Sheet: ctQiLingLevelConf
A2: nLevel | B2: nNeedExp | C2: fnAttrQiXue | D2: fnAttrGongJi | E2: fnAttrFangYu | F2: fnAttrLingLi | G2: fnAttrMoFa | H2: fnAttrSuDu
A3: i | B3: i | C3: e | D3: e | E3: e | F3: e | G3: e | H3: e
A4: 器灵等级 | B4: 升级所需经验 | C4: 气血属性 | D4: 攻击属性 | E4: 防御属性 | F4: 灵力属性 | G4: 魔法属性 | H4: 速度属性
A5: 0 | B5: 100 | C5: math.floor(1.2*nLevel+2+3*nGrade+3) | D5: math.floor(1.8*nLevel+3+1*nGrade+4) | E5: math.floor(1*nLevel+6+5*nGrade+6) | F5: math.floor(0.5*nLevel+1+0.5*nGrade+2) | G5: math.floor(2*nLevel+0+5*nGrade+0) | H5: math.floor(0.15*nLevel+1+0.5*nGrade+1)
A6: 1 | B6: 100 | C6: math.floor(1.2*nLevel+2+3*nGrade+3) | D6: math.floor(1.8*nLevel+3+1*nGrade+4) | E6: math.floor(1*nLevel+6+5*nGrade+6) | F6: math.floor(0.5*nLevel+1+0.5*nGrade+2) | G6: math.floor(2*nLevel+0+5*nGrade+0) | H6: math.floor(0.15*nLevel+1+0.5*nGrade+1)
A7: 2 | B7: 105 | C7: math.floor(1.2*nLevel+2+3*nGrade+3) | D7: math.floor(1.8*nLevel+3+1*nGrade+4) | E7: math.floor(1*nLevel+6+5*nGrade+6) | F7: math.floor(0.5*nLevel+1+0.5*nGrade+2) | G7: math.floor(2*nLevel+0+5*nGrade+0) | H7: math.floor(0.15*nLevel+1+0.5*nGrade+1)
A8: 3 | B8: 110 | C8: math.floor(1.2*nLevel+2+3*nGrade+3) | D8: math.floor(1.8*nLevel+3+1*nGrade+4) | E8: math.floor(1*nLevel+6+5*nGrade+6) | F8: math.floor(0.5*nLevel+1+0.5*nGrade+2) | G8: math.floor(2*nLevel+0+5*nGrade+0) | H8: math.floor(0.15*nLevel+1+0.5*nGrade+1)
A9: 4 | B9: 115 | C9: math.floor(1.2*nLevel+2+3*nGrade+3) | D9: math.floor(1.8*nLevel+3+1*nGrade+4) | E9: math.floor(1*nLevel+6+5*nGrade+6) | F9: math.floor(0.5*nLevel+1+0.5*nGrade+2) | G9: math.floor(2*nLevel+0+5*nGrade+0) | H9: math.floor(0.15*nLevel+1+0.5*nGrade+1)
A10: 5 | B10: 120 | C10: math.floor(1.2*nLevel+2+3*nGrade+3) | D10: math.floor(1.8*nLevel+3+1*nGrade+4) | E10: math.floor(1*nLevel+6+5*nGrade+6) | F10: math.floor(0.5*nLevel+1+0.5*nGrade+2) | G10: math.floor(2*nLevel+0+5*nGrade+0) | H10: math.floor(0.15*nLevel+1+0.5*nGrade+1)
A11: 6 | B11: 125 | C11: math.floor(1.2*nLevel+2+3*nGrade+3) | D11: math.floor(1.8*nLevel+3+1*nGrade+4) | E11: math.floor(1*nLevel+6+5*nGrade+6) | F11: math.floor(0.5*nLevel+1+0.5*nGrade+2) | G11: math.floor(2*nLevel+0+5*nGrade+0) | H11: math.floor(0.15*nLevel+1+0.5*nGrade+1)
A12: 7 | B12: 130 | C12: math.floor(1.2*nLevel+2+3*nGrade+3) | D12: math.floor(1.8*nLevel+3+1*nGrade+4) | E12: math.floor(1*nLevel+6+5*nGrade+6) | F12: math.floor(0.5*nLevel+1+0.5*nGrade+2) | G12: math.floor(2*nLevel+0+5*nGrade+0) | H12: math.floor(0.15*nLevel+1+0.5*nGrade+1)
A13: 8 | B13: 135 | C13: math.floor(1.2*nLevel+2+3*nGrade+3) | D13: math.floor(1.8*nLevel+3+1*nGrade+4) | E13: math.floor(1*nLevel+6+5*nGrade+6) | F13: math.floor(0.5*nLevel+1+0.5*nGrade+2) | G13: math.floor(2*nLevel+0+5*nGrade+0) | H13: math.floor(0.15*nLevel+1+0.5*nGrade+1)
A14: 9 | B14: 140 | C14: math.floor(1.2*nLevel+2+3*nGrade+3) | D14: math.floor(1.8*nLevel+3+1*nGrade+4) | E14: math.floor(1*nLevel+6+5*nGrade+6) | F14: math.floor(0.5*nLevel+1+0.5*nGrade+2) | G14: math.floor(2*nLevel+0+5*nGrade+0) | H14: math.floor(0.15*nLevel+1+0.5*nGrade+1)
A15: 10 | B15: 145 | C15: math.floor(1.2*nLevel+2+3*nGrade+3) | D15: math.floor(1.8*nLevel+3+1*nGrade+4) | E15: math.floor(1*nLevel+6+5*nGrade+6) | F15: math.floor(0.5*nLevel+1+0.5*nGrade+2) | G15: math.floor(2*nLevel+0+5*nGrade+0) | H15: math.floor(0.15*nLevel+1+0.5*nGrade+1)
A16: 11 | B16: 150 | C16: math.floor(1.2*nLevel+2+3*nGrade+3) | D16: math.floor(1.8*nLevel+3+1*nGrade+4) | E16: math.floor(1*nLevel+6+5*nGrade+6) | F16: math.floor(0.5*nLevel+1+0.5*nGrade+2) | G16: math.floor(2*nLevel+0+5*nGrade+0) | H16: math.floor(0.15*nLevel+1+0.5*nGrade+1)
A17: 12 | B17: 160 | C17: math.floor(1.2*nLevel+2+3*nGrade+3) | D17: math.floor(1.8*nLevel+3+1*nGrade+4) | E17: math.floor(1*nLevel+6+5*nGrade+6) | F17: math.floor(0.5*nLevel+1+0.5*nGrade+2) | G17: math.floor(2*nLevel+0+5*nGrade+0) | H17: math.floor(0.15*nLevel+1+0.5*nGrade+1)
A18: 13 | B18: 170 | C18: math.floor(1.2*nLevel+2+3*nGrade+3) | D18: math.floor(1.8*nLevel+3+1*nGrade+4) | E18: math.floor(1*nLevel+6+5*nGrade+6) | F18: math.floor(0.5*nLevel+1+0.5*nGrade+2) | G18: math.floor(2*nLevel+0+5*nGrade+0) | H18: math.floor(0.15*nLevel+1+0.5*nGrade+1)
A19: 14 | B19: 180 | C19: math.floor(1.2*nLevel+2+3*nGrade+3) | D19: math.floor(1.8*nLevel+3+1*nGrade+4) | E19: math.floor(1*nLevel+6+5*nGrade+6) | F19: math.floor(0.5*nLevel+1+0.5*nGrade+2) | G19: math.floor(2*nLevel+0+5*nGrade+0) | H19: math.floor(0.15*nLevel+1+0.5*nGrade+1)
A20: 15 | B20: 190 | C20: math.floor(1.2*nLevel+2+3*nGrade+3) | D20: math.floor(1.8*nLevel+3+1*nGrade+4) | E20: math.floor(1*nLevel+6+5*nGrade+6) | F20: math.floor(0.5*nLevel+1+0.5*nGrade+2) | G20: math.floor(2*nLevel+0+5*nGrade+0) | H20: math.floor(0.15*nLevel+1+0.5*nGrade+1)
A21: 16 | B21: 200 | C21: math.floor(1.2*nLevel+2+3*nGrade+3) | D21: math.floor(1.8*nLevel+3+1*nGrade+4) | E21: math.floor(1*nLevel+6+5*nGrade+6) | F21: math.floor(0.5*nLevel+1+0.5*nGrade+2) | G21: math.floor(2*nLevel+0+5*nGrade+0) | H21: math.floor(0.15*nLevel+1+0.5*nGrade+1)
A22: 17 | B22: 210 | C22: math.floor(1.2*nLevel+2+3*nGrade+3) | D22: math.floor(1.8*nLevel+3+1*nGrade+4) | E22: math.floor(1*nLevel+6+5*nGrade+6) | F22: math.floor(0.5*nLevel+1+0.5*nGrade+2) | G22: math.floor(2*nLevel+0+5*nGrade+0) | H22: math.floor(0.15*nLevel+1+0.5*nGrade+1)
A23: 18 | B23: 220 | C23: math.floor(1.2*nLevel+2+3*nGrade+3) | D23: math.floor(1.8*nLevel+3+1*nGrade+4) | E23: math.floor(1*nLevel+6+5*nGrade+6) | F23: math.floor(0.5*nLevel+1+0.5*nGrade+2) | G23: math.floor(2*nLevel+0+5*nGrade+0) | H23: math.floor(0.15*nLevel+1+0.5*nGrade+1)
A24: 19 | B24: 230 | C24: math.floor(1.2*nLevel+2+3*nGrade+3) | D24: math.floor(1.8*nLevel+3+1*nGrade+4) | E24: math.floor(1*nLevel+6+5*nGrade+6) | F24: math.floor(0.5*nLevel+1+0.5*nGrade+2) | G24: math.floor(2*nLevel+0+5*nGrade+0) | H24: math.floor(0.15*nLevel+1+0.5*nGrade+1)
A25: 20 | B25: 240 | C25: math.floor(1.2*nLevel+2+3*nGrade+3) | D25: math.floor(1.8*nLevel+3+1*nGrade+4) | E25: math.floor(1*nLevel+6+5*nGrade+6) | F25: math.floor(0.5*nLevel+1+0.5*nGrade+2) | G25: math.floor(2*nLevel+0+5*nGrade+0) | H25: math.floor(0.15*nLevel+1+0.5*nGrade+1)
A26: 21 | B26: 250 | C26: math.floor(1.2*nLevel+2+3*nGrade+3) | D26: math.floor(1.8*nLevel+3+1*nGrade+4) | E26: math.floor(1*nLevel+6+5*nGrade+6) | F26: math.floor(0.5*nLevel+1+0.5*nGrade+2) | G26: math.floor(2*nLevel+0+5*nGrade+0) | H26: math.floor(0.15*nLevel+1+0.5*nGrade+1)
A27: 22 | B27: 265 | C27: math.floor(1.2*nLevel+2+3*nGrade+3) | D27: math.floor(1.8*nLevel+3+1*nGrade+4) | E27: math.floor(1*nLevel+6+5*nGrade+6) | F27: math.floor(0.5*nLevel+1+0.5*nGrade+2) | G27: math.floor(2*nLevel+0+5*nGrade+0) | H27: math.floor(0.15*nLevel+1+0.5*nGrade+1)
A28: 23 | B28: 280 | C28: math.floor(1.2*nLevel+2+3*nGrade+3) | D28: math.floor(1.8*nLevel+3+1*nGrade+4) | E28: math.floor(1*nLevel+6+5*nGrade+6) | F28: math.floor(0.5*nLevel+1+0.5*nGrade+2) | G28: math.floor(2*nLevel+0+5*nGrade+0) | H28: math.floor(0.15*nLevel+1+0.5*nGrade+1)
A29: 24 | B29: 295 | C29: math.floor(1.2*nLevel+2+3*nGrade+3) | D29: math.floor(1.8*nLevel+3+1*nGrade+4) | E29: math.floor(1*nLevel+6+5*nGrade+6) | F29: math.floor(0.5*nLevel+1+0.5*nGrade+2) | G29: math.floor(2*nLevel+0+5*nGrade+0) | H29: math.floor(0.15*nLevel+1+0.5*nGrade+1)
A30: 25 | B30: 310 | C30: math.floor(1.2*nLevel+2+3*nGrade+3) | D30: math.floor(1.8*nLevel+3+1*nGrade+4) | E30: math.floor(1*nLevel+6+5*nGrade+6) | F30: math.floor(0.5*nLevel+1+0.5*nGrade+2) | G30: math.floor(2*nLevel+0+5*nGrade+0) | H30: math.floor(0.15*nLevel+1+0.5*nGrade+1)
A31: 26 | B31: 325 | C31: math.floor(1.2*nLevel+2+3*nGrade+3) | D31: math.floor(1.8*nLevel+3+1*nGrade+4) | E31: math.floor(1*nLevel+6+5*nGrade+6) | F31: math.floor(0.5*nLevel+1+0.5*nGrade+2) | G31: math.floor(2*nLevel+0+5*nGrade+0) | H31: math.floor(0.15*nLevel+1+0.5*nGrade+1)
A32: 27 | B32: 340 | C32: math.floor(1.2*nLevel+2+3*nGrade+3) | D32: math.floor(1.8*nLevel+3+1*nGrade+4) | E32: math.floor(1*nLevel+6+5*nGrade+6) | F32: math.floor(0.5*nLevel+1+0.5*nGrade+2) | G32: math.floor(2*nLevel+0+5*nGrade+0) | H32: math.floor(0.15*nLevel+1+0.5*nGrade+1)
A33: 28 | B33: 355 | C33: math.floor(1.2*nLevel+2+3*nGrade+3) | D33: math.floor(1.8*nLevel+3+1*nGrade+4) | E33: math.floor(1*nLevel+6+5*nGrade+6) | F33: math.floor(0.5*nLevel+1+0.5*nGrade+2) | G33: math.floor(2*nLevel+0+5*nGrade+0) | H33: math.floor(0.15*nLevel+1+0.5*nGrade+1)
A34: 29 | B34: 370 | C34: math.floor(1.2*nLevel+2+3*nGrade+3) | D34: math.floor(1.8*nLevel+3+1*nGrade+4) | E34: math.floor(1*nLevel+6+5*nGrade+6) | F34: math.floor(0.5*nLevel+1+0.5*nGrade+2) | G34: math.floor(2*nLevel+0+5*nGrade+0) | H34: math.floor(0.15*nLevel+1+0.5*nGrade+1)
A35: 30 | B35: 770 | C35: math.floor(1.2*nLevel+2+3*nGrade+3) | D35: math.floor(1.8*nLevel+3+1*nGrade+4) | E35: math.floor(1*nLevel+6+5*nGrade+6) | F35: math.floor(0.5*nLevel+1+0.5*nGrade+2) | G35: math.floor(2*nLevel+0+5*nGrade+0) | H35: math.floor(0.15*nLevel+1+0.5*nGrade+1)
A36: 31 | B36: 800 | C36: math.floor(1.2*nLevel+2+3*nGrade+3) | D36: math.floor(1.8*nLevel+3+1*nGrade+4) | E36: math.floor(1*nLevel+6+5*nGrade+6) | F36: math.floor(0.5*nLevel+1+0.5*nGrade+2) | G36: math.floor(2*nLevel+0+5*nGrade+0) | H36: math.floor(0.15*nLevel+1+0.5*nGrade+1)
A37: 32 | B37: 840 | C37: math.floor(1.2*nLevel+2+3*nGrade+3) | D37: math.floor(1.8*nLevel+3+1*nGrade+4) | E37: math.floor(1*nLevel+6+5*nGrade+6) | F37: math.floor(0.5*nLevel+1+0.5*nGrade+2) | G37: math.floor(2*nLevel+0+5*nGrade+0) | H37: math.floor(0.15*nLevel+1+0.5*nGrade+1)
A38: 33 | B38: 880 | C38: math.floor(1.2*nLevel+2+3*nGrade+3) | D38: math.floor(1.8*nLevel+3+1*nGrade+4) | E38: math.floor(1*nLevel+6+5*nGrade+6) | F38: math.floor(0.5*nLevel+1+0.5*nGrade+2) | G38: math.floor(2*nLevel+0+5*nGrade+0) | H38: math.floor(0.15*nLevel+1+0.5*nGrade+1)
A39: 34 | B39: 920 | C39: math.floor(1.2*nLevel+2+3*nGrade+3) | D39: math.floor(1.8*nLevel+3+1*nGrade+4) | E39: math.floor(1*nLevel+6+5*nGrade+6) | F39: math.floor(0.5*nLevel+1+0.5*nGrade+2) | G39: math.floor(2*nLevel+0+5*nGrade+0) | H39: math.floor(0.15*nLevel+1+0.5*nGrade+1)
A40: 35 | B40: 960 | C40: math.floor(1.2*nLevel+2+3*nGrade+3) | D40: math.floor(1.8*nLevel+3+1*nGrade+4) | E40: math.floor(1*nLevel+6+5*nGrade+6) | F40: math.floor(0.5*nLevel+1+0.5*nGrade+2) | G40: math.floor(2*nLevel+0+5*nGrade+0) | H40: math.floor(0.15*nLevel+1+0.5*nGrade+1)
A41: 36 | B41: 1000 | C41: math.floor(1.2*nLevel+2+3*nGrade+3) | D41: math.floor(1.8*nLevel+3+1*nGrade+4) | E41: math.floor(1*nLevel+6+5*nGrade+6) | F41: math.floor(0.5*nLevel+1+0.5*nGrade+2) | G41: math.floor(2*nLevel+0+5*nGrade+0) | H41: math.floor(0.15*nLevel+1+0.5*nGrade+1)
A42: 37 | B42: 1040 | C42: math.floor(1.2*nLevel+2+3*nGrade+3) | D42: math.floor(1.8*nLevel+3+1*nGrade+4) | E42: math.floor(1*nLevel+6+5*nGrade+6) | F42: math.floor(0.5*nLevel+1+0.5*nGrade+2) | G42: math.floor(2*nLevel+0+5*nGrade+0) | H42: math.floor(0.15*nLevel+1+0.5*nGrade+1)
A43: 38 | B43: 1080 | C43: math.floor(1.2*nLevel+2+3*nGrade+3) | D43: math.floor(1.8*nLevel+3+1*nGrade+4) | E43: math.floor(1*nLevel+6+5*nGrade+6) | F43: math.floor(0.5*nLevel+1+0.5*nGrade+2) | G43: math.floor(2*nLevel+0+5*nGrade+0) | H43: math.floor(0.15*nLevel+1+0.5*nGrade+1)
A44: 39 | B44: 1120 | C44: math.floor(1.2*nLevel+2+3*nGrade+3) | D44: math.floor(1.8*nLevel+3+1*nGrade+4) | E44: math.floor(1*nLevel+6+5*nGrade+6) | F44: math.floor(0.5*nLevel+1+0.5*nGrade+2) | G44: math.floor(2*nLevel+0+5*nGrade+0) | H44: math.floor(0.15*nLevel+1+0.5*nGrade+1)
A45: 40 | B45: 1160 | C45: math.floor(1.2*nLevel+2+3*nGrade+3) | D45: math.floor(1.8*nLevel+3+1*nGrade+4) | E45: math.floor(1*nLevel+6+5*nGrade+6) | F45: math.floor(0.5*nLevel+1+0.5*nGrade+2) | G45: math.floor(2*nLevel+0+5*nGrade+0) | H45: math.floor(0.15*nLevel+1+0.5*nGrade+1)
A46: 41 | B46: 1200 | C46: math.floor(1.2*nLevel+2+3*nGrade+3) | D46: math.floor(1.8*nLevel+3+1*nGrade+4) | E46: math.floor(1*nLevel+6+5*nGrade+6) | F46: math.floor(0.5*nLevel+1+0.5*nGrade+2) | G46: math.floor(2*nLevel+0+5*nGrade+0) | H46: math.floor(0.15*nLevel+1+0.5*nGrade+1)
A47: 42 | B47: 1250 | C47: math.floor(1.2*nLevel+2+3*nGrade+3) | D47: math.floor(1.8*nLevel+3+1*nGrade+4) | E47: math.floor(1*nLevel+6+5*nGrade+6) | F47: math.floor(0.5*nLevel+1+0.5*nGrade+2) | G47: math.floor(2*nLevel+0+5*nGrade+0) | H47: math.floor(0.15*nLevel+1+0.5*nGrade+1)
A48: 43 | B48: 1300 | C48: math.floor(1.2*nLevel+2+3*nGrade+3) | D48: math.floor(1.8*nLevel+3+1*nGrade+4) | E48: math.floor(1*nLevel+6+5*nGrade+6) | F48: math.floor(0.5*nLevel+1+0.5*nGrade+2) | G48: math.floor(2*nLevel+0+5*nGrade+0) | H48: math.floor(0.15*nLevel+1+0.5*nGrade+1)
A49: 44 | B49: 1350 | C49: math.floor(1.2*nLevel+2+3*nGrade+3) | D49: math.floor(1.8*nLevel+3+1*nGrade+4) | E49: math.floor(1*nLevel+6+5*nGrade+6) | F49: math.floor(0.5*nLevel+1+0.5*nGrade+2) | G49: math.floor(2*nLevel+0+5*nGrade+0) | H49: math.floor(0.15*nLevel+1+0.5*nGrade+1)
A50: 45 | B50: 1400 | C50: math.floor(1.2*nLevel+2+3*nGrade+3) | D50: math.floor(1.8*nLevel+3+1*nGrade+4) | E50: math.floor(1*nLevel+6+5*nGrade+6) | F50: math.floor(0.5*nLevel+1+0.5*nGrade+2) | G50: math.floor(2*nLevel+0+5*nGrade+0) | H50: math.floor(0.15*nLevel+1+0.5*nGrade+1)
A51: 46 | B51: 1450 | C51: math.floor(1.2*nLevel+2+3*nGrade+3) | D51: math.floor(1.8*nLevel+3+1*nGrade+4) | E51: math.floor(1*nLevel+6+5*nGrade+6) | F51: math.floor(0.5*nLevel+1+0.5*nGrade+2) | G51: math.floor(2*nLevel+0+5*nGrade+0) | H51: math.floor(0.15*nLevel+1+0.5*nGrade+1)
A52: 47 | B52: 1500 | C52: math.floor(1.2*nLevel+2+3*nGrade+3) | D52: math.floor(1.8*nLevel+3+1*nGrade+4) | E52: math.floor(1*nLevel+6+5*nGrade+6) | F52: math.floor(0.5*nLevel+1+0.5*nGrade+2) | G52: math.floor(2*nLevel+0+5*nGrade+0) | H52: math.floor(0.15*nLevel+1+0.5*nGrade+1)
A53: 48 | B53: 1550 | C53: math.floor(1.2*nLevel+2+3*nGrade+3) | D53: math.floor(1.8*nLevel+3+1*nGrade+4) | E53: math.floor(1*nLevel+6+5*nGrade+6) | F53: math.floor(0.5*nLevel+1+0.5*nGrade+2) | G53: math.floor(2*nLevel+0+5*nGrade+0) | H53: math.floor(0.15*nLevel+1+0.5*nGrade+1)
A54: 49 | B54: 1600 | C54: math.floor(1.2*nLevel+2+3*nGrade+3) | D54: math.floor(1.8*nLevel+3+1*nGrade+4) | E54: math.floor(1*nLevel+6+5*nGrade+6) | F54: math.floor(0.5*nLevel+1+0.5*nGrade+2) | G54: math.floor(2*nLevel+0+5*nGrade+0) | H54: math.floor(0.15*nLevel+1+0.5*nGrade+1)
A55: 50 | B55: 1650 | C55: math.floor(1.2*nLevel+2+3*nGrade+3) | D55: math.floor(1.8*nLevel+3+1*nGrade+4) | E55: math.floor(1*nLevel+6+5*nGrade+6) | F55: math.floor(0.5*nLevel+1+0.5*nGrade+2) | G55: math.floor(2*nLevel+0+5*nGrade+0) | H55: math.floor(0.15*nLevel+1+0.5*nGrade+1)
A56: 51 | B56: 1700 | C56: math.floor(1.2*nLevel+2+3*nGrade+3) | D56: math.floor(1.8*nLevel+3+1*nGrade+4) | E56: math.floor(1*nLevel+6+5*nGrade+6) | F56: math.floor(0.5*nLevel+1+0.5*nGrade+2) | G56: math.floor(2*nLevel+0+5*nGrade+0) | H56: math.floor(0.15*nLevel+1+0.5*nGrade+1)
A57: 52 | B57: 1760 | C57: math.floor(1.2*nLevel+2+3*nGrade+3) | D57: math.floor(1.8*nLevel+3+1*nGrade+4) | E57: math.floor(1*nLevel+6+5*nGrade+6) | F57: math.floor(0.5*nLevel+1+0.5*nGrade+2) | G57: math.floor(2*nLevel+0+5*nGrade+0) | H57: math.floor(0.15*nLevel+1+0.5*nGrade+1)
A58: 53 | B58: 1820 | C58: math.floor(1.2*nLevel+2+3*nGrade+3) | D58: math.floor(1.8*nLevel+3+1*nGrade+4) | E58: math.floor(1*nLevel+6+5*nGrade+6) | F58: math.floor(0.5*nLevel+1+0.5*nGrade+2) | G58: math.floor(2*nLevel+0+5*nGrade+0) | H58: math.floor(0.15*nLevel+1+0.5*nGrade+1)
A59: 54 | B59: 1880 | C59: math.floor(1.2*nLevel+2+3*nGrade+3) | D59: math.floor(1.8*nLevel+3+1*nGrade+4) | E59: math.floor(1*nLevel+6+5*nGrade+6) | F59: math.floor(0.5*nLevel+1+0.5*nGrade+2) | G59: math.floor(2*nLevel+0+5*nGrade+0) | H59: math.floor(0.15*nLevel+1+0.5*nGrade+1)
A60: 55 | B60: 1940 | C60: math.floor(1.2*nLevel+2+3*nGrade+3) | D60: math.floor(1.8*nLevel+3+1*nGrade+4) | E60: math.floor(1*nLevel+6+5*nGrade+6) | F60: math.floor(0.5*nLevel+1+0.5*nGrade+2) | G60: math.floor(2*nLevel+0+5*nGrade+0) | H60: math.floor(0.15*nLevel+1+0.5*nGrade+1)
A61: 56 | B61: 2000 | C61: math.floor(1.2*nLevel+2+3*nGrade+3) | D61: math.floor(1.8*nLevel+3+1*nGrade+4) | E61: math.floor(1*nLevel+6+5*nGrade+6) | F61: math.floor(0.5*nLevel+1+0.5*nGrade+2) | G61: math.floor(2*nLevel+0+5*nGrade+0) | H61: math.floor(0.15*nLevel+1+0.5*nGrade+1)
A62: 57 | B62: 2060 | C62: math.floor(1.2*nLevel+2+3*nGrade+3) | D62: math.floor(1.8*nLevel+3+1*nGrade+4) | E62: math.floor(1*nLevel+6+5*nGrade+6) | F62: math.floor(0.5*nLevel+1+0.5*nGrade+2) | G62: math.floor(2*nLevel+0+5*nGrade+0) | H62: math.floor(0.15*nLevel+1+0.5*nGrade+1)
A63: 58 | B63: 2120 | C63: math.floor(1.2*nLevel+2+3*nGrade+3) | D63: math.floor(1.8*nLevel+3+1*nGrade+4) | E63: math.floor(1*nLevel+6+5*nGrade+6) | F63: math.floor(0.5*nLevel+1+0.5*nGrade+2) | G63: math.floor(2*nLevel+0+5*nGrade+0) | H63: math.floor(0.15*nLevel+1+0.5*nGrade+1)
A64: 59 | B64: 2180 | C64: math.floor(1.2*nLevel+2+3*nGrade+3) | D64: math.floor(1.8*nLevel+3+1*nGrade+4) | E64: math.floor(1*nLevel+6+5*nGrade+6) | F64: math.floor(0.5*nLevel+1+0.5*nGrade+2) | G64: math.floor(2*nLevel+0+5*nGrade+0) | H64: math.floor(0.15*nLevel+1+0.5*nGrade+1)
A65: 60 | B65: 2240 | C65: math.floor(1.2*nLevel+2+3*nGrade+3) | D65: math.floor(1.8*nLevel+3+1*nGrade+4) | E65: math.floor(1*nLevel+6+5*nGrade+6) | F65: math.floor(0.5*nLevel+1+0.5*nGrade+2) | G65: math.floor(2*nLevel+0+5*nGrade+0) | H65: math.floor(0.15*nLevel+1+0.5*nGrade+1)
A66: 61 | B66: 2300 | C66: math.floor(1.2*nLevel+2+3*nGrade+3) | D66: math.floor(1.8*nLevel+3+1*nGrade+4) | E66: math.floor(1*nLevel+6+5*nGrade+6) | F66: math.floor(0.5*nLevel+1+0.5*nGrade+2) | G66: math.floor(2*nLevel+0+5*nGrade+0) | H66: math.floor(0.15*nLevel+1+0.5*nGrade+1)
A67: 62 | B67: 2380 | C67: math.floor(1.2*nLevel+2+3*nGrade+3) | D67: math.floor(1.8*nLevel+3+1*nGrade+4) | E67: math.floor(1*nLevel+6+5*nGrade+6) | F67: math.floor(0.5*nLevel+1+0.5*nGrade+2) | G67: math.floor(2*nLevel+0+5*nGrade+0) | H67: math.floor(0.15*nLevel+1+0.5*nGrade+1)
A68: 63 | B68: 2460 | C68: math.floor(1.2*nLevel+2+3*nGrade+3) | D68: math.floor(1.8*nLevel+3+1*nGrade+4) | E68: math.floor(1*nLevel+6+5*nGrade+6) | F68: math.floor(0.5*nLevel+1+0.5*nGrade+2) | G68: math.floor(2*nLevel+0+5*nGrade+0) | H68: math.floor(0.15*nLevel+1+0.5*nGrade+1)
A69: 64 | B69: 2540 | C69: math.floor(1.2*nLevel+2+3*nGrade+3) | D69: math.floor(1.8*nLevel+3+1*nGrade+4) | E69: math.floor(1*nLevel+6+5*nGrade+6) | F69: math.floor(0.5*nLevel+1+0.5*nGrade+2) | G69: math.floor(2*nLevel+0+5*nGrade+0) | H69: math.floor(0.15*nLevel+1+0.5*nGrade+1)
A70: 65 | B70: 2620 | C70: math.floor(1.2*nLevel+2+3*nGrade+3) | D70: math.floor(1.8*nLevel+3+1*nGrade+4) | E70: math.floor(1*nLevel+6+5*nGrade+6) | F70: math.floor(0.5*nLevel+1+0.5*nGrade+2) | G70: math.floor(2*nLevel+0+5*nGrade+0) | H70: math.floor(0.15*nLevel+1+0.5*nGrade+1)
A71: 66 | B71: 2700 | C71: math.floor(1.2*nLevel+2+3*nGrade+3) | D71: math.floor(1.8*nLevel+3+1*nGrade+4) | E71: math.floor(1*nLevel+6+5*nGrade+6) | F71: math.floor(0.5*nLevel+1+0.5*nGrade+2) | G71: math.floor(2*nLevel+0+5*nGrade+0) | H71: math.floor(0.15*nLevel+1+0.5*nGrade+1)
A72: 67 | B72: 2780 | C72: math.floor(1.2*nLevel+2+3*nGrade+3) | D72: math.floor(1.8*nLevel+3+1*nGrade+4) | E72: math.floor(1*nLevel+6+5*nGrade+6) | F72: math.floor(0.5*nLevel+1+0.5*nGrade+2) | G72: math.floor(2*nLevel+0+5*nGrade+0) | H72: math.floor(0.15*nLevel+1+0.5*nGrade+1)
A73: 68 | B73: 2860 | C73: math.floor(1.2*nLevel+2+3*nGrade+3) | D73: math.floor(1.8*nLevel+3+1*nGrade+4) | E73: math.floor(1*nLevel+6+5*nGrade+6) | F73: math.floor(0.5*nLevel+1+0.5*nGrade+2) | G73: math.floor(2*nLevel+0+5*nGrade+0) | H73: math.floor(0.15*nLevel+1+0.5*nGrade+1)
A74: 69 | B74: 2940 | C74: math.floor(1.2*nLevel+2+3*nGrade+3) | D74: math.floor(1.8*nLevel+3+1*nGrade+4) | E74: math.floor(1*nLevel+6+5*nGrade+6) | F74: math.floor(0.5*nLevel+1+0.5*nGrade+2) | G74: math.floor(2*nLevel+0+5*nGrade+0) | H74: math.floor(0.15*nLevel+1+0.5*nGrade+1)
A75: 70 | B75: 3020 | C75: math.floor(1.2*nLevel+2+3*nGrade+3) | D75: math.floor(1.8*nLevel+3+1*nGrade+4) | E75: math.floor(1*nLevel+6+5*nGrade+6) | F75: math.floor(0.5*nLevel+1+0.5*nGrade+2) | G75: math.floor(2*nLevel+0+5*nGrade+0) | H75: math.floor(0.15*nLevel+1+0.5*nGrade+1)
A76: 71 | B76: 3100 | C76: math.floor(1.2*nLevel+2+3*nGrade+3) | D76: math.floor(1.8*nLevel+3+1*nGrade+4) | E76: math.floor(1*nLevel+6+5*nGrade+6) | F76: math.floor(0.5*nLevel+1+0.5*nGrade+2) | G76: math.floor(2*nLevel+0+5*nGrade+0) | H76: math.floor(0.15*nLevel+1+0.5*nGrade+1)
A77: 72 | B77: 3200 | C77: math.floor(1.2*nLevel+2+3*nGrade+3) | D77: math.floor(1.8*nLevel+3+1*nGrade+4) | E77: math.floor(1*nLevel+6+5*nGrade+6) | F77: math.floor(0.5*nLevel+1+0.5*nGrade+2) | G77: math.floor(2*nLevel+0+5*nGrade+0) | H77: math.floor(0.15*nLevel+1+0.5*nGrade+1)
A78: 73 | B78: 3300 | C78: math.floor(1.2*nLevel+2+3*nGrade+3) | D78: math.floor(1.8*nLevel+3+1*nGrade+4) | E78: math.floor(1*nLevel+6+5*nGrade+6) | F78: math.floor(0.5*nLevel+1+0.5*nGrade+2) | G78: math.floor(2*nLevel+0+5*nGrade+0) | H78: math.floor(0.15*nLevel+1+0.5*nGrade+1)
A79: 74 | B79: 3400 | C79: math.floor(1.2*nLevel+2+3*nGrade+3) | D79: math.floor(1.8*nLevel+3+1*nGrade+4) | E79: math.floor(1*nLevel+6+5*nGrade+6) | F79: math.floor(0.5*nLevel+1+0.5*nGrade+2) | G79: math.floor(2*nLevel+0+5*nGrade+0) | H79: math.floor(0.15*nLevel+1+0.5*nGrade+1)
A80: 75 | B80: 3500 | C80: math.floor(1.2*nLevel+2+3*nGrade+3) | D80: math.floor(1.8*nLevel+3+1*nGrade+4) | E80: math.floor(1*nLevel+6+5*nGrade+6) | F80: math.floor(0.5*nLevel+1+0.5*nGrade+2) | G80: math.floor(2*nLevel+0+5*nGrade+0) | H80: math.floor(0.15*nLevel+1+0.5*nGrade+1)
A81: 76 | B81: 3600 | C81: math.floor(1.2*nLevel+2+3*nGrade+3) | D81: math.floor(1.8*nLevel+3+1*nGrade+4) | E81: math.floor(1*nLevel+6+5*nGrade+6) | F81: math.floor(0.5*nLevel+1+0.5*nGrade+2) | G81: math.floor(2*nLevel+0+5*nGrade+0) | H81: math.floor(0.15*nLevel+1+0.5*nGrade+1)
A82: 77 | B82: 3700 | C82: math.floor(1.2*nLevel+2+3*nGrade+3) | D82: math.floor(1.8*nLevel+3+1*nGrade+4) | E82: math.floor(1*nLevel+6+5*nGrade+6) | F82: math.floor(0.5*nLevel+1+0.5*nGrade+2) | G82: math.floor(2*nLevel+0+5*nGrade+0) | H82: math.floor(0.15*nLevel+1+0.5*nGrade+1)
A83: 78 | B83: 3800 | C83: math.floor(1.2*nLevel+2+3*nGrade+3) | D83: math.floor(1.8*nLevel+3+1*nGrade+4) | E83: math.floor(1*nLevel+6+5*nGrade+6) | F83: math.floor(0.5*nLevel+1+0.5*nGrade+2) | G83: math.floor(2*nLevel+0+5*nGrade+0) | H83: math.floor(0.15*nLevel+1+0.5*nGrade+1)
A84: 79 | B84: 3900 | C84: math.floor(1.2*nLevel+2+3*nGrade+3) | D84: math.floor(1.8*nLevel+3+1*nGrade+4) | E84: math.floor(1*nLevel+6+5*nGrade+6) | F84: math.floor(0.5*nLevel+1+0.5*nGrade+2) | G84: math.floor(2*nLevel+0+5*nGrade+0) | H84: math.floor(0.15*nLevel+1+0.5*nGrade+1)
A85: 80 | B85: 4000 | C85: math.floor(1.2*nLevel+2+3*nGrade+3) | D85: math.floor(1.8*nLevel+3+1*nGrade+4) | E85: math.floor(1*nLevel+6+5*nGrade+6) | F85: math.floor(0.5*nLevel+1+0.5*nGrade+2) | G85: math.floor(2*nLevel+0+5*nGrade+0) | H85: math.floor(0.15*nLevel+1+0.5*nGrade+1)
A86: 81 | B86: 4100 | C86: math.floor(1.2*nLevel+2+3*nGrade+3) | D86: math.floor(1.8*nLevel+3+1*nGrade+4) | E86: math.floor(1*nLevel+6+5*nGrade+6) | F86: math.floor(0.5*nLevel+1+0.5*nGrade+2) | G86: math.floor(2*nLevel+0+5*nGrade+0) | H86: math.floor(0.15*nLevel+1+0.5*nGrade+1)
A87: 82 | B87: 4220 | C87: math.floor(1.2*nLevel+2+3*nGrade+3) | D87: math.floor(1.8*nLevel+3+1*nGrade+4) | E87: math.floor(1*nLevel+6+5*nGrade+6) | F87: math.floor(0.5*nLevel+1+0.5*nGrade+2) | G87: math.floor(2*nLevel+0+5*nGrade+0) | H87: math.floor(0.15*nLevel+1+0.5*nGrade+1)
A88: 83 | B88: 4340 | C88: math.floor(1.2*nLevel+2+3*nGrade+3) | D88: math.floor(1.8*nLevel+3+1*nGrade+4) | E88: math.floor(1*nLevel+6+5*nGrade+6) | F88: math.floor(0.5*nLevel+1+0.5*nGrade+2) | G88: math.floor(2*nLevel+0+5*nGrade+0) | H88: math.floor(0.15*nLevel+1+0.5*nGrade+1)
A89: 84 | B89: 4460 | C89: math.floor(1.2*nLevel+2+3*nGrade+3) | D89: math.floor(1.8*nLevel+3+1*nGrade+4) | E89: math.floor(1*nLevel+6+5*nGrade+6) | F89: math.floor(0.5*nLevel+1+0.5*nGrade+2) | G89: math.floor(2*nLevel+0+5*nGrade+0) | H89: math.floor(0.15*nLevel+1+0.5*nGrade+1)
A90: 85 | B90: 4580 | C90: math.floor(1.2*nLevel+2+3*nGrade+3) | D90: math.floor(1.8*nLevel+3+1*nGrade+4) | E90: math.floor(1*nLevel+6+5*nGrade+6) | F90: math.floor(0.5*nLevel+1+0.5*nGrade+2) | G90: math.floor(2*nLevel+0+5*nGrade+0) | H90: math.floor(0.15*nLevel+1+0.5*nGrade+1)
A91: 86 | B91: 4700 | C91: math.floor(1.2*nLevel+2+3*nGrade+3) | D91: math.floor(1.8*nLevel+3+1*nGrade+4) | E91: math.floor(1*nLevel+6+5*nGrade+6) | F91: math.floor(0.5*nLevel+1+0.5*nGrade+2) | G91: math.floor(2*nLevel+0+5*nGrade+0) | H91: math.floor(0.15*nLevel+1+0.5*nGrade+1)
A92: 87 | B92: 4820 | C92: math.floor(1.2*nLevel+2+3*nGrade+3) | D92: math.floor(1.8*nLevel+3+1*nGrade+4) | E92: math.floor(1*nLevel+6+5*nGrade+6) | F92: math.floor(0.5*nLevel+1+0.5*nGrade+2) | G92: math.floor(2*nLevel+0+5*nGrade+0) | H92: math.floor(0.15*nLevel+1+0.5*nGrade+1)
A93: 88 | B93: 4940 | C93: math.floor(1.2*nLevel+2+3*nGrade+3) | D93: math.floor(1.8*nLevel+3+1*nGrade+4) | E93: math.floor(1*nLevel+6+5*nGrade+6) | F93: math.floor(0.5*nLevel+1+0.5*nGrade+2) | G93: math.floor(2*nLevel+0+5*nGrade+0) | H93: math.floor(0.15*nLevel+1+0.5*nGrade+1)
A94: 89 | B94: 5060 | C94: math.floor(1.2*nLevel+2+3*nGrade+3) | D94: math.floor(1.8*nLevel+3+1*nGrade+4) | E94: math.floor(1*nLevel+6+5*nGrade+6) | F94: math.floor(0.5*nLevel+1+0.5*nGrade+2) | G94: math.floor(2*nLevel+0+5*nGrade+0) | H94: math.floor(0.15*nLevel+1+0.5*nGrade+1)
A95: 90 | B95: 5180 | C95: math.floor(1.2*nLevel+2+3*nGrade+3) | D95: math.floor(1.8*nLevel+3+1*nGrade+4) | E95: math.floor(1*nLevel+6+5*nGrade+6) | F95: math.floor(0.5*nLevel+1+0.5*nGrade+2) | G95: math.floor(2*nLevel+0+5*nGrade+0) | H95: math.floor(0.15*nLevel+1+0.5*nGrade+1)
A96: 91 | B96: 5300 | C96: math.floor(1.2*nLevel+2+3*nGrade+3) | D96: math.floor(1.8*nLevel+3+1*nGrade+4) | E96: math.floor(1*nLevel+6+5*nGrade+6) | F96: math.floor(0.5*nLevel+1+0.5*nGrade+2) | G96: math.floor(2*nLevel+0+5*nGrade+0) | H96: math.floor(0.15*nLevel+1+0.5*nGrade+1)
A97: 92 | B97: 5440 | C97: math.floor(1.2*nLevel+2+3*nGrade+3) | D97: math.floor(1.8*nLevel+3+1*nGrade+4) | E97: math.floor(1*nLevel+6+5*nGrade+6) | F97: math.floor(0.5*nLevel+1+0.5*nGrade+2) | G97: math.floor(2*nLevel+0+5*nGrade+0) | H97: math.floor(0.15*nLevel+1+0.5*nGrade+1)
A98: 93 | B98: 5580 | C98: math.floor(1.2*nLevel+2+3*nGrade+3) | D98: math.floor(1.8*nLevel+3+1*nGrade+4) | E98: math.floor(1*nLevel+6+5*nGrade+6) | F98: math.floor(0.5*nLevel+1+0.5*nGrade+2) | G98: math.floor(2*nLevel+0+5*nGrade+0) | H98: math.floor(0.15*nLevel+1+0.5*nGrade+1)
A99: 94 | B99: 5720 | C99: math.floor(1.2*nLevel+2+3*nGrade+3) | D99: math.floor(1.8*nLevel+3+1*nGrade+4) | E99: math.floor(1*nLevel+6+5*nGrade+6) | F99: math.floor(0.5*nLevel+1+0.5*nGrade+2) | G99: math.floor(2*nLevel+0+5*nGrade+0) | H99: math.floor(0.15*nLevel+1+0.5*nGrade+1)
A100: 95 | B100: 5860 | C100: math.floor(1.2*nLevel+2+3*nGrade+3) | D100: math.floor(1.8*nLevel+3+1*nGrade+4) | E100: math.floor(1*nLevel+6+5*nGrade+6) | F100: math.floor(0.5*nLevel+1+0.5*nGrade+2) | G100: math.floor(2*nLevel+0+5*nGrade+0) | H100: math.floor(0.15*nLevel+1+0.5*nGrade+1)
A101: 96 | B101: 6000 | C101: math.floor(1.2*nLevel+2+3*nGrade+3) | D101: math.floor(1.8*nLevel+3+1*nGrade+4) | E101: math.floor(1*nLevel+6+5*nGrade+6) | F101: math.floor(0.5*nLevel+1+0.5*nGrade+2) | G101: math.floor(2*nLevel+0+5*nGrade+0) | H101: math.floor(0.15*nLevel+1+0.5*nGrade+1)
A102: 97 | B102: 6140 | C102: math.floor(1.2*nLevel+2+3*nGrade+3) | D102: math.floor(1.8*nLevel+3+1*nGrade+4) | E102: math.floor(1*nLevel+6+5*nGrade+6) | F102: math.floor(0.5*nLevel+1+0.5*nGrade+2) | G102: math.floor(2*nLevel+0+5*nGrade+0) | H102: math.floor(0.15*nLevel+1+0.5*nGrade+1)
A103: 98 | B103: 6280 | C103: math.floor(1.2*nLevel+2+3*nGrade+3) | D103: math.floor(1.8*nLevel+3+1*nGrade+4) | E103: math.floor(1*nLevel+6+5*nGrade+6) | F103: math.floor(0.5*nLevel+1+0.5*nGrade+2) | G103: math.floor(2*nLevel+0+5*nGrade+0) | H103: math.floor(0.15*nLevel+1+0.5*nGrade+1)
A104: 99 | B104: 6420 | C104: math.floor(1.2*nLevel+2+3*nGrade+3) | D104: math.floor(1.8*nLevel+3+1*nGrade+4) | E104: math.floor(1*nLevel+6+5*nGrade+6) | F104: math.floor(0.5*nLevel+1+0.5*nGrade+2) | G104: math.floor(2*nLevel+0+5*nGrade+0) | H104: math.floor(0.15*nLevel+1+0.5*nGrade+1)
A105: 100 | B105: 6560 | C105: math.floor(1.2*nLevel+2+3*nGrade+3) | D105: math.floor(1.8*nLevel+3+1*nGrade+4) | E105: math.floor(1*nLevel+6+5*nGrade+6) | F105: math.floor(0.5*nLevel+1+0.5*nGrade+2) | G105: math.floor(2*nLevel+0+5*nGrade+0) | H105: math.floor(0.15*nLevel+1+0.5*nGrade+1)
A106: 101 | B106: 6700 | C106: math.floor(1.2*nLevel+2+3*nGrade+3) | D106: math.floor(1.8*nLevel+3+1*nGrade+4) | E106: math.floor(1*nLevel+6+5*nGrade+6) | F106: math.floor(0.5*nLevel+1+0.5*nGrade+2) | G106: math.floor(2*nLevel+0+5*nGrade+0) | H106: math.floor(0.15*nLevel+1+0.5*nGrade+1)
A107: 102 | B107: 6860 | C107: math.floor(1.2*nLevel+2+3*nGrade+3) | D107: math.floor(1.8*nLevel+3+1*nGrade+4) | E107: math.floor(1*nLevel+6+5*nGrade+6) | F107: math.floor(0.5*nLevel+1+0.5*nGrade+2) | G107: math.floor(2*nLevel+0+5*nGrade+0) | H107: math.floor(0.15*nLevel+1+0.5*nGrade+1)
A108: 103 | B108: 7020 | C108: math.floor(1.2*nLevel+2+3*nGrade+3) | D108: math.floor(1.8*nLevel+3+1*nGrade+4) | E108: math.floor(1*nLevel+6+5*nGrade+6) | F108: math.floor(0.5*nLevel+1+0.5*nGrade+2) | G108: math.floor(2*nLevel+0+5*nGrade+0) | H108: math.floor(0.15*nLevel+1+0.5*nGrade+1)
A109: 104 | B109: 7180 | C109: math.floor(1.2*nLevel+2+3*nGrade+3) | D109: math.floor(1.8*nLevel+3+1*nGrade+4) | E109: math.floor(1*nLevel+6+5*nGrade+6) | F109: math.floor(0.5*nLevel+1+0.5*nGrade+2) | G109: math.floor(2*nLevel+0+5*nGrade+0) | H109: math.floor(0.15*nLevel+1+0.5*nGrade+1)
A110: 105 | B110: 7340 | C110: math.floor(1.2*nLevel+2+3*nGrade+3) | D110: math.floor(1.8*nLevel+3+1*nGrade+4) | E110: math.floor(1*nLevel+6+5*nGrade+6) | F110: math.floor(0.5*nLevel+1+0.5*nGrade+2) | G110: math.floor(2*nLevel+0+5*nGrade+0) | H110: math.floor(0.15*nLevel+1+0.5*nGrade+1)
A111: 106 | B111: 7500 | C111: math.floor(1.2*nLevel+2+3*nGrade+3) | D111: math.floor(1.8*nLevel+3+1*nGrade+4) | E111: math.floor(1*nLevel+6+5*nGrade+6) | F111: math.floor(0.5*nLevel+1+0.5*nGrade+2) | G111: math.floor(2*nLevel+0+5*nGrade+0) | H111: math.floor(0.15*nLevel+1+0.5*nGrade+1)
A112: 107 | B112: 7660 | C112: math.floor(1.2*nLevel+2+3*nGrade+3) | D112: math.floor(1.8*nLevel+3+1*nGrade+4) | E112: math.floor(1*nLevel+6+5*nGrade+6) | F112: math.floor(0.5*nLevel+1+0.5*nGrade+2) | G112: math.floor(2*nLevel+0+5*nGrade+0) | H112: math.floor(0.15*nLevel+1+0.5*nGrade+1)
A113: 108 | B113: 7820 | C113: math.floor(1.2*nLevel+2+3*nGrade+3) | D113: math.floor(1.8*nLevel+3+1*nGrade+4) | E113: math.floor(1*nLevel+6+5*nGrade+6) | F113: math.floor(0.5*nLevel+1+0.5*nGrade+2) | G113: math.floor(2*nLevel+0+5*nGrade+0) | H113: math.floor(0.15*nLevel+1+0.5*nGrade+1)
A114: 109 | B114: 7980 | C114: math.floor(1.2*nLevel+2+3*nGrade+3) | D114: math.floor(1.8*nLevel+3+1*nGrade+4) | E114: math.floor(1*nLevel+6+5*nGrade+6) | F114: math.floor(0.5*nLevel+1+0.5*nGrade+2) | G114: math.floor(2*nLevel+0+5*nGrade+0) | H114: math.floor(0.15*nLevel+1+0.5*nGrade+1)
A115: 110 | B115: 8140 | C115: math.floor(1.2*nLevel+2+3*nGrade+3) | D115: math.floor(1.8*nLevel+3+1*nGrade+4) | E115: math.floor(1*nLevel+6+5*nGrade+6) | F115: math.floor(0.5*nLevel+1+0.5*nGrade+2) | G115: math.floor(2*nLevel+0+5*nGrade+0) | H115: math.floor(0.15*nLevel+1+0.5*nGrade+1)
A116: 111 | B116: 8300 | C116: math.floor(1.2*nLevel+2+3*nGrade+3) | D116: math.floor(1.8*nLevel+3+1*nGrade+4) | E116: math.floor(1*nLevel+6+5*nGrade+6) | F116: math.floor(0.5*nLevel+1+0.5*nGrade+2) | G116: math.floor(2*nLevel+0+5*nGrade+0) | H116: math.floor(0.15*nLevel+1+0.5*nGrade+1)
A117: 112 | B117: 8480 | C117: math.floor(1.2*nLevel+2+3*nGrade+3) | D117: math.floor(1.8*nLevel+3+1*nGrade+4) | E117: math.floor(1*nLevel+6+5*nGrade+6) | F117: math.floor(0.5*nLevel+1+0.5*nGrade+2) | G117: math.floor(2*nLevel+0+5*nGrade+0) | H117: math.floor(0.15*nLevel+1+0.5*nGrade+1)
A118: 113 | B118: 8660 | C118: math.floor(1.2*nLevel+2+3*nGrade+3) | D118: math.floor(1.8*nLevel+3+1*nGrade+4) | E118: math.floor(1*nLevel+6+5*nGrade+6) | F118: math.floor(0.5*nLevel+1+0.5*nGrade+2) | G118: math.floor(2*nLevel+0+5*nGrade+0) | H118: math.floor(0.15*nLevel+1+0.5*nGrade+1)
A119: 114 | B119: 8840 | C119: math.floor(1.2*nLevel+2+3*nGrade+3) | D119: math.floor(1.8*nLevel+3+1*nGrade+4) | E119: math.floor(1*nLevel+6+5*nGrade+6) | F119: math.floor(0.5*nLevel+1+0.5*nGrade+2) | G119: math.floor(2*nLevel+0+5*nGrade+0) | H119: math.floor(0.15*nLevel+1+0.5*nGrade+1)
A120: 115 | B120: 9020 | C120: math.floor(1.2*nLevel+2+3*nGrade+3) | D120: math.floor(1.8*nLevel+3+1*nGrade+4) | E120: math.floor(1*nLevel+6+5*nGrade+6) | F120: math.floor(0.5*nLevel+1+0.5*nGrade+2) | G120: math.floor(2*nLevel+0+5*nGrade+0) | H120: math.floor(0.15*nLevel+1+0.5*nGrade+1)
A121: 116 | B121: 9200 | C121: math.floor(1.2*nLevel+2+3*nGrade+3) | D121: math.floor(1.8*nLevel+3+1*nGrade+4) | E121: math.floor(1*nLevel+6+5*nGrade+6) | F121: math.floor(0.5*nLevel+1+0.5*nGrade+2) | G121: math.floor(2*nLevel+0+5*nGrade+0) | H121: math.floor(0.15*nLevel+1+0.5*nGrade+1)
A122: 117 | B122: 9380 | C122: math.floor(1.2*nLevel+2+3*nGrade+3) | D122: math.floor(1.8*nLevel+3+1*nGrade+4) | E122: math.floor(1*nLevel+6+5*nGrade+6) | F122: math.floor(0.5*nLevel+1+0.5*nGrade+2) | G122: math.floor(2*nLevel+0+5*nGrade+0) | H122: math.floor(0.15*nLevel+1+0.5*nGrade+1)
A123: 118 | B123: 9560 | C123: math.floor(1.2*nLevel+2+3*nGrade+3) | D123: math.floor(1.8*nLevel+3+1*nGrade+4) | E123: math.floor(1*nLevel+6+5*nGrade+6) | F123: math.floor(0.5*nLevel+1+0.5*nGrade+2) | G123: math.floor(2*nLevel+0+5*nGrade+0) | H123: math.floor(0.15*nLevel+1+0.5*nGrade+1)
A124: 119 | B124: 9740 | C124: math.floor(1.2*nLevel+2+3*nGrade+3) | D124: math.floor(1.8*nLevel+3+1*nGrade+4) | E124: math.floor(1*nLevel+6+5*nGrade+6) | F124: math.floor(0.5*nLevel+1+0.5*nGrade+2) | G124: math.floor(2*nLevel+0+5*nGrade+0) | H124: math.floor(0.15*nLevel+1+0.5*nGrade+1)
A125: 120 | B125: 9920 | C125: math.floor(1.2*nLevel+2+3*nGrade+3) | D125: math.floor(1.8*nLevel+3+1*nGrade+4) | E125: math.floor(1*nLevel+6+5*nGrade+6) | F125: math.floor(0.5*nLevel+1+0.5*nGrade+2) | G125: math.floor(2*nLevel+0+5*nGrade+0) | H125: math.floor(0.15*nLevel+1+0.5*nGrade+1)
A126: 121 | B126: 10100 | C126: math.floor(1.2*nLevel+2+3*nGrade+3) | D126: math.floor(1.8*nLevel+3+1*nGrade+4) | E126: math.floor(1*nLevel+6+5*nGrade+6) | F126: math.floor(0.5*nLevel+1+0.5*nGrade+2) | G126: math.floor(2*nLevel+0+5*nGrade+0) | H126: math.floor(0.15*nLevel+1+0.5*nGrade+1)
A127: 122 | B127: 10300 | C127: math.floor(1.2*nLevel+2+3*nGrade+3) | D127: math.floor(1.8*nLevel+3+1*nGrade+4) | E127: math.floor(1*nLevel+6+5*nGrade+6) | F127: math.floor(0.5*nLevel+1+0.5*nGrade+2) | G127: math.floor(2*nLevel+0+5*nGrade+0) | H127: math.floor(0.15*nLevel+1+0.5*nGrade+1)
A128: 123 | B128: 10500 | C128: math.floor(1.2*nLevel+2+3*nGrade+3) | D128: math.floor(1.8*nLevel+3+1*nGrade+4) | E128: math.floor(1*nLevel+6+5*nGrade+6) | F128: math.floor(0.5*nLevel+1+0.5*nGrade+2) | G128: math.floor(2*nLevel+0+5*nGrade+0) | H128: math.floor(0.15*nLevel+1+0.5*nGrade+1)
A129: 124 | B129: 10700 | C129: math.floor(1.2*nLevel+2+3*nGrade+3) | D129: math.floor(1.8*nLevel+3+1*nGrade+4) | E129: math.floor(1*nLevel+6+5*nGrade+6) | F129: math.floor(0.5*nLevel+1+0.5*nGrade+2) | G129: math.floor(2*nLevel+0+5*nGrade+0) | H129: math.floor(0.15*nLevel+1+0.5*nGrade+1)
A130: 125 | B130: 10900 | C130: math.floor(1.2*nLevel+2+3*nGrade+3) | D130: math.floor(1.8*nLevel+3+1*nGrade+4) | E130: math.floor(1*nLevel+6+5*nGrade+6) | F130: math.floor(0.5*nLevel+1+0.5*nGrade+2) | G130: math.floor(2*nLevel+0+5*nGrade+0) | H130: math.floor(0.15*nLevel+1+0.5*nGrade+1)
A131: 126 | B131: 11100 | C131: math.floor(1.2*nLevel+2+3*nGrade+3) | D131: math.floor(1.8*nLevel+3+1*nGrade+4) | E131: math.floor(1*nLevel+6+5*nGrade+6) | F131: math.floor(0.5*nLevel+1+0.5*nGrade+2) | G131: math.floor(2*nLevel+0+5*nGrade+0) | H131: math.floor(0.15*nLevel+1+0.5*nGrade+1)
A132: 127 | B132: 11300 | C132: math.floor(1.2*nLevel+2+3*nGrade+3) | D132: math.floor(1.8*nLevel+3+1*nGrade+4) | E132: math.floor(1*nLevel+6+5*nGrade+6) | F132: math.floor(0.5*nLevel+1+0.5*nGrade+2) | G132: math.floor(2*nLevel+0+5*nGrade+0) | H132: math.floor(0.15*nLevel+1+0.5*nGrade+1)
A133: 128 | B133: 11500 | C133: math.floor(1.2*nLevel+2+3*nGrade+3) | D133: math.floor(1.8*nLevel+3+1*nGrade+4) | E133: math.floor(1*nLevel+6+5*nGrade+6) | F133: math.floor(0.5*nLevel+1+0.5*nGrade+2) | G133: math.floor(2*nLevel+0+5*nGrade+0) | H133: math.floor(0.15*nLevel+1+0.5*nGrade+1)
A134: 129 | B134: 11700 | C134: math.floor(1.2*nLevel+2+3*nGrade+3) | D134: math.floor(1.8*nLevel+3+1*nGrade+4) | E134: math.floor(1*nLevel+6+5*nGrade+6) | F134: math.floor(0.5*nLevel+1+0.5*nGrade+2) | G134: math.floor(2*nLevel+0+5*nGrade+0) | H134: math.floor(0.15*nLevel+1+0.5*nGrade+1)
A135: 130 | B135: 11900 | C135: math.floor(1.2*nLevel+2+3*nGrade+3) | D135: math.floor(1.8*nLevel+3+1*nGrade+4) | E135: math.floor(1*nLevel+6+5*nGrade+6) | F135: math.floor(0.5*nLevel+1+0.5*nGrade+2) | G135: math.floor(2*nLevel+0+5*nGrade+0) | H135: math.floor(0.15*nLevel+1+0.5*nGrade+1)
A136: 131 | B136: 12100 | C136: math.floor(1.2*nLevel+2+3*nGrade+3) | D136: math.floor(1.8*nLevel+3+1*nGrade+4) | E136: math.floor(1*nLevel+6+5*nGrade+6) | F136: math.floor(0.5*nLevel+1+0.5*nGrade+2) | G136: math.floor(2*nLevel+0+5*nGrade+0) | H136: math.floor(0.15*nLevel+1+0.5*nGrade+1)
A137: 132 | B137: 12320 | C137: math.floor(1.2*nLevel+2+3*nGrade+3) | D137: math.floor(1.8*nLevel+3+1*nGrade+4) | E137: math.floor(1*nLevel+6+5*nGrade+6) | F137: math.floor(0.5*nLevel+1+0.5*nGrade+2) | G137: math.floor(2*nLevel+0+5*nGrade+0) | H137: math.floor(0.15*nLevel+1+0.5*nGrade+1)
A138: 133 | B138: 12540 | C138: math.floor(1.2*nLevel+2+3*nGrade+3) | D138: math.floor(1.8*nLevel+3+1*nGrade+4) | E138: math.floor(1*nLevel+6+5*nGrade+6) | F138: math.floor(0.5*nLevel+1+0.5*nGrade+2) | G138: math.floor(2*nLevel+0+5*nGrade+0) | H138: math.floor(0.15*nLevel+1+0.5*nGrade+1)
A139: 134 | B139: 12760 | C139: math.floor(1.2*nLevel+2+3*nGrade+3) | D139: math.floor(1.8*nLevel+3+1*nGrade+4) | E139: math.floor(1*nLevel+6+5*nGrade+6) | F139: math.floor(0.5*nLevel+1+0.5*nGrade+2) | G139: math.floor(2*nLevel+0+5*nGrade+0) | H139: math.floor(0.15*nLevel+1+0.5*nGrade+1)
A140: 135 | B140: 12980 | C140: math.floor(1.2*nLevel+2+3*nGrade+3) | D140: math.floor(1.8*nLevel+3+1*nGrade+4) | E140: math.floor(1*nLevel+6+5*nGrade+6) | F140: math.floor(0.5*nLevel+1+0.5*nGrade+2) | G140: math.floor(2*nLevel+0+5*nGrade+0) | H140: math.floor(0.15*nLevel+1+0.5*nGrade+1)
A141: 136 | B141: 13200 | C141: math.floor(1.2*nLevel+2+3*nGrade+3) | D141: math.floor(1.8*nLevel+3+1*nGrade+4) | E141: math.floor(1*nLevel+6+5*nGrade+6) | F141: math.floor(0.5*nLevel+1+0.5*nGrade+2) | G141: math.floor(2*nLevel+0+5*nGrade+0) | H141: math.floor(0.15*nLevel+1+0.5*nGrade+1)
A142: 137 | B142: 13420 | C142: math.floor(1.2*nLevel+2+3*nGrade+3) | D142: math.floor(1.8*nLevel+3+1*nGrade+4) | E142: math.floor(1*nLevel+6+5*nGrade+6) | F142: math.floor(0.5*nLevel+1+0.5*nGrade+2) | G142: math.floor(2*nLevel+0+5*nGrade+0) | H142: math.floor(0.15*nLevel+1+0.5*nGrade+1)
A143: 138 | B143: 13640 | C143: math.floor(1.2*nLevel+2+3*nGrade+3) | D143: math.floor(1.8*nLevel+3+1*nGrade+4) | E143: math.floor(1*nLevel+6+5*nGrade+6) | F143: math.floor(0.5*nLevel+1+0.5*nGrade+2) | G143: math.floor(2*nLevel+0+5*nGrade+0) | H143: math.floor(0.15*nLevel+1+0.5*nGrade+1)
A144: 139 | B144: 13860 | C144: math.floor(1.2*nLevel+2+3*nGrade+3) | D144: math.floor(1.8*nLevel+3+1*nGrade+4) | E144: math.floor(1*nLevel+6+5*nGrade+6) | F144: math.floor(0.5*nLevel+1+0.5*nGrade+2) | G144: math.floor(2*nLevel+0+5*nGrade+0) | H144: math.floor(0.15*nLevel+1+0.5*nGrade+1)
A145: 140 | B145: 14080 | C145: math.floor(1.2*nLevel+2+3*nGrade+3) | D145: math.floor(1.8*nLevel+3+1*nGrade+4) | E145: math.floor(1*nLevel+6+5*nGrade+6) | F145: math.floor(0.5*nLevel+1+0.5*nGrade+2) | G145: math.floor(2*nLevel+0+5*nGrade+0) | H145: math.floor(0.15*nLevel+1+0.5*nGrade+1)
A146: 141 | B146: 14300 | C146: math.floor(1.2*nLevel+2+3*nGrade+3) | D146: math.floor(1.8*nLevel+3+1*nGrade+4) | E146: math.floor(1*nLevel+6+5*nGrade+6) | F146: math.floor(0.5*nLevel+1+0.5*nGrade+2) | G146: math.floor(2*nLevel+0+5*nGrade+0) | H146: math.floor(0.15*nLevel+1+0.5*nGrade+1)
A147: 142 | B147: 14540 | C147: math.floor(1.2*nLevel+2+3*nGrade+3) | D147: math.floor(1.8*nLevel+3+1*nGrade+4) | E147: math.floor(1*nLevel+6+5*nGrade+6) | F147: math.floor(0.5*nLevel+1+0.5*nGrade+2) | G147: math.floor(2*nLevel+0+5*nGrade+0) | H147: math.floor(0.15*nLevel+1+0.5*nGrade+1)
A148: 143 | B148: 14780 | C148: math.floor(1.2*nLevel+2+3*nGrade+3) | D148: math.floor(1.8*nLevel+3+1*nGrade+4) | E148: math.floor(1*nLevel+6+5*nGrade+6) | F148: math.floor(0.5*nLevel+1+0.5*nGrade+2) | G148: math.floor(2*nLevel+0+5*nGrade+0) | H148: math.floor(0.15*nLevel+1+0.5*nGrade+1)
A149: 144 | B149: 15020 | C149: math.floor(1.2*nLevel+2+3*nGrade+3) | D149: math.floor(1.8*nLevel+3+1*nGrade+4) | E149: math.floor(1*nLevel+6+5*nGrade+6) | F149: math.floor(0.5*nLevel+1+0.5*nGrade+2) | G149: math.floor(2*nLevel+0+5*nGrade+0) | H149: math.floor(0.15*nLevel+1+0.5*nGrade+1)
A150: 145 | B150: 15260 | C150: math.floor(1.2*nLevel+2+3*nGrade+3) | D150: math.floor(1.8*nLevel+3+1*nGrade+4) | E150: math.floor(1*nLevel+6+5*nGrade+6) | F150: math.floor(0.5*nLevel+1+0.5*nGrade+2) | G150: math.floor(2*nLevel+0+5*nGrade+0) | H150: math.floor(0.15*nLevel+1+0.5*nGrade+1)
A151: 146 | B151: 15500 | C151: math.floor(1.2*nLevel+2+3*nGrade+3) | D151: math.floor(1.8*nLevel+3+1*nGrade+4) | E151: math.floor(1*nLevel+6+5*nGrade+6) | F151: math.floor(0.5*nLevel+1+0.5*nGrade+2) | G151: math.floor(2*nLevel+0+5*nGrade+0) | H151: math.floor(0.15*nLevel+1+0.5*nGrade+1)
A152: 147 | B152: 15740 | C152: math.floor(1.2*nLevel+2+3*nGrade+3) | D152: math.floor(1.8*nLevel+3+1*nGrade+4) | E152: math.floor(1*nLevel+6+5*nGrade+6) | F152: math.floor(0.5*nLevel+1+0.5*nGrade+2) | G152: math.floor(2*nLevel+0+5*nGrade+0) | H152: math.floor(0.15*nLevel+1+0.5*nGrade+1)
A153: 148 | B153: 15980 | C153: math.floor(1.2*nLevel+2+3*nGrade+3) | D153: math.floor(1.8*nLevel+3+1*nGrade+4) | E153: math.floor(1*nLevel+6+5*nGrade+6) | F153: math.floor(0.5*nLevel+1+0.5*nGrade+2) | G153: math.floor(2*nLevel+0+5*nGrade+0) | H153: math.floor(0.15*nLevel+1+0.5*nGrade+1)
A154: 149 | B154: 16220 | C154: math.floor(1.2*nLevel+2+3*nGrade+3) | D154: math.floor(1.8*nLevel+3+1*nGrade+4) | E154: math.floor(1*nLevel+6+5*nGrade+6) | F154: math.floor(0.5*nLevel+1+0.5*nGrade+2) | G154: math.floor(2*nLevel+0+5*nGrade+0) | H154: math.floor(0.15*nLevel+1+0.5*nGrade+1)
A155: 150 | B155: 16460 | C155: math.floor(1.2*nLevel+2+3*nGrade+3) | D155: math.floor(1.8*nLevel+3+1*nGrade+4) | E155: math.floor(1*nLevel+6+5*nGrade+6) | F155: math.floor(0.5*nLevel+1+0.5*nGrade+2) | G155: math.floor(2*nLevel+0+5*nGrade+0) | H155: math.floor(0.15*nLevel+1+0.5*nGrade+1)
A156: 151 | B156: 16700 | C156: math.floor(1.2*nLevel+2+3*nGrade+3) | D156: math.floor(1.8*nLevel+3+1*nGrade+4) | E156: math.floor(1*nLevel+6+5*nGrade+6) | F156: math.floor(0.5*nLevel+1+0.5*nGrade+2) | G156: math.floor(2*nLevel+0+5*nGrade+0) | H156: math.floor(0.15*nLevel+1+0.5*nGrade+1)
A157: 152 | B157: 16960 | C157: math.floor(1.2*nLevel+2+3*nGrade+3) | D157: math.floor(1.8*nLevel+3+1*nGrade+4) | E157: math.floor(1*nLevel+6+5*nGrade+6) | F157: math.floor(0.5*nLevel+1+0.5*nGrade+2) | G157: math.floor(2*nLevel+0+5*nGrade+0) | H157: math.floor(0.15*nLevel+1+0.5*nGrade+1)
A158: 153 | B158: 17220 | C158: math.floor(1.2*nLevel+2+3*nGrade+3) | D158: math.floor(1.8*nLevel+3+1*nGrade+4) | E158: math.floor(1*nLevel+6+5*nGrade+6) | F158: math.floor(0.5*nLevel+1+0.5*nGrade+2) | G158: math.floor(2*nLevel+0+5*nGrade+0) | H158: math.floor(0.15*nLevel+1+0.5*nGrade+1)
A159: 154 | B159: 17480 | C159: math.floor(1.2*nLevel+2+3*nGrade+3) | D159: math.floor(1.8*nLevel+3+1*nGrade+4) | E159: math.floor(1*nLevel+6+5*nGrade+6) | F159: math.floor(0.5*nLevel+1+0.5*nGrade+2) | G159: math.floor(2*nLevel+0+5*nGrade+0) | H159: math.floor(0.15*nLevel+1+0.5*nGrade+1)
A160: 155 | B160: 17740 | C160: math.floor(1.2*nLevel+2+3*nGrade+3) | D160: math.floor(1.8*nLevel+3+1*nGrade+4) | E160: math.floor(1*nLevel+6+5*nGrade+6) | F160: math.floor(0.5*nLevel+1+0.5*nGrade+2) | G160: math.floor(2*nLevel+0+5*nGrade+0) | H160: math.floor(0.15*nLevel+1+0.5*nGrade+1)
A161: 156 | B161: 18000 | C161: math.floor(1.2*nLevel+2+3*nGrade+3) | D161: math.floor(1.8*nLevel+3+1*nGrade+4) | E161: math.floor(1*nLevel+6+5*nGrade+6) | F161: math.floor(0.5*nLevel+1+0.5*nGrade+2) | G161: math.floor(2*nLevel+0+5*nGrade+0) | H161: math.floor(0.15*nLevel+1+0.5*nGrade+1)
A162: 157 | B162: 18260 | C162: math.floor(1.2*nLevel+2+3*nGrade+3) | D162: math.floor(1.8*nLevel+3+1*nGrade+4) | E162: math.floor(1*nLevel+6+5*nGrade+6) | F162: math.floor(0.5*nLevel+1+0.5*nGrade+2) | G162: math.floor(2*nLevel+0+5*nGrade+0) | H162: math.floor(0.15*nLevel+1+0.5*nGrade+1)
A163: 158 | B163: 18520 | C163: math.floor(1.2*nLevel+2+3*nGrade+3) | D163: math.floor(1.8*nLevel+3+1*nGrade+4) | E163: math.floor(1*nLevel+6+5*nGrade+6) | F163: math.floor(0.5*nLevel+1+0.5*nGrade+2) | G163: math.floor(2*nLevel+0+5*nGrade+0) | H163: math.floor(0.15*nLevel+1+0.5*nGrade+1)
A164: 159 | B164: 18780 | C164: math.floor(1.2*nLevel+2+3*nGrade+3) | D164: math.floor(1.8*nLevel+3+1*nGrade+4) | E164: math.floor(1*nLevel+6+5*nGrade+6) | F164: math.floor(0.5*nLevel+1+0.5*nGrade+2) | G164: math.floor(2*nLevel+0+5*nGrade+0) | H164: math.floor(0.15*nLevel+1+0.5*nGrade+1)
A165: 160 | B165: 19040 | C165: math.floor(1.2*nLevel+2+3*nGrade+3) | D165: math.floor(1.8*nLevel+3+1*nGrade+4) | E165: math.floor(1*nLevel+6+5*nGrade+6) | F165: math.floor(0.5*nLevel+1+0.5*nGrade+2) | G165: math.floor(2*nLevel+0+5*nGrade+0) | H165: math.floor(0.15*nLevel+1+0.5*nGrade+1)
A166: 161 | B166: 19300 | C166: math.floor(1.2*nLevel+2+3*nGrade+3) | D166: math.floor(1.8*nLevel+3+1*nGrade+4) | E166: math.floor(1*nLevel+6+5*nGrade+6) | F166: math.floor(0.5*nLevel+1+0.5*nGrade+2) | G166: math.floor(2*nLevel+0+5*nGrade+0) | H166: math.floor(0.15*nLevel+1+0.5*nGrade+1)
A167: 162 | B167: 19580 | C167: math.floor(1.2*nLevel+2+3*nGrade+3) | D167: math.floor(1.8*nLevel+3+1*nGrade+4) | E167: math.floor(1*nLevel+6+5*nGrade+6) | F167: math.floor(0.5*nLevel+1+0.5*nGrade+2) | G167: math.floor(2*nLevel+0+5*nGrade+0) | H167: math.floor(0.15*nLevel+1+0.5*nGrade+1)
A168: 163 | B168: 19860 | C168: math.floor(1.2*nLevel+2+3*nGrade+3) | D168: math.floor(1.8*nLevel+3+1*nGrade+4) | E168: math.floor(1*nLevel+6+5*nGrade+6) | F168: math.floor(0.5*nLevel+1+0.5*nGrade+2) | G168: math.floor(2*nLevel+0+5*nGrade+0) | H168: math.floor(0.15*nLevel+1+0.5*nGrade+1)
A169: 164 | B169: 20140 | C169: math.floor(1.2*nLevel+2+3*nGrade+3) | D169: math.floor(1.8*nLevel+3+1*nGrade+4) | E169: math.floor(1*nLevel+6+5*nGrade+6) | F169: math.floor(0.5*nLevel+1+0.5*nGrade+2) | G169: math.floor(2*nLevel+0+5*nGrade+0) | H169: math.floor(0.15*nLevel+1+0.5*nGrade+1)
A170: 165 | B170: 20420 | C170: math.floor(1.2*nLevel+2+3*nGrade+3) | D170: math.floor(1.8*nLevel+3+1*nGrade+4) | E170: math.floor(1*nLevel+6+5*nGrade+6) | F170: math.floor(0.5*nLevel+1+0.5*nGrade+2) | G170: math.floor(2*nLevel+0+5*nGrade+0) | H170: math.floor(0.15*nLevel+1+0.5*nGrade+1)
A171: 166 | B171: 20700 | C171: math.floor(1.2*nLevel+2+3*nGrade+3) | D171: math.floor(1.8*nLevel+3+1*nGrade+4) | E171: math.floor(1*nLevel+6+5*nGrade+6) | F171: math.floor(0.5*nLevel+1+0.5*nGrade+2) | G171: math.floor(2*nLevel+0+5*nGrade+0) | H171: math.floor(0.15*nLevel+1+0.5*nGrade+1)
A172: 167 | B172: 20980 | C172: math.floor(1.2*nLevel+2+3*nGrade+3) | D172: math.floor(1.8*nLevel+3+1*nGrade+4) | E172: math.floor(1*nLevel+6+5*nGrade+6) | F172: math.floor(0.5*nLevel+1+0.5*nGrade+2) | G172: math.floor(2*nLevel+0+5*nGrade+0) | H172: math.floor(0.15*nLevel+1+0.5*nGrade+1)
A173: 168 | B173: 21260 | C173: math.floor(1.2*nLevel+2+3*nGrade+3) | D173: math.floor(1.8*nLevel+3+1*nGrade+4) | E173: math.floor(1*nLevel+6+5*nGrade+6) | F173: math.floor(0.5*nLevel+1+0.5*nGrade+2) | G173: math.floor(2*nLevel+0+5*nGrade+0) | H173: math.floor(0.15*nLevel+1+0.5*nGrade+1)
A174: 169 | B174: 21540 | C174: math.floor(1.2*nLevel+2+3*nGrade+3) | D174: math.floor(1.8*nLevel+3+1*nGrade+4) | E174: math.floor(1*nLevel+6+5*nGrade+6) | F174: math.floor(0.5*nLevel+1+0.5*nGrade+2) | G174: math.floor(2*nLevel+0+5*nGrade+0) | H174: math.floor(0.15*nLevel+1+0.5*nGrade+1)
A175: 170 | B175: 21820 | C175: math.floor(1.2*nLevel+2+3*nGrade+3) | D175: math.floor(1.8*nLevel+3+1*nGrade+4) | E175: math.floor(1*nLevel+6+5*nGrade+6) | F175: math.floor(0.5*nLevel+1+0.5*nGrade+2) | G175: math.floor(2*nLevel+0+5*nGrade+0) | H175: math.floor(0.15*nLevel+1+0.5*nGrade+1)
A176: 171 | B176: 22100 | C176: math.floor(1.2*nLevel+2+3*nGrade+3) | D176: math.floor(1.8*nLevel+3+1*nGrade+4) | E176: math.floor(1*nLevel+6+5*nGrade+6) | F176: math.floor(0.5*nLevel+1+0.5*nGrade+2) | G176: math.floor(2*nLevel+0+5*nGrade+0) | H176: math.floor(0.15*nLevel+1+0.5*nGrade+1)
A177: 172 | B177: 22400 | C177: math.floor(1.2*nLevel+2+3*nGrade+3) | D177: math.floor(1.8*nLevel+3+1*nGrade+4) | E177: math.floor(1*nLevel+6+5*nGrade+6) | F177: math.floor(0.5*nLevel+1+0.5*nGrade+2) | G177: math.floor(2*nLevel+0+5*nGrade+0) | H177: math.floor(0.15*nLevel+1+0.5*nGrade+1)
A178: 173 | B178: 22700 | C178: math.floor(1.2*nLevel+2+3*nGrade+3) | D178: math.floor(1.8*nLevel+3+1*nGrade+4) | E178: math.floor(1*nLevel+6+5*nGrade+6) | F178: math.floor(0.5*nLevel+1+0.5*nGrade+2) | G178: math.floor(2*nLevel+0+5*nGrade+0) | H178: math.floor(0.15*nLevel+1+0.5*nGrade+1)
A179: 174 | B179: 23000 | C179: math.floor(1.2*nLevel+2+3*nGrade+3) | D179: math.floor(1.8*nLevel+3+1*nGrade+4) | E179: math.floor(1*nLevel+6+5*nGrade+6) | F179: math.floor(0.5*nLevel+1+0.5*nGrade+2) | G179: math.floor(2*nLevel+0+5*nGrade+0) | H179: math.floor(0.15*nLevel+1+0.5*nGrade+1)
A180: 175 | B180: 23300 | C180: math.floor(1.2*nLevel+2+3*nGrade+3) | D180: math.floor(1.8*nLevel+3+1*nGrade+4) | E180: math.floor(1*nLevel+6+5*nGrade+6) | F180: math.floor(0.5*nLevel+1+0.5*nGrade+2) | G180: math.floor(2*nLevel+0+5*nGrade+0) | H180: math.floor(0.15*nLevel+1+0.5*nGrade+1)
A181: 176 | B181: 23600 | C181: math.floor(1.2*nLevel+2+3*nGrade+3) | D181: math.floor(1.8*nLevel+3+1*nGrade+4) | E181: math.floor(1*nLevel+6+5*nGrade+6) | F181: math.floor(0.5*nLevel+1+0.5*nGrade+2) | G181: math.floor(2*nLevel+0+5*nGrade+0) | H181: math.floor(0.15*nLevel+1+0.5*nGrade+1)
A182: 177 | B182: 23900 | C182: math.floor(1.2*nLevel+2+3*nGrade+3) | D182: math.floor(1.8*nLevel+3+1*nGrade+4) | E182: math.floor(1*nLevel+6+5*nGrade+6) | F182: math.floor(0.5*nLevel+1+0.5*nGrade+2) | G182: math.floor(2*nLevel+0+5*nGrade+0) | H182: math.floor(0.15*nLevel+1+0.5*nGrade+1)
A183: 178 | B183: 24200 | C183: math.floor(1.2*nLevel+2+3*nGrade+3) | D183: math.floor(1.8*nLevel+3+1*nGrade+4) | E183: math.floor(1*nLevel+6+5*nGrade+6) | F183: math.floor(0.5*nLevel+1+0.5*nGrade+2) | G183: math.floor(2*nLevel+0+5*nGrade+0) | H183: math.floor(0.15*nLevel+1+0.5*nGrade+1)
A184: 179 | B184: 24500 | C184: math.floor(1.2*nLevel+2+3*nGrade+3) | D184: math.floor(1.8*nLevel+3+1*nGrade+4) | E184: math.floor(1*nLevel+6+5*nGrade+6) | F184: math.floor(0.5*nLevel+1+0.5*nGrade+2) | G184: math.floor(2*nLevel+0+5*nGrade+0) | H184: math.floor(0.15*nLevel+1+0.5*nGrade+1)
A185: 180 | B185: 24800 | C185: math.floor(1.2*nLevel+2+3*nGrade+3) | D185: math.floor(1.8*nLevel+3+1*nGrade+4) | E185: math.floor(1*nLevel+6+5*nGrade+6) | F185: math.floor(0.5*nLevel+1+0.5*nGrade+2) | G185: math.floor(2*nLevel+0+5*nGrade+0) | H185: math.floor(0.15*nLevel+1+0.5*nGrade+1)
A186: 181 | B186: 25100 | C186: math.floor(1.2*nLevel+2+3*nGrade+3) | D186: math.floor(1.8*nLevel+3+1*nGrade+4) | E186: math.floor(1*nLevel+6+5*nGrade+6) | F186: math.floor(0.5*nLevel+1+0.5*nGrade+2) | G186: math.floor(2*nLevel+0+5*nGrade+0) | H186: math.floor(0.15*nLevel+1+0.5*nGrade+1)
A187: 182 | B187: 25420 | C187: math.floor(1.2*nLevel+2+3*nGrade+3) | D187: math.floor(1.8*nLevel+3+1*nGrade+4) | E187: math.floor(1*nLevel+6+5*nGrade+6) | F187: math.floor(0.5*nLevel+1+0.5*nGrade+2) | G187: math.floor(2*nLevel+0+5*nGrade+0) | H187: math.floor(0.15*nLevel+1+0.5*nGrade+1)
A188: 183 | B188: 25740 | C188: math.floor(1.2*nLevel+2+3*nGrade+3) | D188: math.floor(1.8*nLevel+3+1*nGrade+4) | E188: math.floor(1*nLevel+6+5*nGrade+6) | F188: math.floor(0.5*nLevel+1+0.5*nGrade+2) | G188: math.floor(2*nLevel+0+5*nGrade+0) | H188: math.floor(0.15*nLevel+1+0.5*nGrade+1)
A189: 184 | B189: 26060 | C189: math.floor(1.2*nLevel+2+3*nGrade+3) | D189: math.floor(1.8*nLevel+3+1*nGrade+4) | E189: math.floor(1*nLevel+6+5*nGrade+6) | F189: math.floor(0.5*nLevel+1+0.5*nGrade+2) | G189: math.floor(2*nLevel+0+5*nGrade+0) | H189: math.floor(0.15*nLevel+1+0.5*nGrade+1)
A190: 185 | B190: 26380 | C190: math.floor(1.2*nLevel+2+3*nGrade+3) | D190: math.floor(1.8*nLevel+3+1*nGrade+4) | E190: math.floor(1*nLevel+6+5*nGrade+6) | F190: math.floor(0.5*nLevel+1+0.5*nGrade+2) | G190: math.floor(2*nLevel+0+5*nGrade+0) | H190: math.floor(0.15*nLevel+1+0.5*nGrade+1)
A191: 186 | B191: 26700 | C191: math.floor(1.2*nLevel+2+3*nGrade+3) | D191: math.floor(1.8*nLevel+3+1*nGrade+4) | E191: math.floor(1*nLevel+6+5*nGrade+6) | F191: math.floor(0.5*nLevel+1+0.5*nGrade+2) | G191: math.floor(2*nLevel+0+5*nGrade+0) | H191: math.floor(0.15*nLevel+1+0.5*nGrade+1)
A192: 187 | B192: 27020 | C192: math.floor(1.2*nLevel+2+3*nGrade+3) | D192: math.floor(1.8*nLevel+3+1*nGrade+4) | E192: math.floor(1*nLevel+6+5*nGrade+6) | F192: math.floor(0.5*nLevel+1+0.5*nGrade+2) | G192: math.floor(2*nLevel+0+5*nGrade+0) | H192: math.floor(0.15*nLevel+1+0.5*nGrade+1)
A193: 188 | B193: 27340 | C193: math.floor(1.2*nLevel+2+3*nGrade+3) | D193: math.floor(1.8*nLevel+3+1*nGrade+4) | E193: math.floor(1*nLevel+6+5*nGrade+6) | F193: math.floor(0.5*nLevel+1+0.5*nGrade+2) | G193: math.floor(2*nLevel+0+5*nGrade+0) | H193: math.floor(0.15*nLevel+1+0.5*nGrade+1)
A194: 189 | B194: 27660 | C194: math.floor(1.2*nLevel+2+3*nGrade+3) | D194: math.floor(1.8*nLevel+3+1*nGrade+4) | E194: math.floor(1*nLevel+6+5*nGrade+6) | F194: math.floor(0.5*nLevel+1+0.5*nGrade+2) | G194: math.floor(2*nLevel+0+5*nGrade+0) | H194: math.floor(0.15*nLevel+1+0.5*nGrade+1)
A195: 190 | B195: 27980 | C195: math.floor(1.2*nLevel+2+3*nGrade+3) | D195: math.floor(1.8*nLevel+3+1*nGrade+4) | E195: math.floor(1*nLevel+6+5*nGrade+6) | F195: math.floor(0.5*nLevel+1+0.5*nGrade+2) | G195: math.floor(2*nLevel+0+5*nGrade+0) | H195: math.floor(0.15*nLevel+1+0.5*nGrade+1)
A196: 191 | B196: 28300 | C196: math.floor(1.2*nLevel+2+3*nGrade+3) | D196: math.floor(1.8*nLevel+3+1*nGrade+4) | E196: math.floor(1*nLevel+6+5*nGrade+6) | F196: math.floor(0.5*nLevel+1+0.5*nGrade+2) | G196: math.floor(2*nLevel+0+5*nGrade+0) | H196: math.floor(0.15*nLevel+1+0.5*nGrade+1)
A197: 192 | B197: 28640 | C197: math.floor(1.2*nLevel+2+3*nGrade+3) | D197: math.floor(1.8*nLevel+3+1*nGrade+4) | E197: math.floor(1*nLevel+6+5*nGrade+6) | F197: math.floor(0.5*nLevel+1+0.5*nGrade+2) | G197: math.floor(2*nLevel+0+5*nGrade+0) | H197: math.floor(0.15*nLevel+1+0.5*nGrade+1)
A198: 193 | B198: 28980 | C198: math.floor(1.2*nLevel+2+3*nGrade+3) | D198: math.floor(1.8*nLevel+3+1*nGrade+4) | E198: math.floor(1*nLevel+6+5*nGrade+6) | F198: math.floor(0.5*nLevel+1+0.5*nGrade+2) | G198: math.floor(2*nLevel+0+5*nGrade+0) | H198: math.floor(0.15*nLevel+1+0.5*nGrade+1)
A199: 194 | B199: 29320 | C199: math.floor(1.2*nLevel+2+3*nGrade+3) | D199: math.floor(1.8*nLevel+3+1*nGrade+4) | E199: math.floor(1*nLevel+6+5*nGrade+6) | F199: math.floor(0.5*nLevel+1+0.5*nGrade+2) | G199: math.floor(2*nLevel+0+5*nGrade+0) | H199: math.floor(0.15*nLevel+1+0.5*nGrade+1)
A200: 195 | B200: 29660 | C200: math.floor(1.2*nLevel+2+3*nGrade+3) | D200: math.floor(1.8*nLevel+3+1*nGrade+4) | E200: math.floor(1*nLevel+6+5*nGrade+6) | F200: math.floor(0.5*nLevel+1+0.5*nGrade+2) | G200: math.floor(2*nLevel+0+5*nGrade+0) | H200: math.floor(0.15*nLevel+1+0.5*nGrade+1)
A201: 196 | B201: 30000 | C201: math.floor(1.2*nLevel+2+3*nGrade+3) | D201: math.floor(1.8*nLevel+3+1*nGrade+4) | E201: math.floor(1*nLevel+6+5*nGrade+6) | F201: math.floor(0.5*nLevel+1+0.5*nGrade+2) | G201: math.floor(2*nLevel+0+5*nGrade+0) | H201: math.floor(0.15*nLevel+1+0.5*nGrade+1)
A202: 197 | B202: 30340 | C202: math.floor(1.2*nLevel+2+3*nGrade+3) | D202: math.floor(1.8*nLevel+3+1*nGrade+4) | E202: math.floor(1*nLevel+6+5*nGrade+6) | F202: math.floor(0.5*nLevel+1+0.5*nGrade+2) | G202: math.floor(2*nLevel+0+5*nGrade+0) | H202: math.floor(0.15*nLevel+1+0.5*nGrade+1)
A203: 198 | B203: 30680 | C203: math.floor(1.2*nLevel+2+3*nGrade+3) | D203: math.floor(1.8*nLevel+3+1*nGrade+4) | E203: math.floor(1*nLevel+6+5*nGrade+6) | F203: math.floor(0.5*nLevel+1+0.5*nGrade+2) | G203: math.floor(2*nLevel+0+5*nGrade+0) | H203: math.floor(0.15*nLevel+1+0.5*nGrade+1)
A204: 199 | B204: 31020 | C204: math.floor(1.2*nLevel+2+3*nGrade+3) | D204: math.floor(1.8*nLevel+3+1*nGrade+4) | E204: math.floor(1*nLevel+6+5*nGrade+6) | F204: math.floor(0.5*nLevel+1+0.5*nGrade+2) | G204: math.floor(2*nLevel+0+5*nGrade+0) | H204: math.floor(0.15*nLevel+1+0.5*nGrade+1)
A205: 200 | B205: 31360 | C205: math.floor(1.2*nLevel+2+3*nGrade+3) | D205: math.floor(1.8*nLevel+3+1*nGrade+4) | E205: math.floor(1*nLevel+6+5*nGrade+6) | F205: math.floor(0.5*nLevel+1+0.5*nGrade+2) | G205: math.floor(2*nLevel+0+5*nGrade+0) | H205: math.floor(0.15*nLevel+1+0.5*nGrade+1)

Sheet: Sheet2
A1: 配ABXY | C1: 1 | D1: 2 | E1: 3 | F1: 4 | G1: 5 | H1: 6
B2: A | C2: 1.8 | D2: 1 | E2: 1.2 | F2: 0.5 | G2: 0.15 | H2: 2
B3: B | C3: 3 | D3: 6 | E3: 2 | F3: 1 | G3: 1 | H3: 0
B4: X | C4: 1 | D4: 5 | E4: 3 | F4: 0.5 | G4: 0.5 | H4: 5
B5: Y | C5: 4 | D5: 6 | E5: 3 | F5: 2 | G5: 1 | H5: 0
C6: 1 | D6: 2 | E6: 3 | F6: 4 | G6: 5 | H6: 6
A7: 等级 | B7: 品阶 | C7: 攻击 | D7: 防御 | E7: 生命 | F7: 灵力 | G7: 速度 | H7: 魔法
A8: 1 | B8: 0 | C8: =INT(R2C3*RC1+R3C3+R4C3*RC2+R5C3) -> 8 | D8: =INT(R2C4*RC1+R3C4+R4C4*RC2+R5C4) -> 13 | E8: =INT(R2C5*RC1+R3C5+R4C5*RC2+R5C5) -> 6 | F8: =INT(R2C6*RC1+R3C6+R4C6*RC2+R5C6) -> 3 | G8: =INT(R2C7*RC1+R3C7+R4C7*RC2+R5C7) -> 2 | H8: =INT(R2C8*RC1+R3C8+R4C8*RC2+R5C8) -> 2
A9: 2 | B9: 0 | C9: =INT(R2C3*RC1+R3C3+R4C3*RC2+R5C3) -> 10 | D9: =INT(R2C4*RC1+R3C4+R4C4*RC2+R5C4) -> 14 | E9: =INT(R2C5*RC1+R3C5+R4C5*RC2+R5C5) -> 7 | F9: =INT(R2C6*RC1+R3C6+R4C6*RC2+R5C6) -> 4 | G9: =INT(R2C7*RC1+R3C7+R4C7*RC2+R5C7) -> 2 | H9: =INT(R2C8*RC1+R3C8+R4C8*RC2+R5C8) -> 4
A10: 3 | B10: 0 | C10: =INT(R2C3*RC1+R3C3+R4C3*RC2+R5C3) -> 12 | D10: =INT(R2C4*RC1+R3C4+R4C4*RC2+R5C4) -> 15 | E10: =INT(R2C5*RC1+R3C5+R4C5*RC2+R5C5) -> 8 | F10: =INT(R2C6*RC1+R3C6+R4C6*RC2+R5C6) -> 4 | G10: =INT(R2C7*RC1+R3C7+R4C7*RC2+R5C7) -> 2 | H10: =INT(R2C8*RC1+R3C8+R4C8*RC2+R5C8) -> 6
A11: 4 | B11: 0 | C11: =INT(R2C3*RC1+R3C3+R4C3*RC2+R5C3) -> 14 | D11: =INT(R2C4*RC1+R3C4+R4C4*RC2+R5C4) -> 16 | E11: =INT(R2C5*RC1+R3C5+R4C5*RC2+R5C5) -> 9 | F11: =INT(R2C6*RC1+R3C6+R4C6*RC2+R5C6) -> 5 | G11: =INT(R2C7*RC1+R3C7+R4C7*RC2+R5C7) -> 2 | H11: =INT(R2C8*RC1+R3C8+R4C8*RC2+R5C8) -> 8
A12: 5 | B12: 0 | C12: =INT(R2C3*RC1+R3C3+R4C3*RC2+R5C3) -> 16 | D12: =INT(R2C4*RC1+R3C4+R4C4*RC2+R5C4) -> 17 | E12: =INT(R2C5*RC1+R3C5+R4C5*RC2+R5C5) -> 11 | F12: =INT(R2C6*RC1+R3C6+R4C6*RC2+R5C6) -> 5 | G12: =INT(R2C7*RC1+R3C7+R4C7*RC2+R5C7) -> 2 | H12: =INT(R2C8*RC1+R3C8+R4C8*RC2+R5C8) -> 10
A13: 6 | B13: 0 | C13: =INT(R2C3*RC1+R3C3+R4C3*RC2+R5C3) -> 17 | D13: =INT(R2C4*RC1+R3C4+R4C4*RC2+R5C4) -> 18 | E13: =INT(R2C5*RC1+R3C5+R4C5*RC2+R5C5) -> 12 | F13: =INT(R2C6*RC1+R3C6+R4C6*RC2+R5C6) -> 6 | G13: =INT(R2C7*RC1+R3C7+R4C7*RC2+R5C7) -> 2 | H13: =INT(R2C8*RC1+R3C8+R4C8*RC2+R5C8) -> 12
A14: 7 | B14: 0 | C14: =INT(R2C3*RC1+R3C3+R4C3*RC2+R5C3) -> 19 | D14: =INT(R2C4*RC1+R3C4+R4C4*RC2+R5C4) -> 19 | E14: =INT(R2C5*RC1+R3C5+R4C5*RC2+R5C5) -> 13 | F14: =INT(R2C6*RC1+R3C6+R4C6*RC2+R5C6) -> 6 | G14: =INT(R2C7*RC1+R3C7+R4C7*RC2+R5C7) -> 3 | H14: =INT(R2C8*RC1+R3C8+R4C8*RC2+R5C8) -> 14
A15: 8 | B15: 0 | C15: =INT(R2C3*RC1+R3C3+R4C3*RC2+R5C3) -> 21 | D15: =INT(R2C4*RC1+R3C4+R4C4*RC2+R5C4) -> 20 | E15: =INT(R2C5*RC1+R3C5+R4C5*RC2+R5C5) -> 14 | F15: =INT(R2C6*RC1+R3C6+R4C6*RC2+R5C6) -> 7 | G15: =INT(R2C7*RC1+R3C7+R4C7*RC2+R5C7) -> 3 | H15: =INT(R2C8*RC1+R3C8+R4C8*RC2+R5C8) -> 16
A16: 9 | B16: 0 | C16: =INT(R2C3*RC1+R3C3+R4C3*RC2+R5C3) -> 23 | D16: =INT(R2C4*RC1+R3C4+R4C4*RC2+R5C4) -> 21 | E16: =INT(R2C5*RC1+R3C5+R4C5*RC2+R5C5) -> 15 | F16: =INT(R2C6*RC1+R3C6+R4C6*RC2+R5C6) -> 7 | G16: =INT(R2C7*RC1+R3C7+R4C7*RC2+R5C7) -> 3 | H16: =INT(R2C8*RC1+R3C8+R4C8*RC2+R5C8) -> 18
A17: 10 | B17: 1 | C17: =INT(R2C3*RC1+R3C3+R4C3*RC2+R5C3) -> 26 | D17: =INT(R2C4*RC1+R3C4+R4C4*RC2+R5C4) -> 27 | E17: =INT(R2C5*RC1+R3C5+R4C5*RC2+R5C5) -> 20 | F17: =INT(R2C6*RC1+R3C6+R4C6*RC2+R5C6) -> 8 | G17: =INT(R2C7*RC1+R3C7+R4C7*RC2+R5C7) -> 4 | H17: =INT(R2C8*RC1+R3C8+R4C8*RC2+R5C8) -> 25
A18: 11 | B18: 1 | C18: =INT(R2C3*RC1+R3C3+R4C3*RC2+R5C3) -> 27 | D18: =INT(R2C4*RC1+R3C4+R4C4*RC2+R5C4) -> 28 | E18: =INT(R2C5*RC1+R3C5+R4C5*RC2+R5C5) -> 21 | F18: =INT(R2C6*RC1+R3C6+R4C6*RC2+R5C6) -> 9 | G18: =INT(R2C7*RC1+R3C7+R4C7*RC2+R5C7) -> 4 | H18: =INT(R2C8*RC1+R3C8+R4C8*RC2+R5C8) -> 27
A19: 12 | B19: 1 | C19: =INT(R2C3*RC1+R3C3+R4C3*RC2+R5C3) -> 29 | D19: =INT(R2C4*RC1+R3C4+R4C4*RC2+R5C4) -> 29 | E19: =INT(R2C5*RC1+R3C5+R4C5*RC2+R5C5) -> 22 | F19: =INT(R2C6*RC1+R3C6+R4C6*RC2+R5C6) -> 9 | G19: =INT(R2C7*RC1+R3C7+R4C7*RC2+R5C7) -> 4 | H19: =INT(R2C8*RC1+R3C8+R4C8*RC2+R5C8) -> 29
A20: 13 | B20: 1 | C20: =INT(R2C3*RC1+R3C3+R4C3*RC2+R5C3) -> 31 | D20: =INT(R2C4*RC1+R3C4+R4C4*RC2+R5C4) -> 30 | E20: =INT(R2C5*RC1+R3C5+R4C5*RC2+R5C5) -> 23 | F20: =INT(R2C6*RC1+R3C6+R4C6*RC2+R5C6) -> 10 | G20: =INT(R2C7*RC1+R3C7+R4C7*RC2+R5C7) -> 4 | H20: =INT(R2C8*RC1+R3C8+R4C8*RC2+R5C8) -> 31
A21: 14 | B21: 1 | C21: =INT(R2C3*RC1+R3C3+R4C3*RC2+R5C3) -> 33 | D21: =INT(R2C4*RC1+R3C4+R4C4*RC2+R5C4) -> 31 | E21: =INT(R2C5*RC1+R3C5+R4C5*RC2+R5C5) -> 24 | F21: =INT(R2C6*RC1+R3C6+R4C6*RC2+R5C6) -> 10 | G21: =INT(R2C7*RC1+R3C7+R4C7*RC2+R5C7) -> 4 | H21: =INT(R2C8*RC1+R3C8+R4C8*RC2+R5C8) -> 33
A22: 15 | B22: 1 | C22: =INT(R2C3*RC1+R3C3+R4C3*RC2+R5C3) -> 35 | D22: =INT(R2C4*RC1+R3C4+R4C4*RC2+R5C4) -> 32 | E22: =INT(R2C5*RC1+R3C5+R4C5*RC2+R5C5) -> 26 | F22: =INT(R2C6*RC1+R3C6+R4C6*RC2+R5C6) -> 11 | G22: =INT(R2C7*RC1+R3C7+R4C7*RC2+R5C7) -> 4 | H22: =INT(R2C8*RC1+R3C8+R4C8*RC2+R5C8) -> 35
A23: 16 | B23: 1 | C23: =INT(R2C3*RC1+R3C3+R4C3*RC2+R5C3) -> 36 | D23: =INT(R2C4*RC1+R3C4+R4C4*RC2+R5C4) -> 33 | E23: =INT(R2C5*RC1+R3C5+R4C5*RC2+R5C5) -> 27 | F23: =INT(R2C6*RC1+R3C6+R4C6*RC2+R5C6) -> 11 | G23: =INT(R2C7*RC1+R3C7+R4C7*RC2+R5C7) -> 4 | H23: =INT(R2C8*RC1+R3C8+R4C8*RC2+R5C8) -> 37
A24: 17 | B24: 1 | C24: =INT(R2C3*RC1+R3C3+R4C3*RC2+R5C3) -> 38 | D24: =INT(R2C4*RC1+R3C4+R4C4*RC2+R5C4) -> 34 | E24: =INT(R2C5*RC1+R3C5+R4C5*RC2+R5C5) -> 28 | F24: =INT(R2C6*RC1+R3C6+R4C6*RC2+R5C6) -> 12 | G24: =INT(R2C7*RC1+R3C7+R4C7*RC2+R5C7) -> 5 | H24: =INT(R2C8*RC1+R3C8+R4C8*RC2+R5C8) -> 39
A25: 18 | B25: 1 | C25: =INT(R2C3*RC1+R3C3+R4C3*RC2+R5C3) -> 40 | D25: =INT(R2C4*RC1+R3C4+R4C4*RC2+R5C4) -> 35 | E25: =INT(R2C5*RC1+R3C5+R4C5*RC2+R5C5) -> 29 | F25: =INT(R2C6*RC1+R3C6+R4C6*RC2+R5C6) -> 12 | G25: =INT(R2C7*RC1+R3C7+R4C7*RC2+R5C7) -> 5 | H25: =INT(R2C8*RC1+R3C8+R4C8*RC2+R5C8) -> 41
A26: 19 | B26: 1 | C26: =INT(R2C3*RC1+R3C3+R4C3*RC2+R5C3) -> 42 | D26: =INT(R2C4*RC1+R3C4+R4C4*RC2+R5C4) -> 36 | E26: =INT(R2C5*RC1+R3C5+R4C5*RC2+R5C5) -> 30 | F26: =INT(R2C6*RC1+R3C6+R4C6*RC2+R5C6) -> 13 | G26: =INT(R2C7*RC1+R3C7+R4C7*RC2+R5C7) -> 5 | H26: =INT(R2C8*RC1+R3C8+R4C8*RC2+R5C8) -> 43
A27: 20 | B27: 2 | C27: =INT(R2C3*RC1+R3C3+R4C3*RC2+R5C3) -> 45 | D27: =INT(R2C4*RC1+R3C4+R4C4*RC2+R5C4) -> 42 | E27: =INT(R2C5*RC1+R3C5+R4C5*RC2+R5C5) -> 35 | F27: =INT(R2C6*RC1+R3C6+R4C6*RC2+R5C6) -> 14 | G27: =INT(R2C7*RC1+R3C7+R4C7*RC2+R5C7) -> 6 | H27: =INT(R2C8*RC1+R3C8+R4C8*RC2+R5C8) -> 50
A28: 21 | B28: 2 | C28: =INT(R2C3*RC1+R3C3+R4C3*RC2+R5C3) -> 46 | D28: =INT(R2C4*RC1+R3C4+R4C4*RC2+R5C4) -> 43 | E28: =INT(R2C5*RC1+R3C5+R4C5*RC2+R5C5) -> 36 | F28: =INT(R2C6*RC1+R3C6+R4C6*RC2+R5C6) -> 14 | G28: =INT(R2C7*RC1+R3C7+R4C7*RC2+R5C7) -> 6 | H28: =INT(R2C8*RC1+R3C8+R4C8*RC2+R5C8) -> 52
A29: 22 | B29: 2 | C29: =INT(R2C3*RC1+R3C3+R4C3*RC2+R5C3) -> 48 | D29: =INT(R2C4*RC1+R3C4+R4C4*RC2+R5C4) -> 44 | E29: =INT(R2C5*RC1+R3C5+R4C5*RC2+R5C5) -> 37 | F29: =INT(R2C6*RC1+R3C6+R4C6*RC2+R5C6) -> 15 | G29: =INT(R2C7*RC1+R3C7+R4C7*RC2+R5C7) -> 6 | H29: =INT(R2C8*RC1+R3C8+R4C8*RC2+R5C8) -> 54
A30: 23 | B30: 2 | C30: =INT(R2C3*RC1+R3C3+R4C3*RC2+R5C3) -> 50 | D30: =INT(R2C4*RC1+R3C4+R4C4*RC2+R5C4) -> 45 | E30: =INT(R2C5*RC1+R3C5+R4C5*RC2+R5C5) -> 38 | F30: =INT(R2C6*RC1+R3C6+R4C6*RC2+R5C6) -> 15 | G30: =INT(R2C7*RC1+R3C7+R4C7*RC2+R5C7) -> 6 | H30: =INT(R2C8*RC1+R3C8+R4C8*RC2+R5C8) -> 56
A31: 24 | B31: 2 | C31: =INT(R2C3*RC1+R3C3+R4C3*RC2+R5C3) -> 52 | D31: =INT(R2C4*RC1+R3C4+R4C4*RC2+R5C4) -> 46 | E31: =INT(R2C5*RC1+R3C5+R4C5*RC2+R5C5) -> 39 | F31: =INT(R2C6*RC1+R3C6+R4C6*RC2+R5C6) -> 16 | G31: =INT(R2C7*RC1+R3C7+R4C7*RC2+R5C7) -> 6 | H31: =INT(R2C8*RC1+R3C8+R4C8*RC2+R5C8) -> 58
A32: 25 | B32: 2 | C32: =INT(R2C3*RC1+R3C3+R4C3*RC2+R5C3) -> 54 | D32: =INT(R2C4*RC1+R3C4+R4C4*RC2+R5C4) -> 47 | E32: =INT(R2C5*RC1+R3C5+R4C5*RC2+R5C5) -> 41 | F32: =INT(R2C6*RC1+R3C6+R4C6*RC2+R5C6) -> 16 | G32: =INT(R2C7*RC1+R3C7+R4C7*RC2+R5C7) -> 6 | H32: =INT(R2C8*RC1+R3C8+R4C8*RC2+R5C8) -> 60
A33: 26 | B33: 2 | C33: =INT(R2C3*RC1+R3C3+R4C3*RC2+R5C3) -> 55 | D33: =INT(R2C4*RC1+R3C4+R4C4*RC2+R5C4) -> 48 | E33: =INT(R2C5*RC1+R3C5+R4C5*RC2+R5C5) -> 42 | F33: =INT(R2C6*RC1+R3C6+R4C6*RC2+R5C6) -> 17 | G33: =INT(R2C7*RC1+R3C7+R4C7*RC2+R5C7) -> 6 | H33: =INT(R2C8*RC1+R3C8+R4C8*RC2+R5C8) -> 62
A34: 27 | B34: 2 | C34: =INT(R2C3*RC1+R3C3+R4C3*RC2+R5C3) -> 57 | D34: =INT(R2C4*RC1+R3C4+R4C4*RC2+R5C4) -> 49 | E34: =INT(R2C5*RC1+R3C5+R4C5*RC2+R5C5) -> 43 | F34: =INT(R2C6*RC1+R3C6+R4C6*RC2+R5C6) -> 17 | G34: =INT(R2C7*RC1+R3C7+R4C7*RC2+R5C7) -> 7 | H34: =INT(R2C8*RC1+R3C8+R4C8*RC2+R5C8) -> 64
A35: 28 | B35: 2 | C35: =INT(R2C3*RC1+R3C3+R4C3*RC2+R5C3) -> 59 | D35: =INT(R2C4*RC1+R3C4+R4C4*RC2+R5C4) -> 50 | E35: =INT(R2C5*RC1+R3C5+R4C5*RC2+R5C5) -> 44 | F35: =INT(R2C6*RC1+R3C6+R4C6*RC2+R5C6) -> 18 | G35: =INT(R2C7*RC1+R3C7+R4C7*RC2+R5C7) -> 7 | H35: =INT(R2C8*RC1+R3C8+R4C8*RC2+R5C8) -> 66
A36: 29 | B36: 2 | C36: =INT(R2C3*RC1+R3C3+R4C3*RC2+R5C3) -> 61 | D36: =INT(R2C4*RC1+R3C4+R4C4*RC2+R5C4) -> 51 | E36: =INT(R2C5*RC1+R3C5+R4C5*RC2+R5C5) -> 45 | F36: =INT(R2C6*RC1+R3C6+R4C6*RC2+R5C6) -> 18 | G36: =INT(R2C7*RC1+R3C7+R4C7*RC2+R5C7) -> 7 | H36: =INT(R2C8*RC1+R3C8+R4C8*RC2+R5C8) -> 68
A37: 30 | B37: 3 | C37: =INT(R2C3*RC1+R3C3+R4C3*RC2+R5C3) -> 64 | D37: =INT(R2C4*RC1+R3C4+R4C4*RC2+R5C4) -> 57 | E37: =INT(R2C5*RC1+R3C5+R4C5*RC2+R5C5) -> 50 | F37: =INT(R2C6*RC1+R3C6+R4C6*RC2+R5C6) -> 19 | G37: =INT(R2C7*RC1+R3C7+R4C7*RC2+R5C7) -> 8 | H37: =INT(R2C8*RC1+R3C8+R4C8*RC2+R5C8) -> 75
A38: 31 | B38: 3 | C38: =INT(R2C3*RC1+R3C3+R4C3*RC2+R5C3) -> 65 | D38: =INT(R2C4*RC1+R3C4+R4C4*RC2+R5C4) -> 58 | E38: =INT(R2C5*RC1+R3C5+R4C5*RC2+R5C5) -> 51 | F38: =INT(R2C6*RC1+R3C6+R4C6*RC2+R5C6) -> 20 | G38: =INT(R2C7*RC1+R3C7+R4C7*RC2+R5C7) -> 8 | H38: =INT(R2C8*RC1+R3C8+R4C8*RC2+R5C8) -> 77
A39: 32 | B39: 3 | C39: =INT(R2C3*RC1+R3C3+R4C3*RC2+R5C3) -> 67 | D39: =INT(R2C4*RC1+R3C4+R4C4*RC2+R5C4) -> 59 | E39: =INT(R2C5*RC1+R3C5+R4C5*RC2+R5C5) -> 52 | F39: =INT(R2C6*RC1+R3C6+R4C6*RC2+R5C6) -> 20 | G39: =INT(R2C7*RC1+R3C7+R4C7*RC2+R5C7) -> 8 | H39: =INT(R2C8*RC1+R3C8+R4C8*RC2+R5C8) -> 79
A40: 33 | B40: 3 | C40: =INT(R2C3*RC1+R3C3+R4C3*RC2+R5C3) -> 69 | D40: =INT(R2C4*RC1+R3C4+R4C4*RC2+R5C4) -> 60 | E40: =INT(R2C5*RC1+R3C5+R4C5*RC2+R5C5) -> 53 | F40: =INT(R2C6*RC1+R3C6+R4C6*RC2+R5C6) -> 21 | G40: =INT(R2C7*RC1+R3C7+R4C7*RC2+R5C7) -> 8 | H40: =INT(R2C8*RC1+R3C8+R4C8*RC2+R5C8) -> 81
A41: 34 | B41: 3 | C41: =INT(R2C3*RC1+R3C3+R4C3*RC2+R5C3) -> 71 | D41: =INT(R2C4*RC1+R3C4+R4C4*RC2+R5C4) -> 61 | E41: =INT(R2C5*RC1+R3C5+R4C5*RC2+R5C5) -> 54 | F41: =INT(R2C6*RC1+R3C6+R4C6*RC2+R5C6) -> 21 | G41: =INT(R2C7*RC1+R3C7+R4C7*RC2+R5C7) -> 8 | H41: =INT(R2C8*RC1+R3C8+R4C8*RC2+R5C8) -> 83
A42: 35 | B42: 3 | C42: =INT(R2C3*RC1+R3C3+R4C3*RC2+R5C3) -> 73 | D42: =INT(R2C4*RC1+R3C4+R4C4*RC2+R5C4) -> 62 | E42: =INT(R2C5*RC1+R3C5+R4C5*RC2+R5C5) -> 56 | F42: =INT(R2C6*RC1+R3C6+R4C6*RC2+R5C6) -> 22 | G42: =INT(R2C7*RC1+R3C7+R4C7*RC2+R5C7) -> 8 | H42: =INT(R2C8*RC1+R3C8+R4C8*RC2+R5C8) -> 85
A43: 36 | B43: 3 | C43: =INT(R2C3*RC1+R3C3+R4C3*RC2+R5C3) -> 74 | D43: =INT(R2C4*RC1+R3C4+R4C4*RC2+R5C4) -> 63 | E43: =INT(R2C5*RC1+R3C5+R4C5*RC2+R5C5) -> 57 | F43: =INT(R2C6*RC1+R3C6+R4C6*RC2+R5C6) -> 22 | G43: =INT(R2C7*RC1+R3C7+R4C7*RC2+R5C7) -> 8 | H43: =INT(R2C8*RC1+R3C8+R4C8*RC2+R5C8) -> 87
A44: 37 | B44: 3 | C44: =INT(R2C3*RC1+R3C3+R4C3*RC2+R5C3) -> 76 | D44: =INT(R2C4*RC1+R3C4+R4C4*RC2+R5C4) -> 64 | E44: =INT(R2C5*RC1+R3C5+R4C5*RC2+R5C5) -> 58 | F44: =INT(R2C6*RC1+R3C6+R4C6*RC2+R5C6) -> 23 | G44: =INT(R2C7*RC1+R3C7+R4C7*RC2+R5C7) -> 9 | H44: =INT(R2C8*RC1+R3C8+R4C8*RC2+R5C8) -> 89
A45: 38 | B45: 3 | C45: =INT(R2C3*RC1+R3C3+R4C3*RC2+R5C3) -> 78 | D45: =INT(R2C4*RC1+R3C4+R4C4*RC2+R5C4) -> 65 | E45: =INT(R2C5*RC1+R3C5+R4C5*RC2+R5C5) -> 59 | F45: =INT(R2C6*RC1+R3C6+R4C6*RC2+R5C6) -> 23 | G45: =INT(R2C7*RC1+R3C7+R4C7*RC2+R5C7) -> 9 | H45: =INT(R2C8*RC1+R3C8+R4C8*RC2+R5C8) -> 91
A46: 39 | B46: 3 | C46: =INT(R2C3*RC1+R3C3+R4C3*RC2+R5C3) -> 80 | D46: =INT(R2C4*RC1+R3C4+R4C4*RC2+R5C4) -> 66 | E46: =INT(R2C5*RC1+R3C5+R4C5*RC2+R5C5) -> 60 | F46: =INT(R2C6*RC1+R3C6+R4C6*RC2+R5C6) -> 24 | G46: =INT(R2C7*RC1+R3C7+R4C7*RC2+R5C7) -> 9 | H46: =INT(R2C8*RC1+R3C8+R4C8*RC2+R5C8) -> 93
A47: 40 | B47: 4 | C47: =INT(R2C3*RC1+R3C3+R4C3*RC2+R5C3) -> 83 | D47: =INT(R2C4*RC1+R3C4+R4C4*RC2+R5C4) -> 72 | E47: =INT(R2C5*RC1+R3C5+R4C5*RC2+R5C5) -> 65 | F47: =INT(R2C6*RC1+R3C6+R4C6*RC2+R5C6) -> 25 | G47: =INT(R2C7*RC1+R3C7+R4C7*RC2+R5C7) -> 10 | H47: =INT(R2C8*RC1+R3C8+R4C8*RC2+R5C8) -> 100
A48: 41 | B48: 4 | C48: =INT(R2C3*RC1+R3C3+R4C3*RC2+R5C3) -> 84 | D48: =INT(R2C4*RC1+R3C4+R4C4*RC2+R5C4) -> 73 | E48: =INT(R2C5*RC1+R3C5+R4C5*RC2+R5C5) -> 66 | F48: =INT(R2C6*RC1+R3C6+R4C6*RC2+R5C6) -> 25 | G48: =INT(R2C7*RC1+R3C7+R4C7*RC2+R5C7) -> 10 | H48: =INT(R2C8*RC1+R3C8+R4C8*RC2+R5C8) -> 102
A49: 42 | B49: 4 | C49: =INT(R2C3*RC1+R3C3+R4C3*RC2+R5C3) -> 86 | D49: =INT(R2C4*RC1+R3C4+R4C4*RC2+R5C4) -> 74 | E49: =INT(R2C5*RC1+R3C5+R4C5*RC2+R5C5) -> 67 | F49: =INT(R2C6*RC1+R3C6+R4C6*RC2+R5C6) -> 26 | G49: =INT(R2C7*RC1+R3C7+R4C7*RC2+R5C7) -> 10 | H49: =INT(R2C8*RC1+R3C8+R4C8*RC2+R5C8) -> 104
A50: 43 | B50: 4 | C50: =INT(R2C3*RC1+R3C3+R4C3*RC2+R5C3) -> 88 | D50: =INT(R2C4*RC1+R3C4+R4C4*RC2+R5C4) -> 75 | E50: =INT(R2C5*RC1+R3C5+R4C5*RC2+R5C5) -> 68 | F50: =INT(R2C6*RC1+R3C6+R4C6*RC2+R5C6) -> 26 | G50: =INT(R2C7*RC1+R3C7+R4C7*RC2+R5C7) -> 10 | H50: =INT(R2C8*RC1+R3C8+R4C8*RC2+R5C8) -> 106
A51: 44 | B51: 4 | C51: =INT(R2C3*RC1+R3C3+R4C3*RC2+R5C3) -> 90 | D51: =INT(R2C4*RC1+R3C4+R4C4*RC2+R5C4) -> 76 | E51: =INT(R2C5*RC1+R3C5+R4C5*RC2+R5C5) -> 69 | F51: =INT(R2C6*RC1+R3C6+R4C6*RC2+R5C6) -> 27 | G51: =INT(R2C7*RC1+R3C7+R4C7*RC2+R5C7) -> 10 | H51: =INT(R2C8*RC1+R3C8+R4C8*RC2+R5C8) -> 108
A52: 45 | B52: 4 | C52: =INT(R2C3*RC1+R3C3+R4C3*RC2+R5C3) -> 92 | D52: =INT(R2C4*RC1+R3C4+R4C4*RC2+R5C4) -> 77 | E52: =INT(R2C5*RC1+R3C5+R4C5*RC2+R5C5) -> 71 | F52: =INT(R2C6*RC1+R3C6+R4C6*RC2+R5C6) -> 27 | G52: =INT(R2C7*RC1+R3C7+R4C7*RC2+R5C7) -> 10 | H52: =INT(R2C8*RC1+R3C8+R4C8*RC2+R5C8) -> 110
A53: 46 | B53: 4 | C53: =INT(R2C3*RC1+R3C3+R4C3*RC2+R5C3) -> 93 | D53: =INT(R2C4*RC1+R3C4+R4C4*RC2+R5C4) -> 78 | E53: =INT(R2C5*RC1+R3C5+R4C5*RC2+R5C5) -> 72 | F53: =INT(R2C6*RC1+R3C6+R4C6*RC2+R5C6) -> 28 | G53: =INT(R2C7*RC1+R3C7+R4C7*RC2+R5C7) -> 10 | H53: =INT(R2C8*RC1+R3C8+R4C8*RC2+R5C8) -> 112
A54: 47 | B54: 4 | C54: =INT(R2C3*RC1+R3C3+R4C3*RC2+R5C3) -> 95 | D54: =INT(R2C4*RC1+R3C4+R4C4*RC2+R5C4) -> 79 | E54: =INT(R2C5*RC1+R3C5+R4C5*RC2+R5C5) -> 73 | F54: =INT(R2C6*RC1+R3C6+R4C6*RC2+R5C6) -> 28 | G54: =INT(R2C7*RC1+R3C7+R4C7*RC2+R5C7) -> 11 | H54: =INT(R2C8*RC1+R3C8+R4C8*RC2+R5C8) -> 114
A55: 48 | B55: 4 | C55: =INT(R2C3*RC1+R3C3+R4C3*RC2+R5C3) -> 97 | D55: =INT(R2C4*RC1+R3C4+R4C4*RC2+R5C4) -> 80 | E55: =INT(R2C5*RC1+R3C5+R4C5*RC2+R5C5) -> 74 | F55: =INT(R2C6*RC1+R3C6+R4C6*RC2+R5C6) -> 29 | G55: =INT(R2C7*RC1+R3C7+R4C7*RC2+R5C7) -> 11 | H55: =INT(R2C8*RC1+R3C8+R4C8*RC2+R5C8) -> 116
A56: 49 | B56: 4 | C56: =INT(R2C3*RC1+R3C3+R4C3*RC2+R5C3) -> 99 | D56: =INT(R2C4*RC1+R3C4+R4C4*RC2+R5C4) -> 81 | E56: =INT(R2C5*RC1+R3C5+R4C5*RC2+R5C5) -> 75 | F56: =INT(R2C6*RC1+R3C6+R4C6*RC2+R5C6) -> 29 | G56: =INT(R2C7*RC1+R3C7+R4C7*RC2+R5C7) -> 11 | H56: =INT(R2C8*RC1+R3C8+R4C8*RC2+R5C8) -> 118
A57: 50 | B57: 5 | C57: =INT(R2C3*RC1+R3C3+R4C3*RC2+R5C3) -> 102 | D57: =INT(R2C4*RC1+R3C4+R4C4*RC2+R5C4) -> 87 | E57: =INT(R2C5*RC1+R3C5+R4C5*RC2+R5C5) -> 80 | F57: =INT(R2C6*RC1+R3C6+R4C6*RC2+R5C6) -> 30 | G57: =INT(R2C7*RC1+R3C7+R4C7*RC2+R5C7) -> 12 | H57: =INT(R2C8*RC1+R3C8+R4C8*RC2+R5C8) -> 125
A58: 51 | B58: 5 | C58: =INT(R2C3*RC1+R3C3+R4C3*RC2+R5C3) -> 103 | D58: =INT(R2C4*RC1+R3C4+R4C4*RC2+R5C4) -> 88 | E58: =INT(R2C5*RC1+R3C5+R4C5*RC2+R5C5) -> 81 | F58: =INT(R2C6*RC1+R3C6+R4C6*RC2+R5C6) -> 31 | G58: =INT(R2C7*RC1+R3C7+R4C7*RC2+R5C7) -> 12 | H58: =INT(R2C8*RC1+R3C8+R4C8*RC2+R5C8) -> 127
A59: 52 | B59: 5 | C59: =INT(R2C3*RC1+R3C3+R4C3*RC2+R5C3) -> 105 | D59: =INT(R2C4*RC1+R3C4+R4C4*RC2+R5C4) -> 89 | E59: =INT(R2C5*RC1+R3C5+R4C5*RC2+R5C5) -> 82 | F59: =INT(R2C6*RC1+R3C6+R4C6*RC2+R5C6) -> 31 | G59: =INT(R2C7*RC1+R3C7+R4C7*RC2+R5C7) -> 12 | H59: =INT(R2C8*RC1+R3C8+R4C8*RC2+R5C8) -> 129
A60: 53 | B60: 5 | C60: =INT(R2C3*RC1+R3C3+R4C3*RC2+R5C3) -> 107 | D60: =INT(R2C4*RC1+R3C4+R4C4*RC2+R5C4) -> 90 | E60: =INT(R2C5*RC1+R3C5+R4C5*RC2+R5C5) -> 83 | F60: =INT(R2C6*RC1+R3C6+R4C6*RC2+R5C6) -> 32 | G60: =INT(R2C7*RC1+R3C7+R4C7*RC2+R5C7) -> 12 | H60: =INT(R2C8*RC1+R3C8+R4C8*RC2+R5C8) -> 131
A61: 54 | B61: 5 | C61: =INT(R2C3*RC1+R3C3+R4C3*RC2+R5C3) -> 109 | D61: =INT(R2C4*RC1+R3C4+R4C4*RC2+R5C4) -> 91 | E61: =INT(R2C5*RC1+R3C5+R4C5*RC2+R5C5) -> 84 | F61: =INT(R2C6*RC1+R3C6+R4C6*RC2+R5C6) -> 32 | G61: =INT(R2C7*RC1+R3C7+R4C7*RC2+R5C7) -> 12 | H61: =INT(R2C8*RC1+R3C8+R4C8*RC2+R5C8) -> 133
A62: 55 | B62: 5 | C62: =INT(R2C3*RC1+R3C3+R4C3*RC2+R5C3) -> 111 | D62: =INT(R2C4*RC1+R3C4+R4C4*RC2+R5C4) -> 92 | E62: =INT(R2C5*RC1+R3C5+R4C5*RC2+R5C5) -> 86 | F62: =INT(R2C6*RC1+R3C6+R4C6*RC2+R5C6) -> 33 | G62: =INT(R2C7*RC1+R3C7+R4C7*RC2+R5C7) -> 12 | H62: =INT(R2C8*RC1+R3C8+R4C8*RC2+R5C8) -> 135
A63: 56 | B63: 5 | C63: =INT(R2C3*RC1+R3C3+R4C3*RC2+R5C3) -> 112 | D63: =INT(R2C4*RC1+R3C4+R4C4*RC2+R5C4) -> 93 | E63: =INT(R2C5*RC1+R3C5+R4C5*RC2+R5C5) -> 87 | F63: =INT(R2C6*RC1+R3C6+R4C6*RC2+R5C6) -> 33 | G63: =INT(R2C7*RC1+R3C7+R4C7*RC2+R5C7) -> 12 | H63: =INT(R2C8*RC1+R3C8+R4C8*RC2+R5C8) -> 137
A64: 57 | B64: 5 | C64: =INT(R2C3*RC1+R3C3+R4C3*RC2+R5C3) -> 114 | D64: =INT(R2C4*RC1+R3C4+R4C4*RC2+R5C4) -> 94 | E64: =INT(R2C5*RC1+R3C5+R4C5*RC2+R5C5) -> 88 | F64: =INT(R2C6*RC1+R3C6+R4C6*RC2+R5C6) -> 34 | G64: =INT(R2C7*RC1+R3C7+R4C7*RC2+R5C7) -> 13 | H64: =INT(R2C8*RC1+R3C8+R4C8*RC2+R5C8) -> 139
A65: 58 | B65: 5 | C65: =INT(R2C3*RC1+R3C3+R4C3*RC2+R5C3) -> 116 | D65: =INT(R2C4*RC1+R3C4+R4C4*RC2+R5C4) -> 95 | E65: =INT(R2C5*RC1+R3C5+R4C5*RC2+R5C5) -> 89 | F65: =INT(R2C6*RC1+R3C6+R4C6*RC2+R5C6) -> 34 | G65: =INT(R2C7*RC1+R3C7+R4C7*RC2+R5C7) -> 13 | H65: =INT(R2C8*RC1+R3C8+R4C8*RC2+R5C8) -> 141
A66: 59 | B66: 5 | C66: =INT(R2C3*RC1+R3C3+R4C3*RC2+R5C3) -> 118 | D66: =INT(R2C4*RC1+R3C4+R4C4*RC2+R5C4) -> 96 | E66: =INT(R2C5*RC1+R3C5+R4C5*RC2+R5C5) -> 90 | F66: =INT(R2C6*RC1+R3C6+R4C6*RC2+R5C6) -> 35 | G66: =INT(R2C7*RC1+R3C7+R4C7*RC2+R5C7) -> 13 | H66: =INT(R2C8*RC1+R3C8+R4C8*RC2+R5C8) -> 143
A67: 60 | B67: 6 | C67: =INT(R2C3*RC1+R3C3+R4C3*RC2+R5C3) -> 121 | D67: =INT(R2C4*RC1+R3C4+R4C4*RC2+R5C4) -> 102 | E67: =INT(R2C5*RC1+R3C5+R4C5*RC2+R5C5) -> 95 | F67: =INT(R2C6*RC1+R3C6+R4C6*RC2+R5C6) -> 36 | G67: =INT(R2C7*RC1+R3C7+R4C7*RC2+R5C7) -> 14 | H67: =INT(R2C8*RC1+R3C8+R4C8*RC2+R5C8) -> 150
A68: 61 | B68: 6 | C68: =INT(R2C3*RC1+R3C3+R4C3*RC2+R5C3) -> 122 | D68: =INT(R2C4*RC1+R3C4+R4C4*RC2+R5C4) -> 103 | E68: =INT(R2C5*RC1+R3C5+R4C5*RC2+R5C5) -> 96 | F68: =INT(R2C6*RC1+R3C6+R4C6*RC2+R5C6) -> 36 | G68: =INT(R2C7*RC1+R3C7+R4C7*RC2+R5C7) -> 14 | H68: =INT(R2C8*RC1+R3C8+R4C8*RC2+R5C8) -> 152
A69: 62 | B69: 6 | C69: =INT(R2C3*RC1+R3C3+R4C3*RC2+R5C3) -> 124 | D69: =INT(R2C4*RC1+R3C4+R4C4*RC2+R5C4) -> 104 | E69: =INT(R2C5*RC1+R3C5+R4C5*RC2+R5C5) -> 97 | F69: =INT(R2C6*RC1+R3C6+R4C6*RC2+R5C6) -> 37 | G69: =INT(R2C7*RC1+R3C7+R4C7*RC2+R5C7) -> 14 | H69: =INT(R2C8*RC1+R3C8+R4C8*RC2+R5C8) -> 154
A70: 63 | B70: 6 | C70: =INT(R2C3*RC1+R3C3+R4C3*RC2+R5C3) -> 126 | D70: =INT(R2C4*RC1+R3C4+R4C4*RC2+R5C4) -> 105 | E70: =INT(R2C5*RC1+R3C5+R4C5*RC2+R5C5) -> 98 | F70: =INT(R2C6*RC1+R3C6+R4C6*RC2+R5C6) -> 37 | G70: =INT(R2C7*RC1+R3C7+R4C7*RC2+R5C7) -> 14 | H70: =INT(R2C8*RC1+R3C8+R4C8*RC2+R5C8) -> 156
A71: 64 | B71: 6 | C71: =INT(R2C3*RC1+R3C3+R4C3*RC2+R5C3) -> 128 | D71: =INT(R2C4*RC1+R3C4+R4C4*RC2+R5C4) -> 106 | E71: =INT(R2C5*RC1+R3C5+R4C5*RC2+R5C5) -> 99 | F71: =INT(R2C6*RC1+R3C6+R4C6*RC2+R5C6) -> 38 | G71: =INT(R2C7*RC1+R3C7+R4C7*RC2+R5C7) -> 14 | H71: =INT(R2C8*RC1+R3C8+R4C8*RC2+R5C8) -> 158
A72: 65 | B72: 6 | C72: =INT(R2C3*RC1+R3C3+R4C3*RC2+R5C3) -> 130 | D72: =INT(R2C4*RC1+R3C4+R4C4*RC2+R5C4) -> 107 | E72: =INT(R2C5*RC1+R3C5+R4C5*RC2+R5C5) -> 101 | F72: =INT(R2C6*RC1+R3C6+R4C6*RC2+R5C6) -> 38 | G72: =INT(R2C7*RC1+R3C7+R4C7*RC2+R5C7) -> 14 | H72: =INT(R2C8*RC1+R3C8+R4C8*RC2+R5C8) -> 160
A73: 66 | B73: 6 | C73: =INT(R2C3*RC1+R3C3+R4C3*RC2+R5C3) -> 131 | D73: =INT(R2C4*RC1+R3C4+R4C4*RC2+R5C4) -> 108 | E73: =INT(R2C5*RC1+R3C5+R4C5*RC2+R5C5) -> 102 | F73: =INT(R2C6*RC1+R3C6+R4C6*RC2+R5C6) -> 39 | G73: =INT(R2C7*RC1+R3C7+R4C7*RC2+R5C7) -> 14 | H73: =INT(R2C8*RC1+R3C8+R4C8*RC2+R5C8) -> 162
A74: 67 | B74: 6 | C74: =INT(R2C3*RC1+R3C3+R4C3*RC2+R5C3) -> 133 | D74: =INT(R2C4*RC1+R3C4+R4C4*RC2+R5C4) -> 109 | E74: =INT(R2C5*RC1+R3C5+R4C5*RC2+R5C5) -> 103 | F74: =INT(R2C6*RC1+R3C6+R4C6*RC2+R5C6) -> 39 | G74: =INT(R2C7*RC1+R3C7+R4C7*RC2+R5C7) -> 15 | H74: =INT(R2C8*RC1+R3C8+R4C8*RC2+R5C8) -> 164
A75: 68 | B75: 6 | C75: =INT(R2C3*RC1+R3C3+R4C3*RC2+R5C3) -> 135 | D75: =INT(R2C4*RC1+R3C4+R4C4*RC2+R5C4) -> 110 | E75: =INT(R2C5*RC1+R3C5+R4C5*RC2+R5C5) -> 104 | F75: =INT(R2C6*RC1+R3C6+R4C6*RC2+R5C6) -> 40 | G75: =INT(R2C7*RC1+R3C7+R4C7*RC2+R5C7) -> 15 | H75: =INT(R2C8*RC1+R3C8+R4C8*RC2+R5C8) -> 166
A76: 69 | B76: 6 | C76: =INT(R2C3*RC1+R3C3+R4C3*RC2+R5C3) -> 137 | D76: =INT(R2C4*RC1+R3C4+R4C4*RC2+R5C4) -> 111 | E76: =INT(R2C5*RC1+R3C5+R4C5*RC2+R5C5) -> 105 | F76: =INT(R2C6*RC1+R3C6+R4C6*RC2+R5C6) -> 40 | G76: =INT(R2C7*RC1+R3C7+R4C7*RC2+R5C7) -> 15 | H76: =INT(R2C8*RC1+R3C8+R4C8*RC2+R5C8) -> 168
A77: 70 | B77: 7 | C77: =INT(R2C3*RC1+R3C3+R4C3*RC2+R5C3) -> 140 | D77: =INT(R2C4*RC1+R3C4+R4C4*RC2+R5C4) -> 117 | E77: =INT(R2C5*RC1+R3C5+R4C5*RC2+R5C5) -> 110 | F77: =INT(R2C6*RC1+R3C6+R4C6*RC2+R5C6) -> 41 | G77: =INT(R2C7*RC1+R3C7+R4C7*RC2+R5C7) -> 16 | H77: =INT(R2C8*RC1+R3C8+R4C8*RC2+R5C8) -> 175
A78: 71 | B78: 7 | C78: =INT(R2C3*RC1+R3C3+R4C3*RC2+R5C3) -> 141 | D78: =INT(R2C4*RC1+R3C4+R4C4*RC2+R5C4) -> 118 | E78: =INT(R2C5*RC1+R3C5+R4C5*RC2+R5C5) -> 111 | F78: =INT(R2C6*RC1+R3C6+R4C6*RC2+R5C6) -> 42 | G78: =INT(R2C7*RC1+R3C7+R4C7*RC2+R5C7) -> 16 | H78: =INT(R2C8*RC1+R3C8+R4C8*RC2+R5C8) -> 177
A79: 72 | B79: 7 | C79: =INT(R2C3*RC1+R3C3+R4C3*RC2+R5C3) -> 143 | D79: =INT(R2C4*RC1+R3C4+R4C4*RC2+R5C4) -> 119 | E79: =INT(R2C5*RC1+R3C5+R4C5*RC2+R5C5) -> 112 | F79: =INT(R2C6*RC1+R3C6+R4C6*RC2+R5C6) -> 42 | G79: =INT(R2C7*RC1+R3C7+R4C7*RC2+R5C7) -> 16 | H79: =INT(R2C8*RC1+R3C8+R4C8*RC2+R5C8) -> 179
A80: 73 | B80: 7 | C80: =INT(R2C3*RC1+R3C3+R4C3*RC2+R5C3) -> 145 | D80: =INT(R2C4*RC1+R3C4+R4C4*RC2+R5C4) -> 120 | E80: =INT(R2C5*RC1+R3C5+R4C5*RC2+R5C5) -> 113 | F80: =INT(R2C6*RC1+R3C6+R4C6*RC2+R5C6) -> 43 | G80: =INT(R2C7*RC1+R3C7+R4C7*RC2+R5C7) -> 16 | H80: =INT(R2C8*RC1+R3C8+R4C8*RC2+R5C8) -> 181
A81: 74 | B81: 7 | C81: =INT(R2C3*RC1+R3C3+R4C3*RC2+R5C3) -> 147 | D81: =INT(R2C4*RC1+R3C4+R4C4*RC2+R5C4) -> 121 | E81: =INT(R2C5*RC1+R3C5+R4C5*RC2+R5C5) -> 114 | F81: =INT(R2C6*RC1+R3C6+R4C6*RC2+R5C6) -> 43 | G81: =INT(R2C7*RC1+R3C7+R4C7*RC2+R5C7) -> 16 | H81: =INT(R2C8*RC1+R3C8+R4C8*RC2+R5C8) -> 183
A82: 75 | B82: 7 | C82: =INT(R2C3*RC1+R3C3+R4C3*RC2+R5C3) -> 149 | D82: =INT(R2C4*RC1+R3C4+R4C4*RC2+R5C4) -> 122 | E82: =INT(R2C5*RC1+R3C5+R4C5*RC2+R5C5) -> 116 | F82: =INT(R2C6*RC1+R3C6+R4C6*RC2+R5C6) -> 44 | G82: =INT(R2C7*RC1+R3C7+R4C7*RC2+R5C7) -> 16 | H82: =INT(R2C8*RC1+R3C8+R4C8*RC2+R5C8) -> 185
A83: 76 | B83: 7 | C83: =INT(R2C3*RC1+R3C3+R4C3*RC2+R5C3) -> 150 | D83: =INT(R2C4*RC1+R3C4+R4C4*RC2+R5C4) -> 123 | E83: =INT(R2C5*RC1+R3C5+R4C5*RC2+R5C5) -> 117 | F83: =INT(R2C6*RC1+R3C6+R4C6*RC2+R5C6) -> 44 | G83: =INT(R2C7*RC1+R3C7+R4C7*RC2+R5C7) -> 16 | H83: =INT(R2C8*RC1+R3C8+R4C8*RC2+R5C8) -> 187
A84: 77 | B84: 7 | C84: =INT(R2C3*RC1+R3C3+R4C3*RC2+R5C3) -> 152 | D84: =INT(R2C4*RC1+R3C4+R4C4*RC2+R5C4) -> 124 | E84: =INT(R2C5*RC1+R3C5+R4C5*RC2+R5C5) -> 118 | F84: =INT(R2C6*RC1+R3C6+R4C6*RC2+R5C6) -> 45 | G84: =INT(R2C7*RC1+R3C7+R4C7*RC2+R5C7) -> 17 | H84: =INT(R2C8*RC1+R3C8+R4C8*RC2+R5C8) -> 189
A85: 78 | B85: 7 | C85: =INT(R2C3*RC1+R3C3+R4C3*RC2+R5C3) -> 154 | D85: =INT(R2C4*RC1+R3C4+R4C4*RC2+R5C4) -> 125 | E85: =INT(R2C5*RC1+R3C5+R4C5*RC2+R5C5) -> 119 | F85: =INT(R2C6*RC1+R3C6+R4C6*RC2+R5C6) -> 45 | G85: =INT(R2C7*RC1+R3C7+R4C7*RC2+R5C7) -> 17 | H85: =INT(R2C8*RC1+R3C8+R4C8*RC2+R5C8) -> 191
A86: 79 | B86: 7 | C86: =INT(R2C3*RC1+R3C3+R4C3*RC2+R5C3) -> 156 | D86: =INT(R2C4*RC1+R3C4+R4C4*RC2+R5C4) -> 126 | E86: =INT(R2C5*RC1+R3C5+R4C5*RC2+R5C5) -> 120 | F86: =INT(R2C6*RC1+R3C6+R4C6*RC2+R5C6) -> 46 | G86: =INT(R2C7*RC1+R3C7+R4C7*RC2+R5C7) -> 17 | H86: =INT(R2C8*RC1+R3C8+R4C8*RC2+R5C8) -> 193
A87: 80 | B87: 8 | C87: =INT(R2C3*RC1+R3C3+R4C3*RC2+R5C3) -> 159 | D87: =INT(R2C4*RC1+R3C4+R4C4*RC2+R5C4) -> 132 | E87: =INT(R2C5*RC1+R3C5+R4C5*RC2+R5C5) -> 125 | F87: =INT(R2C6*RC1+R3C6+R4C6*RC2+R5C6) -> 47 | G87: =INT(R2C7*RC1+R3C7+R4C7*RC2+R5C7) -> 18 | H87: =INT(R2C8*RC1+R3C8+R4C8*RC2+R5C8) -> 200
A88: 81 | B88: 8 | C88: =INT(R2C3*RC1+R3C3+R4C3*RC2+R5C3) -> 160 | D88: =INT(R2C4*RC1+R3C4+R4C4*RC2+R5C4) -> 133 | E88: =INT(R2C5*RC1+R3C5+R4C5*RC2+R5C5) -> 126 | F88: =INT(R2C6*RC1+R3C6+R4C6*RC2+R5C6) -> 47 | G88: =INT(R2C7*RC1+R3C7+R4C7*RC2+R5C7) -> 18 | H88: =INT(R2C8*RC1+R3C8+R4C8*RC2+R5C8) -> 202
A89: 82 | B89: 8 | C89: =INT(R2C3*RC1+R3C3+R4C3*RC2+R5C3) -> 162 | D89: =INT(R2C4*RC1+R3C4+R4C4*RC2+R5C4) -> 134 | E89: =INT(R2C5*RC1+R3C5+R4C5*RC2+R5C5) -> 127 | F89: =INT(R2C6*RC1+R3C6+R4C6*RC2+R5C6) -> 48 | G89: =INT(R2C7*RC1+R3C7+R4C7*RC2+R5C7) -> 18 | H89: =INT(R2C8*RC1+R3C8+R4C8*RC2+R5C8) -> 204
A90: 83 | B90: 8 | C90: =INT(R2C3*RC1+R3C3+R4C3*RC2+R5C3) -> 164 | D90: =INT(R2C4*RC1+R3C4+R4C4*RC2+R5C4) -> 135 | E90: =INT(R2C5*RC1+R3C5+R4C5*RC2+R5C5) -> 128 | F90: =INT(R2C6*RC1+R3C6+R4C6*RC2+R5C6) -> 48 | G90: =INT(R2C7*RC1+R3C7+R4C7*RC2+R5C7) -> 18 | H90: =INT(R2C8*RC1+R3C8+R4C8*RC2+R5C8) -> 206
A91: 84 | B91: 8 | C91: =INT(R2C3*RC1+R3C3+R4C3*RC2+R5C3) -> 166 | D91: =INT(R2C4*RC1+R3C4+R4C4*RC2+R5C4) -> 136 | E91: =INT(R2C5*RC1+R3C5+R4C5*RC2+R5C5) -> 129 | F91: =INT(R2C6*RC1+R3C6+R4C6*RC2+R5C6) -> 49 | G91: =INT(R2C7*RC1+R3C7+R4C7*RC2+R5C7) -> 18 | H91: =INT(R2C8*RC1+R3C8+R4C8*RC2+R5C8) -> 208
A92: 85 | B92: 8 | C92: =INT(R2C3*RC1+R3C3+R4C3*RC2+R5C3) -> 168 | D92: =INT(R2C4*RC1+R3C4+R4C4*RC2+R5C4) -> 137 | E92: =INT(R2C5*RC1+R3C5+R4C5*RC2+R5C5) -> 131 | F92: =INT(R2C6*RC1+R3C6+R4C6*RC2+R5C6) -> 49 | G92: =INT(R2C7*RC1+R3C7+R4C7*RC2+R5C7) -> 18 | H92: =INT(R2C8*RC1+R3C8+R4C8*RC2+R5C8) -> 210
A93: 86 | B93: 8 | C93: =INT(R2C3*RC1+R3C3+R4C3*RC2+R5C3) -> 169 | D93: =INT(R2C4*RC1+R3C4+R4C4*RC2+R5C4) -> 138 | E93: =INT(R2C5*RC1+R3C5+R4C5*RC2+R5C5) -> 132 | F93: =INT(R2C6*RC1+R3C6+R4C6*RC2+R5C6) -> 50 | G93: =INT(R2C7*RC1+R3C7+R4C7*RC2+R5C7) -> 18 | H93: =INT(R2C8*RC1+R3C8+R4C8*RC2+R5C8) -> 212
A94: 87 | B94: 8 | C94: =INT(R2C3*RC1+R3C3+R4C3*RC2+R5C3) -> 171 | D94: =INT(R2C4*RC1+R3C4+R4C4*RC2+R5C4) -> 139 | E94: =INT(R2C5*RC1+R3C5+R4C5*RC2+R5C5) -> 133 | F94: =INT(R2C6*RC1+R3C6+R4C6*RC2+R5C6) -> 50 | G94: =INT(R2C7*RC1+R3C7+R4C7*RC2+R5C7) -> 19 | H94: =INT(R2C8*RC1+R3C8+R4C8*RC2+R5C8) -> 214
A95: 88 | B95: 8 | C95: =INT(R2C3*RC1+R3C3+R4C3*RC2+R5C3) -> 173 | D95: =INT(R2C4*RC1+R3C4+R4C4*RC2+R5C4) -> 140 | E95: =INT(R2C5*RC1+R3C5+R4C5*RC2+R5C5) -> 134 | F95: =INT(R2C6*RC1+R3C6+R4C6*RC2+R5C6) -> 51 | G95: =INT(R2C7*RC1+R3C7+R4C7*RC2+R5C7) -> 19 | H95: =INT(R2C8*RC1+R3C8+R4C8*RC2+R5C8) -> 216
A96: 89 | B96: 8 | C96: =INT(R2C3*RC1+R3C3+R4C3*RC2+R5C3) -> 175 | D96: =INT(R2C4*RC1+R3C4+R4C4*RC2+R5C4) -> 141 | E96: =INT(R2C5*RC1+R3C5+R4C5*RC2+R5C5) -> 135 | F96: =INT(R2C6*RC1+R3C6+R4C6*RC2+R5C6) -> 51 | G96: =INT(R2C7*RC1+R3C7+R4C7*RC2+R5C7) -> 19 | H96: =INT(R2C8*RC1+R3C8+R4C8*RC2+R5C8) -> 218
A97: 90 | B97: 9 | C97: =INT(R2C3*RC1+R3C3+R4C3*RC2+R5C3) -> 178 | D97: =INT(R2C4*RC1+R3C4+R4C4*RC2+R5C4) -> 147 | E97: =INT(R2C5*RC1+R3C5+R4C5*RC2+R5C5) -> 140 | F97: =INT(R2C6*RC1+R3C6+R4C6*RC2+R5C6) -> 52 | G97: =INT(R2C7*RC1+R3C7+R4C7*RC2+R5C7) -> 20 | H97: =INT(R2C8*RC1+R3C8+R4C8*RC2+R5C8) -> 225
A98: 91 | B98: 9 | C98: =INT(R2C3*RC1+R3C3+R4C3*RC2+R5C3) -> 179 | D98: =INT(R2C4*RC1+R3C4+R4C4*RC2+R5C4) -> 148 | E98: =INT(R2C5*RC1+R3C5+R4C5*RC2+R5C5) -> 141 | F98: =INT(R2C6*RC1+R3C6+R4C6*RC2+R5C6) -> 53 | G98: =INT(R2C7*RC1+R3C7+R4C7*RC2+R5C7) -> 20 | H98: =INT(R2C8*RC1+R3C8+R4C8*RC2+R5C8) -> 227
A99: 92 | B99: 9 | C99: =INT(R2C3*RC1+R3C3+R4C3*RC2+R5C3) -> 181 | D99: =INT(R2C4*RC1+R3C4+R4C4*RC2+R5C4) -> 149 | E99: =INT(R2C5*RC1+R3C5+R4C5*RC2+R5C5) -> 142 | F99: =INT(R2C6*RC1+R3C6+R4C6*RC2+R5C6) -> 53 | G99: =INT(R2C7*RC1+R3C7+R4C7*RC2+R5C7) -> 20 | H99: =INT(R2C8*RC1+R3C8+R4C8*RC2+R5C8) -> 229
A100: 93 | B100: 9 | C100: =INT(R2C3*RC1+R3C3+R4C3*RC2+R5C3) -> 183 | D100: =INT(R2C4*RC1+R3C4+R4C4*RC2+R5C4) -> 150 | E100: =INT(R2C5*RC1+R3C5+R4C5*RC2+R5C5) -> 143 | F100: =INT(R2C6*RC1+R3C6+R4C6*RC2+R5C6) -> 54 | G100: =INT(R2C7*RC1+R3C7+R4C7*RC2+R5C7) -> 20 | H100: =INT(R2C8*RC1+R3C8+R4C8*RC2+R5C8) -> 231
A101: 94 | B101: 9 | C101: =INT(R2C3*RC1+R3C3+R4C3*RC2+R5C3) -> 185 | D101: =INT(R2C4*RC1+R3C4+R4C4*RC2+R5C4) -> 151 | E101: =INT(R2C5*RC1+R3C5+R4C5*RC2+R5C5) -> 144 | F101: =INT(R2C6*RC1+R3C6+R4C6*RC2+R5C6) -> 54 | G101: =INT(R2C7*RC1+R3C7+R4C7*RC2+R5C7) -> 20 | H101: =INT(R2C8*RC1+R3C8+R4C8*RC2+R5C8) -> 233
A102: 95 | B102: 9 | C102: =INT(R2C3*RC1+R3C3+R4C3*RC2+R5C3) -> 187 | D102: =INT(R2C4*RC1+R3C4+R4C4*RC2+R5C4) -> 152 | E102: =INT(R2C5*RC1+R3C5+R4C5*RC2+R5C5) -> 146 | F102: =INT(R2C6*RC1+R3C6+R4C6*RC2+R5C6) -> 55 | G102: =INT(R2C7*RC1+R3C7+R4C7*RC2+R5C7) -> 20 | H102: =INT(R2C8*RC1+R3C8+R4C8*RC2+R5C8) -> 235
A103: 96 | B103: 9 | C103: =INT(R2C3*RC1+R3C3+R4C3*RC2+R5C3) -> 188 | D103: =INT(R2C4*RC1+R3C4+R4C4*RC2+R5C4) -> 153 | E103: =INT(R2C5*RC1+R3C5+R4C5*RC2+R5C5) -> 147 | F103: =INT(R2C6*RC1+R3C6+R4C6*RC2+R5C6) -> 55 | G103: =INT(R2C7*RC1+R3C7+R4C7*RC2+R5C7) -> 20 | H103: =INT(R2C8*RC1+R3C8+R4C8*RC2+R5C8) -> 237
A104: 97 | B104: 9 | C104: =INT(R2C3*RC1+R3C3+R4C3*RC2+R5C3) -> 190 | D104: =INT(R2C4*RC1+R3C4+R4C4*RC2+R5C4) -> 154 | E104: =INT(R2C5*RC1+R3C5+R4C5*RC2+R5C5) -> 148 | F104: =INT(R2C6*RC1+R3C6+R4C6*RC2+R5C6) -> 56 | G104: =INT(R2C7*RC1+R3C7+R4C7*RC2+R5C7) -> 21 | H104: =INT(R2C8*RC1+R3C8+R4C8*RC2+R5C8) -> 239
A105: 98 | B105: 9 | C105: =INT(R2C3*RC1+R3C3+R4C3*RC2+R5C3) -> 192 | D105: =INT(R2C4*RC1+R3C4+R4C4*RC2+R5C4) -> 155 | E105: =INT(R2C5*RC1+R3C5+R4C5*RC2+R5C5) -> 149 | F105: =INT(R2C6*RC1+R3C6+R4C6*RC2+R5C6) -> 56 | G105: =INT(R2C7*RC1+R3C7+R4C7*RC2+R5C7) -> 21 | H105: =INT(R2C8*RC1+R3C8+R4C8*RC2+R5C8) -> 241
A106: 99 | B106: 9 | C106: =INT(R2C3*RC1+R3C3+R4C3*RC2+R5C3) -> 194 | D106: =INT(R2C4*RC1+R3C4+R4C4*RC2+R5C4) -> 156 | E106: =INT(R2C5*RC1+R3C5+R4C5*RC2+R5C5) -> 150 | F106: =INT(R2C6*RC1+R3C6+R4C6*RC2+R5C6) -> 57 | G106: =INT(R2C7*RC1+R3C7+R4C7*RC2+R5C7) -> 21 | H106: =INT(R2C8*RC1+R3C8+R4C8*RC2+R5C8) -> 243
A107: 100 | B107: 10 | C107: =INT(R2C3*RC1+R3C3+R4C3*RC2+R5C3) -> 197 | D107: =INT(R2C4*RC1+R3C4+R4C4*RC2+R5C4) -> 162 | E107: =INT(R2C5*RC1+R3C5+R4C5*RC2+R5C5) -> 155 | F107: =INT(R2C6*RC1+R3C6+R4C6*RC2+R5C6) -> 58 | G107: =INT(R2C7*RC1+R3C7+R4C7*RC2+R5C7) -> 22 | H107: =INT(R2C8*RC1+R3C8+R4C8*RC2+R5C8) -> 250
A108: 101 | B108: 10 | C108: =INT(R2C3*RC1+R3C3+R4C3*RC2+R5C3) -> 198 | D108: =INT(R2C4*RC1+R3C4+R4C4*RC2+R5C4) -> 163 | E108: =INT(R2C5*RC1+R3C5+R4C5*RC2+R5C5) -> 156 | F108: =INT(R2C6*RC1+R3C6+R4C6*RC2+R5C6) -> 58 | G108: =INT(R2C7*RC1+R3C7+R4C7*RC2+R5C7) -> 22 | H108: =INT(R2C8*RC1+R3C8+R4C8*RC2+R5C8) -> 252
A109: 102 | B109: 10 | C109: =INT(R2C3*RC1+R3C3+R4C3*RC2+R5C3) -> 200 | D109: =INT(R2C4*RC1+R3C4+R4C4*RC2+R5C4) -> 164 | E109: =INT(R2C5*RC1+R3C5+R4C5*RC2+R5C5) -> 157 | F109: =INT(R2C6*RC1+R3C6+R4C6*RC2+R5C6) -> 59 | G109: =INT(R2C7*RC1+R3C7+R4C7*RC2+R5C7) -> 22 | H109: =INT(R2C8*RC1+R3C8+R4C8*RC2+R5C8) -> 254
A110: 103 | B110: 10 | C110: =INT(R2C3*RC1+R3C3+R4C3*RC2+R5C3) -> 202 | D110: =INT(R2C4*RC1+R3C4+R4C4*RC2+R5C4) -> 165 | E110: =INT(R2C5*RC1+R3C5+R4C5*RC2+R5C5) -> 158 | F110: =INT(R2C6*RC1+R3C6+R4C6*RC2+R5C6) -> 59 | G110: =INT(R2C7*RC1+R3C7+R4C7*RC2+R5C7) -> 22 | H110: =INT(R2C8*RC1+R3C8+R4C8*RC2+R5C8) -> 256
A111: 104 | B111: 10 | C111: =INT(R2C3*RC1+R3C3+R4C3*RC2+R5C3) -> 204 | D111: =INT(R2C4*RC1+R3C4+R4C4*RC2+R5C4) -> 166 | E111: =INT(R2C5*RC1+R3C5+R4C5*RC2+R5C5) -> 159 | F111: =INT(R2C6*RC1+R3C6+R4C6*RC2+R5C6) -> 60 | G111: =INT(R2C7*RC1+R3C7+R4C7*RC2+R5C7) -> 22 | H111: =INT(R2C8*RC1+R3C8+R4C8*RC2+R5C8) -> 258
A112: 105 | B112: 10 | C112: =INT(R2C3*RC1+R3C3+R4C3*RC2+R5C3) -> 206 | D112: =INT(R2C4*RC1+R3C4+R4C4*RC2+R5C4) -> 167 | E112: =INT(R2C5*RC1+R3C5+R4C5*RC2+R5C5) -> 161 | F112: =INT(R2C6*RC1+R3C6+R4C6*RC2+R5C6) -> 60 | G112: =INT(R2C7*RC1+R3C7+R4C7*RC2+R5C7) -> 22 | H112: =INT(R2C8*RC1+R3C8+R4C8*RC2+R5C8) -> 260
A113: 106 | B113: 10 | C113: =INT(R2C3*RC1+R3C3+R4C3*RC2+R5C3) -> 207 | D113: =INT(R2C4*RC1+R3C4+R4C4*RC2+R5C4) -> 168 | E113: =INT(R2C5*RC1+R3C5+R4C5*RC2+R5C5) -> 162 | F113: =INT(R2C6*RC1+R3C6+R4C6*RC2+R5C6) -> 61 | G113: =INT(R2C7*RC1+R3C7+R4C7*RC2+R5C7) -> 22 | H113: =INT(R2C8*RC1+R3C8+R4C8*RC2+R5C8) -> 262
A114: 107 | B114: 10 | C114: =INT(R2C3*RC1+R3C3+R4C3*RC2+R5C3) -> 209 | D114: =INT(R2C4*RC1+R3C4+R4C4*RC2+R5C4) -> 169 | E114: =INT(R2C5*RC1+R3C5+R4C5*RC2+R5C5) -> 163 | F114: =INT(R2C6*RC1+R3C6+R4C6*RC2+R5C6) -> 61 | G114: =INT(R2C7*RC1+R3C7+R4C7*RC2+R5C7) -> 23 | H114: =INT(R2C8*RC1+R3C8+R4C8*RC2+R5C8) -> 264
A115: 108 | B115: 10 | C115: =INT(R2C3*RC1+R3C3+R4C3*RC2+R5C3) -> 211 | D115: =INT(R2C4*RC1+R3C4+R4C4*RC2+R5C4) -> 170 | E115: =INT(R2C5*RC1+R3C5+R4C5*RC2+R5C5) -> 164 | F115: =INT(R2C6*RC1+R3C6+R4C6*RC2+R5C6) -> 62 | G115: =INT(R2C7*RC1+R3C7+R4C7*RC2+R5C7) -> 23 | H115: =INT(R2C8*RC1+R3C8+R4C8*RC2+R5C8) -> 266
A116: 109 | B116: 10 | C116: =INT(R2C3*RC1+R3C3+R4C3*RC2+R5C3) -> 213 | D116: =INT(R2C4*RC1+R3C4+R4C4*RC2+R5C4) -> 171 | E116: =INT(R2C5*RC1+R3C5+R4C5*RC2+R5C5) -> 165 | F116: =INT(R2C6*RC1+R3C6+R4C6*RC2+R5C6) -> 62 | G116: =INT(R2C7*RC1+R3C7+R4C7*RC2+R5C7) -> 23 | H116: =INT(R2C8*RC1+R3C8+R4C8*RC2+R5C8) -> 268
A117: 110 | B117: 11 | C117: =INT(R2C3*RC1+R3C3+R4C3*RC2+R5C3) -> 216 | D117: =INT(R2C4*RC1+R3C4+R4C4*RC2+R5C4) -> 177 | E117: =INT(R2C5*RC1+R3C5+R4C5*RC2+R5C5) -> 170 | F117: =INT(R2C6*RC1+R3C6+R4C6*RC2+R5C6) -> 63 | G117: =INT(R2C7*RC1+R3C7+R4C7*RC2+R5C7) -> 24 | H117: =INT(R2C8*RC1+R3C8+R4C8*RC2+R5C8) -> 275
A118: 111 | B118: 11 | C118: =INT(R2C3*RC1+R3C3+R4C3*RC2+R5C3) -> 217 | D118: =INT(R2C4*RC1+R3C4+R4C4*RC2+R5C4) -> 178 | E118: =INT(R2C5*RC1+R3C5+R4C5*RC2+R5C5) -> 171 | F118: =INT(R2C6*RC1+R3C6+R4C6*RC2+R5C6) -> 64 | G118: =INT(R2C7*RC1+R3C7+R4C7*RC2+R5C7) -> 24 | H118: =INT(R2C8*RC1+R3C8+R4C8*RC2+R5C8) -> 277
A119: 112 | B119: 11 | C119: =INT(R2C3*RC1+R3C3+R4C3*RC2+R5C3) -> 219 | D119: =INT(R2C4*RC1+R3C4+R4C4*RC2+R5C4) -> 179 | E119: =INT(R2C5*RC1+R3C5+R4C5*RC2+R5C5) -> 172 | F119: =INT(R2C6*RC1+R3C6+R4C6*RC2+R5C6) -> 64 | G119: =INT(R2C7*RC1+R3C7+R4C7*RC2+R5C7) -> 24 | H119: =INT(R2C8*RC1+R3C8+R4C8*RC2+R5C8) -> 279
A120: 113 | B120: 11 | C120: =INT(R2C3*RC1+R3C3+R4C3*RC2+R5C3) -> 221 | D120: =INT(R2C4*RC1+R3C4+R4C4*RC2+R5C4) -> 180 | E120: =INT(R2C5*RC1+R3C5+R4C5*RC2+R5C5) -> 173 | F120: =INT(R2C6*RC1+R3C6+R4C6*RC2+R5C6) -> 65 | G120: =INT(R2C7*RC1+R3C7+R4C7*RC2+R5C7) -> 24 | H120: =INT(R2C8*RC1+R3C8+R4C8*RC2+R5C8) -> 281
A121: 114 | B121: 11 | C121: =INT(R2C3*RC1+R3C3+R4C3*RC2+R5C3) -> 223 | D121: =INT(R2C4*RC1+R3C4+R4C4*RC2+R5C4) -> 181 | E121: =INT(R2C5*RC1+R3C5+R4C5*RC2+R5C5) -> 174 | F121: =INT(R2C6*RC1+R3C6+R4C6*RC2+R5C6) -> 65 | G121: =INT(R2C7*RC1+R3C7+R4C7*RC2+R5C7) -> 24 | H121: =INT(R2C8*RC1+R3C8+R4C8*RC2+R5C8) -> 283
A122: 115 | B122: 11 | C122: =INT(R2C3*RC1+R3C3+R4C3*RC2+R5C3) -> 225 | D122: =INT(R2C4*RC1+R3C4+R4C4*RC2+R5C4) -> 182 | E122: =INT(R2C5*RC1+R3C5+R4C5*RC2+R5C5) -> 176 | F122: =INT(R2C6*RC1+R3C6+R4C6*RC2+R5C6) -> 66 | G122: =INT(R2C7*RC1+R3C7+R4C7*RC2+R5C7) -> 24 | H122: =INT(R2C8*RC1+R3C8+R4C8*RC2+R5C8) -> 285
A123: 116 | B123: 11 | C123: =INT(R2C3*RC1+R3C3+R4C3*RC2+R5C3) -> 226 | D123: =INT(R2C4*RC1+R3C4+R4C4*RC2+R5C4) -> 183 | E123: =INT(R2C5*RC1+R3C5+R4C5*RC2+R5C5) -> 177 | F123: =INT(R2C6*RC1+R3C6+R4C6*RC2+R5C6) -> 66 | G123: =INT(R2C7*RC1+R3C7+R4C7*RC2+R5C7) -> 24 | H123: =INT(R2C8*RC1+R3C8+R4C8*RC2+R5C8) -> 287
A124: 117 | B124: 11 | C124: =INT(R2C3*RC1+R3C3+R4C3*RC2+R5C3) -> 228 | D124: =INT(R2C4*RC1+R3C4+R4C4*RC2+R5C4) -> 184 | E124: =INT(R2C5*RC1+R3C5+R4C5*RC2+R5C5) -> 178 | F124: =INT(R2C6*RC1+R3C6+R4C6*RC2+R5C6) -> 67 | G124: =INT(R2C7*RC1+R3C7+R4C7*RC2+R5C7) -> 25 | H124: =INT(R2C8*RC1+R3C8+R4C8*RC2+R5C8) -> 289
A125: 118 | B125: 11 | C125: =INT(R2C3*RC1+R3C3+R4C3*RC2+R5C3) -> 230 | D125: =INT(R2C4*RC1+R3C4+R4C4*RC2+R5C4) -> 185 | E125: =INT(R2C5*RC1+R3C5+R4C5*RC2+R5C5) -> 179 | F125: =INT(R2C6*RC1+R3C6+R4C6*RC2+R5C6) -> 67 | G125: =INT(R2C7*RC1+R3C7+R4C7*RC2+R5C7) -> 25 | H125: =INT(R2C8*RC1+R3C8+R4C8*RC2+R5C8) -> 291
A126: 119 | B126: 11 | C126: =INT(R2C3*RC1+R3C3+R4C3*RC2+R5C3) -> 232 | D126: =INT(R2C4*RC1+R3C4+R4C4*RC2+R5C4) -> 186 | E126: =INT(R2C5*RC1+R3C5+R4C5*RC2+R5C5) -> 180 | F126: =INT(R2C6*RC1+R3C6+R4C6*RC2+R5C6) -> 68 | G126: =INT(R2C7*RC1+R3C7+R4C7*RC2+R5C7) -> 25 | H126: =INT(R2C8*RC1+R3C8+R4C8*RC2+R5C8) -> 293
A127: 120 | B127: 12 | C127: =INT(R2C3*RC1+R3C3+R4C3*RC2+R5C3) -> 235 | D127: =INT(R2C4*RC1+R3C4+R4C4*RC2+R5C4) -> 192 | E127: =INT(R2C5*RC1+R3C5+R4C5*RC2+R5C5) -> 185 | F127: =INT(R2C6*RC1+R3C6+R4C6*RC2+R5C6) -> 69 | G127: =INT(R2C7*RC1+R3C7+R4C7*RC2+R5C7) -> 26 | H127: =INT(R2C8*RC1+R3C8+R4C8*RC2+R5C8) -> 300
A128: 121 | B128: 12 | C128: =INT(R2C3*RC1+R3C3+R4C3*RC2+R5C3) -> 236 | D128: =INT(R2C4*RC1+R3C4+R4C4*RC2+R5C4) -> 193 | E128: =INT(R2C5*RC1+R3C5+R4C5*RC2+R5C5) -> 186 | F128: =INT(R2C6*RC1+R3C6+R4C6*RC2+R5C6) -> 69 | G128: =INT(R2C7*RC1+R3C7+R4C7*RC2+R5C7) -> 26 | H128: =INT(R2C8*RC1+R3C8+R4C8*RC2+R5C8) -> 302
A129: 122 | B129: 12 | C129: =INT(R2C3*RC1+R3C3+R4C3*RC2+R5C3) -> 238 | D129: =INT(R2C4*RC1+R3C4+R4C4*RC2+R5C4) -> 194 | E129: =INT(R2C5*RC1+R3C5+R4C5*RC2+R5C5) -> 187 | F129: =INT(R2C6*RC1+R3C6+R4C6*RC2+R5C6) -> 70 | G129: =INT(R2C7*RC1+R3C7+R4C7*RC2+R5C7) -> 26 | H129: =INT(R2C8*RC1+R3C8+R4C8*RC2+R5C8) -> 304
A130: 123 | B130: 12 | C130: =INT(R2C3*RC1+R3C3+R4C3*RC2+R5C3) -> 240 | D130: =INT(R2C4*RC1+R3C4+R4C4*RC2+R5C4) -> 195 | E130: =INT(R2C5*RC1+R3C5+R4C5*RC2+R5C5) -> 188 | F130: =INT(R2C6*RC1+R3C6+R4C6*RC2+R5C6) -> 70 | G130: =INT(R2C7*RC1+R3C7+R4C7*RC2+R5C7) -> 26 | H130: =INT(R2C8*RC1+R3C8+R4C8*RC2+R5C8) -> 306
A131: 124 | B131: 12 | C131: =INT(R2C3*RC1+R3C3+R4C3*RC2+R5C3) -> 242 | D131: =INT(R2C4*RC1+R3C4+R4C4*RC2+R5C4) -> 196 | E131: =INT(R2C5*RC1+R3C5+R4C5*RC2+R5C5) -> 189 | F131: =INT(R2C6*RC1+R3C6+R4C6*RC2+R5C6) -> 71 | G131: =INT(R2C7*RC1+R3C7+R4C7*RC2+R5C7) -> 26 | H131: =INT(R2C8*RC1+R3C8+R4C8*RC2+R5C8) -> 308
A132: 125 | B132: 12 | C132: =INT(R2C3*RC1+R3C3+R4C3*RC2+R5C3) -> 244 | D132: =INT(R2C4*RC1+R3C4+R4C4*RC2+R5C4) -> 197 | E132: =INT(R2C5*RC1+R3C5+R4C5*RC2+R5C5) -> 191 | F132: =INT(R2C6*RC1+R3C6+R4C6*RC2+R5C6) -> 71 | G132: =INT(R2C7*RC1+R3C7+R4C7*RC2+R5C7) -> 26 | H132: =INT(R2C8*RC1+R3C8+R4C8*RC2+R5C8) -> 310
A133: 126 | B133: 12 | C133: =INT(R2C3*RC1+R3C3+R4C3*RC2+R5C3) -> 245 | D133: =INT(R2C4*RC1+R3C4+R4C4*RC2+R5C4) -> 198 | E133: =INT(R2C5*RC1+R3C5+R4C5*RC2+R5C5) -> 192 | F133: =INT(R2C6*RC1+R3C6+R4C6*RC2+R5C6) -> 72 | G133: =INT(R2C7*RC1+R3C7+R4C7*RC2+R5C7) -> 26 | H133: =INT(R2C8*RC1+R3C8+R4C8*RC2+R5C8) -> 312
A134: 127 | B134: 12 | C134: =INT(R2C3*RC1+R3C3+R4C3*RC2+R5C3) -> 247 | D134: =INT(R2C4*RC1+R3C4+R4C4*RC2+R5C4) -> 199 | E134: =INT(R2C5*RC1+R3C5+R4C5*RC2+R5C5) -> 193 | F134: =INT(R2C6*RC1+R3C6+R4C6*RC2+R5C6) -> 72 | G134: =INT(R2C7*RC1+R3C7+R4C7*RC2+R5C7) -> 27 | H134: =INT(R2C8*RC1+R3C8+R4C8*RC2+R5C8) -> 314
A135: 128 | B135: 12 | C135: =INT(R2C3*RC1+R3C3+R4C3*RC2+R5C3) -> 249 | D135: =INT(R2C4*RC1+R3C4+R4C4*RC2+R5C4) -> 200 | E135: =INT(R2C5*RC1+R3C5+R4C5*RC2+R5C5) -> 194 | F135: =INT(R2C6*RC1+R3C6+R4C6*RC2+R5C6) -> 73 | G135: =INT(R2C7*RC1+R3C7+R4C7*RC2+R5C7) -> 27 | H135: =INT(R2C8*RC1+R3C8+R4C8*RC2+R5C8) -> 316
A136: 129 | B136: 12 | C136: =INT(R2C3*RC1+R3C3+R4C3*RC2+R5C3) -> 251 | D136: =INT(R2C4*RC1+R3C4+R4C4*RC2+R5C4) -> 201 | E136: =INT(R2C5*RC1+R3C5+R4C5*RC2+R5C5) -> 195 | F136: =INT(R2C6*RC1+R3C6+R4C6*RC2+R5C6) -> 73 | G136: =INT(R2C7*RC1+R3C7+R4C7*RC2+R5C7) -> 27 | H136: =INT(R2C8*RC1+R3C8+R4C8*RC2+R5C8) -> 318
A137: 130 | B137: 13 | C137: =INT(R2C3*RC1+R3C3+R4C3*RC2+R5C3) -> 254 | D137: =INT(R2C4*RC1+R3C4+R4C4*RC2+R5C4) -> 207 | E137: =INT(R2C5*RC1+R3C5+R4C5*RC2+R5C5) -> 200 | F137: =INT(R2C6*RC1+R3C6+R4C6*RC2+R5C6) -> 74 | G137: =INT(R2C7*RC1+R3C7+R4C7*RC2+R5C7) -> 28 | H137: =INT(R2C8*RC1+R3C8+R4C8*RC2+R5C8) -> 325
A138: 131 | B138: 13 | C138: =INT(R2C3*RC1+R3C3+R4C3*RC2+R5C3) -> 255 | D138: =INT(R2C4*RC1+R3C4+R4C4*RC2+R5C4) -> 208 | E138: =INT(R2C5*RC1+R3C5+R4C5*RC2+R5C5) -> 201 | F138: =INT(R2C6*RC1+R3C6+R4C6*RC2+R5C6) -> 75 | G138: =INT(R2C7*RC1+R3C7+R4C7*RC2+R5C7) -> 28 | H138: =INT(R2C8*RC1+R3C8+R4C8*RC2+R5C8) -> 327
A139: 132 | B139: 13 | C139: =INT(R2C3*RC1+R3C3+R4C3*RC2+R5C3) -> 257 | D139: =INT(R2C4*RC1+R3C4+R4C4*RC2+R5C4) -> 209 | E139: =INT(R2C5*RC1+R3C5+R4C5*RC2+R5C5) -> 202 | F139: =INT(R2C6*RC1+R3C6+R4C6*RC2+R5C6) -> 75 | G139: =INT(R2C7*RC1+R3C7+R4C7*RC2+R5C7) -> 28 | H139: =INT(R2C8*RC1+R3C8+R4C8*RC2+R5C8) -> 329
A140: 133 | B140: 13 | C140: =INT(R2C3*RC1+R3C3+R4C3*RC2+R5C3) -> 259 | D140: =INT(R2C4*RC1+R3C4+R4C4*RC2+R5C4) -> 210 | E140: =INT(R2C5*RC1+R3C5+R4C5*RC2+R5C5) -> 203 | F140: =INT(R2C6*RC1+R3C6+R4C6*RC2+R5C6) -> 76 | G140: =INT(R2C7*RC1+R3C7+R4C7*RC2+R5C7) -> 28 | H140: =INT(R2C8*RC1+R3C8+R4C8*RC2+R5C8) -> 331
A141: 134 | B141: 13 | C141: =INT(R2C3*RC1+R3C3+R4C3*RC2+R5C3) -> 261 | D141: =INT(R2C4*RC1+R3C4+R4C4*RC2+R5C4) -> 211 | E141: =INT(R2C5*RC1+R3C5+R4C5*RC2+R5C5) -> 204 | F141: =INT(R2C6*RC1+R3C6+R4C6*RC2+R5C6) -> 76 | G141: =INT(R2C7*RC1+R3C7+R4C7*RC2+R5C7) -> 28 | H141: =INT(R2C8*RC1+R3C8+R4C8*RC2+R5C8) -> 333
A142: 135 | B142: 13 | C142: =INT(R2C3*RC1+R3C3+R4C3*RC2+R5C3) -> 263 | D142: =INT(R2C4*RC1+R3C4+R4C4*RC2+R5C4) -> 212 | E142: =INT(R2C5*RC1+R3C5+R4C5*RC2+R5C5) -> 206 | F142: =INT(R2C6*RC1+R3C6+R4C6*RC2+R5C6) -> 77 | G142: =INT(R2C7*RC1+R3C7+R4C7*RC2+R5C7) -> 28 | H142: =INT(R2C8*RC1+R3C8+R4C8*RC2+R5C8) -> 335
A143: 136 | B143: 13 | C143: =INT(R2C3*RC1+R3C3+R4C3*RC2+R5C3) -> 264 | D143: =INT(R2C4*RC1+R3C4+R4C4*RC2+R5C4) -> 213 | E143: =INT(R2C5*RC1+R3C5+R4C5*RC2+R5C5) -> 207 | F143: =INT(R2C6*RC1+R3C6+R4C6*RC2+R5C6) -> 77 | G143: =INT(R2C7*RC1+R3C7+R4C7*RC2+R5C7) -> 28 | H143: =INT(R2C8*RC1+R3C8+R4C8*RC2+R5C8) -> 337
A144: 137 | B144: 13 | C144: =INT(R2C3*RC1+R3C3+R4C3*RC2+R5C3) -> 266 | D144: =INT(R2C4*RC1+R3C4+R4C4*RC2+R5C4) -> 214 | E144: =INT(R2C5*RC1+R3C5+R4C5*RC2+R5C5) -> 208 | F144: =INT(R2C6*RC1+R3C6+R4C6*RC2+R5C6) -> 78 | G144: =INT(R2C7*RC1+R3C7+R4C7*RC2+R5C7) -> 29 | H144: =INT(R2C8*RC1+R3C8+R4C8*RC2+R5C8) -> 339
A145: 138 | B145: 13 | C145: =INT(R2C3*RC1+R3C3+R4C3*RC2+R5C3) -> 268 | D145: =INT(R2C4*RC1+R3C4+R4C4*RC2+R5C4) -> 215 | E145: =INT(R2C5*RC1+R3C5+R4C5*RC2+R5C5) -> 209 | F145: =INT(R2C6*RC1+R3C6+R4C6*RC2+R5C6) -> 78 | G145: =INT(R2C7*RC1+R3C7+R4C7*RC2+R5C7) -> 29 | H145: =INT(R2C8*RC1+R3C8+R4C8*RC2+R5C8) -> 341
A146: 139 | B146: 13 | C146: =INT(R2C3*RC1+R3C3+R4C3*RC2+R5C3) -> 270 | D146: =INT(R2C4*RC1+R3C4+R4C4*RC2+R5C4) -> 216 | E146: =INT(R2C5*RC1+R3C5+R4C5*RC2+R5C5) -> 210 | F146: =INT(R2C6*RC1+R3C6+R4C6*RC2+R5C6) -> 79 | G146: =INT(R2C7*RC1+R3C7+R4C7*RC2+R5C7) -> 29 | H146: =INT(R2C8*RC1+R3C8+R4C8*RC2+R5C8) -> 343
A147: 140 | B147: 14 | C147: =INT(R2C3*RC1+R3C3+R4C3*RC2+R5C3) -> 273 | D147: =INT(R2C4*RC1+R3C4+R4C4*RC2+R5C4) -> 222 | E147: =INT(R2C5*RC1+R3C5+R4C5*RC2+R5C5) -> 215 | F147: =INT(R2C6*RC1+R3C6+R4C6*RC2+R5C6) -> 80 | G147: =INT(R2C7*RC1+R3C7+R4C7*RC2+R5C7) -> 30 | H147: =INT(R2C8*RC1+R3C8+R4C8*RC2+R5C8) -> 350
A148: 141 | B148: 14 | C148: =INT(R2C3*RC1+R3C3+R4C3*RC2+R5C3) -> 274 | D148: =INT(R2C4*RC1+R3C4+R4C4*RC2+R5C4) -> 223 | E148: =INT(R2C5*RC1+R3C5+R4C5*RC2+R5C5) -> 216 | F148: =INT(R2C6*RC1+R3C6+R4C6*RC2+R5C6) -> 80 | G148: =INT(R2C7*RC1+R3C7+R4C7*RC2+R5C7) -> 30 | H148: =INT(R2C8*RC1+R3C8+R4C8*RC2+R5C8) -> 352
A149: 142 | B149: 14 | C149: =INT(R2C3*RC1+R3C3+R4C3*RC2+R5C3) -> 276 | D149: =INT(R2C4*RC1+R3C4+R4C4*RC2+R5C4) -> 224 | E149: =INT(R2C5*RC1+R3C5+R4C5*RC2+R5C5) -> 217 | F149: =INT(R2C6*RC1+R3C6+R4C6*RC2+R5C6) -> 81 | G149: =INT(R2C7*RC1+R3C7+R4C7*RC2+R5C7) -> 30 | H149: =INT(R2C8*RC1+R3C8+R4C8*RC2+R5C8) -> 354
A150: 143 | B150: 14 | C150: =INT(R2C3*RC1+R3C3+R4C3*RC2+R5C3) -> 278 | D150: =INT(R2C4*RC1+R3C4+R4C4*RC2+R5C4) -> 225 | E150: =INT(R2C5*RC1+R3C5+R4C5*RC2+R5C5) -> 218 | F150: =INT(R2C6*RC1+R3C6+R4C6*RC2+R5C6) -> 81 | G150: =INT(R2C7*RC1+R3C7+R4C7*RC2+R5C7) -> 30 | H150: =INT(R2C8*RC1+R3C8+R4C8*RC2+R5C8) -> 356
A151: 144 | B151: 14 | C151: =INT(R2C3*RC1+R3C3+R4C3*RC2+R5C3) -> 280 | D151: =INT(R2C4*RC1+R3C4+R4C4*RC2+R5C4) -> 226 | E151: =INT(R2C5*RC1+R3C5+R4C5*RC2+R5C5) -> 219 | F151: =INT(R2C6*RC1+R3C6+R4C6*RC2+R5C6) -> 82 | G151: =INT(R2C7*RC1+R3C7+R4C7*RC2+R5C7) -> 30 | H151: =INT(R2C8*RC1+R3C8+R4C8*RC2+R5C8) -> 358
A152: 145 | B152: 14 | C152: =INT(R2C3*RC1+R3C3+R4C3*RC2+R5C3) -> 282 | D152: =INT(R2C4*RC1+R3C4+R4C4*RC2+R5C4) -> 227 | E152: =INT(R2C5*RC1+R3C5+R4C5*RC2+R5C5) -> 221 | F152: =INT(R2C6*RC1+R3C6+R4C6*RC2+R5C6) -> 82 | G152: =INT(R2C7*RC1+R3C7+R4C7*RC2+R5C7) -> 30 | H152: =INT(R2C8*RC1+R3C8+R4C8*RC2+R5C8) -> 360
A153: 146 | B153: 14 | C153: =INT(R2C3*RC1+R3C3+R4C3*RC2+R5C3) -> 283 | D153: =INT(R2C4*RC1+R3C4+R4C4*RC2+R5C4) -> 228 | E153: =INT(R2C5*RC1+R3C5+R4C5*RC2+R5C5) -> 222 | F153: =INT(R2C6*RC1+R3C6+R4C6*RC2+R5C6) -> 83 | G153: =INT(R2C7*RC1+R3C7+R4C7*RC2+R5C7) -> 30 | H153: =INT(R2C8*RC1+R3C8+R4C8*RC2+R5C8) -> 362
A154: 147 | B154: 14 | C154: =INT(R2C3*RC1+R3C3+R4C3*RC2+R5C3) -> 285 | D154: =INT(R2C4*RC1+R3C4+R4C4*RC2+R5C4) -> 229 | E154: =INT(R2C5*RC1+R3C5+R4C5*RC2+R5C5) -> 223 | F154: =INT(R2C6*RC1+R3C6+R4C6*RC2+R5C6) -> 83 | G154: =INT(R2C7*RC1+R3C7+R4C7*RC2+R5C7) -> 31 | H154: =INT(R2C8*RC1+R3C8+R4C8*RC2+R5C8) -> 364
A155: 148 | B155: 14 | C155: =INT(R2C3*RC1+R3C3+R4C3*RC2+R5C3) -> 287 | D155: =INT(R2C4*RC1+R3C4+R4C4*RC2+R5C4) -> 230 | E155: =INT(R2C5*RC1+R3C5+R4C5*RC2+R5C5) -> 224 | F155: =INT(R2C6*RC1+R3C6+R4C6*RC2+R5C6) -> 84 | G155: =INT(R2C7*RC1+R3C7+R4C7*RC2+R5C7) -> 31 | H155: =INT(R2C8*RC1+R3C8+R4C8*RC2+R5C8) -> 366
A156: 149 | B156: 14 | C156: =INT(R2C3*RC1+R3C3+R4C3*RC2+R5C3) -> 289 | D156: =INT(R2C4*RC1+R3C4+R4C4*RC2+R5C4) -> 231 | E156: =INT(R2C5*RC1+R3C5+R4C5*RC2+R5C5) -> 225 | F156: =INT(R2C6*RC1+R3C6+R4C6*RC2+R5C6) -> 84 | G156: =INT(R2C7*RC1+R3C7+R4C7*RC2+R5C7) -> 31 | H156: =INT(R2C8*RC1+R3C8+R4C8*RC2+R5C8) -> 368
A157: 150 | B157: 15 | C157: =INT(R2C3*RC1+R3C3+R4C3*RC2+R5C3) -> 292 | D157: =INT(R2C4*RC1+R3C4+R4C4*RC2+R5C4) -> 237 | E157: =INT(R2C5*RC1+R3C5+R4C5*RC2+R5C5) -> 230 | F157: =INT(R2C6*RC1+R3C6+R4C6*RC2+R5C6) -> 85 | G157: =INT(R2C7*RC1+R3C7+R4C7*RC2+R5C7) -> 32 | H157: =INT(R2C8*RC1+R3C8+R4C8*RC2+R5C8) -> 375
A158: 目标数值 | C158: 292 | D158: 237 | E158: 230 | F158: 85 | G158: 32 | H158: 375