Sheet: ctTaskSystemConf
B1: 1为主线 2为支线 3为引导 | C1: 1为战斗 2为寻找npc 3为提交指定物品 4为采集 | D1: 目标类型为1：npcid 目标类型为2：npcid 目标类型为3：npcid 目标类型为4：npcid | E1: 目标类型为1：战斗副本id 目标类型为2：0 目标类型为3：itemid 目标类型为4：采集耗时/个 | F1: 目标类型为1：0 目标类型为2：0 目标类型为3：提交数量 目标类型为4：采集数量 | I1: 1为固定npc 2为个人可见npc
A2: nTaskId | B2: nTaskType | C2: nTargetType | D2: nParam1 | E2: nParam2 | F2: nParam3 | G2: nBattleGroup | H2: tTaskPos | I2: nNpcType | J2: nNextTask | K2: nLevelLimit | L2: tTaskReward | M2: sTaskName | N2: sTaskDeclare
A3: i | B3: i | C3: i | D3: i | E3: i | F3: i | G3: i | H3: t{ii} | I3: i | J3: i | K3: i | L3: t{iiii} | M3: s | N3: s
A4: 任务id | B4: 任务类型 | C4: 任务目标类型 | D4: 任务参数1 | E4: 任务参数2 | F4: 任务参数3 | G4: 战斗任务怪所属战斗组 | H4: 任务坐标 | I4: npc类型 | J4: 后继任务id | K4: 任务所需等级 | L4: 任务奖励(角色ID，物品类型，物品ID，数量) | M4: 任务名称 | N4: 任务说明
A5: 101000 | B5: 1 | C5: 2 | D5: 1 | E5: 0 | F5: 0 | G5: 0 | H5: 0,0 | I5: 2 | J5: 101001 | K5: 10 | L5: 0,1,7,1250;0,1,8,1000;0,1,4,10000;0,1,11001,1; | M5: 主线-与师傅谈话 | N5: 师傅要见你
A6: 101001 | B6: 1 | C6: 1 | D6: 1 | E6: 0 | F6: 0 | G6: 1 | H6: 0,0 | I6: 2 | J6: 101002 | K6: 10 | L6: 0,1,7,2810;0,1,8,1000;0,1,4,10000;0,1,19016,10; | M6: 主线-与师傅谈话 | N6: 与宠物切磋
A7: 101002 | B7: 1 | C7: 2 | D7: 1 | E7: 0 | F7: 0 | G7: 0 | H7: 0,0 | I7: 2 | J7: 101003 | K7: 10 | L7: 0,1,7,3170;0,1,8,1000;0,1,4,10000;0,1,11015,1; | M7: 主线-与师傅谈话 | N7: 展捕快失踪事件
A8: 101003 | B8: 1 | C8: 2 | D8: 1 | E8: 1 | F8: 0 | G8: 0 | H8: 0,0 | I8: 2 | J8: 101004 | K8: 10 | L8: 0,1,7,3580;0,1,8,1000;0,1,4,10000;0,1,19016,12; | M8: 主线-与师傅谈话 | N8: 前往长安城
A9: 101004 | B9: 1 | C9: 2 | D9: 2 | E9: 0 | F9: 0 | G9: 0 | H9: 0,0 | I9: 2 | J9: 101005 | K9: 10 | L9: 0,1,7,4050;0,1,8,2000;0,1,4,10000; | M9: 主线-长安风云 | N9: 热心人搭讪
A10: 101005 | B10: 1 | C10: 2 | D10: 2 | E10: 1 | F10: 0 | G10: 0 | H10: 0,0 | I10: 2 | J10: 101006 | K10: 10 | L10: 0,1,7,4590;0,1,8,2000;0,1,4,10000; | M10: 主线-长安风云 | N10: 热心人原来是贼
A11: 101006 | B11: 1 | C11: 1 | D11: 2 | E11: 1 | F11: 0 | G11: 2 | H11: 0,0 | I11: 2 | J11: 101007 | K11: 10 | L11: 0,1,7,5210;0,1,8,2000;0,1,4,10000; | M11: 主线-长安风云 | N11: 教训小偷铁嘴李
A12: 101007 | B12: 1 | C12: 2 | D12: 3 | E12: 0 | F12: 0 | G12: 0 | H12: 0,0 | I12: 2 | J12: 101008 | K12: 10 | L12: 0,1,7,5910;0,1,8,2000;0,1,4,10000; | M12: 主线-长安风云 | N12: 前往长安衙府
A13: 101008 | B13: 1 | C13: 2 | D13: 5 | E13: 1 | F13: 0 | G13: 0 | H13: 0,0 | I13: 2 | J13: 101009 | K13: 20 | L13: 0,1,7,16450;0,1,8,6000;0,1,4,10000; | M13: 主线-长安风云 | N13: 捉拿逃犯王小海
A14: 101009 | B14: 1 | C14: 2 | D14: 6 | E14: 0 | F14: 0 | G14: 0 | H14: 0,0 | I14: 2 | J14: 101010 | K14: 20 | L14: 0,1,7,16450;0,1,8,6000;0,1,4,17000; | M14: 主线-长安风云 | N14: 王大海来接应
A15: 101010 | B15: 1 | C15: 1 | D15: 6 | E15: 1 | F15: 0 | G15: 3 | H15: 0,0 | I15: 2 | J15: 101011 | K15: 20 | L15: 0,1,7,16450;0,1,8,6000;0,1,4,17000; | M15: 主线-长安风云 | N15: 擒拿王大海兄弟
A16: 101011 | B16: 1 | C16: 2 | D16: 7 | E16: 0 | F16: 0 | G16: 0 | H16: 0,0 | I16: 2 | J16: 101012 | K16: 20 | L16: 0,1,7,16450;0,1,8,6000;0,1,4,17000; | M16: 主线-长安风云 | N16: 打架狂人卓一平
A17: 101012 | B17: 1 | C17: 2 | D17: 8 | E17: 0 | F17: 0 | G17: 0 | H17: 0,0 | I17: 2 | J17: 101013 | K17: 20 | L17: 0,1,7,16450;0,1,8,6000;0,1,4,17000; | M17: 主线-境地疑云 | N17: 蛤蟆怪拦路
A18: 101013 | B18: 1 | C18: 2 | D18: 10 | E18: 1 | F18: 0 | G18: 0 | H18: 0,0 | I18: 2 | J18: 101014 | K18: 20 | L18: 0,1,7,16450;0,1,8,6000;0,1,4,17000; | M18: 主线-境地疑云 | N18: 初见毒仙子
A19: 101014 | B19: 1 | C19: 1 | D19: 11 | E19: 0 | F19: 0 | G19: 4 | H19: 0,0 | I19: 2 | J19: 101015 | K19: 20 | L19: 0,1,7,16450;0,1,8,6000;0,1,4,17000; | M19: 主线-境地疑云 | N19: 追讨毒仙子的酒
A20: 101015 | B20: 1 | C20: 2 | D20: 10 | E20: 1 | F20: 0 | G20: 0 | H20: 0,0 | I20: 2 | J20: 101016 | K20: 20 | L20: 0,1,7,16450;0,1,8,6000;0,1,4,17000; | M20: 主线-境地疑云 | N20: 把酒交给毒仙子
A21: 101016 | B21: 1 | C21: 2 | D21: 12 | E21: 0 | F21: 0 | G21: 0 | H21: 0,0 | I21: 2 | J21: 101017 | K21: 26 | L21: 0,1,7,17200;0,1,8,6000;0,1,4,17000; | M21: 主线-境地疑云 | N21: 前往境地
A22: 101017 | B22: 1 | C22: 1 | D22: 13 | E22: 0 | F22: 0 | G22: 10 | H22: 0,0 | I22: 2 | J22: 101018 | K22: 26 | L22: 0,1,7,34400;0,1,8,6000;0,1,4,17000; | M22: 主线-境地疑云 | N22: 为狐妖所为
A23: 101018 | B23: 1 | C23: 2 | D23: 9 | E23: 1 | F23: 0 | G23: 0 | H23: 0,0 | I23: 2 | J23: 101019 | K23: 26 | L23: 0,1,7,17200;0,1,8,6000;0,1,4,17000; | M23: 主线-境地疑云 | N23: 找到昏迷的展捕快
A24: 101019 | B24: 1 | C24: 2 | D24: 9 | E24: 0 | F24: 0 | G24: 0 | H24: 0,0 | I24: 2 | J24: 102020 | K24: 26 | L24: 0,1,7,17200;0,1,8,6000;0,1,4,17000;0,1,13312,1; | M24: 主线-境地疑云 | N24: 了解事情的前因后果
A25: 102020 | B25: 1 | C25: 2 | D25: 14 | E25: 0 | F25: 0 | G25: 0 | H25: 0,0 | I25: 2 | J25: 102021 | K25: 26 | L25: 0,1,7,17200;0,1,8,6000;0,1,4,17000;0,1,11016,1; | M25: 主线-境地疑云 | N25: 击杀幽冥鬼卒
A26: 102021 | B26: 1 | C26: 1 | D26: 15 | E26: 0 | F26: 0 | G26: 11 | H26: 0,0 | I26: 2 | J26: 102022 | K26: 26 | L26: 0,1,7,34400;0,1,8,6000;0,1,4,17000;0,1,19016,15; | M26: 主线-境地疑云 | N26: 阻止神秘人作法
A27: 102022 | B27: 1 | C27: 2 | D27: 15 | E27: 0 | F27: 0 | G27: 0 | H27: 0,0 | I27: 2 | J27: 102023 | K27: 26 | L27: 0,1,7,17200;0,1,8,6000;0,1,4,17000;0,1,10100,1; | M27: 主线-境地疑云 | N27: 听听神秘人说话
A28: 102023 | B28: 1 | C28: 2 | D28: 17 | E28: 1 | F28: 0 | G28: 0 | H28: 0,0 | I28: 2 | J28: 102024 | K28: 26 | L28: 0,1,7,17200;0,1,8,6000;0,1,4,17000; | M28: 主线-巫族初现 | N28: 遇见孙大圣
A29: 102024 | B29: 1 | C29: 2 | D29: 18 | E29: 0 | F29: 0 | G29: 0 | H29: 0,0 | I29: 2 | J29: 102025 | K29: 26 | L29: 0,1,7,17200;0,1,8,6000;0,1,4,17000; | M29: 主线-巫族初现 | N29: 向附近的贵妇人打听消息
A30: 102025 | B30: 1 | C30: 2 | D30: 23 | E30: 0 | F30: 0 | G30: 0 | H30: 0,0 | I30: 2 | J30: 102026 | K30: 26 | L30: 0,1,7,17200;0,1,8,6000;0,1,4,17000; | M30: 主线-巫族初现 | N30: 帮贵妇人找止血散
A31: 102026 | B31: 1 | C31: 2 | D31: 16 | E31: 0 | F31: 0 | G31: 0 | H31: 0,0 | I31: 2 | J31: 102027 | K31: 26 | L31: 0,1,7,17200;0,1,8,6000;0,1,4,17000; | M31: 主线-巫族初现 | N31: 发现一名神秘女子
A32: 102027 | B32: 1 | C32: 2 | D32: 16 | E32: 0 | F32: 0 | G32: 0 | H32: 0,0 | I32: 2 | J32: 102028 | K32: 26 | L32: 0,1,7,17200;0,1,8,8000;0,1,4,17000; | M32: 主线-巫族初现 | N32: 喝问神秘女子有关巫术之事
A33: 102028 | B33: 1 | C33: 1 | D33: 19 | E33: 1 | F33: 0 | G33: 12 | H33: 0,0 | I33: 2 | J33: 102029 | K33: 26 | L33: 0,1,7,34400;0,1,8,8000;0,1,4,17000; | M33: 主线-巫族初现 | N33: 追踪神秘女子至皇宫门外
A34: 102029 | B34: 1 | C34: 2 | D34: 7 | E34: 0 | F34: 0 | G34: 0 | H34: 0,0 | I34: 2 | J34: 102030 | K34: 26 | L34: 0,1,7,17200;0,1,8,8000;0,1,4,17000; | M34: 主线-巫族初现 | N34: 兴奋的卓一平
A35: 102030 | B35: 1 | C35: 1 | D35: 20 | E35: 1 | F35: 0 | G35: 13 | H35: 0,0 | I35: 2 | J35: 102031 | K35: 26 | L35: 0,1,7,34400;0,1,8,8000;0,1,4,17000; | M35: 主线-巫族初现 | N35: 前往房府大院
A36: 102031 | B36: 1 | C36: 2 | D36: 24 | E36: 0 | F36: 0 | G36: 0 | H36: 0,0 | I36: 2 | J36: 102032 | K36: 30 | L36: 0,1,7,17200;0,1,8,8000;0,1,4,17000; | M36: 主线-巫族初现 | N36: 拜见宰相房玄龄
A37: 102032 | B37: 1 | C37: 2 | D37: 19 | E37: 0 | F37: 0 | G37: 0 | H37: 0,0 | I37: 2 | J37: 102033 | K37: 30 | L37: 0,1,7,17200;0,1,8,8000;0,1,4,17000; | M37: 主线-巫族初现 | N37: 进宫面圣
A38: 102033 | B38: 1 | C38: 1 | D38: 21 | E38: 1 | F38: 0 | G38: 14 | H38: 0,0 | I38: 2 | J38: 102034 | K38: 30 | L38: 0,1,7,34400;0,1,8,8000;0,1,4,17000; | M38: 主线-巫族初现 | N38: 击败巫十三
A39: 102034 | B39: 1 | C39: 2 | D39: 24 | E39: 1 | F39: 0 | G39: 0 | H39: 0,0 | I39: 2 | J39: 102035 | K39: 30 | L39: 0,1,7,17200;0,1,8,8000;0,1,4,17000; | M39: 主线-巫族初现 | N39: 找房玄龄商量计策
A40: 102035 | B40: 1 | C40: 2 | D40: 122 | E40: 0 | F40: 0 | G40: 0 | H40: 0,0 | I40: 2 | J40: 102036 | K40: 30 | L40: 0,1,7,17200;0,1,8,8000;0,1,4,17000; | M40: 主线-巫族初现 | N40: 毒仙子有法子救皇上
A41: 102036 | B41: 1 | C41: 2 | D41: 117 | E41: 0 | F41: 0 | G41: 0 | H41: 0,0 | I41: 2 | J41: 102037 | K41: 40 | L41: 0,1,7,18000;0,1,8,10000;0,1,4,20000;0,1,13313,1; | M41: 主线-巫族初现 | N41: 买药又遇到神秘女子
A42: 102037 | B42: 1 | C42: 2 | D42: 117 | E42: 1 | F42: 0 | G42: 0 | H42: 0,0 | I42: 2 | J42: 102038 | K42: 40 | L42: 0,1,7,18000;0,1,8,10000;0,1,4,20000;0,1,11017,1; | M42: 主线-巫族初现 | N42: 神秘女子不耐烦
A43: 102038 | B43: 1 | C43: 2 | D43: 117 | E43: 0 | F43: 0 | G43: 0 | H43: 0,0 | I43: 2 | J43: 102039 | K43: 40 | L43: 0,1,7,18000;0,1,8,10000;0,1,4,20000;0,1,10108,15; | M43: 主线-巫族初现 | N43: 又被神秘女子忽悠了
A44: 102039 | B44: 1 | C44: 2 | D44: 118 | E44: 1 | F44: 0 | G44: 0 | H44: 0,0 | I44: 2 | J44: 102040 | K44: 40 | L44: 0,1,7,18000;0,1,8,10000;0,1,4,20000; | M44: 主线-巫族初现 | N44: 神秘女子道出真实身份
A45: 102040 | B45: 1 | C45: 2 | D45: 23 | E45: 1 | F45: 0 | G45: 0 | H45: 0,0 | I45: 2 | J45: 102041 | K45: 40 | L45: 0,1,7,18000;0,1,8,10000;0,1,4,20000; | M45: 主线-巫族初现 | N45: 继续去买药
A46: 102041 | B46: 1 | C46: 1 | D46: 107 | E46: 1 | F46: 0 | G46: 15 | H46: 0,0 | I46: 2 | J46: 102042 | K46: 40 | L46: 0,1,7,18000;0,1,8,10000;0,1,4,20000; | M46: 主线-巫族初现 | N46: 击败抢药少女
A47: 102042 | B47: 1 | C47: 2 | D47: 122 | E47: 2 | F47: 0 | G47: 0 | H47: 0,0 | I47: 2 | J47: 102043 | K47: 40 | L47: 0,1,7,18000;0,1,8,10000;0,1,4,20000; | M47: 主线-巫族初现 | N47: 赶回去抽血配药
A48: 102043 | B48: 1 | C48: 2 | D48: 119 | E48: 1 | F48: 0 | G48: 0 | H48: 0,0 | I48: 2 | J48: 102044 | K48: 40 | L48: 0,1,7,18000;0,1,8,10000;0,1,4,20000; | M48: 主线-巫族初现 | N48: 突然有人出现
A49: 102044 | B49: 1 | C49: 2 | D49: 119 | E49: 0 | F49: 0 | G49: 0 | H49: 0,0 | I49: 2 | J49: 102045 | K49: 40 | L49: 0,1,7,18000;0,1,8,10000;0,1,4,20000; | M49: 主线-巫族初现 | N49: 出来阻止配药神秘人
A50: 102045 | B50: 1 | C50: 1 | D50: 119 | E50: 0 | F50: 0 | G50: 16 | H50: 0,0 | I50: 2 | J50: 102046 | K50: 40 | L50: 0,1,7,18000;0,1,8,10000;0,1,4,20000; | M50: 主线-巫族初现 | N50: 击败神秘人
A51: 102046 | B51: 1 | C51: 2 | D51: 7 | E51: 0 | F51: 0 | G51: 0 | H51: 0,0 | I51: 2 | J51: 102047 | K51: 40 | L51: 0,1,7,18000;0,1,8,10000;0,1,4,20000; | M51: 主线-巫族初现 | N51: 拷问神秘人
A52: 102047 | B52: 1 | C52: 2 | D52: 24 | E52: 0 | F52: 0 | G52: 0 | H52: 0,0 | I52: 2 | J52: 102048 | K52: 40 | L52: 0,1,7,18000;0,1,8,10000;0,1,4,20000; | M52: 主线-巫族初现 | N52: 向房大人问话
A53: 102048 | B53: 1 | C53: 2 | D53: 25 | E53: 1 | F53: 0 | G53: 0 | H53: 0,0 | I53: 2 | J53: 102049 | K53: 45 | L53: 0,1,7,20000;0,1,8,12000;0,1,4,40000; | M53: 主线-巫族初现 | N53: 觐见太宗李世民
A54: 102049 | B54: 1 | C54: 2 | D54: 118 | E54: 0 | F54: 0 | G54: 0 | H54: 0,0 | I54: 2 | J54: 102050 | K54: 45 | L54: 0,1,7,20000;0,1,8,12000;0,1,4,40000; | M54: 主线-查探消息 | N54: 找慕夕了解情况
A55: 102050 | B55: 1 | C55: 2 | D55: 26 | E55: 1 | F55: 0 | G55: 0 | H55: 0,0 | I55: 2 | J55: 102051 | K55: 45 | L55: 0,1,7,60000;0,1,8,12000;0,1,4,40000; | M55: 主线-查探消息 | N55: 士兵的检查
A56: 102051 | B56: 1 | C56: 2 | D56: 27 | E56: 0 | F56: 0 | G56: 0 | H56: 0,0 | I56: 2 | J56: 102052 | K56: 45 | L56: 0,1,7,20000;0,1,8,12000;0,1,4,40000; | M56: 主线-查探消息 | N56: 惊动尉迟将军
A57: 102052 | B57: 1 | C57: 1 | D57: 27 | E57: 0 | F57: 0 | G57: 17 | H57: 0,0 | I57: 2 | J57: 102053 | K57: 45 | L57: 0,1,7,20000;0,1,8,12000;0,1,4,40000; | M57: 主线-查探消息 | N57: 与尉迟将军对话
A58: 102053 | B58: 1 | C58: 2 | D58: 28 | E58: 1 | F58: 0 | G58: 0 | H58: 0,0 | I58: 2 | J58: 102054 | K58: 45 | L58: 0,1,7,20000;0,1,8,12000;0,1,4,40000; | M58: 主线-查探消息 | N58: 慕夕的消息
A59: 102054 | B59: 1 | C59: 2 | D59: 29 | E59: 2 | F59: 0 | G59: 0 | H59: 0,0 | I59: 2 | J59: 102055 | K59: 45 | L59: 0,1,7,20000;0,1,8,12000;0,1,4,40000; | M59: 主线-查探消息 | N59: 无法砍柴的樵夫
A60: 102055 | B60: 1 | C60: 2 | D60: 29 | E60: 1 | F60: 0 | G60: 0 | H60: 0,0 | I60: 2 | J60: 102056 | K60: 45 | L60: 0,1,7,20000;0,1,8,12000;0,1,4,40000; | M60: 主线-查探消息 | N60: 将斧头带回
A61: 102056 | B61: 1 | C61: 2 | D61: 29 | E61: 0 | F61: 0 | G61: 0 | H61: 0,0 | I61: 2 | J61: 102057 | K61: 45 | L61: 0,1,7,20000;0,1,8,12000;0,1,4,40000; | M61: 主线-查探消息 | N61: 归还斧头给樵夫
A62: 102057 | B62: 1 | C62: 2 | D62: 30 | E62: 1 | F62: 0 | G62: 0 | H62: 0,0 | I62: 2 | J62: 102058 | K62: 45 | L62: 0,1,7,60000;0,1,8,12000;0,1,4,40000; | M62: 主线-僵尸内幕 | N62: 寻找老刘
A63: 102058 | B63: 1 | C63: 1 | D63: 22 | E63: 0 | F63: 0 | G63: 18 | H63: 0,0 | I63: 2 | J63: 102059 | K63: 45 | L63: 0,1,7,20000;0,1,8,12000;0,1,4,40000; | M63: 主线-僵尸内幕 | N63: 击退旺财
A64: 102059 | B64: 1 | C64: 2 | D64: 30 | E64: 0 | F64: 0 | G64: 0 | H64: 0,0 | I64: 2 | J64: 102060 | K64: 45 | L64: 0,1,7,20000;0,1,8,12000;0,1,4,40000; | M64: 主线-僵尸内幕 | N64: 老刘儿子刘沐白
A65: 102060 | B65: 1 | C65: 1 | D65: 31 | E65: 1 | F65: 0 | G65: 19 | H65: 0,0 | I65: 2 | J65: 102061 | K65: 50 | L65: 0,1,7,31000;0,1,8,12000;0,1,4,62000;0,1,13314,1; | M65: 主线-僵尸内幕 | N65: 制伏发狂的刘沐白
A66: 102061 | B66: 1 | C66: 2 | D66: 504 | E66: 0 | F66: 0 | G66: 0 | H66: 0,0 | I66: 2 | J66: 102062 | K66: 50 | L66: 0,1,7,31000;0,1,8,12000;0,1,4,62000;0,1,11018,1; | M66: 主线-僵尸内幕 | N66: 毒仙子有法子了
A67: 102062 | B67: 1 | C67: 2 | D67: 32 | E67: 1 | F67: 0 | G67: 0 | H67: 0,0 | I67: 2 | J67: 102063 | K67: 50 | L67: 0,1,7,31000;0,1,8,12000;0,1,4,62000;0,1,19016,25; | M67: 主线-僵尸内幕 | N67: 跳出一个女贼
A68: 102063 | B68: 1 | C68: 1 | D68: 32 | E68: 1 | F68: 0 | G68: 20 | H68: 0,0 | I68: 2 | J68: 102064 | K68: 50 | L68: 0,1,7,31000;0,1,8,12000;0,1,4,62000;0,1,10009,3; | M68: 主线-僵尸内幕 | N68: 教训女贼
A69: 102064 | B69: 1 | C69: 2 | D69: 504 | E69: 1 | F69: 0 | G69: 0 | H69: 0,0 | I69: 2 | J69: 102065 | K69: 50 | L69: 0,1,7,96000;0,1,8,12000;0,1,4,64000; | M69: 主线-僵尸内幕 | N69: 毒仙子配制解药
A70: 102065 | B70: 1 | C70: 2 | D70: 31 | E70: 0 | F70: 0 | G70: 0 | H70: 0,0 | I70: 2 | J70: 102066 | K70: 50 | L70: 0,1,7,32000;0,1,8,12000;0,1,4,64000; | M70: 主线-僵尸内幕 | N70: 刘沐白服下解药
A71: 102066 | B71: 1 | C71: 1 | D71: 121 | E71: 0 | F71: 0 | G71: 21 | H71: 0,0 | I71: 2 | J71: 102067 | K71: 50 | L71: 0,1,7,32000;0,1,8,12000;0,1,4,64000; | M71: 主线-僵尸内幕 | N71: 击退拦路的僵尸
A72: 102067 | B72: 1 | C72: 2 | D72: 121 | E72: 0 | F72: 0 | G72: 0 | H72: 0,0 | I72: 2 | J72: 102068 | K72: 50 | L72: 0,1,7,32000;0,1,8,12000;0,1,4,64000; | M72: 主线-僵尸内幕 | N72: 心疼卓一平
A73: 102068 | B73: 1 | C73: 2 | D73: 28 | E73: 0 | F73: 0 | G73: 0 | H73: 0,0 | I73: 2 | J73: 102069 | K73: 50 | L73: 0,1,7,33000;0,1,8,12000;0,1,4,66000; | M73: 主线-异变 | N73: 慕夕调查到真相了
A74: 102069 | B74: 1 | C74: 1 | D74: 27 | E74: 0 | F74: 0 | G74: 22 | H74: 0,0 | I74: 2 | J74: 102070 | K74: 50 | L74: 0,1,7,99000;0,1,8,12000;0,1,4,66000; | M74: 主线-异变 | N74: 寻找尉迟将军的的帮忙
A75: 102070 | B75: 1 | C75: 2 | D75: 27 | E75: 1 | F75: 0 | G75: 0 | H75: 0,0 | I75: 2 | J75: 102071 | K75: 50 | L75: 0,1,7,33000;0,1,8,12000;0,1,4,66000; | M75: 主线-异变 | N75: 镇压土匪归来
A76: 102071 | B76: 1 | C76: 2 | D76: 28 | E76: 0 | F76: 0 | G76: 0 | H76: 0,0 | I76: 2 | J76: 102072 | K76: 50 | L76: 0,1,7,99000;0,1,8,12000;0,1,4,66000; | M76: 主线-异变 | N76: 慕夕找你有事
A77: 102072 | B77: 1 | C77: 2 | D77: 33 | E77: 0 | F77: 0 | G77: 0 | H77: 0,0 | I77: 2 | J77: 103070 | K77: 55 | L77: 0,1,7,44000;0,1,8,16000;0,1,4,88000; | M77: 主线-异变 | N77: 找到莫离
A78: 103070 | B78: 1 | C78: 1 | D78: 33 | E78: 0 | F78: 0 | G78: 23 | H78: 0,0 | I78: 2 | J78: 103071 | K78: 55 | L78: 0,1,7,44000;0,1,8,16000;0,1,4,88000; | M78: 主线-异变 | N78: 击败莫离
A79: 103071 | B79: 1 | C79: 2 | D79: 28 | E79: 0 | F79: 0 | G79: 0 | H79: 0,0 | I79: 2 | J79: 103072 | K79: 55 | L79: 0,1,7,44000;0,1,8,16000;0,1,4,88000; | M79: 主线-异变 | N79: 质问慕夕
A80: 103072 | B80: 1 | C80: 2 | D80: 504 | E80: 0 | F80: 0 | G80: 0 | H80: 0,0 | I80: 2 | J80: 103073 | K80: 55 | L80: 0,1,7,132000;0,1,8,16000;0,1,4,88000; | M80: 主线-异变 | N80: 毒仙子的忧心
A81: 103073 | B81: 1 | C81: 2 | D81: 25 | E81: 0 | F81: 0 | G81: 0 | H81: 0,0 | I81: 2 | J81: 103074 | K81: 55 | L81: 0,1,7,45000;0,1,8,18000;0,1,4,90000; | M81: 主线-异变 | N81: 向李世民复命
A82: 103074 | B82: 1 | C82: 2 | D82: 25 | E82: 1 | F82: 0 | G82: 0 | H82: 0,0 | I82: 2 | J82: 103075 | K82: 55 | L82: 0,1,7,45000;0,1,8,18000;0,1,4,90000; | M82: 主线-战事告急 | N82: 主动请缨
A83: 103075 | B83: 1 | C83: 1 | D83: 34 | E83: 1 | F83: 0 | G83: 24 | H83: 0,0 | I83: 2 | J83: 103076 | K83: 55 | L83: 0,1,7,135000;0,1,8,18000;0,1,4,90000; | M83: 主线-战事告急 | N83: 秦琼的疑惑
A84: 103076 | B84: 1 | C84: 2 | D84: 34 | E84: 0 | F84: 0 | G84: 0 | H84: 0,0 | I84: 2 | J84: 103077 | K84: 55 | L84: 0,1,7,45000;0,1,8,18000;0,1,4,90000; | M84: 主线-战事告急 | N84: 秦琼的赏识
A85: 103077 | B85: 1 | C85: 2 | D85: 35 | E85: 0 | F85: 0 | G85: 0 | H85: 0,0 | I85: 2 | J85: 103078 | K85: 55 | L85: 0,1,7,46000;0,1,8,18000;0,1,4,92000; | M85: 主线-战事告急 | N85: 前往报到
A86: 103078 | B86: 1 | C86: 1 | D86: 121 | E86: 1 | F86: 0 | G86: 25 | H86: 0,0 | I86: 2 | J86: 103079 | K86: 55 | L86: 0,1,7,138000;0,1,8,18000;0,1,4,92000; | M86: 主线-波斯阴谋 | N86: 击败扶桑军
A87: 103079 | B87: 1 | C87: 2 | D87: 121 | E87: 0 | F87: 0 | G87: 0 | H87: 0,0 | I87: 2 | J87: 103080 | K87: 55 | L87: 0,1,7,46000;0,1,8,18000;0,1,4,92000; | M87: 主线-波斯阴谋 | N87: 搜到一封扶桑密信
A88: 103080 | B88: 1 | C88: 2 | D88: 36 | E88: 1 | F88: 0 | G88: 0 | H88: 0,0 | I88: 2 | J88: 103081 | K88: 55 | L88: 0,1,7,46000;0,1,8,18000;0,1,4,92000; | M88: 主线-波斯阴谋 | N88: 与波斯巫师的对话
A89: 103081 | B89: 1 | C89: 1 | D89: 36 | E89: 1 | F89: 0 | G89: 26 | H89: 0,0 | I89: 2 | J89: 103082 | K89: 60 | L89: 0,1,7,46000;0,1,8,18000;0,1,4,92000; | M89: 主线-波斯阴谋 | N89: 击败波斯巫师
A90: 103082 | B90: 1 | C90: 2 | D90: 504 | E90: 0 | F90: 0 | G90: 0 | H90: 0,0 | I90: 2 | J90: 103083 | K90: 60 | L90: 0,1,7,46000;0,1,8,18000;0,1,4,92000; | M90: 主线-波斯阴谋 | N90: 毒仙子发话
A91: 103083 | B91: 1 | C91: 2 | D91: 504 | E91: 1 | F91: 0 | G91: 0 | H91: 0,0 | I91: 2 | J91: 103084 | K91: 60 | L91: 0,1,7,46000;0,1,8,18000;0,1,4,92000; | M91: 主线-波斯阴谋 | N91: 破坏阵基
A92: 103084 | B92: 1 | C92: 2 | D92: 35 | E92: 0 | F92: 0 | G92: 0 | H92: 0,0 | I92: 2 | J92: 103085 | K92: 60 | L92: 0,1,7,46000;0,1,8,18000;0,1,4,92000; | M92: 主线-波斯阴谋 | N92: 返回禀报军官
A93: 103085 | B93: 1 | C93: 2 | D93: 38 | E93: 0 | F93: 0 | G93: 0 | H93: 0,0 | I93: 2 | J93: 103086 | K93: 60 | L93: 0,1,7,47000;0,1,8,18000;0,1,4,94000; | M93: 主线-波斯阴谋 | N93: 面见李绩
A94: 103086 | B94: 1 | C94: 1 | D94: 39 | E94: 1 | F94: 0 | G94: 27 | H94: 0,0 | I94: 2 | J94: 103087 | K94: 60 | L94: 0,1,7,47000;0,1,8,18000;0,1,4,94000; | M94: 主线-波斯之乱 | N94: 埋伏的川吉将军
A95: 103087 | B95: 1 | C95: 2 | D95: 121 | E95: 0 | F95: 0 | G95: 0 | H95: 0,0 | I95: 2 | J95: 103088 | K95: 60 | L95: 0,1,7,47000;0,1,8,18000;0,1,4,94000; | M95: 主线-波斯之乱 | N95: 卓一平的计划
A96: 103088 | B96: 1 | C96: 2 | D96: 40 | E96: 1 | F96: 0 | G96: 0 | H96: 0,0 | I96: 2 | J96: 103089 | K96: 60 | L96: 0,1,7,47000;0,1,8,18000;0,1,4,94000; | M96: 主线-波斯之乱 | N96: 行脚商人的麻烦
A97: 103089 | B97: 1 | C97: 1 | D97: 41 | E97: 1 | F97: 0 | G97: 28 | H97: 0,0 | I97: 2 | J97: 103090 | K97: 60 | L97: 0,1,7,48000;0,1,8,18000;0,1,4,96000; | M97: 主线-波斯之乱 | N97: 教训王二狗
A98: 103090 | B98: 1 | C98: 2 | D98: 40 | E98: 0 | F98: 0 | G98: 0 | H98: 0,0 | I98: 2 | J98: 103091 | K98: 60 | L98: 0,1,7,48000;0,1,8,18000;0,1,4,96000; | M98: 主线-波斯之乱 | N98: 获得小路消息
A99: 103091 | B99: 1 | C99: 2 | D99: 121 | E99: 0 | F99: 0 | G99: 0 | H99: 0,0 | I99: 2 | J99: 103092 | K99: 60 | L99: 0,1,7,48000;0,1,8,18000;0,1,4,96000; | M99: 主线-波斯之乱 | N99: 卓一平的想法
A100: 103092 | B100: 1 | C100: 1 | D100: 42 | E100: 1 | F100: 0 | G100: 29 | H100: 0,0 | I100: 2 | J100: 103093 | K100: 60 | L100: 0,1,7,48000;0,1,8,18000;0,1,4,96000; | M100: 主线-波斯之乱 | N100: 击败巫族侍卫
A101: 103093 | B101: 1 | C101: 2 | D101: 43 | E101: 0 | F101: 0 | G101: 0 | H101: 0,0 | I101: 2 | J101: 104094 | K101: 65 | L101: 0,1,7,60000;0,1,8,24000;0,1,4,120000; | M101: 主线-波斯之乱 | N101: 被掳的士兵
A102: 104094 | B102: 1 | C102: 2 | D102: 44 | E102: 0 | F102: 0 | G102: 0 | H102: 0,0 | I102: 2 | J102: 104095 | K102: 65 | L102: 0,1,7,60000;0,1,8,24000;0,1,4,120000; | M102: 主线-波斯之乱 | N102: 波斯将军现身
A103: 104095 | B103: 1 | C103: 2 | D103: 44 | E103: 1 | F103: 0 | G103: 0 | H103: 0,0 | I103: 2 | J103: 104096 | K103: 65 | L103: 0,1,7,180000;0,1,8,24000;0,1,4,120000; | M103: 主线-波斯之乱 | N103: 狂傲波斯将军暴怒
A104: 104096 | B104: 1 | C104: 1 | D104: 45 | E104: 0 | F104: 0 | G104: 30 | H104: 0,0 | I104: 2 | J104: 104097 | K104: 65 | L104: 0,1,7,63000;0,1,8,24000;0,1,4,126000; | M104: 主线-波斯之乱 | N104: 夜无极的出现
A105: 104097 | B105: 1 | C105: 2 | D105: 121 | E105: 1 | F105: 0 | G105: 0 | H105: 0,0 | I105: 2 | J105: 104098 | K105: 65 | L105: 0,1,7,63000;0,1,8,24000;0,1,4,126000; | M105: 主线-波斯之乱 | N105: 卓一平的银剑
A106: 104098 | B106: 1 | C106: 2 | D106: 38 | E106: 1 | F106: 0 | G106: 0 | H106: 0,0 | I106: 2 | J106: 104099 | K106: 65 | L106: 0,1,7,204000;0,1,8,24000;0,1,4,136000; | M106: 主线-波斯之乱 | N106: 向李绩汇报
A107: 104099 | B107: 1 | C107: 2 | D107: 25 | E107: 0 | F107: 0 | G107: 0 | H107: 0,0 | I107: 2 | J107: 104100 | K107: 65 | L107: 0,1,7,68000;0,1,8,24000;0,1,4,136000; | M107: 主线-波斯之乱 | N107: 回京禀报
A108: 104100 | B108: 1 | C108: 1 | D108: 46 | E108: 0 | F108: 0 | G108: 31 | H108: 0,0 | I108: 2 | J108: 104101 | K108: 65 | L108: 0,1,7,219000;0,1,8,24000;0,1,4,146000; | M108: 主线-佛缘 | N108: 和尚拦住去路
A109: 104101 | B109: 1 | C109: 2 | D109: 48 | E109: 1 | F109: 0 | G109: 0 | H109: 0,0 | I109: 2 | J109: 104102 | K109: 65 | L109: 0,1,7,73000;0,1,8,24000;0,1,4,146000; | M109: 主线-佛缘 | N109: 寻找陈玄奘
A110: 104102 | B110: 1 | C110: 2 | D110: 48 | E110: 0 | F110: 0 | G110: 0 | H110: 0,0 | I110: 2 | J110: 104103 | K110: 65 | L110: 0,1,7,76000;0,1,8,24000;0,1,4,152000; | M110: 主线-佛缘 | N110: 与玄奘的对话
A111: 104103 | B111: 1 | C111: 2 | D111: 49 | E111: 0 | F111: 0 | G111: 0 | H111: 0,0 | I111: 2 | J111: 104104 | K111: 65 | L111: 0,1,7,76000;0,1,8,24000;0,1,4,152000; | M111: 主线-神祖血脉 | N111: 莫名其妙的持国天王
A112: 104104 | B112: 1 | C112: 1 | D112: 49 | E112: 1 | F112: 0 | G112: 32 | H112: 0,0 | I112: 2 | J112: 104105 | K112: 65 | L112: 0,1,7,76000;0,1,8,24000;0,1,4,152000; | M112: 主线-神祖血脉 | N112: 战胜持国天王
A113: 104105 | B113: 1 | C113: 2 | D113: 47 | E113: 1 | F113: 0 | G113: 0 | H113: 0,0 | I113: 2 | J113: 104106 | K113: 70 | L113: 0,1,7,231000;0,1,8,29000;0,1,4,304000; | M113: 主线-神祖血脉 | N113: 与太上老君的对话
A114: 104106 | B114: 1 | C114: 2 | D114: 47 | E114: 1 | F114: 0 | G114: 0 | H114: 0,0 | I114: 2 | J114: 104107 | K114: 70 | L114: 0,1,7,79000;0,1,8,30000;0,1,4,308000; | M114: 主线-神祖血脉 | N114: 继续与太上老君对话
A115: 104107 | B115: 1 | C115: 2 | D115: 50 | E115: 0 | F115: 0 | G115: 0 | H115: 0,0 | I115: 2 | J115: 104108 | K115: 70 | L115: 0,1,7,81000;0,1,8,35000;0,1,4,312000; | M115: 主线-追踪巫族 | N115: 协战仙子
A116: 104108 | B116: 1 | C116: 1 | D116: 51 | E116: 1 | F116: 0 | G116: 33 | H116: 0,0 | I116: 2 | J116: 104109 | K116: 70 | L116: 0,1,7,83000;0,1,8,40000;0,1,4,316000; | M116: 主线-追踪巫族 | N116: 击退虎怪
A117: 104109 | B117: 1 | C117: 2 | D117: 50 | E117: 1 | F117: 0 | G117: 0 | H117: 0,0 | I117: 2 | J117: 104110 | K117: 70 | L117: 0,1,7,259000;0,1,8,45000;0,1,4,320000; | M117: 主线-追踪巫族 | N117: 紫霞仙子受伤
A118: 104110 | B118: 1 | C118: 2 | D118: 52 | E118: 0 | F118: 0 | G118: 0 | H118: 0,0 | I118: 2 | J118: 104111 | K118: 70 | L118: 0,1,7,87000;0,1,8,50000;0,1,4,324000; | M118: 主线-追踪巫族 | N118: 与土地公对话
A119: 104111 | B119: 1 | C119: 1 | D119: 116 | E119: 1 | F119: 0 | G119: 34 | H119: 0,0 | I119: 2 | J119: 104112 | K119: 70 | L119: 0,1,7,89000;0,1,8,55000;0,1,4,328000; | M119: 主线-追踪巫族 | N119: 击败虎将军
A120: 104112 | B120: 1 | C120: 2 | D120: 116 | E120: 0 | F120: 0 | G120: 0 | H120: 0,0 | I120: 2 | J120: 104113 | K120: 70 | L120: 0,1,7,273000;0,1,8,60000;0,1,4,332000; | M120: 主线-追踪巫族 | N120: 拷问虎将军
A121: 104113 | B121: 1 | C121: 2 | D121: 116 | E121: 0 | F121: 0 | G121: 0 | H121: 0,0 | I121: 2 | J121: 104114 | K121: 70 | L121: 0,1,7,93000;0,1,8,65000;0,1,4,336000; | M121: 主线-追踪巫族 | N121: 巫妖是虎将军
A122: 104114 | B122: 1 | C122: 1 | D122: 53 | E122: 0 | F122: 0 | G122: 35 | H122: 0,0 | I122: 2 | J122: 104115 | K122: 70 | L122: 0,1,7,290000;0,1,8,70000;0,1,4,340000; | M122: 主线-追踪巫族 | N122: 击杀巫妖
A123: 104115 | B123: 1 | C123: 2 | D123: 54 | E123: 1 | F123: 0 | G123: 0 | H123: 0,0 | I123: 2 | J123: 104116 | K123: 70 | L123: 0,1,7,97000;0,1,8,75000;0,1,4,344000; | M123: 主线-追踪巫族 | N123: 嫦娥仙子降临
A124: 104116 | B124: 1 | C124: 2 | D124: 54 | E124: 0 | F124: 0 | G124: 0 | H124: 0,0 | I124: 2 | J124: 104117 | K124: 70 | L124: 0,1,7,99000;0,1,8,80000;0,1,4,348000; | M124: 主线-追踪巫族 | N124: 与嫦娥仙子的对话
A125: 104117 | B125: 1 | C125: 2 | D125: 55 | E125: 0 | F125: 0 | G125: 0 | H125: 0,0 | I125: 2 | J125: 104118 | K125: 75 | L125: 0,1,7,101000;0,1,8,85000;0,1,4,352000; | M125: 主线-童子事件 | N125: 村长的苦恼
A126: 104118 | B126: 1 | C126: 1 | D126: 56 | E126: 1 | F126: 0 | G126: 36 | H126: 0,0 | I126: 2 | J126: 104119 | K126: 75 | L126: 0,1,7,103000;0,1,8,90000;0,1,4,356000; | M126: 主线-童子事件 | N126: 击杀兔精
A127: 104119 | B127: 1 | C127: 2 | D127: 55 | E127: 0 | F127: 0 | G127: 0 | H127: 0,0 | I127: 2 | J127: 104120 | K127: 75 | L127: 0,1,7,321000;0,1,8,95000;0,1,4,360000; | M127: 主线-童子事件 | N127: 林村长很激动
A128: 104120 | B128: 1 | C128: 2 | D128: 52 | E128: 1 | F128: 0 | G128: 0 | H128: 0,0 | I128: 2 | J128: 104121 | K128: 75 | L128: 0,1,7,107000;0,1,8,100000;0,1,4,364000; | M128: 主线-童子事件 | N128: 找土地公问问
A129: 104121 | B129: 1 | C129: 2 | D129: 57 | E129: 0 | F129: 0 | G129: 0 | H129: 0,0 | I129: 2 | J129: 104122 | K129: 75 | L129: 0,1,7,110000;0,1,8,105000;0,1,4,368000; | M129: 主线-童子事件 | N129: 打败熊怪
A130: 104122 | B130: 1 | C130: 2 | D130: 58 | E130: 0 | F130: 0 | G130: 0 | H130: 0,0 | I130: 2 | J130: 104123 | K130: 75 | L130: 0,1,7,336000;0,1,8,110000;0,1,4,372000; | M130: 主线-童子事件 | N130: 与灵感大王的对话
A131: 104123 | B131: 1 | C131: 1 | D131: 58 | E131: 0 | F131: 0 | G131: 37 | H131: 0,0 | I131: 2 | J131: 104124 | K131: 75 | L131: 0,1,7,114000;0,1,8,115000;0,1,4,376000; | M131: 主线-童子事件 | N131: 激战灵感大王
A132: 104124 | B132: 1 | C132: 2 | D132: 59 | E132: 1 | F132: 0 | G132: 0 | H132: 0,0 | I132: 2 | J132: 104125 | K132: 75 | L132: 0,1,7,117000;0,1,8,120000;0,1,4,380000; | M132: 主线-童子事件 | N132: 找到林贝儿
A133: 104125 | B133: 1 | C133: 2 | D133: 52 | E133: 1 | F133: 0 | G133: 0 | H133: 0,0 | I133: 2 | J133: 104126 | K133: 75 | L133: 0,1,7,357000;0,1,8,125000;0,1,4,384000; | M133: 主线-童子事件 | N133: 与土地公对话
A134: 104126 | B134: 1 | C134: 2 | D134: 60 | E134: 1 | F134: 0 | G134: 0 | H134: 0,0 | I134: 2 | J134: 105127 | K134: 75 | L134: 0,1,7,182000;0,1,8,130000;0,1,4,388000; | M134: 主线-童子事件 | N134: 莫愁的愤怒
A135: 105127 | B135: 1 | C135: 1 | D135: 60 | E135: 0 | F135: 0 | G135: 38 | H135: 0,0 | I135: 2 | J135: 105128 | K135: 75 | L135: 0,1,7,561000;0,1,8,135000;0,1,4,392000; | M135: 主线-童子事件 | N135: 打败莫愁
A136: 105128 | B136: 1 | C136: 2 | D136: 61 | E136: 0 | F136: 0 | G136: 0 | H136: 0,0 | I136: 2 | J136: 105129 | K136: 75 | L136: 0,1,7,193000;0,1,8,140000;0,1,4,396000; | M136: 主线-童子事件 | N136: 找到黑袍人
A137: 105129 | B137: 1 | C137: 1 | D137: 61 | E137: 1 | F137: 0 | G137: 39 | H137: 0,0 | I137: 2 | J137: 105130 | K137: 80 | L137: 0,1,7,198000;0,1,8,145000;0,1,4,400000; | M137: 主线-童子事件 | N137: 打败黑袍人
A138: 105130 | B138: 1 | C138: 2 | D138: 62 | E138: 0 | F138: 0 | G138: 0 | H138: 0,0 | I138: 2 | J138: 105131 | K138: 80 | L138: 0,1,7,204000;0,1,8,150000;0,1,4,405000; | M138: 主线-童子事件 | N138: 傻笑的林宝儿
A139: 105131 | B139: 1 | C139: 2 | D139: 63 | E139: 0 | F139: 0 | G139: 0 | H139: 0,0 | I139: 2 | J139: 105132 | K139: 80 | L139: 0,1,7,627000;0,1,8,155000;0,1,4,410000; | M139: 主线-童子事件 | N139: 出现不明美男
A140: 105132 | B140: 1 | C140: 1 | D140: 63 | E140: 1 | F140: 0 | G140: 40 | H140: 0,0 | I140: 2 | J140: 105133 | K140: 80 | L140: 0,1,7,215000;0,1,8,160000;0,1,4,415000; | M140: 主线-童子事件 | N140: 击败不明美男
A141: 105133 | B141: 1 | C141: 2 | D141: 54 | E141: 0 | F141: 0 | G141: 0 | H141: 0,0 | I141: 2 | J141: 105134 | K141: 80 | L141: 0,1,7,221000;0,1,8,165000;0,1,4,420000; | M141: 主线-童子事件 | N141: 紫霞仙子点明真相
A142: 105134 | B142: 1 | C142: 2 | D142: 54 | E142: 1 | F142: 0 | G142: 0 | H142: 0,0 | I142: 2 | J142: 105135 | K142: 80 | L142: 0,1,7,687000;0,1,8,170000;0,1,4,425000; | M142: 主线-童子事件 | N142: 使用甘露
A143: 105135 | B143: 1 | C143: 2 | D143: 54 | E143: 0 | F143: 0 | G143: 0 | H143: 0,0 | I143: 2 | J143: 105136 | K143: 80 | L143: 0,1,7,232000;0,1,8,175000;0,1,4,430000; | M143: 主线-童子事件 | N143: 镇压寄生虫
A144: 105136 | B144: 1 | C144: 2 | D144: 54 | E144: 1 | F144: 0 | G144: 0 | H144: 0,0 | I144: 2 | J144: 105137 | K144: 80 | L144: 0,1,7,238000;0,1,8,180000;0,1,4,435000; | M144: 主线-童子事件 | N144: 紫霞仙子的来意
A145: 105137 | B145: 1 | C145: 2 | D145: 63 | E145: 0 | F145: 0 | G145: 0 | H145: 0,0 | I145: 2 | J145: 105138 | K145: 80 | L145: 0,1,7,244000;0,1,8,185000;0,1,4,440000; | M145: 主线-童子事件 | N145: 美男八戒有话说
A146: 105138 | B146: 1 | C146: 2 | D146: 64 | E146: 0 | F146: 0 | G146: 0 | H146: 0,0 | I146: 2 | J146: 105139 | K146: 80 | L146: 0,1,7,250000;0,1,8,190000;0,1,4,445000; | M146: 主线-童子事件 | N146: 白面狐狸拦路
A147: 105139 | B147: 1 | C147: 1 | D147: 64 | E147: 1 | F147: 0 | G147: 41 | H147: 0,0 | I147: 2 | J147: 105140 | K147: 80 | L147: 0,1,7,257000;0,1,8,195000;0,1,4,450000; | M147: 主线-童子事件 | N147: 击败白面狐狸
A148: 105140 | B148: 1 | C148: 2 | D148: 115 | E148: 0 | F148: 0 | G148: 0 | H148: 0,0 | I148: 2 | J148: 105141 | K148: 80 | L148: 0,1,7,789000;0,1,8,200000;0,1,4,455000; | M148: 主线-童子事件 | N148: 美男八戒的妙招
A149: 105141 | B149: 1 | C149: 2 | D149: 55 | E149: 1 | F149: 0 | G149: 0 | H149: 0,0 | I149: 2 | J149: 105142 | K149: 85 | L149: 0,1,7,269000;0,1,8,205000;0,1,4,460000; | M149: 主线-童子事件 | N149: 宝儿回家
A150: 105142 | B150: 1 | C150: 2 | D150: 64 | E150: 1 | F150: 0 | G150: 0 | H150: 0,0 | I150: 2 | J150: 105143 | K150: 85 | L150: 0,1,7,275000;0,1,8,210000;0,1,4,465000; | M150: 主线-童子事件 | N150: 追击白面狐狸
A151: 105143 | B151: 1 | C151: 2 | D151: 65 | E151: 0 | F151: 0 | G151: 0 | H151: 0,0 | I151: 2 | J151: 105144 | K151: 85 | L151: 0,1,7,282000;0,1,8,215000;0,1,4,470000; | M151: 主线-真相浮现 | N151: 避寒大王
A152: 105144 | B152: 1 | C152: 1 | D152: 65 | E152: 1 | F152: 0 | G152: 42 | H152: 0,0 | I152: 2 | J152: 105145 | K152: 85 | L152: 0,1,7,878000;0,1,8,220000;0,1,4,475000; | M152: 主线-真相浮现 | N152: 击败避寒大王
A153: 105145 | B153: 1 | C153: 2 | D153: 64 | E153: 1 | F153: 0 | G153: 0 | H153: 0,0 | I153: 2 | J153: 105146 | K153: 85 | L153: 0,1,7,295000;0,1,8,225000;0,1,4,480000; | M153: 主线-真相浮现 | N153: 白面狐狸的担忧
A154: 105146 | B154: 1 | C154: 2 | D154: 64 | E154: 0 | F154: 0 | G154: 0 | H154: 0,0 | I154: 2 | J154: 105147 | K154: 85 | L154: 0,1,7,301000;0,1,8,230000;0,1,4,485000; | M154: 主线-真相浮现 | N154: 白面的分析
A155: 105147 | B155: 1 | C155: 2 | D155: 64 | E155: 1 | F155: 0 | G155: 0 | H155: 0,0 | I155: 2 | J155: 106148 | K155: 85 | L155: 0,1,7,918000;0,1,8,235000;0,1,4,490000; | M155: 主线-真相浮现 | N155: 继续往前
A156: 106148 | B156: 1 | C156: 2 | D156: 123 | E156: 0 | F156: 0 | G156: 0 | H156: 0,0 | I156: 2 | J156: 106149 | K156: 85 | L156: 0,1,7,315000;0,1,8,240000;0,1,4,495000; | M156: 主线-真相浮现 | N156: 毒仙子有话说
A157: 106149 | B157: 1 | C157: 2 | D157: 66 | E157: 0 | F157: 0 | G157: 0 | H157: 0,0 | I157: 2 | J157: 106150 | K157: 85 | L157: 0,1,7,323000;0,1,8,245000;0,1,4,500000; | M157: 主线-真相浮现 | N157: 遭遇避暑大王
A158: 106150 | B158: 1 | C158: 1 | D158: 66 | E158: 1 | F158: 0 | G158: 43 | H158: 0,0 | I158: 2 | J158: 106151 | K158: 85 | L158: 0,1,7,329000;0,1,8,250000;0,1,4,510000; | M158: 主线-真相浮现 | N158: 击败避暑大王
A159: 106151 | B159: 1 | C159: 2 | D159: 115 | E159: 1 | F159: 0 | G159: 0 | H159: 0,0 | I159: 2 | J159: 106152 | K159: 85 | L159: 0,1,7,1008000;0,1,8,255000;0,1,4,520000; | M159: 主线-真相浮现 | N159: 美男八戒的提醒
A160: 106152 | B160: 1 | C160: 2 | D160: 64 | E160: 0 | F160: 0 | G160: 0 | H160: 0,0 | I160: 2 | J160: 106153 | K160: 85 | L160: 0,1,7,343000;0,1,8,260000;0,1,4,530000; | M160: 主线-真相浮现 | N160: 白面狐狸的狞笑
A161: 106153 | B161: 1 | C161: 1 | D161: 64 | E161: 1 | F161: 0 | G161: 44 | H161: 0,0 | I161: 2 | J161: 106154 | K161: 90 | L161: 0,1,7,350000;0,1,8,265000;0,1,4,540000; | M161: 主线-真相浮现 | N161: 击败白面狐狸
A162: 106154 | B162: 1 | C162: 2 | D162: 64 | E162: 1 | F162: 0 | G162: 0 | H162: 0,0 | I162: 2 | J162: 106155 | K162: 90 | L162: 0,1,7,357000;0,1,8,270000;0,1,4,550000; | M162: 主线-真相浮现 | N162: 净化白面狐狸
A163: 106155 | B163: 1 | C163: 2 | D163: 115 | E163: 0 | F163: 0 | G163: 0 | H163: 0,0 | I163: 2 | J163: 106156 | K163: 90 | L163: 0,1,7,365000;0,1,8,275000;0,1,4,560000; | M163: 主线-真相浮现 | N163: 美男八戒的建议
A164: 106156 | B164: 1 | C164: 1 | D164: 67 | E164: 1 | F164: 0 | G164: 45 | H164: 0,0 | I164: 2 | J164: 106157 | K164: 90 | L164: 0,1,7,1116000;0,1,8,280000;0,1,4,570000; | M164: 主线-昆仑危机 | N164: 花妖拦住去路
A165: 106157 | B165: 1 | C165: 2 | D165: 68 | E165: 0 | F165: 0 | G165: 0 | H165: 0,0 | I165: 2 | J165: 106158 | K165: 90 | L165: 0,1,7,380000;0,1,8,285000;0,1,4,580000; | M165: 主线-昆仑危机 | N165: 天雷道人
A166: 106158 | B166: 1 | C166: 2 | D166: 68 | E166: 0 | F166: 0 | G166: 0 | H166: 0,0 | I166: 2 | J166: 106159 | K166: 90 | L166: 0,1,7,387000;0,1,8,290000;0,1,4,590000; | M166: 主线-昆仑危机 | N166: 解开镇魔符
A167: 106159 | B167: 1 | C167: 2 | D167: 127 | E167: 0 | F167: 0 | G167: 0 | H167: 0,0 | I167: 2 | J167: 106160 | K167: 90 | L167: 0,1,7,396000;0,1,8,295000;0,1,4,600000; | M167: 主线-昆仑危机 | N167: 净化巫妖
A168: 106160 | B168: 1 | C168: 2 | D168: 68 | E168: 1 | F168: 0 | G168: 0 | H168: 0,0 | I168: 2 | J168: 106161 | K168: 90 | L168: 0,1,7,403000;0,1,8,300000;0,1,4,610000; | M168: 主线-昆仑危机 | N168: 分头行事
A169: 106161 | B169: 1 | C169: 1 | D169: 69 | E169: 1 | F169: 0 | G169: 46 | H169: 0,0 | I169: 2 | J169: 107162 | K169: 90 | L169: 0,1,7,411000;0,1,8,305000;0,1,4,620000; | M169: 主线-昆仑危机 | N169: 暴怒的白虎
A170: 107162 | B170: 1 | C170: 2 | D170: 69 | E170: 0 | F170: 0 | G170: 0 | H170: 0,0 | I170: 2 | J170: 107163 | K170: 90 | L170: 0,1,7,418000;0,1,8,310000;0,1,4,630000; | M170: 主线-昆仑危机 | N170: 安抚白虎
A171: 107163 | B171: 1 | C171: 2 | D171: 70 | E171: 0 | F171: 0 | G171: 0 | H171: 0,0 | I171: 2 | J171: 107164 | K171: 90 | L171: 0,1,7,426000;0,1,8,315000;0,1,4,640000; | M171: 主线-昆仑危机 | N171: 追踪小偷
A172: 107164 | B172: 1 | C172: 1 | D172: 70 | E172: 1 | F172: 0 | G172: 47 | H172: 0,0 | I172: 2 | J172: 107165 | K172: 90 | L172: 0,1,7,434000;0,1,8,320000;0,1,4,650000; | M172: 主线-昆仑危机 | N172: 击杀恶龙
A173: 107165 | B173: 1 | C173: 2 | D173: 126 | E173: 1 | F173: 0 | G173: 0 | H173: 0,0 | I173: 2 | J173: 107166 | K173: 95 | L173: 0,1,7,442000;0,1,8,325000;0,1,4,660000; | M173: 主线-昆仑危机 | N173: 老猪的猜测
A174: 107166 | B174: 1 | C174: 2 | D174: 69 | E174: 0 | F174: 0 | G174: 0 | H174: 0,0 | I174: 2 | J174: 107167 | K174: 95 | L174: 0,1,7,1353000;0,1,8,330000;0,1,4,670000; | M174: 主线-昆仑危机 | N174: 交还宝珠
A175: 107167 | B175: 1 | C175: 2 | D175: 71 | E175: 1 | F175: 0 | G175: 0 | H175: 0,0 | I175: 2 | J175: 107168 | K175: 95 | L175: 0,1,7,459000;0,1,8,335000;0,1,4,680000; | M175: 主线-昆仑危机 | N175: 天风道人
A176: 107168 | B176: 1 | C176: 1 | D176: 69 | E176: 0 | F176: 0 | G176: 48 | H176: 0,0 | I176: 2 | J176: 107169 | K176: 95 | L176: 0,1,7,467000;0,1,8,340000;0,1,4,690000; | M176: 主线-昆仑危机 | N176: 压制白虎
A177: 107169 | B177: 1 | C177: 2 | D177: 71 | E177: 1 | F177: 0 | G177: 0 | H177: 0,0 | I177: 2 | J177: 107170 | K177: 95 | L177: 0,1,7,476000;0,1,8,345000;0,1,4,700000; | M177: 主线-昆仑危机 | N177: 天风道人的办法
A178: 107170 | B178: 1 | C178: 2 | D178: 71 | E178: 0 | F178: 0 | G178: 0 | H178: 0,0 | I178: 2 | J178: 107171 | K178: 95 | L178: 0,1,7,484000;0,1,8,350000;0,1,4,710000; | M178: 主线-昆仑危机 | N178: 万年玄晶
A179: 107171 | B179: 1 | C179: 2 | D179: 72 | E179: 1 | F179: 0 | G179: 0 | H179: 0,0 | I179: 2 | J179: 107172 | K179: 95 | L179: 0,1,7,493000;0,1,8,355000;0,1,4,720000; | M179: 主线-昆仑危机 | N179: 凶灵现身
A180: 107172 | B180: 1 | C180: 1 | D180: 72 | E180: 1 | F180: 0 | G180: 49 | H180: 0,0 | I180: 2 | J180: 107173 | K180: 95 | L180: 0,1,7,501000;0,1,8,360000;0,1,4,730000; | M180: 主线-昆仑危机 | N180: 击败凶灵
A181: 107173 | B181: 1 | C181: 2 | D181: 69 | E181: 0 | F181: 0 | G181: 0 | H181: 0,0 | I181: 2 | J181: 107174 | K181: 95 | L181: 0,1,7,1530000;0,1,8,365000;0,1,4,740000; | M181: 主线-昆仑危机 | N181: 治疗白虎
A182: 107174 | B182: 1 | C182: 2 | D182: 68 | E182: 0 | F182: 0 | G182: 0 | H182: 0,0 | I182: 2 | J182: 107175 | K182: 95 | L182: 0,1,7,518000;0,1,8,370000;0,1,4,750000; | M182: 主线-昆仑危机 | N182: 天雷道人的麻烦
A183: 107175 | B183: 1 | C183: 1 | D183: 112 | E183: 1 | F183: 0 | G183: 50 | H183: 0,0 | I183: 2 | J183: 107176 | K183: 95 | L183: 0,1,7,527000;0,1,8,375000;0,1,4,760000; | M183: 主线-昆仑危机 | N183: 击杀万圣大王
A184: 107176 | B184: 1 | C184: 2 | D184: 68 | E184: 1 | F184: 0 | G184: 0 | H184: 0,0 | I184: 2 | J184: 107177 | K184: 95 | L184: 0,1,7,1608000;0,1,8,380000;0,1,4,770000; | M184: 主线-昆仑危机 | N184: 天雷道人再有麻烦
A185: 107177 | B185: 1 | C185: 2 | D185: 73 | E185: 1 | F185: 0 | G185: 0 | H185: 0,0 | I185: 2 | J185: 107178 | K185: 100 | L185: 0,1,7,545000;0,1,8,385000;0,1,4,780000; | M185: 主线-昆仑危机 | N185: 万圣公主的邀请
A186: 107178 | B186: 1 | C186: 1 | D186: 73 | E186: 2 | F186: 0 | G186: 51 | H186: 0,0 | I186: 2 | J186: 107179 | K186: 100 | L186: 0,1,7,554000;0,1,8,390000;0,1,4,790000; | M186: 主线-昆仑危机 | N186: 击杀万圣公主
A187: 107179 | B187: 1 | C187: 2 | D187: 126 | E187: 0 | F187: 0 | G187: 0 | H187: 0,0 | I187: 2 | J187: 107180 | K187: 100 | L187: 0,1,7,1732000;0,1,8,395000;0,1,4,800000; | M187: 主线-昆仑危机 | N187: 美男八戒有话要说
A188: 107180 | B188: 1 | C188: 1 | D188: 74 | E188: 1 | F188: 0 | G188: 52 | H188: 0,0 | I188: 2 | J188: 107181 | K188: 100 | L188: 0,1,7,573000;0,1,8,400000;0,1,4,810000; | M188: 主线-昆仑危机 | N188: 击败神宵道长心魔
A189: 107181 | B189: 1 | C189: 2 | D189: 74 | E189: 0 | F189: 0 | G189: 0 | H189: 0,0 | I189: 2 | J189: 107182 | K189: 100 | L189: 0,1,7,582000;0,1,8,405000;0,1,4,820000; | M189: 主线-昆仑危机 | N189: 道长突变的缘由
A190: 107182 | B190: 1 | C190: 2 | D190: 75 | E190: 0 | F190: 0 | G190: 0 | H190: 0,0 | I190: 2 | J190: 107183 | K190: 100 | L190: 0,1,7,591000;0,1,8,410000;0,1,4,830000; | M190: 主线-昆仑危机 | N190: 恶龙又出现
A191: 107183 | B191: 1 | C191: 1 | D191: 75 | E191: 0 | F191: 0 | G191: 53 | H191: 0,0 | I191: 2 | J191: 107184 | K191: 100 | L191: 0,1,7,601000;0,1,8,415000;0,1,4,840000; | M191: 主线-昆仑危机 | N191: 击败恶龙乙
A192: 107184 | B192: 1 | C192: 2 | D192: 74 | E192: 2 | F192: 0 | G192: 0 | H192: 0,0 | I192: 2 | J192: 107185 | K192: 100 | L192: 0,1,7,1877000;0,1,8,420000;0,1,4,850000; | M192: 主线-昆仑危机 | N192: 神宵道长的演算
A193: 107185 | B193: 1 | C193: 2 | D193: 132 | E193: 0 | F193: 0 | G193: 0 | H193: 0,0 | I193: 2 | J193: 107186 | K193: 100 | L193: 0,1,7,620000;0,1,8,425000;0,1,4,860000; | M193: 主线-巫族阴谋 | N193: 老君忽降临昆仑山
A194: 107186 | B194: 1 | C194: 2 | D194: 132 | E194: 1 | F194: 0 | G194: 0 | H194: 0,0 | I194: 2 | J194: 107187 | K194: 100 | L194: 0,1,7,630000;0,1,8,430000;0,1,4,870000; | M194: 主线-解救青龙 | N194: 青龙的行踪
A195: 107187 | B195: 1 | C195: 2 | D195: 132 | E195: 0 | F195: 0 | G195: 0 | H195: 0,0 | I195: 2 | J195: 107188 | K195: 100 | L195: 0,1,7,1917000;0,1,8,435000;0,1,4,880000; | M195: 主线-解救青龙 | N195: 前往了解情况
A196: 107188 | B196: 1 | C196: 2 | D196: 76 | E196: 0 | F196: 0 | G196: 0 | H196: 0,0 | I196: 2 | J196: 107189 | K196: 100 | L196: 0,1,7,649000;0,1,8,440000;0,1,4,890000; | M196: 主线-解救青龙 | N196: 山中出现妖踪
A197: 107189 | B197: 1 | C197: 1 | D197: 76 | E197: 0 | F197: 0 | G197: 54 | H197: 0,0 | I197: 2 | J197: 107190 | K197: 100 | L197: 0,1,7,649000;0,1,8,440000;0,1,4,890000; | M197: 主线-解救青龙 | N197: 击杀封山小妖
A198: 107190 | B198: 1 | C198: 2 | D198: 133 | E198: 0 | F198: 0 | G198: 0 | H198: 0,0 | I198: 2 | J198: 107191 | K198: 100 | L198: 0,1,7,649000;0,1,8,440000;0,1,4,890000; | M198: 主线-解救青龙 | N198: 封山大阵的解法
A199: 107191 | B199: 1 | C199: 2 | D199: 133 | E199: 0 | F199: 0 | G199: 0 | H199: 0,0 | I199: 2 | J199: 107192 | K199: 100 | L199: 0,1,7,649000;0,1,8,440000;0,1,4,890000; | M199: 主线-解救青龙 | N199: 灵符引阵灵一
A200: 107192 | B200: 1 | C200: 1 | D200: 133 | E200: 0 | F200: 0 | G200: 55 | H200: 0,0 | I200: 2 | J200: 107193 | K200: 100 | L200: 0,1,7,649000;0,1,8,440000;0,1,4,890000; | M200: 主线-解救青龙 | N200: 斩杀毒尸阵灵一
A201: 107193 | B201: 1 | C201: 2 | D201: 133 | E201: 1 | F201: 0 | G201: 0 | H201: 0,0 | I201: 2 | J201: 107194 | K201: 100 | L201: 0,1,7,649000;0,1,8,440000;0,1,4,890000; | M201: 主线-解救青龙 | N201: 灵符引阵灵二
A202: 107194 | B202: 1 | C202: 1 | D202: 133 | E202: 0 | F202: 0 | G202: 56 | H202: 0,0 | I202: 2 | J202: 107195 | K202: 100 | L202: 0,1,7,649000;0,1,8,440000;0,1,4,890000; | M202: 主线-解救青龙 | N202: 斩杀毒尸阵灵二
A203: 107195 | B203: 1 | C203: 2 | D203: 133 | E203: 0 | F203: 0 | G203: 0 | H203: 0,0 | I203: 2 | J203: 107196 | K203: 100 | L203: 0,1,7,649000;0,1,8,440000;0,1,4,890000; | M203: 主线-解救青龙 | N203: 灵符引阵灵三
A204: 107196 | B204: 1 | C204: 1 | D204: 133 | E204: 1 | F204: 0 | G204: 57 | H204: 0,0 | I204: 2 | J204: 107197 | K204: 100 | L204: 0,1,7,649000;0,1,8,440000;0,1,4,890000; | M204: 主线-解救青龙 | N204: 斩杀毒尸阵灵三
A205: 107197 | B205: 1 | C205: 2 | D205: 133 | E205: 1 | F205: 0 | G205: 0 | H205: 0,0 | I205: 2 | J205: 107198 | K205: 100 | L205: 0,1,7,649000;0,1,8,440000;0,1,4,890000; | M205: 主线-解救青龙 | N205: 解除危机
A206: 107198 | B206: 1 | C206: 2 | D206: 133 | E206: 0 | F206: 0 | G206: 0 | H206: 0,0 | I206: 2 | J206: 107199 | K206: 100 | L206: 0,1,7,649000;0,1,8,440000;0,1,4,890000; | M206: 主线-解救青龙 | N206: 传音东海
A207: 107199 | B207: 1 | C207: 2 | D207: 77 | E207: 1 | F207: 0 | G207: 0 | H207: 0,0 | I207: 2 | J207: 107200 | K207: 100 | L207: 0,1,7,649000;0,1,8,440000;0,1,4,890000; | M207: 主线-解救青龙 | N207: 求援东海
A208: 107200 | B208: 1 | C208: 1 | D208: 78 | E208: 1 | F208: 0 | G208: 58 | H208: 0,0 | I208: 2 | J208: 107201 | K208: 100 | L208: 0,1,7,649000;0,1,8,440000;0,1,4,890000; | M208: 主线-解救青龙 | N208: 斩杀玉面狐狸
A209: 107201 | B209: 1 | C209: 2 | D209: 79 | E209: 0 | F209: 0 | G209: 0 | H209: 0,0 | I209: 2 | J209: 107202 | K209: 100 | L209: 0,1,7,649000;0,1,8,440000;0,1,4,890000; | M209: 主线-解救青龙 | N209: 山寨情况
A210: 107202 | B210: 1 | C210: 2 | D210: 80 | E210: 0 | F210: 0 | G210: 0 | H210: 0,0 | I210: 2 | J210: 107203 | K210: 100 | L210: 0,1,7,649000;0,1,8,440000;0,1,4,890000; | M210: 主线-解救青龙 | N210: 红孩儿来袭
A211: 107203 | B211: 1 | C211: 1 | D211: 80 | E211: 1 | F211: 0 | G211: 59 | H211: 0,0 | I211: 2 | J211: 107204 | K211: 100 | L211: 0,1,7,649000;0,1,8,440000;0,1,4,890000; | M211: 主线-解救青龙 | N211: 斩杀红孩儿
A212: 107204 | B212: 1 | C212: 2 | D212: 81 | E212: 1 | F212: 0 | G212: 0 | H212: 0,0 | I212: 2 | J212: 107205 | K212: 100 | L212: 0,1,7,649000;0,1,8,440000;0,1,4,890000; | M212: 主线-解救青龙 | N212: 东海援兵到
A213: 107205 | B213: 1 | C213: 2 | D213: 83 | E213: 0 | F213: 0 | G213: 0 | H213: 0,0 | I213: 2 | J213: 107206 | K213: 100 | L213: 0,1,7,649000;0,1,8,440000;0,1,4,890000; | M213: 主线-解救青龙 | N213: 铁扇公主的执念
A214: 107206 | B214: 1 | C214: 1 | D214: 83 | E214: 0 | F214: 0 | G214: 60 | H214: 0,0 | I214: 2 | J214: 107207 | K214: 100 | L214: 0,1,7,649000;0,1,8,440000;0,1,4,890000; | M214: 主线-解救青龙 | N214: 斩杀铁扇公主
A215: 107207 | B215: 1 | C215: 2 | D215: 133 | E215: 1 | F215: 0 | G215: 0 | H215: 0,0 | I215: 2 | J215: 107208 | K215: 100 | L215: 0,1,7,649000;0,1,8,440000;0,1,4,890000; | M215: 主线-解救青龙 | N215: 解救青龙
A216: 107208 | B216: 1 | C216: 2 | D216: 84 | E216: 0 | F216: 0 | G216: 0 | H216: 0,0 | I216: 2 | J216: 0 | K216: 100 | L216: 0,1,7,649000;0,1,8,440000;0,1,4,890000; | M216: 主线-解救青龙 | N216: 青龙嘱托
A217: 201001 | B217: 2 | C217: 2 | D217: 7 | E217: 0 | F217: 0 | G217: 0 | H217: 0,0 | I217: 2 | J217: 201002 | K217: 25 | L217: 0,1,7,2200;0,1,8,1100;0,1,4,5000; | M217: 支线-剑客的剑 | N217: 看看剑客为何发呆
A218: 201002 | B218: 2 | C218: 1 | D218: 200 | E218: 1 | F218: 0 | G218: 210 | H218: 0,0 | I218: 2 | J218: 201003 | K218: 25 | L218: 0,1,7,2200;0,1,8,1100;0,1,4,5000; | M218: 支线-剑客的剑 | N218: 拦住前面的小妖
A219: 201003 | B219: 2 | C219: 2 | D219: 7 | E219: 1 | F219: 0 | G219: 0 | H219: 0,0 | I219: 2 | J219: 201004 | K219: 25 | L219: 0,1,7,2200;0,1,8,1100;0,1,4,5000; | M219: 支线-剑客的剑 | N219: 继续追问剑客
A220: 201004 | B220: 2 | C220: 2 | D220: 502 | E220: 0 | F220: 0 | G220: 0 | H220: 0,0 | I220: 2 | J220: 201005 | K220: 25 | L220: 0,1,7,2200;0,1,8,1100;0,1,4,5000; | M220: 支线-剑客的剑 | N220: 前往天策府门外
A221: 201005 | B221: 2 | C221: 1 | D221: 502 | E221: 1 | F221: 0 | G221: 211 | H221: 0,0 | I221: 2 | J221: 201006 | K221: 25 | L221: 0,1,7,2200;0,1,8,1100;0,1,4,5000; | M221: 支线-剑客的剑 | N221: 打晕天策府护卫
A222: 201006 | B222: 2 | C222: 2 | D222: 502 | E222: 1 | F222: 0 | G222: 0 | H222: 0,0 | I222: 2 | J222: 201007 | K222: 30 | L222: 0,1,7,2200;0,1,8,1100;0,1,4,5000; | M222: 支线-剑客的剑 | N222: 原来剑客又在吹牛
A223: 201007 | B223: 2 | C223: 2 | D223: 202 | E223: 0 | F223: 0 | G223: 0 | H223: 0,0 | I223: 2 | J223: 201008 | K223: 30 | L223: 0,1,7,2200;0,1,8,1100;0,1,4,5000; | M223: 支线-剑客的剑 | N223: 问出大师兄的下落
A224: 201008 | B224: 2 | C224: 2 | D224: 502 | E224: 0 | F224: 0 | G224: 0 | H224: 0,0 | I224: 2 | J224: 201009 | K224: 30 | L224: 0,1,7,2200;0,1,8,1100;0,1,4,5000; | M224: 支线-剑客的剑 | N224: 与剑客前往四平巷
A225: 201009 | B225: 2 | C225: 2 | D225: 203 | E225: 1 | F225: 0 | G225: 0 | H225: 0,0 | I225: 2 | J225: 201010 | K225: 30 | L225: 0,1,7,2200;0,1,8,1100;0,1,4,5000; | M225: 支线-剑客的剑 | N225: 几名巡兵围了过来
A226: 201010 | B226: 2 | C226: 1 | D226: 203 | E226: 0 | F226: 0 | G226: 212 | H226: 0,0 | I226: 2 | J226: 201011 | K226: 30 | L226: 0,1,7,2200;0,1,8,1100;0,1,4,5000; | M226: 支线-剑客的剑 | N226: 打退巡兵
A227: 201011 | B227: 2 | C227: 2 | D227: 203 | E227: 1 | F227: 0 | G227: 0 | H227: 0,0 | I227: 2 | J227: 201012 | K227: 35 | L227: 0,1,7,2200;0,1,8,1100;0,1,4,5000; | M227: 支线-剑客的剑 | N227: 巡兵求饶
A228: 201012 | B228: 2 | C228: 2 | D228: 203 | E228: 0 | F228: 0 | G228: 0 | H228: 0,0 | I228: 2 | J228: 201013 | K228: 35 | L228: 0,1,7,2200;0,1,8,1100;0,1,4,5000; | M228: 支线-剑客的剑 | N228: 训话巡兵
A229: 201013 | B229: 2 | C229: 2 | D229: 502 | E229: 0 | F229: 0 | G229: 0 | H229: 0,0 | I229: 2 | J229: 201014 | K229: 35 | L229: 0,1,7,5000;0,1,8,2500;0,1,4,10000; | M229: 支线-剑客的剑 | N229: 出去喊剑客进来
A230: 201014 | B230: 2 | C230: 1 | D230: 204 | E230: 1 | F230: 0 | G230: 213 | H230: 0,0 | I230: 2 | J230: 201015 | K230: 35 | L230: 0,1,7,5000;0,1,8,2500;0,1,4,10000; | M230: 支线-剑客的剑 | N230: 打退庞府家丁
A231: 201015 | B231: 2 | C231: 2 | D231: 502 | E231: 1 | F231: 0 | G231: 0 | H231: 0,0 | I231: 2 | J231: 201016 | K231: 35 | L231: 0,1,7,5000;0,1,8,2500;0,1,4,10000; | M231: 支线-剑客的剑 | N231: 说服剑客跟你进去
A232: 201016 | B232: 2 | C232: 2 | D232: 205 | E232: 0 | F232: 0 | G232: 0 | H232: 0,0 | I232: 2 | J232: 201017 | K232: 40 | L232: 0,1,7,5000;0,1,8,2500;0,1,4,10000; | M232: 支线-剑客的剑 | N232: 带剑客进入庭院
A233: 201017 | B233: 2 | C233: 2 | D233: 206 | E233: 1 | F233: 0 | G233: 0 | H233: 0,0 | I233: 2 | J233: 201018 | K233: 40 | L233: 0,1,7,5000;0,1,8,2500;0,1,4,10000; | M233: 支线-剑客的剑 | N233: 大师兄要过上两招
A234: 201018 | B234: 2 | C234: 1 | D234: 206 | E234: 0 | F234: 0 | G234: 214 | H234: 0,0 | I234: 2 | J234: 201019 | K234: 40 | L234: 0,1,7,5000;0,1,8,2500;0,1,4,10000; | M234: 支线-剑客的剑 | N234: 到庭院大战
A235: 201019 | B235: 2 | C235: 2 | D235: 205 | E235: 0 | F235: 0 | G235: 0 | H235: 0,0 | I235: 2 | J235: 201020 | K235: 40 | L235: 0,1,7,5000;0,1,8,2500;0,1,4,10000; | M235: 支线-剑客的剑 | N235: 向陆夫人问些事情
A236: 201020 | B236: 2 | C236: 1 | D236: 206 | E236: 2 | F236: 0 | G236: 215 | H236: 0,0 | I236: 2 | J236: 201021 | K236: 40 | L236: 0,1,7,5000;0,1,8,2500;0,1,4,10000; | M236: 支线-剑客的剑 | N236: 与剑客并肩一战
A237: 201021 | B237: 2 | C237: 2 | D237: 502 | E237: 0 | F237: 0 | G237: 0 | H237: 0,0 | I237: 2 | J237: 201022 | K237: 40 | L237: 0,1,7,5000;0,1,8,2500;0,1,4,10000; | M237: 支线-剑客的剑 | N237: 带剑客离开这里
A238: 201022 | B238: 2 | C238: 2 | D238: 502 | E238: 0 | F238: 0 | G238: 0 | H238: 0,0 | I238: 2 | J238: 201023 | K238: 45 | L238: 0,1,7,8000;0,1,8,4000;0,1,4,20000; | M238: 支线-剑客的剑 | N238: 查看剑客的伤势
A239: 201023 | B239: 2 | C239: 2 | D239: 23 | E239: 0 | F239: 0 | G239: 0 | H239: 0,0 | I239: 2 | J239: 201024 | K239: 45 | L239: 0,1,7,10000;0,1,8,5000;0,1,4,20000; | M239: 支线-剑客的剑 | N239: 为剑客买些止血散
A240: 201024 | B240: 2 | C240: 2 | D240: 207 | E240: 1 | F240: 0 | G240: 0 | H240: 0,0 | I240: 2 | J240: 201025 | K240: 45 | L240: 0,1,7,10000;0,1,8,5000;0,1,4,20000; | M240: 支线-剑客的剑 | N240: 剑客不知去了哪里
A241: 201025 | B241: 2 | C241: 2 | D241: 208 | E241: 2 | F241: 0 | G241: 0 | H241: 0,0 | I241: 2 | J241: 201026 | K241: 45 | L241: 0,1,7,10000;0,1,8,5000;0,1,4,20000; | M241: 支线-剑客的剑 | N241: 向仙子询问剑客下落
A242: 201026 | B242: 2 | C242: 2 | D242: 209 | E242: 0 | F242: 0 | G242: 0 | H242: 0,0 | I242: 2 | J242: 201027 | K242: 45 | L242: 0,1,7,10000;0,1,8,5000;0,1,4,20000; | M242: 支线-剑客的剑 | N242: 去醉仙楼买年糕
A243: 201027 | B243: 2 | C243: 1 | D243: 209 | E243: 0 | F243: 0 | G243: 216 | H243: 0,0 | I243: 2 | J243: 201028 | K243: 45 | L243: 0,1,7,10000;0,1,8,5000;0,1,4,20000; | M243: 支线-剑客的剑 | N243: 一块年糕引发的血案
A244: 201028 | B244: 2 | C244: 2 | D244: 208 | E244: 1 | F244: 0 | G244: 0 | H244: 0,0 | I244: 2 | J244: 201029 | K244: 50 | L244: 0,1,7,10000;0,1,8,5000;0,1,4,20000; | M244: 支线-剑客的剑 | N244: 将年糕带给百花仙子
A245: 201029 | B245: 2 | C245: 2 | D245: 502 | E245: 0 | F245: 0 | G245: 0 | H245: 0,0 | I245: 2 | J245: 201030 | K245: 50 | L245: 0,1,7,10000;0,1,8,5000;0,1,4,20000; | M245: 支线-剑客的剑 | N245: 寻找剑客
A246: 201030 | B246: 2 | C246: 2 | D246: 502 | E246: 0 | F246: 0 | G246: 0 | H246: 0,0 | I246: 2 | J246: 201031 | K246: 50 | L246: 0,1,7,10000;0,1,8,5000;0,1,4,20000; | M246: 支线-剑客的剑 | N246: 将铁剑抛入河中
A247: 201031 | B247: 2 | C247: 2 | D247: 502 | E247: 0 | F247: 0 | G247: 0 | H247: 0,0 | I247: 2 | J247: 201032 | K247: 50 | L247: 0,1,7,15000;0,1,8,9000;0,1,4,30000; | M247: 支线-剑客的剑 | N247: 回到剑客那里
A248: 201032 | B248: 2 | C248: 2 | D248: 300 | E248: 1 | F248: 0 | G248: 0 | H248: 0,0 | I248: 2 | J248: 201033 | K248: 50 | L248: 0,1,7,15000;0,1,8,9000;0,1,4,30000; | M248: 支线-龙女托书 | N248: 路遇一位落榜书生
A249: 201033 | B249: 2 | C249: 2 | D249: 300 | E249: 0 | F249: 0 | G249: 0 | H249: 0,0 | I249: 2 | J249: 201034 | K249: 50 | L249: 0,1,7,15000;0,1,8,9000;0,1,4,30000; | M249: 支线-龙女托书 | N249: 继续和书生聊聊
A250: 201034 | B250: 2 | C250: 2 | D250: 300 | E250: 0 | F250: 0 | G250: 0 | H250: 0,0 | I250: 2 | J250: 201035 | K250: 50 | L250: 0,1,7,15000;0,1,8,9000;0,1,4,30000; | M250: 支线-龙女托书 | N250: 和书生一同商量
A251: 201035 | B251: 2 | C251: 1 | D251: 302 | E251: 1 | F251: 0 | G251: 217 | H251: 0,0 | I251: 2 | J251: 201036 | K251: 50 | L251: 0,1,7,45000;0,1,8,9000;0,1,4,30000; | M251: 支线-龙女托书 | N251: 同书生一同前往泾川
A252: 201036 | B252: 2 | C252: 2 | D252: 503 | E252: 0 | F252: 0 | G252: 0 | H252: 0,0 | I252: 2 | J252: 201037 | K252: 50 | L252: 0,1,7,15000;0,1,8,9000;0,1,4,30000; | M252: 支线-龙女托书 | N252: 书生似乎有些担忧
A253: 201037 | B253: 2 | C253: 2 | D253: 301 | E253: 0 | F253: 0 | G253: 0 | H253: 0,0 | I253: 2 | J253: 201038 | K253: 50 | L253: 0,1,7,15000;0,1,8,9000;0,1,4,30000; | M253: 支线-龙女托书 | N253: 问问发生了什么事
A254: 201038 | B254: 2 | C254: 1 | D254: 303 | E254: 0 | F254: 0 | G254: 218 | H254: 0,0 | I254: 2 | J254: 201039 | K254: 55 | L254: 0,1,7,15000;0,1,8,9000;0,1,4,30000; | M254: 支线-龙女托书 | N254: 众虾兵喊来了镇海将军
A255: 201039 | B255: 2 | C255: 2 | D255: 301 | E255: 1 | F255: 0 | G255: 0 | H255: 0,0 | I255: 2 | J255: 201040 | K255: 55 | L255: 0,1,7,20000;0,1,8,10000;0,1,4,36000; | M255: 支线-龙女托书 | N255: 龙女托你们代为传信
A256: 201040 | B256: 2 | C256: 2 | D256: 503 | E256: 0 | F256: 0 | G256: 0 | H256: 0,0 | I256: 2 | J256: 201041 | K256: 55 | L256: 0,1,7,20000;0,1,8,10000;0,1,4,36000; | M256: 支线-龙女托书 | N256: 找到洞庭南岸的大树
A257: 201041 | B257: 2 | C257: 2 | D257: 503 | E257: 2 | F257: 0 | G257: 0 | H257: 0,0 | I257: 2 | J257: 201042 | K257: 55 | L257: 0,1,7,60000;0,1,8,10000;0,1,4,36000; | M257: 支线-龙女托书 | N257: 将玉佩挂在树上
A258: 201042 | B258: 2 | C258: 1 | D258: 304 | E258: 0 | F258: 0 | G258: 219 | H258: 0,0 | I258: 2 | J258: 201043 | K258: 55 | L258: 0,1,7,20000;0,1,8,10000;0,1,4,36000; | M258: 支线-龙女托书 | N258: 洞庭水兵误会了你们
A259: 201043 | B259: 2 | C259: 2 | D259: 503 | E259: 1 | F259: 0 | G259: 0 | H259: 0,0 | I259: 2 | J259: 201044 | K259: 55 | L259: 0,1,7,20000;0,1,8,10000;0,1,4,36000; | M259: 支线-龙女托书 | N259: 书生赶忙表明来意
A260: 201044 | B260: 2 | C260: 2 | D260: 305 | E260: 1 | F260: 0 | G260: 0 | H260: 0,0 | I260: 2 | J260: 201045 | K260: 55 | L260: 0,1,7,60000;0,1,8,10000;0,1,4,36000; | M260: 支线-龙女托书 | N260: 将龙女之事禀明龙君
A261: 201045 | B261: 2 | C261: 1 | D261: 306 | E261: 0 | F261: 0 | G261: 220 | H261: 0,0 | I261: 2 | J261: 201046 | K261: 55 | L261: 0,1,7,20000;0,1,8,10000;0,1,4,36000; | M261: 支线-龙女托书 | N261: 天上出现了巨龙身影
A262: 201046 | B262: 2 | C262: 2 | D262: 306 | E262: 0 | F262: 0 | G262: 0 | H262: 0,0 | I262: 2 | J262: 201047 | K262: 55 | L262: 0,1,7,20000;0,1,8,10000;0,1,4,36000; | M262: 支线-龙女托书 | N262: 钱塘君仍然十分傲慢
A263: 201047 | B263: 2 | C263: 2 | D263: 305 | E263: 1 | F263: 0 | G263: 0 | H263: 0,0 | I263: 2 | J263: 201048 | K263: 55 | L263: 0,1,7,23000;0,1,8,8000;0,1,4,46000; | M263: 支线-龙女托书 | N263: 龙君似乎有话要讲
A264: 201048 | B264: 2 | C264: 2 | D264: 301 | E264: 2 | F264: 0 | G264: 0 | H264: 0,0 | I264: 2 | J264: 201049 | K264: 60 | L264: 0,1,7,69000;0,1,8,8000;0,1,4,46000; | M264: 支线-龙女托书 | N264: 与书生回到泾川
A265: 201049 | B265: 2 | C265: 1 | D265: 303 | E265: 0 | F265: 0 | G265: 221 | H265: 0,0 | I265: 2 | J265: 201050 | K265: 60 | L265: 0,1,7,23000;0,1,8,8000;0,1,4,46000; | M265: 支线-龙女托书 | N265: 赶往泾川龙宫
A266: 201050 | B266: 2 | C266: 2 | D266: 306 | E266: 0 | F266: 0 | G266: 0 | H266: 0,0 | I266: 2 | J266: 201051 | K266: 60 | L266: 0,1,7,24000;0,1,8,8000;0,1,4,48000; | M266: 支线-龙女托书 | N266: 劝阻钱塘君
A267: 201051 | B267: 2 | C267: 2 | D267: 307 | E267: 0 | F267: 0 | G267: 0 | H267: 0,0 | I267: 2 | J267: 201052 | K267: 60 | L267: 0,1,7,24000;0,1,8,8000;0,1,4,48000; | M267: 支线-龙女托书 | N267: 眼前便是龙女的夫君
A268: 201052 | B268: 2 | C268: 1 | D268: 306 | E268: 0 | F268: 0 | G268: 222 | H268: 0,0 | I268: 2 | J268: 201053 | K268: 60 | L268: 0,1,7,24000;0,1,8,8000;0,1,4,48000; | M268: 支线-龙女托书 | N268: 在两人之间煽风点火
A269: 201053 | B269: 2 | C269: 2 | D269: 307 | E269: 1 | F269: 0 | G269: 0 | H269: 0,0 | I269: 2 | J269: 201054 | K269: 60 | L269: 0,1,7,24000;0,1,8,8000;0,1,4,48000; | M269: 支线-龙女托书 | N269: 听听泾阳君说些什么
A270: 201054 | B270: 2 | C270: 2 | D270: 308 | E270: 0 | F270: 0 | G270: 0 | H270: 0,0 | I270: 2 | J270: 201055 | K270: 60 | L270: 0,1,7,24000;0,1,8,8000;0,1,4,48000; | M270: 支线-龙女托书 | N270: 终于见到泾川老龙君
A271: 201055 | B271: 2 | C271: 2 | D271: 306 | E271: 1 | F271: 0 | G271: 0 | H271: 0,0 | I271: 2 | J271: 201056 | K271: 60 | L271: 0,1,7,25000;0,1,8,10000;0,1,4,50000; | M271: 支线-龙女托书 | N271: 劝钱塘君刀下留人
A272: 201056 | B272: 2 | C272: 2 | D272: 306 | E272: 1 | F272: 0 | G272: 0 | H272: 0,0 | I272: 2 | J272: 201057 | K272: 60 | L272: 0,1,7,25000;0,1,8,10000;0,1,4,50000; | M272: 支线-龙女托书 | N272: 到头来白忙一场
A273: 201057 | B273: 2 | C273: 2 | D273: 1 | E273: 0 | F273: 0 | G273: 0 | H273: 0,0 | I273: 2 | J273: 201058 | K273: 60 | L273: 0,1,7,25000;0,1,8,10000;0,1,4,50000; | M273: 支线-先天秘谱 | N273: 回到师门拜见师父
A274: 201058 | B274: 2 | C274: 1 | D274: 401 | E274: 0 | F274: 0 | G274: 223 | H274: 0,0 | I274: 2 | J274: 201059 | K274: 65 | L274: 0,1,7,25000;0,1,8,10000;0,1,4,50000; | M274: 支线-先天秘谱 | N274: 与首席弟子切磋
A275: 201059 | B275: 2 | C275: 2 | D275: 1 | E275: 0 | F275: 0 | G275: 0 | H275: 0,0 | I275: 2 | J275: 201060 | K275: 65 | L275: 0,1,7,25000;0,1,8,10000;0,1,4,50000; | M275: 支线-先天秘谱 | N275: 回见师父
A276: 201060 | B276: 2 | C276: 2 | D276: 1 | E276: 0 | F276: 0 | G276: 0 | H276: 0,0 | I276: 2 | J276: 201061 | K276: 65 | L276: 0,1,7,26000;0,1,8,10000;0,1,4,52000; | M276: 支线-先天秘谱 | N276: 继续听师父训话
A277: 201061 | B277: 2 | C277: 2 | D277: 402 | E277: 0 | F277: 0 | G277: 0 | H277: 0,0 | I277: 2 | J277: 201062 | K277: 65 | L277: 0,1,7,26000;0,1,8,10000;0,1,4,52000; | M277: 支线-先天秘谱 | N277: 求访菩提老祖
A278: 201062 | B278: 2 | C278: 2 | D278: 402 | E278: 0 | F278: 0 | G278: 0 | H278: 0,0 | I278: 2 | J278: 201063 | K278: 65 | L278: 0,1,7,27000;0,1,8,10000;0,1,4,54000; | M278: 支线-先天秘谱 | N278: 点燃第一束香
A279: 201063 | B279: 2 | C279: 2 | D279: 402 | E279: 1 | F279: 0 | G279: 0 | H279: 0,0 | I279: 2 | J279: 201064 | K279: 65 | L279: 0,1,7,27000;0,1,8,10000;0,1,4,54000; | M279: 支线-先天秘谱 | N279: 点燃第二束香
A280: 201064 | B280: 2 | C280: 2 | D280: 402 | E280: 0 | F280: 0 | G280: 0 | H280: 0,0 | I280: 2 | J280: 201065 | K280: 65 | L280: 0,1,7,27000;0,1,8,10000;0,1,4,54000; | M280: 支线-先天秘谱 | N280: 点燃第三束香
A281: 201065 | B281: 2 | C281: 2 | D281: 403 | E281: 2 | F281: 0 | G281: 0 | H281: 0,0 | I281: 2 | J281: 201066 | K281: 65 | L281: 0,1,7,81000;0,1,8,10000;0,1,4,54000; | M281: 支线-先天秘谱 | N281: 忽然来了个游方老道
A282: 201066 | B282: 2 | C282: 1 | D282: 404 | E282: 0 | F282: 0 | G282: 224 | H282: 0,0 | I282: 2 | J282: 201067 | K282: 65 | L282: 0,1,7,28000;0,1,8,10000;0,1,4,56000; | M282: 支线-先天秘谱 | N282: 背后出现了几道黑影
A283: 201067 | B283: 2 | C283: 2 | D283: 403 | E283: 0 | F283: 0 | G283: 0 | H283: 0,0 | I283: 2 | J283: 201068 | K283: 65 | L283: 0,1,7,28000;0,1,8,10000;0,1,4,56000; | M283: 支线-先天秘谱 | N283: 赶忙向老道求教
A284: 201068 | B284: 2 | C284: 2 | D284: 403 | E284: 2 | F284: 0 | G284: 0 | H284: 0,0 | I284: 2 | J284: 201069 | K284: 70 | L284: 0,1,7,87000;0,1,8,10000;0,1,4,58000; | M284: 支线-先天秘谱 | N284: 老道终于现出真身
A285: 201069 | B285: 2 | C285: 2 | D285: 1 | E285: 0 | F285: 0 | G285: 0 | H285: 0,0 | I285: 2 | J285: 201070 | K285: 70 | L285: 0,1,7,29000;0,1,8,10000;0,1,4,58000; | M285: 支线-先天秘谱 | N285: 向师父禀报所见所得
A286: 201070 | B286: 2 | C286: 2 | D286: 401 | E286: 0 | F286: 0 | G286: 0 | H286: 0,0 | I286: 2 | J286: 201071 | K286: 70 | L286: 0,1,7,31000;0,1,8,12000;0,1,4,62000; | M286: 支线-万鬼疑云 | N286: 首席匆忙召你回去
A287: 201071 | B287: 2 | C287: 2 | D287: 1 | E287: 0 | F287: 0 | G287: 0 | H287: 0,0 | I287: 2 | J287: 201072 | K287: 70 | L287: 0,1,7,31000;0,1,8,12000;0,1,4,62000; | M287: 支线-万鬼疑云 | N287: 看看师父是否安康
A288: 201072 | B288: 2 | C288: 2 | D288: 1 | E288: 2 | F288: 0 | G288: 0 | H288: 0,0 | I288: 2 | J288: 201073 | K288: 70 | L288: 0,1,7,93000;0,1,8,12000;0,1,4,62000; | M288: 支线-万鬼疑云 | N288: 与师父商议对策
A289: 201073 | B289: 2 | C289: 1 | D289: 405 | E289: 0 | F289: 0 | G289: 225 | H289: 0,0 | I289: 2 | J289: 201074 | K289: 70 | L289: 0,1,7,33000;0,1,8,12000;0,1,4,66000; | M289: 支线-万鬼疑云 | N289: 前往官府打听消息
A290: 201074 | B290: 2 | C290: 2 | D290: 7 | E290: 1 | F290: 0 | G290: 0 | H290: 0,0 | I290: 2 | J290: 201075 | K290: 70 | L290: 0,1,7,33000;0,1,8,12000;0,1,4,66000; | M290: 支线-万鬼疑云 | N290: 无奈只能另想办法
A291: 201075 | B291: 2 | C291: 2 | D291: 405 | E291: 2 | F291: 0 | G291: 0 | H291: 0,0 | I291: 2 | J291: 201076 | K291: 70 | L291: 0,1,7,99000;0,1,8,12000;0,1,4,66000; | M291: 支线-万鬼疑云 | N291: 为衙役买酒
A292: 201076 | B292: 2 | C292: 2 | D292: 405 | E292: 0 | F292: 0 | G292: 0 | H292: 0,0 | I292: 2 | J292: 201077 | K292: 70 | L292: 0,1,7,33000;0,1,8,12000;0,1,4,66000; | M292: 支线-万鬼疑云 | N292: 衙役道出实情
A293: 201077 | B293: 2 | C293: 1 | D293: 406 | E293: 2 | F293: 0 | G293: 226 | H293: 0,0 | I293: 2 | J293: 201078 | K293: 70 | L293: 0,1,7,99000;0,1,8,12000;0,1,4,66000; | M293: 支线-万鬼疑云 | N293: 向包大仁打听内情
A294: 201078 | B294: 2 | C294: 2 | D294: 406 | E294: 1 | F294: 0 | G294: 0 | H294: 0,0 | I294: 2 | J294: 201079 | K294: 75 | L294: 0,1,7,35000;0,1,8,12000;0,1,4,70000; | M294: 支线-万鬼疑云 | N294: 查看包大仁的伤势
A295: 201079 | B295: 2 | C295: 2 | D295: 406 | E295: 0 | F295: 0 | G295: 0 | H295: 0,0 | I295: 2 | J295: 201080 | K295: 75 | L295: 0,1,7,35000;0,1,8,12000;0,1,4,70000; | M295: 支线-万鬼疑云 | N295: 终于问出了线索
A296: 201080 | B296: 2 | C296: 2 | D296: 505 | E296: 0 | F296: 0 | G296: 0 | H296: 0,0 | I296: 2 | J296: 201081 | K296: 75 | L296: 0,1,7,35000;0,1,8,12000;0,1,4,70000; | M296: 支线-万鬼疑云 | N296: 众人赶往西部边塞
A297: 201081 | B297: 2 | C297: 1 | D297: 407 | E297: 0 | F297: 0 | G297: 227 | H297: 0,0 | I297: 2 | J297: 201082 | K297: 75 | L297: 0,1,7,36000;0,1,8,15000;0,1,4,72000; | M297: 支线-万鬼疑云 | N297: 两个妖人跳了出来
A298: 201082 | B298: 2 | C298: 2 | D298: 407 | E298: 1 | F298: 0 | G298: 0 | H298: 0,0 | I298: 2 | J298: 201083 | K298: 75 | L298: 0,1,7,36000;0,1,8,15000;0,1,4,72000; | M298: 支线-万鬼疑云 | N298: 听听他们说些什么
A299: 201083 | B299: 2 | C299: 2 | D299: 504 | E299: 0 | F299: 0 | G299: 0 | H299: 0,0 | I299: 2 | J299: 201084 | K299: 75 | L299: 0,1,7,36000;0,1,8,15000;0,1,4,72000; | M299: 支线-万鬼疑云 | N299: 毒仙子有话要说
A300: 201084 | B300: 2 | C300: 2 | D300: 409 | E300: 2 | F300: 0 | G300: 0 | H300: 0,0 | I300: 2 | J300: 201085 | K300: 75 | L300: 0,1,7,108000;0,1,8,15000;0,1,4,72000; | M300: 支线-万鬼疑云 | N300: 前面有两名道童
A301: 201085 | B301: 2 | C301: 1 | D301: 410 | E301: 0 | F301: 0 | G301: 228 | H301: 0,0 | I301: 2 | J301: 201086 | K301: 75 | L301: 0,1,7,36000;0,1,8,15000;0,1,4,72000; | M301: 支线-万鬼疑云 | N301: 又来一个道童
A302: 201086 | B302: 2 | C302: 2 | D302: 505 | E302: 1 | F302: 0 | G302: 0 | H302: 0,0 | I302: 2 | J302: 201087 | K302: 75 | L302: 0,1,7,37000;0,1,8,15000;0,1,4,74000; | M302: 支线-万鬼疑云 | N302: 远远传来念咒的声音
A303: 201087 | B303: 2 | C303: 2 | D303: 411 | E303: 0 | F303: 0 | G303: 0 | H303: 0,0 | I303: 2 | J303: 201088 | K303: 75 | L303: 0,1,7,37000;0,1,8,15000;0,1,4,74000; | M303: 支线-万鬼疑云 | N303: 眼前出现一位老道
A304: 201088 | B304: 2 | C304: 2 | D304: 411 | E304: 0 | F304: 0 | G304: 0 | H304: 0,0 | I304: 2 | J304: 201089 | K304: 75 | L304: 0,1,7,37000;0,1,8,15000;0,1,4,74000; | M304: 支线-万鬼疑云 | N304: 继续听大仙说下去
A305: 201089 | B305: 2 | C305: 2 | D305: 412 | E305: 0 | F305: 0 | G305: 0 | H305: 0,0 | I305: 2 | J305: 201090 | K305: 75 | L305: 0,1,7,37000;0,1,8,15000;0,1,4,74000; | M305: 支线-万鬼疑云 | N305: 杀出几个万鬼教众
A306: 201090 | B306: 2 | C306: 2 | D306: 411 | E306: 0 | F306: 0 | G306: 0 | H306: 0,0 | I306: 2 | J306: 201091 | K306: 75 | L306: 0,1,7,38000;0,1,8,15000;0,1,4,76000; | M306: 支线-万鬼疑云 | N306: 破惊门法坛
A307: 201091 | B307: 2 | C307: 2 | D307: 411 | E307: 0 | F307: 0 | G307: 0 | H307: 0,0 | I307: 2 | J307: 201092 | K307: 75 | L307: 0,1,7,38000;0,1,8,15000;0,1,4,76000; | M307: 支线-万鬼疑云 | N307: 破死门法坛
A308: 201092 | B308: 2 | C308: 1 | D308: 412 | E308: 1 | F308: 0 | G308: 229 | H308: 0,0 | I308: 2 | J308: 201093 | K308: 75 | L308: 0,1,7,114000;0,1,8,15000;0,1,4,76000; | M308: 支线-万鬼疑云 | N308: 万鬼教众一拥而上
A309: 201093 | B309: 2 | C309: 2 | D309: 411 | E309: 0 | F309: 0 | G309: 0 | H309: 0,0 | I309: 2 | J309: 201094 | K309: 80 | L309: 0,1,7,38000;0,1,8,15000;0,1,4,76000; | M309: 支线-万鬼疑云 | N309: 大仙有话对你说
A310: 201094 | B310: 2 | C310: 2 | D310: 506 | E310: 0 | F310: 0 | G310: 0 | H310: 0,0 | I310: 2 | J310: 201095 | K310: 80 | L310: 0,1,7,38000;0,1,8,15000;0,1,4,76000; | M310: 支线-再探鬼门 | N310: 前去拜访镇元大仙
A311: 201095 | B311: 2 | C311: 2 | D311: 506 | E311: 1 | F311: 0 | G311: 0 | H311: 0,0 | I311: 2 | J311: 201096 | K311: 80 | L311: 0,1,7,73000;0,1,8,30000;0,1,4,146000; | M311: 支线-再探鬼门 | N311: 两个仙童故意刁难
A312: 201096 | B312: 2 | C312: 2 | D312: 506 | E312: 0 | F312: 0 | G312: 0 | H312: 0,0 | I312: 2 | J312: 201097 | K312: 80 | L312: 0,1,7,74000;0,1,8,30000;0,1,4,148000; | M312: 支线-再探鬼门 | N312: 听听仙童说些什么
A313: 201097 | B313: 2 | C313: 1 | D313: 63 | E313: 1 | F313: 0 | G313: 230 | H313: 0,0 | I313: 2 | J313: 201098 | K313: 80 | L313: 0,1,7,75000;0,1,8,30000;0,1,4,150000; | M313: 支线-再探鬼门 | N313: 前往乌斯藏
A314: 201098 | B314: 2 | C314: 2 | D314: 63 | E314: 0 | F314: 0 | G314: 0 | H314: 0,0 | I314: 2 | J314: 201099 | K314: 80 | L314: 0,1,7,75000;0,1,8,30000;0,1,4,150000; | M314: 支线-再探鬼门 | N314: 听听美男说些什么
A315: 201099 | B315: 2 | C315: 2 | D315: 63 | E315: 1 | F315: 0 | G315: 0 | H315: 0,0 | I315: 2 | J315: 201100 | K315: 80 | L315: 0,1,7,75000;0,1,8,30000;0,1,4,150000; | M315: 支线-再探鬼门 | N315: 美男竟是猪八戒变的
A316: 201100 | B316: 2 | C316: 2 | D316: 413 | E316: 0 | F316: 0 | G316: 0 | H316: 0,0 | I316: 2 | J316: 201101 | K316: 80 | L316: 0,1,7,75000;0,1,8,30000;0,1,4,150000; | M316: 支线-再探鬼门 | N316: 沙僧远远跑来
A317: 201101 | B317: 2 | C317: 2 | D317: 507 | E317: 2 | F317: 0 | G317: 0 | H317: 0,0 | I317: 2 | J317: 201102 | K317: 80 | L317: 0,1,7,76000;0,1,8,30000;0,1,4,152000; | M317: 支线-再探鬼门 | N317: 跟随沙僧去救玄奘
A318: 201102 | B318: 2 | C318: 2 | D318: 414 | E318: 0 | F318: 0 | G318: 0 | H318: 0,0 | I318: 2 | J318: 201103 | K318: 80 | L318: 0,1,7,77000;0,1,8,30000;0,1,4,154000; | M318: 支线-再探鬼门 | N318: 小妖拦住去路
A319: 201103 | B319: 2 | C319: 2 | D319: 414 | E319: 0 | F319: 0 | G319: 0 | H319: 0,0 | I319: 2 | J319: 201104 | K319: 80 | L319: 0,1,7,77000;0,1,8,32000;0,1,4,154000; | M319: 支线-再探鬼门 | N319: 盘问玄奘法师的下落
A320: 201104 | B320: 2 | C320: 1 | D320: 507 | E320: 0 | F320: 0 | G320: 231 | H320: 0,0 | I320: 2 | J320: 201105 | K320: 80 | L320: 0,1,7,78000;0,1,8,32000;0,1,4,156000; | M320: 支线-再探鬼门 | N320: 与沙和尚杀进去
A321: 201105 | B321: 2 | C321: 2 | D321: 120 | E321: 0 | F321: 0 | G321: 0 | H321: 0,0 | I321: 2 | J321: 201106 | K321: 80 | L321: 0,1,7,79000;0,1,8,32000;0,1,4,158000; | M321: 支线-再探鬼门 | N321: 玄奘法师好像误会了
A322: 201106 | B322: 2 | C322: 2 | D322: 414 | E322: 0 | F322: 0 | G322: 0 | H322: 0,0 | I322: 2 | J322: 201107 | K322: 80 | L322: 0,1,7,80000;0,1,8,32000;0,1,4,160000; | M322: 支线-再探鬼门 | N322: 忽然跳出一伙妖人
A323: 201107 | B323: 2 | C323: 2 | D323: 507 | E323: 0 | F323: 0 | G323: 0 | H323: 0,0 | I323: 2 | J323: 201108 | K323: 80 | L323: 0,1,7,81000;0,1,8,32000;0,1,4,162000; | M323: 支线-再探鬼门 | N323: 一大波妖人正在靠近
A324: 201108 | B324: 2 | C324: 2 | D324: 414 | E324: 0 | F324: 0 | G324: 0 | H324: 0,0 | I324: 2 | J324: 201109 | K324: 85 | L324: 0,1,7,81000;0,1,8,32000;0,1,4,162000; | M324: 支线-再探鬼门 | N324: 带师徒二人脱身
A325: 201109 | B325: 2 | C325: 1 | D325: 414 | E325: 2 | F325: 0 | G325: 232 | H325: 0,0 | I325: 2 | J325: 201110 | K325: 85 | L325: 0,1,7,81000;0,1,8,32000;0,1,4,162000; | M325: 支线-再探鬼门 | N325: 原来是大圣及时赶到
A326: 201110 | B326: 2 | C326: 2 | D326: 507 | E326: 0 | F326: 0 | G326: 0 | H326: 0,0 | I326: 2 | J326: 201111 | K326: 85 | L326: 0,1,7,82000;0,1,8,32000;0,1,4,164000; | M326: 支线-再探鬼门 | N326: 跟孙大圣道谢
A327: 201111 | B327: 2 | C327: 2 | D327: 507 | E327: 0 | F327: 0 | G327: 0 | H327: 0,0 | I327: 2 | J327: 201112 | K327: 85 | L327: 0,1,7,83000;0,1,8,32000;0,1,4,166000; | M327: 支线-再探鬼门 | N327: 看看玄奘有无大碍
A328: 201112 | B328: 2 | C328: 2 | D328: 507 | E328: 2 | F328: 0 | G328: 0 | H328: 0,0 | I328: 2 | J328: 201113 | K328: 85 | L328: 0,1,7,252000;0,1,8,32000;0,1,4,168000; | M328: 支线-再探鬼门 | N328: 去给玄奘打点水喝
A329: 201113 | B329: 2 | C329: 2 | D329: 120 | E329: 1 | F329: 0 | G329: 0 | H329: 0,0 | I329: 2 | J329: 201114 | K329: 85 | L329: 0,1,7,85000;0,1,8,32000;0,1,4,170000; | M329: 支线-再探鬼门 | N329: 询问万鬼门的事
A330: 201114 | B330: 2 | C330: 2 | D330: 508 | E330: 0 | F330: 0 | G330: 0 | H330: 0,0 | I330: 2 | J330: 201115 | K330: 85 | L330: 0,1,7,96000;0,1,8,36000;0,1,4,192000; | M330: 支线-再探鬼门 | N330: 听大圣接着说
A331: 201115 | B331: 2 | C331: 2 | D331: 63 | E331: 0 | F331: 0 | G331: 0 | H331: 0,0 | I331: 2 | J331: 201116 | K331: 85 | L331: 0,1,7,111000;0,1,8,40000;0,1,4,222000; | M331: 支线-人间美味 | N331: 闷闷不乐的美男八戒
A332: 201116 | B332: 2 | C332: 1 | D332: 415 | E332: 1 | F332: 0 | G332: 233 | H332: 0,0 | I332: 2 | J332: 201117 | K332: 85 | L332: 0,1,7,116000;0,1,8,40000;0,1,4,232000; | M332: 支线-人间美味 | N332: 高府家丁拦在门前
A333: 201117 | B333: 2 | C333: 2 | D333: 416 | E333: 0 | F333: 0 | G333: 0 | H333: 0,0 | I333: 2 | J333: 201118 | K333: 85 | L333: 0,1,7,121000;0,1,8,40000;0,1,4,242000; | M333: 支线-人间美味 | N333: 进门拜见高太公
A334: 201118 | B334: 2 | C334: 2 | D334: 209 | E334: 0 | F334: 0 | G334: 0 | H334: 0,0 | I334: 2 | J334: 201119 | K334: 85 | L334: 0,1,7,126000;0,1,8,40000;0,1,4,252000; | M334: 支线-人间美味 | N334: 赶往长安醉仙楼
A335: 201119 | B335: 2 | C335: 1 | D335: 417 | E335: 1 | F335: 0 | G335: 234 | H335: 0,0 | I335: 2 | J335: 201120 | K335: 85 | L335: 0,1,7,378000;0,1,8,40000;0,1,4,252000; | M335: 支线-人间美味 | N335: 找到国境盗匪
A336: 201120 | B336: 2 | C336: 2 | D336: 416 | E336: 0 | F336: 0 | G336: 0 | H336: 0,0 | I336: 2 | J336: 201121 | K336: 85 | L336: 0,1,7,131000;0,1,8,50000;0,1,4,262000; | M336: 支线-人间美味 | N336: 将食材带回高老庄
A337: 201121 | B337: 2 | C337: 2 | D337: 416 | E337: 0 | F337: 0 | G337: 0 | H337: 0,0 | I337: 2 | J337: 201122 | K337: 85 | L337: 0,1,7,136000;0,1,8,50000;0,1,4,272000; | M337: 支线-人间美味 | N337: 找到第1颗九孔螺
A338: 201122 | B338: 2 | C338: 2 | D338: 416 | E338: 2 | F338: 0 | G338: 0 | H338: 0,0 | I338: 2 | J338: 201123 | K338: 85 | L338: 0,1,7,423000;0,1,8,50000;0,1,4,282000; | M338: 支线-人间美味 | N338: 找到第2颗九孔螺
A339: 201123 | B339: 2 | C339: 2 | D339: 416 | E339: 0 | F339: 0 | G339: 0 | H339: 0,0 | I339: 2 | J339: 201124 | K339: 90 | L339: 0,1,7,156000;0,1,8,50000;0,1,4,312000; | M339: 支线-人间美味 | N339: 找到第3颗九孔螺
A340: 201124 | B340: 2 | C340: 1 | D340: 418 | E340: 1 | F340: 0 | G340: 235 | H340: 0,0 | I340: 2 | J340: 201125 | K340: 90 | L340: 0,1,7,156000;0,1,8,60000;0,1,4,312000; | M340: 支线-人间美味 | N340: 忽然跳出一个夜叉
A341: 201125 | B341: 2 | C341: 2 | D341: 416 | E341: 0 | F341: 0 | G341: 0 | H341: 0,0 | I341: 2 | J341: 201126 | K341: 90 | L341: 0,1,7,156000;0,1,8,60000;0,1,4,312000; | M341: 支线-人间美味 | N341: 将九孔螺带回高老庄
A342: 201126 | B342: 2 | C342: 2 | D342: 419 | E342: 0 | F342: 0 | G342: 0 | H342: 0,0 | I342: 2 | J342: 201127 | K342: 90 | L342: 0,1,7,161000;0,1,8,60000;0,1,4,322000; | M342: 支线-人间美味 | N342: 舌尖上的高老庄
A343: 201127 | B343: 2 | C343: 1 | D343: 420 | E343: 0 | F343: 0 | G343: 236 | H343: 0,0 | I343: 2 | J343: 201128 | K343: 90 | L343: 0,1,7,161000;0,1,8,60000;0,1,4,322000; | M343: 支线-人间美味 | N343: 乱入的炒饭大魔王
A344: 201128 | B344: 2 | C344: 2 | D344: 416 | E344: 1 | F344: 0 | G344: 0 | H344: 0,0 | I344: 2 | J344: 201129 | K344: 90 | L344: 0,1,7,166000;0,1,8,60000;0,1,4,332000; | M344: 支线-人间美味 | N344: 佛跳墙终于做好了
A345: 201129 | B345: 2 | C345: 2 | D345: 63 | E345: 0 | F345: 0 | G345: 0 | H345: 0,0 | I345: 2 | J345: 201130 | K345: 90 | L345: 0,1,7,166000;0,1,8,60000;0,1,4,332000; | M345: 支线-人间美味 | N345: 饥渴难耐的美男八戒
A346: 201130 | B346: 2 | C346: 2 | D346: 17 | E346: 1 | F346: 0 | G346: 0 | H346: 0,0 | I346: 2 | J346: 201131 | K346: 90 | L346: 0,1,7,498000;0,1,8,60000;0,1,4,332000; | M346: 支线-人间美味 | N346: 赶忙向孙大圣解释
A347: 201131 | B347: 2 | C347: 2 | D347: 17 | E347: 0 | F347: 0 | G347: 0 | H347: 0,0 | I347: 2 | J347: 201132 | K347: 90 | L347: 0,1,7,166000;0,1,8,60000;0,1,4,332000; | M347: 支线-人间美味 | N347: 想阻止大圣出手
A348: 201132 | B348: 2 | C348: 2 | D348: 17 | E348: 1 | F348: 0 | G348: 0 | H348: 0,0 | I348: 2 | J348: 201133 | K348: 90 | L348: 0,1,7,171000;0,1,8,60000;0,1,4,342000; | M348: 支线-人间美味 | N348: 劝孙大圣消消气
A349: 201133 | B349: 2 | C349: 2 | D349: 503 | E349: 0 | F349: 0 | G349: 0 | H349: 0,0 | I349: 2 | J349: 201134 | K349: 90 | L349: 0,1,7,171000;0,1,8,60000;0,1,4,342000; | M349: 支线-钱塘逼婚 | N349: 去洞庭看望柳毅
A350: 201134 | B350: 2 | C350: 1 | D350: 306 | E350: 1 | F350: 0 | G350: 237 | H350: 0,0 | I350: 2 | J350: 201135 | K350: 90 | L350: 0,1,7,528000;0,1,8,60000;0,1,4,352000; | M350: 支线-钱塘逼婚 | N350: 钱塘君来逼婚
A351: 201135 | B351: 2 | C351: 2 | D351: 306 | E351: 0 | F351: 0 | G351: 0 | H351: 0,0 | I351: 2 | J351: 201136 | K351: 90 | L351: 0,1,7,176000;0,1,8,60000;0,1,4,352000; | M351: 支线-钱塘逼婚 | N351: 钱塘君不依不饶
A352: 201136 | B352: 2 | C352: 2 | D352: 305 | E352: 1 | F352: 0 | G352: 0 | H352: 0,0 | I352: 2 | J352: 201137 | K352: 90 | L352: 0,1,7,188000;0,1,8,70000;0,1,4,376000; | M352: 支线-钱塘逼婚 | N352: 去洞庭龙宫讨说法
A353: 201137 | B353: 2 | C353: 2 | D353: 503 | E353: 0 | F353: 0 | G353: 0 | H353: 0,0 | I353: 2 | J353: 201138 | K353: 90 | L353: 0,1,7,188000;0,1,8,70000;0,1,4,376000; | M353: 支线-钱塘逼婚 | N353: 带上柳毅去追龙女
A354: 201138 | B354: 2 | C354: 2 | D354: 503 | E354: 0 | F354: 0 | G354: 0 | H354: 0,0 | I354: 2 | J354: 201139 | K354: 95 | L354: 0,1,7,198000;0,1,8,70000;0,1,4,396000; | M354: 支线-钱塘逼婚 | N354: 与柳毅商量对策
A355: 201139 | B355: 2 | C355: 1 | D355: 421 | E355: 0 | F355: 0 | G355: 238 | H355: 0,0 | I355: 2 | J355: 201140 | K355: 95 | L355: 0,1,7,198000;0,1,8,70000;0,1,4,396000; | M355: 支线-钱塘逼婚 | N355: 追上掳走公主的人
A356: 201140 | B356: 2 | C356: 2 | D356: 503 | E356: 1 | F356: 0 | G356: 0 | H356: 0,0 | I356: 2 | J356: 201141 | K356: 95 | L356: 0,1,7,208000;0,1,8,80000;0,1,4,416000; | M356: 支线-钱塘逼婚 | N356: 似曾相识的玉佩
A357: 201141 | B357: 2 | C357: 2 | D357: 421 | E357: 0 | F357: 0 | G357: 0 | H357: 0,0 | I357: 2 | J357: 201142 | K357: 95 | L357: 0,1,7,208000;0,1,8,80000;0,1,4,416000; | M357: 支线-钱塘逼婚 | N357: 两人被围在垓心
A358: 201142 | B358: 2 | C358: 2 | D358: 306 | E358: 0 | F358: 0 | G358: 0 | H358: 0,0 | I358: 2 | J358: 201143 | K358: 95 | L358: 0,1,7,208000;0,1,8,80000;0,1,4,416000; | M358: 支线-钱塘逼婚 | N358: 钱塘君带水族赶来
A359: 201143 | B359: 2 | C359: 1 | D359: 304 | E359: 1 | F359: 0 | G359: 239 | H359: 0,0 | I359: 2 | J359: 201144 | K359: 95 | L359: 0,1,7,624000;0,1,8,80000;0,1,4,416000; | M359: 支线-钱塘逼婚 | N359: 击败鬼妖
A360: 201144 | B360: 2 | C360: 2 | D360: 421 | E360: 1 | F360: 0 | G360: 0 | H360: 0,0 | I360: 2 | J360: 201145 | K360: 95 | L360: 0,1,7,218000;0,1,8,80000;0,1,4,436000; | M360: 支线-钱塘逼婚 | N360: 此事竟与地府有牵连
A361: 201145 | B361: 2 | C361: 2 | D361: 503 | E361: 0 | F361: 0 | G361: 0 | H361: 0,0 | I361: 2 | J361: 201146 | K361: 95 | L361: 0,1,7,218000;0,1,8,80000;0,1,4,436000; | M361: 支线-钱塘逼婚 | N361: 告别众人前往地府
A362: 201146 | B362: 2 | C362: 2 | D362: 401 | E362: 1 | F362: 0 | G362: 0 | H362: 0,0 | I362: 2 | J362: 201147 | K362: 95 | L362: 0,1,7,684000;0,1,8,80000;0,1,4,456000; | M362: 支线-前尘旧事 | N362: 首席弟子将你拦下
A363: 201147 | B363: 2 | C363: 2 | D363: 422 | E363: 0 | F363: 0 | G363: 0 | H363: 0,0 | I363: 2 | J363: 201148 | K363: 95 | L363: 0,1,7,228000;0,1,8,80000;0,1,4,456000; | M363: 支线-前尘旧事 | N363: 一队天兵拦住去路
A364: 201148 | B364: 2 | C364: 2 | D364: 422 | E364: 0 | F364: 0 | G364: 0 | H364: 0,0 | I364: 2 | J364: 201149 | K364: 95 | L364: 0,1,7,230000;0,1,8,90000;0,1,4,460000; | M364: 支线-前尘旧事 | N364: 有人来相助
A365: 201149 | B365: 2 | C365: 2 | D365: 509 | E365: 1 | F365: 0 | G365: 0 | H365: 0,0 | I365: 2 | J365: 201150 | K365: 95 | L365: 0,1,7,230000;0,1,8,90000;0,1,4,460000; | M365: 支线-前尘旧事 | N365: 原来是柳毅一行人
A366: 201150 | B366: 2 | C366: 2 | D366: 510 | E366: 1 | F366: 0 | G366: 0 | H366: 0,0 | I366: 2 | J366: 201151 | K366: 95 | L366: 0,1,7,232000;0,1,8,90000;0,1,4,464000; | M366: 支线-前尘旧事 | N366: 又遇紫霞仙子
A367: 201151 | B367: 2 | C367: 2 | D367: 510 | E367: 0 | F367: 0 | G367: 0 | H367: 0,0 | I367: 2 | J367: 201152 | K367: 95 | L367: 0,1,7,232000;0,1,8,90000;0,1,4,464000; | M367: 支线-前尘旧事 | N367: 一路来到兽王山
A368: 201152 | B368: 2 | C368: 1 | D368: 511 | E368: 1 | F368: 0 | G368: 240 | H368: 0,0 | I368: 2 | J368: 201153 | K368: 95 | L368: 0,1,7,234000;0,1,8,90000;0,1,4,468000; | M368: 支线-前尘旧事 | N368: 击退天兵天将
A369: 201153 | B369: 2 | C369: 2 | D369: 511 | E369: 2 | F369: 0 | G369: 0 | H369: 0,0 | I369: 2 | J369: 201154 | K369: 100 | L369: 0,1,7,234000;0,1,8,90000;0,1,4,468000; | M369: 支线-前尘旧事 | N369: 原来是八戒和沙僧
A370: 201154 | B370: 2 | C370: 2 | D370: 408 | E370: 0 | F370: 0 | G370: 0 | H370: 0,0 | I370: 2 | J370: 201155 | K370: 100 | L370: 0,1,7,236000;0,1,8,90000;0,1,4,472000; | M370: 支线-前尘旧事 | N370: 无奈只能速速离开
A371: 201155 | B371: 2 | C371: 2 | D371: 408 | E371: 1 | F371: 0 | G371: 0 | H371: 0,0 | I371: 2 | J371: 201156 | K371: 100 | L371: 0,1,7,236000;0,1,8,90000;0,1,4,472000; | M371: 支线-前尘旧事 | N371: 再次击退天兵天将
A372: 201156 | B372: 2 | C372: 2 | D372: 408 | E372: 0 | F372: 0 | G372: 0 | H372: 0,0 | I372: 2 | J372: 201157 | K372: 100 | L372: 0,1,7,238000;0,1,8,90000;0,1,4,476000; | M372: 支线-前尘旧事 | N372: 菩提祖师叱退众天将
A373: 201157 | B373: 2 | C373: 2 | D373: 408 | E373: 1 | F373: 0 | G373: 0 | H373: 0,0 | I373: 2 | J373: 201158 | K373: 100 | L373: 0,1,7,238000;0,1,8,90000;0,1,4,476000; | M373: 支线-前尘旧事 | N373: 与祖师离开此处
A374: 201158 | B374: 2 | C374: 1 | D374: 408 | E374: 0 | F374: 0 | G374: 241 | H374: 0,0 | I374: 2 | J374: 201159 | K374: 100 | L374: 0,1,7,240000;0,1,8,90000;0,1,4,480000; | M374: 支线-前尘旧事 | N374: 接受的试炼
A375: 201159 | B375: 2 | C375: 2 | D375: 408 | E375: 2 | F375: 0 | G375: 0 | H375: 0,0 | I375: 2 | J375: 201160 | K375: 100 | L375: 0,1,7,240000;0,1,8,90000;0,1,4,480000; | M375: 支线-前尘旧事 | N375: 祖师点明一切因果
A376: 201160 | B376: 2 | C376: 2 | D376: 167 | E376: 0 | F376: 0 | G376: 0 | H376: 0,0 | I376: 2 | J376: 201161 | K376: 100 | L376: 0,1,7,242000;0,1,8,90000;0,1,4,484000; | M376: 支线-兽神攻山 | N376: 兽神颇为狼狈
A377: 201161 | B377: 2 | C377: 2 | D377: 168 | E377: 0 | F377: 0 | G377: 0 | H377: 0,0 | I377: 2 | J377: 201162 | K377: 100 | L377: 0,1,7,242000;0,1,8,90000;0,1,4,484000; | M377: 支线-兽神攻山 | N377: 兽神现出真身
A378: 201162 | B378: 2 | C378: 2 | D378: 1 | E378: 0 | F378: 0 | G378: 0 | H378: 0,0 | I378: 2 | J378: 201163 | K378: 100 | L378: 0,1,7,244000;0,1,8,90000;0,1,4,488000; | M378: 支线-兽神攻山 | N378: 兽神不敌诛仙剑
A379: 201163 | B379: 2 | C379: 2 | D379: 168 | E379: 0 | F379: 0 | G379: 0 | H379: 0,0 | I379: 2 | J379: 201164 | K379: 100 | L379: 0,1,7,244000;0,1,8,90000;0,1,4,488000; | M379: 支线-尘事 | N379: 听闻苏茹已殉情
A380: 201164 | B380: 2 | C380: 2 | D380: 168 | E380: 0 | F380: 0 | G380: 0 | H380: 0,0 | I380: 2 | J380: 201165 | K380: 100 | L380: 0,1,7,246000;0,1,8,90000;0,1,4,492000; | M380: 支线-尘事 | N380: 与鬼厉走走
A381: 201165 | B381: 2 | C381: 2 | D381: 1 | E381: 0 | F381: 0 | G381: 0 | H381: 0,0 | I381: 2 | J381: 201166 | K381: 100 | L381: 0,1,7,246000;0,1,8,90000;0,1,4,492000; | M381: 师门 | N381: 0
A382: 201166 | B382: 2 | C382: 2 | D382: 1 | E382: 0 | F382: 0 | G382: 0 | H382: 0,0 | I382: 2 | J382: 201167 | K382: 100 | L382: 0,1,7,248000;0,1,8,90000;0,1,4,496000; | M382: 宝图 | N382: 0
A383: 201167 | B383: 2 | C383: 2 | D383: 1 | E383: 0 | F383: 0 | G383: 0 | H383: 0,0 | I383: 2 | J383: 0 | K383: 100 | L383: 0,1,7,248000;0,1,8,90000;0,1,4,496000; | M383: 打造 | N383: 0

Sheet: Sheet2
AB1: ; | AC1: 1
AB2: ,
B3: 序号 | D3: 职业1 | E3: 职业2 | F3: 职业3 | G3: 职业4 | H3: 职业5 | I3: 职业6 | J3: 职业7 | K3: 职业8 | L3: 职业9 | M3: 职业10 | O3: 物品1 | P3: 物品2 | Q3: 物品3 | R3: 物品4 | S3: 物品5 | T3: 物品6 | U3: 物品7 | V3: 物品8 | W3: 物品9 | X3: 物品10 | Z3: 最终 | AB3: 结果
B4: 1 | D4: 1 | E4: 2 | F4: 3 | G4: 4 | H4: 5 | I4: 6 | J4: 7 | K4: 8 | L4: 9 | M4: 10 | O4: 1101101 | P4: 1101201 | Q4: 1102101 | R4: 1102201 | S4: 1103101 | T4: 1103201 | U4: 1104101 | V4: 1104201 | W4: 1105101 | X4: 1105201 | Z4: =RC[2]&RC[3]&RC[4]&RC[5]&RC[6]&RC[7]&RC[8]&RC[9]&RC[10]&RC[11] -> 1,1,1101101,1;2,1,1101201,1;3,1,1102101,1;4,1,1102201,1;5,1,1103101,1;6,1,1103201,1;7,1,1104101,1;8,1,1104201,1;9,1,1105101,1;10,1,1105201,1; | AB4: =RC[-24]&R2C28&R1C29&R2C28&RC[-13]&R2C28&R1C29&R1C28 -> 1,1,1101101,1; | AC4: =RC[-24]&R2C28&R1C29&R2C28&RC[-13]&R2C28&R1C29&R1C28 -> 2,1,1101201,1; | AD4: =RC[-24]&R2C28&R1C29&R2C28&RC[-13]&R2C28&R1C29&R1C28 -> 3,1,1102101,1; | AE4: =RC[-24]&R2C28&R1C29&R2C28&RC[-13]&R2C28&R1C29&R1C28 -> 4,1,1102201,1; | AF4: =RC[-24]&R2C28&R1C29&R2C28&RC[-13]&R2C28&R1C29&R1C28 -> 5,1,1103101,1; | AG4: =RC[-24]&R2C28&R1C29&R2C28&RC[-13]&R2C28&R1C29&R1C28 -> 6,1,1103201,1; | AH4: =RC[-24]&R2C28&R1C29&R2C28&RC[-13]&R2C28&R1C29&R1C28 -> 7,1,1104101,1; | AI4: =RC[-24]&R2C28&R1C29&R2C28&RC[-13]&R2C28&R1C29&R1C28 -> 8,1,1104201,1; | AJ4: =RC[-24]&R2C28&R1C29&R2C28&RC[-13]&R2C28&R1C29&R1C28 -> 9,1,1105101,1; | AK4: =RC[-24]&R2C28&R1C29&R2C28&RC[-13]&R2C28&R1C29&R1C28 -> 10,1,1105201,1;
B5: 1 | D5: 1 | E5: 2 | F5: 3 | G5: 4 | H5: 5 | I5: 6 | J5: 7 | K5: 8 | L5: 9 | M5: 10 | O5: 1200101 | P5: 1200201 | Q5: 1200101 | R5: 1200201 | S5: 1200101 | T5: 1200201 | U5: 1200101 | V5: 1200201 | W5: 1200101 | X5: 1200201 | Z5: =RC[2]&RC[3]&RC[4]&RC[5]&RC[6]&RC[7]&RC[8]&RC[9]&RC[10]&RC[11] -> 1,1,1200101,1;2,1,1200201,1;3,1,1200101,1;4,1,1200201,1;5,1,1200101,1;6,1,1200201,1;7,1,1200101,1;8,1,1200201,1;9,1,1200101,1;10,1,1200201,1; | AB5: =RC[-24]&R2C28&R1C29&R2C28&RC[-13]&R2C28&R1C29&R1C28 -> 1,1,1200101,1; | AC5: =RC[-24]&R2C28&R1C29&R2C28&RC[-13]&R2C28&R1C29&R1C28 -> 2,1,1200201,1; | AD5: =RC[-24]&R2C28&R1C29&R2C28&RC[-13]&R2C28&R1C29&R1C28 -> 3,1,1200101,1; | AE5: =RC[-24]&R2C28&R1C29&R2C28&RC[-13]&R2C28&R1C29&R1C28 -> 4,1,1200201,1; | AF5: =RC[-24]&R2C28&R1C29&R2C28&RC[-13]&R2C28&R1C29&R1C28 -> 5,1,1200101,1; | AG5: =RC[-24]&R2C28&R1C29&R2C28&RC[-13]&R2C28&R1C29&R1C28 -> 6,1,1200201,1; | AH5: =RC[-24]&R2C28&R1C29&R2C28&RC[-13]&R2C28&R1C29&R1C28 -> 7,1,1200101,1; | AI5: =RC[-24]&R2C28&R1C29&R2C28&RC[-13]&R2C28&R1C29&R1C28 -> 8,1,1200201,1; | AJ5: =RC[-24]&R2C28&R1C29&R2C28&RC[-13]&R2C28&R1C29&R1C28 -> 9,1,1200101,1; | AK5: =RC[-24]&R2C28&R1C29&R2C28&RC[-13]&R2C28&R1C29&R1C28 -> 10,1,1200201,1;
B6: 1 | D6: 1 | E6: 2 | F6: 3 | G6: 4 | H6: 5 | I6: 6 | J6: 7 | K6: 8 | L6: 9 | M6: 10 | O6: 1300101 | P6: 1300201 | Q6: 1300101 | R6: 1300201 | S6: 1300101 | T6: 1300201 | U6: 1300101 | V6: 1300201 | W6: 1300101 | X6: 1300201 | Z6: =RC[2]&RC[3]&RC[4]&RC[5]&RC[6]&RC[7]&RC[8]&RC[9]&RC[10]&RC[11] -> 1,1,1300101,1;2,1,1300201,1;3,1,1300101,1;4,1,1300201,1;5,1,1300101,1;6,1,1300201,1;7,1,1300101,1;8,1,1300201,1;9,1,1300101,1;10,1,1300201,1; | AB6: =RC[-24]&R2C28&R1C29&R2C28&RC[-13]&R2C28&R1C29&R1C28 -> 1,1,1300101,1; | AC6: =RC[-24]&R2C28&R1C29&R2C28&RC[-13]&R2C28&R1C29&R1C28 -> 2,1,1300201,1; | AD6: =RC[-24]&R2C28&R1C29&R2C28&RC[-13]&R2C28&R1C29&R1C28 -> 3,1,1300101,1; | AE6: =RC[-24]&R2C28&R1C29&R2C28&RC[-13]&R2C28&R1C29&R1C28 -> 4,1,1300201,1; | AF6: =RC[-24]&R2C28&R1C29&R2C28&RC[-13]&R2C28&R1C29&R1C28 -> 5,1,1300101,1; | AG6: =RC[-24]&R2C28&R1C29&R2C28&RC[-13]&R2C28&R1C29&R1C28 -> 6,1,1300201,1; | AH6: =RC[-24]&R2C28&R1C29&R2C28&RC[-13]&R2C28&R1C29&R1C28 -> 7,1,1300101,1; | AI6: =RC[-24]&R2C28&R1C29&R2C28&RC[-13]&R2C28&R1C29&R1C28 -> 8,1,1300201,1; | AJ6: =RC[-24]&R2C28&R1C29&R2C28&RC[-13]&R2C28&R1C29&R1C28 -> 9,1,1300101,1; | AK6: =RC[-24]&R2C28&R1C29&R2C28&RC[-13]&R2C28&R1C29&R1C28 -> 10,1,1300201,1;
B7: 1 | D7: 1 | E7: 2 | F7: 3 | G7: 4 | H7: 5 | I7: 6 | J7: 7 | K7: 8 | L7: 9 | M7: 10 | O7: 1200102 | P7: 1200202 | Q7: 1200102 | R7: 1200202 | S7: 1200102 | T7: 1200202 | U7: 1200102 | V7: 1200202 | W7: 1200102 | X7: 1200202 | Z7: =RC[2]&RC[3]&RC[4]&RC[5]&RC[6]&RC[7]&RC[8]&RC[9]&RC[10]&RC[11] -> 1,1,1200102,1;2,1,1200202,1;3,1,1200102,1;4,1,1200202,1;5,1,1200102,1;6,1,1200202,1;7,1,1200102,1;8,1,1200202,1;9,1,1200102,1;10,1,1200202,1; | AB7: =RC[-24]&R2C28&R1C29&R2C28&RC[-13]&R2C28&R1C29&R1C28 -> 1,1,1200102,1; | AC7: =RC[-24]&R2C28&R1C29&R2C28&RC[-13]&R2C28&R1C29&R1C28 -> 2,1,1200202,1; | AD7: =RC[-24]&R2C28&R1C29&R2C28&RC[-13]&R2C28&R1C29&R1C28 -> 3,1,1200102,1; | AE7: =RC[-24]&R2C28&R1C29&R2C28&RC[-13]&R2C28&R1C29&R1C28 -> 4,1,1200202,1; | AF7: =RC[-24]&R2C28&R1C29&R2C28&RC[-13]&R2C28&R1C29&R1C28 -> 5,1,1200102,1; | AG7: =RC[-24]&R2C28&R1C29&R2C28&RC[-13]&R2C28&R1C29&R1C28 -> 6,1,1200202,1; | AH7: =RC[-24]&R2C28&R1C29&R2C28&RC[-13]&R2C28&R1C29&R1C28 -> 7,1,1200102,1; | AI7: =RC[-24]&R2C28&R1C29&R2C28&RC[-13]&R2C28&R1C29&R1C28 -> 8,1,1200202,1; | AJ7: =RC[-24]&R2C28&R1C29&R2C28&RC[-13]&R2C28&R1C29&R1C28 -> 9,1,1200102,1; | AK7: =RC[-24]&R2C28&R1C29&R2C28&RC[-13]&R2C28&R1C29&R1C28 -> 10,1,1200202,1;
B8: 1 | D8: 1 | E8: 2 | F8: 3 | G8: 4 | H8: 5 | I8: 6 | J8: 7 | K8: 8 | L8: 9 | M8: 10 | O8: 1300102 | P8: 1300202 | Q8: 1300102 | R8: 1300202 | S8: 1300102 | T8: 1300202 | U8: 1300102 | V8: 1300202 | W8: 1300102 | X8: 1300202 | Z8: =RC[2]&RC[3]&RC[4]&RC[5]&RC[6]&RC[7]&RC[8]&RC[9]&RC[10]&RC[11] -> 1,1,1300102,1;2,1,1300202,1;3,1,1300102,1;4,1,1300202,1;5,1,1300102,1;6,1,1300202,1;7,1,1300102,1;8,1,1300202,1;9,1,1300102,1;10,1,1300202,1; | AB8: =RC[-24]&R2C28&R1C29&R2C28&RC[-13]&R2C28&R1C29&R1C28 -> 1,1,1300102,1; | AC8: =RC[-24]&R2C28&R1C29&R2C28&RC[-13]&R2C28&R1C29&R1C28 -> 2,1,1300202,1; | AD8: =RC[-24]&R2C28&R1C29&R2C28&RC[-13]&R2C28&R1C29&R1C28 -> 3,1,1300102,1; | AE8: =RC[-24]&R2C28&R1C29&R2C28&RC[-13]&R2C28&R1C29&R1C28 -> 4,1,1300202,1; | AF8: =RC[-24]&R2C28&R1C29&R2C28&RC[-13]&R2C28&R1C29&R1C28 -> 5,1,1300102,1; | AG8: =RC[-24]&R2C28&R1C29&R2C28&RC[-13]&R2C28&R1C29&R1C28 -> 6,1,1300202,1; | AH8: =RC[-24]&R2C28&R1C29&R2C28&RC[-13]&R2C28&R1C29&R1C28 -> 7,1,1300102,1; | AI8: =RC[-24]&R2C28&R1C29&R2C28&RC[-13]&R2C28&R1C29&R1C28 -> 8,1,1300202,1; | AJ8: =RC[-24]&R2C28&R1C29&R2C28&RC[-13]&R2C28&R1C29&R1C28 -> 9,1,1300102,1; | AK8: =RC[-24]&R2C28&R1C29&R2C28&RC[-13]&R2C28&R1C29&R1C28 -> 10,1,1300202,1;
B9: 1 | D9: 1 | E9: 2 | F9: 3 | G9: 4 | H9: 5 | I9: 6 | J9: 7 | K9: 8 | L9: 9 | M9: 10 | O9: 1101102 | P9: 1101202 | Q9: 1102102 | R9: 1102202 | S9: 1103102 | T9: 1103202 | U9: 1104102 | V9: 1104202 | W9: 1105102 | X9: 1105202 | Z9: =RC[2]&RC[3]&RC[4]&RC[5]&RC[6]&RC[7]&RC[8]&RC[9]&RC[10]&RC[11] -> 1,1,1101102,1;2,1,1101202,1;3,1,1102102,1;4,1,1102202,1;5,1,1103102,1;6,1,1103202,1;7,1,1104102,1;8,1,1104202,1;9,1,1105102,1;10,1,1105202,1; | AB9: =RC[-24]&R2C28&R1C29&R2C28&RC[-13]&R2C28&R1C29&R1C28 -> 1,1,1101102,1; | AC9: =RC[-24]&R2C28&R1C29&R2C28&RC[-13]&R2C28&R1C29&R1C28 -> 2,1,1101202,1; | AD9: =RC[-24]&R2C28&R1C29&R2C28&RC[-13]&R2C28&R1C29&R1C28 -> 3,1,1102102,1; | AE9: =RC[-24]&R2C28&R1C29&R2C28&RC[-13]&R2C28&R1C29&R1C28 -> 4,1,1102202,1; | AF9: =RC[-24]&R2C28&R1C29&R2C28&RC[-13]&R2C28&R1C29&R1C28 -> 5,1,1103102,1; | AG9: =RC[-24]&R2C28&R1C29&R2C28&RC[-13]&R2C28&R1C29&R1C28 -> 6,1,1103202,1; | AH9: =RC[-24]&R2C28&R1C29&R2C28&RC[-13]&R2C28&R1C29&R1C28 -> 7,1,1104102,1; | AI9: =RC[-24]&R2C28&R1C29&R2C28&RC[-13]&R2C28&R1C29&R1C28 -> 8,1,1104202,1; | AJ9: =RC[-24]&R2C28&R1C29&R2C28&RC[-13]&R2C28&R1C29&R1C28 -> 9,1,1105102,1; | AK9: =RC[-24]&R2C28&R1C29&R2C28&RC[-13]&R2C28&R1C29&R1C28 -> 10,1,1105202,1;
B10: 1 | D10: 1 | E10: 2 | F10: 3 | G10: 4 | H10: 5 | I10: 6 | J10: 7 | K10: 8 | L10: 9 | M10: 10 | O10: 1200103 | P10: 1200203 | Q10: 1200103 | R10: 1200203 | S10: 1200103 | T10: 1200203 | U10: 1200103 | V10: 1200203 | W10: 1200103 | X10: 1200203 | Z10: =RC[2]&RC[3]&RC[4]&RC[5]&RC[6]&RC[7]&RC[8]&RC[9]&RC[10]&RC[11] -> 1,1,1200103,1;2,1,1200203,1;3,1,1200103,1;4,1,1200203,1;5,1,1200103,1;6,1,1200203,1;7,1,1200103,1;8,1,1200203,1;9,1,1200103,1;10,1,1200203,1; | AB10: =RC[-24]&R2C28&R1C29&R2C28&RC[-13]&R2C28&R1C29&R1C28 -> 1,1,1200103,1; | AC10: =RC[-24]&R2C28&R1C29&R2C28&RC[-13]&R2C28&R1C29&R1C28 -> 2,1,1200203,1; | AD10: =RC[-24]&R2C28&R1C29&R2C28&RC[-13]&R2C28&R1C29&R1C28 -> 3,1,1200103,1; | AE10: =RC[-24]&R2C28&R1C29&R2C28&RC[-13]&R2C28&R1C29&R1C28 -> 4,1,1200203,1; | AF10: =RC[-24]&R2C28&R1C29&R2C28&RC[-13]&R2C28&R1C29&R1C28 -> 5,1,1200103,1; | AG10: =RC[-24]&R2C28&R1C29&R2C28&RC[-13]&R2C28&R1C29&R1C28 -> 6,1,1200203,1; | AH10: =RC[-24]&R2C28&R1C29&R2C28&RC[-13]&R2C28&R1C29&R1C28 -> 7,1,1200103,1; | AI10: =RC[-24]&R2C28&R1C29&R2C28&RC[-13]&R2C28&R1C29&R1C28 -> 8,1,1200203,1; | AJ10: =RC[-24]&R2C28&R1C29&R2C28&RC[-13]&R2C28&R1C29&R1C28 -> 9,1,1200103,1; | AK10: =RC[-24]&R2C28&R1C29&R2C28&RC[-13]&R2C28&R1C29&R1C28 -> 10,1,1200203,1;
B11: 1 | D11: 1 | E11: 2 | F11: 3 | G11: 4 | H11: 5 | I11: 6 | J11: 7 | K11: 8 | L11: 9 | M11: 10 | O11: 1300103 | P11: 1300203 | Q11: 1300103 | R11: 1300203 | S11: 1300103 | T11: 1300203 | U11: 1300103 | V11: 1300203 | W11: 1300103 | X11: 1300203 | Z11: =RC[2]&RC[3]&RC[4]&RC[5]&RC[6]&RC[7]&RC[8]&RC[9]&RC[10]&RC[11] -> 1,1,1300103,1;2,1,1300203,1;3,1,1300103,1;4,1,1300203,1;5,1,1300103,1;6,1,1300203,1;7,1,1300103,1;8,1,1300203,1;9,1,1300103,1;10,1,1300203,1; | AB11: =RC[-24]&R2C28&R1C29&R2C28&RC[-13]&R2C28&R1C29&R1C28 -> 1,1,1300103,1; | AC11: =RC[-24]&R2C28&R1C29&R2C28&RC[-13]&R2C28&R1C29&R1C28 -> 2,1,1300203,1; | AD11: =RC[-24]&R2C28&R1C29&R2C28&RC[-13]&R2C28&R1C29&R1C28 -> 3,1,1300103,1; | AE11: =RC[-24]&R2C28&R1C29&R2C28&RC[-13]&R2C28&R1C29&R1C28 -> 4,1,1300203,1; | AF11: =RC[-24]&R2C28&R1C29&R2C28&RC[-13]&R2C28&R1C29&R1C28 -> 5,1,1300103,1; | AG11: =RC[-24]&R2C28&R1C29&R2C28&RC[-13]&R2C28&R1C29&R1C28 -> 6,1,1300203,1; | AH11: =RC[-24]&R2C28&R1C29&R2C28&RC[-13]&R2C28&R1C29&R1C28 -> 7,1,1300103,1; | AI11: =RC[-24]&R2C28&R1C29&R2C28&RC[-13]&R2C28&R1C29&R1C28 -> 8,1,1300203,1; | AJ11: =RC[-24]&R2C28&R1C29&R2C28&RC[-13]&R2C28&R1C29&R1C28 -> 9,1,1300103,1; | AK11: =RC[-24]&R2C28&R1C29&R2C28&RC[-13]&R2C28&R1C29&R1C28 -> 10,1,1300203,1;
B12: 1 | D12: 1 | E12: 2 | F12: 3 | G12: 4 | H12: 5 | I12: 6 | J12: 7 | K12: 8 | L12: 9 | M12: 10 | Z12: =RC[2]&RC[3]&RC[4]&RC[5]&RC[6]&RC[7]&RC[8]&RC[9]&RC[10]&RC[11] -> 1,1,,1;2,1,,1;3,1,,1;4,1,,1;5,1,,1;6,1,,1;7,1,,1;8,1,,1;9,1,,1;10,1,,1; | AB12: =RC[-24]&R2C28&R1C29&R2C28&RC[-13]&R2C28&R1C29&R1C28 -> 1,1,,1; | AC12: =RC[-24]&R2C28&R1C29&R2C28&RC[-13]&R2C28&R1C29&R1C28 -> 2,1,,1; | AD12: =RC[-24]&R2C28&R1C29&R2C28&RC[-13]&R2C28&R1C29&R1C28 -> 3,1,,1; | AE12: =RC[-24]&R2C28&R1C29&R2C28&RC[-13]&R2C28&R1C29&R1C28 -> 4,1,,1; | AF12: =RC[-24]&R2C28&R1C29&R2C28&RC[-13]&R2C28&R1C29&R1C28 -> 5,1,,1; | AG12: =RC[-24]&R2C28&R1C29&R2C28&RC[-13]&R2C28&R1C29&R1C28 -> 6,1,,1; | AH12: =RC[-24]&R2C28&R1C29&R2C28&RC[-13]&R2C28&R1C29&R1C28 -> 7,1,,1; | AI12: =RC[-24]&R2C28&R1C29&R2C28&RC[-13]&R2C28&R1C29&R1C28 -> 8,1,,1; | AJ12: =RC[-24]&R2C28&R1C29&R2C28&RC[-13]&R2C28&R1C29&R1C28 -> 9,1,,1; | AK12: =RC[-24]&R2C28&R1C29&R2C28&RC[-13]&R2C28&R1C29&R1C28 -> 10,1,,1;
B13: 1 | D13: 1 | E13: 2 | F13: 3 | G13: 4 | H13: 5 | I13: 6 | J13: 7 | K13: 8 | L13: 9 | M13: 10 | Z13: =RC[2]&RC[3]&RC[4]&RC[5]&RC[6]&RC[7]&RC[8]&RC[9]&RC[10]&RC[11] -> 1,1,,1;2,1,,1;3,1,,1;4,1,,1;5,1,,1;6,1,,1;7,1,,1;8,1,,1;9,1,,1;10,1,,1; | AB13: =RC[-24]&R2C28&R1C29&R2C28&RC[-13]&R2C28&R1C29&R1C28 -> 1,1,,1; | AC13: =RC[-24]&R2C28&R1C29&R2C28&RC[-13]&R2C28&R1C29&R1C28 -> 2,1,,1; | AD13: =RC[-24]&R2C28&R1C29&R2C28&RC[-13]&R2C28&R1C29&R1C28 -> 3,1,,1; | AE13: =RC[-24]&R2C28&R1C29&R2C28&RC[-13]&R2C28&R1C29&R1C28 -> 4,1,,1; | AF13: =RC[-24]&R2C28&R1C29&R2C28&RC[-13]&R2C28&R1C29&R1C28 -> 5,1,,1; | AG13: =RC[-24]&R2C28&R1C29&R2C28&RC[-13]&R2C28&R1C29&R1C28 -> 6,1,,1; | AH13: =RC[-24]&R2C28&R1C29&R2C28&RC[-13]&R2C28&R1C29&R1C28 -> 7,1,,1; | AI13: =RC[-24]&R2C28&R1C29&R2C28&RC[-13]&R2C28&R1C29&R1C28 -> 8,1,,1; | AJ13: =RC[-24]&R2C28&R1C29&R2C28&RC[-13]&R2C28&R1C29&R1C28 -> 9,1,,1; | AK13: =RC[-24]&R2C28&R1C29&R2C28&RC[-13]&R2C28&R1C29&R1C28 -> 10,1,,1;
B14: 1 | D14: 1 | E14: 2 | F14: 3 | G14: 4 | H14: 5 | I14: 6 | J14: 7 | K14: 8 | L14: 9 | M14: 10 | Z14: =RC[2]&RC[3]&RC[4]&RC[5]&RC[6]&RC[7]&RC[8]&RC[9]&RC[10]&RC[11] -> 1,1,,1;2,1,,1;3,1,,1;4,1,,1;5,1,,1;6,1,,1;7,1,,1;8,1,,1;9,1,,1;10,1,,1; | AB14: =RC[-24]&R2C28&R1C29&R2C28&RC[-13]&R2C28&R1C29&R1C28 -> 1,1,,1; | AC14: =RC[-24]&R2C28&R1C29&R2C28&RC[-13]&R2C28&R1C29&R1C28 -> 2,1,,1; | AD14: =RC[-24]&R2C28&R1C29&R2C28&RC[-13]&R2C28&R1C29&R1C28 -> 3,1,,1; | AE14: =RC[-24]&R2C28&R1C29&R2C28&RC[-13]&R2C28&R1C29&R1C28 -> 4,1,,1; | AF14: =RC[-24]&R2C28&R1C29&R2C28&RC[-13]&R2C28&R1C29&R1C28 -> 5,1,,1; | AG14: =RC[-24]&R2C28&R1C29&R2C28&RC[-13]&R2C28&R1C29&R1C28 -> 6,1,,1; | AH14: =RC[-24]&R2C28&R1C29&R2C28&RC[-13]&R2C28&R1C29&R1C28 -> 7,1,,1; | AI14: =RC[-24]&R2C28&R1C29&R2C28&RC[-13]&R2C28&R1C29&R1C28 -> 8,1,,1; | AJ14: =RC[-24]&R2C28&R1C29&R2C28&RC[-13]&R2C28&R1C29&R1C28 -> 9,1,,1; | AK14: =RC[-24]&R2C28&R1C29&R2C28&RC[-13]&R2C28&R1C29&R1C28 -> 10,1,,1;
B15: 1 | D15: 1 | E15: 2 | F15: 3 | G15: 4 | H15: 5 | I15: 6 | J15: 7 | K15: 8 | L15: 9 | M15: 10 | Z15: =RC[2]&RC[3]&RC[4]&RC[5]&RC[6]&RC[7]&RC[8]&RC[9]&RC[10]&RC[11] -> 1,1,,1;2,1,,1;3,1,,1;4,1,,1;5,1,,1;6,1,,1;7,1,,1;8,1,,1;9,1,,1;10,1,,1; | AB15: =RC[-24]&R2C28&R1C29&R2C28&RC[-13]&R2C28&R1C29&R1C28 -> 1,1,,1; | AC15: =RC[-24]&R2C28&R1C29&R2C28&RC[-13]&R2C28&R1C29&R1C28 -> 2,1,,1; | AD15: =RC[-24]&R2C28&R1C29&R2C28&RC[-13]&R2C28&R1C29&R1C28 -> 3,1,,1; | AE15: =RC[-24]&R2C28&R1C29&R2C28&RC[-13]&R2C28&R1C29&R1C28 -> 4,1,,1; | AF15: =RC[-24]&R2C28&R1C29&R2C28&RC[-13]&R2C28&R1C29&R1C28 -> 5,1,,1; | AG15: =RC[-24]&R2C28&R1C29&R2C28&RC[-13]&R2C28&R1C29&R1C28 -> 6,1,,1; | AH15: =RC[-24]&R2C28&R1C29&R2C28&RC[-13]&R2C28&R1C29&R1C28 -> 7,1,,1; | AI15: =RC[-24]&R2C28&R1C29&R2C28&RC[-13]&R2C28&R1C29&R1C28 -> 8,1,,1; | AJ15: =RC[-24]&R2C28&R1C29&R2C28&RC[-13]&R2C28&R1C29&R1C28 -> 9,1,,1; | AK15: =RC[-24]&R2C28&R1C29&R2C28&RC[-13]&R2C28&R1C29&R1C28 -> 10,1,,1;
B16: 1 | D16: 1 | E16: 2 | F16: 3 | G16: 4 | H16: 5 | I16: 6 | J16: 7 | K16: 8 | L16: 9 | M16: 10 | Z16: =RC[2]&RC[3]&RC[4]&RC[5]&RC[6]&RC[7]&RC[8]&RC[9]&RC[10]&RC[11] -> 1,1,,1;2,1,,1;3,1,,1;4,1,,1;5,1,,1;6,1,,1;7,1,,1;8,1,,1;9,1,,1;10,1,,1; | AB16: =RC[-24]&R2C28&R1C29&R2C28&RC[-13]&R2C28&R1C29&R1C28 -> 1,1,,1; | AC16: =RC[-24]&R2C28&R1C29&R2C28&RC[-13]&R2C28&R1C29&R1C28 -> 2,1,,1; | AD16: =RC[-24]&R2C28&R1C29&R2C28&RC[-13]&R2C28&R1C29&R1C28 -> 3,1,,1; | AE16: =RC[-24]&R2C28&R1C29&R2C28&RC[-13]&R2C28&R1C29&R1C28 -> 4,1,,1; | AF16: =RC[-24]&R2C28&R1C29&R2C28&RC[-13]&R2C28&R1C29&R1C28 -> 5,1,,1; | AG16: =RC[-24]&R2C28&R1C29&R2C28&RC[-13]&R2C28&R1C29&R1C28 -> 6,1,,1; | AH16: =RC[-24]&R2C28&R1C29&R2C28&RC[-13]&R2C28&R1C29&R1C28 -> 7,1,,1; | AI16: =RC[-24]&R2C28&R1C29&R2C28&RC[-13]&R2C28&R1C29&R1C28 -> 8,1,,1; | AJ16: =RC[-24]&R2C28&R1C29&R2C28&RC[-13]&R2C28&R1C29&R1C28 -> 9,1,,1; | AK16: =RC[-24]&R2C28&R1C29&R2C28&RC[-13]&R2C28&R1C29&R1C28 -> 10,1,,1;
Z19: 1,1,1200101,1;2,1,1200201,1;3,1,1200101,1;4,1,1200201,1;5,1,1200101,1;6,1,1200201,1;7,1,1200101,1;8,1,1200201,1;9,1,1200101,1;10,1,1200201,1;
Z20: 1,1,1300101,1;2,1,1300201,1;3,1,1300101,1;4,1,1300201,1;5,1,1300101,1;6,1,1300201,1;7,1,1300101,1;8,1,1300201,1;9,1,1300101,1;10,1,1300201,1;
Z23: 1,1,1200102,1;2,1,1200202,1;3,1,1200102,1;4,1,1200202,1;5,1,1200102,1;6,1,1200202,1;7,1,1200102,1;8,1,1200202,1;9,1,1200102,1;10,1,1200202,1;
Z24: 1,1,1300102,1;2,1,1300202,1;3,1,1300102,1;4,1,1300202,1;5,1,1300102,1;6,1,1300202,1;7,1,1300102,1;8,1,1300202,1;9,1,1300102,1;10,1,1300202,1;
Z25: 1,1,1101102,1;2,1,1101202,1;3,1,1102102,1;4,1,1102202,1;5,1,1103102,1;6,1,1103202,1;7,1,1104102,1;8,1,1104202,1;9,1,1105102,1;10,1,1105202,1;
Z26: 1,1,1200103,1;2,1,1200203,1;3,1,1200103,1;4,1,1200203,1;5,1,1200103,1;6,1,1200203,1;7,1,1200103,1;8,1,1200203,1;9,1,1200103,1;10,1,1200203,1;
Z27: 1,1,1300103,1;2,1,1300203,1;3,1,1300103,1;4,1,1300203,1;5,1,1300103,1;6,1,1300203,1;7,1,1300103,1;8,1,1300203,1;9,1,1300103,1;10,1,1300203,1;

Sheet: Sheet3
B4: 任务类型 | C4: 任务奖励(角色ID，物品类型，物品ID，数量) | D4: 任务所需等级 | F4: 变化值 | G4: 序号 | H4: 经验 | I4: 总经验 | J4: =RC[10] -> 等级 | L4: 累计产出 | M4: 当次产出 | O4: 实际产出 | P4: 实际总经验 | Q4: 等级占比 | R4: =RC[6] -> 等级 | T4: 等级 | U4: 经验 | V4: 总经验 | W4: 取整 | X4: =RC[-4] -> 等级 | AA4: 产出银币
B5: 1 | C5: 0,1,7,20 | D5: 0 | G5: 1 | H5: =MID(RC[-5],7,20)*1 -> 20 | I5: =SUM(R5C8:RC[-1]) -> 20 | J5: =VLOOKUP(ROUND(RC[-1],-2),C[13]:C[14],2,TRUE) -> 2 | L5: 20 | O5: 20 | P5: =SUM(R5C15:RC[-1]) -> 20 | R5: =VLOOKUP(ROUND(RC[-2],-2),C23:C24,2,TRUE) -> 2 | S5: =RC[-9]-RC[-1] -> 0 | T5: 1 | U5: 41 | V5: =SUM(R[-1]C21:R5C[-1]) -> 41 | W5: =ROUND(RC[-1],-2) -> 0 | X5: =RC[-4] -> 1
B6: 1 | C6: 0,1,7,40 | D6: 0 | F6: 1 | G6: =R[-1]C+RC[-1] -> 2 | H6: =MID(RC[-5],7,20)*1 -> 40 | I6: =SUM(R5C8:RC[-1]) -> 60 | J6: =VLOOKUP(ROUND(RC[-1],-2),C[13]:C[14],2,TRUE) -> 2 | L6: =ROUND(R5C12+(R215C12-R5C12)/R214C7^3*R[-1]C[-5]^3,0) -> 20 | M6: =RC[-1]-R[-1]C[-1] -> 0 | N6: =ROUND(SUM(R[-4]C[-1]:RC[-1])/0.7*0.3,-3) -> 0 | O6: 40 | P6: =SUM(R5C15:RC[-1]) -> 60 | R6: =VLOOKUP(ROUND(RC[-2],-2),C23:C24,2,TRUE) -> 2 | S6: =RC[-9]-RC[-1] -> 0 | T6: 2 | U6: 140 | V6: =SUM(R5C21:R[-1]C[-1]) -> 41 | W6: =ROUND(RC[-1],-2) -> 0 | X6: =RC[-4] -> 2
B7: 1 | C7: 0,1,7,90 | D7: 0 | F7: 1 | G7: =R[-1]C+RC[-1] -> 3 | H7: =MID(RC[-5],7,20)*1 -> 90 | I7: =SUM(R5C8:RC[-1]) -> 150 | J7: =VLOOKUP(ROUND(RC[-1],-2),C[13]:C[14],2,TRUE) -> 3 | L7: =ROUND(R5C12+(R215C12-R5C12)/R214C7^3*R[-1]C[-5]^3,0) -> 24 | M7: =ROUND(RC[-1]-R[-1]C[-1],-1) -> 0 | N7: 0 | O7: 90 | P7: =SUM(R5C15:RC[-1]) -> 150 | R7: =VLOOKUP(ROUND(RC[-2],-2),C23:C24,2,TRUE) -> 3 | S7: =RC[-9]-RC[-1] -> 0 | T7: 3 | U7: 215 | V7: =SUM(R5C21:R[-1]C[-1]) -> 181 | W7: =ROUND(RC[-1],-2) -> 200 | X7: =RC[-4] -> 3
B8: 1 | C8: 0,1,7,110 | D8: 0 | F8: 1 | G8: =R[-1]C+RC[-1] -> 4 | H8: =MID(RC[-5],7,20)*1 -> 110 | I8: =SUM(R5C8:RC[-1]) -> 260 | J8: =VLOOKUP(ROUND(RC[-1],-2),C[13]:C[14],2,TRUE) -> 3 | L8: =ROUND(R5C12+(R215C12-R5C12)/R214C7^3*R[-1]C[-5]^3,0) -> 32 | M8: =ROUND(RC[-1]-R[-1]C[-1],-1) -> 10 | N8: 0 | O8: 110 | P8: =SUM(R5C15:RC[-1]) -> 260 | R8: =VLOOKUP(ROUND(RC[-2],-2),C23:C24,2,TRUE) -> 3 | S8: =RC[-9]-RC[-1] -> 0 | T8: 4 | U8: 273 | V8: =SUM(R5C21:R[-1]C[-1]) -> 396 | W8: =ROUND(RC[-1],-2) -> 400 | X8: =RC[-4] -> 4
B9: 1 | C9: 0,1,7,110 | D9: 0 | F9: 1 | G9: =R[-1]C+RC[-1] -> 5 | H9: =MID(RC[-5],7,20)*1 -> 110 | I9: =SUM(R5C8:RC[-1]) -> 370 | J9: =VLOOKUP(ROUND(RC[-1],-2),C[13]:C[14],2,TRUE) -> 4 | L9: =ROUND(R5C12+(R215C12-R5C12)/R214C7^3*R[-1]C[-5]^3,0) -> 50 | M9: =ROUND(RC[-1]-R[-1]C[-1],-1) -> 20 | N9: 0 | O9: 110 | P9: =SUM(R5C15:RC[-1]) -> 370 | R9: =VLOOKUP(ROUND(RC[-2],-2),C23:C24,2,TRUE) -> 4 | S9: =RC[-9]-RC[-1] -> 0 | T9: 5 | U9: 323 | V9: =SUM(R5C21:R[-1]C[-1]) -> 669 | W9: =ROUND(RC[-1],-2) -> 700 | X9: =RC[-4] -> 5
B10: 1 | C10: 0,1,7,300 | D10: 0 | F10: 1 | G10: =R[-1]C+RC[-1] -> 6 | H10: =MID(RC[-5],7,20)*1 -> 300 | I10: =SUM(R5C8:RC[-1]) -> 670 | J10: =VLOOKUP(ROUND(RC[-1],-2),C[13]:C[14],2,TRUE) -> 5 | L10: =ROUND(R5C12+(R215C12-R5C12)/R214C7^3*R[-1]C[-5]^3,0) -> 78 | M10: =ROUND(RC[-1]-R[-1]C[-1],-1) -> 30 | N10: 0 | O10: 300 | P10: =SUM(R5C15:RC[-1]) -> 670 | R10: =VLOOKUP(ROUND(RC[-2],-2),C23:C24,2,TRUE) -> 5 | S10: =RC[-9]-RC[-1] -> 0 | T10: 6 | U10: 371 | V10: =SUM(R5C21:R[-1]C[-1]) -> 992 | W10: =ROUND(RC[-1],-2) -> 1000 | X10: =RC[-4] -> 6
B11: 1 | C11: 0,1,7,120 | D11: 0 | F11: 1 | G11: =R[-1]C+RC[-1] -> 7 | H11: =MID(RC[-5],7,20)*1 -> 120 | I11: =SUM(R5C8:RC[-1]) -> 790 | J11: =VLOOKUP(ROUND(RC[-1],-2),C[13]:C[14],2,TRUE) -> 5 | L11: =ROUND(R5C12+(R215C12-R5C12)/R214C7^3*R[-1]C[-5]^3,0) -> 120 | M11: =ROUND(RC[-1]-R[-1]C[-1],-1) -> 40 | N11: =ROUND(SUM(R[-4]C[-1]:RC[-1])/0.7*0.3,-1) -> 40 | O11: 120 | P11: =SUM(R5C15:RC[-1]) -> 790 | R11: =VLOOKUP(ROUND(RC[-2],-2),C23:C24,2,TRUE) -> 5 | S11: =RC[-9]-RC[-1] -> 0 | T11: 7 | U11: 426 | V11: =SUM(R5C21:R[-1]C[-1]) -> 1363 | W11: =ROUND(RC[-1],-2) -> 1400 | X11: =RC[-4] -> 7
B12: 1 | C12: 0,1,7,550 | D12: 0 | F12: 1 | G12: =R[-1]C+RC[-1] -> 8 | H12: =MID(RC[-5],7,20)*1 -> 550 | I12: =SUM(R5C8:RC[-1]) -> 1340 | J12: =VLOOKUP(ROUND(RC[-1],-2),C[13]:C[14],2,TRUE) -> 6 | L12: =ROUND(R5C12+(R215C12-R5C12)/R214C7^3*R[-1]C[-5]^3,0) -> 178 | M12: =ROUND(RC[-1]-R[-1]C[-1],-1) -> 60 | N12: 0 | O12: 550 | P12: =SUM(R5C15:RC[-1]) -> 1340 | R12: =VLOOKUP(ROUND(RC[-2],-2),C23:C24,2,TRUE) -> 6 | S12: =RC[-9]-RC[-1] -> 0 | T12: 8 | U12: 496 | V12: =SUM(R5C21:R[-1]C[-1]) -> 1789 | W12: =ROUND(RC[-1],-2) -> 1800 | X12: =RC[-4] -> 8
B13: 1 | C13: 0,1,7,120 | D13: 0 | F13: 1 | G13: =R[-1]C+RC[-1] -> 9 | H13: =MID(RC[-5],7,20)*1 -> 120 | I13: =SUM(R5C8:RC[-1]) -> 1460 | J13: =VLOOKUP(ROUND(RC[-1],-2),C[13]:C[14],2,TRUE) -> 7 | L13: =ROUND(R5C12+(R215C12-R5C12)/R214C7^3*R[-1]C[-5]^3,0) -> 256 | M13: =ROUND(RC[-1]-R[-1]C[-1],-1) -> 80 | N13: 0 | O13: 350 | P13: =SUM(R5C15:RC[-1]) -> 1690 | R13: =VLOOKUP(ROUND(RC[-2],-2),C23:C24,2,TRUE) -> 7 | S13: =RC[-9]-RC[-1] -> 0 | T13: 9 | U13: 588 | V13: =SUM(R5C21:R[-1]C[-1]) -> 2285 | W13: =ROUND(RC[-1],-2) -> 2300 | X13: =RC[-4] -> 9
B14: 1 | C14: 0,1,7,700 | D14: 0 | F14: 1 | G14: =R[-1]C+RC[-1] -> 10 | H14: =MID(RC[-5],7,20)*1 -> 700 | I14: =SUM(R5C8:RC[-1]) -> 2160 | J14: =VLOOKUP(ROUND(RC[-1],-2),C[13]:C[14],2,TRUE) -> 8 | L14: =ROUND(R5C12+(R215C12-R5C12)/R214C7^3*R[-1]C[-5]^3,0) -> 356 | M14: =ROUND(RC[-1]-R[-1]C[-1],-1) -> 100 | N14: 0 | O14: 350 | P14: =SUM(R5C15:RC[-1]) -> 2040 | R14: =VLOOKUP(ROUND(RC[-2],-2),C23:C24,2,TRUE) -> 8 | S14: =RC[-9]-RC[-1] -> 0 | T14: 10 | U14: 710 | V14: =SUM(R5C21:R[-1]C[-1]) -> 2873 | W14: =ROUND(RC[-1],-2) -> 2900 | X14: =RC[-4] -> 10
B15: 1 | C15: 0,1,7,340 | D15: 0 | F15: 1 | G15: =R[-1]C+RC[-1] -> 11 | H15: =MID(RC[-5],7,20)*1 -> 340 | I15: =SUM(R5C8:RC[-1]) -> 2500 | J15: =VLOOKUP(ROUND(RC[-1],-2),C[13]:C[14],2,TRUE) -> 9 | L15: =ROUND(R5C12+(R215C12-R5C12)/R214C7^3*R[-1]C[-5]^3,0) -> 481 | M15: =ROUND(RC[-1]-R[-1]C[-1],-1) -> 130 | N15: 0 | O15: 350 | P15: =SUM(R5C15:RC[-1]) -> 2390 | R15: =VLOOKUP(ROUND(RC[-2],-2),C23:C24,2,TRUE) -> 9 | S15: =RC[-9]-RC[-1] -> 0 | T15: 11 | U15: 870 | V15: =SUM(R5C21:R[-1]C[-1]) -> 3583 | W15: =ROUND(RC[-1],-2) -> 3600 | X15: =RC[-4] -> 11
B16: 1 | C16: 0,1,7,150 | D16: 0 | F16: 1 | G16: =R[-1]C+RC[-1] -> 12 | H16: =MID(RC[-5],7,20)*1 -> 150 | I16: =SUM(R5C8:RC[-1]) -> 2650 | J16: =VLOOKUP(ROUND(RC[-1],-2),C[13]:C[14],2,TRUE) -> 9 | L16: =ROUND(R5C12+(R215C12-R5C12)/R214C7^3*R[-1]C[-5]^3,0) -> 634 | M16: =ROUND(RC[-1]-R[-1]C[-1],-1) -> 150 | N16: =ROUND(SUM(R[-4]C[-1]:RC[-1])/0.7*0.3,-2) -> 200 | O16: =RC[-2]+RC[-1] -> 350 | P16: =SUM(R5C15:RC[-1]) -> 2740 | R16: =VLOOKUP(ROUND(RC[-2],-2),C23:C24,2,TRUE) -> 9 | S16: =RC[-9]-RC[-1] -> 0 | T16: 12 | U16: 1076 | V16: =SUM(R5C21:R[-1]C[-1]) -> 4453 | W16: =ROUND(RC[-1],-2) -> 4500 | X16: =RC[-4] -> 12
B17: 1 | C17: 0,1,7,800 | D17: 0 | F17: 1 | G17: =R[-1]C+RC[-1] -> 13 | H17: =MID(RC[-5],7,20)*1 -> 800 | I17: =SUM(R5C8:RC[-1]) -> 3450 | J17: =VLOOKUP(ROUND(RC[-1],-2),C[13]:C[14],2,TRUE) -> 10 | L17: =ROUND(R5C12+(R215C12-R5C12)/R214C7^3*R[-1]C[-5]^3,0) -> 817 | M17: =ROUND(RC[-1]-R[-1]C[-1],-1) -> 180 | N17: 0 | O17: 500 | P17: =SUM(R5C15:RC[-1]) -> 3240 | R17: =VLOOKUP(ROUND(RC[-2],-2),C23:C24,2,TRUE) -> 10 | S17: =RC[-9]-RC[-1] -> 0 | T17: 13 | U17: 1336 | V17: =SUM(R5C21:R[-1]C[-1]) -> 5529 | W17: =ROUND(RC[-1],-2) -> 5500 | X17: =RC[-4] -> 13
B18: 1 | C18: 0,1,7,150 | D18: 0 | F18: 1 | G18: =R[-1]C+RC[-1] -> 14 | H18: =MID(RC[-5],7,20)*1 -> 150 | I18: =SUM(R5C8:RC[-1]) -> 3600 | J18: =VLOOKUP(ROUND(RC[-1],-2),C[13]:C[14],2,TRUE) -> 11 | L18: =ROUND(R5C12+(R215C12-R5C12)/R214C7^3*R[-1]C[-5]^3,0) -> 1033 | M18: =ROUND(RC[-1]-R[-1]C[-1],-2) -> 200 | N18: 0 | O18: 400 | P18: =SUM(R5C15:RC[-1]) -> 3640 | R18: =VLOOKUP(ROUND(RC[-2],-2),C23:C24,2,TRUE) -> 11 | S18: =RC[-9]-RC[-1] -> 0 | T18: 14 | U18: 1657 | V18: =SUM(R5C21:R[-1]C[-1]) -> 6865 | W18: =ROUND(RC[-1],-2) -> 6900 | X18: =RC[-4] -> 14
B19: 1 | C19: 0,1,7,1000 | D19: 0 | F19: 1 | G19: =R[-1]C+RC[-1] -> 15 | H19: =MID(RC[-5],7,20)*1 -> 1000 | I19: =SUM(R5C8:RC[-1]) -> 4600 | J19: =VLOOKUP(ROUND(RC[-1],-2),C[13]:C[14],2,TRUE) -> 12 | L19: =ROUND(R5C12+(R215C12-R5C12)/R214C7^3*R[-1]C[-5]^3,0) -> 1285 | M19: =ROUND(RC[-1]-R[-1]C[-1],-2) -> 300 | N19: 0 | O19: 400 | P19: =SUM(R5C15:RC[-1]) -> 4040 | R19: =VLOOKUP(ROUND(RC[-2],-2),C23:C24,2,TRUE) -> 11 | S19: =RC[-9]-RC[-1] -> 1 | T19: 15 | U19: 2048 | V19: =SUM(R5C21:R[-1]C[-1]) -> 8522 | W19: =ROUND(RC[-1],-2) -> 8500 | X19: =RC[-4] -> 15
B20: 1 | C20: 0,1,7,160 | D20: 0 | F20: 1 | G20: =R[-1]C+RC[-1] -> 16 | H20: =MID(RC[-5],7,20)*1 -> 160 | I20: =SUM(R5C8:RC[-1]) -> 4760 | J20: =VLOOKUP(ROUND(RC[-1],-2),C[13]:C[14],2,TRUE) -> 12 | L20: =ROUND(R5C12+(R215C12-R5C12)/R214C7^3*R[-1]C[-5]^3,0) -> 1576 | M20: =ROUND(RC[-1]-R[-1]C[-1],-2) -> 300 | N20: 0 | O20: 400 | P20: =SUM(R5C15:RC[-1]) -> 4440 | R20: =VLOOKUP(ROUND(RC[-2],-2),C23:C24,2,TRUE) -> 11 | S20: =RC[-9]-RC[-1] -> 1 | T20: 16 | U20: 2515 | V20: =SUM(R5C21:R[-1]C[-1]) -> 10570 | W20: =ROUND(RC[-1],-2) -> 10600 | X20: =RC[-4] -> 16
B21: 1 | C21: 0,1,7,160 | D21: 0 | F21: 1 | G21: =R[-1]C+RC[-1] -> 17 | H21: =MID(RC[-5],7,20)*1 -> 160 | I21: =SUM(R5C8:RC[-1]) -> 4920 | J21: =VLOOKUP(ROUND(RC[-1],-2),C[13]:C[14],2,TRUE) -> 12 | L21: =ROUND(R5C12+(R215C12-R5C12)/R214C7^3*R[-1]C[-5]^3,0) -> 1909 | M21: =ROUND(RC[-1]-R[-1]C[-1],-2) -> 300 | N21: =ROUND(SUM(R[-4]C[-1]:RC[-1])/0.7*0.3,-3) -> 1000 | O21: =RC[-2]+RC[-1] -> 1300 | P21: =SUM(R5C15:RC[-1]) -> 5740 | R21: =VLOOKUP(ROUND(RC[-2],-2),C23:C24,2,TRUE) -> 13 | S21: =RC[-9]-RC[-1] -> -1 | T21: 17 | U21: 3067 | V21: =SUM(R5C21:R[-1]C[-1]) -> 13085 | W21: =ROUND(RC[-1],-2) -> 13100 | X21: =RC[-4] -> 17
B22: 1 | C22: 0,1,7,1250 | D22: 0 | F22: 1 | G22: =R[-1]C+RC[-1] -> 18 | H22: =MID(RC[-5],7,20)*1 -> 1250 | I22: =SUM(R5C8:RC[-1]) -> 6170 | J22: =VLOOKUP(ROUND(RC[-1],-2),C[13]:C[14],2,TRUE) -> 13 | L22: =ROUND(R5C12+(R215C12-R5C12)/R214C7^3*R[-1]C[-5]^3,0) -> 2286 | M22: =ROUND(RC[-1]-R[-1]C[-1],-2) -> 400 | N22: 0 | O22: =RC[-2]+RC[-1] -> 400 | P22: =SUM(R5C15:RC[-1]) -> 6140 | R22: =VLOOKUP(ROUND(RC[-2],-2),C23:C24,2,TRUE) -> 13 | S22: =RC[-9]-RC[-1] -> 0 | T22: 18 | U22: 3712 | V22: =SUM(R5C21:R[-1]C[-1]) -> 16152 | W22: =ROUND(RC[-1],-2) -> 16200 | X22: =RC[-4] -> 18
B23: 1 | C23: 0,1,7,500 | D23: 0 | F23: 1 | G23: =R[-1]C+RC[-1] -> 19 | H23: =MID(RC[-5],7,20)*1 -> 500 | I23: =SUM(R5C8:RC[-1]) -> 6670 | J23: =VLOOKUP(ROUND(RC[-1],-2),C[13]:C[14],2,TRUE) -> 13 | L23: =ROUND(R5C12+(R215C12-R5C12)/R214C7^3*R[-1]C[-5]^3,0) -> 2709 | M23: =ROUND(RC[-1]-R[-1]C[-1],-2) -> 400 | N23: 0 | O23: =RC[-2]+RC[-1] -> 400 | P23: =SUM(R5C15:RC[-1]) -> 6540 | R23: =VLOOKUP(ROUND(RC[-2],-2),C23:C24,2,TRUE) -> 13 | S23: =RC[-9]-RC[-1] -> 0 | T23: 19 | U23: 4457 | V23: =SUM(R5C21:R[-1]C[-1]) -> 19864 | W23: =ROUND(RC[-1],-2) -> 19900 | X23: =RC[-4] -> 19
B24: 1 | C24: 0,1,7,500 | D24: 0 | F24: 1 | G24: =R[-1]C+RC[-1] -> 20 | H24: =MID(RC[-5],7,20)*1 -> 500 | I24: =SUM(R5C8:RC[-1]) -> 7170 | J24: =VLOOKUP(ROUND(RC[-1],-2),C[13]:C[14],2,TRUE) -> 14 | L24: =ROUND(R5C12+(R215C12-R5C12)/R214C7^3*R[-1]C[-5]^3,0) -> 3183 | M24: =ROUND(RC[-1]-R[-1]C[-1],-2) -> 500 | N24: 0 | O24: =RC[-2]+RC[-1] -> 500 | P24: =SUM(R5C15:RC[-1]) -> 7040 | R24: =VLOOKUP(ROUND(RC[-2],-2),C23:C24,2,TRUE) -> 14 | S24: =RC[-9]-RC[-1] -> 0 | T24: 20 | U24: 5310 | V24: =SUM(R5C21:R[-1]C[-1]) -> 24321 | W24: =ROUND(RC[-1],-2) -> 24300 | X24: =RC[-4] -> 20
B25: 1 | C25: 0,1,7,500 | D25: 0 | F25: 1 | G25: =R[-1]C+RC[-1] -> 21 | H25: =MID(RC[-5],7,20)*1 -> 500 | I25: =SUM(R5C8:RC[-1]) -> 7670 | J25: =VLOOKUP(ROUND(RC[-1],-2),C[13]:C[14],2,TRUE) -> 14 | L25: =ROUND(R5C12+(R215C12-R5C12)/R214C7^3*R[-1]C[-5]^3,0) -> 3709 | M25: =ROUND(RC[-1]-R[-1]C[-1],-2) -> 500 | N25: 0 | O25: =RC[-2]+RC[-1] -> 500 | P25: =SUM(R5C15:RC[-1]) -> 7540 | R25: =VLOOKUP(ROUND(RC[-2],-2),C23:C24,2,TRUE) -> 14 | S25: =RC[-9]-RC[-1] -> 0 | T25: 21 | U25: 6279 | V25: =SUM(R5C21:R[-1]C[-1]) -> 29631 | W25: =ROUND(RC[-1],-2) -> 29600 | X25: =RC[-4] -> 21
B26: 1 | C26: 0,1,7,500 | D26: 0 | F26: 1 | G26: =R[-1]C+RC[-1] -> 22 | H26: =MID(RC[-5],7,20)*1 -> 500 | I26: =SUM(R5C8:RC[-1]) -> 8170 | J26: =VLOOKUP(ROUND(RC[-1],-2),C[13]:C[14],2,TRUE) -> 14 | L26: =ROUND(R5C12+(R215C12-R5C12)/R214C7^3*R[-1]C[-5]^3,0) -> 4291 | M26: =ROUND(RC[-1]-R[-1]C[-1],-2) -> 600 | N26: =ROUND(SUM(R[-4]C[-1]:RC[-1])/0.7*0.3,-3) -> 1000 | O26: =RC[-2]+RC[-1] -> 1600 | P26: =SUM(R5C15:RC[-1]) -> 9140 | R26: =VLOOKUP(ROUND(RC[-2],-2),C23:C24,2,TRUE) -> 15 | S26: =RC[-9]-RC[-1] -> -1 | T26: 22 | U26: 7372 | V26: =SUM(R5C21:R[-1]C[-1]) -> 35910 | W26: =ROUND(RC[-1],-2) -> 35900 | X26: =RC[-4] -> 22
B27: 1 | C27: 0,1,7,2600 | D27: 0 | F27: 1 | G27: =R[-1]C+RC[-1] -> 23 | H27: =MID(RC[-5],7,20)*1 -> 2600 | I27: =SUM(R5C8:RC[-1]) -> 10770 | J27: =VLOOKUP(ROUND(RC[-1],-2),C[13]:C[14],2,TRUE) -> 16 | L27: =ROUND(R5C12+(R215C12-R5C12)/R214C7^3*R[-1]C[-5]^3,0) -> 4930 | M27: =ROUND(RC[-1]-R[-1]C[-1],-2) -> 600 | N27: 0 | O27: =RC[-2]+RC[-1] -> 600 | P27: =SUM(R5C15:RC[-1]) -> 9740 | R27: =VLOOKUP(ROUND(RC[-2],-2),C23:C24,2,TRUE) -> 15 | S27: =RC[-9]-RC[-1] -> 1 | T27: 23 | U27: 8597 | V27: =SUM(R5C21:R[-1]C[-1]) -> 43282 | W27: =ROUND(RC[-1],-2) -> 43300 | X27: =RC[-4] -> 23
B28: 1 | C28: 0,1,7,500 | D28: 0 | F28: 1 | G28: =R[-1]C+RC[-1] -> 24 | H28: =MID(RC[-5],7,20)*1 -> 500 | I28: =SUM(R5C8:RC[-1]) -> 11270 | J28: =VLOOKUP(ROUND(RC[-1],-2),C[13]:C[14],2,TRUE) -> 16 | L28: =ROUND(R5C12+(R215C12-R5C12)/R214C7^3*R[-1]C[-5]^3,0) -> 5631 | M28: =ROUND(RC[-1]-R[-1]C[-1],-2) -> 700 | N28: 0 | O28: =RC[-2]+RC[-1] -> 700 | P28: =SUM(R5C15:RC[-1]) -> 10440 | R28: =VLOOKUP(ROUND(RC[-2],-2),C23:C24,2,TRUE) -> 15 | S28: =RC[-9]-RC[-1] -> 1 | T28: 24 | U28: 9961 | V28: =SUM(R5C21:R[-1]C[-1]) -> 51879 | W28: =ROUND(RC[-1],-2) -> 51900 | X28: =RC[-4] -> 24
B29: 1 | C29: 0,1,7,800 | D29: 0 | F29: 1 | G29: =R[-1]C+RC[-1] -> 25 | H29: =MID(RC[-5],7,20)*1 -> 800 | I29: =SUM(R5C8:RC[-1]) -> 12070 | J29: =VLOOKUP(ROUND(RC[-1],-2),C[13]:C[14],2,TRUE) -> 16 | L29: =ROUND(R5C12+(R215C12-R5C12)/R214C7^3*R[-1]C[-5]^3,0) -> 6395 | M29: =ROUND(RC[-1]-R[-1]C[-1],-2) -> 800 | N29: 0 | O29: =RC[-2]+RC[-1] -> 800 | P29: =SUM(R5C15:RC[-1]) -> 11240 | R29: =VLOOKUP(ROUND(RC[-2],-2),C23:C24,2,TRUE) -> 16 | S29: =RC[-9]-RC[-1] -> 0 | T29: 25 | U29: 11473 | V29: =SUM(R5C21:R[-1]C[-1]) -> 61840 | W29: =ROUND(RC[-1],-2) -> 61800 | X29: =RC[-4] -> 25
B30: 1 | C30: 0,1,7,800 | D30: 0 | F30: 1 | G30: =R[-1]C+RC[-1] -> 26 | H30: =MID(RC[-5],7,20)*1 -> 800 | I30: =SUM(R5C8:RC[-1]) -> 12870 | J30: =VLOOKUP(ROUND(RC[-1],-2),C[13]:C[14],2,TRUE) -> 16 | L30: =ROUND(R5C12+(R215C12-R5C12)/R214C7^3*R[-1]C[-5]^3,0) -> 7225 | M30: =ROUND(RC[-1]-R[-1]C[-1],-2) -> 800 | N30: 0 | O30: =RC[-2]+RC[-1] -> 800 | P30: =SUM(R5C15:RC[-1]) -> 12040 | R30: =VLOOKUP(ROUND(RC[-2],-2),C23:C24,2,TRUE) -> 16 | S30: =RC[-9]-RC[-1] -> 0 | T30: 26 | U30: 13139 | V30: =SUM(R5C21:R[-1]C[-1]) -> 73313 | W30: =ROUND(RC[-1],-2) -> 73300 | X30: =RC[-4] -> 26
B31: 1 | C31: 0,1,7,800 | D31: 0 | F31: 1 | G31: =R[-1]C+RC[-1] -> 27 | H31: =MID(RC[-5],7,20)*1 -> 800 | I31: =SUM(R5C8:RC[-1]) -> 13670 | J31: =VLOOKUP(ROUND(RC[-1],-2),C[13]:C[14],2,TRUE) -> 17 | L31: =ROUND(R5C12+(R215C12-R5C12)/R214C7^3*R[-1]C[-5]^3,0) -> 8125 | M31: =ROUND(RC[-1]-R[-1]C[-1],-2) -> 900 | N31: =ROUND(SUM(R[-4]C[-1]:RC[-1])/0.7*0.3,-3) -> 2000 | O31: =RC[-2]+RC[-1] -> 2900 | P31: =SUM(R5C15:RC[-1]) -> 14940 | R31: =VLOOKUP(ROUND(RC[-2],-2),C23:C24,2,TRUE) -> 17 | S31: =RC[-9]-RC[-1] -> 0 | T31: 27 | U31: 14968 | V31: =SUM(R5C21:R[-1]C[-1]) -> 86452 | W31: =ROUND(RC[-1],-2) -> 86500 | X31: =RC[-4] -> 27
B32: 1 | C32: 0,1,7,4000 | D32: 0 | F32: 1 | G32: =R[-1]C+RC[-1] -> 28 | H32: =MID(RC[-5],7,20)*1 -> 4000 | I32: =SUM(R5C8:RC[-1]) -> 17670 | J32: =VLOOKUP(ROUND(RC[-1],-2),C[13]:C[14],2,TRUE) -> 18 | L32: =ROUND(R5C12+(R215C12-R5C12)/R214C7^3*R[-1]C[-5]^3,0) -> 9097 | M32: =ROUND(RC[-1]-R[-1]C[-1],-2) -> 1000 | N32: 0 | O32: =RC[-2]+RC[-1] -> 1000 | P32: =SUM(R5C15:RC[-1]) -> 15940 | R32: =VLOOKUP(ROUND(RC[-2],-2),C23:C24,2,TRUE) -> 17 | S32: =RC[-9]-RC[-1] -> 1 | T32: 28 | U32: 16968 | V32: =SUM(R5C21:R[-1]C[-1]) -> 101420 | W32: =ROUND(RC[-1],-2) -> 101400 | X32: =RC[-4] -> 28
B33: 1 | C33: 0,1,7,1300 | D33: 0 | F33: 1 | G33: =R[-1]C+RC[-1] -> 29 | H33: =MID(RC[-5],7,20)*1 -> 1300 | I33: =SUM(R5C8:RC[-1]) -> 18970 | J33: =VLOOKUP(ROUND(RC[-1],-2),C[13]:C[14],2,TRUE) -> 18 | L33: =ROUND(R5C12+(R215C12-R5C12)/R214C7^3*R[-1]C[-5]^3,0) -> 10143 | M33: =ROUND(RC[-1]-R[-1]C[-1],-2) -> 1000 | N33: 0 | O33: =RC[-2]+RC[-1] -> 1000 | P33: =SUM(R5C15:RC[-1]) -> 16940 | R33: =VLOOKUP(ROUND(RC[-2],-2),C23:C24,2,TRUE) -> 18 | S33: =RC[-9]-RC[-1] -> 0 | T33: 29 | U33: 19146 | V33: =SUM(R5C21:R[-1]C[-1]) -> 118388 | W33: =ROUND(RC[-1],-2) -> 118400 | X33: =RC[-4] -> 29
B34: 1 | C34: 0,1,7,1300 | D34: 0 | F34: 1 | G34: =R[-1]C+RC[-1] -> 30 | H34: =MID(RC[-5],7,20)*1 -> 1300 | I34: =SUM(R5C8:RC[-1]) -> 20270 | J34: =VLOOKUP(ROUND(RC[-1],-2),C[13]:C[14],2,TRUE) -> 19 | L34: =ROUND(R5C12+(R215C12-R5C12)/R214C7^3*R[-1]C[-5]^3,0) -> 11267 | M34: =ROUND(RC[-1]-R[-1]C[-1],-2) -> 1100 | N34: 0 | O34: =RC[-2]+RC[-1] -> 1100 | P34: =SUM(R5C15:RC[-1]) -> 18040 | R34: =VLOOKUP(ROUND(RC[-2],-2),C23:C24,2,TRUE) -> 18 | S34: =RC[-9]-RC[-1] -> 1 | T34: 30 | U34: 21510 | V34: =SUM(R5C21:R[-1]C[-1]) -> 137534 | W34: =ROUND(RC[-1],-2) -> 137500 | X34: =RC[-4] -> 30
B35: 1 | C35: 0,1,7,1300 | D35: 0 | F35: 1 | G35: =R[-1]C+RC[-1] -> 31 | H35: =MID(RC[-5],7,20)*1 -> 1300 | I35: =SUM(R5C8:RC[-1]) -> 21570 | J35: =VLOOKUP(ROUND(RC[-1],-2),C[13]:C[14],2,TRUE) -> 19 | L35: =ROUND(R5C12+(R215C12-R5C12)/R214C7^3*R[-1]C[-5]^3,0) -> 12471 | M35: =ROUND(RC[-1]-R[-1]C[-1],-2) -> 1200 | N35: 0 | O35: =RC[-2]+RC[-1] -> 1200 | P35: =SUM(R5C15:RC[-1]) -> 19240 | R35: =VLOOKUP(ROUND(RC[-2],-2),C23:C24,2,TRUE) -> 18 | S35: =RC[-9]-RC[-1] -> 1 | T35: 31 | U35: 24068 | V35: =SUM(R5C21:R[-1]C[-1]) -> 159044 | W35: =ROUND(RC[-1],-2) -> 159000 | X35: =RC[-4] -> 31
B36: 1 | C36: 0,1,7,1300 | D36: 0 | F36: 1 | G36: =R[-1]C+RC[-1] -> 32 | H36: =MID(RC[-5],7,20)*1 -> 1300 | I36: =SUM(R5C8:RC[-1]) -> 22870 | J36: =VLOOKUP(ROUND(RC[-1],-2),C[13]:C[14],2,TRUE) -> 19 | L36: =ROUND(R5C12+(R215C12-R5C12)/R214C7^3*R[-1]C[-5]^3,0) -> 13758 | M36: =ROUND(RC[-1]-R[-1]C[-1],-2) -> 1300 | N36: =ROUND(SUM(R[-4]C[-1]:RC[-1])/0.7*0.3,-3) -> 2000 | O36: =RC[-2]+RC[-1] -> 3300 | P36: =SUM(R5C15:RC[-1]) -> 22540 | R36: =VLOOKUP(ROUND(RC[-2],-2),C23:C24,2,TRUE) -> 19 | S36: =RC[-9]-RC[-1] -> 0 | T36: 32 | U36: 26828 | V36: =SUM(R5C21:R[-1]C[-1]) -> 183112 | W36: =ROUND(RC[-1],-2) -> 183100 | X36: =RC[-4] -> 32
B37: 1 | C37: 0,1,7,1300 | D37: 20 | F37: 1 | G37: =R[-1]C+RC[-1] -> 33 | H37: =MID(RC[-5],7,20)*1 -> 1300 | I37: =SUM(R5C8:RC[-1]) -> 24170 | J37: =VLOOKUP(ROUND(RC[-1],-2),C[13]:C[14],2,TRUE) -> 19 | L37: =ROUND(R5C12+(R215C12-R5C12)/R214C7^3*R[-1]C[-5]^3,0) -> 15131 | M37: =ROUND(RC[-1]-R[-1]C[-1],-2) -> 1400 | N37: 0 | O37: =RC[-2]+RC[-1] -> 1400 | P37: =SUM(R5C15:RC[-1]) -> 23940 | Q37: =ROUND(RC[-4]/VLOOKUP(RC[-13],C20:C22,2,FALSE),3) -> 0.264 | R37: =VLOOKUP(ROUND(RC[-2],-2),C23:C24,2,TRUE) -> 19 | S37: =RC[-9]-RC[-1] -> 0 | T37: 33 | U37: 29798 | V37: =SUM(R5C21:R[-1]C[-1]) -> 209940 | W37: =ROUND(RC[-1],-2) -> 209900 | X37: =RC[-4] -> 33
B38: 1 | C38: 0,1,7,3000 | D38: 20 | F38: 1 | G38: =R[-1]C+RC[-1] -> 34 | H38: =MID(RC[-5],7,20)*1 -> 3000 | I38: =SUM(R5C8:RC[-1]) -> 27170 | J38: =VLOOKUP(ROUND(RC[-1],-2),C[13]:C[14],2,TRUE) -> 20 | L38: =ROUND(R5C12+(R215C12-R5C12)/R214C7^3*R[-1]C[-5]^3,0) -> 16592 | M38: =ROUND(RC[-1]-R[-1]C[-1],-2) -> 1500 | N38: 0 | O38: =RC[-2]+RC[-1] -> 1500 | P38: =SUM(R5C15:RC[-1]) -> 25440 | Q38: =ROUND(RC[-4]/VLOOKUP(RC[-13],C20:C22,2,FALSE),3) -> 0.282 | R38: =VLOOKUP(ROUND(RC[-2],-2),C23:C24,2,TRUE) -> 20 | S38: =RC[-9]-RC[-1] -> 0 | T38: 34 | U38: 32985 | V38: =SUM(R5C21:R[-1]C[-1]) -> 239738 | W38: =ROUND(RC[-1],-2) -> 239700 | X38: =RC[-4] -> 34
B39: 1 | C39: 0,1,7,900 | D39: 20 | F39: 1 | G39: =R[-1]C+RC[-1] -> 35 | H39: =MID(RC[-5],7,20)*1 -> 900 | I39: =SUM(R5C8:RC[-1]) -> 28070 | J39: =VLOOKUP(ROUND(RC[-1],-2),C[13]:C[14],2,TRUE) -> 20 | L39: =ROUND(R5C12+(R215C12-R5C12)/R214C7^3*R[-1]C[-5]^3,0) -> 18145 | M39: =ROUND(RC[-1]-R[-1]C[-1],-2) -> 1600 | N39: 0 | O39: =RC[-2]+RC[-1] -> 1600 | P39: =SUM(R5C15:RC[-1]) -> 27040 | Q39: =ROUND(RC[-4]/VLOOKUP(RC[-13],C20:C22,2,FALSE),3) -> 0.301 | R39: =VLOOKUP(ROUND(RC[-2],-2),C23:C24,2,TRUE) -> 20 | S39: =RC[-9]-RC[-1] -> 0 | T39: 35 | U39: 36398 | V39: =SUM(R5C21:R[-1]C[-1]) -> 272723 | W39: =ROUND(RC[-1],-2) -> 272700 | X39: =RC[-4] -> 35
B40: 1 | C40: 0,1,7,900 | D40: 20 | F40: 1 | G40: =R[-1]C+RC[-1] -> 36 | H40: =MID(RC[-5],7,20)*1 -> 900 | I40: =SUM(R5C8:RC[-1]) -> 28970 | J40: =VLOOKUP(ROUND(RC[-1],-2),C[13]:C[14],2,TRUE) -> 20 | L40: =ROUND(R5C12+(R215C12-R5C12)/R214C7^3*R[-1]C[-5]^3,0) -> 19791 | M40: =ROUND(RC[-1]-R[-1]C[-1],-2) -> 1600 | N40: 0 | O40: =RC[-2]+RC[-1] -> 1600 | P40: =SUM(R5C15:RC[-1]) -> 28640 | Q40: =ROUND(RC[-4]/VLOOKUP(RC[-13],C20:C22,2,FALSE),3) -> 0.301 | R40: =VLOOKUP(ROUND(RC[-2],-2),C23:C24,2,TRUE) -> 20 | S40: =RC[-9]-RC[-1] -> 0 | T40: 36 | U40: 40043 | V40: =SUM(R5C21:R[-1]C[-1]) -> 309121 | W40: =ROUND(RC[-1],-2) -> 309100 | X40: =RC[-4] -> 36
B41: 1 | C41: 0,1,7,900 | D41: 20 | F41: 1 | G41: =R[-1]C+RC[-1] -> 37 | H41: =MID(RC[-5],7,20)*1 -> 900 | I41: =SUM(R5C8:RC[-1]) -> 29870 | J41: =VLOOKUP(ROUND(RC[-1],-2),C[13]:C[14],2,TRUE) -> 21 | L41: =ROUND(R5C12+(R215C12-R5C12)/R214C7^3*R[-1]C[-5]^3,0) -> 21535 | M41: =ROUND(RC[-1]-R[-1]C[-1],-2) -> 1700 | N41: =ROUND(SUM(R[-4]C[-1]:RC[-1])/0.7*0.3,-3) -> 3000 | O41: =RC[-2]+RC[-1] -> 4700 | P41: =SUM(R5C15:RC[-1]) -> 33340 | Q41: =ROUND(RC[-4]/VLOOKUP(RC[-13],C20:C22,2,FALSE),3) -> 0.32 | R41: =VLOOKUP(ROUND(RC[-2],-2),C23:C24,2,TRUE) -> 21 | S41: =RC[-9]-RC[-1] -> 0 | T41: 37 | U41: 43929 | V41: =SUM(R5C21:R[-1]C[-1]) -> 349164 | W41: =ROUND(RC[-1],-2) -> 349200 | X41: =RC[-4] -> 37
B42: 1 | C42: 0,1,7,900 | D42: 20 | F42: 1 | G42: =R[-1]C+RC[-1] -> 38 | H42: =MID(RC[-5],7,20)*1 -> 900 | I42: =SUM(R5C8:RC[-1]) -> 30770 | J42: =VLOOKUP(ROUND(RC[-1],-2),C[13]:C[14],2,TRUE) -> 21 | L42: =ROUND(R5C12+(R215C12-R5C12)/R214C7^3*R[-1]C[-5]^3,0) -> 23378 | M42: =ROUND(RC[-1]-R[-1]C[-1],-2) -> 1800 | N42: 0 | O42: =RC[-2]+RC[-1] -> 1800 | P42: =SUM(R5C15:RC[-1]) -> 35140 | Q42: =ROUND(RC[-4]/VLOOKUP(RC[-13],C20:C22,2,FALSE),3) -> 0.339 | R42: =VLOOKUP(ROUND(RC[-2],-2),C23:C24,2,TRUE) -> 21 | S42: =RC[-9]-RC[-1] -> 0 | T42: 38 | U42: 48064 | V42: =SUM(R5C21:R[-1]C[-1]) -> 393093 | W42: =ROUND(RC[-1],-2) -> 393100 | X42: =RC[-4] -> 38
B43: 1 | C43: 0,1,7,6000 | D43: 20 | F43: 1 | G43: =R[-1]C+RC[-1] -> 39 | H43: =MID(RC[-5],7,20)*1 -> 6000 | I43: =SUM(R5C8:RC[-1]) -> 36770 | J43: =VLOOKUP(ROUND(RC[-1],-2),C[13]:C[14],2,TRUE) -> 22 | L43: =ROUND(R5C12+(R215C12-R5C12)/R214C7^3*R[-1]C[-5]^3,0) -> 25324 | M43: =ROUND(RC[-1]-R[-1]C[-1],-2) -> 1900 | N43: 0 | O43: =RC[-2]+RC[-1] -> 1900 | P43: =SUM(R5C15:RC[-1]) -> 37040 | Q43: =ROUND(RC[-4]/VLOOKUP(RC[-13],C20:C22,2,FALSE),3) -> 0.358 | R43: =VLOOKUP(ROUND(RC[-2],-2),C23:C24,2,TRUE) -> 22 | S43: =RC[-9]-RC[-1] -> 0 | T43: 39 | U43: 52455 | V43: =SUM(R5C21:R[-1]C[-1]) -> 441157 | W43: =ROUND(RC[-1],-2) -> 441200 | X43: =RC[-4] -> 39
B44: 1 | C44: 0,1,7,900 | D44: 20 | F44: 1 | G44: =R[-1]C+RC[-1] -> 40 | H44: =MID(RC[-5],7,20)*1 -> 900 | I44: =SUM(R5C8:RC[-1]) -> 37670 | J44: =VLOOKUP(ROUND(RC[-1],-2),C[13]:C[14],2,TRUE) -> 22 | L44: =ROUND(R5C12+(R215C12-R5C12)/R214C7^3*R[-1]C[-5]^3,0) -> 27374 | M44: =ROUND(RC[-1]-R[-1]C[-1],-2) -> 2100 | N44: 0 | O44: =RC[-2]+RC[-1] -> 2100 | P44: =SUM(R5C15:RC[-1]) -> 39140 | Q44: =ROUND(RC[-4]/VLOOKUP(RC[-13],C20:C22,2,FALSE),3) -> 0.395 | R44: =VLOOKUP(ROUND(RC[-2],-2),C23:C24,2,TRUE) -> 22 | S44: =RC[-9]-RC[-1] -> 0 | T44: 40 | U44: 125642 | V44: =SUM(R5C21:R[-1]C[-1]) -> 493612 | W44: =ROUND(RC[-1],-2) -> 493600 | X44: =RC[-4] -> 40
B45: 1 | C45: 0,1,7,10500 | D45: 20 | F45: 1 | G45: =R[-1]C+RC[-1] -> 41 | H45: =MID(RC[-5],7,20)*1 -> 10500 | I45: =SUM(R5C8:RC[-1]) -> 48170 | J45: =VLOOKUP(ROUND(RC[-1],-2),C[13]:C[14],2,TRUE) -> 23 | L45: =ROUND(R5C12+(R215C12-R5C12)/R214C7^3*R[-1]C[-5]^3,0) -> 29533 | M45: =ROUND(RC[-1]-R[-1]C[-1],-3) -> 2000 | N45: 0 | O45: =RC[-2]+RC[-1] -> 2000 | P45: =SUM(R5C15:RC[-1]) -> 41140 | Q45: =ROUND(RC[-4]/VLOOKUP(RC[-13],C20:C22,2,FALSE),3) -> 0.377 | R45: =VLOOKUP(ROUND(RC[-2],-2),C23:C24,2,TRUE) -> 22 | S45: =RC[-9]-RC[-1] -> 1 | T45: 41 | U45: 148890 | V45: =SUM(R5C21:R[-1]C[-1]) -> 619254 | W45: =ROUND(RC[-1],-2) -> 619300 | X45: =RC[-4] -> 41
B46: 1 | C46: 0,1,7,900 | D46: 20 | F46: 1 | G46: =R[-1]C+RC[-1] -> 42 | H46: =MID(RC[-5],7,20)*1 -> 900 | I46: =SUM(R5C8:RC[-1]) -> 49070 | J46: =VLOOKUP(ROUND(RC[-1],-2),C[13]:C[14],2,TRUE) -> 23 | L46: =ROUND(R5C12+(R215C12-R5C12)/R214C7^3*R[-1]C[-5]^3,0) -> 31802 | M46: =ROUND(RC[-1]-R[-1]C[-1],-3) -> 2000 | N46: =ROUND(SUM(R[-4]C[-1]:RC[-1])/0.7*0.3,-3) -> 4000 | O46: =RC[-2]+RC[-1] -> 6000 | P46: =SUM(R5C15:RC[-1]) -> 47140 | Q46: =ROUND(RC[-4]/VLOOKUP(RC[-13],C20:C22,2,FALSE),3) -> 0.377 | R46: =VLOOKUP(ROUND(RC[-2],-2),C23:C24,2,TRUE) -> 23 | S46: =RC[-9]-RC[-1] -> 0 | T46: 42 | U46: 174835 | V46: =SUM(R5C21:R[-1]C[-1]) -> 768144 | W46: =ROUND(RC[-1],-2) -> 768100 | X46: =RC[-4] -> 42
B47: 1 | C47: 0,1,7,900 | D47: 20 | F47: 1 | G47: =R[-1]C+RC[-1] -> 43 | H47: =MID(RC[-5],7,20)*1 -> 900 | I47: =SUM(R5C8:RC[-1]) -> 49970 | J47: =VLOOKUP(ROUND(RC[-1],-2),C[13]:C[14],2,TRUE) -> 23 | L47: =ROUND(R5C12+(R215C12-R5C12)/R214C7^3*R[-1]C[-5]^3,0) -> 34185 | M47: =ROUND(RC[-1]-R[-1]C[-1],-3) -> 2000 | N47: 0 | O47: =RC[-2]+RC[-1] -> 2000 | P47: =SUM(R5C15:RC[-1]) -> 49140 | Q47: =ROUND(RC[-4]/VLOOKUP(RC[-13],C20:C22,2,FALSE),3) -> 0.377 | R47: =VLOOKUP(ROUND(RC[-2],-2),C23:C24,2,TRUE) -> 23 | S47: =RC[-9]-RC[-1] -> 0 | T47: 43 | U47: 203669 | V47: =SUM(R5C21:R[-1]C[-1]) -> 942979 | W47: =ROUND(RC[-1],-2) -> 943000 | X47: =RC[-4] -> 43
B48: 1 | C48: 0,1,7,3000 | D48: 20 | F48: 1 | G48: =R[-1]C+RC[-1] -> 44 | H48: =MID(RC[-5],7,20)*1 -> 3000 | I48: =SUM(R5C8:RC[-1]) -> 52970 | J48: =VLOOKUP(ROUND(RC[-1],-2),C[13]:C[14],2,TRUE) -> 24 | L48: =ROUND(R5C12+(R215C12-R5C12)/R214C7^3*R[-1]C[-5]^3,0) -> 36684 | M48: =ROUND(RC[-1]-R[-1]C[-1],-3) -> 2000 | N48: 0 | O48: =RC[-2]+RC[-1] -> 2000 | P48: =SUM(R5C15:RC[-1]) -> 51140 | Q48: =ROUND(RC[-4]/VLOOKUP(RC[-13],C20:C22,2,FALSE),3) -> 0.377 | R48: =VLOOKUP(ROUND(RC[-2],-2),C23:C24,2,TRUE) -> 23 | S48: =RC[-9]-RC[-1] -> 1 | T48: 44 | U48: 235588 | V48: =SUM(R5C21:R[-1]C[-1]) -> 1146648 | W48: =ROUND(RC[-1],-2) -> 1146600 | X48: =RC[-4] -> 44
B49: 1 | C49: 0,1,7,900 | D49: 20 | F49: 1 | G49: =R[-1]C+RC[-1] -> 45 | H49: =MID(RC[-5],7,20)*1 -> 900 | I49: =SUM(R5C8:RC[-1]) -> 53870 | J49: =VLOOKUP(ROUND(RC[-1],-2),C[13]:C[14],2,TRUE) -> 24 | L49: =ROUND(R5C12+(R215C12-R5C12)/R214C7^3*R[-1]C[-5]^3,0) -> 39302 | M49: =ROUND(RC[-1]-R[-1]C[-1],-3) -> 3000 | N49: 0 | O49: =RC[-2]+RC[-1] -> 3000 | P49: =SUM(R5C15:RC[-1]) -> 54140 | Q49: =ROUND(RC[-4]/VLOOKUP(RC[-13],C20:C22,2,FALSE),3) -> 0.565 | R49: =VLOOKUP(ROUND(RC[-2],-2),C23:C24,2,TRUE) -> 24 | S49: =RC[-9]-RC[-1] -> 0 | T49: 45 | U49: 270792 | V49: =SUM(R5C21:R[-1]C[-1]) -> 1382236 | W49: =ROUND(RC[-1],-2) -> 1382200 | X49: =RC[-4] -> 45
B50: 1 | C50: 0,1,7,900 | D50: 20 | F50: 1 | G50: =R[-1]C+RC[-1] -> 46 | H50: =MID(RC[-5],7,20)*1 -> 900 | I50: =SUM(R5C8:RC[-1]) -> 54770 | J50: =VLOOKUP(ROUND(RC[-1],-2),C[13]:C[14],2,TRUE) -> 24 | L50: =ROUND(R5C12+(R215C12-R5C12)/R214C7^3*R[-1]C[-5]^3,0) -> 42041 | M50: =ROUND(RC[-1]-R[-1]C[-1],-3) -> 3000 | N50: 0 | O50: =RC[-2]+RC[-1] -> 3000 | P50: =SUM(R5C15:RC[-1]) -> 57140 | Q50: =ROUND(RC[-4]/VLOOKUP(RC[-13],C20:C22,2,FALSE),3) -> 0.565 | R50: =VLOOKUP(ROUND(RC[-2],-2),C23:C24,2,TRUE) -> 24 | S50: =RC[-9]-RC[-1] -> 0 | T50: 46 | U50: 309491 | V50: =SUM(R5C21:R[-1]C[-1]) -> 1653028 | W50: =ROUND(RC[-1],-2) -> 1653000 | X50: =RC[-4] -> 46
B51: 1 | C51: 0,1,7,1100 | D51: 20 | F51: 1 | G51: =R[-1]C+RC[-1] -> 47 | H51: =MID(RC[-5],7,20)*1 -> 1100 | I51: =SUM(R5C8:RC[-1]) -> 55870 | J51: =VLOOKUP(ROUND(RC[-1],-2),C[13]:C[14],2,TRUE) -> 24 | L51: =ROUND(R5C12+(R215C12-R5C12)/R214C7^3*R[-1]C[-5]^3,0) -> 44906 | M51: =ROUND(RC[-1]-R[-1]C[-1],-3) -> 3000 | N51: =ROUND(SUM(R[-4]C[-1]:RC[-1])/0.7*0.3,-3) -> 6000 | O51: =RC[-2]+RC[-1] -> 9000 | P51: =SUM(R5C15:RC[-1]) -> 66140 | Q51: =ROUND(RC[-4]/VLOOKUP(RC[-13],C20:C22,2,FALSE),3) -> 0.565 | R51: =VLOOKUP(ROUND(RC[-2],-2),C23:C24,2,TRUE) -> 25 | S51: =RC[-9]-RC[-1] -> -1 | T51: 47 | U51: 351900 | V51: =SUM(R5C21:R[-1]C[-1]) -> 1962519 | W51: =ROUND(RC[-1],-2) -> 1962500 | X51: =RC[-4] -> 47
B52: 1 | C52: 0,1,7,18000 | D52: 20 | F52: 1 | G52: =R[-1]C+RC[-1] -> 48 | H52: =MID(RC[-5],7,20)*1 -> 18000 | I52: =SUM(R5C8:RC[-1]) -> 73870 | J52: =VLOOKUP(ROUND(RC[-1],-2),C[13]:C[14],2,TRUE) -> 26 | L52: =ROUND(R5C12+(R215C12-R5C12)/R214C7^3*R[-1]C[-5]^3,0) -> 47897 | M52: =ROUND(RC[-1]-R[-1]C[-1],-3) -> 3000 | N52: 0 | O52: =RC[-2]+RC[-1] -> 3000 | P52: =SUM(R5C15:RC[-1]) -> 69140 | Q52: =ROUND(RC[-4]/VLOOKUP(RC[-13],C20:C22,2,FALSE),3) -> 0.565 | R52: =VLOOKUP(ROUND(RC[-2],-2),C23:C24,2,TRUE) -> 25 | S52: =RC[-9]-RC[-1] -> 1 | T52: 48 | U52: 398238 | V52: =SUM(R5C21:R[-1]C[-1]) -> 2314419 | W52: =ROUND(RC[-1],-2) -> 2314400 | X52: =RC[-4] -> 48
B53: 1 | C53: 0,1,7,1100 | D53: 20 | F53: 1 | G53: =R[-1]C+RC[-1] -> 49 | H53: =MID(RC[-5],7,20)*1 -> 1100 | I53: =SUM(R5C8:RC[-1]) -> 74970 | J53: =VLOOKUP(ROUND(RC[-1],-2),C[13]:C[14],2,TRUE) -> 26 | L53: =ROUND(R5C12+(R215C12-R5C12)/R214C7^3*R[-1]C[-5]^3,0) -> 51019 | M53: =ROUND(RC[-1]-R[-1]C[-1],-3) -> 3000 | N53: 0 | O53: =RC[-2]+RC[-1] -> 3000 | P53: =SUM(R5C15:RC[-1]) -> 72140 | Q53: =ROUND(RC[-4]/VLOOKUP(RC[-13],C20:C22,2,FALSE),3) -> 0.565 | R53: =VLOOKUP(ROUND(RC[-2],-2),C23:C24,2,TRUE) -> 25 | S53: =RC[-9]-RC[-1] -> 1 | T53: 49 | U53: 448735 | V53: =SUM(R5C21:R[-1]C[-1]) -> 2712657 | W53: =ROUND(RC[-1],-2) -> 2712700 | X53: =RC[-4] -> 49
B54: 1 | C54: 0,1,7,1100 | D54: 20 | F54: 1 | G54: =R[-1]C+RC[-1] -> 50 | H54: =MID(RC[-5],7,20)*1 -> 1100 | I54: =SUM(R5C8:RC[-1]) -> 76070 | J54: =VLOOKUP(ROUND(RC[-1],-2),C[13]:C[14],2,TRUE) -> 26 | L54: =ROUND(R5C12+(R215C12-R5C12)/R214C7^3*R[-1]C[-5]^3,0) -> 54273 | M54: =ROUND(RC[-1]-R[-1]C[-1],-3) -> 3000 | N54: 0 | O54: =RC[-2]+RC[-1] -> 3000 | P54: =SUM(R5C15:RC[-1]) -> 75140 | Q54: =ROUND(RC[-4]/VLOOKUP(RC[-13],C20:C22,2,FALSE),3) -> 0.565 | R54: =VLOOKUP(ROUND(RC[-2],-2),C23:C24,2,TRUE) -> 26 | S54: =RC[-9]-RC[-1] -> 0 | T54: 50 | U54: 503622 | V54: =SUM(R5C21:R[-1]C[-1]) -> 3161392 | W54: =ROUND(RC[-1],-2) -> 3161400 | X54: =RC[-4] -> 50
B55: 1 | C55: 0,1,7,1100 | D55: 30 | F55: 1 | G55: =R[-1]C+RC[-1] -> 51 | H55: =MID(RC[-5],7,20)*1 -> 1100 | I55: =SUM(R5C8:RC[-1]) -> 77170 | J55: =VLOOKUP(ROUND(RC[-1],-2),C[13]:C[14],2,TRUE) -> 26 | L55: =ROUND(R5C12+(R215C12-R5C12)/R214C7^3*R[-1]C[-5]^3,0) -> 57663 | M55: =ROUND(RC[-1]-R[-1]C[-1],-3) -> 3000 | N55: 0 | O55: =RC[-2]+RC[-1] -> 3000 | P55: =SUM(R5C15:RC[-1]) -> 78140 | Q55: =ROUND(RC[-4]/VLOOKUP(RC[-13],C20:C22,2,FALSE),3) -> 0.139 | R55: =VLOOKUP(ROUND(RC[-2],-2),C23:C24,2,TRUE) -> 26 | S55: =RC[-9]-RC[-1] -> 0 | T55: 51 | U55: 563140 | V55: =SUM(R5C21:R[-1]C[-1]) -> 3665014 | W55: =ROUND(RC[-1],-2) -> 3665000 | X55: =RC[-4] -> 51
B56: 1 | C56: 0,1,7,1100 | D56: 30 | F56: 1 | G56: =R[-1]C+RC[-1] -> 52 | H56: =MID(RC[-5],7,20)*1 -> 1100 | I56: =SUM(R5C8:RC[-1]) -> 78270 | J56: =VLOOKUP(ROUND(RC[-1],-2),C[13]:C[14],2,TRUE) -> 26 | L56: =ROUND(R5C12+(R215C12-R5C12)/R214C7^3*R[-1]C[-5]^3,0) -> 61191 | M56: =ROUND(RC[-1]-R[-1]C[-1],-3) -> 4000 | N56: =ROUND(SUM(R[-4]C[-1]:RC[-1])/0.7*0.3,-3) -> 7000 | O56: =RC[-2]+RC[-1] -> 11000 | P56: =SUM(R5C15:RC[-1]) -> 89140 | Q56: =ROUND(RC[-4]/VLOOKUP(RC[-13],C20:C22,2,FALSE),3) -> 0.186 | R56: =VLOOKUP(ROUND(RC[-2],-2),C23:C24,2,TRUE) -> 27 | S56: =RC[-9]-RC[-1] -> -1 | T56: 52 | U56: 627534 | V56: =SUM(R5C21:R[-1]C[-1]) -> 4228154 | W56: =ROUND(RC[-1],-2) -> 4228200 | X56: =RC[-4] -> 52
B57: 1 | C57: 0,1,7,1100 | D57: 30 | F57: 1 | G57: =R[-1]C+RC[-1] -> 53 | H57: =MID(RC[-5],7,20)*1 -> 1100 | I57: =SUM(R5C8:RC[-1]) -> 79370 | J57: =VLOOKUP(ROUND(RC[-1],-2),C[13]:C[14],2,TRUE) -> 26 | L57: =ROUND(R5C12+(R215C12-R5C12)/R214C7^3*R[-1]C[-5]^3,0) -> 64860 | M57: =ROUND(RC[-1]-R[-1]C[-1],-3) -> 4000 | N57: 0 | O57: =RC[-2]+RC[-1] -> 4000 | P57: =SUM(R5C15:RC[-1]) -> 93140 | Q57: =ROUND(RC[-4]/VLOOKUP(RC[-13],C20:C22,2,FALSE),3) -> 0.186 | R57: =VLOOKUP(ROUND(RC[-2],-2),C23:C24,2,TRUE) -> 27 | S57: =RC[-9]-RC[-1] -> -1 | T57: 53 | U57: 697056 | V57: =SUM(R5C21:R[-1]C[-1]) -> 4855688 | W57: =ROUND(RC[-1],-2) -> 4855700 | X57: =RC[-4] -> 53
B58: 1 | C58: 0,1,7,1100 | D58: 30 | F58: 1 | G58: =R[-1]C+RC[-1] -> 54 | H58: =MID(RC[-5],7,20)*1 -> 1100 | I58: =SUM(R5C8:RC[-1]) -> 80470 | J58: =VLOOKUP(ROUND(RC[-1],-2),C[13]:C[14],2,TRUE) -> 26 | L58: =ROUND(R5C12+(R215C12-R5C12)/R214C7^3*R[-1]C[-5]^3,0) -> 68673 | M58: =ROUND(RC[-1]-R[-1]C[-1],-3) -> 4000 | N58: 0 | O58: =RC[-2]+RC[-1] -> 4000 | P58: =SUM(R5C15:RC[-1]) -> 97140 | Q58: =ROUND(RC[-4]/VLOOKUP(RC[-13],C20:C22,2,FALSE),3) -> 0.186 | R58: =VLOOKUP(ROUND(RC[-2],-2),C23:C24,2,TRUE) -> 27 | S58: =RC[-9]-RC[-1] -> -1 | T58: 54 | U58: 771966 | V58: =SUM(R5C21:R[-1]C[-1]) -> 5552744 | W58: =ROUND(RC[-1],-2) -> 5552700 | X58: =RC[-4] -> 54
B59: 1 | C59: 0,1,7,1100 | D59: 30 | F59: 1 | G59: =R[-1]C+RC[-1] -> 55 | H59: =MID(RC[-5],7,20)*1 -> 1100 | I59: =SUM(R5C8:RC[-1]) -> 81570 | J59: =VLOOKUP(ROUND(RC[-1],-2),C[13]:C[14],2,TRUE) -> 26 | L59: =ROUND(R5C12+(R215C12-R5C12)/R214C7^3*R[-1]C[-5]^3,0) -> 72633 | M59: =ROUND(RC[-1]-R[-1]C[-1],-3) -> 4000 | N59: 0 | O59: =RC[-2]+RC[-1] -> 4000 | P59: =SUM(R5C15:RC[-1]) -> 101140 | Q59: =ROUND(RC[-4]/VLOOKUP(RC[-13],C20:C22,2,FALSE),3) -> 0.186 | R59: =VLOOKUP(ROUND(RC[-2],-2),C23:C24,2,TRUE) -> 27 | S59: =RC[-9]-RC[-1] -> -1 | T59: 55 | U59: 852527 | V59: =SUM(R5C21:R[-1]C[-1]) -> 6324710 | W59: =ROUND(RC[-1],-2) -> 6324700 | X59: =RC[-4] -> 55
B60: 1 | C60: 0,1,7,1100 | D60: 30 | F60: 1 | G60: =R[-1]C+RC[-1] -> 56 | H60: =MID(RC[-5],7,20)*1 -> 1100 | I60: =SUM(R5C8:RC[-1]) -> 82670 | J60: =VLOOKUP(ROUND(RC[-1],-2),C[13]:C[14],2,TRUE) -> 26 | L60: =ROUND(R5C12+(R215C12-R5C12)/R214C7^3*R[-1]C[-5]^3,0) -> 76742 | M60: =ROUND(RC[-1]-R[-1]C[-1],-3) -> 4000 | N60: 0 | O60: =RC[-2]+RC[-1] -> 4000 | P60: =SUM(R5C15:RC[-1]) -> 105140 | Q60: =ROUND(RC[-4]/VLOOKUP(RC[-13],C20:C22,2,FALSE),3) -> 0.186 | R60: =VLOOKUP(ROUND(RC[-2],-2),C23:C24,2,TRUE) -> 28 | S60: =RC[-9]-RC[-1] -> -2 | T60: 56 | U60: 939010 | V60: =SUM(R5C21:R[-1]C[-1]) -> 7177237 | W60: =ROUND(RC[-1],-2) -> 7177200 | X60: =RC[-4] -> 56
B61: 1 | C61: 0,1,7,1100 | D61: 30 | F61: 1 | G61: =R[-1]C+RC[-1] -> 57 | H61: =MID(RC[-5],7,20)*1 -> 1100 | I61: =SUM(R5C8:RC[-1]) -> 83770 | J61: =VLOOKUP(ROUND(RC[-1],-2),C[13]:C[14],2,TRUE) -> 26 | L61: =ROUND(R5C12+(R215C12-R5C12)/R214C7^3*R[-1]C[-5]^3,0) -> 81004 | M61: =ROUND(RC[-1]-R[-1]C[-1],-3) -> 4000 | N61: =ROUND(SUM(R[-4]C[-1]:RC[-1])/0.7*0.3,-3) -> 9000 | O61: =RC[-2]+RC[-1] -> 13000 | P61: =SUM(R5C15:RC[-1]) -> 118140 | Q61: =ROUND(RC[-4]/VLOOKUP(RC[-13],C20:C22,2,FALSE),3) -> 0.186 | R61: =VLOOKUP(ROUND(RC[-2],-2),C23:C24,2,TRUE) -> 28 | S61: =RC[-9]-RC[-1] -> -2 | T61: 57 | U61: 1031693 | V61: =SUM(R5C21:R[-1]C[-1]) -> 8116247 | W61: =ROUND(RC[-1],-2) -> 8116200 | X61: =RC[-4] -> 57
B62: 1 | C62: 0,1,7,1300 | D62: 30 | F62: 1 | G62: =R[-1]C+RC[-1] -> 58 | H62: =MID(RC[-5],7,20)*1 -> 1300 | I62: =SUM(R5C8:RC[-1]) -> 85070 | J62: =VLOOKUP(ROUND(RC[-1],-2),C[13]:C[14],2,TRUE) -> 26 | L62: =ROUND(R5C12+(R215C12-R5C12)/R214C7^3*R[-1]C[-5]^3,0) -> 85420 | M62: =ROUND(RC[-1]-R[-1]C[-1],-3) -> 4000 | N62: 0 | O62: =RC[-2]+RC[-1] -> 4000 | P62: =SUM(R5C15:RC[-1]) -> 122140 | Q62: =ROUND(RC[-4]/VLOOKUP(RC[-13],C20:C22,2,FALSE),3) -> 0.186 | R62: =VLOOKUP(ROUND(RC[-2],-2),C23:C24,2,TRUE) -> 29 | S62: =RC[-9]-RC[-1] -> -3 | T62: 58 | U62: 1130858 | V62: =SUM(R5C21:R[-1]C[-1]) -> 9147940 | W62: =ROUND(RC[-1],-2) -> 9147900 | X62: =RC[-4] -> 58
B63: 1 | C63: 0,1,7,1300 | D63: 30 | F63: 1 | G63: =R[-1]C+RC[-1] -> 59 | H63: =MID(RC[-5],7,20)*1 -> 1300 | I63: =SUM(R5C8:RC[-1]) -> 86370 | J63: =VLOOKUP(ROUND(RC[-1],-2),C[13]:C[14],2,TRUE) -> 26 | L63: =ROUND(R5C12+(R215C12-R5C12)/R214C7^3*R[-1]C[-5]^3,0) -> 89994 | M63: =ROUND(RC[-1]-R[-1]C[-1],-3) -> 5000 | N63: 0 | O63: =RC[-2]+RC[-1] -> 5000 | P63: =SUM(R5C15:RC[-1]) -> 127140 | Q63: =ROUND(RC[-4]/VLOOKUP(RC[-13],C20:C22,2,FALSE),3) -> 0.232 | R63: =VLOOKUP(ROUND(RC[-2],-2),C23:C24,2,TRUE) -> 29 | S63: =RC[-9]-RC[-1] -> -3 | T63: 59 | U63: 1236796 | V63: =SUM(R5C21:R[-1]C[-1]) -> 10278798 | W63: =ROUND(RC[-1],-2) -> 10278800 | X63: =RC[-4] -> 59
B64: 1 | C64: 0,1,7,19900 | D64: 30 | F64: 1 | G64: =R[-1]C+RC[-1] -> 60 | H64: =MID(RC[-5],7,20)*1 -> 19900 | I64: =SUM(R5C8:RC[-1]) -> 106270 | J64: =VLOOKUP(ROUND(RC[-1],-2),C[13]:C[14],2,TRUE) -> 28 | L64: =ROUND(R5C12+(R215C12-R5C12)/R214C7^3*R[-1]C[-5]^3,0) -> 94729 | M64: =ROUND(RC[-1]-R[-1]C[-1],-3) -> 5000 | N64: 0 | O64: =RC[-2]+RC[-1] -> 5000 | P64: =SUM(R5C15:RC[-1]) -> 132140 | Q64: =ROUND(RC[-4]/VLOOKUP(RC[-13],C20:C22,2,FALSE),3) -> 0.232 | R64: =VLOOKUP(ROUND(RC[-2],-2),C23:C24,2,TRUE) -> 29 | S64: =RC[-9]-RC[-1] -> -1 | T64: 60 | U64: 1349802 | V64: =SUM(R5C21:R[-1]C[-1]) -> 11515594 | W64: =ROUND(RC[-1],-2) -> 11515600 | X64: =RC[-4] -> 60
B65: 1 | C65: 0,1,7,1300 | D65: 30 | F65: 1 | G65: =R[-1]C+RC[-1] -> 61 | H65: =MID(RC[-5],7,20)*1 -> 1300 | I65: =SUM(R5C8:RC[-1]) -> 107570 | J65: =VLOOKUP(ROUND(RC[-1],-2),C[13]:C[14],2,TRUE) -> 28 | L65: =ROUND(R5C12+(R215C12-R5C12)/R214C7^3*R[-1]C[-5]^3,0) -> 99626 | M65: =ROUND(RC[-1]-R[-1]C[-1],-3) -> 5000 | N65: 0 | O65: =RC[-2]+RC[-1] -> 5000 | P65: =SUM(R5C15:RC[-1]) -> 137140 | Q65: =ROUND(RC[-4]/VLOOKUP(RC[-13],C20:C22,2,FALSE),3) -> 0.232 | R65: =VLOOKUP(ROUND(RC[-2],-2),C23:C24,2,TRUE) -> 29 | S65: =RC[-9]-RC[-1] -> -1 | T65: 61 | U65: 1470178 | V65: =SUM(R5C21:R[-1]C[-1]) -> 12865396 | W65: =ROUND(RC[-1],-2) -> 12865400 | X65: =RC[-4] -> 61
B66: 1 | C66: 0,1,7,1300 | D66: 30 | F66: 1 | G66: =R[-1]C+RC[-1] -> 62 | H66: =MID(RC[-5],7,20)*1 -> 1300 | I66: =SUM(R5C8:RC[-1]) -> 108870 | J66: =VLOOKUP(ROUND(RC[-1],-2),C[13]:C[14],2,TRUE) -> 28 | L66: =ROUND(R5C12+(R215C12-R5C12)/R214C7^3*R[-1]C[-5]^3,0) -> 104690 | M66: =ROUND(RC[-1]-R[-1]C[-1],-3) -> 5000 | N66: =ROUND(SUM(R[-4]C[-1]:RC[-1])/0.7*0.3,-3) -> 10000 | O66: =RC[-2]+RC[-1] -> 15000 | P66: =SUM(R5C15:RC[-1]) -> 152140 | Q66: =ROUND(RC[-4]/VLOOKUP(RC[-13],C20:C22,2,FALSE),3) -> 0.232 | R66: =VLOOKUP(ROUND(RC[-2],-2),C23:C24,2,TRUE) -> 30 | S66: =RC[-9]-RC[-1] -> -2 | T66: 62 | U66: 1598232 | V66: =SUM(R5C21:R[-1]C[-1]) -> 14335574 | W66: =ROUND(RC[-1],-2) -> 14335600 | X66: =RC[-4] -> 62
B67: 1 | C67: 0,1,7,1300 | D67: 30 | F67: 1 | G67: =R[-1]C+RC[-1] -> 63 | H67: =MID(RC[-5],7,20)*1 -> 1300 | I67: =SUM(R5C8:RC[-1]) -> 110170 | J67: =VLOOKUP(ROUND(RC[-1],-2),C[13]:C[14],2,TRUE) -> 28 | L67: =ROUND(R5C12+(R215C12-R5C12)/R214C7^3*R[-1]C[-5]^3,0) -> 109923 | M67: =ROUND(RC[-1]-R[-1]C[-1],-3) -> 5000 | N67: 0 | O67: =RC[-2]+RC[-1] -> 5000 | P67: =SUM(R5C15:RC[-1]) -> 157140 | Q67: =ROUND(RC[-4]/VLOOKUP(RC[-13],C20:C22,2,FALSE),3) -> 0.232 | R67: =VLOOKUP(ROUND(RC[-2],-2),C23:C24,2,TRUE) -> 30 | S67: =RC[-9]-RC[-1] -> -2 | T67: 63 | U67: 1734279 | V67: =SUM(R5C21:R[-1]C[-1]) -> 15933806 | W67: =ROUND(RC[-1],-2) -> 15933800 | X67: =RC[-4] -> 63
B68: 1 | C68: 0,1,7,22800 | D68: 30 | F68: 1 | G68: =R[-1]C+RC[-1] -> 64 | H68: =MID(RC[-5],7,20)*1 -> 22800 | I68: =SUM(R5C8:RC[-1]) -> 132970 | J68: =VLOOKUP(ROUND(RC[-1],-2),C[13]:C[14],2,TRUE) -> 29 | L68: =ROUND(R5C12+(R215C12-R5C12)/R214C7^3*R[-1]C[-5]^3,0) -> 115327 | M68: =ROUND(RC[-1]-R[-1]C[-1],-3) -> 5000 | N68: 0 | O68: =RC[-2]+RC[-1] -> 5000 | P68: =SUM(R5C15:RC[-1]) -> 162140 | Q68: =ROUND(RC[-4]/VLOOKUP(RC[-13],C20:C22,2,FALSE),3) -> 0.232 | R68: =VLOOKUP(ROUND(RC[-2],-2),C23:C24,2,TRUE) -> 31 | S68: =RC[-9]-RC[-1] -> -2 | T68: 64 | U68: 1878640 | V68: =SUM(R5C21:R[-1]C[-1]) -> 17668085 | W68: =ROUND(RC[-1],-2) -> 17668100 | X68: =RC[-4] -> 64
B69: 1 | C69: 0,1,7,1300 | D69: 30 | F69: 1 | G69: =R[-1]C+RC[-1] -> 65 | H69: =MID(RC[-5],7,20)*1 -> 1300 | I69: =SUM(R5C8:RC[-1]) -> 134270 | J69: =VLOOKUP(ROUND(RC[-1],-2),C[13]:C[14],2,TRUE) -> 29 | L69: =ROUND(R5C12+(R215C12-R5C12)/R214C7^3*R[-1]C[-5]^3,0) -> 120905 | M69: =ROUND(RC[-1]-R[-1]C[-1],-3) -> 6000 | N69: 0 | O69: =RC[-2]+RC[-1] -> 6000 | P69: =SUM(R5C15:RC[-1]) -> 168140 | Q69: =ROUND(RC[-4]/VLOOKUP(RC[-13],C20:C22,2,FALSE),3) -> 0.279 | R69: =VLOOKUP(ROUND(RC[-2],-2),C23:C24,2,TRUE) -> 31 | S69: =RC[-9]-RC[-1] -> -2 | T69: 65 | U69: 2031642 | V69: =SUM(R5C21:R[-1]C[-1]) -> 19546725 | W69: =ROUND(RC[-1],-2) -> 19546700 | X69: =RC[-4] -> 65
B70: 1 | C70: 0,1,7,1300 | D70: 35 | F70: 1 | G70: =R[-1]C+RC[-1] -> 66 | H70: =MID(RC[-5],7,20)*1 -> 1300 | I70: =SUM(R5C8:RC[-1]) -> 135570 | J70: =VLOOKUP(ROUND(RC[-1],-2),C[13]:C[14],2,TRUE) -> 29 | L70: =ROUND(R5C12+(R215C12-R5C12)/R214C7^3*R[-1]C[-5]^3,0) -> 126661 | M70: =ROUND(RC[-1]-R[-1]C[-1],-3) -> 6000 | N70: 0 | O70: =RC[-2]+RC[-1] -> 6000 | P70: =SUM(R5C15:RC[-1]) -> 174140 | Q70: =ROUND(RC[-4]/VLOOKUP(RC[-13],C20:C22,2,FALSE),3) -> 0.165 | R70: =VLOOKUP(ROUND(RC[-2],-2),C23:C24,2,TRUE) -> 31 | S70: =RC[-9]-RC[-1] -> -2 | T70: 66 | U70: 2193618 | V70: =SUM(R5C21:R[-1]C[-1]) -> 21578367 | W70: =ROUND(RC[-1],-2) -> 21578400 | X70: =RC[-4] -> 66
B71: 1 | C71: 0,1,7,1300 | D71: 35 | F71: 1 | G71: =R[-1]C+RC[-1] -> 67 | H71: =MID(RC[-5],7,20)*1 -> 1300 | I71: =SUM(R5C8:RC[-1]) -> 136870 | J71: =VLOOKUP(ROUND(RC[-1],-2),C[13]:C[14],2,TRUE) -> 29 | L71: =ROUND(R5C12+(R215C12-R5C12)/R214C7^3*R[-1]C[-5]^3,0) -> 132596 | M71: =ROUND(RC[-1]-R[-1]C[-1],-3) -> 6000 | N71: =ROUND(SUM(R[-4]C[-1]:RC[-1])/0.7*0.3,-3) -> 12000 | O71: =RC[-2]+RC[-1] -> 18000 | P71: =SUM(R5C15:RC[-1]) -> 192140 | Q71: =ROUND(RC[-4]/VLOOKUP(RC[-13],C20:C22,2,FALSE),3) -> 0.165 | R71: =VLOOKUP(ROUND(RC[-2],-2),C23:C24,2,TRUE) -> 32 | S71: =RC[-9]-RC[-1] -> -3 | T71: 67 | U71: 2364906 | V71: =SUM(R5C21:R[-1]C[-1]) -> 23771985 | W71: =ROUND(RC[-1],-2) -> 23772000 | X71: =RC[-4] -> 67
B72: 1 | C72: 0,1,7,1600 | D72: 35 | F72: 1 | G72: =R[-1]C+RC[-1] -> 68 | H72: =MID(RC[-5],7,20)*1 -> 1600 | I72: =SUM(R5C8:RC[-1]) -> 138470 | J72: =VLOOKUP(ROUND(RC[-1],-2),C[13]:C[14],2,TRUE) -> 30 | L72: =ROUND(R5C12+(R215C12-R5C12)/R214C7^3*R[-1]C[-5]^3,0) -> 138714 | M72: =ROUND(RC[-1]-R[-1]C[-1],-3) -> 6000 | N72: 0 | O72: =RC[-2]+RC[-1] -> 6000 | P72: =SUM(R5C15:RC[-1]) -> 198140 | Q72: =ROUND(RC[-4]/VLOOKUP(RC[-13],C20:C22,2,FALSE),3) -> 0.165 | R72: =VLOOKUP(ROUND(RC[-2],-2),C23:C24,2,TRUE) -> 32 | S72: =RC[-9]-RC[-1] -> -2 | T72: 68 | U72: 2545854 | V72: =SUM(R5C21:R[-1]C[-1]) -> 26136891 | W72: =ROUND(RC[-1],-2) -> 26136900 | X72: =RC[-4] -> 68
B73: 1 | C73: 0,1,7,1600 | D73: 35 | F73: 1 | G73: =R[-1]C+RC[-1] -> 69 | H73: =MID(RC[-5],7,20)*1 -> 1600 | I73: =SUM(R5C8:RC[-1]) -> 140070 | J73: =VLOOKUP(ROUND(RC[-1],-2),C[13]:C[14],2,TRUE) -> 30 | L73: =ROUND(R5C12+(R215C12-R5C12)/R214C7^3*R[-1]C[-5]^3,0) -> 145018 | M73: =ROUND(RC[-1]-R[-1]C[-1],-3) -> 6000 | N73: 0 | O73: =RC[-2]+RC[-1] -> 6000 | P73: =SUM(R5C15:RC[-1]) -> 204140 | Q73: =ROUND(RC[-4]/VLOOKUP(RC[-13],C20:C22,2,FALSE),3) -> 0.165 | R73: =VLOOKUP(ROUND(RC[-2],-2),C23:C24,2,TRUE) -> 32 | S73: =RC[-9]-RC[-1] -> -2 | T73: 69 | U73: 2736814 | V73: =SUM(R5C21:R[-1]C[-1]) -> 28682745 | W73: =ROUND(RC[-1],-2) -> 28682700 | X73: =RC[-4] -> 69
B74: 1 | C74: 0,1,7,1600 | D74: 35 | F74: 1 | G74: =R[-1]C+RC[-1] -> 70 | H74: =MID(RC[-5],7,20)*1 -> 1600 | I74: =SUM(R5C8:RC[-1]) -> 141670 | J74: =VLOOKUP(ROUND(RC[-1],-2),C[13]:C[14],2,TRUE) -> 30 | L74: =ROUND(R5C12+(R215C12-R5C12)/R214C7^3*R[-1]C[-5]^3,0) -> 151509 | M74: =ROUND(RC[-1]-R[-1]C[-1],-3) -> 6000 | N74: 0 | O74: =RC[-2]+RC[-1] -> 6000 | P74: =SUM(R5C15:RC[-1]) -> 210140 | Q74: =ROUND(RC[-4]/VLOOKUP(RC[-13],C20:C22,2,FALSE),3) -> 0.165 | R74: =VLOOKUP(ROUND(RC[-2],-2),C23:C24,2,TRUE) -> 33 | S74: =RC[-9]-RC[-1] -> -3 | T74: 70 | U74: 2938142 | V74: =SUM(R5C21:R[-1]C[-1]) -> 31419559 | W74: =ROUND(RC[-1],-2) -> 31419600 | X74: =RC[-4] -> 70
B75: 1 | C75: 0,1,7,1600 | D75: 35 | F75: 1 | G75: =R[-1]C+RC[-1] -> 71 | H75: =MID(RC[-5],7,20)*1 -> 1600 | I75: =SUM(R5C8:RC[-1]) -> 143270 | J75: =VLOOKUP(ROUND(RC[-1],-2),C[13]:C[14],2,TRUE) -> 30 | L75: =ROUND(R5C12+(R215C12-R5C12)/R214C7^3*R[-1]C[-5]^3,0) -> 158191 | M75: =ROUND(RC[-1]-R[-1]C[-1],-3) -> 7000 | N75: 0 | O75: =RC[-2]+RC[-1] -> 7000 | P75: =SUM(R5C15:RC[-1]) -> 217140 | Q75: =ROUND(RC[-4]/VLOOKUP(RC[-13],C20:C22,2,FALSE),3) -> 0.192 | R75: =VLOOKUP(ROUND(RC[-2],-2),C23:C24,2,TRUE) -> 33 | S75: =RC[-9]-RC[-1] -> -3 | T75: 71 | U75: 3150204 | V75: =SUM(R5C21:R[-1]C[-1]) -> 34357701 | W75: =ROUND(RC[-1],-2) -> 34357700 | X75: =RC[-4] -> 71
B76: 1 | C76: 0,1,7,1600 | D76: 35 | F76: 1 | G76: =R[-1]C+RC[-1] -> 72 | H76: =MID(RC[-5],7,20)*1 -> 1600 | I76: =SUM(R5C8:RC[-1]) -> 144870 | J76: =VLOOKUP(ROUND(RC[-1],-2),C[13]:C[14],2,TRUE) -> 30 | L76: =ROUND(R5C12+(R215C12-R5C12)/R214C7^3*R[-1]C[-5]^3,0) -> 165067 | M76: =ROUND(RC[-1]-R[-1]C[-1],-3) -> 7000 | N76: =ROUND(SUM(R[-4]C[-1]:RC[-1])/0.7*0.3,-3) -> 14000 | O76: =RC[-2]+RC[-1] -> 21000 | P76: =SUM(R5C15:RC[-1]) -> 238140 | Q76: =ROUND(RC[-4]/VLOOKUP(RC[-13],C20:C22,2,FALSE),3) -> 0.192 | R76: =VLOOKUP(ROUND(RC[-2],-2),C23:C24,2,TRUE) -> 33 | S76: =RC[-9]-RC[-1] -> -3 | T76: 72 | U76: 3373371 | V76: =SUM(R5C21:R[-1]C[-1]) -> 37507905 | W76: =ROUND(RC[-1],-2) -> 37507900 | X76: =RC[-4] -> 72
B77: 1 | C77: 0,1,7,1600 | D77: 35 | F77: 1 | G77: =R[-1]C+RC[-1] -> 73 | H77: =MID(RC[-5],7,20)*1 -> 1600 | I77: =SUM(R5C8:RC[-1]) -> 146470 | J77: =VLOOKUP(ROUND(RC[-1],-2),C[13]:C[14],2,TRUE) -> 30 | L77: =ROUND(R5C12+(R215C12-R5C12)/R214C7^3*R[-1]C[-5]^3,0) -> 172140 | M77: =ROUND(RC[-1]-R[-1]C[-1],-3) -> 7000 | N77: 0 | O77: =RC[-2]+RC[-1] -> 7000 | P77: =SUM(R5C15:RC[-1]) -> 245140 | Q77: =ROUND(RC[-4]/VLOOKUP(RC[-13],C20:C22,2,FALSE),3) -> 0.192 | R77: =VLOOKUP(ROUND(RC[-2],-2),C23:C24,2,TRUE) -> 34 | S77: =RC[-9]-RC[-1] -> -4 | T77: 73 | U77: 3608018 | V77: =SUM(R5C21:R[-1]C[-1]) -> 40881276 | W77: =ROUND(RC[-1],-2) -> 40881300 | X77: =RC[-4] -> 73
B78: 1 | C78: 0,1,7,1600 | D78: 35 | F78: 1 | G78: =R[-1]C+RC[-1] -> 74 | H78: =MID(RC[-5],7,20)*1 -> 1600 | I78: =SUM(R5C8:RC[-1]) -> 148070 | J78: =VLOOKUP(ROUND(RC[-1],-2),C[13]:C[14],2,TRUE) -> 30 | L78: =ROUND(R5C12+(R215C12-R5C12)/R214C7^3*R[-1]C[-5]^3,0) -> 179412 | M78: =ROUND(RC[-1]-R[-1]C[-1],-3) -> 7000 | N78: 0 | O78: =RC[-2]+RC[-1] -> 7000 | P78: =SUM(R5C15:RC[-1]) -> 252140 | Q78: =ROUND(RC[-4]/VLOOKUP(RC[-13],C20:C22,2,FALSE),3) -> 0.192 | R78: =VLOOKUP(ROUND(RC[-2],-2),C23:C24,2,TRUE) -> 34 | S78: =RC[-9]-RC[-1] -> -4 | T78: 74 | U78: 3854531 | V78: =SUM(R5C21:R[-1]C[-1]) -> 44489294 | W78: =ROUND(RC[-1],-2) -> 44489300 | X78: =RC[-4] -> 74
B79: 1 | C79: 0,1,7,1800 | D79: 35 | F79: 1 | G79: =R[-1]C+RC[-1] -> 75 | H79: =MID(RC[-5],7,20)*1 -> 1800 | I79: =SUM(R5C8:RC[-1]) -> 149870 | J79: =VLOOKUP(ROUND(RC[-1],-2),C[13]:C[14],2,TRUE) -> 30 | L79: =ROUND(R5C12+(R215C12-R5C12)/R214C7^3*R[-1]C[-5]^3,0) -> 186885 | M79: =ROUND(RC[-1]-R[-1]C[-1],-3) -> 7000 | N79: 0 | O79: =RC[-2]+RC[-1] -> 7000 | P79: =SUM(R5C15:RC[-1]) -> 259140 | Q79: =ROUND(RC[-4]/VLOOKUP(RC[-13],C20:C22,2,FALSE),3) -> 0.192 | R79: =VLOOKUP(ROUND(RC[-2],-2),C23:C24,2,TRUE) -> 34 | S79: =RC[-9]-RC[-1] -> -4 | T79: 75 | U79: 4113297 | V79: =SUM(R5C21:R[-1]C[-1]) -> 48343825 | W79: =ROUND(RC[-1],-2) -> 48343800 | X79: =RC[-4] -> 75
B80: 1 | C80: 0,1,7,1800 | D80: 35 | F80: 1 | G80: =R[-1]C+RC[-1] -> 76 | H80: =MID(RC[-5],7,20)*1 -> 1800 | I80: =SUM(R5C8:RC[-1]) -> 151670 | J80: =VLOOKUP(ROUND(RC[-1],-2),C[13]:C[14],2,TRUE) -> 30 | L80: =ROUND(R5C12+(R215C12-R5C12)/R214C7^3*R[-1]C[-5]^3,0) -> 194564 | M80: =ROUND(RC[-1]-R[-1]C[-1],-3) -> 8000 | N80: 0 | O80: =RC[-2]+RC[-1] -> 8000 | P80: =SUM(R5C15:RC[-1]) -> 267140 | Q80: =ROUND(RC[-4]/VLOOKUP(RC[-13],C20:C22,2,FALSE),3) -> 0.22 | R80: =VLOOKUP(ROUND(RC[-2],-2),C23:C24,2,TRUE) -> 34 | S80: =RC[-9]-RC[-1] -> -4 | T80: 76 | U80: 4384713 | V80: =SUM(R5C21:R[-1]C[-1]) -> 52457122 | W80: =ROUND(RC[-1],-2) -> 52457100 | X80: =RC[-4] -> 76
B81: 1 | C81: 0,1,7,30300 | D81: 35 | F81: 1 | G81: =R[-1]C+RC[-1] -> 77 | H81: =MID(RC[-5],7,20)*1 -> 30300 | I81: =SUM(R5C8:RC[-1]) -> 181970 | J81: =VLOOKUP(ROUND(RC[-1],-2),C[13]:C[14],2,TRUE) -> 31 | L81: =ROUND(R5C12+(R215C12-R5C12)/R214C7^3*R[-1]C[-5]^3,0) -> 202450 | M81: =ROUND(RC[-1]-R[-1]C[-1],-3) -> 8000 | N81: =ROUND(SUM(R[-4]C[-1]:RC[-1])/0.7*0.3,-3) -> 16000 | O81: =RC[-2]+RC[-1] -> 24000 | P81: =SUM(R5C15:RC[-1]) -> 291140 | Q81: =ROUND(RC[-4]/VLOOKUP(RC[-13],C20:C22,2,FALSE),3) -> 0.22 | R81: =VLOOKUP(ROUND(RC[-2],-2),C23:C24,2,TRUE) -> 35 | S81: =RC[-9]-RC[-1] -> -4 | T81: 77 | U81: 4669180 | V81: =SUM(R5C21:R[-1]C[-1]) -> 56841835 | W81: =ROUND(RC[-1],-2) -> 56841800 | X81: =RC[-4] -> 77
B82: 1 | C82: 0,1,7,1800 | D82: 35 | F82: 1 | G82: =R[-1]C+RC[-1] -> 78 | H82: =MID(RC[-5],7,20)*1 -> 1800 | I82: =SUM(R5C8:RC[-1]) -> 183770 | J82: =VLOOKUP(ROUND(RC[-1],-2),C[13]:C[14],2,TRUE) -> 32 | L82: =ROUND(R5C12+(R215C12-R5C12)/R214C7^3*R[-1]C[-5]^3,0) -> 210546 | M82: =ROUND(RC[-1]-R[-1]C[-1],-3) -> 8000 | N82: 0 | O82: =RC[-2]+RC[-1] -> 8000 | P82: =SUM(R5C15:RC[-1]) -> 299140 | Q82: =ROUND(RC[-4]/VLOOKUP(RC[-13],C20:C22,2,FALSE),3) -> 0.22 | R82: =VLOOKUP(ROUND(RC[-2],-2),C23:C24,2,TRUE) -> 35 | S82: =RC[-9]-RC[-1] -> -3 | T82: 78 | U82: 4967106 | V82: =SUM(R5C21:R[-1]C[-1]) -> 61511015 | W82: =ROUND(RC[-1],-2) -> 61511000 | X82: =RC[-4] -> 78
B83: 1 | C83: 0,1,7,1800 | D83: 40 | F83: 1 | G83: =R[-1]C+RC[-1] -> 79 | H83: =MID(RC[-5],7,20)*1 -> 1800 | I83: =SUM(R5C8:RC[-1]) -> 185570 | J83: =VLOOKUP(ROUND(RC[-1],-2),C[13]:C[14],2,TRUE) -> 32 | L83: =ROUND(R5C12+(R215C12-R5C12)/R214C7^3*R[-1]C[-5]^3,0) -> 218855 | M83: =ROUND(RC[-1]-R[-1]C[-1],-3) -> 8000 | N83: 0 | O83: =RC[-2]+RC[-1] -> 8000 | P83: =SUM(R5C15:RC[-1]) -> 307140 | Q83: =ROUND(RC[-4]/VLOOKUP(RC[-13],C20:C22,2,FALSE),3) -> 0.064 | R83: =VLOOKUP(ROUND(RC[-2],-2),C23:C24,2,TRUE) -> 35 | S83: =RC[-9]-RC[-1] -> -3 | T83: 79 | U83: 5278907 | V83: =SUM(R5C21:R[-1]C[-1]) -> 66478121 | W83: =ROUND(RC[-1],-2) -> 66478100 | X83: =RC[-4] -> 79
B84: 1 | C84: 0,1,7,1800 | D84: 40 | F84: 1 | G84: =R[-1]C+RC[-1] -> 80 | H84: =MID(RC[-5],7,20)*1 -> 1800 | I84: =SUM(R5C8:RC[-1]) -> 187370 | J84: =VLOOKUP(ROUND(RC[-1],-2),C[13]:C[14],2,TRUE) -> 32 | L84: =ROUND(R5C12+(R215C12-R5C12)/R214C7^3*R[-1]C[-5]^3,0) -> 227381 | M84: =ROUND(RC[-1]-R[-1]C[-1],-3) -> 9000 | N84: 0 | O84: =RC[-2]+RC[-1] -> 9000 | P84: =SUM(R5C15:RC[-1]) -> 316140 | Q84: =ROUND(RC[-4]/VLOOKUP(RC[-13],C20:C22,2,FALSE),3) -> 0.072 | R84: =VLOOKUP(ROUND(RC[-2],-2),C23:C24,2,TRUE) -> 36 | S84: =RC[-9]-RC[-1] -> -4 | T84: 80 | U84: 6165502 | V84: =SUM(R5C21:R[-1]C[-1]) -> 71757028 | W84: =ROUND(RC[-1],-2) -> 71757000 | X84: =RC[-4] -> 80
B85: 1 | C85: 0,1,7,1800 | D85: 40 | F85: 1 | G85: =R[-1]C+RC[-1] -> 81 | H85: =MID(RC[-5],7,20)*1 -> 1800 | I85: =SUM(R5C8:RC[-1]) -> 189170 | J85: =VLOOKUP(ROUND(RC[-1],-2),C[13]:C[14],2,TRUE) -> 32 | L85: =ROUND(R5C12+(R215C12-R5C12)/R214C7^3*R[-1]C[-5]^3,0) -> 236124 | M85: =ROUND(RC[-1]-R[-1]C[-1],-3) -> 9000 | N85: 0 | O85: =RC[-2]+RC[-1] -> 9000 | P85: =SUM(R5C15:RC[-1]) -> 325140 | Q85: =ROUND(RC[-4]/VLOOKUP(RC[-13],C20:C22,2,FALSE),3) -> 0.072 | R85: =VLOOKUP(ROUND(RC[-2],-2),C23:C24,2,TRUE) -> 36 | S85: =RC[-9]-RC[-1] -> -4 | T85: 81 | U85: 7134982 | V85: =SUM(R5C21:R[-1]C[-1]) -> 77922530 | W85: =ROUND(RC[-1],-2) -> 77922500 | X85: =RC[-4] -> 81
B86: 1 | C86: 0,1,7,1800 | D86: 40 | F86: 1 | G86: =R[-1]C+RC[-1] -> 82 | H86: =MID(RC[-5],7,20)*1 -> 1800 | I86: =SUM(R5C8:RC[-1]) -> 190970 | J86: =VLOOKUP(ROUND(RC[-1],-2),C[13]:C[14],2,TRUE) -> 32 | L86: =ROUND(R5C12+(R215C12-R5C12)/R214C7^3*R[-1]C[-5]^3,0) -> 245089 | M86: =ROUND(RC[-1]-R[-1]C[-1],-3) -> 9000 | N86: =ROUND(SUM(R[-4]C[-1]:RC[-1])/0.7*0.3,-3) -> 18000 | O86: =RC[-2]+RC[-1] -> 27000 | P86: =SUM(R5C15:RC[-1]) -> 352140 | Q86: =ROUND(RC[-4]/VLOOKUP(RC[-13],C20:C22,2,FALSE),3) -> 0.072 | R86: =VLOOKUP(ROUND(RC[-2],-2),C23:C24,2,TRUE) -> 37 | S86: =RC[-9]-RC[-1] -> -5 | T86: 82 | U86: 8192326 | V86: =SUM(R5C21:R[-1]C[-1]) -> 85057512 | W86: =ROUND(RC[-1],-2) -> 85057500 | X86: =RC[-4] -> 82
B87: 1 | C87: 0,1,7,1800 | D87: 40 | F87: 1 | G87: =R[-1]C+RC[-1] -> 83 | H87: =MID(RC[-5],7,20)*1 -> 1800 | I87: =SUM(R5C8:RC[-1]) -> 192770 | J87: =VLOOKUP(ROUND(RC[-1],-2),C[13]:C[14],2,TRUE) -> 32 | L87: =ROUND(R5C12+(R215C12-R5C12)/R214C7^3*R[-1]C[-5]^3,0) -> 254278 | M87: =ROUND(RC[-1]-R[-1]C[-1],-3) -> 9000 | N87: 0 | O87: =RC[-2]+RC[-1] -> 9000 | P87: =SUM(R5C15:RC[-1]) -> 361140 | Q87: =ROUND(RC[-4]/VLOOKUP(RC[-13],C20:C22,2,FALSE),3) -> 0.072 | R87: =VLOOKUP(ROUND(RC[-2],-2),C23:C24,2,TRUE) -> 37 | S87: =RC[-9]-RC[-1] -> -5 | T87: 83 | U87: 9342695 | V87: =SUM(R5C21:R[-1]C[-1]) -> 93249838 | W87: =ROUND(RC[-1],-2) -> 93249800 | X87: =RC[-4] -> 83
B88: 1 | C88: 0,1,7,46100 | D88: 40 | F88: 1 | G88: =R[-1]C+RC[-1] -> 84 | H88: =MID(RC[-5],7,20)*1 -> 46100 | I88: =SUM(R5C8:RC[-1]) -> 238870 | J88: =VLOOKUP(ROUND(RC[-1],-2),C[13]:C[14],2,TRUE) -> 33 | L88: =ROUND(R5C12+(R215C12-R5C12)/R214C7^3*R[-1]C[-5]^3,0) -> 263695 | M88: =ROUND(RC[-1]-R[-1]C[-1],-3) -> 9000 | N88: 0 | O88: =RC[-2]+RC[-1] -> 9000 | P88: =SUM(R5C15:RC[-1]) -> 370140 | Q88: =ROUND(RC[-4]/VLOOKUP(RC[-13],C20:C22,2,FALSE),3) -> 0.072 | R88: =VLOOKUP(ROUND(RC[-2],-2),C23:C24,2,TRUE) -> 37 | S88: =RC[-9]-RC[-1] -> -4 | T88: 84 | U88: 10591436 | V88: =SUM(R5C21:R[-1]C[-1]) -> 102592533 | W88: =ROUND(RC[-1],-2) -> 102592500 | X88: =RC[-4] -> 84
B89: 1 | C89: 0,1,7,1800 | D89: 40 | F89: 1 | G89: =R[-1]C+RC[-1] -> 85 | H89: =MID(RC[-5],7,20)*1 -> 1800 | I89: =SUM(R5C8:RC[-1]) -> 240670 | J89: =VLOOKUP(ROUND(RC[-1],-2),C[13]:C[14],2,TRUE) -> 34 | L89: =ROUND(R5C12+(R215C12-R5C12)/R214C7^3*R[-1]C[-5]^3,0) -> 273340 | M89: =ROUND(RC[-1]-R[-1]C[-1],-3) -> 10000 | N89: 0 | O89: =RC[-2]+RC[-1] -> 10000 | P89: =SUM(R5C15:RC[-1]) -> 380140 | Q89: =ROUND(RC[-4]/VLOOKUP(RC[-13],C20:C22,2,FALSE),3) -> 0.08 | R89: =VLOOKUP(ROUND(RC[-2],-2),C23:C24,2,TRUE) -> 37 | S89: =RC[-9]-RC[-1] -> -3 | T89: 85 | U89: 11944083 | V89: =SUM(R5C21:R[-1]C[-1]) -> 113183969 | W89: =ROUND(RC[-1],-2) -> 113184000 | X89: =RC[-4] -> 85
B90: 1 | C90: 0,1,7,1800 | D90: 40 | F90: 1 | G90: =R[-1]C+RC[-1] -> 86 | H90: =MID(RC[-5],7,20)*1 -> 1800 | I90: =SUM(R5C8:RC[-1]) -> 242470 | J90: =VLOOKUP(ROUND(RC[-1],-2),C[13]:C[14],2,TRUE) -> 34 | L90: =ROUND(R5C12+(R215C12-R5C12)/R214C7^3*R[-1]C[-5]^3,0) -> 283218 | M90: =ROUND(RC[-1]-R[-1]C[-1],-3) -> 10000 | N90: 0 | O90: =RC[-2]+RC[-1] -> 10000 | P90: =SUM(R5C15:RC[-1]) -> 390140 | Q90: =ROUND(RC[-4]/VLOOKUP(RC[-13],C20:C22,2,FALSE),3) -> 0.08 | R90: =VLOOKUP(ROUND(RC[-2],-2),C23:C24,2,TRUE) -> 37 | S90: =RC[-9]-RC[-1] -> -3 | T90: 86 | U90: 13406363 | V90: =SUM(R5C21:R[-1]C[-1]) -> 125128052 | W90: =ROUND(RC[-1],-2) -> 125128100 | X90: =RC[-4] -> 86
B91: 1 | C91: 0,1,7,2200 | D91: 40 | F91: 2 | G91: =R[-1]C+RC[-1] -> 88 | H91: =MID(RC[-5],7,20)*1 -> 2200 | I91: =SUM(R5C8:RC[-1]) -> 244670 | J91: =VLOOKUP(ROUND(RC[-1],-2),C[13]:C[14],2,TRUE) -> 34 | L91: =ROUND(R5C12+(R215C12-R5C12)/R214C7^3*R[-1]C[-5]^3,0) -> 293332 | M91: =ROUND(RC[-1]-R[-1]C[-1],-3) -> 10000 | N91: =ROUND(SUM(R[-4]C[-1]:RC[-1])/0.7*0.3,-3) -> 21000 | O91: =RC[-2]+RC[-1] -> 31000 | P91: =SUM(R5C15:RC[-1]) -> 421140 | Q91: =ROUND(RC[-4]/VLOOKUP(RC[-13],C20:C22,2,FALSE),3) -> 0.08 | R91: =VLOOKUP(ROUND(RC[-2],-2),C23:C24,2,TRUE) -> 38 | S91: =RC[-9]-RC[-1] -> -4 | T91: 87 | U91: 14984196 | V91: =SUM(R5C21:R[-1]C[-1]) -> 138534415 | W91: =ROUND(RC[-1],-2) -> 138534400 | X91: =RC[-4] -> 87
B92: 1 | C92: 0,1,7,2200 | D92: 40 | F92: 2 | G92: =R[-1]C+RC[-1] -> 90 | H92: =MID(RC[-5],7,20)*1 -> 2200 | I92: =SUM(R5C8:RC[-1]) -> 246870 | J92: =VLOOKUP(ROUND(RC[-1],-2),C[13]:C[14],2,TRUE) -> 34 | L92: =ROUND(R5C12+(R215C12-R5C12)/R214C7^3*R[-1]C[-5]^3,0) -> 314275 | M92: =ROUND(RC[-1]-R[-1]C[-1],-3) -> 21000 | N92: 0 | O92: =RC[-2]+RC[-1] -> 21000 | P92: =SUM(R5C15:RC[-1]) -> 442140 | Q92: =ROUND(RC[-4]/VLOOKUP(RC[-13],C20:C22,2,FALSE),3) -> 0.167 | R92: =VLOOKUP(ROUND(RC[-2],-2),C23:C24,2,TRUE) -> 39 | S92: =RC[-9]-RC[-1] -> -5 | T92: 88 | U92: 16683700 | V92: =SUM(R5C21:R[-1]C[-1]) -> 153518611 | W92: =ROUND(RC[-1],-2) -> 153518600 | X92: =RC[-4] -> 88
B93: 1 | C93: 0,1,7,52600 | D93: 40 | F93: 2 | G93: =R[-1]C+RC[-1] -> 92 | H93: =MID(RC[-5],7,20)*1 -> 52600 | I93: =SUM(R5C8:RC[-1]) -> 299470 | J93: =VLOOKUP(ROUND(RC[-1],-2),C[13]:C[14],2,TRUE) -> 35 | L93: =ROUND(R5C12+(R215C12-R5C12)/R214C7^3*R[-1]C[-5]^3,0) -> 336192 | M93: =ROUND(RC[-1]-R[-1]C[-1],-3) -> 22000 | N93: 0 | O93: =RC[-2]+RC[-1] -> 22000 | P93: =SUM(R5C15:RC[-1]) -> 464140 | Q93: =ROUND(RC[-4]/VLOOKUP(RC[-13],C20:C22,2,FALSE),3) -> 0.175 | R93: =VLOOKUP(ROUND(RC[-2],-2),C23:C24,2,TRUE) -> 39 | S93: =RC[-9]-RC[-1] -> -4 | T93: 89 | U93: 18511193 | V93: =SUM(R5C21:R[-1]C[-1]) -> 170202311 | W93: =ROUND(RC[-1],-2) -> 170202300 | X93: =RC[-4] -> 89
B94: 1 | C94: 0,1,7,3500 | D94: 45 | F94: 2 | G94: =R[-1]C+RC[-1] -> 94 | H94: =MID(RC[-5],7,20)*1 -> 3500 | I94: =SUM(R5C8:RC[-1]) -> 302970 | J94: =VLOOKUP(ROUND(RC[-1],-2),C[13]:C[14],2,TRUE) -> 35 | L94: =ROUND(R5C12+(R215C12-R5C12)/R214C7^3*R[-1]C[-5]^3,0) -> 359105 | M94: =ROUND(RC[-1]-R[-1]C[-1],-3) -> 23000 | N94: 0 | O94: =RC[-2]+RC[-1] -> 23000 | P94: =SUM(R5C15:RC[-1]) -> 487140 | Q94: =ROUND(RC[-4]/VLOOKUP(RC[-13],C20:C22,2,FALSE),3) -> 0.085 | R94: =VLOOKUP(ROUND(RC[-2],-2),C23:C24,2,TRUE) -> 39 | S94: =RC[-9]-RC[-1] -> -4 | T94: 90 | U94: 20473198 | V94: =SUM(R5C21:R[-1]C[-1]) -> 188713504 | W94: =ROUND(RC[-1],-2) -> 188713500 | X94: =RC[-4] -> 90
B95: 1 | C95: 0,1,7,110000 | D95: 45 | F95: 2 | G95: =R[-1]C+RC[-1] -> 96 | H95: =MID(RC[-5],7,20)*1 -> 110000 | I95: =SUM(R5C8:RC[-1]) -> 412970 | J95: =VLOOKUP(ROUND(RC[-1],-2),C[13]:C[14],2,TRUE) -> 38 | L95: =ROUND(R5C12+(R215C12-R5C12)/R214C7^3*R[-1]C[-5]^3,0) -> 383036 | M95: =ROUND(RC[-1]-R[-1]C[-1],-3) -> 24000 | N95: 0 | O95: =RC[-2]+RC[-1] -> 24000 | P95: =SUM(R5C15:RC[-1]) -> 511140 | Q95: =ROUND(RC[-4]/VLOOKUP(RC[-13],C20:C22,2,FALSE),3) -> 0.089 | R95: =VLOOKUP(ROUND(RC[-2],-2),C23:C24,2,TRUE) -> 40 | S95: =RC[-9]-RC[-1] -> -2 | T95: 91 | U95: 22576445 | V95: =SUM(R5C21:R[-1]C[-1]) -> 209186702 | W95: =ROUND(RC[-1],-2) -> 209186700 | X95: =RC[-4] -> 91
B96: 1 | C96: 0,1,7,3500 | D96: 45 | F96: 2 | G96: =R[-1]C+RC[-1] -> 98 | H96: =MID(RC[-5],7,20)*1 -> 3500 | I96: =SUM(R5C8:RC[-1]) -> 416470 | J96: =VLOOKUP(ROUND(RC[-1],-2),C[13]:C[14],2,TRUE) -> 38 | L96: =ROUND(R5C12+(R215C12-R5C12)/R214C7^3*R[-1]C[-5]^3,0) -> 408008 | M96: =ROUND(RC[-1]-R[-1]C[-1],-3) -> 25000 | N96: =ROUND(SUM(R[-4]C[-1]:RC[-1])/0.7*0.3,-3) -> 49000 | O96: =RC[-2]+RC[-1] -> 74000 | P96: =SUM(R5C15:RC[-1]) -> 585140 | Q96: =ROUND(RC[-4]/VLOOKUP(RC[-13],C20:C22,2,FALSE),3) -> 0.092 | R96: =VLOOKUP(ROUND(RC[-2],-2),C23:C24,2,TRUE) -> 40 | S96: =RC[-9]-RC[-1] -> -2 | T96: 92 | U96: 24827873 | V96: =SUM(R5C21:R[-1]C[-1]) -> 231763147 | W96: =ROUND(RC[-1],-2) -> 231763100 | X96: =RC[-4] -> 92
B97: 1 | C97: 0,1,7,3500 | D97: 45 | F97: 2 | G97: =R[-1]C+RC[-1] -> 100 | H97: =MID(RC[-5],7,20)*1 -> 3500 | I97: =SUM(R5C8:RC[-1]) -> 419970 | J97: =VLOOKUP(ROUND(RC[-1],-2),C[13]:C[14],2,TRUE) -> 38 | L97: =ROUND(R5C12+(R215C12-R5C12)/R214C7^3*R[-1]C[-5]^3,0) -> 434042 | M97: =ROUND(RC[-1]-R[-1]C[-1],-3) -> 26000 | N97: 0 | O97: =RC[-2]+RC[-1] -> 26000 | P97: =SUM(R5C15:RC[-1]) -> 611140 | Q97: =ROUND(RC[-4]/VLOOKUP(RC[-13],C20:C22,2,FALSE),3) -> 0.096 | R97: =VLOOKUP(ROUND(RC[-2],-2),C23:C24,2,TRUE) -> 40 | S97: =RC[-9]-RC[-1] -> -2 | T97: 93 | U97: 27234635 | V97: =SUM(R5C21:R[-1]C[-1]) -> 256591020 | W97: =ROUND(RC[-1],-2) -> 256591000 | X97: =RC[-4] -> 93
B98: 1 | C98: 0,1,7,3500 | D98: 45 | F98: 2 | G98: =R[-1]C+RC[-1] -> 102 | H98: =MID(RC[-5],7,20)*1 -> 3500 | I98: =SUM(R5C8:RC[-1]) -> 423470 | J98: =VLOOKUP(ROUND(RC[-1],-2),C[13]:C[14],2,TRUE) -> 38 | L98: =ROUND(R5C12+(R215C12-R5C12)/R214C7^3*R[-1]C[-5]^3,0) -> 461161 | M98: =ROUND(RC[-1]-R[-1]C[-1],-3) -> 27000 | N98: 0 | O98: =RC[-2]+RC[-1] -> 27000 | P98: =SUM(R5C15:RC[-1]) -> 638140 | Q98: =ROUND(RC[-4]/VLOOKUP(RC[-13],C20:C22,2,FALSE),3) -> 0.1 | R98: =VLOOKUP(ROUND(RC[-2],-2),C23:C24,2,TRUE) -> 41 | S98: =RC[-9]-RC[-1] -> -3 | T98: 94 | U98: 29804099 | V98: =SUM(R5C21:R[-1]C[-1]) -> 283825655 | W98: =ROUND(RC[-1],-2) -> 283825700 | X98: =RC[-4] -> 94
B99: 1 | C99: 0,1,7,150000 | D99: 45 | F99: 2 | G99: =R[-1]C+RC[-1] -> 104 | H99: =MID(RC[-5],7,20)*1 -> 150000 | I99: =SUM(R5C8:RC[-1]) -> 573470 | J99: =VLOOKUP(ROUND(RC[-1],-2),C[13]:C[14],2,TRUE) -> 40 | L99: =ROUND(R5C12+(R215C12-R5C12)/R214C7^3*R[-1]C[-5]^3,0) -> 489387 | M99: =ROUND(RC[-1]-R[-1]C[-1],-3) -> 28000 | N99: 0 | O99: =RC[-2]+RC[-1] -> 28000 | P99: =SUM(R5C15:RC[-1]) -> 666140 | Q99: =ROUND(RC[-4]/VLOOKUP(RC[-13],C20:C22,2,FALSE),3) -> 0.103 | R99: =VLOOKUP(ROUND(RC[-2],-2),C23:C24,2,TRUE) -> 41 | S99: =RC[-9]-RC[-1] -> -1 | T99: 95 | U99: 32543854 | V99: =SUM(R5C21:R[-1]C[-1]) -> 313629754 | W99: =ROUND(RC[-1],-2) -> 313629800 | X99: =RC[-4] -> 95
B100: 1 | C100: 0,1,7,3500 | D100: 45 | F100: 2 | G100: =R[-1]C+RC[-1] -> 106 | H100: =MID(RC[-5],7,20)*1 -> 3500 | I100: =SUM(R5C8:RC[-1]) -> 576970 | J100: =VLOOKUP(ROUND(RC[-1],-2),C[13]:C[14],2,TRUE) -> 40 | L100: =ROUND(R5C12+(R215C12-R5C12)/R214C7^3*R[-1]C[-5]^3,0) -> 518741 | M100: =ROUND(RC[-1]-R[-1]C[-1],-3) -> 29000 | N100: 0 | O100: =RC[-2]+RC[-1] -> 29000 | P100: =SUM(R5C15:RC[-1]) -> 695140 | Q100: =ROUND(RC[-4]/VLOOKUP(RC[-13],C20:C22,2,FALSE),3) -> 0.107 | R100: =VLOOKUP(ROUND(RC[-2],-2),C23:C24,2,TRUE) -> 41 | S100: =RC[-9]-RC[-1] -> -1 | T100: 96 | U100: 35461711 | V100: =SUM(R5C21:R[-1]C[-1]) -> 346173608 | W100: =ROUND(RC[-1],-2) -> 346173600 | X100: =RC[-4] -> 96
B101: 1 | C101: 0,1,7,3500 | D101: 45 | F101: 2 | G101: =R[-1]C+RC[-1] -> 108 | H101: =MID(RC[-5],7,20)*1 -> 3500 | I101: =SUM(R5C8:RC[-1]) -> 580470 | J101: =VLOOKUP(ROUND(RC[-1],-2),C[13]:C[14],2,TRUE) -> 40 | L101: =ROUND(R5C12+(R215C12-R5C12)/R214C7^3*R[-1]C[-5]^3,0) -> 549247 | M101: =ROUND(RC[-1]-R[-1]C[-1],-3) -> 31000 | N101: =ROUND(SUM(R[-4]C[-1]:RC[-1])/0.7*0.3,-3) -> 60000 | O101: =RC[-2]+RC[-1] -> 91000 | P101: =SUM(R5C15:RC[-1]) -> 786140 | Q101: =ROUND(RC[-4]/VLOOKUP(RC[-13],C20:C22,2,FALSE),3) -> 0.114 | R101: =VLOOKUP(ROUND(RC[-2],-2),C23:C24,2,TRUE) -> 42 | S101: =RC[-9]-RC[-1] -> -2 | T101: 97 | U101: 38565707 | V101: =SUM(R5C21:R[-1]C[-1]) -> 381635319 | W101: =ROUND(RC[-1],-2) -> 381635300 | X101: =RC[-4] -> 97
B102: 1 | C102: 0,1,7,190000 | D102: 45 | F102: 2 | G102: =R[-1]C+RC[-1] -> 110 | H102: =MID(RC[-5],7,20)*1 -> 190000 | I102: =SUM(R5C8:RC[-1]) -> 770470 | J102: =VLOOKUP(ROUND(RC[-1],-2),C[13]:C[14],2,TRUE) -> 42 | L102: =ROUND(R5C12+(R215C12-R5C12)/R214C7^3*R[-1]C[-5]^3,0) -> 580925 | M102: =ROUND(RC[-1]-R[-1]C[-1],-3) -> 32000 | N102: 0 | O102: =RC[-2]+RC[-1] -> 32000 | P102: =SUM(R5C15:RC[-1]) -> 818140 | Q102: =ROUND(RC[-4]/VLOOKUP(RC[-13],C20:C22,2,FALSE),3) -> 0.118 | R102: =VLOOKUP(ROUND(RC[-2],-2),C23:C24,2,TRUE) -> 42 | S102: =RC[-9]-RC[-1] -> 0 | T102: 98 | U102: 41864106 | V102: =SUM(R5C21:R[-1]C[-1]) -> 420201026 | W102: =ROUND(RC[-1],-2) -> 420201000 | X102: =RC[-4] -> 98
B103: 1 | C103: 0,1,7,3500 | D103: 45 | F103: 2 | G103: =R[-1]C+RC[-1] -> 112 | H103: =MID(RC[-5],7,20)*1 -> 3500 | I103: =SUM(R5C8:RC[-1]) -> 773970 | J103: =VLOOKUP(ROUND(RC[-1],-2),C[13]:C[14],2,TRUE) -> 42 | L103: =ROUND(R5C12+(R215C12-R5C12)/R214C7^3*R[-1]C[-5]^3,0) -> 613799 | M103: =ROUND(RC[-1]-R[-1]C[-1],-3) -> 33000 | N103: 0 | O103: =RC[-2]+RC[-1] -> 33000 | P103: =SUM(R5C15:RC[-1]) -> 851140 | Q103: =ROUND(RC[-4]/VLOOKUP(RC[-13],C20:C22,2,FALSE),3) -> 0.122 | R103: =VLOOKUP(ROUND(RC[-2],-2),C23:C24,2,TRUE) -> 42 | S103: =RC[-9]-RC[-1] -> 0 | T103: 99 | U103: 45365405 | V103: =SUM(R5C21:R[-1]C[-1]) -> 462065132 | W103: =ROUND(RC[-1],-2) -> 462065100 | X103: =RC[-4] -> 99
B104: 1 | C104: 0,1,7,3500 | D104: 45 | F104: 2 | G104: =R[-1]C+RC[-1] -> 114 | H104: =MID(RC[-5],7,20)*1 -> 3500 | I104: =SUM(R5C8:RC[-1]) -> 777470 | J104: =VLOOKUP(ROUND(RC[-1],-2),C[13]:C[14],2,TRUE) -> 42 | L104: =ROUND(R5C12+(R215C12-R5C12)/R214C7^3*R[-1]C[-5]^3,0) -> 647890 | M104: =ROUND(RC[-1]-R[-1]C[-1],-3) -> 34000 | N104: 0 | O104: =RC[-2]+RC[-1] -> 34000 | P104: =SUM(R5C15:RC[-1]) -> 885140 | Q104: =ROUND(RC[-4]/VLOOKUP(RC[-13],C20:C22,2,FALSE),3) -> 0.126 | R104: =VLOOKUP(ROUND(RC[-2],-2),C23:C24,2,TRUE) -> 42 | S104: =RC[-9]-RC[-1] -> 0 | T104: 100 | U104: 61347923 | V104: =SUM(R5C21:R[-1]C[-1]) -> 507430537 | W104: =ROUND(RC[-1],-2) -> 507430500 | X104: =RC[-4] -> 100
B105: 1 | C105: 0,1,7,140000 | D105: 45 | F105: 2 | G105: =R[-1]C+RC[-1] -> 116 | H105: =MID(RC[-5],7,20)*1 -> 140000 | I105: =SUM(R5C8:RC[-1]) -> 917470 | J105: =VLOOKUP(ROUND(RC[-1],-2),C[13]:C[14],2,TRUE) -> 42 | L105: =ROUND(R5C12+(R215C12-R5C12)/R214C7^3*R[-1]C[-5]^3,0) -> 683221 | M105: =ROUND(RC[-1]-R[-1]C[-1],-3) -> 35000 | N105: 0 | O105: =RC[-2]+RC[-1] -> 35000 | P105: =SUM(R5C15:RC[-1]) -> 920140 | Q105: =ROUND(RC[-4]/VLOOKUP(RC[-13],C20:C22,2,FALSE),3) -> 0.129 | R105: =VLOOKUP(ROUND(RC[-2],-2),C23:C24,2,TRUE) -> 42 | S105: =RC[-9]-RC[-1] -> 0
B106: 1 | C106: 0,1,7,4000 | D106: 50 | F106: 2 | G106: =R[-1]C+RC[-1] -> 118 | H106: =MID(RC[-5],7,20)*1 -> 4000 | I106: =SUM(R5C8:RC[-1]) -> 921470 | J106: =VLOOKUP(ROUND(RC[-1],-2),C[13]:C[14],2,TRUE) -> 42 | L106: =ROUND(R5C12+(R215C12-R5C12)/R214C7^3*R[-1]C[-5]^3,0) -> 719813 | M106: =ROUND(RC[-1]-R[-1]C[-1],-3) -> 37000 | N106: =ROUND(SUM(R[-4]C[-1]:RC[-1])/0.7*0.3,-3) -> 73000 | O106: =RC[-2]+RC[-1] -> 110000 | P106: =SUM(R5C15:RC[-1]) -> 1030140 | Q106: =ROUND(RC[-4]/VLOOKUP(RC[-13],C20:C22,2,FALSE),3) -> 0.073 | R106: =VLOOKUP(ROUND(RC[-2],-2),C23:C24,2,TRUE) -> 43 | S106: =RC[-9]-RC[-1] -> -1
B107: 1 | C107: 0,1,7,4000 | D107: 50 | F107: 2 | G107: =R[-1]C+RC[-1] -> 120 | H107: =MID(RC[-5],7,20)*1 -> 4000 | I107: =SUM(R5C8:RC[-1]) -> 925470 | J107: =VLOOKUP(ROUND(RC[-1],-2),C[13]:C[14],2,TRUE) -> 42 | L107: =ROUND(R5C12+(R215C12-R5C12)/R214C7^3*R[-1]C[-5]^3,0) -> 757690 | M107: =ROUND(RC[-1]-R[-1]C[-1],-3) -> 38000 | N107: 0 | O107: =RC[-2]+RC[-1] -> 38000 | P107: =SUM(R5C15:RC[-1]) -> 1068140 | Q107: =ROUND(RC[-4]/VLOOKUP(RC[-13],C20:C22,2,FALSE),3) -> 0.075 | R107: =VLOOKUP(ROUND(RC[-2],-2),C23:C24,2,TRUE) -> 43 | S107: =RC[-9]-RC[-1] -> -1
B108: 1 | C108: 0,1,7,150000 | D108: 50 | F108: 2 | G108: =R[-1]C+RC[-1] -> 122 | H108: =MID(RC[-5],7,20)*1 -> 150000 | I108: =SUM(R5C8:RC[-1]) -> 1075470 | J108: =VLOOKUP(ROUND(RC[-1],-2),C[13]:C[14],2,TRUE) -> 43 | L108: =ROUND(R5C12+(R215C12-R5C12)/R214C7^3*R[-1]C[-5]^3,0) -> 796872 | M108: =ROUND(RC[-1]-R[-1]C[-1],-3) -> 39000 | N108: 0 | O108: =RC[-2]+RC[-1] -> 39000 | P108: =SUM(R5C15:RC[-1]) -> 1107140 | Q108: =ROUND(RC[-4]/VLOOKUP(RC[-13],C20:C22,2,FALSE),3) -> 0.077 | R108: =VLOOKUP(ROUND(RC[-2],-2),C23:C24,2,TRUE) -> 43 | S108: =RC[-9]-RC[-1] -> 0
B109: 1 | C109: 0,1,7,4000 | D109: 50 | F109: 2 | G109: =R[-1]C+RC[-1] -> 124 | H109: =MID(RC[-5],7,20)*1 -> 4000 | I109: =SUM(R5C8:RC[-1]) -> 1079470 | J109: =VLOOKUP(ROUND(RC[-1],-2),C[13]:C[14],2,TRUE) -> 43 | L109: =ROUND(R5C12+(R215C12-R5C12)/R214C7^3*R[-1]C[-5]^3,0) -> 837382 | M109: =ROUND(RC[-1]-R[-1]C[-1],-3) -> 41000 | N109: 0 | O109: =RC[-2]+RC[-1] -> 41000 | P109: =SUM(R5C15:RC[-1]) -> 1148140 | Q109: =ROUND(RC[-4]/VLOOKUP(RC[-13],C20:C22,2,FALSE),3) -> 0.081 | R109: =VLOOKUP(ROUND(RC[-2],-2),C23:C24,2,TRUE) -> 44 | S109: =RC[-9]-RC[-1] -> -1
B110: 1 | C110: 0,1,7,4000 | D110: 50 | F110: 2 | G110: =R[-1]C+RC[-1] -> 126 | H110: =MID(RC[-5],7,20)*1 -> 4000 | I110: =SUM(R5C8:RC[-1]) -> 1083470 | J110: =VLOOKUP(ROUND(RC[-1],-2),C[13]:C[14],2,TRUE) -> 43 | L110: =ROUND(R5C12+(R215C12-R5C12)/R214C7^3*R[-1]C[-5]^3,0) -> 879243 | M110: =ROUND(RC[-1]-R[-1]C[-1],-3) -> 42000 | N110: 0 | O110: =RC[-2]+RC[-1] -> 42000 | P110: =SUM(R5C15:RC[-1]) -> 1190140 | Q110: =ROUND(RC[-4]/VLOOKUP(RC[-13],C20:C22,2,FALSE),3) -> 0.083 | R110: =VLOOKUP(ROUND(RC[-2],-2),C23:C24,2,TRUE) -> 44 | S110: =RC[-9]-RC[-1] -> -1
B111: 1 | C111: 0,1,7,150000 | D111: 50 | F111: 2 | G111: =R[-1]C+RC[-1] -> 128 | H111: =MID(RC[-5],7,20)*1 -> 150000 | I111: =SUM(R5C8:RC[-1]) -> 1233470 | J111: =VLOOKUP(ROUND(RC[-1],-2),C[13]:C[14],2,TRUE) -> 44 | L111: =ROUND(R5C12+(R215C12-R5C12)/R214C7^3*R[-1]C[-5]^3,0) -> 922476 | M111: =ROUND(RC[-1]-R[-1]C[-1],-3) -> 43000 | N111: =ROUND(SUM(R[-4]C[-1]:RC[-1])/0.7*0.3,-3) -> 87000 | O111: =RC[-2]+RC[-1] -> 130000 | P111: =SUM(R5C15:RC[-1]) -> 1320140 | Q111: =ROUND(RC[-4]/VLOOKUP(RC[-13],C20:C22,2,FALSE),3) -> 0.085 | R111: =VLOOKUP(ROUND(RC[-2],-2),C23:C24,2,TRUE) -> 44 | S111: =RC[-9]-RC[-1] -> 0
B112: 1 | C112: 0,1,7,4000 | D112: 50 | F112: 2 | G112: =R[-1]C+RC[-1] -> 130 | H112: =MID(RC[-5],7,20)*1 -> 4000 | I112: =SUM(R5C8:RC[-1]) -> 1237470 | J112: =VLOOKUP(ROUND(RC[-1],-2),C[13]:C[14],2,TRUE) -> 44 | L112: =ROUND(R5C12+(R215C12-R5C12)/R214C7^3*R[-1]C[-5]^3,0) -> 967103 | M112: =ROUND(RC[-1]-R[-1]C[-1],-3) -> 45000 | N112: 0 | O112: =RC[-2]+RC[-1] -> 45000 | P112: =SUM(R5C15:RC[-1]) -> 1365140 | Q112: =ROUND(RC[-4]/VLOOKUP(RC[-13],C20:C22,2,FALSE),3) -> 0.089 | R112: =VLOOKUP(ROUND(RC[-2],-2),C23:C24,2,TRUE) -> 44 | S112: =RC[-9]-RC[-1] -> 0
B113: 1 | C113: 0,1,7,150000 | D113: 50 | F113: 2 | G113: =R[-1]C+RC[-1] -> 132 | H113: =MID(RC[-5],7,20)*1 -> 150000 | I113: =SUM(R5C8:RC[-1]) -> 1387470 | J113: =VLOOKUP(ROUND(RC[-1],-2),C[13]:C[14],2,TRUE) -> 45 | L113: =ROUND(R5C12+(R215C12-R5C12)/R214C7^3*R[-1]C[-5]^3,0) -> 1013147 | M113: =ROUND(RC[-1]-R[-1]C[-1],-3) -> 46000 | N113: 0 | O113: =RC[-2]+RC[-1] -> 46000 | P113: =SUM(R5C15:RC[-1]) -> 1411140 | Q113: =ROUND(RC[-4]/VLOOKUP(RC[-13],C20:C22,2,FALSE),3) -> 0.091 | R113: =VLOOKUP(ROUND(RC[-2],-2),C23:C24,2,TRUE) -> 45 | S113: =RC[-9]-RC[-1] -> 0
B114: 1 | C114: 0,1,7,4000 | D114: 50 | F114: 2 | G114: =R[-1]C+RC[-1] -> 134 | H114: =MID(RC[-5],7,20)*1 -> 4000 | I114: =SUM(R5C8:RC[-1]) -> 1391470 | J114: =VLOOKUP(ROUND(RC[-1],-2),C[13]:C[14],2,TRUE) -> 45 | L114: =ROUND(R5C12+(R215C12-R5C12)/R214C7^3*R[-1]C[-5]^3,0) -> 1060630 | M114: =ROUND(RC[-1]-R[-1]C[-1],-3) -> 47000 | N114: 0 | O114: =RC[-2]+RC[-1] -> 47000 | P114: =SUM(R5C15:RC[-1]) -> 1458140 | Q114: =ROUND(RC[-4]/VLOOKUP(RC[-13],C20:C22,2,FALSE),3) -> 0.093 | R114: =VLOOKUP(ROUND(RC[-2],-2),C23:C24,2,TRUE) -> 45 | S114: =RC[-9]-RC[-1] -> 0
B115: 1 | C115: 0,1,7,4000 | D115: 50 | F115: 2 | G115: =R[-1]C+RC[-1] -> 136 | H115: =MID(RC[-5],7,20)*1 -> 4000 | I115: =SUM(R5C8:RC[-1]) -> 1395470 | J115: =VLOOKUP(ROUND(RC[-1],-2),C[13]:C[14],2,TRUE) -> 45 | L115: =ROUND(R5C12+(R215C12-R5C12)/R214C7^3*R[-1]C[-5]^3,0) -> 1109574 | M115: =ROUND(RC[-1]-R[-1]C[-1],-3) -> 49000 | N115: 0 | O115: =RC[-2]+RC[-1] -> 49000 | P115: =SUM(R5C15:RC[-1]) -> 1507140 | Q115: =ROUND(RC[-4]/VLOOKUP(RC[-13],C20:C22,2,FALSE),3) -> 0.097 | R115: =VLOOKUP(ROUND(RC[-2],-2),C23:C24,2,TRUE) -> 45 | S115: =RC[-9]-RC[-1] -> 0
B116: 1 | C116: 0,1,7,150000 | D116: 50 | F116: 2 | G116: =R[-1]C+RC[-1] -> 138 | H116: =MID(RC[-5],7,20)*1 -> 150000 | I116: =SUM(R5C8:RC[-1]) -> 1545470 | J116: =VLOOKUP(ROUND(RC[-1],-2),C[13]:C[14],2,TRUE) -> 45 | L116: =ROUND(R5C12+(R215C12-R5C12)/R214C7^3*R[-1]C[-5]^3,0) -> 1160000 | M116: =ROUND(RC[-1]-R[-1]C[-1],-3) -> 50000 | N116: =ROUND(SUM(R[-4]C[-1]:RC[-1])/0.7*0.3,-3) -> 102000 | O116: =RC[-2]+RC[-1] -> 152000 | P116: =SUM(R5C15:RC[-1]) -> 1659140 | Q116: =ROUND(RC[-4]/VLOOKUP(RC[-13],C20:C22,2,FALSE),3) -> 0.099 | R116: =VLOOKUP(ROUND(RC[-2],-2),C23:C24,2,TRUE) -> 46 | S116: =RC[-9]-RC[-1] -> -1
B117: 1 | C117: 0,1,7,4500 | D117: 55 | F117: 2 | G117: =R[-1]C+RC[-1] -> 140 | H117: =MID(RC[-5],7,20)*1 -> 4500 | I117: =SUM(R5C8:RC[-1]) -> 1549970 | J117: =VLOOKUP(ROUND(RC[-1],-2),C[13]:C[14],2,TRUE) -> 45 | L117: =ROUND(R5C12+(R215C12-R5C12)/R214C7^3*R[-1]C[-5]^3,0) -> 1211932 | M117: =ROUND(RC[-1]-R[-1]C[-1],-3) -> 52000 | N117: 0 | O117: =RC[-2]+RC[-1] -> 52000 | P117: =SUM(R5C15:RC[-1]) -> 1711140 | Q117: =ROUND(RC[-4]/VLOOKUP(RC[-13],C20:C22,2,FALSE),3) -> 0.061 | R117: =VLOOKUP(ROUND(RC[-2],-2),C23:C24,2,TRUE) -> 46 | S117: =RC[-9]-RC[-1] -> -1
B118: 1 | C118: 0,1,7,160000 | D118: 55 | F118: 2 | G118: =R[-1]C+RC[-1] -> 142 | H118: =MID(RC[-5],7,20)*1 -> 160000 | I118: =SUM(R5C8:RC[-1]) -> 1709970 | J118: =VLOOKUP(ROUND(RC[-1],-2),C[13]:C[14],2,TRUE) -> 46 | L118: =ROUND(R5C12+(R215C12-R5C12)/R214C7^3*R[-1]C[-5]^3,0) -> 1265391 | M118: =ROUND(RC[-1]-R[-1]C[-1],-3) -> 53000 | N118: 0 | O118: =RC[-2]+RC[-1] -> 53000 | P118: =SUM(R5C15:RC[-1]) -> 1764140 | Q118: =ROUND(RC[-4]/VLOOKUP(RC[-13],C20:C22,2,FALSE),3) -> 0.062 | R118: =VLOOKUP(ROUND(RC[-2],-2),C23:C24,2,TRUE) -> 46 | S118: =RC[-9]-RC[-1] -> 0
B119: 1 | C119: 0,1,7,4500 | D119: 55 | F119: 2 | G119: =R[-1]C+RC[-1] -> 144 | H119: =MID(RC[-5],7,20)*1 -> 4500 | I119: =SUM(R5C8:RC[-1]) -> 1714470 | J119: =VLOOKUP(ROUND(RC[-1],-2),C[13]:C[14],2,TRUE) -> 46 | L119: =ROUND(R5C12+(R215C12-R5C12)/R214C7^3*R[-1]C[-5]^3,0) -> 1320400 | M119: =ROUND(RC[-1]-R[-1]C[-1],-3) -> 55000 | N119: 0 | O119: =RC[-2]+RC[-1] -> 55000 | P119: =SUM(R5C15:RC[-1]) -> 1819140 | Q119: =ROUND(RC[-4]/VLOOKUP(RC[-13],C20:C22,2,FALSE),3) -> 0.065 | R119: =VLOOKUP(ROUND(RC[-2],-2),C23:C24,2,TRUE) -> 46 | S119: =RC[-9]-RC[-1] -> 0
B120: 1 | C120: 0,1,7,4500 | D120: 55 | F120: 2 | G120: =R[-1]C+RC[-1] -> 146 | H120: =MID(RC[-5],7,20)*1 -> 4500 | I120: =SUM(R5C8:RC[-1]) -> 1718970 | J120: =VLOOKUP(ROUND(RC[-1],-2),C[13]:C[14],2,TRUE) -> 46 | L120: =ROUND(R5C12+(R215C12-R5C12)/R214C7^3*R[-1]C[-5]^3,0) -> 1376980 | M120: =ROUND(RC[-1]-R[-1]C[-1],-3) -> 57000 | N120: 0 | O120: =RC[-2]+RC[-1] -> 57000 | P120: =SUM(R5C15:RC[-1]) -> 1876140 | Q120: =ROUND(RC[-4]/VLOOKUP(RC[-13],C20:C22,2,FALSE),3) -> 0.067 | R120: =VLOOKUP(ROUND(RC[-2],-2),C23:C24,2,TRUE) -> 46 | S120: =RC[-9]-RC[-1] -> 0
B121: 1 | C121: 0,1,7,4500 | D121: 55 | F121: 2 | G121: =R[-1]C+RC[-1] -> 148 | H121: =MID(RC[-5],7,20)*1 -> 4500 | I121: =SUM(R5C8:RC[-1]) -> 1723470 | J121: =VLOOKUP(ROUND(RC[-1],-2),C[13]:C[14],2,TRUE) -> 46 | L121: =ROUND(R5C12+(R215C12-R5C12)/R214C7^3*R[-1]C[-5]^3,0) -> 1435154 | M121: =ROUND(RC[-1]-R[-1]C[-1],-3) -> 58000 | N121: =ROUND(SUM(R[-4]C[-1]:RC[-1])/0.7*0.3,-3) -> 118000 | O121: =RC[-2]+RC[-1] -> 176000 | P121: =SUM(R5C15:RC[-1]) -> 2052140 | Q121: =ROUND(RC[-4]/VLOOKUP(RC[-13],C20:C22,2,FALSE),3) -> 0.068 | R121: =VLOOKUP(ROUND(RC[-2],-2),C23:C24,2,TRUE) -> 47 | S121: =RC[-9]-RC[-1] -> -1
B122: 1 | C122: 0,1,7,187500 | D122: 55 | F122: 2 | G122: =R[-1]C+RC[-1] -> 150 | H122: =MID(RC[-5],7,20)*1 -> 187500 | I122: =SUM(R5C8:RC[-1]) -> 1910970 | J122: =VLOOKUP(ROUND(RC[-1],-2),C[13]:C[14],2,TRUE) -> 46 | L122: =ROUND(R5C12+(R215C12-R5C12)/R214C7^3*R[-1]C[-5]^3,0) -> 1494944 | M122: =ROUND(RC[-1]-R[-1]C[-1],-3) -> 60000 | N122: 0 | O122: =RC[-2]+RC[-1] -> 60000 | P122: =SUM(R5C15:RC[-1]) -> 2112140 | Q122: =ROUND(RC[-4]/VLOOKUP(RC[-13],C20:C22,2,FALSE),3) -> 0.07 | R122: =VLOOKUP(ROUND(RC[-2],-2),C23:C24,2,TRUE) -> 47 | S122: =RC[-9]-RC[-1] -> -1
B123: 1 | C123: 0,1,7,4500 | D123: 55 | F123: 2 | G123: =R[-1]C+RC[-1] -> 152 | H123: =MID(RC[-5],7,20)*1 -> 4500 | I123: =SUM(R5C8:RC[-1]) -> 1915470 | J123: =VLOOKUP(ROUND(RC[-1],-2),C[13]:C[14],2,TRUE) -> 46 | L123: =ROUND(R5C12+(R215C12-R5C12)/R214C7^3*R[-1]C[-5]^3,0) -> 1556371 | M123: =ROUND(RC[-1]-R[-1]C[-1],-3) -> 61000 | N123: 0 | O123: =RC[-2]+RC[-1] -> 61000 | P123: =SUM(R5C15:RC[-1]) -> 2173140 | Q123: =ROUND(RC[-4]/VLOOKUP(RC[-13],C20:C22,2,FALSE),3) -> 0.072 | R123: =VLOOKUP(ROUND(RC[-2],-2),C23:C24,2,TRUE) -> 47 | S123: =RC[-9]-RC[-1] -> -1
B124: 1 | C124: 0,1,7,4500 | D124: 55 | F124: 2 | G124: =R[-1]C+RC[-1] -> 154 | H124: =MID(RC[-5],7,20)*1 -> 4500 | I124: =SUM(R5C8:RC[-1]) -> 1919970 | J124: =VLOOKUP(ROUND(RC[-1],-2),C[13]:C[14],2,TRUE) -> 46 | L124: =ROUND(R5C12+(R215C12-R5C12)/R214C7^3*R[-1]C[-5]^3,0) -> 1619459 | M124: =ROUND(RC[-1]-R[-1]C[-1],-3) -> 63000 | N124: 0 | O124: =RC[-2]+RC[-1] -> 63000 | P124: =SUM(R5C15:RC[-1]) -> 2236140 | Q124: =ROUND(RC[-4]/VLOOKUP(RC[-13],C20:C22,2,FALSE),3) -> 0.074 | R124: =VLOOKUP(ROUND(RC[-2],-2),C23:C24,2,TRUE) -> 47 | S124: =RC[-9]-RC[-1] -> -1
B125: 1 | C125: 0,1,7,200000 | D125: 55 | F125: 2 | G125: =R[-1]C+RC[-1] -> 156 | H125: =MID(RC[-5],7,20)*1 -> 200000 | I125: =SUM(R5C8:RC[-1]) -> 2119970 | J125: =VLOOKUP(ROUND(RC[-1],-2),C[13]:C[14],2,TRUE) -> 47 | L125: =ROUND(R5C12+(R215C12-R5C12)/R214C7^3*R[-1]C[-5]^3,0) -> 1684229 | M125: =ROUND(RC[-1]-R[-1]C[-1],-3) -> 65000 | N125: 0 | O125: =RC[-2]+RC[-1] -> 65000 | P125: =SUM(R5C15:RC[-1]) -> 2301140 | Q125: =ROUND(RC[-4]/VLOOKUP(RC[-13],C20:C22,2,FALSE),3) -> 0.076 | R125: =VLOOKUP(ROUND(RC[-2],-2),C23:C24,2,TRUE) -> 47 | S125: =RC[-9]-RC[-1] -> 0
B126: 1 | C126: 0,1,7,4500 | D126: 55 | F126: 2 | G126: =R[-1]C+RC[-1] -> 158 | H126: =MID(RC[-5],7,20)*1 -> 4500 | I126: =SUM(R5C8:RC[-1]) -> 2124470 | J126: =VLOOKUP(ROUND(RC[-1],-2),C[13]:C[14],2,TRUE) -> 47 | L126: =ROUND(R5C12+(R215C12-R5C12)/R214C7^3*R[-1]C[-5]^3,0) -> 1750704 | M126: =ROUND(RC[-1]-R[-1]C[-1],-3) -> 66000 | N126: =ROUND(SUM(R[-4]C[-1]:RC[-1])/0.7*0.3,-3) -> 135000 | O126: =RC[-2]+RC[-1] -> 201000 | P126: =SUM(R5C15:RC[-1]) -> 2502140 | Q126: =ROUND(RC[-4]/VLOOKUP(RC[-13],C20:C22,2,FALSE),3) -> 0.077 | R126: =VLOOKUP(ROUND(RC[-2],-2),C23:C24,2,TRUE) -> 48 | S126: =RC[-9]-RC[-1] -> -1
B127: 1 | C127: 0,1,7,220000 | D127: 55 | F127: 2 | G127: =R[-1]C+RC[-1] -> 160 | H127: =MID(RC[-5],7,20)*1 -> 220000 | I127: =SUM(R5C8:RC[-1]) -> 2344470 | J127: =VLOOKUP(ROUND(RC[-1],-2),C[13]:C[14],2,TRUE) -> 48 | L127: =ROUND(R5C12+(R215C12-R5C12)/R214C7^3*R[-1]C[-5]^3,0) -> 1818905 | M127: =ROUND(RC[-1]-R[-1]C[-1],-3) -> 68000 | N127: 0 | O127: =RC[-2]+RC[-1] -> 68000 | P127: =SUM(R5C15:RC[-1]) -> 2570140 | Q127: =ROUND(RC[-4]/VLOOKUP(RC[-13],C20:C22,2,FALSE),3) -> 0.08 | R127: =VLOOKUP(ROUND(RC[-2],-2),C23:C24,2,TRUE) -> 48 | S127: =RC[-9]-RC[-1] -> 0
B128: 1 | C128: 0,1,7,5000 | D128: 60 | F128: 2 | G128: =R[-1]C+RC[-1] -> 162 | H128: =MID(RC[-5],7,20)*1 -> 5000 | I128: =SUM(R5C8:RC[-1]) -> 2349470 | J128: =VLOOKUP(ROUND(RC[-1],-2),C[13]:C[14],2,TRUE) -> 48 | L128: =ROUND(R5C12+(R215C12-R5C12)/R214C7^3*R[-1]C[-5]^3,0) -> 1888854 | M128: =ROUND(RC[-1]-R[-1]C[-1],-3) -> 70000 | N128: 0 | O128: =RC[-2]+RC[-1] -> 70000 | P128: =SUM(R5C15:RC[-1]) -> 2640140 | Q128: =ROUND(RC[-4]/VLOOKUP(RC[-13],C20:C22,2,FALSE),3) -> 0.052 | R128: =VLOOKUP(ROUND(RC[-2],-2),C23:C24,2,TRUE) -> 48 | S128: =RC[-9]-RC[-1] -> 0
B129: 1 | C129: 0,1,7,5000 | D129: 60 | F129: 2 | G129: =R[-1]C+RC[-1] -> 164 | H129: =MID(RC[-5],7,20)*1 -> 5000 | I129: =SUM(R5C8:RC[-1]) -> 2354470 | J129: =VLOOKUP(ROUND(RC[-1],-2),C[13]:C[14],2,TRUE) -> 48 | L129: =ROUND(R5C12+(R215C12-R5C12)/R214C7^3*R[-1]C[-5]^3,0) -> 1960575 | M129: =ROUND(RC[-1]-R[-1]C[-1],-3) -> 72000 | N129: 0 | O129: =RC[-2]+RC[-1] -> 72000 | P129: =SUM(R5C15:RC[-1]) -> 2712140 | Q129: =ROUND(RC[-4]/VLOOKUP(RC[-13],C20:C22,2,FALSE),3) -> 0.053 | R129: =VLOOKUP(ROUND(RC[-2],-2),C23:C24,2,TRUE) -> 48 | S129: =RC[-9]-RC[-1] -> 0
B130: 1 | C130: 0,1,7,5000 | D130: 60 | F130: 2 | G130: =R[-1]C+RC[-1] -> 166 | H130: =MID(RC[-5],7,20)*1 -> 5000 | I130: =SUM(R5C8:RC[-1]) -> 2359470 | J130: =VLOOKUP(ROUND(RC[-1],-2),C[13]:C[14],2,TRUE) -> 48 | L130: =ROUND(R5C12+(R215C12-R5C12)/R214C7^3*R[-1]C[-5]^3,0) -> 2034088 | M130: =ROUND(RC[-1]-R[-1]C[-1],-3) -> 74000 | N130: 0 | O130: =RC[-2]+RC[-1] -> 74000 | P130: =SUM(R5C15:RC[-1]) -> 2786140 | Q130: =ROUND(RC[-4]/VLOOKUP(RC[-13],C20:C22,2,FALSE),3) -> 0.055 | R130: =VLOOKUP(ROUND(RC[-2],-2),C23:C24,2,TRUE) -> 49 | S130: =RC[-9]-RC[-1] -> -1
B131: 1 | C131: 0,1,7,5000 | D131: 60 | F131: 2 | G131: =R[-1]C+RC[-1] -> 168 | H131: =MID(RC[-5],7,20)*1 -> 5000 | I131: =SUM(R5C8:RC[-1]) -> 2364470 | J131: =VLOOKUP(ROUND(RC[-1],-2),C[13]:C[14],2,TRUE) -> 48 | L131: =ROUND(R5C12+(R215C12-R5C12)/R214C7^3*R[-1]C[-5]^3,0) -> 2109416 | M131: =ROUND(RC[-1]-R[-1]C[-1],-3) -> 75000 | N131: =ROUND(SUM(R[-4]C[-1]:RC[-1])/0.7*0.3,-3) -> 154000 | O131: =RC[-2]+RC[-1] -> 229000 | P131: =SUM(R5C15:RC[-1]) -> 3015140 | Q131: =ROUND(RC[-4]/VLOOKUP(RC[-13],C20:C22,2,FALSE),3) -> 0.056 | R131: =VLOOKUP(ROUND(RC[-2],-2),C23:C24,2,TRUE) -> 49 | S131: =RC[-9]-RC[-1] -> -1
B132: 1 | C132: 0,1,7,300000 | D132: 60 | F132: 2 | G132: =R[-1]C+RC[-1] -> 170 | H132: =MID(RC[-5],7,20)*1 -> 300000 | I132: =SUM(R5C8:RC[-1]) -> 2664470 | J132: =VLOOKUP(ROUND(RC[-1],-2),C[13]:C[14],2,TRUE) -> 48 | L132: =ROUND(R5C12+(R215C12-R5C12)/R214C7^3*R[-1]C[-5]^3,0) -> 2186582 | M132: =ROUND(RC[-1]-R[-1]C[-1],-3) -> 77000 | N132: 0 | O132: =RC[-2]+RC[-1] -> 77000 | P132: =SUM(R5C15:RC[-1]) -> 3092140 | Q132: =ROUND(RC[-4]/VLOOKUP(RC[-13],C20:C22,2,FALSE),3) -> 0.057 | R132: =VLOOKUP(ROUND(RC[-2],-2),C23:C24,2,TRUE) -> 49 | S132: =RC[-9]-RC[-1] -> -1
B133: 1 | C133: 0,1,7,5000 | D133: 60 | F133: 2 | G133: =R[-1]C+RC[-1] -> 172 | H133: =MID(RC[-5],7,20)*1 -> 5000 | I133: =SUM(R5C8:RC[-1]) -> 2669470 | J133: =VLOOKUP(ROUND(RC[-1],-2),C[13]:C[14],2,TRUE) -> 48 | L133: =ROUND(R5C12+(R215C12-R5C12)/R214C7^3*R[-1]C[-5]^3,0) -> 2265607 | M133: =ROUND(RC[-1]-R[-1]C[-1],-3) -> 79000 | N133: 0 | O133: =RC[-2]+RC[-1] -> 79000 | P133: =SUM(R5C15:RC[-1]) -> 3171140 | Q133: =ROUND(RC[-4]/VLOOKUP(RC[-13],C20:C22,2,FALSE),3) -> 0.059 | R133: =VLOOKUP(ROUND(RC[-2],-2),C23:C24,2,TRUE) -> 50 | S133: =RC[-9]-RC[-1] -> -2
B134: 1 | C134: 0,1,7,5000 | D134: 60 | F134: 2 | G134: =R[-1]C+RC[-1] -> 174 | H134: =MID(RC[-5],7,20)*1 -> 5000 | I134: =SUM(R5C8:RC[-1]) -> 2674470 | J134: =VLOOKUP(ROUND(RC[-1],-2),C[13]:C[14],2,TRUE) -> 48 | L134: =ROUND(R5C12+(R215C12-R5C12)/R214C7^3*R[-1]C[-5]^3,0) -> 2346513 | M134: =ROUND(RC[-1]-R[-1]C[-1],-3) -> 81000 | N134: 0 | O134: =RC[-2]+RC[-1] -> 81000 | P134: =SUM(R5C15:RC[-1]) -> 3252140 | Q134: =ROUND(RC[-4]/VLOOKUP(RC[-13],C20:C22,2,FALSE),3) -> 0.06 | R134: =VLOOKUP(ROUND(RC[-2],-2),C23:C24,2,TRUE) -> 50 | S134: =RC[-9]-RC[-1] -> -2
B135: 1 | C135: 0,1,7,5000 | D135: 60 | F135: 2 | G135: =R[-1]C+RC[-1] -> 176 | H135: =MID(RC[-5],7,20)*1 -> 5000 | I135: =SUM(R5C8:RC[-1]) -> 2679470 | J135: =VLOOKUP(ROUND(RC[-1],-2),C[13]:C[14],2,TRUE) -> 48 | L135: =ROUND(R5C12+(R215C12-R5C12)/R214C7^3*R[-1]C[-5]^3,0) -> 2429323 | M135: =ROUND(RC[-1]-R[-1]C[-1],-3) -> 83000 | N135: 0 | O135: =RC[-2]+RC[-1] -> 83000 | P135: =SUM(R5C15:RC[-1]) -> 3335140 | Q135: =ROUND(RC[-4]/VLOOKUP(RC[-13],C20:C22,2,FALSE),3) -> 0.061 | R135: =VLOOKUP(ROUND(RC[-2],-2),C23:C24,2,TRUE) -> 50 | S135: =RC[-9]-RC[-1] -> -2
B136: 1 | C136: 0,1,7,320000 | D136: 60 | F136: 2 | G136: =R[-1]C+RC[-1] -> 178 | H136: =MID(RC[-5],7,20)*1 -> 320000 | I136: =SUM(R5C8:RC[-1]) -> 2999470 | J136: =VLOOKUP(ROUND(RC[-1],-2),C[13]:C[14],2,TRUE) -> 49 | L136: =ROUND(R5C12+(R215C12-R5C12)/R214C7^3*R[-1]C[-5]^3,0) -> 2514058 | M136: =ROUND(RC[-1]-R[-1]C[-1],-3) -> 85000 | N136: =ROUND(SUM(R[-4]C[-1]:RC[-1])/0.7*0.3,-3) -> 174000 | O136: =RC[-2]+RC[-1] -> 259000 | P136: =SUM(R5C15:RC[-1]) -> 3594140 | Q136: =ROUND(RC[-4]/VLOOKUP(RC[-13],C20:C22,2,FALSE),3) -> 0.063 | R136: =VLOOKUP(ROUND(RC[-2],-2),C23:C24,2,TRUE) -> 50 | S136: =RC[-9]-RC[-1] -> -1
B137: 1 | C137: 0,1,7,5000 | D137: 60 | F137: 2 | G137: =R[-1]C+RC[-1] -> 180 | H137: =MID(RC[-5],7,20)*1 -> 5000 | I137: =SUM(R5C8:RC[-1]) -> 3004470 | J137: =VLOOKUP(ROUND(RC[-1],-2),C[13]:C[14],2,TRUE) -> 49 | L137: =ROUND(R5C12+(R215C12-R5C12)/R214C7^3*R[-1]C[-5]^3,0) -> 2600742 | M137: =ROUND(RC[-1]-R[-1]C[-1],-3) -> 87000 | N137: 0 | O137: =RC[-2]+RC[-1] -> 87000 | P137: =SUM(R5C15:RC[-1]) -> 3681140 | Q137: =ROUND(RC[-4]/VLOOKUP(RC[-13],C20:C22,2,FALSE),3) -> 0.064 | R137: =VLOOKUP(ROUND(RC[-2],-2),C23:C24,2,TRUE) -> 51 | S137: =RC[-9]-RC[-1] -> -2
B138: 1 | C138: 0,1,7,5000 | D138: 60 | F138: 2 | G138: =R[-1]C+RC[-1] -> 182 | H138: =MID(RC[-5],7,20)*1 -> 5000 | I138: =SUM(R5C8:RC[-1]) -> 3009470 | J138: =VLOOKUP(ROUND(RC[-1],-2),C[13]:C[14],2,TRUE) -> 49 | L138: =ROUND(R5C12+(R215C12-R5C12)/R214C7^3*R[-1]C[-5]^3,0) -> 2689395 | M138: =ROUND(RC[-1]-R[-1]C[-1],-3) -> 89000 | N138: 0 | O138: =RC[-2]+RC[-1] -> 89000 | P138: =SUM(R5C15:RC[-1]) -> 3770140 | Q138: =ROUND(RC[-4]/VLOOKUP(RC[-13],C20:C22,2,FALSE),3) -> 0.066 | R138: =VLOOKUP(ROUND(RC[-2],-2),C23:C24,2,TRUE) -> 51 | S138: =RC[-9]-RC[-1] -> -2
B139: 1 | C139: 0,1,7,340000 | D139: 60 | F139: 2 | G139: =R[-1]C+RC[-1] -> 184 | H139: =MID(RC[-5],7,20)*1 -> 340000 | I139: =SUM(R5C8:RC[-1]) -> 3349470 | J139: =VLOOKUP(ROUND(RC[-1],-2),C[13]:C[14],2,TRUE) -> 50 | L139: =ROUND(R5C12+(R215C12-R5C12)/R214C7^3*R[-1]C[-5]^3,0) -> 2780041 | M139: =ROUND(RC[-1]-R[-1]C[-1],-3) -> 91000 | N139: 0 | O139: =RC[-2]+RC[-1] -> 91000 | P139: =SUM(R5C15:RC[-1]) -> 3861140 | Q139: =ROUND(RC[-4]/VLOOKUP(RC[-13],C20:C22,2,FALSE),3) -> 0.067 | R139: =VLOOKUP(ROUND(RC[-2],-2),C23:C24,2,TRUE) -> 51 | S139: =RC[-9]-RC[-1] -> -1
B140: 1 | C140: 0,1,7,5500 | D140: 65 | F140: 2 | G140: =R[-1]C+RC[-1] -> 186 | H140: =MID(RC[-5],7,20)*1 -> 5500 | I140: =SUM(R5C8:RC[-1]) -> 3354970 | J140: =VLOOKUP(ROUND(RC[-1],-2),C[13]:C[14],2,TRUE) -> 50 | L140: =ROUND(R5C12+(R215C12-R5C12)/R214C7^3*R[-1]C[-5]^3,0) -> 2872701 | M140: =ROUND(RC[-1]-R[-1]C[-1],-3) -> 93000 | N140: 0 | O140: =RC[-2]+RC[-1] -> 93000 | P140: =SUM(R5C15:RC[-1]) -> 3954140 | Q140: =ROUND(RC[-4]/VLOOKUP(RC[-13],C20:C22,2,FALSE),3) -> 0.046 | R140: =VLOOKUP(ROUND(RC[-2],-2),C23:C24,2,TRUE) -> 51 | S140: =RC[-9]-RC[-1] -> -1
B141: 1 | C141: 0,1,7,340000 | D141: 65 | F141: 2 | G141: =R[-1]C+RC[-1] -> 188 | H141: =MID(RC[-5],7,20)*1 -> 340000 | I141: =SUM(R5C8:RC[-1]) -> 3694970 | J141: =VLOOKUP(ROUND(RC[-1],-2),C[13]:C[14],2,TRUE) -> 51 | L141: =ROUND(R5C12+(R215C12-R5C12)/R214C7^3*R[-1]C[-5]^3,0) -> 2967397 | M141: =ROUND(RC[-1]-R[-1]C[-1],-3) -> 95000 | N141: =ROUND(SUM(R[-4]C[-1]:RC[-1])/0.7*0.3,-3) -> 195000 | O141: =RC[-2]+RC[-1] -> 290000 | P141: =SUM(R5C15:RC[-1]) -> 4244140 | Q141: =ROUND(RC[-4]/VLOOKUP(RC[-13],C20:C22,2,FALSE),3) -> 0.047 | R141: =VLOOKUP(ROUND(RC[-2],-2),C23:C24,2,TRUE) -> 52 | S141: =RC[-9]-RC[-1] -> -1
B142: 1 | C142: 0,1,7,5500 | D142: 65 | F142: 2 | G142: =R[-1]C+RC[-1] -> 190 | H142: =MID(RC[-5],7,20)*1 -> 5500 | I142: =SUM(R5C8:RC[-1]) -> 3700470 | J142: =VLOOKUP(ROUND(RC[-1],-2),C[13]:C[14],2,TRUE) -> 51 | L142: =ROUND(R5C12+(R215C12-R5C12)/R214C7^3*R[-1]C[-5]^3,0) -> 3064152 | M142: =ROUND(RC[-1]-R[-1]C[-1],-3) -> 97000 | N142: 0 | O142: =RC[-2]+RC[-1] -> 97000 | P142: =SUM(R5C15:RC[-1]) -> 4341140 | Q142: =ROUND(RC[-4]/VLOOKUP(RC[-13],C20:C22,2,FALSE),3) -> 0.048 | R142: =VLOOKUP(ROUND(RC[-2],-2),C23:C24,2,TRUE) -> 52 | S142: =RC[-9]-RC[-1] -> -1
B143: 1 | C143: 0,1,7,5500 | D143: 65 | F143: 2 | G143: =R[-1]C+RC[-1] -> 192 | H143: =MID(RC[-5],7,20)*1 -> 5500 | I143: =SUM(R5C8:RC[-1]) -> 3705970 | J143: =VLOOKUP(ROUND(RC[-1],-2),C[13]:C[14],2,TRUE) -> 51 | L143: =ROUND(R5C12+(R215C12-R5C12)/R214C7^3*R[-1]C[-5]^3,0) -> 3162987 | M143: =ROUND(RC[-1]-R[-1]C[-1],-3) -> 99000 | N143: 0 | O143: =RC[-2]+RC[-1] -> 99000 | P143: =SUM(R5C15:RC[-1]) -> 4440140 | Q143: =ROUND(RC[-4]/VLOOKUP(RC[-13],C20:C22,2,FALSE),3) -> 0.049 | R143: =VLOOKUP(ROUND(RC[-2],-2),C23:C24,2,TRUE) -> 52 | S143: =RC[-9]-RC[-1] -> -1
B144: 1 | C144: 0,1,7,5500 | D144: 65 | F144: 2 | G144: =R[-1]C+RC[-1] -> 194 | H144: =MID(RC[-5],7,20)*1 -> 5500 | I144: =SUM(R5C8:RC[-1]) -> 3711470 | J144: =VLOOKUP(ROUND(RC[-1],-2),C[13]:C[14],2,TRUE) -> 51 | L144: =ROUND(R5C12+(R215C12-R5C12)/R214C7^3*R[-1]C[-5]^3,0) -> 3263926 | M144: =ROUND(RC[-1]-R[-1]C[-1],-3) -> 101000 | N144: 0 | O144: =RC[-2]+RC[-1] -> 101000 | P144: =SUM(R5C15:RC[-1]) -> 4541140 | Q144: =ROUND(RC[-4]/VLOOKUP(RC[-13],C20:C22,2,FALSE),3) -> 0.05 | R144: =VLOOKUP(ROUND(RC[-2],-2),C23:C24,2,TRUE) -> 52 | S144: =RC[-9]-RC[-1] -> -1
B145: 1 | C145: 0,1,7,5500 | D145: 65 | F145: 2 | G145: =R[-1]C+RC[-1] -> 196 | H145: =MID(RC[-5],7,20)*1 -> 5500 | I145: =SUM(R5C8:RC[-1]) -> 3716970 | J145: =VLOOKUP(ROUND(RC[-1],-2),C[13]:C[14],2,TRUE) -> 51 | L145: =ROUND(R5C12+(R215C12-R5C12)/R214C7^3*R[-1]C[-5]^3,0) -> 3366989 | M145: =ROUND(RC[-1]-R[-1]C[-1],-3) -> 103000 | N145: 0 | O145: =RC[-2]+RC[-1] -> 103000 | P145: =SUM(R5C15:RC[-1]) -> 4644140 | Q145: =ROUND(RC[-4]/VLOOKUP(RC[-13],C20:C22,2,FALSE),3) -> 0.051 | R145: =VLOOKUP(ROUND(RC[-2],-2),C23:C24,2,TRUE) -> 52 | S145: =RC[-9]-RC[-1] -> -1
B146: 1 | C146: 0,1,7,340000 | D146: 65 | F146: 2 | G146: =R[-1]C+RC[-1] -> 198 | H146: =MID(RC[-5],7,20)*1 -> 340000 | I146: =SUM(R5C8:RC[-1]) -> 4056970 | J146: =VLOOKUP(ROUND(RC[-1],-2),C[13]:C[14],2,TRUE) -> 51 | L146: =ROUND(R5C12+(R215C12-R5C12)/R214C7^3*R[-1]C[-5]^3,0) -> 3472199 | M146: =ROUND(RC[-1]-R[-1]C[-1],-3) -> 105000 | N146: =ROUND(SUM(R[-4]C[-1]:RC[-1])/0.7*0.3,-3) -> 216000 | O146: =RC[-2]+RC[-1] -> 321000 | P146: =SUM(R5C15:RC[-1]) -> 4965140 | Q146: =ROUND(RC[-4]/VLOOKUP(RC[-13],C20:C22,2,FALSE),3) -> 0.052 | R146: =VLOOKUP(ROUND(RC[-2],-2),C23:C24,2,TRUE) -> 53 | S146: =RC[-9]-RC[-1] -> -2
B147: 1 | C147: 0,1,7,5500 | D147: 65 | F147: 2 | G147: =R[-1]C+RC[-1] -> 200 | H147: =MID(RC[-5],7,20)*1 -> 5500 | I147: =SUM(R5C8:RC[-1]) -> 4062470 | J147: =VLOOKUP(ROUND(RC[-1],-2),C[13]:C[14],2,TRUE) -> 51 | L147: =ROUND(R5C12+(R215C12-R5C12)/R214C7^3*R[-1]C[-5]^3,0) -> 3579578 | M147: =ROUND(RC[-1]-R[-1]C[-1],-3) -> 107000 | N147: 0 | O147: =RC[-2]+RC[-1] -> 107000 | P147: =SUM(R5C15:RC[-1]) -> 5072140 | Q147: =ROUND(RC[-4]/VLOOKUP(RC[-13],C20:C22,2,FALSE),3) -> 0.053 | R147: =VLOOKUP(ROUND(RC[-2],-2),C23:C24,2,TRUE) -> 53 | S147: =RC[-9]-RC[-1] -> -2
B148: 1 | C148: 0,1,7,5500 | D148: 65 | F148: 2 | G148: =R[-1]C+RC[-1] -> 202 | H148: =MID(RC[-5],7,20)*1 -> 5500 | I148: =SUM(R5C8:RC[-1]) -> 4067970 | J148: =VLOOKUP(ROUND(RC[-1],-2),C[13]:C[14],2,TRUE) -> 51 | L148: =ROUND(R5C12+(R215C12-R5C12)/R214C7^3*R[-1]C[-5]^3,0) -> 3689149 | M148: =ROUND(RC[-1]-R[-1]C[-1],-3) -> 110000 | N148: 0 | O148: =RC[-2]+RC[-1] -> 110000 | P148: =SUM(R5C15:RC[-1]) -> 5182140 | Q148: =ROUND(RC[-4]/VLOOKUP(RC[-13],C20:C22,2,FALSE),3) -> 0.054 | R148: =VLOOKUP(ROUND(RC[-2],-2),C23:C24,2,TRUE) -> 53 | S148: =RC[-9]-RC[-1] -> -2
B149: 1 | C149: 0,1,7,353000 | D149: 65 | F149: 2 | G149: =R[-1]C+RC[-1] -> 204 | H149: =MID(RC[-5],7,20)*1 -> 353000 | I149: =SUM(R5C8:RC[-1]) -> 4420970 | J149: =VLOOKUP(ROUND(RC[-1],-2),C[13]:C[14],2,TRUE) -> 52 | L149: =ROUND(R5C12+(R215C12-R5C12)/R214C7^3*R[-1]C[-5]^3,0) -> 3800934 | M149: =ROUND(RC[-1]-R[-1]C[-1],-3) -> 112000 | N149: 0 | O149: =RC[-2]+RC[-1] -> 112000 | P149: =SUM(R5C15:RC[-1]) -> 5294140 | Q149: =ROUND(RC[-4]/VLOOKUP(RC[-13],C20:C22,2,FALSE),3) -> 0.055 | R149: =VLOOKUP(ROUND(RC[-2],-2),C23:C24,2,TRUE) -> 53 | S149: =RC[-9]-RC[-1] -> -1
B150: 1 | C150: 0,1,7,6000 | D150: 70 | F150: 2 | G150: =R[-1]C+RC[-1] -> 206 | H150: =MID(RC[-5],7,20)*1 -> 6000 | I150: =SUM(R5C8:RC[-1]) -> 4426970 | J150: =VLOOKUP(ROUND(RC[-1],-2),C[13]:C[14],2,TRUE) -> 52 | L150: =ROUND(R5C12+(R215C12-R5C12)/R214C7^3*R[-1]C[-5]^3,0) -> 3914954 | M150: =ROUND(RC[-1]-R[-1]C[-1],-3) -> 114000 | N150: 0 | O150: =RC[-2]+RC[-1] -> 114000 | P150: =SUM(R5C15:RC[-1]) -> 5408140 | Q150: =ROUND(RC[-4]/VLOOKUP(RC[-13],C20:C22,2,FALSE),3) -> 0.039 | R150: =VLOOKUP(ROUND(RC[-2],-2),C23:C24,2,TRUE) -> 53 | S150: =RC[-9]-RC[-1] -> -1
B151: 1 | C151: 0,1,7,6000 | D151: 70 | F151: 2 | G151: =R[-1]C+RC[-1] -> 208 | H151: =MID(RC[-5],7,20)*1 -> 6000 | I151: =SUM(R5C8:RC[-1]) -> 4432970 | J151: =VLOOKUP(ROUND(RC[-1],-2),C[13]:C[14],2,TRUE) -> 52 | L151: =ROUND(R5C12+(R215C12-R5C12)/R214C7^3*R[-1]C[-5]^3,0) -> 4031231 | M151: =ROUND(RC[-1]-R[-1]C[-1],-3) -> 116000 | N151: =ROUND(SUM(R[-4]C[-1]:RC[-1])/0.7*0.3,-3) -> 240000 | O151: =RC[-2]+RC[-1] -> 356000 | P151: =SUM(R5C15:RC[-1]) -> 5764140 | Q151: =ROUND(RC[-4]/VLOOKUP(RC[-13],C20:C22,2,FALSE),3) -> 0.039 | R151: =VLOOKUP(ROUND(RC[-2],-2),C23:C24,2,TRUE) -> 54 | S151: =RC[-9]-RC[-1] -> -2
B152: 1 | C152: 0,1,7,950000 | D152: 70 | F152: 3 | G152: =R[-1]C+RC[-1] -> 211 | H152: =MID(RC[-5],7,20)*1 -> 950000 | I152: =SUM(R5C8:RC[-1]) -> 5382970 | J152: =VLOOKUP(ROUND(RC[-1],-2),C[13]:C[14],2,TRUE) -> 53 | L152: =ROUND(R5C12+(R215C12-R5C12)/R214C7^3*R[-1]C[-5]^3,0) -> 4149789 | M152: =ROUND(RC[-1]-R[-1]C[-1],-3) -> 119000 | N152: 0 | O152: =RC[-2]+RC[-1] -> 119000 | P152: =SUM(R5C15:RC[-1]) -> 5883140 | Q152: =ROUND(RC[-4]/VLOOKUP(RC[-13],C20:C22,2,FALSE),3) -> 0.041 | R152: =VLOOKUP(ROUND(RC[-2],-2),C23:C24,2,TRUE) -> 54 | S152: =RC[-9]-RC[-1] -> -1
B153: 1 | C153: 0,1,7,6000 | D153: 70 | F153: 3 | G153: =R[-1]C+RC[-1] -> 214 | H153: =MID(RC[-5],7,20)*1 -> 6000 | I153: =SUM(R5C8:RC[-1]) -> 5388970 | J153: =VLOOKUP(ROUND(RC[-1],-2),C[13]:C[14],2,TRUE) -> 53 | L153: =ROUND(R5C12+(R215C12-R5C12)/R214C7^3*R[-1]C[-5]^3,0) -> 4331948 | M153: =ROUND(RC[-1]-R[-1]C[-1],-3) -> 182000 | N153: 0 | O153: =RC[-2]+RC[-1] -> 182000 | P153: =SUM(R5C15:RC[-1]) -> 6065140 | Q153: =ROUND(RC[-4]/VLOOKUP(RC[-13],C20:C22,2,FALSE),3) -> 0.062 | R153: =VLOOKUP(ROUND(RC[-2],-2),C23:C24,2,TRUE) -> 54 | S153: =RC[-9]-RC[-1] -> -1
B154: 1 | C154: 0,1,7,1050000 | D154: 70 | F154: 3 | G154: =R[-1]C+RC[-1] -> 217 | H154: =MID(RC[-5],7,20)*1 -> 1050000 | I154: =SUM(R5C8:RC[-1]) -> 6438970 | J154: =VLOOKUP(ROUND(RC[-1],-2),C[13]:C[14],2,TRUE) -> 55 | L154: =ROUND(R5C12+(R215C12-R5C12)/R214C7^3*R[-1]C[-5]^3,0) -> 4519362 | M154: =ROUND(RC[-1]-R[-1]C[-1],-3) -> 187000 | N154: 0 | O154: =RC[-2]+RC[-1] -> 187000 | P154: =SUM(R5C15:RC[-1]) -> 6252140 | Q154: =ROUND(RC[-4]/VLOOKUP(RC[-13],C20:C22,2,FALSE),3) -> 0.064 | R154: =VLOOKUP(ROUND(RC[-2],-2),C23:C24,2,TRUE) -> 54 | S154: =RC[-9]-RC[-1] -> 1
B155: 1 | C155: 0,1,7,6000 | D155: 70 | F155: 3 | G155: =R[-1]C+RC[-1] -> 220 | H155: =MID(RC[-5],7,20)*1 -> 6000 | I155: =SUM(R5C8:RC[-1]) -> 6444970 | J155: =VLOOKUP(ROUND(RC[-1],-2),C[13]:C[14],2,TRUE) -> 55 | L155: =ROUND(R5C12+(R215C12-R5C12)/R214C7^3*R[-1]C[-5]^3,0) -> 4712105 | M155: =ROUND(RC[-1]-R[-1]C[-1],-3) -> 193000 | N155: 0 | O155: =RC[-2]+RC[-1] -> 193000 | P155: =SUM(R5C15:RC[-1]) -> 6445140 | Q155: =ROUND(RC[-4]/VLOOKUP(RC[-13],C20:C22,2,FALSE),3) -> 0.066 | R155: =VLOOKUP(ROUND(RC[-2],-2),C23:C24,2,TRUE) -> 55 | S155: =RC[-9]-RC[-1] -> 0
B156: 1 | C156: 0,1,7,6000 | D156: 70 | F156: 3 | G156: =R[-1]C+RC[-1] -> 223 | H156: =MID(RC[-5],7,20)*1 -> 6000 | I156: =SUM(R5C8:RC[-1]) -> 6450970 | J156: =VLOOKUP(ROUND(RC[-1],-2),C[13]:C[14],2,TRUE) -> 55 | L156: =ROUND(R5C12+(R215C12-R5C12)/R214C7^3*R[-1]C[-5]^3,0) -> 4910251 | M156: =ROUND(RC[-1]-R[-1]C[-1],-3) -> 198000 | N156: =ROUND(SUM(R[-4]C[-1]:RC[-1])/0.7*0.3,-3) -> 377000 | O156: =RC[-2]+RC[-1] -> 575000 | P156: =SUM(R5C15:RC[-1]) -> 7020140 | Q156: =ROUND(RC[-4]/VLOOKUP(RC[-13],C20:C22,2,FALSE),3) -> 0.067 | R156: =VLOOKUP(ROUND(RC[-2],-2),C23:C24,2,TRUE) -> 55 | S156: =RC[-9]-RC[-1] -> 0
B157: 1 | C157: 0,1,7,6000 | D157: 70 | F157: 3 | G157: =R[-1]C+RC[-1] -> 226 | H157: =MID(RC[-5],7,20)*1 -> 6000 | I157: =SUM(R5C8:RC[-1]) -> 6456970 | J157: =VLOOKUP(ROUND(RC[-1],-2),C[13]:C[14],2,TRUE) -> 55 | L157: =ROUND(R5C12+(R215C12-R5C12)/R214C7^3*R[-1]C[-5]^3,0) -> 5113876 | M157: =ROUND(RC[-1]-R[-1]C[-1],-3) -> 204000 | N157: 0 | O157: =RC[-2]+RC[-1] -> 204000 | P157: =SUM(R5C15:RC[-1]) -> 7224140 | Q157: =ROUND(RC[-4]/VLOOKUP(RC[-13],C20:C22,2,FALSE),3) -> 0.069 | R157: =VLOOKUP(ROUND(RC[-2],-2),C23:C24,2,TRUE) -> 56 | S157: =RC[-9]-RC[-1] -> -1
B158: 1 | C158: 0,1,7,1050000 | D158: 70 | F158: 3 | G158: =R[-1]C+RC[-1] -> 229 | H158: =MID(RC[-5],7,20)*1 -> 1050000 | I158: =SUM(R5C8:RC[-1]) -> 7506970 | J158: =VLOOKUP(ROUND(RC[-1],-2),C[13]:C[14],2,TRUE) -> 56 | L158: =ROUND(R5C12+(R215C12-R5C12)/R214C7^3*R[-1]C[-5]^3,0) -> 5323054 | M158: =ROUND(RC[-1]-R[-1]C[-1],-3) -> 209000 | N158: 0 | O158: =RC[-2]+RC[-1] -> 209000 | P158: =SUM(R5C15:RC[-1]) -> 7433140 | Q158: =ROUND(RC[-4]/VLOOKUP(RC[-13],C20:C22,2,FALSE),3) -> 0.071 | R158: =VLOOKUP(ROUND(RC[-2],-2),C23:C24,2,TRUE) -> 56 | S158: =RC[-9]-RC[-1] -> 0
B159: 1 | C159: 0,1,7,8000 | D159: 75 | F159: 3 | G159: =R[-1]C+RC[-1] -> 232 | H159: =MID(RC[-5],7,20)*1 -> 8000 | I159: =SUM(R5C8:RC[-1]) -> 7514970 | J159: =VLOOKUP(ROUND(RC[-1],-2),C[13]:C[14],2,TRUE) -> 56 | L159: =ROUND(R5C12+(R215C12-R5C12)/R214C7^3*R[-1]C[-5]^3,0) -> 5537859 | M159: =ROUND(RC[-1]-R[-1]C[-1],-3) -> 215000 | N159: 0 | O159: =RC[-2]+RC[-1] -> 215000 | P159: =SUM(R5C15:RC[-1]) -> 7648140 | Q159: =ROUND(RC[-4]/VLOOKUP(RC[-13],C20:C22,2,FALSE),3) -> 0.052 | R159: =VLOOKUP(ROUND(RC[-2],-2),C23:C24,2,TRUE) -> 56 | S159: =RC[-9]-RC[-1] -> 0
B160: 1 | C160: 0,1,7,8000 | D160: 75 | F160: 3 | G160: =R[-1]C+RC[-1] -> 235 | H160: =MID(RC[-5],7,20)*1 -> 8000 | I160: =SUM(R5C8:RC[-1]) -> 7522970 | J160: =VLOOKUP(ROUND(RC[-1],-2),C[13]:C[14],2,TRUE) -> 56 | L160: =ROUND(R5C12+(R215C12-R5C12)/R214C7^3*R[-1]C[-5]^3,0) -> 5758367 | M160: =ROUND(RC[-1]-R[-1]C[-1],-3) -> 221000 | N160: 0 | O160: =RC[-2]+RC[-1] -> 221000 | P160: =SUM(R5C15:RC[-1]) -> 7869140 | Q160: =ROUND(RC[-4]/VLOOKUP(RC[-13],C20:C22,2,FALSE),3) -> 0.054 | R160: =VLOOKUP(ROUND(RC[-2],-2),C23:C24,2,TRUE) -> 56 | S160: =RC[-9]-RC[-1] -> 0
B161: 1 | C161: 0,1,7,1600000 | D161: 75 | F161: 3 | G161: =R[-1]C+RC[-1] -> 238 | H161: =MID(RC[-5],7,20)*1 -> 1600000 | I161: =SUM(R5C8:RC[-1]) -> 9122970 | J161: =VLOOKUP(ROUND(RC[-1],-2),C[13]:C[14],2,TRUE) -> 57 | L161: =ROUND(R5C12+(R215C12-R5C12)/R214C7^3*R[-1]C[-5]^3,0) -> 5984652 | M161: =ROUND(RC[-1]-R[-1]C[-1],-3) -> 226000 | N161: =ROUND(SUM(R[-4]C[-1]:RC[-1])/0.7*0.3,-3) -> 461000 | O161: =RC[-2]+RC[-1] -> 687000 | P161: =SUM(R5C15:RC[-1]) -> 8556140 | Q161: =ROUND(RC[-4]/VLOOKUP(RC[-13],C20:C22,2,FALSE),3) -> 0.055 | R161: =VLOOKUP(ROUND(RC[-2],-2),C23:C24,2,TRUE) -> 57 | S161: =RC[-9]-RC[-1] -> 0
B162: 1 | C162: 0,1,7,8000 | D162: 75 | F162: 3 | G162: =R[-1]C+RC[-1] -> 241 | H162: =MID(RC[-5],7,20)*1 -> 8000 | I162: =SUM(R5C8:RC[-1]) -> 9130970 | J162: =VLOOKUP(ROUND(RC[-1],-2),C[13]:C[14],2,TRUE) -> 57 | L162: =ROUND(R5C12+(R215C12-R5C12)/R214C7^3*R[-1]C[-5]^3,0) -> 6216789 | M162: =ROUND(RC[-1]-R[-1]C[-1],-3) -> 232000 | N162: 0 | O162: =RC[-2]+RC[-1] -> 232000 | P162: =SUM(R5C15:RC[-1]) -> 8788140 | Q162: =ROUND(RC[-4]/VLOOKUP(RC[-13],C20:C22,2,FALSE),3) -> 0.056 | R162: =VLOOKUP(ROUND(RC[-2],-2),C23:C24,2,TRUE) -> 57 | S162: =RC[-9]-RC[-1] -> 0
B163: 1 | C163: 0,1,7,8000 | D163: 75 | F163: 3 | G163: =R[-1]C+RC[-1] -> 244 | H163: =MID(RC[-5],7,20)*1 -> 8000 | I163: =SUM(R5C8:RC[-1]) -> 9138970 | J163: =VLOOKUP(ROUND(RC[-1],-2),C[13]:C[14],2,TRUE) -> 57 | L163: =ROUND(R5C12+(R215C12-R5C12)/R214C7^3*R[-1]C[-5]^3,0) -> 6454853 | M163: =ROUND(RC[-1]-R[-1]C[-1],-3) -> 238000 | N163: 0 | O163: =RC[-2]+RC[-1] -> 238000 | P163: =SUM(R5C15:RC[-1]) -> 9026140 | Q163: =ROUND(RC[-4]/VLOOKUP(RC[-13],C20:C22,2,FALSE),3) -> 0.058 | R163: =VLOOKUP(ROUND(RC[-2],-2),C23:C24,2,TRUE) -> 57 | S163: =RC[-9]-RC[-1] -> 0
B164: 1 | C164: 0,1,7,8000 | D164: 75 | F164: 3 | G164: =R[-1]C+RC[-1] -> 247 | H164: =MID(RC[-5],7,20)*1 -> 8000 | I164: =SUM(R5C8:RC[-1]) -> 9146970 | J164: =VLOOKUP(ROUND(RC[-1],-2),C[13]:C[14],2,TRUE) -> 57 | L164: =ROUND(R5C12+(R215C12-R5C12)/R214C7^3*R[-1]C[-5]^3,0) -> 6698918 | M164: =ROUND(RC[-1]-R[-1]C[-1],-3) -> 244000 | N164: 0 | O164: =RC[-2]+RC[-1] -> 244000 | P164: =SUM(R5C15:RC[-1]) -> 9270140 | Q164: =ROUND(RC[-4]/VLOOKUP(RC[-13],C20:C22,2,FALSE),3) -> 0.059 | R164: =VLOOKUP(ROUND(RC[-2],-2),C23:C24,2,TRUE) -> 58 | S164: =RC[-9]-RC[-1] -> -1
B165: 1 | C165: 0,1,7,8000 | D165: 75 | F165: 3 | G165: =R[-1]C+RC[-1] -> 250 | H165: =MID(RC[-5],7,20)*1 -> 8000 | I165: =SUM(R5C8:RC[-1]) -> 9154970 | J165: =VLOOKUP(ROUND(RC[-1],-2),C[13]:C[14],2,TRUE) -> 58 | L165: =ROUND(R5C12+(R215C12-R5C12)/R214C7^3*R[-1]C[-5]^3,0) -> 6949059 | M165: =ROUND(RC[-1]-R[-1]C[-1],-3) -> 250000 | N165: 0 | O165: =RC[-2]+RC[-1] -> 250000 | P165: =SUM(R5C15:RC[-1]) -> 9520140 | Q165: =ROUND(RC[-4]/VLOOKUP(RC[-13],C20:C22,2,FALSE),3) -> 0.061 | R165: =VLOOKUP(ROUND(RC[-2],-2),C23:C24,2,TRUE) -> 58 | S165: =RC[-9]-RC[-1] -> 0
B166: 1 | C166: 0,1,7,8000 | D166: 75 | F166: 3 | G166: =R[-1]C+RC[-1] -> 253 | H166: =MID(RC[-5],7,20)*1 -> 8000 | I166: =SUM(R5C8:RC[-1]) -> 9162970 | J166: =VLOOKUP(ROUND(RC[-1],-2),C[13]:C[14],2,TRUE) -> 58 | L166: =ROUND(R5C12+(R215C12-R5C12)/R214C7^3*R[-1]C[-5]^3,0) -> 7205351 | M166: =ROUND(RC[-1]-R[-1]C[-1],-3) -> 256000 | N166: =ROUND(SUM(R[-4]C[-1]:RC[-1])/0.7*0.3,-3) -> 523000 | O166: =RC[-2]+RC[-1] -> 779000 | P166: =SUM(R5C15:RC[-1]) -> 10299140 | Q166: =ROUND(RC[-4]/VLOOKUP(RC[-13],C20:C22,2,FALSE),3) -> 0.062 | R166: =VLOOKUP(ROUND(RC[-2],-2),C23:C24,2,TRUE) -> 59 | S166: =RC[-9]-RC[-1] -> -1
B167: 1 | C167: 0,1,7,1600000 | D167: 75 | F167: 3 | G167: =R[-1]C+RC[-1] -> 256 | H167: =MID(RC[-5],7,20)*1 -> 1600000 | I167: =SUM(R5C8:RC[-1]) -> 10762970 | J167: =VLOOKUP(ROUND(RC[-1],-2),C[13]:C[14],2,TRUE) -> 59 | L167: =ROUND(R5C12+(R215C12-R5C12)/R214C7^3*R[-1]C[-5]^3,0) -> 7467868 | M167: =ROUND(RC[-1]-R[-1]C[-1],-3) -> 263000 | N167: 0 | O167: =RC[-2]+RC[-1] -> 263000 | P167: =SUM(R5C15:RC[-1]) -> 10562140 | Q167: =ROUND(RC[-4]/VLOOKUP(RC[-13],C20:C22,2,FALSE),3) -> 0.064 | R167: =VLOOKUP(ROUND(RC[-2],-2),C23:C24,2,TRUE) -> 59 | S167: =RC[-9]-RC[-1] -> 0
B168: 1 | C168: 0,1,7,8000 | D168: 75 | F168: 3 | G168: =R[-1]C+RC[-1] -> 259 | H168: =MID(RC[-5],7,20)*1 -> 8000 | I168: =SUM(R5C8:RC[-1]) -> 10770970 | J168: =VLOOKUP(ROUND(RC[-1],-2),C[13]:C[14],2,TRUE) -> 59 | L168: =ROUND(R5C12+(R215C12-R5C12)/R214C7^3*R[-1]C[-5]^3,0) -> 7736685 | M168: =ROUND(RC[-1]-R[-1]C[-1],-3) -> 269000 | N168: 0 | O168: =RC[-2]+RC[-1] -> 269000 | P168: =SUM(R5C15:RC[-1]) -> 10831140 | Q168: =ROUND(RC[-4]/VLOOKUP(RC[-13],C20:C22,2,FALSE),3) -> 0.065 | R168: =VLOOKUP(ROUND(RC[-2],-2),C23:C24,2,TRUE) -> 59 | S168: =RC[-9]-RC[-1] -> 0
B169: 1 | C169: 0,1,7,9000 | D169: 80 | F169: 3 | G169: =R[-1]C+RC[-1] -> 262 | H169: =MID(RC[-5],7,20)*1 -> 9000 | I169: =SUM(R5C8:RC[-1]) -> 10779970 | J169: =VLOOKUP(ROUND(RC[-1],-2),C[13]:C[14],2,TRUE) -> 59 | L169: =ROUND(R5C12+(R215C12-R5C12)/R214C7^3*R[-1]C[-5]^3,0) -> 8011877 | M169: =ROUND(RC[-1]-R[-1]C[-1],-3) -> 275000 | N169: 0 | O169: =RC[-2]+RC[-1] -> 275000 | P169: =SUM(R5C15:RC[-1]) -> 11106140 | Q169: =ROUND(RC[-4]/VLOOKUP(RC[-13],C20:C22,2,FALSE),3) -> 0.045 | R169: =VLOOKUP(ROUND(RC[-2],-2),C23:C24,2,TRUE) -> 59 | S169: =RC[-9]-RC[-1] -> 0
B170: 1 | C170: 0,1,7,9000 | D170: 80 | F170: 3 | G170: =R[-1]C+RC[-1] -> 265 | H170: =MID(RC[-5],7,20)*1 -> 9000 | I170: =SUM(R5C8:RC[-1]) -> 10788970 | J170: =VLOOKUP(ROUND(RC[-1],-2),C[13]:C[14],2,TRUE) -> 59 | L170: =ROUND(R5C12+(R215C12-R5C12)/R214C7^3*R[-1]C[-5]^3,0) -> 8293518 | M170: =ROUND(RC[-1]-R[-1]C[-1],-3) -> 282000 | N170: 0 | O170: =RC[-2]+RC[-1] -> 282000 | P170: =SUM(R5C15:RC[-1]) -> 11388140 | Q170: =ROUND(RC[-4]/VLOOKUP(RC[-13],C20:C22,2,FALSE),3) -> 0.046 | R170: =VLOOKUP(ROUND(RC[-2],-2),C23:C24,2,TRUE) -> 59 | S170: =RC[-9]-RC[-1] -> 0
B171: 1 | C171: 0,1,7,1835000 | D171: 80 | F171: 3 | G171: =R[-1]C+RC[-1] -> 268 | H171: =MID(RC[-5],7,20)*1 -> 1835000 | I171: =SUM(R5C8:RC[-1]) -> 12623970 | J171: =VLOOKUP(ROUND(RC[-1],-2),C[13]:C[14],2,TRUE) -> 60 | L171: =ROUND(R5C12+(R215C12-R5C12)/R214C7^3*R[-1]C[-5]^3,0) -> 8581684 | M171: =ROUND(RC[-1]-R[-1]C[-1],-3) -> 288000 | N171: =ROUND(SUM(R[-4]C[-1]:RC[-1])/0.7*0.3,-3) -> 590000 | O171: =RC[-2]+RC[-1] -> 878000 | P171: =SUM(R5C15:RC[-1]) -> 12266140 | Q171: =ROUND(RC[-4]/VLOOKUP(RC[-13],C20:C22,2,FALSE),3) -> 0.047 | R171: =VLOOKUP(ROUND(RC[-2],-2),C23:C24,2,TRUE) -> 60 | S171: =RC[-9]-RC[-1] -> 0
B172: 1 | C172: 0,1,7,9000 | D172: 80 | F172: 3 | G172: =R[-1]C+RC[-1] -> 271 | H172: =MID(RC[-5],7,20)*1 -> 9000 | I172: =SUM(R5C8:RC[-1]) -> 12632970 | J172: =VLOOKUP(ROUND(RC[-1],-2),C[13]:C[14],2,TRUE) -> 60 | L172: =ROUND(R5C12+(R215C12-R5C12)/R214C7^3*R[-1]C[-5]^3,0) -> 8876449 | M172: =ROUND(RC[-1]-R[-1]C[-1],-3) -> 295000 | N172: 0 | O172: =RC[-2]+RC[-1] -> 295000 | P172: =SUM(R5C15:RC[-1]) -> 12561140 | Q172: =ROUND(RC[-4]/VLOOKUP(RC[-13],C20:C22,2,FALSE),3) -> 0.048 | R172: =VLOOKUP(ROUND(RC[-2],-2),C23:C24,2,TRUE) -> 60 | S172: =RC[-9]-RC[-1] -> 0
B173: 1 | C173: 0,1,7,9000 | D173: 80 | F173: 3 | G173: =R[-1]C+RC[-1] -> 274 | H173: =MID(RC[-5],7,20)*1 -> 9000 | I173: =SUM(R5C8:RC[-1]) -> 12641970 | J173: =VLOOKUP(ROUND(RC[-1],-2),C[13]:C[14],2,TRUE) -> 60 | L173: =ROUND(R5C12+(R215C12-R5C12)/R214C7^3*R[-1]C[-5]^3,0) -> 9177887 | M173: =ROUND(RC[-1]-R[-1]C[-1],-3) -> 301000 | N173: 0 | O173: =RC[-2]+RC[-1] -> 301000 | P173: =SUM(R5C15:RC[-1]) -> 12862140 | Q173: =ROUND(RC[-4]/VLOOKUP(RC[-13],C20:C22,2,FALSE),3) -> 0.049 | R173: =VLOOKUP(ROUND(RC[-2],-2),C23:C24,2,TRUE) -> 60 | S173: =RC[-9]-RC[-1] -> 0
B174: 1 | C174: 0,1,7,2200000 | D174: 80 | F174: 3 | G174: =R[-1]C+RC[-1] -> 277 | H174: =MID(RC[-5],7,20)*1 -> 2200000 | I174: =SUM(R5C8:RC[-1]) -> 14841970 | J174: =VLOOKUP(ROUND(RC[-1],-2),C[13]:C[14],2,TRUE) -> 62 | L174: =ROUND(R5C12+(R215C12-R5C12)/R214C7^3*R[-1]C[-5]^3,0) -> 9486074 | M174: =ROUND(RC[-1]-R[-1]C[-1],-3) -> 308000 | N174: 0 | O174: =RC[-2]+RC[-1] -> 308000 | P174: =SUM(R5C15:RC[-1]) -> 13170140 | Q174: =ROUND(RC[-4]/VLOOKUP(RC[-13],C20:C22,2,FALSE),3) -> 0.05 | R174: =VLOOKUP(ROUND(RC[-2],-2),C23:C24,2,TRUE) -> 61 | S174: =RC[-9]-RC[-1] -> 1
B175: 1 | C175: 0,1,7,9000 | D175: 80 | F175: 3 | G175: =R[-1]C+RC[-1] -> 280 | H175: =MID(RC[-5],7,20)*1 -> 9000 | I175: =SUM(R5C8:RC[-1]) -> 14850970 | J175: =VLOOKUP(ROUND(RC[-1],-2),C[13]:C[14],2,TRUE) -> 62 | L175: =ROUND(R5C12+(R215C12-R5C12)/R214C7^3*R[-1]C[-5]^3,0) -> 9801083 | M175: =ROUND(RC[-1]-R[-1]C[-1],-3) -> 315000 | N175: 0 | O175: =RC[-2]+RC[-1] -> 315000 | P175: =SUM(R5C15:RC[-1]) -> 13485140 | Q175: =ROUND(RC[-4]/VLOOKUP(RC[-13],C20:C22,2,FALSE),3) -> 0.051 | R175: =VLOOKUP(ROUND(RC[-2],-2),C23:C24,2,TRUE) -> 61 | S175: =RC[-9]-RC[-1] -> 1
B176: 1 | C176: 0,1,7,9000 | D176: 80 | F176: 3 | G176: =R[-1]C+RC[-1] -> 283 | H176: =MID(RC[-5],7,20)*1 -> 9000 | I176: =SUM(R5C8:RC[-1]) -> 14859970 | J176: =VLOOKUP(ROUND(RC[-1],-2),C[13]:C[14],2,TRUE) -> 62 | L176: =ROUND(R5C12+(R215C12-R5C12)/R214C7^3*R[-1]C[-5]^3,0) -> 10122991 | M176: =ROUND(RC[-1]-R[-1]C[-1],-3) -> 322000 | N176: =ROUND(SUM(R[-4]C[-1]:RC[-1])/0.7*0.3,-3) -> 660000 | O176: =RC[-2]+RC[-1] -> 982000 | P176: =SUM(R5C15:RC[-1]) -> 14467140 | Q176: =ROUND(RC[-4]/VLOOKUP(RC[-13],C20:C22,2,FALSE),3) -> 0.052 | R176: =VLOOKUP(ROUND(RC[-2],-2),C23:C24,2,TRUE) -> 62 | S176: =RC[-9]-RC[-1] -> 0
B177: 1 | C177: 0,1,7,10000 | D177: 85 | F177: 3 | G177: =R[-1]C+RC[-1] -> 286 | H177: =MID(RC[-5],7,20)*1 -> 10000 | I177: =SUM(R5C8:RC[-1]) -> 14869970 | J177: =VLOOKUP(ROUND(RC[-1],-2),C[13]:C[14],2,TRUE) -> 62 | L177: =ROUND(R5C12+(R215C12-R5C12)/R214C7^3*R[-1]C[-5]^3,0) -> 10451871 | M177: =ROUND(RC[-1]-R[-1]C[-1],-3) -> 329000 | N177: 0 | O177: =RC[-2]+RC[-1] -> 329000 | P177: =SUM(R5C15:RC[-1]) -> 14796140 | Q177: =ROUND(RC[-4]/VLOOKUP(RC[-13],C20:C22,2,FALSE),3) -> 0.028 | R177: =VLOOKUP(ROUND(RC[-2],-2),C23:C24,2,TRUE) -> 62 | S177: =RC[-9]-RC[-1] -> 0
B178: 1 | C178: 0,1,7,2400000 | D178: 85 | F178: 3 | G178: =R[-1]C+RC[-1] -> 289 | H178: =MID(RC[-5],7,20)*1 -> 2400000 | I178: =SUM(R5C8:RC[-1]) -> 17269970 | J178: =VLOOKUP(ROUND(RC[-1],-2),C[13]:C[14],2,TRUE) -> 63 | L178: =ROUND(R5C12+(R215C12-R5C12)/R214C7^3*R[-1]C[-5]^3,0) -> 10787798 | M178: =ROUND(RC[-1]-R[-1]C[-1],-3) -> 336000 | N178: 0 | O178: =RC[-2]+RC[-1] -> 336000 | P178: =SUM(R5C15:RC[-1]) -> 15132140 | Q178: =ROUND(RC[-4]/VLOOKUP(RC[-13],C20:C22,2,FALSE),3) -> 0.028 | R178: =VLOOKUP(ROUND(RC[-2],-2),C23:C24,2,TRUE) -> 62 | S178: =RC[-9]-RC[-1] -> 1
B179: 1 | C179: 0,1,7,10000 | D179: 85 | F179: 3 | G179: =R[-1]C+RC[-1] -> 292 | H179: =MID(RC[-5],7,20)*1 -> 10000 | I179: =SUM(R5C8:RC[-1]) -> 17279970 | J179: =VLOOKUP(ROUND(RC[-1],-2),C[13]:C[14],2,TRUE) -> 63 | L179: =ROUND(R5C12+(R215C12-R5C12)/R214C7^3*R[-1]C[-5]^3,0) -> 11130847 | M179: =ROUND(RC[-1]-R[-1]C[-1],-3) -> 343000 | N179: 0 | O179: =RC[-2]+RC[-1] -> 343000 | P179: =SUM(R5C15:RC[-1]) -> 15475140 | Q179: =ROUND(RC[-4]/VLOOKUP(RC[-13],C20:C22,2,FALSE),3) -> 0.029 | R179: =VLOOKUP(ROUND(RC[-2],-2),C23:C24,2,TRUE) -> 62 | S179: =RC[-9]-RC[-1] -> 1
B180: 1 | C180: 0,1,7,10000 | D180: 85 | F180: 3 | G180: =R[-1]C+RC[-1] -> 295 | H180: =MID(RC[-5],7,20)*1 -> 10000 | I180: =SUM(R5C8:RC[-1]) -> 17289970 | J180: =VLOOKUP(ROUND(RC[-1],-2),C[13]:C[14],2,TRUE) -> 63 | L180: =ROUND(R5C12+(R215C12-R5C12)/R214C7^3*R[-1]C[-5]^3,0) -> 11481092 | M180: =ROUND(RC[-1]-R[-1]C[-1],-3) -> 350000 | N180: 0 | O180: =RC[-2]+RC[-1] -> 350000 | P180: =SUM(R5C15:RC[-1]) -> 15825140 | Q180: =ROUND(RC[-4]/VLOOKUP(RC[-13],C20:C22,2,FALSE),3) -> 0.029 | R180: =VLOOKUP(ROUND(RC[-2],-2),C23:C24,2,TRUE) -> 62 | S180: =RC[-9]-RC[-1] -> 1
B181: 1 | C181: 0,1,7,10000 | D181: 85 | F181: 3 | G181: =R[-1]C+RC[-1] -> 298 | H181: =MID(RC[-5],7,20)*1 -> 10000 | I181: =SUM(R5C8:RC[-1]) -> 17299970 | J181: =VLOOKUP(ROUND(RC[-1],-2),C[13]:C[14],2,TRUE) -> 63 | L181: =ROUND(R5C12+(R215C12-R5C12)/R214C7^3*R[-1]C[-5]^3,0) -> 11838609 | M181: =ROUND(RC[-1]-R[-1]C[-1],-3) -> 358000 | N181: =ROUND(SUM(R[-4]C[-1]:RC[-1])/0.7*0.3,-3) -> 735000 | O181: =RC[-2]+RC[-1] -> 1093000 | P181: =SUM(R5C15:RC[-1]) -> 16918140 | Q181: =ROUND(RC[-4]/VLOOKUP(RC[-13],C20:C22,2,FALSE),3) -> 0.03 | R181: =VLOOKUP(ROUND(RC[-2],-2),C23:C24,2,TRUE) -> 63 | S181: =RC[-9]-RC[-1] -> 0
B182: 1 | C182: 0,1,7,10000 | D182: 85 | F182: 3 | G182: =R[-1]C+RC[-1] -> 301 | H182: =MID(RC[-5],7,20)*1 -> 10000 | I182: =SUM(R5C8:RC[-1]) -> 17309970 | J182: =VLOOKUP(ROUND(RC[-1],-2),C[13]:C[14],2,TRUE) -> 63 | L182: =ROUND(R5C12+(R215C12-R5C12)/R214C7^3*R[-1]C[-5]^3,0) -> 12203472 | M182: =ROUND(RC[-1]-R[-1]C[-1],-3) -> 365000 | N182: 0 | O182: =RC[-2]+RC[-1] -> 365000 | P182: =SUM(R5C15:RC[-1]) -> 17283140 | Q182: =ROUND(RC[-4]/VLOOKUP(RC[-13],C20:C22,2,FALSE),3) -> 0.031 | R182: =VLOOKUP(ROUND(RC[-2],-2),C23:C24,2,TRUE) -> 63 | S182: =RC[-9]-RC[-1] -> 0
B183: 1 | C183: 0,1,7,3080000 | D183: 85 | F183: 3 | G183: =R[-1]C+RC[-1] -> 304 | H183: =MID(RC[-5],7,20)*1 -> 3080000 | I183: =SUM(R5C8:RC[-1]) -> 20389970 | J183: =VLOOKUP(ROUND(RC[-1],-2),C[13]:C[14],2,TRUE) -> 65 | L183: =ROUND(R5C12+(R215C12-R5C12)/R214C7^3*R[-1]C[-5]^3,0) -> 12575755 | M183: =ROUND(RC[-1]-R[-1]C[-1],-3) -> 372000 | N183: 0 | O183: =RC[-2]+RC[-1] -> 372000 | P183: =SUM(R5C15:RC[-1]) -> 17655140 | Q183: =ROUND(RC[-4]/VLOOKUP(RC[-13],C20:C22,2,FALSE),3) -> 0.031 | R183: =VLOOKUP(ROUND(RC[-2],-2),C23:C24,2,TRUE) -> 63 | S183: =RC[-9]-RC[-1] -> 2
B184: 1 | C184: 0,1,7,10000 | D184: 85 | F184: 3 | G184: =R[-1]C+RC[-1] -> 307 | H184: =MID(RC[-5],7,20)*1 -> 10000 | I184: =SUM(R5C8:RC[-1]) -> 20399970 | J184: =VLOOKUP(ROUND(RC[-1],-2),C[13]:C[14],2,TRUE) -> 65 | L184: =ROUND(R5C12+(R215C12-R5C12)/R214C7^3*R[-1]C[-5]^3,0) -> 12955534 | M184: =ROUND(RC[-1]-R[-1]C[-1],-3) -> 380000 | N184: 0 | O184: =RC[-2]+RC[-1] -> 380000 | P184: =SUM(R5C15:RC[-1]) -> 18035140 | Q184: =ROUND(RC[-4]/VLOOKUP(RC[-13],C20:C22,2,FALSE),3) -> 0.032 | R184: =VLOOKUP(ROUND(RC[-2],-2),C23:C24,2,TRUE) -> 64 | S184: =RC[-9]-RC[-1] -> 1
B185: 1 | C185: 0,1,7,20000 | D185: 85 | F185: 3 | G185: =R[-1]C+RC[-1] -> 310 | H185: =MID(RC[-5],7,20)*1 -> 20000 | I185: =SUM(R5C8:RC[-1]) -> 20419970 | J185: =VLOOKUP(ROUND(RC[-1],-2),C[13]:C[14],2,TRUE) -> 65 | L185: =ROUND(R5C12+(R215C12-R5C12)/R214C7^3*R[-1]C[-5]^3,0) -> 13342883 | M185: =ROUND(RC[-1]-R[-1]C[-1],-3) -> 387000 | N185: 0 | O185: =RC[-2]+RC[-1] -> 387000 | P185: =SUM(R5C15:RC[-1]) -> 18422140 | Q185: =ROUND(RC[-4]/VLOOKUP(RC[-13],C20:C22,2,FALSE),3) -> 0.032 | R185: =VLOOKUP(ROUND(RC[-2],-2),C23:C24,2,TRUE) -> 64 | S185: =RC[-9]-RC[-1] -> 1
B186: 1 | C186: 0,1,7,10000 | D186: 85 | F186: 3 | G186: =R[-1]C+RC[-1] -> 313 | H186: =MID(RC[-5],7,20)*1 -> 10000 | I186: =SUM(R5C8:RC[-1]) -> 20429970 | J186: =VLOOKUP(ROUND(RC[-1],-2),C[13]:C[14],2,TRUE) -> 65 | L186: =ROUND(R5C12+(R215C12-R5C12)/R214C7^3*R[-1]C[-5]^3,0) -> 13737876 | M186: =ROUND(RC[-1]-R[-1]C[-1],-3) -> 395000 | N186: =ROUND(SUM(R[-4]C[-1]:RC[-1])/0.7*0.3,-3) -> 814000 | O186: =RC[-2]+RC[-1] -> 1209000 | P186: =SUM(R5C15:RC[-1]) -> 19631140 | Q186: =ROUND(RC[-4]/VLOOKUP(RC[-13],C20:C22,2,FALSE),3) -> 0.033 | R186: =VLOOKUP(ROUND(RC[-2],-2),C23:C24,2,TRUE) -> 65 | S186: =RC[-9]-RC[-1] -> 0
B187: 1 | C187: 0,1,7,20000 | D187: 90 | F187: 3 | G187: =R[-1]C+RC[-1] -> 316 | H187: =MID(RC[-5],7,20)*1 -> 20000 | I187: =SUM(R5C8:RC[-1]) -> 20449970 | J187: =VLOOKUP(ROUND(RC[-1],-2),C[13]:C[14],2,TRUE) -> 65 | L187: =ROUND(R5C12+(R215C12-R5C12)/R214C7^3*R[-1]C[-5]^3,0) -> 14140590 | M187: =ROUND(RC[-1]-R[-1]C[-1],-3) -> 403000 | N187: 0 | O187: =RC[-2]+RC[-1] -> 403000 | P187: =SUM(R5C15:RC[-1]) -> 20034140 | Q187: =ROUND(RC[-4]/VLOOKUP(RC[-13],C20:C22,2,FALSE),3) -> 0.02 | R187: =VLOOKUP(ROUND(RC[-2],-2),C23:C24,2,TRUE) -> 65 | S187: =RC[-9]-RC[-1] -> 0
B188: 1 | C188: 0,1,7,20000 | D188: 90 | F188: 3 | G188: =R[-1]C+RC[-1] -> 319 | H188: =MID(RC[-5],7,20)*1 -> 20000 | I188: =SUM(R5C8:RC[-1]) -> 20469970 | J188: =VLOOKUP(ROUND(RC[-1],-2),C[13]:C[14],2,TRUE) -> 65 | L188: =ROUND(R5C12+(R215C12-R5C12)/R214C7^3*R[-1]C[-5]^3,0) -> 14551097 | M188: =ROUND(RC[-1]-R[-1]C[-1],-3) -> 411000 | N188: 0 | O188: =RC[-2]+RC[-1] -> 411000 | P188: =SUM(R5C15:RC[-1]) -> 20445140 | Q188: =ROUND(RC[-4]/VLOOKUP(RC[-13],C20:C22,2,FALSE),3) -> 0.02 | R188: =VLOOKUP(ROUND(RC[-2],-2),C23:C24,2,TRUE) -> 65 | S188: =RC[-9]-RC[-1] -> 0
B189: 1 | C189: 0,1,7,20000 | D189: 90 | F189: 3 | G189: =R[-1]C+RC[-1] -> 322 | H189: =MID(RC[-5],7,20)*1 -> 20000 | I189: =SUM(R5C8:RC[-1]) -> 20489970 | J189: =VLOOKUP(ROUND(RC[-1],-2),C[13]:C[14],2,TRUE) -> 65 | L189: =ROUND(R5C12+(R215C12-R5C12)/R214C7^3*R[-1]C[-5]^3,0) -> 14969473 | M189: =ROUND(RC[-1]-R[-1]C[-1],-3) -> 418000 | N189: 0 | O189: =RC[-2]+RC[-1] -> 418000 | P189: =SUM(R5C15:RC[-1]) -> 20863140 | Q189: =ROUND(RC[-4]/VLOOKUP(RC[-13],C20:C22,2,FALSE),3) -> 0.02 | R189: =VLOOKUP(ROUND(RC[-2],-2),C23:C24,2,TRUE) -> 65 | S189: =RC[-9]-RC[-1] -> 0
B190: 1 | C190: 0,1,7,20000 | D190: 90 | F190: 3 | G190: =R[-1]C+RC[-1] -> 325 | H190: =MID(RC[-5],7,20)*1 -> 20000 | I190: =SUM(R5C8:RC[-1]) -> 20509970 | J190: =VLOOKUP(ROUND(RC[-1],-2),C[13]:C[14],2,TRUE) -> 65 | L190: =ROUND(R5C12+(R215C12-R5C12)/R214C7^3*R[-1]C[-5]^3,0) -> 15395793 | M190: =ROUND(RC[-1]-R[-1]C[-1],-3) -> 426000 | N190: 0 | O190: =RC[-2]+RC[-1] -> 426000 | P190: =SUM(R5C15:RC[-1]) -> 21289140 | Q190: =ROUND(RC[-4]/VLOOKUP(RC[-13],C20:C22,2,FALSE),3) -> 0.021 | R190: =VLOOKUP(ROUND(RC[-2],-2),C23:C24,2,TRUE) -> 65 | S190: =RC[-9]-RC[-1] -> 0
B191: 1 | C191: 0,1,7,40000 | D191: 90 | F191: 3 | G191: =R[-1]C+RC[-1] -> 328 | H191: =MID(RC[-5],7,20)*1 -> 40000 | I191: =SUM(R5C8:RC[-1]) -> 20549970 | J191: =VLOOKUP(ROUND(RC[-1],-2),C[13]:C[14],2,TRUE) -> 65 | L191: =ROUND(R5C12+(R215C12-R5C12)/R214C7^3*R[-1]C[-5]^3,0) -> 15830131 | M191: =ROUND(RC[-1]-R[-1]C[-1],-3) -> 434000 | N191: =ROUND(SUM(R[-4]C[-1]:RC[-1])/0.7*0.3,-3) -> 897000 | O191: =RC[-2]+RC[-1] -> 1331000 | P191: =SUM(R5C15:RC[-1]) -> 22620140 | Q191: =ROUND(RC[-4]/VLOOKUP(RC[-13],C20:C22,2,FALSE),3) -> 0.021 | R191: =VLOOKUP(ROUND(RC[-2],-2),C23:C24,2,TRUE) -> 66 | S191: =RC[-9]-RC[-1] -> -1
B192: 1 | C192: 0,1,7,20000 | D192: 90 | F192: 3 | G192: =R[-1]C+RC[-1] -> 331 | H192: =MID(RC[-5],7,20)*1 -> 20000 | I192: =SUM(R5C8:RC[-1]) -> 20569970 | J192: =VLOOKUP(ROUND(RC[-1],-2),C[13]:C[14],2,TRUE) -> 65 | L192: =ROUND(R5C12+(R215C12-R5C12)/R214C7^3*R[-1]C[-5]^3,0) -> 16272563 | M192: =ROUND(RC[-1]-R[-1]C[-1],-3) -> 442000 | N192: 0 | O192: =RC[-2]+RC[-1] -> 442000 | P192: =SUM(R5C15:RC[-1]) -> 23062140 | Q192: =ROUND(RC[-4]/VLOOKUP(RC[-13],C20:C22,2,FALSE),3) -> 0.022 | R192: =VLOOKUP(ROUND(RC[-2],-2),C23:C24,2,TRUE) -> 66 | S192: =RC[-9]-RC[-1] -> -1
B193: 1 | C193: 0,1,7,3100000 | D193: 90 | F193: 3 | G193: =R[-1]C+RC[-1] -> 334 | H193: =MID(RC[-5],7,20)*1 -> 3100000 | I193: =SUM(R5C8:RC[-1]) -> 23669970 | J193: =VLOOKUP(ROUND(RC[-1],-2),C[13]:C[14],2,TRUE) -> 66 | L193: =ROUND(R5C12+(R215C12-R5C12)/R214C7^3*R[-1]C[-5]^3,0) -> 16723162 | M193: =ROUND(RC[-1]-R[-1]C[-1],-3) -> 451000 | N193: 0 | O193: =RC[-2]+RC[-1] -> 451000 | P193: =SUM(R5C15:RC[-1]) -> 23513140 | Q193: =ROUND(RC[-4]/VLOOKUP(RC[-13],C20:C22,2,FALSE),3) -> 0.022 | R193: =VLOOKUP(ROUND(RC[-2],-2),C23:C24,2,TRUE) -> 66 | S193: =RC[-9]-RC[-1] -> 0
B194: 1 | C194: 0,1,7,20000 | D194: 90 | F194: 3 | G194: =R[-1]C+RC[-1] -> 337 | H194: =MID(RC[-5],7,20)*1 -> 20000 | I194: =SUM(R5C8:RC[-1]) -> 23689970 | J194: =VLOOKUP(ROUND(RC[-1],-2),C[13]:C[14],2,TRUE) -> 66 | L194: =ROUND(R5C12+(R215C12-R5C12)/R214C7^3*R[-1]C[-5]^3,0) -> 17182003 | M194: =ROUND(RC[-1]-R[-1]C[-1],-3) -> 459000 | N194: 0 | O194: =RC[-2]+RC[-1] -> 459000 | P194: =SUM(R5C15:RC[-1]) -> 23972140 | Q194: =ROUND(RC[-4]/VLOOKUP(RC[-13],C20:C22,2,FALSE),3) -> 0.022 | R194: =VLOOKUP(ROUND(RC[-2],-2),C23:C24,2,TRUE) -> 67 | S194: =RC[-9]-RC[-1] -> -1
B195: 1 | C195: 0,1,7,20000 | D195: 90 | F195: 3 | G195: =R[-1]C+RC[-1] -> 340 | H195: =MID(RC[-5],7,20)*1 -> 20000 | I195: =SUM(R5C8:RC[-1]) -> 23709970 | J195: =VLOOKUP(ROUND(RC[-1],-2),C[13]:C[14],2,TRUE) -> 66 | L195: =ROUND(R5C12+(R215C12-R5C12)/R214C7^3*R[-1]C[-5]^3,0) -> 17649162 | M195: =ROUND(RC[-1]-R[-1]C[-1],-3) -> 467000 | N195: 0 | O195: =RC[-2]+RC[-1] -> 467000 | P195: =SUM(R5C15:RC[-1]) -> 24439140 | Q195: =ROUND(RC[-4]/VLOOKUP(RC[-13],C20:C22,2,FALSE),3) -> 0.023 | R195: =VLOOKUP(ROUND(RC[-2],-2),C23:C24,2,TRUE) -> 67 | S195: =RC[-9]-RC[-1] -> -1
B196: 1 | C196: 0,1,7,30000 | D196: 95 | F196: 3 | G196: =R[-1]C+RC[-1] -> 343 | H196: =MID(RC[-5],7,20)*1 -> 30000 | I196: =SUM(R5C8:RC[-1]) -> 23739970 | J196: =VLOOKUP(ROUND(RC[-1],-2),C[13]:C[14],2,TRUE) -> 66 | L196: =ROUND(R5C12+(R215C12-R5C12)/R214C7^3*R[-1]C[-5]^3,0) -> 18124712 | M196: =ROUND(RC[-1]-R[-1]C[-1],-3) -> 476000 | N196: =ROUND(SUM(R[-4]C[-1]:RC[-1])/0.7*0.3,-3) -> 984000 | O196: =RC[-2]+RC[-1] -> 1460000 | P196: =SUM(R5C15:RC[-1]) -> 25899140 | Q196: =ROUND(RC[-4]/VLOOKUP(RC[-13],C20:C22,2,FALSE),3) -> 0.015 | R196: =VLOOKUP(ROUND(RC[-2],-2),C23:C24,2,TRUE) -> 67 | S196: =RC[-9]-RC[-1] -> -1
B197: 1 | C197: 0,1,7,30000 | D197: 95 | F197: 3 | G197: =R[-1]C+RC[-1] -> 346 | H197: =MID(RC[-5],7,20)*1 -> 30000 | I197: =SUM(R5C8:RC[-1]) -> 23769970 | J197: =VLOOKUP(ROUND(RC[-1],-2),C[13]:C[14],2,TRUE) -> 66 | L197: =ROUND(R5C12+(R215C12-R5C12)/R214C7^3*R[-1]C[-5]^3,0) -> 18608729 | M197: =ROUND(RC[-1]-R[-1]C[-1],-3) -> 484000 | N197: 0 | O197: =RC[-2]+RC[-1] -> 484000 | P197: =SUM(R5C15:RC[-1]) -> 26383140 | Q197: =ROUND(RC[-4]/VLOOKUP(RC[-13],C20:C22,2,FALSE),3) -> 0.015 | R197: =VLOOKUP(ROUND(RC[-2],-2),C23:C24,2,TRUE) -> 68 | S197: =RC[-9]-RC[-1] -> -2
B198: 1 | C198: 0,1,7,30000 | D198: 95 | F198: 3 | G198: =R[-1]C+RC[-1] -> 349 | H198: =MID(RC[-5],7,20)*1 -> 30000 | I198: =SUM(R5C8:RC[-1]) -> 23799970 | J198: =VLOOKUP(ROUND(RC[-1],-2),C[13]:C[14],2,TRUE) -> 67 | L198: =ROUND(R5C12+(R215C12-R5C12)/R214C7^3*R[-1]C[-5]^3,0) -> 19101287 | M198: =ROUND(RC[-1]-R[-1]C[-1],-3) -> 493000 | N198: 0 | O198: =RC[-2]+RC[-1] -> 493000 | P198: =SUM(R5C15:RC[-1]) -> 26876140 | Q198: =ROUND(RC[-4]/VLOOKUP(RC[-13],C20:C22,2,FALSE),3) -> 0.015 | R198: =VLOOKUP(ROUND(RC[-2],-2),C23:C24,2,TRUE) -> 68 | S198: =RC[-9]-RC[-1] -> -1
B199: 1 | C199: 0,1,7,30000 | D199: 95 | F199: 3 | G199: =R[-1]C+RC[-1] -> 352 | H199: =MID(RC[-5],7,20)*1 -> 30000 | I199: =SUM(R5C8:RC[-1]) -> 23829970 | J199: =VLOOKUP(ROUND(RC[-1],-2),C[13]:C[14],2,TRUE) -> 67 | L199: =ROUND(R5C12+(R215C12-R5C12)/R214C7^3*R[-1]C[-5]^3,0) -> 19602462 | M199: =ROUND(RC[-1]-R[-1]C[-1],-3) -> 501000 | N199: 0 | O199: =RC[-2]+RC[-1] -> 501000 | P199: =SUM(R5C15:RC[-1]) -> 27377140 | Q199: =ROUND(RC[-4]/VLOOKUP(RC[-13],C20:C22,2,FALSE),3) -> 0.015 | R199: =VLOOKUP(ROUND(RC[-2],-2),C23:C24,2,TRUE) -> 68 | S199: =RC[-9]-RC[-1] -> -1
B200: 1 | C200: 0,1,7,3200000 | D200: 95 | F200: 3 | G200: =R[-1]C+RC[-1] -> 355 | H200: =MID(RC[-5],7,20)*1 -> 3200000 | I200: =SUM(R5C8:RC[-1]) -> 27029970 | J200: =VLOOKUP(ROUND(RC[-1],-2),C[13]:C[14],2,TRUE) -> 68 | L200: =ROUND(R5C12+(R215C12-R5C12)/R214C7^3*R[-1]C[-5]^3,0) -> 20112327 | M200: =ROUND(RC[-1]-R[-1]C[-1],-3) -> 510000 | N200: 0 | O200: =RC[-2]+RC[-1] -> 510000 | P200: =SUM(R5C15:RC[-1]) -> 27887140 | Q200: =ROUND(RC[-4]/VLOOKUP(RC[-13],C20:C22,2,FALSE),3) -> 0.016 | R200: =VLOOKUP(ROUND(RC[-2],-2),C23:C24,2,TRUE) -> 68 | S200: =RC[-9]-RC[-1] -> 0
B201: 1 | C201: 0,1,7,30000 | D201: 95 | F201: 3 | G201: =R[-1]C+RC[-1] -> 358 | H201: =MID(RC[-5],7,20)*1 -> 30000 | I201: =SUM(R5C8:RC[-1]) -> 27059970 | J201: =VLOOKUP(ROUND(RC[-1],-2),C[13]:C[14],2,TRUE) -> 68 | L201: =ROUND(R5C12+(R215C12-R5C12)/R214C7^3*R[-1]C[-5]^3,0) -> 20630957 | M201: =ROUND(RC[-1]-R[-1]C[-1],-3) -> 519000 | N201: =ROUND(SUM(R[-4]C[-1]:RC[-1])/0.7*0.3,-3) -> 1074000 | O201: =RC[-2]+RC[-1] -> 1593000 | P201: =SUM(R5C15:RC[-1]) -> 29480140 | Q201: =ROUND(RC[-4]/VLOOKUP(RC[-13],C20:C22,2,FALSE),3) -> 0.016 | R201: =VLOOKUP(ROUND(RC[-2],-2),C23:C24,2,TRUE) -> 69 | S201: =RC[-9]-RC[-1] -> -1
B202: 1 | C202: 0,1,7,30000 | D202: 95 | F202: 3 | G202: =R[-1]C+RC[-1] -> 361 | H202: =MID(RC[-5],7,20)*1 -> 30000 | I202: =SUM(R5C8:RC[-1]) -> 27089970 | J202: =VLOOKUP(ROUND(RC[-1],-2),C[13]:C[14],2,TRUE) -> 68 | L202: =ROUND(R5C12+(R215C12-R5C12)/R214C7^3*R[-1]C[-5]^3,0) -> 21158427 | M202: =ROUND(RC[-1]-R[-1]C[-1],-3) -> 527000 | N202: 0 | O202: =RC[-2]+RC[-1] -> 527000 | P202: =SUM(R5C15:RC[-1]) -> 30007140 | Q202: =ROUND(RC[-4]/VLOOKUP(RC[-13],C20:C22,2,FALSE),3) -> 0.016 | R202: =VLOOKUP(ROUND(RC[-2],-2),C23:C24,2,TRUE) -> 69 | S202: =RC[-9]-RC[-1] -> -1
B203: 1 | C203: 0,1,7,3300000 | D203: 95 | F203: 3 | G203: =R[-1]C+RC[-1] -> 364 | H203: =MID(RC[-5],7,20)*1 -> 3300000 | I203: =SUM(R5C8:RC[-1]) -> 30389970 | J203: =VLOOKUP(ROUND(RC[-1],-2),C[13]:C[14],2,TRUE) -> 69 | L203: =ROUND(R5C12+(R215C12-R5C12)/R214C7^3*R[-1]C[-5]^3,0) -> 21694812 | M203: =ROUND(RC[-1]-R[-1]C[-1],-3) -> 536000 | N203: 0 | O203: =RC[-2]+RC[-1] -> 536000 | P203: =SUM(R5C15:RC[-1]) -> 30543140 | Q203: =ROUND(RC[-4]/VLOOKUP(RC[-13],C20:C22,2,FALSE),3) -> 0.016 | R203: =VLOOKUP(ROUND(RC[-2],-2),C23:C24,2,TRUE) -> 69 | S203: =RC[-9]-RC[-1] -> 0
B204: 1 | C204: 0,1,7,30000 | D204: 95 | F204: 3 | G204: =R[-1]C+RC[-1] -> 367 | H204: =MID(RC[-5],7,20)*1 -> 30000 | I204: =SUM(R5C8:RC[-1]) -> 30419970 | J204: =VLOOKUP(ROUND(RC[-1],-2),C[13]:C[14],2,TRUE) -> 69 | L204: =ROUND(R5C12+(R215C12-R5C12)/R214C7^3*R[-1]C[-5]^3,0) -> 22240187 | M204: =ROUND(RC[-1]-R[-1]C[-1],-3) -> 545000 | N204: 0 | O204: =RC[-2]+RC[-1] -> 545000 | P204: =SUM(R5C15:RC[-1]) -> 31088140 | Q204: =ROUND(RC[-4]/VLOOKUP(RC[-13],C20:C22,2,FALSE),3) -> 0.017 | R204: =VLOOKUP(ROUND(RC[-2],-2),C23:C24,2,TRUE) -> 69 | S204: =RC[-9]-RC[-1] -> 0
B205: 1 | C205: 0,1,7,30000 | D205: 95 | F205: 3 | G205: =R[-1]C+RC[-1] -> 370 | H205: =MID(RC[-5],7,20)*1 -> 30000 | I205: =SUM(R5C8:RC[-1]) -> 30449970 | J205: =VLOOKUP(ROUND(RC[-1],-2),C[13]:C[14],2,TRUE) -> 69 | L205: =ROUND(R5C12+(R215C12-R5C12)/R214C7^3*R[-1]C[-5]^3,0) -> 22794626 | M205: =ROUND(RC[-1]-R[-1]C[-1],-3) -> 554000 | N205: 0 | O205: =RC[-2]+RC[-1] -> 554000 | P205: =SUM(R5C15:RC[-1]) -> 31642140 | Q205: =ROUND(RC[-4]/VLOOKUP(RC[-13],C20:C22,2,FALSE),3) -> 0.017 | R205: =VLOOKUP(ROUND(RC[-2],-2),C23:C24,2,TRUE) -> 70 | S205: =RC[-9]-RC[-1] -> -1
B206: 1 | C206: 0,1,7,3400000 | D206: 95 | F206: 3 | G206: =R[-1]C+RC[-1] -> 373 | H206: =MID(RC[-5],7,20)*1 -> 3400000 | I206: =SUM(R5C8:RC[-1]) -> 33849970 | J206: =VLOOKUP(ROUND(RC[-1],-2),C[13]:C[14],2,TRUE) -> 70 | L206: =ROUND(R5C12+(R215C12-R5C12)/R214C7^3*R[-1]C[-5]^3,0) -> 23358203 | M206: =ROUND(RC[-1]-R[-1]C[-1],-3) -> 564000 | N206: =ROUND(SUM(R[-4]C[-1]:RC[-1])/0.7*0.3,-3) -> 1168000 | O206: =RC[-2]+RC[-1] -> 1732000 | P206: =SUM(R5C15:RC[-1]) -> 33374140 | Q206: =ROUND(RC[-4]/VLOOKUP(RC[-13],C20:C22,2,FALSE),3) -> 0.017 | R206: =VLOOKUP(ROUND(RC[-2],-2),C23:C24,2,TRUE) -> 70 | S206: =RC[-9]-RC[-1] -> 0
B207: 1 | C207: 0,1,7,30000 | D207: 95 | F207: 3 | G207: =R[-1]C+RC[-1] -> 376 | H207: =MID(RC[-5],7,20)*1 -> 30000 | I207: =SUM(R5C8:RC[-1]) -> 33879970 | J207: =VLOOKUP(ROUND(RC[-1],-2),C[13]:C[14],2,TRUE) -> 70 | L207: =ROUND(R5C12+(R215C12-R5C12)/R214C7^3*R[-1]C[-5]^3,0) -> 23930995 | M207: =ROUND(RC[-1]-R[-1]C[-1],-3) -> 573000 | N207: 0 | O207: =RC[-2]+RC[-1] -> 573000 | P207: =SUM(R5C15:RC[-1]) -> 33947140 | Q207: =ROUND(RC[-4]/VLOOKUP(RC[-13],C20:C22,2,FALSE),3) -> 0.018 | R207: =VLOOKUP(ROUND(RC[-2],-2),C23:C24,2,TRUE) -> 70 | S207: =RC[-9]-RC[-1] -> 0
B208: 1 | C208: 0,1,7,40000 | D208: 100 | F208: 3 | G208: =R[-1]C+RC[-1] -> 379 | H208: =MID(RC[-5],7,20)*1 -> 40000 | I208: =SUM(R5C8:RC[-1]) -> 33919970 | J208: =VLOOKUP(ROUND(RC[-1],-2),C[13]:C[14],2,TRUE) -> 70 | L208: =ROUND(R5C12+(R215C12-R5C12)/R214C7^3*R[-1]C[-5]^3,0) -> 24513074 | M208: =ROUND(RC[-1]-R[-1]C[-1],-3) -> 582000 | N208: 0 | O208: =RC[-2]+RC[-1] -> 582000 | P208: =SUM(R5C15:RC[-1]) -> 34529140 | Q208: =ROUND(RC[-4]/VLOOKUP(RC[-13],C20:C22,2,FALSE),3) -> 0.009 | R208: =VLOOKUP(ROUND(RC[-2],-2),C23:C24,2,TRUE) -> 71 | S208: =RC[-9]-RC[-1] -> -1
B209: 1 | C209: 0,1,7,40000 | D209: 100 | F209: 3 | G209: =R[-1]C+RC[-1] -> 382 | H209: =MID(RC[-5],7,20)*1 -> 40000 | I209: =SUM(R5C8:RC[-1]) -> 33959970 | J209: =VLOOKUP(ROUND(RC[-1],-2),C[13]:C[14],2,TRUE) -> 70 | L209: =ROUND(R5C12+(R215C12-R5C12)/R214C7^3*R[-1]C[-5]^3,0) -> 25104517 | M209: =ROUND(RC[-1]-R[-1]C[-1],-3) -> 591000 | N209: 0 | O209: =RC[-2]+RC[-1] -> 591000 | P209: =SUM(R5C15:RC[-1]) -> 35120140 | Q209: =ROUND(RC[-4]/VLOOKUP(RC[-13],C20:C22,2,FALSE),3) -> 0.01 | R209: =VLOOKUP(ROUND(RC[-2],-2),C23:C24,2,TRUE) -> 71 | S209: =RC[-9]-RC[-1] -> -1
B210: 1 | C210: 0,1,7,40000 | D210: 100 | F210: 3 | G210: =R[-1]C+RC[-1] -> 385 | H210: =MID(RC[-5],7,20)*1 -> 40000 | I210: =SUM(R5C8:RC[-1]) -> 33999970 | J210: =VLOOKUP(ROUND(RC[-1],-2),C[13]:C[14],2,TRUE) -> 70 | L210: =ROUND(R5C12+(R215C12-R5C12)/R214C7^3*R[-1]C[-5]^3,0) -> 25705397 | M210: =ROUND(RC[-1]-R[-1]C[-1],-3) -> 601000 | N210: 0 | O210: =RC[-2]+RC[-1] -> 601000 | P210: =SUM(R5C15:RC[-1]) -> 35721140 | Q210: =ROUND(RC[-4]/VLOOKUP(RC[-13],C20:C22,2,FALSE),3) -> 0.01 | R210: =VLOOKUP(ROUND(RC[-2],-2),C23:C24,2,TRUE) -> 71 | S210: =RC[-9]-RC[-1] -> -1
B211: 1 | C211: 0,1,7,3500000 | D211: 100 | F211: 3 | G211: =R[-1]C+RC[-1] -> 388 | H211: =MID(RC[-5],7,20)*1 -> 3500000 | I211: =SUM(R5C8:RC[-1]) -> 37499970 | J211: =VLOOKUP(ROUND(RC[-1],-2),C[13]:C[14],2,TRUE) -> 71 | L211: =ROUND(R5C12+(R215C12-R5C12)/R214C7^3*R[-1]C[-5]^3,0) -> 26315790 | M211: =ROUND(RC[-1]-R[-1]C[-1],-3) -> 610000 | N211: =ROUND(SUM(R[-4]C[-1]:RC[-1])/0.7*0.3,-3) -> 1267000 | O211: =RC[-2]+RC[-1] -> 1877000 | P211: =SUM(R5C15:RC[-1]) -> 37598140 | Q211: =ROUND(RC[-4]/VLOOKUP(RC[-13],C20:C22,2,FALSE),3) -> 0.01 | R211: =VLOOKUP(ROUND(RC[-2],-2),C23:C24,2,TRUE) -> 72 | S211: =RC[-9]-RC[-1] -> -1
B212: 1 | C212: 0,1,7,40000 | D212: 100 | F212: 3 | G212: =R[-1]C+RC[-1] -> 391 | H212: =MID(RC[-5],7,20)*1 -> 40000 | I212: =SUM(R5C8:RC[-1]) -> 37539970 | J212: =VLOOKUP(ROUND(RC[-1],-2),C[13]:C[14],2,TRUE) -> 72 | L212: =ROUND(R5C12+(R215C12-R5C12)/R214C7^3*R[-1]C[-5]^3,0) -> 26935770 | M212: =ROUND(RC[-1]-R[-1]C[-1],-3) -> 620000 | N212: 0 | O212: =RC[-2]+RC[-1] -> 620000 | P212: =SUM(R5C15:RC[-1]) -> 38218140 | Q212: =ROUND(RC[-4]/VLOOKUP(RC[-13],C20:C22,2,FALSE),3) -> 0.01 | R212: =VLOOKUP(ROUND(RC[-2],-2),C23:C24,2,TRUE) -> 72 | S212: =RC[-9]-RC[-1] -> 0
B213: 1 | C213: 0,1,7,40000 | D213: 100 | F213: 3 | G213: =R[-1]C+RC[-1] -> 394 | H213: =MID(RC[-5],7,20)*1 -> 40000 | I213: =SUM(R5C8:RC[-1]) -> 37579970 | J213: =VLOOKUP(ROUND(RC[-1],-2),C[13]:C[14],2,TRUE) -> 72 | L213: =ROUND(R5C12+(R215C12-R5C12)/R214C7^3*R[-1]C[-5]^3,0) -> 27565411 | M213: =ROUND(RC[-1]-R[-1]C[-1],-3) -> 630000 | N213: 0 | O213: =RC[-2]+RC[-1] -> 630000 | P213: =SUM(R5C15:RC[-1]) -> 38848140 | Q213: =ROUND(RC[-4]/VLOOKUP(RC[-13],C20:C22,2,FALSE),3) -> 0.01 | R213: =VLOOKUP(ROUND(RC[-2],-2),C23:C24,2,TRUE) -> 72 | S213: =RC[-9]-RC[-1] -> 0
B214: 1 | C214: 0,1,7,3600000 | D214: 100 | F214: 3 | G214: =R[-1]C+RC[-1] -> 397 | H214: =MID(RC[-5],7,20)*1 -> 3600000 | I214: =SUM(R5C8:RC[-1]) -> 41179970 | J214: =VLOOKUP(ROUND(RC[-1],-2),C[13]:C[14],2,TRUE) -> 73 | L214: =ROUND(R5C12+(R215C12-R5C12)/R214C7^3*R[-1]C[-5]^3,0) -> 28204790 | M214: =ROUND(RC[-1]-R[-1]C[-1],-3) -> 639000 | N214: 0 | O214: =RC[-2]+RC[-1] -> 639000 | P214: =SUM(R5C15:RC[-1]) -> 39487140 | Q214: =ROUND(RC[-4]/VLOOKUP(RC[-13],C20:C22,2,FALSE),3) -> 0.01 | R214: =VLOOKUP(ROUND(RC[-2],-2),C23:C24,2,TRUE) -> 72 | S214: =RC[-9]-RC[-1] -> 1
B215: 1 | C215: 0,1,7,40000 | D215: 100 | F215: 3 | G215: =R[-1]C+RC[-1] -> 400 | H215: =MID(RC[-5],7,20)*1 -> 40000 | I215: =SUM(R5C8:RC[-1]) -> 41219970 | J215: =VLOOKUP(ROUND(RC[-1],-2),C[13]:C[14],2,TRUE) -> 73 | L215: =ROUND(RC[-3]*0.7,0) -> 28853979 | M215: =ROUND(RC[-1]-R[-1]C[-1],-3) -> 649000 | N215: 0 | O215: =RC[-2]+RC[-1] -> 649000 | P215: =SUM(R5C15:RC[-1]) -> 40136140 | Q215: =ROUND(RC[-4]/VLOOKUP(RC[-13],C20:C22,2,FALSE),3) -> 0.011 | R215: =VLOOKUP(ROUND(RC[-2],-2),C23:C24,2,TRUE) -> 72 | S215: =RC[-9]-RC[-1] -> 1
B216: 2 | C216: 0,1,7,500 | D216: 25 | F216: 1 | G216: 1 | H216: =MID(RC[-5],7,20)*1 -> 500 | I216: =SUM(R216C8:RC[-1]) -> 500 | J216: =VLOOKUP(ROUND(RC[-1],-2),C[13]:C[14],2,TRUE) -> 4 | L216: 500 | M216: =RC[-1] -> 500 | N216: 0 | O216: =RC[-2]+RC[-1] -> 500 | P216: =SUM(R216C15:RC[-1]) -> 500 | Q216: =ROUND(RC[-4]/VLOOKUP(RC[-13],C20:C22,2,FALSE),3) -> 0.044 | R216: =VLOOKUP(ROUND(RC[-2],-2),C23:C24,2,TRUE) -> 4 | S216: =RC[-9]-RC[-1] -> 0
B217: 2 | C217: 0,1,7,500 | D217: 25 | F217: 1 | G217: =R[-1]C+RC[-1] -> 2 | H217: =MID(RC[-5],7,20)*1 -> 500 | I217: =SUM(R216C8:RC[-1]) -> 1000 | J217: =VLOOKUP(ROUND(RC[-1],-2),C[13]:C[14],2,TRUE) -> 6 | L217: =ROUND(R216C12+(R381C12-R216C12)/R380C7^2*R[-1]C[-5]^2,0) -> 746 | M217: =ROUND(RC[-1]-R[-1]C[-1],-2) -> 200 | N217: 0 | O217: =RC[-2]+RC[-1] -> 200 | P217: =SUM(R216C15:RC[-1]) -> 700 | Q217: =ROUND(RC[-4]/VLOOKUP(RC[-13],C20:C22,2,FALSE),3) -> 0.017 | R217: =VLOOKUP(ROUND(RC[-2],-2),C23:C24,2,TRUE) -> 5 | S217: =RC[-9]-RC[-1] -> 1
B218: 2 | C218: 0,1,7,3000 | D218: 25 | F218: 1 | G218: =R[-1]C+RC[-1] -> 3 | H218: =MID(RC[-5],7,20)*1 -> 3000 | I218: =SUM(R216C8:RC[-1]) -> 4000 | J218: =VLOOKUP(ROUND(RC[-1],-2),C[13]:C[14],2,TRUE) -> 11 | L218: =ROUND(R216C12+(R381C12-R216C12)/R380C7^2*R[-1]C[-5]^2,0) -> 1485 | M218: =ROUND(RC[-1]-R[-1]C[-1],-3) -> 1000 | N218: 0 | O218: =RC[-2]+RC[-1] -> 1000 | P218: =SUM(R216C15:RC[-1]) -> 1700 | Q218: =ROUND(RC[-4]/VLOOKUP(RC[-13],C20:C22,2,FALSE),3) -> 0.087 | R218: =VLOOKUP(ROUND(RC[-2],-2),C23:C24,2,TRUE) -> 7 | S218: =RC[-9]-RC[-1] -> 4
B219: 2 | C219: 0,1,7,500 | D219: 25 | F219: 1 | G219: =R[-1]C+RC[-1] -> 4 | H219: =MID(RC[-5],7,20)*1 -> 500 | I219: =SUM(R216C8:RC[-1]) -> 4500 | J219: =VLOOKUP(ROUND(RC[-1],-2),C[13]:C[14],2,TRUE) -> 12 | L219: =ROUND(R216C12+(R381C12-R216C12)/R380C7^2*R[-1]C[-5]^2,0) -> 2716 | M219: =ROUND(RC[-1]-R[-1]C[-1],-3) -> 1000 | N219: 0 | O219: =RC[-2]+RC[-1] -> 1000 | P219: =SUM(R216C15:RC[-1]) -> 2700 | Q219: =ROUND(RC[-4]/VLOOKUP(RC[-13],C20:C22,2,FALSE),3) -> 0.087 | R219: =VLOOKUP(ROUND(RC[-2],-2),C23:C24,2,TRUE) -> 9 | S219: =RC[-9]-RC[-1] -> 3
B220: 2 | C220: 0,1,7,500 | D220: 25 | F220: 1 | G220: =R[-1]C+RC[-1] -> 5 | H220: =MID(RC[-5],7,20)*1 -> 500 | I220: =SUM(R216C8:RC[-1]) -> 5000 | J220: =VLOOKUP(ROUND(RC[-1],-2),C[13]:C[14],2,TRUE) -> 12 | L220: =ROUND(R216C12+(R381C12-R216C12)/R380C7^2*R[-1]C[-5]^2,0) -> 4440 | M220: =ROUND(RC[-1]-R[-1]C[-1],-3) -> 2000 | N220: =ROUND(SUM(R[-4]C[-1]:RC[-1])/0.7*0.1,-3) -> 1000 | O220: =RC[-2]+RC[-1] -> 3000 | P220: =SUM(R216C15:RC[-1]) -> 5700 | Q220: =ROUND(RC[-4]/VLOOKUP(RC[-13],C20:C22,2,FALSE),3) -> 0.174 | R220: =VLOOKUP(ROUND(RC[-2],-2),C23:C24,2,TRUE) -> 13 | S220: =RC[-9]-RC[-1] -> -1
B221: 2 | C221: 0,1,7,4000 | D221: 25 | F221: 1 | G221: =R[-1]C+RC[-1] -> 6 | H221: =MID(RC[-5],7,20)*1 -> 4000 | I221: =SUM(R216C8:RC[-1]) -> 9000 | J221: =VLOOKUP(ROUND(RC[-1],-2),C[13]:C[14],2,TRUE) -> 15 | L221: =ROUND(R216C12+(R381C12-R216C12)/R380C7^2*R[-1]C[-5]^2,0) -> 6656 | M221: =ROUND(RC[-1]-R[-1]C[-1],-3) -> 2000 | N221: 0 | O221: =RC[-2]+RC[-1] -> 2000 | P221: =SUM(R216C15:RC[-1]) -> 7700 | Q221: =ROUND(RC[-4]/VLOOKUP(RC[-13],C20:C22,2,FALSE),3) -> 0.174 | R221: =VLOOKUP(ROUND(RC[-2],-2),C23:C24,2,TRUE) -> 14 | S221: =RC[-9]-RC[-1] -> 1
B222: 2 | C222: 0,1,7,500 | D222: 25 | F222: 1 | G222: =R[-1]C+RC[-1] -> 7 | H222: =MID(RC[-5],7,20)*1 -> 500 | I222: =SUM(R216C8:RC[-1]) -> 9500 | J222: =VLOOKUP(ROUND(RC[-1],-2),C[13]:C[14],2,TRUE) -> 15 | L222: =ROUND(R216C12+(R381C12-R216C12)/R380C7^2*R[-1]C[-5]^2,0) -> 9365 | M222: =ROUND(RC[-1]-R[-1]C[-1],-3) -> 3000 | N222: 0 | O222: =RC[-2]+RC[-1] -> 3000 | P222: =SUM(R216C15:RC[-1]) -> 10700 | Q222: =ROUND(RC[-4]/VLOOKUP(RC[-13],C20:C22,2,FALSE),3) -> 0.261 | R222: =VLOOKUP(ROUND(RC[-2],-2),C23:C24,2,TRUE) -> 16 | S222: =RC[-9]-RC[-1] -> -1
B223: 2 | C223: 0,1,7,500 | D223: 25 | F223: 1 | G223: =R[-1]C+RC[-1] -> 8 | H223: =MID(RC[-5],7,20)*1 -> 500 | I223: =SUM(R216C8:RC[-1]) -> 10000 | J223: =VLOOKUP(ROUND(RC[-1],-2),C[13]:C[14],2,TRUE) -> 15 | L223: =ROUND(R216C12+(R381C12-R216C12)/R380C7^2*R[-1]C[-5]^2,0) -> 12566 | M223: =ROUND(RC[-1]-R[-1]C[-1],-3) -> 3000 | N223: 0 | O223: =RC[-2]+RC[-1] -> 3000 | P223: =SUM(R216C15:RC[-1]) -> 13700 | Q223: =ROUND(RC[-4]/VLOOKUP(RC[-13],C20:C22,2,FALSE),3) -> 0.261 | R223: =VLOOKUP(ROUND(RC[-2],-2),C23:C24,2,TRUE) -> 17 | S223: =RC[-9]-RC[-1] -> -2
B224: 2 | C224: 0,1,7,5500 | D224: 25 | F224: 1 | G224: =R[-1]C+RC[-1] -> 9 | H224: =MID(RC[-5],7,20)*1 -> 5500 | I224: =SUM(R216C8:RC[-1]) -> 15500 | J224: =VLOOKUP(ROUND(RC[-1],-2),C[13]:C[14],2,TRUE) -> 17 | L224: =ROUND(R216C12+(R381C12-R216C12)/R380C7^2*R[-1]C[-5]^2,0) -> 16259 | M224: =ROUND(RC[-1]-R[-1]C[-1],-3) -> 4000 | N224: 0 | O224: =RC[-2]+RC[-1] -> 4000 | P224: =SUM(R216C15:RC[-1]) -> 17700 | Q224: =ROUND(RC[-4]/VLOOKUP(RC[-13],C20:C22,2,FALSE),3) -> 0.349 | R224: =VLOOKUP(ROUND(RC[-2],-2),C23:C24,2,TRUE) -> 18 | S224: =RC[-9]-RC[-1] -> -1
B225: 2 | C225: 0,1,7,500 | D225: 25 | F225: 1 | G225: =R[-1]C+RC[-1] -> 10 | H225: =MID(RC[-5],7,20)*1 -> 500 | I225: =SUM(R216C8:RC[-1]) -> 16000 | J225: =VLOOKUP(ROUND(RC[-1],-2),C[13]:C[14],2,TRUE) -> 17 | L225: =ROUND(R216C12+(R381C12-R216C12)/R380C7^2*R[-1]C[-5]^2,0) -> 20445 | M225: =ROUND(RC[-1]-R[-1]C[-1],-3) -> 4000 | N225: =ROUND(SUM(R[-4]C[-1]:RC[-1])/0.7*0.1,-3) -> 2000 | O225: =RC[-2]+RC[-1] -> 6000 | P225: =SUM(R216C15:RC[-1]) -> 23700 | Q225: =ROUND(RC[-4]/VLOOKUP(RC[-13],C20:C22,2,FALSE),3) -> 0.349 | R225: =VLOOKUP(ROUND(RC[-2],-2),C23:C24,2,TRUE) -> 19 | S225: =RC[-9]-RC[-1] -> -2
B226: 2 | C226: 0,1,7,500 | D226: 25 | F226: 1 | G226: =R[-1]C+RC[-1] -> 11 | H226: =MID(RC[-5],7,20)*1 -> 500 | I226: =SUM(R216C8:RC[-1]) -> 16500 | J226: =VLOOKUP(ROUND(RC[-1],-2),C[13]:C[14],2,TRUE) -> 18 | L226: =ROUND(R216C12+(R381C12-R216C12)/R380C7^2*R[-1]C[-5]^2,0) -> 25124 | M226: =ROUND(RC[-1]-R[-1]C[-1],-3) -> 5000 | N226: 0 | O226: =RC[-2]+RC[-1] -> 5000 | P226: =SUM(R216C15:RC[-1]) -> 28700 | Q226: =ROUND(RC[-4]/VLOOKUP(RC[-13],C20:C22,2,FALSE),3) -> 0.436 | R226: =VLOOKUP(ROUND(RC[-2],-2),C23:C24,2,TRUE) -> 20 | S226: =RC[-9]-RC[-1] -> -2
B227: 2 | C227: 0,1,7,500 | D227: 25 | F227: 1 | G227: =R[-1]C+RC[-1] -> 12 | H227: =MID(RC[-5],7,20)*1 -> 500 | I227: =SUM(R216C8:RC[-1]) -> 17000 | J227: =VLOOKUP(ROUND(RC[-1],-2),C[13]:C[14],2,TRUE) -> 18 | L227: =ROUND(R216C12+(R381C12-R216C12)/R380C7^2*R[-1]C[-5]^2,0) -> 30295 | M227: =ROUND(RC[-1]-R[-1]C[-1],-3) -> 5000 | N227: 0 | O227: =RC[-2]+RC[-1] -> 5000 | P227: =SUM(R216C15:RC[-1]) -> 33700 | Q227: =ROUND(RC[-4]/VLOOKUP(RC[-13],C20:C22,2,FALSE),3) -> 0.436 | R227: =VLOOKUP(ROUND(RC[-2],-2),C23:C24,2,TRUE) -> 21 | S227: =RC[-9]-RC[-1] -> -3
B228: 2 | C228: 0,1,7,500 | D228: 30 | F228: 1 | G228: =R[-1]C+RC[-1] -> 13 | H228: =MID(RC[-5],7,20)*1 -> 500 | I228: =SUM(R216C8:RC[-1]) -> 17500 | J228: =VLOOKUP(ROUND(RC[-1],-2),C[13]:C[14],2,TRUE) -> 18 | L228: =ROUND(R216C12+(R381C12-R216C12)/R380C7^2*R[-1]C[-5]^2,0) -> 35958 | M228: =ROUND(RC[-1]-R[-1]C[-1],-3) -> 6000 | N228: 0 | O228: =RC[-2]+RC[-1] -> 6000 | P228: =SUM(R216C15:RC[-1]) -> 39700 | Q228: =ROUND(RC[-4]/VLOOKUP(RC[-13],C20:C22,2,FALSE),3) -> 0.279 | R228: =VLOOKUP(ROUND(RC[-2],-2),C23:C24,2,TRUE) -> 22 | S228: =RC[-9]-RC[-1] -> -4
B229: 2 | C229: 0,1,7,500 | D229: 30 | F229: 1 | G229: =R[-1]C+RC[-1] -> 14 | H229: =MID(RC[-5],7,20)*1 -> 500 | I229: =SUM(R216C8:RC[-1]) -> 18000 | J229: =VLOOKUP(ROUND(RC[-1],-2),C[13]:C[14],2,TRUE) -> 18 | L229: =ROUND(R216C12+(R381C12-R216C12)/R380C7^2*R[-1]C[-5]^2,0) -> 42114 | M229: =ROUND(RC[-1]-R[-1]C[-1],-3) -> 6000 | N229: 0 | O229: =RC[-2]+RC[-1] -> 6000 | P229: =SUM(R216C15:RC[-1]) -> 45700 | Q229: =ROUND(RC[-4]/VLOOKUP(RC[-13],C20:C22,2,FALSE),3) -> 0.279 | R229: =VLOOKUP(ROUND(RC[-2],-2),C23:C24,2,TRUE) -> 23 | S229: =RC[-9]-RC[-1] -> -5
B230: 2 | C230: 0,1,7,9500 | D230: 30 | F230: 1 | G230: =R[-1]C+RC[-1] -> 15 | H230: =MID(RC[-5],7,20)*1 -> 9500 | I230: =SUM(R216C8:RC[-1]) -> 27500 | J230: =VLOOKUP(ROUND(RC[-1],-2),C[13]:C[14],2,TRUE) -> 20 | L230: =ROUND(R216C12+(R381C12-R216C12)/R380C7^2*R[-1]C[-5]^2,0) -> 48763 | M230: =ROUND(RC[-1]-R[-1]C[-1],-3) -> 7000 | N230: =ROUND(SUM(R[-4]C[-1]:RC[-1])/0.7*0.1,-3) -> 4000 | O230: =RC[-2]+RC[-1] -> 11000 | P230: =SUM(R216C15:RC[-1]) -> 56700 | Q230: =ROUND(RC[-4]/VLOOKUP(RC[-13],C20:C22,2,FALSE),3) -> 0.325 | R230: =VLOOKUP(ROUND(RC[-2],-2),C23:C24,2,TRUE) -> 24 | S230: =RC[-9]-RC[-1] -> -4
B231: 2 | C231: 0,1,7,500 | D231: 30 | F231: 1 | G231: =R[-1]C+RC[-1] -> 16 | H231: =MID(RC[-5],7,20)*1 -> 500 | I231: =SUM(R216C8:RC[-1]) -> 28000 | J231: =VLOOKUP(ROUND(RC[-1],-2),C[13]:C[14],2,TRUE) -> 20 | L231: =ROUND(R216C12+(R381C12-R216C12)/R380C7^2*R[-1]C[-5]^2,0) -> 55904 | M231: =ROUND(RC[-1]-R[-1]C[-1],-3) -> 7000 | N231: 0 | O231: =RC[-2]+RC[-1] -> 7000 | P231: =SUM(R216C15:RC[-1]) -> 63700 | Q231: =ROUND(RC[-4]/VLOOKUP(RC[-13],C20:C22,2,FALSE),3) -> 0.325 | R231: =VLOOKUP(ROUND(RC[-2],-2),C23:C24,2,TRUE) -> 25 | S231: =RC[-9]-RC[-1] -> -5
B232: 2 | C232: 0,1,7,500 | D232: 30 | F232: 1 | G232: =R[-1]C+RC[-1] -> 17 | H232: =MID(RC[-5],7,20)*1 -> 500 | I232: =SUM(R216C8:RC[-1]) -> 28500 | J232: =VLOOKUP(ROUND(RC[-1],-2),C[13]:C[14],2,TRUE) -> 20 | L232: =ROUND(R216C12+(R381C12-R216C12)/R380C7^2*R[-1]C[-5]^2,0) -> 63537 | M232: =ROUND(RC[-1]-R[-1]C[-1],-3) -> 8000 | N232: 0 | O232: =RC[-2]+RC[-1] -> 8000 | P232: =SUM(R216C15:RC[-1]) -> 71700 | Q232: =ROUND(RC[-4]/VLOOKUP(RC[-13],C20:C22,2,FALSE),3) -> 0.372 | R232: =VLOOKUP(ROUND(RC[-2],-2),C23:C24,2,TRUE) -> 25 | S232: =RC[-9]-RC[-1] -> -5
B233: 2 | C233: 0,1,7,500 | D233: 30 | F233: 1 | G233: =R[-1]C+RC[-1] -> 18 | H233: =MID(RC[-5],7,20)*1 -> 500 | I233: =SUM(R216C8:RC[-1]) -> 29000 | J233: =VLOOKUP(ROUND(RC[-1],-2),C[13]:C[14],2,TRUE) -> 20 | L233: =ROUND(R216C12+(R381C12-R216C12)/R380C7^2*R[-1]C[-5]^2,0) -> 71663 | M233: =ROUND(RC[-1]-R[-1]C[-1],-3) -> 8000 | N233: 0 | O233: =RC[-2]+RC[-1] -> 8000 | P233: =SUM(R216C15:RC[-1]) -> 79700 | Q233: =ROUND(RC[-4]/VLOOKUP(RC[-13],C20:C22,2,FALSE),3) -> 0.372 | R233: =VLOOKUP(ROUND(RC[-2],-2),C23:C24,2,TRUE) -> 26 | S233: =RC[-9]-RC[-1] -> -6
B234: 2 | C234: 0,1,7,500 | D234: 30 | F234: 1 | G234: =R[-1]C+RC[-1] -> 19 | H234: =MID(RC[-5],7,20)*1 -> 500 | I234: =SUM(R216C8:RC[-1]) -> 29500 | J234: =VLOOKUP(ROUND(RC[-1],-2),C[13]:C[14],2,TRUE) -> 20 | L234: =ROUND(R216C12+(R381C12-R216C12)/R380C7^2*R[-1]C[-5]^2,0) -> 80281 | M234: =ROUND(RC[-1]-R[-1]C[-1],-3) -> 9000 | N234: 0 | O234: =RC[-2]+RC[-1] -> 9000 | P234: =SUM(R216C15:RC[-1]) -> 88700 | Q234: =ROUND(RC[-4]/VLOOKUP(RC[-13],C20:C22,2,FALSE),3) -> 0.418 | R234: =VLOOKUP(ROUND(RC[-2],-2),C23:C24,2,TRUE) -> 27 | S234: =RC[-9]-RC[-1] -> -7
B235: 2 | C235: 0,1,7,10000 | D235: 30 | F235: 1 | G235: =R[-1]C+RC[-1] -> 20 | H235: =MID(RC[-5],7,20)*1 -> 10000 | I235: =SUM(R216C8:RC[-1]) -> 39500 | J235: =VLOOKUP(ROUND(RC[-1],-2),C[13]:C[14],2,TRUE) -> 22 | L235: =ROUND(R216C12+(R381C12-R216C12)/R380C7^2*R[-1]C[-5]^2,0) -> 89392 | M235: =ROUND(RC[-1]-R[-1]C[-1],-3) -> 9000 | N235: =ROUND(SUM(R[-4]C[-1]:RC[-1])/0.7*0.1,-3) -> 6000 | O235: =RC[-2]+RC[-1] -> 15000 | P235: =SUM(R216C15:RC[-1]) -> 103700 | Q235: =ROUND(RC[-4]/VLOOKUP(RC[-13],C20:C22,2,FALSE),3) -> 0.418 | R235: =VLOOKUP(ROUND(RC[-2],-2),C23:C24,2,TRUE) -> 28 | S235: =RC[-9]-RC[-1] -> -6
B236: 2 | C236: 0,1,7,500 | D236: 30 | F236: 1 | G236: =R[-1]C+RC[-1] -> 21 | H236: =MID(RC[-5],7,20)*1 -> 500 | I236: =SUM(R216C8:RC[-1]) -> 40000 | J236: =VLOOKUP(ROUND(RC[-1],-2),C[13]:C[14],2,TRUE) -> 22 | L236: =ROUND(R216C12+(R381C12-R216C12)/R380C7^2*R[-1]C[-5]^2,0) -> 98996 | M236: =ROUND(RC[-1]-R[-1]C[-1],-3) -> 10000 | N236: 0 | O236: =RC[-2]+RC[-1] -> 10000 | P236: =SUM(R216C15:RC[-1]) -> 113700 | Q236: =ROUND(RC[-4]/VLOOKUP(RC[-13],C20:C22,2,FALSE),3) -> 0.465 | R236: =VLOOKUP(ROUND(RC[-2],-2),C23:C24,2,TRUE) -> 28 | S236: =RC[-9]-RC[-1] -> -6
B237: 2 | C237: 0,1,7,730 | D237: 35 | F237: 1 | G237: =R[-1]C+RC[-1] -> 22 | H237: =MID(RC[-5],7,20)*1 -> 730 | I237: =SUM(R216C8:RC[-1]) -> 40730 | J237: =VLOOKUP(ROUND(RC[-1],-2),C[13]:C[14],2,TRUE) -> 22 | L237: =ROUND(R216C12+(R381C12-R216C12)/R380C7^2*R[-1]C[-5]^2,0) -> 109091 | M237: =ROUND(RC[-1]-R[-1]C[-1],-3) -> 10000 | N237: 0 | O237: =RC[-2]+RC[-1] -> 10000 | P237: =SUM(R216C15:RC[-1]) -> 123700 | Q237: =ROUND(RC[-4]/VLOOKUP(RC[-13],C20:C22,2,FALSE),3) -> 0.275 | R237: =VLOOKUP(ROUND(RC[-2],-2),C23:C24,2,TRUE) -> 29 | S237: =RC[-9]-RC[-1] -> -7
B238: 2 | C238: 0,1,7,730 | D238: 35 | F238: 1 | G238: =R[-1]C+RC[-1] -> 23 | H238: =MID(RC[-5],7,20)*1 -> 730 | I238: =SUM(R216C8:RC[-1]) -> 41460 | J238: =VLOOKUP(ROUND(RC[-1],-2),C[13]:C[14],2,TRUE) -> 22 | L238: =ROUND(R216C12+(R381C12-R216C12)/R380C7^2*R[-1]C[-5]^2,0) -> 119680 | M238: =ROUND(RC[-1]-R[-1]C[-1],-3) -> 11000 | N238: 0 | O238: =RC[-2]+RC[-1] -> 11000 | P238: =SUM(R216C15:RC[-1]) -> 134700 | Q238: =ROUND(RC[-4]/VLOOKUP(RC[-13],C20:C22,2,FALSE),3) -> 0.302 | R238: =VLOOKUP(ROUND(RC[-2],-2),C23:C24,2,TRUE) -> 29 | S238: =RC[-9]-RC[-1] -> -7
B239: 2 | C239: 0,1,7,10000 | D239: 35 | F239: 1 | G239: =R[-1]C+RC[-1] -> 24 | H239: =MID(RC[-5],7,20)*1 -> 10000 | I239: =SUM(R216C8:RC[-1]) -> 51460 | J239: =VLOOKUP(ROUND(RC[-1],-2),C[13]:C[14],2,TRUE) -> 23 | L239: =ROUND(R216C12+(R381C12-R216C12)/R380C7^2*R[-1]C[-5]^2,0) -> 130760 | M239: =ROUND(RC[-1]-R[-1]C[-1],-3) -> 11000 | N239: 0 | O239: =RC[-2]+RC[-1] -> 11000 | P239: =SUM(R216C15:RC[-1]) -> 145700 | Q239: =ROUND(RC[-4]/VLOOKUP(RC[-13],C20:C22,2,FALSE),3) -> 0.302 | R239: =VLOOKUP(ROUND(RC[-2],-2),C23:C24,2,TRUE) -> 30 | S239: =RC[-9]-RC[-1] -> -7
B240: 2 | C240: 0,1,7,730 | D240: 35 | F240: 1 | G240: =R[-1]C+RC[-1] -> 25 | H240: =MID(RC[-5],7,20)*1 -> 730 | I240: =SUM(R216C8:RC[-1]) -> 52190 | J240: =VLOOKUP(ROUND(RC[-1],-2),C[13]:C[14],2,TRUE) -> 24 | L240: =ROUND(R216C12+(R381C12-R216C12)/R380C7^2*R[-1]C[-5]^2,0) -> 142334 | M240: =ROUND(RC[-1]-R[-1]C[-1],-3) -> 12000 | N240: =ROUND(SUM(R[-4]C[-1]:RC[-1])/0.7*0.3,-3) -> 23000 | O240: =RC[-2]+RC[-1] -> 35000 | P240: =SUM(R216C15:RC[-1]) -> 180700 | Q240: =ROUND(RC[-4]/VLOOKUP(RC[-13],C20:C22,2,FALSE),3) -> 0.33 | R240: =VLOOKUP(ROUND(RC[-2],-2),C23:C24,2,TRUE) -> 31 | S240: =RC[-9]-RC[-1] -> -7
B241: 2 | C241: 0,1,7,730 | D241: 35 | F241: 1 | G241: =R[-1]C+RC[-1] -> 26 | H241: =MID(RC[-5],7,20)*1 -> 730 | I241: =SUM(R216C8:RC[-1]) -> 52920 | J241: =VLOOKUP(ROUND(RC[-1],-2),C[13]:C[14],2,TRUE) -> 24 | L241: =ROUND(R216C12+(R381C12-R216C12)/R380C7^2*R[-1]C[-5]^2,0) -> 154399 | M241: =ROUND(RC[-1]-R[-1]C[-1],-3) -> 12000 | N241: 0 | O241: =RC[-2]+RC[-1] -> 12000 | P241: =SUM(R216C15:RC[-1]) -> 192700 | Q241: =ROUND(RC[-4]/VLOOKUP(RC[-13],C20:C22,2,FALSE),3) -> 0.33 | R241: =VLOOKUP(ROUND(RC[-2],-2),C23:C24,2,TRUE) -> 32 | S241: =RC[-9]-RC[-1] -> -8
B242: 2 | C242: 0,1,7,10000 | D242: 35 | F242: 1 | G242: =R[-1]C+RC[-1] -> 27 | H242: =MID(RC[-5],7,20)*1 -> 10000 | I242: =SUM(R216C8:RC[-1]) -> 62920 | J242: =VLOOKUP(ROUND(RC[-1],-2),C[13]:C[14],2,TRUE) -> 25 | L242: =ROUND(R216C12+(R381C12-R216C12)/R380C7^2*R[-1]C[-5]^2,0) -> 166958 | M242: =ROUND(RC[-1]-R[-1]C[-1],-3) -> 13000 | N242: 0 | O242: =RC[-2]+RC[-1] -> 13000 | P242: =SUM(R216C15:RC[-1]) -> 205700 | Q242: =ROUND(RC[-4]/VLOOKUP(RC[-13],C20:C22,2,FALSE),3) -> 0.357 | R242: =VLOOKUP(ROUND(RC[-2],-2),C23:C24,2,TRUE) -> 32 | S242: =RC[-9]-RC[-1] -> -7
B243: 2 | C243: 0,1,7,730 | D243: 35 | F243: 1 | G243: =R[-1]C+RC[-1] -> 28 | H243: =MID(RC[-5],7,20)*1 -> 730 | I243: =SUM(R216C8:RC[-1]) -> 63650 | J243: =VLOOKUP(ROUND(RC[-1],-2),C[13]:C[14],2,TRUE) -> 25 | L243: =ROUND(R216C12+(R381C12-R216C12)/R380C7^2*R[-1]C[-5]^2,0) -> 180008 | M243: =ROUND(RC[-1]-R[-1]C[-1],-3) -> 13000 | N243: 0 | O243: =RC[-2]+RC[-1] -> 13000 | P243: =SUM(R216C15:RC[-1]) -> 218700 | Q243: =ROUND(RC[-4]/VLOOKUP(RC[-13],C20:C22,2,FALSE),3) -> 0.357 | R243: =VLOOKUP(ROUND(RC[-2],-2),C23:C24,2,TRUE) -> 33 | S243: =RC[-9]-RC[-1] -> -8
B244: 2 | C244: 0,1,7,730 | D244: 35 | F244: 1 | G244: =R[-1]C+RC[-1] -> 29 | H244: =MID(RC[-5],7,20)*1 -> 730 | I244: =SUM(R216C8:RC[-1]) -> 64380 | J244: =VLOOKUP(ROUND(RC[-1],-2),C[13]:C[14],2,TRUE) -> 25 | L244: =ROUND(R216C12+(R381C12-R216C12)/R380C7^2*R[-1]C[-5]^2,0) -> 193551 | M244: =ROUND(RC[-1]-R[-1]C[-1],-3) -> 14000 | N244: 0 | O244: =RC[-2]+RC[-1] -> 14000 | P244: =SUM(R216C15:RC[-1]) -> 232700 | Q244: =ROUND(RC[-4]/VLOOKUP(RC[-13],C20:C22,2,FALSE),3) -> 0.385 | R244: =VLOOKUP(ROUND(RC[-2],-2),C23:C24,2,TRUE) -> 33 | S244: =RC[-9]-RC[-1] -> -8
B245: 2 | C245: 0,1,7,1200 | D245: 40 | F245: 1 | G245: =R[-1]C+RC[-1] -> 30 | H245: =MID(RC[-5],7,20)*1 -> 1200 | I245: =SUM(R216C8:RC[-1]) -> 65580 | J245: =VLOOKUP(ROUND(RC[-1],-2),C[13]:C[14],2,TRUE) -> 25 | L245: =ROUND(R216C12+(R381C12-R216C12)/R380C7^2*R[-1]C[-5]^2,0) -> 207587 | M245: =ROUND(RC[-1]-R[-1]C[-1],-3) -> 14000 | N245: =ROUND(SUM(R[-4]C[-1]:RC[-1])/0.7*0.3,-3) -> 28000 | O245: =RC[-2]+RC[-1] -> 42000 | P245: =SUM(R216C15:RC[-1]) -> 274700 | Q245: =ROUND(RC[-4]/VLOOKUP(RC[-13],C20:C22,2,FALSE),3) -> 0.111 | R245: =VLOOKUP(ROUND(RC[-2],-2),C23:C24,2,TRUE) -> 35 | S245: =RC[-9]-RC[-1] -> -10
B246: 2 | C246: 0,1,7,1200 | D246: 40 | F246: 1 | G246: =R[-1]C+RC[-1] -> 31 | H246: =MID(RC[-5],7,20)*1 -> 1200 | I246: =SUM(R216C8:RC[-1]) -> 66780 | J246: =VLOOKUP(ROUND(RC[-1],-2),C[13]:C[14],2,TRUE) -> 25 | L246: =ROUND(R216C12+(R381C12-R216C12)/R380C7^2*R[-1]C[-5]^2,0) -> 222115 | M246: =ROUND(RC[-1]-R[-1]C[-1],-3) -> 15000 | N246: 0 | O246: =RC[-2]+RC[-1] -> 15000 | P246: =SUM(R216C15:RC[-1]) -> 289700 | Q246: =ROUND(RC[-4]/VLOOKUP(RC[-13],C20:C22,2,FALSE),3) -> 0.119 | R246: =VLOOKUP(ROUND(RC[-2],-2),C23:C24,2,TRUE) -> 35 | S246: =RC[-9]-RC[-1] -> -10
B247: 2 | C247: 0,1,7,1200 | D247: 40 | F247: 1 | G247: =R[-1]C+RC[-1] -> 32 | H247: =MID(RC[-5],7,20)*1 -> 1200 | I247: =SUM(R216C8:RC[-1]) -> 67980 | J247: =VLOOKUP(ROUND(RC[-1],-2),C[13]:C[14],2,TRUE) -> 25 | L247: =ROUND(R216C12+(R381C12-R216C12)/R380C7^2*R[-1]C[-5]^2,0) -> 237136 | M247: =ROUND(RC[-1]-R[-1]C[-1],-3) -> 15000 | N247: 0 | O247: =RC[-2]+RC[-1] -> 15000 | P247: =SUM(R216C15:RC[-1]) -> 304700 | Q247: =ROUND(RC[-4]/VLOOKUP(RC[-13],C20:C22,2,FALSE),3) -> 0.119 | R247: =VLOOKUP(ROUND(RC[-2],-2),C23:C24,2,TRUE) -> 35 | S247: =RC[-9]-RC[-1] -> -10
B248: 2 | C248: 0,1,7,1200 | D248: 40 | F248: 1 | G248: =R[-1]C+RC[-1] -> 33 | H248: =MID(RC[-5],7,20)*1 -> 1200 | I248: =SUM(R216C8:RC[-1]) -> 69180 | J248: =VLOOKUP(ROUND(RC[-1],-2),C[13]:C[14],2,TRUE) -> 25 | L248: =ROUND(R216C12+(R381C12-R216C12)/R380C7^2*R[-1]C[-5]^2,0) -> 252649 | M248: =ROUND(RC[-1]-R[-1]C[-1],-3) -> 16000 | N248: 0 | O248: =RC[-2]+RC[-1] -> 16000 | P248: =SUM(R216C15:RC[-1]) -> 320700 | Q248: =ROUND(RC[-4]/VLOOKUP(RC[-13],C20:C22,2,FALSE),3) -> 0.127 | R248: =VLOOKUP(ROUND(RC[-2],-2),C23:C24,2,TRUE) -> 36 | S248: =RC[-9]-RC[-1] -> -11
B249: 2 | C249: 0,1,7,36500 | D249: 40 | F249: 1 | G249: =R[-1]C+RC[-1] -> 34 | H249: =MID(RC[-5],7,20)*1 -> 36500 | I249: =SUM(R216C8:RC[-1]) -> 105680 | J249: =VLOOKUP(ROUND(RC[-1],-2),C[13]:C[14],2,TRUE) -> 28 | L249: =ROUND(R216C12+(R381C12-R216C12)/R380C7^2*R[-1]C[-5]^2,0) -> 268654 | M249: =ROUND(RC[-1]-R[-1]C[-1],-3) -> 16000 | N249: 0 | O249: =RC[-2]+RC[-1] -> 16000 | P249: =SUM(R216C15:RC[-1]) -> 336700 | Q249: =ROUND(RC[-4]/VLOOKUP(RC[-13],C20:C22,2,FALSE),3) -> 0.127 | R249: =VLOOKUP(ROUND(RC[-2],-2),C23:C24,2,TRUE) -> 36 | S249: =RC[-9]-RC[-1] -> -8
B250: 2 | C250: 0,1,7,1200 | D250: 40 | F250: 1 | G250: =R[-1]C+RC[-1] -> 35 | H250: =MID(RC[-5],7,20)*1 -> 1200 | I250: =SUM(R216C8:RC[-1]) -> 106880 | J250: =VLOOKUP(ROUND(RC[-1],-2),C[13]:C[14],2,TRUE) -> 28 | L250: =ROUND(R216C12+(R381C12-R216C12)/R380C7^2*R[-1]C[-5]^2,0) -> 285152 | M250: =ROUND(RC[-1]-R[-1]C[-1],-3) -> 16000 | N250: =ROUND(SUM(R[-4]C[-1]:RC[-1])/0.7*0.3,-3) -> 33000 | O250: =RC[-2]+RC[-1] -> 49000 | P250: =SUM(R216C15:RC[-1]) -> 385700 | Q250: =ROUND(RC[-4]/VLOOKUP(RC[-13],C20:C22,2,FALSE),3) -> 0.127 | R250: =VLOOKUP(ROUND(RC[-2],-2),C23:C24,2,TRUE) -> 37 | S250: =RC[-9]-RC[-1] -> -9
B251: 2 | C251: 0,1,7,1200 | D251: 40 | F251: 1 | G251: =R[-1]C+RC[-1] -> 36 | H251: =MID(RC[-5],7,20)*1 -> 1200 | I251: =SUM(R216C8:RC[-1]) -> 108080 | J251: =VLOOKUP(ROUND(RC[-1],-2),C[13]:C[14],2,TRUE) -> 28 | L251: =ROUND(R216C12+(R381C12-R216C12)/R380C7^2*R[-1]C[-5]^2,0) -> 302143 | M251: =ROUND(RC[-1]-R[-1]C[-1],-3) -> 17000 | N251: 0 | O251: =RC[-2]+RC[-1] -> 17000 | P251: =SUM(R216C15:RC[-1]) -> 402700 | Q251: =ROUND(RC[-4]/VLOOKUP(RC[-13],C20:C22,2,FALSE),3) -> 0.135 | R251: =VLOOKUP(ROUND(RC[-2],-2),C23:C24,2,TRUE) -> 38 | S251: =RC[-9]-RC[-1] -> -10
B252: 2 | C252: 0,1,7,1200 | D252: 40 | F252: 1 | G252: =R[-1]C+RC[-1] -> 37 | H252: =MID(RC[-5],7,20)*1 -> 1200 | I252: =SUM(R216C8:RC[-1]) -> 109280 | J252: =VLOOKUP(ROUND(RC[-1],-2),C[13]:C[14],2,TRUE) -> 28 | L252: =ROUND(R216C12+(R381C12-R216C12)/R380C7^2*R[-1]C[-5]^2,0) -> 319626 | M252: =ROUND(RC[-1]-R[-1]C[-1],-3) -> 17000 | N252: 0 | O252: =RC[-2]+RC[-1] -> 17000 | P252: =SUM(R216C15:RC[-1]) -> 419700 | Q252: =ROUND(RC[-4]/VLOOKUP(RC[-13],C20:C22,2,FALSE),3) -> 0.135 | R252: =VLOOKUP(ROUND(RC[-2],-2),C23:C24,2,TRUE) -> 38 | S252: =RC[-9]-RC[-1] -> -10
B253: 2 | C253: 0,1,7,4000 | D253: 45 | F253: 1 | G253: =R[-1]C+RC[-1] -> 38 | H253: =MID(RC[-5],7,20)*1 -> 4000 | I253: =SUM(R216C8:RC[-1]) -> 113280 | J253: =VLOOKUP(ROUND(RC[-1],-2),C[13]:C[14],2,TRUE) -> 28 | L253: =ROUND(R216C12+(R381C12-R216C12)/R380C7^2*R[-1]C[-5]^2,0) -> 337601 | M253: =ROUND(RC[-1]-R[-1]C[-1],-3) -> 18000 | N253: 0 | O253: =RC[-2]+RC[-1] -> 18000 | P253: =SUM(R216C15:RC[-1]) -> 437700 | Q253: =ROUND(RC[-4]/VLOOKUP(RC[-13],C20:C22,2,FALSE),3) -> 0.066 | R253: =VLOOKUP(ROUND(RC[-2],-2),C23:C24,2,TRUE) -> 38 | S253: =RC[-9]-RC[-1] -> -10
B254: 2 | C254: 0,1,7,4000 | D254: 45 | F254: 1 | G254: =R[-1]C+RC[-1] -> 39 | H254: =MID(RC[-5],7,20)*1 -> 4000 | I254: =SUM(R216C8:RC[-1]) -> 117280 | J254: =VLOOKUP(ROUND(RC[-1],-2),C[13]:C[14],2,TRUE) -> 28 | L254: =ROUND(R216C12+(R381C12-R216C12)/R380C7^2*R[-1]C[-5]^2,0) -> 356069 | M254: =ROUND(RC[-1]-R[-1]C[-1],-3) -> 18000 | N254: 0 | O254: =RC[-2]+RC[-1] -> 18000 | P254: =SUM(R216C15:RC[-1]) -> 455700 | Q254: =ROUND(RC[-4]/VLOOKUP(RC[-13],C20:C22,2,FALSE),3) -> 0.066 | R254: =VLOOKUP(ROUND(RC[-2],-2),C23:C24,2,TRUE) -> 39 | S254: =RC[-9]-RC[-1] -> -11
B255: 2 | C255: 0,1,7,114000 | D255: 45 | F255: 1 | G255: =R[-1]C+RC[-1] -> 40 | H255: =MID(RC[-5],7,20)*1 -> 114000 | I255: =SUM(R216C8:RC[-1]) -> 231280 | J255: =VLOOKUP(ROUND(RC[-1],-2),C[13]:C[14],2,TRUE) -> 33 | L255: =ROUND(R216C12+(R381C12-R216C12)/R380C7^2*R[-1]C[-5]^2,0) -> 375030 | M255: =ROUND(RC[-1]-R[-1]C[-1],-3) -> 19000 | N255: =ROUND(SUM(R[-4]C[-1]:RC[-1])/0.7*0.3,-3) -> 38000 | O255: =RC[-2]+RC[-1] -> 57000 | P255: =SUM(R216C15:RC[-1]) -> 512700 | Q255: =ROUND(RC[-4]/VLOOKUP(RC[-13],C20:C22,2,FALSE),3) -> 0.07 | R255: =VLOOKUP(ROUND(RC[-2],-2),C23:C24,2,TRUE) -> 40 | S255: =RC[-9]-RC[-1] -> -7
B256: 2 | C256: 0,1,7,4000 | D256: 45 | F256: 1 | G256: =R[-1]C+RC[-1] -> 41 | H256: =MID(RC[-5],7,20)*1 -> 4000 | I256: =SUM(R216C8:RC[-1]) -> 235280 | J256: =VLOOKUP(ROUND(RC[-1],-2),C[13]:C[14],2,TRUE) -> 33 | L256: =ROUND(R216C12+(R381C12-R216C12)/R380C7^2*R[-1]C[-5]^2,0) -> 394482 | M256: =ROUND(RC[-1]-R[-1]C[-1],-3) -> 19000 | N256: 0 | O256: =RC[-2]+RC[-1] -> 19000 | P256: =SUM(R216C15:RC[-1]) -> 531700 | Q256: =ROUND(RC[-4]/VLOOKUP(RC[-13],C20:C22,2,FALSE),3) -> 0.07 | R256: =VLOOKUP(ROUND(RC[-2],-2),C23:C24,2,TRUE) -> 40 | S256: =RC[-9]-RC[-1] -> -7
B257: 2 | C257: 0,1,7,4000 | D257: 45 | F257: 1 | G257: =R[-1]C+RC[-1] -> 42 | H257: =MID(RC[-5],7,20)*1 -> 4000 | I257: =SUM(R216C8:RC[-1]) -> 239280 | J257: =VLOOKUP(ROUND(RC[-1],-2),C[13]:C[14],2,TRUE) -> 33 | L257: =ROUND(R216C12+(R381C12-R216C12)/R380C7^2*R[-1]C[-5]^2,0) -> 414428 | M257: =ROUND(RC[-1]-R[-1]C[-1],-3) -> 20000 | N257: 0 | O257: =RC[-2]+RC[-1] -> 20000 | P257: =SUM(R216C15:RC[-1]) -> 551700 | Q257: =ROUND(RC[-4]/VLOOKUP(RC[-13],C20:C22,2,FALSE),3) -> 0.074 | R257: =VLOOKUP(ROUND(RC[-2],-2),C23:C24,2,TRUE) -> 40 | S257: =RC[-9]-RC[-1] -> -7
B258: 2 | C258: 0,1,7,114000 | D258: 45 | F258: 1 | G258: =R[-1]C+RC[-1] -> 43 | H258: =MID(RC[-5],7,20)*1 -> 114000 | I258: =SUM(R216C8:RC[-1]) -> 353280 | J258: =VLOOKUP(ROUND(RC[-1],-2),C[13]:C[14],2,TRUE) -> 37 | L258: =ROUND(R216C12+(R381C12-R216C12)/R380C7^2*R[-1]C[-5]^2,0) -> 434866 | M258: =ROUND(RC[-1]-R[-1]C[-1],-3) -> 20000 | N258: 0 | O258: =RC[-2]+RC[-1] -> 20000 | P258: =SUM(R216C15:RC[-1]) -> 571700 | Q258: =ROUND(RC[-4]/VLOOKUP(RC[-13],C20:C22,2,FALSE),3) -> 0.074 | R258: =VLOOKUP(ROUND(RC[-2],-2),C23:C24,2,TRUE) -> 40 | S258: =RC[-9]-RC[-1] -> -3
B259: 2 | C259: 0,1,7,4000 | D259: 45 | F259: 1 | G259: =R[-1]C+RC[-1] -> 44 | H259: =MID(RC[-5],7,20)*1 -> 4000 | I259: =SUM(R216C8:RC[-1]) -> 357280 | J259: =VLOOKUP(ROUND(RC[-1],-2),C[13]:C[14],2,TRUE) -> 37 | L259: =ROUND(R216C12+(R381C12-R216C12)/R380C7^2*R[-1]C[-5]^2,0) -> 455796 | M259: =ROUND(RC[-1]-R[-1]C[-1],-3) -> 21000 | N259: 0 | O259: =RC[-2]+RC[-1] -> 21000 | P259: =SUM(R216C15:RC[-1]) -> 592700 | Q259: =ROUND(RC[-4]/VLOOKUP(RC[-13],C20:C22,2,FALSE),3) -> 0.078 | R259: =VLOOKUP(ROUND(RC[-2],-2),C23:C24,2,TRUE) -> 40 | S259: =RC[-9]-RC[-1] -> -3
B260: 2 | C260: 0,1,7,4000 | D260: 45 | F260: 1 | G260: =R[-1]C+RC[-1] -> 45 | H260: =MID(RC[-5],7,20)*1 -> 4000 | I260: =SUM(R216C8:RC[-1]) -> 361280 | J260: =VLOOKUP(ROUND(RC[-1],-2),C[13]:C[14],2,TRUE) -> 37 | L260: =ROUND(R216C12+(R381C12-R216C12)/R380C7^2*R[-1]C[-5]^2,0) -> 477219 | M260: =ROUND(RC[-1]-R[-1]C[-1],-3) -> 21000 | N260: =ROUND(SUM(R[-4]C[-1]:RC[-1])/0.7*0.3,-3) -> 43000 | O260: =RC[-2]+RC[-1] -> 64000 | P260: =SUM(R216C15:RC[-1]) -> 656700 | Q260: =ROUND(RC[-4]/VLOOKUP(RC[-13],C20:C22,2,FALSE),3) -> 0.078 | R260: =VLOOKUP(ROUND(RC[-2],-2),C23:C24,2,TRUE) -> 41 | S260: =RC[-9]-RC[-1] -> -4
B261: 2 | C261: 0,1,7,4000 | D261: 50 | F261: 1 | G261: =R[-1]C+RC[-1] -> 46 | H261: =MID(RC[-5],7,20)*1 -> 4000 | I261: =SUM(R216C8:RC[-1]) -> 365280 | J261: =VLOOKUP(ROUND(RC[-1],-2),C[13]:C[14],2,TRUE) -> 37 | L261: =ROUND(R216C12+(R381C12-R216C12)/R380C7^2*R[-1]C[-5]^2,0) -> 499134 | M261: =ROUND(RC[-1]-R[-1]C[-1],-3) -> 22000 | N261: 0 | O261: =RC[-2]+RC[-1] -> 22000 | P261: =SUM(R216C15:RC[-1]) -> 678700 | Q261: =ROUND(RC[-4]/VLOOKUP(RC[-13],C20:C22,2,FALSE),3) -> 0.044 | R261: =VLOOKUP(ROUND(RC[-2],-2),C23:C24,2,TRUE) -> 41 | S261: =RC[-9]-RC[-1] -> -4
B262: 2 | C262: 0,1,7,150000 | D262: 50 | F262: 1 | G262: =R[-1]C+RC[-1] -> 47 | H262: =MID(RC[-5],7,20)*1 -> 150000 | I262: =SUM(R216C8:RC[-1]) -> 515280 | J262: =VLOOKUP(ROUND(RC[-1],-2),C[13]:C[14],2,TRUE) -> 40 | L262: =ROUND(R216C12+(R381C12-R216C12)/R380C7^2*R[-1]C[-5]^2,0) -> 521542 | M262: =ROUND(RC[-1]-R[-1]C[-1],-3) -> 22000 | N262: 0 | O262: =RC[-2]+RC[-1] -> 22000 | P262: =SUM(R216C15:RC[-1]) -> 700700 | Q262: =ROUND(RC[-4]/VLOOKUP(RC[-13],C20:C22,2,FALSE),3) -> 0.044 | R262: =VLOOKUP(ROUND(RC[-2],-2),C23:C24,2,TRUE) -> 41 | S262: =RC[-9]-RC[-1] -> -1
B263: 2 | C263: 0,1,7,4000 | D263: 50 | F263: 1 | G263: =R[-1]C+RC[-1] -> 48 | H263: =MID(RC[-5],7,20)*1 -> 4000 | I263: =SUM(R216C8:RC[-1]) -> 519280 | J263: =VLOOKUP(ROUND(RC[-1],-2),C[13]:C[14],2,TRUE) -> 40 | L263: =ROUND(R216C12+(R381C12-R216C12)/R380C7^2*R[-1]C[-5]^2,0) -> 544442 | M263: =ROUND(RC[-1]-R[-1]C[-1],-3) -> 23000 | N263: 0 | O263: =RC[-2]+RC[-1] -> 23000 | P263: =SUM(R216C15:RC[-1]) -> 723700 | Q263: =ROUND(RC[-4]/VLOOKUP(RC[-13],C20:C22,2,FALSE),3) -> 0.046 | R263: =VLOOKUP(ROUND(RC[-2],-2),C23:C24,2,TRUE) -> 41 | S263: =RC[-9]-RC[-1] -> -1
B264: 2 | C264: 0,1,7,4000 | D264: 50 | F264: 1 | G264: =R[-1]C+RC[-1] -> 49 | H264: =MID(RC[-5],7,20)*1 -> 4000 | I264: =SUM(R216C8:RC[-1]) -> 523280 | J264: =VLOOKUP(ROUND(RC[-1],-2),C[13]:C[14],2,TRUE) -> 40 | L264: =ROUND(R216C12+(R381C12-R216C12)/R380C7^2*R[-1]C[-5]^2,0) -> 567835 | M264: =ROUND(RC[-1]-R[-1]C[-1],-3) -> 23000 | N264: 0 | O264: =RC[-2]+RC[-1] -> 23000 | P264: =SUM(R216C15:RC[-1]) -> 746700 | Q264: =ROUND(RC[-4]/VLOOKUP(RC[-13],C20:C22,2,FALSE),3) -> 0.046 | R264: =VLOOKUP(ROUND(RC[-2],-2),C23:C24,2,TRUE) -> 41 | S264: =RC[-9]-RC[-1] -> -1
B265: 2 | C265: 0,1,7,4000 | D265: 50 | F265: 1 | G265: =R[-1]C+RC[-1] -> 50 | H265: =MID(RC[-5],7,20)*1 -> 4000 | I265: =SUM(R216C8:RC[-1]) -> 527280 | J265: =VLOOKUP(ROUND(RC[-1],-2),C[13]:C[14],2,TRUE) -> 40 | L265: =ROUND(R216C12+(R381C12-R216C12)/R380C7^2*R[-1]C[-5]^2,0) -> 591720 | M265: =ROUND(RC[-1]-R[-1]C[-1],-3) -> 24000 | N265: =ROUND(SUM(R[-4]C[-1]:RC[-1])/0.7*0.3,-3) -> 49000 | O265: =RC[-2]+RC[-1] -> 73000 | P265: =SUM(R216C15:RC[-1]) -> 819700 | Q265: =ROUND(RC[-4]/VLOOKUP(RC[-13],C20:C22,2,FALSE),3) -> 0.048 | R265: =VLOOKUP(ROUND(RC[-2],-2),C23:C24,2,TRUE) -> 42 | S265: =RC[-9]-RC[-1] -> -2
B266: 2 | C266: 0,1,7,4000 | D266: 50 | F266: 1 | G266: =R[-1]C+RC[-1] -> 51 | H266: =MID(RC[-5],7,20)*1 -> 4000 | I266: =SUM(R216C8:RC[-1]) -> 531280 | J266: =VLOOKUP(ROUND(RC[-1],-2),C[13]:C[14],2,TRUE) -> 40 | L266: =ROUND(R216C12+(R381C12-R216C12)/R380C7^2*R[-1]C[-5]^2,0) -> 616098 | M266: =ROUND(RC[-1]-R[-1]C[-1],-3) -> 24000 | N266: 0 | O266: =RC[-2]+RC[-1] -> 24000 | P266: =SUM(R216C15:RC[-1]) -> 843700 | Q266: =ROUND(RC[-4]/VLOOKUP(RC[-13],C20:C22,2,FALSE),3) -> 0.048 | R266: =VLOOKUP(ROUND(RC[-2],-2),C23:C24,2,TRUE) -> 42 | S266: =RC[-9]-RC[-1] -> -2
B267: 2 | C267: 0,1,7,4000 | D267: 50 | F267: 1 | G267: =R[-1]C+RC[-1] -> 52 | H267: =MID(RC[-5],7,20)*1 -> 4000 | I267: =SUM(R216C8:RC[-1]) -> 535280 | J267: =VLOOKUP(ROUND(RC[-1],-2),C[13]:C[14],2,TRUE) -> 40 | L267: =ROUND(R216C12+(R381C12-R216C12)/R380C7^2*R[-1]C[-5]^2,0) -> 640968 | M267: =ROUND(RC[-1]-R[-1]C[-1],-3) -> 25000 | N267: 0 | O267: =RC[-2]+RC[-1] -> 25000 | P267: =SUM(R216C15:RC[-1]) -> 868700 | Q267: =ROUND(RC[-4]/VLOOKUP(RC[-13],C20:C22,2,FALSE),3) -> 0.05 | R267: =VLOOKUP(ROUND(RC[-2],-2),C23:C24,2,TRUE) -> 42 | S267: =RC[-9]-RC[-1] -> -2
B268: 2 | C268: 0,1,7,4000 | D268: 50 | F268: 1 | G268: =R[-1]C+RC[-1] -> 53 | H268: =MID(RC[-5],7,20)*1 -> 4000 | I268: =SUM(R216C8:RC[-1]) -> 539280 | J268: =VLOOKUP(ROUND(RC[-1],-2),C[13]:C[14],2,TRUE) -> 40 | L268: =ROUND(R216C12+(R381C12-R216C12)/R380C7^2*R[-1]C[-5]^2,0) -> 666330 | M268: =ROUND(RC[-1]-R[-1]C[-1],-3) -> 25000 | N268: 0 | O268: =RC[-2]+RC[-1] -> 25000 | P268: =SUM(R216C15:RC[-1]) -> 893700 | Q268: =ROUND(RC[-4]/VLOOKUP(RC[-13],C20:C22,2,FALSE),3) -> 0.05 | R268: =VLOOKUP(ROUND(RC[-2],-2),C23:C24,2,TRUE) -> 42 | S268: =RC[-9]-RC[-1] -> -2
B269: 2 | C269: 0,1,7,4000 | D269: 50 | F269: 1 | G269: =R[-1]C+RC[-1] -> 54 | H269: =MID(RC[-5],7,20)*1 -> 4000 | I269: =SUM(R216C8:RC[-1]) -> 543280 | J269: =VLOOKUP(ROUND(RC[-1],-2),C[13]:C[14],2,TRUE) -> 40 | L269: =ROUND(R216C12+(R381C12-R216C12)/R380C7^2*R[-1]C[-5]^2,0) -> 692185 | M269: =ROUND(RC[-1]-R[-1]C[-1],-3) -> 26000 | N269: 0 | O269: =RC[-2]+RC[-1] -> 26000 | P269: =SUM(R216C15:RC[-1]) -> 919700 | Q269: =ROUND(RC[-4]/VLOOKUP(RC[-13],C20:C22,2,FALSE),3) -> 0.052 | R269: =VLOOKUP(ROUND(RC[-2],-2),C23:C24,2,TRUE) -> 42 | S269: =RC[-9]-RC[-1] -> -2
B270: 2 | C270: 0,1,7,4000 | D270: 50 | F270: 1 | G270: =R[-1]C+RC[-1] -> 55 | H270: =MID(RC[-5],7,20)*1 -> 4000 | I270: =SUM(R216C8:RC[-1]) -> 547280 | J270: =VLOOKUP(ROUND(RC[-1],-2),C[13]:C[14],2,TRUE) -> 40 | L270: =ROUND(R216C12+(R381C12-R216C12)/R380C7^2*R[-1]C[-5]^2,0) -> 718533 | M270: =ROUND(RC[-1]-R[-1]C[-1],-3) -> 26000 | N270: =ROUND(SUM(R[-4]C[-1]:RC[-1])/0.7*0.3,-3) -> 54000 | O270: =RC[-2]+RC[-1] -> 80000 | P270: =SUM(R216C15:RC[-1]) -> 999700 | Q270: =ROUND(RC[-4]/VLOOKUP(RC[-13],C20:C22,2,FALSE),3) -> 0.052 | R270: =VLOOKUP(ROUND(RC[-2],-2),C23:C24,2,TRUE) -> 43 | S270: =RC[-9]-RC[-1] -> -3
B271: 2 | C271: 0,1,7,4000 | D271: 50 | F271: 1 | G271: =R[-1]C+RC[-1] -> 56 | H271: =MID(RC[-5],7,20)*1 -> 4000 | I271: =SUM(R216C8:RC[-1]) -> 551280 | J271: =VLOOKUP(ROUND(RC[-1],-2),C[13]:C[14],2,TRUE) -> 40 | L271: =ROUND(R216C12+(R381C12-R216C12)/R380C7^2*R[-1]C[-5]^2,0) -> 745373 | M271: =ROUND(RC[-1]-R[-1]C[-1],-3) -> 27000 | N271: 0 | O271: =RC[-2]+RC[-1] -> 27000 | P271: =SUM(R216C15:RC[-1]) -> 1026700 | Q271: =ROUND(RC[-4]/VLOOKUP(RC[-13],C20:C22,2,FALSE),3) -> 0.054 | R271: =VLOOKUP(ROUND(RC[-2],-2),C23:C24,2,TRUE) -> 43 | S271: =RC[-9]-RC[-1] -> -3
B272: 2 | C272: 0,1,7,4500 | D272: 55 | F272: 1 | G272: =R[-1]C+RC[-1] -> 57 | H272: =MID(RC[-5],7,20)*1 -> 4500 | I272: =SUM(R216C8:RC[-1]) -> 555780 | J272: =VLOOKUP(ROUND(RC[-1],-2),C[13]:C[14],2,TRUE) -> 40 | L272: =ROUND(R216C12+(R381C12-R216C12)/R380C7^2*R[-1]C[-5]^2,0) -> 772706 | M272: =ROUND(RC[-1]-R[-1]C[-1],-3) -> 27000 | N272: 0 | O272: =RC[-2]+RC[-1] -> 27000 | P272: =SUM(R216C15:RC[-1]) -> 1053700 | Q272: =ROUND(RC[-4]/VLOOKUP(RC[-13],C20:C22,2,FALSE),3) -> 0.032 | R272: =VLOOKUP(ROUND(RC[-2],-2),C23:C24,2,TRUE) -> 43 | S272: =RC[-9]-RC[-1] -> -3
B273: 2 | C273: 0,1,7,4500 | D273: 55 | F273: 1 | G273: =R[-1]C+RC[-1] -> 58 | H273: =MID(RC[-5],7,20)*1 -> 4500 | I273: =SUM(R216C8:RC[-1]) -> 560280 | J273: =VLOOKUP(ROUND(RC[-1],-2),C[13]:C[14],2,TRUE) -> 40 | L273: =ROUND(R216C12+(R381C12-R216C12)/R380C7^2*R[-1]C[-5]^2,0) -> 800531 | M273: =ROUND(RC[-1]-R[-1]C[-1],-3) -> 28000 | N273: 0 | O273: =RC[-2]+RC[-1] -> 28000 | P273: =SUM(R216C15:RC[-1]) -> 1081700 | Q273: =ROUND(RC[-4]/VLOOKUP(RC[-13],C20:C22,2,FALSE),3) -> 0.033 | R273: =VLOOKUP(ROUND(RC[-2],-2),C23:C24,2,TRUE) -> 43 | S273: =RC[-9]-RC[-1] -> -3
B274: 2 | C274: 0,1,7,4500 | D274: 55 | F274: 1 | G274: =R[-1]C+RC[-1] -> 59 | H274: =MID(RC[-5],7,20)*1 -> 4500 | I274: =SUM(R216C8:RC[-1]) -> 564780 | J274: =VLOOKUP(ROUND(RC[-1],-2),C[13]:C[14],2,TRUE) -> 40 | L274: =ROUND(R216C12+(R381C12-R216C12)/R380C7^2*R[-1]C[-5]^2,0) -> 828848 | M274: =ROUND(RC[-1]-R[-1]C[-1],-3) -> 28000 | N274: 0 | O274: =RC[-2]+RC[-1] -> 28000 | P274: =SUM(R216C15:RC[-1]) -> 1109700 | Q274: =ROUND(RC[-4]/VLOOKUP(RC[-13],C20:C22,2,FALSE),3) -> 0.033 | R274: =VLOOKUP(ROUND(RC[-2],-2),C23:C24,2,TRUE) -> 43 | S274: =RC[-9]-RC[-1] -> -3
B275: 2 | C275: 0,1,7,4500 | D275: 55 | F275: 1 | G275: =R[-1]C+RC[-1] -> 60 | H275: =MID(RC[-5],7,20)*1 -> 4500 | I275: =SUM(R216C8:RC[-1]) -> 569280 | J275: =VLOOKUP(ROUND(RC[-1],-2),C[13]:C[14],2,TRUE) -> 40 | L275: =ROUND(R216C12+(R381C12-R216C12)/R380C7^2*R[-1]C[-5]^2,0) -> 857658 | M275: =ROUND(RC[-1]-R[-1]C[-1],-3) -> 29000 | N275: =ROUND(SUM(R[-4]C[-1]:RC[-1])/0.7*0.3,-3) -> 60000 | O275: =RC[-2]+RC[-1] -> 89000 | P275: =SUM(R216C15:RC[-1]) -> 1198700 | Q275: =ROUND(RC[-4]/VLOOKUP(RC[-13],C20:C22,2,FALSE),3) -> 0.034 | R275: =VLOOKUP(ROUND(RC[-2],-2),C23:C24,2,TRUE) -> 44 | S275: =RC[-9]-RC[-1] -> -4
B276: 2 | C276: 0,1,7,4500 | D276: 55 | F276: 1 | G276: =R[-1]C+RC[-1] -> 61 | H276: =MID(RC[-5],7,20)*1 -> 4500 | I276: =SUM(R216C8:RC[-1]) -> 573780 | J276: =VLOOKUP(ROUND(RC[-1],-2),C[13]:C[14],2,TRUE) -> 40 | L276: =ROUND(R216C12+(R381C12-R216C12)/R380C7^2*R[-1]C[-5]^2,0) -> 886961 | M276: =ROUND(RC[-1]-R[-1]C[-1],-3) -> 29000 | N276: 0 | O276: =RC[-2]+RC[-1] -> 29000 | P276: =SUM(R216C15:RC[-1]) -> 1227700 | Q276: =ROUND(RC[-4]/VLOOKUP(RC[-13],C20:C22,2,FALSE),3) -> 0.034 | R276: =VLOOKUP(ROUND(RC[-2],-2),C23:C24,2,TRUE) -> 44 | S276: =RC[-9]-RC[-1] -> -4
B277: 2 | C277: 0,1,7,4500 | D277: 55 | F277: 1 | G277: =R[-1]C+RC[-1] -> 62 | H277: =MID(RC[-5],7,20)*1 -> 4500 | I277: =SUM(R216C8:RC[-1]) -> 578280 | J277: =VLOOKUP(ROUND(RC[-1],-2),C[13]:C[14],2,TRUE) -> 40 | L277: =ROUND(R216C12+(R381C12-R216C12)/R380C7^2*R[-1]C[-5]^2,0) -> 916755 | M277: =ROUND(RC[-1]-R[-1]C[-1],-3) -> 30000 | N277: 0 | O277: =RC[-2]+RC[-1] -> 30000 | P277: =SUM(R216C15:RC[-1]) -> 1257700 | Q277: =ROUND(RC[-4]/VLOOKUP(RC[-13],C20:C22,2,FALSE),3) -> 0.035 | R277: =VLOOKUP(ROUND(RC[-2],-2),C23:C24,2,TRUE) -> 44 | S277: =RC[-9]-RC[-1] -> -4
B278: 2 | C278: 0,1,7,4500 | D278: 55 | F278: 1 | G278: =R[-1]C+RC[-1] -> 63 | H278: =MID(RC[-5],7,20)*1 -> 4500 | I278: =SUM(R216C8:RC[-1]) -> 582780 | J278: =VLOOKUP(ROUND(RC[-1],-2),C[13]:C[14],2,TRUE) -> 40 | L278: =ROUND(R216C12+(R381C12-R216C12)/R380C7^2*R[-1]C[-5]^2,0) -> 947043 | M278: =ROUND(RC[-1]-R[-1]C[-1],-3) -> 30000 | N278: 0 | O278: =RC[-2]+RC[-1] -> 30000 | P278: =SUM(R216C15:RC[-1]) -> 1287700 | Q278: =ROUND(RC[-4]/VLOOKUP(RC[-13],C20:C22,2,FALSE),3) -> 0.035 | R278: =VLOOKUP(ROUND(RC[-2],-2),C23:C24,2,TRUE) -> 44 | S278: =RC[-9]-RC[-1] -> -4
B279: 2 | C279: 0,1,7,187500 | D279: 55 | F279: 1 | G279: =R[-1]C+RC[-1] -> 64 | H279: =MID(RC[-5],7,20)*1 -> 187500 | I279: =SUM(R216C8:RC[-1]) -> 770280 | J279: =VLOOKUP(ROUND(RC[-1],-2),C[13]:C[14],2,TRUE) -> 42 | L279: =ROUND(R216C12+(R381C12-R216C12)/R380C7^2*R[-1]C[-5]^2,0) -> 977823 | M279: =ROUND(RC[-1]-R[-1]C[-1],-3) -> 31000 | N279: 0 | O279: =RC[-2]+RC[-1] -> 31000 | P279: =SUM(R216C15:RC[-1]) -> 1318700 | Q279: =ROUND(RC[-4]/VLOOKUP(RC[-13],C20:C22,2,FALSE),3) -> 0.036 | R279: =VLOOKUP(ROUND(RC[-2],-2),C23:C24,2,TRUE) -> 44 | S279: =RC[-9]-RC[-1] -> -2
B280: 2 | C280: 0,1,7,4500 | D280: 55 | F280: 1 | G280: =R[-1]C+RC[-1] -> 65 | H280: =MID(RC[-5],7,20)*1 -> 4500 | I280: =SUM(R216C8:RC[-1]) -> 774780 | J280: =VLOOKUP(ROUND(RC[-1],-2),C[13]:C[14],2,TRUE) -> 42 | L280: =ROUND(R216C12+(R381C12-R216C12)/R380C7^2*R[-1]C[-5]^2,0) -> 1009095 | M280: =ROUND(RC[-1]-R[-1]C[-1],-3) -> 31000 | N280: =ROUND(SUM(R[-4]C[-1]:RC[-1])/0.7*0.3,-3) -> 65000 | O280: =RC[-2]+RC[-1] -> 96000 | P280: =SUM(R216C15:RC[-1]) -> 1414700 | Q280: =ROUND(RC[-4]/VLOOKUP(RC[-13],C20:C22,2,FALSE),3) -> 0.036 | R280: =VLOOKUP(ROUND(RC[-2],-2),C23:C24,2,TRUE) -> 45 | S280: =RC[-9]-RC[-1] -> -3
B281: 2 | C281: 0,1,7,4500 | D281: 55 | F281: 1 | G281: =R[-1]C+RC[-1] -> 66 | H281: =MID(RC[-5],7,20)*1 -> 4500 | I281: =SUM(R216C8:RC[-1]) -> 779280 | J281: =VLOOKUP(ROUND(RC[-1],-2),C[13]:C[14],2,TRUE) -> 42 | L281: =ROUND(R216C12+(R381C12-R216C12)/R380C7^2*R[-1]C[-5]^2,0) -> 1040860 | M281: =ROUND(RC[-1]-R[-1]C[-1],-3) -> 32000 | N281: 0 | O281: =RC[-2]+RC[-1] -> 32000 | P281: =SUM(R216C15:RC[-1]) -> 1446700 | Q281: =ROUND(RC[-4]/VLOOKUP(RC[-13],C20:C22,2,FALSE),3) -> 0.038 | R281: =VLOOKUP(ROUND(RC[-2],-2),C23:C24,2,TRUE) -> 45 | S281: =RC[-9]-RC[-1] -> -3
B282: 2 | C282: 0,1,7,200000 | D282: 55 | F282: 1 | G282: =R[-1]C+RC[-1] -> 67 | H282: =MID(RC[-5],7,20)*1 -> 200000 | I282: =SUM(R216C8:RC[-1]) -> 979280 | J282: =VLOOKUP(ROUND(RC[-1],-2),C[13]:C[14],2,TRUE) -> 43 | L282: =ROUND(R216C12+(R381C12-R216C12)/R380C7^2*R[-1]C[-5]^2,0) -> 1073117 | M282: =ROUND(RC[-1]-R[-1]C[-1],-3) -> 32000 | N282: 0 | O282: =RC[-2]+RC[-1] -> 32000 | P282: =SUM(R216C15:RC[-1]) -> 1478700 | Q282: =ROUND(RC[-4]/VLOOKUP(RC[-13],C20:C22,2,FALSE),3) -> 0.038 | R282: =VLOOKUP(ROUND(RC[-2],-2),C23:C24,2,TRUE) -> 45 | S282: =RC[-9]-RC[-1] -> -2
B283: 2 | C283: 0,1,7,4500 | D283: 55 | F283: 1 | G283: =R[-1]C+RC[-1] -> 68 | H283: =MID(RC[-5],7,20)*1 -> 4500 | I283: =SUM(R216C8:RC[-1]) -> 983780 | J283: =VLOOKUP(ROUND(RC[-1],-2),C[13]:C[14],2,TRUE) -> 43 | L283: =ROUND(R216C12+(R381C12-R216C12)/R380C7^2*R[-1]C[-5]^2,0) -> 1105867 | M283: =ROUND(RC[-1]-R[-1]C[-1],-3) -> 33000 | N283: 0 | O283: =RC[-2]+RC[-1] -> 33000 | P283: =SUM(R216C15:RC[-1]) -> 1511700 | Q283: =ROUND(RC[-4]/VLOOKUP(RC[-13],C20:C22,2,FALSE),3) -> 0.039 | R283: =VLOOKUP(ROUND(RC[-2],-2),C23:C24,2,TRUE) -> 45 | S283: =RC[-9]-RC[-1] -> -2
B284: 2 | C284: 0,1,7,5000 | D284: 60 | F284: 1 | G284: =R[-1]C+RC[-1] -> 69 | H284: =MID(RC[-5],7,20)*1 -> 5000 | I284: =SUM(R216C8:RC[-1]) -> 988780 | J284: =VLOOKUP(ROUND(RC[-1],-2),C[13]:C[14],2,TRUE) -> 43 | L284: =ROUND(R216C12+(R381C12-R216C12)/R380C7^2*R[-1]C[-5]^2,0) -> 1139109 | M284: =ROUND(RC[-1]-R[-1]C[-1],-3) -> 33000 | N284: 0 | O284: =RC[-2]+RC[-1] -> 33000 | P284: =SUM(R216C15:RC[-1]) -> 1544700 | Q284: =ROUND(RC[-4]/VLOOKUP(RC[-13],C20:C22,2,FALSE),3) -> 0.024 | R284: =VLOOKUP(ROUND(RC[-2],-2),C23:C24,2,TRUE) -> 45 | S284: =RC[-9]-RC[-1] -> -2
B285: 2 | C285: 0,1,7,5000 | D285: 60 | F285: 1 | G285: =R[-1]C+RC[-1] -> 70 | H285: =MID(RC[-5],7,20)*1 -> 5000 | I285: =SUM(R216C8:RC[-1]) -> 993780 | J285: =VLOOKUP(ROUND(RC[-1],-2),C[13]:C[14],2,TRUE) -> 43 | L285: =ROUND(R216C12+(R381C12-R216C12)/R380C7^2*R[-1]C[-5]^2,0) -> 1172844 | M285: =ROUND(RC[-1]-R[-1]C[-1],-3) -> 34000 | N285: =ROUND(SUM(R[-4]C[-1]:RC[-1])/0.7*0.3,-3) -> 70000 | O285: =RC[-2]+RC[-1] -> 104000 | P285: =SUM(R216C15:RC[-1]) -> 1648700 | Q285: =ROUND(RC[-4]/VLOOKUP(RC[-13],C20:C22,2,FALSE),3) -> 0.025 | R285: =VLOOKUP(ROUND(RC[-2],-2),C23:C24,2,TRUE) -> 45 | S285: =RC[-9]-RC[-1] -> -2
B286: 2 | C286: 0,1,7,300000 | D286: 60 | F286: 1 | G286: =R[-1]C+RC[-1] -> 71 | H286: =MID(RC[-5],7,20)*1 -> 300000 | I286: =SUM(R216C8:RC[-1]) -> 1293780 | J286: =VLOOKUP(ROUND(RC[-1],-2),C[13]:C[14],2,TRUE) -> 44 | L286: =ROUND(R216C12+(R381C12-R216C12)/R380C7^2*R[-1]C[-5]^2,0) -> 1207071 | M286: =ROUND(RC[-1]-R[-1]C[-1],-3) -> 34000 | N286: 0 | O286: =RC[-2]+RC[-1] -> 34000 | P286: =SUM(R216C15:RC[-1]) -> 1682700 | Q286: =ROUND(RC[-4]/VLOOKUP(RC[-13],C20:C22,2,FALSE),3) -> 0.025 | R286: =VLOOKUP(ROUND(RC[-2],-2),C23:C24,2,TRUE) -> 46 | S286: =RC[-9]-RC[-1] -> -2
B287: 2 | C287: 0,1,7,5000 | D287: 60 | F287: 1 | G287: =R[-1]C+RC[-1] -> 72 | H287: =MID(RC[-5],7,20)*1 -> 5000 | I287: =SUM(R216C8:RC[-1]) -> 1298780 | J287: =VLOOKUP(ROUND(RC[-1],-2),C[13]:C[14],2,TRUE) -> 44 | L287: =ROUND(R216C12+(R381C12-R216C12)/R380C7^2*R[-1]C[-5]^2,0) -> 1241791 | M287: =ROUND(RC[-1]-R[-1]C[-1],-3) -> 35000 | N287: 0 | O287: =RC[-2]+RC[-1] -> 35000 | P287: =SUM(R216C15:RC[-1]) -> 1717700 | Q287: =ROUND(RC[-4]/VLOOKUP(RC[-13],C20:C22,2,FALSE),3) -> 0.026 | R287: =VLOOKUP(ROUND(RC[-2],-2),C23:C24,2,TRUE) -> 46 | S287: =RC[-9]-RC[-1] -> -2
B288: 2 | C288: 0,1,7,5000 | D288: 60 | F288: 1 | G288: =R[-1]C+RC[-1] -> 73 | H288: =MID(RC[-5],7,20)*1 -> 5000 | I288: =SUM(R216C8:RC[-1]) -> 1303780 | J288: =VLOOKUP(ROUND(RC[-1],-2),C[13]:C[14],2,TRUE) -> 44 | L288: =ROUND(R216C12+(R381C12-R216C12)/R380C7^2*R[-1]C[-5]^2,0) -> 1277003 | M288: =ROUND(RC[-1]-R[-1]C[-1],-3) -> 35000 | N288: 0 | O288: =RC[-2]+RC[-1] -> 35000 | P288: =SUM(R216C15:RC[-1]) -> 1752700 | Q288: =ROUND(RC[-4]/VLOOKUP(RC[-13],C20:C22,2,FALSE),3) -> 0.026 | R288: =VLOOKUP(ROUND(RC[-2],-2),C23:C24,2,TRUE) -> 46 | S288: =RC[-9]-RC[-1] -> -2
B289: 2 | C289: 0,1,7,320000 | D289: 60 | F289: 1 | G289: =R[-1]C+RC[-1] -> 74 | H289: =MID(RC[-5],7,20)*1 -> 320000 | I289: =SUM(R216C8:RC[-1]) -> 1623780 | J289: =VLOOKUP(ROUND(RC[-1],-2),C[13]:C[14],2,TRUE) -> 45 | L289: =ROUND(R216C12+(R381C12-R216C12)/R380C7^2*R[-1]C[-5]^2,0) -> 1312708 | M289: =ROUND(RC[-1]-R[-1]C[-1],-3) -> 36000 | N289: 0 | O289: =RC[-2]+RC[-1] -> 36000 | P289: =SUM(R216C15:RC[-1]) -> 1788700 | Q289: =ROUND(RC[-4]/VLOOKUP(RC[-13],C20:C22,2,FALSE),3) -> 0.027 | R289: =VLOOKUP(ROUND(RC[-2],-2),C23:C24,2,TRUE) -> 46 | S289: =RC[-9]-RC[-1] -> -1
B290: 2 | C290: 0,1,7,5000 | D290: 60 | F290: 1 | G290: =R[-1]C+RC[-1] -> 75 | H290: =MID(RC[-5],7,20)*1 -> 5000 | I290: =SUM(R216C8:RC[-1]) -> 1628780 | J290: =VLOOKUP(ROUND(RC[-1],-2),C[13]:C[14],2,TRUE) -> 45 | L290: =ROUND(R216C12+(R381C12-R216C12)/R380C7^2*R[-1]C[-5]^2,0) -> 1348905 | M290: =ROUND(RC[-1]-R[-1]C[-1],-3) -> 36000 | N290: =ROUND(SUM(R[-4]C[-1]:RC[-1])/0.7*0.3,-3) -> 75000 | O290: =RC[-2]+RC[-1] -> 111000 | P290: =SUM(R216C15:RC[-1]) -> 1899700 | Q290: =ROUND(RC[-4]/VLOOKUP(RC[-13],C20:C22,2,FALSE),3) -> 0.027 | R290: =VLOOKUP(ROUND(RC[-2],-2),C23:C24,2,TRUE) -> 46 | S290: =RC[-9]-RC[-1] -> -1
B291: 2 | C291: 0,1,7,320000 | D291: 60 | F291: 1 | G291: =R[-1]C+RC[-1] -> 76 | H291: =MID(RC[-5],7,20)*1 -> 320000 | I291: =SUM(R216C8:RC[-1]) -> 1948780 | J291: =VLOOKUP(ROUND(RC[-1],-2),C[13]:C[14],2,TRUE) -> 46 | L291: =ROUND(R216C12+(R381C12-R216C12)/R380C7^2*R[-1]C[-5]^2,0) -> 1385595 | M291: =ROUND(RC[-1]-R[-1]C[-1],-3) -> 37000 | N291: 0 | O291: =RC[-2]+RC[-1] -> 37000 | P291: =SUM(R216C15:RC[-1]) -> 1936700 | Q291: =ROUND(RC[-4]/VLOOKUP(RC[-13],C20:C22,2,FALSE),3) -> 0.027 | R291: =VLOOKUP(ROUND(RC[-2],-2),C23:C24,2,TRUE) -> 46 | S291: =RC[-9]-RC[-1] -> 0
B292: 2 | C292: 0,1,7,5000 | D292: 60 | F292: 1 | G292: =R[-1]C+RC[-1] -> 77 | H292: =MID(RC[-5],7,20)*1 -> 5000 | I292: =SUM(R216C8:RC[-1]) -> 1953780 | J292: =VLOOKUP(ROUND(RC[-1],-2),C[13]:C[14],2,TRUE) -> 46 | L292: =ROUND(R216C12+(R381C12-R216C12)/R380C7^2*R[-1]C[-5]^2,0) -> 1422777 | M292: =ROUND(RC[-1]-R[-1]C[-1],-3) -> 37000 | N292: 0 | O292: =RC[-2]+RC[-1] -> 37000 | P292: =SUM(R216C15:RC[-1]) -> 1973700 | Q292: =ROUND(RC[-4]/VLOOKUP(RC[-13],C20:C22,2,FALSE),3) -> 0.027 | R292: =VLOOKUP(ROUND(RC[-2],-2),C23:C24,2,TRUE) -> 47 | S292: =RC[-9]-RC[-1] -> -1
B293: 2 | C293: 0,1,7,5000 | D293: 60 | F293: 1 | G293: =R[-1]C+RC[-1] -> 78 | H293: =MID(RC[-5],7,20)*1 -> 5000 | I293: =SUM(R216C8:RC[-1]) -> 1958780 | J293: =VLOOKUP(ROUND(RC[-1],-2),C[13]:C[14],2,TRUE) -> 46 | L293: =ROUND(R216C12+(R381C12-R216C12)/R380C7^2*R[-1]C[-5]^2,0) -> 1460451 | M293: =ROUND(RC[-1]-R[-1]C[-1],-3) -> 38000 | N293: 0 | O293: =RC[-2]+RC[-1] -> 38000 | P293: =SUM(R216C15:RC[-1]) -> 2011700 | Q293: =ROUND(RC[-4]/VLOOKUP(RC[-13],C20:C22,2,FALSE),3) -> 0.028 | R293: =VLOOKUP(ROUND(RC[-2],-2),C23:C24,2,TRUE) -> 47 | S293: =RC[-9]-RC[-1] -> -1
B294: 2 | C294: 0,1,7,5000 | D294: 60 | F294: 1 | G294: =R[-1]C+RC[-1] -> 79 | H294: =MID(RC[-5],7,20)*1 -> 5000 | I294: =SUM(R216C8:RC[-1]) -> 1963780 | J294: =VLOOKUP(ROUND(RC[-1],-2),C[13]:C[14],2,TRUE) -> 47 | L294: =ROUND(R216C12+(R381C12-R216C12)/R380C7^2*R[-1]C[-5]^2,0) -> 1498618 | M294: =ROUND(RC[-1]-R[-1]C[-1],-3) -> 38000 | N294: 0 | O294: =RC[-2]+RC[-1] -> 38000 | P294: =SUM(R216C15:RC[-1]) -> 2049700 | Q294: =ROUND(RC[-4]/VLOOKUP(RC[-13],C20:C22,2,FALSE),3) -> 0.028 | R294: =VLOOKUP(ROUND(RC[-2],-2),C23:C24,2,TRUE) -> 47 | S294: =RC[-9]-RC[-1] -> 0
B295: 2 | C295: 0,1,7,5500 | D295: 65 | F295: 2 | G295: =R[-1]C+RC[-1] -> 81 | H295: =MID(RC[-5],7,20)*1 -> 5500 | I295: =SUM(R216C8:RC[-1]) -> 1969280 | J295: =VLOOKUP(ROUND(RC[-1],-2),C[13]:C[14],2,TRUE) -> 47 | L295: =ROUND(R216C12+(R381C12-R216C12)/R380C7^2*R[-1]C[-5]^2,0) -> 1537278 | M295: =ROUND(RC[-1]-R[-1]C[-1],-3) -> 39000 | N295: =ROUND(SUM(R[-4]C[-1]:RC[-1])/0.7*0.3,-3) -> 81000 | O295: =RC[-2]+RC[-1] -> 120000 | P295: =SUM(R216C15:RC[-1]) -> 2169700 | Q295: =ROUND(RC[-4]/VLOOKUP(RC[-13],C20:C22,2,FALSE),3) -> 0.019 | R295: =VLOOKUP(ROUND(RC[-2],-2),C23:C24,2,TRUE) -> 47 | S295: =RC[-9]-RC[-1] -> 0
B296: 2 | C296: 0,1,7,5500 | D296: 65 | F296: 2 | G296: =R[-1]C+RC[-1] -> 83 | H296: =MID(RC[-5],7,20)*1 -> 5500 | I296: =SUM(R216C8:RC[-1]) -> 1974780 | J296: =VLOOKUP(ROUND(RC[-1],-2),C[13]:C[14],2,TRUE) -> 47 | L296: =ROUND(R216C12+(R381C12-R216C12)/R380C7^2*R[-1]C[-5]^2,0) -> 1616074 | M296: =ROUND(RC[-1]-R[-1]C[-1],-3) -> 79000 | N296: 0 | O296: =RC[-2]+RC[-1] -> 79000 | P296: =SUM(R216C15:RC[-1]) -> 2248700 | Q296: =ROUND(RC[-4]/VLOOKUP(RC[-13],C20:C22,2,FALSE),3) -> 0.039 | R296: =VLOOKUP(ROUND(RC[-2],-2),C23:C24,2,TRUE) -> 47 | S296: =RC[-9]-RC[-1] -> 0
B297: 2 | C297: 0,1,7,5500 | D297: 65 | F297: 2 | G297: =R[-1]C+RC[-1] -> 85 | H297: =MID(RC[-5],7,20)*1 -> 5500 | I297: =SUM(R216C8:RC[-1]) -> 1980280 | J297: =VLOOKUP(ROUND(RC[-1],-2),C[13]:C[14],2,TRUE) -> 47 | L297: =ROUND(R216C12+(R381C12-R216C12)/R380C7^2*R[-1]C[-5]^2,0) -> 1696841 | M297: =ROUND(RC[-1]-R[-1]C[-1],-3) -> 81000 | N297: 0 | O297: =RC[-2]+RC[-1] -> 81000 | P297: =SUM(R216C15:RC[-1]) -> 2329700 | Q297: =ROUND(RC[-4]/VLOOKUP(RC[-13],C20:C22,2,FALSE),3) -> 0.04 | R297: =VLOOKUP(ROUND(RC[-2],-2),C23:C24,2,TRUE) -> 48 | S297: =RC[-9]-RC[-1] -> -1
B298: 2 | C298: 0,1,7,340000 | D298: 65 | F298: 2 | G298: =R[-1]C+RC[-1] -> 87 | H298: =MID(RC[-5],7,20)*1 -> 340000 | I298: =SUM(R216C8:RC[-1]) -> 2320280 | J298: =VLOOKUP(ROUND(RC[-1],-2),C[13]:C[14],2,TRUE) -> 48 | L298: =ROUND(R216C12+(R381C12-R216C12)/R380C7^2*R[-1]C[-5]^2,0) -> 1779577 | M298: =ROUND(RC[-1]-R[-1]C[-1],-3) -> 83000 | N298: 0 | O298: =RC[-2]+RC[-1] -> 83000 | P298: =SUM(R216C15:RC[-1]) -> 2412700 | Q298: =ROUND(RC[-4]/VLOOKUP(RC[-13],C20:C22,2,FALSE),3) -> 0.041 | R298: =VLOOKUP(ROUND(RC[-2],-2),C23:C24,2,TRUE) -> 48 | S298: =RC[-9]-RC[-1] -> 0
B299: 2 | C299: 0,1,7,5500 | D299: 65 | F299: 2 | G299: =R[-1]C+RC[-1] -> 89 | H299: =MID(RC[-5],7,20)*1 -> 5500 | I299: =SUM(R216C8:RC[-1]) -> 2325780 | J299: =VLOOKUP(ROUND(RC[-1],-2),C[13]:C[14],2,TRUE) -> 48 | L299: =ROUND(R216C12+(R381C12-R216C12)/R380C7^2*R[-1]C[-5]^2,0) -> 1864283 | M299: =ROUND(RC[-1]-R[-1]C[-1],-3) -> 85000 | N299: 0 | O299: =RC[-2]+RC[-1] -> 85000 | P299: =SUM(R216C15:RC[-1]) -> 2497700 | Q299: =ROUND(RC[-4]/VLOOKUP(RC[-13],C20:C22,2,FALSE),3) -> 0.042 | R299: =VLOOKUP(ROUND(RC[-2],-2),C23:C24,2,TRUE) -> 48 | S299: =RC[-9]-RC[-1] -> 0
B300: 2 | C300: 0,1,7,5500 | D300: 65 | F300: 2 | G300: =R[-1]C+RC[-1] -> 91 | H300: =MID(RC[-5],7,20)*1 -> 5500 | I300: =SUM(R216C8:RC[-1]) -> 2331280 | J300: =VLOOKUP(ROUND(RC[-1],-2),C[13]:C[14],2,TRUE) -> 48 | L300: =ROUND(R216C12+(R381C12-R216C12)/R380C7^2*R[-1]C[-5]^2,0) -> 1950959 | M300: =ROUND(RC[-1]-R[-1]C[-1],-3) -> 87000 | N300: =ROUND(SUM(R[-4]C[-1]:RC[-1])/0.7*0.3,-3) -> 178000 | O300: =RC[-2]+RC[-1] -> 265000 | P300: =SUM(R216C15:RC[-1]) -> 2762700 | Q300: =ROUND(RC[-4]/VLOOKUP(RC[-13],C20:C22,2,FALSE),3) -> 0.043 | R300: =VLOOKUP(ROUND(RC[-2],-2),C23:C24,2,TRUE) -> 49 | S300: =RC[-9]-RC[-1] -> -1
B301: 2 | C301: 0,1,7,5500 | D301: 65 | F301: 2 | G301: =R[-1]C+RC[-1] -> 93 | H301: =MID(RC[-5],7,20)*1 -> 5500 | I301: =SUM(R216C8:RC[-1]) -> 2336780 | J301: =VLOOKUP(ROUND(RC[-1],-2),C[13]:C[14],2,TRUE) -> 48 | L301: =ROUND(R216C12+(R381C12-R216C12)/R380C7^2*R[-1]C[-5]^2,0) -> 2039606 | M301: =ROUND(RC[-1]-R[-1]C[-1],-3) -> 89000 | N301: 0 | O301: =RC[-2]+RC[-1] -> 89000 | P301: =SUM(R216C15:RC[-1]) -> 2851700 | Q301: =ROUND(RC[-4]/VLOOKUP(RC[-13],C20:C22,2,FALSE),3) -> 0.044 | R301: =VLOOKUP(ROUND(RC[-2],-2),C23:C24,2,TRUE) -> 49 | S301: =RC[-9]-RC[-1] -> -1
B302: 2 | C302: 0,1,7,5500 | D302: 65 | F302: 2 | G302: =R[-1]C+RC[-1] -> 95 | H302: =MID(RC[-5],7,20)*1 -> 5500 | I302: =SUM(R216C8:RC[-1]) -> 2342280 | J302: =VLOOKUP(ROUND(RC[-1],-2),C[13]:C[14],2,TRUE) -> 48 | L302: =ROUND(R216C12+(R381C12-R216C12)/R380C7^2*R[-1]C[-5]^2,0) -> 2130221 | M302: =ROUND(RC[-1]-R[-1]C[-1],-3) -> 91000 | N302: 0 | O302: =RC[-2]+RC[-1] -> 91000 | P302: =SUM(R216C15:RC[-1]) -> 2942700 | Q302: =ROUND(RC[-4]/VLOOKUP(RC[-13],C20:C22,2,FALSE),3) -> 0.045 | R302: =VLOOKUP(ROUND(RC[-2],-2),C23:C24,2,TRUE) -> 49 | S302: =RC[-9]-RC[-1] -> -1
B303: 2 | C303: 0,1,7,5500 | D303: 65 | F303: 2 | G303: =R[-1]C+RC[-1] -> 97 | H303: =MID(RC[-5],7,20)*1 -> 5500 | I303: =SUM(R216C8:RC[-1]) -> 2347780 | J303: =VLOOKUP(ROUND(RC[-1],-2),C[13]:C[14],2,TRUE) -> 48 | L303: =ROUND(R216C12+(R381C12-R216C12)/R380C7^2*R[-1]C[-5]^2,0) -> 2222807 | M303: =ROUND(RC[-1]-R[-1]C[-1],-3) -> 93000 | N303: 0 | O303: =RC[-2]+RC[-1] -> 93000 | P303: =SUM(R216C15:RC[-1]) -> 3035700 | Q303: =ROUND(RC[-4]/VLOOKUP(RC[-13],C20:C22,2,FALSE),3) -> 0.046 | R303: =VLOOKUP(ROUND(RC[-2],-2),C23:C24,2,TRUE) -> 49 | S303: =RC[-9]-RC[-1] -> -1
B304: 2 | C304: 0,1,7,5500 | D304: 65 | F304: 2 | G304: =R[-1]C+RC[-1] -> 99 | H304: =MID(RC[-5],7,20)*1 -> 5500 | I304: =SUM(R216C8:RC[-1]) -> 2353280 | J304: =VLOOKUP(ROUND(RC[-1],-2),C[13]:C[14],2,TRUE) -> 48 | L304: =ROUND(R216C12+(R381C12-R216C12)/R380C7^2*R[-1]C[-5]^2,0) -> 2317363 | M304: =ROUND(RC[-1]-R[-1]C[-1],-3) -> 95000 | N304: 0 | O304: =RC[-2]+RC[-1] -> 95000 | P304: =SUM(R216C15:RC[-1]) -> 3130700 | Q304: =ROUND(RC[-4]/VLOOKUP(RC[-13],C20:C22,2,FALSE),3) -> 0.047 | R304: =VLOOKUP(ROUND(RC[-2],-2),C23:C24,2,TRUE) -> 49 | S304: =RC[-9]-RC[-1] -> -1
B305: 2 | C305: 0,1,7,5500 | D305: 65 | F305: 2 | G305: =R[-1]C+RC[-1] -> 101 | H305: =MID(RC[-5],7,20)*1 -> 5500 | I305: =SUM(R216C8:RC[-1]) -> 2358780 | J305: =VLOOKUP(ROUND(RC[-1],-2),C[13]:C[14],2,TRUE) -> 48 | L305: =ROUND(R216C12+(R381C12-R216C12)/R380C7^2*R[-1]C[-5]^2,0) -> 2413889 | M305: =ROUND(RC[-1]-R[-1]C[-1],-3) -> 97000 | N305: =ROUND(SUM(R[-4]C[-1]:RC[-1])/0.7*0.3,-3) -> 199000 | O305: =RC[-2]+RC[-1] -> 296000 | P305: =SUM(R216C15:RC[-1]) -> 3426700 | Q305: =ROUND(RC[-4]/VLOOKUP(RC[-13],C20:C22,2,FALSE),3) -> 0.048 | R305: =VLOOKUP(ROUND(RC[-2],-2),C23:C24,2,TRUE) -> 50 | S305: =RC[-9]-RC[-1] -> -2
B306: 2 | C306: 0,1,7,340000 | D306: 65 | F306: 2 | G306: =R[-1]C+RC[-1] -> 103 | H306: =MID(RC[-5],7,20)*1 -> 340000 | I306: =SUM(R216C8:RC[-1]) -> 2698780 | J306: =VLOOKUP(ROUND(RC[-1],-2),C[13]:C[14],2,TRUE) -> 48 | L306: =ROUND(R216C12+(R381C12-R216C12)/R380C7^2*R[-1]C[-5]^2,0) -> 2512384 | M306: =ROUND(RC[-1]-R[-1]C[-1],-3) -> 98000 | N306: 0 | O306: =RC[-2]+RC[-1] -> 98000 | P306: =SUM(R216C15:RC[-1]) -> 3524700 | Q306: =ROUND(RC[-4]/VLOOKUP(RC[-13],C20:C22,2,FALSE),3) -> 0.048 | R306: =VLOOKUP(ROUND(RC[-2],-2),C23:C24,2,TRUE) -> 50 | S306: =RC[-9]-RC[-1] -> -2
B307: 2 | C307: 0,1,7,5500 | D307: 65 | F307: 2 | G307: =R[-1]C+RC[-1] -> 105 | H307: =MID(RC[-5],7,20)*1 -> 5500 | I307: =SUM(R216C8:RC[-1]) -> 2704280 | J307: =VLOOKUP(ROUND(RC[-1],-2),C[13]:C[14],2,TRUE) -> 48 | L307: =ROUND(R216C12+(R381C12-R216C12)/R380C7^2*R[-1]C[-5]^2,0) -> 2612850 | M307: =ROUND(RC[-1]-R[-1]C[-1],-3) -> 100000 | N307: 0 | O307: =RC[-2]+RC[-1] -> 100000 | P307: =SUM(R216C15:RC[-1]) -> 3624700 | Q307: =ROUND(RC[-4]/VLOOKUP(RC[-13],C20:C22,2,FALSE),3) -> 0.049 | R307: =VLOOKUP(ROUND(RC[-2],-2),C23:C24,2,TRUE) -> 50 | S307: =RC[-9]-RC[-1] -> -2
B308: 2 | C308: 0,1,7,5500 | D308: 65 | F308: 2 | G308: =R[-1]C+RC[-1] -> 107 | H308: =MID(RC[-5],7,20)*1 -> 5500 | I308: =SUM(R216C8:RC[-1]) -> 2709780 | J308: =VLOOKUP(ROUND(RC[-1],-2),C[13]:C[14],2,TRUE) -> 48 | L308: =ROUND(R216C12+(R381C12-R216C12)/R380C7^2*R[-1]C[-5]^2,0) -> 2715285 | M308: =ROUND(RC[-1]-R[-1]C[-1],-3) -> 102000 | N308: 0 | O308: =RC[-2]+RC[-1] -> 102000 | P308: =SUM(R216C15:RC[-1]) -> 3726700 | Q308: =ROUND(RC[-4]/VLOOKUP(RC[-13],C20:C22,2,FALSE),3) -> 0.05 | R308: =VLOOKUP(ROUND(RC[-2],-2),C23:C24,2,TRUE) -> 51 | S308: =RC[-9]-RC[-1] -> -3
B309: 2 | C309: 0,1,7,6000 | D309: 70 | F309: 2 | G309: =R[-1]C+RC[-1] -> 109 | H309: =MID(RC[-5],7,20)*1 -> 6000 | I309: =SUM(R216C8:RC[-1]) -> 2715780 | J309: =VLOOKUP(ROUND(RC[-1],-2),C[13]:C[14],2,TRUE) -> 49 | L309: =ROUND(R216C12+(R381C12-R216C12)/R380C7^2*R[-1]C[-5]^2,0) -> 2819691 | M309: =ROUND(RC[-1]-R[-1]C[-1],-3) -> 104000 | N309: 0 | O309: =RC[-2]+RC[-1] -> 104000 | P309: =SUM(R216C15:RC[-1]) -> 3830700 | Q309: =ROUND(RC[-4]/VLOOKUP(RC[-13],C20:C22,2,FALSE),3) -> 0.035 | R309: =VLOOKUP(ROUND(RC[-2],-2),C23:C24,2,TRUE) -> 51 | S309: =RC[-9]-RC[-1] -> -2
B310: 2 | C310: 0,1,7,6000 | D310: 70 | F310: 2 | G310: =R[-1]C+RC[-1] -> 111 | H310: =MID(RC[-5],7,20)*1 -> 6000 | I310: =SUM(R216C8:RC[-1]) -> 2721780 | J310: =VLOOKUP(ROUND(RC[-1],-2),C[13]:C[14],2,TRUE) -> 49 | L310: =ROUND(R216C12+(R381C12-R216C12)/R380C7^2*R[-1]C[-5]^2,0) -> 2926066 | M310: =ROUND(RC[-1]-R[-1]C[-1],-3) -> 106000 | N310: =ROUND(SUM(R[-4]C[-1]:RC[-1])/0.7*0.3,-3) -> 219000 | O310: =RC[-2]+RC[-1] -> 325000 | P310: =SUM(R216C15:RC[-1]) -> 4155700 | Q310: =ROUND(RC[-4]/VLOOKUP(RC[-13],C20:C22,2,FALSE),3) -> 0.036 | R310: =VLOOKUP(ROUND(RC[-2],-2),C23:C24,2,TRUE) -> 51 | S310: =RC[-9]-RC[-1] -> -2
B311: 2 | C311: 0,1,7,6000 | D311: 70 | F311: 2 | G311: =R[-1]C+RC[-1] -> 113 | H311: =MID(RC[-5],7,20)*1 -> 6000 | I311: =SUM(R216C8:RC[-1]) -> 2727780 | J311: =VLOOKUP(ROUND(RC[-1],-2),C[13]:C[14],2,TRUE) -> 49 | L311: =ROUND(R216C12+(R381C12-R216C12)/R380C7^2*R[-1]C[-5]^2,0) -> 3034411 | M311: =ROUND(RC[-1]-R[-1]C[-1],-3) -> 108000 | N311: 0 | O311: =RC[-2]+RC[-1] -> 108000 | P311: =SUM(R216C15:RC[-1]) -> 4263700 | Q311: =ROUND(RC[-4]/VLOOKUP(RC[-13],C20:C22,2,FALSE),3) -> 0.037 | R311: =VLOOKUP(ROUND(RC[-2],-2),C23:C24,2,TRUE) -> 52 | S311: =RC[-9]-RC[-1] -> -3
B312: 2 | C312: 0,1,7,6000 | D312: 70 | F312: 2 | G312: =R[-1]C+RC[-1] -> 115 | H312: =MID(RC[-5],7,20)*1 -> 6000 | I312: =SUM(R216C8:RC[-1]) -> 2733780 | J312: =VLOOKUP(ROUND(RC[-1],-2),C[13]:C[14],2,TRUE) -> 49 | L312: =ROUND(R216C12+(R381C12-R216C12)/R380C7^2*R[-1]C[-5]^2,0) -> 3144726 | M312: =ROUND(RC[-1]-R[-1]C[-1],-3) -> 110000 | N312: 0 | O312: =RC[-2]+RC[-1] -> 110000 | P312: =SUM(R216C15:RC[-1]) -> 4373700 | Q312: =ROUND(RC[-4]/VLOOKUP(RC[-13],C20:C22,2,FALSE),3) -> 0.037 | R312: =VLOOKUP(ROUND(RC[-2],-2),C23:C24,2,TRUE) -> 52 | S312: =RC[-9]-RC[-1] -> -3
B313: 2 | C313: 0,1,7,760000 | D313: 70 | F313: 2 | G313: =R[-1]C+RC[-1] -> 117 | H313: =MID(RC[-5],7,20)*1 -> 760000 | I313: =SUM(R216C8:RC[-1]) -> 3493780 | J313: =VLOOKUP(ROUND(RC[-1],-2),C[13]:C[14],2,TRUE) -> 50 | L313: =ROUND(R216C12+(R381C12-R216C12)/R380C7^2*R[-1]C[-5]^2,0) -> 3257011 | M313: =ROUND(RC[-1]-R[-1]C[-1],-3) -> 112000 | N313: 0 | O313: =RC[-2]+RC[-1] -> 112000 | P313: =SUM(R216C15:RC[-1]) -> 4485700 | Q313: =ROUND(RC[-4]/VLOOKUP(RC[-13],C20:C22,2,FALSE),3) -> 0.038 | R313: =VLOOKUP(ROUND(RC[-2],-2),C23:C24,2,TRUE) -> 52 | S313: =RC[-9]-RC[-1] -> -2
B314: 2 | C314: 0,1,7,6000 | D314: 70 | F314: 2 | G314: =R[-1]C+RC[-1] -> 119 | H314: =MID(RC[-5],7,20)*1 -> 6000 | I314: =SUM(R216C8:RC[-1]) -> 3499780 | J314: =VLOOKUP(ROUND(RC[-1],-2),C[13]:C[14],2,TRUE) -> 50 | L314: =ROUND(R216C12+(R381C12-R216C12)/R380C7^2*R[-1]C[-5]^2,0) -> 3371266 | M314: =ROUND(RC[-1]-R[-1]C[-1],-3) -> 114000 | N314: 0 | O314: =RC[-2]+RC[-1] -> 114000 | P314: =SUM(R216C15:RC[-1]) -> 4599700 | Q314: =ROUND(RC[-4]/VLOOKUP(RC[-13],C20:C22,2,FALSE),3) -> 0.039 | R314: =VLOOKUP(ROUND(RC[-2],-2),C23:C24,2,TRUE) -> 52 | S314: =RC[-9]-RC[-1] -> -2
B315: 2 | C315: 0,1,7,840000 | D315: 70 | F315: 2 | G315: =R[-1]C+RC[-1] -> 121 | H315: =MID(RC[-5],7,20)*1 -> 840000 | I315: =SUM(R216C8:RC[-1]) -> 4339780 | J315: =VLOOKUP(ROUND(RC[-1],-2),C[13]:C[14],2,TRUE) -> 52 | L315: =ROUND(R216C12+(R381C12-R216C12)/R380C7^2*R[-1]C[-5]^2,0) -> 3487491 | M315: =ROUND(RC[-1]-R[-1]C[-1],-3) -> 116000 | N315: =ROUND(SUM(R[-4]C[-1]:RC[-1])/0.7*0.3,-3) -> 240000 | O315: =RC[-2]+RC[-1] -> 356000 | P315: =SUM(R216C15:RC[-1]) -> 4955700 | Q315: =ROUND(RC[-4]/VLOOKUP(RC[-13],C20:C22,2,FALSE),3) -> 0.039 | R315: =VLOOKUP(ROUND(RC[-2],-2),C23:C24,2,TRUE) -> 53 | S315: =RC[-9]-RC[-1] -> -1
B316: 2 | C316: 0,1,7,6000 | D316: 70 | F316: 2 | G316: =R[-1]C+RC[-1] -> 123 | H316: =MID(RC[-5],7,20)*1 -> 6000 | I316: =SUM(R216C8:RC[-1]) -> 4345780 | J316: =VLOOKUP(ROUND(RC[-1],-2),C[13]:C[14],2,TRUE) -> 52 | L316: =ROUND(R216C12+(R381C12-R216C12)/R380C7^2*R[-1]C[-5]^2,0) -> 3605686 | M316: =ROUND(RC[-1]-R[-1]C[-1],-3) -> 118000 | N316: 0 | O316: =RC[-2]+RC[-1] -> 118000 | P316: =SUM(R216C15:RC[-1]) -> 5073700 | Q316: =ROUND(RC[-4]/VLOOKUP(RC[-13],C20:C22,2,FALSE),3) -> 0.04 | R316: =VLOOKUP(ROUND(RC[-2],-2),C23:C24,2,TRUE) -> 53 | S316: =RC[-9]-RC[-1] -> -1
B317: 2 | C317: 0,1,7,7200 | D317: 75 | F317: 2 | G317: =R[-1]C+RC[-1] -> 125 | H317: =MID(RC[-5],7,20)*1 -> 7200 | I317: =SUM(R216C8:RC[-1]) -> 4352980 | J317: =VLOOKUP(ROUND(RC[-1],-2),C[13]:C[14],2,TRUE) -> 52 | L317: =ROUND(R216C12+(R381C12-R216C12)/R380C7^2*R[-1]C[-5]^2,0) -> 3725850 | M317: =ROUND(RC[-1]-R[-1]C[-1],-3) -> 120000 | N317: 0 | O317: =RC[-2]+RC[-1] -> 120000 | P317: =SUM(R216C15:RC[-1]) -> 5193700 | Q317: =ROUND(RC[-4]/VLOOKUP(RC[-13],C20:C22,2,FALSE),3) -> 0.029 | R317: =VLOOKUP(ROUND(RC[-2],-2),C23:C24,2,TRUE) -> 53 | S317: =RC[-9]-RC[-1] -> -1
B318: 2 | C318: 0,1,7,7200 | D318: 75 | F318: 2 | G318: =R[-1]C+RC[-1] -> 127 | H318: =MID(RC[-5],7,20)*1 -> 7200 | I318: =SUM(R216C8:RC[-1]) -> 4360180 | J318: =VLOOKUP(ROUND(RC[-1],-2),C[13]:C[14],2,TRUE) -> 52 | L318: =ROUND(R216C12+(R381C12-R216C12)/R380C7^2*R[-1]C[-5]^2,0) -> 3847985 | M318: =ROUND(RC[-1]-R[-1]C[-1],-3) -> 122000 | N318: 0 | O318: =RC[-2]+RC[-1] -> 122000 | P318: =SUM(R216C15:RC[-1]) -> 5315700 | Q318: =ROUND(RC[-4]/VLOOKUP(RC[-13],C20:C22,2,FALSE),3) -> 0.03 | R318: =VLOOKUP(ROUND(RC[-2],-2),C23:C24,2,TRUE) -> 53 | S318: =RC[-9]-RC[-1] -> -1
B319: 2 | C319: 0,1,7,7200 | D319: 75 | F319: 2 | G319: =R[-1]C+RC[-1] -> 129 | H319: =MID(RC[-5],7,20)*1 -> 7200 | I319: =SUM(R216C8:RC[-1]) -> 4367380 | J319: =VLOOKUP(ROUND(RC[-1],-2),C[13]:C[14],2,TRUE) -> 52 | L319: =ROUND(R216C12+(R381C12-R216C12)/R380C7^2*R[-1]C[-5]^2,0) -> 3972090 | M319: =ROUND(RC[-1]-R[-1]C[-1],-3) -> 124000 | N319: 0 | O319: =RC[-2]+RC[-1] -> 124000 | P319: =SUM(R216C15:RC[-1]) -> 5439700 | Q319: =ROUND(RC[-4]/VLOOKUP(RC[-13],C20:C22,2,FALSE),3) -> 0.03 | R319: =VLOOKUP(ROUND(RC[-2],-2),C23:C24,2,TRUE) -> 53 | S319: =RC[-9]-RC[-1] -> -1
B320: 2 | C320: 0,1,7,7200 | D320: 75 | F320: 2 | G320: =R[-1]C+RC[-1] -> 131 | H320: =MID(RC[-5],7,20)*1 -> 7200 | I320: =SUM(R216C8:RC[-1]) -> 4374580 | J320: =VLOOKUP(ROUND(RC[-1],-2),C[13]:C[14],2,TRUE) -> 52 | L320: =ROUND(R216C12+(R381C12-R216C12)/R380C7^2*R[-1]C[-5]^2,0) -> 4098164 | M320: =ROUND(RC[-1]-R[-1]C[-1],-3) -> 126000 | N320: =ROUND(SUM(R[-4]C[-1]:RC[-1])/0.7*0.3,-3) -> 261000 | O320: =RC[-2]+RC[-1] -> 387000 | P320: =SUM(R216C15:RC[-1]) -> 5826700 | Q320: =ROUND(RC[-4]/VLOOKUP(RC[-13],C20:C22,2,FALSE),3) -> 0.031 | R320: =VLOOKUP(ROUND(RC[-2],-2),C23:C24,2,TRUE) -> 54 | S320: =RC[-9]-RC[-1] -> -2
B321: 2 | C321: 0,1,7,7200 | D321: 75 | F321: 2 | G321: =R[-1]C+RC[-1] -> 133 | H321: =MID(RC[-5],7,20)*1 -> 7200 | I321: =SUM(R216C8:RC[-1]) -> 4381780 | J321: =VLOOKUP(ROUND(RC[-1],-2),C[13]:C[14],2,TRUE) -> 52 | L321: =ROUND(R216C12+(R381C12-R216C12)/R380C7^2*R[-1]C[-5]^2,0) -> 4226208 | M321: =ROUND(RC[-1]-R[-1]C[-1],-3) -> 128000 | N321: 0 | O321: =RC[-2]+RC[-1] -> 128000 | P321: =SUM(R216C15:RC[-1]) -> 5954700 | Q321: =ROUND(RC[-4]/VLOOKUP(RC[-13],C20:C22,2,FALSE),3) -> 0.031 | R321: =VLOOKUP(ROUND(RC[-2],-2),C23:C24,2,TRUE) -> 54 | S321: =RC[-9]-RC[-1] -> -2
B322: 2 | C322: 0,1,7,7200 | D322: 75 | F322: 2 | G322: =R[-1]C+RC[-1] -> 135 | H322: =MID(RC[-5],7,20)*1 -> 7200 | I322: =SUM(R216C8:RC[-1]) -> 4388980 | J322: =VLOOKUP(ROUND(RC[-1],-2),C[13]:C[14],2,TRUE) -> 52 | L322: =ROUND(R216C12+(R381C12-R216C12)/R380C7^2*R[-1]C[-5]^2,0) -> 4356222 | M322: =ROUND(RC[-1]-R[-1]C[-1],-3) -> 130000 | N322: 0 | O322: =RC[-2]+RC[-1] -> 130000 | P322: =SUM(R216C15:RC[-1]) -> 6084700 | Q322: =ROUND(RC[-4]/VLOOKUP(RC[-13],C20:C22,2,FALSE),3) -> 0.032 | R322: =VLOOKUP(ROUND(RC[-2],-2),C23:C24,2,TRUE) -> 54 | S322: =RC[-9]-RC[-1] -> -2
B323: 2 | C323: 0,1,7,7200 | D323: 75 | F323: 2 | G323: =R[-1]C+RC[-1] -> 137 | H323: =MID(RC[-5],7,20)*1 -> 7200 | I323: =SUM(R216C8:RC[-1]) -> 4396180 | J323: =VLOOKUP(ROUND(RC[-1],-2),C[13]:C[14],2,TRUE) -> 52 | L323: =ROUND(R216C12+(R381C12-R216C12)/R380C7^2*R[-1]C[-5]^2,0) -> 4488207 | M323: =ROUND(RC[-1]-R[-1]C[-1],-3) -> 132000 | N323: 0 | O323: =RC[-2]+RC[-1] -> 132000 | P323: =SUM(R216C15:RC[-1]) -> 6216700 | Q323: =ROUND(RC[-4]/VLOOKUP(RC[-13],C20:C22,2,FALSE),3) -> 0.032 | R323: =VLOOKUP(ROUND(RC[-2],-2),C23:C24,2,TRUE) -> 54 | S323: =RC[-9]-RC[-1] -> -2
B324: 2 | C324: 0,1,7,7200 | D324: 75 | F324: 2 | G324: =R[-1]C+RC[-1] -> 139 | H324: =MID(RC[-5],7,20)*1 -> 7200 | I324: =SUM(R216C8:RC[-1]) -> 4403380 | J324: =VLOOKUP(ROUND(RC[-1],-2),C[13]:C[14],2,TRUE) -> 52 | L324: =ROUND(R216C12+(R381C12-R216C12)/R380C7^2*R[-1]C[-5]^2,0) -> 4622161 | M324: =ROUND(RC[-1]-R[-1]C[-1],-3) -> 134000 | N324: 0 | O324: =RC[-2]+RC[-1] -> 134000 | P324: =SUM(R216C15:RC[-1]) -> 6350700 | Q324: =ROUND(RC[-4]/VLOOKUP(RC[-13],C20:C22,2,FALSE),3) -> 0.033 | R324: =VLOOKUP(ROUND(RC[-2],-2),C23:C24,2,TRUE) -> 55 | S324: =RC[-9]-RC[-1] -> -3
B325: 2 | C325: 0,1,7,7200 | D325: 75 | F325: 2 | G325: =R[-1]C+RC[-1] -> 141 | H325: =MID(RC[-5],7,20)*1 -> 7200 | I325: =SUM(R216C8:RC[-1]) -> 4410580 | J325: =VLOOKUP(ROUND(RC[-1],-2),C[13]:C[14],2,TRUE) -> 52 | L325: =ROUND(R216C12+(R381C12-R216C12)/R380C7^2*R[-1]C[-5]^2,0) -> 4758085 | M325: =ROUND(RC[-1]-R[-1]C[-1],-3) -> 136000 | N325: =ROUND(SUM(R[-4]C[-1]:RC[-1])/0.7*0.3,-3) -> 283000 | O325: =RC[-2]+RC[-1] -> 419000 | P325: =SUM(R216C15:RC[-1]) -> 6769700 | Q325: =ROUND(RC[-4]/VLOOKUP(RC[-13],C20:C22,2,FALSE),3) -> 0.033 | R325: =VLOOKUP(ROUND(RC[-2],-2),C23:C24,2,TRUE) -> 55 | S325: =RC[-9]-RC[-1] -> -3
B326: 2 | C326: 0,1,7,840000 | D326: 75 | F326: 2 | G326: =R[-1]C+RC[-1] -> 143 | H326: =MID(RC[-5],7,20)*1 -> 840000 | I326: =SUM(R216C8:RC[-1]) -> 5250580 | J326: =VLOOKUP(ROUND(RC[-1],-2),C[13]:C[14],2,TRUE) -> 53 | L326: =ROUND(R216C12+(R381C12-R216C12)/R380C7^2*R[-1]C[-5]^2,0) -> 4895978 | M326: =ROUND(RC[-1]-R[-1]C[-1],-3) -> 138000 | N326: 0 | O326: =RC[-2]+RC[-1] -> 138000 | P326: =SUM(R216C15:RC[-1]) -> 6907700 | Q326: =ROUND(RC[-4]/VLOOKUP(RC[-13],C20:C22,2,FALSE),3) -> 0.034 | R326: =VLOOKUP(ROUND(RC[-2],-2),C23:C24,2,TRUE) -> 55 | S326: =RC[-9]-RC[-1] -> -2
B327: 2 | C327: 0,1,7,7200 | D327: 75 | F327: 2 | G327: =R[-1]C+RC[-1] -> 145 | H327: =MID(RC[-5],7,20)*1 -> 7200 | I327: =SUM(R216C8:RC[-1]) -> 5257780 | J327: =VLOOKUP(ROUND(RC[-1],-2),C[13]:C[14],2,TRUE) -> 53 | L327: =ROUND(R216C12+(R381C12-R216C12)/R380C7^2*R[-1]C[-5]^2,0) -> 5035842 | M327: =ROUND(RC[-1]-R[-1]C[-1],-3) -> 140000 | N327: 0 | O327: =RC[-2]+RC[-1] -> 140000 | P327: =SUM(R216C15:RC[-1]) -> 7047700 | Q327: =ROUND(RC[-4]/VLOOKUP(RC[-13],C20:C22,2,FALSE),3) -> 0.034 | R327: =VLOOKUP(ROUND(RC[-2],-2),C23:C24,2,TRUE) -> 55 | S327: =RC[-9]-RC[-1] -> -2
B328: 2 | C328: 0,1,7,8100 | D328: 80 | F328: 2 | G328: =R[-1]C+RC[-1] -> 147 | H328: =MID(RC[-5],7,20)*1 -> 8100 | I328: =SUM(R216C8:RC[-1]) -> 5265880 | J328: =VLOOKUP(ROUND(RC[-1],-2),C[13]:C[14],2,TRUE) -> 53 | L328: =ROUND(R216C12+(R381C12-R216C12)/R380C7^2*R[-1]C[-5]^2,0) -> 5177676 | M328: =ROUND(RC[-1]-R[-1]C[-1],-3) -> 142000 | N328: 0 | O328: =RC[-2]+RC[-1] -> 142000 | P328: =SUM(R216C15:RC[-1]) -> 7189700 | Q328: =ROUND(RC[-4]/VLOOKUP(RC[-13],C20:C22,2,FALSE),3) -> 0.023 | R328: =VLOOKUP(ROUND(RC[-2],-2),C23:C24,2,TRUE) -> 56 | S328: =RC[-9]-RC[-1] -> -3
B329: 2 | C329: 0,1,7,8100 | D329: 80 | F329: 2 | G329: =R[-1]C+RC[-1] -> 149 | H329: =MID(RC[-5],7,20)*1 -> 8100 | I329: =SUM(R216C8:RC[-1]) -> 5273980 | J329: =VLOOKUP(ROUND(RC[-1],-2),C[13]:C[14],2,TRUE) -> 53 | L329: =ROUND(R216C12+(R381C12-R216C12)/R380C7^2*R[-1]C[-5]^2,0) -> 5321479 | M329: =ROUND(RC[-1]-R[-1]C[-1],-3) -> 144000 | N329: 0 | O329: =RC[-2]+RC[-1] -> 144000 | P329: =SUM(R216C15:RC[-1]) -> 7333700 | Q329: =ROUND(RC[-4]/VLOOKUP(RC[-13],C20:C22,2,FALSE),3) -> 0.023 | R329: =VLOOKUP(ROUND(RC[-2],-2),C23:C24,2,TRUE) -> 56 | S329: =RC[-9]-RC[-1] -> -3
B330: 2 | C330: 0,1,7,8100 | D330: 80 | F330: 2 | G330: =R[-1]C+RC[-1] -> 151 | H330: =MID(RC[-5],7,20)*1 -> 8100 | I330: =SUM(R216C8:RC[-1]) -> 5282080 | J330: =VLOOKUP(ROUND(RC[-1],-2),C[13]:C[14],2,TRUE) -> 53 | L330: =ROUND(R216C12+(R381C12-R216C12)/R380C7^2*R[-1]C[-5]^2,0) -> 5467253 | M330: =ROUND(RC[-1]-R[-1]C[-1],-3) -> 146000 | N330: =ROUND(SUM(R[-4]C[-1]:RC[-1])/0.7*0.3,-3) -> 304000 | O330: =RC[-2]+RC[-1] -> 450000 | P330: =SUM(R216C15:RC[-1]) -> 7783700 | Q330: =ROUND(RC[-4]/VLOOKUP(RC[-13],C20:C22,2,FALSE),3) -> 0.024 | R330: =VLOOKUP(ROUND(RC[-2],-2),C23:C24,2,TRUE) -> 56 | S330: =RC[-9]-RC[-1] -> -3
B331: 2 | C331: 0,1,7,8100 | D331: 80 | F331: 2 | G331: =R[-1]C+RC[-1] -> 153 | H331: =MID(RC[-5],7,20)*1 -> 8100 | I331: =SUM(R216C8:RC[-1]) -> 5290180 | J331: =VLOOKUP(ROUND(RC[-1],-2),C[13]:C[14],2,TRUE) -> 53 | L331: =ROUND(R216C12+(R381C12-R216C12)/R380C7^2*R[-1]C[-5]^2,0) -> 5614996 | M331: =ROUND(RC[-1]-R[-1]C[-1],-3) -> 148000 | N331: 0 | O331: =RC[-2]+RC[-1] -> 148000 | P331: =SUM(R216C15:RC[-1]) -> 7931700 | Q331: =ROUND(RC[-4]/VLOOKUP(RC[-13],C20:C22,2,FALSE),3) -> 0.024 | R331: =VLOOKUP(ROUND(RC[-2],-2),C23:C24,2,TRUE) -> 56 | S331: =RC[-9]-RC[-1] -> -3
B332: 2 | C332: 0,1,7,8100 | D332: 80 | F332: 2 | G332: =R[-1]C+RC[-1] -> 155 | H332: =MID(RC[-5],7,20)*1 -> 8100 | I332: =SUM(R216C8:RC[-1]) -> 5298280 | J332: =VLOOKUP(ROUND(RC[-1],-2),C[13]:C[14],2,TRUE) -> 53 | L332: =ROUND(R216C12+(R381C12-R216C12)/R380C7^2*R[-1]C[-5]^2,0) -> 5764710 | M332: =ROUND(RC[-1]-R[-1]C[-1],-3) -> 150000 | N332: 0 | O332: =RC[-2]+RC[-1] -> 150000 | P332: =SUM(R216C15:RC[-1]) -> 8081700 | Q332: =ROUND(RC[-4]/VLOOKUP(RC[-13],C20:C22,2,FALSE),3) -> 0.024 | R332: =VLOOKUP(ROUND(RC[-2],-2),C23:C24,2,TRUE) -> 56 | S332: =RC[-9]-RC[-1] -> -3
B333: 2 | C333: 0,1,7,840000 | D333: 80 | F333: 2 | G333: =R[-1]C+RC[-1] -> 157 | H333: =MID(RC[-5],7,20)*1 -> 840000 | I333: =SUM(R216C8:RC[-1]) -> 6138280 | J333: =VLOOKUP(ROUND(RC[-1],-2),C[13]:C[14],2,TRUE) -> 54 | L333: =ROUND(R216C12+(R381C12-R216C12)/R380C7^2*R[-1]C[-5]^2,0) -> 5916393 | M333: =ROUND(RC[-1]-R[-1]C[-1],-3) -> 152000 | N333: 0 | O333: =RC[-2]+RC[-1] -> 152000 | P333: =SUM(R216C15:RC[-1]) -> 8233700 | Q333: =ROUND(RC[-4]/VLOOKUP(RC[-13],C20:C22,2,FALSE),3) -> 0.025 | R333: =VLOOKUP(ROUND(RC[-2],-2),C23:C24,2,TRUE) -> 57 | S333: =RC[-9]-RC[-1] -> -3
B334: 2 | C334: 0,1,7,8100 | D334: 80 | F334: 2 | G334: =R[-1]C+RC[-1] -> 159 | H334: =MID(RC[-5],7,20)*1 -> 8100 | I334: =SUM(R216C8:RC[-1]) -> 6146380 | J334: =VLOOKUP(ROUND(RC[-1],-2),C[13]:C[14],2,TRUE) -> 54 | L334: =ROUND(R216C12+(R381C12-R216C12)/R380C7^2*R[-1]C[-5]^2,0) -> 6070046 | M334: =ROUND(RC[-1]-R[-1]C[-1],-3) -> 154000 | N334: 0 | O334: =RC[-2]+RC[-1] -> 154000 | P334: =SUM(R216C15:RC[-1]) -> 8387700 | Q334: =ROUND(RC[-4]/VLOOKUP(RC[-13],C20:C22,2,FALSE),3) -> 0.025 | R334: =VLOOKUP(ROUND(RC[-2],-2),C23:C24,2,TRUE) -> 57 | S334: =RC[-9]-RC[-1] -> -3
B335: 2 | C335: 0,1,7,8100 | D335: 80 | F335: 2 | G335: =R[-1]C+RC[-1] -> 161 | H335: =MID(RC[-5],7,20)*1 -> 8100 | I335: =SUM(R216C8:RC[-1]) -> 6154480 | J335: =VLOOKUP(ROUND(RC[-1],-2),C[13]:C[14],2,TRUE) -> 54 | L335: =ROUND(R216C12+(R381C12-R216C12)/R380C7^2*R[-1]C[-5]^2,0) -> 6225669 | M335: =ROUND(RC[-1]-R[-1]C[-1],-3) -> 156000 | N335: =ROUND(SUM(R[-4]C[-1]:RC[-1])/0.7*0.3,-3) -> 326000 | O335: =RC[-2]+RC[-1] -> 482000 | P335: =SUM(R216C15:RC[-1]) -> 8869700 | Q335: =ROUND(RC[-4]/VLOOKUP(RC[-13],C20:C22,2,FALSE),3) -> 0.025 | R335: =VLOOKUP(ROUND(RC[-2],-2),C23:C24,2,TRUE) -> 57 | S335: =RC[-9]-RC[-1] -> -3
B336: 2 | C336: 0,1,7,840000 | D336: 80 | F336: 2 | G336: =R[-1]C+RC[-1] -> 163 | H336: =MID(RC[-5],7,20)*1 -> 840000 | I336: =SUM(R216C8:RC[-1]) -> 6994480 | J336: =VLOOKUP(ROUND(RC[-1],-2),C[13]:C[14],2,TRUE) -> 55 | L336: =ROUND(R216C12+(R381C12-R216C12)/R380C7^2*R[-1]C[-5]^2,0) -> 6383262 | M336: =ROUND(RC[-1]-R[-1]C[-1],-3) -> 158000 | N336: 0 | O336: =RC[-2]+RC[-1] -> 158000 | P336: =SUM(R216C15:RC[-1]) -> 9027700 | Q336: =ROUND(RC[-4]/VLOOKUP(RC[-13],C20:C22,2,FALSE),3) -> 0.026 | R336: =VLOOKUP(ROUND(RC[-2],-2),C23:C24,2,TRUE) -> 57 | S336: =RC[-9]-RC[-1] -> -2
B337: 2 | C337: 0,1,7,8100 | D337: 80 | F337: 2 | G337: =R[-1]C+RC[-1] -> 165 | H337: =MID(RC[-5],7,20)*1 -> 8100 | I337: =SUM(R216C8:RC[-1]) -> 7002580 | J337: =VLOOKUP(ROUND(RC[-1],-2),C[13]:C[14],2,TRUE) -> 55 | L337: =ROUND(R216C12+(R381C12-R216C12)/R380C7^2*R[-1]C[-5]^2,0) -> 6542825 | M337: =ROUND(RC[-1]-R[-1]C[-1],-3) -> 160000 | N337: 0 | O337: =RC[-2]+RC[-1] -> 160000 | P337: =SUM(R216C15:RC[-1]) -> 9187700 | Q337: =ROUND(RC[-4]/VLOOKUP(RC[-13],C20:C22,2,FALSE),3) -> 0.026 | R337: =VLOOKUP(ROUND(RC[-2],-2),C23:C24,2,TRUE) -> 58 | S337: =RC[-9]-RC[-1] -> -3
B338: 2 | C338: 0,1,7,10000 | D338: 85 | F338: 2 | G338: =R[-1]C+RC[-1] -> 167 | H338: =MID(RC[-5],7,20)*1 -> 10000 | I338: =SUM(R216C8:RC[-1]) -> 7012580 | J338: =VLOOKUP(ROUND(RC[-1],-2),C[13]:C[14],2,TRUE) -> 55 | L338: =ROUND(R216C12+(R381C12-R216C12)/R380C7^2*R[-1]C[-5]^2,0) -> 6704358 | M338: =ROUND(RC[-1]-R[-1]C[-1],-3) -> 162000 | N338: 0 | O338: =RC[-2]+RC[-1] -> 162000 | P338: =SUM(R216C15:RC[-1]) -> 9349700 | Q338: =ROUND(RC[-4]/VLOOKUP(RC[-13],C20:C22,2,FALSE),3) -> 0.014 | R338: =VLOOKUP(ROUND(RC[-2],-2),C23:C24,2,TRUE) -> 58 | S338: =RC[-9]-RC[-1] -> -3
B339: 2 | C339: 0,1,7,10000 | D339: 85 | F339: 2 | G339: =R[-1]C+RC[-1] -> 169 | H339: =MID(RC[-5],7,20)*1 -> 10000 | I339: =SUM(R216C8:RC[-1]) -> 7022580 | J339: =VLOOKUP(ROUND(RC[-1],-2),C[13]:C[14],2,TRUE) -> 55 | L339: =ROUND(R216C12+(R381C12-R216C12)/R380C7^2*R[-1]C[-5]^2,0) -> 6867861 | M339: =ROUND(RC[-1]-R[-1]C[-1],-3) -> 164000 | N339: 0 | O339: =RC[-2]+RC[-1] -> 164000 | P339: =SUM(R216C15:RC[-1]) -> 9513700 | Q339: =ROUND(RC[-4]/VLOOKUP(RC[-13],C20:C22,2,FALSE),3) -> 0.014 | R339: =VLOOKUP(ROUND(RC[-2],-2),C23:C24,2,TRUE) -> 58 | S339: =RC[-9]-RC[-1] -> -3
B340: 2 | C340: 0,1,7,10000 | D340: 85 | F340: 2 | G340: =R[-1]C+RC[-1] -> 171 | H340: =MID(RC[-5],7,20)*1 -> 10000 | I340: =SUM(R216C8:RC[-1]) -> 7032580 | J340: =VLOOKUP(ROUND(RC[-1],-2),C[13]:C[14],2,TRUE) -> 55 | L340: =ROUND(R216C12+(R381C12-R216C12)/R380C7^2*R[-1]C[-5]^2,0) -> 7033333 | M340: =ROUND(RC[-1]-R[-1]C[-1],-3) -> 165000 | N340: =ROUND(SUM(R[-4]C[-1]:RC[-1])/0.7*0.3,-3) -> 347000 | O340: =RC[-2]+RC[-1] -> 512000 | P340: =SUM(R216C15:RC[-1]) -> 10025700 | Q340: =ROUND(RC[-4]/VLOOKUP(RC[-13],C20:C22,2,FALSE),3) -> 0.014 | R340: =VLOOKUP(ROUND(RC[-2],-2),C23:C24,2,TRUE) -> 58 | S340: =RC[-9]-RC[-1] -> -3
B341: 2 | C341: 0,1,7,10000 | D341: 85 | F341: 2 | G341: =R[-1]C+RC[-1] -> 173 | H341: =MID(RC[-5],7,20)*1 -> 10000 | I341: =SUM(R216C8:RC[-1]) -> 7042580 | J341: =VLOOKUP(ROUND(RC[-1],-2),C[13]:C[14],2,TRUE) -> 55 | L341: =ROUND(R216C12+(R381C12-R216C12)/R380C7^2*R[-1]C[-5]^2,0) -> 7200776 | M341: =ROUND(RC[-1]-R[-1]C[-1],-3) -> 167000 | N341: 0 | O341: =RC[-2]+RC[-1] -> 167000 | P341: =SUM(R216C15:RC[-1]) -> 10192700 | Q341: =ROUND(RC[-4]/VLOOKUP(RC[-13],C20:C22,2,FALSE),3) -> 0.014 | R341: =VLOOKUP(ROUND(RC[-2],-2),C23:C24,2,TRUE) -> 58 | S341: =RC[-9]-RC[-1] -> -3
B342: 2 | C342: 0,1,7,10000 | D342: 85 | F342: 2 | G342: =R[-1]C+RC[-1] -> 175 | H342: =MID(RC[-5],7,20)*1 -> 10000 | I342: =SUM(R216C8:RC[-1]) -> 7052580 | J342: =VLOOKUP(ROUND(RC[-1],-2),C[13]:C[14],2,TRUE) -> 55 | L342: =ROUND(R216C12+(R381C12-R216C12)/R380C7^2*R[-1]C[-5]^2,0) -> 7370188 | M342: =ROUND(RC[-1]-R[-1]C[-1],-3) -> 169000 | N342: 0 | O342: =RC[-2]+RC[-1] -> 169000 | P342: =SUM(R216C15:RC[-1]) -> 10361700 | Q342: =ROUND(RC[-4]/VLOOKUP(RC[-13],C20:C22,2,FALSE),3) -> 0.014 | R342: =VLOOKUP(ROUND(RC[-2],-2),C23:C24,2,TRUE) -> 59 | S342: =RC[-9]-RC[-1] -> -4
B343: 2 | C343: 0,1,7,10000 | D343: 85 | F343: 2 | G343: =R[-1]C+RC[-1] -> 177 | H343: =MID(RC[-5],7,20)*1 -> 10000 | I343: =SUM(R216C8:RC[-1]) -> 7062580 | J343: =VLOOKUP(ROUND(RC[-1],-2),C[13]:C[14],2,TRUE) -> 55 | L343: =ROUND(R216C12+(R381C12-R216C12)/R380C7^2*R[-1]C[-5]^2,0) -> 7541571 | M343: =ROUND(RC[-1]-R[-1]C[-1],-3) -> 171000 | N343: 0 | O343: =RC[-2]+RC[-1] -> 171000 | P343: =SUM(R216C15:RC[-1]) -> 10532700 | Q343: =ROUND(RC[-4]/VLOOKUP(RC[-13],C20:C22,2,FALSE),3) -> 0.014 | R343: =VLOOKUP(ROUND(RC[-2],-2),C23:C24,2,TRUE) -> 59 | S343: =RC[-9]-RC[-1] -> -4
B344: 2 | C344: 0,1,7,1200000 | D344: 85 | F344: 2 | G344: =R[-1]C+RC[-1] -> 179 | H344: =MID(RC[-5],7,20)*1 -> 1200000 | I344: =SUM(R216C8:RC[-1]) -> 8262580 | J344: =VLOOKUP(ROUND(RC[-1],-2),C[13]:C[14],2,TRUE) -> 57 | L344: =ROUND(R216C12+(R381C12-R216C12)/R380C7^2*R[-1]C[-5]^2,0) -> 7714923 | M344: =ROUND(RC[-1]-R[-1]C[-1],-3) -> 173000 | N344: 0 | O344: =RC[-2]+RC[-1] -> 173000 | P344: =SUM(R216C15:RC[-1]) -> 10705700 | Q344: =ROUND(RC[-4]/VLOOKUP(RC[-13],C20:C22,2,FALSE),3) -> 0.014 | R344: =VLOOKUP(ROUND(RC[-2],-2),C23:C24,2,TRUE) -> 59 | S344: =RC[-9]-RC[-1] -> -2
B345: 2 | C345: 0,1,7,10000 | D345: 85 | F345: 2 | G345: =R[-1]C+RC[-1] -> 181 | H345: =MID(RC[-5],7,20)*1 -> 10000 | I345: =SUM(R216C8:RC[-1]) -> 8272580 | J345: =VLOOKUP(ROUND(RC[-1],-2),C[13]:C[14],2,TRUE) -> 57 | L345: =ROUND(R216C12+(R381C12-R216C12)/R380C7^2*R[-1]C[-5]^2,0) -> 7890245 | M345: =ROUND(RC[-1]-R[-1]C[-1],-3) -> 175000 | N345: =ROUND(SUM(R[-4]C[-1]:RC[-1])/0.7*0.3,-3) -> 366000 | O345: =RC[-2]+RC[-1] -> 541000 | P345: =SUM(R216C15:RC[-1]) -> 11246700 | Q345: =ROUND(RC[-4]/VLOOKUP(RC[-13],C20:C22,2,FALSE),3) -> 0.015 | R345: =VLOOKUP(ROUND(RC[-2],-2),C23:C24,2,TRUE) -> 59 | S345: =RC[-9]-RC[-1] -> -2
B346: 2 | C346: 0,1,7,10000 | D346: 85 | F346: 2 | G346: =R[-1]C+RC[-1] -> 183 | H346: =MID(RC[-5],7,20)*1 -> 10000 | I346: =SUM(R216C8:RC[-1]) -> 8282580 | J346: =VLOOKUP(ROUND(RC[-1],-2),C[13]:C[14],2,TRUE) -> 57 | L346: =ROUND(R216C12+(R381C12-R216C12)/R380C7^2*R[-1]C[-5]^2,0) -> 8067537 | M346: =ROUND(RC[-1]-R[-1]C[-1],-3) -> 177000 | N346: 0 | O346: =RC[-2]+RC[-1] -> 177000 | P346: =SUM(R216C15:RC[-1]) -> 11423700 | Q346: =ROUND(RC[-4]/VLOOKUP(RC[-13],C20:C22,2,FALSE),3) -> 0.015 | R346: =VLOOKUP(ROUND(RC[-2],-2),C23:C24,2,TRUE) -> 59 | S346: =RC[-9]-RC[-1] -> -2
B347: 2 | C347: 0,1,7,10000 | D347: 85 | F347: 2 | G347: =R[-1]C+RC[-1] -> 185 | H347: =MID(RC[-5],7,20)*1 -> 10000 | I347: =SUM(R216C8:RC[-1]) -> 8292580 | J347: =VLOOKUP(ROUND(RC[-1],-2),C[13]:C[14],2,TRUE) -> 57 | L347: =ROUND(R216C12+(R381C12-R216C12)/R380C7^2*R[-1]C[-5]^2,0) -> 8246799 | M347: =ROUND(RC[-1]-R[-1]C[-1],-3) -> 179000 | N347: 0 | O347: =RC[-2]+RC[-1] -> 179000 | P347: =SUM(R216C15:RC[-1]) -> 11602700 | Q347: =ROUND(RC[-4]/VLOOKUP(RC[-13],C20:C22,2,FALSE),3) -> 0.015 | R347: =VLOOKUP(ROUND(RC[-2],-2),C23:C24,2,TRUE) -> 60 | S347: =RC[-9]-RC[-1] -> -3
B348: 2 | C348: 0,1,7,1540000 | D348: 85 | F348: 2 | G348: =R[-1]C+RC[-1] -> 187 | H348: =MID(RC[-5],7,20)*1 -> 1540000 | I348: =SUM(R216C8:RC[-1]) -> 9832580 | J348: =VLOOKUP(ROUND(RC[-1],-2),C[13]:C[14],2,TRUE) -> 58 | L348: =ROUND(R216C12+(R381C12-R216C12)/R380C7^2*R[-1]C[-5]^2,0) -> 8428031 | M348: =ROUND(RC[-1]-R[-1]C[-1],-3) -> 181000 | N348: 0 | O348: =RC[-2]+RC[-1] -> 181000 | P348: =SUM(R216C15:RC[-1]) -> 11783700 | Q348: =ROUND(RC[-4]/VLOOKUP(RC[-13],C20:C22,2,FALSE),3) -> 0.015 | R348: =VLOOKUP(ROUND(RC[-2],-2),C23:C24,2,TRUE) -> 60 | S348: =RC[-9]-RC[-1] -> -2
B349: 2 | C349: 0,1,7,10000 | D349: 85 | F349: 2 | G349: =R[-1]C+RC[-1] -> 189 | H349: =MID(RC[-5],7,20)*1 -> 10000 | I349: =SUM(R216C8:RC[-1]) -> 9842580 | J349: =VLOOKUP(ROUND(RC[-1],-2),C[13]:C[14],2,TRUE) -> 58 | L349: =ROUND(R216C12+(R381C12-R216C12)/R380C7^2*R[-1]C[-5]^2,0) -> 8611233 | M349: =ROUND(RC[-1]-R[-1]C[-1],-3) -> 183000 | N349: 0 | O349: =RC[-2]+RC[-1] -> 183000 | P349: =SUM(R216C15:RC[-1]) -> 11966700 | Q349: =ROUND(RC[-4]/VLOOKUP(RC[-13],C20:C22,2,FALSE),3) -> 0.015 | R349: =VLOOKUP(ROUND(RC[-2],-2),C23:C24,2,TRUE) -> 60 | S349: =RC[-9]-RC[-1] -> -2
B350: 2 | C350: 0,1,7,20000 | D350: 90 | F350: 2 | G350: =R[-1]C+RC[-1] -> 191 | H350: =MID(RC[-5],7,20)*1 -> 20000 | I350: =SUM(R216C8:RC[-1]) -> 9862580 | J350: =VLOOKUP(ROUND(RC[-1],-2),C[13]:C[14],2,TRUE) -> 58 | L350: =ROUND(R216C12+(R381C12-R216C12)/R380C7^2*R[-1]C[-5]^2,0) -> 8796405 | M350: =ROUND(RC[-1]-R[-1]C[-1],-3) -> 185000 | N350: =ROUND(SUM(R[-4]C[-1]:RC[-1])/0.7*0.3,-3) -> 388000 | O350: =RC[-2]+RC[-1] -> 573000 | P350: =SUM(R216C15:RC[-1]) -> 12539700 | Q350: =ROUND(RC[-4]/VLOOKUP(RC[-13],C20:C22,2,FALSE),3) -> 0.009 | R350: =VLOOKUP(ROUND(RC[-2],-2),C23:C24,2,TRUE) -> 60 | S350: =RC[-9]-RC[-1] -> -2
B351: 2 | C351: 0,1,7,20000 | D351: 90 | F351: 2 | G351: =R[-1]C+RC[-1] -> 193 | H351: =MID(RC[-5],7,20)*1 -> 20000 | I351: =SUM(R216C8:RC[-1]) -> 9882580 | J351: =VLOOKUP(ROUND(RC[-1],-2),C[13]:C[14],2,TRUE) -> 58 | L351: =ROUND(R216C12+(R381C12-R216C12)/R380C7^2*R[-1]C[-5]^2,0) -> 8983547 | M351: =ROUND(RC[-1]-R[-1]C[-1],-3) -> 187000 | N351: 0 | O351: =RC[-2]+RC[-1] -> 187000 | P351: =SUM(R216C15:RC[-1]) -> 12726700 | Q351: =ROUND(RC[-4]/VLOOKUP(RC[-13],C20:C22,2,FALSE),3) -> 0.009 | R351: =VLOOKUP(ROUND(RC[-2],-2),C23:C24,2,TRUE) -> 60 | S351: =RC[-9]-RC[-1] -> -2
B352: 2 | C352: 0,1,7,20000 | D352: 90 | F352: 2 | G352: =R[-1]C+RC[-1] -> 195 | H352: =MID(RC[-5],7,20)*1 -> 20000 | I352: =SUM(R216C8:RC[-1]) -> 9902580 | J352: =VLOOKUP(ROUND(RC[-1],-2),C[13]:C[14],2,TRUE) -> 58 | L352: =ROUND(R216C12+(R381C12-R216C12)/R380C7^2*R[-1]C[-5]^2,0) -> 9172658 | M352: =ROUND(RC[-1]-R[-1]C[-1],-3) -> 189000 | N352: 0 | O352: =RC[-2]+RC[-1] -> 189000 | P352: =SUM(R216C15:RC[-1]) -> 12915700 | Q352: =ROUND(RC[-4]/VLOOKUP(RC[-13],C20:C22,2,FALSE),3) -> 0.009 | R352: =VLOOKUP(ROUND(RC[-2],-2),C23:C24,2,TRUE) -> 61 | S352: =RC[-9]-RC[-1] -> -3
B353: 2 | C353: 0,1,7,20000 | D353: 90 | F353: 2 | G353: =R[-1]C+RC[-1] -> 197 | H353: =MID(RC[-5],7,20)*1 -> 20000 | I353: =SUM(R216C8:RC[-1]) -> 9922580 | J353: =VLOOKUP(ROUND(RC[-1],-2),C[13]:C[14],2,TRUE) -> 58 | L353: =ROUND(R216C12+(R381C12-R216C12)/R380C7^2*R[-1]C[-5]^2,0) -> 9363740 | M353: =ROUND(RC[-1]-R[-1]C[-1],-3) -> 191000 | N353: 0 | O353: =RC[-2]+RC[-1] -> 191000 | P353: =SUM(R216C15:RC[-1]) -> 13106700 | Q353: =ROUND(RC[-4]/VLOOKUP(RC[-13],C20:C22,2,FALSE),3) -> 0.009 | R353: =VLOOKUP(ROUND(RC[-2],-2),C23:C24,2,TRUE) -> 61 | S353: =RC[-9]-RC[-1] -> -3
B354: 2 | C354: 0,1,7,20000 | D354: 90 | F354: 2 | G354: =R[-1]C+RC[-1] -> 199 | H354: =MID(RC[-5],7,20)*1 -> 20000 | I354: =SUM(R216C8:RC[-1]) -> 9942580 | J354: =VLOOKUP(ROUND(RC[-1],-2),C[13]:C[14],2,TRUE) -> 58 | L354: =ROUND(R216C12+(R381C12-R216C12)/R380C7^2*R[-1]C[-5]^2,0) -> 9556791 | M354: =ROUND(RC[-1]-R[-1]C[-1],-3) -> 193000 | N354: 0 | O354: =RC[-2]+RC[-1] -> 193000 | P354: =SUM(R216C15:RC[-1]) -> 13299700 | Q354: =ROUND(RC[-4]/VLOOKUP(RC[-13],C20:C22,2,FALSE),3) -> 0.009 | R354: =VLOOKUP(ROUND(RC[-2],-2),C23:C24,2,TRUE) -> 61 | S354: =RC[-9]-RC[-1] -> -3
B355: 2 | C355: 0,1,7,20000 | D355: 90 | F355: 2 | G355: =R[-1]C+RC[-1] -> 201 | H355: =MID(RC[-5],7,20)*1 -> 20000 | I355: =SUM(R216C8:RC[-1]) -> 9962580 | J355: =VLOOKUP(ROUND(RC[-1],-2),C[13]:C[14],2,TRUE) -> 58 | L355: =ROUND(R216C12+(R381C12-R216C12)/R380C7^2*R[-1]C[-5]^2,0) -> 9751812 | M355: =ROUND(RC[-1]-R[-1]C[-1],-3) -> 195000 | N355: =ROUND(SUM(R[-4]C[-1]:RC[-1])/0.7*0.3,-3) -> 409000 | O355: =RC[-2]+RC[-1] -> 604000 | P355: =SUM(R216C15:RC[-1]) -> 13903700 | Q355: =ROUND(RC[-4]/VLOOKUP(RC[-13],C20:C22,2,FALSE),3) -> 0.01 | R355: =VLOOKUP(ROUND(RC[-2],-2),C23:C24,2,TRUE) -> 61 | S355: =RC[-9]-RC[-1] -> -3
B356: 2 | C356: 0,1,7,20000 | D356: 90 | F356: 2 | G356: =R[-1]C+RC[-1] -> 203 | H356: =MID(RC[-5],7,20)*1 -> 20000 | I356: =SUM(R216C8:RC[-1]) -> 9982580 | J356: =VLOOKUP(ROUND(RC[-1],-2),C[13]:C[14],2,TRUE) -> 58 | L356: =ROUND(R216C12+(R381C12-R216C12)/R380C7^2*R[-1]C[-5]^2,0) -> 9948804 | M356: =ROUND(RC[-1]-R[-1]C[-1],-3) -> 197000 | N356: 0 | O356: =RC[-2]+RC[-1] -> 197000 | P356: =SUM(R216C15:RC[-1]) -> 14100700 | Q356: =ROUND(RC[-4]/VLOOKUP(RC[-13],C20:C22,2,FALSE),3) -> 0.01 | R356: =VLOOKUP(ROUND(RC[-2],-2),C23:C24,2,TRUE) -> 61 | S356: =RC[-9]-RC[-1] -> -3
B357: 2 | C357: 0,1,7,1550000 | D357: 90 | F357: 2 | G357: =R[-1]C+RC[-1] -> 205 | H357: =MID(RC[-5],7,20)*1 -> 1550000 | I357: =SUM(R216C8:RC[-1]) -> 11532580 | J357: =VLOOKUP(ROUND(RC[-1],-2),C[13]:C[14],2,TRUE) -> 60 | L357: =ROUND(R216C12+(R381C12-R216C12)/R380C7^2*R[-1]C[-5]^2,0) -> 10147765 | M357: =ROUND(RC[-1]-R[-1]C[-1],-3) -> 199000 | N357: 0 | O357: =RC[-2]+RC[-1] -> 199000 | P357: =SUM(R216C15:RC[-1]) -> 14299700 | Q357: =ROUND(RC[-4]/VLOOKUP(RC[-13],C20:C22,2,FALSE),3) -> 0.01 | R357: =VLOOKUP(ROUND(RC[-2],-2),C23:C24,2,TRUE) -> 61 | S357: =RC[-9]-RC[-1] -> -1
B358: 2 | C358: 0,1,7,20000 | D358: 90 | F358: 2 | G358: =R[-1]C+RC[-1] -> 207 | H358: =MID(RC[-5],7,20)*1 -> 20000 | I358: =SUM(R216C8:RC[-1]) -> 11552580 | J358: =VLOOKUP(ROUND(RC[-1],-2),C[13]:C[14],2,TRUE) -> 60 | L358: =ROUND(R216C12+(R381C12-R216C12)/R380C7^2*R[-1]C[-5]^2,0) -> 10348696 | M358: =ROUND(RC[-1]-R[-1]C[-1],-3) -> 201000 | N358: 0 | O358: =RC[-2]+RC[-1] -> 201000 | P358: =SUM(R216C15:RC[-1]) -> 14500700 | Q358: =ROUND(RC[-4]/VLOOKUP(RC[-13],C20:C22,2,FALSE),3) -> 0.01 | R358: =VLOOKUP(ROUND(RC[-2],-2),C23:C24,2,TRUE) -> 62 | S358: =RC[-9]-RC[-1] -> -2
B359: 2 | C359: 0,1,7,20000 | D359: 90 | F359: 2 | G359: =R[-1]C+RC[-1] -> 209 | H359: =MID(RC[-5],7,20)*1 -> 20000 | I359: =SUM(R216C8:RC[-1]) -> 11572580 | J359: =VLOOKUP(ROUND(RC[-1],-2),C[13]:C[14],2,TRUE) -> 60 | L359: =ROUND(R216C12+(R381C12-R216C12)/R380C7^2*R[-1]C[-5]^2,0) -> 10551597 | M359: =ROUND(RC[-1]-R[-1]C[-1],-3) -> 203000 | N359: 0 | O359: =RC[-2]+RC[-1] -> 203000 | P359: =SUM(R216C15:RC[-1]) -> 14703700 | Q359: =ROUND(RC[-4]/VLOOKUP(RC[-13],C20:C22,2,FALSE),3) -> 0.01 | R359: =VLOOKUP(ROUND(RC[-2],-2),C23:C24,2,TRUE) -> 62 | S359: =RC[-9]-RC[-1] -> -2
B360: 2 | C360: 0,1,7,1550000 | D360: 90 | F360: 2 | G360: =R[-1]C+RC[-1] -> 211 | H360: =MID(RC[-5],7,20)*1 -> 1550000 | I360: =SUM(R216C8:RC[-1]) -> 13122580 | J360: =VLOOKUP(ROUND(RC[-1],-2),C[13]:C[14],2,TRUE) -> 61 | L360: =ROUND(R216C12+(R381C12-R216C12)/R380C7^2*R[-1]C[-5]^2,0) -> 10756468 | M360: =ROUND(RC[-1]-R[-1]C[-1],-3) -> 205000 | N360: =ROUND(SUM(R[-4]C[-1]:RC[-1])/0.7*0.3,-3) -> 431000 | O360: =RC[-2]+RC[-1] -> 636000 | P360: =SUM(R216C15:RC[-1]) -> 15339700 | Q360: =ROUND(RC[-4]/VLOOKUP(RC[-13],C20:C22,2,FALSE),3) -> 0.01 | R360: =VLOOKUP(ROUND(RC[-2],-2),C23:C24,2,TRUE) -> 62 | S360: =RC[-9]-RC[-1] -> -1
B361: 2 | C361: 0,1,7,20000 | D361: 90 | F361: 2 | G361: =R[-1]C+RC[-1] -> 213 | H361: =MID(RC[-5],7,20)*1 -> 20000 | I361: =SUM(R216C8:RC[-1]) -> 13142580 | J361: =VLOOKUP(ROUND(RC[-1],-2),C[13]:C[14],2,TRUE) -> 61 | L361: =ROUND(R216C12+(R381C12-R216C12)/R380C7^2*R[-1]C[-5]^2,0) -> 10963308 | M361: =ROUND(RC[-1]-R[-1]C[-1],-3) -> 207000 | N361: 0 | O361: =RC[-2]+RC[-1] -> 207000 | P361: =SUM(R216C15:RC[-1]) -> 15546700 | Q361: =ROUND(RC[-4]/VLOOKUP(RC[-13],C20:C22,2,FALSE),3) -> 0.01 | R361: =VLOOKUP(ROUND(RC[-2],-2),C23:C24,2,TRUE) -> 62 | S361: =RC[-9]-RC[-1] -> -1
B362: 2 | C362: 0,1,7,30000 | D362: 95 | F362: 2 | G362: =R[-1]C+RC[-1] -> 215 | H362: =MID(RC[-5],7,20)*1 -> 30000 | I362: =SUM(R216C8:RC[-1]) -> 13172580 | J362: =VLOOKUP(ROUND(RC[-1],-2),C[13]:C[14],2,TRUE) -> 61 | L362: =ROUND(R216C12+(R381C12-R216C12)/R380C7^2*R[-1]C[-5]^2,0) -> 11172119 | M362: =ROUND(RC[-1]-R[-1]C[-1],-3) -> 209000 | N362: 0 | O362: =RC[-2]+RC[-1] -> 209000 | P362: =SUM(R216C15:RC[-1]) -> 15755700 | Q362: =ROUND(RC[-4]/VLOOKUP(RC[-13],C20:C22,2,FALSE),3) -> 0.006 | R362: =VLOOKUP(ROUND(RC[-2],-2),C23:C24,2,TRUE) -> 62 | S362: =RC[-9]-RC[-1] -> -1
B363: 2 | C363: 0,1,7,30000 | D363: 95 | F363: 2 | G363: =R[-1]C+RC[-1] -> 217 | H363: =MID(RC[-5],7,20)*1 -> 30000 | I363: =SUM(R216C8:RC[-1]) -> 13202580 | J363: =VLOOKUP(ROUND(RC[-1],-2),C[13]:C[14],2,TRUE) -> 61 | L363: =ROUND(R216C12+(R381C12-R216C12)/R380C7^2*R[-1]C[-5]^2,0) -> 11382900 | M363: =ROUND(RC[-1]-R[-1]C[-1],-3) -> 211000 | N363: 0 | O363: =RC[-2]+RC[-1] -> 211000 | P363: =SUM(R216C15:RC[-1]) -> 15966700 | Q363: =ROUND(RC[-4]/VLOOKUP(RC[-13],C20:C22,2,FALSE),3) -> 0.006 | R363: =VLOOKUP(ROUND(RC[-2],-2),C23:C24,2,TRUE) -> 63 | S363: =RC[-9]-RC[-1] -> -2
B364: 2 | C364: 0,1,7,1600000 | D364: 95 | F364: 2 | G364: =R[-1]C+RC[-1] -> 219 | H364: =MID(RC[-5],7,20)*1 -> 1600000 | I364: =SUM(R216C8:RC[-1]) -> 14802580 | J364: =VLOOKUP(ROUND(RC[-1],-2),C[13]:C[14],2,TRUE) -> 62 | L364: =ROUND(R216C12+(R381C12-R216C12)/R380C7^2*R[-1]C[-5]^2,0) -> 11595650 | M364: =ROUND(RC[-1]-R[-1]C[-1],-3) -> 213000 | N364: 0 | O364: =RC[-2]+RC[-1] -> 213000 | P364: =SUM(R216C15:RC[-1]) -> 16179700 | Q364: =ROUND(RC[-4]/VLOOKUP(RC[-13],C20:C22,2,FALSE),3) -> 0.007 | R364: =VLOOKUP(ROUND(RC[-2],-2),C23:C24,2,TRUE) -> 63 | S364: =RC[-9]-RC[-1] -> -1
B365: 2 | C365: 0,1,7,30000 | D365: 95 | F365: 2 | G365: =R[-1]C+RC[-1] -> 221 | H365: =MID(RC[-5],7,20)*1 -> 30000 | I365: =SUM(R216C8:RC[-1]) -> 14832580 | J365: =VLOOKUP(ROUND(RC[-1],-2),C[13]:C[14],2,TRUE) -> 62 | L365: =ROUND(R216C12+(R381C12-R216C12)/R380C7^2*R[-1]C[-5]^2,0) -> 11810371 | M365: =ROUND(RC[-1]-R[-1]C[-1],-3) -> 215000 | N365: =ROUND(SUM(R[-4]C[-1]:RC[-1])/0.7*0.3,-3) -> 452000 | O365: =RC[-2]+RC[-1] -> 667000 | P365: =SUM(R216C15:RC[-1]) -> 16846700 | Q365: =ROUND(RC[-4]/VLOOKUP(RC[-13],C20:C22,2,FALSE),3) -> 0.007 | R365: =VLOOKUP(ROUND(RC[-2],-2),C23:C24,2,TRUE) -> 63 | S365: =RC[-9]-RC[-1] -> -1
B366: 2 | C366: 0,1,7,30000 | D366: 95 | F366: 2 | G366: =R[-1]C+RC[-1] -> 223 | H366: =MID(RC[-5],7,20)*1 -> 30000 | I366: =SUM(R216C8:RC[-1]) -> 14862580 | J366: =VLOOKUP(ROUND(RC[-1],-2),C[13]:C[14],2,TRUE) -> 62 | L366: =ROUND(R216C12+(R381C12-R216C12)/R380C7^2*R[-1]C[-5]^2,0) -> 12027061 | M366: =ROUND(RC[-1]-R[-1]C[-1],-3) -> 217000 | N366: 0 | O366: =RC[-2]+RC[-1] -> 217000 | P366: =SUM(R216C15:RC[-1]) -> 17063700 | Q366: =ROUND(RC[-4]/VLOOKUP(RC[-13],C20:C22,2,FALSE),3) -> 0.007 | R366: =VLOOKUP(ROUND(RC[-2],-2),C23:C24,2,TRUE) -> 63 | S366: =RC[-9]-RC[-1] -> -1
B367: 2 | C367: 0,1,7,1650000 | D367: 95 | F367: 2 | G367: =R[-1]C+RC[-1] -> 225 | H367: =MID(RC[-5],7,20)*1 -> 1650000 | I367: =SUM(R216C8:RC[-1]) -> 16512580 | J367: =VLOOKUP(ROUND(RC[-1],-2),C[13]:C[14],2,TRUE) -> 63 | L367: =ROUND(R216C12+(R381C12-R216C12)/R380C7^2*R[-1]C[-5]^2,0) -> 12245721 | M367: =ROUND(RC[-1]-R[-1]C[-1],-3) -> 219000 | N367: 0 | O367: =RC[-2]+RC[-1] -> 219000 | P367: =SUM(R216C15:RC[-1]) -> 17282700 | Q367: =ROUND(RC[-4]/VLOOKUP(RC[-13],C20:C22,2,FALSE),3) -> 0.007 | R367: =VLOOKUP(ROUND(RC[-2],-2),C23:C24,2,TRUE) -> 63 | S367: =RC[-9]-RC[-1] -> 0
B368: 2 | C368: 0,1,7,30000 | D368: 95 | F368: 2 | G368: =R[-1]C+RC[-1] -> 227 | H368: =MID(RC[-5],7,20)*1 -> 30000 | I368: =SUM(R216C8:RC[-1]) -> 16542580 | J368: =VLOOKUP(ROUND(RC[-1],-2),C[13]:C[14],2,TRUE) -> 63 | L368: =ROUND(R216C12+(R381C12-R216C12)/R380C7^2*R[-1]C[-5]^2,0) -> 12466352 | M368: =ROUND(RC[-1]-R[-1]C[-1],-3) -> 221000 | N368: 0 | O368: =RC[-2]+RC[-1] -> 221000 | P368: =SUM(R216C15:RC[-1]) -> 17503700 | Q368: =ROUND(RC[-4]/VLOOKUP(RC[-13],C20:C22,2,FALSE),3) -> 0.007 | R368: =VLOOKUP(ROUND(RC[-2],-2),C23:C24,2,TRUE) -> 63 | S368: =RC[-9]-RC[-1] -> 0
B369: 2 | C369: 0,1,7,1700000 | D369: 95 | F369: 2 | G369: =R[-1]C+RC[-1] -> 229 | H369: =MID(RC[-5],7,20)*1 -> 1700000 | I369: =SUM(R216C8:RC[-1]) -> 18242580 | J369: =VLOOKUP(ROUND(RC[-1],-2),C[13]:C[14],2,TRUE) -> 64 | L369: =ROUND(R216C12+(R381C12-R216C12)/R380C7^2*R[-1]C[-5]^2,0) -> 12688952 | M369: =ROUND(RC[-1]-R[-1]C[-1],-3) -> 223000 | N369: 0 | O369: =RC[-2]+RC[-1] -> 223000 | P369: =SUM(R216C15:RC[-1]) -> 17726700 | Q369: =ROUND(RC[-4]/VLOOKUP(RC[-13],C20:C22,2,FALSE),3) -> 0.007 | R369: =VLOOKUP(ROUND(RC[-2],-2),C23:C24,2,TRUE) -> 64 | S369: =RC[-9]-RC[-1] -> 0
B370: 2 | C370: 0,1,7,30000 | D370: 95 | F370: 2 | G370: =R[-1]C+RC[-1] -> 231 | H370: =MID(RC[-5],7,20)*1 -> 30000 | I370: =SUM(R216C8:RC[-1]) -> 18272580 | J370: =VLOOKUP(ROUND(RC[-1],-2),C[13]:C[14],2,TRUE) -> 64 | L370: =ROUND(R216C12+(R381C12-R216C12)/R380C7^2*R[-1]C[-5]^2,0) -> 12913522 | M370: =ROUND(RC[-1]-R[-1]C[-1],-3) -> 225000 | N370: =ROUND(SUM(R[-4]C[-1]:RC[-1])/0.7*0.3,-3) -> 474000 | O370: =RC[-2]+RC[-1] -> 699000 | P370: =SUM(R216C15:RC[-1]) -> 18425700 | Q370: =ROUND(RC[-4]/VLOOKUP(RC[-13],C20:C22,2,FALSE),3) -> 0.007 | R370: =VLOOKUP(ROUND(RC[-2],-2),C23:C24,2,TRUE) -> 64 | S370: =RC[-9]-RC[-1] -> 0
B371: 2 | C371: 0,1,7,1750000 | D371: 95 | F371: 2 | G371: =R[-1]C+RC[-1] -> 233 | H371: =MID(RC[-5],7,20)*1 -> 1750000 | I371: =SUM(R216C8:RC[-1]) -> 20022580 | J371: =VLOOKUP(ROUND(RC[-1],-2),C[13]:C[14],2,TRUE) -> 65 | L371: =ROUND(R216C12+(R381C12-R216C12)/R380C7^2*R[-1]C[-5]^2,0) -> 13140062 | M371: =ROUND(RC[-1]-R[-1]C[-1],-3) -> 227000 | N371: 0 | O371: =RC[-2]+RC[-1] -> 227000 | P371: =SUM(R216C15:RC[-1]) -> 18652700 | Q371: =ROUND(RC[-4]/VLOOKUP(RC[-13],C20:C22,2,FALSE),3) -> 0.007 | R371: =VLOOKUP(ROUND(RC[-2],-2),C23:C24,2,TRUE) -> 64 | S371: =RC[-9]-RC[-1] -> 1
B372: 2 | C372: 0,1,7,30000 | D372: 95 | F372: 2 | G372: =R[-1]C+RC[-1] -> 235 | H372: =MID(RC[-5],7,20)*1 -> 30000 | I372: =SUM(R216C8:RC[-1]) -> 20052580 | J372: =VLOOKUP(ROUND(RC[-1],-2),C[13]:C[14],2,TRUE) -> 65 | L372: =ROUND(R216C12+(R381C12-R216C12)/R380C7^2*R[-1]C[-5]^2,0) -> 13368571 | M372: =ROUND(RC[-1]-R[-1]C[-1],-3) -> 229000 | N372: 0 | O372: =RC[-2]+RC[-1] -> 229000 | P372: =SUM(R216C15:RC[-1]) -> 18881700 | Q372: =ROUND(RC[-4]/VLOOKUP(RC[-13],C20:C22,2,FALSE),3) -> 0.007 | R372: =VLOOKUP(ROUND(RC[-2],-2),C23:C24,2,TRUE) -> 64 | S372: =RC[-9]-RC[-1] -> 1
B373: 2 | C373: 0,1,7,1800000 | D373: 95 | F373: 2 | G373: =R[-1]C+RC[-1] -> 237 | H373: =MID(RC[-5],7,20)*1 -> 1800000 | I373: =SUM(R216C8:RC[-1]) -> 21852580 | J373: =VLOOKUP(ROUND(RC[-1],-2),C[13]:C[14],2,TRUE) -> 66 | L373: =ROUND(R216C12+(R381C12-R216C12)/R380C7^2*R[-1]C[-5]^2,0) -> 13599051 | M373: =ROUND(RC[-1]-R[-1]C[-1],-3) -> 230000 | N373: 0 | O373: =RC[-2]+RC[-1] -> 230000 | P373: =SUM(R216C15:RC[-1]) -> 19111700 | Q373: =ROUND(RC[-4]/VLOOKUP(RC[-13],C20:C22,2,FALSE),3) -> 0.007 | R373: =VLOOKUP(ROUND(RC[-2],-2),C23:C24,2,TRUE) -> 64 | S373: =RC[-9]-RC[-1] -> 2
B374: 2 | C374: 0,1,7,30000 | D374: 95 | F374: 2 | G374: =R[-1]C+RC[-1] -> 239 | H374: =MID(RC[-5],7,20)*1 -> 30000 | I374: =SUM(R216C8:RC[-1]) -> 21882580 | J374: =VLOOKUP(ROUND(RC[-1],-2),C[13]:C[14],2,TRUE) -> 66 | L374: =ROUND(R216C12+(R381C12-R216C12)/R380C7^2*R[-1]C[-5]^2,0) -> 13831501 | M374: =ROUND(RC[-1]-R[-1]C[-1],-3) -> 232000 | N374: 0 | O374: =RC[-2]+RC[-1] -> 232000 | P374: =SUM(R216C15:RC[-1]) -> 19343700 | Q374: =ROUND(RC[-4]/VLOOKUP(RC[-13],C20:C22,2,FALSE),3) -> 0.007 | R374: =VLOOKUP(ROUND(RC[-2],-2),C23:C24,2,TRUE) -> 64 | S374: =RC[-9]-RC[-1] -> 2
B375: 2 | C375: 0,1,7,40000 | D375: 100 | F375: 2 | G375: =R[-1]C+RC[-1] -> 241 | H375: =MID(RC[-5],7,20)*1 -> 40000 | I375: =SUM(R216C8:RC[-1]) -> 21922580 | J375: =VLOOKUP(ROUND(RC[-1],-2),C[13]:C[14],2,TRUE) -> 66 | L375: =ROUND(R216C12+(R381C12-R216C12)/R380C7^2*R[-1]C[-5]^2,0) -> 14065920 | M375: =ROUND(RC[-1]-R[-1]C[-1],-3) -> 234000 | N375: =ROUND(SUM(R[-4]C[-1]:RC[-1])/0.7*0.3,-3) -> 494000 | O375: =RC[-2]+RC[-1] -> 728000 | P375: =SUM(R216C15:RC[-1]) -> 20071700 | Q375: =ROUND(RC[-4]/VLOOKUP(RC[-13],C20:C22,2,FALSE),3) -> 0.004 | R375: =VLOOKUP(ROUND(RC[-2],-2),C23:C24,2,TRUE) -> 65 | S375: =RC[-9]-RC[-1] -> 1
B376: 2 | C376: 0,1,7,40000 | D376: 100 | F376: 2 | G376: =R[-1]C+RC[-1] -> 243 | H376: =MID(RC[-5],7,20)*1 -> 40000 | I376: =SUM(R216C8:RC[-1]) -> 21962580 | J376: =VLOOKUP(ROUND(RC[-1],-2),C[13]:C[14],2,TRUE) -> 66 | L376: =ROUND(R216C12+(R381C12-R216C12)/R380C7^2*R[-1]C[-5]^2,0) -> 14302310 | M376: =ROUND(RC[-1]-R[-1]C[-1],-3) -> 236000 | N376: 0 | O376: =RC[-2]+RC[-1] -> 236000 | P376: =SUM(R216C15:RC[-1]) -> 20307700 | Q376: =ROUND(RC[-4]/VLOOKUP(RC[-13],C20:C22,2,FALSE),3) -> 0.004 | R376: =VLOOKUP(ROUND(RC[-2],-2),C23:C24,2,TRUE) -> 65 | S376: =RC[-9]-RC[-1] -> 1
B377: 2 | C377: 0,1,7,40000 | D377: 100 | F377: 2 | G377: =R[-1]C+RC[-1] -> 245 | H377: =MID(RC[-5],7,20)*1 -> 40000 | I377: =SUM(R216C8:RC[-1]) -> 22002580 | J377: =VLOOKUP(ROUND(RC[-1],-2),C[13]:C[14],2,TRUE) -> 66 | L377: =ROUND(R216C12+(R381C12-R216C12)/R380C7^2*R[-1]C[-5]^2,0) -> 14540669 | M377: =ROUND(RC[-1]-R[-1]C[-1],-3) -> 238000 | N377: 0 | O377: =RC[-2]+RC[-1] -> 238000 | P377: =SUM(R216C15:RC[-1]) -> 20545700 | Q377: =ROUND(RC[-4]/VLOOKUP(RC[-13],C20:C22,2,FALSE),3) -> 0.004 | R377: =VLOOKUP(ROUND(RC[-2],-2),C23:C24,2,TRUE) -> 65 | S377: =RC[-9]-RC[-1] -> 1
B378: 2 | C378: 0,1,7,40000 | D378: 100 | F378: 2 | G378: =R[-1]C+RC[-1] -> 247 | H378: =MID(RC[-5],7,20)*1 -> 40000 | I378: =SUM(R216C8:RC[-1]) -> 22042580 | J378: =VLOOKUP(ROUND(RC[-1],-2),C[13]:C[14],2,TRUE) -> 66 | L378: =ROUND(R216C12+(R381C12-R216C12)/R380C7^2*R[-1]C[-5]^2,0) -> 14780999 | M378: =ROUND(RC[-1]-R[-1]C[-1],-3) -> 240000 | N378: 0 | O378: =RC[-2]+RC[-1] -> 240000 | P378: =SUM(R216C15:RC[-1]) -> 20785700 | Q378: =ROUND(RC[-4]/VLOOKUP(RC[-13],C20:C22,2,FALSE),3) -> 0.004 | R378: =VLOOKUP(ROUND(RC[-2],-2),C23:C24,2,TRUE) -> 65 | S378: =RC[-9]-RC[-1] -> 1
B379: 2 | C379: 0,1,7,40000 | D379: 100 | F379: 2 | G379: =R[-1]C+RC[-1] -> 249 | H379: =MID(RC[-5],7,20)*1 -> 40000 | I379: =SUM(R216C8:RC[-1]) -> 22082580 | J379: =VLOOKUP(ROUND(RC[-1],-2),C[13]:C[14],2,TRUE) -> 66 | L379: =ROUND(R216C12+(R381C12-R216C12)/R380C7^2*R[-1]C[-5]^2,0) -> 15023298 | M379: =ROUND(RC[-1]-R[-1]C[-1],-3) -> 242000 | N379: 0 | O379: =RC[-2]+RC[-1] -> 242000 | P379: =SUM(R216C15:RC[-1]) -> 21027700 | Q379: =ROUND(RC[-4]/VLOOKUP(RC[-13],C20:C22,2,FALSE),3) -> 0.004 | R379: =VLOOKUP(ROUND(RC[-2],-2),C23:C24,2,TRUE) -> 65 | S379: =RC[-9]-RC[-1] -> 1
B380: 2 | C380: 0,1,7,40000 | D380: 100 | F380: 2 | G380: =R[-1]C+RC[-1] -> 251 | H380: =MID(RC[-5],7,20)*1 -> 40000 | I380: =SUM(R216C8:RC[-1]) -> 22122580 | J380: =VLOOKUP(ROUND(RC[-1],-2),C[13]:C[14],2,TRUE) -> 66 | L380: =ROUND(R216C12+(R381C12-R216C12)/R380C7^2*R[-1]C[-5]^2,0) -> 15267567 | M380: =ROUND(RC[-1]-R[-1]C[-1],-3) -> 244000 | N380: =ROUND(SUM(R[-4]C[-1]:RC[-1])/0.7*0.3,-3) -> 514000 | O380: =RC[-2]+RC[-1] -> 758000 | P380: =SUM(R216C15:RC[-1]) -> 21785700 | Q380: =ROUND(RC[-4]/VLOOKUP(RC[-13],C20:C22,2,FALSE),3) -> 0.004 | R380: =VLOOKUP(ROUND(RC[-2],-2),C23:C24,2,TRUE) -> 66 | S380: =RC[-9]-RC[-1] -> 0
B381: 2 | C381: 0,1,7,40000 | D381: 100 | F381: 2 | G381: =R[-1]C+RC[-1] -> 253 | H381: =MID(RC[-5],7,20)*1 -> 40000 | I381: =SUM(R216C8:RC[-1]) -> 22162580 | J381: =VLOOKUP(ROUND(RC[-1],-2),C[13]:C[14],2,TRUE) -> 66 | L381: =ROUND(RC[-3]*0.7,0) -> 15513806 | M381: =ROUND(RC[-1]-R[-1]C[-1],-3) -> 246000 | N381: 0 | O381: =RC[-2]+RC[-1] -> 246000 | P381: =SUM(R216C15:RC[-1]) -> 22031700 | Q381: =ROUND(RC[-4]/VLOOKUP(RC[-13],C20:C22,2,FALSE),3) -> 0.004 | R381: =VLOOKUP(ROUND(RC[-2],-2),C23:C24,2,TRUE) -> 66 | S381: =RC[-9]-RC[-1] -> 0

Sheet: Sheet4
E2: 0,1,7,
X4: 最终 | Z4: 最终 | AF4: ;
E5: 0,1,7,500 | F5: 500 | G5: =R2C5&RC[-1] -> 0,1,7,500 | H5: 0,1,8,250 | I5: 0,1,4,375 | X5: 0,1,7,500;0,1,8,250;0,1,4,375; | Z5: =RC[3]&RC[4]&RC[5]&RC[6]&RC[7]&RC[8]&RC[9]&RC[10]&RC[11]&RC[12]&RC[13]&RC[14]&RC[15]&RC[16]&RC[17]&RC[18]&RC[19] -> 0,1,7,500;0,1,8,250;0,1,4,375;qqqqqqqqqqqqqq | AC5: =IF(RC[-22]<>0,RC[-22]&R4C32,"q") -> 0,1,7,500; | AD5: =IF(RC[-22]<>0,RC[-22]&R4C32,"q") -> 0,1,8,250; | AE5: =IF(RC[-22]<>0,RC[-22]&R4C32,"q") -> 0,1,4,375; | AF5: =IF(RC[-22]<>0,RC[-22]&R4C32,"q") -> q | AG5: =IF(RC[-22]<>0,RC[-22]&R4C32,"q") -> q | AH5: =IF(RC[-22]<>0,RC[-22]&R4C32,"q") -> q | AI5: =IF(RC[-22]<>0,RC[-22]&R4C32,"q") -> q | AJ5: =IF(RC[-22]<>0,RC[-22]&R4C32,"q") -> q | AK5: =IF(RC[-22]<>0,RC[-22]&R4C32,"q") -> q | AL5: =IF(RC[-22]<>0,RC[-22]&R4C32,"q") -> q | AM5: =IF(RC[-22]<>0,RC[-22]&R4C32,"q") -> q | AN5: =IF(RC[-22]<>0,RC[-22]&R4C32,"q") -> q | AO5: =IF(RC[-22]<>0,RC[-22]&R4C32,"q") -> q | AP5: =IF(RC[-22]<>0,RC[-22]&R4C32,"q") -> q | AQ5: =IF(RC[-22]<>0,RC[-22]&R4C32,"q") -> q | AR5: =IF(RC[-22]<>0,RC[-22]&R4C32,"q") -> q | AS5: =IF(RC[-22]<>0,RC[-22]&R4C32,"q") -> q | AT5: =IF(RC[-22]<>0,RC[-22]&R4C32,"q") -> 0,1,7,500;0,1,8,250;0,1,4,375;; | AU5: =IF(RC[-22]<>0,RC[-22]&R4C32,"q") -> q | AV5: =IF(RC[-22]<>0,RC[-22]&R4C32,"q") -> 0,1,7,500;0,1,8,250;0,1,4,375;qqqqqqqqqqqqqq;
E6: 0,1,7,500 | F6: 200 | G6: =R2C5&RC[-1] -> 0,1,7,200 | H6: 0,1,8,250 | I6: 0,1,4,375 | X6: 0,1,7,200;0,1,8,250;0,1,4,375; | Z6: =RC[3]&RC[4]&RC[5]&RC[6]&RC[7]&RC[8]&RC[9]&RC[10]&RC[11]&RC[12]&RC[13]&RC[14]&RC[15]&RC[16]&RC[17]&RC[18]&RC[19] -> 0,1,7,200;0,1,8,250;0,1,4,375;qqqqqqqqqqqqqq | AC6: =IF(RC[-22]<>0,RC[-22]&R4C32,"q") -> 0,1,7,200; | AD6: =IF(RC[-22]<>0,RC[-22]&R4C32,"q") -> 0,1,8,250; | AE6: =IF(RC[-22]<>0,RC[-22]&R4C32,"q") -> 0,1,4,375; | AF6: =IF(RC[-22]<>0,RC[-22]&R4C32,"q") -> q | AG6: =IF(RC[-22]<>0,RC[-22]&R4C32,"q") -> q | AH6: =IF(RC[-22]<>0,RC[-22]&R4C32,"q") -> q | AI6: =IF(RC[-22]<>0,RC[-22]&R4C32,"q") -> q | AJ6: =IF(RC[-22]<>0,RC[-22]&R4C32,"q") -> q | AK6: =IF(RC[-22]<>0,RC[-22]&R4C32,"q") -> q | AL6: =IF(RC[-22]<>0,RC[-22]&R4C32,"q") -> q | AM6: =IF(RC[-22]<>0,RC[-22]&R4C32,"q") -> q | AN6: =IF(RC[-22]<>0,RC[-22]&R4C32,"q") -> q | AO6: =IF(RC[-22]<>0,RC[-22]&R4C32,"q") -> q | AP6: =IF(RC[-22]<>0,RC[-22]&R4C32,"q") -> q | AQ6: =IF(RC[-22]<>0,RC[-22]&R4C32,"q") -> q | AR6: =IF(RC[-22]<>0,RC[-22]&R4C32,"q") -> q | AS6: =IF(RC[-22]<>0,RC[-22]&R4C32,"q") -> q | AT6: =IF(RC[-22]<>0,RC[-22]&R4C32,"q") -> 0,1,7,200;0,1,8,250;0,1,4,375;; | AU6: =IF(RC[-22]<>0,RC[-22]&R4C32,"q") -> q | AV6: =IF(RC[-22]<>0,RC[-22]&R4C32,"q") -> 0,1,7,200;0,1,8,250;0,1,4,375;qqqqqqqqqqqqqq;
E7: 0,1,7,3000 | F7: 1000 | G7: =R2C5&RC[-1] -> 0,1,7,1000 | H7: 0,1,8,1500 | I7: 0,1,4,8000 | X7: 0,1,7,1000;0,1,8,1500;0,1,4,8000; | Z7: =RC[3]&RC[4]&RC[5]&RC[6]&RC[7]&RC[8]&RC[9]&RC[10]&RC[11]&RC[12]&RC[13]&RC[14]&RC[15]&RC[16]&RC[17]&RC[18]&RC[19] -> 0,1,7,1000;0,1,8,1500;0,1,4,8000;qqqqqqqqqqqqqq | AC7: =IF(RC[-22]<>0,RC[-22]&R4C32,"q") -> 0,1,7,1000; | AD7: =IF(RC[-22]<>0,RC[-22]&R4C32,"q") -> 0,1,8,1500; | AE7: =IF(RC[-22]<>0,RC[-22]&R4C32,"q") -> 0,1,4,8000; | AF7: =IF(RC[-22]<>0,RC[-22]&R4C32,"q") -> q | AG7: =IF(RC[-22]<>0,RC[-22]&R4C32,"q") -> q | AH7: =IF(RC[-22]<>0,RC[-22]&R4C32,"q") -> q | AI7: =IF(RC[-22]<>0,RC[-22]&R4C32,"q") -> q | AJ7: =IF(RC[-22]<>0,RC[-22]&R4C32,"q") -> q | AK7: =IF(RC[-22]<>0,RC[-22]&R4C32,"q") -> q | AL7: =IF(RC[-22]<>0,RC[-22]&R4C32,"q") -> q | AM7: =IF(RC[-22]<>0,RC[-22]&R4C32,"q") -> q | AN7: =IF(RC[-22]<>0,RC[-22]&R4C32,"q") -> q | AO7: =IF(RC[-22]<>0,RC[-22]&R4C32,"q") -> q | AP7: =IF(RC[-22]<>0,RC[-22]&R4C32,"q") -> q | AQ7: =IF(RC[-22]<>0,RC[-22]&R4C32,"q") -> q | AR7: =IF(RC[-22]<>0,RC[-22]&R4C32,"q") -> q | AS7: =IF(RC[-22]<>0,RC[-22]&R4C32,"q") -> q | AT7: =IF(RC[-22]<>0,RC[-22]&R4C32,"q") -> 0,1,7,1000;0,1,8,1500;0,1,4,8000;; | AU7: =IF(RC[-22]<>0,RC[-22]&R4C32,"q") -> q | AV7: =IF(RC[-22]<>0,RC[-22]&R4C32,"q") -> 0,1,7,1000;0,1,8,1500;0,1,4,8000;qqqqqqqqqqqqqq;
E8: 0,1,7,500 | F8: 1000 | G8: =R2C5&RC[-1] -> 0,1,7,1000 | H8: 0,1,8,250 | I8: 0,1,4,375 | X8: 0,1,7,1000;0,1,8,250;0,1,4,375; | Z8: =RC[3]&RC[4]&RC[5]&RC[6]&RC[7]&RC[8]&RC[9]&RC[10]&RC[11]&RC[12]&RC[13]&RC[14]&RC[15]&RC[16]&RC[17]&RC[18]&RC[19] -> 0,1,7,1000;0,1,8,250;0,1,4,375;qqqqqqqqqqqqqq | AC8: =IF(RC[-22]<>0,RC[-22]&R4C32,"q") -> 0,1,7,1000; | AD8: =IF(RC[-22]<>0,RC[-22]&R4C32,"q") -> 0,1,8,250; | AE8: =IF(RC[-22]<>0,RC[-22]&R4C32,"q") -> 0,1,4,375; | AF8: =IF(RC[-22]<>0,RC[-22]&R4C32,"q") -> q | AG8: =IF(RC[-22]<>0,RC[-22]&R4C32,"q") -> q | AH8: =IF(RC[-22]<>0,RC[-22]&R4C32,"q") -> q | AI8: =IF(RC[-22]<>0,RC[-22]&R4C32,"q") -> q | AJ8: =IF(RC[-22]<>0,RC[-22]&R4C32,"q") -> q | AK8: =IF(RC[-22]<>0,RC[-22]&R4C32,"q") -> q | AL8: =IF(RC[-22]<>0,RC[-22]&R4C32,"q") -> q | AM8: =IF(RC[-22]<>0,RC[-22]&R4C32,"q") -> q | AN8: =IF(RC[-22]<>0,RC[-22]&R4C32,"q") -> q | AO8: =IF(RC[-22]<>0,RC[-22]&R4C32,"q") -> q | AP8: =IF(RC[-22]<>0,RC[-22]&R4C32,"q") -> q | AQ8: =IF(RC[-22]<>0,RC[-22]&R4C32,"q") -> q | AR8: =IF(RC[-22]<>0,RC[-22]&R4C32,"q") -> q | AS8: =IF(RC[-22]<>0,RC[-22]&R4C32,"q") -> q | AT8: =IF(RC[-22]<>0,RC[-22]&R4C32,"q") -> 0,1,7,1000;0,1,8,250;0,1,4,375;; | AU8: =IF(RC[-22]<>0,RC[-22]&R4C32,"q") -> q | AV8: =IF(RC[-22]<>0,RC[-22]&R4C32,"q") -> 0,1,7,1000;0,1,8,250;0,1,4,375;qqqqqqqqqqqqqq;
E9: 0,1,7,500 | F9: 3000 | G9: =R2C5&RC[-1] -> 0,1,7,3000 | H9: 0,1,8,250 | I9: 0,1,4,375 | X9: 0,1,7,4000;0,1,8,250;0,1,4,375; | Z9: =RC[3]&RC[4]&RC[5]&RC[6]&RC[7]&RC[8]&RC[9]&RC[10]&RC[11]&RC[12]&RC[13]&RC[14]&RC[15]&RC[16]&RC[17]&RC[18]&RC[19] -> 0,1,7,3000;0,1,8,250;0,1,4,375;qqqqqqqqqqqqqq | AC9: =IF(RC[-22]<>0,RC[-22]&R4C32,"q") -> 0,1,7,3000; | AD9: =IF(RC[-22]<>0,RC[-22]&R4C32,"q") -> 0,1,8,250; | AE9: =IF(RC[-22]<>0,RC[-22]&R4C32,"q") -> 0,1,4,375; | AF9: =IF(RC[-22]<>0,RC[-22]&R4C32,"q") -> q | AG9: =IF(RC[-22]<>0,RC[-22]&R4C32,"q") -> q | AH9: =IF(RC[-22]<>0,RC[-22]&R4C32,"q") -> q | AI9: =IF(RC[-22]<>0,RC[-22]&R4C32,"q") -> q | AJ9: =IF(RC[-22]<>0,RC[-22]&R4C32,"q") -> q | AK9: =IF(RC[-22]<>0,RC[-22]&R4C32,"q") -> q | AL9: =IF(RC[-22]<>0,RC[-22]&R4C32,"q") -> q | AM9: =IF(RC[-22]<>0,RC[-22]&R4C32,"q") -> q | AN9: =IF(RC[-22]<>0,RC[-22]&R4C32,"q") -> q | AO9: =IF(RC[-22]<>0,RC[-22]&R4C32,"q") -> q | AP9: =IF(RC[-22]<>0,RC[-22]&R4C32,"q") -> q | AQ9: =IF(RC[-22]<>0,RC[-22]&R4C32,"q") -> q | AR9: =IF(RC[-22]<>0,RC[-22]&R4C32,"q") -> q | AS9: =IF(RC[-22]<>0,RC[-22]&R4C32,"q") -> q | AT9: =IF(RC[-22]<>0,RC[-22]&R4C32,"q") -> 0,1,7,4000;0,1,8,250;0,1,4,375;; | AU9: =IF(RC[-22]<>0,RC[-22]&R4C32,"q") -> q | AV9: =IF(RC[-22]<>0,RC[-22]&R4C32,"q") -> 0,1,7,3000;0,1,8,250;0,1,4,375;qqqqqqqqqqqqqq;
E10: 0,1,7,4000 | F10: 2000 | G10: =R2C5&RC[-1] -> 0,1,7,2000 | H10: 0,1,8,2000 | I10: 0,1,4,9000 | X10: 0,1,7,2000;0,1,8,2000;0,1,4,9000; | Z10: =RC[3]&RC[4]&RC[5]&RC[6]&RC[7]&RC[8]&RC[9]&RC[10]&RC[11]&RC[12]&RC[13]&RC[14]&RC[15]&RC[16]&RC[17]&RC[18]&RC[19] -> 0,1,7,2000;0,1,8,2000;0,1,4,9000;qqqqqqqqqqqqqq | AC10: =IF(RC[-22]<>0,RC[-22]&R4C32,"q") -> 0,1,7,2000; | AD10: =IF(RC[-22]<>0,RC[-22]&R4C32,"q") -> 0,1,8,2000; | AE10: =IF(RC[-22]<>0,RC[-22]&R4C32,"q") -> 0,1,4,9000; | AF10: =IF(RC[-22]<>0,RC[-22]&R4C32,"q") -> q | AG10: =IF(RC[-22]<>0,RC[-22]&R4C32,"q") -> q | AH10: =IF(RC[-22]<>0,RC[-22]&R4C32,"q") -> q | AI10: =IF(RC[-22]<>0,RC[-22]&R4C32,"q") -> q | AJ10: =IF(RC[-22]<>0,RC[-22]&R4C32,"q") -> q | AK10: =IF(RC[-22]<>0,RC[-22]&R4C32,"q") -> q | AL10: =IF(RC[-22]<>0,RC[-22]&R4C32,"q") -> q | AM10: =IF(RC[-22]<>0,RC[-22]&R4C32,"q") -> q | AN10: =IF(RC[-22]<>0,RC[-22]&R4C32,"q") -> q | AO10: =IF(RC[-22]<>0,RC[-22]&R4C32,"q") -> q | AP10: =IF(RC[-22]<>0,RC[-22]&R4C32,"q") -> q | AQ10: =IF(RC[-22]<>0,RC[-22]&R4C32,"q") -> q | AR10: =IF(RC[-22]<>0,RC[-22]&R4C32,"q") -> q | AS10: =IF(RC[-22]<>0,RC[-22]&R4C32,"q") -> q | AT10: =IF(RC[-22]<>0,RC[-22]&R4C32,"q") -> 0,1,7,2000;0,1,8,2000;0,1,4,9000;; | AU10: =IF(RC[-22]<>0,RC[-22]&R4C32,"q") -> q | AV10: =IF(RC[-22]<>0,RC[-22]&R4C32,"q") -> 0,1,7,2000;0,1,8,2000;0,1,4,9000;qqqqqqqqqqqqqq;
E11: 0,1,7,500 | F11: 3000 | G11: =R2C5&RC[-1] -> 0,1,7,3000 | H11: 0,1,8,250 | I11: 0,1,4,375 | X11: 0,1,7,3000;0,1,8,250;0,1,4,375; | Z11: =RC[3]&RC[4]&RC[5]&RC[6]&RC[7]&RC[8]&RC[9]&RC[10]&RC[11]&RC[12]&RC[13]&RC[14]&RC[15]&RC[16]&RC[17]&RC[18]&RC[19] -> 0,1,7,3000;0,1,8,250;0,1,4,375;qqqqqqqqqqqqqq | AC11: =IF(RC[-22]<>0,RC[-22]&R4C32,"q") -> 0,1,7,3000; | AD11: =IF(RC[-22]<>0,RC[-22]&R4C32,"q") -> 0,1,8,250; | AE11: =IF(RC[-22]<>0,RC[-22]&R4C32,"q") -> 0,1,4,375; | AF11: =IF(RC[-22]<>0,RC[-22]&R4C32,"q") -> q | AG11: =IF(RC[-22]<>0,RC[-22]&R4C32,"q") -> q | AH11: =IF(RC[-22]<>0,RC[-22]&R4C32,"q") -> q | AI11: =IF(RC[-22]<>0,RC[-22]&R4C32,"q") -> q | AJ11: =IF(RC[-22]<>0,RC[-22]&R4C32,"q") -> q | AK11: =IF(RC[-22]<>0,RC[-22]&R4C32,"q") -> q | AL11: =IF(RC[-22]<>0,RC[-22]&R4C32,"q") -> q | AM11: =IF(RC[-22]<>0,RC[-22]&R4C32,"q") -> q | AN11: =IF(RC[-22]<>0,RC[-22]&R4C32,"q") -> q | AO11: =IF(RC[-22]<>0,RC[-22]&R4C32,"q") -> q | AP11: =IF(RC[-22]<>0,RC[-22]&R4C32,"q") -> q | AQ11: =IF(RC[-22]<>0,RC[-22]&R4C32,"q") -> q | AR11: =IF(RC[-22]<>0,RC[-22]&R4C32,"q") -> q | AS11: =IF(RC[-22]<>0,RC[-22]&R4C32,"q") -> q | AT11: =IF(RC[-22]<>0,RC[-22]&R4C32,"q") -> 0,1,7,3000;0,1,8,250;0,1,4,375;; | AU11: =IF(RC[-22]<>0,RC[-22]&R4C32,"q") -> q | AV11: =IF(RC[-22]<>0,RC[-22]&R4C32,"q") -> 0,1,7,3000;0,1,8,250;0,1,4,375;qqqqqqqqqqqqqq;
E12: 0,1,7,500 | F12: 3000 | G12: =R2C5&RC[-1] -> 0,1,7,3000 | H12: 0,1,8,250 | I12: 0,1,4,375 | X12: 0,1,7,3000;0,1,8,250;0,1,4,375; | Z12: =RC[3]&RC[4]&RC[5]&RC[6]&RC[7]&RC[8]&RC[9]&RC[10]&RC[11]&RC[12]&RC[13]&RC[14]&RC[15]&RC[16]&RC[17]&RC[18]&RC[19] -> 0,1,7,3000;0,1,8,250;0,1,4,375;qqqqqqqqqqqqqq | AC12: =IF(RC[-22]<>0,RC[-22]&R4C32,"q") -> 0,1,7,3000; | AD12: =IF(RC[-22]<>0,RC[-22]&R4C32,"q") -> 0,1,8,250; | AE12: =IF(RC[-22]<>0,RC[-22]&R4C32,"q") -> 0,1,4,375; | AF12: =IF(RC[-22]<>0,RC[-22]&R4C32,"q") -> q | AG12: =IF(RC[-22]<>0,RC[-22]&R4C32,"q") -> q | AH12: =IF(RC[-22]<>0,RC[-22]&R4C32,"q") -> q | AI12: =IF(RC[-22]<>0,RC[-22]&R4C32,"q") -> q | AJ12: =IF(RC[-22]<>0,RC[-22]&R4C32,"q") -> q | AK12: =IF(RC[-22]<>0,RC[-22]&R4C32,"q") -> q | AL12: =IF(RC[-22]<>0,RC[-22]&R4C32,"q") -> q | AM12: =IF(RC[-22]<>0,RC[-22]&R4C32,"q") -> q | AN12: =IF(RC[-22]<>0,RC[-22]&R4C32,"q") -> q | AO12: =IF(RC[-22]<>0,RC[-22]&R4C32,"q") -> q | AP12: =IF(RC[-22]<>0,RC[-22]&R4C32,"q") -> q | AQ12: =IF(RC[-22]<>0,RC[-22]&R4C32,"q") -> q | AR12: =IF(RC[-22]<>0,RC[-22]&R4C32,"q") -> q | AS12: =IF(RC[-22]<>0,RC[-22]&R4C32,"q") -> q | AT12: =IF(RC[-22]<>0,RC[-22]&R4C32,"q") -> 0,1,7,3000;0,1,8,250;0,1,4,375;; | AU12: =IF(RC[-22]<>0,RC[-22]&R4C32,"q") -> q | AV12: =IF(RC[-22]<>0,RC[-22]&R4C32,"q") -> 0,1,7,3000;0,1,8,250;0,1,4,375;qqqqqqqqqqqqqq;
E13: 0,1,7,5500 | F13: 4000 | G13: =R2C5&RC[-1] -> 0,1,7,4000 | H13: 0,1,8,2750 | I13: 0,1,4,9000 | X13: 0,1,7,4000;0,1,8,2750;0,1,4,9000; | Z13: =RC[3]&RC[4]&RC[5]&RC[6]&RC[7]&RC[8]&RC[9]&RC[10]&RC[11]&RC[12]&RC[13]&RC[14]&RC[15]&RC[16]&RC[17]&RC[18]&RC[19] -> 0,1,7,4000;0,1,8,2750;0,1,4,9000;qqqqqqqqqqqqqq | AC13: =IF(RC[-22]<>0,RC[-22]&R4C32,"q") -> 0,1,7,4000; | AD13: =IF(RC[-22]<>0,RC[-22]&R4C32,"q") -> 0,1,8,2750; | AE13: =IF(RC[-22]<>0,RC[-22]&R4C32,"q") -> 0,1,4,9000; | AF13: =IF(RC[-22]<>0,RC[-22]&R4C32,"q") -> q | AG13: =IF(RC[-22]<>0,RC[-22]&R4C32,"q") -> q | AH13: =IF(RC[-22]<>0,RC[-22]&R4C32,"q") -> q | AI13: =IF(RC[-22]<>0,RC[-22]&R4C32,"q") -> q | AJ13: =IF(RC[-22]<>0,RC[-22]&R4C32,"q") -> q | AK13: =IF(RC[-22]<>0,RC[-22]&R4C32,"q") -> q | AL13: =IF(RC[-22]<>0,RC[-22]&R4C32,"q") -> q | AM13: =IF(RC[-22]<>0,RC[-22]&R4C32,"q") -> q | AN13: =IF(RC[-22]<>0,RC[-22]&R4C32,"q") -> q | AO13: =IF(RC[-22]<>0,RC[-22]&R4C32,"q") -> q | AP13: =IF(RC[-22]<>0,RC[-22]&R4C32,"q") -> q | AQ13: =IF(RC[-22]<>0,RC[-22]&R4C32,"q") -> q | AR13: =IF(RC[-22]<>0,RC[-22]&R4C32,"q") -> q | AS13: =IF(RC[-22]<>0,RC[-22]&R4C32,"q") -> q | AT13: =IF(RC[-22]<>0,RC[-22]&R4C32,"q") -> 0,1,7,4000;0,1,8,2750;0,1,4,9000;; | AU13: =IF(RC[-22]<>0,RC[-22]&R4C32,"q") -> q | AV13: =IF(RC[-22]<>0,RC[-22]&R4C32,"q") -> 0,1,7,4000;0,1,8,2750;0,1,4,9000;qqqqqqqqqqqqqq;
E14: 0,1,7,500 | F14: 6000 | G14: =R2C5&RC[-1] -> 0,1,7,6000 | H14: 0,1,8,250 | I14: 0,1,4,375 | X14: 0,1,7,11000;0,1,8,250;0,1,4,375; | Z14: =RC[3]&RC[4]&RC[5]&RC[6]&RC[7]&RC[8]&RC[9]&RC[10]&RC[11]&RC[12]&RC[13]&RC[14]&RC[15]&RC[16]&RC[17]&RC[18]&RC[19] -> 0,1,7,6000;0,1,8,250;0,1,4,375;qqqqqqqqqqqqqq | AC14: =IF(RC[-22]<>0,RC[-22]&R4C32,"q") -> 0,1,7,6000; | AD14: =IF(RC[-22]<>0,RC[-22]&R4C32,"q") -> 0,1,8,250; | AE14: =IF(RC[-22]<>0,RC[-22]&R4C32,"q") -> 0,1,4,375; | AF14: =IF(RC[-22]<>0,RC[-22]&R4C32,"q") -> q | AG14: =IF(RC[-22]<>0,RC[-22]&R4C32,"q") -> q | AH14: =IF(RC[-22]<>0,RC[-22]&R4C32,"q") -> q | AI14: =IF(RC[-22]<>0,RC[-22]&R4C32,"q") -> q | AJ14: =IF(RC[-22]<>0,RC[-22]&R4C32,"q") -> q | AK14: =IF(RC[-22]<>0,RC[-22]&R4C32,"q") -> q | AL14: =IF(RC[-22]<>0,RC[-22]&R4C32,"q") -> q | AM14: =IF(RC[-22]<>0,RC[-22]&R4C32,"q") -> q | AN14: =IF(RC[-22]<>0,RC[-22]&R4C32,"q") -> q | AO14: =IF(RC[-22]<>0,RC[-22]&R4C32,"q") -> q | AP14: =IF(RC[-22]<>0,RC[-22]&R4C32,"q") -> q | AQ14: =IF(RC[-22]<>0,RC[-22]&R4C32,"q") -> q | AR14: =IF(RC[-22]<>0,RC[-22]&R4C32,"q") -> q | AS14: =IF(RC[-22]<>0,RC[-22]&R4C32,"q") -> q | AT14: =IF(RC[-22]<>0,RC[-22]&R4C32,"q") -> 0,1,7,11000;0,1,8,250;0,1,4,375;; | AU14: =IF(RC[-22]<>0,RC[-22]&R4C32,"q") -> q | AV14: =IF(RC[-22]<>0,RC[-22]&R4C32,"q") -> 0,1,7,6000;0,1,8,250;0,1,4,375;qqqqqqqqqqqqqq;
E15: 0,1,7,500 | F15: 5000 | G15: =R2C5&RC[-1] -> 0,1,7,5000 | H15: 0,1,8,250 | I15: 0,1,4,375 | X15: 0,1,7,5000;0,1,8,250;0,1,4,375; | Z15: =RC[3]&RC[4]&RC[5]&RC[6]&RC[7]&RC[8]&RC[9]&RC[10]&RC[11]&RC[12]&RC[13]&RC[14]&RC[15]&RC[16]&RC[17]&RC[18]&RC[19] -> 0,1,7,5000;0,1,8,250;0,1,4,375;qqqqqqqqqqqqqq | AC15: =IF(RC[-22]<>0,RC[-22]&R4C32,"q") -> 0,1,7,5000; | AD15: =IF(RC[-22]<>0,RC[-22]&R4C32,"q") -> 0,1,8,250; | AE15: =IF(RC[-22]<>0,RC[-22]&R4C32,"q") -> 0,1,4,375; | AF15: =IF(RC[-22]<>0,RC[-22]&R4C32,"q") -> q | AG15: =IF(RC[-22]<>0,RC[-22]&R4C32,"q") -> q | AH15: =IF(RC[-22]<>0,RC[-22]&R4C32,"q") -> q | AI15: =IF(RC[-22]<>0,RC[-22]&R4C32,"q") -> q | AJ15: =IF(RC[-22]<>0,RC[-22]&R4C32,"q") -> q | AK15: =IF(RC[-22]<>0,RC[-22]&R4C32,"q") -> q | AL15: =IF(RC[-22]<>0,RC[-22]&R4C32,"q") -> q | AM15: =IF(RC[-22]<>0,RC[-22]&R4C32,"q") -> q | AN15: =IF(RC[-22]<>0,RC[-22]&R4C32,"q") -> q | AO15: =IF(RC[-22]<>0,RC[-22]&R4C32,"q") -> q | AP15: =IF(RC[-22]<>0,RC[-22]&R4C32,"q") -> q | AQ15: =IF(RC[-22]<>0,RC[-22]&R4C32,"q") -> q | AR15: =IF(RC[-22]<>0,RC[-22]&R4C32,"q") -> q | AS15: =IF(RC[-22]<>0,RC[-22]&R4C32,"q") -> q | AT15: =IF(RC[-22]<>0,RC[-22]&R4C32,"q") -> 0,1,7,5000;0,1,8,250;0,1,4,375;; | AU15: =IF(RC[-22]<>0,RC[-22]&R4C32,"q") -> q | AV15: =IF(RC[-22]<>0,RC[-22]&R4C32,"q") -> 0,1,7,5000;0,1,8,250;0,1,4,375;qqqqqqqqqqqqqq;
E16: 0,1,7,500 | F16: 5000 | G16: =R2C5&RC[-1] -> 0,1,7,5000 | H16: 0,1,8,250 | I16: 0,1,4,375 | X16: 0,1,7,5000;0,1,8,250;0,1,4,375; | Z16: =RC[3]&RC[4]&RC[5]&RC[6]&RC[7]&RC[8]&RC[9]&RC[10]&RC[11]&RC[12]&RC[13]&RC[14]&RC[15]&RC[16]&RC[17]&RC[18]&RC[19] -> 0,1,7,5000;0,1,8,250;0,1,4,375;qqqqqqqqqqqqqq | AC16: =IF(RC[-22]<>0,RC[-22]&R4C32,"q") -> 0,1,7,5000; | AD16: =IF(RC[-22]<>0,RC[-22]&R4C32,"q") -> 0,1,8,250; | AE16: =IF(RC[-22]<>0,RC[-22]&R4C32,"q") -> 0,1,4,375; | AF16: =IF(RC[-22]<>0,RC[-22]&R4C32,"q") -> q | AG16: =IF(RC[-22]<>0,RC[-22]&R4C32,"q") -> q | AH16: =IF(RC[-22]<>0,RC[-22]&R4C32,"q") -> q | AI16: =IF(RC[-22]<>0,RC[-22]&R4C32,"q") -> q | AJ16: =IF(RC[-22]<>0,RC[-22]&R4C32,"q") -> q | AK16: =IF(RC[-22]<>0,RC[-22]&R4C32,"q") -> q | AL16: =IF(RC[-22]<>0,RC[-22]&R4C32,"q") -> q | AM16: =IF(RC[-22]<>0,RC[-22]&R4C32,"q") -> q | AN16: =IF(RC[-22]<>0,RC[-22]&R4C32,"q") -> q | AO16: =IF(RC[-22]<>0,RC[-22]&R4C32,"q") -> q | AP16: =IF(RC[-22]<>0,RC[-22]&R4C32,"q") -> q | AQ16: =IF(RC[-22]<>0,RC[-22]&R4C32,"q") -> q | AR16: =IF(RC[-22]<>0,RC[-22]&R4C32,"q") -> q | AS16: =IF(RC[-22]<>0,RC[-22]&R4C32,"q") -> q | AT16: =IF(RC[-22]<>0,RC[-22]&R4C32,"q") -> 0,1,7,5000;0,1,8,250;0,1,4,375;; | AU16: =IF(RC[-22]<>0,RC[-22]&R4C32,"q") -> q | AV16: =IF(RC[-22]<>0,RC[-22]&R4C32,"q") -> 0,1,7,5000;0,1,8,250;0,1,4,375;qqqqqqqqqqqqqq;
E17: 0,1,7,500 | F17: 6000 | G17: =R2C5&RC[-1] -> 0,1,7,6000 | H17: 0,1,8,250 | I17: 0,1,4,375 | X17: 0,1,7,6000;0,1,8,250;0,1,4,375; | Z17: =RC[3]&RC[4]&RC[5]&RC[6]&RC[7]&RC[8]&RC[9]&RC[10]&RC[11]&RC[12]&RC[13]&RC[14]&RC[15]&RC[16]&RC[17]&RC[18]&RC[19] -> 0,1,7,6000;0,1,8,250;0,1,4,375;qqqqqqqqqqqqqq | AC17: =IF(RC[-22]<>0,RC[-22]&R4C32,"q") -> 0,1,7,6000; | AD17: =IF(RC[-22]<>0,RC[-22]&R4C32,"q") -> 0,1,8,250; | AE17: =IF(RC[-22]<>0,RC[-22]&R4C32,"q") -> 0,1,4,375; | AF17: =IF(RC[-22]<>0,RC[-22]&R4C32,"q") -> q | AG17: =IF(RC[-22]<>0,RC[-22]&R4C32,"q") -> q | AH17: =IF(RC[-22]<>0,RC[-22]&R4C32,"q") -> q | AI17: =IF(RC[-22]<>0,RC[-22]&R4C32,"q") -> q | AJ17: =IF(RC[-22]<>0,RC[-22]&R4C32,"q") -> q | AK17: =IF(RC[-22]<>0,RC[-22]&R4C32,"q") -> q | AL17: =IF(RC[-22]<>0,RC[-22]&R4C32,"q") -> q | AM17: =IF(RC[-22]<>0,RC[-22]&R4C32,"q") -> q | AN17: =IF(RC[-22]<>0,RC[-22]&R4C32,"q") -> q | AO17: =IF(RC[-22]<>0,RC[-22]&R4C32,"q") -> q | AP17: =IF(RC[-22]<>0,RC[-22]&R4C32,"q") -> q | AQ17: =IF(RC[-22]<>0,RC[-22]&R4C32,"q") -> q | AR17: =IF(RC[-22]<>0,RC[-22]&R4C32,"q") -> q | AS17: =IF(RC[-22]<>0,RC[-22]&R4C32,"q") -> q | AT17: =IF(RC[-22]<>0,RC[-22]&R4C32,"q") -> 0,1,7,6000;0,1,8,250;0,1,4,375;; | AU17: =IF(RC[-22]<>0,RC[-22]&R4C32,"q") -> q | AV17: =IF(RC[-22]<>0,RC[-22]&R4C32,"q") -> 0,1,7,6000;0,1,8,250;0,1,4,375;qqqqqqqqqqqqqq;
E18: 0,1,7,500 | F18: 6000 | G18: =R2C5&RC[-1] -> 0,1,7,6000 | H18: 0,1,8,250 | I18: 0,1,4,375 | X18: 0,1,7,6000;0,1,8,250;0,1,4,375; | Z18: =RC[3]&RC[4]&RC[5]&RC[6]&RC[7]&RC[8]&RC[9]&RC[10]&RC[11]&RC[12]&RC[13]&RC[14]&RC[15]&RC[16]&RC[17]&RC[18]&RC[19] -> 0,1,7,6000;0,1,8,250;0,1,4,375;qqqqqqqqqqqqqq | AC18: =IF(RC[-22]<>0,RC[-22]&R4C32,"q") -> 0,1,7,6000; | AD18: =IF(RC[-22]<>0,RC[-22]&R4C32,"q") -> 0,1,8,250; | AE18: =IF(RC[-22]<>0,RC[-22]&R4C32,"q") -> 0,1,4,375; | AF18: =IF(RC[-22]<>0,RC[-22]&R4C32,"q") -> q | AG18: =IF(RC[-22]<>0,RC[-22]&R4C32,"q") -> q | AH18: =IF(RC[-22]<>0,RC[-22]&R4C32,"q") -> q | AI18: =IF(RC[-22]<>0,RC[-22]&R4C32,"q") -> q | AJ18: =IF(RC[-22]<>0,RC[-22]&R4C32,"q") -> q | AK18: =IF(RC[-22]<>0,RC[-22]&R4C32,"q") -> q | AL18: =IF(RC[-22]<>0,RC[-22]&R4C32,"q") -> q | AM18: =IF(RC[-22]<>0,RC[-22]&R4C32,"q") -> q | AN18: =IF(RC[-22]<>0,RC[-22]&R4C32,"q") -> q | AO18: =IF(RC[-22]<>0,RC[-22]&R4C32,"q") -> q | AP18: =IF(RC[-22]<>0,RC[-22]&R4C32,"q") -> q | AQ18: =IF(RC[-22]<>0,RC[-22]&R4C32,"q") -> q | AR18: =IF(RC[-22]<>0,RC[-22]&R4C32,"q") -> q | AS18: =IF(RC[-22]<>0,RC[-22]&R4C32,"q") -> q | AT18: =IF(RC[-22]<>0,RC[-22]&R4C32,"q") -> 0,1,7,6000;0,1,8,250;0,1,4,375;; | AU18: =IF(RC[-22]<>0,RC[-22]&R4C32,"q") -> q | AV18: =IF(RC[-22]<>0,RC[-22]&R4C32,"q") -> 0,1,7,6000;0,1,8,250;0,1,4,375;qqqqqqqqqqqqqq;
E19: 0,1,7,9500 | F19: 11000 | G19: =R2C5&RC[-1] -> 0,1,7,11000 | H19: 0,1,8,4750 | I19: 0,1,4,13000 | X19: 0,1,7,19000;0,1,8,4750;0,1,4,13000; | Z19: =RC[3]&RC[4]&RC[5]&RC[6]&RC[7]&RC[8]&RC[9]&RC[10]&RC[11]&RC[12]&RC[13]&RC[14]&RC[15]&RC[16]&RC[17]&RC[18]&RC[19] -> 0,1,7,11000;0,1,8,4750;0,1,4,13000;qqqqqqqqqqqqqq | AC19: =IF(RC[-22]<>0,RC[-22]&R4C32,"q") -> 0,1,7,11000; | AD19: =IF(RC[-22]<>0,RC[-22]&R4C32,"q") -> 0,1,8,4750; | AE19: =IF(RC[-22]<>0,RC[-22]&R4C32,"q") -> 0,1,4,13000; | AF19: =IF(RC[-22]<>0,RC[-22]&R4C32,"q") -> q | AG19: =IF(RC[-22]<>0,RC[-22]&R4C32,"q") -> q | AH19: =IF(RC[-22]<>0,RC[-22]&R4C32,"q") -> q | AI19: =IF(RC[-22]<>0,RC[-22]&R4C32,"q") -> q | AJ19: =IF(RC[-22]<>0,RC[-22]&R4C32,"q") -> q | AK19: =IF(RC[-22]<>0,RC[-22]&R4C32,"q") -> q | AL19: =IF(RC[-22]<>0,RC[-22]&R4C32,"q") -> q | AM19: =IF(RC[-22]<>0,RC[-22]&R4C32,"q") -> q | AN19: =IF(RC[-22]<>0,RC[-22]&R4C32,"q") -> q | AO19: =IF(RC[-22]<>0,RC[-22]&R4C32,"q") -> q | AP19: =IF(RC[-22]<>0,RC[-22]&R4C32,"q") -> q | AQ19: =IF(RC[-22]<>0,RC[-22]&R4C32,"q") -> q | AR19: =IF(RC[-22]<>0,RC[-22]&R4C32,"q") -> q | AS19: =IF(RC[-22]<>0,RC[-22]&R4C32,"q") -> q | AT19: =IF(RC[-22]<>0,RC[-22]&R4C32,"q") -> 0,1,7,19000;0,1,8,4750;0,1,4,13000;; | AU19: =IF(RC[-22]<>0,RC[-22]&R4C32,"q") -> q | AV19: =IF(RC[-22]<>0,RC[-22]&R4C32,"q") -> 0,1,7,11000;0,1,8,4750;0,1,4,13000;qqqqqqqqqqqqqq;
E20: 0,1,7,500 | F20: 7000 | G20: =R2C5&RC[-1] -> 0,1,7,7000 | H20: 0,1,8,250 | I20: 0,1,4,375 | X20: 0,1,7,7000;0,1,8,250;0,1,4,375; | Z20: =RC[3]&RC[4]&RC[5]&RC[6]&RC[7]&RC[8]&RC[9]&RC[10]&RC[11]&RC[12]&RC[13]&RC[14]&RC[15]&RC[16]&RC[17]&RC[18]&RC[19] -> 0,1,7,7000;0,1,8,250;0,1,4,375;qqqqqqqqqqqqqq | AC20: =IF(RC[-22]<>0,RC[-22]&R4C32,"q") -> 0,1,7,7000; | AD20: =IF(RC[-22]<>0,RC[-22]&R4C32,"q") -> 0,1,8,250; | AE20: =IF(RC[-22]<>0,RC[-22]&R4C32,"q") -> 0,1,4,375; | AF20: =IF(RC[-22]<>0,RC[-22]&R4C32,"q") -> q | AG20: =IF(RC[-22]<>0,RC[-22]&R4C32,"q") -> q | AH20: =IF(RC[-22]<>0,RC[-22]&R4C32,"q") -> q | AI20: =IF(RC[-22]<>0,RC[-22]&R4C32,"q") -> q | AJ20: =IF(RC[-22]<>0,RC[-22]&R4C32,"q") -> q | AK20: =IF(RC[-22]<>0,RC[-22]&R4C32,"q") -> q | AL20: =IF(RC[-22]<>0,RC[-22]&R4C32,"q") -> q | AM20: =IF(RC[-22]<>0,RC[-22]&R4C32,"q") -> q | AN20: =IF(RC[-22]<>0,RC[-22]&R4C32,"q") -> q | AO20: =IF(RC[-22]<>0,RC[-22]&R4C32,"q") -> q | AP20: =IF(RC[-22]<>0,RC[-22]&R4C32,"q") -> q | AQ20: =IF(RC[-22]<>0,RC[-22]&R4C32,"q") -> q | AR20: =IF(RC[-22]<>0,RC[-22]&R4C32,"q") -> q | AS20: =IF(RC[-22]<>0,RC[-22]&R4C32,"q") -> q | AT20: =IF(RC[-22]<>0,RC[-22]&R4C32,"q") -> 0,1,7,7000;0,1,8,250;0,1,4,375;; | AU20: =IF(RC[-22]<>0,RC[-22]&R4C32,"q") -> q | AV20: =IF(RC[-22]<>0,RC[-22]&R4C32,"q") -> 0,1,7,7000;0,1,8,250;0,1,4,375;qqqqqqqqqqqqqq;
E21: 0,1,7,500 | F21: 8000 | G21: =R2C5&RC[-1] -> 0,1,7,8000 | H21: 0,1,8,250 | I21: 0,1,4,375 | X21: 0,1,7,8000;0,1,8,250;0,1,4,375; | Z21: =RC[3]&RC[4]&RC[5]&RC[6]&RC[7]&RC[8]&RC[9]&RC[10]&RC[11]&RC[12]&RC[13]&RC[14]&RC[15]&RC[16]&RC[17]&RC[18]&RC[19] -> 0,1,7,8000;0,1,8,250;0,1,4,375;qqqqqqqqqqqqqq | AC21: =IF(RC[-22]<>0,RC[-22]&R4C32,"q") -> 0,1,7,8000; | AD21: =IF(RC[-22]<>0,RC[-22]&R4C32,"q") -> 0,1,8,250; | AE21: =IF(RC[-22]<>0,RC[-22]&R4C32,"q") -> 0,1,4,375; | AF21: =IF(RC[-22]<>0,RC[-22]&R4C32,"q") -> q | AG21: =IF(RC[-22]<>0,RC[-22]&R4C32,"q") -> q | AH21: =IF(RC[-22]<>0,RC[-22]&R4C32,"q") -> q | AI21: =IF(RC[-22]<>0,RC[-22]&R4C32,"q") -> q | AJ21: =IF(RC[-22]<>0,RC[-22]&R4C32,"q") -> q | AK21: =IF(RC[-22]<>0,RC[-22]&R4C32,"q") -> q | AL21: =IF(RC[-22]<>0,RC[-22]&R4C32,"q") -> q | AM21: =IF(RC[-22]<>0,RC[-22]&R4C32,"q") -> q | AN21: =IF(RC[-22]<>0,RC[-22]&R4C32,"q") -> q | AO21: =IF(RC[-22]<>0,RC[-22]&R4C32,"q") -> q | AP21: =IF(RC[-22]<>0,RC[-22]&R4C32,"q") -> q | AQ21: =IF(RC[-22]<>0,RC[-22]&R4C32,"q") -> q | AR21: =IF(RC[-22]<>0,RC[-22]&R4C32,"q") -> q | AS21: =IF(RC[-22]<>0,RC[-22]&R4C32,"q") -> q | AT21: =IF(RC[-22]<>0,RC[-22]&R4C32,"q") -> 0,1,7,8000;0,1,8,250;0,1,4,375;; | AU21: =IF(RC[-22]<>0,RC[-22]&R4C32,"q") -> q | AV21: =IF(RC[-22]<>0,RC[-22]&R4C32,"q") -> 0,1,7,8000;0,1,8,250;0,1,4,375;qqqqqqqqqqqqqq;
E22: 0,1,7,500 | F22: 8000 | G22: =R2C5&RC[-1] -> 0,1,7,8000 | H22: 0,1,8,250 | I22: 0,1,4,375 | X22: 0,1,7,8000;0,1,8,250;0,1,4,375; | Z22: =RC[3]&RC[4]&RC[5]&RC[6]&RC[7]&RC[8]&RC[9]&RC[10]&RC[11]&RC[12]&RC[13]&RC[14]&RC[15]&RC[16]&RC[17]&RC[18]&RC[19] -> 0,1,7,8000;0,1,8,250;0,1,4,375;qqqqqqqqqqqqqq | AC22: =IF(RC[-22]<>0,RC[-22]&R4C32,"q") -> 0,1,7,8000; | AD22: =IF(RC[-22]<>0,RC[-22]&R4C32,"q") -> 0,1,8,250; | AE22: =IF(RC[-22]<>0,RC[-22]&R4C32,"q") -> 0,1,4,375; | AF22: =IF(RC[-22]<>0,RC[-22]&R4C32,"q") -> q | AG22: =IF(RC[-22]<>0,RC[-22]&R4C32,"q") -> q | AH22: =IF(RC[-22]<>0,RC[-22]&R4C32,"q") -> q | AI22: =IF(RC[-22]<>0,RC[-22]&R4C32,"q") -> q | AJ22: =IF(RC[-22]<>0,RC[-22]&R4C32,"q") -> q | AK22: =IF(RC[-22]<>0,RC[-22]&R4C32,"q") -> q | AL22: =IF(RC[-22]<>0,RC[-22]&R4C32,"q") -> q | AM22: =IF(RC[-22]<>0,RC[-22]&R4C32,"q") -> q | AN22: =IF(RC[-22]<>0,RC[-22]&R4C32,"q") -> q | AO22: =IF(RC[-22]<>0,RC[-22]&R4C32,"q") -> q | AP22: =IF(RC[-22]<>0,RC[-22]&R4C32,"q") -> q | AQ22: =IF(RC[-22]<>0,RC[-22]&R4C32,"q") -> q | AR22: =IF(RC[-22]<>0,RC[-22]&R4C32,"q") -> q | AS22: =IF(RC[-22]<>0,RC[-22]&R4C32,"q") -> q | AT22: =IF(RC[-22]<>0,RC[-22]&R4C32,"q") -> 0,1,7,8000;0,1,8,250;0,1,4,375;; | AU22: =IF(RC[-22]<>0,RC[-22]&R4C32,"q") -> q | AV22: =IF(RC[-22]<>0,RC[-22]&R4C32,"q") -> 0,1,7,8000;0,1,8,250;0,1,4,375;qqqqqqqqqqqqqq;
E23: 0,1,7,500 | F23: 9000 | G23: =R2C5&RC[-1] -> 0,1,7,9000 | H23: 0,1,8,250 | I23: 0,1,4,375 | X23: 0,1,7,9000;0,1,8,250;0,1,4,375; | Z23: =RC[3]&RC[4]&RC[5]&RC[6]&RC[7]&RC[8]&RC[9]&RC[10]&RC[11]&RC[12]&RC[13]&RC[14]&RC[15]&RC[16]&RC[17]&RC[18]&RC[19] -> 0,1,7,9000;0,1,8,250;0,1,4,375;qqqqqqqqqqqqqq | AC23: =IF(RC[-22]<>0,RC[-22]&R4C32,"q") -> 0,1,7,9000; | AD23: =IF(RC[-22]<>0,RC[-22]&R4C32,"q") -> 0,1,8,250; | AE23: =IF(RC[-22]<>0,RC[-22]&R4C32,"q") -> 0,1,4,375; | AF23: =IF(RC[-22]<>0,RC[-22]&R4C32,"q") -> q | AG23: =IF(RC[-22]<>0,RC[-22]&R4C32,"q") -> q | AH23: =IF(RC[-22]<>0,RC[-22]&R4C32,"q") -> q | AI23: =IF(RC[-22]<>0,RC[-22]&R4C32,"q") -> q | AJ23: =IF(RC[-22]<>0,RC[-22]&R4C32,"q") -> q | AK23: =IF(RC[-22]<>0,RC[-22]&R4C32,"q") -> q | AL23: =IF(RC[-22]<>0,RC[-22]&R4C32,"q") -> q | AM23: =IF(RC[-22]<>0,RC[-22]&R4C32,"q") -> q | AN23: =IF(RC[-22]<>0,RC[-22]&R4C32,"q") -> q | AO23: =IF(RC[-22]<>0,RC[-22]&R4C32,"q") -> q | AP23: =IF(RC[-22]<>0,RC[-22]&R4C32,"q") -> q | AQ23: =IF(RC[-22]<>0,RC[-22]&R4C32,"q") -> q | AR23: =IF(RC[-22]<>0,RC[-22]&R4C32,"q") -> q | AS23: =IF(RC[-22]<>0,RC[-22]&R4C32,"q") -> q | AT23: =IF(RC[-22]<>0,RC[-22]&R4C32,"q") -> 0,1,7,9000;0,1,8,250;0,1,4,375;; | AU23: =IF(RC[-22]<>0,RC[-22]&R4C32,"q") -> q | AV23: =IF(RC[-22]<>0,RC[-22]&R4C32,"q") -> 0,1,7,9000;0,1,8,250;0,1,4,375;qqqqqqqqqqqqqq;
E24: 0,1,7,10000 | F24: 15000 | G24: =R2C5&RC[-1] -> 0,1,7,15000 | H24: 0,1,8,5000 | I24: 0,1,4,20000 | X24: 0,1,7,27000;0,1,8,5000;0,1,4,20000; | Z24: =RC[3]&RC[4]&RC[5]&RC[6]&RC[7]&RC[8]&RC[9]&RC[10]&RC[11]&RC[12]&RC[13]&RC[14]&RC[15]&RC[16]&RC[17]&RC[18]&RC[19] -> 0,1,7,15000;0,1,8,5000;0,1,4,20000;qqqqqqqqqqqqqq | AC24: =IF(RC[-22]<>0,RC[-22]&R4C32,"q") -> 0,1,7,15000; | AD24: =IF(RC[-22]<>0,RC[-22]&R4C32,"q") -> 0,1,8,5000; | AE24: =IF(RC[-22]<>0,RC[-22]&R4C32,"q") -> 0,1,4,20000; | AF24: =IF(RC[-22]<>0,RC[-22]&R4C32,"q") -> q | AG24: =IF(RC[-22]<>0,RC[-22]&R4C32,"q") -> q | AH24: =IF(RC[-22]<>0,RC[-22]&R4C32,"q") -> q | AI24: =IF(RC[-22]<>0,RC[-22]&R4C32,"q") -> q | AJ24: =IF(RC[-22]<>0,RC[-22]&R4C32,"q") -> q | AK24: =IF(RC[-22]<>0,RC[-22]&R4C32,"q") -> q | AL24: =IF(RC[-22]<>0,RC[-22]&R4C32,"q") -> q | AM24: =IF(RC[-22]<>0,RC[-22]&R4C32,"q") -> q | AN24: =IF(RC[-22]<>0,RC[-22]&R4C32,"q") -> q | AO24: =IF(RC[-22]<>0,RC[-22]&R4C32,"q") -> q | AP24: =IF(RC[-22]<>0,RC[-22]&R4C32,"q") -> q | AQ24: =IF(RC[-22]<>0,RC[-22]&R4C32,"q") -> q | AR24: =IF(RC[-22]<>0,RC[-22]&R4C32,"q") -> q | AS24: =IF(RC[-22]<>0,RC[-22]&R4C32,"q") -> q | AT24: =IF(RC[-22]<>0,RC[-22]&R4C32,"q") -> 0,1,7,27000;0,1,8,5000;0,1,4,20000;; | AU24: =IF(RC[-22]<>0,RC[-22]&R4C32,"q") -> q | AV24: =IF(RC[-22]<>0,RC[-22]&R4C32,"q") -> 0,1,7,15000;0,1,8,5000;0,1,4,20000;qqqqqqqqqqqqqq;
E25: 0,1,7,500 | F25: 10000 | G25: =R2C5&RC[-1] -> 0,1,7,10000 | H25: 0,1,8,250 | I25: 0,1,4,375 | X25: 0,1,7,10000;0,1,8,250;0,1,4,375; | Z25: =RC[3]&RC[4]&RC[5]&RC[6]&RC[7]&RC[8]&RC[9]&RC[10]&RC[11]&RC[12]&RC[13]&RC[14]&RC[15]&RC[16]&RC[17]&RC[18]&RC[19] -> 0,1,7,10000;0,1,8,250;0,1,4,375;qqqqqqqqqqqqqq | AC25: =IF(RC[-22]<>0,RC[-22]&R4C32,"q") -> 0,1,7,10000; | AD25: =IF(RC[-22]<>0,RC[-22]&R4C32,"q") -> 0,1,8,250; | AE25: =IF(RC[-22]<>0,RC[-22]&R4C32,"q") -> 0,1,4,375; | AF25: =IF(RC[-22]<>0,RC[-22]&R4C32,"q") -> q | AG25: =IF(RC[-22]<>0,RC[-22]&R4C32,"q") -> q | AH25: =IF(RC[-22]<>0,RC[-22]&R4C32,"q") -> q | AI25: =IF(RC[-22]<>0,RC[-22]&R4C32,"q") -> q | AJ25: =IF(RC[-22]<>0,RC[-22]&R4C32,"q") -> q | AK25: =IF(RC[-22]<>0,RC[-22]&R4C32,"q") -> q | AL25: =IF(RC[-22]<>0,RC[-22]&R4C32,"q") -> q | AM25: =IF(RC[-22]<>0,RC[-22]&R4C32,"q") -> q | AN25: =IF(RC[-22]<>0,RC[-22]&R4C32,"q") -> q | AO25: =IF(RC[-22]<>0,RC[-22]&R4C32,"q") -> q | AP25: =IF(RC[-22]<>0,RC[-22]&R4C32,"q") -> q | AQ25: =IF(RC[-22]<>0,RC[-22]&R4C32,"q") -> q | AR25: =IF(RC[-22]<>0,RC[-22]&R4C32,"q") -> q | AS25: =IF(RC[-22]<>0,RC[-22]&R4C32,"q") -> q | AT25: =IF(RC[-22]<>0,RC[-22]&R4C32,"q") -> 0,1,7,10000;0,1,8,250;0,1,4,375;; | AU25: =IF(RC[-22]<>0,RC[-22]&R4C32,"q") -> q | AV25: =IF(RC[-22]<>0,RC[-22]&R4C32,"q") -> 0,1,7,10000;0,1,8,250;0,1,4,375;qqqqqqqqqqqqqq;
E26: 0,1,7,730 | F26: 10000 | G26: =R2C5&RC[-1] -> 0,1,7,10000 | H26: 0,1,8,360 | I26: 0,1,4,1000 | X26: 0,1,7,10000;0,1,8,360;0,1,4,1000; | Z26: =RC[3]&RC[4]&RC[5]&RC[6]&RC[7]&RC[8]&RC[9]&RC[10]&RC[11]&RC[12]&RC[13]&RC[14]&RC[15]&RC[16]&RC[17]&RC[18]&RC[19] -> 0,1,7,10000;0,1,8,360;0,1,4,1000;qqqqqqqqqqqqqq | AC26: =IF(RC[-22]<>0,RC[-22]&R4C32,"q") -> 0,1,7,10000; | AD26: =IF(RC[-22]<>0,RC[-22]&R4C32,"q") -> 0,1,8,360; | AE26: =IF(RC[-22]<>0,RC[-22]&R4C32,"q") -> 0,1,4,1000; | AF26: =IF(RC[-22]<>0,RC[-22]&R4C32,"q") -> q | AG26: =IF(RC[-22]<>0,RC[-22]&R4C32,"q") -> q | AH26: =IF(RC[-22]<>0,RC[-22]&R4C32,"q") -> q | AI26: =IF(RC[-22]<>0,RC[-22]&R4C32,"q") -> q | AJ26: =IF(RC[-22]<>0,RC[-22]&R4C32,"q") -> q | AK26: =IF(RC[-22]<>0,RC[-22]&R4C32,"q") -> q | AL26: =IF(RC[-22]<>0,RC[-22]&R4C32,"q") -> q | AM26: =IF(RC[-22]<>0,RC[-22]&R4C32,"q") -> q | AN26: =IF(RC[-22]<>0,RC[-22]&R4C32,"q") -> q | AO26: =IF(RC[-22]<>0,RC[-22]&R4C32,"q") -> q | AP26: =IF(RC[-22]<>0,RC[-22]&R4C32,"q") -> q | AQ26: =IF(RC[-22]<>0,RC[-22]&R4C32,"q") -> q | AR26: =IF(RC[-22]<>0,RC[-22]&R4C32,"q") -> q | AS26: =IF(RC[-22]<>0,RC[-22]&R4C32,"q") -> q | AT26: =IF(RC[-22]<>0,RC[-22]&R4C32,"q") -> 0,1,7,10000;0,1,8,360;0,1,4,1000;; | AU26: =IF(RC[-22]<>0,RC[-22]&R4C32,"q") -> q | AV26: =IF(RC[-22]<>0,RC[-22]&R4C32,"q") -> 0,1,7,10000;0,1,8,360;0,1,4,1000;qqqqqqqqqqqqqq;
E27: 0,1,7,730 | F27: 11000 | G27: =R2C5&RC[-1] -> 0,1,7,11000 | H27: 0,1,8,360 | I27: 0,1,4,1000 | X27: 0,1,7,11000;0,1,8,360;0,1,4,1000; | Z27: =RC[3]&RC[4]&RC[5]&RC[6]&RC[7]&RC[8]&RC[9]&RC[10]&RC[11]&RC[12]&RC[13]&RC[14]&RC[15]&RC[16]&RC[17]&RC[18]&RC[19] -> 0,1,7,11000;0,1,8,360;0,1,4,1000;qqqqqqqqqqqqqq | AC27: =IF(RC[-22]<>0,RC[-22]&R4C32,"q") -> 0,1,7,11000; | AD27: =IF(RC[-22]<>0,RC[-22]&R4C32,"q") -> 0,1,8,360; | AE27: =IF(RC[-22]<>0,RC[-22]&R4C32,"q") -> 0,1,4,1000; | AF27: =IF(RC[-22]<>0,RC[-22]&R4C32,"q") -> q | AG27: =IF(RC[-22]<>0,RC[-22]&R4C32,"q") -> q | AH27: =IF(RC[-22]<>0,RC[-22]&R4C32,"q") -> q | AI27: =IF(RC[-22]<>0,RC[-22]&R4C32,"q") -> q | AJ27: =IF(RC[-22]<>0,RC[-22]&R4C32,"q") -> q | AK27: =IF(RC[-22]<>0,RC[-22]&R4C32,"q") -> q | AL27: =IF(RC[-22]<>0,RC[-22]&R4C32,"q") -> q | AM27: =IF(RC[-22]<>0,RC[-22]&R4C32,"q") -> q | AN27: =IF(RC[-22]<>0,RC[-22]&R4C32,"q") -> q | AO27: =IF(RC[-22]<>0,RC[-22]&R4C32,"q") -> q | AP27: =IF(RC[-22]<>0,RC[-22]&R4C32,"q") -> q | AQ27: =IF(RC[-22]<>0,RC[-22]&R4C32,"q") -> q | AR27: =IF(RC[-22]<>0,RC[-22]&R4C32,"q") -> q | AS27: =IF(RC[-22]<>0,RC[-22]&R4C32,"q") -> q | AT27: =IF(RC[-22]<>0,RC[-22]&R4C32,"q") -> 0,1,7,11000;0,1,8,360;0,1,4,1000;; | AU27: =IF(RC[-22]<>0,RC[-22]&R4C32,"q") -> q | AV27: =IF(RC[-22]<>0,RC[-22]&R4C32,"q") -> 0,1,7,11000;0,1,8,360;0,1,4,1000;qqqqqqqqqqqqqq;
E28: 0,1,7,10000 | F28: 11000 | G28: =R2C5&RC[-1] -> 0,1,7,11000 | H28: 0,1,8,5000 | I28: 0,1,4,20000 | X28: 0,1,7,11000;0,1,8,5000;0,1,4,20000; | Z28: =RC[3]&RC[4]&RC[5]&RC[6]&RC[7]&RC[8]&RC[9]&RC[10]&RC[11]&RC[12]&RC[13]&RC[14]&RC[15]&RC[16]&RC[17]&RC[18]&RC[19] -> 0,1,7,11000;0,1,8,5000;0,1,4,20000;qqqqqqqqqqqqqq | AC28: =IF(RC[-22]<>0,RC[-22]&R4C32,"q") -> 0,1,7,11000; | AD28: =IF(RC[-22]<>0,RC[-22]&R4C32,"q") -> 0,1,8,5000; | AE28: =IF(RC[-22]<>0,RC[-22]&R4C32,"q") -> 0,1,4,20000; | AF28: =IF(RC[-22]<>0,RC[-22]&R4C32,"q") -> q | AG28: =IF(RC[-22]<>0,RC[-22]&R4C32,"q") -> q | AH28: =IF(RC[-22]<>0,RC[-22]&R4C32,"q") -> q | AI28: =IF(RC[-22]<>0,RC[-22]&R4C32,"q") -> q | AJ28: =IF(RC[-22]<>0,RC[-22]&R4C32,"q") -> q | AK28: =IF(RC[-22]<>0,RC[-22]&R4C32,"q") -> q | AL28: =IF(RC[-22]<>0,RC[-22]&R4C32,"q") -> q | AM28: =IF(RC[-22]<>0,RC[-22]&R4C32,"q") -> q | AN28: =IF(RC[-22]<>0,RC[-22]&R4C32,"q") -> q | AO28: =IF(RC[-22]<>0,RC[-22]&R4C32,"q") -> q | AP28: =IF(RC[-22]<>0,RC[-22]&R4C32,"q") -> q | AQ28: =IF(RC[-22]<>0,RC[-22]&R4C32,"q") -> q | AR28: =IF(RC[-22]<>0,RC[-22]&R4C32,"q") -> q | AS28: =IF(RC[-22]<>0,RC[-22]&R4C32,"q") -> q | AT28: =IF(RC[-22]<>0,RC[-22]&R4C32,"q") -> 0,1,7,11000;0,1,8,5000;0,1,4,20000;; | AU28: =IF(RC[-22]<>0,RC[-22]&R4C32,"q") -> q | AV28: =IF(RC[-22]<>0,RC[-22]&R4C32,"q") -> 0,1,7,11000;0,1,8,5000;0,1,4,20000;qqqqqqqqqqqqqq;
E29: 0,1,7,730 | F29: 35000 | G29: =R2C5&RC[-1] -> 0,1,7,35000 | H29: 0,1,8,360 | I29: 0,1,4,1000 | X29: 0,1,7,35000;0,1,8,360;0,1,4,1000; | Z29: =RC[3]&RC[4]&RC[5]&RC[6]&RC[7]&RC[8]&RC[9]&RC[10]&RC[11]&RC[12]&RC[13]&RC[14]&RC[15]&RC[16]&RC[17]&RC[18]&RC[19] -> 0,1,7,35000;0,1,8,360;0,1,4,1000;qqqqqqqqqqqqqq | AC29: =IF(RC[-22]<>0,RC[-22]&R4C32,"q") -> 0,1,7,35000; | AD29: =IF(RC[-22]<>0,RC[-22]&R4C32,"q") -> 0,1,8,360; | AE29: =IF(RC[-22]<>0,RC[-22]&R4C32,"q") -> 0,1,4,1000; | AF29: =IF(RC[-22]<>0,RC[-22]&R4C32,"q") -> q | AG29: =IF(RC[-22]<>0,RC[-22]&R4C32,"q") -> q | AH29: =IF(RC[-22]<>0,RC[-22]&R4C32,"q") -> q | AI29: =IF(RC[-22]<>0,RC[-22]&R4C32,"q") -> q | AJ29: =IF(RC[-22]<>0,RC[-22]&R4C32,"q") -> q | AK29: =IF(RC[-22]<>0,RC[-22]&R4C32,"q") -> q | AL29: =IF(RC[-22]<>0,RC[-22]&R4C32,"q") -> q | AM29: =IF(RC[-22]<>0,RC[-22]&R4C32,"q") -> q | AN29: =IF(RC[-22]<>0,RC[-22]&R4C32,"q") -> q | AO29: =IF(RC[-22]<>0,RC[-22]&R4C32,"q") -> q | AP29: =IF(RC[-22]<>0,RC[-22]&R4C32,"q") -> q | AQ29: =IF(RC[-22]<>0,RC[-22]&R4C32,"q") -> q | AR29: =IF(RC[-22]<>0,RC[-22]&R4C32,"q") -> q | AS29: =IF(RC[-22]<>0,RC[-22]&R4C32,"q") -> q | AT29: =IF(RC[-22]<>0,RC[-22]&R4C32,"q") -> 0,1,7,35000;0,1,8,360;0,1,4,1000;; | AU29: =IF(RC[-22]<>0,RC[-22]&R4C32,"q") -> q | AV29: =IF(RC[-22]<>0,RC[-22]&R4C32,"q") -> 0,1,7,35000;0,1,8,360;0,1,4,1000;qqqqqqqqqqqqqq;
E30: 0,1,7,730 | F30: 12000 | G30: =R2C5&RC[-1] -> 0,1,7,12000 | H30: 0,1,8,360 | I30: 0,1,4,1000 | X30: 0,1,7,12000;0,1,8,360;0,1,4,1000; | Z30: =RC[3]&RC[4]&RC[5]&RC[6]&RC[7]&RC[8]&RC[9]&RC[10]&RC[11]&RC[12]&RC[13]&RC[14]&RC[15]&RC[16]&RC[17]&RC[18]&RC[19] -> 0,1,7,12000;0,1,8,360;0,1,4,1000;qqqqqqqqqqqqqq | AC30: =IF(RC[-22]<>0,RC[-22]&R4C32,"q") -> 0,1,7,12000; | AD30: =IF(RC[-22]<>0,RC[-22]&R4C32,"q") -> 0,1,8,360; | AE30: =IF(RC[-22]<>0,RC[-22]&R4C32,"q") -> 0,1,4,1000; | AF30: =IF(RC[-22]<>0,RC[-22]&R4C32,"q") -> q | AG30: =IF(RC[-22]<>0,RC[-22]&R4C32,"q") -> q | AH30: =IF(RC[-22]<>0,RC[-22]&R4C32,"q") -> q | AI30: =IF(RC[-22]<>0,RC[-22]&R4C32,"q") -> q | AJ30: =IF(RC[-22]<>0,RC[-22]&R4C32,"q") -> q | AK30: =IF(RC[-22]<>0,RC[-22]&R4C32,"q") -> q | AL30: =IF(RC[-22]<>0,RC[-22]&R4C32,"q") -> q | AM30: =IF(RC[-22]<>0,RC[-22]&R4C32,"q") -> q | AN30: =IF(RC[-22]<>0,RC[-22]&R4C32,"q") -> q | AO30: =IF(RC[-22]<>0,RC[-22]&R4C32,"q") -> q | AP30: =IF(RC[-22]<>0,RC[-22]&R4C32,"q") -> q | AQ30: =IF(RC[-22]<>0,RC[-22]&R4C32,"q") -> q | AR30: =IF(RC[-22]<>0,RC[-22]&R4C32,"q") -> q | AS30: =IF(RC[-22]<>0,RC[-22]&R4C32,"q") -> q | AT30: =IF(RC[-22]<>0,RC[-22]&R4C32,"q") -> 0,1,7,12000;0,1,8,360;0,1,4,1000;; | AU30: =IF(RC[-22]<>0,RC[-22]&R4C32,"q") -> q | AV30: =IF(RC[-22]<>0,RC[-22]&R4C32,"q") -> 0,1,7,12000;0,1,8,360;0,1,4,1000;qqqqqqqqqqqqqq;
E31: 0,1,7,10000 | F31: 13000 | G31: =R2C5&RC[-1] -> 0,1,7,13000 | H31: 0,1,8,5000 | I31: 0,1,4,20000 | X31: 0,1,7,13000;0,1,8,5000;0,1,4,20000; | Z31: =RC[3]&RC[4]&RC[5]&RC[6]&RC[7]&RC[8]&RC[9]&RC[10]&RC[11]&RC[12]&RC[13]&RC[14]&RC[15]&RC[16]&RC[17]&RC[18]&RC[19] -> 0,1,7,13000;0,1,8,5000;0,1,4,20000;qqqqqqqqqqqqqq | AC31: =IF(RC[-22]<>0,RC[-22]&R4C32,"q") -> 0,1,7,13000; | AD31: =IF(RC[-22]<>0,RC[-22]&R4C32,"q") -> 0,1,8,5000; | AE31: =IF(RC[-22]<>0,RC[-22]&R4C32,"q") -> 0,1,4,20000; | AF31: =IF(RC[-22]<>0,RC[-22]&R4C32,"q") -> q | AG31: =IF(RC[-22]<>0,RC[-22]&R4C32,"q") -> q | AH31: =IF(RC[-22]<>0,RC[-22]&R4C32,"q") -> q | AI31: =IF(RC[-22]<>0,RC[-22]&R4C32,"q") -> q | AJ31: =IF(RC[-22]<>0,RC[-22]&R4C32,"q") -> q | AK31: =IF(RC[-22]<>0,RC[-22]&R4C32,"q") -> q | AL31: =IF(RC[-22]<>0,RC[-22]&R4C32,"q") -> q | AM31: =IF(RC[-22]<>0,RC[-22]&R4C32,"q") -> q | AN31: =IF(RC[-22]<>0,RC[-22]&R4C32,"q") -> q | AO31: =IF(RC[-22]<>0,RC[-22]&R4C32,"q") -> q | AP31: =IF(RC[-22]<>0,RC[-22]&R4C32,"q") -> q | AQ31: =IF(RC[-22]<>0,RC[-22]&R4C32,"q") -> q | AR31: =IF(RC[-22]<>0,RC[-22]&R4C32,"q") -> q | AS31: =IF(RC[-22]<>0,RC[-22]&R4C32,"q") -> q | AT31: =IF(RC[-22]<>0,RC[-22]&R4C32,"q") -> 0,1,7,13000;0,1,8,5000;0,1,4,20000;; | AU31: =IF(RC[-22]<>0,RC[-22]&R4C32,"q") -> q | AV31: =IF(RC[-22]<>0,RC[-22]&R4C32,"q") -> 0,1,7,13000;0,1,8,5000;0,1,4,20000;qqqqqqqqqqqqqq;
E32: 0,1,7,730 | F32: 13000 | G32: =R2C5&RC[-1] -> 0,1,7,13000 | H32: 0,1,8,360 | I32: 0,1,4,1000 | X32: 0,1,7,13000;0,1,8,360;0,1,4,1000; | Z32: =RC[3]&RC[4]&RC[5]&RC[6]&RC[7]&RC[8]&RC[9]&RC[10]&RC[11]&RC[12]&RC[13]&RC[14]&RC[15]&RC[16]&RC[17]&RC[18]&RC[19] -> 0,1,7,13000;0,1,8,360;0,1,4,1000;qqqqqqqqqqqqqq | AC32: =IF(RC[-22]<>0,RC[-22]&R4C32,"q") -> 0,1,7,13000; | AD32: =IF(RC[-22]<>0,RC[-22]&R4C32,"q") -> 0,1,8,360; | AE32: =IF(RC[-22]<>0,RC[-22]&R4C32,"q") -> 0,1,4,1000; | AF32: =IF(RC[-22]<>0,RC[-22]&R4C32,"q") -> q | AG32: =IF(RC[-22]<>0,RC[-22]&R4C32,"q") -> q | AH32: =IF(RC[-22]<>0,RC[-22]&R4C32,"q") -> q | AI32: =IF(RC[-22]<>0,RC[-22]&R4C32,"q") -> q | AJ32: =IF(RC[-22]<>0,RC[-22]&R4C32,"q") -> q | AK32: =IF(RC[-22]<>0,RC[-22]&R4C32,"q") -> q | AL32: =IF(RC[-22]<>0,RC[-22]&R4C32,"q") -> q | AM32: =IF(RC[-22]<>0,RC[-22]&R4C32,"q") -> q | AN32: =IF(RC[-22]<>0,RC[-22]&R4C32,"q") -> q | AO32: =IF(RC[-22]<>0,RC[-22]&R4C32,"q") -> q | AP32: =IF(RC[-22]<>0,RC[-22]&R4C32,"q") -> q | AQ32: =IF(RC[-22]<>0,RC[-22]&R4C32,"q") -> q | AR32: =IF(RC[-22]<>0,RC[-22]&R4C32,"q") -> q | AS32: =IF(RC[-22]<>0,RC[-22]&R4C32,"q") -> q | AT32: =IF(RC[-22]<>0,RC[-22]&R4C32,"q") -> 0,1,7,13000;0,1,8,360;0,1,4,1000;; | AU32: =IF(RC[-22]<>0,RC[-22]&R4C32,"q") -> q | AV32: =IF(RC[-22]<>0,RC[-22]&R4C32,"q") -> 0,1,7,13000;0,1,8,360;0,1,4,1000;qqqqqqqqqqqqqq;
E33: 0,1,7,730 | F33: 14000 | G33: =R2C5&RC[-1] -> 0,1,7,14000 | H33: 0,1,8,360 | I33: 0,1,4,1000 | X33: 0,1,7,14000;0,1,8,360;0,1,4,1000; | Z33: =RC[3]&RC[4]&RC[5]&RC[6]&RC[7]&RC[8]&RC[9]&RC[10]&RC[11]&RC[12]&RC[13]&RC[14]&RC[15]&RC[16]&RC[17]&RC[18]&RC[19] -> 0,1,7,14000;0,1,8,360;0,1,4,1000;qqqqqqqqqqqqqq | AC33: =IF(RC[-22]<>0,RC[-22]&R4C32,"q") -> 0,1,7,14000; | AD33: =IF(RC[-22]<>0,RC[-22]&R4C32,"q") -> 0,1,8,360; | AE33: =IF(RC[-22]<>0,RC[-22]&R4C32,"q") -> 0,1,4,1000; | AF33: =IF(RC[-22]<>0,RC[-22]&R4C32,"q") -> q | AG33: =IF(RC[-22]<>0,RC[-22]&R4C32,"q") -> q | AH33: =IF(RC[-22]<>0,RC[-22]&R4C32,"q") -> q | AI33: =IF(RC[-22]<>0,RC[-22]&R4C32,"q") -> q | AJ33: =IF(RC[-22]<>0,RC[-22]&R4C32,"q") -> q | AK33: =IF(RC[-22]<>0,RC[-22]&R4C32,"q") -> q | AL33: =IF(RC[-22]<>0,RC[-22]&R4C32,"q") -> q | AM33: =IF(RC[-22]<>0,RC[-22]&R4C32,"q") -> q | AN33: =IF(RC[-22]<>0,RC[-22]&R4C32,"q") -> q | AO33: =IF(RC[-22]<>0,RC[-22]&R4C32,"q") -> q | AP33: =IF(RC[-22]<>0,RC[-22]&R4C32,"q") -> q | AQ33: =IF(RC[-22]<>0,RC[-22]&R4C32,"q") -> q | AR33: =IF(RC[-22]<>0,RC[-22]&R4C32,"q") -> q | AS33: =IF(RC[-22]<>0,RC[-22]&R4C32,"q") -> q | AT33: =IF(RC[-22]<>0,RC[-22]&R4C32,"q") -> 0,1,7,14000;0,1,8,360;0,1,4,1000;; | AU33: =IF(RC[-22]<>0,RC[-22]&R4C32,"q") -> q | AV33: =IF(RC[-22]<>0,RC[-22]&R4C32,"q") -> 0,1,7,14000;0,1,8,360;0,1,4,1000;qqqqqqqqqqqqqq;
E34: 0,1,7,1200 | F34: 42000 | G34: =R2C5&RC[-1] -> 0,1,7,42000 | H34: 0,1,8,600 | I34: 0,1,4,1200 | X34: 0,1,7,42000;0,1,8,600;0,1,4,1200; | Z34: =RC[3]&RC[4]&RC[5]&RC[6]&RC[7]&RC[8]&RC[9]&RC[10]&RC[11]&RC[12]&RC[13]&RC[14]&RC[15]&RC[16]&RC[17]&RC[18]&RC[19] -> 0,1,7,42000;0,1,8,600;0,1,4,1200;qqqqqqqqqqqqqq | AC34: =IF(RC[-22]<>0,RC[-22]&R4C32,"q") -> 0,1,7,42000; | AD34: =IF(RC[-22]<>0,RC[-22]&R4C32,"q") -> 0,1,8,600; | AE34: =IF(RC[-22]<>0,RC[-22]&R4C32,"q") -> 0,1,4,1200; | AF34: =IF(RC[-22]<>0,RC[-22]&R4C32,"q") -> q | AG34: =IF(RC[-22]<>0,RC[-22]&R4C32,"q") -> q | AH34: =IF(RC[-22]<>0,RC[-22]&R4C32,"q") -> q | AI34: =IF(RC[-22]<>0,RC[-22]&R4C32,"q") -> q | AJ34: =IF(RC[-22]<>0,RC[-22]&R4C32,"q") -> q | AK34: =IF(RC[-22]<>0,RC[-22]&R4C32,"q") -> q | AL34: =IF(RC[-22]<>0,RC[-22]&R4C32,"q") -> q | AM34: =IF(RC[-22]<>0,RC[-22]&R4C32,"q") -> q | AN34: =IF(RC[-22]<>0,RC[-22]&R4C32,"q") -> q | AO34: =IF(RC[-22]<>0,RC[-22]&R4C32,"q") -> q | AP34: =IF(RC[-22]<>0,RC[-22]&R4C32,"q") -> q | AQ34: =IF(RC[-22]<>0,RC[-22]&R4C32,"q") -> q | AR34: =IF(RC[-22]<>0,RC[-22]&R4C32,"q") -> q | AS34: =IF(RC[-22]<>0,RC[-22]&R4C32,"q") -> q | AT34: =IF(RC[-22]<>0,RC[-22]&R4C32,"q") -> 0,1,7,42000;0,1,8,600;0,1,4,1200;; | AU34: =IF(RC[-22]<>0,RC[-22]&R4C32,"q") -> q | AV34: =IF(RC[-22]<>0,RC[-22]&R4C32,"q") -> 0,1,7,42000;0,1,8,600;0,1,4,1200;qqqqqqqqqqqqqq;
E35: 0,1,7,1200 | F35: 15000 | G35: =R2C5&RC[-1] -> 0,1,7,15000 | H35: 0,1,8,600 | I35: 0,1,4,1200 | X35: 0,1,7,15000;0,1,8,600;0,1,4,1200; | Z35: =RC[3]&RC[4]&RC[5]&RC[6]&RC[7]&RC[8]&RC[9]&RC[10]&RC[11]&RC[12]&RC[13]&RC[14]&RC[15]&RC[16]&RC[17]&RC[18]&RC[19] -> 0,1,7,15000;0,1,8,600;0,1,4,1200;qqqqqqqqqqqqqq | AC35: =IF(RC[-22]<>0,RC[-22]&R4C32,"q") -> 0,1,7,15000; | AD35: =IF(RC[-22]<>0,RC[-22]&R4C32,"q") -> 0,1,8,600; | AE35: =IF(RC[-22]<>0,RC[-22]&R4C32,"q") -> 0,1,4,1200; | AF35: =IF(RC[-22]<>0,RC[-22]&R4C32,"q") -> q | AG35: =IF(RC[-22]<>0,RC[-22]&R4C32,"q") -> q | AH35: =IF(RC[-22]<>0,RC[-22]&R4C32,"q") -> q | AI35: =IF(RC[-22]<>0,RC[-22]&R4C32,"q") -> q | AJ35: =IF(RC[-22]<>0,RC[-22]&R4C32,"q") -> q | AK35: =IF(RC[-22]<>0,RC[-22]&R4C32,"q") -> q | AL35: =IF(RC[-22]<>0,RC[-22]&R4C32,"q") -> q | AM35: =IF(RC[-22]<>0,RC[-22]&R4C32,"q") -> q | AN35: =IF(RC[-22]<>0,RC[-22]&R4C32,"q") -> q | AO35: =IF(RC[-22]<>0,RC[-22]&R4C32,"q") -> q | AP35: =IF(RC[-22]<>0,RC[-22]&R4C32,"q") -> q | AQ35: =IF(RC[-22]<>0,RC[-22]&R4C32,"q") -> q | AR35: =IF(RC[-22]<>0,RC[-22]&R4C32,"q") -> q | AS35: =IF(RC[-22]<>0,RC[-22]&R4C32,"q") -> q | AT35: =IF(RC[-22]<>0,RC[-22]&R4C32,"q") -> 0,1,7,15000;0,1,8,600;0,1,4,1200;; | AU35: =IF(RC[-22]<>0,RC[-22]&R4C32,"q") -> q | AV35: =IF(RC[-22]<>0,RC[-22]&R4C32,"q") -> 0,1,7,15000;0,1,8,600;0,1,4,1200;qqqqqqqqqqqqqq;
E36: 0,1,7,1200 | F36: 15000 | G36: =R2C5&RC[-1] -> 0,1,7,15000 | H36: 0,1,8,600 | I36: 0,1,4,1200 | X36: 0,1,7,15000;0,1,8,600;0,1,4,1200; | Z36: =RC[3]&RC[4]&RC[5]&RC[6]&RC[7]&RC[8]&RC[9]&RC[10]&RC[11]&RC[12]&RC[13]&RC[14]&RC[15]&RC[16]&RC[17]&RC[18]&RC[19] -> 0,1,7,15000;0,1,8,600;0,1,4,1200;qqqqqqqqqqqqqq | AC36: =IF(RC[-22]<>0,RC[-22]&R4C32,"q") -> 0,1,7,15000; | AD36: =IF(RC[-22]<>0,RC[-22]&R4C32,"q") -> 0,1,8,600; | AE36: =IF(RC[-22]<>0,RC[-22]&R4C32,"q") -> 0,1,4,1200; | AF36: =IF(RC[-22]<>0,RC[-22]&R4C32,"q") -> q | AG36: =IF(RC[-22]<>0,RC[-22]&R4C32,"q") -> q | AH36: =IF(RC[-22]<>0,RC[-22]&R4C32,"q") -> q | AI36: =IF(RC[-22]<>0,RC[-22]&R4C32,"q") -> q | AJ36: =IF(RC[-22]<>0,RC[-22]&R4C32,"q") -> q | AK36: =IF(RC[-22]<>0,RC[-22]&R4C32,"q") -> q | AL36: =IF(RC[-22]<>0,RC[-22]&R4C32,"q") -> q | AM36: =IF(RC[-22]<>0,RC[-22]&R4C32,"q") -> q | AN36: =IF(RC[-22]<>0,RC[-22]&R4C32,"q") -> q | AO36: =IF(RC[-22]<>0,RC[-22]&R4C32,"q") -> q | AP36: =IF(RC[-22]<>0,RC[-22]&R4C32,"q") -> q | AQ36: =IF(RC[-22]<>0,RC[-22]&R4C32,"q") -> q | AR36: =IF(RC[-22]<>0,RC[-22]&R4C32,"q") -> q | AS36: =IF(RC[-22]<>0,RC[-22]&R4C32,"q") -> q | AT36: =IF(RC[-22]<>0,RC[-22]&R4C32,"q") -> 0,1,7,15000;0,1,8,600;0,1,4,1200;; | AU36: =IF(RC[-22]<>0,RC[-22]&R4C32,"q") -> q | AV36: =IF(RC[-22]<>0,RC[-22]&R4C32,"q") -> 0,1,7,15000;0,1,8,600;0,1,4,1200;qqqqqqqqqqqqqq;
E37: 0,1,7,1200 | F37: 16000 | G37: =R2C5&RC[-1] -> 0,1,7,16000 | H37: 0,1,8,600 | I37: 0,1,4,1200 | X37: 0,1,7,16000;0,1,8,600;0,1,4,1200; | Z37: =RC[3]&RC[4]&RC[5]&RC[6]&RC[7]&RC[8]&RC[9]&RC[10]&RC[11]&RC[12]&RC[13]&RC[14]&RC[15]&RC[16]&RC[17]&RC[18]&RC[19] -> 0,1,7,16000;0,1,8,600;0,1,4,1200;qqqqqqqqqqqqqq | AC37: =IF(RC[-22]<>0,RC[-22]&R4C32,"q") -> 0,1,7,16000; | AD37: =IF(RC[-22]<>0,RC[-22]&R4C32,"q") -> 0,1,8,600; | AE37: =IF(RC[-22]<>0,RC[-22]&R4C32,"q") -> 0,1,4,1200; | AF37: =IF(RC[-22]<>0,RC[-22]&R4C32,"q") -> q | AG37: =IF(RC[-22]<>0,RC[-22]&R4C32,"q") -> q | AH37: =IF(RC[-22]<>0,RC[-22]&R4C32,"q") -> q | AI37: =IF(RC[-22]<>0,RC[-22]&R4C32,"q") -> q | AJ37: =IF(RC[-22]<>0,RC[-22]&R4C32,"q") -> q | AK37: =IF(RC[-22]<>0,RC[-22]&R4C32,"q") -> q | AL37: =IF(RC[-22]<>0,RC[-22]&R4C32,"q") -> q | AM37: =IF(RC[-22]<>0,RC[-22]&R4C32,"q") -> q | AN37: =IF(RC[-22]<>0,RC[-22]&R4C32,"q") -> q | AO37: =IF(RC[-22]<>0,RC[-22]&R4C32,"q") -> q | AP37: =IF(RC[-22]<>0,RC[-22]&R4C32,"q") -> q | AQ37: =IF(RC[-22]<>0,RC[-22]&R4C32,"q") -> q | AR37: =IF(RC[-22]<>0,RC[-22]&R4C32,"q") -> q | AS37: =IF(RC[-22]<>0,RC[-22]&R4C32,"q") -> q | AT37: =IF(RC[-22]<>0,RC[-22]&R4C32,"q") -> 0,1,7,16000;0,1,8,600;0,1,4,1200;; | AU37: =IF(RC[-22]<>0,RC[-22]&R4C32,"q") -> q | AV37: =IF(RC[-22]<>0,RC[-22]&R4C32,"q") -> 0,1,7,16000;0,1,8,600;0,1,4,1200;qqqqqqqqqqqqqq;
E38: 0,1,7,36500 | F38: 16000 | G38: =R2C5&RC[-1] -> 0,1,7,16000 | H38: 0,1,8,18200 | I38: 0,1,4,37500 | X38: 0,1,7,16000;0,1,8,18200;0,1,4,37500; | Z38: =RC[3]&RC[4]&RC[5]&RC[6]&RC[7]&RC[8]&RC[9]&RC[10]&RC[11]&RC[12]&RC[13]&RC[14]&RC[15]&RC[16]&RC[17]&RC[18]&RC[19] -> 0,1,7,16000;0,1,8,18200;0,1,4,37500;qqqqqqqqqqqqqq | AC38: =IF(RC[-22]<>0,RC[-22]&R4C32,"q") -> 0,1,7,16000; | AD38: =IF(RC[-22]<>0,RC[-22]&R4C32,"q") -> 0,1,8,18200; | AE38: =IF(RC[-22]<>0,RC[-22]&R4C32,"q") -> 0,1,4,37500; | AF38: =IF(RC[-22]<>0,RC[-22]&R4C32,"q") -> q | AG38: =IF(RC[-22]<>0,RC[-22]&R4C32,"q") -> q | AH38: =IF(RC[-22]<>0,RC[-22]&R4C32,"q") -> q | AI38: =IF(RC[-22]<>0,RC[-22]&R4C32,"q") -> q | AJ38: =IF(RC[-22]<>0,RC[-22]&R4C32,"q") -> q | AK38: =IF(RC[-22]<>0,RC[-22]&R4C32,"q") -> q | AL38: =IF(RC[-22]<>0,RC[-22]&R4C32,"q") -> q | AM38: =IF(RC[-22]<>0,RC[-22]&R4C32,"q") -> q | AN38: =IF(RC[-22]<>0,RC[-22]&R4C32,"q") -> q | AO38: =IF(RC[-22]<>0,RC[-22]&R4C32,"q") -> q | AP38: =IF(RC[-22]<>0,RC[-22]&R4C32,"q") -> q | AQ38: =IF(RC[-22]<>0,RC[-22]&R4C32,"q") -> q | AR38: =IF(RC[-22]<>0,RC[-22]&R4C32,"q") -> q | AS38: =IF(RC[-22]<>0,RC[-22]&R4C32,"q") -> q | AT38: =IF(RC[-22]<>0,RC[-22]&R4C32,"q") -> 0,1,7,16000;0,1,8,18200;0,1,4,37500;; | AU38: =IF(RC[-22]<>0,RC[-22]&R4C32,"q") -> q | AV38: =IF(RC[-22]<>0,RC[-22]&R4C32,"q") -> 0,1,7,16000;0,1,8,18200;0,1,4,37500;qqqqqqqqqqqqqq;
E39: 0,1,7,1200 | F39: 49000 | G39: =R2C5&RC[-1] -> 0,1,7,49000 | H39: 0,1,8,600 | I39: 0,1,4,1200 | X39: 0,1,7,49000;0,1,8,600;0,1,4,1200; | Z39: =RC[3]&RC[4]&RC[5]&RC[6]&RC[7]&RC[8]&RC[9]&RC[10]&RC[11]&RC[12]&RC[13]&RC[14]&RC[15]&RC[16]&RC[17]&RC[18]&RC[19] -> 0,1,7,49000;0,1,8,600;0,1,4,1200;qqqqqqqqqqqqqq | AC39: =IF(RC[-22]<>0,RC[-22]&R4C32,"q") -> 0,1,7,49000; | AD39: =IF(RC[-22]<>0,RC[-22]&R4C32,"q") -> 0,1,8,600; | AE39: =IF(RC[-22]<>0,RC[-22]&R4C32,"q") -> 0,1,4,1200; | AF39: =IF(RC[-22]<>0,RC[-22]&R4C32,"q") -> q | AG39: =IF(RC[-22]<>0,RC[-22]&R4C32,"q") -> q | AH39: =IF(RC[-22]<>0,RC[-22]&R4C32,"q") -> q | AI39: =IF(RC[-22]<>0,RC[-22]&R4C32,"q") -> q | AJ39: =IF(RC[-22]<>0,RC[-22]&R4C32,"q") -> q | AK39: =IF(RC[-22]<>0,RC[-22]&R4C32,"q") -> q | AL39: =IF(RC[-22]<>0,RC[-22]&R4C32,"q") -> q | AM39: =IF(RC[-22]<>0,RC[-22]&R4C32,"q") -> q | AN39: =IF(RC[-22]<>0,RC[-22]&R4C32,"q") -> q | AO39: =IF(RC[-22]<>0,RC[-22]&R4C32,"q") -> q | AP39: =IF(RC[-22]<>0,RC[-22]&R4C32,"q") -> q | AQ39: =IF(RC[-22]<>0,RC[-22]&R4C32,"q") -> q | AR39: =IF(RC[-22]<>0,RC[-22]&R4C32,"q") -> q | AS39: =IF(RC[-22]<>0,RC[-22]&R4C32,"q") -> q | AT39: =IF(RC[-22]<>0,RC[-22]&R4C32,"q") -> 0,1,7,49000;0,1,8,600;0,1,4,1200;; | AU39: =IF(RC[-22]<>0,RC[-22]&R4C32,"q") -> q | AV39: =IF(RC[-22]<>0,RC[-22]&R4C32,"q") -> 0,1,7,49000;0,1,8,600;0,1,4,1200;qqqqqqqqqqqqqq;
E40: 0,1,7,1200 | F40: 17000 | G40: =R2C5&RC[-1] -> 0,1,7,17000 | H40: 0,1,8,600 | I40: 0,1,4,1200 | X40: 0,1,7,17000;0,1,8,600;0,1,4,1200; | Z40: =RC[3]&RC[4]&RC[5]&RC[6]&RC[7]&RC[8]&RC[9]&RC[10]&RC[11]&RC[12]&RC[13]&RC[14]&RC[15]&RC[16]&RC[17]&RC[18]&RC[19] -> 0,1,7,17000;0,1,8,600;0,1,4,1200;qqqqqqqqqqqqqq | AC40: =IF(RC[-22]<>0,RC[-22]&R4C32,"q") -> 0,1,7,17000; | AD40: =IF(RC[-22]<>0,RC[-22]&R4C32,"q") -> 0,1,8,600; | AE40: =IF(RC[-22]<>0,RC[-22]&R4C32,"q") -> 0,1,4,1200; | AF40: =IF(RC[-22]<>0,RC[-22]&R4C32,"q") -> q | AG40: =IF(RC[-22]<>0,RC[-22]&R4C32,"q") -> q | AH40: =IF(RC[-22]<>0,RC[-22]&R4C32,"q") -> q | AI40: =IF(RC[-22]<>0,RC[-22]&R4C32,"q") -> q | AJ40: =IF(RC[-22]<>0,RC[-22]&R4C32,"q") -> q | AK40: =IF(RC[-22]<>0,RC[-22]&R4C32,"q") -> q | AL40: =IF(RC[-22]<>0,RC[-22]&R4C32,"q") -> q | AM40: =IF(RC[-22]<>0,RC[-22]&R4C32,"q") -> q | AN40: =IF(RC[-22]<>0,RC[-22]&R4C32,"q") -> q | AO40: =IF(RC[-22]<>0,RC[-22]&R4C32,"q") -> q | AP40: =IF(RC[-22]<>0,RC[-22]&R4C32,"q") -> q | AQ40: =IF(RC[-22]<>0,RC[-22]&R4C32,"q") -> q | AR40: =IF(RC[-22]<>0,RC[-22]&R4C32,"q") -> q | AS40: =IF(RC[-22]<>0,RC[-22]&R4C32,"q") -> q | AT40: =IF(RC[-22]<>0,RC[-22]&R4C32,"q") -> 0,1,7,17000;0,1,8,600;0,1,4,1200;; | AU40: =IF(RC[-22]<>0,RC[-22]&R4C32,"q") -> q | AV40: =IF(RC[-22]<>0,RC[-22]&R4C32,"q") -> 0,1,7,17000;0,1,8,600;0,1,4,1200;qqqqqqqqqqqqqq;
E41: 0,1,7,1200 | F41: 17000 | G41: =R2C5&RC[-1] -> 0,1,7,17000 | H41: 0,1,8,600 | I41: 0,1,4,1200 | X41: 0,1,7,17000;0,1,8,600;0,1,4,1200; | Z41: =RC[3]&RC[4]&RC[5]&RC[6]&RC[7]&RC[8]&RC[9]&RC[10]&RC[11]&RC[12]&RC[13]&RC[14]&RC[15]&RC[16]&RC[17]&RC[18]&RC[19] -> 0,1,7,17000;0,1,8,600;0,1,4,1200;qqqqqqqqqqqqqq | AC41: =IF(RC[-22]<>0,RC[-22]&R4C32,"q") -> 0,1,7,17000; | AD41: =IF(RC[-22]<>0,RC[-22]&R4C32,"q") -> 0,1,8,600; | AE41: =IF(RC[-22]<>0,RC[-22]&R4C32,"q") -> 0,1,4,1200; | AF41: =IF(RC[-22]<>0,RC[-22]&R4C32,"q") -> q | AG41: =IF(RC[-22]<>0,RC[-22]&R4C32,"q") -> q | AH41: =IF(RC[-22]<>0,RC[-22]&R4C32,"q") -> q | AI41: =IF(RC[-22]<>0,RC[-22]&R4C32,"q") -> q | AJ41: =IF(RC[-22]<>0,RC[-22]&R4C32,"q") -> q | AK41: =IF(RC[-22]<>0,RC[-22]&R4C32,"q") -> q | AL41: =IF(RC[-22]<>0,RC[-22]&R4C32,"q") -> q | AM41: =IF(RC[-22]<>0,RC[-22]&R4C32,"q") -> q | AN41: =IF(RC[-22]<>0,RC[-22]&R4C32,"q") -> q | AO41: =IF(RC[-22]<>0,RC[-22]&R4C32,"q") -> q | AP41: =IF(RC[-22]<>0,RC[-22]&R4C32,"q") -> q | AQ41: =IF(RC[-22]<>0,RC[-22]&R4C32,"q") -> q | AR41: =IF(RC[-22]<>0,RC[-22]&R4C32,"q") -> q | AS41: =IF(RC[-22]<>0,RC[-22]&R4C32,"q") -> q | AT41: =IF(RC[-22]<>0,RC[-22]&R4C32,"q") -> 0,1,7,17000;0,1,8,600;0,1,4,1200;; | AU41: =IF(RC[-22]<>0,RC[-22]&R4C32,"q") -> q | AV41: =IF(RC[-22]<>0,RC[-22]&R4C32,"q") -> 0,1,7,17000;0,1,8,600;0,1,4,1200;qqqqqqqqqqqqqq;
E42: 0,1,7,4000 | F42: 18000 | G42: =R2C5&RC[-1] -> 0,1,7,18000 | H42: 0,1,8,2000 | I42: 0,1,4,3000 | X42: 0,1,7,18000;0,1,8,2000;0,1,4,3000; | Z42: =RC[3]&RC[4]&RC[5]&RC[6]&RC[7]&RC[8]&RC[9]&RC[10]&RC[11]&RC[12]&RC[13]&RC[14]&RC[15]&RC[16]&RC[17]&RC[18]&RC[19] -> 0,1,7,18000;0,1,8,2000;0,1,4,3000;qqqqqqqqqqqqqq | AC42: =IF(RC[-22]<>0,RC[-22]&R4C32,"q") -> 0,1,7,18000; | AD42: =IF(RC[-22]<>0,RC[-22]&R4C32,"q") -> 0,1,8,2000; | AE42: =IF(RC[-22]<>0,RC[-22]&R4C32,"q") -> 0,1,4,3000; | AF42: =IF(RC[-22]<>0,RC[-22]&R4C32,"q") -> q | AG42: =IF(RC[-22]<>0,RC[-22]&R4C32,"q") -> q | AH42: =IF(RC[-22]<>0,RC[-22]&R4C32,"q") -> q | AI42: =IF(RC[-22]<>0,RC[-22]&R4C32,"q") -> q | AJ42: =IF(RC[-22]<>0,RC[-22]&R4C32,"q") -> q | AK42: =IF(RC[-22]<>0,RC[-22]&R4C32,"q") -> q | AL42: =IF(RC[-22]<>0,RC[-22]&R4C32,"q") -> q | AM42: =IF(RC[-22]<>0,RC[-22]&R4C32,"q") -> q | AN42: =IF(RC[-22]<>0,RC[-22]&R4C32,"q") -> q | AO42: =IF(RC[-22]<>0,RC[-22]&R4C32,"q") -> q | AP42: =IF(RC[-22]<>0,RC[-22]&R4C32,"q") -> q | AQ42: =IF(RC[-22]<>0,RC[-22]&R4C32,"q") -> q | AR42: =IF(RC[-22]<>0,RC[-22]&R4C32,"q") -> q | AS42: =IF(RC[-22]<>0,RC[-22]&R4C32,"q") -> q | AT42: =IF(RC[-22]<>0,RC[-22]&R4C32,"q") -> 0,1,7,18000;0,1,8,2000;0,1,4,3000;; | AU42: =IF(RC[-22]<>0,RC[-22]&R4C32,"q") -> q | AV42: =IF(RC[-22]<>0,RC[-22]&R4C32,"q") -> 0,1,7,18000;0,1,8,2000;0,1,4,3000;qqqqqqqqqqqqqq;
E43: 0,1,7,4000 | F43: 18000 | G43: =R2C5&RC[-1] -> 0,1,7,18000 | H43: 0,1,8,2000 | I43: 0,1,4,3000 | X43: 0,1,7,18000;0,1,8,2000;0,1,4,3000; | Z43: =RC[3]&RC[4]&RC[5]&RC[6]&RC[7]&RC[8]&RC[9]&RC[10]&RC[11]&RC[12]&RC[13]&RC[14]&RC[15]&RC[16]&RC[17]&RC[18]&RC[19] -> 0,1,7,18000;0,1,8,2000;0,1,4,3000;qqqqqqqqqqqqqq | AC43: =IF(RC[-22]<>0,RC[-22]&R4C32,"q") -> 0,1,7,18000; | AD43: =IF(RC[-22]<>0,RC[-22]&R4C32,"q") -> 0,1,8,2000; | AE43: =IF(RC[-22]<>0,RC[-22]&R4C32,"q") -> 0,1,4,3000; | AF43: =IF(RC[-22]<>0,RC[-22]&R4C32,"q") -> q | AG43: =IF(RC[-22]<>0,RC[-22]&R4C32,"q") -> q | AH43: =IF(RC[-22]<>0,RC[-22]&R4C32,"q") -> q | AI43: =IF(RC[-22]<>0,RC[-22]&R4C32,"q") -> q | AJ43: =IF(RC[-22]<>0,RC[-22]&R4C32,"q") -> q | AK43: =IF(RC[-22]<>0,RC[-22]&R4C32,"q") -> q | AL43: =IF(RC[-22]<>0,RC[-22]&R4C32,"q") -> q | AM43: =IF(RC[-22]<>0,RC[-22]&R4C32,"q") -> q | AN43: =IF(RC[-22]<>0,RC[-22]&R4C32,"q") -> q | AO43: =IF(RC[-22]<>0,RC[-22]&R4C32,"q") -> q | AP43: =IF(RC[-22]<>0,RC[-22]&R4C32,"q") -> q | AQ43: =IF(RC[-22]<>0,RC[-22]&R4C32,"q") -> q | AR43: =IF(RC[-22]<>0,RC[-22]&R4C32,"q") -> q | AS43: =IF(RC[-22]<>0,RC[-22]&R4C32,"q") -> q | AT43: =IF(RC[-22]<>0,RC[-22]&R4C32,"q") -> 0,1,7,18000;0,1,8,2000;0,1,4,3000;; | AU43: =IF(RC[-22]<>0,RC[-22]&R4C32,"q") -> q | AV43: =IF(RC[-22]<>0,RC[-22]&R4C32,"q") -> 0,1,7,18000;0,1,8,2000;0,1,4,3000;qqqqqqqqqqqqqq;
E44: 0,1,7,114000 | F44: 57000 | G44: =R2C5&RC[-1] -> 0,1,7,57000 | H44: 0,1,8,60000 | I44: 0,1,4,80000 | X44: 0,1,7,57000;0,1,8,60000;0,1,4,80000; | Z44: =RC[3]&RC[4]&RC[5]&RC[6]&RC[7]&RC[8]&RC[9]&RC[10]&RC[11]&RC[12]&RC[13]&RC[14]&RC[15]&RC[16]&RC[17]&RC[18]&RC[19] -> 0,1,7,57000;0,1,8,60000;0,1,4,80000;qqqqqqqqqqqqqq | AC44: =IF(RC[-22]<>0,RC[-22]&R4C32,"q") -> 0,1,7,57000; | AD44: =IF(RC[-22]<>0,RC[-22]&R4C32,"q") -> 0,1,8,60000; | AE44: =IF(RC[-22]<>0,RC[-22]&R4C32,"q") -> 0,1,4,80000; | AF44: =IF(RC[-22]<>0,RC[-22]&R4C32,"q") -> q | AG44: =IF(RC[-22]<>0,RC[-22]&R4C32,"q") -> q | AH44: =IF(RC[-22]<>0,RC[-22]&R4C32,"q") -> q | AI44: =IF(RC[-22]<>0,RC[-22]&R4C32,"q") -> q | AJ44: =IF(RC[-22]<>0,RC[-22]&R4C32,"q") -> q | AK44: =IF(RC[-22]<>0,RC[-22]&R4C32,"q") -> q | AL44: =IF(RC[-22]<>0,RC[-22]&R4C32,"q") -> q | AM44: =IF(RC[-22]<>0,RC[-22]&R4C32,"q") -> q | AN44: =IF(RC[-22]<>0,RC[-22]&R4C32,"q") -> q | AO44: =IF(RC[-22]<>0,RC[-22]&R4C32,"q") -> q | AP44: =IF(RC[-22]<>0,RC[-22]&R4C32,"q") -> q | AQ44: =IF(RC[-22]<>0,RC[-22]&R4C32,"q") -> q | AR44: =IF(RC[-22]<>0,RC[-22]&R4C32,"q") -> q | AS44: =IF(RC[-22]<>0,RC[-22]&R4C32,"q") -> q | AT44: =IF(RC[-22]<>0,RC[-22]&R4C32,"q") -> 0,1,7,57000;0,1,8,60000;0,1,4,80000;; | AU44: =IF(RC[-22]<>0,RC[-22]&R4C32,"q") -> q | AV44: =IF(RC[-22]<>0,RC[-22]&R4C32,"q") -> 0,1,7,57000;0,1,8,60000;0,1,4,80000;qqqqqqqqqqqqqq;
E45: 0,1,7,4000 | F45: 19000 | G45: =R2C5&RC[-1] -> 0,1,7,19000 | H45: 0,1,8,2000 | I45: 0,1,4,3000 | X45: 0,1,7,19000;0,1,8,2000;0,1,4,3000; | Z45: =RC[3]&RC[4]&RC[5]&RC[6]&RC[7]&RC[8]&RC[9]&RC[10]&RC[11]&RC[12]&RC[13]&RC[14]&RC[15]&RC[16]&RC[17]&RC[18]&RC[19] -> 0,1,7,19000;0,1,8,2000;0,1,4,3000;qqqqqqqqqqqqqq | AC45: =IF(RC[-22]<>0,RC[-22]&R4C32,"q") -> 0,1,7,19000; | AD45: =IF(RC[-22]<>0,RC[-22]&R4C32,"q") -> 0,1,8,2000; | AE45: =IF(RC[-22]<>0,RC[-22]&R4C32,"q") -> 0,1,4,3000; | AF45: =IF(RC[-22]<>0,RC[-22]&R4C32,"q") -> q | AG45: =IF(RC[-22]<>0,RC[-22]&R4C32,"q") -> q | AH45: =IF(RC[-22]<>0,RC[-22]&R4C32,"q") -> q | AI45: =IF(RC[-22]<>0,RC[-22]&R4C32,"q") -> q | AJ45: =IF(RC[-22]<>0,RC[-22]&R4C32,"q") -> q | AK45: =IF(RC[-22]<>0,RC[-22]&R4C32,"q") -> q | AL45: =IF(RC[-22]<>0,RC[-22]&R4C32,"q") -> q | AM45: =IF(RC[-22]<>0,RC[-22]&R4C32,"q") -> q | AN45: =IF(RC[-22]<>0,RC[-22]&R4C32,"q") -> q | AO45: =IF(RC[-22]<>0,RC[-22]&R4C32,"q") -> q | AP45: =IF(RC[-22]<>0,RC[-22]&R4C32,"q") -> q | AQ45: =IF(RC[-22]<>0,RC[-22]&R4C32,"q") -> q | AR45: =IF(RC[-22]<>0,RC[-22]&R4C32,"q") -> q | AS45: =IF(RC[-22]<>0,RC[-22]&R4C32,"q") -> q | AT45: =IF(RC[-22]<>0,RC[-22]&R4C32,"q") -> 0,1,7,19000;0,1,8,2000;0,1,4,3000;; | AU45: =IF(RC[-22]<>0,RC[-22]&R4C32,"q") -> q | AV45: =IF(RC[-22]<>0,RC[-22]&R4C32,"q") -> 0,1,7,19000;0,1,8,2000;0,1,4,3000;qqqqqqqqqqqqqq;
E46: 0,1,7,4000 | F46: 20000 | G46: =R2C5&RC[-1] -> 0,1,7,20000 | H46: 0,1,8,2000 | I46: 0,1,4,3000 | X46: 0,1,7,20000;0,1,8,2000;0,1,4,3000; | Z46: =RC[3]&RC[4]&RC[5]&RC[6]&RC[7]&RC[8]&RC[9]&RC[10]&RC[11]&RC[12]&RC[13]&RC[14]&RC[15]&RC[16]&RC[17]&RC[18]&RC[19] -> 0,1,7,20000;0,1,8,2000;0,1,4,3000;qqqqqqqqqqqqqq | AC46: =IF(RC[-22]<>0,RC[-22]&R4C32,"q") -> 0,1,7,20000; | AD46: =IF(RC[-22]<>0,RC[-22]&R4C32,"q") -> 0,1,8,2000; | AE46: =IF(RC[-22]<>0,RC[-22]&R4C32,"q") -> 0,1,4,3000; | AF46: =IF(RC[-22]<>0,RC[-22]&R4C32,"q") -> q | AG46: =IF(RC[-22]<>0,RC[-22]&R4C32,"q") -> q | AH46: =IF(RC[-22]<>0,RC[-22]&R4C32,"q") -> q | AI46: =IF(RC[-22]<>0,RC[-22]&R4C32,"q") -> q | AJ46: =IF(RC[-22]<>0,RC[-22]&R4C32,"q") -> q | AK46: =IF(RC[-22]<>0,RC[-22]&R4C32,"q") -> q | AL46: =IF(RC[-22]<>0,RC[-22]&R4C32,"q") -> q | AM46: =IF(RC[-22]<>0,RC[-22]&R4C32,"q") -> q | AN46: =IF(RC[-22]<>0,RC[-22]&R4C32,"q") -> q | AO46: =IF(RC[-22]<>0,RC[-22]&R4C32,"q") -> q | AP46: =IF(RC[-22]<>0,RC[-22]&R4C32,"q") -> q | AQ46: =IF(RC[-22]<>0,RC[-22]&R4C32,"q") -> q | AR46: =IF(RC[-22]<>0,RC[-22]&R4C32,"q") -> q | AS46: =IF(RC[-22]<>0,RC[-22]&R4C32,"q") -> q | AT46: =IF(RC[-22]<>0,RC[-22]&R4C32,"q") -> 0,1,7,20000;0,1,8,2000;0,1,4,3000;; | AU46: =IF(RC[-22]<>0,RC[-22]&R4C32,"q") -> q | AV46: =IF(RC[-22]<>0,RC[-22]&R4C32,"q") -> 0,1,7,20000;0,1,8,2000;0,1,4,3000;qqqqqqqqqqqqqq;
E47: 0,1,7,114000 | F47: 20000 | G47: =R2C5&RC[-1] -> 0,1,7,20000 | H47: 0,1,8,60000 | I47: 0,1,4,80000 | X47: 0,1,7,20000;0,1,8,60000;0,1,4,80000; | Z47: =RC[3]&RC[4]&RC[5]&RC[6]&RC[7]&RC[8]&RC[9]&RC[10]&RC[11]&RC[12]&RC[13]&RC[14]&RC[15]&RC[16]&RC[17]&RC[18]&RC[19] -> 0,1,7,20000;0,1,8,60000;0,1,4,80000;qqqqqqqqqqqqqq | AC47: =IF(RC[-22]<>0,RC[-22]&R4C32,"q") -> 0,1,7,20000; | AD47: =IF(RC[-22]<>0,RC[-22]&R4C32,"q") -> 0,1,8,60000; | AE47: =IF(RC[-22]<>0,RC[-22]&R4C32,"q") -> 0,1,4,80000; | AF47: =IF(RC[-22]<>0,RC[-22]&R4C32,"q") -> q | AG47: =IF(RC[-22]<>0,RC[-22]&R4C32,"q") -> q | AH47: =IF(RC[-22]<>0,RC[-22]&R4C32,"q") -> q | AI47: =IF(RC[-22]<>0,RC[-22]&R4C32,"q") -> q | AJ47: =IF(RC[-22]<>0,RC[-22]&R4C32,"q") -> q | AK47: =IF(RC[-22]<>0,RC[-22]&R4C32,"q") -> q | AL47: =IF(RC[-22]<>0,RC[-22]&R4C32,"q") -> q | AM47: =IF(RC[-22]<>0,RC[-22]&R4C32,"q") -> q | AN47: =IF(RC[-22]<>0,RC[-22]&R4C32,"q") -> q | AO47: =IF(RC[-22]<>0,RC[-22]&R4C32,"q") -> q | AP47: =IF(RC[-22]<>0,RC[-22]&R4C32,"q") -> q | AQ47: =IF(RC[-22]<>0,RC[-22]&R4C32,"q") -> q | AR47: =IF(RC[-22]<>0,RC[-22]&R4C32,"q") -> q | AS47: =IF(RC[-22]<>0,RC[-22]&R4C32,"q") -> q | AT47: =IF(RC[-22]<>0,RC[-22]&R4C32,"q") -> 0,1,7,20000;0,1,8,60000;0,1,4,80000;; | AU47: =IF(RC[-22]<>0,RC[-22]&R4C32,"q") -> q | AV47: =IF(RC[-22]<>0,RC[-22]&R4C32,"q") -> 0,1,7,20000;0,1,8,60000;0,1,4,80000;qqqqqqqqqqqqqq;
E48: 0,1,7,4000 | F48: 21000 | G48: =R2C5&RC[-1] -> 0,1,7,21000 | H48: 0,1,8,2000 | I48: 0,1,4,3000 | X48: 0,1,7,21000;0,1,8,2000;0,1,4,3000; | Z48: =RC[3]&RC[4]&RC[5]&RC[6]&RC[7]&RC[8]&RC[9]&RC[10]&RC[11]&RC[12]&RC[13]&RC[14]&RC[15]&RC[16]&RC[17]&RC[18]&RC[19] -> 0,1,7,21000;0,1,8,2000;0,1,4,3000;qqqqqqqqqqqqqq | AC48: =IF(RC[-22]<>0,RC[-22]&R4C32,"q") -> 0,1,7,21000; | AD48: =IF(RC[-22]<>0,RC[-22]&R4C32,"q") -> 0,1,8,2000; | AE48: =IF(RC[-22]<>0,RC[-22]&R4C32,"q") -> 0,1,4,3000; | AF48: =IF(RC[-22]<>0,RC[-22]&R4C32,"q") -> q | AG48: =IF(RC[-22]<>0,RC[-22]&R4C32,"q") -> q | AH48: =IF(RC[-22]<>0,RC[-22]&R4C32,"q") -> q | AI48: =IF(RC[-22]<>0,RC[-22]&R4C32,"q") -> q | AJ48: =IF(RC[-22]<>0,RC[-22]&R4C32,"q") -> q | AK48: =IF(RC[-22]<>0,RC[-22]&R4C32,"q") -> q | AL48: =IF(RC[-22]<>0,RC[-22]&R4C32,"q") -> q | AM48: =IF(RC[-22]<>0,RC[-22]&R4C32,"q") -> q | AN48: =IF(RC[-22]<>0,RC[-22]&R4C32,"q") -> q | AO48: =IF(RC[-22]<>0,RC[-22]&R4C32,"q") -> q | AP48: =IF(RC[-22]<>0,RC[-22]&R4C32,"q") -> q | AQ48: =IF(RC[-22]<>0,RC[-22]&R4C32,"q") -> q | AR48: =IF(RC[-22]<>0,RC[-22]&R4C32,"q") -> q | AS48: =IF(RC[-22]<>0,RC[-22]&R4C32,"q") -> q | AT48: =IF(RC[-22]<>0,RC[-22]&R4C32,"q") -> 0,1,7,21000;0,1,8,2000;0,1,4,3000;; | AU48: =IF(RC[-22]<>0,RC[-22]&R4C32,"q") -> q | AV48: =IF(RC[-22]<>0,RC[-22]&R4C32,"q") -> 0,1,7,21000;0,1,8,2000;0,1,4,3000;qqqqqqqqqqqqqq;
E49: 0,1,7,4000 | F49: 64000 | G49: =R2C5&RC[-1] -> 0,1,7,64000 | H49: 0,1,8,2000 | I49: 0,1,4,3000 | X49: 0,1,7,64000;0,1,8,2000;0,1,4,3000; | Z49: =RC[3]&RC[4]&RC[5]&RC[6]&RC[7]&RC[8]&RC[9]&RC[10]&RC[11]&RC[12]&RC[13]&RC[14]&RC[15]&RC[16]&RC[17]&RC[18]&RC[19] -> 0,1,7,64000;0,1,8,2000;0,1,4,3000;qqqqqqqqqqqqqq | AC49: =IF(RC[-22]<>0,RC[-22]&R4C32,"q") -> 0,1,7,64000; | AD49: =IF(RC[-22]<>0,RC[-22]&R4C32,"q") -> 0,1,8,2000; | AE49: =IF(RC[-22]<>0,RC[-22]&R4C32,"q") -> 0,1,4,3000; | AF49: =IF(RC[-22]<>0,RC[-22]&R4C32,"q") -> q | AG49: =IF(RC[-22]<>0,RC[-22]&R4C32,"q") -> q | AH49: =IF(RC[-22]<>0,RC[-22]&R4C32,"q") -> q | AI49: =IF(RC[-22]<>0,RC[-22]&R4C32,"q") -> q | AJ49: =IF(RC[-22]<>0,RC[-22]&R4C32,"q") -> q | AK49: =IF(RC[-22]<>0,RC[-22]&R4C32,"q") -> q | AL49: =IF(RC[-22]<>0,RC[-22]&R4C32,"q") -> q | AM49: =IF(RC[-22]<>0,RC[-22]&R4C32,"q") -> q | AN49: =IF(RC[-22]<>0,RC[-22]&R4C32,"q") -> q | AO49: =IF(RC[-22]<>0,RC[-22]&R4C32,"q") -> q | AP49: =IF(RC[-22]<>0,RC[-22]&R4C32,"q") -> q | AQ49: =IF(RC[-22]<>0,RC[-22]&R4C32,"q") -> q | AR49: =IF(RC[-22]<>0,RC[-22]&R4C32,"q") -> q | AS49: =IF(RC[-22]<>0,RC[-22]&R4C32,"q") -> q | AT49: =IF(RC[-22]<>0,RC[-22]&R4C32,"q") -> 0,1,7,64000;0,1,8,2000;0,1,4,3000;; | AU49: =IF(RC[-22]<>0,RC[-22]&R4C32,"q") -> q | AV49: =IF(RC[-22]<>0,RC[-22]&R4C32,"q") -> 0,1,7,64000;0,1,8,2000;0,1,4,3000;qqqqqqqqqqqqqq;
E50: 0,1,7,4000 | F50: 22000 | G50: =R2C5&RC[-1] -> 0,1,7,22000 | H50: 0,1,8,2000 | I50: 0,1,4,5000 | X50: 0,1,7,22000;0,1,8,2000;0,1,4,5000; | Z50: =RC[3]&RC[4]&RC[5]&RC[6]&RC[7]&RC[8]&RC[9]&RC[10]&RC[11]&RC[12]&RC[13]&RC[14]&RC[15]&RC[16]&RC[17]&RC[18]&RC[19] -> 0,1,7,22000;0,1,8,2000;0,1,4,5000;qqqqqqqqqqqqqq | AC50: =IF(RC[-22]<>0,RC[-22]&R4C32,"q") -> 0,1,7,22000; | AD50: =IF(RC[-22]<>0,RC[-22]&R4C32,"q") -> 0,1,8,2000; | AE50: =IF(RC[-22]<>0,RC[-22]&R4C32,"q") -> 0,1,4,5000; | AF50: =IF(RC[-22]<>0,RC[-22]&R4C32,"q") -> q | AG50: =IF(RC[-22]<>0,RC[-22]&R4C32,"q") -> q | AH50: =IF(RC[-22]<>0,RC[-22]&R4C32,"q") -> q | AI50: =IF(RC[-22]<>0,RC[-22]&R4C32,"q") -> q | AJ50: =IF(RC[-22]<>0,RC[-22]&R4C32,"q") -> q | AK50: =IF(RC[-22]<>0,RC[-22]&R4C32,"q") -> q | AL50: =IF(RC[-22]<>0,RC[-22]&R4C32,"q") -> q | AM50: =IF(RC[-22]<>0,RC[-22]&R4C32,"q") -> q | AN50: =IF(RC[-22]<>0,RC[-22]&R4C32,"q") -> q | AO50: =IF(RC[-22]<>0,RC[-22]&R4C32,"q") -> q | AP50: =IF(RC[-22]<>0,RC[-22]&R4C32,"q") -> q | AQ50: =IF(RC[-22]<>0,RC[-22]&R4C32,"q") -> q | AR50: =IF(RC[-22]<>0,RC[-22]&R4C32,"q") -> q | AS50: =IF(RC[-22]<>0,RC[-22]&R4C32,"q") -> q | AT50: =IF(RC[-22]<>0,RC[-22]&R4C32,"q") -> 0,1,7,22000;0,1,8,2000;0,1,4,5000;; | AU50: =IF(RC[-22]<>0,RC[-22]&R4C32,"q") -> q | AV50: =IF(RC[-22]<>0,RC[-22]&R4C32,"q") -> 0,1,7,22000;0,1,8,2000;0,1,4,5000;qqqqqqqqqqqqqq;
E51: 0,1,7,150000 | F51: 22000 | G51: =R2C5&RC[-1] -> 0,1,7,22000 | H51: 0,1,8,75000 | I51: 0,1,4,140000 | X51: 0,1,7,22000;0,1,8,75000;0,1,4,140000; | Z51: =RC[3]&RC[4]&RC[5]&RC[6]&RC[7]&RC[8]&RC[9]&RC[10]&RC[11]&RC[12]&RC[13]&RC[14]&RC[15]&RC[16]&RC[17]&RC[18]&RC[19] -> 0,1,7,22000;0,1,8,75000;0,1,4,140000;qqqqqqqqqqqqqq | AC51: =IF(RC[-22]<>0,RC[-22]&R4C32,"q") -> 0,1,7,22000; | AD51: =IF(RC[-22]<>0,RC[-22]&R4C32,"q") -> 0,1,8,75000; | AE51: =IF(RC[-22]<>0,RC[-22]&R4C32,"q") -> 0,1,4,140000; | AF51: =IF(RC[-22]<>0,RC[-22]&R4C32,"q") -> q | AG51: =IF(RC[-22]<>0,RC[-22]&R4C32,"q") -> q | AH51: =IF(RC[-22]<>0,RC[-22]&R4C32,"q") -> q | AI51: =IF(RC[-22]<>0,RC[-22]&R4C32,"q") -> q | AJ51: =IF(RC[-22]<>0,RC[-22]&R4C32,"q") -> q | AK51: =IF(RC[-22]<>0,RC[-22]&R4C32,"q") -> q | AL51: =IF(RC[-22]<>0,RC[-22]&R4C32,"q") -> q | AM51: =IF(RC[-22]<>0,RC[-22]&R4C32,"q") -> q | AN51: =IF(RC[-22]<>0,RC[-22]&R4C32,"q") -> q | AO51: =IF(RC[-22]<>0,RC[-22]&R4C32,"q") -> q | AP51: =IF(RC[-22]<>0,RC[-22]&R4C32,"q") -> q | AQ51: =IF(RC[-22]<>0,RC[-22]&R4C32,"q") -> q | AR51: =IF(RC[-22]<>0,RC[-22]&R4C32,"q") -> q | AS51: =IF(RC[-22]<>0,RC[-22]&R4C32,"q") -> q | AT51: =IF(RC[-22]<>0,RC[-22]&R4C32,"q") -> 0,1,7,22000;0,1,8,75000;0,1,4,140000;; | AU51: =IF(RC[-22]<>0,RC[-22]&R4C32,"q") -> q | AV51: =IF(RC[-22]<>0,RC[-22]&R4C32,"q") -> 0,1,7,22000;0,1,8,75000;0,1,4,140000;qqqqqqqqqqqqqq;
E52: 0,1,7,4000 | F52: 23000 | G52: =R2C5&RC[-1] -> 0,1,7,23000 | H52: 0,1,8,2000 | I52: 0,1,4,5000 | X52: 0,1,7,23000;0,1,8,2000;0,1,4,5000; | Z52: =RC[3]&RC[4]&RC[5]&RC[6]&RC[7]&RC[8]&RC[9]&RC[10]&RC[11]&RC[12]&RC[13]&RC[14]&RC[15]&RC[16]&RC[17]&RC[18]&RC[19] -> 0,1,7,23000;0,1,8,2000;0,1,4,5000;qqqqqqqqqqqqqq | AC52: =IF(RC[-22]<>0,RC[-22]&R4C32,"q") -> 0,1,7,23000; | AD52: =IF(RC[-22]<>0,RC[-22]&R4C32,"q") -> 0,1,8,2000; | AE52: =IF(RC[-22]<>0,RC[-22]&R4C32,"q") -> 0,1,4,5000; | AF52: =IF(RC[-22]<>0,RC[-22]&R4C32,"q") -> q | AG52: =IF(RC[-22]<>0,RC[-22]&R4C32,"q") -> q | AH52: =IF(RC[-22]<>0,RC[-22]&R4C32,"q") -> q | AI52: =IF(RC[-22]<>0,RC[-22]&R4C32,"q") -> q | AJ52: =IF(RC[-22]<>0,RC[-22]&R4C32,"q") -> q | AK52: =IF(RC[-22]<>0,RC[-22]&R4C32,"q") -> q | AL52: =IF(RC[-22]<>0,RC[-22]&R4C32,"q") -> q | AM52: =IF(RC[-22]<>0,RC[-22]&R4C32,"q") -> q | AN52: =IF(RC[-22]<>0,RC[-22]&R4C32,"q") -> q | AO52: =IF(RC[-22]<>0,RC[-22]&R4C32,"q") -> q | AP52: =IF(RC[-22]<>0,RC[-22]&R4C32,"q") -> q | AQ52: =IF(RC[-22]<>0,RC[-22]&R4C32,"q") -> q | AR52: =IF(RC[-22]<>0,RC[-22]&R4C32,"q") -> q | AS52: =IF(RC[-22]<>0,RC[-22]&R4C32,"q") -> q | AT52: =IF(RC[-22]<>0,RC[-22]&R4C32,"q") -> 0,1,7,23000;0,1,8,2000;0,1,4,5000;; | AU52: =IF(RC[-22]<>0,RC[-22]&R4C32,"q") -> q | AV52: =IF(RC[-22]<>0,RC[-22]&R4C32,"q") -> 0,1,7,23000;0,1,8,2000;0,1,4,5000;qqqqqqqqqqqqqq;
E53: 0,1,7,4000 | F53: 23000 | G53: =R2C5&RC[-1] -> 0,1,7,23000 | H53: 0,1,8,2000 | I53: 0,1,4,5000 | X53: 0,1,7,23000;0,1,8,2000;0,1,4,5000; | Z53: =RC[3]&RC[4]&RC[5]&RC[6]&RC[7]&RC[8]&RC[9]&RC[10]&RC[11]&RC[12]&RC[13]&RC[14]&RC[15]&RC[16]&RC[17]&RC[18]&RC[19] -> 0,1,7,23000;0,1,8,2000;0,1,4,5000;qqqqqqqqqqqqqq | AC53: =IF(RC[-22]<>0,RC[-22]&R4C32,"q") -> 0,1,7,23000; | AD53: =IF(RC[-22]<>0,RC[-22]&R4C32,"q") -> 0,1,8,2000; | AE53: =IF(RC[-22]<>0,RC[-22]&R4C32,"q") -> 0,1,4,5000; | AF53: =IF(RC[-22]<>0,RC[-22]&R4C32,"q") -> q | AG53: =IF(RC[-22]<>0,RC[-22]&R4C32,"q") -> q | AH53: =IF(RC[-22]<>0,RC[-22]&R4C32,"q") -> q | AI53: =IF(RC[-22]<>0,RC[-22]&R4C32,"q") -> q | AJ53: =IF(RC[-22]<>0,RC[-22]&R4C32,"q") -> q | AK53: =IF(RC[-22]<>0,RC[-22]&R4C32,"q") -> q | AL53: =IF(RC[-22]<>0,RC[-22]&R4C32,"q") -> q | AM53: =IF(RC[-22]<>0,RC[-22]&R4C32,"q") -> q | AN53: =IF(RC[-22]<>0,RC[-22]&R4C32,"q") -> q | AO53: =IF(RC[-22]<>0,RC[-22]&R4C32,"q") -> q | AP53: =IF(RC[-22]<>0,RC[-22]&R4C32,"q") -> q | AQ53: =IF(RC[-22]<>0,RC[-22]&R4C32,"q") -> q | AR53: =IF(RC[-22]<>0,RC[-22]&R4C32,"q") -> q | AS53: =IF(RC[-22]<>0,RC[-22]&R4C32,"q") -> q | AT53: =IF(RC[-22]<>0,RC[-22]&R4C32,"q") -> 0,1,7,23000;0,1,8,2000;0,1,4,5000;; | AU53: =IF(RC[-22]<>0,RC[-22]&R4C32,"q") -> q | AV53: =IF(RC[-22]<>0,RC[-22]&R4C32,"q") -> 0,1,7,23000;0,1,8,2000;0,1,4,5000;qqqqqqqqqqqqqq;
E54: 0,1,7,4000 | F54: 73000 | G54: =R2C5&RC[-1] -> 0,1,7,73000 | H54: 0,1,8,2000 | I54: 0,1,4,5000 | X54: 0,1,7,73000;0,1,8,2000;0,1,4,5000; | Z54: =RC[3]&RC[4]&RC[5]&RC[6]&RC[7]&RC[8]&RC[9]&RC[10]&RC[11]&RC[12]&RC[13]&RC[14]&RC[15]&RC[16]&RC[17]&RC[18]&RC[19] -> 0,1,7,73000;0,1,8,2000;0,1,4,5000;qqqqqqqqqqqqqq | AC54: =IF(RC[-22]<>0,RC[-22]&R4C32,"q") -> 0,1,7,73000; | AD54: =IF(RC[-22]<>0,RC[-22]&R4C32,"q") -> 0,1,8,2000; | AE54: =IF(RC[-22]<>0,RC[-22]&R4C32,"q") -> 0,1,4,5000; | AF54: =IF(RC[-22]<>0,RC[-22]&R4C32,"q") -> q | AG54: =IF(RC[-22]<>0,RC[-22]&R4C32,"q") -> q | AH54: =IF(RC[-22]<>0,RC[-22]&R4C32,"q") -> q | AI54: =IF(RC[-22]<>0,RC[-22]&R4C32,"q") -> q | AJ54: =IF(RC[-22]<>0,RC[-22]&R4C32,"q") -> q | AK54: =IF(RC[-22]<>0,RC[-22]&R4C32,"q") -> q | AL54: =IF(RC[-22]<>0,RC[-22]&R4C32,"q") -> q | AM54: =IF(RC[-22]<>0,RC[-22]&R4C32,"q") -> q | AN54: =IF(RC[-22]<>0,RC[-22]&R4C32,"q") -> q | AO54: =IF(RC[-22]<>0,RC[-22]&R4C32,"q") -> q | AP54: =IF(RC[-22]<>0,RC[-22]&R4C32,"q") -> q | AQ54: =IF(RC[-22]<>0,RC[-22]&R4C32,"q") -> q | AR54: =IF(RC[-22]<>0,RC[-22]&R4C32,"q") -> q | AS54: =IF(RC[-22]<>0,RC[-22]&R4C32,"q") -> q | AT54: =IF(RC[-22]<>0,RC[-22]&R4C32,"q") -> 0,1,7,73000;0,1,8,2000;0,1,4,5000;; | AU54: =IF(RC[-22]<>0,RC[-22]&R4C32,"q") -> q | AV54: =IF(RC[-22]<>0,RC[-22]&R4C32,"q") -> 0,1,7,73000;0,1,8,2000;0,1,4,5000;qqqqqqqqqqqqqq;
E55: 0,1,7,4000 | F55: 24000 | G55: =R2C5&RC[-1] -> 0,1,7,24000 | H55: 0,1,8,2000 | I55: 0,1,4,5000 | X55: 0,1,7,24000;0,1,8,2000;0,1,4,5000; | Z55: =RC[3]&RC[4]&RC[5]&RC[6]&RC[7]&RC[8]&RC[9]&RC[10]&RC[11]&RC[12]&RC[13]&RC[14]&RC[15]&RC[16]&RC[17]&RC[18]&RC[19] -> 0,1,7,24000;0,1,8,2000;0,1,4,5000;qqqqqqqqqqqqqq | AC55: =IF(RC[-22]<>0,RC[-22]&R4C32,"q") -> 0,1,7,24000; | AD55: =IF(RC[-22]<>0,RC[-22]&R4C32,"q") -> 0,1,8,2000; | AE55: =IF(RC[-22]<>0,RC[-22]&R4C32,"q") -> 0,1,4,5000; | AF55: =IF(RC[-22]<>0,RC[-22]&R4C32,"q") -> q | AG55: =IF(RC[-22]<>0,RC[-22]&R4C32,"q") -> q | AH55: =IF(RC[-22]<>0,RC[-22]&R4C32,"q") -> q | AI55: =IF(RC[-22]<>0,RC[-22]&R4C32,"q") -> q | AJ55: =IF(RC[-22]<>0,RC[-22]&R4C32,"q") -> q | AK55: =IF(RC[-22]<>0,RC[-22]&R4C32,"q") -> q | AL55: =IF(RC[-22]<>0,RC[-22]&R4C32,"q") -> q | AM55: =IF(RC[-22]<>0,RC[-22]&R4C32,"q") -> q | AN55: =IF(RC[-22]<>0,RC[-22]&R4C32,"q") -> q | AO55: =IF(RC[-22]<>0,RC[-22]&R4C32,"q") -> q | AP55: =IF(RC[-22]<>0,RC[-22]&R4C32,"q") -> q | AQ55: =IF(RC[-22]<>0,RC[-22]&R4C32,"q") -> q | AR55: =IF(RC[-22]<>0,RC[-22]&R4C32,"q") -> q | AS55: =IF(RC[-22]<>0,RC[-22]&R4C32,"q") -> q | AT55: =IF(RC[-22]<>0,RC[-22]&R4C32,"q") -> 0,1,7,24000;0,1,8,2000;0,1,4,5000;; | AU55: =IF(RC[-22]<>0,RC[-22]&R4C32,"q") -> q | AV55: =IF(RC[-22]<>0,RC[-22]&R4C32,"q") -> 0,1,7,24000;0,1,8,2000;0,1,4,5000;qqqqqqqqqqqqqq;
E56: 0,1,7,4000 | F56: 25000 | G56: =R2C5&RC[-1] -> 0,1,7,25000 | H56: 0,1,8,2000 | I56: 0,1,4,5000 | X56: 0,1,7,25000;0,1,8,2000;0,1,4,5000; | Z56: =RC[3]&RC[4]&RC[5]&RC[6]&RC[7]&RC[8]&RC[9]&RC[10]&RC[11]&RC[12]&RC[13]&RC[14]&RC[15]&RC[16]&RC[17]&RC[18]&RC[19] -> 0,1,7,25000;0,1,8,2000;0,1,4,5000;qqqqqqqqqqqqqq | AC56: =IF(RC[-22]<>0,RC[-22]&R4C32,"q") -> 0,1,7,25000; | AD56: =IF(RC[-22]<>0,RC[-22]&R4C32,"q") -> 0,1,8,2000; | AE56: =IF(RC[-22]<>0,RC[-22]&R4C32,"q") -> 0,1,4,5000; | AF56: =IF(RC[-22]<>0,RC[-22]&R4C32,"q") -> q | AG56: =IF(RC[-22]<>0,RC[-22]&R4C32,"q") -> q | AH56: =IF(RC[-22]<>0,RC[-22]&R4C32,"q") -> q | AI56: =IF(RC[-22]<>0,RC[-22]&R4C32,"q") -> q | AJ56: =IF(RC[-22]<>0,RC[-22]&R4C32,"q") -> q | AK56: =IF(RC[-22]<>0,RC[-22]&R4C32,"q") -> q | AL56: =IF(RC[-22]<>0,RC[-22]&R4C32,"q") -> q | AM56: =IF(RC[-22]<>0,RC[-22]&R4C32,"q") -> q | AN56: =IF(RC[-22]<>0,RC[-22]&R4C32,"q") -> q | AO56: =IF(RC[-22]<>0,RC[-22]&R4C32,"q") -> q | AP56: =IF(RC[-22]<>0,RC[-22]&R4C32,"q") -> q | AQ56: =IF(RC[-22]<>0,RC[-22]&R4C32,"q") -> q | AR56: =IF(RC[-22]<>0,RC[-22]&R4C32,"q") -> q | AS56: =IF(RC[-22]<>0,RC[-22]&R4C32,"q") -> q | AT56: =IF(RC[-22]<>0,RC[-22]&R4C32,"q") -> 0,1,7,25000;0,1,8,2000;0,1,4,5000;; | AU56: =IF(RC[-22]<>0,RC[-22]&R4C32,"q") -> q | AV56: =IF(RC[-22]<>0,RC[-22]&R4C32,"q") -> 0,1,7,25000;0,1,8,2000;0,1,4,5000;qqqqqqqqqqqqqq;
E57: 0,1,7,4000 | F57: 25000 | G57: =R2C5&RC[-1] -> 0,1,7,25000 | H57: 0,1,8,2000 | I57: 0,1,4,5000 | X57: 0,1,7,25000;0,1,8,2000;0,1,4,5000; | Z57: =RC[3]&RC[4]&RC[5]&RC[6]&RC[7]&RC[8]&RC[9]&RC[10]&RC[11]&RC[12]&RC[13]&RC[14]&RC[15]&RC[16]&RC[17]&RC[18]&RC[19] -> 0,1,7,25000;0,1,8,2000;0,1,4,5000;qqqqqqqqqqqqqq | AC57: =IF(RC[-22]<>0,RC[-22]&R4C32,"q") -> 0,1,7,25000; | AD57: =IF(RC[-22]<>0,RC[-22]&R4C32,"q") -> 0,1,8,2000; | AE57: =IF(RC[-22]<>0,RC[-22]&R4C32,"q") -> 0,1,4,5000; | AF57: =IF(RC[-22]<>0,RC[-22]&R4C32,"q") -> q | AG57: =IF(RC[-22]<>0,RC[-22]&R4C32,"q") -> q | AH57: =IF(RC[-22]<>0,RC[-22]&R4C32,"q") -> q | AI57: =IF(RC[-22]<>0,RC[-22]&R4C32,"q") -> q | AJ57: =IF(RC[-22]<>0,RC[-22]&R4C32,"q") -> q | AK57: =IF(RC[-22]<>0,RC[-22]&R4C32,"q") -> q | AL57: =IF(RC[-22]<>0,RC[-22]&R4C32,"q") -> q | AM57: =IF(RC[-22]<>0,RC[-22]&R4C32,"q") -> q | AN57: =IF(RC[-22]<>0,RC[-22]&R4C32,"q") -> q | AO57: =IF(RC[-22]<>0,RC[-22]&R4C32,"q") -> q | AP57: =IF(RC[-22]<>0,RC[-22]&R4C32,"q") -> q | AQ57: =IF(RC[-22]<>0,RC[-22]&R4C32,"q") -> q | AR57: =IF(RC[-22]<>0,RC[-22]&R4C32,"q") -> q | AS57: =IF(RC[-22]<>0,RC[-22]&R4C32,"q") -> q | AT57: =IF(RC[-22]<>0,RC[-22]&R4C32,"q") -> 0,1,7,25000;0,1,8,2000;0,1,4,5000;; | AU57: =IF(RC[-22]<>0,RC[-22]&R4C32,"q") -> q | AV57: =IF(RC[-22]<>0,RC[-22]&R4C32,"q") -> 0,1,7,25000;0,1,8,2000;0,1,4,5000;qqqqqqqqqqqqqq;
E58: 0,1,7,4000 | F58: 26000 | G58: =R2C5&RC[-1] -> 0,1,7,26000 | H58: 0,1,8,2000 | I58: 0,1,4,5000 | X58: 0,1,7,26000;0,1,8,2000;0,1,4,5000; | Z58: =RC[3]&RC[4]&RC[5]&RC[6]&RC[7]&RC[8]&RC[9]&RC[10]&RC[11]&RC[12]&RC[13]&RC[14]&RC[15]&RC[16]&RC[17]&RC[18]&RC[19] -> 0,1,7,26000;0,1,8,2000;0,1,4,5000;qqqqqqqqqqqqqq | AC58: =IF(RC[-22]<>0,RC[-22]&R4C32,"q") -> 0,1,7,26000; | AD58: =IF(RC[-22]<>0,RC[-22]&R4C32,"q") -> 0,1,8,2000; | AE58: =IF(RC[-22]<>0,RC[-22]&R4C32,"q") -> 0,1,4,5000; | AF58: =IF(RC[-22]<>0,RC[-22]&R4C32,"q") -> q | AG58: =IF(RC[-22]<>0,RC[-22]&R4C32,"q") -> q | AH58: =IF(RC[-22]<>0,RC[-22]&R4C32,"q") -> q | AI58: =IF(RC[-22]<>0,RC[-22]&R4C32,"q") -> q | AJ58: =IF(RC[-22]<>0,RC[-22]&R4C32,"q") -> q | AK58: =IF(RC[-22]<>0,RC[-22]&R4C32,"q") -> q | AL58: =IF(RC[-22]<>0,RC[-22]&R4C32,"q") -> q | AM58: =IF(RC[-22]<>0,RC[-22]&R4C32,"q") -> q | AN58: =IF(RC[-22]<>0,RC[-22]&R4C32,"q") -> q | AO58: =IF(RC[-22]<>0,RC[-22]&R4C32,"q") -> q | AP58: =IF(RC[-22]<>0,RC[-22]&R4C32,"q") -> q | AQ58: =IF(RC[-22]<>0,RC[-22]&R4C32,"q") -> q | AR58: =IF(RC[-22]<>0,RC[-22]&R4C32,"q") -> q | AS58: =IF(RC[-22]<>0,RC[-22]&R4C32,"q") -> q | AT58: =IF(RC[-22]<>0,RC[-22]&R4C32,"q") -> 0,1,7,26000;0,1,8,2000;0,1,4,5000;; | AU58: =IF(RC[-22]<>0,RC[-22]&R4C32,"q") -> q | AV58: =IF(RC[-22]<>0,RC[-22]&R4C32,"q") -> 0,1,7,26000;0,1,8,2000;0,1,4,5000;qqqqqqqqqqqqqq;
E59: 0,1,7,4000 | F59: 80000 | G59: =R2C5&RC[-1] -> 0,1,7,80000 | H59: 0,1,8,2000 | I59: 0,1,4,5000 | X59: 0,1,7,80000;0,1,8,2000;0,1,4,5000; | Z59: =RC[3]&RC[4]&RC[5]&RC[6]&RC[7]&RC[8]&RC[9]&RC[10]&RC[11]&RC[12]&RC[13]&RC[14]&RC[15]&RC[16]&RC[17]&RC[18]&RC[19] -> 0,1,7,80000;0,1,8,2000;0,1,4,5000;qqqqqqqqqqqqqq | AC59: =IF(RC[-22]<>0,RC[-22]&R4C32,"q") -> 0,1,7,80000; | AD59: =IF(RC[-22]<>0,RC[-22]&R4C32,"q") -> 0,1,8,2000; | AE59: =IF(RC[-22]<>0,RC[-22]&R4C32,"q") -> 0,1,4,5000; | AF59: =IF(RC[-22]<>0,RC[-22]&R4C32,"q") -> q | AG59: =IF(RC[-22]<>0,RC[-22]&R4C32,"q") -> q | AH59: =IF(RC[-22]<>0,RC[-22]&R4C32,"q") -> q | AI59: =IF(RC[-22]<>0,RC[-22]&R4C32,"q") -> q | AJ59: =IF(RC[-22]<>0,RC[-22]&R4C32,"q") -> q | AK59: =IF(RC[-22]<>0,RC[-22]&R4C32,"q") -> q | AL59: =IF(RC[-22]<>0,RC[-22]&R4C32,"q") -> q | AM59: =IF(RC[-22]<>0,RC[-22]&R4C32,"q") -> q | AN59: =IF(RC[-22]<>0,RC[-22]&R4C32,"q") -> q | AO59: =IF(RC[-22]<>0,RC[-22]&R4C32,"q") -> q | AP59: =IF(RC[-22]<>0,RC[-22]&R4C32,"q") -> q | AQ59: =IF(RC[-22]<>0,RC[-22]&R4C32,"q") -> q | AR59: =IF(RC[-22]<>0,RC[-22]&R4C32,"q") -> q | AS59: =IF(RC[-22]<>0,RC[-22]&R4C32,"q") -> q | AT59: =IF(RC[-22]<>0,RC[-22]&R4C32,"q") -> 0,1,7,80000;0,1,8,2000;0,1,4,5000;; | AU59: =IF(RC[-22]<>0,RC[-22]&R4C32,"q") -> q | AV59: =IF(RC[-22]<>0,RC[-22]&R4C32,"q") -> 0,1,7,80000;0,1,8,2000;0,1,4,5000;qqqqqqqqqqqqqq;
E60: 0,1,7,4000 | F60: 27000 | G60: =R2C5&RC[-1] -> 0,1,7,27000 | H60: 0,1,8,2000 | I60: 0,1,4,5000 | X60: 0,1,7,27000;0,1,8,2000;0,1,4,5000; | Z60: =RC[3]&RC[4]&RC[5]&RC[6]&RC[7]&RC[8]&RC[9]&RC[10]&RC[11]&RC[12]&RC[13]&RC[14]&RC[15]&RC[16]&RC[17]&RC[18]&RC[19] -> 0,1,7,27000;0,1,8,2000;0,1,4,5000;qqqqqqqqqqqqqq | AC60: =IF(RC[-22]<>0,RC[-22]&R4C32,"q") -> 0,1,7,27000; | AD60: =IF(RC[-22]<>0,RC[-22]&R4C32,"q") -> 0,1,8,2000; | AE60: =IF(RC[-22]<>0,RC[-22]&R4C32,"q") -> 0,1,4,5000; | AF60: =IF(RC[-22]<>0,RC[-22]&R4C32,"q") -> q | AG60: =IF(RC[-22]<>0,RC[-22]&R4C32,"q") -> q | AH60: =IF(RC[-22]<>0,RC[-22]&R4C32,"q") -> q | AI60: =IF(RC[-22]<>0,RC[-22]&R4C32,"q") -> q | AJ60: =IF(RC[-22]<>0,RC[-22]&R4C32,"q") -> q | AK60: =IF(RC[-22]<>0,RC[-22]&R4C32,"q") -> q | AL60: =IF(RC[-22]<>0,RC[-22]&R4C32,"q") -> q | AM60: =IF(RC[-22]<>0,RC[-22]&R4C32,"q") -> q | AN60: =IF(RC[-22]<>0,RC[-22]&R4C32,"q") -> q | AO60: =IF(RC[-22]<>0,RC[-22]&R4C32,"q") -> q | AP60: =IF(RC[-22]<>0,RC[-22]&R4C32,"q") -> q | AQ60: =IF(RC[-22]<>0,RC[-22]&R4C32,"q") -> q | AR60: =IF(RC[-22]<>0,RC[-22]&R4C32,"q") -> q | AS60: =IF(RC[-22]<>0,RC[-22]&R4C32,"q") -> q | AT60: =IF(RC[-22]<>0,RC[-22]&R4C32,"q") -> 0,1,7,27000;0,1,8,2000;0,1,4,5000;; | AU60: =IF(RC[-22]<>0,RC[-22]&R4C32,"q") -> q | AV60: =IF(RC[-22]<>0,RC[-22]&R4C32,"q") -> 0,1,7,27000;0,1,8,2000;0,1,4,5000;qqqqqqqqqqqqqq;
E61: 0,1,7,4500 | F61: 27000 | G61: =R2C5&RC[-1] -> 0,1,7,27000 | H61: 0,1,8,2250 | I61: 0,1,4,5000 | X61: 0,1,7,27000;0,1,8,2250;0,1,4,5000; | Z61: =RC[3]&RC[4]&RC[5]&RC[6]&RC[7]&RC[8]&RC[9]&RC[10]&RC[11]&RC[12]&RC[13]&RC[14]&RC[15]&RC[16]&RC[17]&RC[18]&RC[19] -> 0,1,7,27000;0,1,8,2250;0,1,4,5000;qqqqqqqqqqqqqq | AC61: =IF(RC[-22]<>0,RC[-22]&R4C32,"q") -> 0,1,7,27000; | AD61: =IF(RC[-22]<>0,RC[-22]&R4C32,"q") -> 0,1,8,2250; | AE61: =IF(RC[-22]<>0,RC[-22]&R4C32,"q") -> 0,1,4,5000; | AF61: =IF(RC[-22]<>0,RC[-22]&R4C32,"q") -> q | AG61: =IF(RC[-22]<>0,RC[-22]&R4C32,"q") -> q | AH61: =IF(RC[-22]<>0,RC[-22]&R4C32,"q") -> q | AI61: =IF(RC[-22]<>0,RC[-22]&R4C32,"q") -> q | AJ61: =IF(RC[-22]<>0,RC[-22]&R4C32,"q") -> q | AK61: =IF(RC[-22]<>0,RC[-22]&R4C32,"q") -> q | AL61: =IF(RC[-22]<>0,RC[-22]&R4C32,"q") -> q | AM61: =IF(RC[-22]<>0,RC[-22]&R4C32,"q") -> q | AN61: =IF(RC[-22]<>0,RC[-22]&R4C32,"q") -> q | AO61: =IF(RC[-22]<>0,RC[-22]&R4C32,"q") -> q | AP61: =IF(RC[-22]<>0,RC[-22]&R4C32,"q") -> q | AQ61: =IF(RC[-22]<>0,RC[-22]&R4C32,"q") -> q | AR61: =IF(RC[-22]<>0,RC[-22]&R4C32,"q") -> q | AS61: =IF(RC[-22]<>0,RC[-22]&R4C32,"q") -> q | AT61: =IF(RC[-22]<>0,RC[-22]&R4C32,"q") -> 0,1,7,27000;0,1,8,2250;0,1,4,5000;; | AU61: =IF(RC[-22]<>0,RC[-22]&R4C32,"q") -> q | AV61: =IF(RC[-22]<>0,RC[-22]&R4C32,"q") -> 0,1,7,27000;0,1,8,2250;0,1,4,5000;qqqqqqqqqqqqqq;
E62: 0,1,7,4500 | F62: 28000 | G62: =R2C5&RC[-1] -> 0,1,7,28000 | H62: 0,1,8,2250 | I62: 0,1,4,5000 | X62: 0,1,7,28000;0,1,8,2250;0,1,4,5000; | Z62: =RC[3]&RC[4]&RC[5]&RC[6]&RC[7]&RC[8]&RC[9]&RC[10]&RC[11]&RC[12]&RC[13]&RC[14]&RC[15]&RC[16]&RC[17]&RC[18]&RC[19] -> 0,1,7,28000;0,1,8,2250;0,1,4,5000;qqqqqqqqqqqqqq | AC62: =IF(RC[-22]<>0,RC[-22]&R4C32,"q") -> 0,1,7,28000; | AD62: =IF(RC[-22]<>0,RC[-22]&R4C32,"q") -> 0,1,8,2250; | AE62: =IF(RC[-22]<>0,RC[-22]&R4C32,"q") -> 0,1,4,5000; | AF62: =IF(RC[-22]<>0,RC[-22]&R4C32,"q") -> q | AG62: =IF(RC[-22]<>0,RC[-22]&R4C32,"q") -> q | AH62: =IF(RC[-22]<>0,RC[-22]&R4C32,"q") -> q | AI62: =IF(RC[-22]<>0,RC[-22]&R4C32,"q") -> q | AJ62: =IF(RC[-22]<>0,RC[-22]&R4C32,"q") -> q | AK62: =IF(RC[-22]<>0,RC[-22]&R4C32,"q") -> q | AL62: =IF(RC[-22]<>0,RC[-22]&R4C32,"q") -> q | AM62: =IF(RC[-22]<>0,RC[-22]&R4C32,"q") -> q | AN62: =IF(RC[-22]<>0,RC[-22]&R4C32,"q") -> q | AO62: =IF(RC[-22]<>0,RC[-22]&R4C32,"q") -> q | AP62: =IF(RC[-22]<>0,RC[-22]&R4C32,"q") -> q | AQ62: =IF(RC[-22]<>0,RC[-22]&R4C32,"q") -> q | AR62: =IF(RC[-22]<>0,RC[-22]&R4C32,"q") -> q | AS62: =IF(RC[-22]<>0,RC[-22]&R4C32,"q") -> q | AT62: =IF(RC[-22]<>0,RC[-22]&R4C32,"q") -> 0,1,7,28000;0,1,8,2250;0,1,4,5000;; | AU62: =IF(RC[-22]<>0,RC[-22]&R4C32,"q") -> q | AV62: =IF(RC[-22]<>0,RC[-22]&R4C32,"q") -> 0,1,7,28000;0,1,8,2250;0,1,4,5000;qqqqqqqqqqqqqq;
E63: 0,1,7,4500 | F63: 28000 | G63: =R2C5&RC[-1] -> 0,1,7,28000 | H63: 0,1,8,2250 | I63: 0,1,4,5000 | X63: 0,1,7,28000;0,1,8,2250;0,1,4,5000; | Z63: =RC[3]&RC[4]&RC[5]&RC[6]&RC[7]&RC[8]&RC[9]&RC[10]&RC[11]&RC[12]&RC[13]&RC[14]&RC[15]&RC[16]&RC[17]&RC[18]&RC[19] -> 0,1,7,28000;0,1,8,2250;0,1,4,5000;qqqqqqqqqqqqqq | AC63: =IF(RC[-22]<>0,RC[-22]&R4C32,"q") -> 0,1,7,28000; | AD63: =IF(RC[-22]<>0,RC[-22]&R4C32,"q") -> 0,1,8,2250; | AE63: =IF(RC[-22]<>0,RC[-22]&R4C32,"q") -> 0,1,4,5000; | AF63: =IF(RC[-22]<>0,RC[-22]&R4C32,"q") -> q | AG63: =IF(RC[-22]<>0,RC[-22]&R4C32,"q") -> q | AH63: =IF(RC[-22]<>0,RC[-22]&R4C32,"q") -> q | AI63: =IF(RC[-22]<>0,RC[-22]&R4C32,"q") -> q | AJ63: =IF(RC[-22]<>0,RC[-22]&R4C32,"q") -> q | AK63: =IF(RC[-22]<>0,RC[-22]&R4C32,"q") -> q | AL63: =IF(RC[-22]<>0,RC[-22]&R4C32,"q") -> q | AM63: =IF(RC[-22]<>0,RC[-22]&R4C32,"q") -> q | AN63: =IF(RC[-22]<>0,RC[-22]&R4C32,"q") -> q | AO63: =IF(RC[-22]<>0,RC[-22]&R4C32,"q") -> q | AP63: =IF(RC[-22]<>0,RC[-22]&R4C32,"q") -> q | AQ63: =IF(RC[-22]<>0,RC[-22]&R4C32,"q") -> q | AR63: =IF(RC[-22]<>0,RC[-22]&R4C32,"q") -> q | AS63: =IF(RC[-22]<>0,RC[-22]&R4C32,"q") -> q | AT63: =IF(RC[-22]<>0,RC[-22]&R4C32,"q") -> 0,1,7,28000;0,1,8,2250;0,1,4,5000;; | AU63: =IF(RC[-22]<>0,RC[-22]&R4C32,"q") -> q | AV63: =IF(RC[-22]<>0,RC[-22]&R4C32,"q") -> 0,1,7,28000;0,1,8,2250;0,1,4,5000;qqqqqqqqqqqqqq;
E64: 0,1,7,4500 | F64: 89000 | G64: =R2C5&RC[-1] -> 0,1,7,89000 | H64: 0,1,8,2250 | I64: 0,1,4,5000 | X64: 0,1,7,89000;0,1,8,2250;0,1,4,5000; | Z64: =RC[3]&RC[4]&RC[5]&RC[6]&RC[7]&RC[8]&RC[9]&RC[10]&RC[11]&RC[12]&RC[13]&RC[14]&RC[15]&RC[16]&RC[17]&RC[18]&RC[19] -> 0,1,7,89000;0,1,8,2250;0,1,4,5000;qqqqqqqqqqqqqq | AC64: =IF(RC[-22]<>0,RC[-22]&R4C32,"q") -> 0,1,7,89000; | AD64: =IF(RC[-22]<>0,RC[-22]&R4C32,"q") -> 0,1,8,2250; | AE64: =IF(RC[-22]<>0,RC[-22]&R4C32,"q") -> 0,1,4,5000; | AF64: =IF(RC[-22]<>0,RC[-22]&R4C32,"q") -> q | AG64: =IF(RC[-22]<>0,RC[-22]&R4C32,"q") -> q | AH64: =IF(RC[-22]<>0,RC[-22]&R4C32,"q") -> q | AI64: =IF(RC[-22]<>0,RC[-22]&R4C32,"q") -> q | AJ64: =IF(RC[-22]<>0,RC[-22]&R4C32,"q") -> q | AK64: =IF(RC[-22]<>0,RC[-22]&R4C32,"q") -> q | AL64: =IF(RC[-22]<>0,RC[-22]&R4C32,"q") -> q | AM64: =IF(RC[-22]<>0,RC[-22]&R4C32,"q") -> q | AN64: =IF(RC[-22]<>0,RC[-22]&R4C32,"q") -> q | AO64: =IF(RC[-22]<>0,RC[-22]&R4C32,"q") -> q | AP64: =IF(RC[-22]<>0,RC[-22]&R4C32,"q") -> q | AQ64: =IF(RC[-22]<>0,RC[-22]&R4C32,"q") -> q | AR64: =IF(RC[-22]<>0,RC[-22]&R4C32,"q") -> q | AS64: =IF(RC[-22]<>0,RC[-22]&R4C32,"q") -> q | AT64: =IF(RC[-22]<>0,RC[-22]&R4C32,"q") -> 0,1,7,89000;0,1,8,2250;0,1,4,5000;; | AU64: =IF(RC[-22]<>0,RC[-22]&R4C32,"q") -> q | AV64: =IF(RC[-22]<>0,RC[-22]&R4C32,"q") -> 0,1,7,89000;0,1,8,2250;0,1,4,5000;qqqqqqqqqqqqqq;
E65: 0,1,7,4500 | F65: 29000 | G65: =R2C5&RC[-1] -> 0,1,7,29000 | H65: 0,1,8,2250 | I65: 0,1,4,5000 | X65: 0,1,7,29000;0,1,8,2250;0,1,4,5000; | Z65: =RC[3]&RC[4]&RC[5]&RC[6]&RC[7]&RC[8]&RC[9]&RC[10]&RC[11]&RC[12]&RC[13]&RC[14]&RC[15]&RC[16]&RC[17]&RC[18]&RC[19] -> 0,1,7,29000;0,1,8,2250;0,1,4,5000;qqqqqqqqqqqqqq | AC65: =IF(RC[-22]<>0,RC[-22]&R4C32,"q") -> 0,1,7,29000; | AD65: =IF(RC[-22]<>0,RC[-22]&R4C32,"q") -> 0,1,8,2250; | AE65: =IF(RC[-22]<>0,RC[-22]&R4C32,"q") -> 0,1,4,5000; | AF65: =IF(RC[-22]<>0,RC[-22]&R4C32,"q") -> q | AG65: =IF(RC[-22]<>0,RC[-22]&R4C32,"q") -> q | AH65: =IF(RC[-22]<>0,RC[-22]&R4C32,"q") -> q | AI65: =IF(RC[-22]<>0,RC[-22]&R4C32,"q") -> q | AJ65: =IF(RC[-22]<>0,RC[-22]&R4C32,"q") -> q | AK65: =IF(RC[-22]<>0,RC[-22]&R4C32,"q") -> q | AL65: =IF(RC[-22]<>0,RC[-22]&R4C32,"q") -> q | AM65: =IF(RC[-22]<>0,RC[-22]&R4C32,"q") -> q | AN65: =IF(RC[-22]<>0,RC[-22]&R4C32,"q") -> q | AO65: =IF(RC[-22]<>0,RC[-22]&R4C32,"q") -> q | AP65: =IF(RC[-22]<>0,RC[-22]&R4C32,"q") -> q | AQ65: =IF(RC[-22]<>0,RC[-22]&R4C32,"q") -> q | AR65: =IF(RC[-22]<>0,RC[-22]&R4C32,"q") -> q | AS65: =IF(RC[-22]<>0,RC[-22]&R4C32,"q") -> q | AT65: =IF(RC[-22]<>0,RC[-22]&R4C32,"q") -> 0,1,7,29000;0,1,8,2250;0,1,4,5000;; | AU65: =IF(RC[-22]<>0,RC[-22]&R4C32,"q") -> q | AV65: =IF(RC[-22]<>0,RC[-22]&R4C32,"q") -> 0,1,7,29000;0,1,8,2250;0,1,4,5000;qqqqqqqqqqqqqq;
E66: 0,1,7,4500 | F66: 30000 | G66: =R2C5&RC[-1] -> 0,1,7,30000 | H66: 0,1,8,2250 | I66: 0,1,4,5000 | X66: 0,1,7,30000;0,1,8,2250;0,1,4,5000; | Z66: =RC[3]&RC[4]&RC[5]&RC[6]&RC[7]&RC[8]&RC[9]&RC[10]&RC[11]&RC[12]&RC[13]&RC[14]&RC[15]&RC[16]&RC[17]&RC[18]&RC[19] -> 0,1,7,30000;0,1,8,2250;0,1,4,5000;qqqqqqqqqqqqqq | AC66: =IF(RC[-22]<>0,RC[-22]&R4C32,"q") -> 0,1,7,30000; | AD66: =IF(RC[-22]<>0,RC[-22]&R4C32,"q") -> 0,1,8,2250; | AE66: =IF(RC[-22]<>0,RC[-22]&R4C32,"q") -> 0,1,4,5000; | AF66: =IF(RC[-22]<>0,RC[-22]&R4C32,"q") -> q | AG66: =IF(RC[-22]<>0,RC[-22]&R4C32,"q") -> q | AH66: =IF(RC[-22]<>0,RC[-22]&R4C32,"q") -> q | AI66: =IF(RC[-22]<>0,RC[-22]&R4C32,"q") -> q | AJ66: =IF(RC[-22]<>0,RC[-22]&R4C32,"q") -> q | AK66: =IF(RC[-22]<>0,RC[-22]&R4C32,"q") -> q | AL66: =IF(RC[-22]<>0,RC[-22]&R4C32,"q") -> q | AM66: =IF(RC[-22]<>0,RC[-22]&R4C32,"q") -> q | AN66: =IF(RC[-22]<>0,RC[-22]&R4C32,"q") -> q | AO66: =IF(RC[-22]<>0,RC[-22]&R4C32,"q") -> q | AP66: =IF(RC[-22]<>0,RC[-22]&R4C32,"q") -> q | AQ66: =IF(RC[-22]<>0,RC[-22]&R4C32,"q") -> q | AR66: =IF(RC[-22]<>0,RC[-22]&R4C32,"q") -> q | AS66: =IF(RC[-22]<>0,RC[-22]&R4C32,"q") -> q | AT66: =IF(RC[-22]<>0,RC[-22]&R4C32,"q") -> 0,1,7,30000;0,1,8,2250;0,1,4,5000;; | AU66: =IF(RC[-22]<>0,RC[-22]&R4C32,"q") -> q | AV66: =IF(RC[-22]<>0,RC[-22]&R4C32,"q") -> 0,1,7,30000;0,1,8,2250;0,1,4,5000;qqqqqqqqqqqqqq;
E67: 0,1,7,4500 | F67: 30000 | G67: =R2C5&RC[-1] -> 0,1,7,30000 | H67: 0,1,8,2250 | I67: 0,1,4,5000 | X67: 0,1,7,30000;0,1,8,2250;0,1,4,5000; | Z67: =RC[3]&RC[4]&RC[5]&RC[6]&RC[7]&RC[8]&RC[9]&RC[10]&RC[11]&RC[12]&RC[13]&RC[14]&RC[15]&RC[16]&RC[17]&RC[18]&RC[19] -> 0,1,7,30000;0,1,8,2250;0,1,4,5000;qqqqqqqqqqqqqq | AC67: =IF(RC[-22]<>0,RC[-22]&R4C32,"q") -> 0,1,7,30000; | AD67: =IF(RC[-22]<>0,RC[-22]&R4C32,"q") -> 0,1,8,2250; | AE67: =IF(RC[-22]<>0,RC[-22]&R4C32,"q") -> 0,1,4,5000; | AF67: =IF(RC[-22]<>0,RC[-22]&R4C32,"q") -> q | AG67: =IF(RC[-22]<>0,RC[-22]&R4C32,"q") -> q | AH67: =IF(RC[-22]<>0,RC[-22]&R4C32,"q") -> q | AI67: =IF(RC[-22]<>0,RC[-22]&R4C32,"q") -> q | AJ67: =IF(RC[-22]<>0,RC[-22]&R4C32,"q") -> q | AK67: =IF(RC[-22]<>0,RC[-22]&R4C32,"q") -> q | AL67: =IF(RC[-22]<>0,RC[-22]&R4C32,"q") -> q | AM67: =IF(RC[-22]<>0,RC[-22]&R4C32,"q") -> q | AN67: =IF(RC[-22]<>0,RC[-22]&R4C32,"q") -> q | AO67: =IF(RC[-22]<>0,RC[-22]&R4C32,"q") -> q | AP67: =IF(RC[-22]<>0,RC[-22]&R4C32,"q") -> q | AQ67: =IF(RC[-22]<>0,RC[-22]&R4C32,"q") -> q | AR67: =IF(RC[-22]<>0,RC[-22]&R4C32,"q") -> q | AS67: =IF(RC[-22]<>0,RC[-22]&R4C32,"q") -> q | AT67: =IF(RC[-22]<>0,RC[-22]&R4C32,"q") -> 0,1,7,30000;0,1,8,2250;0,1,4,5000;; | AU67: =IF(RC[-22]<>0,RC[-22]&R4C32,"q") -> q | AV67: =IF(RC[-22]<>0,RC[-22]&R4C32,"q") -> 0,1,7,30000;0,1,8,2250;0,1,4,5000;qqqqqqqqqqqqqq;
E68: 0,1,7,187500 | F68: 31000 | G68: =R2C5&RC[-1] -> 0,1,7,31000 | H68: 0,1,8,93750 | I68: 0,1,4,195000 | X68: 0,1,7,31000;0,1,8,93750;0,1,4,195000; | Z68: =RC[3]&RC[4]&RC[5]&RC[6]&RC[7]&RC[8]&RC[9]&RC[10]&RC[11]&RC[12]&RC[13]&RC[14]&RC[15]&RC[16]&RC[17]&RC[18]&RC[19] -> 0,1,7,31000;0,1,8,93750;0,1,4,195000;qqqqqqqqqqqqqq | AC68: =IF(RC[-22]<>0,RC[-22]&R4C32,"q") -> 0,1,7,31000; | AD68: =IF(RC[-22]<>0,RC[-22]&R4C32,"q") -> 0,1,8,93750; | AE68: =IF(RC[-22]<>0,RC[-22]&R4C32,"q") -> 0,1,4,195000; | AF68: =IF(RC[-22]<>0,RC[-22]&R4C32,"q") -> q | AG68: =IF(RC[-22]<>0,RC[-22]&R4C32,"q") -> q | AH68: =IF(RC[-22]<>0,RC[-22]&R4C32,"q") -> q | AI68: =IF(RC[-22]<>0,RC[-22]&R4C32,"q") -> q | AJ68: =IF(RC[-22]<>0,RC[-22]&R4C32,"q") -> q | AK68: =IF(RC[-22]<>0,RC[-22]&R4C32,"q") -> q | AL68: =IF(RC[-22]<>0,RC[-22]&R4C32,"q") -> q | AM68: =IF(RC[-22]<>0,RC[-22]&R4C32,"q") -> q | AN68: =IF(RC[-22]<>0,RC[-22]&R4C32,"q") -> q | AO68: =IF(RC[-22]<>0,RC[-22]&R4C32,"q") -> q | AP68: =IF(RC[-22]<>0,RC[-22]&R4C32,"q") -> q | AQ68: =IF(RC[-22]<>0,RC[-22]&R4C32,"q") -> q | AR68: =IF(RC[-22]<>0,RC[-22]&R4C32,"q") -> q | AS68: =IF(RC[-22]<>0,RC[-22]&R4C32,"q") -> q | AT68: =IF(RC[-22]<>0,RC[-22]&R4C32,"q") -> 0,1,7,31000;0,1,8,93750;0,1,4,195000;; | AU68: =IF(RC[-22]<>0,RC[-22]&R4C32,"q") -> q | AV68: =IF(RC[-22]<>0,RC[-22]&R4C32,"q") -> 0,1,7,31000;0,1,8,93750;0,1,4,195000;qqqqqqqqqqqqqq;
E69: 0,1,7,4500 | F69: 96000 | G69: =R2C5&RC[-1] -> 0,1,7,96000 | H69: 0,1,8,2250 | I69: 0,1,4,5000 | X69: 0,1,7,96000;0,1,8,2250;0,1,4,5000; | Z69: =RC[3]&RC[4]&RC[5]&RC[6]&RC[7]&RC[8]&RC[9]&RC[10]&RC[11]&RC[12]&RC[13]&RC[14]&RC[15]&RC[16]&RC[17]&RC[18]&RC[19] -> 0,1,7,96000;0,1,8,2250;0,1,4,5000;qqqqqqqqqqqqqq | AC69: =IF(RC[-22]<>0,RC[-22]&R4C32,"q") -> 0,1,7,96000; | AD69: =IF(RC[-22]<>0,RC[-22]&R4C32,"q") -> 0,1,8,2250; | AE69: =IF(RC[-22]<>0,RC[-22]&R4C32,"q") -> 0,1,4,5000; | AF69: =IF(RC[-22]<>0,RC[-22]&R4C32,"q") -> q | AG69: =IF(RC[-22]<>0,RC[-22]&R4C32,"q") -> q | AH69: =IF(RC[-22]<>0,RC[-22]&R4C32,"q") -> q | AI69: =IF(RC[-22]<>0,RC[-22]&R4C32,"q") -> q | AJ69: =IF(RC[-22]<>0,RC[-22]&R4C32,"q") -> q | AK69: =IF(RC[-22]<>0,RC[-22]&R4C32,"q") -> q | AL69: =IF(RC[-22]<>0,RC[-22]&R4C32,"q") -> q | AM69: =IF(RC[-22]<>0,RC[-22]&R4C32,"q") -> q | AN69: =IF(RC[-22]<>0,RC[-22]&R4C32,"q") -> q | AO69: =IF(RC[-22]<>0,RC[-22]&R4C32,"q") -> q | AP69: =IF(RC[-22]<>0,RC[-22]&R4C32,"q") -> q | AQ69: =IF(RC[-22]<>0,RC[-22]&R4C32,"q") -> q | AR69: =IF(RC[-22]<>0,RC[-22]&R4C32,"q") -> q | AS69: =IF(RC[-22]<>0,RC[-22]&R4C32,"q") -> q | AT69: =IF(RC[-22]<>0,RC[-22]&R4C32,"q") -> 0,1,7,96000;0,1,8,2250;0,1,4,5000;; | AU69: =IF(RC[-22]<>0,RC[-22]&R4C32,"q") -> q | AV69: =IF(RC[-22]<>0,RC[-22]&R4C32,"q") -> 0,1,7,96000;0,1,8,2250;0,1,4,5000;qqqqqqqqqqqqqq;
E70: 0,1,7,4500 | F70: 32000 | G70: =R2C5&RC[-1] -> 0,1,7,32000 | H70: 0,1,8,2250 | I70: 0,1,4,5000 | X70: 0,1,7,32000;0,1,8,2250;0,1,4,5000; | Z70: =RC[3]&RC[4]&RC[5]&RC[6]&RC[7]&RC[8]&RC[9]&RC[10]&RC[11]&RC[12]&RC[13]&RC[14]&RC[15]&RC[16]&RC[17]&RC[18]&RC[19] -> 0,1,7,32000;0,1,8,2250;0,1,4,5000;qqqqqqqqqqqqqq | AC70: =IF(RC[-22]<>0,RC[-22]&R4C32,"q") -> 0,1,7,32000; | AD70: =IF(RC[-22]<>0,RC[-22]&R4C32,"q") -> 0,1,8,2250; | AE70: =IF(RC[-22]<>0,RC[-22]&R4C32,"q") -> 0,1,4,5000; | AF70: =IF(RC[-22]<>0,RC[-22]&R4C32,"q") -> q | AG70: =IF(RC[-22]<>0,RC[-22]&R4C32,"q") -> q | AH70: =IF(RC[-22]<>0,RC[-22]&R4C32,"q") -> q | AI70: =IF(RC[-22]<>0,RC[-22]&R4C32,"q") -> q | AJ70: =IF(RC[-22]<>0,RC[-22]&R4C32,"q") -> q | AK70: =IF(RC[-22]<>0,RC[-22]&R4C32,"q") -> q | AL70: =IF(RC[-22]<>0,RC[-22]&R4C32,"q") -> q | AM70: =IF(RC[-22]<>0,RC[-22]&R4C32,"q") -> q | AN70: =IF(RC[-22]<>0,RC[-22]&R4C32,"q") -> q | AO70: =IF(RC[-22]<>0,RC[-22]&R4C32,"q") -> q | AP70: =IF(RC[-22]<>0,RC[-22]&R4C32,"q") -> q | AQ70: =IF(RC[-22]<>0,RC[-22]&R4C32,"q") -> q | AR70: =IF(RC[-22]<>0,RC[-22]&R4C32,"q") -> q | AS70: =IF(RC[-22]<>0,RC[-22]&R4C32,"q") -> q | AT70: =IF(RC[-22]<>0,RC[-22]&R4C32,"q") -> 0,1,7,32000;0,1,8,2250;0,1,4,5000;; | AU70: =IF(RC[-22]<>0,RC[-22]&R4C32,"q") -> q | AV70: =IF(RC[-22]<>0,RC[-22]&R4C32,"q") -> 0,1,7,32000;0,1,8,2250;0,1,4,5000;qqqqqqqqqqqqqq;
E71: 0,1,7,200000 | F71: 32000 | G71: =R2C5&RC[-1] -> 0,1,7,32000 | H71: 0,1,8,100000 | I71: 0,1,4,195000 | X71: 0,1,7,32000;0,1,8,100000;0,1,4,195000; | Z71: =RC[3]&RC[4]&RC[5]&RC[6]&RC[7]&RC[8]&RC[9]&RC[10]&RC[11]&RC[12]&RC[13]&RC[14]&RC[15]&RC[16]&RC[17]&RC[18]&RC[19] -> 0,1,7,32000;0,1,8,100000;0,1,4,195000;qqqqqqqqqqqqqq | AC71: =IF(RC[-22]<>0,RC[-22]&R4C32,"q") -> 0,1,7,32000; | AD71: =IF(RC[-22]<>0,RC[-22]&R4C32,"q") -> 0,1,8,100000; | AE71: =IF(RC[-22]<>0,RC[-22]&R4C32,"q") -> 0,1,4,195000; | AF71: =IF(RC[-22]<>0,RC[-22]&R4C32,"q") -> q | AG71: =IF(RC[-22]<>0,RC[-22]&R4C32,"q") -> q | AH71: =IF(RC[-22]<>0,RC[-22]&R4C32,"q") -> q | AI71: =IF(RC[-22]<>0,RC[-22]&R4C32,"q") -> q | AJ71: =IF(RC[-22]<>0,RC[-22]&R4C32,"q") -> q | AK71: =IF(RC[-22]<>0,RC[-22]&R4C32,"q") -> q | AL71: =IF(RC[-22]<>0,RC[-22]&R4C32,"q") -> q | AM71: =IF(RC[-22]<>0,RC[-22]&R4C32,"q") -> q | AN71: =IF(RC[-22]<>0,RC[-22]&R4C32,"q") -> q | AO71: =IF(RC[-22]<>0,RC[-22]&R4C32,"q") -> q | AP71: =IF(RC[-22]<>0,RC[-22]&R4C32,"q") -> q | AQ71: =IF(RC[-22]<>0,RC[-22]&R4C32,"q") -> q | AR71: =IF(RC[-22]<>0,RC[-22]&R4C32,"q") -> q | AS71: =IF(RC[-22]<>0,RC[-22]&R4C32,"q") -> q | AT71: =IF(RC[-22]<>0,RC[-22]&R4C32,"q") -> 0,1,7,32000;0,1,8,100000;0,1,4,195000;; | AU71: =IF(RC[-22]<>0,RC[-22]&R4C32,"q") -> q | AV71: =IF(RC[-22]<>0,RC[-22]&R4C32,"q") -> 0,1,7,32000;0,1,8,100000;0,1,4,195000;qqqqqqqqqqqqqq;
E72: 0,1,7,4500 | F72: 33000 | G72: =R2C5&RC[-1] -> 0,1,7,33000 | H72: 0,1,8,2250 | I72: 0,1,4,5000 | X72: 0,1,7,33000;0,1,8,2250;0,1,4,5000; | Z72: =RC[3]&RC[4]&RC[5]&RC[6]&RC[7]&RC[8]&RC[9]&RC[10]&RC[11]&RC[12]&RC[13]&RC[14]&RC[15]&RC[16]&RC[17]&RC[18]&RC[19] -> 0,1,7,33000;0,1,8,2250;0,1,4,5000;qqqqqqqqqqqqqq | AC72: =IF(RC[-22]<>0,RC[-22]&R4C32,"q") -> 0,1,7,33000; | AD72: =IF(RC[-22]<>0,RC[-22]&R4C32,"q") -> 0,1,8,2250; | AE72: =IF(RC[-22]<>0,RC[-22]&R4C32,"q") -> 0,1,4,5000; | AF72: =IF(RC[-22]<>0,RC[-22]&R4C32,"q") -> q | AG72: =IF(RC[-22]<>0,RC[-22]&R4C32,"q") -> q | AH72: =IF(RC[-22]<>0,RC[-22]&R4C32,"q") -> q | AI72: =IF(RC[-22]<>0,RC[-22]&R4C32,"q") -> q | AJ72: =IF(RC[-22]<>0,RC[-22]&R4C32,"q") -> q | AK72: =IF(RC[-22]<>0,RC[-22]&R4C32,"q") -> q | AL72: =IF(RC[-22]<>0,RC[-22]&R4C32,"q") -> q | AM72: =IF(RC[-22]<>0,RC[-22]&R4C32,"q") -> q | AN72: =IF(RC[-22]<>0,RC[-22]&R4C32,"q") -> q | AO72: =IF(RC[-22]<>0,RC[-22]&R4C32,"q") -> q | AP72: =IF(RC[-22]<>0,RC[-22]&R4C32,"q") -> q | AQ72: =IF(RC[-22]<>0,RC[-22]&R4C32,"q") -> q | AR72: =IF(RC[-22]<>0,RC[-22]&R4C32,"q") -> q | AS72: =IF(RC[-22]<>0,RC[-22]&R4C32,"q") -> q | AT72: =IF(RC[-22]<>0,RC[-22]&R4C32,"q") -> 0,1,7,33000;0,1,8,2250;0,1,4,5000;; | AU72: =IF(RC[-22]<>0,RC[-22]&R4C32,"q") -> q | AV72: =IF(RC[-22]<>0,RC[-22]&R4C32,"q") -> 0,1,7,33000;0,1,8,2250;0,1,4,5000;qqqqqqqqqqqqqq;
E73: 0,1,7,5000 | F73: 33000 | G73: =R2C5&RC[-1] -> 0,1,7,33000 | H73: 0,1,8,2500 | I73: 0,1,4,5500 | X73: 0,1,7,33000;0,1,8,2500;0,1,4,5500; | Z73: =RC[3]&RC[4]&RC[5]&RC[6]&RC[7]&RC[8]&RC[9]&RC[10]&RC[11]&RC[12]&RC[13]&RC[14]&RC[15]&RC[16]&RC[17]&RC[18]&RC[19] -> 0,1,7,33000;0,1,8,2500;0,1,4,5500;qqqqqqqqqqqqqq | AC73: =IF(RC[-22]<>0,RC[-22]&R4C32,"q") -> 0,1,7,33000; | AD73: =IF(RC[-22]<>0,RC[-22]&R4C32,"q") -> 0,1,8,2500; | AE73: =IF(RC[-22]<>0,RC[-22]&R4C32,"q") -> 0,1,4,5500; | AF73: =IF(RC[-22]<>0,RC[-22]&R4C32,"q") -> q | AG73: =IF(RC[-22]<>0,RC[-22]&R4C32,"q") -> q | AH73: =IF(RC[-22]<>0,RC[-22]&R4C32,"q") -> q | AI73: =IF(RC[-22]<>0,RC[-22]&R4C32,"q") -> q | AJ73: =IF(RC[-22]<>0,RC[-22]&R4C32,"q") -> q | AK73: =IF(RC[-22]<>0,RC[-22]&R4C32,"q") -> q | AL73: =IF(RC[-22]<>0,RC[-22]&R4C32,"q") -> q | AM73: =IF(RC[-22]<>0,RC[-22]&R4C32,"q") -> q | AN73: =IF(RC[-22]<>0,RC[-22]&R4C32,"q") -> q | AO73: =IF(RC[-22]<>0,RC[-22]&R4C32,"q") -> q | AP73: =IF(RC[-22]<>0,RC[-22]&R4C32,"q") -> q | AQ73: =IF(RC[-22]<>0,RC[-22]&R4C32,"q") -> q | AR73: =IF(RC[-22]<>0,RC[-22]&R4C32,"q") -> q | AS73: =IF(RC[-22]<>0,RC[-22]&R4C32,"q") -> q | AT73: =IF(RC[-22]<>0,RC[-22]&R4C32,"q") -> 0,1,7,33000;0,1,8,2500;0,1,4,5500;; | AU73: =IF(RC[-22]<>0,RC[-22]&R4C32,"q") -> q | AV73: =IF(RC[-22]<>0,RC[-22]&R4C32,"q") -> 0,1,7,33000;0,1,8,2500;0,1,4,5500;qqqqqqqqqqqqqq;
E74: 0,1,7,5000 | F74: 104000 | G74: =R2C5&RC[-1] -> 0,1,7,104000 | H74: 0,1,8,2500 | I74: 0,1,4,5500 | X74: 0,1,7,104000;0,1,8,2500;0,1,4,5500; | Z74: =RC[3]&RC[4]&RC[5]&RC[6]&RC[7]&RC[8]&RC[9]&RC[10]&RC[11]&RC[12]&RC[13]&RC[14]&RC[15]&RC[16]&RC[17]&RC[18]&RC[19] -> 0,1,7,104000;0,1,8,2500;0,1,4,5500;qqqqqqqqqqqqqq | AC74: =IF(RC[-22]<>0,RC[-22]&R4C32,"q") -> 0,1,7,104000; | AD74: =IF(RC[-22]<>0,RC[-22]&R4C32,"q") -> 0,1,8,2500; | AE74: =IF(RC[-22]<>0,RC[-22]&R4C32,"q") -> 0,1,4,5500; | AF74: =IF(RC[-22]<>0,RC[-22]&R4C32,"q") -> q | AG74: =IF(RC[-22]<>0,RC[-22]&R4C32,"q") -> q | AH74: =IF(RC[-22]<>0,RC[-22]&R4C32,"q") -> q | AI74: =IF(RC[-22]<>0,RC[-22]&R4C32,"q") -> q | AJ74: =IF(RC[-22]<>0,RC[-22]&R4C32,"q") -> q | AK74: =IF(RC[-22]<>0,RC[-22]&R4C32,"q") -> q | AL74: =IF(RC[-22]<>0,RC[-22]&R4C32,"q") -> q | AM74: =IF(RC[-22]<>0,RC[-22]&R4C32,"q") -> q | AN74: =IF(RC[-22]<>0,RC[-22]&R4C32,"q") -> q | AO74: =IF(RC[-22]<>0,RC[-22]&R4C32,"q") -> q | AP74: =IF(RC[-22]<>0,RC[-22]&R4C32,"q") -> q | AQ74: =IF(RC[-22]<>0,RC[-22]&R4C32,"q") -> q | AR74: =IF(RC[-22]<>0,RC[-22]&R4C32,"q") -> q | AS74: =IF(RC[-22]<>0,RC[-22]&R4C32,"q") -> q | AT74: =IF(RC[-22]<>0,RC[-22]&R4C32,"q") -> 0,1,7,104000;0,1,8,2500;0,1,4,5500;; | AU74: =IF(RC[-22]<>0,RC[-22]&R4C32,"q") -> q | AV74: =IF(RC[-22]<>0,RC[-22]&R4C32,"q") -> 0,1,7,104000;0,1,8,2500;0,1,4,5500;qqqqqqqqqqqqqq;
E75: 0,1,7,300000 | F75: 34000 | G75: =R2C5&RC[-1] -> 0,1,7,34000 | H75: 0,1,8,160000 | I75: 0,1,4,638000 | X75: 0,1,7,34000;0,1,8,160000;0,1,4,638000; | Z75: =RC[3]&RC[4]&RC[5]&RC[6]&RC[7]&RC[8]&RC[9]&RC[10]&RC[11]&RC[12]&RC[13]&RC[14]&RC[15]&RC[16]&RC[17]&RC[18]&RC[19] -> 0,1,7,34000;0,1,8,160000;0,1,4,638000;qqqqqqqqqqqqqq | AC75: =IF(RC[-22]<>0,RC[-22]&R4C32,"q") -> 0,1,7,34000; | AD75: =IF(RC[-22]<>0,RC[-22]&R4C32,"q") -> 0,1,8,160000; | AE75: =IF(RC[-22]<>0,RC[-22]&R4C32,"q") -> 0,1,4,638000; | AF75: =IF(RC[-22]<>0,RC[-22]&R4C32,"q") -> q | AG75: =IF(RC[-22]<>0,RC[-22]&R4C32,"q") -> q | AH75: =IF(RC[-22]<>0,RC[-22]&R4C32,"q") -> q | AI75: =IF(RC[-22]<>0,RC[-22]&R4C32,"q") -> q | AJ75: =IF(RC[-22]<>0,RC[-22]&R4C32,"q") -> q | AK75: =IF(RC[-22]<>0,RC[-22]&R4C32,"q") -> q | AL75: =IF(RC[-22]<>0,RC[-22]&R4C32,"q") -> q | AM75: =IF(RC[-22]<>0,RC[-22]&R4C32,"q") -> q | AN75: =IF(RC[-22]<>0,RC[-22]&R4C32,"q") -> q | AO75: =IF(RC[-22]<>0,RC[-22]&R4C32,"q") -> q | AP75: =IF(RC[-22]<>0,RC[-22]&R4C32,"q") -> q | AQ75: =IF(RC[-22]<>0,RC[-22]&R4C32,"q") -> q | AR75: =IF(RC[-22]<>0,RC[-22]&R4C32,"q") -> q | AS75: =IF(RC[-22]<>0,RC[-22]&R4C32,"q") -> q | AT75: =IF(RC[-22]<>0,RC[-22]&R4C32,"q") -> 0,1,7,34000;0,1,8,160000;0,1,4,638000;; | AU75: =IF(RC[-22]<>0,RC[-22]&R4C32,"q") -> q | AV75: =IF(RC[-22]<>0,RC[-22]&R4C32,"q") -> 0,1,7,34000;0,1,8,160000;0,1,4,638000;qqqqqqqqqqqqqq;
E76: 0,1,7,5000 | F76: 35000 | G76: =R2C5&RC[-1] -> 0,1,7,35000 | H76: 0,1,8,2500 | I76: 0,1,4,5500 | X76: 0,1,7,35000;0,1,8,2500;0,1,4,5500; | Z76: =RC[3]&RC[4]&RC[5]&RC[6]&RC[7]&RC[8]&RC[9]&RC[10]&RC[11]&RC[12]&RC[13]&RC[14]&RC[15]&RC[16]&RC[17]&RC[18]&RC[19] -> 0,1,7,35000;0,1,8,2500;0,1,4,5500;qqqqqqqqqqqqqq | AC76: =IF(RC[-22]<>0,RC[-22]&R4C32,"q") -> 0,1,7,35000; | AD76: =IF(RC[-22]<>0,RC[-22]&R4C32,"q") -> 0,1,8,2500; | AE76: =IF(RC[-22]<>0,RC[-22]&R4C32,"q") -> 0,1,4,5500; | AF76: =IF(RC[-22]<>0,RC[-22]&R4C32,"q") -> q | AG76: =IF(RC[-22]<>0,RC[-22]&R4C32,"q") -> q | AH76: =IF(RC[-22]<>0,RC[-22]&R4C32,"q") -> q | AI76: =IF(RC[-22]<>0,RC[-22]&R4C32,"q") -> q | AJ76: =IF(RC[-22]<>0,RC[-22]&R4C32,"q") -> q | AK76: =IF(RC[-22]<>0,RC[-22]&R4C32,"q") -> q | AL76: =IF(RC[-22]<>0,RC[-22]&R4C32,"q") -> q | AM76: =IF(RC[-22]<>0,RC[-22]&R4C32,"q") -> q | AN76: =IF(RC[-22]<>0,RC[-22]&R4C32,"q") -> q | AO76: =IF(RC[-22]<>0,RC[-22]&R4C32,"q") -> q | AP76: =IF(RC[-22]<>0,RC[-22]&R4C32,"q") -> q | AQ76: =IF(RC[-22]<>0,RC[-22]&R4C32,"q") -> q | AR76: =IF(RC[-22]<>0,RC[-22]&R4C32,"q") -> q | AS76: =IF(RC[-22]<>0,RC[-22]&R4C32,"q") -> q | AT76: =IF(RC[-22]<>0,RC[-22]&R4C32,"q") -> 0,1,7,35000;0,1,8,2500;0,1,4,5500;; | AU76: =IF(RC[-22]<>0,RC[-22]&R4C32,"q") -> q | AV76: =IF(RC[-22]<>0,RC[-22]&R4C32,"q") -> 0,1,7,35000;0,1,8,2500;0,1,4,5500;qqqqqqqqqqqqqq;
E77: 0,1,7,5000 | F77: 35000 | G77: =R2C5&RC[-1] -> 0,1,7,35000 | H77: 0,1,8,2500 | I77: 0,1,4,5500 | X77: 0,1,7,35000;0,1,8,2500;0,1,4,5500; | Z77: =RC[3]&RC[4]&RC[5]&RC[6]&RC[7]&RC[8]&RC[9]&RC[10]&RC[11]&RC[12]&RC[13]&RC[14]&RC[15]&RC[16]&RC[17]&RC[18]&RC[19] -> 0,1,7,35000;0,1,8,2500;0,1,4,5500;qqqqqqqqqqqqqq | AC77: =IF(RC[-22]<>0,RC[-22]&R4C32,"q") -> 0,1,7,35000; | AD77: =IF(RC[-22]<>0,RC[-22]&R4C32,"q") -> 0,1,8,2500; | AE77: =IF(RC[-22]<>0,RC[-22]&R4C32,"q") -> 0,1,4,5500; | AF77: =IF(RC[-22]<>0,RC[-22]&R4C32,"q") -> q | AG77: =IF(RC[-22]<>0,RC[-22]&R4C32,"q") -> q | AH77: =IF(RC[-22]<>0,RC[-22]&R4C32,"q") -> q | AI77: =IF(RC[-22]<>0,RC[-22]&R4C32,"q") -> q | AJ77: =IF(RC[-22]<>0,RC[-22]&R4C32,"q") -> q | AK77: =IF(RC[-22]<>0,RC[-22]&R4C32,"q") -> q | AL77: =IF(RC[-22]<>0,RC[-22]&R4C32,"q") -> q | AM77: =IF(RC[-22]<>0,RC[-22]&R4C32,"q") -> q | AN77: =IF(RC[-22]<>0,RC[-22]&R4C32,"q") -> q | AO77: =IF(RC[-22]<>0,RC[-22]&R4C32,"q") -> q | AP77: =IF(RC[-22]<>0,RC[-22]&R4C32,"q") -> q | AQ77: =IF(RC[-22]<>0,RC[-22]&R4C32,"q") -> q | AR77: =IF(RC[-22]<>0,RC[-22]&R4C32,"q") -> q | AS77: =IF(RC[-22]<>0,RC[-22]&R4C32,"q") -> q | AT77: =IF(RC[-22]<>0,RC[-22]&R4C32,"q") -> 0,1,7,35000;0,1,8,2500;0,1,4,5500;; | AU77: =IF(RC[-22]<>0,RC[-22]&R4C32,"q") -> q | AV77: =IF(RC[-22]<>0,RC[-22]&R4C32,"q") -> 0,1,7,35000;0,1,8,2500;0,1,4,5500;qqqqqqqqqqqqqq;
E78: 0,1,7,320000 | F78: 36000 | G78: =R2C5&RC[-1] -> 0,1,7,36000 | H78: 0,1,8,160000 | I78: 0,1,4,650000 | X78: 0,1,7,36000;0,1,8,160000;0,1,4,650000; | Z78: =RC[3]&RC[4]&RC[5]&RC[6]&RC[7]&RC[8]&RC[9]&RC[10]&RC[11]&RC[12]&RC[13]&RC[14]&RC[15]&RC[16]&RC[17]&RC[18]&RC[19] -> 0,1,7,36000;0,1,8,160000;0,1,4,650000;qqqqqqqqqqqqqq | AC78: =IF(RC[-22]<>0,RC[-22]&R4C32,"q") -> 0,1,7,36000; | AD78: =IF(RC[-22]<>0,RC[-22]&R4C32,"q") -> 0,1,8,160000; | AE78: =IF(RC[-22]<>0,RC[-22]&R4C32,"q") -> 0,1,4,650000; | AF78: =IF(RC[-22]<>0,RC[-22]&R4C32,"q") -> q | AG78: =IF(RC[-22]<>0,RC[-22]&R4C32,"q") -> q | AH78: =IF(RC[-22]<>0,RC[-22]&R4C32,"q") -> q | AI78: =IF(RC[-22]<>0,RC[-22]&R4C32,"q") -> q | AJ78: =IF(RC[-22]<>0,RC[-22]&R4C32,"q") -> q | AK78: =IF(RC[-22]<>0,RC[-22]&R4C32,"q") -> q | AL78: =IF(RC[-22]<>0,RC[-22]&R4C32,"q") -> q | AM78: =IF(RC[-22]<>0,RC[-22]&R4C32,"q") -> q | AN78: =IF(RC[-22]<>0,RC[-22]&R4C32,"q") -> q | AO78: =IF(RC[-22]<>0,RC[-22]&R4C32,"q") -> q | AP78: =IF(RC[-22]<>0,RC[-22]&R4C32,"q") -> q | AQ78: =IF(RC[-22]<>0,RC[-22]&R4C32,"q") -> q | AR78: =IF(RC[-22]<>0,RC[-22]&R4C32,"q") -> q | AS78: =IF(RC[-22]<>0,RC[-22]&R4C32,"q") -> q | AT78: =IF(RC[-22]<>0,RC[-22]&R4C32,"q") -> 0,1,7,36000;0,1,8,160000;0,1,4,650000;; | AU78: =IF(RC[-22]<>0,RC[-22]&R4C32,"q") -> q | AV78: =IF(RC[-22]<>0,RC[-22]&R4C32,"q") -> 0,1,7,36000;0,1,8,160000;0,1,4,650000;qqqqqqqqqqqqqq;
E79: 0,1,7,5000 | F79: 111000 | G79: =R2C5&RC[-1] -> 0,1,7,111000 | H79: 0,1,8,2500 | I79: 0,1,4,5500 | X79: 0,1,7,111000;0,1,8,2500;0,1,4,5500; | Z79: =RC[3]&RC[4]&RC[5]&RC[6]&RC[7]&RC[8]&RC[9]&RC[10]&RC[11]&RC[12]&RC[13]&RC[14]&RC[15]&RC[16]&RC[17]&RC[18]&RC[19] -> 0,1,7,111000;0,1,8,2500;0,1,4,5500;qqqqqqqqqqqqqq | AC79: =IF(RC[-22]<>0,RC[-22]&R4C32,"q") -> 0,1,7,111000; | AD79: =IF(RC[-22]<>0,RC[-22]&R4C32,"q") -> 0,1,8,2500; | AE79: =IF(RC[-22]<>0,RC[-22]&R4C32,"q") -> 0,1,4,5500; | AF79: =IF(RC[-22]<>0,RC[-22]&R4C32,"q") -> q | AG79: =IF(RC[-22]<>0,RC[-22]&R4C32,"q") -> q | AH79: =IF(RC[-22]<>0,RC[-22]&R4C32,"q") -> q | AI79: =IF(RC[-22]<>0,RC[-22]&R4C32,"q") -> q | AJ79: =IF(RC[-22]<>0,RC[-22]&R4C32,"q") -> q | AK79: =IF(RC[-22]<>0,RC[-22]&R4C32,"q") -> q | AL79: =IF(RC[-22]<>0,RC[-22]&R4C32,"q") -> q | AM79: =IF(RC[-22]<>0,RC[-22]&R4C32,"q") -> q | AN79: =IF(RC[-22]<>0,RC[-22]&R4C32,"q") -> q | AO79: =IF(RC[-22]<>0,RC[-22]&R4C32,"q") -> q | AP79: =IF(RC[-22]<>0,RC[-22]&R4C32,"q") -> q | AQ79: =IF(RC[-22]<>0,RC[-22]&R4C32,"q") -> q | AR79: =IF(RC[-22]<>0,RC[-22]&R4C32,"q") -> q | AS79: =IF(RC[-22]<>0,RC[-22]&R4C32,"q") -> q | AT79: =IF(RC[-22]<>0,RC[-22]&R4C32,"q") -> 0,1,7,111000;0,1,8,2500;0,1,4,5500;; | AU79: =IF(RC[-22]<>0,RC[-22]&R4C32,"q") -> q | AV79: =IF(RC[-22]<>0,RC[-22]&R4C32,"q") -> 0,1,7,111000;0,1,8,2500;0,1,4,5500;qqqqqqqqqqqqqq;
E80: 0,1,7,320000 | F80: 37000 | G80: =R2C5&RC[-1] -> 0,1,7,37000 | H80: 0,1,8,160000 | I80: 0,1,4,650000 | X80: 0,1,7,37000;0,1,8,160000;0,1,4,650000; | Z80: =RC[3]&RC[4]&RC[5]&RC[6]&RC[7]&RC[8]&RC[9]&RC[10]&RC[11]&RC[12]&RC[13]&RC[14]&RC[15]&RC[16]&RC[17]&RC[18]&RC[19] -> 0,1,7,37000;0,1,8,160000;0,1,4,650000;qqqqqqqqqqqqqq | AC80: =IF(RC[-22]<>0,RC[-22]&R4C32,"q") -> 0,1,7,37000; | AD80: =IF(RC[-22]<>0,RC[-22]&R4C32,"q") -> 0,1,8,160000; | AE80: =IF(RC[-22]<>0,RC[-22]&R4C32,"q") -> 0,1,4,650000; | AF80: =IF(RC[-22]<>0,RC[-22]&R4C32,"q") -> q | AG80: =IF(RC[-22]<>0,RC[-22]&R4C32,"q") -> q | AH80: =IF(RC[-22]<>0,RC[-22]&R4C32,"q") -> q | AI80: =IF(RC[-22]<>0,RC[-22]&R4C32,"q") -> q | AJ80: =IF(RC[-22]<>0,RC[-22]&R4C32,"q") -> q | AK80: =IF(RC[-22]<>0,RC[-22]&R4C32,"q") -> q | AL80: =IF(RC[-22]<>0,RC[-22]&R4C32,"q") -> q | AM80: =IF(RC[-22]<>0,RC[-22]&R4C32,"q") -> q | AN80: =IF(RC[-22]<>0,RC[-22]&R4C32,"q") -> q | AO80: =IF(RC[-22]<>0,RC[-22]&R4C32,"q") -> q | AP80: =IF(RC[-22]<>0,RC[-22]&R4C32,"q") -> q | AQ80: =IF(RC[-22]<>0,RC[-22]&R4C32,"q") -> q | AR80: =IF(RC[-22]<>0,RC[-22]&R4C32,"q") -> q | AS80: =IF(RC[-22]<>0,RC[-22]&R4C32,"q") -> q | AT80: =IF(RC[-22]<>0,RC[-22]&R4C32,"q") -> 0,1,7,37000;0,1,8,160000;0,1,4,650000;; | AU80: =IF(RC[-22]<>0,RC[-22]&R4C32,"q") -> q | AV80: =IF(RC[-22]<>0,RC[-22]&R4C32,"q") -> 0,1,7,37000;0,1,8,160000;0,1,4,650000;qqqqqqqqqqqqqq;
E81: 0,1,7,5000 | F81: 37000 | G81: =R2C5&RC[-1] -> 0,1,7,37000 | H81: 0,1,8,2500 | I81: 0,1,4,5500 | X81: 0,1,7,37000;0,1,8,2500;0,1,4,5500; | Z81: =RC[3]&RC[4]&RC[5]&RC[6]&RC[7]&RC[8]&RC[9]&RC[10]&RC[11]&RC[12]&RC[13]&RC[14]&RC[15]&RC[16]&RC[17]&RC[18]&RC[19] -> 0,1,7,37000;0,1,8,2500;0,1,4,5500;qqqqqqqqqqqqqq | AC81: =IF(RC[-22]<>0,RC[-22]&R4C32,"q") -> 0,1,7,37000; | AD81: =IF(RC[-22]<>0,RC[-22]&R4C32,"q") -> 0,1,8,2500; | AE81: =IF(RC[-22]<>0,RC[-22]&R4C32,"q") -> 0,1,4,5500; | AF81: =IF(RC[-22]<>0,RC[-22]&R4C32,"q") -> q | AG81: =IF(RC[-22]<>0,RC[-22]&R4C32,"q") -> q | AH81: =IF(RC[-22]<>0,RC[-22]&R4C32,"q") -> q | AI81: =IF(RC[-22]<>0,RC[-22]&R4C32,"q") -> q | AJ81: =IF(RC[-22]<>0,RC[-22]&R4C32,"q") -> q | AK81: =IF(RC[-22]<>0,RC[-22]&R4C32,"q") -> q | AL81: =IF(RC[-22]<>0,RC[-22]&R4C32,"q") -> q | AM81: =IF(RC[-22]<>0,RC[-22]&R4C32,"q") -> q | AN81: =IF(RC[-22]<>0,RC[-22]&R4C32,"q") -> q | AO81: =IF(RC[-22]<>0,RC[-22]&R4C32,"q") -> q | AP81: =IF(RC[-22]<>0,RC[-22]&R4C32,"q") -> q | AQ81: =IF(RC[-22]<>0,RC[-22]&R4C32,"q") -> q | AR81: =IF(RC[-22]<>0,RC[-22]&R4C32,"q") -> q | AS81: =IF(RC[-22]<>0,RC[-22]&R4C32,"q") -> q | AT81: =IF(RC[-22]<>0,RC[-22]&R4C32,"q") -> 0,1,7,37000;0,1,8,2500;0,1,4,5500;; | AU81: =IF(RC[-22]<>0,RC[-22]&R4C32,"q") -> q | AV81: =IF(RC[-22]<>0,RC[-22]&R4C32,"q") -> 0,1,7,37000;0,1,8,2500;0,1,4,5500;qqqqqqqqqqqqqq;
E82: 0,1,7,5000 | F82: 38000 | G82: =R2C5&RC[-1] -> 0,1,7,38000 | H82: 0,1,8,2500 | I82: 0,1,4,5500 | X82: 0,1,7,38000;0,1,8,2500;0,1,4,5500; | Z82: =RC[3]&RC[4]&RC[5]&RC[6]&RC[7]&RC[8]&RC[9]&RC[10]&RC[11]&RC[12]&RC[13]&RC[14]&RC[15]&RC[16]&RC[17]&RC[18]&RC[19] -> 0,1,7,38000;0,1,8,2500;0,1,4,5500;qqqqqqqqqqqqqq | AC82: =IF(RC[-22]<>0,RC[-22]&R4C32,"q") -> 0,1,7,38000; | AD82: =IF(RC[-22]<>0,RC[-22]&R4C32,"q") -> 0,1,8,2500; | AE82: =IF(RC[-22]<>0,RC[-22]&R4C32,"q") -> 0,1,4,5500; | AF82: =IF(RC[-22]<>0,RC[-22]&R4C32,"q") -> q | AG82: =IF(RC[-22]<>0,RC[-22]&R4C32,"q") -> q | AH82: =IF(RC[-22]<>0,RC[-22]&R4C32,"q") -> q | AI82: =IF(RC[-22]<>0,RC[-22]&R4C32,"q") -> q | AJ82: =IF(RC[-22]<>0,RC[-22]&R4C32,"q") -> q | AK82: =IF(RC[-22]<>0,RC[-22]&R4C32,"q") -> q | AL82: =IF(RC[-22]<>0,RC[-22]&R4C32,"q") -> q | AM82: =IF(RC[-22]<>0,RC[-22]&R4C32,"q") -> q | AN82: =IF(RC[-22]<>0,RC[-22]&R4C32,"q") -> q | AO82: =IF(RC[-22]<>0,RC[-22]&R4C32,"q") -> q | AP82: =IF(RC[-22]<>0,RC[-22]&R4C32,"q") -> q | AQ82: =IF(RC[-22]<>0,RC[-22]&R4C32,"q") -> q | AR82: =IF(RC[-22]<>0,RC[-22]&R4C32,"q") -> q | AS82: =IF(RC[-22]<>0,RC[-22]&R4C32,"q") -> q | AT82: =IF(RC[-22]<>0,RC[-22]&R4C32,"q") -> 0,1,7,38000;0,1,8,2500;0,1,4,5500;; | AU82: =IF(RC[-22]<>0,RC[-22]&R4C32,"q") -> q | AV82: =IF(RC[-22]<>0,RC[-22]&R4C32,"q") -> 0,1,7,38000;0,1,8,2500;0,1,4,5500;qqqqqqqqqqqqqq;
E83: 0,1,7,5000 | F83: 38000 | G83: =R2C5&RC[-1] -> 0,1,7,38000 | H83: 0,1,8,2500 | I83: 0,1,4,5500 | X83: 0,1,7,38000;0,1,8,2500;0,1,4,5500; | Z83: =RC[3]&RC[4]&RC[5]&RC[6]&RC[7]&RC[8]&RC[9]&RC[10]&RC[11]&RC[12]&RC[13]&RC[14]&RC[15]&RC[16]&RC[17]&RC[18]&RC[19] -> 0,1,7,38000;0,1,8,2500;0,1,4,5500;qqqqqqqqqqqqqq | AC83: =IF(RC[-22]<>0,RC[-22]&R4C32,"q") -> 0,1,7,38000; | AD83: =IF(RC[-22]<>0,RC[-22]&R4C32,"q") -> 0,1,8,2500; | AE83: =IF(RC[-22]<>0,RC[-22]&R4C32,"q") -> 0,1,4,5500; | AF83: =IF(RC[-22]<>0,RC[-22]&R4C32,"q") -> q | AG83: =IF(RC[-22]<>0,RC[-22]&R4C32,"q") -> q | AH83: =IF(RC[-22]<>0,RC[-22]&R4C32,"q") -> q | AI83: =IF(RC[-22]<>0,RC[-22]&R4C32,"q") -> q | AJ83: =IF(RC[-22]<>0,RC[-22]&R4C32,"q") -> q | AK83: =IF(RC[-22]<>0,RC[-22]&R4C32,"q") -> q | AL83: =IF(RC[-22]<>0,RC[-22]&R4C32,"q") -> q | AM83: =IF(RC[-22]<>0,RC[-22]&R4C32,"q") -> q | AN83: =IF(RC[-22]<>0,RC[-22]&R4C32,"q") -> q | AO83: =IF(RC[-22]<>0,RC[-22]&R4C32,"q") -> q | AP83: =IF(RC[-22]<>0,RC[-22]&R4C32,"q") -> q | AQ83: =IF(RC[-22]<>0,RC[-22]&R4C32,"q") -> q | AR83: =IF(RC[-22]<>0,RC[-22]&R4C32,"q") -> q | AS83: =IF(RC[-22]<>0,RC[-22]&R4C32,"q") -> q | AT83: =IF(RC[-22]<>0,RC[-22]&R4C32,"q") -> 0,1,7,38000;0,1,8,2500;0,1,4,5500;; | AU83: =IF(RC[-22]<>0,RC[-22]&R4C32,"q") -> q | AV83: =IF(RC[-22]<>0,RC[-22]&R4C32,"q") -> 0,1,7,38000;0,1,8,2500;0,1,4,5500;qqqqqqqqqqqqqq;
E84: 0,1,7,5500 | F84: 120000 | G84: =R2C5&RC[-1] -> 0,1,7,120000 | H84: 0,1,8,2750 | I84: 0,1,4,6500 | X84: 0,1,7,120000;0,1,8,2750;0,1,4,6500; | Z84: =RC[3]&RC[4]&RC[5]&RC[6]&RC[7]&RC[8]&RC[9]&RC[10]&RC[11]&RC[12]&RC[13]&RC[14]&RC[15]&RC[16]&RC[17]&RC[18]&RC[19] -> 0,1,7,120000;0,1,8,2750;0,1,4,6500;qqqqqqqqqqqqqq | AC84: =IF(RC[-22]<>0,RC[-22]&R4C32,"q") -> 0,1,7,120000; | AD84: =IF(RC[-22]<>0,RC[-22]&R4C32,"q") -> 0,1,8,2750; | AE84: =IF(RC[-22]<>0,RC[-22]&R4C32,"q") -> 0,1,4,6500; | AF84: =IF(RC[-22]<>0,RC[-22]&R4C32,"q") -> q | AG84: =IF(RC[-22]<>0,RC[-22]&R4C32,"q") -> q | AH84: =IF(RC[-22]<>0,RC[-22]&R4C32,"q") -> q | AI84: =IF(RC[-22]<>0,RC[-22]&R4C32,"q") -> q | AJ84: =IF(RC[-22]<>0,RC[-22]&R4C32,"q") -> q | AK84: =IF(RC[-22]<>0,RC[-22]&R4C32,"q") -> q | AL84: =IF(RC[-22]<>0,RC[-22]&R4C32,"q") -> q | AM84: =IF(RC[-22]<>0,RC[-22]&R4C32,"q") -> q | AN84: =IF(RC[-22]<>0,RC[-22]&R4C32,"q") -> q | AO84: =IF(RC[-22]<>0,RC[-22]&R4C32,"q") -> q | AP84: =IF(RC[-22]<>0,RC[-22]&R4C32,"q") -> q | AQ84: =IF(RC[-22]<>0,RC[-22]&R4C32,"q") -> q | AR84: =IF(RC[-22]<>0,RC[-22]&R4C32,"q") -> q | AS84: =IF(RC[-22]<>0,RC[-22]&R4C32,"q") -> q | AT84: =IF(RC[-22]<>0,RC[-22]&R4C32,"q") -> 0,1,7,120000;0,1,8,2750;0,1,4,6500;; | AU84: =IF(RC[-22]<>0,RC[-22]&R4C32,"q") -> q | AV84: =IF(RC[-22]<>0,RC[-22]&R4C32,"q") -> 0,1,7,120000;0,1,8,2750;0,1,4,6500;qqqqqqqqqqqqqq;
E85: 0,1,7,5500 | F85: 79000 | G85: =R2C5&RC[-1] -> 0,1,7,79000 | H85: 0,1,8,2750 | I85: 0,1,4,6500 | X85: 0,1,7,79000;0,1,8,2750;0,1,4,6500; | Z85: =RC[3]&RC[4]&RC[5]&RC[6]&RC[7]&RC[8]&RC[9]&RC[10]&RC[11]&RC[12]&RC[13]&RC[14]&RC[15]&RC[16]&RC[17]&RC[18]&RC[19] -> 0,1,7,79000;0,1,8,2750;0,1,4,6500;qqqqqqqqqqqqqq | AC85: =IF(RC[-22]<>0,RC[-22]&R4C32,"q") -> 0,1,7,79000; | AD85: =IF(RC[-22]<>0,RC[-22]&R4C32,"q") -> 0,1,8,2750; | AE85: =IF(RC[-22]<>0,RC[-22]&R4C32,"q") -> 0,1,4,6500; | AF85: =IF(RC[-22]<>0,RC[-22]&R4C32,"q") -> q | AG85: =IF(RC[-22]<>0,RC[-22]&R4C32,"q") -> q | AH85: =IF(RC[-22]<>0,RC[-22]&R4C32,"q") -> q | AI85: =IF(RC[-22]<>0,RC[-22]&R4C32,"q") -> q | AJ85: =IF(RC[-22]<>0,RC[-22]&R4C32,"q") -> q | AK85: =IF(RC[-22]<>0,RC[-22]&R4C32,"q") -> q | AL85: =IF(RC[-22]<>0,RC[-22]&R4C32,"q") -> q | AM85: =IF(RC[-22]<>0,RC[-22]&R4C32,"q") -> q | AN85: =IF(RC[-22]<>0,RC[-22]&R4C32,"q") -> q | AO85: =IF(RC[-22]<>0,RC[-22]&R4C32,"q") -> q | AP85: =IF(RC[-22]<>0,RC[-22]&R4C32,"q") -> q | AQ85: =IF(RC[-22]<>0,RC[-22]&R4C32,"q") -> q | AR85: =IF(RC[-22]<>0,RC[-22]&R4C32,"q") -> q | AS85: =IF(RC[-22]<>0,RC[-22]&R4C32,"q") -> q | AT85: =IF(RC[-22]<>0,RC[-22]&R4C32,"q") -> 0,1,7,79000;0,1,8,2750;0,1,4,6500;; | AU85: =IF(RC[-22]<>0,RC[-22]&R4C32,"q") -> q | AV85: =IF(RC[-22]<>0,RC[-22]&R4C32,"q") -> 0,1,7,79000;0,1,8,2750;0,1,4,6500;qqqqqqqqqqqqqq;
E86: 0,1,7,5500 | F86: 81000 | G86: =R2C5&RC[-1] -> 0,1,7,81000 | H86: 0,1,8,2750 | I86: 0,1,4,6500 | X86: 0,1,7,81000;0,1,8,2750;0,1,4,6500; | Z86: =RC[3]&RC[4]&RC[5]&RC[6]&RC[7]&RC[8]&RC[9]&RC[10]&RC[11]&RC[12]&RC[13]&RC[14]&RC[15]&RC[16]&RC[17]&RC[18]&RC[19] -> 0,1,7,81000;0,1,8,2750;0,1,4,6500;qqqqqqqqqqqqqq | AC86: =IF(RC[-22]<>0,RC[-22]&R4C32,"q") -> 0,1,7,81000; | AD86: =IF(RC[-22]<>0,RC[-22]&R4C32,"q") -> 0,1,8,2750; | AE86: =IF(RC[-22]<>0,RC[-22]&R4C32,"q") -> 0,1,4,6500; | AF86: =IF(RC[-22]<>0,RC[-22]&R4C32,"q") -> q | AG86: =IF(RC[-22]<>0,RC[-22]&R4C32,"q") -> q | AH86: =IF(RC[-22]<>0,RC[-22]&R4C32,"q") -> q | AI86: =IF(RC[-22]<>0,RC[-22]&R4C32,"q") -> q | AJ86: =IF(RC[-22]<>0,RC[-22]&R4C32,"q") -> q | AK86: =IF(RC[-22]<>0,RC[-22]&R4C32,"q") -> q | AL86: =IF(RC[-22]<>0,RC[-22]&R4C32,"q") -> q | AM86: =IF(RC[-22]<>0,RC[-22]&R4C32,"q") -> q | AN86: =IF(RC[-22]<>0,RC[-22]&R4C32,"q") -> q | AO86: =IF(RC[-22]<>0,RC[-22]&R4C32,"q") -> q | AP86: =IF(RC[-22]<>0,RC[-22]&R4C32,"q") -> q | AQ86: =IF(RC[-22]<>0,RC[-22]&R4C32,"q") -> q | AR86: =IF(RC[-22]<>0,RC[-22]&R4C32,"q") -> q | AS86: =IF(RC[-22]<>0,RC[-22]&R4C32,"q") -> q | AT86: =IF(RC[-22]<>0,RC[-22]&R4C32,"q") -> 0,1,7,81000;0,1,8,2750;0,1,4,6500;; | AU86: =IF(RC[-22]<>0,RC[-22]&R4C32,"q") -> q | AV86: =IF(RC[-22]<>0,RC[-22]&R4C32,"q") -> 0,1,7,81000;0,1,8,2750;0,1,4,6500;qqqqqqqqqqqqqq;
E87: 0,1,7,340000 | F87: 83000 | G87: =R2C5&RC[-1] -> 0,1,7,83000 | H87: 0,1,8,170000 | I87: 0,1,4,650000 | X87: 0,1,7,83000;0,1,8,170000;0,1,4,650000; | Z87: =RC[3]&RC[4]&RC[5]&RC[6]&RC[7]&RC[8]&RC[9]&RC[10]&RC[11]&RC[12]&RC[13]&RC[14]&RC[15]&RC[16]&RC[17]&RC[18]&RC[19] -> 0,1,7,83000;0,1,8,170000;0,1,4,650000;qqqqqqqqqqqqqq | AC87: =IF(RC[-22]<>0,RC[-22]&R4C32,"q") -> 0,1,7,83000; | AD87: =IF(RC[-22]<>0,RC[-22]&R4C32,"q") -> 0,1,8,170000; | AE87: =IF(RC[-22]<>0,RC[-22]&R4C32,"q") -> 0,1,4,650000; | AF87: =IF(RC[-22]<>0,RC[-22]&R4C32,"q") -> q | AG87: =IF(RC[-22]<>0,RC[-22]&R4C32,"q") -> q | AH87: =IF(RC[-22]<>0,RC[-22]&R4C32,"q") -> q | AI87: =IF(RC[-22]<>0,RC[-22]&R4C32,"q") -> q | AJ87: =IF(RC[-22]<>0,RC[-22]&R4C32,"q") -> q | AK87: =IF(RC[-22]<>0,RC[-22]&R4C32,"q") -> q | AL87: =IF(RC[-22]<>0,RC[-22]&R4C32,"q") -> q | AM87: =IF(RC[-22]<>0,RC[-22]&R4C32,"q") -> q | AN87: =IF(RC[-22]<>0,RC[-22]&R4C32,"q") -> q | AO87: =IF(RC[-22]<>0,RC[-22]&R4C32,"q") -> q | AP87: =IF(RC[-22]<>0,RC[-22]&R4C32,"q") -> q | AQ87: =IF(RC[-22]<>0,RC[-22]&R4C32,"q") -> q | AR87: =IF(RC[-22]<>0,RC[-22]&R4C32,"q") -> q | AS87: =IF(RC[-22]<>0,RC[-22]&R4C32,"q") -> q | AT87: =IF(RC[-22]<>0,RC[-22]&R4C32,"q") -> 0,1,7,83000;0,1,8,170000;0,1,4,650000;; | AU87: =IF(RC[-22]<>0,RC[-22]&R4C32,"q") -> q | AV87: =IF(RC[-22]<>0,RC[-22]&R4C32,"q") -> 0,1,7,83000;0,1,8,170000;0,1,4,650000;qqqqqqqqqqqqqq;
E88: 0,1,7,5500 | F88: 85000 | G88: =R2C5&RC[-1] -> 0,1,7,85000 | H88: 0,1,8,2750 | I88: 0,1,4,6500 | X88: 0,1,7,85000;0,1,8,2750;0,1,4,6500; | Z88: =RC[3]&RC[4]&RC[5]&RC[6]&RC[7]&RC[8]&RC[9]&RC[10]&RC[11]&RC[12]&RC[13]&RC[14]&RC[15]&RC[16]&RC[17]&RC[18]&RC[19] -> 0,1,7,85000;0,1,8,2750;0,1,4,6500;qqqqqqqqqqqqqq | AC88: =IF(RC[-22]<>0,RC[-22]&R4C32,"q") -> 0,1,7,85000; | AD88: =IF(RC[-22]<>0,RC[-22]&R4C32,"q") -> 0,1,8,2750; | AE88: =IF(RC[-22]<>0,RC[-22]&R4C32,"q") -> 0,1,4,6500; | AF88: =IF(RC[-22]<>0,RC[-22]&R4C32,"q") -> q | AG88: =IF(RC[-22]<>0,RC[-22]&R4C32,"q") -> q | AH88: =IF(RC[-22]<>0,RC[-22]&R4C32,"q") -> q | AI88: =IF(RC[-22]<>0,RC[-22]&R4C32,"q") -> q | AJ88: =IF(RC[-22]<>0,RC[-22]&R4C32,"q") -> q | AK88: =IF(RC[-22]<>0,RC[-22]&R4C32,"q") -> q | AL88: =IF(RC[-22]<>0,RC[-22]&R4C32,"q") -> q | AM88: =IF(RC[-22]<>0,RC[-22]&R4C32,"q") -> q | AN88: =IF(RC[-22]<>0,RC[-22]&R4C32,"q") -> q | AO88: =IF(RC[-22]<>0,RC[-22]&R4C32,"q") -> q | AP88: =IF(RC[-22]<>0,RC[-22]&R4C32,"q") -> q | AQ88: =IF(RC[-22]<>0,RC[-22]&R4C32,"q") -> q | AR88: =IF(RC[-22]<>0,RC[-22]&R4C32,"q") -> q | AS88: =IF(RC[-22]<>0,RC[-22]&R4C32,"q") -> q | AT88: =IF(RC[-22]<>0,RC[-22]&R4C32,"q") -> 0,1,7,85000;0,1,8,2750;0,1,4,6500;; | AU88: =IF(RC[-22]<>0,RC[-22]&R4C32,"q") -> q | AV88: =IF(RC[-22]<>0,RC[-22]&R4C32,"q") -> 0,1,7,85000;0,1,8,2750;0,1,4,6500;qqqqqqqqqqqqqq;
E89: 0,1,7,5500 | F89: 265000 | G89: =R2C5&RC[-1] -> 0,1,7,265000 | H89: 0,1,8,2750 | I89: 0,1,4,6500 | X89: 0,1,7,265000;0,1,8,2750;0,1,4,6500; | Z89: =RC[3]&RC[4]&RC[5]&RC[6]&RC[7]&RC[8]&RC[9]&RC[10]&RC[11]&RC[12]&RC[13]&RC[14]&RC[15]&RC[16]&RC[17]&RC[18]&RC[19] -> 0,1,7,265000;0,1,8,2750;0,1,4,6500;qqqqqqqqqqqqqq | AC89: =IF(RC[-22]<>0,RC[-22]&R4C32,"q") -> 0,1,7,265000; | AD89: =IF(RC[-22]<>0,RC[-22]&R4C32,"q") -> 0,1,8,2750; | AE89: =IF(RC[-22]<>0,RC[-22]&R4C32,"q") -> 0,1,4,6500; | AF89: =IF(RC[-22]<>0,RC[-22]&R4C32,"q") -> q | AG89: =IF(RC[-22]<>0,RC[-22]&R4C32,"q") -> q | AH89: =IF(RC[-22]<>0,RC[-22]&R4C32,"q") -> q | AI89: =IF(RC[-22]<>0,RC[-22]&R4C32,"q") -> q | AJ89: =IF(RC[-22]<>0,RC[-22]&R4C32,"q") -> q | AK89: =IF(RC[-22]<>0,RC[-22]&R4C32,"q") -> q | AL89: =IF(RC[-22]<>0,RC[-22]&R4C32,"q") -> q | AM89: =IF(RC[-22]<>0,RC[-22]&R4C32,"q") -> q | AN89: =IF(RC[-22]<>0,RC[-22]&R4C32,"q") -> q | AO89: =IF(RC[-22]<>0,RC[-22]&R4C32,"q") -> q | AP89: =IF(RC[-22]<>0,RC[-22]&R4C32,"q") -> q | AQ89: =IF(RC[-22]<>0,RC[-22]&R4C32,"q") -> q | AR89: =IF(RC[-22]<>0,RC[-22]&R4C32,"q") -> q | AS89: =IF(RC[-22]<>0,RC[-22]&R4C32,"q") -> q | AT89: =IF(RC[-22]<>0,RC[-22]&R4C32,"q") -> 0,1,7,265000;0,1,8,2750;0,1,4,6500;; | AU89: =IF(RC[-22]<>0,RC[-22]&R4C32,"q") -> q | AV89: =IF(RC[-22]<>0,RC[-22]&R4C32,"q") -> 0,1,7,265000;0,1,8,2750;0,1,4,6500;qqqqqqqqqqqqqq;
E90: 0,1,7,5500 | F90: 89000 | G90: =R2C5&RC[-1] -> 0,1,7,89000 | H90: 0,1,8,2750 | I90: 0,1,4,6500 | X90: 0,1,7,89000;0,1,8,2750;0,1,4,6500; | Z90: =RC[3]&RC[4]&RC[5]&RC[6]&RC[7]&RC[8]&RC[9]&RC[10]&RC[11]&RC[12]&RC[13]&RC[14]&RC[15]&RC[16]&RC[17]&RC[18]&RC[19] -> 0,1,7,89000;0,1,8,2750;0,1,4,6500;qqqqqqqqqqqqqq | AC90: =IF(RC[-22]<>0,RC[-22]&R4C32,"q") -> 0,1,7,89000; | AD90: =IF(RC[-22]<>0,RC[-22]&R4C32,"q") -> 0,1,8,2750; | AE90: =IF(RC[-22]<>0,RC[-22]&R4C32,"q") -> 0,1,4,6500; | AF90: =IF(RC[-22]<>0,RC[-22]&R4C32,"q") -> q | AG90: =IF(RC[-22]<>0,RC[-22]&R4C32,"q") -> q | AH90: =IF(RC[-22]<>0,RC[-22]&R4C32,"q") -> q | AI90: =IF(RC[-22]<>0,RC[-22]&R4C32,"q") -> q | AJ90: =IF(RC[-22]<>0,RC[-22]&R4C32,"q") -> q | AK90: =IF(RC[-22]<>0,RC[-22]&R4C32,"q") -> q | AL90: =IF(RC[-22]<>0,RC[-22]&R4C32,"q") -> q | AM90: =IF(RC[-22]<>0,RC[-22]&R4C32,"q") -> q | AN90: =IF(RC[-22]<>0,RC[-22]&R4C32,"q") -> q | AO90: =IF(RC[-22]<>0,RC[-22]&R4C32,"q") -> q | AP90: =IF(RC[-22]<>0,RC[-22]&R4C32,"q") -> q | AQ90: =IF(RC[-22]<>0,RC[-22]&R4C32,"q") -> q | AR90: =IF(RC[-22]<>0,RC[-22]&R4C32,"q") -> q | AS90: =IF(RC[-22]<>0,RC[-22]&R4C32,"q") -> q | AT90: =IF(RC[-22]<>0,RC[-22]&R4C32,"q") -> 0,1,7,89000;0,1,8,2750;0,1,4,6500;; | AU90: =IF(RC[-22]<>0,RC[-22]&R4C32,"q") -> q | AV90: =IF(RC[-22]<>0,RC[-22]&R4C32,"q") -> 0,1,7,89000;0,1,8,2750;0,1,4,6500;qqqqqqqqqqqqqq;
E91: 0,1,7,5500 | F91: 91000 | G91: =R2C5&RC[-1] -> 0,1,7,91000 | H91: 0,1,8,2750 | I91: 0,1,4,6500 | X91: 0,1,7,91000;0,1,8,2750;0,1,4,6500; | Z91: =RC[3]&RC[4]&RC[5]&RC[6]&RC[7]&RC[8]&RC[9]&RC[10]&RC[11]&RC[12]&RC[13]&RC[14]&RC[15]&RC[16]&RC[17]&RC[18]&RC[19] -> 0,1,7,91000;0,1,8,2750;0,1,4,6500;qqqqqqqqqqqqqq | AC91: =IF(RC[-22]<>0,RC[-22]&R4C32,"q") -> 0,1,7,91000; | AD91: =IF(RC[-22]<>0,RC[-22]&R4C32,"q") -> 0,1,8,2750; | AE91: =IF(RC[-22]<>0,RC[-22]&R4C32,"q") -> 0,1,4,6500; | AF91: =IF(RC[-22]<>0,RC[-22]&R4C32,"q") -> q | AG91: =IF(RC[-22]<>0,RC[-22]&R4C32,"q") -> q | AH91: =IF(RC[-22]<>0,RC[-22]&R4C32,"q") -> q | AI91: =IF(RC[-22]<>0,RC[-22]&R4C32,"q") -> q | AJ91: =IF(RC[-22]<>0,RC[-22]&R4C32,"q") -> q | AK91: =IF(RC[-22]<>0,RC[-22]&R4C32,"q") -> q | AL91: =IF(RC[-22]<>0,RC[-22]&R4C32,"q") -> q | AM91: =IF(RC[-22]<>0,RC[-22]&R4C32,"q") -> q | AN91: =IF(RC[-22]<>0,RC[-22]&R4C32,"q") -> q | AO91: =IF(RC[-22]<>0,RC[-22]&R4C32,"q") -> q | AP91: =IF(RC[-22]<>0,RC[-22]&R4C32,"q") -> q | AQ91: =IF(RC[-22]<>0,RC[-22]&R4C32,"q") -> q | AR91: =IF(RC[-22]<>0,RC[-22]&R4C32,"q") -> q | AS91: =IF(RC[-22]<>0,RC[-22]&R4C32,"q") -> q | AT91: =IF(RC[-22]<>0,RC[-22]&R4C32,"q") -> 0,1,7,91000;0,1,8,2750;0,1,4,6500;; | AU91: =IF(RC[-22]<>0,RC[-22]&R4C32,"q") -> q | AV91: =IF(RC[-22]<>0,RC[-22]&R4C32,"q") -> 0,1,7,91000;0,1,8,2750;0,1,4,6500;qqqqqqqqqqqqqq;
E92: 0,1,7,5500 | F92: 93000 | G92: =R2C5&RC[-1] -> 0,1,7,93000 | H92: 0,1,8,2750 | I92: 0,1,4,6500 | X92: 0,1,7,93000;0,1,8,2750;0,1,4,6500; | Z92: =RC[3]&RC[4]&RC[5]&RC[6]&RC[7]&RC[8]&RC[9]&RC[10]&RC[11]&RC[12]&RC[13]&RC[14]&RC[15]&RC[16]&RC[17]&RC[18]&RC[19] -> 0,1,7,93000;0,1,8,2750;0,1,4,6500;qqqqqqqqqqqqqq | AC92: =IF(RC[-22]<>0,RC[-22]&R4C32,"q") -> 0,1,7,93000; | AD92: =IF(RC[-22]<>0,RC[-22]&R4C32,"q") -> 0,1,8,2750; | AE92: =IF(RC[-22]<>0,RC[-22]&R4C32,"q") -> 0,1,4,6500; | AF92: =IF(RC[-22]<>0,RC[-22]&R4C32,"q") -> q | AG92: =IF(RC[-22]<>0,RC[-22]&R4C32,"q") -> q | AH92: =IF(RC[-22]<>0,RC[-22]&R4C32,"q") -> q | AI92: =IF(RC[-22]<>0,RC[-22]&R4C32,"q") -> q | AJ92: =IF(RC[-22]<>0,RC[-22]&R4C32,"q") -> q | AK92: =IF(RC[-22]<>0,RC[-22]&R4C32,"q") -> q | AL92: =IF(RC[-22]<>0,RC[-22]&R4C32,"q") -> q | AM92: =IF(RC[-22]<>0,RC[-22]&R4C32,"q") -> q | AN92: =IF(RC[-22]<>0,RC[-22]&R4C32,"q") -> q | AO92: =IF(RC[-22]<>0,RC[-22]&R4C32,"q") -> q | AP92: =IF(RC[-22]<>0,RC[-22]&R4C32,"q") -> q | AQ92: =IF(RC[-22]<>0,RC[-22]&R4C32,"q") -> q | AR92: =IF(RC[-22]<>0,RC[-22]&R4C32,"q") -> q | AS92: =IF(RC[-22]<>0,RC[-22]&R4C32,"q") -> q | AT92: =IF(RC[-22]<>0,RC[-22]&R4C32,"q") -> 0,1,7,93000;0,1,8,2750;0,1,4,6500;; | AU92: =IF(RC[-22]<>0,RC[-22]&R4C32,"q") -> q | AV92: =IF(RC[-22]<>0,RC[-22]&R4C32,"q") -> 0,1,7,93000;0,1,8,2750;0,1,4,6500;qqqqqqqqqqqqqq;
E93: 0,1,7,5500 | F93: 95000 | G93: =R2C5&RC[-1] -> 0,1,7,95000 | H93: 0,1,8,2750 | I93: 0,1,4,6500 | X93: 0,1,7,95000;0,1,8,2750;0,1,4,6500; | Z93: =RC[3]&RC[4]&RC[5]&RC[6]&RC[7]&RC[8]&RC[9]&RC[10]&RC[11]&RC[12]&RC[13]&RC[14]&RC[15]&RC[16]&RC[17]&RC[18]&RC[19] -> 0,1,7,95000;0,1,8,2750;0,1,4,6500;qqqqqqqqqqqqqq | AC93: =IF(RC[-22]<>0,RC[-22]&R4C32,"q") -> 0,1,7,95000; | AD93: =IF(RC[-22]<>0,RC[-22]&R4C32,"q") -> 0,1,8,2750; | AE93: =IF(RC[-22]<>0,RC[-22]&R4C32,"q") -> 0,1,4,6500; | AF93: =IF(RC[-22]<>0,RC[-22]&R4C32,"q") -> q | AG93: =IF(RC[-22]<>0,RC[-22]&R4C32,"q") -> q | AH93: =IF(RC[-22]<>0,RC[-22]&R4C32,"q") -> q | AI93: =IF(RC[-22]<>0,RC[-22]&R4C32,"q") -> q | AJ93: =IF(RC[-22]<>0,RC[-22]&R4C32,"q") -> q | AK93: =IF(RC[-22]<>0,RC[-22]&R4C32,"q") -> q | AL93: =IF(RC[-22]<>0,RC[-22]&R4C32,"q") -> q | AM93: =IF(RC[-22]<>0,RC[-22]&R4C32,"q") -> q | AN93: =IF(RC[-22]<>0,RC[-22]&R4C32,"q") -> q | AO93: =IF(RC[-22]<>0,RC[-22]&R4C32,"q") -> q | AP93: =IF(RC[-22]<>0,RC[-22]&R4C32,"q") -> q | AQ93: =IF(RC[-22]<>0,RC[-22]&R4C32,"q") -> q | AR93: =IF(RC[-22]<>0,RC[-22]&R4C32,"q") -> q | AS93: =IF(RC[-22]<>0,RC[-22]&R4C32,"q") -> q | AT93: =IF(RC[-22]<>0,RC[-22]&R4C32,"q") -> 0,1,7,95000;0,1,8,2750;0,1,4,6500;; | AU93: =IF(RC[-22]<>0,RC[-22]&R4C32,"q") -> q | AV93: =IF(RC[-22]<>0,RC[-22]&R4C32,"q") -> 0,1,7,95000;0,1,8,2750;0,1,4,6500;qqqqqqqqqqqqqq;
E94: 0,1,7,5500 | F94: 296000 | G94: =R2C5&RC[-1] -> 0,1,7,296000 | H94: 0,1,8,2750 | I94: 0,1,4,6500 | X94: 0,1,7,296000;0,1,8,2750;0,1,4,6500; | Z94: =RC[3]&RC[4]&RC[5]&RC[6]&RC[7]&RC[8]&RC[9]&RC[10]&RC[11]&RC[12]&RC[13]&RC[14]&RC[15]&RC[16]&RC[17]&RC[18]&RC[19] -> 0,1,7,296000;0,1,8,2750;0,1,4,6500;qqqqqqqqqqqqqq | AC94: =IF(RC[-22]<>0,RC[-22]&R4C32,"q") -> 0,1,7,296000; | AD94: =IF(RC[-22]<>0,RC[-22]&R4C32,"q") -> 0,1,8,2750; | AE94: =IF(RC[-22]<>0,RC[-22]&R4C32,"q") -> 0,1,4,6500; | AF94: =IF(RC[-22]<>0,RC[-22]&R4C32,"q") -> q | AG94: =IF(RC[-22]<>0,RC[-22]&R4C32,"q") -> q | AH94: =IF(RC[-22]<>0,RC[-22]&R4C32,"q") -> q | AI94: =IF(RC[-22]<>0,RC[-22]&R4C32,"q") -> q | AJ94: =IF(RC[-22]<>0,RC[-22]&R4C32,"q") -> q | AK94: =IF(RC[-22]<>0,RC[-22]&R4C32,"q") -> q | AL94: =IF(RC[-22]<>0,RC[-22]&R4C32,"q") -> q | AM94: =IF(RC[-22]<>0,RC[-22]&R4C32,"q") -> q | AN94: =IF(RC[-22]<>0,RC[-22]&R4C32,"q") -> q | AO94: =IF(RC[-22]<>0,RC[-22]&R4C32,"q") -> q | AP94: =IF(RC[-22]<>0,RC[-22]&R4C32,"q") -> q | AQ94: =IF(RC[-22]<>0,RC[-22]&R4C32,"q") -> q | AR94: =IF(RC[-22]<>0,RC[-22]&R4C32,"q") -> q | AS94: =IF(RC[-22]<>0,RC[-22]&R4C32,"q") -> q | AT94: =IF(RC[-22]<>0,RC[-22]&R4C32,"q") -> 0,1,7,296000;0,1,8,2750;0,1,4,6500;; | AU94: =IF(RC[-22]<>0,RC[-22]&R4C32,"q") -> q | AV94: =IF(RC[-22]<>0,RC[-22]&R4C32,"q") -> 0,1,7,296000;0,1,8,2750;0,1,4,6500;qqqqqqqqqqqqqq;
E95: 0,1,7,340000 | F95: 98000 | G95: =R2C5&RC[-1] -> 0,1,7,98000 | H95: 0,1,8,170000 | I95: 0,1,4,650000 | X95: 0,1,7,98000;0,1,8,170000;0,1,4,650000; | Z95: =RC[3]&RC[4]&RC[5]&RC[6]&RC[7]&RC[8]&RC[9]&RC[10]&RC[11]&RC[12]&RC[13]&RC[14]&RC[15]&RC[16]&RC[17]&RC[18]&RC[19] -> 0,1,7,98000;0,1,8,170000;0,1,4,650000;qqqqqqqqqqqqqq | AC95: =IF(RC[-22]<>0,RC[-22]&R4C32,"q") -> 0,1,7,98000; | AD95: =IF(RC[-22]<>0,RC[-22]&R4C32,"q") -> 0,1,8,170000; | AE95: =IF(RC[-22]<>0,RC[-22]&R4C32,"q") -> 0,1,4,650000; | AF95: =IF(RC[-22]<>0,RC[-22]&R4C32,"q") -> q | AG95: =IF(RC[-22]<>0,RC[-22]&R4C32,"q") -> q | AH95: =IF(RC[-22]<>0,RC[-22]&R4C32,"q") -> q | AI95: =IF(RC[-22]<>0,RC[-22]&R4C32,"q") -> q | AJ95: =IF(RC[-22]<>0,RC[-22]&R4C32,"q") -> q | AK95: =IF(RC[-22]<>0,RC[-22]&R4C32,"q") -> q | AL95: =IF(RC[-22]<>0,RC[-22]&R4C32,"q") -> q | AM95: =IF(RC[-22]<>0,RC[-22]&R4C32,"q") -> q | AN95: =IF(RC[-22]<>0,RC[-22]&R4C32,"q") -> q | AO95: =IF(RC[-22]<>0,RC[-22]&R4C32,"q") -> q | AP95: =IF(RC[-22]<>0,RC[-22]&R4C32,"q") -> q | AQ95: =IF(RC[-22]<>0,RC[-22]&R4C32,"q") -> q | AR95: =IF(RC[-22]<>0,RC[-22]&R4C32,"q") -> q | AS95: =IF(RC[-22]<>0,RC[-22]&R4C32,"q") -> q | AT95: =IF(RC[-22]<>0,RC[-22]&R4C32,"q") -> 0,1,7,98000;0,1,8,170000;0,1,4,650000;; | AU95: =IF(RC[-22]<>0,RC[-22]&R4C32,"q") -> q | AV95: =IF(RC[-22]<>0,RC[-22]&R4C32,"q") -> 0,1,7,98000;0,1,8,170000;0,1,4,650000;qqqqqqqqqqqqqq;
E96: 0,1,7,5500 | F96: 100000 | G96: =R2C5&RC[-1] -> 0,1,7,100000 | H96: 0,1,8,2750 | I96: 0,1,4,6500 | X96: 0,1,7,100000;0,1,8,2750;0,1,4,6500; | Z96: =RC[3]&RC[4]&RC[5]&RC[6]&RC[7]&RC[8]&RC[9]&RC[10]&RC[11]&RC[12]&RC[13]&RC[14]&RC[15]&RC[16]&RC[17]&RC[18]&RC[19] -> 0,1,7,100000;0,1,8,2750;0,1,4,6500;qqqqqqqqqqqqqq | AC96: =IF(RC[-22]<>0,RC[-22]&R4C32,"q") -> 0,1,7,100000; | AD96: =IF(RC[-22]<>0,RC[-22]&R4C32,"q") -> 0,1,8,2750; | AE96: =IF(RC[-22]<>0,RC[-22]&R4C32,"q") -> 0,1,4,6500; | AF96: =IF(RC[-22]<>0,RC[-22]&R4C32,"q") -> q | AG96: =IF(RC[-22]<>0,RC[-22]&R4C32,"q") -> q | AH96: =IF(RC[-22]<>0,RC[-22]&R4C32,"q") -> q | AI96: =IF(RC[-22]<>0,RC[-22]&R4C32,"q") -> q | AJ96: =IF(RC[-22]<>0,RC[-22]&R4C32,"q") -> q | AK96: =IF(RC[-22]<>0,RC[-22]&R4C32,"q") -> q | AL96: =IF(RC[-22]<>0,RC[-22]&R4C32,"q") -> q | AM96: =IF(RC[-22]<>0,RC[-22]&R4C32,"q") -> q | AN96: =IF(RC[-22]<>0,RC[-22]&R4C32,"q") -> q | AO96: =IF(RC[-22]<>0,RC[-22]&R4C32,"q") -> q | AP96: =IF(RC[-22]<>0,RC[-22]&R4C32,"q") -> q | AQ96: =IF(RC[-22]<>0,RC[-22]&R4C32,"q") -> q | AR96: =IF(RC[-22]<>0,RC[-22]&R4C32,"q") -> q | AS96: =IF(RC[-22]<>0,RC[-22]&R4C32,"q") -> q | AT96: =IF(RC[-22]<>0,RC[-22]&R4C32,"q") -> 0,1,7,100000;0,1,8,2750;0,1,4,6500;; | AU96: =IF(RC[-22]<>0,RC[-22]&R4C32,"q") -> q | AV96: =IF(RC[-22]<>0,RC[-22]&R4C32,"q") -> 0,1,7,100000;0,1,8,2750;0,1,4,6500;qqqqqqqqqqqqqq;
E97: 0,1,7,5500 | F97: 102000 | G97: =R2C5&RC[-1] -> 0,1,7,102000 | H97: 0,1,8,2750 | I97: 0,1,4,6500 | X97: 0,1,7,102000;0,1,8,2750;0,1,4,6500; | Z97: =RC[3]&RC[4]&RC[5]&RC[6]&RC[7]&RC[8]&RC[9]&RC[10]&RC[11]&RC[12]&RC[13]&RC[14]&RC[15]&RC[16]&RC[17]&RC[18]&RC[19] -> 0,1,7,102000;0,1,8,2750;0,1,4,6500;qqqqqqqqqqqqqq | AC97: =IF(RC[-22]<>0,RC[-22]&R4C32,"q") -> 0,1,7,102000; | AD97: =IF(RC[-22]<>0,RC[-22]&R4C32,"q") -> 0,1,8,2750; | AE97: =IF(RC[-22]<>0,RC[-22]&R4C32,"q") -> 0,1,4,6500; | AF97: =IF(RC[-22]<>0,RC[-22]&R4C32,"q") -> q | AG97: =IF(RC[-22]<>0,RC[-22]&R4C32,"q") -> q | AH97: =IF(RC[-22]<>0,RC[-22]&R4C32,"q") -> q | AI97: =IF(RC[-22]<>0,RC[-22]&R4C32,"q") -> q | AJ97: =IF(RC[-22]<>0,RC[-22]&R4C32,"q") -> q | AK97: =IF(RC[-22]<>0,RC[-22]&R4C32,"q") -> q | AL97: =IF(RC[-22]<>0,RC[-22]&R4C32,"q") -> q | AM97: =IF(RC[-22]<>0,RC[-22]&R4C32,"q") -> q | AN97: =IF(RC[-22]<>0,RC[-22]&R4C32,"q") -> q | AO97: =IF(RC[-22]<>0,RC[-22]&R4C32,"q") -> q | AP97: =IF(RC[-22]<>0,RC[-22]&R4C32,"q") -> q | AQ97: =IF(RC[-22]<>0,RC[-22]&R4C32,"q") -> q | AR97: =IF(RC[-22]<>0,RC[-22]&R4C32,"q") -> q | AS97: =IF(RC[-22]<>0,RC[-22]&R4C32,"q") -> q | AT97: =IF(RC[-22]<>0,RC[-22]&R4C32,"q") -> 0,1,7,102000;0,1,8,2750;0,1,4,6500;; | AU97: =IF(RC[-22]<>0,RC[-22]&R4C32,"q") -> q | AV97: =IF(RC[-22]<>0,RC[-22]&R4C32,"q") -> 0,1,7,102000;0,1,8,2750;0,1,4,6500;qqqqqqqqqqqqqq;
E98: 0,1,7,6000 | F98: 104000 | G98: =R2C5&RC[-1] -> 0,1,7,104000 | H98: 0,1,8,3000 | I98: 0,1,4,7500 | X98: 0,1,7,104000;0,1,8,3000;0,1,4,7500; | Z98: =RC[3]&RC[4]&RC[5]&RC[6]&RC[7]&RC[8]&RC[9]&RC[10]&RC[11]&RC[12]&RC[13]&RC[14]&RC[15]&RC[16]&RC[17]&RC[18]&RC[19] -> 0,1,7,104000;0,1,8,3000;0,1,4,7500;qqqqqqqqqqqqqq | AC98: =IF(RC[-22]<>0,RC[-22]&R4C32,"q") -> 0,1,7,104000; | AD98: =IF(RC[-22]<>0,RC[-22]&R4C32,"q") -> 0,1,8,3000; | AE98: =IF(RC[-22]<>0,RC[-22]&R4C32,"q") -> 0,1,4,7500; | AF98: =IF(RC[-22]<>0,RC[-22]&R4C32,"q") -> q | AG98: =IF(RC[-22]<>0,RC[-22]&R4C32,"q") -> q | AH98: =IF(RC[-22]<>0,RC[-22]&R4C32,"q") -> q | AI98: =IF(RC[-22]<>0,RC[-22]&R4C32,"q") -> q | AJ98: =IF(RC[-22]<>0,RC[-22]&R4C32,"q") -> q | AK98: =IF(RC[-22]<>0,RC[-22]&R4C32,"q") -> q | AL98: =IF(RC[-22]<>0,RC[-22]&R4C32,"q") -> q | AM98: =IF(RC[-22]<>0,RC[-22]&R4C32,"q") -> q | AN98: =IF(RC[-22]<>0,RC[-22]&R4C32,"q") -> q | AO98: =IF(RC[-22]<>0,RC[-22]&R4C32,"q") -> q | AP98: =IF(RC[-22]<>0,RC[-22]&R4C32,"q") -> q | AQ98: =IF(RC[-22]<>0,RC[-22]&R4C32,"q") -> q | AR98: =IF(RC[-22]<>0,RC[-22]&R4C32,"q") -> q | AS98: =IF(RC[-22]<>0,RC[-22]&R4C32,"q") -> q | AT98: =IF(RC[-22]<>0,RC[-22]&R4C32,"q") -> 0,1,7,104000;0,1,8,3000;0,1,4,7500;; | AU98: =IF(RC[-22]<>0,RC[-22]&R4C32,"q") -> q | AV98: =IF(RC[-22]<>0,RC[-22]&R4C32,"q") -> 0,1,7,104000;0,1,8,3000;0,1,4,7500;qqqqqqqqqqqqqq;
E99: 0,1,7,6000 | F99: 325000 | G99: =R2C5&RC[-1] -> 0,1,7,325000 | H99: 0,1,8,3000 | I99: 0,1,4,7500 | X99: 0,1,7,325000;0,1,8,3000;0,1,4,7500; | Z99: =RC[3]&RC[4]&RC[5]&RC[6]&RC[7]&RC[8]&RC[9]&RC[10]&RC[11]&RC[12]&RC[13]&RC[14]&RC[15]&RC[16]&RC[17]&RC[18]&RC[19] -> 0,1,7,325000;0,1,8,3000;0,1,4,7500;qqqqqqqqqqqqqq | AC99: =IF(RC[-22]<>0,RC[-22]&R4C32,"q") -> 0,1,7,325000; | AD99: =IF(RC[-22]<>0,RC[-22]&R4C32,"q") -> 0,1,8,3000; | AE99: =IF(RC[-22]<>0,RC[-22]&R4C32,"q") -> 0,1,4,7500; | AF99: =IF(RC[-22]<>0,RC[-22]&R4C32,"q") -> q | AG99: =IF(RC[-22]<>0,RC[-22]&R4C32,"q") -> q | AH99: =IF(RC[-22]<>0,RC[-22]&R4C32,"q") -> q | AI99: =IF(RC[-22]<>0,RC[-22]&R4C32,"q") -> q | AJ99: =IF(RC[-22]<>0,RC[-22]&R4C32,"q") -> q | AK99: =IF(RC[-22]<>0,RC[-22]&R4C32,"q") -> q | AL99: =IF(RC[-22]<>0,RC[-22]&R4C32,"q") -> q | AM99: =IF(RC[-22]<>0,RC[-22]&R4C32,"q") -> q | AN99: =IF(RC[-22]<>0,RC[-22]&R4C32,"q") -> q | AO99: =IF(RC[-22]<>0,RC[-22]&R4C32,"q") -> q | AP99: =IF(RC[-22]<>0,RC[-22]&R4C32,"q") -> q | AQ99: =IF(RC[-22]<>0,RC[-22]&R4C32,"q") -> q | AR99: =IF(RC[-22]<>0,RC[-22]&R4C32,"q") -> q | AS99: =IF(RC[-22]<>0,RC[-22]&R4C32,"q") -> q | AT99: =IF(RC[-22]<>0,RC[-22]&R4C32,"q") -> 0,1,7,325000;0,1,8,3000;0,1,4,7500;; | AU99: =IF(RC[-22]<>0,RC[-22]&R4C32,"q") -> q | AV99: =IF(RC[-22]<>0,RC[-22]&R4C32,"q") -> 0,1,7,325000;0,1,8,3000;0,1,4,7500;qqqqqqqqqqqqqq;
E100: 0,1,7,6000 | F100: 108000 | G100: =R2C5&RC[-1] -> 0,1,7,108000 | H100: 0,1,8,3000 | I100: 0,1,4,7500 | X100: 0,1,7,108000;0,1,8,3000;0,1,4,7500; | Z100: =RC[3]&RC[4]&RC[5]&RC[6]&RC[7]&RC[8]&RC[9]&RC[10]&RC[11]&RC[12]&RC[13]&RC[14]&RC[15]&RC[16]&RC[17]&RC[18]&RC[19] -> 0,1,7,108000;0,1,8,3000;0,1,4,7500;qqqqqqqqqqqqqq | AC100: =IF(RC[-22]<>0,RC[-22]&R4C32,"q") -> 0,1,7,108000; | AD100: =IF(RC[-22]<>0,RC[-22]&R4C32,"q") -> 0,1,8,3000; | AE100: =IF(RC[-22]<>0,RC[-22]&R4C32,"q") -> 0,1,4,7500; | AF100: =IF(RC[-22]<>0,RC[-22]&R4C32,"q") -> q | AG100: =IF(RC[-22]<>0,RC[-22]&R4C32,"q") -> q | AH100: =IF(RC[-22]<>0,RC[-22]&R4C32,"q") -> q | AI100: =IF(RC[-22]<>0,RC[-22]&R4C32,"q") -> q | AJ100: =IF(RC[-22]<>0,RC[-22]&R4C32,"q") -> q | AK100: =IF(RC[-22]<>0,RC[-22]&R4C32,"q") -> q | AL100: =IF(RC[-22]<>0,RC[-22]&R4C32,"q") -> q | AM100: =IF(RC[-22]<>0,RC[-22]&R4C32,"q") -> q | AN100: =IF(RC[-22]<>0,RC[-22]&R4C32,"q") -> q | AO100: =IF(RC[-22]<>0,RC[-22]&R4C32,"q") -> q | AP100: =IF(RC[-22]<>0,RC[-22]&R4C32,"q") -> q | AQ100: =IF(RC[-22]<>0,RC[-22]&R4C32,"q") -> q | AR100: =IF(RC[-22]<>0,RC[-22]&R4C32,"q") -> q | AS100: =IF(RC[-22]<>0,RC[-22]&R4C32,"q") -> q | AT100: =IF(RC[-22]<>0,RC[-22]&R4C32,"q") -> 0,1,7,108000;0,1,8,3000;0,1,4,7500;; | AU100: =IF(RC[-22]<>0,RC[-22]&R4C32,"q") -> q | AV100: =IF(RC[-22]<>0,RC[-22]&R4C32,"q") -> 0,1,7,108000;0,1,8,3000;0,1,4,7500;qqqqqqqqqqqqqq;
E101: 0,1,7,6000 | F101: 110000 | G101: =R2C5&RC[-1] -> 0,1,7,110000 | H101: 0,1,8,3000 | I101: 0,1,4,7500 | X101: 0,1,7,110000;0,1,8,3000;0,1,4,7500; | Z101: =RC[3]&RC[4]&RC[5]&RC[6]&RC[7]&RC[8]&RC[9]&RC[10]&RC[11]&RC[12]&RC[13]&RC[14]&RC[15]&RC[16]&RC[17]&RC[18]&RC[19] -> 0,1,7,110000;0,1,8,3000;0,1,4,7500;qqqqqqqqqqqqqq | AC101: =IF(RC[-22]<>0,RC[-22]&R4C32,"q") -> 0,1,7,110000; | AD101: =IF(RC[-22]<>0,RC[-22]&R4C32,"q") -> 0,1,8,3000; | AE101: =IF(RC[-22]<>0,RC[-22]&R4C32,"q") -> 0,1,4,7500; | AF101: =IF(RC[-22]<>0,RC[-22]&R4C32,"q") -> q | AG101: =IF(RC[-22]<>0,RC[-22]&R4C32,"q") -> q | AH101: =IF(RC[-22]<>0,RC[-22]&R4C32,"q") -> q | AI101: =IF(RC[-22]<>0,RC[-22]&R4C32,"q") -> q | AJ101: =IF(RC[-22]<>0,RC[-22]&R4C32,"q") -> q | AK101: =IF(RC[-22]<>0,RC[-22]&R4C32,"q") -> q | AL101: =IF(RC[-22]<>0,RC[-22]&R4C32,"q") -> q | AM101: =IF(RC[-22]<>0,RC[-22]&R4C32,"q") -> q | AN101: =IF(RC[-22]<>0,RC[-22]&R4C32,"q") -> q | AO101: =IF(RC[-22]<>0,RC[-22]&R4C32,"q") -> q | AP101: =IF(RC[-22]<>0,RC[-22]&R4C32,"q") -> q | AQ101: =IF(RC[-22]<>0,RC[-22]&R4C32,"q") -> q | AR101: =IF(RC[-22]<>0,RC[-22]&R4C32,"q") -> q | AS101: =IF(RC[-22]<>0,RC[-22]&R4C32,"q") -> q | AT101: =IF(RC[-22]<>0,RC[-22]&R4C32,"q") -> 0,1,7,110000;0,1,8,3000;0,1,4,7500;; | AU101: =IF(RC[-22]<>0,RC[-22]&R4C32,"q") -> q | AV101: =IF(RC[-22]<>0,RC[-22]&R4C32,"q") -> 0,1,7,110000;0,1,8,3000;0,1,4,7500;qqqqqqqqqqqqqq;
E102: 0,1,7,760000 | F102: 112000 | G102: =R2C5&RC[-1] -> 0,1,7,112000 | H102: 0,1,8,290400 | I102: 0,1,4,1040000 | X102: 0,1,7,112000;0,1,8,290400;0,1,4,1040000; | Z102: =RC[3]&RC[4]&RC[5]&RC[6]&RC[7]&RC[8]&RC[9]&RC[10]&RC[11]&RC[12]&RC[13]&RC[14]&RC[15]&RC[16]&RC[17]&RC[18]&RC[19] -> 0,1,7,112000;0,1,8,290400;0,1,4,1040000;qqqqqqqqqqqqqq | AC102: =IF(RC[-22]<>0,RC[-22]&R4C32,"q") -> 0,1,7,112000; | AD102: =IF(RC[-22]<>0,RC[-22]&R4C32,"q") -> 0,1,8,290400; | AE102: =IF(RC[-22]<>0,RC[-22]&R4C32,"q") -> 0,1,4,1040000; | AF102: =IF(RC[-22]<>0,RC[-22]&R4C32,"q") -> q | AG102: =IF(RC[-22]<>0,RC[-22]&R4C32,"q") -> q | AH102: =IF(RC[-22]<>0,RC[-22]&R4C32,"q") -> q | AI102: =IF(RC[-22]<>0,RC[-22]&R4C32,"q") -> q | AJ102: =IF(RC[-22]<>0,RC[-22]&R4C32,"q") -> q | AK102: =IF(RC[-22]<>0,RC[-22]&R4C32,"q") -> q | AL102: =IF(RC[-22]<>0,RC[-22]&R4C32,"q") -> q | AM102: =IF(RC[-22]<>0,RC[-22]&R4C32,"q") -> q | AN102: =IF(RC[-22]<>0,RC[-22]&R4C32,"q") -> q | AO102: =IF(RC[-22]<>0,RC[-22]&R4C32,"q") -> q | AP102: =IF(RC[-22]<>0,RC[-22]&R4C32,"q") -> q | AQ102: =IF(RC[-22]<>0,RC[-22]&R4C32,"q") -> q | AR102: =IF(RC[-22]<>0,RC[-22]&R4C32,"q") -> q | AS102: =IF(RC[-22]<>0,RC[-22]&R4C32,"q") -> q | AT102: =IF(RC[-22]<>0,RC[-22]&R4C32,"q") -> 0,1,7,112000;0,1,8,290400;0,1,4,1040000;; | AU102: =IF(RC[-22]<>0,RC[-22]&R4C32,"q") -> q | AV102: =IF(RC[-22]<>0,RC[-22]&R4C32,"q") -> 0,1,7,112000;0,1,8,290400;0,1,4,1040000;qqqqqqqqqqqqqq;
E103: 0,1,7,6000 | F103: 114000 | G103: =R2C5&RC[-1] -> 0,1,7,114000 | H103: 0,1,8,3000 | I103: 0,1,4,7500 | X103: 0,1,7,114000;0,1,8,3000;0,1,4,7500; | Z103: =RC[3]&RC[4]&RC[5]&RC[6]&RC[7]&RC[8]&RC[9]&RC[10]&RC[11]&RC[12]&RC[13]&RC[14]&RC[15]&RC[16]&RC[17]&RC[18]&RC[19] -> 0,1,7,114000;0,1,8,3000;0,1,4,7500;qqqqqqqqqqqqqq | AC103: =IF(RC[-22]<>0,RC[-22]&R4C32,"q") -> 0,1,7,114000; | AD103: =IF(RC[-22]<>0,RC[-22]&R4C32,"q") -> 0,1,8,3000; | AE103: =IF(RC[-22]<>0,RC[-22]&R4C32,"q") -> 0,1,4,7500; | AF103: =IF(RC[-22]<>0,RC[-22]&R4C32,"q") -> q | AG103: =IF(RC[-22]<>0,RC[-22]&R4C32,"q") -> q | AH103: =IF(RC[-22]<>0,RC[-22]&R4C32,"q") -> q | AI103: =IF(RC[-22]<>0,RC[-22]&R4C32,"q") -> q | AJ103: =IF(RC[-22]<>0,RC[-22]&R4C32,"q") -> q | AK103: =IF(RC[-22]<>0,RC[-22]&R4C32,"q") -> q | AL103: =IF(RC[-22]<>0,RC[-22]&R4C32,"q") -> q | AM103: =IF(RC[-22]<>0,RC[-22]&R4C32,"q") -> q | AN103: =IF(RC[-22]<>0,RC[-22]&R4C32,"q") -> q | AO103: =IF(RC[-22]<>0,RC[-22]&R4C32,"q") -> q | AP103: =IF(RC[-22]<>0,RC[-22]&R4C32,"q") -> q | AQ103: =IF(RC[-22]<>0,RC[-22]&R4C32,"q") -> q | AR103: =IF(RC[-22]<>0,RC[-22]&R4C32,"q") -> q | AS103: =IF(RC[-22]<>0,RC[-22]&R4C32,"q") -> q | AT103: =IF(RC[-22]<>0,RC[-22]&R4C32,"q") -> 0,1,7,114000;0,1,8,3000;0,1,4,7500;; | AU103: =IF(RC[-22]<>0,RC[-22]&R4C32,"q") -> q | AV103: =IF(RC[-22]<>0,RC[-22]&R4C32,"q") -> 0,1,7,114000;0,1,8,3000;0,1,4,7500;qqqqqqqqqqqqqq;
E104: 0,1,7,840000 | F104: 356000 | G104: =R2C5&RC[-1] -> 0,1,7,356000 | H104: 0,1,8,388000 | I104: 0,1,4,1120000 | X104: 0,1,7,356000;0,1,8,388000;0,1,4,1120000; | Z104: =RC[3]&RC[4]&RC[5]&RC[6]&RC[7]&RC[8]&RC[9]&RC[10]&RC[11]&RC[12]&RC[13]&RC[14]&RC[15]&RC[16]&RC[17]&RC[18]&RC[19] -> 0,1,7,356000;0,1,8,388000;0,1,4,1120000;qqqqqqqqqqqqqq | AC104: =IF(RC[-22]<>0,RC[-22]&R4C32,"q") -> 0,1,7,356000; | AD104: =IF(RC[-22]<>0,RC[-22]&R4C32,"q") -> 0,1,8,388000; | AE104: =IF(RC[-22]<>0,RC[-22]&R4C32,"q") -> 0,1,4,1120000; | AF104: =IF(RC[-22]<>0,RC[-22]&R4C32,"q") -> q | AG104: =IF(RC[-22]<>0,RC[-22]&R4C32,"q") -> q | AH104: =IF(RC[-22]<>0,RC[-22]&R4C32,"q") -> q | AI104: =IF(RC[-22]<>0,RC[-22]&R4C32,"q") -> q | AJ104: =IF(RC[-22]<>0,RC[-22]&R4C32,"q") -> q | AK104: =IF(RC[-22]<>0,RC[-22]&R4C32,"q") -> q | AL104: =IF(RC[-22]<>0,RC[-22]&R4C32,"q") -> q | AM104: =IF(RC[-22]<>0,RC[-22]&R4C32,"q") -> q | AN104: =IF(RC[-22]<>0,RC[-22]&R4C32,"q") -> q | AO104: =IF(RC[-22]<>0,RC[-22]&R4C32,"q") -> q | AP104: =IF(RC[-22]<>0,RC[-22]&R4C32,"q") -> q | AQ104: =IF(RC[-22]<>0,RC[-22]&R4C32,"q") -> q | AR104: =IF(RC[-22]<>0,RC[-22]&R4C32,"q") -> q | AS104: =IF(RC[-22]<>0,RC[-22]&R4C32,"q") -> q | AT104: =IF(RC[-22]<>0,RC[-22]&R4C32,"q") -> 0,1,7,356000;0,1,8,388000;0,1,4,1120000;; | AU104: =IF(RC[-22]<>0,RC[-22]&R4C32,"q") -> q | AV104: =IF(RC[-22]<>0,RC[-22]&R4C32,"q") -> 0,1,7,356000;0,1,8,388000;0,1,4,1120000;qqqqqqqqqqqqqq;
E105: 0,1,7,6000 | F105: 118000 | G105: =R2C5&RC[-1] -> 0,1,7,118000 | H105: 0,1,8,3000 | I105: 0,1,4,7500 | X105: 0,1,7,118000;0,1,8,3000;0,1,4,7500; | Z105: =RC[3]&RC[4]&RC[5]&RC[6]&RC[7]&RC[8]&RC[9]&RC[10]&RC[11]&RC[12]&RC[13]&RC[14]&RC[15]&RC[16]&RC[17]&RC[18]&RC[19] -> 0,1,7,118000;0,1,8,3000;0,1,4,7500;qqqqqqqqqqqqqq | AC105: =IF(RC[-22]<>0,RC[-22]&R4C32,"q") -> 0,1,7,118000; | AD105: =IF(RC[-22]<>0,RC[-22]&R4C32,"q") -> 0,1,8,3000; | AE105: =IF(RC[-22]<>0,RC[-22]&R4C32,"q") -> 0,1,4,7500; | AF105: =IF(RC[-22]<>0,RC[-22]&R4C32,"q") -> q | AG105: =IF(RC[-22]<>0,RC[-22]&R4C32,"q") -> q | AH105: =IF(RC[-22]<>0,RC[-22]&R4C32,"q") -> q | AI105: =IF(RC[-22]<>0,RC[-22]&R4C32,"q") -> q | AJ105: =IF(RC[-22]<>0,RC[-22]&R4C32,"q") -> q | AK105: =IF(RC[-22]<>0,RC[-22]&R4C32,"q") -> q | AL105: =IF(RC[-22]<>0,RC[-22]&R4C32,"q") -> q | AM105: =IF(RC[-22]<>0,RC[-22]&R4C32,"q") -> q | AN105: =IF(RC[-22]<>0,RC[-22]&R4C32,"q") -> q | AO105: =IF(RC[-22]<>0,RC[-22]&R4C32,"q") -> q | AP105: =IF(RC[-22]<>0,RC[-22]&R4C32,"q") -> q | AQ105: =IF(RC[-22]<>0,RC[-22]&R4C32,"q") -> q | AR105: =IF(RC[-22]<>0,RC[-22]&R4C32,"q") -> q | AS105: =IF(RC[-22]<>0,RC[-22]&R4C32,"q") -> q | AT105: =IF(RC[-22]<>0,RC[-22]&R4C32,"q") -> 0,1,7,118000;0,1,8,3000;0,1,4,7500;; | AU105: =IF(RC[-22]<>0,RC[-22]&R4C32,"q") -> q | AV105: =IF(RC[-22]<>0,RC[-22]&R4C32,"q") -> 0,1,7,118000;0,1,8,3000;0,1,4,7500;qqqqqqqqqqqqqq;
E106: 0,1,7,7200 | F106: 120000 | G106: =R2C5&RC[-1] -> 0,1,7,120000 | H106: 0,1,8,3600 | I106: 0,1,4,9000 | X106: 0,1,7,120000;0,1,8,3600;0,1,4,9000; | Z106: =RC[3]&RC[4]&RC[5]&RC[6]&RC[7]&RC[8]&RC[9]&RC[10]&RC[11]&RC[12]&RC[13]&RC[14]&RC[15]&RC[16]&RC[17]&RC[18]&RC[19] -> 0,1,7,120000;0,1,8,3600;0,1,4,9000;qqqqqqqqqqqqqq | AC106: =IF(RC[-22]<>0,RC[-22]&R4C32,"q") -> 0,1,7,120000; | AD106: =IF(RC[-22]<>0,RC[-22]&R4C32,"q") -> 0,1,8,3600; | AE106: =IF(RC[-22]<>0,RC[-22]&R4C32,"q") -> 0,1,4,9000; | AF106: =IF(RC[-22]<>0,RC[-22]&R4C32,"q") -> q | AG106: =IF(RC[-22]<>0,RC[-22]&R4C32,"q") -> q | AH106: =IF(RC[-22]<>0,RC[-22]&R4C32,"q") -> q | AI106: =IF(RC[-22]<>0,RC[-22]&R4C32,"q") -> q | AJ106: =IF(RC[-22]<>0,RC[-22]&R4C32,"q") -> q | AK106: =IF(RC[-22]<>0,RC[-22]&R4C32,"q") -> q | AL106: =IF(RC[-22]<>0,RC[-22]&R4C32,"q") -> q | AM106: =IF(RC[-22]<>0,RC[-22]&R4C32,"q") -> q | AN106: =IF(RC[-22]<>0,RC[-22]&R4C32,"q") -> q | AO106: =IF(RC[-22]<>0,RC[-22]&R4C32,"q") -> q | AP106: =IF(RC[-22]<>0,RC[-22]&R4C32,"q") -> q | AQ106: =IF(RC[-22]<>0,RC[-22]&R4C32,"q") -> q | AR106: =IF(RC[-22]<>0,RC[-22]&R4C32,"q") -> q | AS106: =IF(RC[-22]<>0,RC[-22]&R4C32,"q") -> q | AT106: =IF(RC[-22]<>0,RC[-22]&R4C32,"q") -> 0,1,7,120000;0,1,8,3600;0,1,4,9000;; | AU106: =IF(RC[-22]<>0,RC[-22]&R4C32,"q") -> q | AV106: =IF(RC[-22]<>0,RC[-22]&R4C32,"q") -> 0,1,7,120000;0,1,8,3600;0,1,4,9000;qqqqqqqqqqqqqq;
E107: 0,1,7,7200 | F107: 122000 | G107: =R2C5&RC[-1] -> 0,1,7,122000 | H107: 0,1,8,3600 | I107: 0,1,4,9000 | X107: 0,1,7,122000;0,1,8,3600;0,1,4,9000; | Z107: =RC[3]&RC[4]&RC[5]&RC[6]&RC[7]&RC[8]&RC[9]&RC[10]&RC[11]&RC[12]&RC[13]&RC[14]&RC[15]&RC[16]&RC[17]&RC[18]&RC[19] -> 0,1,7,122000;0,1,8,3600;0,1,4,9000;qqqqqqqqqqqqqq | AC107: =IF(RC[-22]<>0,RC[-22]&R4C32,"q") -> 0,1,7,122000; | AD107: =IF(RC[-22]<>0,RC[-22]&R4C32,"q") -> 0,1,8,3600; | AE107: =IF(RC[-22]<>0,RC[-22]&R4C32,"q") -> 0,1,4,9000; | AF107: =IF(RC[-22]<>0,RC[-22]&R4C32,"q") -> q | AG107: =IF(RC[-22]<>0,RC[-22]&R4C32,"q") -> q | AH107: =IF(RC[-22]<>0,RC[-22]&R4C32,"q") -> q | AI107: =IF(RC[-22]<>0,RC[-22]&R4C32,"q") -> q | AJ107: =IF(RC[-22]<>0,RC[-22]&R4C32,"q") -> q | AK107: =IF(RC[-22]<>0,RC[-22]&R4C32,"q") -> q | AL107: =IF(RC[-22]<>0,RC[-22]&R4C32,"q") -> q | AM107: =IF(RC[-22]<>0,RC[-22]&R4C32,"q") -> q | AN107: =IF(RC[-22]<>0,RC[-22]&R4C32,"q") -> q | AO107: =IF(RC[-22]<>0,RC[-22]&R4C32,"q") -> q | AP107: =IF(RC[-22]<>0,RC[-22]&R4C32,"q") -> q | AQ107: =IF(RC[-22]<>0,RC[-22]&R4C32,"q") -> q | AR107: =IF(RC[-22]<>0,RC[-22]&R4C32,"q") -> q | AS107: =IF(RC[-22]<>0,RC[-22]&R4C32,"q") -> q | AT107: =IF(RC[-22]<>0,RC[-22]&R4C32,"q") -> 0,1,7,122000;0,1,8,3600;0,1,4,9000;; | AU107: =IF(RC[-22]<>0,RC[-22]&R4C32,"q") -> q | AV107: =IF(RC[-22]<>0,RC[-22]&R4C32,"q") -> 0,1,7,122000;0,1,8,3600;0,1,4,9000;qqqqqqqqqqqqqq;
E108: 0,1,7,7200 | F108: 124000 | G108: =R2C5&RC[-1] -> 0,1,7,124000 | H108: 0,1,8,3600 | I108: 0,1,4,9000 | X108: 0,1,7,124000;0,1,8,3600;0,1,4,9000; | Z108: =RC[3]&RC[4]&RC[5]&RC[6]&RC[7]&RC[8]&RC[9]&RC[10]&RC[11]&RC[12]&RC[13]&RC[14]&RC[15]&RC[16]&RC[17]&RC[18]&RC[19] -> 0,1,7,124000;0,1,8,3600;0,1,4,9000;qqqqqqqqqqqqqq | AC108: =IF(RC[-22]<>0,RC[-22]&R4C32,"q") -> 0,1,7,124000; | AD108: =IF(RC[-22]<>0,RC[-22]&R4C32,"q") -> 0,1,8,3600; | AE108: =IF(RC[-22]<>0,RC[-22]&R4C32,"q") -> 0,1,4,9000; | AF108: =IF(RC[-22]<>0,RC[-22]&R4C32,"q") -> q | AG108: =IF(RC[-22]<>0,RC[-22]&R4C32,"q") -> q | AH108: =IF(RC[-22]<>0,RC[-22]&R4C32,"q") -> q | AI108: =IF(RC[-22]<>0,RC[-22]&R4C32,"q") -> q | AJ108: =IF(RC[-22]<>0,RC[-22]&R4C32,"q") -> q | AK108: =IF(RC[-22]<>0,RC[-22]&R4C32,"q") -> q | AL108: =IF(RC[-22]<>0,RC[-22]&R4C32,"q") -> q | AM108: =IF(RC[-22]<>0,RC[-22]&R4C32,"q") -> q | AN108: =IF(RC[-22]<>0,RC[-22]&R4C32,"q") -> q | AO108: =IF(RC[-22]<>0,RC[-22]&R4C32,"q") -> q | AP108: =IF(RC[-22]<>0,RC[-22]&R4C32,"q") -> q | AQ108: =IF(RC[-22]<>0,RC[-22]&R4C32,"q") -> q | AR108: =IF(RC[-22]<>0,RC[-22]&R4C32,"q") -> q | AS108: =IF(RC[-22]<>0,RC[-22]&R4C32,"q") -> q | AT108: =IF(RC[-22]<>0,RC[-22]&R4C32,"q") -> 0,1,7,124000;0,1,8,3600;0,1,4,9000;; | AU108: =IF(RC[-22]<>0,RC[-22]&R4C32,"q") -> q | AV108: =IF(RC[-22]<>0,RC[-22]&R4C32,"q") -> 0,1,7,124000;0,1,8,3600;0,1,4,9000;qqqqqqqqqqqqqq;
E109: 0,1,7,7200 | F109: 387000 | G109: =R2C5&RC[-1] -> 0,1,7,387000 | H109: 0,1,8,3600 | I109: 0,1,4,9000 | X109: 0,1,7,387000;0,1,8,3600;0,1,4,9000; | Z109: =RC[3]&RC[4]&RC[5]&RC[6]&RC[7]&RC[8]&RC[9]&RC[10]&RC[11]&RC[12]&RC[13]&RC[14]&RC[15]&RC[16]&RC[17]&RC[18]&RC[19] -> 0,1,7,387000;0,1,8,3600;0,1,4,9000;qqqqqqqqqqqqqq | AC109: =IF(RC[-22]<>0,RC[-22]&R4C32,"q") -> 0,1,7,387000; | AD109: =IF(RC[-22]<>0,RC[-22]&R4C32,"q") -> 0,1,8,3600; | AE109: =IF(RC[-22]<>0,RC[-22]&R4C32,"q") -> 0,1,4,9000; | AF109: =IF(RC[-22]<>0,RC[-22]&R4C32,"q") -> q | AG109: =IF(RC[-22]<>0,RC[-22]&R4C32,"q") -> q | AH109: =IF(RC[-22]<>0,RC[-22]&R4C32,"q") -> q | AI109: =IF(RC[-22]<>0,RC[-22]&R4C32,"q") -> q | AJ109: =IF(RC[-22]<>0,RC[-22]&R4C32,"q") -> q | AK109: =IF(RC[-22]<>0,RC[-22]&R4C32,"q") -> q | AL109: =IF(RC[-22]<>0,RC[-22]&R4C32,"q") -> q | AM109: =IF(RC[-22]<>0,RC[-22]&R4C32,"q") -> q | AN109: =IF(RC[-22]<>0,RC[-22]&R4C32,"q") -> q | AO109: =IF(RC[-22]<>0,RC[-22]&R4C32,"q") -> q | AP109: =IF(RC[-22]<>0,RC[-22]&R4C32,"q") -> q | AQ109: =IF(RC[-22]<>0,RC[-22]&R4C32,"q") -> q | AR109: =IF(RC[-22]<>0,RC[-22]&R4C32,"q") -> q | AS109: =IF(RC[-22]<>0,RC[-22]&R4C32,"q") -> q | AT109: =IF(RC[-22]<>0,RC[-22]&R4C32,"q") -> 0,1,7,387000;0,1,8,3600;0,1,4,9000;; | AU109: =IF(RC[-22]<>0,RC[-22]&R4C32,"q") -> q | AV109: =IF(RC[-22]<>0,RC[-22]&R4C32,"q") -> 0,1,7,387000;0,1,8,3600;0,1,4,9000;qqqqqqqqqqqqqq;
E110: 0,1,7,7200 | F110: 128000 | G110: =R2C5&RC[-1] -> 0,1,7,128000 | H110: 0,1,8,3600 | I110: 0,1,4,9000 | X110: 0,1,7,128000;0,1,8,3600;0,1,4,9000; | Z110: =RC[3]&RC[4]&RC[5]&RC[6]&RC[7]&RC[8]&RC[9]&RC[10]&RC[11]&RC[12]&RC[13]&RC[14]&RC[15]&RC[16]&RC[17]&RC[18]&RC[19] -> 0,1,7,128000;0,1,8,3600;0,1,4,9000;qqqqqqqqqqqqqq | AC110: =IF(RC[-22]<>0,RC[-22]&R4C32,"q") -> 0,1,7,128000; | AD110: =IF(RC[-22]<>0,RC[-22]&R4C32,"q") -> 0,1,8,3600; | AE110: =IF(RC[-22]<>0,RC[-22]&R4C32,"q") -> 0,1,4,9000; | AF110: =IF(RC[-22]<>0,RC[-22]&R4C32,"q") -> q | AG110: =IF(RC[-22]<>0,RC[-22]&R4C32,"q") -> q | AH110: =IF(RC[-22]<>0,RC[-22]&R4C32,"q") -> q | AI110: =IF(RC[-22]<>0,RC[-22]&R4C32,"q") -> q | AJ110: =IF(RC[-22]<>0,RC[-22]&R4C32,"q") -> q | AK110: =IF(RC[-22]<>0,RC[-22]&R4C32,"q") -> q | AL110: =IF(RC[-22]<>0,RC[-22]&R4C32,"q") -> q | AM110: =IF(RC[-22]<>0,RC[-22]&R4C32,"q") -> q | AN110: =IF(RC[-22]<>0,RC[-22]&R4C32,"q") -> q | AO110: =IF(RC[-22]<>0,RC[-22]&R4C32,"q") -> q | AP110: =IF(RC[-22]<>0,RC[-22]&R4C32,"q") -> q | AQ110: =IF(RC[-22]<>0,RC[-22]&R4C32,"q") -> q | AR110: =IF(RC[-22]<>0,RC[-22]&R4C32,"q") -> q | AS110: =IF(RC[-22]<>0,RC[-22]&R4C32,"q") -> q | AT110: =IF(RC[-22]<>0,RC[-22]&R4C32,"q") -> 0,1,7,128000;0,1,8,3600;0,1,4,9000;; | AU110: =IF(RC[-22]<>0,RC[-22]&R4C32,"q") -> q | AV110: =IF(RC[-22]<>0,RC[-22]&R4C32,"q") -> 0,1,7,128000;0,1,8,3600;0,1,4,9000;qqqqqqqqqqqqqq;
E111: 0,1,7,7200 | F111: 130000 | G111: =R2C5&RC[-1] -> 0,1,7,130000 | H111: 0,1,8,3600 | I111: 0,1,4,9000 | X111: 0,1,7,130000;0,1,8,3600;0,1,4,9000; | Z111: =RC[3]&RC[4]&RC[5]&RC[6]&RC[7]&RC[8]&RC[9]&RC[10]&RC[11]&RC[12]&RC[13]&RC[14]&RC[15]&RC[16]&RC[17]&RC[18]&RC[19] -> 0,1,7,130000;0,1,8,3600;0,1,4,9000;qqqqqqqqqqqqqq | AC111: =IF(RC[-22]<>0,RC[-22]&R4C32,"q") -> 0,1,7,130000; | AD111: =IF(RC[-22]<>0,RC[-22]&R4C32,"q") -> 0,1,8,3600; | AE111: =IF(RC[-22]<>0,RC[-22]&R4C32,"q") -> 0,1,4,9000; | AF111: =IF(RC[-22]<>0,RC[-22]&R4C32,"q") -> q | AG111: =IF(RC[-22]<>0,RC[-22]&R4C32,"q") -> q | AH111: =IF(RC[-22]<>0,RC[-22]&R4C32,"q") -> q | AI111: =IF(RC[-22]<>0,RC[-22]&R4C32,"q") -> q | AJ111: =IF(RC[-22]<>0,RC[-22]&R4C32,"q") -> q | AK111: =IF(RC[-22]<>0,RC[-22]&R4C32,"q") -> q | AL111: =IF(RC[-22]<>0,RC[-22]&R4C32,"q") -> q | AM111: =IF(RC[-22]<>0,RC[-22]&R4C32,"q") -> q | AN111: =IF(RC[-22]<>0,RC[-22]&R4C32,"q") -> q | AO111: =IF(RC[-22]<>0,RC[-22]&R4C32,"q") -> q | AP111: =IF(RC[-22]<>0,RC[-22]&R4C32,"q") -> q | AQ111: =IF(RC[-22]<>0,RC[-22]&R4C32,"q") -> q | AR111: =IF(RC[-22]<>0,RC[-22]&R4C32,"q") -> q | AS111: =IF(RC[-22]<>0,RC[-22]&R4C32,"q") -> q | AT111: =IF(RC[-22]<>0,RC[-22]&R4C32,"q") -> 0,1,7,130000;0,1,8,3600;0,1,4,9000;; | AU111: =IF(RC[-22]<>0,RC[-22]&R4C32,"q") -> q | AV111: =IF(RC[-22]<>0,RC[-22]&R4C32,"q") -> 0,1,7,130000;0,1,8,3600;0,1,4,9000;qqqqqqqqqqqqqq;
E112: 0,1,7,7200 | F112: 132000 | G112: =R2C5&RC[-1] -> 0,1,7,132000 | H112: 0,1,8,3600 | I112: 0,1,4,9000 | X112: 0,1,7,132000;0,1,8,3600;0,1,4,9000; | Z112: =RC[3]&RC[4]&RC[5]&RC[6]&RC[7]&RC[8]&RC[9]&RC[10]&RC[11]&RC[12]&RC[13]&RC[14]&RC[15]&RC[16]&RC[17]&RC[18]&RC[19] -> 0,1,7,132000;0,1,8,3600;0,1,4,9000;qqqqqqqqqqqqqq | AC112: =IF(RC[-22]<>0,RC[-22]&R4C32,"q") -> 0,1,7,132000; | AD112: =IF(RC[-22]<>0,RC[-22]&R4C32,"q") -> 0,1,8,3600; | AE112: =IF(RC[-22]<>0,RC[-22]&R4C32,"q") -> 0,1,4,9000; | AF112: =IF(RC[-22]<>0,RC[-22]&R4C32,"q") -> q | AG112: =IF(RC[-22]<>0,RC[-22]&R4C32,"q") -> q | AH112: =IF(RC[-22]<>0,RC[-22]&R4C32,"q") -> q | AI112: =IF(RC[-22]<>0,RC[-22]&R4C32,"q") -> q | AJ112: =IF(RC[-22]<>0,RC[-22]&R4C32,"q") -> q | AK112: =IF(RC[-22]<>0,RC[-22]&R4C32,"q") -> q | AL112: =IF(RC[-22]<>0,RC[-22]&R4C32,"q") -> q | AM112: =IF(RC[-22]<>0,RC[-22]&R4C32,"q") -> q | AN112: =IF(RC[-22]<>0,RC[-22]&R4C32,"q") -> q | AO112: =IF(RC[-22]<>0,RC[-22]&R4C32,"q") -> q | AP112: =IF(RC[-22]<>0,RC[-22]&R4C32,"q") -> q | AQ112: =IF(RC[-22]<>0,RC[-22]&R4C32,"q") -> q | AR112: =IF(RC[-22]<>0,RC[-22]&R4C32,"q") -> q | AS112: =IF(RC[-22]<>0,RC[-22]&R4C32,"q") -> q | AT112: =IF(RC[-22]<>0,RC[-22]&R4C32,"q") -> 0,1,7,132000;0,1,8,3600;0,1,4,9000;; | AU112: =IF(RC[-22]<>0,RC[-22]&R4C32,"q") -> q | AV112: =IF(RC[-22]<>0,RC[-22]&R4C32,"q") -> 0,1,7,132000;0,1,8,3600;0,1,4,9000;qqqqqqqqqqqqqq;
E113: 0,1,7,7200 | F113: 134000 | G113: =R2C5&RC[-1] -> 0,1,7,134000 | H113: 0,1,8,3600 | I113: 0,1,4,9000 | X113: 0,1,7,134000;0,1,8,3600;0,1,4,9000; | Z113: =RC[3]&RC[4]&RC[5]&RC[6]&RC[7]&RC[8]&RC[9]&RC[10]&RC[11]&RC[12]&RC[13]&RC[14]&RC[15]&RC[16]&RC[17]&RC[18]&RC[19] -> 0,1,7,134000;0,1,8,3600;0,1,4,9000;qqqqqqqqqqqqqq | AC113: =IF(RC[-22]<>0,RC[-22]&R4C32,"q") -> 0,1,7,134000; | AD113: =IF(RC[-22]<>0,RC[-22]&R4C32,"q") -> 0,1,8,3600; | AE113: =IF(RC[-22]<>0,RC[-22]&R4C32,"q") -> 0,1,4,9000; | AF113: =IF(RC[-22]<>0,RC[-22]&R4C32,"q") -> q | AG113: =IF(RC[-22]<>0,RC[-22]&R4C32,"q") -> q | AH113: =IF(RC[-22]<>0,RC[-22]&R4C32,"q") -> q | AI113: =IF(RC[-22]<>0,RC[-22]&R4C32,"q") -> q | AJ113: =IF(RC[-22]<>0,RC[-22]&R4C32,"q") -> q | AK113: =IF(RC[-22]<>0,RC[-22]&R4C32,"q") -> q | AL113: =IF(RC[-22]<>0,RC[-22]&R4C32,"q") -> q | AM113: =IF(RC[-22]<>0,RC[-22]&R4C32,"q") -> q | AN113: =IF(RC[-22]<>0,RC[-22]&R4C32,"q") -> q | AO113: =IF(RC[-22]<>0,RC[-22]&R4C32,"q") -> q | AP113: =IF(RC[-22]<>0,RC[-22]&R4C32,"q") -> q | AQ113: =IF(RC[-22]<>0,RC[-22]&R4C32,"q") -> q | AR113: =IF(RC[-22]<>0,RC[-22]&R4C32,"q") -> q | AS113: =IF(RC[-22]<>0,RC[-22]&R4C32,"q") -> q | AT113: =IF(RC[-22]<>0,RC[-22]&R4C32,"q") -> 0,1,7,134000;0,1,8,3600;0,1,4,9000;; | AU113: =IF(RC[-22]<>0,RC[-22]&R4C32,"q") -> q | AV113: =IF(RC[-22]<>0,RC[-22]&R4C32,"q") -> 0,1,7,134000;0,1,8,3600;0,1,4,9000;qqqqqqqqqqqqqq;
E114: 0,1,7,7200 | F114: 419000 | G114: =R2C5&RC[-1] -> 0,1,7,419000 | H114: 0,1,8,3600 | I114: 0,1,4,9000 | X114: 0,1,7,419000;0,1,8,3600;0,1,4,9000; | Z114: =RC[3]&RC[4]&RC[5]&RC[6]&RC[7]&RC[8]&RC[9]&RC[10]&RC[11]&RC[12]&RC[13]&RC[14]&RC[15]&RC[16]&RC[17]&RC[18]&RC[19] -> 0,1,7,419000;0,1,8,3600;0,1,4,9000;qqqqqqqqqqqqqq | AC114: =IF(RC[-22]<>0,RC[-22]&R4C32,"q") -> 0,1,7,419000; | AD114: =IF(RC[-22]<>0,RC[-22]&R4C32,"q") -> 0,1,8,3600; | AE114: =IF(RC[-22]<>0,RC[-22]&R4C32,"q") -> 0,1,4,9000; | AF114: =IF(RC[-22]<>0,RC[-22]&R4C32,"q") -> q | AG114: =IF(RC[-22]<>0,RC[-22]&R4C32,"q") -> q | AH114: =IF(RC[-22]<>0,RC[-22]&R4C32,"q") -> q | AI114: =IF(RC[-22]<>0,RC[-22]&R4C32,"q") -> q | AJ114: =IF(RC[-22]<>0,RC[-22]&R4C32,"q") -> q | AK114: =IF(RC[-22]<>0,RC[-22]&R4C32,"q") -> q | AL114: =IF(RC[-22]<>0,RC[-22]&R4C32,"q") -> q | AM114: =IF(RC[-22]<>0,RC[-22]&R4C32,"q") -> q | AN114: =IF(RC[-22]<>0,RC[-22]&R4C32,"q") -> q | AO114: =IF(RC[-22]<>0,RC[-22]&R4C32,"q") -> q | AP114: =IF(RC[-22]<>0,RC[-22]&R4C32,"q") -> q | AQ114: =IF(RC[-22]<>0,RC[-22]&R4C32,"q") -> q | AR114: =IF(RC[-22]<>0,RC[-22]&R4C32,"q") -> q | AS114: =IF(RC[-22]<>0,RC[-22]&R4C32,"q") -> q | AT114: =IF(RC[-22]<>0,RC[-22]&R4C32,"q") -> 0,1,7,419000;0,1,8,3600;0,1,4,9000;; | AU114: =IF(RC[-22]<>0,RC[-22]&R4C32,"q") -> q | AV114: =IF(RC[-22]<>0,RC[-22]&R4C32,"q") -> 0,1,7,419000;0,1,8,3600;0,1,4,9000;qqqqqqqqqqqqqq;
E115: 0,1,7,840000 | F115: 138000 | G115: =R2C5&RC[-1] -> 0,1,7,138000 | H115: 0,1,8,388000 | I115: 0,1,4,1120000 | X115: 0,1,7,138000;0,1,8,388000;0,1,4,1120000; | Z115: =RC[3]&RC[4]&RC[5]&RC[6]&RC[7]&RC[8]&RC[9]&RC[10]&RC[11]&RC[12]&RC[13]&RC[14]&RC[15]&RC[16]&RC[17]&RC[18]&RC[19] -> 0,1,7,138000;0,1,8,388000;0,1,4,1120000;qqqqqqqqqqqqqq | AC115: =IF(RC[-22]<>0,RC[-22]&R4C32,"q") -> 0,1,7,138000; | AD115: =IF(RC[-22]<>0,RC[-22]&R4C32,"q") -> 0,1,8,388000; | AE115: =IF(RC[-22]<>0,RC[-22]&R4C32,"q") -> 0,1,4,1120000; | AF115: =IF(RC[-22]<>0,RC[-22]&R4C32,"q") -> q | AG115: =IF(RC[-22]<>0,RC[-22]&R4C32,"q") -> q | AH115: =IF(RC[-22]<>0,RC[-22]&R4C32,"q") -> q | AI115: =IF(RC[-22]<>0,RC[-22]&R4C32,"q") -> q | AJ115: =IF(RC[-22]<>0,RC[-22]&R4C32,"q") -> q | AK115: =IF(RC[-22]<>0,RC[-22]&R4C32,"q") -> q | AL115: =IF(RC[-22]<>0,RC[-22]&R4C32,"q") -> q | AM115: =IF(RC[-22]<>0,RC[-22]&R4C32,"q") -> q | AN115: =IF(RC[-22]<>0,RC[-22]&R4C32,"q") -> q | AO115: =IF(RC[-22]<>0,RC[-22]&R4C32,"q") -> q | AP115: =IF(RC[-22]<>0,RC[-22]&R4C32,"q") -> q | AQ115: =IF(RC[-22]<>0,RC[-22]&R4C32,"q") -> q | AR115: =IF(RC[-22]<>0,RC[-22]&R4C32,"q") -> q | AS115: =IF(RC[-22]<>0,RC[-22]&R4C32,"q") -> q | AT115: =IF(RC[-22]<>0,RC[-22]&R4C32,"q") -> 0,1,7,138000;0,1,8,388000;0,1,4,1120000;; | AU115: =IF(RC[-22]<>0,RC[-22]&R4C32,"q") -> q | AV115: =IF(RC[-22]<>0,RC[-22]&R4C32,"q") -> 0,1,7,138000;0,1,8,388000;0,1,4,1120000;qqqqqqqqqqqqqq;
E116: 0,1,7,7200 | F116: 140000 | G116: =R2C5&RC[-1] -> 0,1,7,140000 | H116: 0,1,8,3600 | I116: 0,1,4,9000 | X116: 0,1,7,140000;0,1,8,3600;0,1,4,9000; | Z116: =RC[3]&RC[4]&RC[5]&RC[6]&RC[7]&RC[8]&RC[9]&RC[10]&RC[11]&RC[12]&RC[13]&RC[14]&RC[15]&RC[16]&RC[17]&RC[18]&RC[19] -> 0,1,7,140000;0,1,8,3600;0,1,4,9000;qqqqqqqqqqqqqq | AC116: =IF(RC[-22]<>0,RC[-22]&R4C32,"q") -> 0,1,7,140000; | AD116: =IF(RC[-22]<>0,RC[-22]&R4C32,"q") -> 0,1,8,3600; | AE116: =IF(RC[-22]<>0,RC[-22]&R4C32,"q") -> 0,1,4,9000; | AF116: =IF(RC[-22]<>0,RC[-22]&R4C32,"q") -> q | AG116: =IF(RC[-22]<>0,RC[-22]&R4C32,"q") -> q | AH116: =IF(RC[-22]<>0,RC[-22]&R4C32,"q") -> q | AI116: =IF(RC[-22]<>0,RC[-22]&R4C32,"q") -> q | AJ116: =IF(RC[-22]<>0,RC[-22]&R4C32,"q") -> q | AK116: =IF(RC[-22]<>0,RC[-22]&R4C32,"q") -> q | AL116: =IF(RC[-22]<>0,RC[-22]&R4C32,"q") -> q | AM116: =IF(RC[-22]<>0,RC[-22]&R4C32,"q") -> q | AN116: =IF(RC[-22]<>0,RC[-22]&R4C32,"q") -> q | AO116: =IF(RC[-22]<>0,RC[-22]&R4C32,"q") -> q | AP116: =IF(RC[-22]<>0,RC[-22]&R4C32,"q") -> q | AQ116: =IF(RC[-22]<>0,RC[-22]&R4C32,"q") -> q | AR116: =IF(RC[-22]<>0,RC[-22]&R4C32,"q") -> q | AS116: =IF(RC[-22]<>0,RC[-22]&R4C32,"q") -> q | AT116: =IF(RC[-22]<>0,RC[-22]&R4C32,"q") -> 0,1,7,140000;0,1,8,3600;0,1,4,9000;; | AU116: =IF(RC[-22]<>0,RC[-22]&R4C32,"q") -> q | AV116: =IF(RC[-22]<>0,RC[-22]&R4C32,"q") -> 0,1,7,140000;0,1,8,3600;0,1,4,9000;qqqqqqqqqqqqqq;
E117: 0,1,7,8100 | F117: 142000 | G117: =R2C5&RC[-1] -> 0,1,7,142000 | H117: 0,1,8,4500 | I117: 0,1,4,10800 | X117: 0,1,7,142000;0,1,8,4500;0,1,4,10800; | Z117: =RC[3]&RC[4]&RC[5]&RC[6]&RC[7]&RC[8]&RC[9]&RC[10]&RC[11]&RC[12]&RC[13]&RC[14]&RC[15]&RC[16]&RC[17]&RC[18]&RC[19] -> 0,1,7,142000;0,1,8,4500;0,1,4,10800;qqqqqqqqqqqqqq | AC117: =IF(RC[-22]<>0,RC[-22]&R4C32,"q") -> 0,1,7,142000; | AD117: =IF(RC[-22]<>0,RC[-22]&R4C32,"q") -> 0,1,8,4500; | AE117: =IF(RC[-22]<>0,RC[-22]&R4C32,"q") -> 0,1,4,10800; | AF117: =IF(RC[-22]<>0,RC[-22]&R4C32,"q") -> q | AG117: =IF(RC[-22]<>0,RC[-22]&R4C32,"q") -> q | AH117: =IF(RC[-22]<>0,RC[-22]&R4C32,"q") -> q | AI117: =IF(RC[-22]<>0,RC[-22]&R4C32,"q") -> q | AJ117: =IF(RC[-22]<>0,RC[-22]&R4C32,"q") -> q | AK117: =IF(RC[-22]<>0,RC[-22]&R4C32,"q") -> q | AL117: =IF(RC[-22]<>0,RC[-22]&R4C32,"q") -> q | AM117: =IF(RC[-22]<>0,RC[-22]&R4C32,"q") -> q | AN117: =IF(RC[-22]<>0,RC[-22]&R4C32,"q") -> q | AO117: =IF(RC[-22]<>0,RC[-22]&R4C32,"q") -> q | AP117: =IF(RC[-22]<>0,RC[-22]&R4C32,"q") -> q | AQ117: =IF(RC[-22]<>0,RC[-22]&R4C32,"q") -> q | AR117: =IF(RC[-22]<>0,RC[-22]&R4C32,"q") -> q | AS117: =IF(RC[-22]<>0,RC[-22]&R4C32,"q") -> q | AT117: =IF(RC[-22]<>0,RC[-22]&R4C32,"q") -> 0,1,7,142000;0,1,8,4500;0,1,4,10800;; | AU117: =IF(RC[-22]<>0,RC[-22]&R4C32,"q") -> q | AV117: =IF(RC[-22]<>0,RC[-22]&R4C32,"q") -> 0,1,7,142000;0,1,8,4500;0,1,4,10800;qqqqqqqqqqqqqq;
E118: 0,1,7,8100 | F118: 144000 | G118: =R2C5&RC[-1] -> 0,1,7,144000 | H118: 0,1,8,4500 | I118: 0,1,4,10800 | X118: 0,1,7,144000;0,1,8,4500;0,1,4,10800; | Z118: =RC[3]&RC[4]&RC[5]&RC[6]&RC[7]&RC[8]&RC[9]&RC[10]&RC[11]&RC[12]&RC[13]&RC[14]&RC[15]&RC[16]&RC[17]&RC[18]&RC[19] -> 0,1,7,144000;0,1,8,4500;0,1,4,10800;qqqqqqqqqqqqqq | AC118: =IF(RC[-22]<>0,RC[-22]&R4C32,"q") -> 0,1,7,144000; | AD118: =IF(RC[-22]<>0,RC[-22]&R4C32,"q") -> 0,1,8,4500; | AE118: =IF(RC[-22]<>0,RC[-22]&R4C32,"q") -> 0,1,4,10800; | AF118: =IF(RC[-22]<>0,RC[-22]&R4C32,"q") -> q | AG118: =IF(RC[-22]<>0,RC[-22]&R4C32,"q") -> q | AH118: =IF(RC[-22]<>0,RC[-22]&R4C32,"q") -> q | AI118: =IF(RC[-22]<>0,RC[-22]&R4C32,"q") -> q | AJ118: =IF(RC[-22]<>0,RC[-22]&R4C32,"q") -> q | AK118: =IF(RC[-22]<>0,RC[-22]&R4C32,"q") -> q | AL118: =IF(RC[-22]<>0,RC[-22]&R4C32,"q") -> q | AM118: =IF(RC[-22]<>0,RC[-22]&R4C32,"q") -> q | AN118: =IF(RC[-22]<>0,RC[-22]&R4C32,"q") -> q | AO118: =IF(RC[-22]<>0,RC[-22]&R4C32,"q") -> q | AP118: =IF(RC[-22]<>0,RC[-22]&R4C32,"q") -> q | AQ118: =IF(RC[-22]<>0,RC[-22]&R4C32,"q") -> q | AR118: =IF(RC[-22]<>0,RC[-22]&R4C32,"q") -> q | AS118: =IF(RC[-22]<>0,RC[-22]&R4C32,"q") -> q | AT118: =IF(RC[-22]<>0,RC[-22]&R4C32,"q") -> 0,1,7,144000;0,1,8,4500;0,1,4,10800;; | AU118: =IF(RC[-22]<>0,RC[-22]&R4C32,"q") -> q | AV118: =IF(RC[-22]<>0,RC[-22]&R4C32,"q") -> 0,1,7,144000;0,1,8,4500;0,1,4,10800;qqqqqqqqqqqqqq;
E119: 0,1,7,8100 | F119: 450000 | G119: =R2C5&RC[-1] -> 0,1,7,450000 | H119: 0,1,8,4500 | I119: 0,1,4,10800 | X119: 0,1,7,450000;0,1,8,4500;0,1,4,10800; | Z119: =RC[3]&RC[4]&RC[5]&RC[6]&RC[7]&RC[8]&RC[9]&RC[10]&RC[11]&RC[12]&RC[13]&RC[14]&RC[15]&RC[16]&RC[17]&RC[18]&RC[19] -> 0,1,7,450000;0,1,8,4500;0,1,4,10800;qqqqqqqqqqqqqq | AC119: =IF(RC[-22]<>0,RC[-22]&R4C32,"q") -> 0,1,7,450000; | AD119: =IF(RC[-22]<>0,RC[-22]&R4C32,"q") -> 0,1,8,4500; | AE119: =IF(RC[-22]<>0,RC[-22]&R4C32,"q") -> 0,1,4,10800; | AF119: =IF(RC[-22]<>0,RC[-22]&R4C32,"q") -> q | AG119: =IF(RC[-22]<>0,RC[-22]&R4C32,"q") -> q | AH119: =IF(RC[-22]<>0,RC[-22]&R4C32,"q") -> q | AI119: =IF(RC[-22]<>0,RC[-22]&R4C32,"q") -> q | AJ119: =IF(RC[-22]<>0,RC[-22]&R4C32,"q") -> q | AK119: =IF(RC[-22]<>0,RC[-22]&R4C32,"q") -> q | AL119: =IF(RC[-22]<>0,RC[-22]&R4C32,"q") -> q | AM119: =IF(RC[-22]<>0,RC[-22]&R4C32,"q") -> q | AN119: =IF(RC[-22]<>0,RC[-22]&R4C32,"q") -> q | AO119: =IF(RC[-22]<>0,RC[-22]&R4C32,"q") -> q | AP119: =IF(RC[-22]<>0,RC[-22]&R4C32,"q") -> q | AQ119: =IF(RC[-22]<>0,RC[-22]&R4C32,"q") -> q | AR119: =IF(RC[-22]<>0,RC[-22]&R4C32,"q") -> q | AS119: =IF(RC[-22]<>0,RC[-22]&R4C32,"q") -> q | AT119: =IF(RC[-22]<>0,RC[-22]&R4C32,"q") -> 0,1,7,450000;0,1,8,4500;0,1,4,10800;; | AU119: =IF(RC[-22]<>0,RC[-22]&R4C32,"q") -> q | AV119: =IF(RC[-22]<>0,RC[-22]&R4C32,"q") -> 0,1,7,450000;0,1,8,4500;0,1,4,10800;qqqqqqqqqqqqqq;
E120: 0,1,7,8100 | F120: 148000 | G120: =R2C5&RC[-1] -> 0,1,7,148000 | H120: 0,1,8,4500 | I120: 0,1,4,10800 | X120: 0,1,7,148000;0,1,8,4500;0,1,4,10800; | Z120: =RC[3]&RC[4]&RC[5]&RC[6]&RC[7]&RC[8]&RC[9]&RC[10]&RC[11]&RC[12]&RC[13]&RC[14]&RC[15]&RC[16]&RC[17]&RC[18]&RC[19] -> 0,1,7,148000;0,1,8,4500;0,1,4,10800;qqqqqqqqqqqqqq | AC120: =IF(RC[-22]<>0,RC[-22]&R4C32,"q") -> 0,1,7,148000; | AD120: =IF(RC[-22]<>0,RC[-22]&R4C32,"q") -> 0,1,8,4500; | AE120: =IF(RC[-22]<>0,RC[-22]&R4C32,"q") -> 0,1,4,10800; | AF120: =IF(RC[-22]<>0,RC[-22]&R4C32,"q") -> q | AG120: =IF(RC[-22]<>0,RC[-22]&R4C32,"q") -> q | AH120: =IF(RC[-22]<>0,RC[-22]&R4C32,"q") -> q | AI120: =IF(RC[-22]<>0,RC[-22]&R4C32,"q") -> q | AJ120: =IF(RC[-22]<>0,RC[-22]&R4C32,"q") -> q | AK120: =IF(RC[-22]<>0,RC[-22]&R4C32,"q") -> q | AL120: =IF(RC[-22]<>0,RC[-22]&R4C32,"q") -> q | AM120: =IF(RC[-22]<>0,RC[-22]&R4C32,"q") -> q | AN120: =IF(RC[-22]<>0,RC[-22]&R4C32,"q") -> q | AO120: =IF(RC[-22]<>0,RC[-22]&R4C32,"q") -> q | AP120: =IF(RC[-22]<>0,RC[-22]&R4C32,"q") -> q | AQ120: =IF(RC[-22]<>0,RC[-22]&R4C32,"q") -> q | AR120: =IF(RC[-22]<>0,RC[-22]&R4C32,"q") -> q | AS120: =IF(RC[-22]<>0,RC[-22]&R4C32,"q") -> q | AT120: =IF(RC[-22]<>0,RC[-22]&R4C32,"q") -> 0,1,7,148000;0,1,8,4500;0,1,4,10800;; | AU120: =IF(RC[-22]<>0,RC[-22]&R4C32,"q") -> q | AV120: =IF(RC[-22]<>0,RC[-22]&R4C32,"q") -> 0,1,7,148000;0,1,8,4500;0,1,4,10800;qqqqqqqqqqqqqq;
E121: 0,1,7,8100 | F121: 150000 | G121: =R2C5&RC[-1] -> 0,1,7,150000 | H121: 0,1,8,4500 | I121: 0,1,4,10800 | X121: 0,1,7,150000;0,1,8,4500;0,1,4,10800; | Z121: =RC[3]&RC[4]&RC[5]&RC[6]&RC[7]&RC[8]&RC[9]&RC[10]&RC[11]&RC[12]&RC[13]&RC[14]&RC[15]&RC[16]&RC[17]&RC[18]&RC[19] -> 0,1,7,150000;0,1,8,4500;0,1,4,10800;qqqqqqqqqqqqqq | AC121: =IF(RC[-22]<>0,RC[-22]&R4C32,"q") -> 0,1,7,150000; | AD121: =IF(RC[-22]<>0,RC[-22]&R4C32,"q") -> 0,1,8,4500; | AE121: =IF(RC[-22]<>0,RC[-22]&R4C32,"q") -> 0,1,4,10800; | AF121: =IF(RC[-22]<>0,RC[-22]&R4C32,"q") -> q | AG121: =IF(RC[-22]<>0,RC[-22]&R4C32,"q") -> q | AH121: =IF(RC[-22]<>0,RC[-22]&R4C32,"q") -> q | AI121: =IF(RC[-22]<>0,RC[-22]&R4C32,"q") -> q | AJ121: =IF(RC[-22]<>0,RC[-22]&R4C32,"q") -> q | AK121: =IF(RC[-22]<>0,RC[-22]&R4C32,"q") -> q | AL121: =IF(RC[-22]<>0,RC[-22]&R4C32,"q") -> q | AM121: =IF(RC[-22]<>0,RC[-22]&R4C32,"q") -> q | AN121: =IF(RC[-22]<>0,RC[-22]&R4C32,"q") -> q | AO121: =IF(RC[-22]<>0,RC[-22]&R4C32,"q") -> q | AP121: =IF(RC[-22]<>0,RC[-22]&R4C32,"q") -> q | AQ121: =IF(RC[-22]<>0,RC[-22]&R4C32,"q") -> q | AR121: =IF(RC[-22]<>0,RC[-22]&R4C32,"q") -> q | AS121: =IF(RC[-22]<>0,RC[-22]&R4C32,"q") -> q | AT121: =IF(RC[-22]<>0,RC[-22]&R4C32,"q") -> 0,1,7,150000;0,1,8,4500;0,1,4,10800;; | AU121: =IF(RC[-22]<>0,RC[-22]&R4C32,"q") -> q | AV121: =IF(RC[-22]<>0,RC[-22]&R4C32,"q") -> 0,1,7,150000;0,1,8,4500;0,1,4,10800;qqqqqqqqqqqqqq;
E122: 0,1,7,840000 | F122: 152000 | G122: =R2C5&RC[-1] -> 0,1,7,152000 | H122: 0,1,8,388000 | I122: 0,1,4,1120000 | X122: 0,1,7,152000;0,1,8,388000;0,1,4,1120000; | Z122: =RC[3]&RC[4]&RC[5]&RC[6]&RC[7]&RC[8]&RC[9]&RC[10]&RC[11]&RC[12]&RC[13]&RC[14]&RC[15]&RC[16]&RC[17]&RC[18]&RC[19] -> 0,1,7,152000;0,1,8,388000;0,1,4,1120000;qqqqqqqqqqqqqq | AC122: =IF(RC[-22]<>0,RC[-22]&R4C32,"q") -> 0,1,7,152000; | AD122: =IF(RC[-22]<>0,RC[-22]&R4C32,"q") -> 0,1,8,388000; | AE122: =IF(RC[-22]<>0,RC[-22]&R4C32,"q") -> 0,1,4,1120000; | AF122: =IF(RC[-22]<>0,RC[-22]&R4C32,"q") -> q | AG122: =IF(RC[-22]<>0,RC[-22]&R4C32,"q") -> q | AH122: =IF(RC[-22]<>0,RC[-22]&R4C32,"q") -> q | AI122: =IF(RC[-22]<>0,RC[-22]&R4C32,"q") -> q | AJ122: =IF(RC[-22]<>0,RC[-22]&R4C32,"q") -> q | AK122: =IF(RC[-22]<>0,RC[-22]&R4C32,"q") -> q | AL122: =IF(RC[-22]<>0,RC[-22]&R4C32,"q") -> q | AM122: =IF(RC[-22]<>0,RC[-22]&R4C32,"q") -> q | AN122: =IF(RC[-22]<>0,RC[-22]&R4C32,"q") -> q | AO122: =IF(RC[-22]<>0,RC[-22]&R4C32,"q") -> q | AP122: =IF(RC[-22]<>0,RC[-22]&R4C32,"q") -> q | AQ122: =IF(RC[-22]<>0,RC[-22]&R4C32,"q") -> q | AR122: =IF(RC[-22]<>0,RC[-22]&R4C32,"q") -> q | AS122: =IF(RC[-22]<>0,RC[-22]&R4C32,"q") -> q | AT122: =IF(RC[-22]<>0,RC[-22]&R4C32,"q") -> 0,1,7,152000;0,1,8,388000;0,1,4,1120000;; | AU122: =IF(RC[-22]<>0,RC[-22]&R4C32,"q") -> q | AV122: =IF(RC[-22]<>0,RC[-22]&R4C32,"q") -> 0,1,7,152000;0,1,8,388000;0,1,4,1120000;qqqqqqqqqqqqqq;
E123: 0,1,7,8100 | F123: 154000 | G123: =R2C5&RC[-1] -> 0,1,7,154000 | H123: 0,1,8,4500 | I123: 0,1,4,10800 | X123: 0,1,7,154000;0,1,8,4500;0,1,4,10800; | Z123: =RC[3]&RC[4]&RC[5]&RC[6]&RC[7]&RC[8]&RC[9]&RC[10]&RC[11]&RC[12]&RC[13]&RC[14]&RC[15]&RC[16]&RC[17]&RC[18]&RC[19] -> 0,1,7,154000;0,1,8,4500;0,1,4,10800;qqqqqqqqqqqqqq | AC123: =IF(RC[-22]<>0,RC[-22]&R4C32,"q") -> 0,1,7,154000; | AD123: =IF(RC[-22]<>0,RC[-22]&R4C32,"q") -> 0,1,8,4500; | AE123: =IF(RC[-22]<>0,RC[-22]&R4C32,"q") -> 0,1,4,10800; | AF123: =IF(RC[-22]<>0,RC[-22]&R4C32,"q") -> q | AG123: =IF(RC[-22]<>0,RC[-22]&R4C32,"q") -> q | AH123: =IF(RC[-22]<>0,RC[-22]&R4C32,"q") -> q | AI123: =IF(RC[-22]<>0,RC[-22]&R4C32,"q") -> q | AJ123: =IF(RC[-22]<>0,RC[-22]&R4C32,"q") -> q | AK123: =IF(RC[-22]<>0,RC[-22]&R4C32,"q") -> q | AL123: =IF(RC[-22]<>0,RC[-22]&R4C32,"q") -> q | AM123: =IF(RC[-22]<>0,RC[-22]&R4C32,"q") -> q | AN123: =IF(RC[-22]<>0,RC[-22]&R4C32,"q") -> q | AO123: =IF(RC[-22]<>0,RC[-22]&R4C32,"q") -> q | AP123: =IF(RC[-22]<>0,RC[-22]&R4C32,"q") -> q | AQ123: =IF(RC[-22]<>0,RC[-22]&R4C32,"q") -> q | AR123: =IF(RC[-22]<>0,RC[-22]&R4C32,"q") -> q | AS123: =IF(RC[-22]<>0,RC[-22]&R4C32,"q") -> q | AT123: =IF(RC[-22]<>0,RC[-22]&R4C32,"q") -> 0,1,7,154000;0,1,8,4500;0,1,4,10800;; | AU123: =IF(RC[-22]<>0,RC[-22]&R4C32,"q") -> q | AV123: =IF(RC[-22]<>0,RC[-22]&R4C32,"q") -> 0,1,7,154000;0,1,8,4500;0,1,4,10800;qqqqqqqqqqqqqq;
E124: 0,1,7,8100 | F124: 482000 | G124: =R2C5&RC[-1] -> 0,1,7,482000 | H124: 0,1,8,4500 | I124: 0,1,4,10800 | X124: 0,1,7,482000;0,1,8,4500;0,1,4,10800; | Z124: =RC[3]&RC[4]&RC[5]&RC[6]&RC[7]&RC[8]&RC[9]&RC[10]&RC[11]&RC[12]&RC[13]&RC[14]&RC[15]&RC[16]&RC[17]&RC[18]&RC[19] -> 0,1,7,482000;0,1,8,4500;0,1,4,10800;qqqqqqqqqqqqqq | AC124: =IF(RC[-22]<>0,RC[-22]&R4C32,"q") -> 0,1,7,482000; | AD124: =IF(RC[-22]<>0,RC[-22]&R4C32,"q") -> 0,1,8,4500; | AE124: =IF(RC[-22]<>0,RC[-22]&R4C32,"q") -> 0,1,4,10800; | AF124: =IF(RC[-22]<>0,RC[-22]&R4C32,"q") -> q | AG124: =IF(RC[-22]<>0,RC[-22]&R4C32,"q") -> q | AH124: =IF(RC[-22]<>0,RC[-22]&R4C32,"q") -> q | AI124: =IF(RC[-22]<>0,RC[-22]&R4C32,"q") -> q | AJ124: =IF(RC[-22]<>0,RC[-22]&R4C32,"q") -> q | AK124: =IF(RC[-22]<>0,RC[-22]&R4C32,"q") -> q | AL124: =IF(RC[-22]<>0,RC[-22]&R4C32,"q") -> q | AM124: =IF(RC[-22]<>0,RC[-22]&R4C32,"q") -> q | AN124: =IF(RC[-22]<>0,RC[-22]&R4C32,"q") -> q | AO124: =IF(RC[-22]<>0,RC[-22]&R4C32,"q") -> q | AP124: =IF(RC[-22]<>0,RC[-22]&R4C32,"q") -> q | AQ124: =IF(RC[-22]<>0,RC[-22]&R4C32,"q") -> q | AR124: =IF(RC[-22]<>0,RC[-22]&R4C32,"q") -> q | AS124: =IF(RC[-22]<>0,RC[-22]&R4C32,"q") -> q | AT124: =IF(RC[-22]<>0,RC[-22]&R4C32,"q") -> 0,1,7,482000;0,1,8,4500;0,1,4,10800;; | AU124: =IF(RC[-22]<>0,RC[-22]&R4C32,"q") -> q | AV124: =IF(RC[-22]<>0,RC[-22]&R4C32,"q") -> 0,1,7,482000;0,1,8,4500;0,1,4,10800;qqqqqqqqqqqqqq;
E125: 0,1,7,840000 | F125: 158000 | G125: =R2C5&RC[-1] -> 0,1,7,158000 | H125: 0,1,8,388000 | I125: 0,1,4,1120000 | X125: 0,1,7,158000;0,1,8,388000;0,1,4,1120000; | Z125: =RC[3]&RC[4]&RC[5]&RC[6]&RC[7]&RC[8]&RC[9]&RC[10]&RC[11]&RC[12]&RC[13]&RC[14]&RC[15]&RC[16]&RC[17]&RC[18]&RC[19] -> 0,1,7,158000;0,1,8,388000;0,1,4,1120000;qqqqqqqqqqqqqq | AC125: =IF(RC[-22]<>0,RC[-22]&R4C32,"q") -> 0,1,7,158000; | AD125: =IF(RC[-22]<>0,RC[-22]&R4C32,"q") -> 0,1,8,388000; | AE125: =IF(RC[-22]<>0,RC[-22]&R4C32,"q") -> 0,1,4,1120000; | AF125: =IF(RC[-22]<>0,RC[-22]&R4C32,"q") -> q | AG125: =IF(RC[-22]<>0,RC[-22]&R4C32,"q") -> q | AH125: =IF(RC[-22]<>0,RC[-22]&R4C32,"q") -> q | AI125: =IF(RC[-22]<>0,RC[-22]&R4C32,"q") -> q | AJ125: =IF(RC[-22]<>0,RC[-22]&R4C32,"q") -> q | AK125: =IF(RC[-22]<>0,RC[-22]&R4C32,"q") -> q | AL125: =IF(RC[-22]<>0,RC[-22]&R4C32,"q") -> q | AM125: =IF(RC[-22]<>0,RC[-22]&R4C32,"q") -> q | AN125: =IF(RC[-22]<>0,RC[-22]&R4C32,"q") -> q | AO125: =IF(RC[-22]<>0,RC[-22]&R4C32,"q") -> q | AP125: =IF(RC[-22]<>0,RC[-22]&R4C32,"q") -> q | AQ125: =IF(RC[-22]<>0,RC[-22]&R4C32,"q") -> q | AR125: =IF(RC[-22]<>0,RC[-22]&R4C32,"q") -> q | AS125: =IF(RC[-22]<>0,RC[-22]&R4C32,"q") -> q | AT125: =IF(RC[-22]<>0,RC[-22]&R4C32,"q") -> 0,1,7,158000;0,1,8,388000;0,1,4,1120000;; | AU125: =IF(RC[-22]<>0,RC[-22]&R4C32,"q") -> q | AV125: =IF(RC[-22]<>0,RC[-22]&R4C32,"q") -> 0,1,7,158000;0,1,8,388000;0,1,4,1120000;qqqqqqqqqqqqqq;
E126: 0,1,7,8100 | F126: 160000 | G126: =R2C5&RC[-1] -> 0,1,7,160000 | H126: 0,1,8,4500 | I126: 0,1,4,10800 | X126: 0,1,7,160000;0,1,8,4500;0,1,4,10800; | Z126: =RC[3]&RC[4]&RC[5]&RC[6]&RC[7]&RC[8]&RC[9]&RC[10]&RC[11]&RC[12]&RC[13]&RC[14]&RC[15]&RC[16]&RC[17]&RC[18]&RC[19] -> 0,1,7,160000;0,1,8,4500;0,1,4,10800;qqqqqqqqqqqqqq | AC126: =IF(RC[-22]<>0,RC[-22]&R4C32,"q") -> 0,1,7,160000; | AD126: =IF(RC[-22]<>0,RC[-22]&R4C32,"q") -> 0,1,8,4500; | AE126: =IF(RC[-22]<>0,RC[-22]&R4C32,"q") -> 0,1,4,10800; | AF126: =IF(RC[-22]<>0,RC[-22]&R4C32,"q") -> q | AG126: =IF(RC[-22]<>0,RC[-22]&R4C32,"q") -> q | AH126: =IF(RC[-22]<>0,RC[-22]&R4C32,"q") -> q | AI126: =IF(RC[-22]<>0,RC[-22]&R4C32,"q") -> q | AJ126: =IF(RC[-22]<>0,RC[-22]&R4C32,"q") -> q | AK126: =IF(RC[-22]<>0,RC[-22]&R4C32,"q") -> q | AL126: =IF(RC[-22]<>0,RC[-22]&R4C32,"q") -> q | AM126: =IF(RC[-22]<>0,RC[-22]&R4C32,"q") -> q | AN126: =IF(RC[-22]<>0,RC[-22]&R4C32,"q") -> q | AO126: =IF(RC[-22]<>0,RC[-22]&R4C32,"q") -> q | AP126: =IF(RC[-22]<>0,RC[-22]&R4C32,"q") -> q | AQ126: =IF(RC[-22]<>0,RC[-22]&R4C32,"q") -> q | AR126: =IF(RC[-22]<>0,RC[-22]&R4C32,"q") -> q | AS126: =IF(RC[-22]<>0,RC[-22]&R4C32,"q") -> q | AT126: =IF(RC[-22]<>0,RC[-22]&R4C32,"q") -> 0,1,7,160000;0,1,8,4500;0,1,4,10800;; | AU126: =IF(RC[-22]<>0,RC[-22]&R4C32,"q") -> q | AV126: =IF(RC[-22]<>0,RC[-22]&R4C32,"q") -> 0,1,7,160000;0,1,8,4500;0,1,4,10800;qqqqqqqqqqqqqq;
E127: 0,1,7,10000 | F127: 162000 | G127: =R2C5&RC[-1] -> 0,1,7,162000 | H127: 0,1,8,5500 | I127: 0,1,4,13500 | X127: 0,1,7,162000;0,1,8,5500;0,1,4,13500; | Z127: =RC[3]&RC[4]&RC[5]&RC[6]&RC[7]&RC[8]&RC[9]&RC[10]&RC[11]&RC[12]&RC[13]&RC[14]&RC[15]&RC[16]&RC[17]&RC[18]&RC[19] -> 0,1,7,162000;0,1,8,5500;0,1,4,13500;qqqqqqqqqqqqqq | AC127: =IF(RC[-22]<>0,RC[-22]&R4C32,"q") -> 0,1,7,162000; | AD127: =IF(RC[-22]<>0,RC[-22]&R4C32,"q") -> 0,1,8,5500; | AE127: =IF(RC[-22]<>0,RC[-22]&R4C32,"q") -> 0,1,4,13500; | AF127: =IF(RC[-22]<>0,RC[-22]&R4C32,"q") -> q | AG127: =IF(RC[-22]<>0,RC[-22]&R4C32,"q") -> q | AH127: =IF(RC[-22]<>0,RC[-22]&R4C32,"q") -> q | AI127: =IF(RC[-22]<>0,RC[-22]&R4C32,"q") -> q | AJ127: =IF(RC[-22]<>0,RC[-22]&R4C32,"q") -> q | AK127: =IF(RC[-22]<>0,RC[-22]&R4C32,"q") -> q | AL127: =IF(RC[-22]<>0,RC[-22]&R4C32,"q") -> q | AM127: =IF(RC[-22]<>0,RC[-22]&R4C32,"q") -> q | AN127: =IF(RC[-22]<>0,RC[-22]&R4C32,"q") -> q | AO127: =IF(RC[-22]<>0,RC[-22]&R4C32,"q") -> q | AP127: =IF(RC[-22]<>0,RC[-22]&R4C32,"q") -> q | AQ127: =IF(RC[-22]<>0,RC[-22]&R4C32,"q") -> q | AR127: =IF(RC[-22]<>0,RC[-22]&R4C32,"q") -> q | AS127: =IF(RC[-22]<>0,RC[-22]&R4C32,"q") -> q | AT127: =IF(RC[-22]<>0,RC[-22]&R4C32,"q") -> 0,1,7,162000;0,1,8,5500;0,1,4,13500;; | AU127: =IF(RC[-22]<>0,RC[-22]&R4C32,"q") -> q | AV127: =IF(RC[-22]<>0,RC[-22]&R4C32,"q") -> 0,1,7,162000;0,1,8,5500;0,1,4,13500;qqqqqqqqqqqqqq;
E128: 0,1,7,10000 | F128: 164000 | G128: =R2C5&RC[-1] -> 0,1,7,164000 | H128: 0,1,8,5500 | I128: 0,1,4,13500 | X128: 0,1,7,164000;0,1,8,5500;0,1,4,13500; | Z128: =RC[3]&RC[4]&RC[5]&RC[6]&RC[7]&RC[8]&RC[9]&RC[10]&RC[11]&RC[12]&RC[13]&RC[14]&RC[15]&RC[16]&RC[17]&RC[18]&RC[19] -> 0,1,7,164000;0,1,8,5500;0,1,4,13500;qqqqqqqqqqqqqq | AC128: =IF(RC[-22]<>0,RC[-22]&R4C32,"q") -> 0,1,7,164000; | AD128: =IF(RC[-22]<>0,RC[-22]&R4C32,"q") -> 0,1,8,5500; | AE128: =IF(RC[-22]<>0,RC[-22]&R4C32,"q") -> 0,1,4,13500; | AF128: =IF(RC[-22]<>0,RC[-22]&R4C32,"q") -> q | AG128: =IF(RC[-22]<>0,RC[-22]&R4C32,"q") -> q | AH128: =IF(RC[-22]<>0,RC[-22]&R4C32,"q") -> q | AI128: =IF(RC[-22]<>0,RC[-22]&R4C32,"q") -> q | AJ128: =IF(RC[-22]<>0,RC[-22]&R4C32,"q") -> q | AK128: =IF(RC[-22]<>0,RC[-22]&R4C32,"q") -> q | AL128: =IF(RC[-22]<>0,RC[-22]&R4C32,"q") -> q | AM128: =IF(RC[-22]<>0,RC[-22]&R4C32,"q") -> q | AN128: =IF(RC[-22]<>0,RC[-22]&R4C32,"q") -> q | AO128: =IF(RC[-22]<>0,RC[-22]&R4C32,"q") -> q | AP128: =IF(RC[-22]<>0,RC[-22]&R4C32,"q") -> q | AQ128: =IF(RC[-22]<>0,RC[-22]&R4C32,"q") -> q | AR128: =IF(RC[-22]<>0,RC[-22]&R4C32,"q") -> q | AS128: =IF(RC[-22]<>0,RC[-22]&R4C32,"q") -> q | AT128: =IF(RC[-22]<>0,RC[-22]&R4C32,"q") -> 0,1,7,164000;0,1,8,5500;0,1,4,13500;; | AU128: =IF(RC[-22]<>0,RC[-22]&R4C32,"q") -> q | AV128: =IF(RC[-22]<>0,RC[-22]&R4C32,"q") -> 0,1,7,164000;0,1,8,5500;0,1,4,13500;qqqqqqqqqqqqqq;
E129: 0,1,7,10000 | F129: 512000 | G129: =R2C5&RC[-1] -> 0,1,7,512000 | H129: 0,1,8,5500 | I129: 0,1,4,13500 | X129: 0,1,7,512000;0,1,8,5500;0,1,4,13500; | Z129: =RC[3]&RC[4]&RC[5]&RC[6]&RC[7]&RC[8]&RC[9]&RC[10]&RC[11]&RC[12]&RC[13]&RC[14]&RC[15]&RC[16]&RC[17]&RC[18]&RC[19] -> 0,1,7,512000;0,1,8,5500;0,1,4,13500;qqqqqqqqqqqqqq | AC129: =IF(RC[-22]<>0,RC[-22]&R4C32,"q") -> 0,1,7,512000; | AD129: =IF(RC[-22]<>0,RC[-22]&R4C32,"q") -> 0,1,8,5500; | AE129: =IF(RC[-22]<>0,RC[-22]&R4C32,"q") -> 0,1,4,13500; | AF129: =IF(RC[-22]<>0,RC[-22]&R4C32,"q") -> q | AG129: =IF(RC[-22]<>0,RC[-22]&R4C32,"q") -> q | AH129: =IF(RC[-22]<>0,RC[-22]&R4C32,"q") -> q | AI129: =IF(RC[-22]<>0,RC[-22]&R4C32,"q") -> q | AJ129: =IF(RC[-22]<>0,RC[-22]&R4C32,"q") -> q | AK129: =IF(RC[-22]<>0,RC[-22]&R4C32,"q") -> q | AL129: =IF(RC[-22]<>0,RC[-22]&R4C32,"q") -> q | AM129: =IF(RC[-22]<>0,RC[-22]&R4C32,"q") -> q | AN129: =IF(RC[-22]<>0,RC[-22]&R4C32,"q") -> q | AO129: =IF(RC[-22]<>0,RC[-22]&R4C32,"q") -> q | AP129: =IF(RC[-22]<>0,RC[-22]&R4C32,"q") -> q | AQ129: =IF(RC[-22]<>0,RC[-22]&R4C32,"q") -> q | AR129: =IF(RC[-22]<>0,RC[-22]&R4C32,"q") -> q | AS129: =IF(RC[-22]<>0,RC[-22]&R4C32,"q") -> q | AT129: =IF(RC[-22]<>0,RC[-22]&R4C32,"q") -> 0,1,7,512000;0,1,8,5500;0,1,4,13500;; | AU129: =IF(RC[-22]<>0,RC[-22]&R4C32,"q") -> q | AV129: =IF(RC[-22]<>0,RC[-22]&R4C32,"q") -> 0,1,7,512000;0,1,8,5500;0,1,4,13500;qqqqqqqqqqqqqq;
E130: 0,1,7,10000 | F130: 167000 | G130: =R2C5&RC[-1] -> 0,1,7,167000 | H130: 0,1,8,5500 | I130: 0,1,4,13500 | X130: 0,1,7,167000;0,1,8,5500;0,1,4,13500; | Z130: =RC[3]&RC[4]&RC[5]&RC[6]&RC[7]&RC[8]&RC[9]&RC[10]&RC[11]&RC[12]&RC[13]&RC[14]&RC[15]&RC[16]&RC[17]&RC[18]&RC[19] -> 0,1,7,167000;0,1,8,5500;0,1,4,13500;qqqqqqqqqqqqqq | AC130: =IF(RC[-22]<>0,RC[-22]&R4C32,"q") -> 0,1,7,167000; | AD130: =IF(RC[-22]<>0,RC[-22]&R4C32,"q") -> 0,1,8,5500; | AE130: =IF(RC[-22]<>0,RC[-22]&R4C32,"q") -> 0,1,4,13500; | AF130: =IF(RC[-22]<>0,RC[-22]&R4C32,"q") -> q | AG130: =IF(RC[-22]<>0,RC[-22]&R4C32,"q") -> q | AH130: =IF(RC[-22]<>0,RC[-22]&R4C32,"q") -> q | AI130: =IF(RC[-22]<>0,RC[-22]&R4C32,"q") -> q | AJ130: =IF(RC[-22]<>0,RC[-22]&R4C32,"q") -> q | AK130: =IF(RC[-22]<>0,RC[-22]&R4C32,"q") -> q | AL130: =IF(RC[-22]<>0,RC[-22]&R4C32,"q") -> q | AM130: =IF(RC[-22]<>0,RC[-22]&R4C32,"q") -> q | AN130: =IF(RC[-22]<>0,RC[-22]&R4C32,"q") -> q | AO130: =IF(RC[-22]<>0,RC[-22]&R4C32,"q") -> q | AP130: =IF(RC[-22]<>0,RC[-22]&R4C32,"q") -> q | AQ130: =IF(RC[-22]<>0,RC[-22]&R4C32,"q") -> q | AR130: =IF(RC[-22]<>0,RC[-22]&R4C32,"q") -> q | AS130: =IF(RC[-22]<>0,RC[-22]&R4C32,"q") -> q | AT130: =IF(RC[-22]<>0,RC[-22]&R4C32,"q") -> 0,1,7,167000;0,1,8,5500;0,1,4,13500;; | AU130: =IF(RC[-22]<>0,RC[-22]&R4C32,"q") -> q | AV130: =IF(RC[-22]<>0,RC[-22]&R4C32,"q") -> 0,1,7,167000;0,1,8,5500;0,1,4,13500;qqqqqqqqqqqqqq;
E131: 0,1,7,10000 | F131: 169000 | G131: =R2C5&RC[-1] -> 0,1,7,169000 | H131: 0,1,8,5500 | I131: 0,1,4,13500 | X131: 0,1,7,169000;0,1,8,5500;0,1,4,13500; | Z131: =RC[3]&RC[4]&RC[5]&RC[6]&RC[7]&RC[8]&RC[9]&RC[10]&RC[11]&RC[12]&RC[13]&RC[14]&RC[15]&RC[16]&RC[17]&RC[18]&RC[19] -> 0,1,7,169000;0,1,8,5500;0,1,4,13500;qqqqqqqqqqqqqq | AC131: =IF(RC[-22]<>0,RC[-22]&R4C32,"q") -> 0,1,7,169000; | AD131: =IF(RC[-22]<>0,RC[-22]&R4C32,"q") -> 0,1,8,5500; | AE131: =IF(RC[-22]<>0,RC[-22]&R4C32,"q") -> 0,1,4,13500; | AF131: =IF(RC[-22]<>0,RC[-22]&R4C32,"q") -> q | AG131: =IF(RC[-22]<>0,RC[-22]&R4C32,"q") -> q | AH131: =IF(RC[-22]<>0,RC[-22]&R4C32,"q") -> q | AI131: =IF(RC[-22]<>0,RC[-22]&R4C32,"q") -> q | AJ131: =IF(RC[-22]<>0,RC[-22]&R4C32,"q") -> q | AK131: =IF(RC[-22]<>0,RC[-22]&R4C32,"q") -> q | AL131: =IF(RC[-22]<>0,RC[-22]&R4C32,"q") -> q | AM131: =IF(RC[-22]<>0,RC[-22]&R4C32,"q") -> q | AN131: =IF(RC[-22]<>0,RC[-22]&R4C32,"q") -> q | AO131: =IF(RC[-22]<>0,RC[-22]&R4C32,"q") -> q | AP131: =IF(RC[-22]<>0,RC[-22]&R4C32,"q") -> q | AQ131: =IF(RC[-22]<>0,RC[-22]&R4C32,"q") -> q | AR131: =IF(RC[-22]<>0,RC[-22]&R4C32,"q") -> q | AS131: =IF(RC[-22]<>0,RC[-22]&R4C32,"q") -> q | AT131: =IF(RC[-22]<>0,RC[-22]&R4C32,"q") -> 0,1,7,169000;0,1,8,5500;0,1,4,13500;; | AU131: =IF(RC[-22]<>0,RC[-22]&R4C32,"q") -> q | AV131: =IF(RC[-22]<>0,RC[-22]&R4C32,"q") -> 0,1,7,169000;0,1,8,5500;0,1,4,13500;qqqqqqqqqqqqqq;
E132: 0,1,7,10000 | F132: 171000 | G132: =R2C5&RC[-1] -> 0,1,7,171000 | H132: 0,1,8,5500 | I132: 0,1,4,13500 | X132: 0,1,7,171000;0,1,8,5500;0,1,4,13500; | Z132: =RC[3]&RC[4]&RC[5]&RC[6]&RC[7]&RC[8]&RC[9]&RC[10]&RC[11]&RC[12]&RC[13]&RC[14]&RC[15]&RC[16]&RC[17]&RC[18]&RC[19] -> 0,1,7,171000;0,1,8,5500;0,1,4,13500;qqqqqqqqqqqqqq | AC132: =IF(RC[-22]<>0,RC[-22]&R4C32,"q") -> 0,1,7,171000; | AD132: =IF(RC[-22]<>0,RC[-22]&R4C32,"q") -> 0,1,8,5500; | AE132: =IF(RC[-22]<>0,RC[-22]&R4C32,"q") -> 0,1,4,13500; | AF132: =IF(RC[-22]<>0,RC[-22]&R4C32,"q") -> q | AG132: =IF(RC[-22]<>0,RC[-22]&R4C32,"q") -> q | AH132: =IF(RC[-22]<>0,RC[-22]&R4C32,"q") -> q | AI132: =IF(RC[-22]<>0,RC[-22]&R4C32,"q") -> q | AJ132: =IF(RC[-22]<>0,RC[-22]&R4C32,"q") -> q | AK132: =IF(RC[-22]<>0,RC[-22]&R4C32,"q") -> q | AL132: =IF(RC[-22]<>0,RC[-22]&R4C32,"q") -> q | AM132: =IF(RC[-22]<>0,RC[-22]&R4C32,"q") -> q | AN132: =IF(RC[-22]<>0,RC[-22]&R4C32,"q") -> q | AO132: =IF(RC[-22]<>0,RC[-22]&R4C32,"q") -> q | AP132: =IF(RC[-22]<>0,RC[-22]&R4C32,"q") -> q | AQ132: =IF(RC[-22]<>0,RC[-22]&R4C32,"q") -> q | AR132: =IF(RC[-22]<>0,RC[-22]&R4C32,"q") -> q | AS132: =IF(RC[-22]<>0,RC[-22]&R4C32,"q") -> q | AT132: =IF(RC[-22]<>0,RC[-22]&R4C32,"q") -> 0,1,7,171000;0,1,8,5500;0,1,4,13500;; | AU132: =IF(RC[-22]<>0,RC[-22]&R4C32,"q") -> q | AV132: =IF(RC[-22]<>0,RC[-22]&R4C32,"q") -> 0,1,7,171000;0,1,8,5500;0,1,4,13500;qqqqqqqqqqqqqq;
E133: 0,1,7,1200000 | F133: 173000 | G133: =R2C5&RC[-1] -> 0,1,7,173000 | H133: 0,1,8,620000 | I133: 0,1,4,1200000 | X133: 0,1,7,173000;0,1,8,620000;0,1,4,1200000; | Z133: =RC[3]&RC[4]&RC[5]&RC[6]&RC[7]&RC[8]&RC[9]&RC[10]&RC[11]&RC[12]&RC[13]&RC[14]&RC[15]&RC[16]&RC[17]&RC[18]&RC[19] -> 0,1,7,173000;0,1,8,620000;0,1,4,1200000;qqqqqqqqqqqqqq | AC133: =IF(RC[-22]<>0,RC[-22]&R4C32,"q") -> 0,1,7,173000; | AD133: =IF(RC[-22]<>0,RC[-22]&R4C32,"q") -> 0,1,8,620000; | AE133: =IF(RC[-22]<>0,RC[-22]&R4C32,"q") -> 0,1,4,1200000; | AF133: =IF(RC[-22]<>0,RC[-22]&R4C32,"q") -> q | AG133: =IF(RC[-22]<>0,RC[-22]&R4C32,"q") -> q | AH133: =IF(RC[-22]<>0,RC[-22]&R4C32,"q") -> q | AI133: =IF(RC[-22]<>0,RC[-22]&R4C32,"q") -> q | AJ133: =IF(RC[-22]<>0,RC[-22]&R4C32,"q") -> q | AK133: =IF(RC[-22]<>0,RC[-22]&R4C32,"q") -> q | AL133: =IF(RC[-22]<>0,RC[-22]&R4C32,"q") -> q | AM133: =IF(RC[-22]<>0,RC[-22]&R4C32,"q") -> q | AN133: =IF(RC[-22]<>0,RC[-22]&R4C32,"q") -> q | AO133: =IF(RC[-22]<>0,RC[-22]&R4C32,"q") -> q | AP133: =IF(RC[-22]<>0,RC[-22]&R4C32,"q") -> q | AQ133: =IF(RC[-22]<>0,RC[-22]&R4C32,"q") -> q | AR133: =IF(RC[-22]<>0,RC[-22]&R4C32,"q") -> q | AS133: =IF(RC[-22]<>0,RC[-22]&R4C32,"q") -> q | AT133: =IF(RC[-22]<>0,RC[-22]&R4C32,"q") -> 0,1,7,173000;0,1,8,620000;0,1,4,1200000;; | AU133: =IF(RC[-22]<>0,RC[-22]&R4C32,"q") -> q | AV133: =IF(RC[-22]<>0,RC[-22]&R4C32,"q") -> 0,1,7,173000;0,1,8,620000;0,1,4,1200000;qqqqqqqqqqqqqq;
E134: 0,1,7,10000 | F134: 541000 | G134: =R2C5&RC[-1] -> 0,1,7,541000 | H134: 0,1,8,5500 | I134: 0,1,4,13500 | X134: 0,1,7,541000;0,1,8,5500;0,1,4,13500; | Z134: =RC[3]&RC[4]&RC[5]&RC[6]&RC[7]&RC[8]&RC[9]&RC[10]&RC[11]&RC[12]&RC[13]&RC[14]&RC[15]&RC[16]&RC[17]&RC[18]&RC[19] -> 0,1,7,541000;0,1,8,5500;0,1,4,13500;qqqqqqqqqqqqqq | AC134: =IF(RC[-22]<>0,RC[-22]&R4C32,"q") -> 0,1,7,541000; | AD134: =IF(RC[-22]<>0,RC[-22]&R4C32,"q") -> 0,1,8,5500; | AE134: =IF(RC[-22]<>0,RC[-22]&R4C32,"q") -> 0,1,4,13500; | AF134: =IF(RC[-22]<>0,RC[-22]&R4C32,"q") -> q | AG134: =IF(RC[-22]<>0,RC[-22]&R4C32,"q") -> q | AH134: =IF(RC[-22]<>0,RC[-22]&R4C32,"q") -> q | AI134: =IF(RC[-22]<>0,RC[-22]&R4C32,"q") -> q | AJ134: =IF(RC[-22]<>0,RC[-22]&R4C32,"q") -> q | AK134: =IF(RC[-22]<>0,RC[-22]&R4C32,"q") -> q | AL134: =IF(RC[-22]<>0,RC[-22]&R4C32,"q") -> q | AM134: =IF(RC[-22]<>0,RC[-22]&R4C32,"q") -> q | AN134: =IF(RC[-22]<>0,RC[-22]&R4C32,"q") -> q | AO134: =IF(RC[-22]<>0,RC[-22]&R4C32,"q") -> q | AP134: =IF(RC[-22]<>0,RC[-22]&R4C32,"q") -> q | AQ134: =IF(RC[-22]<>0,RC[-22]&R4C32,"q") -> q | AR134: =IF(RC[-22]<>0,RC[-22]&R4C32,"q") -> q | AS134: =IF(RC[-22]<>0,RC[-22]&R4C32,"q") -> q | AT134: =IF(RC[-22]<>0,RC[-22]&R4C32,"q") -> 0,1,7,541000;0,1,8,5500;0,1,4,13500;; | AU134: =IF(RC[-22]<>0,RC[-22]&R4C32,"q") -> q | AV134: =IF(RC[-22]<>0,RC[-22]&R4C32,"q") -> 0,1,7,541000;0,1,8,5500;0,1,4,13500;qqqqqqqqqqqqqq;
E135: 0,1,7,10000 | F135: 177000 | G135: =R2C5&RC[-1] -> 0,1,7,177000 | H135: 0,1,8,5500 | I135: 0,1,4,13500 | X135: 0,1,7,177000;0,1,8,5500;0,1,4,13500; | Z135: =RC[3]&RC[4]&RC[5]&RC[6]&RC[7]&RC[8]&RC[9]&RC[10]&RC[11]&RC[12]&RC[13]&RC[14]&RC[15]&RC[16]&RC[17]&RC[18]&RC[19] -> 0,1,7,177000;0,1,8,5500;0,1,4,13500;qqqqqqqqqqqqqq | AC135: =IF(RC[-22]<>0,RC[-22]&R4C32,"q") -> 0,1,7,177000; | AD135: =IF(RC[-22]<>0,RC[-22]&R4C32,"q") -> 0,1,8,5500; | AE135: =IF(RC[-22]<>0,RC[-22]&R4C32,"q") -> 0,1,4,13500; | AF135: =IF(RC[-22]<>0,RC[-22]&R4C32,"q") -> q | AG135: =IF(RC[-22]<>0,RC[-22]&R4C32,"q") -> q | AH135: =IF(RC[-22]<>0,RC[-22]&R4C32,"q") -> q | AI135: =IF(RC[-22]<>0,RC[-22]&R4C32,"q") -> q | AJ135: =IF(RC[-22]<>0,RC[-22]&R4C32,"q") -> q | AK135: =IF(RC[-22]<>0,RC[-22]&R4C32,"q") -> q | AL135: =IF(RC[-22]<>0,RC[-22]&R4C32,"q") -> q | AM135: =IF(RC[-22]<>0,RC[-22]&R4C32,"q") -> q | AN135: =IF(RC[-22]<>0,RC[-22]&R4C32,"q") -> q | AO135: =IF(RC[-22]<>0,RC[-22]&R4C32,"q") -> q | AP135: =IF(RC[-22]<>0,RC[-22]&R4C32,"q") -> q | AQ135: =IF(RC[-22]<>0,RC[-22]&R4C32,"q") -> q | AR135: =IF(RC[-22]<>0,RC[-22]&R4C32,"q") -> q | AS135: =IF(RC[-22]<>0,RC[-22]&R4C32,"q") -> q | AT135: =IF(RC[-22]<>0,RC[-22]&R4C32,"q") -> 0,1,7,177000;0,1,8,5500;0,1,4,13500;; | AU135: =IF(RC[-22]<>0,RC[-22]&R4C32,"q") -> q | AV135: =IF(RC[-22]<>0,RC[-22]&R4C32,"q") -> 0,1,7,177000;0,1,8,5500;0,1,4,13500;qqqqqqqqqqqqqq;
E136: 0,1,7,10000 | F136: 179000 | G136: =R2C5&RC[-1] -> 0,1,7,179000 | H136: 0,1,8,5500 | I136: 0,1,4,13500 | X136: 0,1,7,179000;0,1,8,5500;0,1,4,13500; | Z136: =RC[3]&RC[4]&RC[5]&RC[6]&RC[7]&RC[8]&RC[9]&RC[10]&RC[11]&RC[12]&RC[13]&RC[14]&RC[15]&RC[16]&RC[17]&RC[18]&RC[19] -> 0,1,7,179000;0,1,8,5500;0,1,4,13500;qqqqqqqqqqqqqq | AC136: =IF(RC[-22]<>0,RC[-22]&R4C32,"q") -> 0,1,7,179000; | AD136: =IF(RC[-22]<>0,RC[-22]&R4C32,"q") -> 0,1,8,5500; | AE136: =IF(RC[-22]<>0,RC[-22]&R4C32,"q") -> 0,1,4,13500; | AF136: =IF(RC[-22]<>0,RC[-22]&R4C32,"q") -> q | AG136: =IF(RC[-22]<>0,RC[-22]&R4C32,"q") -> q | AH136: =IF(RC[-22]<>0,RC[-22]&R4C32,"q") -> q | AI136: =IF(RC[-22]<>0,RC[-22]&R4C32,"q") -> q | AJ136: =IF(RC[-22]<>0,RC[-22]&R4C32,"q") -> q | AK136: =IF(RC[-22]<>0,RC[-22]&R4C32,"q") -> q | AL136: =IF(RC[-22]<>0,RC[-22]&R4C32,"q") -> q | AM136: =IF(RC[-22]<>0,RC[-22]&R4C32,"q") -> q | AN136: =IF(RC[-22]<>0,RC[-22]&R4C32,"q") -> q | AO136: =IF(RC[-22]<>0,RC[-22]&R4C32,"q") -> q | AP136: =IF(RC[-22]<>0,RC[-22]&R4C32,"q") -> q | AQ136: =IF(RC[-22]<>0,RC[-22]&R4C32,"q") -> q | AR136: =IF(RC[-22]<>0,RC[-22]&R4C32,"q") -> q | AS136: =IF(RC[-22]<>0,RC[-22]&R4C32,"q") -> q | AT136: =IF(RC[-22]<>0,RC[-22]&R4C32,"q") -> 0,1,7,179000;0,1,8,5500;0,1,4,13500;; | AU136: =IF(RC[-22]<>0,RC[-22]&R4C32,"q") -> q | AV136: =IF(RC[-22]<>0,RC[-22]&R4C32,"q") -> 0,1,7,179000;0,1,8,5500;0,1,4,13500;qqqqqqqqqqqqqq;
E137: 0,1,7,1540000 | F137: 181000 | G137: =R2C5&RC[-1] -> 0,1,7,181000 | H137: 0,1,8,650000 | I137: 0,1,4,1200000 | X137: 0,1,7,181000;0,1,8,650000;0,1,4,1200000; | Z137: =RC[3]&RC[4]&RC[5]&RC[6]&RC[7]&RC[8]&RC[9]&RC[10]&RC[11]&RC[12]&RC[13]&RC[14]&RC[15]&RC[16]&RC[17]&RC[18]&RC[19] -> 0,1,7,181000;0,1,8,650000;0,1,4,1200000;qqqqqqqqqqqqqq | AC137: =IF(RC[-22]<>0,RC[-22]&R4C32,"q") -> 0,1,7,181000; | AD137: =IF(RC[-22]<>0,RC[-22]&R4C32,"q") -> 0,1,8,650000; | AE137: =IF(RC[-22]<>0,RC[-22]&R4C32,"q") -> 0,1,4,1200000; | AF137: =IF(RC[-22]<>0,RC[-22]&R4C32,"q") -> q | AG137: =IF(RC[-22]<>0,RC[-22]&R4C32,"q") -> q | AH137: =IF(RC[-22]<>0,RC[-22]&R4C32,"q") -> q | AI137: =IF(RC[-22]<>0,RC[-22]&R4C32,"q") -> q | AJ137: =IF(RC[-22]<>0,RC[-22]&R4C32,"q") -> q | AK137: =IF(RC[-22]<>0,RC[-22]&R4C32,"q") -> q | AL137: =IF(RC[-22]<>0,RC[-22]&R4C32,"q") -> q | AM137: =IF(RC[-22]<>0,RC[-22]&R4C32,"q") -> q | AN137: =IF(RC[-22]<>0,RC[-22]&R4C32,"q") -> q | AO137: =IF(RC[-22]<>0,RC[-22]&R4C32,"q") -> q | AP137: =IF(RC[-22]<>0,RC[-22]&R4C32,"q") -> q | AQ137: =IF(RC[-22]<>0,RC[-22]&R4C32,"q") -> q | AR137: =IF(RC[-22]<>0,RC[-22]&R4C32,"q") -> q | AS137: =IF(RC[-22]<>0,RC[-22]&R4C32,"q") -> q | AT137: =IF(RC[-22]<>0,RC[-22]&R4C32,"q") -> 0,1,7,181000;0,1,8,650000;0,1,4,1200000;; | AU137: =IF(RC[-22]<>0,RC[-22]&R4C32,"q") -> q | AV137: =IF(RC[-22]<>0,RC[-22]&R4C32,"q") -> 0,1,7,181000;0,1,8,650000;0,1,4,1200000;qqqqqqqqqqqqqq;
E138: 0,1,7,10000 | F138: 183000 | G138: =R2C5&RC[-1] -> 0,1,7,183000 | H138: 0,1,8,5500 | I138: 0,1,4,13500 | X138: 0,1,7,183000;0,1,8,5500;0,1,4,13500; | Z138: =RC[3]&RC[4]&RC[5]&RC[6]&RC[7]&RC[8]&RC[9]&RC[10]&RC[11]&RC[12]&RC[13]&RC[14]&RC[15]&RC[16]&RC[17]&RC[18]&RC[19] -> 0,1,7,183000;0,1,8,5500;0,1,4,13500;qqqqqqqqqqqqqq | AC138: =IF(RC[-22]<>0,RC[-22]&R4C32,"q") -> 0,1,7,183000; | AD138: =IF(RC[-22]<>0,RC[-22]&R4C32,"q") -> 0,1,8,5500; | AE138: =IF(RC[-22]<>0,RC[-22]&R4C32,"q") -> 0,1,4,13500; | AF138: =IF(RC[-22]<>0,RC[-22]&R4C32,"q") -> q | AG138: =IF(RC[-22]<>0,RC[-22]&R4C32,"q") -> q | AH138: =IF(RC[-22]<>0,RC[-22]&R4C32,"q") -> q | AI138: =IF(RC[-22]<>0,RC[-22]&R4C32,"q") -> q | AJ138: =IF(RC[-22]<>0,RC[-22]&R4C32,"q") -> q | AK138: =IF(RC[-22]<>0,RC[-22]&R4C32,"q") -> q | AL138: =IF(RC[-22]<>0,RC[-22]&R4C32,"q") -> q | AM138: =IF(RC[-22]<>0,RC[-22]&R4C32,"q") -> q | AN138: =IF(RC[-22]<>0,RC[-22]&R4C32,"q") -> q | AO138: =IF(RC[-22]<>0,RC[-22]&R4C32,"q") -> q | AP138: =IF(RC[-22]<>0,RC[-22]&R4C32,"q") -> q | AQ138: =IF(RC[-22]<>0,RC[-22]&R4C32,"q") -> q | AR138: =IF(RC[-22]<>0,RC[-22]&R4C32,"q") -> q | AS138: =IF(RC[-22]<>0,RC[-22]&R4C32,"q") -> q | AT138: =IF(RC[-22]<>0,RC[-22]&R4C32,"q") -> 0,1,7,183000;0,1,8,5500;0,1,4,13500;; | AU138: =IF(RC[-22]<>0,RC[-22]&R4C32,"q") -> q | AV138: =IF(RC[-22]<>0,RC[-22]&R4C32,"q") -> 0,1,7,183000;0,1,8,5500;0,1,4,13500;qqqqqqqqqqqqqq;
E139: 0,1,7,20000 | F139: 573000 | G139: =R2C5&RC[-1] -> 0,1,7,573000 | H139: 0,1,8,10000 | I139: 0,1,4,20000 | X139: 0,1,7,573000;0,1,8,10000;0,1,4,20000; | Z139: =RC[3]&RC[4]&RC[5]&RC[6]&RC[7]&RC[8]&RC[9]&RC[10]&RC[11]&RC[12]&RC[13]&RC[14]&RC[15]&RC[16]&RC[17]&RC[18]&RC[19] -> 0,1,7,573000;0,1,8,10000;0,1,4,20000;qqqqqqqqqqqqqq | AC139: =IF(RC[-22]<>0,RC[-22]&R4C32,"q") -> 0,1,7,573000; | AD139: =IF(RC[-22]<>0,RC[-22]&R4C32,"q") -> 0,1,8,10000; | AE139: =IF(RC[-22]<>0,RC[-22]&R4C32,"q") -> 0,1,4,20000; | AF139: =IF(RC[-22]<>0,RC[-22]&R4C32,"q") -> q | AG139: =IF(RC[-22]<>0,RC[-22]&R4C32,"q") -> q | AH139: =IF(RC[-22]<>0,RC[-22]&R4C32,"q") -> q | AI139: =IF(RC[-22]<>0,RC[-22]&R4C32,"q") -> q | AJ139: =IF(RC[-22]<>0,RC[-22]&R4C32,"q") -> q | AK139: =IF(RC[-22]<>0,RC[-22]&R4C32,"q") -> q | AL139: =IF(RC[-22]<>0,RC[-22]&R4C32,"q") -> q | AM139: =IF(RC[-22]<>0,RC[-22]&R4C32,"q") -> q | AN139: =IF(RC[-22]<>0,RC[-22]&R4C32,"q") -> q | AO139: =IF(RC[-22]<>0,RC[-22]&R4C32,"q") -> q | AP139: =IF(RC[-22]<>0,RC[-22]&R4C32,"q") -> q | AQ139: =IF(RC[-22]<>0,RC[-22]&R4C32,"q") -> q | AR139: =IF(RC[-22]<>0,RC[-22]&R4C32,"q") -> q | AS139: =IF(RC[-22]<>0,RC[-22]&R4C32,"q") -> q | AT139: =IF(RC[-22]<>0,RC[-22]&R4C32,"q") -> 0,1,7,573000;0,1,8,10000;0,1,4,20000;; | AU139: =IF(RC[-22]<>0,RC[-22]&R4C32,"q") -> q | AV139: =IF(RC[-22]<>0,RC[-22]&R4C32,"q") -> 0,1,7,573000;0,1,8,10000;0,1,4,20000;qqqqqqqqqqqqqq;
E140: 0,1,7,20000 | F140: 187000 | G140: =R2C5&RC[-1] -> 0,1,7,187000 | H140: 0,1,8,10000 | I140: 0,1,4,20000 | X140: 0,1,7,187000;0,1,8,10000;0,1,4,20000; | Z140: =RC[3]&RC[4]&RC[5]&RC[6]&RC[7]&RC[8]&RC[9]&RC[10]&RC[11]&RC[12]&RC[13]&RC[14]&RC[15]&RC[16]&RC[17]&RC[18]&RC[19] -> 0,1,7,187000;0,1,8,10000;0,1,4,20000;qqqqqqqqqqqqqq | AC140: =IF(RC[-22]<>0,RC[-22]&R4C32,"q") -> 0,1,7,187000; | AD140: =IF(RC[-22]<>0,RC[-22]&R4C32,"q") -> 0,1,8,10000; | AE140: =IF(RC[-22]<>0,RC[-22]&R4C32,"q") -> 0,1,4,20000; | AF140: =IF(RC[-22]<>0,RC[-22]&R4C32,"q") -> q | AG140: =IF(RC[-22]<>0,RC[-22]&R4C32,"q") -> q | AH140: =IF(RC[-22]<>0,RC[-22]&R4C32,"q") -> q | AI140: =IF(RC[-22]<>0,RC[-22]&R4C32,"q") -> q | AJ140: =IF(RC[-22]<>0,RC[-22]&R4C32,"q") -> q | AK140: =IF(RC[-22]<>0,RC[-22]&R4C32,"q") -> q | AL140: =IF(RC[-22]<>0,RC[-22]&R4C32,"q") -> q | AM140: =IF(RC[-22]<>0,RC[-22]&R4C32,"q") -> q | AN140: =IF(RC[-22]<>0,RC[-22]&R4C32,"q") -> q | AO140: =IF(RC[-22]<>0,RC[-22]&R4C32,"q") -> q | AP140: =IF(RC[-22]<>0,RC[-22]&R4C32,"q") -> q | AQ140: =IF(RC[-22]<>0,RC[-22]&R4C32,"q") -> q | AR140: =IF(RC[-22]<>0,RC[-22]&R4C32,"q") -> q | AS140: =IF(RC[-22]<>0,RC[-22]&R4C32,"q") -> q | AT140: =IF(RC[-22]<>0,RC[-22]&R4C32,"q") -> 0,1,7,187000;0,1,8,10000;0,1,4,20000;; | AU140: =IF(RC[-22]<>0,RC[-22]&R4C32,"q") -> q | AV140: =IF(RC[-22]<>0,RC[-22]&R4C32,"q") -> 0,1,7,187000;0,1,8,10000;0,1,4,20000;qqqqqqqqqqqqqq;
E141: 0,1,7,20000 | F141: 189000 | G141: =R2C5&RC[-1] -> 0,1,7,189000 | H141: 0,1,8,10000 | I141: 0,1,4,20000 | X141: 0,1,7,189000;0,1,8,10000;0,1,4,20000; | Z141: =RC[3]&RC[4]&RC[5]&RC[6]&RC[7]&RC[8]&RC[9]&RC[10]&RC[11]&RC[12]&RC[13]&RC[14]&RC[15]&RC[16]&RC[17]&RC[18]&RC[19] -> 0,1,7,189000;0,1,8,10000;0,1,4,20000;qqqqqqqqqqqqqq | AC141: =IF(RC[-22]<>0,RC[-22]&R4C32,"q") -> 0,1,7,189000; | AD141: =IF(RC[-22]<>0,RC[-22]&R4C32,"q") -> 0,1,8,10000; | AE141: =IF(RC[-22]<>0,RC[-22]&R4C32,"q") -> 0,1,4,20000; | AF141: =IF(RC[-22]<>0,RC[-22]&R4C32,"q") -> q | AG141: =IF(RC[-22]<>0,RC[-22]&R4C32,"q") -> q | AH141: =IF(RC[-22]<>0,RC[-22]&R4C32,"q") -> q | AI141: =IF(RC[-22]<>0,RC[-22]&R4C32,"q") -> q | AJ141: =IF(RC[-22]<>0,RC[-22]&R4C32,"q") -> q | AK141: =IF(RC[-22]<>0,RC[-22]&R4C32,"q") -> q | AL141: =IF(RC[-22]<>0,RC[-22]&R4C32,"q") -> q | AM141: =IF(RC[-22]<>0,RC[-22]&R4C32,"q") -> q | AN141: =IF(RC[-22]<>0,RC[-22]&R4C32,"q") -> q | AO141: =IF(RC[-22]<>0,RC[-22]&R4C32,"q") -> q | AP141: =IF(RC[-22]<>0,RC[-22]&R4C32,"q") -> q | AQ141: =IF(RC[-22]<>0,RC[-22]&R4C32,"q") -> q | AR141: =IF(RC[-22]<>0,RC[-22]&R4C32,"q") -> q | AS141: =IF(RC[-22]<>0,RC[-22]&R4C32,"q") -> q | AT141: =IF(RC[-22]<>0,RC[-22]&R4C32,"q") -> 0,1,7,189000;0,1,8,10000;0,1,4,20000;; | AU141: =IF(RC[-22]<>0,RC[-22]&R4C32,"q") -> q | AV141: =IF(RC[-22]<>0,RC[-22]&R4C32,"q") -> 0,1,7,189000;0,1,8,10000;0,1,4,20000;qqqqqqqqqqqqqq;
E142: 0,1,7,20000 | F142: 191000 | G142: =R2C5&RC[-1] -> 0,1,7,191000 | H142: 0,1,8,10000 | I142: 0,1,4,20000 | X142: 0,1,7,191000;0,1,8,10000;0,1,4,20000; | Z142: =RC[3]&RC[4]&RC[5]&RC[6]&RC[7]&RC[8]&RC[9]&RC[10]&RC[11]&RC[12]&RC[13]&RC[14]&RC[15]&RC[16]&RC[17]&RC[18]&RC[19] -> 0,1,7,191000;0,1,8,10000;0,1,4,20000;qqqqqqqqqqqqqq | AC142: =IF(RC[-22]<>0,RC[-22]&R4C32,"q") -> 0,1,7,191000; | AD142: =IF(RC[-22]<>0,RC[-22]&R4C32,"q") -> 0,1,8,10000; | AE142: =IF(RC[-22]<>0,RC[-22]&R4C32,"q") -> 0,1,4,20000; | AF142: =IF(RC[-22]<>0,RC[-22]&R4C32,"q") -> q | AG142: =IF(RC[-22]<>0,RC[-22]&R4C32,"q") -> q | AH142: =IF(RC[-22]<>0,RC[-22]&R4C32,"q") -> q | AI142: =IF(RC[-22]<>0,RC[-22]&R4C32,"q") -> q | AJ142: =IF(RC[-22]<>0,RC[-22]&R4C32,"q") -> q | AK142: =IF(RC[-22]<>0,RC[-22]&R4C32,"q") -> q | AL142: =IF(RC[-22]<>0,RC[-22]&R4C32,"q") -> q | AM142: =IF(RC[-22]<>0,RC[-22]&R4C32,"q") -> q | AN142: =IF(RC[-22]<>0,RC[-22]&R4C32,"q") -> q | AO142: =IF(RC[-22]<>0,RC[-22]&R4C32,"q") -> q | AP142: =IF(RC[-22]<>0,RC[-22]&R4C32,"q") -> q | AQ142: =IF(RC[-22]<>0,RC[-22]&R4C32,"q") -> q | AR142: =IF(RC[-22]<>0,RC[-22]&R4C32,"q") -> q | AS142: =IF(RC[-22]<>0,RC[-22]&R4C32,"q") -> q | AT142: =IF(RC[-22]<>0,RC[-22]&R4C32,"q") -> 0,1,7,191000;0,1,8,10000;0,1,4,20000;; | AU142: =IF(RC[-22]<>0,RC[-22]&R4C32,"q") -> q | AV142: =IF(RC[-22]<>0,RC[-22]&R4C32,"q") -> 0,1,7,191000;0,1,8,10000;0,1,4,20000;qqqqqqqqqqqqqq;
E143: 0,1,7,20000 | F143: 193000 | G143: =R2C5&RC[-1] -> 0,1,7,193000 | H143: 0,1,8,10000 | I143: 0,1,4,20000 | X143: 0,1,7,193000;0,1,8,10000;0,1,4,20000; | Z143: =RC[3]&RC[4]&RC[5]&RC[6]&RC[7]&RC[8]&RC[9]&RC[10]&RC[11]&RC[12]&RC[13]&RC[14]&RC[15]&RC[16]&RC[17]&RC[18]&RC[19] -> 0,1,7,193000;0,1,8,10000;0,1,4,20000;qqqqqqqqqqqqqq | AC143: =IF(RC[-22]<>0,RC[-22]&R4C32,"q") -> 0,1,7,193000; | AD143: =IF(RC[-22]<>0,RC[-22]&R4C32,"q") -> 0,1,8,10000; | AE143: =IF(RC[-22]<>0,RC[-22]&R4C32,"q") -> 0,1,4,20000; | AF143: =IF(RC[-22]<>0,RC[-22]&R4C32,"q") -> q | AG143: =IF(RC[-22]<>0,RC[-22]&R4C32,"q") -> q | AH143: =IF(RC[-22]<>0,RC[-22]&R4C32,"q") -> q | AI143: =IF(RC[-22]<>0,RC[-22]&R4C32,"q") -> q | AJ143: =IF(RC[-22]<>0,RC[-22]&R4C32,"q") -> q | AK143: =IF(RC[-22]<>0,RC[-22]&R4C32,"q") -> q | AL143: =IF(RC[-22]<>0,RC[-22]&R4C32,"q") -> q | AM143: =IF(RC[-22]<>0,RC[-22]&R4C32,"q") -> q | AN143: =IF(RC[-22]<>0,RC[-22]&R4C32,"q") -> q | AO143: =IF(RC[-22]<>0,RC[-22]&R4C32,"q") -> q | AP143: =IF(RC[-22]<>0,RC[-22]&R4C32,"q") -> q | AQ143: =IF(RC[-22]<>0,RC[-22]&R4C32,"q") -> q | AR143: =IF(RC[-22]<>0,RC[-22]&R4C32,"q") -> q | AS143: =IF(RC[-22]<>0,RC[-22]&R4C32,"q") -> q | AT143: =IF(RC[-22]<>0,RC[-22]&R4C32,"q") -> 0,1,7,193000;0,1,8,10000;0,1,4,20000;; | AU143: =IF(RC[-22]<>0,RC[-22]&R4C32,"q") -> q | AV143: =IF(RC[-22]<>0,RC[-22]&R4C32,"q") -> 0,1,7,193000;0,1,8,10000;0,1,4,20000;qqqqqqqqqqqqqq;
E144: 0,1,7,20000 | F144: 604000 | G144: =R2C5&RC[-1] -> 0,1,7,604000 | H144: 0,1,8,10000 | I144: 0,1,4,20000 | X144: 0,1,7,604000;0,1,8,10000;0,1,4,20000; | Z144: =RC[3]&RC[4]&RC[5]&RC[6]&RC[7]&RC[8]&RC[9]&RC[10]&RC[11]&RC[12]&RC[13]&RC[14]&RC[15]&RC[16]&RC[17]&RC[18]&RC[19] -> 0,1,7,604000;0,1,8,10000;0,1,4,20000;qqqqqqqqqqqqqq | AC144: =IF(RC[-22]<>0,RC[-22]&R4C32,"q") -> 0,1,7,604000; | AD144: =IF(RC[-22]<>0,RC[-22]&R4C32,"q") -> 0,1,8,10000; | AE144: =IF(RC[-22]<>0,RC[-22]&R4C32,"q") -> 0,1,4,20000; | AF144: =IF(RC[-22]<>0,RC[-22]&R4C32,"q") -> q | AG144: =IF(RC[-22]<>0,RC[-22]&R4C32,"q") -> q | AH144: =IF(RC[-22]<>0,RC[-22]&R4C32,"q") -> q | AI144: =IF(RC[-22]<>0,RC[-22]&R4C32,"q") -> q | AJ144: =IF(RC[-22]<>0,RC[-22]&R4C32,"q") -> q | AK144: =IF(RC[-22]<>0,RC[-22]&R4C32,"q") -> q | AL144: =IF(RC[-22]<>0,RC[-22]&R4C32,"q") -> q | AM144: =IF(RC[-22]<>0,RC[-22]&R4C32,"q") -> q | AN144: =IF(RC[-22]<>0,RC[-22]&R4C32,"q") -> q | AO144: =IF(RC[-22]<>0,RC[-22]&R4C32,"q") -> q | AP144: =IF(RC[-22]<>0,RC[-22]&R4C32,"q") -> q | AQ144: =IF(RC[-22]<>0,RC[-22]&R4C32,"q") -> q | AR144: =IF(RC[-22]<>0,RC[-22]&R4C32,"q") -> q | AS144: =IF(RC[-22]<>0,RC[-22]&R4C32,"q") -> q | AT144: =IF(RC[-22]<>0,RC[-22]&R4C32,"q") -> 0,1,7,604000;0,1,8,10000;0,1,4,20000;; | AU144: =IF(RC[-22]<>0,RC[-22]&R4C32,"q") -> q | AV144: =IF(RC[-22]<>0,RC[-22]&R4C32,"q") -> 0,1,7,604000;0,1,8,10000;0,1,4,20000;qqqqqqqqqqqqqq;
E145: 0,1,7,20000 | F145: 197000 | G145: =R2C5&RC[-1] -> 0,1,7,197000 | H145: 0,1,8,10000 | I145: 0,1,4,20000 | X145: 0,1,7,197000;0,1,8,10000;0,1,4,20000; | Z145: =RC[3]&RC[4]&RC[5]&RC[6]&RC[7]&RC[8]&RC[9]&RC[10]&RC[11]&RC[12]&RC[13]&RC[14]&RC[15]&RC[16]&RC[17]&RC[18]&RC[19] -> 0,1,7,197000;0,1,8,10000;0,1,4,20000;qqqqqqqqqqqqqq | AC145: =IF(RC[-22]<>0,RC[-22]&R4C32,"q") -> 0,1,7,197000; | AD145: =IF(RC[-22]<>0,RC[-22]&R4C32,"q") -> 0,1,8,10000; | AE145: =IF(RC[-22]<>0,RC[-22]&R4C32,"q") -> 0,1,4,20000; | AF145: =IF(RC[-22]<>0,RC[-22]&R4C32,"q") -> q | AG145: =IF(RC[-22]<>0,RC[-22]&R4C32,"q") -> q | AH145: =IF(RC[-22]<>0,RC[-22]&R4C32,"q") -> q | AI145: =IF(RC[-22]<>0,RC[-22]&R4C32,"q") -> q | AJ145: =IF(RC[-22]<>0,RC[-22]&R4C32,"q") -> q | AK145: =IF(RC[-22]<>0,RC[-22]&R4C32,"q") -> q | AL145: =IF(RC[-22]<>0,RC[-22]&R4C32,"q") -> q | AM145: =IF(RC[-22]<>0,RC[-22]&R4C32,"q") -> q | AN145: =IF(RC[-22]<>0,RC[-22]&R4C32,"q") -> q | AO145: =IF(RC[-22]<>0,RC[-22]&R4C32,"q") -> q | AP145: =IF(RC[-22]<>0,RC[-22]&R4C32,"q") -> q | AQ145: =IF(RC[-22]<>0,RC[-22]&R4C32,"q") -> q | AR145: =IF(RC[-22]<>0,RC[-22]&R4C32,"q") -> q | AS145: =IF(RC[-22]<>0,RC[-22]&R4C32,"q") -> q | AT145: =IF(RC[-22]<>0,RC[-22]&R4C32,"q") -> 0,1,7,197000;0,1,8,10000;0,1,4,20000;; | AU145: =IF(RC[-22]<>0,RC[-22]&R4C32,"q") -> q | AV145: =IF(RC[-22]<>0,RC[-22]&R4C32,"q") -> 0,1,7,197000;0,1,8,10000;0,1,4,20000;qqqqqqqqqqqqqq;
E146: 0,1,7,1550000 | F146: 199000 | G146: =R2C5&RC[-1] -> 0,1,7,199000 | H146: 0,1,8,750000 | I146: 0,1,4,2700000 | X146: 0,1,7,199000;0,1,8,750000;0,1,4,2700000; | Z146: =RC[3]&RC[4]&RC[5]&RC[6]&RC[7]&RC[8]&RC[9]&RC[10]&RC[11]&RC[12]&RC[13]&RC[14]&RC[15]&RC[16]&RC[17]&RC[18]&RC[19] -> 0,1,7,199000;0,1,8,750000;0,1,4,2700000;qqqqqqqqqqqqqq | AC146: =IF(RC[-22]<>0,RC[-22]&R4C32,"q") -> 0,1,7,199000; | AD146: =IF(RC[-22]<>0,RC[-22]&R4C32,"q") -> 0,1,8,750000; | AE146: =IF(RC[-22]<>0,RC[-22]&R4C32,"q") -> 0,1,4,2700000; | AF146: =IF(RC[-22]<>0,RC[-22]&R4C32,"q") -> q | AG146: =IF(RC[-22]<>0,RC[-22]&R4C32,"q") -> q | AH146: =IF(RC[-22]<>0,RC[-22]&R4C32,"q") -> q | AI146: =IF(RC[-22]<>0,RC[-22]&R4C32,"q") -> q | AJ146: =IF(RC[-22]<>0,RC[-22]&R4C32,"q") -> q | AK146: =IF(RC[-22]<>0,RC[-22]&R4C32,"q") -> q | AL146: =IF(RC[-22]<>0,RC[-22]&R4C32,"q") -> q | AM146: =IF(RC[-22]<>0,RC[-22]&R4C32,"q") -> q | AN146: =IF(RC[-22]<>0,RC[-22]&R4C32,"q") -> q | AO146: =IF(RC[-22]<>0,RC[-22]&R4C32,"q") -> q | AP146: =IF(RC[-22]<>0,RC[-22]&R4C32,"q") -> q | AQ146: =IF(RC[-22]<>0,RC[-22]&R4C32,"q") -> q | AR146: =IF(RC[-22]<>0,RC[-22]&R4C32,"q") -> q | AS146: =IF(RC[-22]<>0,RC[-22]&R4C32,"q") -> q | AT146: =IF(RC[-22]<>0,RC[-22]&R4C32,"q") -> 0,1,7,199000;0,1,8,750000;0,1,4,2700000;; | AU146: =IF(RC[-22]<>0,RC[-22]&R4C32,"q") -> q | AV146: =IF(RC[-22]<>0,RC[-22]&R4C32,"q") -> 0,1,7,199000;0,1,8,750000;0,1,4,2700000;qqqqqqqqqqqqqq;
E147: 0,1,7,20000 | F147: 201000 | G147: =R2C5&RC[-1] -> 0,1,7,201000 | H147: 0,1,8,10000 | I147: 0,1,4,20000 | X147: 0,1,7,201000;0,1,8,10000;0,1,4,20000; | Z147: =RC[3]&RC[4]&RC[5]&RC[6]&RC[7]&RC[8]&RC[9]&RC[10]&RC[11]&RC[12]&RC[13]&RC[14]&RC[15]&RC[16]&RC[17]&RC[18]&RC[19] -> 0,1,7,201000;0,1,8,10000;0,1,4,20000;qqqqqqqqqqqqqq | AC147: =IF(RC[-22]<>0,RC[-22]&R4C32,"q") -> 0,1,7,201000; | AD147: =IF(RC[-22]<>0,RC[-22]&R4C32,"q") -> 0,1,8,10000; | AE147: =IF(RC[-22]<>0,RC[-22]&R4C32,"q") -> 0,1,4,20000; | AF147: =IF(RC[-22]<>0,RC[-22]&R4C32,"q") -> q | AG147: =IF(RC[-22]<>0,RC[-22]&R4C32,"q") -> q | AH147: =IF(RC[-22]<>0,RC[-22]&R4C32,"q") -> q | AI147: =IF(RC[-22]<>0,RC[-22]&R4C32,"q") -> q | AJ147: =IF(RC[-22]<>0,RC[-22]&R4C32,"q") -> q | AK147: =IF(RC[-22]<>0,RC[-22]&R4C32,"q") -> q | AL147: =IF(RC[-22]<>0,RC[-22]&R4C32,"q") -> q | AM147: =IF(RC[-22]<>0,RC[-22]&R4C32,"q") -> q | AN147: =IF(RC[-22]<>0,RC[-22]&R4C32,"q") -> q | AO147: =IF(RC[-22]<>0,RC[-22]&R4C32,"q") -> q | AP147: =IF(RC[-22]<>0,RC[-22]&R4C32,"q") -> q | AQ147: =IF(RC[-22]<>0,RC[-22]&R4C32,"q") -> q | AR147: =IF(RC[-22]<>0,RC[-22]&R4C32,"q") -> q | AS147: =IF(RC[-22]<>0,RC[-22]&R4C32,"q") -> q | AT147: =IF(RC[-22]<>0,RC[-22]&R4C32,"q") -> 0,1,7,201000;0,1,8,10000;0,1,4,20000;; | AU147: =IF(RC[-22]<>0,RC[-22]&R4C32,"q") -> q | AV147: =IF(RC[-22]<>0,RC[-22]&R4C32,"q") -> 0,1,7,201000;0,1,8,10000;0,1,4,20000;qqqqqqqqqqqqqq;
E148: 0,1,7,20000 | F148: 203000 | G148: =R2C5&RC[-1] -> 0,1,7,203000 | H148: 0,1,8,10000 | I148: 0,1,4,20000 | X148: 0,1,7,203000;0,1,8,10000;0,1,4,20000; | Z148: =RC[3]&RC[4]&RC[5]&RC[6]&RC[7]&RC[8]&RC[9]&RC[10]&RC[11]&RC[12]&RC[13]&RC[14]&RC[15]&RC[16]&RC[17]&RC[18]&RC[19] -> 0,1,7,203000;0,1,8,10000;0,1,4,20000;qqqqqqqqqqqqqq | AC148: =IF(RC[-22]<>0,RC[-22]&R4C32,"q") -> 0,1,7,203000; | AD148: =IF(RC[-22]<>0,RC[-22]&R4C32,"q") -> 0,1,8,10000; | AE148: =IF(RC[-22]<>0,RC[-22]&R4C32,"q") -> 0,1,4,20000; | AF148: =IF(RC[-22]<>0,RC[-22]&R4C32,"q") -> q | AG148: =IF(RC[-22]<>0,RC[-22]&R4C32,"q") -> q | AH148: =IF(RC[-22]<>0,RC[-22]&R4C32,"q") -> q | AI148: =IF(RC[-22]<>0,RC[-22]&R4C32,"q") -> q | AJ148: =IF(RC[-22]<>0,RC[-22]&R4C32,"q") -> q | AK148: =IF(RC[-22]<>0,RC[-22]&R4C32,"q") -> q | AL148: =IF(RC[-22]<>0,RC[-22]&R4C32,"q") -> q | AM148: =IF(RC[-22]<>0,RC[-22]&R4C32,"q") -> q | AN148: =IF(RC[-22]<>0,RC[-22]&R4C32,"q") -> q | AO148: =IF(RC[-22]<>0,RC[-22]&R4C32,"q") -> q | AP148: =IF(RC[-22]<>0,RC[-22]&R4C32,"q") -> q | AQ148: =IF(RC[-22]<>0,RC[-22]&R4C32,"q") -> q | AR148: =IF(RC[-22]<>0,RC[-22]&R4C32,"q") -> q | AS148: =IF(RC[-22]<>0,RC[-22]&R4C32,"q") -> q | AT148: =IF(RC[-22]<>0,RC[-22]&R4C32,"q") -> 0,1,7,203000;0,1,8,10000;0,1,4,20000;; | AU148: =IF(RC[-22]<>0,RC[-22]&R4C32,"q") -> q | AV148: =IF(RC[-22]<>0,RC[-22]&R4C32,"q") -> 0,1,7,203000;0,1,8,10000;0,1,4,20000;qqqqqqqqqqqqqq;
E149: 0,1,7,1550000 | F149: 636000 | G149: =R2C5&RC[-1] -> 0,1,7,636000 | H149: 0,1,8,750000 | I149: 0,1,4,2700000 | X149: 0,1,7,636000;0,1,8,750000;0,1,4,2700000; | Z149: =RC[3]&RC[4]&RC[5]&RC[6]&RC[7]&RC[8]&RC[9]&RC[10]&RC[11]&RC[12]&RC[13]&RC[14]&RC[15]&RC[16]&RC[17]&RC[18]&RC[19] -> 0,1,7,636000;0,1,8,750000;0,1,4,2700000;qqqqqqqqqqqqqq | AC149: =IF(RC[-22]<>0,RC[-22]&R4C32,"q") -> 0,1,7,636000; | AD149: =IF(RC[-22]<>0,RC[-22]&R4C32,"q") -> 0,1,8,750000; | AE149: =IF(RC[-22]<>0,RC[-22]&R4C32,"q") -> 0,1,4,2700000; | AF149: =IF(RC[-22]<>0,RC[-22]&R4C32,"q") -> q | AG149: =IF(RC[-22]<>0,RC[-22]&R4C32,"q") -> q | AH149: =IF(RC[-22]<>0,RC[-22]&R4C32,"q") -> q | AI149: =IF(RC[-22]<>0,RC[-22]&R4C32,"q") -> q | AJ149: =IF(RC[-22]<>0,RC[-22]&R4C32,"q") -> q | AK149: =IF(RC[-22]<>0,RC[-22]&R4C32,"q") -> q | AL149: =IF(RC[-22]<>0,RC[-22]&R4C32,"q") -> q | AM149: =IF(RC[-22]<>0,RC[-22]&R4C32,"q") -> q | AN149: =IF(RC[-22]<>0,RC[-22]&R4C32,"q") -> q | AO149: =IF(RC[-22]<>0,RC[-22]&R4C32,"q") -> q | AP149: =IF(RC[-22]<>0,RC[-22]&R4C32,"q") -> q | AQ149: =IF(RC[-22]<>0,RC[-22]&R4C32,"q") -> q | AR149: =IF(RC[-22]<>0,RC[-22]&R4C32,"q") -> q | AS149: =IF(RC[-22]<>0,RC[-22]&R4C32,"q") -> q | AT149: =IF(RC[-22]<>0,RC[-22]&R4C32,"q") -> 0,1,7,636000;0,1,8,750000;0,1,4,2700000;; | AU149: =IF(RC[-22]<>0,RC[-22]&R4C32,"q") -> q | AV149: =IF(RC[-22]<>0,RC[-22]&R4C32,"q") -> 0,1,7,636000;0,1,8,750000;0,1,4,2700000;qqqqqqqqqqqqqq;
E150: 0,1,7,20000 | F150: 207000 | G150: =R2C5&RC[-1] -> 0,1,7,207000 | H150: 0,1,8,10000 | I150: 0,1,4,20000 | X150: 0,1,7,207000;0,1,8,10000;0,1,4,20000; | Z150: =RC[3]&RC[4]&RC[5]&RC[6]&RC[7]&RC[8]&RC[9]&RC[10]&RC[11]&RC[12]&RC[13]&RC[14]&RC[15]&RC[16]&RC[17]&RC[18]&RC[19] -> 0,1,7,207000;0,1,8,10000;0,1,4,20000;qqqqqqqqqqqqqq | AC150: =IF(RC[-22]<>0,RC[-22]&R4C32,"q") -> 0,1,7,207000; | AD150: =IF(RC[-22]<>0,RC[-22]&R4C32,"q") -> 0,1,8,10000; | AE150: =IF(RC[-22]<>0,RC[-22]&R4C32,"q") -> 0,1,4,20000; | AF150: =IF(RC[-22]<>0,RC[-22]&R4C32,"q") -> q | AG150: =IF(RC[-22]<>0,RC[-22]&R4C32,"q") -> q | AH150: =IF(RC[-22]<>0,RC[-22]&R4C32,"q") -> q | AI150: =IF(RC[-22]<>0,RC[-22]&R4C32,"q") -> q | AJ150: =IF(RC[-22]<>0,RC[-22]&R4C32,"q") -> q | AK150: =IF(RC[-22]<>0,RC[-22]&R4C32,"q") -> q | AL150: =IF(RC[-22]<>0,RC[-22]&R4C32,"q") -> q | AM150: =IF(RC[-22]<>0,RC[-22]&R4C32,"q") -> q | AN150: =IF(RC[-22]<>0,RC[-22]&R4C32,"q") -> q | AO150: =IF(RC[-22]<>0,RC[-22]&R4C32,"q") -> q | AP150: =IF(RC[-22]<>0,RC[-22]&R4C32,"q") -> q | AQ150: =IF(RC[-22]<>0,RC[-22]&R4C32,"q") -> q | AR150: =IF(RC[-22]<>0,RC[-22]&R4C32,"q") -> q | AS150: =IF(RC[-22]<>0,RC[-22]&R4C32,"q") -> q | AT150: =IF(RC[-22]<>0,RC[-22]&R4C32,"q") -> 0,1,7,207000;0,1,8,10000;0,1,4,20000;; | AU150: =IF(RC[-22]<>0,RC[-22]&R4C32,"q") -> q | AV150: =IF(RC[-22]<>0,RC[-22]&R4C32,"q") -> 0,1,7,207000;0,1,8,10000;0,1,4,20000;qqqqqqqqqqqqqq;
E151: 0,1,7,30000 | F151: 209000 | G151: =R2C5&RC[-1] -> 0,1,7,209000 | H151: 0,1,8,15000 | I151: 0,1,4,30000 | X151: 0,1,7,209000;0,1,8,15000;0,1,4,30000; | Z151: =RC[3]&RC[4]&RC[5]&RC[6]&RC[7]&RC[8]&RC[9]&RC[10]&RC[11]&RC[12]&RC[13]&RC[14]&RC[15]&RC[16]&RC[17]&RC[18]&RC[19] -> 0,1,7,209000;0,1,8,15000;0,1,4,30000;qqqqqqqqqqqqqq | AC151: =IF(RC[-22]<>0,RC[-22]&R4C32,"q") -> 0,1,7,209000; | AD151: =IF(RC[-22]<>0,RC[-22]&R4C32,"q") -> 0,1,8,15000; | AE151: =IF(RC[-22]<>0,RC[-22]&R4C32,"q") -> 0,1,4,30000; | AF151: =IF(RC[-22]<>0,RC[-22]&R4C32,"q") -> q | AG151: =IF(RC[-22]<>0,RC[-22]&R4C32,"q") -> q | AH151: =IF(RC[-22]<>0,RC[-22]&R4C32,"q") -> q | AI151: =IF(RC[-22]<>0,RC[-22]&R4C32,"q") -> q | AJ151: =IF(RC[-22]<>0,RC[-22]&R4C32,"q") -> q | AK151: =IF(RC[-22]<>0,RC[-22]&R4C32,"q") -> q | AL151: =IF(RC[-22]<>0,RC[-22]&R4C32,"q") -> q | AM151: =IF(RC[-22]<>0,RC[-22]&R4C32,"q") -> q | AN151: =IF(RC[-22]<>0,RC[-22]&R4C32,"q") -> q | AO151: =IF(RC[-22]<>0,RC[-22]&R4C32,"q") -> q | AP151: =IF(RC[-22]<>0,RC[-22]&R4C32,"q") -> q | AQ151: =IF(RC[-22]<>0,RC[-22]&R4C32,"q") -> q | AR151: =IF(RC[-22]<>0,RC[-22]&R4C32,"q") -> q | AS151: =IF(RC[-22]<>0,RC[-22]&R4C32,"q") -> q | AT151: =IF(RC[-22]<>0,RC[-22]&R4C32,"q") -> 0,1,7,209000;0,1,8,15000;0,1,4,30000;; | AU151: =IF(RC[-22]<>0,RC[-22]&R4C32,"q") -> q | AV151: =IF(RC[-22]<>0,RC[-22]&R4C32,"q") -> 0,1,7,209000;0,1,8,15000;0,1,4,30000;qqqqqqqqqqqqqq;
E152: 0,1,7,30000 | F152: 211000 | G152: =R2C5&RC[-1] -> 0,1,7,211000 | H152: 0,1,8,15000 | I152: 0,1,4,30000 | X152: 0,1,7,211000;0,1,8,15000;0,1,4,30000; | Z152: =RC[3]&RC[4]&RC[5]&RC[6]&RC[7]&RC[8]&RC[9]&RC[10]&RC[11]&RC[12]&RC[13]&RC[14]&RC[15]&RC[16]&RC[17]&RC[18]&RC[19] -> 0,1,7,211000;0,1,8,15000;0,1,4,30000;qqqqqqqqqqqqqq | AC152: =IF(RC[-22]<>0,RC[-22]&R4C32,"q") -> 0,1,7,211000; | AD152: =IF(RC[-22]<>0,RC[-22]&R4C32,"q") -> 0,1,8,15000; | AE152: =IF(RC[-22]<>0,RC[-22]&R4C32,"q") -> 0,1,4,30000; | AF152: =IF(RC[-22]<>0,RC[-22]&R4C32,"q") -> q | AG152: =IF(RC[-22]<>0,RC[-22]&R4C32,"q") -> q | AH152: =IF(RC[-22]<>0,RC[-22]&R4C32,"q") -> q | AI152: =IF(RC[-22]<>0,RC[-22]&R4C32,"q") -> q | AJ152: =IF(RC[-22]<>0,RC[-22]&R4C32,"q") -> q | AK152: =IF(RC[-22]<>0,RC[-22]&R4C32,"q") -> q | AL152: =IF(RC[-22]<>0,RC[-22]&R4C32,"q") -> q | AM152: =IF(RC[-22]<>0,RC[-22]&R4C32,"q") -> q | AN152: =IF(RC[-22]<>0,RC[-22]&R4C32,"q") -> q | AO152: =IF(RC[-22]<>0,RC[-22]&R4C32,"q") -> q | AP152: =IF(RC[-22]<>0,RC[-22]&R4C32,"q") -> q | AQ152: =IF(RC[-22]<>0,RC[-22]&R4C32,"q") -> q | AR152: =IF(RC[-22]<>0,RC[-22]&R4C32,"q") -> q | AS152: =IF(RC[-22]<>0,RC[-22]&R4C32,"q") -> q | AT152: =IF(RC[-22]<>0,RC[-22]&R4C32,"q") -> 0,1,7,211000;0,1,8,15000;0,1,4,30000;; | AU152: =IF(RC[-22]<>0,RC[-22]&R4C32,"q") -> q | AV152: =IF(RC[-22]<>0,RC[-22]&R4C32,"q") -> 0,1,7,211000;0,1,8,15000;0,1,4,30000;qqqqqqqqqqqqqq;
E153: 0,1,7,1600000 | F153: 213000 | G153: =R2C5&RC[-1] -> 0,1,7,213000 | H153: 0,1,8,800000 | I153: 0,1,4,2750000 | X153: 0,1,7,213000;0,1,8,800000;0,1,4,2750000; | Z153: =RC[3]&RC[4]&RC[5]&RC[6]&RC[7]&RC[8]&RC[9]&RC[10]&RC[11]&RC[12]&RC[13]&RC[14]&RC[15]&RC[16]&RC[17]&RC[18]&RC[19] -> 0,1,7,213000;0,1,8,800000;0,1,4,2750000;qqqqqqqqqqqqqq | AC153: =IF(RC[-22]<>0,RC[-22]&R4C32,"q") -> 0,1,7,213000; | AD153: =IF(RC[-22]<>0,RC[-22]&R4C32,"q") -> 0,1,8,800000; | AE153: =IF(RC[-22]<>0,RC[-22]&R4C32,"q") -> 0,1,4,2750000; | AF153: =IF(RC[-22]<>0,RC[-22]&R4C32,"q") -> q | AG153: =IF(RC[-22]<>0,RC[-22]&R4C32,"q") -> q | AH153: =IF(RC[-22]<>0,RC[-22]&R4C32,"q") -> q | AI153: =IF(RC[-22]<>0,RC[-22]&R4C32,"q") -> q | AJ153: =IF(RC[-22]<>0,RC[-22]&R4C32,"q") -> q | AK153: =IF(RC[-22]<>0,RC[-22]&R4C32,"q") -> q | AL153: =IF(RC[-22]<>0,RC[-22]&R4C32,"q") -> q | AM153: =IF(RC[-22]<>0,RC[-22]&R4C32,"q") -> q | AN153: =IF(RC[-22]<>0,RC[-22]&R4C32,"q") -> q | AO153: =IF(RC[-22]<>0,RC[-22]&R4C32,"q") -> q | AP153: =IF(RC[-22]<>0,RC[-22]&R4C32,"q") -> q | AQ153: =IF(RC[-22]<>0,RC[-22]&R4C32,"q") -> q | AR153: =IF(RC[-22]<>0,RC[-22]&R4C32,"q") -> q | AS153: =IF(RC[-22]<>0,RC[-22]&R4C32,"q") -> q | AT153: =IF(RC[-22]<>0,RC[-22]&R4C32,"q") -> 0,1,7,213000;0,1,8,800000;0,1,4,2750000;; | AU153: =IF(RC[-22]<>0,RC[-22]&R4C32,"q") -> q | AV153: =IF(RC[-22]<>0,RC[-22]&R4C32,"q") -> 0,1,7,213000;0,1,8,800000;0,1,4,2750000;qqqqqqqqqqqqqq;
E154: 0,1,7,30000 | F154: 667000 | G154: =R2C5&RC[-1] -> 0,1,7,667000 | H154: 0,1,8,15000 | I154: 0,1,4,30000 | X154: 0,1,7,667000;0,1,8,15000;0,1,4,30000; | Z154: =RC[3]&RC[4]&RC[5]&RC[6]&RC[7]&RC[8]&RC[9]&RC[10]&RC[11]&RC[12]&RC[13]&RC[14]&RC[15]&RC[16]&RC[17]&RC[18]&RC[19] -> 0,1,7,667000;0,1,8,15000;0,1,4,30000;qqqqqqqqqqqqqq | AC154: =IF(RC[-22]<>0,RC[-22]&R4C32,"q") -> 0,1,7,667000; | AD154: =IF(RC[-22]<>0,RC[-22]&R4C32,"q") -> 0,1,8,15000; | AE154: =IF(RC[-22]<>0,RC[-22]&R4C32,"q") -> 0,1,4,30000; | AF154: =IF(RC[-22]<>0,RC[-22]&R4C32,"q") -> q | AG154: =IF(RC[-22]<>0,RC[-22]&R4C32,"q") -> q | AH154: =IF(RC[-22]<>0,RC[-22]&R4C32,"q") -> q | AI154: =IF(RC[-22]<>0,RC[-22]&R4C32,"q") -> q | AJ154: =IF(RC[-22]<>0,RC[-22]&R4C32,"q") -> q | AK154: =IF(RC[-22]<>0,RC[-22]&R4C32,"q") -> q | AL154: =IF(RC[-22]<>0,RC[-22]&R4C32,"q") -> q | AM154: =IF(RC[-22]<>0,RC[-22]&R4C32,"q") -> q | AN154: =IF(RC[-22]<>0,RC[-22]&R4C32,"q") -> q | AO154: =IF(RC[-22]<>0,RC[-22]&R4C32,"q") -> q | AP154: =IF(RC[-22]<>0,RC[-22]&R4C32,"q") -> q | AQ154: =IF(RC[-22]<>0,RC[-22]&R4C32,"q") -> q | AR154: =IF(RC[-22]<>0,RC[-22]&R4C32,"q") -> q | AS154: =IF(RC[-22]<>0,RC[-22]&R4C32,"q") -> q | AT154: =IF(RC[-22]<>0,RC[-22]&R4C32,"q") -> 0,1,7,667000;0,1,8,15000;0,1,4,30000;; | AU154: =IF(RC[-22]<>0,RC[-22]&R4C32,"q") -> q | AV154: =IF(RC[-22]<>0,RC[-22]&R4C32,"q") -> 0,1,7,667000;0,1,8,15000;0,1,4,30000;qqqqqqqqqqqqqq;
E155: 0,1,7,30000 | F155: 217000 | G155: =R2C5&RC[-1] -> 0,1,7,217000 | H155: 0,1,8,15000 | I155: 0,1,4,30000 | X155: 0,1,7,217000;0,1,8,15000;0,1,4,30000; | Z155: =RC[3]&RC[4]&RC[5]&RC[6]&RC[7]&RC[8]&RC[9]&RC[10]&RC[11]&RC[12]&RC[13]&RC[14]&RC[15]&RC[16]&RC[17]&RC[18]&RC[19] -> 0,1,7,217000;0,1,8,15000;0,1,4,30000;qqqqqqqqqqqqqq | AC155: =IF(RC[-22]<>0,RC[-22]&R4C32,"q") -> 0,1,7,217000; | AD155: =IF(RC[-22]<>0,RC[-22]&R4C32,"q") -> 0,1,8,15000; | AE155: =IF(RC[-22]<>0,RC[-22]&R4C32,"q") -> 0,1,4,30000; | AF155: =IF(RC[-22]<>0,RC[-22]&R4C32,"q") -> q | AG155: =IF(RC[-22]<>0,RC[-22]&R4C32,"q") -> q | AH155: =IF(RC[-22]<>0,RC[-22]&R4C32,"q") -> q | AI155: =IF(RC[-22]<>0,RC[-22]&R4C32,"q") -> q | AJ155: =IF(RC[-22]<>0,RC[-22]&R4C32,"q") -> q | AK155: =IF(RC[-22]<>0,RC[-22]&R4C32,"q") -> q | AL155: =IF(RC[-22]<>0,RC[-22]&R4C32,"q") -> q | AM155: =IF(RC[-22]<>0,RC[-22]&R4C32,"q") -> q | AN155: =IF(RC[-22]<>0,RC[-22]&R4C32,"q") -> q | AO155: =IF(RC[-22]<>0,RC[-22]&R4C32,"q") -> q | AP155: =IF(RC[-22]<>0,RC[-22]&R4C32,"q") -> q | AQ155: =IF(RC[-22]<>0,RC[-22]&R4C32,"q") -> q | AR155: =IF(RC[-22]<>0,RC[-22]&R4C32,"q") -> q | AS155: =IF(RC[-22]<>0,RC[-22]&R4C32,"q") -> q | AT155: =IF(RC[-22]<>0,RC[-22]&R4C32,"q") -> 0,1,7,217000;0,1,8,15000;0,1,4,30000;; | AU155: =IF(RC[-22]<>0,RC[-22]&R4C32,"q") -> q | AV155: =IF(RC[-22]<>0,RC[-22]&R4C32,"q") -> 0,1,7,217000;0,1,8,15000;0,1,4,30000;qqqqqqqqqqqqqq;
E156: 0,1,7,1650000 | F156: 219000 | G156: =R2C5&RC[-1] -> 0,1,7,219000 | H156: 0,1,8,850000 | I156: 0,1,4,2800000 | X156: 0,1,7,219000;0,1,8,850000;0,1,4,2800000; | Z156: =RC[3]&RC[4]&RC[5]&RC[6]&RC[7]&RC[8]&RC[9]&RC[10]&RC[11]&RC[12]&RC[13]&RC[14]&RC[15]&RC[16]&RC[17]&RC[18]&RC[19] -> 0,1,7,219000;0,1,8,850000;0,1,4,2800000;qqqqqqqqqqqqqq | AC156: =IF(RC[-22]<>0,RC[-22]&R4C32,"q") -> 0,1,7,219000; | AD156: =IF(RC[-22]<>0,RC[-22]&R4C32,"q") -> 0,1,8,850000; | AE156: =IF(RC[-22]<>0,RC[-22]&R4C32,"q") -> 0,1,4,2800000; | AF156: =IF(RC[-22]<>0,RC[-22]&R4C32,"q") -> q | AG156: =IF(RC[-22]<>0,RC[-22]&R4C32,"q") -> q | AH156: =IF(RC[-22]<>0,RC[-22]&R4C32,"q") -> q | AI156: =IF(RC[-22]<>0,RC[-22]&R4C32,"q") -> q | AJ156: =IF(RC[-22]<>0,RC[-22]&R4C32,"q") -> q | AK156: =IF(RC[-22]<>0,RC[-22]&R4C32,"q") -> q | AL156: =IF(RC[-22]<>0,RC[-22]&R4C32,"q") -> q | AM156: =IF(RC[-22]<>0,RC[-22]&R4C32,"q") -> q | AN156: =IF(RC[-22]<>0,RC[-22]&R4C32,"q") -> q | AO156: =IF(RC[-22]<>0,RC[-22]&R4C32,"q") -> q | AP156: =IF(RC[-22]<>0,RC[-22]&R4C32,"q") -> q | AQ156: =IF(RC[-22]<>0,RC[-22]&R4C32,"q") -> q | AR156: =IF(RC[-22]<>0,RC[-22]&R4C32,"q") -> q | AS156: =IF(RC[-22]<>0,RC[-22]&R4C32,"q") -> q | AT156: =IF(RC[-22]<>0,RC[-22]&R4C32,"q") -> 0,1,7,219000;0,1,8,850000;0,1,4,2800000;; | AU156: =IF(RC[-22]<>0,RC[-22]&R4C32,"q") -> q | AV156: =IF(RC[-22]<>0,RC[-22]&R4C32,"q") -> 0,1,7,219000;0,1,8,850000;0,1,4,2800000;qqqqqqqqqqqqqq;
E157: 0,1,7,30000 | F157: 221000 | G157: =R2C5&RC[-1] -> 0,1,7,221000 | H157: 0,1,8,15000 | I157: 0,1,4,30000 | X157: 0,1,7,221000;0,1,8,15000;0,1,4,30000; | Z157: =RC[3]&RC[4]&RC[5]&RC[6]&RC[7]&RC[8]&RC[9]&RC[10]&RC[11]&RC[12]&RC[13]&RC[14]&RC[15]&RC[16]&RC[17]&RC[18]&RC[19] -> 0,1,7,221000;0,1,8,15000;0,1,4,30000;qqqqqqqqqqqqqq | AC157: =IF(RC[-22]<>0,RC[-22]&R4C32,"q") -> 0,1,7,221000; | AD157: =IF(RC[-22]<>0,RC[-22]&R4C32,"q") -> 0,1,8,15000; | AE157: =IF(RC[-22]<>0,RC[-22]&R4C32,"q") -> 0,1,4,30000; | AF157: =IF(RC[-22]<>0,RC[-22]&R4C32,"q") -> q | AG157: =IF(RC[-22]<>0,RC[-22]&R4C32,"q") -> q | AH157: =IF(RC[-22]<>0,RC[-22]&R4C32,"q") -> q | AI157: =IF(RC[-22]<>0,RC[-22]&R4C32,"q") -> q | AJ157: =IF(RC[-22]<>0,RC[-22]&R4C32,"q") -> q | AK157: =IF(RC[-22]<>0,RC[-22]&R4C32,"q") -> q | AL157: =IF(RC[-22]<>0,RC[-22]&R4C32,"q") -> q | AM157: =IF(RC[-22]<>0,RC[-22]&R4C32,"q") -> q | AN157: =IF(RC[-22]<>0,RC[-22]&R4C32,"q") -> q | AO157: =IF(RC[-22]<>0,RC[-22]&R4C32,"q") -> q | AP157: =IF(RC[-22]<>0,RC[-22]&R4C32,"q") -> q | AQ157: =IF(RC[-22]<>0,RC[-22]&R4C32,"q") -> q | AR157: =IF(RC[-22]<>0,RC[-22]&R4C32,"q") -> q | AS157: =IF(RC[-22]<>0,RC[-22]&R4C32,"q") -> q | AT157: =IF(RC[-22]<>0,RC[-22]&R4C32,"q") -> 0,1,7,221000;0,1,8,15000;0,1,4,30000;; | AU157: =IF(RC[-22]<>0,RC[-22]&R4C32,"q") -> q | AV157: =IF(RC[-22]<>0,RC[-22]&R4C32,"q") -> 0,1,7,221000;0,1,8,15000;0,1,4,30000;qqqqqqqqqqqqqq;
E158: 0,1,7,1700000 | F158: 223000 | G158: =R2C5&RC[-1] -> 0,1,7,223000 | H158: 0,1,8,900000 | I158: 0,1,4,2850000 | X158: 0,1,7,223000;0,1,8,900000;0,1,4,2850000; | Z158: =RC[3]&RC[4]&RC[5]&RC[6]&RC[7]&RC[8]&RC[9]&RC[10]&RC[11]&RC[12]&RC[13]&RC[14]&RC[15]&RC[16]&RC[17]&RC[18]&RC[19] -> 0,1,7,223000;0,1,8,900000;0,1,4,2850000;qqqqqqqqqqqqqq | AC158: =IF(RC[-22]<>0,RC[-22]&R4C32,"q") -> 0,1,7,223000; | AD158: =IF(RC[-22]<>0,RC[-22]&R4C32,"q") -> 0,1,8,900000; | AE158: =IF(RC[-22]<>0,RC[-22]&R4C32,"q") -> 0,1,4,2850000; | AF158: =IF(RC[-22]<>0,RC[-22]&R4C32,"q") -> q | AG158: =IF(RC[-22]<>0,RC[-22]&R4C32,"q") -> q | AH158: =IF(RC[-22]<>0,RC[-22]&R4C32,"q") -> q | AI158: =IF(RC[-22]<>0,RC[-22]&R4C32,"q") -> q | AJ158: =IF(RC[-22]<>0,RC[-22]&R4C32,"q") -> q | AK158: =IF(RC[-22]<>0,RC[-22]&R4C32,"q") -> q | AL158: =IF(RC[-22]<>0,RC[-22]&R4C32,"q") -> q | AM158: =IF(RC[-22]<>0,RC[-22]&R4C32,"q") -> q | AN158: =IF(RC[-22]<>0,RC[-22]&R4C32,"q") -> q | AO158: =IF(RC[-22]<>0,RC[-22]&R4C32,"q") -> q | AP158: =IF(RC[-22]<>0,RC[-22]&R4C32,"q") -> q | AQ158: =IF(RC[-22]<>0,RC[-22]&R4C32,"q") -> q | AR158: =IF(RC[-22]<>0,RC[-22]&R4C32,"q") -> q | AS158: =IF(RC[-22]<>0,RC[-22]&R4C32,"q") -> q | AT158: =IF(RC[-22]<>0,RC[-22]&R4C32,"q") -> 0,1,7,223000;0,1,8,900000;0,1,4,2850000;; | AU158: =IF(RC[-22]<>0,RC[-22]&R4C32,"q") -> q | AV158: =IF(RC[-22]<>0,RC[-22]&R4C32,"q") -> 0,1,7,223000;0,1,8,900000;0,1,4,2850000;qqqqqqqqqqqqqq;
E159: 0,1,7,30000 | F159: 699000 | G159: =R2C5&RC[-1] -> 0,1,7,699000 | H159: 0,1,8,15000 | I159: 0,1,4,30000 | X159: 0,1,7,699000;0,1,8,15000;0,1,4,30000; | Z159: =RC[3]&RC[4]&RC[5]&RC[6]&RC[7]&RC[8]&RC[9]&RC[10]&RC[11]&RC[12]&RC[13]&RC[14]&RC[15]&RC[16]&RC[17]&RC[18]&RC[19] -> 0,1,7,699000;0,1,8,15000;0,1,4,30000;qqqqqqqqqqqqqq | AC159: =IF(RC[-22]<>0,RC[-22]&R4C32,"q") -> 0,1,7,699000; | AD159: =IF(RC[-22]<>0,RC[-22]&R4C32,"q") -> 0,1,8,15000; | AE159: =IF(RC[-22]<>0,RC[-22]&R4C32,"q") -> 0,1,4,30000; | AF159: =IF(RC[-22]<>0,RC[-22]&R4C32,"q") -> q | AG159: =IF(RC[-22]<>0,RC[-22]&R4C32,"q") -> q | AH159: =IF(RC[-22]<>0,RC[-22]&R4C32,"q") -> q | AI159: =IF(RC[-22]<>0,RC[-22]&R4C32,"q") -> q | AJ159: =IF(RC[-22]<>0,RC[-22]&R4C32,"q") -> q | AK159: =IF(RC[-22]<>0,RC[-22]&R4C32,"q") -> q | AL159: =IF(RC[-22]<>0,RC[-22]&R4C32,"q") -> q | AM159: =IF(RC[-22]<>0,RC[-22]&R4C32,"q") -> q | AN159: =IF(RC[-22]<>0,RC[-22]&R4C32,"q") -> q | AO159: =IF(RC[-22]<>0,RC[-22]&R4C32,"q") -> q | AP159: =IF(RC[-22]<>0,RC[-22]&R4C32,"q") -> q | AQ159: =IF(RC[-22]<>0,RC[-22]&R4C32,"q") -> q | AR159: =IF(RC[-22]<>0,RC[-22]&R4C32,"q") -> q | AS159: =IF(RC[-22]<>0,RC[-22]&R4C32,"q") -> q | AT159: =IF(RC[-22]<>0,RC[-22]&R4C32,"q") -> 0,1,7,699000;0,1,8,15000;0,1,4,30000;; | AU159: =IF(RC[-22]<>0,RC[-22]&R4C32,"q") -> q | AV159: =IF(RC[-22]<>0,RC[-22]&R4C32,"q") -> 0,1,7,699000;0,1,8,15000;0,1,4,30000;qqqqqqqqqqqqqq;
E160: 0,1,7,1750000 | F160: 227000 | G160: =R2C5&RC[-1] -> 0,1,7,227000 | H160: 0,1,8,950000 | I160: 0,1,4,2900000 | X160: 0,1,7,227000;0,1,8,950000;0,1,4,2900000; | Z160: =RC[3]&RC[4]&RC[5]&RC[6]&RC[7]&RC[8]&RC[9]&RC[10]&RC[11]&RC[12]&RC[13]&RC[14]&RC[15]&RC[16]&RC[17]&RC[18]&RC[19] -> 0,1,7,227000;0,1,8,950000;0,1,4,2900000;qqqqqqqqqqqqqq | AC160: =IF(RC[-22]<>0,RC[-22]&R4C32,"q") -> 0,1,7,227000; | AD160: =IF(RC[-22]<>0,RC[-22]&R4C32,"q") -> 0,1,8,950000; | AE160: =IF(RC[-22]<>0,RC[-22]&R4C32,"q") -> 0,1,4,2900000; | AF160: =IF(RC[-22]<>0,RC[-22]&R4C32,"q") -> q | AG160: =IF(RC[-22]<>0,RC[-22]&R4C32,"q") -> q | AH160: =IF(RC[-22]<>0,RC[-22]&R4C32,"q") -> q | AI160: =IF(RC[-22]<>0,RC[-22]&R4C32,"q") -> q | AJ160: =IF(RC[-22]<>0,RC[-22]&R4C32,"q") -> q | AK160: =IF(RC[-22]<>0,RC[-22]&R4C32,"q") -> q | AL160: =IF(RC[-22]<>0,RC[-22]&R4C32,"q") -> q | AM160: =IF(RC[-22]<>0,RC[-22]&R4C32,"q") -> q | AN160: =IF(RC[-22]<>0,RC[-22]&R4C32,"q") -> q | AO160: =IF(RC[-22]<>0,RC[-22]&R4C32,"q") -> q | AP160: =IF(RC[-22]<>0,RC[-22]&R4C32,"q") -> q | AQ160: =IF(RC[-22]<>0,RC[-22]&R4C32,"q") -> q | AR160: =IF(RC[-22]<>0,RC[-22]&R4C32,"q") -> q | AS160: =IF(RC[-22]<>0,RC[-22]&R4C32,"q") -> q | AT160: =IF(RC[-22]<>0,RC[-22]&R4C32,"q") -> 0,1,7,227000;0,1,8,950000;0,1,4,2900000;; | AU160: =IF(RC[-22]<>0,RC[-22]&R4C32,"q") -> q | AV160: =IF(RC[-22]<>0,RC[-22]&R4C32,"q") -> 0,1,7,227000;0,1,8,950000;0,1,4,2900000;qqqqqqqqqqqqqq;
E161: 0,1,7,30000 | F161: 229000 | G161: =R2C5&RC[-1] -> 0,1,7,229000 | H161: 0,1,8,15000 | I161: 0,1,4,30000 | X161: 0,1,7,229000;0,1,8,15000;0,1,4,30000; | Z161: =RC[3]&RC[4]&RC[5]&RC[6]&RC[7]&RC[8]&RC[9]&RC[10]&RC[11]&RC[12]&RC[13]&RC[14]&RC[15]&RC[16]&RC[17]&RC[18]&RC[19] -> 0,1,7,229000;0,1,8,15000;0,1,4,30000;qqqqqqqqqqqqqq | AC161: =IF(RC[-22]<>0,RC[-22]&R4C32,"q") -> 0,1,7,229000; | AD161: =IF(RC[-22]<>0,RC[-22]&R4C32,"q") -> 0,1,8,15000; | AE161: =IF(RC[-22]<>0,RC[-22]&R4C32,"q") -> 0,1,4,30000; | AF161: =IF(RC[-22]<>0,RC[-22]&R4C32,"q") -> q | AG161: =IF(RC[-22]<>0,RC[-22]&R4C32,"q") -> q | AH161: =IF(RC[-22]<>0,RC[-22]&R4C32,"q") -> q | AI161: =IF(RC[-22]<>0,RC[-22]&R4C32,"q") -> q | AJ161: =IF(RC[-22]<>0,RC[-22]&R4C32,"q") -> q | AK161: =IF(RC[-22]<>0,RC[-22]&R4C32,"q") -> q | AL161: =IF(RC[-22]<>0,RC[-22]&R4C32,"q") -> q | AM161: =IF(RC[-22]<>0,RC[-22]&R4C32,"q") -> q | AN161: =IF(RC[-22]<>0,RC[-22]&R4C32,"q") -> q | AO161: =IF(RC[-22]<>0,RC[-22]&R4C32,"q") -> q | AP161: =IF(RC[-22]<>0,RC[-22]&R4C32,"q") -> q | AQ161: =IF(RC[-22]<>0,RC[-22]&R4C32,"q") -> q | AR161: =IF(RC[-22]<>0,RC[-22]&R4C32,"q") -> q | AS161: =IF(RC[-22]<>0,RC[-22]&R4C32,"q") -> q | AT161: =IF(RC[-22]<>0,RC[-22]&R4C32,"q") -> 0,1,7,229000;0,1,8,15000;0,1,4,30000;; | AU161: =IF(RC[-22]<>0,RC[-22]&R4C32,"q") -> q | AV161: =IF(RC[-22]<>0,RC[-22]&R4C32,"q") -> 0,1,7,229000;0,1,8,15000;0,1,4,30000;qqqqqqqqqqqqqq;
E162: 0,1,7,1800000 | F162: 230000 | G162: =R2C5&RC[-1] -> 0,1,7,230000 | H162: 0,1,8,1000000 | I162: 0,1,4,3060000 | X162: 0,1,7,230000;0,1,8,1000000;0,1,4,3060000; | Z162: =RC[3]&RC[4]&RC[5]&RC[6]&RC[7]&RC[8]&RC[9]&RC[10]&RC[11]&RC[12]&RC[13]&RC[14]&RC[15]&RC[16]&RC[17]&RC[18]&RC[19] -> 0,1,7,230000;0,1,8,1000000;0,1,4,3060000;qqqqqqqqqqqqqq | AC162: =IF(RC[-22]<>0,RC[-22]&R4C32,"q") -> 0,1,7,230000; | AD162: =IF(RC[-22]<>0,RC[-22]&R4C32,"q") -> 0,1,8,1000000; | AE162: =IF(RC[-22]<>0,RC[-22]&R4C32,"q") -> 0,1,4,3060000; | AF162: =IF(RC[-22]<>0,RC[-22]&R4C32,"q") -> q | AG162: =IF(RC[-22]<>0,RC[-22]&R4C32,"q") -> q | AH162: =IF(RC[-22]<>0,RC[-22]&R4C32,"q") -> q | AI162: =IF(RC[-22]<>0,RC[-22]&R4C32,"q") -> q | AJ162: =IF(RC[-22]<>0,RC[-22]&R4C32,"q") -> q | AK162: =IF(RC[-22]<>0,RC[-22]&R4C32,"q") -> q | AL162: =IF(RC[-22]<>0,RC[-22]&R4C32,"q") -> q | AM162: =IF(RC[-22]<>0,RC[-22]&R4C32,"q") -> q | AN162: =IF(RC[-22]<>0,RC[-22]&R4C32,"q") -> q | AO162: =IF(RC[-22]<>0,RC[-22]&R4C32,"q") -> q | AP162: =IF(RC[-22]<>0,RC[-22]&R4C32,"q") -> q | AQ162: =IF(RC[-22]<>0,RC[-22]&R4C32,"q") -> q | AR162: =IF(RC[-22]<>0,RC[-22]&R4C32,"q") -> q | AS162: =IF(RC[-22]<>0,RC[-22]&R4C32,"q") -> q | AT162: =IF(RC[-22]<>0,RC[-22]&R4C32,"q") -> 0,1,7,230000;0,1,8,1000000;0,1,4,3060000;; | AU162: =IF(RC[-22]<>0,RC[-22]&R4C32,"q") -> q | AV162: =IF(RC[-22]<>0,RC[-22]&R4C32,"q") -> 0,1,7,230000;0,1,8,1000000;0,1,4,3060000;qqqqqqqqqqqqqq;
E163: 0,1,7,30000 | F163: 232000 | G163: =R2C5&RC[-1] -> 0,1,7,232000 | H163: 0,1,8,15000 | I163: 0,1,4,30000 | X163: 0,1,7,232000;0,1,8,15000;0,1,4,30000; | Z163: =RC[3]&RC[4]&RC[5]&RC[6]&RC[7]&RC[8]&RC[9]&RC[10]&RC[11]&RC[12]&RC[13]&RC[14]&RC[15]&RC[16]&RC[17]&RC[18]&RC[19] -> 0,1,7,232000;0,1,8,15000;0,1,4,30000;qqqqqqqqqqqqqq | AC163: =IF(RC[-22]<>0,RC[-22]&R4C32,"q") -> 0,1,7,232000; | AD163: =IF(RC[-22]<>0,RC[-22]&R4C32,"q") -> 0,1,8,15000; | AE163: =IF(RC[-22]<>0,RC[-22]&R4C32,"q") -> 0,1,4,30000; | AF163: =IF(RC[-22]<>0,RC[-22]&R4C32,"q") -> q | AG163: =IF(RC[-22]<>0,RC[-22]&R4C32,"q") -> q | AH163: =IF(RC[-22]<>0,RC[-22]&R4C32,"q") -> q | AI163: =IF(RC[-22]<>0,RC[-22]&R4C32,"q") -> q | AJ163: =IF(RC[-22]<>0,RC[-22]&R4C32,"q") -> q | AK163: =IF(RC[-22]<>0,RC[-22]&R4C32,"q") -> q | AL163: =IF(RC[-22]<>0,RC[-22]&R4C32,"q") -> q | AM163: =IF(RC[-22]<>0,RC[-22]&R4C32,"q") -> q | AN163: =IF(RC[-22]<>0,RC[-22]&R4C32,"q") -> q | AO163: =IF(RC[-22]<>0,RC[-22]&R4C32,"q") -> q | AP163: =IF(RC[-22]<>0,RC[-22]&R4C32,"q") -> q | AQ163: =IF(RC[-22]<>0,RC[-22]&R4C32,"q") -> q | AR163: =IF(RC[-22]<>0,RC[-22]&R4C32,"q") -> q | AS163: =IF(RC[-22]<>0,RC[-22]&R4C32,"q") -> q | AT163: =IF(RC[-22]<>0,RC[-22]&R4C32,"q") -> 0,1,7,232000;0,1,8,15000;0,1,4,30000;; | AU163: =IF(RC[-22]<>0,RC[-22]&R4C32,"q") -> q | AV163: =IF(RC[-22]<>0,RC[-22]&R4C32,"q") -> 0,1,7,232000;0,1,8,15000;0,1,4,30000;qqqqqqqqqqqqqq;
E164: 0,1,7,40000 | F164: 728000 | G164: =R2C5&RC[-1] -> 0,1,7,728000 | H164: 0,1,8,20000 | I164: 0,1,4,40000 | X164: 0,1,7,728000;0,1,8,20000;0,1,4,40000; | Z164: =RC[3]&RC[4]&RC[5]&RC[6]&RC[7]&RC[8]&RC[9]&RC[10]&RC[11]&RC[12]&RC[13]&RC[14]&RC[15]&RC[16]&RC[17]&RC[18]&RC[19] -> 0,1,7,728000;0,1,8,20000;0,1,4,40000;qqqqqqqqqqqqqq | AC164: =IF(RC[-22]<>0,RC[-22]&R4C32,"q") -> 0,1,7,728000; | AD164: =IF(RC[-22]<>0,RC[-22]&R4C32,"q") -> 0,1,8,20000; | AE164: =IF(RC[-22]<>0,RC[-22]&R4C32,"q") -> 0,1,4,40000; | AF164: =IF(RC[-22]<>0,RC[-22]&R4C32,"q") -> q | AG164: =IF(RC[-22]<>0,RC[-22]&R4C32,"q") -> q | AH164: =IF(RC[-22]<>0,RC[-22]&R4C32,"q") -> q | AI164: =IF(RC[-22]<>0,RC[-22]&R4C32,"q") -> q | AJ164: =IF(RC[-22]<>0,RC[-22]&R4C32,"q") -> q | AK164: =IF(RC[-22]<>0,RC[-22]&R4C32,"q") -> q | AL164: =IF(RC[-22]<>0,RC[-22]&R4C32,"q") -> q | AM164: =IF(RC[-22]<>0,RC[-22]&R4C32,"q") -> q | AN164: =IF(RC[-22]<>0,RC[-22]&R4C32,"q") -> q | AO164: =IF(RC[-22]<>0,RC[-22]&R4C32,"q") -> q | AP164: =IF(RC[-22]<>0,RC[-22]&R4C32,"q") -> q | AQ164: =IF(RC[-22]<>0,RC[-22]&R4C32,"q") -> q | AR164: =IF(RC[-22]<>0,RC[-22]&R4C32,"q") -> q | AS164: =IF(RC[-22]<>0,RC[-22]&R4C32,"q") -> q | AT164: =IF(RC[-22]<>0,RC[-22]&R4C32,"q") -> 0,1,7,728000;0,1,8,20000;0,1,4,40000;; | AU164: =IF(RC[-22]<>0,RC[-22]&R4C32,"q") -> q | AV164: =IF(RC[-22]<>0,RC[-22]&R4C32,"q") -> 0,1,7,728000;0,1,8,20000;0,1,4,40000;qqqqqqqqqqqqqq;
E165: 0,1,7,40000 | F165: 236000 | G165: =R2C5&RC[-1] -> 0,1,7,236000 | H165: 0,1,8,20000 | I165: 0,1,4,40000 | X165: 0,1,7,236000;0,1,8,20000;0,1,4,40000; | Z165: =RC[3]&RC[4]&RC[5]&RC[6]&RC[7]&RC[8]&RC[9]&RC[10]&RC[11]&RC[12]&RC[13]&RC[14]&RC[15]&RC[16]&RC[17]&RC[18]&RC[19] -> 0,1,7,236000;0,1,8,20000;0,1,4,40000;qqqqqqqqqqqqqq | AC165: =IF(RC[-22]<>0,RC[-22]&R4C32,"q") -> 0,1,7,236000; | AD165: =IF(RC[-22]<>0,RC[-22]&R4C32,"q") -> 0,1,8,20000; | AE165: =IF(RC[-22]<>0,RC[-22]&R4C32,"q") -> 0,1,4,40000; | AF165: =IF(RC[-22]<>0,RC[-22]&R4C32,"q") -> q | AG165: =IF(RC[-22]<>0,RC[-22]&R4C32,"q") -> q | AH165: =IF(RC[-22]<>0,RC[-22]&R4C32,"q") -> q | AI165: =IF(RC[-22]<>0,RC[-22]&R4C32,"q") -> q | AJ165: =IF(RC[-22]<>0,RC[-22]&R4C32,"q") -> q | AK165: =IF(RC[-22]<>0,RC[-22]&R4C32,"q") -> q | AL165: =IF(RC[-22]<>0,RC[-22]&R4C32,"q") -> q | AM165: =IF(RC[-22]<>0,RC[-22]&R4C32,"q") -> q | AN165: =IF(RC[-22]<>0,RC[-22]&R4C32,"q") -> q | AO165: =IF(RC[-22]<>0,RC[-22]&R4C32,"q") -> q | AP165: =IF(RC[-22]<>0,RC[-22]&R4C32,"q") -> q | AQ165: =IF(RC[-22]<>0,RC[-22]&R4C32,"q") -> q | AR165: =IF(RC[-22]<>0,RC[-22]&R4C32,"q") -> q | AS165: =IF(RC[-22]<>0,RC[-22]&R4C32,"q") -> q | AT165: =IF(RC[-22]<>0,RC[-22]&R4C32,"q") -> 0,1,7,236000;0,1,8,20000;0,1,4,40000;; | AU165: =IF(RC[-22]<>0,RC[-22]&R4C32,"q") -> q | AV165: =IF(RC[-22]<>0,RC[-22]&R4C32,"q") -> 0,1,7,236000;0,1,8,20000;0,1,4,40000;qqqqqqqqqqqqqq;
E166: 0,1,7,40000 | F166: 238000 | G166: =R2C5&RC[-1] -> 0,1,7,238000 | H166: 0,1,8,20000 | I166: 0,1,4,40000 | X166: 0,1,7,238000;0,1,8,20000;0,1,4,40000; | Z166: =RC[3]&RC[4]&RC[5]&RC[6]&RC[7]&RC[8]&RC[9]&RC[10]&RC[11]&RC[12]&RC[13]&RC[14]&RC[15]&RC[16]&RC[17]&RC[18]&RC[19] -> 0,1,7,238000;0,1,8,20000;0,1,4,40000;qqqqqqqqqqqqqq | AC166: =IF(RC[-22]<>0,RC[-22]&R4C32,"q") -> 0,1,7,238000; | AD166: =IF(RC[-22]<>0,RC[-22]&R4C32,"q") -> 0,1,8,20000; | AE166: =IF(RC[-22]<>0,RC[-22]&R4C32,"q") -> 0,1,4,40000; | AF166: =IF(RC[-22]<>0,RC[-22]&R4C32,"q") -> q | AG166: =IF(RC[-22]<>0,RC[-22]&R4C32,"q") -> q | AH166: =IF(RC[-22]<>0,RC[-22]&R4C32,"q") -> q | AI166: =IF(RC[-22]<>0,RC[-22]&R4C32,"q") -> q | AJ166: =IF(RC[-22]<>0,RC[-22]&R4C32,"q") -> q | AK166: =IF(RC[-22]<>0,RC[-22]&R4C32,"q") -> q | AL166: =IF(RC[-22]<>0,RC[-22]&R4C32,"q") -> q | AM166: =IF(RC[-22]<>0,RC[-22]&R4C32,"q") -> q | AN166: =IF(RC[-22]<>0,RC[-22]&R4C32,"q") -> q | AO166: =IF(RC[-22]<>0,RC[-22]&R4C32,"q") -> q | AP166: =IF(RC[-22]<>0,RC[-22]&R4C32,"q") -> q | AQ166: =IF(RC[-22]<>0,RC[-22]&R4C32,"q") -> q | AR166: =IF(RC[-22]<>0,RC[-22]&R4C32,"q") -> q | AS166: =IF(RC[-22]<>0,RC[-22]&R4C32,"q") -> q | AT166: =IF(RC[-22]<>0,RC[-22]&R4C32,"q") -> 0,1,7,238000;0,1,8,20000;0,1,4,40000;; | AU166: =IF(RC[-22]<>0,RC[-22]&R4C32,"q") -> q | AV166: =IF(RC[-22]<>0,RC[-22]&R4C32,"q") -> 0,1,7,238000;0,1,8,20000;0,1,4,40000;qqqqqqqqqqqqqq;
E167: 0,1,7,40000 | F167: 240000 | G167: =R2C5&RC[-1] -> 0,1,7,240000 | H167: 0,1,8,20000 | I167: 0,1,4,40000 | X167: 0,1,7,240000;0,1,8,20000;0,1,4,40000; | Z167: =RC[3]&RC[4]&RC[5]&RC[6]&RC[7]&RC[8]&RC[9]&RC[10]&RC[11]&RC[12]&RC[13]&RC[14]&RC[15]&RC[16]&RC[17]&RC[18]&RC[19] -> 0,1,7,240000;0,1,8,20000;0,1,4,40000;qqqqqqqqqqqqqq | AC167: =IF(RC[-22]<>0,RC[-22]&R4C32,"q") -> 0,1,7,240000; | AD167: =IF(RC[-22]<>0,RC[-22]&R4C32,"q") -> 0,1,8,20000; | AE167: =IF(RC[-22]<>0,RC[-22]&R4C32,"q") -> 0,1,4,40000; | AF167: =IF(RC[-22]<>0,RC[-22]&R4C32,"q") -> q | AG167: =IF(RC[-22]<>0,RC[-22]&R4C32,"q") -> q | AH167: =IF(RC[-22]<>0,RC[-22]&R4C32,"q") -> q | AI167: =IF(RC[-22]<>0,RC[-22]&R4C32,"q") -> q | AJ167: =IF(RC[-22]<>0,RC[-22]&R4C32,"q") -> q | AK167: =IF(RC[-22]<>0,RC[-22]&R4C32,"q") -> q | AL167: =IF(RC[-22]<>0,RC[-22]&R4C32,"q") -> q | AM167: =IF(RC[-22]<>0,RC[-22]&R4C32,"q") -> q | AN167: =IF(RC[-22]<>0,RC[-22]&R4C32,"q") -> q | AO167: =IF(RC[-22]<>0,RC[-22]&R4C32,"q") -> q | AP167: =IF(RC[-22]<>0,RC[-22]&R4C32,"q") -> q | AQ167: =IF(RC[-22]<>0,RC[-22]&R4C32,"q") -> q | AR167: =IF(RC[-22]<>0,RC[-22]&R4C32,"q") -> q | AS167: =IF(RC[-22]<>0,RC[-22]&R4C32,"q") -> q | AT167: =IF(RC[-22]<>0,RC[-22]&R4C32,"q") -> 0,1,7,240000;0,1,8,20000;0,1,4,40000;; | AU167: =IF(RC[-22]<>0,RC[-22]&R4C32,"q") -> q | AV167: =IF(RC[-22]<>0,RC[-22]&R4C32,"q") -> 0,1,7,240000;0,1,8,20000;0,1,4,40000;qqqqqqqqqqqqqq;
E168: 0,1,7,40000 | F168: 242000 | G168: =R2C5&RC[-1] -> 0,1,7,242000 | H168: 0,1,8,20000 | I168: 0,1,4,40000 | X168: 0,1,7,242000;0,1,8,20000;0,1,4,40000; | Z168: =RC[3]&RC[4]&RC[5]&RC[6]&RC[7]&RC[8]&RC[9]&RC[10]&RC[11]&RC[12]&RC[13]&RC[14]&RC[15]&RC[16]&RC[17]&RC[18]&RC[19] -> 0,1,7,242000;0,1,8,20000;0,1,4,40000;qqqqqqqqqqqqqq | AC168: =IF(RC[-22]<>0,RC[-22]&R4C32,"q") -> 0,1,7,242000; | AD168: =IF(RC[-22]<>0,RC[-22]&R4C32,"q") -> 0,1,8,20000; | AE168: =IF(RC[-22]<>0,RC[-22]&R4C32,"q") -> 0,1,4,40000; | AF168: =IF(RC[-22]<>0,RC[-22]&R4C32,"q") -> q | AG168: =IF(RC[-22]<>0,RC[-22]&R4C32,"q") -> q | AH168: =IF(RC[-22]<>0,RC[-22]&R4C32,"q") -> q | AI168: =IF(RC[-22]<>0,RC[-22]&R4C32,"q") -> q | AJ168: =IF(RC[-22]<>0,RC[-22]&R4C32,"q") -> q | AK168: =IF(RC[-22]<>0,RC[-22]&R4C32,"q") -> q | AL168: =IF(RC[-22]<>0,RC[-22]&R4C32,"q") -> q | AM168: =IF(RC[-22]<>0,RC[-22]&R4C32,"q") -> q | AN168: =IF(RC[-22]<>0,RC[-22]&R4C32,"q") -> q | AO168: =IF(RC[-22]<>0,RC[-22]&R4C32,"q") -> q | AP168: =IF(RC[-22]<>0,RC[-22]&R4C32,"q") -> q | AQ168: =IF(RC[-22]<>0,RC[-22]&R4C32,"q") -> q | AR168: =IF(RC[-22]<>0,RC[-22]&R4C32,"q") -> q | AS168: =IF(RC[-22]<>0,RC[-22]&R4C32,"q") -> q | AT168: =IF(RC[-22]<>0,RC[-22]&R4C32,"q") -> 0,1,7,242000;0,1,8,20000;0,1,4,40000;; | AU168: =IF(RC[-22]<>0,RC[-22]&R4C32,"q") -> q | AV168: =IF(RC[-22]<>0,RC[-22]&R4C32,"q") -> 0,1,7,242000;0,1,8,20000;0,1,4,40000;qqqqqqqqqqqqqq;
E169: 0,1,7,40000 | F169: 758000 | G169: =R2C5&RC[-1] -> 0,1,7,758000 | H169: 0,1,8,20000 | I169: 0,1,4,40000 | X169: 0,1,7,758000;0,1,8,20000;0,1,4,40000; | Z169: =RC[3]&RC[4]&RC[5]&RC[6]&RC[7]&RC[8]&RC[9]&RC[10]&RC[11]&RC[12]&RC[13]&RC[14]&RC[15]&RC[16]&RC[17]&RC[18]&RC[19] -> 0,1,7,758000;0,1,8,20000;0,1,4,40000;qqqqqqqqqqqqqq | AC169: =IF(RC[-22]<>0,RC[-22]&R4C32,"q") -> 0,1,7,758000; | AD169: =IF(RC[-22]<>0,RC[-22]&R4C32,"q") -> 0,1,8,20000; | AE169: =IF(RC[-22]<>0,RC[-22]&R4C32,"q") -> 0,1,4,40000; | AF169: =IF(RC[-22]<>0,RC[-22]&R4C32,"q") -> q | AG169: =IF(RC[-22]<>0,RC[-22]&R4C32,"q") -> q | AH169: =IF(RC[-22]<>0,RC[-22]&R4C32,"q") -> q | AI169: =IF(RC[-22]<>0,RC[-22]&R4C32,"q") -> q | AJ169: =IF(RC[-22]<>0,RC[-22]&R4C32,"q") -> q | AK169: =IF(RC[-22]<>0,RC[-22]&R4C32,"q") -> q | AL169: =IF(RC[-22]<>0,RC[-22]&R4C32,"q") -> q | AM169: =IF(RC[-22]<>0,RC[-22]&R4C32,"q") -> q | AN169: =IF(RC[-22]<>0,RC[-22]&R4C32,"q") -> q | AO169: =IF(RC[-22]<>0,RC[-22]&R4C32,"q") -> q | AP169: =IF(RC[-22]<>0,RC[-22]&R4C32,"q") -> q | AQ169: =IF(RC[-22]<>0,RC[-22]&R4C32,"q") -> q | AR169: =IF(RC[-22]<>0,RC[-22]&R4C32,"q") -> q | AS169: =IF(RC[-22]<>0,RC[-22]&R4C32,"q") -> q | AT169: =IF(RC[-22]<>0,RC[-22]&R4C32,"q") -> 0,1,7,758000;0,1,8,20000;0,1,4,40000;; | AU169: =IF(RC[-22]<>0,RC[-22]&R4C32,"q") -> q | AV169: =IF(RC[-22]<>0,RC[-22]&R4C32,"q") -> 0,1,7,758000;0,1,8,20000;0,1,4,40000;qqqqqqqqqqqqqq;
E170: 0,1,7,40000 | F170: 246000 | G170: =R2C5&RC[-1] -> 0,1,7,246000 | H170: 0,1,8,20000 | I170: 0,1,4,40000 | X170: 0,1,7,246000;0,1,8,20000;0,1,4,40000; | Z170: =RC[3]&RC[4]&RC[5]&RC[6]&RC[7]&RC[8]&RC[9]&RC[10]&RC[11]&RC[12]&RC[13]&RC[14]&RC[15]&RC[16]&RC[17]&RC[18]&RC[19] -> 0,1,7,246000;0,1,8,20000;0,1,4,40000;qqqqqqqqqqqqqq | AC170: =IF(RC[-22]<>0,RC[-22]&R4C32,"q") -> 0,1,7,246000; | AD170: =IF(RC[-22]<>0,RC[-22]&R4C32,"q") -> 0,1,8,20000; | AE170: =IF(RC[-22]<>0,RC[-22]&R4C32,"q") -> 0,1,4,40000; | AF170: =IF(RC[-22]<>0,RC[-22]&R4C32,"q") -> q | AG170: =IF(RC[-22]<>0,RC[-22]&R4C32,"q") -> q | AH170: =IF(RC[-22]<>0,RC[-22]&R4C32,"q") -> q | AI170: =IF(RC[-22]<>0,RC[-22]&R4C32,"q") -> q | AJ170: =IF(RC[-22]<>0,RC[-22]&R4C32,"q") -> q | AK170: =IF(RC[-22]<>0,RC[-22]&R4C32,"q") -> q | AL170: =IF(RC[-22]<>0,RC[-22]&R4C32,"q") -> q | AM170: =IF(RC[-22]<>0,RC[-22]&R4C32,"q") -> q | AN170: =IF(RC[-22]<>0,RC[-22]&R4C32,"q") -> q | AO170: =IF(RC[-22]<>0,RC[-22]&R4C32,"q") -> q | AP170: =IF(RC[-22]<>0,RC[-22]&R4C32,"q") -> q | AQ170: =IF(RC[-22]<>0,RC[-22]&R4C32,"q") -> q | AR170: =IF(RC[-22]<>0,RC[-22]&R4C32,"q") -> q | AS170: =IF(RC[-22]<>0,RC[-22]&R4C32,"q") -> q | AT170: =IF(RC[-22]<>0,RC[-22]&R4C32,"q") -> 0,1,7,246000;0,1,8,20000;0,1,4,40000;; | AU170: =IF(RC[-22]<>0,RC[-22]&R4C32,"q") -> q | AV170: =IF(RC[-22]<>0,RC[-22]&R4C32,"q") -> 0,1,7,246000;0,1,8,20000;0,1,4,40000;qqqqqqqqqqqqqq;
AC171: =IF(RC[-22]<>0,RC[-22]&R4C32,"q") -> q | AD171: =IF(RC[-22]<>0,RC[-22]&R4C32,"q") -> q | AE171: =IF(RC[-22]<>0,RC[-22]&R4C32,"q") -> q | AF171: =IF(RC[-22]<>0,RC[-22]&R4C32,"q") -> q | AG171: =IF(RC[-22]<>0,RC[-22]&R4C32,"q") -> q | AH171: =IF(RC[-22]<>0,RC[-22]&R4C32,"q") -> q | AI171: =IF(RC[-22]<>0,RC[-22]&R4C32,"q") -> q | AJ171: =IF(RC[-22]<>0,RC[-22]&R4C32,"q") -> q | AK171: =IF(RC[-22]<>0,RC[-22]&R4C32,"q") -> q | AL171: =IF(RC[-22]<>0,RC[-22]&R4C32,"q") -> q | AM171: =IF(RC[-22]<>0,RC[-22]&R4C32,"q") -> q | AN171: =IF(RC[-22]<>0,RC[-22]&R4C32,"q") -> q | AO171: =IF(RC[-22]<>0,RC[-22]&R4C32,"q") -> q | AP171: =IF(RC[-22]<>0,RC[-22]&R4C32,"q") -> q | AQ171: =IF(RC[-22]<>0,RC[-22]&R4C32,"q") -> q | AR171: =IF(RC[-22]<>0,RC[-22]&R4C32,"q") -> q | AS171: =IF(RC[-22]<>0,RC[-22]&R4C32,"q") -> q | AT171: =IF(RC[-22]<>0,RC[-22]&R4C32,"q") -> q | AU171: =IF(RC[-22]<>0,RC[-22]&R4C32,"q") -> q | AV171: =IF(RC[-22]<>0,RC[-22]&R4C32,"q") -> q
AC172: =IF(RC[-22]<>0,RC[-22]&R4C32,"q") -> q | AD172: =IF(RC[-22]<>0,RC[-22]&R4C32,"q") -> q | AE172: =IF(RC[-22]<>0,RC[-22]&R4C32,"q") -> q | AF172: =IF(RC[-22]<>0,RC[-22]&R4C32,"q") -> q | AG172: =IF(RC[-22]<>0,RC[-22]&R4C32,"q") -> q | AH172: =IF(RC[-22]<>0,RC[-22]&R4C32,"q") -> q | AI172: =IF(RC[-22]<>0,RC[-22]&R4C32,"q") -> q | AJ172: =IF(RC[-22]<>0,RC[-22]&R4C32,"q") -> q | AK172: =IF(RC[-22]<>0,RC[-22]&R4C32,"q") -> q | AL172: =IF(RC[-22]<>0,RC[-22]&R4C32,"q") -> q | AM172: =IF(RC[-22]<>0,RC[-22]&R4C32,"q") -> q | AN172: =IF(RC[-22]<>0,RC[-22]&R4C32,"q") -> q | AO172: =IF(RC[-22]<>0,RC[-22]&R4C32,"q") -> q | AP172: =IF(RC[-22]<>0,RC[-22]&R4C32,"q") -> q | AQ172: =IF(RC[-22]<>0,RC[-22]&R4C32,"q") -> q | AR172: =IF(RC[-22]<>0,RC[-22]&R4C32,"q") -> q | AS172: =IF(RC[-22]<>0,RC[-22]&R4C32,"q") -> q | AT172: =IF(RC[-22]<>0,RC[-22]&R4C32,"q") -> q | AU172: =IF(RC[-22]<>0,RC[-22]&R4C32,"q") -> q | AV172: =IF(RC[-22]<>0,RC[-22]&R4C32,"q") -> q
AC173: =IF(RC[-22]<>0,RC[-22]&R4C32,"q") -> q | AD173: =IF(RC[-22]<>0,RC[-22]&R4C32,"q") -> q | AE173: =IF(RC[-22]<>0,RC[-22]&R4C32,"q") -> q | AF173: =IF(RC[-22]<>0,RC[-22]&R4C32,"q") -> q | AG173: =IF(RC[-22]<>0,RC[-22]&R4C32,"q") -> q | AH173: =IF(RC[-22]<>0,RC[-22]&R4C32,"q") -> q | AI173: =IF(RC[-22]<>0,RC[-22]&R4C32,"q") -> q | AJ173: =IF(RC[-22]<>0,RC[-22]&R4C32,"q") -> q | AK173: =IF(RC[-22]<>0,RC[-22]&R4C32,"q") -> q | AL173: =IF(RC[-22]<>0,RC[-22]&R4C32,"q") -> q | AM173: =IF(RC[-22]<>0,RC[-22]&R4C32,"q") -> q | AN173: =IF(RC[-22]<>0,RC[-22]&R4C32,"q") -> q | AO173: =IF(RC[-22]<>0,RC[-22]&R4C32,"q") -> q | AP173: =IF(RC[-22]<>0,RC[-22]&R4C32,"q") -> q | AQ173: =IF(RC[-22]<>0,RC[-22]&R4C32,"q") -> q | AR173: =IF(RC[-22]<>0,RC[-22]&R4C32,"q") -> q | AS173: =IF(RC[-22]<>0,RC[-22]&R4C32,"q") -> q | AT173: =IF(RC[-22]<>0,RC[-22]&R4C32,"q") -> q | AU173: =IF(RC[-22]<>0,RC[-22]&R4C32,"q") -> q | AV173: =IF(RC[-22]<>0,RC[-22]&R4C32,"q") -> q
AC174: =IF(RC[-22]<>0,RC[-22]&R4C32,"q") -> q | AD174: =IF(RC[-22]<>0,RC[-22]&R4C32,"q") -> q | AE174: =IF(RC[-22]<>0,RC[-22]&R4C32,"q") -> q | AF174: =IF(RC[-22]<>0,RC[-22]&R4C32,"q") -> q | AG174: =IF(RC[-22]<>0,RC[-22]&R4C32,"q") -> q | AH174: =IF(RC[-22]<>0,RC[-22]&R4C32,"q") -> q | AI174: =IF(RC[-22]<>0,RC[-22]&R4C32,"q") -> q | AJ174: =IF(RC[-22]<>0,RC[-22]&R4C32,"q") -> q | AK174: =IF(RC[-22]<>0,RC[-22]&R4C32,"q") -> q | AL174: =IF(RC[-22]<>0,RC[-22]&R4C32,"q") -> q | AM174: =IF(RC[-22]<>0,RC[-22]&R4C32,"q") -> q | AN174: =IF(RC[-22]<>0,RC[-22]&R4C32,"q") -> q | AO174: =IF(RC[-22]<>0,RC[-22]&R4C32,"q") -> q | AP174: =IF(RC[-22]<>0,RC[-22]&R4C32,"q") -> q | AQ174: =IF(RC[-22]<>0,RC[-22]&R4C32,"q") -> q | AR174: =IF(RC[-22]<>0,RC[-22]&R4C32,"q") -> q | AS174: =IF(RC[-22]<>0,RC[-22]&R4C32,"q") -> q | AT174: =IF(RC[-22]<>0,RC[-22]&R4C32,"q") -> q | AU174: =IF(RC[-22]<>0,RC[-22]&R4C32,"q") -> q | AV174: =IF(RC[-22]<>0,RC[-22]&R4C32,"q") -> q
AC175: =IF(RC[-22]<>0,RC[-22]&R4C32,"q") -> q | AD175: =IF(RC[-22]<>0,RC[-22]&R4C32,"q") -> q | AE175: =IF(RC[-22]<>0,RC[-22]&R4C32,"q") -> q | AF175: =IF(RC[-22]<>0,RC[-22]&R4C32,"q") -> q | AG175: =IF(RC[-22]<>0,RC[-22]&R4C32,"q") -> q | AH175: =IF(RC[-22]<>0,RC[-22]&R4C32,"q") -> q | AI175: =IF(RC[-22]<>0,RC[-22]&R4C32,"q") -> q | AJ175: =IF(RC[-22]<>0,RC[-22]&R4C32,"q") -> q | AK175: =IF(RC[-22]<>0,RC[-22]&R4C32,"q") -> q | AL175: =IF(RC[-22]<>0,RC[-22]&R4C32,"q") -> q | AM175: =IF(RC[-22]<>0,RC[-22]&R4C32,"q") -> q | AN175: =IF(RC[-22]<>0,RC[-22]&R4C32,"q") -> q | AO175: =IF(RC[-22]<>0,RC[-22]&R4C32,"q") -> q | AP175: =IF(RC[-22]<>0,RC[-22]&R4C32,"q") -> q | AQ175: =IF(RC[-22]<>0,RC[-22]&R4C32,"q") -> q | AR175: =IF(RC[-22]<>0,RC[-22]&R4C32,"q") -> q | AS175: =IF(RC[-22]<>0,RC[-22]&R4C32,"q") -> q | AT175: =IF(RC[-22]<>0,RC[-22]&R4C32,"q") -> q | AU175: =IF(RC[-22]<>0,RC[-22]&R4C32,"q") -> q | AV175: =IF(RC[-22]<>0,RC[-22]&R4C32,"q") -> q
AC176: =IF(RC[-22]<>0,RC[-22]&R4C32,"q") -> q | AD176: =IF(RC[-22]<>0,RC[-22]&R4C32,"q") -> q | AE176: =IF(RC[-22]<>0,RC[-22]&R4C32,"q") -> q | AF176: =IF(RC[-22]<>0,RC[-22]&R4C32,"q") -> q | AG176: =IF(RC[-22]<>0,RC[-22]&R4C32,"q") -> q | AH176: =IF(RC[-22]<>0,RC[-22]&R4C32,"q") -> q | AI176: =IF(RC[-22]<>0,RC[-22]&R4C32,"q") -> q | AJ176: =IF(RC[-22]<>0,RC[-22]&R4C32,"q") -> q | AK176: =IF(RC[-22]<>0,RC[-22]&R4C32,"q") -> q | AL176: =IF(RC[-22]<>0,RC[-22]&R4C32,"q") -> q | AM176: =IF(RC[-22]<>0,RC[-22]&R4C32,"q") -> q | AN176: =IF(RC[-22]<>0,RC[-22]&R4C32,"q") -> q | AO176: =IF(RC[-22]<>0,RC[-22]&R4C32,"q") -> q | AP176: =IF(RC[-22]<>0,RC[-22]&R4C32,"q") -> q | AQ176: =IF(RC[-22]<>0,RC[-22]&R4C32,"q") -> q | AR176: =IF(RC[-22]<>0,RC[-22]&R4C32,"q") -> q | AS176: =IF(RC[-22]<>0,RC[-22]&R4C32,"q") -> q | AT176: =IF(RC[-22]<>0,RC[-22]&R4C32,"q") -> q | AU176: =IF(RC[-22]<>0,RC[-22]&R4C32,"q") -> q | AV176: =IF(RC[-22]<>0,RC[-22]&R4C32,"q") -> q
AC177: =IF(RC[-22]<>0,RC[-22]&R4C32,"q") -> q | AD177: =IF(RC[-22]<>0,RC[-22]&R4C32,"q") -> q | AE177: =IF(RC[-22]<>0,RC[-22]&R4C32,"q") -> q | AF177: =IF(RC[-22]<>0,RC[-22]&R4C32,"q") -> q | AG177: =IF(RC[-22]<>0,RC[-22]&R4C32,"q") -> q | AH177: =IF(RC[-22]<>0,RC[-22]&R4C32,"q") -> q | AI177: =IF(RC[-22]<>0,RC[-22]&R4C32,"q") -> q | AJ177: =IF(RC[-22]<>0,RC[-22]&R4C32,"q") -> q | AK177: =IF(RC[-22]<>0,RC[-22]&R4C32,"q") -> q | AL177: =IF(RC[-22]<>0,RC[-22]&R4C32,"q") -> q | AM177: =IF(RC[-22]<>0,RC[-22]&R4C32,"q") -> q | AN177: =IF(RC[-22]<>0,RC[-22]&R4C32,"q") -> q | AO177: =IF(RC[-22]<>0,RC[-22]&R4C32,"q") -> q | AP177: =IF(RC[-22]<>0,RC[-22]&R4C32,"q") -> q | AQ177: =IF(RC[-22]<>0,RC[-22]&R4C32,"q") -> q | AR177: =IF(RC[-22]<>0,RC[-22]&R4C32,"q") -> q | AS177: =IF(RC[-22]<>0,RC[-22]&R4C32,"q") -> q | AT177: =IF(RC[-22]<>0,RC[-22]&R4C32,"q") -> q | AU177: =IF(RC[-22]<>0,RC[-22]&R4C32,"q") -> q | AV177: =IF(RC[-22]<>0,RC[-22]&R4C32,"q") -> q
AC178: =IF(RC[-22]<>0,RC[-22]&R4C32,"q") -> q | AD178: =IF(RC[-22]<>0,RC[-22]&R4C32,"q") -> q | AE178: =IF(RC[-22]<>0,RC[-22]&R4C32,"q") -> q | AF178: =IF(RC[-22]<>0,RC[-22]&R4C32,"q") -> q | AG178: =IF(RC[-22]<>0,RC[-22]&R4C32,"q") -> q | AH178: =IF(RC[-22]<>0,RC[-22]&R4C32,"q") -> q | AI178: =IF(RC[-22]<>0,RC[-22]&R4C32,"q") -> q | AJ178: =IF(RC[-22]<>0,RC[-22]&R4C32,"q") -> q | AK178: =IF(RC[-22]<>0,RC[-22]&R4C32,"q") -> q | AL178: =IF(RC[-22]<>0,RC[-22]&R4C32,"q") -> q | AM178: =IF(RC[-22]<>0,RC[-22]&R4C32,"q") -> q | AN178: =IF(RC[-22]<>0,RC[-22]&R4C32,"q") -> q | AO178: =IF(RC[-22]<>0,RC[-22]&R4C32,"q") -> q | AP178: =IF(RC[-22]<>0,RC[-22]&R4C32,"q") -> q | AQ178: =IF(RC[-22]<>0,RC[-22]&R4C32,"q") -> q | AR178: =IF(RC[-22]<>0,RC[-22]&R4C32,"q") -> q | AS178: =IF(RC[-22]<>0,RC[-22]&R4C32,"q") -> q | AT178: =IF(RC[-22]<>0,RC[-22]&R4C32,"q") -> q | AU178: =IF(RC[-22]<>0,RC[-22]&R4C32,"q") -> q | AV178: =IF(RC[-22]<>0,RC[-22]&R4C32,"q") -> q
AC179: =IF(RC[-22]<>0,RC[-22]&R4C32,"q") -> q | AD179: =IF(RC[-22]<>0,RC[-22]&R4C32,"q") -> q | AE179: =IF(RC[-22]<>0,RC[-22]&R4C32,"q") -> q | AF179: =IF(RC[-22]<>0,RC[-22]&R4C32,"q") -> q | AG179: =IF(RC[-22]<>0,RC[-22]&R4C32,"q") -> q | AH179: =IF(RC[-22]<>0,RC[-22]&R4C32,"q") -> q | AI179: =IF(RC[-22]<>0,RC[-22]&R4C32,"q") -> q | AJ179: =IF(RC[-22]<>0,RC[-22]&R4C32,"q") -> q | AK179: =IF(RC[-22]<>0,RC[-22]&R4C32,"q") -> q | AL179: =IF(RC[-22]<>0,RC[-22]&R4C32,"q") -> q | AM179: =IF(RC[-22]<>0,RC[-22]&R4C32,"q") -> q | AN179: =IF(RC[-22]<>0,RC[-22]&R4C32,"q") -> q | AO179: =IF(RC[-22]<>0,RC[-22]&R4C32,"q") -> q | AP179: =IF(RC[-22]<>0,RC[-22]&R4C32,"q") -> q | AQ179: =IF(RC[-22]<>0,RC[-22]&R4C32,"q") -> q | AR179: =IF(RC[-22]<>0,RC[-22]&R4C32,"q") -> q | AS179: =IF(RC[-22]<>0,RC[-22]&R4C32,"q") -> q | AT179: =IF(RC[-22]<>0,RC[-22]&R4C32,"q") -> q | AU179: =IF(RC[-22]<>0,RC[-22]&R4C32,"q") -> q | AV179: =IF(RC[-22]<>0,RC[-22]&R4C32,"q") -> q
AC180: =IF(RC[-22]<>0,RC[-22]&R4C32,"q") -> q | AD180: =IF(RC[-22]<>0,RC[-22]&R4C32,"q") -> q | AE180: =IF(RC[-22]<>0,RC[-22]&R4C32,"q") -> q | AF180: =IF(RC[-22]<>0,RC[-22]&R4C32,"q") -> q | AG180: =IF(RC[-22]<>0,RC[-22]&R4C32,"q") -> q | AH180: =IF(RC[-22]<>0,RC[-22]&R4C32,"q") -> q | AI180: =IF(RC[-22]<>0,RC[-22]&R4C32,"q") -> q | AJ180: =IF(RC[-22]<>0,RC[-22]&R4C32,"q") -> q | AK180: =IF(RC[-22]<>0,RC[-22]&R4C32,"q") -> q | AL180: =IF(RC[-22]<>0,RC[-22]&R4C32,"q") -> q | AM180: =IF(RC[-22]<>0,RC[-22]&R4C32,"q") -> q | AN180: =IF(RC[-22]<>0,RC[-22]&R4C32,"q") -> q | AO180: =IF(RC[-22]<>0,RC[-22]&R4C32,"q") -> q | AP180: =IF(RC[-22]<>0,RC[-22]&R4C32,"q") -> q | AQ180: =IF(RC[-22]<>0,RC[-22]&R4C32,"q") -> q | AR180: =IF(RC[-22]<>0,RC[-22]&R4C32,"q") -> q | AS180: =IF(RC[-22]<>0,RC[-22]&R4C32,"q") -> q | AT180: =IF(RC[-22]<>0,RC[-22]&R4C32,"q") -> q | AU180: =IF(RC[-22]<>0,RC[-22]&R4C32,"q") -> q | AV180: =IF(RC[-22]<>0,RC[-22]&R4C32,"q") -> q
AC181: =IF(RC[-22]<>0,RC[-22]&R4C32,"q") -> q | AD181: =IF(RC[-22]<>0,RC[-22]&R4C32,"q") -> q | AE181: =IF(RC[-22]<>0,RC[-22]&R4C32,"q") -> q | AF181: =IF(RC[-22]<>0,RC[-22]&R4C32,"q") -> q | AG181: =IF(RC[-22]<>0,RC[-22]&R4C32,"q") -> q | AH181: =IF(RC[-22]<>0,RC[-22]&R4C32,"q") -> q | AI181: =IF(RC[-22]<>0,RC[-22]&R4C32,"q") -> q | AJ181: =IF(RC[-22]<>0,RC[-22]&R4C32,"q") -> q | AK181: =IF(RC[-22]<>0,RC[-22]&R4C32,"q") -> q | AL181: =IF(RC[-22]<>0,RC[-22]&R4C32,"q") -> q | AM181: =IF(RC[-22]<>0,RC[-22]&R4C32,"q") -> q | AN181: =IF(RC[-22]<>0,RC[-22]&R4C32,"q") -> q | AO181: =IF(RC[-22]<>0,RC[-22]&R4C32,"q") -> q | AP181: =IF(RC[-22]<>0,RC[-22]&R4C32,"q") -> q | AQ181: =IF(RC[-22]<>0,RC[-22]&R4C32,"q") -> q | AR181: =IF(RC[-22]<>0,RC[-22]&R4C32,"q") -> q | AS181: =IF(RC[-22]<>0,RC[-22]&R4C32,"q") -> q | AT181: =IF(RC[-22]<>0,RC[-22]&R4C32,"q") -> q | AU181: =IF(RC[-22]<>0,RC[-22]&R4C32,"q") -> q | AV181: =IF(RC[-22]<>0,RC[-22]&R4C32,"q") -> q
AC182: =IF(RC[-22]<>0,RC[-22]&R4C32,"q") -> q | AD182: =IF(RC[-22]<>0,RC[-22]&R4C32,"q") -> q | AE182: =IF(RC[-22]<>0,RC[-22]&R4C32,"q") -> q | AF182: =IF(RC[-22]<>0,RC[-22]&R4C32,"q") -> q | AG182: =IF(RC[-22]<>0,RC[-22]&R4C32,"q") -> q | AH182: =IF(RC[-22]<>0,RC[-22]&R4C32,"q") -> q | AI182: =IF(RC[-22]<>0,RC[-22]&R4C32,"q") -> q | AJ182: =IF(RC[-22]<>0,RC[-22]&R4C32,"q") -> q | AK182: =IF(RC[-22]<>0,RC[-22]&R4C32,"q") -> q | AL182: =IF(RC[-22]<>0,RC[-22]&R4C32,"q") -> q | AM182: =IF(RC[-22]<>0,RC[-22]&R4C32,"q") -> q | AN182: =IF(RC[-22]<>0,RC[-22]&R4C32,"q") -> q | AO182: =IF(RC[-22]<>0,RC[-22]&R4C32,"q") -> q | AP182: =IF(RC[-22]<>0,RC[-22]&R4C32,"q") -> q | AQ182: =IF(RC[-22]<>0,RC[-22]&R4C32,"q") -> q | AR182: =IF(RC[-22]<>0,RC[-22]&R4C32,"q") -> q | AS182: =IF(RC[-22]<>0,RC[-22]&R4C32,"q") -> q | AT182: =IF(RC[-22]<>0,RC[-22]&R4C32,"q") -> q | AU182: =IF(RC[-22]<>0,RC[-22]&R4C32,"q") -> q | AV182: =IF(RC[-22]<>0,RC[-22]&R4C32,"q") -> q
AC183: =IF(RC[-22]<>0,RC[-22]&R4C32,"q") -> q | AD183: =IF(RC[-22]<>0,RC[-22]&R4C32,"q") -> q | AE183: =IF(RC[-22]<>0,RC[-22]&R4C32,"q") -> q | AF183: =IF(RC[-22]<>0,RC[-22]&R4C32,"q") -> q | AG183: =IF(RC[-22]<>0,RC[-22]&R4C32,"q") -> q | AH183: =IF(RC[-22]<>0,RC[-22]&R4C32,"q") -> q | AI183: =IF(RC[-22]<>0,RC[-22]&R4C32,"q") -> q | AJ183: =IF(RC[-22]<>0,RC[-22]&R4C32,"q") -> q | AK183: =IF(RC[-22]<>0,RC[-22]&R4C32,"q") -> q | AL183: =IF(RC[-22]<>0,RC[-22]&R4C32,"q") -> q | AM183: =IF(RC[-22]<>0,RC[-22]&R4C32,"q") -> q | AN183: =IF(RC[-22]<>0,RC[-22]&R4C32,"q") -> q | AO183: =IF(RC[-22]<>0,RC[-22]&R4C32,"q") -> q | AP183: =IF(RC[-22]<>0,RC[-22]&R4C32,"q") -> q | AQ183: =IF(RC[-22]<>0,RC[-22]&R4C32,"q") -> q | AR183: =IF(RC[-22]<>0,RC[-22]&R4C32,"q") -> q | AS183: =IF(RC[-22]<>0,RC[-22]&R4C32,"q") -> q | AT183: =IF(RC[-22]<>0,RC[-22]&R4C32,"q") -> q | AU183: =IF(RC[-22]<>0,RC[-22]&R4C32,"q") -> q | AV183: =IF(RC[-22]<>0,RC[-22]&R4C32,"q") -> q
AC184: =IF(RC[-22]<>0,RC[-22]&R4C32,"q") -> q | AD184: =IF(RC[-22]<>0,RC[-22]&R4C32,"q") -> q | AE184: =IF(RC[-22]<>0,RC[-22]&R4C32,"q") -> q | AF184: =IF(RC[-22]<>0,RC[-22]&R4C32,"q") -> q | AG184: =IF(RC[-22]<>0,RC[-22]&R4C32,"q") -> q | AH184: =IF(RC[-22]<>0,RC[-22]&R4C32,"q") -> q | AI184: =IF(RC[-22]<>0,RC[-22]&R4C32,"q") -> q | AJ184: =IF(RC[-22]<>0,RC[-22]&R4C32,"q") -> q | AK184: =IF(RC[-22]<>0,RC[-22]&R4C32,"q") -> q | AL184: =IF(RC[-22]<>0,RC[-22]&R4C32,"q") -> q | AM184: =IF(RC[-22]<>0,RC[-22]&R4C32,"q") -> q | AN184: =IF(RC[-22]<>0,RC[-22]&R4C32,"q") -> q | AO184: =IF(RC[-22]<>0,RC[-22]&R4C32,"q") -> q | AP184: =IF(RC[-22]<>0,RC[-22]&R4C32,"q") -> q | AQ184: =IF(RC[-22]<>0,RC[-22]&R4C32,"q") -> q | AR184: =IF(RC[-22]<>0,RC[-22]&R4C32,"q") -> q | AS184: =IF(RC[-22]<>0,RC[-22]&R4C32,"q") -> q | AT184: =IF(RC[-22]<>0,RC[-22]&R4C32,"q") -> q | AU184: =IF(RC[-22]<>0,RC[-22]&R4C32,"q") -> q | AV184: =IF(RC[-22]<>0,RC[-22]&R4C32,"q") -> q
AC185: =IF(RC[-22]<>0,RC[-22]&R4C32,"q") -> q | AD185: =IF(RC[-22]<>0,RC[-22]&R4C32,"q") -> q | AE185: =IF(RC[-22]<>0,RC[-22]&R4C32,"q") -> q | AF185: =IF(RC[-22]<>0,RC[-22]&R4C32,"q") -> q | AG185: =IF(RC[-22]<>0,RC[-22]&R4C32,"q") -> q | AH185: =IF(RC[-22]<>0,RC[-22]&R4C32,"q") -> q | AI185: =IF(RC[-22]<>0,RC[-22]&R4C32,"q") -> q | AJ185: =IF(RC[-22]<>0,RC[-22]&R4C32,"q") -> q | AK185: =IF(RC[-22]<>0,RC[-22]&R4C32,"q") -> q | AL185: =IF(RC[-22]<>0,RC[-22]&R4C32,"q") -> q | AM185: =IF(RC[-22]<>0,RC[-22]&R4C32,"q") -> q | AN185: =IF(RC[-22]<>0,RC[-22]&R4C32,"q") -> q | AO185: =IF(RC[-22]<>0,RC[-22]&R4C32,"q") -> q | AP185: =IF(RC[-22]<>0,RC[-22]&R4C32,"q") -> q | AQ185: =IF(RC[-22]<>0,RC[-22]&R4C32,"q") -> q | AR185: =IF(RC[-22]<>0,RC[-22]&R4C32,"q") -> q | AS185: =IF(RC[-22]<>0,RC[-22]&R4C32,"q") -> q | AT185: =IF(RC[-22]<>0,RC[-22]&R4C32,"q") -> q | AU185: =IF(RC[-22]<>0,RC[-22]&R4C32,"q") -> q | AV185: =IF(RC[-22]<>0,RC[-22]&R4C32,"q") -> q
AC186: =IF(RC[-22]<>0,RC[-22]&R4C32,"q") -> q | AD186: =IF(RC[-22]<>0,RC[-22]&R4C32,"q") -> q | AE186: =IF(RC[-22]<>0,RC[-22]&R4C32,"q") -> q | AF186: =IF(RC[-22]<>0,RC[-22]&R4C32,"q") -> q | AG186: =IF(RC[-22]<>0,RC[-22]&R4C32,"q") -> q | AH186: =IF(RC[-22]<>0,RC[-22]&R4C32,"q") -> q | AI186: =IF(RC[-22]<>0,RC[-22]&R4C32,"q") -> q | AJ186: =IF(RC[-22]<>0,RC[-22]&R4C32,"q") -> q | AK186: =IF(RC[-22]<>0,RC[-22]&R4C32,"q") -> q | AL186: =IF(RC[-22]<>0,RC[-22]&R4C32,"q") -> q | AM186: =IF(RC[-22]<>0,RC[-22]&R4C32,"q") -> q | AN186: =IF(RC[-22]<>0,RC[-22]&R4C32,"q") -> q | AO186: =IF(RC[-22]<>0,RC[-22]&R4C32,"q") -> q | AP186: =IF(RC[-22]<>0,RC[-22]&R4C32,"q") -> q | AQ186: =IF(RC[-22]<>0,RC[-22]&R4C32,"q") -> q | AR186: =IF(RC[-22]<>0,RC[-22]&R4C32,"q") -> q | AS186: =IF(RC[-22]<>0,RC[-22]&R4C32,"q") -> q | AT186: =IF(RC[-22]<>0,RC[-22]&R4C32,"q") -> q | AU186: =IF(RC[-22]<>0,RC[-22]&R4C32,"q") -> q | AV186: =IF(RC[-22]<>0,RC[-22]&R4C32,"q") -> q
AC187: =IF(RC[-22]<>0,RC[-22]&R4C32,"q") -> q | AD187: =IF(RC[-22]<>0,RC[-22]&R4C32,"q") -> q | AE187: =IF(RC[-22]<>0,RC[-22]&R4C32,"q") -> q | AF187: =IF(RC[-22]<>0,RC[-22]&R4C32,"q") -> q | AG187: =IF(RC[-22]<>0,RC[-22]&R4C32,"q") -> q | AH187: =IF(RC[-22]<>0,RC[-22]&R4C32,"q") -> q | AI187: =IF(RC[-22]<>0,RC[-22]&R4C32,"q") -> q | AJ187: =IF(RC[-22]<>0,RC[-22]&R4C32,"q") -> q | AK187: =IF(RC[-22]<>0,RC[-22]&R4C32,"q") -> q | AL187: =IF(RC[-22]<>0,RC[-22]&R4C32,"q") -> q | AM187: =IF(RC[-22]<>0,RC[-22]&R4C32,"q") -> q | AN187: =IF(RC[-22]<>0,RC[-22]&R4C32,"q") -> q | AO187: =IF(RC[-22]<>0,RC[-22]&R4C32,"q") -> q | AP187: =IF(RC[-22]<>0,RC[-22]&R4C32,"q") -> q | AQ187: =IF(RC[-22]<>0,RC[-22]&R4C32,"q") -> q | AR187: =IF(RC[-22]<>0,RC[-22]&R4C32,"q") -> q | AS187: =IF(RC[-22]<>0,RC[-22]&R4C32,"q") -> q | AT187: =IF(RC[-22]<>0,RC[-22]&R4C32,"q") -> q | AU187: =IF(RC[-22]<>0,RC[-22]&R4C32,"q") -> q | AV187: =IF(RC[-22]<>0,RC[-22]&R4C32,"q") -> q
AC188: =IF(RC[-22]<>0,RC[-22]&R4C32,"q") -> q | AD188: =IF(RC[-22]<>0,RC[-22]&R4C32,"q") -> q | AE188: =IF(RC[-22]<>0,RC[-22]&R4C32,"q") -> q | AF188: =IF(RC[-22]<>0,RC[-22]&R4C32,"q") -> q | AG188: =IF(RC[-22]<>0,RC[-22]&R4C32,"q") -> q | AH188: =IF(RC[-22]<>0,RC[-22]&R4C32,"q") -> q | AI188: =IF(RC[-22]<>0,RC[-22]&R4C32,"q") -> q | AJ188: =IF(RC[-22]<>0,RC[-22]&R4C32,"q") -> q | AK188: =IF(RC[-22]<>0,RC[-22]&R4C32,"q") -> q | AL188: =IF(RC[-22]<>0,RC[-22]&R4C32,"q") -> q | AM188: =IF(RC[-22]<>0,RC[-22]&R4C32,"q") -> q | AN188: =IF(RC[-22]<>0,RC[-22]&R4C32,"q") -> q | AO188: =IF(RC[-22]<>0,RC[-22]&R4C32,"q") -> q | AP188: =IF(RC[-22]<>0,RC[-22]&R4C32,"q") -> q | AQ188: =IF(RC[-22]<>0,RC[-22]&R4C32,"q") -> q | AR188: =IF(RC[-22]<>0,RC[-22]&R4C32,"q") -> q | AS188: =IF(RC[-22]<>0,RC[-22]&R4C32,"q") -> q | AT188: =IF(RC[-22]<>0,RC[-22]&R4C32,"q") -> q | AU188: =IF(RC[-22]<>0,RC[-22]&R4C32,"q") -> q | AV188: =IF(RC[-22]<>0,RC[-22]&R4C32,"q") -> q
AC189: =IF(RC[-22]<>0,RC[-22]&R4C32,"q") -> q | AD189: =IF(RC[-22]<>0,RC[-22]&R4C32,"q") -> q | AE189: =IF(RC[-22]<>0,RC[-22]&R4C32,"q") -> q | AF189: =IF(RC[-22]<>0,RC[-22]&R4C32,"q") -> q | AG189: =IF(RC[-22]<>0,RC[-22]&R4C32,"q") -> q | AH189: =IF(RC[-22]<>0,RC[-22]&R4C32,"q") -> q | AI189: =IF(RC[-22]<>0,RC[-22]&R4C32,"q") -> q | AJ189: =IF(RC[-22]<>0,RC[-22]&R4C32,"q") -> q | AK189: =IF(RC[-22]<>0,RC[-22]&R4C32,"q") -> q | AL189: =IF(RC[-22]<>0,RC[-22]&R4C32,"q") -> q | AM189: =IF(RC[-22]<>0,RC[-22]&R4C32,"q") -> q | AN189: =IF(RC[-22]<>0,RC[-22]&R4C32,"q") -> q | AO189: =IF(RC[-22]<>0,RC[-22]&R4C32,"q") -> q | AP189: =IF(RC[-22]<>0,RC[-22]&R4C32,"q") -> q | AQ189: =IF(RC[-22]<>0,RC[-22]&R4C32,"q") -> q | AR189: =IF(RC[-22]<>0,RC[-22]&R4C32,"q") -> q | AS189: =IF(RC[-22]<>0,RC[-22]&R4C32,"q") -> q | AT189: =IF(RC[-22]<>0,RC[-22]&R4C32,"q") -> q | AU189: =IF(RC[-22]<>0,RC[-22]&R4C32,"q") -> q | AV189: =IF(RC[-22]<>0,RC[-22]&R4C32,"q") -> q
AC190: =IF(RC[-22]<>0,RC[-22]&R4C32,"q") -> q | AD190: =IF(RC[-22]<>0,RC[-22]&R4C32,"q") -> q | AE190: =IF(RC[-22]<>0,RC[-22]&R4C32,"q") -> q | AF190: =IF(RC[-22]<>0,RC[-22]&R4C32,"q") -> q | AG190: =IF(RC[-22]<>0,RC[-22]&R4C32,"q") -> q | AH190: =IF(RC[-22]<>0,RC[-22]&R4C32,"q") -> q | AI190: =IF(RC[-22]<>0,RC[-22]&R4C32,"q") -> q | AJ190: =IF(RC[-22]<>0,RC[-22]&R4C32,"q") -> q | AK190: =IF(RC[-22]<>0,RC[-22]&R4C32,"q") -> q | AL190: =IF(RC[-22]<>0,RC[-22]&R4C32,"q") -> q | AM190: =IF(RC[-22]<>0,RC[-22]&R4C32,"q") -> q | AN190: =IF(RC[-22]<>0,RC[-22]&R4C32,"q") -> q | AO190: =IF(RC[-22]<>0,RC[-22]&R4C32,"q") -> q | AP190: =IF(RC[-22]<>0,RC[-22]&R4C32,"q") -> q | AQ190: =IF(RC[-22]<>0,RC[-22]&R4C32,"q") -> q | AR190: =IF(RC[-22]<>0,RC[-22]&R4C32,"q") -> q | AS190: =IF(RC[-22]<>0,RC[-22]&R4C32,"q") -> q | AT190: =IF(RC[-22]<>0,RC[-22]&R4C32,"q") -> q | AU190: =IF(RC[-22]<>0,RC[-22]&R4C32,"q") -> q | AV190: =IF(RC[-22]<>0,RC[-22]&R4C32,"q") -> q
AC191: =IF(RC[-22]<>0,RC[-22]&R4C32,"q") -> q | AD191: =IF(RC[-22]<>0,RC[-22]&R4C32,"q") -> q | AE191: =IF(RC[-22]<>0,RC[-22]&R4C32,"q") -> q | AF191: =IF(RC[-22]<>0,RC[-22]&R4C32,"q") -> q | AG191: =IF(RC[-22]<>0,RC[-22]&R4C32,"q") -> q | AH191: =IF(RC[-22]<>0,RC[-22]&R4C32,"q") -> q | AI191: =IF(RC[-22]<>0,RC[-22]&R4C32,"q") -> q | AJ191: =IF(RC[-22]<>0,RC[-22]&R4C32,"q") -> q | AK191: =IF(RC[-22]<>0,RC[-22]&R4C32,"q") -> q | AL191: =IF(RC[-22]<>0,RC[-22]&R4C32,"q") -> q | AM191: =IF(RC[-22]<>0,RC[-22]&R4C32,"q") -> q | AN191: =IF(RC[-22]<>0,RC[-22]&R4C32,"q") -> q | AO191: =IF(RC[-22]<>0,RC[-22]&R4C32,"q") -> q | AP191: =IF(RC[-22]<>0,RC[-22]&R4C32,"q") -> q | AQ191: =IF(RC[-22]<>0,RC[-22]&R4C32,"q") -> q | AR191: =IF(RC[-22]<>0,RC[-22]&R4C32,"q") -> q | AS191: =IF(RC[-22]<>0,RC[-22]&R4C32,"q") -> q | AT191: =IF(RC[-22]<>0,RC[-22]&R4C32,"q") -> q | AU191: =IF(RC[-22]<>0,RC[-22]&R4C32,"q") -> q | AV191: =IF(RC[-22]<>0,RC[-22]&R4C32,"q") -> q
AC192: =IF(RC[-22]<>0,RC[-22]&R4C32,"q") -> q | AD192: =IF(RC[-22]<>0,RC[-22]&R4C32,"q") -> q | AE192: =IF(RC[-22]<>0,RC[-22]&R4C32,"q") -> q | AF192: =IF(RC[-22]<>0,RC[-22]&R4C32,"q") -> q | AG192: =IF(RC[-22]<>0,RC[-22]&R4C32,"q") -> q | AH192: =IF(RC[-22]<>0,RC[-22]&R4C32,"q") -> q | AI192: =IF(RC[-22]<>0,RC[-22]&R4C32,"q") -> q | AJ192: =IF(RC[-22]<>0,RC[-22]&R4C32,"q") -> q | AK192: =IF(RC[-22]<>0,RC[-22]&R4C32,"q") -> q | AL192: =IF(RC[-22]<>0,RC[-22]&R4C32,"q") -> q | AM192: =IF(RC[-22]<>0,RC[-22]&R4C32,"q") -> q | AN192: =IF(RC[-22]<>0,RC[-22]&R4C32,"q") -> q | AO192: =IF(RC[-22]<>0,RC[-22]&R4C32,"q") -> q | AP192: =IF(RC[-22]<>0,RC[-22]&R4C32,"q") -> q | AQ192: =IF(RC[-22]<>0,RC[-22]&R4C32,"q") -> q | AR192: =IF(RC[-22]<>0,RC[-22]&R4C32,"q") -> q | AS192: =IF(RC[-22]<>0,RC[-22]&R4C32,"q") -> q | AT192: =IF(RC[-22]<>0,RC[-22]&R4C32,"q") -> q | AU192: =IF(RC[-22]<>0,RC[-22]&R4C32,"q") -> q | AV192: =IF(RC[-22]<>0,RC[-22]&R4C32,"q") -> q
AC193: =IF(RC[-22]<>0,RC[-22]&R4C32,"q") -> q | AD193: =IF(RC[-22]<>0,RC[-22]&R4C32,"q") -> q | AE193: =IF(RC[-22]<>0,RC[-22]&R4C32,"q") -> q | AF193: =IF(RC[-22]<>0,RC[-22]&R4C32,"q") -> q | AG193: =IF(RC[-22]<>0,RC[-22]&R4C32,"q") -> q | AH193: =IF(RC[-22]<>0,RC[-22]&R4C32,"q") -> q | AI193: =IF(RC[-22]<>0,RC[-22]&R4C32,"q") -> q | AJ193: =IF(RC[-22]<>0,RC[-22]&R4C32,"q") -> q | AK193: =IF(RC[-22]<>0,RC[-22]&R4C32,"q") -> q | AL193: =IF(RC[-22]<>0,RC[-22]&R4C32,"q") -> q | AM193: =IF(RC[-22]<>0,RC[-22]&R4C32,"q") -> q | AN193: =IF(RC[-22]<>0,RC[-22]&R4C32,"q") -> q | AO193: =IF(RC[-22]<>0,RC[-22]&R4C32,"q") -> q | AP193: =IF(RC[-22]<>0,RC[-22]&R4C32,"q") -> q | AQ193: =IF(RC[-22]<>0,RC[-22]&R4C32,"q") -> q | AR193: =IF(RC[-22]<>0,RC[-22]&R4C32,"q") -> q | AS193: =IF(RC[-22]<>0,RC[-22]&R4C32,"q") -> q | AT193: =IF(RC[-22]<>0,RC[-22]&R4C32,"q") -> q | AU193: =IF(RC[-22]<>0,RC[-22]&R4C32,"q") -> q | AV193: =IF(RC[-22]<>0,RC[-22]&R4C32,"q") -> q
AC194: =IF(RC[-22]<>0,RC[-22]&R4C32,"q") -> q | AD194: =IF(RC[-22]<>0,RC[-22]&R4C32,"q") -> q | AE194: =IF(RC[-22]<>0,RC[-22]&R4C32,"q") -> q | AF194: =IF(RC[-22]<>0,RC[-22]&R4C32,"q") -> q | AG194: =IF(RC[-22]<>0,RC[-22]&R4C32,"q") -> q | AH194: =IF(RC[-22]<>0,RC[-22]&R4C32,"q") -> q | AI194: =IF(RC[-22]<>0,RC[-22]&R4C32,"q") -> q | AJ194: =IF(RC[-22]<>0,RC[-22]&R4C32,"q") -> q | AK194: =IF(RC[-22]<>0,RC[-22]&R4C32,"q") -> q | AL194: =IF(RC[-22]<>0,RC[-22]&R4C32,"q") -> q | AM194: =IF(RC[-22]<>0,RC[-22]&R4C32,"q") -> q | AN194: =IF(RC[-22]<>0,RC[-22]&R4C32,"q") -> q | AO194: =IF(RC[-22]<>0,RC[-22]&R4C32,"q") -> q | AP194: =IF(RC[-22]<>0,RC[-22]&R4C32,"q") -> q | AQ194: =IF(RC[-22]<>0,RC[-22]&R4C32,"q") -> q | AR194: =IF(RC[-22]<>0,RC[-22]&R4C32,"q") -> q | AS194: =IF(RC[-22]<>0,RC[-22]&R4C32,"q") -> q | AT194: =IF(RC[-22]<>0,RC[-22]&R4C32,"q") -> q | AU194: =IF(RC[-22]<>0,RC[-22]&R4C32,"q") -> q | AV194: =IF(RC[-22]<>0,RC[-22]&R4C32,"q") -> q
AC195: =IF(RC[-22]<>0,RC[-22]&R4C32,"q") -> q | AD195: =IF(RC[-22]<>0,RC[-22]&R4C32,"q") -> q | AE195: =IF(RC[-22]<>0,RC[-22]&R4C32,"q") -> q | AF195: =IF(RC[-22]<>0,RC[-22]&R4C32,"q") -> q | AG195: =IF(RC[-22]<>0,RC[-22]&R4C32,"q") -> q | AH195: =IF(RC[-22]<>0,RC[-22]&R4C32,"q") -> q | AI195: =IF(RC[-22]<>0,RC[-22]&R4C32,"q") -> q | AJ195: =IF(RC[-22]<>0,RC[-22]&R4C32,"q") -> q | AK195: =IF(RC[-22]<>0,RC[-22]&R4C32,"q") -> q | AL195: =IF(RC[-22]<>0,RC[-22]&R4C32,"q") -> q | AM195: =IF(RC[-22]<>0,RC[-22]&R4C32,"q") -> q | AN195: =IF(RC[-22]<>0,RC[-22]&R4C32,"q") -> q | AO195: =IF(RC[-22]<>0,RC[-22]&R4C32,"q") -> q | AP195: =IF(RC[-22]<>0,RC[-22]&R4C32,"q") -> q | AQ195: =IF(RC[-22]<>0,RC[-22]&R4C32,"q") -> q | AR195: =IF(RC[-22]<>0,RC[-22]&R4C32,"q") -> q | AS195: =IF(RC[-22]<>0,RC[-22]&R4C32,"q") -> q | AT195: =IF(RC[-22]<>0,RC[-22]&R4C32,"q") -> q | AU195: =IF(RC[-22]<>0,RC[-22]&R4C32,"q") -> q | AV195: =IF(RC[-22]<>0,RC[-22]&R4C32,"q") -> q
AC196: =IF(RC[-22]<>0,RC[-22]&R4C32,"q") -> q | AD196: =IF(RC[-22]<>0,RC[-22]&R4C32,"q") -> q | AE196: =IF(RC[-22]<>0,RC[-22]&R4C32,"q") -> q | AF196: =IF(RC[-22]<>0,RC[-22]&R4C32,"q") -> q | AG196: =IF(RC[-22]<>0,RC[-22]&R4C32,"q") -> q | AH196: =IF(RC[-22]<>0,RC[-22]&R4C32,"q") -> q | AI196: =IF(RC[-22]<>0,RC[-22]&R4C32,"q") -> q | AJ196: =IF(RC[-22]<>0,RC[-22]&R4C32,"q") -> q | AK196: =IF(RC[-22]<>0,RC[-22]&R4C32,"q") -> q | AL196: =IF(RC[-22]<>0,RC[-22]&R4C32,"q") -> q | AM196: =IF(RC[-22]<>0,RC[-22]&R4C32,"q") -> q | AN196: =IF(RC[-22]<>0,RC[-22]&R4C32,"q") -> q | AO196: =IF(RC[-22]<>0,RC[-22]&R4C32,"q") -> q | AP196: =IF(RC[-22]<>0,RC[-22]&R4C32,"q") -> q | AQ196: =IF(RC[-22]<>0,RC[-22]&R4C32,"q") -> q | AR196: =IF(RC[-22]<>0,RC[-22]&R4C32,"q") -> q | AS196: =IF(RC[-22]<>0,RC[-22]&R4C32,"q") -> q | AT196: =IF(RC[-22]<>0,RC[-22]&R4C32,"q") -> q | AU196: =IF(RC[-22]<>0,RC[-22]&R4C32,"q") -> q | AV196: =IF(RC[-22]<>0,RC[-22]&R4C32,"q") -> q
AC197: =IF(RC[-22]<>0,RC[-22]&R4C32,"q") -> q | AD197: =IF(RC[-22]<>0,RC[-22]&R4C32,"q") -> q | AE197: =IF(RC[-22]<>0,RC[-22]&R4C32,"q") -> q | AF197: =IF(RC[-22]<>0,RC[-22]&R4C32,"q") -> q | AG197: =IF(RC[-22]<>0,RC[-22]&R4C32,"q") -> q | AH197: =IF(RC[-22]<>0,RC[-22]&R4C32,"q") -> q | AI197: =IF(RC[-22]<>0,RC[-22]&R4C32,"q") -> q | AJ197: =IF(RC[-22]<>0,RC[-22]&R4C32,"q") -> q | AK197: =IF(RC[-22]<>0,RC[-22]&R4C32,"q") -> q | AL197: =IF(RC[-22]<>0,RC[-22]&R4C32,"q") -> q | AM197: =IF(RC[-22]<>0,RC[-22]&R4C32,"q") -> q | AN197: =IF(RC[-22]<>0,RC[-22]&R4C32,"q") -> q | AO197: =IF(RC[-22]<>0,RC[-22]&R4C32,"q") -> q | AP197: =IF(RC[-22]<>0,RC[-22]&R4C32,"q") -> q | AQ197: =IF(RC[-22]<>0,RC[-22]&R4C32,"q") -> q | AR197: =IF(RC[-22]<>0,RC[-22]&R4C32,"q") -> q | AS197: =IF(RC[-22]<>0,RC[-22]&R4C32,"q") -> q | AT197: =IF(RC[-22]<>0,RC[-22]&R4C32,"q") -> q | AU197: =IF(RC[-22]<>0,RC[-22]&R4C32,"q") -> q | AV197: =IF(RC[-22]<>0,RC[-22]&R4C32,"q") -> q
AC198: =IF(RC[-22]<>0,RC[-22]&R4C32,"q") -> q | AD198: =IF(RC[-22]<>0,RC[-22]&R4C32,"q") -> q | AE198: =IF(RC[-22]<>0,RC[-22]&R4C32,"q") -> q | AF198: =IF(RC[-22]<>0,RC[-22]&R4C32,"q") -> q | AG198: =IF(RC[-22]<>0,RC[-22]&R4C32,"q") -> q | AH198: =IF(RC[-22]<>0,RC[-22]&R4C32,"q") -> q | AI198: =IF(RC[-22]<>0,RC[-22]&R4C32,"q") -> q | AJ198: =IF(RC[-22]<>0,RC[-22]&R4C32,"q") -> q | AK198: =IF(RC[-22]<>0,RC[-22]&R4C32,"q") -> q | AL198: =IF(RC[-22]<>0,RC[-22]&R4C32,"q") -> q | AM198: =IF(RC[-22]<>0,RC[-22]&R4C32,"q") -> q | AN198: =IF(RC[-22]<>0,RC[-22]&R4C32,"q") -> q | AO198: =IF(RC[-22]<>0,RC[-22]&R4C32,"q") -> q | AP198: =IF(RC[-22]<>0,RC[-22]&R4C32,"q") -> q | AQ198: =IF(RC[-22]<>0,RC[-22]&R4C32,"q") -> q | AR198: =IF(RC[-22]<>0,RC[-22]&R4C32,"q") -> q | AS198: =IF(RC[-22]<>0,RC[-22]&R4C32,"q") -> q | AT198: =IF(RC[-22]<>0,RC[-22]&R4C32,"q") -> q | AU198: =IF(RC[-22]<>0,RC[-22]&R4C32,"q") -> q | AV198: =IF(RC[-22]<>0,RC[-22]&R4C32,"q") -> q
AC199: =IF(RC[-22]<>0,RC[-22]&R4C32,"q") -> q | AD199: =IF(RC[-22]<>0,RC[-22]&R4C32,"q") -> q | AE199: =IF(RC[-22]<>0,RC[-22]&R4C32,"q") -> q | AF199: =IF(RC[-22]<>0,RC[-22]&R4C32,"q") -> q | AG199: =IF(RC[-22]<>0,RC[-22]&R4C32,"q") -> q | AH199: =IF(RC[-22]<>0,RC[-22]&R4C32,"q") -> q | AI199: =IF(RC[-22]<>0,RC[-22]&R4C32,"q") -> q | AJ199: =IF(RC[-22]<>0,RC[-22]&R4C32,"q") -> q | AK199: =IF(RC[-22]<>0,RC[-22]&R4C32,"q") -> q | AL199: =IF(RC[-22]<>0,RC[-22]&R4C32,"q") -> q | AM199: =IF(RC[-22]<>0,RC[-22]&R4C32,"q") -> q | AN199: =IF(RC[-22]<>0,RC[-22]&R4C32,"q") -> q | AO199: =IF(RC[-22]<>0,RC[-22]&R4C32,"q") -> q | AP199: =IF(RC[-22]<>0,RC[-22]&R4C32,"q") -> q | AQ199: =IF(RC[-22]<>0,RC[-22]&R4C32,"q") -> q | AR199: =IF(RC[-22]<>0,RC[-22]&R4C32,"q") -> q | AS199: =IF(RC[-22]<>0,RC[-22]&R4C32,"q") -> q | AT199: =IF(RC[-22]<>0,RC[-22]&R4C32,"q") -> q | AU199: =IF(RC[-22]<>0,RC[-22]&R4C32,"q") -> q | AV199: =IF(RC[-22]<>0,RC[-22]&R4C32,"q") -> q
AC200: =IF(RC[-22]<>0,RC[-22]&R4C32,"q") -> q | AD200: =IF(RC[-22]<>0,RC[-22]&R4C32,"q") -> q | AE200: =IF(RC[-22]<>0,RC[-22]&R4C32,"q") -> q | AF200: =IF(RC[-22]<>0,RC[-22]&R4C32,"q") -> q | AG200: =IF(RC[-22]<>0,RC[-22]&R4C32,"q") -> q | AH200: =IF(RC[-22]<>0,RC[-22]&R4C32,"q") -> q | AI200: =IF(RC[-22]<>0,RC[-22]&R4C32,"q") -> q | AJ200: =IF(RC[-22]<>0,RC[-22]&R4C32,"q") -> q | AK200: =IF(RC[-22]<>0,RC[-22]&R4C32,"q") -> q | AL200: =IF(RC[-22]<>0,RC[-22]&R4C32,"q") -> q | AM200: =IF(RC[-22]<>0,RC[-22]&R4C32,"q") -> q | AN200: =IF(RC[-22]<>0,RC[-22]&R4C32,"q") -> q | AO200: =IF(RC[-22]<>0,RC[-22]&R4C32,"q") -> q | AP200: =IF(RC[-22]<>0,RC[-22]&R4C32,"q") -> q | AQ200: =IF(RC[-22]<>0,RC[-22]&R4C32,"q") -> q | AR200: =IF(RC[-22]<>0,RC[-22]&R4C32,"q") -> q | AS200: =IF(RC[-22]<>0,RC[-22]&R4C32,"q") -> q | AT200: =IF(RC[-22]<>0,RC[-22]&R4C32,"q") -> q | AU200: =IF(RC[-22]<>0,RC[-22]&R4C32,"q") -> q | AV200: =IF(RC[-22]<>0,RC[-22]&R4C32,"q") -> q
AC201: =IF(RC[-22]<>0,RC[-22]&R4C32,"q") -> q | AD201: =IF(RC[-22]<>0,RC[-22]&R4C32,"q") -> q | AE201: =IF(RC[-22]<>0,RC[-22]&R4C32,"q") -> q | AF201: =IF(RC[-22]<>0,RC[-22]&R4C32,"q") -> q | AG201: =IF(RC[-22]<>0,RC[-22]&R4C32,"q") -> q | AH201: =IF(RC[-22]<>0,RC[-22]&R4C32,"q") -> q | AI201: =IF(RC[-22]<>0,RC[-22]&R4C32,"q") -> q | AJ201: =IF(RC[-22]<>0,RC[-22]&R4C32,"q") -> q | AK201: =IF(RC[-22]<>0,RC[-22]&R4C32,"q") -> q | AL201: =IF(RC[-22]<>0,RC[-22]&R4C32,"q") -> q | AM201: =IF(RC[-22]<>0,RC[-22]&R4C32,"q") -> q | AN201: =IF(RC[-22]<>0,RC[-22]&R4C32,"q") -> q | AO201: =IF(RC[-22]<>0,RC[-22]&R4C32,"q") -> q | AP201: =IF(RC[-22]<>0,RC[-22]&R4C32,"q") -> q | AQ201: =IF(RC[-22]<>0,RC[-22]&R4C32,"q") -> q | AR201: =IF(RC[-22]<>0,RC[-22]&R4C32,"q") -> q | AS201: =IF(RC[-22]<>0,RC[-22]&R4C32,"q") -> q | AT201: =IF(RC[-22]<>0,RC[-22]&R4C32,"q") -> q | AU201: =IF(RC[-22]<>0,RC[-22]&R4C32,"q") -> q | AV201: =IF(RC[-22]<>0,RC[-22]&R4C32,"q") -> q
AC202: =IF(RC[-22]<>0,RC[-22]&R4C32,"q") -> q | AD202: =IF(RC[-22]<>0,RC[-22]&R4C32,"q") -> q | AE202: =IF(RC[-22]<>0,RC[-22]&R4C32,"q") -> q | AF202: =IF(RC[-22]<>0,RC[-22]&R4C32,"q") -> q | AG202: =IF(RC[-22]<>0,RC[-22]&R4C32,"q") -> q | AH202: =IF(RC[-22]<>0,RC[-22]&R4C32,"q") -> q | AI202: =IF(RC[-22]<>0,RC[-22]&R4C32,"q") -> q | AJ202: =IF(RC[-22]<>0,RC[-22]&R4C32,"q") -> q | AK202: =IF(RC[-22]<>0,RC[-22]&R4C32,"q") -> q | AL202: =IF(RC[-22]<>0,RC[-22]&R4C32,"q") -> q | AM202: =IF(RC[-22]<>0,RC[-22]&R4C32,"q") -> q | AN202: =IF(RC[-22]<>0,RC[-22]&R4C32,"q") -> q | AO202: =IF(RC[-22]<>0,RC[-22]&R4C32,"q") -> q | AP202: =IF(RC[-22]<>0,RC[-22]&R4C32,"q") -> q | AQ202: =IF(RC[-22]<>0,RC[-22]&R4C32,"q") -> q | AR202: =IF(RC[-22]<>0,RC[-22]&R4C32,"q") -> q | AS202: =IF(RC[-22]<>0,RC[-22]&R4C32,"q") -> q | AT202: =IF(RC[-22]<>0,RC[-22]&R4C32,"q") -> q | AU202: =IF(RC[-22]<>0,RC[-22]&R4C32,"q") -> q | AV202: =IF(RC[-22]<>0,RC[-22]&R4C32,"q") -> q
AC203: =IF(RC[-22]<>0,RC[-22]&R4C32,"q") -> q | AD203: =IF(RC[-22]<>0,RC[-22]&R4C32,"q") -> q | AE203: =IF(RC[-22]<>0,RC[-22]&R4C32,"q") -> q | AF203: =IF(RC[-22]<>0,RC[-22]&R4C32,"q") -> q | AG203: =IF(RC[-22]<>0,RC[-22]&R4C32,"q") -> q | AH203: =IF(RC[-22]<>0,RC[-22]&R4C32,"q") -> q | AI203: =IF(RC[-22]<>0,RC[-22]&R4C32,"q") -> q | AJ203: =IF(RC[-22]<>0,RC[-22]&R4C32,"q") -> q | AK203: =IF(RC[-22]<>0,RC[-22]&R4C32,"q") -> q | AL203: =IF(RC[-22]<>0,RC[-22]&R4C32,"q") -> q | AM203: =IF(RC[-22]<>0,RC[-22]&R4C32,"q") -> q | AN203: =IF(RC[-22]<>0,RC[-22]&R4C32,"q") -> q | AO203: =IF(RC[-22]<>0,RC[-22]&R4C32,"q") -> q | AP203: =IF(RC[-22]<>0,RC[-22]&R4C32,"q") -> q | AQ203: =IF(RC[-22]<>0,RC[-22]&R4C32,"q") -> q | AR203: =IF(RC[-22]<>0,RC[-22]&R4C32,"q") -> q | AS203: =IF(RC[-22]<>0,RC[-22]&R4C32,"q") -> q | AT203: =IF(RC[-22]<>0,RC[-22]&R4C32,"q") -> q | AU203: =IF(RC[-22]<>0,RC[-22]&R4C32,"q") -> q | AV203: =IF(RC[-22]<>0,RC[-22]&R4C32,"q") -> q
AC204: =IF(RC[-22]<>0,RC[-22]&R4C32,"q") -> q | AD204: =IF(RC[-22]<>0,RC[-22]&R4C32,"q") -> q | AE204: =IF(RC[-22]<>0,RC[-22]&R4C32,"q") -> q | AF204: =IF(RC[-22]<>0,RC[-22]&R4C32,"q") -> q | AG204: =IF(RC[-22]<>0,RC[-22]&R4C32,"q") -> q | AH204: =IF(RC[-22]<>0,RC[-22]&R4C32,"q") -> q | AI204: =IF(RC[-22]<>0,RC[-22]&R4C32,"q") -> q | AJ204: =IF(RC[-22]<>0,RC[-22]&R4C32,"q") -> q | AK204: =IF(RC[-22]<>0,RC[-22]&R4C32,"q") -> q | AL204: =IF(RC[-22]<>0,RC[-22]&R4C32,"q") -> q | AM204: =IF(RC[-22]<>0,RC[-22]&R4C32,"q") -> q | AN204: =IF(RC[-22]<>0,RC[-22]&R4C32,"q") -> q | AO204: =IF(RC[-22]<>0,RC[-22]&R4C32,"q") -> q | AP204: =IF(RC[-22]<>0,RC[-22]&R4C32,"q") -> q | AQ204: =IF(RC[-22]<>0,RC[-22]&R4C32,"q") -> q | AR204: =IF(RC[-22]<>0,RC[-22]&R4C32,"q") -> q | AS204: =IF(RC[-22]<>0,RC[-22]&R4C32,"q") -> q | AT204: =IF(RC[-22]<>0,RC[-22]&R4C32,"q") -> q | AU204: =IF(RC[-22]<>0,RC[-22]&R4C32,"q") -> q | AV204: =IF(RC[-22]<>0,RC[-22]&R4C32,"q") -> q
AC205: =IF(RC[-22]<>0,RC[-22]&R4C32,"q") -> q | AD205: =IF(RC[-22]<>0,RC[-22]&R4C32,"q") -> q | AE205: =IF(RC[-22]<>0,RC[-22]&R4C32,"q") -> q | AF205: =IF(RC[-22]<>0,RC[-22]&R4C32,"q") -> q | AG205: =IF(RC[-22]<>0,RC[-22]&R4C32,"q") -> q | AH205: =IF(RC[-22]<>0,RC[-22]&R4C32,"q") -> q | AI205: =IF(RC[-22]<>0,RC[-22]&R4C32,"q") -> q | AJ205: =IF(RC[-22]<>0,RC[-22]&R4C32,"q") -> q | AK205: =IF(RC[-22]<>0,RC[-22]&R4C32,"q") -> q | AL205: =IF(RC[-22]<>0,RC[-22]&R4C32,"q") -> q | AM205: =IF(RC[-22]<>0,RC[-22]&R4C32,"q") -> q | AN205: =IF(RC[-22]<>0,RC[-22]&R4C32,"q") -> q | AO205: =IF(RC[-22]<>0,RC[-22]&R4C32,"q") -> q | AP205: =IF(RC[-22]<>0,RC[-22]&R4C32,"q") -> q | AQ205: =IF(RC[-22]<>0,RC[-22]&R4C32,"q") -> q | AR205: =IF(RC[-22]<>0,RC[-22]&R4C32,"q") -> q | AS205: =IF(RC[-22]<>0,RC[-22]&R4C32,"q") -> q | AT205: =IF(RC[-22]<>0,RC[-22]&R4C32,"q") -> q | AU205: =IF(RC[-22]<>0,RC[-22]&R4C32,"q") -> q | AV205: =IF(RC[-22]<>0,RC[-22]&R4C32,"q") -> q
AC206: =IF(RC[-22]<>0,RC[-22]&R4C32,"q") -> q | AD206: =IF(RC[-22]<>0,RC[-22]&R4C32,"q") -> q | AE206: =IF(RC[-22]<>0,RC[-22]&R4C32,"q") -> q | AF206: =IF(RC[-22]<>0,RC[-22]&R4C32,"q") -> q | AG206: =IF(RC[-22]<>0,RC[-22]&R4C32,"q") -> q | AH206: =IF(RC[-22]<>0,RC[-22]&R4C32,"q") -> q | AI206: =IF(RC[-22]<>0,RC[-22]&R4C32,"q") -> q | AJ206: =IF(RC[-22]<>0,RC[-22]&R4C32,"q") -> q | AK206: =IF(RC[-22]<>0,RC[-22]&R4C32,"q") -> q | AL206: =IF(RC[-22]<>0,RC[-22]&R4C32,"q") -> q | AM206: =IF(RC[-22]<>0,RC[-22]&R4C32,"q") -> q | AN206: =IF(RC[-22]<>0,RC[-22]&R4C32,"q") -> q | AO206: =IF(RC[-22]<>0,RC[-22]&R4C32,"q") -> q | AP206: =IF(RC[-22]<>0,RC[-22]&R4C32,"q") -> q | AQ206: =IF(RC[-22]<>0,RC[-22]&R4C32,"q") -> q | AR206: =IF(RC[-22]<>0,RC[-22]&R4C32,"q") -> q | AS206: =IF(RC[-22]<>0,RC[-22]&R4C32,"q") -> q | AT206: =IF(RC[-22]<>0,RC[-22]&R4C32,"q") -> q | AU206: =IF(RC[-22]<>0,RC[-22]&R4C32,"q") -> q | AV206: =IF(RC[-22]<>0,RC[-22]&R4C32,"q") -> q
AC207: =IF(RC[-22]<>0,RC[-22]&R4C32,"q") -> q | AD207: =IF(RC[-22]<>0,RC[-22]&R4C32,"q") -> q | AE207: =IF(RC[-22]<>0,RC[-22]&R4C32,"q") -> q | AF207: =IF(RC[-22]<>0,RC[-22]&R4C32,"q") -> q | AG207: =IF(RC[-22]<>0,RC[-22]&R4C32,"q") -> q | AH207: =IF(RC[-22]<>0,RC[-22]&R4C32,"q") -> q | AI207: =IF(RC[-22]<>0,RC[-22]&R4C32,"q") -> q | AJ207: =IF(RC[-22]<>0,RC[-22]&R4C32,"q") -> q | AK207: =IF(RC[-22]<>0,RC[-22]&R4C32,"q") -> q | AL207: =IF(RC[-22]<>0,RC[-22]&R4C32,"q") -> q | AM207: =IF(RC[-22]<>0,RC[-22]&R4C32,"q") -> q | AN207: =IF(RC[-22]<>0,RC[-22]&R4C32,"q") -> q | AO207: =IF(RC[-22]<>0,RC[-22]&R4C32,"q") -> q | AP207: =IF(RC[-22]<>0,RC[-22]&R4C32,"q") -> q | AQ207: =IF(RC[-22]<>0,RC[-22]&R4C32,"q") -> q | AR207: =IF(RC[-22]<>0,RC[-22]&R4C32,"q") -> q | AS207: =IF(RC[-22]<>0,RC[-22]&R4C32,"q") -> q | AT207: =IF(RC[-22]<>0,RC[-22]&R4C32,"q") -> q | AU207: =IF(RC[-22]<>0,RC[-22]&R4C32,"q") -> q | AV207: =IF(RC[-22]<>0,RC[-22]&R4C32,"q") -> q
AC208: =IF(RC[-22]<>0,RC[-22]&R4C32,"q") -> q | AD208: =IF(RC[-22]<>0,RC[-22]&R4C32,"q") -> q | AE208: =IF(RC[-22]<>0,RC[-22]&R4C32,"q") -> q | AF208: =IF(RC[-22]<>0,RC[-22]&R4C32,"q") -> q | AG208: =IF(RC[-22]<>0,RC[-22]&R4C32,"q") -> q | AH208: =IF(RC[-22]<>0,RC[-22]&R4C32,"q") -> q | AI208: =IF(RC[-22]<>0,RC[-22]&R4C32,"q") -> q | AJ208: =IF(RC[-22]<>0,RC[-22]&R4C32,"q") -> q | AK208: =IF(RC[-22]<>0,RC[-22]&R4C32,"q") -> q | AL208: =IF(RC[-22]<>0,RC[-22]&R4C32,"q") -> q | AM208: =IF(RC[-22]<>0,RC[-22]&R4C32,"q") -> q | AN208: =IF(RC[-22]<>0,RC[-22]&R4C32,"q") -> q | AO208: =IF(RC[-22]<>0,RC[-22]&R4C32,"q") -> q | AP208: =IF(RC[-22]<>0,RC[-22]&R4C32,"q") -> q | AQ208: =IF(RC[-22]<>0,RC[-22]&R4C32,"q") -> q | AR208: =IF(RC[-22]<>0,RC[-22]&R4C32,"q") -> q | AS208: =IF(RC[-22]<>0,RC[-22]&R4C32,"q") -> q | AT208: =IF(RC[-22]<>0,RC[-22]&R4C32,"q") -> q | AU208: =IF(RC[-22]<>0,RC[-22]&R4C32,"q") -> q | AV208: =IF(RC[-22]<>0,RC[-22]&R4C32,"q") -> q
AC209: =IF(RC[-22]<>0,RC[-22]&R4C32,"q") -> q | AD209: =IF(RC[-22]<>0,RC[-22]&R4C32,"q") -> q | AE209: =IF(RC[-22]<>0,RC[-22]&R4C32,"q") -> q | AF209: =IF(RC[-22]<>0,RC[-22]&R4C32,"q") -> q | AG209: =IF(RC[-22]<>0,RC[-22]&R4C32,"q") -> q | AH209: =IF(RC[-22]<>0,RC[-22]&R4C32,"q") -> q | AI209: =IF(RC[-22]<>0,RC[-22]&R4C32,"q") -> q | AJ209: =IF(RC[-22]<>0,RC[-22]&R4C32,"q") -> q | AK209: =IF(RC[-22]<>0,RC[-22]&R4C32,"q") -> q | AL209: =IF(RC[-22]<>0,RC[-22]&R4C32,"q") -> q | AM209: =IF(RC[-22]<>0,RC[-22]&R4C32,"q") -> q | AN209: =IF(RC[-22]<>0,RC[-22]&R4C32,"q") -> q | AO209: =IF(RC[-22]<>0,RC[-22]&R4C32,"q") -> q | AP209: =IF(RC[-22]<>0,RC[-22]&R4C32,"q") -> q | AQ209: =IF(RC[-22]<>0,RC[-22]&R4C32,"q") -> q | AR209: =IF(RC[-22]<>0,RC[-22]&R4C32,"q") -> q | AS209: =IF(RC[-22]<>0,RC[-22]&R4C32,"q") -> q | AT209: =IF(RC[-22]<>0,RC[-22]&R4C32,"q") -> q | AU209: =IF(RC[-22]<>0,RC[-22]&R4C32,"q") -> q | AV209: =IF(RC[-22]<>0,RC[-22]&R4C32,"q") -> q
AC210: =IF(RC[-22]<>0,RC[-22]&R4C32,"q") -> q | AD210: =IF(RC[-22]<>0,RC[-22]&R4C32,"q") -> q | AE210: =IF(RC[-22]<>0,RC[-22]&R4C32,"q") -> q | AF210: =IF(RC[-22]<>0,RC[-22]&R4C32,"q") -> q | AG210: =IF(RC[-22]<>0,RC[-22]&R4C32,"q") -> q | AH210: =IF(RC[-22]<>0,RC[-22]&R4C32,"q") -> q | AI210: =IF(RC[-22]<>0,RC[-22]&R4C32,"q") -> q | AJ210: =IF(RC[-22]<>0,RC[-22]&R4C32,"q") -> q | AK210: =IF(RC[-22]<>0,RC[-22]&R4C32,"q") -> q | AL210: =IF(RC[-22]<>0,RC[-22]&R4C32,"q") -> q | AM210: =IF(RC[-22]<>0,RC[-22]&R4C32,"q") -> q | AN210: =IF(RC[-22]<>0,RC[-22]&R4C32,"q") -> q | AO210: =IF(RC[-22]<>0,RC[-22]&R4C32,"q") -> q | AP210: =IF(RC[-22]<>0,RC[-22]&R4C32,"q") -> q | AQ210: =IF(RC[-22]<>0,RC[-22]&R4C32,"q") -> q | AR210: =IF(RC[-22]<>0,RC[-22]&R4C32,"q") -> q | AS210: =IF(RC[-22]<>0,RC[-22]&R4C32,"q") -> q | AT210: =IF(RC[-22]<>0,RC[-22]&R4C32,"q") -> q | AU210: =IF(RC[-22]<>0,RC[-22]&R4C32,"q") -> q | AV210: =IF(RC[-22]<>0,RC[-22]&R4C32,"q") -> q
AC211: =IF(RC[-22]<>0,RC[-22]&R4C32,"q") -> q | AD211: =IF(RC[-22]<>0,RC[-22]&R4C32,"q") -> q | AE211: =IF(RC[-22]<>0,RC[-22]&R4C32,"q") -> q | AF211: =IF(RC[-22]<>0,RC[-22]&R4C32,"q") -> q | AG211: =IF(RC[-22]<>0,RC[-22]&R4C32,"q") -> q | AH211: =IF(RC[-22]<>0,RC[-22]&R4C32,"q") -> q | AI211: =IF(RC[-22]<>0,RC[-22]&R4C32,"q") -> q | AJ211: =IF(RC[-22]<>0,RC[-22]&R4C32,"q") -> q | AK211: =IF(RC[-22]<>0,RC[-22]&R4C32,"q") -> q | AL211: =IF(RC[-22]<>0,RC[-22]&R4C32,"q") -> q | AM211: =IF(RC[-22]<>0,RC[-22]&R4C32,"q") -> q | AN211: =IF(RC[-22]<>0,RC[-22]&R4C32,"q") -> q | AO211: =IF(RC[-22]<>0,RC[-22]&R4C32,"q") -> q | AP211: =IF(RC[-22]<>0,RC[-22]&R4C32,"q") -> q | AQ211: =IF(RC[-22]<>0,RC[-22]&R4C32,"q") -> q | AR211: =IF(RC[-22]<>0,RC[-22]&R4C32,"q") -> q | AS211: =IF(RC[-22]<>0,RC[-22]&R4C32,"q") -> q | AT211: =IF(RC[-22]<>0,RC[-22]&R4C32,"q") -> q | AU211: =IF(RC[-22]<>0,RC[-22]&R4C32,"q") -> q | AV211: =IF(RC[-22]<>0,RC[-22]&R4C32,"q") -> q
AC212: =IF(RC[-22]<>0,RC[-22]&R4C32,"q") -> q | AD212: =IF(RC[-22]<>0,RC[-22]&R4C32,"q") -> q | AE212: =IF(RC[-22]<>0,RC[-22]&R4C32,"q") -> q | AF212: =IF(RC[-22]<>0,RC[-22]&R4C32,"q") -> q | AG212: =IF(RC[-22]<>0,RC[-22]&R4C32,"q") -> q | AH212: =IF(RC[-22]<>0,RC[-22]&R4C32,"q") -> q | AI212: =IF(RC[-22]<>0,RC[-22]&R4C32,"q") -> q | AJ212: =IF(RC[-22]<>0,RC[-22]&R4C32,"q") -> q | AK212: =IF(RC[-22]<>0,RC[-22]&R4C32,"q") -> q | AL212: =IF(RC[-22]<>0,RC[-22]&R4C32,"q") -> q | AM212: =IF(RC[-22]<>0,RC[-22]&R4C32,"q") -> q | AN212: =IF(RC[-22]<>0,RC[-22]&R4C32,"q") -> q | AO212: =IF(RC[-22]<>0,RC[-22]&R4C32,"q") -> q | AP212: =IF(RC[-22]<>0,RC[-22]&R4C32,"q") -> q | AQ212: =IF(RC[-22]<>0,RC[-22]&R4C32,"q") -> q | AR212: =IF(RC[-22]<>0,RC[-22]&R4C32,"q") -> q | AS212: =IF(RC[-22]<>0,RC[-22]&R4C32,"q") -> q | AT212: =IF(RC[-22]<>0,RC[-22]&R4C32,"q") -> q | AU212: =IF(RC[-22]<>0,RC[-22]&R4C32,"q") -> q | AV212: =IF(RC[-22]<>0,RC[-22]&R4C32,"q") -> q
AC213: =IF(RC[-22]<>0,RC[-22]&R4C32,"q") -> q | AD213: =IF(RC[-22]<>0,RC[-22]&R4C32,"q") -> q | AE213: =IF(RC[-22]<>0,RC[-22]&R4C32,"q") -> q | AF213: =IF(RC[-22]<>0,RC[-22]&R4C32,"q") -> q | AG213: =IF(RC[-22]<>0,RC[-22]&R4C32,"q") -> q | AH213: =IF(RC[-22]<>0,RC[-22]&R4C32,"q") -> q | AI213: =IF(RC[-22]<>0,RC[-22]&R4C32,"q") -> q | AJ213: =IF(RC[-22]<>0,RC[-22]&R4C32,"q") -> q | AK213: =IF(RC[-22]<>0,RC[-22]&R4C32,"q") -> q | AL213: =IF(RC[-22]<>0,RC[-22]&R4C32,"q") -> q | AM213: =IF(RC[-22]<>0,RC[-22]&R4C32,"q") -> q | AN213: =IF(RC[-22]<>0,RC[-22]&R4C32,"q") -> q | AO213: =IF(RC[-22]<>0,RC[-22]&R4C32,"q") -> q | AP213: =IF(RC[-22]<>0,RC[-22]&R4C32,"q") -> q | AQ213: =IF(RC[-22]<>0,RC[-22]&R4C32,"q") -> q | AR213: =IF(RC[-22]<>0,RC[-22]&R4C32,"q") -> q | AS213: =IF(RC[-22]<>0,RC[-22]&R4C32,"q") -> q | AT213: =IF(RC[-22]<>0,RC[-22]&R4C32,"q") -> q | AU213: =IF(RC[-22]<>0,RC[-22]&R4C32,"q") -> q | AV213: =IF(RC[-22]<>0,RC[-22]&R4C32,"q") -> q
AC214: =IF(RC[-22]<>0,RC[-22]&R4C32,"q") -> q | AD214: =IF(RC[-22]<>0,RC[-22]&R4C32,"q") -> q | AE214: =IF(RC[-22]<>0,RC[-22]&R4C32,"q") -> q | AF214: =IF(RC[-22]<>0,RC[-22]&R4C32,"q") -> q | AG214: =IF(RC[-22]<>0,RC[-22]&R4C32,"q") -> q | AH214: =IF(RC[-22]<>0,RC[-22]&R4C32,"q") -> q | AI214: =IF(RC[-22]<>0,RC[-22]&R4C32,"q") -> q | AJ214: =IF(RC[-22]<>0,RC[-22]&R4C32,"q") -> q | AK214: =IF(RC[-22]<>0,RC[-22]&R4C32,"q") -> q | AL214: =IF(RC[-22]<>0,RC[-22]&R4C32,"q") -> q | AM214: =IF(RC[-22]<>0,RC[-22]&R4C32,"q") -> q | AN214: =IF(RC[-22]<>0,RC[-22]&R4C32,"q") -> q | AO214: =IF(RC[-22]<>0,RC[-22]&R4C32,"q") -> q | AP214: =IF(RC[-22]<>0,RC[-22]&R4C32,"q") -> q | AQ214: =IF(RC[-22]<>0,RC[-22]&R4C32,"q") -> q | AR214: =IF(RC[-22]<>0,RC[-22]&R4C32,"q") -> q | AS214: =IF(RC[-22]<>0,RC[-22]&R4C32,"q") -> q | AT214: =IF(RC[-22]<>0,RC[-22]&R4C32,"q") -> q | AU214: =IF(RC[-22]<>0,RC[-22]&R4C32,"q") -> q | AV214: =IF(RC[-22]<>0,RC[-22]&R4C32,"q") -> q
AC215: =IF(RC[-22]<>0,RC[-22]&R4C32,"q") -> q | AD215: =IF(RC[-22]<>0,RC[-22]&R4C32,"q") -> q | AE215: =IF(RC[-22]<>0,RC[-22]&R4C32,"q") -> q | AF215: =IF(RC[-22]<>0,RC[-22]&R4C32,"q") -> q | AG215: =IF(RC[-22]<>0,RC[-22]&R4C32,"q") -> q | AH215: =IF(RC[-22]<>0,RC[-22]&R4C32,"q") -> q | AI215: =IF(RC[-22]<>0,RC[-22]&R4C32,"q") -> q | AJ215: =IF(RC[-22]<>0,RC[-22]&R4C32,"q") -> q | AK215: =IF(RC[-22]<>0,RC[-22]&R4C32,"q") -> q | AL215: =IF(RC[-22]<>0,RC[-22]&R4C32,"q") -> q | AM215: =IF(RC[-22]<>0,RC[-22]&R4C32,"q") -> q | AN215: =IF(RC[-22]<>0,RC[-22]&R4C32,"q") -> q | AO215: =IF(RC[-22]<>0,RC[-22]&R4C32,"q") -> q | AP215: =IF(RC[-22]<>0,RC[-22]&R4C32,"q") -> q | AQ215: =IF(RC[-22]<>0,RC[-22]&R4C32,"q") -> q | AR215: =IF(RC[-22]<>0,RC[-22]&R4C32,"q") -> q | AS215: =IF(RC[-22]<>0,RC[-22]&R4C32,"q") -> q | AT215: =IF(RC[-22]<>0,RC[-22]&R4C32,"q") -> q | AU215: =IF(RC[-22]<>0,RC[-22]&R4C32,"q") -> q | AV215: =IF(RC[-22]<>0,RC[-22]&R4C32,"q") -> q
AC216: =IF(RC[-22]<>0,RC[-22]&R4C32,"q") -> q | AD216: =IF(RC[-22]<>0,RC[-22]&R4C32,"q") -> q | AE216: =IF(RC[-22]<>0,RC[-22]&R4C32,"q") -> q | AF216: =IF(RC[-22]<>0,RC[-22]&R4C32,"q") -> q | AG216: =IF(RC[-22]<>0,RC[-22]&R4C32,"q") -> q | AH216: =IF(RC[-22]<>0,RC[-22]&R4C32,"q") -> q | AI216: =IF(RC[-22]<>0,RC[-22]&R4C32,"q") -> q | AJ216: =IF(RC[-22]<>0,RC[-22]&R4C32,"q") -> q | AK216: =IF(RC[-22]<>0,RC[-22]&R4C32,"q") -> q | AL216: =IF(RC[-22]<>0,RC[-22]&R4C32,"q") -> q | AM216: =IF(RC[-22]<>0,RC[-22]&R4C32,"q") -> q | AN216: =IF(RC[-22]<>0,RC[-22]&R4C32,"q") -> q | AO216: =IF(RC[-22]<>0,RC[-22]&R4C32,"q") -> q | AP216: =IF(RC[-22]<>0,RC[-22]&R4C32,"q") -> q | AQ216: =IF(RC[-22]<>0,RC[-22]&R4C32,"q") -> q | AR216: =IF(RC[-22]<>0,RC[-22]&R4C32,"q") -> q | AS216: =IF(RC[-22]<>0,RC[-22]&R4C32,"q") -> q | AT216: =IF(RC[-22]<>0,RC[-22]&R4C32,"q") -> q | AU216: =IF(RC[-22]<>0,RC[-22]&R4C32,"q") -> q | AV216: =IF(RC[-22]<>0,RC[-22]&R4C32,"q") -> q
AC217: =IF(RC[-22]<>0,RC[-22]&R4C32,"q") -> q | AD217: =IF(RC[-22]<>0,RC[-22]&R4C32,"q") -> q | AE217: =IF(RC[-22]<>0,RC[-22]&R4C32,"q") -> q | AF217: =IF(RC[-22]<>0,RC[-22]&R4C32,"q") -> q | AG217: =IF(RC[-22]<>0,RC[-22]&R4C32,"q") -> q | AH217: =IF(RC[-22]<>0,RC[-22]&R4C32,"q") -> q | AI217: =IF(RC[-22]<>0,RC[-22]&R4C32,"q") -> q | AJ217: =IF(RC[-22]<>0,RC[-22]&R4C32,"q") -> q | AK217: =IF(RC[-22]<>0,RC[-22]&R4C32,"q") -> q | AL217: =IF(RC[-22]<>0,RC[-22]&R4C32,"q") -> q | AM217: =IF(RC[-22]<>0,RC[-22]&R4C32,"q") -> q | AN217: =IF(RC[-22]<>0,RC[-22]&R4C32,"q") -> q | AO217: =IF(RC[-22]<>0,RC[-22]&R4C32,"q") -> q | AP217: =IF(RC[-22]<>0,RC[-22]&R4C32,"q") -> q | AQ217: =IF(RC[-22]<>0,RC[-22]&R4C32,"q") -> q | AR217: =IF(RC[-22]<>0,RC[-22]&R4C32,"q") -> q | AS217: =IF(RC[-22]<>0,RC[-22]&R4C32,"q") -> q | AT217: =IF(RC[-22]<>0,RC[-22]&R4C32,"q") -> q | AU217: =IF(RC[-22]<>0,RC[-22]&R4C32,"q") -> q | AV217: =IF(RC[-22]<>0,RC[-22]&R4C32,"q") -> q
AC218: =IF(RC[-22]<>0,RC[-22]&R4C32,"q") -> q | AD218: =IF(RC[-22]<>0,RC[-22]&R4C32,"q") -> q | AE218: =IF(RC[-22]<>0,RC[-22]&R4C32,"q") -> q | AF218: =IF(RC[-22]<>0,RC[-22]&R4C32,"q") -> q | AG218: =IF(RC[-22]<>0,RC[-22]&R4C32,"q") -> q | AH218: =IF(RC[-22]<>0,RC[-22]&R4C32,"q") -> q | AI218: =IF(RC[-22]<>0,RC[-22]&R4C32,"q") -> q | AJ218: =IF(RC[-22]<>0,RC[-22]&R4C32,"q") -> q | AK218: =IF(RC[-22]<>0,RC[-22]&R4C32,"q") -> q | AL218: =IF(RC[-22]<>0,RC[-22]&R4C32,"q") -> q | AM218: =IF(RC[-22]<>0,RC[-22]&R4C32,"q") -> q | AN218: =IF(RC[-22]<>0,RC[-22]&R4C32,"q") -> q | AO218: =IF(RC[-22]<>0,RC[-22]&R4C32,"q") -> q | AP218: =IF(RC[-22]<>0,RC[-22]&R4C32,"q") -> q | AQ218: =IF(RC[-22]<>0,RC[-22]&R4C32,"q") -> q | AR218: =IF(RC[-22]<>0,RC[-22]&R4C32,"q") -> q | AS218: =IF(RC[-22]<>0,RC[-22]&R4C32,"q") -> q | AT218: =IF(RC[-22]<>0,RC[-22]&R4C32,"q") -> q | AU218: =IF(RC[-22]<>0,RC[-22]&R4C32,"q") -> q | AV218: =IF(RC[-22]<>0,RC[-22]&R4C32,"q") -> q
AC219: =IF(RC[-22]<>0,RC[-22]&R4C32,"q") -> q | AD219: =IF(RC[-22]<>0,RC[-22]&R4C32,"q") -> q | AE219: =IF(RC[-22]<>0,RC[-22]&R4C32,"q") -> q | AF219: =IF(RC[-22]<>0,RC[-22]&R4C32,"q") -> q | AG219: =IF(RC[-22]<>0,RC[-22]&R4C32,"q") -> q | AH219: =IF(RC[-22]<>0,RC[-22]&R4C32,"q") -> q | AI219: =IF(RC[-22]<>0,RC[-22]&R4C32,"q") -> q | AJ219: =IF(RC[-22]<>0,RC[-22]&R4C32,"q") -> q | AK219: =IF(RC[-22]<>0,RC[-22]&R4C32,"q") -> q | AL219: =IF(RC[-22]<>0,RC[-22]&R4C32,"q") -> q | AM219: =IF(RC[-22]<>0,RC[-22]&R4C32,"q") -> q | AN219: =IF(RC[-22]<>0,RC[-22]&R4C32,"q") -> q | AO219: =IF(RC[-22]<>0,RC[-22]&R4C32,"q") -> q | AP219: =IF(RC[-22]<>0,RC[-22]&R4C32,"q") -> q | AQ219: =IF(RC[-22]<>0,RC[-22]&R4C32,"q") -> q | AR219: =IF(RC[-22]<>0,RC[-22]&R4C32,"q") -> q | AS219: =IF(RC[-22]<>0,RC[-22]&R4C32,"q") -> q | AT219: =IF(RC[-22]<>0,RC[-22]&R4C32,"q") -> q | AU219: =IF(RC[-22]<>0,RC[-22]&R4C32,"q") -> q | AV219: =IF(RC[-22]<>0,RC[-22]&R4C32,"q") -> q
AC220: =IF(RC[-22]<>0,RC[-22]&R4C32,"q") -> q | AD220: =IF(RC[-22]<>0,RC[-22]&R4C32,"q") -> q | AE220: =IF(RC[-22]<>0,RC[-22]&R4C32,"q") -> q | AF220: =IF(RC[-22]<>0,RC[-22]&R4C32,"q") -> q | AG220: =IF(RC[-22]<>0,RC[-22]&R4C32,"q") -> q | AH220: =IF(RC[-22]<>0,RC[-22]&R4C32,"q") -> q | AI220: =IF(RC[-22]<>0,RC[-22]&R4C32,"q") -> q | AJ220: =IF(RC[-22]<>0,RC[-22]&R4C32,"q") -> q | AK220: =IF(RC[-22]<>0,RC[-22]&R4C32,"q") -> q | AL220: =IF(RC[-22]<>0,RC[-22]&R4C32,"q") -> q | AM220: =IF(RC[-22]<>0,RC[-22]&R4C32,"q") -> q | AN220: =IF(RC[-22]<>0,RC[-22]&R4C32,"q") -> q | AO220: =IF(RC[-22]<>0,RC[-22]&R4C32,"q") -> q | AP220: =IF(RC[-22]<>0,RC[-22]&R4C32,"q") -> q | AQ220: =IF(RC[-22]<>0,RC[-22]&R4C32,"q") -> q | AR220: =IF(RC[-22]<>0,RC[-22]&R4C32,"q") -> q | AS220: =IF(RC[-22]<>0,RC[-22]&R4C32,"q") -> q | AT220: =IF(RC[-22]<>0,RC[-22]&R4C32,"q") -> q | AU220: =IF(RC[-22]<>0,RC[-22]&R4C32,"q") -> q | AV220: =IF(RC[-22]<>0,RC[-22]&R4C32,"q") -> q
AC221: =IF(RC[-22]<>0,RC[-22]&R4C32,"q") -> q | AD221: =IF(RC[-22]<>0,RC[-22]&R4C32,"q") -> q | AE221: =IF(RC[-22]<>0,RC[-22]&R4C32,"q") -> q | AF221: =IF(RC[-22]<>0,RC[-22]&R4C32,"q") -> q | AG221: =IF(RC[-22]<>0,RC[-22]&R4C32,"q") -> q | AH221: =IF(RC[-22]<>0,RC[-22]&R4C32,"q") -> q | AI221: =IF(RC[-22]<>0,RC[-22]&R4C32,"q") -> q | AJ221: =IF(RC[-22]<>0,RC[-22]&R4C32,"q") -> q | AK221: =IF(RC[-22]<>0,RC[-22]&R4C32,"q") -> q | AL221: =IF(RC[-22]<>0,RC[-22]&R4C32,"q") -> q | AM221: =IF(RC[-22]<>0,RC[-22]&R4C32,"q") -> q | AN221: =IF(RC[-22]<>0,RC[-22]&R4C32,"q") -> q | AO221: =IF(RC[-22]<>0,RC[-22]&R4C32,"q") -> q | AP221: =IF(RC[-22]<>0,RC[-22]&R4C32,"q") -> q | AQ221: =IF(RC[-22]<>0,RC[-22]&R4C32,"q") -> q | AR221: =IF(RC[-22]<>0,RC[-22]&R4C32,"q") -> q | AS221: =IF(RC[-22]<>0,RC[-22]&R4C32,"q") -> q | AT221: =IF(RC[-22]<>0,RC[-22]&R4C32,"q") -> q | AU221: =IF(RC[-22]<>0,RC[-22]&R4C32,"q") -> q | AV221: =IF(RC[-22]<>0,RC[-22]&R4C32,"q") -> q
AC222: =IF(RC[-22]<>0,RC[-22]&R4C32,"q") -> q | AD222: =IF(RC[-22]<>0,RC[-22]&R4C32,"q") -> q | AE222: =IF(RC[-22]<>0,RC[-22]&R4C32,"q") -> q | AF222: =IF(RC[-22]<>0,RC[-22]&R4C32,"q") -> q | AG222: =IF(RC[-22]<>0,RC[-22]&R4C32,"q") -> q | AH222: =IF(RC[-22]<>0,RC[-22]&R4C32,"q") -> q | AI222: =IF(RC[-22]<>0,RC[-22]&R4C32,"q") -> q | AJ222: =IF(RC[-22]<>0,RC[-22]&R4C32,"q") -> q | AK222: =IF(RC[-22]<>0,RC[-22]&R4C32,"q") -> q | AL222: =IF(RC[-22]<>0,RC[-22]&R4C32,"q") -> q | AM222: =IF(RC[-22]<>0,RC[-22]&R4C32,"q") -> q | AN222: =IF(RC[-22]<>0,RC[-22]&R4C32,"q") -> q | AO222: =IF(RC[-22]<>0,RC[-22]&R4C32,"q") -> q | AP222: =IF(RC[-22]<>0,RC[-22]&R4C32,"q") -> q | AQ222: =IF(RC[-22]<>0,RC[-22]&R4C32,"q") -> q | AR222: =IF(RC[-22]<>0,RC[-22]&R4C32,"q") -> q | AS222: =IF(RC[-22]<>0,RC[-22]&R4C32,"q") -> q | AT222: =IF(RC[-22]<>0,RC[-22]&R4C32,"q") -> q | AU222: =IF(RC[-22]<>0,RC[-22]&R4C32,"q") -> q | AV222: =IF(RC[-22]<>0,RC[-22]&R4C32,"q") -> q
AC223: =IF(RC[-22]<>0,RC[-22]&R4C32,"q") -> q | AD223: =IF(RC[-22]<>0,RC[-22]&R4C32,"q") -> q | AE223: =IF(RC[-22]<>0,RC[-22]&R4C32,"q") -> q | AF223: =IF(RC[-22]<>0,RC[-22]&R4C32,"q") -> q | AG223: =IF(RC[-22]<>0,RC[-22]&R4C32,"q") -> q | AH223: =IF(RC[-22]<>0,RC[-22]&R4C32,"q") -> q | AI223: =IF(RC[-22]<>0,RC[-22]&R4C32,"q") -> q | AJ223: =IF(RC[-22]<>0,RC[-22]&R4C32,"q") -> q | AK223: =IF(RC[-22]<>0,RC[-22]&R4C32,"q") -> q | AL223: =IF(RC[-22]<>0,RC[-22]&R4C32,"q") -> q | AM223: =IF(RC[-22]<>0,RC[-22]&R4C32,"q") -> q | AN223: =IF(RC[-22]<>0,RC[-22]&R4C32,"q") -> q | AO223: =IF(RC[-22]<>0,RC[-22]&R4C32,"q") -> q | AP223: =IF(RC[-22]<>0,RC[-22]&R4C32,"q") -> q | AQ223: =IF(RC[-22]<>0,RC[-22]&R4C32,"q") -> q | AR223: =IF(RC[-22]<>0,RC[-22]&R4C32,"q") -> q | AS223: =IF(RC[-22]<>0,RC[-22]&R4C32,"q") -> q | AT223: =IF(RC[-22]<>0,RC[-22]&R4C32,"q") -> q | AU223: =IF(RC[-22]<>0,RC[-22]&R4C32,"q") -> q | AV223: =IF(RC[-22]<>0,RC[-22]&R4C32,"q") -> q
AC224: =IF(RC[-22]<>0,RC[-22]&R4C32,"q") -> q | AD224: =IF(RC[-22]<>0,RC[-22]&R4C32,"q") -> q | AE224: =IF(RC[-22]<>0,RC[-22]&R4C32,"q") -> q | AF224: =IF(RC[-22]<>0,RC[-22]&R4C32,"q") -> q | AG224: =IF(RC[-22]<>0,RC[-22]&R4C32,"q") -> q | AH224: =IF(RC[-22]<>0,RC[-22]&R4C32,"q") -> q | AI224: =IF(RC[-22]<>0,RC[-22]&R4C32,"q") -> q | AJ224: =IF(RC[-22]<>0,RC[-22]&R4C32,"q") -> q | AK224: =IF(RC[-22]<>0,RC[-22]&R4C32,"q") -> q | AL224: =IF(RC[-22]<>0,RC[-22]&R4C32,"q") -> q | AM224: =IF(RC[-22]<>0,RC[-22]&R4C32,"q") -> q | AN224: =IF(RC[-22]<>0,RC[-22]&R4C32,"q") -> q | AO224: =IF(RC[-22]<>0,RC[-22]&R4C32,"q") -> q | AP224: =IF(RC[-22]<>0,RC[-22]&R4C32,"q") -> q | AQ224: =IF(RC[-22]<>0,RC[-22]&R4C32,"q") -> q | AR224: =IF(RC[-22]<>0,RC[-22]&R4C32,"q") -> q | AS224: =IF(RC[-22]<>0,RC[-22]&R4C32,"q") -> q | AT224: =IF(RC[-22]<>0,RC[-22]&R4C32,"q") -> q | AU224: =IF(RC[-22]<>0,RC[-22]&R4C32,"q") -> q | AV224: =IF(RC[-22]<>0,RC[-22]&R4C32,"q") -> q
AC225: =IF(RC[-22]<>0,RC[-22]&R4C32,"q") -> q | AD225: =IF(RC[-22]<>0,RC[-22]&R4C32,"q") -> q | AE225: =IF(RC[-22]<>0,RC[-22]&R4C32,"q") -> q | AF225: =IF(RC[-22]<>0,RC[-22]&R4C32,"q") -> q | AG225: =IF(RC[-22]<>0,RC[-22]&R4C32,"q") -> q | AH225: =IF(RC[-22]<>0,RC[-22]&R4C32,"q") -> q | AI225: =IF(RC[-22]<>0,RC[-22]&R4C32,"q") -> q | AJ225: =IF(RC[-22]<>0,RC[-22]&R4C32,"q") -> q | AK225: =IF(RC[-22]<>0,RC[-22]&R4C32,"q") -> q | AL225: =IF(RC[-22]<>0,RC[-22]&R4C32,"q") -> q | AM225: =IF(RC[-22]<>0,RC[-22]&R4C32,"q") -> q | AN225: =IF(RC[-22]<>0,RC[-22]&R4C32,"q") -> q | AO225: =IF(RC[-22]<>0,RC[-22]&R4C32,"q") -> q | AP225: =IF(RC[-22]<>0,RC[-22]&R4C32,"q") -> q | AQ225: =IF(RC[-22]<>0,RC[-22]&R4C32,"q") -> q | AR225: =IF(RC[-22]<>0,RC[-22]&R4C32,"q") -> q | AS225: =IF(RC[-22]<>0,RC[-22]&R4C32,"q") -> q | AT225: =IF(RC[-22]<>0,RC[-22]&R4C32,"q") -> q | AU225: =IF(RC[-22]<>0,RC[-22]&R4C32,"q") -> q | AV225: =IF(RC[-22]<>0,RC[-22]&R4C32,"q") -> q
AC226: =IF(RC[-22]<>0,RC[-22]&R4C32,"q") -> q | AD226: =IF(RC[-22]<>0,RC[-22]&R4C32,"q") -> q | AE226: =IF(RC[-22]<>0,RC[-22]&R4C32,"q") -> q | AF226: =IF(RC[-22]<>0,RC[-22]&R4C32,"q") -> q | AG226: =IF(RC[-22]<>0,RC[-22]&R4C32,"q") -> q | AH226: =IF(RC[-22]<>0,RC[-22]&R4C32,"q") -> q | AI226: =IF(RC[-22]<>0,RC[-22]&R4C32,"q") -> q | AJ226: =IF(RC[-22]<>0,RC[-22]&R4C32,"q") -> q | AK226: =IF(RC[-22]<>0,RC[-22]&R4C32,"q") -> q | AL226: =IF(RC[-22]<>0,RC[-22]&R4C32,"q") -> q | AM226: =IF(RC[-22]<>0,RC[-22]&R4C32,"q") -> q | AN226: =IF(RC[-22]<>0,RC[-22]&R4C32,"q") -> q | AO226: =IF(RC[-22]<>0,RC[-22]&R4C32,"q") -> q | AP226: =IF(RC[-22]<>0,RC[-22]&R4C32,"q") -> q | AQ226: =IF(RC[-22]<>0,RC[-22]&R4C32,"q") -> q | AR226: =IF(RC[-22]<>0,RC[-22]&R4C32,"q") -> q | AS226: =IF(RC[-22]<>0,RC[-22]&R4C32,"q") -> q | AT226: =IF(RC[-22]<>0,RC[-22]&R4C32,"q") -> q | AU226: =IF(RC[-22]<>0,RC[-22]&R4C32,"q") -> q | AV226: =IF(RC[-22]<>0,RC[-22]&R4C32,"q") -> q
AC227: =IF(RC[-22]<>0,RC[-22]&R4C32,"q") -> q | AD227: =IF(RC[-22]<>0,RC[-22]&R4C32,"q") -> q | AE227: =IF(RC[-22]<>0,RC[-22]&R4C32,"q") -> q | AF227: =IF(RC[-22]<>0,RC[-22]&R4C32,"q") -> q | AG227: =IF(RC[-22]<>0,RC[-22]&R4C32,"q") -> q | AH227: =IF(RC[-22]<>0,RC[-22]&R4C32,"q") -> q | AI227: =IF(RC[-22]<>0,RC[-22]&R4C32,"q") -> q | AJ227: =IF(RC[-22]<>0,RC[-22]&R4C32,"q") -> q | AK227: =IF(RC[-22]<>0,RC[-22]&R4C32,"q") -> q | AL227: =IF(RC[-22]<>0,RC[-22]&R4C32,"q") -> q | AM227: =IF(RC[-22]<>0,RC[-22]&R4C32,"q") -> q | AN227: =IF(RC[-22]<>0,RC[-22]&R4C32,"q") -> q | AO227: =IF(RC[-22]<>0,RC[-22]&R4C32,"q") -> q | AP227: =IF(RC[-22]<>0,RC[-22]&R4C32,"q") -> q | AQ227: =IF(RC[-22]<>0,RC[-22]&R4C32,"q") -> q | AR227: =IF(RC[-22]<>0,RC[-22]&R4C32,"q") -> q | AS227: =IF(RC[-22]<>0,RC[-22]&R4C32,"q") -> q | AT227: =IF(RC[-22]<>0,RC[-22]&R4C32,"q") -> q | AU227: =IF(RC[-22]<>0,RC[-22]&R4C32,"q") -> q | AV227: =IF(RC[-22]<>0,RC[-22]&R4C32,"q") -> q
AC228: =IF(RC[-22]<>0,RC[-22]&R4C32,"q") -> q | AD228: =IF(RC[-22]<>0,RC[-22]&R4C32,"q") -> q | AE228: =IF(RC[-22]<>0,RC[-22]&R4C32,"q") -> q | AF228: =IF(RC[-22]<>0,RC[-22]&R4C32,"q") -> q | AG228: =IF(RC[-22]<>0,RC[-22]&R4C32,"q") -> q | AH228: =IF(RC[-22]<>0,RC[-22]&R4C32,"q") -> q | AI228: =IF(RC[-22]<>0,RC[-22]&R4C32,"q") -> q | AJ228: =IF(RC[-22]<>0,RC[-22]&R4C32,"q") -> q | AK228: =IF(RC[-22]<>0,RC[-22]&R4C32,"q") -> q | AL228: =IF(RC[-22]<>0,RC[-22]&R4C32,"q") -> q | AM228: =IF(RC[-22]<>0,RC[-22]&R4C32,"q") -> q | AN228: =IF(RC[-22]<>0,RC[-22]&R4C32,"q") -> q | AO228: =IF(RC[-22]<>0,RC[-22]&R4C32,"q") -> q | AP228: =IF(RC[-22]<>0,RC[-22]&R4C32,"q") -> q | AQ228: =IF(RC[-22]<>0,RC[-22]&R4C32,"q") -> q | AR228: =IF(RC[-22]<>0,RC[-22]&R4C32,"q") -> q | AS228: =IF(RC[-22]<>0,RC[-22]&R4C32,"q") -> q | AT228: =IF(RC[-22]<>0,RC[-22]&R4C32,"q") -> q | AU228: =IF(RC[-22]<>0,RC[-22]&R4C32,"q") -> q | AV228: =IF(RC[-22]<>0,RC[-22]&R4C32,"q") -> q
AC229: =IF(RC[-22]<>0,RC[-22]&R4C32,"q") -> q | AD229: =IF(RC[-22]<>0,RC[-22]&R4C32,"q") -> q | AE229: =IF(RC[-22]<>0,RC[-22]&R4C32,"q") -> q | AF229: =IF(RC[-22]<>0,RC[-22]&R4C32,"q") -> q | AG229: =IF(RC[-22]<>0,RC[-22]&R4C32,"q") -> q | AH229: =IF(RC[-22]<>0,RC[-22]&R4C32,"q") -> q | AI229: =IF(RC[-22]<>0,RC[-22]&R4C32,"q") -> q | AJ229: =IF(RC[-22]<>0,RC[-22]&R4C32,"q") -> q | AK229: =IF(RC[-22]<>0,RC[-22]&R4C32,"q") -> q | AL229: =IF(RC[-22]<>0,RC[-22]&R4C32,"q") -> q | AM229: =IF(RC[-22]<>0,RC[-22]&R4C32,"q") -> q | AN229: =IF(RC[-22]<>0,RC[-22]&R4C32,"q") -> q | AO229: =IF(RC[-22]<>0,RC[-22]&R4C32,"q") -> q | AP229: =IF(RC[-22]<>0,RC[-22]&R4C32,"q") -> q | AQ229: =IF(RC[-22]<>0,RC[-22]&R4C32,"q") -> q | AR229: =IF(RC[-22]<>0,RC[-22]&R4C32,"q") -> q | AS229: =IF(RC[-22]<>0,RC[-22]&R4C32,"q") -> q | AT229: =IF(RC[-22]<>0,RC[-22]&R4C32,"q") -> q | AU229: =IF(RC[-22]<>0,RC[-22]&R4C32,"q") -> q | AV229: =IF(RC[-22]<>0,RC[-22]&R4C32,"q") -> q
AC230: =IF(RC[-22]<>0,RC[-22]&R4C32,"q") -> q | AD230: =IF(RC[-22]<>0,RC[-22]&R4C32,"q") -> q | AE230: =IF(RC[-22]<>0,RC[-22]&R4C32,"q") -> q | AF230: =IF(RC[-22]<>0,RC[-22]&R4C32,"q") -> q | AG230: =IF(RC[-22]<>0,RC[-22]&R4C32,"q") -> q | AH230: =IF(RC[-22]<>0,RC[-22]&R4C32,"q") -> q | AI230: =IF(RC[-22]<>0,RC[-22]&R4C32,"q") -> q | AJ230: =IF(RC[-22]<>0,RC[-22]&R4C32,"q") -> q | AK230: =IF(RC[-22]<>0,RC[-22]&R4C32,"q") -> q | AL230: =IF(RC[-22]<>0,RC[-22]&R4C32,"q") -> q | AM230: =IF(RC[-22]<>0,RC[-22]&R4C32,"q") -> q | AN230: =IF(RC[-22]<>0,RC[-22]&R4C32,"q") -> q | AO230: =IF(RC[-22]<>0,RC[-22]&R4C32,"q") -> q | AP230: =IF(RC[-22]<>0,RC[-22]&R4C32,"q") -> q | AQ230: =IF(RC[-22]<>0,RC[-22]&R4C32,"q") -> q | AR230: =IF(RC[-22]<>0,RC[-22]&R4C32,"q") -> q | AS230: =IF(RC[-22]<>0,RC[-22]&R4C32,"q") -> q | AT230: =IF(RC[-22]<>0,RC[-22]&R4C32,"q") -> q | AU230: =IF(RC[-22]<>0,RC[-22]&R4C32,"q") -> q | AV230: =IF(RC[-22]<>0,RC[-22]&R4C32,"q") -> q
AC231: =IF(RC[-22]<>0,RC[-22]&R4C32,"q") -> q | AD231: =IF(RC[-22]<>0,RC[-22]&R4C32,"q") -> q | AE231: =IF(RC[-22]<>0,RC[-22]&R4C32,"q") -> q | AF231: =IF(RC[-22]<>0,RC[-22]&R4C32,"q") -> q | AG231: =IF(RC[-22]<>0,RC[-22]&R4C32,"q") -> q | AH231: =IF(RC[-22]<>0,RC[-22]&R4C32,"q") -> q | AI231: =IF(RC[-22]<>0,RC[-22]&R4C32,"q") -> q | AJ231: =IF(RC[-22]<>0,RC[-22]&R4C32,"q") -> q | AK231: =IF(RC[-22]<>0,RC[-22]&R4C32,"q") -> q | AL231: =IF(RC[-22]<>0,RC[-22]&R4C32,"q") -> q | AM231: =IF(RC[-22]<>0,RC[-22]&R4C32,"q") -> q | AN231: =IF(RC[-22]<>0,RC[-22]&R4C32,"q") -> q | AO231: =IF(RC[-22]<>0,RC[-22]&R4C32,"q") -> q | AP231: =IF(RC[-22]<>0,RC[-22]&R4C32,"q") -> q | AQ231: =IF(RC[-22]<>0,RC[-22]&R4C32,"q") -> q | AR231: =IF(RC[-22]<>0,RC[-22]&R4C32,"q") -> q | AS231: =IF(RC[-22]<>0,RC[-22]&R4C32,"q") -> q | AT231: =IF(RC[-22]<>0,RC[-22]&R4C32,"q") -> q | AU231: =IF(RC[-22]<>0,RC[-22]&R4C32,"q") -> q | AV231: =IF(RC[-22]<>0,RC[-22]&R4C32,"q") -> q
AC232: =IF(RC[-22]<>0,RC[-22]&R4C32,"q") -> q | AD232: =IF(RC[-22]<>0,RC[-22]&R4C32,"q") -> q | AE232: =IF(RC[-22]<>0,RC[-22]&R4C32,"q") -> q | AF232: =IF(RC[-22]<>0,RC[-22]&R4C32,"q") -> q | AG232: =IF(RC[-22]<>0,RC[-22]&R4C32,"q") -> q | AH232: =IF(RC[-22]<>0,RC[-22]&R4C32,"q") -> q | AI232: =IF(RC[-22]<>0,RC[-22]&R4C32,"q") -> q | AJ232: =IF(RC[-22]<>0,RC[-22]&R4C32,"q") -> q | AK232: =IF(RC[-22]<>0,RC[-22]&R4C32,"q") -> q | AL232: =IF(RC[-22]<>0,RC[-22]&R4C32,"q") -> q | AM232: =IF(RC[-22]<>0,RC[-22]&R4C32,"q") -> q | AN232: =IF(RC[-22]<>0,RC[-22]&R4C32,"q") -> q | AO232: =IF(RC[-22]<>0,RC[-22]&R4C32,"q") -> q | AP232: =IF(RC[-22]<>0,RC[-22]&R4C32,"q") -> q | AQ232: =IF(RC[-22]<>0,RC[-22]&R4C32,"q") -> q | AR232: =IF(RC[-22]<>0,RC[-22]&R4C32,"q") -> q | AS232: =IF(RC[-22]<>0,RC[-22]&R4C32,"q") -> q | AT232: =IF(RC[-22]<>0,RC[-22]&R4C32,"q") -> q | AU232: =IF(RC[-22]<>0,RC[-22]&R4C32,"q") -> q | AV232: =IF(RC[-22]<>0,RC[-22]&R4C32,"q") -> q
AC233: =IF(RC[-22]<>0,RC[-22]&R4C32,"q") -> q | AD233: =IF(RC[-22]<>0,RC[-22]&R4C32,"q") -> q | AE233: =IF(RC[-22]<>0,RC[-22]&R4C32,"q") -> q | AF233: =IF(RC[-22]<>0,RC[-22]&R4C32,"q") -> q | AG233: =IF(RC[-22]<>0,RC[-22]&R4C32,"q") -> q | AH233: =IF(RC[-22]<>0,RC[-22]&R4C32,"q") -> q | AI233: =IF(RC[-22]<>0,RC[-22]&R4C32,"q") -> q | AJ233: =IF(RC[-22]<>0,RC[-22]&R4C32,"q") -> q | AK233: =IF(RC[-22]<>0,RC[-22]&R4C32,"q") -> q | AL233: =IF(RC[-22]<>0,RC[-22]&R4C32,"q") -> q | AM233: =IF(RC[-22]<>0,RC[-22]&R4C32,"q") -> q | AN233: =IF(RC[-22]<>0,RC[-22]&R4C32,"q") -> q | AO233: =IF(RC[-22]<>0,RC[-22]&R4C32,"q") -> q | AP233: =IF(RC[-22]<>0,RC[-22]&R4C32,"q") -> q | AQ233: =IF(RC[-22]<>0,RC[-22]&R4C32,"q") -> q | AR233: =IF(RC[-22]<>0,RC[-22]&R4C32,"q") -> q | AS233: =IF(RC[-22]<>0,RC[-22]&R4C32,"q") -> q | AT233: =IF(RC[-22]<>0,RC[-22]&R4C32,"q") -> q | AU233: =IF(RC[-22]<>0,RC[-22]&R4C32,"q") -> q | AV233: =IF(RC[-22]<>0,RC[-22]&R4C32,"q") -> q
AC234: =IF(RC[-22]<>0,RC[-22]&R4C32,"q") -> q | AD234: =IF(RC[-22]<>0,RC[-22]&R4C32,"q") -> q | AE234: =IF(RC[-22]<>0,RC[-22]&R4C32,"q") -> q | AF234: =IF(RC[-22]<>0,RC[-22]&R4C32,"q") -> q | AG234: =IF(RC[-22]<>0,RC[-22]&R4C32,"q") -> q | AH234: =IF(RC[-22]<>0,RC[-22]&R4C32,"q") -> q | AI234: =IF(RC[-22]<>0,RC[-22]&R4C32,"q") -> q | AJ234: =IF(RC[-22]<>0,RC[-22]&R4C32,"q") -> q | AK234: =IF(RC[-22]<>0,RC[-22]&R4C32,"q") -> q | AL234: =IF(RC[-22]<>0,RC[-22]&R4C32,"q") -> q | AM234: =IF(RC[-22]<>0,RC[-22]&R4C32,"q") -> q | AN234: =IF(RC[-22]<>0,RC[-22]&R4C32,"q") -> q | AO234: =IF(RC[-22]<>0,RC[-22]&R4C32,"q") -> q | AP234: =IF(RC[-22]<>0,RC[-22]&R4C32,"q") -> q | AQ234: =IF(RC[-22]<>0,RC[-22]&R4C32,"q") -> q | AR234: =IF(RC[-22]<>0,RC[-22]&R4C32,"q") -> q | AS234: =IF(RC[-22]<>0,RC[-22]&R4C32,"q") -> q | AT234: =IF(RC[-22]<>0,RC[-22]&R4C32,"q") -> q | AU234: =IF(RC[-22]<>0,RC[-22]&R4C32,"q") -> q | AV234: =IF(RC[-22]<>0,RC[-22]&R4C32,"q") -> q
AC235: =IF(RC[-22]<>0,RC[-22]&R4C32,"q") -> q | AD235: =IF(RC[-22]<>0,RC[-22]&R4C32,"q") -> q | AE235: =IF(RC[-22]<>0,RC[-22]&R4C32,"q") -> q | AF235: =IF(RC[-22]<>0,RC[-22]&R4C32,"q") -> q | AG235: =IF(RC[-22]<>0,RC[-22]&R4C32,"q") -> q | AH235: =IF(RC[-22]<>0,RC[-22]&R4C32,"q") -> q | AI235: =IF(RC[-22]<>0,RC[-22]&R4C32,"q") -> q | AJ235: =IF(RC[-22]<>0,RC[-22]&R4C32,"q") -> q | AK235: =IF(RC[-22]<>0,RC[-22]&R4C32,"q") -> q | AL235: =IF(RC[-22]<>0,RC[-22]&R4C32,"q") -> q | AM235: =IF(RC[-22]<>0,RC[-22]&R4C32,"q") -> q | AN235: =IF(RC[-22]<>0,RC[-22]&R4C32,"q") -> q | AO235: =IF(RC[-22]<>0,RC[-22]&R4C32,"q") -> q | AP235: =IF(RC[-22]<>0,RC[-22]&R4C32,"q") -> q | AQ235: =IF(RC[-22]<>0,RC[-22]&R4C32,"q") -> q | AR235: =IF(RC[-22]<>0,RC[-22]&R4C32,"q") -> q | AS235: =IF(RC[-22]<>0,RC[-22]&R4C32,"q") -> q | AT235: =IF(RC[-22]<>0,RC[-22]&R4C32,"q") -> q | AU235: =IF(RC[-22]<>0,RC[-22]&R4C32,"q") -> q | AV235: =IF(RC[-22]<>0,RC[-22]&R4C32,"q") -> q
AC236: =IF(RC[-22]<>0,RC[-22]&R4C32,"q") -> q | AD236: =IF(RC[-22]<>0,RC[-22]&R4C32,"q") -> q | AE236: =IF(RC[-22]<>0,RC[-22]&R4C32,"q") -> q | AF236: =IF(RC[-22]<>0,RC[-22]&R4C32,"q") -> q | AG236: =IF(RC[-22]<>0,RC[-22]&R4C32,"q") -> q | AH236: =IF(RC[-22]<>0,RC[-22]&R4C32,"q") -> q | AI236: =IF(RC[-22]<>0,RC[-22]&R4C32,"q") -> q | AJ236: =IF(RC[-22]<>0,RC[-22]&R4C32,"q") -> q | AK236: =IF(RC[-22]<>0,RC[-22]&R4C32,"q") -> q | AL236: =IF(RC[-22]<>0,RC[-22]&R4C32,"q") -> q | AM236: =IF(RC[-22]<>0,RC[-22]&R4C32,"q") -> q | AN236: =IF(RC[-22]<>0,RC[-22]&R4C32,"q") -> q | AO236: =IF(RC[-22]<>0,RC[-22]&R4C32,"q") -> q | AP236: =IF(RC[-22]<>0,RC[-22]&R4C32,"q") -> q | AQ236: =IF(RC[-22]<>0,RC[-22]&R4C32,"q") -> q | AR236: =IF(RC[-22]<>0,RC[-22]&R4C32,"q") -> q | AS236: =IF(RC[-22]<>0,RC[-22]&R4C32,"q") -> q | AT236: =IF(RC[-22]<>0,RC[-22]&R4C32,"q") -> q | AU236: =IF(RC[-22]<>0,RC[-22]&R4C32,"q") -> q | AV236: =IF(RC[-22]<>0,RC[-22]&R4C32,"q") -> q
AC237: =IF(RC[-22]<>0,RC[-22]&R4C32,"q") -> q | AD237: =IF(RC[-22]<>0,RC[-22]&R4C32,"q") -> q | AE237: =IF(RC[-22]<>0,RC[-22]&R4C32,"q") -> q | AF237: =IF(RC[-22]<>0,RC[-22]&R4C32,"q") -> q | AG237: =IF(RC[-22]<>0,RC[-22]&R4C32,"q") -> q | AH237: =IF(RC[-22]<>0,RC[-22]&R4C32,"q") -> q | AI237: =IF(RC[-22]<>0,RC[-22]&R4C32,"q") -> q | AJ237: =IF(RC[-22]<>0,RC[-22]&R4C32,"q") -> q | AK237: =IF(RC[-22]<>0,RC[-22]&R4C32,"q") -> q | AL237: =IF(RC[-22]<>0,RC[-22]&R4C32,"q") -> q | AM237: =IF(RC[-22]<>0,RC[-22]&R4C32,"q") -> q | AN237: =IF(RC[-22]<>0,RC[-22]&R4C32,"q") -> q | AO237: =IF(RC[-22]<>0,RC[-22]&R4C32,"q") -> q | AP237: =IF(RC[-22]<>0,RC[-22]&R4C32,"q") -> q | AQ237: =IF(RC[-22]<>0,RC[-22]&R4C32,"q") -> q | AR237: =IF(RC[-22]<>0,RC[-22]&R4C32,"q") -> q | AS237: =IF(RC[-22]<>0,RC[-22]&R4C32,"q") -> q | AT237: =IF(RC[-22]<>0,RC[-22]&R4C32,"q") -> q | AU237: =IF(RC[-22]<>0,RC[-22]&R4C32,"q") -> q | AV237: =IF(RC[-22]<>0,RC[-22]&R4C32,"q") -> q
AC238: =IF(RC[-22]<>0,RC[-22]&R4C32,"q") -> q | AD238: =IF(RC[-22]<>0,RC[-22]&R4C32,"q") -> q | AE238: =IF(RC[-22]<>0,RC[-22]&R4C32,"q") -> q | AF238: =IF(RC[-22]<>0,RC[-22]&R4C32,"q") -> q | AG238: =IF(RC[-22]<>0,RC[-22]&R4C32,"q") -> q | AH238: =IF(RC[-22]<>0,RC[-22]&R4C32,"q") -> q | AI238: =IF(RC[-22]<>0,RC[-22]&R4C32,"q") -> q | AJ238: =IF(RC[-22]<>0,RC[-22]&R4C32,"q") -> q | AK238: =IF(RC[-22]<>0,RC[-22]&R4C32,"q") -> q | AL238: =IF(RC[-22]<>0,RC[-22]&R4C32,"q") -> q | AM238: =IF(RC[-22]<>0,RC[-22]&R4C32,"q") -> q | AN238: =IF(RC[-22]<>0,RC[-22]&R4C32,"q") -> q | AO238: =IF(RC[-22]<>0,RC[-22]&R4C32,"q") -> q | AP238: =IF(RC[-22]<>0,RC[-22]&R4C32,"q") -> q | AQ238: =IF(RC[-22]<>0,RC[-22]&R4C32,"q") -> q | AR238: =IF(RC[-22]<>0,RC[-22]&R4C32,"q") -> q | AS238: =IF(RC[-22]<>0,RC[-22]&R4C32,"q") -> q | AT238: =IF(RC[-22]<>0,RC[-22]&R4C32,"q") -> q | AU238: =IF(RC[-22]<>0,RC[-22]&R4C32,"q") -> q | AV238: =IF(RC[-22]<>0,RC[-22]&R4C32,"q") -> q
AC239: =IF(RC[-22]<>0,RC[-22]&R4C32,"q") -> q | AD239: =IF(RC[-22]<>0,RC[-22]&R4C32,"q") -> q | AE239: =IF(RC[-22]<>0,RC[-22]&R4C32,"q") -> q | AF239: =IF(RC[-22]<>0,RC[-22]&R4C32,"q") -> q | AG239: =IF(RC[-22]<>0,RC[-22]&R4C32,"q") -> q | AH239: =IF(RC[-22]<>0,RC[-22]&R4C32,"q") -> q | AI239: =IF(RC[-22]<>0,RC[-22]&R4C32,"q") -> q | AJ239: =IF(RC[-22]<>0,RC[-22]&R4C32,"q") -> q | AK239: =IF(RC[-22]<>0,RC[-22]&R4C32,"q") -> q | AL239: =IF(RC[-22]<>0,RC[-22]&R4C32,"q") -> q | AM239: =IF(RC[-22]<>0,RC[-22]&R4C32,"q") -> q | AN239: =IF(RC[-22]<>0,RC[-22]&R4C32,"q") -> q | AO239: =IF(RC[-22]<>0,RC[-22]&R4C32,"q") -> q | AP239: =IF(RC[-22]<>0,RC[-22]&R4C32,"q") -> q | AQ239: =IF(RC[-22]<>0,RC[-22]&R4C32,"q") -> q | AR239: =IF(RC[-22]<>0,RC[-22]&R4C32,"q") -> q | AS239: =IF(RC[-22]<>0,RC[-22]&R4C32,"q") -> q | AT239: =IF(RC[-22]<>0,RC[-22]&R4C32,"q") -> q | AU239: =IF(RC[-22]<>0,RC[-22]&R4C32,"q") -> q | AV239: =IF(RC[-22]<>0,RC[-22]&R4C32,"q") -> q
AC240: =IF(RC[-22]<>0,RC[-22]&R4C32,"q") -> q | AD240: =IF(RC[-22]<>0,RC[-22]&R4C32,"q") -> q | AE240: =IF(RC[-22]<>0,RC[-22]&R4C32,"q") -> q | AF240: =IF(RC[-22]<>0,RC[-22]&R4C32,"q") -> q | AG240: =IF(RC[-22]<>0,RC[-22]&R4C32,"q") -> q | AH240: =IF(RC[-22]<>0,RC[-22]&R4C32,"q") -> q | AI240: =IF(RC[-22]<>0,RC[-22]&R4C32,"q") -> q | AJ240: =IF(RC[-22]<>0,RC[-22]&R4C32,"q") -> q | AK240: =IF(RC[-22]<>0,RC[-22]&R4C32,"q") -> q | AL240: =IF(RC[-22]<>0,RC[-22]&R4C32,"q") -> q | AM240: =IF(RC[-22]<>0,RC[-22]&R4C32,"q") -> q | AN240: =IF(RC[-22]<>0,RC[-22]&R4C32,"q") -> q | AO240: =IF(RC[-22]<>0,RC[-22]&R4C32,"q") -> q | AP240: =IF(RC[-22]<>0,RC[-22]&R4C32,"q") -> q | AQ240: =IF(RC[-22]<>0,RC[-22]&R4C32,"q") -> q | AR240: =IF(RC[-22]<>0,RC[-22]&R4C32,"q") -> q | AS240: =IF(RC[-22]<>0,RC[-22]&R4C32,"q") -> q | AT240: =IF(RC[-22]<>0,RC[-22]&R4C32,"q") -> q | AU240: =IF(RC[-22]<>0,RC[-22]&R4C32,"q") -> q | AV240: =IF(RC[-22]<>0,RC[-22]&R4C32,"q") -> q
AC241: =IF(RC[-22]<>0,RC[-22]&R4C32,"q") -> q | AD241: =IF(RC[-22]<>0,RC[-22]&R4C32,"q") -> q | AE241: =IF(RC[-22]<>0,RC[-22]&R4C32,"q") -> q | AF241: =IF(RC[-22]<>0,RC[-22]&R4C32,"q") -> q | AG241: =IF(RC[-22]<>0,RC[-22]&R4C32,"q") -> q | AH241: =IF(RC[-22]<>0,RC[-22]&R4C32,"q") -> q | AI241: =IF(RC[-22]<>0,RC[-22]&R4C32,"q") -> q | AJ241: =IF(RC[-22]<>0,RC[-22]&R4C32,"q") -> q | AK241: =IF(RC[-22]<>0,RC[-22]&R4C32,"q") -> q | AL241: =IF(RC[-22]<>0,RC[-22]&R4C32,"q") -> q | AM241: =IF(RC[-22]<>0,RC[-22]&R4C32,"q") -> q | AN241: =IF(RC[-22]<>0,RC[-22]&R4C32,"q") -> q | AO241: =IF(RC[-22]<>0,RC[-22]&R4C32,"q") -> q | AP241: =IF(RC[-22]<>0,RC[-22]&R4C32,"q") -> q | AQ241: =IF(RC[-22]<>0,RC[-22]&R4C32,"q") -> q | AR241: =IF(RC[-22]<>0,RC[-22]&R4C32,"q") -> q | AS241: =IF(RC[-22]<>0,RC[-22]&R4C32,"q") -> q | AT241: =IF(RC[-22]<>0,RC[-22]&R4C32,"q") -> q | AU241: =IF(RC[-22]<>0,RC[-22]&R4C32,"q") -> q | AV241: =IF(RC[-22]<>0,RC[-22]&R4C32,"q") -> q
AC242: =IF(RC[-22]<>0,RC[-22]&R4C32,"q") -> q | AD242: =IF(RC[-22]<>0,RC[-22]&R4C32,"q") -> q | AE242: =IF(RC[-22]<>0,RC[-22]&R4C32,"q") -> q | AF242: =IF(RC[-22]<>0,RC[-22]&R4C32,"q") -> q | AG242: =IF(RC[-22]<>0,RC[-22]&R4C32,"q") -> q | AH242: =IF(RC[-22]<>0,RC[-22]&R4C32,"q") -> q | AI242: =IF(RC[-22]<>0,RC[-22]&R4C32,"q") -> q | AJ242: =IF(RC[-22]<>0,RC[-22]&R4C32,"q") -> q | AK242: =IF(RC[-22]<>0,RC[-22]&R4C32,"q") -> q | AL242: =IF(RC[-22]<>0,RC[-22]&R4C32,"q") -> q | AM242: =IF(RC[-22]<>0,RC[-22]&R4C32,"q") -> q | AN242: =IF(RC[-22]<>0,RC[-22]&R4C32,"q") -> q | AO242: =IF(RC[-22]<>0,RC[-22]&R4C32,"q") -> q | AP242: =IF(RC[-22]<>0,RC[-22]&R4C32,"q") -> q | AQ242: =IF(RC[-22]<>0,RC[-22]&R4C32,"q") -> q | AR242: =IF(RC[-22]<>0,RC[-22]&R4C32,"q") -> q | AS242: =IF(RC[-22]<>0,RC[-22]&R4C32,"q") -> q | AT242: =IF(RC[-22]<>0,RC[-22]&R4C32,"q") -> q | AU242: =IF(RC[-22]<>0,RC[-22]&R4C32,"q") -> q | AV242: =IF(RC[-22]<>0,RC[-22]&R4C32,"q") -> q
AC243: =IF(RC[-22]<>0,RC[-22]&R4C32,"q") -> q | AD243: =IF(RC[-22]<>0,RC[-22]&R4C32,"q") -> q | AE243: =IF(RC[-22]<>0,RC[-22]&R4C32,"q") -> q | AF243: =IF(RC[-22]<>0,RC[-22]&R4C32,"q") -> q | AG243: =IF(RC[-22]<>0,RC[-22]&R4C32,"q") -> q | AH243: =IF(RC[-22]<>0,RC[-22]&R4C32,"q") -> q | AI243: =IF(RC[-22]<>0,RC[-22]&R4C32,"q") -> q | AJ243: =IF(RC[-22]<>0,RC[-22]&R4C32,"q") -> q | AK243: =IF(RC[-22]<>0,RC[-22]&R4C32,"q") -> q | AL243: =IF(RC[-22]<>0,RC[-22]&R4C32,"q") -> q | AM243: =IF(RC[-22]<>0,RC[-22]&R4C32,"q") -> q | AN243: =IF(RC[-22]<>0,RC[-22]&R4C32,"q") -> q | AO243: =IF(RC[-22]<>0,RC[-22]&R4C32,"q") -> q | AP243: =IF(RC[-22]<>0,RC[-22]&R4C32,"q") -> q | AQ243: =IF(RC[-22]<>0,RC[-22]&R4C32,"q") -> q | AR243: =IF(RC[-22]<>0,RC[-22]&R4C32,"q") -> q | AS243: =IF(RC[-22]<>0,RC[-22]&R4C32,"q") -> q | AT243: =IF(RC[-22]<>0,RC[-22]&R4C32,"q") -> q | AU243: =IF(RC[-22]<>0,RC[-22]&R4C32,"q") -> q | AV243: =IF(RC[-22]<>0,RC[-22]&R4C32,"q") -> q
AC244: =IF(RC[-22]<>0,RC[-22]&R4C32,"q") -> q | AD244: =IF(RC[-22]<>0,RC[-22]&R4C32,"q") -> q | AE244: =IF(RC[-22]<>0,RC[-22]&R4C32,"q") -> q | AF244: =IF(RC[-22]<>0,RC[-22]&R4C32,"q") -> q | AG244: =IF(RC[-22]<>0,RC[-22]&R4C32,"q") -> q | AH244: =IF(RC[-22]<>0,RC[-22]&R4C32,"q") -> q | AI244: =IF(RC[-22]<>0,RC[-22]&R4C32,"q") -> q | AJ244: =IF(RC[-22]<>0,RC[-22]&R4C32,"q") -> q | AK244: =IF(RC[-22]<>0,RC[-22]&R4C32,"q") -> q | AL244: =IF(RC[-22]<>0,RC[-22]&R4C32,"q") -> q | AM244: =IF(RC[-22]<>0,RC[-22]&R4C32,"q") -> q | AN244: =IF(RC[-22]<>0,RC[-22]&R4C32,"q") -> q | AO244: =IF(RC[-22]<>0,RC[-22]&R4C32,"q") -> q | AP244: =IF(RC[-22]<>0,RC[-22]&R4C32,"q") -> q | AQ244: =IF(RC[-22]<>0,RC[-22]&R4C32,"q") -> q | AR244: =IF(RC[-22]<>0,RC[-22]&R4C32,"q") -> q | AS244: =IF(RC[-22]<>0,RC[-22]&R4C32,"q") -> q | AT244: =IF(RC[-22]<>0,RC[-22]&R4C32,"q") -> q | AU244: =IF(RC[-22]<>0,RC[-22]&R4C32,"q") -> q | AV244: =IF(RC[-22]<>0,RC[-22]&R4C32,"q") -> q
AC245: =IF(RC[-22]<>0,RC[-22]&R4C32,"q") -> q | AD245: =IF(RC[-22]<>0,RC[-22]&R4C32,"q") -> q | AE245: =IF(RC[-22]<>0,RC[-22]&R4C32,"q") -> q | AF245: =IF(RC[-22]<>0,RC[-22]&R4C32,"q") -> q | AG245: =IF(RC[-22]<>0,RC[-22]&R4C32,"q") -> q | AH245: =IF(RC[-22]<>0,RC[-22]&R4C32,"q") -> q | AI245: =IF(RC[-22]<>0,RC[-22]&R4C32,"q") -> q | AJ245: =IF(RC[-22]<>0,RC[-22]&R4C32,"q") -> q | AK245: =IF(RC[-22]<>0,RC[-22]&R4C32,"q") -> q | AL245: =IF(RC[-22]<>0,RC[-22]&R4C32,"q") -> q | AM245: =IF(RC[-22]<>0,RC[-22]&R4C32,"q") -> q | AN245: =IF(RC[-22]<>0,RC[-22]&R4C32,"q") -> q | AO245: =IF(RC[-22]<>0,RC[-22]&R4C32,"q") -> q | AP245: =IF(RC[-22]<>0,RC[-22]&R4C32,"q") -> q | AQ245: =IF(RC[-22]<>0,RC[-22]&R4C32,"q") -> q | AR245: =IF(RC[-22]<>0,RC[-22]&R4C32,"q") -> q | AS245: =IF(RC[-22]<>0,RC[-22]&R4C32,"q") -> q | AT245: =IF(RC[-22]<>0,RC[-22]&R4C32,"q") -> q | AU245: =IF(RC[-22]<>0,RC[-22]&R4C32,"q") -> q | AV245: =IF(RC[-22]<>0,RC[-22]&R4C32,"q") -> q
AC246: =IF(RC[-22]<>0,RC[-22]&R4C32,"q") -> q | AD246: =IF(RC[-22]<>0,RC[-22]&R4C32,"q") -> q | AE246: =IF(RC[-22]<>0,RC[-22]&R4C32,"q") -> q | AF246: =IF(RC[-22]<>0,RC[-22]&R4C32,"q") -> q | AG246: =IF(RC[-22]<>0,RC[-22]&R4C32,"q") -> q | AH246: =IF(RC[-22]<>0,RC[-22]&R4C32,"q") -> q | AI246: =IF(RC[-22]<>0,RC[-22]&R4C32,"q") -> q | AJ246: =IF(RC[-22]<>0,RC[-22]&R4C32,"q") -> q | AK246: =IF(RC[-22]<>0,RC[-22]&R4C32,"q") -> q | AL246: =IF(RC[-22]<>0,RC[-22]&R4C32,"q") -> q | AM246: =IF(RC[-22]<>0,RC[-22]&R4C32,"q") -> q | AN246: =IF(RC[-22]<>0,RC[-22]&R4C32,"q") -> q | AO246: =IF(RC[-22]<>0,RC[-22]&R4C32,"q") -> q | AP246: =IF(RC[-22]<>0,RC[-22]&R4C32,"q") -> q | AQ246: =IF(RC[-22]<>0,RC[-22]&R4C32,"q") -> q | AR246: =IF(RC[-22]<>0,RC[-22]&R4C32,"q") -> q | AS246: =IF(RC[-22]<>0,RC[-22]&R4C32,"q") -> q | AT246: =IF(RC[-22]<>0,RC[-22]&R4C32,"q") -> q | AU246: =IF(RC[-22]<>0,RC[-22]&R4C32,"q") -> q | AV246: =IF(RC[-22]<>0,RC[-22]&R4C32,"q") -> q
AC247: =IF(RC[-22]<>0,RC[-22]&R4C32,"q") -> q | AD247: =IF(RC[-22]<>0,RC[-22]&R4C32,"q") -> q | AE247: =IF(RC[-22]<>0,RC[-22]&R4C32,"q") -> q | AF247: =IF(RC[-22]<>0,RC[-22]&R4C32,"q") -> q | AG247: =IF(RC[-22]<>0,RC[-22]&R4C32,"q") -> q | AH247: =IF(RC[-22]<>0,RC[-22]&R4C32,"q") -> q | AI247: =IF(RC[-22]<>0,RC[-22]&R4C32,"q") -> q | AJ247: =IF(RC[-22]<>0,RC[-22]&R4C32,"q") -> q | AK247: =IF(RC[-22]<>0,RC[-22]&R4C32,"q") -> q | AL247: =IF(RC[-22]<>0,RC[-22]&R4C32,"q") -> q | AM247: =IF(RC[-22]<>0,RC[-22]&R4C32,"q") -> q | AN247: =IF(RC[-22]<>0,RC[-22]&R4C32,"q") -> q | AO247: =IF(RC[-22]<>0,RC[-22]&R4C32,"q") -> q | AP247: =IF(RC[-22]<>0,RC[-22]&R4C32,"q") -> q | AQ247: =IF(RC[-22]<>0,RC[-22]&R4C32,"q") -> q | AR247: =IF(RC[-22]<>0,RC[-22]&R4C32,"q") -> q | AS247: =IF(RC[-22]<>0,RC[-22]&R4C32,"q") -> q | AT247: =IF(RC[-22]<>0,RC[-22]&R4C32,"q") -> q | AU247: =IF(RC[-22]<>0,RC[-22]&R4C32,"q") -> q | AV247: =IF(RC[-22]<>0,RC[-22]&R4C32,"q") -> q
AC248: =IF(RC[-22]<>0,RC[-22]&R4C32,"q") -> q | AD248: =IF(RC[-22]<>0,RC[-22]&R4C32,"q") -> q | AE248: =IF(RC[-22]<>0,RC[-22]&R4C32,"q") -> q | AF248: =IF(RC[-22]<>0,RC[-22]&R4C32,"q") -> q | AG248: =IF(RC[-22]<>0,RC[-22]&R4C32,"q") -> q | AH248: =IF(RC[-22]<>0,RC[-22]&R4C32,"q") -> q | AI248: =IF(RC[-22]<>0,RC[-22]&R4C32,"q") -> q | AJ248: =IF(RC[-22]<>0,RC[-22]&R4C32,"q") -> q | AK248: =IF(RC[-22]<>0,RC[-22]&R4C32,"q") -> q | AL248: =IF(RC[-22]<>0,RC[-22]&R4C32,"q") -> q | AM248: =IF(RC[-22]<>0,RC[-22]&R4C32,"q") -> q | AN248: =IF(RC[-22]<>0,RC[-22]&R4C32,"q") -> q | AO248: =IF(RC[-22]<>0,RC[-22]&R4C32,"q") -> q | AP248: =IF(RC[-22]<>0,RC[-22]&R4C32,"q") -> q | AQ248: =IF(RC[-22]<>0,RC[-22]&R4C32,"q") -> q | AR248: =IF(RC[-22]<>0,RC[-22]&R4C32,"q") -> q | AS248: =IF(RC[-22]<>0,RC[-22]&R4C32,"q") -> q | AT248: =IF(RC[-22]<>0,RC[-22]&R4C32,"q") -> q | AU248: =IF(RC[-22]<>0,RC[-22]&R4C32,"q") -> q | AV248: =IF(RC[-22]<>0,RC[-22]&R4C32,"q") -> q
AC249: =IF(RC[-22]<>0,RC[-22]&R4C32,"q") -> q | AD249: =IF(RC[-22]<>0,RC[-22]&R4C32,"q") -> q | AE249: =IF(RC[-22]<>0,RC[-22]&R4C32,"q") -> q | AF249: =IF(RC[-22]<>0,RC[-22]&R4C32,"q") -> q | AG249: =IF(RC[-22]<>0,RC[-22]&R4C32,"q") -> q | AH249: =IF(RC[-22]<>0,RC[-22]&R4C32,"q") -> q | AI249: =IF(RC[-22]<>0,RC[-22]&R4C32,"q") -> q | AJ249: =IF(RC[-22]<>0,RC[-22]&R4C32,"q") -> q | AK249: =IF(RC[-22]<>0,RC[-22]&R4C32,"q") -> q | AL249: =IF(RC[-22]<>0,RC[-22]&R4C32,"q") -> q | AM249: =IF(RC[-22]<>0,RC[-22]&R4C32,"q") -> q | AN249: =IF(RC[-22]<>0,RC[-22]&R4C32,"q") -> q | AO249: =IF(RC[-22]<>0,RC[-22]&R4C32,"q") -> q | AP249: =IF(RC[-22]<>0,RC[-22]&R4C32,"q") -> q | AQ249: =IF(RC[-22]<>0,RC[-22]&R4C32,"q") -> q | AR249: =IF(RC[-22]<>0,RC[-22]&R4C32,"q") -> q | AS249: =IF(RC[-22]<>0,RC[-22]&R4C32,"q") -> q | AT249: =IF(RC[-22]<>0,RC[-22]&R4C32,"q") -> q | AU249: =IF(RC[-22]<>0,RC[-22]&R4C32,"q") -> q | AV249: =IF(RC[-22]<>0,RC[-22]&R4C32,"q") -> q
AC250: =IF(RC[-22]<>0,RC[-22]&R4C32,"q") -> q | AD250: =IF(RC[-22]<>0,RC[-22]&R4C32,"q") -> q | AE250: =IF(RC[-22]<>0,RC[-22]&R4C32,"q") -> q | AF250: =IF(RC[-22]<>0,RC[-22]&R4C32,"q") -> q | AG250: =IF(RC[-22]<>0,RC[-22]&R4C32,"q") -> q | AH250: =IF(RC[-22]<>0,RC[-22]&R4C32,"q") -> q | AI250: =IF(RC[-22]<>0,RC[-22]&R4C32,"q") -> q | AJ250: =IF(RC[-22]<>0,RC[-22]&R4C32,"q") -> q | AK250: =IF(RC[-22]<>0,RC[-22]&R4C32,"q") -> q | AL250: =IF(RC[-22]<>0,RC[-22]&R4C32,"q") -> q | AM250: =IF(RC[-22]<>0,RC[-22]&R4C32,"q") -> q | AN250: =IF(RC[-22]<>0,RC[-22]&R4C32,"q") -> q | AO250: =IF(RC[-22]<>0,RC[-22]&R4C32,"q") -> q | AP250: =IF(RC[-22]<>0,RC[-22]&R4C32,"q") -> q | AQ250: =IF(RC[-22]<>0,RC[-22]&R4C32,"q") -> q | AR250: =IF(RC[-22]<>0,RC[-22]&R4C32,"q") -> q | AS250: =IF(RC[-22]<>0,RC[-22]&R4C32,"q") -> q | AT250: =IF(RC[-22]<>0,RC[-22]&R4C32,"q") -> q | AU250: =IF(RC[-22]<>0,RC[-22]&R4C32,"q") -> q | AV250: =IF(RC[-22]<>0,RC[-22]&R4C32,"q") -> q
AC251: =IF(RC[-22]<>0,RC[-22]&R4C32,"q") -> q | AD251: =IF(RC[-22]<>0,RC[-22]&R4C32,"q") -> q | AE251: =IF(RC[-22]<>0,RC[-22]&R4C32,"q") -> q | AF251: =IF(RC[-22]<>0,RC[-22]&R4C32,"q") -> q | AG251: =IF(RC[-22]<>0,RC[-22]&R4C32,"q") -> q | AH251: =IF(RC[-22]<>0,RC[-22]&R4C32,"q") -> q | AI251: =IF(RC[-22]<>0,RC[-22]&R4C32,"q") -> q | AJ251: =IF(RC[-22]<>0,RC[-22]&R4C32,"q") -> q | AK251: =IF(RC[-22]<>0,RC[-22]&R4C32,"q") -> q | AL251: =IF(RC[-22]<>0,RC[-22]&R4C32,"q") -> q | AM251: =IF(RC[-22]<>0,RC[-22]&R4C32,"q") -> q | AN251: =IF(RC[-22]<>0,RC[-22]&R4C32,"q") -> q | AO251: =IF(RC[-22]<>0,RC[-22]&R4C32,"q") -> q | AP251: =IF(RC[-22]<>0,RC[-22]&R4C32,"q") -> q | AQ251: =IF(RC[-22]<>0,RC[-22]&R4C32,"q") -> q | AR251: =IF(RC[-22]<>0,RC[-22]&R4C32,"q") -> q | AS251: =IF(RC[-22]<>0,RC[-22]&R4C32,"q") -> q | AT251: =IF(RC[-22]<>0,RC[-22]&R4C32,"q") -> q | AU251: =IF(RC[-22]<>0,RC[-22]&R4C32,"q") -> q | AV251: =IF(RC[-22]<>0,RC[-22]&R4C32,"q") -> q
AC252: =IF(RC[-22]<>0,RC[-22]&R4C32,"q") -> q | AD252: =IF(RC[-22]<>0,RC[-22]&R4C32,"q") -> q | AE252: =IF(RC[-22]<>0,RC[-22]&R4C32,"q") -> q | AF252: =IF(RC[-22]<>0,RC[-22]&R4C32,"q") -> q | AG252: =IF(RC[-22]<>0,RC[-22]&R4C32,"q") -> q | AH252: =IF(RC[-22]<>0,RC[-22]&R4C32,"q") -> q | AI252: =IF(RC[-22]<>0,RC[-22]&R4C32,"q") -> q | AJ252: =IF(RC[-22]<>0,RC[-22]&R4C32,"q") -> q | AK252: =IF(RC[-22]<>0,RC[-22]&R4C32,"q") -> q | AL252: =IF(RC[-22]<>0,RC[-22]&R4C32,"q") -> q | AM252: =IF(RC[-22]<>0,RC[-22]&R4C32,"q") -> q | AN252: =IF(RC[-22]<>0,RC[-22]&R4C32,"q") -> q | AO252: =IF(RC[-22]<>0,RC[-22]&R4C32,"q") -> q | AP252: =IF(RC[-22]<>0,RC[-22]&R4C32,"q") -> q | AQ252: =IF(RC[-22]<>0,RC[-22]&R4C32,"q") -> q | AR252: =IF(RC[-22]<>0,RC[-22]&R4C32,"q") -> q | AS252: =IF(RC[-22]<>0,RC[-22]&R4C32,"q") -> q | AT252: =IF(RC[-22]<>0,RC[-22]&R4C32,"q") -> q | AU252: =IF(RC[-22]<>0,RC[-22]&R4C32,"q") -> q | AV252: =IF(RC[-22]<>0,RC[-22]&R4C32,"q") -> q
AC253: =IF(RC[-22]<>0,RC[-22]&R4C32,"q") -> q | AD253: =IF(RC[-22]<>0,RC[-22]&R4C32,"q") -> q | AE253: =IF(RC[-22]<>0,RC[-22]&R4C32,"q") -> q | AF253: =IF(RC[-22]<>0,RC[-22]&R4C32,"q") -> q | AG253: =IF(RC[-22]<>0,RC[-22]&R4C32,"q") -> q | AH253: =IF(RC[-22]<>0,RC[-22]&R4C32,"q") -> q | AI253: =IF(RC[-22]<>0,RC[-22]&R4C32,"q") -> q | AJ253: =IF(RC[-22]<>0,RC[-22]&R4C32,"q") -> q | AK253: =IF(RC[-22]<>0,RC[-22]&R4C32,"q") -> q | AL253: =IF(RC[-22]<>0,RC[-22]&R4C32,"q") -> q | AM253: =IF(RC[-22]<>0,RC[-22]&R4C32,"q") -> q | AN253: =IF(RC[-22]<>0,RC[-22]&R4C32,"q") -> q | AO253: =IF(RC[-22]<>0,RC[-22]&R4C32,"q") -> q | AP253: =IF(RC[-22]<>0,RC[-22]&R4C32,"q") -> q | AQ253: =IF(RC[-22]<>0,RC[-22]&R4C32,"q") -> q | AR253: =IF(RC[-22]<>0,RC[-22]&R4C32,"q") -> q | AS253: =IF(RC[-22]<>0,RC[-22]&R4C32,"q") -> q | AT253: =IF(RC[-22]<>0,RC[-22]&R4C32,"q") -> q | AU253: =IF(RC[-22]<>0,RC[-22]&R4C32,"q") -> q | AV253: =IF(RC[-22]<>0,RC[-22]&R4C32,"q") -> q
AC254: =IF(RC[-22]<>0,RC[-22]&R4C32,"q") -> q | AD254: =IF(RC[-22]<>0,RC[-22]&R4C32,"q") -> q | AE254: =IF(RC[-22]<>0,RC[-22]&R4C32,"q") -> q | AF254: =IF(RC[-22]<>0,RC[-22]&R4C32,"q") -> q | AG254: =IF(RC[-22]<>0,RC[-22]&R4C32,"q") -> q | AH254: =IF(RC[-22]<>0,RC[-22]&R4C32,"q") -> q | AI254: =IF(RC[-22]<>0,RC[-22]&R4C32,"q") -> q | AJ254: =IF(RC[-22]<>0,RC[-22]&R4C32,"q") -> q | AK254: =IF(RC[-22]<>0,RC[-22]&R4C32,"q") -> q | AL254: =IF(RC[-22]<>0,RC[-22]&R4C32,"q") -> q | AM254: =IF(RC[-22]<>0,RC[-22]&R4C32,"q") -> q | AN254: =IF(RC[-22]<>0,RC[-22]&R4C32,"q") -> q | AO254: =IF(RC[-22]<>0,RC[-22]&R4C32,"q") -> q | AP254: =IF(RC[-22]<>0,RC[-22]&R4C32,"q") -> q | AQ254: =IF(RC[-22]<>0,RC[-22]&R4C32,"q") -> q | AR254: =IF(RC[-22]<>0,RC[-22]&R4C32,"q") -> q | AS254: =IF(RC[-22]<>0,RC[-22]&R4C32,"q") -> q | AT254: =IF(RC[-22]<>0,RC[-22]&R4C32,"q") -> q | AU254: =IF(RC[-22]<>0,RC[-22]&R4C32,"q") -> q | AV254: =IF(RC[-22]<>0,RC[-22]&R4C32,"q") -> q
AC255: =IF(RC[-22]<>0,RC[-22]&R4C32,"q") -> q | AD255: =IF(RC[-22]<>0,RC[-22]&R4C32,"q") -> q | AE255: =IF(RC[-22]<>0,RC[-22]&R4C32,"q") -> q | AF255: =IF(RC[-22]<>0,RC[-22]&R4C32,"q") -> q | AG255: =IF(RC[-22]<>0,RC[-22]&R4C32,"q") -> q | AH255: =IF(RC[-22]<>0,RC[-22]&R4C32,"q") -> q | AI255: =IF(RC[-22]<>0,RC[-22]&R4C32,"q") -> q | AJ255: =IF(RC[-22]<>0,RC[-22]&R4C32,"q") -> q | AK255: =IF(RC[-22]<>0,RC[-22]&R4C32,"q") -> q | AL255: =IF(RC[-22]<>0,RC[-22]&R4C32,"q") -> q | AM255: =IF(RC[-22]<>0,RC[-22]&R4C32,"q") -> q | AN255: =IF(RC[-22]<>0,RC[-22]&R4C32,"q") -> q | AO255: =IF(RC[-22]<>0,RC[-22]&R4C32,"q") -> q | AP255: =IF(RC[-22]<>0,RC[-22]&R4C32,"q") -> q | AQ255: =IF(RC[-22]<>0,RC[-22]&R4C32,"q") -> q | AR255: =IF(RC[-22]<>0,RC[-22]&R4C32,"q") -> q | AS255: =IF(RC[-22]<>0,RC[-22]&R4C32,"q") -> q | AT255: =IF(RC[-22]<>0,RC[-22]&R4C32,"q") -> q | AU255: =IF(RC[-22]<>0,RC[-22]&R4C32,"q") -> q | AV255: =IF(RC[-22]<>0,RC[-22]&R4C32,"q") -> q
AC256: =IF(RC[-22]<>0,RC[-22]&R4C32,"q") -> q | AD256: =IF(RC[-22]<>0,RC[-22]&R4C32,"q") -> q | AE256: =IF(RC[-22]<>0,RC[-22]&R4C32,"q") -> q | AF256: =IF(RC[-22]<>0,RC[-22]&R4C32,"q") -> q | AG256: =IF(RC[-22]<>0,RC[-22]&R4C32,"q") -> q | AH256: =IF(RC[-22]<>0,RC[-22]&R4C32,"q") -> q | AI256: =IF(RC[-22]<>0,RC[-22]&R4C32,"q") -> q | AJ256: =IF(RC[-22]<>0,RC[-22]&R4C32,"q") -> q | AK256: =IF(RC[-22]<>0,RC[-22]&R4C32,"q") -> q | AL256: =IF(RC[-22]<>0,RC[-22]&R4C32,"q") -> q | AM256: =IF(RC[-22]<>0,RC[-22]&R4C32,"q") -> q | AN256: =IF(RC[-22]<>0,RC[-22]&R4C32,"q") -> q | AO256: =IF(RC[-22]<>0,RC[-22]&R4C32,"q") -> q | AP256: =IF(RC[-22]<>0,RC[-22]&R4C32,"q") -> q | AQ256: =IF(RC[-22]<>0,RC[-22]&R4C32,"q") -> q | AR256: =IF(RC[-22]<>0,RC[-22]&R4C32,"q") -> q | AS256: =IF(RC[-22]<>0,RC[-22]&R4C32,"q") -> q | AT256: =IF(RC[-22]<>0,RC[-22]&R4C32,"q") -> q | AU256: =IF(RC[-22]<>0,RC[-22]&R4C32,"q") -> q | AV256: =IF(RC[-22]<>0,RC[-22]&R4C32,"q") -> q
AC257: =IF(RC[-22]<>0,RC[-22]&R4C32,"q") -> q | AD257: =IF(RC[-22]<>0,RC[-22]&R4C32,"q") -> q | AE257: =IF(RC[-22]<>0,RC[-22]&R4C32,"q") -> q | AF257: =IF(RC[-22]<>0,RC[-22]&R4C32,"q") -> q | AG257: =IF(RC[-22]<>0,RC[-22]&R4C32,"q") -> q | AH257: =IF(RC[-22]<>0,RC[-22]&R4C32,"q") -> q | AI257: =IF(RC[-22]<>0,RC[-22]&R4C32,"q") -> q | AJ257: =IF(RC[-22]<>0,RC[-22]&R4C32,"q") -> q | AK257: =IF(RC[-22]<>0,RC[-22]&R4C32,"q") -> q | AL257: =IF(RC[-22]<>0,RC[-22]&R4C32,"q") -> q | AM257: =IF(RC[-22]<>0,RC[-22]&R4C32,"q") -> q | AN257: =IF(RC[-22]<>0,RC[-22]&R4C32,"q") -> q | AO257: =IF(RC[-22]<>0,RC[-22]&R4C32,"q") -> q | AP257: =IF(RC[-22]<>0,RC[-22]&R4C32,"q") -> q | AQ257: =IF(RC[-22]<>0,RC[-22]&R4C32,"q") -> q | AR257: =IF(RC[-22]<>0,RC[-22]&R4C32,"q") -> q | AS257: =IF(RC[-22]<>0,RC[-22]&R4C32,"q") -> q | AT257: =IF(RC[-22]<>0,RC[-22]&R4C32,"q") -> q | AU257: =IF(RC[-22]<>0,RC[-22]&R4C32,"q") -> q | AV257: =IF(RC[-22]<>0,RC[-22]&R4C32,"q") -> q
AC258: =IF(RC[-22]<>0,RC[-22]&R4C32,"q") -> q | AD258: =IF(RC[-22]<>0,RC[-22]&R4C32,"q") -> q | AE258: =IF(RC[-22]<>0,RC[-22]&R4C32,"q") -> q | AF258: =IF(RC[-22]<>0,RC[-22]&R4C32,"q") -> q | AG258: =IF(RC[-22]<>0,RC[-22]&R4C32,"q") -> q | AH258: =IF(RC[-22]<>0,RC[-22]&R4C32,"q") -> q | AI258: =IF(RC[-22]<>0,RC[-22]&R4C32,"q") -> q | AJ258: =IF(RC[-22]<>0,RC[-22]&R4C32,"q") -> q | AK258: =IF(RC[-22]<>0,RC[-22]&R4C32,"q") -> q | AL258: =IF(RC[-22]<>0,RC[-22]&R4C32,"q") -> q | AM258: =IF(RC[-22]<>0,RC[-22]&R4C32,"q") -> q | AN258: =IF(RC[-22]<>0,RC[-22]&R4C32,"q") -> q | AO258: =IF(RC[-22]<>0,RC[-22]&R4C32,"q") -> q | AP258: =IF(RC[-22]<>0,RC[-22]&R4C32,"q") -> q | AQ258: =IF(RC[-22]<>0,RC[-22]&R4C32,"q") -> q | AR258: =IF(RC[-22]<>0,RC[-22]&R4C32,"q") -> q | AS258: =IF(RC[-22]<>0,RC[-22]&R4C32,"q") -> q | AT258: =IF(RC[-22]<>0,RC[-22]&R4C32,"q") -> q | AU258: =IF(RC[-22]<>0,RC[-22]&R4C32,"q") -> q | AV258: =IF(RC[-22]<>0,RC[-22]&R4C32,"q") -> q
AC259: =IF(RC[-22]<>0,RC[-22]&R4C32,"q") -> q | AD259: =IF(RC[-22]<>0,RC[-22]&R4C32,"q") -> q | AE259: =IF(RC[-22]<>0,RC[-22]&R4C32,"q") -> q | AF259: =IF(RC[-22]<>0,RC[-22]&R4C32,"q") -> q | AG259: =IF(RC[-22]<>0,RC[-22]&R4C32,"q") -> q | AH259: =IF(RC[-22]<>0,RC[-22]&R4C32,"q") -> q | AI259: =IF(RC[-22]<>0,RC[-22]&R4C32,"q") -> q | AJ259: =IF(RC[-22]<>0,RC[-22]&R4C32,"q") -> q | AK259: =IF(RC[-22]<>0,RC[-22]&R4C32,"q") -> q | AL259: =IF(RC[-22]<>0,RC[-22]&R4C32,"q") -> q | AM259: =IF(RC[-22]<>0,RC[-22]&R4C32,"q") -> q | AN259: =IF(RC[-22]<>0,RC[-22]&R4C32,"q") -> q | AO259: =IF(RC[-22]<>0,RC[-22]&R4C32,"q") -> q | AP259: =IF(RC[-22]<>0,RC[-22]&R4C32,"q") -> q | AQ259: =IF(RC[-22]<>0,RC[-22]&R4C32,"q") -> q | AR259: =IF(RC[-22]<>0,RC[-22]&R4C32,"q") -> q | AS259: =IF(RC[-22]<>0,RC[-22]&R4C32,"q") -> q | AT259: =IF(RC[-22]<>0,RC[-22]&R4C32,"q") -> q | AU259: =IF(RC[-22]<>0,RC[-22]&R4C32,"q") -> q | AV259: =IF(RC[-22]<>0,RC[-22]&R4C32,"q") -> q
AC260: =IF(RC[-22]<>0,RC[-22]&R4C32,"q") -> q | AD260: =IF(RC[-22]<>0,RC[-22]&R4C32,"q") -> q | AE260: =IF(RC[-22]<>0,RC[-22]&R4C32,"q") -> q | AF260: =IF(RC[-22]<>0,RC[-22]&R4C32,"q") -> q | AG260: =IF(RC[-22]<>0,RC[-22]&R4C32,"q") -> q | AH260: =IF(RC[-22]<>0,RC[-22]&R4C32,"q") -> q | AI260: =IF(RC[-22]<>0,RC[-22]&R4C32,"q") -> q | AJ260: =IF(RC[-22]<>0,RC[-22]&R4C32,"q") -> q | AK260: =IF(RC[-22]<>0,RC[-22]&R4C32,"q") -> q | AL260: =IF(RC[-22]<>0,RC[-22]&R4C32,"q") -> q | AM260: =IF(RC[-22]<>0,RC[-22]&R4C32,"q") -> q | AN260: =IF(RC[-22]<>0,RC[-22]&R4C32,"q") -> q | AO260: =IF(RC[-22]<>0,RC[-22]&R4C32,"q") -> q | AP260: =IF(RC[-22]<>0,RC[-22]&R4C32,"q") -> q | AQ260: =IF(RC[-22]<>0,RC[-22]&R4C32,"q") -> q | AR260: =IF(RC[-22]<>0,RC[-22]&R4C32,"q") -> q | AS260: =IF(RC[-22]<>0,RC[-22]&R4C32,"q") -> q | AT260: =IF(RC[-22]<>0,RC[-22]&R4C32,"q") -> q | AU260: =IF(RC[-22]<>0,RC[-22]&R4C32,"q") -> q | AV260: =IF(RC[-22]<>0,RC[-22]&R4C32,"q") -> q
AC261: =IF(RC[-22]<>0,RC[-22]&R4C32,"q") -> q | AD261: =IF(RC[-22]<>0,RC[-22]&R4C32,"q") -> q | AE261: =IF(RC[-22]<>0,RC[-22]&R4C32,"q") -> q | AF261: =IF(RC[-22]<>0,RC[-22]&R4C32,"q") -> q | AG261: =IF(RC[-22]<>0,RC[-22]&R4C32,"q") -> q | AH261: =IF(RC[-22]<>0,RC[-22]&R4C32,"q") -> q | AI261: =IF(RC[-22]<>0,RC[-22]&R4C32,"q") -> q | AJ261: =IF(RC[-22]<>0,RC[-22]&R4C32,"q") -> q | AK261: =IF(RC[-22]<>0,RC[-22]&R4C32,"q") -> q | AL261: =IF(RC[-22]<>0,RC[-22]&R4C32,"q") -> q | AM261: =IF(RC[-22]<>0,RC[-22]&R4C32,"q") -> q | AN261: =IF(RC[-22]<>0,RC[-22]&R4C32,"q") -> q | AO261: =IF(RC[-22]<>0,RC[-22]&R4C32,"q") -> q | AP261: =IF(RC[-22]<>0,RC[-22]&R4C32,"q") -> q | AQ261: =IF(RC[-22]<>0,RC[-22]&R4C32,"q") -> q | AR261: =IF(RC[-22]<>0,RC[-22]&R4C32,"q") -> q | AS261: =IF(RC[-22]<>0,RC[-22]&R4C32,"q") -> q | AT261: =IF(RC[-22]<>0,RC[-22]&R4C32,"q") -> q | AU261: =IF(RC[-22]<>0,RC[-22]&R4C32,"q") -> q | AV261: =IF(RC[-22]<>0,RC[-22]&R4C32,"q") -> q
AC262: =IF(RC[-22]<>0,RC[-22]&R4C32,"q") -> q | AD262: =IF(RC[-22]<>0,RC[-22]&R4C32,"q") -> q | AE262: =IF(RC[-22]<>0,RC[-22]&R4C32,"q") -> q | AF262: =IF(RC[-22]<>0,RC[-22]&R4C32,"q") -> q | AG262: =IF(RC[-22]<>0,RC[-22]&R4C32,"q") -> q | AH262: =IF(RC[-22]<>0,RC[-22]&R4C32,"q") -> q | AI262: =IF(RC[-22]<>0,RC[-22]&R4C32,"q") -> q | AJ262: =IF(RC[-22]<>0,RC[-22]&R4C32,"q") -> q | AK262: =IF(RC[-22]<>0,RC[-22]&R4C32,"q") -> q | AL262: =IF(RC[-22]<>0,RC[-22]&R4C32,"q") -> q | AM262: =IF(RC[-22]<>0,RC[-22]&R4C32,"q") -> q | AN262: =IF(RC[-22]<>0,RC[-22]&R4C32,"q") -> q | AO262: =IF(RC[-22]<>0,RC[-22]&R4C32,"q") -> q | AP262: =IF(RC[-22]<>0,RC[-22]&R4C32,"q") -> q | AQ262: =IF(RC[-22]<>0,RC[-22]&R4C32,"q") -> q | AR262: =IF(RC[-22]<>0,RC[-22]&R4C32,"q") -> q | AS262: =IF(RC[-22]<>0,RC[-22]&R4C32,"q") -> q | AT262: =IF(RC[-22]<>0,RC[-22]&R4C32,"q") -> q | AU262: =IF(RC[-22]<>0,RC[-22]&R4C32,"q") -> q | AV262: =IF(RC[-22]<>0,RC[-22]&R4C32,"q") -> q
AC263: =IF(RC[-22]<>0,RC[-22]&R4C32,"q") -> q | AD263: =IF(RC[-22]<>0,RC[-22]&R4C32,"q") -> q | AE263: =IF(RC[-22]<>0,RC[-22]&R4C32,"q") -> q | AF263: =IF(RC[-22]<>0,RC[-22]&R4C32,"q") -> q | AG263: =IF(RC[-22]<>0,RC[-22]&R4C32,"q") -> q | AH263: =IF(RC[-22]<>0,RC[-22]&R4C32,"q") -> q | AI263: =IF(RC[-22]<>0,RC[-22]&R4C32,"q") -> q | AJ263: =IF(RC[-22]<>0,RC[-22]&R4C32,"q") -> q | AK263: =IF(RC[-22]<>0,RC[-22]&R4C32,"q") -> q | AL263: =IF(RC[-22]<>0,RC[-22]&R4C32,"q") -> q | AM263: =IF(RC[-22]<>0,RC[-22]&R4C32,"q") -> q | AN263: =IF(RC[-22]<>0,RC[-22]&R4C32,"q") -> q | AO263: =IF(RC[-22]<>0,RC[-22]&R4C32,"q") -> q | AP263: =IF(RC[-22]<>0,RC[-22]&R4C32,"q") -> q | AQ263: =IF(RC[-22]<>0,RC[-22]&R4C32,"q") -> q | AR263: =IF(RC[-22]<>0,RC[-22]&R4C32,"q") -> q | AS263: =IF(RC[-22]<>0,RC[-22]&R4C32,"q") -> q | AT263: =IF(RC[-22]<>0,RC[-22]&R4C32,"q") -> q | AU263: =IF(RC[-22]<>0,RC[-22]&R4C32,"q") -> q | AV263: =IF(RC[-22]<>0,RC[-22]&R4C32,"q") -> q
AC264: =IF(RC[-22]<>0,RC[-22]&R4C32,"q") -> q | AD264: =IF(RC[-22]<>0,RC[-22]&R4C32,"q") -> q | AE264: =IF(RC[-22]<>0,RC[-22]&R4C32,"q") -> q | AF264: =IF(RC[-22]<>0,RC[-22]&R4C32,"q") -> q | AG264: =IF(RC[-22]<>0,RC[-22]&R4C32,"q") -> q | AH264: =IF(RC[-22]<>0,RC[-22]&R4C32,"q") -> q | AI264: =IF(RC[-22]<>0,RC[-22]&R4C32,"q") -> q | AJ264: =IF(RC[-22]<>0,RC[-22]&R4C32,"q") -> q | AK264: =IF(RC[-22]<>0,RC[-22]&R4C32,"q") -> q | AL264: =IF(RC[-22]<>0,RC[-22]&R4C32,"q") -> q | AM264: =IF(RC[-22]<>0,RC[-22]&R4C32,"q") -> q | AN264: =IF(RC[-22]<>0,RC[-22]&R4C32,"q") -> q | AO264: =IF(RC[-22]<>0,RC[-22]&R4C32,"q") -> q | AP264: =IF(RC[-22]<>0,RC[-22]&R4C32,"q") -> q | AQ264: =IF(RC[-22]<>0,RC[-22]&R4C32,"q") -> q | AR264: =IF(RC[-22]<>0,RC[-22]&R4C32,"q") -> q | AS264: =IF(RC[-22]<>0,RC[-22]&R4C32,"q") -> q | AT264: =IF(RC[-22]<>0,RC[-22]&R4C32,"q") -> q | AU264: =IF(RC[-22]<>0,RC[-22]&R4C32,"q") -> q | AV264: =IF(RC[-22]<>0,RC[-22]&R4C32,"q") -> q
AC265: =IF(RC[-22]<>0,RC[-22]&R4C32,"q") -> q | AD265: =IF(RC[-22]<>0,RC[-22]&R4C32,"q") -> q | AE265: =IF(RC[-22]<>0,RC[-22]&R4C32,"q") -> q | AF265: =IF(RC[-22]<>0,RC[-22]&R4C32,"q") -> q | AG265: =IF(RC[-22]<>0,RC[-22]&R4C32,"q") -> q | AH265: =IF(RC[-22]<>0,RC[-22]&R4C32,"q") -> q | AI265: =IF(RC[-22]<>0,RC[-22]&R4C32,"q") -> q | AJ265: =IF(RC[-22]<>0,RC[-22]&R4C32,"q") -> q | AK265: =IF(RC[-22]<>0,RC[-22]&R4C32,"q") -> q | AL265: =IF(RC[-22]<>0,RC[-22]&R4C32,"q") -> q | AM265: =IF(RC[-22]<>0,RC[-22]&R4C32,"q") -> q | AN265: =IF(RC[-22]<>0,RC[-22]&R4C32,"q") -> q | AO265: =IF(RC[-22]<>0,RC[-22]&R4C32,"q") -> q | AP265: =IF(RC[-22]<>0,RC[-22]&R4C32,"q") -> q | AQ265: =IF(RC[-22]<>0,RC[-22]&R4C32,"q") -> q | AR265: =IF(RC[-22]<>0,RC[-22]&R4C32,"q") -> q | AS265: =IF(RC[-22]<>0,RC[-22]&R4C32,"q") -> q | AT265: =IF(RC[-22]<>0,RC[-22]&R4C32,"q") -> q | AU265: =IF(RC[-22]<>0,RC[-22]&R4C32,"q") -> q | AV265: =IF(RC[-22]<>0,RC[-22]&R4C32,"q") -> q
AC266: =IF(RC[-22]<>0,RC[-22]&R4C32,"q") -> q | AD266: =IF(RC[-22]<>0,RC[-22]&R4C32,"q") -> q | AE266: =IF(RC[-22]<>0,RC[-22]&R4C32,"q") -> q | AF266: =IF(RC[-22]<>0,RC[-22]&R4C32,"q") -> q | AG266: =IF(RC[-22]<>0,RC[-22]&R4C32,"q") -> q | AH266: =IF(RC[-22]<>0,RC[-22]&R4C32,"q") -> q | AI266: =IF(RC[-22]<>0,RC[-22]&R4C32,"q") -> q | AJ266: =IF(RC[-22]<>0,RC[-22]&R4C32,"q") -> q | AK266: =IF(RC[-22]<>0,RC[-22]&R4C32,"q") -> q | AL266: =IF(RC[-22]<>0,RC[-22]&R4C32,"q") -> q | AM266: =IF(RC[-22]<>0,RC[-22]&R4C32,"q") -> q | AN266: =IF(RC[-22]<>0,RC[-22]&R4C32,"q") -> q | AO266: =IF(RC[-22]<>0,RC[-22]&R4C32,"q") -> q | AP266: =IF(RC[-22]<>0,RC[-22]&R4C32,"q") -> q | AQ266: =IF(RC[-22]<>0,RC[-22]&R4C32,"q") -> q | AR266: =IF(RC[-22]<>0,RC[-22]&R4C32,"q") -> q | AS266: =IF(RC[-22]<>0,RC[-22]&R4C32,"q") -> q | AT266: =IF(RC[-22]<>0,RC[-22]&R4C32,"q") -> q | AU266: =IF(RC[-22]<>0,RC[-22]&R4C32,"q") -> q | AV266: =IF(RC[-22]<>0,RC[-22]&R4C32,"q") -> q
AC267: =IF(RC[-22]<>0,RC[-22]&R4C32,"q") -> q | AD267: =IF(RC[-22]<>0,RC[-22]&R4C32,"q") -> q | AE267: =IF(RC[-22]<>0,RC[-22]&R4C32,"q") -> q | AF267: =IF(RC[-22]<>0,RC[-22]&R4C32,"q") -> q | AG267: =IF(RC[-22]<>0,RC[-22]&R4C32,"q") -> q | AH267: =IF(RC[-22]<>0,RC[-22]&R4C32,"q") -> q | AI267: =IF(RC[-22]<>0,RC[-22]&R4C32,"q") -> q | AJ267: =IF(RC[-22]<>0,RC[-22]&R4C32,"q") -> q | AK267: =IF(RC[-22]<>0,RC[-22]&R4C32,"q") -> q | AL267: =IF(RC[-22]<>0,RC[-22]&R4C32,"q") -> q | AM267: =IF(RC[-22]<>0,RC[-22]&R4C32,"q") -> q | AN267: =IF(RC[-22]<>0,RC[-22]&R4C32,"q") -> q | AO267: =IF(RC[-22]<>0,RC[-22]&R4C32,"q") -> q | AP267: =IF(RC[-22]<>0,RC[-22]&R4C32,"q") -> q | AQ267: =IF(RC[-22]<>0,RC[-22]&R4C32,"q") -> q | AR267: =IF(RC[-22]<>0,RC[-22]&R4C32,"q") -> q | AS267: =IF(RC[-22]<>0,RC[-22]&R4C32,"q") -> q | AT267: =IF(RC[-22]<>0,RC[-22]&R4C32,"q") -> q | AU267: =IF(RC[-22]<>0,RC[-22]&R4C32,"q") -> q | AV267: =IF(RC[-22]<>0,RC[-22]&R4C32,"q") -> q
AC268: =IF(RC[-22]<>0,RC[-22]&R4C32,"q") -> q | AD268: =IF(RC[-22]<>0,RC[-22]&R4C32,"q") -> q | AE268: =IF(RC[-22]<>0,RC[-22]&R4C32,"q") -> q | AF268: =IF(RC[-22]<>0,RC[-22]&R4C32,"q") -> q | AG268: =IF(RC[-22]<>0,RC[-22]&R4C32,"q") -> q | AH268: =IF(RC[-22]<>0,RC[-22]&R4C32,"q") -> q | AI268: =IF(RC[-22]<>0,RC[-22]&R4C32,"q") -> q | AJ268: =IF(RC[-22]<>0,RC[-22]&R4C32,"q") -> q | AK268: =IF(RC[-22]<>0,RC[-22]&R4C32,"q") -> q | AL268: =IF(RC[-22]<>0,RC[-22]&R4C32,"q") -> q | AM268: =IF(RC[-22]<>0,RC[-22]&R4C32,"q") -> q | AN268: =IF(RC[-22]<>0,RC[-22]&R4C32,"q") -> q | AO268: =IF(RC[-22]<>0,RC[-22]&R4C32,"q") -> q | AP268: =IF(RC[-22]<>0,RC[-22]&R4C32,"q") -> q | AQ268: =IF(RC[-22]<>0,RC[-22]&R4C32,"q") -> q | AR268: =IF(RC[-22]<>0,RC[-22]&R4C32,"q") -> q | AS268: =IF(RC[-22]<>0,RC[-22]&R4C32,"q") -> q | AT268: =IF(RC[-22]<>0,RC[-22]&R4C32,"q") -> q | AU268: =IF(RC[-22]<>0,RC[-22]&R4C32,"q") -> q | AV268: =IF(RC[-22]<>0,RC[-22]&R4C32,"q") -> q
AC269: =IF(RC[-22]<>0,RC[-22]&R4C32,"q") -> q | AD269: =IF(RC[-22]<>0,RC[-22]&R4C32,"q") -> q | AE269: =IF(RC[-22]<>0,RC[-22]&R4C32,"q") -> q | AF269: =IF(RC[-22]<>0,RC[-22]&R4C32,"q") -> q | AG269: =IF(RC[-22]<>0,RC[-22]&R4C32,"q") -> q | AH269: =IF(RC[-22]<>0,RC[-22]&R4C32,"q") -> q | AI269: =IF(RC[-22]<>0,RC[-22]&R4C32,"q") -> q | AJ269: =IF(RC[-22]<>0,RC[-22]&R4C32,"q") -> q | AK269: =IF(RC[-22]<>0,RC[-22]&R4C32,"q") -> q | AL269: =IF(RC[-22]<>0,RC[-22]&R4C32,"q") -> q | AM269: =IF(RC[-22]<>0,RC[-22]&R4C32,"q") -> q | AN269: =IF(RC[-22]<>0,RC[-22]&R4C32,"q") -> q | AO269: =IF(RC[-22]<>0,RC[-22]&R4C32,"q") -> q | AP269: =IF(RC[-22]<>0,RC[-22]&R4C32,"q") -> q | AQ269: =IF(RC[-22]<>0,RC[-22]&R4C32,"q") -> q | AR269: =IF(RC[-22]<>0,RC[-22]&R4C32,"q") -> q | AS269: =IF(RC[-22]<>0,RC[-22]&R4C32,"q") -> q | AT269: =IF(RC[-22]<>0,RC[-22]&R4C32,"q") -> q | AU269: =IF(RC[-22]<>0,RC[-22]&R4C32,"q") -> q | AV269: =IF(RC[-22]<>0,RC[-22]&R4C32,"q") -> q
AC270: =IF(RC[-22]<>0,RC[-22]&R4C32,"q") -> q | AD270: =IF(RC[-22]<>0,RC[-22]&R4C32,"q") -> q | AE270: =IF(RC[-22]<>0,RC[-22]&R4C32,"q") -> q | AF270: =IF(RC[-22]<>0,RC[-22]&R4C32,"q") -> q | AG270: =IF(RC[-22]<>0,RC[-22]&R4C32,"q") -> q | AH270: =IF(RC[-22]<>0,RC[-22]&R4C32,"q") -> q | AI270: =IF(RC[-22]<>0,RC[-22]&R4C32,"q") -> q | AJ270: =IF(RC[-22]<>0,RC[-22]&R4C32,"q") -> q | AK270: =IF(RC[-22]<>0,RC[-22]&R4C32,"q") -> q | AL270: =IF(RC[-22]<>0,RC[-22]&R4C32,"q") -> q | AM270: =IF(RC[-22]<>0,RC[-22]&R4C32,"q") -> q | AN270: =IF(RC[-22]<>0,RC[-22]&R4C32,"q") -> q | AO270: =IF(RC[-22]<>0,RC[-22]&R4C32,"q") -> q | AP270: =IF(RC[-22]<>0,RC[-22]&R4C32,"q") -> q | AQ270: =IF(RC[-22]<>0,RC[-22]&R4C32,"q") -> q | AR270: =IF(RC[-22]<>0,RC[-22]&R4C32,"q") -> q | AS270: =IF(RC[-22]<>0,RC[-22]&R4C32,"q") -> q | AT270: =IF(RC[-22]<>0,RC[-22]&R4C32,"q") -> q | AU270: =IF(RC[-22]<>0,RC[-22]&R4C32,"q") -> q | AV270: =IF(RC[-22]<>0,RC[-22]&R4C32,"q") -> q
AC271: =IF(RC[-22]<>0,RC[-22]&R4C32,"q") -> q | AD271: =IF(RC[-22]<>0,RC[-22]&R4C32,"q") -> q | AE271: =IF(RC[-22]<>0,RC[-22]&R4C32,"q") -> q | AF271: =IF(RC[-22]<>0,RC[-22]&R4C32,"q") -> q | AG271: =IF(RC[-22]<>0,RC[-22]&R4C32,"q") -> q | AH271: =IF(RC[-22]<>0,RC[-22]&R4C32,"q") -> q | AI271: =IF(RC[-22]<>0,RC[-22]&R4C32,"q") -> q | AJ271: =IF(RC[-22]<>0,RC[-22]&R4C32,"q") -> q | AK271: =IF(RC[-22]<>0,RC[-22]&R4C32,"q") -> q | AL271: =IF(RC[-22]<>0,RC[-22]&R4C32,"q") -> q | AM271: =IF(RC[-22]<>0,RC[-22]&R4C32,"q") -> q | AN271: =IF(RC[-22]<>0,RC[-22]&R4C32,"q") -> q | AO271: =IF(RC[-22]<>0,RC[-22]&R4C32,"q") -> q | AP271: =IF(RC[-22]<>0,RC[-22]&R4C32,"q") -> q | AQ271: =IF(RC[-22]<>0,RC[-22]&R4C32,"q") -> q | AR271: =IF(RC[-22]<>0,RC[-22]&R4C32,"q") -> q | AS271: =IF(RC[-22]<>0,RC[-22]&R4C32,"q") -> q | AT271: =IF(RC[-22]<>0,RC[-22]&R4C32,"q") -> q | AU271: =IF(RC[-22]<>0,RC[-22]&R4C32,"q") -> q | AV271: =IF(RC[-22]<>0,RC[-22]&R4C32,"q") -> q
AC272: =IF(RC[-22]<>0,RC[-22]&R4C32,"q") -> q | AD272: =IF(RC[-22]<>0,RC[-22]&R4C32,"q") -> q | AE272: =IF(RC[-22]<>0,RC[-22]&R4C32,"q") -> q | AF272: =IF(RC[-22]<>0,RC[-22]&R4C32,"q") -> q | AG272: =IF(RC[-22]<>0,RC[-22]&R4C32,"q") -> q | AH272: =IF(RC[-22]<>0,RC[-22]&R4C32,"q") -> q | AI272: =IF(RC[-22]<>0,RC[-22]&R4C32,"q") -> q | AJ272: =IF(RC[-22]<>0,RC[-22]&R4C32,"q") -> q | AK272: =IF(RC[-22]<>0,RC[-22]&R4C32,"q") -> q | AL272: =IF(RC[-22]<>0,RC[-22]&R4C32,"q") -> q | AM272: =IF(RC[-22]<>0,RC[-22]&R4C32,"q") -> q | AN272: =IF(RC[-22]<>0,RC[-22]&R4C32,"q") -> q | AO272: =IF(RC[-22]<>0,RC[-22]&R4C32,"q") -> q | AP272: =IF(RC[-22]<>0,RC[-22]&R4C32,"q") -> q | AQ272: =IF(RC[-22]<>0,RC[-22]&R4C32,"q") -> q | AR272: =IF(RC[-22]<>0,RC[-22]&R4C32,"q") -> q | AS272: =IF(RC[-22]<>0,RC[-22]&R4C32,"q") -> q | AT272: =IF(RC[-22]<>0,RC[-22]&R4C32,"q") -> q | AU272: =IF(RC[-22]<>0,RC[-22]&R4C32,"q") -> q | AV272: =IF(RC[-22]<>0,RC[-22]&R4C32,"q") -> q
AC273: =IF(RC[-22]<>0,RC[-22]&R4C32,"q") -> q | AD273: =IF(RC[-22]<>0,RC[-22]&R4C32,"q") -> q | AE273: =IF(RC[-22]<>0,RC[-22]&R4C32,"q") -> q | AF273: =IF(RC[-22]<>0,RC[-22]&R4C32,"q") -> q | AG273: =IF(RC[-22]<>0,RC[-22]&R4C32,"q") -> q | AH273: =IF(RC[-22]<>0,RC[-22]&R4C32,"q") -> q | AI273: =IF(RC[-22]<>0,RC[-22]&R4C32,"q") -> q | AJ273: =IF(RC[-22]<>0,RC[-22]&R4C32,"q") -> q | AK273: =IF(RC[-22]<>0,RC[-22]&R4C32,"q") -> q | AL273: =IF(RC[-22]<>0,RC[-22]&R4C32,"q") -> q | AM273: =IF(RC[-22]<>0,RC[-22]&R4C32,"q") -> q | AN273: =IF(RC[-22]<>0,RC[-22]&R4C32,"q") -> q | AO273: =IF(RC[-22]<>0,RC[-22]&R4C32,"q") -> q | AP273: =IF(RC[-22]<>0,RC[-22]&R4C32,"q") -> q | AQ273: =IF(RC[-22]<>0,RC[-22]&R4C32,"q") -> q | AR273: =IF(RC[-22]<>0,RC[-22]&R4C32,"q") -> q | AS273: =IF(RC[-22]<>0,RC[-22]&R4C32,"q") -> q | AT273: =IF(RC[-22]<>0,RC[-22]&R4C32,"q") -> q | AU273: =IF(RC[-22]<>0,RC[-22]&R4C32,"q") -> q | AV273: =IF(RC[-22]<>0,RC[-22]&R4C32,"q") -> q
AC274: =IF(RC[-22]<>0,RC[-22]&R4C32,"q") -> q | AD274: =IF(RC[-22]<>0,RC[-22]&R4C32,"q") -> q | AE274: =IF(RC[-22]<>0,RC[-22]&R4C32,"q") -> q | AF274: =IF(RC[-22]<>0,RC[-22]&R4C32,"q") -> q | AG274: =IF(RC[-22]<>0,RC[-22]&R4C32,"q") -> q | AH274: =IF(RC[-22]<>0,RC[-22]&R4C32,"q") -> q | AI274: =IF(RC[-22]<>0,RC[-22]&R4C32,"q") -> q | AJ274: =IF(RC[-22]<>0,RC[-22]&R4C32,"q") -> q | AK274: =IF(RC[-22]<>0,RC[-22]&R4C32,"q") -> q | AL274: =IF(RC[-22]<>0,RC[-22]&R4C32,"q") -> q | AM274: =IF(RC[-22]<>0,RC[-22]&R4C32,"q") -> q | AN274: =IF(RC[-22]<>0,RC[-22]&R4C32,"q") -> q | AO274: =IF(RC[-22]<>0,RC[-22]&R4C32,"q") -> q | AP274: =IF(RC[-22]<>0,RC[-22]&R4C32,"q") -> q | AQ274: =IF(RC[-22]<>0,RC[-22]&R4C32,"q") -> q | AR274: =IF(RC[-22]<>0,RC[-22]&R4C32,"q") -> q | AS274: =IF(RC[-22]<>0,RC[-22]&R4C32,"q") -> q | AT274: =IF(RC[-22]<>0,RC[-22]&R4C32,"q") -> q | AU274: =IF(RC[-22]<>0,RC[-22]&R4C32,"q") -> q | AV274: =IF(RC[-22]<>0,RC[-22]&R4C32,"q") -> q
AC275: =IF(RC[-22]<>0,RC[-22]&R4C32,"q") -> q | AD275: =IF(RC[-22]<>0,RC[-22]&R4C32,"q") -> q | AE275: =IF(RC[-22]<>0,RC[-22]&R4C32,"q") -> q | AF275: =IF(RC[-22]<>0,RC[-22]&R4C32,"q") -> q | AG275: =IF(RC[-22]<>0,RC[-22]&R4C32,"q") -> q | AH275: =IF(RC[-22]<>0,RC[-22]&R4C32,"q") -> q | AI275: =IF(RC[-22]<>0,RC[-22]&R4C32,"q") -> q | AJ275: =IF(RC[-22]<>0,RC[-22]&R4C32,"q") -> q | AK275: =IF(RC[-22]<>0,RC[-22]&R4C32,"q") -> q | AL275: =IF(RC[-22]<>0,RC[-22]&R4C32,"q") -> q | AM275: =IF(RC[-22]<>0,RC[-22]&R4C32,"q") -> q | AN275: =IF(RC[-22]<>0,RC[-22]&R4C32,"q") -> q | AO275: =IF(RC[-22]<>0,RC[-22]&R4C32,"q") -> q | AP275: =IF(RC[-22]<>0,RC[-22]&R4C32,"q") -> q | AQ275: =IF(RC[-22]<>0,RC[-22]&R4C32,"q") -> q | AR275: =IF(RC[-22]<>0,RC[-22]&R4C32,"q") -> q | AS275: =IF(RC[-22]<>0,RC[-22]&R4C32,"q") -> q | AT275: =IF(RC[-22]<>0,RC[-22]&R4C32,"q") -> q | AU275: =IF(RC[-22]<>0,RC[-22]&R4C32,"q") -> q | AV275: =IF(RC[-22]<>0,RC[-22]&R4C32,"q") -> q
AC276: =IF(RC[-22]<>0,RC[-22]&R4C32,"q") -> q | AD276: =IF(RC[-22]<>0,RC[-22]&R4C32,"q") -> q | AE276: =IF(RC[-22]<>0,RC[-22]&R4C32,"q") -> q | AF276: =IF(RC[-22]<>0,RC[-22]&R4C32,"q") -> q | AG276: =IF(RC[-22]<>0,RC[-22]&R4C32,"q") -> q | AH276: =IF(RC[-22]<>0,RC[-22]&R4C32,"q") -> q | AI276: =IF(RC[-22]<>0,RC[-22]&R4C32,"q") -> q | AJ276: =IF(RC[-22]<>0,RC[-22]&R4C32,"q") -> q | AK276: =IF(RC[-22]<>0,RC[-22]&R4C32,"q") -> q | AL276: =IF(RC[-22]<>0,RC[-22]&R4C32,"q") -> q | AM276: =IF(RC[-22]<>0,RC[-22]&R4C32,"q") -> q | AN276: =IF(RC[-22]<>0,RC[-22]&R4C32,"q") -> q | AO276: =IF(RC[-22]<>0,RC[-22]&R4C32,"q") -> q | AP276: =IF(RC[-22]<>0,RC[-22]&R4C32,"q") -> q | AQ276: =IF(RC[-22]<>0,RC[-22]&R4C32,"q") -> q | AR276: =IF(RC[-22]<>0,RC[-22]&R4C32,"q") -> q | AS276: =IF(RC[-22]<>0,RC[-22]&R4C32,"q") -> q | AT276: =IF(RC[-22]<>0,RC[-22]&R4C32,"q") -> q | AU276: =IF(RC[-22]<>0,RC[-22]&R4C32,"q") -> q | AV276: =IF(RC[-22]<>0,RC[-22]&R4C32,"q") -> q
AC277: =IF(RC[-22]<>0,RC[-22]&R4C32,"q") -> q | AD277: =IF(RC[-22]<>0,RC[-22]&R4C32,"q") -> q | AE277: =IF(RC[-22]<>0,RC[-22]&R4C32,"q") -> q | AF277: =IF(RC[-22]<>0,RC[-22]&R4C32,"q") -> q | AG277: =IF(RC[-22]<>0,RC[-22]&R4C32,"q") -> q | AH277: =IF(RC[-22]<>0,RC[-22]&R4C32,"q") -> q | AI277: =IF(RC[-22]<>0,RC[-22]&R4C32,"q") -> q | AJ277: =IF(RC[-22]<>0,RC[-22]&R4C32,"q") -> q | AK277: =IF(RC[-22]<>0,RC[-22]&R4C32,"q") -> q | AL277: =IF(RC[-22]<>0,RC[-22]&R4C32,"q") -> q | AM277: =IF(RC[-22]<>0,RC[-22]&R4C32,"q") -> q | AN277: =IF(RC[-22]<>0,RC[-22]&R4C32,"q") -> q | AO277: =IF(RC[-22]<>0,RC[-22]&R4C32,"q") -> q | AP277: =IF(RC[-22]<>0,RC[-22]&R4C32,"q") -> q | AQ277: =IF(RC[-22]<>0,RC[-22]&R4C32,"q") -> q | AR277: =IF(RC[-22]<>0,RC[-22]&R4C32,"q") -> q | AS277: =IF(RC[-22]<>0,RC[-22]&R4C32,"q") -> q | AT277: =IF(RC[-22]<>0,RC[-22]&R4C32,"q") -> q | AU277: =IF(RC[-22]<>0,RC[-22]&R4C32,"q") -> q | AV277: =IF(RC[-22]<>0,RC[-22]&R4C32,"q") -> q
AC278: =IF(RC[-22]<>0,RC[-22]&R4C32,"q") -> q | AD278: =IF(RC[-22]<>0,RC[-22]&R4C32,"q") -> q | AE278: =IF(RC[-22]<>0,RC[-22]&R4C32,"q") -> q | AF278: =IF(RC[-22]<>0,RC[-22]&R4C32,"q") -> q | AG278: =IF(RC[-22]<>0,RC[-22]&R4C32,"q") -> q | AH278: =IF(RC[-22]<>0,RC[-22]&R4C32,"q") -> q | AI278: =IF(RC[-22]<>0,RC[-22]&R4C32,"q") -> q | AJ278: =IF(RC[-22]<>0,RC[-22]&R4C32,"q") -> q | AK278: =IF(RC[-22]<>0,RC[-22]&R4C32,"q") -> q | AL278: =IF(RC[-22]<>0,RC[-22]&R4C32,"q") -> q | AM278: =IF(RC[-22]<>0,RC[-22]&R4C32,"q") -> q | AN278: =IF(RC[-22]<>0,RC[-22]&R4C32,"q") -> q | AO278: =IF(RC[-22]<>0,RC[-22]&R4C32,"q") -> q | AP278: =IF(RC[-22]<>0,RC[-22]&R4C32,"q") -> q | AQ278: =IF(RC[-22]<>0,RC[-22]&R4C32,"q") -> q | AR278: =IF(RC[-22]<>0,RC[-22]&R4C32,"q") -> q | AS278: =IF(RC[-22]<>0,RC[-22]&R4C32,"q") -> q | AT278: =IF(RC[-22]<>0,RC[-22]&R4C32,"q") -> q | AU278: =IF(RC[-22]<>0,RC[-22]&R4C32,"q") -> q | AV278: =IF(RC[-22]<>0,RC[-22]&R4C32,"q") -> q
AC279: =IF(RC[-22]<>0,RC[-22]&R4C32,"q") -> q | AD279: =IF(RC[-22]<>0,RC[-22]&R4C32,"q") -> q | AE279: =IF(RC[-22]<>0,RC[-22]&R4C32,"q") -> q | AF279: =IF(RC[-22]<>0,RC[-22]&R4C32,"q") -> q | AG279: =IF(RC[-22]<>0,RC[-22]&R4C32,"q") -> q | AH279: =IF(RC[-22]<>0,RC[-22]&R4C32,"q") -> q | AI279: =IF(RC[-22]<>0,RC[-22]&R4C32,"q") -> q | AJ279: =IF(RC[-22]<>0,RC[-22]&R4C32,"q") -> q | AK279: =IF(RC[-22]<>0,RC[-22]&R4C32,"q") -> q | AL279: =IF(RC[-22]<>0,RC[-22]&R4C32,"q") -> q | AM279: =IF(RC[-22]<>0,RC[-22]&R4C32,"q") -> q | AN279: =IF(RC[-22]<>0,RC[-22]&R4C32,"q") -> q | AO279: =IF(RC[-22]<>0,RC[-22]&R4C32,"q") -> q | AP279: =IF(RC[-22]<>0,RC[-22]&R4C32,"q") -> q | AQ279: =IF(RC[-22]<>0,RC[-22]&R4C32,"q") -> q | AR279: =IF(RC[-22]<>0,RC[-22]&R4C32,"q") -> q | AS279: =IF(RC[-22]<>0,RC[-22]&R4C32,"q") -> q | AT279: =IF(RC[-22]<>0,RC[-22]&R4C32,"q") -> q | AU279: =IF(RC[-22]<>0,RC[-22]&R4C32,"q") -> q | AV279: =IF(RC[-22]<>0,RC[-22]&R4C32,"q") -> q
AC280: =IF(RC[-22]<>0,RC[-22]&R4C32,"q") -> q | AD280: =IF(RC[-22]<>0,RC[-22]&R4C32,"q") -> q | AE280: =IF(RC[-22]<>0,RC[-22]&R4C32,"q") -> q | AF280: =IF(RC[-22]<>0,RC[-22]&R4C32,"q") -> q | AG280: =IF(RC[-22]<>0,RC[-22]&R4C32,"q") -> q | AH280: =IF(RC[-22]<>0,RC[-22]&R4C32,"q") -> q | AI280: =IF(RC[-22]<>0,RC[-22]&R4C32,"q") -> q | AJ280: =IF(RC[-22]<>0,RC[-22]&R4C32,"q") -> q | AK280: =IF(RC[-22]<>0,RC[-22]&R4C32,"q") -> q | AL280: =IF(RC[-22]<>0,RC[-22]&R4C32,"q") -> q | AM280: =IF(RC[-22]<>0,RC[-22]&R4C32,"q") -> q | AN280: =IF(RC[-22]<>0,RC[-22]&R4C32,"q") -> q | AO280: =IF(RC[-22]<>0,RC[-22]&R4C32,"q") -> q | AP280: =IF(RC[-22]<>0,RC[-22]&R4C32,"q") -> q | AQ280: =IF(RC[-22]<>0,RC[-22]&R4C32,"q") -> q | AR280: =IF(RC[-22]<>0,RC[-22]&R4C32,"q") -> q | AS280: =IF(RC[-22]<>0,RC[-22]&R4C32,"q") -> q | AT280: =IF(RC[-22]<>0,RC[-22]&R4C32,"q") -> q | AU280: =IF(RC[-22]<>0,RC[-22]&R4C32,"q") -> q | AV280: =IF(RC[-22]<>0,RC[-22]&R4C32,"q") -> q
AC281: =IF(RC[-22]<>0,RC[-22]&R4C32,"q") -> q | AD281: =IF(RC[-22]<>0,RC[-22]&R4C32,"q") -> q | AE281: =IF(RC[-22]<>0,RC[-22]&R4C32,"q") -> q | AF281: =IF(RC[-22]<>0,RC[-22]&R4C32,"q") -> q | AG281: =IF(RC[-22]<>0,RC[-22]&R4C32,"q") -> q | AH281: =IF(RC[-22]<>0,RC[-22]&R4C32,"q") -> q | AI281: =IF(RC[-22]<>0,RC[-22]&R4C32,"q") -> q | AJ281: =IF(RC[-22]<>0,RC[-22]&R4C32,"q") -> q | AK281: =IF(RC[-22]<>0,RC[-22]&R4C32,"q") -> q | AL281: =IF(RC[-22]<>0,RC[-22]&R4C32,"q") -> q | AM281: =IF(RC[-22]<>0,RC[-22]&R4C32,"q") -> q | AN281: =IF(RC[-22]<>0,RC[-22]&R4C32,"q") -> q | AO281: =IF(RC[-22]<>0,RC[-22]&R4C32,"q") -> q | AP281: =IF(RC[-22]<>0,RC[-22]&R4C32,"q") -> q | AQ281: =IF(RC[-22]<>0,RC[-22]&R4C32,"q") -> q | AR281: =IF(RC[-22]<>0,RC[-22]&R4C32,"q") -> q | AS281: =IF(RC[-22]<>0,RC[-22]&R4C32,"q") -> q | AT281: =IF(RC[-22]<>0,RC[-22]&R4C32,"q") -> q | AU281: =IF(RC[-22]<>0,RC[-22]&R4C32,"q") -> q | AV281: =IF(RC[-22]<>0,RC[-22]&R4C32,"q") -> q
AC282: =IF(RC[-22]<>0,RC[-22]&R4C32,"q") -> q | AD282: =IF(RC[-22]<>0,RC[-22]&R4C32,"q") -> q | AE282: =IF(RC[-22]<>0,RC[-22]&R4C32,"q") -> q | AF282: =IF(RC[-22]<>0,RC[-22]&R4C32,"q") -> q | AG282: =IF(RC[-22]<>0,RC[-22]&R4C32,"q") -> q | AH282: =IF(RC[-22]<>0,RC[-22]&R4C32,"q") -> q | AI282: =IF(RC[-22]<>0,RC[-22]&R4C32,"q") -> q | AJ282: =IF(RC[-22]<>0,RC[-22]&R4C32,"q") -> q | AK282: =IF(RC[-22]<>0,RC[-22]&R4C32,"q") -> q | AL282: =IF(RC[-22]<>0,RC[-22]&R4C32,"q") -> q | AM282: =IF(RC[-22]<>0,RC[-22]&R4C32,"q") -> q | AN282: =IF(RC[-22]<>0,RC[-22]&R4C32,"q") -> q | AO282: =IF(RC[-22]<>0,RC[-22]&R4C32,"q") -> q | AP282: =IF(RC[-22]<>0,RC[-22]&R4C32,"q") -> q | AQ282: =IF(RC[-22]<>0,RC[-22]&R4C32,"q") -> q | AR282: =IF(RC[-22]<>0,RC[-22]&R4C32,"q") -> q | AS282: =IF(RC[-22]<>0,RC[-22]&R4C32,"q") -> q | AT282: =IF(RC[-22]<>0,RC[-22]&R4C32,"q") -> q | AU282: =IF(RC[-22]<>0,RC[-22]&R4C32,"q") -> q | AV282: =IF(RC[-22]<>0,RC[-22]&R4C32,"q") -> q
AC283: =IF(RC[-22]<>0,RC[-22]&R4C32,"q") -> q | AD283: =IF(RC[-22]<>0,RC[-22]&R4C32,"q") -> q | AE283: =IF(RC[-22]<>0,RC[-22]&R4C32,"q") -> q | AF283: =IF(RC[-22]<>0,RC[-22]&R4C32,"q") -> q | AG283: =IF(RC[-22]<>0,RC[-22]&R4C32,"q") -> q | AH283: =IF(RC[-22]<>0,RC[-22]&R4C32,"q") -> q | AI283: =IF(RC[-22]<>0,RC[-22]&R4C32,"q") -> q | AJ283: =IF(RC[-22]<>0,RC[-22]&R4C32,"q") -> q | AK283: =IF(RC[-22]<>0,RC[-22]&R4C32,"q") -> q | AL283: =IF(RC[-22]<>0,RC[-22]&R4C32,"q") -> q | AM283: =IF(RC[-22]<>0,RC[-22]&R4C32,"q") -> q | AN283: =IF(RC[-22]<>0,RC[-22]&R4C32,"q") -> q | AO283: =IF(RC[-22]<>0,RC[-22]&R4C32,"q") -> q | AP283: =IF(RC[-22]<>0,RC[-22]&R4C32,"q") -> q | AQ283: =IF(RC[-22]<>0,RC[-22]&R4C32,"q") -> q | AR283: =IF(RC[-22]<>0,RC[-22]&R4C32,"q") -> q | AS283: =IF(RC[-22]<>0,RC[-22]&R4C32,"q") -> q | AT283: =IF(RC[-22]<>0,RC[-22]&R4C32,"q") -> q | AU283: =IF(RC[-22]<>0,RC[-22]&R4C32,"q") -> q | AV283: =IF(RC[-22]<>0,RC[-22]&R4C32,"q") -> q
AC284: =IF(RC[-22]<>0,RC[-22]&R4C32,"q") -> q | AD284: =IF(RC[-22]<>0,RC[-22]&R4C32,"q") -> q | AE284: =IF(RC[-22]<>0,RC[-22]&R4C32,"q") -> q | AF284: =IF(RC[-22]<>0,RC[-22]&R4C32,"q") -> q | AG284: =IF(RC[-22]<>0,RC[-22]&R4C32,"q") -> q | AH284: =IF(RC[-22]<>0,RC[-22]&R4C32,"q") -> q | AI284: =IF(RC[-22]<>0,RC[-22]&R4C32,"q") -> q | AJ284: =IF(RC[-22]<>0,RC[-22]&R4C32,"q") -> q | AK284: =IF(RC[-22]<>0,RC[-22]&R4C32,"q") -> q | AL284: =IF(RC[-22]<>0,RC[-22]&R4C32,"q") -> q | AM284: =IF(RC[-22]<>0,RC[-22]&R4C32,"q") -> q | AN284: =IF(RC[-22]<>0,RC[-22]&R4C32,"q") -> q | AO284: =IF(RC[-22]<>0,RC[-22]&R4C32,"q") -> q | AP284: =IF(RC[-22]<>0,RC[-22]&R4C32,"q") -> q | AQ284: =IF(RC[-22]<>0,RC[-22]&R4C32,"q") -> q | AR284: =IF(RC[-22]<>0,RC[-22]&R4C32,"q") -> q | AS284: =IF(RC[-22]<>0,RC[-22]&R4C32,"q") -> q | AT284: =IF(RC[-22]<>0,RC[-22]&R4C32,"q") -> q | AU284: =IF(RC[-22]<>0,RC[-22]&R4C32,"q") -> q | AV284: =IF(RC[-22]<>0,RC[-22]&R4C32,"q") -> q
AC285: =IF(RC[-22]<>0,RC[-22]&R4C32,"q") -> q | AD285: =IF(RC[-22]<>0,RC[-22]&R4C32,"q") -> q | AE285: =IF(RC[-22]<>0,RC[-22]&R4C32,"q") -> q | AF285: =IF(RC[-22]<>0,RC[-22]&R4C32,"q") -> q | AG285: =IF(RC[-22]<>0,RC[-22]&R4C32,"q") -> q | AH285: =IF(RC[-22]<>0,RC[-22]&R4C32,"q") -> q | AI285: =IF(RC[-22]<>0,RC[-22]&R4C32,"q") -> q | AJ285: =IF(RC[-22]<>0,RC[-22]&R4C32,"q") -> q | AK285: =IF(RC[-22]<>0,RC[-22]&R4C32,"q") -> q | AL285: =IF(RC[-22]<>0,RC[-22]&R4C32,"q") -> q | AM285: =IF(RC[-22]<>0,RC[-22]&R4C32,"q") -> q | AN285: =IF(RC[-22]<>0,RC[-22]&R4C32,"q") -> q | AO285: =IF(RC[-22]<>0,RC[-22]&R4C32,"q") -> q | AP285: =IF(RC[-22]<>0,RC[-22]&R4C32,"q") -> q | AQ285: =IF(RC[-22]<>0,RC[-22]&R4C32,"q") -> q | AR285: =IF(RC[-22]<>0,RC[-22]&R4C32,"q") -> q | AS285: =IF(RC[-22]<>0,RC[-22]&R4C32,"q") -> q | AT285: =IF(RC[-22]<>0,RC[-22]&R4C32,"q") -> q | AU285: =IF(RC[-22]<>0,RC[-22]&R4C32,"q") -> q | AV285: =IF(RC[-22]<>0,RC[-22]&R4C32,"q") -> q
AC286: =IF(RC[-22]<>0,RC[-22]&R4C32,"q") -> q | AD286: =IF(RC[-22]<>0,RC[-22]&R4C32,"q") -> q | AE286: =IF(RC[-22]<>0,RC[-22]&R4C32,"q") -> q | AF286: =IF(RC[-22]<>0,RC[-22]&R4C32,"q") -> q | AG286: =IF(RC[-22]<>0,RC[-22]&R4C32,"q") -> q | AH286: =IF(RC[-22]<>0,RC[-22]&R4C32,"q") -> q | AI286: =IF(RC[-22]<>0,RC[-22]&R4C32,"q") -> q | AJ286: =IF(RC[-22]<>0,RC[-22]&R4C32,"q") -> q | AK286: =IF(RC[-22]<>0,RC[-22]&R4C32,"q") -> q | AL286: =IF(RC[-22]<>0,RC[-22]&R4C32,"q") -> q | AM286: =IF(RC[-22]<>0,RC[-22]&R4C32,"q") -> q | AN286: =IF(RC[-22]<>0,RC[-22]&R4C32,"q") -> q | AO286: =IF(RC[-22]<>0,RC[-22]&R4C32,"q") -> q | AP286: =IF(RC[-22]<>0,RC[-22]&R4C32,"q") -> q | AQ286: =IF(RC[-22]<>0,RC[-22]&R4C32,"q") -> q | AR286: =IF(RC[-22]<>0,RC[-22]&R4C32,"q") -> q | AS286: =IF(RC[-22]<>0,RC[-22]&R4C32,"q") -> q | AT286: =IF(RC[-22]<>0,RC[-22]&R4C32,"q") -> q | AU286: =IF(RC[-22]<>0,RC[-22]&R4C32,"q") -> q | AV286: =IF(RC[-22]<>0,RC[-22]&R4C32,"q") -> q
AC287: =IF(RC[-22]<>0,RC[-22]&R4C32,"q") -> q | AD287: =IF(RC[-22]<>0,RC[-22]&R4C32,"q") -> q | AE287: =IF(RC[-22]<>0,RC[-22]&R4C32,"q") -> q | AF287: =IF(RC[-22]<>0,RC[-22]&R4C32,"q") -> q | AG287: =IF(RC[-22]<>0,RC[-22]&R4C32,"q") -> q | AH287: =IF(RC[-22]<>0,RC[-22]&R4C32,"q") -> q | AI287: =IF(RC[-22]<>0,RC[-22]&R4C32,"q") -> q | AJ287: =IF(RC[-22]<>0,RC[-22]&R4C32,"q") -> q | AK287: =IF(RC[-22]<>0,RC[-22]&R4C32,"q") -> q | AL287: =IF(RC[-22]<>0,RC[-22]&R4C32,"q") -> q | AM287: =IF(RC[-22]<>0,RC[-22]&R4C32,"q") -> q | AN287: =IF(RC[-22]<>0,RC[-22]&R4C32,"q") -> q | AO287: =IF(RC[-22]<>0,RC[-22]&R4C32,"q") -> q | AP287: =IF(RC[-22]<>0,RC[-22]&R4C32,"q") -> q | AQ287: =IF(RC[-22]<>0,RC[-22]&R4C32,"q") -> q | AR287: =IF(RC[-22]<>0,RC[-22]&R4C32,"q") -> q | AS287: =IF(RC[-22]<>0,RC[-22]&R4C32,"q") -> q | AT287: =IF(RC[-22]<>0,RC[-22]&R4C32,"q") -> q | AU287: =IF(RC[-22]<>0,RC[-22]&R4C32,"q") -> q | AV287: =IF(RC[-22]<>0,RC[-22]&R4C32,"q") -> q
AC288: =IF(RC[-22]<>0,RC[-22]&R4C32,"q") -> q | AD288: =IF(RC[-22]<>0,RC[-22]&R4C32,"q") -> q | AE288: =IF(RC[-22]<>0,RC[-22]&R4C32,"q") -> q | AF288: =IF(RC[-22]<>0,RC[-22]&R4C32,"q") -> q | AG288: =IF(RC[-22]<>0,RC[-22]&R4C32,"q") -> q | AH288: =IF(RC[-22]<>0,RC[-22]&R4C32,"q") -> q | AI288: =IF(RC[-22]<>0,RC[-22]&R4C32,"q") -> q | AJ288: =IF(RC[-22]<>0,RC[-22]&R4C32,"q") -> q | AK288: =IF(RC[-22]<>0,RC[-22]&R4C32,"q") -> q | AL288: =IF(RC[-22]<>0,RC[-22]&R4C32,"q") -> q | AM288: =IF(RC[-22]<>0,RC[-22]&R4C32,"q") -> q | AN288: =IF(RC[-22]<>0,RC[-22]&R4C32,"q") -> q | AO288: =IF(RC[-22]<>0,RC[-22]&R4C32,"q") -> q | AP288: =IF(RC[-22]<>0,RC[-22]&R4C32,"q") -> q | AQ288: =IF(RC[-22]<>0,RC[-22]&R4C32,"q") -> q | AR288: =IF(RC[-22]<>0,RC[-22]&R4C32,"q") -> q | AS288: =IF(RC[-22]<>0,RC[-22]&R4C32,"q") -> q | AT288: =IF(RC[-22]<>0,RC[-22]&R4C32,"q") -> q | AU288: =IF(RC[-22]<>0,RC[-22]&R4C32,"q") -> q | AV288: =IF(RC[-22]<>0,RC[-22]&R4C32,"q") -> q
AC289: =IF(RC[-22]<>0,RC[-22]&R4C32,"q") -> q | AD289: =IF(RC[-22]<>0,RC[-22]&R4C32,"q") -> q | AE289: =IF(RC[-22]<>0,RC[-22]&R4C32,"q") -> q | AF289: =IF(RC[-22]<>0,RC[-22]&R4C32,"q") -> q | AG289: =IF(RC[-22]<>0,RC[-22]&R4C32,"q") -> q | AH289: =IF(RC[-22]<>0,RC[-22]&R4C32,"q") -> q | AI289: =IF(RC[-22]<>0,RC[-22]&R4C32,"q") -> q | AJ289: =IF(RC[-22]<>0,RC[-22]&R4C32,"q") -> q | AK289: =IF(RC[-22]<>0,RC[-22]&R4C32,"q") -> q | AL289: =IF(RC[-22]<>0,RC[-22]&R4C32,"q") -> q | AM289: =IF(RC[-22]<>0,RC[-22]&R4C32,"q") -> q | AN289: =IF(RC[-22]<>0,RC[-22]&R4C32,"q") -> q | AO289: =IF(RC[-22]<>0,RC[-22]&R4C32,"q") -> q | AP289: =IF(RC[-22]<>0,RC[-22]&R4C32,"q") -> q | AQ289: =IF(RC[-22]<>0,RC[-22]&R4C32,"q") -> q | AR289: =IF(RC[-22]<>0,RC[-22]&R4C32,"q") -> q | AS289: =IF(RC[-22]<>0,RC[-22]&R4C32,"q") -> q | AT289: =IF(RC[-22]<>0,RC[-22]&R4C32,"q") -> q | AU289: =IF(RC[-22]<>0,RC[-22]&R4C32,"q") -> q | AV289: =IF(RC[-22]<>0,RC[-22]&R4C32,"q") -> q
AC290: =IF(RC[-22]<>0,RC[-22]&R4C32,"q") -> q | AD290: =IF(RC[-22]<>0,RC[-22]&R4C32,"q") -> q | AE290: =IF(RC[-22]<>0,RC[-22]&R4C32,"q") -> q | AF290: =IF(RC[-22]<>0,RC[-22]&R4C32,"q") -> q | AG290: =IF(RC[-22]<>0,RC[-22]&R4C32,"q") -> q | AH290: =IF(RC[-22]<>0,RC[-22]&R4C32,"q") -> q | AI290: =IF(RC[-22]<>0,RC[-22]&R4C32,"q") -> q | AJ290: =IF(RC[-22]<>0,RC[-22]&R4C32,"q") -> q | AK290: =IF(RC[-22]<>0,RC[-22]&R4C32,"q") -> q | AL290: =IF(RC[-22]<>0,RC[-22]&R4C32,"q") -> q | AM290: =IF(RC[-22]<>0,RC[-22]&R4C32,"q") -> q | AN290: =IF(RC[-22]<>0,RC[-22]&R4C32,"q") -> q | AO290: =IF(RC[-22]<>0,RC[-22]&R4C32,"q") -> q | AP290: =IF(RC[-22]<>0,RC[-22]&R4C32,"q") -> q | AQ290: =IF(RC[-22]<>0,RC[-22]&R4C32,"q") -> q | AR290: =IF(RC[-22]<>0,RC[-22]&R4C32,"q") -> q | AS290: =IF(RC[-22]<>0,RC[-22]&R4C32,"q") -> q | AT290: =IF(RC[-22]<>0,RC[-22]&R4C32,"q") -> q | AU290: =IF(RC[-22]<>0,RC[-22]&R4C32,"q") -> q | AV290: =IF(RC[-22]<>0,RC[-22]&R4C32,"q") -> q
AC291: =IF(RC[-22]<>0,RC[-22]&R4C32,"q") -> q | AD291: =IF(RC[-22]<>0,RC[-22]&R4C32,"q") -> q | AE291: =IF(RC[-22]<>0,RC[-22]&R4C32,"q") -> q | AF291: =IF(RC[-22]<>0,RC[-22]&R4C32,"q") -> q | AG291: =IF(RC[-22]<>0,RC[-22]&R4C32,"q") -> q | AH291: =IF(RC[-22]<>0,RC[-22]&R4C32,"q") -> q | AI291: =IF(RC[-22]<>0,RC[-22]&R4C32,"q") -> q | AJ291: =IF(RC[-22]<>0,RC[-22]&R4C32,"q") -> q | AK291: =IF(RC[-22]<>0,RC[-22]&R4C32,"q") -> q | AL291: =IF(RC[-22]<>0,RC[-22]&R4C32,"q") -> q | AM291: =IF(RC[-22]<>0,RC[-22]&R4C32,"q") -> q | AN291: =IF(RC[-22]<>0,RC[-22]&R4C32,"q") -> q | AO291: =IF(RC[-22]<>0,RC[-22]&R4C32,"q") -> q | AP291: =IF(RC[-22]<>0,RC[-22]&R4C32,"q") -> q | AQ291: =IF(RC[-22]<>0,RC[-22]&R4C32,"q") -> q | AR291: =IF(RC[-22]<>0,RC[-22]&R4C32,"q") -> q | AS291: =IF(RC[-22]<>0,RC[-22]&R4C32,"q") -> q | AT291: =IF(RC[-22]<>0,RC[-22]&R4C32,"q") -> q | AU291: =IF(RC[-22]<>0,RC[-22]&R4C32,"q") -> q | AV291: =IF(RC[-22]<>0,RC[-22]&R4C32,"q") -> q
AC292: =IF(RC[-22]<>0,RC[-22]&R4C32,"q") -> q | AD292: =IF(RC[-22]<>0,RC[-22]&R4C32,"q") -> q | AE292: =IF(RC[-22]<>0,RC[-22]&R4C32,"q") -> q | AF292: =IF(RC[-22]<>0,RC[-22]&R4C32,"q") -> q | AG292: =IF(RC[-22]<>0,RC[-22]&R4C32,"q") -> q | AH292: =IF(RC[-22]<>0,RC[-22]&R4C32,"q") -> q | AI292: =IF(RC[-22]<>0,RC[-22]&R4C32,"q") -> q | AJ292: =IF(RC[-22]<>0,RC[-22]&R4C32,"q") -> q | AK292: =IF(RC[-22]<>0,RC[-22]&R4C32,"q") -> q | AL292: =IF(RC[-22]<>0,RC[-22]&R4C32,"q") -> q | AM292: =IF(RC[-22]<>0,RC[-22]&R4C32,"q") -> q | AN292: =IF(RC[-22]<>0,RC[-22]&R4C32,"q") -> q | AO292: =IF(RC[-22]<>0,RC[-22]&R4C32,"q") -> q | AP292: =IF(RC[-22]<>0,RC[-22]&R4C32,"q") -> q | AQ292: =IF(RC[-22]<>0,RC[-22]&R4C32,"q") -> q | AR292: =IF(RC[-22]<>0,RC[-22]&R4C32,"q") -> q | AS292: =IF(RC[-22]<>0,RC[-22]&R4C32,"q") -> q | AT292: =IF(RC[-22]<>0,RC[-22]&R4C32,"q") -> q | AU292: =IF(RC[-22]<>0,RC[-22]&R4C32,"q") -> q | AV292: =IF(RC[-22]<>0,RC[-22]&R4C32,"q") -> q
AC293: =IF(RC[-22]<>0,RC[-22]&R4C32,"q") -> q | AD293: =IF(RC[-22]<>0,RC[-22]&R4C32,"q") -> q | AE293: =IF(RC[-22]<>0,RC[-22]&R4C32,"q") -> q | AF293: =IF(RC[-22]<>0,RC[-22]&R4C32,"q") -> q | AG293: =IF(RC[-22]<>0,RC[-22]&R4C32,"q") -> q | AH293: =IF(RC[-22]<>0,RC[-22]&R4C32,"q") -> q | AI293: =IF(RC[-22]<>0,RC[-22]&R4C32,"q") -> q | AJ293: =IF(RC[-22]<>0,RC[-22]&R4C32,"q") -> q | AK293: =IF(RC[-22]<>0,RC[-22]&R4C32,"q") -> q | AL293: =IF(RC[-22]<>0,RC[-22]&R4C32,"q") -> q | AM293: =IF(RC[-22]<>0,RC[-22]&R4C32,"q") -> q | AN293: =IF(RC[-22]<>0,RC[-22]&R4C32,"q") -> q | AO293: =IF(RC[-22]<>0,RC[-22]&R4C32,"q") -> q | AP293: =IF(RC[-22]<>0,RC[-22]&R4C32,"q") -> q | AQ293: =IF(RC[-22]<>0,RC[-22]&R4C32,"q") -> q | AR293: =IF(RC[-22]<>0,RC[-22]&R4C32,"q") -> q | AS293: =IF(RC[-22]<>0,RC[-22]&R4C32,"q") -> q | AT293: =IF(RC[-22]<>0,RC[-22]&R4C32,"q") -> q | AU293: =IF(RC[-22]<>0,RC[-22]&R4C32,"q") -> q | AV293: =IF(RC[-22]<>0,RC[-22]&R4C32,"q") -> q
AC294: =IF(RC[-22]<>0,RC[-22]&R4C32,"q") -> q | AD294: =IF(RC[-22]<>0,RC[-22]&R4C32,"q") -> q | AE294: =IF(RC[-22]<>0,RC[-22]&R4C32,"q") -> q | AF294: =IF(RC[-22]<>0,RC[-22]&R4C32,"q") -> q | AG294: =IF(RC[-22]<>0,RC[-22]&R4C32,"q") -> q | AH294: =IF(RC[-22]<>0,RC[-22]&R4C32,"q") -> q | AI294: =IF(RC[-22]<>0,RC[-22]&R4C32,"q") -> q | AJ294: =IF(RC[-22]<>0,RC[-22]&R4C32,"q") -> q | AK294: =IF(RC[-22]<>0,RC[-22]&R4C32,"q") -> q | AL294: =IF(RC[-22]<>0,RC[-22]&R4C32,"q") -> q | AM294: =IF(RC[-22]<>0,RC[-22]&R4C32,"q") -> q | AN294: =IF(RC[-22]<>0,RC[-22]&R4C32,"q") -> q | AO294: =IF(RC[-22]<>0,RC[-22]&R4C32,"q") -> q | AP294: =IF(RC[-22]<>0,RC[-22]&R4C32,"q") -> q | AQ294: =IF(RC[-22]<>0,RC[-22]&R4C32,"q") -> q | AR294: =IF(RC[-22]<>0,RC[-22]&R4C32,"q") -> q | AS294: =IF(RC[-22]<>0,RC[-22]&R4C32,"q") -> q | AT294: =IF(RC[-22]<>0,RC[-22]&R4C32,"q") -> q | AU294: =IF(RC[-22]<>0,RC[-22]&R4C32,"q") -> q | AV294: =IF(RC[-22]<>0,RC[-22]&R4C32,"q") -> q
AC295: =IF(RC[-22]<>0,RC[-22]&R4C32,"q") -> q | AD295: =IF(RC[-22]<>0,RC[-22]&R4C32,"q") -> q | AE295: =IF(RC[-22]<>0,RC[-22]&R4C32,"q") -> q | AF295: =IF(RC[-22]<>0,RC[-22]&R4C32,"q") -> q | AG295: =IF(RC[-22]<>0,RC[-22]&R4C32,"q") -> q | AH295: =IF(RC[-22]<>0,RC[-22]&R4C32,"q") -> q | AI295: =IF(RC[-22]<>0,RC[-22]&R4C32,"q") -> q | AJ295: =IF(RC[-22]<>0,RC[-22]&R4C32,"q") -> q | AK295: =IF(RC[-22]<>0,RC[-22]&R4C32,"q") -> q | AL295: =IF(RC[-22]<>0,RC[-22]&R4C32,"q") -> q | AM295: =IF(RC[-22]<>0,RC[-22]&R4C32,"q") -> q | AN295: =IF(RC[-22]<>0,RC[-22]&R4C32,"q") -> q | AO295: =IF(RC[-22]<>0,RC[-22]&R4C32,"q") -> q | AP295: =IF(RC[-22]<>0,RC[-22]&R4C32,"q") -> q | AQ295: =IF(RC[-22]<>0,RC[-22]&R4C32,"q") -> q | AR295: =IF(RC[-22]<>0,RC[-22]&R4C32,"q") -> q | AS295: =IF(RC[-22]<>0,RC[-22]&R4C32,"q") -> q | AT295: =IF(RC[-22]<>0,RC[-22]&R4C32,"q") -> q | AU295: =IF(RC[-22]<>0,RC[-22]&R4C32,"q") -> q | AV295: =IF(RC[-22]<>0,RC[-22]&R4C32,"q") -> q
AC296: =IF(RC[-22]<>0,RC[-22]&R4C32,"q") -> q | AD296: =IF(RC[-22]<>0,RC[-22]&R4C32,"q") -> q | AE296: =IF(RC[-22]<>0,RC[-22]&R4C32,"q") -> q | AF296: =IF(RC[-22]<>0,RC[-22]&R4C32,"q") -> q | AG296: =IF(RC[-22]<>0,RC[-22]&R4C32,"q") -> q | AH296: =IF(RC[-22]<>0,RC[-22]&R4C32,"q") -> q | AI296: =IF(RC[-22]<>0,RC[-22]&R4C32,"q") -> q | AJ296: =IF(RC[-22]<>0,RC[-22]&R4C32,"q") -> q | AK296: =IF(RC[-22]<>0,RC[-22]&R4C32,"q") -> q | AL296: =IF(RC[-22]<>0,RC[-22]&R4C32,"q") -> q | AM296: =IF(RC[-22]<>0,RC[-22]&R4C32,"q") -> q | AN296: =IF(RC[-22]<>0,RC[-22]&R4C32,"q") -> q | AO296: =IF(RC[-22]<>0,RC[-22]&R4C32,"q") -> q | AP296: =IF(RC[-22]<>0,RC[-22]&R4C32,"q") -> q | AQ296: =IF(RC[-22]<>0,RC[-22]&R4C32,"q") -> q | AR296: =IF(RC[-22]<>0,RC[-22]&R4C32,"q") -> q | AS296: =IF(RC[-22]<>0,RC[-22]&R4C32,"q") -> q | AT296: =IF(RC[-22]<>0,RC[-22]&R4C32,"q") -> q | AU296: =IF(RC[-22]<>0,RC[-22]&R4C32,"q") -> q | AV296: =IF(RC[-22]<>0,RC[-22]&R4C32,"q") -> q
AC297: =IF(RC[-22]<>0,RC[-22]&R4C32,"q") -> q | AD297: =IF(RC[-22]<>0,RC[-22]&R4C32,"q") -> q | AE297: =IF(RC[-22]<>0,RC[-22]&R4C32,"q") -> q | AF297: =IF(RC[-22]<>0,RC[-22]&R4C32,"q") -> q | AG297: =IF(RC[-22]<>0,RC[-22]&R4C32,"q") -> q | AH297: =IF(RC[-22]<>0,RC[-22]&R4C32,"q") -> q | AI297: =IF(RC[-22]<>0,RC[-22]&R4C32,"q") -> q | AJ297: =IF(RC[-22]<>0,RC[-22]&R4C32,"q") -> q | AK297: =IF(RC[-22]<>0,RC[-22]&R4C32,"q") -> q | AL297: =IF(RC[-22]<>0,RC[-22]&R4C32,"q") -> q | AM297: =IF(RC[-22]<>0,RC[-22]&R4C32,"q") -> q | AN297: =IF(RC[-22]<>0,RC[-22]&R4C32,"q") -> q | AO297: =IF(RC[-22]<>0,RC[-22]&R4C32,"q") -> q | AP297: =IF(RC[-22]<>0,RC[-22]&R4C32,"q") -> q | AQ297: =IF(RC[-22]<>0,RC[-22]&R4C32,"q") -> q | AR297: =IF(RC[-22]<>0,RC[-22]&R4C32,"q") -> q | AS297: =IF(RC[-22]<>0,RC[-22]&R4C32,"q") -> q | AT297: =IF(RC[-22]<>0,RC[-22]&R4C32,"q") -> q | AU297: =IF(RC[-22]<>0,RC[-22]&R4C32,"q") -> q | AV297: =IF(RC[-22]<>0,RC[-22]&R4C32,"q") -> q
AC298: =IF(RC[-22]<>0,RC[-22]&R4C32,"q") -> q | AD298: =IF(RC[-22]<>0,RC[-22]&R4C32,"q") -> q | AE298: =IF(RC[-22]<>0,RC[-22]&R4C32,"q") -> q | AF298: =IF(RC[-22]<>0,RC[-22]&R4C32,"q") -> q | AG298: =IF(RC[-22]<>0,RC[-22]&R4C32,"q") -> q | AH298: =IF(RC[-22]<>0,RC[-22]&R4C32,"q") -> q | AI298: =IF(RC[-22]<>0,RC[-22]&R4C32,"q") -> q | AJ298: =IF(RC[-22]<>0,RC[-22]&R4C32,"q") -> q | AK298: =IF(RC[-22]<>0,RC[-22]&R4C32,"q") -> q | AL298: =IF(RC[-22]<>0,RC[-22]&R4C32,"q") -> q | AM298: =IF(RC[-22]<>0,RC[-22]&R4C32,"q") -> q | AN298: =IF(RC[-22]<>0,RC[-22]&R4C32,"q") -> q | AO298: =IF(RC[-22]<>0,RC[-22]&R4C32,"q") -> q | AP298: =IF(RC[-22]<>0,RC[-22]&R4C32,"q") -> q | AQ298: =IF(RC[-22]<>0,RC[-22]&R4C32,"q") -> q | AR298: =IF(RC[-22]<>0,RC[-22]&R4C32,"q") -> q | AS298: =IF(RC[-22]<>0,RC[-22]&R4C32,"q") -> q | AT298: =IF(RC[-22]<>0,RC[-22]&R4C32,"q") -> q | AU298: =IF(RC[-22]<>0,RC[-22]&R4C32,"q") -> q | AV298: =IF(RC[-22]<>0,RC[-22]&R4C32,"q") -> q
AC299: =IF(RC[-22]<>0,RC[-22]&R4C32,"q") -> q | AD299: =IF(RC[-22]<>0,RC[-22]&R4C32,"q") -> q | AE299: =IF(RC[-22]<>0,RC[-22]&R4C32,"q") -> q | AF299: =IF(RC[-22]<>0,RC[-22]&R4C32,"q") -> q | AG299: =IF(RC[-22]<>0,RC[-22]&R4C32,"q") -> q | AH299: =IF(RC[-22]<>0,RC[-22]&R4C32,"q") -> q | AI299: =IF(RC[-22]<>0,RC[-22]&R4C32,"q") -> q | AJ299: =IF(RC[-22]<>0,RC[-22]&R4C32,"q") -> q | AK299: =IF(RC[-22]<>0,RC[-22]&R4C32,"q") -> q | AL299: =IF(RC[-22]<>0,RC[-22]&R4C32,"q") -> q | AM299: =IF(RC[-22]<>0,RC[-22]&R4C32,"q") -> q | AN299: =IF(RC[-22]<>0,RC[-22]&R4C32,"q") -> q | AO299: =IF(RC[-22]<>0,RC[-22]&R4C32,"q") -> q | AP299: =IF(RC[-22]<>0,RC[-22]&R4C32,"q") -> q | AQ299: =IF(RC[-22]<>0,RC[-22]&R4C32,"q") -> q | AR299: =IF(RC[-22]<>0,RC[-22]&R4C32,"q") -> q | AS299: =IF(RC[-22]<>0,RC[-22]&R4C32,"q") -> q | AT299: =IF(RC[-22]<>0,RC[-22]&R4C32,"q") -> q | AU299: =IF(RC[-22]<>0,RC[-22]&R4C32,"q") -> q | AV299: =IF(RC[-22]<>0,RC[-22]&R4C32,"q") -> q
AC300: =IF(RC[-22]<>0,RC[-22]&R4C32,"q") -> q | AD300: =IF(RC[-22]<>0,RC[-22]&R4C32,"q") -> q | AE300: =IF(RC[-22]<>0,RC[-22]&R4C32,"q") -> q | AF300: =IF(RC[-22]<>0,RC[-22]&R4C32,"q") -> q | AG300: =IF(RC[-22]<>0,RC[-22]&R4C32,"q") -> q | AH300: =IF(RC[-22]<>0,RC[-22]&R4C32,"q") -> q | AI300: =IF(RC[-22]<>0,RC[-22]&R4C32,"q") -> q | AJ300: =IF(RC[-22]<>0,RC[-22]&R4C32,"q") -> q | AK300: =IF(RC[-22]<>0,RC[-22]&R4C32,"q") -> q | AL300: =IF(RC[-22]<>0,RC[-22]&R4C32,"q") -> q | AM300: =IF(RC[-22]<>0,RC[-22]&R4C32,"q") -> q | AN300: =IF(RC[-22]<>0,RC[-22]&R4C32,"q") -> q | AO300: =IF(RC[-22]<>0,RC[-22]&R4C32,"q") -> q | AP300: =IF(RC[-22]<>0,RC[-22]&R4C32,"q") -> q | AQ300: =IF(RC[-22]<>0,RC[-22]&R4C32,"q") -> q | AR300: =IF(RC[-22]<>0,RC[-22]&R4C32,"q") -> q | AS300: =IF(RC[-22]<>0,RC[-22]&R4C32,"q") -> q | AT300: =IF(RC[-22]<>0,RC[-22]&R4C32,"q") -> q | AU300: =IF(RC[-22]<>0,RC[-22]&R4C32,"q") -> q | AV300: =IF(RC[-22]<>0,RC[-22]&R4C32,"q") -> q
AC301: =IF(RC[-22]<>0,RC[-22]&R4C32,"q") -> q | AD301: =IF(RC[-22]<>0,RC[-22]&R4C32,"q") -> q | AE301: =IF(RC[-22]<>0,RC[-22]&R4C32,"q") -> q | AF301: =IF(RC[-22]<>0,RC[-22]&R4C32,"q") -> q | AG301: =IF(RC[-22]<>0,RC[-22]&R4C32,"q") -> q | AH301: =IF(RC[-22]<>0,RC[-22]&R4C32,"q") -> q | AI301: =IF(RC[-22]<>0,RC[-22]&R4C32,"q") -> q | AJ301: =IF(RC[-22]<>0,RC[-22]&R4C32,"q") -> q | AK301: =IF(RC[-22]<>0,RC[-22]&R4C32,"q") -> q | AL301: =IF(RC[-22]<>0,RC[-22]&R4C32,"q") -> q | AM301: =IF(RC[-22]<>0,RC[-22]&R4C32,"q") -> q | AN301: =IF(RC[-22]<>0,RC[-22]&R4C32,"q") -> q | AO301: =IF(RC[-22]<>0,RC[-22]&R4C32,"q") -> q | AP301: =IF(RC[-22]<>0,RC[-22]&R4C32,"q") -> q | AQ301: =IF(RC[-22]<>0,RC[-22]&R4C32,"q") -> q | AR301: =IF(RC[-22]<>0,RC[-22]&R4C32,"q") -> q | AS301: =IF(RC[-22]<>0,RC[-22]&R4C32,"q") -> q | AT301: =IF(RC[-22]<>0,RC[-22]&R4C32,"q") -> q | AU301: =IF(RC[-22]<>0,RC[-22]&R4C32,"q") -> q | AV301: =IF(RC[-22]<>0,RC[-22]&R4C32,"q") -> q
AC302: =IF(RC[-22]<>0,RC[-22]&R4C32,"q") -> q | AD302: =IF(RC[-22]<>0,RC[-22]&R4C32,"q") -> q | AE302: =IF(RC[-22]<>0,RC[-22]&R4C32,"q") -> q | AF302: =IF(RC[-22]<>0,RC[-22]&R4C32,"q") -> q | AG302: =IF(RC[-22]<>0,RC[-22]&R4C32,"q") -> q | AH302: =IF(RC[-22]<>0,RC[-22]&R4C32,"q") -> q | AI302: =IF(RC[-22]<>0,RC[-22]&R4C32,"q") -> q | AJ302: =IF(RC[-22]<>0,RC[-22]&R4C32,"q") -> q | AK302: =IF(RC[-22]<>0,RC[-22]&R4C32,"q") -> q | AL302: =IF(RC[-22]<>0,RC[-22]&R4C32,"q") -> q | AM302: =IF(RC[-22]<>0,RC[-22]&R4C32,"q") -> q | AN302: =IF(RC[-22]<>0,RC[-22]&R4C32,"q") -> q | AO302: =IF(RC[-22]<>0,RC[-22]&R4C32,"q") -> q | AP302: =IF(RC[-22]<>0,RC[-22]&R4C32,"q") -> q | AQ302: =IF(RC[-22]<>0,RC[-22]&R4C32,"q") -> q | AR302: =IF(RC[-22]<>0,RC[-22]&R4C32,"q") -> q | AS302: =IF(RC[-22]<>0,RC[-22]&R4C32,"q") -> q | AT302: =IF(RC[-22]<>0,RC[-22]&R4C32,"q") -> q | AU302: =IF(RC[-22]<>0,RC[-22]&R4C32,"q") -> q | AV302: =IF(RC[-22]<>0,RC[-22]&R4C32,"q") -> q
AC303: =IF(RC[-22]<>0,RC[-22]&R4C32,"q") -> q | AD303: =IF(RC[-22]<>0,RC[-22]&R4C32,"q") -> q | AE303: =IF(RC[-22]<>0,RC[-22]&R4C32,"q") -> q | AF303: =IF(RC[-22]<>0,RC[-22]&R4C32,"q") -> q | AG303: =IF(RC[-22]<>0,RC[-22]&R4C32,"q") -> q | AH303: =IF(RC[-22]<>0,RC[-22]&R4C32,"q") -> q | AI303: =IF(RC[-22]<>0,RC[-22]&R4C32,"q") -> q | AJ303: =IF(RC[-22]<>0,RC[-22]&R4C32,"q") -> q | AK303: =IF(RC[-22]<>0,RC[-22]&R4C32,"q") -> q | AL303: =IF(RC[-22]<>0,RC[-22]&R4C32,"q") -> q | AM303: =IF(RC[-22]<>0,RC[-22]&R4C32,"q") -> q | AN303: =IF(RC[-22]<>0,RC[-22]&R4C32,"q") -> q | AO303: =IF(RC[-22]<>0,RC[-22]&R4C32,"q") -> q | AP303: =IF(RC[-22]<>0,RC[-22]&R4C32,"q") -> q | AQ303: =IF(RC[-22]<>0,RC[-22]&R4C32,"q") -> q | AR303: =IF(RC[-22]<>0,RC[-22]&R4C32,"q") -> q | AS303: =IF(RC[-22]<>0,RC[-22]&R4C32,"q") -> q | AT303: =IF(RC[-22]<>0,RC[-22]&R4C32,"q") -> q | AU303: =IF(RC[-22]<>0,RC[-22]&R4C32,"q") -> q | AV303: =IF(RC[-22]<>0,RC[-22]&R4C32,"q") -> q
AC304: =IF(RC[-22]<>0,RC[-22]&R4C32,"q") -> q | AD304: =IF(RC[-22]<>0,RC[-22]&R4C32,"q") -> q | AE304: =IF(RC[-22]<>0,RC[-22]&R4C32,"q") -> q | AF304: =IF(RC[-22]<>0,RC[-22]&R4C32,"q") -> q | AG304: =IF(RC[-22]<>0,RC[-22]&R4C32,"q") -> q | AH304: =IF(RC[-22]<>0,RC[-22]&R4C32,"q") -> q | AI304: =IF(RC[-22]<>0,RC[-22]&R4C32,"q") -> q | AJ304: =IF(RC[-22]<>0,RC[-22]&R4C32,"q") -> q | AK304: =IF(RC[-22]<>0,RC[-22]&R4C32,"q") -> q | AL304: =IF(RC[-22]<>0,RC[-22]&R4C32,"q") -> q | AM304: =IF(RC[-22]<>0,RC[-22]&R4C32,"q") -> q | AN304: =IF(RC[-22]<>0,RC[-22]&R4C32,"q") -> q | AO304: =IF(RC[-22]<>0,RC[-22]&R4C32,"q") -> q | AP304: =IF(RC[-22]<>0,RC[-22]&R4C32,"q") -> q | AQ304: =IF(RC[-22]<>0,RC[-22]&R4C32,"q") -> q | AR304: =IF(RC[-22]<>0,RC[-22]&R4C32,"q") -> q | AS304: =IF(RC[-22]<>0,RC[-22]&R4C32,"q") -> q | AT304: =IF(RC[-22]<>0,RC[-22]&R4C32,"q") -> q | AU304: =IF(RC[-22]<>0,RC[-22]&R4C32,"q") -> q | AV304: =IF(RC[-22]<>0,RC[-22]&R4C32,"q") -> q
AC305: =IF(RC[-22]<>0,RC[-22]&R4C32,"q") -> q | AD305: =IF(RC[-22]<>0,RC[-22]&R4C32,"q") -> q | AE305: =IF(RC[-22]<>0,RC[-22]&R4C32,"q") -> q | AF305: =IF(RC[-22]<>0,RC[-22]&R4C32,"q") -> q | AG305: =IF(RC[-22]<>0,RC[-22]&R4C32,"q") -> q | AH305: =IF(RC[-22]<>0,RC[-22]&R4C32,"q") -> q | AI305: =IF(RC[-22]<>0,RC[-22]&R4C32,"q") -> q | AJ305: =IF(RC[-22]<>0,RC[-22]&R4C32,"q") -> q | AK305: =IF(RC[-22]<>0,RC[-22]&R4C32,"q") -> q | AL305: =IF(RC[-22]<>0,RC[-22]&R4C32,"q") -> q | AM305: =IF(RC[-22]<>0,RC[-22]&R4C32,"q") -> q | AN305: =IF(RC[-22]<>0,RC[-22]&R4C32,"q") -> q | AO305: =IF(RC[-22]<>0,RC[-22]&R4C32,"q") -> q | AP305: =IF(RC[-22]<>0,RC[-22]&R4C32,"q") -> q | AQ305: =IF(RC[-22]<>0,RC[-22]&R4C32,"q") -> q | AR305: =IF(RC[-22]<>0,RC[-22]&R4C32,"q") -> q | AS305: =IF(RC[-22]<>0,RC[-22]&R4C32,"q") -> q | AT305: =IF(RC[-22]<>0,RC[-22]&R4C32,"q") -> q | AU305: =IF(RC[-22]<>0,RC[-22]&R4C32,"q") -> q | AV305: =IF(RC[-22]<>0,RC[-22]&R4C32,"q") -> q
AC306: =IF(RC[-22]<>0,RC[-22]&R4C32,"q") -> q | AD306: =IF(RC[-22]<>0,RC[-22]&R4C32,"q") -> q | AE306: =IF(RC[-22]<>0,RC[-22]&R4C32,"q") -> q | AF306: =IF(RC[-22]<>0,RC[-22]&R4C32,"q") -> q | AG306: =IF(RC[-22]<>0,RC[-22]&R4C32,"q") -> q | AH306: =IF(RC[-22]<>0,RC[-22]&R4C32,"q") -> q | AI306: =IF(RC[-22]<>0,RC[-22]&R4C32,"q") -> q | AJ306: =IF(RC[-22]<>0,RC[-22]&R4C32,"q") -> q | AK306: =IF(RC[-22]<>0,RC[-22]&R4C32,"q") -> q | AL306: =IF(RC[-22]<>0,RC[-22]&R4C32,"q") -> q | AM306: =IF(RC[-22]<>0,RC[-22]&R4C32,"q") -> q | AN306: =IF(RC[-22]<>0,RC[-22]&R4C32,"q") -> q | AO306: =IF(RC[-22]<>0,RC[-22]&R4C32,"q") -> q | AP306: =IF(RC[-22]<>0,RC[-22]&R4C32,"q") -> q | AQ306: =IF(RC[-22]<>0,RC[-22]&R4C32,"q") -> q | AR306: =IF(RC[-22]<>0,RC[-22]&R4C32,"q") -> q | AS306: =IF(RC[-22]<>0,RC[-22]&R4C32,"q") -> q | AT306: =IF(RC[-22]<>0,RC[-22]&R4C32,"q") -> q | AU306: =IF(RC[-22]<>0,RC[-22]&R4C32,"q") -> q | AV306: =IF(RC[-22]<>0,RC[-22]&R4C32,"q") -> q
AC307: =IF(RC[-22]<>0,RC[-22]&R4C32,"q") -> q | AD307: =IF(RC[-22]<>0,RC[-22]&R4C32,"q") -> q | AE307: =IF(RC[-22]<>0,RC[-22]&R4C32,"q") -> q | AF307: =IF(RC[-22]<>0,RC[-22]&R4C32,"q") -> q | AG307: =IF(RC[-22]<>0,RC[-22]&R4C32,"q") -> q | AH307: =IF(RC[-22]<>0,RC[-22]&R4C32,"q") -> q | AI307: =IF(RC[-22]<>0,RC[-22]&R4C32,"q") -> q | AJ307: =IF(RC[-22]<>0,RC[-22]&R4C32,"q") -> q | AK307: =IF(RC[-22]<>0,RC[-22]&R4C32,"q") -> q | AL307: =IF(RC[-22]<>0,RC[-22]&R4C32,"q") -> q | AM307: =IF(RC[-22]<>0,RC[-22]&R4C32,"q") -> q | AN307: =IF(RC[-22]<>0,RC[-22]&R4C32,"q") -> q | AO307: =IF(RC[-22]<>0,RC[-22]&R4C32,"q") -> q | AP307: =IF(RC[-22]<>0,RC[-22]&R4C32,"q") -> q | AQ307: =IF(RC[-22]<>0,RC[-22]&R4C32,"q") -> q | AR307: =IF(RC[-22]<>0,RC[-22]&R4C32,"q") -> q | AS307: =IF(RC[-22]<>0,RC[-22]&R4C32,"q") -> q | AT307: =IF(RC[-22]<>0,RC[-22]&R4C32,"q") -> q | AU307: =IF(RC[-22]<>0,RC[-22]&R4C32,"q") -> q | AV307: =IF(RC[-22]<>0,RC[-22]&R4C32,"q") -> q
AC308: =IF(RC[-22]<>0,RC[-22]&R4C32,"q") -> q | AD308: =IF(RC[-22]<>0,RC[-22]&R4C32,"q") -> q | AE308: =IF(RC[-22]<>0,RC[-22]&R4C32,"q") -> q | AF308: =IF(RC[-22]<>0,RC[-22]&R4C32,"q") -> q | AG308: =IF(RC[-22]<>0,RC[-22]&R4C32,"q") -> q | AH308: =IF(RC[-22]<>0,RC[-22]&R4C32,"q") -> q | AI308: =IF(RC[-22]<>0,RC[-22]&R4C32,"q") -> q | AJ308: =IF(RC[-22]<>0,RC[-22]&R4C32,"q") -> q | AK308: =IF(RC[-22]<>0,RC[-22]&R4C32,"q") -> q | AL308: =IF(RC[-22]<>0,RC[-22]&R4C32,"q") -> q | AM308: =IF(RC[-22]<>0,RC[-22]&R4C32,"q") -> q | AN308: =IF(RC[-22]<>0,RC[-22]&R4C32,"q") -> q | AO308: =IF(RC[-22]<>0,RC[-22]&R4C32,"q") -> q | AP308: =IF(RC[-22]<>0,RC[-22]&R4C32,"q") -> q | AQ308: =IF(RC[-22]<>0,RC[-22]&R4C32,"q") -> q | AR308: =IF(RC[-22]<>0,RC[-22]&R4C32,"q") -> q | AS308: =IF(RC[-22]<>0,RC[-22]&R4C32,"q") -> q | AT308: =IF(RC[-22]<>0,RC[-22]&R4C32,"q") -> q | AU308: =IF(RC[-22]<>0,RC[-22]&R4C32,"q") -> q | AV308: =IF(RC[-22]<>0,RC[-22]&R4C32,"q") -> q
AC309: =IF(RC[-22]<>0,RC[-22]&R4C32,"q") -> q | AD309: =IF(RC[-22]<>0,RC[-22]&R4C32,"q") -> q | AE309: =IF(RC[-22]<>0,RC[-22]&R4C32,"q") -> q | AF309: =IF(RC[-22]<>0,RC[-22]&R4C32,"q") -> q | AG309: =IF(RC[-22]<>0,RC[-22]&R4C32,"q") -> q | AH309: =IF(RC[-22]<>0,RC[-22]&R4C32,"q") -> q | AI309: =IF(RC[-22]<>0,RC[-22]&R4C32,"q") -> q | AJ309: =IF(RC[-22]<>0,RC[-22]&R4C32,"q") -> q | AK309: =IF(RC[-22]<>0,RC[-22]&R4C32,"q") -> q | AL309: =IF(RC[-22]<>0,RC[-22]&R4C32,"q") -> q | AM309: =IF(RC[-22]<>0,RC[-22]&R4C32,"q") -> q | AN309: =IF(RC[-22]<>0,RC[-22]&R4C32,"q") -> q | AO309: =IF(RC[-22]<>0,RC[-22]&R4C32,"q") -> q | AP309: =IF(RC[-22]<>0,RC[-22]&R4C32,"q") -> q | AQ309: =IF(RC[-22]<>0,RC[-22]&R4C32,"q") -> q | AR309: =IF(RC[-22]<>0,RC[-22]&R4C32,"q") -> q | AS309: =IF(RC[-22]<>0,RC[-22]&R4C32,"q") -> q | AT309: =IF(RC[-22]<>0,RC[-22]&R4C32,"q") -> q | AU309: =IF(RC[-22]<>0,RC[-22]&R4C32,"q") -> q | AV309: =IF(RC[-22]<>0,RC[-22]&R4C32,"q") -> q
AC310: =IF(RC[-22]<>0,RC[-22]&R4C32,"q") -> q | AD310: =IF(RC[-22]<>0,RC[-22]&R4C32,"q") -> q | AE310: =IF(RC[-22]<>0,RC[-22]&R4C32,"q") -> q | AF310: =IF(RC[-22]<>0,RC[-22]&R4C32,"q") -> q | AG310: =IF(RC[-22]<>0,RC[-22]&R4C32,"q") -> q | AH310: =IF(RC[-22]<>0,RC[-22]&R4C32,"q") -> q | AI310: =IF(RC[-22]<>0,RC[-22]&R4C32,"q") -> q | AJ310: =IF(RC[-22]<>0,RC[-22]&R4C32,"q") -> q | AK310: =IF(RC[-22]<>0,RC[-22]&R4C32,"q") -> q | AL310: =IF(RC[-22]<>0,RC[-22]&R4C32,"q") -> q | AM310: =IF(RC[-22]<>0,RC[-22]&R4C32,"q") -> q | AN310: =IF(RC[-22]<>0,RC[-22]&R4C32,"q") -> q | AO310: =IF(RC[-22]<>0,RC[-22]&R4C32,"q") -> q | AP310: =IF(RC[-22]<>0,RC[-22]&R4C32,"q") -> q | AQ310: =IF(RC[-22]<>0,RC[-22]&R4C32,"q") -> q | AR310: =IF(RC[-22]<>0,RC[-22]&R4C32,"q") -> q | AS310: =IF(RC[-22]<>0,RC[-22]&R4C32,"q") -> q | AT310: =IF(RC[-22]<>0,RC[-22]&R4C32,"q") -> q | AU310: =IF(RC[-22]<>0,RC[-22]&R4C32,"q") -> q | AV310: =IF(RC[-22]<>0,RC[-22]&R4C32,"q") -> q
AC311: =IF(RC[-22]<>0,RC[-22]&R4C32,"q") -> q | AD311: =IF(RC[-22]<>0,RC[-22]&R4C32,"q") -> q | AE311: =IF(RC[-22]<>0,RC[-22]&R4C32,"q") -> q | AF311: =IF(RC[-22]<>0,RC[-22]&R4C32,"q") -> q | AG311: =IF(RC[-22]<>0,RC[-22]&R4C32,"q") -> q | AH311: =IF(RC[-22]<>0,RC[-22]&R4C32,"q") -> q | AI311: =IF(RC[-22]<>0,RC[-22]&R4C32,"q") -> q | AJ311: =IF(RC[-22]<>0,RC[-22]&R4C32,"q") -> q | AK311: =IF(RC[-22]<>0,RC[-22]&R4C32,"q") -> q | AL311: =IF(RC[-22]<>0,RC[-22]&R4C32,"q") -> q | AM311: =IF(RC[-22]<>0,RC[-22]&R4C32,"q") -> q | AN311: =IF(RC[-22]<>0,RC[-22]&R4C32,"q") -> q | AO311: =IF(RC[-22]<>0,RC[-22]&R4C32,"q") -> q | AP311: =IF(RC[-22]<>0,RC[-22]&R4C32,"q") -> q | AQ311: =IF(RC[-22]<>0,RC[-22]&R4C32,"q") -> q | AR311: =IF(RC[-22]<>0,RC[-22]&R4C32,"q") -> q | AS311: =IF(RC[-22]<>0,RC[-22]&R4C32,"q") -> q | AT311: =IF(RC[-22]<>0,RC[-22]&R4C32,"q") -> q | AU311: =IF(RC[-22]<>0,RC[-22]&R4C32,"q") -> q | AV311: =IF(RC[-22]<>0,RC[-22]&R4C32,"q") -> q
AC312: =IF(RC[-22]<>0,RC[-22]&R4C32,"q") -> q | AD312: =IF(RC[-22]<>0,RC[-22]&R4C32,"q") -> q | AE312: =IF(RC[-22]<>0,RC[-22]&R4C32,"q") -> q | AF312: =IF(RC[-22]<>0,RC[-22]&R4C32,"q") -> q | AG312: =IF(RC[-22]<>0,RC[-22]&R4C32,"q") -> q | AH312: =IF(RC[-22]<>0,RC[-22]&R4C32,"q") -> q | AI312: =IF(RC[-22]<>0,RC[-22]&R4C32,"q") -> q | AJ312: =IF(RC[-22]<>0,RC[-22]&R4C32,"q") -> q | AK312: =IF(RC[-22]<>0,RC[-22]&R4C32,"q") -> q | AL312: =IF(RC[-22]<>0,RC[-22]&R4C32,"q") -> q | AM312: =IF(RC[-22]<>0,RC[-22]&R4C32,"q") -> q | AN312: =IF(RC[-22]<>0,RC[-22]&R4C32,"q") -> q | AO312: =IF(RC[-22]<>0,RC[-22]&R4C32,"q") -> q | AP312: =IF(RC[-22]<>0,RC[-22]&R4C32,"q") -> q | AQ312: =IF(RC[-22]<>0,RC[-22]&R4C32,"q") -> q | AR312: =IF(RC[-22]<>0,RC[-22]&R4C32,"q") -> q | AS312: =IF(RC[-22]<>0,RC[-22]&R4C32,"q") -> q | AT312: =IF(RC[-22]<>0,RC[-22]&R4C32,"q") -> q | AU312: =IF(RC[-22]<>0,RC[-22]&R4C32,"q") -> q | AV312: =IF(RC[-22]<>0,RC[-22]&R4C32,"q") -> q
AC313: =IF(RC[-22]<>0,RC[-22]&R4C32,"q") -> q | AD313: =IF(RC[-22]<>0,RC[-22]&R4C32,"q") -> q | AE313: =IF(RC[-22]<>0,RC[-22]&R4C32,"q") -> q | AF313: =IF(RC[-22]<>0,RC[-22]&R4C32,"q") -> q | AG313: =IF(RC[-22]<>0,RC[-22]&R4C32,"q") -> q | AH313: =IF(RC[-22]<>0,RC[-22]&R4C32,"q") -> q | AI313: =IF(RC[-22]<>0,RC[-22]&R4C32,"q") -> q | AJ313: =IF(RC[-22]<>0,RC[-22]&R4C32,"q") -> q | AK313: =IF(RC[-22]<>0,RC[-22]&R4C32,"q") -> q | AL313: =IF(RC[-22]<>0,RC[-22]&R4C32,"q") -> q | AM313: =IF(RC[-22]<>0,RC[-22]&R4C32,"q") -> q | AN313: =IF(RC[-22]<>0,RC[-22]&R4C32,"q") -> q | AO313: =IF(RC[-22]<>0,RC[-22]&R4C32,"q") -> q | AP313: =IF(RC[-22]<>0,RC[-22]&R4C32,"q") -> q | AQ313: =IF(RC[-22]<>0,RC[-22]&R4C32,"q") -> q | AR313: =IF(RC[-22]<>0,RC[-22]&R4C32,"q") -> q | AS313: =IF(RC[-22]<>0,RC[-22]&R4C32,"q") -> q | AT313: =IF(RC[-22]<>0,RC[-22]&R4C32,"q") -> q | AU313: =IF(RC[-22]<>0,RC[-22]&R4C32,"q") -> q | AV313: =IF(RC[-22]<>0,RC[-22]&R4C32,"q") -> q
AC314: =IF(RC[-22]<>0,RC[-22]&R4C32,"q") -> q | AD314: =IF(RC[-22]<>0,RC[-22]&R4C32,"q") -> q | AE314: =IF(RC[-22]<>0,RC[-22]&R4C32,"q") -> q | AF314: =IF(RC[-22]<>0,RC[-22]&R4C32,"q") -> q | AG314: =IF(RC[-22]<>0,RC[-22]&R4C32,"q") -> q | AH314: =IF(RC[-22]<>0,RC[-22]&R4C32,"q") -> q | AI314: =IF(RC[-22]<>0,RC[-22]&R4C32,"q") -> q | AJ314: =IF(RC[-22]<>0,RC[-22]&R4C32,"q") -> q | AK314: =IF(RC[-22]<>0,RC[-22]&R4C32,"q") -> q | AL314: =IF(RC[-22]<>0,RC[-22]&R4C32,"q") -> q | AM314: =IF(RC[-22]<>0,RC[-22]&R4C32,"q") -> q | AN314: =IF(RC[-22]<>0,RC[-22]&R4C32,"q") -> q | AO314: =IF(RC[-22]<>0,RC[-22]&R4C32,"q") -> q | AP314: =IF(RC[-22]<>0,RC[-22]&R4C32,"q") -> q | AQ314: =IF(RC[-22]<>0,RC[-22]&R4C32,"q") -> q | AR314: =IF(RC[-22]<>0,RC[-22]&R4C32,"q") -> q | AS314: =IF(RC[-22]<>0,RC[-22]&R4C32,"q") -> q | AT314: =IF(RC[-22]<>0,RC[-22]&R4C32,"q") -> q | AU314: =IF(RC[-22]<>0,RC[-22]&R4C32,"q") -> q | AV314: =IF(RC[-22]<>0,RC[-22]&R4C32,"q") -> q
AC315: =IF(RC[-22]<>0,RC[-22]&R4C32,"q") -> q | AD315: =IF(RC[-22]<>0,RC[-22]&R4C32,"q") -> q | AE315: =IF(RC[-22]<>0,RC[-22]&R4C32,"q") -> q | AF315: =IF(RC[-22]<>0,RC[-22]&R4C32,"q") -> q | AG315: =IF(RC[-22]<>0,RC[-22]&R4C32,"q") -> q | AH315: =IF(RC[-22]<>0,RC[-22]&R4C32,"q") -> q | AI315: =IF(RC[-22]<>0,RC[-22]&R4C32,"q") -> q | AJ315: =IF(RC[-22]<>0,RC[-22]&R4C32,"q") -> q | AK315: =IF(RC[-22]<>0,RC[-22]&R4C32,"q") -> q | AL315: =IF(RC[-22]<>0,RC[-22]&R4C32,"q") -> q | AM315: =IF(RC[-22]<>0,RC[-22]&R4C32,"q") -> q | AN315: =IF(RC[-22]<>0,RC[-22]&R4C32,"q") -> q | AO315: =IF(RC[-22]<>0,RC[-22]&R4C32,"q") -> q | AP315: =IF(RC[-22]<>0,RC[-22]&R4C32,"q") -> q | AQ315: =IF(RC[-22]<>0,RC[-22]&R4C32,"q") -> q | AR315: =IF(RC[-22]<>0,RC[-22]&R4C32,"q") -> q | AS315: =IF(RC[-22]<>0,RC[-22]&R4C32,"q") -> q | AT315: =IF(RC[-22]<>0,RC[-22]&R4C32,"q") -> q | AU315: =IF(RC[-22]<>0,RC[-22]&R4C32,"q") -> q | AV315: =IF(RC[-22]<>0,RC[-22]&R4C32,"q") -> q
AC316: =IF(RC[-22]<>0,RC[-22]&R4C32,"q") -> q | AD316: =IF(RC[-22]<>0,RC[-22]&R4C32,"q") -> q | AE316: =IF(RC[-22]<>0,RC[-22]&R4C32,"q") -> q | AF316: =IF(RC[-22]<>0,RC[-22]&R4C32,"q") -> q | AG316: =IF(RC[-22]<>0,RC[-22]&R4C32,"q") -> q | AH316: =IF(RC[-22]<>0,RC[-22]&R4C32,"q") -> q | AI316: =IF(RC[-22]<>0,RC[-22]&R4C32,"q") -> q | AJ316: =IF(RC[-22]<>0,RC[-22]&R4C32,"q") -> q | AK316: =IF(RC[-22]<>0,RC[-22]&R4C32,"q") -> q | AL316: =IF(RC[-22]<>0,RC[-22]&R4C32,"q") -> q | AM316: =IF(RC[-22]<>0,RC[-22]&R4C32,"q") -> q | AN316: =IF(RC[-22]<>0,RC[-22]&R4C32,"q") -> q | AO316: =IF(RC[-22]<>0,RC[-22]&R4C32,"q") -> q | AP316: =IF(RC[-22]<>0,RC[-22]&R4C32,"q") -> q | AQ316: =IF(RC[-22]<>0,RC[-22]&R4C32,"q") -> q | AR316: =IF(RC[-22]<>0,RC[-22]&R4C32,"q") -> q | AS316: =IF(RC[-22]<>0,RC[-22]&R4C32,"q") -> q | AT316: =IF(RC[-22]<>0,RC[-22]&R4C32,"q") -> q | AU316: =IF(RC[-22]<>0,RC[-22]&R4C32,"q") -> q | AV316: =IF(RC[-22]<>0,RC[-22]&R4C32,"q") -> q
AC317: =IF(RC[-22]<>0,RC[-22]&R4C32,"q") -> q | AD317: =IF(RC[-22]<>0,RC[-22]&R4C32,"q") -> q | AE317: =IF(RC[-22]<>0,RC[-22]&R4C32,"q") -> q | AF317: =IF(RC[-22]<>0,RC[-22]&R4C32,"q") -> q | AG317: =IF(RC[-22]<>0,RC[-22]&R4C32,"q") -> q | AH317: =IF(RC[-22]<>0,RC[-22]&R4C32,"q") -> q | AI317: =IF(RC[-22]<>0,RC[-22]&R4C32,"q") -> q | AJ317: =IF(RC[-22]<>0,RC[-22]&R4C32,"q") -> q | AK317: =IF(RC[-22]<>0,RC[-22]&R4C32,"q") -> q | AL317: =IF(RC[-22]<>0,RC[-22]&R4C32,"q") -> q | AM317: =IF(RC[-22]<>0,RC[-22]&R4C32,"q") -> q | AN317: =IF(RC[-22]<>0,RC[-22]&R4C32,"q") -> q | AO317: =IF(RC[-22]<>0,RC[-22]&R4C32,"q") -> q | AP317: =IF(RC[-22]<>0,RC[-22]&R4C32,"q") -> q | AQ317: =IF(RC[-22]<>0,RC[-22]&R4C32,"q") -> q | AR317: =IF(RC[-22]<>0,RC[-22]&R4C32,"q") -> q | AS317: =IF(RC[-22]<>0,RC[-22]&R4C32,"q") -> q | AT317: =IF(RC[-22]<>0,RC[-22]&R4C32,"q") -> q | AU317: =IF(RC[-22]<>0,RC[-22]&R4C32,"q") -> q | AV317: =IF(RC[-22]<>0,RC[-22]&R4C32,"q") -> q
AC318: =IF(RC[-22]<>0,RC[-22]&R4C32,"q") -> q | AD318: =IF(RC[-22]<>0,RC[-22]&R4C32,"q") -> q | AE318: =IF(RC[-22]<>0,RC[-22]&R4C32,"q") -> q | AF318: =IF(RC[-22]<>0,RC[-22]&R4C32,"q") -> q | AG318: =IF(RC[-22]<>0,RC[-22]&R4C32,"q") -> q | AH318: =IF(RC[-22]<>0,RC[-22]&R4C32,"q") -> q | AI318: =IF(RC[-22]<>0,RC[-22]&R4C32,"q") -> q | AJ318: =IF(RC[-22]<>0,RC[-22]&R4C32,"q") -> q | AK318: =IF(RC[-22]<>0,RC[-22]&R4C32,"q") -> q | AL318: =IF(RC[-22]<>0,RC[-22]&R4C32,"q") -> q | AM318: =IF(RC[-22]<>0,RC[-22]&R4C32,"q") -> q | AN318: =IF(RC[-22]<>0,RC[-22]&R4C32,"q") -> q | AO318: =IF(RC[-22]<>0,RC[-22]&R4C32,"q") -> q | AP318: =IF(RC[-22]<>0,RC[-22]&R4C32,"q") -> q | AQ318: =IF(RC[-22]<>0,RC[-22]&R4C32,"q") -> q | AR318: =IF(RC[-22]<>0,RC[-22]&R4C32,"q") -> q | AS318: =IF(RC[-22]<>0,RC[-22]&R4C32,"q") -> q | AT318: =IF(RC[-22]<>0,RC[-22]&R4C32,"q") -> q | AU318: =IF(RC[-22]<>0,RC[-22]&R4C32,"q") -> q | AV318: =IF(RC[-22]<>0,RC[-22]&R4C32,"q") -> q
AC319: =IF(RC[-22]<>0,RC[-22]&R4C32,"q") -> q | AD319: =IF(RC[-22]<>0,RC[-22]&R4C32,"q") -> q | AE319: =IF(RC[-22]<>0,RC[-22]&R4C32,"q") -> q | AF319: =IF(RC[-22]<>0,RC[-22]&R4C32,"q") -> q | AG319: =IF(RC[-22]<>0,RC[-22]&R4C32,"q") -> q | AH319: =IF(RC[-22]<>0,RC[-22]&R4C32,"q") -> q | AI319: =IF(RC[-22]<>0,RC[-22]&R4C32,"q") -> q | AJ319: =IF(RC[-22]<>0,RC[-22]&R4C32,"q") -> q | AK319: =IF(RC[-22]<>0,RC[-22]&R4C32,"q") -> q | AL319: =IF(RC[-22]<>0,RC[-22]&R4C32,"q") -> q | AM319: =IF(RC[-22]<>0,RC[-22]&R4C32,"q") -> q | AN319: =IF(RC[-22]<>0,RC[-22]&R4C32,"q") -> q | AO319: =IF(RC[-22]<>0,RC[-22]&R4C32,"q") -> q | AP319: =IF(RC[-22]<>0,RC[-22]&R4C32,"q") -> q | AQ319: =IF(RC[-22]<>0,RC[-22]&R4C32,"q") -> q | AR319: =IF(RC[-22]<>0,RC[-22]&R4C32,"q") -> q | AS319: =IF(RC[-22]<>0,RC[-22]&R4C32,"q") -> q | AT319: =IF(RC[-22]<>0,RC[-22]&R4C32,"q") -> q | AU319: =IF(RC[-22]<>0,RC[-22]&R4C32,"q") -> q | AV319: =IF(RC[-22]<>0,RC[-22]&R4C32,"q") -> q
AC320: =IF(RC[-22]<>0,RC[-22]&R4C32,"q") -> q | AD320: =IF(RC[-22]<>0,RC[-22]&R4C32,"q") -> q | AE320: =IF(RC[-22]<>0,RC[-22]&R4C32,"q") -> q | AF320: =IF(RC[-22]<>0,RC[-22]&R4C32,"q") -> q | AG320: =IF(RC[-22]<>0,RC[-22]&R4C32,"q") -> q | AH320: =IF(RC[-22]<>0,RC[-22]&R4C32,"q") -> q | AI320: =IF(RC[-22]<>0,RC[-22]&R4C32,"q") -> q | AJ320: =IF(RC[-22]<>0,RC[-22]&R4C32,"q") -> q | AK320: =IF(RC[-22]<>0,RC[-22]&R4C32,"q") -> q | AL320: =IF(RC[-22]<>0,RC[-22]&R4C32,"q") -> q | AM320: =IF(RC[-22]<>0,RC[-22]&R4C32,"q") -> q | AN320: =IF(RC[-22]<>0,RC[-22]&R4C32,"q") -> q | AO320: =IF(RC[-22]<>0,RC[-22]&R4C32,"q") -> q | AP320: =IF(RC[-22]<>0,RC[-22]&R4C32,"q") -> q | AQ320: =IF(RC[-22]<>0,RC[-22]&R4C32,"q") -> q | AR320: =IF(RC[-22]<>0,RC[-22]&R4C32,"q") -> q | AS320: =IF(RC[-22]<>0,RC[-22]&R4C32,"q") -> q | AT320: =IF(RC[-22]<>0,RC[-22]&R4C32,"q") -> q | AU320: =IF(RC[-22]<>0,RC[-22]&R4C32,"q") -> q | AV320: =IF(RC[-22]<>0,RC[-22]&R4C32,"q") -> q
AC321: =IF(RC[-22]<>0,RC[-22]&R4C32,"q") -> q | AD321: =IF(RC[-22]<>0,RC[-22]&R4C32,"q") -> q | AE321: =IF(RC[-22]<>0,RC[-22]&R4C32,"q") -> q | AF321: =IF(RC[-22]<>0,RC[-22]&R4C32,"q") -> q | AG321: =IF(RC[-22]<>0,RC[-22]&R4C32,"q") -> q | AH321: =IF(RC[-22]<>0,RC[-22]&R4C32,"q") -> q | AI321: =IF(RC[-22]<>0,RC[-22]&R4C32,"q") -> q | AJ321: =IF(RC[-22]<>0,RC[-22]&R4C32,"q") -> q | AK321: =IF(RC[-22]<>0,RC[-22]&R4C32,"q") -> q | AL321: =IF(RC[-22]<>0,RC[-22]&R4C32,"q") -> q | AM321: =IF(RC[-22]<>0,RC[-22]&R4C32,"q") -> q | AN321: =IF(RC[-22]<>0,RC[-22]&R4C32,"q") -> q | AO321: =IF(RC[-22]<>0,RC[-22]&R4C32,"q") -> q | AP321: =IF(RC[-22]<>0,RC[-22]&R4C32,"q") -> q | AQ321: =IF(RC[-22]<>0,RC[-22]&R4C32,"q") -> q | AR321: =IF(RC[-22]<>0,RC[-22]&R4C32,"q") -> q | AS321: =IF(RC[-22]<>0,RC[-22]&R4C32,"q") -> q | AT321: =IF(RC[-22]<>0,RC[-22]&R4C32,"q") -> q | AU321: =IF(RC[-22]<>0,RC[-22]&R4C32,"q") -> q | AV321: =IF(RC[-22]<>0,RC[-22]&R4C32,"q") -> q
AC322: =IF(RC[-22]<>0,RC[-22]&R4C32,"q") -> q | AD322: =IF(RC[-22]<>0,RC[-22]&R4C32,"q") -> q | AE322: =IF(RC[-22]<>0,RC[-22]&R4C32,"q") -> q | AF322: =IF(RC[-22]<>0,RC[-22]&R4C32,"q") -> q | AG322: =IF(RC[-22]<>0,RC[-22]&R4C32,"q") -> q | AH322: =IF(RC[-22]<>0,RC[-22]&R4C32,"q") -> q | AI322: =IF(RC[-22]<>0,RC[-22]&R4C32,"q") -> q | AJ322: =IF(RC[-22]<>0,RC[-22]&R4C32,"q") -> q | AK322: =IF(RC[-22]<>0,RC[-22]&R4C32,"q") -> q | AL322: =IF(RC[-22]<>0,RC[-22]&R4C32,"q") -> q | AM322: =IF(RC[-22]<>0,RC[-22]&R4C32,"q") -> q | AN322: =IF(RC[-22]<>0,RC[-22]&R4C32,"q") -> q | AO322: =IF(RC[-22]<>0,RC[-22]&R4C32,"q") -> q | AP322: =IF(RC[-22]<>0,RC[-22]&R4C32,"q") -> q | AQ322: =IF(RC[-22]<>0,RC[-22]&R4C32,"q") -> q | AR322: =IF(RC[-22]<>0,RC[-22]&R4C32,"q") -> q | AS322: =IF(RC[-22]<>0,RC[-22]&R4C32,"q") -> q | AT322: =IF(RC[-22]<>0,RC[-22]&R4C32,"q") -> q | AU322: =IF(RC[-22]<>0,RC[-22]&R4C32,"q") -> q | AV322: =IF(RC[-22]<>0,RC[-22]&R4C32,"q") -> q
AC323: =IF(RC[-22]<>0,RC[-22]&R4C32,"q") -> q | AD323: =IF(RC[-22]<>0,RC[-22]&R4C32,"q") -> q | AE323: =IF(RC[-22]<>0,RC[-22]&R4C32,"q") -> q | AF323: =IF(RC[-22]<>0,RC[-22]&R4C32,"q") -> q | AG323: =IF(RC[-22]<>0,RC[-22]&R4C32,"q") -> q | AH323: =IF(RC[-22]<>0,RC[-22]&R4C32,"q") -> q | AI323: =IF(RC[-22]<>0,RC[-22]&R4C32,"q") -> q | AJ323: =IF(RC[-22]<>0,RC[-22]&R4C32,"q") -> q | AK323: =IF(RC[-22]<>0,RC[-22]&R4C32,"q") -> q | AL323: =IF(RC[-22]<>0,RC[-22]&R4C32,"q") -> q | AM323: =IF(RC[-22]<>0,RC[-22]&R4C32,"q") -> q | AN323: =IF(RC[-22]<>0,RC[-22]&R4C32,"q") -> q | AO323: =IF(RC[-22]<>0,RC[-22]&R4C32,"q") -> q | AP323: =IF(RC[-22]<>0,RC[-22]&R4C32,"q") -> q | AQ323: =IF(RC[-22]<>0,RC[-22]&R4C32,"q") -> q | AR323: =IF(RC[-22]<>0,RC[-22]&R4C32,"q") -> q | AS323: =IF(RC[-22]<>0,RC[-22]&R4C32,"q") -> q | AT323: =IF(RC[-22]<>0,RC[-22]&R4C32,"q") -> q | AU323: =IF(RC[-22]<>0,RC[-22]&R4C32,"q") -> q | AV323: =IF(RC[-22]<>0,RC[-22]&R4C32,"q") -> q
AC324: =IF(RC[-22]<>0,RC[-22]&R4C32,"q") -> q | AD324: =IF(RC[-22]<>0,RC[-22]&R4C32,"q") -> q | AE324: =IF(RC[-22]<>0,RC[-22]&R4C32,"q") -> q | AF324: =IF(RC[-22]<>0,RC[-22]&R4C32,"q") -> q | AG324: =IF(RC[-22]<>0,RC[-22]&R4C32,"q") -> q | AH324: =IF(RC[-22]<>0,RC[-22]&R4C32,"q") -> q | AI324: =IF(RC[-22]<>0,RC[-22]&R4C32,"q") -> q | AJ324: =IF(RC[-22]<>0,RC[-22]&R4C32,"q") -> q | AK324: =IF(RC[-22]<>0,RC[-22]&R4C32,"q") -> q | AL324: =IF(RC[-22]<>0,RC[-22]&R4C32,"q") -> q | AM324: =IF(RC[-22]<>0,RC[-22]&R4C32,"q") -> q | AN324: =IF(RC[-22]<>0,RC[-22]&R4C32,"q") -> q | AO324: =IF(RC[-22]<>0,RC[-22]&R4C32,"q") -> q | AP324: =IF(RC[-22]<>0,RC[-22]&R4C32,"q") -> q | AQ324: =IF(RC[-22]<>0,RC[-22]&R4C32,"q") -> q | AR324: =IF(RC[-22]<>0,RC[-22]&R4C32,"q") -> q | AS324: =IF(RC[-22]<>0,RC[-22]&R4C32,"q") -> q | AT324: =IF(RC[-22]<>0,RC[-22]&R4C32,"q") -> q | AU324: =IF(RC[-22]<>0,RC[-22]&R4C32,"q") -> q | AV324: =IF(RC[-22]<>0,RC[-22]&R4C32,"q") -> q
AC325: =IF(RC[-22]<>0,RC[-22]&R4C32,"q") -> q | AD325: =IF(RC[-22]<>0,RC[-22]&R4C32,"q") -> q | AE325: =IF(RC[-22]<>0,RC[-22]&R4C32,"q") -> q | AF325: =IF(RC[-22]<>0,RC[-22]&R4C32,"q") -> q | AG325: =IF(RC[-22]<>0,RC[-22]&R4C32,"q") -> q | AH325: =IF(RC[-22]<>0,RC[-22]&R4C32,"q") -> q | AI325: =IF(RC[-22]<>0,RC[-22]&R4C32,"q") -> q | AJ325: =IF(RC[-22]<>0,RC[-22]&R4C32,"q") -> q | AK325: =IF(RC[-22]<>0,RC[-22]&R4C32,"q") -> q | AL325: =IF(RC[-22]<>0,RC[-22]&R4C32,"q") -> q | AM325: =IF(RC[-22]<>0,RC[-22]&R4C32,"q") -> q | AN325: =IF(RC[-22]<>0,RC[-22]&R4C32,"q") -> q | AO325: =IF(RC[-22]<>0,RC[-22]&R4C32,"q") -> q | AP325: =IF(RC[-22]<>0,RC[-22]&R4C32,"q") -> q | AQ325: =IF(RC[-22]<>0,RC[-22]&R4C32,"q") -> q | AR325: =IF(RC[-22]<>0,RC[-22]&R4C32,"q") -> q | AS325: =IF(RC[-22]<>0,RC[-22]&R4C32,"q") -> q | AT325: =IF(RC[-22]<>0,RC[-22]&R4C32,"q") -> q | AU325: =IF(RC[-22]<>0,RC[-22]&R4C32,"q") -> q | AV325: =IF(RC[-22]<>0,RC[-22]&R4C32,"q") -> q
AC326: =IF(RC[-22]<>0,RC[-22]&R4C32,"q") -> q | AD326: =IF(RC[-22]<>0,RC[-22]&R4C32,"q") -> q | AE326: =IF(RC[-22]<>0,RC[-22]&R4C32,"q") -> q | AF326: =IF(RC[-22]<>0,RC[-22]&R4C32,"q") -> q | AG326: =IF(RC[-22]<>0,RC[-22]&R4C32,"q") -> q | AH326: =IF(RC[-22]<>0,RC[-22]&R4C32,"q") -> q | AI326: =IF(RC[-22]<>0,RC[-22]&R4C32,"q") -> q | AJ326: =IF(RC[-22]<>0,RC[-22]&R4C32,"q") -> q | AK326: =IF(RC[-22]<>0,RC[-22]&R4C32,"q") -> q | AL326: =IF(RC[-22]<>0,RC[-22]&R4C32,"q") -> q | AM326: =IF(RC[-22]<>0,RC[-22]&R4C32,"q") -> q | AN326: =IF(RC[-22]<>0,RC[-22]&R4C32,"q") -> q | AO326: =IF(RC[-22]<>0,RC[-22]&R4C32,"q") -> q | AP326: =IF(RC[-22]<>0,RC[-22]&R4C32,"q") -> q | AQ326: =IF(RC[-22]<>0,RC[-22]&R4C32,"q") -> q | AR326: =IF(RC[-22]<>0,RC[-22]&R4C32,"q") -> q | AS326: =IF(RC[-22]<>0,RC[-22]&R4C32,"q") -> q | AT326: =IF(RC[-22]<>0,RC[-22]&R4C32,"q") -> q | AU326: =IF(RC[-22]<>0,RC[-22]&R4C32,"q") -> q | AV326: =IF(RC[-22]<>0,RC[-22]&R4C32,"q") -> q
AC327: =IF(RC[-22]<>0,RC[-22]&R4C32,"q") -> q | AD327: =IF(RC[-22]<>0,RC[-22]&R4C32,"q") -> q | AE327: =IF(RC[-22]<>0,RC[-22]&R4C32,"q") -> q | AF327: =IF(RC[-22]<>0,RC[-22]&R4C32,"q") -> q | AG327: =IF(RC[-22]<>0,RC[-22]&R4C32,"q") -> q | AH327: =IF(RC[-22]<>0,RC[-22]&R4C32,"q") -> q | AI327: =IF(RC[-22]<>0,RC[-22]&R4C32,"q") -> q | AJ327: =IF(RC[-22]<>0,RC[-22]&R4C32,"q") -> q | AK327: =IF(RC[-22]<>0,RC[-22]&R4C32,"q") -> q | AL327: =IF(RC[-22]<>0,RC[-22]&R4C32,"q") -> q | AM327: =IF(RC[-22]<>0,RC[-22]&R4C32,"q") -> q | AN327: =IF(RC[-22]<>0,RC[-22]&R4C32,"q") -> q | AO327: =IF(RC[-22]<>0,RC[-22]&R4C32,"q") -> q | AP327: =IF(RC[-22]<>0,RC[-22]&R4C32,"q") -> q | AQ327: =IF(RC[-22]<>0,RC[-22]&R4C32,"q") -> q | AR327: =IF(RC[-22]<>0,RC[-22]&R4C32,"q") -> q | AS327: =IF(RC[-22]<>0,RC[-22]&R4C32,"q") -> q | AT327: =IF(RC[-22]<>0,RC[-22]&R4C32,"q") -> q | AU327: =IF(RC[-22]<>0,RC[-22]&R4C32,"q") -> q | AV327: =IF(RC[-22]<>0,RC[-22]&R4C32,"q") -> q
AC328: =IF(RC[-22]<>0,RC[-22]&R4C32,"q") -> q | AD328: =IF(RC[-22]<>0,RC[-22]&R4C32,"q") -> q | AE328: =IF(RC[-22]<>0,RC[-22]&R4C32,"q") -> q | AF328: =IF(RC[-22]<>0,RC[-22]&R4C32,"q") -> q | AG328: =IF(RC[-22]<>0,RC[-22]&R4C32,"q") -> q | AH328: =IF(RC[-22]<>0,RC[-22]&R4C32,"q") -> q | AI328: =IF(RC[-22]<>0,RC[-22]&R4C32,"q") -> q | AJ328: =IF(RC[-22]<>0,RC[-22]&R4C32,"q") -> q | AK328: =IF(RC[-22]<>0,RC[-22]&R4C32,"q") -> q | AL328: =IF(RC[-22]<>0,RC[-22]&R4C32,"q") -> q | AM328: =IF(RC[-22]<>0,RC[-22]&R4C32,"q") -> q | AN328: =IF(RC[-22]<>0,RC[-22]&R4C32,"q") -> q | AO328: =IF(RC[-22]<>0,RC[-22]&R4C32,"q") -> q | AP328: =IF(RC[-22]<>0,RC[-22]&R4C32,"q") -> q | AQ328: =IF(RC[-22]<>0,RC[-22]&R4C32,"q") -> q | AR328: =IF(RC[-22]<>0,RC[-22]&R4C32,"q") -> q | AS328: =IF(RC[-22]<>0,RC[-22]&R4C32,"q") -> q | AT328: =IF(RC[-22]<>0,RC[-22]&R4C32,"q") -> q | AU328: =IF(RC[-22]<>0,RC[-22]&R4C32,"q") -> q | AV328: =IF(RC[-22]<>0,RC[-22]&R4C32,"q") -> q
AC329: =IF(RC[-22]<>0,RC[-22]&R4C32,"q") -> q | AD329: =IF(RC[-22]<>0,RC[-22]&R4C32,"q") -> q | AE329: =IF(RC[-22]<>0,RC[-22]&R4C32,"q") -> q | AF329: =IF(RC[-22]<>0,RC[-22]&R4C32,"q") -> q | AG329: =IF(RC[-22]<>0,RC[-22]&R4C32,"q") -> q | AH329: =IF(RC[-22]<>0,RC[-22]&R4C32,"q") -> q | AI329: =IF(RC[-22]<>0,RC[-22]&R4C32,"q") -> q | AJ329: =IF(RC[-22]<>0,RC[-22]&R4C32,"q") -> q | AK329: =IF(RC[-22]<>0,RC[-22]&R4C32,"q") -> q | AL329: =IF(RC[-22]<>0,RC[-22]&R4C32,"q") -> q | AM329: =IF(RC[-22]<>0,RC[-22]&R4C32,"q") -> q | AN329: =IF(RC[-22]<>0,RC[-22]&R4C32,"q") -> q | AO329: =IF(RC[-22]<>0,RC[-22]&R4C32,"q") -> q | AP329: =IF(RC[-22]<>0,RC[-22]&R4C32,"q") -> q | AQ329: =IF(RC[-22]<>0,RC[-22]&R4C32,"q") -> q | AR329: =IF(RC[-22]<>0,RC[-22]&R4C32,"q") -> q | AS329: =IF(RC[-22]<>0,RC[-22]&R4C32,"q") -> q | AT329: =IF(RC[-22]<>0,RC[-22]&R4C32,"q") -> q | AU329: =IF(RC[-22]<>0,RC[-22]&R4C32,"q") -> q | AV329: =IF(RC[-22]<>0,RC[-22]&R4C32,"q") -> q
AC330: =IF(RC[-22]<>0,RC[-22]&R4C32,"q") -> q | AD330: =IF(RC[-22]<>0,RC[-22]&R4C32,"q") -> q | AE330: =IF(RC[-22]<>0,RC[-22]&R4C32,"q") -> q | AF330: =IF(RC[-22]<>0,RC[-22]&R4C32,"q") -> q | AG330: =IF(RC[-22]<>0,RC[-22]&R4C32,"q") -> q | AH330: =IF(RC[-22]<>0,RC[-22]&R4C32,"q") -> q | AI330: =IF(RC[-22]<>0,RC[-22]&R4C32,"q") -> q | AJ330: =IF(RC[-22]<>0,RC[-22]&R4C32,"q") -> q | AK330: =IF(RC[-22]<>0,RC[-22]&R4C32,"q") -> q | AL330: =IF(RC[-22]<>0,RC[-22]&R4C32,"q") -> q | AM330: =IF(RC[-22]<>0,RC[-22]&R4C32,"q") -> q | AN330: =IF(RC[-22]<>0,RC[-22]&R4C32,"q") -> q | AO330: =IF(RC[-22]<>0,RC[-22]&R4C32,"q") -> q | AP330: =IF(RC[-22]<>0,RC[-22]&R4C32,"q") -> q | AQ330: =IF(RC[-22]<>0,RC[-22]&R4C32,"q") -> q | AR330: =IF(RC[-22]<>0,RC[-22]&R4C32,"q") -> q | AS330: =IF(RC[-22]<>0,RC[-22]&R4C32,"q") -> q | AT330: =IF(RC[-22]<>0,RC[-22]&R4C32,"q") -> q | AU330: =IF(RC[-22]<>0,RC[-22]&R4C32,"q") -> q | AV330: =IF(RC[-22]<>0,RC[-22]&R4C32,"q") -> q
AC331: =IF(RC[-22]<>0,RC[-22]&R4C32,"q") -> q | AD331: =IF(RC[-22]<>0,RC[-22]&R4C32,"q") -> q | AE331: =IF(RC[-22]<>0,RC[-22]&R4C32,"q") -> q | AF331: =IF(RC[-22]<>0,RC[-22]&R4C32,"q") -> q | AG331: =IF(RC[-22]<>0,RC[-22]&R4C32,"q") -> q | AH331: =IF(RC[-22]<>0,RC[-22]&R4C32,"q") -> q | AI331: =IF(RC[-22]<>0,RC[-22]&R4C32,"q") -> q | AJ331: =IF(RC[-22]<>0,RC[-22]&R4C32,"q") -> q | AK331: =IF(RC[-22]<>0,RC[-22]&R4C32,"q") -> q | AL331: =IF(RC[-22]<>0,RC[-22]&R4C32,"q") -> q | AM331: =IF(RC[-22]<>0,RC[-22]&R4C32,"q") -> q | AN331: =IF(RC[-22]<>0,RC[-22]&R4C32,"q") -> q | AO331: =IF(RC[-22]<>0,RC[-22]&R4C32,"q") -> q | AP331: =IF(RC[-22]<>0,RC[-22]&R4C32,"q") -> q | AQ331: =IF(RC[-22]<>0,RC[-22]&R4C32,"q") -> q | AR331: =IF(RC[-22]<>0,RC[-22]&R4C32,"q") -> q | AS331: =IF(RC[-22]<>0,RC[-22]&R4C32,"q") -> q | AT331: =IF(RC[-22]<>0,RC[-22]&R4C32,"q") -> q | AU331: =IF(RC[-22]<>0,RC[-22]&R4C32,"q") -> q | AV331: =IF(RC[-22]<>0,RC[-22]&R4C32,"q") -> q
AC332: =IF(RC[-22]<>0,RC[-22]&R4C32,"q") -> q | AD332: =IF(RC[-22]<>0,RC[-22]&R4C32,"q") -> q | AE332: =IF(RC[-22]<>0,RC[-22]&R4C32,"q") -> q | AF332: =IF(RC[-22]<>0,RC[-22]&R4C32,"q") -> q | AG332: =IF(RC[-22]<>0,RC[-22]&R4C32,"q") -> q | AH332: =IF(RC[-22]<>0,RC[-22]&R4C32,"q") -> q | AI332: =IF(RC[-22]<>0,RC[-22]&R4C32,"q") -> q | AJ332: =IF(RC[-22]<>0,RC[-22]&R4C32,"q") -> q | AK332: =IF(RC[-22]<>0,RC[-22]&R4C32,"q") -> q | AL332: =IF(RC[-22]<>0,RC[-22]&R4C32,"q") -> q | AM332: =IF(RC[-22]<>0,RC[-22]&R4C32,"q") -> q | AN332: =IF(RC[-22]<>0,RC[-22]&R4C32,"q") -> q | AO332: =IF(RC[-22]<>0,RC[-22]&R4C32,"q") -> q | AP332: =IF(RC[-22]<>0,RC[-22]&R4C32,"q") -> q | AQ332: =IF(RC[-22]<>0,RC[-22]&R4C32,"q") -> q | AR332: =IF(RC[-22]<>0,RC[-22]&R4C32,"q") -> q | AS332: =IF(RC[-22]<>0,RC[-22]&R4C32,"q") -> q | AT332: =IF(RC[-22]<>0,RC[-22]&R4C32,"q") -> q | AU332: =IF(RC[-22]<>0,RC[-22]&R4C32,"q") -> q | AV332: =IF(RC[-22]<>0,RC[-22]&R4C32,"q") -> q
AC333: =IF(RC[-22]<>0,RC[-22]&R4C32,"q") -> q | AD333: =IF(RC[-22]<>0,RC[-22]&R4C32,"q") -> q | AE333: =IF(RC[-22]<>0,RC[-22]&R4C32,"q") -> q | AF333: =IF(RC[-22]<>0,RC[-22]&R4C32,"q") -> q | AG333: =IF(RC[-22]<>0,RC[-22]&R4C32,"q") -> q | AH333: =IF(RC[-22]<>0,RC[-22]&R4C32,"q") -> q | AI333: =IF(RC[-22]<>0,RC[-22]&R4C32,"q") -> q | AJ333: =IF(RC[-22]<>0,RC[-22]&R4C32,"q") -> q | AK333: =IF(RC[-22]<>0,RC[-22]&R4C32,"q") -> q | AL333: =IF(RC[-22]<>0,RC[-22]&R4C32,"q") -> q | AM333: =IF(RC[-22]<>0,RC[-22]&R4C32,"q") -> q | AN333: =IF(RC[-22]<>0,RC[-22]&R4C32,"q") -> q | AO333: =IF(RC[-22]<>0,RC[-22]&R4C32,"q") -> q | AP333: =IF(RC[-22]<>0,RC[-22]&R4C32,"q") -> q | AQ333: =IF(RC[-22]<>0,RC[-22]&R4C32,"q") -> q | AR333: =IF(RC[-22]<>0,RC[-22]&R4C32,"q") -> q | AS333: =IF(RC[-22]<>0,RC[-22]&R4C32,"q") -> q | AT333: =IF(RC[-22]<>0,RC[-22]&R4C32,"q") -> q | AU333: =IF(RC[-22]<>0,RC[-22]&R4C32,"q") -> q | AV333: =IF(RC[-22]<>0,RC[-22]&R4C32,"q") -> q
AC334: =IF(RC[-22]<>0,RC[-22]&R4C32,"q") -> q | AD334: =IF(RC[-22]<>0,RC[-22]&R4C32,"q") -> q | AE334: =IF(RC[-22]<>0,RC[-22]&R4C32,"q") -> q | AF334: =IF(RC[-22]<>0,RC[-22]&R4C32,"q") -> q | AG334: =IF(RC[-22]<>0,RC[-22]&R4C32,"q") -> q | AH334: =IF(RC[-22]<>0,RC[-22]&R4C32,"q") -> q | AI334: =IF(RC[-22]<>0,RC[-22]&R4C32,"q") -> q | AJ334: =IF(RC[-22]<>0,RC[-22]&R4C32,"q") -> q | AK334: =IF(RC[-22]<>0,RC[-22]&R4C32,"q") -> q | AL334: =IF(RC[-22]<>0,RC[-22]&R4C32,"q") -> q | AM334: =IF(RC[-22]<>0,RC[-22]&R4C32,"q") -> q | AN334: =IF(RC[-22]<>0,RC[-22]&R4C32,"q") -> q | AO334: =IF(RC[-22]<>0,RC[-22]&R4C32,"q") -> q | AP334: =IF(RC[-22]<>0,RC[-22]&R4C32,"q") -> q | AQ334: =IF(RC[-22]<>0,RC[-22]&R4C32,"q") -> q | AR334: =IF(RC[-22]<>0,RC[-22]&R4C32,"q") -> q | AS334: =IF(RC[-22]<>0,RC[-22]&R4C32,"q") -> q | AT334: =IF(RC[-22]<>0,RC[-22]&R4C32,"q") -> q | AU334: =IF(RC[-22]<>0,RC[-22]&R4C32,"q") -> q | AV334: =IF(RC[-22]<>0,RC[-22]&R4C32,"q") -> q
AC335: =IF(RC[-22]<>0,RC[-22]&R4C32,"q") -> q | AD335: =IF(RC[-22]<>0,RC[-22]&R4C32,"q") -> q | AE335: =IF(RC[-22]<>0,RC[-22]&R4C32,"q") -> q | AF335: =IF(RC[-22]<>0,RC[-22]&R4C32,"q") -> q | AG335: =IF(RC[-22]<>0,RC[-22]&R4C32,"q") -> q | AH335: =IF(RC[-22]<>0,RC[-22]&R4C32,"q") -> q | AI335: =IF(RC[-22]<>0,RC[-22]&R4C32,"q") -> q | AJ335: =IF(RC[-22]<>0,RC[-22]&R4C32,"q") -> q | AK335: =IF(RC[-22]<>0,RC[-22]&R4C32,"q") -> q | AL335: =IF(RC[-22]<>0,RC[-22]&R4C32,"q") -> q | AM335: =IF(RC[-22]<>0,RC[-22]&R4C32,"q") -> q | AN335: =IF(RC[-22]<>0,RC[-22]&R4C32,"q") -> q | AO335: =IF(RC[-22]<>0,RC[-22]&R4C32,"q") -> q | AP335: =IF(RC[-22]<>0,RC[-22]&R4C32,"q") -> q | AQ335: =IF(RC[-22]<>0,RC[-22]&R4C32,"q") -> q | AR335: =IF(RC[-22]<>0,RC[-22]&R4C32,"q") -> q | AS335: =IF(RC[-22]<>0,RC[-22]&R4C32,"q") -> q | AT335: =IF(RC[-22]<>0,RC[-22]&R4C32,"q") -> q | AU335: =IF(RC[-22]<>0,RC[-22]&R4C32,"q") -> q | AV335: =IF(RC[-22]<>0,RC[-22]&R4C32,"q") -> q
AC336: =IF(RC[-22]<>0,RC[-22]&R4C32,"q") -> q | AD336: =IF(RC[-22]<>0,RC[-22]&R4C32,"q") -> q | AE336: =IF(RC[-22]<>0,RC[-22]&R4C32,"q") -> q | AF336: =IF(RC[-22]<>0,RC[-22]&R4C32,"q") -> q | AG336: =IF(RC[-22]<>0,RC[-22]&R4C32,"q") -> q | AH336: =IF(RC[-22]<>0,RC[-22]&R4C32,"q") -> q | AI336: =IF(RC[-22]<>0,RC[-22]&R4C32,"q") -> q | AJ336: =IF(RC[-22]<>0,RC[-22]&R4C32,"q") -> q | AK336: =IF(RC[-22]<>0,RC[-22]&R4C32,"q") -> q | AL336: =IF(RC[-22]<>0,RC[-22]&R4C32,"q") -> q | AM336: =IF(RC[-22]<>0,RC[-22]&R4C32,"q") -> q | AN336: =IF(RC[-22]<>0,RC[-22]&R4C32,"q") -> q | AO336: =IF(RC[-22]<>0,RC[-22]&R4C32,"q") -> q | AP336: =IF(RC[-22]<>0,RC[-22]&R4C32,"q") -> q | AQ336: =IF(RC[-22]<>0,RC[-22]&R4C32,"q") -> q | AR336: =IF(RC[-22]<>0,RC[-22]&R4C32,"q") -> q | AS336: =IF(RC[-22]<>0,RC[-22]&R4C32,"q") -> q | AT336: =IF(RC[-22]<>0,RC[-22]&R4C32,"q") -> q | AU336: =IF(RC[-22]<>0,RC[-22]&R4C32,"q") -> q | AV336: =IF(RC[-22]<>0,RC[-22]&R4C32,"q") -> q
AC337: =IF(RC[-22]<>0,RC[-22]&R4C32,"q") -> q | AD337: =IF(RC[-22]<>0,RC[-22]&R4C32,"q") -> q | AE337: =IF(RC[-22]<>0,RC[-22]&R4C32,"q") -> q | AF337: =IF(RC[-22]<>0,RC[-22]&R4C32,"q") -> q | AG337: =IF(RC[-22]<>0,RC[-22]&R4C32,"q") -> q | AH337: =IF(RC[-22]<>0,RC[-22]&R4C32,"q") -> q | AI337: =IF(RC[-22]<>0,RC[-22]&R4C32,"q") -> q | AJ337: =IF(RC[-22]<>0,RC[-22]&R4C32,"q") -> q | AK337: =IF(RC[-22]<>0,RC[-22]&R4C32,"q") -> q | AL337: =IF(RC[-22]<>0,RC[-22]&R4C32,"q") -> q | AM337: =IF(RC[-22]<>0,RC[-22]&R4C32,"q") -> q | AN337: =IF(RC[-22]<>0,RC[-22]&R4C32,"q") -> q | AO337: =IF(RC[-22]<>0,RC[-22]&R4C32,"q") -> q | AP337: =IF(RC[-22]<>0,RC[-22]&R4C32,"q") -> q | AQ337: =IF(RC[-22]<>0,RC[-22]&R4C32,"q") -> q | AR337: =IF(RC[-22]<>0,RC[-22]&R4C32,"q") -> q | AS337: =IF(RC[-22]<>0,RC[-22]&R4C32,"q") -> q | AT337: =IF(RC[-22]<>0,RC[-22]&R4C32,"q") -> q | AU337: =IF(RC[-22]<>0,RC[-22]&R4C32,"q") -> q | AV337: =IF(RC[-22]<>0,RC[-22]&R4C32,"q") -> q
AC338: =IF(RC[-22]<>0,RC[-22]&R4C32,"q") -> q | AD338: =IF(RC[-22]<>0,RC[-22]&R4C32,"q") -> q | AE338: =IF(RC[-22]<>0,RC[-22]&R4C32,"q") -> q | AF338: =IF(RC[-22]<>0,RC[-22]&R4C32,"q") -> q | AG338: =IF(RC[-22]<>0,RC[-22]&R4C32,"q") -> q | AH338: =IF(RC[-22]<>0,RC[-22]&R4C32,"q") -> q | AI338: =IF(RC[-22]<>0,RC[-22]&R4C32,"q") -> q | AJ338: =IF(RC[-22]<>0,RC[-22]&R4C32,"q") -> q | AK338: =IF(RC[-22]<>0,RC[-22]&R4C32,"q") -> q | AL338: =IF(RC[-22]<>0,RC[-22]&R4C32,"q") -> q | AM338: =IF(RC[-22]<>0,RC[-22]&R4C32,"q") -> q | AN338: =IF(RC[-22]<>0,RC[-22]&R4C32,"q") -> q | AO338: =IF(RC[-22]<>0,RC[-22]&R4C32,"q") -> q | AP338: =IF(RC[-22]<>0,RC[-22]&R4C32,"q") -> q | AQ338: =IF(RC[-22]<>0,RC[-22]&R4C32,"q") -> q | AR338: =IF(RC[-22]<>0,RC[-22]&R4C32,"q") -> q | AS338: =IF(RC[-22]<>0,RC[-22]&R4C32,"q") -> q | AT338: =IF(RC[-22]<>0,RC[-22]&R4C32,"q") -> q | AU338: =IF(RC[-22]<>0,RC[-22]&R4C32,"q") -> q | AV338: =IF(RC[-22]<>0,RC[-22]&R4C32,"q") -> q
AC339: =IF(RC[-22]<>0,RC[-22]&R4C32,"q") -> q | AD339: =IF(RC[-22]<>0,RC[-22]&R4C32,"q") -> q | AE339: =IF(RC[-22]<>0,RC[-22]&R4C32,"q") -> q | AF339: =IF(RC[-22]<>0,RC[-22]&R4C32,"q") -> q | AG339: =IF(RC[-22]<>0,RC[-22]&R4C32,"q") -> q | AH339: =IF(RC[-22]<>0,RC[-22]&R4C32,"q") -> q | AI339: =IF(RC[-22]<>0,RC[-22]&R4C32,"q") -> q | AJ339: =IF(RC[-22]<>0,RC[-22]&R4C32,"q") -> q | AK339: =IF(RC[-22]<>0,RC[-22]&R4C32,"q") -> q | AL339: =IF(RC[-22]<>0,RC[-22]&R4C32,"q") -> q | AM339: =IF(RC[-22]<>0,RC[-22]&R4C32,"q") -> q | AN339: =IF(RC[-22]<>0,RC[-22]&R4C32,"q") -> q | AO339: =IF(RC[-22]<>0,RC[-22]&R4C32,"q") -> q | AP339: =IF(RC[-22]<>0,RC[-22]&R4C32,"q") -> q | AQ339: =IF(RC[-22]<>0,RC[-22]&R4C32,"q") -> q | AR339: =IF(RC[-22]<>0,RC[-22]&R4C32,"q") -> q | AS339: =IF(RC[-22]<>0,RC[-22]&R4C32,"q") -> q | AT339: =IF(RC[-22]<>0,RC[-22]&R4C32,"q") -> q | AU339: =IF(RC[-22]<>0,RC[-22]&R4C32,"q") -> q | AV339: =IF(RC[-22]<>0,RC[-22]&R4C32,"q") -> q
AC340: =IF(RC[-22]<>0,RC[-22]&R4C32,"q") -> q | AD340: =IF(RC[-22]<>0,RC[-22]&R4C32,"q") -> q | AE340: =IF(RC[-22]<>0,RC[-22]&R4C32,"q") -> q | AF340: =IF(RC[-22]<>0,RC[-22]&R4C32,"q") -> q | AG340: =IF(RC[-22]<>0,RC[-22]&R4C32,"q") -> q | AH340: =IF(RC[-22]<>0,RC[-22]&R4C32,"q") -> q | AI340: =IF(RC[-22]<>0,RC[-22]&R4C32,"q") -> q | AJ340: =IF(RC[-22]<>0,RC[-22]&R4C32,"q") -> q | AK340: =IF(RC[-22]<>0,RC[-22]&R4C32,"q") -> q | AL340: =IF(RC[-22]<>0,RC[-22]&R4C32,"q") -> q | AM340: =IF(RC[-22]<>0,RC[-22]&R4C32,"q") -> q | AN340: =IF(RC[-22]<>0,RC[-22]&R4C32,"q") -> q | AO340: =IF(RC[-22]<>0,RC[-22]&R4C32,"q") -> q | AP340: =IF(RC[-22]<>0,RC[-22]&R4C32,"q") -> q | AQ340: =IF(RC[-22]<>0,RC[-22]&R4C32,"q") -> q | AR340: =IF(RC[-22]<>0,RC[-22]&R4C32,"q") -> q | AS340: =IF(RC[-22]<>0,RC[-22]&R4C32,"q") -> q | AT340: =IF(RC[-22]<>0,RC[-22]&R4C32,"q") -> q | AU340: =IF(RC[-22]<>0,RC[-22]&R4C32,"q") -> q | AV340: =IF(RC[-22]<>0,RC[-22]&R4C32,"q") -> q
AC341: =IF(RC[-22]<>0,RC[-22]&R4C32,"q") -> q | AD341: =IF(RC[-22]<>0,RC[-22]&R4C32,"q") -> q | AE341: =IF(RC[-22]<>0,RC[-22]&R4C32,"q") -> q | AF341: =IF(RC[-22]<>0,RC[-22]&R4C32,"q") -> q | AG341: =IF(RC[-22]<>0,RC[-22]&R4C32,"q") -> q | AH341: =IF(RC[-22]<>0,RC[-22]&R4C32,"q") -> q | AI341: =IF(RC[-22]<>0,RC[-22]&R4C32,"q") -> q | AJ341: =IF(RC[-22]<>0,RC[-22]&R4C32,"q") -> q | AK341: =IF(RC[-22]<>0,RC[-22]&R4C32,"q") -> q | AL341: =IF(RC[-22]<>0,RC[-22]&R4C32,"q") -> q | AM341: =IF(RC[-22]<>0,RC[-22]&R4C32,"q") -> q | AN341: =IF(RC[-22]<>0,RC[-22]&R4C32,"q") -> q | AO341: =IF(RC[-22]<>0,RC[-22]&R4C32,"q") -> q | AP341: =IF(RC[-22]<>0,RC[-22]&R4C32,"q") -> q | AQ341: =IF(RC[-22]<>0,RC[-22]&R4C32,"q") -> q | AR341: =IF(RC[-22]<>0,RC[-22]&R4C32,"q") -> q | AS341: =IF(RC[-22]<>0,RC[-22]&R4C32,"q") -> q | AT341: =IF(RC[-22]<>0,RC[-22]&R4C32,"q") -> q | AU341: =IF(RC[-22]<>0,RC[-22]&R4C32,"q") -> q | AV341: =IF(RC[-22]<>0,RC[-22]&R4C32,"q") -> q
AC342: =IF(RC[-22]<>0,RC[-22]&R4C32,"q") -> q | AD342: =IF(RC[-22]<>0,RC[-22]&R4C32,"q") -> q | AE342: =IF(RC[-22]<>0,RC[-22]&R4C32,"q") -> q | AF342: =IF(RC[-22]<>0,RC[-22]&R4C32,"q") -> q | AG342: =IF(RC[-22]<>0,RC[-22]&R4C32,"q") -> q | AH342: =IF(RC[-22]<>0,RC[-22]&R4C32,"q") -> q | AI342: =IF(RC[-22]<>0,RC[-22]&R4C32,"q") -> q | AJ342: =IF(RC[-22]<>0,RC[-22]&R4C32,"q") -> q | AK342: =IF(RC[-22]<>0,RC[-22]&R4C32,"q") -> q | AL342: =IF(RC[-22]<>0,RC[-22]&R4C32,"q") -> q | AM342: =IF(RC[-22]<>0,RC[-22]&R4C32,"q") -> q | AN342: =IF(RC[-22]<>0,RC[-22]&R4C32,"q") -> q | AO342: =IF(RC[-22]<>0,RC[-22]&R4C32,"q") -> q | AP342: =IF(RC[-22]<>0,RC[-22]&R4C32,"q") -> q | AQ342: =IF(RC[-22]<>0,RC[-22]&R4C32,"q") -> q | AR342: =IF(RC[-22]<>0,RC[-22]&R4C32,"q") -> q | AS342: =IF(RC[-22]<>0,RC[-22]&R4C32,"q") -> q | AT342: =IF(RC[-22]<>0,RC[-22]&R4C32,"q") -> q | AU342: =IF(RC[-22]<>0,RC[-22]&R4C32,"q") -> q | AV342: =IF(RC[-22]<>0,RC[-22]&R4C32,"q") -> q
AC343: =IF(RC[-22]<>0,RC[-22]&R4C32,"q") -> q | AD343: =IF(RC[-22]<>0,RC[-22]&R4C32,"q") -> q | AE343: =IF(RC[-22]<>0,RC[-22]&R4C32,"q") -> q | AF343: =IF(RC[-22]<>0,RC[-22]&R4C32,"q") -> q | AG343: =IF(RC[-22]<>0,RC[-22]&R4C32,"q") -> q | AH343: =IF(RC[-22]<>0,RC[-22]&R4C32,"q") -> q | AI343: =IF(RC[-22]<>0,RC[-22]&R4C32,"q") -> q | AJ343: =IF(RC[-22]<>0,RC[-22]&R4C32,"q") -> q | AK343: =IF(RC[-22]<>0,RC[-22]&R4C32,"q") -> q | AL343: =IF(RC[-22]<>0,RC[-22]&R4C32,"q") -> q | AM343: =IF(RC[-22]<>0,RC[-22]&R4C32,"q") -> q | AN343: =IF(RC[-22]<>0,RC[-22]&R4C32,"q") -> q | AO343: =IF(RC[-22]<>0,RC[-22]&R4C32,"q") -> q | AP343: =IF(RC[-22]<>0,RC[-22]&R4C32,"q") -> q | AQ343: =IF(RC[-22]<>0,RC[-22]&R4C32,"q") -> q | AR343: =IF(RC[-22]<>0,RC[-22]&R4C32,"q") -> q | AS343: =IF(RC[-22]<>0,RC[-22]&R4C32,"q") -> q | AT343: =IF(RC[-22]<>0,RC[-22]&R4C32,"q") -> q | AU343: =IF(RC[-22]<>0,RC[-22]&R4C32,"q") -> q | AV343: =IF(RC[-22]<>0,RC[-22]&R4C32,"q") -> q
AC344: =IF(RC[-22]<>0,RC[-22]&R4C32,"q") -> q | AD344: =IF(RC[-22]<>0,RC[-22]&R4C32,"q") -> q | AE344: =IF(RC[-22]<>0,RC[-22]&R4C32,"q") -> q | AF344: =IF(RC[-22]<>0,RC[-22]&R4C32,"q") -> q | AG344: =IF(RC[-22]<>0,RC[-22]&R4C32,"q") -> q | AH344: =IF(RC[-22]<>0,RC[-22]&R4C32,"q") -> q | AI344: =IF(RC[-22]<>0,RC[-22]&R4C32,"q") -> q | AJ344: =IF(RC[-22]<>0,RC[-22]&R4C32,"q") -> q | AK344: =IF(RC[-22]<>0,RC[-22]&R4C32,"q") -> q | AL344: =IF(RC[-22]<>0,RC[-22]&R4C32,"q") -> q | AM344: =IF(RC[-22]<>0,RC[-22]&R4C32,"q") -> q | AN344: =IF(RC[-22]<>0,RC[-22]&R4C32,"q") -> q | AO344: =IF(RC[-22]<>0,RC[-22]&R4C32,"q") -> q | AP344: =IF(RC[-22]<>0,RC[-22]&R4C32,"q") -> q | AQ344: =IF(RC[-22]<>0,RC[-22]&R4C32,"q") -> q | AR344: =IF(RC[-22]<>0,RC[-22]&R4C32,"q") -> q | AS344: =IF(RC[-22]<>0,RC[-22]&R4C32,"q") -> q | AT344: =IF(RC[-22]<>0,RC[-22]&R4C32,"q") -> q | AU344: =IF(RC[-22]<>0,RC[-22]&R4C32,"q") -> q | AV344: =IF(RC[-22]<>0,RC[-22]&R4C32,"q") -> q
AC345: =IF(RC[-22]<>0,RC[-22]&R4C32,"q") -> q | AD345: =IF(RC[-22]<>0,RC[-22]&R4C32,"q") -> q | AE345: =IF(RC[-22]<>0,RC[-22]&R4C32,"q") -> q | AF345: =IF(RC[-22]<>0,RC[-22]&R4C32,"q") -> q | AG345: =IF(RC[-22]<>0,RC[-22]&R4C32,"q") -> q | AH345: =IF(RC[-22]<>0,RC[-22]&R4C32,"q") -> q | AI345: =IF(RC[-22]<>0,RC[-22]&R4C32,"q") -> q | AJ345: =IF(RC[-22]<>0,RC[-22]&R4C32,"q") -> q | AK345: =IF(RC[-22]<>0,RC[-22]&R4C32,"q") -> q | AL345: =IF(RC[-22]<>0,RC[-22]&R4C32,"q") -> q | AM345: =IF(RC[-22]<>0,RC[-22]&R4C32,"q") -> q | AN345: =IF(RC[-22]<>0,RC[-22]&R4C32,"q") -> q | AO345: =IF(RC[-22]<>0,RC[-22]&R4C32,"q") -> q | AP345: =IF(RC[-22]<>0,RC[-22]&R4C32,"q") -> q | AQ345: =IF(RC[-22]<>0,RC[-22]&R4C32,"q") -> q | AR345: =IF(RC[-22]<>0,RC[-22]&R4C32,"q") -> q | AS345: =IF(RC[-22]<>0,RC[-22]&R4C32,"q") -> q | AT345: =IF(RC[-22]<>0,RC[-22]&R4C32,"q") -> q | AU345: =IF(RC[-22]<>0,RC[-22]&R4C32,"q") -> q | AV345: =IF(RC[-22]<>0,RC[-22]&R4C32,"q") -> q
AC346: =IF(RC[-22]<>0,RC[-22]&R4C32,"q") -> q | AD346: =IF(RC[-22]<>0,RC[-22]&R4C32,"q") -> q | AE346: =IF(RC[-22]<>0,RC[-22]&R4C32,"q") -> q | AF346: =IF(RC[-22]<>0,RC[-22]&R4C32,"q") -> q | AG346: =IF(RC[-22]<>0,RC[-22]&R4C32,"q") -> q | AH346: =IF(RC[-22]<>0,RC[-22]&R4C32,"q") -> q | AI346: =IF(RC[-22]<>0,RC[-22]&R4C32,"q") -> q | AJ346: =IF(RC[-22]<>0,RC[-22]&R4C32,"q") -> q | AK346: =IF(RC[-22]<>0,RC[-22]&R4C32,"q") -> q | AL346: =IF(RC[-22]<>0,RC[-22]&R4C32,"q") -> q | AM346: =IF(RC[-22]<>0,RC[-22]&R4C32,"q") -> q | AN346: =IF(RC[-22]<>0,RC[-22]&R4C32,"q") -> q | AO346: =IF(RC[-22]<>0,RC[-22]&R4C32,"q") -> q | AP346: =IF(RC[-22]<>0,RC[-22]&R4C32,"q") -> q | AQ346: =IF(RC[-22]<>0,RC[-22]&R4C32,"q") -> q | AR346: =IF(RC[-22]<>0,RC[-22]&R4C32,"q") -> q | AS346: =IF(RC[-22]<>0,RC[-22]&R4C32,"q") -> q | AT346: =IF(RC[-22]<>0,RC[-22]&R4C32,"q") -> q | AU346: =IF(RC[-22]<>0,RC[-22]&R4C32,"q") -> q | AV346: =IF(RC[-22]<>0,RC[-22]&R4C32,"q") -> q
AC347: =IF(RC[-22]<>0,RC[-22]&R4C32,"q") -> q | AD347: =IF(RC[-22]<>0,RC[-22]&R4C32,"q") -> q | AE347: =IF(RC[-22]<>0,RC[-22]&R4C32,"q") -> q | AF347: =IF(RC[-22]<>0,RC[-22]&R4C32,"q") -> q | AG347: =IF(RC[-22]<>0,RC[-22]&R4C32,"q") -> q | AH347: =IF(RC[-22]<>0,RC[-22]&R4C32,"q") -> q | AI347: =IF(RC[-22]<>0,RC[-22]&R4C32,"q") -> q | AJ347: =IF(RC[-22]<>0,RC[-22]&R4C32,"q") -> q | AK347: =IF(RC[-22]<>0,RC[-22]&R4C32,"q") -> q | AL347: =IF(RC[-22]<>0,RC[-22]&R4C32,"q") -> q | AM347: =IF(RC[-22]<>0,RC[-22]&R4C32,"q") -> q | AN347: =IF(RC[-22]<>0,RC[-22]&R4C32,"q") -> q | AO347: =IF(RC[-22]<>0,RC[-22]&R4C32,"q") -> q | AP347: =IF(RC[-22]<>0,RC[-22]&R4C32,"q") -> q | AQ347: =IF(RC[-22]<>0,RC[-22]&R4C32,"q") -> q | AR347: =IF(RC[-22]<>0,RC[-22]&R4C32,"q") -> q | AS347: =IF(RC[-22]<>0,RC[-22]&R4C32,"q") -> q | AT347: =IF(RC[-22]<>0,RC[-22]&R4C32,"q") -> q | AU347: =IF(RC[-22]<>0,RC[-22]&R4C32,"q") -> q | AV347: =IF(RC[-22]<>0,RC[-22]&R4C32,"q") -> q
AC348: =IF(RC[-22]<>0,RC[-22]&R4C32,"q") -> q | AD348: =IF(RC[-22]<>0,RC[-22]&R4C32,"q") -> q | AE348: =IF(RC[-22]<>0,RC[-22]&R4C32,"q") -> q | AF348: =IF(RC[-22]<>0,RC[-22]&R4C32,"q") -> q | AG348: =IF(RC[-22]<>0,RC[-22]&R4C32,"q") -> q | AH348: =IF(RC[-22]<>0,RC[-22]&R4C32,"q") -> q | AI348: =IF(RC[-22]<>0,RC[-22]&R4C32,"q") -> q | AJ348: =IF(RC[-22]<>0,RC[-22]&R4C32,"q") -> q | AK348: =IF(RC[-22]<>0,RC[-22]&R4C32,"q") -> q | AL348: =IF(RC[-22]<>0,RC[-22]&R4C32,"q") -> q | AM348: =IF(RC[-22]<>0,RC[-22]&R4C32,"q") -> q | AN348: =IF(RC[-22]<>0,RC[-22]&R4C32,"q") -> q | AO348: =IF(RC[-22]<>0,RC[-22]&R4C32,"q") -> q | AP348: =IF(RC[-22]<>0,RC[-22]&R4C32,"q") -> q | AQ348: =IF(RC[-22]<>0,RC[-22]&R4C32,"q") -> q | AR348: =IF(RC[-22]<>0,RC[-22]&R4C32,"q") -> q | AS348: =IF(RC[-22]<>0,RC[-22]&R4C32,"q") -> q | AT348: =IF(RC[-22]<>0,RC[-22]&R4C32,"q") -> q | AU348: =IF(RC[-22]<>0,RC[-22]&R4C32,"q") -> q | AV348: =IF(RC[-22]<>0,RC[-22]&R4C32,"q") -> q
AC349: =IF(RC[-22]<>0,RC[-22]&R4C32,"q") -> q | AD349: =IF(RC[-22]<>0,RC[-22]&R4C32,"q") -> q | AE349: =IF(RC[-22]<>0,RC[-22]&R4C32,"q") -> q | AF349: =IF(RC[-22]<>0,RC[-22]&R4C32,"q") -> q | AG349: =IF(RC[-22]<>0,RC[-22]&R4C32,"q") -> q | AH349: =IF(RC[-22]<>0,RC[-22]&R4C32,"q") -> q | AI349: =IF(RC[-22]<>0,RC[-22]&R4C32,"q") -> q | AJ349: =IF(RC[-22]<>0,RC[-22]&R4C32,"q") -> q | AK349: =IF(RC[-22]<>0,RC[-22]&R4C32,"q") -> q | AL349: =IF(RC[-22]<>0,RC[-22]&R4C32,"q") -> q | AM349: =IF(RC[-22]<>0,RC[-22]&R4C32,"q") -> q | AN349: =IF(RC[-22]<>0,RC[-22]&R4C32,"q") -> q | AO349: =IF(RC[-22]<>0,RC[-22]&R4C32,"q") -> q | AP349: =IF(RC[-22]<>0,RC[-22]&R4C32,"q") -> q | AQ349: =IF(RC[-22]<>0,RC[-22]&R4C32,"q") -> q | AR349: =IF(RC[-22]<>0,RC[-22]&R4C32,"q") -> q | AS349: =IF(RC[-22]<>0,RC[-22]&R4C32,"q") -> q | AT349: =IF(RC[-22]<>0,RC[-22]&R4C32,"q") -> q | AU349: =IF(RC[-22]<>0,RC[-22]&R4C32,"q") -> q | AV349: =IF(RC[-22]<>0,RC[-22]&R4C32,"q") -> q
AC350: =IF(RC[-22]<>0,RC[-22]&R4C32,"q") -> q | AD350: =IF(RC[-22]<>0,RC[-22]&R4C32,"q") -> q | AE350: =IF(RC[-22]<>0,RC[-22]&R4C32,"q") -> q | AF350: =IF(RC[-22]<>0,RC[-22]&R4C32,"q") -> q | AG350: =IF(RC[-22]<>0,RC[-22]&R4C32,"q") -> q | AH350: =IF(RC[-22]<>0,RC[-22]&R4C32,"q") -> q | AI350: =IF(RC[-22]<>0,RC[-22]&R4C32,"q") -> q | AJ350: =IF(RC[-22]<>0,RC[-22]&R4C32,"q") -> q | AK350: =IF(RC[-22]<>0,RC[-22]&R4C32,"q") -> q | AL350: =IF(RC[-22]<>0,RC[-22]&R4C32,"q") -> q | AM350: =IF(RC[-22]<>0,RC[-22]&R4C32,"q") -> q | AN350: =IF(RC[-22]<>0,RC[-22]&R4C32,"q") -> q | AO350: =IF(RC[-22]<>0,RC[-22]&R4C32,"q") -> q | AP350: =IF(RC[-22]<>0,RC[-22]&R4C32,"q") -> q | AQ350: =IF(RC[-22]<>0,RC[-22]&R4C32,"q") -> q | AR350: =IF(RC[-22]<>0,RC[-22]&R4C32,"q") -> q | AS350: =IF(RC[-22]<>0,RC[-22]&R4C32,"q") -> q | AT350: =IF(RC[-22]<>0,RC[-22]&R4C32,"q") -> q | AU350: =IF(RC[-22]<>0,RC[-22]&R4C32,"q") -> q | AV350: =IF(RC[-22]<>0,RC[-22]&R4C32,"q") -> q
AC351: =IF(RC[-22]<>0,RC[-22]&R4C32,"q") -> q | AD351: =IF(RC[-22]<>0,RC[-22]&R4C32,"q") -> q | AE351: =IF(RC[-22]<>0,RC[-22]&R4C32,"q") -> q | AF351: =IF(RC[-22]<>0,RC[-22]&R4C32,"q") -> q | AG351: =IF(RC[-22]<>0,RC[-22]&R4C32,"q") -> q | AH351: =IF(RC[-22]<>0,RC[-22]&R4C32,"q") -> q | AI351: =IF(RC[-22]<>0,RC[-22]&R4C32,"q") -> q | AJ351: =IF(RC[-22]<>0,RC[-22]&R4C32,"q") -> q | AK351: =IF(RC[-22]<>0,RC[-22]&R4C32,"q") -> q | AL351: =IF(RC[-22]<>0,RC[-22]&R4C32,"q") -> q | AM351: =IF(RC[-22]<>0,RC[-22]&R4C32,"q") -> q | AN351: =IF(RC[-22]<>0,RC[-22]&R4C32,"q") -> q | AO351: =IF(RC[-22]<>0,RC[-22]&R4C32,"q") -> q | AP351: =IF(RC[-22]<>0,RC[-22]&R4C32,"q") -> q | AQ351: =IF(RC[-22]<>0,RC[-22]&R4C32,"q") -> q | AR351: =IF(RC[-22]<>0,RC[-22]&R4C32,"q") -> q | AS351: =IF(RC[-22]<>0,RC[-22]&R4C32,"q") -> q | AT351: =IF(RC[-22]<>0,RC[-22]&R4C32,"q") -> q | AU351: =IF(RC[-22]<>0,RC[-22]&R4C32,"q") -> q | AV351: =IF(RC[-22]<>0,RC[-22]&R4C32,"q") -> q
AC352: =IF(RC[-22]<>0,RC[-22]&R4C32,"q") -> q | AD352: =IF(RC[-22]<>0,RC[-22]&R4C32,"q") -> q | AE352: =IF(RC[-22]<>0,RC[-22]&R4C32,"q") -> q | AF352: =IF(RC[-22]<>0,RC[-22]&R4C32,"q") -> q | AG352: =IF(RC[-22]<>0,RC[-22]&R4C32,"q") -> q | AH352: =IF(RC[-22]<>0,RC[-22]&R4C32,"q") -> q | AI352: =IF(RC[-22]<>0,RC[-22]&R4C32,"q") -> q | AJ352: =IF(RC[-22]<>0,RC[-22]&R4C32,"q") -> q | AK352: =IF(RC[-22]<>0,RC[-22]&R4C32,"q") -> q | AL352: =IF(RC[-22]<>0,RC[-22]&R4C32,"q") -> q | AM352: =IF(RC[-22]<>0,RC[-22]&R4C32,"q") -> q | AN352: =IF(RC[-22]<>0,RC[-22]&R4C32,"q") -> q | AO352: =IF(RC[-22]<>0,RC[-22]&R4C32,"q") -> q | AP352: =IF(RC[-22]<>0,RC[-22]&R4C32,"q") -> q | AQ352: =IF(RC[-22]<>0,RC[-22]&R4C32,"q") -> q | AR352: =IF(RC[-22]<>0,RC[-22]&R4C32,"q") -> q | AS352: =IF(RC[-22]<>0,RC[-22]&R4C32,"q") -> q | AT352: =IF(RC[-22]<>0,RC[-22]&R4C32,"q") -> q | AU352: =IF(RC[-22]<>0,RC[-22]&R4C32,"q") -> q | AV352: =IF(RC[-22]<>0,RC[-22]&R4C32,"q") -> q
AC353: =IF(RC[-22]<>0,RC[-22]&R4C32,"q") -> q | AD353: =IF(RC[-22]<>0,RC[-22]&R4C32,"q") -> q | AE353: =IF(RC[-22]<>0,RC[-22]&R4C32,"q") -> q | AF353: =IF(RC[-22]<>0,RC[-22]&R4C32,"q") -> q | AG353: =IF(RC[-22]<>0,RC[-22]&R4C32,"q") -> q | AH353: =IF(RC[-22]<>0,RC[-22]&R4C32,"q") -> q | AI353: =IF(RC[-22]<>0,RC[-22]&R4C32,"q") -> q | AJ353: =IF(RC[-22]<>0,RC[-22]&R4C32,"q") -> q | AK353: =IF(RC[-22]<>0,RC[-22]&R4C32,"q") -> q | AL353: =IF(RC[-22]<>0,RC[-22]&R4C32,"q") -> q | AM353: =IF(RC[-22]<>0,RC[-22]&R4C32,"q") -> q | AN353: =IF(RC[-22]<>0,RC[-22]&R4C32,"q") -> q | AO353: =IF(RC[-22]<>0,RC[-22]&R4C32,"q") -> q | AP353: =IF(RC[-22]<>0,RC[-22]&R4C32,"q") -> q | AQ353: =IF(RC[-22]<>0,RC[-22]&R4C32,"q") -> q | AR353: =IF(RC[-22]<>0,RC[-22]&R4C32,"q") -> q | AS353: =IF(RC[-22]<>0,RC[-22]&R4C32,"q") -> q | AT353: =IF(RC[-22]<>0,RC[-22]&R4C32,"q") -> q | AU353: =IF(RC[-22]<>0,RC[-22]&R4C32,"q") -> q | AV353: =IF(RC[-22]<>0,RC[-22]&R4C32,"q") -> q
AC354: =IF(RC[-22]<>0,RC[-22]&R4C32,"q") -> q | AD354: =IF(RC[-22]<>0,RC[-22]&R4C32,"q") -> q | AE354: =IF(RC[-22]<>0,RC[-22]&R4C32,"q") -> q | AF354: =IF(RC[-22]<>0,RC[-22]&R4C32,"q") -> q | AG354: =IF(RC[-22]<>0,RC[-22]&R4C32,"q") -> q | AH354: =IF(RC[-22]<>0,RC[-22]&R4C32,"q") -> q | AI354: =IF(RC[-22]<>0,RC[-22]&R4C32,"q") -> q | AJ354: =IF(RC[-22]<>0,RC[-22]&R4C32,"q") -> q | AK354: =IF(RC[-22]<>0,RC[-22]&R4C32,"q") -> q | AL354: =IF(RC[-22]<>0,RC[-22]&R4C32,"q") -> q | AM354: =IF(RC[-22]<>0,RC[-22]&R4C32,"q") -> q | AN354: =IF(RC[-22]<>0,RC[-22]&R4C32,"q") -> q | AO354: =IF(RC[-22]<>0,RC[-22]&R4C32,"q") -> q | AP354: =IF(RC[-22]<>0,RC[-22]&R4C32,"q") -> q | AQ354: =IF(RC[-22]<>0,RC[-22]&R4C32,"q") -> q | AR354: =IF(RC[-22]<>0,RC[-22]&R4C32,"q") -> q | AS354: =IF(RC[-22]<>0,RC[-22]&R4C32,"q") -> q | AT354: =IF(RC[-22]<>0,RC[-22]&R4C32,"q") -> q | AU354: =IF(RC[-22]<>0,RC[-22]&R4C32,"q") -> q | AV354: =IF(RC[-22]<>0,RC[-22]&R4C32,"q") -> q
AC355: =IF(RC[-22]<>0,RC[-22]&R4C32,"q") -> q | AD355: =IF(RC[-22]<>0,RC[-22]&R4C32,"q") -> q | AE355: =IF(RC[-22]<>0,RC[-22]&R4C32,"q") -> q | AF355: =IF(RC[-22]<>0,RC[-22]&R4C32,"q") -> q | AG355: =IF(RC[-22]<>0,RC[-22]&R4C32,"q") -> q | AH355: =IF(RC[-22]<>0,RC[-22]&R4C32,"q") -> q | AI355: =IF(RC[-22]<>0,RC[-22]&R4C32,"q") -> q | AJ355: =IF(RC[-22]<>0,RC[-22]&R4C32,"q") -> q | AK355: =IF(RC[-22]<>0,RC[-22]&R4C32,"q") -> q | AL355: =IF(RC[-22]<>0,RC[-22]&R4C32,"q") -> q | AM355: =IF(RC[-22]<>0,RC[-22]&R4C32,"q") -> q | AN355: =IF(RC[-22]<>0,RC[-22]&R4C32,"q") -> q | AO355: =IF(RC[-22]<>0,RC[-22]&R4C32,"q") -> q | AP355: =IF(RC[-22]<>0,RC[-22]&R4C32,"q") -> q | AQ355: =IF(RC[-22]<>0,RC[-22]&R4C32,"q") -> q | AR355: =IF(RC[-22]<>0,RC[-22]&R4C32,"q") -> q | AS355: =IF(RC[-22]<>0,RC[-22]&R4C32,"q") -> q | AT355: =IF(RC[-22]<>0,RC[-22]&R4C32,"q") -> q | AU355: =IF(RC[-22]<>0,RC[-22]&R4C32,"q") -> q | AV355: =IF(RC[-22]<>0,RC[-22]&R4C32,"q") -> q
AC356: =IF(RC[-22]<>0,RC[-22]&R4C32,"q") -> q | AD356: =IF(RC[-22]<>0,RC[-22]&R4C32,"q") -> q | AE356: =IF(RC[-22]<>0,RC[-22]&R4C32,"q") -> q | AF356: =IF(RC[-22]<>0,RC[-22]&R4C32,"q") -> q | AG356: =IF(RC[-22]<>0,RC[-22]&R4C32,"q") -> q | AH356: =IF(RC[-22]<>0,RC[-22]&R4C32,"q") -> q | AI356: =IF(RC[-22]<>0,RC[-22]&R4C32,"q") -> q | AJ356: =IF(RC[-22]<>0,RC[-22]&R4C32,"q") -> q | AK356: =IF(RC[-22]<>0,RC[-22]&R4C32,"q") -> q | AL356: =IF(RC[-22]<>0,RC[-22]&R4C32,"q") -> q | AM356: =IF(RC[-22]<>0,RC[-22]&R4C32,"q") -> q | AN356: =IF(RC[-22]<>0,RC[-22]&R4C32,"q") -> q | AO356: =IF(RC[-22]<>0,RC[-22]&R4C32,"q") -> q | AP356: =IF(RC[-22]<>0,RC[-22]&R4C32,"q") -> q | AQ356: =IF(RC[-22]<>0,RC[-22]&R4C32,"q") -> q | AR356: =IF(RC[-22]<>0,RC[-22]&R4C32,"q") -> q | AS356: =IF(RC[-22]<>0,RC[-22]&R4C32,"q") -> q | AT356: =IF(RC[-22]<>0,RC[-22]&R4C32,"q") -> q | AU356: =IF(RC[-22]<>0,RC[-22]&R4C32,"q") -> q | AV356: =IF(RC[-22]<>0,RC[-22]&R4C32,"q") -> q
AC357: =IF(RC[-22]<>0,RC[-22]&R4C32,"q") -> q | AD357: =IF(RC[-22]<>0,RC[-22]&R4C32,"q") -> q | AE357: =IF(RC[-22]<>0,RC[-22]&R4C32,"q") -> q | AF357: =IF(RC[-22]<>0,RC[-22]&R4C32,"q") -> q | AG357: =IF(RC[-22]<>0,RC[-22]&R4C32,"q") -> q | AH357: =IF(RC[-22]<>0,RC[-22]&R4C32,"q") -> q | AI357: =IF(RC[-22]<>0,RC[-22]&R4C32,"q") -> q | AJ357: =IF(RC[-22]<>0,RC[-22]&R4C32,"q") -> q | AK357: =IF(RC[-22]<>0,RC[-22]&R4C32,"q") -> q | AL357: =IF(RC[-22]<>0,RC[-22]&R4C32,"q") -> q | AM357: =IF(RC[-22]<>0,RC[-22]&R4C32,"q") -> q | AN357: =IF(RC[-22]<>0,RC[-22]&R4C32,"q") -> q | AO357: =IF(RC[-22]<>0,RC[-22]&R4C32,"q") -> q | AP357: =IF(RC[-22]<>0,RC[-22]&R4C32,"q") -> q | AQ357: =IF(RC[-22]<>0,RC[-22]&R4C32,"q") -> q | AR357: =IF(RC[-22]<>0,RC[-22]&R4C32,"q") -> q | AS357: =IF(RC[-22]<>0,RC[-22]&R4C32,"q") -> q | AT357: =IF(RC[-22]<>0,RC[-22]&R4C32,"q") -> q | AU357: =IF(RC[-22]<>0,RC[-22]&R4C32,"q") -> q | AV357: =IF(RC[-22]<>0,RC[-22]&R4C32,"q") -> q
AC358: =IF(RC[-22]<>0,RC[-22]&R4C32,"q") -> q | AD358: =IF(RC[-22]<>0,RC[-22]&R4C32,"q") -> q | AE358: =IF(RC[-22]<>0,RC[-22]&R4C32,"q") -> q | AF358: =IF(RC[-22]<>0,RC[-22]&R4C32,"q") -> q | AG358: =IF(RC[-22]<>0,RC[-22]&R4C32,"q") -> q | AH358: =IF(RC[-22]<>0,RC[-22]&R4C32,"q") -> q | AI358: =IF(RC[-22]<>0,RC[-22]&R4C32,"q") -> q | AJ358: =IF(RC[-22]<>0,RC[-22]&R4C32,"q") -> q | AK358: =IF(RC[-22]<>0,RC[-22]&R4C32,"q") -> q | AL358: =IF(RC[-22]<>0,RC[-22]&R4C32,"q") -> q | AM358: =IF(RC[-22]<>0,RC[-22]&R4C32,"q") -> q | AN358: =IF(RC[-22]<>0,RC[-22]&R4C32,"q") -> q | AO358: =IF(RC[-22]<>0,RC[-22]&R4C32,"q") -> q | AP358: =IF(RC[-22]<>0,RC[-22]&R4C32,"q") -> q | AQ358: =IF(RC[-22]<>0,RC[-22]&R4C32,"q") -> q | AR358: =IF(RC[-22]<>0,RC[-22]&R4C32,"q") -> q | AS358: =IF(RC[-22]<>0,RC[-22]&R4C32,"q") -> q | AT358: =IF(RC[-22]<>0,RC[-22]&R4C32,"q") -> q | AU358: =IF(RC[-22]<>0,RC[-22]&R4C32,"q") -> q | AV358: =IF(RC[-22]<>0,RC[-22]&R4C32,"q") -> q
AC359: =IF(RC[-22]<>0,RC[-22]&R4C32,"q") -> q | AD359: =IF(RC[-22]<>0,RC[-22]&R4C32,"q") -> q | AE359: =IF(RC[-22]<>0,RC[-22]&R4C32,"q") -> q | AF359: =IF(RC[-22]<>0,RC[-22]&R4C32,"q") -> q | AG359: =IF(RC[-22]<>0,RC[-22]&R4C32,"q") -> q | AH359: =IF(RC[-22]<>0,RC[-22]&R4C32,"q") -> q | AI359: =IF(RC[-22]<>0,RC[-22]&R4C32,"q") -> q | AJ359: =IF(RC[-22]<>0,RC[-22]&R4C32,"q") -> q | AK359: =IF(RC[-22]<>0,RC[-22]&R4C32,"q") -> q | AL359: =IF(RC[-22]<>0,RC[-22]&R4C32,"q") -> q | AM359: =IF(RC[-22]<>0,RC[-22]&R4C32,"q") -> q | AN359: =IF(RC[-22]<>0,RC[-22]&R4C32,"q") -> q | AO359: =IF(RC[-22]<>0,RC[-22]&R4C32,"q") -> q | AP359: =IF(RC[-22]<>0,RC[-22]&R4C32,"q") -> q | AQ359: =IF(RC[-22]<>0,RC[-22]&R4C32,"q") -> q | AR359: =IF(RC[-22]<>0,RC[-22]&R4C32,"q") -> q | AS359: =IF(RC[-22]<>0,RC[-22]&R4C32,"q") -> q | AT359: =IF(RC[-22]<>0,RC[-22]&R4C32,"q") -> q | AU359: =IF(RC[-22]<>0,RC[-22]&R4C32,"q") -> q | AV359: =IF(RC[-22]<>0,RC[-22]&R4C32,"q") -> q
AC360: =IF(RC[-22]<>0,RC[-22]&R4C32,"q") -> q | AD360: =IF(RC[-22]<>0,RC[-22]&R4C32,"q") -> q | AE360: =IF(RC[-22]<>0,RC[-22]&R4C32,"q") -> q | AF360: =IF(RC[-22]<>0,RC[-22]&R4C32,"q") -> q | AG360: =IF(RC[-22]<>0,RC[-22]&R4C32,"q") -> q | AH360: =IF(RC[-22]<>0,RC[-22]&R4C32,"q") -> q | AI360: =IF(RC[-22]<>0,RC[-22]&R4C32,"q") -> q | AJ360: =IF(RC[-22]<>0,RC[-22]&R4C32,"q") -> q | AK360: =IF(RC[-22]<>0,RC[-22]&R4C32,"q") -> q | AL360: =IF(RC[-22]<>0,RC[-22]&R4C32,"q") -> q | AM360: =IF(RC[-22]<>0,RC[-22]&R4C32,"q") -> q | AN360: =IF(RC[-22]<>0,RC[-22]&R4C32,"q") -> q | AO360: =IF(RC[-22]<>0,RC[-22]&R4C32,"q") -> q | AP360: =IF(RC[-22]<>0,RC[-22]&R4C32,"q") -> q | AQ360: =IF(RC[-22]<>0,RC[-22]&R4C32,"q") -> q | AR360: =IF(RC[-22]<>0,RC[-22]&R4C32,"q") -> q | AS360: =IF(RC[-22]<>0,RC[-22]&R4C32,"q") -> q | AT360: =IF(RC[-22]<>0,RC[-22]&R4C32,"q") -> q | AU360: =IF(RC[-22]<>0,RC[-22]&R4C32,"q") -> q | AV360: =IF(RC[-22]<>0,RC[-22]&R4C32,"q") -> q
AC361: =IF(RC[-22]<>0,RC[-22]&R4C32,"q") -> q | AD361: =IF(RC[-22]<>0,RC[-22]&R4C32,"q") -> q | AE361: =IF(RC[-22]<>0,RC[-22]&R4C32,"q") -> q | AF361: =IF(RC[-22]<>0,RC[-22]&R4C32,"q") -> q | AG361: =IF(RC[-22]<>0,RC[-22]&R4C32,"q") -> q | AH361: =IF(RC[-22]<>0,RC[-22]&R4C32,"q") -> q | AI361: =IF(RC[-22]<>0,RC[-22]&R4C32,"q") -> q | AJ361: =IF(RC[-22]<>0,RC[-22]&R4C32,"q") -> q | AK361: =IF(RC[-22]<>0,RC[-22]&R4C32,"q") -> q | AL361: =IF(RC[-22]<>0,RC[-22]&R4C32,"q") -> q | AM361: =IF(RC[-22]<>0,RC[-22]&R4C32,"q") -> q | AN361: =IF(RC[-22]<>0,RC[-22]&R4C32,"q") -> q | AO361: =IF(RC[-22]<>0,RC[-22]&R4C32,"q") -> q | AP361: =IF(RC[-22]<>0,RC[-22]&R4C32,"q") -> q | AQ361: =IF(RC[-22]<>0,RC[-22]&R4C32,"q") -> q | AR361: =IF(RC[-22]<>0,RC[-22]&R4C32,"q") -> q | AS361: =IF(RC[-22]<>0,RC[-22]&R4C32,"q") -> q | AT361: =IF(RC[-22]<>0,RC[-22]&R4C32,"q") -> q | AU361: =IF(RC[-22]<>0,RC[-22]&R4C32,"q") -> q | AV361: =IF(RC[-22]<>0,RC[-22]&R4C32,"q") -> q
AC362: =IF(RC[-22]<>0,RC[-22]&R4C32,"q") -> q | AD362: =IF(RC[-22]<>0,RC[-22]&R4C32,"q") -> q | AE362: =IF(RC[-22]<>0,RC[-22]&R4C32,"q") -> q | AF362: =IF(RC[-22]<>0,RC[-22]&R4C32,"q") -> q | AG362: =IF(RC[-22]<>0,RC[-22]&R4C32,"q") -> q | AH362: =IF(RC[-22]<>0,RC[-22]&R4C32,"q") -> q | AI362: =IF(RC[-22]<>0,RC[-22]&R4C32,"q") -> q | AJ362: =IF(RC[-22]<>0,RC[-22]&R4C32,"q") -> q | AK362: =IF(RC[-22]<>0,RC[-22]&R4C32,"q") -> q | AL362: =IF(RC[-22]<>0,RC[-22]&R4C32,"q") -> q | AM362: =IF(RC[-22]<>0,RC[-22]&R4C32,"q") -> q | AN362: =IF(RC[-22]<>0,RC[-22]&R4C32,"q") -> q | AO362: =IF(RC[-22]<>0,RC[-22]&R4C32,"q") -> q | AP362: =IF(RC[-22]<>0,RC[-22]&R4C32,"q") -> q | AQ362: =IF(RC[-22]<>0,RC[-22]&R4C32,"q") -> q | AR362: =IF(RC[-22]<>0,RC[-22]&R4C32,"q") -> q | AS362: =IF(RC[-22]<>0,RC[-22]&R4C32,"q") -> q | AT362: =IF(RC[-22]<>0,RC[-22]&R4C32,"q") -> q | AU362: =IF(RC[-22]<>0,RC[-22]&R4C32,"q") -> q | AV362: =IF(RC[-22]<>0,RC[-22]&R4C32,"q") -> q
AC363: =IF(RC[-22]<>0,RC[-22]&R4C32,"q") -> q | AD363: =IF(RC[-22]<>0,RC[-22]&R4C32,"q") -> q | AE363: =IF(RC[-22]<>0,RC[-22]&R4C32,"q") -> q | AF363: =IF(RC[-22]<>0,RC[-22]&R4C32,"q") -> q | AG363: =IF(RC[-22]<>0,RC[-22]&R4C32,"q") -> q | AH363: =IF(RC[-22]<>0,RC[-22]&R4C32,"q") -> q | AI363: =IF(RC[-22]<>0,RC[-22]&R4C32,"q") -> q | AJ363: =IF(RC[-22]<>0,RC[-22]&R4C32,"q") -> q | AK363: =IF(RC[-22]<>0,RC[-22]&R4C32,"q") -> q | AL363: =IF(RC[-22]<>0,RC[-22]&R4C32,"q") -> q | AM363: =IF(RC[-22]<>0,RC[-22]&R4C32,"q") -> q | AN363: =IF(RC[-22]<>0,RC[-22]&R4C32,"q") -> q | AO363: =IF(RC[-22]<>0,RC[-22]&R4C32,"q") -> q | AP363: =IF(RC[-22]<>0,RC[-22]&R4C32,"q") -> q | AQ363: =IF(RC[-22]<>0,RC[-22]&R4C32,"q") -> q | AR363: =IF(RC[-22]<>0,RC[-22]&R4C32,"q") -> q | AS363: =IF(RC[-22]<>0,RC[-22]&R4C32,"q") -> q | AT363: =IF(RC[-22]<>0,RC[-22]&R4C32,"q") -> q | AU363: =IF(RC[-22]<>0,RC[-22]&R4C32,"q") -> q | AV363: =IF(RC[-22]<>0,RC[-22]&R4C32,"q") -> q
AC364: =IF(RC[-22]<>0,RC[-22]&R4C32,"q") -> q | AD364: =IF(RC[-22]<>0,RC[-22]&R4C32,"q") -> q | AE364: =IF(RC[-22]<>0,RC[-22]&R4C32,"q") -> q | AF364: =IF(RC[-22]<>0,RC[-22]&R4C32,"q") -> q | AG364: =IF(RC[-22]<>0,RC[-22]&R4C32,"q") -> q | AH364: =IF(RC[-22]<>0,RC[-22]&R4C32,"q") -> q | AI364: =IF(RC[-22]<>0,RC[-22]&R4C32,"q") -> q | AJ364: =IF(RC[-22]<>0,RC[-22]&R4C32,"q") -> q | AK364: =IF(RC[-22]<>0,RC[-22]&R4C32,"q") -> q | AL364: =IF(RC[-22]<>0,RC[-22]&R4C32,"q") -> q | AM364: =IF(RC[-22]<>0,RC[-22]&R4C32,"q") -> q | AN364: =IF(RC[-22]<>0,RC[-22]&R4C32,"q") -> q | AO364: =IF(RC[-22]<>0,RC[-22]&R4C32,"q") -> q | AP364: =IF(RC[-22]<>0,RC[-22]&R4C32,"q") -> q | AQ364: =IF(RC[-22]<>0,RC[-22]&R4C32,"q") -> q | AR364: =IF(RC[-22]<>0,RC[-22]&R4C32,"q") -> q | AS364: =IF(RC[-22]<>0,RC[-22]&R4C32,"q") -> q | AT364: =IF(RC[-22]<>0,RC[-22]&R4C32,"q") -> q | AU364: =IF(RC[-22]<>0,RC[-22]&R4C32,"q") -> q | AV364: =IF(RC[-22]<>0,RC[-22]&R4C32,"q") -> q
AC365: =IF(RC[-22]<>0,RC[-22]&R4C32,"q") -> q | AD365: =IF(RC[-22]<>0,RC[-22]&R4C32,"q") -> q | AE365: =IF(RC[-22]<>0,RC[-22]&R4C32,"q") -> q | AF365: =IF(RC[-22]<>0,RC[-22]&R4C32,"q") -> q | AG365: =IF(RC[-22]<>0,RC[-22]&R4C32,"q") -> q | AH365: =IF(RC[-22]<>0,RC[-22]&R4C32,"q") -> q | AI365: =IF(RC[-22]<>0,RC[-22]&R4C32,"q") -> q | AJ365: =IF(RC[-22]<>0,RC[-22]&R4C32,"q") -> q | AK365: =IF(RC[-22]<>0,RC[-22]&R4C32,"q") -> q | AL365: =IF(RC[-22]<>0,RC[-22]&R4C32,"q") -> q | AM365: =IF(RC[-22]<>0,RC[-22]&R4C32,"q") -> q | AN365: =IF(RC[-22]<>0,RC[-22]&R4C32,"q") -> q | AO365: =IF(RC[-22]<>0,RC[-22]&R4C32,"q") -> q | AP365: =IF(RC[-22]<>0,RC[-22]&R4C32,"q") -> q | AQ365: =IF(RC[-22]<>0,RC[-22]&R4C32,"q") -> q | AR365: =IF(RC[-22]<>0,RC[-22]&R4C32,"q") -> q | AS365: =IF(RC[-22]<>0,RC[-22]&R4C32,"q") -> q | AT365: =IF(RC[-22]<>0,RC[-22]&R4C32,"q") -> q | AU365: =IF(RC[-22]<>0,RC[-22]&R4C32,"q") -> q | AV365: =IF(RC[-22]<>0,RC[-22]&R4C32,"q") -> q
AC366: =IF(RC[-22]<>0,RC[-22]&R4C32,"q") -> q | AD366: =IF(RC[-22]<>0,RC[-22]&R4C32,"q") -> q | AE366: =IF(RC[-22]<>0,RC[-22]&R4C32,"q") -> q | AF366: =IF(RC[-22]<>0,RC[-22]&R4C32,"q") -> q | AG366: =IF(RC[-22]<>0,RC[-22]&R4C32,"q") -> q | AH366: =IF(RC[-22]<>0,RC[-22]&R4C32,"q") -> q | AI366: =IF(RC[-22]<>0,RC[-22]&R4C32,"q") -> q | AJ366: =IF(RC[-22]<>0,RC[-22]&R4C32,"q") -> q | AK366: =IF(RC[-22]<>0,RC[-22]&R4C32,"q") -> q | AL366: =IF(RC[-22]<>0,RC[-22]&R4C32,"q") -> q | AM366: =IF(RC[-22]<>0,RC[-22]&R4C32,"q") -> q | AN366: =IF(RC[-22]<>0,RC[-22]&R4C32,"q") -> q | AO366: =IF(RC[-22]<>0,RC[-22]&R4C32,"q") -> q | AP366: =IF(RC[-22]<>0,RC[-22]&R4C32,"q") -> q | AQ366: =IF(RC[-22]<>0,RC[-22]&R4C32,"q") -> q | AR366: =IF(RC[-22]<>0,RC[-22]&R4C32,"q") -> q | AS366: =IF(RC[-22]<>0,RC[-22]&R4C32,"q") -> q | AT366: =IF(RC[-22]<>0,RC[-22]&R4C32,"q") -> q | AU366: =IF(RC[-22]<>0,RC[-22]&R4C32,"q") -> q | AV366: =IF(RC[-22]<>0,RC[-22]&R4C32,"q") -> q
AC367: =IF(RC[-22]<>0,RC[-22]&R4C32,"q") -> q | AD367: =IF(RC[-22]<>0,RC[-22]&R4C32,"q") -> q | AE367: =IF(RC[-22]<>0,RC[-22]&R4C32,"q") -> q | AF367: =IF(RC[-22]<>0,RC[-22]&R4C32,"q") -> q | AG367: =IF(RC[-22]<>0,RC[-22]&R4C32,"q") -> q | AH367: =IF(RC[-22]<>0,RC[-22]&R4C32,"q") -> q | AI367: =IF(RC[-22]<>0,RC[-22]&R4C32,"q") -> q | AJ367: =IF(RC[-22]<>0,RC[-22]&R4C32,"q") -> q | AK367: =IF(RC[-22]<>0,RC[-22]&R4C32,"q") -> q | AL367: =IF(RC[-22]<>0,RC[-22]&R4C32,"q") -> q | AM367: =IF(RC[-22]<>0,RC[-22]&R4C32,"q") -> q | AN367: =IF(RC[-22]<>0,RC[-22]&R4C32,"q") -> q | AO367: =IF(RC[-22]<>0,RC[-22]&R4C32,"q") -> q | AP367: =IF(RC[-22]<>0,RC[-22]&R4C32,"q") -> q | AQ367: =IF(RC[-22]<>0,RC[-22]&R4C32,"q") -> q | AR367: =IF(RC[-22]<>0,RC[-22]&R4C32,"q") -> q | AS367: =IF(RC[-22]<>0,RC[-22]&R4C32,"q") -> q | AT367: =IF(RC[-22]<>0,RC[-22]&R4C32,"q") -> q | AU367: =IF(RC[-22]<>0,RC[-22]&R4C32,"q") -> q | AV367: =IF(RC[-22]<>0,RC[-22]&R4C32,"q") -> q
AC368: =IF(RC[-22]<>0,RC[-22]&R4C32,"q") -> q | AD368: =IF(RC[-22]<>0,RC[-22]&R4C32,"q") -> q | AE368: =IF(RC[-22]<>0,RC[-22]&R4C32,"q") -> q | AF368: =IF(RC[-22]<>0,RC[-22]&R4C32,"q") -> q | AG368: =IF(RC[-22]<>0,RC[-22]&R4C32,"q") -> q | AH368: =IF(RC[-22]<>0,RC[-22]&R4C32,"q") -> q | AI368: =IF(RC[-22]<>0,RC[-22]&R4C32,"q") -> q | AJ368: =IF(RC[-22]<>0,RC[-22]&R4C32,"q") -> q | AK368: =IF(RC[-22]<>0,RC[-22]&R4C32,"q") -> q | AL368: =IF(RC[-22]<>0,RC[-22]&R4C32,"q") -> q | AM368: =IF(RC[-22]<>0,RC[-22]&R4C32,"q") -> q | AN368: =IF(RC[-22]<>0,RC[-22]&R4C32,"q") -> q | AO368: =IF(RC[-22]<>0,RC[-22]&R4C32,"q") -> q | AP368: =IF(RC[-22]<>0,RC[-22]&R4C32,"q") -> q | AQ368: =IF(RC[-22]<>0,RC[-22]&R4C32,"q") -> q | AR368: =IF(RC[-22]<>0,RC[-22]&R4C32,"q") -> q | AS368: =IF(RC[-22]<>0,RC[-22]&R4C32,"q") -> q | AT368: =IF(RC[-22]<>0,RC[-22]&R4C32,"q") -> q | AU368: =IF(RC[-22]<>0,RC[-22]&R4C32,"q") -> q | AV368: =IF(RC[-22]<>0,RC[-22]&R4C32,"q") -> q
AC369: =IF(RC[-22]<>0,RC[-22]&R4C32,"q") -> q | AD369: =IF(RC[-22]<>0,RC[-22]&R4C32,"q") -> q | AE369: =IF(RC[-22]<>0,RC[-22]&R4C32,"q") -> q | AF369: =IF(RC[-22]<>0,RC[-22]&R4C32,"q") -> q | AG369: =IF(RC[-22]<>0,RC[-22]&R4C32,"q") -> q | AH369: =IF(RC[-22]<>0,RC[-22]&R4C32,"q") -> q | AI369: =IF(RC[-22]<>0,RC[-22]&R4C32,"q") -> q | AJ369: =IF(RC[-22]<>0,RC[-22]&R4C32,"q") -> q | AK369: =IF(RC[-22]<>0,RC[-22]&R4C32,"q") -> q | AL369: =IF(RC[-22]<>0,RC[-22]&R4C32,"q") -> q | AM369: =IF(RC[-22]<>0,RC[-22]&R4C32,"q") -> q | AN369: =IF(RC[-22]<>0,RC[-22]&R4C32,"q") -> q | AO369: =IF(RC[-22]<>0,RC[-22]&R4C32,"q") -> q | AP369: =IF(RC[-22]<>0,RC[-22]&R4C32,"q") -> q | AQ369: =IF(RC[-22]<>0,RC[-22]&R4C32,"q") -> q | AR369: =IF(RC[-22]<>0,RC[-22]&R4C32,"q") -> q | AS369: =IF(RC[-22]<>0,RC[-22]&R4C32,"q") -> q | AT369: =IF(RC[-22]<>0,RC[-22]&R4C32,"q") -> q | AU369: =IF(RC[-22]<>0,RC[-22]&R4C32,"q") -> q | AV369: =IF(RC[-22]<>0,RC[-22]&R4C32,"q") -> q
AC370: =IF(RC[-22]<>0,RC[-22]&R4C32,"q") -> q | AD370: =IF(RC[-22]<>0,RC[-22]&R4C32,"q") -> q | AE370: =IF(RC[-22]<>0,RC[-22]&R4C32,"q") -> q | AF370: =IF(RC[-22]<>0,RC[-22]&R4C32,"q") -> q | AG370: =IF(RC[-22]<>0,RC[-22]&R4C32,"q") -> q | AH370: =IF(RC[-22]<>0,RC[-22]&R4C32,"q") -> q | AI370: =IF(RC[-22]<>0,RC[-22]&R4C32,"q") -> q | AJ370: =IF(RC[-22]<>0,RC[-22]&R4C32,"q") -> q | AK370: =IF(RC[-22]<>0,RC[-22]&R4C32,"q") -> q | AL370: =IF(RC[-22]<>0,RC[-22]&R4C32,"q") -> q | AM370: =IF(RC[-22]<>0,RC[-22]&R4C32,"q") -> q | AN370: =IF(RC[-22]<>0,RC[-22]&R4C32,"q") -> q | AO370: =IF(RC[-22]<>0,RC[-22]&R4C32,"q") -> q | AP370: =IF(RC[-22]<>0,RC[-22]&R4C32,"q") -> q | AQ370: =IF(RC[-22]<>0,RC[-22]&R4C32,"q") -> q | AR370: =IF(RC[-22]<>0,RC[-22]&R4C32,"q") -> q | AS370: =IF(RC[-22]<>0,RC[-22]&R4C32,"q") -> q | AT370: =IF(RC[-22]<>0,RC[-22]&R4C32,"q") -> q | AU370: =IF(RC[-22]<>0,RC[-22]&R4C32,"q") -> q | AV370: =IF(RC[-22]<>0,RC[-22]&R4C32,"q") -> q
AC371: =IF(RC[-22]<>0,RC[-22]&R4C32,"q") -> q | AD371: =IF(RC[-22]<>0,RC[-22]&R4C32,"q") -> q | AE371: =IF(RC[-22]<>0,RC[-22]&R4C32,"q") -> q | AF371: =IF(RC[-22]<>0,RC[-22]&R4C32,"q") -> q | AG371: =IF(RC[-22]<>0,RC[-22]&R4C32,"q") -> q | AH371: =IF(RC[-22]<>0,RC[-22]&R4C32,"q") -> q | AI371: =IF(RC[-22]<>0,RC[-22]&R4C32,"q") -> q | AJ371: =IF(RC[-22]<>0,RC[-22]&R4C32,"q") -> q | AK371: =IF(RC[-22]<>0,RC[-22]&R4C32,"q") -> q | AL371: =IF(RC[-22]<>0,RC[-22]&R4C32,"q") -> q | AM371: =IF(RC[-22]<>0,RC[-22]&R4C32,"q") -> q | AN371: =IF(RC[-22]<>0,RC[-22]&R4C32,"q") -> q | AO371: =IF(RC[-22]<>0,RC[-22]&R4C32,"q") -> q | AP371: =IF(RC[-22]<>0,RC[-22]&R4C32,"q") -> q | AQ371: =IF(RC[-22]<>0,RC[-22]&R4C32,"q") -> q | AR371: =IF(RC[-22]<>0,RC[-22]&R4C32,"q") -> q | AS371: =IF(RC[-22]<>0,RC[-22]&R4C32,"q") -> q | AT371: =IF(RC[-22]<>0,RC[-22]&R4C32,"q") -> q | AU371: =IF(RC[-22]<>0,RC[-22]&R4C32,"q") -> q | AV371: =IF(RC[-22]<>0,RC[-22]&R4C32,"q") -> q
AC372: =IF(RC[-22]<>0,RC[-22]&R4C32,"q") -> q | AD372: =IF(RC[-22]<>0,RC[-22]&R4C32,"q") -> q | AE372: =IF(RC[-22]<>0,RC[-22]&R4C32,"q") -> q | AF372: =IF(RC[-22]<>0,RC[-22]&R4C32,"q") -> q | AG372: =IF(RC[-22]<>0,RC[-22]&R4C32,"q") -> q | AH372: =IF(RC[-22]<>0,RC[-22]&R4C32,"q") -> q | AI372: =IF(RC[-22]<>0,RC[-22]&R4C32,"q") -> q | AJ372: =IF(RC[-22]<>0,RC[-22]&R4C32,"q") -> q | AK372: =IF(RC[-22]<>0,RC[-22]&R4C32,"q") -> q | AL372: =IF(RC[-22]<>0,RC[-22]&R4C32,"q") -> q | AM372: =IF(RC[-22]<>0,RC[-22]&R4C32,"q") -> q | AN372: =IF(RC[-22]<>0,RC[-22]&R4C32,"q") -> q | AO372: =IF(RC[-22]<>0,RC[-22]&R4C32,"q") -> q | AP372: =IF(RC[-22]<>0,RC[-22]&R4C32,"q") -> q | AQ372: =IF(RC[-22]<>0,RC[-22]&R4C32,"q") -> q | AR372: =IF(RC[-22]<>0,RC[-22]&R4C32,"q") -> q | AS372: =IF(RC[-22]<>0,RC[-22]&R4C32,"q") -> q | AT372: =IF(RC[-22]<>0,RC[-22]&R4C32,"q") -> q | AU372: =IF(RC[-22]<>0,RC[-22]&R4C32,"q") -> q | AV372: =IF(RC[-22]<>0,RC[-22]&R4C32,"q") -> q
AC373: =IF(RC[-22]<>0,RC[-22]&R4C32,"q") -> q | AD373: =IF(RC[-22]<>0,RC[-22]&R4C32,"q") -> q | AE373: =IF(RC[-22]<>0,RC[-22]&R4C32,"q") -> q | AF373: =IF(RC[-22]<>0,RC[-22]&R4C32,"q") -> q | AG373: =IF(RC[-22]<>0,RC[-22]&R4C32,"q") -> q | AH373: =IF(RC[-22]<>0,RC[-22]&R4C32,"q") -> q | AI373: =IF(RC[-22]<>0,RC[-22]&R4C32,"q") -> q | AJ373: =IF(RC[-22]<>0,RC[-22]&R4C32,"q") -> q | AK373: =IF(RC[-22]<>0,RC[-22]&R4C32,"q") -> q | AL373: =IF(RC[-22]<>0,RC[-22]&R4C32,"q") -> q | AM373: =IF(RC[-22]<>0,RC[-22]&R4C32,"q") -> q | AN373: =IF(RC[-22]<>0,RC[-22]&R4C32,"q") -> q | AO373: =IF(RC[-22]<>0,RC[-22]&R4C32,"q") -> q | AP373: =IF(RC[-22]<>0,RC[-22]&R4C32,"q") -> q | AQ373: =IF(RC[-22]<>0,RC[-22]&R4C32,"q") -> q | AR373: =IF(RC[-22]<>0,RC[-22]&R4C32,"q") -> q | AS373: =IF(RC[-22]<>0,RC[-22]&R4C32,"q") -> q | AT373: =IF(RC[-22]<>0,RC[-22]&R4C32,"q") -> q | AU373: =IF(RC[-22]<>0,RC[-22]&R4C32,"q") -> q | AV373: =IF(RC[-22]<>0,RC[-22]&R4C32,"q") -> q
AC374: =IF(RC[-22]<>0,RC[-22]&R4C32,"q") -> q | AD374: =IF(RC[-22]<>0,RC[-22]&R4C32,"q") -> q | AE374: =IF(RC[-22]<>0,RC[-22]&R4C32,"q") -> q | AF374: =IF(RC[-22]<>0,RC[-22]&R4C32,"q") -> q | AG374: =IF(RC[-22]<>0,RC[-22]&R4C32,"q") -> q | AH374: =IF(RC[-22]<>0,RC[-22]&R4C32,"q") -> q | AI374: =IF(RC[-22]<>0,RC[-22]&R4C32,"q") -> q | AJ374: =IF(RC[-22]<>0,RC[-22]&R4C32,"q") -> q | AK374: =IF(RC[-22]<>0,RC[-22]&R4C32,"q") -> q | AL374: =IF(RC[-22]<>0,RC[-22]&R4C32,"q") -> q | AM374: =IF(RC[-22]<>0,RC[-22]&R4C32,"q") -> q | AN374: =IF(RC[-22]<>0,RC[-22]&R4C32,"q") -> q | AO374: =IF(RC[-22]<>0,RC[-22]&R4C32,"q") -> q | AP374: =IF(RC[-22]<>0,RC[-22]&R4C32,"q") -> q | AQ374: =IF(RC[-22]<>0,RC[-22]&R4C32,"q") -> q | AR374: =IF(RC[-22]<>0,RC[-22]&R4C32,"q") -> q | AS374: =IF(RC[-22]<>0,RC[-22]&R4C32,"q") -> q | AT374: =IF(RC[-22]<>0,RC[-22]&R4C32,"q") -> q | AU374: =IF(RC[-22]<>0,RC[-22]&R4C32,"q") -> q | AV374: =IF(RC[-22]<>0,RC[-22]&R4C32,"q") -> q
AC375: =IF(RC[-22]<>0,RC[-22]&R4C32,"q") -> q | AD375: =IF(RC[-22]<>0,RC[-22]&R4C32,"q") -> q | AE375: =IF(RC[-22]<>0,RC[-22]&R4C32,"q") -> q | AF375: =IF(RC[-22]<>0,RC[-22]&R4C32,"q") -> q | AG375: =IF(RC[-22]<>0,RC[-22]&R4C32,"q") -> q | AH375: =IF(RC[-22]<>0,RC[-22]&R4C32,"q") -> q | AI375: =IF(RC[-22]<>0,RC[-22]&R4C32,"q") -> q | AJ375: =IF(RC[-22]<>0,RC[-22]&R4C32,"q") -> q | AK375: =IF(RC[-22]<>0,RC[-22]&R4C32,"q") -> q | AL375: =IF(RC[-22]<>0,RC[-22]&R4C32,"q") -> q | AM375: =IF(RC[-22]<>0,RC[-22]&R4C32,"q") -> q | AN375: =IF(RC[-22]<>0,RC[-22]&R4C32,"q") -> q | AO375: =IF(RC[-22]<>0,RC[-22]&R4C32,"q") -> q | AP375: =IF(RC[-22]<>0,RC[-22]&R4C32,"q") -> q | AQ375: =IF(RC[-22]<>0,RC[-22]&R4C32,"q") -> q | AR375: =IF(RC[-22]<>0,RC[-22]&R4C32,"q") -> q | AS375: =IF(RC[-22]<>0,RC[-22]&R4C32,"q") -> q | AT375: =IF(RC[-22]<>0,RC[-22]&R4C32,"q") -> q | AU375: =IF(RC[-22]<>0,RC[-22]&R4C32,"q") -> q | AV375: =IF(RC[-22]<>0,RC[-22]&R4C32,"q") -> q
AC376: =IF(RC[-22]<>0,RC[-22]&R4C32,"q") -> q | AD376: =IF(RC[-22]<>0,RC[-22]&R4C32,"q") -> q | AE376: =IF(RC[-22]<>0,RC[-22]&R4C32,"q") -> q | AF376: =IF(RC[-22]<>0,RC[-22]&R4C32,"q") -> q | AG376: =IF(RC[-22]<>0,RC[-22]&R4C32,"q") -> q | AH376: =IF(RC[-22]<>0,RC[-22]&R4C32,"q") -> q | AI376: =IF(RC[-22]<>0,RC[-22]&R4C32,"q") -> q | AJ376: =IF(RC[-22]<>0,RC[-22]&R4C32,"q") -> q | AK376: =IF(RC[-22]<>0,RC[-22]&R4C32,"q") -> q | AL376: =IF(RC[-22]<>0,RC[-22]&R4C32,"q") -> q | AM376: =IF(RC[-22]<>0,RC[-22]&R4C32,"q") -> q | AN376: =IF(RC[-22]<>0,RC[-22]&R4C32,"q") -> q | AO376: =IF(RC[-22]<>0,RC[-22]&R4C32,"q") -> q | AP376: =IF(RC[-22]<>0,RC[-22]&R4C32,"q") -> q | AQ376: =IF(RC[-22]<>0,RC[-22]&R4C32,"q") -> q | AR376: =IF(RC[-22]<>0,RC[-22]&R4C32,"q") -> q | AS376: =IF(RC[-22]<>0,RC[-22]&R4C32,"q") -> q | AT376: =IF(RC[-22]<>0,RC[-22]&R4C32,"q") -> q | AU376: =IF(RC[-22]<>0,RC[-22]&R4C32,"q") -> q | AV376: =IF(RC[-22]<>0,RC[-22]&R4C32,"q") -> q
AC377: =IF(RC[-22]<>0,RC[-22]&R4C32,"q") -> q | AD377: =IF(RC[-22]<>0,RC[-22]&R4C32,"q") -> q | AE377: =IF(RC[-22]<>0,RC[-22]&R4C32,"q") -> q | AF377: =IF(RC[-22]<>0,RC[-22]&R4C32,"q") -> q | AG377: =IF(RC[-22]<>0,RC[-22]&R4C32,"q") -> q | AH377: =IF(RC[-22]<>0,RC[-22]&R4C32,"q") -> q | AI377: =IF(RC[-22]<>0,RC[-22]&R4C32,"q") -> q | AJ377: =IF(RC[-22]<>0,RC[-22]&R4C32,"q") -> q | AK377: =IF(RC[-22]<>0,RC[-22]&R4C32,"q") -> q | AL377: =IF(RC[-22]<>0,RC[-22]&R4C32,"q") -> q | AM377: =IF(RC[-22]<>0,RC[-22]&R4C32,"q") -> q | AN377: =IF(RC[-22]<>0,RC[-22]&R4C32,"q") -> q | AO377: =IF(RC[-22]<>0,RC[-22]&R4C32,"q") -> q | AP377: =IF(RC[-22]<>0,RC[-22]&R4C32,"q") -> q | AQ377: =IF(RC[-22]<>0,RC[-22]&R4C32,"q") -> q | AR377: =IF(RC[-22]<>0,RC[-22]&R4C32,"q") -> q | AS377: =IF(RC[-22]<>0,RC[-22]&R4C32,"q") -> q | AT377: =IF(RC[-22]<>0,RC[-22]&R4C32,"q") -> q | AU377: =IF(RC[-22]<>0,RC[-22]&R4C32,"q") -> q | AV377: =IF(RC[-22]<>0,RC[-22]&R4C32,"q") -> q
AC378: =IF(RC[-22]<>0,RC[-22]&R4C32,"q") -> q | AD378: =IF(RC[-22]<>0,RC[-22]&R4C32,"q") -> q | AE378: =IF(RC[-22]<>0,RC[-22]&R4C32,"q") -> q | AF378: =IF(RC[-22]<>0,RC[-22]&R4C32,"q") -> q | AG378: =IF(RC[-22]<>0,RC[-22]&R4C32,"q") -> q | AH378: =IF(RC[-22]<>0,RC[-22]&R4C32,"q") -> q | AI378: =IF(RC[-22]<>0,RC[-22]&R4C32,"q") -> q | AJ378: =IF(RC[-22]<>0,RC[-22]&R4C32,"q") -> q | AK378: =IF(RC[-22]<>0,RC[-22]&R4C32,"q") -> q | AL378: =IF(RC[-22]<>0,RC[-22]&R4C32,"q") -> q | AM378: =IF(RC[-22]<>0,RC[-22]&R4C32,"q") -> q | AN378: =IF(RC[-22]<>0,RC[-22]&R4C32,"q") -> q | AO378: =IF(RC[-22]<>0,RC[-22]&R4C32,"q") -> q | AP378: =IF(RC[-22]<>0,RC[-22]&R4C32,"q") -> q | AQ378: =IF(RC[-22]<>0,RC[-22]&R4C32,"q") -> q | AR378: =IF(RC[-22]<>0,RC[-22]&R4C32,"q") -> q | AS378: =IF(RC[-22]<>0,RC[-22]&R4C32,"q") -> q | AT378: =IF(RC[-22]<>0,RC[-22]&R4C32,"q") -> q | AU378: =IF(RC[-22]<>0,RC[-22]&R4C32,"q") -> q | AV378: =IF(RC[-22]<>0,RC[-22]&R4C32,"q") -> q
AC379: =IF(RC[-22]<>0,RC[-22]&R4C32,"q") -> q | AD379: =IF(RC[-22]<>0,RC[-22]&R4C32,"q") -> q | AE379: =IF(RC[-22]<>0,RC[-22]&R4C32,"q") -> q | AF379: =IF(RC[-22]<>0,RC[-22]&R4C32,"q") -> q | AG379: =IF(RC[-22]<>0,RC[-22]&R4C32,"q") -> q | AH379: =IF(RC[-22]<>0,RC[-22]&R4C32,"q") -> q | AI379: =IF(RC[-22]<>0,RC[-22]&R4C32,"q") -> q | AJ379: =IF(RC[-22]<>0,RC[-22]&R4C32,"q") -> q | AK379: =IF(RC[-22]<>0,RC[-22]&R4C32,"q") -> q | AL379: =IF(RC[-22]<>0,RC[-22]&R4C32,"q") -> q | AM379: =IF(RC[-22]<>0,RC[-22]&R4C32,"q") -> q | AN379: =IF(RC[-22]<>0,RC[-22]&R4C32,"q") -> q | AO379: =IF(RC[-22]<>0,RC[-22]&R4C32,"q") -> q | AP379: =IF(RC[-22]<>0,RC[-22]&R4C32,"q") -> q | AQ379: =IF(RC[-22]<>0,RC[-22]&R4C32,"q") -> q | AR379: =IF(RC[-22]<>0,RC[-22]&R4C32,"q") -> q | AS379: =IF(RC[-22]<>0,RC[-22]&R4C32,"q") -> q | AT379: =IF(RC[-22]<>0,RC[-22]&R4C32,"q") -> q | AU379: =IF(RC[-22]<>0,RC[-22]&R4C32,"q") -> q | AV379: =IF(RC[-22]<>0,RC[-22]&R4C32,"q") -> q
AC380: =IF(RC[-22]<>0,RC[-22]&R4C32,"q") -> q | AD380: =IF(RC[-22]<>0,RC[-22]&R4C32,"q") -> q | AE380: =IF(RC[-22]<>0,RC[-22]&R4C32,"q") -> q | AF380: =IF(RC[-22]<>0,RC[-22]&R4C32,"q") -> q | AG380: =IF(RC[-22]<>0,RC[-22]&R4C32,"q") -> q | AH380: =IF(RC[-22]<>0,RC[-22]&R4C32,"q") -> q | AI380: =IF(RC[-22]<>0,RC[-22]&R4C32,"q") -> q | AJ380: =IF(RC[-22]<>0,RC[-22]&R4C32,"q") -> q | AK380: =IF(RC[-22]<>0,RC[-22]&R4C32,"q") -> q | AL380: =IF(RC[-22]<>0,RC[-22]&R4C32,"q") -> q | AM380: =IF(RC[-22]<>0,RC[-22]&R4C32,"q") -> q | AN380: =IF(RC[-22]<>0,RC[-22]&R4C32,"q") -> q | AO380: =IF(RC[-22]<>0,RC[-22]&R4C32,"q") -> q | AP380: =IF(RC[-22]<>0,RC[-22]&R4C32,"q") -> q | AQ380: =IF(RC[-22]<>0,RC[-22]&R4C32,"q") -> q | AR380: =IF(RC[-22]<>0,RC[-22]&R4C32,"q") -> q | AS380: =IF(RC[-22]<>0,RC[-22]&R4C32,"q") -> q | AT380: =IF(RC[-22]<>0,RC[-22]&R4C32,"q") -> q | AU380: =IF(RC[-22]<>0,RC[-22]&R4C32,"q") -> q | AV380: =IF(RC[-22]<>0,RC[-22]&R4C32,"q") -> q
AC381: =IF(RC[-22]<>0,RC[-22]&R4C32,"q") -> q | AD381: =IF(RC[-22]<>0,RC[-22]&R4C32,"q") -> q | AE381: =IF(RC[-22]<>0,RC[-22]&R4C32,"q") -> q | AF381: =IF(RC[-22]<>0,RC[-22]&R4C32,"q") -> q | AG381: =IF(RC[-22]<>0,RC[-22]&R4C32,"q") -> q | AH381: =IF(RC[-22]<>0,RC[-22]&R4C32,"q") -> q | AI381: =IF(RC[-22]<>0,RC[-22]&R4C32,"q") -> q | AJ381: =IF(RC[-22]<>0,RC[-22]&R4C32,"q") -> q | AK381: =IF(RC[-22]<>0,RC[-22]&R4C32,"q") -> q | AL381: =IF(RC[-22]<>0,RC[-22]&R4C32,"q") -> q | AM381: =IF(RC[-22]<>0,RC[-22]&R4C32,"q") -> q | AN381: =IF(RC[-22]<>0,RC[-22]&R4C32,"q") -> q | AO381: =IF(RC[-22]<>0,RC[-22]&R4C32,"q") -> q | AP381: =IF(RC[-22]<>0,RC[-22]&R4C32,"q") -> q | AQ381: =IF(RC[-22]<>0,RC[-22]&R4C32,"q") -> q | AR381: =IF(RC[-22]<>0,RC[-22]&R4C32,"q") -> q | AS381: =IF(RC[-22]<>0,RC[-22]&R4C32,"q") -> q | AT381: =IF(RC[-22]<>0,RC[-22]&R4C32,"q") -> q | AU381: =IF(RC[-22]<>0,RC[-22]&R4C32,"q") -> q | AV381: =IF(RC[-22]<>0,RC[-22]&R4C32,"q") -> q

Sheet: Sheet5
F1: ;
D2: 等级 | E2: 经验 | F2: 任务所需等级 | AA2: 每次银币 | AH2: 宠物等级 | AI2: 下级需要经验 | AJ2: 总经验
B3: =RC[5]&R1C6&RC[6]&R1C6&RC[7]&R1C6 -> 0,1,7,5000;0,1,8,1000;0,1,4,5000; | D3: =VLOOKUP(ROUND(RC[1],-2),Sheet3!C23:C24,2,TRUE) -> 2 | E3: =Sheet3!R[2]C[11] -> 20 | F3: 0 | G3: 0,1,7,5000 | H3: ="0,1,8,"&RC[24] -> 0,1,8,1000 | I3: ="0,1,4,"&RC[18] -> 0,1,4,5000 | U3: 0,1,4,200 | X3: 1 | Y3: =MID(RC[-4],7,99)*1 -> 200 | AA3: 5000 | AE3: 45 | AF3: 1000 | AH3: 0 | AI3: 21
B4: =RC[5]&R1C6&RC[6]&R1C6&RC[7]&R1C6 -> 0,1,7,5000;0,1,8,1000;0,1,4,5000; | D4: =VLOOKUP(ROUND(RC[1],-2),Sheet3!C23:C24,2,TRUE) -> 2 | E4: =Sheet3!R[2]C[11] -> 60 | F4: 0 | G4: 0,1,7,5000 | H4: ="0,1,8,"&RC[24] -> 0,1,8,1000 | I4: ="0,1,4,"&RC[18] -> 0,1,4,5000 | U4: 0,1,4,200 | X4: 2 | Y4: =MID(RC[-4],7,99)*1 -> 200 | AA4: 5000 | AE4: 45 | AF4: 1000 | AH4: 1 | AI4: 70 | AJ4: =SUM(R3C35:RC[-1]) -> 91
B5: =RC[5]&R1C6&RC[6]&R1C6&RC[7]&R1C6 -> 0,1,7,5000;0,1,8,1000;0,1,4,5000; | D5: =VLOOKUP(ROUND(RC[1],-2),Sheet3!C23:C24,2,TRUE) -> 3 | E5: =Sheet3!R[2]C[11] -> 150 | F5: 0 | G5: 0,1,7,5000 | H5: ="0,1,8,"&RC[24] -> 0,1,8,1000 | I5: ="0,1,4,"&RC[18] -> 0,1,4,5000 | U5: 0,1,4,200 | X5: 3 | Y5: =MID(RC[-4],7,99)*1 -> 200 | AA5: 5000 | AE5: 45 | AF5: 1000 | AH5: 2 | AI5: 105 | AJ5: =SUM(R3C35:RC[-1]) -> 196
B6: =RC[5]&R1C6&RC[6]&R1C6&RC[7]&R1C6 -> 0,1,7,5000;0,1,8,1000;0,1,4,5000; | D6: =VLOOKUP(ROUND(RC[1],-2),Sheet3!C23:C24,2,TRUE) -> 3 | E6: =Sheet3!R[2]C[11] -> 260 | F6: 0 | G6: 0,1,7,5000 | H6: ="0,1,8,"&RC[24] -> 0,1,8,1000 | I6: ="0,1,4,"&RC[18] -> 0,1,4,5000 | U6: 0,1,4,200 | X6: 4 | Y6: =MID(RC[-4],7,99)*1 -> 200 | AA6: 5000 | AE6: 55 | AF6: 1000 | AH6: 3 | AI6: 131 | AJ6: =SUM(R3C35:RC[-1]) -> 327
B7: =RC[5]&R1C6&RC[6]&R1C6&RC[7]&R1C6 -> 0,1,7,5000;0,1,8,1000;0,1,4,5000; | D7: =VLOOKUP(ROUND(RC[1],-2),Sheet3!C23:C24,2,TRUE) -> 4 | E7: =Sheet3!R[2]C[11] -> 370 | F7: 0 | G7: 0,1,7,5000 | H7: ="0,1,8,"&RC[24] -> 0,1,8,1000 | I7: ="0,1,4,"&RC[18] -> 0,1,4,5000 | U7: 0,1,4,200 | X7: 5 | Y7: =MID(RC[-4],7,99)*1 -> 200 | AA7: 5000 | AE7: 55 | AF7: 1000 | AH7: 4 | AI7: 152 | AJ7: =SUM(R3C35:RC[-1]) -> 479
B8: =RC[5]&R1C6&RC[6]&R1C6&RC[7]&R1C6 -> 0,1,7,15000;0,1,8,1000;0,1,4,5000; | D8: =VLOOKUP(ROUND(RC[1],-2),Sheet3!C23:C24,2,TRUE) -> 5 | E8: =Sheet3!R[2]C[11] -> 670 | F8: 0 | G8: 0,1,7,15000 | H8: ="0,1,8,"&RC[24] -> 0,1,8,1000 | I8: ="0,1,4,"&RC[18] -> 0,1,4,5000 | X8: 6 | AA8: 5000 | AE8: 250 | AF8: 1000 | AH8: 5 | AI8: 170 | AJ8: =SUM(R3C35:RC[-1]) -> 649
B9: =RC[5]&R1C6&RC[6]&R1C6&RC[7]&R1C6&RC[8]&R1C6 -> 0,1,7,5000;0,1,8,1000;0,1,4,5000;0,3,3003,1; | D9: =VLOOKUP(ROUND(RC[1],-2),Sheet3!C23:C24,2,TRUE) -> 5 | E9: =Sheet3!R[2]C[11] -> 790 | F9: 0 | G9: 0,1,7,5000 | H9: ="0,1,8,"&RC[24] -> 0,1,8,1000 | I9: ="0,1,4,"&RC[18] -> 0,1,4,5000 | J9: 0,3,3003,1 | U9: 0,1,4,300 | X9: 7 | Y9: =MID(RC[-4],7,99)*1 -> 300 | AA9: 5000 | AE9: 60 | AF9: 1000 | AH9: 6 | AI9: 190 | AJ9: =SUM(R3C35:RC[-1]) -> 839
B10: =RC[5]&R1C6&RC[6]&R1C6&RC[7]&R1C6&RC[8]&R1C6 -> 0,1,7,15000;0,1,8,1000;0,1,4,5000;0,1,1600000,1; | D10: =VLOOKUP(ROUND(RC[1],-2),Sheet3!C23:C24,2,TRUE) -> 6 | E10: =Sheet3!R[2]C[11] -> 1340 | F10: 0 | G10: 0,1,7,15000 | H10: ="0,1,8,"&RC[24] -> 0,1,8,1000 | I10: ="0,1,4,"&RC[18] -> 0,1,4,5000 | J10: 0,1,1600000,1 | U10: 0,1,4,1600 | X10: 8 | Y10: =MID(RC[-4],7,99)*1 -> 1600 | AA10: 5000 | AE10: 325 | AF10: 1000 | AH10: 7 | AI10: 214 | AJ10: =SUM(R3C35:RC[-1]) -> 1053
B11: =RC[5]&R1C6&RC[6]&R1C6&RC[7]&R1C6&RC[8]&R1C6 -> 0,1,7,5000;0,1,8,1000;0,1,4,5000;0,4,20001,1; | D11: =VLOOKUP(ROUND(RC[1],-2),Sheet3!C23:C24,2,TRUE) -> 7 | E11: =Sheet3!R[2]C[11] -> 1690 | F11: 0 | G11: 0,1,7,5000 | H11: ="0,1,8,"&RC[24] -> 0,1,8,1000 | I11: ="0,1,4,"&RC[18] -> 0,1,4,5000 | J11: 0,4,20001,1 | U11: 0,1,4,300 | X11: 9 | Y11: =MID(RC[-4],7,99)*1 -> 300 | AA11: 5000 | AE11: 60 | AF11: 1000 | AH11: 8 | AI11: 244 | AJ11: =SUM(R3C35:RC[-1]) -> 1297
B12: =RC[5]&R1C6&RC[6]&R1C6&RC[7]&R1C6 -> 0,1,7,5000;0,1,8,1000;0,1,4,5000; | D12: =VLOOKUP(ROUND(RC[1],-2),Sheet3!C23:C24,2,TRUE) -> 8 | E12: =Sheet3!R[2]C[11] -> 2040 | F12: 0 | G12: 0,1,7,5000 | H12: ="0,1,8,"&RC[24] -> 0,1,8,1000 | I12: ="0,1,4,"&RC[18] -> 0,1,4,5000 | U12: 0,1,4,1500 | X12: 10 | Y12: =MID(RC[-4],7,99)*1 -> 1500 | AA12: 5000 | AE12: 350 | AF12: 1000 | AH12: 9 | AI12: 284 | AJ12: =SUM(R3C35:RC[-1]) -> 1581
B13: =RC[5]&R1C6&RC[6]&R1C6&RC[7]&R1C6 -> 0,1,7,5000;0,1,8,1000;0,1,4,5000; | D13: =VLOOKUP(ROUND(RC[1],-2),Sheet3!C23:C24,2,TRUE) -> 9 | E13: =Sheet3!R[2]C[11] -> 2390 | F13: 0 | G13: 0,1,7,5000 | H13: ="0,1,8,"&RC[24] -> 0,1,8,1000 | I13: ="0,1,4,"&RC[18] -> 0,1,4,5000 | U13: 0,1,4,300 | X13: 11 | Y13: =MID(RC[-4],7,99)*1 -> 300 | AA13: 5000 | AE13: 70 | AF13: 1000 | AH13: 10 | AI13: 334 | AJ13: =SUM(R3C35:RC[-1]) -> 1915
B14: =RC[5]&R1C6&RC[6]&R1C6&RC[7]&R1C6&RC[8]&R1C6&RC[9]&R1C6&RC[10]&R1C6&RC[11]&R1C6&RC[12]&R1C6&RC[13]&R1C6&RC[14]&R1C6&RC[15]&R1C6&RC[16]&R1C6&RC[17]&R1C6 -> 0,1,7,5000;0,1,8,1000;0,1,4,5000;1,1,1200101,1;2,1,1200201,1;3,1,1200101,1;4,1,1200201,1;5,1,1200101,1;6,1,1200201,1;7,1,1200101,1;8,1,1200201,1;9,1,1200101,1;10,1,1200201,1; | D14: =VLOOKUP(ROUND(RC[1],-2),Sheet3!C23:C24,2,TRUE) -> 9 | E14: =Sheet3!R[2]C[11] -> 2740 | F14: 0 | G14: 0,1,7,5000 | H14: ="0,1,8,"&RC[24] -> 0,1,8,1000 | I14: ="0,1,4,"&RC[18] -> 0,1,4,5000 | J14: 1,1,1200101,1 | K14: 2,1,1200201,1 | L14: 3,1,1200101,1 | M14: 4,1,1200201,1 | N14: 5,1,1200101,1 | O14: 6,1,1200201,1 | P14: 7,1,1200101,1 | Q14: 8,1,1200201,1 | R14: 9,1,1200101,1 | S14: 10,1,1200201,1 | U14: 0,1,4,300 | X14: 12 | Y14: =MID(RC[-4],7,99)*1 -> 300 | AA14: 5000 | AE14: 75 | AF14: 1000 | AH14: 11 | AI14: 396 | AJ14: =SUM(R3C35:RC[-1]) -> 2311
B15: =RC[5]&R1C6&RC[6]&R1C6&RC[7]&R1C6&RC[8]&R1C6&RC[9]&R1C6&RC[10]&R1C6&RC[11]&R1C6&RC[12]&R1C6&RC[13]&R1C6&RC[14]&R1C6&RC[15]&R1C6&RC[16]&R1C6&RC[17]&R1C6 -> 0,1,7,15000;0,1,8,1000;0,1,4,5000;1,1,1300101,1;2,1,1300201,1;3,1,1300101,1;4,1,1300201,1;5,1,1300101,1;6,1,1300201,1;7,1,1300101,1;8,1,1300201,1;9,1,1300101,1;10,1,1300201,1; | D15: =VLOOKUP(ROUND(RC[1],-2),Sheet3!C23:C24,2,TRUE) -> 10 | E15: =Sheet3!R[2]C[11] -> 3240 | F15: 0 | G15: 0,1,7,15000 | H15: ="0,1,8,"&RC[24] -> 0,1,8,1000 | I15: ="0,1,4,"&RC[18] -> 0,1,4,5000 | J15: 1,1,1300101,1 | K15: 2,1,1300201,1 | L15: 3,1,1300101,1 | M15: 4,1,1300201,1 | N15: 5,1,1300101,1 | O15: 6,1,1300201,1 | P15: 7,1,1300101,1 | Q15: 8,1,1300201,1 | R15: 9,1,1300101,1 | S15: 10,1,1300201,1 | U15: 0,1,4,1500 | X15: 13 | Y15: =MID(RC[-4],7,99)*1 -> 1500 | AA15: 5000 | AE15: 350 | AF15: 1000 | AH15: 12 | AI15: 470 | AJ15: =SUM(R3C35:RC[-1]) -> 2781
B16: =RC[5]&R1C6&RC[6]&R1C6&RC[7]&R1C6&RC[8]&R1C6&RC[9]&R1C6&RC[10]&R1C6&RC[11]&R1C6&RC[12]&R1C6&RC[13]&R1C6&RC[14]&R1C6&RC[15]&R1C6&RC[16]&R1C6&RC[17]&R1C6 -> 0,1,7,5000;0,1,8,1000;0,1,4,5000;1,1,1101101,1;2,1,1101201,1;3,1,1102101,1;4,1,1102201,1;5,1,1103101,1;6,1,1103201,1;7,1,1104101,1;8,1,1104201,1;9,1,1105101,1;10,1,1105201,1; | D16: =VLOOKUP(ROUND(RC[1],-2),Sheet3!C23:C24,2,TRUE) -> 11 | E16: =Sheet3!R[2]C[11] -> 3640 | F16: 0 | G16: 0,1,7,5000 | H16: ="0,1,8,"&RC[24] -> 0,1,8,1000 | I16: ="0,1,4,"&RC[18] -> 0,1,4,5000 | J16: 1,1,1101101,1 | K16: 2,1,1101201,1 | L16: 3,1,1102101,1 | M16: 4,1,1102201,1 | N16: 5,1,1103101,1 | O16: 6,1,1103201,1 | P16: 7,1,1104101,1 | Q16: 8,1,1104201,1 | R16: 9,1,1105101,1 | S16: 10,1,1105201,1 | U16: 0,1,4,300 | X16: 14 | Y16: =MID(RC[-4],7,99)*1 -> 300 | AA16: 5000 | AE16: 75 | AF16: 1000 | AH16: 13 | AI16: 556 | AJ16: =SUM(R3C35:RC[-1]) -> 3337
B17: =RC[5]&R1C6&RC[6]&R1C6&RC[7]&R1C6&RC[8]&R1C6 -> 0,1,7,5000;0,1,8,1000;0,1,4,5000;0,4,20006,1; | D17: =VLOOKUP(ROUND(RC[1],-2),Sheet3!C23:C24,2,TRUE) -> 11 | E17: =Sheet3!R[2]C[11] -> 4040 | F17: 0 | G17: 0,1,7,5000 | H17: ="0,1,8,"&RC[24] -> 0,1,8,1000 | I17: ="0,1,4,"&RC[18] -> 0,1,4,5000 | J17: 0,4,20006,1 | U17: 0,1,4,2000 | X17: 15 | Y17: =MID(RC[-4],7,99)*1 -> 2000 | AA17: 5000 | AE17: 500 | AF17: 1000 | AH17: 14 | AI17: 655 | AJ17: =SUM(R3C35:RC[-1]) -> 3992
B18: =RC[5]&R1C6&RC[6]&R1C6&RC[7]&R1C6 -> 0,1,7,5000;0,1,8,1000;0,1,4,5000; | D18: =VLOOKUP(ROUND(RC[1],-2),Sheet3!C23:C24,2,TRUE) -> 11 | E18: =Sheet3!R[2]C[11] -> 4440 | F18: 0 | G18: 0,1,7,5000 | H18: ="0,1,8,"&RC[24] -> 0,1,8,1000 | I18: ="0,1,4,"&RC[18] -> 0,1,4,5000 | U18: 0,1,4,200 | X18: 16 | Y18: =MID(RC[-4],7,99)*1 -> 200 | AA18: 5000 | AE18: 80 | AF18: 1000 | AH18: 15 | AI18: 767 | AJ18: =SUM(R3C35:RC[-1]) -> 4759
B19: =RC[5]&R1C6&RC[6]&R1C6&RC[7]&R1C6 -> 0,1,7,15000;0,1,8,1000;0,1,4,5000; | D19: =VLOOKUP(ROUND(RC[1],-2),Sheet3!C23:C24,2,TRUE) -> 13 | E19: =Sheet3!R[2]C[11] -> 5740 | F19: 0 | G19: 0,1,7,15000 | H19: ="0,1,8,"&RC[24] -> 0,1,8,1000 | I19: ="0,1,4,"&RC[18] -> 0,1,4,5000 | U19: 0,1,4,200 | X19: 17 | Y19: =MID(RC[-4],7,99)*1 -> 200 | AA19: 5000 | AE19: 80 | AF19: 1000 | AH19: 16 | AI19: 890 | AJ19: =SUM(R3C35:RC[-1]) -> 5649
B20: =RC[5]&R1C6&RC[6]&R1C6&RC[7]&R1C6 -> 0,1,7,5000;0,1,8,1000;0,1,4,5500; | D20: =VLOOKUP(ROUND(RC[1],-2),Sheet3!C23:C24,2,TRUE) -> 13 | E20: =Sheet3!R[2]C[11] -> 6140 | F20: 0 | G20: 0,1,7,5000 | H20: ="0,1,8,"&RC[24] -> 0,1,8,1000 | I20: ="0,1,4,"&RC[18] -> 0,1,4,5500 | U20: 0,1,4,3000 | X20: 18 | Y20: =MID(RC[-4],7,99)*1 -> 3000 | AA20: 5500 | AE20: 625 | AF20: 1000 | AH20: 17 | AI20: 1025 | AJ20: =SUM(R3C35:RC[-1]) -> 6674
B21: =RC[5]&R1C6&RC[6]&R1C6&RC[7]&R1C6 -> 0,1,7,6000;0,1,8,1000;0,1,4,6000; | D21: =VLOOKUP(ROUND(RC[1],-2),Sheet3!C23:C24,2,TRUE) -> 13 | E21: =Sheet3!R[2]C[11] -> 6540 | F21: 0 | G21: 0,1,7,6000 | H21: ="0,1,8,"&RC[24] -> 0,1,8,1000 | I21: ="0,1,4,"&RC[18] -> 0,1,4,6000 | U21: 0,1,4,600 | X21: 19 | Y21: =MID(RC[-4],7,99)*1 -> 600 | AA21: 6000 | AE21: 85 | AF21: 1000 | AH21: 18 | AI21: 1171 | AJ21: =SUM(R3C35:RC[-1]) -> 7845
B22: =RC[5]&R1C6&RC[6]&R1C6&RC[7]&R1C6 -> 0,1,7,6000;0,1,8,1000;0,1,4,6500; | D22: =VLOOKUP(ROUND(RC[1],-2),Sheet3!C23:C24,2,TRUE) -> 14 | E22: =Sheet3!R[2]C[11] -> 7040 | F22: 0 | G22: 0,1,7,6000 | H22: ="0,1,8,"&RC[24] -> 0,1,8,1000 | I22: ="0,1,4,"&RC[18] -> 0,1,4,6500 | U22: 0,1,4,600 | X22: 20 | Y22: =MID(RC[-4],7,99)*1 -> 600 | AA22: 6500 | AE22: 85 | AF22: 1000 | AH22: 19 | AI22: 1328 | AJ22: =SUM(R3C35:RC[-1]) -> 9173
B23: =RC[5]&R1C6&RC[6]&R1C6&RC[7]&R1C6 -> 0,1,7,6000;0,1,8,1000;0,1,4,7000; | D23: =VLOOKUP(ROUND(RC[1],-2),Sheet3!C23:C24,2,TRUE) -> 14 | E23: =Sheet3!R[2]C[11] -> 7540 | F23: 0 | G23: 0,1,7,6000 | H23: ="0,1,8,"&RC[24] -> 0,1,8,1000 | I23: ="0,1,4,"&RC[18] -> 0,1,4,7000 | U23: 0,1,4,600 | X23: 21 | Y23: =MID(RC[-4],7,99)*1 -> 600 | AA23: 7000 | AE23: 85 | AF23: 1000 | AH23: 20 | AI23: 1493 | AJ23: =SUM(R3C35:RC[-1]) -> 10666
B24: =RC[5]&R1C6&RC[6]&R1C6&RC[7]&R1C6 -> 0,1,7,18000;0,1,8,1000;0,1,4,7500; | D24: =VLOOKUP(ROUND(RC[1],-2),Sheet3!C23:C24,2,TRUE) -> 15 | E24: =Sheet3!R[2]C[11] -> 9140 | F24: 0 | G24: 0,1,7,18000 | H24: ="0,1,8,"&RC[24] -> 0,1,8,1000 | I24: ="0,1,4,"&RC[18] -> 0,1,4,7500 | U24: 0,1,4,600 | X24: 22 | Y24: =MID(RC[-4],7,99)*1 -> 600 | AA24: 7500 | AE24: 85 | AF24: 1000 | AH24: 21 | AI24: 1668 | AJ24: =SUM(R3C35:RC[-1]) -> 12334
B25: =RC[5]&R1C6&RC[6]&R1C6&RC[7]&R1C6 -> 0,1,7,6000;0,1,8,1000;0,1,4,8000; | D25: =VLOOKUP(ROUND(RC[1],-2),Sheet3!C23:C24,2,TRUE) -> 15 | E25: =Sheet3!R[2]C[11] -> 9740 | F25: 0 | G25: 0,1,7,6000 | H25: ="0,1,8,"&RC[24] -> 0,1,8,1000 | I25: ="0,1,4,"&RC[18] -> 0,1,4,8000 | U25: 0,1,4,3200 | X25: 23 | Y25: =MID(RC[-4],7,99)*1 -> 3200 | AA25: 8000 | AE25: 800 | AF25: 1000 | AH25: 22 | AI25: 1851 | AJ25: =SUM(R3C35:RC[-1]) -> 14185
B26: =RC[5]&R1C6&RC[6]&R1C6&RC[7]&R1C6 -> 0,1,7,6000;0,1,8,1000;0,1,4,8500; | D26: =VLOOKUP(ROUND(RC[1],-2),Sheet3!C23:C24,2,TRUE) -> 15 | E26: =Sheet3!R[2]C[11] -> 10440 | F26: 0 | G26: 0,1,7,6000 | H26: ="0,1,8,"&RC[24] -> 0,1,8,1000 | I26: ="0,1,4,"&RC[18] -> 0,1,4,8500 | U26: 0,1,4,600 | X26: 24 | Y26: =MID(RC[-4],7,99)*1 -> 600 | AA26: 8500 | AE26: 150 | AF26: 1000 | AH26: 23 | AI26: 2041 | AJ26: =SUM(R3C35:RC[-1]) -> 16226
B27: =RC[5]&R1C6&RC[6]&R1C6&RC[7]&R1C6 -> 0,1,7,6000;0,1,8,1000;0,1,4,9000; | D27: =VLOOKUP(ROUND(RC[1],-2),Sheet3!C23:C24,2,TRUE) -> 16 | E27: =Sheet3!R[2]C[11] -> 11240 | F27: 0 | G27: 0,1,7,6000 | H27: ="0,1,8,"&RC[24] -> 0,1,8,1000 | I27: ="0,1,4,"&RC[18] -> 0,1,4,9000 | U27: 0,1,4,1000 | X27: 25 | Y27: =MID(RC[-4],7,99)*1 -> 1000 | AA27: 9000 | AE27: 400 | AF27: 1000 | AH27: 24 | AI27: 2239 | AJ27: =SUM(R3C35:RC[-1]) -> 18465
B28: =RC[5]&R1C6&RC[6]&R1C6&RC[7]&R1C6 -> 0,1,7,6000;0,1,8,1000;0,1,4,9500; | D28: =VLOOKUP(ROUND(RC[1],-2),Sheet3!C23:C24,2,TRUE) -> 16 | E28: =Sheet3!R[2]C[11] -> 12040 | F28: 0 | G28: 0,1,7,6000 | H28: ="0,1,8,"&RC[24] -> 0,1,8,1000 | I28: ="0,1,4,"&RC[18] -> 0,1,4,9500 | U28: 0,1,4,1000 | X28: 26 | Y28: =MID(RC[-4],7,99)*1 -> 1000 | AA28: 9500 | AE28: 400 | AF28: 1000 | AH28: 25 | AI28: 2442 | AJ28: =SUM(R3C35:RC[-1]) -> 20907
B29: =RC[5]&R1C6&RC[6]&R1C6&RC[7]&R1C6 -> 0,1,7,18000;0,1,8,1000;0,1,4,10000; | D29: =VLOOKUP(ROUND(RC[1],-2),Sheet3!C23:C24,2,TRUE) -> 17 | E29: =Sheet3!R[2]C[11] -> 14940 | F29: 0 | G29: 0,1,7,18000 | H29: ="0,1,8,"&RC[24] -> 0,1,8,1000 | I29: ="0,1,4,"&RC[18] -> 0,1,4,10000 | U29: 0,1,4,1000 | X29: 27 | Y29: =MID(RC[-4],7,99)*1 -> 1000 | AA29: 10000 | AE29: 400 | AF29: 1000 | AH29: 26 | AI29: 2652 | AJ29: =SUM(R3C35:RC[-1]) -> 23559
B30: =RC[5]&R1C6&RC[6]&R1C6&RC[7]&R1C6 -> 0,1,7,6000;0,1,8,1000;0,1,4,11000; | D30: =VLOOKUP(ROUND(RC[1],-2),Sheet3!C23:C24,2,TRUE) -> 17 | E30: =Sheet3!R[2]C[11] -> 15940 | F30: 0 | G30: 0,1,7,6000 | H30: ="0,1,8,"&RC[24] -> 0,1,8,1000 | I30: ="0,1,4,"&RC[18] -> 0,1,4,11000 | U30: 0,1,4,26000 | X30: 28 | Y30: =MID(RC[-4],7,99)*1 -> 26000 | AA30: 11000 | AE30: 2000 | AF30: 1000 | AH30: 27 | AI30: 2866 | AJ30: =SUM(R3C35:RC[-1]) -> 26425
B31: =RC[5]&R1C6&RC[6]&R1C6&RC[7]&R1C6 -> 0,1,7,6000;0,1,8,1000;0,1,4,12000; | D31: =VLOOKUP(ROUND(RC[1],-2),Sheet3!C23:C24,2,TRUE) -> 18 | E31: =Sheet3!R[2]C[11] -> 16940 | F31: 0 | G31: 0,1,7,6000 | H31: ="0,1,8,"&RC[24] -> 0,1,8,1000 | I31: ="0,1,4,"&RC[18] -> 0,1,4,12000 | U31: 0,1,4,1000 | X31: 29 | Y31: =MID(RC[-4],7,99)*1 -> 1000 | AA31: 12000 | AE31: 400 | AF31: 1000 | AH31: 28 | AI31: 3086 | AJ31: =SUM(R3C35:RC[-1]) -> 29511
B32: =RC[5]&R1C6&RC[6]&R1C6&RC[7]&R1C6 -> 0,1,7,6000;0,1,8,1000;0,1,4,13000; | D32: =VLOOKUP(ROUND(RC[1],-2),Sheet3!C23:C24,2,TRUE) -> 18 | E32: =Sheet3!R[2]C[11] -> 18040 | F32: 0 | G32: 0,1,7,6000 | H32: ="0,1,8,"&RC[24] -> 0,1,8,1000 | I32: ="0,1,4,"&RC[18] -> 0,1,4,13000 | U32: 0,1,4,1000 | X32: 30 | Y32: =MID(RC[-4],7,99)*1 -> 1000 | AA32: 13000 | AE32: 400 | AF32: 1000 | AH32: 29 | AI32: 3309 | AJ32: =SUM(R3C35:RC[-1]) -> 32820
B33: =RC[5]&R1C6&RC[6]&R1C6&RC[7]&R1C6 -> 0,1,7,6000;0,1,8,1000;0,1,4,14000; | D33: =VLOOKUP(ROUND(RC[1],-2),Sheet3!C23:C24,2,TRUE) -> 18 | E33: =Sheet3!R[2]C[11] -> 19240 | F33: 0 | G33: 0,1,7,6000 | H33: ="0,1,8,"&RC[24] -> 0,1,8,1000 | I33: ="0,1,4,"&RC[18] -> 0,1,4,14000 | U33: 0,1,4,1000 | X33: 31 | Y33: =MID(RC[-4],7,99)*1 -> 1000 | AA33: 14000 | AE33: 400 | AF33: 1000 | AH33: 30 | AI33: 3537 | AJ33: =SUM(R3C35:RC[-1]) -> 36357
B34: =RC[5]&R1C6&RC[6]&R1C6&RC[7]&R1C6 -> 0,1,7,18000;0,1,8,1100;0,1,4,15000; | D34: =VLOOKUP(ROUND(RC[1],-2),Sheet3!C23:C24,2,TRUE) -> 19 | E34: =Sheet3!R[2]C[11] -> 22540 | F34: 0 | G34: 0,1,7,18000 | H34: ="0,1,8,"&RC[24] -> 0,1,8,1100 | I34: ="0,1,4,"&RC[18] -> 0,1,4,15000 | U34: 0,1,4,1200 | X34: 32 | Y34: =MID(RC[-4],7,99)*1 -> 1200 | AA34: 15000 | AE34: 450 | AF34: 1100 | AH34: 31 | AI34: 3768 | AJ34: =SUM(R3C35:RC[-1]) -> 40125
B35: =RC[5]&R1C6&RC[6]&R1C6&RC[7]&R1C6&RC[8]&R1C6&RC[9]&R1C6&RC[10]&R1C6&RC[11]&R1C6&RC[12]&R1C6&RC[13]&R1C6&RC[14]&R1C6&RC[15]&R1C6&RC[16]&R1C6&RC[17]&R1C6 -> 0,1,7,6000;0,1,8,1200;0,1,4,16000;1,1,1200102,1;2,1,1200202,1;3,1,1200102,1;4,1,1200202,1;5,1,1200102,1;6,1,1200202,1;7,1,1200102,1;8,1,1200202,1;9,1,1200102,1;10,1,1200202,1; | D35: =VLOOKUP(ROUND(RC[1],-2),Sheet3!C23:C24,2,TRUE) -> 19 | E35: =Sheet3!R[2]C[11] -> 23940 | F35: 20 | G35: 0,1,7,6000 | H35: ="0,1,8,"&RC[24] -> 0,1,8,1200 | I35: ="0,1,4,"&RC[18] -> 0,1,4,16000 | J35: 1,1,1200102,1 | K35: 2,1,1200202,1 | L35: 3,1,1200102,1 | M35: 4,1,1200202,1 | N35: 5,1,1200102,1 | O35: 6,1,1200202,1 | P35: 7,1,1200102,1 | Q35: 8,1,1200202,1 | R35: 9,1,1200102,1 | S35: 10,1,1200202,1 | U35: 0,1,4,900 | X35: 33 | Y35: =MID(RC[-4],7,99)*1 -> 900 | AA35: 16000 | AE35: 450 | AF35: 1200 | AH35: 32 | AI35: 4002 | AJ35: =SUM(R3C35:RC[-1]) -> 44127
B36: =RC[5]&R1C6&RC[6]&R1C6&RC[7]&R1C6&RC[8]&R1C6 -> 0,1,7,6000;0,1,8,1300;0,1,4,17000;0,1,1500002,1; | D36: =VLOOKUP(ROUND(RC[1],-2),Sheet3!C23:C24,2,TRUE) -> 20 | E36: =Sheet3!R[2]C[11] -> 25440 | F36: 20 | G36: 0,1,7,6000 | H36: ="0,1,8,"&RC[24] -> 0,1,8,1300 | I36: ="0,1,4,"&RC[18] -> 0,1,4,17000 | J36: 0,1,1500002,1 | U36: 0,1,4,19500 | X36: 34 | Y36: =MID(RC[-4],7,99)*1 -> 19500 | AA36: 17000 | AE36: 1500 | AF36: 1300 | AH36: 33 | AI36: 4240 | AJ36: =SUM(R3C35:RC[-1]) -> 48367
B37: =RC[5]&R1C6&RC[6]&R1C6&RC[7]&R1C6&RC[8]&R1C6&RC[9]&R1C6&RC[10]&R1C6&RC[11]&R1C6&RC[12]&R1C6&RC[13]&R1C6&RC[14]&R1C6&RC[15]&R1C6&RC[16]&R1C6&RC[17]&R1C6 -> 0,1,7,6000;0,1,8,1400;0,1,4,18000;1,1,1300102,1;2,1,1300202,1;3,1,1300102,1;4,1,1300202,1;5,1,1300102,1;6,1,1300202,1;7,1,1300102,1;8,1,1300202,1;9,1,1300102,1;10,1,1300202,1; | D37: =VLOOKUP(ROUND(RC[1],-2),Sheet3!C23:C24,2,TRUE) -> 20 | E37: =Sheet3!R[2]C[11] -> 27040 | F37: 20 | G37: 0,1,7,6000 | H37: ="0,1,8,"&RC[24] -> 0,1,8,1400 | I37: ="0,1,4,"&RC[18] -> 0,1,4,18000 | J37: 1,1,1300102,1 | K37: 2,1,1300202,1 | L37: 3,1,1300102,1 | M37: 4,1,1300202,1 | N37: 5,1,1300102,1 | O37: 6,1,1300202,1 | P37: 7,1,1300102,1 | Q37: 8,1,1300202,1 | R37: 9,1,1300102,1 | S37: 10,1,1300202,1 | U37: 0,1,4,900 | X37: 35 | Y37: =MID(RC[-4],7,99)*1 -> 900 | AA37: 18000 | AE37: 450 | AF37: 1400 | AH37: 34 | AI37: 4480 | AJ37: =SUM(R3C35:RC[-1]) -> 52847
B38: =RC[5]&R1C6&RC[6]&R1C6&RC[7]&R1C6&RC[8]&R1C6&RC[9]&R1C6&RC[10]&R1C6&RC[11]&R1C6&RC[12]&R1C6&RC[13]&R1C6&RC[14]&R1C6&RC[15]&R1C6&RC[16]&R1C6&RC[17]&R1C6 -> 0,1,7,6000;0,1,8,1500;0,1,4,19000;1,1,1101102,1;2,1,1101202,1;3,1,1102102,1;4,1,1102202,1;5,1,1103102,1;6,1,1103202,1;7,1,1104102,1;8,1,1104202,1;9,1,1105102,1;10,1,1105202,1; | D38: =VLOOKUP(ROUND(RC[1],-2),Sheet3!C23:C24,2,TRUE) -> 20 | E38: =Sheet3!R[2]C[11] -> 28640 | F38: 20 | G38: 0,1,7,6000 | H38: ="0,1,8,"&RC[24] -> 0,1,8,1500 | I38: ="0,1,4,"&RC[18] -> 0,1,4,19000 | J38: 1,1,1101102,1 | K38: 2,1,1101202,1 | L38: 3,1,1102102,1 | M38: 4,1,1102202,1 | N38: 5,1,1103102,1 | O38: 6,1,1103202,1 | P38: 7,1,1104102,1 | Q38: 8,1,1104202,1 | R38: 9,1,1105102,1 | S38: 10,1,1105202,1 | U38: 0,1,4,900 | X38: 36 | Y38: =MID(RC[-4],7,99)*1 -> 900 | AA38: 19000 | AE38: 450 | AF38: 1500 | AH38: 35 | AI38: 4722 | AJ38: =SUM(R3C35:RC[-1]) -> 57569
B39: =RC[5]&R1C6&RC[6]&R1C6&RC[7]&R1C6&RC[8]&R1C6 -> 0,1,7,18000;0,1,8,1600;0,1,4,20000;0,1,1400002,1; | D39: =VLOOKUP(ROUND(RC[1],-2),Sheet3!C23:C24,2,TRUE) -> 21 | E39: =Sheet3!R[2]C[11] -> 33340 | F39: 20 | G39: 0,1,7,18000 | H39: ="0,1,8,"&RC[24] -> 0,1,8,1600 | I39: ="0,1,4,"&RC[18] -> 0,1,4,20000 | J39: 0,1,1400002,1 | U39: 0,1,4,900 | X39: 37 | Y39: =MID(RC[-4],7,99)*1 -> 900 | AA39: 20000 | AE39: 450 | AF39: 1600 | AH39: 36 | AI39: 4967 | AJ39: =SUM(R3C35:RC[-1]) -> 62536
B40: =RC[5]&R1C6&RC[6]&R1C6&RC[7]&R1C6 -> 0,1,7,6000;0,1,8,1700;0,1,4,22000; | D40: =VLOOKUP(ROUND(RC[1],-2),Sheet3!C23:C24,2,TRUE) -> 21 | E40: =Sheet3!R[2]C[11] -> 35140 | F40: 20 | G40: 0,1,7,6000 | H40: ="0,1,8,"&RC[24] -> 0,1,8,1700 | I40: ="0,1,4,"&RC[18] -> 0,1,4,22000 | U40: 0,1,4,900 | X40: 38 | Y40: =MID(RC[-4],7,99)*1 -> 900 | AA40: 22000 | AE40: 450 | AF40: 1700 | AH40: 37 | AI40: 5213 | AJ40: =SUM(R3C35:RC[-1]) -> 67749
B41: =RC[5]&R1C6&RC[6]&R1C6&RC[7]&R1C6 -> 0,1,7,6000;0,1,8,1800;0,1,4,24000; | D41: =VLOOKUP(ROUND(RC[1],-2),Sheet3!C23:C24,2,TRUE) -> 22 | E41: =Sheet3!R[2]C[11] -> 37040 | F41: 20 | G41: 0,1,7,6000 | H41: ="0,1,8,"&RC[24] -> 0,1,8,1800 | I41: ="0,1,4,"&RC[18] -> 0,1,4,24000 | U41: 0,1,4,19500 | X41: 39 | Y41: =MID(RC[-4],7,99)*1 -> 19500 | AA41: 24000 | AE41: 3000 | AF41: 1800 | AH41: 38 | AI41: 5461 | AJ41: =SUM(R3C35:RC[-1]) -> 73210
B42: =RC[5]&R1C6&RC[6]&R1C6&RC[7]&R1C6 -> 0,1,7,6000;0,1,8,1900;0,1,4,26000; | D42: =VLOOKUP(ROUND(RC[1],-2),Sheet3!C23:C24,2,TRUE) -> 22 | E42: =Sheet3!R[2]C[11] -> 39140 | F42: 20 | G42: 0,1,7,6000 | H42: ="0,1,8,"&RC[24] -> 0,1,8,1900 | I42: ="0,1,4,"&RC[18] -> 0,1,4,26000 | U42: 0,1,4,900 | X42: 40 | Y42: =MID(RC[-4],7,99)*1 -> 900 | AA42: 26000 | AE42: 450 | AF42: 1900 | AH42: 39 | AI42: 12564 | AJ42: =SUM(R3C35:RC[-1]) -> 85774
B43: =RC[5]&R1C6&RC[6]&R1C6&RC[7]&R1C6 -> 0,1,7,6000;0,1,8,2000;0,1,4,28000; | D43: =VLOOKUP(ROUND(RC[1],-2),Sheet3!C23:C24,2,TRUE) -> 22 | E43: =Sheet3!R[2]C[11] -> 41140 | F43: 20 | G43: 0,1,7,6000 | H43: ="0,1,8,"&RC[24] -> 0,1,8,2000 | I43: ="0,1,4,"&RC[18] -> 0,1,4,28000 | U43: 0,1,4,19500 | X43: 41 | Y43: =MID(RC[-4],7,99)*1 -> 19500 | AA43: 28000 | AE43: 5250 | AF43: 2000 | AH43: 40 | AI43: 14309 | AJ43: =SUM(R3C35:RC[-1]) -> 100083
B44: =RC[5]&R1C6&RC[6]&R1C6&RC[7]&R1C6 -> 0,1,7,18000;0,1,8,2150;0,1,4,30000; | D44: =VLOOKUP(ROUND(RC[1],-2),Sheet3!C23:C24,2,TRUE) -> 23 | E44: =Sheet3!R[2]C[11] -> 47140 | F44: 20 | G44: 0,1,7,18000 | H44: ="0,1,8,"&RC[24] -> 0,1,8,2150 | I44: ="0,1,4,"&RC[18] -> 0,1,4,30000 | U44: 0,1,4,900 | X44: 42 | Y44: =MID(RC[-4],7,99)*1 -> 900 | AA44: 30000 | AE44: 450 | AF44: 2150 | AH44: 41 | AI44: 16159 | AJ44: =SUM(R3C35:RC[-1]) -> 116242
B45: =RC[5]&R1C6&RC[6]&R1C6&RC[7]&R1C6 -> 0,1,7,6000;0,1,8,2300;0,1,4,32000; | D45: =VLOOKUP(ROUND(RC[1],-2),Sheet3!C23:C24,2,TRUE) -> 23 | E45: =Sheet3!R[2]C[11] -> 49140 | F45: 20 | G45: 0,1,7,6000 | H45: ="0,1,8,"&RC[24] -> 0,1,8,2300 | I45: ="0,1,4,"&RC[18] -> 0,1,4,32000 | U45: 0,1,4,900 | X45: 43 | Y45: =MID(RC[-4],7,99)*1 -> 900 | AA45: 32000 | AE45: 450 | AF45: 2300 | AH45: 42 | AI45: 18112 | AJ45: =SUM(R3C35:RC[-1]) -> 134354
B46: =RC[5]&R1C6&RC[6]&R1C6&RC[7]&R1C6 -> 0,1,7,6000;0,1,8,2450;0,1,4,34000; | D46: =VLOOKUP(ROUND(RC[1],-2),Sheet3!C23:C24,2,TRUE) -> 23 | E46: =Sheet3!R[2]C[11] -> 51140 | F46: 20 | G46: 0,1,7,6000 | H46: ="0,1,8,"&RC[24] -> 0,1,8,2450 | I46: ="0,1,4,"&RC[18] -> 0,1,4,34000 | U46: 0,1,4,1125 | X46: 44 | Y46: =MID(RC[-4],7,99)*1 -> 1125 | AA46: 34000 | AE46: 1500 | AF46: 2450 | AH46: 43 | AI46: 20170 | AJ46: =SUM(R3C35:RC[-1]) -> 154524
B47: =RC[5]&R1C6&RC[6]&R1C6&RC[7]&R1C6 -> 0,1,7,6000;0,1,8,2600;0,1,4,36000; | D47: =VLOOKUP(ROUND(RC[1],-2),Sheet3!C23:C24,2,TRUE) -> 24 | E47: =Sheet3!R[2]C[11] -> 54140 | F47: 20 | G47: 0,1,7,6000 | H47: ="0,1,8,"&RC[24] -> 0,1,8,2600 | I47: ="0,1,4,"&RC[18] -> 0,1,4,36000 | U47: 0,1,4,900 | X47: 45 | Y47: =MID(RC[-4],7,99)*1 -> 900 | AA47: 36000 | AE47: 450 | AF47: 2600 | AH47: 44 | AI47: 22333 | AJ47: =SUM(R3C35:RC[-1]) -> 176857
B48: =RC[5]&R1C6&RC[6]&R1C6&RC[7]&R1C6 -> 0,1,7,6000;0,1,8,2750;0,1,4,38000; | D48: =VLOOKUP(ROUND(RC[1],-2),Sheet3!C23:C24,2,TRUE) -> 24 | E48: =Sheet3!R[2]C[11] -> 57140 | F48: 20 | G48: 0,1,7,6000 | H48: ="0,1,8,"&RC[24] -> 0,1,8,2750 | I48: ="0,1,4,"&RC[18] -> 0,1,4,38000 | U48: 0,1,4,900 | X48: 46 | Y48: =MID(RC[-4],7,99)*1 -> 900 | AA48: 38000 | AE48: 450 | AF48: 2750 | AH48: 45 | AI48: 24602 | AJ48: =SUM(R3C35:RC[-1]) -> 201459
B49: =RC[5]&R1C6&RC[6]&R1C6&RC[7]&R1C6 -> 0,1,7,18000;0,1,8,2900;0,1,4,40000; | D49: =VLOOKUP(ROUND(RC[1],-2),Sheet3!C23:C24,2,TRUE) -> 25 | E49: =Sheet3!R[2]C[11] -> 66140 | F49: 20 | G49: 0,1,7,18000 | H49: ="0,1,8,"&RC[24] -> 0,1,8,2900 | I49: ="0,1,4,"&RC[18] -> 0,1,4,40000 | U49: 0,1,4,1400 | X49: 47 | Y49: =MID(RC[-4],7,99)*1 -> 1400 | AA49: 40000 | AE49: 500 | AF49: 2900 | AH49: 46 | AI49: 26976 | AJ49: =SUM(R3C35:RC[-1]) -> 228435
B50: =RC[5]&R1C6&RC[6]&R1C6&RC[7]&R1C6 -> 0,1,7,6000;0,1,8,3050;0,1,4,42000; | D50: =VLOOKUP(ROUND(RC[1],-2),Sheet3!C23:C24,2,TRUE) -> 25 | E50: =Sheet3!R[2]C[11] -> 69140 | F50: 20 | G50: 0,1,7,6000 | H50: ="0,1,8,"&RC[24] -> 0,1,8,3050 | I50: ="0,1,4,"&RC[18] -> 0,1,4,42000 | U50: 0,1,4,19500 | X50: 48 | Y50: =MID(RC[-4],7,99)*1 -> 19500 | AA50: 42000 | AE50: 9000 | AF50: 3050 | AH50: 47 | AI50: 29456 | AJ50: =SUM(R3C35:RC[-1]) -> 257891
B51: =RC[5]&R1C6&RC[6]&R1C6&RC[7]&R1C6 -> 0,1,7,6000;0,1,8,3200;0,1,4,44000; | D51: =VLOOKUP(ROUND(RC[1],-2),Sheet3!C23:C24,2,TRUE) -> 25 | E51: =Sheet3!R[2]C[11] -> 72140 | F51: 20 | G51: 0,1,7,6000 | H51: ="0,1,8,"&RC[24] -> 0,1,8,3200 | I51: ="0,1,4,"&RC[18] -> 0,1,4,44000 | U51: 0,1,4,1400 | X51: 49 | Y51: =MID(RC[-4],7,99)*1 -> 1400 | AA51: 44000 | AE51: 500 | AF51: 3200 | AH51: 48 | AI51: 32041 | AJ51: =SUM(R3C35:RC[-1]) -> 289932
B52: =RC[5]&R1C6&RC[6]&R1C6&RC[7]&R1C6 -> 0,1,7,6000;0,1,8,3350;0,1,4,46000; | D52: =VLOOKUP(ROUND(RC[1],-2),Sheet3!C23:C24,2,TRUE) -> 26 | E52: =Sheet3!R[2]C[11] -> 75140 | F52: 20 | G52: 0,1,7,6000 | H52: ="0,1,8,"&RC[24] -> 0,1,8,3350 | I52: ="0,1,4,"&RC[18] -> 0,1,4,46000 | U52: 0,1,4,1400 | X52: 50 | Y52: =MID(RC[-4],7,99)*1 -> 1400 | AA52: 46000 | AE52: 500 | AF52: 3350 | AH52: 49 | AI52: 34733 | AJ52: =SUM(R3C35:RC[-1]) -> 324665
B53: =RC[5]&R1C6&RC[6]&R1C6&RC[7]&R1C6&RC[8]&R1C6&RC[9]&R1C6&RC[10]&R1C6&RC[11]&R1C6&RC[12]&R1C6&RC[13]&R1C6&RC[14]&R1C6&RC[15]&R1C6&RC[16]&R1C6&RC[17]&R1C6 -> 0,1,7,7000;0,1,8,3500;0,1,4,48000;1,1,1200103,1;2,1,1200203,1;3,1,1200103,1;4,1,1200203,1;5,1,1200103,1;6,1,1200203,1;7,1,1200103,1;8,1,1200203,1;9,1,1200103,1;10,1,1200203,1; | D53: =VLOOKUP(ROUND(RC[1],-2),Sheet3!C23:C24,2,TRUE) -> 26 | E53: =Sheet3!R[2]C[11] -> 78140 | F53: 30 | G53: 0,1,7,7000 | H53: ="0,1,8,"&RC[24] -> 0,1,8,3500 | I53: ="0,1,4,"&RC[18] -> 0,1,4,48000 | J53: 1,1,1200103,1 | K53: 2,1,1200203,1 | L53: 3,1,1200103,1 | M53: 4,1,1200203,1 | N53: 5,1,1200103,1 | O53: 6,1,1200203,1 | P53: 7,1,1200103,1 | Q53: 8,1,1200203,1 | R53: 9,1,1200103,1 | S53: 10,1,1200203,1 | U53: 0,1,4,1400 | X53: 51 | Y53: =MID(RC[-4],7,99)*1 -> 1400 | AA53: 48000 | AE53: 500 | AF53: 3500 | AH53: 50 | AI53: 37530 | AJ53: =SUM(R3C35:RC[-1]) -> 362195
B54: =RC[5]&R1C6&RC[6]&R1C6&RC[7]&R1C6&RC[8]&R1C6 -> 0,1,7,21000;0,1,8,3650;0,1,4,50000;0,1,1500003,1; | D54: =VLOOKUP(ROUND(RC[1],-2),Sheet3!C23:C24,2,TRUE) -> 27 | E54: =Sheet3!R[2]C[11] -> 89140 | F54: 30 | G54: 0,1,7,21000 | H54: ="0,1,8,"&RC[24] -> 0,1,8,3650 | I54: ="0,1,4,"&RC[18] -> 0,1,4,50000 | J54: 0,1,1500003,1 | U54: 0,1,4,1400 | X54: 52 | Y54: =MID(RC[-4],7,99)*1 -> 1400 | AA54: 50000 | AE54: 500 | AF54: 3650 | AH54: 51 | AI54: 40434 | AJ54: =SUM(R3C35:RC[-1]) -> 402629
B55: =RC[5]&R1C6&RC[6]&R1C6&RC[7]&R1C6&RC[8]&R1C6&RC[9]&R1C6&RC[10]&R1C6&RC[11]&R1C6&RC[12]&R1C6&RC[13]&R1C6&RC[14]&R1C6&RC[15]&R1C6&RC[16]&R1C6&RC[17]&R1C6 -> 0,1,7,7000;0,1,8,3800;0,1,4,52000;1,1,1300103,1;2,1,1300203,1;3,1,1300103,1;4,1,1300203,1;5,1,1300103,1;6,1,1300203,1;7,1,1300103,1;8,1,1300203,1;9,1,1300103,1;10,1,1300203,1; | D55: =VLOOKUP(ROUND(RC[1],-2),Sheet3!C23:C24,2,TRUE) -> 27 | E55: =Sheet3!R[2]C[11] -> 93140 | F55: 30 | G55: 0,1,7,7000 | H55: ="0,1,8,"&RC[24] -> 0,1,8,3800 | I55: ="0,1,4,"&RC[18] -> 0,1,4,52000 | J55: 1,1,1300103,1 | K55: 2,1,1300203,1 | L55: 3,1,1300103,1 | M55: 4,1,1300203,1 | N55: 5,1,1300103,1 | O55: 6,1,1300203,1 | P55: 7,1,1300103,1 | Q55: 8,1,1300203,1 | R55: 9,1,1300103,1 | S55: 10,1,1300203,1 | U55: 0,1,4,1400 | X55: 53 | Y55: =MID(RC[-4],7,99)*1 -> 1400 | AA55: 52000 | AE55: 500 | AF55: 3800 | AH55: 52 | AI55: 43444 | AJ55: =SUM(R3C35:RC[-1]) -> 446073
B56: =RC[5]&R1C6&RC[6]&R1C6&RC[7]&R1C6&RC[8]&R1C6&RC[9]&R1C6&RC[10]&R1C6&RC[11]&R1C6&RC[12]&R1C6&RC[13]&R1C6&RC[14]&R1C6&RC[15]&R1C6&RC[16]&R1C6&RC[17]&R1C6 -> 0,1,7,7000;0,1,8,3950;0,1,4,54000;1,1,1101103,1;2,1,1101203,1;3,1,1102103,1;4,1,1102203,1;5,1,1103103,1;6,1,1103203,1;7,1,1104103,1;8,1,1104203,1;9,1,1105103,1;10,1,1105203,1; | D56: =VLOOKUP(ROUND(RC[1],-2),Sheet3!C23:C24,2,TRUE) -> 27 | E56: =Sheet3!R[2]C[11] -> 97140 | F56: 30 | G56: 0,1,7,7000 | H56: ="0,1,8,"&RC[24] -> 0,1,8,3950 | I56: ="0,1,4,"&RC[18] -> 0,1,4,54000 | J56: 1,1,1101103,1 | K56: 2,1,1101203,1 | L56: 3,1,1102103,1 | M56: 4,1,1102203,1 | N56: 5,1,1103103,1 | O56: 6,1,1103203,1 | P56: 7,1,1104103,1 | Q56: 8,1,1104203,1 | R56: 9,1,1105103,1 | S56: 10,1,1105203,1 | U56: 0,1,4,1400 | X56: 54 | Y56: =MID(RC[-4],7,99)*1 -> 1400 | AA56: 54000 | AE56: 500 | AF56: 3950 | AH56: 53 | AI56: 46560 | AJ56: =SUM(R3C35:RC[-1]) -> 492633
B57: =RC[5]&R1C6&RC[6]&R1C6&RC[7]&R1C6&RC[8]&R1C6 -> 0,1,7,7000;0,1,8,4100;0,1,4,56000;0,1,1400003,1; | D57: =VLOOKUP(ROUND(RC[1],-2),Sheet3!C23:C24,2,TRUE) -> 27 | E57: =Sheet3!R[2]C[11] -> 101140 | F57: 30 | G57: 0,1,7,7000 | H57: ="0,1,8,"&RC[24] -> 0,1,8,4100 | I57: ="0,1,4,"&RC[18] -> 0,1,4,56000 | J57: 0,1,1400003,1 | U57: 0,1,4,1400 | X57: 55 | Y57: =MID(RC[-4],7,99)*1 -> 1400 | AA57: 56000 | AE57: 500 | AF57: 4100 | AH57: 54 | AI57: 49783 | AJ57: =SUM(R3C35:RC[-1]) -> 542416
B58: =RC[5]&R1C6&RC[6]&R1C6&RC[7]&R1C6&RC[8]&R1C6 -> 0,1,7,7000;0,1,8,4250;0,1,4,58000;0,1,1600003,1; | D58: =VLOOKUP(ROUND(RC[1],-2),Sheet3!C23:C24,2,TRUE) -> 28 | E58: =Sheet3!R[2]C[11] -> 105140 | F58: 30 | G58: 0,1,7,7000 | H58: ="0,1,8,"&RC[24] -> 0,1,8,4250 | I58: ="0,1,4,"&RC[18] -> 0,1,4,58000 | J58: 0,1,1600003,1 | U58: 0,1,4,1400 | X58: 56 | Y58: =MID(RC[-4],7,99)*1 -> 1400 | AA58: 58000 | AE58: 500 | AF58: 4250 | AH58: 55 | AI58: 53111 | AJ58: =SUM(R3C35:RC[-1]) -> 595527
B59: =RC[5]&R1C6&RC[6]&R1C6&RC[7]&R1C6&RC[8]&R1C6 -> 0,1,7,21000;0,1,8,4400;0,1,4,60000;0,1,28000,20; | D59: =VLOOKUP(ROUND(RC[1],-2),Sheet3!C23:C24,2,TRUE) -> 28 | E59: =Sheet3!R[2]C[11] -> 118140 | F59: 30 | G59: 0,1,7,21000 | H59: ="0,1,8,"&RC[24] -> 0,1,8,4400 | I59: ="0,1,4,"&RC[18] -> 0,1,4,60000 | J59: 0,1,28000,20 | U59: 0,1,4,1400 | X59: 57 | Y59: =MID(RC[-4],7,99)*1 -> 1400 | AA59: 60000 | AE59: 500 | AF59: 4400 | AH59: 56 | AI59: 56547 | AJ59: =SUM(R3C35:RC[-1]) -> 652074
B60: =RC[5]&R1C6&RC[6]&R1C6&RC[7]&R1C6 -> 0,1,7,7000;0,1,8,4550;0,1,4,62000; | D60: =VLOOKUP(ROUND(RC[1],-2),Sheet3!C23:C24,2,TRUE) -> 29 | E60: =Sheet3!R[2]C[11] -> 122140 | F60: 30 | G60: 0,1,7,7000 | H60: ="0,1,8,"&RC[24] -> 0,1,8,4550 | I60: ="0,1,4,"&RC[18] -> 0,1,4,62000 | U60: 0,1,4,1800 | X60: 58 | Y60: =MID(RC[-4],7,99)*1 -> 1800 | AA60: 62000 | AE60: 600 | AF60: 4550 | AH60: 57 | AI60: 60088 | AJ60: =SUM(R3C35:RC[-1]) -> 712162
B61: =RC[5]&R1C6&RC[6]&R1C6&RC[7]&R1C6 -> 0,1,7,7000;0,1,8,4700;0,1,4,64000; | D61: =VLOOKUP(ROUND(RC[1],-2),Sheet3!C23:C24,2,TRUE) -> 29 | E61: =Sheet3!R[2]C[11] -> 127140 | F61: 30 | G61: 0,1,7,7000 | H61: ="0,1,8,"&RC[24] -> 0,1,8,4700 | I61: ="0,1,4,"&RC[18] -> 0,1,4,64000 | U61: 0,1,4,1800 | X61: 59 | Y61: =MID(RC[-4],7,99)*1 -> 1800 | AA61: 64000 | AE61: 600 | AF61: 4700 | AH61: 58 | AI61: 63736 | AJ61: =SUM(R3C35:RC[-1]) -> 775898
B62: =RC[5]&R1C6&RC[6]&R1C6&RC[7]&R1C6 -> 0,1,7,7000;0,1,8,4850;0,1,4,66000; | D62: =VLOOKUP(ROUND(RC[1],-2),Sheet3!C23:C24,2,TRUE) -> 29 | E62: =Sheet3!R[2]C[11] -> 132140 | F62: 30 | G62: 0,1,7,7000 | H62: ="0,1,8,"&RC[24] -> 0,1,8,4850 | I62: ="0,1,4,"&RC[18] -> 0,1,4,66000 | U62: 0,1,4,41300 | X62: 60 | Y62: =MID(RC[-4],7,99)*1 -> 41300 | AA62: 66000 | AE62: 10000 | AF62: 4850 | AH62: 59 | AI62: 67490 | AJ62: =SUM(R3C35:RC[-1]) -> 843388
B63: =RC[5]&R1C6&RC[6]&R1C6&RC[7]&R1C6 -> 0,1,7,7000;0,1,8,5000;0,1,4,68000; | D63: =VLOOKUP(ROUND(RC[1],-2),Sheet3!C23:C24,2,TRUE) -> 29 | E63: =Sheet3!R[2]C[11] -> 137140 | F63: 30 | G63: 0,1,7,7000 | H63: ="0,1,8,"&RC[24] -> 0,1,8,5000 | I63: ="0,1,4,"&RC[18] -> 0,1,4,68000 | U63: 0,1,4,1800 | X63: 61 | Y63: =MID(RC[-4],7,99)*1 -> 1800 | AA63: 68000 | AE63: 600 | AF63: 5000 | AH63: 60 | AI63: 71351 | AJ63: =SUM(R3C35:RC[-1]) -> 914739
B64: =RC[5]&R1C6&RC[6]&R1C6&RC[7]&R1C6 -> 0,1,7,21000;0,1,8,5150;0,1,4,70000; | D64: =VLOOKUP(ROUND(RC[1],-2),Sheet3!C23:C24,2,TRUE) -> 30 | E64: =Sheet3!R[2]C[11] -> 152140 | F64: 30 | G64: 0,1,7,21000 | H64: ="0,1,8,"&RC[24] -> 0,1,8,5150 | I64: ="0,1,4,"&RC[18] -> 0,1,4,70000 | U64: 0,1,4,1800 | X64: 62 | Y64: =MID(RC[-4],7,99)*1 -> 1800 | AA64: 70000 | AE64: 600 | AF64: 5150 | AH64: 61 | AI64: 75317 | AJ64: =SUM(R3C35:RC[-1]) -> 990056
B65: =RC[5]&R1C6&RC[6]&R1C6&RC[7]&R1C6 -> 0,1,7,7000;0,1,8,5300;0,1,4,72000; | D65: =VLOOKUP(ROUND(RC[1],-2),Sheet3!C23:C24,2,TRUE) -> 30 | E65: =Sheet3!R[2]C[11] -> 157140 | F65: 30 | G65: 0,1,7,7000 | H65: ="0,1,8,"&RC[24] -> 0,1,8,5300 | I65: ="0,1,4,"&RC[18] -> 0,1,4,72000 | U65: 0,1,4,1800 | X65: 63 | Y65: =MID(RC[-4],7,99)*1 -> 1800 | AA65: 72000 | AE65: 600 | AF65: 5300 | AH65: 62 | AI65: 79390 | AJ65: =SUM(R3C35:RC[-1]) -> 1069446
B66: =RC[5]&R1C6&RC[6]&R1C6&RC[7]&R1C6 -> 0,1,7,7000;0,1,8,5450;0,1,4,74000; | D66: =VLOOKUP(ROUND(RC[1],-2),Sheet3!C23:C24,2,TRUE) -> 31 | E66: =Sheet3!R[2]C[11] -> 162140 | F66: 30 | G66: 0,1,7,7000 | H66: ="0,1,8,"&RC[24] -> 0,1,8,5450 | I66: ="0,1,4,"&RC[18] -> 0,1,4,74000 | U66: 0,1,4,46300 | X66: 64 | Y66: =MID(RC[-4],7,99)*1 -> 46300 | AA66: 74000 | AE66: 11400 | AF66: 5450 | AH66: 63 | AI66: 83569 | AJ66: =SUM(R3C35:RC[-1]) -> 1153015
B67: =RC[5]&R1C6&RC[6]&R1C6&RC[7]&R1C6 -> 0,1,7,7000;0,1,8,5600;0,1,4,76000; | D67: =VLOOKUP(ROUND(RC[1],-2),Sheet3!C23:C24,2,TRUE) -> 31 | E67: =Sheet3!R[2]C[11] -> 168140 | F67: 30 | G67: 0,1,7,7000 | H67: ="0,1,8,"&RC[24] -> 0,1,8,5600 | I67: ="0,1,4,"&RC[18] -> 0,1,4,76000 | U67: 0,1,4,1800 | X67: 65 | Y67: =MID(RC[-4],7,99)*1 -> 1800 | AA67: 76000 | AE67: 600 | AF67: 5600 | AH67: 64 | AI67: 87855 | AJ67: =SUM(R3C35:RC[-1]) -> 1240870
B68: =RC[5]&R1C6&RC[6]&R1C6&RC[7]&R1C6 -> 0,1,7,7000;0,1,8,5700;0,1,4,78000; | D68: =VLOOKUP(ROUND(RC[1],-2),Sheet3!C23:C24,2,TRUE) -> 31 | E68: =Sheet3!R[2]C[11] -> 174140 | F68: 35 | G68: 0,1,7,7000 | H68: ="0,1,8,"&RC[24] -> 0,1,8,5700 | I68: ="0,1,4,"&RC[18] -> 0,1,4,78000 | U68: 0,1,4,1800 | X68: 66 | Y68: =MID(RC[-4],7,99)*1 -> 1800 | AA68: 78000 | AE68: 600 | AF68: 5700 | AH68: 65 | AI68: 92246 | AJ68: =SUM(R3C35:RC[-1]) -> 1333116
B69: =RC[5]&R1C6&RC[6]&R1C6&RC[7]&R1C6 -> 0,1,7,21000;0,1,8,5800;0,1,4,80000; | D69: =VLOOKUP(ROUND(RC[1],-2),Sheet3!C23:C24,2,TRUE) -> 32 | E69: =Sheet3!R[2]C[11] -> 192140 | F69: 35 | G69: 0,1,7,21000 | H69: ="0,1,8,"&RC[24] -> 0,1,8,5800 | I69: ="0,1,4,"&RC[18] -> 0,1,4,80000 | U69: 0,1,4,1800 | X69: 67 | Y69: =MID(RC[-4],7,99)*1 -> 1800 | AA69: 80000 | AE69: 600 | AF69: 5800 | AH69: 66 | AI69: 96744 | AJ69: =SUM(R3C35:RC[-1]) -> 1429860
B70: =RC[5]&R1C6&RC[6]&R1C6&RC[7]&R1C6 -> 0,1,7,7000;0,1,8,5900;0,1,4,82000; | D70: =VLOOKUP(ROUND(RC[1],-2),Sheet3!C23:C24,2,TRUE) -> 32 | E70: =Sheet3!R[2]C[11] -> 198140 | F70: 35 | G70: 0,1,7,7000 | H70: ="0,1,8,"&RC[24] -> 0,1,8,5900 | I70: ="0,1,4,"&RC[18] -> 0,1,4,82000 | U70: 0,1,4,1800 | X70: 68 | Y70: =MID(RC[-4],7,99)*1 -> 1800 | AA70: 82000 | AE70: 800 | AF70: 5900 | AH70: 67 | AI70: 101348 | AJ70: =SUM(R3C35:RC[-1]) -> 1531208
B71: =RC[5]&R1C6&RC[6]&R1C6&RC[7]&R1C6 -> 0,1,7,7000;0,1,8,6000;0,1,4,84000; | D71: =VLOOKUP(ROUND(RC[1],-2),Sheet3!C23:C24,2,TRUE) -> 32 | E71: =Sheet3!R[2]C[11] -> 204140 | F71: 35 | G71: 0,1,7,7000 | H71: ="0,1,8,"&RC[24] -> 0,1,8,6000 | I71: ="0,1,4,"&RC[18] -> 0,1,4,84000 | U71: 0,1,4,1800 | X71: 69 | Y71: =MID(RC[-4],7,99)*1 -> 1800 | AA71: 84000 | AE71: 800 | AF71: 6000 | AH71: 68 | AI71: 106057 | AJ71: =SUM(R3C35:RC[-1]) -> 1637265
B72: =RC[5]&R1C6&RC[6]&R1C6&RC[7]&R1C6 -> 0,1,7,8000;0,1,8,6100;0,1,4,86000; | D72: =VLOOKUP(ROUND(RC[1],-2),Sheet3!C23:C24,2,TRUE) -> 33 | E72: =Sheet3!R[2]C[11] -> 210140 | F72: 35 | G72: 0,1,7,8000 | H72: ="0,1,8,"&RC[24] -> 0,1,8,6100 | I72: ="0,1,4,"&RC[18] -> 0,1,4,86000 | U72: 0,1,4,2200 | X72: 70 | Y72: =MID(RC[-4],7,99)*1 -> 2200 | AA72: 86000 | AE72: 800 | AF72: 6100 | AH72: 69 | AI72: 110873 | AJ72: =SUM(R3C35:RC[-1]) -> 1748138
B73: =RC[5]&R1C6&RC[6]&R1C6&RC[7]&R1C6 -> 0,1,7,8000;0,1,8,6200;0,1,4,88000; | D73: =VLOOKUP(ROUND(RC[1],-2),Sheet3!C23:C24,2,TRUE) -> 33 | E73: =Sheet3!R[2]C[11] -> 217140 | F73: 35 | G73: 0,1,7,8000 | H73: ="0,1,8,"&RC[24] -> 0,1,8,6200 | I73: ="0,1,4,"&RC[18] -> 0,1,4,88000 | U73: 0,1,4,2200 | X73: 71 | Y73: =MID(RC[-4],7,99)*1 -> 2200 | AA73: 88000 | AE73: 800 | AF73: 6200 | AH73: 70 | AI73: 115795 | AJ73: =SUM(R3C35:RC[-1]) -> 1863933
B74: =RC[5]&R1C6&RC[6]&R1C6&RC[7]&R1C6 -> 0,1,7,24000;0,1,8,6300;0,1,4,90000; | D74: =VLOOKUP(ROUND(RC[1],-2),Sheet3!C23:C24,2,TRUE) -> 33 | E74: =Sheet3!R[2]C[11] -> 238140 | F74: 35 | G74: 0,1,7,24000 | H74: ="0,1,8,"&RC[24] -> 0,1,8,6300 | I74: ="0,1,4,"&RC[18] -> 0,1,4,90000 | U74: 0,1,4,2200 | X74: 72 | Y74: =MID(RC[-4],7,99)*1 -> 2200 | AA74: 90000 | AE74: 800 | AF74: 6300 | AH74: 71 | AI74: 120823 | AJ74: =SUM(R3C35:RC[-1]) -> 1984756
B75: =RC[5]&R1C6&RC[6]&R1C6&RC[7]&R1C6 -> 0,1,7,8000;0,1,8,6400;0,1,4,92000; | D75: =VLOOKUP(ROUND(RC[1],-2),Sheet3!C23:C24,2,TRUE) -> 34 | E75: =Sheet3!R[2]C[11] -> 245140 | F75: 35 | G75: 0,1,7,8000 | H75: ="0,1,8,"&RC[24] -> 0,1,8,6400 | I75: ="0,1,4,"&RC[18] -> 0,1,4,92000 | U75: 0,1,4,1800 | X75: 73 | Y75: =MID(RC[-4],7,99)*1 -> 1800 | AA75: 92000 | AE75: 800 | AF75: 6400 | AH75: 72 | AI75: 125956 | AJ75: =SUM(R3C35:RC[-1]) -> 2110712
B76: =RC[5]&R1C6&RC[6]&R1C6&RC[7]&R1C6 -> 0,1,7,8000;0,1,8,6500;0,1,4,94000; | D76: =VLOOKUP(ROUND(RC[1],-2),Sheet3!C23:C24,2,TRUE) -> 34 | E76: =Sheet3!R[2]C[11] -> 252140 | F76: 35 | G76: 0,1,7,8000 | H76: ="0,1,8,"&RC[24] -> 0,1,8,6500 | I76: ="0,1,4,"&RC[18] -> 0,1,4,94000 | U76: 0,1,4,2200 | X76: 74 | Y76: =MID(RC[-4],7,99)*1 -> 2200 | AA76: 94000 | AE76: 800 | AF76: 6500 | AH76: 73 | AI76: 131196 | AJ76: =SUM(R3C35:RC[-1]) -> 2241908
B77: =RC[5]&R1C6&RC[6]&R1C6&RC[7]&R1C6 -> 0,1,7,8000;0,1,8,6600;0,1,4,96000; | D77: =VLOOKUP(ROUND(RC[1],-2),Sheet3!C23:C24,2,TRUE) -> 34 | E77: =Sheet3!R[2]C[11] -> 259140 | F77: 35 | G77: 0,1,7,8000 | H77: ="0,1,8,"&RC[24] -> 0,1,8,6600 | I77: ="0,1,4,"&RC[18] -> 0,1,4,96000 | U77: 0,1,4,2200 | X77: 75 | Y77: =MID(RC[-4],7,99)*1 -> 2200 | AA77: 96000 | AE77: 900 | AF77: 6600 | AH77: 74 | AI77: 136541 | AJ77: =SUM(R3C35:RC[-1]) -> 2378449
B78: =RC[5]&R1C6&RC[6]&R1C6&RC[7]&R1C6 -> 0,1,7,8000;0,1,8,6700;0,1,4,98000; | D78: =VLOOKUP(ROUND(RC[1],-2),Sheet3!C23:C24,2,TRUE) -> 34 | E78: =Sheet3!R[2]C[11] -> 267140 | F78: 35 | G78: 0,1,7,8000 | H78: ="0,1,8,"&RC[24] -> 0,1,8,6700 | I78: ="0,1,4,"&RC[18] -> 0,1,4,98000 | U78: 0,1,4,2200 | X78: 76 | Y78: =MID(RC[-4],7,99)*1 -> 2200 | AA78: 98000 | AE78: 900 | AF78: 6700 | AH78: 75 | AI78: 141992 | AJ78: =SUM(R3C35:RC[-1]) -> 2520441
B79: =RC[5]&R1C6&RC[6]&R1C6&RC[7]&R1C6 -> 0,1,7,24000;0,1,8,6800;0,1,4,100000; | D79: =VLOOKUP(ROUND(RC[1],-2),Sheet3!C23:C24,2,TRUE) -> 35 | E79: =Sheet3!R[2]C[11] -> 291140 | F79: 35 | G79: 0,1,7,24000 | H79: ="0,1,8,"&RC[24] -> 0,1,8,6800 | I79: ="0,1,4,"&RC[18] -> 0,1,4,100000 | U79: 0,1,4,57700 | X79: 77 | Y79: =MID(RC[-4],7,99)*1 -> 57700 | AA79: 100000 | AE79: 15100 | AF79: 6800 | AH79: 76 | AI79: 147549 | AJ79: =SUM(R3C35:RC[-1]) -> 2667990
B80: =RC[5]&R1C6&RC[6]&R1C6&RC[7]&R1C6 -> 0,1,7,8000;0,1,8,6900;0,1,4,104000; | D80: =VLOOKUP(ROUND(RC[1],-2),Sheet3!C23:C24,2,TRUE) -> 35 | E80: =Sheet3!R[2]C[11] -> 299140 | F80: 35 | G80: 0,1,7,8000 | H80: ="0,1,8,"&RC[24] -> 0,1,8,6900 | I80: ="0,1,4,"&RC[18] -> 0,1,4,104000 | U80: 0,1,4,2200 | X80: 78 | Y80: =MID(RC[-4],7,99)*1 -> 2200 | AA80: 104000 | AE80: 900 | AF80: 6900 | AH80: 77 | AI80: 153211 | AJ80: =SUM(R3C35:RC[-1]) -> 2821201
B81: =RC[5]&R1C6&RC[6]&R1C6&RC[7]&R1C6&RC[8]&R1C6&RC[9]&R1C6&RC[10]&R1C6&RC[11]&R1C6&RC[12]&R1C6&RC[13]&R1C6&RC[14]&R1C6&RC[15]&R1C6&RC[16]&R1C6&RC[17]&R1C6 -> 0,1,7,8000;0,1,8,7000;0,1,4,108000;1,1,1200104,1;2,1,1200204,1;3,1,1200104,1;4,1,1200204,1;5,1,1200104,1;6,1,1200204,1;7,1,1200104,1;8,1,1200204,1;9,1,1200104,1;10,1,1200204,1; | D81: =VLOOKUP(ROUND(RC[1],-2),Sheet3!C23:C24,2,TRUE) -> 35 | E81: =Sheet3!R[2]C[11] -> 307140 | F81: 40 | G81: 0,1,7,8000 | H81: ="0,1,8,"&RC[24] -> 0,1,8,7000 | I81: ="0,1,4,"&RC[18] -> 0,1,4,108000 | J81: 1,1,1200104,1 | K81: 2,1,1200204,1 | L81: 3,1,1200104,1 | M81: 4,1,1200204,1 | N81: 5,1,1200104,1 | O81: 6,1,1200204,1 | P81: 7,1,1200104,1 | Q81: 8,1,1200204,1 | R81: 9,1,1200104,1 | S81: 10,1,1200204,1 | U81: 0,1,4,1800 | X81: 79 | Y81: =MID(RC[-4],7,99)*1 -> 1800 | AA81: 108000 | AE81: 900 | AF81: 7000 | AH81: 78 | AI81: 158979 | AJ81: =SUM(R3C35:RC[-1]) -> 2980180
B82: =RC[5]&R1C6&RC[6]&R1C6&RC[7]&R1C6&RC[8]&R1C6 -> 0,1,7,9000;0,1,8,7100;0,1,4,112000;0,1,1600004,1; | D82: =VLOOKUP(ROUND(RC[1],-2),Sheet3!C23:C24,2,TRUE) -> 36 | E82: =Sheet3!R[2]C[11] -> 316140 | F82: 40 | G82: 0,1,7,9000 | H82: ="0,1,8,"&RC[24] -> 0,1,8,7100 | I82: ="0,1,4,"&RC[18] -> 0,1,4,112000 | J82: 0,1,1600004,1 | U82: 0,1,4,1800 | X82: 80 | Y82: =MID(RC[-4],7,99)*1 -> 1800 | AA82: 112000 | AE82: 900 | AF82: 7100 | AH82: 79 | AI82: 181338 | AJ82: =SUM(R3C35:RC[-1]) -> 3161518
B83: =RC[5]&R1C6&RC[6]&R1C6&RC[7]&R1C6&RC[8]&R1C6 -> 0,1,7,9000;0,1,8,7200;0,1,4,116000;0,1,1400004,1; | D83: =VLOOKUP(ROUND(RC[1],-2),Sheet3!C23:C24,2,TRUE) -> 36 | E83: =Sheet3!R[2]C[11] -> 325140 | F83: 40 | G83: 0,1,7,9000 | H83: ="0,1,8,"&RC[24] -> 0,1,8,7200 | I83: ="0,1,4,"&RC[18] -> 0,1,4,116000 | J83: 0,1,1400004,1 | U83: 0,1,4,1800 | X83: 81 | Y83: =MID(RC[-4],7,99)*1 -> 1800 | AA83: 116000 | AE83: 900 | AF83: 7200 | AH83: 80 | AI83: 204999 | AJ83: =SUM(R3C35:RC[-1]) -> 3366517
B84: =RC[5]&R1C6&RC[6]&R1C6&RC[7]&R1C6&RC[8]&R1C6&RC[9]&R1C6&RC[10]&R1C6&RC[11]&R1C6&RC[12]&R1C6&RC[13]&R1C6&RC[14]&R1C6&RC[15]&R1C6&RC[16]&R1C6&RC[17]&R1C6 -> 0,1,7,27000;0,1,8,7300;0,1,4,120000;1,1,1300104,1;2,1,1300204,1;3,1,1300104,1;4,1,1300204,1;5,1,1300104,1;6,1,1300204,1;7,1,1300104,1;8,1,1300204,1;9,1,1300104,1;10,1,1300204,1; | D84: =VLOOKUP(ROUND(RC[1],-2),Sheet3!C23:C24,2,TRUE) -> 37 | E84: =Sheet3!R[2]C[11] -> 352140 | F84: 40 | G84: 0,1,7,27000 | H84: ="0,1,8,"&RC[24] -> 0,1,8,7300 | I84: ="0,1,4,"&RC[18] -> 0,1,4,120000 | J84: 1,1,1300104,1 | K84: 2,1,1300204,1 | L84: 3,1,1300104,1 | M84: 4,1,1300204,1 | N84: 5,1,1300104,1 | O84: 6,1,1300204,1 | P84: 7,1,1300104,1 | Q84: 8,1,1300204,1 | R84: 9,1,1300104,1 | S84: 10,1,1300204,1 | U84: 0,1,4,1800 | X84: 82 | Y84: =MID(RC[-4],7,99)*1 -> 1800 | AA84: 120000 | AE84: 900 | AF84: 7300 | AH84: 81 | AI84: 229992 | AJ84: =SUM(R3C35:RC[-1]) -> 3596509
B85: =RC[5]&R1C6&RC[6]&R1C6&RC[7]&R1C6&RC[8]&R1C6&RC[9]&R1C6&RC[10]&R1C6&RC[11]&R1C6&RC[12]&R1C6&RC[13]&R1C6&RC[14]&R1C6&RC[15]&R1C6&RC[16]&R1C6&RC[17]&R1C6 -> 0,1,7,9000;0,1,8,7400;0,1,4,124000;1,1,1101104,1;2,1,1101204,1;3,1,1102104,1;4,1,1102204,1;5,1,1103104,1;6,1,1103204,1;7,1,1104104,1;8,1,1104204,1;9,1,1105104,1;10,1,1105204,1; | D85: =VLOOKUP(ROUND(RC[1],-2),Sheet3!C23:C24,2,TRUE) -> 37 | E85: =Sheet3!R[2]C[11] -> 361140 | F85: 40 | G85: 0,1,7,9000 | H85: ="0,1,8,"&RC[24] -> 0,1,8,7400 | I85: ="0,1,4,"&RC[18] -> 0,1,4,124000 | J85: 1,1,1101104,1 | K85: 2,1,1101204,1 | L85: 3,1,1102104,1 | M85: 4,1,1102204,1 | N85: 5,1,1103104,1 | O85: 6,1,1103204,1 | P85: 7,1,1104104,1 | Q85: 8,1,1104204,1 | R85: 9,1,1105104,1 | S85: 10,1,1105204,1 | U85: 0,1,4,1800 | X85: 83 | Y85: =MID(RC[-4],7,99)*1 -> 1800 | AA85: 124000 | AE85: 900 | AF85: 7400 | AH85: 82 | AI85: 256351 | AJ85: =SUM(R3C35:RC[-1]) -> 3852860
B86: =RC[5]&R1C6&RC[6]&R1C6&RC[7]&R1C6&RC[8]&R1C6 -> 0,1,7,9000;0,1,8,7500;0,1,4,128000;0,1,1500004,1; | D86: =VLOOKUP(ROUND(RC[1],-2),Sheet3!C23:C24,2,TRUE) -> 37 | E86: =Sheet3!R[2]C[11] -> 370140 | F86: 40 | G86: 0,1,7,9000 | H86: ="0,1,8,"&RC[24] -> 0,1,8,7500 | I86: ="0,1,4,"&RC[18] -> 0,1,4,128000 | J86: 0,1,1500004,1 | U86: 0,1,4,42700 | X86: 84 | Y86: =MID(RC[-4],7,99)*1 -> 42700 | AA86: 128000 | AE86: 23100 | AF86: 7500 | AH86: 83 | AI86: 284105 | AJ86: =SUM(R3C35:RC[-1]) -> 4136965
B87: =RC[5]&R1C6&RC[6]&R1C6&RC[7]&R1C6&RC[8]&R1C6 -> 0,1,7,10000;0,1,8,7600;0,1,4,132000;0,1,28000,50; | D87: =VLOOKUP(ROUND(RC[1],-2),Sheet3!C23:C24,2,TRUE) -> 37 | E87: =Sheet3!R[2]C[11] -> 380140 | F87: 40 | G87: 0,1,7,10000 | H87: ="0,1,8,"&RC[24] -> 0,1,8,7600 | I87: ="0,1,4,"&RC[18] -> 0,1,4,132000 | J87: 0,1,28000,50 | U87: 0,1,4,2100 | X87: 85 | Y87: =MID(RC[-4],7,99)*1 -> 2100 | AA87: 132000 | AE87: 900 | AF87: 7600 | AH87: 84 | AI87: 313287 | AJ87: =SUM(R3C35:RC[-1]) -> 4450252
B88: =RC[5]&R1C6&RC[6]&R1C6&RC[7]&R1C6 -> 0,1,7,10000;0,1,8,7700;0,1,4,136000; | D88: =VLOOKUP(ROUND(RC[1],-2),Sheet3!C23:C24,2,TRUE) -> 37 | E88: =Sheet3!R[2]C[11] -> 390140 | F88: 40 | G88: 0,1,7,10000 | H88: ="0,1,8,"&RC[24] -> 0,1,8,7700 | I88: ="0,1,4,"&RC[18] -> 0,1,4,136000 | U88: 0,1,4,2100 | X88: 86 | Y88: =MID(RC[-4],7,99)*1 -> 2100 | AA88: 136000 | AE88: 900 | AF88: 7700 | AH88: 85 | AI88: 343929 | AJ88: =SUM(R3C35:RC[-1]) -> 4794181
B89: =RC[5]&R1C6&RC[6]&R1C6&RC[7]&R1C6 -> 0,1,7,31000;0,1,8,7800;0,1,4,140000; | D89: =VLOOKUP(ROUND(RC[1],-2),Sheet3!C23:C24,2,TRUE) -> 38 | E89: =Sheet3!R[2]C[11] -> 421140 | F89: 40 | G89: 0,1,7,31000 | H89: ="0,1,8,"&RC[24] -> 0,1,8,7800 | I89: ="0,1,4,"&RC[18] -> 0,1,4,140000 | U89: 0,1,4,2100 | X89: 87 | Y89: =MID(RC[-4],7,99)*1 -> 2100 | AA89: 140000 | AE89: 1100 | AF89: 7800 | AH89: 86 | AI89: 376062 | AJ89: =SUM(R3C35:RC[-1]) -> 5170243
B90: =RC[5]&R1C6&RC[6]&R1C6&RC[7]&R1C6 -> 0,1,7,21000;0,1,8,7900;0,1,4,144000; | D90: =VLOOKUP(ROUND(RC[1],-2),Sheet3!C23:C24,2,TRUE) -> 39 | E90: =Sheet3!R[2]C[11] -> 442140 | F90: 40 | G90: 0,1,7,21000 | H90: ="0,1,8,"&RC[24] -> 0,1,8,7900 | I90: ="0,1,4,"&RC[18] -> 0,1,4,144000 | U90: 0,1,4,2100 | X90: 88 | Y90: =MID(RC[-4],7,99)*1 -> 2100 | AA90: 144000 | AE90: 1100 | AF90: 7900 | AH90: 87 | AI90: 409718 | AJ90: =SUM(R3C35:RC[-1]) -> 5579961
B91: =RC[5]&R1C6&RC[6]&R1C6&RC[7]&R1C6 -> 0,1,7,22000;0,1,8,8000;0,1,4,148000; | D91: =VLOOKUP(ROUND(RC[1],-2),Sheet3!C23:C24,2,TRUE) -> 39 | E91: =Sheet3!R[2]C[11] -> 464140 | F91: 40 | G91: 0,1,7,22000 | H91: ="0,1,8,"&RC[24] -> 0,1,8,8000 | I91: ="0,1,4,"&RC[18] -> 0,1,4,148000 | U91: 0,1,4,53400 | X91: 89 | Y91: =MID(RC[-4],7,99)*1 -> 53400 | AA91: 148000 | AE91: 26300 | AF91: 8000 | AH91: 88 | AI91: 444927 | AJ91: =SUM(R3C35:RC[-1]) -> 6024888
B92: =RC[5]&R1C6&RC[6]&R1C6&RC[7]&R1C6 -> 0,1,7,23000;0,1,8,8100;0,1,4,152000; | D92: =VLOOKUP(ROUND(RC[1],-2),Sheet3!C23:C24,2,TRUE) -> 39 | E92: =Sheet3!R[2]C[11] -> 487140 | F92: 45 | G92: 0,1,7,23000 | H92: ="0,1,8,"&RC[24] -> 0,1,8,8100 | I92: ="0,1,4,"&RC[18] -> 0,1,4,152000 | U92: 0,1,4,3500 | X92: 90 | Y92: =MID(RC[-4],7,99)*1 -> 3500 | AA92: 152000 | AE92: 1750 | AF92: 8100 | AH92: 89 | AI92: 481722 | AJ92: =SUM(R3C35:RC[-1]) -> 6506610
B93: =RC[5]&R1C6&RC[6]&R1C6&RC[7]&R1C6 -> 0,1,7,24000;0,1,8,8200;0,1,4,156000; | D93: =VLOOKUP(ROUND(RC[1],-2),Sheet3!C23:C24,2,TRUE) -> 40 | E93: =Sheet3!R[2]C[11] -> 511140 | F93: 45 | G93: 0,1,7,24000 | H93: ="0,1,8,"&RC[24] -> 0,1,8,8200 | I93: ="0,1,4,"&RC[18] -> 0,1,4,156000 | U93: 0,1,4,100000 | X93: 91 | Y93: =MID(RC[-4],7,99)*1 -> 100000 | AA93: 156000 | AE93: 55000 | AF93: 8200 | AH93: 90 | AI93: 520135 | AJ93: =SUM(R3C35:RC[-1]) -> 7026745
B94: =RC[5]&R1C6&RC[6]&R1C6&RC[7]&R1C6 -> 0,1,7,74000;0,1,8,8300;0,1,4,160000; | D94: =VLOOKUP(ROUND(RC[1],-2),Sheet3!C23:C24,2,TRUE) -> 40 | E94: =Sheet3!R[2]C[11] -> 585140 | F94: 45 | G94: 0,1,7,74000 | H94: ="0,1,8,"&RC[24] -> 0,1,8,8300 | I94: ="0,1,4,"&RC[18] -> 0,1,4,160000 | U94: 0,1,4,3500 | X94: 92 | Y94: =MID(RC[-4],7,99)*1 -> 3500 | AA94: 160000 | AE94: 1750 | AF94: 8300 | AH94: 91 | AI94: 560196 | AJ94: =SUM(R3C35:RC[-1]) -> 7586941
B95: =RC[5]&R1C6&RC[6]&R1C6&RC[7]&R1C6 -> 0,1,7,26000;0,1,8,8400;0,1,4,164000; | D95: =VLOOKUP(ROUND(RC[1],-2),Sheet3!C23:C24,2,TRUE) -> 40 | E95: =Sheet3!R[2]C[11] -> 611140 | F95: 45 | G95: 0,1,7,26000 | H95: ="0,1,8,"&RC[24] -> 0,1,8,8400 | I95: ="0,1,4,"&RC[18] -> 0,1,4,164000 | U95: 0,1,4,3500 | X95: 93 | Y95: =MID(RC[-4],7,99)*1 -> 3500 | AA95: 164000 | AE95: 1750 | AF95: 8400 | AH95: 92 | AI95: 601937 | AJ95: =SUM(R3C35:RC[-1]) -> 8188878
B96: =RC[5]&R1C6&RC[6]&R1C6&RC[7]&R1C6 -> 0,1,7,27000;0,1,8,8500;0,1,4,168000; | D96: =VLOOKUP(ROUND(RC[1],-2),Sheet3!C23:C24,2,TRUE) -> 41 | E96: =Sheet3!R[2]C[11] -> 638140 | F96: 45 | G96: 0,1,7,27000 | H96: ="0,1,8,"&RC[24] -> 0,1,8,8500 | I96: ="0,1,4,"&RC[18] -> 0,1,4,168000 | U96: 0,1,4,3500 | X96: 94 | Y96: =MID(RC[-4],7,99)*1 -> 3500 | AA96: 168000 | AE96: 1750 | AF96: 8500 | AH96: 93 | AI96: 645390 | AJ96: =SUM(R3C35:RC[-1]) -> 8834268
B97: =RC[5]&R1C6&RC[6]&R1C6&RC[7]&R1C6 -> 0,1,7,28000;0,1,8,8600;0,1,4,172000; | D97: =VLOOKUP(ROUND(RC[1],-2),Sheet3!C23:C24,2,TRUE) -> 41 | E97: =Sheet3!R[2]C[11] -> 666140 | F97: 45 | G97: 0,1,7,28000 | H97: ="0,1,8,"&RC[24] -> 0,1,8,8600 | I97: ="0,1,4,"&RC[18] -> 0,1,4,172000 | U97: 0,1,4,160000 | X97: 95 | Y97: =MID(RC[-4],7,99)*1 -> 160000 | AA97: 172000 | AE97: 75000 | AF97: 8600 | AH97: 94 | AI97: 690586 | AJ97: =SUM(R3C35:RC[-1]) -> 9524854
B98: =RC[5]&R1C6&RC[6]&R1C6&RC[7]&R1C6 -> 0,1,7,29000;0,1,8,8700;0,1,4,176000; | D98: =VLOOKUP(ROUND(RC[1],-2),Sheet3!C23:C24,2,TRUE) -> 41 | E98: =Sheet3!R[2]C[11] -> 695140 | F98: 45 | G98: 0,1,7,29000 | H98: ="0,1,8,"&RC[24] -> 0,1,8,8700 | I98: ="0,1,4,"&RC[18] -> 0,1,4,176000 | U98: 0,1,4,3500 | X98: 96 | Y98: =MID(RC[-4],7,99)*1 -> 3500 | AA98: 176000 | AE98: 1750 | AF98: 8700 | AH98: 95 | AI98: 737556 | AJ98: =SUM(R3C35:RC[-1]) -> 10262410
B99: =RC[5]&R1C6&RC[6]&R1C6&RC[7]&R1C6 -> 0,1,7,91000;0,1,8,8800;0,1,4,180000; | D99: =VLOOKUP(ROUND(RC[1],-2),Sheet3!C23:C24,2,TRUE) -> 42 | E99: =Sheet3!R[2]C[11] -> 786140 | F99: 45 | G99: 0,1,7,91000 | H99: ="0,1,8,"&RC[24] -> 0,1,8,8800 | I99: ="0,1,4,"&RC[18] -> 0,1,4,180000 | U99: 0,1,4,3500 | X99: 97 | Y99: =MID(RC[-4],7,99)*1 -> 3500 | AA99: 180000 | AE99: 1750 | AF99: 8800 | AH99: 96 | AI99: 786333 | AJ99: =SUM(R3C35:RC[-1]) -> 11048743
B100: =RC[5]&R1C6&RC[6]&R1C6&RC[7]&R1C6 -> 0,1,7,32000;0,1,8,8900;0,1,4,184000; | D100: =VLOOKUP(ROUND(RC[1],-2),Sheet3!C23:C24,2,TRUE) -> 42 | E100: =Sheet3!R[2]C[11] -> 818140 | F100: 45 | G100: 0,1,7,32000 | H100: ="0,1,8,"&RC[24] -> 0,1,8,8900 | I100: ="0,1,4,"&RC[18] -> 0,1,4,184000 | U100: 0,1,4,200000 | X100: 98 | Y100: =MID(RC[-4],7,99)*1 -> 200000 | AA100: 184000 | AE100: 95000 | AF100: 8900 | AH100: 97 | AI100: 836947 | AJ100: =SUM(R3C35:RC[-1]) -> 11885690
B101: =RC[5]&R1C6&RC[6]&R1C6&RC[7]&R1C6 -> 0,1,7,33000;0,1,8,9000;0,1,4,188000; | D101: =VLOOKUP(ROUND(RC[1],-2),Sheet3!C23:C24,2,TRUE) -> 42 | E101: =Sheet3!R[2]C[11] -> 851140 | F101: 45 | G101: 0,1,7,33000 | H101: ="0,1,8,"&RC[24] -> 0,1,8,9000 | I101: ="0,1,4,"&RC[18] -> 0,1,4,188000 | U101: 0,1,4,3500 | X101: 99 | Y101: =MID(RC[-4],7,99)*1 -> 3500 | AA101: 188000 | AE101: 1750 | AF101: 9000 | AH101: 98 | AI101: 889431 | AJ101: =SUM(R3C35:RC[-1]) -> 12775121
B102: =RC[5]&R1C6&RC[6]&R1C6&RC[7]&R1C6 -> 0,1,7,34000;0,1,8,9100;0,1,4,192000; | D102: =VLOOKUP(ROUND(RC[1],-2),Sheet3!C23:C24,2,TRUE) -> 42 | E102: =Sheet3!R[2]C[11] -> 885140 | F102: 45 | G102: 0,1,7,34000 | H102: ="0,1,8,"&RC[24] -> 0,1,8,9100 | I102: ="0,1,4,"&RC[18] -> 0,1,4,192000 | U102: 0,1,4,3500 | X102: 100 | Y102: =MID(RC[-4],7,99)*1 -> 3500 | AA102: 192000 | AE102: 1750 | AF102: 9100 | AH102: 99 | AI102: 1179768 | AJ102: =SUM(R3C35:RC[-1]) -> 13954889
B103: =RC[5]&R1C6&RC[6]&R1C6&RC[7]&R1C6 -> 0,1,7,35000;0,1,8,9200;0,1,4,196000; | D103: =VLOOKUP(ROUND(RC[1],-2),Sheet3!C23:C24,2,TRUE) -> 42 | E103: =Sheet3!R[2]C[11] -> 920140 | F103: 45 | G103: 0,1,7,35000 | H103: ="0,1,8,"&RC[24] -> 0,1,8,9200 | I103: ="0,1,4,"&RC[18] -> 0,1,4,196000 | U103: 0,1,4,130000 | X103: 101 | Y103: =MID(RC[-4],7,99)*1 -> 130000 | AA103: 196000 | AE103: 70000 | AF103: 9200 | AH103: 100 | AI103: 1250162 | AJ103: =SUM(R3C35:RC[-1]) -> 15205051
B104: =RC[5]&R1C6&RC[6]&R1C6&RC[7]&R1C6&RC[8]&R1C6 -> 0,1,7,110000;0,1,8,9300;0,1,4,200000;0,1,1500005,1; | D104: =VLOOKUP(ROUND(RC[1],-2),Sheet3!C23:C24,2,TRUE) -> 43 | E104: =Sheet3!R[2]C[11] -> 1030140 | F104: 50 | G104: 0,1,7,110000 | H104: ="0,1,8,"&RC[24] -> 0,1,8,9300 | I104: ="0,1,4,"&RC[18] -> 0,1,4,200000 | J104: 0,1,1500005,1 | U104: 0,1,4,5000 | X104: 102 | Y104: =MID(RC[-4],7,99)*1 -> 5000 | AA104: 200000 | AE104: 2000 | AF104: 9300 | AH104: 101 | AI104: 1323011 | AJ104: =SUM(R3C35:RC[-1]) -> 16528062
B105: =RC[5]&R1C6&RC[6]&R1C6&RC[7]&R1C6&RC[8]&R1C6&RC[9]&R1C6&RC[10]&R1C6&RC[11]&R1C6&RC[12]&R1C6&RC[13]&R1C6&RC[14]&R1C6&RC[15]&R1C6&RC[16]&R1C6&RC[17]&R1C6 -> 0,1,7,38000;0,1,8,9400;0,1,4,204000;1,1,1200105,1;2,1,1200205,1;3,1,1200105,1;4,1,1200205,1;5,1,1200105,1;6,1,1200205,1;7,1,1200105,1;8,1,1200205,1;9,1,1200105,1;10,1,1200205,1; | D105: =VLOOKUP(ROUND(RC[1],-2),Sheet3!C23:C24,2,TRUE) -> 43 | E105: =Sheet3!R[2]C[11] -> 1068140 | F105: 50 | G105: 0,1,7,38000 | H105: ="0,1,8,"&RC[24] -> 0,1,8,9400 | I105: ="0,1,4,"&RC[18] -> 0,1,4,204000 | J105: 1,1,1200105,1 | K105: 2,1,1200205,1 | L105: 3,1,1200105,1 | M105: 4,1,1200205,1 | N105: 5,1,1200105,1 | O105: 6,1,1200205,1 | P105: 7,1,1200105,1 | Q105: 8,1,1200205,1 | R105: 9,1,1200105,1 | S105: 10,1,1200205,1 | U105: 0,1,4,5000 | X105: 103 | Y105: =MID(RC[-4],7,99)*1 -> 5000 | AA105: 204000 | AE105: 2000 | AF105: 9400 | AH105: 102 | AI105: 1398352 | AJ105: =SUM(R3C35:RC[-1]) -> 17926414
B106: =RC[5]&R1C6&RC[6]&R1C6&RC[7]&R1C6&RC[8]&R1C6 -> 0,1,7,39000;0,1,8,9500;0,1,4,208000;0,1,1600005,1; | D106: =VLOOKUP(ROUND(RC[1],-2),Sheet3!C23:C24,2,TRUE) -> 43 | E106: =Sheet3!R[2]C[11] -> 1107140 | F106: 50 | G106: 0,1,7,39000 | H106: ="0,1,8,"&RC[24] -> 0,1,8,9500 | I106: ="0,1,4,"&RC[18] -> 0,1,4,208000 | J106: 0,1,1600005,1 | U106: 0,1,4,140000 | X106: 104 | Y106: =MID(RC[-4],7,99)*1 -> 140000 | AA106: 208000 | AE106: 75000 | AF106: 9500 | AH106: 103 | AI106: 1476227 | AJ106: =SUM(R3C35:RC[-1]) -> 19402641
B107: =RC[5]&R1C6&RC[6]&R1C6&RC[7]&R1C6&RC[8]&R1C6&RC[9]&R1C6&RC[10]&R1C6&RC[11]&R1C6&RC[12]&R1C6&RC[13]&R1C6&RC[14]&R1C6&RC[15]&R1C6&RC[16]&R1C6&RC[17]&R1C6 -> 0,1,7,41000;0,1,8,9600;0,1,4,212000;1,1,1300105,1;2,1,1300205,1;3,1,1300105,1;4,1,1300205,1;5,1,1300105,1;6,1,1300205,1;7,1,1300105,1;8,1,1300205,1;9,1,1300105,1;10,1,1300205,1; | D107: =VLOOKUP(ROUND(RC[1],-2),Sheet3!C23:C24,2,TRUE) -> 44 | E107: =Sheet3!R[2]C[11] -> 1148140 | F107: 50 | G107: 0,1,7,41000 | H107: ="0,1,8,"&RC[24] -> 0,1,8,9600 | I107: ="0,1,4,"&RC[18] -> 0,1,4,212000 | J107: 1,1,1300105,1 | K107: 2,1,1300205,1 | L107: 3,1,1300105,1 | M107: 4,1,1300205,1 | N107: 5,1,1300105,1 | O107: 6,1,1300205,1 | P107: 7,1,1300105,1 | Q107: 8,1,1300205,1 | R107: 9,1,1300105,1 | S107: 10,1,1300205,1 | U107: 0,1,4,5000 | X107: 105 | Y107: =MID(RC[-4],7,99)*1 -> 5000 | AA107: 212000 | AE107: 2000 | AF107: 9600 | AH107: 104 | AI107: 1556673 | AJ107: =SUM(R3C35:RC[-1]) -> 20959314
B108: =RC[5]&R1C6&RC[6]&R1C6&RC[7]&R1C6&RC[8]&R1C6&RC[9]&R1C6&RC[10]&R1C6&RC[11]&R1C6&RC[12]&R1C6&RC[13]&R1C6&RC[14]&R1C6&RC[15]&R1C6&RC[16]&R1C6&RC[17]&R1C6 -> 0,1,7,42000;0,1,8,9700;0,1,4,216000;1,1,1101105,1;2,1,1101205,1;3,1,1102105,1;4,1,1102205,1;5,1,1103105,1;6,1,1103205,1;7,1,1104105,1;8,1,1104205,1;9,1,1105105,1;10,1,1105205,1; | D108: =VLOOKUP(ROUND(RC[1],-2),Sheet3!C23:C24,2,TRUE) -> 44 | E108: =Sheet3!R[2]C[11] -> 1190140 | F108: 50 | G108: 0,1,7,42000 | H108: ="0,1,8,"&RC[24] -> 0,1,8,9700 | I108: ="0,1,4,"&RC[18] -> 0,1,4,216000 | J108: 1,1,1101105,1 | K108: 2,1,1101205,1 | L108: 3,1,1102105,1 | M108: 4,1,1102205,1 | N108: 5,1,1103105,1 | O108: 6,1,1103205,1 | P108: 7,1,1104105,1 | Q108: 8,1,1104205,1 | R108: 9,1,1105105,1 | S108: 10,1,1105205,1 | U108: 0,1,4,5000 | X108: 106 | Y108: =MID(RC[-4],7,99)*1 -> 5000 | AA108: 216000 | AE108: 2000 | AF108: 9700 | AH108: 105 | AI108: 1639731 | AJ108: =SUM(R3C35:RC[-1]) -> 22599045
B109: =RC[5]&R1C6&RC[6]&R1C6&RC[7]&R1C6&RC[8]&R1C6 -> 0,1,7,130000;0,1,8,9800;0,1,4,220000;0,1,1400005,1; | D109: =VLOOKUP(ROUND(RC[1],-2),Sheet3!C23:C24,2,TRUE) -> 44 | E109: =Sheet3!R[2]C[11] -> 1320140 | F109: 50 | G109: 0,1,7,130000 | H109: ="0,1,8,"&RC[24] -> 0,1,8,9800 | I109: ="0,1,4,"&RC[18] -> 0,1,4,220000 | J109: 0,1,1400005,1 | U109: 0,1,4,140000 | X109: 107 | Y109: =MID(RC[-4],7,99)*1 -> 140000 | AA109: 220000 | AE109: 75000 | AF109: 9800 | AH109: 106 | AI109: 1725439 | AJ109: =SUM(R3C35:RC[-1]) -> 24324484
B110: =RC[5]&R1C6&RC[6]&R1C6&RC[7]&R1C6 -> 0,1,7,45000;0,1,8,9900;0,1,4,224000; | D110: =VLOOKUP(ROUND(RC[1],-2),Sheet3!C23:C24,2,TRUE) -> 44 | E110: =Sheet3!R[2]C[11] -> 1365140 | F110: 50 | G110: 0,1,7,45000 | H110: ="0,1,8,"&RC[24] -> 0,1,8,9900 | I110: ="0,1,4,"&RC[18] -> 0,1,4,224000 | U110: 0,1,4,5000 | X110: 108 | Y110: =MID(RC[-4],7,99)*1 -> 5000 | AA110: 224000 | AE110: 2000 | AF110: 9900 | AH110: 107 | AI110: 1813836 | AJ110: =SUM(R3C35:RC[-1]) -> 26138320
B111: =RC[5]&R1C6&RC[6]&R1C6&RC[7]&R1C6 -> 0,1,7,46000;0,1,8,10000;0,1,4,228000; | D111: =VLOOKUP(ROUND(RC[1],-2),Sheet3!C23:C24,2,TRUE) -> 45 | E111: =Sheet3!R[2]C[11] -> 1411140 | F111: 50 | G111: 0,1,7,46000 | H111: ="0,1,8,"&RC[24] -> 0,1,8,10000 | I111: ="0,1,4,"&RC[18] -> 0,1,4,228000 | U111: 0,1,4,140000 | X111: 109 | Y111: =MID(RC[-4],7,99)*1 -> 140000 | AA111: 228000 | AE111: 75000 | AF111: 10000 | AH111: 108 | AI111: 1904962 | AJ111: =SUM(R3C35:RC[-1]) -> 28043282
B112: =RC[5]&R1C6&RC[6]&R1C6&RC[7]&R1C6 -> 0,1,7,47000;0,1,8,11000;0,1,4,232000; | D112: =VLOOKUP(ROUND(RC[1],-2),Sheet3!C23:C24,2,TRUE) -> 45 | E112: =Sheet3!R[2]C[11] -> 1458140 | F112: 50 | G112: 0,1,7,47000 | H112: ="0,1,8,"&RC[24] -> 0,1,8,11000 | I112: ="0,1,4,"&RC[18] -> 0,1,4,232000 | U112: 0,1,4,5000 | X112: 110 | Y112: =MID(RC[-4],7,99)*1 -> 5000 | AA112: 232000 | AE112: 2000 | AF112: 11000 | AH112: 109 | AI112: 1998857 | AJ112: =SUM(R3C35:RC[-1]) -> 30042139
B113: =RC[5]&R1C6&RC[6]&R1C6&RC[7]&R1C6 -> 0,1,7,49000;0,1,8,12000;0,1,4,236000; | D113: =VLOOKUP(ROUND(RC[1],-2),Sheet3!C23:C24,2,TRUE) -> 45 | E113: =Sheet3!R[2]C[11] -> 1507140 | F113: 50 | G113: 0,1,7,49000 | H113: ="0,1,8,"&RC[24] -> 0,1,8,12000 | I113: ="0,1,4,"&RC[18] -> 0,1,4,236000 | U113: 0,1,4,5000 | X113: 111 | Y113: =MID(RC[-4],7,99)*1 -> 5000 | AA113: 236000 | AE113: 2000 | AF113: 12000 | AH113: 110 | AI113: 2095558 | AJ113: =SUM(R3C35:RC[-1]) -> 32137697
B114: =RC[5]&R1C6&RC[6]&R1C6&RC[7]&R1C6 -> 0,1,7,152000;0,1,8,13000;0,1,4,240000; | D114: =VLOOKUP(ROUND(RC[1],-2),Sheet3!C23:C24,2,TRUE) -> 46 | E114: =Sheet3!R[2]C[11] -> 1659140 | F114: 50 | G114: 0,1,7,152000 | H114: ="0,1,8,"&RC[24] -> 0,1,8,13000 | I114: ="0,1,4,"&RC[18] -> 0,1,4,240000 | U114: 0,1,4,140000 | X114: 112 | Y114: =MID(RC[-4],7,99)*1 -> 140000 | AA114: 240000 | AE114: 75000 | AF114: 13000 | AH114: 111 | AI114: 2195107 | AJ114: =SUM(R3C35:RC[-1]) -> 34332804
B115: =RC[5]&R1C6&RC[6]&R1C6&RC[7]&R1C6 -> 0,1,7,52000;0,1,8,14000;0,1,4,244000; | D115: =VLOOKUP(ROUND(RC[1],-2),Sheet3!C23:C24,2,TRUE) -> 46 | E115: =Sheet3!R[2]C[11] -> 1711140 | F115: 55 | G115: 0,1,7,52000 | H115: ="0,1,8,"&RC[24] -> 0,1,8,14000 | I115: ="0,1,4,"&RC[18] -> 0,1,4,244000 | U115: 0,1,4,5000 | X115: 113 | Y115: =MID(RC[-4],7,99)*1 -> 5000 | AA115: 244000 | AE115: 2250 | AF115: 14000 | AH115: 112 | AI115: 2297540 | AJ115: =SUM(R3C35:RC[-1]) -> 36630344
B116: =RC[5]&R1C6&RC[6]&R1C6&RC[7]&R1C6 -> 0,1,7,53000;0,1,8,15000;0,1,4,248000; | D116: =VLOOKUP(ROUND(RC[1],-2),Sheet3!C23:C24,2,TRUE) -> 46 | E116: =Sheet3!R[2]C[11] -> 1764140 | F116: 55 | G116: 0,1,7,53000 | H116: ="0,1,8,"&RC[24] -> 0,1,8,15000 | I116: ="0,1,4,"&RC[18] -> 0,1,4,248000 | U116: 0,1,4,158000 | X116: 114 | Y116: =MID(RC[-4],7,99)*1 -> 158000 | AA116: 248000 | AE116: 80000 | AF116: 15000 | AH116: 113 | AI116: 2402899 | AJ116: =SUM(R3C35:RC[-1]) -> 39033243
B117: =RC[5]&R1C6&RC[6]&R1C6&RC[7]&R1C6 -> 0,1,7,55000;0,1,8,16000;0,1,4,252000; | D117: =VLOOKUP(ROUND(RC[1],-2),Sheet3!C23:C24,2,TRUE) -> 46 | E117: =Sheet3!R[2]C[11] -> 1819140 | F117: 55 | G117: 0,1,7,55000 | H117: ="0,1,8,"&RC[24] -> 0,1,8,16000 | I117: ="0,1,4,"&RC[18] -> 0,1,4,252000 | U117: 0,1,4,5000 | X117: 115 | Y117: =MID(RC[-4],7,99)*1 -> 5000 | AA117: 252000 | AE117: 2250 | AF117: 16000 | AH117: 114 | AI117: 2511222 | AJ117: =SUM(R3C35:RC[-1]) -> 41544465
B118: =RC[5]&R1C6&RC[6]&R1C6&RC[7]&R1C6 -> 0,1,7,57000;0,1,8,17000;0,1,4,256000; | D118: =VLOOKUP(ROUND(RC[1],-2),Sheet3!C23:C24,2,TRUE) -> 46 | E118: =Sheet3!R[2]C[11] -> 1876140 | F118: 55 | G118: 0,1,7,57000 | H118: ="0,1,8,"&RC[24] -> 0,1,8,17000 | I118: ="0,1,4,"&RC[18] -> 0,1,4,256000 | U118: 0,1,4,5000 | X118: 116 | Y118: =MID(RC[-4],7,99)*1 -> 5000 | AA118: 256000 | AE118: 2250 | AF118: 17000 | AH118: 115 | AI118: 2622548 | AJ118: =SUM(R3C35:RC[-1]) -> 44167013
B119: =RC[5]&R1C6&RC[6]&R1C6&RC[7]&R1C6 -> 0,1,7,176000;0,1,8,18000;0,1,4,260000; | D119: =VLOOKUP(ROUND(RC[1],-2),Sheet3!C23:C24,2,TRUE) -> 47 | E119: =Sheet3!R[2]C[11] -> 2052140 | F119: 55 | G119: 0,1,7,176000 | H119: ="0,1,8,"&RC[24] -> 0,1,8,18000 | I119: ="0,1,4,"&RC[18] -> 0,1,4,260000 | U119: 0,1,4,5000 | X119: 117 | Y119: =MID(RC[-4],7,99)*1 -> 5000 | AA119: 260000 | AE119: 2250 | AF119: 18000 | AH119: 116 | AI119: 2736916 | AJ119: =SUM(R3C35:RC[-1]) -> 46903929
B120: =RC[5]&R1C6&RC[6]&R1C6&RC[7]&R1C6 -> 0,1,7,60000;0,1,8,19000;0,1,4,264000; | D120: =VLOOKUP(ROUND(RC[1],-2),Sheet3!C23:C24,2,TRUE) -> 47 | E120: =Sheet3!R[2]C[11] -> 2112140 | F120: 55 | G120: 0,1,7,60000 | H120: ="0,1,8,"&RC[24] -> 0,1,8,19000 | I120: ="0,1,4,"&RC[18] -> 0,1,4,264000 | U120: 0,1,4,195000 | X120: 118 | Y120: =MID(RC[-4],7,99)*1 -> 195000 | AA120: 264000 | AE120: 93750 | AF120: 19000 | AH120: 117 | AI120: 2854366 | AJ120: =SUM(R3C35:RC[-1]) -> 49758295
B121: =RC[5]&R1C6&RC[6]&R1C6&RC[7]&R1C6 -> 0,1,7,61000;0,1,8,20000;0,1,4,268000; | D121: =VLOOKUP(ROUND(RC[1],-2),Sheet3!C23:C24,2,TRUE) -> 47 | E121: =Sheet3!R[2]C[11] -> 2173140 | F121: 55 | G121: 0,1,7,61000 | H121: ="0,1,8,"&RC[24] -> 0,1,8,20000 | I121: ="0,1,4,"&RC[18] -> 0,1,4,268000 | U121: 0,1,4,5000 | X121: 119 | Y121: =MID(RC[-4],7,99)*1 -> 5000 | AA121: 268000 | AE121: 2250 | AF121: 20000 | AH121: 118 | AI121: 2974937 | AJ121: =SUM(R3C35:RC[-1]) -> 52733232
B122: =RC[5]&R1C6&RC[6]&R1C6&RC[7]&R1C6 -> 0,1,7,63000;0,1,8,21000;0,1,4,272000; | D122: =VLOOKUP(ROUND(RC[1],-2),Sheet3!C23:C24,2,TRUE) -> 47 | E122: =Sheet3!R[2]C[11] -> 2236140 | F122: 55 | G122: 0,1,7,63000 | H122: ="0,1,8,"&RC[24] -> 0,1,8,21000 | I122: ="0,1,4,"&RC[18] -> 0,1,4,272000 | U122: 0,1,4,5000 | X122: 120 | Y122: =MID(RC[-4],7,99)*1 -> 5000 | AA122: 272000 | AE122: 2250 | AF122: 21000 | AH122: 119 | AI122: 3098667 | AJ122: =SUM(R3C35:RC[-1]) -> 55831899
B123: =RC[5]&R1C6&RC[6]&R1C6&RC[7]&R1C6 -> 0,1,7,65000;0,1,8,22000;0,1,4,276000; | D123: =VLOOKUP(ROUND(RC[1],-2),Sheet3!C23:C24,2,TRUE) -> 47 | E123: =Sheet3!R[2]C[11] -> 2301140 | F123: 55 | G123: 0,1,7,65000 | H123: ="0,1,8,"&RC[24] -> 0,1,8,22000 | I123: ="0,1,4,"&RC[18] -> 0,1,4,276000 | U123: 0,1,4,195000 | X123: 121 | Y123: =MID(RC[-4],7,99)*1 -> 195000 | AA123: 276000 | AE123: 100000 | AF123: 22000 | AH123: 120 | AI123: 3870716 | AJ123: =SUM(R3C35:RC[-1]) -> 59702615
B124: =RC[5]&R1C6&RC[6]&R1C6&RC[7]&R1C6 -> 0,1,7,201000;0,1,8,23000;0,1,4,280000; | D124: =VLOOKUP(ROUND(RC[1],-2),Sheet3!C23:C24,2,TRUE) -> 48 | E124: =Sheet3!R[2]C[11] -> 2502140 | F124: 55 | G124: 0,1,7,201000 | H124: ="0,1,8,"&RC[24] -> 0,1,8,23000 | I124: ="0,1,4,"&RC[18] -> 0,1,4,280000 | U124: 0,1,4,5000 | X124: 122 | Y124: =MID(RC[-4],7,99)*1 -> 5000 | AA124: 280000 | AE124: 2250 | AF124: 23000 | AH124: 121 | AI124: 4026918 | AJ124: =SUM(R3C35:RC[-1]) -> 63729533
B125: =RC[5]&R1C6&RC[6]&R1C6&RC[7]&R1C6 -> 0,1,7,68000;0,1,8,24000;0,1,4,284000; | D125: =VLOOKUP(ROUND(RC[1],-2),Sheet3!C23:C24,2,TRUE) -> 48 | E125: =Sheet3!R[2]C[11] -> 2570140 | F125: 55 | G125: 0,1,7,68000 | H125: ="0,1,8,"&RC[24] -> 0,1,8,24000 | I125: ="0,1,4,"&RC[18] -> 0,1,4,284000 | U125: 0,1,4,213000 | X125: 123 | Y125: =MID(RC[-4],7,99)*1 -> 213000 | AA125: 284000 | AE125: 110000 | AF125: 24000 | AH125: 122 | AI125: 4187052 | AJ125: =SUM(R3C35:RC[-1]) -> 67916585
B126: =RC[5]&R1C6&RC[6]&R1C6&RC[7]&R1C6&RC[8]&R1C6&RC[9]&R1C6&RC[10]&R1C6&RC[11]&R1C6&RC[12]&R1C6&RC[13]&R1C6&RC[14]&R1C6&RC[15]&R1C6&RC[16]&R1C6&RC[17]&R1C6 -> 0,1,7,70000;0,1,8,25000;0,1,4,288000;1,1,1200106,1;2,1,1200206,1;3,1,1200106,1;4,1,1200206,1;5,1,1200106,1;6,1,1200206,1;7,1,1200106,1;8,1,1200206,1;9,1,1200106,1;10,1,1200206,1; | D126: =VLOOKUP(ROUND(RC[1],-2),Sheet3!C23:C24,2,TRUE) -> 48 | E126: =Sheet3!R[2]C[11] -> 2640140 | F126: 60 | G126: 0,1,7,70000 | H126: ="0,1,8,"&RC[24] -> 0,1,8,25000 | I126: ="0,1,4,"&RC[18] -> 0,1,4,288000 | J126: 1,1,1200106,1 | K126: 2,1,1200206,1 | L126: 3,1,1200106,1 | M126: 4,1,1200206,1 | N126: 5,1,1200106,1 | O126: 6,1,1200206,1 | P126: 7,1,1200106,1 | Q126: 8,1,1200206,1 | R126: 9,1,1200106,1 | S126: 10,1,1200206,1 | U126: 0,1,4,5500 | X126: 124 | Y126: =MID(RC[-4],7,99)*1 -> 5500 | AA126: 288000 | AE126: 2500 | AF126: 25000 | AH126: 123 | AI126: 4351166 | AJ126: =SUM(R3C35:RC[-1]) -> 72267751
B127: =RC[5]&R1C6&RC[6]&R1C6&RC[7]&R1C6&RC[8]&R1C6 -> 0,1,7,72000;0,1,8,26000;0,1,4,292000;0,1,1500006,1; | D127: =VLOOKUP(ROUND(RC[1],-2),Sheet3!C23:C24,2,TRUE) -> 48 | E127: =Sheet3!R[2]C[11] -> 2712140 | F127: 60 | G127: 0,1,7,72000 | H127: ="0,1,8,"&RC[24] -> 0,1,8,26000 | I127: ="0,1,4,"&RC[18] -> 0,1,4,292000 | J127: 0,1,1500006,1 | U127: 0,1,4,5500 | X127: 125 | Y127: =MID(RC[-4],7,99)*1 -> 5500 | AA127: 292000 | AE127: 2500 | AF127: 26000 | AH127: 124 | AI127: 4519307 | AJ127: =SUM(R3C35:RC[-1]) -> 76787058
B128: =RC[5]&R1C6&RC[6]&R1C6&RC[7]&R1C6&RC[8]&R1C6&RC[9]&R1C6&RC[10]&R1C6&RC[11]&R1C6&RC[12]&R1C6&RC[13]&R1C6&RC[14]&R1C6&RC[15]&R1C6&RC[16]&R1C6&RC[17]&R1C6 -> 0,1,7,74000;0,1,8,27000;0,1,4,296000;1,1,1300106,1;2,1,1300206,1;3,1,1300106,1;4,1,1300206,1;5,1,1300106,1;6,1,1300206,1;7,1,1300106,1;8,1,1300206,1;9,1,1300106,1;10,1,1300206,1; | D128: =VLOOKUP(ROUND(RC[1],-2),Sheet3!C23:C24,2,TRUE) -> 49 | E128: =Sheet3!R[2]C[11] -> 2786140 | F128: 60 | G128: 0,1,7,74000 | H128: ="0,1,8,"&RC[24] -> 0,1,8,27000 | I128: ="0,1,4,"&RC[18] -> 0,1,4,296000 | J128: 1,1,1300106,1 | K128: 2,1,1300206,1 | L128: 3,1,1300106,1 | M128: 4,1,1300206,1 | N128: 5,1,1300106,1 | O128: 6,1,1300206,1 | P128: 7,1,1300106,1 | Q128: 8,1,1300206,1 | R128: 9,1,1300106,1 | S128: 10,1,1300206,1 | U128: 0,1,4,5500 | X128: 126 | Y128: =MID(RC[-4],7,99)*1 -> 5500 | AA128: 296000 | AE128: 2500 | AF128: 27000 | AH128: 125 | AI128: 4691522 | AJ128: =SUM(R3C35:RC[-1]) -> 81478580
B129: =RC[5]&R1C6&RC[6]&R1C6&RC[7]&R1C6&RC[8]&R1C6&RC[9]&R1C6&RC[10]&R1C6&RC[11]&R1C6&RC[12]&R1C6&RC[13]&R1C6&RC[14]&R1C6&RC[15]&R1C6&RC[16]&R1C6&RC[17]&R1C6 -> 0,1,7,229000;0,1,8,28000;0,1,4,300000;1,1,1101106,1;2,1,1101206,1;3,1,1102106,1;4,1,1102206,1;5,1,1103106,1;6,1,1103206,1;7,1,1104106,1;8,1,1104206,1;9,1,1105106,1;10,1,1105206,1; | D129: =VLOOKUP(ROUND(RC[1],-2),Sheet3!C23:C24,2,TRUE) -> 49 | E129: =Sheet3!R[2]C[11] -> 3015140 | F129: 60 | G129: 0,1,7,229000 | H129: ="0,1,8,"&RC[24] -> 0,1,8,28000 | I129: ="0,1,4,"&RC[18] -> 0,1,4,300000 | J129: 1,1,1101106,1 | K129: 2,1,1101206,1 | L129: 3,1,1102106,1 | M129: 4,1,1102206,1 | N129: 5,1,1103106,1 | O129: 6,1,1103206,1 | P129: 7,1,1104106,1 | Q129: 8,1,1104206,1 | R129: 9,1,1105106,1 | S129: 10,1,1105206,1 | U129: 0,1,4,5500 | X129: 127 | Y129: =MID(RC[-4],7,99)*1 -> 5500 | AA129: 300000 | AE129: 2500 | AF129: 28000 | AH129: 126 | AI129: 4867857 | AJ129: =SUM(R3C35:RC[-1]) -> 86346437
B130: =RC[5]&R1C6&RC[6]&R1C6&RC[7]&R1C6&RC[8]&R1C6 -> 0,1,7,77000;0,1,8,29000;0,1,4,304000;0,1,1400006,1; | D130: =VLOOKUP(ROUND(RC[1],-2),Sheet3!C23:C24,2,TRUE) -> 49 | E130: =Sheet3!R[2]C[11] -> 3092140 | F130: 60 | G130: 0,1,7,77000 | H130: ="0,1,8,"&RC[24] -> 0,1,8,29000 | I130: ="0,1,4,"&RC[18] -> 0,1,4,304000 | J130: 0,1,1400006,1 | U130: 0,1,4,638000 | X130: 128 | Y130: =MID(RC[-4],7,99)*1 -> 638000 | AA130: 304000 | AE130: 160000 | AF130: 29000 | AH130: 127 | AI130: 5048360 | AJ130: =SUM(R3C35:RC[-1]) -> 91394797
B131: =RC[5]&R1C6&RC[6]&R1C6&RC[7]&R1C6&RC[8]&R1C6 -> 0,1,7,79000;0,1,8,30000;0,1,4,308000;0,1,1600006,1; | D131: =VLOOKUP(ROUND(RC[1],-2),Sheet3!C23:C24,2,TRUE) -> 50 | E131: =Sheet3!R[2]C[11] -> 3171140 | F131: 60 | G131: 0,1,7,79000 | H131: ="0,1,8,"&RC[24] -> 0,1,8,30000 | I131: ="0,1,4,"&RC[18] -> 0,1,4,308000 | J131: 0,1,1600006,1 | U131: 0,1,4,5500 | X131: 129 | Y131: =MID(RC[-4],7,99)*1 -> 5500 | AA131: 308000 | AE131: 2500 | AF131: 30000 | AH131: 128 | AI131: 5233078 | AJ131: =SUM(R3C35:RC[-1]) -> 96627875
B132: =RC[5]&R1C6&RC[6]&R1C6&RC[7]&R1C6 -> 0,1,7,81000;0,1,8,35000;0,1,4,312000; | D132: =VLOOKUP(ROUND(RC[1],-2),Sheet3!C23:C24,2,TRUE) -> 50 | E132: =Sheet3!R[2]C[11] -> 3252140 | F132: 60 | G132: 0,1,7,81000 | H132: ="0,1,8,"&RC[24] -> 0,1,8,35000 | I132: ="0,1,4,"&RC[18] -> 0,1,4,312000 | U132: 0,1,4,5500 | X132: 130 | Y132: =MID(RC[-4],7,99)*1 -> 5500 | AA132: 312000 | AE132: 2500 | AF132: 35000 | AH132: 129 | AI132: 5422057 | AJ132: =SUM(R3C35:RC[-1]) -> 102049932
B133: =RC[5]&R1C6&RC[6]&R1C6&RC[7]&R1C6 -> 0,1,7,83000;0,1,8,40000;0,1,4,316000; | D133: =VLOOKUP(ROUND(RC[1],-2),Sheet3!C23:C24,2,TRUE) -> 50 | E133: =Sheet3!R[2]C[11] -> 3335140 | F133: 60 | G133: 0,1,7,83000 | H133: ="0,1,8,"&RC[24] -> 0,1,8,40000 | I133: ="0,1,4,"&RC[18] -> 0,1,4,316000 | U133: 0,1,4,5500 | X133: 131 | Y133: =MID(RC[-4],7,99)*1 -> 5500 | AA133: 316000 | AE133: 2500 | AF133: 40000 | AH133: 130 | AI133: 5615345 | AJ133: =SUM(R3C35:RC[-1]) -> 107665277
B134: =RC[5]&R1C6&RC[6]&R1C6&RC[7]&R1C6 -> 0,1,7,259000;0,1,8,45000;0,1,4,320000; | D134: =VLOOKUP(ROUND(RC[1],-2),Sheet3!C23:C24,2,TRUE) -> 50 | E134: =Sheet3!R[2]C[11] -> 3594140 | F134: 60 | G134: 0,1,7,259000 | H134: ="0,1,8,"&RC[24] -> 0,1,8,45000 | I134: ="0,1,4,"&RC[18] -> 0,1,4,320000 | U134: 0,1,4,650000 | X134: 132 | Y134: =MID(RC[-4],7,99)*1 -> 650000 | AA134: 320000 | AE134: 160000 | AF134: 45000 | AH134: 131 | AI134: 5812989 | AJ134: =SUM(R3C35:RC[-1]) -> 113478266
B135: =RC[5]&R1C6&RC[6]&R1C6&RC[7]&R1C6 -> 0,1,7,87000;0,1,8,50000;0,1,4,324000; | D135: =VLOOKUP(ROUND(RC[1],-2),Sheet3!C23:C24,2,TRUE) -> 51 | E135: =Sheet3!R[2]C[11] -> 3681140 | F135: 60 | G135: 0,1,7,87000 | H135: ="0,1,8,"&RC[24] -> 0,1,8,50000 | I135: ="0,1,4,"&RC[18] -> 0,1,4,324000 | U135: 0,1,4,5500 | X135: 133 | Y135: =MID(RC[-4],7,99)*1 -> 5500 | AA135: 324000 | AE135: 2500 | AF135: 50000 | AH135: 132 | AI135: 6015034 | AJ135: =SUM(R3C35:RC[-1]) -> 119493300
B136: =RC[5]&R1C6&RC[6]&R1C6&RC[7]&R1C6 -> 0,1,7,89000;0,1,8,55000;0,1,4,328000; | D136: =VLOOKUP(ROUND(RC[1],-2),Sheet3!C23:C24,2,TRUE) -> 51 | E136: =Sheet3!R[2]C[11] -> 3770140 | F136: 60 | G136: 0,1,7,89000 | H136: ="0,1,8,"&RC[24] -> 0,1,8,55000 | I136: ="0,1,4,"&RC[18] -> 0,1,4,328000 | U136: 0,1,4,5500 | X136: 134 | Y136: =MID(RC[-4],7,99)*1 -> 5500 | AA136: 328000 | AE136: 2500 | AF136: 55000 | AH136: 133 | AI136: 6221529 | AJ136: =SUM(R3C35:RC[-1]) -> 125714829
B137: =RC[5]&R1C6&RC[6]&R1C6&RC[7]&R1C6 -> 0,1,7,91000;0,1,8,60000;0,1,4,332000; | D137: =VLOOKUP(ROUND(RC[1],-2),Sheet3!C23:C24,2,TRUE) -> 51 | E137: =Sheet3!R[2]C[11] -> 3861140 | F137: 60 | G137: 0,1,7,91000 | H137: ="0,1,8,"&RC[24] -> 0,1,8,60000 | I137: ="0,1,4,"&RC[18] -> 0,1,4,332000 | U137: 0,1,4,650000 | X137: 135 | Y137: =MID(RC[-4],7,99)*1 -> 650000 | AA137: 332000 | AE137: 160000 | AF137: 60000 | AH137: 134 | AI137: 6432521 | AJ137: =SUM(R3C35:RC[-1]) -> 132147350
B138: =RC[5]&R1C6&RC[6]&R1C6&RC[7]&R1C6 -> 0,1,7,93000;0,1,8,65000;0,1,4,336000; | D138: =VLOOKUP(ROUND(RC[1],-2),Sheet3!C23:C24,2,TRUE) -> 51 | E138: =Sheet3!R[2]C[11] -> 3954140 | F138: 65 | G138: 0,1,7,93000 | H138: ="0,1,8,"&RC[24] -> 0,1,8,65000 | I138: ="0,1,4,"&RC[18] -> 0,1,4,336000 | U138: 0,1,4,6500 | X138: 136 | Y138: =MID(RC[-4],7,99)*1 -> 6500 | AA138: 336000 | AE138: 2750 | AF138: 65000 | AH138: 135 | AI138: 6648055 | AJ138: =SUM(R3C35:RC[-1]) -> 138795405
B139: =RC[5]&R1C6&RC[6]&R1C6&RC[7]&R1C6 -> 0,1,7,290000;0,1,8,70000;0,1,4,340000; | D139: =VLOOKUP(ROUND(RC[1],-2),Sheet3!C23:C24,2,TRUE) -> 52 | E139: =Sheet3!R[2]C[11] -> 4244140 | F139: 65 | G139: 0,1,7,290000 | H139: ="0,1,8,"&RC[24] -> 0,1,8,70000 | I139: ="0,1,4,"&RC[18] -> 0,1,4,340000 | U139: 0,1,4,650000 | X139: 137 | Y139: =MID(RC[-4],7,99)*1 -> 650000 | AA139: 340000 | AE139: 160000 | AF139: 70000 | AH139: 136 | AI139: 6868180 | AJ139: =SUM(R3C35:RC[-1]) -> 145663585
B140: =RC[5]&R1C6&RC[6]&R1C6&RC[7]&R1C6 -> 0,1,7,97000;0,1,8,75000;0,1,4,344000; | D140: =VLOOKUP(ROUND(RC[1],-2),Sheet3!C23:C24,2,TRUE) -> 52 | E140: =Sheet3!R[2]C[11] -> 4341140 | F140: 65 | G140: 0,1,7,97000 | H140: ="0,1,8,"&RC[24] -> 0,1,8,75000 | I140: ="0,1,4,"&RC[18] -> 0,1,4,344000 | U140: 0,1,4,6500 | X140: 138 | Y140: =MID(RC[-4],7,99)*1 -> 6500 | AA140: 344000 | AE140: 2750 | AF140: 75000 | AH140: 137 | AI140: 7092941 | AJ140: =SUM(R3C35:RC[-1]) -> 152756526
B141: =RC[5]&R1C6&RC[6]&R1C6&RC[7]&R1C6 -> 0,1,7,99000;0,1,8,80000;0,1,4,348000; | D141: =VLOOKUP(ROUND(RC[1],-2),Sheet3!C23:C24,2,TRUE) -> 52 | E141: =Sheet3!R[2]C[11] -> 4440140 | F141: 65 | G141: 0,1,7,99000 | H141: ="0,1,8,"&RC[24] -> 0,1,8,80000 | I141: ="0,1,4,"&RC[18] -> 0,1,4,348000 | U141: 0,1,4,6500 | X141: 139 | Y141: =MID(RC[-4],7,99)*1 -> 6500 | AA141: 348000 | AE141: 2750 | AF141: 80000 | AH141: 138 | AI141: 7322387 | AJ141: =SUM(R3C35:RC[-1]) -> 160078913
B142: =RC[5]&R1C6&RC[6]&R1C6&RC[7]&R1C6 -> 0,1,7,101000;0,1,8,85000;0,1,4,352000; | D142: =VLOOKUP(ROUND(RC[1],-2),Sheet3!C23:C24,2,TRUE) -> 52 | E142: =Sheet3!R[2]C[11] -> 4541140 | F142: 65 | G142: 0,1,7,101000 | H142: ="0,1,8,"&RC[24] -> 0,1,8,85000 | I142: ="0,1,4,"&RC[18] -> 0,1,4,352000 | U142: 0,1,4,6500 | X142: 140 | Y142: =MID(RC[-4],7,99)*1 -> 6500 | AA142: 352000 | AE142: 2750 | AF142: 85000 | AH142: 139 | AI142: 7556563 | AJ142: =SUM(R3C35:RC[-1]) -> 167635476
B143: =RC[5]&R1C6&RC[6]&R1C6&RC[7]&R1C6 -> 0,1,7,103000;0,1,8,90000;0,1,4,356000; | D143: =VLOOKUP(ROUND(RC[1],-2),Sheet3!C23:C24,2,TRUE) -> 52 | E143: =Sheet3!R[2]C[11] -> 4644140 | F143: 65 | G143: 0,1,7,103000 | H143: ="0,1,8,"&RC[24] -> 0,1,8,90000 | I143: ="0,1,4,"&RC[18] -> 0,1,4,356000 | U143: 0,1,4,6500 | X143: 141 | Y143: =MID(RC[-4],7,99)*1 -> 6500 | AA143: 356000 | AE143: 2750 | AF143: 90000 | AH143: 140 | AI143: 7795517 | AJ143: =SUM(R3C35:RC[-1]) -> 175430993
B144: =RC[5]&R1C6&RC[6]&R1C6&RC[7]&R1C6 -> 0,1,7,321000;0,1,8,95000;0,1,4,360000; | D144: =VLOOKUP(ROUND(RC[1],-2),Sheet3!C23:C24,2,TRUE) -> 53 | E144: =Sheet3!R[2]C[11] -> 4965140 | F144: 65 | G144: 0,1,7,321000 | H144: ="0,1,8,"&RC[24] -> 0,1,8,95000 | I144: ="0,1,4,"&RC[18] -> 0,1,4,360000 | U144: 0,1,4,650000 | X144: 142 | Y144: =MID(RC[-4],7,99)*1 -> 650000 | AA144: 360000 | AE144: 170000 | AF144: 95000 | AH144: 141 | AI144: 8039296 | AJ144: =SUM(R3C35:RC[-1]) -> 183470289
B145: =RC[5]&R1C6&RC[6]&R1C6&RC[7]&R1C6 -> 0,1,7,107000;0,1,8,100000;0,1,4,364000; | D145: =VLOOKUP(ROUND(RC[1],-2),Sheet3!C23:C24,2,TRUE) -> 53 | E145: =Sheet3!R[2]C[11] -> 5072140 | F145: 65 | G145: 0,1,7,107000 | H145: ="0,1,8,"&RC[24] -> 0,1,8,100000 | I145: ="0,1,4,"&RC[18] -> 0,1,4,364000 | U145: 0,1,4,6500 | X145: 143 | Y145: =MID(RC[-4],7,99)*1 -> 6500 | AA145: 364000 | AE145: 2750 | AF145: 100000 | AH145: 142 | AI145: 8287946 | AJ145: =SUM(R3C35:RC[-1]) -> 191758235
B146: =RC[5]&R1C6&RC[6]&R1C6&RC[7]&R1C6 -> 0,1,7,110000;0,1,8,105000;0,1,4,368000; | D146: =VLOOKUP(ROUND(RC[1],-2),Sheet3!C23:C24,2,TRUE) -> 53 | E146: =Sheet3!R[2]C[11] -> 5182140 | F146: 65 | G146: 0,1,7,110000 | H146: ="0,1,8,"&RC[24] -> 0,1,8,105000 | I146: ="0,1,4,"&RC[18] -> 0,1,4,368000 | U146: 0,1,4,6500 | X146: 144 | Y146: =MID(RC[-4],7,99)*1 -> 6500 | AA146: 368000 | AE146: 2750 | AF146: 105000 | AH146: 143 | AI146: 8541515 | AJ146: =SUM(R3C35:RC[-1]) -> 200299750
B147: =RC[5]&R1C6&RC[6]&R1C6&RC[7]&R1C6 -> 0,1,7,112000;0,1,8,110000;0,1,4,372000; | D147: =VLOOKUP(ROUND(RC[1],-2),Sheet3!C23:C24,2,TRUE) -> 53 | E147: =Sheet3!R[2]C[11] -> 5294140 | F147: 65 | G147: 0,1,7,112000 | H147: ="0,1,8,"&RC[24] -> 0,1,8,110000 | I147: ="0,1,4,"&RC[18] -> 0,1,4,372000 | U147: 0,1,4,650000 | X147: 145 | Y147: =MID(RC[-4],7,99)*1 -> 650000 | AA147: 372000 | AE147: 186500 | AF147: 110000 | AH147: 144 | AI147: 8800049 | AJ147: =SUM(R3C35:RC[-1]) -> 209099799
B148: =RC[5]&R1C6&RC[6]&R1C6&RC[7]&R1C6&RC[8]&R1C6 -> 0,1,7,114000;0,1,8,115000;0,1,4,376000;0,1,1500007,1; | D148: =VLOOKUP(ROUND(RC[1],-2),Sheet3!C23:C24,2,TRUE) -> 53 | E148: =Sheet3!R[2]C[11] -> 5408140 | F148: 70 | G148: 0,1,7,114000 | H148: ="0,1,8,"&RC[24] -> 0,1,8,115000 | I148: ="0,1,4,"&RC[18] -> 0,1,4,376000 | J148: 0,1,1500007,1 | U148: 0,1,4,7500 | X148: 146 | Y148: =MID(RC[-4],7,99)*1 -> 7500 | AA148: 376000 | AE148: 3000 | AF148: 115000 | AH148: 145 | AI148: 9063595 | AJ148: =SUM(R3C35:RC[-1]) -> 218163394
B149: =RC[5]&R1C6&RC[6]&R1C6&RC[7]&R1C6&RC[8]&R1C6&RC[9]&R1C6&RC[10]&R1C6&RC[11]&R1C6&RC[12]&R1C6&RC[13]&R1C6&RC[14]&R1C6&RC[15]&R1C6&RC[16]&R1C6&RC[17]&R1C6 -> 0,1,7,356000;0,1,8,120000;0,1,4,380000;1,1,1200107,1;2,1,1200207,1;3,1,1200107,1;4,1,1200207,1;5,1,1200107,1;6,1,1200207,1;7,1,1200107,1;8,1,1200207,1;9,1,1200107,1;10,1,1200207,1; | D149: =VLOOKUP(ROUND(RC[1],-2),Sheet3!C23:C24,2,TRUE) -> 54 | E149: =Sheet3!R[2]C[11] -> 5764140 | F149: 70 | G149: 0,1,7,356000 | H149: ="0,1,8,"&RC[24] -> 0,1,8,120000 | I149: ="0,1,4,"&RC[18] -> 0,1,4,380000 | J149: 1,1,1200107,1 | K149: 2,1,1200207,1 | L149: 3,1,1200107,1 | M149: 4,1,1200207,1 | N149: 5,1,1200107,1 | O149: 6,1,1200207,1 | P149: 7,1,1200107,1 | Q149: 8,1,1200207,1 | R149: 9,1,1200107,1 | S149: 10,1,1200207,1 | U149: 0,1,4,7500 | X149: 147 | Y149: =MID(RC[-4],7,99)*1 -> 7500 | AA149: 380000 | AE149: 3000 | AF149: 120000 | AH149: 146 | AI149: 9332201 | AJ149: =SUM(R3C35:RC[-1]) -> 227495595
B150: =RC[5]&R1C6&RC[6]&R1C6&RC[7]&R1C6&RC[8]&R1C6 -> 0,1,7,119000;0,1,8,125000;0,1,4,384000;0,1,1600007,1; | D150: =VLOOKUP(ROUND(RC[1],-2),Sheet3!C23:C24,2,TRUE) -> 54 | E150: =Sheet3!R[2]C[11] -> 5883140 | F150: 70 | G150: 0,1,7,119000 | H150: ="0,1,8,"&RC[24] -> 0,1,8,125000 | I150: ="0,1,4,"&RC[18] -> 0,1,4,384000 | J150: 0,1,1600007,1 | U150: 0,1,4,1300000 | X150: 148 | Y150: =MID(RC[-4],7,99)*1 -> 1300000 | AA150: 384000 | AE150: 363000 | AF150: 125000 | AH150: 147 | AI150: 9605912 | AJ150: =SUM(R3C35:RC[-1]) -> 237101507
B151: =RC[5]&R1C6&RC[6]&R1C6&RC[7]&R1C6&RC[8]&R1C6&RC[9]&R1C6&RC[10]&R1C6&RC[11]&R1C6&RC[12]&R1C6&RC[13]&R1C6&RC[14]&R1C6&RC[15]&R1C6&RC[16]&R1C6&RC[17]&R1C6 -> 0,1,7,182000;0,1,8,130000;0,1,4,388000;1,1,1300107,1;2,1,1300207,1;3,1,1300107,1;4,1,1300207,1;5,1,1300107,1;6,1,1300207,1;7,1,1300107,1;8,1,1300207,1;9,1,1300107,1;10,1,1300207,1; | D151: =VLOOKUP(ROUND(RC[1],-2),Sheet3!C23:C24,2,TRUE) -> 54 | E151: =Sheet3!R[2]C[11] -> 6065140 | F151: 70 | G151: 0,1,7,182000 | H151: ="0,1,8,"&RC[24] -> 0,1,8,130000 | I151: ="0,1,4,"&RC[18] -> 0,1,4,388000 | J151: 1,1,1300107,1 | K151: 2,1,1300207,1 | L151: 3,1,1300107,1 | M151: 4,1,1300207,1 | N151: 5,1,1300107,1 | O151: 6,1,1300207,1 | P151: 7,1,1300107,1 | Q151: 8,1,1300207,1 | R151: 9,1,1300107,1 | S151: 10,1,1300207,1 | U151: 0,1,4,7500 | X151: 149 | Y151: =MID(RC[-4],7,99)*1 -> 7500 | AA151: 388000 | AE151: 3000 | AF151: 130000 | AH151: 148 | AI151: 9884777 | AJ151: =SUM(R3C35:RC[-1]) -> 246986284
B152: =RC[5]&R1C6&RC[6]&R1C6&RC[7]&R1C6&RC[8]&R1C6&RC[9]&R1C6&RC[10]&R1C6&RC[11]&R1C6&RC[12]&R1C6&RC[13]&R1C6&RC[14]&R1C6&RC[15]&R1C6&RC[16]&R1C6&RC[17]&R1C6 -> 0,1,7,187000;0,1,8,135000;0,1,4,392000;1,1,1101107,1;2,1,1101207,1;3,1,1102107,1;4,1,1102207,1;5,1,1103107,1;6,1,1103207,1;7,1,1104107,1;8,1,1104207,1;9,1,1105107,1;10,1,1105207,1; | D152: =VLOOKUP(ROUND(RC[1],-2),Sheet3!C23:C24,2,TRUE) -> 54 | E152: =Sheet3!R[2]C[11] -> 6252140 | F152: 70 | G152: 0,1,7,187000 | H152: ="0,1,8,"&RC[24] -> 0,1,8,135000 | I152: ="0,1,4,"&RC[18] -> 0,1,4,392000 | J152: 1,1,1101107,1 | K152: 2,1,1101207,1 | L152: 3,1,1102107,1 | M152: 4,1,1102207,1 | N152: 5,1,1103107,1 | O152: 6,1,1103207,1 | P152: 7,1,1104107,1 | Q152: 8,1,1104207,1 | R152: 9,1,1105107,1 | S152: 10,1,1105207,1 | U152: 0,1,4,1400000 | X152: 150 | Y152: =MID(RC[-4],7,99)*1 -> 1400000 | AA152: 392000 | AE152: 485000 | AF152: 135000 | AH152: 149 | AI152: 10168841 | AJ152: =SUM(R3C35:RC[-1]) -> 257155125
B153: =RC[5]&R1C6&RC[6]&R1C6&RC[7]&R1C6&RC[8]&R1C6 -> 0,1,7,193000;0,1,8,140000;0,1,4,396000;0,1,1400007,1; | D153: =VLOOKUP(ROUND(RC[1],-2),Sheet3!C23:C24,2,TRUE) -> 55 | E153: =Sheet3!R[2]C[11] -> 6445140 | F153: 70 | G153: 0,1,7,193000 | H153: ="0,1,8,"&RC[24] -> 0,1,8,140000 | I153: ="0,1,4,"&RC[18] -> 0,1,4,396000 | J153: 0,1,1400007,1 | U153: 0,1,4,7500 | X153: 151 | Y153: =MID(RC[-4],7,99)*1 -> 7500 | AA153: 396000 | AE153: 3000 | AF153: 140000 | AH153: 150 | AI153: 10458152 | AJ153: =SUM(R3C35:RC[-1]) -> 267613277
B154: =RC[5]&R1C6&RC[6]&R1C6&RC[7]&R1C6 -> 0,1,7,575000;0,1,8,145000;0,1,4,400000; | D154: =VLOOKUP(ROUND(RC[1],-2),Sheet3!C23:C24,2,TRUE) -> 55 | E154: =Sheet3!R[2]C[11] -> 7020140 | F154: 70 | G154: 0,1,7,575000 | H154: ="0,1,8,"&RC[24] -> 0,1,8,145000 | I154: ="0,1,4,"&RC[18] -> 0,1,4,400000 | U154: 0,1,4,7500 | X154: 152 | Y154: =MID(RC[-4],7,99)*1 -> 7500 | AA154: 400000 | AE154: 3000 | AF154: 145000 | AH154: 151 | AI154: 10752757 | AJ154: =SUM(R3C35:RC[-1]) -> 278366034
B155: =RC[5]&R1C6&RC[6]&R1C6&RC[7]&R1C6 -> 0,1,7,204000;0,1,8,150000;0,1,4,405000; | D155: =VLOOKUP(ROUND(RC[1],-2),Sheet3!C23:C24,2,TRUE) -> 56 | E155: =Sheet3!R[2]C[11] -> 7224140 | F155: 70 | G155: 0,1,7,204000 | H155: ="0,1,8,"&RC[24] -> 0,1,8,150000 | I155: ="0,1,4,"&RC[18] -> 0,1,4,405000 | U155: 0,1,4,7500 | X155: 153 | Y155: =MID(RC[-4],7,99)*1 -> 7500 | AA155: 405000 | AE155: 3000 | AF155: 150000 | AH155: 152 | AI155: 11052702 | AJ155: =SUM(R3C35:RC[-1]) -> 289418736
B156: =RC[5]&R1C6&RC[6]&R1C6&RC[7]&R1C6 -> 0,1,7,209000;0,1,8,155000;0,1,4,410000; | D156: =VLOOKUP(ROUND(RC[1],-2),Sheet3!C23:C24,2,TRUE) -> 56 | E156: =Sheet3!R[2]C[11] -> 7433140 | F156: 70 | G156: 0,1,7,209000 | H156: ="0,1,8,"&RC[24] -> 0,1,8,155000 | I156: ="0,1,4,"&RC[18] -> 0,1,4,410000 | U156: 0,1,4,1400000 | X156: 154 | Y156: =MID(RC[-4],7,99)*1 -> 1400000 | AA156: 410000 | AE156: 485000 | AF156: 155000 | AH156: 153 | AI156: 11358035 | AJ156: =SUM(R3C35:RC[-1]) -> 300776771
B157: =RC[5]&R1C6&RC[6]&R1C6&RC[7]&R1C6 -> 0,1,7,215000;0,1,8,160000;0,1,4,415000; | D157: =VLOOKUP(ROUND(RC[1],-2),Sheet3!C23:C24,2,TRUE) -> 56 | E157: =Sheet3!R[2]C[11] -> 7648140 | F157: 75 | G157: 0,1,7,215000 | H157: ="0,1,8,"&RC[24] -> 0,1,8,160000 | I157: ="0,1,4,"&RC[18] -> 0,1,4,415000 | U157: 0,1,4,10000 | X157: 155 | Y157: =MID(RC[-4],7,99)*1 -> 10000 | AA157: 415000 | AE157: 4000 | AF157: 160000 | AH157: 154 | AI157: 11668802 | AJ157: =SUM(R3C35:RC[-1]) -> 312445573
B158: =RC[5]&R1C6&RC[6]&R1C6&RC[7]&R1C6 -> 0,1,7,221000;0,1,8,165000;0,1,4,420000; | D158: =VLOOKUP(ROUND(RC[1],-2),Sheet3!C23:C24,2,TRUE) -> 56 | E158: =Sheet3!R[2]C[11] -> 7869140 | F158: 75 | G158: 0,1,7,221000 | H158: ="0,1,8,"&RC[24] -> 0,1,8,165000 | I158: ="0,1,4,"&RC[18] -> 0,1,4,420000 | U158: 0,1,4,10000 | X158: 156 | Y158: =MID(RC[-4],7,99)*1 -> 10000 | AA158: 420000 | AE158: 4000 | AF158: 165000 | AH158: 155 | AI158: 11985049 | AJ158: =SUM(R3C35:RC[-1]) -> 324430622
B159: =RC[5]&R1C6&RC[6]&R1C6&RC[7]&R1C6 -> 0,1,7,687000;0,1,8,170000;0,1,4,425000; | D159: =VLOOKUP(ROUND(RC[1],-2),Sheet3!C23:C24,2,TRUE) -> 57 | E159: =Sheet3!R[2]C[11] -> 8556140 | F159: 75 | G159: 0,1,7,687000 | H159: ="0,1,8,"&RC[24] -> 0,1,8,170000 | I159: ="0,1,4,"&RC[18] -> 0,1,4,425000 | U159: 0,1,4,2180000 | X159: 157 | Y159: =MID(RC[-4],7,99)*1 -> 2180000 | AA159: 425000 | AE159: 900000 | AF159: 170000 | AH159: 156 | AI159: 12306825 | AJ159: =SUM(R3C35:RC[-1]) -> 336737447
B160: =RC[5]&R1C6&RC[6]&R1C6&RC[7]&R1C6 -> 0,1,7,232000;0,1,8,175000;0,1,4,430000; | D160: =VLOOKUP(ROUND(RC[1],-2),Sheet3!C23:C24,2,TRUE) -> 57 | E160: =Sheet3!R[2]C[11] -> 8788140 | F160: 75 | G160: 0,1,7,232000 | H160: ="0,1,8,"&RC[24] -> 0,1,8,175000 | I160: ="0,1,4,"&RC[18] -> 0,1,4,430000 | U160: 0,1,4,10000 | X160: 158 | Y160: =MID(RC[-4],7,99)*1 -> 10000 | AA160: 430000 | AE160: 4000 | AF160: 175000 | AH160: 157 | AI160: 12634176 | AJ160: =SUM(R3C35:RC[-1]) -> 349371623
B161: =RC[5]&R1C6&RC[6]&R1C6&RC[7]&R1C6 -> 0,1,7,238000;0,1,8,180000;0,1,4,435000; | D161: =VLOOKUP(ROUND(RC[1],-2),Sheet3!C23:C24,2,TRUE) -> 57 | E161: =Sheet3!R[2]C[11] -> 9026140 | F161: 75 | G161: 0,1,7,238000 | H161: ="0,1,8,"&RC[24] -> 0,1,8,180000 | I161: ="0,1,4,"&RC[18] -> 0,1,4,435000 | U161: 0,1,4,10000 | X161: 159 | Y161: =MID(RC[-4],7,99)*1 -> 10000 | AA161: 435000 | AE161: 4000 | AF161: 180000 | AH161: 158 | AI161: 12967148 | AJ161: =SUM(R3C35:RC[-1]) -> 362338771
B162: =RC[5]&R1C6&RC[6]&R1C6&RC[7]&R1C6 -> 0,1,7,244000;0,1,8,185000;0,1,4,440000; | D162: =VLOOKUP(ROUND(RC[1],-2),Sheet3!C23:C24,2,TRUE) -> 58 | E162: =Sheet3!R[2]C[11] -> 9270140 | F162: 75 | G162: 0,1,7,244000 | H162: ="0,1,8,"&RC[24] -> 0,1,8,185000 | I162: ="0,1,4,"&RC[18] -> 0,1,4,440000 | U162: 0,1,4,10000 | X162: 160 | Y162: =MID(RC[-4],7,99)*1 -> 10000 | AA162: 440000 | AE162: 4000 | AF162: 185000 | AH162: 159 | AI162: 13305789 | AJ162: =SUM(R3C35:RC[-1]) -> 375644560
B163: =RC[5]&R1C6&RC[6]&R1C6&RC[7]&R1C6 -> 0,1,7,250000;0,1,8,190000;0,1,4,445000; | D163: =VLOOKUP(ROUND(RC[1],-2),Sheet3!C23:C24,2,TRUE) -> 58 | E163: =Sheet3!R[2]C[11] -> 9520140 | F163: 75 | G163: 0,1,7,250000 | H163: ="0,1,8,"&RC[24] -> 0,1,8,190000 | I163: ="0,1,4,"&RC[18] -> 0,1,4,445000 | U163: 0,1,4,10000 | X163: 161 | Y163: =MID(RC[-4],7,99)*1 -> 10000 | AA163: 445000 | AE163: 4000 | AF163: 190000 | AH163: 160 | AI163: 13650146 | AJ163: =SUM(R3C35:RC[-1]) -> 389294706
B164: =RC[5]&R1C6&RC[6]&R1C6&RC[7]&R1C6 -> 0,1,7,779000;0,1,8,195000;0,1,4,450000; | D164: =VLOOKUP(ROUND(RC[1],-2),Sheet3!C23:C24,2,TRUE) -> 59 | E164: =Sheet3!R[2]C[11] -> 10299140 | F164: 75 | G164: 0,1,7,779000 | H164: ="0,1,8,"&RC[24] -> 0,1,8,195000 | I164: ="0,1,4,"&RC[18] -> 0,1,4,450000 | U164: 0,1,4,10000 | X164: 162 | Y164: =MID(RC[-4],7,99)*1 -> 10000 | AA164: 450000 | AE164: 4000 | AF164: 195000 | AH164: 161 | AI164: 14000264 | AJ164: =SUM(R3C35:RC[-1]) -> 403294970
B165: =RC[5]&R1C6&RC[6]&R1C6&RC[7]&R1C6 -> 0,1,7,263000;0,1,8,200000;0,1,4,455000; | D165: =VLOOKUP(ROUND(RC[1],-2),Sheet3!C23:C24,2,TRUE) -> 59 | E165: =Sheet3!R[2]C[11] -> 10562140 | F165: 75 | G165: 0,1,7,263000 | H165: ="0,1,8,"&RC[24] -> 0,1,8,200000 | I165: ="0,1,4,"&RC[18] -> 0,1,4,455000 | U165: 0,1,4,2180000 | X165: 163 | Y165: =MID(RC[-4],7,99)*1 -> 2180000 | AA165: 455000 | AE165: 900000 | AF165: 200000 | AH165: 162 | AI165: 14356192 | AJ165: =SUM(R3C35:RC[-1]) -> 417651162
B166: =RC[5]&R1C6&RC[6]&R1C6&RC[7]&R1C6 -> 0,1,7,269000;0,1,8,205000;0,1,4,460000; | D166: =VLOOKUP(ROUND(RC[1],-2),Sheet3!C23:C24,2,TRUE) -> 59 | E166: =Sheet3!R[2]C[11] -> 10831140 | F166: 75 | G166: 0,1,7,269000 | H166: ="0,1,8,"&RC[24] -> 0,1,8,205000 | I166: ="0,1,4,"&RC[18] -> 0,1,4,460000 | U166: 0,1,4,10000 | X166: 164 | Y166: =MID(RC[-4],7,99)*1 -> 10000 | AA166: 460000 | AE166: 4000 | AF166: 205000 | AH166: 163 | AI166: 14717976 | AJ166: =SUM(R3C35:RC[-1]) -> 432369138
B167: =RC[5]&R1C6&RC[6]&R1C6&RC[7]&R1C6&RC[8]&R1C6 -> 0,1,7,275000;0,1,8,210000;0,1,4,465000;0,1,1500008,1; | D167: =VLOOKUP(ROUND(RC[1],-2),Sheet3!C23:C24,2,TRUE) -> 59 | E167: =Sheet3!R[2]C[11] -> 11106140 | F167: 80 | G167: 0,1,7,275000 | H167: ="0,1,8,"&RC[24] -> 0,1,8,210000 | I167: ="0,1,4,"&RC[18] -> 0,1,4,465000 | J167: 0,1,1500008,1 | U167: 0,1,4,12000 | X167: 165 | Y167: =MID(RC[-4],7,99)*1 -> 12000 | AA167: 465000 | AE167: 5000 | AF167: 210000 | AH167: 164 | AI167: 15085663 | AJ167: =SUM(R3C35:RC[-1]) -> 447454801
B168: =RC[5]&R1C6&RC[6]&R1C6&RC[7]&R1C6&RC[8]&R1C6&RC[9]&R1C6&RC[10]&R1C6&RC[11]&R1C6&RC[12]&R1C6&RC[13]&R1C6&RC[14]&R1C6&RC[15]&R1C6&RC[16]&R1C6&RC[17]&R1C6 -> 0,1,7,282000;0,1,8,215000;0,1,4,470000;1,1,1300108,1;2,1,1300208,1;3,1,1300108,1;4,1,1300208,1;5,1,1300108,1;6,1,1300208,1;7,1,1300108,1;8,1,1300208,1;9,1,1300108,1;10,1,1300208,1; | D168: =VLOOKUP(ROUND(RC[1],-2),Sheet3!C23:C24,2,TRUE) -> 59 | E168: =Sheet3!R[2]C[11] -> 11388140 | F168: 80 | G168: 0,1,7,282000 | H168: ="0,1,8,"&RC[24] -> 0,1,8,215000 | I168: ="0,1,4,"&RC[18] -> 0,1,4,470000 | J168: 1,1,1300108,1 | K168: 2,1,1300208,1 | L168: 3,1,1300108,1 | M168: 4,1,1300208,1 | N168: 5,1,1300108,1 | O168: 6,1,1300208,1 | P168: 7,1,1300108,1 | Q168: 8,1,1300208,1 | R168: 9,1,1300108,1 | S168: 10,1,1300208,1 | U168: 0,1,4,12000 | X168: 166 | Y168: =MID(RC[-4],7,99)*1 -> 12000 | AA168: 470000 | AE168: 5000 | AF168: 215000 | AH168: 165 | AI168: 15459300 | AJ168: =SUM(R3C35:RC[-1]) -> 462914101
B169: =RC[5]&R1C6&RC[6]&R1C6&RC[7]&R1C6 -> 0,1,7,878000;0,1,8,220000;0,1,4,475000; | D169: =VLOOKUP(ROUND(RC[1],-2),Sheet3!C23:C24,2,TRUE) -> 60 | E169: =Sheet3!R[2]C[11] -> 12266140 | F169: 80 | G169: 0,1,7,878000 | H169: ="0,1,8,"&RC[24] -> 0,1,8,220000 | I169: ="0,1,4,"&RC[18] -> 0,1,4,475000 | U169: 0,1,4,2200000 | X169: 167 | Y169: =MID(RC[-4],7,99)*1 -> 2200000 | AA169: 475000 | AE169: 1000000 | AF169: 220000 | AH169: 166 | AI169: 15838933 | AJ169: =SUM(R3C35:RC[-1]) -> 478753034
B170: =RC[5]&R1C6&RC[6]&R1C6&RC[7]&R1C6 -> 0,1,7,295000;0,1,8,225000;0,1,4,480000; | D170: =VLOOKUP(ROUND(RC[1],-2),Sheet3!C23:C24,2,TRUE) -> 60 | E170: =Sheet3!R[2]C[11] -> 12561140 | F170: 80 | G170: 0,1,7,295000 | H170: ="0,1,8,"&RC[24] -> 0,1,8,225000 | I170: ="0,1,4,"&RC[18] -> 0,1,4,480000 | U170: 0,1,4,12000 | X170: 168 | Y170: =MID(RC[-4],7,99)*1 -> 12000 | AA170: 480000 | AE170: 5000 | AF170: 225000 | AH170: 167 | AI170: 16224610 | AJ170: =SUM(R3C35:RC[-1]) -> 494977644
B171: =RC[5]&R1C6&RC[6]&R1C6&RC[7]&R1C6 -> 0,1,7,301000;0,1,8,230000;0,1,4,485000; | D171: =VLOOKUP(ROUND(RC[1],-2),Sheet3!C23:C24,2,TRUE) -> 60 | E171: =Sheet3!R[2]C[11] -> 12862140 | F171: 80 | G171: 0,1,7,301000 | H171: ="0,1,8,"&RC[24] -> 0,1,8,230000 | I171: ="0,1,4,"&RC[18] -> 0,1,4,485000 | U171: 0,1,4,12000 | X171: 169 | Y171: =MID(RC[-4],7,99)*1 -> 12000 | AA171: 485000 | AE171: 5000 | AF171: 230000 | AH171: 168 | AI171: 16616377 | AJ171: =SUM(R3C35:RC[-1]) -> 511594021
B172: =RC[5]&R1C6&RC[6]&R1C6&RC[7]&R1C6 -> 0,1,7,308000;0,1,8,235000;0,1,4,490000; | D172: =VLOOKUP(ROUND(RC[1],-2),Sheet3!C23:C24,2,TRUE) -> 61 | E172: =Sheet3!R[2]C[11] -> 13170140 | F172: 80 | G172: 0,1,7,308000 | H172: ="0,1,8,"&RC[24] -> 0,1,8,235000 | I172: ="0,1,4,"&RC[18] -> 0,1,4,490000 | U172: 0,1,4,2300000 | X172: 170 | Y172: =MID(RC[-4],7,99)*1 -> 2300000 | AA172: 490000 | AE172: 1200000 | AF172: 235000 | AH172: 169 | AI172: 17014282 | AJ172: =SUM(R3C35:RC[-1]) -> 528608303
B173: =RC[5]&R1C6&RC[6]&R1C6&RC[7]&R1C6 -> 0,1,7,315000;0,1,8,240000;0,1,4,495000; | D173: =VLOOKUP(ROUND(RC[1],-2),Sheet3!C23:C24,2,TRUE) -> 61 | E173: =Sheet3!R[2]C[11] -> 13485140 | F173: 80 | G173: 0,1,7,315000 | H173: ="0,1,8,"&RC[24] -> 0,1,8,240000 | I173: ="0,1,4,"&RC[18] -> 0,1,4,495000 | U173: 0,1,4,12000 | X173: 171 | Y173: =MID(RC[-4],7,99)*1 -> 12000 | AA173: 495000 | AE173: 5000 | AF173: 240000 | AH173: 170 | AI173: 17418370 | AJ173: =SUM(R3C35:RC[-1]) -> 546026673
B174: =RC[5]&R1C6&RC[6]&R1C6&RC[7]&R1C6 -> 0,1,7,982000;0,1,8,245000;0,1,4,500000; | D174: =VLOOKUP(ROUND(RC[1],-2),Sheet3!C23:C24,2,TRUE) -> 62 | E174: =Sheet3!R[2]C[11] -> 14467140 | F174: 80 | G174: 0,1,7,982000 | H174: ="0,1,8,"&RC[24] -> 0,1,8,245000 | I174: ="0,1,4,"&RC[18] -> 0,1,4,500000 | U174: 0,1,4,12000 | X174: 172 | Y174: =MID(RC[-4],7,99)*1 -> 12000 | AA174: 500000 | AE174: 5000 | AF174: 245000 | AH174: 171 | AI174: 17828689 | AJ174: =SUM(R3C35:RC[-1]) -> 563855362
B175: =RC[5]&R1C6&RC[6]&R1C6&RC[7]&R1C6 -> 0,1,7,329000;0,1,8,250000;0,1,4,510000; | D175: =VLOOKUP(ROUND(RC[1],-2),Sheet3!C23:C24,2,TRUE) -> 62 | E175: =Sheet3!R[2]C[11] -> 14796140 | F175: 85 | G175: 0,1,7,329000 | H175: ="0,1,8,"&RC[24] -> 0,1,8,250000 | I175: ="0,1,4,"&RC[18] -> 0,1,4,510000 | U175: 0,1,4,13500 | X175: 173 | Y175: =MID(RC[-4],7,99)*1 -> 13500 | AA175: 510000 | AE175: 5500 | AF175: 250000 | AH175: 172 | AI175: 18245286 | AJ175: =SUM(R3C35:RC[-1]) -> 582100648
B176: =RC[5]&R1C6&RC[6]&R1C6&RC[7]&R1C6 -> 0,1,7,336000;0,1,8,255000;0,1,4,520000; | D176: =VLOOKUP(ROUND(RC[1],-2),Sheet3!C23:C24,2,TRUE) -> 62 | E176: =Sheet3!R[2]C[11] -> 15132140 | F176: 85 | G176: 0,1,7,336000 | H176: ="0,1,8,"&RC[24] -> 0,1,8,255000 | I176: ="0,1,4,"&RC[18] -> 0,1,4,520000 | U176: 0,1,4,2368000 | X176: 174 | Y176: =MID(RC[-4],7,99)*1 -> 2368000 | AA176: 520000 | AE176: 1227500 | AF176: 255000 | AH176: 173 | AI176: 18668208 | AJ176: =SUM(R3C35:RC[-1]) -> 600768856
B177: =RC[5]&R1C6&RC[6]&R1C6&RC[7]&R1C6 -> 0,1,7,343000;0,1,8,260000;0,1,4,530000; | D177: =VLOOKUP(ROUND(RC[1],-2),Sheet3!C23:C24,2,TRUE) -> 62 | E177: =Sheet3!R[2]C[11] -> 15475140 | F177: 85 | G177: 0,1,7,343000 | H177: ="0,1,8,"&RC[24] -> 0,1,8,260000 | I177: ="0,1,4,"&RC[18] -> 0,1,4,530000 | U177: 0,1,4,13500 | X177: 175 | Y177: =MID(RC[-4],7,99)*1 -> 13500 | AA177: 530000 | AE177: 5500 | AF177: 260000 | AH177: 174 | AI177: 19097501 | AJ177: =SUM(R3C35:RC[-1]) -> 619866357
B178: =RC[5]&R1C6&RC[6]&R1C6&RC[7]&R1C6 -> 0,1,7,350000;0,1,8,265000;0,1,4,540000; | D178: =VLOOKUP(ROUND(RC[1],-2),Sheet3!C23:C24,2,TRUE) -> 62 | E178: =Sheet3!R[2]C[11] -> 15825140 | F178: 85 | G178: 0,1,7,350000 | H178: ="0,1,8,"&RC[24] -> 0,1,8,265000 | I178: ="0,1,4,"&RC[18] -> 0,1,4,540000 | U178: 0,1,4,13500 | X178: 176 | Y178: =MID(RC[-4],7,99)*1 -> 13500 | AA178: 540000 | AE178: 5500 | AF178: 265000 | AH178: 175 | AI178: 19533213 | AJ178: =SUM(R3C35:RC[-1]) -> 639399570
B179: =RC[5]&R1C6&RC[6]&R1C6&RC[7]&R1C6 -> 0,1,7,1093000;0,1,8,270000;0,1,4,550000; | D179: =VLOOKUP(ROUND(RC[1],-2),Sheet3!C23:C24,2,TRUE) -> 63 | E179: =Sheet3!R[2]C[11] -> 16918140 | F179: 85 | G179: 0,1,7,1093000 | H179: ="0,1,8,"&RC[24] -> 0,1,8,270000 | I179: ="0,1,4,"&RC[18] -> 0,1,4,550000 | U179: 0,1,4,13500 | X179: 177 | Y179: =MID(RC[-4],7,99)*1 -> 13500 | AA179: 550000 | AE179: 5500 | AF179: 270000 | AH179: 176 | AI179: 19975389 | AJ179: =SUM(R3C35:RC[-1]) -> 659374959
B180: =RC[5]&R1C6&RC[6]&R1C6&RC[7]&R1C6 -> 0,1,7,365000;0,1,8,275000;0,1,4,560000; | D180: =VLOOKUP(ROUND(RC[1],-2),Sheet3!C23:C24,2,TRUE) -> 63 | E180: =Sheet3!R[2]C[11] -> 17283140 | F180: 85 | G180: 0,1,7,365000 | H180: ="0,1,8,"&RC[24] -> 0,1,8,275000 | I180: ="0,1,4,"&RC[18] -> 0,1,4,560000 | U180: 0,1,4,13500 | X180: 178 | Y180: =MID(RC[-4],7,99)*1 -> 13500 | AA180: 560000 | AE180: 5500 | AF180: 275000 | AH180: 177 | AI180: 20424078 | AJ180: =SUM(R3C35:RC[-1]) -> 679799037
B181: =RC[5]&R1C6&RC[6]&R1C6&RC[7]&R1C6 -> 0,1,7,372000;0,1,8,280000;0,1,4,570000; | D181: =VLOOKUP(ROUND(RC[1],-2),Sheet3!C23:C24,2,TRUE) -> 63 | E181: =Sheet3!R[2]C[11] -> 17655140 | F181: 85 | G181: 0,1,7,372000 | H181: ="0,1,8,"&RC[24] -> 0,1,8,280000 | I181: ="0,1,4,"&RC[18] -> 0,1,4,570000 | U181: 0,1,4,2400000 | X181: 179 | Y181: =MID(RC[-4],7,99)*1 -> 2400000 | AA181: 570000 | AE181: 1300000 | AF181: 280000 | AH181: 178 | AI181: 20879325 | AJ181: =SUM(R3C35:RC[-1]) -> 700678362
B182: =RC[5]&R1C6&RC[6]&R1C6&RC[7]&R1C6 -> 0,1,7,380000;0,1,8,285000;0,1,4,580000; | D182: =VLOOKUP(ROUND(RC[1],-2),Sheet3!C23:C24,2,TRUE) -> 64 | E182: =Sheet3!R[2]C[11] -> 18035140 | F182: 85 | G182: 0,1,7,380000 | H182: ="0,1,8,"&RC[24] -> 0,1,8,285000 | I182: ="0,1,4,"&RC[18] -> 0,1,4,580000 | U182: 0,1,4,13500 | X182: 180 | Y182: =MID(RC[-4],7,99)*1 -> 13500 | AA182: 580000 | AE182: 5500 | AF182: 285000 | AH182: 179 | AI182: 21341178 | AJ182: =SUM(R3C35:RC[-1]) -> 722019540
B183: =RC[5]&R1C6&RC[6]&R1C6&RC[7]&R1C6 -> 0,1,7,387000;0,1,8,290000;0,1,4,590000; | D183: =VLOOKUP(ROUND(RC[1],-2),Sheet3!C23:C24,2,TRUE) -> 64 | E183: =Sheet3!R[2]C[11] -> 18422140 | F183: 85 | G183: 0,1,7,387000 | H183: ="0,1,8,"&RC[24] -> 0,1,8,290000 | I183: ="0,1,4,"&RC[18] -> 0,1,4,590000 | U183: 0,1,4,27000 | X183: 181 | Y183: =MID(RC[-4],7,99)*1 -> 27000 | AA183: 590000 | AE183: 11000 | AF183: 290000 | AH183: 180 | AI183: 21809684 | AJ183: =SUM(R3C35:RC[-1]) -> 743829224
B184: =RC[5]&R1C6&RC[6]&R1C6&RC[7]&R1C6 -> 0,1,7,1209000;0,1,8,295000;0,1,4,600000; | D184: =VLOOKUP(ROUND(RC[1],-2),Sheet3!C23:C24,2,TRUE) -> 65 | E184: =Sheet3!R[2]C[11] -> 19631140 | F184: 85 | G184: 0,1,7,1209000 | H184: ="0,1,8,"&RC[24] -> 0,1,8,295000 | I184: ="0,1,4,"&RC[18] -> 0,1,4,600000 | U184: 0,1,4,13500 | X184: 182 | Y184: =MID(RC[-4],7,99)*1 -> 13500 | AA184: 600000 | AE184: 5500 | AF184: 295000 | AH184: 181 | AI184: 22284889 | AJ184: =SUM(R3C35:RC[-1]) -> 766114113
B185: =RC[5]&R1C6&RC[6]&R1C6&RC[7]&R1C6 -> 0,1,7,403000;0,1,8,300000;0,1,4,610000; | D185: =VLOOKUP(ROUND(RC[1],-2),Sheet3!C23:C24,2,TRUE) -> 65 | E185: =Sheet3!R[2]C[11] -> 20034140 | F185: 90 | G185: 0,1,7,403000 | H185: ="0,1,8,"&RC[24] -> 0,1,8,300000 | I185: ="0,1,4,"&RC[18] -> 0,1,4,610000 | U185: 0,1,4,20000 | X185: 183 | Y185: =MID(RC[-4],7,99)*1 -> 20000 | AA185: 610000 | AE185: 10000 | AF185: 300000 | AH185: 182 | AI185: 22766840 | AJ185: =SUM(R3C35:RC[-1]) -> 788880953
B186: =RC[5]&R1C6&RC[6]&R1C6&RC[7]&R1C6 -> 0,1,7,411000;0,1,8,305000;0,1,4,620000; | D186: =VLOOKUP(ROUND(RC[1],-2),Sheet3!C23:C24,2,TRUE) -> 65 | E186: =Sheet3!R[2]C[11] -> 20445140 | F186: 90 | G186: 0,1,7,411000 | H186: ="0,1,8,"&RC[24] -> 0,1,8,305000 | I186: ="0,1,4,"&RC[18] -> 0,1,4,620000 | U186: 0,1,4,20000 | X186: 184 | Y186: =MID(RC[-4],7,99)*1 -> 20000 | AA186: 620000 | AE186: 10000 | AF186: 305000 | AH186: 183 | AI186: 23255584 | AJ186: =SUM(R3C35:RC[-1]) -> 812136537
B187: =RC[5]&R1C6&RC[6]&R1C6&RC[7]&R1C6 -> 0,1,7,418000;0,1,8,310000;0,1,4,630000; | D187: =VLOOKUP(ROUND(RC[1],-2),Sheet3!C23:C24,2,TRUE) -> 65 | E187: =Sheet3!R[2]C[11] -> 20863140 | F187: 90 | G187: 0,1,7,418000 | H187: ="0,1,8,"&RC[24] -> 0,1,8,310000 | I187: ="0,1,4,"&RC[18] -> 0,1,4,630000 | U187: 0,1,4,20000 | X187: 185 | Y187: =MID(RC[-4],7,99)*1 -> 20000 | AA187: 630000 | AE187: 10000 | AF187: 310000 | AH187: 184 | AI187: 23751169 | AJ187: =SUM(R3C35:RC[-1]) -> 835887706
B188: =RC[5]&R1C6&RC[6]&R1C6&RC[7]&R1C6 -> 0,1,7,426000;0,1,8,315000;0,1,4,640000; | D188: =VLOOKUP(ROUND(RC[1],-2),Sheet3!C23:C24,2,TRUE) -> 65 | E188: =Sheet3!R[2]C[11] -> 21289140 | F188: 90 | G188: 0,1,7,426000 | H188: ="0,1,8,"&RC[24] -> 0,1,8,315000 | I188: ="0,1,4,"&RC[18] -> 0,1,4,640000 | U188: 0,1,4,20000 | X188: 186 | Y188: =MID(RC[-4],7,99)*1 -> 20000 | AA188: 640000 | AE188: 10000 | AF188: 315000 | AH188: 185 | AI188: 24253639 | AJ188: =SUM(R3C35:RC[-1]) -> 860141345
B189: =RC[5]&R1C6&RC[6]&R1C6&RC[7]&R1C6 -> 0,1,7,1331000;0,1,8,320000;0,1,4,650000; | D189: =VLOOKUP(ROUND(RC[1],-2),Sheet3!C23:C24,2,TRUE) -> 66 | E189: =Sheet3!R[2]C[11] -> 22620140 | F189: 90 | G189: 0,1,7,1331000 | H189: ="0,1,8,"&RC[24] -> 0,1,8,320000 | I189: ="0,1,4,"&RC[18] -> 0,1,4,650000 | U189: 0,1,4,40000 | X189: 187 | Y189: =MID(RC[-4],7,99)*1 -> 40000 | AA189: 650000 | AE189: 20000 | AF189: 320000 | AH189: 186 | AI189: 24763044 | AJ189: =SUM(R3C35:RC[-1]) -> 884904389
B190: =RC[5]&R1C6&RC[6]&R1C6&RC[7]&R1C6 -> 0,1,7,442000;0,1,8,325000;0,1,4,660000; | D190: =VLOOKUP(ROUND(RC[1],-2),Sheet3!C23:C24,2,TRUE) -> 66 | E190: =Sheet3!R[2]C[11] -> 23062140 | F190: 90 | G190: 0,1,7,442000 | H190: ="0,1,8,"&RC[24] -> 0,1,8,325000 | I190: ="0,1,4,"&RC[18] -> 0,1,4,660000 | U190: 0,1,4,20000 | X190: 188 | Y190: =MID(RC[-4],7,99)*1 -> 20000 | AA190: 660000 | AE190: 10000 | AF190: 325000 | AH190: 187 | AI190: 25279429 | AJ190: =SUM(R3C35:RC[-1]) -> 910183818
B191: =RC[5]&R1C6&RC[6]&R1C6&RC[7]&R1C6 -> 0,1,7,451000;0,1,8,330000;0,1,4,670000; | D191: =VLOOKUP(ROUND(RC[1],-2),Sheet3!C23:C24,2,TRUE) -> 66 | E191: =Sheet3!R[2]C[11] -> 23513140 | F191: 90 | G191: 0,1,7,451000 | H191: ="0,1,8,"&RC[24] -> 0,1,8,330000 | I191: ="0,1,4,"&RC[18] -> 0,1,4,670000 | U191: 0,1,4,5400000 | X191: 189 | Y191: =MID(RC[-4],7,99)*1 -> 5400000 | AA191: 670000 | AE191: 1500000 | AF191: 330000 | AH191: 188 | AI191: 25802841 | AJ191: =SUM(R3C35:RC[-1]) -> 935986659
B192: =RC[5]&R1C6&RC[6]&R1C6&RC[7]&R1C6 -> 0,1,7,459000;0,1,8,335000;0,1,4,680000; | D192: =VLOOKUP(ROUND(RC[1],-2),Sheet3!C23:C24,2,TRUE) -> 67 | E192: =Sheet3!R[2]C[11] -> 23972140 | F192: 90 | G192: 0,1,7,459000 | H192: ="0,1,8,"&RC[24] -> 0,1,8,335000 | I192: ="0,1,4,"&RC[18] -> 0,1,4,680000 | U192: 0,1,4,20000 | X192: 190 | Y192: =MID(RC[-4],7,99)*1 -> 20000 | AA192: 680000 | AE192: 10000 | AF192: 335000 | AH192: 189 | AI192: 26333327 | AJ192: =SUM(R3C35:RC[-1]) -> 962319986
B193: =RC[5]&R1C6&RC[6]&R1C6&RC[7]&R1C6 -> 0,1,7,467000;0,1,8,340000;0,1,4,690000; | D193: =VLOOKUP(ROUND(RC[1],-2),Sheet3!C23:C24,2,TRUE) -> 67 | E193: =Sheet3!R[2]C[11] -> 24439140 | F193: 90 | G193: 0,1,7,467000 | H193: ="0,1,8,"&RC[24] -> 0,1,8,340000 | I193: ="0,1,4,"&RC[18] -> 0,1,4,690000 | U193: 0,1,4,20000 | X193: 191 | Y193: =MID(RC[-4],7,99)*1 -> 20000 | AA193: 690000 | AE193: 10000 | AF193: 340000 | AH193: 190 | AI193: 26870934 | AJ193: =SUM(R3C35:RC[-1]) -> 989190920
B194: =RC[5]&R1C6&RC[6]&R1C6&RC[7]&R1C6 -> 0,1,7,1460000;0,1,8,345000;0,1,4,700000; | D194: =VLOOKUP(ROUND(RC[1],-2),Sheet3!C23:C24,2,TRUE) -> 67 | E194: =Sheet3!R[2]C[11] -> 25899140 | F194: 95 | G194: 0,1,7,1460000 | H194: ="0,1,8,"&RC[24] -> 0,1,8,345000 | I194: ="0,1,4,"&RC[18] -> 0,1,4,700000 | U194: 0,1,4,30000 | X194: 192 | Y194: =MID(RC[-4],7,99)*1 -> 30000 | AA194: 700000 | AE194: 15000 | AF194: 345000 | AH194: 191 | AI194: 27415709 | AJ194: =SUM(R3C35:RC[-1]) -> 1016606629
B195: =RC[5]&R1C6&RC[6]&R1C6&RC[7]&R1C6 -> 0,1,7,484000;0,1,8,350000;0,1,4,710000; | D195: =VLOOKUP(ROUND(RC[1],-2),Sheet3!C23:C24,2,TRUE) -> 68 | E195: =Sheet3!R[2]C[11] -> 26383140 | F195: 95 | G195: 0,1,7,484000 | H195: ="0,1,8,"&RC[24] -> 0,1,8,350000 | I195: ="0,1,4,"&RC[18] -> 0,1,4,710000 | U195: 0,1,4,30000 | X195: 193 | Y195: =MID(RC[-4],7,99)*1 -> 30000 | AA195: 710000 | AE195: 15000 | AF195: 350000 | AH195: 192 | AI195: 27967698 | AJ195: =SUM(R3C35:RC[-1]) -> 1044574327
B196: =RC[5]&R1C6&RC[6]&R1C6&RC[7]&R1C6 -> 0,1,7,493000;0,1,8,355000;0,1,4,720000; | D196: =VLOOKUP(ROUND(RC[1],-2),Sheet3!C23:C24,2,TRUE) -> 68 | E196: =Sheet3!R[2]C[11] -> 26876140 | F196: 95 | G196: 0,1,7,493000 | H196: ="0,1,8,"&RC[24] -> 0,1,8,355000 | I196: ="0,1,4,"&RC[18] -> 0,1,4,720000 | U196: 0,1,4,30000 | X196: 194 | Y196: =MID(RC[-4],7,99)*1 -> 30000 | AA196: 720000 | AE196: 15000 | AF196: 355000 | AH196: 193 | AI196: 28526949 | AJ196: =SUM(R3C35:RC[-1]) -> 1073101276
B197: =RC[5]&R1C6&RC[6]&R1C6&RC[7]&R1C6 -> 0,1,7,501000;0,1,8,360000;0,1,4,730000; | D197: =VLOOKUP(ROUND(RC[1],-2),Sheet3!C23:C24,2,TRUE) -> 68 | E197: =Sheet3!R[2]C[11] -> 27377140 | F197: 95 | G197: 0,1,7,501000 | H197: ="0,1,8,"&RC[24] -> 0,1,8,360000 | I197: ="0,1,4,"&RC[18] -> 0,1,4,730000 | U197: 0,1,4,30000 | X197: 195 | Y197: =MID(RC[-4],7,99)*1 -> 30000 | AA197: 730000 | AE197: 15000 | AF197: 360000 | AH197: 194 | AI197: 29093508 | AJ197: =SUM(R3C35:RC[-1]) -> 1102194784
B198: =RC[5]&R1C6&RC[6]&R1C6&RC[7]&R1C6 -> 0,1,7,510000;0,1,8,365000;0,1,4,740000; | D198: =VLOOKUP(ROUND(RC[1],-2),Sheet3!C23:C24,2,TRUE) -> 68 | E198: =Sheet3!R[2]C[11] -> 27887140 | F198: 95 | G198: 0,1,7,510000 | H198: ="0,1,8,"&RC[24] -> 0,1,8,365000 | I198: ="0,1,4,"&RC[18] -> 0,1,4,740000 | U198: 0,1,4,5500000 | X198: 196 | Y198: =MID(RC[-4],7,99)*1 -> 5500000 | AA198: 740000 | AE198: 1600000 | AF198: 365000 | AH198: 195 | AI198: 29667422 | AJ198: =SUM(R3C35:RC[-1]) -> 1131862206
B199: =RC[5]&R1C6&RC[6]&R1C6&RC[7]&R1C6 -> 0,1,7,1593000;0,1,8,370000;0,1,4,750000; | D199: =VLOOKUP(ROUND(RC[1],-2),Sheet3!C23:C24,2,TRUE) -> 69 | E199: =Sheet3!R[2]C[11] -> 29480140 | F199: 95 | G199: 0,1,7,1593000 | H199: ="0,1,8,"&RC[24] -> 0,1,8,370000 | I199: ="0,1,4,"&RC[18] -> 0,1,4,750000 | U199: 0,1,4,30000 | X199: 197 | Y199: =MID(RC[-4],7,99)*1 -> 30000 | AA199: 750000 | AE199: 15000 | AF199: 370000 | AH199: 196 | AI199: 30248738 | AJ199: =SUM(R3C35:RC[-1]) -> 1162110944
B200: =RC[5]&R1C6&RC[6]&R1C6&RC[7]&R1C6 -> 0,1,7,527000;0,1,8,375000;0,1,4,760000; | D200: =VLOOKUP(ROUND(RC[1],-2),Sheet3!C23:C24,2,TRUE) -> 69 | E200: =Sheet3!R[2]C[11] -> 30007140 | F200: 95 | G200: 0,1,7,527000 | H200: ="0,1,8,"&RC[24] -> 0,1,8,375000 | I200: ="0,1,4,"&RC[18] -> 0,1,4,760000 | U200: 0,1,4,30000 | X200: 198 | Y200: =MID(RC[-4],7,99)*1 -> 30000 | AA200: 760000 | AE200: 15000 | AF200: 375000 | AH200: 197 | AI200: 30837503 | AJ200: =SUM(R3C35:RC[-1]) -> 1192948447
B201: =RC[5]&R1C6&RC[6]&R1C6&RC[7]&R1C6 -> 0,1,7,536000;0,1,8,380000;0,1,4,770000; | D201: =VLOOKUP(ROUND(RC[1],-2),Sheet3!C23:C24,2,TRUE) -> 69 | E201: =Sheet3!R[2]C[11] -> 30543140 | F201: 95 | G201: 0,1,7,536000 | H201: ="0,1,8,"&RC[24] -> 0,1,8,380000 | I201: ="0,1,4,"&RC[18] -> 0,1,4,770000 | U201: 0,1,4,5600000 | X201: 199 | Y201: =MID(RC[-4],7,99)*1 -> 5600000 | AA201: 770000 | AE201: 1700000 | AF201: 380000 | AH201: 198 | AI201: 31433764 | AJ201: =SUM(R3C35:RC[-1]) -> 1224382211
B202: =RC[5]&R1C6&RC[6]&R1C6&RC[7]&R1C6 -> 0,1,7,545000;0,1,8,385000;0,1,4,780000; | D202: =VLOOKUP(ROUND(RC[1],-2),Sheet3!C23:C24,2,TRUE) -> 69 | E202: =Sheet3!R[2]C[11] -> 31088140 | F202: 95 | G202: 0,1,7,545000 | H202: ="0,1,8,"&RC[24] -> 0,1,8,385000 | I202: ="0,1,4,"&RC[18] -> 0,1,4,780000 | U202: 0,1,4,30000 | X202: 200 | Y202: =MID(RC[-4],7,99)*1 -> 30000 | AA202: 780000 | AE202: 15000 | AF202: 385000 | AH202: 199 | AI202: 32037566 | AJ202: =SUM(R3C35:RC[-1]) -> 1256419777
B203: =RC[5]&R1C6&RC[6]&R1C6&RC[7]&R1C6 -> 0,1,7,554000;0,1,8,390000;0,1,4,790000; | D203: =VLOOKUP(ROUND(RC[1],-2),Sheet3!C23:C24,2,TRUE) -> 70 | E203: =Sheet3!R[2]C[11] -> 31642140 | F203: 95 | G203: 0,1,7,554000 | H203: ="0,1,8,"&RC[24] -> 0,1,8,390000 | I203: ="0,1,4,"&RC[18] -> 0,1,4,790000 | U203: 0,1,4,30000 | X203: 201 | Y203: =MID(RC[-4],7,99)*1 -> 30000 | AA203: 790000 | AE203: 15000 | AF203: 390000 | AH203: 200 | AI203: 32648958 | AJ203: =SUM(R3C35:RC[-1]) -> 1289068735
B204: =RC[5]&R1C6&RC[6]&R1C6&RC[7]&R1C6 -> 0,1,7,1732000;0,1,8,395000;0,1,4,800000; | D204: =VLOOKUP(ROUND(RC[1],-2),Sheet3!C23:C24,2,TRUE) -> 70 | E204: =Sheet3!R[2]C[11] -> 33374140 | F204: 95 | G204: 0,1,7,1732000 | H204: ="0,1,8,"&RC[24] -> 0,1,8,395000 | I204: ="0,1,4,"&RC[18] -> 0,1,4,800000 | U204: 0,1,4,5700000 | X204: 202 | Y204: =MID(RC[-4],7,99)*1 -> 5700000 | AA204: 800000 | AE204: 1800000 | AF204: 395000 | AH204: 201 | AI204: 33267986 | AJ204: =SUM(R3C35:RC[-1]) -> 1322336721
B205: =RC[5]&R1C6&RC[6]&R1C6&RC[7]&R1C6 -> 0,1,7,573000;0,1,8,400000;0,1,4,810000; | D205: =VLOOKUP(ROUND(RC[1],-2),Sheet3!C23:C24,2,TRUE) -> 70 | E205: =Sheet3!R[2]C[11] -> 33947140 | F205: 95 | G205: 0,1,7,573000 | H205: ="0,1,8,"&RC[24] -> 0,1,8,400000 | I205: ="0,1,4,"&RC[18] -> 0,1,4,810000 | U205: 0,1,4,30000 | X205: 203 | Y205: =MID(RC[-4],7,99)*1 -> 30000 | AA205: 810000 | AE205: 15000 | AF205: 400000 | AH205: 202 | AI205: 33894697 | AJ205: =SUM(R3C35:RC[-1]) -> 1356231418
B206: =RC[5]&R1C6&RC[6]&R1C6&RC[7]&R1C6 -> 0,1,7,582000;0,1,8,405000;0,1,4,820000; | D206: =VLOOKUP(ROUND(RC[1],-2),Sheet3!C23:C24,2,TRUE) -> 71 | E206: =Sheet3!R[2]C[11] -> 34529140 | F206: 100 | G206: 0,1,7,582000 | H206: ="0,1,8,"&RC[24] -> 0,1,8,405000 | I206: ="0,1,4,"&RC[18] -> 0,1,4,820000 | U206: 0,1,4,40000 | X206: 204 | Y206: =MID(RC[-4],7,99)*1 -> 40000 | AA206: 820000 | AE206: 20000 | AF206: 405000 | AH206: 203 | AI206: 34529138 | AJ206: =SUM(R3C35:RC[-1]) -> 1390760556
B207: =RC[5]&R1C6&RC[6]&R1C6&RC[7]&R1C6 -> 0,1,7,591000;0,1,8,410000;0,1,4,830000; | D207: =VLOOKUP(ROUND(RC[1],-2),Sheet3!C23:C24,2,TRUE) -> 71 | E207: =Sheet3!R[2]C[11] -> 35120140 | F207: 100 | G207: 0,1,7,591000 | H207: ="0,1,8,"&RC[24] -> 0,1,8,410000 | I207: ="0,1,4,"&RC[18] -> 0,1,4,830000 | U207: 0,1,4,40000 | X207: 205 | Y207: =MID(RC[-4],7,99)*1 -> 40000 | AA207: 830000 | AE207: 20000 | AF207: 410000 | AH207: 204 | AI207: 35171355 | AJ207: =SUM(R3C35:RC[-1]) -> 1425931911
B208: =RC[5]&R1C6&RC[6]&R1C6&RC[7]&R1C6 -> 0,1,7,601000;0,1,8,415000;0,1,4,840000; | D208: =VLOOKUP(ROUND(RC[1],-2),Sheet3!C23:C24,2,TRUE) -> 71 | E208: =Sheet3!R[2]C[11] -> 35721140 | F208: 100 | G208: 0,1,7,601000 | H208: ="0,1,8,"&RC[24] -> 0,1,8,415000 | I208: ="0,1,4,"&RC[18] -> 0,1,4,840000 | U208: 0,1,4,40000 | X208: 206 | Y208: =MID(RC[-4],7,99)*1 -> 40000 | AA208: 840000 | AE208: 20000 | AF208: 415000 | AH208: 205 | AI208: 35821396 | AJ208: =SUM(R3C35:RC[-1]) -> 1461753307
B209: =RC[5]&R1C6&RC[6]&R1C6&RC[7]&R1C6 -> 0,1,7,1877000;0,1,8,420000;0,1,4,850000; | D209: =VLOOKUP(ROUND(RC[1],-2),Sheet3!C23:C24,2,TRUE) -> 72 | E209: =Sheet3!R[2]C[11] -> 37598140 | F209: 100 | G209: 0,1,7,1877000 | H209: ="0,1,8,"&RC[24] -> 0,1,8,420000 | I209: ="0,1,4,"&RC[18] -> 0,1,4,850000 | U209: 0,1,4,5800000 | X209: 207 | Y209: =MID(RC[-4],7,99)*1 -> 5800000 | AA209: 850000 | AE209: 1900000 | AF209: 420000 | AH209: 206 | AI209: 36479307 | AJ209: =SUM(R3C35:RC[-1]) -> 1498232614
B210: =RC[5]&R1C6&RC[6]&R1C6&RC[7]&R1C6 -> 0,1,7,620000;0,1,8,425000;0,1,4,860000; | D210: =VLOOKUP(ROUND(RC[1],-2),Sheet3!C23:C24,2,TRUE) -> 72 | E210: =Sheet3!R[2]C[11] -> 38218140 | F210: 100 | G210: 0,1,7,620000 | H210: ="0,1,8,"&RC[24] -> 0,1,8,425000 | I210: ="0,1,4,"&RC[18] -> 0,1,4,860000 | U210: 0,1,4,40000 | X210: 208 | Y210: =MID(RC[-4],7,99)*1 -> 40000 | AA210: 860000 | AE210: 20000 | AF210: 425000 | AH210: 207 | AI210: 37145134 | AJ210: =SUM(R3C35:RC[-1]) -> 1535377748
B211: =RC[5]&R1C6&RC[6]&R1C6&RC[7]&R1C6 -> 0,1,7,630000;0,1,8,430000;0,1,4,870000; | D211: =VLOOKUP(ROUND(RC[1],-2),Sheet3!C23:C24,2,TRUE) -> 72 | E211: =Sheet3!R[2]C[11] -> 38848140 | F211: 100 | G211: 0,1,7,630000 | H211: ="0,1,8,"&RC[24] -> 0,1,8,430000 | I211: ="0,1,4,"&RC[18] -> 0,1,4,870000 | U211: 0,1,4,40000 | X211: 209 | Y211: =MID(RC[-4],7,99)*1 -> 40000 | AA211: 870000 | AE211: 20000 | AF211: 430000 | AH211: 208 | AI211: 37810961 | AJ211: =SUM(R3C35:RC[-1]) -> 1573188709
B212: =RC[5]&R1C6&RC[6]&R1C6&RC[7]&R1C6 -> 0,1,7,639000;0,1,8,435000;0,1,4,880000; | D212: =VLOOKUP(ROUND(RC[1],-2),Sheet3!C23:C24,2,TRUE) -> 72 | E212: =Sheet3!R[2]C[11] -> 39487140 | F212: 100 | G212: 0,1,7,639000 | H212: ="0,1,8,"&RC[24] -> 0,1,8,435000 | I212: ="0,1,4,"&RC[18] -> 0,1,4,880000 | U212: 0,1,4,6120000 | X212: 210 | Y212: =MID(RC[-4],7,99)*1 -> 6120000 | AA212: 880000 | AE212: 2000000 | AF212: 435000
B213: =RC[5]&R1C6&RC[6]&R1C6&RC[7]&R1C6 -> 0,1,7,649000;0,1,8,440000;0,1,4,890000; | D213: =VLOOKUP(ROUND(RC[1],-2),Sheet3!C23:C24,2,TRUE) -> 72 | E213: =Sheet3!R[2]C[11] -> 40136140 | F213: 100 | G213: 0,1,7,649000 | H213: ="0,1,8,"&RC[24] -> 0,1,8,440000 | I213: ="0,1,4,"&RC[18] -> 0,1,4,890000 | U213: 0,1,4,40000 | X213: 211 | Y213: =MID(RC[-4],7,99)*1 -> 40000 | Z213: =SUM(R3C25:R213C25) -> 59296525 | AA213: 890000 | AB213: =SUM(R3C27:R213C27) -> 58007500 | AC213: =RC[-3]-RC[-1] -> 1289025 | AE213: 20000 | AF213: 440000
B214: =RC[5]&R1C6&RC[6]&R1C6&RC[7]&R1C6 -> 0,1,7,500;0,1,8,800;0,1,4,350; | D214: =VLOOKUP(ROUND(RC[1],-2),Sheet3!C23:C24,2,TRUE) -> 4 | E214: =Sheet3!R[2]C[11] -> 500 | F214: 25 | G214: 0,1,7,500 | H214: ="0,1,8,"&RC[24] -> 0,1,8,800 | I214: ="0,1,4,"&RC[18] -> 0,1,4,350 | U214: 0,1,4,375 | X214: 1 | Y214: =MID(RC[-4],7,99)*1 -> 375 | AA214: 350 | AE214: 250 | AF214: 800
B215: =RC[5]&R1C6&RC[6]&R1C6&RC[7]&R1C6 -> 0,1,7,200;0,1,8,900;0,1,4,450; | D215: =VLOOKUP(ROUND(RC[1],-2),Sheet3!C23:C24,2,TRUE) -> 5 | E215: =Sheet3!R[2]C[11] -> 700 | F215: 25 | G215: 0,1,7,200 | H215: ="0,1,8,"&RC[24] -> 0,1,8,900 | I215: ="0,1,4,"&RC[18] -> 0,1,4,450 | U215: 0,1,4,375 | X215: 2 | Y215: =MID(RC[-4],7,99)*1 -> 375 | AA215: 450 | AE215: 250 | AF215: 900
B216: =RC[5]&R1C6&RC[6]&R1C6&RC[7]&R1C6 -> 0,1,7,1000;0,1,8,1000;0,1,4,550; | D216: =VLOOKUP(ROUND(RC[1],-2),Sheet3!C23:C24,2,TRUE) -> 7 | E216: =Sheet3!R[2]C[11] -> 1700 | F216: 25 | G216: 0,1,7,1000 | H216: ="0,1,8,"&RC[24] -> 0,1,8,1000 | I216: ="0,1,4,"&RC[18] -> 0,1,4,550 | U216: 0,1,4,8000 | X216: 3 | Y216: =MID(RC[-4],7,99)*1 -> 8000 | AA216: 550 | AE216: 1500 | AF216: 1000
B217: =RC[5]&R1C6&RC[6]&R1C6&RC[7]&R1C6 -> 0,1,7,1000;0,1,8,1100;0,1,4,650; | D217: =VLOOKUP(ROUND(RC[1],-2),Sheet3!C23:C24,2,TRUE) -> 9 | E217: =Sheet3!R[2]C[11] -> 2700 | F217: 25 | G217: 0,1,7,1000 | H217: ="0,1,8,"&RC[24] -> 0,1,8,1100 | I217: ="0,1,4,"&RC[18] -> 0,1,4,650 | U217: 0,1,4,375 | X217: 4 | Y217: =MID(RC[-4],7,99)*1 -> 375 | AA217: 650 | AE217: 250 | AF217: 1100
B218: =RC[5]&R1C6&RC[6]&R1C6&RC[7]&R1C6 -> 0,1,7,3000;0,1,8,1200;0,1,4,750; | D218: =VLOOKUP(ROUND(RC[1],-2),Sheet3!C23:C24,2,TRUE) -> 13 | E218: =Sheet3!R[2]C[11] -> 5700 | F218: 25 | G218: 0,1,7,3000 | H218: ="0,1,8,"&RC[24] -> 0,1,8,1200 | I218: ="0,1,4,"&RC[18] -> 0,1,4,750 | U218: 0,1,4,375 | X218: 5 | Y218: =MID(RC[-4],7,99)*1 -> 375 | AA218: 750 | AE218: 250 | AF218: 1200
B219: =RC[5]&R1C6&RC[6]&R1C6&RC[7]&R1C6 -> 0,1,7,2000;0,1,8,1300;0,1,4,850; | D219: =VLOOKUP(ROUND(RC[1],-2),Sheet3!C23:C24,2,TRUE) -> 14 | E219: =Sheet3!R[2]C[11] -> 7700 | F219: 25 | G219: 0,1,7,2000 | H219: ="0,1,8,"&RC[24] -> 0,1,8,1300 | I219: ="0,1,4,"&RC[18] -> 0,1,4,850 | U219: 0,1,4,9000 | X219: 6 | Y219: =MID(RC[-4],7,99)*1 -> 9000 | AA219: 850 | AE219: 2000 | AF219: 1300
B220: =RC[5]&R1C6&RC[6]&R1C6&RC[7]&R1C6 -> 0,1,7,3000;0,1,8,1400;0,1,4,1000; | D220: =VLOOKUP(ROUND(RC[1],-2),Sheet3!C23:C24,2,TRUE) -> 16 | E220: =Sheet3!R[2]C[11] -> 10700 | F220: 25 | G220: 0,1,7,3000 | H220: ="0,1,8,"&RC[24] -> 0,1,8,1400 | I220: ="0,1,4,"&RC[18] -> 0,1,4,1000 | U220: 0,1,4,375 | X220: 7 | Y220: =MID(RC[-4],7,99)*1 -> 375 | AA220: 1000 | AE220: 250 | AF220: 1400
B221: =RC[5]&R1C6&RC[6]&R1C6&RC[7]&R1C6 -> 0,1,7,3000;0,1,8,1500;0,1,4,1100; | D221: =VLOOKUP(ROUND(RC[1],-2),Sheet3!C23:C24,2,TRUE) -> 17 | E221: =Sheet3!R[2]C[11] -> 13700 | F221: 25 | G221: 0,1,7,3000 | H221: ="0,1,8,"&RC[24] -> 0,1,8,1500 | I221: ="0,1,4,"&RC[18] -> 0,1,4,1100 | U221: 0,1,4,375 | X221: 8 | Y221: =MID(RC[-4],7,99)*1 -> 375 | AA221: 1100 | AE221: 250 | AF221: 1500
B222: =RC[5]&R1C6&RC[6]&R1C6&RC[7]&R1C6 -> 0,1,7,4000;0,1,8,1600;0,1,4,1200; | D222: =VLOOKUP(ROUND(RC[1],-2),Sheet3!C23:C24,2,TRUE) -> 18 | E222: =Sheet3!R[2]C[11] -> 17700 | F222: 25 | G222: 0,1,7,4000 | H222: ="0,1,8,"&RC[24] -> 0,1,8,1600 | I222: ="0,1,4,"&RC[18] -> 0,1,4,1200 | U222: 0,1,4,9000 | X222: 9 | Y222: =MID(RC[-4],7,99)*1 -> 9000 | AA222: 1200 | AE222: 2750 | AF222: 1600
B223: =RC[5]&R1C6&RC[6]&R1C6&RC[7]&R1C6 -> 0,1,7,6000;0,1,8,1700;0,1,4,1300; | D223: =VLOOKUP(ROUND(RC[1],-2),Sheet3!C23:C24,2,TRUE) -> 19 | E223: =Sheet3!R[2]C[11] -> 23700 | F223: 25 | G223: 0,1,7,6000 | H223: ="0,1,8,"&RC[24] -> 0,1,8,1700 | I223: ="0,1,4,"&RC[18] -> 0,1,4,1300 | U223: 0,1,4,375 | X223: 10 | Y223: =MID(RC[-4],7,99)*1 -> 375 | AA223: 1300 | AE223: 250 | AF223: 1700
B224: =RC[5]&R1C6&RC[6]&R1C6&RC[7]&R1C6 -> 0,1,7,5000;0,1,8,1800;0,1,4,1400; | D224: =VLOOKUP(ROUND(RC[1],-2),Sheet3!C23:C24,2,TRUE) -> 20 | E224: =Sheet3!R[2]C[11] -> 28700 | F224: 25 | G224: 0,1,7,5000 | H224: ="0,1,8,"&RC[24] -> 0,1,8,1800 | I224: ="0,1,4,"&RC[18] -> 0,1,4,1400 | U224: 0,1,4,375 | X224: 11 | Y224: =MID(RC[-4],7,99)*1 -> 375 | AA224: 1400 | AE224: 250 | AF224: 1800
B225: =RC[5]&R1C6&RC[6]&R1C6&RC[7]&R1C6 -> 0,1,7,5000;0,1,8,1900;0,1,4,1500; | D225: =VLOOKUP(ROUND(RC[1],-2),Sheet3!C23:C24,2,TRUE) -> 21 | E225: =Sheet3!R[2]C[11] -> 33700 | F225: 25 | G225: 0,1,7,5000 | H225: ="0,1,8,"&RC[24] -> 0,1,8,1900 | I225: ="0,1,4,"&RC[18] -> 0,1,4,1500 | U225: 0,1,4,375 | X225: 12 | Y225: =MID(RC[-4],7,99)*1 -> 375 | AA225: 1500 | AE225: 250 | AF225: 1900
B226: =RC[5]&R1C6&RC[6]&R1C6&RC[7]&R1C6 -> 0,1,7,6000;0,1,8,2000;0,1,4,1600; | D226: =VLOOKUP(ROUND(RC[1],-2),Sheet3!C23:C24,2,TRUE) -> 22 | E226: =Sheet3!R[2]C[11] -> 39700 | F226: 30 | G226: 0,1,7,6000 | H226: ="0,1,8,"&RC[24] -> 0,1,8,2000 | I226: ="0,1,4,"&RC[18] -> 0,1,4,1600 | U226: 0,1,4,375 | X226: 13 | Y226: =MID(RC[-4],7,99)*1 -> 375 | AA226: 1600 | AE226: 250 | AF226: 2000
B227: =RC[5]&R1C6&RC[6]&R1C6&RC[7]&R1C6 -> 0,1,7,6000;0,1,8,2100;0,1,4,1700; | D227: =VLOOKUP(ROUND(RC[1],-2),Sheet3!C23:C24,2,TRUE) -> 23 | E227: =Sheet3!R[2]C[11] -> 45700 | F227: 30 | G227: 0,1,7,6000 | H227: ="0,1,8,"&RC[24] -> 0,1,8,2100 | I227: ="0,1,4,"&RC[18] -> 0,1,4,1700 | U227: 0,1,4,375 | X227: 14 | Y227: =MID(RC[-4],7,99)*1 -> 375 | AA227: 1700 | AE227: 250 | AF227: 2100
B228: =RC[5]&R1C6&RC[6]&R1C6&RC[7]&R1C6 -> 0,1,7,11000;0,1,8,2200;0,1,4,1800; | D228: =VLOOKUP(ROUND(RC[1],-2),Sheet3!C23:C24,2,TRUE) -> 24 | E228: =Sheet3!R[2]C[11] -> 56700 | F228: 30 | G228: 0,1,7,11000 | H228: ="0,1,8,"&RC[24] -> 0,1,8,2200 | I228: ="0,1,4,"&RC[18] -> 0,1,4,1800 | U228: 0,1,4,13000 | X228: 15 | Y228: =MID(RC[-4],7,99)*1 -> 13000 | AA228: 1800 | AE228: 4750 | AF228: 2200
B229: =RC[5]&R1C6&RC[6]&R1C6&RC[7]&R1C6 -> 0,1,7,7000;0,1,8,2300;0,1,4,1900; | D229: =VLOOKUP(ROUND(RC[1],-2),Sheet3!C23:C24,2,TRUE) -> 25 | E229: =Sheet3!R[2]C[11] -> 63700 | F229: 30 | G229: 0,1,7,7000 | H229: ="0,1,8,"&RC[24] -> 0,1,8,2300 | I229: ="0,1,4,"&RC[18] -> 0,1,4,1900 | U229: 0,1,4,375 | X229: 16 | Y229: =MID(RC[-4],7,99)*1 -> 375 | AA229: 1900 | AE229: 250 | AF229: 2300
B230: =RC[5]&R1C6&RC[6]&R1C6&RC[7]&R1C6 -> 0,1,7,8000;0,1,8,2400;0,1,4,2000; | D230: =VLOOKUP(ROUND(RC[1],-2),Sheet3!C23:C24,2,TRUE) -> 25 | E230: =Sheet3!R[2]C[11] -> 71700 | F230: 30 | G230: 0,1,7,8000 | H230: ="0,1,8,"&RC[24] -> 0,1,8,2400 | I230: ="0,1,4,"&RC[18] -> 0,1,4,2000 | U230: 0,1,4,375 | X230: 17 | Y230: =MID(RC[-4],7,99)*1 -> 375 | AA230: 2000 | AE230: 250 | AF230: 2400
B231: =RC[5]&R1C6&RC[6]&R1C6&RC[7]&R1C6 -> 0,1,7,8000;0,1,8,2500;0,1,4,2500; | D231: =VLOOKUP(ROUND(RC[1],-2),Sheet3!C23:C24,2,TRUE) -> 26 | E231: =Sheet3!R[2]C[11] -> 79700 | F231: 30 | G231: 0,1,7,8000 | H231: ="0,1,8,"&RC[24] -> 0,1,8,2500 | I231: ="0,1,4,"&RC[18] -> 0,1,4,2500 | U231: 0,1,4,375 | X231: 18 | Y231: =MID(RC[-4],7,99)*1 -> 375 | AA231: 2500 | AE231: 250 | AF231: 2500
B232: =RC[5]&R1C6&RC[6]&R1C6&RC[7]&R1C6 -> 0,1,7,9000;0,1,8,2600;0,1,4,3000; | D232: =VLOOKUP(ROUND(RC[1],-2),Sheet3!C23:C24,2,TRUE) -> 27 | E232: =Sheet3!R[2]C[11] -> 88700 | F232: 30 | G232: 0,1,7,9000 | H232: ="0,1,8,"&RC[24] -> 0,1,8,2600 | I232: ="0,1,4,"&RC[18] -> 0,1,4,3000 | U232: 0,1,4,375 | X232: 19 | Y232: =MID(RC[-4],7,99)*1 -> 375 | AA232: 3000 | AE232: 250 | AF232: 2600
B233: =RC[5]&R1C6&RC[6]&R1C6&RC[7]&R1C6 -> 0,1,7,15000;0,1,8,2700;0,1,4,3500; | D233: =VLOOKUP(ROUND(RC[1],-2),Sheet3!C23:C24,2,TRUE) -> 28 | E233: =Sheet3!R[2]C[11] -> 103700 | F233: 30 | G233: 0,1,7,15000 | H233: ="0,1,8,"&RC[24] -> 0,1,8,2700 | I233: ="0,1,4,"&RC[18] -> 0,1,4,3500 | U233: 0,1,4,20000 | X233: 20 | Y233: =MID(RC[-4],7,99)*1 -> 20000 | AA233: 3500 | AE233: 5000 | AF233: 2700
B234: =RC[5]&R1C6&RC[6]&R1C6&RC[7]&R1C6 -> 0,1,7,10000;0,1,8,2800;0,1,4,4000; | D234: =VLOOKUP(ROUND(RC[1],-2),Sheet3!C23:C24,2,TRUE) -> 28 | E234: =Sheet3!R[2]C[11] -> 113700 | F234: 30 | G234: 0,1,7,10000 | H234: ="0,1,8,"&RC[24] -> 0,1,8,2800 | I234: ="0,1,4,"&RC[18] -> 0,1,4,4000 | U234: 0,1,4,375 | X234: 21 | Y234: =MID(RC[-4],7,99)*1 -> 375 | AA234: 4000 | AE234: 250 | AF234: 2800
B235: =RC[5]&R1C6&RC[6]&R1C6&RC[7]&R1C6 -> 0,1,7,10000;0,1,8,2900;0,1,4,4500; | D235: =VLOOKUP(ROUND(RC[1],-2),Sheet3!C23:C24,2,TRUE) -> 29 | E235: =Sheet3!R[2]C[11] -> 123700 | F235: 35 | G235: 0,1,7,10000 | H235: ="0,1,8,"&RC[24] -> 0,1,8,2900 | I235: ="0,1,4,"&RC[18] -> 0,1,4,4500 | U235: 0,1,4,1000 | X235: 22 | Y235: =MID(RC[-4],7,99)*1 -> 1000 | AA235: 4500 | AE235: 360 | AF235: 2900
B236: =RC[5]&R1C6&RC[6]&R1C6&RC[7]&R1C6 -> 0,1,7,11000;0,1,8,3000;0,1,4,5000; | D236: =VLOOKUP(ROUND(RC[1],-2),Sheet3!C23:C24,2,TRUE) -> 29 | E236: =Sheet3!R[2]C[11] -> 134700 | F236: 35 | G236: 0,1,7,11000 | H236: ="0,1,8,"&RC[24] -> 0,1,8,3000 | I236: ="0,1,4,"&RC[18] -> 0,1,4,5000 | U236: 0,1,4,1000 | X236: 23 | Y236: =MID(RC[-4],7,99)*1 -> 1000 | AA236: 5000 | AE236: 360 | AF236: 3000
B237: =RC[5]&R1C6&RC[6]&R1C6&RC[7]&R1C6 -> 0,1,7,11000;0,1,8,3300;0,1,4,5500; | D237: =VLOOKUP(ROUND(RC[1],-2),Sheet3!C23:C24,2,TRUE) -> 30 | E237: =Sheet3!R[2]C[11] -> 145700 | F237: 35 | G237: 0,1,7,11000 | H237: ="0,1,8,"&RC[24] -> 0,1,8,3300 | I237: ="0,1,4,"&RC[18] -> 0,1,4,5500 | U237: 0,1,4,20000 | X237: 24 | Y237: =MID(RC[-4],7,99)*1 -> 20000 | AA237: 5500 | AE237: 5000 | AF237: 3300
B238: =RC[5]&R1C6&RC[6]&R1C6&RC[7]&R1C6 -> 0,1,7,35000;0,1,8,3600;0,1,4,6000; | D238: =VLOOKUP(ROUND(RC[1],-2),Sheet3!C23:C24,2,TRUE) -> 31 | E238: =Sheet3!R[2]C[11] -> 180700 | F238: 35 | G238: 0,1,7,35000 | H238: ="0,1,8,"&RC[24] -> 0,1,8,3600 | I238: ="0,1,4,"&RC[18] -> 0,1,4,6000 | U238: 0,1,4,1000 | X238: 25 | Y238: =MID(RC[-4],7,99)*1 -> 1000 | AA238: 6000 | AE238: 360 | AF238: 3600
B239: =RC[5]&R1C6&RC[6]&R1C6&RC[7]&R1C6 -> 0,1,7,12000;0,1,8,3900;0,1,4,6500; | D239: =VLOOKUP(ROUND(RC[1],-2),Sheet3!C23:C24,2,TRUE) -> 32 | E239: =Sheet3!R[2]C[11] -> 192700 | F239: 35 | G239: 0,1,7,12000 | H239: ="0,1,8,"&RC[24] -> 0,1,8,3900 | I239: ="0,1,4,"&RC[18] -> 0,1,4,6500 | U239: 0,1,4,1000 | X239: 26 | Y239: =MID(RC[-4],7,99)*1 -> 1000 | AA239: 6500 | AE239: 360 | AF239: 3900
B240: =RC[5]&R1C6&RC[6]&R1C6&RC[7]&R1C6 -> 0,1,7,13000;0,1,8,4200;0,1,4,7000; | D240: =VLOOKUP(ROUND(RC[1],-2),Sheet3!C23:C24,2,TRUE) -> 32 | E240: =Sheet3!R[2]C[11] -> 205700 | F240: 35 | G240: 0,1,7,13000 | H240: ="0,1,8,"&RC[24] -> 0,1,8,4200 | I240: ="0,1,4,"&RC[18] -> 0,1,4,7000 | U240: 0,1,4,20000 | X240: 27 | Y240: =MID(RC[-4],7,99)*1 -> 20000 | AA240: 7000 | AE240: 5000 | AF240: 4200
B241: =RC[5]&R1C6&RC[6]&R1C6&RC[7]&R1C6 -> 0,1,7,13000;0,1,8,4500;0,1,4,7500; | D241: =VLOOKUP(ROUND(RC[1],-2),Sheet3!C23:C24,2,TRUE) -> 33 | E241: =Sheet3!R[2]C[11] -> 218700 | F241: 35 | G241: 0,1,7,13000 | H241: ="0,1,8,"&RC[24] -> 0,1,8,4500 | I241: ="0,1,4,"&RC[18] -> 0,1,4,7500 | U241: 0,1,4,1000 | X241: 28 | Y241: =MID(RC[-4],7,99)*1 -> 1000 | AA241: 7500 | AE241: 360 | AF241: 4500
B242: =RC[5]&R1C6&RC[6]&R1C6&RC[7]&R1C6 -> 0,1,7,14000;0,1,8,4800;0,1,4,8000; | D242: =VLOOKUP(ROUND(RC[1],-2),Sheet3!C23:C24,2,TRUE) -> 33 | E242: =Sheet3!R[2]C[11] -> 232700 | F242: 35 | G242: 0,1,7,14000 | H242: ="0,1,8,"&RC[24] -> 0,1,8,4800 | I242: ="0,1,4,"&RC[18] -> 0,1,4,8000 | U242: 0,1,4,1000 | X242: 29 | Y242: =MID(RC[-4],7,99)*1 -> 1000 | AA242: 8000 | AE242: 360 | AF242: 4800
B243: =RC[5]&R1C6&RC[6]&R1C6&RC[7]&R1C6 -> 0,1,7,42000;0,1,8,5100;0,1,4,8500; | D243: =VLOOKUP(ROUND(RC[1],-2),Sheet3!C23:C24,2,TRUE) -> 35 | E243: =Sheet3!R[2]C[11] -> 274700 | F243: 40 | G243: 0,1,7,42000 | H243: ="0,1,8,"&RC[24] -> 0,1,8,5100 | I243: ="0,1,4,"&RC[18] -> 0,1,4,8500 | U243: 0,1,4,1200 | X243: 30 | Y243: =MID(RC[-4],7,99)*1 -> 1200 | AA243: 8500 | AE243: 600 | AF243: 5100
B244: =RC[5]&R1C6&RC[6]&R1C6&RC[7]&R1C6 -> 0,1,7,15000;0,1,8,5400;0,1,4,9000; | D244: =VLOOKUP(ROUND(RC[1],-2),Sheet3!C23:C24,2,TRUE) -> 35 | E244: =Sheet3!R[2]C[11] -> 289700 | F244: 40 | G244: 0,1,7,15000 | H244: ="0,1,8,"&RC[24] -> 0,1,8,5400 | I244: ="0,1,4,"&RC[18] -> 0,1,4,9000 | U244: 0,1,4,1200 | X244: 31 | Y244: =MID(RC[-4],7,99)*1 -> 1200 | AA244: 9000 | AE244: 600 | AF244: 5400
B245: =RC[5]&R1C6&RC[6]&R1C6&RC[7]&R1C6 -> 0,1,7,15000;0,1,8,5700;0,1,4,9500; | D245: =VLOOKUP(ROUND(RC[1],-2),Sheet3!C23:C24,2,TRUE) -> 35 | E245: =Sheet3!R[2]C[11] -> 304700 | F245: 40 | G245: 0,1,7,15000 | H245: ="0,1,8,"&RC[24] -> 0,1,8,5700 | I245: ="0,1,4,"&RC[18] -> 0,1,4,9500 | U245: 0,1,4,1200 | X245: 32 | Y245: =MID(RC[-4],7,99)*1 -> 1200 | AA245: 9500 | AE245: 600 | AF245: 5700
B246: =RC[5]&R1C6&RC[6]&R1C6&RC[7]&R1C6 -> 0,1,7,16000;0,1,8,6000;0,1,4,10000; | D246: =VLOOKUP(ROUND(RC[1],-2),Sheet3!C23:C24,2,TRUE) -> 36 | E246: =Sheet3!R[2]C[11] -> 320700 | F246: 40 | G246: 0,1,7,16000 | H246: ="0,1,8,"&RC[24] -> 0,1,8,6000 | I246: ="0,1,4,"&RC[18] -> 0,1,4,10000 | U246: 0,1,4,1200 | X246: 33 | Y246: =MID(RC[-4],7,99)*1 -> 1200 | AA246: 10000 | AE246: 600 | AF246: 6000
B247: =RC[5]&R1C6&RC[6]&R1C6&RC[7]&R1C6 -> 0,1,7,16000;0,1,8,6500;0,1,4,11000; | D247: =VLOOKUP(ROUND(RC[1],-2),Sheet3!C23:C24,2,TRUE) -> 36 | E247: =Sheet3!R[2]C[11] -> 336700 | F247: 40 | G247: 0,1,7,16000 | H247: ="0,1,8,"&RC[24] -> 0,1,8,6500 | I247: ="0,1,4,"&RC[18] -> 0,1,4,11000 | U247: 0,1,4,37500 | X247: 34 | Y247: =MID(RC[-4],7,99)*1 -> 37500 | AA247: 11000 | AE247: 18200 | AF247: 6500
B248: =RC[5]&R1C6&RC[6]&R1C6&RC[7]&R1C6 -> 0,1,7,49000;0,1,8,7000;0,1,4,12000; | D248: =VLOOKUP(ROUND(RC[1],-2),Sheet3!C23:C24,2,TRUE) -> 37 | E248: =Sheet3!R[2]C[11] -> 385700 | F248: 40 | G248: 0,1,7,49000 | H248: ="0,1,8,"&RC[24] -> 0,1,8,7000 | I248: ="0,1,4,"&RC[18] -> 0,1,4,12000 | U248: 0,1,4,1200 | X248: 35 | Y248: =MID(RC[-4],7,99)*1 -> 1200 | AA248: 12000 | AE248: 600 | AF248: 7000
B249: =RC[5]&R1C6&RC[6]&R1C6&RC[7]&R1C6 -> 0,1,7,17000;0,1,8,7500;0,1,4,13000; | D249: =VLOOKUP(ROUND(RC[1],-2),Sheet3!C23:C24,2,TRUE) -> 38 | E249: =Sheet3!R[2]C[11] -> 402700 | F249: 40 | G249: 0,1,7,17000 | H249: ="0,1,8,"&RC[24] -> 0,1,8,7500 | I249: ="0,1,4,"&RC[18] -> 0,1,4,13000 | U249: 0,1,4,1200 | X249: 36 | Y249: =MID(RC[-4],7,99)*1 -> 1200 | AA249: 13000 | AE249: 600 | AF249: 7500
B250: =RC[5]&R1C6&RC[6]&R1C6&RC[7]&R1C6 -> 0,1,7,17000;0,1,8,8000;0,1,4,14000; | D250: =VLOOKUP(ROUND(RC[1],-2),Sheet3!C23:C24,2,TRUE) -> 38 | E250: =Sheet3!R[2]C[11] -> 419700 | F250: 40 | G250: 0,1,7,17000 | H250: ="0,1,8,"&RC[24] -> 0,1,8,8000 | I250: ="0,1,4,"&RC[18] -> 0,1,4,14000 | U250: 0,1,4,1200 | X250: 37 | Y250: =MID(RC[-4],7,99)*1 -> 1200 | AA250: 14000 | AE250: 600 | AF250: 8000
B251: =RC[5]&R1C6&RC[6]&R1C6&RC[7]&R1C6 -> 0,1,7,18000;0,1,8,8500;0,1,4,15000; | D251: =VLOOKUP(ROUND(RC[1],-2),Sheet3!C23:C24,2,TRUE) -> 38 | E251: =Sheet3!R[2]C[11] -> 437700 | F251: 45 | G251: 0,1,7,18000 | H251: ="0,1,8,"&RC[24] -> 0,1,8,8500 | I251: ="0,1,4,"&RC[18] -> 0,1,4,15000 | U251: 0,1,4,3000 | X251: 38 | Y251: =MID(RC[-4],7,99)*1 -> 3000 | AA251: 15000 | AE251: 2000 | AF251: 8500
B252: =RC[5]&R1C6&RC[6]&R1C6&RC[7]&R1C6 -> 0,1,7,18000;0,1,8,9000;0,1,4,16000; | D252: =VLOOKUP(ROUND(RC[1],-2),Sheet3!C23:C24,2,TRUE) -> 39 | E252: =Sheet3!R[2]C[11] -> 455700 | F252: 45 | G252: 0,1,7,18000 | H252: ="0,1,8,"&RC[24] -> 0,1,8,9000 | I252: ="0,1,4,"&RC[18] -> 0,1,4,16000 | U252: 0,1,4,3000 | X252: 39 | Y252: =MID(RC[-4],7,99)*1 -> 3000 | AA252: 16000 | AE252: 2000 | AF252: 9000
B253: =RC[5]&R1C6&RC[6]&R1C6&RC[7]&R1C6 -> 0,1,7,57000;0,1,8,9500;0,1,4,17000; | D253: =VLOOKUP(ROUND(RC[1],-2),Sheet3!C23:C24,2,TRUE) -> 40 | E253: =Sheet3!R[2]C[11] -> 512700 | F253: 45 | G253: 0,1,7,57000 | H253: ="0,1,8,"&RC[24] -> 0,1,8,9500 | I253: ="0,1,4,"&RC[18] -> 0,1,4,17000 | U253: 0,1,4,80000 | X253: 40 | Y253: =MID(RC[-4],7,99)*1 -> 80000 | AA253: 17000 | AE253: 60000 | AF253: 9500
B254: =RC[5]&R1C6&RC[6]&R1C6&RC[7]&R1C6 -> 0,1,7,19000;0,1,8,10000;0,1,4,18000; | D254: =VLOOKUP(ROUND(RC[1],-2),Sheet3!C23:C24,2,TRUE) -> 40 | E254: =Sheet3!R[2]C[11] -> 531700 | F254: 45 | G254: 0,1,7,19000 | H254: ="0,1,8,"&RC[24] -> 0,1,8,10000 | I254: ="0,1,4,"&RC[18] -> 0,1,4,18000 | U254: 0,1,4,3000 | X254: 41 | Y254: =MID(RC[-4],7,99)*1 -> 3000 | AA254: 18000 | AE254: 2000 | AF254: 10000
B255: =RC[5]&R1C6&RC[6]&R1C6&RC[7]&R1C6 -> 0,1,7,20000;0,1,8,11000;0,1,4,19000; | D255: =VLOOKUP(ROUND(RC[1],-2),Sheet3!C23:C24,2,TRUE) -> 40 | E255: =Sheet3!R[2]C[11] -> 551700 | F255: 45 | G255: 0,1,7,20000 | H255: ="0,1,8,"&RC[24] -> 0,1,8,11000 | I255: ="0,1,4,"&RC[18] -> 0,1,4,19000 | U255: 0,1,4,3000 | X255: 42 | Y255: =MID(RC[-4],7,99)*1 -> 3000 | AA255: 19000 | AE255: 2000 | AF255: 11000
B256: =RC[5]&R1C6&RC[6]&R1C6&RC[7]&R1C6 -> 0,1,7,20000;0,1,8,12000;0,1,4,20000; | D256: =VLOOKUP(ROUND(RC[1],-2),Sheet3!C23:C24,2,TRUE) -> 40 | E256: =Sheet3!R[2]C[11] -> 571700 | F256: 45 | G256: 0,1,7,20000 | H256: ="0,1,8,"&RC[24] -> 0,1,8,12000 | I256: ="0,1,4,"&RC[18] -> 0,1,4,20000 | U256: 0,1,4,80000 | X256: 43 | Y256: =MID(RC[-4],7,99)*1 -> 80000 | AA256: 20000 | AE256: 60000 | AF256: 12000
B257: =RC[5]&R1C6&RC[6]&R1C6&RC[7]&R1C6 -> 0,1,7,21000;0,1,8,13000;0,1,4,22000; | D257: =VLOOKUP(ROUND(RC[1],-2),Sheet3!C23:C24,2,TRUE) -> 40 | E257: =Sheet3!R[2]C[11] -> 592700 | F257: 45 | G257: 0,1,7,21000 | H257: ="0,1,8,"&RC[24] -> 0,1,8,13000 | I257: ="0,1,4,"&RC[18] -> 0,1,4,22000 | U257: 0,1,4,3000 | X257: 44 | Y257: =MID(RC[-4],7,99)*1 -> 3000 | AA257: 22000 | AE257: 2000 | AF257: 13000
B258: =RC[5]&R1C6&RC[6]&R1C6&RC[7]&R1C6 -> 0,1,7,64000;0,1,8,14000;0,1,4,24000; | D258: =VLOOKUP(ROUND(RC[1],-2),Sheet3!C23:C24,2,TRUE) -> 41 | E258: =Sheet3!R[2]C[11] -> 656700 | F258: 45 | G258: 0,1,7,64000 | H258: ="0,1,8,"&RC[24] -> 0,1,8,14000 | I258: ="0,1,4,"&RC[18] -> 0,1,4,24000 | U258: 0,1,4,3000 | X258: 45 | Y258: =MID(RC[-4],7,99)*1 -> 3000 | AA258: 24000 | AE258: 2000 | AF258: 14000
B259: =RC[5]&R1C6&RC[6]&R1C6&RC[7]&R1C6 -> 0,1,7,22000;0,1,8,15000;0,1,4,26000; | D259: =VLOOKUP(ROUND(RC[1],-2),Sheet3!C23:C24,2,TRUE) -> 41 | E259: =Sheet3!R[2]C[11] -> 678700 | F259: 50 | G259: 0,1,7,22000 | H259: ="0,1,8,"&RC[24] -> 0,1,8,15000 | I259: ="0,1,4,"&RC[18] -> 0,1,4,26000 | U259: 0,1,4,5000 | X259: 46 | Y259: =MID(RC[-4],7,99)*1 -> 5000 | AA259: 26000 | AE259: 2000 | AF259: 15000
B260: =RC[5]&R1C6&RC[6]&R1C6&RC[7]&R1C6 -> 0,1,7,22000;0,1,8,16000;0,1,4,28000; | D260: =VLOOKUP(ROUND(RC[1],-2),Sheet3!C23:C24,2,TRUE) -> 41 | E260: =Sheet3!R[2]C[11] -> 700700 | F260: 50 | G260: 0,1,7,22000 | H260: ="0,1,8,"&RC[24] -> 0,1,8,16000 | I260: ="0,1,4,"&RC[18] -> 0,1,4,28000 | U260: 0,1,4,140000 | X260: 47 | Y260: =MID(RC[-4],7,99)*1 -> 140000 | AA260: 28000 | AE260: 75000 | AF260: 16000
B261: =RC[5]&R1C6&RC[6]&R1C6&RC[7]&R1C6 -> 0,1,7,23000;0,1,8,17000;0,1,4,30000; | D261: =VLOOKUP(ROUND(RC[1],-2),Sheet3!C23:C24,2,TRUE) -> 41 | E261: =Sheet3!R[2]C[11] -> 723700 | F261: 50 | G261: 0,1,7,23000 | H261: ="0,1,8,"&RC[24] -> 0,1,8,17000 | I261: ="0,1,4,"&RC[18] -> 0,1,4,30000 | U261: 0,1,4,5000 | X261: 48 | Y261: =MID(RC[-4],7,99)*1 -> 5000 | AA261: 30000 | AE261: 2000 | AF261: 17000
B262: =RC[5]&R1C6&RC[6]&R1C6&RC[7]&R1C6 -> 0,1,7,23000;0,1,8,18000;0,1,4,32000; | D262: =VLOOKUP(ROUND(RC[1],-2),Sheet3!C23:C24,2,TRUE) -> 41 | E262: =Sheet3!R[2]C[11] -> 746700 | F262: 50 | G262: 0,1,7,23000 | H262: ="0,1,8,"&RC[24] -> 0,1,8,18000 | I262: ="0,1,4,"&RC[18] -> 0,1,4,32000 | U262: 0,1,4,5000 | X262: 49 | Y262: =MID(RC[-4],7,99)*1 -> 5000 | AA262: 32000 | AE262: 2000 | AF262: 18000
B263: =RC[5]&R1C6&RC[6]&R1C6&RC[7]&R1C6 -> 0,1,7,73000;0,1,8,19000;0,1,4,34000; | D263: =VLOOKUP(ROUND(RC[1],-2),Sheet3!C23:C24,2,TRUE) -> 42 | E263: =Sheet3!R[2]C[11] -> 819700 | F263: 50 | G263: 0,1,7,73000 | H263: ="0,1,8,"&RC[24] -> 0,1,8,19000 | I263: ="0,1,4,"&RC[18] -> 0,1,4,34000 | U263: 0,1,4,5000 | X263: 50 | Y263: =MID(RC[-4],7,99)*1 -> 5000 | AA263: 34000 | AE263: 2000 | AF263: 19000
B264: =RC[5]&R1C6&RC[6]&R1C6&RC[7]&R1C6 -> 0,1,7,24000;0,1,8,20000;0,1,4,36000; | D264: =VLOOKUP(ROUND(RC[1],-2),Sheet3!C23:C24,2,TRUE) -> 42 | E264: =Sheet3!R[2]C[11] -> 843700 | F264: 50 | G264: 0,1,7,24000 | H264: ="0,1,8,"&RC[24] -> 0,1,8,20000 | I264: ="0,1,4,"&RC[18] -> 0,1,4,36000 | U264: 0,1,4,5000 | X264: 51 | Y264: =MID(RC[-4],7,99)*1 -> 5000 | AA264: 36000 | AE264: 2000 | AF264: 20000
B265: =RC[5]&R1C6&RC[6]&R1C6&RC[7]&R1C6 -> 0,1,7,25000;0,1,8,22000;0,1,4,38000; | D265: =VLOOKUP(ROUND(RC[1],-2),Sheet3!C23:C24,2,TRUE) -> 42 | E265: =Sheet3!R[2]C[11] -> 868700 | F265: 50 | G265: 0,1,7,25000 | H265: ="0,1,8,"&RC[24] -> 0,1,8,22000 | I265: ="0,1,4,"&RC[18] -> 0,1,4,38000 | U265: 0,1,4,5000 | X265: 52 | Y265: =MID(RC[-4],7,99)*1 -> 5000 | AA265: 38000 | AE265: 2000 | AF265: 22000
B266: =RC[5]&R1C6&RC[6]&R1C6&RC[7]&R1C6 -> 0,1,7,25000;0,1,8,24000;0,1,4,40000; | D266: =VLOOKUP(ROUND(RC[1],-2),Sheet3!C23:C24,2,TRUE) -> 42 | E266: =Sheet3!R[2]C[11] -> 893700 | F266: 50 | G266: 0,1,7,25000 | H266: ="0,1,8,"&RC[24] -> 0,1,8,24000 | I266: ="0,1,4,"&RC[18] -> 0,1,4,40000 | U266: 0,1,4,5000 | X266: 53 | Y266: =MID(RC[-4],7,99)*1 -> 5000 | AA266: 40000 | AE266: 2000 | AF266: 24000
B267: =RC[5]&R1C6&RC[6]&R1C6&RC[7]&R1C6 -> 0,1,7,26000;0,1,8,26000;0,1,4,42000; | D267: =VLOOKUP(ROUND(RC[1],-2),Sheet3!C23:C24,2,TRUE) -> 42 | E267: =Sheet3!R[2]C[11] -> 919700 | F267: 50 | G267: 0,1,7,26000 | H267: ="0,1,8,"&RC[24] -> 0,1,8,26000 | I267: ="0,1,4,"&RC[18] -> 0,1,4,42000 | U267: 0,1,4,5000 | X267: 54 | Y267: =MID(RC[-4],7,99)*1 -> 5000 | AA267: 42000 | AE267: 2000 | AF267: 26000
B268: =RC[5]&R1C6&RC[6]&R1C6&RC[7]&R1C6 -> 0,1,7,80000;0,1,8,28000;0,1,4,44000; | D268: =VLOOKUP(ROUND(RC[1],-2),Sheet3!C23:C24,2,TRUE) -> 43 | E268: =Sheet3!R[2]C[11] -> 999700 | F268: 50 | G268: 0,1,7,80000 | H268: ="0,1,8,"&RC[24] -> 0,1,8,28000 | I268: ="0,1,4,"&RC[18] -> 0,1,4,44000 | U268: 0,1,4,5000 | X268: 55 | Y268: =MID(RC[-4],7,99)*1 -> 5000 | AA268: 44000 | AE268: 2000 | AF268: 28000
B269: =RC[5]&R1C6&RC[6]&R1C6&RC[7]&R1C6 -> 0,1,7,27000;0,1,8,30000;0,1,4,46000; | D269: =VLOOKUP(ROUND(RC[1],-2),Sheet3!C23:C24,2,TRUE) -> 43 | E269: =Sheet3!R[2]C[11] -> 1026700 | F269: 50 | G269: 0,1,7,27000 | H269: ="0,1,8,"&RC[24] -> 0,1,8,30000 | I269: ="0,1,4,"&RC[18] -> 0,1,4,46000 | U269: 0,1,4,5000 | X269: 56 | Y269: =MID(RC[-4],7,99)*1 -> 5000 | AA269: 46000 | AE269: 2000 | AF269: 30000
B270: =RC[5]&R1C6&RC[6]&R1C6&RC[7]&R1C6 -> 0,1,7,27000;0,1,8,32000;0,1,4,48000; | D270: =VLOOKUP(ROUND(RC[1],-2),Sheet3!C23:C24,2,TRUE) -> 43 | E270: =Sheet3!R[2]C[11] -> 1053700 | F270: 55 | G270: 0,1,7,27000 | H270: ="0,1,8,"&RC[24] -> 0,1,8,32000 | I270: ="0,1,4,"&RC[18] -> 0,1,4,48000 | U270: 0,1,4,5000 | X270: 57 | Y270: =MID(RC[-4],7,99)*1 -> 5000 | AA270: 48000 | AE270: 2250 | AF270: 32000
B271: =RC[5]&R1C6&RC[6]&R1C6&RC[7]&R1C6 -> 0,1,7,28000;0,1,8,34000;0,1,4,50000; | D271: =VLOOKUP(ROUND(RC[1],-2),Sheet3!C23:C24,2,TRUE) -> 43 | E271: =Sheet3!R[2]C[11] -> 1081700 | F271: 55 | G271: 0,1,7,28000 | H271: ="0,1,8,"&RC[24] -> 0,1,8,34000 | I271: ="0,1,4,"&RC[18] -> 0,1,4,50000 | U271: 0,1,4,5000 | X271: 58 | Y271: =MID(RC[-4],7,99)*1 -> 5000 | AA271: 50000 | AE271: 2250 | AF271: 34000
B272: =RC[5]&R1C6&RC[6]&R1C6&RC[7]&R1C6 -> 0,1,7,28000;0,1,8,36000;0,1,4,55000; | D272: =VLOOKUP(ROUND(RC[1],-2),Sheet3!C23:C24,2,TRUE) -> 43 | E272: =Sheet3!R[2]C[11] -> 1109700 | F272: 55 | G272: 0,1,7,28000 | H272: ="0,1,8,"&RC[24] -> 0,1,8,36000 | I272: ="0,1,4,"&RC[18] -> 0,1,4,55000 | U272: 0,1,4,5000 | X272: 59 | Y272: =MID(RC[-4],7,99)*1 -> 5000 | AA272: 55000 | AE272: 2250 | AF272: 36000
B273: =RC[5]&R1C6&RC[6]&R1C6&RC[7]&R1C6 -> 0,1,7,89000;0,1,8,38000;0,1,4,60000; | D273: =VLOOKUP(ROUND(RC[1],-2),Sheet3!C23:C24,2,TRUE) -> 44 | E273: =Sheet3!R[2]C[11] -> 1198700 | F273: 55 | G273: 0,1,7,89000 | H273: ="0,1,8,"&RC[24] -> 0,1,8,38000 | I273: ="0,1,4,"&RC[18] -> 0,1,4,60000 | U273: 0,1,4,5000 | X273: 60 | Y273: =MID(RC[-4],7,99)*1 -> 5000 | AA273: 60000 | AE273: 2250 | AF273: 38000
B274: =RC[5]&R1C6&RC[6]&R1C6&RC[7]&R1C6 -> 0,1,7,29000;0,1,8,40000;0,1,4,65000; | D274: =VLOOKUP(ROUND(RC[1],-2),Sheet3!C23:C24,2,TRUE) -> 44 | E274: =Sheet3!R[2]C[11] -> 1227700 | F274: 55 | G274: 0,1,7,29000 | H274: ="0,1,8,"&RC[24] -> 0,1,8,40000 | I274: ="0,1,4,"&RC[18] -> 0,1,4,65000 | U274: 0,1,4,5000 | X274: 61 | Y274: =MID(RC[-4],7,99)*1 -> 5000 | AA274: 65000 | AE274: 2250 | AF274: 40000
B275: =RC[5]&R1C6&RC[6]&R1C6&RC[7]&R1C6 -> 0,1,7,30000;0,1,8,42000;0,1,4,70000; | D275: =VLOOKUP(ROUND(RC[1],-2),Sheet3!C23:C24,2,TRUE) -> 44 | E275: =Sheet3!R[2]C[11] -> 1257700 | F275: 55 | G275: 0,1,7,30000 | H275: ="0,1,8,"&RC[24] -> 0,1,8,42000 | I275: ="0,1,4,"&RC[18] -> 0,1,4,70000 | U275: 0,1,4,5000 | X275: 62 | Y275: =MID(RC[-4],7,99)*1 -> 5000 | AA275: 70000 | AE275: 2250 | AF275: 42000
B276: =RC[5]&R1C6&RC[6]&R1C6&RC[7]&R1C6 -> 0,1,7,30000;0,1,8,44000;0,1,4,75000; | D276: =VLOOKUP(ROUND(RC[1],-2),Sheet3!C23:C24,2,TRUE) -> 44 | E276: =Sheet3!R[2]C[11] -> 1287700 | F276: 55 | G276: 0,1,7,30000 | H276: ="0,1,8,"&RC[24] -> 0,1,8,44000 | I276: ="0,1,4,"&RC[18] -> 0,1,4,75000 | U276: 0,1,4,5000 | X276: 63 | Y276: =MID(RC[-4],7,99)*1 -> 5000 | AA276: 75000 | AE276: 2250 | AF276: 44000
B277: =RC[5]&R1C6&RC[6]&R1C6&RC[7]&R1C6 -> 0,1,7,31000;0,1,8,46000;0,1,4,80000; | D277: =VLOOKUP(ROUND(RC[1],-2),Sheet3!C23:C24,2,TRUE) -> 44 | E277: =Sheet3!R[2]C[11] -> 1318700 | F277: 55 | G277: 0,1,7,31000 | H277: ="0,1,8,"&RC[24] -> 0,1,8,46000 | I277: ="0,1,4,"&RC[18] -> 0,1,4,80000 | U277: 0,1,4,195000 | X277: 64 | Y277: =MID(RC[-4],7,99)*1 -> 195000 | AA277: 80000 | AE277: 93750 | AF277: 46000
B278: =RC[5]&R1C6&RC[6]&R1C6&RC[7]&R1C6 -> 0,1,7,96000;0,1,8,48000;0,1,4,85000; | D278: =VLOOKUP(ROUND(RC[1],-2),Sheet3!C23:C24,2,TRUE) -> 45 | E278: =Sheet3!R[2]C[11] -> 1414700 | F278: 55 | G278: 0,1,7,96000 | H278: ="0,1,8,"&RC[24] -> 0,1,8,48000 | I278: ="0,1,4,"&RC[18] -> 0,1,4,85000 | U278: 0,1,4,5000 | X278: 65 | Y278: =MID(RC[-4],7,99)*1 -> 5000 | AA278: 85000 | AE278: 2250 | AF278: 48000
B279: =RC[5]&R1C6&RC[6]&R1C6&RC[7]&R1C6 -> 0,1,7,32000;0,1,8,50000;0,1,4,90000; | D279: =VLOOKUP(ROUND(RC[1],-2),Sheet3!C23:C24,2,TRUE) -> 45 | E279: =Sheet3!R[2]C[11] -> 1446700 | F279: 55 | G279: 0,1,7,32000 | H279: ="0,1,8,"&RC[24] -> 0,1,8,50000 | I279: ="0,1,4,"&RC[18] -> 0,1,4,90000 | U279: 0,1,4,5000 | X279: 66 | Y279: =MID(RC[-4],7,99)*1 -> 5000 | AA279: 90000 | AE279: 2250 | AF279: 50000
B280: =RC[5]&R1C6&RC[6]&R1C6&RC[7]&R1C6 -> 0,1,7,32000;0,1,8,52000;0,1,4,95000; | D280: =VLOOKUP(ROUND(RC[1],-2),Sheet3!C23:C24,2,TRUE) -> 45 | E280: =Sheet3!R[2]C[11] -> 1478700 | F280: 55 | G280: 0,1,7,32000 | H280: ="0,1,8,"&RC[24] -> 0,1,8,52000 | I280: ="0,1,4,"&RC[18] -> 0,1,4,95000 | U280: 0,1,4,195000 | X280: 67 | Y280: =MID(RC[-4],7,99)*1 -> 195000 | AA280: 95000 | AE280: 100000 | AF280: 52000
B281: =RC[5]&R1C6&RC[6]&R1C6&RC[7]&R1C6 -> 0,1,7,33000;0,1,8,54000;0,1,4,100000; | D281: =VLOOKUP(ROUND(RC[1],-2),Sheet3!C23:C24,2,TRUE) -> 45 | E281: =Sheet3!R[2]C[11] -> 1511700 | F281: 55 | G281: 0,1,7,33000 | H281: ="0,1,8,"&RC[24] -> 0,1,8,54000 | I281: ="0,1,4,"&RC[18] -> 0,1,4,100000 | U281: 0,1,4,5000 | X281: 68 | Y281: =MID(RC[-4],7,99)*1 -> 5000 | AA281: 100000 | AE281: 2250 | AF281: 54000
B282: =RC[5]&R1C6&RC[6]&R1C6&RC[7]&R1C6 -> 0,1,7,33000;0,1,8,56000;0,1,4,105000; | D282: =VLOOKUP(ROUND(RC[1],-2),Sheet3!C23:C24,2,TRUE) -> 45 | E282: =Sheet3!R[2]C[11] -> 1544700 | F282: 60 | G282: 0,1,7,33000 | H282: ="0,1,8,"&RC[24] -> 0,1,8,56000 | I282: ="0,1,4,"&RC[18] -> 0,1,4,105000 | U282: 0,1,4,5500 | X282: 69 | Y282: =MID(RC[-4],7,99)*1 -> 5500 | AA282: 105000 | AE282: 2500 | AF282: 56000
B283: =RC[5]&R1C6&RC[6]&R1C6&RC[7]&R1C6 -> 0,1,7,104000;0,1,8,58000;0,1,4,110000; | D283: =VLOOKUP(ROUND(RC[1],-2),Sheet3!C23:C24,2,TRUE) -> 45 | E283: =Sheet3!R[2]C[11] -> 1648700 | F283: 60 | G283: 0,1,7,104000 | H283: ="0,1,8,"&RC[24] -> 0,1,8,58000 | I283: ="0,1,4,"&RC[18] -> 0,1,4,110000 | U283: 0,1,4,5500 | X283: 70 | Y283: =MID(RC[-4],7,99)*1 -> 5500 | AA283: 110000 | AE283: 2500 | AF283: 58000
B284: =RC[5]&R1C6&RC[6]&R1C6&RC[7]&R1C6 -> 0,1,7,34000;0,1,8,60000;0,1,4,115000; | D284: =VLOOKUP(ROUND(RC[1],-2),Sheet3!C23:C24,2,TRUE) -> 46 | E284: =Sheet3!R[2]C[11] -> 1682700 | F284: 60 | G284: 0,1,7,34000 | H284: ="0,1,8,"&RC[24] -> 0,1,8,60000 | I284: ="0,1,4,"&RC[18] -> 0,1,4,115000 | U284: 0,1,4,638000 | X284: 71 | Y284: =MID(RC[-4],7,99)*1 -> 638000 | AA284: 115000 | AE284: 160000 | AF284: 60000
B285: =RC[5]&R1C6&RC[6]&R1C6&RC[7]&R1C6 -> 0,1,7,35000;0,1,8,62000;0,1,4,120000; | D285: =VLOOKUP(ROUND(RC[1],-2),Sheet3!C23:C24,2,TRUE) -> 46 | E285: =Sheet3!R[2]C[11] -> 1717700 | F285: 60 | G285: 0,1,7,35000 | H285: ="0,1,8,"&RC[24] -> 0,1,8,62000 | I285: ="0,1,4,"&RC[18] -> 0,1,4,120000 | U285: 0,1,4,5500 | X285: 72 | Y285: =MID(RC[-4],7,99)*1 -> 5500 | AA285: 120000 | AE285: 2500 | AF285: 62000
B286: =RC[5]&R1C6&RC[6]&R1C6&RC[7]&R1C6 -> 0,1,7,35000;0,1,8,64000;0,1,4,125000; | D286: =VLOOKUP(ROUND(RC[1],-2),Sheet3!C23:C24,2,TRUE) -> 46 | E286: =Sheet3!R[2]C[11] -> 1752700 | F286: 60 | G286: 0,1,7,35000 | H286: ="0,1,8,"&RC[24] -> 0,1,8,64000 | I286: ="0,1,4,"&RC[18] -> 0,1,4,125000 | U286: 0,1,4,5500 | X286: 73 | Y286: =MID(RC[-4],7,99)*1 -> 5500 | AA286: 125000 | AE286: 2500 | AF286: 64000
B287: =RC[5]&R1C6&RC[6]&R1C6&RC[7]&R1C6 -> 0,1,7,36000;0,1,8,66000;0,1,4,130000; | D287: =VLOOKUP(ROUND(RC[1],-2),Sheet3!C23:C24,2,TRUE) -> 46 | E287: =Sheet3!R[2]C[11] -> 1788700 | F287: 60 | G287: 0,1,7,36000 | H287: ="0,1,8,"&RC[24] -> 0,1,8,66000 | I287: ="0,1,4,"&RC[18] -> 0,1,4,130000 | U287: 0,1,4,650000 | X287: 74 | Y287: =MID(RC[-4],7,99)*1 -> 650000 | AA287: 130000 | AE287: 160000 | AF287: 66000
B288: =RC[5]&R1C6&RC[6]&R1C6&RC[7]&R1C6 -> 0,1,7,111000;0,1,8,68000;0,1,4,135000; | D288: =VLOOKUP(ROUND(RC[1],-2),Sheet3!C23:C24,2,TRUE) -> 46 | E288: =Sheet3!R[2]C[11] -> 1899700 | F288: 60 | G288: 0,1,7,111000 | H288: ="0,1,8,"&RC[24] -> 0,1,8,68000 | I288: ="0,1,4,"&RC[18] -> 0,1,4,135000 | U288: 0,1,4,5500 | X288: 75 | Y288: =MID(RC[-4],7,99)*1 -> 5500 | AA288: 135000 | AE288: 2500 | AF288: 68000
B289: =RC[5]&R1C6&RC[6]&R1C6&RC[7]&R1C6 -> 0,1,7,37000;0,1,8,70000;0,1,4,140000; | D289: =VLOOKUP(ROUND(RC[1],-2),Sheet3!C23:C24,2,TRUE) -> 46 | E289: =Sheet3!R[2]C[11] -> 1936700 | F289: 60 | G289: 0,1,7,37000 | H289: ="0,1,8,"&RC[24] -> 0,1,8,70000 | I289: ="0,1,4,"&RC[18] -> 0,1,4,140000 | U289: 0,1,4,650000 | X289: 76 | Y289: =MID(RC[-4],7,99)*1 -> 650000 | AA289: 140000 | AE289: 160000 | AF289: 70000
B290: =RC[5]&R1C6&RC[6]&R1C6&RC[7]&R1C6 -> 0,1,7,37000;0,1,8,72000;0,1,4,145000; | D290: =VLOOKUP(ROUND(RC[1],-2),Sheet3!C23:C24,2,TRUE) -> 47 | E290: =Sheet3!R[2]C[11] -> 1973700 | F290: 60 | G290: 0,1,7,37000 | H290: ="0,1,8,"&RC[24] -> 0,1,8,72000 | I290: ="0,1,4,"&RC[18] -> 0,1,4,145000 | U290: 0,1,4,5500 | X290: 77 | Y290: =MID(RC[-4],7,99)*1 -> 5500 | AA290: 145000 | AE290: 2500 | AF290: 72000
B291: =RC[5]&R1C6&RC[6]&R1C6&RC[7]&R1C6 -> 0,1,7,38000;0,1,8,74000;0,1,4,150000; | D291: =VLOOKUP(ROUND(RC[1],-2),Sheet3!C23:C24,2,TRUE) -> 47 | E291: =Sheet3!R[2]C[11] -> 2011700 | F291: 60 | G291: 0,1,7,38000 | H291: ="0,1,8,"&RC[24] -> 0,1,8,74000 | I291: ="0,1,4,"&RC[18] -> 0,1,4,150000 | U291: 0,1,4,5500 | X291: 78 | Y291: =MID(RC[-4],7,99)*1 -> 5500 | AA291: 150000 | AE291: 2500 | AF291: 74000
B292: =RC[5]&R1C6&RC[6]&R1C6&RC[7]&R1C6 -> 0,1,7,38000;0,1,8,76000;0,1,4,155000; | D292: =VLOOKUP(ROUND(RC[1],-2),Sheet3!C23:C24,2,TRUE) -> 47 | E292: =Sheet3!R[2]C[11] -> 2049700 | F292: 60 | G292: 0,1,7,38000 | H292: ="0,1,8,"&RC[24] -> 0,1,8,76000 | I292: ="0,1,4,"&RC[18] -> 0,1,4,155000 | U292: 0,1,4,5500 | X292: 79 | Y292: =MID(RC[-4],7,99)*1 -> 5500 | AA292: 155000 | AE292: 2500 | AF292: 76000
B293: =RC[5]&R1C6&RC[6]&R1C6&RC[7]&R1C6 -> 0,1,7,120000;0,1,8,78000;0,1,4,160000; | D293: =VLOOKUP(ROUND(RC[1],-2),Sheet3!C23:C24,2,TRUE) -> 47 | E293: =Sheet3!R[2]C[11] -> 2169700 | F293: 65 | G293: 0,1,7,120000 | H293: ="0,1,8,"&RC[24] -> 0,1,8,78000 | I293: ="0,1,4,"&RC[18] -> 0,1,4,160000 | U293: 0,1,4,6500 | X293: 80 | Y293: =MID(RC[-4],7,99)*1 -> 6500 | AA293: 160000 | AE293: 2750 | AF293: 78000
B294: =RC[5]&R1C6&RC[6]&R1C6&RC[7]&R1C6 -> 0,1,7,79000;0,1,8,80000;0,1,4,165000; | D294: =VLOOKUP(ROUND(RC[1],-2),Sheet3!C23:C24,2,TRUE) -> 47 | E294: =Sheet3!R[2]C[11] -> 2248700 | F294: 65 | G294: 0,1,7,79000 | H294: ="0,1,8,"&RC[24] -> 0,1,8,80000 | I294: ="0,1,4,"&RC[18] -> 0,1,4,165000 | U294: 0,1,4,6500 | X294: 81 | Y294: =MID(RC[-4],7,99)*1 -> 6500 | AA294: 165000 | AE294: 2750 | AF294: 80000
B295: =RC[5]&R1C6&RC[6]&R1C6&RC[7]&R1C6 -> 0,1,7,81000;0,1,8,82000;0,1,4,170000; | D295: =VLOOKUP(ROUND(RC[1],-2),Sheet3!C23:C24,2,TRUE) -> 48 | E295: =Sheet3!R[2]C[11] -> 2329700 | F295: 65 | G295: 0,1,7,81000 | H295: ="0,1,8,"&RC[24] -> 0,1,8,82000 | I295: ="0,1,4,"&RC[18] -> 0,1,4,170000 | U295: 0,1,4,6500 | X295: 82 | Y295: =MID(RC[-4],7,99)*1 -> 6500 | AA295: 170000 | AE295: 2750 | AF295: 82000
B296: =RC[5]&R1C6&RC[6]&R1C6&RC[7]&R1C6 -> 0,1,7,83000;0,1,8,84000;0,1,4,175000; | D296: =VLOOKUP(ROUND(RC[1],-2),Sheet3!C23:C24,2,TRUE) -> 48 | E296: =Sheet3!R[2]C[11] -> 2412700 | F296: 65 | G296: 0,1,7,83000 | H296: ="0,1,8,"&RC[24] -> 0,1,8,84000 | I296: ="0,1,4,"&RC[18] -> 0,1,4,175000 | U296: 0,1,4,650000 | X296: 83 | Y296: =MID(RC[-4],7,99)*1 -> 650000 | AA296: 175000 | AE296: 170000 | AF296: 84000
B297: =RC[5]&R1C6&RC[6]&R1C6&RC[7]&R1C6 -> 0,1,7,85000;0,1,8,86000;0,1,4,180000; | D297: =VLOOKUP(ROUND(RC[1],-2),Sheet3!C23:C24,2,TRUE) -> 48 | E297: =Sheet3!R[2]C[11] -> 2497700 | F297: 65 | G297: 0,1,7,85000 | H297: ="0,1,8,"&RC[24] -> 0,1,8,86000 | I297: ="0,1,4,"&RC[18] -> 0,1,4,180000 | U297: 0,1,4,6500 | X297: 84 | Y297: =MID(RC[-4],7,99)*1 -> 6500 | AA297: 180000 | AE297: 2750 | AF297: 86000
B298: =RC[5]&R1C6&RC[6]&R1C6&RC[7]&R1C6 -> 0,1,7,265000;0,1,8,88000;0,1,4,185000; | D298: =VLOOKUP(ROUND(RC[1],-2),Sheet3!C23:C24,2,TRUE) -> 49 | E298: =Sheet3!R[2]C[11] -> 2762700 | F298: 65 | G298: 0,1,7,265000 | H298: ="0,1,8,"&RC[24] -> 0,1,8,88000 | I298: ="0,1,4,"&RC[18] -> 0,1,4,185000 | U298: 0,1,4,6500 | X298: 85 | Y298: =MID(RC[-4],7,99)*1 -> 6500 | AA298: 185000 | AE298: 2750 | AF298: 88000
B299: =RC[5]&R1C6&RC[6]&R1C6&RC[7]&R1C6 -> 0,1,7,89000;0,1,8,90000;0,1,4,190000; | D299: =VLOOKUP(ROUND(RC[1],-2),Sheet3!C23:C24,2,TRUE) -> 49 | E299: =Sheet3!R[2]C[11] -> 2851700 | F299: 65 | G299: 0,1,7,89000 | H299: ="0,1,8,"&RC[24] -> 0,1,8,90000 | I299: ="0,1,4,"&RC[18] -> 0,1,4,190000 | U299: 0,1,4,6500 | X299: 86 | Y299: =MID(RC[-4],7,99)*1 -> 6500 | AA299: 190000 | AE299: 2750 | AF299: 90000
B300: =RC[5]&R1C6&RC[6]&R1C6&RC[7]&R1C6 -> 0,1,7,91000;0,1,8,92000;0,1,4,195000; | D300: =VLOOKUP(ROUND(RC[1],-2),Sheet3!C23:C24,2,TRUE) -> 49 | E300: =Sheet3!R[2]C[11] -> 2942700 | F300: 65 | G300: 0,1,7,91000 | H300: ="0,1,8,"&RC[24] -> 0,1,8,92000 | I300: ="0,1,4,"&RC[18] -> 0,1,4,195000 | U300: 0,1,4,6500 | X300: 87 | Y300: =MID(RC[-4],7,99)*1 -> 6500 | AA300: 195000 | AE300: 2750 | AF300: 92000
B301: =RC[5]&R1C6&RC[6]&R1C6&RC[7]&R1C6 -> 0,1,7,93000;0,1,8,94000;0,1,4,200000; | D301: =VLOOKUP(ROUND(RC[1],-2),Sheet3!C23:C24,2,TRUE) -> 49 | E301: =Sheet3!R[2]C[11] -> 3035700 | F301: 65 | G301: 0,1,7,93000 | H301: ="0,1,8,"&RC[24] -> 0,1,8,94000 | I301: ="0,1,4,"&RC[18] -> 0,1,4,200000 | U301: 0,1,4,6500 | X301: 88 | Y301: =MID(RC[-4],7,99)*1 -> 6500 | AA301: 200000 | AE301: 2750 | AF301: 94000
B302: =RC[5]&R1C6&RC[6]&R1C6&RC[7]&R1C6 -> 0,1,7,95000;0,1,8,96000;0,1,4,205000; | D302: =VLOOKUP(ROUND(RC[1],-2),Sheet3!C23:C24,2,TRUE) -> 49 | E302: =Sheet3!R[2]C[11] -> 3130700 | F302: 65 | G302: 0,1,7,95000 | H302: ="0,1,8,"&RC[24] -> 0,1,8,96000 | I302: ="0,1,4,"&RC[18] -> 0,1,4,205000 | U302: 0,1,4,6500 | X302: 89 | Y302: =MID(RC[-4],7,99)*1 -> 6500 | AA302: 205000 | AE302: 2750 | AF302: 96000
B303: =RC[5]&R1C6&RC[6]&R1C6&RC[7]&R1C6 -> 0,1,7,296000;0,1,8,98000;0,1,4,210000; | D303: =VLOOKUP(ROUND(RC[1],-2),Sheet3!C23:C24,2,TRUE) -> 50 | E303: =Sheet3!R[2]C[11] -> 3426700 | F303: 65 | G303: 0,1,7,296000 | H303: ="0,1,8,"&RC[24] -> 0,1,8,98000 | I303: ="0,1,4,"&RC[18] -> 0,1,4,210000 | U303: 0,1,4,6500 | X303: 90 | Y303: =MID(RC[-4],7,99)*1 -> 6500 | AA303: 210000 | AE303: 2750 | AF303: 98000
B304: =RC[5]&R1C6&RC[6]&R1C6&RC[7]&R1C6 -> 0,1,7,98000;0,1,8,100000;0,1,4,215000; | D304: =VLOOKUP(ROUND(RC[1],-2),Sheet3!C23:C24,2,TRUE) -> 50 | E304: =Sheet3!R[2]C[11] -> 3524700 | F304: 65 | G304: 0,1,7,98000 | H304: ="0,1,8,"&RC[24] -> 0,1,8,100000 | I304: ="0,1,4,"&RC[18] -> 0,1,4,215000 | U304: 0,1,4,650000 | X304: 91 | Y304: =MID(RC[-4],7,99)*1 -> 650000 | AA304: 215000 | AE304: 170000 | AF304: 100000
B305: =RC[5]&R1C6&RC[6]&R1C6&RC[7]&R1C6 -> 0,1,7,100000;0,1,8,102000;0,1,4,220000; | D305: =VLOOKUP(ROUND(RC[1],-2),Sheet3!C23:C24,2,TRUE) -> 50 | E305: =Sheet3!R[2]C[11] -> 3624700 | F305: 65 | G305: 0,1,7,100000 | H305: ="0,1,8,"&RC[24] -> 0,1,8,102000 | I305: ="0,1,4,"&RC[18] -> 0,1,4,220000 | U305: 0,1,4,6500 | X305: 92 | Y305: =MID(RC[-4],7,99)*1 -> 6500 | AA305: 220000 | AE305: 2750 | AF305: 102000
B306: =RC[5]&R1C6&RC[6]&R1C6&RC[7]&R1C6 -> 0,1,7,102000;0,1,8,104000;0,1,4,225000; | D306: =VLOOKUP(ROUND(RC[1],-2),Sheet3!C23:C24,2,TRUE) -> 51 | E306: =Sheet3!R[2]C[11] -> 3726700 | F306: 65 | G306: 0,1,7,102000 | H306: ="0,1,8,"&RC[24] -> 0,1,8,104000 | I306: ="0,1,4,"&RC[18] -> 0,1,4,225000 | U306: 0,1,4,6500 | X306: 93 | Y306: =MID(RC[-4],7,99)*1 -> 6500 | AA306: 225000 | AE306: 2750 | AF306: 104000
B307: =RC[5]&R1C6&RC[6]&R1C6&RC[7]&R1C6 -> 0,1,7,104000;0,1,8,106000;0,1,4,230000; | D307: =VLOOKUP(ROUND(RC[1],-2),Sheet3!C23:C24,2,TRUE) -> 51 | E307: =Sheet3!R[2]C[11] -> 3830700 | F307: 70 | G307: 0,1,7,104000 | H307: ="0,1,8,"&RC[24] -> 0,1,8,106000 | I307: ="0,1,4,"&RC[18] -> 0,1,4,230000 | U307: 0,1,4,7500 | X307: 94 | Y307: =MID(RC[-4],7,99)*1 -> 7500 | AA307: 230000 | AE307: 3000 | AF307: 106000
B308: =RC[5]&R1C6&RC[6]&R1C6&RC[7]&R1C6 -> 0,1,7,325000;0,1,8,108000;0,1,4,235000; | D308: =VLOOKUP(ROUND(RC[1],-2),Sheet3!C23:C24,2,TRUE) -> 51 | E308: =Sheet3!R[2]C[11] -> 4155700 | F308: 70 | G308: 0,1,7,325000 | H308: ="0,1,8,"&RC[24] -> 0,1,8,108000 | I308: ="0,1,4,"&RC[18] -> 0,1,4,235000 | U308: 0,1,4,7500 | X308: 95 | Y308: =MID(RC[-4],7,99)*1 -> 7500 | AA308: 235000 | AE308: 3000 | AF308: 108000
B309: =RC[5]&R1C6&RC[6]&R1C6&RC[7]&R1C6 -> 0,1,7,108000;0,1,8,110000;0,1,4,240000; | D309: =VLOOKUP(ROUND(RC[1],-2),Sheet3!C23:C24,2,TRUE) -> 52 | E309: =Sheet3!R[2]C[11] -> 4263700 | F309: 70 | G309: 0,1,7,108000 | H309: ="0,1,8,"&RC[24] -> 0,1,8,110000 | I309: ="0,1,4,"&RC[18] -> 0,1,4,240000 | U309: 0,1,4,7500 | X309: 96 | Y309: =MID(RC[-4],7,99)*1 -> 7500 | AA309: 240000 | AE309: 3000 | AF309: 110000
B310: =RC[5]&R1C6&RC[6]&R1C6&RC[7]&R1C6 -> 0,1,7,110000;0,1,8,112000;0,1,4,245000; | D310: =VLOOKUP(ROUND(RC[1],-2),Sheet3!C23:C24,2,TRUE) -> 52 | E310: =Sheet3!R[2]C[11] -> 4373700 | F310: 70 | G310: 0,1,7,110000 | H310: ="0,1,8,"&RC[24] -> 0,1,8,112000 | I310: ="0,1,4,"&RC[18] -> 0,1,4,245000 | U310: 0,1,4,7500 | X310: 97 | Y310: =MID(RC[-4],7,99)*1 -> 7500 | AA310: 245000 | AE310: 3000 | AF310: 112000
B311: =RC[5]&R1C6&RC[6]&R1C6&RC[7]&R1C6 -> 0,1,7,112000;0,1,8,114000;0,1,4,250000; | D311: =VLOOKUP(ROUND(RC[1],-2),Sheet3!C23:C24,2,TRUE) -> 52 | E311: =Sheet3!R[2]C[11] -> 4485700 | F311: 70 | G311: 0,1,7,112000 | H311: ="0,1,8,"&RC[24] -> 0,1,8,114000 | I311: ="0,1,4,"&RC[18] -> 0,1,4,250000 | U311: 0,1,4,1040000 | X311: 98 | Y311: =MID(RC[-4],7,99)*1 -> 1040000 | AA311: 250000 | AE311: 290400 | AF311: 114000
B312: =RC[5]&R1C6&RC[6]&R1C6&RC[7]&R1C6 -> 0,1,7,114000;0,1,8,116000;0,1,4,255000; | D312: =VLOOKUP(ROUND(RC[1],-2),Sheet3!C23:C24,2,TRUE) -> 52 | E312: =Sheet3!R[2]C[11] -> 4599700 | F312: 70 | G312: 0,1,7,114000 | H312: ="0,1,8,"&RC[24] -> 0,1,8,116000 | I312: ="0,1,4,"&RC[18] -> 0,1,4,255000 | U312: 0,1,4,7500 | X312: 99 | Y312: =MID(RC[-4],7,99)*1 -> 7500 | AA312: 255000 | AE312: 3000 | AF312: 116000
B313: =RC[5]&R1C6&RC[6]&R1C6&RC[7]&R1C6 -> 0,1,7,356000;0,1,8,118000;0,1,4,260000; | D313: =VLOOKUP(ROUND(RC[1],-2),Sheet3!C23:C24,2,TRUE) -> 53 | E313: =Sheet3!R[2]C[11] -> 4955700 | F313: 70 | G313: 0,1,7,356000 | H313: ="0,1,8,"&RC[24] -> 0,1,8,118000 | I313: ="0,1,4,"&RC[18] -> 0,1,4,260000 | U313: 0,1,4,1120000 | X313: 100 | Y313: =MID(RC[-4],7,99)*1 -> 1120000 | AA313: 260000 | AE313: 388000 | AF313: 118000
B314: =RC[5]&R1C6&RC[6]&R1C6&RC[7]&R1C6 -> 0,1,7,118000;0,1,8,120000;0,1,4,265000; | D314: =VLOOKUP(ROUND(RC[1],-2),Sheet3!C23:C24,2,TRUE) -> 53 | E314: =Sheet3!R[2]C[11] -> 5073700 | F314: 70 | G314: 0,1,7,118000 | H314: ="0,1,8,"&RC[24] -> 0,1,8,120000 | I314: ="0,1,4,"&RC[18] -> 0,1,4,265000 | U314: 0,1,4,7500 | X314: 101 | Y314: =MID(RC[-4],7,99)*1 -> 7500 | AA314: 265000 | AE314: 3000 | AF314: 120000
B315: =RC[5]&R1C6&RC[6]&R1C6&RC[7]&R1C6 -> 0,1,7,120000;0,1,8,122000;0,1,4,270000; | D315: =VLOOKUP(ROUND(RC[1],-2),Sheet3!C23:C24,2,TRUE) -> 53 | E315: =Sheet3!R[2]C[11] -> 5193700 | F315: 75 | G315: 0,1,7,120000 | H315: ="0,1,8,"&RC[24] -> 0,1,8,122000 | I315: ="0,1,4,"&RC[18] -> 0,1,4,270000 | U315: 0,1,4,9000 | X315: 102 | Y315: =MID(RC[-4],7,99)*1 -> 9000 | AA315: 270000 | AE315: 3600 | AF315: 122000
B316: =RC[5]&R1C6&RC[6]&R1C6&RC[7]&R1C6 -> 0,1,7,122000;0,1,8,124000;0,1,4,275000; | D316: =VLOOKUP(ROUND(RC[1],-2),Sheet3!C23:C24,2,TRUE) -> 53 | E316: =Sheet3!R[2]C[11] -> 5315700 | F316: 75 | G316: 0,1,7,122000 | H316: ="0,1,8,"&RC[24] -> 0,1,8,124000 | I316: ="0,1,4,"&RC[18] -> 0,1,4,275000 | U316: 0,1,4,9000 | X316: 103 | Y316: =MID(RC[-4],7,99)*1 -> 9000 | AA316: 275000 | AE316: 3600 | AF316: 124000
B317: =RC[5]&R1C6&RC[6]&R1C6&RC[7]&R1C6 -> 0,1,7,124000;0,1,8,126000;0,1,4,280000; | D317: =VLOOKUP(ROUND(RC[1],-2),Sheet3!C23:C24,2,TRUE) -> 53 | E317: =Sheet3!R[2]C[11] -> 5439700 | F317: 75 | G317: 0,1,7,124000 | H317: ="0,1,8,"&RC[24] -> 0,1,8,126000 | I317: ="0,1,4,"&RC[18] -> 0,1,4,280000 | U317: 0,1,4,9000 | X317: 104 | Y317: =MID(RC[-4],7,99)*1 -> 9000 | AA317: 280000 | AE317: 3600 | AF317: 126000
B318: =RC[5]&R1C6&RC[6]&R1C6&RC[7]&R1C6 -> 0,1,7,387000;0,1,8,128000;0,1,4,285000; | D318: =VLOOKUP(ROUND(RC[1],-2),Sheet3!C23:C24,2,TRUE) -> 54 | E318: =Sheet3!R[2]C[11] -> 5826700 | F318: 75 | G318: 0,1,7,387000 | H318: ="0,1,8,"&RC[24] -> 0,1,8,128000 | I318: ="0,1,4,"&RC[18] -> 0,1,4,285000 | U318: 0,1,4,9000 | X318: 105 | Y318: =MID(RC[-4],7,99)*1 -> 9000 | AA318: 285000 | AE318: 3600 | AF318: 128000
B319: =RC[5]&R1C6&RC[6]&R1C6&RC[7]&R1C6 -> 0,1,7,128000;0,1,8,130000;0,1,4,290000; | D319: =VLOOKUP(ROUND(RC[1],-2),Sheet3!C23:C24,2,TRUE) -> 54 | E319: =Sheet3!R[2]C[11] -> 5954700 | F319: 75 | G319: 0,1,7,128000 | H319: ="0,1,8,"&RC[24] -> 0,1,8,130000 | I319: ="0,1,4,"&RC[18] -> 0,1,4,290000 | U319: 0,1,4,9000 | X319: 106 | Y319: =MID(RC[-4],7,99)*1 -> 9000 | AA319: 290000 | AE319: 3600 | AF319: 130000
B320: =RC[5]&R1C6&RC[6]&R1C6&RC[7]&R1C6 -> 0,1,7,130000;0,1,8,132000;0,1,4,295000; | D320: =VLOOKUP(ROUND(RC[1],-2),Sheet3!C23:C24,2,TRUE) -> 54 | E320: =Sheet3!R[2]C[11] -> 6084700 | F320: 75 | G320: 0,1,7,130000 | H320: ="0,1,8,"&RC[24] -> 0,1,8,132000 | I320: ="0,1,4,"&RC[18] -> 0,1,4,295000 | U320: 0,1,4,9000 | X320: 107 | Y320: =MID(RC[-4],7,99)*1 -> 9000 | AA320: 295000 | AE320: 3600 | AF320: 132000
B321: =RC[5]&R1C6&RC[6]&R1C6&RC[7]&R1C6 -> 0,1,7,132000;0,1,8,134000;0,1,4,300000; | D321: =VLOOKUP(ROUND(RC[1],-2),Sheet3!C23:C24,2,TRUE) -> 54 | E321: =Sheet3!R[2]C[11] -> 6216700 | F321: 75 | G321: 0,1,7,132000 | H321: ="0,1,8,"&RC[24] -> 0,1,8,134000 | I321: ="0,1,4,"&RC[18] -> 0,1,4,300000 | U321: 0,1,4,9000 | X321: 108 | Y321: =MID(RC[-4],7,99)*1 -> 9000 | AA321: 300000 | AE321: 3600 | AF321: 134000
B322: =RC[5]&R1C6&RC[6]&R1C6&RC[7]&R1C6 -> 0,1,7,134000;0,1,8,136000;0,1,4,305000; | D322: =VLOOKUP(ROUND(RC[1],-2),Sheet3!C23:C24,2,TRUE) -> 55 | E322: =Sheet3!R[2]C[11] -> 6350700 | F322: 75 | G322: 0,1,7,134000 | H322: ="0,1,8,"&RC[24] -> 0,1,8,136000 | I322: ="0,1,4,"&RC[18] -> 0,1,4,305000 | U322: 0,1,4,9000 | X322: 109 | Y322: =MID(RC[-4],7,99)*1 -> 9000 | AA322: 305000 | AE322: 3600 | AF322: 136000
B323: =RC[5]&R1C6&RC[6]&R1C6&RC[7]&R1C6 -> 0,1,7,419000;0,1,8,138000;0,1,4,310000; | D323: =VLOOKUP(ROUND(RC[1],-2),Sheet3!C23:C24,2,TRUE) -> 55 | E323: =Sheet3!R[2]C[11] -> 6769700 | F323: 75 | G323: 0,1,7,419000 | H323: ="0,1,8,"&RC[24] -> 0,1,8,138000 | I323: ="0,1,4,"&RC[18] -> 0,1,4,310000 | U323: 0,1,4,9000 | X323: 110 | Y323: =MID(RC[-4],7,99)*1 -> 9000 | AA323: 310000 | AE323: 3600 | AF323: 138000
B324: =RC[5]&R1C6&RC[6]&R1C6&RC[7]&R1C6 -> 0,1,7,138000;0,1,8,140000;0,1,4,315000; | D324: =VLOOKUP(ROUND(RC[1],-2),Sheet3!C23:C24,2,TRUE) -> 55 | E324: =Sheet3!R[2]C[11] -> 6907700 | F324: 75 | G324: 0,1,7,138000 | H324: ="0,1,8,"&RC[24] -> 0,1,8,140000 | I324: ="0,1,4,"&RC[18] -> 0,1,4,315000 | U324: 0,1,4,1120000 | X324: 111 | Y324: =MID(RC[-4],7,99)*1 -> 1120000 | AA324: 315000 | AE324: 388000 | AF324: 140000
B325: =RC[5]&R1C6&RC[6]&R1C6&RC[7]&R1C6 -> 0,1,7,140000;0,1,8,142000;0,1,4,320000; | D325: =VLOOKUP(ROUND(RC[1],-2),Sheet3!C23:C24,2,TRUE) -> 55 | E325: =Sheet3!R[2]C[11] -> 7047700 | F325: 75 | G325: 0,1,7,140000 | H325: ="0,1,8,"&RC[24] -> 0,1,8,142000 | I325: ="0,1,4,"&RC[18] -> 0,1,4,320000 | U325: 0,1,4,9000 | X325: 112 | Y325: =MID(RC[-4],7,99)*1 -> 9000 | AA325: 320000 | AE325: 3600 | AF325: 142000
B326: =RC[5]&R1C6&RC[6]&R1C6&RC[7]&R1C6 -> 0,1,7,142000;0,1,8,144000;0,1,4,325000; | D326: =VLOOKUP(ROUND(RC[1],-2),Sheet3!C23:C24,2,TRUE) -> 56 | E326: =Sheet3!R[2]C[11] -> 7189700 | F326: 80 | G326: 0,1,7,142000 | H326: ="0,1,8,"&RC[24] -> 0,1,8,144000 | I326: ="0,1,4,"&RC[18] -> 0,1,4,325000 | U326: 0,1,4,10800 | X326: 113 | Y326: =MID(RC[-4],7,99)*1 -> 10800 | AA326: 325000 | AE326: 4500 | AF326: 144000
B327: =RC[5]&R1C6&RC[6]&R1C6&RC[7]&R1C6 -> 0,1,7,144000;0,1,8,146000;0,1,4,330000; | D327: =VLOOKUP(ROUND(RC[1],-2),Sheet3!C23:C24,2,TRUE) -> 56 | E327: =Sheet3!R[2]C[11] -> 7333700 | F327: 80 | G327: 0,1,7,144000 | H327: ="0,1,8,"&RC[24] -> 0,1,8,146000 | I327: ="0,1,4,"&RC[18] -> 0,1,4,330000 | U327: 0,1,4,10800 | X327: 114 | Y327: =MID(RC[-4],7,99)*1 -> 10800 | AA327: 330000 | AE327: 4500 | AF327: 146000
B328: =RC[5]&R1C6&RC[6]&R1C6&RC[7]&R1C6 -> 0,1,7,450000;0,1,8,148000;0,1,4,335000; | D328: =VLOOKUP(ROUND(RC[1],-2),Sheet3!C23:C24,2,TRUE) -> 56 | E328: =Sheet3!R[2]C[11] -> 7783700 | F328: 80 | G328: 0,1,7,450000 | H328: ="0,1,8,"&RC[24] -> 0,1,8,148000 | I328: ="0,1,4,"&RC[18] -> 0,1,4,335000 | U328: 0,1,4,10800 | X328: 115 | Y328: =MID(RC[-4],7,99)*1 -> 10800 | AA328: 335000 | AE328: 4500 | AF328: 148000
B329: =RC[5]&R1C6&RC[6]&R1C6&RC[7]&R1C6 -> 0,1,7,148000;0,1,8,150000;0,1,4,340000; | D329: =VLOOKUP(ROUND(RC[1],-2),Sheet3!C23:C24,2,TRUE) -> 56 | E329: =Sheet3!R[2]C[11] -> 7931700 | F329: 80 | G329: 0,1,7,148000 | H329: ="0,1,8,"&RC[24] -> 0,1,8,150000 | I329: ="0,1,4,"&RC[18] -> 0,1,4,340000 | U329: 0,1,4,10800 | X329: 116 | Y329: =MID(RC[-4],7,99)*1 -> 10800 | AA329: 340000 | AE329: 4500 | AF329: 150000
B330: =RC[5]&R1C6&RC[6]&R1C6&RC[7]&R1C6 -> 0,1,7,150000;0,1,8,152000;0,1,4,345000; | D330: =VLOOKUP(ROUND(RC[1],-2),Sheet3!C23:C24,2,TRUE) -> 56 | E330: =Sheet3!R[2]C[11] -> 8081700 | F330: 80 | G330: 0,1,7,150000 | H330: ="0,1,8,"&RC[24] -> 0,1,8,152000 | I330: ="0,1,4,"&RC[18] -> 0,1,4,345000 | U330: 0,1,4,10800 | X330: 117 | Y330: =MID(RC[-4],7,99)*1 -> 10800 | AA330: 345000 | AE330: 4500 | AF330: 152000
B331: =RC[5]&R1C6&RC[6]&R1C6&RC[7]&R1C6 -> 0,1,7,152000;0,1,8,154000;0,1,4,350000; | D331: =VLOOKUP(ROUND(RC[1],-2),Sheet3!C23:C24,2,TRUE) -> 57 | E331: =Sheet3!R[2]C[11] -> 8233700 | F331: 80 | G331: 0,1,7,152000 | H331: ="0,1,8,"&RC[24] -> 0,1,8,154000 | I331: ="0,1,4,"&RC[18] -> 0,1,4,350000 | U331: 0,1,4,1120000 | X331: 118 | Y331: =MID(RC[-4],7,99)*1 -> 1120000 | AA331: 350000 | AE331: 388000 | AF331: 154000
B332: =RC[5]&R1C6&RC[6]&R1C6&RC[7]&R1C6 -> 0,1,7,154000;0,1,8,156000;0,1,4,355000; | D332: =VLOOKUP(ROUND(RC[1],-2),Sheet3!C23:C24,2,TRUE) -> 57 | E332: =Sheet3!R[2]C[11] -> 8387700 | F332: 80 | G332: 0,1,7,154000 | H332: ="0,1,8,"&RC[24] -> 0,1,8,156000 | I332: ="0,1,4,"&RC[18] -> 0,1,4,355000 | U332: 0,1,4,10800 | X332: 119 | Y332: =MID(RC[-4],7,99)*1 -> 10800 | AA332: 355000 | AE332: 4500 | AF332: 156000
B333: =RC[5]&R1C6&RC[6]&R1C6&RC[7]&R1C6 -> 0,1,7,482000;0,1,8,158000;0,1,4,360000; | D333: =VLOOKUP(ROUND(RC[1],-2),Sheet3!C23:C24,2,TRUE) -> 57 | E333: =Sheet3!R[2]C[11] -> 8869700 | F333: 80 | G333: 0,1,7,482000 | H333: ="0,1,8,"&RC[24] -> 0,1,8,158000 | I333: ="0,1,4,"&RC[18] -> 0,1,4,360000 | U333: 0,1,4,10800 | X333: 120 | Y333: =MID(RC[-4],7,99)*1 -> 10800 | AA333: 360000 | AE333: 4500 | AF333: 158000
B334: =RC[5]&R1C6&RC[6]&R1C6&RC[7]&R1C6 -> 0,1,7,158000;0,1,8,160000;0,1,4,365000; | D334: =VLOOKUP(ROUND(RC[1],-2),Sheet3!C23:C24,2,TRUE) -> 57 | E334: =Sheet3!R[2]C[11] -> 9027700 | F334: 80 | G334: 0,1,7,158000 | H334: ="0,1,8,"&RC[24] -> 0,1,8,160000 | I334: ="0,1,4,"&RC[18] -> 0,1,4,365000 | U334: 0,1,4,1120000 | X334: 121 | Y334: =MID(RC[-4],7,99)*1 -> 1120000 | AA334: 365000 | AE334: 388000 | AF334: 160000
B335: =RC[5]&R1C6&RC[6]&R1C6&RC[7]&R1C6 -> 0,1,7,160000;0,1,8,162000;0,1,4,370000; | D335: =VLOOKUP(ROUND(RC[1],-2),Sheet3!C23:C24,2,TRUE) -> 58 | E335: =Sheet3!R[2]C[11] -> 9187700 | F335: 80 | G335: 0,1,7,160000 | H335: ="0,1,8,"&RC[24] -> 0,1,8,162000 | I335: ="0,1,4,"&RC[18] -> 0,1,4,370000 | U335: 0,1,4,10800 | X335: 122 | Y335: =MID(RC[-4],7,99)*1 -> 10800 | AA335: 370000 | AE335: 4500 | AF335: 162000
B336: =RC[5]&R1C6&RC[6]&R1C6&RC[7]&R1C6 -> 0,1,7,162000;0,1,8,164000;0,1,4,375000; | D336: =VLOOKUP(ROUND(RC[1],-2),Sheet3!C23:C24,2,TRUE) -> 58 | E336: =Sheet3!R[2]C[11] -> 9349700 | F336: 85 | G336: 0,1,7,162000 | H336: ="0,1,8,"&RC[24] -> 0,1,8,164000 | I336: ="0,1,4,"&RC[18] -> 0,1,4,375000 | U336: 0,1,4,13500 | X336: 123 | Y336: =MID(RC[-4],7,99)*1 -> 13500 | AA336: 375000 | AE336: 5500 | AF336: 164000
B337: =RC[5]&R1C6&RC[6]&R1C6&RC[7]&R1C6 -> 0,1,7,164000;0,1,8,166000;0,1,4,380000; | D337: =VLOOKUP(ROUND(RC[1],-2),Sheet3!C23:C24,2,TRUE) -> 58 | E337: =Sheet3!R[2]C[11] -> 9513700 | F337: 85 | G337: 0,1,7,164000 | H337: ="0,1,8,"&RC[24] -> 0,1,8,166000 | I337: ="0,1,4,"&RC[18] -> 0,1,4,380000 | U337: 0,1,4,13500 | X337: 124 | Y337: =MID(RC[-4],7,99)*1 -> 13500 | AA337: 380000 | AE337: 5500 | AF337: 166000
B338: =RC[5]&R1C6&RC[6]&R1C6&RC[7]&R1C6 -> 0,1,7,512000;0,1,8,168000;0,1,4,385000; | D338: =VLOOKUP(ROUND(RC[1],-2),Sheet3!C23:C24,2,TRUE) -> 58 | E338: =Sheet3!R[2]C[11] -> 10025700 | F338: 85 | G338: 0,1,7,512000 | H338: ="0,1,8,"&RC[24] -> 0,1,8,168000 | I338: ="0,1,4,"&RC[18] -> 0,1,4,385000 | U338: 0,1,4,13500 | X338: 125 | Y338: =MID(RC[-4],7,99)*1 -> 13500 | AA338: 385000 | AE338: 5500 | AF338: 168000
B339: =RC[5]&R1C6&RC[6]&R1C6&RC[7]&R1C6 -> 0,1,7,167000;0,1,8,170000;0,1,4,390000; | D339: =VLOOKUP(ROUND(RC[1],-2),Sheet3!C23:C24,2,TRUE) -> 58 | E339: =Sheet3!R[2]C[11] -> 10192700 | F339: 85 | G339: 0,1,7,167000 | H339: ="0,1,8,"&RC[24] -> 0,1,8,170000 | I339: ="0,1,4,"&RC[18] -> 0,1,4,390000 | U339: 0,1,4,13500 | X339: 126 | Y339: =MID(RC[-4],7,99)*1 -> 13500 | AA339: 390000 | AE339: 5500 | AF339: 170000
B340: =RC[5]&R1C6&RC[6]&R1C6&RC[7]&R1C6 -> 0,1,7,169000;0,1,8,172000;0,1,4,395000; | D340: =VLOOKUP(ROUND(RC[1],-2),Sheet3!C23:C24,2,TRUE) -> 59 | E340: =Sheet3!R[2]C[11] -> 10361700 | F340: 85 | G340: 0,1,7,169000 | H340: ="0,1,8,"&RC[24] -> 0,1,8,172000 | I340: ="0,1,4,"&RC[18] -> 0,1,4,395000 | U340: 0,1,4,13500 | X340: 127 | Y340: =MID(RC[-4],7,99)*1 -> 13500 | AA340: 395000 | AE340: 5500 | AF340: 172000
B341: =RC[5]&R1C6&RC[6]&R1C6&RC[7]&R1C6 -> 0,1,7,171000;0,1,8,174000;0,1,4,400000; | D341: =VLOOKUP(ROUND(RC[1],-2),Sheet3!C23:C24,2,TRUE) -> 59 | E341: =Sheet3!R[2]C[11] -> 10532700 | F341: 85 | G341: 0,1,7,171000 | H341: ="0,1,8,"&RC[24] -> 0,1,8,174000 | I341: ="0,1,4,"&RC[18] -> 0,1,4,400000 | U341: 0,1,4,13500 | X341: 128 | Y341: =MID(RC[-4],7,99)*1 -> 13500 | AA341: 400000 | AE341: 5500 | AF341: 174000
B342: =RC[5]&R1C6&RC[6]&R1C6&RC[7]&R1C6 -> 0,1,7,173000;0,1,8,176000;0,1,4,405000; | D342: =VLOOKUP(ROUND(RC[1],-2),Sheet3!C23:C24,2,TRUE) -> 59 | E342: =Sheet3!R[2]C[11] -> 10705700 | F342: 85 | G342: 0,1,7,173000 | H342: ="0,1,8,"&RC[24] -> 0,1,8,176000 | I342: ="0,1,4,"&RC[18] -> 0,1,4,405000 | U342: 0,1,4,1200000 | X342: 129 | Y342: =MID(RC[-4],7,99)*1 -> 1200000 | AA342: 405000 | AE342: 620000 | AF342: 176000
B343: =RC[5]&R1C6&RC[6]&R1C6&RC[7]&R1C6 -> 0,1,7,541000;0,1,8,178000;0,1,4,410000; | D343: =VLOOKUP(ROUND(RC[1],-2),Sheet3!C23:C24,2,TRUE) -> 59 | E343: =Sheet3!R[2]C[11] -> 11246700 | F343: 85 | G343: 0,1,7,541000 | H343: ="0,1,8,"&RC[24] -> 0,1,8,178000 | I343: ="0,1,4,"&RC[18] -> 0,1,4,410000 | U343: 0,1,4,13500 | X343: 130 | Y343: =MID(RC[-4],7,99)*1 -> 13500 | AA343: 410000 | AE343: 5500 | AF343: 178000
B344: =RC[5]&R1C6&RC[6]&R1C6&RC[7]&R1C6 -> 0,1,7,177000;0,1,8,180000;0,1,4,415000; | D344: =VLOOKUP(ROUND(RC[1],-2),Sheet3!C23:C24,2,TRUE) -> 59 | E344: =Sheet3!R[2]C[11] -> 11423700 | F344: 85 | G344: 0,1,7,177000 | H344: ="0,1,8,"&RC[24] -> 0,1,8,180000 | I344: ="0,1,4,"&RC[18] -> 0,1,4,415000 | U344: 0,1,4,13500 | X344: 131 | Y344: =MID(RC[-4],7,99)*1 -> 13500 | AA344: 415000 | AE344: 5500 | AF344: 180000
B345: =RC[5]&R1C6&RC[6]&R1C6&RC[7]&R1C6 -> 0,1,7,179000;0,1,8,182000;0,1,4,420000; | D345: =VLOOKUP(ROUND(RC[1],-2),Sheet3!C23:C24,2,TRUE) -> 60 | E345: =Sheet3!R[2]C[11] -> 11602700 | F345: 85 | G345: 0,1,7,179000 | H345: ="0,1,8,"&RC[24] -> 0,1,8,182000 | I345: ="0,1,4,"&RC[18] -> 0,1,4,420000 | U345: 0,1,4,13500 | X345: 132 | Y345: =MID(RC[-4],7,99)*1 -> 13500 | AA345: 420000 | AE345: 5500 | AF345: 182000
B346: =RC[5]&R1C6&RC[6]&R1C6&RC[7]&R1C6 -> 0,1,7,181000;0,1,8,184000;0,1,4,425000; | D346: =VLOOKUP(ROUND(RC[1],-2),Sheet3!C23:C24,2,TRUE) -> 60 | E346: =Sheet3!R[2]C[11] -> 11783700 | F346: 85 | G346: 0,1,7,181000 | H346: ="0,1,8,"&RC[24] -> 0,1,8,184000 | I346: ="0,1,4,"&RC[18] -> 0,1,4,425000 | U346: 0,1,4,1200000 | X346: 133 | Y346: =MID(RC[-4],7,99)*1 -> 1200000 | AA346: 425000 | AE346: 650000 | AF346: 184000
B347: =RC[5]&R1C6&RC[6]&R1C6&RC[7]&R1C6 -> 0,1,7,183000;0,1,8,186000;0,1,4,430000; | D347: =VLOOKUP(ROUND(RC[1],-2),Sheet3!C23:C24,2,TRUE) -> 60 | E347: =Sheet3!R[2]C[11] -> 11966700 | F347: 85 | G347: 0,1,7,183000 | H347: ="0,1,8,"&RC[24] -> 0,1,8,186000 | I347: ="0,1,4,"&RC[18] -> 0,1,4,430000 | U347: 0,1,4,13500 | X347: 134 | Y347: =MID(RC[-4],7,99)*1 -> 13500 | AA347: 430000 | AE347: 5500 | AF347: 186000
B348: =RC[5]&R1C6&RC[6]&R1C6&RC[7]&R1C6 -> 0,1,7,573000;0,1,8,188000;0,1,4,435000; | D348: =VLOOKUP(ROUND(RC[1],-2),Sheet3!C23:C24,2,TRUE) -> 60 | E348: =Sheet3!R[2]C[11] -> 12539700 | F348: 90 | G348: 0,1,7,573000 | H348: ="0,1,8,"&RC[24] -> 0,1,8,188000 | I348: ="0,1,4,"&RC[18] -> 0,1,4,435000 | U348: 0,1,4,20000 | X348: 135 | Y348: =MID(RC[-4],7,99)*1 -> 20000 | AA348: 435000 | AE348: 10000 | AF348: 188000
B349: =RC[5]&R1C6&RC[6]&R1C6&RC[7]&R1C6 -> 0,1,7,187000;0,1,8,190000;0,1,4,440000; | D349: =VLOOKUP(ROUND(RC[1],-2),Sheet3!C23:C24,2,TRUE) -> 60 | E349: =Sheet3!R[2]C[11] -> 12726700 | F349: 90 | G349: 0,1,7,187000 | H349: ="0,1,8,"&RC[24] -> 0,1,8,190000 | I349: ="0,1,4,"&RC[18] -> 0,1,4,440000 | U349: 0,1,4,20000 | X349: 136 | Y349: =MID(RC[-4],7,99)*1 -> 20000 | AA349: 440000 | AE349: 10000 | AF349: 190000
B350: =RC[5]&R1C6&RC[6]&R1C6&RC[7]&R1C6 -> 0,1,7,189000;0,1,8,192000;0,1,4,445000; | D350: =VLOOKUP(ROUND(RC[1],-2),Sheet3!C23:C24,2,TRUE) -> 61 | E350: =Sheet3!R[2]C[11] -> 12915700 | F350: 90 | G350: 0,1,7,189000 | H350: ="0,1,8,"&RC[24] -> 0,1,8,192000 | I350: ="0,1,4,"&RC[18] -> 0,1,4,445000 | U350: 0,1,4,20000 | X350: 137 | Y350: =MID(RC[-4],7,99)*1 -> 20000 | AA350: 445000 | AE350: 10000 | AF350: 192000
B351: =RC[5]&R1C6&RC[6]&R1C6&RC[7]&R1C6 -> 0,1,7,191000;0,1,8,194000;0,1,4,450000; | D351: =VLOOKUP(ROUND(RC[1],-2),Sheet3!C23:C24,2,TRUE) -> 61 | E351: =Sheet3!R[2]C[11] -> 13106700 | F351: 90 | G351: 0,1,7,191000 | H351: ="0,1,8,"&RC[24] -> 0,1,8,194000 | I351: ="0,1,4,"&RC[18] -> 0,1,4,450000 | U351: 0,1,4,20000 | X351: 138 | Y351: =MID(RC[-4],7,99)*1 -> 20000 | AA351: 450000 | AE351: 10000 | AF351: 194000
B352: =RC[5]&R1C6&RC[6]&R1C6&RC[7]&R1C6 -> 0,1,7,193000;0,1,8,196000;0,1,4,455000; | D352: =VLOOKUP(ROUND(RC[1],-2),Sheet3!C23:C24,2,TRUE) -> 61 | E352: =Sheet3!R[2]C[11] -> 13299700 | F352: 90 | G352: 0,1,7,193000 | H352: ="0,1,8,"&RC[24] -> 0,1,8,196000 | I352: ="0,1,4,"&RC[18] -> 0,1,4,455000 | U352: 0,1,4,20000 | X352: 139 | Y352: =MID(RC[-4],7,99)*1 -> 20000 | AA352: 455000 | AE352: 10000 | AF352: 196000
B353: =RC[5]&R1C6&RC[6]&R1C6&RC[7]&R1C6 -> 0,1,7,604000;0,1,8,198000;0,1,4,460000; | D353: =VLOOKUP(ROUND(RC[1],-2),Sheet3!C23:C24,2,TRUE) -> 61 | E353: =Sheet3!R[2]C[11] -> 13903700 | F353: 90 | G353: 0,1,7,604000 | H353: ="0,1,8,"&RC[24] -> 0,1,8,198000 | I353: ="0,1,4,"&RC[18] -> 0,1,4,460000 | U353: 0,1,4,20000 | X353: 140 | Y353: =MID(RC[-4],7,99)*1 -> 20000 | AA353: 460000 | AE353: 10000 | AF353: 198000
B354: =RC[5]&R1C6&RC[6]&R1C6&RC[7]&R1C6 -> 0,1,7,197000;0,1,8,200000;0,1,4,465000; | D354: =VLOOKUP(ROUND(RC[1],-2),Sheet3!C23:C24,2,TRUE) -> 61 | E354: =Sheet3!R[2]C[11] -> 14100700 | F354: 90 | G354: 0,1,7,197000 | H354: ="0,1,8,"&RC[24] -> 0,1,8,200000 | I354: ="0,1,4,"&RC[18] -> 0,1,4,465000 | U354: 0,1,4,20000 | X354: 141 | Y354: =MID(RC[-4],7,99)*1 -> 20000 | AA354: 465000 | AE354: 10000 | AF354: 200000
B355: =RC[5]&R1C6&RC[6]&R1C6&RC[7]&R1C6 -> 0,1,7,199000;0,1,8,202000;0,1,4,470000; | D355: =VLOOKUP(ROUND(RC[1],-2),Sheet3!C23:C24,2,TRUE) -> 61 | E355: =Sheet3!R[2]C[11] -> 14299700 | F355: 90 | G355: 0,1,7,199000 | H355: ="0,1,8,"&RC[24] -> 0,1,8,202000 | I355: ="0,1,4,"&RC[18] -> 0,1,4,470000 | U355: 0,1,4,2700000 | X355: 142 | Y355: =MID(RC[-4],7,99)*1 -> 2700000 | AA355: 470000 | AE355: 750000 | AF355: 202000
B356: =RC[5]&R1C6&RC[6]&R1C6&RC[7]&R1C6 -> 0,1,7,201000;0,1,8,204000;0,1,4,475000; | D356: =VLOOKUP(ROUND(RC[1],-2),Sheet3!C23:C24,2,TRUE) -> 62 | E356: =Sheet3!R[2]C[11] -> 14500700 | F356: 90 | G356: 0,1,7,201000 | H356: ="0,1,8,"&RC[24] -> 0,1,8,204000 | I356: ="0,1,4,"&RC[18] -> 0,1,4,475000 | U356: 0,1,4,20000 | X356: 143 | Y356: =MID(RC[-4],7,99)*1 -> 20000 | AA356: 475000 | AE356: 10000 | AF356: 204000
B357: =RC[5]&R1C6&RC[6]&R1C6&RC[7]&R1C6 -> 0,1,7,203000;0,1,8,206000;0,1,4,480000; | D357: =VLOOKUP(ROUND(RC[1],-2),Sheet3!C23:C24,2,TRUE) -> 62 | E357: =Sheet3!R[2]C[11] -> 14703700 | F357: 90 | G357: 0,1,7,203000 | H357: ="0,1,8,"&RC[24] -> 0,1,8,206000 | I357: ="0,1,4,"&RC[18] -> 0,1,4,480000 | U357: 0,1,4,20000 | X357: 144 | Y357: =MID(RC[-4],7,99)*1 -> 20000 | AA357: 480000 | AE357: 10000 | AF357: 206000
B358: =RC[5]&R1C6&RC[6]&R1C6&RC[7]&R1C6 -> 0,1,7,636000;0,1,8,208000;0,1,4,485000; | D358: =VLOOKUP(ROUND(RC[1],-2),Sheet3!C23:C24,2,TRUE) -> 62 | E358: =Sheet3!R[2]C[11] -> 15339700 | F358: 90 | G358: 0,1,7,636000 | H358: ="0,1,8,"&RC[24] -> 0,1,8,208000 | I358: ="0,1,4,"&RC[18] -> 0,1,4,485000 | U358: 0,1,4,2700000 | X358: 145 | Y358: =MID(RC[-4],7,99)*1 -> 2700000 | AA358: 485000 | AE358: 750000 | AF358: 208000
B359: =RC[5]&R1C6&RC[6]&R1C6&RC[7]&R1C6 -> 0,1,7,207000;0,1,8,210000;0,1,4,490000; | D359: =VLOOKUP(ROUND(RC[1],-2),Sheet3!C23:C24,2,TRUE) -> 62 | E359: =Sheet3!R[2]C[11] -> 15546700 | F359: 90 | G359: 0,1,7,207000 | H359: ="0,1,8,"&RC[24] -> 0,1,8,210000 | I359: ="0,1,4,"&RC[18] -> 0,1,4,490000 | U359: 0,1,4,20000 | X359: 146 | Y359: =MID(RC[-4],7,99)*1 -> 20000 | AA359: 490000 | AE359: 10000 | AF359: 210000
B360: =RC[5]&R1C6&RC[6]&R1C6&RC[7]&R1C6 -> 0,1,7,209000;0,1,8,212000;0,1,4,495000; | D360: =VLOOKUP(ROUND(RC[1],-2),Sheet3!C23:C24,2,TRUE) -> 62 | E360: =Sheet3!R[2]C[11] -> 15755700 | F360: 95 | G360: 0,1,7,209000 | H360: ="0,1,8,"&RC[24] -> 0,1,8,212000 | I360: ="0,1,4,"&RC[18] -> 0,1,4,495000 | U360: 0,1,4,30000 | X360: 147 | Y360: =MID(RC[-4],7,99)*1 -> 30000 | AA360: 495000 | AE360: 15000 | AF360: 212000
B361: =RC[5]&R1C6&RC[6]&R1C6&RC[7]&R1C6 -> 0,1,7,211000;0,1,8,214000;0,1,4,500000; | D361: =VLOOKUP(ROUND(RC[1],-2),Sheet3!C23:C24,2,TRUE) -> 63 | E361: =Sheet3!R[2]C[11] -> 15966700 | F361: 95 | G361: 0,1,7,211000 | H361: ="0,1,8,"&RC[24] -> 0,1,8,214000 | I361: ="0,1,4,"&RC[18] -> 0,1,4,500000 | U361: 0,1,4,30000 | X361: 148 | Y361: =MID(RC[-4],7,99)*1 -> 30000 | AA361: 500000 | AE361: 15000 | AF361: 214000
B362: =RC[5]&R1C6&RC[6]&R1C6&RC[7]&R1C6 -> 0,1,7,213000;0,1,8,216000;0,1,4,505000; | D362: =VLOOKUP(ROUND(RC[1],-2),Sheet3!C23:C24,2,TRUE) -> 63 | E362: =Sheet3!R[2]C[11] -> 16179700 | F362: 95 | G362: 0,1,7,213000 | H362: ="0,1,8,"&RC[24] -> 0,1,8,216000 | I362: ="0,1,4,"&RC[18] -> 0,1,4,505000 | U362: 0,1,4,2750000 | X362: 149 | Y362: =MID(RC[-4],7,99)*1 -> 2750000 | AA362: 505000 | AE362: 800000 | AF362: 216000
B363: =RC[5]&R1C6&RC[6]&R1C6&RC[7]&R1C6 -> 0,1,7,667000;0,1,8,218000;0,1,4,510000; | D363: =VLOOKUP(ROUND(RC[1],-2),Sheet3!C23:C24,2,TRUE) -> 63 | E363: =Sheet3!R[2]C[11] -> 16846700 | F363: 95 | G363: 0,1,7,667000 | H363: ="0,1,8,"&RC[24] -> 0,1,8,218000 | I363: ="0,1,4,"&RC[18] -> 0,1,4,510000 | U363: 0,1,4,30000 | X363: 150 | Y363: =MID(RC[-4],7,99)*1 -> 30000 | AA363: 510000 | AE363: 15000 | AF363: 218000
B364: =RC[5]&R1C6&RC[6]&R1C6&RC[7]&R1C6 -> 0,1,7,217000;0,1,8,220000;0,1,4,515000; | D364: =VLOOKUP(ROUND(RC[1],-2),Sheet3!C23:C24,2,TRUE) -> 63 | E364: =Sheet3!R[2]C[11] -> 17063700 | F364: 95 | G364: 0,1,7,217000 | H364: ="0,1,8,"&RC[24] -> 0,1,8,220000 | I364: ="0,1,4,"&RC[18] -> 0,1,4,515000 | U364: 0,1,4,30000 | X364: 151 | Y364: =MID(RC[-4],7,99)*1 -> 30000 | AA364: 515000 | AE364: 15000 | AF364: 220000
B365: =RC[5]&R1C6&RC[6]&R1C6&RC[7]&R1C6 -> 0,1,7,219000;0,1,8,222000;0,1,4,520000; | D365: =VLOOKUP(ROUND(RC[1],-2),Sheet3!C23:C24,2,TRUE) -> 63 | E365: =Sheet3!R[2]C[11] -> 17282700 | F365: 95 | G365: 0,1,7,219000 | H365: ="0,1,8,"&RC[24] -> 0,1,8,222000 | I365: ="0,1,4,"&RC[18] -> 0,1,4,520000 | U365: 0,1,4,2800000 | X365: 152 | Y365: =MID(RC[-4],7,99)*1 -> 2800000 | AA365: 520000 | AE365: 850000 | AF365: 222000
B366: =RC[5]&R1C6&RC[6]&R1C6&RC[7]&R1C6 -> 0,1,7,221000;0,1,8,224000;0,1,4,525000; | D366: =VLOOKUP(ROUND(RC[1],-2),Sheet3!C23:C24,2,TRUE) -> 63 | E366: =Sheet3!R[2]C[11] -> 17503700 | F366: 95 | G366: 0,1,7,221000 | H366: ="0,1,8,"&RC[24] -> 0,1,8,224000 | I366: ="0,1,4,"&RC[18] -> 0,1,4,525000 | U366: 0,1,4,30000 | X366: 153 | Y366: =MID(RC[-4],7,99)*1 -> 30000 | AA366: 525000 | AE366: 15000 | AF366: 224000
B367: =RC[5]&R1C6&RC[6]&R1C6&RC[7]&R1C6 -> 0,1,7,223000;0,1,8,226000;0,1,4,530000; | D367: =VLOOKUP(ROUND(RC[1],-2),Sheet3!C23:C24,2,TRUE) -> 64 | E367: =Sheet3!R[2]C[11] -> 17726700 | F367: 95 | G367: 0,1,7,223000 | H367: ="0,1,8,"&RC[24] -> 0,1,8,226000 | I367: ="0,1,4,"&RC[18] -> 0,1,4,530000 | U367: 0,1,4,2850000 | X367: 154 | Y367: =MID(RC[-4],7,99)*1 -> 2850000 | AA367: 530000 | AE367: 900000 | AF367: 226000
B368: =RC[5]&R1C6&RC[6]&R1C6&RC[7]&R1C6 -> 0,1,7,699000;0,1,8,228000;0,1,4,535000; | D368: =VLOOKUP(ROUND(RC[1],-2),Sheet3!C23:C24,2,TRUE) -> 64 | E368: =Sheet3!R[2]C[11] -> 18425700 | F368: 95 | G368: 0,1,7,699000 | H368: ="0,1,8,"&RC[24] -> 0,1,8,228000 | I368: ="0,1,4,"&RC[18] -> 0,1,4,535000 | U368: 0,1,4,30000 | X368: 155 | Y368: =MID(RC[-4],7,99)*1 -> 30000 | AA368: 535000 | AE368: 15000 | AF368: 228000
B369: =RC[5]&R1C6&RC[6]&R1C6&RC[7]&R1C6 -> 0,1,7,227000;0,1,8,230000;0,1,4,540000; | D369: =VLOOKUP(ROUND(RC[1],-2),Sheet3!C23:C24,2,TRUE) -> 64 | E369: =Sheet3!R[2]C[11] -> 18652700 | F369: 95 | G369: 0,1,7,227000 | H369: ="0,1,8,"&RC[24] -> 0,1,8,230000 | I369: ="0,1,4,"&RC[18] -> 0,1,4,540000 | U369: 0,1,4,2900000 | X369: 156 | Y369: =MID(RC[-4],7,99)*1 -> 2900000 | AA369: 540000 | AE369: 950000 | AF369: 230000
B370: =RC[5]&R1C6&RC[6]&R1C6&RC[7]&R1C6 -> 0,1,7,229000;0,1,8,232000;0,1,4,545000; | D370: =VLOOKUP(ROUND(RC[1],-2),Sheet3!C23:C24,2,TRUE) -> 64 | E370: =Sheet3!R[2]C[11] -> 18881700 | F370: 95 | G370: 0,1,7,229000 | H370: ="0,1,8,"&RC[24] -> 0,1,8,232000 | I370: ="0,1,4,"&RC[18] -> 0,1,4,545000 | U370: 0,1,4,30000 | X370: 157 | Y370: =MID(RC[-4],7,99)*1 -> 30000 | AA370: 545000 | AE370: 15000 | AF370: 232000
B371: =RC[5]&R1C6&RC[6]&R1C6&RC[7]&R1C6 -> 0,1,7,230000;0,1,8,234000;0,1,4,550000; | D371: =VLOOKUP(ROUND(RC[1],-2),Sheet3!C23:C24,2,TRUE) -> 64 | E371: =Sheet3!R[2]C[11] -> 19111700 | F371: 95 | G371: 0,1,7,230000 | H371: ="0,1,8,"&RC[24] -> 0,1,8,234000 | I371: ="0,1,4,"&RC[18] -> 0,1,4,550000 | U371: 0,1,4,3060000 | X371: 158 | Y371: =MID(RC[-4],7,99)*1 -> 3060000 | AA371: 550000 | AE371: 1000000 | AF371: 234000
B372: =RC[5]&R1C6&RC[6]&R1C6&RC[7]&R1C6 -> 0,1,7,232000;0,1,8,236000;0,1,4,555000; | D372: =VLOOKUP(ROUND(RC[1],-2),Sheet3!C23:C24,2,TRUE) -> 64 | E372: =Sheet3!R[2]C[11] -> 19343700 | F372: 95 | G372: 0,1,7,232000 | H372: ="0,1,8,"&RC[24] -> 0,1,8,236000 | I372: ="0,1,4,"&RC[18] -> 0,1,4,555000 | U372: 0,1,4,30000 | X372: 159 | Y372: =MID(RC[-4],7,99)*1 -> 30000 | AA372: 555000 | AE372: 15000 | AF372: 236000
B373: =RC[5]&R1C6&RC[6]&R1C6&RC[7]&R1C6 -> 0,1,7,728000;0,1,8,238000;0,1,4,560000; | D373: =VLOOKUP(ROUND(RC[1],-2),Sheet3!C23:C24,2,TRUE) -> 65 | E373: =Sheet3!R[2]C[11] -> 20071700 | F373: 100 | G373: 0,1,7,728000 | H373: ="0,1,8,"&RC[24] -> 0,1,8,238000 | I373: ="0,1,4,"&RC[18] -> 0,1,4,560000 | U373: 0,1,4,40000 | X373: 160 | Y373: =MID(RC[-4],7,99)*1 -> 40000 | AA373: 560000 | AE373: 20000 | AF373: 238000
B374: =RC[5]&R1C6&RC[6]&R1C6&RC[7]&R1C6 -> 0,1,7,236000;0,1,8,240000;0,1,4,565000; | D374: =VLOOKUP(ROUND(RC[1],-2),Sheet3!C23:C24,2,TRUE) -> 65 | E374: =Sheet3!R[2]C[11] -> 20307700 | F374: 100 | G374: 0,1,7,236000 | H374: ="0,1,8,"&RC[24] -> 0,1,8,240000 | I374: ="0,1,4,"&RC[18] -> 0,1,4,565000 | U374: 0,1,4,40000 | X374: 161 | Y374: =MID(RC[-4],7,99)*1 -> 40000 | AA374: 565000 | AE374: 20000 | AF374: 240000
B375: =RC[5]&R1C6&RC[6]&R1C6&RC[7]&R1C6 -> 0,1,7,238000;0,1,8,242000;0,1,4,570000; | D375: =VLOOKUP(ROUND(RC[1],-2),Sheet3!C23:C24,2,TRUE) -> 65 | E375: =Sheet3!R[2]C[11] -> 20545700 | F375: 100 | G375: 0,1,7,238000 | H375: ="0,1,8,"&RC[24] -> 0,1,8,242000 | I375: ="0,1,4,"&RC[18] -> 0,1,4,570000 | U375: 0,1,4,40000 | X375: 162 | Y375: =MID(RC[-4],7,99)*1 -> 40000 | AA375: 570000 | AE375: 20000 | AF375: 242000
B376: =RC[5]&R1C6&RC[6]&R1C6&RC[7]&R1C6 -> 0,1,7,240000;0,1,8,244000;0,1,4,575000; | D376: =VLOOKUP(ROUND(RC[1],-2),Sheet3!C23:C24,2,TRUE) -> 65 | E376: =Sheet3!R[2]C[11] -> 20785700 | F376: 100 | G376: 0,1,7,240000 | H376: ="0,1,8,"&RC[24] -> 0,1,8,244000 | I376: ="0,1,4,"&RC[18] -> 0,1,4,575000 | U376: 0,1,4,40000 | X376: 163 | Y376: =MID(RC[-4],7,99)*1 -> 40000 | AA376: 575000 | AE376: 20000 | AF376: 244000
B377: =RC[5]&R1C6&RC[6]&R1C6&RC[7]&R1C6 -> 0,1,7,242000;0,1,8,246000;0,1,4,580000; | D377: =VLOOKUP(ROUND(RC[1],-2),Sheet3!C23:C24,2,TRUE) -> 65 | E377: =Sheet3!R[2]C[11] -> 21027700 | F377: 100 | G377: 0,1,7,242000 | H377: ="0,1,8,"&RC[24] -> 0,1,8,246000 | I377: ="0,1,4,"&RC[18] -> 0,1,4,580000 | U377: 0,1,4,40000 | X377: 164 | Y377: =MID(RC[-4],7,99)*1 -> 40000 | AA377: 580000 | AE377: 20000 | AF377: 246000
B378: =RC[5]&R1C6&RC[6]&R1C6&RC[7]&R1C6 -> 0,1,7,758000;0,1,8,248000;0,1,4,585000; | D378: =VLOOKUP(ROUND(RC[1],-2),Sheet3!C23:C24,2,TRUE) -> 66 | E378: =Sheet3!R[2]C[11] -> 21785700 | F378: 100 | G378: 0,1,7,758000 | H378: ="0,1,8,"&RC[24] -> 0,1,8,248000 | I378: ="0,1,4,"&RC[18] -> 0,1,4,585000 | U378: 0,1,4,40000 | X378: 165 | Y378: =MID(RC[-4],7,99)*1 -> 40000 | AA378: 585000 | AE378: 20000 | AF378: 248000
B379: =RC[5]&R1C6&RC[6]&R1C6&RC[7]&R1C6 -> 0,1,7,246000;0,1,8,250000;0,1,4,590000; | D379: =VLOOKUP(ROUND(RC[1],-2),Sheet3!C23:C24,2,TRUE) -> 66 | E379: =Sheet3!R[2]C[11] -> 22031700 | F379: 100 | G379: 0,1,7,246000 | H379: ="0,1,8,"&RC[24] -> 0,1,8,250000 | I379: ="0,1,4,"&RC[18] -> 0,1,4,590000 | U379: 0,1,4,40000 | X379: 166 | Y379: =MID(RC[-4],7,99)*1 -> 40000 | Z379: =SUM(R214C25:R379C25) -> 33081300 | AA379: 590000 | AB379: =SUM(R214C27:R379C27) -> 35645100 | AC379: =RC[-3]-RC[-1] -> -2563800 | AE379: 20000 | AF379: 250000

Sheet: Sheet6
B3: 201001 | C3: 201001
B4: 201002 | C4: 201002
B5: 201003 | C5: 201003
B6: 201004 | C6: 201004
B7: 201005 | C7: 201005
B8: 201006 | C8: 201006
B9: 201007 | C9: 201007
B10: 201008 | C10: 201008
B11: 201009 | C11: 201009
B12: 201010 | C12: 201010
B13: 201011 | C13: 201011
B14: 201012 | C14: 201012
B15: 201000 | C15: 201013
B16: 202013 | C16: 202014
B17: 202014 | C17: 202015
B18: 202015 | C18: 202016
B19: 202016 | C19: 202017
B20: 202017 | C20: 202018
B21: 202018 | C21: 202019
B22: 202019 | C22: 202020
B23: 202020 | C23: 202021
B24: 202021 | C24: 202022
B25: 203022 | C25: 203023
B26: 203023 | C26: 203024
B27: 203024 | C27: 203025
B28: 203025 | C28: 203026
B29: 203026 | C29: 203027
B30: 203027 | C30: 203028
B31: 203028 | C31: 203029
B32: 203029 | C32: 203030
B33: 204030 | C33: 204031
B34: 204031 | C34: 204032
B35: 204032 | C35: 204033
B36: 204033 | C36: 204034
B37: 204034 | C37: 204035
B38: 204035 | C38: 204036
B39: 204036 | C39: 204037
B40: 204037 | C40: 204038
B41: 205038 | C41: 205039
B42: 205039 | C42: 205040
B43: 205040 | C43: 205041
B44: 205041 | C44: 205042
B45: 205042 | C45: 205043
B46: 205043 | C46: 205044
B47: 205044 | C47: 205045
B48: 205045 | C48: 205046
B49: 206046 | C49: 206047
B50: 206047 | C50: 206048
B51: 206048 | C51: 206049
B52: 206049 | C52: 206050
B53: 206050 | C53: 206051
B54: 206051 | C54: 206052
B55: 206052 | C55: 206053
B56: 206053 | C56: 206054
B57: 206054 | C57: 206055
B58: 206055 | C58: 206056
B59: 206056 | C59: 206057
B60: 207057 | C60: 207058
B61: 207058 | C61: 207059
B62: 207059 | C62: 207060
B63: 207060 | C63: 207061
B64: 207061 | C64: 207062
B65: 207062 | C65: 207063
B66: 207063 | C66: 207064
B67: 207064 | C67: 207065
B68: 207065 | C68: 207066
B69: 207066 | C69: 207067
B70: 207067 | C70: 207068
B71: 207068 | C71: 207069
B72: 208069 | C72: 208070
B73: 208070 | C73: 208071
B74: 208071 | C74: 208072
B75: 208072 | C75: 208073
B76: 208073 | C76: 208074
B77: 208074 | C77: 208075
B78: 208075 | C78: 208076
B79: 208076 | C79: 208077
B80: 208077 | C80: 208078
B81: 208078 | C81: 208079
B82: 208079 | C82: 208080
B83: 209080 | C83: 209081
B84: 209081 | C84: 209082
B85: 209082 | C85: 209083
B86: 209083 | C86: 209084
B87: 209084 | C87: 209085
B88: 209085 | C88: 209086
B89: 209086 | C89: 209087
B90: 209087 | C90: 209088
B91: 209088 | C91: 209089
B92: 209089 | C92: 209090
B93: 209090 | C93: 209091
B94: 209091 | C94: 209092
B95: 209092 | C95: 209093
B96: 209093 | C96: 209094
B97: 210094 | C97: 210095
B98: 210095 | C98: 210096
B99: 210096 | C99: 210097
B100: 210097 | C100: 210098
B101: 210098 | C101: 210099
B102: 210099 | C102: 210100
B103: 210100 | C103: 210101
B104: 210101 | C104: 210102
B105: 210102 | C105: 210103
B106: 210103 | C106: 210104
B107: 210104 | C107: 210105
B108: 210105 | C108: 210106
B109: 210106 | C109: 210107
B110: 210107 | C110: 210108
B111: 210108 | C111: 210109
B112: 210109 | C112: 210110
B113: 210110 | C113: 210111
B114: 210111 | C114: 210112
B115: 210112 | C115: 210113
B116: 210113 | C116: 210114
B117: 210114 | C117: 210115
B118: 210115 | C118: 210116
B119: 210116 | C119: 210117
B120: 210117 | C120: 210118
B121: 210118 | C121: 210119
B122: 210119 | C122: 210120
B123: 210120 | C123: 210121
B124: 210121 | C124: 210122
B125: 211122 | C125: 211123
B126: 211123 | C126: 211124
B127: 211124 | C127: 211125
B128: 211125 | C128: 211126
B129: 211126 | C129: 211127
B130: 211127 | C130: 211128
B131: 211128 | C131: 211129
B132: 211129 | C132: 211130
B133: 211130 | C133: 211131
B134: 211131 | C134: 211132
B135: 211132 | C135: 211133
B136: 211133 | C136: 211134
B137: 212134 | C137: 212135
B138: 212135 | C138: 212136
B139: 212136 | C139: 212137
B140: 212137 | C140: 212138
B141: 212138 | C141: 212139
B142: 212139 | C142: 212140
B143: 212140 | C143: 212141
B144: 212141 | C144: 212142
B145: 212142 | C145: 212143
B146: 212143 | C146: 212144
B147: 212144 | C147: 212145
B148: 212145 | C148: 212146
B149: 213146 | C149: 213147
B150: 213147 | C150: 213148
B151: 213148 | C151: 213149
B152: 213149 | C152: 213150
B153: 213150 | C153: 213151
B154: 213151 | C154: 213152
B155: 213152 | C155: 213153
B156: 213153 | C156: 213154
B157: 213154 | C157: 213155
B158: 213155 | C158: 213156
B159: 213156 | C159: 213157
B160: 213157 | C160: 213158
B161: 213158 | C161: 213159
B162: 214159 | C162: 214160
B163: 214160 | C163: 214161
B164: 214161 | C164: 214162
B165: 214162 | C165: 214163
B166: 214163 | C166: 214164
B167: 214164 | C167: 214165
B168: 214165 | C168: 214166
B169: 214166 | C169: 214167