Sheet: ctAchievementsConf
B1: 1. 累计登录天数 2. 角色等级 3. 战力 4. 宠物最高战力 5. 仙侣数量 6. 总人气 7. 全身所有宝石总等级 8. 启灵总等级 9. 修炼总等级 10. 完成师门次数（已删） 11. 进行竞技次数 12. 赏金任务次数（已删） 13. 寻宝次数（已删） 14. 捉妖次数（已删） 15. 诛心魔次数 16. 妖兽突袭次数 17. 神兽大放送战斗次数(已删) 18. 神魔录总星数达到N 19. 获得个人空间宝箱N个 20. 家园赠送鲜花给仙侣次数N次 21. 拥有N个友好度Y以上的好友 22. 帮派建设次数 23. 帮战次数 24. 萌仙轶事（已删） 25. 萌仙课堂（已删） | D1: 是否绑定,道具id,道具数量;
A2: 0 | B2: 0 | C2: 0 | D2: 1
A3: nID | B3: nType | C3: nTarget | D3: tAward
A4: i | B4: i | C4: i | D4: t{bii}
A5: 成就ID | B5: 成就类型 | C5: 目标参数 | D5: 奖励
A6: 1 | B6: 1 | C6: 1 | D6: 1,3,50000;
A7: 2 | B7: 1 | C7: 2 | D7: 1,3,100000;
A8: 3 | B8: 1 | C8: 3 | D8: 1,3,150000;
A9: 4 | B9: 1 | C9: 4 | D9: 1,3,200000;
A10: 5 | B10: 1 | C10: 5 | D10: 1,3,250000;
A11: 6 | B11: 1 | C11: 7 | D11: 1,3,250000;
A12: 7 | B12: 1 | C12: 9 | D12: 1,3,250000;
A13: 8 | B13: 1 | C13: 11 | D13: 1,3,250000;
A14: 9 | B14: 1 | C14: 13 | D14: 1,3,250000;
A15: 10 | B15: 1 | C15: 15 | D15: 1,3,250000;
A16: 11 | B16: 1 | C16: 18 | D16: 1,3,250000;
A17: 12 | B17: 1 | C17: 21 | D17: 1,3,250000;
A18: 13 | B18: 1 | C18: 24 | D18: 1,3,250000;
A19: 14 | B19: 1 | C19: 27 | D19: 1,3,250000;
A20: 15 | B20: 1 | C20: 30 | D20: 1,3,250000;
A21: 16 | B21: 1 | C21: 34 | D21: 1,3,250000;
A22: 17 | B22: 1 | C22: 38 | D22: 1,3,250000;
A23: 18 | B23: 1 | C23: 42 | D23: 1,3,250000;
A24: 19 | B24: 1 | C24: 46 | D24: 1,3,250000;
A25: 20 | B25: 1 | C25: 50 | D25: 1,3,250000;
A26: 21 | B26: 1 | C26: 55 | D26: 1,3,250000;
A27: 22 | B27: 1 | C27: 60 | D27: 1,3,400000;
A28: 23 | B28: 1 | C28: 65 | D28: 1,3,400000;
A29: 24 | B29: 1 | C29: 70 | D29: 1,3,400000;
A30: 25 | B30: 1 | C30: 75 | D30: 1,3,400000;
A31: 26 | B31: 1 | C31: 81 | D31: 1,3,400000;
A32: 27 | B32: 1 | C32: 87 | D32: 1,3,400000;
A33: 28 | B33: 1 | C33: 93 | D33: 1,3,400000;
A34: 29 | B34: 1 | C34: 99 | D34: 1,3,400000;
A35: 30 | B35: 1 | C35: 105 | D35: 1,3,400000;
A36: 31 | B36: 1 | C36: 111 | D36: 1,3,400000;
A37: 32 | B37: 1 | C37: 117 | D37: 1,3,400000;
A38: 33 | B38: 1 | C38: 124 | D38: 1,3,500000;
A39: 34 | B39: 2 | C39: 10 | D39: 1,3,50000;
A40: 35 | B40: 2 | C40: 20 | D40: 1,3,100000;
A41: 36 | B41: 2 | C41: 30 | D41: 1,3,150000;
A42: 37 | B42: 2 | C42: 40 | D42: 1,3,200000;
A43: 38 | B43: 2 | C43: 45 | D43: 1,3,250000;
A44: 39 | B44: 2 | C44: 50 | D44: 1,3,250000;
A45: 40 | B45: 2 | C45: 55 | D45: 1,3,250000;
A46: 41 | B46: 2 | C46: 60 | D46: 1,3,250000;
A47: 42 | B47: 2 | C47: 65 | D47: 1,3,250000;
A48: 43 | B48: 2 | C48: 68 | D48: 1,3,400000;
A49: 44 | B49: 2 | C49: 70 | D49: 1,3,400000;
A50: 45 | B50: 2 | C50: 72 | D50: 1,3,400000;
A51: 46 | B51: 2 | C51: 74 | D51: 1,3,400000;
A52: 47 | B52: 2 | C52: 76 | D52: 1,3,400000;
A53: 48 | B53: 2 | C53: 78 | D53: 1,3,400000;
A54: 49 | B54: 2 | C54: 80 | D54: 1,3,500000;
A55: 50 | B55: 2 | C55: 82 | D55: 1,3,500000;
A56: 51 | B56: 2 | C56: 84 | D56: 1,3,500000;
A57: 52 | B57: 2 | C57: 86 | D57: 1,3,500000;
A58: 53 | B58: 2 | C58: 88 | D58: 1,3,500000;
A59: 54 | B59: 2 | C59: 90 | D59: 1,3,600000;
A60: 55 | B60: 2 | C60: 92 | D60: 1,3,600000;
A61: 56 | B61: 2 | C61: 93 | D61: 1,3,600000;
A62: 57 | B62: 2 | C62: 94 | D62: 1,3,600000;
A63: 58 | B63: 2 | C63: 95 | D63: 1,3,750000;
A64: 59 | B64: 2 | C64: 96 | D64: 1,3,750000;
A65: 60 | B65: 2 | C65: 97 | D65: 1,3,750000;
A66: 61 | B66: 2 | C66: 98 | D66: 1,3,750000;
A67: 62 | B67: 2 | C67: 99 | D67: 1,3,750000;
A68: 63 | B68: 2 | C68: 100 | D68: 1,3,1000000;
A69: 64 | B69: 3 | C69: 250000 | D69: 1,4,30000;
A70: 65 | B70: 3 | C70: 280000 | D70: 1,4,50000;
A71: 66 | B71: 3 | C71: 300000 | D71: 1,4,80000;
A72: 67 | B72: 3 | C72: 350000 | D72: 1,4,100000;
A73: 68 | B73: 3 | C73: 400000 | D73: 1,4,120000;
A74: 69 | B74: 3 | C74: 450000 | D74: 1,4,150000;
A75: 70 | B75: 3 | C75: 500000 | D75: 1,4,200000;
A76: 71 | B76: 3 | C76: 550000 | D76: 1,4,250000;
A77: 72 | B77: 3 | C77: 600000 | D77: 1,4,300000;
A78: 73 | B78: 3 | C78: 650000 | D78: 1,4,350000;
A79: 74 | B79: 3 | C79: 700000 | D79: 1,4,400000;
A80: 75 | B80: 3 | C80: 750000 | D80: 1,4,500000;
A81: 76 | B81: 3 | C81: 800000 | D81: 1,4,600000;
A82: 77 | B82: 3 | C82: 850000 | D82: 1,4,700000;
A83: 78 | B83: 3 | C83: 900000 | D83: 1,4,800000;
A84: 79 | B84: 3 | C84: 950000 | D84: 1,4,900000;
A85: 80 | B85: 3 | C85: 1000000 | D85: 1,4,1000000;
A86: 81 | B86: 3 | C86: 1050000 | D86: 1,4,1100000;
A87: 82 | B87: 3 | C87: 1100000 | D87: 1,4,1200000;
A88: 83 | B88: 3 | C88: 1150000 | D88: 1,4,1300000;
A89: 84 | B89: 3 | C89: 1200000 | D89: 1,4,1400000;
A90: 85 | B90: 3 | C90: 1250000 | D90: 1,4,1500000;
A91: 86 | B91: 3 | C91: 1300000 | D91: 1,4,1600000;
A92: 87 | B92: 3 | C92: 1350000 | D92: 1,4,1700000;
A93: 88 | B93: 3 | C93: 1400000 | D93: 1,4,1800000;
A94: 89 | B94: 3 | C94: 1450000 | D94: 1,4,1900000;
A95: 90 | B95: 3 | C95: 1500000 | D95: 1,4,2000000;
A96: 91 | B96: 4 | C96: 220000 | D96: 1,11007,1;
A97: 92 | B97: 4 | C97: 260000 | D97: 1,11007,1;
A98: 93 | B98: 4 | C98: 300000 | D98: 1,11007,1;
A99: 94 | B99: 4 | C99: 350000 | D99: 1,11007,1;
A100: 95 | B100: 4 | C100: 400000 | D100: 1,11007,1;
A101: 96 | B101: 4 | C101: 450000 | D101: 1,11007,1;
A102: 97 | B102: 4 | C102: 500000 | D102: 1,11007,1;
A103: 98 | B103: 4 | C103: 550000 | D103: 1,11007,1;
A104: 99 | B104: 4 | C104: 600000 | D104: 1,11007,1;
A105: 100 | B105: 4 | C105: 650000 | D105: 1,11007,1;
A106: 101 | B106: 4 | C106: 700000 | D106: 1,11007,1;
A107: 102 | B107: 4 | C107: 750000 | D107: 1,11007,1;
A108: 103 | B108: 4 | C108: 800000 | D108: 1,11007,1;
A109: 104 | B109: 4 | C109: 850000 | D109: 1,11007,1;
A110: 105 | B110: 4 | C110: 900000 | D110: 1,11007,1;
A111: 106 | B111: 4 | C111: 950000 | D111: 1,11007,1;
A112: 107 | B112: 4 | C112: 1000000 | D112: 1,11008,1;
A113: 108 | B113: 5 | C113: 1 | D113: 1,3,50000;
A114: 109 | B114: 5 | C114: 2 | D114: 1,3,50000;
A115: 110 | B115: 5 | C115: 3 | D115: 1,3,50000;
A116: 111 | B116: 5 | C116: 4 | D116: 1,3,50000;
A117: 112 | B117: 5 | C117: 5 | D117: 1,3,50000;
A118: 113 | B118: 5 | C118: 6 | D118: 1,3,100000;
A119: 114 | B119: 5 | C119: 7 | D119: 1,3,150000;
A120: 115 | B120: 5 | C120: 8 | D120: 1,3,200000;
A121: 116 | B121: 5 | C121: 9 | D121: 1,3,250000;
A122: 117 | B122: 5 | C122: 10 | D122: 1,3,250000;
A123: 118 | B123: 5 | C123: 11 | D123: 1,3,250000;
A124: 119 | B124: 5 | C124: 12 | D124: 1,3,250000;
A125: 120 | B125: 5 | C125: 13 | D125: 1,3,250000;
A126: 121 | B126: 5 | C126: 14 | D126: 1,3,250000;
A127: 122 | B127: 5 | C127: 15 | D127: 1,3,400000;
A128: 123 | B128: 5 | C128: 16 | D128: 1,3,400000;
A129: 124 | B129: 5 | C129: 17 | D129: 1,3,400000;
A130: 125 | B130: 5 | C130: 18 | D130: 1,3,400000;
A131: 126 | B131: 5 | C131: 19 | D131: 1,3,500000;
A132: 181 | B132: 7 | C132: 3 | D132: 1,4,100000;
A133: 182 | B133: 7 | C133: 6 | D133: 1,4,100000;
A134: 183 | B134: 7 | C134: 9 | D134: 1,4,100000;
A135: 184 | B135: 7 | C135: 12 | D135: 1,4,100000;
A136: 185 | B136: 7 | C136: 15 | D136: 1,4,100000;
A137: 186 | B137: 7 | C137: 18 | D137: 1,4,200000;
A138: 187 | B138: 7 | C138: 21 | D138: 1,4,200000;
A139: 188 | B139: 7 | C139: 24 | D139: 1,4,200000;
A140: 189 | B140: 7 | C140: 27 | D140: 1,4,200000;
A141: 190 | B141: 7 | C141: 30 | D141: 1,4,200000;
A142: 191 | B142: 7 | C142: 36 | D142: 1,4,200000;
A143: 192 | B143: 7 | C143: 42 | D143: 1,4,200000;
A144: 193 | B144: 7 | C144: 48 | D144: 1,4,200000;
A145: 194 | B145: 7 | C145: 54 | D145: 1,4,300000;
A146: 195 | B146: 7 | C146: 60 | D146: 1,4,300000;
A147: 196 | B147: 7 | C147: 66 | D147: 1,4,300000;
A148: 197 | B148: 7 | C148: 72 | D148: 1,4,300000;
A149: 198 | B149: 7 | C149: 78 | D149: 1,4,300000;
A150: 199 | B150: 7 | C150: 84 | D150: 1,4,300000;
A151: 200 | B151: 7 | C151: 90 | D151: 1,4,300000;
A152: 201 | B152: 7 | C152: 96 | D152: 1,4,300000;
A153: 202 | B153: 7 | C153: 102 | D153: 1,4,300000;
A154: 203 | B154: 7 | C154: 108 | D154: 1,4,400000;
A155: 204 | B155: 7 | C155: 114 | D155: 1,4,400000;
A156: 205 | B156: 7 | C156: 120 | D156: 1,4,400000;
A157: 206 | B157: 7 | C157: 126 | D157: 1,4,400000;
A158: 207 | B158: 7 | C158: 132 | D158: 1,4,400000;
A159: 208 | B159: 7 | C159: 138 | D159: 1,4,400000;
A160: 209 | B160: 7 | C160: 144 | D160: 1,4,400000;
A161: 210 | B161: 7 | C161: 150 | D161: 1,4,400000;
A162: 211 | B162: 7 | C162: 156 | D162: 1,4,400000;
A163: 212 | B163: 7 | C163: 162 | D163: 1,4,400000;
A164: 213 | B164: 7 | C164: 168 | D164: 1,4,400000;
A165: 214 | B165: 7 | C165: 174 | D165: 1,4,400000;
A166: 215 | B166: 7 | C166: 180 | D166: 1,4,500000;
A167: 216 | B167: 7 | C167: 186 | D167: 1,4,500000;
A168: 217 | B168: 7 | C168: 192 | D168: 1,4,500000;
A169: 218 | B169: 7 | C169: 198 | D169: 1,4,500000;
A170: 219 | B170: 7 | C170: 204 | D170: 1,4,500000;
A171: 220 | B171: 7 | C171: 210 | D171: 1,4,500000;
A172: 221 | B172: 7 | C172: 216 | D172: 1,4,500000;
A173: 222 | B173: 8 | C173: 3 | D173: 1,28000,1;
A174: 223 | B174: 8 | C174: 6 | D174: 1,28000,2;
A175: 224 | B175: 8 | C175: 9 | D175: 1,28000,3;
A176: 225 | B176: 8 | C176: 12 | D176: 1,28000,4;
A177: 226 | B177: 8 | C177: 15 | D177: 1,28000,5;
A178: 227 | B178: 8 | C178: 18 | D178: 1,28000,10;
A179: 228 | B179: 8 | C179: 21 | D179: 1,28000,15;
A180: 229 | B180: 8 | C180: 24 | D180: 1,28000,20;
A181: 230 | B181: 8 | C181: 27 | D181: 1,28000,25;
A182: 231 | B182: 8 | C182: 30 | D182: 1,28001,5;
A183: 232 | B183: 8 | C183: 36 | D183: 1,28001,6;
A184: 233 | B184: 8 | C184: 42 | D184: 1,28001,7;
A185: 234 | B185: 8 | C185: 48 | D185: 1,28001,8;
A186: 235 | B186: 8 | C186: 54 | D186: 1,28001,9;
A187: 236 | B187: 8 | C187: 60 | D187: 1,28001,10;
A188: 237 | B188: 8 | C188: 66 | D188: 1,28001,12;
A189: 238 | B189: 8 | C189: 72 | D189: 1,28001,15;
A190: 239 | B190: 8 | C190: 78 | D190: 1,28001,18;
A191: 240 | B191: 8 | C191: 84 | D191: 1,28001,20;
A192: 241 | B192: 8 | C192: 90 | D192: 1,28001,22;
A193: 242 | B193: 8 | C193: 96 | D193: 1,28001,25;
A194: 243 | B194: 8 | C194: 102 | D194: 1,28001,28;
A195: 244 | B195: 8 | C195: 108 | D195: 1,28001,30;
A196: 245 | B196: 8 | C196: 114 | D196: 1,28002,5;
A197: 246 | B197: 8 | C197: 120 | D197: 1,28002,6;
A198: 247 | B198: 8 | C198: 126 | D198: 1,28002,7;
A199: 248 | B199: 8 | C199: 132 | D199: 1,28002,8;
A200: 249 | B200: 8 | C200: 138 | D200: 1,28002,9;
A201: 250 | B201: 8 | C201: 144 | D201: 1,28002,10;
A202: 251 | B202: 8 | C202: 150 | D202: 1,3,150000;
A203: 252 | B203: 9 | C203: 3 | D203: 1,10008,1;
A204: 253 | B204: 9 | C204: 6 | D204: 1,10008,2;
A205: 254 | B205: 9 | C205: 9 | D205: 1,10008,3;
A206: 255 | B206: 9 | C206: 12 | D206: 1,10008,4;
A207: 256 | B207: 9 | C207: 15 | D207: 1,10008,5;
A208: 257 | B208: 9 | C208: 18 | D208: 1,10008,5;
A209: 258 | B209: 9 | C209: 21 | D209: 1,10008,5;
A210: 259 | B210: 9 | C210: 24 | D210: 1,10008,8;
A211: 260 | B211: 9 | C211: 27 | D211: 1,10008,8;
A212: 261 | B212: 9 | C212: 30 | D212: 1,10008,8;
A213: 262 | B213: 9 | C213: 33 | D213: 1,10008,8;
A214: 263 | B214: 9 | C214: 40 | D214: 1,10008,8;
A215: 264 | B215: 9 | C215: 48 | D215: 1,10008,10;
A216: 265 | B216: 9 | C216: 56 | D216: 1,10008,10;
A217: 266 | B217: 9 | C217: 64 | D217: 1,10008,10;
A218: 267 | B218: 9 | C218: 72 | D218: 1,10008,10;
A219: 268 | B219: 9 | C219: 80 | D219: 1,10008,10;
A220: 269 | B220: 9 | C220: 88 | D220: 1,10008,15;
A221: 270 | B221: 9 | C221: 96 | D221: 1,10008,15;
A222: 271 | B222: 9 | C222: 104 | D222: 1,10008,15;
A223: 272 | B223: 9 | C223: 112 | D223: 1,10008,15;
A224: 273 | B224: 9 | C224: 120 | D224: 1,10008,15;
A225: 274 | B225: 9 | C225: 128 | D225: 1,10009,5;
A226: 275 | B226: 9 | C226: 136 | D226: 1,10009,5;
A227: 276 | B227: 9 | C227: 144 | D227: 1,10009,5;
A228: 277 | B228: 9 | C228: 152 | D228: 1,10009,5;
A229: 278 | B229: 9 | C229: 160 | D229: 1,10009,5;
A230: 279 | B230: 9 | C230: 168 | D230: 1,10009,5;
A231: 280 | B231: 9 | C231: 176 | D231: 1,10009,5;
A232: 281 | B232: 9 | C232: 184 | D232: 1,10009,5;
A233: 282 | B233: 9 | C233: 192 | D233: 1,10009,5;
A234: 283 | B234: 9 | C234: 200 | D234: 1,10009,8;
A235: 284 | B235: 9 | C235: 208 | D235: 1,10009,8;
A236: 285 | B236: 9 | C236: 216 | D236: 1,10009,8;
A237: 286 | B237: 9 | C237: 224 | D237: 1,10009,8;
A238: 287 | B238: 9 | C238: 232 | D238: 1,10009,8;
A239: 288 | B239: 9 | C239: 240 | D239: 1,10009,10;
A240: 289 | B240: 9 | C240: 248 | D240: 1,10009,10;
A241: 290 | B241: 9 | C241: 256 | D241: 1,10009,10;
A242: 291 | B242: 9 | C242: 264 | D242: 1,10009,10;
A243: 292 | B243: 9 | C243: 272 | D243: 1,10009,10;
A244: 293 | B244: 9 | C244: 275 | D244: 1,10009,10;
A245: 294 | B245: 11 | C245: 5 | D245: 1,5,10;
A246: 295 | B246: 11 | C246: 10 | D246: 1,5,10;
A247: 296 | B247: 11 | C247: 15 | D247: 1,5,10;
A248: 297 | B248: 11 | C248: 20 | D248: 1,5,10;
A249: 298 | B249: 11 | C249: 25 | D249: 1,5,10;
A250: 299 | B250: 11 | C250: 30 | D250: 1,5,10;
A251: 300 | B251: 11 | C251: 35 | D251: 1,5,10;
A252: 301 | B252: 11 | C252: 40 | D252: 1,5,10;
A253: 302 | B253: 11 | C253: 45 | D253: 1,5,10;
A254: 303 | B254: 11 | C254: 50 | D254: 1,5,10;
A255: 304 | B255: 11 | C255: 55 | D255: 1,5,10;
A256: 305 | B256: 11 | C256: 60 | D256: 1,5,10;
A257: 306 | B257: 11 | C257: 65 | D257: 1,5,10;
A258: 307 | B258: 11 | C258: 70 | D258: 1,5,10;
A259: 308 | B259: 11 | C259: 75 | D259: 1,5,10;
A260: 309 | B260: 11 | C260: 80 | D260: 1,5,10;
A261: 310 | B261: 11 | C261: 85 | D261: 1,5,10;
A262: 311 | B262: 11 | C262: 90 | D262: 1,5,10;
A263: 312 | B263: 11 | C263: 95 | D263: 1,5,10;
A264: 313 | B264: 11 | C264: 100 | D264: 1,5,10;
A265: 314 | B265: 11 | C265: 105 | D265: 1,5,10;
A266: 315 | B266: 11 | C266: 110 | D266: 1,5,10;
A267: 316 | B267: 11 | C267: 120 | D267: 1,5,10;
A268: 317 | B268: 11 | C268: 130 | D268: 1,5,10;
A269: 318 | B269: 11 | C269: 140 | D269: 1,5,10;
A270: 319 | B270: 11 | C270: 150 | D270: 1,5,10;
A271: 320 | B271: 11 | C271: 160 | D271: 1,5,10;
A272: 321 | B272: 11 | C272: 170 | D272: 1,5,10;
A273: 322 | B273: 11 | C273: 180 | D273: 1,5,10;
A274: 323 | B274: 11 | C274: 190 | D274: 1,5,10;
A275: 324 | B275: 11 | C275: 200 | D275: 1,5,10;
A276: 325 | B276: 11 | C276: 220 | D276: 1,5,10;
A277: 326 | B277: 11 | C277: 240 | D277: 1,5,10;
A278: 327 | B278: 11 | C278: 260 | D278: 1,5,10;
A279: 328 | B279: 11 | C279: 280 | D279: 1,5,10;
A280: 329 | B280: 11 | C280: 300 | D280: 1,5,10;
A281: 330 | B281: 11 | C281: 350 | D281: 1,5,10;
A282: 331 | B282: 11 | C282: 400 | D282: 1,5,10;
A283: 332 | B283: 11 | C283: 450 | D283: 1,5,10;
A284: 333 | B284: 11 | C284: 500 | D284: 1,5,10;
A285: 334 | B285: 11 | C285: 550 | D285: 1,5,10;
A286: 335 | B286: 11 | C286: 600 | D286: 1,5,10;
A287: 336 | B287: 11 | C287: 650 | D287: 1,5,10;
A288: 337 | B288: 11 | C288: 700 | D288: 1,5,10;
A289: 338 | B289: 11 | C289: 750 | D289: 1,5,10;
A290: 339 | B290: 11 | C290: 800 | D290: 1,5,10;
A291: 340 | B291: 11 | C291: 850 | D291: 1,5,10;
A292: 341 | B292: 11 | C292: 900 | D292: 1,5,10;
A293: 342 | B293: 11 | C293: 950 | D293: 1,5,10;
A294: 343 | B294: 11 | C294: 1000 | D294: 1,5,20;
A295: 344 | B295: 11 | C295: 1100 | D295: 1,5,20;
A296: 345 | B296: 11 | C296: 1200 | D296: 1,5,20;
A297: 346 | B297: 11 | C297: 1300 | D297: 1,5,20;
A298: 347 | B298: 11 | C298: 1400 | D298: 1,5,20;
A299: 348 | B299: 11 | C299: 1500 | D299: 1,5,20;
A300: 349 | B300: 11 | C300: 1600 | D300: 1,5,20;
A301: 350 | B301: 11 | C301: 1700 | D301: 1,5,20;
A302: 351 | B302: 11 | C302: 1800 | D302: 1,5,20;
A303: 352 | B303: 11 | C303: 1900 | D303: 1,5,20;
A304: 353 | B304: 11 | C304: 2000 | D304: 1,5,20;
A305: 354 | B305: 15 | C305: 2 | D305: 1,3,50000;
A306: 355 | B306: 15 | C306: 4 | D306: 1,3,100000;
A307: 356 | B307: 15 | C307: 6 | D307: 1,3,150000;
A308: 357 | B308: 15 | C308: 8 | D308: 1,3,200000;
A309: 358 | B309: 15 | C309: 10 | D309: 1,3,250000;
A310: 359 | B310: 15 | C310: 14 | D310: 1,3,250000;
A311: 360 | B311: 15 | C311: 18 | D311: 1,3,250000;
A312: 361 | B312: 15 | C312: 22 | D312: 1,3,250000;
A313: 362 | B313: 15 | C313: 26 | D313: 1,3,250000;
A314: 363 | B314: 15 | C314: 30 | D314: 1,3,250000;
A315: 364 | B315: 15 | C315: 36 | D315: 1,3,250000;
A316: 365 | B316: 15 | C316: 42 | D316: 1,3,250000;
A317: 366 | B317: 15 | C317: 48 | D317: 1,3,250000;
A318: 367 | B318: 15 | C318: 54 | D318: 1,3,250000;
A319: 368 | B319: 15 | C319: 60 | D319: 1,3,250000;
A320: 369 | B320: 15 | C320: 68 | D320: 1,3,250000;
A321: 370 | B321: 15 | C321: 76 | D321: 1,3,250000;
A322: 371 | B322: 15 | C322: 84 | D322: 1,3,250000;
A323: 372 | B323: 15 | C323: 92 | D323: 1,3,250000;
A324: 373 | B324: 15 | C324: 100 | D324: 1,3,400000;
A325: 374 | B325: 15 | C325: 110 | D325: 1,3,400000;
A326: 375 | B326: 15 | C326: 120 | D326: 1,3,400000;
A327: 376 | B327: 15 | C327: 130 | D327: 1,3,400000;
A328: 377 | B328: 15 | C328: 140 | D328: 1,3,400000;
A329: 378 | B329: 15 | C329: 150 | D329: 1,3,500000;
A330: 379 | B330: 15 | C330: 162 | D330: 1,3,500000;
A331: 380 | B331: 15 | C331: 174 | D331: 1,3,500000;
A332: 381 | B332: 15 | C332: 186 | D332: 1,3,500000;
A333: 382 | B333: 15 | C333: 198 | D333: 1,3,500000;
A334: 383 | B334: 15 | C334: 210 | D334: 1,3,500000;
A335: 384 | B335: 15 | C335: 224 | D335: 1,3,500000;
A336: 385 | B336: 15 | C336: 238 | D336: 1,3,500000;
A337: 386 | B337: 15 | C337: 252 | D337: 1,3,500000;
A338: 387 | B338: 15 | C338: 266 | D338: 1,3,500000;
A339: 388 | B339: 15 | C339: 280 | D339: 1,3,500000;
A340: 389 | B340: 15 | C340: 296 | D340: 1,3,500000;
A341: 390 | B341: 15 | C341: 312 | D341: 1,3,500000;
A342: 391 | B342: 15 | C342: 328 | D342: 1,3,500000;
A343: 392 | B343: 15 | C343: 344 | D343: 1,3,500000;
A344: 393 | B344: 15 | C344: 360 | D344: 1,3,600000;
A345: 394 | B345: 15 | C345: 380 | D345: 1,3,600000;
A346: 395 | B346: 15 | C346: 400 | D346: 1,3,600000;
A347: 396 | B347: 15 | C347: 440 | D347: 1,3,600000;
A348: 397 | B348: 15 | C348: 480 | D348: 1,3,600000;
A349: 398 | B349: 15 | C349: 520 | D349: 1,3,600000;
A350: 399 | B350: 15 | C350: 560 | D350: 1,3,600000;
A351: 400 | B351: 15 | C351: 600 | D351: 1,3,600000;
A352: 401 | B352: 15 | C352: 660 | D352: 1,3,600000;
A353: 402 | B353: 15 | C353: 720 | D353: 1,3,600000;
A354: 403 | B354: 15 | C354: 730 | D354: 1,3,750000;
A355: 404 | B355: 16 | C355: 3 | D355: 1,3,50000;
A356: 405 | B356: 16 | C356: 6 | D356: 1,3,100000;
A357: 406 | B357: 16 | C357: 9 | D357: 1,3,150000;
A358: 407 | B358: 16 | C358: 12 | D358: 1,3,200000;
A359: 408 | B359: 16 | C359: 15 | D359: 1,3,250000;
A360: 409 | B360: 16 | C360: 21 | D360: 1,3,250000;
A361: 410 | B361: 16 | C361: 27 | D361: 1,3,250000;
A362: 411 | B362: 16 | C362: 33 | D362: 1,3,250000;
A363: 412 | B363: 16 | C363: 39 | D363: 1,3,250000;
A364: 413 | B364: 16 | C364: 45 | D364: 1,3,250000;
A365: 414 | B365: 16 | C365: 54 | D365: 1,3,250000;
A366: 415 | B366: 16 | C366: 63 | D366: 1,3,250000;
A367: 416 | B367: 16 | C367: 72 | D367: 1,3,250000;
A368: 417 | B368: 16 | C368: 81 | D368: 1,3,250000;
A369: 418 | B369: 16 | C369: 90 | D369: 1,3,250000;
A370: 419 | B370: 16 | C370: 102 | D370: 1,3,250000;
A371: 420 | B371: 16 | C371: 114 | D371: 1,3,250000;
A372: 421 | B372: 16 | C372: 126 | D372: 1,3,250000;
A373: 422 | B373: 16 | C373: 138 | D373: 1,3,250000;
A374: 423 | B374: 16 | C374: 150 | D374: 1,3,400000;
A375: 424 | B375: 16 | C375: 165 | D375: 1,3,400000;
A376: 425 | B376: 16 | C376: 180 | D376: 1,3,400000;
A377: 426 | B377: 16 | C377: 195 | D377: 1,3,400000;
A378: 427 | B378: 16 | C378: 210 | D378: 1,3,400000;
A379: 428 | B379: 16 | C379: 225 | D379: 1,3,500000;
A380: 429 | B380: 16 | C380: 243 | D380: 1,3,500000;
A381: 430 | B381: 16 | C381: 261 | D381: 1,3,500000;
A382: 431 | B382: 16 | C382: 279 | D382: 1,3,500000;
A383: 432 | B383: 16 | C383: 297 | D383: 1,3,500000;
A384: 433 | B384: 16 | C384: 315 | D384: 1,3,500000;
A385: 434 | B385: 16 | C385: 336 | D385: 1,3,500000;
A386: 435 | B386: 16 | C386: 357 | D386: 1,3,500000;
A387: 436 | B387: 16 | C387: 378 | D387: 1,3,500000;
A388: 437 | B388: 16 | C388: 399 | D388: 1,3,500000;
A389: 438 | B389: 16 | C389: 420 | D389: 1,3,500000;
A390: 439 | B390: 16 | C390: 444 | D390: 1,3,500000;
A391: 440 | B391: 16 | C391: 468 | D391: 1,3,500000;
A392: 441 | B392: 16 | C392: 492 | D392: 1,3,500000;
A393: 442 | B393: 16 | C393: 516 | D393: 1,3,500000;
A394: 443 | B394: 16 | C394: 540 | D394: 1,3,600000;
A395: 444 | B395: 16 | C395: 570 | D395: 1,3,600000;
A396: 445 | B396: 16 | C396: 600 | D396: 1,3,600000;
A397: 446 | B397: 16 | C397: 660 | D397: 1,3,600000;
A398: 447 | B398: 16 | C398: 720 | D398: 1,3,600000;
A399: 448 | B399: 16 | C399: 780 | D399: 1,3,600000;
A400: 449 | B400: 16 | C400: 840 | D400: 1,3,600000;
A401: 450 | B401: 16 | C401: 900 | D401: 1,3,600000;
A402: 451 | B402: 16 | C402: 990 | D402: 1,3,600000;
A403: 452 | B403: 16 | C403: 1080 | D403: 1,3,600000;
A404: 453 | B404: 16 | C404: 1095 | D404: 1,3,750000;
A405: 494 | B405: 21 | C405: 1 | D405: 1,3,50000;
A406: 495 | B406: 21 | C406: 2 | D406: 1,3,50000;
A407: 496 | B407: 21 | C407: 3 | D407: 1,3,50000;
A408: 497 | B408: 21 | C408: 5 | D408: 1,3,50000;
A409: 498 | B409: 21 | C409: 10 | D409: 1,3,150000;
A410: 499 | B410: 21 | C410: 20 | D410: 1,3,250000;
A411: 500 | B411: 21 | C411: 30 | D411: 1,3,400000;
A412: 501 | B412: 21 | C412: 50 | D412: 1,3,500000;
A413: 552 | B413: 23 | C413: 1 | D413: 1,6,50;
A414: 553 | B414: 23 | C414: 2 | D414: 1,6,50;
A415: 554 | B415: 23 | C415: 3 | D415: 1,6,50;
A416: 555 | B416: 23 | C416: 4 | D416: 1,6,50;
A417: 556 | B417: 23 | C417: 5 | D417: 1,6,50;
A418: 557 | B418: 23 | C418: 6 | D418: 1,6,50;
A419: 558 | B419: 23 | C419: 7 | D419: 1,6,50;
A420: 559 | B420: 23 | C420: 8 | D420: 1,6,50;
A421: 560 | B421: 23 | C421: 9 | D421: 1,6,50;
A422: 561 | B422: 23 | C422: 10 | D422: 1,6,50;
A423: 562 | B423: 23 | C423: 11 | D423: 1,6,50;
A424: 563 | B424: 23 | C424: 12 | D424: 1,6,50;
A425: 564 | B425: 23 | C425: 13 | D425: 1,6,50;
A426: 565 | B426: 23 | C426: 14 | D426: 1,6,50;
A427: 566 | B427: 23 | C427: 15 | D427: 1,6,50;
A428: 567 | B428: 23 | C428: 16 | D428: 1,6,50;
A429: 568 | B429: 23 | C429: 17 | D429: 1,6,50;
A430: 569 | B430: 23 | C430: 18 | D430: 1,6,50;
A431: 570 | B431: 23 | C431: 19 | D431: 1,6,50;
A432: 571 | B432: 23 | C432: 20 | D432: 1,6,50;
A433: 572 | B433: 23 | C433: 21 | D433: 1,6,50;
A434: 573 | B434: 23 | C434: 22 | D434: 1,6,50;
A435: 574 | B435: 23 | C435: 23 | D435: 1,6,50;
A436: 575 | B436: 23 | C436: 24 | D436: 1,6,50;
A437: 576 | B437: 23 | C437: 25 | D437: 1,6,50;
A438: 577 | B438: 23 | C438: 26 | D438: 1,6,50;
A439: 578 | B439: 23 | C439: 27 | D439: 1,6,50;
A440: 579 | B440: 23 | C440: 28 | D440: 1,6,50;
A441: 580 | B441: 23 | C441: 29 | D441: 1,6,50;
A442: 581 | B442: 23 | C442: 30 | D442: 1,6,50;
A443: 582 | B443: 23 | C443: 31 | D443: 1,6,50;
A444: 583 | B444: 23 | C444: 32 | D444: 1,6,50;
A445: 584 | B445: 23 | C445: 33 | D445: 1,6,50;
A446: 585 | B446: 23 | C446: 34 | D446: 1,6,50;
A447: 586 | B447: 23 | C447: 35 | D447: 1,6,50;
A448: 587 | B448: 23 | C448: 36 | D448: 1,6,50;
A449: 588 | B449: 23 | C449: 37 | D449: 1,6,50;
A450: 589 | B450: 23 | C450: 38 | D450: 1,6,50;
A451: 590 | B451: 23 | C451: 39 | D451: 1,6,50;
A452: 591 | B452: 23 | C452: 40 | D452: 1,6,50;
A453: 592 | B453: 23 | C453: 41 | D453: 1,6,50;
A454: 593 | B454: 23 | C454: 42 | D454: 1,6,50;
A455: 594 | B455: 23 | C455: 43 | D455: 1,6,50;
A456: 595 | B456: 23 | C456: 44 | D456: 1,6,50;
A457: 596 | B457: 23 | C457: 45 | D457: 1,6,50;
A458: 597 | B458: 23 | C458: 46 | D458: 1,6,50;
A459: 598 | B459: 23 | C459: 47 | D459: 1,6,50;
A460: 599 | B460: 23 | C460: 48 | D460: 1,6,50;
A461: 600 | B461: 23 | C461: 49 | D461: 1,6,50;
A462: 601 | B462: 23 | C462: 50 | D462: 1,6,50;
A463: 602 | B463: 23 | C463: 51 | D463: 1,6,50;
A464: 603 | B464: 23 | C464: 52 | D464: 1,6,50;
A465: 604 | B465: 23 | C465: 53 | D465: 1,6,50;
A466: 605 | B466: 23 | C466: 54 | D466: 1,6,50;
A467: 606 | B467: 23 | C467: 55 | D467: 1,6,50;
A468: 607 | B468: 23 | C468: 56 | D468: 1,6,50;
A469: 608 | B469: 23 | C469: 57 | D469: 1,6,50;
A470: 609 | B470: 23 | C470: 58 | D470: 1,6,50;
A471: 610 | B471: 23 | C471: 59 | D471: 1,6,50;
A472: 611 | B472: 23 | C472: 60 | D472: 1,6,50;
A473: 612 | B473: 23 | C473: 61 | D473: 1,6,50;
A474: 613 | B474: 23 | C474: 62 | D474: 1,6,50;
A475: 614 | B475: 23 | C475: 63 | D475: 1,6,50;
A476: 615 | B476: 23 | C476: 64 | D476: 1,6,50;
A477: 616 | B477: 23 | C477: 65 | D477: 1,6,50;
A478: 617 | B478: 23 | C478: 66 | D478: 1,6,50;
A479: 618 | B479: 23 | C479: 67 | D479: 1,6,50;
A480: 619 | B480: 23 | C480: 68 | D480: 1,6,50;
A481: 620 | B481: 23 | C481: 69 | D481: 1,6,50;
A482: 621 | B482: 23 | C482: 70 | D482: 1,6,50;
A483: 622 | B483: 23 | C483: 71 | D483: 1,6,50;
A484: 623 | B484: 23 | C484: 72 | D484: 1,6,50;
A485: 624 | B485: 23 | C485: 73 | D485: 1,6,50;
A486: 625 | B486: 23 | C486: 74 | D486: 1,6,50;
A487: 626 | B487: 23 | C487: 75 | D487: 1,6,50;
A488: 627 | B488: 23 | C488: 76 | D488: 1,6,50;
A489: 628 | B489: 23 | C489: 77 | D489: 1,6,50;
A490: 629 | B490: 23 | C490: 78 | D490: 1,6,50;
A491: 630 | B491: 23 | C491: 79 | D491: 1,6,50;
A492: 631 | B492: 23 | C492: 80 | D492: 1,6,50;
A493: 632 | B493: 23 | C493: 81 | D493: 1,6,50;
A494: 633 | B494: 23 | C494: 82 | D494: 1,6,50;
A495: 634 | B495: 23 | C495: 83 | D495: 1,6,50;
A496: 635 | B496: 23 | C496: 84 | D496: 1,6,50;
A497: 636 | B497: 23 | C497: 85 | D497: 1,6,50;
A498: 637 | B498: 23 | C498: 86 | D498: 1,6,50;
A499: 638 | B499: 23 | C499: 87 | D499: 1,6,50;
A500: 639 | B500: 23 | C500: 88 | D500: 1,6,50;
A501: 640 | B501: 23 | C501: 89 | D501: 1,6,50;
A502: 641 | B502: 23 | C502: 90 | D502: 1,6,50;
A503: 642 | B503: 23 | C503: 91 | D503: 1,6,50;
A504: 643 | B504: 23 | C504: 92 | D504: 1,6,50;
A505: 644 | B505: 23 | C505: 93 | D505: 1,6,50;
A506: 645 | B506: 23 | C506: 94 | D506: 1,6,50;
A507: 646 | B507: 23 | C507: 95 | D507: 1,6,50;
A508: 647 | B508: 23 | C508: 96 | D508: 1,6,50;
A509: 648 | B509: 23 | C509: 97 | D509: 1,6,50;
A510: 649 | B510: 23 | C510: 98 | D510: 1,6,50;
A511: 650 | B511: 23 | C511: 99 | D511: 1,6,50;
A512: 651 | B512: 23 | C512: 100 | D512: 1,6,50;

Sheet: Sheet2
B2: 1 | D2: 1000 | G2: =RC[-5]*20 -> 20 | J2: =RC[-8]*5 -> 5 | L2: =RC[-10]*10 -> 10 | N2: =RC[-12]*50 -> 50 | P2: =RC[-14]*2 -> 2
B3: 2 | D3: 2000 | G3: =RC[-5]*20 -> 40 | J3: =RC[-8]*5 -> 10 | L3: =RC[-10]*10 -> 20 | N3: =RC[-12]*50 -> 100 | P3: =RC[-14]*2 -> 4
B4: 3 | D4: 3000 | G4: =RC[-5]*20 -> 60 | J4: =RC[-8]*5 -> 15 | L4: =RC[-10]*10 -> 30 | N4: =RC[-12]*50 -> 150 | P4: =RC[-14]*2 -> 6
B5: 4 | D5: 4000 | G5: =RC[-5]*20 -> 80 | J5: =RC[-8]*5 -> 20 | L5: =RC[-10]*10 -> 40 | N5: =RC[-12]*50 -> 200 | P5: =RC[-14]*2 -> 8
B6: 5 | D6: 5000 | G6: =RC[-5]*20 -> 100 | J6: =RC[-8]*5 -> 25 | L6: =RC[-10]*10 -> 50 | N6: =RC[-12]*50 -> 250 | P6: =RC[-14]*2 -> 10
B7: 7 | D7: 6000 | G7: =RC[-5]*20 -> 140 | J7: =RC[-8]*5 -> 35 | L7: =RC[-10]*10 -> 70 | N7: =RC[-12]*50 -> 350 | P7: =RC[-14]*2 -> 14
B8: 9 | D8: 7000 | G8: =RC[-5]*20 -> 180 | J8: =RC[-8]*5 -> 45 | L8: =RC[-10]*10 -> 90 | N8: =RC[-12]*50 -> 450 | P8: =RC[-14]*2 -> 18
B9: 11 | D9: 8000 | G9: =RC[-5]*20 -> 220 | J9: =RC[-8]*5 -> 55 | L9: =RC[-10]*10 -> 110 | N9: =RC[-12]*50 -> 550 | P9: =RC[-14]*2 -> 22
B10: 13 | D10: 9000 | G10: =RC[-5]*20 -> 260 | J10: =RC[-8]*5 -> 65 | L10: =RC[-10]*10 -> 130 | N10: =RC[-12]*50 -> 650 | P10: =RC[-14]*2 -> 26
B11: 15 | D11: 10000 | G11: =RC[-5]*20 -> 300 | J11: =RC[-8]*5 -> 75 | L11: =RC[-10]*10 -> 150 | N11: =RC[-12]*50 -> 750 | P11: =RC[-14]*2 -> 30
B12: 18 | D12: 11000 | G12: =RC[-5]*20 -> 360 | J12: =RC[-8]*5 -> 90 | L12: =RC[-10]*10 -> 180 | N12: =RC[-12]*50 -> 900 | P12: =RC[-14]*2 -> 36
B13: 21 | D13: 12000 | G13: =RC[-5]*20 -> 420 | J13: =RC[-8]*5 -> 105 | L13: =RC[-10]*10 -> 210 | N13: =RC[-12]*50 -> 1050 | P13: =RC[-14]*2 -> 42
B14: 24 | D14: 13000 | G14: =RC[-5]*20 -> 480 | J14: =RC[-8]*5 -> 120 | L14: =RC[-10]*10 -> 240 | N14: =RC[-12]*50 -> 1200 | P14: =RC[-14]*2 -> 48
B15: 27 | D15: 14000 | G15: =RC[-5]*20 -> 540 | J15: =RC[-8]*5 -> 135 | L15: =RC[-10]*10 -> 270 | N15: =RC[-12]*50 -> 1350 | P15: =RC[-14]*2 -> 54
B16: 30 | D16: 15000 | G16: =RC[-5]*20 -> 600 | J16: =RC[-8]*5 -> 150 | L16: =RC[-10]*10 -> 300 | N16: =RC[-12]*50 -> 1500 | P16: =RC[-14]*2 -> 60
B17: 34 | D17: 15000 | G17: =RC[-5]*20 -> 680 | J17: =RC[-8]*5 -> 170 | L17: =RC[-10]*10 -> 340 | N17: =RC[-12]*50 -> 1700 | P17: =RC[-14]*2 -> 68
B18: 38 | D18: 15000 | G18: =RC[-5]*20 -> 760 | J18: =RC[-8]*5 -> 190 | L18: =RC[-10]*10 -> 380 | N18: =RC[-12]*50 -> 1900 | P18: =RC[-14]*2 -> 76
B19: 42 | D19: 15000 | G19: =RC[-5]*20 -> 840 | J19: =RC[-8]*5 -> 210 | L19: =RC[-10]*10 -> 420 | N19: =RC[-12]*50 -> 2100 | P19: =RC[-14]*2 -> 84
B20: 46 | D20: 15000 | G20: =RC[-5]*20 -> 920 | J20: =RC[-8]*5 -> 230 | L20: =RC[-10]*10 -> 460 | N20: =RC[-12]*50 -> 2300 | P20: =RC[-14]*2 -> 92
B21: 50 | D21: 15000 | G21: =RC[-5]*20 -> 1000 | J21: =RC[-8]*5 -> 250 | L21: =RC[-10]*10 -> 500 | N21: =RC[-12]*50 -> 2500 | P21: =RC[-14]*2 -> 100
B22: 55 | D22: 15000 | G22: =RC[-5]*20 -> 1100 | J22: =RC[-8]*5 -> 275 | L22: =RC[-10]*10 -> 550 | N22: =RC[-12]*50 -> 2750 | P22: =RC[-14]*2 -> 110
B23: 60 | D23: 20000 | G23: =RC[-5]*20 -> 1200 | J23: =RC[-8]*5 -> 300 | L23: =RC[-10]*10 -> 600 | N23: =RC[-12]*50 -> 3000 | P23: =RC[-14]*2 -> 120
B24: 65 | D24: 20000 | G24: =RC[-5]*20 -> 1300 | J24: =RC[-8]*5 -> 325 | L24: =RC[-10]*10 -> 650 | N24: =RC[-12]*50 -> 3250 | P24: =RC[-14]*2 -> 130
B25: 70 | D25: 20000 | G25: =RC[-5]*20 -> 1400 | J25: =RC[-8]*5 -> 350 | L25: =RC[-10]*10 -> 700 | N25: =RC[-12]*50 -> 3500 | P25: =RC[-14]*2 -> 140
B26: 75 | D26: 20000 | G26: =RC[-5]*20 -> 1500 | J26: =RC[-8]*5 -> 375 | L26: =RC[-10]*10 -> 750 | N26: =RC[-12]*50 -> 3750 | P26: =RC[-14]*2 -> 150
B27: 81 | D27: 20000 | G27: =RC[-5]*20 -> 1620 | J27: =RC[-8]*5 -> 405 | L27: =RC[-10]*10 -> 810 | N27: =RC[-12]*50 -> 4050 | P27: =RC[-14]*2 -> 162
B28: 87 | D28: 20000 | G28: =RC[-5]*20 -> 1740 | J28: =RC[-8]*5 -> 435 | L28: =RC[-10]*10 -> 870 | N28: =RC[-12]*50 -> 4350 | P28: =RC[-14]*2 -> 174
B29: 93 | D29: 20000 | G29: =RC[-5]*20 -> 1860 | J29: =RC[-8]*5 -> 465 | L29: =RC[-10]*10 -> 930 | N29: =RC[-12]*50 -> 4650 | P29: =RC[-14]*2 -> 186
B30: 99 | D30: 20000 | G30: =RC[-5]*20 -> 1980 | J30: =RC[-8]*5 -> 495 | L30: =RC[-10]*10 -> 990 | N30: =RC[-12]*50 -> 4950 | P30: =RC[-14]*2 -> 198
B31: 105 | D31: 20000 | G31: =RC[-5]*20 -> 2100 | J31: =RC[-8]*5 -> 525 | L31: =RC[-10]*10 -> 1050 | N31: =RC[-12]*50 -> 5250 | P31: =RC[-14]*2 -> 210
B32: 112 | D32: 20000 | G32: =RC[-5]*20 -> 2240 | J32: =RC[-8]*5 -> 560 | L32: =RC[-10]*10 -> 1120 | N32: =RC[-12]*50 -> 5600 | P32: =RC[-14]*2 -> 224
B33: 119 | D33: 20000 | G33: =RC[-5]*20 -> 2380 | J33: =RC[-8]*5 -> 595 | L33: =RC[-10]*10 -> 1190 | N33: =RC[-12]*50 -> 5950 | P33: =RC[-14]*2 -> 238
B34: 126 | D34: 20000 | G34: =RC[-5]*20 -> 2520 | J34: =RC[-8]*5 -> 630 | L34: =RC[-10]*10 -> 1260 | N34: =RC[-12]*50 -> 6300 | P34: =RC[-14]*2 -> 252
B35: 133 | D35: 20000 | G35: =RC[-5]*20 -> 2660 | J35: =RC[-8]*5 -> 665 | L35: =RC[-10]*10 -> 1330 | N35: =RC[-12]*50 -> 6650 | P35: =RC[-14]*2 -> 266
B36: 140 | D36: 20000 | G36: =RC[-5]*20 -> 2800 | J36: =RC[-8]*5 -> 700 | L36: =RC[-10]*10 -> 1400 | N36: =RC[-12]*50 -> 7000 | P36: =RC[-14]*2 -> 280
B37: 148 | D37: 20000 | G37: =RC[-5]*20 -> 2960 | J37: =RC[-8]*5 -> 740 | L37: =RC[-10]*10 -> 1480 | N37: =RC[-12]*50 -> 7400 | P37: =RC[-14]*2 -> 296
B38: 156 | D38: 20000 | G38: =RC[-5]*20 -> 3120 | J38: =RC[-8]*5 -> 780 | L38: =RC[-10]*10 -> 1560 | N38: =RC[-12]*50 -> 7800 | P38: =RC[-14]*2 -> 312
B39: 164 | D39: 20000 | G39: =RC[-5]*20 -> 3280 | J39: =RC[-8]*5 -> 820 | L39: =RC[-10]*10 -> 1640 | N39: =RC[-12]*50 -> 8200 | P39: =RC[-14]*2 -> 328
B40: 172 | D40: 20000 | G40: =RC[-5]*20 -> 3440 | J40: =RC[-8]*5 -> 860 | L40: =RC[-10]*10 -> 1720 | N40: =RC[-12]*50 -> 8600 | P40: =RC[-14]*2 -> 344
B41: 180 | D41: 30000 | G41: =RC[-5]*20 -> 3600 | J41: =RC[-8]*5 -> 900 | L41: =RC[-10]*10 -> 1800 | N41: =RC[-12]*50 -> 9000 | P41: =RC[-14]*2 -> 360
B42: 190 | D42: 30000 | G42: =RC[-5]*20 -> 3800 | J42: =RC[-8]*5 -> 950 | L42: =RC[-10]*10 -> 1900 | N42: =RC[-12]*50 -> 9500 | P42: =RC[-14]*2 -> 380
B43: 200 | D43: 30000 | G43: =RC[-5]*20 -> 4000 | J43: =RC[-8]*5 -> 1000 | L43: =RC[-10]*10 -> 2000 | N43: =RC[-12]*50 -> 10000 | P43: =RC[-14]*2 -> 400
B44: 220 | D44: 30000 | G44: =RC[-5]*20 -> 4400 | J44: =RC[-8]*5 -> 1100 | L44: =RC[-10]*10 -> 2200 | N44: =RC[-12]*50 -> 11000 | P44: =RC[-14]*2 -> 440
B45: 240 | D45: 30000 | G45: =RC[-5]*20 -> 4800 | J45: =RC[-8]*5 -> 1200 | L45: =RC[-10]*10 -> 2400 | N45: =RC[-12]*50 -> 12000 | P45: =RC[-14]*2 -> 480
B46: 260 | D46: 30000 | G46: =RC[-5]*20 -> 5200 | J46: =RC[-8]*5 -> 1300 | L46: =RC[-10]*10 -> 2600 | N46: =RC[-12]*50 -> 13000 | P46: =RC[-14]*2 -> 520
B47: 280 | D47: 30000 | G47: =RC[-5]*20 -> 5600 | J47: =RC[-8]*5 -> 1400 | L47: =RC[-10]*10 -> 2800 | N47: =RC[-12]*50 -> 14000 | P47: =RC[-14]*2 -> 560
B48: 300 | D48: 30000 | G48: =RC[-5]*20 -> 6000 | J48: =RC[-8]*5 -> 1500 | L48: =RC[-10]*10 -> 3000 | N48: =RC[-12]*50 -> 15000 | P48: =RC[-14]*2 -> 600
B49: 330 | D49: 30000 | G49: =RC[-5]*20 -> 6600 | J49: =RC[-8]*5 -> 1650 | L49: =RC[-10]*10 -> 3300 | N49: =RC[-12]*50 -> 16500 | P49: =RC[-14]*2 -> 660
B50: 360 | D50: 30000 | G50: =RC[-5]*20 -> 7200 | J50: =RC[-8]*5 -> 1800 | L50: =RC[-10]*10 -> 3600 | N50: =RC[-12]*50 -> 18000 | P50: =RC[-14]*2 -> 720
B51: 365 | D51: 50000 | G51: =RC[-5]*20 -> 7300 | J51: =RC[-8]*5 -> 1825 | L51: =RC[-10]*10 -> 3650 | N51: =RC[-12]*50 -> 18250 | P51: =RC[-14]*2 -> 730
B60: 10 | D60: 1000
B61: 20 | D61: 2000
B62: 30 | D62: 3000
B63: 40 | D63: 4000
B64: 45 | D64: 5000
B65: 50 | D65: 6000
B66: 55 | D66: 7000
B67: 60 | D67: 8000
B68: 65 | D68: 9000
B69: 68 | D69: 10000
B70: 70 | D70: 10000
B71: 72 | D71: 10000
B72: 74 | D72: 10000
B73: 76 | D73: 10000
B74: 78 | D74: 10000
B75: 80 | D75: 15000
B76: 82 | D76: 15000
B77: 84 | D77: 15000
B78: 86 | D78: 15000
B79: 88 | D79: 15000
B80: 90 | D80: 20000
B81: 92 | D81: 20000
B82: 93 | D82: 20000
B83: 94 | D83: 20000
B84: 95 | D84: 30000
B85: 96 | D85: 30000
B86: 97 | D86: 30000
B87: 98 | D87: 30000
B88: 99 | D88: 30000
B89: 100 | D89: 50000

Sheet: Sheet3
B2: 2 | C2: =RC[-1]/2*3 -> 3 | E2: 3 | J2: 3000 | K2: =RC[-1]*100 -> 300000
B3: 4 | C3: =RC[-1]/2*3 -> 6 | E3: 6 | J3: 5000 | K3: =RC[-1]*100 -> 500000
B4: 6 | C4: =RC[-1]/2*3 -> 9 | E4: 9 | J4: 8000 | K4: =RC[-1]*100 -> 800000
B5: 8 | C5: =RC[-1]/2*3 -> 12 | E5: 12 | J5: 10000 | K5: =RC[-1]*100 -> 1000000
B6: 10 | C6: =RC[-1]/2*3 -> 15 | E6: 15 | J6: 12000 | K6: =RC[-1]*100 -> 1200000
B7: 14 | C7: =RC[-1]/2*3 -> 21 | E7: 21 | J7: 15000 | K7: =RC[-1]*100 -> 1500000
B8: 18 | C8: =RC[-1]/2*3 -> 27 | E8: 27 | J8: 20000 | K8: =RC[-1]*100 -> 2000000
B9: 22 | C9: =RC[-1]/2*3 -> 33 | E9: 33 | J9: 25000 | K9: =RC[-1]*100 -> 2500000
B10: 26 | C10: =RC[-1]/2*3 -> 39 | E10: 39 | J10: 30000 | K10: =RC[-1]*100 -> 3000000
B11: 30 | C11: =RC[-1]/2*3 -> 45 | E11: 45 | J11: 35000 | K11: =RC[-1]*100 -> 3500000
B12: 36 | C12: =RC[-1]/2*3 -> 54 | E12: 54 | J12: 40000 | K12: =RC[-1]*100 -> 4000000
B13: 42 | C13: =RC[-1]/2*3 -> 63 | E13: 63 | J13: 50000 | K13: =RC[-1]*100 -> 5000000
B14: 48 | C14: =RC[-1]/2*3 -> 72 | E14: 72 | J14: 60000 | K14: =RC[-1]*100 -> 6000000
B15: 54 | C15: =RC[-1]/2*3 -> 81 | E15: 81 | J15: 70000 | K15: =RC[-1]*100 -> 7000000
B16: 60 | C16: =RC[-1]/2*3 -> 90 | E16: 90 | J16: 80000 | K16: =RC[-1]*100 -> 8000000
B17: 68 | C17: =RC[-1]/2*3 -> 102 | E17: 102 | J17: 90000 | K17: =RC[-1]*100 -> 9000000
B18: 76 | C18: =RC[-1]/2*3 -> 114 | E18: 114 | J18: 100000 | K18: =RC[-1]*100 -> 10000000
B19: 84 | C19: =RC[-1]/2*3 -> 126 | E19: 126 | J19: 110000 | K19: =RC[-1]*100 -> 11000000
B20: 92 | C20: =RC[-1]/2*3 -> 138 | E20: 138 | J20: 120000 | K20: =RC[-1]*100 -> 12000000
B21: 100 | C21: =RC[-1]/2*3 -> 150 | E21: 150 | J21: 130000 | K21: =RC[-1]*100 -> 13000000
B22: 110 | C22: =RC[-1]/2*3 -> 165 | E22: 165 | J22: 140000 | K22: =RC[-1]*100 -> 14000000
B23: 120 | C23: =RC[-1]/2*3 -> 180 | E23: 180 | J23: 150000 | K23: =RC[-1]*100 -> 15000000
B24: 130 | C24: =RC[-1]/2*3 -> 195 | E24: 195 | J24: 160000 | K24: =RC[-1]*100 -> 16000000
B25: 140 | C25: =RC[-1]/2*3 -> 210 | E25: 210 | J25: 170000 | K25: =RC[-1]*100 -> 17000000
B26: 150 | C26: =RC[-1]/2*3 -> 225 | E26: 225 | J26: 180000 | K26: =RC[-1]*100 -> 18000000
B27: 162 | C27: =RC[-1]/2*3 -> 243 | E27: 243 | J27: 190000 | K27: =RC[-1]*100 -> 19000000
B28: 174 | C28: =RC[-1]/2*3 -> 261 | E28: 261 | J28: 200000 | K28: =RC[-1]*100 -> 20000000
B29: 186 | C29: =RC[-1]/2*3 -> 279 | E29: 279 | J29: 2200 | K29: =RC[-1]*100 -> 220000
B30: 198 | C30: =RC[-1]/2*3 -> 297 | E30: 297 | J30: 2600 | K30: =RC[-1]*100 -> 260000
B31: 210 | C31: =RC[-1]/2*3 -> 315 | E31: 315 | J31: 3000 | K31: =RC[-1]*100 -> 300000
B32: 224 | C32: =RC[-1]/2*3 -> 336 | E32: 336 | J32: 3500 | K32: =RC[-1]*100 -> 350000
B33: 238 | C33: =RC[-1]/2*3 -> 357 | E33: 357 | J33: 4000 | K33: =RC[-1]*100 -> 400000
B34: 252 | C34: =RC[-1]/2*3 -> 378 | E34: 378 | J34: 4500 | K34: =RC[-1]*100 -> 450000
B35: 266 | C35: =RC[-1]/2*3 -> 399 | E35: 399 | J35: 5000 | K35: =RC[-1]*100 -> 500000
B36: 280 | C36: =RC[-1]/2*3 -> 420 | E36: 420 | J36: 5500 | K36: =RC[-1]*100 -> 550000
B37: 296 | C37: =RC[-1]/2*3 -> 444 | E37: 444 | J37: 6000 | K37: =RC[-1]*100 -> 600000
B38: 312 | C38: =RC[-1]/2*3 -> 468 | E38: 468 | J38: 6500 | K38: =RC[-1]*100 -> 650000
B39: 328 | C39: =RC[-1]/2*3 -> 492 | E39: 492 | J39: 7000 | K39: =RC[-1]*100 -> 700000
B40: 344 | C40: =RC[-1]/2*3 -> 516 | E40: 516 | J40: 7500 | K40: =RC[-1]*100 -> 750000
B41: 360 | C41: =RC[-1]/2*3 -> 540 | E41: 540 | J41: 8000 | K41: =RC[-1]*100 -> 800000
B42: 380 | C42: =RC[-1]/2*3 -> 570 | E42: 570 | J42: 8500 | K42: =RC[-1]*100 -> 850000
B43: 400 | C43: =RC[-1]/2*3 -> 600 | E43: 600 | J43: 9000 | K43: =RC[-1]*100 -> 900000
B44: 440 | C44: =RC[-1]/2*3 -> 660 | E44: 660 | J44: 9500 | K44: =RC[-1]*100 -> 950000
B45: 480 | C45: =RC[-1]/2*3 -> 720 | E45: 720 | J45: 10000 | K45: =RC[-1]*100 -> 1000000
B46: 520 | C46: =RC[-1]/2*3 -> 780 | E46: 780
B47: 560 | C47: =RC[-1]/2*3 -> 840 | E47: 840
B48: 600 | C48: =RC[-1]/2*3 -> 900 | E48: 900
B49: 660 | C49: =RC[-1]/2*3 -> 990 | E49: 990
B50: 720 | C50: =RC[-1]/2*3 -> 1080 | E50: 1080
B51: 730 | C51: =RC[-1]/2*3 -> 1095 | E51: 1095