Sheet: ctQiLingGradeConf
B1: 道具ID,数量;
A2: nGrade | B2: tGradeCost | C2: nLevelLimit
A3: i | B3: t{ii} | C3: i
A4: 器灵品阶 | B4: 进阶所需道具 | C4: 人物等级要求
A5: 1 | B5: 10110,1; | C5: 0
A6: 2 | B6: 10110,2; | C6: 0
A7: 3 | B7: 10110,4; | C7: 0
A8: 4 | B8: 10110,6; | C8: 0
A9: 5 | B9: 10110,9; | C9: 20
A10: 6 | B10: 10110,12; | C10: 30
A11: 7 | B11: 10110,15; | C11: 35
A12: 8 | B12: 10110,20; | C12: 40
A13: 9 | B13: 10110,30; | C13: 45
A14: 10 | B14: 10110,40;10111,1; | C14: 50
A15: 11 | B15: 10110,60;10111,2; | C15: 55
A16: 12 | B16: 10110,80;10111,4; | C16: 60
A17: 13 | B17: 10110,100;10111,8; | C17: 65
A18: 14 | B18: 10110,150;10111,16; | C18: 70
A19: 15 | B19: 10110,200;10111,24; | C19: 75
A20: 16 | B20: 10110,300;10111,32; | C20: 80
A21: 17 | B21: 10110,500;10111,48; | C21: 85
A22: 18 | B22: 10110,600;10111,64; | C22: 90
A23: 19 | B23: 10110,800;10111,80; | C23: 95
A24: 20 | B24: 10110,1000;10111,100; | C24: 100

Sheet: Sheet2
A1: 配ABXY | C1: 1 | D1: 2 | E1: 3 | F1: 4 | G1: 5 | H1: 6 | J1: 定价 | K1: RMB | L1: 元宝 | M1: 金币 | N1: 经验值
B2: A | C2: 1.8 | D2: 1 | E2: 1.2 | F2: 0.5 | G2: 0.15 | H2: 2 | K2: 1 | L2: 10 | M2: 1000 | N2: 50
B3: B | C3: 3 | D3: 6 | E3: 2 | F3: 1 | G3: 1 | H3: 0 | J3: 低阶 | K3: 5 | L3: =RC[-1]*R[-1]C -> 50 | M3: =RC[-2]*R[-1]C -> 5000
B4: X | C4: 1 | D4: 5 | E4: 3 | F4: 0.5 | G4: 0.5 | H4: 5 | J4: 高阶 | K4: 15 | L4: =RC[-1]*R[-2]C -> 150 | M4: =RC[-2]*R[-2]C -> 15000 | O4: 调整进阶消耗
B5: Y | C5: 4 | D5: 6 | E5: 3 | F5: 2 | G5: 1 | H5: 0
C6: 1 | D6: 2 | E6: 3 | F6: 4 | G6: 5 | H6: 6 | I6: 经验 | J6: 累计经验 | K6: 消耗R值 | L6: 升阶消耗 | M6: 高阶消耗 | N6: 单消耗R值 | O6: 合消耗R值 | P6: R值大合计
A7: 等级 | B7: 品阶 | C7: 攻击 | D7: 防御 | E7: 生命 | F7: 灵力 | G7: 速度 | H7: 魔法 | I7: 100 | J7: =SUM(R7C9:RC9) -> 100 | K7: =RC10/R2C14 -> 2 | N7: =RC12*R3C11+RC13*R4C11 -> 0 | O7: =SUM(R7C14:RC14) -> 0 | P7: =RC11+RC15 -> 2
A8: 1 | B8: 0 | C8: =INT(R2C3*RC1+R3C3+R4C3*RC2+R5C3) -> 8 | D8: =INT(R2C4*RC1+R3C4+R4C4*RC2+R5C4) -> 13 | E8: =INT(R2C5*RC1+R3C5+R4C5*RC2+R5C5) -> 6 | F8: =INT(R2C6*RC1+R3C6+R4C6*RC2+R5C6) -> 3 | G8: =INT(R2C7*RC1+R3C7+R4C7*RC2+R5C7) -> 2 | H8: =INT(R2C8*RC1+R3C8+R4C8*RC2+R5C8) -> 2 | I8: 105 | J8: =SUM(R7C9:RC9) -> 205 | K8: =RC10/R2C14 -> 4.1 | N8: =RC12*R3C11+RC13*R4C11 -> 0 | O8: =SUM(R7C14:RC14) -> 0 | P8: =RC11+RC15 -> 4.1
A9: 2 | B9: 0 | C9: =INT(R2C3*RC1+R3C3+R4C3*RC2+R5C3) -> 10 | D9: =INT(R2C4*RC1+R3C4+R4C4*RC2+R5C4) -> 14 | E9: =INT(R2C5*RC1+R3C5+R4C5*RC2+R5C5) -> 7 | F9: =INT(R2C6*RC1+R3C6+R4C6*RC2+R5C6) -> 4 | G9: =INT(R2C7*RC1+R3C7+R4C7*RC2+R5C7) -> 2 | H9: =INT(R2C8*RC1+R3C8+R4C8*RC2+R5C8) -> 4 | I9: 110 | J9: =SUM(R7C9:RC9) -> 315 | K9: =RC10/R2C14 -> 6.3 | N9: =RC12*R3C11+RC13*R4C11 -> 0 | O9: =SUM(R7C14:RC14) -> 0 | P9: =RC11+RC15 -> 6.3
A10: 3 | B10: 0 | C10: =INT(R2C3*RC1+R3C3+R4C3*RC2+R5C3) -> 12 | D10: =INT(R2C4*RC1+R3C4+R4C4*RC2+R5C4) -> 15 | E10: =INT(R2C5*RC1+R3C5+R4C5*RC2+R5C5) -> 8 | F10: =INT(R2C6*RC1+R3C6+R4C6*RC2+R5C6) -> 4 | G10: =INT(R2C7*RC1+R3C7+R4C7*RC2+R5C7) -> 2 | H10: =INT(R2C8*RC1+R3C8+R4C8*RC2+R5C8) -> 6 | I10: 115 | J10: =SUM(R7C9:RC9) -> 430 | K10: =RC10/R2C14 -> 8.6 | N10: =RC12*R3C11+RC13*R4C11 -> 0 | O10: =SUM(R7C14:RC14) -> 0 | P10: =RC11+RC15 -> 8.6
A11: 4 | B11: 0 | C11: =INT(R2C3*RC1+R3C3+R4C3*RC2+R5C3) -> 14 | D11: =INT(R2C4*RC1+R3C4+R4C4*RC2+R5C4) -> 16 | E11: =INT(R2C5*RC1+R3C5+R4C5*RC2+R5C5) -> 9 | F11: =INT(R2C6*RC1+R3C6+R4C6*RC2+R5C6) -> 5 | G11: =INT(R2C7*RC1+R3C7+R4C7*RC2+R5C7) -> 2 | H11: =INT(R2C8*RC1+R3C8+R4C8*RC2+R5C8) -> 8 | I11: 120 | J11: =SUM(R7C9:RC9) -> 550 | K11: =RC10/R2C14 -> 11 | N11: =RC12*R3C11+RC13*R4C11 -> 0 | O11: =SUM(R7C14:RC14) -> 0 | P11: =RC11+RC15 -> 11
A12: 5 | B12: 0 | C12: =INT(R2C3*RC1+R3C3+R4C3*RC2+R5C3) -> 16 | D12: =INT(R2C4*RC1+R3C4+R4C4*RC2+R5C4) -> 17 | E12: =INT(R2C5*RC1+R3C5+R4C5*RC2+R5C5) -> 11 | F12: =INT(R2C6*RC1+R3C6+R4C6*RC2+R5C6) -> 5 | G12: =INT(R2C7*RC1+R3C7+R4C7*RC2+R5C7) -> 2 | H12: =INT(R2C8*RC1+R3C8+R4C8*RC2+R5C8) -> 10 | I12: 125 | J12: =SUM(R7C9:RC9) -> 675 | K12: =RC10/R2C14 -> 13.5 | N12: =RC12*R3C11+RC13*R4C11 -> 0 | O12: =SUM(R7C14:RC14) -> 0 | P12: =RC11+RC15 -> 13.5
A13: 6 | B13: 0 | C13: =INT(R2C3*RC1+R3C3+R4C3*RC2+R5C3) -> 17 | D13: =INT(R2C4*RC1+R3C4+R4C4*RC2+R5C4) -> 18 | E13: =INT(R2C5*RC1+R3C5+R4C5*RC2+R5C5) -> 12 | F13: =INT(R2C6*RC1+R3C6+R4C6*RC2+R5C6) -> 6 | G13: =INT(R2C7*RC1+R3C7+R4C7*RC2+R5C7) -> 2 | H13: =INT(R2C8*RC1+R3C8+R4C8*RC2+R5C8) -> 12 | I13: 130 | J13: =SUM(R7C9:RC9) -> 805 | K13: =RC10/R2C14 -> 16.1 | N13: =RC12*R3C11+RC13*R4C11 -> 0 | O13: =SUM(R7C14:RC14) -> 0 | P13: =RC11+RC15 -> 16.1
A14: 7 | B14: 0 | C14: =INT(R2C3*RC1+R3C3+R4C3*RC2+R5C3) -> 19 | D14: =INT(R2C4*RC1+R3C4+R4C4*RC2+R5C4) -> 19 | E14: =INT(R2C5*RC1+R3C5+R4C5*RC2+R5C5) -> 13 | F14: =INT(R2C6*RC1+R3C6+R4C6*RC2+R5C6) -> 6 | G14: =INT(R2C7*RC1+R3C7+R4C7*RC2+R5C7) -> 3 | H14: =INT(R2C8*RC1+R3C8+R4C8*RC2+R5C8) -> 14 | I14: 135 | J14: =SUM(R7C9:RC9) -> 940 | K14: =RC10/R2C14 -> 18.8 | N14: =RC12*R3C11+RC13*R4C11 -> 0 | O14: =SUM(R7C14:RC14) -> 0 | P14: =RC11+RC15 -> 18.8
A15: 8 | B15: 0 | C15: =INT(R2C3*RC1+R3C3+R4C3*RC2+R5C3) -> 21 | D15: =INT(R2C4*RC1+R3C4+R4C4*RC2+R5C4) -> 20 | E15: =INT(R2C5*RC1+R3C5+R4C5*RC2+R5C5) -> 14 | F15: =INT(R2C6*RC1+R3C6+R4C6*RC2+R5C6) -> 7 | G15: =INT(R2C7*RC1+R3C7+R4C7*RC2+R5C7) -> 3 | H15: =INT(R2C8*RC1+R3C8+R4C8*RC2+R5C8) -> 16 | I15: 140 | J15: =SUM(R7C9:RC9) -> 1080 | K15: =RC10/R2C14 -> 21.6 | N15: =RC12*R3C11+RC13*R4C11 -> 0 | O15: =SUM(R7C14:RC14) -> 0 | P15: =RC11+RC15 -> 21.6
A16: 9 | B16: 0 | C16: =INT(R2C3*RC1+R3C3+R4C3*RC2+R5C3) -> 23 | D16: =INT(R2C4*RC1+R3C4+R4C4*RC2+R5C4) -> 21 | E16: =INT(R2C5*RC1+R3C5+R4C5*RC2+R5C5) -> 15 | F16: =INT(R2C6*RC1+R3C6+R4C6*RC2+R5C6) -> 7 | G16: =INT(R2C7*RC1+R3C7+R4C7*RC2+R5C7) -> 3 | H16: =INT(R2C8*RC1+R3C8+R4C8*RC2+R5C8) -> 18 | I16: 145 | J16: =SUM(R7C9:RC9) -> 1225 | K16: =RC10/R2C14 -> 24.5 | N16: =RC12*R3C11+RC13*R4C11 -> 0 | O16: =SUM(R7C14:RC14) -> 0 | P16: =RC11+RC15 -> 24.5
A17: 10 | B17: 1 | C17: =INT(R2C3*RC1+R3C3+R4C3*RC2+R5C3) -> 26 | D17: =INT(R2C4*RC1+R3C4+R4C4*RC2+R5C4) -> 27 | E17: =INT(R2C5*RC1+R3C5+R4C5*RC2+R5C5) -> 20 | F17: =INT(R2C6*RC1+R3C6+R4C6*RC2+R5C6) -> 8 | G17: =INT(R2C7*RC1+R3C7+R4C7*RC2+R5C7) -> 4 | H17: =INT(R2C8*RC1+R3C8+R4C8*RC2+R5C8) -> 25 | I17: 150 | J17: =SUM(R7C9:RC9) -> 1375 | K17: =RC10/R2C14 -> 27.5 | L17: 1 | N17: =RC12*R3C11+RC13*R4C11 -> 5 | O17: =SUM(R7C14:RC14) -> 5 | P17: =RC11+RC15 -> 32.5
A18: 11 | B18: 1 | C18: =INT(R2C3*RC1+R3C3+R4C3*RC2+R5C3) -> 27 | D18: =INT(R2C4*RC1+R3C4+R4C4*RC2+R5C4) -> 28 | E18: =INT(R2C5*RC1+R3C5+R4C5*RC2+R5C5) -> 21 | F18: =INT(R2C6*RC1+R3C6+R4C6*RC2+R5C6) -> 9 | G18: =INT(R2C7*RC1+R3C7+R4C7*RC2+R5C7) -> 4 | H18: =INT(R2C8*RC1+R3C8+R4C8*RC2+R5C8) -> 27 | I18: 160 | J18: =SUM(R7C9:RC9) -> 1535 | K18: =RC10/R2C14 -> 30.7 | N18: =RC12*R3C11+RC13*R4C11 -> 0 | O18: =SUM(R7C14:RC14) -> 5 | P18: =RC11+RC15 -> 35.7
A19: 12 | B19: 1 | C19: =INT(R2C3*RC1+R3C3+R4C3*RC2+R5C3) -> 29 | D19: =INT(R2C4*RC1+R3C4+R4C4*RC2+R5C4) -> 29 | E19: =INT(R2C5*RC1+R3C5+R4C5*RC2+R5C5) -> 22 | F19: =INT(R2C6*RC1+R3C6+R4C6*RC2+R5C6) -> 9 | G19: =INT(R2C7*RC1+R3C7+R4C7*RC2+R5C7) -> 4 | H19: =INT(R2C8*RC1+R3C8+R4C8*RC2+R5C8) -> 29 | I19: 170 | J19: =SUM(R7C9:RC9) -> 1705 | K19: =RC10/R2C14 -> 34.1 | N19: =RC12*R3C11+RC13*R4C11 -> 0 | O19: =SUM(R7C14:RC14) -> 5 | P19: =RC11+RC15 -> 39.1
A20: 13 | B20: 1 | C20: =INT(R2C3*RC1+R3C3+R4C3*RC2+R5C3) -> 31 | D20: =INT(R2C4*RC1+R3C4+R4C4*RC2+R5C4) -> 30 | E20: =INT(R2C5*RC1+R3C5+R4C5*RC2+R5C5) -> 23 | F20: =INT(R2C6*RC1+R3C6+R4C6*RC2+R5C6) -> 10 | G20: =INT(R2C7*RC1+R3C7+R4C7*RC2+R5C7) -> 4 | H20: =INT(R2C8*RC1+R3C8+R4C8*RC2+R5C8) -> 31 | I20: 180 | J20: =SUM(R7C9:RC9) -> 1885 | K20: =RC10/R2C14 -> 37.7 | N20: =RC12*R3C11+RC13*R4C11 -> 0 | O20: =SUM(R7C14:RC14) -> 5 | P20: =RC11+RC15 -> 42.7
A21: 14 | B21: 1 | C21: =INT(R2C3*RC1+R3C3+R4C3*RC2+R5C3) -> 33 | D21: =INT(R2C4*RC1+R3C4+R4C4*RC2+R5C4) -> 31 | E21: =INT(R2C5*RC1+R3C5+R4C5*RC2+R5C5) -> 24 | F21: =INT(R2C6*RC1+R3C6+R4C6*RC2+R5C6) -> 10 | G21: =INT(R2C7*RC1+R3C7+R4C7*RC2+R5C7) -> 4 | H21: =INT(R2C8*RC1+R3C8+R4C8*RC2+R5C8) -> 33 | I21: 190 | J21: =SUM(R7C9:RC9) -> 2075 | K21: =RC10/R2C14 -> 41.5 | N21: =RC12*R3C11+RC13*R4C11 -> 0 | O21: =SUM(R7C14:RC14) -> 5 | P21: =RC11+RC15 -> 46.5
A22: 15 | B22: 1 | C22: =INT(R2C3*RC1+R3C3+R4C3*RC2+R5C3) -> 35 | D22: =INT(R2C4*RC1+R3C4+R4C4*RC2+R5C4) -> 32 | E22: =INT(R2C5*RC1+R3C5+R4C5*RC2+R5C5) -> 26 | F22: =INT(R2C6*RC1+R3C6+R4C6*RC2+R5C6) -> 11 | G22: =INT(R2C7*RC1+R3C7+R4C7*RC2+R5C7) -> 4 | H22: =INT(R2C8*RC1+R3C8+R4C8*RC2+R5C8) -> 35 | I22: 200 | J22: =SUM(R7C9:RC9) -> 2275 | K22: =RC10/R2C14 -> 45.5 | N22: =RC12*R3C11+RC13*R4C11 -> 0 | O22: =SUM(R7C14:RC14) -> 5 | P22: =RC11+RC15 -> 50.5
A23: 16 | B23: 1 | C23: =INT(R2C3*RC1+R3C3+R4C3*RC2+R5C3) -> 36 | D23: =INT(R2C4*RC1+R3C4+R4C4*RC2+R5C4) -> 33 | E23: =INT(R2C5*RC1+R3C5+R4C5*RC2+R5C5) -> 27 | F23: =INT(R2C6*RC1+R3C6+R4C6*RC2+R5C6) -> 11 | G23: =INT(R2C7*RC1+R3C7+R4C7*RC2+R5C7) -> 4 | H23: =INT(R2C8*RC1+R3C8+R4C8*RC2+R5C8) -> 37 | I23: 210 | J23: =SUM(R7C9:RC9) -> 2485 | K23: =RC10/R2C14 -> 49.7 | N23: =RC12*R3C11+RC13*R4C11 -> 0 | O23: =SUM(R7C14:RC14) -> 5 | P23: =RC11+RC15 -> 54.7
A24: 17 | B24: 1 | C24: =INT(R2C3*RC1+R3C3+R4C3*RC2+R5C3) -> 38 | D24: =INT(R2C4*RC1+R3C4+R4C4*RC2+R5C4) -> 34 | E24: =INT(R2C5*RC1+R3C5+R4C5*RC2+R5C5) -> 28 | F24: =INT(R2C6*RC1+R3C6+R4C6*RC2+R5C6) -> 12 | G24: =INT(R2C7*RC1+R3C7+R4C7*RC2+R5C7) -> 5 | H24: =INT(R2C8*RC1+R3C8+R4C8*RC2+R5C8) -> 39 | I24: 220 | J24: =SUM(R7C9:RC9) -> 2705 | K24: =RC10/R2C14 -> 54.1 | N24: =RC12*R3C11+RC13*R4C11 -> 0 | O24: =SUM(R7C14:RC14) -> 5 | P24: =RC11+RC15 -> 59.1
A25: 18 | B25: 1 | C25: =INT(R2C3*RC1+R3C3+R4C3*RC2+R5C3) -> 40 | D25: =INT(R2C4*RC1+R3C4+R4C4*RC2+R5C4) -> 35 | E25: =INT(R2C5*RC1+R3C5+R4C5*RC2+R5C5) -> 29 | F25: =INT(R2C6*RC1+R3C6+R4C6*RC2+R5C6) -> 12 | G25: =INT(R2C7*RC1+R3C7+R4C7*RC2+R5C7) -> 5 | H25: =INT(R2C8*RC1+R3C8+R4C8*RC2+R5C8) -> 41 | I25: 230 | J25: =SUM(R7C9:RC9) -> 2935 | K25: =RC10/R2C14 -> 58.7 | N25: =RC12*R3C11+RC13*R4C11 -> 0 | O25: =SUM(R7C14:RC14) -> 5 | P25: =RC11+RC15 -> 63.7
A26: 19 | B26: 1 | C26: =INT(R2C3*RC1+R3C3+R4C3*RC2+R5C3) -> 42 | D26: =INT(R2C4*RC1+R3C4+R4C4*RC2+R5C4) -> 36 | E26: =INT(R2C5*RC1+R3C5+R4C5*RC2+R5C5) -> 30 | F26: =INT(R2C6*RC1+R3C6+R4C6*RC2+R5C6) -> 13 | G26: =INT(R2C7*RC1+R3C7+R4C7*RC2+R5C7) -> 5 | H26: =INT(R2C8*RC1+R3C8+R4C8*RC2+R5C8) -> 43 | I26: 240 | J26: =SUM(R7C9:RC9) -> 3175 | K26: =RC10/R2C14 -> 63.5 | N26: =RC12*R3C11+RC13*R4C11 -> 0 | O26: =SUM(R7C14:RC14) -> 5 | P26: =RC11+RC15 -> 68.5
A27: 20 | B27: 2 | C27: =INT(R2C3*RC1+R3C3+R4C3*RC2+R5C3) -> 45 | D27: =INT(R2C4*RC1+R3C4+R4C4*RC2+R5C4) -> 42 | E27: =INT(R2C5*RC1+R3C5+R4C5*RC2+R5C5) -> 35 | F27: =INT(R2C6*RC1+R3C6+R4C6*RC2+R5C6) -> 14 | G27: =INT(R2C7*RC1+R3C7+R4C7*RC2+R5C7) -> 6 | H27: =INT(R2C8*RC1+R3C8+R4C8*RC2+R5C8) -> 50 | I27: 250 | J27: =SUM(R7C9:RC9) -> 3425 | K27: =RC10/R2C14 -> 68.5 | L27: 2 | N27: =RC12*R3C11+RC13*R4C11 -> 10 | O27: =SUM(R7C14:RC14) -> 15 | P27: =RC11+RC15 -> 83.5
A28: 21 | B28: 2 | C28: =INT(R2C3*RC1+R3C3+R4C3*RC2+R5C3) -> 46 | D28: =INT(R2C4*RC1+R3C4+R4C4*RC2+R5C4) -> 43 | E28: =INT(R2C5*RC1+R3C5+R4C5*RC2+R5C5) -> 36 | F28: =INT(R2C6*RC1+R3C6+R4C6*RC2+R5C6) -> 14 | G28: =INT(R2C7*RC1+R3C7+R4C7*RC2+R5C7) -> 6 | H28: =INT(R2C8*RC1+R3C8+R4C8*RC2+R5C8) -> 52 | I28: 265 | J28: =SUM(R7C9:RC9) -> 3690 | K28: =RC10/R2C14 -> 73.8 | N28: =RC12*R3C11+RC13*R4C11 -> 0 | O28: =SUM(R7C14:RC14) -> 15 | P28: =RC11+RC15 -> 88.8
A29: 22 | B29: 2 | C29: =INT(R2C3*RC1+R3C3+R4C3*RC2+R5C3) -> 48 | D29: =INT(R2C4*RC1+R3C4+R4C4*RC2+R5C4) -> 44 | E29: =INT(R2C5*RC1+R3C5+R4C5*RC2+R5C5) -> 37 | F29: =INT(R2C6*RC1+R3C6+R4C6*RC2+R5C6) -> 15 | G29: =INT(R2C7*RC1+R3C7+R4C7*RC2+R5C7) -> 6 | H29: =INT(R2C8*RC1+R3C8+R4C8*RC2+R5C8) -> 54 | I29: 270 | J29: =SUM(R7C9:RC9) -> 3960 | K29: =RC10/R2C14 -> 79.2 | N29: =RC12*R3C11+RC13*R4C11 -> 0 | O29: =SUM(R7C14:RC14) -> 15 | P29: =RC11+RC15 -> 94.2
A30: 23 | B30: 2 | C30: =INT(R2C3*RC1+R3C3+R4C3*RC2+R5C3) -> 50 | D30: =INT(R2C4*RC1+R3C4+R4C4*RC2+R5C4) -> 45 | E30: =INT(R2C5*RC1+R3C5+R4C5*RC2+R5C5) -> 38 | F30: =INT(R2C6*RC1+R3C6+R4C6*RC2+R5C6) -> 15 | G30: =INT(R2C7*RC1+R3C7+R4C7*RC2+R5C7) -> 6 | H30: =INT(R2C8*RC1+R3C8+R4C8*RC2+R5C8) -> 56 | I30: 280 | J30: =SUM(R7C9:RC9) -> 4240 | K30: =RC10/R2C14 -> 84.8 | N30: =RC12*R3C11+RC13*R4C11 -> 0 | O30: =SUM(R7C14:RC14) -> 15 | P30: =RC11+RC15 -> 99.8
A31: 24 | B31: 2 | C31: =INT(R2C3*RC1+R3C3+R4C3*RC2+R5C3) -> 52 | D31: =INT(R2C4*RC1+R3C4+R4C4*RC2+R5C4) -> 46 | E31: =INT(R2C5*RC1+R3C5+R4C5*RC2+R5C5) -> 39 | F31: =INT(R2C6*RC1+R3C6+R4C6*RC2+R5C6) -> 16 | G31: =INT(R2C7*RC1+R3C7+R4C7*RC2+R5C7) -> 6 | H31: =INT(R2C8*RC1+R3C8+R4C8*RC2+R5C8) -> 58 | I31: 290 | J31: =SUM(R7C9:RC9) -> 4530 | K31: =RC10/R2C14 -> 90.6 | N31: =RC12*R3C11+RC13*R4C11 -> 0 | O31: =SUM(R7C14:RC14) -> 15 | P31: =RC11+RC15 -> 105.6
A32: 25 | B32: 2 | C32: =INT(R2C3*RC1+R3C3+R4C3*RC2+R5C3) -> 54 | D32: =INT(R2C4*RC1+R3C4+R4C4*RC2+R5C4) -> 47 | E32: =INT(R2C5*RC1+R3C5+R4C5*RC2+R5C5) -> 41 | F32: =INT(R2C6*RC1+R3C6+R4C6*RC2+R5C6) -> 16 | G32: =INT(R2C7*RC1+R3C7+R4C7*RC2+R5C7) -> 6 | H32: =INT(R2C8*RC1+R3C8+R4C8*RC2+R5C8) -> 60 | I32: 300 | J32: =SUM(R7C9:RC9) -> 4830 | K32: =RC10/R2C14 -> 96.6 | N32: =RC12*R3C11+RC13*R4C11 -> 0 | O32: =SUM(R7C14:RC14) -> 15 | P32: =RC11+RC15 -> 111.6
A33: 26 | B33: 2 | C33: =INT(R2C3*RC1+R3C3+R4C3*RC2+R5C3) -> 55 | D33: =INT(R2C4*RC1+R3C4+R4C4*RC2+R5C4) -> 48 | E33: =INT(R2C5*RC1+R3C5+R4C5*RC2+R5C5) -> 42 | F33: =INT(R2C6*RC1+R3C6+R4C6*RC2+R5C6) -> 17 | G33: =INT(R2C7*RC1+R3C7+R4C7*RC2+R5C7) -> 6 | H33: =INT(R2C8*RC1+R3C8+R4C8*RC2+R5C8) -> 62 | I33: 310 | J33: =SUM(R7C9:RC9) -> 5140 | K33: =RC10/R2C14 -> 102.8 | N33: =RC12*R3C11+RC13*R4C11 -> 0 | O33: =SUM(R7C14:RC14) -> 15 | P33: =RC11+RC15 -> 117.8
A34: 27 | B34: 2 | C34: =INT(R2C3*RC1+R3C3+R4C3*RC2+R5C3) -> 57 | D34: =INT(R2C4*RC1+R3C4+R4C4*RC2+R5C4) -> 49 | E34: =INT(R2C5*RC1+R3C5+R4C5*RC2+R5C5) -> 43 | F34: =INT(R2C6*RC1+R3C6+R4C6*RC2+R5C6) -> 17 | G34: =INT(R2C7*RC1+R3C7+R4C7*RC2+R5C7) -> 7 | H34: =INT(R2C8*RC1+R3C8+R4C8*RC2+R5C8) -> 64 | I34: 320 | J34: =SUM(R7C9:RC9) -> 5460 | K34: =RC10/R2C14 -> 109.2 | N34: =RC12*R3C11+RC13*R4C11 -> 0 | O34: =SUM(R7C14:RC14) -> 15 | P34: =RC11+RC15 -> 124.2
A35: 28 | B35: 2 | C35: =INT(R2C3*RC1+R3C3+R4C3*RC2+R5C3) -> 59 | D35: =INT(R2C4*RC1+R3C4+R4C4*RC2+R5C4) -> 50 | E35: =INT(R2C5*RC1+R3C5+R4C5*RC2+R5C5) -> 44 | F35: =INT(R2C6*RC1+R3C6+R4C6*RC2+R5C6) -> 18 | G35: =INT(R2C7*RC1+R3C7+R4C7*RC2+R5C7) -> 7 | H35: =INT(R2C8*RC1+R3C8+R4C8*RC2+R5C8) -> 66 | I35: 330 | J35: =SUM(R7C9:RC9) -> 5790 | K35: =RC10/R2C14 -> 115.8 | N35: =RC12*R3C11+RC13*R4C11 -> 0 | O35: =SUM(R7C14:RC14) -> 15 | P35: =RC11+RC15 -> 130.8
A36: 29 | B36: 2 | C36: =INT(R2C3*RC1+R3C3+R4C3*RC2+R5C3) -> 61 | D36: =INT(R2C4*RC1+R3C4+R4C4*RC2+R5C4) -> 51 | E36: =INT(R2C5*RC1+R3C5+R4C5*RC2+R5C5) -> 45 | F36: =INT(R2C6*RC1+R3C6+R4C6*RC2+R5C6) -> 18 | G36: =INT(R2C7*RC1+R3C7+R4C7*RC2+R5C7) -> 7 | H36: =INT(R2C8*RC1+R3C8+R4C8*RC2+R5C8) -> 68 | I36: 340 | J36: =SUM(R7C9:RC9) -> 6130 | K36: =RC10/R2C14 -> 122.6 | N36: =RC12*R3C11+RC13*R4C11 -> 0 | O36: =SUM(R7C14:RC14) -> 15 | P36: =RC11+RC15 -> 137.6
A37: 30 | B37: 3 | C37: =INT(R2C3*RC1+R3C3+R4C3*RC2+R5C3) -> 64 | D37: =INT(R2C4*RC1+R3C4+R4C4*RC2+R5C4) -> 57 | E37: =INT(R2C5*RC1+R3C5+R4C5*RC2+R5C5) -> 50 | F37: =INT(R2C6*RC1+R3C6+R4C6*RC2+R5C6) -> 19 | G37: =INT(R2C7*RC1+R3C7+R4C7*RC2+R5C7) -> 8 | H37: =INT(R2C8*RC1+R3C8+R4C8*RC2+R5C8) -> 75 | I37: 350 | J37: =SUM(R7C9:RC9) -> 6480 | K37: =RC10/R2C14 -> 129.6 | L37: 4 | N37: =RC12*R3C11+RC13*R4C11 -> 20 | O37: =SUM(R7C14:RC14) -> 35 | P37: =RC11+RC15 -> 164.6
A38: 31 | B38: 3 | C38: =INT(R2C3*RC1+R3C3+R4C3*RC2+R5C3) -> 65 | D38: =INT(R2C4*RC1+R3C4+R4C4*RC2+R5C4) -> 58 | E38: =INT(R2C5*RC1+R3C5+R4C5*RC2+R5C5) -> 51 | F38: =INT(R2C6*RC1+R3C6+R4C6*RC2+R5C6) -> 20 | G38: =INT(R2C7*RC1+R3C7+R4C7*RC2+R5C7) -> 8 | H38: =INT(R2C8*RC1+R3C8+R4C8*RC2+R5C8) -> 77 | I38: 370 | J38: =SUM(R7C9:RC9) -> 6850 | K38: =RC10/R2C14 -> 137 | N38: =RC12*R3C11+RC13*R4C11 -> 0 | O38: =SUM(R7C14:RC14) -> 35 | P38: =RC11+RC15 -> 172
A39: 32 | B39: 3 | C39: =INT(R2C3*RC1+R3C3+R4C3*RC2+R5C3) -> 67 | D39: =INT(R2C4*RC1+R3C4+R4C4*RC2+R5C4) -> 59 | E39: =INT(R2C5*RC1+R3C5+R4C5*RC2+R5C5) -> 52 | F39: =INT(R2C6*RC1+R3C6+R4C6*RC2+R5C6) -> 20 | G39: =INT(R2C7*RC1+R3C7+R4C7*RC2+R5C7) -> 8 | H39: =INT(R2C8*RC1+R3C8+R4C8*RC2+R5C8) -> 79 | I39: 390 | J39: =SUM(R7C9:RC9) -> 7240 | K39: =RC10/R2C14 -> 144.8 | N39: =RC12*R3C11+RC13*R4C11 -> 0 | O39: =SUM(R7C14:RC14) -> 35 | P39: =RC11+RC15 -> 179.8
A40: 33 | B40: 3 | C40: =INT(R2C3*RC1+R3C3+R4C3*RC2+R5C3) -> 69 | D40: =INT(R2C4*RC1+R3C4+R4C4*RC2+R5C4) -> 60 | E40: =INT(R2C5*RC1+R3C5+R4C5*RC2+R5C5) -> 53 | F40: =INT(R2C6*RC1+R3C6+R4C6*RC2+R5C6) -> 21 | G40: =INT(R2C7*RC1+R3C7+R4C7*RC2+R5C7) -> 8 | H40: =INT(R2C8*RC1+R3C8+R4C8*RC2+R5C8) -> 81 | I40: 410 | J40: =SUM(R7C9:RC9) -> 7650 | K40: =RC10/R2C14 -> 153 | N40: =RC12*R3C11+RC13*R4C11 -> 0 | O40: =SUM(R7C14:RC14) -> 35 | P40: =RC11+RC15 -> 188
A41: 34 | B41: 3 | C41: =INT(R2C3*RC1+R3C3+R4C3*RC2+R5C3) -> 71 | D41: =INT(R2C4*RC1+R3C4+R4C4*RC2+R5C4) -> 61 | E41: =INT(R2C5*RC1+R3C5+R4C5*RC2+R5C5) -> 54 | F41: =INT(R2C6*RC1+R3C6+R4C6*RC2+R5C6) -> 21 | G41: =INT(R2C7*RC1+R3C7+R4C7*RC2+R5C7) -> 8 | H41: =INT(R2C8*RC1+R3C8+R4C8*RC2+R5C8) -> 83 | I41: 430 | J41: =SUM(R7C9:RC9) -> 8080 | K41: =RC10/R2C14 -> 161.6 | N41: =RC12*R3C11+RC13*R4C11 -> 0 | O41: =SUM(R7C14:RC14) -> 35 | P41: =RC11+RC15 -> 196.6
A42: 35 | B42: 3 | C42: =INT(R2C3*RC1+R3C3+R4C3*RC2+R5C3) -> 73 | D42: =INT(R2C4*RC1+R3C4+R4C4*RC2+R5C4) -> 62 | E42: =INT(R2C5*RC1+R3C5+R4C5*RC2+R5C5) -> 56 | F42: =INT(R2C6*RC1+R3C6+R4C6*RC2+R5C6) -> 22 | G42: =INT(R2C7*RC1+R3C7+R4C7*RC2+R5C7) -> 8 | H42: =INT(R2C8*RC1+R3C8+R4C8*RC2+R5C8) -> 85 | I42: 450 | J42: =SUM(R7C9:RC9) -> 8530 | K42: =RC10/R2C14 -> 170.6 | N42: =RC12*R3C11+RC13*R4C11 -> 0 | O42: =SUM(R7C14:RC14) -> 35 | P42: =RC11+RC15 -> 205.6
A43: 36 | B43: 3 | C43: =INT(R2C3*RC1+R3C3+R4C3*RC2+R5C3) -> 74 | D43: =INT(R2C4*RC1+R3C4+R4C4*RC2+R5C4) -> 63 | E43: =INT(R2C5*RC1+R3C5+R4C5*RC2+R5C5) -> 57 | F43: =INT(R2C6*RC1+R3C6+R4C6*RC2+R5C6) -> 22 | G43: =INT(R2C7*RC1+R3C7+R4C7*RC2+R5C7) -> 8 | H43: =INT(R2C8*RC1+R3C8+R4C8*RC2+R5C8) -> 87 | I43: 470 | J43: =SUM(R7C9:RC9) -> 9000 | K43: =RC10/R2C14 -> 180 | N43: =RC12*R3C11+RC13*R4C11 -> 0 | O43: =SUM(R7C14:RC14) -> 35 | P43: =RC11+RC15 -> 215
A44: 37 | B44: 3 | C44: =INT(R2C3*RC1+R3C3+R4C3*RC2+R5C3) -> 76 | D44: =INT(R2C4*RC1+R3C4+R4C4*RC2+R5C4) -> 64 | E44: =INT(R2C5*RC1+R3C5+R4C5*RC2+R5C5) -> 58 | F44: =INT(R2C6*RC1+R3C6+R4C6*RC2+R5C6) -> 23 | G44: =INT(R2C7*RC1+R3C7+R4C7*RC2+R5C7) -> 9 | H44: =INT(R2C8*RC1+R3C8+R4C8*RC2+R5C8) -> 89 | I44: 490 | J44: =SUM(R7C9:RC9) -> 9490 | K44: =RC10/R2C14 -> 189.8 | N44: =RC12*R3C11+RC13*R4C11 -> 0 | O44: =SUM(R7C14:RC14) -> 35 | P44: =RC11+RC15 -> 224.8
A45: 38 | B45: 3 | C45: =INT(R2C3*RC1+R3C3+R4C3*RC2+R5C3) -> 78 | D45: =INT(R2C4*RC1+R3C4+R4C4*RC2+R5C4) -> 65 | E45: =INT(R2C5*RC1+R3C5+R4C5*RC2+R5C5) -> 59 | F45: =INT(R2C6*RC1+R3C6+R4C6*RC2+R5C6) -> 23 | G45: =INT(R2C7*RC1+R3C7+R4C7*RC2+R5C7) -> 9 | H45: =INT(R2C8*RC1+R3C8+R4C8*RC2+R5C8) -> 91 | I45: 510 | J45: =SUM(R7C9:RC9) -> 10000 | K45: =RC10/R2C14 -> 200 | N45: =RC12*R3C11+RC13*R4C11 -> 0 | O45: =SUM(R7C14:RC14) -> 35 | P45: =RC11+RC15 -> 235
A46: 39 | B46: 3 | C46: =INT(R2C3*RC1+R3C3+R4C3*RC2+R5C3) -> 80 | D46: =INT(R2C4*RC1+R3C4+R4C4*RC2+R5C4) -> 66 | E46: =INT(R2C5*RC1+R3C5+R4C5*RC2+R5C5) -> 60 | F46: =INT(R2C6*RC1+R3C6+R4C6*RC2+R5C6) -> 24 | G46: =INT(R2C7*RC1+R3C7+R4C7*RC2+R5C7) -> 9 | H46: =INT(R2C8*RC1+R3C8+R4C8*RC2+R5C8) -> 93 | I46: 530 | J46: =SUM(R7C9:RC9) -> 10530 | K46: =RC10/R2C14 -> 210.6 | N46: =RC12*R3C11+RC13*R4C11 -> 0 | O46: =SUM(R7C14:RC14) -> 35 | P46: =RC11+RC15 -> 245.6
A47: 40 | B47: 4 | C47: =INT(R2C3*RC1+R3C3+R4C3*RC2+R5C3) -> 83 | D47: =INT(R2C4*RC1+R3C4+R4C4*RC2+R5C4) -> 72 | E47: =INT(R2C5*RC1+R3C5+R4C5*RC2+R5C5) -> 65 | F47: =INT(R2C6*RC1+R3C6+R4C6*RC2+R5C6) -> 25 | G47: =INT(R2C7*RC1+R3C7+R4C7*RC2+R5C7) -> 10 | H47: =INT(R2C8*RC1+R3C8+R4C8*RC2+R5C8) -> 100 | I47: 550 | J47: =SUM(R7C9:RC9) -> 11080 | K47: =RC10/R2C14 -> 221.6 | L47: 6 | N47: =RC12*R3C11+RC13*R4C11 -> 30 | O47: =SUM(R7C14:RC14) -> 65 | P47: =RC11+RC15 -> 286.6
A48: 41 | B48: 4 | C48: =INT(R2C3*RC1+R3C3+R4C3*RC2+R5C3) -> 84 | D48: =INT(R2C4*RC1+R3C4+R4C4*RC2+R5C4) -> 73 | E48: =INT(R2C5*RC1+R3C5+R4C5*RC2+R5C5) -> 66 | F48: =INT(R2C6*RC1+R3C6+R4C6*RC2+R5C6) -> 25 | G48: =INT(R2C7*RC1+R3C7+R4C7*RC2+R5C7) -> 10 | H48: =INT(R2C8*RC1+R3C8+R4C8*RC2+R5C8) -> 102 | I48: 575 | J48: =SUM(R7C9:RC9) -> 11655 | K48: =RC10/R2C14 -> 233.1 | N48: =RC12*R3C11+RC13*R4C11 -> 0 | O48: =SUM(R7C14:RC14) -> 65 | P48: =RC11+RC15 -> 298.1
A49: 42 | B49: 4 | C49: =INT(R2C3*RC1+R3C3+R4C3*RC2+R5C3) -> 86 | D49: =INT(R2C4*RC1+R3C4+R4C4*RC2+R5C4) -> 74 | E49: =INT(R2C5*RC1+R3C5+R4C5*RC2+R5C5) -> 67 | F49: =INT(R2C6*RC1+R3C6+R4C6*RC2+R5C6) -> 26 | G49: =INT(R2C7*RC1+R3C7+R4C7*RC2+R5C7) -> 10 | H49: =INT(R2C8*RC1+R3C8+R4C8*RC2+R5C8) -> 104 | I49: 600 | J49: =SUM(R7C9:RC9) -> 12255 | K49: =RC10/R2C14 -> 245.1 | N49: =RC12*R3C11+RC13*R4C11 -> 0 | O49: =SUM(R7C14:RC14) -> 65 | P49: =RC11+RC15 -> 310.1
A50: 43 | B50: 4 | C50: =INT(R2C3*RC1+R3C3+R4C3*RC2+R5C3) -> 88 | D50: =INT(R2C4*RC1+R3C4+R4C4*RC2+R5C4) -> 75 | E50: =INT(R2C5*RC1+R3C5+R4C5*RC2+R5C5) -> 68 | F50: =INT(R2C6*RC1+R3C6+R4C6*RC2+R5C6) -> 26 | G50: =INT(R2C7*RC1+R3C7+R4C7*RC2+R5C7) -> 10 | H50: =INT(R2C8*RC1+R3C8+R4C8*RC2+R5C8) -> 106 | I50: 625 | J50: =SUM(R7C9:RC9) -> 12880 | K50: =RC10/R2C14 -> 257.6 | N50: =RC12*R3C11+RC13*R4C11 -> 0 | O50: =SUM(R7C14:RC14) -> 65 | P50: =RC11+RC15 -> 322.6
A51: 44 | B51: 4 | C51: =INT(R2C3*RC1+R3C3+R4C3*RC2+R5C3) -> 90 | D51: =INT(R2C4*RC1+R3C4+R4C4*RC2+R5C4) -> 76 | E51: =INT(R2C5*RC1+R3C5+R4C5*RC2+R5C5) -> 69 | F51: =INT(R2C6*RC1+R3C6+R4C6*RC2+R5C6) -> 27 | G51: =INT(R2C7*RC1+R3C7+R4C7*RC2+R5C7) -> 10 | H51: =INT(R2C8*RC1+R3C8+R4C8*RC2+R5C8) -> 108 | I51: 650 | J51: =SUM(R7C9:RC9) -> 13530 | K51: =RC10/R2C14 -> 270.6 | N51: =RC12*R3C11+RC13*R4C11 -> 0 | O51: =SUM(R7C14:RC14) -> 65 | P51: =RC11+RC15 -> 335.6
A52: 45 | B52: 4 | C52: =INT(R2C3*RC1+R3C3+R4C3*RC2+R5C3) -> 92 | D52: =INT(R2C4*RC1+R3C4+R4C4*RC2+R5C4) -> 77 | E52: =INT(R2C5*RC1+R3C5+R4C5*RC2+R5C5) -> 71 | F52: =INT(R2C6*RC1+R3C6+R4C6*RC2+R5C6) -> 27 | G52: =INT(R2C7*RC1+R3C7+R4C7*RC2+R5C7) -> 10 | H52: =INT(R2C8*RC1+R3C8+R4C8*RC2+R5C8) -> 110 | I52: 675 | J52: =SUM(R7C9:RC9) -> 14205 | K52: =RC10/R2C14 -> 284.1 | N52: =RC12*R3C11+RC13*R4C11 -> 0 | O52: =SUM(R7C14:RC14) -> 65 | P52: =RC11+RC15 -> 349.1
A53: 46 | B53: 4 | C53: =INT(R2C3*RC1+R3C3+R4C3*RC2+R5C3) -> 93 | D53: =INT(R2C4*RC1+R3C4+R4C4*RC2+R5C4) -> 78 | E53: =INT(R2C5*RC1+R3C5+R4C5*RC2+R5C5) -> 72 | F53: =INT(R2C6*RC1+R3C6+R4C6*RC2+R5C6) -> 28 | G53: =INT(R2C7*RC1+R3C7+R4C7*RC2+R5C7) -> 10 | H53: =INT(R2C8*RC1+R3C8+R4C8*RC2+R5C8) -> 112 | I53: 700 | J53: =SUM(R7C9:RC9) -> 14905 | K53: =RC10/R2C14 -> 298.1 | N53: =RC12*R3C11+RC13*R4C11 -> 0 | O53: =SUM(R7C14:RC14) -> 65 | P53: =RC11+RC15 -> 363.1
A54: 47 | B54: 4 | C54: =INT(R2C3*RC1+R3C3+R4C3*RC2+R5C3) -> 95 | D54: =INT(R2C4*RC1+R3C4+R4C4*RC2+R5C4) -> 79 | E54: =INT(R2C5*RC1+R3C5+R4C5*RC2+R5C5) -> 73 | F54: =INT(R2C6*RC1+R3C6+R4C6*RC2+R5C6) -> 28 | G54: =INT(R2C7*RC1+R3C7+R4C7*RC2+R5C7) -> 11 | H54: =INT(R2C8*RC1+R3C8+R4C8*RC2+R5C8) -> 114 | I54: 725 | J54: =SUM(R7C9:RC9) -> 15630 | K54: =RC10/R2C14 -> 312.6 | N54: =RC12*R3C11+RC13*R4C11 -> 0 | O54: =SUM(R7C14:RC14) -> 65 | P54: =RC11+RC15 -> 377.6
A55: 48 | B55: 4 | C55: =INT(R2C3*RC1+R3C3+R4C3*RC2+R5C3) -> 97 | D55: =INT(R2C4*RC1+R3C4+R4C4*RC2+R5C4) -> 80 | E55: =INT(R2C5*RC1+R3C5+R4C5*RC2+R5C5) -> 74 | F55: =INT(R2C6*RC1+R3C6+R4C6*RC2+R5C6) -> 29 | G55: =INT(R2C7*RC1+R3C7+R4C7*RC2+R5C7) -> 11 | H55: =INT(R2C8*RC1+R3C8+R4C8*RC2+R5C8) -> 116 | I55: 750 | J55: =SUM(R7C9:RC9) -> 16380 | K55: =RC10/R2C14 -> 327.6 | N55: =RC12*R3C11+RC13*R4C11 -> 0 | O55: =SUM(R7C14:RC14) -> 65 | P55: =RC11+RC15 -> 392.6
A56: 49 | B56: 4 | C56: =INT(R2C3*RC1+R3C3+R4C3*RC2+R5C3) -> 99 | D56: =INT(R2C4*RC1+R3C4+R4C4*RC2+R5C4) -> 81 | E56: =INT(R2C5*RC1+R3C5+R4C5*RC2+R5C5) -> 75 | F56: =INT(R2C6*RC1+R3C6+R4C6*RC2+R5C6) -> 29 | G56: =INT(R2C7*RC1+R3C7+R4C7*RC2+R5C7) -> 11 | H56: =INT(R2C8*RC1+R3C8+R4C8*RC2+R5C8) -> 118 | I56: 775 | J56: =SUM(R7C9:RC9) -> 17155 | K56: =RC10/R2C14 -> 343.1 | N56: =RC12*R3C11+RC13*R4C11 -> 0 | O56: =SUM(R7C14:RC14) -> 65 | P56: =RC11+RC15 -> 408.1
A57: 50 | B57: 5 | C57: =INT(R2C3*RC1+R3C3+R4C3*RC2+R5C3) -> 102 | D57: =INT(R2C4*RC1+R3C4+R4C4*RC2+R5C4) -> 87 | E57: =INT(R2C5*RC1+R3C5+R4C5*RC2+R5C5) -> 80 | F57: =INT(R2C6*RC1+R3C6+R4C6*RC2+R5C6) -> 30 | G57: =INT(R2C7*RC1+R3C7+R4C7*RC2+R5C7) -> 12 | H57: =INT(R2C8*RC1+R3C8+R4C8*RC2+R5C8) -> 125 | I57: 800 | J57: =SUM(R7C9:RC9) -> 17955 | K57: =RC10/R2C14 -> 359.1 | L57: 9 | N57: =RC12*R3C11+RC13*R4C11 -> 45 | O57: =SUM(R7C14:RC14) -> 110 | P57: =RC11+RC15 -> 469.1
A58: 51 | B58: 5 | C58: =INT(R2C3*RC1+R3C3+R4C3*RC2+R5C3) -> 103 | D58: =INT(R2C4*RC1+R3C4+R4C4*RC2+R5C4) -> 88 | E58: =INT(R2C5*RC1+R3C5+R4C5*RC2+R5C5) -> 81 | F58: =INT(R2C6*RC1+R3C6+R4C6*RC2+R5C6) -> 31 | G58: =INT(R2C7*RC1+R3C7+R4C7*RC2+R5C7) -> 12 | H58: =INT(R2C8*RC1+R3C8+R4C8*RC2+R5C8) -> 127 | I58: 830 | J58: =SUM(R7C9:RC9) -> 18785 | K58: =RC10/R2C14 -> 375.7 | N58: =RC12*R3C11+RC13*R4C11 -> 0 | O58: =SUM(R7C14:RC14) -> 110 | P58: =RC11+RC15 -> 485.7
A59: 52 | B59: 5 | C59: =INT(R2C3*RC1+R3C3+R4C3*RC2+R5C3) -> 105 | D59: =INT(R2C4*RC1+R3C4+R4C4*RC2+R5C4) -> 89 | E59: =INT(R2C5*RC1+R3C5+R4C5*RC2+R5C5) -> 82 | F59: =INT(R2C6*RC1+R3C6+R4C6*RC2+R5C6) -> 31 | G59: =INT(R2C7*RC1+R3C7+R4C7*RC2+R5C7) -> 12 | H59: =INT(R2C8*RC1+R3C8+R4C8*RC2+R5C8) -> 129 | I59: 860 | J59: =SUM(R7C9:RC9) -> 19645 | K59: =RC10/R2C14 -> 392.9 | N59: =RC12*R3C11+RC13*R4C11 -> 0 | O59: =SUM(R7C14:RC14) -> 110 | P59: =RC11+RC15 -> 502.9
A60: 53 | B60: 5 | C60: =INT(R2C3*RC1+R3C3+R4C3*RC2+R5C3) -> 107 | D60: =INT(R2C4*RC1+R3C4+R4C4*RC2+R5C4) -> 90 | E60: =INT(R2C5*RC1+R3C5+R4C5*RC2+R5C5) -> 83 | F60: =INT(R2C6*RC1+R3C6+R4C6*RC2+R5C6) -> 32 | G60: =INT(R2C7*RC1+R3C7+R4C7*RC2+R5C7) -> 12 | H60: =INT(R2C8*RC1+R3C8+R4C8*RC2+R5C8) -> 131 | I60: 890 | J60: =SUM(R7C9:RC9) -> 20535 | K60: =RC10/R2C14 -> 410.7 | N60: =RC12*R3C11+RC13*R4C11 -> 0 | O60: =SUM(R7C14:RC14) -> 110 | P60: =RC11+RC15 -> 520.7
A61: 54 | B61: 5 | C61: =INT(R2C3*RC1+R3C3+R4C3*RC2+R5C3) -> 109 | D61: =INT(R2C4*RC1+R3C4+R4C4*RC2+R5C4) -> 91 | E61: =INT(R2C5*RC1+R3C5+R4C5*RC2+R5C5) -> 84 | F61: =INT(R2C6*RC1+R3C6+R4C6*RC2+R5C6) -> 32 | G61: =INT(R2C7*RC1+R3C7+R4C7*RC2+R5C7) -> 12 | H61: =INT(R2C8*RC1+R3C8+R4C8*RC2+R5C8) -> 133 | I61: 920 | J61: =SUM(R7C9:RC9) -> 21455 | K61: =RC10/R2C14 -> 429.1 | N61: =RC12*R3C11+RC13*R4C11 -> 0 | O61: =SUM(R7C14:RC14) -> 110 | P61: =RC11+RC15 -> 539.1
A62: 55 | B62: 5 | C62: =INT(R2C3*RC1+R3C3+R4C3*RC2+R5C3) -> 111 | D62: =INT(R2C4*RC1+R3C4+R4C4*RC2+R5C4) -> 92 | E62: =INT(R2C5*RC1+R3C5+R4C5*RC2+R5C5) -> 86 | F62: =INT(R2C6*RC1+R3C6+R4C6*RC2+R5C6) -> 33 | G62: =INT(R2C7*RC1+R3C7+R4C7*RC2+R5C7) -> 12 | H62: =INT(R2C8*RC1+R3C8+R4C8*RC2+R5C8) -> 135 | I62: 950 | J62: =SUM(R7C9:RC9) -> 22405 | K62: =RC10/R2C14 -> 448.1 | N62: =RC12*R3C11+RC13*R4C11 -> 0 | O62: =SUM(R7C14:RC14) -> 110 | P62: =RC11+RC15 -> 558.1
A63: 56 | B63: 5 | C63: =INT(R2C3*RC1+R3C3+R4C3*RC2+R5C3) -> 112 | D63: =INT(R2C4*RC1+R3C4+R4C4*RC2+R5C4) -> 93 | E63: =INT(R2C5*RC1+R3C5+R4C5*RC2+R5C5) -> 87 | F63: =INT(R2C6*RC1+R3C6+R4C6*RC2+R5C6) -> 33 | G63: =INT(R2C7*RC1+R3C7+R4C7*RC2+R5C7) -> 12 | H63: =INT(R2C8*RC1+R3C8+R4C8*RC2+R5C8) -> 137 | I63: 980 | J63: =SUM(R7C9:RC9) -> 23385 | K63: =RC10/R2C14 -> 467.7 | N63: =RC12*R3C11+RC13*R4C11 -> 0 | O63: =SUM(R7C14:RC14) -> 110 | P63: =RC11+RC15 -> 577.7
A64: 57 | B64: 5 | C64: =INT(R2C3*RC1+R3C3+R4C3*RC2+R5C3) -> 114 | D64: =INT(R2C4*RC1+R3C4+R4C4*RC2+R5C4) -> 94 | E64: =INT(R2C5*RC1+R3C5+R4C5*RC2+R5C5) -> 88 | F64: =INT(R2C6*RC1+R3C6+R4C6*RC2+R5C6) -> 34 | G64: =INT(R2C7*RC1+R3C7+R4C7*RC2+R5C7) -> 13 | H64: =INT(R2C8*RC1+R3C8+R4C8*RC2+R5C8) -> 139 | I64: 1010 | J64: =SUM(R7C9:RC9) -> 24395 | K64: =RC10/R2C14 -> 487.9 | N64: =RC12*R3C11+RC13*R4C11 -> 0 | O64: =SUM(R7C14:RC14) -> 110 | P64: =RC11+RC15 -> 597.9
A65: 58 | B65: 5 | C65: =INT(R2C3*RC1+R3C3+R4C3*RC2+R5C3) -> 116 | D65: =INT(R2C4*RC1+R3C4+R4C4*RC2+R5C4) -> 95 | E65: =INT(R2C5*RC1+R3C5+R4C5*RC2+R5C5) -> 89 | F65: =INT(R2C6*RC1+R3C6+R4C6*RC2+R5C6) -> 34 | G65: =INT(R2C7*RC1+R3C7+R4C7*RC2+R5C7) -> 13 | H65: =INT(R2C8*RC1+R3C8+R4C8*RC2+R5C8) -> 141 | I65: 1040 | J65: =SUM(R7C9:RC9) -> 25435 | K65: =RC10/R2C14 -> 508.7 | N65: =RC12*R3C11+RC13*R4C11 -> 0 | O65: =SUM(R7C14:RC14) -> 110 | P65: =RC11+RC15 -> 618.7
A66: 59 | B66: 5 | C66: =INT(R2C3*RC1+R3C3+R4C3*RC2+R5C3) -> 118 | D66: =INT(R2C4*RC1+R3C4+R4C4*RC2+R5C4) -> 96 | E66: =INT(R2C5*RC1+R3C5+R4C5*RC2+R5C5) -> 90 | F66: =INT(R2C6*RC1+R3C6+R4C6*RC2+R5C6) -> 35 | G66: =INT(R2C7*RC1+R3C7+R4C7*RC2+R5C7) -> 13 | H66: =INT(R2C8*RC1+R3C8+R4C8*RC2+R5C8) -> 143 | I66: 1070 | J66: =SUM(R7C9:RC9) -> 26505 | K66: =RC10/R2C14 -> 530.1 | N66: =RC12*R3C11+RC13*R4C11 -> 0 | O66: =SUM(R7C14:RC14) -> 110 | P66: =RC11+RC15 -> 640.1
A67: 60 | B67: 6 | C67: =INT(R2C3*RC1+R3C3+R4C3*RC2+R5C3) -> 121 | D67: =INT(R2C4*RC1+R3C4+R4C4*RC2+R5C4) -> 102 | E67: =INT(R2C5*RC1+R3C5+R4C5*RC2+R5C5) -> 95 | F67: =INT(R2C6*RC1+R3C6+R4C6*RC2+R5C6) -> 36 | G67: =INT(R2C7*RC1+R3C7+R4C7*RC2+R5C7) -> 14 | H67: =INT(R2C8*RC1+R3C8+R4C8*RC2+R5C8) -> 150 | I67: 1100 | J67: =SUM(R7C9:RC9) -> 27605 | K67: =RC10/R2C14 -> 552.1 | L67: 12 | N67: =RC12*R3C11+RC13*R4C11 -> 60 | O67: =SUM(R7C14:RC14) -> 170 | P67: =RC11+RC15 -> 722.1
A68: 61 | B68: 6 | C68: =INT(R2C3*RC1+R3C3+R4C3*RC2+R5C3) -> 122 | D68: =INT(R2C4*RC1+R3C4+R4C4*RC2+R5C4) -> 103 | E68: =INT(R2C5*RC1+R3C5+R4C5*RC2+R5C5) -> 96 | F68: =INT(R2C6*RC1+R3C6+R4C6*RC2+R5C6) -> 36 | G68: =INT(R2C7*RC1+R3C7+R4C7*RC2+R5C7) -> 14 | H68: =INT(R2C8*RC1+R3C8+R4C8*RC2+R5C8) -> 152 | I68: 1140 | J68: =SUM(R7C9:RC9) -> 28745 | K68: =RC10/R2C14 -> 574.9 | N68: =RC12*R3C11+RC13*R4C11 -> 0 | O68: =SUM(R7C14:RC14) -> 170 | P68: =RC11+RC15 -> 744.9
A69: 62 | B69: 6 | C69: =INT(R2C3*RC1+R3C3+R4C3*RC2+R5C3) -> 124 | D69: =INT(R2C4*RC1+R3C4+R4C4*RC2+R5C4) -> 104 | E69: =INT(R2C5*RC1+R3C5+R4C5*RC2+R5C5) -> 97 | F69: =INT(R2C6*RC1+R3C6+R4C6*RC2+R5C6) -> 37 | G69: =INT(R2C7*RC1+R3C7+R4C7*RC2+R5C7) -> 14 | H69: =INT(R2C8*RC1+R3C8+R4C8*RC2+R5C8) -> 154 | I69: 1180 | J69: =SUM(R7C9:RC9) -> 29925 | K69: =RC10/R2C14 -> 598.5 | N69: =RC12*R3C11+RC13*R4C11 -> 0 | O69: =SUM(R7C14:RC14) -> 170 | P69: =RC11+RC15 -> 768.5
A70: 63 | B70: 6 | C70: =INT(R2C3*RC1+R3C3+R4C3*RC2+R5C3) -> 126 | D70: =INT(R2C4*RC1+R3C4+R4C4*RC2+R5C4) -> 105 | E70: =INT(R2C5*RC1+R3C5+R4C5*RC2+R5C5) -> 98 | F70: =INT(R2C6*RC1+R3C6+R4C6*RC2+R5C6) -> 37 | G70: =INT(R2C7*RC1+R3C7+R4C7*RC2+R5C7) -> 14 | H70: =INT(R2C8*RC1+R3C8+R4C8*RC2+R5C8) -> 156 | I70: 1220 | J70: =SUM(R7C9:RC9) -> 31145 | K70: =RC10/R2C14 -> 622.9 | N70: =RC12*R3C11+RC13*R4C11 -> 0 | O70: =SUM(R7C14:RC14) -> 170 | P70: =RC11+RC15 -> 792.9
A71: 64 | B71: 6 | C71: =INT(R2C3*RC1+R3C3+R4C3*RC2+R5C3) -> 128 | D71: =INT(R2C4*RC1+R3C4+R4C4*RC2+R5C4) -> 106 | E71: =INT(R2C5*RC1+R3C5+R4C5*RC2+R5C5) -> 99 | F71: =INT(R2C6*RC1+R3C6+R4C6*RC2+R5C6) -> 38 | G71: =INT(R2C7*RC1+R3C7+R4C7*RC2+R5C7) -> 14 | H71: =INT(R2C8*RC1+R3C8+R4C8*RC2+R5C8) -> 158 | I71: 1260 | J71: =SUM(R7C9:RC9) -> 32405 | K71: =RC10/R2C14 -> 648.1 | N71: =RC12*R3C11+RC13*R4C11 -> 0 | O71: =SUM(R7C14:RC14) -> 170 | P71: =RC11+RC15 -> 818.1
A72: 65 | B72: 6 | C72: =INT(R2C3*RC1+R3C3+R4C3*RC2+R5C3) -> 130 | D72: =INT(R2C4*RC1+R3C4+R4C4*RC2+R5C4) -> 107 | E72: =INT(R2C5*RC1+R3C5+R4C5*RC2+R5C5) -> 101 | F72: =INT(R2C6*RC1+R3C6+R4C6*RC2+R5C6) -> 38 | G72: =INT(R2C7*RC1+R3C7+R4C7*RC2+R5C7) -> 14 | H72: =INT(R2C8*RC1+R3C8+R4C8*RC2+R5C8) -> 160 | I72: 1300 | J72: =SUM(R7C9:RC9) -> 33705 | K72: =RC10/R2C14 -> 674.1 | N72: =RC12*R3C11+RC13*R4C11 -> 0 | O72: =SUM(R7C14:RC14) -> 170 | P72: =RC11+RC15 -> 844.1
A73: 66 | B73: 6 | C73: =INT(R2C3*RC1+R3C3+R4C3*RC2+R5C3) -> 131 | D73: =INT(R2C4*RC1+R3C4+R4C4*RC2+R5C4) -> 108 | E73: =INT(R2C5*RC1+R3C5+R4C5*RC2+R5C5) -> 102 | F73: =INT(R2C6*RC1+R3C6+R4C6*RC2+R5C6) -> 39 | G73: =INT(R2C7*RC1+R3C7+R4C7*RC2+R5C7) -> 14 | H73: =INT(R2C8*RC1+R3C8+R4C8*RC2+R5C8) -> 162 | I73: 1340 | J73: =SUM(R7C9:RC9) -> 35045 | K73: =RC10/R2C14 -> 700.9 | N73: =RC12*R3C11+RC13*R4C11 -> 0 | O73: =SUM(R7C14:RC14) -> 170 | P73: =RC11+RC15 -> 870.9
A74: 67 | B74: 6 | C74: =INT(R2C3*RC1+R3C3+R4C3*RC2+R5C3) -> 133 | D74: =INT(R2C4*RC1+R3C4+R4C4*RC2+R5C4) -> 109 | E74: =INT(R2C5*RC1+R3C5+R4C5*RC2+R5C5) -> 103 | F74: =INT(R2C6*RC1+R3C6+R4C6*RC2+R5C6) -> 39 | G74: =INT(R2C7*RC1+R3C7+R4C7*RC2+R5C7) -> 15 | H74: =INT(R2C8*RC1+R3C8+R4C8*RC2+R5C8) -> 164 | I74: 1380 | J74: =SUM(R7C9:RC9) -> 36425 | K74: =RC10/R2C14 -> 728.5 | N74: =RC12*R3C11+RC13*R4C11 -> 0 | O74: =SUM(R7C14:RC14) -> 170 | P74: =RC11+RC15 -> 898.5
A75: 68 | B75: 6 | C75: =INT(R2C3*RC1+R3C3+R4C3*RC2+R5C3) -> 135 | D75: =INT(R2C4*RC1+R3C4+R4C4*RC2+R5C4) -> 110 | E75: =INT(R2C5*RC1+R3C5+R4C5*RC2+R5C5) -> 104 | F75: =INT(R2C6*RC1+R3C6+R4C6*RC2+R5C6) -> 40 | G75: =INT(R2C7*RC1+R3C7+R4C7*RC2+R5C7) -> 15 | H75: =INT(R2C8*RC1+R3C8+R4C8*RC2+R5C8) -> 166 | I75: 1420 | J75: =SUM(R7C9:RC9) -> 37845 | K75: =RC10/R2C14 -> 756.9 | N75: =RC12*R3C11+RC13*R4C11 -> 0 | O75: =SUM(R7C14:RC14) -> 170 | P75: =RC11+RC15 -> 926.9
A76: 69 | B76: 6 | C76: =INT(R2C3*RC1+R3C3+R4C3*RC2+R5C3) -> 137 | D76: =INT(R2C4*RC1+R3C4+R4C4*RC2+R5C4) -> 111 | E76: =INT(R2C5*RC1+R3C5+R4C5*RC2+R5C5) -> 105 | F76: =INT(R2C6*RC1+R3C6+R4C6*RC2+R5C6) -> 40 | G76: =INT(R2C7*RC1+R3C7+R4C7*RC2+R5C7) -> 15 | H76: =INT(R2C8*RC1+R3C8+R4C8*RC2+R5C8) -> 168 | I76: 1460 | J76: =SUM(R7C9:RC9) -> 39305 | K76: =RC10/R2C14 -> 786.1 | N76: =RC12*R3C11+RC13*R4C11 -> 0 | O76: =SUM(R7C14:RC14) -> 170 | P76: =RC11+RC15 -> 956.1
A77: 70 | B77: 7 | C77: =INT(R2C3*RC1+R3C3+R4C3*RC2+R5C3) -> 140 | D77: =INT(R2C4*RC1+R3C4+R4C4*RC2+R5C4) -> 117 | E77: =INT(R2C5*RC1+R3C5+R4C5*RC2+R5C5) -> 110 | F77: =INT(R2C6*RC1+R3C6+R4C6*RC2+R5C6) -> 41 | G77: =INT(R2C7*RC1+R3C7+R4C7*RC2+R5C7) -> 16 | H77: =INT(R2C8*RC1+R3C8+R4C8*RC2+R5C8) -> 175 | I77: 1500 | J77: =SUM(R7C9:RC9) -> 40805 | K77: =RC10/R2C14 -> 816.1 | L77: 15 | N77: =RC12*R3C11+RC13*R4C11 -> 75 | O77: =SUM(R7C14:RC14) -> 245 | P77: =RC11+RC15 -> 1061.1
A78: 71 | B78: 7 | C78: =INT(R2C3*RC1+R3C3+R4C3*RC2+R5C3) -> 141 | D78: =INT(R2C4*RC1+R3C4+R4C4*RC2+R5C4) -> 118 | E78: =INT(R2C5*RC1+R3C5+R4C5*RC2+R5C5) -> 111 | F78: =INT(R2C6*RC1+R3C6+R4C6*RC2+R5C6) -> 42 | G78: =INT(R2C7*RC1+R3C7+R4C7*RC2+R5C7) -> 16 | H78: =INT(R2C8*RC1+R3C8+R4C8*RC2+R5C8) -> 177 | I78: 1550 | J78: =SUM(R7C9:RC9) -> 42355 | K78: =RC10/R2C14 -> 847.1 | N78: =RC12*R3C11+RC13*R4C11 -> 0 | O78: =SUM(R7C14:RC14) -> 245 | P78: =RC11+RC15 -> 1092.1
A79: 72 | B79: 7 | C79: =INT(R2C3*RC1+R3C3+R4C3*RC2+R5C3) -> 143 | D79: =INT(R2C4*RC1+R3C4+R4C4*RC2+R5C4) -> 119 | E79: =INT(R2C5*RC1+R3C5+R4C5*RC2+R5C5) -> 112 | F79: =INT(R2C6*RC1+R3C6+R4C6*RC2+R5C6) -> 42 | G79: =INT(R2C7*RC1+R3C7+R4C7*RC2+R5C7) -> 16 | H79: =INT(R2C8*RC1+R3C8+R4C8*RC2+R5C8) -> 179 | I79: 1600 | J79: =SUM(R7C9:RC9) -> 43955 | K79: =RC10/R2C14 -> 879.1 | N79: =RC12*R3C11+RC13*R4C11 -> 0 | O79: =SUM(R7C14:RC14) -> 245 | P79: =RC11+RC15 -> 1124.1
A80: 73 | B80: 7 | C80: =INT(R2C3*RC1+R3C3+R4C3*RC2+R5C3) -> 145 | D80: =INT(R2C4*RC1+R3C4+R4C4*RC2+R5C4) -> 120 | E80: =INT(R2C5*RC1+R3C5+R4C5*RC2+R5C5) -> 113 | F80: =INT(R2C6*RC1+R3C6+R4C6*RC2+R5C6) -> 43 | G80: =INT(R2C7*RC1+R3C7+R4C7*RC2+R5C7) -> 16 | H80: =INT(R2C8*RC1+R3C8+R4C8*RC2+R5C8) -> 181 | I80: 1650 | J80: =SUM(R7C9:RC9) -> 45605 | K80: =RC10/R2C14 -> 912.1 | N80: =RC12*R3C11+RC13*R4C11 -> 0 | O80: =SUM(R7C14:RC14) -> 245 | P80: =RC11+RC15 -> 1157.1
A81: 74 | B81: 7 | C81: =INT(R2C3*RC1+R3C3+R4C3*RC2+R5C3) -> 147 | D81: =INT(R2C4*RC1+R3C4+R4C4*RC2+R5C4) -> 121 | E81: =INT(R2C5*RC1+R3C5+R4C5*RC2+R5C5) -> 114 | F81: =INT(R2C6*RC1+R3C6+R4C6*RC2+R5C6) -> 43 | G81: =INT(R2C7*RC1+R3C7+R4C7*RC2+R5C7) -> 16 | H81: =INT(R2C8*RC1+R3C8+R4C8*RC2+R5C8) -> 183 | I81: 1700 | J81: =SUM(R7C9:RC9) -> 47305 | K81: =RC10/R2C14 -> 946.1 | N81: =RC12*R3C11+RC13*R4C11 -> 0 | O81: =SUM(R7C14:RC14) -> 245 | P81: =RC11+RC15 -> 1191.1
A82: 75 | B82: 7 | C82: =INT(R2C3*RC1+R3C3+R4C3*RC2+R5C3) -> 149 | D82: =INT(R2C4*RC1+R3C4+R4C4*RC2+R5C4) -> 122 | E82: =INT(R2C5*RC1+R3C5+R4C5*RC2+R5C5) -> 116 | F82: =INT(R2C6*RC1+R3C6+R4C6*RC2+R5C6) -> 44 | G82: =INT(R2C7*RC1+R3C7+R4C7*RC2+R5C7) -> 16 | H82: =INT(R2C8*RC1+R3C8+R4C8*RC2+R5C8) -> 185 | I82: 1750 | J82: =SUM(R7C9:RC9) -> 49055 | K82: =RC10/R2C14 -> 981.1 | N82: =RC12*R3C11+RC13*R4C11 -> 0 | O82: =SUM(R7C14:RC14) -> 245 | P82: =RC11+RC15 -> 1226.1
A83: 76 | B83: 7 | C83: =INT(R2C3*RC1+R3C3+R4C3*RC2+R5C3) -> 150 | D83: =INT(R2C4*RC1+R3C4+R4C4*RC2+R5C4) -> 123 | E83: =INT(R2C5*RC1+R3C5+R4C5*RC2+R5C5) -> 117 | F83: =INT(R2C6*RC1+R3C6+R4C6*RC2+R5C6) -> 44 | G83: =INT(R2C7*RC1+R3C7+R4C7*RC2+R5C7) -> 16 | H83: =INT(R2C8*RC1+R3C8+R4C8*RC2+R5C8) -> 187 | I83: 1800 | J83: =SUM(R7C9:RC9) -> 50855 | K83: =RC10/R2C14 -> 1017.1 | N83: =RC12*R3C11+RC13*R4C11 -> 0 | O83: =SUM(R7C14:RC14) -> 245 | P83: =RC11+RC15 -> 1262.1
A84: 77 | B84: 7 | C84: =INT(R2C3*RC1+R3C3+R4C3*RC2+R5C3) -> 152 | D84: =INT(R2C4*RC1+R3C4+R4C4*RC2+R5C4) -> 124 | E84: =INT(R2C5*RC1+R3C5+R4C5*RC2+R5C5) -> 118 | F84: =INT(R2C6*RC1+R3C6+R4C6*RC2+R5C6) -> 45 | G84: =INT(R2C7*RC1+R3C7+R4C7*RC2+R5C7) -> 17 | H84: =INT(R2C8*RC1+R3C8+R4C8*RC2+R5C8) -> 189 | I84: 1850 | J84: =SUM(R7C9:RC9) -> 52705 | K84: =RC10/R2C14 -> 1054.1 | N84: =RC12*R3C11+RC13*R4C11 -> 0 | O84: =SUM(R7C14:RC14) -> 245 | P84: =RC11+RC15 -> 1299.1
A85: 78 | B85: 7 | C85: =INT(R2C3*RC1+R3C3+R4C3*RC2+R5C3) -> 154 | D85: =INT(R2C4*RC1+R3C4+R4C4*RC2+R5C4) -> 125 | E85: =INT(R2C5*RC1+R3C5+R4C5*RC2+R5C5) -> 119 | F85: =INT(R2C6*RC1+R3C6+R4C6*RC2+R5C6) -> 45 | G85: =INT(R2C7*RC1+R3C7+R4C7*RC2+R5C7) -> 17 | H85: =INT(R2C8*RC1+R3C8+R4C8*RC2+R5C8) -> 191 | I85: 1900 | J85: =SUM(R7C9:RC9) -> 54605 | K85: =RC10/R2C14 -> 1092.1 | N85: =RC12*R3C11+RC13*R4C11 -> 0 | O85: =SUM(R7C14:RC14) -> 245 | P85: =RC11+RC15 -> 1337.1
A86: 79 | B86: 7 | C86: =INT(R2C3*RC1+R3C3+R4C3*RC2+R5C3) -> 156 | D86: =INT(R2C4*RC1+R3C4+R4C4*RC2+R5C4) -> 126 | E86: =INT(R2C5*RC1+R3C5+R4C5*RC2+R5C5) -> 120 | F86: =INT(R2C6*RC1+R3C6+R4C6*RC2+R5C6) -> 46 | G86: =INT(R2C7*RC1+R3C7+R4C7*RC2+R5C7) -> 17 | H86: =INT(R2C8*RC1+R3C8+R4C8*RC2+R5C8) -> 193 | I86: 1950 | J86: =SUM(R7C9:RC9) -> 56555 | K86: =RC10/R2C14 -> 1131.1 | N86: =RC12*R3C11+RC13*R4C11 -> 0 | O86: =SUM(R7C14:RC14) -> 245 | P86: =RC11+RC15 -> 1376.1
A87: 80 | B87: 8 | C87: =INT(R2C3*RC1+R3C3+R4C3*RC2+R5C3) -> 159 | D87: =INT(R2C4*RC1+R3C4+R4C4*RC2+R5C4) -> 132 | E87: =INT(R2C5*RC1+R3C5+R4C5*RC2+R5C5) -> 125 | F87: =INT(R2C6*RC1+R3C6+R4C6*RC2+R5C6) -> 47 | G87: =INT(R2C7*RC1+R3C7+R4C7*RC2+R5C7) -> 18 | H87: =INT(R2C8*RC1+R3C8+R4C8*RC2+R5C8) -> 200 | I87: 2000 | J87: =SUM(R7C9:RC9) -> 58555 | K87: =RC10/R2C14 -> 1171.1 | L87: 20 | N87: =RC12*R3C11+RC13*R4C11 -> 100 | O87: =SUM(R7C14:RC14) -> 345 | P87: =RC11+RC15 -> 1516.1
A88: 81 | B88: 8 | C88: =INT(R2C3*RC1+R3C3+R4C3*RC2+R5C3) -> 160 | D88: =INT(R2C4*RC1+R3C4+R4C4*RC2+R5C4) -> 133 | E88: =INT(R2C5*RC1+R3C5+R4C5*RC2+R5C5) -> 126 | F88: =INT(R2C6*RC1+R3C6+R4C6*RC2+R5C6) -> 47 | G88: =INT(R2C7*RC1+R3C7+R4C7*RC2+R5C7) -> 18 | H88: =INT(R2C8*RC1+R3C8+R4C8*RC2+R5C8) -> 202 | I88: 2060 | J88: =SUM(R7C9:RC9) -> 60615 | K88: =RC10/R2C14 -> 1212.3 | N88: =RC12*R3C11+RC13*R4C11 -> 0 | O88: =SUM(R7C14:RC14) -> 345 | P88: =RC11+RC15 -> 1557.3
A89: 82 | B89: 8 | C89: =INT(R2C3*RC1+R3C3+R4C3*RC2+R5C3) -> 162 | D89: =INT(R2C4*RC1+R3C4+R4C4*RC2+R5C4) -> 134 | E89: =INT(R2C5*RC1+R3C5+R4C5*RC2+R5C5) -> 127 | F89: =INT(R2C6*RC1+R3C6+R4C6*RC2+R5C6) -> 48 | G89: =INT(R2C7*RC1+R3C7+R4C7*RC2+R5C7) -> 18 | H89: =INT(R2C8*RC1+R3C8+R4C8*RC2+R5C8) -> 204 | I89: 2120 | J89: =SUM(R7C9:RC9) -> 62735 | K89: =RC10/R2C14 -> 1254.7 | N89: =RC12*R3C11+RC13*R4C11 -> 0 | O89: =SUM(R7C14:RC14) -> 345 | P89: =RC11+RC15 -> 1599.7
A90: 83 | B90: 8 | C90: =INT(R2C3*RC1+R3C3+R4C3*RC2+R5C3) -> 164 | D90: =INT(R2C4*RC1+R3C4+R4C4*RC2+R5C4) -> 135 | E90: =INT(R2C5*RC1+R3C5+R4C5*RC2+R5C5) -> 128 | F90: =INT(R2C6*RC1+R3C6+R4C6*RC2+R5C6) -> 48 | G90: =INT(R2C7*RC1+R3C7+R4C7*RC2+R5C7) -> 18 | H90: =INT(R2C8*RC1+R3C8+R4C8*RC2+R5C8) -> 206 | I90: 2180 | J90: =SUM(R7C9:RC9) -> 64915 | K90: =RC10/R2C14 -> 1298.3 | N90: =RC12*R3C11+RC13*R4C11 -> 0 | O90: =SUM(R7C14:RC14) -> 345 | P90: =RC11+RC15 -> 1643.3
A91: 84 | B91: 8 | C91: =INT(R2C3*RC1+R3C3+R4C3*RC2+R5C3) -> 166 | D91: =INT(R2C4*RC1+R3C4+R4C4*RC2+R5C4) -> 136 | E91: =INT(R2C5*RC1+R3C5+R4C5*RC2+R5C5) -> 129 | F91: =INT(R2C6*RC1+R3C6+R4C6*RC2+R5C6) -> 49 | G91: =INT(R2C7*RC1+R3C7+R4C7*RC2+R5C7) -> 18 | H91: =INT(R2C8*RC1+R3C8+R4C8*RC2+R5C8) -> 208 | I91: 2240 | J91: =SUM(R7C9:RC9) -> 67155 | K91: =RC10/R2C14 -> 1343.1 | N91: =RC12*R3C11+RC13*R4C11 -> 0 | O91: =SUM(R7C14:RC14) -> 345 | P91: =RC11+RC15 -> 1688.1
A92: 85 | B92: 8 | C92: =INT(R2C3*RC1+R3C3+R4C3*RC2+R5C3) -> 168 | D92: =INT(R2C4*RC1+R3C4+R4C4*RC2+R5C4) -> 137 | E92: =INT(R2C5*RC1+R3C5+R4C5*RC2+R5C5) -> 131 | F92: =INT(R2C6*RC1+R3C6+R4C6*RC2+R5C6) -> 49 | G92: =INT(R2C7*RC1+R3C7+R4C7*RC2+R5C7) -> 18 | H92: =INT(R2C8*RC1+R3C8+R4C8*RC2+R5C8) -> 210 | I92: 2300 | J92: =SUM(R7C9:RC9) -> 69455 | K92: =RC10/R2C14 -> 1389.1 | N92: =RC12*R3C11+RC13*R4C11 -> 0 | O92: =SUM(R7C14:RC14) -> 345 | P92: =RC11+RC15 -> 1734.1
A93: 86 | B93: 8 | C93: =INT(R2C3*RC1+R3C3+R4C3*RC2+R5C3) -> 169 | D93: =INT(R2C4*RC1+R3C4+R4C4*RC2+R5C4) -> 138 | E93: =INT(R2C5*RC1+R3C5+R4C5*RC2+R5C5) -> 132 | F93: =INT(R2C6*RC1+R3C6+R4C6*RC2+R5C6) -> 50 | G93: =INT(R2C7*RC1+R3C7+R4C7*RC2+R5C7) -> 18 | H93: =INT(R2C8*RC1+R3C8+R4C8*RC2+R5C8) -> 212 | I93: 2360 | J93: =SUM(R7C9:RC9) -> 71815 | K93: =RC10/R2C14 -> 1436.3 | N93: =RC12*R3C11+RC13*R4C11 -> 0 | O93: =SUM(R7C14:RC14) -> 345 | P93: =RC11+RC15 -> 1781.3
A94: 87 | B94: 8 | C94: =INT(R2C3*RC1+R3C3+R4C3*RC2+R5C3) -> 171 | D94: =INT(R2C4*RC1+R3C4+R4C4*RC2+R5C4) -> 139 | E94: =INT(R2C5*RC1+R3C5+R4C5*RC2+R5C5) -> 133 | F94: =INT(R2C6*RC1+R3C6+R4C6*RC2+R5C6) -> 50 | G94: =INT(R2C7*RC1+R3C7+R4C7*RC2+R5C7) -> 19 | H94: =INT(R2C8*RC1+R3C8+R4C8*RC2+R5C8) -> 214 | I94: 2420 | J94: =SUM(R7C9:RC9) -> 74235 | K94: =RC10/R2C14 -> 1484.7 | N94: =RC12*R3C11+RC13*R4C11 -> 0 | O94: =SUM(R7C14:RC14) -> 345 | P94: =RC11+RC15 -> 1829.7
A95: 88 | B95: 8 | C95: =INT(R2C3*RC1+R3C3+R4C3*RC2+R5C3) -> 173 | D95: =INT(R2C4*RC1+R3C4+R4C4*RC2+R5C4) -> 140 | E95: =INT(R2C5*RC1+R3C5+R4C5*RC2+R5C5) -> 134 | F95: =INT(R2C6*RC1+R3C6+R4C6*RC2+R5C6) -> 51 | G95: =INT(R2C7*RC1+R3C7+R4C7*RC2+R5C7) -> 19 | H95: =INT(R2C8*RC1+R3C8+R4C8*RC2+R5C8) -> 216 | I95: 2480 | J95: =SUM(R7C9:RC9) -> 76715 | K95: =RC10/R2C14 -> 1534.3 | N95: =RC12*R3C11+RC13*R4C11 -> 0 | O95: =SUM(R7C14:RC14) -> 345 | P95: =RC11+RC15 -> 1879.3
A96: 89 | B96: 8 | C96: =INT(R2C3*RC1+R3C3+R4C3*RC2+R5C3) -> 175 | D96: =INT(R2C4*RC1+R3C4+R4C4*RC2+R5C4) -> 141 | E96: =INT(R2C5*RC1+R3C5+R4C5*RC2+R5C5) -> 135 | F96: =INT(R2C6*RC1+R3C6+R4C6*RC2+R5C6) -> 51 | G96: =INT(R2C7*RC1+R3C7+R4C7*RC2+R5C7) -> 19 | H96: =INT(R2C8*RC1+R3C8+R4C8*RC2+R5C8) -> 218 | I96: 2540 | J96: =SUM(R7C9:RC9) -> 79255 | K96: =RC10/R2C14 -> 1585.1 | N96: =RC12*R3C11+RC13*R4C11 -> 0 | O96: =SUM(R7C14:RC14) -> 345 | P96: =RC11+RC15 -> 1930.1
A97: 90 | B97: 9 | C97: =INT(R2C3*RC1+R3C3+R4C3*RC2+R5C3) -> 178 | D97: =INT(R2C4*RC1+R3C4+R4C4*RC2+R5C4) -> 147 | E97: =INT(R2C5*RC1+R3C5+R4C5*RC2+R5C5) -> 140 | F97: =INT(R2C6*RC1+R3C6+R4C6*RC2+R5C6) -> 52 | G97: =INT(R2C7*RC1+R3C7+R4C7*RC2+R5C7) -> 20 | H97: =INT(R2C8*RC1+R3C8+R4C8*RC2+R5C8) -> 225 | I97: 2600 | J97: =SUM(R7C9:RC9) -> 81855 | K97: =RC10/R2C14 -> 1637.1 | L97: 30 | N97: =RC12*R3C11+RC13*R4C11 -> 150 | O97: =SUM(R7C14:RC14) -> 495 | P97: =RC11+RC15 -> 2132.1
A98: 91 | B98: 9 | C98: =INT(R2C3*RC1+R3C3+R4C3*RC2+R5C3) -> 179 | D98: =INT(R2C4*RC1+R3C4+R4C4*RC2+R5C4) -> 148 | E98: =INT(R2C5*RC1+R3C5+R4C5*RC2+R5C5) -> 141 | F98: =INT(R2C6*RC1+R3C6+R4C6*RC2+R5C6) -> 53 | G98: =INT(R2C7*RC1+R3C7+R4C7*RC2+R5C7) -> 20 | H98: =INT(R2C8*RC1+R3C8+R4C8*RC2+R5C8) -> 227 | I98: 2670 | J98: =SUM(R7C9:RC9) -> 84525 | K98: =RC10/R2C14 -> 1690.5 | N98: =RC12*R3C11+RC13*R4C11 -> 0 | O98: =SUM(R7C14:RC14) -> 495 | P98: =RC11+RC15 -> 2185.5
A99: 92 | B99: 9 | C99: =INT(R2C3*RC1+R3C3+R4C3*RC2+R5C3) -> 181 | D99: =INT(R2C4*RC1+R3C4+R4C4*RC2+R5C4) -> 149 | E99: =INT(R2C5*RC1+R3C5+R4C5*RC2+R5C5) -> 142 | F99: =INT(R2C6*RC1+R3C6+R4C6*RC2+R5C6) -> 53 | G99: =INT(R2C7*RC1+R3C7+R4C7*RC2+R5C7) -> 20 | H99: =INT(R2C8*RC1+R3C8+R4C8*RC2+R5C8) -> 229 | I99: 2740 | J99: =SUM(R7C9:RC9) -> 87265 | K99: =RC10/R2C14 -> 1745.3 | N99: =RC12*R3C11+RC13*R4C11 -> 0 | O99: =SUM(R7C14:RC14) -> 495 | P99: =RC11+RC15 -> 2240.3
A100: 93 | B100: 9 | C100: =INT(R2C3*RC1+R3C3+R4C3*RC2+R5C3) -> 183 | D100: =INT(R2C4*RC1+R3C4+R4C4*RC2+R5C4) -> 150 | E100: =INT(R2C5*RC1+R3C5+R4C5*RC2+R5C5) -> 143 | F100: =INT(R2C6*RC1+R3C6+R4C6*RC2+R5C6) -> 54 | G100: =INT(R2C7*RC1+R3C7+R4C7*RC2+R5C7) -> 20 | H100: =INT(R2C8*RC1+R3C8+R4C8*RC2+R5C8) -> 231 | I100: 2810 | J100: =SUM(R7C9:RC9) -> 90075 | K100: =RC10/R2C14 -> 1801.5 | N100: =RC12*R3C11+RC13*R4C11 -> 0 | O100: =SUM(R7C14:RC14) -> 495 | P100: =RC11+RC15 -> 2296.5
A101: 94 | B101: 9 | C101: =INT(R2C3*RC1+R3C3+R4C3*RC2+R5C3) -> 185 | D101: =INT(R2C4*RC1+R3C4+R4C4*RC2+R5C4) -> 151 | E101: =INT(R2C5*RC1+R3C5+R4C5*RC2+R5C5) -> 144 | F101: =INT(R2C6*RC1+R3C6+R4C6*RC2+R5C6) -> 54 | G101: =INT(R2C7*RC1+R3C7+R4C7*RC2+R5C7) -> 20 | H101: =INT(R2C8*RC1+R3C8+R4C8*RC2+R5C8) -> 233 | I101: 2880 | J101: =SUM(R7C9:RC9) -> 92955 | K101: =RC10/R2C14 -> 1859.1 | N101: =RC12*R3C11+RC13*R4C11 -> 0 | O101: =SUM(R7C14:RC14) -> 495 | P101: =RC11+RC15 -> 2354.1
A102: 95 | B102: 9 | C102: =INT(R2C3*RC1+R3C3+R4C3*RC2+R5C3) -> 187 | D102: =INT(R2C4*RC1+R3C4+R4C4*RC2+R5C4) -> 152 | E102: =INT(R2C5*RC1+R3C5+R4C5*RC2+R5C5) -> 146 | F102: =INT(R2C6*RC1+R3C6+R4C6*RC2+R5C6) -> 55 | G102: =INT(R2C7*RC1+R3C7+R4C7*RC2+R5C7) -> 20 | H102: =INT(R2C8*RC1+R3C8+R4C8*RC2+R5C8) -> 235 | I102: 2950 | J102: =SUM(R7C9:RC9) -> 95905 | K102: =RC10/R2C14 -> 1918.1 | N102: =RC12*R3C11+RC13*R4C11 -> 0 | O102: =SUM(R7C14:RC14) -> 495 | P102: =RC11+RC15 -> 2413.1
A103: 96 | B103: 9 | C103: =INT(R2C3*RC1+R3C3+R4C3*RC2+R5C3) -> 188 | D103: =INT(R2C4*RC1+R3C4+R4C4*RC2+R5C4) -> 153 | E103: =INT(R2C5*RC1+R3C5+R4C5*RC2+R5C5) -> 147 | F103: =INT(R2C6*RC1+R3C6+R4C6*RC2+R5C6) -> 55 | G103: =INT(R2C7*RC1+R3C7+R4C7*RC2+R5C7) -> 20 | H103: =INT(R2C8*RC1+R3C8+R4C8*RC2+R5C8) -> 237 | I103: 3020 | J103: =SUM(R7C9:RC9) -> 98925 | K103: =RC10/R2C14 -> 1978.5 | N103: =RC12*R3C11+RC13*R4C11 -> 0 | O103: =SUM(R7C14:RC14) -> 495 | P103: =RC11+RC15 -> 2473.5
A104: 97 | B104: 9 | C104: =INT(R2C3*RC1+R3C3+R4C3*RC2+R5C3) -> 190 | D104: =INT(R2C4*RC1+R3C4+R4C4*RC2+R5C4) -> 154 | E104: =INT(R2C5*RC1+R3C5+R4C5*RC2+R5C5) -> 148 | F104: =INT(R2C6*RC1+R3C6+R4C6*RC2+R5C6) -> 56 | G104: =INT(R2C7*RC1+R3C7+R4C7*RC2+R5C7) -> 21 | H104: =INT(R2C8*RC1+R3C8+R4C8*RC2+R5C8) -> 239 | I104: 3090 | J104: =SUM(R7C9:RC9) -> 102015 | K104: =RC10/R2C14 -> 2040.3 | N104: =RC12*R3C11+RC13*R4C11 -> 0 | O104: =SUM(R7C14:RC14) -> 495 | P104: =RC11+RC15 -> 2535.3
A105: 98 | B105: 9 | C105: =INT(R2C3*RC1+R3C3+R4C3*RC2+R5C3) -> 192 | D105: =INT(R2C4*RC1+R3C4+R4C4*RC2+R5C4) -> 155 | E105: =INT(R2C5*RC1+R3C5+R4C5*RC2+R5C5) -> 149 | F105: =INT(R2C6*RC1+R3C6+R4C6*RC2+R5C6) -> 56 | G105: =INT(R2C7*RC1+R3C7+R4C7*RC2+R5C7) -> 21 | H105: =INT(R2C8*RC1+R3C8+R4C8*RC2+R5C8) -> 241 | I105: 3160 | J105: =SUM(R7C9:RC9) -> 105175 | K105: =RC10/R2C14 -> 2103.5 | N105: =RC12*R3C11+RC13*R4C11 -> 0 | O105: =SUM(R7C14:RC14) -> 495 | P105: =RC11+RC15 -> 2598.5
A106: 99 | B106: 9 | C106: =INT(R2C3*RC1+R3C3+R4C3*RC2+R5C3) -> 194 | D106: =INT(R2C4*RC1+R3C4+R4C4*RC2+R5C4) -> 156 | E106: =INT(R2C5*RC1+R3C5+R4C5*RC2+R5C5) -> 150 | F106: =INT(R2C6*RC1+R3C6+R4C6*RC2+R5C6) -> 57 | G106: =INT(R2C7*RC1+R3C7+R4C7*RC2+R5C7) -> 21 | H106: =INT(R2C8*RC1+R3C8+R4C8*RC2+R5C8) -> 243 | I106: 3230 | J106: =SUM(R7C9:RC9) -> 108405 | K106: =RC10/R2C14 -> 2168.1 | N106: =RC12*R3C11+RC13*R4C11 -> 0 | O106: =SUM(R7C14:RC14) -> 495 | P106: =RC11+RC15 -> 2663.1
A107: 100 | B107: 10 | C107: =INT(R2C3*RC1+R3C3+R4C3*RC2+R5C3) -> 197 | D107: =INT(R2C4*RC1+R3C4+R4C4*RC2+R5C4) -> 162 | E107: =INT(R2C5*RC1+R3C5+R4C5*RC2+R5C5) -> 155 | F107: =INT(R2C6*RC1+R3C6+R4C6*RC2+R5C6) -> 58 | G107: =INT(R2C7*RC1+R3C7+R4C7*RC2+R5C7) -> 22 | H107: =INT(R2C8*RC1+R3C8+R4C8*RC2+R5C8) -> 250 | I107: 3300 | J107: =SUM(R7C9:RC9) -> 111705 | K107: =RC10/R2C14 -> 2234.1 | L107: 40 | M107: 1 | N107: =RC12*R3C11+RC13*R4C11 -> 215 | O107: =SUM(R7C14:RC14) -> 710 | P107: =RC11+RC15 -> 2944.1
A108: 101 | B108: 10 | C108: =INT(R2C3*RC1+R3C3+R4C3*RC2+R5C3) -> 198 | D108: =INT(R2C4*RC1+R3C4+R4C4*RC2+R5C4) -> 163 | E108: =INT(R2C5*RC1+R3C5+R4C5*RC2+R5C5) -> 156 | F108: =INT(R2C6*RC1+R3C6+R4C6*RC2+R5C6) -> 58 | G108: =INT(R2C7*RC1+R3C7+R4C7*RC2+R5C7) -> 22 | H108: =INT(R2C8*RC1+R3C8+R4C8*RC2+R5C8) -> 252 | I108: 3380 | J108: =SUM(R7C9:RC9) -> 115085 | K108: =RC10/R2C14 -> 2301.7 | N108: =RC12*R3C11+RC13*R4C11 -> 0 | O108: =SUM(R7C14:RC14) -> 710 | P108: =RC11+RC15 -> 3011.7
A109: 102 | B109: 10 | C109: =INT(R2C3*RC1+R3C3+R4C3*RC2+R5C3) -> 200 | D109: =INT(R2C4*RC1+R3C4+R4C4*RC2+R5C4) -> 164 | E109: =INT(R2C5*RC1+R3C5+R4C5*RC2+R5C5) -> 157 | F109: =INT(R2C6*RC1+R3C6+R4C6*RC2+R5C6) -> 59 | G109: =INT(R2C7*RC1+R3C7+R4C7*RC2+R5C7) -> 22 | H109: =INT(R2C8*RC1+R3C8+R4C8*RC2+R5C8) -> 254 | I109: 3460 | J109: =SUM(R7C9:RC9) -> 118545 | K109: =RC10/R2C14 -> 2370.9 | N109: =RC12*R3C11+RC13*R4C11 -> 0 | O109: =SUM(R7C14:RC14) -> 710 | P109: =RC11+RC15 -> 3080.9
A110: 103 | B110: 10 | C110: =INT(R2C3*RC1+R3C3+R4C3*RC2+R5C3) -> 202 | D110: =INT(R2C4*RC1+R3C4+R4C4*RC2+R5C4) -> 165 | E110: =INT(R2C5*RC1+R3C5+R4C5*RC2+R5C5) -> 158 | F110: =INT(R2C6*RC1+R3C6+R4C6*RC2+R5C6) -> 59 | G110: =INT(R2C7*RC1+R3C7+R4C7*RC2+R5C7) -> 22 | H110: =INT(R2C8*RC1+R3C8+R4C8*RC2+R5C8) -> 256 | I110: 3540 | J110: =SUM(R7C9:RC9) -> 122085 | K110: =RC10/R2C14 -> 2441.7 | N110: =RC12*R3C11+RC13*R4C11 -> 0 | O110: =SUM(R7C14:RC14) -> 710 | P110: =RC11+RC15 -> 3151.7
A111: 104 | B111: 10 | C111: =INT(R2C3*RC1+R3C3+R4C3*RC2+R5C3) -> 204 | D111: =INT(R2C4*RC1+R3C4+R4C4*RC2+R5C4) -> 166 | E111: =INT(R2C5*RC1+R3C5+R4C5*RC2+R5C5) -> 159 | F111: =INT(R2C6*RC1+R3C6+R4C6*RC2+R5C6) -> 60 | G111: =INT(R2C7*RC1+R3C7+R4C7*RC2+R5C7) -> 22 | H111: =INT(R2C8*RC1+R3C8+R4C8*RC2+R5C8) -> 258 | I111: 3620 | J111: =SUM(R7C9:RC9) -> 125705 | K111: =RC10/R2C14 -> 2514.1 | N111: =RC12*R3C11+RC13*R4C11 -> 0 | O111: =SUM(R7C14:RC14) -> 710 | P111: =RC11+RC15 -> 3224.1
A112: 105 | B112: 10 | C112: =INT(R2C3*RC1+R3C3+R4C3*RC2+R5C3) -> 206 | D112: =INT(R2C4*RC1+R3C4+R4C4*RC2+R5C4) -> 167 | E112: =INT(R2C5*RC1+R3C5+R4C5*RC2+R5C5) -> 161 | F112: =INT(R2C6*RC1+R3C6+R4C6*RC2+R5C6) -> 60 | G112: =INT(R2C7*RC1+R3C7+R4C7*RC2+R5C7) -> 22 | H112: =INT(R2C8*RC1+R3C8+R4C8*RC2+R5C8) -> 260 | I112: 3700 | J112: =SUM(R7C9:RC9) -> 129405 | K112: =RC10/R2C14 -> 2588.1 | N112: =RC12*R3C11+RC13*R4C11 -> 0 | O112: =SUM(R7C14:RC14) -> 710 | P112: =RC11+RC15 -> 3298.1
A113: 106 | B113: 10 | C113: =INT(R2C3*RC1+R3C3+R4C3*RC2+R5C3) -> 207 | D113: =INT(R2C4*RC1+R3C4+R4C4*RC2+R5C4) -> 168 | E113: =INT(R2C5*RC1+R3C5+R4C5*RC2+R5C5) -> 162 | F113: =INT(R2C6*RC1+R3C6+R4C6*RC2+R5C6) -> 61 | G113: =INT(R2C7*RC1+R3C7+R4C7*RC2+R5C7) -> 22 | H113: =INT(R2C8*RC1+R3C8+R4C8*RC2+R5C8) -> 262 | I113: 3780 | J113: =SUM(R7C9:RC9) -> 133185 | K113: =RC10/R2C14 -> 2663.7 | N113: =RC12*R3C11+RC13*R4C11 -> 0 | O113: =SUM(R7C14:RC14) -> 710 | P113: =RC11+RC15 -> 3373.7
A114: 107 | B114: 10 | C114: =INT(R2C3*RC1+R3C3+R4C3*RC2+R5C3) -> 209 | D114: =INT(R2C4*RC1+R3C4+R4C4*RC2+R5C4) -> 169 | E114: =INT(R2C5*RC1+R3C5+R4C5*RC2+R5C5) -> 163 | F114: =INT(R2C6*RC1+R3C6+R4C6*RC2+R5C6) -> 61 | G114: =INT(R2C7*RC1+R3C7+R4C7*RC2+R5C7) -> 23 | H114: =INT(R2C8*RC1+R3C8+R4C8*RC2+R5C8) -> 264 | I114: 3860 | J114: =SUM(R7C9:RC9) -> 137045 | K114: =RC10/R2C14 -> 2740.9 | N114: =RC12*R3C11+RC13*R4C11 -> 0 | O114: =SUM(R7C14:RC14) -> 710 | P114: =RC11+RC15 -> 3450.9
A115: 108 | B115: 10 | C115: =INT(R2C3*RC1+R3C3+R4C3*RC2+R5C3) -> 211 | D115: =INT(R2C4*RC1+R3C4+R4C4*RC2+R5C4) -> 170 | E115: =INT(R2C5*RC1+R3C5+R4C5*RC2+R5C5) -> 164 | F115: =INT(R2C6*RC1+R3C6+R4C6*RC2+R5C6) -> 62 | G115: =INT(R2C7*RC1+R3C7+R4C7*RC2+R5C7) -> 23 | H115: =INT(R2C8*RC1+R3C8+R4C8*RC2+R5C8) -> 266 | I115: 3940 | J115: =SUM(R7C9:RC9) -> 140985 | K115: =RC10/R2C14 -> 2819.7 | N115: =RC12*R3C11+RC13*R4C11 -> 0 | O115: =SUM(R7C14:RC14) -> 710 | P115: =RC11+RC15 -> 3529.7
A116: 109 | B116: 10 | C116: =INT(R2C3*RC1+R3C3+R4C3*RC2+R5C3) -> 213 | D116: =INT(R2C4*RC1+R3C4+R4C4*RC2+R5C4) -> 171 | E116: =INT(R2C5*RC1+R3C5+R4C5*RC2+R5C5) -> 165 | F116: =INT(R2C6*RC1+R3C6+R4C6*RC2+R5C6) -> 62 | G116: =INT(R2C7*RC1+R3C7+R4C7*RC2+R5C7) -> 23 | H116: =INT(R2C8*RC1+R3C8+R4C8*RC2+R5C8) -> 268 | I116: 4020 | J116: =SUM(R7C9:RC9) -> 145005 | K116: =RC10/R2C14 -> 2900.1 | N116: =RC12*R3C11+RC13*R4C11 -> 0 | O116: =SUM(R7C14:RC14) -> 710 | P116: =RC11+RC15 -> 3610.1
A117: 110 | B117: 11 | C117: =INT(R2C3*RC1+R3C3+R4C3*RC2+R5C3) -> 216 | D117: =INT(R2C4*RC1+R3C4+R4C4*RC2+R5C4) -> 177 | E117: =INT(R2C5*RC1+R3C5+R4C5*RC2+R5C5) -> 170 | F117: =INT(R2C6*RC1+R3C6+R4C6*RC2+R5C6) -> 63 | G117: =INT(R2C7*RC1+R3C7+R4C7*RC2+R5C7) -> 24 | H117: =INT(R2C8*RC1+R3C8+R4C8*RC2+R5C8) -> 275 | I117: 4100 | J117: =SUM(R7C9:RC9) -> 149105 | K117: =RC10/R2C14 -> 2982.1 | L117: 60 | M117: 2 | N117: =RC12*R3C11+RC13*R4C11 -> 330 | O117: =SUM(R7C14:RC14) -> 1040 | P117: =RC11+RC15 -> 4022.1
A118: 111 | B118: 11 | C118: =INT(R2C3*RC1+R3C3+R4C3*RC2+R5C3) -> 217 | D118: =INT(R2C4*RC1+R3C4+R4C4*RC2+R5C4) -> 178 | E118: =INT(R2C5*RC1+R3C5+R4C5*RC2+R5C5) -> 171 | F118: =INT(R2C6*RC1+R3C6+R4C6*RC2+R5C6) -> 64 | G118: =INT(R2C7*RC1+R3C7+R4C7*RC2+R5C7) -> 24 | H118: =INT(R2C8*RC1+R3C8+R4C8*RC2+R5C8) -> 277 | I118: 4190 | J118: =SUM(R7C9:RC9) -> 153295 | K118: =RC10/R2C14 -> 3065.9 | N118: =RC12*R3C11+RC13*R4C11 -> 0 | O118: =SUM(R7C14:RC14) -> 1040 | P118: =RC11+RC15 -> 4105.9
A119: 112 | B119: 11 | C119: =INT(R2C3*RC1+R3C3+R4C3*RC2+R5C3) -> 219 | D119: =INT(R2C4*RC1+R3C4+R4C4*RC2+R5C4) -> 179 | E119: =INT(R2C5*RC1+R3C5+R4C5*RC2+R5C5) -> 172 | F119: =INT(R2C6*RC1+R3C6+R4C6*RC2+R5C6) -> 64 | G119: =INT(R2C7*RC1+R3C7+R4C7*RC2+R5C7) -> 24 | H119: =INT(R2C8*RC1+R3C8+R4C8*RC2+R5C8) -> 279 | I119: 4280 | J119: =SUM(R7C9:RC9) -> 157575 | K119: =RC10/R2C14 -> 3151.5 | N119: =RC12*R3C11+RC13*R4C11 -> 0 | O119: =SUM(R7C14:RC14) -> 1040 | P119: =RC11+RC15 -> 4191.5
A120: 113 | B120: 11 | C120: =INT(R2C3*RC1+R3C3+R4C3*RC2+R5C3) -> 221 | D120: =INT(R2C4*RC1+R3C4+R4C4*RC2+R5C4) -> 180 | E120: =INT(R2C5*RC1+R3C5+R4C5*RC2+R5C5) -> 173 | F120: =INT(R2C6*RC1+R3C6+R4C6*RC2+R5C6) -> 65 | G120: =INT(R2C7*RC1+R3C7+R4C7*RC2+R5C7) -> 24 | H120: =INT(R2C8*RC1+R3C8+R4C8*RC2+R5C8) -> 281 | I120: 4370 | J120: =SUM(R7C9:RC9) -> 161945 | K120: =RC10/R2C14 -> 3238.9 | N120: =RC12*R3C11+RC13*R4C11 -> 0 | O120: =SUM(R7C14:RC14) -> 1040 | P120: =RC11+RC15 -> 4278.9
A121: 114 | B121: 11 | C121: =INT(R2C3*RC1+R3C3+R4C3*RC2+R5C3) -> 223 | D121: =INT(R2C4*RC1+R3C4+R4C4*RC2+R5C4) -> 181 | E121: =INT(R2C5*RC1+R3C5+R4C5*RC2+R5C5) -> 174 | F121: =INT(R2C6*RC1+R3C6+R4C6*RC2+R5C6) -> 65 | G121: =INT(R2C7*RC1+R3C7+R4C7*RC2+R5C7) -> 24 | H121: =INT(R2C8*RC1+R3C8+R4C8*RC2+R5C8) -> 283 | I121: 4460 | J121: =SUM(R7C9:RC9) -> 166405 | K121: =RC10/R2C14 -> 3328.1 | N121: =RC12*R3C11+RC13*R4C11 -> 0 | O121: =SUM(R7C14:RC14) -> 1040 | P121: =RC11+RC15 -> 4368.1
A122: 115 | B122: 11 | C122: =INT(R2C3*RC1+R3C3+R4C3*RC2+R5C3) -> 225 | D122: =INT(R2C4*RC1+R3C4+R4C4*RC2+R5C4) -> 182 | E122: =INT(R2C5*RC1+R3C5+R4C5*RC2+R5C5) -> 176 | F122: =INT(R2C6*RC1+R3C6+R4C6*RC2+R5C6) -> 66 | G122: =INT(R2C7*RC1+R3C7+R4C7*RC2+R5C7) -> 24 | H122: =INT(R2C8*RC1+R3C8+R4C8*RC2+R5C8) -> 285 | I122: 4550 | J122: =SUM(R7C9:RC9) -> 170955 | K122: =RC10/R2C14 -> 3419.1 | N122: =RC12*R3C11+RC13*R4C11 -> 0 | O122: =SUM(R7C14:RC14) -> 1040 | P122: =RC11+RC15 -> 4459.1
A123: 116 | B123: 11 | C123: =INT(R2C3*RC1+R3C3+R4C3*RC2+R5C3) -> 226 | D123: =INT(R2C4*RC1+R3C4+R4C4*RC2+R5C4) -> 183 | E123: =INT(R2C5*RC1+R3C5+R4C5*RC2+R5C5) -> 177 | F123: =INT(R2C6*RC1+R3C6+R4C6*RC2+R5C6) -> 66 | G123: =INT(R2C7*RC1+R3C7+R4C7*RC2+R5C7) -> 24 | H123: =INT(R2C8*RC1+R3C8+R4C8*RC2+R5C8) -> 287 | I123: 4640 | J123: =SUM(R7C9:RC9) -> 175595 | K123: =RC10/R2C14 -> 3511.9 | N123: =RC12*R3C11+RC13*R4C11 -> 0 | O123: =SUM(R7C14:RC14) -> 1040 | P123: =RC11+RC15 -> 4551.9
A124: 117 | B124: 11 | C124: =INT(R2C3*RC1+R3C3+R4C3*RC2+R5C3) -> 228 | D124: =INT(R2C4*RC1+R3C4+R4C4*RC2+R5C4) -> 184 | E124: =INT(R2C5*RC1+R3C5+R4C5*RC2+R5C5) -> 178 | F124: =INT(R2C6*RC1+R3C6+R4C6*RC2+R5C6) -> 67 | G124: =INT(R2C7*RC1+R3C7+R4C7*RC2+R5C7) -> 25 | H124: =INT(R2C8*RC1+R3C8+R4C8*RC2+R5C8) -> 289 | I124: 4730 | J124: =SUM(R7C9:RC9) -> 180325 | K124: =RC10/R2C14 -> 3606.5 | N124: =RC12*R3C11+RC13*R4C11 -> 0 | O124: =SUM(R7C14:RC14) -> 1040 | P124: =RC11+RC15 -> 4646.5
A125: 118 | B125: 11 | C125: =INT(R2C3*RC1+R3C3+R4C3*RC2+R5C3) -> 230 | D125: =INT(R2C4*RC1+R3C4+R4C4*RC2+R5C4) -> 185 | E125: =INT(R2C5*RC1+R3C5+R4C5*RC2+R5C5) -> 179 | F125: =INT(R2C6*RC1+R3C6+R4C6*RC2+R5C6) -> 67 | G125: =INT(R2C7*RC1+R3C7+R4C7*RC2+R5C7) -> 25 | H125: =INT(R2C8*RC1+R3C8+R4C8*RC2+R5C8) -> 291 | I125: 4820 | J125: =SUM(R7C9:RC9) -> 185145 | K125: =RC10/R2C14 -> 3702.9 | N125: =RC12*R3C11+RC13*R4C11 -> 0 | O125: =SUM(R7C14:RC14) -> 1040 | P125: =RC11+RC15 -> 4742.9
A126: 119 | B126: 11 | C126: =INT(R2C3*RC1+R3C3+R4C3*RC2+R5C3) -> 232 | D126: =INT(R2C4*RC1+R3C4+R4C4*RC2+R5C4) -> 186 | E126: =INT(R2C5*RC1+R3C5+R4C5*RC2+R5C5) -> 180 | F126: =INT(R2C6*RC1+R3C6+R4C6*RC2+R5C6) -> 68 | G126: =INT(R2C7*RC1+R3C7+R4C7*RC2+R5C7) -> 25 | H126: =INT(R2C8*RC1+R3C8+R4C8*RC2+R5C8) -> 293 | I126: 4910 | J126: =SUM(R7C9:RC9) -> 190055 | K126: =RC10/R2C14 -> 3801.1 | N126: =RC12*R3C11+RC13*R4C11 -> 0 | O126: =SUM(R7C14:RC14) -> 1040 | P126: =RC11+RC15 -> 4841.1
A127: 120 | B127: 12 | C127: =INT(R2C3*RC1+R3C3+R4C3*RC2+R5C3) -> 235 | D127: =INT(R2C4*RC1+R3C4+R4C4*RC2+R5C4) -> 192 | E127: =INT(R2C5*RC1+R3C5+R4C5*RC2+R5C5) -> 185 | F127: =INT(R2C6*RC1+R3C6+R4C6*RC2+R5C6) -> 69 | G127: =INT(R2C7*RC1+R3C7+R4C7*RC2+R5C7) -> 26 | H127: =INT(R2C8*RC1+R3C8+R4C8*RC2+R5C8) -> 300 | I127: 5000 | J127: =SUM(R7C9:RC9) -> 195055 | K127: =RC10/R2C14 -> 3901.1 | L127: 80 | M127: 4 | N127: =RC12*R3C11+RC13*R4C11 -> 460 | O127: =SUM(R7C14:RC14) -> 1500 | P127: =RC11+RC15 -> 5401.1
A128: 121 | B128: 12 | C128: =INT(R2C3*RC1+R3C3+R4C3*RC2+R5C3) -> 236 | D128: =INT(R2C4*RC1+R3C4+R4C4*RC2+R5C4) -> 193 | E128: =INT(R2C5*RC1+R3C5+R4C5*RC2+R5C5) -> 186 | F128: =INT(R2C6*RC1+R3C6+R4C6*RC2+R5C6) -> 69 | G128: =INT(R2C7*RC1+R3C7+R4C7*RC2+R5C7) -> 26 | H128: =INT(R2C8*RC1+R3C8+R4C8*RC2+R5C8) -> 302 | I128: 5100 | J128: =SUM(R7C9:RC9) -> 200155 | K128: =RC10/R2C14 -> 4003.1 | N128: =RC12*R3C11+RC13*R4C11 -> 0 | O128: =SUM(R7C14:RC14) -> 1500 | P128: =RC11+RC15 -> 5503.1
A129: 122 | B129: 12 | C129: =INT(R2C3*RC1+R3C3+R4C3*RC2+R5C3) -> 238 | D129: =INT(R2C4*RC1+R3C4+R4C4*RC2+R5C4) -> 194 | E129: =INT(R2C5*RC1+R3C5+R4C5*RC2+R5C5) -> 187 | F129: =INT(R2C6*RC1+R3C6+R4C6*RC2+R5C6) -> 70 | G129: =INT(R2C7*RC1+R3C7+R4C7*RC2+R5C7) -> 26 | H129: =INT(R2C8*RC1+R3C8+R4C8*RC2+R5C8) -> 304 | I129: 5200 | J129: =SUM(R7C9:RC9) -> 205355 | K129: =RC10/R2C14 -> 4107.1 | N129: =RC12*R3C11+RC13*R4C11 -> 0 | O129: =SUM(R7C14:RC14) -> 1500 | P129: =RC11+RC15 -> 5607.1
A130: 123 | B130: 12 | C130: =INT(R2C3*RC1+R3C3+R4C3*RC2+R5C3) -> 240 | D130: =INT(R2C4*RC1+R3C4+R4C4*RC2+R5C4) -> 195 | E130: =INT(R2C5*RC1+R3C5+R4C5*RC2+R5C5) -> 188 | F130: =INT(R2C6*RC1+R3C6+R4C6*RC2+R5C6) -> 70 | G130: =INT(R2C7*RC1+R3C7+R4C7*RC2+R5C7) -> 26 | H130: =INT(R2C8*RC1+R3C8+R4C8*RC2+R5C8) -> 306 | I130: 5300 | J130: =SUM(R7C9:RC9) -> 210655 | K130: =RC10/R2C14 -> 4213.1 | N130: =RC12*R3C11+RC13*R4C11 -> 0 | O130: =SUM(R7C14:RC14) -> 1500 | P130: =RC11+RC15 -> 5713.1
A131: 124 | B131: 12 | C131: =INT(R2C3*RC1+R3C3+R4C3*RC2+R5C3) -> 242 | D131: =INT(R2C4*RC1+R3C4+R4C4*RC2+R5C4) -> 196 | E131: =INT(R2C5*RC1+R3C5+R4C5*RC2+R5C5) -> 189 | F131: =INT(R2C6*RC1+R3C6+R4C6*RC2+R5C6) -> 71 | G131: =INT(R2C7*RC1+R3C7+R4C7*RC2+R5C7) -> 26 | H131: =INT(R2C8*RC1+R3C8+R4C8*RC2+R5C8) -> 308 | I131: 5400 | J131: =SUM(R7C9:RC9) -> 216055 | K131: =RC10/R2C14 -> 4321.1 | N131: =RC12*R3C11+RC13*R4C11 -> 0 | O131: =SUM(R7C14:RC14) -> 1500 | P131: =RC11+RC15 -> 5821.1
A132: 125 | B132: 12 | C132: =INT(R2C3*RC1+R3C3+R4C3*RC2+R5C3) -> 244 | D132: =INT(R2C4*RC1+R3C4+R4C4*RC2+R5C4) -> 197 | E132: =INT(R2C5*RC1+R3C5+R4C5*RC2+R5C5) -> 191 | F132: =INT(R2C6*RC1+R3C6+R4C6*RC2+R5C6) -> 71 | G132: =INT(R2C7*RC1+R3C7+R4C7*RC2+R5C7) -> 26 | H132: =INT(R2C8*RC1+R3C8+R4C8*RC2+R5C8) -> 310 | I132: 5500 | J132: =SUM(R7C9:RC9) -> 221555 | K132: =RC10/R2C14 -> 4431.1 | N132: =RC12*R3C11+RC13*R4C11 -> 0 | O132: =SUM(R7C14:RC14) -> 1500 | P132: =RC11+RC15 -> 5931.1
A133: 126 | B133: 12 | C133: =INT(R2C3*RC1+R3C3+R4C3*RC2+R5C3) -> 245 | D133: =INT(R2C4*RC1+R3C4+R4C4*RC2+R5C4) -> 198 | E133: =INT(R2C5*RC1+R3C5+R4C5*RC2+R5C5) -> 192 | F133: =INT(R2C6*RC1+R3C6+R4C6*RC2+R5C6) -> 72 | G133: =INT(R2C7*RC1+R3C7+R4C7*RC2+R5C7) -> 26 | H133: =INT(R2C8*RC1+R3C8+R4C8*RC2+R5C8) -> 312 | I133: 5600 | J133: =SUM(R7C9:RC9) -> 227155 | K133: =RC10/R2C14 -> 4543.1 | N133: =RC12*R3C11+RC13*R4C11 -> 0 | O133: =SUM(R7C14:RC14) -> 1500 | P133: =RC11+RC15 -> 6043.1
A134: 127 | B134: 12 | C134: =INT(R2C3*RC1+R3C3+R4C3*RC2+R5C3) -> 247 | D134: =INT(R2C4*RC1+R3C4+R4C4*RC2+R5C4) -> 199 | E134: =INT(R2C5*RC1+R3C5+R4C5*RC2+R5C5) -> 193 | F134: =INT(R2C6*RC1+R3C6+R4C6*RC2+R5C6) -> 72 | G134: =INT(R2C7*RC1+R3C7+R4C7*RC2+R5C7) -> 27 | H134: =INT(R2C8*RC1+R3C8+R4C8*RC2+R5C8) -> 314 | I134: 5700 | J134: =SUM(R7C9:RC9) -> 232855 | K134: =RC10/R2C14 -> 4657.1 | N134: =RC12*R3C11+RC13*R4C11 -> 0 | O134: =SUM(R7C14:RC14) -> 1500 | P134: =RC11+RC15 -> 6157.1
A135: 128 | B135: 12 | C135: =INT(R2C3*RC1+R3C3+R4C3*RC2+R5C3) -> 249 | D135: =INT(R2C4*RC1+R3C4+R4C4*RC2+R5C4) -> 200 | E135: =INT(R2C5*RC1+R3C5+R4C5*RC2+R5C5) -> 194 | F135: =INT(R2C6*RC1+R3C6+R4C6*RC2+R5C6) -> 73 | G135: =INT(R2C7*RC1+R3C7+R4C7*RC2+R5C7) -> 27 | H135: =INT(R2C8*RC1+R3C8+R4C8*RC2+R5C8) -> 316 | I135: 5800 | J135: =SUM(R7C9:RC9) -> 238655 | K135: =RC10/R2C14 -> 4773.1 | N135: =RC12*R3C11+RC13*R4C11 -> 0 | O135: =SUM(R7C14:RC14) -> 1500 | P135: =RC11+RC15 -> 6273.1
A136: 129 | B136: 12 | C136: =INT(R2C3*RC1+R3C3+R4C3*RC2+R5C3) -> 251 | D136: =INT(R2C4*RC1+R3C4+R4C4*RC2+R5C4) -> 201 | E136: =INT(R2C5*RC1+R3C5+R4C5*RC2+R5C5) -> 195 | F136: =INT(R2C6*RC1+R3C6+R4C6*RC2+R5C6) -> 73 | G136: =INT(R2C7*RC1+R3C7+R4C7*RC2+R5C7) -> 27 | H136: =INT(R2C8*RC1+R3C8+R4C8*RC2+R5C8) -> 318 | I136: 5900 | J136: =SUM(R7C9:RC9) -> 244555 | K136: =RC10/R2C14 -> 4891.1 | N136: =RC12*R3C11+RC13*R4C11 -> 0 | O136: =SUM(R7C14:RC14) -> 1500 | P136: =RC11+RC15 -> 6391.1
A137: 130 | B137: 13 | C137: =INT(R2C3*RC1+R3C3+R4C3*RC2+R5C3) -> 254 | D137: =INT(R2C4*RC1+R3C4+R4C4*RC2+R5C4) -> 207 | E137: =INT(R2C5*RC1+R3C5+R4C5*RC2+R5C5) -> 200 | F137: =INT(R2C6*RC1+R3C6+R4C6*RC2+R5C6) -> 74 | G137: =INT(R2C7*RC1+R3C7+R4C7*RC2+R5C7) -> 28 | H137: =INT(R2C8*RC1+R3C8+R4C8*RC2+R5C8) -> 325 | I137: 6000 | J137: =SUM(R7C9:RC9) -> 250555 | K137: =RC10/R2C14 -> 5011.1 | L137: 100 | M137: 8 | N137: =RC12*R3C11+RC13*R4C11 -> 620 | O137: =SUM(R7C14:RC14) -> 2120 | P137: =RC11+RC15 -> 7131.1
A138: 131 | B138: 13 | C138: =INT(R2C3*RC1+R3C3+R4C3*RC2+R5C3) -> 255 | D138: =INT(R2C4*RC1+R3C4+R4C4*RC2+R5C4) -> 208 | E138: =INT(R2C5*RC1+R3C5+R4C5*RC2+R5C5) -> 201 | F138: =INT(R2C6*RC1+R3C6+R4C6*RC2+R5C6) -> 75 | G138: =INT(R2C7*RC1+R3C7+R4C7*RC2+R5C7) -> 28 | H138: =INT(R2C8*RC1+R3C8+R4C8*RC2+R5C8) -> 327 | I138: 6110 | J138: =SUM(R7C9:RC9) -> 256665 | K138: =RC10/R2C14 -> 5133.3 | N138: =RC12*R3C11+RC13*R4C11 -> 0 | O138: =SUM(R7C14:RC14) -> 2120 | P138: =RC11+RC15 -> 7253.3
A139: 132 | B139: 13 | C139: =INT(R2C3*RC1+R3C3+R4C3*RC2+R5C3) -> 257 | D139: =INT(R2C4*RC1+R3C4+R4C4*RC2+R5C4) -> 209 | E139: =INT(R2C5*RC1+R3C5+R4C5*RC2+R5C5) -> 202 | F139: =INT(R2C6*RC1+R3C6+R4C6*RC2+R5C6) -> 75 | G139: =INT(R2C7*RC1+R3C7+R4C7*RC2+R5C7) -> 28 | H139: =INT(R2C8*RC1+R3C8+R4C8*RC2+R5C8) -> 329 | I139: 6220 | J139: =SUM(R7C9:RC9) -> 262885 | K139: =RC10/R2C14 -> 5257.7 | N139: =RC12*R3C11+RC13*R4C11 -> 0 | O139: =SUM(R7C14:RC14) -> 2120 | P139: =RC11+RC15 -> 7377.7
A140: 133 | B140: 13 | C140: =INT(R2C3*RC1+R3C3+R4C3*RC2+R5C3) -> 259 | D140: =INT(R2C4*RC1+R3C4+R4C4*RC2+R5C4) -> 210 | E140: =INT(R2C5*RC1+R3C5+R4C5*RC2+R5C5) -> 203 | F140: =INT(R2C6*RC1+R3C6+R4C6*RC2+R5C6) -> 76 | G140: =INT(R2C7*RC1+R3C7+R4C7*RC2+R5C7) -> 28 | H140: =INT(R2C8*RC1+R3C8+R4C8*RC2+R5C8) -> 331 | I140: 6330 | J140: =SUM(R7C9:RC9) -> 269215 | K140: =RC10/R2C14 -> 5384.3 | N140: =RC12*R3C11+RC13*R4C11 -> 0 | O140: =SUM(R7C14:RC14) -> 2120 | P140: =RC11+RC15 -> 7504.3
A141: 134 | B141: 13 | C141: =INT(R2C3*RC1+R3C3+R4C3*RC2+R5C3) -> 261 | D141: =INT(R2C4*RC1+R3C4+R4C4*RC2+R5C4) -> 211 | E141: =INT(R2C5*RC1+R3C5+R4C5*RC2+R5C5) -> 204 | F141: =INT(R2C6*RC1+R3C6+R4C6*RC2+R5C6) -> 76 | G141: =INT(R2C7*RC1+R3C7+R4C7*RC2+R5C7) -> 28 | H141: =INT(R2C8*RC1+R3C8+R4C8*RC2+R5C8) -> 333 | I141: 6440 | J141: =SUM(R7C9:RC9) -> 275655 | K141: =RC10/R2C14 -> 5513.1 | N141: =RC12*R3C11+RC13*R4C11 -> 0 | O141: =SUM(R7C14:RC14) -> 2120 | P141: =RC11+RC15 -> 7633.1
A142: 135 | B142: 13 | C142: =INT(R2C3*RC1+R3C3+R4C3*RC2+R5C3) -> 263 | D142: =INT(R2C4*RC1+R3C4+R4C4*RC2+R5C4) -> 212 | E142: =INT(R2C5*RC1+R3C5+R4C5*RC2+R5C5) -> 206 | F142: =INT(R2C6*RC1+R3C6+R4C6*RC2+R5C6) -> 77 | G142: =INT(R2C7*RC1+R3C7+R4C7*RC2+R5C7) -> 28 | H142: =INT(R2C8*RC1+R3C8+R4C8*RC2+R5C8) -> 335 | I142: 6550 | J142: =SUM(R7C9:RC9) -> 282205 | K142: =RC10/R2C14 -> 5644.1 | N142: =RC12*R3C11+RC13*R4C11 -> 0 | O142: =SUM(R7C14:RC14) -> 2120 | P142: =RC11+RC15 -> 7764.1
A143: 136 | B143: 13 | C143: =INT(R2C3*RC1+R3C3+R4C3*RC2+R5C3) -> 264 | D143: =INT(R2C4*RC1+R3C4+R4C4*RC2+R5C4) -> 213 | E143: =INT(R2C5*RC1+R3C5+R4C5*RC2+R5C5) -> 207 | F143: =INT(R2C6*RC1+R3C6+R4C6*RC2+R5C6) -> 77 | G143: =INT(R2C7*RC1+R3C7+R4C7*RC2+R5C7) -> 28 | H143: =INT(R2C8*RC1+R3C8+R4C8*RC2+R5C8) -> 337 | I143: 6660 | J143: =SUM(R7C9:RC9) -> 288865 | K143: =RC10/R2C14 -> 5777.3 | N143: =RC12*R3C11+RC13*R4C11 -> 0 | O143: =SUM(R7C14:RC14) -> 2120 | P143: =RC11+RC15 -> 7897.3
A144: 137 | B144: 13 | C144: =INT(R2C3*RC1+R3C3+R4C3*RC2+R5C3) -> 266 | D144: =INT(R2C4*RC1+R3C4+R4C4*RC2+R5C4) -> 214 | E144: =INT(R2C5*RC1+R3C5+R4C5*RC2+R5C5) -> 208 | F144: =INT(R2C6*RC1+R3C6+R4C6*RC2+R5C6) -> 78 | G144: =INT(R2C7*RC1+R3C7+R4C7*RC2+R5C7) -> 29 | H144: =INT(R2C8*RC1+R3C8+R4C8*RC2+R5C8) -> 339 | I144: 6770 | J144: =SUM(R7C9:RC9) -> 295635 | K144: =RC10/R2C14 -> 5912.7 | N144: =RC12*R3C11+RC13*R4C11 -> 0 | O144: =SUM(R7C14:RC14) -> 2120 | P144: =RC11+RC15 -> 8032.7
A145: 138 | B145: 13 | C145: =INT(R2C3*RC1+R3C3+R4C3*RC2+R5C3) -> 268 | D145: =INT(R2C4*RC1+R3C4+R4C4*RC2+R5C4) -> 215 | E145: =INT(R2C5*RC1+R3C5+R4C5*RC2+R5C5) -> 209 | F145: =INT(R2C6*RC1+R3C6+R4C6*RC2+R5C6) -> 78 | G145: =INT(R2C7*RC1+R3C7+R4C7*RC2+R5C7) -> 29 | H145: =INT(R2C8*RC1+R3C8+R4C8*RC2+R5C8) -> 341 | I145: 6880 | J145: =SUM(R7C9:RC9) -> 302515 | K145: =RC10/R2C14 -> 6050.3 | N145: =RC12*R3C11+RC13*R4C11 -> 0 | O145: =SUM(R7C14:RC14) -> 2120 | P145: =RC11+RC15 -> 8170.3
A146: 139 | B146: 13 | C146: =INT(R2C3*RC1+R3C3+R4C3*RC2+R5C3) -> 270 | D146: =INT(R2C4*RC1+R3C4+R4C4*RC2+R5C4) -> 216 | E146: =INT(R2C5*RC1+R3C5+R4C5*RC2+R5C5) -> 210 | F146: =INT(R2C6*RC1+R3C6+R4C6*RC2+R5C6) -> 79 | G146: =INT(R2C7*RC1+R3C7+R4C7*RC2+R5C7) -> 29 | H146: =INT(R2C8*RC1+R3C8+R4C8*RC2+R5C8) -> 343 | I146: 6990 | J146: =SUM(R7C9:RC9) -> 309505 | K146: =RC10/R2C14 -> 6190.1 | N146: =RC12*R3C11+RC13*R4C11 -> 0 | O146: =SUM(R7C14:RC14) -> 2120 | P146: =RC11+RC15 -> 8310.1
A147: 140 | B147: 14 | C147: =INT(R2C3*RC1+R3C3+R4C3*RC2+R5C3) -> 273 | D147: =INT(R2C4*RC1+R3C4+R4C4*RC2+R5C4) -> 222 | E147: =INT(R2C5*RC1+R3C5+R4C5*RC2+R5C5) -> 215 | F147: =INT(R2C6*RC1+R3C6+R4C6*RC2+R5C6) -> 80 | G147: =INT(R2C7*RC1+R3C7+R4C7*RC2+R5C7) -> 30 | H147: =INT(R2C8*RC1+R3C8+R4C8*RC2+R5C8) -> 350 | I147: 7100 | J147: =SUM(R7C9:RC9) -> 316605 | K147: =RC10/R2C14 -> 6332.1 | L147: 150 | M147: 16 | N147: =RC12*R3C11+RC13*R4C11 -> 990 | O147: =SUM(R7C14:RC14) -> 3110 | P147: =RC11+RC15 -> 9442.1
A148: 141 | B148: 14 | C148: =INT(R2C3*RC1+R3C3+R4C3*RC2+R5C3) -> 274 | D148: =INT(R2C4*RC1+R3C4+R4C4*RC2+R5C4) -> 223 | E148: =INT(R2C5*RC1+R3C5+R4C5*RC2+R5C5) -> 216 | F148: =INT(R2C6*RC1+R3C6+R4C6*RC2+R5C6) -> 80 | G148: =INT(R2C7*RC1+R3C7+R4C7*RC2+R5C7) -> 30 | H148: =INT(R2C8*RC1+R3C8+R4C8*RC2+R5C8) -> 352 | I148: 7220 | J148: =SUM(R7C9:RC9) -> 323825 | K148: =RC10/R2C14 -> 6476.5 | N148: =RC12*R3C11+RC13*R4C11 -> 0 | O148: =SUM(R7C14:RC14) -> 3110 | P148: =RC11+RC15 -> 9586.5
A149: 142 | B149: 14 | C149: =INT(R2C3*RC1+R3C3+R4C3*RC2+R5C3) -> 276 | D149: =INT(R2C4*RC1+R3C4+R4C4*RC2+R5C4) -> 224 | E149: =INT(R2C5*RC1+R3C5+R4C5*RC2+R5C5) -> 217 | F149: =INT(R2C6*RC1+R3C6+R4C6*RC2+R5C6) -> 81 | G149: =INT(R2C7*RC1+R3C7+R4C7*RC2+R5C7) -> 30 | H149: =INT(R2C8*RC1+R3C8+R4C8*RC2+R5C8) -> 354 | I149: 7340 | J149: =SUM(R7C9:RC9) -> 331165 | K149: =RC10/R2C14 -> 6623.3 | N149: =RC12*R3C11+RC13*R4C11 -> 0 | O149: =SUM(R7C14:RC14) -> 3110 | P149: =RC11+RC15 -> 9733.3
A150: 143 | B150: 14 | C150: =INT(R2C3*RC1+R3C3+R4C3*RC2+R5C3) -> 278 | D150: =INT(R2C4*RC1+R3C4+R4C4*RC2+R5C4) -> 225 | E150: =INT(R2C5*RC1+R3C5+R4C5*RC2+R5C5) -> 218 | F150: =INT(R2C6*RC1+R3C6+R4C6*RC2+R5C6) -> 81 | G150: =INT(R2C7*RC1+R3C7+R4C7*RC2+R5C7) -> 30 | H150: =INT(R2C8*RC1+R3C8+R4C8*RC2+R5C8) -> 356 | I150: 7460 | J150: =SUM(R7C9:RC9) -> 338625 | K150: =RC10/R2C14 -> 6772.5 | N150: =RC12*R3C11+RC13*R4C11 -> 0 | O150: =SUM(R7C14:RC14) -> 3110 | P150: =RC11+RC15 -> 9882.5
A151: 144 | B151: 14 | C151: =INT(R2C3*RC1+R3C3+R4C3*RC2+R5C3) -> 280 | D151: =INT(R2C4*RC1+R3C4+R4C4*RC2+R5C4) -> 226 | E151: =INT(R2C5*RC1+R3C5+R4C5*RC2+R5C5) -> 219 | F151: =INT(R2C6*RC1+R3C6+R4C6*RC2+R5C6) -> 82 | G151: =INT(R2C7*RC1+R3C7+R4C7*RC2+R5C7) -> 30 | H151: =INT(R2C8*RC1+R3C8+R4C8*RC2+R5C8) -> 358 | I151: 7580 | J151: =SUM(R7C9:RC9) -> 346205 | K151: =RC10/R2C14 -> 6924.1 | N151: =RC12*R3C11+RC13*R4C11 -> 0 | O151: =SUM(R7C14:RC14) -> 3110 | P151: =RC11+RC15 -> 10034.1
A152: 145 | B152: 14 | C152: =INT(R2C3*RC1+R3C3+R4C3*RC2+R5C3) -> 282 | D152: =INT(R2C4*RC1+R3C4+R4C4*RC2+R5C4) -> 227 | E152: =INT(R2C5*RC1+R3C5+R4C5*RC2+R5C5) -> 221 | F152: =INT(R2C6*RC1+R3C6+R4C6*RC2+R5C6) -> 82 | G152: =INT(R2C7*RC1+R3C7+R4C7*RC2+R5C7) -> 30 | H152: =INT(R2C8*RC1+R3C8+R4C8*RC2+R5C8) -> 360 | I152: 7700 | J152: =SUM(R7C9:RC9) -> 353905 | K152: =RC10/R2C14 -> 7078.1 | N152: =RC12*R3C11+RC13*R4C11 -> 0 | O152: =SUM(R7C14:RC14) -> 3110 | P152: =RC11+RC15 -> 10188.1
A153: 146 | B153: 14 | C153: =INT(R2C3*RC1+R3C3+R4C3*RC2+R5C3) -> 283 | D153: =INT(R2C4*RC1+R3C4+R4C4*RC2+R5C4) -> 228 | E153: =INT(R2C5*RC1+R3C5+R4C5*RC2+R5C5) -> 222 | F153: =INT(R2C6*RC1+R3C6+R4C6*RC2+R5C6) -> 83 | G153: =INT(R2C7*RC1+R3C7+R4C7*RC2+R5C7) -> 30 | H153: =INT(R2C8*RC1+R3C8+R4C8*RC2+R5C8) -> 362 | I153: 7820 | J153: =SUM(R7C9:RC9) -> 361725 | K153: =RC10/R2C14 -> 7234.5 | N153: =RC12*R3C11+RC13*R4C11 -> 0 | O153: =SUM(R7C14:RC14) -> 3110 | P153: =RC11+RC15 -> 10344.5
A154: 147 | B154: 14 | C154: =INT(R2C3*RC1+R3C3+R4C3*RC2+R5C3) -> 285 | D154: =INT(R2C4*RC1+R3C4+R4C4*RC2+R5C4) -> 229 | E154: =INT(R2C5*RC1+R3C5+R4C5*RC2+R5C5) -> 223 | F154: =INT(R2C6*RC1+R3C6+R4C6*RC2+R5C6) -> 83 | G154: =INT(R2C7*RC1+R3C7+R4C7*RC2+R5C7) -> 31 | H154: =INT(R2C8*RC1+R3C8+R4C8*RC2+R5C8) -> 364 | I154: 7940 | J154: =SUM(R7C9:RC9) -> 369665 | K154: =RC10/R2C14 -> 7393.3 | N154: =RC12*R3C11+RC13*R4C11 -> 0 | O154: =SUM(R7C14:RC14) -> 3110 | P154: =RC11+RC15 -> 10503.3
A155: 148 | B155: 14 | C155: =INT(R2C3*RC1+R3C3+R4C3*RC2+R5C3) -> 287 | D155: =INT(R2C4*RC1+R3C4+R4C4*RC2+R5C4) -> 230 | E155: =INT(R2C5*RC1+R3C5+R4C5*RC2+R5C5) -> 224 | F155: =INT(R2C6*RC1+R3C6+R4C6*RC2+R5C6) -> 84 | G155: =INT(R2C7*RC1+R3C7+R4C7*RC2+R5C7) -> 31 | H155: =INT(R2C8*RC1+R3C8+R4C8*RC2+R5C8) -> 366 | I155: 8060 | J155: =SUM(R7C9:RC9) -> 377725 | K155: =RC10/R2C14 -> 7554.5 | N155: =RC12*R3C11+RC13*R4C11 -> 0 | O155: =SUM(R7C14:RC14) -> 3110 | P155: =RC11+RC15 -> 10664.5
A156: 149 | B156: 14 | C156: =INT(R2C3*RC1+R3C3+R4C3*RC2+R5C3) -> 289 | D156: =INT(R2C4*RC1+R3C4+R4C4*RC2+R5C4) -> 231 | E156: =INT(R2C5*RC1+R3C5+R4C5*RC2+R5C5) -> 225 | F156: =INT(R2C6*RC1+R3C6+R4C6*RC2+R5C6) -> 84 | G156: =INT(R2C7*RC1+R3C7+R4C7*RC2+R5C7) -> 31 | H156: =INT(R2C8*RC1+R3C8+R4C8*RC2+R5C8) -> 368 | I156: 8180 | J156: =SUM(R7C9:RC9) -> 385905 | K156: =RC10/R2C14 -> 7718.1 | N156: =RC12*R3C11+RC13*R4C11 -> 0 | O156: =SUM(R7C14:RC14) -> 3110 | P156: =RC11+RC15 -> 10828.1 | T156: 比对梦诛
A157: 150 | B157: 15 | C157: =INT(R2C3*RC1+R3C3+R4C3*RC2+R5C3) -> 292 | D157: =INT(R2C4*RC1+R3C4+R4C4*RC2+R5C4) -> 237 | E157: =INT(R2C5*RC1+R3C5+R4C5*RC2+R5C5) -> 230 | F157: =INT(R2C6*RC1+R3C6+R4C6*RC2+R5C6) -> 85 | G157: =INT(R2C7*RC1+R3C7+R4C7*RC2+R5C7) -> 32 | H157: =INT(R2C8*RC1+R3C8+R4C8*RC2+R5C8) -> 375 | I157: 8300 | J157: =SUM(R7C9:RC9) -> 394205 | K157: =RC10/R2C14 -> 7884.1 | L157: 200 | M157: 24 | N157: =RC12*R3C11+RC13*R4C11 -> 1360 | O157: =SUM(R7C14:RC14) -> 4470 | P157: =RC11+RC15 -> 12354.1 | Q157: 到150级投放0.5A | T157: 1A
A158: 151 | B158: 15 | C158: =INT(R2C3*RC1+R3C3+R4C3*RC2+R5C3) -> 293 | D158: =INT(R2C4*RC1+R3C4+R4C4*RC2+R5C4) -> 238 | E158: =INT(R2C5*RC1+R3C5+R4C5*RC2+R5C5) -> 231 | F158: =INT(R2C6*RC1+R3C6+R4C6*RC2+R5C6) -> 86 | G158: =INT(R2C7*RC1+R3C7+R4C7*RC2+R5C7) -> 32 | H158: =INT(R2C8*RC1+R3C8+R4C8*RC2+R5C8) -> 377 | I158: 8350 | J158: =SUM(R7C9:RC9) -> 402555 | K158: =RC10/R2C14 -> 8051.1 | N158: =RC12*R3C11+RC13*R4C11 -> 0 | O158: =SUM(R7C14:RC14) -> 4470 | P158: =RC11+RC15 -> 12521.1 | Q158: P值 | R158: =R[-1]C[-2]/69000 -> 0.179044927536232 | T158: 0.35P
A159: 152 | B159: 15 | C159: =INT(R2C3*RC1+R3C3+R4C3*RC2+R5C3) -> 295 | D159: =INT(R2C4*RC1+R3C4+R4C4*RC2+R5C4) -> 239 | E159: =INT(R2C5*RC1+R3C5+R4C5*RC2+R5C5) -> 232 | F159: =INT(R2C6*RC1+R3C6+R4C6*RC2+R5C6) -> 86 | G159: =INT(R2C7*RC1+R3C7+R4C7*RC2+R5C7) -> 32 | H159: =INT(R2C8*RC1+R3C8+R4C8*RC2+R5C8) -> 379 | I159: 8480 | J159: =SUM(R7C9:RC9) -> 411035 | K159: =RC10/R2C14 -> 8220.7 | N159: =RC12*R3C11+RC13*R4C11 -> 0 | O159: =SUM(R7C14:RC14) -> 4470 | P159: =RC11+RC15 -> 12690.7
A160: 153 | B160: 15 | C160: =INT(R2C3*RC1+R3C3+R4C3*RC2+R5C3) -> 297 | D160: =INT(R2C4*RC1+R3C4+R4C4*RC2+R5C4) -> 240 | E160: =INT(R2C5*RC1+R3C5+R4C5*RC2+R5C5) -> 233 | F160: =INT(R2C6*RC1+R3C6+R4C6*RC2+R5C6) -> 87 | G160: =INT(R2C7*RC1+R3C7+R4C7*RC2+R5C7) -> 32 | H160: =INT(R2C8*RC1+R3C8+R4C8*RC2+R5C8) -> 381 | I160: 8610 | J160: =SUM(R7C9:RC9) -> 419645 | K160: =RC10/R2C14 -> 8392.9 | N160: =RC12*R3C11+RC13*R4C11 -> 0 | O160: =SUM(R7C14:RC14) -> 4470 | P160: =RC11+RC15 -> 12862.9
A161: 154 | B161: 15 | C161: =INT(R2C3*RC1+R3C3+R4C3*RC2+R5C3) -> 299 | D161: =INT(R2C4*RC1+R3C4+R4C4*RC2+R5C4) -> 241 | E161: =INT(R2C5*RC1+R3C5+R4C5*RC2+R5C5) -> 234 | F161: =INT(R2C6*RC1+R3C6+R4C6*RC2+R5C6) -> 87 | G161: =INT(R2C7*RC1+R3C7+R4C7*RC2+R5C7) -> 32 | H161: =INT(R2C8*RC1+R3C8+R4C8*RC2+R5C8) -> 383 | I161: 8740 | J161: =SUM(R7C9:RC9) -> 428385 | K161: =RC10/R2C14 -> 8567.7 | N161: =RC12*R3C11+RC13*R4C11 -> 0 | O161: =SUM(R7C14:RC14) -> 4470 | P161: =RC11+RC15 -> 13037.7
A162: 155 | B162: 15 | C162: =INT(R2C3*RC1+R3C3+R4C3*RC2+R5C3) -> 301 | D162: =INT(R2C4*RC1+R3C4+R4C4*RC2+R5C4) -> 242 | E162: =INT(R2C5*RC1+R3C5+R4C5*RC2+R5C5) -> 236 | F162: =INT(R2C6*RC1+R3C6+R4C6*RC2+R5C6) -> 88 | G162: =INT(R2C7*RC1+R3C7+R4C7*RC2+R5C7) -> 32 | H162: =INT(R2C8*RC1+R3C8+R4C8*RC2+R5C8) -> 385 | I162: 8870 | J162: =SUM(R7C9:RC9) -> 437255 | K162: =RC10/R2C14 -> 8745.1 | N162: =RC12*R3C11+RC13*R4C11 -> 0 | O162: =SUM(R7C14:RC14) -> 4470 | P162: =RC11+RC15 -> 13215.1
A163: 156 | B163: 15 | C163: =INT(R2C3*RC1+R3C3+R4C3*RC2+R5C3) -> 302 | D163: =INT(R2C4*RC1+R3C4+R4C4*RC2+R5C4) -> 243 | E163: =INT(R2C5*RC1+R3C5+R4C5*RC2+R5C5) -> 237 | F163: =INT(R2C6*RC1+R3C6+R4C6*RC2+R5C6) -> 88 | G163: =INT(R2C7*RC1+R3C7+R4C7*RC2+R5C7) -> 32 | H163: =INT(R2C8*RC1+R3C8+R4C8*RC2+R5C8) -> 387 | I163: 9000 | J163: =SUM(R7C9:RC9) -> 446255 | K163: =RC10/R2C14 -> 8925.1 | N163: =RC12*R3C11+RC13*R4C11 -> 0 | O163: =SUM(R7C14:RC14) -> 4470 | P163: =RC11+RC15 -> 13395.1
A164: 157 | B164: 15 | C164: =INT(R2C3*RC1+R3C3+R4C3*RC2+R5C3) -> 304 | D164: =INT(R2C4*RC1+R3C4+R4C4*RC2+R5C4) -> 244 | E164: =INT(R2C5*RC1+R3C5+R4C5*RC2+R5C5) -> 238 | F164: =INT(R2C6*RC1+R3C6+R4C6*RC2+R5C6) -> 89 | G164: =INT(R2C7*RC1+R3C7+R4C7*RC2+R5C7) -> 33 | H164: =INT(R2C8*RC1+R3C8+R4C8*RC2+R5C8) -> 389 | I164: 9130 | J164: =SUM(R7C9:RC9) -> 455385 | K164: =RC10/R2C14 -> 9107.7 | N164: =RC12*R3C11+RC13*R4C11 -> 0 | O164: =SUM(R7C14:RC14) -> 4470 | P164: =RC11+RC15 -> 13577.7
A165: 158 | B165: 15 | C165: =INT(R2C3*RC1+R3C3+R4C3*RC2+R5C3) -> 306 | D165: =INT(R2C4*RC1+R3C4+R4C4*RC2+R5C4) -> 245 | E165: =INT(R2C5*RC1+R3C5+R4C5*RC2+R5C5) -> 239 | F165: =INT(R2C6*RC1+R3C6+R4C6*RC2+R5C6) -> 89 | G165: =INT(R2C7*RC1+R3C7+R4C7*RC2+R5C7) -> 33 | H165: =INT(R2C8*RC1+R3C8+R4C8*RC2+R5C8) -> 391 | I165: 9260 | J165: =SUM(R7C9:RC9) -> 464645 | K165: =RC10/R2C14 -> 9292.9 | N165: =RC12*R3C11+RC13*R4C11 -> 0 | O165: =SUM(R7C14:RC14) -> 4470 | P165: =RC11+RC15 -> 13762.9
A166: 159 | B166: 15 | C166: =INT(R2C3*RC1+R3C3+R4C3*RC2+R5C3) -> 308 | D166: =INT(R2C4*RC1+R3C4+R4C4*RC2+R5C4) -> 246 | E166: =INT(R2C5*RC1+R3C5+R4C5*RC2+R5C5) -> 240 | F166: =INT(R2C6*RC1+R3C6+R4C6*RC2+R5C6) -> 90 | G166: =INT(R2C7*RC1+R3C7+R4C7*RC2+R5C7) -> 33 | H166: =INT(R2C8*RC1+R3C8+R4C8*RC2+R5C8) -> 393 | I166: 9390 | J166: =SUM(R7C9:RC9) -> 474035 | K166: =RC10/R2C14 -> 9480.7 | N166: =RC12*R3C11+RC13*R4C11 -> 0 | O166: =SUM(R7C14:RC14) -> 4470 | P166: =RC11+RC15 -> 13950.7
A167: 160 | B167: 16 | C167: =INT(R2C3*RC1+R3C3+R4C3*RC2+R5C3) -> 311 | D167: =INT(R2C4*RC1+R3C4+R4C4*RC2+R5C4) -> 252 | E167: =INT(R2C5*RC1+R3C5+R4C5*RC2+R5C5) -> 245 | F167: =INT(R2C6*RC1+R3C6+R4C6*RC2+R5C6) -> 91 | G167: =INT(R2C7*RC1+R3C7+R4C7*RC2+R5C7) -> 34 | H167: =INT(R2C8*RC1+R3C8+R4C8*RC2+R5C8) -> 400 | I167: 9520 | J167: =SUM(R7C9:RC9) -> 483555 | K167: =RC10/R2C14 -> 9671.1 | L167: 300 | M167: 32 | N167: =RC12*R3C11+RC13*R4C11 -> 1980 | O167: =SUM(R7C14:RC14) -> 6450 | P167: =RC11+RC15 -> 16121.1
A168: 161 | B168: 16 | C168: =INT(R2C3*RC1+R3C3+R4C3*RC2+R5C3) -> 312 | D168: =INT(R2C4*RC1+R3C4+R4C4*RC2+R5C4) -> 253 | E168: =INT(R2C5*RC1+R3C5+R4C5*RC2+R5C5) -> 246 | F168: =INT(R2C6*RC1+R3C6+R4C6*RC2+R5C6) -> 91 | G168: =INT(R2C7*RC1+R3C7+R4C7*RC2+R5C7) -> 34 | H168: =INT(R2C8*RC1+R3C8+R4C8*RC2+R5C8) -> 402 | I168: 9650 | J168: =SUM(R7C9:RC9) -> 493205 | K168: =RC10/R2C14 -> 9864.1 | N168: =RC12*R3C11+RC13*R4C11 -> 0 | O168: =SUM(R7C14:RC14) -> 6450 | P168: =RC11+RC15 -> 16314.1
A169: 162 | B169: 16 | C169: =INT(R2C3*RC1+R3C3+R4C3*RC2+R5C3) -> 314 | D169: =INT(R2C4*RC1+R3C4+R4C4*RC2+R5C4) -> 254 | E169: =INT(R2C5*RC1+R3C5+R4C5*RC2+R5C5) -> 247 | F169: =INT(R2C6*RC1+R3C6+R4C6*RC2+R5C6) -> 92 | G169: =INT(R2C7*RC1+R3C7+R4C7*RC2+R5C7) -> 34 | H169: =INT(R2C8*RC1+R3C8+R4C8*RC2+R5C8) -> 404 | I169: 9790 | J169: =SUM(R7C9:RC9) -> 502995 | K169: =RC10/R2C14 -> 10059.9 | N169: =RC12*R3C11+RC13*R4C11 -> 0 | O169: =SUM(R7C14:RC14) -> 6450 | P169: =RC11+RC15 -> 16509.9
A170: 163 | B170: 16 | C170: =INT(R2C3*RC1+R3C3+R4C3*RC2+R5C3) -> 316 | D170: =INT(R2C4*RC1+R3C4+R4C4*RC2+R5C4) -> 255 | E170: =INT(R2C5*RC1+R3C5+R4C5*RC2+R5C5) -> 248 | F170: =INT(R2C6*RC1+R3C6+R4C6*RC2+R5C6) -> 92 | G170: =INT(R2C7*RC1+R3C7+R4C7*RC2+R5C7) -> 34 | H170: =INT(R2C8*RC1+R3C8+R4C8*RC2+R5C8) -> 406 | I170: 9930 | J170: =SUM(R7C9:RC9) -> 512925 | K170: =RC10/R2C14 -> 10258.5 | N170: =RC12*R3C11+RC13*R4C11 -> 0 | O170: =SUM(R7C14:RC14) -> 6450 | P170: =RC11+RC15 -> 16708.5
A171: 164 | B171: 16 | C171: =INT(R2C3*RC1+R3C3+R4C3*RC2+R5C3) -> 318 | D171: =INT(R2C4*RC1+R3C4+R4C4*RC2+R5C4) -> 256 | E171: =INT(R2C5*RC1+R3C5+R4C5*RC2+R5C5) -> 249 | F171: =INT(R2C6*RC1+R3C6+R4C6*RC2+R5C6) -> 93 | G171: =INT(R2C7*RC1+R3C7+R4C7*RC2+R5C7) -> 34 | H171: =INT(R2C8*RC1+R3C8+R4C8*RC2+R5C8) -> 408 | I171: 10070 | J171: =SUM(R7C9:RC9) -> 522995 | K171: =RC10/R2C14 -> 10459.9 | N171: =RC12*R3C11+RC13*R4C11 -> 0 | O171: =SUM(R7C14:RC14) -> 6450 | P171: =RC11+RC15 -> 16909.9
A172: 165 | B172: 16 | C172: =INT(R2C3*RC1+R3C3+R4C3*RC2+R5C3) -> 320 | D172: =INT(R2C4*RC1+R3C4+R4C4*RC2+R5C4) -> 257 | E172: =INT(R2C5*RC1+R3C5+R4C5*RC2+R5C5) -> 251 | F172: =INT(R2C6*RC1+R3C6+R4C6*RC2+R5C6) -> 93 | G172: =INT(R2C7*RC1+R3C7+R4C7*RC2+R5C7) -> 34 | H172: =INT(R2C8*RC1+R3C8+R4C8*RC2+R5C8) -> 410 | I172: 10210 | J172: =SUM(R7C9:RC9) -> 533205 | K172: =RC10/R2C14 -> 10664.1 | N172: =RC12*R3C11+RC13*R4C11 -> 0 | O172: =SUM(R7C14:RC14) -> 6450 | P172: =RC11+RC15 -> 17114.1
A173: 166 | B173: 16 | C173: =INT(R2C3*RC1+R3C3+R4C3*RC2+R5C3) -> 321 | D173: =INT(R2C4*RC1+R3C4+R4C4*RC2+R5C4) -> 258 | E173: =INT(R2C5*RC1+R3C5+R4C5*RC2+R5C5) -> 252 | F173: =INT(R2C6*RC1+R3C6+R4C6*RC2+R5C6) -> 94 | G173: =INT(R2C7*RC1+R3C7+R4C7*RC2+R5C7) -> 34 | H173: =INT(R2C8*RC1+R3C8+R4C8*RC2+R5C8) -> 412 | I173: 10350 | J173: =SUM(R7C9:RC9) -> 543555 | K173: =RC10/R2C14 -> 10871.1 | N173: =RC12*R3C11+RC13*R4C11 -> 0 | O173: =SUM(R7C14:RC14) -> 6450 | P173: =RC11+RC15 -> 17321.1
A174: 167 | B174: 16 | C174: =INT(R2C3*RC1+R3C3+R4C3*RC2+R5C3) -> 323 | D174: =INT(R2C4*RC1+R3C4+R4C4*RC2+R5C4) -> 259 | E174: =INT(R2C5*RC1+R3C5+R4C5*RC2+R5C5) -> 253 | F174: =INT(R2C6*RC1+R3C6+R4C6*RC2+R5C6) -> 94 | G174: =INT(R2C7*RC1+R3C7+R4C7*RC2+R5C7) -> 35 | H174: =INT(R2C8*RC1+R3C8+R4C8*RC2+R5C8) -> 414 | I174: 10490 | J174: =SUM(R7C9:RC9) -> 554045 | K174: =RC10/R2C14 -> 11080.9 | N174: =RC12*R3C11+RC13*R4C11 -> 0 | O174: =SUM(R7C14:RC14) -> 6450 | P174: =RC11+RC15 -> 17530.9
A175: 168 | B175: 16 | C175: =INT(R2C3*RC1+R3C3+R4C3*RC2+R5C3) -> 325 | D175: =INT(R2C4*RC1+R3C4+R4C4*RC2+R5C4) -> 260 | E175: =INT(R2C5*RC1+R3C5+R4C5*RC2+R5C5) -> 254 | F175: =INT(R2C6*RC1+R3C6+R4C6*RC2+R5C6) -> 95 | G175: =INT(R2C7*RC1+R3C7+R4C7*RC2+R5C7) -> 35 | H175: =INT(R2C8*RC1+R3C8+R4C8*RC2+R5C8) -> 416 | I175: 10630 | J175: =SUM(R7C9:RC9) -> 564675 | K175: =RC10/R2C14 -> 11293.5 | N175: =RC12*R3C11+RC13*R4C11 -> 0 | O175: =SUM(R7C14:RC14) -> 6450 | P175: =RC11+RC15 -> 17743.5
A176: 169 | B176: 16 | C176: =INT(R2C3*RC1+R3C3+R4C3*RC2+R5C3) -> 327 | D176: =INT(R2C4*RC1+R3C4+R4C4*RC2+R5C4) -> 261 | E176: =INT(R2C5*RC1+R3C5+R4C5*RC2+R5C5) -> 255 | F176: =INT(R2C6*RC1+R3C6+R4C6*RC2+R5C6) -> 95 | G176: =INT(R2C7*RC1+R3C7+R4C7*RC2+R5C7) -> 35 | H176: =INT(R2C8*RC1+R3C8+R4C8*RC2+R5C8) -> 418 | I176: 10770 | J176: =SUM(R7C9:RC9) -> 575445 | K176: =RC10/R2C14 -> 11508.9 | N176: =RC12*R3C11+RC13*R4C11 -> 0 | O176: =SUM(R7C14:RC14) -> 6450 | P176: =RC11+RC15 -> 17958.9
A177: 170 | B177: 17 | C177: =INT(R2C3*RC1+R3C3+R4C3*RC2+R5C3) -> 330 | D177: =INT(R2C4*RC1+R3C4+R4C4*RC2+R5C4) -> 267 | E177: =INT(R2C5*RC1+R3C5+R4C5*RC2+R5C5) -> 260 | F177: =INT(R2C6*RC1+R3C6+R4C6*RC2+R5C6) -> 96 | G177: =INT(R2C7*RC1+R3C7+R4C7*RC2+R5C7) -> 36 | H177: =INT(R2C8*RC1+R3C8+R4C8*RC2+R5C8) -> 425 | I177: 10910 | J177: =SUM(R7C9:RC9) -> 586355 | K177: =RC10/R2C14 -> 11727.1 | L177: 500 | M177: 48 | N177: =RC12*R3C11+RC13*R4C11 -> 3220 | O177: =SUM(R7C14:RC14) -> 9670 | P177: =RC11+RC15 -> 21397.1
A178: 171 | B178: 17 | C178: =INT(R2C3*RC1+R3C3+R4C3*RC2+R5C3) -> 331 | D178: =INT(R2C4*RC1+R3C4+R4C4*RC2+R5C4) -> 268 | E178: =INT(R2C5*RC1+R3C5+R4C5*RC2+R5C5) -> 261 | F178: =INT(R2C6*RC1+R3C6+R4C6*RC2+R5C6) -> 97 | G178: =INT(R2C7*RC1+R3C7+R4C7*RC2+R5C7) -> 36 | H178: =INT(R2C8*RC1+R3C8+R4C8*RC2+R5C8) -> 427 | I178: 11050 | J178: =SUM(R7C9:RC9) -> 597405 | K178: =RC10/R2C14 -> 11948.1 | N178: =RC12*R3C11+RC13*R4C11 -> 0 | O178: =SUM(R7C14:RC14) -> 9670 | P178: =RC11+RC15 -> 21618.1
A179: 172 | B179: 17 | C179: =INT(R2C3*RC1+R3C3+R4C3*RC2+R5C3) -> 333 | D179: =INT(R2C4*RC1+R3C4+R4C4*RC2+R5C4) -> 269 | E179: =INT(R2C5*RC1+R3C5+R4C5*RC2+R5C5) -> 262 | F179: =INT(R2C6*RC1+R3C6+R4C6*RC2+R5C6) -> 97 | G179: =INT(R2C7*RC1+R3C7+R4C7*RC2+R5C7) -> 36 | H179: =INT(R2C8*RC1+R3C8+R4C8*RC2+R5C8) -> 429 | I179: 11200 | J179: =SUM(R7C9:RC9) -> 608605 | K179: =RC10/R2C14 -> 12172.1 | N179: =RC12*R3C11+RC13*R4C11 -> 0 | O179: =SUM(R7C14:RC14) -> 9670 | P179: =RC11+RC15 -> 21842.1
A180: 173 | B180: 17 | C180: =INT(R2C3*RC1+R3C3+R4C3*RC2+R5C3) -> 335 | D180: =INT(R2C4*RC1+R3C4+R4C4*RC2+R5C4) -> 270 | E180: =INT(R2C5*RC1+R3C5+R4C5*RC2+R5C5) -> 263 | F180: =INT(R2C6*RC1+R3C6+R4C6*RC2+R5C6) -> 98 | G180: =INT(R2C7*RC1+R3C7+R4C7*RC2+R5C7) -> 36 | H180: =INT(R2C8*RC1+R3C8+R4C8*RC2+R5C8) -> 431 | I180: 11350 | J180: =SUM(R7C9:RC9) -> 619955 | K180: =RC10/R2C14 -> 12399.1 | N180: =RC12*R3C11+RC13*R4C11 -> 0 | O180: =SUM(R7C14:RC14) -> 9670 | P180: =RC11+RC15 -> 22069.1
A181: 174 | B181: 17 | C181: =INT(R2C3*RC1+R3C3+R4C3*RC2+R5C3) -> 337 | D181: =INT(R2C4*RC1+R3C4+R4C4*RC2+R5C4) -> 271 | E181: =INT(R2C5*RC1+R3C5+R4C5*RC2+R5C5) -> 264 | F181: =INT(R2C6*RC1+R3C6+R4C6*RC2+R5C6) -> 98 | G181: =INT(R2C7*RC1+R3C7+R4C7*RC2+R5C7) -> 36 | H181: =INT(R2C8*RC1+R3C8+R4C8*RC2+R5C8) -> 433 | I181: 11500 | J181: =SUM(R7C9:RC9) -> 631455 | K181: =RC10/R2C14 -> 12629.1 | N181: =RC12*R3C11+RC13*R4C11 -> 0 | O181: =SUM(R7C14:RC14) -> 9670 | P181: =RC11+RC15 -> 22299.1
A182: 175 | B182: 17 | C182: =INT(R2C3*RC1+R3C3+R4C3*RC2+R5C3) -> 339 | D182: =INT(R2C4*RC1+R3C4+R4C4*RC2+R5C4) -> 272 | E182: =INT(R2C5*RC1+R3C5+R4C5*RC2+R5C5) -> 266 | F182: =INT(R2C6*RC1+R3C6+R4C6*RC2+R5C6) -> 99 | G182: =INT(R2C7*RC1+R3C7+R4C7*RC2+R5C7) -> 36 | H182: =INT(R2C8*RC1+R3C8+R4C8*RC2+R5C8) -> 435 | I182: 11650 | J182: =SUM(R7C9:RC9) -> 643105 | K182: =RC10/R2C14 -> 12862.1 | N182: =RC12*R3C11+RC13*R4C11 -> 0 | O182: =SUM(R7C14:RC14) -> 9670 | P182: =RC11+RC15 -> 22532.1
A183: 176 | B183: 17 | C183: =INT(R2C3*RC1+R3C3+R4C3*RC2+R5C3) -> 340 | D183: =INT(R2C4*RC1+R3C4+R4C4*RC2+R5C4) -> 273 | E183: =INT(R2C5*RC1+R3C5+R4C5*RC2+R5C5) -> 267 | F183: =INT(R2C6*RC1+R3C6+R4C6*RC2+R5C6) -> 99 | G183: =INT(R2C7*RC1+R3C7+R4C7*RC2+R5C7) -> 36 | H183: =INT(R2C8*RC1+R3C8+R4C8*RC2+R5C8) -> 437 | I183: 11800 | J183: =SUM(R7C9:RC9) -> 654905 | K183: =RC10/R2C14 -> 13098.1 | N183: =RC12*R3C11+RC13*R4C11 -> 0 | O183: =SUM(R7C14:RC14) -> 9670 | P183: =RC11+RC15 -> 22768.1
A184: 177 | B184: 17 | C184: =INT(R2C3*RC1+R3C3+R4C3*RC2+R5C3) -> 342 | D184: =INT(R2C4*RC1+R3C4+R4C4*RC2+R5C4) -> 274 | E184: =INT(R2C5*RC1+R3C5+R4C5*RC2+R5C5) -> 268 | F184: =INT(R2C6*RC1+R3C6+R4C6*RC2+R5C6) -> 100 | G184: =INT(R2C7*RC1+R3C7+R4C7*RC2+R5C7) -> 37 | H184: =INT(R2C8*RC1+R3C8+R4C8*RC2+R5C8) -> 439 | I184: 11950 | J184: =SUM(R7C9:RC9) -> 666855 | K184: =RC10/R2C14 -> 13337.1 | N184: =RC12*R3C11+RC13*R4C11 -> 0 | O184: =SUM(R7C14:RC14) -> 9670 | P184: =RC11+RC15 -> 23007.1
A185: 178 | B185: 17 | C185: =INT(R2C3*RC1+R3C3+R4C3*RC2+R5C3) -> 344 | D185: =INT(R2C4*RC1+R3C4+R4C4*RC2+R5C4) -> 275 | E185: =INT(R2C5*RC1+R3C5+R4C5*RC2+R5C5) -> 269 | F185: =INT(R2C6*RC1+R3C6+R4C6*RC2+R5C6) -> 100 | G185: =INT(R2C7*RC1+R3C7+R4C7*RC2+R5C7) -> 37 | H185: =INT(R2C8*RC1+R3C8+R4C8*RC2+R5C8) -> 441 | I185: 12100 | J185: =SUM(R7C9:RC9) -> 678955 | K185: =RC10/R2C14 -> 13579.1 | N185: =RC12*R3C11+RC13*R4C11 -> 0 | O185: =SUM(R7C14:RC14) -> 9670 | P185: =RC11+RC15 -> 23249.1
A186: 179 | B186: 17 | C186: =INT(R2C3*RC1+R3C3+R4C3*RC2+R5C3) -> 346 | D186: =INT(R2C4*RC1+R3C4+R4C4*RC2+R5C4) -> 276 | E186: =INT(R2C5*RC1+R3C5+R4C5*RC2+R5C5) -> 270 | F186: =INT(R2C6*RC1+R3C6+R4C6*RC2+R5C6) -> 101 | G186: =INT(R2C7*RC1+R3C7+R4C7*RC2+R5C7) -> 37 | H186: =INT(R2C8*RC1+R3C8+R4C8*RC2+R5C8) -> 443 | I186: 12250 | J186: =SUM(R7C9:RC9) -> 691205 | K186: =RC10/R2C14 -> 13824.1 | N186: =RC12*R3C11+RC13*R4C11 -> 0 | O186: =SUM(R7C14:RC14) -> 9670 | P186: =RC11+RC15 -> 23494.1
A187: 180 | B187: 18 | C187: =INT(R2C3*RC1+R3C3+R4C3*RC2+R5C3) -> 349 | D187: =INT(R2C4*RC1+R3C4+R4C4*RC2+R5C4) -> 282 | E187: =INT(R2C5*RC1+R3C5+R4C5*RC2+R5C5) -> 275 | F187: =INT(R2C6*RC1+R3C6+R4C6*RC2+R5C6) -> 102 | G187: =INT(R2C7*RC1+R3C7+R4C7*RC2+R5C7) -> 38 | H187: =INT(R2C8*RC1+R3C8+R4C8*RC2+R5C8) -> 450 | I187: 12400 | J187: =SUM(R7C9:RC9) -> 703605 | K187: =RC10/R2C14 -> 14072.1 | L187: 600 | M187: 64 | N187: =RC12*R3C11+RC13*R4C11 -> 3960 | O187: =SUM(R7C14:RC14) -> 13630 | P187: =RC11+RC15 -> 27702.1
A188: 181 | B188: 18 | C188: =INT(R2C3*RC1+R3C3+R4C3*RC2+R5C3) -> 350 | D188: =INT(R2C4*RC1+R3C4+R4C4*RC2+R5C4) -> 283 | E188: =INT(R2C5*RC1+R3C5+R4C5*RC2+R5C5) -> 276 | F188: =INT(R2C6*RC1+R3C6+R4C6*RC2+R5C6) -> 102 | G188: =INT(R2C7*RC1+R3C7+R4C7*RC2+R5C7) -> 38 | H188: =INT(R2C8*RC1+R3C8+R4C8*RC2+R5C8) -> 452 | I188: 12550 | J188: =SUM(R7C9:RC9) -> 716155 | K188: =RC10/R2C14 -> 14323.1 | N188: =RC12*R3C11+RC13*R4C11 -> 0 | O188: =SUM(R7C14:RC14) -> 13630 | P188: =RC11+RC15 -> 27953.1
A189: 182 | B189: 18 | C189: =INT(R2C3*RC1+R3C3+R4C3*RC2+R5C3) -> 352 | D189: =INT(R2C4*RC1+R3C4+R4C4*RC2+R5C4) -> 284 | E189: =INT(R2C5*RC1+R3C5+R4C5*RC2+R5C5) -> 277 | F189: =INT(R2C6*RC1+R3C6+R4C6*RC2+R5C6) -> 103 | G189: =INT(R2C7*RC1+R3C7+R4C7*RC2+R5C7) -> 38 | H189: =INT(R2C8*RC1+R3C8+R4C8*RC2+R5C8) -> 454 | I189: 12710 | J189: =SUM(R7C9:RC9) -> 728865 | K189: =RC10/R2C14 -> 14577.3 | N189: =RC12*R3C11+RC13*R4C11 -> 0 | O189: =SUM(R7C14:RC14) -> 13630 | P189: =RC11+RC15 -> 28207.3
A190: 183 | B190: 18 | C190: =INT(R2C3*RC1+R3C3+R4C3*RC2+R5C3) -> 354 | D190: =INT(R2C4*RC1+R3C4+R4C4*RC2+R5C4) -> 285 | E190: =INT(R2C5*RC1+R3C5+R4C5*RC2+R5C5) -> 278 | F190: =INT(R2C6*RC1+R3C6+R4C6*RC2+R5C6) -> 103 | G190: =INT(R2C7*RC1+R3C7+R4C7*RC2+R5C7) -> 38 | H190: =INT(R2C8*RC1+R3C8+R4C8*RC2+R5C8) -> 456 | I190: 12870 | J190: =SUM(R7C9:RC9) -> 741735 | K190: =RC10/R2C14 -> 14834.7 | N190: =RC12*R3C11+RC13*R4C11 -> 0 | O190: =SUM(R7C14:RC14) -> 13630 | P190: =RC11+RC15 -> 28464.7
A191: 184 | B191: 18 | C191: =INT(R2C3*RC1+R3C3+R4C3*RC2+R5C3) -> 356 | D191: =INT(R2C4*RC1+R3C4+R4C4*RC2+R5C4) -> 286 | E191: =INT(R2C5*RC1+R3C5+R4C5*RC2+R5C5) -> 279 | F191: =INT(R2C6*RC1+R3C6+R4C6*RC2+R5C6) -> 104 | G191: =INT(R2C7*RC1+R3C7+R4C7*RC2+R5C7) -> 38 | H191: =INT(R2C8*RC1+R3C8+R4C8*RC2+R5C8) -> 458 | I191: 13030 | J191: =SUM(R7C9:RC9) -> 754765 | K191: =RC10/R2C14 -> 15095.3 | N191: =RC12*R3C11+RC13*R4C11 -> 0 | O191: =SUM(R7C14:RC14) -> 13630 | P191: =RC11+RC15 -> 28725.3
A192: 185 | B192: 18 | C192: =INT(R2C3*RC1+R3C3+R4C3*RC2+R5C3) -> 358 | D192: =INT(R2C4*RC1+R3C4+R4C4*RC2+R5C4) -> 287 | E192: =INT(R2C5*RC1+R3C5+R4C5*RC2+R5C5) -> 281 | F192: =INT(R2C6*RC1+R3C6+R4C6*RC2+R5C6) -> 104 | G192: =INT(R2C7*RC1+R3C7+R4C7*RC2+R5C7) -> 38 | H192: =INT(R2C8*RC1+R3C8+R4C8*RC2+R5C8) -> 460 | I192: 13190 | J192: =SUM(R7C9:RC9) -> 767955 | K192: =RC10/R2C14 -> 15359.1 | N192: =RC12*R3C11+RC13*R4C11 -> 0 | O192: =SUM(R7C14:RC14) -> 13630 | P192: =RC11+RC15 -> 28989.1
A193: 186 | B193: 18 | C193: =INT(R2C3*RC1+R3C3+R4C3*RC2+R5C3) -> 359 | D193: =INT(R2C4*RC1+R3C4+R4C4*RC2+R5C4) -> 288 | E193: =INT(R2C5*RC1+R3C5+R4C5*RC2+R5C5) -> 282 | F193: =INT(R2C6*RC1+R3C6+R4C6*RC2+R5C6) -> 105 | G193: =INT(R2C7*RC1+R3C7+R4C7*RC2+R5C7) -> 38 | H193: =INT(R2C8*RC1+R3C8+R4C8*RC2+R5C8) -> 462 | I193: 13350 | J193: =SUM(R7C9:RC9) -> 781305 | K193: =RC10/R2C14 -> 15626.1 | N193: =RC12*R3C11+RC13*R4C11 -> 0 | O193: =SUM(R7C14:RC14) -> 13630 | P193: =RC11+RC15 -> 29256.1
A194: 187 | B194: 18 | C194: =INT(R2C3*RC1+R3C3+R4C3*RC2+R5C3) -> 361 | D194: =INT(R2C4*RC1+R3C4+R4C4*RC2+R5C4) -> 289 | E194: =INT(R2C5*RC1+R3C5+R4C5*RC2+R5C5) -> 283 | F194: =INT(R2C6*RC1+R3C6+R4C6*RC2+R5C6) -> 105 | G194: =INT(R2C7*RC1+R3C7+R4C7*RC2+R5C7) -> 39 | H194: =INT(R2C8*RC1+R3C8+R4C8*RC2+R5C8) -> 464 | I194: 13510 | J194: =SUM(R7C9:RC9) -> 794815 | K194: =RC10/R2C14 -> 15896.3 | N194: =RC12*R3C11+RC13*R4C11 -> 0 | O194: =SUM(R7C14:RC14) -> 13630 | P194: =RC11+RC15 -> 29526.3
A195: 188 | B195: 18 | C195: =INT(R2C3*RC1+R3C3+R4C3*RC2+R5C3) -> 363 | D195: =INT(R2C4*RC1+R3C4+R4C4*RC2+R5C4) -> 290 | E195: =INT(R2C5*RC1+R3C5+R4C5*RC2+R5C5) -> 284 | F195: =INT(R2C6*RC1+R3C6+R4C6*RC2+R5C6) -> 106 | G195: =INT(R2C7*RC1+R3C7+R4C7*RC2+R5C7) -> 39 | H195: =INT(R2C8*RC1+R3C8+R4C8*RC2+R5C8) -> 466 | I195: 13670 | J195: =SUM(R7C9:RC9) -> 808485 | K195: =RC10/R2C14 -> 16169.7 | N195: =RC12*R3C11+RC13*R4C11 -> 0 | O195: =SUM(R7C14:RC14) -> 13630 | P195: =RC11+RC15 -> 29799.7
A196: 189 | B196: 18 | C196: =INT(R2C3*RC1+R3C3+R4C3*RC2+R5C3) -> 365 | D196: =INT(R2C4*RC1+R3C4+R4C4*RC2+R5C4) -> 291 | E196: =INT(R2C5*RC1+R3C5+R4C5*RC2+R5C5) -> 285 | F196: =INT(R2C6*RC1+R3C6+R4C6*RC2+R5C6) -> 106 | G196: =INT(R2C7*RC1+R3C7+R4C7*RC2+R5C7) -> 39 | H196: =INT(R2C8*RC1+R3C8+R4C8*RC2+R5C8) -> 468 | I196: 13830 | J196: =SUM(R7C9:RC9) -> 822315 | K196: =RC10/R2C14 -> 16446.3 | N196: =RC12*R3C11+RC13*R4C11 -> 0 | O196: =SUM(R7C14:RC14) -> 13630 | P196: =RC11+RC15 -> 30076.3
A197: 190 | B197: 19 | C197: =INT(R2C3*RC1+R3C3+R4C3*RC2+R5C3) -> 368 | D197: =INT(R2C4*RC1+R3C4+R4C4*RC2+R5C4) -> 297 | E197: =INT(R2C5*RC1+R3C5+R4C5*RC2+R5C5) -> 290 | F197: =INT(R2C6*RC1+R3C6+R4C6*RC2+R5C6) -> 107 | G197: =INT(R2C7*RC1+R3C7+R4C7*RC2+R5C7) -> 40 | H197: =INT(R2C8*RC1+R3C8+R4C8*RC2+R5C8) -> 475 | I197: 13990 | J197: =SUM(R7C9:RC9) -> 836305 | K197: =RC10/R2C14 -> 16726.1 | L197: 800 | M197: 80 | N197: =RC12*R3C11+RC13*R4C11 -> 5200 | O197: =SUM(R7C14:RC14) -> 18830 | P197: =RC11+RC15 -> 35556.1
A198: 191 | B198: 19 | C198: =INT(R2C3*RC1+R3C3+R4C3*RC2+R5C3) -> 369 | D198: =INT(R2C4*RC1+R3C4+R4C4*RC2+R5C4) -> 298 | E198: =INT(R2C5*RC1+R3C5+R4C5*RC2+R5C5) -> 291 | F198: =INT(R2C6*RC1+R3C6+R4C6*RC2+R5C6) -> 108 | G198: =INT(R2C7*RC1+R3C7+R4C7*RC2+R5C7) -> 40 | H198: =INT(R2C8*RC1+R3C8+R4C8*RC2+R5C8) -> 477 | I198: 14150 | J198: =SUM(R7C9:RC9) -> 850455 | K198: =RC10/R2C14 -> 17009.1 | N198: =RC12*R3C11+RC13*R4C11 -> 0 | O198: =SUM(R7C14:RC14) -> 18830 | P198: =RC11+RC15 -> 35839.1
A199: 192 | B199: 19 | C199: =INT(R2C3*RC1+R3C3+R4C3*RC2+R5C3) -> 371 | D199: =INT(R2C4*RC1+R3C4+R4C4*RC2+R5C4) -> 299 | E199: =INT(R2C5*RC1+R3C5+R4C5*RC2+R5C5) -> 292 | F199: =INT(R2C6*RC1+R3C6+R4C6*RC2+R5C6) -> 108 | G199: =INT(R2C7*RC1+R3C7+R4C7*RC2+R5C7) -> 40 | H199: =INT(R2C8*RC1+R3C8+R4C8*RC2+R5C8) -> 479 | I199: 14320 | J199: =SUM(R7C9:RC9) -> 864775 | K199: =RC10/R2C14 -> 17295.5 | N199: =RC12*R3C11+RC13*R4C11 -> 0 | O199: =SUM(R7C14:RC14) -> 18830 | P199: =RC11+RC15 -> 36125.5
A200: 193 | B200: 19 | C200: =INT(R2C3*RC1+R3C3+R4C3*RC2+R5C3) -> 373 | D200: =INT(R2C4*RC1+R3C4+R4C4*RC2+R5C4) -> 300 | E200: =INT(R2C5*RC1+R3C5+R4C5*RC2+R5C5) -> 293 | F200: =INT(R2C6*RC1+R3C6+R4C6*RC2+R5C6) -> 109 | G200: =INT(R2C7*RC1+R3C7+R4C7*RC2+R5C7) -> 40 | H200: =INT(R2C8*RC1+R3C8+R4C8*RC2+R5C8) -> 481 | I200: 14490 | J200: =SUM(R7C9:RC9) -> 879265 | K200: =RC10/R2C14 -> 17585.3 | N200: =RC12*R3C11+RC13*R4C11 -> 0 | O200: =SUM(R7C14:RC14) -> 18830 | P200: =RC11+RC15 -> 36415.3
A201: 194 | B201: 19 | C201: =INT(R2C3*RC1+R3C3+R4C3*RC2+R5C3) -> 375 | D201: =INT(R2C4*RC1+R3C4+R4C4*RC2+R5C4) -> 301 | E201: =INT(R2C5*RC1+R3C5+R4C5*RC2+R5C5) -> 294 | F201: =INT(R2C6*RC1+R3C6+R4C6*RC2+R5C6) -> 109 | G201: =INT(R2C7*RC1+R3C7+R4C7*RC2+R5C7) -> 40 | H201: =INT(R2C8*RC1+R3C8+R4C8*RC2+R5C8) -> 483 | I201: 14660 | J201: =SUM(R7C9:RC9) -> 893925 | K201: =RC10/R2C14 -> 17878.5 | N201: =RC12*R3C11+RC13*R4C11 -> 0 | O201: =SUM(R7C14:RC14) -> 18830 | P201: =RC11+RC15 -> 36708.5
A202: 195 | B202: 19 | C202: =INT(R2C3*RC1+R3C3+R4C3*RC2+R5C3) -> 377 | D202: =INT(R2C4*RC1+R3C4+R4C4*RC2+R5C4) -> 302 | E202: =INT(R2C5*RC1+R3C5+R4C5*RC2+R5C5) -> 296 | F202: =INT(R2C6*RC1+R3C6+R4C6*RC2+R5C6) -> 110 | G202: =INT(R2C7*RC1+R3C7+R4C7*RC2+R5C7) -> 40 | H202: =INT(R2C8*RC1+R3C8+R4C8*RC2+R5C8) -> 485 | I202: 14830 | J202: =SUM(R7C9:RC9) -> 908755 | K202: =RC10/R2C14 -> 18175.1 | N202: =RC12*R3C11+RC13*R4C11 -> 0 | O202: =SUM(R7C14:RC14) -> 18830 | P202: =RC11+RC15 -> 37005.1
A203: 196 | B203: 19 | C203: =INT(R2C3*RC1+R3C3+R4C3*RC2+R5C3) -> 378 | D203: =INT(R2C4*RC1+R3C4+R4C4*RC2+R5C4) -> 303 | E203: =INT(R2C5*RC1+R3C5+R4C5*RC2+R5C5) -> 297 | F203: =INT(R2C6*RC1+R3C6+R4C6*RC2+R5C6) -> 110 | G203: =INT(R2C7*RC1+R3C7+R4C7*RC2+R5C7) -> 40 | H203: =INT(R2C8*RC1+R3C8+R4C8*RC2+R5C8) -> 487 | I203: 15000 | J203: =SUM(R7C9:RC9) -> 923755 | K203: =RC10/R2C14 -> 18475.1 | N203: =RC12*R3C11+RC13*R4C11 -> 0 | O203: =SUM(R7C14:RC14) -> 18830 | P203: =RC11+RC15 -> 37305.1
A204: 197 | B204: 19 | C204: =INT(R2C3*RC1+R3C3+R4C3*RC2+R5C3) -> 380 | D204: =INT(R2C4*RC1+R3C4+R4C4*RC2+R5C4) -> 304 | E204: =INT(R2C5*RC1+R3C5+R4C5*RC2+R5C5) -> 298 | F204: =INT(R2C6*RC1+R3C6+R4C6*RC2+R5C6) -> 111 | G204: =INT(R2C7*RC1+R3C7+R4C7*RC2+R5C7) -> 41 | H204: =INT(R2C8*RC1+R3C8+R4C8*RC2+R5C8) -> 489 | I204: 15170 | J204: =SUM(R7C9:RC9) -> 938925 | K204: =RC10/R2C14 -> 18778.5 | N204: =RC12*R3C11+RC13*R4C11 -> 0 | O204: =SUM(R7C14:RC14) -> 18830 | P204: =RC11+RC15 -> 37608.5
A205: 198 | B205: 19 | C205: =INT(R2C3*RC1+R3C3+R4C3*RC2+R5C3) -> 382 | D205: =INT(R2C4*RC1+R3C4+R4C4*RC2+R5C4) -> 305 | E205: =INT(R2C5*RC1+R3C5+R4C5*RC2+R5C5) -> 299 | F205: =INT(R2C6*RC1+R3C6+R4C6*RC2+R5C6) -> 111 | G205: =INT(R2C7*RC1+R3C7+R4C7*RC2+R5C7) -> 41 | H205: =INT(R2C8*RC1+R3C8+R4C8*RC2+R5C8) -> 491 | I205: 15340 | J205: =SUM(R7C9:RC9) -> 954265 | K205: =RC10/R2C14 -> 19085.3 | N205: =RC12*R3C11+RC13*R4C11 -> 0 | O205: =SUM(R7C14:RC14) -> 18830 | P205: =RC11+RC15 -> 37915.3
A206: 199 | B206: 19 | C206: =INT(R2C3*RC1+R3C3+R4C3*RC2+R5C3) -> 384 | D206: =INT(R2C4*RC1+R3C4+R4C4*RC2+R5C4) -> 306 | E206: =INT(R2C5*RC1+R3C5+R4C5*RC2+R5C5) -> 300 | F206: =INT(R2C6*RC1+R3C6+R4C6*RC2+R5C6) -> 112 | G206: =INT(R2C7*RC1+R3C7+R4C7*RC2+R5C7) -> 41 | H206: =INT(R2C8*RC1+R3C8+R4C8*RC2+R5C8) -> 493 | I206: 15510 | J206: =SUM(R7C9:RC9) -> 969775 | K206: =RC10/R2C14 -> 19395.5 | N206: =RC12*R3C11+RC13*R4C11 -> 0 | O206: =SUM(R7C14:RC14) -> 18830 | P206: =RC11+RC15 -> 38225.5
A207: 200 | B207: 20 | C207: =INT(R2C3*RC1+R3C3+R4C3*RC2+R5C3) -> 387 | D207: =INT(R2C4*RC1+R3C4+R4C4*RC2+R5C4) -> 312 | E207: =INT(R2C5*RC1+R3C5+R4C5*RC2+R5C5) -> 305 | F207: =INT(R2C6*RC1+R3C6+R4C6*RC2+R5C6) -> 113 | G207: =INT(R2C7*RC1+R3C7+R4C7*RC2+R5C7) -> 42 | H207: =INT(R2C8*RC1+R3C8+R4C8*RC2+R5C8) -> 500 | I207: 15680 | J207: =SUM(R7C9:RC9) -> 985455 | K207: =RC10/R2C14 -> 19709.1 | L207: 1000 | M207: 100 | N207: =RC12*R3C11+RC13*R4C11 -> 6500 | O207: =SUM(R7C14:RC14) -> 25330 | P207: =RC11+RC15 -> 45039.1 | Q207: 到200级投放约0.65A
A208: 合计 | I208: =SUM(R[-201]C:R[-1]C) -> 985455 | Q208: P值 | R208: =R[-1]C[-2]/69000 -> 0.652740579710145