Sheet: ctSubMonsterConf
A1: AutoBVT: 神魔志小怪编号规则： 第二位数为难度标识。第三第四位数为关卡标识。第五位数为本关卡怪物种类标识 | F1: 0 | V1: id,权重
A2: nID | B2: sName | C2: sModel | D2: bGhost | E2: bScale | F2: tActSkill | G2: tPasSkill | H2: fnHP | I2: fnAtk | J2: fnDef | K2: fnMana | L2: fnSpeed | M2: fnMag | N2: fnWeaponAtk | O2: fnAtkPra | P2: fnDefPra | Q2: fnMagPra | R2: tTalkSchool | S2: sExistTalk | T2: sNotExistTalk | U2: nEscapeRounds | V2: tCallMonster | W2: nSchool
A3: i | B3: s | C3: s | D3: b | E3: b | F3: t{ii} | G3: t{ii} | H3: e | I3: e | J3: e | K3: e | L3: e | M3: e | N3: e | O3: e | P3: e | Q3: e | R3: t{i} | S3: s | T3: s | U3: i | V3: t{ii} | W3: i
A4: 子怪物ID | B4: 名字 | C4: 模型ID | D4: 是否魅怪 | E4: 是否缩放 | F4: 主动技能表(技能ID,概率) | G4: 被动技能表(技能ID,概率) | H4: 血量公式 | I4: 攻击力公式 | J4: 防御公式 | K4: 灵力公式 | L4: 速度公式 | M4: 法力公式 | N4: 武器攻击公式 | O4: 攻法修炼等级 | P4: 防御修炼等级 | Q4: 法抗修炼等级 | R4: 喊话门派 | S4: 存在门派则喊话 | T4: 不存在喊话 | U4: 逃跑回合数 | V4: 召唤的子怪 | W4: 门派ID
A5: 1 | B5: 莫愁 | C5: hero_1001 | D5: 0 | E5: 0 | F5: 1411,100;1412,100;1413,100;1414,100; | G5: 0,0; | H5: 12*LV+30 | I5: 2.1*LV+30 | J5: 1.2*LV+10 | K5: 2.2*LV+15 | L5: 1.1*LV+8 | M5: 1000*LV+100000 | N5: 0 | O5: math.max(0,(lv/10)-1) | P5: math.max(0,(lv/10)-1) | Q5: math.max(0,(lv/10)-1) | R5: 0; | S5: 有药王谷和盘丝洞的弟子在，真是不爽，还是跑路算了！ | T5: 药王谷和盘丝洞的弟子不在眼前，真是轻松愉快啊！ | U5: 0 | V5: 0,0; | W5: 2
A6: 2 | B6: 亦诗 | C6: hero_2001 | D6: 0 | E6: 0 | F6: 0,0; | G6: 0,0; | H6: 12*LV+70 | I6: 2.1*LV+30 | J6: 1.2*LV+10 | K6: 2.2*LV+15 | L6: 1.1*LV+8 | M6: 1000*LV+100000 | N6: 0 | O6: math.max(0,(lv/10)-1) | P6: math.max(0,(lv/10)-1) | Q6: math.max(0,(lv/10)-1) | R6: 0; | S6: 有药王谷和盘丝洞的弟子在，真是不爽，还是跑路算了！ | T6: 药王谷和盘丝洞的弟子不在眼前，真是轻松愉快啊！ | U6: 0 | V6: 0,0; | W6: 0
A7: 3 | B7: 李青峰 | C7: hero_1001 | D7: 0 | E7: 0 | F7: 0,0; | G7: 0,0; | H7: 12*LV+70 | I7: 2.1*LV+30 | J7: 1.2*LV+10 | K7: 2.2*LV+15 | L7: 1.1*LV+8 | M7: 1000*LV+100000 | N7: 0 | O7: math.max(0,(lv/10)-1) | P7: math.max(0,(lv/10)-1) | Q7: math.max(0,(lv/10)-1) | R7: 0; | S7: 有药王谷和盘丝洞的弟子在，真是不爽，还是跑路算了！ | T7: 药王谷和盘丝洞的弟子不在眼前，真是轻松愉快啊！ | U7: 0 | V7: 0,0; | W7: 0
A8: 4 | B8: 张若风 | C8: hero_2001 | D8: 0 | E8: 0 | F8: 0,0; | G8: 0,0; | H8: 12*LV+70 | I8: 2.1*LV+30 | J8: 1.2*LV+10 | K8: 2.2*LV+15 | L8: 1.1*LV+8 | M8: 1000*LV+100000 | N8: 0 | O8: math.max(0,(lv/10)-1) | P8: math.max(0,(lv/10)-1) | Q8: math.max(0,(lv/10)-1) | R8: 0; | S8: 有药王谷和盘丝洞的弟子在，真是不爽，还是跑路算了！ | T8: 药王谷和盘丝洞的弟子不在眼前，真是轻松愉快啊！ | U8: 0 | V8: 0,0; | W8: 0
A9: 5 | B9: 菩提 | C9: hero_1001 | D9: 0 | E9: 0 | F9: 0,0; | G9: 0,0; | H9: 12*LV+70 | I9: 2.1*LV+30 | J9: 1.2*LV+10 | K9: 2.2*LV+15 | L9: 1.1*LV+8 | M9: 1000*LV+100000 | N9: 0 | O9: math.max(0,(lv/10)-1) | P9: math.max(0,(lv/10)-1) | Q9: math.max(0,(lv/10)-1) | R9: 0; | S9: 有药王谷和盘丝洞的弟子在，真是不爽，还是跑路算了！ | T9: 药王谷和盘丝洞的弟子不在眼前，真是轻松愉快啊！ | U9: 0 | V9: 0,0; | W9: 0
A10: 6 | B10: 风道 | C10: hero_2001 | D10: 0 | E10: 0 | F10: 0,0; | G10: 0,0; | H10: 12*LV+70 | I10: 2.1*LV+30 | J10: 1.2*LV+10 | K10: 2.2*LV+15 | L10: 1.1*LV+8 | M10: 1000*LV+100000 | N10: 0 | O10: math.max(0,(lv/10)-1) | P10: math.max(0,(lv/10)-1) | Q10: math.max(0,(lv/10)-1) | R10: 0; | S10: 有药王谷和盘丝洞的弟子在，真是不爽，还是跑路算了！ | T10: 药王谷和盘丝洞的弟子不在眼前，真是轻松愉快啊！ | U10: 0 | V10: 0,0; | W10: 0
A11: 7 | B11: 无双子 | C11: hero_1001 | D11: 0 | E11: 0 | F11: 0,0; | G11: 0,0; | H11: 12*LV+30 | I11: 2.1*LV+30 | J11: 1.2*LV+10 | K11: 2.2*LV+15 | L11: 1.1*LV+8 | M11: 1000*LV+100000 | N11: 0 | O11: math.max(0,(lv/10)-1) | P11: math.max(0,(lv/10)-1) | Q11: math.max(0,(lv/10)-1) | R11: 0; | S11: 有药王谷和盘丝洞的弟子在，真是不爽，还是跑路算了！ | T11: 药王谷和盘丝洞的弟子不在眼前，真是轻松愉快啊！ | U11: 0 | V11: 0,0; | W11: 0
A12: 8 | B12: 青花 | C12: hero_2001 | D12: 0 | E12: 0 | F12: 0,0; | G12: 0,0; | H12: 12*LV+70 | I12: 2.1*LV+30 | J12: 1.2*LV+10 | K12: 2.2*LV+15 | L12: 1.1*LV+8 | M12: 1000*LV+100000 | N12: 0 | O12: math.max(0,(lv/10)-1) | P12: math.max(0,(lv/10)-1) | Q12: math.max(0,(lv/10)-1) | R12: 0; | S12: 有药王谷和盘丝洞的弟子在，真是不爽，还是跑路算了！ | T12: 药王谷和盘丝洞的弟子不在眼前，真是轻松愉快啊！ | U12: 0 | V12: 0,0; | W12: 0
A13: 9 | B13: 艾蓝 | C13: hero_1001 | D13: 0 | E13: 0 | F13: 0,0; | G13: 0,0; | H13: 12*LV+70 | I13: 2.1*LV+30 | J13: 1.2*LV+10 | K13: 2.2*LV+15 | L13: 1.1*LV+8 | M13: 1000*LV+100000 | N13: 0 | O13: math.max(0,(lv/10)-1) | P13: math.max(0,(lv/10)-1) | Q13: math.max(0,(lv/10)-1) | R13: 0; | S13: 有药王谷和盘丝洞的弟子在，真是不爽，还是跑路算了！ | T13: 药王谷和盘丝洞的弟子不在眼前，真是轻松愉快啊！ | U13: 0 | V13: 0,0; | W13: 0
A14: 10 | B14: 铃铛 | C14: hero_2001 | D14: 0 | E14: 0 | F14: 0,0; | G14: 0,0; | H14: 12*LV+70 | I14: 2.1*LV+30 | J14: 1.2*LV+10 | K14: 2.2*LV+15 | L14: 1.1*LV+8 | M14: 1000*LV+100000 | N14: 0 | O14: math.max(0,(lv/10)-1) | P14: math.max(0,(lv/10)-1) | Q14: math.max(0,(lv/10)-1) | R14: 0; | S14: 有药王谷和盘丝洞的弟子在，真是不爽，还是跑路算了！ | T14: 药王谷和盘丝洞的弟子不在眼前，真是轻松愉快啊！ | U14: 0 | V14: 0,0; | W14: 0
A15: 11 | B15: 哈士奇 | C15: pet_1 | D15: 0 | E15: 0 | F15: 0,0; | G15: 0,0; | H15: 9*LV+30 | I15: 1.5*LV+20 | J15: 0.9*LV+10 | K15: 1.5*LV+15 | L15: 0.8*LV+8 | M15: 1000*LV+100000 | N15: 0 | O15: math.max(0,(lv/10)-1) | P15: math.max(0,(lv/10)-1) | Q15: math.max(0,(lv/10)-1) | R15: 0; | S15: 有药王谷和盘丝洞的弟子在，真是不爽，还是跑路算了！ | T15: 药王谷和盘丝洞的弟子不在眼前，真是轻松愉快啊！ | U15: 0 | V15: 0,0; | W15: 0
A16: 12 | B16: 兔精 | C16: pet_11 | D16: 0 | E16: 0 | F16: 0,0; | G16: 0,0; | H16: 9*LV+30 | I16: 1.5*LV+20 | J16: 0.9*LV+10 | K16: 1.5*LV+15 | L16: 0.8*LV+8 | M16: 1000*LV+100000 | N16: 0 | O16: math.max(0,(lv/10)-1) | P16: math.max(0,(lv/10)-1) | Q16: math.max(0,(lv/10)-1) | R16: 0; | S16: 有药王谷和盘丝洞的弟子在，真是不爽，还是跑路算了！ | T16: 药王谷和盘丝洞的弟子不在眼前，真是轻松愉快啊！ | U16: 0 | V16: 0,0; | W16: 0
A17: 13 | B17: 铁嘴李 | C17: common_3023 | D17: 0 | E17: 0 | F17: 0,0; | G17: 0,0; | H17: 9*LV+60 | I17: 1.5*LV+20 | J17: 0.9*LV+10 | K17: 1.5*LV+15 | L17: 0.8*LV+8 | M17: 1000*LV+100000 | N17: 0 | O17: math.max(0,(lv/10)-1) | P17: math.max(0,(lv/10)-1) | Q17: math.max(0,(lv/10)-1) | R17: 0; | S17: 有药王谷和盘丝洞的弟子在，真是不爽，还是跑路算了！ | T17: 药王谷和盘丝洞的弟子不在眼前，真是轻松愉快啊！ | U17: 0 | V17: 0,0; | W17: 0
A18: 14 | B18: 兔精 | C18: pet_11 | D18: 0 | E18: 0 | F18: 0,0; | G18: 0,0; | H18: 9*LV+60 | I18: 1.5*LV+20 | J18: 0.9*LV+10 | K18: 1.5*LV+15 | L18: 0.8*LV+8 | M18: 1000*LV+100000 | N18: 0 | O18: math.max(0,(lv/10)-1) | P18: math.max(0,(lv/10)-1) | Q18: math.max(0,(lv/10)-1) | R18: 0; | S18: 有药王谷和盘丝洞的弟子在，真是不爽，还是跑路算了！ | T18: 药王谷和盘丝洞的弟子不在眼前，真是轻松愉快啊！ | U18: 0 | V18: 0,0; | W18: 0
A19: 15 | B19: 王大海 | C19: partner_1016 | D19: 0 | E19: 0 | F19: 0,0; | G19: 0,0; | H19: 9*LV+60 | I19: 1.5*LV+20 | J19: 0.9*LV+10 | K19: 1.5*LV+15 | L19: 0.8*LV+8 | M19: 1000*LV+100000 | N19: 0 | O19: math.max(0,(lv/10)-1) | P19: math.max(0,(lv/10)-1) | Q19: math.max(0,(lv/10)-1) | R19: 0; | S19: 有药王谷和盘丝洞的弟子在，真是不爽，还是跑路算了！ | T19: 药王谷和盘丝洞的弟子不在眼前，真是轻松愉快啊！ | U19: 0 | V19: 0,0; | W19: 0
A20: 16 | B20: 熊猫武师 | C20: pet_13 | D20: 0 | E20: 0 | F20: 0,0; | G20: 0,0; | H20: 9*LV+60 | I20: 1.5*LV+20 | J20: 0.9*LV+10 | K20: 1.5*LV+15 | L20: 0.8*LV+8 | M20: 1000*LV+100000 | N20: 0 | O20: math.max(0,(lv/10)-1) | P20: math.max(0,(lv/10)-1) | Q20: math.max(0,(lv/10)-1) | R20: 0; | S20: 有药王谷和盘丝洞的弟子在，真是不爽，还是跑路算了！ | T20: 药王谷和盘丝洞的弟子不在眼前，真是轻松愉快啊！ | U20: 0 | V20: 0,0; | W20: 0
A21: 17 | B21: 萝卜兔 | C21: pet_11 | D21: 0 | E21: 0 | F21: 0,0; | G21: 0,0; | H21: 9*LV+60 | I21: 1.5*LV+20 | J21: 0.9*LV+10 | K21: 1.5*LV+15 | L21: 0.8*LV+8 | M21: 1000*LV+100000 | N21: 0 | O21: math.max(0,(lv/10)-1) | P21: math.max(0,(lv/10)-1) | Q21: math.max(0,(lv/10)-1) | R21: 0; | S21: 有药王谷和盘丝洞的弟子在，真是不爽，还是跑路算了！ | T21: 药王谷和盘丝洞的弟子不在眼前，真是轻松愉快啊！ | U21: 0 | V21: 0,0; | W21: 0
A22: 18 | B22: 天师道人 | C22: pet_22 | D22: 0 | E22: 0 | F22: 0,0; | G22: 0,0; | H22: 9*LV+60 | I22: 1.5*LV+20 | J22: 0.9*LV+10 | K22: 1.5*LV+15 | L22: 0.8*LV+8 | M22: 1000*LV+100000 | N22: 0 | O22: math.max(0,(lv/10)-1) | P22: math.max(0,(lv/10)-1) | Q22: math.max(0,(lv/10)-1) | R22: 0; | S22: 有药王谷和盘丝洞的弟子在，真是不爽，还是跑路算了！ | T22: 药王谷和盘丝洞的弟子不在眼前，真是轻松愉快啊！ | U22: 0 | V22: 0,0; | W22: 0
A23: 19 | B23: 龙人 | C23: pet_23 | D23: 0 | E23: 0 | F23: 0,0; | G23: 0,0; | H23: 9*LV+60 | I23: 1.5*LV+20 | J23: 0.9*LV+10 | K23: 1.5*LV+15 | L23: 0.8*LV+8 | M23: 1000*LV+100000 | N23: 0 | O23: math.max(0,(lv/10)-1) | P23: math.max(0,(lv/10)-1) | Q23: math.max(0,(lv/10)-1) | R23: 0; | S23: 有药王谷和盘丝洞的弟子在，真是不爽，还是跑路算了！ | T23: 药王谷和盘丝洞的弟子不在眼前，真是轻松愉快啊！ | U23: 0 | V23: 0,0; | W23: 0
A24: 20 | B24: 恶狗 | C24: pet_1 | D24: 0 | E24: 0 | F24: 0,0; | G24: 0,0; | H24: 9*LV+60 | I24: 1.5*LV+20 | J24: 0.9*LV+10 | K24: 1.5*LV+15 | L24: 0.8*LV+8 | M24: 1000*LV+100000 | N24: 0 | O24: math.max(0,(lv/10)-1) | P24: math.max(0,(lv/10)-1) | Q24: math.max(0,(lv/10)-1) | R24: 0; | S24: 有药王谷和盘丝洞的弟子在，真是不爽，还是跑路算了！ | T24: 药王谷和盘丝洞的弟子不在眼前，真是轻松愉快啊！ | U24: 0 | V24: 0,0; | W24: 0
A25: 21 | B25: 兔精 | C25: pet_11 | D25: 0 | E25: 0 | F25: 0,0; | G25: 0,0; | H25: 9*LV+60 | I25: 1.5*LV+20 | J25: 0.9*LV+10 | K25: 1.5*LV+15 | L25: 0.8*LV+8 | M25: 1000*LV+100000 | N25: 0 | O25: math.max(0,(lv/10)-1) | P25: math.max(0,(lv/10)-1) | Q25: math.max(0,(lv/10)-1) | R25: 0; | S25: 有药王谷和盘丝洞的弟子在，真是不爽，还是跑路算了！ | T25: 药王谷和盘丝洞的弟子不在眼前，真是轻松愉快啊！ | U25: 0 | V25: 0,0; | W25: 0
A26: 22 | B26: 仙鹤童子 | C26: pet_33 | D26: 0 | E26: 0 | F26: 0,0; | G26: 0,0; | H26: 9*LV+60 | I26: 1.5*LV+20 | J26: 0.9*LV+10 | K26: 1.5*LV+15 | L26: 0.8*LV+8 | M26: 1000*LV+100000 | N26: 0 | O26: math.max(0,(lv/10)-1) | P26: math.max(0,(lv/10)-1) | Q26: math.max(0,(lv/10)-1) | R26: 0; | S26: 有药王谷和盘丝洞的弟子在，真是不爽，还是跑路算了！ | T26: 药王谷和盘丝洞的弟子不在眼前，真是轻松愉快啊！ | U26: 0 | V26: 0,0; | W26: 0
A27: 23 | B27: 罗刹女 | C27: pet_61 | D27: 0 | E27: 0 | F27: 0,0; | G27: 0,0; | H27: 9*LV+60 | I27: 1.5*LV+20 | J27: 0.9*LV+10 | K27: 1.5*LV+15 | L27: 0.8*LV+8 | M27: 1000*LV+100000 | N27: 0 | O27: math.max(0,(lv/10)-1) | P27: math.max(0,(lv/10)-1) | Q27: math.max(0,(lv/10)-1) | R27: 0; | S27: 有药王谷和盘丝洞的弟子在，真是不爽，还是跑路算了！ | T27: 药王谷和盘丝洞的弟子不在眼前，真是轻松愉快啊！ | U27: 0 | V27: 0,0; | W27: 0
A28: 24 | B28: 织梦花妖 | C28: pet_42 | D28: 0 | E28: 0 | F28: 0,0; | G28: 0,0; | H28: 9*LV+60 | I28: 1.5*LV+20 | J28: 0.9*LV+10 | K28: 1.5*LV+15 | L28: 0.8*LV+8 | M28: 1000*LV+100000 | N28: 0 | O28: math.max(0,(lv/10)-1) | P28: math.max(0,(lv/10)-1) | Q28: math.max(0,(lv/10)-1) | R28: 0; | S28: 有药王谷和盘丝洞的弟子在，真是不爽，还是跑路算了！ | T28: 药王谷和盘丝洞的弟子不在眼前，真是轻松愉快啊！ | U28: 0 | V28: 0,0; | W28: 0
A29: 25 | B29: 浪人 | C29: pet_43 | D29: 0 | E29: 0 | F29: 0,0; | G29: 0,0; | H29: 9*LV+60 | I29: 1.5*LV+20 | J29: 0.9*LV+10 | K29: 1.5*LV+15 | L29: 0.8*LV+8 | M29: 1000*LV+100000 | N29: 0 | O29: math.max(0,(lv/10)-1) | P29: math.max(0,(lv/10)-1) | Q29: math.max(0,(lv/10)-1) | R29: 0; | S29: 有药王谷和盘丝洞的弟子在，真是不爽，还是跑路算了！ | T29: 药王谷和盘丝洞的弟子不在眼前，真是轻松愉快啊！ | U29: 0 | V29: 0,0; | W29: 0
A30: 26 | B30: 兔精 | C30: pet_11 | D30: 0 | E30: 0 | F30: 0,0; | G30: 0,0; | H30: 9*LV+60 | I30: 1.5*LV+20 | J30: 0.9*LV+10 | K30: 1.5*LV+15 | L30: 0.8*LV+8 | M30: 1000*LV+100000 | N30: 0 | O30: math.max(0,(lv/10)-1) | P30: math.max(0,(lv/10)-1) | Q30: math.max(0,(lv/10)-1) | R30: 0; | S30: 有药王谷和盘丝洞的弟子在，真是不爽，还是跑路算了！ | T30: 药王谷和盘丝洞的弟子不在眼前，真是轻松愉快啊！ | U30: 0 | V30: 0,0; | W30: 0
A31: 27 | B31: 阴阳师 | C31: pet_52 | D31: 0 | E31: 0 | F31: 0,0; | G31: 0,0; | H31: 9*LV+60 | I31: 1.5*LV+20 | J31: 0.9*LV+10 | K31: 1.5*LV+15 | L31: 0.8*LV+8 | M31: 1000*LV+100000 | N31: 0 | O31: math.max(0,(lv/10)-1) | P31: math.max(0,(lv/10)-1) | Q31: math.max(0,(lv/10)-1) | R31: 0; | S31: 有药王谷和盘丝洞的弟子在，真是不爽，还是跑路算了！ | T31: 药王谷和盘丝洞的弟子不在眼前，真是轻松愉快啊！ | U31: 0 | V31: 0,0; | W31: 0
A32: 28 | B32: 女魃 | C32: pet_53 | D32: 0 | E32: 0 | F32: 0,0; | G32: 0,0; | H32: 9*LV+60 | I32: 1.5*LV+20 | J32: 0.9*LV+10 | K32: 1.5*LV+15 | L32: 0.8*LV+8 | M32: 1000*LV+100000 | N32: 0 | O32: math.max(0,(lv/10)-1) | P32: math.max(0,(lv/10)-1) | Q32: math.max(0,(lv/10)-1) | R32: 0; | S32: 有药王谷和盘丝洞的弟子在，真是不爽，还是跑路算了！ | T32: 药王谷和盘丝洞的弟子不在眼前，真是轻松愉快啊！ | U32: 0 | V32: 0,0; | W32: 0
A33: 29 | B33: 罗刹女 | C33: pet_61 | D33: 0 | E33: 0 | F33: 0,0; | G33: 0,0; | H33: 9*LV+60 | I33: 1.5*LV+20 | J33: 0.9*LV+10 | K33: 1.5*LV+15 | L33: 0.8*LV+8 | M33: 1000*LV+100000 | N33: 0 | O33: math.max(0,(lv/10)-1) | P33: math.max(0,(lv/10)-1) | Q33: math.max(0,(lv/10)-1) | R33: 0; | S33: 有药王谷和盘丝洞的弟子在，真是不爽，还是跑路算了！ | T33: 药王谷和盘丝洞的弟子不在眼前，真是轻松愉快啊！ | U33: 0 | V33: 0,0; | W33: 0
A34: 30 | B34: 泥石人 | C34: pet_62 | D34: 0 | E34: 0 | F34: 0,0; | G34: 0,0; | H34: 9*LV+60 | I34: 1.5*LV+20 | J34: 0.9*LV+10 | K34: 1.5*LV+15 | L34: 0.8*LV+8 | M34: 1000*LV+100000 | N34: 0 | O34: math.max(0,(lv/10)-1) | P34: math.max(0,(lv/10)-1) | Q34: math.max(0,(lv/10)-1) | R34: 0; | S34: 有药王谷和盘丝洞的弟子在，真是不爽，还是跑路算了！ | T34: 药王谷和盘丝洞的弟子不在眼前，真是轻松愉快啊！ | U34: 0 | V34: 0,0; | W34: 0
A35: 31 | B35: 插翅虎 | C35: pet_63 | D35: 0 | E35: 0 | F35: 0,0; | G35: 0,0; | H35: 9*LV+60 | I35: 1.5*LV+20 | J35: 0.9*LV+10 | K35: 1.5*LV+15 | L35: 0.8*LV+8 | M35: 1000*LV+100000 | N35: 0 | O35: math.max(0,(lv/10)-1) | P35: math.max(0,(lv/10)-1) | Q35: math.max(0,(lv/10)-1) | R35: 0; | S35: 有药王谷和盘丝洞的弟子在，真是不爽，还是跑路算了！ | T35: 药王谷和盘丝洞的弟子不在眼前，真是轻松愉快啊！ | U35: 0 | V35: 0,0; | W35: 0
A36: 32 | B36: 剑侠 | C36: pet_71 | D36: 0 | E36: 0 | F36: 0,0; | G36: 0,0; | H36: 9*LV+60 | I36: 1.5*LV+20 | J36: 0.9*LV+10 | K36: 1.5*LV+15 | L36: 0.8*LV+8 | M36: 1000*LV+100000 | N36: 0 | O36: math.max(0,(lv/10)-1) | P36: math.max(0,(lv/10)-1) | Q36: math.max(0,(lv/10)-1) | R36: 0; | S36: 有药王谷和盘丝洞的弟子在，真是不爽，还是跑路算了！ | T36: 药王谷和盘丝洞的弟子不在眼前，真是轻松愉快啊！ | U36: 0 | V36: 0,0; | W36: 0
A37: 33 | B37: 大鹏鸟 | C37: pet_72 | D37: 0 | E37: 0 | F37: 0,0; | G37: 0,0; | H37: 9*LV+60 | I37: 1.5*LV+20 | J37: 0.9*LV+10 | K37: 1.5*LV+15 | L37: 0.8*LV+8 | M37: 1000*LV+100000 | N37: 0 | O37: math.max(0,(lv/10)-1) | P37: math.max(0,(lv/10)-1) | Q37: math.max(0,(lv/10)-1) | R37: 0; | S37: 有药王谷和盘丝洞的弟子在，真是不爽，还是跑路算了！ | T37: 药王谷和盘丝洞的弟子不在眼前，真是轻松愉快啊！ | U37: 0 | V37: 0,0; | W37: 0
A38: 34 | B38: 猴子 | C38: pet_73 | D38: 0 | E38: 0 | F38: 0,0; | G38: 0,0; | H38: 9*LV+60 | I38: 1.5*LV+20 | J38: 0.9*LV+10 | K38: 1.5*LV+15 | L38: 0.8*LV+8 | M38: 1000*LV+100000 | N38: 0 | O38: math.max(0,(lv/10)-1) | P38: math.max(0,(lv/10)-1) | Q38: math.max(0,(lv/10)-1) | R38: 0; | S38: 有药王谷和盘丝洞的弟子在，真是不爽，还是跑路算了！ | T38: 药王谷和盘丝洞的弟子不在眼前，真是轻松愉快啊！ | U38: 0 | V38: 0,0; | W38: 0
A39: 35 | B39: 枪天将 | C39: pet_81 | D39: 0 | E39: 0 | F39: 0,0; | G39: 0,0; | H39: 9*LV+60 | I39: 1.5*LV+20 | J39: 0.9*LV+10 | K39: 1.5*LV+15 | L39: 0.8*LV+8 | M39: 1000*LV+100000 | N39: 0 | O39: math.max(0,(lv/10)-1) | P39: math.max(0,(lv/10)-1) | Q39: math.max(0,(lv/10)-1) | R39: 0; | S39: 有药王谷和盘丝洞的弟子在，真是不爽，还是跑路算了！ | T39: 药王谷和盘丝洞的弟子不在眼前，真是轻松愉快啊！ | U39: 0 | V39: 0,0; | W39: 0
A40: 36 | B40: 虎傀儡 | C40: pet_102 | D40: 0 | E40: 0 | F40: 0,0; | G40: 0,0; | H40: 9*LV+60 | I40: 1.5*LV+20 | J40: 0.9*LV+10 | K40: 1.5*LV+15 | L40: 0.8*LV+8 | M40: 1000*LV+100000 | N40: 0 | O40: math.max(0,(lv/10)-1) | P40: math.max(0,(lv/10)-1) | Q40: math.max(0,(lv/10)-1) | R40: 0; | S40: 有药王谷和盘丝洞的弟子在，真是不爽，还是跑路算了！ | T40: 药王谷和盘丝洞的弟子不在眼前，真是轻松愉快啊！ | U40: 0 | V40: 0,0; | W40: 0
A41: 37 | B41: 天璇仙子 | C41: pet_83 | D41: 0 | E41: 0 | F41: 0,0; | G41: 0,0; | H41: 9*LV+60 | I41: 1.5*LV+20 | J41: 0.9*LV+10 | K41: 1.5*LV+15 | L41: 0.8*LV+8 | M41: 1000*LV+100000 | N41: 0 | O41: math.max(0,(lv/10)-1) | P41: math.max(0,(lv/10)-1) | Q41: math.max(0,(lv/10)-1) | R41: 0; | S41: 有药王谷和盘丝洞的弟子在，真是不爽，还是跑路算了！ | T41: 药王谷和盘丝洞的弟子不在眼前，真是轻松愉快啊！ | U41: 0 | V41: 0,0; | W41: 0
A42: 38 | B42: 桃花妖 | C42: pet_91 | D42: 0 | E42: 0 | F42: 0,0; | G42: 0,0; | H42: 9*LV+60 | I42: 1.5*LV+20 | J42: 0.9*LV+10 | K42: 1.5*LV+15 | L42: 0.8*LV+8 | M42: 1000*LV+100000 | N42: 0 | O42: math.max(0,(lv/10)-1) | P42: math.max(0,(lv/10)-1) | Q42: math.max(0,(lv/10)-1) | R42: 0; | S42: 有药王谷和盘丝洞的弟子在，真是不爽，还是跑路算了！ | T42: 药王谷和盘丝洞的弟子不在眼前，真是轻松愉快啊！ | U42: 0 | V42: 0,0; | W42: 0
A43: 39 | B43: 罗刹女 | C43: pet_61 | D43: 0 | E43: 0 | F43: 0,0; | G43: 0,0; | H43: 9*LV+60 | I43: 1.5*LV+20 | J43: 0.9*LV+10 | K43: 1.5*LV+15 | L43: 0.8*LV+8 | M43: 1000*LV+100000 | N43: 0 | O43: math.max(0,(lv/10)-1) | P43: math.max(0,(lv/10)-1) | Q43: math.max(0,(lv/10)-1) | R43: 0; | S43: 有药王谷和盘丝洞的弟子在，真是不爽，还是跑路算了！ | T43: 药王谷和盘丝洞的弟子不在眼前，真是轻松愉快啊！ | U43: 0 | V43: 0,0; | W43: 0
A44: 40 | B44: 媚魔 | C44: pet_93 | D44: 0 | E44: 0 | F44: 0,0; | G44: 0,0; | H44: 9*LV+60 | I44: 1.5*LV+20 | J44: 0.9*LV+10 | K44: 1.5*LV+15 | L44: 0.8*LV+8 | M44: 1000*LV+100000 | N44: 0 | O44: math.max(0,(lv/10)-1) | P44: math.max(0,(lv/10)-1) | Q44: math.max(0,(lv/10)-1) | R44: 0; | S44: 有药王谷和盘丝洞的弟子在，真是不爽，还是跑路算了！ | T44: 药王谷和盘丝洞的弟子不在眼前，真是轻松愉快啊！ | U44: 0 | V44: 0,0; | W44: 0
A45: 41 | B45: 剑灵 | C45: pet_21 | D45: 0 | E45: 0 | F45: 0,0; | G45: 0,0; | H45: 9*LV+60 | I45: 1.5*LV+20 | J45: 0.9*LV+10 | K45: 1.5*LV+15 | L45: 0.8*LV+8 | M45: 1000*LV+100000 | N45: 0 | O45: math.max(0,(lv/10)-1) | P45: math.max(0,(lv/10)-1) | Q45: math.max(0,(lv/10)-1) | R45: 0; | S45: 有药王谷和盘丝洞的弟子在，真是不爽，还是跑路算了！ | T45: 药王谷和盘丝洞的弟子不在眼前，真是轻松愉快啊！ | U45: 0 | V45: 0,0; | W45: 0
A46: 42 | B46: 虎傀儡 | C46: pet_102 | D46: 0 | E46: 0 | F46: 0,0; | G46: 0,0; | H46: 9*LV+60 | I46: 1.5*LV+20 | J46: 0.9*LV+10 | K46: 1.5*LV+15 | L46: 0.8*LV+8 | M46: 1000*LV+100000 | N46: 0 | O46: math.max(0,(lv/10)-1) | P46: math.max(0,(lv/10)-1) | Q46: math.max(0,(lv/10)-1) | R46: 0; | S46: 有药王谷和盘丝洞的弟子在，真是不爽，还是跑路算了！ | T46: 药王谷和盘丝洞的弟子不在眼前，真是轻松愉快啊！ | U46: 0 | V46: 0,0; | W46: 0
A47: 43 | B47: 熊猫武师 | C47: pet_13 | D47: 0 | E47: 0 | F47: 0,0; | G47: 0,0; | H47: 9*LV+60 | I47: 1.5*LV+20 | J47: 0.9*LV+10 | K47: 1.5*LV+15 | L47: 0.8*LV+8 | M47: 1000*LV+100000 | N47: 0 | O47: math.max(0,(lv/10)-1) | P47: math.max(0,(lv/10)-1) | Q47: math.max(0,(lv/10)-1) | R47: 0; | S47: 有药王谷和盘丝洞的弟子在，真是不爽，还是跑路算了！ | T47: 药王谷和盘丝洞的弟子不在眼前，真是轻松愉快啊！ | U47: 0 | V47: 0,0; | W47: 0
A48: 44 | B48: 迦楼罗 | C48: pet_201 | D48: 0 | E48: 0 | F48: 0,0; | G48: 0,0; | H48: 9*LV+60 | I48: 1.5*LV+20 | J48: 0.9*LV+10 | K48: 1.5*LV+15 | L48: 0.8*LV+8 | M48: 1000*LV+100000 | N48: 0 | O48: math.max(0,(lv/10)-1) | P48: math.max(0,(lv/10)-1) | Q48: math.max(0,(lv/10)-1) | R48: 0; | S48: 有药王谷和盘丝洞的弟子在，真是不爽，还是跑路算了！ | T48: 药王谷和盘丝洞的弟子不在眼前，真是轻松愉快啊！ | U48: 0 | V48: 0,0; | W48: 0
A49: 45 | B49: 猴子 | C49: pet_73 | D49: 0 | E49: 0 | F49: 0,0; | G49: 0,0; | H49: 9*LV+60 | I49: 1.5*LV+20 | J49: 0.9*LV+10 | K49: 1.5*LV+15 | L49: 0.8*LV+8 | M49: 1000*LV+100000 | N49: 0 | O49: math.max(0,(lv/10)-1) | P49: math.max(0,(lv/10)-1) | Q49: math.max(0,(lv/10)-1) | R49: 0; | S49: 有药王谷和盘丝洞的弟子在，真是不爽，还是跑路算了！ | T49: 药王谷和盘丝洞的弟子不在眼前，真是轻松愉快啊！ | U49: 0 | V49: 0,0; | W49: 0
A50: 46 | B50: 阴阳师 | C50: pet_52 | D50: 0 | E50: 0 | F50: 0,0; | G50: 0,0; | H50: 9*LV+60 | I50: 1.5*LV+20 | J50: 0.9*LV+10 | K50: 1.5*LV+15 | L50: 0.8*LV+8 | M50: 1000*LV+100000 | N50: 0 | O50: math.max(0,(lv/10)-1) | P50: math.max(0,(lv/10)-1) | Q50: math.max(0,(lv/10)-1) | R50: 0; | S50: 有药王谷和盘丝洞的弟子在，真是不爽，还是跑路算了！ | T50: 药王谷和盘丝洞的弟子不在眼前，真是轻松愉快啊！ | U50: 0 | V50: 0,0; | W50: 0
A51: 47 | B51: 天璇仙子 | C51: pet_83 | D51: 0 | E51: 0 | F51: 0,0; | G51: 0,0; | H51: 9*LV+60 | I51: 1.5*LV+20 | J51: 0.9*LV+10 | K51: 1.5*LV+15 | L51: 0.8*LV+8 | M51: 1000*LV+100000 | N51: 0 | O51: math.max(0,(lv/10)-1) | P51: math.max(0,(lv/10)-1) | Q51: math.max(0,(lv/10)-1) | R51: 0; | S51: 有药王谷和盘丝洞的弟子在，真是不爽，还是跑路算了！ | T51: 药王谷和盘丝洞的弟子不在眼前，真是轻松愉快啊！ | U51: 0 | V51: 0,0; | W51: 0
A52: 48 | B52: 阴阳师 | C52: pet_52 | D52: 0 | E52: 0 | F52: 0,0; | G52: 0,0; | H52: 9*LV+60 | I52: 1.5*LV+20 | J52: 0.9*LV+10 | K52: 1.5*LV+15 | L52: 0.8*LV+8 | M52: 1000*LV+100000 | N52: 0 | O52: math.max(0,(lv/10)-1) | P52: math.max(0,(lv/10)-1) | Q52: math.max(0,(lv/10)-1) | R52: 0; | S52: 有药王谷和盘丝洞的弟子在，真是不爽，还是跑路算了！ | T52: 药王谷和盘丝洞的弟子不在眼前，真是轻松愉快啊！ | U52: 0 | V52: 0,0; | W52: 0
A53: 49 | B53: 枪天兵 | C53: pet_81 | D53: 0 | E53: 0 | F53: 0,0; | G53: 0,0; | H53: 9*LV+60 | I53: 1.5*LV+20 | J53: 0.9*LV+10 | K53: 1.5*LV+15 | L53: 0.8*LV+8 | M53: 1000*LV+100000 | N53: 0 | O53: math.max(0,(lv/10)-1) | P53: math.max(0,(lv/10)-1) | Q53: math.max(0,(lv/10)-1) | R53: 0; | S53: 有药王谷和盘丝洞的弟子在，真是不爽，还是跑路算了！ | T53: 药王谷和盘丝洞的弟子不在眼前，真是轻松愉快啊！ | U53: 0 | V53: 0,0; | W53: 0
A54: 50 | B54: 枪天兵 | C54: pet_81 | D54: 0 | E54: 0 | F54: 0,0; | G54: 0,0; | H54: 9*LV+60 | I54: 1.5*LV+20 | J54: 0.9*LV+10 | K54: 1.5*LV+15 | L54: 0.8*LV+8 | M54: 1000*LV+100000 | N54: 0 | O54: math.max(0,(lv/10)-1) | P54: math.max(0,(lv/10)-1) | Q54: math.max(0,(lv/10)-1) | R54: 0; | S54: 有药王谷和盘丝洞的弟子在，真是不爽，还是跑路算了！ | T54: 药王谷和盘丝洞的弟子不在眼前，真是轻松愉快啊！ | U54: 0 | V54: 0,0; | W54: 0
A55: 51 | B55: 枪天兵 | C55: pet_81 | D55: 0 | E55: 0 | F55: 0,0; | G55: 0,0; | H55: 9*LV+60 | I55: 1.5*LV+20 | J55: 0.9*LV+10 | K55: 1.5*LV+15 | L55: 0.8*LV+8 | M55: 1000*LV+100000 | N55: 0 | O55: math.max(0,(lv/10)-1) | P55: math.max(0,(lv/10)-1) | Q55: math.max(0,(lv/10)-1) | R55: 0; | S55: 有药王谷和盘丝洞的弟子在，真是不爽，还是跑路算了！ | T55: 药王谷和盘丝洞的弟子不在眼前，真是轻松愉快啊！ | U55: 0 | V55: 0,0; | W55: 0
A56: 52 | B56: 枪天兵 | C56: pet_81 | D56: 0 | E56: 0 | F56: 0,0; | G56: 0,0; | H56: 9*LV+60 | I56: 1.5*LV+20 | J56: 0.9*LV+10 | K56: 1.5*LV+15 | L56: 0.8*LV+8 | M56: 1000*LV+100000 | N56: 0 | O56: math.max(0,(lv/10)-1) | P56: math.max(0,(lv/10)-1) | Q56: math.max(0,(lv/10)-1) | R56: 0; | S56: 有药王谷和盘丝洞的弟子在，真是不爽，还是跑路算了！ | T56: 药王谷和盘丝洞的弟子不在眼前，真是轻松愉快啊！ | U56: 0 | V56: 0,0; | W56: 0
A57: 53 | B57: 媚魔 | C57: pet_93 | D57: 0 | E57: 0 | F57: 0,0; | G57: 0,0; | H57: 9*LV+60 | I57: 1.5*LV+20 | J57: 0.9*LV+10 | K57: 1.5*LV+15 | L57: 0.8*LV+8 | M57: 1000*LV+100000 | N57: 0 | O57: math.max(0,(lv/10)-1) | P57: math.max(0,(lv/10)-1) | Q57: math.max(0,(lv/10)-1) | R57: 0; | S57: 有药王谷和盘丝洞的弟子在，真是不爽，还是跑路算了！ | T57: 药王谷和盘丝洞的弟子不在眼前，真是轻松愉快啊！ | U57: 0 | V57: 0,0; | W57: 0
A58: 54 | B58: 媚魔 | C58: pet_93 | D58: 0 | E58: 0 | F58: 0,0; | G58: 0,0; | H58: 9*LV+60 | I58: 1.5*LV+20 | J58: 0.9*LV+10 | K58: 1.5*LV+15 | L58: 0.8*LV+8 | M58: 1000*LV+100000 | N58: 0 | O58: math.max(0,(lv/10)-1) | P58: math.max(0,(lv/10)-1) | Q58: math.max(0,(lv/10)-1) | R58: 0; | S58: 有药王谷和盘丝洞的弟子在，真是不爽，还是跑路算了！ | T58: 药王谷和盘丝洞的弟子不在眼前，真是轻松愉快啊！ | U58: 0 | V58: 0,0; | W58: 0
A59: 55 | B59: 媚魔 | C59: pet_93 | D59: 0 | E59: 0 | F59: 0,0; | G59: 0,0; | H59: 9*LV+60 | I59: 1.5*LV+20 | J59: 0.9*LV+10 | K59: 1.5*LV+15 | L59: 0.8*LV+8 | M59: 1000*LV+100000 | N59: 0 | O59: math.max(0,(lv/10)-1) | P59: math.max(0,(lv/10)-1) | Q59: math.max(0,(lv/10)-1) | R59: 0; | S59: 有药王谷和盘丝洞的弟子在，真是不爽，还是跑路算了！ | T59: 药王谷和盘丝洞的弟子不在眼前，真是轻松愉快啊！ | U59: 0 | V59: 0,0; | W59: 0
A60: 56 | B60: 媚魔 | C60: pet_93 | D60: 0 | E60: 0 | F60: 0,0; | G60: 0,0; | H60: 9*LV+60 | I60: 1.5*LV+20 | J60: 0.9*LV+10 | K60: 1.5*LV+15 | L60: 0.8*LV+8 | M60: 1000*LV+100000 | N60: 0 | O60: math.max(0,(lv/10)-1) | P60: math.max(0,(lv/10)-1) | Q60: math.max(0,(lv/10)-1) | R60: 0; | S60: 有药王谷和盘丝洞的弟子在，真是不爽，还是跑路算了！ | T60: 药王谷和盘丝洞的弟子不在眼前，真是轻松愉快啊！ | U60: 0 | V60: 0,0; | W60: 0
A61: 57 | B61: 媚魔 | C61: pet_93 | D61: 0 | E61: 0 | F61: 0,0; | G61: 0,0; | H61: 9*LV+60 | I61: 1.5*LV+20 | J61: 0.9*LV+10 | K61: 1.5*LV+15 | L61: 0.8*LV+8 | M61: 1000*LV+100000 | N61: 0 | O61: math.max(0,(lv/10)-1) | P61: math.max(0,(lv/10)-1) | Q61: math.max(0,(lv/10)-1) | R61: 0; | S61: 有药王谷和盘丝洞的弟子在，真是不爽，还是跑路算了！ | T61: 药王谷和盘丝洞的弟子不在眼前，真是轻松愉快啊！ | U61: 0 | V61: 0,0; | W61: 0
A62: 58 | B62: 媚魔 | C62: pet_93 | D62: 0 | E62: 0 | F62: 0,0; | G62: 0,0; | H62: 9*LV+60 | I62: 1.5*LV+20 | J62: 0.9*LV+10 | K62: 1.5*LV+15 | L62: 0.8*LV+8 | M62: 1000*LV+100000 | N62: 0 | O62: math.max(0,(lv/10)-1) | P62: math.max(0,(lv/10)-1) | Q62: math.max(0,(lv/10)-1) | R62: 0; | S62: 有药王谷和盘丝洞的弟子在，真是不爽，还是跑路算了！ | T62: 药王谷和盘丝洞的弟子不在眼前，真是轻松愉快啊！ | U62: 0 | V62: 0,0; | W62: 0
A63: 59 | B63: 熊猫武师 | C63: pet_13 | D63: 0 | E63: 0 | F63: 0,0; | G63: 0,0; | H63: 9*LV+60 | I63: 1.5*LV+20 | J63: 0.9*LV+10 | K63: 1.5*LV+15 | L63: 0.8*LV+8 | M63: 1000*LV+100000 | N63: 0 | O63: math.max(0,(lv/10)-1) | P63: math.max(0,(lv/10)-1) | Q63: math.max(0,(lv/10)-1) | R63: 0; | S63: 有药王谷和盘丝洞的弟子在，真是不爽，还是跑路算了！ | T63: 药王谷和盘丝洞的弟子不在眼前，真是轻松愉快啊！ | U63: 0 | V63: 0,0; | W63: 0
A64: 102 | B64: 魔教打手 | C64: hero_1001 | D64: 0 | E64: 0 | F64: 0,0; | G64: 5103,100; | H64: 25*LV+125 | I64: (6*LV+10)*0.99 | J64: 0.9*LV+10 | K64: (2*LV+4)*0.05 | L64: 0.8*LV+8 | M64: 1000*LV+100000 | N64: 0 | O64: math.max(0,(lv/10)-1) | P64: math.max(0,(lv/10)-1) | Q64: math.max(0,(lv/10)-1) | R64: 0; | S64: 有药王谷和盘丝洞的弟子在，真是不爽，还是跑路算了！ | T64: 药王谷和盘丝洞的弟子不在眼前，真是轻松愉快啊！ | U64: 0 | V64: 0,0; | W64: 2
A65: 112 | B65: 魔教打手 | C65: hero_1001 | D65: 0 | E65: 0 | F65: 0,0; | G65: 5103,100; | H65: 25.5*LV+127.5 | I65: (6.5*LV+10.4)*0.98 | J65: 0.9*LV+10 | K65: (2.1*LV+4.2)*0.05 | L65: 0.8*LV+8 | M65: 1000*LV+100000 | N65: 0 | O65: math.max(0,(lv/10)-1) | P65: math.max(0,(lv/10)-1) | Q65: math.max(0,(lv/10)-1) | R65: 0; | S65: 有药王谷和盘丝洞的弟子在，真是不爽，还是跑路算了！ | T65: 药王谷和盘丝洞的弟子不在眼前，真是轻松愉快啊！ | U65: 0 | V65: 0,0; | W65: 0
A66: 122 | B66: 魔教打手 | C66: hero_1001 | D66: 0 | E66: 0 | F66: 0,0; | G66: 5103,100; | H66: 26*LV+129.9 | I66: (6.9*LV+10.8)*0.97 | J66: 0.9*LV+10 | K66: (2.1*LV+4.4)*0.05 | L66: 0.8*LV+8 | M66: 1000*LV+100000 | N66: 0 | O66: math.max(0,(lv/10)-1) | P66: math.max(0,(lv/10)-1) | Q66: math.max(0,(lv/10)-1) | R66: 0; | S66: 有药王谷和盘丝洞的弟子在，真是不爽，还是跑路算了！ | T66: 药王谷和盘丝洞的弟子不在眼前，真是轻松愉快啊！ | U66: 0 | V66: 0,0; | W66: 0
A67: 132 | B67: 魔教打手 | C67: hero_1001 | D67: 0 | E67: 0 | F67: 0,0; | G67: 0,1; | H67: 26.5*LV+132.4 | I67: (7.4*LV+11.2)*0.96 | J67: 0.9*LV+10 | K67: (2.2*LV+4.6)*0.05 | L67: 0.8*LV+8 | M67: 1000*LV+100000 | N67: 0 | O67: math.max(0,(lv/10)-1) | P67: math.max(0,(lv/10)-1) | Q67: math.max(0,(lv/10)-1) | R67: 0; | S67: 有药王谷和盘丝洞的弟子在，真是不爽，还是跑路算了！ | T67: 药王谷和盘丝洞的弟子不在眼前，真是轻松愉快啊！ | U67: 0 | V67: 0,0; | W67: 2
A68: 142 | B68: 打手 | C68: pet_43 | D68: 0 | E68: 0 | F68: 0,0; | G68: 5105,100; | H68: 27*LV+134.8 | I68: (7.9*LV+11.6)*0.95 | J68: 0.9*LV+10 | K68: (2.2*LV+4.9)*0.05 | L68: 0.8*LV+8 | M68: 1000*LV+100000 | N68: 0 | O68: math.max(0,(lv/10)-1) | P68: math.max(0,(lv/10)-1) | Q68: math.max(0,(lv/10)-1) | R68: 0; | S68: 有药王谷和盘丝洞的弟子在，真是不爽，还是跑路算了！ | T68: 药王谷和盘丝洞的弟子不在眼前，真是轻松愉快啊！ | U68: 0 | V68: 0,0; | W68: 0
A69: 152 | B69: 武僧 | C69: hero_1001 | D69: 0 | E69: 0 | F69: 0,0; | G69: 5102,100; | H69: 27.5*LV+137.3 | I69: (8.4*LV+12)*0.94 | J69: 0.9*LV+10 | K69: (2.3*LV+5.1)*0.05 | L69: 0.8*LV+8 | M69: 1000*LV+100000 | N69: 0 | O69: math.max(0,(lv/10)-1) | P69: math.max(0,(lv/10)-1) | Q69: math.max(0,(lv/10)-1) | R69: 0; | S69: 有药王谷和盘丝洞的弟子在，真是不爽，还是跑路算了！ | T69: 药王谷和盘丝洞的弟子不在眼前，真是轻松愉快啊！ | U69: 0 | V69: 0,0; | W69: 0
A70: 172 | B70: 外门弟子 | C70: hero_2001 | D70: 0 | E70: 0 | F70: 0,0; | G70: 5102,100; | H70: 28.4*LV+142.2 | I70: (9.3*LV+12.7)*0.93 | J70: 0.9*LV+10 | K70: (2.4*LV+5.5)*0.05 | L70: 0.8*LV+8 | M70: 1000*LV+100000 | N70: 0 | O70: math.max(0,(lv/10)-1) | P70: math.max(0,(lv/10)-1) | Q70: math.max(0,(lv/10)-1) | R70: 0; | S70: 有药王谷和盘丝洞的弟子在，真是不爽，还是跑路算了！ | T70: 药王谷和盘丝洞的弟子不在眼前，真是轻松愉快啊！ | U70: 0 | V70: 0,0; | W70: 2
A71: 182 | B71: 外门弟子 | C71: hero_2001 | D71: 0 | E71: 0 | F71: 5309,100; | G71: 5123,100; | H71: 28.4*LV+142.2 | I71: (9.3*LV+12.7)*0.92 | J71: 0.9*LV+10 | K71: (2.4*LV+5.5)*0.05 | L71: 0.8*LV+8 | M71: 1000*LV+100000 | N71: 0 | O71: math.max(0,(lv/10)-1) | P71: math.max(0,(lv/10)-1) | Q71: math.max(0,(lv/10)-1) | R71: 0; | S71: 有药王谷和盘丝洞的弟子在，真是不爽，还是跑路算了！ | T71: 药王谷和盘丝洞的弟子不在眼前，真是轻松愉快啊！ | U71: 0 | V71: 0,0; | W71: 0
A72: 192 | B72: 喽啰 | C72: pet_11 | D72: 0 | E72: 0 | F72: 0,0; | G72: 5102,100; | H72: 29.4*LV+147.1 | I72: (10.2*LV+13.5)*0.91 | J72: 0.9*LV+10 | K72: (2.5*LV+5.9)*0.05 | L72: 0.8*LV+8 | M72: 1000*LV+100000 | N72: 0 | O72: math.max(0,(lv/10)-1) | P72: math.max(0,(lv/10)-1) | Q72: math.max(0,(lv/10)-1) | R72: 0; | S72: 有药王谷和盘丝洞的弟子在，真是不爽，还是跑路算了！ | T72: 药王谷和盘丝洞的弟子不在眼前，真是轻松愉快啊！ | U72: 0 | V72: 0,0; | W72: 0
A73: 202 | B73: 帮手 | C73: pet_23 | D73: 0 | E73: 0 | F73: 0,0; | G73: 5102,100; | H73: 29.9*LV+149.5 | I73: (10.7*LV+13.9)*0.9 | J73: 0.9*LV+10 | K73: (2.6*LV+6.2)*0.05 | L73: 0.8*LV+8 | M73: 1000*LV+100000 | N73: 0 | O73: math.max(0,(lv/10)-1) | P73: math.max(0,(lv/10)-1) | Q73: math.max(0,(lv/10)-1) | R73: 0; | S73: 有药王谷和盘丝洞的弟子在，真是不爽，还是跑路算了！ | T73: 药王谷和盘丝洞的弟子不在眼前，真是轻松愉快啊！ | U73: 0 | V73: 0,0; | W73: 2
A74: 212 | B74: 幼兽 | C74: pet_63 | D74: 0 | E74: 0 | F74: 1112,100;1111,100; | G74: 0,0; | H74: 30.4*LV+152 | I74: (11.2*LV+14.3)*0.89 | J74: 0.9*LV+10 | K74: (2.6*LV+6.4)*0.05 | L74: 0.8*LV+8 | M74: 1000*LV+100000 | N74: 0 | O74: math.max(0,(lv/10)-1) | P74: math.max(0,(lv/10)-1) | Q74: math.max(0,(lv/10)-1) | R74: 0; | S74: 有药王谷和盘丝洞的弟子在，真是不爽，还是跑路算了！ | T74: 药王谷和盘丝洞的弟子不在眼前，真是轻松愉快啊！ | U74: 0 | V74: 0,0; | W74: 1
A75: 222 | B75: 龙宫弟子 | C75: hero_2001 | D75: 0 | E75: 0 | F75: 1411,100; | G75: 0,0; | H75: 28.4*LV+142.2 | I75: (9.3*LV+12.7)*0.88 | J75: 0.9*LV+10 | K75: 2.4*LV+5.5 | L75: 0.8*LV+8 | M75: 1000*LV+100000 | N75: 0 | O75: math.max(0,(lv/10)-1) | P75: math.max(0,(lv/10)-1) | Q75: math.max(0,(lv/10)-1) | R75: 0; | S75: 有药王谷和盘丝洞的弟子在，真是不爽，还是跑路算了！ | T75: 药王谷和盘丝洞的弟子不在眼前，真是轻松愉快啊！ | U75: 0 | V75: 0,0; | W75: 2
A76: 223 | B76: 外门弟子 | C76: hero_2001 | D76: 0 | E76: 0 | F76: 0,0; | G76: 5102,100; | H76: 28.4*LV+142.2 | I76: (9.3*LV+12.7)*0.87 | J76: 0.9*LV+10 | K76: (2.4*LV+5.5)*0.05 | L76: 0.8*LV+8 | M76: 1000*LV+100000 | N76: 0 | O76: math.max(0,(lv/10)-1) | P76: math.max(0,(lv/10)-1) | Q76: math.max(0,(lv/10)-1) | R76: 0; | S76: 有药王谷和盘丝洞的弟子在，真是不爽，还是跑路算了！ | T76: 药王谷和盘丝洞的弟子不在眼前，真是轻松愉快啊！ | U76: 0 | V76: 0,0; | W76: 4
A77: 232 | B77: 外门弟子 | C77: hero_2001 | D77: 0 | E77: 0 | F77: 0,0; | G77: 5102,100; | H77: 28.4*LV+142.2 | I77: (9.3*LV+12.7)*0.86 | J77: 0.9*LV+10 | K77: (2.4*LV+5.5)*0.05 | L77: 0.8*LV+8 | M77: 1000*LV+100000 | N77: 0 | O77: math.max(0,(lv/10)-1) | P77: math.max(0,(lv/10)-1) | Q77: math.max(0,(lv/10)-1) | R77: 0; | S77: 有药王谷和盘丝洞的弟子在，真是不爽，还是跑路算了！ | T77: 药王谷和盘丝洞的弟子不在眼前，真是轻松愉快啊！ | U77: 0 | V77: 0,0; | W77: 0
A78: 242 | B78: 剑灵 | C78: pet_21 | D78: 0 | E78: 0 | F78: 0,0; | G78: 5103,100; | H78: 31.9*LV+159.3 | I78: (12.6*LV+15.5)*0.85 | J78: 0.9*LV+10 | K78: (2.8*LV+7)*0.05 | L78: 0.8*LV+8 | M78: 1000*LV+100000 | N78: 0 | O78: math.max(0,(lv/10)-1) | P78: math.max(0,(lv/10)-1) | Q78: math.max(0,(lv/10)-1) | R78: 0; | S78: 有药王谷和盘丝洞的弟子在，真是不爽，还是跑路算了！ | T78: 药王谷和盘丝洞的弟子不在眼前，真是轻松愉快啊！ | U78: 0 | V78: 0,0; | W78: 0
A79: 252 | B79: 外门弟子 | C79: hero_2001 | D79: 0 | E79: 0 | F79: 0,0; | G79: 5102,100; | H79: 28.4*LV+142.2 | I79: (9.3*LV+12.7)*0.84 | J79: 0.9*LV+10 | K79: (2.4*LV+5.5)*0.05 | L79: 0.8*LV+8 | M79: 1000*LV+100000 | N79: 0 | O79: math.max(0,(lv/10)-1) | P79: math.max(0,(lv/10)-1) | Q79: math.max(0,(lv/10)-1) | R79: 0; | S79: 有药王谷和盘丝洞的弟子在，真是不爽，还是跑路算了！ | T79: 药王谷和盘丝洞的弟子不在眼前，真是轻松愉快啊！ | U79: 0 | V79: 0,0; | W79: 3
A80: 262 | B80: 兔精 | C80: pet_11 | D80: 0 | E80: 0 | F80: 0,0; | G80: 5123,100;5225,100;5104,100; | H80: 32.8*LV+164.2 | I80: (13.5*LV+16.3)*0.83 | J80: 0.9*LV+10 | K80: (2.9*LV+7.5)*0.05 | L80: 0.8*LV+8 | M80: 1000*LV+100000 | N80: 0 | O80: math.max(0,(lv/10)-1) | P80: math.max(0,(lv/10)-1) | Q80: math.max(0,(lv/10)-1) | R80: 0; | S80: 有药王谷和盘丝洞的弟子在，真是不爽，还是跑路算了！ | T80: 药王谷和盘丝洞的弟子不在眼前，真是轻松愉快啊！ | U80: 0 | V80: 0,0; | W80: 3
A81: 272 | B81: 外门弟子 | C81: hero_2001 | D81: 0 | E81: 0 | F81: 0,0; | G81: 5102,100; | H81: 28.4*LV+142.2 | I81: (9.3*LV+12.7)*0.82 | J81: 0.9*LV+10 | K81: (2.4*LV+5.5)*0.05 | L81: 0.8*LV+8 | M81: 1000*LV+100000 | N81: 0 | O81: math.max(0,(lv/10)-1) | P81: math.max(0,(lv/10)-1) | Q81: math.max(0,(lv/10)-1) | R81: 0; | S81: 有药王谷和盘丝洞的弟子在，真是不爽，还是跑路算了！ | T81: 药王谷和盘丝洞的弟子不在眼前，真是轻松愉快啊！ | U81: 0 | V81: 0,0; | W81: 0
A82: 282 | B82: 外门弟子 | C82: hero_2001 | D82: 0 | E82: 0 | F82: 0,0; | G82: 5102,100; | H82: 28.4*LV+142.2 | I82: (9.3*LV+12.7)*0.82 | J82: 0.9*LV+10 | K82: (2.4*LV+5.5)*0.05 | L82: 0.8*LV+8 | M82: 1000*LV+100000 | N82: 0 | O82: math.max(0,(lv/10)-1) | P82: math.max(0,(lv/10)-1) | Q82: math.max(0,(lv/10)-1) | R82: 0; | S82: 有药王谷和盘丝洞的弟子在，真是不爽，还是跑路算了！ | T82: 药王谷和盘丝洞的弟子不在眼前，真是轻松愉快啊！ | U82: 0 | V82: 0,0; | W82: 0
A83: 292 | B83: 剑灵 | C83: pet_21 | D83: 0 | E83: 0 | F83: 0,0; | G83: 5103,100; | H83: 31.9*LV+159.3 | I83: (12.6*LV+15.5)*0.81 | J83: 0.9*LV+10 | K83: (2.8*LV+7)*0.05 | L83: 0.8*LV+8 | M83: 1000*LV+100000 | N83: 0 | O83: math.max(0,(lv/10)-1) | P83: math.max(0,(lv/10)-1) | Q83: math.max(0,(lv/10)-1) | R83: 0; | S83: 有药王谷和盘丝洞的弟子在，真是不爽，还是跑路算了！ | T83: 药王谷和盘丝洞的弟子不在眼前，真是轻松愉快啊！ | U83: 0 | V83: 0,0; | W83: 0
A84: 302 | B84: 剑灵 | C84: pet_21 | D84: 0 | E84: 0 | F84: 0,0; | G84: 5103,100; | H84: 31.9*LV+159.3 | I84: (12.6*LV+15.5)*0.8 | J84: 0.9*LV+10 | K84: (2.8*LV+7)*0.05 | L84: 0.8*LV+8 | M84: 1000*LV+100000 | N84: 0 | O84: math.max(0,(lv/10)-1) | P84: math.max(0,(lv/10)-1) | Q84: math.max(0,(lv/10)-1) | R84: 0; | S84: 有药王谷和盘丝洞的弟子在，真是不爽，还是跑路算了！ | T84: 药王谷和盘丝洞的弟子不在眼前，真是轻松愉快啊！ | U84: 0 | V84: 0,0; | W84: 2
A85: 312 | B85: 合欢弟子 | C85: partner_1002 | D85: 0 | E85: 0 | F85: 1313,100;1315,100; | G85: 0,0; | H85: 35.3*LV+176.5 | I85: (15.9*LV+18.2)*0.79 | J85: 0.9*LV+10 | K85: (3.2*LV+8.5)*0.05 | L85: 0.8*LV+8 | M85: 1000*LV+100000 | N85: 0 | O85: math.max(0,(lv/10)-1) | P85: math.max(0,(lv/10)-1) | Q85: math.max(0,(lv/10)-1) | R85: 0; | S85: 有药王谷和盘丝洞的弟子在，真是不爽，还是跑路算了！ | T85: 药王谷和盘丝洞的弟子不在眼前，真是轻松愉快啊！ | U85: 0 | V85: 0,0; | W85: 4
A86: 322 | B86: 喽啰 | C86: pet_11 | D86: 0 | E86: 0 | F86: 0,0; | G86: 5102,100; | H86: 35.8*LV+178.9 | I86: (16.4*LV+18.6)*0.78 | J86: 0.9*LV+10 | K86: (3.3*LV+8.7)*0.05 | L86: 0.8*LV+8 | M86: 1000*LV+100000 | N86: 0 | O86: math.max(0,(lv/10)-1) | P86: math.max(0,(lv/10)-1) | Q86: math.max(0,(lv/10)-1) | R86: 0; | S86: 有药王谷和盘丝洞的弟子在，真是不爽，还是跑路算了！ | T86: 药王谷和盘丝洞的弟子不在眼前，真是轻松愉快啊！ | U86: 0 | V86: 0,0; | W86: 0
A87: 332 | B87: 打手 | C87: hero_1001 | D87: 0 | E87: 0 | F87: 0,0; | G87: 5103,100; | H87: 36.3*LV+181.4 | I87: (16.8*LV+19)*0.77 | J87: 0.9*LV+10 | K87: (3.4*LV+9)*0.05 | L87: 0.8*LV+8 | M87: 1000*LV+100000 | N87: 0 | O87: math.max(0,(lv/10)-1) | P87: math.max(0,(lv/10)-1) | Q87: math.max(0,(lv/10)-1) | R87: 0; | S87: 有药王谷和盘丝洞的弟子在，真是不爽，还是跑路算了！ | T87: 药王谷和盘丝洞的弟子不在眼前，真是轻松愉快啊！ | U87: 0 | V87: 0,0; | W87: 2
A88: 342 | B88: 帮手 | C88: pet_23 | D88: 0 | E88: 0 | F88: 0,0; | G88: 5103,100; | H88: 36.8*LV+183.8 | I88: (17.3*LV+19.4)*0.76 | J88: 0.9*LV+10 | K88: (3.4*LV+9.2)*0.05 | L88: 0.8*LV+8 | M88: 1000*LV+100000 | N88: 0 | O88: math.max(0,(lv/10)-1) | P88: math.max(0,(lv/10)-1) | Q88: math.max(0,(lv/10)-1) | R88: 0; | S88: 有药王谷和盘丝洞的弟子在，真是不爽，还是跑路算了！ | T88: 药王谷和盘丝洞的弟子不在眼前，真是轻松愉快啊！ | U88: 0 | V88: 0,0; | W88: 2
A89: 352 | B89: 帮手 | C89: pet_23 | D89: 0 | E89: 0 | F89: 0,0; | G89: 5203,100;5224,100; | H89: 37.3*LV+186.3 | I89: (17.8*LV+19.8)*0.75 | J89: 0.9*LV+10 | K89: (3.5*LV+9.4)*0.05 | L89: 0.8*LV+8 | M89: 1000*LV+100000 | N89: 0 | O89: math.max(0,(lv/10)-1) | P89: math.max(0,(lv/10)-1) | Q89: math.max(0,(lv/10)-1) | R89: 0; | S89: 有药王谷和盘丝洞的弟子在，真是不爽，还是跑路算了！ | T89: 药王谷和盘丝洞的弟子不在眼前，真是轻松愉快啊！ | U89: 0 | V89: 0,0; | W89: 0
A90: 362 | B90: 合欢弟子 | C90: partner_1002 | D90: 0 | E90: 0 | F90: 1315,100; | G90: 0,0; | H90: 37.7*LV+188.7 | I90: (18.2*LV+20.2)*0.74 | J90: 0.9*LV+10 | K90: (3.5*LV+9.6)*0.05 | L90: 0.8*LV+8 | M90: 1000*LV+100000 | N90: 0 | O90: math.max(0,(lv/10)-1) | P90: math.max(0,(lv/10)-1) | Q90: math.max(0,(lv/10)-1) | R90: 0; | S90: 有药王谷和盘丝洞的弟子在，真是不爽，还是跑路算了！ | T90: 药王谷和盘丝洞的弟子不在眼前，真是轻松愉快啊！ | U90: 0 | V90: 0,0; | W90: 4
A91: 372 | B91: 帮手 | C91: pet_23 | D91: 0 | E91: 0 | F91: 0,0; | G91: 5103,100; | H91: 37.3*LV+186.3 | I91: (17.8*LV+19.8)*0.73 | J91: 0.9*LV+10 | K91: (3.5*LV+9.4)*0.05 | L91: 0.8*LV+8 | M91: 1000*LV+100000 | N91: 0 | O91: math.max(0,(lv/10)-1) | P91: math.max(0,(lv/10)-1) | Q91: math.max(0,(lv/10)-1) | R91: 0; | S91: 有药王谷和盘丝洞的弟子在，真是不爽，还是跑路算了！ | T91: 药王谷和盘丝洞的弟子不在眼前，真是轻松愉快啊！ | U91: 0 | V91: 0,0; | W91: 0
A92: 382 | B92: 凶灵 | C92: pet_61 | D92: 0 | E92: 0 | F92: 5309,100; | G92: 0,0; | H92: 38.7*LV+193.6 | I92: (19.2*LV+21)*0.72 | J92: 0.9*LV+10 | K92: (3.6*LV+10)*0.05 | L92: 0.8*LV+8 | M92: 1000*LV+100000 | N92: 0 | O92: math.max(0,(lv/10)-1) | P92: math.max(0,(lv/10)-1) | Q92: math.max(0,(lv/10)-1) | R92: 0; | S92: 有药王谷和盘丝洞的弟子在，真是不爽，还是跑路算了！ | T92: 药王谷和盘丝洞的弟子不在眼前，真是轻松愉快啊！ | U92: 0 | V92: 0,0; | W92: 0
A93: 392 | B93: 合欢弟子 | C93: partner_1002 | D93: 0 | E93: 0 | F93: 1311,100;1315,100; | G93: 0,0; | H93: 35.3*LV+176.5 | I93: (15.9*LV+18.2)*0.71 | J93: 0.9*LV+10 | K93: (3.2*LV+8.5)*0.05 | L93: 0.8*LV+8 | M93: 1000*LV+100000 | N93: 0 | O93: math.max(0,(lv/10)-1) | P93: math.max(0,(lv/10)-1) | Q93: math.max(0,(lv/10)-1) | R93: 0; | S93: 有药王谷和盘丝洞的弟子在，真是不爽，还是跑路算了！ | T93: 药王谷和盘丝洞的弟子不在眼前，真是轻松愉快啊！ | U93: 0 | V93: 0,0; | W93: 4
A94: 402 | B94: 凶灵 | C94: pet_61 | D94: 0 | E94: 0 | F94: 5309,100; | G94: 0,0; | H94: 39.7*LV+198.5 | I94: (20.1*LV+21.8)*0.7 | J94: 0.9*LV+10 | K94: (3.8*LV+10.5)*0.05 | L94: 0.8*LV+8 | M94: 1000*LV+100000 | N94: 0 | O94: math.max(0,(lv/10)-1) | P94: math.max(0,(lv/10)-1) | Q94: math.max(0,(lv/10)-1) | R94: 0; | S94: 有药王谷和盘丝洞的弟子在，真是不爽，还是跑路算了！ | T94: 药王谷和盘丝洞的弟子不在眼前，真是轻松愉快啊！ | U94: 0 | V94: 0,0; | W94: 1
A95: 410 | B95: 白面狐狸 | C95: partner_1009 | D95: 0 | E95: 0 | F95: 1411,100;1413,100;1412,100;1416,100; | G95: 0,0; | H95: 80.4*LV+402 | I95: (34.3*LV+44.3)*0.7 | J95: 1.5*LV+10 | K95: 7.6*LV+15.3 | L95: 1.4*LV+8 | M95: 1000*LV+100000 | N95: 0 | O95: math.max(0,(lv/10)-1) | P95: math.max(0,(lv/10)-1) | Q95: math.max(0,(lv/10)-1) | R95: 0; | S95: 有药王谷和盘丝洞的弟子在，真是不爽，还是跑路算了！ | T95: 药王谷和盘丝洞的弟子不在眼前，真是轻松愉快啊！ | U95: 0 | V95: 0,0; | W95: 2
A96: 411 | B96: 捉妖天师 | C96: partner_1004 | D96: 0 | E96: 0 | F96: 1311,100;1313,100;1315,100;1312,100; | G96: 0,0; | H96: 40.2*LV+201 | I96: (20.6*LV+22.2)*0.69 | J96: 0.9*LV+10 | K96: 3.8*LV+10.7 | L96: 0.8*LV+8 | M96: 1000*LV+100000 | N96: 0 | O96: math.max(0,(lv/10)-1) | P96: math.max(0,(lv/10)-1) | Q96: math.max(0,(lv/10)-1) | R96: 0; | S96: 有药王谷和盘丝洞的弟子在，真是不爽，还是跑路算了！ | T96: 药王谷和盘丝洞的弟子不在眼前，真是轻松愉快啊！ | U96: 0 | V96: 0,0; | W96: 4
A97: 412 | B97: 剑灵 | C97: pet_21 | D97: 0 | E97: 0 | F97: 5309,100; | G97: 0,0; | H97: 40.2*LV+201 | I97: (20.6*LV+22.2)*0.69 | J97: 0.9*LV+10 | K97: (3.8*LV+10.7)*0.05 | L97: 0.8*LV+8 | M97: 1000*LV+100000 | N97: 0 | O97: math.max(0,(lv/10)-1) | P97: math.max(0,(lv/10)-1) | Q97: math.max(0,(lv/10)-1) | R97: 0; | S97: 有药王谷和盘丝洞的弟子在，真是不爽，还是跑路算了！ | T97: 药王谷和盘丝洞的弟子不在眼前，真是轻松愉快啊！ | U97: 0 | V97: 0,0; | W97: 2
A98: 420 | B98: 避寒大王 | C98: pet_72 | D98: 0 | E98: 0 | F98: 5306,100; | G98: 0,0; | H98: 81.4*LV+406.9 | I98: (35.1*LV+45.1)*0.69 | J98: 1.5*LV+10 | K98: 7.8*LV+15.5 | L98: 1.4*LV+8 | M98: 1000*LV+100000 | N98: 0 | O98: math.max(0,(lv/10)-1) | P98: math.max(0,(lv/10)-1) | Q98: math.max(0,(lv/10)-1) | R98: 0; | S98: 有药王谷和盘丝洞的弟子在，真是不爽，还是跑路算了！ | T98: 药王谷和盘丝洞的弟子不在眼前，真是轻松愉快啊！ | U98: 0 | V98: 0,0; | W98: 1
A99: 421 | B99: 织梦花妖 | C99: pet_42 | D99: 0 | E99: 0 | F99: 5309,100; | G99: 0,0; | H99: 40.7*LV+203.4 | I99: (21.1*LV+22.5)*0.68 | J99: 0.9*LV+10 | K99: (3.9*LV+10.9)*0.05 | L99: 0.8*LV+8 | M99: 1000*LV+100000 | N99: 0 | O99: math.max(0,(lv/10)-1) | P99: math.max(0,(lv/10)-1) | Q99: math.max(0,(lv/10)-1) | R99: 0; | S99: 有药王谷和盘丝洞的弟子在，真是不爽，还是跑路算了！ | T99: 药王谷和盘丝洞的弟子不在眼前，真是轻松愉快啊！ | U99: 0 | V99: 0,0; | W99: 2
A100: 422 | B100: 兔精 | C100: pet_11 | D100: 0 | E100: 0 | F100: 0,0; | G100: 5123,100;5225,100;5104,100;5202,100; | H100: 40.7*LV+203.4 | I100: (21.1*LV+22.5)*0.68 | J100: 0.9*LV+10 | K100: (3.9*LV+10.9)*0.05 | L100: 0.8*LV+8 | M100: 1000*LV+100000 | N100: 0 | O100: math.max(0,(lv/10)-1) | P100: math.max(0,(lv/10)-1) | Q100: math.max(0,(lv/10)-1) | R100: 0; | S100: 有药王谷和盘丝洞的弟子在，真是不爽，还是跑路算了！ | T100: 药王谷和盘丝洞的弟子不在眼前，真是轻松愉快啊！ | U100: 0 | V100: 0,0; | W100: 2
A101: 430 | B101: 避暑大王 | C101: pet_72 | D101: 0 | E101: 0 | F101: 1312,100;1315,100;1311,100; | G101: 0,0; | H101: 82.4*LV+411.8 | I101: (35.9*LV+45.9)*0.68 | J101: 1.5*LV+10 | K101: (7.9*LV+15.8)*0.05 | L101: 1.4*LV+8 | M101: 1000*LV+100000 | N101: 0 | O101: math.max(0,(lv/10)-1) | P101: math.max(0,(lv/10)-1) | Q101: math.max(0,(lv/10)-1) | R101: 0; | S101: 有药王谷和盘丝洞的弟子在，真是不爽，还是跑路算了！ | T101: 药王谷和盘丝洞的弟子不在眼前，真是轻松愉快啊！ | U101: 0 | V101: 0,0; | W101: 4
A102: 431 | B102: 幻影派弟子 | C102: hero_1001 | D102: 0 | E102: 0 | F102: 1112,100;1111,100; | G102: 0,0; | H102: 41.2*LV+205.9 | I102: (21.5*LV+22.9)*0.68 | J102: 0.9*LV+10 | K102: (3.9*LV+11.1)*0.05 | L102: 0.8*LV+8 | M102: 1000*LV+100000 | N102: 0 | O102: math.max(0,(lv/10)-1) | P102: math.max(0,(lv/10)-1) | Q102: math.max(0,(lv/10)-1) | R102: 0; | S102: 有药王谷和盘丝洞的弟子在，真是不爽，还是跑路算了！ | T102: 药王谷和盘丝洞的弟子不在眼前，真是轻松愉快啊！ | U102: 0 | V102: 0,0; | W102: 1
A103: 432 | B103: 合欢弟子 | C103: partner_1002 | D103: 0 | E103: 0 | F103: 1311,100;1315,100; | G103: 0,0; | H103: 35.3*LV+176.5 | I103: (15.9*LV+18.2)*0.67 | J103: 0.9*LV+10 | K103: (3.2*LV+8.5)*0.05 | L103: 0.8*LV+8 | M103: 1000*LV+100000 | N103: 0 | O103: math.max(0,(lv/10)-1) | P103: math.max(0,(lv/10)-1) | Q103: math.max(0,(lv/10)-1) | R103: 0; | S103: 有药王谷和盘丝洞的弟子在，真是不爽，还是跑路算了！ | T103: 药王谷和盘丝洞的弟子不在眼前，真是轻松愉快啊！ | U103: 0 | V103: 0,0; | W103: 4
A104: 440 | B104: 白面狐狸 | C104: partner_1009 | D104: 0 | E104: 0 | F104: 1411,100;1413,100;1412,100;1416,100; | G104: 0,0; | H104: 83.3*LV+416.7 | I104: (36.7*LV+46.7)*0.67 | J104: 1.5*LV+10 | K104: 8*LV+16 | L104: 1.4*LV+8 | M104: 1000*LV+100000 | N104: 0 | O104: math.max(0,(lv/10)-1) | P104: math.max(0,(lv/10)-1) | Q104: math.max(0,(lv/10)-1) | R104: 0; | S104: 有药王谷和盘丝洞的弟子在，真是不爽，还是跑路算了！ | T104: 药王谷和盘丝洞的弟子不在眼前，真是轻松愉快啊！ | U104: 0 | V104: 0,0; | W104: 2
A105: 441 | B105: 幼兽 | C105: pet_63 | D105: 0 | E105: 0 | F105: 1511,100;1513,100; | G105: 0,0; | H105: 41.7*LV+208.3 | I105: (22*LV+23.3)*0.67 | J105: 0.9*LV+10 | K105: 4*LV+11.3 | L105: 0.8*LV+8 | M105: 1000*LV+100000 | N105: 0 | O105: math.max(0,(lv/10)-1) | P105: math.max(0,(lv/10)-1) | Q105: math.max(0,(lv/10)-1) | R105: 0; | S105: 有药王谷和盘丝洞的弟子在，真是不爽，还是跑路算了！ | T105: 药王谷和盘丝洞的弟子不在眼前，真是轻松愉快啊！ | U105: 0 | V105: 0,0; | W105: 5
A106: 442 | B106: 魔教弟子 | C106: hero_1001 | D106: 0 | E106: 0 | F106: 1112,100;1111,100; | G106: 0,0; | H106: 41.7*LV+208.3 | I106: (22*LV+23.3)*0.66 | J106: 0.9*LV+10 | K106: (4*LV+11.3)*0.05 | L106: 0.8*LV+8 | M106: 1000*LV+100000 | N106: 0 | O106: math.max(0,(lv/10)-1) | P106: math.max(0,(lv/10)-1) | Q106: math.max(0,(lv/10)-1) | R106: 0; | S106: 有药王谷和盘丝洞的弟子在，真是不爽，还是跑路算了！ | T106: 药王谷和盘丝洞的弟子不在眼前，真是轻松愉快啊！ | U106: 0 | V106: 0,0; | W106: 1
A107: 450 | B107: 花妖 | C107: pet_42 | D107: 0 | E107: 0 | F107: 1111,100;1112,100;1113,100;1114,100; | G107: 0,0; | H107: 84.3*LV+421.6 | I107: (37.5*LV+47.5)*0.66 | J107: 1.5*LV+10 | K107: (8.1*LV+16.2)*0.05 | L107: 1.4*LV+8 | M107: 1000*LV+100000 | N107: 0 | O107: math.max(0,(lv/10)-1) | P107: math.max(0,(lv/10)-1) | Q107: math.max(0,(lv/10)-1) | R107: 0; | S107: 有药王谷和盘丝洞的弟子在，真是不爽，还是跑路算了！ | T107: 药王谷和盘丝洞的弟子不在眼前，真是轻松愉快啊！ | U107: 0 | V107: 0,0; | W107: 1
A108: 451 | B108: 幻影派弟子 | C108: hero_1001 | D108: 0 | E108: 0 | F108: 1112,100;1111,100; | G108: 0,0; | H108: 42.2*LV+210.8 | I108: (22.5*LV+23.7)*0.66 | J108: 0.9*LV+10 | K108: (4.1*LV+11.5)*0.05 | L108: 0.8*LV+8 | M108: 1000*LV+100000 | N108: 0 | O108: math.max(0,(lv/10)-1) | P108: math.max(0,(lv/10)-1) | Q108: math.max(0,(lv/10)-1) | R108: 0; | S108: 有药王谷和盘丝洞的弟子在，真是不爽，还是跑路算了！ | T108: 药王谷和盘丝洞的弟子不在眼前，真是轻松愉快啊！ | U108: 0 | V108: 0,0; | W108: 1
A109: 452 | B109: 道长 | C109: pet_22 | D109: 0 | E109: 0 | F109: 1212,100;1211,100; | G109: 0,0; | H109: 42.2*LV+210.8 | I109: (22.5*LV+23.7)*0.65 | J109: 0.9*LV+10 | K109: 4.1*LV+11.5 | L109: 0.8*LV+8 | M109: 1000*LV+100000 | N109: 0 | O109: math.max(0,(lv/10)-1) | P109: math.max(0,(lv/10)-1) | Q109: math.max(0,(lv/10)-1) | R109: 0; | S109: 有药王谷和盘丝洞的弟子在，真是不爽，还是跑路算了！ | T109: 药王谷和盘丝洞的弟子不在眼前，真是轻松愉快啊！ | U109: 0 | V109: 0,0; | W109: 3
A110: 460 | B110: 白虎 | C110: pet_63 | D110: 0 | E110: 0 | F110: 1111,100;1112,100;1113,100;1114,100; | G110: 0,0; | H110: 85.3*LV+426.5 | I110: (38.2*LV+48.2)*0.65 | J110: 1.5*LV+10 | K110: (8.2*LV+16.5)*0.05 | L110: 1.4*LV+8 | M110: 1000*LV+100000 | N110: 0 | O110: math.max(0,(lv/10)-1) | P110: math.max(0,(lv/10)-1) | Q110: math.max(0,(lv/10)-1) | R110: 0; | S110: 有药王谷和盘丝洞的弟子在，真是不爽，还是跑路算了！ | T110: 药王谷和盘丝洞的弟子不在眼前，真是轻松愉快啊！ | U110: 0 | V110: 0,0; | W110: 1
A111: 461 | B111: 妖狐 | C111: partner_1009 | D111: 0 | E111: 0 | F111: 1311,100;1315,100; | G111: 0,0; | H111: 42.6*LV+213.2 | I111: (22.9*LV+24.1)*0.65 | J111: 0.9*LV+10 | K111: (4.1*LV+11.8)*0.05 | L111: 0.8*LV+8 | M111: 1000*LV+100000 | N111: 0 | O111: math.max(0,(lv/10)-1) | P111: math.max(0,(lv/10)-1) | Q111: math.max(0,(lv/10)-1) | R111: 0; | S111: 有药王谷和盘丝洞的弟子在，真是不爽，还是跑路算了！ | T111: 药王谷和盘丝洞的弟子不在眼前，真是轻松愉快啊！ | U111: 0 | V111: 0,0; | W111: 4
A112: 462 | B112: 合欢弟子 | C112: partner_1002 | D112: 0 | E112: 0 | F112: 1312,100;1315,100; | G112: 0,0; | H112: 42.6*LV+213.2 | I112: (22.9*LV+24.1)*0.64 | J112: 0.9*LV+10 | K112: (4.1*LV+11.8)*0.05 | L112: 0.8*LV+8 | M112: 1000*LV+100000 | N112: 0 | O112: math.max(0,(lv/10)-1) | P112: math.max(0,(lv/10)-1) | Q112: math.max(0,(lv/10)-1) | R112: 0; | S112: 有药王谷和盘丝洞的弟子在，真是不爽，还是跑路算了！ | T112: 药王谷和盘丝洞的弟子不在眼前，真是轻松愉快啊！ | U112: 0 | V112: 0,0; | W112: 4
A113: 470 | B113: 恶龙甲 | C113: pet_23 | D113: 0 | E113: 0 | F113: 5306,100; | G113: 0,0; | H113: 86.3*LV+431.4 | I113: (39*LV+49)*0.64 | J113: 1.5*LV+10 | K113: 8.4*LV+16.7 | L113: 1.4*LV+8 | M113: 1000*LV+100000 | N113: 0 | O113: math.max(0,(lv/10)-1) | P113: math.max(0,(lv/10)-1) | Q113: math.max(0,(lv/10)-1) | R113: 0; | S113: 有药王谷和盘丝洞的弟子在，真是不爽，还是跑路算了！ | T113: 药王谷和盘丝洞的弟子不在眼前，真是轻松愉快啊！ | U113: 0 | V113: 0,0; | W113: 0
A114: 471 | B114: 随从 | C114: pet_23 | D114: 0 | E114: 0 | F114: 1112,100;1111,100; | G114: 0,0; | H114: 43.1*LV+215.7 | I114: (23.4*LV+24.5)*0.64 | J114: 0.9*LV+10 | K114: (4.2*LV+12)*0.05 | L114: 0.8*LV+8 | M114: 1000*LV+100000 | N114: 0 | O114: math.max(0,(lv/10)-1) | P114: math.max(0,(lv/10)-1) | Q114: math.max(0,(lv/10)-1) | R114: 0; | S114: 有药王谷和盘丝洞的弟子在，真是不爽，还是跑路算了！ | T114: 药王谷和盘丝洞的弟子不在眼前，真是轻松愉快啊！ | U114: 0 | V114: 0,0; | W114: 1
A115: 472 | B115: 妖人 | C115: pet_61 | D115: 0 | E115: 0 | F115: 1311,100;1315,100; | G115: 5103,100; | H115: 43.1*LV+215.7 | I115: (23.4*LV+24.5)*0.63 | J115: 0.9*LV+10 | K115: (4.2*LV+12)*0.05 | L115: 0.8*LV+8 | M115: 1000*LV+100000 | N115: 0 | O115: math.max(0,(lv/10)-1) | P115: math.max(0,(lv/10)-1) | Q115: math.max(0,(lv/10)-1) | R115: 0; | S115: 有药王谷和盘丝洞的弟子在，真是不爽，还是跑路算了！ | T115: 药王谷和盘丝洞的弟子不在眼前，真是轻松愉快啊！ | U115: 0 | V115: 0,0; | W115: 4
A116: 480 | B116: 白虎 | C116: pet_63 | D116: 0 | E116: 0 | F116: 1312,100;1315,100;1311,100; | G116: 0,0; | H116: 87.3*LV+436.3 | I116: (39.8*LV+49.8)*0.63 | J116: 1.5*LV+10 | K116: (8.5*LV+16.9)*0.05 | L116: 1.4*LV+8 | M116: 1000*LV+100000 | N116: 0 | O116: math.max(0,(lv/10)-1) | P116: math.max(0,(lv/10)-1) | Q116: math.max(0,(lv/10)-1) | R116: 0; | S116: 有药王谷和盘丝洞的弟子在，真是不爽，还是跑路算了！ | T116: 药王谷和盘丝洞的弟子不在眼前，真是轻松愉快啊！ | U116: 0 | V116: 0,0; | W116: 4
A117: 481 | B117: 幻影派弟子 | C117: hero_1001 | D117: 0 | E117: 0 | F117: 1111,100;1112,100; | G117: 0,0; | H117: 43.6*LV+218.1 | I117: (23.9*LV+24.9)*0.63 | J117: 0.9*LV+10 | K117: (4.2*LV+12.2)*0.05 | L117: 0.8*LV+8 | M117: 1000*LV+100000 | N117: 0 | O117: math.max(0,(lv/10)-1) | P117: math.max(0,(lv/10)-1) | Q117: math.max(0,(lv/10)-1) | R117: 0; | S117: 有药王谷和盘丝洞的弟子在，真是不爽，还是跑路算了！ | T117: 药王谷和盘丝洞的弟子不在眼前，真是轻松愉快啊！ | U117: 0 | V117: 0,0; | W117: 1
A118: 482 | B118: 道长 | C118: pet_22 | D118: 0 | E118: 0 | F118: 1212,100;1211,100; | G118: 0,0; | H118: 43.6*LV+218.1 | I118: (23.9*LV+24.9)*0.62 | J118: 0.9*LV+10 | K118: 4.2*LV+12.2 | L118: 0.8*LV+8 | M118: 1000*LV+100000 | N118: 0 | O118: math.max(0,(lv/10)-1) | P118: math.max(0,(lv/10)-1) | Q118: math.max(0,(lv/10)-1) | R118: 0; | S118: 有药王谷和盘丝洞的弟子在，真是不爽，还是跑路算了！ | T118: 药王谷和盘丝洞的弟子不在眼前，真是轻松愉快啊！ | U118: 0 | V118: 0,0; | W118: 3
A119: 490 | B119: 凶灵 | C119: pet_62 | D119: 0 | E119: 0 | F119: 1312,100;1315,100;1311,100; | G119: 0,0; | H119: 88.2*LV+441.2 | I119: (40.6*LV+50.6)*0.62 | J119: 1.5*LV+10 | K119: (8.6*LV+17.2)*0.05 | L119: 1.4*LV+8 | M119: 1000*LV+100000 | N119: 0 | O119: math.max(0,(lv/10)-1) | P119: math.max(0,(lv/10)-1) | Q119: math.max(0,(lv/10)-1) | R119: 0; | S119: 有药王谷和盘丝洞的弟子在，真是不爽，还是跑路算了！ | T119: 药王谷和盘丝洞的弟子不在眼前，真是轻松愉快啊！ | U119: 0 | V119: 0,0; | W119: 4
A120: 491 | B120: 剑灵 | C120: pet_21 | D120: 0 | E120: 0 | F120: 1311,100;1315,100; | G120: 0,0; | H120: 44.1*LV+220.6 | I120: (24.4*LV+25.3)*0.62 | J120: 0.9*LV+10 | K120: (4.3*LV+12.4)*0.05 | L120: 0.8*LV+8 | M120: 1000*LV+100000 | N120: 0 | O120: math.max(0,(lv/10)-1) | P120: math.max(0,(lv/10)-1) | Q120: math.max(0,(lv/10)-1) | R120: 0; | S120: 有药王谷和盘丝洞的弟子在，真是不爽，还是跑路算了！ | T120: 药王谷和盘丝洞的弟子不在眼前，真是轻松愉快啊！ | U120: 0 | V120: 0,0; | W120: 4
A121: 492 | B121: 毒虫 | C121: pet_21 | D121: 0 | E121: 0 | F121: 0,0; | G121: 5224,100;5202,100;5203,100; | H121: 44.1*LV+220.6 | I121: (24.4*LV+25.3)*0.61 | J121: 0.9*LV+10 | K121: (4.3*LV+12.4)*0.05 | L121: 0.8*LV+8 | M121: 1000*LV+100000 | N121: 0 | O121: math.max(0,(lv/10)-1) | P121: math.max(0,(lv/10)-1) | Q121: math.max(0,(lv/10)-1) | R121: 0; | S121: 有药王谷和盘丝洞的弟子在，真是不爽，还是跑路算了！ | T121: 药王谷和盘丝洞的弟子不在眼前，真是轻松愉快啊！ | U121: 0 | V121: 0,0; | W121: 0
A122: 500 | B122: 万圣大王 | C122: pet_81 | D122: 0 | E122: 0 | F122: 1112,100;1111,100; | G122: 0,0; | H122: 89.2*LV+446.1 | I122: (41.4*LV+51.4)*0.61 | J122: 1.5*LV+10 | K122: (8.7*LV+17.4)*0.05 | L122: 1.4*LV+8 | M122: 1000*LV+100000 | N122: 0 | O122: math.max(0,(lv/10)-1) | P122: math.max(0,(lv/10)-1) | Q122: math.max(0,(lv/10)-1) | R122: 0; | S122: 有药王谷和盘丝洞的弟子在，真是不爽，还是跑路算了！ | T122: 药王谷和盘丝洞的弟子不在眼前，真是轻松愉快啊！ | U122: 0 | V122: 0,0; | W122: 1
A123: 501 | B123: 蛊毒派弟子 | C123: pet_53 | D123: 0 | E123: 0 | F123: 1111,100;1112,100;1113,100;1114,100; | G123: 0,0; | H123: 44.6*LV+223 | I123: (24.8*LV+25.7)*0.61 | J123: 0.9*LV+10 | K123: (4.4*LV+12.6)*0.05 | L123: 0.8*LV+8 | M123: 1000*LV+100000 | N123: 0 | O123: math.max(0,(lv/10)-1) | P123: math.max(0,(lv/10)-1) | Q123: math.max(0,(lv/10)-1) | R123: 0; | S123: 有药王谷和盘丝洞的弟子在，真是不爽，还是跑路算了！ | T123: 药王谷和盘丝洞的弟子不在眼前，真是轻松愉快啊！ | U123: 0 | V123: 0,0; | W123: 1
A124: 502 | B124: 妖人 | C124: pet_61 | D124: 0 | E124: 0 | F124: 1311,100;1315,100; | G124: 5103,100; | H124: 44.6*LV+223 | I124: (24.8*LV+25.7)*0.61 | J124: 0.9*LV+10 | K124: (4.4*LV+12.6)*0.05 | L124: 0.8*LV+8 | M124: 1000*LV+100000 | N124: 0 | O124: math.max(0,(lv/10)-1) | P124: math.max(0,(lv/10)-1) | Q124: math.max(0,(lv/10)-1) | R124: 0; | S124: 有药王谷和盘丝洞的弟子在，真是不爽，还是跑路算了！ | T124: 药王谷和盘丝洞的弟子不在眼前，真是轻松愉快啊！ | U124: 0 | V124: 0,0; | W124: 4
A125: 510 | B125: 万圣公主 | C125: partner_1010 | D125: 0 | E125: 0 | F125: 1411,100;1413,100;1412,100;1416,100; | G125: 0,0; | H125: 90.2*LV+451 | I125: (42.2*LV+52.2)*0.6 | J125: 1.5*LV+10 | K125: 8.8*LV+17.6 | L125: 1.4*LV+8 | M125: 1000*LV+100000 | N125: 0 | O125: math.max(0,(lv/10)-1) | P125: math.max(0,(lv/10)-1) | Q125: math.max(0,(lv/10)-1) | R125: 0; | S125: 有药王谷和盘丝洞的弟子在，真是不爽，还是跑路算了！ | T125: 药王谷和盘丝洞的弟子不在眼前，真是轻松愉快啊！ | U125: 0 | V125: 0,0; | W125: 2
A126: 511 | B126: 幼兽 | C126: pet_63 | D126: 0 | E126: 0 | F126: 1511,100;1513,100; | G126: 0,0; | H126: 45.1*LV+225.5 | I126: (25.3*LV+26.1)*0.6 | J126: 0.9*LV+10 | K126: 4.4*LV+12.8 | L126: 0.8*LV+8 | M126: 1000*LV+100000 | N126: 0 | O126: math.max(0,(lv/10)-1) | P126: math.max(0,(lv/10)-1) | Q126: math.max(0,(lv/10)-1) | R126: 0; | S126: 有药王谷和盘丝洞的弟子在，真是不爽，还是跑路算了！ | T126: 药王谷和盘丝洞的弟子不在眼前，真是轻松愉快啊！ | U126: 0 | V126: 0,0; | W126: 5
A127: 512 | B127: 魔教弟子 | C127: hero_1001 | D127: 0 | E127: 0 | F127: 1112,100;1111,100; | G127: 0,0; | H127: 41.7*LV+208.3 | I127: (22*LV+23.3)*0.6 | J127: 0.9*LV+10 | K127: (4*LV+11.3)*0.05 | L127: 0.8*LV+8 | M127: 1000*LV+100000 | N127: 0 | O127: math.max(0,(lv/10)-1) | P127: math.max(0,(lv/10)-1) | Q127: math.max(0,(lv/10)-1) | R127: 0; | S127: 有药王谷和盘丝洞的弟子在，真是不爽，还是跑路算了！ | T127: 药王谷和盘丝洞的弟子不在眼前，真是轻松愉快啊！ | U127: 0 | V127: 0,0; | W127: 1
A128: 520 | B128: 神宵道长心魔 | C128: pet_22 | D128: 0 | E128: 0 | F128: 1312,100;1315,100;1311,100; | G128: 0,0; | H128: 91.2*LV+455.9 | I128: (42.9*LV+52.9)*0.59 | J128: 1.5*LV+10 | K128: (8.9*LV+17.9)*0.05 | L128: 1.4*LV+8 | M128: 1000*LV+100000 | N128: 0 | O128: math.max(0,(lv/10)-1) | P128: math.max(0,(lv/10)-1) | Q128: math.max(0,(lv/10)-1) | R128: 0; | S128: 有药王谷和盘丝洞的弟子在，真是不爽，还是跑路算了！ | T128: 药王谷和盘丝洞的弟子不在眼前，真是轻松愉快啊！ | U128: 0 | V128: 0,0; | W128: 4
A129: 521 | B129: 孤魂 | C129: pet_21 | D129: 0 | E129: 0 | F129: 1112,100;1111,100; | G129: 0,0; | H129: 45.6*LV+227.9 | I129: (25.8*LV+26.5)*0.59 | J129: 0.9*LV+10 | K129: (4.5*LV+13.1)*0.05 | L129: 0.8*LV+8 | M129: 1000*LV+100000 | N129: 0 | O129: math.max(0,(lv/10)-1) | P129: math.max(0,(lv/10)-1) | Q129: math.max(0,(lv/10)-1) | R129: 0; | S129: 有药王谷和盘丝洞的弟子在，真是不爽，还是跑路算了！ | T129: 药王谷和盘丝洞的弟子不在眼前，真是轻松愉快啊！ | U129: 0 | V129: 0,0; | W129: 1
A130: 522 | B130: 凶灵 | C130: pet_61 | D130: 0 | E130: 0 | F130: 5309,100; | G130: 0,0; | H130: 45.6*LV+227.9 | I130: (25.8*LV+26.5)*0.59 | J130: 0.9*LV+10 | K130: (4.5*LV+13.1)*0.05 | L130: 0.8*LV+8 | M130: 1000*LV+100000 | N130: 0 | O130: math.max(0,(lv/10)-1) | P130: math.max(0,(lv/10)-1) | Q130: math.max(0,(lv/10)-1) | R130: 0; | S130: 有药王谷和盘丝洞的弟子在，真是不爽，还是跑路算了！ | T130: 药王谷和盘丝洞的弟子不在眼前，真是轻松愉快啊！ | U130: 0 | V130: 0,0; | W130: 4
A131: 530 | B131: 恶龙乙 | C131: pet_23 | D131: 0 | E131: 0 | F131: 1311,100;1315,100; | G131: 0,0; | H131: 92.2*LV+460.8 | I131: (43.7*LV+53.7)*0.58 | J131: 1.5*LV+10 | K131: (9.1*LV+18.1)*0.05 | L131: 1.4*LV+8 | M131: 1000*LV+100000 | N131: 0 | O131: math.max(0,(lv/10)-1) | P131: math.max(0,(lv/10)-1) | Q131: math.max(0,(lv/10)-1) | R131: 0; | S131: 有药王谷和盘丝洞的弟子在，真是不爽，还是跑路算了！ | T131: 药王谷和盘丝洞的弟子不在眼前，真是轻松愉快啊！ | U131: 0 | V131: 0,0; | W131: 4
A132: 531 | B132: 幼兽 | C132: pet_63 | D132: 0 | E132: 0 | F132: 1111,100;1112,100;1113,100;1114,100; | G132: 0,0; | H132: 46.1*LV+230.4 | I132: (26.2*LV+26.9)*0.58 | J132: 0.9*LV+10 | K132: (4.5*LV+13.3)*0.05 | L132: 0.8*LV+8 | M132: 1000*LV+100000 | N132: 0 | O132: math.max(0,(lv/10)-1) | P132: math.max(0,(lv/10)-1) | Q132: math.max(0,(lv/10)-1) | R132: 0; | S132: 有药王谷和盘丝洞的弟子在，真是不爽，还是跑路算了！ | T132: 药王谷和盘丝洞的弟子不在眼前，真是轻松愉快啊！ | U132: 0 | V132: 0,0; | W132: 1
A133: 532 | B133: 妖狐 | C133: partner_1009 | D133: 0 | E133: 0 | F133: 1312,100;1315,100;1311,100; | G133: 5224,100; | H133: 46.1*LV+230.4 | I133: (26.2*LV+26.9)*0.58 | J133: 0.9*LV+10 | K133: (4.5*LV+13.3)*0.05 | L133: 0.8*LV+8 | M133: 1000*LV+100000 | N133: 0 | O133: math.max(0,(lv/10)-1) | P133: math.max(0,(lv/10)-1) | Q133: math.max(0,(lv/10)-1) | R133: 0; | S133: 有药王谷和盘丝洞的弟子在，真是不爽，还是跑路算了！ | T133: 药王谷和盘丝洞的弟子不在眼前，真是轻松愉快啊！ | U133: 0 | V133: 0,0; | W133: 4
A134: 540 | B134: 封山小妖 | C134: pet_62 | D134: 0 | E134: 0 | F134: 1411,100;1413,100;1412,100;1416,100; | G134: 0,0; | H134: 93.1*LV+465.7 | I134: (44.5*LV+54.5)*0.57 | J134: 1.5*LV+10 | K134: 9.2*LV+18.4 | L134: 1.4*LV+8 | M134: 1000*LV+100000 | N134: 0 | O134: math.max(0,(lv/10)-1) | P134: math.max(0,(lv/10)-1) | Q134: math.max(0,(lv/10)-1) | R134: 0; | S134: 有药王谷和盘丝洞的弟子在，真是不爽，还是跑路算了！ | T134: 药王谷和盘丝洞的弟子不在眼前，真是轻松愉快啊！ | U134: 0 | V134: 0,0; | W134: 2
A135: 541 | B135: 猴子 | C135: pet_73 | D135: 0 | E135: 0 | F135: 1411,100;1413,100;1412,100;1416,100; | G135: 0,0; | H135: 46.6*LV+232.8 | I135: (26.7*LV+27.3)*0.57 | J135: 0.9*LV+10 | K135: 4.6*LV+13.5 | L135: 0.8*LV+8 | M135: 1000*LV+100000 | N135: 0 | O135: math.max(0,(lv/10)-1) | P135: math.max(0,(lv/10)-1) | Q135: math.max(0,(lv/10)-1) | R135: 0; | S135: 有药王谷和盘丝洞的弟子在，真是不爽，还是跑路算了！ | T135: 药王谷和盘丝洞的弟子不在眼前，真是轻松愉快啊！ | U135: 0 | V135: 0,0; | W135: 2
A136: 542 | B136: 剑灵 | C136: pet_21 | D136: 0 | E136: 0 | F136: 5309,100; | G136: 0,0; | H136: 46.6*LV+232.8 | I136: (26.7*LV+27.3)*0.57 | J136: 0.9*LV+10 | K136: (4.6*LV+13.5)*0.05 | L136: 0.8*LV+8 | M136: 1000*LV+100000 | N136: 0 | O136: math.max(0,(lv/10)-1) | P136: math.max(0,(lv/10)-1) | Q136: math.max(0,(lv/10)-1) | R136: 0; | S136: 有药王谷和盘丝洞的弟子在，真是不爽，还是跑路算了！ | T136: 药王谷和盘丝洞的弟子不在眼前，真是轻松愉快啊！ | U136: 0 | V136: 0,0; | W136: 0
A137: 550 | B137: 阵灵 | C137: pet_62 | D137: 0 | E137: 0 | F137: 1411,100;1413,100;1412,100;1416,100; | G137: 0,0; | H137: 94.1*LV+470.6 | I137: (45.3*LV+55.3)*0.56 | J137: 1.5*LV+10 | K137: 9.3*LV+18.6 | L137: 1.4*LV+8 | M137: 1000*LV+100000 | N137: 0 | O137: math.max(0,(lv/10)-1) | P137: math.max(0,(lv/10)-1) | Q137: math.max(0,(lv/10)-1) | R137: 0; | S137: 有药王谷和盘丝洞的弟子在，真是不爽，还是跑路算了！ | T137: 药王谷和盘丝洞的弟子不在眼前，真是轻松愉快啊！ | U137: 0 | V137: 0,0; | W137: 2
A138: 551 | B138: 幼兽 | C138: pet_63 | D138: 0 | E138: 0 | F138: 1511,100;1513,100; | G138: 0,0; | H138: 47.1*LV+235.3 | I138: (27.2*LV+27.6)*0.56 | J138: 0.9*LV+10 | K138: 4.6*LV+13.7 | L138: 0.8*LV+8 | M138: 1000*LV+100000 | N138: 0 | O138: math.max(0,(lv/10)-1) | P138: math.max(0,(lv/10)-1) | Q138: math.max(0,(lv/10)-1) | R138: 0; | S138: 有药王谷和盘丝洞的弟子在，真是不爽，还是跑路算了！ | T138: 药王谷和盘丝洞的弟子不在眼前，真是轻松愉快啊！ | U138: 0 | V138: 0,0; | W138: 5
A139: 552 | B139: 魔教弟子 | C139: hero_1001 | D139: 0 | E139: 0 | F139: 1112,100;1111,100; | G139: 0,0; | H139: 47.1*LV+235.3 | I139: (27.2*LV+27.6)*0.56 | J139: 0.9*LV+10 | K139: (4.6*LV+13.7)*0.05 | L139: 0.8*LV+8 | M139: 1000*LV+100000 | N139: 0 | O139: math.max(0,(lv/10)-1) | P139: math.max(0,(lv/10)-1) | Q139: math.max(0,(lv/10)-1) | R139: 0; | S139: 有药王谷和盘丝洞的弟子在，真是不爽，还是跑路算了！ | T139: 药王谷和盘丝洞的弟子不在眼前，真是轻松愉快啊！ | U139: 0 | V139: 0,0; | W139: 1
A140: 560 | B140: 阵灵 | C140: pet_62 | D140: 0 | E140: 0 | F140: 5306,100; | G140: 0,0; | H140: 95.1*LV+475.5 | I140: (46.1*LV+56.1)*0.55 | J140: 1.5*LV+10 | K140: 9.4*LV+18.8 | L140: 1.4*LV+8 | M140: 1000*LV+100000 | N140: 0 | O140: math.max(0,(lv/10)-1) | P140: math.max(0,(lv/10)-1) | Q140: math.max(0,(lv/10)-1) | R140: 0; | S140: 有药王谷和盘丝洞的弟子在，真是不爽，还是跑路算了！ | T140: 药王谷和盘丝洞的弟子不在眼前，真是轻松愉快啊！ | U140: 0 | V140: 0,0; | W140: 4
A141: 561 | B141: 随从 | C141: pet_23 | D141: 0 | E141: 0 | F141: 1112,100;1111,100; | G141: 0,0; | H141: 47.5*LV+237.7 | I141: (27.6*LV+28)*0.55 | J141: 0.9*LV+10 | K141: (4.7*LV+13.9)*0.05 | L141: 0.8*LV+8 | M141: 1000*LV+100000 | N141: 0 | O141: math.max(0,(lv/10)-1) | P141: math.max(0,(lv/10)-1) | Q141: math.max(0,(lv/10)-1) | R141: 0; | S141: 有药王谷和盘丝洞的弟子在，真是不爽，还是跑路算了！ | T141: 药王谷和盘丝洞的弟子不在眼前，真是轻松愉快啊！ | U141: 0 | V141: 0,0; | W141: 1
A142: 562 | B142: 妖人 | C142: pet_61 | D142: 0 | E142: 0 | F142: 1311,100;1315,100; | G142: 5103,100; | H142: 43.1*LV+215.7 | I142: (23.4*LV+24.5)*0.55 | J142: 0.9*LV+10 | K142: (4.2*LV+12)*0.05 | L142: 0.8*LV+8 | M142: 1000*LV+100000 | N142: 0 | O142: math.max(0,(lv/10)-1) | P142: math.max(0,(lv/10)-1) | Q142: math.max(0,(lv/10)-1) | R142: 0; | S142: 有药王谷和盘丝洞的弟子在，真是不爽，还是跑路算了！ | T142: 药王谷和盘丝洞的弟子不在眼前，真是轻松愉快啊！ | U142: 0 | V142: 0,0; | W142: 4
A143: 570 | B143: 阵灵 | C143: pet_62 | D143: 0 | E143: 0 | F143: 1511,100;1512,100;1513,100;1514,100; | G143: 0,0; | H143: 96.1*LV+480.4 | I143: (46.9*LV+56.9)*0.54 | J143: 1.5*LV+10 | K143: 9.5*LV+19.1 | L143: 1.4*LV+8 | M143: 1000*LV+100000 | N143: 0 | O143: math.max(0,(lv/10)-1) | P143: math.max(0,(lv/10)-1) | Q143: math.max(0,(lv/10)-1) | R143: 0; | S143: 有药王谷和盘丝洞的弟子在，真是不爽，还是跑路算了！ | T143: 药王谷和盘丝洞的弟子不在眼前，真是轻松愉快啊！ | U143: 0 | V143: 0,0; | W143: 5
A144: 571 | B144: 凶魂 | C144: pet_53 | D144: 0 | E144: 0 | F144: 1311,100;1315,100; | G144: 0,0; | H144: 48*LV+240.2 | I144: (28.1*LV+28.4)*0.54 | J144: 0.9*LV+10 | K144: (4.8*LV+14.1)*0.05 | L144: 0.8*LV+8 | M144: 1000*LV+100000 | N144: 0 | O144: math.max(0,(lv/10)-1) | P144: math.max(0,(lv/10)-1) | Q144: math.max(0,(lv/10)-1) | R144: 0; | S144: 有药王谷和盘丝洞的弟子在，真是不爽，还是跑路算了！ | T144: 药王谷和盘丝洞的弟子不在眼前，真是轻松愉快啊！ | U144: 0 | V144: 0,0; | W144: 4
A145: 572 | B145: 帮凶 | C145: pet_23 | D145: 0 | E145: 0 | F145: 1112,100;1111,100; | G145: 0,0; | H145: 48*LV+240.2 | I145: (28.1*LV+28.4)*0.54 | J145: 0.9*LV+10 | K145: (4.8*LV+14.1)*0.05 | L145: 0.8*LV+8 | M145: 1000*LV+100000 | N145: 0 | O145: math.max(0,(lv/10)-1) | P145: math.max(0,(lv/10)-1) | Q145: math.max(0,(lv/10)-1) | R145: 0; | S145: 有药王谷和盘丝洞的弟子在，真是不爽，还是跑路算了！ | T145: 药王谷和盘丝洞的弟子不在眼前，真是轻松愉快啊！ | U145: 0 | V145: 0,0; | W145: 1
A146: 580 | B146: 玉面狐狸 | C146: partner_1009 | D146: 0 | E146: 0 | F146: 1411,100;1413,100;1412,100;1416,100; | G146: 0,0; | H146: 97.1*LV+485.3 | I146: (47.6*LV+57.6)*0.54 | J146: 1.5*LV+10 | K146: 9.6*LV+19.3 | L146: 1.4*LV+8 | M146: 1000*LV+100000 | N146: 0 | O146: math.max(0,(lv/10)-1) | P146: math.max(0,(lv/10)-1) | Q146: math.max(0,(lv/10)-1) | R146: 0; | S146: 有药王谷和盘丝洞的弟子在，真是不爽，还是跑路算了！ | T146: 药王谷和盘丝洞的弟子不在眼前，真是轻松愉快啊！ | U146: 0 | V146: 0,0; | W146: 2
A147: 581 | B147: 仆从 | C147: pet_21 | D147: 0 | E147: 0 | F147: 5309,100; | G147: 0,0; | H147: 48.5*LV+242.6 | I147: (28.6*LV+28.8)*0.53 | J147: 0.9*LV+10 | K147: (4.8*LV+14.4)*0.05 | L147: 0.8*LV+8 | M147: 1000*LV+100000 | N147: 0 | O147: math.max(0,(lv/10)-1) | P147: math.max(0,(lv/10)-1) | Q147: math.max(0,(lv/10)-1) | R147: 0; | S147: 有药王谷和盘丝洞的弟子在，真是不爽，还是跑路算了！ | T147: 药王谷和盘丝洞的弟子不在眼前，真是轻松愉快啊！ | U147: 0 | V147: 0,0; | W147: 1
A148: 582 | B148: 水晶宫弟子 | C148: hero_1001 | D148: 0 | E148: 0 | F148: 1411,100;1413,100;1412,100; | G148: 0,0; | H148: 49*LV+245.1 | I148: (29.1*LV+29.2)*0.53 | J148: 0.9*LV+10 | K148: 4.9*LV+14.6 | L148: 0.8*LV+8 | M148: 1000*LV+100000 | N148: 0 | O148: math.max(0,(lv/10)-1) | P148: math.max(0,(lv/10)-1) | Q148: math.max(0,(lv/10)-1) | R148: 0; | S148: 有药王谷和盘丝洞的弟子在，真是不爽，还是跑路算了！ | T148: 药王谷和盘丝洞的弟子不在眼前，真是轻松愉快啊！ | U148: 0 | V148: 0,0; | W148: 2
A149: 590 | B149: 红孩儿 | C149: pet_33 | D149: 0 | E149: 0 | F149: 1411,100;1413,100;1412,100;1416,100; | G149: 0,0; | H149: 98*LV+490.2 | I149: (48.4*LV+58.4)*0.53 | J149: 1.5*LV+10 | K149: 9.8*LV+19.5 | L149: 1.4*LV+8 | M149: 1000*LV+100000 | N149: 0 | O149: math.max(0,(lv/10)-1) | P149: math.max(0,(lv/10)-1) | Q149: math.max(0,(lv/10)-1) | R149: 0; | S149: 有药王谷和盘丝洞的弟子在，真是不爽，还是跑路算了！ | T149: 药王谷和盘丝洞的弟子不在眼前，真是轻松愉快啊！ | U149: 0 | V149: 0,0; | W149: 2
A150: 591 | B150: 水晶宫妖魔 | C150: pet_23 | D150: 0 | E150: 0 | F150: 1411,100;1413,100;1412,100;1416,100; | G150: 0,0; | H150: 49*LV+245.1 | I150: (29.1*LV+29.2)*0.52 | J150: 0.9*LV+10 | K150: 4.9*LV+14.6 | L150: 0.8*LV+8 | M150: 1000*LV+100000 | N150: 0 | O150: math.max(0,(lv/10)-1) | P150: math.max(0,(lv/10)-1) | Q150: math.max(0,(lv/10)-1) | R150: 0; | S150: 有药王谷和盘丝洞的弟子在，真是不爽，还是跑路算了！ | T150: 药王谷和盘丝洞的弟子不在眼前，真是轻松愉快啊！ | U150: 0 | V150: 0,0; | W150: 2
A151: 592 | B151: 外门弟子 | C151: hero_1001 | D151: 0 | E151: 0 | F151: 5309,100; | G151: 5103,100; | H151: 49*LV+245.1 | I151: (29.1*LV+29.2)*0.52 | J151: 0.9*LV+10 | K151: (4.9*LV+14.6)*0.05 | L151: 0.8*LV+8 | M151: 1000*LV+100000 | N151: 0 | O151: math.max(0,(lv/10)-1) | P151: math.max(0,(lv/10)-1) | Q151: math.max(0,(lv/10)-1) | R151: 0; | S151: 有药王谷和盘丝洞的弟子在，真是不爽，还是跑路算了！ | T151: 药王谷和盘丝洞的弟子不在眼前，真是轻松愉快啊！ | U151: 0 | V151: 0,0; | W151: 0
A152: 600 | B152: 铁扇公主 | C152: partner_1003 | D152: 0 | E152: 0 | F152: 1411,100;1413,100;1412,100;1416,100; | G152: 0,0; | H152: 99*LV+495.1 | I152: (49.2*LV+59.2)*0.52 | J152: 1.5*LV+10 | K152: 9.9*LV+19.8 | L152: 1.4*LV+8 | M152: 1000*LV+100000 | N152: 0 | O152: math.max(0,(lv/10)-1) | P152: math.max(0,(lv/10)-1) | Q152: math.max(0,(lv/10)-1) | R152: 0; | S152: 有药王谷和盘丝洞的弟子在，真是不爽，还是跑路算了！ | T152: 药王谷和盘丝洞的弟子不在眼前，真是轻松愉快啊！ | U152: 0 | V152: 0,0; | W152: 2
A153: 601 | B153: 恶狗 | C153: pet_1 | D153: 0 | E153: 0 | F153: 1311,100;1315,100; | G153: 0,0; | H153: 49.5*LV+247.5 | I153: (29.5*LV+29.6)*0.51 | J153: 0.9*LV+10 | K153: (4.9*LV+14.8)*0.05 | L153: 0.8*LV+8 | M153: 1000*LV+100000 | N153: 0 | O153: math.max(0,(lv/10)-1) | P153: math.max(0,(lv/10)-1) | Q153: math.max(0,(lv/10)-1) | R153: 0; | S153: 有药王谷和盘丝洞的弟子在，真是不爽，还是跑路算了！ | T153: 药王谷和盘丝洞的弟子不在眼前，真是轻松愉快啊！ | U153: 0 | V153: 0,0; | W153: 4
A154: 602 | B154: 幼兽 | C154: pet_63 | D154: 0 | E154: 0 | F154: 1411,100;1412,100; | G154: 5121,100; | H154: 49.5*LV+247.5 | I154: (29.5*LV+29.6)*0.51 | J154: 0.9*LV+10 | K154: 4.9*LV+14.8 | L154: 0.8*LV+8 | M154: 1000*LV+100000 | N154: 0 | O154: math.max(0,(lv/10)-1) | P154: math.max(0,(lv/10)-1) | Q154: math.max(0,(lv/10)-1) | R154: 0; | S154: 有药王谷和盘丝洞的弟子在，真是不爽，还是跑路算了！ | T154: 药王谷和盘丝洞的弟子不在眼前，真是轻松愉快啊！ | U154: 0 | V154: 0,0; | W154: 2
A155: 610 | B155: 过路小妖 | C155: pet_62 | D155: 0 | E155: 0 | F155: 1411,100;1413,100;1412,100;1416,100; | G155: 0,0; | H155: 100*LV+500 | I155: (50*LV+60)*0.51 | J155: 1.5*LV+10 | K155: 10*LV+20 | L155: 1.4*LV+8 | M155: 1000*LV+100000 | N155: 0 | O155: math.max(0,(lv/10)-1) | P155: math.max(0,(lv/10)-1) | Q155: math.max(0,(lv/10)-1) | R155: 0; | S155: 有药王谷和盘丝洞的弟子在，真是不爽，还是跑路算了！ | T155: 药王谷和盘丝洞的弟子不在眼前，真是轻松愉快啊！ | U155: 0 | V155: 0,0; | W155: 2
A156: 611 | B156: 媚魔 | C156: pet_93 | D156: 0 | E156: 0 | F156: 5306,100; | G156: 0,0; | H156: 50*LV+250 | I156: (30*LV+30)*0.5 | J156: 0.9*LV+10 | K156: 5*LV+15 | L156: 0.8*LV+8 | M156: 1000*LV+100000 | N156: 0 | O156: math.max(0,(lv/10)-1) | P156: math.max(0,(lv/10)-1) | Q156: math.max(0,(lv/10)-1) | R156: 0; | S156: 有药王谷和盘丝洞的弟子在，真是不爽，还是跑路算了！ | T156: 药王谷和盘丝洞的弟子不在眼前，真是轻松愉快啊！ | U156: 0 | V156: 0,0; | W156: 4
A157: 612 | B157: 猴子 | C157: pet_73 | D157: 0 | E157: 0 | F157: 1111,100;1112,100;1113,100;1114,100; | G157: 5203,100;5209,100;5133,100; | H157: 50*LV+250 | I157: (30*LV+30)*0.5 | J157: 0.9*LV+10 | K157: (5*LV+15)*0.05 | L157: 0.8*LV+8 | M157: 1000*LV+100000 | N157: 0 | O157: math.max(0,(lv/10)-1) | P157: math.max(0,(lv/10)-1) | Q157: math.max(0,(lv/10)-1) | R157: 0; | S157: 有药王谷和盘丝洞的弟子在，真是不爽，还是跑路算了！ | T157: 药王谷和盘丝洞的弟子不在眼前，真是轻松愉快啊！ | U157: 0 | V157: 0,0; | W157: 1
A158: 1000 | B158: 天璇仙子 | C158: pet_83 | D158: 0 | E158: 0 | F158: 1411,100;1413,100;1412,100;1416,100; | G158: 0,0; | H158: 10*LV+120 | I158: 5*LV+60 | J158: 0.9*LV+10 | K158: 2*LV+8 | L158: LV+8 | M158: 1000*LV+100000 | N158: 0 | O158: math.max(0,(lv/10)-1) | P158: math.max(0,(lv/10)-1) | Q158: math.max(0,(lv/10)-1) | R158: 0; | S158: 有药王谷和盘丝洞的弟子在，真是不爽，还是跑路算了！ | T158: 药王谷和盘丝洞的弟子不在眼前，真是轻松愉快啊！ | U158: 0 | V158: 0,0; | W158: 2
A159: 1001 | B159: 天师道人 | C159: pet_22 | D159: 0 | E159: 0 | F159: 5302,50; | G159: 0,0; | H159: 10*LV+80 | I159: 4*LV+48 | J159: 0.9*LV+10 | K159: 1.5*LV+6 | L159: LV+8 | M159: 1000*LV+100000 | N159: 0 | O159: math.max(0,(lv/10)-1) | P159: math.max(0,(lv/10)-1) | Q159: math.max(0,(lv/10)-1) | R159: 0; | S159: 有药王谷和盘丝洞的弟子在，真是不爽，还是跑路算了！ | T159: 药王谷和盘丝洞的弟子不在眼前，真是轻松愉快啊！ | U159: 0 | V159: 0,0; | W159: 2
A160: 1010 | B160: 迦楼罗 | C160: pet_201 | D160: 0 | E160: 0 | F160: 5305,100; | G160: 0,0; | H160: 10*LV+120 | I160: 5*LV+60 | J160: 0.9*LV+10 | K160: 2*LV+8 | L160: LV+8 | M160: 1000*LV+100000 | N160: 0 | O160: math.max(0,(lv/10)-1) | P160: math.max(0,(lv/10)-1) | Q160: math.max(0,(lv/10)-1) | R160: 0; | S160: 有药王谷和盘丝洞的弟子在，真是不爽，还是跑路算了！ | T160: 药王谷和盘丝洞的弟子不在眼前，真是轻松愉快啊！ | U160: 0 | V160: 0,0; | W160: 0
A161: 1011 | B161: 天师道人 | C161: pet_22 | D161: 0 | E161: 0 | F161: 5302,50; | G161: 0,0; | H161: 10*LV+80 | I161: 4*LV+48 | J161: 0.9*LV+10 | K161: 1.5*LV+6 | L161: LV+8 | M161: 1000*LV+100000 | N161: 0 | O161: math.max(0,(lv/10)-1) | P161: math.max(0,(lv/10)-1) | Q161: math.max(0,(lv/10)-1) | R161: 0; | S161: 有药王谷和盘丝洞的弟子在，真是不爽，还是跑路算了！ | T161: 药王谷和盘丝洞的弟子不在眼前，真是轻松愉快啊！ | U161: 0 | V161: 0,0; | W161: 0
A162: 2100 | B162: 过路小妖 | C162: pet_62 | D162: 0 | E162: 0 | F162: 1411,100; | G162: 0,0; | H162: 60*LV+300 | I162: 7*LV+50 | J162: 1.5*LV+10 | K162: 6*LV+15 | L162: 1.4*LV+8 | M162: 1000*LV+100000 | N162: 0 | O162: math.max(0,(lv/10)-1) | P162: math.max(0,(lv/10)-1) | Q162: math.max(0,(lv/10)-1) | R162: 0; | S162: 有药王谷和盘丝洞的弟子在，真是不爽，还是跑路算了！ | T162: 药王谷和盘丝洞的弟子不在眼前，真是轻松愉快啊！ | U162: 0 | V162: 0,0; | W162: 2
A163: 2101 | B163: 水晶宫弟子 | C163: hero_1001 | D163: 0 | E163: 0 | F163: 1411,100; | G163: 0,0; | H163: 50*LV+200 | I163: 6*LV+30 | J163: 0.9*LV+10 | K163: 5*LV+12 | L163: 0.8*LV+8 | M163: 1000*LV+100000 | N163: 0 | O163: math.max(0,(lv/10)-1) | P163: math.max(0,(lv/10)-1) | Q163: math.max(0,(lv/10)-1) | R163: 0; | S163: 有药王谷和盘丝洞的弟子在，真是不爽，还是跑路算了！ | T163: 药王谷和盘丝洞的弟子不在眼前，真是轻松愉快啊！ | U163: 0 | V163: 0,0; | W163: 2
A164: 2102 | B164: 外门弟子 | C164: hero_1001 | D164: 0 | E164: 0 | F164: 0,0; | G164: 5102,100; | H164: 50*LV+200 | I164: 6*LV+30 | J164: 0.9*LV+10 | K164: (5*LV+12)*0.05 | L164: 0.8*LV+8 | M164: 1000*LV+100000 | N164: 0 | O164: math.max(0,(lv/10)-1) | P164: math.max(0,(lv/10)-1) | Q164: math.max(0,(lv/10)-1) | R164: 0; | S164: 有药王谷和盘丝洞的弟子在，真是不爽，还是跑路算了！ | T164: 药王谷和盘丝洞的弟子不在眼前，真是轻松愉快啊！ | U164: 0 | V164: 0,0; | W164: 4
A165: 2110 | B165: 天策府护卫 | C165: common_3018 | D165: 0 | E165: 0 | F165: 1411,100;1413,100;1412,100;1416,100; | G165: 0,0; | H165: 60.8*LV+302.5 | I165: 7.1*LV+50 | J165: 1.5*LV+10 | K165: 6.1*LV+15.2 | L165: 1.4*LV+8 | M165: 1000*LV+100000 | N165: 0 | O165: math.max(0,(lv/10)-1) | P165: math.max(0,(lv/10)-1) | Q165: math.max(0,(lv/10)-1) | R165: 0; | S165: 有药王谷和盘丝洞的弟子在，真是不爽，还是跑路算了！ | T165: 药王谷和盘丝洞的弟子不在眼前，真是轻松愉快啊！ | U165: 0 | V165: 0,0; | W165: 2
A166: 2111 | B166: 水晶宫弟子 | C166: hero_1001 | D166: 0 | E166: 0 | F166: 1411,100; | G166: 0,0; | H166: 50.6*LV+201.9 | I166: 6.1*LV+30 | J166: 0.9*LV+10 | K166: 5.1*LV+12.2 | L166: 0.8*LV+8 | M166: 1000*LV+100000 | N166: 0 | O166: math.max(0,(lv/10)-1) | P166: math.max(0,(lv/10)-1) | Q166: math.max(0,(lv/10)-1) | R166: 0; | S166: 有药王谷和盘丝洞的弟子在，真是不爽，还是跑路算了！ | T166: 药王谷和盘丝洞的弟子不在眼前，真是轻松愉快啊！ | U166: 0 | V166: 0,0; | W166: 2
A167: 2112 | B167: 外门弟子 | C167: hero_2001 | D167: 0 | E167: 0 | F167: 0,0; | G167: 5102,100; | H167: 50.6*LV+201.9 | I167: 6.1*LV+30 | J167: 0.9*LV+10 | K167: (5.1*LV+12.2)*0.05 | L167: 0.8*LV+8 | M167: 1000*LV+100000 | N167: 0 | O167: math.max(0,(lv/10)-1) | P167: math.max(0,(lv/10)-1) | Q167: math.max(0,(lv/10)-1) | R167: 0; | S167: 有药王谷和盘丝洞的弟子在，真是不爽，还是跑路算了！ | T167: 药王谷和盘丝洞的弟子不在眼前，真是轻松愉快啊！ | U167: 0 | V167: 0,0; | W167: 2
A168: 2120 | B168: 巡兵 | C168: partner_1016 | D168: 0 | E168: 0 | F168: 1511,100;1512,100;1513,400;1514,100; | G168: 0,0; | H168: 61.5*LV+305.1 | I168: 7.2*LV+50 | J168: 1.5*LV+10 | K168: (6.2*LV+15.4)*0.05 | L168: 1.4*LV+8 | M168: 1000*LV+100000 | N168: 0 | O168: math.max(0,(lv/10)-1) | P168: math.max(0,(lv/10)-1) | Q168: math.max(0,(lv/10)-1) | R168: 0; | S168: 有药王谷和盘丝洞的弟子在，真是不爽，还是跑路算了！ | T168: 药王谷和盘丝洞的弟子不在眼前，真是轻松愉快啊！ | U168: 0 | V168: 0,0; | W168: 5
A169: 2121 | B169: 天策府护卫 | C169: hero_1001 | D169: 0 | E169: 0 | F169: 1111,100; | G169: 0,0; | H169: 51.3*LV+203.8 | I169: 6.2*LV+30 | J169: 0.9*LV+10 | K169: (5.1*LV+12.3)*0.05 | L169: 0.8*LV+8 | M169: 1000*LV+100000 | N169: 0 | O169: math.max(0,(lv/10)-1) | P169: math.max(0,(lv/10)-1) | Q169: math.max(0,(lv/10)-1) | R169: 0; | S169: 有药王谷和盘丝洞的弟子在，真是不爽，还是跑路算了！ | T169: 药王谷和盘丝洞的弟子不在眼前，真是轻松愉快啊！ | U169: 0 | V169: 0,0; | W169: 1
A170: 2130 | B170: 庞府家丁 | C170: common_3007 | D170: 0 | E170: 0 | F170: 1211,100;1212,100;1213,100; | G170: 0,0; | H170: 62.3*LV+307.6 | I170: 7.3*LV+50 | J170: 1.5*LV+10 | K170: 6.2*LV+15.6 | L170: 1.4*LV+8 | M170: 1000*LV+100000 | N170: 0 | O170: math.max(0,(lv/10)-1) | P170: math.max(0,(lv/10)-1) | Q170: math.max(0,(lv/10)-1) | R170: 0; | S170: 有药王谷和盘丝洞的弟子在，真是不爽，还是跑路算了！ | T170: 药王谷和盘丝洞的弟子不在眼前，真是轻松愉快啊！ | U170: 0 | V170: 0,0; | W170: 3
A171: 2131 | B171: 药王谷弟子 | C171: hero_1001 | D171: 0 | E171: 0 | F171: 1212,100; | G171: 0,0; | H171: 51.9*LV+205.7 | I171: 6.2*LV+30 | J171: 0.9*LV+10 | K171: 5.2*LV+12.5 | L171: 0.8*LV+8 | M171: 1000*LV+100000 | N171: 0 | O171: math.max(0,(lv/10)-1) | P171: math.max(0,(lv/10)-1) | Q171: math.max(0,(lv/10)-1) | R171: 0; | S171: 有药王谷和盘丝洞的弟子在，真是不爽，还是跑路算了！ | T171: 药王谷和盘丝洞的弟子不在眼前，真是轻松愉快啊！ | U171: 0 | V171: 0,0; | W171: 3
A172: 2132 | B172: 武僧 | C172: hero_1001 | D172: 0 | E172: 0 | F172: 0,0; | G172: 5102,100; | H172: 51.9*LV+205.7 | I172: 6.2*LV+30 | J172: 0.9*LV+10 | K172: (5.2*LV+12.5)*0.05 | L172: 0.8*LV+8 | M172: 1000*LV+100000 | N172: 0 | O172: math.max(0,(lv/10)-1) | P172: math.max(0,(lv/10)-1) | Q172: math.max(0,(lv/10)-1) | R172: 0; | S172: 有药王谷和盘丝洞的弟子在，真是不爽，还是跑路算了！ | T172: 药王谷和盘丝洞的弟子不在眼前，真是轻松愉快啊！ | U172: 0 | V172: 0,0; | W172: 3
A173: 2140 | B173: 陆师兄 | C173: pet_22 | D173: 0 | E173: 0 | F173: 1411,100;1413,100;1412,100;1416,100; | G173: 0,0; | H173: 63*LV+310.1 | I173: 7.4*LV+50 | J173: 1.5*LV+10 | K173: 6.3*LV+15.8 | L173: 1.4*LV+8 | M173: 1000*LV+100000 | N173: 0 | O173: math.max(0,(lv/10)-1) | P173: math.max(0,(lv/10)-1) | Q173: math.max(0,(lv/10)-1) | R173: 0; | S173: 有药王谷和盘丝洞的弟子在，真是不爽，还是跑路算了！ | T173: 药王谷和盘丝洞的弟子不在眼前，真是轻松愉快啊！ | U173: 0 | V173: 0,0; | W173: 2
A174: 2141 | B174: 凶魂 | C174: pet_53 | D174: 0 | E174: 0 | F174: 5302,100; | G174: 0,0; | H174: 52.5*LV+207.6 | I174: 6.3*LV+30 | J174: 0.9*LV+10 | K174: 5.3*LV+12.6 | L174: 0.8*LV+8 | M174: 1000*LV+100000 | N174: 0 | O174: math.max(0,(lv/10)-1) | P174: math.max(0,(lv/10)-1) | Q174: math.max(0,(lv/10)-1) | R174: 0; | S174: 有药王谷和盘丝洞的弟子在，真是不爽，还是跑路算了！ | T174: 药王谷和盘丝洞的弟子不在眼前，真是轻松愉快啊！ | U174: 0 | V174: 0,0; | W174: 4
A175: 2142 | B175: 凶灵 | C175: pet_61 | D175: 0 | E175: 0 | F175: 5309,100; | G175: 0,0; | H175: 52.5*LV+207.6 | I175: 6.3*LV+30 | J175: 0.9*LV+10 | K175: (5.3*LV+12.6)*0.05 | L175: 0.8*LV+8 | M175: 1000*LV+100000 | N175: 0 | O175: math.max(0,(lv/10)-1) | P175: math.max(0,(lv/10)-1) | Q175: math.max(0,(lv/10)-1) | R175: 0; | S175: 有药王谷和盘丝洞的弟子在，真是不爽，还是跑路算了！ | T175: 药王谷和盘丝洞的弟子不在眼前，真是轻松愉快啊！ | U175: 0 | V175: 0,0; | W175: 4
A176: 2150 | B176: 陆师兄 | C176: pet_22 | D176: 0 | E176: 0 | F176: 5309,100; | G176: 0,0; | H176: 63.8*LV+312.7 | I176: 7.4*LV+50 | J176: 1.5*LV+10 | K176: (6.4*LV+15.9)*0.05 | L176: 1.4*LV+8 | M176: 1000*LV+100000 | N176: 0 | O176: math.max(0,(lv/10)-1) | P176: math.max(0,(lv/10)-1) | Q176: math.max(0,(lv/10)-1) | R176: 0; | S176: 有药王谷和盘丝洞的弟子在，真是不爽，还是跑路算了！ | T176: 药王谷和盘丝洞的弟子不在眼前，真是轻松愉快啊！ | U176: 0 | V176: 0,0; | W176: 0
A177: 2151 | B177: 熊猫武师 | C177: pet_13 | D177: 0 | E177: 0 | F177: 5309,100; | G177: 0,0; | H177: 53.2*LV+209.5 | I177: 6.4*LV+30 | J177: 0.9*LV+10 | K177: (5.3*LV+12.8)*0.05 | L177: 0.8*LV+8 | M177: 1000*LV+100000 | N177: 0 | O177: math.max(0,(lv/10)-1) | P177: math.max(0,(lv/10)-1) | Q177: math.max(0,(lv/10)-1) | R177: 0; | S177: 有药王谷和盘丝洞的弟子在，真是不爽，还是跑路算了！ | T177: 药王谷和盘丝洞的弟子不在眼前，真是轻松愉快啊！ | U177: 0 | V177: 0,0; | W177: 1
A178: 2152 | B178: 恶龙 | C178: pet_23 | D178: 0 | E178: 0 | F178: 0,0; | G178: 5102,100; | H178: 53.2*LV+209.5 | I178: 6.4*LV+30 | J178: 0.9*LV+10 | K178: (5.3*LV+12.8)*0.05 | L178: 0.8*LV+8 | M178: 1000*LV+100000 | N178: 0 | O178: math.max(0,(lv/10)-1) | P178: math.max(0,(lv/10)-1) | Q178: math.max(0,(lv/10)-1) | R178: 0; | S178: 有药王谷和盘丝洞的弟子在，真是不爽，还是跑路算了！ | T178: 药王谷和盘丝洞的弟子不在眼前，真是轻松愉快啊！ | U178: 0 | V178: 0,0; | W178: 4
A179: 2160 | B179: 店小二 | C179: common_3007 | D179: 0 | E179: 0 | F179: 1511,100;1513,100; | G179: 0,0; | H179: 64.6*LV+315.2 | I179: 7.5*LV+50 | J179: 1.5*LV+10 | K179: (6.5*LV+16.1)*0.05 | L179: 1.4*LV+8 | M179: 1000*LV+100000 | N179: 0 | O179: math.max(0,(lv/10)-1) | P179: math.max(0,(lv/10)-1) | Q179: math.max(0,(lv/10)-1) | R179: 0; | S179: 有药王谷和盘丝洞的弟子在，真是不爽，还是跑路算了！ | T179: 药王谷和盘丝洞的弟子不在眼前，真是轻松愉快啊！ | U179: 0 | V179: 0,0; | W179: 5
A180: 2161 | B180: 士兵 | C180: pet_71 | D180: 0 | E180: 0 | F180: 5309,100; | G180: 0,0; | H180: 53.8*LV+211.4 | I180: 6.5*LV+30 | J180: 0.9*LV+10 | K180: (5.4*LV+12.9)*0.05 | L180: 0.8*LV+8 | M180: 1000*LV+100000 | N180: 0 | O180: math.max(0,(lv/10)-1) | P180: math.max(0,(lv/10)-1) | Q180: math.max(0,(lv/10)-1) | R180: 0; | S180: 有药王谷和盘丝洞的弟子在，真是不爽，还是跑路算了！ | T180: 药王谷和盘丝洞的弟子不在眼前，真是轻松愉快啊！ | U180: 0 | V180: 0,0; | W180: 1
A181: 2162 | B181: 士兵 | C181: hero_1001 | D181: 0 | E181: 0 | F181: 0,0; | G181: 5116,100;5101,100; | H181: 53.8*LV+211.4 | I181: 6.5*LV+30 | J181: 0.9*LV+10 | K181: (5.4*LV+12.9)*0.05 | L181: 0.8*LV+8 | M181: 1000*LV+100000 | N181: 0 | O181: math.max(0,(lv/10)-1) | P181: math.max(0,(lv/10)-1) | Q181: math.max(0,(lv/10)-1) | R181: 0; | S181: 有药王谷和盘丝洞的弟子在，真是不爽，还是跑路算了！ | T181: 药王谷和盘丝洞的弟子不在眼前，真是轻松愉快啊！ | U181: 0 | V181: 0,0; | W181: 3
A182: 2170 | B182: 泾川水兵 | C182: common_3018 | D182: 0 | E182: 0 | F182: 1411,100;1413,100;1412,100;1416,100; | G182: 0,0; | H182: 65.3*LV+317.7 | I182: 7.6*LV+50 | J182: 1.5*LV+10 | K182: 6.5*LV+16.3 | L182: 1.4*LV+8 | M182: 1000*LV+100000 | N182: 0 | O182: math.max(0,(lv/10)-1) | P182: math.max(0,(lv/10)-1) | Q182: math.max(0,(lv/10)-1) | R182: 0; | S182: 有药王谷和盘丝洞的弟子在，真是不爽，还是跑路算了！ | T182: 药王谷和盘丝洞的弟子不在眼前，真是轻松愉快啊！ | U182: 0 | V182: 0,0; | W182: 2
A183: 2171 | B183: 水晶宫弟子 | C183: hero_1001 | D183: 0 | E183: 0 | F183: 1411,100; | G183: 0,0; | H183: 54.4*LV+213.3 | I183: 6.5*LV+30 | J183: 0.9*LV+10 | K183: 5.4*LV+13.1 | L183: 0.8*LV+8 | M183: 1000*LV+100000 | N183: 0 | O183: math.max(0,(lv/10)-1) | P183: math.max(0,(lv/10)-1) | Q183: math.max(0,(lv/10)-1) | R183: 0; | S183: 有药王谷和盘丝洞的弟子在，真是不爽，还是跑路算了！ | T183: 药王谷和盘丝洞的弟子不在眼前，真是轻松愉快啊！ | U183: 0 | V183: 0,0; | W183: 2
A184: 2172 | B184: 外门弟子 | C184: hero_2001 | D184: 0 | E184: 0 | F184: 0,0; | G184: 5102,100; | H184: 54.4*LV+213.3 | I184: 6.5*LV+30 | J184: 0.9*LV+10 | K184: (5.4*LV+13.1)*0.05 | L184: 0.8*LV+8 | M184: 1000*LV+100000 | N184: 0 | O184: math.max(0,(lv/10)-1) | P184: math.max(0,(lv/10)-1) | Q184: math.max(0,(lv/10)-1) | R184: 0; | S184: 有药王谷和盘丝洞的弟子在，真是不爽，还是跑路算了！ | T184: 药王谷和盘丝洞的弟子不在眼前，真是轻松愉快啊！ | U184: 0 | V184: 0,0; | W184: 0
A185: 2180 | B185: 镇海将军 | C185: common_3018 | D185: 0 | E185: 0 | F185: 1111,100;1112,100; | G185: 0,0; | H185: 66.1*LV+320.3 | I185: 7.7*LV+50 | J185: 1.5*LV+10 | K185: (6.6*LV+16.5)*0.05 | L185: 1.4*LV+8 | M185: 1000*LV+100000 | N185: 0 | O185: math.max(0,(lv/10)-1) | P185: math.max(0,(lv/10)-1) | Q185: math.max(0,(lv/10)-1) | R185: 0; | S185: 有药王谷和盘丝洞的弟子在，真是不爽，还是跑路算了！ | T185: 药王谷和盘丝洞的弟子不在眼前，真是轻松愉快啊！ | U185: 0 | V185: 0,0; | W185: 1
A186: 2181 | B186: 熊猫武师 | C186: pet_13 | D186: 0 | E186: 0 | F186: 5309,100; | G186: 0,0; | H186: 55.1*LV+215.2 | I186: 6.6*LV+30 | J186: 0.9*LV+10 | K186: (5.5*LV+13.2)*0.05 | L186: 0.8*LV+8 | M186: 1000*LV+100000 | N186: 0 | O186: math.max(0,(lv/10)-1) | P186: math.max(0,(lv/10)-1) | Q186: math.max(0,(lv/10)-1) | R186: 0; | S186: 有药王谷和盘丝洞的弟子在，真是不爽，还是跑路算了！ | T186: 药王谷和盘丝洞的弟子不在眼前，真是轻松愉快啊！ | U186: 0 | V186: 0,0; | W186: 1
A187: 2182 | B187: 恶龙 | C187: pet_23 | D187: 0 | E187: 0 | F187: 0,0; | G187: 5102,100; | H187: 55.1*LV+215.2 | I187: 6.6*LV+30 | J187: 0.9*LV+10 | K187: (5.5*LV+13.2)*0.05 | L187: 0.8*LV+8 | M187: 1000*LV+100000 | N187: 0 | O187: math.max(0,(lv/10)-1) | P187: math.max(0,(lv/10)-1) | Q187: math.max(0,(lv/10)-1) | R187: 0; | S187: 有药王谷和盘丝洞的弟子在，真是不爽，还是跑路算了！ | T187: 药王谷和盘丝洞的弟子不在眼前，真是轻松愉快啊！ | U187: 0 | V187: 0,0; | W187: 4
A188: 2190 | B188: 洞庭水兵 | C188: common_3018 | D188: 0 | E188: 0 | F188: 1111,100;1112,100; | G188: 0,0; | H188: 66.8*LV+322.8 | I188: 7.8*LV+50 | J188: 1.5*LV+10 | K188: (6.7*LV+16.7)*0.05 | L188: 1.4*LV+8 | M188: 1000*LV+100000 | N188: 0 | O188: math.max(0,(lv/10)-1) | P188: math.max(0,(lv/10)-1) | Q188: math.max(0,(lv/10)-1) | R188: 0; | S188: 有药王谷和盘丝洞的弟子在，真是不爽，还是跑路算了！ | T188: 药王谷和盘丝洞的弟子不在眼前，真是轻松愉快啊！ | U188: 0 | V188: 0,0; | W188: 1
A189: 2191 | B189: 天策弟子 | C189: hero_1001 | D189: 0 | E189: 0 | F189: 1111,100;1112,100; | G189: 0,0; | H189: 55.7*LV+217.1 | I189: 6.7*LV+30 | J189: 0.9*LV+10 | K189: (5.6*LV+13.4)*0.05 | L189: 0.8*LV+8 | M189: 1000*LV+100000 | N189: 0 | O189: math.max(0,(lv/10)-1) | P189: math.max(0,(lv/10)-1) | Q189: math.max(0,(lv/10)-1) | R189: 0; | S189: 有药王谷和盘丝洞的弟子在，真是不爽，还是跑路算了！ | T189: 药王谷和盘丝洞的弟子不在眼前，真是轻松愉快啊！ | U189: 0 | V189: 0,0; | W189: 1
A190: 2192 | B190: 道长 | C190: pet_22 | D190: 0 | E190: 0 | F190: 1212,100;1211,100; | G190: 0,0; | H190: 55.7*LV+217.1 | I190: 6.7*LV+30 | J190: 0.9*LV+10 | K190: 5.6*LV+13.4 | L190: 0.8*LV+8 | M190: 1000*LV+100000 | N190: 0 | O190: math.max(0,(lv/10)-1) | P190: math.max(0,(lv/10)-1) | Q190: math.max(0,(lv/10)-1) | R190: 0; | S190: 有药王谷和盘丝洞的弟子在，真是不爽，还是跑路算了！ | T190: 药王谷和盘丝洞的弟子不在眼前，真是轻松愉快啊！ | U190: 0 | V190: 0,0; | W190: 3
A191: 2200 | B191: 钱塘君 | C191: pet_23 | D191: 0 | E191: 0 | F191: 1111,100;1112,100; | G191: 0,0; | H191: 67.6*LV+325.3 | I191: 7.9*LV+50 | J191: 1.5*LV+10 | K191: (6.8*LV+16.9)*0.05 | L191: 1.4*LV+8 | M191: 1000*LV+100000 | N191: 0 | O191: math.max(0,(lv/10)-1) | P191: math.max(0,(lv/10)-1) | Q191: math.max(0,(lv/10)-1) | R191: 0; | S191: 有药王谷和盘丝洞的弟子在，真是不爽，还是跑路算了！ | T191: 药王谷和盘丝洞的弟子不在眼前，真是轻松愉快啊！ | U191: 0 | V191: 0,0; | W191: 1
A192: 2201 | B192: 天策弟子 | C192: hero_1001 | D192: 0 | E192: 0 | F192: 1111,100;1112,100; | G192: 0,0; | H192: 56.3*LV+219 | I192: 6.8*LV+30 | J192: 0.9*LV+10 | K192: (5.6*LV+13.5)*0.05 | L192: 0.8*LV+8 | M192: 1000*LV+100000 | N192: 0 | O192: math.max(0,(lv/10)-1) | P192: math.max(0,(lv/10)-1) | Q192: math.max(0,(lv/10)-1) | R192: 0; | S192: 有药王谷和盘丝洞的弟子在，真是不爽，还是跑路算了！ | T192: 药王谷和盘丝洞的弟子不在眼前，真是轻松愉快啊！ | U192: 0 | V192: 0,0; | W192: 1
A193: 2202 | B193: 盘丝弟子 | C193: hero_1001 | D193: 0 | E193: 0 | F193: 1511,100;1513,100; | G193: 0,0; | H193: 56.3*LV+219 | I193: 6.8*LV+30 | J193: 0.9*LV+10 | K193: 5.6*LV+13.5 | L193: 0.8*LV+8 | M193: 1000*LV+100000 | N193: 0 | O193: math.max(0,(lv/10)-1) | P193: math.max(0,(lv/10)-1) | Q193: math.max(0,(lv/10)-1) | R193: 0; | S193: 有药王谷和盘丝洞的弟子在，真是不爽，还是跑路算了！ | T193: 药王谷和盘丝洞的弟子不在眼前，真是轻松愉快啊！ | U193: 0 | V193: 0,0; | W193: 5
A194: 2210 | B194: 镇海将军 | C194: common_3018 | D194: 0 | E194: 0 | F194: 1411,100;1413,100;1412,100;1416,100; | G194: 0,0; | H194: 68.4*LV+327.8 | I194: 8*LV+50 | J194: 1.5*LV+10 | K194: 6.8*LV+17.1 | L194: 1.4*LV+8 | M194: 1000*LV+100000 | N194: 0 | O194: math.max(0,(lv/10)-1) | P194: math.max(0,(lv/10)-1) | Q194: math.max(0,(lv/10)-1) | R194: 0; | S194: 有药王谷和盘丝洞的弟子在，真是不爽，还是跑路算了！ | T194: 药王谷和盘丝洞的弟子不在眼前，真是轻松愉快啊！ | U194: 0 | V194: 0,0; | W194: 2
A195: 2211 | B195: 凶魂 | C195: pet_53 | D195: 0 | E195: 0 | F195: 0,0; | G195: 0,0; | H195: 57*LV+220.9 | I195: 6.8*LV+30 | J195: 0.9*LV+10 | K195: (5.7*LV+13.7)*0.05 | L195: 0.8*LV+8 | M195: 1000*LV+100000 | N195: 0 | O195: math.max(0,(lv/10)-1) | P195: math.max(0,(lv/10)-1) | Q195: math.max(0,(lv/10)-1) | R195: 0; | S195: 有药王谷和盘丝洞的弟子在，真是不爽，还是跑路算了！ | T195: 药王谷和盘丝洞的弟子不在眼前，真是轻松愉快啊！ | U195: 0 | V195: 0,0; | W195: 1
A196: 2212 | B196: 凶灵 | C196: pet_61 | D196: 0 | E196: 0 | F196: 5309,100; | G196: 0,0; | H196: 57*LV+220.9 | I196: 6.8*LV+30 | J196: 0.9*LV+10 | K196: (5.7*LV+13.7)*0.05 | L196: 0.8*LV+8 | M196: 1000*LV+100000 | N196: 0 | O196: math.max(0,(lv/10)-1) | P196: math.max(0,(lv/10)-1) | Q196: math.max(0,(lv/10)-1) | R196: 0; | S196: 有药王谷和盘丝洞的弟子在，真是不爽，还是跑路算了！ | T196: 药王谷和盘丝洞的弟子不在眼前，真是轻松愉快啊！ | U196: 0 | V196: 0,0; | W196: 1
A197: 2220 | B197: 泾川龙子 | C197: pet_23 | D197: 0 | E197: 0 | F197: 1111,100;1112,100; | G197: 0,0; | H197: 69.1*LV+330.4 | I197: 8.1*LV+50 | J197: 1.5*LV+10 | K197: (6.9*LV+17.3)*0.05 | L197: 1.4*LV+8 | M197: 1000*LV+100000 | N197: 0 | O197: math.max(0,(lv/10)-1) | P197: math.max(0,(lv/10)-1) | Q197: math.max(0,(lv/10)-1) | R197: 0; | S197: 有药王谷和盘丝洞的弟子在，真是不爽，还是跑路算了！ | T197: 药王谷和盘丝洞的弟子不在眼前，真是轻松愉快啊！ | U197: 0 | V197: 0,0; | W197: 1
A198: 2221 | B198: 云经之灵 | C198: pet_21 | D198: 0 | E198: 0 | F198: 0,0; | G198: 0,0; | H198: 57.6*LV+222.8 | I198: 6.9*LV+30 | J198: 0.9*LV+10 | K198: (5.8*LV+13.8)*0.05 | L198: 0.8*LV+8 | M198: 1000*LV+100000 | N198: 0 | O198: math.max(0,(lv/10)-1) | P198: math.max(0,(lv/10)-1) | Q198: math.max(0,(lv/10)-1) | R198: 0; | S198: 有药王谷和盘丝洞的弟子在，真是不爽，还是跑路算了！ | T198: 药王谷和盘丝洞的弟子不在眼前，真是轻松愉快啊！ | U198: 0 | V198: 0,0; | W198: 2
A199: 2222 | B199: 帮手 | C199: pet_23 | D199: 0 | E199: 0 | F199: 1311,100;1315,100;1311,100; | G199: 0,0; | H199: 57.6*LV+222.8 | I199: 6.9*LV+30 | J199: 0.9*LV+10 | K199: (5.8*LV+13.8)*0.05 | L199: 0.8*LV+8 | M199: 1000*LV+100000 | N199: 0 | O199: math.max(0,(lv/10)-1) | P199: math.max(0,(lv/10)-1) | Q199: math.max(0,(lv/10)-1) | R199: 0; | S199: 有药王谷和盘丝洞的弟子在，真是不爽，还是跑路算了！ | T199: 药王谷和盘丝洞的弟子不在眼前，真是轻松愉快啊！ | U199: 0 | V199: 0,0; | W199: 4
A200: 2230 | B200: 首席弟子 | C200: pet_43 | D200: 0 | E200: 0 | F200: 1211,100;1212,100;1213,100; | G200: 0,0; | H200: 69.9*LV+332.9 | I200: 8.2*LV+50 | J200: 1.5*LV+10 | K200: 7*LV+17.5 | L200: 1.4*LV+8 | M200: 1000*LV+100000 | N200: 0 | O200: math.max(0,(lv/10)-1) | P200: math.max(0,(lv/10)-1) | Q200: math.max(0,(lv/10)-1) | R200: 0; | S200: 有药王谷和盘丝洞的弟子在，真是不爽，还是跑路算了！ | T200: 药王谷和盘丝洞的弟子不在眼前，真是轻松愉快啊！ | U200: 0 | V200: 0,0; | W200: 3
A201: 2231 | B201: 铁衣堂弟子 | C201: hero_1001 | D201: 0 | E201: 0 | F201: 1211,100;1212,100; | G201: 0,0; | H201: 58.2*LV+224.7 | I201: 7*LV+30 | J201: 0.9*LV+10 | K201: 5.8*LV+14 | L201: 0.8*LV+8 | M201: 1000*LV+100000 | N201: 0 | O201: math.max(0,(lv/10)-1) | P201: math.max(0,(lv/10)-1) | Q201: math.max(0,(lv/10)-1) | R201: 0; | S201: 有药王谷和盘丝洞的弟子在，真是不爽，还是跑路算了！ | T201: 药王谷和盘丝洞的弟子不在眼前，真是轻松愉快啊！ | U201: 0 | V201: 0,0; | W201: 3
A202: 2232 | B202: 合欢弟子 | C202: partner_1002 | D202: 0 | E202: 0 | F202: 1311,100;1315,100; | G202: 0,0; | H202: 58.2*LV+224.7 | I202: 7*LV+30 | J202: 0.9*LV+10 | K202: (5.8*LV+14)*0.05 | L202: 0.8*LV+8 | M202: 1000*LV+100000 | N202: 0 | O202: math.max(0,(lv/10)-1) | P202: math.max(0,(lv/10)-1) | Q202: math.max(0,(lv/10)-1) | R202: 0; | S202: 有药王谷和盘丝洞的弟子在，真是不爽，还是跑路算了！ | T202: 药王谷和盘丝洞的弟子不在眼前，真是轻松愉快啊！ | U202: 0 | V202: 0,0; | W202: 4
A203: 2240 | B203: 山中小妖 | C203: pet_62 | D203: 0 | E203: 0 | F203: 1411,100;1413,100;1412,100;1416,100; | G203: 0,0; | H203: 70.6*LV+335.4 | I203: 8.2*LV+50 | J203: 1.5*LV+10 | K203: 7.1*LV+17.7 | L203: 1.4*LV+8 | M203: 1000*LV+100000 | N203: 0 | O203: math.max(0,(lv/10)-1) | P203: math.max(0,(lv/10)-1) | Q203: math.max(0,(lv/10)-1) | R203: 0; | S203: 有药王谷和盘丝洞的弟子在，真是不爽，还是跑路算了！ | T203: 药王谷和盘丝洞的弟子不在眼前，真是轻松愉快啊！ | U203: 0 | V203: 0,0; | W203: 2
A204: 2241 | B204: 妖狐 | C204: partner_1009 | D204: 0 | E204: 0 | F204: 1511,100;1513,100; | G204: 0,0; | H204: 58.9*LV+226.6 | I204: 7.1*LV+30 | J204: 0.9*LV+10 | K204: 5.9*LV+14.1 | L204: 0.8*LV+8 | M204: 1000*LV+100000 | N204: 0 | O204: math.max(0,(lv/10)-1) | P204: math.max(0,(lv/10)-1) | Q204: math.max(0,(lv/10)-1) | R204: 0; | S204: 有药王谷和盘丝洞的弟子在，真是不爽，还是跑路算了！ | T204: 药王谷和盘丝洞的弟子不在眼前，真是轻松愉快啊！ | U204: 0 | V204: 0,0; | W204: 5
A205: 2242 | B205: 剑灵 | C205: pet_21 | D205: 0 | E205: 0 | F205: 0,0; | G205: 5224,100;5202,100;5203,100; | H205: 58.9*LV+226.6 | I205: 7.1*LV+30 | J205: 0.9*LV+10 | K205: (5.9*LV+14.1)*0.05 | L205: 0.8*LV+8 | M205: 1000*LV+100000 | N205: 0 | O205: math.max(0,(lv/10)-1) | P205: math.max(0,(lv/10)-1) | Q205: math.max(0,(lv/10)-1) | R205: 0; | S205: 有药王谷和盘丝洞的弟子在，真是不爽，还是跑路算了！ | T205: 药王谷和盘丝洞的弟子不在眼前，真是轻松愉快啊！ | U205: 0 | V205: 0,0; | W205: 4
A206: 2250 | B206: 长安官差 | C206: partner_1016 | D206: 0 | E206: 0 | F206: 1411,100;1413,100;1412,100;1416,100; | G206: 0,0; | H206: 71.4*LV+338 | I206: 8.3*LV+50 | J206: 1.5*LV+10 | K206: 7.1*LV+17.8 | L206: 1.4*LV+8 | M206: 1000*LV+100000 | N206: 0 | O206: math.max(0,(lv/10)-1) | P206: math.max(0,(lv/10)-1) | Q206: math.max(0,(lv/10)-1) | R206: 0; | S206: 有药王谷和盘丝洞的弟子在，真是不爽，还是跑路算了！ | T206: 药王谷和盘丝洞的弟子不在眼前，真是轻松愉快啊！ | U206: 0 | V206: 0,0; | W206: 2
A207: 2251 | B207: 妖狐 | C207: partner_1009 | D207: 0 | E207: 0 | F207: 1511,100;1513,100; | G207: 0,0; | H207: 59.5*LV+228.5 | I207: 7.1*LV+30 | J207: 0.9*LV+10 | K207: 5.9*LV+14.3 | L207: 0.8*LV+8 | M207: 1000*LV+100000 | N207: 0 | O207: math.max(0,(lv/10)-1) | P207: math.max(0,(lv/10)-1) | Q207: math.max(0,(lv/10)-1) | R207: 0; | S207: 有药王谷和盘丝洞的弟子在，真是不爽，还是跑路算了！ | T207: 药王谷和盘丝洞的弟子不在眼前，真是轻松愉快啊！ | U207: 0 | V207: 0,0; | W207: 5
A208: 2252 | B208: 魔教弟子 | C208: hero_1001 | D208: 0 | E208: 0 | F208: 1112,100;1111,100; | G208: 0,0; | H208: 58.9*LV+226.6 | I208: 7.1*LV+30 | J208: 0.9*LV+10 | K208: (5.9*LV+14.1)*0.05 | L208: 0.8*LV+8 | M208: 1000*LV+100000 | N208: 0 | O208: math.max(0,(lv/10)-1) | P208: math.max(0,(lv/10)-1) | Q208: math.max(0,(lv/10)-1) | R208: 0; | S208: 有药王谷和盘丝洞的弟子在，真是不爽，还是跑路算了！ | T208: 药王谷和盘丝洞的弟子不在眼前，真是轻松愉快啊！ | U208: 0 | V208: 0,0; | W208: 1
A209: 2260 | B209: 包大仁 | C209: common_3006 | D209: 0 | E209: 0 | F209: 5306,100; | G209: 0,0; | H209: 72.2*LV+340.5 | I209: 8.4*LV+50 | J209: 1.5*LV+10 | K209: 7.2*LV+18 | L209: 1.4*LV+8 | M209: 1000*LV+100000 | N209: 0 | O209: math.max(0,(lv/10)-1) | P209: math.max(0,(lv/10)-1) | Q209: math.max(0,(lv/10)-1) | R209: 0; | S209: 有药王谷和盘丝洞的弟子在，真是不爽，还是跑路算了！ | T209: 药王谷和盘丝洞的弟子不在眼前，真是轻松愉快啊！ | U209: 0 | V209: 0,0; | W209: 2
A210: 2261 | B210: 紫雨林弟子 | C210: pet_83 | D210: 0 | E210: 0 | F210: 5302,100; | G210: 0,0; | H210: 60.1*LV+230.4 | I210: 7.2*LV+30 | J210: 0.9*LV+10 | K210: 6*LV+14.4 | L210: 0.8*LV+8 | M210: 1000*LV+100000 | N210: 0 | O210: math.max(0,(lv/10)-1) | P210: math.max(0,(lv/10)-1) | Q210: math.max(0,(lv/10)-1) | R210: 0; | S210: 有药王谷和盘丝洞的弟子在，真是不爽，还是跑路算了！ | T210: 药王谷和盘丝洞的弟子不在眼前，真是轻松愉快啊！ | U210: 0 | V210: 0,0; | W210: 0
A211: 2262 | B211: 合欢弟子 | C211: partner_1002 | D211: 0 | E211: 0 | F211: 1312,100;1315,100; | G211: 0,0; | H211: 60.1*LV+230.4 | I211: 7.2*LV+30 | J211: 0.9*LV+10 | K211: (6*LV+14.4)*0.05 | L211: 0.8*LV+8 | M211: 1000*LV+100000 | N211: 0 | O211: math.max(0,(lv/10)-1) | P211: math.max(0,(lv/10)-1) | Q211: math.max(0,(lv/10)-1) | R211: 0; | S211: 有药王谷和盘丝洞的弟子在，真是不爽，还是跑路算了！ | T211: 药王谷和盘丝洞的弟子不在眼前，真是轻松愉快啊！ | U211: 0 | V211: 0,0; | W211: 4
A212: 2270 | B212: 边塞小妖 | C212: pet_62 | D212: 0 | E212: 0 | F212: 5306,100; | G212: 0,0; | H212: 72.9*LV+343 | I212: 8.5*LV+50 | J212: 1.5*LV+10 | K212: 7.3*LV+18.2 | L212: 1.4*LV+8 | M212: 1000*LV+100000 | N212: 0 | O212: math.max(0,(lv/10)-1) | P212: math.max(0,(lv/10)-1) | Q212: math.max(0,(lv/10)-1) | R212: 0; | S212: 有药王谷和盘丝洞的弟子在，真是不爽，还是跑路算了！ | T212: 药王谷和盘丝洞的弟子不在眼前，真是轻松愉快啊！ | U212: 0 | V212: 0,0; | W212: 2
A213: 2271 | B213: 紫雨林弟子 | C213: pet_83 | D213: 0 | E213: 0 | F213: 5302,100; | G213: 0,0; | H213: 60.8*LV+232.3 | I213: 7.3*LV+30 | J213: 0.9*LV+10 | K213: 6.1*LV+14.6 | L213: 0.8*LV+8 | M213: 1000*LV+100000 | N213: 0 | O213: math.max(0,(lv/10)-1) | P213: math.max(0,(lv/10)-1) | Q213: math.max(0,(lv/10)-1) | R213: 0; | S213: 有药王谷和盘丝洞的弟子在，真是不爽，还是跑路算了！ | T213: 药王谷和盘丝洞的弟子不在眼前，真是轻松愉快啊！ | U213: 0 | V213: 0,0; | W213: 2
A214: 2272 | B214: 帮手 | C214: pet_23 | D214: 0 | E214: 0 | F214: 1111,100;1112,100; | G214: 0,0; | H214: 60.8*LV+232.3 | I214: 7.3*LV+30 | J214: 0.9*LV+10 | K214: (6.1*LV+14.6)*0.05 | L214: 0.8*LV+8 | M214: 1000*LV+100000 | N214: 0 | O214: math.max(0,(lv/10)-1) | P214: math.max(0,(lv/10)-1) | Q214: math.max(0,(lv/10)-1) | R214: 0; | S214: 有药王谷和盘丝洞的弟子在，真是不爽，还是跑路算了！ | T214: 药王谷和盘丝洞的弟子不在眼前，真是轻松愉快啊！ | U214: 0 | V214: 0,0; | W214: 1
A215: 2273 | B215: 天音弟子 | C215: hero_1001 | D215: 0 | E215: 0 | F215: 1212,100;1211,100; | G215: 0,0; | H215: 60.8*LV+232.3 | I215: 7.3*LV+30 | J215: 0.9*LV+10 | K215: 6.1*LV+14.6 | L215: 0.8*LV+8 | M215: 1000*LV+100000 | N215: 0 | O215: math.max(0,(lv/10)-1) | P215: math.max(0,(lv/10)-1) | Q215: math.max(0,(lv/10)-1) | R215: 0; | S215: 有药王谷和盘丝洞的弟子在，真是不爽，还是跑路算了！ | T215: 药王谷和盘丝洞的弟子不在眼前，真是轻松愉快啊！ | U215: 0 | V215: 0,0; | W215: 3
A216: 2280 | B216: 道童 | C216: pet_33 | D216: 0 | E216: 0 | F216: 1311,100;1315,100; | G216: 0,0; | H216: 73.7*LV+345.6 | I216: 8.6*LV+50 | J216: 1.5*LV+10 | K216: (7.4*LV+18.4)*0.05 | L216: 1.4*LV+8 | M216: 1000*LV+100000 | N216: 0 | O216: math.max(0,(lv/10)-1) | P216: math.max(0,(lv/10)-1) | Q216: math.max(0,(lv/10)-1) | R216: 0; | S216: 有药王谷和盘丝洞的弟子在，真是不爽，还是跑路算了！ | T216: 药王谷和盘丝洞的弟子不在眼前，真是轻松愉快啊！ | U216: 0 | V216: 0,0; | W216: 4
A217: 2281 | B217: 迦楼罗 | C217: pet_201 | D217: 0 | E217: 0 | F217: 1111,100;1112,100;1113,100;1114,100; | G217: 0,0; | H217: 61.4*LV+234.2 | I217: 7.4*LV+30 | J217: 0.9*LV+10 | K217: (6.1*LV+14.7)*0.05 | L217: 0.8*LV+8 | M217: 1000*LV+100000 | N217: 0 | O217: math.max(0,(lv/10)-1) | P217: math.max(0,(lv/10)-1) | Q217: math.max(0,(lv/10)-1) | R217: 0; | S217: 有药王谷和盘丝洞的弟子在，真是不爽，还是跑路算了！ | T217: 药王谷和盘丝洞的弟子不在眼前，真是轻松愉快啊！ | U217: 0 | V217: 0,0; | W217: 1
A218: 2282 | B218: 幼兽 | C218: pet_63 | D218: 0 | E218: 0 | F218: 1411,100;1412,100; | G218: 5121,100; | H218: 61.4*LV+234.2 | I218: 7.4*LV+30 | J218: 0.9*LV+10 | K218: 6.1*LV+14.7 | L218: 0.8*LV+8 | M218: 1000*LV+100000 | N218: 0 | O218: math.max(0,(lv/10)-1) | P218: math.max(0,(lv/10)-1) | Q218: math.max(0,(lv/10)-1) | R218: 0; | S218: 有药王谷和盘丝洞的弟子在，真是不爽，还是跑路算了！ | T218: 药王谷和盘丝洞的弟子不在眼前，真是轻松愉快啊！ | U218: 0 | V218: 0,0; | W218: 2
A219: 2290 | B219: 万鬼教众 | C219: pet_62 | D219: 0 | E219: 0 | F219: 1111,100;1112,100; | G219: 0,0; | H219: 74.4*LV+348.1 | I219: 8.7*LV+50 | J219: 1.5*LV+10 | K219: 7.4*LV+18.6 | L219: 1.4*LV+8 | M219: 1000*LV+100000 | N219: 0 | O219: math.max(0,(lv/10)-1) | P219: math.max(0,(lv/10)-1) | Q219: math.max(0,(lv/10)-1) | R219: 0; | S219: 有药王谷和盘丝洞的弟子在，真是不爽，还是跑路算了！ | T219: 药王谷和盘丝洞的弟子不在眼前，真是轻松愉快啊！ | U219: 0 | V219: 0,0; | W219: 1
A220: 2291 | B220: 剑客 | C220: hero_1001 | D220: 0 | E220: 0 | F220: 5309,100; | G220: 0,0; | H220: 62*LV+236.1 | I220: 7.4*LV+30 | J220: 0.9*LV+10 | K220: (6.2*LV+14.9)*0.05 | L220: 0.8*LV+8 | M220: 1000*LV+100000 | N220: 0 | O220: math.max(0,(lv/10)-1) | P220: math.max(0,(lv/10)-1) | Q220: math.max(0,(lv/10)-1) | R220: 0; | S220: 有药王谷和盘丝洞的弟子在，真是不爽，还是跑路算了！ | T220: 药王谷和盘丝洞的弟子不在眼前，真是轻松愉快啊！ | U220: 0 | V220: 0,0; | W220: 1
A221: 2292 | B221: 女魃 | C221: pet_53 | D221: 0 | E221: 0 | F221: 0,0; | G221: 5123,100;5225,100;5104,100;5202,100; | H221: 62*LV+236.1 | I221: 7.4*LV+30 | J221: 0.9*LV+10 | K221: (6.2*LV+14.9)*0.05 | L221: 0.8*LV+8 | M221: 1000*LV+100000 | N221: 0 | O221: math.max(0,(lv/10)-1) | P221: math.max(0,(lv/10)-1) | Q221: math.max(0,(lv/10)-1) | R221: 0; | S221: 有药王谷和盘丝洞的弟子在，真是不爽，还是跑路算了！ | T221: 药王谷和盘丝洞的弟子不在眼前，真是轻松愉快啊！ | U221: 0 | V221: 0,0; | W221: 2
A222: 2300 | B222: 美男八戒 | C222: partner_1001 | D222: 0 | E222: 0 | F222: 1311,100;1315,100; | G222: 0,0; | H222: 75.2*LV+350.6 | I222: 8.8*LV+50 | J222: 1.5*LV+10 | K222: (7.5*LV+18.8)*0.05 | L222: 1.4*LV+8 | M222: 1000*LV+100000 | N222: 0 | O222: math.max(0,(lv/10)-1) | P222: math.max(0,(lv/10)-1) | Q222: math.max(0,(lv/10)-1) | R222: 0; | S222: 有药王谷和盘丝洞的弟子在，真是不爽，还是跑路算了！ | T222: 药王谷和盘丝洞的弟子不在眼前，真是轻松愉快啊！ | U222: 0 | V222: 0,0; | W222: 4
A223: =R[-50]C+100 -> 2240 | B223: 恶狗 | C223: pet_1 | D223: 0 | E223: 0 | F223: 1411,100;1413,100;1412,100;1416,100; | G223: 0,0; | H223: 70.6*LV+335.4 | I223: 8.2*LV+50 | J223: 1.5*LV+10 | K223: 7.1*LV+17.7 | L223: 1.4*LV+8 | M223: 1000*LV+100000 | N223: 0 | O223: math.max(0,(lv/10)-1) | P223: math.max(0,(lv/10)-1) | Q223: math.max(0,(lv/10)-1) | R223: 0; | S223: 有药王谷和盘丝洞的弟子在，真是不爽，还是跑路算了！ | T223: 药王谷和盘丝洞的弟子不在眼前，真是轻松愉快啊！ | U223: 0 | V223: 0,0; | W223: 2
A224: 2301 | B224: 迦楼罗 | C224: pet_201 | D224: 0 | E224: 0 | F224: 1111,100;1112,100;1113,100;1114,100; | G224: 0,0; | H224: 62.7*LV+238 | I224: 7.5*LV+30 | J224: 0.9*LV+10 | K224: (6.3*LV+15)*0.05 | L224: 0.8*LV+8 | M224: 1000*LV+100000 | N224: 0 | O224: math.max(0,(lv/10)-1) | P224: math.max(0,(lv/10)-1) | Q224: math.max(0,(lv/10)-1) | R224: 0; | S224: 有药王谷和盘丝洞的弟子在，真是不爽，还是跑路算了！ | T224: 药王谷和盘丝洞的弟子不在眼前，真是轻松愉快啊！ | U224: 0 | V224: 0,0; | W224: 1
A225: 2302 | B225: 剑灵 | C225: pet_21 | D225: 0 | E225: 0 | F225: 0,0; | G225: 5224,100;5202,100;5203,100; | H225: 62.7*LV+238 | I225: 7.5*LV+30 | J225: 0.9*LV+10 | K225: (6.3*LV+15)*0.05 | L225: 0.8*LV+8 | M225: 1000*LV+100000 | N225: 0 | O225: math.max(0,(lv/10)-1) | P225: math.max(0,(lv/10)-1) | Q225: math.max(0,(lv/10)-1) | R225: 0; | S225: 有药王谷和盘丝洞的弟子在，真是不爽，还是跑路算了！ | T225: 药王谷和盘丝洞的弟子不在眼前，真是轻松愉快啊！ | U225: 0 | V225: 0,0; | W225: 2
A226: =R[-50]C+100 -> 2250 | B226: 兔精 | C226: pet_11 | D226: 0 | E226: 0 | F226: 1411,100;1413,100;1412,100;1416,100; | G226: 0,0; | H226: 71.4*LV+338 | I226: 8.3*LV+50 | J226: 1.5*LV+10 | K226: 7.1*LV+17.8 | L226: 1.4*LV+8 | M226: 1000*LV+100000 | N226: 0 | O226: math.max(0,(lv/10)-1) | P226: math.max(0,(lv/10)-1) | Q226: math.max(0,(lv/10)-1) | R226: 0; | S226: 有药王谷和盘丝洞的弟子在，真是不爽，还是跑路算了！ | T226: 药王谷和盘丝洞的弟子不在眼前，真是轻松愉快啊！ | U226: 0 | V226: 0,0; | W226: 2
A227: 2310 | B227: 妖人 | C227: pet_62 | D227: 0 | E227: 0 | F227: 1312,100;1315,100;1311,100; | G227: 0,0; | H227: 75.9*LV+353.2 | I227: 8.9*LV+50 | J227: 1.5*LV+10 | K227: (7.6*LV+19)*0.05 | L227: 1.4*LV+8 | M227: 1000*LV+100000 | N227: 0 | O227: math.max(0,(lv/10)-1) | P227: math.max(0,(lv/10)-1) | Q227: math.max(0,(lv/10)-1) | R227: 0; | S227: 有药王谷和盘丝洞的弟子在，真是不爽，还是跑路算了！ | T227: 药王谷和盘丝洞的弟子不在眼前，真是轻松愉快啊！ | U227: 0 | V227: 0,0; | W227: 4
A228: 2311 | B228: 兽王寨弟子 | C228: hero_2001 | D228: 0 | E228: 0 | F228: 1311,100;1315,100; | G228: 0,0; | H228: 63.3*LV+239.9 | I228: 7.6*LV+30 | J228: 0.9*LV+10 | K228: (6.3*LV+15.2)*0.05 | L228: 0.8*LV+8 | M228: 1000*LV+100000 | N228: 0 | O228: math.max(0,(lv/10)-1) | P228: math.max(0,(lv/10)-1) | Q228: math.max(0,(lv/10)-1) | R228: 0; | S228: 有药王谷和盘丝洞的弟子在，真是不爽，还是跑路算了！ | T228: 药王谷和盘丝洞的弟子不在眼前，真是轻松愉快啊！ | U228: 0 | V228: 0,0; | W228: 4
A229: =R[-50]C+100 -> 2260 | B229: 仙鹤童子 | C229: pet_33 | D229: 0 | E229: 0 | F229: 5306,100; | G229: 0,0; | H229: 72.2*LV+340.5 | I229: 8.4*LV+50 | J229: 1.5*LV+10 | K229: 7.2*LV+18 | L229: 1.4*LV+8 | M229: 1000*LV+100000 | N229: 0 | O229: math.max(0,(lv/10)-1) | P229: math.max(0,(lv/10)-1) | Q229: math.max(0,(lv/10)-1) | R229: 0; | S229: 有药王谷和盘丝洞的弟子在，真是不爽，还是跑路算了！ | T229: 药王谷和盘丝洞的弟子不在眼前，真是轻松愉快啊！ | U229: 0 | V229: 0,0; | W229: 2
A230: 2312 | B230: 盘丝弟子 | C230: hero_1001 | D230: 0 | E230: 0 | F230: 1511,100;1513,100; | G230: 0,0; | H230: 63.3*LV+239.9 | I230: 7.6*LV+30 | J230: 0.9*LV+10 | K230: 6.3*LV+15.2 | L230: 0.8*LV+8 | M230: 1000*LV+100000 | N230: 0 | O230: math.max(0,(lv/10)-1) | P230: math.max(0,(lv/10)-1) | Q230: math.max(0,(lv/10)-1) | R230: 0; | S230: 有药王谷和盘丝洞的弟子在，真是不爽，还是跑路算了！ | T230: 药王谷和盘丝洞的弟子不在眼前，真是轻松愉快啊！ | U230: 0 | V230: 0,0; | W230: 5
A231: 2320 | B231: 妖人 | C231: pet_62 | D231: 0 | E231: 0 | F231: 5307,100; | G231: 0,0; | H231: 76.7*LV+355.7 | I231: 8.9*LV+50 | J231: 1.5*LV+10 | K231: 7.7*LV+19.2 | L231: 1.4*LV+8 | M231: 1000*LV+100000 | N231: 0 | O231: math.max(0,(lv/10)-1) | P231: math.max(0,(lv/10)-1) | Q231: math.max(0,(lv/10)-1) | R231: 0; | S231: 有药王谷和盘丝洞的弟子在，真是不爽，还是跑路算了！ | T231: 药王谷和盘丝洞的弟子不在眼前，真是轻松愉快啊！ | U231: 0 | V231: 0,0; | W231: 1
A232: =R[-50]C+100 -> 2270 | B232: 罗刹女 | C232: pet_61 | D232: 0 | E232: 0 | F232: 5306,100; | G232: 0,0; | H232: 72.9*LV+343 | I232: 8.5*LV+50 | J232: 1.5*LV+10 | K232: 7.3*LV+18.2 | L232: 1.4*LV+8 | M232: 1000*LV+100000 | N232: 0 | O232: math.max(0,(lv/10)-1) | P232: math.max(0,(lv/10)-1) | Q232: math.max(0,(lv/10)-1) | R232: 0; | S232: 有药王谷和盘丝洞的弟子在，真是不爽，还是跑路算了！ | T232: 药王谷和盘丝洞的弟子不在眼前，真是轻松愉快啊！ | U232: 0 | V232: 0,0; | W232: 1
A233: 2321 | B233: 兔精 | C233: pet_11 | D233: 0 | E233: 0 | F233: 5303,50; | G233: 0,0; | H233: 63.9*LV+241.8 | I233: 7.7*LV+30 | J233: 0.9*LV+10 | K233: 6.4*LV+15.3 | L233: 0.8*LV+8 | M233: 1000*LV+100000 | N233: 0 | O233: math.max(0,(lv/10)-1) | P233: math.max(0,(lv/10)-1) | Q233: math.max(0,(lv/10)-1) | R233: 0; | S233: 有药王谷和盘丝洞的弟子在，真是不爽，还是跑路算了！ | T233: 药王谷和盘丝洞的弟子不在眼前，真是轻松愉快啊！ | U233: 0 | V233: 0,0; | W233: 3
A234: 2322 | B234: 兔精 | C234: pet_11 | D234: 0 | E234: 0 | F234: 0,0; | G234: 5123,100;5225,100;5104,100;5202,100; | H234: 63.9*LV+241.8 | I234: 7.7*LV+30 | J234: 0.9*LV+10 | K234: (6.4*LV+15.3)*0.05 | L234: 0.8*LV+8 | M234: 1000*LV+100000 | N234: 0 | O234: math.max(0,(lv/10)-1) | P234: math.max(0,(lv/10)-1) | Q234: math.max(0,(lv/10)-1) | R234: 0; | S234: 有药王谷和盘丝洞的弟子在，真是不爽，还是跑路算了！ | T234: 药王谷和盘丝洞的弟子不在眼前，真是轻松愉快啊！ | U234: 0 | V234: 0,0; | W234: 3
A235: =R[-50]C+100 -> 2280 | B235: 织梦花妖 | C235: pet_42 | D235: 0 | E235: 0 | F235: 1311,100;1315,100; | G235: 0,0; | H235: 73.7*LV+345.6 | I235: 8.6*LV+50 | J235: 1.5*LV+10 | K235: (7.4*LV+18.4)*0.05 | L235: 1.4*LV+8 | M235: 1000*LV+100000 | N235: 0 | O235: math.max(0,(lv/10)-1) | P235: math.max(0,(lv/10)-1) | Q235: math.max(0,(lv/10)-1) | R235: 0; | S235: 有药王谷和盘丝洞的弟子在，真是不爽，还是跑路算了！ | T235: 药王谷和盘丝洞的弟子不在眼前，真是轻松愉快啊！ | U235: 0 | V235: 0,0; | W235: 4
A236: 2330 | B236: 高府家丁 | C236: common_3007 | D236: 0 | E236: 0 | F236: 5307,100; | G236: 0,0; | H236: 77.5*LV+358.2 | I236: 9*LV+50 | J236: 1.5*LV+10 | K236: 7.7*LV+19.4 | L236: 1.4*LV+8 | M236: 1000*LV+100000 | N236: 0 | O236: math.max(0,(lv/10)-1) | P236: math.max(0,(lv/10)-1) | Q236: math.max(0,(lv/10)-1) | R236: 0; | S236: 有药王谷和盘丝洞的弟子在，真是不爽，还是跑路算了！ | T236: 药王谷和盘丝洞的弟子不在眼前，真是轻松愉快啊！ | U236: 0 | V236: 0,0; | W236: 2
A237: 2331 | B237: 兔精 | C237: pet_11 | D237: 0 | E237: 0 | F237: 5303,50; | G237: 0,0; | H237: 64.6*LV+243.7 | I237: 7.7*LV+30 | J237: 0.9*LV+10 | K237: 6.5*LV+15.5 | L237: 0.8*LV+8 | M237: 1000*LV+100000 | N237: 0 | O237: math.max(0,(lv/10)-1) | P237: math.max(0,(lv/10)-1) | Q237: math.max(0,(lv/10)-1) | R237: 0; | S237: 有药王谷和盘丝洞的弟子在，真是不爽，还是跑路算了！ | T237: 药王谷和盘丝洞的弟子不在眼前，真是轻松愉快啊！ | U237: 0 | V237: 0,0; | W237: 0
A238: =R[-50]C+100 -> 2290 | B238: 凶灵 | C238: pet_61 | D238: 0 | E238: 0 | F238: 1111,100;1112,100; | G238: 0,0; | H238: 74.4*LV+348.1 | I238: 8.7*LV+50 | J238: 1.5*LV+10 | K238: 7.4*LV+18.6 | L238: 1.4*LV+8 | M238: 1000*LV+100000 | N238: 0 | O238: math.max(0,(lv/10)-1) | P238: math.max(0,(lv/10)-1) | Q238: math.max(0,(lv/10)-1) | R238: 0; | S238: 有药王谷和盘丝洞的弟子在，真是不爽，还是跑路算了！ | T238: 药王谷和盘丝洞的弟子不在眼前，真是轻松愉快啊！ | U238: 0 | V238: 0,0; | W238: 1
A239: 2332 | B239: 兔精 | C239: pet_11 | D239: 0 | E239: 0 | F239: 0,0; | G239: 5226,100;5101,100;5222,100;5116,100; | H239: 63.9*LV+241.8 | I239: 7.7*LV+30 | J239: 0.9*LV+10 | K239: (6.4*LV+15.3)*0.05 | L239: 0.8*LV+8 | M239: 1000*LV+100000 | N239: 0 | O239: math.max(0,(lv/10)-1) | P239: math.max(0,(lv/10)-1) | Q239: math.max(0,(lv/10)-1) | R239: 0; | S239: 有药王谷和盘丝洞的弟子在，真是不爽，还是跑路算了！ | T239: 药王谷和盘丝洞的弟子不在眼前，真是轻松愉快啊！ | U239: 0 | V239: 0,0; | W239: 0
A240: =R[-50]C+100 -> 2292 | B240: 火瑞兽 | C240: pet_63 | D240: 0 | E240: 0 | F240: 0,0; | G240: 0,0; | H240: 62*LV+236.1 | I240: 7.4*LV+30 | J240: 0.9*LV+10 | K240: (6.2*LV+14.9)*0.05 | L240: 0.8*LV+8 | M240: 1000*LV+100000 | N240: 0 | O240: math.max(0,(lv/10)-1) | P240: math.max(0,(lv/10)-1) | Q240: math.max(0,(lv/10)-1) | R240: 0; | S240: 有药王谷和盘丝洞的弟子在，真是不爽，还是跑路算了！ | T240: 药王谷和盘丝洞的弟子不在眼前，真是轻松愉快啊！ | U240: 0 | V240: 0,0; | W240: 0
A241: 2340 | B241: 国境盗匪 | C241: common_3032 | D241: 0 | E241: 0 | F241: 5306,100; | G241: 0,0; | H241: 78.2*LV+360.8 | I241: 9.1*LV+50 | J241: 1.5*LV+10 | K241: 7.8*LV+19.6 | L241: 1.4*LV+8 | M241: 1000*LV+100000 | N241: 0 | O241: math.max(0,(lv/10)-1) | P241: math.max(0,(lv/10)-1) | Q241: math.max(0,(lv/10)-1) | R241: 0; | S241: 有药王谷和盘丝洞的弟子在，真是不爽，还是跑路算了！ | T241: 药王谷和盘丝洞的弟子不在眼前，真是轻松愉快啊！ | U241: 0 | V241: 0,0; | W241: 0
A242: 2341 | B242: 紫雨林弟子 | C242: pet_83 | D242: 0 | E242: 0 | F242: 5302,100; | G242: 0,0; | H242: 65.2*LV+245.6 | I242: 7.8*LV+30 | J242: 0.9*LV+10 | K242: 6.5*LV+15.6 | L242: 0.8*LV+8 | M242: 1000*LV+100000 | N242: 0 | O242: math.max(0,(lv/10)-1) | P242: math.max(0,(lv/10)-1) | Q242: math.max(0,(lv/10)-1) | R242: 0; | S242: 有药王谷和盘丝洞的弟子在，真是不爽，还是跑路算了！ | T242: 药王谷和盘丝洞的弟子不在眼前，真是轻松愉快啊！ | U242: 0 | V242: 0,0; | W242: 5
A243: =R[-50]C+100 -> 2302 | B243: 阴阳师 | C243: pet_52 | D243: 0 | E243: 0 | F243: 0,0; | G243: 0,0; | H243: 62.7*LV+238 | I243: 7.5*LV+30 | J243: 0.9*LV+10 | K243: (6.3*LV+15)*0.05 | L243: 0.8*LV+8 | M243: 1000*LV+100000 | N243: 0 | O243: math.max(0,(lv/10)-1) | P243: math.max(0,(lv/10)-1) | Q243: math.max(0,(lv/10)-1) | R243: 0; | S243: 有药王谷和盘丝洞的弟子在，真是不爽，还是跑路算了！ | T243: 药王谷和盘丝洞的弟子不在眼前，真是轻松愉快啊！ | U243: 0 | V243: 0,0; | W243: 0
A244: 2342 | B244: 帮手 | C244: pet_23 | D244: 0 | E244: 0 | F244: 1111,100;1112,100; | G244: 0,0; | H244: 65.2*LV+245.6 | I244: 7.8*LV+30 | J244: 0.9*LV+10 | K244: (6.5*LV+15.6)*0.05 | L244: 0.8*LV+8 | M244: 1000*LV+100000 | N244: 0 | O244: math.max(0,(lv/10)-1) | P244: math.max(0,(lv/10)-1) | Q244: math.max(0,(lv/10)-1) | R244: 0; | S244: 有药王谷和盘丝洞的弟子在，真是不爽，还是跑路算了！ | T244: 药王谷和盘丝洞的弟子不在眼前，真是轻松愉快啊！ | U244: 0 | V244: 0,0; | W244: 1
A245: 2350 | B245: 夜叉 | C245: pet_53 | D245: 0 | E245: 0 | F245: 1311,100;1315,100; | G245: 0,0; | H245: 79*LV+363.3 | I245: 9.2*LV+50 | J245: 1.5*LV+10 | K245: (7.9*LV+19.7)*0.05 | L245: 1.4*LV+8 | M245: 1000*LV+100000 | N245: 0 | O245: math.max(0,(lv/10)-1) | P245: math.max(0,(lv/10)-1) | Q245: math.max(0,(lv/10)-1) | R245: 0; | S245: 有药王谷和盘丝洞的弟子在，真是不爽，还是跑路算了！ | T245: 药王谷和盘丝洞的弟子不在眼前，真是轻松愉快啊！ | U245: 0 | V245: 0,0; | W245: 4
A246: =R[-50]C+100 -> 2312 | B246: 孤魂女弟子 | C246: pet_53 | D246: 0 | E246: 0 | F246: 1511,100;1513,100; | G246: 0,0; | H246: 63.3*LV+239.9 | I246: 7.6*LV+30 | J246: 0.9*LV+10 | K246: 6.3*LV+15.2 | L246: 0.8*LV+8 | M246: 1000*LV+100000 | N246: 0 | O246: math.max(0,(lv/10)-1) | P246: math.max(0,(lv/10)-1) | Q246: math.max(0,(lv/10)-1) | R246: 0; | S246: 有药王谷和盘丝洞的弟子在，真是不爽，还是跑路算了！ | T246: 药王谷和盘丝洞的弟子不在眼前，真是轻松愉快啊！ | U246: 0 | V246: 0,0; | W246: 5
A247: 2351 | B247: 迦楼罗 | C247: pet_201 | D247: 0 | E247: 0 | F247: 1111,100;1112,100;1113,100;1114,100; | G247: 0,0; | H247: 65.8*LV+247.5 | I247: 7.9*LV+30 | J247: 0.9*LV+10 | K247: (6.6*LV+15.8)*0.05 | L247: 0.8*LV+8 | M247: 1000*LV+100000 | N247: 0 | O247: math.max(0,(lv/10)-1) | P247: math.max(0,(lv/10)-1) | Q247: math.max(0,(lv/10)-1) | R247: 0; | S247: 有药王谷和盘丝洞的弟子在，真是不爽，还是跑路算了！ | T247: 药王谷和盘丝洞的弟子不在眼前，真是轻松愉快啊！ | U247: 0 | V247: 0,0; | W247: 1
A248: 2352 | B248: 幼兽 | C248: pet_63 | D248: 0 | E248: 0 | F248: 1411,100;1412,100; | G248: 5121,100; | H248: 65.8*LV+247.5 | I248: 7.9*LV+30 | J248: 0.9*LV+10 | K248: 6.6*LV+15.8 | L248: 0.8*LV+8 | M248: 1000*LV+100000 | N248: 0 | O248: math.max(0,(lv/10)-1) | P248: math.max(0,(lv/10)-1) | Q248: math.max(0,(lv/10)-1) | R248: 0; | S248: 有药王谷和盘丝洞的弟子在，真是不爽，还是跑路算了！ | T248: 药王谷和盘丝洞的弟子不在眼前，真是轻松愉快啊！ | U248: 0 | V248: 0,0; | W248: 2
A249: =R[-50]C+100 -> 2322 | B249: 恶龙 | C249: pet_23 | D249: 0 | E249: 0 | F249: 0,0; | G249: 0,0; | H249: 63.9*LV+241.8 | I249: 7.7*LV+30 | J249: 0.9*LV+10 | K249: (6.4*LV+15.3)*0.05 | L249: 0.8*LV+8 | M249: 1000*LV+100000 | N249: 0 | O249: math.max(0,(lv/10)-1) | P249: math.max(0,(lv/10)-1) | Q249: math.max(0,(lv/10)-1) | R249: 0; | S249: 有药王谷和盘丝洞的弟子在，真是不爽，还是跑路算了！ | T249: 药王谷和盘丝洞的弟子不在眼前，真是轻松愉快啊！ | U249: 0 | V249: 0,0; | W249: 0
A250: 2360 | B250: 炒饭大魔王 | C250: partner_1004 | D250: 0 | E250: 0 | F250: 1111,100;1112,100;1113,100;1114,100; | G250: 0,0; | H250: 79.7*LV+365.8 | I250: 9.3*LV+50 | J250: 1.5*LV+10 | K250: (8*LV+19.9)*0.05 | L250: 1.4*LV+8 | M250: 1000*LV+100000 | N250: 0 | O250: math.max(0,(lv/10)-1) | P250: math.max(0,(lv/10)-1) | Q250: math.max(0,(lv/10)-1) | R250: 0; | S250: 有药王谷和盘丝洞的弟子在，真是不爽，还是跑路算了！ | T250: 药王谷和盘丝洞的弟子不在眼前，真是轻松愉快啊！ | U250: 0 | V250: 0,0; | W250: 1
A251: 2361 | B251: 蛊毒派弟子 | C251: hero_1001 | D251: 0 | E251: 0 | F251: 1111,100;1112,100;1113,100;1114,100; | G251: 0,0; | H251: 66.5*LV+249.4 | I251: 8*LV+30 | J251: 0.9*LV+10 | K251: (6.6*LV+15.9)*0.05 | L251: 0.8*LV+8 | M251: 1000*LV+100000 | N251: 0 | O251: math.max(0,(lv/10)-1) | P251: math.max(0,(lv/10)-1) | Q251: math.max(0,(lv/10)-1) | R251: 0; | S251: 有药王谷和盘丝洞的弟子在，真是不爽，还是跑路算了！ | T251: 药王谷和盘丝洞的弟子不在眼前，真是轻松愉快啊！ | U251: 0 | V251: 0,0; | W251: 1
A252: =R[-50]C+100 -> 2332 | B252: 熊猫武师 | C252: pet_13 | D252: 0 | E252: 0 | F252: 0,0; | G252: 0,0; | H252: 63.9*LV+241.8 | I252: 7.7*LV+30 | J252: 0.9*LV+10 | K252: (6.4*LV+15.3)*0.05 | L252: 0.8*LV+8 | M252: 1000*LV+100000 | N252: 0 | O252: math.max(0,(lv/10)-1) | P252: math.max(0,(lv/10)-1) | Q252: math.max(0,(lv/10)-1) | R252: 0; | S252: 有药王谷和盘丝洞的弟子在，真是不爽，还是跑路算了！ | T252: 药王谷和盘丝洞的弟子不在眼前，真是轻松愉快啊！ | U252: 0 | V252: 0,0; | W252: 1
A253: 2362 | B253: 剑灵 | C253: pet_21 | D253: 0 | E253: 0 | F253: 0,0; | G253: 5224,100;5202,100;5203,100; | H253: 66.5*LV+249.4 | I253: 8*LV+30 | J253: 0.9*LV+10 | K253: (6.6*LV+15.9)*0.05 | L253: 0.8*LV+8 | M253: 1000*LV+100000 | N253: 0 | O253: math.max(0,(lv/10)-1) | P253: math.max(0,(lv/10)-1) | Q253: math.max(0,(lv/10)-1) | R253: 0; | S253: 有药王谷和盘丝洞的弟子在，真是不爽，还是跑路算了！ | T253: 药王谷和盘丝洞的弟子不在眼前，真是轻松愉快啊！ | U253: 0 | V253: 0,0; | W253: 3
A254: 2370 | B254: 钱塘君 | C254: pet_23 | D254: 0 | E254: 0 | F254: 1311,100;1315,100; | G254: 0,0; | H254: 80.5*LV+368.4 | I254: 9.4*LV+50 | J254: 1.5*LV+10 | K254: (8.1*LV+20.1)*0.05 | L254: 1.4*LV+8 | M254: 1000*LV+100000 | N254: 0 | O254: math.max(0,(lv/10)-1) | P254: math.max(0,(lv/10)-1) | Q254: math.max(0,(lv/10)-1) | R254: 0; | S254: 有药王谷和盘丝洞的弟子在，真是不爽，还是跑路算了！ | T254: 药王谷和盘丝洞的弟子不在眼前，真是轻松愉快啊！ | U254: 0 | V254: 0,0; | W254: 4
A255: =R[-50]C+100 -> 2342 | B255: 夔兽 | C255: pet_63 | D255: 0 | E255: 0 | F255: 1111,100;1112,100; | G255: 0,0; | H255: 65.2*LV+245.6 | I255: 7.8*LV+30 | J255: 0.9*LV+10 | K255: (6.5*LV+15.6)*0.05 | L255: 0.8*LV+8 | M255: 1000*LV+100000 | N255: 0 | O255: math.max(0,(lv/10)-1) | P255: math.max(0,(lv/10)-1) | Q255: math.max(0,(lv/10)-1) | R255: 0; | S255: 有药王谷和盘丝洞的弟子在，真是不爽，还是跑路算了！ | T255: 药王谷和盘丝洞的弟子不在眼前，真是轻松愉快啊！ | U255: 0 | V255: 0,0; | W255: 1
A256: 2371 | B256: 迦楼罗 | C256: pet_201 | D256: 0 | E256: 0 | F256: 1111,100;1112,100;1113,100;1114,100; | G256: 0,0; | H256: 67.1*LV+251.3 | I256: 8.1*LV+30 | J256: 0.9*LV+10 | K256: (6.7*LV+16.1)*0.05 | L256: 0.8*LV+8 | M256: 1000*LV+100000 | N256: 0 | O256: math.max(0,(lv/10)-1) | P256: math.max(0,(lv/10)-1) | Q256: math.max(0,(lv/10)-1) | R256: 0; | S256: 有药王谷和盘丝洞的弟子在，真是不爽，还是跑路算了！ | T256: 药王谷和盘丝洞的弟子不在眼前，真是轻松愉快啊！ | U256: 0 | V256: 0,0; | W256: 1
A257: 2372 | B257: 幼兽 | C257: pet_63 | D257: 0 | E257: 0 | F257: 1411,100;1412,100; | G257: 5121,100; | H257: 67.1*LV+251.3 | I257: 8.1*LV+30 | J257: 0.9*LV+10 | K257: 6.7*LV+16.1 | L257: 0.8*LV+8 | M257: 1000*LV+100000 | N257: 0 | O257: math.max(0,(lv/10)-1) | P257: math.max(0,(lv/10)-1) | Q257: math.max(0,(lv/10)-1) | R257: 0; | S257: 有药王谷和盘丝洞的弟子在，真是不爽，还是跑路算了！ | T257: 药王谷和盘丝洞的弟子不在眼前，真是轻松愉快啊！ | U257: 0 | V257: 0,0; | W257: 2
A258: =R[-50]C+100 -> 2352 | B258: 剑侠 | C258: pet_71 | D258: 0 | E258: 0 | F258: 1411,100;1412,100; | G258: 0,0; | H258: 65.8*LV+247.5 | I258: 7.9*LV+30 | J258: 0.9*LV+10 | K258: 6.6*LV+15.8 | L258: 0.8*LV+8 | M258: 1000*LV+100000 | N258: 0 | O258: math.max(0,(lv/10)-1) | P258: math.max(0,(lv/10)-1) | Q258: math.max(0,(lv/10)-1) | R258: 0; | S258: 有药王谷和盘丝洞的弟子在，真是不爽，还是跑路算了！ | T258: 药王谷和盘丝洞的弟子不在眼前，真是轻松愉快啊！ | U258: 0 | V258: 0,0; | W258: 2
A259: 2380 | B259: 鬼妖 | C259: common_3018 | D259: 0 | E259: 0 | F259: 1311,100;1315,100; | G259: 0,0; | H259: 81.3*LV+370.9 | I259: 9.5*LV+50 | J259: 1.5*LV+10 | K259: (8.1*LV+20.3)*0.05 | L259: 1.4*LV+8 | M259: 1000*LV+100000 | N259: 0 | O259: math.max(0,(lv/10)-1) | P259: math.max(0,(lv/10)-1) | Q259: math.max(0,(lv/10)-1) | R259: 0; | S259: 有药王谷和盘丝洞的弟子在，真是不爽，还是跑路算了！ | T259: 药王谷和盘丝洞的弟子不在眼前，真是轻松愉快啊！ | U259: 0 | V259: 0,0; | W259: 4
A260: =R[-50]C+100 -> 2361 | B260: 李易初 | C260: pet_71 | D260: 0 | E260: 0 | F260: 1111,100;1112,100;1113,100;1114,100; | G260: 0,0; | H260: 66.5*LV+249.4 | I260: 8*LV+30 | J260: 0.9*LV+10 | K260: (6.6*LV+15.9)*0.05 | L260: 0.8*LV+8 | M260: 1000*LV+100000 | N260: 0 | O260: math.max(0,(lv/10)-1) | P260: math.max(0,(lv/10)-1) | Q260: math.max(0,(lv/10)-1) | R260: 0; | S260: 有药王谷和盘丝洞的弟子在，真是不爽，还是跑路算了！ | T260: 药王谷和盘丝洞的弟子不在眼前，真是轻松愉快啊！ | U260: 0 | V260: 0,0; | W260: 1
A261: 2381 | B261: 迦楼罗 | C261: pet_201 | D261: 0 | E261: 0 | F261: 1411,100;1412,100; | G261: 0,0; | H261: 67.7*LV+253.2 | I261: 8.1*LV+30 | J261: 0.9*LV+10 | K261: 6.8*LV+16.3 | L261: 0.8*LV+8 | M261: 1000*LV+100000 | N261: 0 | O261: math.max(0,(lv/10)-1) | P261: math.max(0,(lv/10)-1) | Q261: math.max(0,(lv/10)-1) | R261: 0; | S261: 有药王谷和盘丝洞的弟子在，真是不爽，还是跑路算了！ | T261: 药王谷和盘丝洞的弟子不在眼前，真是轻松愉快啊！ | U261: 0 | V261: 0,0; | W261: 2
A262: 2382 | B262: 剑灵 | C262: pet_21 | D262: 0 | E262: 0 | F262: 0,0; | G262: 5224,100;5202,100;5203,100; | H262: 67.7*LV+253.2 | I262: 8.1*LV+30 | J262: 0.9*LV+10 | K262: (6.8*LV+16.3)*0.05 | L262: 0.8*LV+8 | M262: 1000*LV+100000 | N262: 0 | O262: math.max(0,(lv/10)-1) | P262: math.max(0,(lv/10)-1) | Q262: math.max(0,(lv/10)-1) | R262: 0; | S262: 有药王谷和盘丝洞的弟子在，真是不爽，还是跑路算了！ | T262: 药王谷和盘丝洞的弟子不在眼前，真是轻松愉快啊！ | U262: 0 | V262: 0,0; | W262: 4
A263: =R[-50]C+100 -> 2371 | B263: 宋无闻 | C263: pet_71 | D263: 0 | E263: 0 | F263: 1111,100;1112,100;1113,100;1114,100; | G263: 0,0; | H263: 67.1*LV+251.3 | I263: 8.1*LV+30 | J263: 0.9*LV+10 | K263: (6.7*LV+16.1)*0.05 | L263: 0.8*LV+8 | M263: 1000*LV+100000 | N263: 0 | O263: math.max(0,(lv/10)-1) | P263: math.max(0,(lv/10)-1) | Q263: math.max(0,(lv/10)-1) | R263: 0; | S263: 有药王谷和盘丝洞的弟子在，真是不爽，还是跑路算了！ | T263: 药王谷和盘丝洞的弟子不在眼前，真是轻松愉快啊！ | U263: 0 | V263: 0,0; | W263: 1
A264: 2390 | B264: 鬼妖 | C264: pet_93 | D264: 0 | E264: 0 | F264: 1411,100;1413,100;1412,100;1416,100; | G264: 0,0; | H264: 82*LV+373.4 | I264: 9.6*LV+50 | J264: 1.5*LV+10 | K264: 8.2*LV+20.5 | L264: 1.4*LV+8 | M264: 1000*LV+100000 | N264: 0 | O264: math.max(0,(lv/10)-1) | P264: math.max(0,(lv/10)-1) | Q264: math.max(0,(lv/10)-1) | R264: 0; | S264: 有药王谷和盘丝洞的弟子在，真是不爽，还是跑路算了！ | T264: 药王谷和盘丝洞的弟子不在眼前，真是轻松愉快啊！ | U264: 0 | V264: 0,0; | W264: 2
A265: 2391 | B265: 煞气 | C265: pet_53 | D265: 0 | E265: 0 | F265: 5306,100; | G265: 0,0; | H265: 68.4*LV+255.1 | I265: 8.2*LV+30 | J265: 0.9*LV+10 | K265: 6.8*LV+16.4 | L265: 0.8*LV+8 | M265: 1000*LV+100000 | N265: 0 | O265: math.max(0,(lv/10)-1) | P265: math.max(0,(lv/10)-1) | Q265: math.max(0,(lv/10)-1) | R265: 0; | S265: 有药王谷和盘丝洞的弟子在，真是不爽，还是跑路算了！ | T265: 药王谷和盘丝洞的弟子不在眼前，真是轻松愉快啊！ | U265: 0 | V265: 0,0; | W265: 4
A266: =R[-50]C+100 -> 2380 | B266: 铁扇公主 | C266: partner_1003 | D266: 0 | E266: 0 | F266: 1511,100;1512,100;1513,400;1514,100; | G266: 0,0; | H266: 81.3*LV+370.9 | I266: 9.5*LV+50 | J266: 1.5*LV+10 | K266: (8.1*LV+20.3)*0.05 | L266: 1.4*LV+8 | M266: 1000*LV+100000 | N266: 0 | O266: math.max(0,(lv/10)-1) | P266: math.max(0,(lv/10)-1) | Q266: math.max(0,(lv/10)-1) | R266: 0; | S266: 有药王谷和盘丝洞的弟子在，真是不爽，还是跑路算了！ | T266: 药王谷和盘丝洞的弟子不在眼前，真是轻松愉快啊！ | U266: 0 | V266: 0,0; | W266: 5
A267: 2392 | B267: 猴子 | C267: pet_73 | D267: 0 | E267: 0 | F267: 1111,100;1112,100;1113,100;1114,100; | G267: 5203,100;5209,100;5133,100; | H267: 68.4*LV+255.1 | I267: 8.2*LV+30 | J267: 0.9*LV+10 | K267: (6.8*LV+16.4)*0.05 | L267: 0.8*LV+8 | M267: 1000*LV+100000 | N267: 0 | O267: math.max(0,(lv/10)-1) | P267: math.max(0,(lv/10)-1) | Q267: math.max(0,(lv/10)-1) | R267: 0; | S267: 有药王谷和盘丝洞的弟子在，真是不爽，还是跑路算了！ | T267: 药王谷和盘丝洞的弟子不在眼前，真是轻松愉快啊！ | U267: 0 | V267: 0,0; | W267: 1
A268: 2400 | B268: 天兵 | C268: common_3018 | D268: 0 | E268: 0 | F268: 1411,100;1413,100;1412,100;1416,100; | G268: 0,0; | H268: 82.8*LV+375.9 | I268: 9.7*LV+50 | J268: 1.5*LV+10 | K268: 8.3*LV+20.7 | L268: 1.4*LV+8 | M268: 1000*LV+100000 | N268: 0 | O268: math.max(0,(lv/10)-1) | P268: math.max(0,(lv/10)-1) | Q268: math.max(0,(lv/10)-1) | R268: 0; | S268: 有药王谷和盘丝洞的弟子在，真是不爽，还是跑路算了！ | T268: 药王谷和盘丝洞的弟子不在眼前，真是轻松愉快啊！ | U268: 0 | V268: 0,0; | W268: 2
A269: =R[-50]C+100 -> 2390 | B269: 冯远志 | C269: pet_71 | D269: 0 | E269: 0 | F269: 1411,100;1413,100;1412,100;1416,100; | G269: 0,0; | H269: 82*LV+373.4 | I269: 9.6*LV+50 | J269: 1.5*LV+10 | K269: 8.2*LV+20.5 | L269: 1.4*LV+8 | M269: 1000*LV+100000 | N269: 0 | O269: math.max(0,(lv/10)-1) | P269: math.max(0,(lv/10)-1) | Q269: math.max(0,(lv/10)-1) | R269: 0; | S269: 有药王谷和盘丝洞的弟子在，真是不爽，还是跑路算了！ | T269: 药王谷和盘丝洞的弟子不在眼前，真是轻松愉快啊！ | U269: 0 | V269: 0,0; | W269: 2
A270: =R[-50]C+100 -> 2391 | B270: 铁扇公主 | C270: partner_1003 | D270: 0 | E270: 0 | F270: 5306,100; | G270: 0,0; | H270: 68.4*LV+255.1 | I270: 8.2*LV+30 | J270: 0.9*LV+10 | K270: 6.8*LV+16.4 | L270: 0.8*LV+8 | M270: 1000*LV+100000 | N270: 0 | O270: math.max(0,(lv/10)-1) | P270: math.max(0,(lv/10)-1) | Q270: math.max(0,(lv/10)-1) | R270: 0; | S270: 有药王谷和盘丝洞的弟子在，真是不爽，还是跑路算了！ | T270: 药王谷和盘丝洞的弟子不在眼前，真是轻松愉快啊！ | U270: 0 | V270: 0,0; | W270: 5
A271: 2401 | B271: 煞气 | C271: pet_53 | D271: 0 | E271: 0 | F271: 1311,100;1315,100; | G271: 0,0; | H271: 69*LV+257 | I271: 8.3*LV+30 | J271: 0.9*LV+10 | K271: (6.9*LV+16.6)*0.05 | L271: 0.8*LV+8 | M271: 1000*LV+100000 | N271: 0 | O271: math.max(0,(lv/10)-1) | P271: math.max(0,(lv/10)-1) | Q271: math.max(0,(lv/10)-1) | R271: 0; | S271: 有药王谷和盘丝洞的弟子在，真是不爽，还是跑路算了！ | T271: 药王谷和盘丝洞的弟子不在眼前，真是轻松愉快啊！ | U271: 0 | V271: 0,0; | W271: 4
A272: 2402 | B272: 幼兽 | C272: pet_63 | D272: 0 | E272: 0 | F272: 1511,100;1513,100; | G272: 0,0; | H272: 69*LV+257 | I272: 8.3*LV+30 | J272: 0.9*LV+10 | K272: 6.9*LV+16.6 | L272: 0.8*LV+8 | M272: 1000*LV+100000 | N272: 0 | O272: math.max(0,(lv/10)-1) | P272: math.max(0,(lv/10)-1) | Q272: math.max(0,(lv/10)-1) | R272: 0; | S272: 有药王谷和盘丝洞的弟子在，真是不爽，还是跑路算了！ | T272: 药王谷和盘丝洞的弟子不在眼前，真是轻松愉快啊！ | U272: 0 | V272: 0,0; | W272: 5
A273: =R[-50]C+100 -> 2340 | B273: 恶狗 | C273: pet_1 | D273: 0 | E273: 0 | F273: 5306,100; | G273: 0,0; | H273: 78.2*LV+360.8 | I273: 9.1*LV+50 | J273: 1.5*LV+10 | K273: 7.8*LV+19.6 | L273: 1.4*LV+8 | M273: 1000*LV+100000 | N273: 0 | O273: math.max(0,(lv/10)-1) | P273: math.max(0,(lv/10)-1) | Q273: math.max(0,(lv/10)-1) | R273: 0; | S273: 有药王谷和盘丝洞的弟子在，真是不爽，还是跑路算了！ | T273: 药王谷和盘丝洞的弟子不在眼前，真是轻松愉快啊！ | U273: 0 | V273: 0,0; | W273: 0
A274: =R[-50]C+100 -> 2401 | B274: 李琅 | C274: pet_43 | D274: 0 | E274: 0 | F274: 1311,100;1315,100; | G274: 0,0; | H274: 69*LV+257 | I274: 8.3*LV+30 | J274: 0.9*LV+10 | K274: (6.9*LV+16.6)*0.05 | L274: 0.8*LV+8 | M274: 1000*LV+100000 | N274: 0 | O274: math.max(0,(lv/10)-1) | P274: math.max(0,(lv/10)-1) | Q274: math.max(0,(lv/10)-1) | R274: 0; | S274: 有药王谷和盘丝洞的弟子在，真是不爽，还是跑路算了！ | T274: 药王谷和盘丝洞的弟子不在眼前，真是轻松愉快啊！ | U274: 0 | V274: 0,0; | W274: 4
A275: 2410 | B275: 试炼使者 | C275: pet_52 | D275: 0 | E275: 0 | F275: 1411,100;1413,100;1412,100;1416,100; | G275: 0,0; | H275: 83.5*LV+378.5 | I275: 9.7*LV+50 | J275: 1.5*LV+10 | K275: 8.4*LV+20.9 | L275: 1.4*LV+8 | M275: 1000*LV+100000 | N275: 0 | O275: math.max(0,(lv/10)-1) | P275: math.max(0,(lv/10)-1) | Q275: math.max(0,(lv/10)-1) | R275: 0; | S275: 有药王谷和盘丝洞的弟子在，真是不爽，还是跑路算了！ | T275: 药王谷和盘丝洞的弟子不在眼前，真是轻松愉快啊！ | U275: 0 | V275: 0,0; | W275: 2
A276: 2411 | B276: 煞气 | C276: pet_53 | D276: 0 | E276: 0 | F276: 1311,100;1315,100; | G276: 0,0; | H276: 69.6*LV+258.9 | I276: 8.4*LV+30 | J276: 0.9*LV+10 | K276: (7*LV+16.7)*0.05 | L276: 0.8*LV+8 | M276: 1000*LV+100000 | N276: 0 | O276: math.max(0,(lv/10)-1) | P276: math.max(0,(lv/10)-1) | Q276: math.max(0,(lv/10)-1) | R276: 0; | S276: 有药王谷和盘丝洞的弟子在，真是不爽，还是跑路算了！ | T276: 药王谷和盘丝洞的弟子不在眼前，真是轻松愉快啊！ | U276: 0 | V276: 0,0; | W276: 4
A277: =R[-50]C+100 -> 2410 | B277: 兔精 | C277: pet_11 | D277: 0 | E277: 0 | F277: 1411,100;1413,100;1412,100;1416,100; | G277: 0,0; | H277: 83.5*LV+378.5 | I277: 9.7*LV+50 | J277: 1.5*LV+10 | K277: 8.4*LV+20.9 | L277: 1.4*LV+8 | M277: 1000*LV+100000 | N277: 0 | O277: math.max(0,(lv/10)-1) | P277: math.max(0,(lv/10)-1) | Q277: math.max(0,(lv/10)-1) | R277: 0; | S277: 有药王谷和盘丝洞的弟子在，真是不爽，还是跑路算了！ | T277: 药王谷和盘丝洞的弟子不在眼前，真是轻松愉快啊！ | U277: 0 | V277: 0,0; | W277: 2
A278: =R[-50]C+100 -> 2411 | B278: 剑侠 | C278: pet_71 | D278: 0 | E278: 0 | F278: 1311,100;1315,100; | G278: 0,0; | H278: 69.6*LV+258.9 | I278: 8.4*LV+30 | J278: 0.9*LV+10 | K278: (7*LV+16.7)*0.05 | L278: 0.8*LV+8 | M278: 1000*LV+100000 | N278: 0 | O278: math.max(0,(lv/10)-1) | P278: math.max(0,(lv/10)-1) | Q278: math.max(0,(lv/10)-1) | R278: 0; | S278: 有药王谷和盘丝洞的弟子在，真是不爽，还是跑路算了！ | T278: 药王谷和盘丝洞的弟子不在眼前，真是轻松愉快啊！ | U278: 0 | V278: 0,0; | W278: 4
A279: 2412 | B279: 幼兽 | C279: pet_63 | D279: 0 | E279: 0 | F279: 1511,100;1513,100; | G279: 0,0; | H279: 69.6*LV+258.9 | I279: 8.4*LV+30 | J279: 0.9*LV+10 | K279: 7*LV+16.7 | L279: 0.8*LV+8 | M279: 1000*LV+100000 | N279: 0 | O279: math.max(0,(lv/10)-1) | P279: math.max(0,(lv/10)-1) | Q279: math.max(0,(lv/10)-1) | R279: 0; | S279: 有药王谷和盘丝洞的弟子在，真是不爽，还是跑路算了！ | T279: 药王谷和盘丝洞的弟子不在眼前，真是轻松愉快啊！ | U279: 0 | V279: 0,0; | W279: 5
A280: 2413 | B280: 猴子 | C280: pet_73 | D280: 0 | E280: 0 | F280: 1111,100;1112,100;1113,100;1114,100; | G280: 5203,100;5209,100;5133,100; | H280: 69.6*LV+258.9 | I280: 8.4*LV+30 | J280: 0.9*LV+10 | K280: (7*LV+16.7)*0.05 | L280: 0.8*LV+8 | M280: 1000*LV+100000 | N280: 0 | O280: math.max(0,(lv/10)-1) | P280: math.max(0,(lv/10)-1) | Q280: math.max(0,(lv/10)-1) | R280: 0; | S280: 有药王谷和盘丝洞的弟子在，真是不爽，还是跑路算了！ | T280: 药王谷和盘丝洞的弟子不在眼前，真是轻松愉快啊！ | U280: 0 | V280: 0,0; | W280: 1
A281: =R[-50]C+100 -> 2420 | B281: 仙鹤童子 | C281: pet_33 | D281: 0 | E281: 0 | F281: 0,0; | G281: 0,0; | H281: 1 | I281: 1 | J281: 1 | K281: 1 | L281: 1 | M281: 1000*LV+100000 | N281: 0 | O281: math.max(0,(lv/10)-1) | P281: math.max(0,(lv/10)-1) | Q281: math.max(0,(lv/10)-1) | R281: 0; | S281: 有药王谷和盘丝洞的弟子在，真是不爽，还是跑路算了！ | T281: 药王谷和盘丝洞的弟子不在眼前，真是轻松愉快啊！ | U281: 0 | V281: 0,0; | W281: 2
A282: =R[-50]C+100 -> 2370 | B282: 凶魂 | C282: pet_53 | D282: 0 | E282: 0 | F282: 1311,100;1315,100; | G282: 0,0; | H282: 80.5*LV+368.4 | I282: 9.4*LV+50 | J282: 1.5*LV+10 | K282: (8.1*LV+20.1)*0.05 | L282: 1.4*LV+8 | M282: 1000*LV+100000 | N282: 0 | O282: math.max(0,(lv/10)-1) | P282: math.max(0,(lv/10)-1) | Q282: math.max(0,(lv/10)-1) | R282: 0; | S282: 有药王谷和盘丝洞的弟子在，真是不爽，还是跑路算了！ | T282: 药王谷和盘丝洞的弟子不在眼前，真是轻松愉快啊！ | U282: 0 | V282: 0,0; | W282: 4
A283: =R[-50]C+100 -> 2421 | B283: 罗刹女 | C283: pet_61 | D283: 0 | E283: 0 | F283: 0,0; | G283: 0,0; | H283: 1 | I283: 1 | J283: 1 | K283: 1 | L283: 1 | M283: 1000*LV+100000 | N283: 0 | O283: math.max(0,(lv/10)-1) | P283: math.max(0,(lv/10)-1) | Q283: math.max(0,(lv/10)-1) | R283: 0; | S283: 有药王谷和盘丝洞的弟子在，真是不爽，还是跑路算了！ | T283: 药王谷和盘丝洞的弟子不在眼前，真是轻松愉快啊！ | U283: 0 | V283: 0,0; | W283: 0
A284: =R[-50]C+100 -> 2422 | B284: 织梦花妖 | C284: pet_42 | D284: 0 | E284: 0 | F284: 0,0; | G284: 0,0; | H284: 1 | I284: 1 | J284: 1 | K284: 1 | L284: 1 | M284: 1000*LV+100000 | N284: 0 | O284: math.max(0,(lv/10)-1) | P284: math.max(0,(lv/10)-1) | Q284: math.max(0,(lv/10)-1) | R284: 0; | S284: 有药王谷和盘丝洞的弟子在，真是不爽，还是跑路算了！ | T284: 药王谷和盘丝洞的弟子不在眼前，真是轻松愉快啊！ | U284: 0 | V284: 0,0; | W284: 0
A285: =R[-50]C+100 -> 2380 | B285: 道观真人 | C285: partner_1007 | D285: 0 | E285: 0 | F285: 1411,100;1412,100; | G285: 0,0; | H285: 81.3*LV+370.9 | I285: 9.5*LV+50 | J285: 1.5*LV+10 | K285: (8.1*LV+20.3)*0.05 | L285: 1.4*LV+8 | M285: 1000*LV+100000 | N285: 0 | O285: math.max(0,(lv/10)-1) | P285: math.max(0,(lv/10)-1) | Q285: math.max(0,(lv/10)-1) | R285: 0; | S285: 有药王谷和盘丝洞的弟子在，真是不爽，还是跑路算了！ | T285: 药王谷和盘丝洞的弟子不在眼前，真是轻松愉快啊！ | U285: 0 | V285: 0,0; | W285: 2
A286: =R[-50]C+100 -> 2430 | B286: 凶灵 | C286: pet_61 | D286: 0 | E286: 0 | F286: 0,0; | G286: 0,0; | H286: 1 | I286: 1 | J286: 1 | K286: 1 | L286: 1 | M286: 1000*LV+100000 | N286: 0 | O286: math.max(0,(lv/10)-1) | P286: math.max(0,(lv/10)-1) | Q286: math.max(0,(lv/10)-1) | R286: 0; | S286: 有药王谷和盘丝洞的弟子在，真是不爽，还是跑路算了！ | T286: 药王谷和盘丝洞的弟子不在眼前，真是轻松愉快啊！ | U286: 0 | V286: 0,0; | W286: 1
A287: =R[-50]C+100 -> 2431 | B287: 火瑞兽 | C287: pet_63 | D287: 0 | E287: 0 | F287: 0,0; | G287: 0,0; | H287: 1 | I287: 1 | J287: 1 | K287: 1 | L287: 1 | M287: 1000*LV+100000 | N287: 0 | O287: math.max(0,(lv/10)-1) | P287: math.max(0,(lv/10)-1) | Q287: math.max(0,(lv/10)-1) | R287: 0; | S287: 有药王谷和盘丝洞的弟子在，真是不爽，还是跑路算了！ | T287: 药王谷和盘丝洞的弟子不在眼前，真是轻松愉快啊！ | U287: 0 | V287: 0,0; | W287: 0
A288: =R[-50]C+100 -> 2390 | B288: 青花仙灵 | C288: pet_42 | D288: 0 | E288: 0 | F288: 1411,100;1413,100;1412,100;1416,100; | G288: 0,0; | H288: 82*LV+373.4 | I288: 9.6*LV+50 | J288: 1.5*LV+10 | K288: 8.2*LV+20.5 | L288: 1.4*LV+8 | M288: 1000*LV+100000 | N288: 0 | O288: math.max(0,(lv/10)-1) | P288: math.max(0,(lv/10)-1) | Q288: math.max(0,(lv/10)-1) | R288: 0; | S288: 有药王谷和盘丝洞的弟子在，真是不爽，还是跑路算了！ | T288: 药王谷和盘丝洞的弟子不在眼前，真是轻松愉快啊！ | U288: 0 | V288: 0,0; | W288: 2
A289: =R[-50]C+100 -> 2432 | B289: 阴阳师 | C289: pet_52 | D289: 0 | E289: 0 | F289: 0,0; | G289: 0,0; | H289: 1 | I289: 1 | J289: 1 | K289: 1 | L289: 1 | M289: 1000*LV+100000 | N289: 0 | O289: math.max(0,(lv/10)-1) | P289: math.max(0,(lv/10)-1) | Q289: math.max(0,(lv/10)-1) | R289: 0; | S289: 有药王谷和盘丝洞的弟子在，真是不爽，还是跑路算了！ | T289: 药王谷和盘丝洞的弟子不在眼前，真是轻松愉快啊！ | U289: 0 | V289: 0,0; | W289: 4
A290: =R[-50]C+100 -> 2392 | B290: 巫女娘娘 | C290: pet_83 | D290: 0 | E290: 0 | F290: 1111,100;1112,100;1113,100;1114,100; | G290: 0,0; | H290: 68.4*LV+255.1 | I290: 8.2*LV+30 | J290: 0.9*LV+10 | K290: (6.8*LV+16.4)*0.05 | L290: 0.8*LV+8 | M290: 1000*LV+100000 | N290: 0 | O290: math.max(0,(lv/10)-1) | P290: math.max(0,(lv/10)-1) | Q290: math.max(0,(lv/10)-1) | R290: 0; | S290: 有药王谷和盘丝洞的弟子在，真是不爽，还是跑路算了！ | T290: 药王谷和盘丝洞的弟子不在眼前，真是轻松愉快啊！ | U290: 0 | V290: 0,0; | W290: 1
A291: =R[-50]C+100 -> 2440 | B291: 孤魂女弟子 | C291: pet_53 | D291: 0 | E291: 0 | F291: 0,0; | G291: 0,0; | H291: 1 | I291: 1 | J291: 1 | K291: 1 | L291: 1 | M291: 1000*LV+100000 | N291: 0 | O291: math.max(0,(lv/10)-1) | P291: math.max(0,(lv/10)-1) | Q291: math.max(0,(lv/10)-1) | R291: 0; | S291: 有药王谷和盘丝洞的弟子在，真是不爽，还是跑路算了！ | T291: 药王谷和盘丝洞的弟子不在眼前，真是轻松愉快啊！ | U291: 0 | V291: 0,0; | W291: 0
A292: =R[-50]C+100 -> 2441 | B292: 恶龙 | C292: pet_23 | D292: 0 | E292: 0 | F292: 0,0; | G292: 0,0; | H292: 1 | I292: 1 | J292: 1 | K292: 1 | L292: 1 | M292: 1000*LV+100000 | N292: 0 | O292: math.max(0,(lv/10)-1) | P292: math.max(0,(lv/10)-1) | Q292: math.max(0,(lv/10)-1) | R292: 0; | S292: 有药王谷和盘丝洞的弟子在，真是不爽，还是跑路算了！ | T292: 药王谷和盘丝洞的弟子不在眼前，真是轻松愉快啊！ | U292: 0 | V292: 0,0; | W292: 0
A293: =R[-50]C+100 -> 2402 | B293: 煞之气 | C293: hero_1001 | D293: 0 | E293: 0 | F293: 1511,100;1513,100; | G293: 0,0; | H293: 69*LV+257 | I293: 8.3*LV+30 | J293: 0.9*LV+10 | K293: 6.9*LV+16.6 | L293: 0.8*LV+8 | M293: 1000*LV+100000 | N293: 0 | O293: math.max(0,(lv/10)-1) | P293: math.max(0,(lv/10)-1) | Q293: math.max(0,(lv/10)-1) | R293: 0; | S293: 有药王谷和盘丝洞的弟子在，真是不爽，还是跑路算了！ | T293: 药王谷和盘丝洞的弟子不在眼前，真是轻松愉快啊！ | U293: 0 | V293: 0,0; | W293: 5
A294: =R[-50]C+100 -> 2442 | B294: 熊猫武师 | C294: pet_13 | D294: 0 | E294: 0 | F294: 0,0; | G294: 0,0; | H294: 1 | I294: 1 | J294: 1 | K294: 1 | L294: 1 | M294: 1000*LV+100000 | N294: 0 | O294: math.max(0,(lv/10)-1) | P294: math.max(0,(lv/10)-1) | Q294: math.max(0,(lv/10)-1) | R294: 0; | S294: 有药王谷和盘丝洞的弟子在，真是不爽，还是跑路算了！ | T294: 药王谷和盘丝洞的弟子不在眼前，真是轻松愉快啊！ | U294: 0 | V294: 0,0; | W294: 0
A295: =R[-50]C+100 -> 2450 | B295: 夔兽 | C295: pet_63 | D295: 0 | E295: 0 | F295: 0,0; | G295: 0,0; | H295: 1 | I295: 1 | J295: 1 | K295: 1 | L295: 1 | M295: 1000*LV+100000 | N295: 0 | O295: math.max(0,(lv/10)-1) | P295: math.max(0,(lv/10)-1) | Q295: math.max(0,(lv/10)-1) | R295: 0; | S295: 有药王谷和盘丝洞的弟子在，真是不爽，还是跑路算了！ | T295: 药王谷和盘丝洞的弟子不在眼前，真是轻松愉快啊！ | U295: 0 | V295: 0,0; | W295: 0
A296: =R[-50]C+100 -> 2412 | B296: 菩提 | C296: hero_1001 | D296: 0 | E296: 0 | F296: 1511,100;1513,100; | G296: 0,0; | H296: 69.6*LV+258.9 | I296: 8.4*LV+30 | J296: 0.9*LV+10 | K296: 7*LV+16.7 | L296: 0.8*LV+8 | M296: 1000*LV+100000 | N296: 0 | O296: math.max(0,(lv/10)-1) | P296: math.max(0,(lv/10)-1) | Q296: math.max(0,(lv/10)-1) | R296: 0; | S296: 有药王谷和盘丝洞的弟子在，真是不爽，还是跑路算了！ | T296: 药王谷和盘丝洞的弟子不在眼前，真是轻松愉快啊！ | U296: 0 | V296: 0,0; | W296: 5
A297: =R[-50]C+100 -> 2451 | B297: 长青居士 | C297: pet_71 | D297: 0 | E297: 0 | F297: 0,0; | G297: 0,0; | H297: 1 | I297: 1 | J297: 1 | K297: 1 | L297: 1 | M297: 1000*LV+100000 | N297: 0 | O297: math.max(0,(lv/10)-1) | P297: math.max(0,(lv/10)-1) | Q297: math.max(0,(lv/10)-1) | R297: 0; | S297: 有药王谷和盘丝洞的弟子在，真是不爽，还是跑路算了！ | T297: 药王谷和盘丝洞的弟子不在眼前，真是轻松愉快啊！ | U297: 0 | V297: 0,0; | W297: 0
A298: =R[-50]C+100 -> 2452 | B298: 李易初 | C298: pet_71 | D298: 0 | E298: 0 | F298: 0,0; | G298: 0,0; | H298: 1 | I298: 1 | J298: 1 | K298: 1 | L298: 1 | M298: 1000*LV+100000 | N298: 0 | O298: math.max(0,(lv/10)-1) | P298: math.max(0,(lv/10)-1) | Q298: math.max(0,(lv/10)-1) | R298: 0; | S298: 有药王谷和盘丝洞的弟子在，真是不爽，还是跑路算了！ | T298: 药王谷和盘丝洞的弟子不在眼前，真是轻松愉快啊！ | U298: 0 | V298: 0,0; | W298: 0
A299: =R[-50]C+100 -> 2422 | B299: 魄魅 | C299: hero_1001 | D299: 0 | E299: 0 | F299: 0,0; | G299: 0,0; | H299: 1 | I299: 1 | J299: 1 | K299: 1 | L299: 1 | M299: 1000*LV+100000 | N299: 0 | O299: math.max(0,(lv/10)-1) | P299: math.max(0,(lv/10)-1) | Q299: math.max(0,(lv/10)-1) | R299: 0; | S299: 有药王谷和盘丝洞的弟子在，真是不爽，还是跑路算了！ | T299: 药王谷和盘丝洞的弟子不在眼前，真是轻松愉快啊！ | U299: 0 | V299: 0,0; | W299: 1
A300: =R[-50]C+100 -> 2460 | B300: 宋无闻 | C300: pet_71 | D300: 0 | E300: 0 | F300: 0,0; | G300: 0,0; | H300: 1 | I300: 1 | J300: 1 | K300: 1 | L300: 1 | M300: 1000*LV+100000 | N300: 0 | O300: math.max(0,(lv/10)-1) | P300: math.max(0,(lv/10)-1) | Q300: math.max(0,(lv/10)-1) | R300: 0; | S300: 有药王谷和盘丝洞的弟子在，真是不爽，还是跑路算了！ | T300: 药王谷和盘丝洞的弟子不在眼前，真是轻松愉快啊！ | U300: 0 | V300: 0,0; | W300: 4
A301: =R[-50]C+100 -> 2461 | B301: 冯远志 | C301: pet_71 | D301: 0 | E301: 0 | F301: 0,0; | G301: 0,0; | H301: 1 | I301: 1 | J301: 1 | K301: 1 | L301: 1 | M301: 1000*LV+100000 | N301: 0 | O301: math.max(0,(lv/10)-1) | P301: math.max(0,(lv/10)-1) | Q301: math.max(0,(lv/10)-1) | R301: 0; | S301: 有药王谷和盘丝洞的弟子在，真是不爽，还是跑路算了！ | T301: 药王谷和盘丝洞的弟子不在眼前，真是轻松愉快啊！ | U301: 0 | V301: 0,0; | W301: 1
A302: =R[-50]C+100 -> 2432 | B302: 李安安 | C302: hero_2001 | D302: 0 | E302: 0 | F302: 0,0; | G302: 0,0; | H302: 1 | I302: 1 | J302: 1 | K302: 1 | L302: 1 | M302: 1000*LV+100000 | N302: 0 | O302: math.max(0,(lv/10)-1) | P302: math.max(0,(lv/10)-1) | Q302: math.max(0,(lv/10)-1) | R302: 0; | S302: 有药王谷和盘丝洞的弟子在，真是不爽，还是跑路算了！ | T302: 药王谷和盘丝洞的弟子不在眼前，真是轻松愉快啊！ | U302: 0 | V302: 0,0; | W302: 2
A303: =R[-50]C+100 -> 2462 | B303: 马巨 | C303: pet_71 | D303: 0 | E303: 0 | F303: 0,0; | G303: 0,0; | H303: 1 | I303: 1 | J303: 1 | K303: 1 | L303: 1 | M303: 1000*LV+100000 | N303: 0 | O303: math.max(0,(lv/10)-1) | P303: math.max(0,(lv/10)-1) | Q303: math.max(0,(lv/10)-1) | R303: 0; | S303: 有药王谷和盘丝洞的弟子在，真是不爽，还是跑路算了！ | T303: 药王谷和盘丝洞的弟子不在眼前，真是轻松愉快啊！ | U303: 0 | V303: 0,0; | W303: 1
A304: =R[-50]C+100 -> 2470 | B304: 玄蛇 | C304: pet_23 | D304: 0 | E304: 0 | F304: 0,0; | G304: 0,0; | H304: 1 | I304: 1 | J304: 1 | K304: 1 | L304: 1 | M304: 1000*LV+100000 | N304: 0 | O304: math.max(0,(lv/10)-1) | P304: math.max(0,(lv/10)-1) | Q304: math.max(0,(lv/10)-1) | R304: 0; | S304: 有药王谷和盘丝洞的弟子在，真是不爽，还是跑路算了！ | T304: 药王谷和盘丝洞的弟子不在眼前，真是轻松愉快啊！ | U304: 0 | V304: 0,0; | W304: 1
A305: =R[-50]C+100 -> 2442 | B305: 女魃 | C305: pet_53 | D305: 0 | E305: 0 | F305: 0,0; | G305: 0,0; | H305: 1 | I305: 1 | J305: 1 | K305: 1 | L305: 1 | M305: 1000*LV+100000 | N305: 0 | O305: math.max(0,(lv/10)-1) | P305: math.max(0,(lv/10)-1) | Q305: math.max(0,(lv/10)-1) | R305: 0; | S305: 有药王谷和盘丝洞的弟子在，真是不爽，还是跑路算了！ | T305: 药王谷和盘丝洞的弟子不在眼前，真是轻松愉快啊！ | U305: 0 | V305: 0,0; | W305: 0
A306: =R[-50]C+100 -> 2471 | B306: 天策 | C306: hero_1001 | D306: 0 | E306: 0 | F306: 0,0; | G306: 0,0; | H306: 1 | I306: 1 | J306: 1 | K306: 1 | L306: 1 | M306: 1000*LV+100000 | N306: 0 | O306: math.max(0,(lv/10)-1) | P306: math.max(0,(lv/10)-1) | Q306: math.max(0,(lv/10)-1) | R306: 0; | S306: 有药王谷和盘丝洞的弟子在，真是不爽，还是跑路算了！ | T306: 药王谷和盘丝洞的弟子不在眼前，真是轻松愉快啊！ | U306: 0 | V306: 0,0; | W306: 4
A307: =R[-50]C+100 -> 2472 | B307: 玄奘法师 | C307: partner_1007 | D307: 0 | E307: 0 | F307: 1411,100;1412,100; | G307: 0,0; | H307: 1 | I307: 1 | J307: 1 | K307: 1 | L307: 1 | M307: 1000*LV+100000 | N307: 0 | O307: math.max(0,(lv/10)-1) | P307: math.max(0,(lv/10)-1) | Q307: math.max(0,(lv/10)-1) | R307: 0; | S307: 有药王谷和盘丝洞的弟子在，真是不爽，还是跑路算了！ | T307: 药王谷和盘丝洞的弟子不在眼前，真是轻松愉快啊！ | U307: 0 | V307: 0,0; | W307: 2
A308: =R[-50]C+100 -> 2452 | B308: 菩提 | C308: hero_1001 | D308: 0 | E308: 0 | F308: 0,0; | G308: 0,0; | H308: 1 | I308: 1 | J308: 1 | K308: 1 | L308: 1 | M308: 1000*LV+100000 | N308: 0 | O308: math.max(0,(lv/10)-1) | P308: math.max(0,(lv/10)-1) | Q308: math.max(0,(lv/10)-1) | R308: 0; | S308: 有药王谷和盘丝洞的弟子在，真是不爽，还是跑路算了！ | T308: 药王谷和盘丝洞的弟子不在眼前，真是轻松愉快啊！ | U308: 0 | V308: 0,0; | W308: 2
A309: =R[-50]C+100 -> 2480 | B309: 女魃 | C309: pet_53 | D309: 0 | E309: 0 | F309: 0,0; | G309: 0,0; | H309: 1 | I309: 1 | J309: 1 | K309: 1 | L309: 1 | M309: 1000*LV+100000 | N309: 0 | O309: math.max(0,(lv/10)-1) | P309: math.max(0,(lv/10)-1) | Q309: math.max(0,(lv/10)-1) | R309: 0; | S309: 有药王谷和盘丝洞的弟子在，真是不爽，还是跑路算了！ | T309: 药王谷和盘丝洞的弟子不在眼前，真是轻松愉快啊！ | U309: 0 | V309: 0,0; | W309: 4
A310: =R[-50]C+100 -> 2461 | B310: 李安安 | C310: hero_2001 | D310: 0 | E310: 0 | F310: 0,0; | G310: 0,0; | H310: 1 | I310: 1 | J310: 1 | K310: 1 | L310: 1 | M310: 1000*LV+100000 | N310: 0 | O310: math.max(0,(lv/10)-1) | P310: math.max(0,(lv/10)-1) | Q310: math.max(0,(lv/10)-1) | R310: 0; | S310: 有药王谷和盘丝洞的弟子在，真是不爽，还是跑路算了！ | T310: 药王谷和盘丝洞的弟子不在眼前，真是轻松愉快啊！ | U310: 0 | V310: 0,0; | W310: 2
A311: =R[-50]C+100 -> 2481 | B311: 章疾步 | C311: hero_1001 | D311: 0 | E311: 0 | F311: 0,0; | G311: 0,0; | H311: 1 | I311: 1 | J311: 1 | K311: 1 | L311: 1 | M311: 1000*LV+100000 | N311: 0 | O311: math.max(0,(lv/10)-1) | P311: math.max(0,(lv/10)-1) | Q311: math.max(0,(lv/10)-1) | R311: 0; | S311: 有药王谷和盘丝洞的弟子在，真是不爽，还是跑路算了！ | T311: 药王谷和盘丝洞的弟子不在眼前，真是轻松愉快啊！ | U311: 0 | V311: 0,0; | W311: 0
A312: =R[-50]C+100 -> 2482 | B312: 无邪 | C312: hero_1001 | D312: 0 | E312: 0 | F312: 0,0; | G312: 0,0; | H312: 1 | I312: 1 | J312: 1 | K312: 1 | L312: 1 | M312: 1000*LV+100000 | N312: 0 | O312: math.max(0,(lv/10)-1) | P312: math.max(0,(lv/10)-1) | Q312: math.max(0,(lv/10)-1) | R312: 0; | S312: 有药王谷和盘丝洞的弟子在，真是不爽，还是跑路算了！ | T312: 药王谷和盘丝洞的弟子不在眼前，真是轻松愉快啊！ | U312: 0 | V312: 0,0; | W312: 2
A313: =R[-50]C+100 -> 2471 | B313: 卓一平 | C313: partner_1001 | D313: 0 | E313: 0 | F313: 1111,100;1112,100;1114,100;1116,100; | G313: 0,0; | H313: 1 | I313: 1 | J313: 1 | K313: 1 | L313: 1 | M313: 1000*LV+100000 | N313: 0 | O313: math.max(0,(lv/10)-1) | P313: math.max(0,(lv/10)-1) | Q313: math.max(0,(lv/10)-1) | R313: 0; | S313: 有药王谷和盘丝洞的弟子在，真是不爽，还是跑路算了！ | T313: 药王谷和盘丝洞的弟子不在眼前，真是轻松愉快啊！ | U313: 0 | V313: 0,0; | W313: 1
A314: =R[-50]C+100 -> 2490 | B314: 亦诗 | C314: hero_2001 | D314: 0 | E314: 0 | F314: 0,0; | G314: 0,0; | H314: 1 | I314: 1 | J314: 1 | K314: 1 | L314: 1 | M314: 1000*LV+100000 | N314: 0 | O314: math.max(0,(lv/10)-1) | P314: math.max(0,(lv/10)-1) | Q314: math.max(0,(lv/10)-1) | R314: 0; | S314: 有药王谷和盘丝洞的弟子在，真是不爽，还是跑路算了！ | T314: 药王谷和盘丝洞的弟子不在眼前，真是轻松愉快啊！ | U314: 0 | V314: 0,0; | W314: 1
A315: =R[-50]C+100 -> 2491 | B315: 巫女娘娘 | C315: pet_83 | D315: 0 | E315: 0 | F315: 0,0; | G315: 0,0; | H315: 1 | I315: 1 | J315: 1 | K315: 1 | L315: 1 | M315: 1000*LV+100000 | N315: 0 | O315: math.max(0,(lv/10)-1) | P315: math.max(0,(lv/10)-1) | Q315: math.max(0,(lv/10)-1) | R315: 0; | S315: 有药王谷和盘丝洞的弟子在，真是不爽，还是跑路算了！ | T315: 药王谷和盘丝洞的弟子不在眼前，真是轻松愉快啊！ | U315: 0 | V315: 0,0; | W315: 2
A316: =R[-50]C+100 -> 2480 | B316: 玄奘法师 | C316: partner_1007 | D316: 0 | E316: 0 | F316: 1411,100;1412,100; | G316: 0,0; | H316: 1 | I316: 1 | J316: 1 | K316: 1 | L316: 1 | M316: 1000*LV+100000 | N316: 0 | O316: math.max(0,(lv/10)-1) | P316: math.max(0,(lv/10)-1) | Q316: math.max(0,(lv/10)-1) | R316: 0; | S316: 有药王谷和盘丝洞的弟子在，真是不爽，还是跑路算了！ | T316: 药王谷和盘丝洞的弟子不在眼前，真是轻松愉快啊！ | U316: 0 | V316: 0,0; | W316: 2
A317: =R[-50]C+100 -> 2492 | B317: 煞之气 | C317: hero_1001 | D317: 0 | E317: 0 | F317: 0,0; | G317: 0,0; | H317: 1 | I317: 1 | J317: 1 | K317: 1 | L317: 1 | M317: 1000*LV+100000 | N317: 0 | O317: math.max(0,(lv/10)-1) | P317: math.max(0,(lv/10)-1) | Q317: math.max(0,(lv/10)-1) | R317: 0; | S317: 有药王谷和盘丝洞的弟子在，真是不爽，还是跑路算了！ | T317: 药王谷和盘丝洞的弟子不在眼前，真是轻松愉快啊！ | U317: 0 | V317: 0,0; | W317: 5
A318: =R[-50]C+100 -> 2500 | B318: 魄魅 | C318: hero_1001 | D318: 0 | E318: 0 | F318: 0,0; | G318: 0,0; | H318: 1 | I318: 1 | J318: 1 | K318: 1 | L318: 1 | M318: 1000*LV+100000 | N318: 0 | O318: math.max(0,(lv/10)-1) | P318: math.max(0,(lv/10)-1) | Q318: math.max(0,(lv/10)-1) | R318: 0; | S318: 有药王谷和盘丝洞的弟子在，真是不爽，还是跑路算了！ | T318: 药王谷和盘丝洞的弟子不在眼前，真是轻松愉快啊！ | U318: 0 | V318: 0,0; | W318: 2
A319: =R[-50]C+100 -> 2490 | B319: 太阳神 | C319: partner_1011 | D319: 0 | E319: 0 | F319: 1211,100;1212,100;1213,100;1214,100; | G319: 0,0; | H319: 1 | I319: 1 | J319: 1 | K319: 1 | L319: 1 | M319: 1000*LV+100000 | N319: 0 | O319: math.max(0,(lv/10)-1) | P319: math.max(0,(lv/10)-1) | Q319: math.max(0,(lv/10)-1) | R319: 0; | S319: 有药王谷和盘丝洞的弟子在，真是不爽，还是跑路算了！ | T319: 药王谷和盘丝洞的弟子不在眼前，真是轻松愉快啊！ | U319: 0 | V319: 0,0; | W319: 3
A320: =R[-50]C+100 -> 2491 | B320: 吕青衣 | C320: hero_2001 | D320: 0 | E320: 0 | F320: 0,0; | G320: 0,0; | H320: 1 | I320: 1 | J320: 1 | K320: 1 | L320: 1 | M320: 1000*LV+100000 | N320: 0 | O320: math.max(0,(lv/10)-1) | P320: math.max(0,(lv/10)-1) | Q320: math.max(0,(lv/10)-1) | R320: 0; | S320: 有药王谷和盘丝洞的弟子在，真是不爽，还是跑路算了！ | T320: 药王谷和盘丝洞的弟子不在眼前，真是轻松愉快啊！ | U320: 0 | V320: 0,0; | W320: 5
A321: =R[-50]C+100 -> 2501 | B321: 毒仙子 | C321: partner_1005 | D321: 0 | E321: 0 | F321: 1211,100;1212,100;1213,100; | G321: 0,0; | H321: 1 | I321: 1 | J321: 1 | K321: 1 | L321: 1 | M321: 1000*LV+100000 | N321: 0 | O321: math.max(0,(lv/10)-1) | P321: math.max(0,(lv/10)-1) | Q321: math.max(0,(lv/10)-1) | R321: 0; | S321: 有药王谷和盘丝洞的弟子在，真是不爽，还是跑路算了！ | T321: 药王谷和盘丝洞的弟子不在眼前，真是轻松愉快啊！ | U321: 0 | V321: 0,0; | W321: 3
A322: =R[-50]C+100 -> 2502 | B322: 女魃 | C322: pet_53 | D322: 0 | E322: 0 | F322: 0,0; | G322: 0,0; | H322: 1 | I322: 1 | J322: 1 | K322: 1 | L322: 1 | M322: 1000*LV+100000 | N322: 0 | O322: math.max(0,(lv/10)-1) | P322: math.max(0,(lv/10)-1) | Q322: math.max(0,(lv/10)-1) | R322: 0; | S322: 有药王谷和盘丝洞的弟子在，真是不爽，还是跑路算了！ | T322: 药王谷和盘丝洞的弟子不在眼前，真是轻松愉快啊！ | U322: 0 | V322: 0,0; | W322: 0
A323: =R[-50]C+100 -> 2440 | B323: 妖狐 | C323: partner_1009 | D323: 0 | E323: 0 | F323: 0,0; | G323: 0,0; | H323: 1 | I323: 1 | J323: 1 | K323: 1 | L323: 1 | M323: 1000*LV+100000 | N323: 0 | O323: math.max(0,(lv/10)-1) | P323: math.max(0,(lv/10)-1) | Q323: math.max(0,(lv/10)-1) | R323: 0; | S323: 有药王谷和盘丝洞的弟子在，真是不爽，还是跑路算了！ | T323: 药王谷和盘丝洞的弟子不在眼前，真是轻松愉快啊！ | U323: 0 | V323: 0,0; | W323: 0
A324: =R[-50]C+100 -> 2501 | B324: 白面狐狸 | C324: partner_1009 | D324: 0 | E324: 0 | F324: 0,0; | G324: 0,0; | H324: 1 | I324: 1 | J324: 1 | K324: 1 | L324: 1 | M324: 1000*LV+100000 | N324: 0 | O324: math.max(0,(lv/10)-1) | P324: math.max(0,(lv/10)-1) | Q324: math.max(0,(lv/10)-1) | R324: 0; | S324: 有药王谷和盘丝洞的弟子在，真是不爽，还是跑路算了！ | T324: 药王谷和盘丝洞的弟子不在眼前，真是轻松愉快啊！ | U324: 0 | V324: 0,0; | W324: 0
A325: =R[-50]C+100 -> 2510 | B325: 玄奘法师 | C325: partner_1007 | D325: 0 | E325: 0 | F325: 1411,100;1412,100; | G325: 0,0; | H325: 1 | I325: 1 | J325: 1 | K325: 1 | L325: 1 | M325: 1000*LV+100000 | N325: 0 | O325: math.max(0,(lv/10)-1) | P325: math.max(0,(lv/10)-1) | Q325: math.max(0,(lv/10)-1) | R325: 0; | S325: 有药王谷和盘丝洞的弟子在，真是不爽，还是跑路算了！ | T325: 药王谷和盘丝洞的弟子不在眼前，真是轻松愉快啊！ | U325: 0 | V325: 0,0; | W325: 2
A326: =R[-50]C+100 -> 2511 | B326: 玄奘法师 | C326: partner_1007 | D326: 0 | E326: 0 | F326: 1411,100;1412,100; | G326: 0,0; | H326: 1 | I326: 1 | J326: 1 | K326: 1 | L326: 1 | M326: 1000*LV+100000 | N326: 0 | O326: math.max(0,(lv/10)-1) | P326: math.max(0,(lv/10)-1) | Q326: math.max(0,(lv/10)-1) | R326: 0; | S326: 有药王谷和盘丝洞的弟子在，真是不爽，还是跑路算了！ | T326: 药王谷和盘丝洞的弟子不在眼前，真是轻松愉快啊！ | U326: 0 | V326: 0,0; | W326: 2
A327: =R[-50]C+100 -> 2510 | B327: 吕青衣 | C327: hero_2001 | D327: 0 | E327: 0 | F327: 0,0; | G327: 0,0; | H327: 1 | I327: 1 | J327: 1 | K327: 1 | L327: 1 | M327: 1000*LV+100000 | N327: 0 | O327: math.max(0,(lv/10)-1) | P327: math.max(0,(lv/10)-1) | Q327: math.max(0,(lv/10)-1) | R327: 0; | S327: 有药王谷和盘丝洞的弟子在，真是不爽，还是跑路算了！ | T327: 药王谷和盘丝洞的弟子不在眼前，真是轻松愉快啊！ | U327: 0 | V327: 0,0; | W327: 0
A328: =R[-50]C+100 -> 2511 | B328: 铃铛 | C328: hero_2001 | D328: 0 | E328: 0 | F328: 0,0; | G328: 0,0; | H328: 1 | I328: 1 | J328: 1 | K328: 1 | L328: 1 | M328: 1000*LV+100000 | N328: 0 | O328: math.max(0,(lv/10)-1) | P328: math.max(0,(lv/10)-1) | Q328: math.max(0,(lv/10)-1) | R328: 0; | S328: 有药王谷和盘丝洞的弟子在，真是不爽，还是跑路算了！ | T328: 药王谷和盘丝洞的弟子不在眼前，真是轻松愉快啊！ | U328: 0 | V328: 0,0; | W328: 0
A329: =R[-50]C+100 -> 2512 | B329: 李琅 | C329: pet_43 | D329: 0 | E329: 0 | F329: 0,0; | G329: 0,0; | H329: 1 | I329: 1 | J329: 1 | K329: 1 | L329: 1 | M329: 1000*LV+100000 | N329: 0 | O329: math.max(0,(lv/10)-1) | P329: math.max(0,(lv/10)-1) | Q329: math.max(0,(lv/10)-1) | R329: 0; | S329: 有药王谷和盘丝洞的弟子在，真是不爽，还是跑路算了！ | T329: 药王谷和盘丝洞的弟子不在眼前，真是轻松愉快啊！ | U329: 0 | V329: 0,0; | W329: 0
A330: =R[-2]C+10 -> 2521 | B330: 剑侠 | C330: pet_71 | D330: 0 | E330: 0 | F330: 0,0; | G330: 0,0; | H330: 1 | I330: 1 | J330: 1 | K330: 1 | L330: 1 | M330: 1000*LV+100000 | N330: 0 | O330: math.max(0,(lv/10)-1) | P330: math.max(0,(lv/10)-1) | Q330: math.max(0,(lv/10)-1) | R330: 0; | S330: 有药王谷和盘丝洞的弟子在，真是不爽，还是跑路算了！ | T330: 药王谷和盘丝洞的弟子不在眼前，真是轻松愉快啊！ | U330: 0 | V330: 0,0; | W330: 0
A331: =R[-50]C+100 -> 2520 | B331: 卓一平 | C331: partner_1001 | D331: 0 | E331: 0 | F331: 1111,100;1112,100;1114,100;1116,100; | G331: 0,0; | H331: 1 | I331: 1 | J331: 1 | K331: 1 | L331: 1 | M331: 1000*LV+100000 | N331: 0 | O331: math.max(0,(lv/10)-1) | P331: math.max(0,(lv/10)-1) | Q331: math.max(0,(lv/10)-1) | R331: 0; | S331: 有药王谷和盘丝洞的弟子在，真是不爽，还是跑路算了！ | T331: 药王谷和盘丝洞的弟子不在眼前，真是轻松愉快啊！ | U331: 0 | V331: 0,0; | W331: 1
A332: =R[-2]C+10 -> 2531 | B332: 奴仆 | C332: pet_62 | D332: 0 | E332: 0 | F332: 0,0; | G332: 0,0; | H332: 1 | I332: 1 | J332: 1 | K332: 1 | L332: 1 | M332: 1000*LV+100000 | N332: 0 | O332: math.max(0,(lv/10)-1) | P332: math.max(0,(lv/10)-1) | Q332: math.max(0,(lv/10)-1) | R332: 0; | S332: 有药王谷和盘丝洞的弟子在，真是不爽，还是跑路算了！ | T332: 药王谷和盘丝洞的弟子不在眼前，真是轻松愉快啊！ | U332: 0 | V332: 0,0; | W332: 0
A333: =R[-50]C+100 -> 2521 | B333: 剑侠 | C333: pet_71 | D333: 0 | E333: 0 | F333: 0,0; | G333: 0,0; | H333: 1 | I333: 1 | J333: 1 | K333: 1 | L333: 1 | M333: 1000*LV+100000 | N333: 0 | O333: math.max(0,(lv/10)-1) | P333: math.max(0,(lv/10)-1) | Q333: math.max(0,(lv/10)-1) | R333: 0; | S333: 有药王谷和盘丝洞的弟子在，真是不爽，还是跑路算了！ | T333: 药王谷和盘丝洞的弟子不在眼前，真是轻松愉快啊！ | U333: 0 | V333: 0,0; | W333: 0
A334: =R[-50]C+100 -> 2522 | B334: 毒仙子 | C334: partner_1005 | D334: 0 | E334: 0 | F334: 1211,100;1212,100;1213,100; | G334: 0,0; | H334: 1 | I334: 1 | J334: 1 | K334: 1 | L334: 1 | M334: 1000*LV+100000 | N334: 0 | O334: math.max(0,(lv/10)-1) | P334: math.max(0,(lv/10)-1) | Q334: math.max(0,(lv/10)-1) | R334: 0; | S334: 有药王谷和盘丝洞的弟子在，真是不爽，还是跑路算了！ | T334: 药王谷和盘丝洞的弟子不在眼前，真是轻松愉快啊！ | U334: 0 | V334: 0,0; | W334: 3
A335: =R[-50]C+100 -> 2480 | B335: 艳青 | C335: hero_2001 | D335: 0 | E335: 0 | F335: 0,0; | G335: 0,0; | H335: 1 | I335: 1 | J335: 1 | K335: 1 | L335: 1 | M335: 1000*LV+100000 | N335: 0 | O335: math.max(0,(lv/10)-1) | P335: math.max(0,(lv/10)-1) | Q335: math.max(0,(lv/10)-1) | R335: 0; | S335: 有药王谷和盘丝洞的弟子在，真是不爽，还是跑路算了！ | T335: 药王谷和盘丝洞的弟子不在眼前，真是轻松愉快啊！ | U335: 0 | V335: 0,0; | W335: 0
A336: =R[-2]C+10 -> 2532 | B336: 小喽啰 | C336: pet_23 | D336: 0 | E336: 0 | F336: 0,0; | G336: 0,0; | H336: 1 | I336: 1 | J336: 1 | K336: 1 | L336: 1 | M336: 1000*LV+100000 | N336: 0 | O336: math.max(0,(lv/10)-1) | P336: math.max(0,(lv/10)-1) | Q336: math.max(0,(lv/10)-1) | R336: 0; | S336: 有药王谷和盘丝洞的弟子在，真是不爽，还是跑路算了！ | T336: 药王谷和盘丝洞的弟子不在眼前，真是轻松愉快啊！ | U336: 0 | V336: 0,0; | W336: 0
A337: =R[-50]C+100 -> 2531 | B337: 凶魂 | C337: pet_53 | D337: 0 | E337: 0 | F337: 0,0; | G337: 0,0; | H337: 1 | I337: 1 | J337: 1 | K337: 1 | L337: 1 | M337: 1000*LV+100000 | N337: 0 | O337: math.max(0,(lv/10)-1) | P337: math.max(0,(lv/10)-1) | Q337: math.max(0,(lv/10)-1) | R337: 0; | S337: 有药王谷和盘丝洞的弟子在，真是不爽，还是跑路算了！ | T337: 药王谷和盘丝洞的弟子不在眼前，真是轻松愉快啊！ | U337: 0 | V337: 0,0; | W337: 0
A338: =R[-50]C+100 -> 2490 | B338: 玄奘法师 | C338: partner_1007 | D338: 0 | E338: 0 | F338: 1411,100;1412,100; | G338: 0,0; | H338: 1 | I338: 1 | J338: 1 | K338: 1 | L338: 1 | M338: 1000*LV+100000 | N338: 0 | O338: math.max(0,(lv/10)-1) | P338: math.max(0,(lv/10)-1) | Q338: math.max(0,(lv/10)-1) | R338: 0; | S338: 有药王谷和盘丝洞的弟子在，真是不爽，还是跑路算了！ | T338: 药王谷和盘丝洞的弟子不在眼前，真是轻松愉快啊！ | U338: 0 | V338: 0,0; | W338: 2
A339: =R[-2]C+10 -> 2541 | B339: 奴仆 | C339: pet_62 | D339: 0 | E339: 0 | F339: 0,0; | G339: 0,0; | H339: 1 | I339: 1 | J339: 1 | K339: 1 | L339: 1 | M339: 1000*LV+100000 | N339: 0 | O339: math.max(0,(lv/10)-1) | P339: math.max(0,(lv/10)-1) | Q339: math.max(0,(lv/10)-1) | R339: 0; | S339: 有药王谷和盘丝洞的弟子在，真是不爽，还是跑路算了！ | T339: 药王谷和盘丝洞的弟子不在眼前，真是轻松愉快啊！ | U339: 0 | V339: 0,0; | W339: 0
A340: =R[-50]C+100 -> 2492 | B340: 剑侠 | C340: pet_71 | D340: 0 | E340: 0 | F340: 0,0; | G340: 0,0; | H340: 1 | I340: 1 | J340: 1 | K340: 1 | L340: 1 | M340: 1000*LV+100000 | N340: 0 | O340: math.max(0,(lv/10)-1) | P340: math.max(0,(lv/10)-1) | Q340: math.max(0,(lv/10)-1) | R340: 0; | S340: 有药王谷和盘丝洞的弟子在，真是不爽，还是跑路算了！ | T340: 药王谷和盘丝洞的弟子不在眼前，真是轻松愉快啊！ | U340: 0 | V340: 0,0; | W340: 0
A341: =R[-50]C+100 -> 2540 | B341: 捉妖天师 | C341: partner_1004 | D341: 0 | E341: 0 | F341: 1311,100;1313,100;1315,100;1312,100; | G341: 0,0; | H341: 1 | I341: 1 | J341: 1 | K341: 1 | L341: 1 | M341: 1000*LV+100000 | N341: 0 | O341: math.max(0,(lv/10)-1) | P341: math.max(0,(lv/10)-1) | Q341: math.max(0,(lv/10)-1) | R341: 0; | S341: 有药王谷和盘丝洞的弟子在，真是不爽，还是跑路算了！ | T341: 药王谷和盘丝洞的弟子不在眼前，真是轻松愉快啊！ | U341: 0 | V341: 0,0; | W341: 4
A342: =R[-2]C+10 -> 2502 | B342: 小喽啰 | C342: pet_23 | D342: 0 | E342: 0 | F342: 0,0; | G342: 0,0; | H342: 1 | I342: 1 | J342: 1 | K342: 1 | L342: 1 | M342: 1000*LV+100000 | N342: 0 | O342: math.max(0,(lv/10)-1) | P342: math.max(0,(lv/10)-1) | Q342: math.max(0,(lv/10)-1) | R342: 0; | S342: 有药王谷和盘丝洞的弟子在，真是不爽，还是跑路算了！ | T342: 药王谷和盘丝洞的弟子不在眼前，真是轻松愉快啊！ | U342: 0 | V342: 0,0; | W342: 0
A343: =R[-50]C+100 -> 2502 | B343: 玄蛇 | C343: pet_23 | D343: 0 | E343: 0 | F343: 0,0; | G343: 0,0; | H343: 1 | I343: 1 | J343: 1 | K343: 1 | L343: 1 | M343: 1000*LV+100000 | N343: 0 | O343: math.max(0,(lv/10)-1) | P343: math.max(0,(lv/10)-1) | Q343: math.max(0,(lv/10)-1) | R343: 0; | S343: 有药王谷和盘丝洞的弟子在，真是不爽，还是跑路算了！ | T343: 药王谷和盘丝洞的弟子不在眼前，真是轻松愉快啊！ | U343: 0 | V343: 0,0; | W343: 0
A344: =R[-50]C+100 -> 2542 | B344: 道观真人 | C344: partner_1007 | D344: 0 | E344: 0 | F344: 1411,100;1412,100; | G344: 0,0; | H344: 1 | I344: 1 | J344: 1 | K344: 1 | L344: 1 | M344: 1000*LV+100000 | N344: 0 | O344: math.max(0,(lv/10)-1) | P344: math.max(0,(lv/10)-1) | Q344: math.max(0,(lv/10)-1) | R344: 0; | S344: 有药王谷和盘丝洞的弟子在，真是不爽，还是跑路算了！ | T344: 药王谷和盘丝洞的弟子不在眼前，真是轻松愉快啊！ | U344: 0 | V344: 0,0; | W344: 2
A345: =R[-2]C+10 -> 2512 | B345: 熊猫武师 | C345: pet_13 | D345: 0 | E345: 0 | F345: 0,0; | G345: 0,0; | H345: 1 | I345: 1 | J345: 1 | K345: 1 | L345: 1 | M345: 1000*LV+100000 | N345: 0 | O345: math.max(0,(lv/10)-1) | P345: math.max(0,(lv/10)-1) | Q345: math.max(0,(lv/10)-1) | R345: 0; | S345: 有药王谷和盘丝洞的弟子在，真是不爽，还是跑路算了！ | T345: 药王谷和盘丝洞的弟子不在眼前，真是轻松愉快啊！ | U345: 0 | V345: 0,0; | W345: 0
A346: =R[-50]C+100 -> 2512 | B346: 青鸟 | C346: partner_1006 | D346: 0 | E346: 0 | F346: 1411,100;1413,100;1412,100;1416,100; | G346: 0,0; | H346: 1 | I346: 1 | J346: 1 | K346: 1 | L346: 1 | M346: 1000*LV+100000 | N346: 0 | O346: math.max(0,(lv/10)-1) | P346: math.max(0,(lv/10)-1) | Q346: math.max(0,(lv/10)-1) | R346: 0; | S346: 有药王谷和盘丝洞的弟子在，真是不爽，还是跑路算了！ | T346: 药王谷和盘丝洞的弟子不在眼前，真是轻松愉快啊！ | U346: 0 | V346: 0,0; | W346: 2
A347: =R[-50]C+100 -> 2551 | B347: 妖狐 | C347: partner_1009 | D347: 0 | E347: 0 | F347: 0,0; | G347: 0,0; | H347: 1 | I347: 1 | J347: 1 | K347: 1 | L347: 1 | M347: 1000*LV+100000 | N347: 0 | O347: math.max(0,(lv/10)-1) | P347: math.max(0,(lv/10)-1) | Q347: math.max(0,(lv/10)-1) | R347: 0; | S347: 有药王谷和盘丝洞的弟子在，真是不爽，还是跑路算了！ | T347: 药王谷和盘丝洞的弟子不在眼前，真是轻松愉快啊！ | U347: 0 | V347: 0,0; | W347: 0
A348: =R[-50]C+100 -> 2552 | B348: 天策 | C348: hero_1001 | D348: 0 | E348: 0 | F348: 0,0; | G348: 0,0; | H348: 1 | I348: 1 | J348: 1 | K348: 1 | L348: 1 | M348: 1000*LV+100000 | N348: 0 | O348: math.max(0,(lv/10)-1) | P348: math.max(0,(lv/10)-1) | Q348: math.max(0,(lv/10)-1) | R348: 0; | S348: 有药王谷和盘丝洞的弟子在，真是不爽，还是跑路算了！ | T348: 药王谷和盘丝洞的弟子不在眼前，真是轻松愉快啊！ | U348: 0 | V348: 0,0; | W348: 0
A349: =R[-2]C+10 -> 2561 | B349: 熊猫武师 | C349: pet_13 | D349: 0 | E349: 0 | F349: 0,0; | G349: 0,0; | H349: 1 | I349: 1 | J349: 1 | K349: 1 | L349: 1 | M349: 1000*LV+100000 | N349: 0 | O349: math.max(0,(lv/10)-1) | P349: math.max(0,(lv/10)-1) | Q349: math.max(0,(lv/10)-1) | R349: 0; | S349: 有药王谷和盘丝洞的弟子在，真是不爽，还是跑路算了！ | T349: 药王谷和盘丝洞的弟子不在眼前，真是轻松愉快啊！ | U349: 0 | V349: 0,0; | W349: 0
A350: =R[-50]C+100 -> 2560 | B350: 道济和尚 | C350: partner_1008 | D350: 0 | E350: 0 | F350: 0,0; | G350: 0,0; | H350: 1 | I350: 1 | J350: 1 | K350: 1 | L350: 1 | M350: 1000*LV+100000 | N350: 0 | O350: math.max(0,(lv/10)-1) | P350: math.max(0,(lv/10)-1) | Q350: math.max(0,(lv/10)-1) | R350: 0; | S350: 有药王谷和盘丝洞的弟子在，真是不爽，还是跑路算了！ | T350: 药王谷和盘丝洞的弟子不在眼前，真是轻松愉快啊！ | U350: 0 | V350: 0,0; | W350: 0
A351: =R[-2]C+10 -> 2571 | B351: 奴仆 | C351: pet_62 | D351: 0 | E351: 0 | F351: 0,0; | G351: 0,0; | H351: 1 | I351: 1 | J351: 1 | K351: 1 | L351: 1 | M351: 1000*LV+100000 | N351: 0 | O351: math.max(0,(lv/10)-1) | P351: math.max(0,(lv/10)-1) | Q351: math.max(0,(lv/10)-1) | R351: 0; | S351: 有药王谷和盘丝洞的弟子在，真是不爽，还是跑路算了！ | T351: 药王谷和盘丝洞的弟子不在眼前，真是轻松愉快啊！ | U351: 0 | V351: 0,0; | W351: 0
A352: =R[-50]C+100 -> 2532 | B352: 玄奘法师 | C352: partner_1007 | D352: 0 | E352: 0 | F352: 1411,100;1412,100; | G352: 0,0; | H352: 1 | I352: 1 | J352: 1 | K352: 1 | L352: 1 | M352: 1000*LV+100000 | N352: 0 | O352: math.max(0,(lv/10)-1) | P352: math.max(0,(lv/10)-1) | Q352: math.max(0,(lv/10)-1) | R352: 0; | S352: 有药王谷和盘丝洞的弟子在，真是不爽，还是跑路算了！ | T352: 药王谷和盘丝洞的弟子不在眼前，真是轻松愉快啊！ | U352: 0 | V352: 0,0; | W352: 2
A353: =R[-50]C+100 -> 2562 | B353: 青花仙灵 | C353: pet_42 | D353: 0 | E353: 0 | F353: 0,0; | G353: 0,0; | H353: 1 | I353: 1 | J353: 1 | K353: 1 | L353: 1 | M353: 1000*LV+100000 | N353: 0 | O353: math.max(0,(lv/10)-1) | P353: math.max(0,(lv/10)-1) | Q353: math.max(0,(lv/10)-1) | R353: 0; | S353: 有药王谷和盘丝洞的弟子在，真是不爽，还是跑路算了！ | T353: 药王谷和盘丝洞的弟子不在眼前，真是轻松愉快啊！ | U353: 0 | V353: 0,0; | W353: 1
A354: =R[-2]C+10 -> 2542 | B354: 剑侠 | C354: pet_71 | D354: 0 | E354: 0 | F354: 0,0; | G354: 0,0; | H354: 1 | I354: 1 | J354: 1 | K354: 1 | L354: 1 | M354: 1000*LV+100000 | N354: 0 | O354: math.max(0,(lv/10)-1) | P354: math.max(0,(lv/10)-1) | Q354: math.max(0,(lv/10)-1) | R354: 0; | S354: 有药王谷和盘丝洞的弟子在，真是不爽，还是跑路算了！ | T354: 药王谷和盘丝洞的弟子不在眼前，真是轻松愉快啊！ | U354: 0 | V354: 0,0; | W354: 1
A355: =R[-50]C+100 -> 2542 | B355: 九天玄女 | C355: partner_1010 | D355: 0 | E355: 0 | F355: 1411,100;1413,100;1412,100;1416,100; | G355: 0,0; | H355: 1 | I355: 1 | J355: 1 | K355: 1 | L355: 1 | M355: 1000*LV+100000 | N355: 0 | O355: math.max(0,(lv/10)-1) | P355: math.max(0,(lv/10)-1) | Q355: math.max(0,(lv/10)-1) | R355: 0; | S355: 有药王谷和盘丝洞的弟子在，真是不爽，还是跑路算了！ | T355: 药王谷和盘丝洞的弟子不在眼前，真是轻松愉快啊！ | U355: 0 | V355: 0,0; | W355: 2
A356: =R[-2]C+10 -> 2552 | B356: 剑侠 | C356: pet_71 | D356: 0 | E356: 0 | F356: 0,0; | G356: 0,0; | H356: 1 | I356: 1 | J356: 1 | K356: 1 | L356: 1 | M356: 1000*LV+100000 | N356: 0 | O356: math.max(0,(lv/10)-1) | P356: math.max(0,(lv/10)-1) | Q356: math.max(0,(lv/10)-1) | R356: 0; | S356: 有药王谷和盘丝洞的弟子在，真是不爽，还是跑路算了！ | T356: 药王谷和盘丝洞的弟子不在眼前，真是轻松愉快啊！ | U356: 0 | V356: 0,0; | W356: 2
A357: =R[-2]C+10 -> 2552 | B357: 奴仆 | C357: pet_62 | D357: 0 | E357: 0 | F357: 0,0; | G357: 0,0; | H357: 1 | I357: 1 | J357: 1 | K357: 1 | L357: 1 | M357: 1000*LV+100000 | N357: 0 | O357: math.max(0,(lv/10)-1) | P357: math.max(0,(lv/10)-1) | Q357: math.max(0,(lv/10)-1) | R357: 0; | S357: 有药王谷和盘丝洞的弟子在，真是不爽，还是跑路算了！ | T357: 药王谷和盘丝洞的弟子不在眼前，真是轻松愉快啊！ | U357: 0 | V357: 0,0; | W357: 3
A358: 3001 | B358: 熊猫武师 | C358: pet_13 | D358: 0 | E358: 0 | F358: 0,0; | G358: 0,0; | H358: 1 | I358: 1 | J358: 1 | K358: 1 | L358: 1 | M358: 1000*LV+100000 | N358: 0 | O358: math.max(0,(lv/10)-1) | P358: math.max(0,(lv/10)-1) | Q358: math.max(0,(lv/10)-1) | R358: 0; | S358: 有药王谷和盘丝洞的弟子在，真是不爽，还是跑路算了！ | T358: 药王谷和盘丝洞的弟子不在眼前，真是轻松愉快啊！ | U358: 0 | V358: 0,0; | W358: 3
A359: 3002 | B359: 小喽啰 | C359: pet_23 | D359: 0 | E359: 0 | F359: 0,0; | G359: 0,0; | H359: 5*LV+30 | I359: 2.5*LV+30 | J359: 1.2*LV+10 | K359: 3*LV+15 | L359: LV+8 | M359: 1000*LV+100000 | N359: 0 | O359: math.max(0,(lv/10)-1) | P359: math.max(0,(lv/10)-1) | Q359: math.max(0,(lv/10)-1) | R359: 0; | S359: 有药王谷和盘丝洞的弟子在，真是不爽，还是跑路算了！ | T359: 药王谷和盘丝洞的弟子不在眼前，真是轻松愉快啊！ | U359: 0 | V359: 0,0; | W359: 4
A360: =R[-2]C+10 -> 3011 | B360: 熊猫武师 | C360: pet_13 | D360: 0 | E360: 0 | F360: 0,0; | G360: 0,0; | H360: 1 | I360: 1 | J360: 1 | K360: 1 | L360: 1 | M360: 1000*LV+100000 | N360: 0 | O360: math.max(0,(lv/10)-1) | P360: math.max(0,(lv/10)-1) | Q360: math.max(0,(lv/10)-1) | R360: 0; | S360: 有药王谷和盘丝洞的弟子在，真是不爽，还是跑路算了！ | T360: 药王谷和盘丝洞的弟子不在眼前，真是轻松愉快啊！ | U360: 0 | V360: 0,0; | W360: 4
A361: =R[-2]C+10 -> 3012 | B361: 小喽啰 | C361: pet_23 | D361: 0 | E361: 0 | F361: 0,0; | G361: 0,0; | H361: 5.3*LV+30 | I361: 2.6*LV+30 | J361: 1.2*LV+10 | K361: 3*LV+15 | L361: LV+8 | M361: 1000*LV+100000 | N361: 0 | O361: math.max(0,(lv/10)-1) | P361: math.max(0,(lv/10)-1) | Q361: math.max(0,(lv/10)-1) | R361: 0; | S361: 有药王谷和盘丝洞的弟子在，真是不爽，还是跑路算了！ | T361: 药王谷和盘丝洞的弟子不在眼前，真是轻松愉快啊！ | U361: 0 | V361: 0,0; | W361: 5
A362: =R[-2]C+10 -> 3021 | B362: 剑侠 | C362: pet_71 | D362: 0 | E362: 0 | F362: 0,0; | G362: 0,0; | H362: 1 | I362: 1 | J362: 1 | K362: 1 | L362: 1 | M362: 1000*LV+100000 | N362: 0 | O362: math.max(0,(lv/10)-1) | P362: math.max(0,(lv/10)-1) | Q362: math.max(0,(lv/10)-1) | R362: 0; | S362: 有药王谷和盘丝洞的弟子在，真是不爽，还是跑路算了！ | T362: 药王谷和盘丝洞的弟子不在眼前，真是轻松愉快啊！ | U362: 0 | V362: 0,0; | W362: 5
A363: =R[-2]C+10 -> 3022 | B363: 奴仆 | C363: pet_62 | D363: 0 | E363: 0 | F363: 0,0; | G363: 0,0; | H363: 5.5*LV+30 | I363: 2.8*LV+30 | J363: 1.2*LV+10 | K363: 3*LV+15 | L363: LV+8 | M363: 1000*LV+100000 | N363: 0 | O363: math.max(0,(lv/10)-1) | P363: math.max(0,(lv/10)-1) | Q363: math.max(0,(lv/10)-1) | R363: 0; | S363: 有药王谷和盘丝洞的弟子在，真是不爽，还是跑路算了！ | T363: 药王谷和盘丝洞的弟子不在眼前，真是轻松愉快啊！ | U363: 0 | V363: 0,0; | W363: 0
A364: =R[-2]C+10 -> 3031 | B364: 剑侠 | C364: pet_71 | D364: 0 | E364: 0 | F364: 0,0; | G364: 0,0; | H364: 1 | I364: 1 | J364: 1 | K364: 1 | L364: 1 | M364: 1000*LV+100000 | N364: 0 | O364: math.max(0,(lv/10)-1) | P364: math.max(0,(lv/10)-1) | Q364: math.max(0,(lv/10)-1) | R364: 0; | S364: 有药王谷和盘丝洞的弟子在，真是不爽，还是跑路算了！ | T364: 药王谷和盘丝洞的弟子不在眼前，真是轻松愉快啊！ | U364: 0 | V364: 0,0; | W364: 0
A365: =R[-2]C+10 -> 3032 | B365: 奴仆 | C365: pet_62 | D365: 0 | E365: 0 | F365: 0,0; | G365: 0,0; | H365: 5.8*LV+30 | I365: 2.9*LV+30 | J365: 1.2*LV+10 | K365: 3*LV+15 | L365: LV+8 | M365: 1000*LV+100000 | N365: 0 | O365: math.max(0,(lv/10)-1) | P365: math.max(0,(lv/10)-1) | Q365: math.max(0,(lv/10)-1) | R365: 0; | S365: 有药王谷和盘丝洞的弟子在，真是不爽，还是跑路算了！ | T365: 药王谷和盘丝洞的弟子不在眼前，真是轻松愉快啊！ | U365: 0 | V365: 0,0; | W365: 4
A366: =R[-2]C+10 -> 3041 | B366: 熊猫武师 | C366: pet_13 | D366: 0 | E366: 0 | F366: 0,0; | G366: 0,0; | H366: 1 | I366: 1 | J366: 1 | K366: 1 | L366: 1 | M366: 1000*LV+100000 | N366: 0 | O366: math.max(0,(lv/10)-1) | P366: math.max(0,(lv/10)-1) | Q366: math.max(0,(lv/10)-1) | R366: 0; | S366: 有药王谷和盘丝洞的弟子在，真是不爽，还是跑路算了！ | T366: 药王谷和盘丝洞的弟子不在眼前，真是轻松愉快啊！ | U366: 0 | V366: 0,0; | W366: 2
A367: =R[-2]C+10 -> 3042 | B367: 小喽啰 | C367: pet_23 | D367: 0 | E367: 0 | F367: 0,0; | G367: 0,0; | H367: 6.1*LV+30 | I367: 3*LV+30 | J367: 1.2*LV+10 | K367: 3*LV+15 | L367: LV+8 | M367: 1000*LV+100000 | N367: 0 | O367: math.max(0,(lv/10)-1) | P367: math.max(0,(lv/10)-1) | Q367: math.max(0,(lv/10)-1) | R367: 0; | S367: 有药王谷和盘丝洞的弟子在，真是不爽，还是跑路算了！ | T367: 药王谷和盘丝洞的弟子不在眼前，真是轻松愉快啊！ | U367: 0 | V367: 0,0; | W367: 5
A368: =R[-2]C+10 -> 3051 | B368: 熊猫武师 | C368: pet_13 | D368: 0 | E368: 0 | F368: 0,0; | G368: 0,0; | H368: 1 | I368: 1 | J368: 1 | K368: 1 | L368: 1 | M368: 1000*LV+100000 | N368: 0 | O368: math.max(0,(lv/10)-1) | P368: math.max(0,(lv/10)-1) | Q368: math.max(0,(lv/10)-1) | R368: 0; | S368: 有药王谷和盘丝洞的弟子在，真是不爽，还是跑路算了！ | T368: 药王谷和盘丝洞的弟子不在眼前，真是轻松愉快啊！ | U368: 0 | V368: 0,0; | W368: 1
A369: =R[-2]C+10 -> 3052 | B369: 小喽啰 | C369: pet_23 | D369: 0 | E369: 0 | F369: 0,0; | G369: 0,0; | H369: 6.3*LV+30 | I369: 3.2*LV+30 | J369: 1.2*LV+10 | K369: 3*LV+15 | L369: LV+8 | M369: 1000*LV+100000 | N369: 0 | O369: math.max(0,(lv/10)-1) | P369: math.max(0,(lv/10)-1) | Q369: math.max(0,(lv/10)-1) | R369: 0; | S369: 有药王谷和盘丝洞的弟子在，真是不爽，还是跑路算了！ | T369: 药王谷和盘丝洞的弟子不在眼前，真是轻松愉快啊！ | U369: 0 | V369: 0,0; | W369: 0
A370: =R[-2]C+10 -> 3061 | B370: 剑侠 | C370: pet_71 | D370: 0 | E370: 0 | F370: 0,0; | G370: 0,0; | H370: 1 | I370: 1 | J370: 1 | K370: 1 | L370: 1 | M370: 1000*LV+100000 | N370: 0 | O370: math.max(0,(lv/10)-1) | P370: math.max(0,(lv/10)-1) | Q370: math.max(0,(lv/10)-1) | R370: 0; | S370: 有药王谷和盘丝洞的弟子在，真是不爽，还是跑路算了！ | T370: 药王谷和盘丝洞的弟子不在眼前，真是轻松愉快啊！ | U370: 0 | V370: 0,0; | W370: 0
A371: =R[-2]C+10 -> 3062 | B371: 奴仆 | C371: pet_62 | D371: 0 | E371: 0 | F371: 0,0; | G371: 0,0; | H371: 6.6*LV+30 | I371: 3.3*LV+30 | J371: 1.2*LV+10 | K371: 3*LV+15 | L371: LV+8 | M371: 1000*LV+100000 | N371: 0 | O371: math.max(0,(lv/10)-1) | P371: math.max(0,(lv/10)-1) | Q371: math.max(0,(lv/10)-1) | R371: 0; | S371: 有药王谷和盘丝洞的弟子在，真是不爽，还是跑路算了！ | T371: 药王谷和盘丝洞的弟子不在眼前，真是轻松愉快啊！ | U371: 0 | V371: 0,0; | W371: 0
A372: =R[-2]C+10 -> 3071 | B372: 剑侠 | C372: pet_71 | D372: 0 | E372: 0 | F372: 0,0; | G372: 0,0; | H372: 1 | I372: 1 | J372: 1 | K372: 1 | L372: 1 | M372: 1000*LV+100000 | N372: 0 | O372: math.max(0,(lv/10)-1) | P372: math.max(0,(lv/10)-1) | Q372: math.max(0,(lv/10)-1) | R372: 0; | S372: 有药王谷和盘丝洞的弟子在，真是不爽，还是跑路算了！ | T372: 药王谷和盘丝洞的弟子不在眼前，真是轻松愉快啊！ | U372: 0 | V372: 0,0; | W372: 0
A373: =R[-2]C+10 -> 3072 | B373: 奴仆 | C373: pet_62 | D373: 0 | E373: 0 | F373: 0,0; | G373: 0,0; | H373: 6.9*LV+30 | I373: 3.4*LV+30 | J373: 1.2*LV+10 | K373: 3*LV+15 | L373: LV+8 | M373: 1000*LV+100000 | N373: 0 | O373: math.max(0,(lv/10)-1) | P373: math.max(0,(lv/10)-1) | Q373: math.max(0,(lv/10)-1) | R373: 0; | S373: 有药王谷和盘丝洞的弟子在，真是不爽，还是跑路算了！ | T373: 药王谷和盘丝洞的弟子不在眼前，真是轻松愉快啊！ | U373: 0 | V373: 0,0; | W373: 4
A374: =R[-2]C+10 -> 3081 | B374: 熊猫武师 | C374: pet_13 | D374: 0 | E374: 0 | F374: 0,0; | G374: 0,0; | H374: 1 | I374: 1 | J374: 1 | K374: 1 | L374: 1 | M374: 1000*LV+100000 | N374: 0 | O374: math.max(0,(lv/10)-1) | P374: math.max(0,(lv/10)-1) | Q374: math.max(0,(lv/10)-1) | R374: 0; | S374: 有药王谷和盘丝洞的弟子在，真是不爽，还是跑路算了！ | T374: 药王谷和盘丝洞的弟子不在眼前，真是轻松愉快啊！ | U374: 0 | V374: 0,0; | W374: 2
A375: =R[-2]C+10 -> 3082 | B375: 小喽啰 | C375: pet_23 | D375: 0 | E375: 0 | F375: 0,0; | G375: 0,0; | H375: 7.1*LV+30 | I375: 3.6*LV+30 | J375: 1.2*LV+10 | K375: 3*LV+15 | L375: LV+8 | M375: 1000*LV+100000 | N375: 0 | O375: math.max(0,(lv/10)-1) | P375: math.max(0,(lv/10)-1) | Q375: math.max(0,(lv/10)-1) | R375: 0; | S375: 有药王谷和盘丝洞的弟子在，真是不爽，还是跑路算了！ | T375: 药王谷和盘丝洞的弟子不在眼前，真是轻松愉快啊！ | U375: 0 | V375: 0,0; | W375: 5
A376: =R[-2]C+10 -> 3091 | B376: 熊猫武师 | C376: pet_13 | D376: 0 | E376: 0 | F376: 0,0; | G376: 0,0; | H376: 1 | I376: 1 | J376: 1 | K376: 1 | L376: 1 | M376: 1000*LV+100000 | N376: 0 | O376: math.max(0,(lv/10)-1) | P376: math.max(0,(lv/10)-1) | Q376: math.max(0,(lv/10)-1) | R376: 0; | S376: 有药王谷和盘丝洞的弟子在，真是不爽，还是跑路算了！ | T376: 药王谷和盘丝洞的弟子不在眼前，真是轻松愉快啊！ | U376: 0 | V376: 0,0; | W376: 1
A377: =R[-2]C+10 -> 3092 | B377: 小喽啰 | C377: pet_23 | D377: 0 | E377: 0 | F377: 0,0; | G377: 0,0; | H377: 7.4*LV+30 | I377: 3.7*LV+30 | J377: 1.2*LV+10 | K377: 3*LV+15 | L377: LV+8 | M377: 1000*LV+100000 | N377: 0 | O377: math.max(0,(lv/10)-1) | P377: math.max(0,(lv/10)-1) | Q377: math.max(0,(lv/10)-1) | R377: 0; | S377: 有药王谷和盘丝洞的弟子在，真是不爽，还是跑路算了！ | T377: 药王谷和盘丝洞的弟子不在眼前，真是轻松愉快啊！ | U377: 0 | V377: 0,0; | W377: 0
A378: =R[-2]C+10 -> 3101 | B378: 剑侠 | C378: pet_71 | D378: 0 | E378: 0 | F378: 0,0; | G378: 0,0; | H378: 1 | I378: 1 | J378: 1 | K378: 1 | L378: 1 | M378: 1000*LV+100000 | N378: 0 | O378: math.max(0,(lv/10)-1) | P378: math.max(0,(lv/10)-1) | Q378: math.max(0,(lv/10)-1) | R378: 0; | S378: 有药王谷和盘丝洞的弟子在，真是不爽，还是跑路算了！ | T378: 药王谷和盘丝洞的弟子不在眼前，真是轻松愉快啊！ | U378: 0 | V378: 0,0; | W378: 0
A379: =R[-50]C+100 -> 2612 | B379: 太阳神 | C379: partner_1011 | D379: 0 | E379: 0 | F379: 1211,100;1212,100;1213,100;1214,100; | G379: 0,0; | H379: 1 | I379: 1 | J379: 1 | K379: 1 | L379: 1 | M379: 1000*LV+100000 | N379: 0 | O379: math.max(0,(lv/10)-1) | P379: math.max(0,(lv/10)-1) | Q379: math.max(0,(lv/10)-1) | R379: 0; | S379: 有药王谷和盘丝洞的弟子在，真是不爽，还是跑路算了！ | T379: 药王谷和盘丝洞的弟子不在眼前，真是轻松愉快啊！ | U379: 0 | V379: 0,0; | W379: 3
A380: =R[-50]C+100 -> 2621 | B380: 白面狐狸 | C380: partner_1009 | D380: 0 | E380: 0 | F380: 0,0; | G380: 0,0; | H380: 1 | I380: 1 | J380: 1 | K380: 1 | L380: 1 | M380: 1000*LV+100000 | N380: 0 | O380: math.max(0,(lv/10)-1) | P380: math.max(0,(lv/10)-1) | Q380: math.max(0,(lv/10)-1) | R380: 0; | S380: 有药王谷和盘丝洞的弟子在，真是不爽，还是跑路算了！ | T380: 药王谷和盘丝洞的弟子不在眼前，真是轻松愉快啊！ | U380: 0 | V380: 0,0; | W380: 0
A381: =R[-50]C+100 -> 2620 | B381: 女魃 | C381: pet_53 | D381: 0 | E381: 0 | F381: 0,0; | G381: 0,0; | H381: 1 | I381: 1 | J381: 1 | K381: 1 | L381: 1 | M381: 1000*LV+100000 | N381: 0 | O381: math.max(0,(lv/10)-1) | P381: math.max(0,(lv/10)-1) | Q381: math.max(0,(lv/10)-1) | R381: 0; | S381: 有药王谷和盘丝洞的弟子在，真是不爽，还是跑路算了！ | T381: 药王谷和盘丝洞的弟子不在眼前，真是轻松愉快啊！ | U381: 0 | V381: 0,0; | W381: 3
A382: =R[-50]C+100 -> 2631 | B382: 章疾步 | C382: hero_1001 | D382: 0 | E382: 0 | F382: 0,0; | G382: 0,0; | H382: 1 | I382: 1 | J382: 1 | K382: 1 | L382: 1 | M382: 1000*LV+100000 | N382: 0 | O382: math.max(0,(lv/10)-1) | P382: math.max(0,(lv/10)-1) | Q382: math.max(0,(lv/10)-1) | R382: 0; | S382: 有药王谷和盘丝洞的弟子在，真是不爽，还是跑路算了！ | T382: 药王谷和盘丝洞的弟子不在眼前，真是轻松愉快啊！ | U382: 0 | V382: 0,0; | W382: 2
A383: =R[-50]C+100 -> 2621 | B383: 无邪 | C383: hero_1001 | D383: 0 | E383: 0 | F383: 0,0; | G383: 0,0; | H383: 1 | I383: 1 | J383: 1 | K383: 1 | L383: 1 | M383: 1000*LV+100000 | N383: 0 | O383: math.max(0,(lv/10)-1) | P383: math.max(0,(lv/10)-1) | Q383: math.max(0,(lv/10)-1) | R383: 0; | S383: 有药王谷和盘丝洞的弟子在，真是不爽，还是跑路算了！ | T383: 药王谷和盘丝洞的弟子不在眼前，真是轻松愉快啊！ | U383: 0 | V383: 0,0; | W383: 5
A384: =R[-50]C+100 -> 2622 | B384: 亦诗 | C384: hero_2001 | D384: 0 | E384: 0 | F384: 0,0; | G384: 0,0; | H384: 1 | I384: 1 | J384: 1 | K384: 1 | L384: 1 | M384: 1000*LV+100000 | N384: 0 | O384: math.max(0,(lv/10)-1) | P384: math.max(0,(lv/10)-1) | Q384: math.max(0,(lv/10)-1) | R384: 0; | S384: 有药王谷和盘丝洞的弟子在，真是不爽，还是跑路算了！ | T384: 药王谷和盘丝洞的弟子不在眼前，真是轻松愉快啊！ | U384: 0 | V384: 0,0; | W384: 4
A385: =R[-50]C+100 -> 2580 | B385: 艳青 | C385: hero_2001 | D385: 0 | E385: 0 | F385: 0,0; | G385: 0,0; | H385: 1 | I385: 1 | J385: 1 | K385: 1 | L385: 1 | M385: 1000*LV+100000 | N385: 0 | O385: math.max(0,(lv/10)-1) | P385: math.max(0,(lv/10)-1) | Q385: math.max(0,(lv/10)-1) | R385: 0; | S385: 有药王谷和盘丝洞的弟子在，真是不爽，还是跑路算了！ | T385: 药王谷和盘丝洞的弟子不在眼前，真是轻松愉快啊！ | U385: 0 | V385: 0,0; | W385: 1
A386: =R[-50]C+100 -> 2632 | B386: 铃铛 | C386: hero_2001 | D386: 0 | E386: 0 | F386: 0,0; | G386: 0,0; | H386: 1 | I386: 1 | J386: 1 | K386: 1 | L386: 1 | M386: 1000*LV+100000 | N386: 0 | O386: math.max(0,(lv/10)-1) | P386: math.max(0,(lv/10)-1) | Q386: math.max(0,(lv/10)-1) | R386: 0; | S386: 有药王谷和盘丝洞的弟子在，真是不爽，还是跑路算了！ | T386: 药王谷和盘丝洞的弟子不在眼前，真是轻松愉快啊！ | U386: 0 | V386: 0,0; | W386: 4
A387: =R[-50]C+100 -> 2631 | B387: 捉妖天师 | C387: partner_1004 | D387: 0 | E387: 0 | F387: 1311,100;1313,100;1315,100;1312,100; | G387: 0,0; | H387: 1 | I387: 1 | J387: 1 | K387: 1 | L387: 1 | M387: 1000*LV+100000 | N387: 0 | O387: math.max(0,(lv/10)-1) | P387: math.max(0,(lv/10)-1) | Q387: math.max(0,(lv/10)-1) | R387: 0; | S387: 有药王谷和盘丝洞的弟子在，真是不爽，还是跑路算了！ | T387: 药王谷和盘丝洞的弟子不在眼前，真是轻松愉快啊！ | U387: 0 | V387: 0,0; | W387: 4
A388: =R[-50]C+100 -> 2590 | B388: 青鸟 | C388: partner_1006 | D388: 0 | E388: 0 | F388: 1411,100;1413,100;1412,100;1416,100; | G388: 0,0; | H388: 1 | I388: 1 | J388: 1 | K388: 1 | L388: 1 | M388: 1000*LV+100000 | N388: 0 | O388: math.max(0,(lv/10)-1) | P388: math.max(0,(lv/10)-1) | Q388: math.max(0,(lv/10)-1) | R388: 0; | S388: 有药王谷和盘丝洞的弟子在，真是不爽，还是跑路算了！ | T388: 药王谷和盘丝洞的弟子不在眼前，真是轻松愉快啊！ | U388: 0 | V388: 0,0; | W388: 2
A389: =R[-50]C+100 -> 2641 | B389: 道济和尚 | C389: partner_1008 | D389: 0 | E389: 0 | F389: 0,0; | G389: 0,0; | H389: 1 | I389: 1 | J389: 1 | K389: 1 | L389: 1 | M389: 1000*LV+100000 | N389: 0 | O389: math.max(0,(lv/10)-1) | P389: math.max(0,(lv/10)-1) | Q389: math.max(0,(lv/10)-1) | R389: 0; | S389: 有药王谷和盘丝洞的弟子在，真是不爽，还是跑路算了！ | T389: 药王谷和盘丝洞的弟子不在眼前，真是轻松愉快啊！ | U389: 0 | V389: 0,0; | W389: 1
A390: =R[-50]C+100 -> 2592 | B390: 九天玄女 | C390: partner_1010 | D390: 0 | E390: 0 | F390: 1411,100;1413,100;1412,100;1416,100; | G390: 0,0; | H390: 1 | I390: 1 | J390: 1 | K390: 1 | L390: 1 | M390: 1000*LV+100000 | N390: 0 | O390: math.max(0,(lv/10)-1) | P390: math.max(0,(lv/10)-1) | Q390: math.max(0,(lv/10)-1) | R390: 0; | S390: 有药王谷和盘丝洞的弟子在，真是不爽，还是跑路算了！ | T390: 药王谷和盘丝洞的弟子不在眼前，真是轻松愉快啊！ | U390: 0 | V390: 0,0; | W390: 2
A391: 101001 | B391: 金刚凶魂 | C391: pet_61 | D391: 0 | E391: 0 | F391: 1311,80;1312,20; | G391: 0,0; | H391: 70*LV+50 | I391: 8*LV+75 | J391: 1.5*LV+8 | K391: (6*LV+15)*0.1 | L391: 1.4*LV+8 | M391: 1000*LV+100000 | N391: 0 | O391: math.max(0,(lv/10)-1) | P391: math.max(0,(lv/10)-1) | Q391: math.max(0,(lv/10)-1) | R391: 0; | S391: 有药王谷和盘丝洞的弟子在，真是不爽，还是跑路算了！ | T391: 药王谷和盘丝洞的弟子不在眼前，真是轻松愉快啊！ | U391: 0 | V391: 0,0; | W391: 4
A392: 101002 | B392: 虚无凶魂 | C392: pet_53 | D392: 0 | E392: 0 | F392: 1411,80;1412,20; | G392: 0,0; | H392: 70*LV+50 | I392: 8*LV+75 | J392: 1.5*LV+8 | K392: 6*LV+15 | L392: 1.4*LV+8 | M392: 1000*LV+100000 | N392: 0 | O392: math.max(0,(lv/10)-1) | P392: math.max(0,(lv/10)-1) | Q392: math.max(0,(lv/10)-1) | R392: 0; | S392: 有药王谷和盘丝洞的弟子在，真是不爽，还是跑路算了！ | T392: 药王谷和盘丝洞的弟子不在眼前，真是轻松愉快啊！ | U392: 0 | V392: 0,0; | W392: 5
A393: 101003 | B393: 摄魂凶魂 | C393: pet_93 | D393: 0 | E393: 0 | F393: 1511,100; | G393: 0,0; | H393: 70*LV+50 | I393: 8*LV+75 | J393: 1.5*LV+8 | K393: 6*LV+15 | L393: 1.4*LV+8 | M393: 1000*LV+100000 | N393: 0 | O393: math.max(0,(lv/10)-1) | P393: math.max(0,(lv/10)-1) | Q393: math.max(0,(lv/10)-1) | R393: 0; | S393: 有药王谷和盘丝洞的弟子在，真是不爽，还是跑路算了！ | T393: 药王谷和盘丝洞的弟子不在眼前，真是轻松愉快啊！ | U393: 0 | V393: 0,0; | W393: 5
A394: 101004 | B394: 狂暴凶魂 | C394: pet_201 | D394: 0 | E394: 0 | F394: 1111,80;1112,20; | G394: 0,0; | H394: 70*LV+50 | I394: 8*LV+75 | J394: 1.5*LV+8 | K394: (6*LV+15)*0.1 | L394: 1.4*LV+8 | M394: 1000*LV+100000 | N394: 0 | O394: math.max(0,(lv/10)-1) | P394: math.max(0,(lv/10)-1) | Q394: math.max(0,(lv/10)-1) | R394: 0; | S394: 有药王谷和盘丝洞的弟子在，真是不爽，还是跑路算了！ | T394: 药王谷和盘丝洞的弟子不在眼前，真是轻松愉快啊！ | U394: 0 | V394: 0,0; | W394: 1
A395: 101005 | B395: 兔精 | C395: pet_11 | D395: 0 | E395: 0 | F395: 0,0; | G395: 0,0; | H395: 30*LV+30 | I395: 7*LV+70 | J395: 1.2*LV+8 | K395: (5*LV+12)*0.1 | L395: 0.8*LV+8 | M395: 1000*LV+100000 | N395: 0 | O395: math.max(0,(lv/10)-1) | P395: math.max(0,(lv/10)-1) | Q395: math.max(0,(lv/10)-1) | R395: 0; | S395: 有药王谷和盘丝洞的弟子在，真是不爽，还是跑路算了！ | T395: 药王谷和盘丝洞的弟子不在眼前，真是轻松愉快啊！ | U395: 0 | V395: 0,0; | W395: 4
A396: 101006 | B396: 剑灵 | C396: pet_21 | D396: 0 | E396: 0 | F396: 5304,40; | G396: 0,0; | H396: 30*LV+30 | I396: 7*LV+70 | J396: 1.2*LV+8 | K396: 5*LV+12 | L396: 0.8*LV+8 | M396: 1000*LV+100000 | N396: 0 | O396: math.max(0,(lv/10)-1) | P396: math.max(0,(lv/10)-1) | Q396: math.max(0,(lv/10)-1) | R396: 0; | S396: 有药王谷和盘丝洞的弟子在，真是不爽，还是跑路算了！ | T396: 药王谷和盘丝洞的弟子不在眼前，真是轻松愉快啊！ | U396: 0 | V396: 0,0; | W396: 2
A397: 101007 | B397: 阴阳师 | C397: pet_52 | D397: 0 | E397: 0 | F397: 0,0; | G397: 0,0; | H397: 30*LV+30 | I397: 7*LV+70 | J397: 1.2*LV+8 | K397: (5*LV+12)*0.1 | L397: 0.8*LV+8 | M397: 1000*LV+100000 | N397: 0 | O397: math.max(0,(lv/10)-1) | P397: math.max(0,(lv/10)-1) | Q397: math.max(0,(lv/10)-1) | R397: 0; | S397: 有药王谷和盘丝洞的弟子在，真是不爽，还是跑路算了！ | T397: 药王谷和盘丝洞的弟子不在眼前，真是轻松愉快啊！ | U397: 0 | V397: 0,0; | W397: 5
A398: 101008 | B398: 媚怪 | C398: pet_42 | D398: 1 | E398: 0 | F398: 0,0; | G398: 0,0; | H398: 70*LV+50 | I398: 8*LV+75 | J398: 1.5*LV+8 | K398: 6*LV+15 | L398: 1.4*LV+8 | M398: 1000*LV+100000 | N398: 0 | O398: math.max(0,(lv/10)-1) | P398: math.max(0,(lv/10)-1) | Q398: math.max(0,(lv/10)-1) | R398: 3;5; | S398: 有药王谷和盘丝洞的弟子在，真是不爽，还是跑路算了！ | T398: 药王谷和盘丝洞的弟子不在眼前，真是轻松愉快啊！ | U398: 3 | V398: 0,0; | W398: 1
A399: 103001 | B399: 入魔的药王长老 | C399: hero_1001 | D399: 0 | E399: 0 | F399: 1211,100;1212,100;1216,100;5310,100; | G399: 0,0; | H399: (89*LV+80)*0.42*1.2 | I399: (21*LV+160)*0.42*0.5 | J399: (6*LV+140)*0.42*1.2 | K399: (7*LV+23)*0.42*0.1 | L399: (0.4*LV+23)*0.42*1.5 | M399: 1000*LV+100000 | N399: 0 | O399: math.max(0,(lv/10)-1) | P399: math.max(0,(lv/10)-1) | Q399: math.max(0,(lv/10)-1) | R399: 0; | S399: 有药王谷和盘丝洞的弟子在，真是不爽，还是跑路算了！ | T399: 药王谷和盘丝洞的弟子不在眼前，真是轻松愉快啊！ | U399: 0 | V399: 103006,25;103007,25;103008,25;103009,25; | W399: 3
A400: 103002 | B400: 入魔的水晶长老 | C400: hero_1001 | D400: 0 | E400: 0 | F400: 1411,100;1416,100;1412,100; | G400: 0,0; | H400: (89*LV+80)*0.42 | I400: (21*LV+160)*0.42*0.5 | J400: (6*LV+140)*0.42*0.8 | K400: (7*LV+23)*0.42*1.5 | L400: (0.4*LV+23)*0.42*0.8 | M400: 1000*LV+100000 | N400: 0 | O400: math.max(0,(lv/10)-1) | P400: math.max(0,(lv/10)-1) | Q400: math.max(0,(lv/10)-1) | R400: 0; | S400: 有药王谷和盘丝洞的弟子在，真是不爽，还是跑路算了！ | T400: 药王谷和盘丝洞的弟子不在眼前，真是轻松愉快啊！ | U400: 0 | V400: 103006,25;103007,25;103008,25;103009,25; | W400: 2
A401: 103003 | B401: 入魔的兽王护法 | C401: hero_1001 | D401: 0 | E401: 0 | F401: 1511,100;1512,100;1513,100;1514,100; | G401: 0,0; | H401: (89*LV+80)*0.42*0.8 | I401: (21*LV+160)*0.42*0.5 | J401: (6*LV+140)*0.42 | K401: (7*LV+23)*0.42*0.5 | L401: (0.4*LV+23)*0.42*2 | M401: 1000*LV+100000 | N401: 0 | O401: math.max(0,(lv/10)-1) | P401: math.max(0,(lv/10)-1) | Q401: math.max(0,(lv/10)-1) | R401: 0; | S401: 有药王谷和盘丝洞的弟子在，真是不爽，还是跑路算了！ | T401: 药王谷和盘丝洞的弟子不在眼前，真是轻松愉快啊！ | U401: 0 | V401: 103006,25;103007,25;103008,25;103009,25; | W401: 5
A402: 103004 | B402: 入魔的狮驼供奉 | C402: hero_2001 | D402: 0 | E402: 0 | F402: 1311,100;1312,100;1315,100; | G402: 0,0; | H402: (89*LV+80)*0.42 | I402: (21*LV+160)*0.42 | J402: (6*LV+140)*0.42*0.7 | K402: (7*LV+23)*0.42*0.5 | L402: (0.4*LV+23)*0.42*1.2 | M402: 1000*LV+100000 | N402: 0 | O402: math.max(0,(lv/10)-1) | P402: math.max(0,(lv/10)-1) | Q402: math.max(0,(lv/10)-1) | R402: 0; | S402: 有药王谷和盘丝洞的弟子在，真是不爽，还是跑路算了！ | T402: 药王谷和盘丝洞的弟子不在眼前，真是轻松愉快啊！ | U402: 0 | V402: 103006,25;103007,25;103008,25;103009,25; | W402: 4
A403: 103005 | B403: 入魔的天策圣使 | C403: hero_1001 | D403: 0 | E403: 0 | F403: 1112,100;1116,100;1111,100; | G403: 0,0; | H403: (89*LV+80)*0.42 | I403: (21*LV+160)*0.42 | J403: (6*LV+140)*0.42*0.7 | K403: (7*LV+23)*0.42*0.5 | L403: (0.4*LV+23)*0.42*1.2 | M403: 1000*LV+100000 | N403: 0 | O403: math.max(0,(lv/10)-1) | P403: math.max(0,(lv/10)-1) | Q403: math.max(0,(lv/10)-1) | R403: 0; | S403: 有药王谷和盘丝洞的弟子在，真是不爽，还是跑路算了！ | T403: 药王谷和盘丝洞的弟子不在眼前，真是轻松愉快啊！ | U403: 0 | V403: 103006,25;103007,25;103008,25;103009,25; | W403: 1
A404: 103006 | B404: 奴仆 | C404: pet_62 | D404: 0 | E404: 0 | F404: 5309,100; | G404: 0,0; | H404: ((89*LV+80)*2/3)*0.42 | I404: (21*LV+160)*0.42 | J404: ((6*LV+140)*2/3)*0.42*0.7 | K404: ((7*LV+23)*2/20)*0.42*0.5 | L404: ((0.4*LV+23)*2/3)*0.42*1.2 | M404: 1000*LV+100000 | N404: 0 | O404: math.max(0,(lv/10)-1) | P404: math.max(0,(lv/10)-1) | Q404: math.max(0,(lv/10)-1) | R404: 0; | S404: 有药王谷和盘丝洞的弟子在，真是不爽，还是跑路算了！ | T404: 药王谷和盘丝洞的弟子不在眼前，真是轻松愉快啊！ | U404: 0 | V404: 0,0; | W404: 4
A405: 103007 | B405: 小怪 | C405: pet_62 | D405: 0 | E405: 0 | F405: 1411,100;1416,100; | G405: 0,0; | H405: ((89*LV+80)*2/3)*0.42 | I405: (21*LV+160)*0.42*0.5 | J405: ((6*LV+140)*2/3)*0.42*0.8 | K405: ((7*LV+23)*2/20)*0.42*1.5 | L405: ((0.4*LV+23)*2/3)*0.42*0.8 | M405: 1000*LV+100000 | N405: 0 | O405: math.max(0,(lv/10)-1) | P405: math.max(0,(lv/10)-1) | Q405: math.max(0,(lv/10)-1) | R405: 0; | S405: 有药王谷和盘丝洞的弟子在，真是不爽，还是跑路算了！ | T405: 药王谷和盘丝洞的弟子不在眼前，真是轻松愉快啊！ | U405: 0 | V405: 0,0; | W405: 2
A406: 103008 | B406: 小怪 | C406: pet_62 | D406: 0 | E406: 0 | F406: 1511,100;1514,100; | G406: 0,0; | H406: ((89*LV+80)*2/3)*0.42*0.8 | I406: (21*LV+160)*0.42*0.5 | J406: ((6*LV+140)*2/3)*0.42 | K406: ((7*LV+23)*2/20)*0.42*0.5 | L406: ((0.4*LV+23)*2/3)*0.42*2 | M406: 1000*LV+100000 | N406: 0 | O406: math.max(0,(lv/10)-1) | P406: math.max(0,(lv/10)-1) | Q406: math.max(0,(lv/10)-1) | R406: 0; | S406: 有药王谷和盘丝洞的弟子在，真是不爽，还是跑路算了！ | T406: 药王谷和盘丝洞的弟子不在眼前，真是轻松愉快啊！ | U406: 0 | V406: 0,0; | W406: 5
A407: 103009 | B407: 凶魂 | C407: pet_53 | D407: 0 | E407: 0 | F407: 5307,100; | G407: 0,0; | H407: ((89*LV+80)*2/3)*0.42 | I407: (21*LV+160)*0.42*0.5 | J407: ((6*LV+140)*2/3)*0.42*0.8 | K407: ((7*LV+23)*2/20)*0.42*1.5 | L407: ((0.4*LV+23)*2/3)*0.42*0.8 | M407: 1000*LV+100000 | N407: 0 | O407: math.max(0,(lv/10)-1) | P407: math.max(0,(lv/10)-1) | Q407: math.max(0,(lv/10)-1) | R407: 0; | S407: 有药王谷和盘丝洞的弟子在，真是不爽，还是跑路算了！ | T407: 药王谷和盘丝洞的弟子不在眼前，真是轻松愉快啊！ | U407: 0 | V407: 0,0; | W407: 1
A408: 103011 | B408: 入魔的药王长老 | C408: hero_1001 | D408: 0 | E408: 0 | F408: 1211,100;1212,100;1216,100;5310,100; | G408: 0,0; | H408: (94*LV+90)*0.56*1.2 | I408: (23*LV+180)*0.56*0.5 | J408: (8*LV+160)*0.56*1.2 | K408: (7.5*LV+26)*0.56*0.1 | L408: (0.6*LV+26)*0.56*1.5 | M408: 1000*LV+100000 | N408: 0 | O408: math.max(0,(lv/10)-1) | P408: math.max(0,(lv/10)-1) | Q408: math.max(0,(lv/10)-1) | R408: 0; | S408: 有药王谷和盘丝洞的弟子在，真是不爽，还是跑路算了！ | T408: 药王谷和盘丝洞的弟子不在眼前，真是轻松愉快啊！ | U408: 0 | V408: 103016,25;103017,25;103018,25;103019,25; | W408: 3
A409: 103012 | B409: 入魔的水晶长老 | C409: hero_1001 | D409: 0 | E409: 0 | F409: 1411,100;1416,100;1412,100; | G409: 0,0; | H409: (94*LV+90)*0.56 | I409: (23*LV+180)*0.56*0.5 | J409: (8*LV+160)*0.56*0.8 | K409: (7.5*LV+26)*0.56*1.5 | L409: (0.6*LV+26)*0.56*0.8 | M409: 1000*LV+100000 | N409: 0 | O409: math.max(0,(lv/10)-1) | P409: math.max(0,(lv/10)-1) | Q409: math.max(0,(lv/10)-1) | R409: 0; | S409: 有药王谷和盘丝洞的弟子在，真是不爽，还是跑路算了！ | T409: 药王谷和盘丝洞的弟子不在眼前，真是轻松愉快啊！ | U409: 0 | V409: 103016,25;103017,25;103018,25;103019,25; | W409: 2
A410: 103013 | B410: 入魔的兽王护法 | C410: hero_1001 | D410: 0 | E410: 0 | F410: 1511,100;1512,100;1513,100;1514,100; | G410: 0,0; | H410: (94*LV+90)*0.56*0.8 | I410: (23*LV+180)*0.56*0.5 | J410: (8*LV+160)*0.56 | K410: (7.5*LV+26)*0.56*0.5 | L410: (0.6*LV+26)*0.56*2 | M410: 1000*LV+100000 | N410: 0 | O410: math.max(0,(lv/10)-1) | P410: math.max(0,(lv/10)-1) | Q410: math.max(0,(lv/10)-1) | R410: 0; | S410: 有药王谷和盘丝洞的弟子在，真是不爽，还是跑路算了！ | T410: 药王谷和盘丝洞的弟子不在眼前，真是轻松愉快啊！ | U410: 0 | V410: 103016,25;103017,25;103018,25;103019,25; | W410: 5
A411: 103014 | B411: 入魔的狮驼供奉 | C411: hero_2001 | D411: 0 | E411: 0 | F411: 1311,100;1312,100;1315,100; | G411: 0,0; | H411: (94*LV+90)*0.56 | I411: (23*LV+180)*0.56 | J411: (8*LV+160)*0.56*0.7 | K411: (7.5*LV+26)*0.56*0.5 | L411: (0.6*LV+26)*0.56*1.2 | M411: 1000*LV+100000 | N411: 0 | O411: math.max(0,(lv/10)-1) | P411: math.max(0,(lv/10)-1) | Q411: math.max(0,(lv/10)-1) | R411: 0; | S411: 有药王谷和盘丝洞的弟子在，真是不爽，还是跑路算了！ | T411: 药王谷和盘丝洞的弟子不在眼前，真是轻松愉快啊！ | U411: 0 | V411: 103016,25;103017,25;103018,25;103019,25; | W411: 4
A412: 103015 | B412: 入魔的天策圣使 | C412: hero_1001 | D412: 0 | E412: 0 | F412: 1112,100;1116,100;1111,100; | G412: 0,0; | H412: (94*LV+90)*0.56 | I412: (23*LV+180)*0.56 | J412: (8*LV+160)*0.56*0.7 | K412: (7.5*LV+26)*0.56*0.5 | L412: (0.6*LV+26)*0.56*1.2 | M412: 1000*LV+100000 | N412: 0 | O412: math.max(0,(lv/10)-1) | P412: math.max(0,(lv/10)-1) | Q412: math.max(0,(lv/10)-1) | R412: 0; | S412: 有药王谷和盘丝洞的弟子在，真是不爽，还是跑路算了！ | T412: 药王谷和盘丝洞的弟子不在眼前，真是轻松愉快啊！ | U412: 0 | V412: 103016,25;103017,25;103018,25;103019,25; | W412: 1
A413: 103016 | B413: 奴仆 | C413: pet_62 | D413: 0 | E413: 0 | F413: 5309,100; | G413: 0,0; | H413: ((94*LV+90)*2/3)*0.56 | I413: (23*LV+180)*0.56 | J413: ((8*LV+160)*2/3)*0.56*0.7 | K413: ((7.5*LV+26)*2/20)*0.56*0.5 | L413: ((0.6*LV+26)*2/3)*0.56*1.2 | M413: 1000*LV+100000 | N413: 0 | O413: math.max(0,(lv/10)-1) | P413: math.max(0,(lv/10)-1) | Q413: math.max(0,(lv/10)-1) | R413: 0; | S413: 有药王谷和盘丝洞的弟子在，真是不爽，还是跑路算了！ | T413: 药王谷和盘丝洞的弟子不在眼前，真是轻松愉快啊！ | U413: 0 | V413: 0,0; | W413: 4
A414: 103017 | B414: 小怪 | C414: pet_62 | D414: 0 | E414: 0 | F414: 1411,100;1416,100; | G414: 0,0; | H414: ((94*LV+90)*2/3)*0.56 | I414: (23*LV+180)*0.56*0.5 | J414: ((8*LV+160)*2/3)*0.56*0.8 | K414: ((7.5*LV+26)*2/20)*0.56*1.5 | L414: ((0.6*LV+26)*2/3)*0.56*0.8 | M414: 1000*LV+100000 | N414: 0 | O414: math.max(0,(lv/10)-1) | P414: math.max(0,(lv/10)-1) | Q414: math.max(0,(lv/10)-1) | R414: 0; | S414: 有药王谷和盘丝洞的弟子在，真是不爽，还是跑路算了！ | T414: 药王谷和盘丝洞的弟子不在眼前，真是轻松愉快啊！ | U414: 0 | V414: 0,0; | W414: 2
A415: 103018 | B415: 小怪 | C415: pet_62 | D415: 0 | E415: 0 | F415: 1511,100;1514,100; | G415: 0,0; | H415: ((94*LV+90)*2/3)*0.56*0.8 | I415: (23*LV+180)*0.56*0.5 | J415: ((8*LV+160)*2/3)*0.56 | K415: ((7.5*LV+26)*2/20)*0.56*0.5 | L415: ((0.6*LV+26)*2/3)*0.56*2 | M415: 1000*LV+100000 | N415: 0 | O415: math.max(0,(lv/10)-1) | P415: math.max(0,(lv/10)-1) | Q415: math.max(0,(lv/10)-1) | R415: 0; | S415: 有药王谷和盘丝洞的弟子在，真是不爽，还是跑路算了！ | T415: 药王谷和盘丝洞的弟子不在眼前，真是轻松愉快啊！ | U415: 0 | V415: 0,0; | W415: 5
A416: 103019 | B416: 凶魂 | C416: pet_53 | D416: 0 | E416: 0 | F416: 5307,100; | G416: 0,0; | H416: ((94*LV+90)*2/3)*0.56 | I416: (23*LV+180)*0.56*0.5 | J416: ((8*LV+160)*2/3)*0.56*0.8 | K416: ((7.5*LV+26)*2/20)*0.56*1.5 | L416: ((0.6*LV+26)*2/3)*0.56*0.8 | M416: 1000*LV+100000 | N416: 0 | O416: math.max(0,(lv/10)-1) | P416: math.max(0,(lv/10)-1) | Q416: math.max(0,(lv/10)-1) | R416: 0; | S416: 有药王谷和盘丝洞的弟子在，真是不爽，还是跑路算了！ | T416: 药王谷和盘丝洞的弟子不在眼前，真是轻松愉快啊！ | U416: 0 | V416: 0,0; | W416: 1
A417: 103021 | B417: 入魔的药王长老 | C417: hero_1001 | D417: 0 | E417: 0 | F417: 1211,100;1212,100;1216,100;5310,100; | G417: 0,0; | H417: (99*LV+100)*0.71*1.2 | I417: (25*LV+200)*0.71*0.5 | J417: (10*LV+180)*0.71*1.2 | K417: (8*LV+29)*0.71*0.1 | L417: (0.8*LV+29)*0.71*1.5 | M417: 1000*LV+100000 | N417: 0 | O417: math.max(0,(lv/10)-1) | P417: math.max(0,(lv/10)-1) | Q417: math.max(0,(lv/10)-1) | R417: 0; | S417: 有药王谷和盘丝洞的弟子在，真是不爽，还是跑路算了！ | T417: 药王谷和盘丝洞的弟子不在眼前，真是轻松愉快啊！ | U417: 0 | V417: 103026,25;103027,25;103028,25;103029,25; | W417: 3
A418: 103022 | B418: 入魔的水晶长老 | C418: hero_1001 | D418: 0 | E418: 0 | F418: 1411,100;1416,100;1412,100; | G418: 0,0; | H418: (99*LV+100)*0.71 | I418: (25*LV+200)*0.71*0.5 | J418: (10*LV+180)*0.71*0.8 | K418: (8*LV+29)*0.71*1.5 | L418: (0.8*LV+29)*0.71*0.8 | M418: 1000*LV+100000 | N418: 0 | O418: math.max(0,(lv/10)-1) | P418: math.max(0,(lv/10)-1) | Q418: math.max(0,(lv/10)-1) | R418: 0; | S418: 有药王谷和盘丝洞的弟子在，真是不爽，还是跑路算了！ | T418: 药王谷和盘丝洞的弟子不在眼前，真是轻松愉快啊！ | U418: 0 | V418: 103026,25;103027,25;103028,25;103029,25; | W418: 2
A419: 103023 | B419: 入魔的兽王护法 | C419: hero_1001 | D419: 0 | E419: 0 | F419: 1511,100;1512,100;1513,100;1514,100; | G419: 0,0; | H419: (99*LV+100)*0.71*0.8 | I419: (25*LV+200)*0.71*0.5 | J419: (10*LV+180)*0.71 | K419: (8*LV+29)*0.71*0.5 | L419: (0.8*LV+29)*0.71*2 | M419: 1000*LV+100000 | N419: 0 | O419: math.max(0,(lv/10)-1) | P419: math.max(0,(lv/10)-1) | Q419: math.max(0,(lv/10)-1) | R419: 0; | S419: 有药王谷和盘丝洞的弟子在，真是不爽，还是跑路算了！ | T419: 药王谷和盘丝洞的弟子不在眼前，真是轻松愉快啊！ | U419: 0 | V419: 103026,25;103027,25;103028,25;103029,25; | W419: 5
A420: 103024 | B420: 入魔的狮驼供奉 | C420: hero_2001 | D420: 0 | E420: 0 | F420: 1311,100;1312,100;1315,100; | G420: 0,0; | H420: (99*LV+100)*0.71 | I420: (25*LV+200)*0.71 | J420: (10*LV+180)*0.71*0.7 | K420: (8*LV+29)*0.71*0.5 | L420: (0.8*LV+29)*0.71*1.2 | M420: 1000*LV+100000 | N420: 0 | O420: math.max(0,(lv/10)-1) | P420: math.max(0,(lv/10)-1) | Q420: math.max(0,(lv/10)-1) | R420: 0; | S420: 有药王谷和盘丝洞的弟子在，真是不爽，还是跑路算了！ | T420: 药王谷和盘丝洞的弟子不在眼前，真是轻松愉快啊！ | U420: 0 | V420: 103026,25;103027,25;103028,25;103029,25; | W420: 4
A421: 103025 | B421: 入魔的天策圣使 | C421: hero_1001 | D421: 0 | E421: 0 | F421: 1112,100;1116,100;1111,100; | G421: 0,0; | H421: (99*LV+100)*0.71 | I421: (25*LV+200)*0.71 | J421: (10*LV+180)*0.71*0.7 | K421: (8*LV+29)*0.71*0.5 | L421: (0.8*LV+29)*0.71*1.2 | M421: 1000*LV+100000 | N421: 0 | O421: math.max(0,(lv/10)-1) | P421: math.max(0,(lv/10)-1) | Q421: math.max(0,(lv/10)-1) | R421: 0; | S421: 有药王谷和盘丝洞的弟子在，真是不爽，还是跑路算了！ | T421: 药王谷和盘丝洞的弟子不在眼前，真是轻松愉快啊！ | U421: 0 | V421: 103026,25;103027,25;103028,25;103029,25; | W421: 1
A422: 103026 | B422: 奴仆 | C422: pet_62 | D422: 0 | E422: 0 | F422: 5309,100; | G422: 0,0; | H422: ((99*LV+100)*2/3)*0.71 | I422: (25*LV+200)*0.71 | J422: ((10*LV+180)*2/3)*0.71*0.7 | K422: ((8*LV+29)*2/20)*0.71*0.5 | L422: ((0.8*LV+29)*2/3)*0.71*1.2 | M422: 1000*LV+100000 | N422: 0 | O422: math.max(0,(lv/10)-1) | P422: math.max(0,(lv/10)-1) | Q422: math.max(0,(lv/10)-1) | R422: 0; | S422: 有药王谷和盘丝洞的弟子在，真是不爽，还是跑路算了！ | T422: 药王谷和盘丝洞的弟子不在眼前，真是轻松愉快啊！ | U422: 0 | V422: 0,0; | W422: 4
A423: 103027 | B423: 小怪 | C423: pet_62 | D423: 0 | E423: 0 | F423: 1411,100;1416,100; | G423: 0,0; | H423: ((99*LV+100)*2/3)*0.71 | I423: (25*LV+200)*0.71*0.5 | J423: ((10*LV+180)*2/3)*0.71*0.8 | K423: ((8*LV+29)*2/20)*0.71*1.5 | L423: ((0.8*LV+29)*2/3)*0.71*0.8 | M423: 1000*LV+100000 | N423: 0 | O423: math.max(0,(lv/10)-1) | P423: math.max(0,(lv/10)-1) | Q423: math.max(0,(lv/10)-1) | R423: 0; | S423: 有药王谷和盘丝洞的弟子在，真是不爽，还是跑路算了！ | T423: 药王谷和盘丝洞的弟子不在眼前，真是轻松愉快啊！ | U423: 0 | V423: 0,0; | W423: 2
A424: 103028 | B424: 小怪 | C424: pet_62 | D424: 0 | E424: 0 | F424: 1511,100;1514,100; | G424: 0,0; | H424: ((99*LV+100)*2/3)*0.71*0.8 | I424: (25*LV+200)*0.71*0.5 | J424: ((10*LV+180)*2/3)*0.71 | K424: ((8*LV+29)*2/20)*0.71*0.5 | L424: ((0.8*LV+29)*2/3)*0.71*2 | M424: 1000*LV+100000 | N424: 0 | O424: math.max(0,(lv/10)-1) | P424: math.max(0,(lv/10)-1) | Q424: math.max(0,(lv/10)-1) | R424: 0; | S424: 有药王谷和盘丝洞的弟子在，真是不爽，还是跑路算了！ | T424: 药王谷和盘丝洞的弟子不在眼前，真是轻松愉快啊！ | U424: 0 | V424: 0,0; | W424: 5
A425: 103029 | B425: 凶魂 | C425: pet_53 | D425: 0 | E425: 0 | F425: 5307,100; | G425: 0,0; | H425: ((99*LV+100)*2/3)*0.71 | I425: (25*LV+200)*0.71*0.5 | J425: ((10*LV+180)*2/3)*0.71*0.8 | K425: ((8*LV+29)*2/20)*0.71*1.5 | L425: ((0.8*LV+29)*2/3)*0.71*0.8 | M425: 1000*LV+100000 | N425: 0 | O425: math.max(0,(lv/10)-1) | P425: math.max(0,(lv/10)-1) | Q425: math.max(0,(lv/10)-1) | R425: 0; | S425: 有药王谷和盘丝洞的弟子在，真是不爽，还是跑路算了！ | T425: 药王谷和盘丝洞的弟子不在眼前，真是轻松愉快啊！ | U425: 0 | V425: 0,0; | W425: 1
A426: 103031 | B426: 入魔的药王长老 | C426: hero_1001 | D426: 0 | E426: 0 | F426: 1211,100;1212,100;1216,100;5310,100; | G426: 0,0; | H426: (104*LV+110)*0.85*1.2 | I426: (27*LV+220)*0.85*0.5 | J426: (12*LV+200)*0.85*1.2 | K426: (8.5*LV+32)*0.85*0.1 | L426: (1*LV+32)*0.85*1.5 | M426: 1000*LV+100000 | N426: 0 | O426: math.max(0,(lv/10)-1) | P426: math.max(0,(lv/10)-1) | Q426: math.max(0,(lv/10)-1) | R426: 0; | S426: 有药王谷和盘丝洞的弟子在，真是不爽，还是跑路算了！ | T426: 药王谷和盘丝洞的弟子不在眼前，真是轻松愉快啊！ | U426: 0 | V426: 103036,25;103037,25;103038,25;103039,25; | W426: 3
A427: 103032 | B427: 入魔的水晶长老 | C427: hero_1001 | D427: 0 | E427: 0 | F427: 1411,100;1416,100;1412,100; | G427: 0,0; | H427: (104*LV+110)*0.85 | I427: (27*LV+220)*0.85*0.5 | J427: (12*LV+200)*0.85*0.8 | K427: (8.5*LV+32)*0.85*1.5 | L427: (1*LV+32)*0.85*0.8 | M427: 1000*LV+100000 | N427: 0 | O427: math.max(0,(lv/10)-1) | P427: math.max(0,(lv/10)-1) | Q427: math.max(0,(lv/10)-1) | R427: 0; | S427: 有药王谷和盘丝洞的弟子在，真是不爽，还是跑路算了！ | T427: 药王谷和盘丝洞的弟子不在眼前，真是轻松愉快啊！ | U427: 0 | V427: 103036,25;103037,25;103038,25;103039,25; | W427: 2
A428: 103033 | B428: 入魔的兽王护法 | C428: hero_1001 | D428: 0 | E428: 0 | F428: 1511,100;1512,100;1513,100;1514,100; | G428: 0,0; | H428: (104*LV+110)*0.85*0.8 | I428: (27*LV+220)*0.85*0.5 | J428: (12*LV+200)*0.85 | K428: (8.5*LV+32)*0.85*0.5 | L428: (1*LV+32)*0.85*2 | M428: 1000*LV+100000 | N428: 0 | O428: math.max(0,(lv/10)-1) | P428: math.max(0,(lv/10)-1) | Q428: math.max(0,(lv/10)-1) | R428: 0; | S428: 有药王谷和盘丝洞的弟子在，真是不爽，还是跑路算了！ | T428: 药王谷和盘丝洞的弟子不在眼前，真是轻松愉快啊！ | U428: 0 | V428: 103036,25;103037,25;103038,25;103039,25; | W428: 5
A429: 103034 | B429: 入魔的狮驼供奉 | C429: hero_2001 | D429: 0 | E429: 0 | F429: 1311,100;1312,100;1315,100; | G429: 0,0; | H429: (104*LV+110)*0.85 | I429: (27*LV+220)*0.85 | J429: (12*LV+200)*0.85*0.7 | K429: (8.5*LV+32)*0.85*0.5 | L429: (1*LV+32)*0.85*1.2 | M429: 1000*LV+100000 | N429: 0 | O429: math.max(0,(lv/10)-1) | P429: math.max(0,(lv/10)-1) | Q429: math.max(0,(lv/10)-1) | R429: 0; | S429: 有药王谷和盘丝洞的弟子在，真是不爽，还是跑路算了！ | T429: 药王谷和盘丝洞的弟子不在眼前，真是轻松愉快啊！ | U429: 0 | V429: 103036,25;103037,25;103038,25;103039,25; | W429: 4
A430: 103035 | B430: 入魔的天策圣使 | C430: hero_1001 | D430: 0 | E430: 0 | F430: 1112,100;1116,100;1111,100; | G430: 0,0; | H430: (104*LV+110)*0.85 | I430: (27*LV+220)*0.85 | J430: (12*LV+200)*0.85*0.7 | K430: (8.5*LV+32)*0.85*0.5 | L430: (1*LV+32)*0.85*1.2 | M430: 1000*LV+100000 | N430: 0 | O430: math.max(0,(lv/10)-1) | P430: math.max(0,(lv/10)-1) | Q430: math.max(0,(lv/10)-1) | R430: 0; | S430: 有药王谷和盘丝洞的弟子在，真是不爽，还是跑路算了！ | T430: 药王谷和盘丝洞的弟子不在眼前，真是轻松愉快啊！ | U430: 0 | V430: 103036,25;103037,25;103038,25;103039,25; | W430: 1
A431: 103036 | B431: 奴仆 | C431: pet_62 | D431: 0 | E431: 0 | F431: 5309,100; | G431: 0,0; | H431: ((104*LV+110)*2/3)*0.85 | I431: (27*LV+220)*0.85 | J431: ((12*LV+200)*2/3)*0.85*0.7 | K431: ((8.5*LV+32)*2/20)*0.85*0.5 | L431: ((1*LV+32)*2/3)*0.85*1.2 | M431: 1000*LV+100000 | N431: 0 | O431: math.max(0,(lv/10)-1) | P431: math.max(0,(lv/10)-1) | Q431: math.max(0,(lv/10)-1) | R431: 0; | S431: 有药王谷和盘丝洞的弟子在，真是不爽，还是跑路算了！ | T431: 药王谷和盘丝洞的弟子不在眼前，真是轻松愉快啊！ | U431: 0 | V431: 0,0; | W431: 4
A432: 103037 | B432: 小怪 | C432: pet_62 | D432: 0 | E432: 0 | F432: 1411,100;1416,100; | G432: 0,0; | H432: ((104*LV+110)*2/3)*0.85 | I432: (27*LV+220)*0.85*0.5 | J432: ((12*LV+200)*2/3)*0.85*0.8 | K432: ((8.5*LV+32)*2/20)*0.85*1.5 | L432: ((1*LV+32)*2/3)*0.85*0.8 | M432: 1000*LV+100000 | N432: 0 | O432: math.max(0,(lv/10)-1) | P432: math.max(0,(lv/10)-1) | Q432: math.max(0,(lv/10)-1) | R432: 0; | S432: 有药王谷和盘丝洞的弟子在，真是不爽，还是跑路算了！ | T432: 药王谷和盘丝洞的弟子不在眼前，真是轻松愉快啊！ | U432: 0 | V432: 0,0; | W432: 2
A433: 103038 | B433: 小怪 | C433: pet_62 | D433: 0 | E433: 0 | F433: 1511,100;1514,100; | G433: 0,0; | H433: ((104*LV+110)*2/3)*0.85*0.8 | I433: (27*LV+220)*0.85*0.5 | J433: ((12*LV+200)*2/3)*0.85 | K433: ((8.5*LV+32)*2/20)*0.85*0.5 | L433: ((1*LV+32)*2/3)*0.85*2 | M433: 1000*LV+100000 | N433: 0 | O433: math.max(0,(lv/10)-1) | P433: math.max(0,(lv/10)-1) | Q433: math.max(0,(lv/10)-1) | R433: 0; | S433: 有药王谷和盘丝洞的弟子在，真是不爽，还是跑路算了！ | T433: 药王谷和盘丝洞的弟子不在眼前，真是轻松愉快啊！ | U433: 0 | V433: 0,0; | W433: 5
A434: 103039 | B434: 凶魂 | C434: pet_53 | D434: 0 | E434: 0 | F434: 5307,100; | G434: 0,0; | H434: ((104*LV+110)*2/3)*0.85 | I434: (27*LV+220)*0.85*0.5 | J434: ((12*LV+200)*2/3)*0.85*0.8 | K434: ((8.5*LV+32)*2/20)*0.85*1.5 | L434: ((1*LV+32)*2/3)*0.85*0.8 | M434: 1000*LV+100000 | N434: 0 | O434: math.max(0,(lv/10)-1) | P434: math.max(0,(lv/10)-1) | Q434: math.max(0,(lv/10)-1) | R434: 0; | S434: 有药王谷和盘丝洞的弟子在，真是不爽，还是跑路算了！ | T434: 药王谷和盘丝洞的弟子不在眼前，真是轻松愉快啊！ | U434: 0 | V434: 0,0; | W434: 1
A435: 103041 | B435: 入魔的药王长老 | C435: hero_1001 | D435: 0 | E435: 0 | F435: 1211,100;1212,100;1216,100;5310,100; | G435: 0,0; | H435: (109*LV+120)*1*1.2 | I435: (29*LV+240)*1*0.5 | J435: (14*LV+220)*1*1.2 | K435: (9*LV+35)*1*0.1 | L435: (1.2*LV+35)*1*1.5 | M435: 1000*LV+100000 | N435: 0 | O435: math.max(0,(lv/10)-1) | P435: math.max(0,(lv/10)-1) | Q435: math.max(0,(lv/10)-1) | R435: 0; | S435: 有药王谷和盘丝洞的弟子在，真是不爽，还是跑路算了！ | T435: 药王谷和盘丝洞的弟子不在眼前，真是轻松愉快啊！ | U435: 0 | V435: 103046,25;103047,25;103048,25;103049,25; | W435: 3
A436: 103042 | B436: 入魔的水晶长老 | C436: hero_1001 | D436: 0 | E436: 0 | F436: 1411,100;1416,100;1412,100; | G436: 0,0; | H436: (109*LV+120)*1 | I436: (29*LV+240)*1*0.5 | J436: (14*LV+220)*1*0.8 | K436: (9*LV+35)*1*1.5 | L436: (1.2*LV+35)*1*0.8 | M436: 1000*LV+100000 | N436: 0 | O436: math.max(0,(lv/10)-1) | P436: math.max(0,(lv/10)-1) | Q436: math.max(0,(lv/10)-1) | R436: 0; | S436: 有药王谷和盘丝洞的弟子在，真是不爽，还是跑路算了！ | T436: 药王谷和盘丝洞的弟子不在眼前，真是轻松愉快啊！ | U436: 0 | V436: 103046,25;103047,25;103048,25;103049,25; | W436: 2
A437: 103043 | B437: 入魔的兽王护法 | C437: hero_1001 | D437: 0 | E437: 0 | F437: 1511,100;1512,100;1513,100;1514,100; | G437: 0,0; | H437: (109*LV+120)*1*0.8 | I437: (29*LV+240)*1*0.5 | J437: (14*LV+220)*1 | K437: (9*LV+35)*1*0.5 | L437: (1.2*LV+35)*1*2 | M437: 1000*LV+100000 | N437: 0 | O437: math.max(0,(lv/10)-1) | P437: math.max(0,(lv/10)-1) | Q437: math.max(0,(lv/10)-1) | R437: 0; | S437: 有药王谷和盘丝洞的弟子在，真是不爽，还是跑路算了！ | T437: 药王谷和盘丝洞的弟子不在眼前，真是轻松愉快啊！ | U437: 0 | V437: 103046,25;103047,25;103048,25;103049,25; | W437: 5
A438: 103044 | B438: 入魔的狮驼供奉 | C438: hero_2001 | D438: 0 | E438: 0 | F438: 1311,100;1312,100;1315,100; | G438: 0,0; | H438: (109*LV+120)*1 | I438: (29*LV+240)*1 | J438: (14*LV+220)*1*0.7 | K438: (9*LV+35)*1*0.5 | L438: (1.2*LV+35)*1*1.2 | M438: 1000*LV+100000 | N438: 0 | O438: math.max(0,(lv/10)-1) | P438: math.max(0,(lv/10)-1) | Q438: math.max(0,(lv/10)-1) | R438: 0; | S438: 有药王谷和盘丝洞的弟子在，真是不爽，还是跑路算了！ | T438: 药王谷和盘丝洞的弟子不在眼前，真是轻松愉快啊！ | U438: 0 | V438: 103046,25;103047,25;103048,25;103049,25; | W438: 4
A439: 103045 | B439: 入魔的天策圣使 | C439: hero_1001 | D439: 0 | E439: 0 | F439: 1112,100;1116,100;1111,100; | G439: 0,0; | H439: (109*LV+120)*1 | I439: (29*LV+240)*1 | J439: (14*LV+220)*1*0.7 | K439: (9*LV+35)*1*0.5 | L439: (1.2*LV+35)*1*1.2 | M439: 1000*LV+100000 | N439: 0 | O439: math.max(0,(lv/10)-1) | P439: math.max(0,(lv/10)-1) | Q439: math.max(0,(lv/10)-1) | R439: 0; | S439: 有药王谷和盘丝洞的弟子在，真是不爽，还是跑路算了！ | T439: 药王谷和盘丝洞的弟子不在眼前，真是轻松愉快啊！ | U439: 0 | V439: 103046,25;103047,25;103048,25;103049,25; | W439: 1
A440: 103046 | B440: 奴仆 | C440: pet_62 | D440: 0 | E440: 0 | F440: 5309,100; | G440: 0,0; | H440: ((109*LV+120)*2/3)*1 | I440: (29*LV+240)*1 | J440: ((14*LV+220)*2/3)*1*0.7 | K440: ((9*LV+35)*2/20)*1*0.5 | L440: ((1.2*LV+35)*2/3)*1*1.2 | M440: 1000*LV+100000 | N440: 0 | O440: math.max(0,(lv/10)-1) | P440: math.max(0,(lv/10)-1) | Q440: math.max(0,(lv/10)-1) | R440: 0; | S440: 有药王谷和盘丝洞的弟子在，真是不爽，还是跑路算了！ | T440: 药王谷和盘丝洞的弟子不在眼前，真是轻松愉快啊！ | U440: 0 | V440: 0,0; | W440: 4
A441: 103047 | B441: 小怪 | C441: pet_62 | D441: 0 | E441: 0 | F441: 1411,100;1416,100; | G441: 0,0; | H441: ((109*LV+120)*2/3)*1 | I441: (29*LV+240)*1*0.5 | J441: ((14*LV+220)*2/3)*1*0.8 | K441: ((9*LV+35)*2/20)*1*1.5 | L441: ((1.2*LV+35)*2/3)*1*0.8 | M441: 1000*LV+100000 | N441: 0 | O441: math.max(0,(lv/10)-1) | P441: math.max(0,(lv/10)-1) | Q441: math.max(0,(lv/10)-1) | R441: 0; | S441: 有药王谷和盘丝洞的弟子在，真是不爽，还是跑路算了！ | T441: 药王谷和盘丝洞的弟子不在眼前，真是轻松愉快啊！ | U441: 0 | V441: 0,0; | W441: 2
A442: 103048 | B442: 小怪 | C442: pet_62 | D442: 0 | E442: 0 | F442: 1511,100;1514,100; | G442: 0,0; | H442: ((109*LV+120)*2/3)*1*0.8 | I442: (29*LV+240)*1*0.5 | J442: ((14*LV+220)*2/3)*1 | K442: ((9*LV+35)*2/20)*1*0.5 | L442: ((1.2*LV+35)*2/3)*1*2 | M442: 1000*LV+100000 | N442: 0 | O442: math.max(0,(lv/10)-1) | P442: math.max(0,(lv/10)-1) | Q442: math.max(0,(lv/10)-1) | R442: 0; | S442: 有药王谷和盘丝洞的弟子在，真是不爽，还是跑路算了！ | T442: 药王谷和盘丝洞的弟子不在眼前，真是轻松愉快啊！ | U442: 0 | V442: 0,0; | W442: 5
A443: 103049 | B443: 凶魂 | C443: pet_53 | D443: 0 | E443: 0 | F443: 5307,100; | G443: 0,0; | H443: ((109*LV+120)*2/3)*1 | I443: (29*LV+240)*1*0.5 | J443: ((14*LV+220)*2/3)*1*0.8 | K443: ((9*LV+35)*2/20)*1*1.5 | L443: ((1.2*LV+35)*2/3)*1*0.8 | M443: 1000*LV+100000 | N443: 0 | O443: math.max(0,(lv/10)-1) | P443: math.max(0,(lv/10)-1) | Q443: math.max(0,(lv/10)-1) | R443: 0; | S443: 有药王谷和盘丝洞的弟子在，真是不爽，还是跑路算了！ | T443: 药王谷和盘丝洞的弟子不在眼前，真是轻松愉快啊！ | U443: 0 | V443: 0,0; | W443: 1
A444: 103051 | B444: 入魔的药王长老 | C444: hero_1001 | D444: 0 | E444: 0 | F444: 1211,100;1212,100;1216,100;5310,100; | G444: 0,0; | H444: (114*LV+130)*1.15*1.2 | I444: (31*LV+260)*1.15*0.5 | J444: (16*LV+240)*1.15*1.2 | K444: ((9*LV+35)*2/20)*1*0.1 | L444: (1.4*LV+38)*1.15*1.5 | M444: 1000*LV+100000 | N444: 0 | O444: math.max(0,(lv/10)-1) | P444: math.max(0,(lv/10)-1) | Q444: math.max(0,(lv/10)-1) | R444: 0; | S444: 有药王谷和盘丝洞的弟子在，真是不爽，还是跑路算了！ | T444: 药王谷和盘丝洞的弟子不在眼前，真是轻松愉快啊！ | U444: 0 | V444: 103056,25;103057,25;103058,25;103059,25; | W444: 3
A445: 103052 | B445: 入魔的水晶长老 | C445: hero_1001 | D445: 0 | E445: 0 | F445: 1411,100;1416,100;1412,100; | G445: 0,0; | H445: (114*LV+130)*1.15 | I445: (31*LV+260)*1.15*0.5 | J445: (16*LV+240)*1.15*0.8 | K445: (9.5*LV+38)*1.15*1.5 | L445: (1.4*LV+38)*1.15*0.8 | M445: 1000*LV+100000 | N445: 0 | O445: math.max(0,(lv/10)-1) | P445: math.max(0,(lv/10)-1) | Q445: math.max(0,(lv/10)-1) | R445: 0; | S445: 有药王谷和盘丝洞的弟子在，真是不爽，还是跑路算了！ | T445: 药王谷和盘丝洞的弟子不在眼前，真是轻松愉快啊！ | U445: 0 | V445: 103056,25;103057,25;103058,25;103059,25; | W445: 2
A446: 103053 | B446: 入魔的兽王护法 | C446: hero_1001 | D446: 0 | E446: 0 | F446: 1511,100;1512,100;1513,100;1514,100; | G446: 0,0; | H446: (114*LV+130)*1.15*0.8 | I446: (31*LV+260)*1.15*0.5 | J446: (16*LV+240)*1.15 | K446: (9.5*LV+38)*1.15*0.5 | L446: (1.4*LV+38)*1.15*2 | M446: 1000*LV+100000 | N446: 0 | O446: math.max(0,(lv/10)-1) | P446: math.max(0,(lv/10)-1) | Q446: math.max(0,(lv/10)-1) | R446: 0; | S446: 有药王谷和盘丝洞的弟子在，真是不爽，还是跑路算了！ | T446: 药王谷和盘丝洞的弟子不在眼前，真是轻松愉快啊！ | U446: 0 | V446: 103056,25;103057,25;103058,25;103059,25; | W446: 5
A447: 103054 | B447: 入魔的狮驼供奉 | C447: hero_2001 | D447: 0 | E447: 0 | F447: 1311,100;1312,100;1315,100; | G447: 0,0; | H447: (114*LV+130)*1.15 | I447: (31*LV+260)*1.15 | J447: (16*LV+240)*1.15*0.7 | K447: (9.5*LV+38)*1.15*0.5 | L447: (1.4*LV+38)*1.15*1.2 | M447: 1000*LV+100000 | N447: 0 | O447: math.max(0,(lv/10)-1) | P447: math.max(0,(lv/10)-1) | Q447: math.max(0,(lv/10)-1) | R447: 0; | S447: 有药王谷和盘丝洞的弟子在，真是不爽，还是跑路算了！ | T447: 药王谷和盘丝洞的弟子不在眼前，真是轻松愉快啊！ | U447: 0 | V447: 103056,25;103057,25;103058,25;103059,25; | W447: 4
A448: 103055 | B448: 入魔的天策圣使 | C448: hero_1001 | D448: 0 | E448: 0 | F448: 1112,100;1116,100;1111,100; | G448: 0,0; | H448: (114*LV+130)*1.15 | I448: (31*LV+260)*1.15 | J448: (16*LV+240)*1.15*0.7 | K448: (9.5*LV+38)*1.15*0.5 | L448: (1.4*LV+38)*1.15*1.2 | M448: 1000*LV+100000 | N448: 0 | O448: math.max(0,(lv/10)-1) | P448: math.max(0,(lv/10)-1) | Q448: math.max(0,(lv/10)-1) | R448: 0; | S448: 有药王谷和盘丝洞的弟子在，真是不爽，还是跑路算了！ | T448: 药王谷和盘丝洞的弟子不在眼前，真是轻松愉快啊！ | U448: 0 | V448: 103056,25;103057,25;103058,25;103059,25; | W448: 1
A449: 103056 | B449: 奴仆 | C449: pet_62 | D449: 0 | E449: 0 | F449: 5309,100; | G449: 0,0; | H449: ((114*LV+130)*2/3)*1.15 | I449: (31*LV+260)*1.15 | J449: ((16*LV+240)*2/3)*1.15*0.7 | K449: ((9.5*LV+38)*2/20)*1.15*0.5 | L449: ((1.4*LV+38)*2/3)*1.15*1.2 | M449: 1000*LV+100000 | N449: 0 | O449: math.max(0,(lv/10)-1) | P449: math.max(0,(lv/10)-1) | Q449: math.max(0,(lv/10)-1) | R449: 0; | S449: 有药王谷和盘丝洞的弟子在，真是不爽，还是跑路算了！ | T449: 药王谷和盘丝洞的弟子不在眼前，真是轻松愉快啊！ | U449: 0 | V449: 0,0; | W449: 4
A450: 103057 | B450: 小怪 | C450: pet_62 | D450: 0 | E450: 0 | F450: 1411,100;1416,100; | G450: 0,0; | H450: ((114*LV+130)*2/3)*1.15 | I450: (31*LV+260)*1.15*0.5 | J450: ((16*LV+240)*2/3)*1.15*0.8 | K450: ((9.5*LV+38)*2/20)*1.15*1.5 | L450: ((1.4*LV+38)*2/3)*1.15*0.8 | M450: 1000*LV+100000 | N450: 0 | O450: math.max(0,(lv/10)-1) | P450: math.max(0,(lv/10)-1) | Q450: math.max(0,(lv/10)-1) | R450: 0; | S450: 有药王谷和盘丝洞的弟子在，真是不爽，还是跑路算了！ | T450: 药王谷和盘丝洞的弟子不在眼前，真是轻松愉快啊！ | U450: 0 | V450: 0,0; | W450: 2
A451: 103058 | B451: 小怪 | C451: pet_62 | D451: 0 | E451: 0 | F451: 1511,100;1514,100; | G451: 0,0; | H451: ((114*LV+130)*2/3)*1.15*0.8 | I451: (31*LV+260)*1.15*0.5 | J451: ((16*LV+240)*2/3)*1.15 | K451: ((9.5*LV+38)*2/20)*1.15*0.5 | L451: ((1.4*LV+38)*2/3)*1.15*2 | M451: 1000*LV+100000 | N451: 0 | O451: math.max(0,(lv/10)-1) | P451: math.max(0,(lv/10)-1) | Q451: math.max(0,(lv/10)-1) | R451: 0; | S451: 有药王谷和盘丝洞的弟子在，真是不爽，还是跑路算了！ | T451: 药王谷和盘丝洞的弟子不在眼前，真是轻松愉快啊！ | U451: 0 | V451: 0,0; | W451: 5
A452: 103059 | B452: 凶魂 | C452: pet_53 | D452: 0 | E452: 0 | F452: 5307,100; | G452: 0,0; | H452: ((114*LV+130)*2/3)*1.15 | I452: (31*LV+260)*1.15*0.5 | J452: ((16*LV+240)*2/3)*1.15*0.8 | K452: ((9.5*LV+38)*2/20)*1.15*1.5 | L452: ((1.4*LV+38)*2/3)*1.15*0.8 | M452: 1000*LV+100000 | N452: 0 | O452: math.max(0,(lv/10)-1) | P452: math.max(0,(lv/10)-1) | Q452: math.max(0,(lv/10)-1) | R452: 0; | S452: 有药王谷和盘丝洞的弟子在，真是不爽，还是跑路算了！ | T452: 药王谷和盘丝洞的弟子不在眼前，真是轻松愉快啊！ | U452: 0 | V452: 0,0; | W452: 1
A453: 103061 | B453: 入魔的药王长老 | C453: hero_1001 | D453: 0 | E453: 0 | F453: 1211,100;1212,100;1216,100;5310,100; | G453: 0,0; | H453: (119*LV+140)*1.29*1.2 | I453: (33*LV+280)*1.29*0.5 | J453: (18*LV+260)*1.29*1.2 | K453: (10*LV+41)*1.29*0.1 | L453: (1.6*LV+41)*1.29*1.5 | M453: 1000*LV+100000 | N453: 0 | O453: math.max(0,(lv/10)-1) | P453: math.max(0,(lv/10)-1) | Q453: math.max(0,(lv/10)-1) | R453: 0; | S453: 有药王谷和盘丝洞的弟子在，真是不爽，还是跑路算了！ | T453: 药王谷和盘丝洞的弟子不在眼前，真是轻松愉快啊！ | U453: 0 | V453: 103066,25;103067,25;103068,25;103069,25; | W453: 3
A454: 103062 | B454: 入魔的水晶长老 | C454: hero_1001 | D454: 0 | E454: 0 | F454: 1411,100;1416,100;1412,100; | G454: 0,0; | H454: (119*LV+140)*1.29 | I454: (33*LV+280)*1.29*0.5 | J454: (18*LV+260)*1.29*0.8 | K454: (10*LV+41)*1.29*1.5 | L454: (1.6*LV+41)*1.29*0.8 | M454: 1000*LV+100000 | N454: 0 | O454: math.max(0,(lv/10)-1) | P454: math.max(0,(lv/10)-1) | Q454: math.max(0,(lv/10)-1) | R454: 0; | S454: 有药王谷和盘丝洞的弟子在，真是不爽，还是跑路算了！ | T454: 药王谷和盘丝洞的弟子不在眼前，真是轻松愉快啊！ | U454: 0 | V454: 103066,25;103067,25;103068,25;103069,25; | W454: 2
A455: 103063 | B455: 入魔的兽王护法 | C455: hero_1001 | D455: 0 | E455: 0 | F455: 1511,100;1512,100;1513,100;1514,100; | G455: 0,0; | H455: (119*LV+140)*1.29*0.8 | I455: (33*LV+280)*1.29*0.5 | J455: (18*LV+260)*1.29 | K455: (10*LV+41)*1.29*0.5 | L455: (1.6*LV+41)*1.29*2 | M455: 1000*LV+100000 | N455: 0 | O455: math.max(0,(lv/10)-1) | P455: math.max(0,(lv/10)-1) | Q455: math.max(0,(lv/10)-1) | R455: 0; | S455: 有药王谷和盘丝洞的弟子在，真是不爽，还是跑路算了！ | T455: 药王谷和盘丝洞的弟子不在眼前，真是轻松愉快啊！ | U455: 0 | V455: 103066,25;103067,25;103068,25;103069,25; | W455: 5
A456: 103064 | B456: 入魔的狮驼供奉 | C456: hero_2001 | D456: 0 | E456: 0 | F456: 1311,100;1312,100;1315,100; | G456: 0,0; | H456: (119*LV+140)*1.29 | I456: (33*LV+280)*1.29 | J456: (18*LV+260)*1.29*0.7 | K456: (10*LV+41)*1.29*0.5 | L456: (1.6*LV+41)*1.29*1.2 | M456: 1000*LV+100000 | N456: 0 | O456: math.max(0,(lv/10)-1) | P456: math.max(0,(lv/10)-1) | Q456: math.max(0,(lv/10)-1) | R456: 0; | S456: 有药王谷和盘丝洞的弟子在，真是不爽，还是跑路算了！ | T456: 药王谷和盘丝洞的弟子不在眼前，真是轻松愉快啊！ | U456: 0 | V456: 103066,25;103067,25;103068,25;103069,25; | W456: 4
A457: 103065 | B457: 入魔的天策圣使 | C457: hero_1001 | D457: 0 | E457: 0 | F457: 1112,100;1116,100;1111,100; | G457: 0,0; | H457: (119*LV+140)*1.29 | I457: (33*LV+280)*1.29 | J457: (18*LV+260)*1.29*0.7 | K457: (10*LV+41)*1.29*0.5 | L457: (1.6*LV+41)*1.29*1.2 | M457: 1000*LV+100000 | N457: 0 | O457: math.max(0,(lv/10)-1) | P457: math.max(0,(lv/10)-1) | Q457: math.max(0,(lv/10)-1) | R457: 0; | S457: 有药王谷和盘丝洞的弟子在，真是不爽，还是跑路算了！ | T457: 药王谷和盘丝洞的弟子不在眼前，真是轻松愉快啊！ | U457: 0 | V457: 103066,25;103067,25;103068,25;103069,25; | W457: 1
A458: 103066 | B458: 奴仆 | C458: pet_62 | D458: 0 | E458: 0 | F458: 5309,100; | G458: 0,0; | H458: ((119*LV+140)*2/3)*1.29 | I458: (33*LV+280)*1.29 | J458: ((18*LV+260)*2/3)*1.29*0.7 | K458: ((10*LV+41)*2/20)*1.29*0.5 | L458: ((1.6*LV+41)*2/3)*1.29*1.2 | M458: 1000*LV+100000 | N458: 0 | O458: math.max(0,(lv/10)-1) | P458: math.max(0,(lv/10)-1) | Q458: math.max(0,(lv/10)-1) | R458: 0; | S458: 有药王谷和盘丝洞的弟子在，真是不爽，还是跑路算了！ | T458: 药王谷和盘丝洞的弟子不在眼前，真是轻松愉快啊！ | U458: 0 | V458: 0,0; | W458: 4
A459: 103067 | B459: 小怪 | C459: pet_62 | D459: 0 | E459: 0 | F459: 1411,100;1416,100; | G459: 0,0; | H459: ((119*LV+140)*2/3)*1.29 | I459: (33*LV+280)*1.29*0.5 | J459: ((18*LV+260)*2/3)*1.29*0.8 | K459: ((10*LV+41)*2/20)*1.29*1.5 | L459: ((1.6*LV+41)*2/3)*1.29*0.8 | M459: 1000*LV+100000 | N459: 0 | O459: math.max(0,(lv/10)-1) | P459: math.max(0,(lv/10)-1) | Q459: math.max(0,(lv/10)-1) | R459: 0; | S459: 有药王谷和盘丝洞的弟子在，真是不爽，还是跑路算了！ | T459: 药王谷和盘丝洞的弟子不在眼前，真是轻松愉快啊！ | U459: 0 | V459: 0,0; | W459: 2
A460: 103068 | B460: 小怪 | C460: pet_62 | D460: 0 | E460: 0 | F460: 1511,100;1514,100; | G460: 0,0; | H460: ((119*LV+140)*2/3)*1.29*0.8 | I460: (33*LV+280)*1.29*0.5 | J460: ((18*LV+260)*2/3)*1.29 | K460: ((10*LV+41)*2/20)*1.29*0.5 | L460: ((1.6*LV+41)*2/3)*1.29*2 | M460: 1000*LV+100000 | N460: 0 | O460: math.max(0,(lv/10)-1) | P460: math.max(0,(lv/10)-1) | Q460: math.max(0,(lv/10)-1) | R460: 0; | S460: 有药王谷和盘丝洞的弟子在，真是不爽，还是跑路算了！ | T460: 药王谷和盘丝洞的弟子不在眼前，真是轻松愉快啊！ | U460: 0 | V460: 0,0; | W460: 5
A461: 103069 | B461: 凶魂 | C461: pet_53 | D461: 0 | E461: 0 | F461: 5307,100; | G461: 0,0; | H461: ((119*LV+140)*2/3)*1.29 | I461: (33*LV+280)*1.29*0.5 | J461: ((18*LV+260)*2/3)*1.29*0.8 | K461: ((10*LV+41)*2/20)*1.29*1.5 | L461: ((1.6*LV+41)*2/3)*1.29*0.8 | M461: 1000*LV+100000 | N461: 0 | O461: math.max(0,(lv/10)-1) | P461: math.max(0,(lv/10)-1) | Q461: math.max(0,(lv/10)-1) | R461: 0; | S461: 有药王谷和盘丝洞的弟子在，真是不爽，还是跑路算了！ | T461: 药王谷和盘丝洞的弟子不在眼前，真是轻松愉快啊！ | U461: 0 | V461: 0,0; | W461: 1
A462: 103071 | B462: 入魔的药王长老 | C462: hero_1001 | D462: 0 | E462: 0 | F462: 1211,100;1212,100;1216,100;5310,100; | G462: 0,0; | H462: (124*LV+150)*1.44*1.2 | I462: (35*LV+300)*1.44*0.5 | J462: (20*LV+280)*1.44*1.2 | K462: ((10*LV+41)*2/20)*1.29*0.1 | L462: (1.8*LV+44)*1.44*1.5 | M462: 1000*LV+100000 | N462: 0 | O462: math.max(0,(lv/10)-1) | P462: math.max(0,(lv/10)-1) | Q462: math.max(0,(lv/10)-1) | R462: 0; | S462: 有药王谷和盘丝洞的弟子在，真是不爽，还是跑路算了！ | T462: 药王谷和盘丝洞的弟子不在眼前，真是轻松愉快啊！ | U462: 0 | V462: 103076,25;103077,25;103078,25;103079,25; | W462: 3
A463: 103072 | B463: 入魔的水晶长老 | C463: hero_1001 | D463: 0 | E463: 0 | F463: 1411,100;1416,100;1412,100; | G463: 0,0; | H463: (124*LV+150)*1.44 | I463: (35*LV+300)*1.44*0.5 | J463: (20*LV+280)*1.44*0.8 | K463: (10.5*LV+44)*1.44*1.5 | L463: (1.8*LV+44)*1.44*0.8 | M463: 1000*LV+100000 | N463: 0 | O463: math.max(0,(lv/10)-1) | P463: math.max(0,(lv/10)-1) | Q463: math.max(0,(lv/10)-1) | R463: 0; | S463: 有药王谷和盘丝洞的弟子在，真是不爽，还是跑路算了！ | T463: 药王谷和盘丝洞的弟子不在眼前，真是轻松愉快啊！ | U463: 0 | V463: 103076,25;103077,25;103078,25;103079,25; | W463: 2
A464: 103073 | B464: 入魔的兽王护法 | C464: hero_1001 | D464: 0 | E464: 0 | F464: 1511,100;1512,100;1513,100;1514,100; | G464: 0,0; | H464: (124*LV+150)*1.44*0.8 | I464: (35*LV+300)*1.44*0.5 | J464: (20*LV+280)*1.44 | K464: (10.5*LV+44)*1.44*0.5 | L464: (1.8*LV+44)*1.44*2 | M464: 1000*LV+100000 | N464: 0 | O464: math.max(0,(lv/10)-1) | P464: math.max(0,(lv/10)-1) | Q464: math.max(0,(lv/10)-1) | R464: 0; | S464: 有药王谷和盘丝洞的弟子在，真是不爽，还是跑路算了！ | T464: 药王谷和盘丝洞的弟子不在眼前，真是轻松愉快啊！ | U464: 0 | V464: 103076,25;103077,25;103078,25;103079,25; | W464: 5
A465: 103074 | B465: 入魔的狮驼供奉 | C465: hero_2001 | D465: 0 | E465: 0 | F465: 1311,100;1312,100;1315,100; | G465: 0,0; | H465: (124*LV+150)*1.44 | I465: (35*LV+300)*1.44 | J465: (20*LV+280)*1.44*0.7 | K465: (10.5*LV+44)*1.44*0.5 | L465: (1.8*LV+44)*1.44*1.2 | M465: 1000*LV+100000 | N465: 0 | O465: math.max(0,(lv/10)-1) | P465: math.max(0,(lv/10)-1) | Q465: math.max(0,(lv/10)-1) | R465: 0; | S465: 有药王谷和盘丝洞的弟子在，真是不爽，还是跑路算了！ | T465: 药王谷和盘丝洞的弟子不在眼前，真是轻松愉快啊！ | U465: 0 | V465: 103076,25;103077,25;103078,25;103079,25; | W465: 4
A466: 103075 | B466: 入魔的天策圣使 | C466: hero_1001 | D466: 0 | E466: 0 | F466: 1112,100;1116,100;1111,100; | G466: 0,0; | H466: (124*LV+150)*1.44 | I466: (35*LV+300)*1.44 | J466: (20*LV+280)*1.44*0.7 | K466: (10.5*LV+44)*1.44*0.5 | L466: (1.8*LV+44)*1.44*1.2 | M466: 1000*LV+100000 | N466: 0 | O466: math.max(0,(lv/10)-1) | P466: math.max(0,(lv/10)-1) | Q466: math.max(0,(lv/10)-1) | R466: 0; | S466: 有药王谷和盘丝洞的弟子在，真是不爽，还是跑路算了！ | T466: 药王谷和盘丝洞的弟子不在眼前，真是轻松愉快啊！ | U466: 0 | V466: 103076,25;103077,25;103078,25;103079,25; | W466: 1
A467: 103076 | B467: 奴仆 | C467: pet_62 | D467: 0 | E467: 0 | F467: 5309,100; | G467: 0,0; | H467: ((124*LV+150)*2/3)*1.44 | I467: (35*LV+300)*1.44 | J467: ((20*LV+280)*2/3)*1.44*0.7 | K467: ((10.5*LV+44)*2/20)*1.44*0.5 | L467: ((1.8*LV+44)*2/3)*1.44*1.2 | M467: 1000*LV+100000 | N467: 0 | O467: math.max(0,(lv/10)-1) | P467: math.max(0,(lv/10)-1) | Q467: math.max(0,(lv/10)-1) | R467: 0; | S467: 有药王谷和盘丝洞的弟子在，真是不爽，还是跑路算了！ | T467: 药王谷和盘丝洞的弟子不在眼前，真是轻松愉快啊！ | U467: 0 | V467: 0,0; | W467: 4
A468: 103077 | B468: 小怪 | C468: pet_62 | D468: 0 | E468: 0 | F468: 1411,100;1416,100; | G468: 0,0; | H468: ((124*LV+150)*2/3)*1.44 | I468: (35*LV+300)*1.44*0.5 | J468: ((20*LV+280)*2/3)*1.44*0.8 | K468: ((10.5*LV+44)*2/20)*1.44*1.5 | L468: ((1.8*LV+44)*2/3)*1.44*0.8 | M468: 1000*LV+100000 | N468: 0 | O468: math.max(0,(lv/10)-1) | P468: math.max(0,(lv/10)-1) | Q468: math.max(0,(lv/10)-1) | R468: 0; | S468: 有药王谷和盘丝洞的弟子在，真是不爽，还是跑路算了！ | T468: 药王谷和盘丝洞的弟子不在眼前，真是轻松愉快啊！ | U468: 0 | V468: 0,0; | W468: 2
A469: 103078 | B469: 小怪 | C469: pet_62 | D469: 0 | E469: 0 | F469: 1511,100;1514,100; | G469: 0,0; | H469: ((124*LV+150)*2/3)*1.44*0.8 | I469: (35*LV+300)*1.44*0.5 | J469: ((20*LV+280)*2/3)*1.44 | K469: ((10.5*LV+44)*2/20)*1.44*0.5 | L469: ((1.8*LV+44)*2/3)*1.44*2 | M469: 1000*LV+100000 | N469: 0 | O469: math.max(0,(lv/10)-1) | P469: math.max(0,(lv/10)-1) | Q469: math.max(0,(lv/10)-1) | R469: 0; | S469: 有药王谷和盘丝洞的弟子在，真是不爽，还是跑路算了！ | T469: 药王谷和盘丝洞的弟子不在眼前，真是轻松愉快啊！ | U469: 0 | V469: 0,0; | W469: 5
A470: 103079 | B470: 凶魂 | C470: pet_53 | D470: 0 | E470: 0 | F470: 5307,100; | G470: 0,0; | H470: ((124*LV+150)*2/3)*1.44 | I470: (35*LV+300)*1.44*0.5 | J470: ((20*LV+280)*2/3)*1.44*0.8 | K470: ((10.5*LV+44)*2/20)*1.44*1.5 | L470: ((1.8*LV+44)*2/3)*1.44*0.8 | M470: 1000*LV+100000 | N470: 0 | O470: math.max(0,(lv/10)-1) | P470: math.max(0,(lv/10)-1) | Q470: math.max(0,(lv/10)-1) | R470: 0; | S470: 有药王谷和盘丝洞的弟子在，真是不爽，还是跑路算了！ | T470: 药王谷和盘丝洞的弟子不在眼前，真是轻松愉快啊！ | U470: 0 | V470: 0,0; | W470: 1
A471: 103081 | B471: 入魔的药王长老 | C471: hero_1001 | D471: 0 | E471: 0 | F471: 1211,100;1212,100;1216,100;5310,100; | G471: 0,0; | H471: (129*LV+160)*1.58*1.2 | I471: (37*LV+320)*1.58*0.5 | J471: (22*LV+300)*1.58*1.2 | K471: (11*LV+47)*1.58*0.1 | L471: (2*LV+47)*1.58*1.5 | M471: 1000*LV+100000 | N471: 0 | O471: math.max(0,(lv/10)-1) | P471: math.max(0,(lv/10)-1) | Q471: math.max(0,(lv/10)-1) | R471: 0; | S471: 有药王谷和盘丝洞的弟子在，真是不爽，还是跑路算了！ | T471: 药王谷和盘丝洞的弟子不在眼前，真是轻松愉快啊！ | U471: 0 | V471: 103086,25;103087,25;103088,25;103089,25; | W471: 3
A472: 103082 | B472: 入魔的水晶长老 | C472: hero_1001 | D472: 0 | E472: 0 | F472: 1411,100;1416,100;1412,100; | G472: 0,0; | H472: (129*LV+160)*1.58 | I472: (37*LV+320)*1.58*0.5 | J472: (22*LV+300)*1.58*0.8 | K472: (11*LV+47)*1.58*1.5 | L472: (2*LV+47)*1.58*0.8 | M472: 1000*LV+100000 | N472: 0 | O472: math.max(0,(lv/10)-1) | P472: math.max(0,(lv/10)-1) | Q472: math.max(0,(lv/10)-1) | R472: 0; | S472: 有药王谷和盘丝洞的弟子在，真是不爽，还是跑路算了！ | T472: 药王谷和盘丝洞的弟子不在眼前，真是轻松愉快啊！ | U472: 0 | V472: 103086,25;103087,25;103088,25;103089,25; | W472: 2
A473: 103083 | B473: 入魔的兽王护法 | C473: hero_1001 | D473: 0 | E473: 0 | F473: 1511,100;1512,100;1513,100;1514,100; | G473: 0,0; | H473: (129*LV+160)*1.58*0.8 | I473: (37*LV+320)*1.58*0.5 | J473: (22*LV+300)*1.58 | K473: (11*LV+47)*1.58*0.5 | L473: (2*LV+47)*1.58*2 | M473: 1000*LV+100000 | N473: 0 | O473: math.max(0,(lv/10)-1) | P473: math.max(0,(lv/10)-1) | Q473: math.max(0,(lv/10)-1) | R473: 0; | S473: 有药王谷和盘丝洞的弟子在，真是不爽，还是跑路算了！ | T473: 药王谷和盘丝洞的弟子不在眼前，真是轻松愉快啊！ | U473: 0 | V473: 103086,25;103087,25;103088,25;103089,25; | W473: 5
A474: 103084 | B474: 入魔的狮驼供奉 | C474: hero_2001 | D474: 0 | E474: 0 | F474: 1311,100;1312,100;1315,100; | G474: 0,0; | H474: (129*LV+160)*1.58 | I474: (37*LV+320)*1.58 | J474: (22*LV+300)*1.58*0.7 | K474: (11*LV+47)*1.58*0.5 | L474: (2*LV+47)*1.58*1.2 | M474: 1000*LV+100000 | N474: 0 | O474: math.max(0,(lv/10)-1) | P474: math.max(0,(lv/10)-1) | Q474: math.max(0,(lv/10)-1) | R474: 0; | S474: 有药王谷和盘丝洞的弟子在，真是不爽，还是跑路算了！ | T474: 药王谷和盘丝洞的弟子不在眼前，真是轻松愉快啊！ | U474: 0 | V474: 103086,25;103087,25;103088,25;103089,25; | W474: 4
A475: 103085 | B475: 入魔的天策圣使 | C475: hero_1001 | D475: 0 | E475: 0 | F475: 1112,100;1116,100;1111,100; | G475: 0,0; | H475: (129*LV+160)*1.58 | I475: (37*LV+320)*1.58 | J475: (22*LV+300)*1.58*0.7 | K475: (11*LV+47)*1.58*0.5 | L475: (2*LV+47)*1.58*1.2 | M475: 1000*LV+100000 | N475: 0 | O475: math.max(0,(lv/10)-1) | P475: math.max(0,(lv/10)-1) | Q475: math.max(0,(lv/10)-1) | R475: 0; | S475: 有药王谷和盘丝洞的弟子在，真是不爽，还是跑路算了！ | T475: 药王谷和盘丝洞的弟子不在眼前，真是轻松愉快啊！ | U475: 0 | V475: 103086,25;103087,25;103088,25;103089,25; | W475: 1
A476: 103086 | B476: 奴仆 | C476: pet_62 | D476: 0 | E476: 0 | F476: 5309,100; | G476: 0,0; | H476: ((129*LV+160)*2/3)*1.58 | I476: (37*LV+320)*1.58 | J476: ((22*LV+300)*2/3)*1.58*0.7 | K476: ((11*LV+47)*2/20)*1.58*0.5 | L476: ((2*LV+47)*2/3)*1.58*1.2 | M476: 1000*LV+100000 | N476: 0 | O476: math.max(0,(lv/10)-1) | P476: math.max(0,(lv/10)-1) | Q476: math.max(0,(lv/10)-1) | R476: 0; | S476: 有药王谷和盘丝洞的弟子在，真是不爽，还是跑路算了！ | T476: 药王谷和盘丝洞的弟子不在眼前，真是轻松愉快啊！ | U476: 0 | V476: 0,0; | W476: 4
A477: 103087 | B477: 小怪 | C477: pet_62 | D477: 0 | E477: 0 | F477: 1411,100;1416,100; | G477: 0,0; | H477: ((129*LV+160)*2/3)*1.58 | I477: (37*LV+320)*1.58*0.5 | J477: ((22*LV+300)*2/3)*1.58*0.8 | K477: ((11*LV+47)*2/20)*1.58*1.5 | L477: ((2*LV+47)*2/3)*1.58*0.8 | M477: 1000*LV+100000 | N477: 0 | O477: math.max(0,(lv/10)-1) | P477: math.max(0,(lv/10)-1) | Q477: math.max(0,(lv/10)-1) | R477: 0; | S477: 有药王谷和盘丝洞的弟子在，真是不爽，还是跑路算了！ | T477: 药王谷和盘丝洞的弟子不在眼前，真是轻松愉快啊！ | U477: 0 | V477: 0,0; | W477: 2
A478: 103088 | B478: 小怪 | C478: pet_62 | D478: 0 | E478: 0 | F478: 1511,100;1514,100; | G478: 0,0; | H478: ((129*LV+160)*2/3)*1.58*0.8 | I478: (37*LV+320)*1.58*0.5 | J478: ((22*LV+300)*2/3)*1.58 | K478: ((11*LV+47)*2/20)*1.58*0.5 | L478: ((2*LV+47)*2/3)*1.58*2 | M478: 1000*LV+100000 | N478: 0 | O478: math.max(0,(lv/10)-1) | P478: math.max(0,(lv/10)-1) | Q478: math.max(0,(lv/10)-1) | R478: 0; | S478: 有药王谷和盘丝洞的弟子在，真是不爽，还是跑路算了！ | T478: 药王谷和盘丝洞的弟子不在眼前，真是轻松愉快啊！ | U478: 0 | V478: 0,0; | W478: 5
A479: 103089 | B479: 凶魂 | C479: pet_53 | D479: 0 | E479: 0 | F479: 5307,100; | G479: 0,0; | H479: ((129*LV+160)*2/3)*1.58 | I479: (37*LV+320)*1.58*0.5 | J479: ((22*LV+300)*2/3)*1.58*0.8 | K479: ((11*LV+47)*2/20)*1.58*1.5 | L479: ((2*LV+47)*2/3)*1.58*0.8 | M479: 1000*LV+100000 | N479: 0 | O479: math.max(0,(lv/10)-1) | P479: math.max(0,(lv/10)-1) | Q479: math.max(0,(lv/10)-1) | R479: 0; | S479: 有药王谷和盘丝洞的弟子在，真是不爽，还是跑路算了！ | T479: 药王谷和盘丝洞的弟子不在眼前，真是轻松愉快啊！ | U479: 0 | V479: 0,0; | W479: 1
A480: 104001 | B480: 九霄一层BOSS | C480: pet_73 | D480: 0 | E480: 0 | F480: 1411,100;1416,100;1412,100; | G480: 0,0; | H480: 70.5*LV+156 | I480: 17*LV+25 | J480: 4.05*LV+7 | K480: 5.4*LV+12 | L480: 0.98*LV+5.6 | M480: 1000*LV+100000 | N480: 0 | O480: math.max(0,(lv/10)-1) | P480: math.max(0,(lv/10)-1) | Q480: math.max(0,(lv/10)-1) | R480: 0; | S480: 有药王谷和盘丝洞的弟子在，真是不爽，还是跑路算了！ | T480: 药王谷和盘丝洞的弟子不在眼前，真是轻松愉快啊！ | U480: 0 | V480: 0,0; | W480: 2
A481: 104002 | B481: 九霄二层BOSS | C481: pet_81 | D481: 0 | E481: 0 | F481: 1311,100;1312,100;1315,100; | G481: 0,0; | H481: 72*LV+164 | I481: 17.2*LV+27 | J481: 4.2*LV+8 | K481: (5.7*LV+13.5)*0.1 | L481: 1.12*LV+6.4 | M481: 1000*LV+100000 | N481: 0 | O481: math.max(0,(lv/10)-1) | P481: math.max(0,(lv/10)-1) | Q481: math.max(0,(lv/10)-1) | R481: 0; | S481: 有药王谷和盘丝洞的弟子在，真是不爽，还是跑路算了！ | T481: 药王谷和盘丝洞的弟子不在眼前，真是轻松愉快啊！ | U481: 0 | V481: 0,0; | W481: 4
A482: 104003 | B482: 九霄四层BOSS | C482: pet_102 | D482: 0 | E482: 0 | F482: 1112,100;1116,100; | G482: 0,0; | H482: 73.5*LV+172 | I482: 17.4*LV+29 | J482: 4.35*LV+9 | K482: (6*LV+15)*0.1 | L482: 1.26*LV+7.2 | M482: 1000*LV+100000 | N482: 0 | O482: math.max(0,(lv/10)-1) | P482: math.max(0,(lv/10)-1) | Q482: math.max(0,(lv/10)-1) | R482: 0; | S482: 有药王谷和盘丝洞的弟子在，真是不爽，还是跑路算了！ | T482: 药王谷和盘丝洞的弟子不在眼前，真是轻松愉快啊！ | U482: 0 | V482: 0,0; | W482: 1
A483: 104004 | B483: 九霄五层BOSS | C483: pet_83 | D483: 0 | E483: 0 | F483: 1211,100;1212,100;1216,100; | G483: 0,0; | H483: 75*LV+180 | I483: 17.6*LV+31 | J483: 4.5*LV+10 | K483: 6.3*LV+16.5 | L483: 1.4*LV+8 | M483: 1000*LV+100000 | N483: 0 | O483: math.max(0,(lv/10)-1) | P483: math.max(0,(lv/10)-1) | Q483: math.max(0,(lv/10)-1) | R483: 0; | S483: 有药王谷和盘丝洞的弟子在，真是不爽，还是跑路算了！ | T483: 药王谷和盘丝洞的弟子不在眼前，真是轻松愉快啊！ | U483: 0 | V483: 0,0; | W483: 2
A484: 104005 | B484: 九霄七层BOSS | C484: pet_91 | D484: 0 | E484: 0 | F484: 1411,100;1416,100;1412,100; | G484: 0,0; | H484: 76.5*LV+188 | I484: 17.8*LV+33 | J484: 4.65*LV+11 | K484: 6.6*LV+18 | L484: 1.54*LV+8.8 | M484: 1000*LV+100000 | N484: 0 | O484: math.max(0,(lv/10)-1) | P484: math.max(0,(lv/10)-1) | Q484: math.max(0,(lv/10)-1) | R484: 0; | S484: 有药王谷和盘丝洞的弟子在，真是不爽，还是跑路算了！ | T484: 药王谷和盘丝洞的弟子不在眼前，真是轻松愉快啊！ | U484: 0 | V484: 0,0; | W484: 2
A485: 104006 | B485: 九霄八层BOSS | C485: pet_93 | D485: 0 | E485: 0 | F485: 1311,100;1312,100;1315,100; | G485: 0,0; | H485: 78*LV+196 | I485: 18*LV+35 | J485: 4.8*LV+12 | K485: (6.9*LV+19.5)*0.1 | L485: 1.68*LV+9.6 | M485: 1000*LV+100000 | N485: 0 | O485: math.max(0,(lv/10)-1) | P485: math.max(0,(lv/10)-1) | Q485: math.max(0,(lv/10)-1) | R485: 0; | S485: 有药王谷和盘丝洞的弟子在，真是不爽，还是跑路算了！ | T485: 药王谷和盘丝洞的弟子不在眼前，真是轻松愉快啊！ | U485: 0 | V485: 0,0; | W485: 4
A486: 104007 | B486: 九霄九层BOSS | C486: pet_93 | D486: 0 | E486: 0 | F486: 1112,100;1116,100; | G486: 0,0; | H486: 79.5*LV+204 | I486: 18.2*LV+37 | J486: 4.95*LV+13 | K486: (7.2*LV+21)*0.1 | L486: 1.82*LV+10.4 | M486: 1000*LV+100000 | N486: 0 | O486: math.max(0,(lv/10)-1) | P486: math.max(0,(lv/10)-1) | Q486: math.max(0,(lv/10)-1) | R486: 0; | S486: 有药王谷和盘丝洞的弟子在，真是不爽，还是跑路算了！ | T486: 药王谷和盘丝洞的弟子不在眼前，真是轻松愉快啊！ | U486: 0 | V486: 0,0; | W486: 1
A487: 104011 | B487: 九霄精英 | C487: pet_71 | D487: 0 | E487: 0 | F487: 1211,100;1212,100;1216,100; | G487: 0,0; | H487: (30*LV+165)*1.2 | I487: (11*LV+50)*0.5 | J487: (2.9*LV+28)*1.5 | K487: (4.4*LV+5)*0.5 | L487: (1.3*LV+8)*2.5 | M487: 1000*LV+100000 | N487: 0 | O487: math.max(0,(lv/10)-1) | P487: math.max(0,(lv/10)-1) | Q487: math.max(0,(lv/10)-1) | R487: 0; | S487: 有药王谷和盘丝洞的弟子在，真是不爽，还是跑路算了！ | T487: 药王谷和盘丝洞的弟子不在眼前，真是轻松愉快啊！ | U487: 0 | V487: 0,0; | W487: 2
A488: 104012 | B488: 九霄先锋 | C488: pet_3 | D488: 0 | E488: 0 | F488: 5309,100; | G488: 0,0; | H488: 30*LV+165 | I488: 11*LV+50 | J488: 2.9*LV+28 | K488: (4.4*LV+5)*0.1 | L488: 1.3*LV+8 | M488: 1000*LV+100000 | N488: 0 | O488: math.max(0,(lv/10)-1) | P488: math.max(0,(lv/10)-1) | Q488: math.max(0,(lv/10)-1) | R488: 0; | S488: 有药王谷和盘丝洞的弟子在，真是不爽，还是跑路算了！ | T488: 药王谷和盘丝洞的弟子不在眼前，真是轻松愉快啊！ | U488: 0 | V488: 0,0; | W488: 0
A489: 104013 | B489: 九霄法师 | C489: pet_83 | D489: 0 | E489: 0 | F489: 5306,100; | G489: 0,0; | H489: (30*LV+165)*0.8 | I489: (11*LV+50)*0.5 | J489: 2.9*LV+28 | K489: (4.4*LV+5)*1.2 | L489: (1.3*LV+8)*0.8 | M489: 1000*LV+100000 | N489: 0 | O489: math.max(0,(lv/10)-1) | P489: math.max(0,(lv/10)-1) | Q489: math.max(0,(lv/10)-1) | R489: 0; | S489: 有药王谷和盘丝洞的弟子在，真是不爽，还是跑路算了！ | T489: 药王谷和盘丝洞的弟子不在眼前，真是轻松愉快啊！ | U489: 0 | V489: 0,0; | W489: 0
A490: 104021 | B490: 九霄精英 | C490: pet_71 | D490: 0 | E490: 0 | F490: 1211,100;1212,100;1216,100; | G490: 0,0; | H490: (31*LV+170)*1.2 | I490: (11.2*LV+52)*0.5 | J490: (2.9*LV+28)*1.5 | K490: (4.7*LV+7)*0.5 | L490: (1.3*LV+8)*2.5 | M490: 1000*LV+100000 | N490: 0 | O490: math.max(0,(lv/10)-1) | P490: math.max(0,(lv/10)-1) | Q490: math.max(0,(lv/10)-1) | R490: 0; | S490: 有药王谷和盘丝洞的弟子在，真是不爽，还是跑路算了！ | T490: 药王谷和盘丝洞的弟子不在眼前，真是轻松愉快啊！ | U490: 0 | V490: 0,0; | W490: 2
A491: 104022 | B491: 九霄先锋 | C491: pet_3 | D491: 0 | E491: 0 | F491: 5309,100; | G491: 0,0; | H491: 31*LV+170 | I491: 11.2*LV+52 | J491: 2.9*LV+28 | K491: (4.7*LV+7)*0.1 | L491: 1.3*LV+8 | M491: 1000*LV+100000 | N491: 0 | O491: math.max(0,(lv/10)-1) | P491: math.max(0,(lv/10)-1) | Q491: math.max(0,(lv/10)-1) | R491: 0; | S491: 有药王谷和盘丝洞的弟子在，真是不爽，还是跑路算了！ | T491: 药王谷和盘丝洞的弟子不在眼前，真是轻松愉快啊！ | U491: 0 | V491: 0,0; | W491: 1
A492: 104023 | B492: 九霄法师 | C492: pet_83 | D492: 0 | E492: 0 | F492: 5306,100; | G492: 0,0; | H492: (31*LV+170)*0.8 | I492: (11.2*LV+52)*0.5 | J492: 2.9*LV+28 | K492: (4.7*LV+7)*1.2 | L492: (1.3*LV+8)*0.8 | M492: 1000*LV+100000 | N492: 0 | O492: math.max(0,(lv/10)-1) | P492: math.max(0,(lv/10)-1) | Q492: math.max(0,(lv/10)-1) | R492: 0; | S492: 有药王谷和盘丝洞的弟子在，真是不爽，还是跑路算了！ | T492: 药王谷和盘丝洞的弟子不在眼前，真是轻松愉快啊！ | U492: 0 | V492: 0,0; | W492: 4
A493: 104041 | B493: 九霄精英 | C493: pet_71 | D493: 0 | E493: 0 | F493: 1211,100;1212,100;1216,100; | G493: 0,0; | H493: (32*LV+175)*1.2 | I493: (11.4*LV+54)*0.5 | J493: (2.9*LV+28)*1.5 | K493: (5*LV+9)*0.5 | L493: (1.3*LV+8)*2.5 | M493: 1000*LV+100000 | N493: 0 | O493: math.max(0,(lv/10)-1) | P493: math.max(0,(lv/10)-1) | Q493: math.max(0,(lv/10)-1) | R493: 0; | S493: 有药王谷和盘丝洞的弟子在，真是不爽，还是跑路算了！ | T493: 药王谷和盘丝洞的弟子不在眼前，真是轻松愉快啊！ | U493: 0 | V493: 0,0; | W493: 2
A494: 104042 | B494: 九霄先锋 | C494: pet_3 | D494: 0 | E494: 0 | F494: 5309,100; | G494: 0,0; | H494: 32*LV+175 | I494: 11.4*LV+54 | J494: 2.9*LV+28 | K494: (5*LV+9)*0.1 | L494: 1.3*LV+8 | M494: 1000*LV+100000 | N494: 0 | O494: math.max(0,(lv/10)-1) | P494: math.max(0,(lv/10)-1) | Q494: math.max(0,(lv/10)-1) | R494: 0; | S494: 有药王谷和盘丝洞的弟子在，真是不爽，还是跑路算了！ | T494: 药王谷和盘丝洞的弟子不在眼前，真是轻松愉快啊！ | U494: 0 | V494: 0,0; | W494: 5
A495: 104043 | B495: 九霄法师 | C495: pet_83 | D495: 0 | E495: 0 | F495: 5306,100; | G495: 0,0; | H495: (32*LV+175)*0.8 | I495: (11.4*LV+54)*0.5 | J495: 2.9*LV+28 | K495: (5*LV+9)*1.2 | L495: (1.3*LV+8)*0.8 | M495: 1000*LV+100000 | N495: 0 | O495: math.max(0,(lv/10)-1) | P495: math.max(0,(lv/10)-1) | Q495: math.max(0,(lv/10)-1) | R495: 0; | S495: 有药王谷和盘丝洞的弟子在，真是不爽，还是跑路算了！ | T495: 药王谷和盘丝洞的弟子不在眼前，真是轻松愉快啊！ | U495: 0 | V495: 0,0; | W495: 2
A496: 104051 | B496: 九霄精英 | C496: pet_71 | D496: 0 | E496: 0 | F496: 1211,100;1212,100;1216,100; | G496: 0,0; | H496: (33*LV+180)*1.2 | I496: (11.6*LV+56)*0.5 | J496: (2.9*LV+28)*1.5 | K496: (5.3*LV+11)*0.5 | L496: (1.3*LV+8)*2.5 | M496: 1000*LV+100000 | N496: 0 | O496: math.max(0,(lv/10)-1) | P496: math.max(0,(lv/10)-1) | Q496: math.max(0,(lv/10)-1) | R496: 0; | S496: 有药王谷和盘丝洞的弟子在，真是不爽，还是跑路算了！ | T496: 药王谷和盘丝洞的弟子不在眼前，真是轻松愉快啊！ | U496: 0 | V496: 0,0; | W496: 2
A497: 104052 | B497: 九霄先锋 | C497: pet_3 | D497: 0 | E497: 0 | F497: 5309,100; | G497: 0,0; | H497: 33*LV+180 | I497: 11.6*LV+56 | J497: 2.9*LV+28 | K497: (5.3*LV+11)*0.1 | L497: 1.3*LV+8 | M497: 1000*LV+100000 | N497: 0 | O497: math.max(0,(lv/10)-1) | P497: math.max(0,(lv/10)-1) | Q497: math.max(0,(lv/10)-1) | R497: 0; | S497: 有药王谷和盘丝洞的弟子在，真是不爽，还是跑路算了！ | T497: 药王谷和盘丝洞的弟子不在眼前，真是轻松愉快啊！ | U497: 0 | V497: 0,0; | W497: 4
A498: 104053 | B498: 九霄法师 | C498: pet_83 | D498: 0 | E498: 0 | F498: 5306,100; | G498: 0,0; | H498: (33*LV+180)*0.8 | I498: (11.6*LV+56)*0.5 | J498: 2.9*LV+28 | K498: (5.3*LV+11)*1.2 | L498: (1.3*LV+8)*0.8 | M498: 1000*LV+100000 | N498: 0 | O498: math.max(0,(lv/10)-1) | P498: math.max(0,(lv/10)-1) | Q498: math.max(0,(lv/10)-1) | R498: 0; | S498: 有药王谷和盘丝洞的弟子在，真是不爽，还是跑路算了！ | T498: 药王谷和盘丝洞的弟子不在眼前，真是轻松愉快啊！ | U498: 0 | V498: 0,0; | W498: 3
A499: 104071 | B499: 九霄精英 | C499: pet_71 | D499: 0 | E499: 0 | F499: 1211,100;1212,100;1216,100; | G499: 0,0; | H499: (34*LV+185)*1.2 | I499: (11.8*LV+58)*0.5 | J499: (2.9*LV+28)*1.5 | K499: (5.6*LV+13)*0.5 | L499: (1.3*LV+8)*2.5 | M499: 1000*LV+100000 | N499: 0 | O499: math.max(0,(lv/10)-1) | P499: math.max(0,(lv/10)-1) | Q499: math.max(0,(lv/10)-1) | R499: 0; | S499: 有药王谷和盘丝洞的弟子在，真是不爽，还是跑路算了！ | T499: 药王谷和盘丝洞的弟子不在眼前，真是轻松愉快啊！ | U499: 0 | V499: 0,0; | W499: 2
A500: 104072 | B500: 九霄先锋 | C500: pet_3 | D500: 0 | E500: 0 | F500: 5309,100; | G500: 0,0; | H500: 34*LV+185 | I500: 11.8*LV+58 | J500: 2.9*LV+28 | K500: (5.6*LV+13)*0.1 | L500: 1.3*LV+8 | M500: 1000*LV+100000 | N500: 0 | O500: math.max(0,(lv/10)-1) | P500: math.max(0,(lv/10)-1) | Q500: math.max(0,(lv/10)-1) | R500: 0; | S500: 有药王谷和盘丝洞的弟子在，真是不爽，还是跑路算了！ | T500: 药王谷和盘丝洞的弟子不在眼前，真是轻松愉快啊！ | U500: 0 | V500: 0,0; | W500: 1
A501: 104073 | B501: 九霄法师 | C501: pet_83 | D501: 0 | E501: 0 | F501: 5306,100; | G501: 0,0; | H501: (34*LV+185)*0.8 | I501: (11.8*LV+58)*0.5 | J501: 2.9*LV+28 | K501: (5.6*LV+13)*1.2 | L501: (1.3*LV+8)*0.8 | M501: 1000*LV+100000 | N501: 0 | O501: math.max(0,(lv/10)-1) | P501: math.max(0,(lv/10)-1) | Q501: math.max(0,(lv/10)-1) | R501: 0; | S501: 有药王谷和盘丝洞的弟子在，真是不爽，还是跑路算了！ | T501: 药王谷和盘丝洞的弟子不在眼前，真是轻松愉快啊！ | U501: 0 | V501: 0,0; | W501: 4
A502: 104081 | B502: 九霄精英 | C502: pet_71 | D502: 0 | E502: 0 | F502: 1211,100;1212,100;1216,100; | G502: 0,0; | H502: (35*LV+190)*1.2 | I502: (12*LV+60)*0.5 | J502: (2.9*LV+28)*1.5 | K502: (5.9*LV+15)*0.5 | L502: (1.3*LV+8)*2.5 | M502: 1000*LV+100000 | N502: 0 | O502: math.max(0,(lv/10)-1) | P502: math.max(0,(lv/10)-1) | Q502: math.max(0,(lv/10)-1) | R502: 0; | S502: 有药王谷和盘丝洞的弟子在，真是不爽，还是跑路算了！ | T502: 药王谷和盘丝洞的弟子不在眼前，真是轻松愉快啊！ | U502: 0 | V502: 0,0; | W502: 2
A503: 104082 | B503: 九霄先锋 | C503: pet_3 | D503: 0 | E503: 0 | F503: 5309,100; | G503: 0,0; | H503: 35*LV+190 | I503: 12*LV+60 | J503: 2.9*LV+28 | K503: (5.9*LV+15)*0.1 | L503: 1.3*LV+8 | M503: 1000*LV+100000 | N503: 0 | O503: math.max(0,(lv/10)-1) | P503: math.max(0,(lv/10)-1) | Q503: math.max(0,(lv/10)-1) | R503: 0; | S503: 有药王谷和盘丝洞的弟子在，真是不爽，还是跑路算了！ | T503: 药王谷和盘丝洞的弟子不在眼前，真是轻松愉快啊！ | U503: 0 | V503: 0,0; | W503: 5
A504: 104083 | B504: 九霄法师 | C504: pet_83 | D504: 0 | E504: 0 | F504: 5306,100; | G504: 0,0; | H504: (35*LV+190)*0.8 | I504: (12*LV+60)*0.5 | J504: 2.9*LV+28 | K504: (5.9*LV+15)*1.2 | L504: (1.3*LV+8)*0.8 | M504: 1000*LV+100000 | N504: 0 | O504: math.max(0,(lv/10)-1) | P504: math.max(0,(lv/10)-1) | Q504: math.max(0,(lv/10)-1) | R504: 0; | S504: 有药王谷和盘丝洞的弟子在，真是不爽，还是跑路算了！ | T504: 药王谷和盘丝洞的弟子不在眼前，真是轻松愉快啊！ | U504: 0 | V504: 0,0; | W504: 2
A505: 104091 | B505: 九霄精英 | C505: pet_71 | D505: 0 | E505: 0 | F505: 1211,100;1212,100;1216,100; | G505: 0,0; | H505: (36*LV+195)*1.2 | I505: (12.2*LV+62)*0.5 | J505: (2.9*LV+28)*1.5 | K505: (6.2*LV+17)*0.5 | L505: (1.3*LV+8)*2.5 | M505: 1000*LV+100000 | N505: 0 | O505: math.max(0,(lv/10)-1) | P505: math.max(0,(lv/10)-1) | Q505: math.max(0,(lv/10)-1) | R505: 0; | S505: 有药王谷和盘丝洞的弟子在，真是不爽，还是跑路算了！ | T505: 药王谷和盘丝洞的弟子不在眼前，真是轻松愉快啊！ | U505: 0 | V505: 0,0; | W505: 2
A506: 104092 | B506: 九霄先锋 | C506: pet_3 | D506: 0 | E506: 0 | F506: 5309,100; | G506: 0,0; | H506: 36*LV+195 | I506: 12.2*LV+62 | J506: 2.9*LV+28 | K506: (6.2*LV+17)*0.1 | L506: 1.3*LV+8 | M506: 1000*LV+100000 | N506: 0 | O506: math.max(0,(lv/10)-1) | P506: math.max(0,(lv/10)-1) | Q506: math.max(0,(lv/10)-1) | R506: 0; | S506: 有药王谷和盘丝洞的弟子在，真是不爽，还是跑路算了！ | T506: 药王谷和盘丝洞的弟子不在眼前，真是轻松愉快啊！ | U506: 0 | V506: 0,0; | W506: 4
A507: 104093 | B507: 九霄法师 | C507: pet_83 | D507: 0 | E507: 0 | F507: 5306,100; | G507: 0,0; | H507: (36*LV+195)*0.8 | I507: (12.2*LV+62)*0.5 | J507: 2.9*LV+28 | K507: (6.2*LV+17)*1.2 | L507: (1.3*LV+8)*0.8 | M507: 1000*LV+100000 | N507: 0 | O507: math.max(0,(lv/10)-1) | P507: math.max(0,(lv/10)-1) | Q507: math.max(0,(lv/10)-1) | R507: 0; | S507: 有药王谷和盘丝洞的弟子在，真是不爽，还是跑路算了！ | T507: 药王谷和盘丝洞的弟子不在眼前，真是轻松愉快啊！ | U507: 0 | V507: 0,0; | W507: 3
A508: 105001 | B508: 试炼一层BOSS | C508: hero_1001 | D508: 0 | E508: 0 | F508: 1411,100;1416,100;1412,100; | G508: 0,0; | H508: 70*LV+100 | I508: 17*LV+25 | J508: 4.05*LV+7 | K508: 4.8*LV+9 | L508: 0.84*LV+4.8 | M508: 1000*LV+100000 | N508: 0 | O508: math.max(0,(lv/10)-1) | P508: math.max(0,(lv/10)-1) | Q508: math.max(0,(lv/10)-1) | R508: 0; | S508: 有药王谷和盘丝洞的弟子在，真是不爽，还是跑路算了！ | T508: 药王谷和盘丝洞的弟子不在眼前，真是轻松愉快啊！ | U508: 0 | V508: 0,0; | W508: 2
A509: 105002 | B509: 试炼二层BOSS | C509: hero_1001 | D509: 0 | E509: 0 | F509: 1112,100;1116,100; | G509: 0,0; | H509: 71*LV+105 | I509: 17.2*LV+27 | J509: 4.2*LV+8 | K509: 5.1*LV+10.5 | L509: 0.98*LV+5.6 | M509: 1000*LV+100000 | N509: 0 | O509: math.max(0,(lv/10)-1) | P509: math.max(0,(lv/10)-1) | Q509: math.max(0,(lv/10)-1) | R509: 0; | S509: 有药王谷和盘丝洞的弟子在，真是不爽，还是跑路算了！ | T509: 药王谷和盘丝洞的弟子不在眼前，真是轻松愉快啊！ | U509: 0 | V509: 0,0; | W509: 1
A510: 105003 | B510: 试炼三层BOSS | C510: hero_1001 | D510: 0 | E510: 0 | F510: 1311,100;1312,100;1315,100; | G510: 0,0; | H510: 72*LV+110 | I510: 17.4*LV+29 | J510: 4.35*LV+9 | K510: 5.4*LV+12 | L510: 1.12*LV+6.4 | M510: 1000*LV+100000 | N510: 0 | O510: math.max(0,(lv/10)-1) | P510: math.max(0,(lv/10)-1) | Q510: math.max(0,(lv/10)-1) | R510: 0; | S510: 有药王谷和盘丝洞的弟子在，真是不爽，还是跑路算了！ | T510: 药王谷和盘丝洞的弟子不在眼前，真是轻松愉快啊！ | U510: 0 | V510: 0,0; | W510: 4
A511: 105004 | B511: 试炼四层BOSS | C511: hero_1001 | D511: 0 | E511: 0 | F511: 1211,100;1212,100;1216,100; | G511: 0,0; | H511: 73*LV+115 | I511: 17.6*LV+31 | J511: 4.5*LV+10 | K511: 5.7*LV+13.5 | L511: 1.26*LV+7.2 | M511: 1000*LV+100000 | N511: 0 | O511: math.max(0,(lv/10)-1) | P511: math.max(0,(lv/10)-1) | Q511: math.max(0,(lv/10)-1) | R511: 0; | S511: 有药王谷和盘丝洞的弟子在，真是不爽，还是跑路算了！ | T511: 药王谷和盘丝洞的弟子不在眼前，真是轻松愉快啊！ | U511: 0 | V511: 0,0; | W511: 2
A512: 105005 | B512: 试炼五层BOSS | C512: hero_1001 | D512: 0 | E512: 0 | F512: 1511,100;1512,100;1513,100;1514,100; | G512: 0,0; | H512: 74*LV+120 | I512: 17.8*LV+33 | J512: 4.65*LV+11 | K512: 6*LV+15 | L512: (1.4*LV+8)*2.5 | M512: 1000*LV+100000 | N512: 0 | O512: math.max(0,(lv/10)-1) | P512: math.max(0,(lv/10)-1) | Q512: math.max(0,(lv/10)-1) | R512: 0; | S512: 有药王谷和盘丝洞的弟子在，真是不爽，还是跑路算了！ | T512: 药王谷和盘丝洞的弟子不在眼前，真是轻松愉快啊！ | U512: 0 | V512: 0,0; | W512: 5
A513: 105006 | B513: 试炼六层BOSS | C513: hero_1001 | D513: 0 | E513: 0 | F513: 1411,100;1416,100;1412,100; | G513: 0,0; | H513: 75*LV+125 | I513: 18*LV+35 | J513: 4.8*LV+12 | K513: 6.3*LV+16.5 | L513: 1.54*LV+8.8 | M513: 1000*LV+100000 | N513: 0 | O513: math.max(0,(lv/10)-1) | P513: math.max(0,(lv/10)-1) | Q513: math.max(0,(lv/10)-1) | R513: 0; | S513: 有药王谷和盘丝洞的弟子在，真是不爽，还是跑路算了！ | T513: 药王谷和盘丝洞的弟子不在眼前，真是轻松愉快啊！ | U513: 0 | V513: 0,0; | W513: 2
A514: 105007 | B514: 试炼七层BOSS | C514: hero_1001 | D514: 0 | E514: 0 | F514: 1112,100;1116,100; | G514: 0,0; | H514: 76*LV+130 | I514: 18.2*LV+37 | J514: 4.95*LV+13 | K514: 6.6*LV+18 | L514: 1.68*LV+9.6 | M514: 1000*LV+100000 | N514: 0 | O514: math.max(0,(lv/10)-1) | P514: math.max(0,(lv/10)-1) | Q514: math.max(0,(lv/10)-1) | R514: 0; | S514: 有药王谷和盘丝洞的弟子在，真是不爽，还是跑路算了！ | T514: 药王谷和盘丝洞的弟子不在眼前，真是轻松愉快啊！ | U514: 0 | V514: 0,0; | W514: 1
A515: 105008 | B515: 试炼八层BOSS | C515: hero_1001 | D515: 0 | E515: 0 | F515: 1311,100;1312,100;1315,100; | G515: 0,0; | H515: 77*LV+135 | I515: 18.4*LV+39 | J515: 5.1*LV+14 | K515: 6.9*LV+19.5 | L515: 1.82*LV+10.4 | M515: 1000*LV+100000 | N515: 0 | O515: math.max(0,(lv/10)-1) | P515: math.max(0,(lv/10)-1) | Q515: math.max(0,(lv/10)-1) | R515: 0; | S515: 有药王谷和盘丝洞的弟子在，真是不爽，还是跑路算了！ | T515: 药王谷和盘丝洞的弟子不在眼前，真是轻松愉快啊！ | U515: 0 | V515: 0,0; | W515: 4
A516: 105009 | B516: 试炼九层BOSS | C516: hero_1001 | D516: 0 | E516: 0 | F516: 1211,100;1212,100;1216,100; | G516: 0,0; | H516: 78*LV+140 | I516: 18.6*LV+41 | J516: 5.5*LV+14 | K516: 7.2*LV+21 | L516: 1.96*LV+11.2 | M516: 1000*LV+100000 | N516: 0 | O516: math.max(0,(lv/10)-1) | P516: math.max(0,(lv/10)-1) | Q516: math.max(0,(lv/10)-1) | R516: 0; | S516: 有药王谷和盘丝洞的弟子在，真是不爽，还是跑路算了！ | T516: 药王谷和盘丝洞的弟子不在眼前，真是轻松愉快啊！ | U516: 0 | V516: 0,0; | W516: 2
A517: 105010 | B517: 试炼一层怪物 | C517: pet_61 | D517: 0 | E517: 0 | F517: 1411,100;1416,100;1412,100; | G517: 0,0; | H517: (30*LV+65)*0.8 | I517: (11*LV+50)*0.5 | J517: 2.9*LV+28 | K517: (4.4*LV+5)*1.2 | L517: (1.3*LV+8)*0.8 | M517: 1000*LV+100000 | N517: 0 | O517: math.max(0,(lv/10)-1) | P517: math.max(0,(lv/10)-1) | Q517: math.max(0,(lv/10)-1) | R517: 0; | S517: 有药王谷和盘丝洞的弟子在，真是不爽，还是跑路算了！ | T517: 药王谷和盘丝洞的弟子不在眼前，真是轻松愉快啊！ | U517: 0 | V517: 0,0; | W517: 2
A518: 105011 | B518: 试炼二层怪物 | C518: pet_42 | D518: 0 | E518: 0 | F518: 1112,100;1116,100; | G518: 0,0; | H518: 31*LV+70 | I518: 11.2*LV+52 | J518: 2.9*LV+28 | K518: (4.7*LV+7)*0.1 | L518: 1.3*LV+8 | M518: 1000*LV+100000 | N518: 0 | O518: math.max(0,(lv/10)-1) | P518: math.max(0,(lv/10)-1) | Q518: math.max(0,(lv/10)-1) | R518: 0; | S518: 有药王谷和盘丝洞的弟子在，真是不爽，还是跑路算了！ | T518: 药王谷和盘丝洞的弟子不在眼前，真是轻松愉快啊！ | U518: 0 | V518: 0,0; | W518: 1
A519: 105012 | B519: 试炼三层怪物 | C519: pet_61 | D519: 0 | E519: 0 | F519: 1311,100;1312,100;1315,100; | G519: 0,0; | H519: 32*LV+75 | I519: 11.4*LV+54 | J519: 2.9*LV+28 | K519: (5*LV+9)*0.1 | L519: 1.3*LV+8 | M519: 1000*LV+100000 | N519: 0 | O519: math.max(0,(lv/10)-1) | P519: math.max(0,(lv/10)-1) | Q519: math.max(0,(lv/10)-1) | R519: 0; | S519: 有药王谷和盘丝洞的弟子在，真是不爽，还是跑路算了！ | T519: 药王谷和盘丝洞的弟子不在眼前，真是轻松愉快啊！ | U519: 0 | V519: 0,0; | W519: 4
A520: 105013 | B520: 试炼四层怪物 | C520: pet_83 | D520: 0 | E520: 0 | F520: 1211,100;1212,100;1216,100; | G520: 0,0; | H520: (33*LV+80)*1.2 | I520: (11.6*LV+56)*0.5 | J520: (2.9*LV+28)*1.5 | K520: (5.3*LV+11)*0.5 | L520: (1.3*LV+8)*2.5 | M520: 1000*LV+100000 | N520: 0 | O520: math.max(0,(lv/10)-1) | P520: math.max(0,(lv/10)-1) | Q520: math.max(0,(lv/10)-1) | R520: 0; | S520: 有药王谷和盘丝洞的弟子在，真是不爽，还是跑路算了！ | T520: 药王谷和盘丝洞的弟子不在眼前，真是轻松愉快啊！ | U520: 0 | V520: 0,0; | W520: 2
A521: 105014 | B521: 试炼五层怪物 | C521: pet_52 | D521: 0 | E521: 0 | F521: 1511,100;1512,100;1513,100;1514,100; | G521: 0,0; | H521: (34*LV+85)*1.2 | I521: (11.8*LV+58)*0.5 | J521: 2.9*LV+28 | K521: (5.6*LV+13)*1.2 | L521: (1.3*LV+8)*2.5 | M521: 1000*LV+100000 | N521: 0 | O521: math.max(0,(lv/10)-1) | P521: math.max(0,(lv/10)-1) | Q521: math.max(0,(lv/10)-1) | R521: 0; | S521: 有药王谷和盘丝洞的弟子在，真是不爽，还是跑路算了！ | T521: 药王谷和盘丝洞的弟子不在眼前，真是轻松愉快啊！ | U521: 0 | V521: 0,0; | W521: 5
A522: 105015 | B522: 试炼六层怪物 | C522: pet_53 | D522: 0 | E522: 0 | F522: 1411,100;1416,100;1412,100; | G522: 0,0; | H522: (35*LV+90)*0.8 | I522: (12*LV+60)*0.5 | J522: 2.9*LV+28 | K522: (5.9*LV+15)*1.2 | L522: (1.3*LV+8)*0.8 | M522: 1000*LV+100000 | N522: 0 | O522: math.max(0,(lv/10)-1) | P522: math.max(0,(lv/10)-1) | Q522: math.max(0,(lv/10)-1) | R522: 0; | S522: 有药王谷和盘丝洞的弟子在，真是不爽，还是跑路算了！ | T522: 药王谷和盘丝洞的弟子不在眼前，真是轻松愉快啊！ | U522: 0 | V522: 0,0; | W522: 2
A523: 105016 | B523: 试炼七层怪物 | C523: pet_61 | D523: 0 | E523: 0 | F523: 1112,100;1116,100; | G523: 0,0; | H523: 36*LV+95 | I523: 12.2*LV+62 | J523: 2.9*LV+28 | K523: (6.2*LV+17)*0.1 | L523: 1.3*LV+8 | M523: 1000*LV+100000 | N523: 0 | O523: math.max(0,(lv/10)-1) | P523: math.max(0,(lv/10)-1) | Q523: math.max(0,(lv/10)-1) | R523: 0; | S523: 有药王谷和盘丝洞的弟子在，真是不爽，还是跑路算了！ | T523: 药王谷和盘丝洞的弟子不在眼前，真是轻松愉快啊！ | U523: 0 | V523: 0,0; | W523: 1
A524: 105017 | B524: 试炼八层怪物 | C524: pet_62 | D524: 0 | E524: 0 | F524: 1311,100;1312,100;1315,100; | G524: 0,0; | H524: 37*LV+100 | I524: 12.4*LV+64 | J524: 2.9*LV+28 | K524: (6.5*LV+19)*0.1 | L524: 1.3*LV+8 | M524: 1000*LV+100000 | N524: 0 | O524: math.max(0,(lv/10)-1) | P524: math.max(0,(lv/10)-1) | Q524: math.max(0,(lv/10)-1) | R524: 0; | S524: 有药王谷和盘丝洞的弟子在，真是不爽，还是跑路算了！ | T524: 药王谷和盘丝洞的弟子不在眼前，真是轻松愉快啊！ | U524: 0 | V524: 0,0; | W524: 4
A525: 105018 | B525: 试炼九层怪物 | C525: pet_63 | D525: 0 | E525: 0 | F525: 1211,100;1212,100; | G525: 0,0; | H525: (38*LV+105)*1.2 | I525: (12.6*LV+66)*0.5 | J525: (2.9*LV+28)*1.5 | K525: (6.8*LV+21)*0.5 | L525: (1.3*LV+8)*2.5 | M525: 1000*LV+100000 | N525: 0 | O525: math.max(0,(lv/10)-1) | P525: math.max(0,(lv/10)-1) | Q525: math.max(0,(lv/10)-1) | R525: 0; | S525: 有药王谷和盘丝洞的弟子在，真是不爽，还是跑路算了！ | T525: 药王谷和盘丝洞的弟子不在眼前，真是轻松愉快啊！ | U525: 0 | V525: 0,0; | W525: 3
A526: 106001 | B526: 天下无双BOSS | C526: pet_93 | D526: 0 | E526: 0 | F526: 1511,80;1518,20; | G526: 0,0; | H526: 150*LV+80 | I526: 12.8*LV+40 | J526: 1.5*LV+10 | K526: 3*LV+15 | L526: 1.4*LV+8 | M526: 1000*LV+100000 | N526: 0 | O526: math.max(0,(lv/5)-1) | P526: math.max(0,(lv/5)-1) | Q526: math.max(0,(lv/5)-1) | R526: 0; | S526: 有药王谷和盘丝洞的弟子在，真是不爽，还是跑路算了！ | T526: 药王谷和盘丝洞的弟子不在眼前，真是轻松愉快啊！ | U526: 0 | V526: 0,0; | W526: 5
A527: 108001 | B527: 1☆妖兽首领 | C527: pet_72 | D527: 0 | E527: 0 | F527: 1513,100;1511,100; | G527: 0,0; | H527: 49*LV+48 | I527: 11*LV+25 | J527: 3.9*LV+6 | K527: 5.8*LV+9 | L527: (0.84*LV+4.8)*2.5 | M527: 1000*LV+100000 | N527: 0 | O527: math.max(0,(lv/5)-1) | P527: math.max(0,(lv/5)-1) | Q527: math.max(0,(lv/5)-1) | R527: 0; | S527: 有药王谷和盘丝洞的弟子在，真是不爽，还是跑路算了！ | T527: 药王谷和盘丝洞的弟子不在眼前，真是轻松愉快啊！ | U527: 0 | V527: 0,0; | W527: 5
A528: 108002 | B528: 2☆妖兽首领 | C528: pet_72 | D528: 0 | E528: 0 | F528: 1513,100;1511,100; | G528: 0,0; | H528: (50.5*LV+56)*1.07 | I528: (11.2*LV+28)*1.07 | J528: (4.05*LV+7) | K528: (6.1*LV+10.5)*1.07 | L528: (0.98*LV+5.6)*1.07*2.5 | M528: 1000*LV+100000 | N528: 0 | O528: math.max(0,(lv/5)-1) | P528: math.max(0,(lv/5)-1) | Q528: math.max(0,(lv/5)-1) | R528: 0; | S528: 有药王谷和盘丝洞的弟子在，真是不爽，还是跑路算了！ | T528: 药王谷和盘丝洞的弟子不在眼前，真是轻松愉快啊！ | U528: 0 | V528: 0,0; | W528: 5
A529: 108003 | B529: 3☆妖兽首领 | C529: pet_72 | D529: 0 | E529: 0 | F529: 1513,100;1511,100; | G529: 0,0; | H529: (52*LV+64)*1.14 | I529: (11.4*LV+31)*1.14 | J529: (4.2*LV+8) | K529: (6.4*LV+12)*1.14 | L529: (1.12*LV+6.4)*1.14*2.5 | M529: 1000*LV+100000 | N529: 0 | O529: math.max(0,(lv/5)-1) | P529: math.max(0,(lv/5)-1) | Q529: math.max(0,(lv/5)-1) | R529: 0; | S529: 有药王谷和盘丝洞的弟子在，真是不爽，还是跑路算了！ | T529: 药王谷和盘丝洞的弟子不在眼前，真是轻松愉快啊！ | U529: 0 | V529: 0,0; | W529: 5
A530: 108004 | B530: 4☆妖兽首领 | C530: pet_72 | D530: 0 | E530: 0 | F530: 1513,100;1511,100; | G530: 0,0; | H530: (53.5*LV+72)*1.21 | I530: (11.6*LV+34)*1.21 | J530: (4.35*LV+9) | K530: (6.7*LV+13.5)*1.21 | L530: (1.26*LV+7.2)*1.21*2.5 | M530: 1000*LV+100000 | N530: 0 | O530: math.max(0,(lv/5)-1) | P530: math.max(0,(lv/5)-1) | Q530: math.max(0,(lv/5)-1) | R530: 0; | S530: 有药王谷和盘丝洞的弟子在，真是不爽，还是跑路算了！ | T530: 药王谷和盘丝洞的弟子不在眼前，真是轻松愉快啊！ | U530: 0 | V530: 0,0; | W530: 5
A531: 108005 | B531: 5☆妖兽首领 | C531: pet_72 | D531: 0 | E531: 0 | F531: 1513,100;1511,100; | G531: 0,0; | H531: (55*LV+80)*1.28 | I531: (11.8*LV+37)*1.28 | J531: (4.5*LV+10) | K531: (7*LV+15)*1.28 | L531: (1.4*LV+8)*1.28*2.5 | M531: 1000*LV+100000 | N531: 0 | O531: math.max(0,(lv/5)-1) | P531: math.max(0,(lv/5)-1) | Q531: math.max(0,(lv/5)-1) | R531: 0; | S531: 有药王谷和盘丝洞的弟子在，真是不爽，还是跑路算了！ | T531: 药王谷和盘丝洞的弟子不在眼前，真是轻松愉快啊！ | U531: 0 | V531: 0,0; | W531: 5
A532: 108006 | B532: 6☆妖兽首领 | C532: pet_72 | D532: 0 | E532: 0 | F532: 1513,100;1511,100; | G532: 0,0; | H532: (56.5*LV+88)*1.4 | I532: (12*LV+40)*1.4 | J532: (4.65*LV+11) | K532: (7.3*LV+16.5)*1.4 | L532: (1.54*LV+8.8)*1.4*2.5 | M532: 1000*LV+100000 | N532: 0 | O532: math.max(0,(lv/5)-1) | P532: math.max(0,(lv/5)-1) | Q532: math.max(0,(lv/5)-1) | R532: 0; | S532: 有药王谷和盘丝洞的弟子在，真是不爽，还是跑路算了！ | T532: 药王谷和盘丝洞的弟子不在眼前，真是轻松愉快啊！ | U532: 0 | V532: 0,0; | W532: 5
A533: 108007 | B533: 7☆妖兽首领 | C533: pet_72 | D533: 0 | E533: 0 | F533: 1513,100;1511,100; | G533: 0,0; | H533: (58*LV+96)*1.55 | I533: (12.2*LV+43)*1.55 | J533: (4.8*LV+12) | K533: (7.6*LV+18)*1.55 | L533: (1.68*LV+9.6)*1.55*2.5 | M533: 1000*LV+100000 | N533: 0 | O533: math.max(0,(lv/5)-1) | P533: math.max(0,(lv/5)-1) | Q533: math.max(0,(lv/5)-1) | R533: 0; | S533: 有药王谷和盘丝洞的弟子在，真是不爽，还是跑路算了！ | T533: 药王谷和盘丝洞的弟子不在眼前，真是轻松愉快啊！ | U533: 0 | V533: 0,0; | W533: 5
A534: 108008 | B534: 8☆妖兽首领 | C534: pet_72 | D534: 0 | E534: 0 | F534: 1513,100;1511,100; | G534: 0,0; | H534: (69.5*LV+104)*1.75 | I534: (11.5*LV+46)*1.75 | J534: (4.95*LV+13) | K534: (7.9*LV+19.5)*1.75 | L534: (1.82*LV+10.4)*1.75*2.5 | M534: 1000*LV+100000 | N534: 0 | O534: math.max(0,(lv/5)-1) | P534: math.max(0,(lv/5)-1) | Q534: math.max(0,(lv/5)-1) | R534: 0; | S534: 有药王谷和盘丝洞的弟子在，真是不爽，还是跑路算了！ | T534: 药王谷和盘丝洞的弟子不在眼前，真是轻松愉快啊！ | U534: 0 | V534: 0,0; | W534: 5
A535: 108009 | B535: 9☆妖兽首领 | C535: pet_72 | D535: 0 | E535: 0 | F535: 1513,100;1511,100; | G535: 0,0; | H535: (71*LV+112)*2 | I535: (12.6*LV+49)*2 | J535: (5.1*LV+14) | K535: (8.2*LV+21)*2 | L535: (1.96*LV+11.2)*2*2.5 | M535: 1000*LV+100000 | N535: 0 | O535: math.max(0,(lv/5)-1) | P535: math.max(0,(lv/5)-1) | Q535: math.max(0,(lv/5)-1) | R535: 0; | S535: 有药王谷和盘丝洞的弟子在，真是不爽，还是跑路算了！ | T535: 药王谷和盘丝洞的弟子不在眼前，真是轻松愉快啊！ | U535: 0 | V535: 0,0; | W535: 5
A536: 108111 | B536: 妖兽精英 | C536: pet_71 | D536: 0 | E536: 0 | F536: 1211,100;1212,100; | G536: 0,0; | H536: (26*LV+30)*1.2 | I536: (11.4*LV+31)*0.5 | J536: (3.9*LV+10)*1.1 | K536: (5.8*LV+9)*0.5 | L536: (0.8*LV+8)*1.2 | M536: 1000*LV+100000 | N536: 0 | O536: math.max(0,(lv/5)-1) | P536: math.max(0,(lv/5)-1) | Q536: math.max(0,(lv/5)-1) | R536: 0; | S536: 有药王谷和盘丝洞的弟子在，真是不爽，还是跑路算了！ | T536: 药王谷和盘丝洞的弟子不在眼前，真是轻松愉快啊！ | U536: 0 | V536: 0,0; | W536: 3
A537: 108112 | B537: 妖兽战士 | C537: pet_3 | D537: 0 | E537: 0 | F537: 5309,100; | G537: 5115,100; | H537: 26*LV+30 | I537: 11.4*LV+31 | J537: (3.9*LV+10) | K537: (5.8*LV+9)*0.5*0.1 | L537: 0.8*LV+8 | M537: 1000*LV+100000 | N537: 0 | O537: math.max(0,(lv/5)-1) | P537: math.max(0,(lv/5)-1) | Q537: math.max(0,(lv/5)-1) | R537: 0; | S537: 有药王谷和盘丝洞的弟子在，真是不爽，还是跑路算了！ | T537: 药王谷和盘丝洞的弟子不在眼前，真是轻松愉快啊！ | U537: 0 | V537: 0,0; | W537: 0
A538: 108113 | B538: 妖兽法师 | C538: pet_72 | D538: 0 | E538: 0 | F538: 5306,100; | G538: 5115,100; | H538: (26*LV+30)*0.8 | I538: (11.4*LV+31)*0.5 | J538: (3.9*LV+10)*0.8 | K538: (5.8*LV+9)*1.5 | L538: (0.8*LV+8)*0.8 | M538: 1000*LV+100000 | N538: 0 | O538: math.max(0,(lv/5)-1) | P538: math.max(0,(lv/5)-1) | Q538: math.max(0,(lv/5)-1) | R538: 0; | S538: 有药王谷和盘丝洞的弟子在，真是不爽，还是跑路算了！ | T538: 药王谷和盘丝洞的弟子不在眼前，真是轻松愉快啊！ | U538: 0 | V538: 0,0; | W538: 0
A539: 108114 | B539: 妖兽勇士 | C539: pet_201 | D539: 0 | E539: 0 | F539: 0,0; | G539: 5115,100;5201,100;5202,100;5205,100; | H539: 26*LV+30 | I539: 11.4*LV+31 | J539: (3.9*LV+10) | K539: (5.8*LV+9)*0.5*0.1 | L539: 0.8*LV+8 | M539: 1000*LV+100000 | N539: 0 | O539: math.max(0,(lv/5)-1) | P539: math.max(0,(lv/5)-1) | Q539: math.max(0,(lv/5)-1) | R539: 0; | S539: 有药王谷和盘丝洞的弟子在，真是不爽，还是跑路算了！ | T539: 药王谷和盘丝洞的弟子不在眼前，真是轻松愉快啊！ | U539: 0 | V539: 0,0; | W539: 0
A540: 108121 | B540: 妖兽精英 | C540: pet_71 | D540: 0 | E540: 0 | F540: 1211,100;1212,100; | G540: 0,0; | H540: (26*LV+30)*1.07*1.2 | I540: (11.4*LV+31)*1.07*0.5 | J540: (3.9*LV+10)*1.1 | K540: (6.1*LV+10.5)*1.07*0.5 | L540: (0.8*LV+8)*1.07*1.2 | M540: 1000*LV+100000 | N540: 0 | O540: math.max(0,(lv/5)-1) | P540: math.max(0,(lv/5)-1) | Q540: math.max(0,(lv/5)-1) | R540: 0; | S540: 有药王谷和盘丝洞的弟子在，真是不爽，还是跑路算了！ | T540: 药王谷和盘丝洞的弟子不在眼前，真是轻松愉快啊！ | U540: 0 | V540: 0,0; | W540: 3
A541: 108122 | B541: 妖兽战士 | C541: pet_3 | D541: 0 | E541: 0 | F541: 5309,100; | G541: 5115,100; | H541: (26*LV+30)*1.07 | I541: (11.4*LV+31)*1.07 | J541: (3.9*LV+10) | K541: (6.1*LV+10.5)*1.07*0.5*0.1 | L541: (0.8*LV+8)*1.07 | M541: 1000*LV+100000 | N541: 0 | O541: math.max(0,(lv/5)-1) | P541: math.max(0,(lv/5)-1) | Q541: math.max(0,(lv/5)-1) | R541: 0; | S541: 有药王谷和盘丝洞的弟子在，真是不爽，还是跑路算了！ | T541: 药王谷和盘丝洞的弟子不在眼前，真是轻松愉快啊！ | U541: 0 | V541: 0,0; | W541: 0
A542: 108123 | B542: 妖兽法师 | C542: pet_72 | D542: 0 | E542: 0 | F542: 5306,100; | G542: 5115,100; | H542: (26*LV+30)*1.07*0.8 | I542: (11.4*LV+31)*1.07*0.5 | J542: (3.9*LV+10)*0.8 | K542: (6.1*LV+10.5)*1.07*1.5 | L542: (0.8*LV+8)*1.07*0.8 | M542: 1000*LV+100000 | N542: 0 | O542: math.max(0,(lv/5)-1) | P542: math.max(0,(lv/5)-1) | Q542: math.max(0,(lv/5)-1) | R542: 0; | S542: 有药王谷和盘丝洞的弟子在，真是不爽，还是跑路算了！ | T542: 药王谷和盘丝洞的弟子不在眼前，真是轻松愉快啊！ | U542: 0 | V542: 0,0; | W542: 0
A543: 108124 | B543: 妖兽勇士 | C543: pet_201 | D543: 0 | E543: 0 | F543: 0,0; | G543: 5115,100;5201,100;5202,100;5205,100; | H543: (26*LV+30)*1.07 | I543: (11.4*LV+31)*1.07 | J543: (3.9*LV+10) | K543: (6.1*LV+10.5)*1.07*0.5*0.1 | L543: (0.8*LV+8)*1.07 | M543: 1000*LV+100000 | N543: 0 | O543: math.max(0,(lv/5)-1) | P543: math.max(0,(lv/5)-1) | Q543: math.max(0,(lv/5)-1) | R543: 0; | S543: 有药王谷和盘丝洞的弟子在，真是不爽，还是跑路算了！ | T543: 药王谷和盘丝洞的弟子不在眼前，真是轻松愉快啊！ | U543: 0 | V543: 0,0; | W543: 0
A544: 108131 | B544: 妖兽精英 | C544: pet_71 | D544: 0 | E544: 0 | F544: 1211,100;1212,100; | G544: 0,0; | H544: (26*LV+30)*1.14*1.2 | I544: (11.4*LV+31)*1.14*0.5 | J544: (3.9*LV+10)*1.1 | K544: (6.4*LV+12)*1.14*0.5 | L544: (0.8*LV+8)*1.14*1.2 | M544: 1000*LV+100000 | N544: 0 | O544: math.max(0,(lv/5)-1) | P544: math.max(0,(lv/5)-1) | Q544: math.max(0,(lv/5)-1) | R544: 0; | S544: 有药王谷和盘丝洞的弟子在，真是不爽，还是跑路算了！ | T544: 药王谷和盘丝洞的弟子不在眼前，真是轻松愉快啊！ | U544: 0 | V544: 0,0; | W544: 3
A545: 108132 | B545: 妖兽战士 | C545: pet_3 | D545: 0 | E545: 0 | F545: 5309,100; | G545: 5115,100; | H545: (26*LV+30)*1.14 | I545: (11.4*LV+31)*1.14 | J545: (3.9*LV+10) | K545: (6.4*LV+12)*1.14*0.5*0.1 | L545: (0.8*LV+8)*1.14 | M545: 1000*LV+100000 | N545: 0 | O545: math.max(0,(lv/5)-1) | P545: math.max(0,(lv/5)-1) | Q545: math.max(0,(lv/5)-1) | R545: 0; | S545: 有药王谷和盘丝洞的弟子在，真是不爽，还是跑路算了！ | T545: 药王谷和盘丝洞的弟子不在眼前，真是轻松愉快啊！ | U545: 0 | V545: 0,0; | W545: 0
A546: 108133 | B546: 妖兽法师 | C546: pet_72 | D546: 0 | E546: 0 | F546: 5306,100; | G546: 5115,100; | H546: (26*LV+30)*1.14*0.8 | I546: (11.4*LV+31)*1.14*0.5 | J546: (3.9*LV+10)*0.8 | K546: (6.4*LV+12)*1.14*1.5 | L546: (0.8*LV+8)*1.14*0.8 | M546: 1000*LV+100000 | N546: 0 | O546: math.max(0,(lv/5)-1) | P546: math.max(0,(lv/5)-1) | Q546: math.max(0,(lv/5)-1) | R546: 0; | S546: 有药王谷和盘丝洞的弟子在，真是不爽，还是跑路算了！ | T546: 药王谷和盘丝洞的弟子不在眼前，真是轻松愉快啊！ | U546: 0 | V546: 0,0; | W546: 0
A547: 108134 | B547: 妖兽勇士 | C547: pet_201 | D547: 0 | E547: 0 | F547: 0,0; | G547: 5115,100;5201,100;5202,100;5205,100; | H547: (26*LV+30)*1.14 | I547: (11.4*LV+31)*1.14 | J547: (3.9*LV+10) | K547: (6.4*LV+12)*1.14*0.5*0.1 | L547: (0.8*LV+8)*1.14 | M547: 1000*LV+100000 | N547: 0 | O547: math.max(0,(lv/5)-1) | P547: math.max(0,(lv/5)-1) | Q547: math.max(0,(lv/5)-1) | R547: 0; | S547: 有药王谷和盘丝洞的弟子在，真是不爽，还是跑路算了！ | T547: 药王谷和盘丝洞的弟子不在眼前，真是轻松愉快啊！ | U547: 0 | V547: 0,0; | W547: 0
A548: 108141 | B548: 妖兽精英 | C548: pet_71 | D548: 0 | E548: 0 | F548: 1211,100;1212,100; | G548: 0,0; | H548: (35*LV+60)*1.21*1.2 | I548: (12*LV+40)*1.21*0.5 | J548: (3.9*LV+10)*1.1 | K548: (6.7*LV+13.5)*1.21*0.5 | L548: (0.8*LV+8)*1.21*1.2 | M548: 1000*LV+100000 | N548: 0 | O548: math.max(0,(lv/5)-1) | P548: math.max(0,(lv/5)-1) | Q548: math.max(0,(lv/5)-1) | R548: 0; | S548: 有药王谷和盘丝洞的弟子在，真是不爽，还是跑路算了！ | T548: 药王谷和盘丝洞的弟子不在眼前，真是轻松愉快啊！ | U548: 0 | V548: 0,0; | W548: 3
A549: 108142 | B549: 妖兽战士 | C549: pet_3 | D549: 0 | E549: 0 | F549: 5309,100; | G549: 5115,100; | H549: (35*LV+60)*1.21 | I549: (12*LV+40)*1.21 | J549: (3.9*LV+10) | K549: (6.7*LV+13.5)*1.21*0.5*0.1 | L549: (0.8*LV+8)*1.21 | M549: 1000*LV+100000 | N549: 0 | O549: math.max(0,(lv/5)-1) | P549: math.max(0,(lv/5)-1) | Q549: math.max(0,(lv/5)-1) | R549: 0; | S549: 有药王谷和盘丝洞的弟子在，真是不爽，还是跑路算了！ | T549: 药王谷和盘丝洞的弟子不在眼前，真是轻松愉快啊！ | U549: 0 | V549: 0,0; | W549: 0
A550: 108143 | B550: 妖兽法师 | C550: pet_72 | D550: 0 | E550: 0 | F550: 5306,100; | G550: 5115,100; | H550: (35*LV+60)*1.21*0.8 | I550: (12*LV+40)*1.21*0.5 | J550: (3.9*LV+10)*0.8 | K550: (6.7*LV+13.5)*1.21*1.5 | L550: (0.8*LV+8)*1.21*0.8 | M550: 1000*LV+100000 | N550: 0 | O550: math.max(0,(lv/5)-1) | P550: math.max(0,(lv/5)-1) | Q550: math.max(0,(lv/5)-1) | R550: 0; | S550: 有药王谷和盘丝洞的弟子在，真是不爽，还是跑路算了！ | T550: 药王谷和盘丝洞的弟子不在眼前，真是轻松愉快啊！ | U550: 0 | V550: 0,0; | W550: 0
A551: 108144 | B551: 妖兽勇士 | C551: pet_201 | D551: 0 | E551: 0 | F551: 0,0; | G551: 5115,100;5201,100;5202,100;5205,100; | H551: (35*LV+60)*1.21 | I551: (12*LV+40)*1.21 | J551: (3.9*LV+10) | K551: (6.7*LV+13.5)*1.21*0.5*0.1 | L551: (0.8*LV+8)*1.21 | M551: 1000*LV+100000 | N551: 0 | O551: math.max(0,(lv/5)-1) | P551: math.max(0,(lv/5)-1) | Q551: math.max(0,(lv/5)-1) | R551: 0; | S551: 有药王谷和盘丝洞的弟子在，真是不爽，还是跑路算了！ | T551: 药王谷和盘丝洞的弟子不在眼前，真是轻松愉快啊！ | U551: 0 | V551: 0,0; | W551: 0
A552: 108151 | B552: 妖兽精英 | C552: pet_71 | D552: 0 | E552: 0 | F552: 1211,100;1212,100; | G552: 0,0; | H552: (35*LV+60)*1.28*1.2 | I552: (12*LV+40)*1.28*0.5 | J552: (3.9*LV+10)*1.1 | K552: (7*LV+15)*1.28*0.5 | L552: (0.8*LV+8)*1.28*1.2 | M552: 1000*LV+100000 | N552: 0 | O552: math.max(0,(lv/5)-1) | P552: math.max(0,(lv/5)-1) | Q552: math.max(0,(lv/5)-1) | R552: 0; | S552: 有药王谷和盘丝洞的弟子在，真是不爽，还是跑路算了！ | T552: 药王谷和盘丝洞的弟子不在眼前，真是轻松愉快啊！ | U552: 0 | V552: 0,0; | W552: 3
A553: 108152 | B553: 妖兽战士 | C553: pet_3 | D553: 0 | E553: 0 | F553: 5309,100; | G553: 5115,100; | H553: (35*LV+60)*1.28 | I553: (12*LV+40)*1.28 | J553: (3.9*LV+10) | K553: (7*LV+15)*1.28*0.5*0.1 | L553: (0.8*LV+8)*1.28 | M553: 1000*LV+100000 | N553: 0 | O553: math.max(0,(lv/5)-1) | P553: math.max(0,(lv/5)-1) | Q553: math.max(0,(lv/5)-1) | R553: 0; | S553: 有药王谷和盘丝洞的弟子在，真是不爽，还是跑路算了！ | T553: 药王谷和盘丝洞的弟子不在眼前，真是轻松愉快啊！ | U553: 0 | V553: 0,0; | W553: 0
A554: 108153 | B554: 妖兽法师 | C554: pet_72 | D554: 0 | E554: 0 | F554: 5306,100; | G554: 5115,100; | H554: (35*LV+60)*1.28*0.8 | I554: (12*LV+40)*1.28*0.5 | J554: (3.9*LV+10)*0.8 | K554: (7*LV+15)*1.28*1.5 | L554: (0.8*LV+8)*1.28*0.8 | M554: 1000*LV+100000 | N554: 0 | O554: math.max(0,(lv/5)-1) | P554: math.max(0,(lv/5)-1) | Q554: math.max(0,(lv/5)-1) | R554: 0; | S554: 有药王谷和盘丝洞的弟子在，真是不爽，还是跑路算了！ | T554: 药王谷和盘丝洞的弟子不在眼前，真是轻松愉快啊！ | U554: 0 | V554: 0,0; | W554: 0
A555: 108154 | B555: 妖兽勇士 | C555: pet_201 | D555: 0 | E555: 0 | F555: 0,0; | G555: 5115,100;5201,100;5202,100;5205,100; | H555: (35*LV+60)*1.28 | I555: (12*LV+40)*1.28 | J555: (3.9*LV+10) | K555: (7*LV+15)*1.28*0.5*0.1 | L555: (0.8*LV+8)*1.28 | M555: 1000*LV+100000 | N555: 0 | O555: math.max(0,(lv/5)-1) | P555: math.max(0,(lv/5)-1) | Q555: math.max(0,(lv/5)-1) | R555: 0; | S555: 有药王谷和盘丝洞的弟子在，真是不爽，还是跑路算了！ | T555: 药王谷和盘丝洞的弟子不在眼前，真是轻松愉快啊！ | U555: 0 | V555: 0,0; | W555: 0
A556: 108161 | B556: 妖兽精英 | C556: pet_71 | D556: 0 | E556: 0 | F556: 1211,100;1212,100; | G556: 0,0; | H556: (35*LV+60)*1.4*1.2 | I556: (12*LV+40)*1.4*0.5 | J556: (3.9*LV+10)*1.1 | K556: (7.3*LV+16.5)*1.4*0.5 | L556: (0.8*LV+8)*1.4*1.2 | M556: 1000*LV+100000 | N556: 0 | O556: math.max(0,(lv/5)-1) | P556: math.max(0,(lv/5)-1) | Q556: math.max(0,(lv/5)-1) | R556: 0; | S556: 有药王谷和盘丝洞的弟子在，真是不爽，还是跑路算了！ | T556: 药王谷和盘丝洞的弟子不在眼前，真是轻松愉快啊！ | U556: 0 | V556: 0,0; | W556: 3
A557: 108162 | B557: 妖兽战士 | C557: pet_3 | D557: 0 | E557: 0 | F557: 5309,100; | G557: 5115,100; | H557: (35*LV+60)*1.4 | I557: (12*LV+40)*1.4 | J557: (3.9*LV+10) | K557: (7.3*LV+16.5)*1.4*0.5*0.1 | L557: (0.8*LV+8)*1.4 | M557: 1000*LV+100000 | N557: 0 | O557: math.max(0,(lv/5)-1) | P557: math.max(0,(lv/5)-1) | Q557: math.max(0,(lv/5)-1) | R557: 0; | S557: 有药王谷和盘丝洞的弟子在，真是不爽，还是跑路算了！ | T557: 药王谷和盘丝洞的弟子不在眼前，真是轻松愉快啊！ | U557: 0 | V557: 0,0; | W557: 0
A558: 108163 | B558: 妖兽法师 | C558: pet_72 | D558: 0 | E558: 0 | F558: 5306,100; | G558: 5115,100; | H558: (35*LV+60)*1.4*0.8 | I558: (12*LV+40)*1.4*0.5 | J558: (3.9*LV+10)*0.8 | K558: (7.3*LV+16.5)*1.4*1.5 | L558: (0.8*LV+8)*1.4*0.8 | M558: 1000*LV+100000 | N558: 0 | O558: math.max(0,(lv/5)-1) | P558: math.max(0,(lv/5)-1) | Q558: math.max(0,(lv/5)-1) | R558: 0; | S558: 有药王谷和盘丝洞的弟子在，真是不爽，还是跑路算了！ | T558: 药王谷和盘丝洞的弟子不在眼前，真是轻松愉快啊！ | U558: 0 | V558: 0,0; | W558: 0
A559: 108164 | B559: 妖兽勇士 | C559: pet_201 | D559: 0 | E559: 0 | F559: 0,0; | G559: 5115,100;5201,100;5202,100;5205,100; | H559: (35*LV+60)*1.4 | I559: (12*LV+40)*1.4 | J559: (3.9*LV+10) | K559: (7.3*LV+16.5)*1.4*0.5*0.1 | L559: (0.8*LV+8)*1.4 | M559: 1000*LV+100000 | N559: 0 | O559: math.max(0,(lv/5)-1) | P559: math.max(0,(lv/5)-1) | Q559: math.max(0,(lv/5)-1) | R559: 0; | S559: 有药王谷和盘丝洞的弟子在，真是不爽，还是跑路算了！ | T559: 药王谷和盘丝洞的弟子不在眼前，真是轻松愉快啊！ | U559: 0 | V559: 0,0; | W559: 0
A560: 108171 | B560: 妖兽精英 | C560: pet_71 | D560: 0 | E560: 0 | F560: 1211,100;1212,100; | G560: 0,0; | H560: (44*LV+90)*1.55*1.2 | I560: (12.6*LV+49)*1.55*0.5 | J560: (3.9*LV+10)*1.1 | K560: (7.6*LV+18)*1.55*0.5 | L560: (0.8*LV+8)*1.55*1.2 | M560: 1000*LV+100000 | N560: 0 | O560: math.max(0,(lv/5)-1) | P560: math.max(0,(lv/5)-1) | Q560: math.max(0,(lv/5)-1) | R560: 0; | S560: 有药王谷和盘丝洞的弟子在，真是不爽，还是跑路算了！ | T560: 药王谷和盘丝洞的弟子不在眼前，真是轻松愉快啊！ | U560: 0 | V560: 0,0; | W560: 3
A561: 108172 | B561: 妖兽战士 | C561: pet_3 | D561: 0 | E561: 0 | F561: 5309,100; | G561: 5115,100; | H561: (44*LV+90)*1.55 | I561: (12.6*LV+49)*1.55 | J561: (3.9*LV+10) | K561: (7.6*LV+18)*1.55*0.5*0.1 | L561: (0.8*LV+8)*1.55 | M561: 1000*LV+100000 | N561: 0 | O561: math.max(0,(lv/5)-1) | P561: math.max(0,(lv/5)-1) | Q561: math.max(0,(lv/5)-1) | R561: 0; | S561: 有药王谷和盘丝洞的弟子在，真是不爽，还是跑路算了！ | T561: 药王谷和盘丝洞的弟子不在眼前，真是轻松愉快啊！ | U561: 0 | V561: 0,0; | W561: 0
A562: 108173 | B562: 妖兽法师 | C562: pet_72 | D562: 0 | E562: 0 | F562: 5306,100; | G562: 5115,100; | H562: (44*LV+90)*1.55*0.8 | I562: (12.6*LV+49)*1.55*0.5 | J562: (3.9*LV+10)*0.8 | K562: (7.6*LV+18)*1.55*1.5 | L562: (0.8*LV+8)*1.55*0.8 | M562: 1000*LV+100000 | N562: 0 | O562: math.max(0,(lv/5)-1) | P562: math.max(0,(lv/5)-1) | Q562: math.max(0,(lv/5)-1) | R562: 0; | S562: 有药王谷和盘丝洞的弟子在，真是不爽，还是跑路算了！ | T562: 药王谷和盘丝洞的弟子不在眼前，真是轻松愉快啊！ | U562: 0 | V562: 0,0; | W562: 0
A563: 108174 | B563: 妖兽勇士 | C563: pet_201 | D563: 0 | E563: 0 | F563: 0,0; | G563: 5115,100;5201,100;5202,100;5205,100; | H563: (44*LV+90)*1.55 | I563: (12.6*LV+49)*1.55 | J563: (3.9*LV+10) | K563: (7.6*LV+18)*1.55*0.5*0.1 | L563: (0.8*LV+8)*1.55 | M563: 1000*LV+100000 | N563: 0 | O563: math.max(0,(lv/5)-1) | P563: math.max(0,(lv/5)-1) | Q563: math.max(0,(lv/5)-1) | R563: 0; | S563: 有药王谷和盘丝洞的弟子在，真是不爽，还是跑路算了！ | T563: 药王谷和盘丝洞的弟子不在眼前，真是轻松愉快啊！ | U563: 0 | V563: 0,0; | W563: 0
A564: 108181 | B564: 妖兽精英 | C564: pet_71 | D564: 0 | E564: 0 | F564: 1211,100;1212,100; | G564: 0,0; | H564: (44*LV+90)*1.75*1.2 | I564: (12.6*LV+49)*1.75*0.5 | J564: (3.9*LV+10)*1.1 | K564: (7.9*LV+19.5)*1.75*0.5 | L564: (0.8*LV+8)*1.75*1.2 | M564: 1000*LV+100000 | N564: 0 | O564: math.max(0,(lv/5)-1) | P564: math.max(0,(lv/5)-1) | Q564: math.max(0,(lv/5)-1) | R564: 0; | S564: 有药王谷和盘丝洞的弟子在，真是不爽，还是跑路算了！ | T564: 药王谷和盘丝洞的弟子不在眼前，真是轻松愉快啊！ | U564: 0 | V564: 0,0; | W564: 3
A565: 108182 | B565: 妖兽战士 | C565: pet_3 | D565: 0 | E565: 0 | F565: 5309,100; | G565: 5115,100; | H565: (44*LV+90)*1.75 | I565: (12.6*LV+49)*1.75 | J565: (3.9*LV+10) | K565: (7.9*LV+19.5)*1.75*0.5*0.1 | L565: (0.8*LV+8)*1.75 | M565: 1000*LV+100000 | N565: 0 | O565: math.max(0,(lv/5)-1) | P565: math.max(0,(lv/5)-1) | Q565: math.max(0,(lv/5)-1) | R565: 0; | S565: 有药王谷和盘丝洞的弟子在，真是不爽，还是跑路算了！ | T565: 药王谷和盘丝洞的弟子不在眼前，真是轻松愉快啊！ | U565: 0 | V565: 0,0; | W565: 4
A566: 108183 | B566: 妖兽法师 | C566: pet_72 | D566: 0 | E566: 0 | F566: 5306,100; | G566: 5115,100; | H566: (44*LV+90)*1.75*0.8 | I566: (12.6*LV+49)*1.75*0.5 | J566: (3.9*LV+10)*0.8 | K566: (7.9*LV+19.5)*1.75*1.5 | L566: (0.8*LV+8)*1.75*0.8 | M566: 1000*LV+100000 | N566: 0 | O566: math.max(0,(lv/5)-1) | P566: math.max(0,(lv/5)-1) | Q566: math.max(0,(lv/5)-1) | R566: 0; | S566: 有药王谷和盘丝洞的弟子在，真是不爽，还是跑路算了！ | T566: 药王谷和盘丝洞的弟子不在眼前，真是轻松愉快啊！ | U566: 0 | V566: 0,0; | W566: 0
A567: 108184 | B567: 妖兽勇士 | C567: pet_201 | D567: 0 | E567: 0 | F567: 0,0; | G567: 5115,100;5201,100;5202,100;5205,100; | H567: (44*LV+90)*1.75 | I567: (12.6*LV+49)*1.75 | J567: (3.9*LV+10) | K567: (7.9*LV+19.5)*1.75*0.5*0.1 | L567: (0.8*LV+8)*1.75 | M567: 1000*LV+100000 | N567: 0 | O567: math.max(0,(lv/5)-1) | P567: math.max(0,(lv/5)-1) | Q567: math.max(0,(lv/5)-1) | R567: 0; | S567: 有药王谷和盘丝洞的弟子在，真是不爽，还是跑路算了！ | T567: 药王谷和盘丝洞的弟子不在眼前，真是轻松愉快啊！ | U567: 0 | V567: 0,0; | W567: 1
A568: 108191 | B568: 妖兽精英 | C568: pet_71 | D568: 0 | E568: 0 | F568: 1211,100;1212,100; | G568: 0,0; | H568: (44*LV+90)*2*1.2 | I568: (12.6*LV+49)*2*0.5 | J568: (3.9*LV+10)*1.1 | K568: (8.2*LV+21)*2*0.5 | L568: (0.8*LV+8)*2*1.2 | M568: 1000*LV+100000 | N568: 0 | O568: math.max(0,(lv/5)-1) | P568: math.max(0,(lv/5)-1) | Q568: math.max(0,(lv/5)-1) | R568: 0; | S568: 有药王谷和盘丝洞的弟子在，真是不爽，还是跑路算了！ | T568: 药王谷和盘丝洞的弟子不在眼前，真是轻松愉快啊！ | U568: 0 | V568: 0,0; | W568: 3
A569: 108192 | B569: 妖兽战士 | C569: pet_3 | D569: 0 | E569: 0 | F569: 5309,100; | G569: 5115,100; | H569: (44*LV+90)*2 | I569: (12.6*LV+49)*2 | J569: (3.9*LV+10) | K569: (8.2*LV+21)*2*0.5*0.1 | L569: (0.8*LV+8)*2 | M569: 1000*LV+100000 | N569: 0 | O569: math.max(0,(lv/5)-1) | P569: math.max(0,(lv/5)-1) | Q569: math.max(0,(lv/5)-1) | R569: 0; | S569: 有药王谷和盘丝洞的弟子在，真是不爽，还是跑路算了！ | T569: 药王谷和盘丝洞的弟子不在眼前，真是轻松愉快啊！ | U569: 0 | V569: 0,0; | W569: 0
A570: 108193 | B570: 妖兽法师 | C570: pet_72 | D570: 0 | E570: 0 | F570: 5306,100; | G570: 5115,100; | H570: (44*LV+90)*2*0.8 | I570: (12.6*LV+49)*2*0.5 | J570: (3.9*LV+10)*0.8 | K570: (8.2*LV+21)*2*1.5 | L570: (0.8*LV+8)*2*0.8 | M570: 1000*LV+100000 | N570: 0 | O570: math.max(0,(lv/5)-1) | P570: math.max(0,(lv/5)-1) | Q570: math.max(0,(lv/5)-1) | R570: 0; | S570: 有药王谷和盘丝洞的弟子在，真是不爽，还是跑路算了！ | T570: 药王谷和盘丝洞的弟子不在眼前，真是轻松愉快啊！ | U570: 0 | V570: 0,0; | W570: 0
A571: 108194 | B571: 妖兽勇士 | C571: pet_201 | D571: 0 | E571: 0 | F571: 0,0; | G571: 5115,100;5201,100;5202,100;5205,100; | H571: (44*LV+90)*2 | I571: (12.6*LV+49)*2 | J571: (3.9*LV+10) | K571: (8.2*LV+21)*2*0.5*0.1 | L571: (0.8*LV+8)*2 | M571: 1000*LV+100000 | N571: 0 | O571: math.max(0,(lv/5)-1) | P571: math.max(0,(lv/5)-1) | Q571: math.max(0,(lv/5)-1) | R571: 0; | S571: 有药王谷和盘丝洞的弟子在，真是不爽，还是跑路算了！ | T571: 药王谷和盘丝洞的弟子不在眼前，真是轻松愉快啊！ | U571: 0 | V571: 0,0; | W571: 0
A572: 100 | B572: 狐妖 | C572: partner_1009 | D572: 0 | E572: 0 | F572: 1211,100;1212,100;1213,100; | G572: 0,0; | H572: 50*LV+250 | I572: (10*LV+20)*1 | J572: 1.5*LV+23 | K572: 4*LV+8 | L572: LV+8 | M572: 1000*LV+100000 | N572: 0 | O572: math.max(0,(lv/10)-1) | P572: math.max(0,(lv/10)-1) | Q572: math.max(0,(lv/10)-1) | R572: 0; | S572: 有药王谷和盘丝洞的弟子在，真是不爽，还是跑路算了！ | T572: 药王谷和盘丝洞的弟子不在眼前，真是轻松愉快啊！ | U572: 0 | V572: 0,0; | W572: 3
A573: 101 | B573: 幻影派弟子 | C573: hero_1001 | D573: 0 | E573: 0 | F573: 5302,100; | G573: 0,0; | H573: 25*LV+125 | I573: (6*LV+10)*0.99 | J573: 0.9*LV+10 | K573: 2*LV+4 | L573: 0.8*LV+8 | M573: 1000*LV+100000 | N573: 0 | O573: math.max(0,(lv/10)-1) | P573: math.max(0,(lv/10)-1) | Q573: math.max(0,(lv/10)-1) | R573: 0; | S573: 有药王谷和盘丝洞的弟子在，真是不爽，还是跑路算了！ | T573: 药王谷和盘丝洞的弟子不在眼前，真是轻松愉快啊！ | U573: 0 | V573: 0,0; | W573: 0
A574: 102001 | B574: 降妖除魔 | C574: pet_42 | D574: 0 | E574: 0 | F574: 1311,80;1312,20; | G574: 0,0; | H574: 70*LV+40 | I574: 8*LV+75 | J574: 2.25*LV+15 | K574: (6.5*LV+15)*0.1 | L574: 1.4*LV+8 | M574: 1000*LV+100000 | N574: 0 | O574: math.max(0,(lv/10)-1) | P574: math.max(0,(lv/10)-1) | Q574: math.max(0,(lv/10)-1) | R574: 0; | S574: 有药王谷和盘丝洞的弟子在，真是不爽，还是跑路算了！ | T574: 药王谷和盘丝洞的弟子不在眼前，真是轻松愉快啊！ | U574: 0 | V574: 0,0; | W574: 4
A575: 102002 | B575: 降妖除魔 | C575: pet_72 | D575: 0 | E575: 0 | F575: 1411,80;1412,20; | G575: 0,0; | H575: 70*LV+40 | I575: 8*LV+75 | J575: 1.05*LV+6 | K575: 6.5*LV+15 | L575: 1.4*LV+8 | M575: 1000*LV+100000 | N575: 0 | O575: math.max(0,(lv/10)-1) | P575: math.max(0,(lv/10)-1) | Q575: math.max(0,(lv/10)-1) | R575: 0; | S575: 有药王谷和盘丝洞的弟子在，真是不爽，还是跑路算了！ | T575: 药王谷和盘丝洞的弟子不在眼前，真是轻松愉快啊！ | U575: 0 | V575: 0,0; | W575: 5
A576: 102003 | B576: 降妖除魔 | C576: pet_53 | D576: 0 | E576: 0 | F576: 1511,100; | G576: 0,0; | H576: 70*LV+40 | I576: 8*LV+75 | J576: 2.25*LV+15 | K576: 6.5*LV+15 | L576: 1.4*LV+8 | M576: 1000*LV+100000 | N576: 0 | O576: math.max(0,(lv/10)-1) | P576: math.max(0,(lv/10)-1) | Q576: math.max(0,(lv/10)-1) | R576: 0; | S576: 有药王谷和盘丝洞的弟子在，真是不爽，还是跑路算了！ | T576: 药王谷和盘丝洞的弟子不在眼前，真是轻松愉快啊！ | U576: 0 | V576: 0,0; | W576: 5
A577: 102004 | B577: 妖魔 | C577: pet_93 | D577: 0 | E577: 0 | F577: 1111,80;1112,20; | G577: 0,0; | H577: 70*LV+40 | I577: 8*LV+75 | J577: 1.5*LV+10 | K577: (6.5*LV+15)*0.1 | L577: 1.4*LV+8 | M577: 1000*LV+100000 | N577: 0 | O577: math.max(0,(lv/10)-1) | P577: math.max(0,(lv/10)-1) | Q577: math.max(0,(lv/10)-1) | R577: 0; | S577: 有药王谷和盘丝洞的弟子在，真是不爽，还是跑路算了！ | T577: 药王谷和盘丝洞的弟子不在眼前，真是轻松愉快啊！ | U577: 0 | V577: 0,0; | W577: 1
A578: 102005 | B578: 山精妖魔 | C578: pet_62 | D578: 0 | E578: 0 | F578: 0,0; | G578: 0,0; | H578: 30*LV+30 | I578: 5*LV+70 | J578: 0.9*LV+10 | K578: (5*LV+12)*0.1 | L578: 0.8*LV+8 | M578: 1000*LV+100000 | N578: 0 | O578: math.max(0,(lv/10)-1) | P578: math.max(0,(lv/10)-1) | Q578: math.max(0,(lv/10)-1) | R578: 0; | S578: 有药王谷和盘丝洞的弟子在，真是不爽，还是跑路算了！ | T578: 药王谷和盘丝洞的弟子不在眼前，真是轻松愉快啊！ | U578: 0 | V578: 0,0; | W578: 0
A579: 102006 | B579: 剑灵 | C579: pet_21 | D579: 0 | E579: 0 | F579: 5304,40; | G579: 0,0; | H579: 30*LV+30 | I579: 5*LV+70 | J579: 0.9*LV+10 | K579: (5*LV+12)*0.1 | L579: 0.8*LV+8 | M579: 1000*LV+100000 | N579: 0 | O579: math.max(0,(lv/10)-1) | P579: math.max(0,(lv/10)-1) | Q579: math.max(0,(lv/10)-1) | R579: 0; | S579: 有药王谷和盘丝洞的弟子在，真是不爽，还是跑路算了！ | T579: 药王谷和盘丝洞的弟子不在眼前，真是轻松愉快啊！ | U579: 0 | V579: 0,0; | W579: 0
A580: 102007 | B580: 兔精 | C580: pet_11 | D580: 0 | E580: 0 | F580: 0,0; | G580: 0,0; | H580: 30*LV+30 | I580: 5*LV+70 | J580: 0.9*LV+10 | K580: (5*LV+12)*0.1 | L580: 0.8*LV+8 | M580: 1000*LV+100000 | N580: 0 | O580: math.max(0,(lv/10)-1) | P580: math.max(0,(lv/10)-1) | Q580: math.max(0,(lv/10)-1) | R580: 0; | S580: 有药王谷和盘丝洞的弟子在，真是不爽，还是跑路算了！ | T580: 药王谷和盘丝洞的弟子不在眼前，真是轻松愉快啊！ | U580: 0 | V580: 0,0; | W580: 0
A581: 102008 | B581: 凶灵妖魔 | C581: pet_61 | D581: 0 | E581: 0 | F581: 5309,100; | G581: 0,0; | H581: 60*LV+160 | I581: 7*LV+35 | J581: 0.9*LV+10 | K581: 6*LV+30 | L581: 0.8*LV+8 | M581: 1000*LV+100000 | N581: 0 | O581: math.max(0,(lv/10)-1) | P581: math.max(0,(lv/10)-1) | Q581: math.max(0,(lv/10)-1) | R581: 0; | S581: 有药王谷和盘丝洞的弟子在，真是不爽，还是跑路算了！ | T581: 药王谷和盘丝洞的弟子不在眼前，真是轻松愉快啊！ | U581: 0 | V581: 0,0; | W581: 0
A582: 106002 | B582: 天下无双小怪1 | C582: pet_81 | D582: 0 | E582: 0 | F582: 1511,30;1518,20; | G582: 0,0; | H582: 90*LV+60 | I582: 11.5*LV+20 | J582: 0.9*LV+10 | K582: 1.5*LV+15 | L582: 0.8*LV+8 | M582: 1000*LV+100000 | N582: 0 | O582: math.max(0,(lv/10)-1) | P582: math.max(0,(lv/10)-1) | Q582: math.max(0,(lv/10)-1) | R582: 0; | S582: 有药王谷和盘丝洞的弟子在，真是不爽，还是跑路算了！ | T582: 药王谷和盘丝洞的弟子不在眼前，真是轻松愉快啊！ | U582: 0 | V582: 0,0; | W582: 5
A583: 106003 | B583: 天下无双小怪2 | C583: pet_102 | D583: 0 | E583: 0 | F583: 1511,30;1518,20; | G583: 0,0; | H583: 90*LV+60 | I583: 11.5*LV+20 | J583: 0.9*LV+10 | K583: 1.5*LV+15 | L583: 0.8*LV+8 | M583: 1000*LV+100000 | N583: 0 | O583: math.max(0,(lv/10)-1) | P583: math.max(0,(lv/10)-1) | Q583: math.max(0,(lv/10)-1) | R583: 0; | S583: 有药王谷和盘丝洞的弟子在，真是不爽，还是跑路算了！ | T583: 药王谷和盘丝洞的弟子不在眼前，真是轻松愉快啊！ | U583: 0 | V583: 0,0; | W583: 5
A584: 106004 | B584: 天下无双小怪3 | C584: pet_83 | D584: 0 | E584: 0 | F584: 1511,30;1518,20; | G584: 0,0; | H584: 90*LV+60 | I584: 11.5*LV+20 | J584: 0.9*LV+10 | K584: 1.5*LV+15 | L584: 0.8*LV+8 | M584: 1000*LV+100000 | N584: 0 | O584: math.max(0,(lv/10)-1) | P584: math.max(0,(lv/10)-1) | Q584: math.max(0,(lv/10)-1) | R584: 0; | S584: 有药王谷和盘丝洞的弟子在，真是不爽，还是跑路算了！ | T584: 药王谷和盘丝洞的弟子不在眼前，真是轻松愉快啊！ | U584: 0 | V584: 0,0; | W584: 5
A585: 106005 | B585: 天下无双小怪4 | C585: pet_91 | D585: 0 | E585: 0 | F585: 1511,30;1518,20; | G585: 0,0; | H585: 90*LV+60 | I585: 11.5*LV+20 | J585: 0.9*LV+10 | K585: 1.5*LV+15 | L585: 0.8*LV+8 | M585: 1000*LV+100000 | N585: 0 | O585: math.max(0,(lv/10)-1) | P585: math.max(0,(lv/10)-1) | Q585: math.max(0,(lv/10)-1) | R585: 0; | S585: 有药王谷和盘丝洞的弟子在，真是不爽，还是跑路算了！ | T585: 药王谷和盘丝洞的弟子不在眼前，真是轻松愉快啊！ | U585: 0 | V585: 0,0; | W585: 5
A586: 106006 | B586: 天下无双小怪5 | C586: pet_61 | D586: 0 | E586: 0 | F586: 1511,30;1518,20; | G586: 0,0; | H586: 90*LV+60 | I586: 11.5*LV+20 | J586: 0.9*LV+10 | K586: 1.5*LV+15 | L586: 0.8*LV+8 | M586: 1000*LV+100000 | N586: 0 | O586: math.max(0,(lv/10)-1) | P586: math.max(0,(lv/10)-1) | Q586: math.max(0,(lv/10)-1) | R586: 0; | S586: 有药王谷和盘丝洞的弟子在，真是不爽，还是跑路算了！ | T586: 药王谷和盘丝洞的弟子不在眼前，真是轻松愉快啊！ | U586: 0 | V586: 0,0; | W586: 5
A587: 107001 | B587: 飞虎 | C587: pet_63 | D587: 0 | E587: 0 | F587: 0,0; | G587: 0,0; | H587: 10*LV+60 | I587: 1.5*LV+20 | J587: 0.9*LV+10 | K587: 2*LV+15 | L587: 0.8*LV+8 | M587: 1000*LV+100000 | N587: 0 | O587: math.max(0,(lv/10)-1) | P587: math.max(0,(lv/10)-1) | Q587: math.max(0,(lv/10)-1) | R587: 0; | S587: 有药王谷和盘丝洞的弟子在，真是不爽，还是跑路算了！ | T587: 药王谷和盘丝洞的弟子不在眼前，真是轻松愉快啊！ | U587: 0 | V587: 0,0; | W587: 1
A588: 107002 | B588: 熊猫武师 | C588: pet_13 | D588: 0 | E588: 0 | F588: 0,0; | G588: 0,0; | H588: 9*LV+60 | I588: 1.5*LV+20 | J588: 0.9*LV+10 | K588: 1.5*LV+15 | L588: 0.8*LV+8 | M588: 1000*LV+100000 | N588: 0 | O588: math.max(0,(lv/10)-1) | P588: math.max(0,(lv/10)-1) | Q588: math.max(0,(lv/10)-1) | R588: 0; | S588: 有药王谷和盘丝洞的弟子在，真是不爽，还是跑路算了！ | T588: 药王谷和盘丝洞的弟子不在眼前，真是轻松愉快啊！ | U588: 0 | V588: 0,0; | W588: 4
A589: 107003 | B589: 白银飞虎 | C589: pet_63 | D589: 0 | E589: 0 | F589: 0,0; | G589: 0,0; | H589: 10*LV+60 | I589: 1.5*LV+20 | J589: 0.9*LV+10 | K589: 2*LV+15 | L589: 0.8*LV+8 | M589: 1000*LV+100000 | N589: 0 | O589: math.max(0,(lv/10)-1) | P589: math.max(0,(lv/10)-1) | Q589: math.max(0,(lv/10)-1) | R589: 0; | S589: 有药王谷和盘丝洞的弟子在，真是不爽，还是跑路算了！ | T589: 药王谷和盘丝洞的弟子不在眼前，真是轻松愉快啊！ | U589: 0 | V589: 0,0; | W589: 1
A590: 107004 | B590: 黄金飞虎 | C590: pet_63 | D590: 0 | E590: 0 | F590: 0,0; | G590: 0,0; | H590: 10*LV+60 | I590: 1.5*LV+20 | J590: 0.9*LV+10 | K590: 2*LV+15 | L590: 0.8*LV+8 | M590: 1000*LV+100000 | N590: 0 | O590: math.max(0,(lv/10)-1) | P590: math.max(0,(lv/10)-1) | Q590: math.max(0,(lv/10)-1) | R590: 0; | S590: 有药王谷和盘丝洞的弟子在，真是不爽，还是跑路算了！ | T590: 药王谷和盘丝洞的弟子不在眼前，真是轻松愉快啊！ | U590: 0 | V590: 0,0; | W590: 4
A591: 107005 | B591: 蓝钻飞虎 | C591: pet_63 | D591: 0 | E591: 0 | F591: 0,0; | G591: 0,0; | H591: 10*LV+60 | I591: 1.5*LV+20 | J591: 0.9*LV+10 | K591: 2*LV+15 | L591: 0.8*LV+8 | M591: 1000*LV+100000 | N591: 0 | O591: math.max(0,(lv/10)-1) | P591: math.max(0,(lv/10)-1) | Q591: math.max(0,(lv/10)-1) | R591: 0; | S591: 有药王谷和盘丝洞的弟子在，真是不爽，还是跑路算了！ | T591: 药王谷和盘丝洞的弟子不在眼前，真是轻松愉快啊！ | U591: 0 | V591: 0,0; | W591: 0
A592: 109001 | B592: 长生堂弟子 | C592: hero_1001 | D592: 0 | E592: 0 | F592: 1111,100; | G592: 0,0; | H592: 13.5*LV+72 | I592: 8.82*LV+36 | J592: 1.35*LV+9 | K592: (9.45*LV+13.5)*0.05 | L592: 1.26*LV+7.2 | M592: 1000*LV+100000 | N592: 0 | O592: math.max(0,(lv/10)-1) | P592: math.max(0,(lv/10)-1) | Q592: math.max(0,(lv/10)-1) | R592: 0; | S592: 有药王谷和盘丝洞的弟子在，真是不爽，还是跑路算了！ | T592: 药王谷和盘丝洞的弟子不在眼前，真是轻松愉快啊！ | U592: 0 | V592: 0,0; | W592: 1
A593: 109002 | B593: 水晶宫妖魔 | C593: pet_23 | D593: 0 | E593: 0 | F593: 1311,100; | G593: 0,0; | H593: 13.5*LV+72 | I593: 8.82*LV+36 | J593: 1.35*LV+9 | K593: (9.45*LV+13.5)*0.05 | L593: 1.26*LV+7.2 | M593: 1000*LV+100000 | N593: 0 | O593: math.max(0,(lv/10)-1) | P593: math.max(0,(lv/10)-1) | Q593: math.max(0,(lv/10)-1) | R593: 0; | S593: 有药王谷和盘丝洞的弟子在，真是不爽，还是跑路算了！ | T593: 药王谷和盘丝洞的弟子不在眼前，真是轻松愉快啊！ | U593: 0 | V593: 0,0; | W593: 4
A594: 109003 | B594: 女魃 | C594: pet_53 | D594: 0 | E594: 0 | F594: 0,0; | G594: 0,0; | H594: 9*LV+48 | I594: 5.88*LV+24 | J594: 0.9*LV+6 | K594: (6.3*LV+9)*0.05 | L594: 0.84*LV+4.8 | M594: 1000*LV+100000 | N594: 0 | O594: math.max(0,(lv/10)-1) | P594: math.max(0,(lv/10)-1) | Q594: math.max(0,(lv/10)-1) | R594: 0; | S594: 有药王谷和盘丝洞的弟子在，真是不爽，还是跑路算了！ | T594: 药王谷和盘丝洞的弟子不在眼前，真是轻松愉快啊！ | U594: 0 | V594: 0,0; | W594: 2
A595: 109011 | B595: 奴仆 | C595: pet_62 | D595: 0 | E595: 0 | F595: 1111,100; | G595: 0,0; | H595: 15*LV+80 | I595: 9.8*LV+40 | J595: 1.5*LV+10 | K595: (10.5*LV+15)*0.05 | L595: 1.4*LV+8 | M595: 1000*LV+100000 | N595: 0 | O595: math.max(0,(lv/10)-1) | P595: math.max(0,(lv/10)-1) | Q595: math.max(0,(lv/10)-1) | R595: 0; | S595: 有药王谷和盘丝洞的弟子在，真是不爽，还是跑路算了！ | T595: 药王谷和盘丝洞的弟子不在眼前，真是轻松愉快啊！ | U595: 0 | V595: 0,0; | W595: 1
A596: 109012 | B596: 罗刹女 | C596: pet_61 | D596: 0 | E596: 0 | F596: 1311,100; | G596: 0,0; | H596: 15*LV+80 | I596: 9.8*LV+40 | J596: 1.5*LV+10 | K596: (10.5*LV+15)*0.05 | L596: 1.4*LV+8 | M596: 1000*LV+100000 | N596: 0 | O596: math.max(0,(lv/10)-1) | P596: math.max(0,(lv/10)-1) | Q596: math.max(0,(lv/10)-1) | R596: 0; | S596: 有药王谷和盘丝洞的弟子在，真是不爽，还是跑路算了！ | T596: 药王谷和盘丝洞的弟子不在眼前，真是轻松愉快啊！ | U596: 0 | V596: 0,0; | W596: 4
A597: 109013 | B597: 长生堂弟子 | C597: hero_1001 | D597: 0 | E597: 0 | F597: 5309,100; | G597: 0,0; | H597: 13.5*LV+72 | I597: 8.82*LV+36 | J597: 1.35*LV+9 | K597: (9.45*LV+13.5)*0.05 | L597: 1.26*LV+7.2 | M597: 1000*LV+100000 | N597: 0 | O597: math.max(0,(lv/10)-1) | P597: math.max(0,(lv/10)-1) | Q597: math.max(0,(lv/10)-1) | R597: 0; | S597: 有药王谷和盘丝洞的弟子在，真是不爽，还是跑路算了！ | T597: 药王谷和盘丝洞的弟子不在眼前，真是轻松愉快啊！ | U597: 0 | V597: 0,0; | W597: 4
A598: 109014 | B598: 水晶宫妖魔 | C598: pet_23 | D598: 0 | E598: 0 | F598: 5309,100; | G598: 0,0; | H598: 13.5*LV+72 | I598: 8.82*LV+36 | J598: 1.35*LV+9 | K598: (9.45*LV+13.5)*0.05 | L598: 1.26*LV+7.2 | M598: 1000*LV+100000 | N598: 0 | O598: math.max(0,(lv/10)-1) | P598: math.max(0,(lv/10)-1) | Q598: math.max(0,(lv/10)-1) | R598: 0; | S598: 有药王谷和盘丝洞的弟子在，真是不爽，还是跑路算了！ | T598: 药王谷和盘丝洞的弟子不在眼前，真是轻松愉快啊！ | U598: 0 | V598: 0,0; | W598: 5
A599: 109015 | B599: 女魃 | C599: pet_53 | D599: 0 | E599: 0 | F599: 0,0; | G599: 5202,50; | H599: 9*LV+48 | I599: 5.88*LV+24 | J599: 0.9*LV+6 | K599: (6.3*LV+9)*0.05 | L599: 0.84*LV+4.8 | M599: 1000*LV+100000 | N599: 0 | O599: math.max(0,(lv/10)-1) | P599: math.max(0,(lv/10)-1) | Q599: math.max(0,(lv/10)-1) | R599: 0; | S599: 有药王谷和盘丝洞的弟子在，真是不爽，还是跑路算了！ | T599: 药王谷和盘丝洞的弟子不在眼前，真是轻松愉快啊！ | U599: 0 | V599: 0,0; | W599: 2
A600: 109016 | B600: 三妖·星 | C600: pet_11 | D600: 0 | E600: 0 | F600: 5309,100; | G600: 0,0; | H600: 15*LV+80 | I600: 9.8*LV+40 | J600: 1.5*LV+10 | K600: (10.5*LV+15)*0.05 | L600: 1.4*LV+8 | M600: 1000*LV+100000 | N600: 0 | O600: math.max(0,(lv/10)-1) | P600: math.max(0,(lv/10)-1) | Q600: math.max(0,(lv/10)-1) | R600: 0; | S600: 有药王谷和盘丝洞的弟子在，真是不爽，还是跑路算了！ | T600: 药王谷和盘丝洞的弟子不在眼前，真是轻松愉快啊！ | U600: 0 | V600: 0,0; | W600: 1
A601: 109017 | B601: 星之守卫 | C601: pet_13 | D601: 0 | E601: 0 | F601: 0,0; | G601: 5202,50; | H601: 13.5*LV+72 | I601: 8.82*LV+36 | J601: 1.35*LV+9 | K601: (9.45*LV+13.5)*0.05 | L601: 1.26*LV+7.2 | M601: 1000*LV+100000 | N601: 0 | O601: math.max(0,(lv/10)-1) | P601: math.max(0,(lv/10)-1) | Q601: math.max(0,(lv/10)-1) | R601: 0; | S601: 有药王谷和盘丝洞的弟子在，真是不爽，还是跑路算了！ | T601: 药王谷和盘丝洞的弟子不在眼前，真是轻松愉快啊！ | U601: 0 | V601: 0,0; | W601: 3
A602: 109021 | B602: 铁扇公主 | C602: partner_1003 | D602: 0 | E602: 0 | F602: 1511,100;1512,100;1513,400;1514,100; | G602: 0,0; | H602: 16.5*LV+88 | I602: 10.78*LV+44 | J602: 1.65*LV+11 | K602: (11.55*LV+16.5)*0.05 | L602: 1.54*LV+8.8 | M602: 1000*LV+100000 | N602: 0 | O602: math.max(0,(lv/10)-1) | P602: math.max(0,(lv/10)-1) | Q602: math.max(0,(lv/10)-1) | R602: 0; | S602: 有药王谷和盘丝洞的弟子在，真是不爽，还是跑路算了！ | T602: 药王谷和盘丝洞的弟子不在眼前，真是轻松愉快啊！ | U602: 0 | V602: 0,0; | W602: 5
A603: 109022 | B603: 妖狐 | C603: partner_1009 | D603: 0 | E603: 0 | F603: 1312,100;1315,100;1311,100; | G603: 0,0; | H603: 16.5*LV+88 | I603: 10.78*LV+44 | J603: 1.65*LV+11 | K603: (11.55*LV+16.5)*0.05 | L603: 1.54*LV+8.8 | M603: 1000*LV+100000 | N603: 0 | O603: math.max(0,(lv/10)-1) | P603: math.max(0,(lv/10)-1) | Q603: math.max(0,(lv/10)-1) | R603: 0; | S603: 有药王谷和盘丝洞的弟子在，真是不爽，还是跑路算了！ | T603: 药王谷和盘丝洞的弟子不在眼前，真是轻松愉快啊！ | U603: 0 | V603: 0,0; | W603: 4
A604: 109023 | B604: 奴仆 | C604: pet_62 | D604: 0 | E604: 0 | F604: 1111,100; | G604: 0,0; | H604: 15*LV+80 | I604: 9.8*LV+40 | J604: 1.5*LV+10 | K604: (10.5*LV+15)*0.05 | L604: 1.4*LV+8 | M604: 1000*LV+100000 | N604: 0 | O604: math.max(0,(lv/10)-1) | P604: math.max(0,(lv/10)-1) | Q604: math.max(0,(lv/10)-1) | R604: 0; | S604: 有药王谷和盘丝洞的弟子在，真是不爽，还是跑路算了！ | T604: 药王谷和盘丝洞的弟子不在眼前，真是轻松愉快啊！ | U604: 0 | V604: 0,0; | W604: 1
A605: 109024 | B605: 罗刹女 | C605: pet_61 | D605: 0 | E605: 0 | F605: 1311,100; | G605: 0,0; | H605: 15*LV+80 | I605: 9.8*LV+40 | J605: 1.5*LV+10 | K605: (10.5*LV+15)*0.05 | L605: 1.4*LV+8 | M605: 1000*LV+100000 | N605: 0 | O605: math.max(0,(lv/10)-1) | P605: math.max(0,(lv/10)-1) | Q605: math.max(0,(lv/10)-1) | R605: 0; | S605: 有药王谷和盘丝洞的弟子在，真是不爽，还是跑路算了！ | T605: 药王谷和盘丝洞的弟子不在眼前，真是轻松愉快啊！ | U605: 0 | V605: 0,0; | W605: 4
A606: 109025 | B606: 长生堂弟子 | C606: hero_1001 | D606: 0 | E606: 0 | F606: 0,0; | G606: 5202,50; | H606: 13.5*LV+72 | I606: 8.82*LV+36 | J606: 1.35*LV+9 | K606: (9.45*LV+13.5)*0.05 | L606: 1.26*LV+7.2 | M606: 1000*LV+100000 | N606: 0 | O606: math.max(0,(lv/10)-1) | P606: math.max(0,(lv/10)-1) | Q606: math.max(0,(lv/10)-1) | R606: 0; | S606: 有药王谷和盘丝洞的弟子在，真是不爽，还是跑路算了！ | T606: 药王谷和盘丝洞的弟子不在眼前，真是轻松愉快啊！ | U606: 0 | V606: 0,0; | W606: 0
A607: 109026 | B607: 水晶宫妖魔 | C607: pet_23 | D607: 0 | E607: 0 | F607: 0,0; | G607: 5202,50; | H607: 13.5*LV+72 | I607: 8.82*LV+36 | J607: 1.35*LV+9 | K607: (9.45*LV+13.5)*0.05 | L607: 1.26*LV+7.2 | M607: 1000*LV+100000 | N607: 0 | O607: math.max(0,(lv/10)-1) | P607: math.max(0,(lv/10)-1) | Q607: math.max(0,(lv/10)-1) | R607: 0; | S607: 有药王谷和盘丝洞的弟子在，真是不爽，还是跑路算了！ | T607: 药王谷和盘丝洞的弟子不在眼前，真是轻松愉快啊！ | U607: 0 | V607: 0,0; | W607: 4
A608: 109027 | B608: 三妖·月 | C608: pet_53 | D608: 0 | E608: 0 | F608: 5309,100; | G608: 5218,50; | H608: 16.5*LV+88 | I608: 10.78*LV+44 | J608: 1.65*LV+11 | K608: (11.55*LV+16.5)*0.05 | L608: 1.54*LV+8.8 | M608: 1000*LV+100000 | N608: 0 | O608: math.max(0,(lv/10)-1) | P608: math.max(0,(lv/10)-1) | Q608: math.max(0,(lv/10)-1) | R608: 0; | S608: 有药王谷和盘丝洞的弟子在，真是不爽，还是跑路算了！ | T608: 药王谷和盘丝洞的弟子不在眼前，真是轻松愉快啊！ | U608: 0 | V608: 0,0; | W608: 0
A609: 109028 | B609: 月之守卫 | C609: pet_61 | D609: 0 | E609: 0 | F609: 0,0; | G609: 5202,50; | H609: 15*LV+80 | I609: 9.8*LV+40 | J609: 1.5*LV+10 | K609: (10.5*LV+15)*0.05 | L609: 1.4*LV+8 | M609: 1000*LV+100000 | N609: 0 | O609: math.max(0,(lv/10)-1) | P609: math.max(0,(lv/10)-1) | Q609: math.max(0,(lv/10)-1) | R609: 0; | S609: 有药王谷和盘丝洞的弟子在，真是不爽，还是跑路算了！ | T609: 药王谷和盘丝洞的弟子不在眼前，真是轻松愉快啊！ | U609: 0 | V609: 0,0; | W609: 1
A610: 109031 | B610: 三妖·阳 | C610: pet_63 | D610: 0 | E610: 0 | F610: 5309,100; | G610: 5218,50; | H610: 16.5*LV+88 | I610: 10.78*LV+44 | J610: 1.65*LV+11 | K610: (11.55*LV+16.5)*0.05 | L610: 1.54*LV+8.8 | M610: 1000*LV+100000 | N610: 0 | O610: math.max(0,(lv/10)-1) | P610: math.max(0,(lv/10)-1) | Q610: math.max(0,(lv/10)-1) | R610: 0; | S610: 有药王谷和盘丝洞的弟子在，真是不爽，还是跑路算了！ | T610: 药王谷和盘丝洞的弟子不在眼前，真是轻松愉快啊！ | U610: 0 | V610: 0,0; | W610: 2
A611: 109032 | B611: 阳之守卫 | C611: pet_21 | D611: 0 | E611: 0 | F611: 0,0; | G611: 5202,50; | H611: 15*LV+80 | I611: 9.8*LV+40 | J611: 1.5*LV+10 | K611: (10.5*LV+15)*0.05 | L611: 1.4*LV+8 | M611: 1000*LV+100000 | N611: 0 | O611: math.max(0,(lv/10)-1) | P611: math.max(0,(lv/10)-1) | Q611: math.max(0,(lv/10)-1) | R611: 0; | S611: 有药王谷和盘丝洞的弟子在，真是不爽，还是跑路算了！ | T611: 药王谷和盘丝洞的弟子不在眼前，真是轻松愉快啊！ | U611: 0 | V611: 0,0; | W611: 4
A612: 109033 | B612: 兔精 | C612: pet_11 | D612: 0 | E612: 0 | F612: 0,0; | G612: 5202,50; | H612: 16.5*LV+88 | I612: 10.78*LV+44 | J612: 1.65*LV+11 | K612: (11.55*LV+16.5)*0.05 | L612: 1.54*LV+8.8 | M612: 1000*LV+100000 | N612: 0 | O612: math.max(0,(lv/10)-1) | P612: math.max(0,(lv/10)-1) | Q612: math.max(0,(lv/10)-1) | R612: 0; | S612: 有药王谷和盘丝洞的弟子在，真是不爽，还是跑路算了！ | T612: 药王谷和盘丝洞的弟子不在眼前，真是轻松愉快啊！ | U612: 0 | V612: 0,0; | W612: 3
A613: 109041 | B613: 长生堂掌门 | C613: pet_71 | D613: 0 | E613: 0 | F613: 1512,100;1511,100; | G613: 0,0; | H613: 18*LV+96 | I613: 11.76*LV+48 | J613: 1.8*LV+12 | K613: (12.6*LV+18)*0.05 | L613: 1.68*LV+9.6 | M613: 1000*LV+100000 | N613: 0 | O613: math.max(0,(lv/10)-1) | P613: math.max(0,(lv/10)-1) | Q613: math.max(0,(lv/10)-1) | R613: 0; | S613: 有药王谷和盘丝洞的弟子在，真是不爽，还是跑路算了！ | T613: 药王谷和盘丝洞的弟子不在眼前，真是轻松愉快啊！ | U613: 0 | V613: 0,0; | W613: 5
A614: 109042 | B614: 暮光林掌门 | C614: hero_1001 | D614: 0 | E614: 0 | F614: 1311,100;1312,100; | G614: 5218,50; | H614: 18*LV+96 | I614: 11.76*LV+48 | J614: 1.8*LV+12 | K614: (12.6*LV+18)*0.05 | L614: 1.68*LV+9.6 | M614: 1000*LV+100000 | N614: 0 | O614: math.max(0,(lv/10)-1) | P614: math.max(0,(lv/10)-1) | Q614: math.max(0,(lv/10)-1) | R614: 0; | S614: 有药王谷和盘丝洞的弟子在，真是不爽，还是跑路算了！ | T614: 药王谷和盘丝洞的弟子不在眼前，真是轻松愉快啊！ | U614: 0 | V614: 0,0; | W614: 4
A615: 109043 | B615: 铁扇公主 | C615: partner_1003 | D615: 0 | E615: 0 | F615: 1511,100;1512,100;1513,400;1514,100; | G615: 0,0; | H615: 16.5*LV+88 | I615: 10.78*LV+44 | J615: 1.65*LV+11 | K615: (11.55*LV+16.5)*0.05 | L615: 1.54*LV+8.8 | M615: 1000*LV+100000 | N615: 0 | O615: math.max(0,(lv/10)-1) | P615: math.max(0,(lv/10)-1) | Q615: math.max(0,(lv/10)-1) | R615: 0; | S615: 有药王谷和盘丝洞的弟子在，真是不爽，还是跑路算了！ | T615: 药王谷和盘丝洞的弟子不在眼前，真是轻松愉快啊！ | U615: 0 | V615: 0,0; | W615: 5
A616: 109044 | B616: 妖狐 | C616: partner_1009 | D616: 0 | E616: 0 | F616: 1311,100;1312,100; | G616: 0,0; | H616: 16.5*LV+88 | I616: 10.78*LV+44 | J616: 1.65*LV+11 | K616: (11.55*LV+16.5)*0.05 | L616: 1.54*LV+8.8 | M616: 1000*LV+100000 | N616: 0 | O616: math.max(0,(lv/10)-1) | P616: math.max(0,(lv/10)-1) | Q616: math.max(0,(lv/10)-1) | R616: 0; | S616: 有药王谷和盘丝洞的弟子在，真是不爽，还是跑路算了！ | T616: 药王谷和盘丝洞的弟子不在眼前，真是轻松愉快啊！ | U616: 0 | V616: 0,0; | W616: 4
A617: 109045 | B617: 奴仆 | C617: pet_62 | D617: 0 | E617: 0 | F617: 1111,100; | G617: 0,0; | H617: 15*LV+80 | I617: 9.8*LV+40 | J617: 1.5*LV+10 | K617: (10.5*LV+15)*0.05 | L617: 1.4*LV+8 | M617: 1000*LV+100000 | N617: 0 | O617: math.max(0,(lv/10)-1) | P617: math.max(0,(lv/10)-1) | Q617: math.max(0,(lv/10)-1) | R617: 0; | S617: 有药王谷和盘丝洞的弟子在，真是不爽，还是跑路算了！ | T617: 药王谷和盘丝洞的弟子不在眼前，真是轻松愉快啊！ | U617: 0 | V617: 0,0; | W617: 1
A618: 109046 | B618: 罗刹女 | C618: pet_61 | D618: 0 | E618: 0 | F618: 1311,100; | G618: 0,0; | H618: 15*LV+80 | I618: 9.8*LV+40 | J618: 1.5*LV+10 | K618: (10.5*LV+15)*0.05 | L618: 1.4*LV+8 | M618: 1000*LV+100000 | N618: 0 | O618: math.max(0,(lv/10)-1) | P618: math.max(0,(lv/10)-1) | Q618: math.max(0,(lv/10)-1) | R618: 0; | S618: 有药王谷和盘丝洞的弟子在，真是不爽，还是跑路算了！ | T618: 药王谷和盘丝洞的弟子不在眼前，真是轻松愉快啊！ | U618: 0 | V618: 0,0; | W618: 4
A619: 109047 | B619: 长生堂弟子 | C619: hero_1001 | D619: 0 | E619: 0 | F619: 0,0; | G619: 5202,50; | H619: 13.5*LV+72 | I619: 8.82*LV+36 | J619: 1.35*LV+9 | K619: (9.45*LV+13.5)*0.05 | L619: 1.26*LV+7.2 | M619: 1000*LV+100000 | N619: 0 | O619: math.max(0,(lv/10)-1) | P619: math.max(0,(lv/10)-1) | Q619: math.max(0,(lv/10)-1) | R619: 0; | S619: 有药王谷和盘丝洞的弟子在，真是不爽，还是跑路算了！ | T619: 药王谷和盘丝洞的弟子不在眼前，真是轻松愉快啊！ | U619: 0 | V619: 0,0; | W619: 4
A620: 109048 | B620: 水晶宫妖魔 | C620: pet_23 | D620: 0 | E620: 0 | F620: 0,0; | G620: 5202,50; | H620: 13.5*LV+72 | I620: 8.82*LV+36 | J620: 1.35*LV+9 | K620: (9.45*LV+13.5)*0.05 | L620: 1.26*LV+7.2 | M620: 1000*LV+100000 | N620: 0 | O620: math.max(0,(lv/10)-1) | P620: math.max(0,(lv/10)-1) | Q620: math.max(0,(lv/10)-1) | R620: 0; | S620: 有药王谷和盘丝洞的弟子在，真是不爽，还是跑路算了！ | T620: 药王谷和盘丝洞的弟子不在眼前，真是轻松愉快啊！ | U620: 0 | V620: 0,0; | W620: 3
A621: 109049 | B621: 兔精 | C621: pet_11 | D621: 0 | E621: 0 | F621: 0,0; | G621: 5202,50; | H621: 16.5*LV+88 | I621: 10.78*LV+44 | J621: 1.65*LV+11 | K621: (11.55*LV+16.5)*0.05 | L621: 1.54*LV+8.8 | M621: 1000*LV+100000 | N621: 0 | O621: math.max(0,(lv/10)-1) | P621: math.max(0,(lv/10)-1) | Q621: math.max(0,(lv/10)-1) | R621: 0; | S621: 有药王谷和盘丝洞的弟子在，真是不爽，还是跑路算了！ | T621: 药王谷和盘丝洞的弟子不在眼前，真是轻松愉快啊！ | U621: 0 | V621: 0,0; | W621: 0
A622: 110 | B622: 神秘人 | C622: pet_52 | D622: 0 | E622: 0 | F622: 1411,100; | G622: 0,0; | H622: 51*LV+254.9 | I622: (10.8*LV+20.8)*0.99 | J622: 1.5*LV+23 | K622: 4.1*LV+8.2 | L622: LV+8 | M622: 1000*LV+100000 | N622: 0 | O622: math.max(0,(lv/10)-1) | P622: math.max(0,(lv/10)-1) | Q622: math.max(0,(lv/10)-1) | R622: 0; | S622: 有药王谷和盘丝洞的弟子在，真是不爽，还是跑路算了！ | T622: 药王谷和盘丝洞的弟子不在眼前，真是轻松愉快啊！ | U622: 0 | V622: 0,0; | W622: 2
A623: 110001 | B623: 长青居士 | C623: pet_71 | D623: 0 | E623: 0 | F623: 1411,100;1412,100; | G623: 0,0; | H623: (20*LV+50)*0.8 | I623: (9*LV+35)*0.5 | J623: (5*LV+25)*0.8 | K623: (7*LV+2)*1.2 | L623: (1*LV+6)*0.8 | M623: 1000*LV+100000 | N623: 0 | O623: math.max(0,(lv/10)-1) | P623: math.max(0,(lv/10)-1) | Q623: math.max(0,(lv/10)-1) | R623: 0; | S623: 有药王谷和盘丝洞的弟子在，真是不爽，还是跑路算了！ | T623: 药王谷和盘丝洞的弟子不在眼前，真是轻松愉快啊！ | U623: 0 | V623: 0,0; | W623: 2
A624: 110002 | B624: 天策 | C624: hero_1001 | D624: 0 | E624: 0 | F624: 1111,100;1112,100; | G624: 0,0; | H624: (20*LV+50) | I624: (9*LV+35) | J624: (5*LV+25) | K624: (7*LV+2)*0.5 | L624: (1*LV+6) | M624: 1000*LV+100000 | N624: 0 | O624: math.max(0,(lv/10)-1) | P624: math.max(0,(lv/10)-1) | Q624: math.max(0,(lv/10)-1) | R624: 0; | S624: 有药王谷和盘丝洞的弟子在，真是不爽，还是跑路算了！ | T624: 药王谷和盘丝洞的弟子不在眼前，真是轻松愉快啊！ | U624: 0 | V624: 0,0; | W624: 1
A625: 110003 | B625: 玄奘法师 | C625: partner_1007 | D625: 0 | E625: 0 | F625: 1411,100;1412,100; | G625: 0,0; | H625: (20*LV+50)*1.2 | I625: (9*LV+35)*0.5 | J625: (5*LV+25)*1.1 | K625: (7*LV+2)*0.5 | L625: (1*LV+6)*1.5 | M625: 1000*LV+100000 | N625: 0 | O625: math.max(0,(lv/10)-1) | P625: math.max(0,(lv/10)-1) | Q625: math.max(0,(lv/10)-1) | R625: 0; | S625: 有药王谷和盘丝洞的弟子在，真是不爽，还是跑路算了！ | T625: 药王谷和盘丝洞的弟子不在眼前，真是轻松愉快啊！ | U625: 0 | V625: 0,0; | W625: 2
A626: 110004 | B626: 李易初 | C626: pet_71 | D626: 0 | E626: 0 | F626: 1312,100;1315,100; | G626: 0,0; | H626: (20*LV+50) | I626: (9*LV+35) | J626: (5*LV+25) | K626: (7*LV+2)*0.5 | L626: (1*LV+6) | M626: 1000*LV+100000 | N626: 0 | O626: math.max(0,(lv/10)-1) | P626: math.max(0,(lv/10)-1) | Q626: math.max(0,(lv/10)-1) | R626: 0; | S626: 有药王谷和盘丝洞的弟子在，真是不爽，还是跑路算了！ | T626: 药王谷和盘丝洞的弟子不在眼前，真是轻松愉快啊！ | U626: 0 | V626: 0,0; | W626: 4
A627: 110005 | B627: 道济和尚 | C627: partner_1008 | D627: 0 | E627: 0 | F627: 1411,100;1413,100;1412,100;1416,100; | G627: 0,0; | H627: (20*LV+50)*1.2 | I627: (9*LV+35)*0.5 | J627: (5*LV+25)*0.8 | K627: (7*LV+2)*1.2 | L627: (2*LV+6)*2 | M627: 1000*LV+100000 | N627: 0 | O627: math.max(0,(lv/10)-1) | P627: math.max(0,(lv/10)-1) | Q627: math.max(0,(lv/10)-1) | R627: 0; | S627: 有药王谷和盘丝洞的弟子在，真是不爽，还是跑路算了！ | T627: 药王谷和盘丝洞的弟子不在眼前，真是轻松愉快啊！ | U627: 0 | V627: 0,0; | W627: 2
A628: 110006 | B628: 水晶宫妖魔 | C628: pet_23 | D628: 0 | E628: 0 | F628: 1411,100;1412,100; | G628: 0,0; | H628: (10*LV+40)*0.8 | I628: (7*LV+35)*0.5 | J628: (3*LV+25)*0.8 | K628: (5*LV+2) | L628: (0.7*LV+6)*0.8 | M628: 1000*LV+100000 | N628: 0 | O628: math.max(0,(lv/10)-1) | P628: math.max(0,(lv/10)-1) | Q628: math.max(0,(lv/10)-1) | R628: 0; | S628: 有药王谷和盘丝洞的弟子在，真是不爽，还是跑路算了！ | T628: 药王谷和盘丝洞的弟子不在眼前，真是轻松愉快啊！ | U628: 0 | V628: 0,0; | W628: 2
A629: 110007 | B629: 天策府弟子 | C629: hero_1001 | D629: 0 | E629: 0 | F629: 1112,100; | G629: 0,0; | H629: (10*LV+40) | I629: (7*LV+35) | J629: (3*LV+25) | K629: (5*LV+2)*0.5 | L629: (0.7*LV+6) | M629: 1000*LV+100000 | N629: 0 | O629: math.max(0,(lv/10)-1) | P629: math.max(0,(lv/10)-1) | Q629: math.max(0,(lv/10)-1) | R629: 0; | S629: 有药王谷和盘丝洞的弟子在，真是不爽，还是跑路算了！ | T629: 药王谷和盘丝洞的弟子不在眼前，真是轻松愉快啊！ | U629: 0 | V629: 0,0; | W629: 1
A630: 110008 | B630: 药王谷弟子 | C630: hero_1001 | D630: 0 | E630: 0 | F630: 1212,100;1211,100; | G630: 0,0; | H630: (10*LV+40)*1.2 | I630: (7*LV+35)*0.5 | J630: (3*LV+25)*1.1 | K630: (5*LV+2)*0.5 | L630: (0.7*LV+6)*1.5 | M630: 1000*LV+100000 | N630: 0 | O630: math.max(0,(lv/10)-1) | P630: math.max(0,(lv/10)-1) | Q630: math.max(0,(lv/10)-1) | R630: 0; | S630: 有药王谷和盘丝洞的弟子在，真是不爽，还是跑路算了！ | T630: 药王谷和盘丝洞的弟子不在眼前，真是轻松愉快啊！ | U630: 0 | V630: 0,0; | W630: 3
A631: 110009 | B631: 水晶宫弟子 | C631: hero_1001 | D631: 0 | E631: 0 | F631: 1312,100;1315,100; | G631: 0,0; | H631: (10*LV+40) | I631: (7*LV+35) | J631: (3*LV+25) | K631: (5*LV+2)*0.5 | L631: (0.7*LV+6) | M631: 1000*LV+100000 | N631: 0 | O631: math.max(0,(lv/10)-1) | P631: math.max(0,(lv/10)-1) | Q631: math.max(0,(lv/10)-1) | R631: 0; | S631: 有药王谷和盘丝洞的弟子在，真是不爽，还是跑路算了！ | T631: 药王谷和盘丝洞的弟子不在眼前，真是轻松愉快啊！ | U631: 0 | V631: 0,0; | W631: 4
A632: 110010 | B632: 仆从 | C632: pet_21 | D632: 0 | E632: 0 | F632: 1511,100;1513,100; | G632: 0,0; | H632: (10*LV+40)*1.2 | I632: (7*LV+35)*0.5 | J632: (3*LV+25)*0.8 | K632: (5*LV+2) | L632: (1.7*LV+6)*2 | M632: 1000*LV+100000 | N632: 0 | O632: math.max(0,(lv/10)-1) | P632: math.max(0,(lv/10)-1) | Q632: math.max(0,(lv/10)-1) | R632: 0; | S632: 有药王谷和盘丝洞的弟子在，真是不爽，还是跑路算了！ | T632: 药王谷和盘丝洞的弟子不在眼前，真是轻松愉快啊！ | U632: 0 | V632: 0,0; | W632: 5
A633: 110011 | B633: 水晶宫外门弟子 | C633: hero_2001 | D633: 0 | E633: 0 | F633: 1411,100;1412,100; | G633: 0,0; | H633: (10*LV+40) | I633: (7*LV+35) | J633: (3*LV+25) | K633: (5*LV+2) | L633: (0.7*LV+6) | M633: 1000*LV+100000 | N633: 0 | O633: math.max(0,(lv/10)-1) | P633: math.max(0,(lv/10)-1) | Q633: math.max(0,(lv/10)-1) | R633: 0; | S633: 有药王谷和盘丝洞的弟子在，真是不爽，还是跑路算了！ | T633: 药王谷和盘丝洞的弟子不在眼前，真是轻松愉快啊！ | U633: 0 | V633: 0,0; | W633: 2
A634: 110012 | B634: 天策府外门弟子 | C634: hero_2001 | D634: 0 | E634: 0 | F634: 1111,100; | G634: 0,0; | H634: (10*LV+40) | I634: (7*LV+35) | J634: (3*LV+25) | K634: (5*LV+2)*0.5 | L634: (0.7*LV+6) | M634: 1000*LV+100000 | N634: 0 | O634: math.max(0,(lv/10)-1) | P634: math.max(0,(lv/10)-1) | Q634: math.max(0,(lv/10)-1) | R634: 0; | S634: 有药王谷和盘丝洞的弟子在，真是不爽，还是跑路算了！ | T634: 药王谷和盘丝洞的弟子不在眼前，真是轻松愉快啊！ | U634: 0 | V634: 0,0; | W634: 1
A635: 110013 | B635: 药王谷外门弟子 | C635: hero_2001 | D635: 0 | E635: 0 | F635: 5305,100; | G635: 0,0; | H635: (10*LV+40) | I635: (7*LV+35) | J635: (3*LV+25) | K635: (5*LV+2) | L635: (0.7*LV+6) | M635: 1000*LV+100000 | N635: 0 | O635: math.max(0,(lv/10)-1) | P635: math.max(0,(lv/10)-1) | Q635: math.max(0,(lv/10)-1) | R635: 0; | S635: 有药王谷和盘丝洞的弟子在，真是不爽，还是跑路算了！ | T635: 药王谷和盘丝洞的弟子不在眼前，真是轻松愉快啊！ | U635: 0 | V635: 0,0; | W635: 3
A636: 110014 | B636: 兽王寨外门弟子 | C636: hero_2001 | D636: 0 | E636: 0 | F636: 1311,100;1315,100; | G636: 0,0; | H636: (10*LV+40) | I636: (7*LV+35) | J636: (3*LV+25) | K636: (5*LV+2)*0.5 | L636: (0.7*LV+6) | M636: 1000*LV+100000 | N636: 0 | O636: math.max(0,(lv/10)-1) | P636: math.max(0,(lv/10)-1) | Q636: math.max(0,(lv/10)-1) | R636: 0; | S636: 有药王谷和盘丝洞的弟子在，真是不爽，还是跑路算了！ | T636: 药王谷和盘丝洞的弟子不在眼前，真是轻松愉快啊！ | U636: 0 | V636: 0,0; | W636: 4
A637: 110015 | B637: 盘丝洞外门弟子 | C637: hero_2001 | D637: 0 | E637: 0 | F637: 5306,100; | G637: 0,0; | H637: (10*LV+40) | I637: (7*LV+35) | J637: (3*LV+25) | K637: (5*LV+2)*0.5 | L637: (1.7*LV+6) | M637: 1000*LV+100000 | N637: 0 | O637: math.max(0,(lv/10)-1) | P637: math.max(0,(lv/10)-1) | Q637: math.max(0,(lv/10)-1) | R637: 0; | S637: 有药王谷和盘丝洞的弟子在，真是不爽，还是跑路算了！ | T637: 药王谷和盘丝洞的弟子不在眼前，真是轻松愉快啊！ | U637: 0 | V637: 0,0; | W637: 5
A638: 111 | B638: 幻影派弟子 | C638: hero_1001 | D638: 0 | E638: 0 | F638: 5302,100; | G638: 0,0; | H638: 25.5*LV+127.5 | I638: (6.5*LV+10.4)*0.98 | J638: 0.9*LV+10 | K638: 2.1*LV+4.2 | L638: 0.8*LV+8 | M638: 1000*LV+100000 | N638: 0 | O638: math.max(0,(lv/10)-1) | P638: math.max(0,(lv/10)-1) | Q638: math.max(0,(lv/10)-1) | R638: 0; | S638: 有药王谷和盘丝洞的弟子在，真是不爽，还是跑路算了！ | T638: 药王谷和盘丝洞的弟子不在眼前，真是轻松愉快啊！ | U638: 0 | V638: 0,0; | W638: 5
A639: 111001 | B639: 天策 | C639: hero_1001 | D639: 0 | E639: 0 | F639: 1111,100;1112,100; | G639: 0,0; | H639: (20*LV+50) | I639: (8.5*LV+35) | J639: (5*LV+25) | K639: (7*LV+2)*0.5 | L639: (2*LV+6) | M639: 1000*LV+100000 | N639: 0 | O639: math.max(0,(lv/10)-1) | P639: math.max(0,(lv/10)-1) | Q639: math.max(0,(lv/10)-1) | R639: 0; | S639: 有药王谷和盘丝洞的弟子在，真是不爽，还是跑路算了！ | T639: 药王谷和盘丝洞的弟子不在眼前，真是轻松愉快啊！ | U639: 0 | V639: 0,0; | W639: 1
A640: 111002 | B640: 道观真人 | C640: partner_1007 | D640: 0 | E640: 0 | F640: 1411,100;1412,100; | G640: 0,0; | H640: (20*LV+50)*0.8 | I640: (8.5*LV+35)*0.5 | J640: (5*LV+25)*0.8 | K640: (7*LV+2)*1.2 | L640: (2*LV+6)*0.8 | M640: 1000*LV+100000 | N640: 0 | O640: math.max(0,(lv/10)-1) | P640: math.max(0,(lv/10)-1) | Q640: math.max(0,(lv/10)-1) | R640: 0; | S640: 有药王谷和盘丝洞的弟子在，真是不爽，还是跑路算了！ | T640: 药王谷和盘丝洞的弟子不在眼前，真是轻松愉快啊！ | U640: 0 | V640: 0,0; | W640: 2
A641: 111003 | B641: 青花仙灵 | C641: pet_42 | D641: 0 | E641: 0 | F641: 1312,100;1315,100; | G641: 0,0; | H641: (20*LV+50) | I641: (8.5*LV+35) | J641: (5*LV+25) | K641: (7*LV+2)*0.5 | L641: (2*LV+6) | M641: 1000*LV+100000 | N641: 0 | O641: math.max(0,(lv/10)-1) | P641: math.max(0,(lv/10)-1) | Q641: math.max(0,(lv/10)-1) | R641: 0; | S641: 有药王谷和盘丝洞的弟子在，真是不爽，还是跑路算了！ | T641: 药王谷和盘丝洞的弟子不在眼前，真是轻松愉快啊！ | U641: 0 | V641: 0,0; | W641: 4
A642: 111004 | B642: 玄奘法师 | C642: partner_1007 | D642: 0 | E642: 0 | F642: 1411,100;1412,100; | G642: 0,0; | H642: (20*LV+50)*1.2 | I642: (8.5*LV+35)*0.5 | J642: (5*LV+25)*1.1 | K642: (7*LV+2)*0.5 | L642: (2*LV+6)*1.5 | M642: 1000*LV+100000 | N642: 0 | O642: math.max(0,(lv/10)-1) | P642: math.max(0,(lv/10)-1) | Q642: math.max(0,(lv/10)-1) | R642: 0; | S642: 有药王谷和盘丝洞的弟子在，真是不爽，还是跑路算了！ | T642: 药王谷和盘丝洞的弟子不在眼前，真是轻松愉快啊！ | U642: 0 | V642: 0,0; | W642: 2
A643: 111005 | B643: 巫女娘娘 | C643: pet_83 | D643: 0 | E643: 0 | F643: 1511,100;1513,100; | G643: 0,0; | H643: (20*LV+50)*1.2 | I643: (8.5*LV+35)*0.5 | J643: (5*LV+25)*0.8 | K643: (7*LV+2)*1.2 | L643: (2*LV+6)*2 | M643: 1000*LV+100000 | N643: 0 | O643: math.max(0,(lv/10)-1) | P643: math.max(0,(lv/10)-1) | Q643: math.max(0,(lv/10)-1) | R643: 0; | S643: 有药王谷和盘丝洞的弟子在，真是不爽，还是跑路算了！ | T643: 药王谷和盘丝洞的弟子不在眼前，真是轻松愉快啊！ | U643: 0 | V643: 0,0; | W643: 5
A644: 111006 | B644: 天策府弟子 | C644: hero_1001 | D644: 0 | E644: 0 | F644: 1112,100; | G644: 0,0; | H644: (10*LV+40) | I644: (6.5*LV+35) | J644: (3*LV+25) | K644: (5*LV+2)*0.5 | L644: (1.7*LV+6) | M644: 1000*LV+100000 | N644: 0 | O644: math.max(0,(lv/10)-1) | P644: math.max(0,(lv/10)-1) | Q644: math.max(0,(lv/10)-1) | R644: 0; | S644: 有药王谷和盘丝洞的弟子在，真是不爽，还是跑路算了！ | T644: 药王谷和盘丝洞的弟子不在眼前，真是轻松愉快啊！ | U644: 0 | V644: 0,0; | W644: 1
A645: 111007 | B645: 天策府弟子 | C645: hero_2001 | D645: 0 | E645: 0 | F645: 1111,100; | G645: 0,0; | H645: (10*LV+40) | I645: (6.5*LV+35) | J645: (3*LV+25) | K645: (5*LV+2)*0.5 | L645: (1.7*LV+6) | M645: 1000*LV+100000 | N645: 0 | O645: math.max(0,(lv/10)-1) | P645: math.max(0,(lv/10)-1) | Q645: math.max(0,(lv/10)-1) | R645: 0; | S645: 有药王谷和盘丝洞的弟子在，真是不爽，还是跑路算了！ | T645: 药王谷和盘丝洞的弟子不在眼前，真是轻松愉快啊！ | U645: 0 | V645: 0,0; | W645: 1
A646: 111008 | B646: 天策府弟子 | C646: hero_1001 | D646: 0 | E646: 0 | F646: 1411,100;1412,100; | G646: 0,0; | H646: (10*LV+40)*0.8 | I646: (6.5*LV+35)*0.5 | J646: (3*LV+25)*0.8 | K646: (5*LV+2) | L646: (1.7*LV+6)*0.8 | M646: 1000*LV+100000 | N646: 0 | O646: math.max(0,(lv/10)-1) | P646: math.max(0,(lv/10)-1) | Q646: math.max(0,(lv/10)-1) | R646: 0; | S646: 有药王谷和盘丝洞的弟子在，真是不爽，还是跑路算了！ | T646: 药王谷和盘丝洞的弟子不在眼前，真是轻松愉快啊！ | U646: 0 | V646: 0,0; | W646: 2
A647: 111009 | B647: 水晶宫弟子 | C647: hero_2001 | D647: 0 | E647: 0 | F647: 1411,100;1412,100; | G647: 0,0; | H647: (10*LV+40)*0.8 | I647: (6.5*LV+35)*0.5 | J647: (3*LV+25)*0.8 | K647: (5*LV+2) | L647: (1.7*LV+6)*0.8 | M647: 1000*LV+100000 | N647: 0 | O647: math.max(0,(lv/10)-1) | P647: math.max(0,(lv/10)-1) | Q647: math.max(0,(lv/10)-1) | R647: 0; | S647: 有药王谷和盘丝洞的弟子在，真是不爽，还是跑路算了！ | T647: 药王谷和盘丝洞的弟子不在眼前，真是轻松愉快啊！ | U647: 0 | V647: 0,0; | W647: 2
A648: 111010 | B648: 兽王寨弟子 | C648: hero_1001 | D648: 0 | E648: 0 | F648: 1312,100;1315,100; | G648: 0,0; | H648: (10*LV+40) | I648: (6.5*LV+35) | J648: (3*LV+25) | K648: (5*LV+2)*0.5 | L648: (1.7*LV+6) | M648: 1000*LV+100000 | N648: 0 | O648: math.max(0,(lv/10)-1) | P648: math.max(0,(lv/10)-1) | Q648: math.max(0,(lv/10)-1) | R648: 0; | S648: 有药王谷和盘丝洞的弟子在，真是不爽，还是跑路算了！ | T648: 药王谷和盘丝洞的弟子不在眼前，真是轻松愉快啊！ | U648: 0 | V648: 0,0; | W648: 4
A649: 111011 | B649: 兽王寨弟子 | C649: hero_2001 | D649: 0 | E649: 0 | F649: 1311,100;1315,100; | G649: 0,0; | H649: (10*LV+40) | I649: (6.5*LV+35) | J649: (3*LV+25) | K649: (5*LV+2)*0.5 | L649: (1.7*LV+6) | M649: 1000*LV+100000 | N649: 0 | O649: math.max(0,(lv/10)-1) | P649: math.max(0,(lv/10)-1) | Q649: math.max(0,(lv/10)-1) | R649: 0; | S649: 有药王谷和盘丝洞的弟子在，真是不爽，还是跑路算了！ | T649: 药王谷和盘丝洞的弟子不在眼前，真是轻松愉快啊！ | U649: 0 | V649: 0,0; | W649: 4
A650: 111012 | B650: 药王寺弟子 | C650: hero_1001 | D650: 0 | E650: 0 | F650: 1212,100;1211,100; | G650: 0,0; | H650: (10*LV+40)*1.2 | I650: (6.5*LV+35)*0.5 | J650: (3*LV+25)*1.1 | K650: (5*LV+2)*0.5 | L650: (1.7*LV+6)*1.5 | M650: 1000*LV+100000 | N650: 0 | O650: math.max(0,(lv/10)-1) | P650: math.max(0,(lv/10)-1) | Q650: math.max(0,(lv/10)-1) | R650: 0; | S650: 有药王谷和盘丝洞的弟子在，真是不爽，还是跑路算了！ | T650: 药王谷和盘丝洞的弟子不在眼前，真是轻松愉快啊！ | U650: 0 | V650: 0,0; | W650: 3
A651: 111013 | B651: 药王寺弟子 | C651: hero_2001 | D651: 0 | E651: 0 | F651: 5305,100; | G651: 0,0; | H651: (10*LV+40)*1.2 | I651: (6.5*LV+35)*0.5 | J651: (3*LV+25)*1.1 | K651: (5*LV+2) | L651: (1.7*LV+6)*1.5 | M651: 1000*LV+100000 | N651: 0 | O651: math.max(0,(lv/10)-1) | P651: math.max(0,(lv/10)-1) | Q651: math.max(0,(lv/10)-1) | R651: 0; | S651: 有药王谷和盘丝洞的弟子在，真是不爽，还是跑路算了！ | T651: 药王谷和盘丝洞的弟子不在眼前，真是轻松愉快啊！ | U651: 0 | V651: 0,0; | W651: 0
A652: 111014 | B652: 盘丝洞弟子 | C652: hero_1001 | D652: 0 | E652: 0 | F652: 1511,100;1513,100; | G652: 0,0; | H652: (10*LV+40)*1.2 | I652: (6.5*LV+35)*0.5 | J652: (3*LV+25)*0.8 | K652: (5*LV+2) | L652: (1.7*LV+6)*2 | M652: 1000*LV+100000 | N652: 0 | O652: math.max(0,(lv/10)-1) | P652: math.max(0,(lv/10)-1) | Q652: math.max(0,(lv/10)-1) | R652: 0; | S652: 有药王谷和盘丝洞的弟子在，真是不爽，还是跑路算了！ | T652: 药王谷和盘丝洞的弟子不在眼前，真是轻松愉快啊！ | U652: 0 | V652: 0,0; | W652: 5
A653: 111015 | B653: 盘丝洞弟子 | C653: hero_2001 | D653: 0 | E653: 0 | F653: 1511,100;1513,100; | G653: 0,0; | H653: (10*LV+40)*1.2 | I653: (6.5*LV+35)*0.5 | J653: (3*LV+25)*0.8 | K653: (5*LV+2) | L653: (1.7*LV+6)*2 | M653: 1000*LV+100000 | N653: 0 | O653: math.max(0,(lv/10)-1) | P653: math.max(0,(lv/10)-1) | Q653: math.max(0,(lv/10)-1) | R653: 0; | S653: 有药王谷和盘丝洞的弟子在，真是不爽，还是跑路算了！ | T653: 药王谷和盘丝洞的弟子不在眼前，真是轻松愉快啊！ | U653: 0 | V653: 0,0; | W653: 5
A654: 111016 | B654: 天策 | C654: hero_1001 | D654: 0 | E654: 0 | F654: 1111,100;1112,100; | G654: 0,0; | H654: (20*LV+50)*1.15 | I654: (8.5*LV+35)*1.15 | J654: (5*LV+25)*1.15 | K654: (7*LV+2)*0.5*1.15 | L654: (2*LV+6)*1.15 | M654: 1000*LV+100000 | N654: 0 | O654: math.max(0,(lv/10)-1) | P654: math.max(0,(lv/10)-1) | Q654: math.max(0,(lv/10)-1) | R654: 0; | S654: 有药王谷和盘丝洞的弟子在，真是不爽，还是跑路算了！ | T654: 药王谷和盘丝洞的弟子不在眼前，真是轻松愉快啊！ | U654: 0 | V654: 0,0; | W654: 1
A655: 111017 | B655: 道观真人 | C655: partner_1007 | D655: 0 | E655: 0 | F655: 1411,100;1412,100; | G655: 0,0; | H655: (20*LV+50)*0.8*1.15 | I655: (8.5*LV+35)*0.5*1.15 | J655: (5*LV+25)*0.8*1.15 | K655: (7*LV+2)*1.2*1.15 | L655: (2*LV+6)*0.8*1.15 | M655: 1000*LV+100000 | N655: 0 | O655: math.max(0,(lv/10)-1) | P655: math.max(0,(lv/10)-1) | Q655: math.max(0,(lv/10)-1) | R655: 0; | S655: 有药王谷和盘丝洞的弟子在，真是不爽，还是跑路算了！ | T655: 药王谷和盘丝洞的弟子不在眼前，真是轻松愉快啊！ | U655: 0 | V655: 0,0; | W655: 2
A656: 111018 | B656: 青花仙灵 | C656: pet_42 | D656: 0 | E656: 0 | F656: 1312,100;1315,100; | G656: 0,0; | H656: (20*LV+50)*1.15 | I656: (8.5*LV+35)*1.15 | J656: (5*LV+25)*1.15 | K656: (7*LV+2)*0.5*1.15 | L656: (2*LV+6)*1.15 | M656: 1000*LV+100000 | N656: 0 | O656: math.max(0,(lv/10)-1) | P656: math.max(0,(lv/10)-1) | Q656: math.max(0,(lv/10)-1) | R656: 0; | S656: 有药王谷和盘丝洞的弟子在，真是不爽，还是跑路算了！ | T656: 药王谷和盘丝洞的弟子不在眼前，真是轻松愉快啊！ | U656: 0 | V656: 0,0; | W656: 4
A657: 111019 | B657: 玄奘法师 | C657: partner_1007 | D657: 0 | E657: 0 | F657: 1411,100;1412,100; | G657: 0,0; | H657: (20*LV+50)*1.2*1.15 | I657: (8.5*LV+35)*0.5*1.15 | J657: (5*LV+25)*1.1*1.15 | K657: (7*LV+2)*0.5*1.15 | L657: (2*LV+6)*1.5*1.15 | M657: 1000*LV+100000 | N657: 0 | O657: math.max(0,(lv/10)-1) | P657: math.max(0,(lv/10)-1) | Q657: math.max(0,(lv/10)-1) | R657: 0; | S657: 有药王谷和盘丝洞的弟子在，真是不爽，还是跑路算了！ | T657: 药王谷和盘丝洞的弟子不在眼前，真是轻松愉快啊！ | U657: 0 | V657: 0,0; | W657: 2
A658: 111020 | B658: 巫女娘娘 | C658: pet_83 | D658: 0 | E658: 0 | F658: 1511,100;1513,100; | G658: 0,0; | H658: (20*LV+50)*1.2*1.15 | I658: (8.5*LV+35)*0.5*1.15 | J658: (5*LV+25)*0.8*1.15 | K658: (7*LV+2)*1.2*1.15 | L658: (2*LV+6)*2*1.15 | M658: 1000*LV+100000 | N658: 0 | O658: math.max(0,(lv/10)-1) | P658: math.max(0,(lv/10)-1) | Q658: math.max(0,(lv/10)-1) | R658: 0; | S658: 有药王谷和盘丝洞的弟子在，真是不爽，还是跑路算了！ | T658: 药王谷和盘丝洞的弟子不在眼前，真是轻松愉快啊！ | U658: 0 | V658: 0,0; | W658: 5
A659: 111021 | B659: 天策府弟子 | C659: hero_1001 | D659: 0 | E659: 0 | F659: 1112,100; | G659: 0,0; | H659: (10*LV+40)*1.15 | I659: (6.5*LV+35)*1.15 | J659: (3*LV+25)*1.15 | K659: (5*LV+2)*0.5*1.15 | L659: (1.7*LV+6)*1.15 | M659: 1000*LV+100000 | N659: 0 | O659: math.max(0,(lv/10)-1) | P659: math.max(0,(lv/10)-1) | Q659: math.max(0,(lv/10)-1) | R659: 0; | S659: 有药王谷和盘丝洞的弟子在，真是不爽，还是跑路算了！ | T659: 药王谷和盘丝洞的弟子不在眼前，真是轻松愉快啊！ | U659: 0 | V659: 0,0; | W659: 1
A660: 111022 | B660: 天策府弟子 | C660: hero_2001 | D660: 0 | E660: 0 | F660: 1111,100; | G660: 0,0; | H660: (10*LV+40)*1.15 | I660: (6.5*LV+35)*1.15 | J660: (3*LV+25)*1.15 | K660: (5*LV+2)*0.5*1.15 | L660: (1.7*LV+6)*1.15 | M660: 1000*LV+100000 | N660: 0 | O660: math.max(0,(lv/10)-1) | P660: math.max(0,(lv/10)-1) | Q660: math.max(0,(lv/10)-1) | R660: 0; | S660: 有药王谷和盘丝洞的弟子在，真是不爽，还是跑路算了！ | T660: 药王谷和盘丝洞的弟子不在眼前，真是轻松愉快啊！ | U660: 0 | V660: 0,0; | W660: 1
A661: 111023 | B661: 天策府弟子 | C661: hero_1001 | D661: 0 | E661: 0 | F661: 1411,100;1412,100; | G661: 0,0; | H661: (10*LV+40)*0.8*1.15 | I661: (6.5*LV+35)*0.5*1.15 | J661: (3*LV+25)*0.8*1.15 | K661: (5*LV+2)*1.15 | L661: (1.7*LV+6)*0.8*1.15 | M661: 1000*LV+100000 | N661: 0 | O661: math.max(0,(lv/10)-1) | P661: math.max(0,(lv/10)-1) | Q661: math.max(0,(lv/10)-1) | R661: 0; | S661: 有药王谷和盘丝洞的弟子在，真是不爽，还是跑路算了！ | T661: 药王谷和盘丝洞的弟子不在眼前，真是轻松愉快啊！ | U661: 0 | V661: 0,0; | W661: 2
A662: 111024 | B662: 水晶宫弟子 | C662: hero_2001 | D662: 0 | E662: 0 | F662: 1411,100;1412,100; | G662: 0,0; | H662: (10*LV+40)*0.8*1.15 | I662: (6.5*LV+35)*0.5*1.15 | J662: (3*LV+25)*0.8*1.15 | K662: (5*LV+2)*1.15 | L662: (1.7*LV+6)*0.8*1.15 | M662: 1000*LV+100000 | N662: 0 | O662: math.max(0,(lv/10)-1) | P662: math.max(0,(lv/10)-1) | Q662: math.max(0,(lv/10)-1) | R662: 0; | S662: 有药王谷和盘丝洞的弟子在，真是不爽，还是跑路算了！ | T662: 药王谷和盘丝洞的弟子不在眼前，真是轻松愉快啊！ | U662: 0 | V662: 0,0; | W662: 2
A663: 111025 | B663: 兽王寨弟子 | C663: hero_1001 | D663: 0 | E663: 0 | F663: 1312,100;1315,100; | G663: 0,0; | H663: (10*LV+40)*1.15 | I663: (6.5*LV+35)*1.15 | J663: (3*LV+25)*1.15 | K663: (5*LV+2)*0.5*1.15 | L663: (1.7*LV+6)*1.15 | M663: 1000*LV+100000 | N663: 0 | O663: math.max(0,(lv/10)-1) | P663: math.max(0,(lv/10)-1) | Q663: math.max(0,(lv/10)-1) | R663: 0; | S663: 有药王谷和盘丝洞的弟子在，真是不爽，还是跑路算了！ | T663: 药王谷和盘丝洞的弟子不在眼前，真是轻松愉快啊！ | U663: 0 | V663: 0,0; | W663: 4
A664: 111026 | B664: 兽王寨弟子 | C664: hero_2001 | D664: 0 | E664: 0 | F664: 1311,100;1315,100; | G664: 0,0; | H664: (10*LV+40)*1.15 | I664: (6.5*LV+35)*1.15 | J664: (3*LV+25)*1.15 | K664: (5*LV+2)*0.5*1.15 | L664: (1.7*LV+6)*1.15 | M664: 1000*LV+100000 | N664: 0 | O664: math.max(0,(lv/10)-1) | P664: math.max(0,(lv/10)-1) | Q664: math.max(0,(lv/10)-1) | R664: 0; | S664: 有药王谷和盘丝洞的弟子在，真是不爽，还是跑路算了！ | T664: 药王谷和盘丝洞的弟子不在眼前，真是轻松愉快啊！ | U664: 0 | V664: 0,0; | W664: 4
A665: 111027 | B665: 药王谷弟子 | C665: hero_1001 | D665: 0 | E665: 0 | F665: 1212,100;1211,100; | G665: 0,0; | H665: (10*LV+40)*1.2*1.15 | I665: (6.5*LV+35)*0.5*1.15 | J665: (3*LV+25)*1.1*1.15 | K665: (5*LV+2)*0.5*1.15 | L665: (1.7*LV+6)*1.5*1.15 | M665: 1000*LV+100000 | N665: 0 | O665: math.max(0,(lv/10)-1) | P665: math.max(0,(lv/10)-1) | Q665: math.max(0,(lv/10)-1) | R665: 0; | S665: 有药王谷和盘丝洞的弟子在，真是不爽，还是跑路算了！ | T665: 药王谷和盘丝洞的弟子不在眼前，真是轻松愉快啊！ | U665: 0 | V665: 0,0; | W665: 3
A666: 111028 | B666: 药王谷弟子 | C666: hero_2001 | D666: 0 | E666: 0 | F666: 5305,100; | G666: 0,0; | H666: (10*LV+40)*1.2*1.15 | I666: (6.5*LV+35)*0.5*1.15 | J666: (3*LV+25)*1.1*1.15 | K666: (5*LV+2)*1.15 | L666: (1.7*LV+6)*1.5*1.15 | M666: 1000*LV+100000 | N666: 0 | O666: math.max(0,(lv/10)-1) | P666: math.max(0,(lv/10)-1) | Q666: math.max(0,(lv/10)-1) | R666: 0; | S666: 有药王谷和盘丝洞的弟子在，真是不爽，还是跑路算了！ | T666: 药王谷和盘丝洞的弟子不在眼前，真是轻松愉快啊！ | U666: 0 | V666: 0,0; | W666: 2
A667: 111029 | B667: 盘丝洞弟子 | C667: hero_1001 | D667: 0 | E667: 0 | F667: 1511,100;1513,100; | G667: 0,0; | H667: (10*LV+40)*1.2*1.15 | I667: (6.5*LV+35)*0.5*1.15 | J667: (3*LV+25)*0.8*1.15 | K667: (5*LV+2)*1.15 | L667: (1.7*LV+6)*2*1.15 | M667: 1000*LV+100000 | N667: 0 | O667: math.max(0,(lv/10)-1) | P667: math.max(0,(lv/10)-1) | Q667: math.max(0,(lv/10)-1) | R667: 0; | S667: 有药王谷和盘丝洞的弟子在，真是不爽，还是跑路算了！ | T667: 药王谷和盘丝洞的弟子不在眼前，真是轻松愉快啊！ | U667: 0 | V667: 0,0; | W667: 5
A668: 111030 | B668: 盘丝洞弟子 | C668: hero_2001 | D668: 0 | E668: 0 | F668: 1511,100;1513,100; | G668: 0,0; | H668: (10*LV+40)*1.2*1.15 | I668: (6.5*LV+35)*0.5*1.15 | J668: (3*LV+25)*0.8*1.15 | K668: (5*LV+2)*1.15 | L668: (1.7*LV+6)*2*1.15 | M668: 1000*LV+100000 | N668: 0 | O668: math.max(0,(lv/10)-1) | P668: math.max(0,(lv/10)-1) | Q668: math.max(0,(lv/10)-1) | R668: 0; | S668: 有药王谷和盘丝洞的弟子在，真是不爽，还是跑路算了！ | T668: 药王谷和盘丝洞的弟子不在眼前，真是轻松愉快啊！ | U668: 0 | V668: 0,0; | W668: 5
A669: 111031 | B669: 天策 | C669: hero_1001 | D669: 0 | E669: 0 | F669: 1111,100;1112,100; | G669: 0,0; | H669: (20*LV+50)*1.3 | I669: (8.5*LV+35)*1.3 | J669: (5*LV+25)*1.3 | K669: (7*LV+2)*0.5*1.3 | L669: (2*LV+6)*1.3 | M669: 1000*LV+100000 | N669: 0 | O669: math.max(0,(lv/10)-1) | P669: math.max(0,(lv/10)-1) | Q669: math.max(0,(lv/10)-1) | R669: 0; | S669: 有药王谷和盘丝洞的弟子在，真是不爽，还是跑路算了！ | T669: 药王谷和盘丝洞的弟子不在眼前，真是轻松愉快啊！ | U669: 0 | V669: 0,0; | W669: 1
A670: 111032 | B670: 道观真人 | C670: partner_1007 | D670: 0 | E670: 0 | F670: 1411,100;1412,100; | G670: 0,0; | H670: (20*LV+50)*0.8*1.3 | I670: (8.5*LV+35)*0.5*1.3 | J670: (5*LV+25)*0.8*1.3 | K670: (7*LV+2)*1.2*1.3 | L670: (2*LV+6)*0.8*1.3 | M670: 1000*LV+100000 | N670: 0 | O670: math.max(0,(lv/10)-1) | P670: math.max(0,(lv/10)-1) | Q670: math.max(0,(lv/10)-1) | R670: 0; | S670: 有药王谷和盘丝洞的弟子在，真是不爽，还是跑路算了！ | T670: 药王谷和盘丝洞的弟子不在眼前，真是轻松愉快啊！ | U670: 0 | V670: 0,0; | W670: 2
A671: 111033 | B671: 青花仙灵 | C671: pet_42 | D671: 0 | E671: 0 | F671: 1312,100;1315,100; | G671: 0,0; | H671: (20*LV+50)*1.3 | I671: (8.5*LV+35)*1.3 | J671: (5*LV+25)*1.3 | K671: (7*LV+2)*0.5*1.3 | L671: (2*LV+6)*1.3 | M671: 1000*LV+100000 | N671: 0 | O671: math.max(0,(lv/10)-1) | P671: math.max(0,(lv/10)-1) | Q671: math.max(0,(lv/10)-1) | R671: 0; | S671: 有药王谷和盘丝洞的弟子在，真是不爽，还是跑路算了！ | T671: 药王谷和盘丝洞的弟子不在眼前，真是轻松愉快啊！ | U671: 0 | V671: 0,0; | W671: 4
A672: 111034 | B672: 玄奘法师 | C672: partner_1007 | D672: 0 | E672: 0 | F672: 1411,100;1412,100; | G672: 0,0; | H672: (20*LV+50)*1.2*1.3 | I672: (8.5*LV+35)*0.5*1.3 | J672: (5*LV+25)*1.1*1.3 | K672: (7*LV+2)*0.5*1.3 | L672: (2*LV+6)*1.5*1.3 | M672: 1000*LV+100000 | N672: 0 | O672: math.max(0,(lv/10)-1) | P672: math.max(0,(lv/10)-1) | Q672: math.max(0,(lv/10)-1) | R672: 0; | S672: 有药王谷和盘丝洞的弟子在，真是不爽，还是跑路算了！ | T672: 药王谷和盘丝洞的弟子不在眼前，真是轻松愉快啊！ | U672: 0 | V672: 0,0; | W672: 2
A673: 111035 | B673: 巫女娘娘 | C673: pet_83 | D673: 0 | E673: 0 | F673: 1511,100;1513,100; | G673: 0,0; | H673: (20*LV+50)*1.2*1.3 | I673: (8.5*LV+35)*0.5*1.3 | J673: (5*LV+25)*0.8*1.3 | K673: (7*LV+2)*1.2*1.3 | L673: (2*LV+6)*2*1.3 | M673: 1000*LV+100000 | N673: 0 | O673: math.max(0,(lv/10)-1) | P673: math.max(0,(lv/10)-1) | Q673: math.max(0,(lv/10)-1) | R673: 0; | S673: 有药王谷和盘丝洞的弟子在，真是不爽，还是跑路算了！ | T673: 药王谷和盘丝洞的弟子不在眼前，真是轻松愉快啊！ | U673: 0 | V673: 0,0; | W673: 5
A674: 111036 | B674: 天策府弟子 | C674: hero_1001 | D674: 0 | E674: 0 | F674: 1112,100; | G674: 0,0; | H674: (10*LV+40)*1.3 | I674: (6.5*LV+35)*1.3 | J674: (3*LV+25)*1.3 | K674: (5*LV+2)*0.5*1.3 | L674: (1.7*LV+6)*1.3 | M674: 1000*LV+100000 | N674: 0 | O674: math.max(0,(lv/10)-1) | P674: math.max(0,(lv/10)-1) | Q674: math.max(0,(lv/10)-1) | R674: 0; | S674: 有药王谷和盘丝洞的弟子在，真是不爽，还是跑路算了！ | T674: 药王谷和盘丝洞的弟子不在眼前，真是轻松愉快啊！ | U674: 0 | V674: 0,0; | W674: 1
A675: 111037 | B675: 天策府弟子 | C675: hero_2001 | D675: 0 | E675: 0 | F675: 1111,100; | G675: 0,0; | H675: (10*LV+40)*1.3 | I675: (6.5*LV+35)*1.3 | J675: (3*LV+25)*1.3 | K675: (5*LV+2)*0.5*1.3 | L675: (1.7*LV+6)*1.3 | M675: 1000*LV+100000 | N675: 0 | O675: math.max(0,(lv/10)-1) | P675: math.max(0,(lv/10)-1) | Q675: math.max(0,(lv/10)-1) | R675: 0; | S675: 有药王谷和盘丝洞的弟子在，真是不爽，还是跑路算了！ | T675: 药王谷和盘丝洞的弟子不在眼前，真是轻松愉快啊！ | U675: 0 | V675: 0,0; | W675: 1
A676: 111038 | B676: 天策府弟子 | C676: hero_1001 | D676: 0 | E676: 0 | F676: 1411,100;1412,100; | G676: 0,0; | H676: (10*LV+40)*0.8*1.3 | I676: (6.5*LV+35)*0.5*1.3 | J676: (3*LV+25)*0.8*1.3 | K676: (5*LV+2)*1.3 | L676: (1.7*LV+6)*0.8*1.3 | M676: 1000*LV+100000 | N676: 0 | O676: math.max(0,(lv/10)-1) | P676: math.max(0,(lv/10)-1) | Q676: math.max(0,(lv/10)-1) | R676: 0; | S676: 有药王谷和盘丝洞的弟子在，真是不爽，还是跑路算了！ | T676: 药王谷和盘丝洞的弟子不在眼前，真是轻松愉快啊！ | U676: 0 | V676: 0,0; | W676: 2
A677: 111039 | B677: 水晶宫弟子 | C677: hero_2001 | D677: 0 | E677: 0 | F677: 1411,100;1412,100; | G677: 0,0; | H677: (10*LV+40)*0.8*1.3 | I677: (6.5*LV+35)*0.5*1.3 | J677: (3*LV+25)*0.8*1.3 | K677: (5*LV+2)*1.3 | L677: (1.7*LV+6)*0.8*1.3 | M677: 1000*LV+100000 | N677: 0 | O677: math.max(0,(lv/10)-1) | P677: math.max(0,(lv/10)-1) | Q677: math.max(0,(lv/10)-1) | R677: 0; | S677: 有药王谷和盘丝洞的弟子在，真是不爽，还是跑路算了！ | T677: 药王谷和盘丝洞的弟子不在眼前，真是轻松愉快啊！ | U677: 0 | V677: 0,0; | W677: 2
A678: 111040 | B678: 兽王寨弟子 | C678: hero_1001 | D678: 0 | E678: 0 | F678: 1312,100;1315,100; | G678: 0,0; | H678: (10*LV+40)*1.3 | I678: (6.5*LV+35)*1.3 | J678: (3*LV+25)*1.3 | K678: (5*LV+2)*0.5*1.3 | L678: (1.7*LV+6)*1.3 | M678: 1000*LV+100000 | N678: 0 | O678: math.max(0,(lv/10)-1) | P678: math.max(0,(lv/10)-1) | Q678: math.max(0,(lv/10)-1) | R678: 0; | S678: 有药王谷和盘丝洞的弟子在，真是不爽，还是跑路算了！ | T678: 药王谷和盘丝洞的弟子不在眼前，真是轻松愉快啊！ | U678: 0 | V678: 0,0; | W678: 4
A679: 111041 | B679: 兽王寨弟子 | C679: hero_2001 | D679: 0 | E679: 0 | F679: 1311,100;1315,100; | G679: 0,0; | H679: (10*LV+40)*1.3 | I679: (6.5*LV+35)*1.3 | J679: (3*LV+25)*1.3 | K679: (5*LV+2)*0.5*1.3 | L679: (1.7*LV+6)*1.3 | M679: 1000*LV+100000 | N679: 0 | O679: math.max(0,(lv/10)-1) | P679: math.max(0,(lv/10)-1) | Q679: math.max(0,(lv/10)-1) | R679: 0; | S679: 有药王谷和盘丝洞的弟子在，真是不爽，还是跑路算了！ | T679: 药王谷和盘丝洞的弟子不在眼前，真是轻松愉快啊！ | U679: 0 | V679: 0,0; | W679: 4
A680: 111042 | B680: 药王谷弟子 | C680: hero_1001 | D680: 0 | E680: 0 | F680: 1212,100;1211,100; | G680: 0,0; | H680: (10*LV+40)*1.2*1.3 | I680: (6.5*LV+35)*0.5*1.3 | J680: (3*LV+25)*1.1*1.3 | K680: (5*LV+2)*0.5*1.3 | L680: (1.7*LV+6)*1.5*1.3 | M680: 1000*LV+100000 | N680: 0 | O680: math.max(0,(lv/10)-1) | P680: math.max(0,(lv/10)-1) | Q680: math.max(0,(lv/10)-1) | R680: 0; | S680: 有药王谷和盘丝洞的弟子在，真是不爽，还是跑路算了！ | T680: 药王谷和盘丝洞的弟子不在眼前，真是轻松愉快啊！ | U680: 0 | V680: 0,0; | W680: 3
A681: 111043 | B681: 药王谷弟子 | C681: hero_2001 | D681: 0 | E681: 0 | F681: 5305,100; | G681: 0,0; | H681: (10*LV+40)*1.2*1.3 | I681: (6.5*LV+35)*0.5*1.3 | J681: (3*LV+25)*1.1*1.3 | K681: (5*LV+2)*1.3 | L681: (1.7*LV+6)*1.5*1.3 | M681: 1000*LV+100000 | N681: 0 | O681: math.max(0,(lv/10)-1) | P681: math.max(0,(lv/10)-1) | Q681: math.max(0,(lv/10)-1) | R681: 0; | S681: 有药王谷和盘丝洞的弟子在，真是不爽，还是跑路算了！ | T681: 药王谷和盘丝洞的弟子不在眼前，真是轻松愉快啊！ | U681: 0 | V681: 0,0; | W681: 2
A682: 111044 | B682: 盘丝洞弟子 | C682: hero_1001 | D682: 0 | E682: 0 | F682: 1511,100;1513,100; | G682: 0,0; | H682: (10*LV+40)*1.2*1.3 | I682: (6.5*LV+35)*0.5*1.3 | J682: (3*LV+25)*0.8*1.3 | K682: (5*LV+2)*1.3 | L682: (1.7*LV+6)*2*1.3 | M682: 1000*LV+100000 | N682: 0 | O682: math.max(0,(lv/10)-1) | P682: math.max(0,(lv/10)-1) | Q682: math.max(0,(lv/10)-1) | R682: 0; | S682: 有药王谷和盘丝洞的弟子在，真是不爽，还是跑路算了！ | T682: 药王谷和盘丝洞的弟子不在眼前，真是轻松愉快啊！ | U682: 0 | V682: 0,0; | W682: 5
A683: 111045 | B683: 盘丝洞弟子 | C683: hero_2001 | D683: 0 | E683: 0 | F683: 1511,100;1513,100; | G683: 0,0; | H683: (10*LV+40)*1.2*1.3 | I683: (6.5*LV+35)*0.5*1.3 | J683: (3*LV+25)*0.8*1.3 | K683: (5*LV+2)*1.3 | L683: (1.7*LV+6)*2*1.3 | M683: 1000*LV+100000 | N683: 0 | O683: math.max(0,(lv/10)-1) | P683: math.max(0,(lv/10)-1) | Q683: math.max(0,(lv/10)-1) | R683: 0; | S683: 有药王谷和盘丝洞的弟子在，真是不爽，还是跑路算了！ | T683: 药王谷和盘丝洞的弟子不在眼前，真是轻松愉快啊！ | U683: 0 | V683: 0,0; | W683: 5
A684: 120 | B684: 皇宫禁卫 | C684: common_3018 | D684: 0 | E684: 0 | F684: 1411,100; | G684: 0,0; | H684: 52*LV+259.8 | I684: (11.6*LV+21.6)*0.98 | J684: 1.5*LV+23 | K684: 4.2*LV+8.5 | L684: LV+8 | M684: 1000*LV+100000 | N684: 0 | O684: math.max(0,(lv/10)-1) | P684: math.max(0,(lv/10)-1) | Q684: math.max(0,(lv/10)-1) | R684: 0; | S684: 有药王谷和盘丝洞的弟子在，真是不爽，还是跑路算了！ | T684: 药王谷和盘丝洞的弟子不在眼前，真是轻松愉快啊！ | U684: 0 | V684: 0,0; | W684: 2
A685: 121 | B685: 幻影派弟子 | C685: hero_1001 | D685: 0 | E685: 0 | F685: 5302,100; | G685: 0,0; | H685: 26*LV+129.9 | I685: (6.9*LV+10.8)*0.97 | J685: 0.9*LV+10 | K685: 2.1*LV+4.4 | L685: 0.8*LV+8 | M685: 1000*LV+100000 | N685: 0 | O685: math.max(0,(lv/10)-1) | P685: math.max(0,(lv/10)-1) | Q685: math.max(0,(lv/10)-1) | R685: 0; | S685: 有药王谷和盘丝洞的弟子在，真是不爽，还是跑路算了！ | T685: 药王谷和盘丝洞的弟子不在眼前，真是轻松愉快啊！ | U685: 0 | V685: 0,0; | W685: 4
A686: 130 | B686: 房府家丁 | C686: common_3007 | D686: 0 | E686: 0 | F686: 1411,100; | G686: 0,0; | H686: 52.9*LV+264.7 | I686: (12.4*LV+22.4)*0.97 | J686: 1.5*LV+23 | K686: 4.4*LV+8.7 | L686: LV+8 | M686: 1000*LV+100000 | N686: 0 | O686: math.max(0,(lv/10)-1) | P686: math.max(0,(lv/10)-1) | Q686: math.max(0,(lv/10)-1) | R686: 0; | S686: 有药王谷和盘丝洞的弟子在，真是不爽，还是跑路算了！ | T686: 药王谷和盘丝洞的弟子不在眼前，真是轻松愉快啊！ | U686: 0 | V686: 0,0; | W686: 2
A687: 131 | B687: 剑灵 | C687: pet_21 | D687: 0 | E687: 0 | F687: 5306,100; | G687: 0,0; | H687: 26.5*LV+132.4 | I687: (7.4*LV+11.2)*0.96 | J687: 0.9*LV+10 | K687: 2.2*LV+4.6 | L687: 0.8*LV+8 | M687: 1000*LV+100000 | N687: 0 | O687: math.max(0,(lv/10)-1) | P687: math.max(0,(lv/10)-1) | Q687: math.max(0,(lv/10)-1) | R687: 0; | S687: 有药王谷和盘丝洞的弟子在，真是不爽，还是跑路算了！ | T687: 药王谷和盘丝洞的弟子不在眼前，真是轻松愉快啊！ | U687: 0 | V687: 0,0; | W687: 4
A688: 140 | B688: 巫十三 | C688: common_3018 | D688: 0 | E688: 0 | F688: 1311,100;1315,100; | G688: 0,0; | H688: 53.9*LV+269.6 | I688: (13.1*LV+23.1)*0.96 | J688: 1.5*LV+23 | K688: (4.5*LV+8.9)*0.05 | L688: LV+8 | M688: 1000*LV+100000 | N688: 0 | O688: math.max(0,(lv/10)-1) | P688: math.max(0,(lv/10)-1) | Q688: math.max(0,(lv/10)-1) | R688: 0; | S688: 有药王谷和盘丝洞的弟子在，真是不爽，还是跑路算了！ | T688: 药王谷和盘丝洞的弟子不在眼前，真是轻松愉快啊！ | U688: 0 | V688: 0,0; | W688: 4
A689: 141 | B689: 打手 | C689: pet_43 | D689: 0 | E689: 0 | F689: 5304,100; | G689: 0,0; | H689: 27*LV+134.8 | I689: (7.9*LV+11.6)*0.96 | J689: 0.9*LV+10 | K689: 2.2*LV+4.9 | L689: 0.8*LV+8 | M689: 1000*LV+100000 | N689: 0 | O689: math.max(0,(lv/10)-1) | P689: math.max(0,(lv/10)-1) | Q689: math.max(0,(lv/10)-1) | R689: 0; | S689: 有药王谷和盘丝洞的弟子在，真是不爽，还是跑路算了！ | T689: 药王谷和盘丝洞的弟子不在眼前，真是轻松愉快啊！ | U689: 0 | V689: 0,0; | W689: 2
A690: 150 | B690: 抢药少女 | C690: pet_42 | D690: 0 | E690: 0 | F690: 1211,100;1212,100;1213,100; | G690: 0,0; | H690: 54.9*LV+274.5 | I690: (13.9*LV+23.9)*0.95 | J690: 1.5*LV+23 | K690: 4.6*LV+9.2 | L690: LV+8 | M690: 1000*LV+100000 | N690: 0 | O690: math.max(0,(lv/10)-1) | P690: math.max(0,(lv/10)-1) | Q690: math.max(0,(lv/10)-1) | R690: 0; | S690: 有药王谷和盘丝洞的弟子在，真是不爽，还是跑路算了！ | T690: 药王谷和盘丝洞的弟子不在眼前，真是轻松愉快啊！ | U690: 0 | V690: 0,0; | W690: 3
A691: 151 | B691: 九天玄女 | C691: partner_1010 | D691: 0 | E691: 0 | F691: 1411,100;1413,100;1412,100;1416,100; | G691: 0,0; | H691: 27.5*LV+137.3 | I691: (8.4*LV+12)*0.95 | J691: 0.9*LV+10 | K691: 2.3*LV+5.1 | L691: 0.8*LV+8 | M691: 1000*LV+100000 | N691: 0 | O691: math.max(0,(lv/10)-1) | P691: math.max(0,(lv/10)-1) | Q691: math.max(0,(lv/10)-1) | R691: 0; | S691: 有药王谷和盘丝洞的弟子在，真是不爽，还是跑路算了！ | T691: 药王谷和盘丝洞的弟子不在眼前，真是轻松愉快啊！ | U691: 0 | V691: 0,0; | W691: 2
A692: 160 | B692: 神秘人 | C692: pet_52 | D692: 0 | E692: 0 | F692: 5309,100; | G692: 0,0; | H692: 55.9*LV+279.4 | I692: (14.7*LV+24.7)*0.94 | J692: 1.5*LV+10 | K692: (4.7*LV+9.4)*0.05 | L692: LV+8 | M692: 1000*LV+100000 | N692: 0 | O692: math.max(0,(lv/10)-1) | P692: math.max(0,(lv/10)-1) | Q692: math.max(0,(lv/10)-1) | R692: 0; | S692: 有药王谷和盘丝洞的弟子在，真是不爽，还是跑路算了！ | T692: 药王谷和盘丝洞的弟子不在眼前，真是轻松愉快啊！ | U692: 0 | V692: 0,0; | W692: 4
A693: 161 | B693: 熊猫武师 | C693: pet_13 | D693: 0 | E693: 0 | F693: 0,0; | G693: 0,0; | H693: 27.9*LV+139.7 | I693: (8.8*LV+12.4)*0.94 | J693: 0.9*LV+10 | K693: (2.4*LV+5.3)*0.05 | L693: 0.8*LV+8 | M693: 1000*LV+100000 | N693: 0 | O693: math.max(0,(lv/10)-1) | P693: math.max(0,(lv/10)-1) | Q693: math.max(0,(lv/10)-1) | R693: 0; | S693: 有药王谷和盘丝洞的弟子在，真是不爽，还是跑路算了！ | T693: 药王谷和盘丝洞的弟子不在眼前，真是轻松愉快啊！ | U693: 0 | V693: 0,0; | W693: 5
A694: 170 | B694: 尉迟将军 | C694: common_3018 | D694: 0 | E694: 0 | F694: 1411,100; | G694: 0,0; | H694: 56.9*LV+284.3 | I694: (15.5*LV+25.5)*0.93 | J694: 1.5*LV+10 | K694: 4.8*LV+9.6 | L694: 1.4*LV+8 | M694: 1000*LV+100000 | N694: 0 | O694: math.max(0,(lv/10)-1) | P694: math.max(0,(lv/10)-1) | Q694: math.max(0,(lv/10)-1) | R694: 0; | S694: 有药王谷和盘丝洞的弟子在，真是不爽，还是跑路算了！ | T694: 药王谷和盘丝洞的弟子不在眼前，真是轻松愉快啊！ | U694: 0 | V694: 0,0; | W694: 2
A695: 171 | B695: 水晶宫弟子 | C695: hero_2001 | D695: 0 | E695: 0 | F695: 1411,100; | G695: 0,0; | H695: 28.4*LV+142.2 | I695: (9.3*LV+12.7)*0.93 | J695: 0.9*LV+10 | K695: 2.4*LV+5.5 | L695: 0.8*LV+8 | M695: 1000*LV+100000 | N695: 0 | O695: math.max(0,(lv/10)-1) | P695: math.max(0,(lv/10)-1) | Q695: math.max(0,(lv/10)-1) | R695: 0; | S695: 有药王谷和盘丝洞的弟子在，真是不爽，还是跑路算了！ | T695: 药王谷和盘丝洞的弟子不在眼前，真是轻松愉快啊！ | U695: 0 | V695: 0,0; | W695: 2
A696: 180 | B696: 旺财 | C696: pet_1 | D696: 0 | E696: 0 | F696: 1411,100;1413,100;1412,100;1416,100; | G696: 0,0; | H696: 57.8*LV+289.2 | I696: (16.3*LV+26.3)*0.92 | J696: 1.5*LV+10 | K696: 4.9*LV+9.9 | L696: 1.4*LV+8 | M696: 1000*LV+100000 | N696: 0 | O696: math.max(0,(lv/10)-1) | P696: math.max(0,(lv/10)-1) | Q696: math.max(0,(lv/10)-1) | R696: 0; | S696: 有药王谷和盘丝洞的弟子在，真是不爽，还是跑路算了！ | T696: 药王谷和盘丝洞的弟子不在眼前，真是轻松愉快啊！ | U696: 0 | V696: 0,0; | W696: 2
A697: 181 | B697: 随从 | C697: pet_23 | D697: 0 | E697: 0 | F697: 1411,100; | G697: 0,0; | H697: 28.9*LV+144.6 | I697: (9.8*LV+13.1)*0.92 | J697: 0.9*LV+10 | K697: 2.5*LV+5.7 | L697: 0.8*LV+8 | M697: 1000*LV+100000 | N697: 0 | O697: math.max(0,(lv/10)-1) | P697: math.max(0,(lv/10)-1) | Q697: math.max(0,(lv/10)-1) | R697: 0; | S697: 有药王谷和盘丝洞的弟子在，真是不爽，还是跑路算了！ | T697: 药王谷和盘丝洞的弟子不在眼前，真是轻松愉快啊！ | U697: 0 | V697: 0,0; | W697: 2
A698: 190 | B698: 刘沐白 | C698: pet_43 | D698: 0 | E698: 0 | F698: 5308,100; | G698: 0,0; | H698: 58.8*LV+294.1 | I698: (17.1*LV+27.1)*0.91 | J698: 1.5*LV+10 | K698: 5.1*LV+10.1 | L698: 1.4*LV+8 | M698: 1000*LV+100000 | N698: 0 | O698: math.max(0,(lv/10)-1) | P698: math.max(0,(lv/10)-1) | Q698: math.max(0,(lv/10)-1) | R698: 0; | S698: 有药王谷和盘丝洞的弟子在，真是不爽，还是跑路算了！ | T698: 药王谷和盘丝洞的弟子不在眼前，真是轻松愉快啊！ | U698: 0 | V698: 0,0; | W698: 4
A699: 191 | B699: 奴仆 | C699: pet_62 | D699: 0 | E699: 0 | F699: 5304,100; | G699: 0,0; | H699: 29.4*LV+147.1 | I699: (10.2*LV+13.5)*0.91 | J699: 0.9*LV+10 | K699: 2.5*LV+5.9 | L699: 0.8*LV+8 | M699: 1000*LV+100000 | N699: 0 | O699: math.max(0,(lv/10)-1) | P699: math.max(0,(lv/10)-1) | Q699: math.max(0,(lv/10)-1) | R699: 0; | S699: 有药王谷和盘丝洞的弟子在，真是不爽，还是跑路算了！ | T699: 药王谷和盘丝洞的弟子不在眼前，真是轻松愉快啊！ | U699: 0 | V699: 0,0; | W699: 3
A700: 200 | B700: 女贼 | C700: partner_1006 | D700: 0 | E700: 0 | F700: 0,0; | G700: 0,0; | H700: 59.8*LV+299 | I700: (17.8*LV+27.8)*0.9 | J700: 1.5*LV+10 | K700: (5.2*LV+10.4)*0.05 | L700: 1.4*LV+8 | M700: 1000*LV+100000 | N700: 0 | O700: math.max(0,(lv/10)-1) | P700: math.max(0,(lv/10)-1) | Q700: math.max(0,(lv/10)-1) | R700: 0; | S700: 有药王谷和盘丝洞的弟子在，真是不爽，还是跑路算了！ | T700: 药王谷和盘丝洞的弟子不在眼前，真是轻松愉快啊！ | U700: 0 | V700: 0,0; | W700: 2
A701: 201 | B701: 帮凶 | C701: pet_23 | D701: 0 | E701: 0 | F701: 1111,50; | G701: 0,0; | H701: 29.9*LV+149.5 | I701: (10.7*LV+13.9)*0.9 | J701: 0.9*LV+10 | K701: (2.6*LV+6.2)*0.05 | L701: 0.8*LV+8 | M701: 1000*LV+100000 | N701: 0 | O701: math.max(0,(lv/10)-1) | P701: math.max(0,(lv/10)-1) | Q701: math.max(0,(lv/10)-1) | R701: 0; | S701: 有药王谷和盘丝洞的弟子在，真是不爽，还是跑路算了！ | T701: 药王谷和盘丝洞的弟子不在眼前，真是轻松愉快啊！ | U701: 0 | V701: 0,0; | W701: 1
A702: 210 | B702: 僵尸 | C702: pet_62 | D702: 0 | E702: 0 | F702: 1111,100;1112,100;1113,100;1114,100; | G702: 0,0; | H702: 60.8*LV+303.9 | I702: (18.6*LV+28.6)*0.89 | J702: 1.5*LV+10 | K702: (5.3*LV+10.6)*0.05 | L702: 1.4*LV+8 | M702: 1000*LV+100000 | N702: 0 | O702: math.max(0,(lv/10)-1) | P702: math.max(0,(lv/10)-1) | Q702: math.max(0,(lv/10)-1) | R702: 0; | S702: 有药王谷和盘丝洞的弟子在，真是不爽，还是跑路算了！ | T702: 药王谷和盘丝洞的弟子不在眼前，真是轻松愉快啊！ | U702: 0 | V702: 0,0; | W702: 1
A703: 211 | B703: 怒气 | C703: pet_63 | D703: 0 | E703: 0 | F703: 1411,100; | G703: 0,0; | H703: 30.4*LV+152 | I703: (11.2*LV+14.3)*0.89 | J703: 0.9*LV+10 | K703: 2.6*LV+6.4 | L703: 0.8*LV+8 | M703: 1000*LV+100000 | N703: 0 | O703: math.max(0,(lv/10)-1) | P703: math.max(0,(lv/10)-1) | Q703: math.max(0,(lv/10)-1) | R703: 0; | S703: 有药王谷和盘丝洞的弟子在，真是不爽，还是跑路算了！ | T703: 药王谷和盘丝洞的弟子不在眼前，真是轻松愉快啊！ | U703: 0 | V703: 0,0; | W703: 2
A704: 215 | B704: 天策府护卫 | C704: common_3018 | D704: 0 | E704: 0 | F704: 1411,100;1413,100;1412,100;1416,100; | G704: 0,0; | H704: 61.8*LV+308.8 | I704: (19.4*LV+29.4)*0.89 | J704: 1.5*LV+10 | K704: 5.4*LV+10.8 | L704: 1.4*LV+8 | M704: 1000*LV+100000 | N704: 0 | O704: math.max(0,(lv/10)-1) | P704: math.max(0,(lv/10)-1) | Q704: math.max(0,(lv/10)-1) | R704: 0; | S704: 有药王谷和盘丝洞的弟子在，真是不爽，还是跑路算了！ | T704: 药王谷和盘丝洞的弟子不在眼前，真是轻松愉快啊！ | U704: 0 | V704: 0,0; | W704: 2
A705: 220 | B705: 土匪 | C705: partner_1016 | D705: 0 | E705: 0 | F705: 1411,100;1413,100;1412,100;1416,100; | G705: 0,0; | H705: 61.8*LV+308.8 | I705: (19.4*LV+29.4)*0.88 | J705: 1.5*LV+10 | K705: 5.4*LV+10.8 | L705: 1.4*LV+8 | M705: 1000*LV+100000 | N705: 0 | O705: math.max(0,(lv/10)-1) | P705: math.max(0,(lv/10)-1) | Q705: math.max(0,(lv/10)-1) | R705: 0; | S705: 有药王谷和盘丝洞的弟子在，真是不爽，还是跑路算了！ | T705: 药王谷和盘丝洞的弟子不在眼前，真是轻松愉快啊！ | U705: 0 | V705: 0,0; | W705: 2
A706: 221 | B706: 士兵 | C706: pet_71 | D706: 0 | E706: 0 | F706: 5309,100; | G706: 0,0; | H706: 30.9*LV+154.4 | I706: (11.6*LV+14.7)*0.88 | J706: 0.9*LV+10 | K706: (2.7*LV+6.6)*0.05 | L706: 0.8*LV+8 | M706: 1000*LV+100000 | N706: 0 | O706: math.max(0,(lv/10)-1) | P706: math.max(0,(lv/10)-1) | Q706: math.max(0,(lv/10)-1) | R706: 0; | S706: 有药王谷和盘丝洞的弟子在，真是不爽，还是跑路算了！ | T706: 药王谷和盘丝洞的弟子不在眼前，真是轻松愉快啊！ | U706: 0 | V706: 0,0; | W706: 2
A707: 230 | B707: 莫离 | C707: partner_1006 | D707: 0 | E707: 0 | F707: 1411,100;1413,100;1412,100;1416,100; | G707: 0,0; | H707: 62.7*LV+313.7 | I707: (20.2*LV+30.2)*0.87 | J707: 1.5*LV+10 | K707: 5.5*LV+11.1 | L707: 1.4*LV+8 | M707: 1000*LV+100000 | N707: 0 | O707: math.max(0,(lv/10)-1) | P707: math.max(0,(lv/10)-1) | Q707: math.max(0,(lv/10)-1) | R707: 0; | S707: 有药王谷和盘丝洞的弟子在，真是不爽，还是跑路算了！ | T707: 药王谷和盘丝洞的弟子不在眼前，真是轻松愉快啊！ | U707: 0 | V707: 0,0; | W707: 2
A708: 231 | B708: 护卫 | C708: pet_23 | D708: 0 | E708: 0 | F708: 1411,100; | G708: 0,0; | H708: 31.4*LV+156.9 | I708: (12.1*LV+15.1)*0.87 | J708: 0.9*LV+10 | K708: 2.8*LV+6.8 | L708: 0.8*LV+8 | M708: 1000*LV+100000 | N708: 0 | O708: math.max(0,(lv/10)-1) | P708: math.max(0,(lv/10)-1) | Q708: math.max(0,(lv/10)-1) | R708: 0; | S708: 有药王谷和盘丝洞的弟子在，真是不爽，还是跑路算了！ | T708: 药王谷和盘丝洞的弟子不在眼前，真是轻松愉快啊！ | U708: 0 | V708: 0,0; | W708: 2
A709: 240 | B709: 秦琼亲卫 | C709: common_3018 | D709: 0 | E709: 0 | F709: 1411,100;1413,100;1412,100;1416,100; | G709: 0,0; | H709: 63.7*LV+318.6 | I709: (21*LV+31)*0.86 | J709: 1.5*LV+10 | K709: 5.6*LV+11.3 | L709: 1.4*LV+8 | M709: 1000*LV+100000 | N709: 0 | O709: math.max(0,(lv/10)-1) | P709: math.max(0,(lv/10)-1) | Q709: math.max(0,(lv/10)-1) | R709: 0; | S709: 有药王谷和盘丝洞的弟子在，真是不爽，还是跑路算了！ | T709: 药王谷和盘丝洞的弟子不在眼前，真是轻松愉快啊！ | U709: 0 | V709: 0,0; | W709: 2
A710: 241 | B710: 剑灵 | C710: pet_21 | D710: 0 | E710: 0 | F710: 5309,100; | G710: 0,0; | H710: 31.9*LV+159.3 | I710: (12.6*LV+15.5)*0.86 | J710: 0.9*LV+10 | K710: (2.8*LV+7)*0.05 | L710: 0.8*LV+8 | M710: 1000*LV+100000 | N710: 0 | O710: math.max(0,(lv/10)-1) | P710: math.max(0,(lv/10)-1) | Q710: math.max(0,(lv/10)-1) | R710: 0; | S710: 有药王谷和盘丝洞的弟子在，真是不爽，还是跑路算了！ | T710: 药王谷和盘丝洞的弟子不在眼前，真是轻松愉快啊！ | U710: 0 | V710: 0,0; | W710: 2
A711: 250 | B711: 扶桑军 | C711: partner_1016 | D711: 0 | E711: 0 | F711: 1411,100;1413,100;1412,100;1416,100; | G711: 0,0; | H711: 64.7*LV+323.5 | I711: (21.8*LV+31.8)*0.85 | J711: 1.5*LV+10 | K711: 5.8*LV+11.5 | L711: 1.4*LV+8 | M711: 1000*LV+100000 | N711: 0 | O711: math.max(0,(lv/10)-1) | P711: math.max(0,(lv/10)-1) | Q711: math.max(0,(lv/10)-1) | R711: 0; | S711: 有药王谷和盘丝洞的弟子在，真是不爽，还是跑路算了！ | T711: 药王谷和盘丝洞的弟子不在眼前，真是轻松愉快啊！ | U711: 0 | V711: 0,0; | W711: 2
A712: 251 | B712: 护卫 | C712: pet_23 | D712: 0 | E712: 0 | F712: 1411,100; | G712: 0,0; | H712: 32.4*LV+161.8 | I712: (13.1*LV+15.9)*0.85 | J712: 0.9*LV+10 | K712: 2.9*LV+7.2 | L712: 0.8*LV+8 | M712: 1000*LV+100000 | N712: 0 | O712: math.max(0,(lv/10)-1) | P712: math.max(0,(lv/10)-1) | Q712: math.max(0,(lv/10)-1) | R712: 0; | S712: 有药王谷和盘丝洞的弟子在，真是不爽，还是跑路算了！ | T712: 药王谷和盘丝洞的弟子不在眼前，真是轻松愉快啊！ | U712: 0 | V712: 0,0; | W712: 2
A713: 260 | B713: 波斯巫师 | C713: pet_61 | D713: 0 | E713: 0 | F713: 5307,100; | G713: 0,0; | H713: 65.7*LV+328.4 | I713: (22.5*LV+32.5)*0.84 | J713: 1.5*LV+10 | K713: 5.9*LV+11.8 | L713: 1.4*LV+8 | M713: 1000*LV+100000 | N713: 0 | O713: math.max(0,(lv/10)-1) | P713: math.max(0,(lv/10)-1) | Q713: math.max(0,(lv/10)-1) | R713: 0; | S713: 有药王谷和盘丝洞的弟子在，真是不爽，还是跑路算了！ | T713: 药王谷和盘丝洞的弟子不在眼前，真是轻松愉快啊！ | U713: 0 | V713: 0,0; | W713: 1
A714: 261 | B714: 巫师守卫 | C714: pet_62 | D714: 0 | E714: 0 | F714: 5306,100; | G714: 0,0; | H714: 32.8*LV+164.2 | I714: (13.5*LV+16.3)*0.84 | J714: 0.9*LV+10 | K714: 2.9*LV+7.5 | L714: 0.8*LV+8 | M714: 1000*LV+100000 | N714: 0 | O714: math.max(0,(lv/10)-1) | P714: math.max(0,(lv/10)-1) | Q714: math.max(0,(lv/10)-1) | R714: 0; | S714: 有药王谷和盘丝洞的弟子在，真是不爽，还是跑路算了！ | T714: 药王谷和盘丝洞的弟子不在眼前，真是轻松愉快啊！ | U714: 0 | V714: 0,0; | W714: 3
A715: 270 | B715: 川吉将军 | C715: pet_81 | D715: 0 | E715: 0 | F715: 1411,100;1413,100;1412,100;1416,100; | G715: 0,0; | H715: 66.7*LV+333.3 | I715: (23.3*LV+33.3)*0.83 | J715: 1.5*LV+10 | K715: 6*LV+12 | L715: 1.4*LV+8 | M715: 1000*LV+100000 | N715: 0 | O715: math.max(0,(lv/10)-1) | P715: math.max(0,(lv/10)-1) | Q715: math.max(0,(lv/10)-1) | R715: 0; | S715: 有药王谷和盘丝洞的弟子在，真是不爽，还是跑路算了！ | T715: 药王谷和盘丝洞的弟子不在眼前，真是轻松愉快啊！ | U715: 0 | V715: 0,0; | W715: 2
A716: 271 | B716: 护卫 | C716: pet_23 | D716: 0 | E716: 0 | F716: 1411,100; | G716: 0,0; | H716: 33.3*LV+166.7 | I716: (14*LV+16.7)*0.83 | J716: 0.9*LV+10 | K716: 3*LV+7.7 | L716: 0.8*LV+8 | M716: 1000*LV+100000 | N716: 0 | O716: math.max(0,(lv/10)-1) | P716: math.max(0,(lv/10)-1) | Q716: math.max(0,(lv/10)-1) | R716: 0; | S716: 有药王谷和盘丝洞的弟子在，真是不爽，还是跑路算了！ | T716: 药王谷和盘丝洞的弟子不在眼前，真是轻松愉快啊！ | U716: 0 | V716: 0,0; | W716: 2
A717: 280 | B717: 王二狗 | C717: partner_1016 | D717: 0 | E717: 0 | F717: 1411,100;1413,100;1412,100;1416,100; | G717: 0,0; | H717: 67.6*LV+338.2 | I717: (24.1*LV+34.1)*0.82 | J717: 1.5*LV+10 | K717: 6.1*LV+12.2 | L717: 1.4*LV+8 | M717: 1000*LV+100000 | N717: 0 | O717: math.max(0,(lv/10)-1) | P717: math.max(0,(lv/10)-1) | Q717: math.max(0,(lv/10)-1) | R717: 0; | S717: 有药王谷和盘丝洞的弟子在，真是不爽，还是跑路算了！ | T717: 药王谷和盘丝洞的弟子不在眼前，真是轻松愉快啊！ | U717: 0 | V717: 0,0; | W717: 2
A718: 281 | B718: 护卫 | C718: pet_23 | D718: 0 | E718: 0 | F718: 1411,100; | G718: 0,0; | H718: 33.8*LV+169.1 | I718: (14.5*LV+17.1)*0.82 | J718: 0.9*LV+10 | K718: 3.1*LV+7.9 | L718: 0.8*LV+8 | M718: 1000*LV+100000 | N718: 0 | O718: math.max(0,(lv/10)-1) | P718: math.max(0,(lv/10)-1) | Q718: math.max(0,(lv/10)-1) | R718: 0; | S718: 有药王谷和盘丝洞的弟子在，真是不爽，还是跑路算了！ | T718: 药王谷和盘丝洞的弟子不在眼前，真是轻松愉快啊！ | U718: 0 | V718: 0,0; | W718: 2
A719: 290 | B719: 巫族侍卫 | C719: pet_62 | D719: 0 | E719: 0 | F719: 1411,100;1413,100;1412,100;1416,100; | G719: 0,0; | H719: 68.6*LV+343.1 | I719: (24.9*LV+34.9)*0.81 | J719: 1.5*LV+10 | K719: 6.2*LV+12.5 | L719: 1.4*LV+8 | M719: 1000*LV+100000 | N719: 0 | O719: math.max(0,(lv/10)-1) | P719: math.max(0,(lv/10)-1) | Q719: math.max(0,(lv/10)-1) | R719: 0; | S719: 有药王谷和盘丝洞的弟子在，真是不爽，还是跑路算了！ | T719: 药王谷和盘丝洞的弟子不在眼前，真是轻松愉快啊！ | U719: 0 | V719: 0,0; | W719: 2
A720: 291 | B720: 剑灵 | C720: pet_21 | D720: 0 | E720: 0 | F720: 5309,100; | G720: 0,0; | H720: 34.3*LV+171.6 | I720: (14.9*LV+17.5)*0.81 | J720: 0.9*LV+10 | K720: (3.1*LV+8.1)*0.05 | L720: 0.8*LV+8 | M720: 1000*LV+100000 | N720: 0 | O720: math.max(0,(lv/10)-1) | P720: math.max(0,(lv/10)-1) | Q720: math.max(0,(lv/10)-1) | R720: 0; | S720: 有药王谷和盘丝洞的弟子在，真是不爽，还是跑路算了！ | T720: 药王谷和盘丝洞的弟子不在眼前，真是轻松愉快啊！ | U720: 0 | V720: 0,0; | W720: 2
A721: 300 | B721: 夜无极 | C721: pet_53 | D721: 0 | E721: 0 | F721: 1411,100;1413,100;1412,100;1416,100; | G721: 0,0; | H721: 69.6*LV+348 | I721: (25.7*LV+35.7)*0.8 | J721: 1.5*LV+10 | K721: 6.4*LV+12.7 | L721: 1.4*LV+8 | M721: 1000*LV+100000 | N721: 0 | O721: math.max(0,(lv/10)-1) | P721: math.max(0,(lv/10)-1) | Q721: math.max(0,(lv/10)-1) | R721: 0; | S721: 有药王谷和盘丝洞的弟子在，真是不爽，还是跑路算了！ | T721: 药王谷和盘丝洞的弟子不在眼前，真是轻松愉快啊！ | U721: 0 | V721: 0,0; | W721: 2
A722: 301 | B722: 剑灵 | C722: pet_21 | D722: 0 | E722: 0 | F722: 1411,50; | G722: 0,0; | H722: 34.8*LV+174 | I722: (15.4*LV+17.8)*0.8 | J722: 0.9*LV+10 | K722: 3.2*LV+8.3 | L722: 0.8*LV+8 | M722: 1000*LV+100000 | N722: 0 | O722: math.max(0,(lv/10)-1) | P722: math.max(0,(lv/10)-1) | Q722: math.max(0,(lv/10)-1) | R722: 0; | S722: 有药王谷和盘丝洞的弟子在，真是不爽，还是跑路算了！ | T722: 药王谷和盘丝洞的弟子不在眼前，真是轻松愉快啊！ | U722: 0 | V722: 0,0; | W722: 2
A723: 310 | B723: 和尚不为 | C723: partner_1007 | D723: 0 | E723: 0 | F723: 1313,100;1315,100; | G723: 0,0; | H723: 70.6*LV+352.9 | I723: (26.5*LV+36.5)*0.79 | J723: 1.5*LV+10 | K723: (6.5*LV+12.9)*0.05 | L723: 1.4*LV+8 | M723: 1000*LV+100000 | N723: 0 | O723: math.max(0,(lv/10)-1) | P723: math.max(0,(lv/10)-1) | Q723: math.max(0,(lv/10)-1) | R723: 0; | S723: 有药王谷和盘丝洞的弟子在，真是不爽，还是跑路算了！ | T723: 药王谷和盘丝洞的弟子不在眼前，真是轻松愉快啊！ | U723: 0 | V723: 0,0; | W723: 4
A724: 311 | B724: 毒仙子 | C724: partner_1005 | D724: 0 | E724: 0 | F724: 1211,100;1212,100;1213,100; | G724: 0,0; | H724: 35.3*LV+176.5 | I724: (15.9*LV+18.2)*0.79 | J724: 0.9*LV+10 | K724: (3.2*LV+8.5)*0.05 | L724: 0.8*LV+8 | M724: 1000*LV+100000 | N724: 0 | O724: math.max(0,(lv/10)-1) | P724: math.max(0,(lv/10)-1) | Q724: math.max(0,(lv/10)-1) | R724: 0; | S724: 有药王谷和盘丝洞的弟子在，真是不爽，还是跑路算了！ | T724: 药王谷和盘丝洞的弟子不在眼前，真是轻松愉快啊！ | U724: 0 | V724: 0,0; | W724: 3
A725: 320 | B725: 持国天王心魔 | C725: pet_81 | D725: 0 | E725: 0 | F725: 5306,100; | G725: 0,0; | H725: 71.6*LV+357.8 | I725: (27.3*LV+37.3)*0.78 | J725: 1.5*LV+10 | K725: 6.6*LV+13.2 | L725: 1.4*LV+8 | M725: 1000*LV+100000 | N725: 0 | O725: math.max(0,(lv/10)-1) | P725: math.max(0,(lv/10)-1) | Q725: math.max(0,(lv/10)-1) | R725: 0; | S725: 有药王谷和盘丝洞的弟子在，真是不爽，还是跑路算了！ | T725: 药王谷和盘丝洞的弟子不在眼前，真是轻松愉快啊！ | U725: 0 | V725: 0,0; | W725: 4
A726: 321 | B726: 幼兽 | C726: pet_63 | D726: 0 | E726: 0 | F726: 0,0; | G726: 0,0; | H726: 35.8*LV+178.9 | I726: (16.4*LV+18.6)*0.78 | J726: 0.9*LV+10 | K726: (3.3*LV+8.7)*0.05 | L726: 0.8*LV+8 | M726: 1000*LV+100000 | N726: 0 | O726: math.max(0,(lv/10)-1) | P726: math.max(0,(lv/10)-1) | Q726: math.max(0,(lv/10)-1) | R726: 0; | S726: 有药王谷和盘丝洞的弟子在，真是不爽，还是跑路算了！ | T726: 药王谷和盘丝洞的弟子不在眼前，真是轻松愉快啊！ | U726: 0 | V726: 0,0; | W726: 1
A727: 330 | B727: 虎怪 | C727: pet_102 | D727: 0 | E727: 0 | F727: 5306,100; | G727: 0,0; | H727: 72.5*LV+362.7 | I727: (28*LV+38)*0.77 | J727: 1.5*LV+10 | K727: 6.7*LV+13.4 | L727: 1.4*LV+8 | M727: 1000*LV+100000 | N727: 0 | O727: math.max(0,(lv/10)-1) | P727: math.max(0,(lv/10)-1) | Q727: math.max(0,(lv/10)-1) | R727: 0; | S727: 有药王谷和盘丝洞的弟子在，真是不爽，还是跑路算了！ | T727: 药王谷和盘丝洞的弟子不在眼前，真是轻松愉快啊！ | U727: 0 | V727: 0,0; | W727: 5
A728: 331 | B728: 紫雨林弟子 | C728: pet_83 | D728: 0 | E728: 0 | F728: 5302,100; | G728: 0,0; | H728: 36.3*LV+181.4 | I728: (16.8*LV+19)*0.77 | J728: 0.9*LV+10 | K728: 3.4*LV+9 | L728: 0.8*LV+8 | M728: 1000*LV+100000 | N728: 0 | O728: math.max(0,(lv/10)-1) | P728: math.max(0,(lv/10)-1) | Q728: math.max(0,(lv/10)-1) | R728: 0; | S728: 有药王谷和盘丝洞的弟子在，真是不爽，还是跑路算了！ | T728: 药王谷和盘丝洞的弟子不在眼前，真是轻松愉快啊！ | U728: 0 | V728: 0,0; | W728: 4
A729: 340 | B729: 虎将军 | C729: pet_63 | D729: 0 | E729: 0 | F729: 1411,100;1413,100;1412,100;1416,100; | G729: 0,0; | H729: 73.5*LV+367.6 | I729: (28.8*LV+38.8)*0.76 | J729: 1.5*LV+10 | K729: (6.8*LV+13.6)*0.05 | L729: 1.4*LV+8 | M729: 1000*LV+100000 | N729: 0 | O729: math.max(0,(lv/10)-1) | P729: math.max(0,(lv/10)-1) | Q729: math.max(0,(lv/10)-1) | R729: 0; | S729: 有药王谷和盘丝洞的弟子在，真是不爽，还是跑路算了！ | T729: 药王谷和盘丝洞的弟子不在眼前，真是轻松愉快啊！ | U729: 0 | V729: 0,0; | W729: 2
A730: 341 | B730: 打手 | C730: pet_23 | D730: 0 | E730: 0 | F730: 1311,100;1315,100;1312,100; | G730: 0,0; | H730: 36.8*LV+183.8 | I730: (17.3*LV+19.4)*0.76 | J730: 0.9*LV+10 | K730: (3.4*LV+9.2)*0.05 | L730: 0.8*LV+8 | M730: 1000*LV+100000 | N730: 0 | O730: math.max(0,(lv/10)-1) | P730: math.max(0,(lv/10)-1) | Q730: math.max(0,(lv/10)-1) | R730: 0; | S730: 有药王谷和盘丝洞的弟子在，真是不爽，还是跑路算了！ | T730: 药王谷和盘丝洞的弟子不在眼前，真是轻松愉快啊！ | U730: 0 | V730: 0,0; | W730: 4
A731: 350 | B731: 巫妖 | C731: pet_93 | D731: 0 | E731: 0 | F731: 1315,100; | G731: 0,0; | H731: 74.5*LV+372.5 | I731: (29.6*LV+39.6)*0.75 | J731: 1.5*LV+10 | K731: 6.9*LV+13.9*0.05 | L731: 1.4*LV+8 | M731: 1000*LV+100000 | N731: 0 | O731: math.max(0,(lv/10)-1) | P731: math.max(0,(lv/10)-1) | Q731: math.max(0,(lv/10)-1) | R731: 0; | S731: 有药王谷和盘丝洞的弟子在，真是不爽，还是跑路算了！ | T731: 药王谷和盘丝洞的弟子不在眼前，真是轻松愉快啊！ | U731: 0 | V731: 0,0; | W731: 4
A732: 351 | B732: 打手 | C732: pet_23 | D732: 0 | E732: 0 | F732: 1112,100;1111,100; | G732: 0,0; | H732: 37.3*LV+186.3 | I732: (17.8*LV+19.8)*0.75 | J732: 0.9*LV+10 | K732: (3.5*LV+9.4)*0.05 | L732: 0.8*LV+8 | M732: 1000*LV+100000 | N732: 0 | O732: math.max(0,(lv/10)-1) | P732: math.max(0,(lv/10)-1) | Q732: math.max(0,(lv/10)-1) | R732: 0; | S732: 有药王谷和盘丝洞的弟子在，真是不爽，还是跑路算了！ | T732: 药王谷和盘丝洞的弟子不在眼前，真是轻松愉快啊！ | U732: 0 | V732: 0,0; | W732: 1
A733: 360 | B733: 兔精 | C733: pet_11 | D733: 0 | E733: 0 | F733: 1111,100;1112,100; | G733: 0,0; | H733: 75.5*LV+377.5 | I733: (30.4*LV+40.4)*0.75 | J733: 1.5*LV+10 | K733: (7.1*LV+14.1)*0.05 | L733: 1.4*LV+8 | M733: 1000*LV+100000 | N733: 0 | O733: math.max(0,(lv/10)-1) | P733: math.max(0,(lv/10)-1) | Q733: math.max(0,(lv/10)-1) | R733: 0; | S733: 有药王谷和盘丝洞的弟子在，真是不爽，还是跑路算了！ | T733: 药王谷和盘丝洞的弟子不在眼前，真是轻松愉快啊！ | U733: 0 | V733: 0,0; | W733: 1
A734: 361 | B734: 打手 | C734: pet_23 | D734: 0 | E734: 0 | F734: 1112,100;1111,100; | G734: 0,0; | H734: 37.7*LV+188.7 | I734: (18.2*LV+20.2)*0.74 | J734: 0.9*LV+10 | K734: (3.5*LV+9.6)*0.05 | L734: 0.8*LV+8 | M734: 1000*LV+100000 | N734: 0 | O734: math.max(0,(lv/10)-1) | P734: math.max(0,(lv/10)-1) | Q734: math.max(0,(lv/10)-1) | R734: 0; | S734: 有药王谷和盘丝洞的弟子在，真是不爽，还是跑路算了！ | T734: 药王谷和盘丝洞的弟子不在眼前，真是轻松愉快啊！ | U734: 0 | V734: 0,0; | W734: 1
A735: 370 | B735: 灵感大王 | C735: pet_52 | D735: 0 | E735: 0 | F735: 5306,100; | G735: 0,0; | H735: 76.5*LV+382.4 | I735: (31.2*LV+41.2)*0.74 | J735: 1.5*LV+10 | K735: 7.2*LV+14.4 | L735: 1.4*LV+8 | M735: 1000*LV+100000 | N735: 0 | O735: math.max(0,(lv/10)-1) | P735: math.max(0,(lv/10)-1) | Q735: math.max(0,(lv/10)-1) | R735: 0; | S735: 有药王谷和盘丝洞的弟子在，真是不爽，还是跑路算了！ | T735: 药王谷和盘丝洞的弟子不在眼前，真是轻松愉快啊！ | U735: 0 | V735: 0,0; | W735: 4
A736: 371 | B736: 打手 | C736: pet_23 | D736: 0 | E736: 0 | F736: 1112,100;1111,100; | G736: 0,0; | H736: 38.2*LV+191.2 | I736: (18.7*LV+20.6)*0.73 | J736: 0.9*LV+10 | K736: (3.6*LV+9.8)*0.05 | L736: 0.8*LV+8 | M736: 1000*LV+100000 | N736: 0 | O736: math.max(0,(lv/10)-1) | P736: math.max(0,(lv/10)-1) | Q736: math.max(0,(lv/10)-1) | R736: 0; | S736: 有药王谷和盘丝洞的弟子在，真是不爽，还是跑路算了！ | T736: 药王谷和盘丝洞的弟子不在眼前，真是轻松愉快啊！ | U736: 0 | V736: 0,0; | W736: 1
A737: 380 | B737: 莫愁 | C737: partner_1006 | D737: 0 | E737: 0 | F737: 1211,100;1212,100;1213,100;1214,100; | G737: 0,0; | H737: 77.5*LV+387.3 | I737: (32*LV+42)*0.73 | J737: 1.5*LV+10 | K737: 7.3*LV+14.6 | L737: 1.4*LV+8 | M737: 1000*LV+100000 | N737: 0 | O737: math.max(0,(lv/10)-1) | P737: math.max(0,(lv/10)-1) | Q737: math.max(0,(lv/10)-1) | R737: 0; | S737: 有药王谷和盘丝洞的弟子在，真是不爽，还是跑路算了！ | T737: 药王谷和盘丝洞的弟子不在眼前，真是轻松愉快啊！ | U737: 0 | V737: 0,0; | W737: 3
A738: 381 | B738: 凶魂 | C738: pet_53 | D738: 0 | E738: 0 | F738: 5302,100; | G738: 0,0; | H738: 38.7*LV+193.6 | I738: (19.2*LV+21)*0.72 | J738: 0.9*LV+10 | K738: 3.6*LV+10 | L738: 0.8*LV+8 | M738: 1000*LV+100000 | N738: 0 | O738: math.max(0,(lv/10)-1) | P738: math.max(0,(lv/10)-1) | Q738: math.max(0,(lv/10)-1) | R738: 0; | S738: 有药王谷和盘丝洞的弟子在，真是不爽，还是跑路算了！ | T738: 药王谷和盘丝洞的弟子不在眼前，真是轻松愉快啊！ | U738: 0 | V738: 0,0; | W738: 4
A739: 390 | B739: 黑袍人 | C739: pet_93 | D739: 0 | E739: 0 | F739: 1312,100;1315,100;1311,100; | G739: 0,0; | H739: 78.4*LV+392.2 | I739: (32.7*LV+42.7)*0.72 | J739: 1.5*LV+10 | K739: (7.4*LV+14.8)*0.05 | L739: 1.4*LV+8 | M739: 1000*LV+100000 | N739: 0 | O739: math.max(0,(lv/10)-1) | P739: math.max(0,(lv/10)-1) | Q739: math.max(0,(lv/10)-1) | R739: 0; | S739: 有药王谷和盘丝洞的弟子在，真是不爽，还是跑路算了！ | T739: 药王谷和盘丝洞的弟子不在眼前，真是轻松愉快啊！ | U739: 0 | V739: 0,0; | W739: 4
A740: 391 | B740: 毒仙子 | C740: partner_1005 | D740: 0 | E740: 0 | F740: 1211,100;1212,100;1213,100; | G740: 0,0; | H740: 39.2*LV+196.1 | I740: (19.6*LV+21.4)*0.71 | J740: 0.9*LV+10 | K740: (3.7*LV+10.3)*0.05 | L740: 0.8*LV+8 | M740: 1000*LV+100000 | N740: 0 | O740: math.max(0,(lv/10)-1) | P740: math.max(0,(lv/10)-1) | Q740: math.max(0,(lv/10)-1) | R740: 0; | S740: 有药王谷和盘丝洞的弟子在，真是不爽，还是跑路算了！ | T740: 药王谷和盘丝洞的弟子不在眼前，真是轻松愉快啊！ | U740: 0 | V740: 0,0; | W740: 3
A741: 400 | B741: 猪美男 | C741: partner_1001 | D741: 0 | E741: 0 | F741: 1411,100;1413,100;1412,100;1416,100; | G741: 0,0; | H741: 79.4*LV+397.1 | I741: (33.5*LV+43.5)*0.71 | J741: 1.5*LV+10 | K741: 7.5*LV+15.1 | L741: 1.4*LV+8 | M741: 1000*LV+100000 | N741: 0 | O741: math.max(0,(lv/10)-1) | P741: math.max(0,(lv/10)-1) | Q741: math.max(0,(lv/10)-1) | R741: 0; | S741: 有药王谷和盘丝洞的弟子在，真是不爽，还是跑路算了！ | T741: 药王谷和盘丝洞的弟子不在眼前，真是轻松愉快啊！ | U741: 0 | V741: 0,0; | W741: 2
A742: 401 | B742: 帮凶 | C742: pet_23 | D742: 0 | E742: 0 | F742: 1311,100;1315,100;1311,100; | G742: 0,0; | H742: 39.7*LV+198.5 | I742: (20.1*LV+21.8)*0.7 | J742: 0.9*LV+10 | K742: (3.8*LV+10.5)*0.05 | L742: 0.8*LV+8 | M742: 1000*LV+100000 | N742: 0 | O742: math.max(0,(lv/10)-1) | P742: math.max(0,(lv/10)-1) | Q742: math.max(0,(lv/10)-1) | R742: 0; | S742: 有药王谷和盘丝洞的弟子在，真是不爽，还是跑路算了！ | T742: 药王谷和盘丝洞的弟子不在眼前，真是轻松愉快啊！ | U742: 0 | V742: 0,0; | W742: 4
A743: 5101 | B743: 小师弟 | C743: hero_1001 | D743: 0 | E743: 0 | F743: 1111,40;1112,40; | G743: 0,0; | H743: 12*LV+25 | I743: 8*LV+75 | J743: 0.9*LV+10 | K743: 6*LV+15 | L743: 0.8*LV+8 | M743: 1000*LV+100000 | N743: 0 | O743: math.max(0,(lv/10)-1) | P743: math.max(0,(lv/10)-1) | Q743: math.max(0,(lv/10)-1) | R743: 0; | S743: 有药王谷和盘丝洞的弟子在，真是不爽，还是跑路算了！ | T743: 药王谷和盘丝洞的弟子不在眼前，真是轻松愉快啊！ | U743: 0 | V743: 0,0; | W743: 1
A744: 5102 | B744: 小师妹 | C744: hero_2001 | D744: 0 | E744: 0 | F744: 1111,40;1112,40; | G744: 0,0; | H744: 12*LV+25 | I744: 8*LV+75 | J744: 2.9*LV+10 | K744: 6*LV+15 | L744: 0.8*LV+8 | M744: 1000*LV+100000 | N744: 0 | O744: math.max(0,(lv/10)-1) | P744: math.max(0,(lv/10)-1) | Q744: math.max(0,(lv/10)-1) | R744: 0; | S744: 有药王谷和盘丝洞的弟子在，真是不爽，还是跑路算了！ | T744: 药王谷和盘丝洞的弟子不在眼前，真是轻松愉快啊！ | U744: 0 | V744: 0,0; | W744: 1
A745: 5103 | B745: 小师弟 | C745: hero_1001 | D745: 0 | E745: 0 | F745: 1411,40;1412,40; | G745: 0,0; | H745: 12*LV+25 | I745: 8*LV+75 | J745: 2.9*LV+10 | K745: 6*LV+15 | L745: 0.8*LV+8 | M745: 1000*LV+100000 | N745: 0 | O745: math.max(0,(lv/10)-1) | P745: math.max(0,(lv/10)-1) | Q745: math.max(0,(lv/10)-1) | R745: 0; | S745: 有药王谷和盘丝洞的弟子在，真是不爽，还是跑路算了！ | T745: 药王谷和盘丝洞的弟子不在眼前，真是轻松愉快啊！ | U745: 0 | V745: 0,0; | W745: 2
A746: 5104 | B746: 小师妹 | C746: hero_2001 | D746: 0 | E746: 0 | F746: 1411,40;1412,40; | G746: 0,0; | H746: 12*LV+25 | I746: 8*LV+75 | J746: 2.9*LV+10 | K746: 6*LV+15 | L746: 0.8*LV+8 | M746: 1000*LV+100000 | N746: 0 | O746: math.max(0,(lv/10)-1) | P746: math.max(0,(lv/10)-1) | Q746: math.max(0,(lv/10)-1) | R746: 0; | S746: 有药王谷和盘丝洞的弟子在，真是不爽，还是跑路算了！ | T746: 药王谷和盘丝洞的弟子不在眼前，真是轻松愉快啊！ | U746: 0 | V746: 0,0; | W746: 2
A747: 5105 | B747: 小师弟 | C747: hero_1001 | D747: 0 | E747: 0 | F747: 1211,80; | G747: 0,0; | H747: 12*LV+25 | I747: 8*LV+75 | J747: 2.9*LV+10 | K747: 6*LV+15 | L747: 0.8*LV+8 | M747: 1000*LV+100000 | N747: 0 | O747: math.max(0,(lv/10)-1) | P747: math.max(0,(lv/10)-1) | Q747: math.max(0,(lv/10)-1) | R747: 0; | S747: 有药王谷和盘丝洞的弟子在，真是不爽，还是跑路算了！ | T747: 药王谷和盘丝洞的弟子不在眼前，真是轻松愉快啊！ | U747: 0 | V747: 0,0; | W747: 3
A748: 5106 | B748: 小师妹 | C748: hero_2001 | D748: 0 | E748: 0 | F748: 1211,80; | G748: 0,0; | H748: 12*LV+25 | I748: 8*LV+75 | J748: 2.9*LV+10 | K748: 6*LV+15 | L748: 0.8*LV+8 | M748: 1000*LV+100000 | N748: 0 | O748: math.max(0,(lv/10)-1) | P748: math.max(0,(lv/10)-1) | Q748: math.max(0,(lv/10)-1) | R748: 0; | S748: 有药王谷和盘丝洞的弟子在，真是不爽，还是跑路算了！ | T748: 药王谷和盘丝洞的弟子不在眼前，真是轻松愉快啊！ | U748: 0 | V748: 0,0; | W748: 3
A749: 5107 | B749: 小师弟 | C749: hero_1001 | D749: 0 | E749: 0 | F749: 1311,40;1312,40; | G749: 0,0; | H749: 12*LV+25 | I749: 8*LV+75 | J749: 2.9*LV+10 | K749: 6*LV+15 | L749: 0.8*LV+8 | M749: 1000*LV+100000 | N749: 0 | O749: math.max(0,(lv/10)-1) | P749: math.max(0,(lv/10)-1) | Q749: math.max(0,(lv/10)-1) | R749: 0; | S749: 有药王谷和盘丝洞的弟子在，真是不爽，还是跑路算了！ | T749: 药王谷和盘丝洞的弟子不在眼前，真是轻松愉快啊！ | U749: 0 | V749: 0,0; | W749: 4
A750: 5108 | B750: 小师妹 | C750: hero_2001 | D750: 0 | E750: 0 | F750: 1311,40;1312,40; | G750: 0,0; | H750: 12*LV+25 | I750: 8*LV+75 | J750: 2.9*LV+10 | K750: 6*LV+15 | L750: 0.8*LV+8 | M750: 1000*LV+100000 | N750: 0 | O750: math.max(0,(lv/10)-1) | P750: math.max(0,(lv/10)-1) | Q750: math.max(0,(lv/10)-1) | R750: 0; | S750: 有药王谷和盘丝洞的弟子在，真是不爽，还是跑路算了！ | T750: 药王谷和盘丝洞的弟子不在眼前，真是轻松愉快啊！ | U750: 0 | V750: 0,0; | W750: 4
A751: 5109 | B751: 小师弟 | C751: hero_1001 | D751: 0 | E751: 0 | F751: 1511,80; | G751: 0,0; | H751: 12*LV+25 | I751: 8*LV+75 | J751: 2.9*LV+10 | K751: 6*LV+15 | L751: 0.8*LV+8 | M751: 1000*LV+100000 | N751: 0 | O751: math.max(0,(lv/10)-1) | P751: math.max(0,(lv/10)-1) | Q751: math.max(0,(lv/10)-1) | R751: 0; | S751: 有药王谷和盘丝洞的弟子在，真是不爽，还是跑路算了！ | T751: 药王谷和盘丝洞的弟子不在眼前，真是轻松愉快啊！ | U751: 0 | V751: 0,0; | W751: 5
A752: 5110 | B752: 小师妹 | C752: hero_2001 | D752: 0 | E752: 0 | F752: 1511,80; | G752: 0,0; | H752: 12*LV+25 | I752: 8*LV+75 | J752: 2.9*LV+10 | K752: 6*LV+15 | L752: 0.8*LV+8 | M752: 1000*LV+100000 | N752: 0 | O752: math.max(0,(lv/10)-1) | P752: math.max(0,(lv/10)-1) | Q752: math.max(0,(lv/10)-1) | R752: 0; | S752: 有药王谷和盘丝洞的弟子在，真是不爽，还是跑路算了！ | T752: 药王谷和盘丝洞的弟子不在眼前，真是轻松愉快啊！ | U752: 0 | V752: 0,0; | W752: 5
A753: 5111 | B753: 兔精 | C753: pet_11 | D753: 0 | E753: 0 | F753: 0,0; | G753: 0,0; | H753: 7*LV+15 | I753: 7*LV+37 | J753: 2.9*LV+10 | K753: 5*LV+12 | L753: 0.8*LV+8 | M753: 1000*LV+100000 | N753: 0 | O753: math.max(0,(lv/10)-1) | P753: math.max(0,(lv/10)-1) | Q753: math.max(0,(lv/10)-1) | R753: 0; | S753: 有药王谷和盘丝洞的弟子在，真是不爽，还是跑路算了！ | T753: 药王谷和盘丝洞的弟子不在眼前，真是轻松愉快啊！ | U753: 0 | V753: 0,0; | W753: 1
A754: 5112 | B754: 兔精 | C754: pet_11 | D754: 0 | E754: 0 | F754: 0,0; | G754: 0,0; | H754: 7*LV+15 | I754: 7*LV+37 | J754: 2.9*LV+10 | K754: 5*LV+12 | L754: 0.8*LV+8 | M754: 1000*LV+100000 | N754: 0 | O754: math.max(0,(lv/10)-1) | P754: math.max(0,(lv/10)-1) | Q754: math.max(0,(lv/10)-1) | R754: 0; | S754: 有药王谷和盘丝洞的弟子在，真是不爽，还是跑路算了！ | T754: 药王谷和盘丝洞的弟子不在眼前，真是轻松愉快啊！ | U754: 0 | V754: 0,0; | W754: 2
A755: 100 | B755: 狐妖 | C755: partner_1009 | D755: 0 | E755: 0 | F755: 1211,100;1212,100;1213,100; | G755: 5103,100; | H755: 25*LV+125 | I755: (6*LV+10)*0.99 | J755: 0.9*LV+10 | K755: (2*LV+4)*0.05 | L755: 0.8*LV+8 | M755: 1000*LV+100000 | N755: 0 | O755: math.max(0,(lv/10)-1) | P755: math.max(0,(lv/10)-1) | Q755: math.max(0,(lv/10)-1) | R755: 0; | S755: 有药王谷和盘丝洞的弟子在，真是不爽，还是跑路算了！ | T755: 药王谷和盘丝洞的弟子不在眼前，真是轻松愉快啊！ | U755: 0 | V755: 0,0; | W755: 3
A756: 101 | B756: 魔教打手 | C756: hero_1001 | D756: 0 | E756: 0 | F756: 0,0; | G756: 5103,100; | H756: 25*LV+125 | I756: (6*LV+10)*0.99 | J756: 0.9*LV+10 | K756: (2*LV+4)*0.05 | L756: 0.8*LV+8 | M756: 1000*LV+100000 | N756: 0 | O756: math.max(0,(lv/10)-1) | P756: math.max(0,(lv/10)-1) | Q756: math.max(0,(lv/10)-1) | R756: 0; | S756: 有药王谷和盘丝洞的弟子在，真是不爽，还是跑路算了！ | T756: 药王谷和盘丝洞的弟子不在眼前，真是轻松愉快啊！ | U756: 0 | V756: 0,0; | W756: 2
A757: 10001 | B757: 水晶宫弟子 | C757: hero_1001 | D757: 0 | E757: 0 | F757: 1411,100;1412,100; | G757: 0,0; | H757: 2403*0.5 | I757: 676*0.5*0.5 | J757: 266*0.8*0.5 | K757: 192*1.5*0.5 | L757: 95*0.8*0.5 | M757: 1000*LV+100000 | N757: 0 | O757: math.max(0,(lv/10)-1) | P757: math.max(0,(lv/10)-1) | Q757: math.max(0,(lv/10)-1) | R757: 0; | S757: 有药王谷和盘丝洞的弟子在，真是不爽，还是跑路算了！ | T757: 药王谷和盘丝洞的弟子不在眼前，真是轻松愉快啊！ | U757: 0 | V757: 0,0; | W757: 2
A758: 10002 | B758: 天策府长老 | C758: hero_2001 | D758: 0 | E758: 0 | F758: 1111,100;1112,100; | G758: 0,0; | H758: 2421*0.6 | I758: 685*0.6 | J758: 269*0.6 | K758: 195*0.5*0.6 | L758: 96*1.2*0.6 | M758: 1000*LV+100000 | N758: 0 | O758: math.max(0,(lv/10)-1) | P758: math.max(0,(lv/10)-1) | Q758: math.max(0,(lv/10)-1) | R758: 0; | S758: 有药王谷和盘丝洞的弟子在，真是不爽，还是跑路算了！ | T758: 药王谷和盘丝洞的弟子不在眼前，真是轻松愉快啊！ | U758: 0 | V758: 0,0; | W758: 1
A759: 10003 | B759: 青鸟 | C759: partner_1006 | D759: 0 | E759: 0 | F759: 1411,100;1413,100;1412,100;1416,100; | G759: 0,0; | H759: 2448*0.8 | I759: 693*0.5*0.8 | J759: 271*0.8*0.8 | K759: 198*1.5*0.8 | L759: 98*0.8*0.8 | M759: 1000*LV+100000 | N759: 0 | O759: math.max(0,(lv/10)-1) | P759: math.max(0,(lv/10)-1) | Q759: math.max(0,(lv/10)-1) | R759: 0; | S759: 有药王谷和盘丝洞的弟子在，真是不爽，还是跑路算了！ | T759: 药王谷和盘丝洞的弟子不在眼前，真是轻松愉快啊！ | U759: 0 | V759: 0,0; | W759: 2
A760: 10004 | B760: 兽王御兽弟子 | C760: hero_1001 | D760: 0 | E760: 0 | F760: 1312,100;1315,100; | G760: 0,0; | H760: 1479*0.9 | I760: 603*0.9 | J760: 273*0.9 | K760: 202*0.5*0.9 | L760: 100*1.2*0.9 | M760: 1000*LV+100000 | N760: 0 | O760: math.max(0,(lv/10)-1) | P760: math.max(0,(lv/10)-1) | Q760: math.max(0,(lv/10)-1) | R760: 0; | S760: 有药王谷和盘丝洞的弟子在，真是不爽，还是跑路算了！ | T760: 药王谷和盘丝洞的弟子不在眼前，真是轻松愉快啊！ | U760: 0 | V760: 0,0; | W760: 4
A761: 10005 | B761: 铁扇公主 | C761: partner_1003 | D761: 0 | E761: 0 | F761: 1511,100;1512,100;1513,100;1514,100; | G761: 5216,100; | H761: 1490*0.8 | I761: 609*0.5 | J761: 276 | K761: 205 | L761: 101*2 | M761: 1000*LV+100000 | N761: 0 | O761: math.max(0,(lv/5)-1) | P761: math.max(0,(lv/5)-1) | Q761: math.max(0,(lv/5)-1) | R761: 0; | S761: 有药王谷和盘丝洞的弟子在，真是不爽，还是跑路算了！ | T761: 药王谷和盘丝洞的弟子不在眼前，真是轻松愉快啊！ | U761: 0 | V761: 0,0; | W761: 5
A762: 10006 | B762: 玄奘法师 | C762: partner_1007 | D762: 0 | E762: 0 | F762: 1411,100;1413,100;1412,100;1416,100; | G762: 0,0; | H762: 1533 | I762: 628*0.5 | J762: 284*0.8 | K762: 211*1.5 | L762: 104*0.8 | M762: 1000*LV+100000 | N762: 0 | O762: math.max(0,(lv/10)-1) | P762: math.max(0,(lv/10)-1) | Q762: math.max(0,(lv/10)-1) | R762: 0; | S762: 有药王谷和盘丝洞的弟子在，真是不爽，还是跑路算了！ | T762: 药王谷和盘丝洞的弟子不在眼前，真是轻松愉快啊！ | U762: 0 | V762: 0,0; | W762: 2
A763: 10007 | B763: 水晶宫御兽弟子 | C763: hero_2001 | D763: 0 | E763: 0 | F763: 1411,100;1413,100;1412,100;1416,100; | G763: 0,0; | H763: 1549 | I763: 634*0.5 | J763: 286*0.8 | K763: 213*1.5 | L763: 105*0.8 | M763: 1000*LV+100000 | N763: 0 | O763: math.max(0,(lv/10)-1) | P763: math.max(0,(lv/10)-1) | Q763: math.max(0,(lv/10)-1) | R763: 0; | S763: 有药王谷和盘丝洞的弟子在，真是不爽，还是跑路算了！ | T763: 药王谷和盘丝洞的弟子不在眼前，真是轻松愉快啊！ | U763: 0 | V763: 0,0; | W763: 2
A764: 10008 | B764: 赤天帝 | C764: partner_1012 | D764: 0 | E764: 0 | F764: 1411,100;1413,100;1412,100;1416,100; | G764: 0,0; | H764: 1560 | I764: 642*0.5 | J764: 288*0.8 | K764: 216*1.5 | L764: 107*0.8 | M764: 1000*LV+100000 | N764: 0 | O764: math.max(0,(lv/10)-1) | P764: math.max(0,(lv/10)-1) | Q764: math.max(0,(lv/10)-1) | R764: 0; | S764: 有药王谷和盘丝洞的弟子在，真是不爽，还是跑路算了！ | T764: 药王谷和盘丝洞的弟子不在眼前，真是轻松愉快啊！ | U764: 0 | V764: 0,0; | W764: 2
A765: 10009 | B765: 铁扇公主 | C765: partner_1003 | D765: 0 | E765: 0 | F765: 1511,100;1512,100;1513,100;1514,100; | G765: 0,0; | H765: 1571*0.8 | I765: 648*0.5 | J765: 290 | K765: 220 | L765: 108*2 | M765: 1000*LV+100000 | N765: 0 | O765: math.max(0,(lv/10)-1) | P765: math.max(0,(lv/10)-1) | Q765: math.max(0,(lv/10)-1) | R765: 0; | S765: 有药王谷和盘丝洞的弟子在，真是不爽，还是跑路算了！ | T765: 药王谷和盘丝洞的弟子不在眼前，真是轻松愉快啊！ | U765: 0 | V765: 0,0; | W765: 5
A766: 10010 | B766: 迦楼罗 | C766: pet_201 | D766: 0 | E766: 0 | F766: 1111,100;1112,100; | G766: 5209,100; | H766: 1587*1.2 | I766: 656*1.2 | J766: 293*1.2 | K766: 223*0.5*1.2 | L766: 110*1.2*1.2 | M766: 1000*LV+100000 | N766: 0 | O766: math.max(0,(lv/5)-1) | P766: math.max(0,(lv/5)-1) | Q766: math.max(0,(lv/5)-1) | R766: 0; | S766: 有药王谷和盘丝洞的弟子在，真是不爽，还是跑路算了！ | T766: 药王谷和盘丝洞的弟子不在眼前，真是轻松愉快啊！ | U766: 0 | V766: 0,0; | W766: 1
A767: 10011 | B767: 毒仙子 | C767: partner_1005 | D767: 0 | E767: 0 | F767: 1211,100;1212,100;1213,100; | G767: 0,0; | H767: 1836*1.2 | I767: 743*0.5 | J767: 340*1.2 | K767: 250*0.5 | L767: 122*1.5 | M767: 1000*LV+100000 | N767: 0 | O767: math.max(0,(lv/10)-1) | P767: math.max(0,(lv/10)-1) | Q767: math.max(0,(lv/10)-1) | R767: 0; | S767: 有药王谷和盘丝洞的弟子在，真是不爽，还是跑路算了！ | T767: 药王谷和盘丝洞的弟子不在眼前，真是轻松愉快啊！ | U767: 0 | V767: 0,0; | W767: 3
A768: 10012 | B768: 水晶宫长老 | C768: hero_1001 | D768: 0 | E768: 0 | F768: 1411,100;1412,100; | G768: 0,0; | H768: 1852 | I768: 749*0.5 | J768: 343*0.8 | K768: 252*1.5 | L768: 124*0.8 | M768: 1000*LV+100000 | N768: 0 | O768: math.max(0,(lv/10)-1) | P768: math.max(0,(lv/10)-1) | Q768: math.max(0,(lv/10)-1) | R768: 0; | S768: 有药王谷和盘丝洞的弟子在，真是不爽，还是跑路算了！ | T768: 药王谷和盘丝洞的弟子不在眼前，真是轻松愉快啊！ | U768: 0 | V768: 0,0; | W768: 2
A769: 10013 | B769: 道济和尚 | C769: partner_1008 | D769: 0 | E769: 0 | F769: 1411,100;1413,100;1412,100;1416,100; | G769: 0,0; | H769: 1863 | I769: 757*0.5 | J769: 345*0.8 | K769: 256*1.5 | L769: 125*0.8 | M769: 1000*LV+100000 | N769: 0 | O769: math.max(0,(lv/10)-1) | P769: math.max(0,(lv/10)-1) | Q769: math.max(0,(lv/10)-1) | R769: 0; | S769: 有药王谷和盘丝洞的弟子在，真是不爽，还是跑路算了！ | T769: 药王谷和盘丝洞的弟子不在眼前，真是轻松愉快啊！ | U769: 0 | V769: 0,0; | W769: 2
A770: 10014 | B770: 罗刹女 | C770: pet_61 | D770: 0 | E770: 0 | F770: 1312,100;1315,100;1311,100; | G770: 0,0; | H770: 1879 | I770: 764 | J770: 347 | K770: 260*0.5 | L770: 127*1.2 | M770: 1000*LV+100000 | N770: 0 | O770: math.max(0,(lv/10)-1) | P770: math.max(0,(lv/10)-1) | Q770: math.max(0,(lv/10)-1) | R770: 0; | S770: 有药王谷和盘丝洞的弟子在，真是不爽，还是跑路算了！ | T770: 药王谷和盘丝洞的弟子不在眼前，真是轻松愉快啊！ | U770: 0 | V770: 0,0; | W770: 4
A771: 10015 | B771: 兽王御兽弟子 | C771: hero_1001 | D771: 0 | E771: 0 | F771: 1312,100;1315,100;1311,100; | G771: 5201,100; | H771: 1890*1.2 | I771: 771*1.2 | J771: 350*1.2 | K771: 262*0.5*1.2 | L771: 128*1.2*1.2 | M771: 1000*LV+100000 | N771: 0 | O771: math.max(0,(lv/5)-1) | P771: math.max(0,(lv/5)-1) | Q771: math.max(0,(lv/5)-1) | R771: 0; | S771: 有药王谷和盘丝洞的弟子在，真是不爽，还是跑路算了！ | T771: 药王谷和盘丝洞的弟子不在眼前，真是轻松愉快啊！ | U771: 0 | V771: 0,0; | W771: 4
A772: 10016 | B772: 天璇仙子 | C772: pet_83 | D772: 0 | E772: 0 | F772: 1311,100;1312,100; | G772: 0,0; | H772: 1938 | I772: 789 | J772: 358 | K772: 270*0.5 | L772: 131*1.2 | M772: 1000*LV+100000 | N772: 0 | O772: math.max(0,(lv/10)-1) | P772: math.max(0,(lv/10)-1) | Q772: math.max(0,(lv/10)-1) | R772: 0; | S772: 有药王谷和盘丝洞的弟子在，真是不爽，还是跑路算了！ | T772: 药王谷和盘丝洞的弟子不在眼前，真是轻松愉快啊！ | U772: 0 | V772: 0,0; | W772: 4
A773: 10017 | B773: 水晶宫长老 | C773: hero_2001 | D773: 0 | E773: 0 | F773: 1411,100;1413,100;1412,100;1416,100; | G773: 0,0; | H773: 1949 | I773: 797*0.5 | J773: 361*0.8 | K773: 272*1.5 | L773: 132*0.8 | M773: 1000*LV+100000 | N773: 0 | O773: math.max(0,(lv/10)-1) | P773: math.max(0,(lv/10)-1) | Q773: math.max(0,(lv/10)-1) | R773: 0; | S773: 有药王谷和盘丝洞的弟子在，真是不爽，还是跑路算了！ | T773: 药王谷和盘丝洞的弟子不在眼前，真是轻松愉快啊！ | U773: 0 | V773: 0,0; | W773: 2
A774: 10018 | B774: 青鸟 | C774: partner_1006 | D774: 0 | E774: 0 | F774: 1411,100;1413,100;1412,100;1416,100; | G774: 0,0; | H774: 1965 | I774: 803*0.5 | J774: 363*0.8 | K774: 276*1.5 | L774: 134*0.8 | M774: 1000*LV+100000 | N774: 0 | O774: math.max(0,(lv/10)-1) | P774: math.max(0,(lv/10)-1) | Q774: math.max(0,(lv/10)-1) | R774: 0; | S774: 有药王谷和盘丝洞的弟子在，真是不爽，还是跑路算了！ | T774: 药王谷和盘丝洞的弟子不在眼前，真是轻松愉快啊！ | U774: 0 | V774: 0,0; | W774: 2
A775: 10019 | B775: 大鹏鸟 | C775: pet_72 | D775: 0 | E775: 0 | F775: 1311,100;1313,100;1315,100;1312,100; | G775: 5135,100; | H775: 1976 | I775: 811 | J775: 365 | K775: 279*0.5 | L775: 136*1.2 | M775: 1000*LV+100000 | N775: 0 | O775: math.max(0,(lv/10)-1) | P775: math.max(0,(lv/10)-1) | Q775: math.max(0,(lv/10)-1) | R775: 0; | S775: 有药王谷和盘丝洞的弟子在，真是不爽，还是跑路算了！ | T775: 药王谷和盘丝洞的弟子不在眼前，真是轻松愉快啊！ | U775: 0 | V775: 0,0; | W775: 4
A776: 10020 | B776: 白面狐狸 | C776: partner_1009 | D776: 0 | E776: 0 | F776: 1311,100;1313,100;1315,100;1312,100; | G776: 5135,100;5105,100; | H776: 1992*1.2 | I776: 818*1.2 | J776: 368*1.2 | K776: 281*0.5*1.2 | L776: 137*1.2*1.2 | M776: 1000*LV+100000 | N776: 0 | O776: math.max(0,(lv/5)-1) | P776: math.max(0,(lv/5)-1) | Q776: math.max(0,(lv/5)-1) | R776: 0; | S776: 有药王谷和盘丝洞的弟子在，真是不爽，还是跑路算了！ | T776: 药王谷和盘丝洞的弟子不在眼前，真是轻松愉快啊！ | U776: 0 | V776: 0,0; | W776: 4
A777: 10021 | B777: 罗刹女 | C777: pet_61 | D777: 0 | E777: 0 | F777: 1111,100;1112,100; | G777: 0,0; | H777: 1872 | I777: 874 | J777: 416 | K777: 311*0.5 | L777: 148*1.2 | M777: 1000*LV+100000 | N777: 0 | O777: math.max(0,(lv/10)-1) | P777: math.max(0,(lv/10)-1) | Q777: math.max(0,(lv/10)-1) | R777: 0; | S777: 有药王谷和盘丝洞的弟子在，真是不爽，还是跑路算了！ | T777: 药王谷和盘丝洞的弟子不在眼前，真是轻松愉快啊！ | U777: 0 | V777: 0,0; | W777: 1
A778: 10022 | B778: 烈焰悟空 | C778: pet_73 | D778: 0 | E778: 0 | F778: 1311,50;1312,50; | G778: 0,0; | H778: 1885 | I778: 880 | J778: 419 | K778: 314*0.5 | L778: 150*1.2 | M778: 1000*LV+100000 | N778: 0 | O778: math.max(0,(lv/10)-1) | P778: math.max(0,(lv/10)-1) | Q778: math.max(0,(lv/10)-1) | R778: 0; | S778: 有药王谷和盘丝洞的弟子在，真是不爽，还是跑路算了！ | T778: 药王谷和盘丝洞的弟子不在眼前，真是轻松愉快啊！ | U778: 0 | V778: 0,0; | W778: 4
A779: 10023 | B779: 剑侠 | C779: pet_71 | D779: 0 | E779: 0 | F779: 1111,40;1112,40;1116,20; | G779: 0,0; | H779: 1894 | I779: 888 | J779: 421 | K779: 317*0.5 | L779: 152*1.2 | M779: 1000*LV+100000 | N779: 0 | O779: math.max(0,(lv/10)-1) | P779: math.max(0,(lv/10)-1) | Q779: math.max(0,(lv/10)-1) | R779: 0; | S779: 有药王谷和盘丝洞的弟子在，真是不爽，还是跑路算了！ | T779: 药王谷和盘丝洞的弟子不在眼前，真是轻松愉快啊！ | U779: 0 | V779: 0,0; | W779: 1
A780: 10024 | B780: 媚魔 | C780: pet_93 | D780: 0 | E780: 0 | F780: 1511,100;1512,100;1513,100;1514,100; | G780: 5132,100; | H780: 1908*0.8 | I780: 895*0.5 | J780: 423 | K780: 321 | L780: 153*2 | M780: 1000*LV+100000 | N780: 0 | O780: math.max(0,(lv/10)-1) | P780: math.max(0,(lv/10)-1) | Q780: math.max(0,(lv/10)-1) | R780: 0; | S780: 有药王谷和盘丝洞的弟子在，真是不爽，还是跑路算了！ | T780: 药王谷和盘丝洞的弟子不在眼前，真是轻松愉快啊！ | U780: 0 | V780: 0,0; | W780: 5
A781: 10025 | B781: 小小 | C781: partner_1002 | D781: 0 | E781: 0 | F781: 1311,100;1313,100;1315,100;1312,100; | G781: 5103,100;5133,100; | H781: 1921*1.2 | I781: 902*1.2 | J781: 426*1.2 | K781: 324*0.5*1.2 | L781: 155*1.2*1.2 | M781: 1000*LV+100000 | N781: 0 | O781: math.max(0,(lv/5)-1) | P781: math.max(0,(lv/5)-1) | Q781: math.max(0,(lv/5)-1) | R781: 0; | S781: 有药王谷和盘丝洞的弟子在，真是不爽，还是跑路算了！ | T781: 药王谷和盘丝洞的弟子不在眼前，真是轻松愉快啊！ | U781: 0 | V781: 0,0; | W781: 4
A782: 10026 | B782: 太阳神 | C782: partner_1011 | D782: 0 | E782: 0 | F782: 1211,100;1212,100;1213,100; | G782: 0,0; | H782: 1962*1.2 | I782: 921*0.5 | J782: 435*1.2 | K782: 332*0.5 | L782: 157*1.5 | M782: 1000*LV+100000 | N782: 0 | O782: math.max(0,(lv/10)-1) | P782: math.max(0,(lv/10)-1) | Q782: math.max(0,(lv/10)-1) | R782: 0; | S782: 有药王谷和盘丝洞的弟子在，真是不爽，还是跑路算了！ | T782: 药王谷和盘丝洞的弟子不在眼前，真是轻松愉快啊！ | U782: 0 | V782: 0,0; | W782: 3
A783: 10027 | B783: 道济和尚 | C783: partner_1008 | D783: 0 | E783: 0 | F783: 1411,100;1413,100;1412,100;1416,100; | G783: 0,0; | H783: 1971 | I783: 927*0.5 | J783: 438*0.8 | K783: 334*1.5 | L783: 159*0.8 | M783: 1000*LV+100000 | N783: 0 | O783: math.max(0,(lv/10)-1) | P783: math.max(0,(lv/10)-1) | Q783: math.max(0,(lv/10)-1) | R783: 0; | S783: 有药王谷和盘丝洞的弟子在，真是不爽，还是跑路算了！ | T783: 药王谷和盘丝洞的弟子不在眼前，真是轻松愉快啊！ | U783: 0 | V783: 0,0; | W783: 2
A784: 10028 | B784: 织梦花妖 | C784: pet_42 | D784: 0 | E784: 0 | F784: 1411,100;1413,100;1412,100;1416,100; | G784: 0,0; | H784: 1984 | I784: 934*0.5 | J784: 440*0.8 | K784: 338*1.5 | L784: 160*0.8 | M784: 1000*LV+100000 | N784: 0 | O784: math.max(0,(lv/10)-1) | P784: math.max(0,(lv/10)-1) | Q784: math.max(0,(lv/10)-1) | R784: 0; | S784: 有药王谷和盘丝洞的弟子在，真是不爽，还是跑路算了！ | T784: 药王谷和盘丝洞的弟子不在眼前，真是轻松愉快啊！ | U784: 0 | V784: 0,0; | W784: 2
A785: 10029 | B785: 天剑府弟子 | C785: hero_1001 | D785: 0 | E785: 0 | F785: 1111,100;1112,100; | G785: 5127,100; | H785: 1993 | I785: 941 | J785: 443 | K785: 342*0.5 | L785: 162*1.2 | M785: 1000*LV+100000 | N785: 0 | O785: math.max(0,(lv/10)-1) | P785: math.max(0,(lv/10)-1) | Q785: math.max(0,(lv/10)-1) | R785: 0; | S785: 有药王谷和盘丝洞的弟子在，真是不爽，还是跑路算了！ | T785: 药王谷和盘丝洞的弟子不在眼前，真是轻松愉快啊！ | U785: 0 | V785: 0,0; | W785: 1
A786: 10030 | B786: 天师道人 | C786: pet_22 | D786: 0 | E786: 0 | F786: 1511,100;1512,100;1513,100; | G786: 5132,100;5126,100; | H786: 2007*0.8*1.2 | I786: 948*0.5*1.2 | J786: 445*1.2 | K786: 344*1.2 | L786: 164*2*1.2 | M786: 1000*LV+100000 | N786: 0 | O786: math.max(0,(lv/5)-1) | P786: math.max(0,(lv/5)-1) | Q786: math.max(0,(lv/5)-1) | R786: 0; | S786: 有药王谷和盘丝洞的弟子在，真是不爽，还是跑路算了！ | T786: 药王谷和盘丝洞的弟子不在眼前，真是轻松愉快啊！ | U786: 0 | V786: 0,0; | W786: 5
A787: 10031 | B787: 女魃 | C787: pet_53 | D787: 0 | E787: 0 | F787: 1111,100;1112,100;1116,100; | G787: 0,0; | H787: 2272 | I787: 1082 | J787: 505 | K787: 386*0.5 | L787: 191*1.2 | M787: 1000*LV+100000 | N787: 0 | O787: math.max(0,(lv/10)-1) | P787: math.max(0,(lv/10)-1) | Q787: math.max(0,(lv/10)-1) | R787: 0; | S787: 有药王谷和盘丝洞的弟子在，真是不爽，还是跑路算了！ | T787: 药王谷和盘丝洞的弟子不在眼前，真是轻松愉快啊！ | U787: 0 | V787: 0,0; | W787: 1
A788: 10032 | B788: 兽王御兽弟子 | C788: hero_1001 | D788: 0 | E788: 0 | F788: 1312,100;1315,100; | G788: 0,0; | H788: 2286 | I788: 1089 | J788: 508 | K788: 388*0.5 | L788: 192*1.2 | M788: 1000*LV+100000 | N788: 0 | O788: math.max(0,(lv/10)-1) | P788: math.max(0,(lv/10)-1) | Q788: math.max(0,(lv/10)-1) | R788: 0; | S788: 有药王谷和盘丝洞的弟子在，真是不爽，还是跑路算了！ | T788: 药王谷和盘丝洞的弟子不在眼前，真是轻松愉快啊！ | U788: 0 | V788: 0,0; | W788: 4
A789: 10033 | B789: 九天玄女 | C789: partner_1010 | D789: 0 | E789: 0 | F789: 1411,100;1413,100;1412,100;1416,100; | G789: 0,0; | H789: 2299 | I789: 1097*0.5 | J789: 510*0.8 | K789: 392*1.5 | L789: 194*0.8 | M789: 1000*LV+100000 | N789: 0 | O789: math.max(0,(lv/10)-1) | P789: math.max(0,(lv/10)-1) | Q789: math.max(0,(lv/10)-1) | R789: 0; | S789: 有药王谷和盘丝洞的弟子在，真是不爽，还是跑路算了！ | T789: 药王谷和盘丝洞的弟子不在眼前，真是轻松愉快啊！ | U789: 0 | V789: 0,0; | W789: 2
A790: 10034 | B790: 魔教精英 | C790: pet_61 | D790: 0 | E790: 0 | F790: 1312,100;1315,100;1311,100; | G790: 5123,100; | H790: 2308 | I790: 1104 | J790: 513 | K790: 396*0.5 | L790: 196*1.2 | M790: 1000*LV+100000 | N790: 0 | O790: math.max(0,(lv/10)-1) | P790: math.max(0,(lv/10)-1) | Q790: math.max(0,(lv/10)-1) | R790: 0; | S790: 有药王谷和盘丝洞的弟子在，真是不爽，还是跑路算了！ | T790: 药王谷和盘丝洞的弟子不在眼前，真是轻松愉快啊！ | U790: 0 | V790: 0,0; | W790: 4
A791: 10035 | B791: 插翅虎 | C791: pet_63 | D791: 0 | E791: 0 | F791: 1311,100;1313,100;1315,100;1312,100; | G791: 5117,100;5103,100; | H791: 2322*1.2 | I791: 1111*1.2 | J791: 516*1.2 | K791: 398*0.5*1.2 | L791: 197*1.2*1.2 | M791: 1000*LV+100000 | N791: 0 | O791: math.max(0,(lv/5)-1) | P791: math.max(0,(lv/5)-1) | Q791: math.max(0,(lv/5)-1) | R791: 0; | S791: 有药王谷和盘丝洞的弟子在，真是不爽，还是跑路算了！ | T791: 药王谷和盘丝洞的弟子不在眼前，真是轻松愉快啊！ | U791: 0 | V791: 0,0; | W791: 4
A792: 10036 | B792: 青鸟 | C792: partner_1006 | D792: 0 | E792: 0 | F792: 1411,100;1413,100;1412,100;1416,100; | G792: 0,0; | H792: 2367 | I792: 1131*0.5 | J792: 526*0.8 | K792: 405*1.5 | L792: 200*0.8 | M792: 1000*LV+100000 | N792: 0 | O792: math.max(0,(lv/10)-1) | P792: math.max(0,(lv/10)-1) | Q792: math.max(0,(lv/10)-1) | R792: 0; | S792: 有药王谷和盘丝洞的弟子在，真是不爽，还是跑路算了！ | T792: 药王谷和盘丝洞的弟子不在眼前，真是轻松愉快啊！ | U792: 0 | V792: 0,0; | W792: 2
A793: 10037 | B793: 虎傀儡 | C793: pet_102 | D793: 0 | E793: 0 | F793: 1312,100;1315,100; | G793: 0,0; | H793: 2380 | I793: 1138 | J793: 528 | K793: 408*0.5 | L793: 201*1.2 | M793: 1000*LV+100000 | N793: 0 | O793: math.max(0,(lv/10)-1) | P793: math.max(0,(lv/10)-1) | Q793: math.max(0,(lv/10)-1) | R793: 0; | S793: 有药王谷和盘丝洞的弟子在，真是不爽，还是跑路算了！ | T793: 药王谷和盘丝洞的弟子不在眼前，真是轻松愉快啊！ | U793: 0 | V793: 0,0; | W793: 4
A794: 10038 | B794: 青鸟 | C794: partner_1006 | D794: 0 | E794: 0 | F794: 1411,100;1413,100;1412,100;1416,100; | G794: 0,0; | H794: 2389 | I794: 1145*0.5 | J794: 531*0.8 | K794: 413*1.5 | L794: 203*0.8 | M794: 1000*LV+100000 | N794: 0 | O794: math.max(0,(lv/10)-1) | P794: math.max(0,(lv/10)-1) | Q794: math.max(0,(lv/10)-1) | R794: 0; | S794: 有药王谷和盘丝洞的弟子在，真是不爽，还是跑路算了！ | T794: 药王谷和盘丝洞的弟子不在眼前，真是轻松愉快啊！ | U794: 0 | V794: 0,0; | W794: 2
A795: 10039 | B795: 小小 | C795: partner_1002 | D795: 0 | E795: 0 | F795: 1311,100;1313,100;1315,100;1312,100; | G795: 5123,100;5103,100; | H795: 2403 | I795: 1152 | J795: 533 | K795: 416*0.5 | L795: 204*1.2 | M795: 1000*LV+100000 | N795: 0 | O795: math.max(0,(lv/10)-1) | P795: math.max(0,(lv/10)-1) | Q795: math.max(0,(lv/10)-1) | R795: 0; | S795: 有药王谷和盘丝洞的弟子在，真是不爽，还是跑路算了！ | T795: 药王谷和盘丝洞的弟子不在眼前，真是轻松愉快啊！ | U795: 0 | V795: 0,0; | W795: 4
A796: 10040 | B796: 铁扇公主 | C796: partner_1003 | D796: 0 | E796: 0 | F796: 1511,100;1512,100;1513,100;1514,100; | G796: 5232,100;5126,100;5116,100; | H796: 2416*0.8*1.2 | I796: 1159*0.5*1.2 | J796: 536*1.2 | K796: 419*1.2 | L796: 206*2*1.2 | M796: 1000*LV+100000 | N796: 0 | O796: math.max(0,(lv/5)-1) | P796: math.max(0,(lv/5)-1) | Q796: math.max(0,(lv/5)-1) | R796: 0; | S796: 有药王谷和盘丝洞的弟子在，真是不爽，还是跑路算了！ | T796: 药王谷和盘丝洞的弟子不在眼前，真是轻松愉快啊！ | U796: 0 | V796: 0,0; | W796: 5
A797: 10041 | B797: 太阳神 | C797: partner_1011 | D797: 0 | E797: 0 | F797: 1211,100;1212,100;1213,100; | G797: 0,0; | H797: 2279*1.2 | I797: 1224*0.5 | J797: 590*1.2 | K797: 451*0.5 | L797: 220*1.5 | M797: 1000*LV+100000 | N797: 0 | O797: math.max(0,(lv/10)-1) | P797: math.max(0,(lv/10)-1) | Q797: math.max(0,(lv/10)-1) | R797: 0; | S797: 有药王谷和盘丝洞的弟子在，真是不爽，还是跑路算了！ | T797: 药王谷和盘丝洞的弟子不在眼前，真是轻松愉快啊！ | U797: 0 | V797: 0,0; | W797: 3
A798: 10042 | B798: 九天玄女 | C798: partner_1010 | D798: 0 | E798: 0 | F798: 1411,100;1413,100;1412,100;1416,100; | G798: 0,0; | H798: 2291 | I798: 1231*0.5 | J798: 593*0.8 | K798: 454*1.5 | L798: 221*0.8 | M798: 1000*LV+100000 | N798: 0 | O798: math.max(0,(lv/10)-1) | P798: math.max(0,(lv/10)-1) | Q798: math.max(0,(lv/10)-1) | R798: 0; | S798: 有药王谷和盘丝洞的弟子在，真是不爽，还是跑路算了！ | T798: 药王谷和盘丝洞的弟子不在眼前，真是轻松愉快啊！ | U798: 0 | V798: 0,0; | W798: 2
A799: 10043 | B799: 女魃 | C799: pet_53 | D799: 0 | E799: 0 | F799: 1411,100;1412,100; | G799: 0,0; | H799: 2298 | I799: 1238*0.5 | J799: 596*0.8 | K799: 458*1.5 | L799: 223*0.8 | M799: 1000*LV+100000 | N799: 0 | O799: math.max(0,(lv/10)-1) | P799: math.max(0,(lv/10)-1) | Q799: math.max(0,(lv/10)-1) | R799: 0; | S799: 有药王谷和盘丝洞的弟子在，真是不爽，还是跑路算了！ | T799: 药王谷和盘丝洞的弟子不在眼前，真是轻松愉快啊！ | U799: 0 | V799: 0,0; | W799: 2
A800: 10044 | B800: 天剑府弟子 | C800: hero_1001 | D800: 0 | E800: 0 | F800: 1111,100;1112,100; | G800: 5109,100;5110,100; | H800: 2310 | I800: 1244 | J800: 598 | K800: 462*0.5 | L800: 224*1.2 | M800: 1000*LV+100000 | N800: 0 | O800: math.max(0,(lv/10)-1) | P800: math.max(0,(lv/10)-1) | Q800: math.max(0,(lv/10)-1) | R800: 0; | S800: 有药王谷和盘丝洞的弟子在，真是不爽，还是跑路算了！ | T800: 药王谷和盘丝洞的弟子不在眼前，真是轻松愉快啊！ | U800: 0 | V800: 0,0; | W800: 1
A801: 10045 | B801: 白面狐狸 | C801: partner_1009 | D801: 0 | E801: 0 | F801: 1311,100;1313,100;1315,100;1312,100; | G801: 5201,100;5135,100;5110,100; | H801: 2322*1.2 | I801: 1251*1.2 | J801: 601*1.2 | K801: 465*0.5*1.2 | L801: 226*1.2*1.2 | M801: 1000*LV+100000 | N801: 0 | O801: math.max(0,(lv/5)-1) | P801: math.max(0,(lv/5)-1) | Q801: math.max(0,(lv/5)-1) | R801: 0; | S801: 有药王谷和盘丝洞的弟子在，真是不爽，还是跑路算了！ | T801: 药王谷和盘丝洞的弟子不在眼前，真是轻松愉快啊！ | U801: 0 | V801: 0,0; | W801: 4
A802: 10046 | B802: 毒仙子 | C802: partner_1005 | D802: 0 | E802: 0 | F802: 1211,100;1212,100;1216,100; | G802: 0,0; | H802: 2364*1.2 | I802: 1273*0.5 | J802: 612*1.2 | K802: 473*0.5 | L802: 229*1.5 | M802: 1000*LV+100000 | N802: 0 | O802: math.max(0,(lv/10)-1) | P802: math.max(0,(lv/10)-1) | Q802: math.max(0,(lv/10)-1) | R802: 0; | S802: 有药王谷和盘丝洞的弟子在，真是不爽，还是跑路算了！ | T802: 药王谷和盘丝洞的弟子不在眼前，真是轻松愉快啊！ | U802: 0 | V802: 0,0; | W802: 2
A803: 10047 | B803: 剑侠 | C803: pet_71 | D803: 0 | E803: 0 | F803: 1411,100;1413,100;1412,100;1416,100; | G803: 0,0; | H803: 2376 | I803: 1280*0.5 | J803: 615*0.8 | K803: 476*1.5 | L803: 231*0.8 | M803: 1000*LV+100000 | N803: 0 | O803: math.max(0,(lv/10)-1) | P803: math.max(0,(lv/10)-1) | Q803: math.max(0,(lv/10)-1) | R803: 0; | S803: 有药王谷和盘丝洞的弟子在，真是不爽，还是跑路算了！ | T803: 药王谷和盘丝洞的弟子不在眼前，真是轻松愉快啊！ | U803: 0 | V803: 0,0; | W803: 2
A804: 10048 | B804: 媚魔 | C804: pet_93 | D804: 0 | E804: 0 | F804: 1511,100;1512,100;1513,100;1514,100; | G804: 0,0; | H804: 2383*0.8 | I804: 1286*0.5 | J804: 618 | K804: 479 | L804: 232*2 | M804: 1000*LV+100000 | N804: 0 | O804: math.max(0,(lv/10)-1) | P804: math.max(0,(lv/10)-1) | Q804: math.max(0,(lv/10)-1) | R804: 0; | S804: 有药王谷和盘丝洞的弟子在，真是不爽，还是跑路算了！ | T804: 药王谷和盘丝洞的弟子不在眼前，真是轻松愉快啊！ | U804: 0 | V804: 0,0; | W804: 5
A805: 10049 | B805: 小小 | C805: partner_1002 | D805: 0 | E805: 0 | F805: 1311,100;1313,100;1315,100;1312,100; | G805: 5109,100;5110,100; | H805: 2395 | I805: 1293 | J805: 620 | K805: 484*0.5 | L805: 234*1.2 | M805: 1000*LV+100000 | N805: 0 | O805: math.max(0,(lv/10)-1) | P805: math.max(0,(lv/10)-1) | Q805: math.max(0,(lv/10)-1) | R805: 0; | S805: 有药王谷和盘丝洞的弟子在，真是不爽，还是跑路算了！ | T805: 药王谷和盘丝洞的弟子不在眼前，真是轻松愉快啊！ | U805: 0 | V805: 0,0; | W805: 4
A806: 10050 | B806: 卓一平 | C806: partner_1001 | D806: 0 | E806: 0 | F806: 1111,100;1112,100;1113,100;1114,100; | G806: 5203,100;5209,100;5133,100; | H806: 2406*1.2 | I806: 1301*1.2 | J806: 623*1.2 | K806: 486*0.5*1.2 | L806: 236*1.2*1.2 | M806: 1000*LV+100000 | N806: 0 | O806: math.max(0,(lv/5)-1) | P806: math.max(0,(lv/5)-1) | Q806: math.max(0,(lv/5)-1) | R806: 0; | S806: 有药王谷和盘丝洞的弟子在，真是不爽，还是跑路算了！ | T806: 药王谷和盘丝洞的弟子不在眼前，真是轻松愉快啊！ | U806: 0 | V806: 0,0; | W806: 1
A807: =R[-50]C+100 -> 10101 | B807: 水晶宫弟子 | C807: hero_1001 | D807: 0 | E807: 0 | F807: 1411,100;1412,100; | G807: 0,0; | H807: 3800*1.5 | I807: 1272*0.5-500 | J807: 444*0.8 | K807: 308*1.5 | L807: 148*0.8 | M807: 1000*LV+100000 | N807: 0 | O807: math.max(0,(lv/10)-1) | P807: math.max(0,(lv/10)-1) | Q807: math.max(0,(lv/10)-1) | R807: 0; | S807: 有药王谷和盘丝洞的弟子在，真是不爽，还是跑路算了！ | T807: 药王谷和盘丝洞的弟子不在眼前，真是轻松愉快啊！ | U807: 0 | V807: 0,0; | W807: 2
A808: =R[-50]C+100 -> 10102 | B808: 天策府长老 | C808: hero_2001 | D808: 0 | E808: 0 | F808: 1111,100;1112,100; | G808: 0,0; | H808: 3815*1.5 | I808: 1282-500 | J808: 447 | K808: 311*0.5 | L808: 150*1.2 | M808: 1000*LV+100000 | N808: 0 | O808: math.max(0,(lv/10)-1) | P808: math.max(0,(lv/10)-1) | Q808: math.max(0,(lv/10)-1) | R808: 0; | S808: 有药王谷和盘丝洞的弟子在，真是不爽，还是跑路算了！ | T808: 药王谷和盘丝洞的弟子不在眼前，真是轻松愉快啊！ | U808: 0 | V808: 0,0; | W808: 1
A809: =R[-50]C+100 -> 10103 | B809: 青鸟 | C809: partner_1006 | D809: 0 | E809: 0 | F809: 1411,100;1413,100;1412,100;1416,100; | G809: 0,0; | H809: 3830*1.5 | I809: 1294*0.5-500 | J809: 449*0.8 | K809: 315*1.5 | L809: 152*0.8 | M809: 1000*LV+100000 | N809: 0 | O809: math.max(0,(lv/10)-1) | P809: math.max(0,(lv/10)-1) | Q809: math.max(0,(lv/10)-1) | R809: 0; | S809: 有药王谷和盘丝洞的弟子在，真是不爽，还是跑路算了！ | T809: 药王谷和盘丝洞的弟子不在眼前，真是轻松愉快啊！ | U809: 0 | V809: 0,0; | W809: 2
A810: =R[-50]C+100 -> 10104 | B810: 兽王御兽弟子 | C810: hero_1001 | D810: 0 | E810: 0 | F810: 1312,100;1315,100; | G810: 0,0; | H810: 3842*1.5 | I810: 1125-500 | J810: 452 | K810: 318*0.5 | L810: 153*1.2 | M810: 1000*LV+100000 | N810: 0 | O810: math.max(0,(lv/10)-1) | P810: math.max(0,(lv/10)-1) | Q810: math.max(0,(lv/10)-1) | R810: 0; | S810: 有药王谷和盘丝洞的弟子在，真是不爽，还是跑路算了！ | T810: 药王谷和盘丝洞的弟子不在眼前，真是轻松愉快啊！ | U810: 0 | V810: 0,0; | W810: 4
A811: =R[-50]C+100 -> 10105 | B811: 铁扇公主 | C811: partner_1003 | D811: 0 | E811: 0 | F811: 1511,100;1512,100;1513,100;1514,100; | G811: 5216,100; | H811: 3867*0.8*1.5 | I811: 1133*0.5-500 | J811: 454 | K811: 321 | L811: 155*2 | M811: 1000*LV+100000 | N811: 0 | O811: math.max(0,(lv/10)-1) | P811: math.max(0,(lv/10)-1) | Q811: math.max(0,(lv/10)-1) | R811: 0; | S811: 有药王谷和盘丝洞的弟子在，真是不爽，还是跑路算了！ | T811: 药王谷和盘丝洞的弟子不在眼前，真是轻松愉快啊！ | U811: 0 | V811: 0,0; | W811: 5
A812: =R[-50]C+100 -> 10106 | B812: 玄奘法师 | C812: partner_1007 | D812: 0 | E812: 0 | F812: 1411,100;1413,100;1412,100;1416,100; | G812: 0,0; | H812: 3961*1.5 | I812: 1161*0.5-500 | J812: 466*0.8 | K812: 329*1.5 | L812: 157*0.8 | M812: 1000*LV+100000 | N812: 0 | O812: math.max(0,(lv/10)-1) | P812: math.max(0,(lv/10)-1) | Q812: math.max(0,(lv/10)-1) | R812: 0; | S812: 有药王谷和盘丝洞的弟子在，真是不爽，还是跑路算了！ | T812: 药王谷和盘丝洞的弟子不在眼前，真是轻松愉快啊！ | U812: 0 | V812: 0,0; | W812: 2
A813: =R[-50]C+100 -> 10107 | B813: 水晶宫御兽弟子 | C813: hero_2001 | D813: 0 | E813: 0 | F813: 1411,100;1413,100;1412,100;1416,100; | G813: 0,0; | H813: 3986*1.5 | I813: 1170*0.5-500 | J813: 468*0.8 | K813: 332*1.5 | L813: 159*0.8 | M813: 1000*LV+100000 | N813: 0 | O813: math.max(0,(lv/10)-1) | P813: math.max(0,(lv/10)-1) | Q813: math.max(0,(lv/10)-1) | R813: 0; | S813: 有药王谷和盘丝洞的弟子在，真是不爽，还是跑路算了！ | T813: 药王谷和盘丝洞的弟子不在眼前，真是轻松愉快啊！ | U813: 0 | V813: 0,0; | W813: 2
A814: =R[-50]C+100 -> 10108 | B814: 赤天帝 | C814: partner_1012 | D814: 0 | E814: 0 | F814: 1411,100;1413,100;1412,100;1416,100; | G814: 0,0; | H814: 4003*1.5 | I814: 1179*0.5-500 | J814: 471*0.8 | K814: 335*1.5 | L814: 160*0.8 | M814: 1000*LV+100000 | N814: 0 | O814: math.max(0,(lv/10)-1) | P814: math.max(0,(lv/10)-1) | Q814: math.max(0,(lv/10)-1) | R814: 0; | S814: 有药王谷和盘丝洞的弟子在，真是不爽，还是跑路算了！ | T814: 药王谷和盘丝洞的弟子不在眼前，真是轻松愉快啊！ | U814: 0 | V814: 0,0; | W814: 2
A815: =R[-50]C+100 -> 10109 | B815: 铁扇公主 | C815: partner_1003 | D815: 0 | E815: 0 | F815: 1511,100;1512,100;1513,100;1514,100; | G815: 0,0; | H815: 4020*0.8*1.5 | I815: 1188*0.5-500 | J815: 473 | K815: 338 | L815: 162*2 | M815: 1000*LV+100000 | N815: 0 | O815: math.max(0,(lv/10)-1) | P815: math.max(0,(lv/10)-1) | Q815: math.max(0,(lv/10)-1) | R815: 0; | S815: 有药王谷和盘丝洞的弟子在，真是不爽，还是跑路算了！ | T815: 药王谷和盘丝洞的弟子不在眼前，真是轻松愉快啊！ | U815: 0 | V815: 0,0; | W815: 5
A816: =R[-50]C+100 -> 10110 | B816: 迦楼罗 | C816: pet_201 | D816: 0 | E816: 0 | F816: 1111,100;1112,100; | G816: 5209,100; | H816: 4046*1.5 | I816: 1198-500 | J816: 476 | K816: 341*0.5 | L816: 164*1.2 | M816: 1000*LV+100000 | N816: 0 | O816: math.max(0,(lv/10)-1) | P816: math.max(0,(lv/10)-1) | Q816: math.max(0,(lv/10)-1) | R816: 0; | S816: 有药王谷和盘丝洞的弟子在，真是不爽，还是跑路算了！ | T816: 药王谷和盘丝洞的弟子不在眼前，真是轻松愉快啊！ | U816: 0 | V816: 0,0; | W816: 1
A817: =R[-50]C+100 -> 10111 | B817: 毒仙子 | C817: partner_1005 | D817: 0 | E817: 0 | F817: 1211,100;1212,100;1213,100; | G817: 0,0; | H817: 4590*1.2*1.5 | I817: 1331*0.5-500 | J817: 540*1.2 | K817: 381*0.5 | L817: 179*1.5 | M817: 1000*LV+100000 | N817: 0 | O817: math.max(0,(lv/10)-1) | P817: math.max(0,(lv/10)-1) | Q817: math.max(0,(lv/10)-1) | R817: 0; | S817: 有药王谷和盘丝洞的弟子在，真是不爽，还是跑路算了！ | T817: 药王谷和盘丝洞的弟子不在眼前，真是轻松愉快啊！ | U817: 0 | V817: 0,0; | W817: 3
A818: =R[-50]C+100 -> 10112 | B818: 水晶宫长老 | C818: hero_1001 | D818: 0 | E818: 0 | F818: 1411,100;1412,100; | G818: 0,0; | H818: 4615*1.5 | I818: 1339*0.5-500 | J818: 543*0.8 | K818: 384*1.5 | L818: 180*0.8 | M818: 1000*LV+100000 | N818: 0 | O818: math.max(0,(lv/10)-1) | P818: math.max(0,(lv/10)-1) | Q818: math.max(0,(lv/10)-1) | R818: 0; | S818: 有药王谷和盘丝洞的弟子在，真是不爽，还是跑路算了！ | T818: 药王谷和盘丝洞的弟子不在眼前，真是轻松愉快啊！ | U818: 0 | V818: 0,0; | W818: 2
A819: =R[-50]C+100 -> 10113 | B819: 道济和尚 | C819: partner_1008 | D819: 0 | E819: 0 | F819: 1411,100;1413,100;1412,100;1416,100; | G819: 0,0; | H819: 4632*1.5 | I819: 1349*0.5-500 | J819: 545*0.8 | K819: 387*1.5 | L819: 182*0.8 | M819: 1000*LV+100000 | N819: 0 | O819: math.max(0,(lv/10)-1) | P819: math.max(0,(lv/10)-1) | Q819: math.max(0,(lv/10)-1) | R819: 0; | S819: 有药王谷和盘丝洞的弟子在，真是不爽，还是跑路算了！ | T819: 药王谷和盘丝洞的弟子不在眼前，真是轻松愉快啊！ | U819: 0 | V819: 0,0; | W819: 2
A820: =R[-50]C+100 -> 10114 | B820: 罗刹女 | C820: pet_61 | D820: 0 | E820: 0 | F820: 1312,100;1315,100;1311,100; | G820: 0,0; | H820: 4658*1.5 | I820: 1358-500 | J820: 547 | K820: 391*0.5 | L820: 184*1.2 | M820: 1000*LV+100000 | N820: 0 | O820: math.max(0,(lv/10)-1) | P820: math.max(0,(lv/10)-1) | Q820: math.max(0,(lv/10)-1) | R820: 0; | S820: 有药王谷和盘丝洞的弟子在，真是不爽，还是跑路算了！ | T820: 药王谷和盘丝洞的弟子不在眼前，真是轻松愉快啊！ | U820: 0 | V820: 0,0; | W820: 4
A821: =R[-50]C+100 -> 10115 | B821: 兽王御兽弟子 | C821: hero_1001 | D821: 0 | E821: 0 | F821: 1312,100;1315,100;1311,100; | G821: 5201,100; | H821: 4683*1.5 | I821: 1368-500 | J821: 550 | K821: 394*0.5 | L821: 185*1.2 | M821: 1000*LV+100000 | N821: 0 | O821: math.max(0,(lv/10)-1) | P821: math.max(0,(lv/10)-1) | Q821: math.max(0,(lv/10)-1) | R821: 0; | S821: 有药王谷和盘丝洞的弟子在，真是不爽，还是跑路算了！ | T821: 药王谷和盘丝洞的弟子不在眼前，真是轻松愉快啊！ | U821: 0 | V821: 0,0; | W821: 4
A822: =R[-50]C+100 -> 10116 | B822: 天璇仙子 | C822: pet_83 | D822: 0 | E822: 0 | F822: 1311,100;1312,100; | G822: 0,0; | H822: 4785*1.5 | I822: 1396-500 | J822: 563 | K822: 403*0.5 | L822: 188*1.2 | M822: 1000*LV+100000 | N822: 0 | O822: math.max(0,(lv/10)-1) | P822: math.max(0,(lv/10)-1) | Q822: math.max(0,(lv/10)-1) | R822: 0; | S822: 有药王谷和盘丝洞的弟子在，真是不爽，还是跑路算了！ | T822: 药王谷和盘丝洞的弟子不在眼前，真是轻松愉快啊！ | U822: 0 | V822: 0,0; | W822: 4
A823: =R[-50]C+100 -> 10117 | B823: 水晶宫长老 | C823: hero_2001 | D823: 0 | E823: 0 | F823: 1411,100;1413,100;1412,100;1416,100; | G823: 0,0; | H823: 4811*1.5 | I823: 1404*0.5-500 | J823: 565*0.8 | K823: 405*1.5 | L823: 190*0.8 | M823: 1000*LV+100000 | N823: 0 | O823: math.max(0,(lv/10)-1) | P823: math.max(0,(lv/10)-1) | Q823: math.max(0,(lv/10)-1) | R823: 0; | S823: 有药王谷和盘丝洞的弟子在，真是不爽，还是跑路算了！ | T823: 药王谷和盘丝洞的弟子不在眼前，真是轻松愉快啊！ | U823: 0 | V823: 0,0; | W823: 2
A824: =R[-50]C+100 -> 10118 | B824: 青鸟 | C824: partner_1006 | D824: 0 | E824: 0 | F824: 1411,100;1413,100;1412,100;1416,100; | G824: 0,0; | H824: 4828*1.5 | I824: 1414*0.5-500 | J824: 568*0.8 | K824: 409*1.5 | L824: 192*0.8 | M824: 1000*LV+100000 | N824: 0 | O824: math.max(0,(lv/10)-1) | P824: math.max(0,(lv/10)-1) | Q824: math.max(0,(lv/10)-1) | R824: 0; | S824: 有药王谷和盘丝洞的弟子在，真是不爽，还是跑路算了！ | T824: 药王谷和盘丝洞的弟子不在眼前，真是轻松愉快啊！ | U824: 0 | V824: 0,0; | W824: 2
A825: =R[-50]C+100 -> 10119 | B825: 大鹏鸟 | C825: pet_72 | D825: 0 | E825: 0 | F825: 1311,100;1313,100;1315,100;1312,100; | G825: 5135,100; | H825: 4853*1.5 | I825: 1423-500 | J825: 570 | K825: 413*0.5 | L825: 193*1.2 | M825: 1000*LV+100000 | N825: 0 | O825: math.max(0,(lv/10)-1) | P825: math.max(0,(lv/10)-1) | Q825: math.max(0,(lv/10)-1) | R825: 0; | S825: 有药王谷和盘丝洞的弟子在，真是不爽，还是跑路算了！ | T825: 药王谷和盘丝洞的弟子不在眼前，真是轻松愉快啊！ | U825: 0 | V825: 0,0; | W825: 4
A826: =R[-50]C+100 -> 10120 | B826: 白面狐狸 | C826: partner_1009 | D826: 0 | E826: 0 | F826: 1311,100;1313,100;1315,100;1312,100; | G826: 5135,100;5105,100; | H826: 4870*1.5 | I826: 1433-500 | J826: 573 | K826: 415*0.5 | L826: 195*1.2 | M826: 1000*LV+100000 | N826: 0 | O826: math.max(0,(lv/10)-1) | P826: math.max(0,(lv/10)-1) | Q826: math.max(0,(lv/10)-1) | R826: 0; | S826: 有药王谷和盘丝洞的弟子在，真是不爽，还是跑路算了！ | T826: 药王谷和盘丝洞的弟子不在眼前，真是轻松愉快啊！ | U826: 0 | V826: 0,0; | W826: 4
A827: =R[-50]C+100 -> 10121 | B827: 罗刹女 | C827: pet_61 | D827: 0 | E827: 0 | F827: 1111,100;1112,100; | G827: 0,0; | H827: 4779*1.5 | I827: 1588-500 | J827: 655 | K827: 475*0.5 | L827: 235*1.2 | M827: 1000*LV+100000 | N827: 0 | O827: math.max(0,(lv/10)-1) | P827: math.max(0,(lv/10)-1) | Q827: math.max(0,(lv/10)-1) | R827: 0; | S827: 有药王谷和盘丝洞的弟子在，真是不爽，还是跑路算了！ | T827: 药王谷和盘丝洞的弟子不在眼前，真是轻松愉快啊！ | U827: 0 | V827: 0,0; | W827: 1
A828: =R[-50]C+100 -> 10122 | B828: 烈焰悟空 | C828: pet_73 | D828: 0 | E828: 0 | F828: 1311,50;1312,50; | G828: 0,0; | H828: 4801*1.5 | I828: 1597-500 | J828: 658 | K828: 477*0.5 | L828: 236*1.2 | M828: 1000*LV+100000 | N828: 0 | O828: math.max(0,(lv/10)-1) | P828: math.max(0,(lv/10)-1) | Q828: math.max(0,(lv/10)-1) | R828: 0; | S828: 有药王谷和盘丝洞的弟子在，真是不爽，还是跑路算了！ | T828: 药王谷和盘丝洞的弟子不在眼前，真是轻松愉快啊！ | U828: 0 | V828: 0,0; | W828: 4
A829: =R[-50]C+100 -> 10123 | B829: 剑侠 | C829: pet_71 | D829: 0 | E829: 0 | F829: 1111,40;1112,40;1116,20; | G829: 0,0; | H829: 4815*1.5 | I829: 1606-500 | J829: 661 | K829: 481*0.5 | L829: 238*1.2 | M829: 1000*LV+100000 | N829: 0 | O829: math.max(0,(lv/10)-1) | P829: math.max(0,(lv/10)-1) | Q829: math.max(0,(lv/10)-1) | R829: 0; | S829: 有药王谷和盘丝洞的弟子在，真是不爽，还是跑路算了！ | T829: 药王谷和盘丝洞的弟子不在眼前，真是轻松愉快啊！ | U829: 0 | V829: 0,0; | W829: 1
A830: =R[-50]C+100 -> 10124 | B830: 媚魔 | C830: pet_93 | D830: 0 | E830: 0 | F830: 1511,100;1512,100;1513,100;1514,100; | G830: 5132,100; | H830: 4837*0.8*1.5 | I830: 1615*0.5-500 | J830: 663 | K830: 485 | L830: 240*2 | M830: 1000*LV+100000 | N830: 0 | O830: math.max(0,(lv/10)-1) | P830: math.max(0,(lv/10)-1) | Q830: math.max(0,(lv/10)-1) | R830: 0; | S830: 有药王谷和盘丝洞的弟子在，真是不爽，还是跑路算了！ | T830: 药王谷和盘丝洞的弟子不在眼前，真是轻松愉快啊！ | U830: 0 | V830: 0,0; | W830: 5
A831: =R[-50]C+100 -> 10125 | B831: 小小 | C831: partner_1002 | D831: 0 | E831: 0 | F831: 1311,100;1313,100;1315,100;1312,100; | G831: 5103,100;5133,100; | H831: 4859*1.5 | I831: 1624-500 | J831: 666 | K831: 487*0.5 | L831: 241*1.2 | M831: 1000*LV+100000 | N831: 0 | O831: math.max(0,(lv/10)-1) | P831: math.max(0,(lv/10)-1) | Q831: math.max(0,(lv/10)-1) | R831: 0; | S831: 有药王谷和盘丝洞的弟子在，真是不爽，还是跑路算了！ | T831: 药王谷和盘丝洞的弟子不在眼前，真是轻松愉快啊！ | U831: 0 | V831: 0,0; | W831: 4
A832: =R[-50]C+100 -> 10126 | B832: 太阳神 | C832: partner_1011 | D832: 0 | E832: 0 | F832: 1211,100;1212,100;1213,100; | G832: 0,0; | H832: 4954*1.2*1.5 | I832: 1652*0.5-500 | J832: 680*1.2 | K832: 496*0.5 | L832: 245*1.5 | M832: 1000*LV+100000 | N832: 0 | O832: math.max(0,(lv/10)-1) | P832: math.max(0,(lv/10)-1) | Q832: math.max(0,(lv/10)-1) | R832: 0; | S832: 有药王谷和盘丝洞的弟子在，真是不爽，还是跑路算了！ | T832: 药王谷和盘丝洞的弟子不在眼前，真是轻松愉快啊！ | U832: 0 | V832: 0,0; | W832: 3
A833: =R[-50]C+100 -> 10127 | B833: 道济和尚 | C833: partner_1008 | D833: 0 | E833: 0 | F833: 1411,100;1413,100;1412,100;1416,100; | G833: 0,0; | H833: 4976*1.5 | I833: 1661*0.5-500 | J833: 682*0.8 | K833: 499*1.5 | L833: 247*0.8 | M833: 1000*LV+100000 | N833: 0 | O833: math.max(0,(lv/10)-1) | P833: math.max(0,(lv/10)-1) | Q833: math.max(0,(lv/10)-1) | R833: 0; | S833: 有药王谷和盘丝洞的弟子在，真是不爽，还是跑路算了！ | T833: 药王谷和盘丝洞的弟子不在眼前，真是轻松愉快啊！ | U833: 0 | V833: 0,0; | W833: 2
A834: =R[-50]C+100 -> 10128 | B834: 织梦花妖 | C834: pet_42 | D834: 0 | E834: 0 | F834: 1411,100;1413,100;1412,100;1416,100; | G834: 0,0; | H834: 4990*1.5 | I834: 1670*0.5-500 | J834: 685*0.8 | K834: 504*1.5 | L834: 248*0.8 | M834: 1000*LV+100000 | N834: 0 | O834: math.max(0,(lv/10)-1) | P834: math.max(0,(lv/10)-1) | Q834: math.max(0,(lv/10)-1) | R834: 0; | S834: 有药王谷和盘丝洞的弟子在，真是不爽，还是跑路算了！ | T834: 药王谷和盘丝洞的弟子不在眼前，真是轻松愉快啊！ | U834: 0 | V834: 0,0; | W834: 2
A835: =R[-50]C+100 -> 10129 | B835: 天剑府弟子 | C835: hero_1001 | D835: 0 | E835: 0 | F835: 1111,100;1112,100; | G835: 5127,100; | H835: 5012*1.5 | I835: 1678-500 | J835: 687 | K835: 507*0.5 | L835: 250*1.2 | M835: 1000*LV+100000 | N835: 0 | O835: math.max(0,(lv/10)-1) | P835: math.max(0,(lv/10)-1) | Q835: math.max(0,(lv/10)-1) | R835: 0; | S835: 有药王谷和盘丝洞的弟子在，真是不爽，还是跑路算了！ | T835: 药王谷和盘丝洞的弟子不在眼前，真是轻松愉快啊！ | U835: 0 | V835: 0,0; | W835: 1
A836: =R[-50]C+100 -> 10130 | B836: 天师道人 | C836: pet_22 | D836: 0 | E836: 0 | F836: 1511,100;1512,100;1513,100; | G836: 5132,100;5126,100; | H836: 5034*0.8*1.5 | I836: 1687*0.5-500 | J836: 690 | K836: 510 | L836: 252*2 | M836: 1000*LV+100000 | N836: 0 | O836: math.max(0,(lv/10)-1) | P836: math.max(0,(lv/10)-1) | Q836: math.max(0,(lv/10)-1) | R836: 0; | S836: 有药王谷和盘丝洞的弟子在，真是不爽，还是跑路算了！ | T836: 药王谷和盘丝洞的弟子不在眼前，真是轻松愉快啊！ | U836: 0 | V836: 0,0; | W836: 5
A837: =R[-50]C+100 -> 10131 | B837: 女魃 | C837: pet_53 | D837: 0 | E837: 0 | F837: 1111,100;1112,100;1116,100; | G837: 0,0; | H837: 5559*1.5 | I837: 1835-500 | J837: 762 | K837: 553*0.5 | L837: 270*1.2 | M837: 1000*LV+100000 | N837: 0 | O837: math.max(0,(lv/10)-1) | P837: math.max(0,(lv/10)-1) | Q837: math.max(0,(lv/10)-1) | R837: 0; | S837: 有药王谷和盘丝洞的弟子在，真是不爽，还是跑路算了！ | T837: 药王谷和盘丝洞的弟子不在眼前，真是轻松愉快啊！ | U837: 0 | V837: 0,0; | W837: 1
A838: =R[-50]C+100 -> 10132 | B838: 兽王御兽弟子 | C838: hero_1001 | D838: 0 | E838: 0 | F838: 1312,100;1315,100; | G838: 0,0; | H838: 5580*1.5 | I838: 1844-500 | J838: 765 | K838: 556*0.5 | L838: 272*1.2 | M838: 1000*LV+100000 | N838: 0 | O838: math.max(0,(lv/10)-1) | P838: math.max(0,(lv/10)-1) | Q838: math.max(0,(lv/10)-1) | R838: 0; | S838: 有药王谷和盘丝洞的弟子在，真是不爽，还是跑路算了！ | T838: 药王谷和盘丝洞的弟子不在眼前，真是轻松愉快啊！ | U838: 0 | V838: 0,0; | W838: 4
A839: =R[-50]C+100 -> 10133 | B839: 九天玄女 | C839: partner_1010 | D839: 0 | E839: 0 | F839: 1411,100;1413,100;1412,100;1416,100; | G839: 0,0; | H839: 5595*1.5 | I839: 1853*0.5-500 | J839: 768*0.8 | K839: 559*1.5 | L839: 273*0.8 | M839: 1000*LV+100000 | N839: 0 | O839: math.max(0,(lv/10)-1) | P839: math.max(0,(lv/10)-1) | Q839: math.max(0,(lv/10)-1) | R839: 0; | S839: 有药王谷和盘丝洞的弟子在，真是不爽，还是跑路算了！ | T839: 药王谷和盘丝洞的弟子不在眼前，真是轻松愉快啊！ | U839: 0 | V839: 0,0; | W839: 2
A840: =R[-50]C+100 -> 10134 | B840: 魔教精英 | C840: pet_61 | D840: 0 | E840: 0 | F840: 1312,100;1315,100;1311,100; | G840: 5123,100; | H840: 5617*1.5 | I840: 1862-500 | J840: 770 | K840: 564*0.5 | L840: 275*1.2 | M840: 1000*LV+100000 | N840: 0 | O840: math.max(0,(lv/10)-1) | P840: math.max(0,(lv/10)-1) | Q840: math.max(0,(lv/10)-1) | R840: 0; | S840: 有药王谷和盘丝洞的弟子在，真是不爽，还是跑路算了！ | T840: 药王谷和盘丝洞的弟子不在眼前，真是轻松愉快啊！ | U840: 0 | V840: 0,0; | W840: 4
A841: =R[-50]C+100 -> 10135 | B841: 插翅虎 | C841: pet_63 | D841: 0 | E841: 0 | F841: 1311,100;1313,100;1315,100;1312,100; | G841: 5117,100;5103,100; | H841: 5639*1.5 | I841: 1871-500 | J841: 773 | K841: 567*0.5 | L841: 276*1.2 | M841: 1000*LV+100000 | N841: 0 | O841: math.max(0,(lv/10)-1) | P841: math.max(0,(lv/10)-1) | Q841: math.max(0,(lv/10)-1) | R841: 0; | S841: 有药王谷和盘丝洞的弟子在，真是不爽，还是跑路算了！ | T841: 药王谷和盘丝洞的弟子不在眼前，真是轻松愉快啊！ | U841: 0 | V841: 0,0; | W841: 4
A842: =R[-50]C+100 -> 10136 | B842: 青鸟 | C842: partner_1006 | D842: 0 | E842: 0 | F842: 1411,100;1413,100;1412,100;1416,100; | G842: 0,0; | H842: 5741*1.5 | I842: 1901*0.5-500 | J842: 788*0.8 | K842: 576*1.5 | L842: 280*0.8 | M842: 1000*LV+100000 | N842: 0 | O842: math.max(0,(lv/10)-1) | P842: math.max(0,(lv/10)-1) | Q842: math.max(0,(lv/10)-1) | R842: 0; | S842: 有药王谷和盘丝洞的弟子在，真是不爽，还是跑路算了！ | T842: 药王谷和盘丝洞的弟子不在眼前，真是轻松愉快啊！ | U842: 0 | V842: 0,0; | W842: 2
A843: =R[-50]C+100 -> 10137 | B843: 虎傀儡 | C843: pet_102 | D843: 0 | E843: 0 | F843: 1312,100;1315,100; | G843: 0,0; | H843: 5763*1.5 | I843: 1910-500 | J843: 791 | K843: 578*0.5 | L843: 282*1.2 | M843: 1000*LV+100000 | N843: 0 | O843: math.max(0,(lv/10)-1) | P843: math.max(0,(lv/10)-1) | Q843: math.max(0,(lv/10)-1) | R843: 0; | S843: 有药王谷和盘丝洞的弟子在，真是不爽，还是跑路算了！ | T843: 药王谷和盘丝洞的弟子不在眼前，真是轻松愉快啊！ | U843: 0 | V843: 0,0; | W843: 4
A844: =R[-50]C+100 -> 10138 | B844: 青鸟 | C844: partner_1006 | D844: 0 | E844: 0 | F844: 1411,100;1413,100;1412,100;1416,100; | G844: 0,0; | H844: 5784*1.5 | I844: 1919*0.5-500 | J844: 793*0.8 | K844: 582*1.5 | L844: 284*0.8 | M844: 1000*LV+100000 | N844: 0 | O844: math.max(0,(lv/10)-1) | P844: math.max(0,(lv/10)-1) | Q844: math.max(0,(lv/10)-1) | R844: 0; | S844: 有药王谷和盘丝洞的弟子在，真是不爽，还是跑路算了！ | T844: 药王谷和盘丝洞的弟子不在眼前，真是轻松愉快啊！ | U844: 0 | V844: 0,0; | W844: 2
A845: =R[-50]C+100 -> 10139 | B845: 小小 | C845: partner_1002 | D845: 0 | E845: 0 | F845: 1311,100;1313,100;1315,100;1312,100; | G845: 5123,100;5103,100; | H845: 5799*1.5 | I845: 1928-500 | J845: 796 | K845: 586*0.5 | L845: 285*1.2 | M845: 1000*LV+100000 | N845: 0 | O845: math.max(0,(lv/10)-1) | P845: math.max(0,(lv/10)-1) | Q845: math.max(0,(lv/10)-1) | R845: 0; | S845: 有药王谷和盘丝洞的弟子在，真是不爽，还是跑路算了！ | T845: 药王谷和盘丝洞的弟子不在眼前，真是轻松愉快啊！ | U845: 0 | V845: 0,0; | W845: 4
A846: =R[-50]C+100 -> 10140 | B846: 铁扇公主 | C846: partner_1003 | D846: 0 | E846: 0 | F846: 1511,100;1512,100;1513,100;1514,100; | G846: 5232,100;5126,100;5116,100; | H846: 5821*0.8*1.5 | I846: 1937*0.5-500 | J846: 799 | K846: 589 | L846: 287*2 | M846: 1000*LV+100000 | N846: 0 | O846: math.max(0,(lv/10)-1) | P846: math.max(0,(lv/10)-1) | Q846: math.max(0,(lv/10)-1) | R846: 0; | S846: 有药王谷和盘丝洞的弟子在，真是不爽，还是跑路算了！ | T846: 药王谷和盘丝洞的弟子不在眼前，真是轻松愉快啊！ | U846: 0 | V846: 0,0; | W846: 5
A847: =R[-50]C+100 -> 10141 | B847: 太阳神 | C847: partner_1011 | D847: 0 | E847: 0 | F847: 1211,100;1212,100;1213,100; | G847: 0,0; | H847: 5686*1.2*1.5 | I847: 2119*0.5-500 | J847: 892*1.2 | K847: 659*0.5 | L847: 337*1.5 | M847: 1000*LV+100000 | N847: 0 | O847: math.max(0,(lv/10)-1) | P847: math.max(0,(lv/10)-1) | Q847: math.max(0,(lv/10)-1) | R847: 0; | S847: 有药王谷和盘丝洞的弟子在，真是不爽，还是跑路算了！ | T847: 药王谷和盘丝洞的弟子不在眼前，真是轻松愉快啊！ | U847: 0 | V847: 0,0; | W847: 3
A848: =R[-50]C+100 -> 10142 | B848: 九天玄女 | C848: partner_1010 | D848: 0 | E848: 0 | F848: 1411,100;1413,100;1412,100;1416,100; | G848: 0,0; | H848: 5705*1.5 | I848: 2127*0.5-500 | J848: 895*0.8 | K848: 662*1.5 | L848: 339*0.8 | M848: 1000*LV+100000 | N848: 0 | O848: math.max(0,(lv/10)-1) | P848: math.max(0,(lv/10)-1) | Q848: math.max(0,(lv/10)-1) | R848: 0; | S848: 有药王谷和盘丝洞的弟子在，真是不爽，还是跑路算了！ | T848: 药王谷和盘丝洞的弟子不在眼前，真是轻松愉快啊！ | U848: 0 | V848: 0,0; | W848: 2
A849: =R[-50]C+100 -> 10143 | B849: 女魃 | C849: pet_53 | D849: 0 | E849: 0 | F849: 1411,100;1412,100; | G849: 0,0; | H849: 5724*1.5 | I849: 2136*0.5-500 | J849: 898*0.8 | K849: 666*1.5 | L849: 340*0.8 | M849: 1000*LV+100000 | N849: 0 | O849: math.max(0,(lv/10)-1) | P849: math.max(0,(lv/10)-1) | Q849: math.max(0,(lv/10)-1) | R849: 0; | S849: 有药王谷和盘丝洞的弟子在，真是不爽，还是跑路算了！ | T849: 药王谷和盘丝洞的弟子不在眼前，真是轻松愉快啊！ | U849: 0 | V849: 0,0; | W849: 2
A850: =R[-50]C+100 -> 10144 | B850: 天剑府弟子 | C850: hero_1001 | D850: 0 | E850: 0 | F850: 1111,100;1112,100; | G850: 5109,100;5110,100; | H850: 5743*1.5 | I850: 2144-500 | J850: 900 | K850: 670*0.5 | L850: 342*1.2 | M850: 1000*LV+100000 | N850: 0 | O850: math.max(0,(lv/10)-1) | P850: math.max(0,(lv/10)-1) | Q850: math.max(0,(lv/10)-1) | R850: 0; | S850: 有药王谷和盘丝洞的弟子在，真是不爽，还是跑路算了！ | T850: 药王谷和盘丝洞的弟子不在眼前，真是轻松愉快啊！ | U850: 0 | V850: 0,0; | W850: 1
A851: =R[-50]C+100 -> 10145 | B851: 白面狐狸 | C851: partner_1009 | D851: 0 | E851: 0 | F851: 1311,100;1313,100;1315,100;1312,100; | G851: 5201,100;5135,100;5110,100; | H851: 5763*1.5 | I851: 2153-500 | J851: 903 | K851: 673*0.5 | L851: 344*1.2 | M851: 1000*LV+100000 | N851: 0 | O851: math.max(0,(lv/10)-1) | P851: math.max(0,(lv/10)-1) | Q851: math.max(0,(lv/10)-1) | R851: 0; | S851: 有药王谷和盘丝洞的弟子在，真是不爽，还是跑路算了！ | T851: 药王谷和盘丝洞的弟子不在眼前，真是轻松愉快啊！ | U851: 0 | V851: 0,0; | W851: 4
A852: =R[-50]C+100 -> 10146 | B852: 毒仙子 | C852: partner_1005 | D852: 0 | E852: 0 | F852: 1211,100;1212,100;1216,100; | G852: 0,0; | H852: 5858*1.2*1.5 | I852: 2184*0.5-500 | J852: 919*1.2 | K852: 684*0.5 | L852: 347*1.5 | M852: 1000*LV+100000 | N852: 0 | O852: math.max(0,(lv/10)-1) | P852: math.max(0,(lv/10)-1) | Q852: math.max(0,(lv/10)-1) | R852: 0; | S852: 有药王谷和盘丝洞的弟子在，真是不爽，还是跑路算了！ | T852: 药王谷和盘丝洞的弟子不在眼前，真是轻松愉快啊！ | U852: 0 | V852: 0,0; | W852: 2
A853: =R[-50]C+100 -> 10147 | B853: 剑侠 | C853: pet_71 | D853: 0 | E853: 0 | F853: 1411,100;1413,100;1412,100;1416,100; | G853: 0,0; | H853: 5877*1.5 | I853: 2193*0.5-500 | J853: 922*0.8 | K853: 686*1.5 | L853: 348*0.8 | M853: 1000*LV+100000 | N853: 0 | O853: math.max(0,(lv/10)-1) | P853: math.max(0,(lv/10)-1) | Q853: math.max(0,(lv/10)-1) | R853: 0; | S853: 有药王谷和盘丝洞的弟子在，真是不爽，还是跑路算了！ | T853: 药王谷和盘丝洞的弟子不在眼前，真是轻松愉快啊！ | U853: 0 | V853: 0,0; | W853: 2
A854: =R[-50]C+100 -> 10148 | B854: 媚魔 | C854: pet_93 | D854: 0 | E854: 0 | F854: 1511,100;1512,100;1513,100;1514,100; | G854: 0,0; | H854: 5896*0.8*1.5 | I854: 2201*0.5-500 | J854: 924 | K854: 690 | L854: 350*2 | M854: 1000*LV+100000 | N854: 0 | O854: math.max(0,(lv/10)-1) | P854: math.max(0,(lv/10)-1) | Q854: math.max(0,(lv/10)-1) | R854: 0; | S854: 有药王谷和盘丝洞的弟子在，真是不爽，还是跑路算了！ | T854: 药王谷和盘丝洞的弟子不在眼前，真是轻松愉快啊！ | U854: 0 | V854: 0,0; | W854: 5
A855: =R[-50]C+100 -> 10149 | B855: 小小 | C855: partner_1002 | D855: 0 | E855: 0 | F855: 1311,100;1313,100;1315,100;1312,100; | G855: 5109,100;5110,100; | H855: 5909*1.5 | I855: 2210-500 | J855: 927 | K855: 693*0.5 | L855: 352*1.2 | M855: 1000*LV+100000 | N855: 0 | O855: math.max(0,(lv/10)-1) | P855: math.max(0,(lv/10)-1) | Q855: math.max(0,(lv/10)-1) | R855: 0; | S855: 有药王谷和盘丝洞的弟子在，真是不爽，还是跑路算了！ | T855: 药王谷和盘丝洞的弟子不在眼前，真是轻松愉快啊！ | U855: 0 | V855: 0,0; | W855: 4
A856: =R[-50]C+100 -> 10150 | B856: 卓一平 | C856: partner_1001 | D856: 0 | E856: 0 | F856: 1111,100;1112,100;1113,100;1114,100; | G856: 5203,100;5209,100;5133,100; | H856: 5935*1.5 | I856: 2219-500 | J856: 930 | K856: 697*0.5 | L856: 353*1.2 | M856: 1000*LV+100000 | N856: 0 | O856: math.max(0,(lv/10)-1) | P856: math.max(0,(lv/10)-1) | Q856: math.max(0,(lv/10)-1) | R856: 0; | S856: 有药王谷和盘丝洞的弟子在，真是不爽，还是跑路算了！ | T856: 药王谷和盘丝洞的弟子不在眼前，真是轻松愉快啊！ | U856: 0 | V856: 0,0; | W856: 1
A857: =R[-50]C+100 -> 10201 | B857: 水晶宫弟子 | C857: hero_1001 | D857: 0 | E857: 0 | F857: 1411,100;1412,100; | G857: 0,0; | H857: 9120*1.5 | I857: 2756*0.5-500 | J857: 1073*0.8 | K857: 764*1.5 | L857: 386*0.8 | M857: 1000*LV+100000 | N857: 0 | O857: math.max(0,(lv/10)-1) | P857: math.max(0,(lv/10)-1) | Q857: math.max(0,(lv/10)-1) | R857: 0; | S857: 有药王谷和盘丝洞的弟子在，真是不爽，还是跑路算了！ | T857: 药王谷和盘丝洞的弟子不在眼前，真是轻松愉快啊！ | U857: 0 | V857: 0,0; | W857: 2
A858: =R[-50]C+100 -> 10202 | B858: 天策府长老 | C858: hero_2001 | D858: 0 | E858: 0 | F858: 1111,100;1112,100; | G858: 0,0; | H858: 9146*1.5 | I858: 2766-500 | J858: 1076 | K858: 766*0.5 | L858: 388*1.2 | M858: 1000*LV+100000 | N858: 0 | O858: math.max(0,(lv/10)-1) | P858: math.max(0,(lv/10)-1) | Q858: math.max(0,(lv/10)-1) | R858: 0; | S858: 有药王谷和盘丝洞的弟子在，真是不爽，还是跑路算了！ | T858: 药王谷和盘丝洞的弟子不在眼前，真是轻松愉快啊！ | U858: 0 | V858: 0,0; | W858: 1
A859: =R[-50]C+100 -> 10203 | B859: 青鸟 | C859: partner_1006 | D859: 0 | E859: 0 | F859: 1411,100;1413,100;1412,100;1416,100; | G859: 0,0; | H859: 9171*1.5 | I859: 2776*0.5-500 | J859: 1079*0.8 | K859: 771*1.5 | L859: 389*0.8 | M859: 1000*LV+100000 | N859: 0 | O859: math.max(0,(lv/10)-1) | P859: math.max(0,(lv/10)-1) | Q859: math.max(0,(lv/10)-1) | R859: 0; | S859: 有药王谷和盘丝洞的弟子在，真是不爽，还是跑路算了！ | T859: 药王谷和盘丝洞的弟子不在眼前，真是轻松愉快啊！ | U859: 0 | V859: 0,0; | W859: 2
A860: =R[-50]C+100 -> 10204 | B860: 兽王御兽弟子 | C860: hero_1001 | D860: 0 | E860: 0 | F860: 1312,100;1315,100; | G860: 0,0; | H860: 6897*1.5 | I860: 2562-500 | J860: 1081 | K860: 774*0.5 | L860: 391*1.2 | M860: 1000*LV+100000 | N860: 0 | O860: math.max(0,(lv/10)-1) | P860: math.max(0,(lv/10)-1) | Q860: math.max(0,(lv/10)-1) | R860: 0; | S860: 有药王谷和盘丝洞的弟子在，真是不爽，还是跑路算了！ | T860: 药王谷和盘丝洞的弟子不在眼前，真是轻松愉快啊！ | U860: 0 | V860: 0,0; | W860: 4
A861: =R[-50]C+100 -> 10205 | B861: 铁扇公主 | C861: partner_1003 | D861: 0 | E861: 0 | F861: 1511,100;1512,100;1513,100;1514,100; | G861: 5216,100; | H861: 6916*0.8*1.5 | I861: 2571*0.5-500 | J861: 1084 | K861: 777 | L861: 392*2 | M861: 1000*LV+100000 | N861: 0 | O861: math.max(0,(lv/10)-1) | P861: math.max(0,(lv/10)-1) | Q861: math.max(0,(lv/10)-1) | R861: 0; | S861: 有药王谷和盘丝洞的弟子在，真是不爽，还是跑路算了！ | T861: 药王谷和盘丝洞的弟子不在眼前，真是轻松愉快啊！ | U861: 0 | V861: 0,0; | W861: 5
A862: =R[-50]C+100 -> 10206 | B862: 玄奘法师 | C862: partner_1007 | D862: 0 | E862: 0 | F862: 1411,100;1413,100;1412,100;1416,100; | G862: 0,0; | H862: 7044*1.5 | I862: 2611*0.5-500 | J862: 1105*0.8 | K862: 790*1.5 | L862: 396*0.8 | M862: 1000*LV+100000 | N862: 0 | O862: math.max(0,(lv/10)-1) | P862: math.max(0,(lv/10)-1) | Q862: math.max(0,(lv/10)-1) | R862: 0; | S862: 有药王谷和盘丝洞的弟子在，真是不爽，还是跑路算了！ | T862: 药王谷和盘丝洞的弟子不在眼前，真是轻松愉快啊！ | U862: 0 | V862: 0,0; | W862: 2
A863: =R[-50]C+100 -> 10207 | B863: 水晶宫御兽弟子 | C863: hero_2001 | D863: 0 | E863: 0 | F863: 1411,100;1413,100;1412,100;1416,100; | G863: 0,0; | H863: 7063*1.5 | I863: 2620*0.5-500 | J863: 1108*0.8 | K863: 792*1.5 | L863: 398*0.8 | M863: 1000*LV+100000 | N863: 0 | O863: math.max(0,(lv/10)-1) | P863: math.max(0,(lv/10)-1) | Q863: math.max(0,(lv/10)-1) | R863: 0; | S863: 有药王谷和盘丝洞的弟子在，真是不爽，还是跑路算了！ | T863: 药王谷和盘丝洞的弟子不在眼前，真是轻松愉快啊！ | U863: 0 | V863: 0,0; | W863: 2
A864: =R[-50]C+100 -> 10208 | B864: 赤天帝 | C864: partner_1012 | D864: 0 | E864: 0 | F864: 1411,100;1413,100;1412,100;1416,100; | G864: 0,0; | H864: 7082*1.5 | I864: 2629*0.5-500 | J864: 1110*0.8 | K864: 796*1.5 | L864: 400*0.8 | M864: 1000*LV+100000 | N864: 0 | O864: math.max(0,(lv/10)-1) | P864: math.max(0,(lv/10)-1) | Q864: math.max(0,(lv/10)-1) | R864: 0; | S864: 有药王谷和盘丝洞的弟子在，真是不爽，还是跑路算了！ | T864: 药王谷和盘丝洞的弟子不在眼前，真是轻松愉快啊！ | U864: 0 | V864: 0,0; | W864: 2
A865: =R[-50]C+100 -> 10209 | B865: 铁扇公主 | C865: partner_1003 | D865: 0 | E865: 0 | F865: 1511,100;1512,100;1513,100;1514,100; | G865: 0,0; | H865: 7095*0.8*1.5 | I865: 2638*0.5-500 | J865: 1113 | K865: 800 | L865: 401*2 | M865: 1000*LV+100000 | N865: 0 | O865: math.max(0,(lv/10)-1) | P865: math.max(0,(lv/10)-1) | Q865: math.max(0,(lv/10)-1) | R865: 0; | S865: 有药王谷和盘丝洞的弟子在，真是不爽，还是跑路算了！ | T865: 药王谷和盘丝洞的弟子不在眼前，真是轻松愉快啊！ | U865: 0 | V865: 0,0; | W865: 5
A866: =R[-50]C+100 -> 10210 | B866: 迦楼罗 | C866: pet_201 | D866: 0 | E866: 0 | F866: 1111,100;1112,100; | G866: 5209,100; | H866: 7120*1.5 | I866: 2647-500 | J866: 1116 | K866: 803*0.5 | L866: 403*1.2 | M866: 1000*LV+100000 | N866: 0 | O866: math.max(0,(lv/10)-1) | P866: math.max(0,(lv/10)-1) | Q866: math.max(0,(lv/10)-1) | R866: 0; | S866: 有药王谷和盘丝洞的弟子在，真是不爽，还是跑路算了！ | T866: 药王谷和盘丝洞的弟子不在眼前，真是轻松愉快啊！ | U866: 0 | V866: 0,0; | W866: 1
A867: =R[-50]C+100 -> 10211 | B867: 毒仙子 | C867: partner_1005 | D867: 0 | E867: 0 | F867: 1211,100;1212,100;1213,100; | G867: 0,0; | H867: 7713*1.2*1.5 | I867: 2843*0.5-500 | J867: 1210*1.2 | K867: 864*0.5 | L867: 433*1.5 | M867: 1000*LV+100000 | N867: 0 | O867: math.max(0,(lv/10)-1) | P867: math.max(0,(lv/10)-1) | Q867: math.max(0,(lv/10)-1) | R867: 0; | S867: 有药王谷和盘丝洞的弟子在，真是不爽，还是跑路算了！ | T867: 药王谷和盘丝洞的弟子不在眼前，真是轻松愉快啊！ | U867: 0 | V867: 0,0; | W867: 3
A868: =R[-50]C+100 -> 10212 | B868: 水晶宫长老 | C868: hero_1001 | D868: 0 | E868: 0 | F868: 1411,100;1412,100; | G868: 0,0; | H868: 7739*1.5 | I868: 2852*0.5-500 | J868: 1213*0.8 | K868: 866*1.5 | L868: 435*0.8 | M868: 1000*LV+100000 | N868: 0 | O868: math.max(0,(lv/10)-1) | P868: math.max(0,(lv/10)-1) | Q868: math.max(0,(lv/10)-1) | R868: 0; | S868: 有药王谷和盘丝洞的弟子在，真是不爽，还是跑路算了！ | T868: 药王谷和盘丝洞的弟子不在眼前，真是轻松愉快啊！ | U868: 0 | V868: 0,0; | W868: 2
A869: =R[-50]C+100 -> 10213 | B869: 道济和尚 | C869: partner_1008 | D869: 0 | E869: 0 | F869: 1411,100;1413,100;1412,100;1416,100; | G869: 0,0; | H869: 7752*1.5 | I869: 2861*0.5-500 | J869: 1216*0.8 | K869: 871*1.5 | L869: 436*0.8 | M869: 1000*LV+100000 | N869: 0 | O869: math.max(0,(lv/10)-1) | P869: math.max(0,(lv/10)-1) | Q869: math.max(0,(lv/10)-1) | R869: 0; | S869: 有药王谷和盘丝洞的弟子在，真是不爽，还是跑路算了！ | T869: 药王谷和盘丝洞的弟子不在眼前，真是轻松愉快啊！ | U869: 0 | V869: 0,0; | W869: 2
A870: =R[-50]C+100 -> 10214 | B870: 罗刹女 | C870: pet_61 | D870: 0 | E870: 0 | F870: 1312,100;1315,100;1311,100; | G870: 0,0; | H870: 7771*1.5 | I870: 2869-500 | J870: 1219 | K870: 874*0.5 | L870: 438*1.2 | M870: 1000*LV+100000 | N870: 0 | O870: math.max(0,(lv/10)-1) | P870: math.max(0,(lv/10)-1) | Q870: math.max(0,(lv/10)-1) | R870: 0; | S870: 有药王谷和盘丝洞的弟子在，真是不爽，还是跑路算了！ | T870: 药王谷和盘丝洞的弟子不在眼前，真是轻松愉快啊！ | U870: 0 | V870: 0,0; | W870: 4
A871: =R[-50]C+100 -> 10215 | B871: 兽王御兽弟子 | C871: hero_1001 | D871: 0 | E871: 0 | F871: 1312,100;1315,100;1311,100; | G871: 5201,100; | H871: 7790*1.5 | I871: 2879-500 | J871: 1222 | K871: 878*0.5 | L871: 440*1.2 | M871: 1000*LV+100000 | N871: 0 | O871: math.max(0,(lv/10)-1) | P871: math.max(0,(lv/10)-1) | Q871: math.max(0,(lv/10)-1) | R871: 0; | S871: 有药王谷和盘丝洞的弟子在，真是不爽，还是跑路算了！ | T871: 药王谷和盘丝洞的弟子不在眼前，真是轻松愉快啊！ | U871: 0 | V871: 0,0; | W871: 4
A872: =R[-50]C+100 -> 10216 | B872: 天璇仙子 | C872: pet_83 | D872: 0 | E872: 0 | F872: 1311,100;1312,100; | G872: 0,0; | H872: 7924*1.5 | I872: 2920-500 | J872: 1243 | K872: 891*0.5 | L872: 444*1.2 | M872: 1000*LV+100000 | N872: 0 | O872: math.max(0,(lv/10)-1) | P872: math.max(0,(lv/10)-1) | Q872: math.max(0,(lv/10)-1) | R872: 0; | S872: 有药王谷和盘丝洞的弟子在，真是不爽，还是跑路算了！ | T872: 药王谷和盘丝洞的弟子不在眼前，真是轻松愉快啊！ | U872: 0 | V872: 0,0; | W872: 4
A873: =R[-50]C+100 -> 10217 | B873: 水晶宫长老 | C873: hero_2001 | D873: 0 | E873: 0 | F873: 1411,100;1413,100;1412,100;1416,100; | G873: 0,0; | H873: 7943*1.5 | I873: 2929*0.5-500 | J873: 1246*0.8 | K873: 893*1.5 | L873: 446*0.8 | M873: 1000*LV+100000 | N873: 0 | O873: math.max(0,(lv/10)-1) | P873: math.max(0,(lv/10)-1) | Q873: math.max(0,(lv/10)-1) | R873: 0; | S873: 有药王谷和盘丝洞的弟子在，真是不爽，还是跑路算了！ | T873: 药王谷和盘丝洞的弟子不在眼前，真是轻松愉快啊！ | U873: 0 | V873: 0,0; | W873: 2
A874: =R[-50]C+100 -> 10218 | B874: 青鸟 | C874: partner_1006 | D874: 0 | E874: 0 | F874: 1411,100;1413,100;1412,100;1416,100; | G874: 0,0; | H874: 7962*1.5 | I874: 2938*0.5-500 | J874: 1249*0.8 | K874: 898*1.5 | L874: 448*0.8 | M874: 1000*LV+100000 | N874: 0 | O874: math.max(0,(lv/10)-1) | P874: math.max(0,(lv/10)-1) | Q874: math.max(0,(lv/10)-1) | R874: 0; | S874: 有药王谷和盘丝洞的弟子在，真是不爽，还是跑路算了！ | T874: 药王谷和盘丝洞的弟子不在眼前，真是轻松愉快啊！ | U874: 0 | V874: 0,0; | W874: 2
A875: =R[-50]C+100 -> 10219 | B875: 大鹏鸟 | C875: pet_72 | D875: 0 | E875: 0 | F875: 1311,100;1313,100;1315,100;1312,100; | G875: 5135,100; | H875: 7981*1.5 | I875: 2947-500 | J875: 1251 | K875: 901*0.5 | L875: 449*1.2 | M875: 1000*LV+100000 | N875: 0 | O875: math.max(0,(lv/10)-1) | P875: math.max(0,(lv/10)-1) | Q875: math.max(0,(lv/10)-1) | R875: 0; | S875: 有药王谷和盘丝洞的弟子在，真是不爽，还是跑路算了！ | T875: 药王谷和盘丝洞的弟子不在眼前，真是轻松愉快啊！ | U875: 0 | V875: 0,0; | W875: 4
A876: =R[-50]C+100 -> 10220 | B876: 白面狐狸 | C876: partner_1009 | D876: 0 | E876: 0 | F876: 1311,100;1313,100;1315,100;1312,100; | G876: 5135,100;5105,100; | H876: 8000*1.5 | I876: 2957-500 | J876: 1255 | K876: 905*0.5 | L876: 451*1.2 | M876: 1000*LV+100000 | N876: 0 | O876: math.max(0,(lv/10)-1) | P876: math.max(0,(lv/10)-1) | Q876: math.max(0,(lv/10)-1) | R876: 0; | S876: 有药王谷和盘丝洞的弟子在，真是不爽，还是跑路算了！ | T876: 药王谷和盘丝洞的弟子不在眼前，真是轻松愉快啊！ | U876: 0 | V876: 0,0; | W876: 4
A877: =R[-50]C+100 -> 10221 | B877: 罗刹女 | C877: pet_61 | D877: 0 | E877: 0 | F877: 1111,100;1112,100; | G877: 0,0; | H877: 7593*1.5 | I877: 3052-500 | J877: 1339 | K877: 956*0.5 | L877: 476*1.2 | M877: 1000*LV+100000 | N877: 0 | O877: math.max(0,(lv/10)-1) | P877: math.max(0,(lv/10)-1) | Q877: math.max(0,(lv/10)-1) | R877: 0; | S877: 有药王谷和盘丝洞的弟子在，真是不爽，还是跑路算了！ | T877: 药王谷和盘丝洞的弟子不在眼前，真是轻松愉快啊！ | U877: 0 | V877: 0,0; | W877: 1
A878: =R[-50]C+100 -> 10222 | B878: 烈焰悟空 | C878: pet_73 | D878: 0 | E878: 0 | F878: 1311,50;1312,50; | G878: 0,0; | H878: 7610*1.5 | I878: 3062-500 | J878: 1343 | K878: 959*0.5 | L878: 478*1.2 | M878: 1000*LV+100000 | N878: 0 | O878: math.max(0,(lv/10)-1) | P878: math.max(0,(lv/10)-1) | Q878: math.max(0,(lv/10)-1) | R878: 0; | S878: 有药王谷和盘丝洞的弟子在，真是不爽，还是跑路算了！ | T878: 药王谷和盘丝洞的弟子不在眼前，真是轻松愉快啊！ | U878: 0 | V878: 0,0; | W878: 4
A879: =R[-50]C+100 -> 10223 | B879: 剑侠 | C879: pet_71 | D879: 0 | E879: 0 | F879: 1111,40;1112,40;1116,20; | G879: 0,0; | H879: 7627*1.5 | I879: 3070-500 | J879: 1345 | K879: 963*0.5 | L879: 480*1.2 | M879: 1000*LV+100000 | N879: 0 | O879: math.max(0,(lv/10)-1) | P879: math.max(0,(lv/10)-1) | Q879: math.max(0,(lv/10)-1) | R879: 0; | S879: 有药王谷和盘丝洞的弟子在，真是不爽，还是跑路算了！ | T879: 药王谷和盘丝洞的弟子不在眼前，真是轻松愉快啊！ | U879: 0 | V879: 0,0; | W879: 1
A880: =R[-50]C+100 -> 10224 | B880: 媚魔 | C880: pet_93 | D880: 0 | E880: 0 | F880: 1511,100;1512,100;1513,100;1514,100; | G880: 5132,100; | H880: 7644*0.8*1.5 | I880: 3079*0.5-500 | J880: 1348 | K880: 967 | L880: 481*2 | M880: 1000*LV+100000 | N880: 0 | O880: math.max(0,(lv/10)-1) | P880: math.max(0,(lv/10)-1) | Q880: math.max(0,(lv/10)-1) | R880: 0; | S880: 有药王谷和盘丝洞的弟子在，真是不爽，还是跑路算了！ | T880: 药王谷和盘丝洞的弟子不在眼前，真是轻松愉快啊！ | U880: 0 | V880: 0,0; | W880: 5
A881: =R[-50]C+100 -> 10225 | B881: 小小 | C881: partner_1002 | D881: 0 | E881: 0 | F881: 1311,100;1313,100;1315,100;1312,100; | G881: 5103,100;5133,100; | H881: 7661*1.5 | I881: 3087-500 | J881: 1352 | K881: 971*0.5 | L881: 483*1.2 | M881: 1000*LV+100000 | N881: 0 | O881: math.max(0,(lv/10)-1) | P881: math.max(0,(lv/10)-1) | Q881: math.max(0,(lv/10)-1) | R881: 0; | S881: 有药王谷和盘丝洞的弟子在，真是不爽，还是跑路算了！ | T881: 药王谷和盘丝洞的弟子不在眼前，真是轻松愉快啊！ | U881: 0 | V881: 0,0; | W881: 4
A882: =R[-50]C+100 -> 10226 | B882: 太阳神 | C882: partner_1011 | D882: 0 | E882: 0 | F882: 1211,100;1212,100;1213,100; | G882: 0,0; | H882: 7729*1.2*1.5 | I882: 3113*0.5-500 | J882: 1363*1.2 | K882: 979*0.5 | L882: 486*1.5 | M882: 1000*LV+100000 | N882: 0 | O882: math.max(0,(lv/10)-1) | P882: math.max(0,(lv/10)-1) | Q882: math.max(0,(lv/10)-1) | R882: 0; | S882: 有药王谷和盘丝洞的弟子在，真是不爽，还是跑路算了！ | T882: 药王谷和盘丝洞的弟子不在眼前，真是轻松愉快啊！ | U882: 0 | V882: 0,0; | W882: 3
A883: =R[-50]C+100 -> 10227 | B883: 道济和尚 | C883: partner_1008 | D883: 0 | E883: 0 | F883: 1411,100;1413,100;1412,100;1416,100; | G883: 0,0; | H883: 7746*1.5 | I883: 3121*0.5-500 | J883: 1366*0.8 | K883: 982*1.5 | L883: 488*0.8 | M883: 1000*LV+100000 | N883: 0 | O883: math.max(0,(lv/10)-1) | P883: math.max(0,(lv/10)-1) | Q883: math.max(0,(lv/10)-1) | R883: 0; | S883: 有药王谷和盘丝洞的弟子在，真是不爽，还是跑路算了！ | T883: 药王谷和盘丝洞的弟子不在眼前，真是轻松愉快啊！ | U883: 0 | V883: 0,0; | W883: 2
A884: =R[-50]C+100 -> 10228 | B884: 织梦花妖 | C884: pet_42 | D884: 0 | E884: 0 | F884: 1411,100;1413,100;1412,100;1416,100; | G884: 0,0; | H884: 7763*1.5 | I884: 3130*0.5-500 | J884: 1369*0.8 | K884: 986*1.5 | L884: 489*0.8 | M884: 1000*LV+100000 | N884: 0 | O884: math.max(0,(lv/10)-1) | P884: math.max(0,(lv/10)-1) | Q884: math.max(0,(lv/10)-1) | R884: 0; | S884: 有药王谷和盘丝洞的弟子在，真是不爽，还是跑路算了！ | T884: 药王谷和盘丝洞的弟子不在眼前，真是轻松愉快啊！ | U884: 0 | V884: 0,0; | W884: 2
A885: =R[-50]C+100 -> 10229 | B885: 天剑府弟子 | C885: hero_1001 | D885: 0 | E885: 0 | F885: 1111,100;1112,100; | G885: 5127,100; | H885: 7780*1.5 | I885: 3138-500 | J885: 1372 | K885: 990*0.5 | L885: 491*1.2 | M885: 1000*LV+100000 | N885: 0 | O885: math.max(0,(lv/10)-1) | P885: math.max(0,(lv/10)-1) | Q885: math.max(0,(lv/10)-1) | R885: 0; | S885: 有药王谷和盘丝洞的弟子在，真是不爽，还是跑路算了！ | T885: 药王谷和盘丝洞的弟子不在眼前，真是轻松愉快啊！ | U885: 0 | V885: 0,0; | W885: 1
A886: =R[-50]C+100 -> 10230 | B886: 天师道人 | C886: pet_22 | D886: 0 | E886: 0 | F886: 1511,100;1512,100;1513,100; | G886: 5132,100;5126,100; | H886: 7797*0.8*1.5 | I886: 3148*0.5-500 | J886: 1375 | K886: 993 | L886: 492*2 | M886: 1000*LV+100000 | N886: 0 | O886: math.max(0,(lv/10)-1) | P886: math.max(0,(lv/10)-1) | Q886: math.max(0,(lv/10)-1) | R886: 0; | S886: 有药王谷和盘丝洞的弟子在，真是不爽，还是跑路算了！ | T886: 药王谷和盘丝洞的弟子不在眼前，真是轻松愉快啊！ | U886: 0 | V886: 0,0; | W886: 5
A887: =R[-50]C+100 -> 10231 | B887: 女魃 | C887: pet_53 | D887: 0 | E887: 0 | F887: 1111,100;1112,100;1116,100; | G887: 0,0; | H887: 8290*1.5 | I887: 3329-500 | J887: 1462 | K887: 1047*0.5 | L887: 518*1.2 | M887: 1000*LV+100000 | N887: 0 | O887: math.max(0,(lv/10)-1) | P887: math.max(0,(lv/10)-1) | Q887: math.max(0,(lv/10)-1) | R887: 0; | S887: 有药王谷和盘丝洞的弟子在，真是不爽，还是跑路算了！ | T887: 药王谷和盘丝洞的弟子不在眼前，真是轻松愉快啊！ | U887: 0 | V887: 0,0; | W887: 1
A888: =R[-50]C+100 -> 10232 | B888: 兽王御兽弟子 | C888: hero_1001 | D888: 0 | E888: 0 | F888: 1312,100;1315,100; | G888: 0,0; | H888: 8307*1.5 | I888: 3338-500 | J888: 1466 | K888: 1050*0.5 | L888: 520*1.2 | M888: 1000*LV+100000 | N888: 0 | O888: math.max(0,(lv/10)-1) | P888: math.max(0,(lv/10)-1) | Q888: math.max(0,(lv/10)-1) | R888: 0; | S888: 有药王谷和盘丝洞的弟子在，真是不爽，还是跑路算了！ | T888: 药王谷和盘丝洞的弟子不在眼前，真是轻松愉快啊！ | U888: 0 | V888: 0,0; | W888: 4
A889: =R[-50]C+100 -> 10233 | B889: 九天玄女 | C889: partner_1010 | D889: 0 | E889: 0 | F889: 1411,100;1413,100;1412,100;1416,100; | G889: 0,0; | H889: 8324*1.5 | I889: 3348*0.5-500 | J889: 1469*0.8 | K889: 1054*1.5 | L889: 521*0.8 | M889: 1000*LV+100000 | N889: 0 | O889: math.max(0,(lv/10)-1) | P889: math.max(0,(lv/10)-1) | Q889: math.max(0,(lv/10)-1) | R889: 0; | S889: 有药王谷和盘丝洞的弟子在，真是不爽，还是跑路算了！ | T889: 药王谷和盘丝洞的弟子不在眼前，真是轻松愉快啊！ | U889: 0 | V889: 0,0; | W889: 2
A890: =R[-50]C+100 -> 10234 | B890: 魔教精英 | C890: pet_61 | D890: 0 | E890: 0 | F890: 1312,100;1315,100;1311,100; | G890: 5123,100; | H890: 8341*1.5 | I890: 3356-500 | J890: 1472 | K890: 1058*0.5 | L890: 523*1.2 | M890: 1000*LV+100000 | N890: 0 | O890: math.max(0,(lv/10)-1) | P890: math.max(0,(lv/10)-1) | Q890: math.max(0,(lv/10)-1) | R890: 0; | S890: 有药王谷和盘丝洞的弟子在，真是不爽，还是跑路算了！ | T890: 药王谷和盘丝洞的弟子不在眼前，真是轻松愉快啊！ | U890: 0 | V890: 0,0; | W890: 4
A891: =R[-50]C+100 -> 10235 | B891: 插翅虎 | C891: pet_63 | D891: 0 | E891: 0 | F891: 1311,100;1313,100;1315,100;1312,100; | G891: 5117,100;5103,100; | H891: 8364*1.5 | I891: 3365-500 | J891: 1475 | K891: 1062*0.5 | L891: 524*1.2 | M891: 1000*LV+100000 | N891: 0 | O891: math.max(0,(lv/10)-1) | P891: math.max(0,(lv/10)-1) | Q891: math.max(0,(lv/10)-1) | R891: 0; | S891: 有药王谷和盘丝洞的弟子在，真是不爽，还是跑路算了！ | T891: 药王谷和盘丝洞的弟子不在眼前，真是轻松愉快啊！ | U891: 0 | V891: 0,0; | W891: 4
A892: =R[-50]C+100 -> 10236 | B892: 青鸟 | C892: partner_1006 | D892: 0 | E892: 0 | F892: 1411,100;1413,100;1412,100;1416,100; | G892: 0,0; | H892: 8437*1.5 | I892: 3392*0.5-500 | J892: 1488*0.8 | K892: 1071*1.5 | L892: 528*0.8 | M892: 1000*LV+100000 | N892: 0 | O892: math.max(0,(lv/10)-1) | P892: math.max(0,(lv/10)-1) | Q892: math.max(0,(lv/10)-1) | R892: 0; | S892: 有药王谷和盘丝洞的弟子在，真是不爽，还是跑路算了！ | T892: 药王谷和盘丝洞的弟子不在眼前，真是轻松愉快啊！ | U892: 0 | V892: 0,0; | W892: 2
A893: =R[-50]C+100 -> 10237 | B893: 虎傀儡 | C893: pet_102 | D893: 0 | E893: 0 | F893: 1312,100;1315,100; | G893: 0,0; | H893: 8454*1.5 | I893: 3400-500 | J893: 1491 | K893: 1074*0.5 | L893: 529*1.2 | M893: 1000*LV+100000 | N893: 0 | O893: math.max(0,(lv/10)-1) | P893: math.max(0,(lv/10)-1) | Q893: math.max(0,(lv/10)-1) | R893: 0; | S893: 有药王谷和盘丝洞的弟子在，真是不爽，还是跑路算了！ | T893: 药王谷和盘丝洞的弟子不在眼前，真是轻松愉快啊！ | U893: 0 | V893: 0,0; | W893: 4
A894: =R[-50]C+100 -> 10238 | B894: 青鸟 | C894: partner_1006 | D894: 0 | E894: 0 | F894: 1411,100;1413,100;1412,100;1416,100; | G894: 0,0; | H894: 8471*1.5 | I894: 3409*0.5-500 | J894: 1494*0.8 | K894: 1079*1.5 | L894: 531*0.8 | M894: 1000*LV+100000 | N894: 0 | O894: math.max(0,(lv/10)-1) | P894: math.max(0,(lv/10)-1) | Q894: math.max(0,(lv/10)-1) | R894: 0; | S894: 有药王谷和盘丝洞的弟子在，真是不爽，还是跑路算了！ | T894: 药王谷和盘丝洞的弟子不在眼前，真是轻松愉快啊！ | U894: 0 | V894: 0,0; | W894: 2
A895: =R[-50]C+100 -> 10239 | B895: 小小 | C895: partner_1002 | D895: 0 | E895: 0 | F895: 1311,100;1313,100;1315,100;1312,100; | G895: 5123,100;5103,100; | H895: 8488*1.5 | I895: 3418-500 | J895: 1497 | K895: 1082*0.5 | L895: 532*1.2 | M895: 1000*LV+100000 | N895: 0 | O895: math.max(0,(lv/10)-1) | P895: math.max(0,(lv/10)-1) | Q895: math.max(0,(lv/10)-1) | R895: 0; | S895: 有药王谷和盘丝洞的弟子在，真是不爽，还是跑路算了！ | T895: 药王谷和盘丝洞的弟子不在眼前，真是轻松愉快啊！ | U895: 0 | V895: 0,0; | W895: 4
A896: =R[-50]C+100 -> 10240 | B896: 铁扇公主 | C896: partner_1003 | D896: 0 | E896: 0 | F896: 1511,100;1512,100;1513,100;1514,100; | G896: 5232,100;5126,100;5116,100; | H896: 8505*0.8*1.5 | I896: 3427*0.5-500 | J896: 1501 | K896: 1086 | L896: 534*2 | M896: 1000*LV+100000 | N896: 0 | O896: math.max(0,(lv/10)-1) | P896: math.max(0,(lv/10)-1) | Q896: math.max(0,(lv/10)-1) | R896: 0; | S896: 有药王谷和盘丝洞的弟子在，真是不爽，还是跑路算了！ | T896: 药王谷和盘丝洞的弟子不在眼前，真是轻松愉快啊！ | U896: 0 | V896: 0,0; | W896: 5
A897: =R[-50]C+100 -> 10241 | B897: 太阳神 | C897: partner_1011 | D897: 0 | E897: 0 | F897: 1211,100;1212,100;1213,100; | G897: 0,0; | H897: 8175*1.2*1.5 | I897: 3549*0.5-500 | J897: 1603*1.2 | K897: 1148*0.5 | L897: 562*1.5 | M897: 1000*LV+100000 | N897: 0 | O897: math.max(0,(lv/10)-1) | P897: math.max(0,(lv/10)-1) | Q897: math.max(0,(lv/10)-1) | R897: 0; | S897: 有药王谷和盘丝洞的弟子在，真是不爽，还是跑路算了！ | T897: 药王谷和盘丝洞的弟子不在眼前，真是轻松愉快啊！ | U897: 0 | V897: 0,0; | W897: 3
A898: =R[-50]C+100 -> 10242 | B898: 九天玄女 | C898: partner_1010 | D898: 0 | E898: 0 | F898: 1411,100;1413,100;1412,100;1416,100; | G898: 0,0; | H898: 8195*1.5 | I898: 3558*0.5-500 | J898: 1606*0.8 | K898: 1152*1.5 | L898: 564*0.8 | M898: 1000*LV+100000 | N898: 0 | O898: math.max(0,(lv/10)-1) | P898: math.max(0,(lv/10)-1) | Q898: math.max(0,(lv/10)-1) | R898: 0; | S898: 有药王谷和盘丝洞的弟子在，真是不爽，还是跑路算了！ | T898: 药王谷和盘丝洞的弟子不在眼前，真是轻松愉快啊！ | U898: 0 | V898: 0,0; | W898: 2
A899: =R[-50]C+100 -> 10243 | B899: 女魃 | C899: pet_53 | D899: 0 | E899: 0 | F899: 1411,100;1412,100; | G899: 0,0; | H899: 8211*1.5 | I899: 3567*0.5-500 | J899: 1609*0.8 | K899: 1156*1.5 | L899: 565*0.8 | M899: 1000*LV+100000 | N899: 0 | O899: math.max(0,(lv/10)-1) | P899: math.max(0,(lv/10)-1) | Q899: math.max(0,(lv/10)-1) | R899: 0; | S899: 有药王谷和盘丝洞的弟子在，真是不爽，还是跑路算了！ | T899: 药王谷和盘丝洞的弟子不在眼前，真是轻松愉快啊！ | U899: 0 | V899: 0,0; | W899: 2
A900: =R[-50]C+100 -> 10244 | B900: 天剑府弟子 | C900: hero_1001 | D900: 0 | E900: 0 | F900: 1111,100;1112,100; | G900: 5109,100;5110,100; | H900: 8226*1.5 | I900: 3575-500 | J900: 1612 | K900: 1160*0.5 | L900: 567*1.2 | M900: 1000*LV+100000 | N900: 0 | O900: math.max(0,(lv/10)-1) | P900: math.max(0,(lv/10)-1) | Q900: math.max(0,(lv/10)-1) | R900: 0; | S900: 有药王谷和盘丝洞的弟子在，真是不爽，还是跑路算了！ | T900: 药王谷和盘丝洞的弟子不在眼前，真是轻松愉快啊！ | U900: 0 | V900: 0,0; | W900: 1
A901: =R[-50]C+100 -> 10245 | B901: 白面狐狸 | C901: partner_1009 | D901: 0 | E901: 0 | F901: 1311,100;1313,100;1315,100;1312,100; | G901: 5201,100;5135,100;5110,100; | H901: 8241*1.5 | I901: 3584-500 | J901: 1616 | K901: 1163*0.5 | L901: 568*1.2 | M901: 1000*LV+100000 | N901: 0 | O901: math.max(0,(lv/10)-1) | P901: math.max(0,(lv/10)-1) | Q901: math.max(0,(lv/10)-1) | R901: 0; | S901: 有药王谷和盘丝洞的弟子在，真是不爽，还是跑路算了！ | T901: 药王谷和盘丝洞的弟子不在眼前，真是轻松愉快啊！ | U901: 0 | V901: 0,0; | W901: 4
A902: =R[-50]C+100 -> 10246 | B902: 毒仙子 | C902: partner_1005 | D902: 0 | E902: 0 | F902: 1211,100;1212,100;1216,100; | G902: 0,0; | H902: 8262*1.2*1.5 | I902: 3592*0.5-500 | J902: 1619*1.2 | K902: 1168*0.5 | L902: 570*1.5 | M902: 1000*LV+100000 | N902: 0 | O902: math.max(0,(lv/10)-1) | P902: math.max(0,(lv/10)-1) | Q902: math.max(0,(lv/10)-1) | R902: 0; | S902: 有药王谷和盘丝洞的弟子在，真是不爽，还是跑路算了！ | T902: 药王谷和盘丝洞的弟子不在眼前，真是轻松愉快啊！ | U902: 0 | V902: 0,0; | W902: 2
A903: =R[-50]C+100 -> 10247 | B903: 剑侠 | C903: pet_71 | D903: 0 | E903: 0 | F903: 1411,100;1413,100;1412,100;1416,100; | G903: 0,0; | H903: 8277*1.5 | I903: 3601*0.5-500 | J903: 1623*0.8 | K903: 1170*1.5 | L903: 572*0.8 | M903: 1000*LV+100000 | N903: 0 | O903: math.max(0,(lv/10)-1) | P903: math.max(0,(lv/10)-1) | Q903: math.max(0,(lv/10)-1) | R903: 0; | S903: 有药王谷和盘丝洞的弟子在，真是不爽，还是跑路算了！ | T903: 药王谷和盘丝洞的弟子不在眼前，真是轻松愉快啊！ | U903: 0 | V903: 0,0; | W903: 2
A904: =R[-50]C+100 -> 10248 | B904: 媚魔 | C904: pet_93 | D904: 0 | E904: 0 | F904: 1511,100;1512,100;1513,100;1514,100; | G904: 0,0; | H904: 8292*0.8*1.5 | I904: 3610*0.5-500 | J904: 1626 | K904: 1175 | L904: 573*2 | M904: 1000*LV+100000 | N904: 0 | O904: math.max(0,(lv/10)-1) | P904: math.max(0,(lv/10)-1) | Q904: math.max(0,(lv/10)-1) | R904: 0; | S904: 有药王谷和盘丝洞的弟子在，真是不爽，还是跑路算了！ | T904: 药王谷和盘丝洞的弟子不在眼前，真是轻松愉快啊！ | U904: 0 | V904: 0,0; | W904: 5
A905: =R[-50]C+100 -> 10249 | B905: 小小 | C905: partner_1002 | D905: 0 | E905: 0 | F905: 1311,100;1313,100;1315,100;1312,100; | G905: 5109,100;5110,100; | H905: 8307*1.5 | I905: 3618-500 | J905: 1629 | K905: 1179*0.5 | L905: 575*1.2 | M905: 1000*LV+100000 | N905: 0 | O905: math.max(0,(lv/10)-1) | P905: math.max(0,(lv/10)-1) | Q905: math.max(0,(lv/10)-1) | R905: 0; | S905: 有药王谷和盘丝洞的弟子在，真是不爽，还是跑路算了！ | T905: 药王谷和盘丝洞的弟子不在眼前，真是轻松愉快啊！ | U905: 0 | V905: 0,0; | W905: 4
A906: =R[-50]C+100 -> 10250 | B906: 卓一平 | C906: partner_1001 | D906: 0 | E906: 0 | F906: 1111,100;1112,100;1113,100;1114,100; | G906: 5203,100;5209,100;5133,100; | H906: 8328*1.5 | I906: 3627-500 | J906: 1632 | K906: 1182*0.5 | L906: 576*1.2 | M906: 1000*LV+100000 | N906: 0 | O906: math.max(0,(lv/10)-1) | P906: math.max(0,(lv/10)-1) | Q906: math.max(0,(lv/10)-1) | R906: 0; | S906: 有药王谷和盘丝洞的弟子在，真是不爽，还是跑路算了！ | T906: 药王谷和盘丝洞的弟子不在眼前，真是轻松愉快啊！ | U906: 0 | V906: 0,0; | W906: 1
A907: 11011 | B907: 天策府弟子 | C907: hero_1001 | D907: 0 | E907: 0 | F907: 1112,100;1111,100; | G907: 0,0; | H907: 2403*0.5 | I907: 676*0.5 | J907: 266*0.5 | K907: 192*0.5*0.5 | L907: 95*1.2*0.5 | M907: 1000*LV+100000 | N907: 0 | O907: math.max(0,(lv/10)-1) | P907: math.max(0,(lv/10)-1) | Q907: math.max(0,(lv/10)-1) | R907: 0; | S907: 有药王谷和盘丝洞的弟子在，真是不爽，还是跑路算了！ | T907: 药王谷和盘丝洞的弟子不在眼前，真是轻松愉快啊！ | U907: 0 | V907: 0,0; | W907: 1
A908: 11021 | B908: 天策府弟子 | C908: hero_1001 | D908: 0 | E908: 0 | F908: 1112,100;1111,100; | G908: 0,0; | H908: 2421*0.6 | I908: 685*0.6 | J908: 269*0.6 | K908: 195*0.5*0.6 | L908: 96*1.2*0.6 | M908: 1000*LV+100000 | N908: 0 | O908: math.max(0,(lv/10)-1) | P908: math.max(0,(lv/10)-1) | Q908: math.max(0,(lv/10)-1) | R908: 0; | S908: 有药王谷和盘丝洞的弟子在，真是不爽，还是跑路算了！ | T908: 药王谷和盘丝洞的弟子不在眼前，真是轻松愉快啊！ | U908: 0 | V908: 0,0; | W908: 1
A909: 11031 | B909: 蛤蟆精 | C909: pet_3 | D909: 0 | E909: 0 | F909: 0,0; | G909: 5123,100;5225,100;5104,100;5202,100; | H909: 2448*0.8 | I909: 693*0.8 | J909: 271*0.8 | K909: 198*0.5*0.8 | L909: 98*1.2*0.8 | M909: 1000*LV+100000 | N909: 0 | O909: math.max(0,(lv/10)-1) | P909: math.max(0,(lv/10)-1) | Q909: math.max(0,(lv/10)-1) | R909: 0; | S909: 有药王谷和盘丝洞的弟子在，真是不爽，还是跑路算了！ | T909: 药王谷和盘丝洞的弟子不在眼前，真是轻松愉快啊！ | U909: 0 | V909: 0,0; | W909: 2
A910: 11032 | B910: 蛤蟆精 | C910: pet_3 | D910: 0 | E910: 0 | F910: 0,0; | G910: 5123,100;5225,100;5104,100;5202,100; | H910: 2448*0.8 | I910: 693*0.8 | J910: 271*0.8 | K910: 198*0.5*0.8 | L910: 98*1.2*0.8 | M910: 1000*LV+100000 | N910: 0 | O910: math.max(0,(lv/10)-1) | P910: math.max(0,(lv/10)-1) | Q910: math.max(0,(lv/10)-1) | R910: 0; | S910: 有药王谷和盘丝洞的弟子在，真是不爽，还是跑路算了！ | T910: 药王谷和盘丝洞的弟子不在眼前，真是轻松愉快啊！ | U910: 0 | V910: 0,0; | W910: 1
A911: 11041 | B911: 熊猫武师 | C911: pet_13 | D911: 0 | E911: 0 | F911: 1311,100;1315,100;1312,100; | G911: 5138,100; | H911: 1479*0.9 | I911: 603*0.9 | J911: 273*0.9 | K911: 202*0.5*0.9 | L911: 100*1.2*0.9 | M911: 1000*LV+100000 | N911: 0 | O911: math.max(0,(lv/10)-1) | P911: math.max(0,(lv/10)-1) | Q911: math.max(0,(lv/10)-1) | R911: 0; | S911: 有药王谷和盘丝洞的弟子在，真是不爽，还是跑路算了！ | T911: 药王谷和盘丝洞的弟子不在眼前，真是轻松愉快啊！ | U911: 0 | V911: 0,0; | W911: 4
A912: 11042 | B912: 帮凶 | C912: pet_43 | D912: 0 | E912: 0 | F912: 1112,100;1111,100; | G912: 5101,100; | H912: 1479*0.9 | I912: 603*0.9 | J912: 273*0.9 | K912: 202*0.5*0.9 | L912: 100*1.2*0.9 | M912: 1000*LV+100000 | N912: 0 | O912: math.max(0,(lv/10)-1) | P912: math.max(0,(lv/10)-1) | Q912: math.max(0,(lv/10)-1) | R912: 0; | S912: 有药王谷和盘丝洞的弟子在，真是不爽，还是跑路算了！ | T912: 药王谷和盘丝洞的弟子不在眼前，真是轻松愉快啊！ | U912: 0 | V912: 0,0; | W912: 1
A913: 11051 | B913: 仙鹤童子 | C913: pet_33 | D913: 0 | E913: 0 | F913: 1212,100;1211,100; | G913: 5138,100; | H913: 1490*1.2 | I913: 609*0.5 | J913: 276*1.2 | K913: 205*0.5 | L913: 101*1.5 | M913: 1000*LV+100000 | N913: 0 | O913: math.max(0,(lv/5)-1) | P913: math.max(0,(lv/5)-1) | Q913: math.max(0,(lv/5)-1) | R913: 0; | S913: 有药王谷和盘丝洞的弟子在，真是不爽，还是跑路算了！ | T913: 药王谷和盘丝洞的弟子不在眼前，真是轻松愉快啊！ | U913: 0 | V913: 0,0; | W913: 3
A914: 11052 | B914: 熊猫武师 | C914: pet_13 | D914: 0 | E914: 0 | F914: 1311,100;1315,100;1312,100; | G914: 5121,100; | H914: 1490 | I914: 609 | J914: 276 | K914: 205*0.5 | L914: 101*1.2 | M914: 1000*LV+100000 | N914: 0 | O914: math.max(0,(lv/5)-1) | P914: math.max(0,(lv/5)-1) | Q914: math.max(0,(lv/5)-1) | R914: 0; | S914: 有药王谷和盘丝洞的弟子在，真是不爽，还是跑路算了！ | T914: 药王谷和盘丝洞的弟子不在眼前，真是轻松愉快啊！ | U914: 0 | V914: 0,0; | W914: 4
A915: 11053 | B915: 帮凶 | C915: pet_43 | D915: 0 | E915: 0 | F915: 1112,100;1111,100; | G915: 5101,100; | H915: 1490 | I915: 609 | J915: 276 | K915: 205*0.5 | L915: 101*1.2 | M915: 1000*LV+100000 | N915: 0 | O915: math.max(0,(lv/5)-1) | P915: math.max(0,(lv/5)-1) | Q915: math.max(0,(lv/5)-1) | R915: 0; | S915: 有药王谷和盘丝洞的弟子在，真是不爽，还是跑路算了！ | T915: 药王谷和盘丝洞的弟子不在眼前，真是轻松愉快啊！ | U915: 0 | V915: 0,0; | W915: 1
A916: 11061 | B916: 水晶宫弟子 | C916: hero_1001 | D916: 0 | E916: 0 | F916: 1411,100;1412,100; | G916: 0,0; | H916: 1533 | I916: 628*0.5 | J916: 284*0.8 | K916: 211*1.5 | L916: 104*0.8 | M916: 1000*LV+100000 | N916: 0 | O916: math.max(0,(lv/10)-1) | P916: math.max(0,(lv/10)-1) | Q916: math.max(0,(lv/10)-1) | R916: 0; | S916: 有药王谷和盘丝洞的弟子在，真是不爽，还是跑路算了！ | T916: 药王谷和盘丝洞的弟子不在眼前，真是轻松愉快啊！ | U916: 0 | V916: 0,0; | W916: 2
A917: 11062 | B917: 水晶宫外门弟子 | C917: hero_2001 | D917: 0 | E917: 0 | F917: 5309,100; | G917: 5103,100; | H917: 1533 | I917: 628 | J917: 284 | K917: 211*0.5 | L917: 104*1.2 | M917: 1000*LV+100000 | N917: 0 | O917: math.max(0,(lv/10)-1) | P917: math.max(0,(lv/10)-1) | Q917: math.max(0,(lv/10)-1) | R917: 0; | S917: 有药王谷和盘丝洞的弟子在，真是不爽，还是跑路算了！ | T917: 药王谷和盘丝洞的弟子不在眼前，真是轻松愉快啊！ | U917: 0 | V917: 0,0; | W917: 5
A918: 11071 | B918: 阴阳师 | C918: pet_52 | D918: 0 | E918: 0 | F918: 1411,100;1412,100; | G918: 0,0; | H918: 1549 | I918: 634*0.5 | J918: 286*0.8 | K918: 213*1.5 | L918: 105*0.8 | M918: 1000*LV+100000 | N918: 0 | O918: math.max(0,(lv/10)-1) | P918: math.max(0,(lv/10)-1) | Q918: math.max(0,(lv/10)-1) | R918: 0; | S918: 有药王谷和盘丝洞的弟子在，真是不爽，还是跑路算了！ | T918: 药王谷和盘丝洞的弟子不在眼前，真是轻松愉快啊！ | U918: 0 | V918: 0,0; | W918: 2
A919: 11072 | B919: 蛤蟆精 | C919: pet_3 | D919: 0 | E919: 0 | F919: 0,0; | G919: 5123,100;5225,100;5104,100;5202,100; | H919: 1549 | I919: 634 | J919: 286 | K919: 213*0.5 | L919: 105*1.2 | M919: 1000*LV+100000 | N919: 0 | O919: math.max(0,(lv/10)-1) | P919: math.max(0,(lv/10)-1) | Q919: math.max(0,(lv/10)-1) | R919: 0; | S919: 有药王谷和盘丝洞的弟子在，真是不爽，还是跑路算了！ | T919: 药王谷和盘丝洞的弟子不在眼前，真是轻松愉快啊！ | U919: 0 | V919: 0,0; | W919: 5
A920: 11081 | B920: 水晶宫弟子 | C920: hero_1001 | D920: 0 | E920: 0 | F920: 1411,100;1412,100; | G920: 0,0; | H920: 1560 | I920: 642*0.5 | J920: 288*0.8 | K920: 216*1.5 | L920: 107*0.8 | M920: 1000*LV+100000 | N920: 0 | O920: math.max(0,(lv/10)-1) | P920: math.max(0,(lv/10)-1) | Q920: math.max(0,(lv/10)-1) | R920: 0; | S920: 有药王谷和盘丝洞的弟子在，真是不爽，还是跑路算了！ | T920: 药王谷和盘丝洞的弟子不在眼前，真是轻松愉快啊！ | U920: 0 | V920: 0,0; | W920: 2
A921: 11082 | B921: 药王谷弟子 | C921: hero_1001 | D921: 0 | E921: 0 | F921: 1212,100;1211,100; | G921: 0,0; | H921: 1560*1.2 | I921: 642*0.5 | J921: 288*1.2 | K921: 216*0.5 | L921: 107*1.5 | M921: 1000*LV+100000 | N921: 0 | O921: math.max(0,(lv/10)-1) | P921: math.max(0,(lv/10)-1) | Q921: math.max(0,(lv/10)-1) | R921: 0; | S921: 有药王谷和盘丝洞的弟子在，真是不爽，还是跑路算了！ | T921: 药王谷和盘丝洞的弟子不在眼前，真是轻松愉快啊！ | U921: 0 | V921: 0,0; | W921: 3
A922: 11083 | B922: 水晶宫弟子 | C922: hero_1001 | D922: 0 | E922: 0 | F922: 1411,100;1412,100; | G922: 0,0; | H922: 1560 | I922: 642*0.5 | J922: 288*0.8 | K922: 216*1.5 | L922: 107*0.8 | M922: 1000*LV+100000 | N922: 0 | O922: math.max(0,(lv/10)-1) | P922: math.max(0,(lv/10)-1) | Q922: math.max(0,(lv/10)-1) | R922: 0; | S922: 有药王谷和盘丝洞的弟子在，真是不爽，还是跑路算了！ | T922: 药王谷和盘丝洞的弟子不在眼前，真是轻松愉快啊！ | U922: 0 | V922: 0,0; | W922: 2
A923: 11091 | B923: 熊猫武师 | C923: pet_13 | D923: 0 | E923: 0 | F923: 1311,100;1315,100;1312,100; | G923: 5101,100; | H923: 1571 | I923: 648 | J923: 290 | K923: 220*0.5 | L923: 108*1.2 | M923: 1000*LV+100000 | N923: 0 | O923: math.max(0,(lv/10)-1) | P923: math.max(0,(lv/10)-1) | Q923: math.max(0,(lv/10)-1) | R923: 0; | S923: 有药王谷和盘丝洞的弟子在，真是不爽，还是跑路算了！ | T923: 药王谷和盘丝洞的弟子不在眼前，真是轻松愉快啊！ | U923: 0 | V923: 0,0; | W923: 4
A924: 11092 | B924: 仙鹤童子 | C924: pet_33 | D924: 0 | E924: 0 | F924: 1212,100;1211,100; | G924: 5138,100; | H924: 1571*1.2 | I924: 648*0.5 | J924: 290*1.2 | K924: 220*0.5 | L924: 108*1.5 | M924: 1000*LV+100000 | N924: 0 | O924: math.max(0,(lv/10)-1) | P924: math.max(0,(lv/10)-1) | Q924: math.max(0,(lv/10)-1) | R924: 0; | S924: 有药王谷和盘丝洞的弟子在，真是不爽，还是跑路算了！ | T924: 药王谷和盘丝洞的弟子不在眼前，真是轻松愉快啊！ | U924: 0 | V924: 0,0; | W924: 3
A925: 11093 | B925: 熊猫武师 | C925: pet_13 | D925: 0 | E925: 0 | F925: 1311,100;1315,100;1312,100; | G925: 5101,100; | H925: 1571 | I925: 648 | J925: 290 | K925: 220*0.5 | L925: 108*1.2 | M925: 1000*LV+100000 | N925: 0 | O925: math.max(0,(lv/10)-1) | P925: math.max(0,(lv/10)-1) | Q925: math.max(0,(lv/10)-1) | R925: 0; | S925: 有药王谷和盘丝洞的弟子在，真是不爽，还是跑路算了！ | T925: 药王谷和盘丝洞的弟子不在眼前，真是轻松愉快啊！ | U925: 0 | V925: 0,0; | W925: 4
A926: 11101 | B926: 盘丝弟子 | C926: hero_2001 | D926: 0 | E926: 0 | F926: 1511,100;1513,100; | G926: 5110,100; | H926: 1587*0.8 | I926: 656*0.5 | J926: 293 | K926: 223 | L926: 110*2 | M926: 1000*LV+100000 | N926: 0 | O926: math.max(0,(lv/5)-1) | P926: math.max(0,(lv/5)-1) | Q926: math.max(0,(lv/5)-1) | R926: 0; | S926: 有药王谷和盘丝洞的弟子在，真是不爽，还是跑路算了！ | T926: 药王谷和盘丝洞的弟子不在眼前，真是轻松愉快啊！ | U926: 0 | V926: 0,0; | W926: 4
A927: 11102 | B927: 兽王弟子 | C927: hero_1001 | D927: 0 | E927: 0 | F927: 1312,100;1315,100; | G927: 5103,100; | H927: 1587 | I927: 656 | J927: 293 | K927: 223*0.5 | L927: 110*1.2 | M927: 1000*LV+100000 | N927: 0 | O927: math.max(0,(lv/5)-1) | P927: math.max(0,(lv/5)-1) | Q927: math.max(0,(lv/5)-1) | R927: 0; | S927: 有药王谷和盘丝洞的弟子在，真是不爽，还是跑路算了！ | T927: 药王谷和盘丝洞的弟子不在眼前，真是轻松愉快啊！ | U927: 0 | V927: 0,0; | W927: 4
A928: 11103 | B928: 兽王弟子 | C928: hero_1001 | D928: 0 | E928: 0 | F928: 1312,100;1315,100; | G928: 5103,100; | H928: 1587 | I928: 656 | J928: 293 | K928: 223*0.5 | L928: 110*1.2 | M928: 1000*LV+100000 | N928: 0 | O928: math.max(0,(lv/5)-1) | P928: math.max(0,(lv/5)-1) | Q928: math.max(0,(lv/5)-1) | R928: 0; | S928: 有药王谷和盘丝洞的弟子在，真是不爽，还是跑路算了！ | T928: 药王谷和盘丝洞的弟子不在眼前，真是轻松愉快啊！ | U928: 0 | V928: 0,0; | W928: 4
A929: 11111 | B929: 爱慕者 | C929: hero_1001 | D929: 0 | E929: 0 | F929: 1411,100;1412,100; | G929: 0,0; | H929: 1836 | I929: 743*0.5 | J929: 340*0.8 | K929: 250*1.5 | L929: 122*0.8 | M929: 1000*LV+100000 | N929: 0 | O929: math.max(0,(lv/10)-1) | P929: math.max(0,(lv/10)-1) | Q929: math.max(0,(lv/10)-1) | R929: 0; | S929: 有药王谷和盘丝洞的弟子在，真是不爽，还是跑路算了！ | T929: 药王谷和盘丝洞的弟子不在眼前，真是轻松愉快啊！ | U929: 0 | V929: 0,0; | W929: 2
A930: 11112 | B930: 仙鹤童子 | C930: pet_33 | D930: 0 | E930: 0 | F930: 1212,100;1211,100; | G930: 0,0; | H930: 1836*1.2 | I930: 743*0.5 | J930: 340*1.2 | K930: 250*0.5 | L930: 122*1.5 | M930: 1000*LV+100000 | N930: 0 | O930: math.max(0,(lv/10)-1) | P930: math.max(0,(lv/10)-1) | Q930: math.max(0,(lv/10)-1) | R930: 0; | S930: 有药王谷和盘丝洞的弟子在，真是不爽，还是跑路算了！ | T930: 药王谷和盘丝洞的弟子不在眼前，真是轻松愉快啊！ | U930: 0 | V930: 0,0; | W930: 3
A931: 11113 | B931: 阴阳师 | C931: pet_52 | D931: 0 | E931: 0 | F931: 1411,100;1412,100; | G931: 0,0; | H931: 1836 | I931: 743*0.5 | J931: 340*0.8 | K931: 250*1.5 | L931: 122*0.8 | M931: 1000*LV+100000 | N931: 0 | O931: math.max(0,(lv/10)-1) | P931: math.max(0,(lv/10)-1) | Q931: math.max(0,(lv/10)-1) | R931: 0; | S931: 有药王谷和盘丝洞的弟子在，真是不爽，还是跑路算了！ | T931: 药王谷和盘丝洞的弟子不在眼前，真是轻松愉快啊！ | U931: 0 | V931: 0,0; | W931: 2
A932: 11121 | B932: 水晶宫弟子 | C932: hero_1001 | D932: 0 | E932: 0 | F932: 1411,100;1412,100; | G932: 0,0; | H932: 1852 | I932: 749*0.5 | J932: 343*0.8 | K932: 252*1.5 | L932: 124*0.8 | M932: 1000*LV+100000 | N932: 0 | O932: math.max(0,(lv/10)-1) | P932: math.max(0,(lv/10)-1) | Q932: math.max(0,(lv/10)-1) | R932: 0; | S932: 有药王谷和盘丝洞的弟子在，真是不爽，还是跑路算了！ | T932: 药王谷和盘丝洞的弟子不在眼前，真是轻松愉快啊！ | U932: 0 | V932: 0,0; | W932: 2
A933: 11122 | B933: 水晶宫外门弟子 | C933: hero_2001 | D933: 0 | E933: 0 | F933: 5309,100; | G933: 0,0; | H933: 1852 | I933: 749 | J933: 343 | K933: 252*0.5 | L933: 124*1.2 | M933: 1000*LV+100000 | N933: 0 | O933: math.max(0,(lv/10)-1) | P933: math.max(0,(lv/10)-1) | Q933: math.max(0,(lv/10)-1) | R933: 0; | S933: 有药王谷和盘丝洞的弟子在，真是不爽，还是跑路算了！ | T933: 药王谷和盘丝洞的弟子不在眼前，真是轻松愉快啊！ | U933: 0 | V933: 0,0; | W933: 0
A934: 11123 | B934: 水晶宫外门弟子 | C934: hero_2001 | D934: 0 | E934: 0 | F934: 5309,100; | G934: 0,0; | H934: 1852 | I934: 749 | J934: 343 | K934: 252*0.5 | L934: 124*1.2 | M934: 1000*LV+100000 | N934: 0 | O934: math.max(0,(lv/10)-1) | P934: math.max(0,(lv/10)-1) | Q934: math.max(0,(lv/10)-1) | R934: 0; | S934: 有药王谷和盘丝洞的弟子在，真是不爽，还是跑路算了！ | T934: 药王谷和盘丝洞的弟子不在眼前，真是轻松愉快啊！ | U934: 0 | V934: 0,0; | W934: 1
A935: 11131 | B935: 水晶宫弟子 | C935: hero_1001 | D935: 0 | E935: 0 | F935: 1411,100;1412,100; | G935: 0,0; | H935: 1863 | I935: 757*0.5 | J935: 345*0.8 | K935: 256*1.5 | L935: 125*0.8 | M935: 1000*LV+100000 | N935: 0 | O935: math.max(0,(lv/10)-1) | P935: math.max(0,(lv/10)-1) | Q935: math.max(0,(lv/10)-1) | R935: 0; | S935: 有药王谷和盘丝洞的弟子在，真是不爽，还是跑路算了！ | T935: 药王谷和盘丝洞的弟子不在眼前，真是轻松愉快啊！ | U935: 0 | V935: 0,0; | W935: 2
A936: 11132 | B936: 药王谷弟子 | C936: hero_1001 | D936: 0 | E936: 0 | F936: 1212,100;1211,100; | G936: 0,0; | H936: 1863*1.2 | I936: 757*0.5 | J936: 345*1.2 | K936: 256*0.5 | L936: 125*1.5 | M936: 1000*LV+100000 | N936: 0 | O936: math.max(0,(lv/10)-1) | P936: math.max(0,(lv/10)-1) | Q936: math.max(0,(lv/10)-1) | R936: 0; | S936: 有药王谷和盘丝洞的弟子在，真是不爽，还是跑路算了！ | T936: 药王谷和盘丝洞的弟子不在眼前，真是轻松愉快啊！ | U936: 0 | V936: 0,0; | W936: 3
A937: 11133 | B937: 兽王弟子 | C937: hero_1001 | D937: 0 | E937: 0 | F937: 1312,100;1315,100; | G937: 0,0; | H937: 1863 | I937: 757 | J937: 345 | K937: 256*0.5 | L937: 125*1.2 | M937: 1000*LV+100000 | N937: 0 | O937: math.max(0,(lv/10)-1) | P937: math.max(0,(lv/10)-1) | Q937: math.max(0,(lv/10)-1) | R937: 0; | S937: 有药王谷和盘丝洞的弟子在，真是不爽，还是跑路算了！ | T937: 药王谷和盘丝洞的弟子不在眼前，真是轻松愉快啊！ | U937: 0 | V937: 0,0; | W937: 4
A938: 11141 | B938: 兽王弟子 | C938: hero_1001 | D938: 0 | E938: 0 | F938: 1312,100;1315,100; | G938: 5103,100; | H938: 1879 | I938: 764 | J938: 347 | K938: 260*0.5 | L938: 127*1.2 | M938: 1000*LV+100000 | N938: 0 | O938: math.max(0,(lv/10)-1) | P938: math.max(0,(lv/10)-1) | Q938: math.max(0,(lv/10)-1) | R938: 0; | S938: 有药王谷和盘丝洞的弟子在，真是不爽，还是跑路算了！ | T938: 药王谷和盘丝洞的弟子不在眼前，真是轻松愉快啊！ | U938: 0 | V938: 0,0; | W938: 4
A939: 11142 | B939: 仙鹤童子 | C939: pet_33 | D939: 0 | E939: 0 | F939: 1212,100;1211,100; | G939: 5138,100; | H939: 1879*1.2 | I939: 764*0.5 | J939: 347*1.2 | K939: 260*0.5 | L939: 127*1.5 | M939: 1000*LV+100000 | N939: 0 | O939: math.max(0,(lv/10)-1) | P939: math.max(0,(lv/10)-1) | Q939: math.max(0,(lv/10)-1) | R939: 0; | S939: 有药王谷和盘丝洞的弟子在，真是不爽，还是跑路算了！ | T939: 药王谷和盘丝洞的弟子不在眼前，真是轻松愉快啊！ | U939: 0 | V939: 0,0; | W939: 3
A940: 11143 | B940: 盘丝弟子 | C940: hero_2001 | D940: 0 | E940: 0 | F940: 1511,100;1513,100; | G940: 5110,100; | H940: 1879*0.8 | I940: 764*0.5 | J940: 347 | K940: 260 | L940: 127*2 | M940: 1000*LV+100000 | N940: 0 | O940: math.max(0,(lv/10)-1) | P940: math.max(0,(lv/10)-1) | Q940: math.max(0,(lv/10)-1) | R940: 0; | S940: 有药王谷和盘丝洞的弟子在，真是不爽，还是跑路算了！ | T940: 药王谷和盘丝洞的弟子不在眼前，真是轻松愉快啊！ | U940: 0 | V940: 0,0; | W940: 5
A941: 11144 | B941: 兽王弟子 | C941: hero_1001 | D941: 0 | E941: 0 | F941: 1312,100;1315,100; | G941: 5103,100; | H941: 1879 | I941: 764 | J941: 347 | K941: 260*0.5 | L941: 127*1.2 | M941: 1000*LV+100000 | N941: 0 | O941: math.max(0,(lv/10)-1) | P941: math.max(0,(lv/10)-1) | Q941: math.max(0,(lv/10)-1) | R941: 0; | S941: 有药王谷和盘丝洞的弟子在，真是不爽，还是跑路算了！ | T941: 药王谷和盘丝洞的弟子不在眼前，真是轻松愉快啊！ | U941: 0 | V941: 0,0; | W941: 4
A942: 11151 | B942: 兽王弟子 | C942: hero_1001 | D942: 0 | E942: 0 | F942: 1312,100;1315,100; | G942: 5121,100; | H942: 1890 | I942: 771 | J942: 350 | K942: 262*0.5 | L942: 128*1.2 | M942: 1000*LV+100000 | N942: 0 | O942: math.max(0,(lv/5)-1) | P942: math.max(0,(lv/5)-1) | Q942: math.max(0,(lv/5)-1) | R942: 0; | S942: 有药王谷和盘丝洞的弟子在，真是不爽，还是跑路算了！ | T942: 药王谷和盘丝洞的弟子不在眼前，真是轻松愉快啊！ | U942: 0 | V942: 0,0; | W942: 4
A943: 11152 | B943: 蛤蟆精 | C943: pet_3 | D943: 0 | E943: 0 | F943: 0,0; | G943: 5123,100;5225,100;5104,100;5202,100; | H943: 1890 | I943: 771 | J943: 350 | K943: 262*0.5 | L943: 128*1.2 | M943: 1000*LV+100000 | N943: 0 | O943: math.max(0,(lv/5)-1) | P943: math.max(0,(lv/5)-1) | Q943: math.max(0,(lv/5)-1) | R943: 0; | S943: 有药王谷和盘丝洞的弟子在，真是不爽，还是跑路算了！ | T943: 药王谷和盘丝洞的弟子不在眼前，真是轻松愉快啊！ | U943: 0 | V943: 0,0; | W943: 2
A944: 11153 | B944: 熊猫武师 | C944: pet_13 | D944: 0 | E944: 0 | F944: 1311,100;1315,100;1312,100; | G944: 5103,100; | H944: 1890 | I944: 771 | J944: 350 | K944: 262*0.5 | L944: 128*1.2 | M944: 1000*LV+100000 | N944: 0 | O944: math.max(0,(lv/5)-1) | P944: math.max(0,(lv/5)-1) | Q944: math.max(0,(lv/5)-1) | R944: 0; | S944: 有药王谷和盘丝洞的弟子在，真是不爽，还是跑路算了！ | T944: 药王谷和盘丝洞的弟子不在眼前，真是轻松愉快啊！ | U944: 0 | V944: 0,0; | W944: 4
A945: 11161 | B945: 仙鹤童子 | C945: pet_33 | D945: 0 | E945: 0 | F945: 1212,100;1211,100; | G945: 0,0; | H945: 1938*1.2 | I945: 789*0.5 | J945: 358*1.2 | K945: 270*0.5 | L945: 131*1.5 | M945: 1000*LV+100000 | N945: 0 | O945: math.max(0,(lv/10)-1) | P945: math.max(0,(lv/10)-1) | Q945: math.max(0,(lv/10)-1) | R945: 0; | S945: 有药王谷和盘丝洞的弟子在，真是不爽，还是跑路算了！ | T945: 药王谷和盘丝洞的弟子不在眼前，真是轻松愉快啊！ | U945: 0 | V945: 0,0; | W945: 3
A946: 11162 | B946: 阴阳师 | C946: pet_52 | D946: 0 | E946: 0 | F946: 1411,100;1412,100; | G946: 0,0; | H946: 1938 | I946: 789*0.5 | J946: 358*0.8 | K946: 270*1.5 | L946: 131*0.8 | M946: 1000*LV+100000 | N946: 0 | O946: math.max(0,(lv/10)-1) | P946: math.max(0,(lv/10)-1) | Q946: math.max(0,(lv/10)-1) | R946: 0; | S946: 有药王谷和盘丝洞的弟子在，真是不爽，还是跑路算了！ | T946: 药王谷和盘丝洞的弟子不在眼前，真是轻松愉快啊！ | U946: 0 | V946: 0,0; | W946: 2
A947: 11163 | B947: 蛤蟆精 | C947: pet_3 | D947: 0 | E947: 0 | F947: 0,0; | G947: 5123,100;5225,100;5104,100;5202,100; | H947: 1938 | I947: 789 | J947: 358 | K947: 270*0.5 | L947: 131*1.2 | M947: 1000*LV+100000 | N947: 0 | O947: math.max(0,(lv/10)-1) | P947: math.max(0,(lv/10)-1) | Q947: math.max(0,(lv/10)-1) | R947: 0; | S947: 有药王谷和盘丝洞的弟子在，真是不爽，还是跑路算了！ | T947: 药王谷和盘丝洞的弟子不在眼前，真是轻松愉快啊！ | U947: 0 | V947: 0,0; | W947: 2
A948: 11171 | B948: 水晶宫弟子 | C948: hero_1001 | D948: 0 | E948: 0 | F948: 1411,100;1412,100; | G948: 0,0; | H948: 1949 | I948: 797*0.5 | J948: 361*0.8 | K948: 272*1.5 | L948: 132*0.8 | M948: 1000*LV+100000 | N948: 0 | O948: math.max(0,(lv/10)-1) | P948: math.max(0,(lv/10)-1) | Q948: math.max(0,(lv/10)-1) | R948: 0; | S948: 有药王谷和盘丝洞的弟子在，真是不爽，还是跑路算了！ | T948: 药王谷和盘丝洞的弟子不在眼前，真是轻松愉快啊！ | U948: 0 | V948: 0,0; | W948: 2
A949: 11172 | B949: 熊猫武师 | C949: pet_13 | D949: 0 | E949: 0 | F949: 1311,100;1315,100;1312,100; | G949: 0,0; | H949: 1949 | I949: 797 | J949: 361 | K949: 272*0.5 | L949: 132*1.2 | M949: 1000*LV+100000 | N949: 0 | O949: math.max(0,(lv/10)-1) | P949: math.max(0,(lv/10)-1) | Q949: math.max(0,(lv/10)-1) | R949: 0; | S949: 有药王谷和盘丝洞的弟子在，真是不爽，还是跑路算了！ | T949: 药王谷和盘丝洞的弟子不在眼前，真是轻松愉快啊！ | U949: 0 | V949: 0,0; | W949: 4
A950: 11173 | B950: 魔女 | C950: pet_53 | D950: 0 | E950: 0 | F950: 1511,100;1513,100; | G950: 0,0; | H950: 1949*0.8 | I950: 797*0.5 | J950: 361 | K950: 272 | L950: 132*2 | M950: 1000*LV+100000 | N950: 0 | O950: math.max(0,(lv/10)-1) | P950: math.max(0,(lv/10)-1) | Q950: math.max(0,(lv/10)-1) | R950: 0; | S950: 有药王谷和盘丝洞的弟子在，真是不爽，还是跑路算了！ | T950: 药王谷和盘丝洞的弟子不在眼前，真是轻松愉快啊！ | U950: 0 | V950: 0,0; | W950: 5
A951: 11181 | B951: 熊猫武师 | C951: pet_13 | D951: 0 | E951: 0 | F951: 1311,100;1315,100;1312,100; | G951: 0,0; | H951: 1965 | I951: 803 | J951: 363 | K951: 276*0.5 | L951: 134*1.2 | M951: 1000*LV+100000 | N951: 0 | O951: math.max(0,(lv/10)-1) | P951: math.max(0,(lv/10)-1) | Q951: math.max(0,(lv/10)-1) | R951: 0; | S951: 有药王谷和盘丝洞的弟子在，真是不爽，还是跑路算了！ | T951: 药王谷和盘丝洞的弟子不在眼前，真是轻松愉快啊！ | U951: 0 | V951: 0,0; | W951: 4
A952: 11182 | B952: 水晶宫弟子 | C952: hero_1001 | D952: 0 | E952: 0 | F952: 1411,100;1412,100; | G952: 0,0; | H952: 1965 | I952: 803*0.5 | J952: 363*0.8 | K952: 276*1.5 | L952: 134*0.8 | M952: 1000*LV+100000 | N952: 0 | O952: math.max(0,(lv/10)-1) | P952: math.max(0,(lv/10)-1) | Q952: math.max(0,(lv/10)-1) | R952: 0; | S952: 有药王谷和盘丝洞的弟子在，真是不爽，还是跑路算了！ | T952: 药王谷和盘丝洞的弟子不在眼前，真是轻松愉快啊！ | U952: 0 | V952: 0,0; | W952: 2
A953: 11183 | B953: 水晶宫外门弟子 | C953: hero_2001 | D953: 0 | E953: 0 | F953: 5309,100; | G953: 0,0; | H953: 1965 | I953: 803 | J953: 363 | K953: 276*0.5 | L953: 134*1.2 | M953: 1000*LV+100000 | N953: 0 | O953: math.max(0,(lv/10)-1) | P953: math.max(0,(lv/10)-1) | Q953: math.max(0,(lv/10)-1) | R953: 0; | S953: 有药王谷和盘丝洞的弟子在，真是不爽，还是跑路算了！ | T953: 药王谷和盘丝洞的弟子不在眼前，真是轻松愉快啊！ | U953: 0 | V953: 0,0; | W953: 5
A954: 11191 | B954: 兽王弟子 | C954: hero_1001 | D954: 0 | E954: 0 | F954: 1312,100;1315,100; | G954: 5103,100; | H954: 1976 | I954: 811 | J954: 365 | K954: 279*0.5 | L954: 136*1.2 | M954: 1000*LV+100000 | N954: 0 | O954: math.max(0,(lv/10)-1) | P954: math.max(0,(lv/10)-1) | Q954: math.max(0,(lv/10)-1) | R954: 0; | S954: 有药王谷和盘丝洞的弟子在，真是不爽，还是跑路算了！ | T954: 药王谷和盘丝洞的弟子不在眼前，真是轻松愉快啊！ | U954: 0 | V954: 0,0; | W954: 4
A955: 11192 | B955: 帮凶 | C955: pet_43 | D955: 0 | E955: 0 | F955: 1112,100;1111,100; | G955: 5101,100; | H955: 1976 | I955: 811 | J955: 365 | K955: 279*0.5 | L955: 136*1.2 | M955: 1000*LV+100000 | N955: 0 | O955: math.max(0,(lv/10)-1) | P955: math.max(0,(lv/10)-1) | Q955: math.max(0,(lv/10)-1) | R955: 0; | S955: 有药王谷和盘丝洞的弟子在，真是不爽，还是跑路算了！ | T955: 药王谷和盘丝洞的弟子不在眼前，真是轻松愉快啊！ | U955: 0 | V955: 0,0; | W955: 1
A956: 11201 | B956: 兽王弟子 | C956: hero_1001 | D956: 0 | E956: 0 | F956: 1312,100;1315,100; | G956: 5103,100;5108,100; | H956: 1992 | I956: 818 | J956: 368 | K956: 281*0.5 | L956: 137*1.2 | M956: 1000*LV+100000 | N956: 0 | O956: math.max(0,(lv/5)-1) | P956: math.max(0,(lv/5)-1) | Q956: math.max(0,(lv/5)-1) | R956: 0; | S956: 有药王谷和盘丝洞的弟子在，真是不爽，还是跑路算了！ | T956: 药王谷和盘丝洞的弟子不在眼前，真是轻松愉快啊！ | U956: 0 | V956: 0,0; | W956: 4
A957: 11202 | B957: 帮凶 | C957: pet_43 | D957: 0 | E957: 0 | F957: 1112,100;1111,100; | G957: 5124,100;5126,100; | H957: 1992 | I957: 818 | J957: 368 | K957: 281*0.5 | L957: 137*1.2 | M957: 1000*LV+100000 | N957: 0 | O957: math.max(0,(lv/5)-1) | P957: math.max(0,(lv/5)-1) | Q957: math.max(0,(lv/5)-1) | R957: 0; | S957: 有药王谷和盘丝洞的弟子在，真是不爽，还是跑路算了！ | T957: 药王谷和盘丝洞的弟子不在眼前，真是轻松愉快啊！ | U957: 0 | V957: 0,0; | W957: 1
A958: 11203 | B958: 魔女 | C958: pet_53 | D958: 0 | E958: 0 | F958: 1511,100;1513,100; | G958: 5132,100;5126,100; | H958: 1992*0.8 | I958: 818*0.5 | J958: 368 | K958: 281 | L958: 137*2 | M958: 1000*LV+100000 | N958: 0 | O958: math.max(0,(lv/5)-1) | P958: math.max(0,(lv/5)-1) | Q958: math.max(0,(lv/5)-1) | R958: 0; | S958: 有药王谷和盘丝洞的弟子在，真是不爽，还是跑路算了！ | T958: 药王谷和盘丝洞的弟子不在眼前，真是轻松愉快啊！ | U958: 0 | V958: 0,0; | W958: 5
A959: 11211 | B959: 剑灵 | C959: pet_21 | D959: 0 | E959: 0 | F959: 5309,100; | G959: 0,0; | H959: 1872 | I959: 874 | J959: 416 | K959: 311*0.5 | L959: 148*1.2 | M959: 1000*LV+100000 | N959: 0 | O959: math.max(0,(lv/10)-1) | P959: math.max(0,(lv/10)-1) | Q959: math.max(0,(lv/10)-1) | R959: 0; | S959: 有药王谷和盘丝洞的弟子在，真是不爽，还是跑路算了！ | T959: 药王谷和盘丝洞的弟子不在眼前，真是轻松愉快啊！ | U959: 0 | V959: 0,0; | W959: 2
A960: 11212 | B960: 天策府弟子 | C960: hero_1001 | D960: 0 | E960: 0 | F960: 1112,100;1111,100; | G960: 0,0; | H960: 1872 | I960: 874 | J960: 416 | K960: 311*0.5 | L960: 148*1.2 | M960: 1000*LV+100000 | N960: 0 | O960: math.max(0,(lv/10)-1) | P960: math.max(0,(lv/10)-1) | Q960: math.max(0,(lv/10)-1) | R960: 0; | S960: 有药王谷和盘丝洞的弟子在，真是不爽，还是跑路算了！ | T960: 药王谷和盘丝洞的弟子不在眼前，真是轻松愉快啊！ | U960: 0 | V960: 0,0; | W960: 1
A961: 11213 | B961: 仙鹤童子 | C961: pet_33 | D961: 0 | E961: 0 | F961: 1212,100;1211,100; | G961: 0,0; | H961: 1872*1.2 | I961: 874*0.5 | J961: 416*1.2 | K961: 311*0.5 | L961: 148*1.5 | M961: 1000*LV+100000 | N961: 0 | O961: math.max(0,(lv/10)-1) | P961: math.max(0,(lv/10)-1) | Q961: math.max(0,(lv/10)-1) | R961: 0; | S961: 有药王谷和盘丝洞的弟子在，真是不爽，还是跑路算了！ | T961: 药王谷和盘丝洞的弟子不在眼前，真是轻松愉快啊！ | U961: 0 | V961: 0,0; | W961: 3
A962: 11221 | B962: 盘丝弟子 | C962: hero_2001 | D962: 0 | E962: 0 | F962: 1511,100;1513,100; | G962: 0,0; | H962: 1885*0.8 | I962: 880*0.5 | J962: 419 | K962: 314 | L962: 150*2 | M962: 1000*LV+100000 | N962: 0 | O962: math.max(0,(lv/10)-1) | P962: math.max(0,(lv/10)-1) | Q962: math.max(0,(lv/10)-1) | R962: 0; | S962: 有药王谷和盘丝洞的弟子在，真是不爽，还是跑路算了！ | T962: 药王谷和盘丝洞的弟子不在眼前，真是轻松愉快啊！ | U962: 0 | V962: 0,0; | W962: 5
A963: 11222 | B963: 熊猫武师 | C963: pet_13 | D963: 0 | E963: 0 | F963: 1311,100;1315,100;1312,100; | G963: 0,0; | H963: 1885 | I963: 880 | J963: 419 | K963: 314*0.5 | L963: 150*1.2 | M963: 1000*LV+100000 | N963: 0 | O963: math.max(0,(lv/10)-1) | P963: math.max(0,(lv/10)-1) | Q963: math.max(0,(lv/10)-1) | R963: 0; | S963: 有药王谷和盘丝洞的弟子在，真是不爽，还是跑路算了！ | T963: 药王谷和盘丝洞的弟子不在眼前，真是轻松愉快啊！ | U963: 0 | V963: 0,0; | W963: 4
A964: 11223 | B964: 天策府弟子 | C964: hero_1001 | D964: 0 | E964: 0 | F964: 1112,100;1111,100; | G964: 0,0; | H964: 1885 | I964: 880 | J964: 419 | K964: 314*0.5 | L964: 150*1.2 | M964: 1000*LV+100000 | N964: 0 | O964: math.max(0,(lv/10)-1) | P964: math.max(0,(lv/10)-1) | Q964: math.max(0,(lv/10)-1) | R964: 0; | S964: 有药王谷和盘丝洞的弟子在，真是不爽，还是跑路算了！ | T964: 药王谷和盘丝洞的弟子不在眼前，真是轻松愉快啊！ | U964: 0 | V964: 0,0; | W964: 1
A965: 11231 | B965: 水晶宫弟子 | C965: hero_1001 | D965: 0 | E965: 0 | F965: 1411,100;1412,100; | G965: 0,0; | H965: 1894 | I965: 888*0.5 | J965: 421*0.8 | K965: 317*1.5 | L965: 152*0.8 | M965: 1000*LV+100000 | N965: 0 | O965: math.max(0,(lv/10)-1) | P965: math.max(0,(lv/10)-1) | Q965: math.max(0,(lv/10)-1) | R965: 0; | S965: 有药王谷和盘丝洞的弟子在，真是不爽，还是跑路算了！ | T965: 药王谷和盘丝洞的弟子不在眼前，真是轻松愉快啊！ | U965: 0 | V965: 0,0; | W965: 2
A966: 11232 | B966: 熊猫武师 | C966: pet_13 | D966: 0 | E966: 0 | F966: 1311,100;1315,100;1312,100; | G966: 0,0; | H966: 1894 | I966: 888 | J966: 421 | K966: 317*0.5 | L966: 152*1.2 | M966: 1000*LV+100000 | N966: 0 | O966: math.max(0,(lv/10)-1) | P966: math.max(0,(lv/10)-1) | Q966: math.max(0,(lv/10)-1) | R966: 0; | S966: 有药王谷和盘丝洞的弟子在，真是不爽，还是跑路算了！ | T966: 药王谷和盘丝洞的弟子不在眼前，真是轻松愉快啊！ | U966: 0 | V966: 0,0; | W966: 4
A967: 11233 | B967: 水晶宫外门弟子 | C967: hero_2001 | D967: 0 | E967: 0 | F967: 5309,100; | G967: 5103,100; | H967: 1894 | I967: 888 | J967: 421 | K967: 317*0.5 | L967: 152*1.2 | M967: 1000*LV+100000 | N967: 0 | O967: math.max(0,(lv/10)-1) | P967: math.max(0,(lv/10)-1) | Q967: math.max(0,(lv/10)-1) | R967: 0; | S967: 有药王谷和盘丝洞的弟子在，真是不爽，还是跑路算了！ | T967: 药王谷和盘丝洞的弟子不在眼前，真是轻松愉快啊！ | U967: 0 | V967: 0,0; | W967: 5
A968: 11241 | B968: 天策府弟子 | C968: hero_1001 | D968: 0 | E968: 0 | F968: 1112,100;1111,100; | G968: 5109,100;5116,100; | H968: 1908 | I968: 895 | J968: 423 | K968: 321*0.5 | L968: 153*1.2 | M968: 1000*LV+100000 | N968: 0 | O968: math.max(0,(lv/10)-1) | P968: math.max(0,(lv/10)-1) | Q968: math.max(0,(lv/10)-1) | R968: 0; | S968: 有药王谷和盘丝洞的弟子在，真是不爽，还是跑路算了！ | T968: 药王谷和盘丝洞的弟子不在眼前，真是轻松愉快啊！ | U968: 0 | V968: 0,0; | W968: 1
A969: 11242 | B969: 仙鹤童子 | C969: pet_33 | D969: 0 | E969: 0 | F969: 1212,100;1211,100; | G969: 5138,100;5131,100; | H969: 1908*1.2 | I969: 895*0.5 | J969: 423*1.2 | K969: 321*0.5 | L969: 153*1.5 | M969: 1000*LV+100000 | N969: 0 | O969: math.max(0,(lv/10)-1) | P969: math.max(0,(lv/10)-1) | Q969: math.max(0,(lv/10)-1) | R969: 0; | S969: 有药王谷和盘丝洞的弟子在，真是不爽，还是跑路算了！ | T969: 药王谷和盘丝洞的弟子不在眼前，真是轻松愉快啊！ | U969: 0 | V969: 0,0; | W969: 3
A970: 11243 | B970: 熊猫武师 | C970: pet_13 | D970: 0 | E970: 0 | F970: 1311,100;1315,100; | G970: 5103,100;5108,100; | H970: 1908 | I970: 895 | J970: 423 | K970: 321*0.5 | L970: 153*1.2 | M970: 1000*LV+100000 | N970: 0 | O970: math.max(0,(lv/10)-1) | P970: math.max(0,(lv/10)-1) | Q970: math.max(0,(lv/10)-1) | R970: 0; | S970: 有药王谷和盘丝洞的弟子在，真是不爽，还是跑路算了！ | T970: 药王谷和盘丝洞的弟子不在眼前，真是轻松愉快啊！ | U970: 0 | V970: 0,0; | W970: 4
A971: 11251 | B971: 兽王弟子 | C971: hero_1001 | D971: 0 | E971: 0 | F971: 1312,100;1315,100; | G971: 5138,100;5122,100; | H971: 1921 | I971: 902 | J971: 426 | K971: 324*0.5 | L971: 155*1.2 | M971: 1000*LV+100000 | N971: 0 | O971: math.max(0,(lv/5)-1) | P971: math.max(0,(lv/5)-1) | Q971: math.max(0,(lv/5)-1) | R971: 0; | S971: 有药王谷和盘丝洞的弟子在，真是不爽，还是跑路算了！ | T971: 药王谷和盘丝洞的弟子不在眼前，真是轻松愉快啊！ | U971: 0 | V971: 0,0; | W971: 4
A972: 11252 | B972: 帮凶 | C972: pet_43 | D972: 0 | E972: 0 | F972: 1112,100;1111,100; | G972: 5124,100;5126,100; | H972: 1921 | I972: 902 | J972: 426 | K972: 324*0.5 | L972: 155*1.2 | M972: 1000*LV+100000 | N972: 0 | O972: math.max(0,(lv/5)-1) | P972: math.max(0,(lv/5)-1) | Q972: math.max(0,(lv/5)-1) | R972: 0; | S972: 有药王谷和盘丝洞的弟子在，真是不爽，还是跑路算了！ | T972: 药王谷和盘丝洞的弟子不在眼前，真是轻松愉快啊！ | U972: 0 | V972: 0,0; | W972: 1
A973: 11253 | B973: 魔女 | C973: pet_53 | D973: 0 | E973: 0 | F973: 1511,100;1513,100; | G973: 5132,100;5126,100; | H973: 1921*0.8 | I973: 902*0.5 | J973: 426 | K973: 324 | L973: 155*2 | M973: 1000*LV+100000 | N973: 0 | O973: math.max(0,(lv/5)-1) | P973: math.max(0,(lv/5)-1) | Q973: math.max(0,(lv/5)-1) | R973: 0; | S973: 有药王谷和盘丝洞的弟子在，真是不爽，还是跑路算了！ | T973: 药王谷和盘丝洞的弟子不在眼前，真是轻松愉快啊！ | U973: 0 | V973: 0,0; | W973: 5
A974: 11254 | B974: 兽王弟子 | C974: hero_1001 | D974: 0 | E974: 0 | F974: 1312,100;1315,100; | G974: 5138,100;5122,100; | H974: 1921 | I974: 902 | J974: 426 | K974: 324*0.5 | L974: 155*1.2 | M974: 1000*LV+100000 | N974: 0 | O974: math.max(0,(lv/5)-1) | P974: math.max(0,(lv/5)-1) | Q974: math.max(0,(lv/5)-1) | R974: 0; | S974: 有药王谷和盘丝洞的弟子在，真是不爽，还是跑路算了！ | T974: 药王谷和盘丝洞的弟子不在眼前，真是轻松愉快啊！ | U974: 0 | V974: 0,0; | W974: 4
A975: 11261 | B975: 水晶宫弟子 | C975: hero_1001 | D975: 0 | E975: 0 | F975: 1411,100;1412,100; | G975: 0,0; | H975: 1962 | I975: 921*0.5 | J975: 435*0.8 | K975: 332*1.5 | L975: 157*0.8 | M975: 1000*LV+100000 | N975: 0 | O975: math.max(0,(lv/10)-1) | P975: math.max(0,(lv/10)-1) | Q975: math.max(0,(lv/10)-1) | R975: 0; | S975: 有药王谷和盘丝洞的弟子在，真是不爽，还是跑路算了！ | T975: 药王谷和盘丝洞的弟子不在眼前，真是轻松愉快啊！ | U975: 0 | V975: 0,0; | W975: 2
A976: 11262 | B976: 药王谷弟子 | C976: hero_1001 | D976: 0 | E976: 0 | F976: 1212,100;1211,100; | G976: 0,0; | H976: 1962*1.2 | I976: 921*0.5 | J976: 435*1.2 | K976: 332*0.5 | L976: 157*1.5 | M976: 1000*LV+100000 | N976: 0 | O976: math.max(0,(lv/10)-1) | P976: math.max(0,(lv/10)-1) | Q976: math.max(0,(lv/10)-1) | R976: 0; | S976: 有药王谷和盘丝洞的弟子在，真是不爽，还是跑路算了！ | T976: 药王谷和盘丝洞的弟子不在眼前，真是轻松愉快啊！ | U976: 0 | V976: 0,0; | W976: 3
A977: 11263 | B977: 药王谷外门弟子 | C977: hero_2001 | D977: 0 | E977: 0 | F977: 5305,100; | G977: 0,0; | H977: 1962 | I977: 921*0.5 | J977: 435*0.8 | K977: 332*1.5 | L977: 157*0.8 | M977: 1000*LV+100000 | N977: 0 | O977: math.max(0,(lv/10)-1) | P977: math.max(0,(lv/10)-1) | Q977: math.max(0,(lv/10)-1) | R977: 0; | S977: 有药王谷和盘丝洞的弟子在，真是不爽，还是跑路算了！ | T977: 药王谷和盘丝洞的弟子不在眼前，真是轻松愉快啊！ | U977: 0 | V977: 0,0; | W977: 5
A978: 11271 | B978: 仙鹤童子 | C978: pet_33 | D978: 0 | E978: 0 | F978: 1212,100;1211,100; | G978: 0,0; | H978: 1971*1.2 | I978: 927*0.5 | J978: 438*1.2 | K978: 334*0.5 | L978: 159*1.5 | M978: 1000*LV+100000 | N978: 0 | O978: math.max(0,(lv/10)-1) | P978: math.max(0,(lv/10)-1) | Q978: math.max(0,(lv/10)-1) | R978: 0; | S978: 有药王谷和盘丝洞的弟子在，真是不爽，还是跑路算了！ | T978: 药王谷和盘丝洞的弟子不在眼前，真是轻松愉快啊！ | U978: 0 | V978: 0,0; | W978: 3
A979: 11272 | B979: 魔女 | C979: pet_53 | D979: 0 | E979: 0 | F979: 1511,100;1513,100; | G979: 0,0; | H979: 1971*0.8 | I979: 927*0.5 | J979: 438 | K979: 334 | L979: 159*2 | M979: 1000*LV+100000 | N979: 0 | O979: math.max(0,(lv/10)-1) | P979: math.max(0,(lv/10)-1) | Q979: math.max(0,(lv/10)-1) | R979: 0; | S979: 有药王谷和盘丝洞的弟子在，真是不爽，还是跑路算了！ | T979: 药王谷和盘丝洞的弟子不在眼前，真是轻松愉快啊！ | U979: 0 | V979: 0,0; | W979: 5
A980: 11273 | B980: 阴阳师 | C980: pet_52 | D980: 0 | E980: 0 | F980: 1411,100;1412,100; | G980: 0,0; | H980: 1971 | I980: 927*0.5 | J980: 438*0.8 | K980: 334*1.5 | L980: 159*0.8 | M980: 1000*LV+100000 | N980: 0 | O980: math.max(0,(lv/10)-1) | P980: math.max(0,(lv/10)-1) | Q980: math.max(0,(lv/10)-1) | R980: 0; | S980: 有药王谷和盘丝洞的弟子在，真是不爽，还是跑路算了！ | T980: 药王谷和盘丝洞的弟子不在眼前，真是轻松愉快啊！ | U980: 0 | V980: 0,0; | W980: 2
A981: 11281 | B981: 水晶宫弟子 | C981: hero_1001 | D981: 0 | E981: 0 | F981: 1411,100;1412,100; | G981: 0,0; | H981: 1984 | I981: 934*0.5 | J981: 440*0.8 | K981: 338*1.5 | L981: 160*0.8 | M981: 1000*LV+100000 | N981: 0 | O981: math.max(0,(lv/10)-1) | P981: math.max(0,(lv/10)-1) | Q981: math.max(0,(lv/10)-1) | R981: 0; | S981: 有药王谷和盘丝洞的弟子在，真是不爽，还是跑路算了！ | T981: 药王谷和盘丝洞的弟子不在眼前，真是轻松愉快啊！ | U981: 0 | V981: 0,0; | W981: 2
A982: 11282 | B982: 阴阳师 | C982: pet_52 | D982: 0 | E982: 0 | F982: 1411,100;1412,100; | G982: 0,0; | H982: 1984 | I982: 934*0.5 | J982: 440*0.8 | K982: 338*1.5 | L982: 160*0.8 | M982: 1000*LV+100000 | N982: 0 | O982: math.max(0,(lv/10)-1) | P982: math.max(0,(lv/10)-1) | Q982: math.max(0,(lv/10)-1) | R982: 0; | S982: 有药王谷和盘丝洞的弟子在，真是不爽，还是跑路算了！ | T982: 药王谷和盘丝洞的弟子不在眼前，真是轻松愉快啊！ | U982: 0 | V982: 0,0; | W982: 2
A983: 11283 | B983: 水晶宫外门弟子 | C983: hero_2001 | D983: 0 | E983: 0 | F983: 5309,100; | G983: 5103,100; | H983: 1984 | I983: 934 | J983: 440 | K983: 338*0.5 | L983: 160*1.2 | M983: 1000*LV+100000 | N983: 0 | O983: math.max(0,(lv/10)-1) | P983: math.max(0,(lv/10)-1) | Q983: math.max(0,(lv/10)-1) | R983: 0; | S983: 有药王谷和盘丝洞的弟子在，真是不爽，还是跑路算了！ | T983: 药王谷和盘丝洞的弟子不在眼前，真是轻松愉快啊！ | U983: 0 | V983: 0,0; | W983: 4
A984: 11291 | B984: 天策府弟子 | C984: hero_1001 | D984: 0 | E984: 0 | F984: 1112,100;1111,100; | G984: 5109,100;5116,100; | H984: 1993 | I984: 941 | J984: 443 | K984: 342*0.5 | L984: 162*1.2 | M984: 1000*LV+100000 | N984: 0 | O984: math.max(0,(lv/10)-1) | P984: math.max(0,(lv/10)-1) | Q984: math.max(0,(lv/10)-1) | R984: 0; | S984: 有药王谷和盘丝洞的弟子在，真是不爽，还是跑路算了！ | T984: 药王谷和盘丝洞的弟子不在眼前，真是轻松愉快啊！ | U984: 0 | V984: 0,0; | W984: 1
A985: 11292 | B985: 盘丝弟子 | C985: hero_2001 | D985: 0 | E985: 0 | F985: 1511,100;1513,100; | G985: 5132,100;5126,100; | H985: 1993*0.8 | I985: 941*0.5 | J985: 443 | K985: 342 | L985: 162*2 | M985: 1000*LV+100000 | N985: 0 | O985: math.max(0,(lv/10)-1) | P985: math.max(0,(lv/10)-1) | Q985: math.max(0,(lv/10)-1) | R985: 0; | S985: 有药王谷和盘丝洞的弟子在，真是不爽，还是跑路算了！ | T985: 药王谷和盘丝洞的弟子不在眼前，真是轻松愉快啊！ | U985: 0 | V985: 0,0; | W985: 5
A986: 11301 | B986: 熊猫武师 | C986: pet_13 | D986: 0 | E986: 0 | F986: 1311,100;1315,100;1312,100; | G986: 5103,100;5108,100; | H986: 2007 | I986: 948 | J986: 445 | K986: 344*0.5 | L986: 164*1.2 | M986: 1000*LV+100000 | N986: 0 | O986: math.max(0,(lv/5)-1) | P986: math.max(0,(lv/5)-1) | Q986: math.max(0,(lv/5)-1) | R986: 0; | S986: 有药王谷和盘丝洞的弟子在，真是不爽，还是跑路算了！ | T986: 药王谷和盘丝洞的弟子不在眼前，真是轻松愉快啊！ | U986: 0 | V986: 0,0; | W986: 4
A987: 11302 | B987: 仙鹤童子 | C987: pet_33 | D987: 0 | E987: 0 | F987: 1212,100;1211,100; | G987: 5138,100;5131,100; | H987: 2007*1.2 | I987: 948*0.5 | J987: 445*1.2 | K987: 344*0.5 | L987: 164*1.5 | M987: 1000*LV+100000 | N987: 0 | O987: math.max(0,(lv/5)-1) | P987: math.max(0,(lv/5)-1) | Q987: math.max(0,(lv/5)-1) | R987: 0; | S987: 有药王谷和盘丝洞的弟子在，真是不爽，还是跑路算了！ | T987: 药王谷和盘丝洞的弟子不在眼前，真是轻松愉快啊！ | U987: 0 | V987: 0,0; | W987: 3
A988: 11311 | B988: 天策府弟子 | C988: hero_1001 | D988: 0 | E988: 0 | F988: 1112,100;1111,100; | G988: 0,0; | H988: 2272 | I988: 1082 | J988: 505 | K988: 386*0.5 | L988: 191*1.2 | M988: 1000*LV+100000 | N988: 0 | O988: math.max(0,(lv/10)-1) | P988: math.max(0,(lv/10)-1) | Q988: math.max(0,(lv/10)-1) | R988: 0; | S988: 有药王谷和盘丝洞的弟子在，真是不爽，还是跑路算了！ | T988: 药王谷和盘丝洞的弟子不在眼前，真是轻松愉快啊！ | U988: 0 | V988: 0,0; | W988: 1
A989: 11312 | B989: 盘丝弟子 | C989: hero_2001 | D989: 0 | E989: 0 | F989: 1511,100;1513,100; | G989: 0,0; | H989: 2272*0.8 | I989: 1082*0.5 | J989: 505 | K989: 386 | L989: 191*2 | M989: 1000*LV+100000 | N989: 0 | O989: math.max(0,(lv/10)-1) | P989: math.max(0,(lv/10)-1) | Q989: math.max(0,(lv/10)-1) | R989: 0; | S989: 有药王谷和盘丝洞的弟子在，真是不爽，还是跑路算了！ | T989: 药王谷和盘丝洞的弟子不在眼前，真是轻松愉快啊！ | U989: 0 | V989: 0,0; | W989: 5
A990: 11313 | B990: 天策府弟子 | C990: hero_1001 | D990: 0 | E990: 0 | F990: 1112,100;1111,100; | G990: 0,0; | H990: 2272 | I990: 1082 | J990: 505 | K990: 386*0.5 | L990: 191*1.2 | M990: 1000*LV+100000 | N990: 0 | O990: math.max(0,(lv/10)-1) | P990: math.max(0,(lv/10)-1) | Q990: math.max(0,(lv/10)-1) | R990: 0; | S990: 有药王谷和盘丝洞的弟子在，真是不爽，还是跑路算了！ | T990: 药王谷和盘丝洞的弟子不在眼前，真是轻松愉快啊！ | U990: 0 | V990: 0,0; | W990: 1
A991: 11314 | B991: 熊猫武师 | C991: pet_13 | D991: 0 | E991: 0 | F991: 1311,100;1315,100;1312,100; | G991: 0,0; | H991: 2272 | I991: 1082 | J991: 505 | K991: 386*0.5 | L991: 191*1.2 | M991: 1000*LV+100000 | N991: 0 | O991: math.max(0,(lv/10)-1) | P991: math.max(0,(lv/10)-1) | Q991: math.max(0,(lv/10)-1) | R991: 0; | S991: 有药王谷和盘丝洞的弟子在，真是不爽，还是跑路算了！ | T991: 药王谷和盘丝洞的弟子不在眼前，真是轻松愉快啊！ | U991: 0 | V991: 0,0; | W991: 4
A992: 11321 | B992: 兽王弟子 | C992: hero_1001 | D992: 0 | E992: 0 | F992: 1312,100;1315,100; | G992: 0,0; | H992: 2286 | I992: 1089 | J992: 508 | K992: 388*0.5 | L992: 192*1.2 | M992: 1000*LV+100000 | N992: 0 | O992: math.max(0,(lv/10)-1) | P992: math.max(0,(lv/10)-1) | Q992: math.max(0,(lv/10)-1) | R992: 0; | S992: 有药王谷和盘丝洞的弟子在，真是不爽，还是跑路算了！ | T992: 药王谷和盘丝洞的弟子不在眼前，真是轻松愉快啊！ | U992: 0 | V992: 0,0; | W992: 4
A993: 11322 | B993: 阴阳师 | C993: pet_52 | D993: 0 | E993: 0 | F993: 1411,100;1412,100; | G993: 0,0; | H993: 2286 | I993: 1089*0.5 | J993: 508*0.8 | K993: 388*1.5 | L993: 192*0.8 | M993: 1000*LV+100000 | N993: 0 | O993: math.max(0,(lv/10)-1) | P993: math.max(0,(lv/10)-1) | Q993: math.max(0,(lv/10)-1) | R993: 0; | S993: 有药王谷和盘丝洞的弟子在，真是不爽，还是跑路算了！ | T993: 药王谷和盘丝洞的弟子不在眼前，真是轻松愉快啊！ | U993: 0 | V993: 0,0; | W993: 2
A994: 11323 | B994: 帮凶 | C994: pet_43 | D994: 0 | E994: 0 | F994: 1112,100;1111,100; | G994: 0,0; | H994: 2286 | I994: 1089 | J994: 508 | K994: 388*0.5 | L994: 192*1.2 | M994: 1000*LV+100000 | N994: 0 | O994: math.max(0,(lv/10)-1) | P994: math.max(0,(lv/10)-1) | Q994: math.max(0,(lv/10)-1) | R994: 0; | S994: 有药王谷和盘丝洞的弟子在，真是不爽，还是跑路算了！ | T994: 药王谷和盘丝洞的弟子不在眼前，真是轻松愉快啊！ | U994: 0 | V994: 0,0; | W994: 1
A995: 11331 | B995: 水晶宫弟子 | C995: hero_1001 | D995: 0 | E995: 0 | F995: 1411,100;1412,100; | G995: 0,0; | H995: 2299 | I995: 1097*0.5 | J995: 510*0.8 | K995: 392*1.5 | L995: 194*0.8 | M995: 1000*LV+100000 | N995: 0 | O995: math.max(0,(lv/10)-1) | P995: math.max(0,(lv/10)-1) | Q995: math.max(0,(lv/10)-1) | R995: 0; | S995: 有药王谷和盘丝洞的弟子在，真是不爽，还是跑路算了！ | T995: 药王谷和盘丝洞的弟子不在眼前，真是轻松愉快啊！ | U995: 0 | V995: 0,0; | W995: 2
A996: 11332 | B996: 阴阳师 | C996: pet_52 | D996: 0 | E996: 0 | F996: 1411,100;1412,100; | G996: 0,0; | H996: 2299 | I996: 1097*0.5 | J996: 510*0.8 | K996: 392*1.5 | L996: 194*0.8 | M996: 1000*LV+100000 | N996: 0 | O996: math.max(0,(lv/10)-1) | P996: math.max(0,(lv/10)-1) | Q996: math.max(0,(lv/10)-1) | R996: 0; | S996: 有药王谷和盘丝洞的弟子在，真是不爽，还是跑路算了！ | T996: 药王谷和盘丝洞的弟子不在眼前，真是轻松愉快啊！ | U996: 0 | V996: 0,0; | W996: 2
A997: 11333 | B997: 水晶宫外门弟子 | C997: hero_2001 | D997: 0 | E997: 0 | F997: 5309,100; | G997: 5103,100; | H997: 2299 | I997: 1097 | J997: 510 | K997: 392*0.5 | L997: 194*1.2 | M997: 1000*LV+100000 | N997: 0 | O997: math.max(0,(lv/10)-1) | P997: math.max(0,(lv/10)-1) | Q997: math.max(0,(lv/10)-1) | R997: 0; | S997: 有药王谷和盘丝洞的弟子在，真是不爽，还是跑路算了！ | T997: 药王谷和盘丝洞的弟子不在眼前，真是轻松愉快啊！ | U997: 0 | V997: 0,0; | W997: 4
A998: 11341 | B998: 魔女 | C998: pet_53 | D998: 0 | E998: 0 | F998: 1511,100;1513,100; | G998: 5132,100;5126,100; | H998: 2308*0.8 | I998: 1104*0.5 | J998: 513 | K998: 396 | L998: 196*2 | M998: 1000*LV+100000 | N998: 0 | O998: math.max(0,(lv/10)-1) | P998: math.max(0,(lv/10)-1) | Q998: math.max(0,(lv/10)-1) | R998: 0; | S998: 有药王谷和盘丝洞的弟子在，真是不爽，还是跑路算了！ | T998: 药王谷和盘丝洞的弟子不在眼前，真是轻松愉快啊！ | U998: 0 | V998: 0,0; | W998: 5
A999: 11342 | B999: 熊猫武师 | C999: pet_13 | D999: 0 | E999: 0 | F999: 1311,100;1315,100;1312,100; | G999: 5103,100;5108,100; | H999: 2308 | I999: 1104 | J999: 513 | K999: 396*0.5 | L999: 196*1.2 | M999: 1000*LV+100000 | N999: 0 | O999: math.max(0,(lv/10)-1) | P999: math.max(0,(lv/10)-1) | Q999: math.max(0,(lv/10)-1) | R999: 0; | S999: 有药王谷和盘丝洞的弟子在，真是不爽，还是跑路算了！ | T999: 药王谷和盘丝洞的弟子不在眼前，真是轻松愉快啊！ | U999: 0 | V999: 0,0; | W999: 4
A1000: 11343 | B1000: 天策府弟子 | C1000: hero_1001 | D1000: 0 | E1000: 0 | F1000: 1112,100;1111,100; | G1000: 5109,100;5116,100; | H1000: 2308 | I1000: 1104 | J1000: 513 | K1000: 396*0.5 | L1000: 196*1.2 | M1000: 1000*LV+100000 | N1000: 0 | O1000: math.max(0,(lv/10)-1) | P1000: math.max(0,(lv/10)-1) | Q1000: math.max(0,(lv/10)-1) | R1000: 0; | S1000: 有药王谷和盘丝洞的弟子在，真是不爽，还是跑路算了！ | T1000: 药王谷和盘丝洞的弟子不在眼前，真是轻松愉快啊！ | U1000: 0 | V1000: 0,0; | W1000: 1
A1001: 11351 | B1001: 熊猫武师 | C1001: pet_13 | D1001: 0 | E1001: 0 | F1001: 1311,100;1315,100;1312,100; | G1001: 5103,100;5108,100; | H1001: 2322 | I1001: 1111 | J1001: 516 | K1001: 398*0.5 | L1001: 197*1.2 | M1001: 1000*LV+100000 | N1001: 0 | O1001: math.max(0,(lv/5)-1) | P1001: math.max(0,(lv/5)-1) | Q1001: math.max(0,(lv/5)-1) | R1001: 0; | S1001: 有药王谷和盘丝洞的弟子在，真是不爽，还是跑路算了！ | T1001: 药王谷和盘丝洞的弟子不在眼前，真是轻松愉快啊！ | U1001: 0 | V1001: 0,0; | W1001: 4
A1002: 11352 | B1002: 盘丝弟子 | C1002: hero_2001 | D1002: 0 | E1002: 0 | F1002: 1511,100;1513,100; | G1002: 5132,100;5126,100; | H1002: 2322*0.8 | I1002: 1111*0.5 | J1002: 516 | K1002: 398 | L1002: 197*2 | M1002: 1000*LV+100000 | N1002: 0 | O1002: math.max(0,(lv/5)-1) | P1002: math.max(0,(lv/5)-1) | Q1002: math.max(0,(lv/5)-1) | R1002: 0; | S1002: 有药王谷和盘丝洞的弟子在，真是不爽，还是跑路算了！ | T1002: 药王谷和盘丝洞的弟子不在眼前，真是轻松愉快啊！ | U1002: 0 | V1002: 0,0; | W1002: 5
A1003: 11353 | B1003: 仙鹤童子 | C1003: pet_33 | D1003: 0 | E1003: 0 | F1003: 1212,100;1211,100; | G1003: 5138,100;5131,100; | H1003: 2322*1.2 | I1003: 1111*0.5 | J1003: 516*1.2 | K1003: 398*0.5 | L1003: 197*1.5 | M1003: 1000*LV+100000 | N1003: 0 | O1003: math.max(0,(lv/5)-1) | P1003: math.max(0,(lv/5)-1) | Q1003: math.max(0,(lv/5)-1) | R1003: 0; | S1003: 有药王谷和盘丝洞的弟子在，真是不爽，还是跑路算了！ | T1003: 药王谷和盘丝洞的弟子不在眼前，真是轻松愉快啊！ | U1003: 0 | V1003: 0,0; | W1003: 3
A1004: 11361 | B1004: 仙鹤童子 | C1004: pet_33 | D1004: 0 | E1004: 0 | F1004: 1212,100;1211,100; | G1004: 0,0; | H1004: 2367*1.2 | I1004: 1131*0.5 | J1004: 526*1.2 | K1004: 405*0.5 | L1004: 200*1.5 | M1004: 1000*LV+100000 | N1004: 0 | O1004: math.max(0,(lv/10)-1) | P1004: math.max(0,(lv/10)-1) | Q1004: math.max(0,(lv/10)-1) | R1004: 0; | S1004: 有药王谷和盘丝洞的弟子在，真是不爽，还是跑路算了！ | T1004: 药王谷和盘丝洞的弟子不在眼前，真是轻松愉快啊！ | U1004: 0 | V1004: 0,0; | W1004: 3
A1005: 11362 | B1005: 魔女 | C1005: pet_53 | D1005: 0 | E1005: 0 | F1005: 1511,100;1513,100; | G1005: 0,0; | H1005: 2367*0.8 | I1005: 1131*0.5 | J1005: 526 | K1005: 405 | L1005: 200*2 | M1005: 1000*LV+100000 | N1005: 0 | O1005: math.max(0,(lv/10)-1) | P1005: math.max(0,(lv/10)-1) | Q1005: math.max(0,(lv/10)-1) | R1005: 0; | S1005: 有药王谷和盘丝洞的弟子在，真是不爽，还是跑路算了！ | T1005: 药王谷和盘丝洞的弟子不在眼前，真是轻松愉快啊！ | U1005: 0 | V1005: 0,0; | W1005: 5
A1006: 11363 | B1006: 阴阳师 | C1006: pet_52 | D1006: 0 | E1006: 0 | F1006: 1411,100;1412,100; | G1006: 0,0; | H1006: 2367 | I1006: 1131*0.5 | J1006: 526*0.8 | K1006: 405*1.5 | L1006: 200*0.8 | M1006: 1000*LV+100000 | N1006: 0 | O1006: math.max(0,(lv/10)-1) | P1006: math.max(0,(lv/10)-1) | Q1006: math.max(0,(lv/10)-1) | R1006: 0; | S1006: 有药王谷和盘丝洞的弟子在，真是不爽，还是跑路算了！ | T1006: 药王谷和盘丝洞的弟子不在眼前，真是轻松愉快啊！ | U1006: 0 | V1006: 0,0; | W1006: 2
A1007: 11364 | B1007: 剑灵 | C1007: pet_21 | D1007: 0 | E1007: 0 | F1007: 5309,100; | G1007: 0,0; | H1007: 2367 | I1007: 1131 | J1007: 526 | K1007: 405*0.5 | L1007: 200*1.2 | M1007: 1000*LV+100000 | N1007: 0 | O1007: math.max(0,(lv/10)-1) | P1007: math.max(0,(lv/10)-1) | Q1007: math.max(0,(lv/10)-1) | R1007: 0; | S1007: 有药王谷和盘丝洞的弟子在，真是不爽，还是跑路算了！ | T1007: 药王谷和盘丝洞的弟子不在眼前，真是轻松愉快啊！ | U1007: 0 | V1007: 0,0; | W1007: 2
A1008: 11371 | B1008: 兽王弟子 | C1008: hero_1001 | D1008: 0 | E1008: 0 | F1008: 1312,100;1315,100; | G1008: 0,0; | H1008: 2380 | I1008: 1138 | J1008: 528 | K1008: 408*0.5 | L1008: 201*1.2 | M1008: 1000*LV+100000 | N1008: 0 | O1008: math.max(0,(lv/10)-1) | P1008: math.max(0,(lv/10)-1) | Q1008: math.max(0,(lv/10)-1) | R1008: 0; | S1008: 有药王谷和盘丝洞的弟子在，真是不爽，还是跑路算了！ | T1008: 药王谷和盘丝洞的弟子不在眼前，真是轻松愉快啊！ | U1008: 0 | V1008: 0,0; | W1008: 4
A1009: 11372 | B1009: 剑灵 | C1009: pet_21 | D1009: 0 | E1009: 0 | F1009: 5309,100; | G1009: 0,0; | H1009: 2380 | I1009: 1138 | J1009: 528 | K1009: 408*0.5 | L1009: 201*1.2 | M1009: 1000*LV+100000 | N1009: 0 | O1009: math.max(0,(lv/10)-1) | P1009: math.max(0,(lv/10)-1) | Q1009: math.max(0,(lv/10)-1) | R1009: 0; | S1009: 有药王谷和盘丝洞的弟子在，真是不爽，还是跑路算了！ | T1009: 药王谷和盘丝洞的弟子不在眼前，真是轻松愉快啊！ | U1009: 0 | V1009: 0,0; | W1009: 2
A1010: 11381 | B1010: 水晶宫弟子 | C1010: hero_1001 | D1010: 0 | E1010: 0 | F1010: 1411,100;1412,100; | G1010: 0,0; | H1010: 2389 | I1010: 1145*0.5 | J1010: 531*0.8 | K1010: 413*1.5 | L1010: 203*0.8 | M1010: 1000*LV+100000 | N1010: 0 | O1010: math.max(0,(lv/10)-1) | P1010: math.max(0,(lv/10)-1) | Q1010: math.max(0,(lv/10)-1) | R1010: 0; | S1010: 有药王谷和盘丝洞的弟子在，真是不爽，还是跑路算了！ | T1010: 药王谷和盘丝洞的弟子不在眼前，真是轻松愉快啊！ | U1010: 0 | V1010: 0,0; | W1010: 2
A1011: 11382 | B1011: 天策府弟子 | C1011: hero_1001 | D1011: 0 | E1011: 0 | F1011: 1112,100;1111,100; | G1011: 0,0; | H1011: 2389 | I1011: 1145 | J1011: 531 | K1011: 413*0.5 | L1011: 203*1.2 | M1011: 1000*LV+100000 | N1011: 0 | O1011: math.max(0,(lv/10)-1) | P1011: math.max(0,(lv/10)-1) | Q1011: math.max(0,(lv/10)-1) | R1011: 0; | S1011: 有药王谷和盘丝洞的弟子在，真是不爽，还是跑路算了！ | T1011: 药王谷和盘丝洞的弟子不在眼前，真是轻松愉快啊！ | U1011: 0 | V1011: 0,0; | W1011: 1
A1012: 11383 | B1012: 水晶宫外门弟子 | C1012: hero_2001 | D1012: 0 | E1012: 0 | F1012: 5309,100; | G1012: 5103,100; | H1012: 2389 | I1012: 1145 | J1012: 531 | K1012: 413*0.5 | L1012: 203*1.2 | M1012: 1000*LV+100000 | N1012: 0 | O1012: math.max(0,(lv/10)-1) | P1012: math.max(0,(lv/10)-1) | Q1012: math.max(0,(lv/10)-1) | R1012: 0; | S1012: 有药王谷和盘丝洞的弟子在，真是不爽，还是跑路算了！ | T1012: 药王谷和盘丝洞的弟子不在眼前，真是轻松愉快啊！ | U1012: 0 | V1012: 0,0; | W1012: 5
A1013: 11391 | B1013: 兽王弟子 | C1013: hero_1001 | D1013: 0 | E1013: 0 | F1013: 1312,100;1315,100; | G1013: 5103,100;5108,100; | H1013: 2403 | I1013: 1152 | J1013: 533 | K1013: 416*0.5 | L1013: 204*1.2 | M1013: 1000*LV+100000 | N1013: 0 | O1013: math.max(0,(lv/10)-1) | P1013: math.max(0,(lv/10)-1) | Q1013: math.max(0,(lv/10)-1) | R1013: 0; | S1013: 有药王谷和盘丝洞的弟子在，真是不爽，还是跑路算了！ | T1013: 药王谷和盘丝洞的弟子不在眼前，真是轻松愉快啊！ | U1013: 0 | V1013: 0,0; | W1013: 4
A1014: 11392 | B1014: 熊猫武师 | C1014: pet_13 | D1014: 0 | E1014: 0 | F1014: 1311,100;1315,100;1312,100; | G1014: 5103,100;5108,100; | H1014: 2403 | I1014: 1152 | J1014: 533 | K1014: 416*0.5 | L1014: 204*1.2 | M1014: 1000*LV+100000 | N1014: 0 | O1014: math.max(0,(lv/10)-1) | P1014: math.max(0,(lv/10)-1) | Q1014: math.max(0,(lv/10)-1) | R1014: 0; | S1014: 有药王谷和盘丝洞的弟子在，真是不爽，还是跑路算了！ | T1014: 药王谷和盘丝洞的弟子不在眼前，真是轻松愉快啊！ | U1014: 0 | V1014: 0,0; | W1014: 4
A1015: 11401 | B1015: 熊猫武师 | C1015: pet_13 | D1015: 0 | E1015: 0 | F1015: 1311,100;1315,100;1312,100; | G1015: 5103,100;5108,100; | H1015: 2416 | I1015: 1159 | J1015: 536 | K1015: 419*0.5 | L1015: 206*1.2 | M1015: 1000*LV+100000 | N1015: 0 | O1015: math.max(0,(lv/5)-1) | P1015: math.max(0,(lv/5)-1) | Q1015: math.max(0,(lv/5)-1) | R1015: 0; | S1015: 有药王谷和盘丝洞的弟子在，真是不爽，还是跑路算了！ | T1015: 药王谷和盘丝洞的弟子不在眼前，真是轻松愉快啊！ | U1015: 0 | V1015: 0,0; | W1015: 4
A1016: 11402 | B1016: 魔女 | C1016: pet_53 | D1016: 0 | E1016: 0 | F1016: 1511,100;1513,100; | G1016: 5132,100;5126,100; | H1016: 2416*0.8 | I1016: 1159*0.5 | J1016: 536 | K1016: 419 | L1016: 206*2 | M1016: 1000*LV+100000 | N1016: 0 | O1016: math.max(0,(lv/5)-1) | P1016: math.max(0,(lv/5)-1) | Q1016: math.max(0,(lv/5)-1) | R1016: 0; | S1016: 有药王谷和盘丝洞的弟子在，真是不爽，还是跑路算了！ | T1016: 药王谷和盘丝洞的弟子不在眼前，真是轻松愉快啊！ | U1016: 0 | V1016: 0,0; | W1016: 5
A1017: 11403 | B1017: 帮凶 | C1017: pet_43 | D1017: 0 | E1017: 0 | F1017: 1112,100;1111,100; | G1017: 5205,100;5123,100; | H1017: 2416 | I1017: 1159 | J1017: 536 | K1017: 419*0.5 | L1017: 206*1.2 | M1017: 1000*LV+100000 | N1017: 0 | O1017: math.max(0,(lv/5)-1) | P1017: math.max(0,(lv/5)-1) | Q1017: math.max(0,(lv/5)-1) | R1017: 0; | S1017: 有药王谷和盘丝洞的弟子在，真是不爽，还是跑路算了！ | T1017: 药王谷和盘丝洞的弟子不在眼前，真是轻松愉快啊！ | U1017: 0 | V1017: 0,0; | W1017: 1
A1018: 11404 | B1018: 熊猫武师 | C1018: pet_13 | D1018: 0 | E1018: 0 | F1018: 1311,100;1315,100;1312,100; | G1018: 5103,100;5108,100; | H1018: 2416 | I1018: 1159 | J1018: 536 | K1018: 419*0.5 | L1018: 206*1.2 | M1018: 1000*LV+100000 | N1018: 0 | O1018: math.max(0,(lv/5)-1) | P1018: math.max(0,(lv/5)-1) | Q1018: math.max(0,(lv/5)-1) | R1018: 0; | S1018: 有药王谷和盘丝洞的弟子在，真是不爽，还是跑路算了！ | T1018: 药王谷和盘丝洞的弟子不在眼前，真是轻松愉快啊！ | U1018: 0 | V1018: 0,0; | W1018: 4
A1019: 11411 | B1019: 水晶宫弟子 | C1019: hero_1001 | D1019: 0 | E1019: 0 | F1019: 1411,100;1412,100; | G1019: 0,0; | H1019: 2279 | I1019: 1224*0.5 | J1019: 590*0.8 | K1019: 451*1.5 | L1019: 220*0.8 | M1019: 1000*LV+100000 | N1019: 0 | O1019: math.max(0,(lv/10)-1) | P1019: math.max(0,(lv/10)-1) | Q1019: math.max(0,(lv/10)-1) | R1019: 0; | S1019: 有药王谷和盘丝洞的弟子在，真是不爽，还是跑路算了！ | T1019: 药王谷和盘丝洞的弟子不在眼前，真是轻松愉快啊！ | U1019: 0 | V1019: 0,0; | W1019: 2
A1020: 11412 | B1020: 药王谷弟子 | C1020: hero_1001 | D1020: 0 | E1020: 0 | F1020: 1212,100;1211,100; | G1020: 0,0; | H1020: 2279*1.2 | I1020: 1224*0.5 | J1020: 590*1.2 | K1020: 451*0.5 | L1020: 220*1.5 | M1020: 1000*LV+100000 | N1020: 0 | O1020: math.max(0,(lv/10)-1) | P1020: math.max(0,(lv/10)-1) | Q1020: math.max(0,(lv/10)-1) | R1020: 0; | S1020: 有药王谷和盘丝洞的弟子在，真是不爽，还是跑路算了！ | T1020: 药王谷和盘丝洞的弟子不在眼前，真是轻松愉快啊！ | U1020: 0 | V1020: 0,0; | W1020: 3
A1021: 11413 | B1021: 药王谷外门弟子 | C1021: hero_2001 | D1021: 0 | E1021: 0 | F1021: 5305,100; | G1021: 0,0; | H1021: 2279 | I1021: 1224*0.5 | J1021: 590*0.8 | K1021: 451*1.5 | L1021: 220*0.8 | M1021: 1000*LV+100000 | N1021: 0 | O1021: math.max(0,(lv/10)-1) | P1021: math.max(0,(lv/10)-1) | Q1021: math.max(0,(lv/10)-1) | R1021: 0; | S1021: 有药王谷和盘丝洞的弟子在，真是不爽，还是跑路算了！ | T1021: 药王谷和盘丝洞的弟子不在眼前，真是轻松愉快啊！ | U1021: 0 | V1021: 0,0; | W1021: 1
A1022: 11414 | B1022: 药王谷外门弟子 | C1022: hero_2001 | D1022: 0 | E1022: 0 | F1022: 5305,100; | G1022: 0,0; | H1022: 2279 | I1022: 1224*0.5 | J1022: 590*0.8 | K1022: 451*1.5 | L1022: 220*0.8 | M1022: 1000*LV+100000 | N1022: 0 | O1022: math.max(0,(lv/10)-1) | P1022: math.max(0,(lv/10)-1) | Q1022: math.max(0,(lv/10)-1) | R1022: 0; | S1022: 有药王谷和盘丝洞的弟子在，真是不爽，还是跑路算了！ | T1022: 药王谷和盘丝洞的弟子不在眼前，真是轻松愉快啊！ | U1022: 0 | V1022: 0,0; | W1022: 2
A1023: 11421 | B1023: 水晶宫弟子 | C1023: hero_1001 | D1023: 0 | E1023: 0 | F1023: 1411,100;1412,100; | G1023: 0,0; | H1023: 2291 | I1023: 1231*0.5 | J1023: 593*0.8 | K1023: 454*1.5 | L1023: 221*0.8 | M1023: 1000*LV+100000 | N1023: 0 | O1023: math.max(0,(lv/10)-1) | P1023: math.max(0,(lv/10)-1) | Q1023: math.max(0,(lv/10)-1) | R1023: 0; | S1023: 有药王谷和盘丝洞的弟子在，真是不爽，还是跑路算了！ | T1023: 药王谷和盘丝洞的弟子不在眼前，真是轻松愉快啊！ | U1023: 0 | V1023: 0,0; | W1023: 2
A1024: 11422 | B1024: 天策府弟子 | C1024: hero_1001 | D1024: 0 | E1024: 0 | F1024: 1112,100;1111,100; | G1024: 0,0; | H1024: 2291 | I1024: 1231 | J1024: 593 | K1024: 454*0.5 | L1024: 221*1.2 | M1024: 1000*LV+100000 | N1024: 0 | O1024: math.max(0,(lv/10)-1) | P1024: math.max(0,(lv/10)-1) | Q1024: math.max(0,(lv/10)-1) | R1024: 0; | S1024: 有药王谷和盘丝洞的弟子在，真是不爽，还是跑路算了！ | T1024: 药王谷和盘丝洞的弟子不在眼前，真是轻松愉快啊！ | U1024: 0 | V1024: 0,0; | W1024: 1
A1025: 11423 | B1025: 水晶宫外门弟子 | C1025: hero_2001 | D1025: 0 | E1025: 0 | F1025: 5309,100; | G1025: 5103,100; | H1025: 2291 | I1025: 1231 | J1025: 593 | K1025: 454*0.5 | L1025: 221*1.2 | M1025: 1000*LV+100000 | N1025: 0 | O1025: math.max(0,(lv/10)-1) | P1025: math.max(0,(lv/10)-1) | Q1025: math.max(0,(lv/10)-1) | R1025: 0; | S1025: 有药王谷和盘丝洞的弟子在，真是不爽，还是跑路算了！ | T1025: 药王谷和盘丝洞的弟子不在眼前，真是轻松愉快啊！ | U1025: 0 | V1025: 0,0; | W1025: 5
A1026: 11431 | B1026: 水晶宫弟子 | C1026: hero_1001 | D1026: 0 | E1026: 0 | F1026: 1411,100;1412,100; | G1026: 0,0; | H1026: 2298 | I1026: 1238*0.5 | J1026: 596*0.8 | K1026: 458*1.5 | L1026: 223*0.8 | M1026: 1000*LV+100000 | N1026: 0 | O1026: math.max(0,(lv/10)-1) | P1026: math.max(0,(lv/10)-1) | Q1026: math.max(0,(lv/10)-1) | R1026: 0; | S1026: 有药王谷和盘丝洞的弟子在，真是不爽，还是跑路算了！ | T1026: 药王谷和盘丝洞的弟子不在眼前，真是轻松愉快啊！ | U1026: 0 | V1026: 0,0; | W1026: 2
A1027: 11432 | B1027: 仙鹤童子 | C1027: pet_33 | D1027: 0 | E1027: 0 | F1027: 1212,100;1211,100; | G1027: 0,0; | H1027: 2298*1.2 | I1027: 1238*0.5 | J1027: 596*1.2 | K1027: 458*0.5 | L1027: 223*1.5 | M1027: 1000*LV+100000 | N1027: 0 | O1027: math.max(0,(lv/10)-1) | P1027: math.max(0,(lv/10)-1) | Q1027: math.max(0,(lv/10)-1) | R1027: 0; | S1027: 有药王谷和盘丝洞的弟子在，真是不爽，还是跑路算了！ | T1027: 药王谷和盘丝洞的弟子不在眼前，真是轻松愉快啊！ | U1027: 0 | V1027: 0,0; | W1027: 3
A1028: 11433 | B1028: 熊猫武师 | C1028: pet_13 | D1028: 0 | E1028: 0 | F1028: 1311,100;1315,100;1312,100; | G1028: 0,0; | H1028: 2298 | I1028: 1238 | J1028: 596 | K1028: 458*0.5 | L1028: 223*1.2 | M1028: 1000*LV+100000 | N1028: 0 | O1028: math.max(0,(lv/10)-1) | P1028: math.max(0,(lv/10)-1) | Q1028: math.max(0,(lv/10)-1) | R1028: 0; | S1028: 有药王谷和盘丝洞的弟子在，真是不爽，还是跑路算了！ | T1028: 药王谷和盘丝洞的弟子不在眼前，真是轻松愉快啊！ | U1028: 0 | V1028: 0,0; | W1028: 4
A1029: 11441 | B1029: 熊猫武师 | C1029: pet_13 | D1029: 0 | E1029: 0 | F1029: 1311,100;1315,100;1312,100; | G1029: 5103,100;5108,100; | H1029: 2310 | I1029: 1244 | J1029: 598 | K1029: 462*0.5 | L1029: 224*1.2 | M1029: 1000*LV+100000 | N1029: 0 | O1029: math.max(0,(lv/10)-1) | P1029: math.max(0,(lv/10)-1) | Q1029: math.max(0,(lv/10)-1) | R1029: 0; | S1029: 有药王谷和盘丝洞的弟子在，真是不爽，还是跑路算了！ | T1029: 药王谷和盘丝洞的弟子不在眼前，真是轻松愉快啊！ | U1029: 0 | V1029: 0,0; | W1029: 4
A1030: 11442 | B1030: 仙鹤童子 | C1030: pet_33 | D1030: 0 | E1030: 0 | F1030: 1212,100;1211,100; | G1030: 5138,100;5131,100; | H1030: 2310*1.2 | I1030: 1244*0.5 | J1030: 598*1.2 | K1030: 462*0.5 | L1030: 224*1.5 | M1030: 1000*LV+100000 | N1030: 0 | O1030: math.max(0,(lv/10)-1) | P1030: math.max(0,(lv/10)-1) | Q1030: math.max(0,(lv/10)-1) | R1030: 0; | S1030: 有药王谷和盘丝洞的弟子在，真是不爽，还是跑路算了！ | T1030: 药王谷和盘丝洞的弟子不在眼前，真是轻松愉快啊！ | U1030: 0 | V1030: 0,0; | W1030: 3
A1031: 11443 | B1031: 魔女 | C1031: pet_53 | D1031: 0 | E1031: 0 | F1031: 1511,100;1513,100; | G1031: 5132,100;5126,100; | H1031: 2310*0.8 | I1031: 1244*0.5 | J1031: 598 | K1031: 462 | L1031: 224*2 | M1031: 1000*LV+100000 | N1031: 0 | O1031: math.max(0,(lv/10)-1) | P1031: math.max(0,(lv/10)-1) | Q1031: math.max(0,(lv/10)-1) | R1031: 0; | S1031: 有药王谷和盘丝洞的弟子在，真是不爽，还是跑路算了！ | T1031: 药王谷和盘丝洞的弟子不在眼前，真是轻松愉快啊！ | U1031: 0 | V1031: 0,0; | W1031: 5
A1032: 11451 | B1032: 兽王弟子 | C1032: hero_1001 | D1032: 0 | E1032: 0 | F1032: 1312,100;1315,100; | G1032: 5103,100;5108,100; | H1032: 2322 | I1032: 1251 | J1032: 601 | K1032: 465*0.5 | L1032: 226*1.2 | M1032: 1000*LV+100000 | N1032: 0 | O1032: math.max(0,(lv/5)-1) | P1032: math.max(0,(lv/5)-1) | Q1032: math.max(0,(lv/5)-1) | R1032: 0; | S1032: 有药王谷和盘丝洞的弟子在，真是不爽，还是跑路算了！ | T1032: 药王谷和盘丝洞的弟子不在眼前，真是轻松愉快啊！ | U1032: 0 | V1032: 0,0; | W1032: 4
A1033: 11452 | B1033: 魔女 | C1033: pet_53 | D1033: 0 | E1033: 0 | F1033: 1511,100;1513,100; | G1033: 5132,100;5126,100; | H1033: 2322*0.8 | I1033: 1251*0.5 | J1033: 601 | K1033: 465 | L1033: 226*2 | M1033: 1000*LV+100000 | N1033: 0 | O1033: math.max(0,(lv/5)-1) | P1033: math.max(0,(lv/5)-1) | Q1033: math.max(0,(lv/5)-1) | R1033: 0; | S1033: 有药王谷和盘丝洞的弟子在，真是不爽，还是跑路算了！ | T1033: 药王谷和盘丝洞的弟子不在眼前，真是轻松愉快啊！ | U1033: 0 | V1033: 0,0; | W1033: 5
A1034: 11461 | B1034: 帮凶 | C1034: pet_43 | D1034: 0 | E1034: 0 | F1034: 1112,100;1111,100; | G1034: 0,0; | H1034: 2364 | I1034: 1273 | J1034: 612 | K1034: 473*0.5 | L1034: 229*1.2 | M1034: 1000*LV+100000 | N1034: 0 | O1034: math.max(0,(lv/10)-1) | P1034: math.max(0,(lv/10)-1) | Q1034: math.max(0,(lv/10)-1) | R1034: 0; | S1034: 有药王谷和盘丝洞的弟子在，真是不爽，还是跑路算了！ | T1034: 药王谷和盘丝洞的弟子不在眼前，真是轻松愉快啊！ | U1034: 0 | V1034: 0,0; | W1034: 1
A1035: 11462 | B1035: 仙鹤童子 | C1035: pet_33 | D1035: 0 | E1035: 0 | F1035: 1212,100;1211,100; | G1035: 0,0; | H1035: 2364*1.2 | I1035: 1273*0.5 | J1035: 612*1.2 | K1035: 473*0.5 | L1035: 229*1.5 | M1035: 1000*LV+100000 | N1035: 0 | O1035: math.max(0,(lv/10)-1) | P1035: math.max(0,(lv/10)-1) | Q1035: math.max(0,(lv/10)-1) | R1035: 0; | S1035: 有药王谷和盘丝洞的弟子在，真是不爽，还是跑路算了！ | T1035: 药王谷和盘丝洞的弟子不在眼前，真是轻松愉快啊！ | U1035: 0 | V1035: 0,0; | W1035: 3
A1036: 11471 | B1036: 阴阳师 | C1036: pet_52 | D1036: 0 | E1036: 0 | F1036: 1411,100;1412,100; | G1036: 0,0; | H1036: 2376 | I1036: 1280*0.5 | J1036: 615*0.8 | K1036: 476*1.5 | L1036: 231*0.8 | M1036: 1000*LV+100000 | N1036: 0 | O1036: math.max(0,(lv/10)-1) | P1036: math.max(0,(lv/10)-1) | Q1036: math.max(0,(lv/10)-1) | R1036: 0; | S1036: 有药王谷和盘丝洞的弟子在，真是不爽，还是跑路算了！ | T1036: 药王谷和盘丝洞的弟子不在眼前，真是轻松愉快啊！ | U1036: 0 | V1036: 0,0; | W1036: 2
A1037: 11472 | B1037: 魔女 | C1037: pet_53 | D1037: 0 | E1037: 0 | F1037: 1511,100;1513,100; | G1037: 0,0; | H1037: 2376*0.8 | I1037: 1280*0.5 | J1037: 615 | K1037: 476 | L1037: 231*2 | M1037: 1000*LV+100000 | N1037: 0 | O1037: math.max(0,(lv/10)-1) | P1037: math.max(0,(lv/10)-1) | Q1037: math.max(0,(lv/10)-1) | R1037: 0; | S1037: 有药王谷和盘丝洞的弟子在，真是不爽，还是跑路算了！ | T1037: 药王谷和盘丝洞的弟子不在眼前，真是轻松愉快啊！ | U1037: 0 | V1037: 0,0; | W1037: 5
A1038: 11473 | B1038: 蛤蟆精 | C1038: pet_3 | D1038: 0 | E1038: 0 | F1038: 0,0; | G1038: 5123,100;5225,100;5104,100;5202,100; | H1038: 2376 | I1038: 1280 | J1038: 615 | K1038: 476*0.5 | L1038: 231*1.2 | M1038: 1000*LV+100000 | N1038: 0 | O1038: math.max(0,(lv/10)-1) | P1038: math.max(0,(lv/10)-1) | Q1038: math.max(0,(lv/10)-1) | R1038: 0; | S1038: 有药王谷和盘丝洞的弟子在，真是不爽，还是跑路算了！ | T1038: 药王谷和盘丝洞的弟子不在眼前，真是轻松愉快啊！ | U1038: 0 | V1038: 0,0; | W1038: 1
A1039: 11481 | B1039: 盘丝弟子 | C1039: hero_2001 | D1039: 0 | E1039: 0 | F1039: 1511,100;1513,100; | G1039: 0,0; | H1039: 2383*0.8 | I1039: 1286*0.5 | J1039: 618 | K1039: 479 | L1039: 232*2 | M1039: 1000*LV+100000 | N1039: 0 | O1039: math.max(0,(lv/10)-1) | P1039: math.max(0,(lv/10)-1) | Q1039: math.max(0,(lv/10)-1) | R1039: 0; | S1039: 有药王谷和盘丝洞的弟子在，真是不爽，还是跑路算了！ | T1039: 药王谷和盘丝洞的弟子不在眼前，真是轻松愉快啊！ | U1039: 0 | V1039: 0,0; | W1039: 5
A1040: 11482 | B1040: 熊猫武师 | C1040: pet_13 | D1040: 0 | E1040: 0 | F1040: 1311,100;1315,100; | G1040: 0,0; | H1040: 2383 | I1040: 1286 | J1040: 618 | K1040: 479*0.5 | L1040: 232*1.2 | M1040: 1000*LV+100000 | N1040: 0 | O1040: math.max(0,(lv/10)-1) | P1040: math.max(0,(lv/10)-1) | Q1040: math.max(0,(lv/10)-1) | R1040: 0; | S1040: 有药王谷和盘丝洞的弟子在，真是不爽，还是跑路算了！ | T1040: 药王谷和盘丝洞的弟子不在眼前，真是轻松愉快啊！ | U1040: 0 | V1040: 0,0; | W1040: 4
A1041: 11483 | B1041: 剑灵 | C1041: pet_21 | D1041: 0 | E1041: 0 | F1041: 5309,100; | G1041: 0,0; | H1041: 2383 | I1041: 1286 | J1041: 618 | K1041: 479*0.5 | L1041: 232*1.2 | M1041: 1000*LV+100000 | N1041: 0 | O1041: math.max(0,(lv/10)-1) | P1041: math.max(0,(lv/10)-1) | Q1041: math.max(0,(lv/10)-1) | R1041: 0; | S1041: 有药王谷和盘丝洞的弟子在，真是不爽，还是跑路算了！ | T1041: 药王谷和盘丝洞的弟子不在眼前，真是轻松愉快啊！ | U1041: 0 | V1041: 0,0; | W1041: 4
A1042: 11491 | B1042: 兽王弟子 | C1042: hero_1001 | D1042: 0 | E1042: 0 | F1042: 1312,100;1315,100; | G1042: 5103,100;5108,100; | H1042: 2395 | I1042: 1293 | J1042: 620 | K1042: 484*0.5 | L1042: 234*1.2 | M1042: 1000*LV+100000 | N1042: 0 | O1042: math.max(0,(lv/10)-1) | P1042: math.max(0,(lv/10)-1) | Q1042: math.max(0,(lv/10)-1) | R1042: 0; | S1042: 有药王谷和盘丝洞的弟子在，真是不爽，还是跑路算了！ | T1042: 药王谷和盘丝洞的弟子不在眼前，真是轻松愉快啊！ | U1042: 0 | V1042: 0,0; | W1042: 4
A1043: 11492 | B1043: 魔女 | C1043: pet_53 | D1043: 0 | E1043: 0 | F1043: 1511,100;1513,100; | G1043: 5132,100;5126,100; | H1043: 2395*0.8 | I1043: 1293*0.5 | J1043: 620 | K1043: 484 | L1043: 234*2 | M1043: 1000*LV+100000 | N1043: 0 | O1043: math.max(0,(lv/10)-1) | P1043: math.max(0,(lv/10)-1) | Q1043: math.max(0,(lv/10)-1) | R1043: 0; | S1043: 有药王谷和盘丝洞的弟子在，真是不爽，还是跑路算了！ | T1043: 药王谷和盘丝洞的弟子不在眼前，真是轻松愉快啊！ | U1043: 0 | V1043: 0,0; | W1043: 5
A1044: 11493 | B1044: 帮凶 | C1044: pet_43 | D1044: 0 | E1044: 0 | F1044: 1112,100;1111,100; | G1044: 5205,100;5123,100; | H1044: 2395 | I1044: 1293 | J1044: 620 | K1044: 484*0.5 | L1044: 234*1.2 | M1044: 1000*LV+100000 | N1044: 0 | O1044: math.max(0,(lv/10)-1) | P1044: math.max(0,(lv/10)-1) | Q1044: math.max(0,(lv/10)-1) | R1044: 0; | S1044: 有药王谷和盘丝洞的弟子在，真是不爽，还是跑路算了！ | T1044: 药王谷和盘丝洞的弟子不在眼前，真是轻松愉快啊！ | U1044: 0 | V1044: 0,0; | W1044: 1
A1045: 11501 | B1045: 天策府弟子 | C1045: hero_1001 | D1045: 0 | E1045: 0 | F1045: 1112,100;1111,100; | G1045: 5103,100;5209,100;5101,100; | H1045: 2406 | I1045: 1301 | J1045: 623 | K1045: 486*0.5 | L1045: 236*1.2 | M1045: 1000*LV+100000 | N1045: 0 | O1045: math.max(0,(lv/5)-1) | P1045: math.max(0,(lv/5)-1) | Q1045: math.max(0,(lv/5)-1) | R1045: 0; | S1045: 有药王谷和盘丝洞的弟子在，真是不爽，还是跑路算了！ | T1045: 药王谷和盘丝洞的弟子不在眼前，真是轻松愉快啊！ | U1045: 0 | V1045: 0,0; | W1045: 1
A1046: 11502 | B1046: 盘丝弟子 | C1046: hero_2001 | D1046: 0 | E1046: 0 | F1046: 1511,100;1513,100; | G1046: 5210,100;5126,100;5131,100; | H1046: 2406*0.8 | I1046: 1301*0.5 | J1046: 623 | K1046: 486 | L1046: 236*2 | M1046: 1000*LV+100000 | N1046: 0 | O1046: math.max(0,(lv/5)-1) | P1046: math.max(0,(lv/5)-1) | Q1046: math.max(0,(lv/5)-1) | R1046: 0; | S1046: 有药王谷和盘丝洞的弟子在，真是不爽，还是跑路算了！ | T1046: 药王谷和盘丝洞的弟子不在眼前，真是轻松愉快啊！ | U1046: 0 | V1046: 0,0; | W1046: 5
A1047: 11503 | B1047: 剑灵 | C1047: pet_21 | D1047: 0 | E1047: 0 | F1047: 5309,100; | G1047: 5223,100;5124,100;5101,100; | H1047: 2406 | I1047: 1301 | J1047: 623 | K1047: 486*0.5 | L1047: 236*1.2 | M1047: 1000*LV+100000 | N1047: 0 | O1047: math.max(0,(lv/5)-1) | P1047: math.max(0,(lv/5)-1) | Q1047: math.max(0,(lv/5)-1) | R1047: 0; | S1047: 有药王谷和盘丝洞的弟子在，真是不爽，还是跑路算了！ | T1047: 药王谷和盘丝洞的弟子不在眼前，真是轻松愉快啊！ | U1047: 0 | V1047: 0,0; | W1047: 3
A1048: 12011 | B1048: 天策府弟子 | C1048: hero_1001 | D1048: 0 | E1048: 0 | F1048: 1112,100;1111,100; | G1048: 0,0; | H1048: 3800*1.5 | I1048: 1272-500 | J1048: 444 | K1048: 308*0.5 | L1048: 148*1.2 | M1048: 1000*LV+100000 | N1048: 0 | O1048: math.max(0,(lv/10)-1) | P1048: math.max(0,(lv/10)-1) | Q1048: math.max(0,(lv/10)-1) | R1048: 0; | S1048: 有药王谷和盘丝洞的弟子在，真是不爽，还是跑路算了！ | T1048: 药王谷和盘丝洞的弟子不在眼前，真是轻松愉快啊！ | U1048: 0 | V1048: 0,0; | W1048: 1
A1049: 12021 | B1049: 天策府弟子 | C1049: hero_1001 | D1049: 0 | E1049: 0 | F1049: 1112,100;1111,100; | G1049: 0,0; | H1049: 3815*1.5 | I1049: 1282-500 | J1049: 447 | K1049: 311*0.5 | L1049: 150*1.2 | M1049: 1000*LV+100000 | N1049: 0 | O1049: math.max(0,(lv/10)-1) | P1049: math.max(0,(lv/10)-1) | Q1049: math.max(0,(lv/10)-1) | R1049: 0; | S1049: 有药王谷和盘丝洞的弟子在，真是不爽，还是跑路算了！ | T1049: 药王谷和盘丝洞的弟子不在眼前，真是轻松愉快啊！ | U1049: 0 | V1049: 0,0; | W1049: 1
A1050: 12031 | B1050: 蛤蟆精 | C1050: pet_3 | D1050: 0 | E1050: 0 | F1050: 0,0; | G1050: 5123,100;5225,100;5104,100;5202,100; | H1050: 3830*1.5 | I1050: 1294-500 | J1050: 449 | K1050: 315*0.5 | L1050: 152*1.2 | M1050: 1000*LV+100000 | N1050: 0 | O1050: math.max(0,(lv/10)-1) | P1050: math.max(0,(lv/10)-1) | Q1050: math.max(0,(lv/10)-1) | R1050: 0; | S1050: 有药王谷和盘丝洞的弟子在，真是不爽，还是跑路算了！ | T1050: 药王谷和盘丝洞的弟子不在眼前，真是轻松愉快啊！ | U1050: 0 | V1050: 0,0; | W1050: 2
A1051: 12032 | B1051: 蛤蟆精 | C1051: pet_3 | D1051: 0 | E1051: 0 | F1051: 0,0; | G1051: 5123,100;5225,100;5104,100;5202,100; | H1051: 3830*1.5 | I1051: 1294-500 | J1051: 449 | K1051: 315*0.5 | L1051: 152*1.2 | M1051: 1000*LV+100000 | N1051: 0 | O1051: math.max(0,(lv/10)-1) | P1051: math.max(0,(lv/10)-1) | Q1051: math.max(0,(lv/10)-1) | R1051: 0; | S1051: 有药王谷和盘丝洞的弟子在，真是不爽，还是跑路算了！ | T1051: 药王谷和盘丝洞的弟子不在眼前，真是轻松愉快啊！ | U1051: 0 | V1051: 0,0; | W1051: 1
A1052: 12041 | B1052: 仙鹤童子 | C1052: pet_33 | D1052: 0 | E1052: 0 | F1052: 1212,100;1211,100; | G1052: 5138,100; | H1052: 3842*1.2*1.5 | I1052: 1125*0.5-500 | J1052: 452*1.2 | K1052: 318*0.5 | L1052: 153*1.5 | M1052: 1000*LV+100000 | N1052: 0 | O1052: math.max(0,(lv/10)-1) | P1052: math.max(0,(lv/10)-1) | Q1052: math.max(0,(lv/10)-1) | R1052: 0; | S1052: 有药王谷和盘丝洞的弟子在，真是不爽，还是跑路算了！ | T1052: 药王谷和盘丝洞的弟子不在眼前，真是轻松愉快啊！ | U1052: 0 | V1052: 0,0; | W1052: 3
A1053: 12042 | B1053: 帮凶 | C1053: pet_43 | D1053: 0 | E1053: 0 | F1053: 1112,100;1111,100; | G1053: 5101,100; | H1053: 3842*1.5 | I1053: 1125-500 | J1053: 452 | K1053: 318*0.5 | L1053: 153*1.2 | M1053: 1000*LV+100000 | N1053: 0 | O1053: math.max(0,(lv/10)-1) | P1053: math.max(0,(lv/10)-1) | Q1053: math.max(0,(lv/10)-1) | R1053: 0; | S1053: 有药王谷和盘丝洞的弟子在，真是不爽，还是跑路算了！ | T1053: 药王谷和盘丝洞的弟子不在眼前，真是轻松愉快啊！ | U1053: 0 | V1053: 0,0; | W1053: 1
A1054: 12051 | B1054: 仙鹤童子 | C1054: pet_33 | D1054: 0 | E1054: 0 | F1054: 1212,100;1211,100; | G1054: 5138,100; | H1054: 3867*1.2*1.5 | I1054: 1133*0.5-500 | J1054: 454*1.2 | K1054: 321*0.5 | L1054: 155*1.5 | M1054: 1000*LV+100000 | N1054: 0 | O1054: math.max(0,(lv/10)-1) | P1054: math.max(0,(lv/10)-1) | Q1054: math.max(0,(lv/10)-1) | R1054: 0; | S1054: 有药王谷和盘丝洞的弟子在，真是不爽，还是跑路算了！ | T1054: 药王谷和盘丝洞的弟子不在眼前，真是轻松愉快啊！ | U1054: 0 | V1054: 0,0; | W1054: 3
A1055: 12052 | B1055: 阴阳师 | C1055: pet_52 | D1055: 0 | E1055: 0 | F1055: 1411,100;1412,100; | G1055: 5121,100; | H1055: 3867*1.5 | I1055: 1133*0.5-500 | J1055: 454*0.8 | K1055: 321*1.5 | L1055: 155*0.8 | M1055: 1000*LV+100000 | N1055: 0 | O1055: math.max(0,(lv/10)-1) | P1055: math.max(0,(lv/10)-1) | Q1055: math.max(0,(lv/10)-1) | R1055: 0; | S1055: 有药王谷和盘丝洞的弟子在，真是不爽，还是跑路算了！ | T1055: 药王谷和盘丝洞的弟子不在眼前，真是轻松愉快啊！ | U1055: 0 | V1055: 0,0; | W1055: 2
A1056: 12053 | B1056: 帮凶 | C1056: pet_43 | D1056: 0 | E1056: 0 | F1056: 1112,100;1111,100; | G1056: 5101,100; | H1056: 3867*1.5 | I1056: 1133-500 | J1056: 454 | K1056: 321*0.5 | L1056: 155*1.2 | M1056: 1000*LV+100000 | N1056: 0 | O1056: math.max(0,(lv/10)-1) | P1056: math.max(0,(lv/10)-1) | Q1056: math.max(0,(lv/10)-1) | R1056: 0; | S1056: 有药王谷和盘丝洞的弟子在，真是不爽，还是跑路算了！ | T1056: 药王谷和盘丝洞的弟子不在眼前，真是轻松愉快啊！ | U1056: 0 | V1056: 0,0; | W1056: 1
A1057: 12061 | B1057: 水晶宫弟子 | C1057: hero_1001 | D1057: 0 | E1057: 0 | F1057: 1411,100;1412,100; | G1057: 0,0; | H1057: 3961*1.5 | I1057: 1161*0.5-500 | J1057: 466*0.8 | K1057: 329*1.5 | L1057: 157*0.8 | M1057: 1000*LV+100000 | N1057: 0 | O1057: math.max(0,(lv/10)-1) | P1057: math.max(0,(lv/10)-1) | Q1057: math.max(0,(lv/10)-1) | R1057: 0; | S1057: 有药王谷和盘丝洞的弟子在，真是不爽，还是跑路算了！ | T1057: 药王谷和盘丝洞的弟子不在眼前，真是轻松愉快啊！ | U1057: 0 | V1057: 0,0; | W1057: 2
A1058: 12062 | B1058: 水晶宫外门弟子 | C1058: hero_2001 | D1058: 0 | E1058: 0 | F1058: 5309,100; | G1058: 5103,100; | H1058: 3961*1.5 | I1058: 1161-500 | J1058: 466 | K1058: 329*0.5 | L1058: 157*1.2 | M1058: 1000*LV+100000 | N1058: 0 | O1058: math.max(0,(lv/10)-1) | P1058: math.max(0,(lv/10)-1) | Q1058: math.max(0,(lv/10)-1) | R1058: 0; | S1058: 有药王谷和盘丝洞的弟子在，真是不爽，还是跑路算了！ | T1058: 药王谷和盘丝洞的弟子不在眼前，真是轻松愉快啊！ | U1058: 0 | V1058: 0,0; | W1058: 5
A1059: 12071 | B1059: 阴阳师 | C1059: pet_52 | D1059: 0 | E1059: 0 | F1059: 1411,100;1412,100; | G1059: 0,0; | H1059: 3986*1.5 | I1059: 1170*0.5-500 | J1059: 468*0.8 | K1059: 332*1.5 | L1059: 159*0.8 | M1059: 1000*LV+100000 | N1059: 0 | O1059: math.max(0,(lv/10)-1) | P1059: math.max(0,(lv/10)-1) | Q1059: math.max(0,(lv/10)-1) | R1059: 0; | S1059: 有药王谷和盘丝洞的弟子在，真是不爽，还是跑路算了！ | T1059: 药王谷和盘丝洞的弟子不在眼前，真是轻松愉快啊！ | U1059: 0 | V1059: 0,0; | W1059: 2
A1060: 12072 | B1060: 蛤蟆精 | C1060: pet_3 | D1060: 0 | E1060: 0 | F1060: 0,0; | G1060: 5123,100;5225,100;5104,100;5202,100; | H1060: 3986*1.5 | I1060: 1170-500 | J1060: 468 | K1060: 332*0.5 | L1060: 159*1.2 | M1060: 1000*LV+100000 | N1060: 0 | O1060: math.max(0,(lv/10)-1) | P1060: math.max(0,(lv/10)-1) | Q1060: math.max(0,(lv/10)-1) | R1060: 0; | S1060: 有药王谷和盘丝洞的弟子在，真是不爽，还是跑路算了！ | T1060: 药王谷和盘丝洞的弟子不在眼前，真是轻松愉快啊！ | U1060: 0 | V1060: 0,0; | W1060: 5
A1061: 12081 | B1061: 水晶宫弟子 | C1061: hero_1001 | D1061: 0 | E1061: 0 | F1061: 1411,100;1412,100; | G1061: 0,0; | H1061: 4003*1.5 | I1061: 1179*0.5-500 | J1061: 471*0.8 | K1061: 335*1.5 | L1061: 160*0.8 | M1061: 1000*LV+100000 | N1061: 0 | O1061: math.max(0,(lv/10)-1) | P1061: math.max(0,(lv/10)-1) | Q1061: math.max(0,(lv/10)-1) | R1061: 0; | S1061: 有药王谷和盘丝洞的弟子在，真是不爽，还是跑路算了！ | T1061: 药王谷和盘丝洞的弟子不在眼前，真是轻松愉快啊！ | U1061: 0 | V1061: 0,0; | W1061: 2
A1062: 12082 | B1062: 药王谷弟子 | C1062: hero_1001 | D1062: 0 | E1062: 0 | F1062: 1212,100;1211,100; | G1062: 0,0; | H1062: 4003*1.2*1.5 | I1062: 1179*0.5-500 | J1062: 471*1.2 | K1062: 335*0.5 | L1062: 160*1.5 | M1062: 1000*LV+100000 | N1062: 0 | O1062: math.max(0,(lv/10)-1) | P1062: math.max(0,(lv/10)-1) | Q1062: math.max(0,(lv/10)-1) | R1062: 0; | S1062: 有药王谷和盘丝洞的弟子在，真是不爽，还是跑路算了！ | T1062: 药王谷和盘丝洞的弟子不在眼前，真是轻松愉快啊！ | U1062: 0 | V1062: 0,0; | W1062: 3
A1063: 12083 | B1063: 水晶宫弟子 | C1063: hero_1001 | D1063: 0 | E1063: 0 | F1063: 1411,100;1412,100; | G1063: 0,0; | H1063: 4003*1.5 | I1063: 1179*0.5-500 | J1063: 471*0.8 | K1063: 335*1.5 | L1063: 160*0.8 | M1063: 1000*LV+100000 | N1063: 0 | O1063: math.max(0,(lv/10)-1) | P1063: math.max(0,(lv/10)-1) | Q1063: math.max(0,(lv/10)-1) | R1063: 0; | S1063: 有药王谷和盘丝洞的弟子在，真是不爽，还是跑路算了！ | T1063: 药王谷和盘丝洞的弟子不在眼前，真是轻松愉快啊！ | U1063: 0 | V1063: 0,0; | W1063: 2
A1064: 12091 | B1064: 熊猫武师 | C1064: pet_13 | D1064: 0 | E1064: 0 | F1064: 1311,100;1315,100;1312,100; | G1064: 5101,100; | H1064: 4020*1.5 | I1064: 1188-500 | J1064: 473 | K1064: 338*0.5 | L1064: 162*1.2 | M1064: 1000*LV+100000 | N1064: 0 | O1064: math.max(0,(lv/10)-1) | P1064: math.max(0,(lv/10)-1) | Q1064: math.max(0,(lv/10)-1) | R1064: 0; | S1064: 有药王谷和盘丝洞的弟子在，真是不爽，还是跑路算了！ | T1064: 药王谷和盘丝洞的弟子不在眼前，真是轻松愉快啊！ | U1064: 0 | V1064: 0,0; | W1064: 4
A1065: 12092 | B1065: 仙鹤童子 | C1065: pet_33 | D1065: 0 | E1065: 0 | F1065: 1212,100;1211,100; | G1065: 5138,100; | H1065: 4020*1.2*1.5 | I1065: 1188*0.5-500 | J1065: 473*1.2 | K1065: 338*0.5 | L1065: 162*1.5 | M1065: 1000*LV+100000 | N1065: 0 | O1065: math.max(0,(lv/10)-1) | P1065: math.max(0,(lv/10)-1) | Q1065: math.max(0,(lv/10)-1) | R1065: 0; | S1065: 有药王谷和盘丝洞的弟子在，真是不爽，还是跑路算了！ | T1065: 药王谷和盘丝洞的弟子不在眼前，真是轻松愉快啊！ | U1065: 0 | V1065: 0,0; | W1065: 3
A1066: 12093 | B1066: 熊猫武师 | C1066: pet_13 | D1066: 0 | E1066: 0 | F1066: 1311,100;1315,100;1312,100; | G1066: 5101,100; | H1066: 4020*1.5 | I1066: 1188-500 | J1066: 473 | K1066: 338*0.5 | L1066: 162*1.2 | M1066: 1000*LV+100000 | N1066: 0 | O1066: math.max(0,(lv/10)-1) | P1066: math.max(0,(lv/10)-1) | Q1066: math.max(0,(lv/10)-1) | R1066: 0; | S1066: 有药王谷和盘丝洞的弟子在，真是不爽，还是跑路算了！ | T1066: 药王谷和盘丝洞的弟子不在眼前，真是轻松愉快啊！ | U1066: 0 | V1066: 0,0; | W1066: 4
A1067: 12101 | B1067: 盘丝弟子 | C1067: hero_2001 | D1067: 0 | E1067: 0 | F1067: 1511,100;1513,100; | G1067: 5110,100; | H1067: 4046*0.8*1.5 | I1067: 1198*0.5-500 | J1067: 476 | K1067: 341 | L1067: 164*2 | M1067: 1000*LV+100000 | N1067: 0 | O1067: math.max(0,(lv/10)-1) | P1067: math.max(0,(lv/10)-1) | Q1067: math.max(0,(lv/10)-1) | R1067: 0; | S1067: 有药王谷和盘丝洞的弟子在，真是不爽，还是跑路算了！ | T1067: 药王谷和盘丝洞的弟子不在眼前，真是轻松愉快啊！ | U1067: 0 | V1067: 0,0; | W1067: 5
A1068: 12102 | B1068: 兽王弟子 | C1068: hero_1001 | D1068: 0 | E1068: 0 | F1068: 1312,100;1315,100; | G1068: 5103,100; | H1068: 4046*1.5 | I1068: 1198-500 | J1068: 476 | K1068: 341*0.5 | L1068: 164*1.2 | M1068: 1000*LV+100000 | N1068: 0 | O1068: math.max(0,(lv/10)-1) | P1068: math.max(0,(lv/10)-1) | Q1068: math.max(0,(lv/10)-1) | R1068: 0; | S1068: 有药王谷和盘丝洞的弟子在，真是不爽，还是跑路算了！ | T1068: 药王谷和盘丝洞的弟子不在眼前，真是轻松愉快啊！ | U1068: 0 | V1068: 0,0; | W1068: 4
A1069: 12103 | B1069: 兽王弟子 | C1069: hero_1001 | D1069: 0 | E1069: 0 | F1069: 1312,100;1315,100; | G1069: 5103,100; | H1069: 4046*1.5 | I1069: 1198-500 | J1069: 476 | K1069: 341*0.5 | L1069: 164*1.2 | M1069: 1000*LV+100000 | N1069: 0 | O1069: math.max(0,(lv/10)-1) | P1069: math.max(0,(lv/10)-1) | Q1069: math.max(0,(lv/10)-1) | R1069: 0; | S1069: 有药王谷和盘丝洞的弟子在，真是不爽，还是跑路算了！ | T1069: 药王谷和盘丝洞的弟子不在眼前，真是轻松愉快啊！ | U1069: 0 | V1069: 0,0; | W1069: 4
A1070: 12111 | B1070: 爱慕者 | C1070: hero_1001 | D1070: 0 | E1070: 0 | F1070: 1411,100;1412,100; | G1070: 0,0; | H1070: 4590*1.5 | I1070: 1331*0.5-500 | J1070: 540*0.8 | K1070: 381*1.5 | L1070: 179*0.8 | M1070: 1000*LV+100000 | N1070: 0 | O1070: math.max(0,(lv/10)-1) | P1070: math.max(0,(lv/10)-1) | Q1070: math.max(0,(lv/10)-1) | R1070: 0; | S1070: 有药王谷和盘丝洞的弟子在，真是不爽，还是跑路算了！ | T1070: 药王谷和盘丝洞的弟子不在眼前，真是轻松愉快啊！ | U1070: 0 | V1070: 0,0; | W1070: 2
A1071: 12112 | B1071: 仙鹤童子 | C1071: pet_33 | D1071: 0 | E1071: 0 | F1071: 1212,100;1211,100; | G1071: 0,0; | H1071: 4590*1.2*1.5 | I1071: 1331*0.5-500 | J1071: 540*1.2 | K1071: 381*0.5 | L1071: 179*1.5 | M1071: 1000*LV+100000 | N1071: 0 | O1071: math.max(0,(lv/10)-1) | P1071: math.max(0,(lv/10)-1) | Q1071: math.max(0,(lv/10)-1) | R1071: 0; | S1071: 有药王谷和盘丝洞的弟子在，真是不爽，还是跑路算了！ | T1071: 药王谷和盘丝洞的弟子不在眼前，真是轻松愉快啊！ | U1071: 0 | V1071: 0,0; | W1071: 3
A1072: 12113 | B1072: 阴阳师 | C1072: pet_52 | D1072: 0 | E1072: 0 | F1072: 1411,100;1412,100; | G1072: 0,0; | H1072: 4590*1.5 | I1072: 1331*0.5-500 | J1072: 540*0.8 | K1072: 381*1.5 | L1072: 179*0.8 | M1072: 1000*LV+100000 | N1072: 0 | O1072: math.max(0,(lv/10)-1) | P1072: math.max(0,(lv/10)-1) | Q1072: math.max(0,(lv/10)-1) | R1072: 0; | S1072: 有药王谷和盘丝洞的弟子在，真是不爽，还是跑路算了！ | T1072: 药王谷和盘丝洞的弟子不在眼前，真是轻松愉快啊！ | U1072: 0 | V1072: 0,0; | W1072: 2
A1073: 12121 | B1073: 水晶宫弟子 | C1073: hero_1001 | D1073: 0 | E1073: 0 | F1073: 1411,100;1412,100; | G1073: 0,0; | H1073: 4615*1.5 | I1073: 1339*0.5-500 | J1073: 543*0.8 | K1073: 384*1.5 | L1073: 180*0.8 | M1073: 1000*LV+100000 | N1073: 0 | O1073: math.max(0,(lv/10)-1) | P1073: math.max(0,(lv/10)-1) | Q1073: math.max(0,(lv/10)-1) | R1073: 0; | S1073: 有药王谷和盘丝洞的弟子在，真是不爽，还是跑路算了！ | T1073: 药王谷和盘丝洞的弟子不在眼前，真是轻松愉快啊！ | U1073: 0 | V1073: 0,0; | W1073: 2
A1074: 12122 | B1074: 水晶宫外门弟子 | C1074: hero_2001 | D1074: 0 | E1074: 0 | F1074: 5309,100; | G1074: 0,0; | H1074: 4615*1.5 | I1074: 1339-500 | J1074: 543 | K1074: 384*0.5 | L1074: 180*1.2 | M1074: 1000*LV+100000 | N1074: 0 | O1074: math.max(0,(lv/10)-1) | P1074: math.max(0,(lv/10)-1) | Q1074: math.max(0,(lv/10)-1) | R1074: 0; | S1074: 有药王谷和盘丝洞的弟子在，真是不爽，还是跑路算了！ | T1074: 药王谷和盘丝洞的弟子不在眼前，真是轻松愉快啊！ | U1074: 0 | V1074: 0,0; | W1074: 0
A1075: 12123 | B1075: 水晶宫外门弟子 | C1075: hero_2001 | D1075: 0 | E1075: 0 | F1075: 5309,100; | G1075: 0,0; | H1075: 4615*1.5 | I1075: 1339-500 | J1075: 543 | K1075: 384*0.5 | L1075: 180*1.2 | M1075: 1000*LV+100000 | N1075: 0 | O1075: math.max(0,(lv/10)-1) | P1075: math.max(0,(lv/10)-1) | Q1075: math.max(0,(lv/10)-1) | R1075: 0; | S1075: 有药王谷和盘丝洞的弟子在，真是不爽，还是跑路算了！ | T1075: 药王谷和盘丝洞的弟子不在眼前，真是轻松愉快啊！ | U1075: 0 | V1075: 0,0; | W1075: 1
A1076: 12131 | B1076: 水晶宫弟子 | C1076: hero_1001 | D1076: 0 | E1076: 0 | F1076: 1411,100;1412,100; | G1076: 0,0; | H1076: 4632*1.5 | I1076: 1349*0.5-500 | J1076: 545*0.8 | K1076: 387*1.5 | L1076: 182*0.8 | M1076: 1000*LV+100000 | N1076: 0 | O1076: math.max(0,(lv/10)-1) | P1076: math.max(0,(lv/10)-1) | Q1076: math.max(0,(lv/10)-1) | R1076: 0; | S1076: 有药王谷和盘丝洞的弟子在，真是不爽，还是跑路算了！ | T1076: 药王谷和盘丝洞的弟子不在眼前，真是轻松愉快啊！ | U1076: 0 | V1076: 0,0; | W1076: 2
A1077: 12132 | B1077: 药王谷弟子 | C1077: hero_1001 | D1077: 0 | E1077: 0 | F1077: 1212,100;1211,100; | G1077: 0,0; | H1077: 4632*1.2*1.5 | I1077: 1349*0.5-500 | J1077: 545*1.2 | K1077: 387*0.5 | L1077: 182*1.5 | M1077: 1000*LV+100000 | N1077: 0 | O1077: math.max(0,(lv/10)-1) | P1077: math.max(0,(lv/10)-1) | Q1077: math.max(0,(lv/10)-1) | R1077: 0; | S1077: 有药王谷和盘丝洞的弟子在，真是不爽，还是跑路算了！ | T1077: 药王谷和盘丝洞的弟子不在眼前，真是轻松愉快啊！ | U1077: 0 | V1077: 0,0; | W1077: 3
A1078: 12133 | B1078: 兽王弟子 | C1078: hero_1001 | D1078: 0 | E1078: 0 | F1078: 1312,100;1315,100; | G1078: 0,0; | H1078: 4632*1.5 | I1078: 1349-500 | J1078: 545 | K1078: 387*0.5 | L1078: 182*1.2 | M1078: 1000*LV+100000 | N1078: 0 | O1078: math.max(0,(lv/10)-1) | P1078: math.max(0,(lv/10)-1) | Q1078: math.max(0,(lv/10)-1) | R1078: 0; | S1078: 有药王谷和盘丝洞的弟子在，真是不爽，还是跑路算了！ | T1078: 药王谷和盘丝洞的弟子不在眼前，真是轻松愉快啊！ | U1078: 0 | V1078: 0,0; | W1078: 4
A1079: 12141 | B1079: 兽王弟子 | C1079: hero_1001 | D1079: 0 | E1079: 0 | F1079: 1312,100;1315,100; | G1079: 5103,100; | H1079: 4658*1.5 | I1079: 1358-500 | J1079: 547 | K1079: 391*0.5 | L1079: 184*1.2 | M1079: 1000*LV+100000 | N1079: 0 | O1079: math.max(0,(lv/10)-1) | P1079: math.max(0,(lv/10)-1) | Q1079: math.max(0,(lv/10)-1) | R1079: 0; | S1079: 有药王谷和盘丝洞的弟子在，真是不爽，还是跑路算了！ | T1079: 药王谷和盘丝洞的弟子不在眼前，真是轻松愉快啊！ | U1079: 0 | V1079: 0,0; | W1079: 4
A1080: 12142 | B1080: 仙鹤童子 | C1080: pet_33 | D1080: 0 | E1080: 0 | F1080: 1212,100;1211,100; | G1080: 5138,100; | H1080: 4658*1.2*1.5 | I1080: 1358*0.5-500 | J1080: 547*1.2 | K1080: 391*0.5 | L1080: 184*1.5 | M1080: 1000*LV+100000 | N1080: 0 | O1080: math.max(0,(lv/10)-1) | P1080: math.max(0,(lv/10)-1) | Q1080: math.max(0,(lv/10)-1) | R1080: 0; | S1080: 有药王谷和盘丝洞的弟子在，真是不爽，还是跑路算了！ | T1080: 药王谷和盘丝洞的弟子不在眼前，真是轻松愉快啊！ | U1080: 0 | V1080: 0,0; | W1080: 3
A1081: 12143 | B1081: 盘丝弟子 | C1081: hero_2001 | D1081: 0 | E1081: 0 | F1081: 1511,100;1513,100; | G1081: 5110,100; | H1081: 4658*0.8*1.5 | I1081: 1358*0.5-500 | J1081: 547 | K1081: 391 | L1081: 184*2 | M1081: 1000*LV+100000 | N1081: 0 | O1081: math.max(0,(lv/10)-1) | P1081: math.max(0,(lv/10)-1) | Q1081: math.max(0,(lv/10)-1) | R1081: 0; | S1081: 有药王谷和盘丝洞的弟子在，真是不爽，还是跑路算了！ | T1081: 药王谷和盘丝洞的弟子不在眼前，真是轻松愉快啊！ | U1081: 0 | V1081: 0,0; | W1081: 5
A1082: 12144 | B1082: 兽王弟子 | C1082: hero_1001 | D1082: 0 | E1082: 0 | F1082: 1312,100;1315,100; | G1082: 5103,100; | H1082: 4658*1.5 | I1082: 1358-500 | J1082: 547 | K1082: 391*0.5 | L1082: 184*1.2 | M1082: 1000*LV+100000 | N1082: 0 | O1082: math.max(0,(lv/10)-1) | P1082: math.max(0,(lv/10)-1) | Q1082: math.max(0,(lv/10)-1) | R1082: 0; | S1082: 有药王谷和盘丝洞的弟子在，真是不爽，还是跑路算了！ | T1082: 药王谷和盘丝洞的弟子不在眼前，真是轻松愉快啊！ | U1082: 0 | V1082: 0,0; | W1082: 4
A1083: 12151 | B1083: 兽王弟子 | C1083: hero_1001 | D1083: 0 | E1083: 0 | F1083: 1312,100;1315,100; | G1083: 5121,100; | H1083: 4683*1.5 | I1083: 1368-500 | J1083: 550 | K1083: 394*0.5 | L1083: 185*1.2 | M1083: 1000*LV+100000 | N1083: 0 | O1083: math.max(0,(lv/10)-1) | P1083: math.max(0,(lv/10)-1) | Q1083: math.max(0,(lv/10)-1) | R1083: 0; | S1083: 有药王谷和盘丝洞的弟子在，真是不爽，还是跑路算了！ | T1083: 药王谷和盘丝洞的弟子不在眼前，真是轻松愉快啊！ | U1083: 0 | V1083: 0,0; | W1083: 4
A1084: 12152 | B1084: 蛤蟆精 | C1084: pet_3 | D1084: 0 | E1084: 0 | F1084: 0,0; | G1084: 5123,100;5225,100;5104,100;5202,100; | H1084: 4683*1.5 | I1084: 1368-500 | J1084: 550 | K1084: 394*0.5 | L1084: 185*1.2 | M1084: 1000*LV+100000 | N1084: 0 | O1084: math.max(0,(lv/10)-1) | P1084: math.max(0,(lv/10)-1) | Q1084: math.max(0,(lv/10)-1) | R1084: 0; | S1084: 有药王谷和盘丝洞的弟子在，真是不爽，还是跑路算了！ | T1084: 药王谷和盘丝洞的弟子不在眼前，真是轻松愉快啊！ | U1084: 0 | V1084: 0,0; | W1084: 2
A1085: 12153 | B1085: 熊猫武师 | C1085: pet_13 | D1085: 0 | E1085: 0 | F1085: 1311,100;1315,100;1312,100; | G1085: 5103,100; | H1085: 4683*1.5 | I1085: 1368-500 | J1085: 550 | K1085: 394*0.5 | L1085: 185*1.2 | M1085: 1000*LV+100000 | N1085: 0 | O1085: math.max(0,(lv/10)-1) | P1085: math.max(0,(lv/10)-1) | Q1085: math.max(0,(lv/10)-1) | R1085: 0; | S1085: 有药王谷和盘丝洞的弟子在，真是不爽，还是跑路算了！ | T1085: 药王谷和盘丝洞的弟子不在眼前，真是轻松愉快啊！ | U1085: 0 | V1085: 0,0; | W1085: 4
A1086: 12161 | B1086: 仙鹤童子 | C1086: pet_33 | D1086: 0 | E1086: 0 | F1086: 1212,100;1211,100; | G1086: 0,0; | H1086: 4785*1.2*1.5 | I1086: 1396*0.5-500 | J1086: 563*1.2 | K1086: 403*0.5 | L1086: 188*1.5 | M1086: 1000*LV+100000 | N1086: 0 | O1086: math.max(0,(lv/10)-1) | P1086: math.max(0,(lv/10)-1) | Q1086: math.max(0,(lv/10)-1) | R1086: 0; | S1086: 有药王谷和盘丝洞的弟子在，真是不爽，还是跑路算了！ | T1086: 药王谷和盘丝洞的弟子不在眼前，真是轻松愉快啊！ | U1086: 0 | V1086: 0,0; | W1086: 3
A1087: 12162 | B1087: 阴阳师 | C1087: pet_52 | D1087: 0 | E1087: 0 | F1087: 1411,100;1412,100; | G1087: 0,0; | H1087: 4785*1.5 | I1087: 1396*0.5-500 | J1087: 563*0.8 | K1087: 403*1.5 | L1087: 188*0.8 | M1087: 1000*LV+100000 | N1087: 0 | O1087: math.max(0,(lv/10)-1) | P1087: math.max(0,(lv/10)-1) | Q1087: math.max(0,(lv/10)-1) | R1087: 0; | S1087: 有药王谷和盘丝洞的弟子在，真是不爽，还是跑路算了！ | T1087: 药王谷和盘丝洞的弟子不在眼前，真是轻松愉快啊！ | U1087: 0 | V1087: 0,0; | W1087: 2
A1088: 12163 | B1088: 蛤蟆精 | C1088: pet_3 | D1088: 0 | E1088: 0 | F1088: 0,0; | G1088: 5123,100;5225,100;5104,100;5202,100; | H1088: 4785*1.5 | I1088: 1396-500 | J1088: 563 | K1088: 403*0.5 | L1088: 188*1.2 | M1088: 1000*LV+100000 | N1088: 0 | O1088: math.max(0,(lv/10)-1) | P1088: math.max(0,(lv/10)-1) | Q1088: math.max(0,(lv/10)-1) | R1088: 0; | S1088: 有药王谷和盘丝洞的弟子在，真是不爽，还是跑路算了！ | T1088: 药王谷和盘丝洞的弟子不在眼前，真是轻松愉快啊！ | U1088: 0 | V1088: 0,0; | W1088: 2
A1089: 12171 | B1089: 水晶宫弟子 | C1089: hero_1001 | D1089: 0 | E1089: 0 | F1089: 1411,100;1412,100; | G1089: 0,0; | H1089: 4811*1.5 | I1089: 1404*0.5-500 | J1089: 565*0.8 | K1089: 405*1.5 | L1089: 190*0.8 | M1089: 1000*LV+100000 | N1089: 0 | O1089: math.max(0,(lv/10)-1) | P1089: math.max(0,(lv/10)-1) | Q1089: math.max(0,(lv/10)-1) | R1089: 0; | S1089: 有药王谷和盘丝洞的弟子在，真是不爽，还是跑路算了！ | T1089: 药王谷和盘丝洞的弟子不在眼前，真是轻松愉快啊！ | U1089: 0 | V1089: 0,0; | W1089: 2
A1090: 12172 | B1090: 熊猫武师 | C1090: pet_13 | D1090: 0 | E1090: 0 | F1090: 1311,100;1315,100;1312,100; | G1090: 0,0; | H1090: 4811*1.5 | I1090: 1404-500 | J1090: 565 | K1090: 405*0.5 | L1090: 190*1.2 | M1090: 1000*LV+100000 | N1090: 0 | O1090: math.max(0,(lv/10)-1) | P1090: math.max(0,(lv/10)-1) | Q1090: math.max(0,(lv/10)-1) | R1090: 0; | S1090: 有药王谷和盘丝洞的弟子在，真是不爽，还是跑路算了！ | T1090: 药王谷和盘丝洞的弟子不在眼前，真是轻松愉快啊！ | U1090: 0 | V1090: 0,0; | W1090: 4
A1091: 12173 | B1091: 魔女 | C1091: pet_53 | D1091: 0 | E1091: 0 | F1091: 1511,100;1513,100; | G1091: 0,0; | H1091: 4811*0.8*1.5 | I1091: 1404*0.5-500 | J1091: 565 | K1091: 405 | L1091: 190*2 | M1091: 1000*LV+100000 | N1091: 0 | O1091: math.max(0,(lv/10)-1) | P1091: math.max(0,(lv/10)-1) | Q1091: math.max(0,(lv/10)-1) | R1091: 0; | S1091: 有药王谷和盘丝洞的弟子在，真是不爽，还是跑路算了！ | T1091: 药王谷和盘丝洞的弟子不在眼前，真是轻松愉快啊！ | U1091: 0 | V1091: 0,0; | W1091: 5
A1092: 12181 | B1092: 熊猫武师 | C1092: pet_13 | D1092: 0 | E1092: 0 | F1092: 1311,100;1315,100;1312,100; | G1092: 0,0; | H1092: 4828*1.5 | I1092: 1414-500 | J1092: 568 | K1092: 409*0.5 | L1092: 192*1.2 | M1092: 1000*LV+100000 | N1092: 0 | O1092: math.max(0,(lv/10)-1) | P1092: math.max(0,(lv/10)-1) | Q1092: math.max(0,(lv/10)-1) | R1092: 0; | S1092: 有药王谷和盘丝洞的弟子在，真是不爽，还是跑路算了！ | T1092: 药王谷和盘丝洞的弟子不在眼前，真是轻松愉快啊！ | U1092: 0 | V1092: 0,0; | W1092: 4
A1093: 12182 | B1093: 水晶宫弟子 | C1093: hero_1001 | D1093: 0 | E1093: 0 | F1093: 1411,100;1412,100; | G1093: 0,0; | H1093: 4828*1.5 | I1093: 1414*0.5-500 | J1093: 568*0.8 | K1093: 409*1.5 | L1093: 192*0.8 | M1093: 1000*LV+100000 | N1093: 0 | O1093: math.max(0,(lv/10)-1) | P1093: math.max(0,(lv/10)-1) | Q1093: math.max(0,(lv/10)-1) | R1093: 0; | S1093: 有药王谷和盘丝洞的弟子在，真是不爽，还是跑路算了！ | T1093: 药王谷和盘丝洞的弟子不在眼前，真是轻松愉快啊！ | U1093: 0 | V1093: 0,0; | W1093: 2
A1094: 12183 | B1094: 水晶宫外门弟子 | C1094: hero_2001 | D1094: 0 | E1094: 0 | F1094: 5309,100; | G1094: 0,0; | H1094: 4828*1.5 | I1094: 1414-500 | J1094: 568 | K1094: 409*0.5 | L1094: 192*1.2 | M1094: 1000*LV+100000 | N1094: 0 | O1094: math.max(0,(lv/10)-1) | P1094: math.max(0,(lv/10)-1) | Q1094: math.max(0,(lv/10)-1) | R1094: 0; | S1094: 有药王谷和盘丝洞的弟子在，真是不爽，还是跑路算了！ | T1094: 药王谷和盘丝洞的弟子不在眼前，真是轻松愉快啊！ | U1094: 0 | V1094: 0,0; | W1094: 5
A1095: 12191 | B1095: 兽王弟子 | C1095: hero_1001 | D1095: 0 | E1095: 0 | F1095: 1312,100;1315,100; | G1095: 5103,100; | H1095: 4853*1.5 | I1095: 1423-500 | J1095: 570 | K1095: 413*0.5 | L1095: 193*1.2 | M1095: 1000*LV+100000 | N1095: 0 | O1095: math.max(0,(lv/10)-1) | P1095: math.max(0,(lv/10)-1) | Q1095: math.max(0,(lv/10)-1) | R1095: 0; | S1095: 有药王谷和盘丝洞的弟子在，真是不爽，还是跑路算了！ | T1095: 药王谷和盘丝洞的弟子不在眼前，真是轻松愉快啊！ | U1095: 0 | V1095: 0,0; | W1095: 4
A1096: 12192 | B1096: 帮凶 | C1096: pet_43 | D1096: 0 | E1096: 0 | F1096: 1112,100;1111,100; | G1096: 5101,100; | H1096: 4853*1.5 | I1096: 1423-500 | J1096: 570 | K1096: 413*0.5 | L1096: 193*1.2 | M1096: 1000*LV+100000 | N1096: 0 | O1096: math.max(0,(lv/10)-1) | P1096: math.max(0,(lv/10)-1) | Q1096: math.max(0,(lv/10)-1) | R1096: 0; | S1096: 有药王谷和盘丝洞的弟子在，真是不爽，还是跑路算了！ | T1096: 药王谷和盘丝洞的弟子不在眼前，真是轻松愉快啊！ | U1096: 0 | V1096: 0,0; | W1096: 1
A1097: 12201 | B1097: 兽王弟子 | C1097: hero_1001 | D1097: 0 | E1097: 0 | F1097: 1312,100;1315,100; | G1097: 5103,100;5108,100; | H1097: 4870*1.5 | I1097: 1433-500 | J1097: 573 | K1097: 415*0.5 | L1097: 195*1.2 | M1097: 1000*LV+100000 | N1097: 0 | O1097: math.max(0,(lv/10)-1) | P1097: math.max(0,(lv/10)-1) | Q1097: math.max(0,(lv/10)-1) | R1097: 0; | S1097: 有药王谷和盘丝洞的弟子在，真是不爽，还是跑路算了！ | T1097: 药王谷和盘丝洞的弟子不在眼前，真是轻松愉快啊！ | U1097: 0 | V1097: 0,0; | W1097: 4
A1098: 12202 | B1098: 帮凶 | C1098: pet_43 | D1098: 0 | E1098: 0 | F1098: 1112,100;1111,100; | G1098: 5124,100;5126,100; | H1098: 4870*1.5 | I1098: 1433-500 | J1098: 573 | K1098: 415*0.5 | L1098: 195*1.2 | M1098: 1000*LV+100000 | N1098: 0 | O1098: math.max(0,(lv/10)-1) | P1098: math.max(0,(lv/10)-1) | Q1098: math.max(0,(lv/10)-1) | R1098: 0; | S1098: 有药王谷和盘丝洞的弟子在，真是不爽，还是跑路算了！ | T1098: 药王谷和盘丝洞的弟子不在眼前，真是轻松愉快啊！ | U1098: 0 | V1098: 0,0; | W1098: 1
A1099: 12203 | B1099: 魔女 | C1099: pet_53 | D1099: 0 | E1099: 0 | F1099: 1511,100;1513,100; | G1099: 5132,100;5126,100; | H1099: 4870*0.8*1.5 | I1099: 1433*0.5-500 | J1099: 573 | K1099: 415 | L1099: 195*2 | M1099: 1000*LV+100000 | N1099: 0 | O1099: math.max(0,(lv/10)-1) | P1099: math.max(0,(lv/10)-1) | Q1099: math.max(0,(lv/10)-1) | R1099: 0; | S1099: 有药王谷和盘丝洞的弟子在，真是不爽，还是跑路算了！ | T1099: 药王谷和盘丝洞的弟子不在眼前，真是轻松愉快啊！ | U1099: 0 | V1099: 0,0; | W1099: 5
A1100: 12211 | B1100: 剑灵 | C1100: pet_21 | D1100: 0 | E1100: 0 | F1100: 5309,100; | G1100: 0,0; | H1100: 4779*1.5 | I1100: 1588-500 | J1100: 655 | K1100: 475*0.5 | L1100: 235*1.2 | M1100: 1000*LV+100000 | N1100: 0 | O1100: math.max(0,(lv/10)-1) | P1100: math.max(0,(lv/10)-1) | Q1100: math.max(0,(lv/10)-1) | R1100: 0; | S1100: 有药王谷和盘丝洞的弟子在，真是不爽，还是跑路算了！ | T1100: 药王谷和盘丝洞的弟子不在眼前，真是轻松愉快啊！ | U1100: 0 | V1100: 0,0; | W1100: 2
A1101: 12212 | B1101: 天策府弟子 | C1101: hero_1001 | D1101: 0 | E1101: 0 | F1101: 1112,100;1111,100; | G1101: 0,0; | H1101: 4779*1.5 | I1101: 1588-500 | J1101: 655 | K1101: 475*0.5 | L1101: 235*1.2 | M1101: 1000*LV+100000 | N1101: 0 | O1101: math.max(0,(lv/10)-1) | P1101: math.max(0,(lv/10)-1) | Q1101: math.max(0,(lv/10)-1) | R1101: 0; | S1101: 有药王谷和盘丝洞的弟子在，真是不爽，还是跑路算了！ | T1101: 药王谷和盘丝洞的弟子不在眼前，真是轻松愉快啊！ | U1101: 0 | V1101: 0,0; | W1101: 1
A1102: 12213 | B1102: 仙鹤童子 | C1102: pet_33 | D1102: 0 | E1102: 0 | F1102: 1212,100;1211,100; | G1102: 0,0; | H1102: 4779*1.2*1.5 | I1102: 1588*0.5-500 | J1102: 655*1.2 | K1102: 475*0.5 | L1102: 235*1.5 | M1102: 1000*LV+100000 | N1102: 0 | O1102: math.max(0,(lv/10)-1) | P1102: math.max(0,(lv/10)-1) | Q1102: math.max(0,(lv/10)-1) | R1102: 0; | S1102: 有药王谷和盘丝洞的弟子在，真是不爽，还是跑路算了！ | T1102: 药王谷和盘丝洞的弟子不在眼前，真是轻松愉快啊！ | U1102: 0 | V1102: 0,0; | W1102: 3
A1103: 12221 | B1103: 盘丝弟子 | C1103: hero_2001 | D1103: 0 | E1103: 0 | F1103: 1511,100;1513,100; | G1103: 0,0; | H1103: 4801*0.8*1.5 | I1103: 1597*0.5-500 | J1103: 658 | K1103: 477 | L1103: 236*2 | M1103: 1000*LV+100000 | N1103: 0 | O1103: math.max(0,(lv/10)-1) | P1103: math.max(0,(lv/10)-1) | Q1103: math.max(0,(lv/10)-1) | R1103: 0; | S1103: 有药王谷和盘丝洞的弟子在，真是不爽，还是跑路算了！ | T1103: 药王谷和盘丝洞的弟子不在眼前，真是轻松愉快啊！ | U1103: 0 | V1103: 0,0; | W1103: 5
A1104: 12222 | B1104: 熊猫武师 | C1104: pet_13 | D1104: 0 | E1104: 0 | F1104: 1311,100;1315,100;1312,100; | G1104: 0,0; | H1104: 4801*1.5 | I1104: 1597-500 | J1104: 658 | K1104: 477*0.5 | L1104: 236*1.2 | M1104: 1000*LV+100000 | N1104: 0 | O1104: math.max(0,(lv/10)-1) | P1104: math.max(0,(lv/10)-1) | Q1104: math.max(0,(lv/10)-1) | R1104: 0; | S1104: 有药王谷和盘丝洞的弟子在，真是不爽，还是跑路算了！ | T1104: 药王谷和盘丝洞的弟子不在眼前，真是轻松愉快啊！ | U1104: 0 | V1104: 0,0; | W1104: 4
A1105: 12223 | B1105: 天策府弟子 | C1105: hero_1001 | D1105: 0 | E1105: 0 | F1105: 1112,100;1111,100; | G1105: 0,0; | H1105: 4801*1.5 | I1105: 1597-500 | J1105: 658 | K1105: 477*0.5 | L1105: 236*1.2 | M1105: 1000*LV+100000 | N1105: 0 | O1105: math.max(0,(lv/10)-1) | P1105: math.max(0,(lv/10)-1) | Q1105: math.max(0,(lv/10)-1) | R1105: 0; | S1105: 有药王谷和盘丝洞的弟子在，真是不爽，还是跑路算了！ | T1105: 药王谷和盘丝洞的弟子不在眼前，真是轻松愉快啊！ | U1105: 0 | V1105: 0,0; | W1105: 1
A1106: 12231 | B1106: 水晶宫弟子 | C1106: hero_1001 | D1106: 0 | E1106: 0 | F1106: 1411,100;1412,100; | G1106: 0,0; | H1106: 4815*1.5 | I1106: 1606*0.5-500 | J1106: 661*0.8 | K1106: 481*1.5 | L1106: 238*0.8 | M1106: 1000*LV+100000 | N1106: 0 | O1106: math.max(0,(lv/10)-1) | P1106: math.max(0,(lv/10)-1) | Q1106: math.max(0,(lv/10)-1) | R1106: 0; | S1106: 有药王谷和盘丝洞的弟子在，真是不爽，还是跑路算了！ | T1106: 药王谷和盘丝洞的弟子不在眼前，真是轻松愉快啊！ | U1106: 0 | V1106: 0,0; | W1106: 2
A1107: 12232 | B1107: 熊猫武师 | C1107: pet_13 | D1107: 0 | E1107: 0 | F1107: 1311,100;1315,100;1312,100; | G1107: 0,0; | H1107: 4815*1.5 | I1107: 1606-500 | J1107: 661 | K1107: 481*0.5 | L1107: 238*1.2 | M1107: 1000*LV+100000 | N1107: 0 | O1107: math.max(0,(lv/10)-1) | P1107: math.max(0,(lv/10)-1) | Q1107: math.max(0,(lv/10)-1) | R1107: 0; | S1107: 有药王谷和盘丝洞的弟子在，真是不爽，还是跑路算了！ | T1107: 药王谷和盘丝洞的弟子不在眼前，真是轻松愉快啊！ | U1107: 0 | V1107: 0,0; | W1107: 4
A1108: 12233 | B1108: 水晶宫外门弟子 | C1108: hero_2001 | D1108: 0 | E1108: 0 | F1108: 5309,100; | G1108: 5103,100; | H1108: 4815*1.5 | I1108: 1606-500 | J1108: 661 | K1108: 481*0.5 | L1108: 238*1.2 | M1108: 1000*LV+100000 | N1108: 0 | O1108: math.max(0,(lv/10)-1) | P1108: math.max(0,(lv/10)-1) | Q1108: math.max(0,(lv/10)-1) | R1108: 0; | S1108: 有药王谷和盘丝洞的弟子在，真是不爽，还是跑路算了！ | T1108: 药王谷和盘丝洞的弟子不在眼前，真是轻松愉快啊！ | U1108: 0 | V1108: 0,0; | W1108: 5
A1109: 12241 | B1109: 天策府弟子 | C1109: hero_1001 | D1109: 0 | E1109: 0 | F1109: 1112,100;1111,100; | G1109: 5109,100;5116,100; | H1109: 4837*1.5 | I1109: 1615-500 | J1109: 663 | K1109: 485*0.5 | L1109: 240*1.2 | M1109: 1000*LV+100000 | N1109: 0 | O1109: math.max(0,(lv/10)-1) | P1109: math.max(0,(lv/10)-1) | Q1109: math.max(0,(lv/10)-1) | R1109: 0; | S1109: 有药王谷和盘丝洞的弟子在，真是不爽，还是跑路算了！ | T1109: 药王谷和盘丝洞的弟子不在眼前，真是轻松愉快啊！ | U1109: 0 | V1109: 0,0; | W1109: 1
A1110: 12242 | B1110: 仙鹤童子 | C1110: pet_33 | D1110: 0 | E1110: 0 | F1110: 1212,100;1211,100; | G1110: 5138,100;5131,100; | H1110: 4837*1.2*1.5 | I1110: 1615*0.5-500 | J1110: 663*1.2 | K1110: 485*0.5 | L1110: 240*1.5 | M1110: 1000*LV+100000 | N1110: 0 | O1110: math.max(0,(lv/10)-1) | P1110: math.max(0,(lv/10)-1) | Q1110: math.max(0,(lv/10)-1) | R1110: 0; | S1110: 有药王谷和盘丝洞的弟子在，真是不爽，还是跑路算了！ | T1110: 药王谷和盘丝洞的弟子不在眼前，真是轻松愉快啊！ | U1110: 0 | V1110: 0,0; | W1110: 3
A1111: 12243 | B1111: 熊猫武师 | C1111: pet_13 | D1111: 0 | E1111: 0 | F1111: 1311,100;1315,100; | G1111: 5103,100;5108,100; | H1111: 4837*1.5 | I1111: 1615-500 | J1111: 663 | K1111: 485*0.5 | L1111: 240*1.2 | M1111: 1000*LV+100000 | N1111: 0 | O1111: math.max(0,(lv/10)-1) | P1111: math.max(0,(lv/10)-1) | Q1111: math.max(0,(lv/10)-1) | R1111: 0; | S1111: 有药王谷和盘丝洞的弟子在，真是不爽，还是跑路算了！ | T1111: 药王谷和盘丝洞的弟子不在眼前，真是轻松愉快啊！ | U1111: 0 | V1111: 0,0; | W1111: 4
A1112: 12251 | B1112: 兽王弟子 | C1112: hero_1001 | D1112: 0 | E1112: 0 | F1112: 1312,100;1315,100; | G1112: 5138,100;5122,100; | H1112: 4859*1.5 | I1112: 1624-500 | J1112: 666 | K1112: 487*0.5 | L1112: 241*1.2 | M1112: 1000*LV+100000 | N1112: 0 | O1112: math.max(0,(lv/10)-1) | P1112: math.max(0,(lv/10)-1) | Q1112: math.max(0,(lv/10)-1) | R1112: 0; | S1112: 有药王谷和盘丝洞的弟子在，真是不爽，还是跑路算了！ | T1112: 药王谷和盘丝洞的弟子不在眼前，真是轻松愉快啊！ | U1112: 0 | V1112: 0,0; | W1112: 4
A1113: 12252 | B1113: 帮凶 | C1113: pet_43 | D1113: 0 | E1113: 0 | F1113: 1112,100;1111,100; | G1113: 5124,100;5126,100; | H1113: 4859*1.5 | I1113: 1624-500 | J1113: 666 | K1113: 487*0.5 | L1113: 241*1.2 | M1113: 1000*LV+100000 | N1113: 0 | O1113: math.max(0,(lv/10)-1) | P1113: math.max(0,(lv/10)-1) | Q1113: math.max(0,(lv/10)-1) | R1113: 0; | S1113: 有药王谷和盘丝洞的弟子在，真是不爽，还是跑路算了！ | T1113: 药王谷和盘丝洞的弟子不在眼前，真是轻松愉快啊！ | U1113: 0 | V1113: 0,0; | W1113: 1
A1114: 12253 | B1114: 魔女 | C1114: pet_53 | D1114: 0 | E1114: 0 | F1114: 1511,100;1513,100; | G1114: 5132,100;5126,100; | H1114: 4859*0.8*1.5 | I1114: 1624*0.5-500 | J1114: 666 | K1114: 487 | L1114: 241*2 | M1114: 1000*LV+100000 | N1114: 0 | O1114: math.max(0,(lv/10)-1) | P1114: math.max(0,(lv/10)-1) | Q1114: math.max(0,(lv/10)-1) | R1114: 0; | S1114: 有药王谷和盘丝洞的弟子在，真是不爽，还是跑路算了！ | T1114: 药王谷和盘丝洞的弟子不在眼前，真是轻松愉快啊！ | U1114: 0 | V1114: 0,0; | W1114: 5
A1115: 12254 | B1115: 兽王弟子 | C1115: hero_1001 | D1115: 0 | E1115: 0 | F1115: 1312,100;1315,100; | G1115: 5138,100;5122,100; | H1115: 4859*1.5 | I1115: 1624-500 | J1115: 666 | K1115: 487*0.5 | L1115: 241*1.2 | M1115: 1000*LV+100000 | N1115: 0 | O1115: math.max(0,(lv/10)-1) | P1115: math.max(0,(lv/10)-1) | Q1115: math.max(0,(lv/10)-1) | R1115: 0; | S1115: 有药王谷和盘丝洞的弟子在，真是不爽，还是跑路算了！ | T1115: 药王谷和盘丝洞的弟子不在眼前，真是轻松愉快啊！ | U1115: 0 | V1115: 0,0; | W1115: 4
A1116: 12261 | B1116: 水晶宫弟子 | C1116: hero_1001 | D1116: 0 | E1116: 0 | F1116: 1411,100;1412,100; | G1116: 0,0; | H1116: 4954*1.5 | I1116: 1652*0.5-500 | J1116: 680*0.8 | K1116: 496*1.5 | L1116: 245*0.8 | M1116: 1000*LV+100000 | N1116: 0 | O1116: math.max(0,(lv/10)-1) | P1116: math.max(0,(lv/10)-1) | Q1116: math.max(0,(lv/10)-1) | R1116: 0; | S1116: 有药王谷和盘丝洞的弟子在，真是不爽，还是跑路算了！ | T1116: 药王谷和盘丝洞的弟子不在眼前，真是轻松愉快啊！ | U1116: 0 | V1116: 0,0; | W1116: 2
A1117: 12262 | B1117: 药王谷弟子 | C1117: hero_1001 | D1117: 0 | E1117: 0 | F1117: 1212,100;1211,100; | G1117: 0,0; | H1117: 4954*1.2*1.5 | I1117: 1652*0.5-500 | J1117: 680*1.2 | K1117: 496*0.5 | L1117: 245*1.5 | M1117: 1000*LV+100000 | N1117: 0 | O1117: math.max(0,(lv/10)-1) | P1117: math.max(0,(lv/10)-1) | Q1117: math.max(0,(lv/10)-1) | R1117: 0; | S1117: 有药王谷和盘丝洞的弟子在，真是不爽，还是跑路算了！ | T1117: 药王谷和盘丝洞的弟子不在眼前，真是轻松愉快啊！ | U1117: 0 | V1117: 0,0; | W1117: 3
A1118: 12263 | B1118: 药王谷外门弟子 | C1118: hero_2001 | D1118: 0 | E1118: 0 | F1118: 5305,100; | G1118: 0,0; | H1118: 4954*1.5 | I1118: 1652*0.5-500 | J1118: 680*0.8 | K1118: 496*1.5 | L1118: 245*0.8 | M1118: 1000*LV+100000 | N1118: 0 | O1118: math.max(0,(lv/10)-1) | P1118: math.max(0,(lv/10)-1) | Q1118: math.max(0,(lv/10)-1) | R1118: 0; | S1118: 有药王谷和盘丝洞的弟子在，真是不爽，还是跑路算了！ | T1118: 药王谷和盘丝洞的弟子不在眼前，真是轻松愉快啊！ | U1118: 0 | V1118: 0,0; | W1118: 5
A1119: 12271 | B1119: 仙鹤童子 | C1119: pet_33 | D1119: 0 | E1119: 0 | F1119: 1212,100;1211,100; | G1119: 0,0; | H1119: 4976*1.2*1.5 | I1119: 1661*0.5-500 | J1119: 682*1.2 | K1119: 499*0.5 | L1119: 247*1.5 | M1119: 1000*LV+100000 | N1119: 0 | O1119: math.max(0,(lv/10)-1) | P1119: math.max(0,(lv/10)-1) | Q1119: math.max(0,(lv/10)-1) | R1119: 0; | S1119: 有药王谷和盘丝洞的弟子在，真是不爽，还是跑路算了！ | T1119: 药王谷和盘丝洞的弟子不在眼前，真是轻松愉快啊！ | U1119: 0 | V1119: 0,0; | W1119: 3
A1120: 12272 | B1120: 魔女 | C1120: pet_53 | D1120: 0 | E1120: 0 | F1120: 1511,100;1513,100; | G1120: 0,0; | H1120: 4976*0.8*1.5 | I1120: 1661*0.5-500 | J1120: 682 | K1120: 499 | L1120: 247*2 | M1120: 1000*LV+100000 | N1120: 0 | O1120: math.max(0,(lv/10)-1) | P1120: math.max(0,(lv/10)-1) | Q1120: math.max(0,(lv/10)-1) | R1120: 0; | S1120: 有药王谷和盘丝洞的弟子在，真是不爽，还是跑路算了！ | T1120: 药王谷和盘丝洞的弟子不在眼前，真是轻松愉快啊！ | U1120: 0 | V1120: 0,0; | W1120: 5
A1121: 12273 | B1121: 阴阳师 | C1121: pet_52 | D1121: 0 | E1121: 0 | F1121: 1411,100;1412,100; | G1121: 0,0; | H1121: 4976*1.5 | I1121: 1661*0.5-500 | J1121: 682*0.8 | K1121: 499*1.5 | L1121: 247*0.8 | M1121: 1000*LV+100000 | N1121: 0 | O1121: math.max(0,(lv/10)-1) | P1121: math.max(0,(lv/10)-1) | Q1121: math.max(0,(lv/10)-1) | R1121: 0; | S1121: 有药王谷和盘丝洞的弟子在，真是不爽，还是跑路算了！ | T1121: 药王谷和盘丝洞的弟子不在眼前，真是轻松愉快啊！ | U1121: 0 | V1121: 0,0; | W1121: 2
A1122: 12281 | B1122: 水晶宫弟子 | C1122: hero_1001 | D1122: 0 | E1122: 0 | F1122: 1411,100;1412,100; | G1122: 0,0; | H1122: 4990*1.5 | I1122: 1670*0.5-500 | J1122: 685*0.8 | K1122: 504*1.5 | L1122: 248*0.8 | M1122: 1000*LV+100000 | N1122: 0 | O1122: math.max(0,(lv/10)-1) | P1122: math.max(0,(lv/10)-1) | Q1122: math.max(0,(lv/10)-1) | R1122: 0; | S1122: 有药王谷和盘丝洞的弟子在，真是不爽，还是跑路算了！ | T1122: 药王谷和盘丝洞的弟子不在眼前，真是轻松愉快啊！ | U1122: 0 | V1122: 0,0; | W1122: 2
A1123: 12282 | B1123: 阴阳师 | C1123: pet_52 | D1123: 0 | E1123: 0 | F1123: 1411,100;1412,100; | G1123: 0,0; | H1123: 4990*1.5 | I1123: 1670*0.5-500 | J1123: 685*0.8 | K1123: 504*1.5 | L1123: 248*0.8 | M1123: 1000*LV+100000 | N1123: 0 | O1123: math.max(0,(lv/10)-1) | P1123: math.max(0,(lv/10)-1) | Q1123: math.max(0,(lv/10)-1) | R1123: 0; | S1123: 有药王谷和盘丝洞的弟子在，真是不爽，还是跑路算了！ | T1123: 药王谷和盘丝洞的弟子不在眼前，真是轻松愉快啊！ | U1123: 0 | V1123: 0,0; | W1123: 2
A1124: 12283 | B1124: 水晶宫外门弟子 | C1124: hero_2001 | D1124: 0 | E1124: 0 | F1124: 5309,100; | G1124: 5103,100; | H1124: 4990*1.5 | I1124: 1670-500 | J1124: 685 | K1124: 504*0.5 | L1124: 248*1.2 | M1124: 1000*LV+100000 | N1124: 0 | O1124: math.max(0,(lv/10)-1) | P1124: math.max(0,(lv/10)-1) | Q1124: math.max(0,(lv/10)-1) | R1124: 0; | S1124: 有药王谷和盘丝洞的弟子在，真是不爽，还是跑路算了！ | T1124: 药王谷和盘丝洞的弟子不在眼前，真是轻松愉快啊！ | U1124: 0 | V1124: 0,0; | W1124: 4
A1125: 12291 | B1125: 天策府弟子 | C1125: hero_1001 | D1125: 0 | E1125: 0 | F1125: 1112,100;1111,100; | G1125: 5109,100;5116,100; | H1125: 5012*1.5 | I1125: 1678-500 | J1125: 687 | K1125: 507*0.5 | L1125: 250*1.2 | M1125: 1000*LV+100000 | N1125: 0 | O1125: math.max(0,(lv/10)-1) | P1125: math.max(0,(lv/10)-1) | Q1125: math.max(0,(lv/10)-1) | R1125: 0; | S1125: 有药王谷和盘丝洞的弟子在，真是不爽，还是跑路算了！ | T1125: 药王谷和盘丝洞的弟子不在眼前，真是轻松愉快啊！ | U1125: 0 | V1125: 0,0; | W1125: 1
A1126: 12292 | B1126: 盘丝弟子 | C1126: hero_2001 | D1126: 0 | E1126: 0 | F1126: 1511,100;1513,100; | G1126: 5132,100;5126,100; | H1126: 5012*0.8*1.5 | I1126: 1678*0.5-500 | J1126: 687 | K1126: 507 | L1126: 250*2 | M1126: 1000*LV+100000 | N1126: 0 | O1126: math.max(0,(lv/10)-1) | P1126: math.max(0,(lv/10)-1) | Q1126: math.max(0,(lv/10)-1) | R1126: 0; | S1126: 有药王谷和盘丝洞的弟子在，真是不爽，还是跑路算了！ | T1126: 药王谷和盘丝洞的弟子不在眼前，真是轻松愉快啊！ | U1126: 0 | V1126: 0,0; | W1126: 5
A1127: 12301 | B1127: 熊猫武师 | C1127: pet_13 | D1127: 0 | E1127: 0 | F1127: 1311,100;1315,100;1312,100; | G1127: 5103,100;5108,100; | H1127: 5034*1.5 | I1127: 1687-500 | J1127: 690 | K1127: 510*0.5 | L1127: 252*1.2 | M1127: 1000*LV+100000 | N1127: 0 | O1127: math.max(0,(lv/10)-1) | P1127: math.max(0,(lv/10)-1) | Q1127: math.max(0,(lv/10)-1) | R1127: 0; | S1127: 有药王谷和盘丝洞的弟子在，真是不爽，还是跑路算了！ | T1127: 药王谷和盘丝洞的弟子不在眼前，真是轻松愉快啊！ | U1127: 0 | V1127: 0,0; | W1127: 4
A1128: 12302 | B1128: 仙鹤童子 | C1128: pet_33 | D1128: 0 | E1128: 0 | F1128: 1212,100;1211,100; | G1128: 5138,100;5131,100; | H1128: 5034*1.2*1.5 | I1128: 1687*0.5-500 | J1128: 690*1.2 | K1128: 510*0.5 | L1128: 252*1.5 | M1128: 1000*LV+100000 | N1128: 0 | O1128: math.max(0,(lv/10)-1) | P1128: math.max(0,(lv/10)-1) | Q1128: math.max(0,(lv/10)-1) | R1128: 0; | S1128: 有药王谷和盘丝洞的弟子在，真是不爽，还是跑路算了！ | T1128: 药王谷和盘丝洞的弟子不在眼前，真是轻松愉快啊！ | U1128: 0 | V1128: 0,0; | W1128: 3
A1129: 12311 | B1129: 天策府弟子 | C1129: hero_1001 | D1129: 0 | E1129: 0 | F1129: 1112,100;1111,100; | G1129: 0,0; | H1129: 5559*1.5 | I1129: 1835-500 | J1129: 762 | K1129: 553*0.5 | L1129: 270*1.2 | M1129: 1000*LV+100000 | N1129: 0 | O1129: math.max(0,(lv/10)-1) | P1129: math.max(0,(lv/10)-1) | Q1129: math.max(0,(lv/10)-1) | R1129: 0; | S1129: 有药王谷和盘丝洞的弟子在，真是不爽，还是跑路算了！ | T1129: 药王谷和盘丝洞的弟子不在眼前，真是轻松愉快啊！ | U1129: 0 | V1129: 0,0; | W1129: 1
A1130: 12312 | B1130: 盘丝弟子 | C1130: hero_2001 | D1130: 0 | E1130: 0 | F1130: 1511,100;1513,100; | G1130: 0,0; | H1130: 5559*0.8*1.5 | I1130: 1835*0.5-500 | J1130: 762 | K1130: 553 | L1130: 270*2 | M1130: 1000*LV+100000 | N1130: 0 | O1130: math.max(0,(lv/10)-1) | P1130: math.max(0,(lv/10)-1) | Q1130: math.max(0,(lv/10)-1) | R1130: 0; | S1130: 有药王谷和盘丝洞的弟子在，真是不爽，还是跑路算了！ | T1130: 药王谷和盘丝洞的弟子不在眼前，真是轻松愉快啊！ | U1130: 0 | V1130: 0,0; | W1130: 5
A1131: 12313 | B1131: 天策府弟子 | C1131: hero_1001 | D1131: 0 | E1131: 0 | F1131: 1112,100;1111,100; | G1131: 0,0; | H1131: 5559*1.5 | I1131: 1835-500 | J1131: 762 | K1131: 553*0.5 | L1131: 270*1.2 | M1131: 1000*LV+100000 | N1131: 0 | O1131: math.max(0,(lv/10)-1) | P1131: math.max(0,(lv/10)-1) | Q1131: math.max(0,(lv/10)-1) | R1131: 0; | S1131: 有药王谷和盘丝洞的弟子在，真是不爽，还是跑路算了！ | T1131: 药王谷和盘丝洞的弟子不在眼前，真是轻松愉快啊！ | U1131: 0 | V1131: 0,0; | W1131: 1
A1132: 12314 | B1132: 熊猫武师 | C1132: pet_13 | D1132: 0 | E1132: 0 | F1132: 1311,100;1315,100;1312,100; | G1132: 0,0; | H1132: 5559*1.5 | I1132: 1835-500 | J1132: 762 | K1132: 553*0.5 | L1132: 270*1.2 | M1132: 1000*LV+100000 | N1132: 0 | O1132: math.max(0,(lv/10)-1) | P1132: math.max(0,(lv/10)-1) | Q1132: math.max(0,(lv/10)-1) | R1132: 0; | S1132: 有药王谷和盘丝洞的弟子在，真是不爽，还是跑路算了！ | T1132: 药王谷和盘丝洞的弟子不在眼前，真是轻松愉快啊！ | U1132: 0 | V1132: 0,0; | W1132: 4
A1133: 12321 | B1133: 兽王弟子 | C1133: hero_1001 | D1133: 0 | E1133: 0 | F1133: 1312,100;1315,100; | G1133: 0,0; | H1133: 5580*1.5 | I1133: 1844-500 | J1133: 765 | K1133: 556*0.5 | L1133: 272*1.2 | M1133: 1000*LV+100000 | N1133: 0 | O1133: math.max(0,(lv/10)-1) | P1133: math.max(0,(lv/10)-1) | Q1133: math.max(0,(lv/10)-1) | R1133: 0; | S1133: 有药王谷和盘丝洞的弟子在，真是不爽，还是跑路算了！ | T1133: 药王谷和盘丝洞的弟子不在眼前，真是轻松愉快啊！ | U1133: 0 | V1133: 0,0; | W1133: 4
A1134: 12322 | B1134: 阴阳师 | C1134: pet_52 | D1134: 0 | E1134: 0 | F1134: 1411,100;1412,100; | G1134: 0,0; | H1134: 5580*1.5 | I1134: 1844*0.5-500 | J1134: 765*0.8 | K1134: 556*1.5 | L1134: 272*0.8 | M1134: 1000*LV+100000 | N1134: 0 | O1134: math.max(0,(lv/10)-1) | P1134: math.max(0,(lv/10)-1) | Q1134: math.max(0,(lv/10)-1) | R1134: 0; | S1134: 有药王谷和盘丝洞的弟子在，真是不爽，还是跑路算了！ | T1134: 药王谷和盘丝洞的弟子不在眼前，真是轻松愉快啊！ | U1134: 0 | V1134: 0,0; | W1134: 2
A1135: 12323 | B1135: 帮凶 | C1135: pet_43 | D1135: 0 | E1135: 0 | F1135: 1112,100;1111,100; | G1135: 0,0; | H1135: 5580*1.5 | I1135: 1844-500 | J1135: 765 | K1135: 556*0.5 | L1135: 272*1.2 | M1135: 1000*LV+100000 | N1135: 0 | O1135: math.max(0,(lv/10)-1) | P1135: math.max(0,(lv/10)-1) | Q1135: math.max(0,(lv/10)-1) | R1135: 0; | S1135: 有药王谷和盘丝洞的弟子在，真是不爽，还是跑路算了！ | T1135: 药王谷和盘丝洞的弟子不在眼前，真是轻松愉快啊！ | U1135: 0 | V1135: 0,0; | W1135: 1
A1136: 12331 | B1136: 水晶宫弟子 | C1136: hero_1001 | D1136: 0 | E1136: 0 | F1136: 1411,100;1412,100; | G1136: 0,0; | H1136: 5595*1.5 | I1136: 1853*0.5-500 | J1136: 768*0.8 | K1136: 559*1.5 | L1136: 273*0.8 | M1136: 1000*LV+100000 | N1136: 0 | O1136: math.max(0,(lv/10)-1) | P1136: math.max(0,(lv/10)-1) | Q1136: math.max(0,(lv/10)-1) | R1136: 0; | S1136: 有药王谷和盘丝洞的弟子在，真是不爽，还是跑路算了！ | T1136: 药王谷和盘丝洞的弟子不在眼前，真是轻松愉快啊！ | U1136: 0 | V1136: 0,0; | W1136: 2
A1137: 12332 | B1137: 阴阳师 | C1137: pet_52 | D1137: 0 | E1137: 0 | F1137: 1411,100;1412,100; | G1137: 0,0; | H1137: 5595*1.5 | I1137: 1853*0.5-500 | J1137: 768*0.8 | K1137: 559*1.5 | L1137: 273*0.8 | M1137: 1000*LV+100000 | N1137: 0 | O1137: math.max(0,(lv/10)-1) | P1137: math.max(0,(lv/10)-1) | Q1137: math.max(0,(lv/10)-1) | R1137: 0; | S1137: 有药王谷和盘丝洞的弟子在，真是不爽，还是跑路算了！ | T1137: 药王谷和盘丝洞的弟子不在眼前，真是轻松愉快啊！ | U1137: 0 | V1137: 0,0; | W1137: 2
A1138: 12333 | B1138: 水晶宫外门弟子 | C1138: hero_2001 | D1138: 0 | E1138: 0 | F1138: 5309,100; | G1138: 5103,100; | H1138: 5595*1.5 | I1138: 1853-500 | J1138: 768 | K1138: 559*0.5 | L1138: 273*1.2 | M1138: 1000*LV+100000 | N1138: 0 | O1138: math.max(0,(lv/10)-1) | P1138: math.max(0,(lv/10)-1) | Q1138: math.max(0,(lv/10)-1) | R1138: 0; | S1138: 有药王谷和盘丝洞的弟子在，真是不爽，还是跑路算了！ | T1138: 药王谷和盘丝洞的弟子不在眼前，真是轻松愉快啊！ | U1138: 0 | V1138: 0,0; | W1138: 4
A1139: 12341 | B1139: 魔女 | C1139: pet_53 | D1139: 0 | E1139: 0 | F1139: 1511,100;1513,100; | G1139: 5132,100;5126,100; | H1139: 5617*0.8*1.5 | I1139: 1862*0.5-500 | J1139: 770 | K1139: 564 | L1139: 275*2 | M1139: 1000*LV+100000 | N1139: 0 | O1139: math.max(0,(lv/10)-1) | P1139: math.max(0,(lv/10)-1) | Q1139: math.max(0,(lv/10)-1) | R1139: 0; | S1139: 有药王谷和盘丝洞的弟子在，真是不爽，还是跑路算了！ | T1139: 药王谷和盘丝洞的弟子不在眼前，真是轻松愉快啊！ | U1139: 0 | V1139: 0,0; | W1139: 5
A1140: 12342 | B1140: 熊猫武师 | C1140: pet_13 | D1140: 0 | E1140: 0 | F1140: 1311,100;1315,100;1312,100; | G1140: 5103,100;5108,100; | H1140: 5617*1.5 | I1140: 1862-500 | J1140: 770 | K1140: 564*0.5 | L1140: 275*1.2 | M1140: 1000*LV+100000 | N1140: 0 | O1140: math.max(0,(lv/10)-1) | P1140: math.max(0,(lv/10)-1) | Q1140: math.max(0,(lv/10)-1) | R1140: 0; | S1140: 有药王谷和盘丝洞的弟子在，真是不爽，还是跑路算了！ | T1140: 药王谷和盘丝洞的弟子不在眼前，真是轻松愉快啊！ | U1140: 0 | V1140: 0,0; | W1140: 4
A1141: 12343 | B1141: 天策府弟子 | C1141: hero_1001 | D1141: 0 | E1141: 0 | F1141: 1112,100;1111,100; | G1141: 5109,100;5116,100; | H1141: 5617*1.5 | I1141: 1862-500 | J1141: 770 | K1141: 564*0.5 | L1141: 275*1.2 | M1141: 1000*LV+100000 | N1141: 0 | O1141: math.max(0,(lv/10)-1) | P1141: math.max(0,(lv/10)-1) | Q1141: math.max(0,(lv/10)-1) | R1141: 0; | S1141: 有药王谷和盘丝洞的弟子在，真是不爽，还是跑路算了！ | T1141: 药王谷和盘丝洞的弟子不在眼前，真是轻松愉快啊！ | U1141: 0 | V1141: 0,0; | W1141: 1
A1142: 12351 | B1142: 熊猫武师 | C1142: pet_13 | D1142: 0 | E1142: 0 | F1142: 1311,100;1315,100;1312,100; | G1142: 5103,100;5108,100; | H1142: 5639*1.5 | I1142: 1871-500 | J1142: 773 | K1142: 567*0.5 | L1142: 276*1.2 | M1142: 1000*LV+100000 | N1142: 0 | O1142: math.max(0,(lv/10)-1) | P1142: math.max(0,(lv/10)-1) | Q1142: math.max(0,(lv/10)-1) | R1142: 0; | S1142: 有药王谷和盘丝洞的弟子在，真是不爽，还是跑路算了！ | T1142: 药王谷和盘丝洞的弟子不在眼前，真是轻松愉快啊！ | U1142: 0 | V1142: 0,0; | W1142: 4
A1143: 12352 | B1143: 盘丝弟子 | C1143: hero_2001 | D1143: 0 | E1143: 0 | F1143: 1511,100;1513,100; | G1143: 5132,100;5126,100; | H1143: 5639*0.8*1.5 | I1143: 1871*0.5-500 | J1143: 773 | K1143: 567 | L1143: 276*2 | M1143: 1000*LV+100000 | N1143: 0 | O1143: math.max(0,(lv/10)-1) | P1143: math.max(0,(lv/10)-1) | Q1143: math.max(0,(lv/10)-1) | R1143: 0; | S1143: 有药王谷和盘丝洞的弟子在，真是不爽，还是跑路算了！ | T1143: 药王谷和盘丝洞的弟子不在眼前，真是轻松愉快啊！ | U1143: 0 | V1143: 0,0; | W1143: 5
A1144: 12353 | B1144: 仙鹤童子 | C1144: pet_33 | D1144: 0 | E1144: 0 | F1144: 1212,100;1211,100; | G1144: 5138,100;5131,100; | H1144: 5639*1.2*1.5 | I1144: 1871*0.5-500 | J1144: 773*1.2 | K1144: 567*0.5 | L1144: 276*1.5 | M1144: 1000*LV+100000 | N1144: 0 | O1144: math.max(0,(lv/10)-1) | P1144: math.max(0,(lv/10)-1) | Q1144: math.max(0,(lv/10)-1) | R1144: 0; | S1144: 有药王谷和盘丝洞的弟子在，真是不爽，还是跑路算了！ | T1144: 药王谷和盘丝洞的弟子不在眼前，真是轻松愉快啊！ | U1144: 0 | V1144: 0,0; | W1144: 3
A1145: 12361 | B1145: 仙鹤童子 | C1145: pet_33 | D1145: 0 | E1145: 0 | F1145: 1212,100;1211,100; | G1145: 0,0; | H1145: 5741*1.2*1.5 | I1145: 1901*0.5-500 | J1145: 788*1.2 | K1145: 576*0.5 | L1145: 280*1.5 | M1145: 1000*LV+100000 | N1145: 0 | O1145: math.max(0,(lv/10)-1) | P1145: math.max(0,(lv/10)-1) | Q1145: math.max(0,(lv/10)-1) | R1145: 0; | S1145: 有药王谷和盘丝洞的弟子在，真是不爽，还是跑路算了！ | T1145: 药王谷和盘丝洞的弟子不在眼前，真是轻松愉快啊！ | U1145: 0 | V1145: 0,0; | W1145: 3
A1146: 12362 | B1146: 魔女 | C1146: pet_53 | D1146: 0 | E1146: 0 | F1146: 1511,100;1513,100; | G1146: 0,0; | H1146: 5741*0.8*1.5 | I1146: 1901*0.5-500 | J1146: 788 | K1146: 576 | L1146: 280*2 | M1146: 1000*LV+100000 | N1146: 0 | O1146: math.max(0,(lv/10)-1) | P1146: math.max(0,(lv/10)-1) | Q1146: math.max(0,(lv/10)-1) | R1146: 0; | S1146: 有药王谷和盘丝洞的弟子在，真是不爽，还是跑路算了！ | T1146: 药王谷和盘丝洞的弟子不在眼前，真是轻松愉快啊！ | U1146: 0 | V1146: 0,0; | W1146: 5
A1147: 12363 | B1147: 阴阳师 | C1147: pet_52 | D1147: 0 | E1147: 0 | F1147: 1411,100;1412,100; | G1147: 0,0; | H1147: 5741*1.5 | I1147: 1901*0.5-500 | J1147: 788*0.8 | K1147: 576*1.5 | L1147: 280*0.8 | M1147: 1000*LV+100000 | N1147: 0 | O1147: math.max(0,(lv/10)-1) | P1147: math.max(0,(lv/10)-1) | Q1147: math.max(0,(lv/10)-1) | R1147: 0; | S1147: 有药王谷和盘丝洞的弟子在，真是不爽，还是跑路算了！ | T1147: 药王谷和盘丝洞的弟子不在眼前，真是轻松愉快啊！ | U1147: 0 | V1147: 0,0; | W1147: 2
A1148: 12364 | B1148: 剑灵 | C1148: pet_21 | D1148: 0 | E1148: 0 | F1148: 5309,100; | G1148: 0,0; | H1148: 5741*1.5 | I1148: 1901-500 | J1148: 788 | K1148: 576*0.5 | L1148: 280*1.2 | M1148: 1000*LV+100000 | N1148: 0 | O1148: math.max(0,(lv/10)-1) | P1148: math.max(0,(lv/10)-1) | Q1148: math.max(0,(lv/10)-1) | R1148: 0; | S1148: 有药王谷和盘丝洞的弟子在，真是不爽，还是跑路算了！ | T1148: 药王谷和盘丝洞的弟子不在眼前，真是轻松愉快啊！ | U1148: 0 | V1148: 0,0; | W1148: 2
A1149: 12371 | B1149: 兽王弟子 | C1149: hero_1001 | D1149: 0 | E1149: 0 | F1149: 1312,100;1315,100; | G1149: 0,0; | H1149: 5763*1.5 | I1149: 1910-500 | J1149: 791 | K1149: 578*0.5 | L1149: 282*1.2 | M1149: 1000*LV+100000 | N1149: 0 | O1149: math.max(0,(lv/10)-1) | P1149: math.max(0,(lv/10)-1) | Q1149: math.max(0,(lv/10)-1) | R1149: 0; | S1149: 有药王谷和盘丝洞的弟子在，真是不爽，还是跑路算了！ | T1149: 药王谷和盘丝洞的弟子不在眼前，真是轻松愉快啊！ | U1149: 0 | V1149: 0,0; | W1149: 4
A1150: 12372 | B1150: 剑灵 | C1150: pet_21 | D1150: 0 | E1150: 0 | F1150: 5309,100; | G1150: 0,0; | H1150: 5763*1.5 | I1150: 1910-500 | J1150: 791 | K1150: 578*0.5 | L1150: 282*1.2 | M1150: 1000*LV+100000 | N1150: 0 | O1150: math.max(0,(lv/10)-1) | P1150: math.max(0,(lv/10)-1) | Q1150: math.max(0,(lv/10)-1) | R1150: 0; | S1150: 有药王谷和盘丝洞的弟子在，真是不爽，还是跑路算了！ | T1150: 药王谷和盘丝洞的弟子不在眼前，真是轻松愉快啊！ | U1150: 0 | V1150: 0,0; | W1150: 2
A1151: 12381 | B1151: 水晶宫弟子 | C1151: hero_1001 | D1151: 0 | E1151: 0 | F1151: 1411,100;1412,100; | G1151: 0,0; | H1151: 5784*1.5 | I1151: 1919*0.5-500 | J1151: 793*0.8 | K1151: 582*1.5 | L1151: 284*0.8 | M1151: 1000*LV+100000 | N1151: 0 | O1151: math.max(0,(lv/10)-1) | P1151: math.max(0,(lv/10)-1) | Q1151: math.max(0,(lv/10)-1) | R1151: 0; | S1151: 有药王谷和盘丝洞的弟子在，真是不爽，还是跑路算了！ | T1151: 药王谷和盘丝洞的弟子不在眼前，真是轻松愉快啊！ | U1151: 0 | V1151: 0,0; | W1151: 2
A1152: 12382 | B1152: 天策府弟子 | C1152: hero_1001 | D1152: 0 | E1152: 0 | F1152: 1112,100;1111,100; | G1152: 0,0; | H1152: 5784*1.5 | I1152: 1919-500 | J1152: 793 | K1152: 582*0.5 | L1152: 284*1.2 | M1152: 1000*LV+100000 | N1152: 0 | O1152: math.max(0,(lv/10)-1) | P1152: math.max(0,(lv/10)-1) | Q1152: math.max(0,(lv/10)-1) | R1152: 0; | S1152: 有药王谷和盘丝洞的弟子在，真是不爽，还是跑路算了！ | T1152: 药王谷和盘丝洞的弟子不在眼前，真是轻松愉快啊！ | U1152: 0 | V1152: 0,0; | W1152: 1
A1153: 12383 | B1153: 水晶宫外门弟子 | C1153: hero_2001 | D1153: 0 | E1153: 0 | F1153: 5309,100; | G1153: 5103,100; | H1153: 5784*1.5 | I1153: 1919-500 | J1153: 793 | K1153: 582*0.5 | L1153: 284*1.2 | M1153: 1000*LV+100000 | N1153: 0 | O1153: math.max(0,(lv/10)-1) | P1153: math.max(0,(lv/10)-1) | Q1153: math.max(0,(lv/10)-1) | R1153: 0; | S1153: 有药王谷和盘丝洞的弟子在，真是不爽，还是跑路算了！ | T1153: 药王谷和盘丝洞的弟子不在眼前，真是轻松愉快啊！ | U1153: 0 | V1153: 0,0; | W1153: 5
A1154: 12391 | B1154: 兽王弟子 | C1154: hero_1001 | D1154: 0 | E1154: 0 | F1154: 1312,100;1315,100; | G1154: 5103,100;5108,100; | H1154: 5799*1.5 | I1154: 1928-500 | J1154: 796 | K1154: 586*0.5 | L1154: 285*1.2 | M1154: 1000*LV+100000 | N1154: 0 | O1154: math.max(0,(lv/10)-1) | P1154: math.max(0,(lv/10)-1) | Q1154: math.max(0,(lv/10)-1) | R1154: 0; | S1154: 有药王谷和盘丝洞的弟子在，真是不爽，还是跑路算了！ | T1154: 药王谷和盘丝洞的弟子不在眼前，真是轻松愉快啊！ | U1154: 0 | V1154: 0,0; | W1154: 4
A1155: 12392 | B1155: 熊猫武师 | C1155: pet_13 | D1155: 0 | E1155: 0 | F1155: 1311,100;1315,100;1312,100; | G1155: 5103,100;5108,100; | H1155: 5799*1.5 | I1155: 1928-500 | J1155: 796 | K1155: 586*0.5 | L1155: 285*1.2 | M1155: 1000*LV+100000 | N1155: 0 | O1155: math.max(0,(lv/10)-1) | P1155: math.max(0,(lv/10)-1) | Q1155: math.max(0,(lv/10)-1) | R1155: 0; | S1155: 有药王谷和盘丝洞的弟子在，真是不爽，还是跑路算了！ | T1155: 药王谷和盘丝洞的弟子不在眼前，真是轻松愉快啊！ | U1155: 0 | V1155: 0,0; | W1155: 4
A1156: 12401 | B1156: 熊猫武师 | C1156: pet_13 | D1156: 0 | E1156: 0 | F1156: 1311,100;1315,100;1312,100; | G1156: 5103,100;5108,100; | H1156: 5821*1.5 | I1156: 1937-500 | J1156: 799 | K1156: 589*0.5 | L1156: 287*1.2 | M1156: 1000*LV+100000 | N1156: 0 | O1156: math.max(0,(lv/10)-1) | P1156: math.max(0,(lv/10)-1) | Q1156: math.max(0,(lv/10)-1) | R1156: 0; | S1156: 有药王谷和盘丝洞的弟子在，真是不爽，还是跑路算了！ | T1156: 药王谷和盘丝洞的弟子不在眼前，真是轻松愉快啊！ | U1156: 0 | V1156: 0,0; | W1156: 4
A1157: 12402 | B1157: 魔女 | C1157: pet_53 | D1157: 0 | E1157: 0 | F1157: 1511,100;1513,100; | G1157: 5132,100;5126,100; | H1157: 5821*0.8*1.5 | I1157: 1937*0.5-500 | J1157: 799 | K1157: 589 | L1157: 287*2 | M1157: 1000*LV+100000 | N1157: 0 | O1157: math.max(0,(lv/10)-1) | P1157: math.max(0,(lv/10)-1) | Q1157: math.max(0,(lv/10)-1) | R1157: 0; | S1157: 有药王谷和盘丝洞的弟子在，真是不爽，还是跑路算了！ | T1157: 药王谷和盘丝洞的弟子不在眼前，真是轻松愉快啊！ | U1157: 0 | V1157: 0,0; | W1157: 5
A1158: 12403 | B1158: 帮凶 | C1158: pet_43 | D1158: 0 | E1158: 0 | F1158: 1112,100;1111,100; | G1158: 5205,100;5123,100; | H1158: 5821*1.5 | I1158: 1937-500 | J1158: 799 | K1158: 589*0.5 | L1158: 287*1.2 | M1158: 1000*LV+100000 | N1158: 0 | O1158: math.max(0,(lv/10)-1) | P1158: math.max(0,(lv/10)-1) | Q1158: math.max(0,(lv/10)-1) | R1158: 0; | S1158: 有药王谷和盘丝洞的弟子在，真是不爽，还是跑路算了！ | T1158: 药王谷和盘丝洞的弟子不在眼前，真是轻松愉快啊！ | U1158: 0 | V1158: 0,0; | W1158: 1
A1159: 12404 | B1159: 熊猫武师 | C1159: pet_13 | D1159: 0 | E1159: 0 | F1159: 1311,100;1315,100;1312,100; | G1159: 5103,100;5108,100; | H1159: 5821*1.5 | I1159: 1937-500 | J1159: 799 | K1159: 589*0.5 | L1159: 287*1.2 | M1159: 1000*LV+100000 | N1159: 0 | O1159: math.max(0,(lv/10)-1) | P1159: math.max(0,(lv/10)-1) | Q1159: math.max(0,(lv/10)-1) | R1159: 0; | S1159: 有药王谷和盘丝洞的弟子在，真是不爽，还是跑路算了！ | T1159: 药王谷和盘丝洞的弟子不在眼前，真是轻松愉快啊！ | U1159: 0 | V1159: 0,0; | W1159: 4
A1160: 12411 | B1160: 水晶宫弟子 | C1160: hero_1001 | D1160: 0 | E1160: 0 | F1160: 1411,100;1412,100; | G1160: 0,0; | H1160: 5686*1.5 | I1160: 2119*0.5-500 | J1160: 892*0.8 | K1160: 659*1.5 | L1160: 337*0.8 | M1160: 1000*LV+100000 | N1160: 0 | O1160: math.max(0,(lv/10)-1) | P1160: math.max(0,(lv/10)-1) | Q1160: math.max(0,(lv/10)-1) | R1160: 0; | S1160: 有药王谷和盘丝洞的弟子在，真是不爽，还是跑路算了！ | T1160: 药王谷和盘丝洞的弟子不在眼前，真是轻松愉快啊！ | U1160: 0 | V1160: 0,0; | W1160: 2
A1161: 12412 | B1161: 药王谷弟子 | C1161: hero_1001 | D1161: 0 | E1161: 0 | F1161: 1212,100;1211,100; | G1161: 0,0; | H1161: 5686*1.2*1.5 | I1161: 2119*0.5-500 | J1161: 892*1.2 | K1161: 659*0.5 | L1161: 337*1.5 | M1161: 1000*LV+100000 | N1161: 0 | O1161: math.max(0,(lv/10)-1) | P1161: math.max(0,(lv/10)-1) | Q1161: math.max(0,(lv/10)-1) | R1161: 0; | S1161: 有药王谷和盘丝洞的弟子在，真是不爽，还是跑路算了！ | T1161: 药王谷和盘丝洞的弟子不在眼前，真是轻松愉快啊！ | U1161: 0 | V1161: 0,0; | W1161: 3
A1162: 12413 | B1162: 药王谷外门弟子 | C1162: hero_2001 | D1162: 0 | E1162: 0 | F1162: 5305,100; | G1162: 0,0; | H1162: 5686*1.5 | I1162: 2119*0.5-500 | J1162: 892*0.8 | K1162: 659*1.5 | L1162: 337*0.8 | M1162: 1000*LV+100000 | N1162: 0 | O1162: math.max(0,(lv/10)-1) | P1162: math.max(0,(lv/10)-1) | Q1162: math.max(0,(lv/10)-1) | R1162: 0; | S1162: 有药王谷和盘丝洞的弟子在，真是不爽，还是跑路算了！ | T1162: 药王谷和盘丝洞的弟子不在眼前，真是轻松愉快啊！ | U1162: 0 | V1162: 0,0; | W1162: 1
A1163: 12414 | B1163: 药王谷外门弟子 | C1163: hero_2001 | D1163: 0 | E1163: 0 | F1163: 5305,100; | G1163: 0,0; | H1163: 5686*1.5 | I1163: 2119*0.5-500 | J1163: 892*0.8 | K1163: 659*1.5 | L1163: 337*0.8 | M1163: 1000*LV+100000 | N1163: 0 | O1163: math.max(0,(lv/10)-1) | P1163: math.max(0,(lv/10)-1) | Q1163: math.max(0,(lv/10)-1) | R1163: 0; | S1163: 有药王谷和盘丝洞的弟子在，真是不爽，还是跑路算了！ | T1163: 药王谷和盘丝洞的弟子不在眼前，真是轻松愉快啊！ | U1163: 0 | V1163: 0,0; | W1163: 2
A1164: 12421 | B1164: 水晶宫弟子 | C1164: hero_1001 | D1164: 0 | E1164: 0 | F1164: 1411,100;1412,100; | G1164: 0,0; | H1164: 5705*1.5 | I1164: 2127*0.5-500 | J1164: 895*0.8 | K1164: 662*1.5 | L1164: 339*0.8 | M1164: 1000*LV+100000 | N1164: 0 | O1164: math.max(0,(lv/10)-1) | P1164: math.max(0,(lv/10)-1) | Q1164: math.max(0,(lv/10)-1) | R1164: 0; | S1164: 有药王谷和盘丝洞的弟子在，真是不爽，还是跑路算了！ | T1164: 药王谷和盘丝洞的弟子不在眼前，真是轻松愉快啊！ | U1164: 0 | V1164: 0,0; | W1164: 2
A1165: 12422 | B1165: 天策府弟子 | C1165: hero_1001 | D1165: 0 | E1165: 0 | F1165: 1112,100;1111,100; | G1165: 0,0; | H1165: 5705*1.5 | I1165: 2127-500 | J1165: 895 | K1165: 662*0.5 | L1165: 339*1.2 | M1165: 1000*LV+100000 | N1165: 0 | O1165: math.max(0,(lv/10)-1) | P1165: math.max(0,(lv/10)-1) | Q1165: math.max(0,(lv/10)-1) | R1165: 0; | S1165: 有药王谷和盘丝洞的弟子在，真是不爽，还是跑路算了！ | T1165: 药王谷和盘丝洞的弟子不在眼前，真是轻松愉快啊！ | U1165: 0 | V1165: 0,0; | W1165: 1
A1166: 12423 | B1166: 水晶宫外门弟子 | C1166: hero_2001 | D1166: 0 | E1166: 0 | F1166: 5309,100; | G1166: 5103,100; | H1166: 5705*1.5 | I1166: 2127-500 | J1166: 895 | K1166: 662*0.5 | L1166: 339*1.2 | M1166: 1000*LV+100000 | N1166: 0 | O1166: math.max(0,(lv/10)-1) | P1166: math.max(0,(lv/10)-1) | Q1166: math.max(0,(lv/10)-1) | R1166: 0; | S1166: 有药王谷和盘丝洞的弟子在，真是不爽，还是跑路算了！ | T1166: 药王谷和盘丝洞的弟子不在眼前，真是轻松愉快啊！ | U1166: 0 | V1166: 0,0; | W1166: 5
A1167: 12431 | B1167: 水晶宫弟子 | C1167: hero_1001 | D1167: 0 | E1167: 0 | F1167: 1411,100;1412,100; | G1167: 0,0; | H1167: 5724*1.5 | I1167: 2136*0.5-500 | J1167: 898*0.8 | K1167: 666*1.5 | L1167: 340*0.8 | M1167: 1000*LV+100000 | N1167: 0 | O1167: math.max(0,(lv/10)-1) | P1167: math.max(0,(lv/10)-1) | Q1167: math.max(0,(lv/10)-1) | R1167: 0; | S1167: 有药王谷和盘丝洞的弟子在，真是不爽，还是跑路算了！ | T1167: 药王谷和盘丝洞的弟子不在眼前，真是轻松愉快啊！ | U1167: 0 | V1167: 0,0; | W1167: 2
A1168: 12432 | B1168: 仙鹤童子 | C1168: pet_33 | D1168: 0 | E1168: 0 | F1168: 1212,100;1211,100; | G1168: 0,0; | H1168: 5724*1.2*1.5 | I1168: 2136*0.5-500 | J1168: 898*1.2 | K1168: 666*0.5 | L1168: 340*1.5 | M1168: 1000*LV+100000 | N1168: 0 | O1168: math.max(0,(lv/10)-1) | P1168: math.max(0,(lv/10)-1) | Q1168: math.max(0,(lv/10)-1) | R1168: 0; | S1168: 有药王谷和盘丝洞的弟子在，真是不爽，还是跑路算了！ | T1168: 药王谷和盘丝洞的弟子不在眼前，真是轻松愉快啊！ | U1168: 0 | V1168: 0,0; | W1168: 3
A1169: 12433 | B1169: 熊猫武师 | C1169: pet_13 | D1169: 0 | E1169: 0 | F1169: 1311,100;1315,100;1312,100; | G1169: 0,0; | H1169: 5724*1.5 | I1169: 2136-500 | J1169: 898 | K1169: 666*0.5 | L1169: 340*1.2 | M1169: 1000*LV+100000 | N1169: 0 | O1169: math.max(0,(lv/10)-1) | P1169: math.max(0,(lv/10)-1) | Q1169: math.max(0,(lv/10)-1) | R1169: 0; | S1169: 有药王谷和盘丝洞的弟子在，真是不爽，还是跑路算了！ | T1169: 药王谷和盘丝洞的弟子不在眼前，真是轻松愉快啊！ | U1169: 0 | V1169: 0,0; | W1169: 4
A1170: 12441 | B1170: 熊猫武师 | C1170: pet_13 | D1170: 0 | E1170: 0 | F1170: 1311,100;1315,100;1312,100; | G1170: 5103,100;5108,100; | H1170: 5743*1.5 | I1170: 2144-500 | J1170: 900 | K1170: 670*0.5 | L1170: 342*1.2 | M1170: 1000*LV+100000 | N1170: 0 | O1170: math.max(0,(lv/10)-1) | P1170: math.max(0,(lv/10)-1) | Q1170: math.max(0,(lv/10)-1) | R1170: 0; | S1170: 有药王谷和盘丝洞的弟子在，真是不爽，还是跑路算了！ | T1170: 药王谷和盘丝洞的弟子不在眼前，真是轻松愉快啊！ | U1170: 0 | V1170: 0,0; | W1170: 4
A1171: 12442 | B1171: 仙鹤童子 | C1171: pet_33 | D1171: 0 | E1171: 0 | F1171: 1212,100;1211,100; | G1171: 5138,100;5131,100; | H1171: 5743*1.2*1.5 | I1171: 2144*0.5-500 | J1171: 900*1.2 | K1171: 670*0.5 | L1171: 342*1.5 | M1171: 1000*LV+100000 | N1171: 0 | O1171: math.max(0,(lv/10)-1) | P1171: math.max(0,(lv/10)-1) | Q1171: math.max(0,(lv/10)-1) | R1171: 0; | S1171: 有药王谷和盘丝洞的弟子在，真是不爽，还是跑路算了！ | T1171: 药王谷和盘丝洞的弟子不在眼前，真是轻松愉快啊！ | U1171: 0 | V1171: 0,0; | W1171: 3
A1172: 12443 | B1172: 魔女 | C1172: pet_53 | D1172: 0 | E1172: 0 | F1172: 1511,100;1513,100; | G1172: 5132,100;5126,100; | H1172: 5743*0.8*1.5 | I1172: 2144*0.5-500 | J1172: 900 | K1172: 670 | L1172: 342*2 | M1172: 1000*LV+100000 | N1172: 0 | O1172: math.max(0,(lv/10)-1) | P1172: math.max(0,(lv/10)-1) | Q1172: math.max(0,(lv/10)-1) | R1172: 0; | S1172: 有药王谷和盘丝洞的弟子在，真是不爽，还是跑路算了！ | T1172: 药王谷和盘丝洞的弟子不在眼前，真是轻松愉快啊！ | U1172: 0 | V1172: 0,0; | W1172: 5
A1173: 12451 | B1173: 兽王弟子 | C1173: hero_1001 | D1173: 0 | E1173: 0 | F1173: 1312,100;1315,100; | G1173: 5103,100;5108,100; | H1173: 5763*1.5 | I1173: 2153-500 | J1173: 903 | K1173: 673*0.5 | L1173: 344*1.2 | M1173: 1000*LV+100000 | N1173: 0 | O1173: math.max(0,(lv/10)-1) | P1173: math.max(0,(lv/10)-1) | Q1173: math.max(0,(lv/10)-1) | R1173: 0; | S1173: 有药王谷和盘丝洞的弟子在，真是不爽，还是跑路算了！ | T1173: 药王谷和盘丝洞的弟子不在眼前，真是轻松愉快啊！ | U1173: 0 | V1173: 0,0; | W1173: 4
A1174: 12452 | B1174: 魔女 | C1174: pet_53 | D1174: 0 | E1174: 0 | F1174: 1511,100;1513,100; | G1174: 5132,100;5126,100; | H1174: 5763*0.8*1.5 | I1174: 2153*0.5-500 | J1174: 903 | K1174: 673 | L1174: 344*2 | M1174: 1000*LV+100000 | N1174: 0 | O1174: math.max(0,(lv/10)-1) | P1174: math.max(0,(lv/10)-1) | Q1174: math.max(0,(lv/10)-1) | R1174: 0; | S1174: 有药王谷和盘丝洞的弟子在，真是不爽，还是跑路算了！ | T1174: 药王谷和盘丝洞的弟子不在眼前，真是轻松愉快啊！ | U1174: 0 | V1174: 0,0; | W1174: 5
A1175: 12461 | B1175: 帮凶 | C1175: pet_43 | D1175: 0 | E1175: 0 | F1175: 1112,100;1111,100; | G1175: 0,0; | H1175: 5858*1.5 | I1175: 2184-500 | J1175: 919 | K1175: 684*0.5 | L1175: 347*1.2 | M1175: 1000*LV+100000 | N1175: 0 | O1175: math.max(0,(lv/10)-1) | P1175: math.max(0,(lv/10)-1) | Q1175: math.max(0,(lv/10)-1) | R1175: 0; | S1175: 有药王谷和盘丝洞的弟子在，真是不爽，还是跑路算了！ | T1175: 药王谷和盘丝洞的弟子不在眼前，真是轻松愉快啊！ | U1175: 0 | V1175: 0,0; | W1175: 1
A1176: 12462 | B1176: 仙鹤童子 | C1176: pet_33 | D1176: 0 | E1176: 0 | F1176: 1212,100;1211,100; | G1176: 0,0; | H1176: 5858*1.2*1.5 | I1176: 2184*0.5-500 | J1176: 919*1.2 | K1176: 684*0.5 | L1176: 347*1.5 | M1176: 1000*LV+100000 | N1176: 0 | O1176: math.max(0,(lv/10)-1) | P1176: math.max(0,(lv/10)-1) | Q1176: math.max(0,(lv/10)-1) | R1176: 0; | S1176: 有药王谷和盘丝洞的弟子在，真是不爽，还是跑路算了！ | T1176: 药王谷和盘丝洞的弟子不在眼前，真是轻松愉快啊！ | U1176: 0 | V1176: 0,0; | W1176: 3
A1177: 12471 | B1177: 阴阳师 | C1177: pet_52 | D1177: 0 | E1177: 0 | F1177: 1411,100;1412,100; | G1177: 0,0; | H1177: 5877*1.5 | I1177: 2193*0.5-500 | J1177: 922*0.8 | K1177: 686*1.5 | L1177: 348*0.8 | M1177: 1000*LV+100000 | N1177: 0 | O1177: math.max(0,(lv/10)-1) | P1177: math.max(0,(lv/10)-1) | Q1177: math.max(0,(lv/10)-1) | R1177: 0; | S1177: 有药王谷和盘丝洞的弟子在，真是不爽，还是跑路算了！ | T1177: 药王谷和盘丝洞的弟子不在眼前，真是轻松愉快啊！ | U1177: 0 | V1177: 0,0; | W1177: 2
A1178: 12472 | B1178: 魔女 | C1178: pet_53 | D1178: 0 | E1178: 0 | F1178: 1511,100;1513,100; | G1178: 0,0; | H1178: 5877*0.8*1.5 | I1178: 2193*0.5-500 | J1178: 922 | K1178: 686 | L1178: 348*2 | M1178: 1000*LV+100000 | N1178: 0 | O1178: math.max(0,(lv/10)-1) | P1178: math.max(0,(lv/10)-1) | Q1178: math.max(0,(lv/10)-1) | R1178: 0; | S1178: 有药王谷和盘丝洞的弟子在，真是不爽，还是跑路算了！ | T1178: 药王谷和盘丝洞的弟子不在眼前，真是轻松愉快啊！ | U1178: 0 | V1178: 0,0; | W1178: 5
A1179: 12473 | B1179: 蛤蟆精 | C1179: pet_3 | D1179: 0 | E1179: 0 | F1179: 0,0; | G1179: 5123,100;5225,100;5104,100;5202,100; | H1179: 5877*1.5 | I1179: 2193-500 | J1179: 922 | K1179: 686*0.5 | L1179: 348*1.2 | M1179: 1000*LV+100000 | N1179: 0 | O1179: math.max(0,(lv/10)-1) | P1179: math.max(0,(lv/10)-1) | Q1179: math.max(0,(lv/10)-1) | R1179: 0; | S1179: 有药王谷和盘丝洞的弟子在，真是不爽，还是跑路算了！ | T1179: 药王谷和盘丝洞的弟子不在眼前，真是轻松愉快啊！ | U1179: 0 | V1179: 0,0; | W1179: 1
A1180: 12481 | B1180: 盘丝弟子 | C1180: hero_2001 | D1180: 0 | E1180: 0 | F1180: 1511,100;1513,100; | G1180: 0,0; | H1180: 5896*0.8*1.5 | I1180: 2201*0.5-500 | J1180: 924 | K1180: 690 | L1180: 350*2 | M1180: 1000*LV+100000 | N1180: 0 | O1180: math.max(0,(lv/10)-1) | P1180: math.max(0,(lv/10)-1) | Q1180: math.max(0,(lv/10)-1) | R1180: 0; | S1180: 有药王谷和盘丝洞的弟子在，真是不爽，还是跑路算了！ | T1180: 药王谷和盘丝洞的弟子不在眼前，真是轻松愉快啊！ | U1180: 0 | V1180: 0,0; | W1180: 5
A1181: 12482 | B1181: 熊猫武师 | C1181: pet_13 | D1181: 0 | E1181: 0 | F1181: 1311,100;1315,100; | G1181: 0,0; | H1181: 5896*1.5 | I1181: 2201-500 | J1181: 924 | K1181: 690*0.5 | L1181: 350*1.2 | M1181: 1000*LV+100000 | N1181: 0 | O1181: math.max(0,(lv/10)-1) | P1181: math.max(0,(lv/10)-1) | Q1181: math.max(0,(lv/10)-1) | R1181: 0; | S1181: 有药王谷和盘丝洞的弟子在，真是不爽，还是跑路算了！ | T1181: 药王谷和盘丝洞的弟子不在眼前，真是轻松愉快啊！ | U1181: 0 | V1181: 0,0; | W1181: 4
A1182: 12483 | B1182: 剑灵 | C1182: pet_21 | D1182: 0 | E1182: 0 | F1182: 5309,100; | G1182: 0,0; | H1182: 5896*1.5 | I1182: 2201-500 | J1182: 924 | K1182: 690*0.5 | L1182: 350*1.2 | M1182: 1000*LV+100000 | N1182: 0 | O1182: math.max(0,(lv/10)-1) | P1182: math.max(0,(lv/10)-1) | Q1182: math.max(0,(lv/10)-1) | R1182: 0; | S1182: 有药王谷和盘丝洞的弟子在，真是不爽，还是跑路算了！ | T1182: 药王谷和盘丝洞的弟子不在眼前，真是轻松愉快啊！ | U1182: 0 | V1182: 0,0; | W1182: 4
A1183: 12491 | B1183: 兽王弟子 | C1183: hero_1001 | D1183: 0 | E1183: 0 | F1183: 1312,100;1315,100; | G1183: 5103,100;5108,100; | H1183: 5909*1.5 | I1183: 2210-500 | J1183: 927 | K1183: 693*0.5 | L1183: 352*1.2 | M1183: 1000*LV+100000 | N1183: 0 | O1183: math.max(0,(lv/10)-1) | P1183: math.max(0,(lv/10)-1) | Q1183: math.max(0,(lv/10)-1) | R1183: 0; | S1183: 有药王谷和盘丝洞的弟子在，真是不爽，还是跑路算了！ | T1183: 药王谷和盘丝洞的弟子不在眼前，真是轻松愉快啊！ | U1183: 0 | V1183: 0,0; | W1183: 4
A1184: 12492 | B1184: 魔女 | C1184: pet_53 | D1184: 0 | E1184: 0 | F1184: 1511,100;1513,100; | G1184: 5132,100;5126,100; | H1184: 5909*0.8*1.5 | I1184: 2210*0.5-500 | J1184: 927 | K1184: 693 | L1184: 352*2 | M1184: 1000*LV+100000 | N1184: 0 | O1184: math.max(0,(lv/10)-1) | P1184: math.max(0,(lv/10)-1) | Q1184: math.max(0,(lv/10)-1) | R1184: 0; | S1184: 有药王谷和盘丝洞的弟子在，真是不爽，还是跑路算了！ | T1184: 药王谷和盘丝洞的弟子不在眼前，真是轻松愉快啊！ | U1184: 0 | V1184: 0,0; | W1184: 5
A1185: 12493 | B1185: 帮凶 | C1185: pet_43 | D1185: 0 | E1185: 0 | F1185: 1112,100;1111,100; | G1185: 5205,100;5123,100; | H1185: 5909*1.5 | I1185: 2210-500 | J1185: 927 | K1185: 693*0.5 | L1185: 352*1.2 | M1185: 1000*LV+100000 | N1185: 0 | O1185: math.max(0,(lv/10)-1) | P1185: math.max(0,(lv/10)-1) | Q1185: math.max(0,(lv/10)-1) | R1185: 0; | S1185: 有药王谷和盘丝洞的弟子在，真是不爽，还是跑路算了！ | T1185: 药王谷和盘丝洞的弟子不在眼前，真是轻松愉快啊！ | U1185: 0 | V1185: 0,0; | W1185: 1
A1186: 12501 | B1186: 天策府弟子 | C1186: hero_1001 | D1186: 0 | E1186: 0 | F1186: 1112,100;1111,100; | G1186: 5103,100;5209,100;5101,100; | H1186: 5935*1.5 | I1186: 2219-500 | J1186: 930 | K1186: 697*0.5 | L1186: 353*1.2 | M1186: 1000*LV+100000 | N1186: 0 | O1186: math.max(0,(lv/10)-1) | P1186: math.max(0,(lv/10)-1) | Q1186: math.max(0,(lv/10)-1) | R1186: 0; | S1186: 有药王谷和盘丝洞的弟子在，真是不爽，还是跑路算了！ | T1186: 药王谷和盘丝洞的弟子不在眼前，真是轻松愉快啊！ | U1186: 0 | V1186: 0,0; | W1186: 1
A1187: 12502 | B1187: 盘丝弟子 | C1187: hero_2001 | D1187: 0 | E1187: 0 | F1187: 1511,100;1513,100; | G1187: 5210,100;5126,100;5131,100; | H1187: 5935*0.8*1.5 | I1187: 2219*0.5-500 | J1187: 930 | K1187: 697 | L1187: 353*2 | M1187: 1000*LV+100000 | N1187: 0 | O1187: math.max(0,(lv/10)-1) | P1187: math.max(0,(lv/10)-1) | Q1187: math.max(0,(lv/10)-1) | R1187: 0; | S1187: 有药王谷和盘丝洞的弟子在，真是不爽，还是跑路算了！ | T1187: 药王谷和盘丝洞的弟子不在眼前，真是轻松愉快啊！ | U1187: 0 | V1187: 0,0; | W1187: 5
A1188: 12503 | B1188: 剑灵 | C1188: pet_21 | D1188: 0 | E1188: 0 | F1188: 5309,100; | G1188: 5223,100;5124,100;5101,100; | H1188: 5935*1.5 | I1188: 2219-500 | J1188: 930 | K1188: 697*0.5 | L1188: 353*1.2 | M1188: 1000*LV+100000 | N1188: 0 | O1188: math.max(0,(lv/10)-1) | P1188: math.max(0,(lv/10)-1) | Q1188: math.max(0,(lv/10)-1) | R1188: 0; | S1188: 有药王谷和盘丝洞的弟子在，真是不爽，还是跑路算了！ | T1188: 药王谷和盘丝洞的弟子不在眼前，真是轻松愉快啊！ | U1188: 0 | V1188: 0,0; | W1188: 3
A1189: 13011 | B1189: 天策府弟子 | C1189: hero_1001 | D1189: 0 | E1189: 0 | F1189: 1112,100;1111,100; | G1189: 0,0; | H1189: 9120*1.5 | I1189: 2756-500 | J1189: 1073 | K1189: 764*0.5 | L1189: 386*1.2 | M1189: 1000*LV+100000 | N1189: 0 | O1189: math.max(0,(lv/10)-1) | P1189: math.max(0,(lv/10)-1) | Q1189: math.max(0,(lv/10)-1) | R1189: 0; | S1189: 有药王谷和盘丝洞的弟子在，真是不爽，还是跑路算了！ | T1189: 药王谷和盘丝洞的弟子不在眼前，真是轻松愉快啊！ | U1189: 0 | V1189: 0,0; | W1189: 1
A1190: 13021 | B1190: 天策府弟子 | C1190: hero_1001 | D1190: 0 | E1190: 0 | F1190: 1112,100;1111,100; | G1190: 0,0; | H1190: 9146*1.5 | I1190: 2766-500 | J1190: 1076 | K1190: 766*0.5 | L1190: 388*1.2 | M1190: 1000*LV+100000 | N1190: 0 | O1190: math.max(0,(lv/10)-1) | P1190: math.max(0,(lv/10)-1) | Q1190: math.max(0,(lv/10)-1) | R1190: 0; | S1190: 有药王谷和盘丝洞的弟子在，真是不爽，还是跑路算了！ | T1190: 药王谷和盘丝洞的弟子不在眼前，真是轻松愉快啊！ | U1190: 0 | V1190: 0,0; | W1190: 1
A1191: 13031 | B1191: 蛤蟆精 | C1191: pet_3 | D1191: 0 | E1191: 0 | F1191: 0,0; | G1191: 5123,100;5225,100;5104,100;5202,100; | H1191: 9171*1.5 | I1191: 2776-500 | J1191: 1079 | K1191: 771*0.5 | L1191: 389*1.2 | M1191: 1000*LV+100000 | N1191: 0 | O1191: math.max(0,(lv/10)-1) | P1191: math.max(0,(lv/10)-1) | Q1191: math.max(0,(lv/10)-1) | R1191: 0; | S1191: 有药王谷和盘丝洞的弟子在，真是不爽，还是跑路算了！ | T1191: 药王谷和盘丝洞的弟子不在眼前，真是轻松愉快啊！ | U1191: 0 | V1191: 0,0; | W1191: 2
A1192: 13032 | B1192: 蛤蟆精 | C1192: pet_3 | D1192: 0 | E1192: 0 | F1192: 0,0; | G1192: 5123,100;5225,100;5104,100;5202,100; | H1192: 9171*1.5 | I1192: 2776-500 | J1192: 1079 | K1192: 771*0.5 | L1192: 389*1.2 | M1192: 1000*LV+100000 | N1192: 0 | O1192: math.max(0,(lv/10)-1) | P1192: math.max(0,(lv/10)-1) | Q1192: math.max(0,(lv/10)-1) | R1192: 0; | S1192: 有药王谷和盘丝洞的弟子在，真是不爽，还是跑路算了！ | T1192: 药王谷和盘丝洞的弟子不在眼前，真是轻松愉快啊！ | U1192: 0 | V1192: 0,0; | W1192: 1
A1193: 13041 | B1193: 仙鹤童子 | C1193: pet_33 | D1193: 0 | E1193: 0 | F1193: 1212,100;1211,100; | G1193: 5138,100; | H1193: 6897*1.2*1.5 | I1193: 2562*0.5-500 | J1193: 1081*1.2 | K1193: 774*0.5 | L1193: 391*1.5 | M1193: 1000*LV+100000 | N1193: 0 | O1193: math.max(0,(lv/10)-1) | P1193: math.max(0,(lv/10)-1) | Q1193: math.max(0,(lv/10)-1) | R1193: 0; | S1193: 有药王谷和盘丝洞的弟子在，真是不爽，还是跑路算了！ | T1193: 药王谷和盘丝洞的弟子不在眼前，真是轻松愉快啊！ | U1193: 0 | V1193: 0,0; | W1193: 3
A1194: 13042 | B1194: 帮凶 | C1194: pet_43 | D1194: 0 | E1194: 0 | F1194: 1112,100;1111,100; | G1194: 5101,100; | H1194: 6897*1.5 | I1194: 2562-500 | J1194: 1081 | K1194: 774*0.5 | L1194: 391*1.2 | M1194: 1000*LV+100000 | N1194: 0 | O1194: math.max(0,(lv/10)-1) | P1194: math.max(0,(lv/10)-1) | Q1194: math.max(0,(lv/10)-1) | R1194: 0; | S1194: 有药王谷和盘丝洞的弟子在，真是不爽，还是跑路算了！ | T1194: 药王谷和盘丝洞的弟子不在眼前，真是轻松愉快啊！ | U1194: 0 | V1194: 0,0; | W1194: 1
A1195: 13051 | B1195: 仙鹤童子 | C1195: pet_33 | D1195: 0 | E1195: 0 | F1195: 1212,100;1211,100; | G1195: 5138,100; | H1195: 6916*1.2*1.5 | I1195: 2571*0.5-500 | J1195: 1084*1.2 | K1195: 777*0.5 | L1195: 392*1.5 | M1195: 1000*LV+100000 | N1195: 0 | O1195: math.max(0,(lv/10)-1) | P1195: math.max(0,(lv/10)-1) | Q1195: math.max(0,(lv/10)-1) | R1195: 0; | S1195: 有药王谷和盘丝洞的弟子在，真是不爽，还是跑路算了！ | T1195: 药王谷和盘丝洞的弟子不在眼前，真是轻松愉快啊！ | U1195: 0 | V1195: 0,0; | W1195: 3
A1196: 13052 | B1196: 阴阳师 | C1196: pet_52 | D1196: 0 | E1196: 0 | F1196: 1411,100;1412,100; | G1196: 5121,100; | H1196: 6916*1.5 | I1196: 2571*0.5-500 | J1196: 1084*0.8 | K1196: 777*1.5 | L1196: 392*0.8 | M1196: 1000*LV+100000 | N1196: 0 | O1196: math.max(0,(lv/10)-1) | P1196: math.max(0,(lv/10)-1) | Q1196: math.max(0,(lv/10)-1) | R1196: 0; | S1196: 有药王谷和盘丝洞的弟子在，真是不爽，还是跑路算了！ | T1196: 药王谷和盘丝洞的弟子不在眼前，真是轻松愉快啊！ | U1196: 0 | V1196: 0,0; | W1196: 2
A1197: 13053 | B1197: 帮凶 | C1197: pet_43 | D1197: 0 | E1197: 0 | F1197: 1112,100;1111,100; | G1197: 5101,100; | H1197: 6916*1.5 | I1197: 2571-500 | J1197: 1084 | K1197: 777*0.5 | L1197: 392*1.2 | M1197: 1000*LV+100000 | N1197: 0 | O1197: math.max(0,(lv/10)-1) | P1197: math.max(0,(lv/10)-1) | Q1197: math.max(0,(lv/10)-1) | R1197: 0; | S1197: 有药王谷和盘丝洞的弟子在，真是不爽，还是跑路算了！ | T1197: 药王谷和盘丝洞的弟子不在眼前，真是轻松愉快啊！ | U1197: 0 | V1197: 0,0; | W1197: 1
A1198: 13061 | B1198: 水晶宫弟子 | C1198: hero_1001 | D1198: 0 | E1198: 0 | F1198: 1411,100;1412,100; | G1198: 0,0; | H1198: 7044*1.5 | I1198: 2611*0.5-500 | J1198: 1105*0.8 | K1198: 790*1.5 | L1198: 396*0.8 | M1198: 1000*LV+100000 | N1198: 0 | O1198: math.max(0,(lv/10)-1) | P1198: math.max(0,(lv/10)-1) | Q1198: math.max(0,(lv/10)-1) | R1198: 0; | S1198: 有药王谷和盘丝洞的弟子在，真是不爽，还是跑路算了！ | T1198: 药王谷和盘丝洞的弟子不在眼前，真是轻松愉快啊！ | U1198: 0 | V1198: 0,0; | W1198: 2
A1199: 13062 | B1199: 水晶宫外门弟子 | C1199: hero_2001 | D1199: 0 | E1199: 0 | F1199: 5309,100; | G1199: 5103,100; | H1199: 7044*1.5 | I1199: 2611-500 | J1199: 1105 | K1199: 790*0.5 | L1199: 396*1.2 | M1199: 1000*LV+100000 | N1199: 0 | O1199: math.max(0,(lv/10)-1) | P1199: math.max(0,(lv/10)-1) | Q1199: math.max(0,(lv/10)-1) | R1199: 0; | S1199: 有药王谷和盘丝洞的弟子在，真是不爽，还是跑路算了！ | T1199: 药王谷和盘丝洞的弟子不在眼前，真是轻松愉快啊！ | U1199: 0 | V1199: 0,0; | W1199: 5
A1200: 13071 | B1200: 阴阳师 | C1200: pet_52 | D1200: 0 | E1200: 0 | F1200: 1411,100;1412,100; | G1200: 0,0; | H1200: 7063*1.5 | I1200: 2620*0.5-500 | J1200: 1108*0.8 | K1200: 792*1.5 | L1200: 398*0.8 | M1200: 1000*LV+100000 | N1200: 0 | O1200: math.max(0,(lv/10)-1) | P1200: math.max(0,(lv/10)-1) | Q1200: math.max(0,(lv/10)-1) | R1200: 0; | S1200: 有药王谷和盘丝洞的弟子在，真是不爽，还是跑路算了！ | T1200: 药王谷和盘丝洞的弟子不在眼前，真是轻松愉快啊！ | U1200: 0 | V1200: 0,0; | W1200: 2
A1201: 13072 | B1201: 蛤蟆精 | C1201: pet_3 | D1201: 0 | E1201: 0 | F1201: 0,0; | G1201: 5123,100;5225,100;5104,100;5202,100; | H1201: 7063*1.5 | I1201: 2620-500 | J1201: 1108 | K1201: 792*0.5 | L1201: 398*1.2 | M1201: 1000*LV+100000 | N1201: 0 | O1201: math.max(0,(lv/10)-1) | P1201: math.max(0,(lv/10)-1) | Q1201: math.max(0,(lv/10)-1) | R1201: 0; | S1201: 有药王谷和盘丝洞的弟子在，真是不爽，还是跑路算了！ | T1201: 药王谷和盘丝洞的弟子不在眼前，真是轻松愉快啊！ | U1201: 0 | V1201: 0,0; | W1201: 5
A1202: 13081 | B1202: 水晶宫弟子 | C1202: hero_1001 | D1202: 0 | E1202: 0 | F1202: 1411,100;1412,100; | G1202: 0,0; | H1202: 7082*1.5 | I1202: 2629*0.5-500 | J1202: 1110*0.8 | K1202: 796*1.5 | L1202: 400*0.8 | M1202: 1000*LV+100000 | N1202: 0 | O1202: math.max(0,(lv/10)-1) | P1202: math.max(0,(lv/10)-1) | Q1202: math.max(0,(lv/10)-1) | R1202: 0; | S1202: 有药王谷和盘丝洞的弟子在，真是不爽，还是跑路算了！ | T1202: 药王谷和盘丝洞的弟子不在眼前，真是轻松愉快啊！ | U1202: 0 | V1202: 0,0; | W1202: 2
A1203: 13082 | B1203: 药王谷弟子 | C1203: hero_1001 | D1203: 0 | E1203: 0 | F1203: 1212,100;1211,100; | G1203: 0,0; | H1203: 7082*1.2*1.5 | I1203: 2629*0.5-500 | J1203: 1110*1.2 | K1203: 796*0.5 | L1203: 400*1.5 | M1203: 1000*LV+100000 | N1203: 0 | O1203: math.max(0,(lv/10)-1) | P1203: math.max(0,(lv/10)-1) | Q1203: math.max(0,(lv/10)-1) | R1203: 0; | S1203: 有药王谷和盘丝洞的弟子在，真是不爽，还是跑路算了！ | T1203: 药王谷和盘丝洞的弟子不在眼前，真是轻松愉快啊！ | U1203: 0 | V1203: 0,0; | W1203: 3
A1204: 13083 | B1204: 水晶宫弟子 | C1204: hero_1001 | D1204: 0 | E1204: 0 | F1204: 1411,100;1412,100; | G1204: 0,0; | H1204: 7082*1.5 | I1204: 2629*0.5-500 | J1204: 1110*0.8 | K1204: 796*1.5 | L1204: 400*0.8 | M1204: 1000*LV+100000 | N1204: 0 | O1204: math.max(0,(lv/10)-1) | P1204: math.max(0,(lv/10)-1) | Q1204: math.max(0,(lv/10)-1) | R1204: 0; | S1204: 有药王谷和盘丝洞的弟子在，真是不爽，还是跑路算了！ | T1204: 药王谷和盘丝洞的弟子不在眼前，真是轻松愉快啊！ | U1204: 0 | V1204: 0,0; | W1204: 2
A1205: 13091 | B1205: 熊猫武师 | C1205: pet_13 | D1205: 0 | E1205: 0 | F1205: 1311,100;1315,100;1312,100; | G1205: 5101,100; | H1205: 7095*1.5 | I1205: 2638-500 | J1205: 1113 | K1205: 800*0.5 | L1205: 401*1.2 | M1205: 1000*LV+100000 | N1205: 0 | O1205: math.max(0,(lv/10)-1) | P1205: math.max(0,(lv/10)-1) | Q1205: math.max(0,(lv/10)-1) | R1205: 0; | S1205: 有药王谷和盘丝洞的弟子在，真是不爽，还是跑路算了！ | T1205: 药王谷和盘丝洞的弟子不在眼前，真是轻松愉快啊！ | U1205: 0 | V1205: 0,0; | W1205: 4
A1206: 13092 | B1206: 仙鹤童子 | C1206: pet_33 | D1206: 0 | E1206: 0 | F1206: 1212,100;1211,100; | G1206: 5138,100; | H1206: 7095*1.2*1.5 | I1206: 2638*0.5-500 | J1206: 1113*1.2 | K1206: 800*0.5 | L1206: 401*1.5 | M1206: 1000*LV+100000 | N1206: 0 | O1206: math.max(0,(lv/10)-1) | P1206: math.max(0,(lv/10)-1) | Q1206: math.max(0,(lv/10)-1) | R1206: 0; | S1206: 有药王谷和盘丝洞的弟子在，真是不爽，还是跑路算了！ | T1206: 药王谷和盘丝洞的弟子不在眼前，真是轻松愉快啊！ | U1206: 0 | V1206: 0,0; | W1206: 3
A1207: 13093 | B1207: 熊猫武师 | C1207: pet_13 | D1207: 0 | E1207: 0 | F1207: 1311,100;1315,100;1312,100; | G1207: 5101,100; | H1207: 7095*1.5 | I1207: 2638-500 | J1207: 1113 | K1207: 800*0.5 | L1207: 401*1.2 | M1207: 1000*LV+100000 | N1207: 0 | O1207: math.max(0,(lv/10)-1) | P1207: math.max(0,(lv/10)-1) | Q1207: math.max(0,(lv/10)-1) | R1207: 0; | S1207: 有药王谷和盘丝洞的弟子在，真是不爽，还是跑路算了！ | T1207: 药王谷和盘丝洞的弟子不在眼前，真是轻松愉快啊！ | U1207: 0 | V1207: 0,0; | W1207: 4
A1208: 13101 | B1208: 盘丝弟子 | C1208: hero_2001 | D1208: 0 | E1208: 0 | F1208: 1511,100;1513,100; | G1208: 5110,100; | H1208: 7120*0.8*1.5 | I1208: 2647*0.5-500 | J1208: 1116 | K1208: 803 | L1208: 403*2 | M1208: 1000*LV+100000 | N1208: 0 | O1208: math.max(0,(lv/10)-1) | P1208: math.max(0,(lv/10)-1) | Q1208: math.max(0,(lv/10)-1) | R1208: 0; | S1208: 有药王谷和盘丝洞的弟子在，真是不爽，还是跑路算了！ | T1208: 药王谷和盘丝洞的弟子不在眼前，真是轻松愉快啊！ | U1208: 0 | V1208: 0,0; | W1208: 5
A1209: 13102 | B1209: 兽王弟子 | C1209: hero_1001 | D1209: 0 | E1209: 0 | F1209: 1312,100;1315,100; | G1209: 5103,100; | H1209: 7120*1.5 | I1209: 2647-500 | J1209: 1116 | K1209: 803*0.5 | L1209: 403*1.2 | M1209: 1000*LV+100000 | N1209: 0 | O1209: math.max(0,(lv/10)-1) | P1209: math.max(0,(lv/10)-1) | Q1209: math.max(0,(lv/10)-1) | R1209: 0; | S1209: 有药王谷和盘丝洞的弟子在，真是不爽，还是跑路算了！ | T1209: 药王谷和盘丝洞的弟子不在眼前，真是轻松愉快啊！ | U1209: 0 | V1209: 0,0; | W1209: 4
A1210: 13103 | B1210: 兽王弟子 | C1210: hero_1001 | D1210: 0 | E1210: 0 | F1210: 1312,100;1315,100; | G1210: 5103,100; | H1210: 7120*1.5 | I1210: 2647-500 | J1210: 1116 | K1210: 803*0.5 | L1210: 403*1.2 | M1210: 1000*LV+100000 | N1210: 0 | O1210: math.max(0,(lv/10)-1) | P1210: math.max(0,(lv/10)-1) | Q1210: math.max(0,(lv/10)-1) | R1210: 0; | S1210: 有药王谷和盘丝洞的弟子在，真是不爽，还是跑路算了！ | T1210: 药王谷和盘丝洞的弟子不在眼前，真是轻松愉快啊！ | U1210: 0 | V1210: 0,0; | W1210: 4
A1211: 13111 | B1211: 爱慕者 | C1211: hero_1001 | D1211: 0 | E1211: 0 | F1211: 1411,100;1412,100; | G1211: 0,0; | H1211: 7713*1.5 | I1211: 2843*0.5-500 | J1211: 1210*0.8 | K1211: 864*1.5 | L1211: 433*0.8 | M1211: 1000*LV+100000 | N1211: 0 | O1211: math.max(0,(lv/10)-1) | P1211: math.max(0,(lv/10)-1) | Q1211: math.max(0,(lv/10)-1) | R1211: 0; | S1211: 有药王谷和盘丝洞的弟子在，真是不爽，还是跑路算了！ | T1211: 药王谷和盘丝洞的弟子不在眼前，真是轻松愉快啊！ | U1211: 0 | V1211: 0,0; | W1211: 2
A1212: 13112 | B1212: 仙鹤童子 | C1212: pet_33 | D1212: 0 | E1212: 0 | F1212: 1212,100;1211,100; | G1212: 0,0; | H1212: 7713*1.2*1.5 | I1212: 2843*0.5-500 | J1212: 1210*1.2 | K1212: 864*0.5 | L1212: 433*1.5 | M1212: 1000*LV+100000 | N1212: 0 | O1212: math.max(0,(lv/10)-1) | P1212: math.max(0,(lv/10)-1) | Q1212: math.max(0,(lv/10)-1) | R1212: 0; | S1212: 有药王谷和盘丝洞的弟子在，真是不爽，还是跑路算了！ | T1212: 药王谷和盘丝洞的弟子不在眼前，真是轻松愉快啊！ | U1212: 0 | V1212: 0,0; | W1212: 3
A1213: 13113 | B1213: 阴阳师 | C1213: pet_52 | D1213: 0 | E1213: 0 | F1213: 1411,100;1412,100; | G1213: 0,0; | H1213: 7713*1.5 | I1213: 2843*0.5-500 | J1213: 1210*0.8 | K1213: 864*1.5 | L1213: 433*0.8 | M1213: 1000*LV+100000 | N1213: 0 | O1213: math.max(0,(lv/10)-1) | P1213: math.max(0,(lv/10)-1) | Q1213: math.max(0,(lv/10)-1) | R1213: 0; | S1213: 有药王谷和盘丝洞的弟子在，真是不爽，还是跑路算了！ | T1213: 药王谷和盘丝洞的弟子不在眼前，真是轻松愉快啊！ | U1213: 0 | V1213: 0,0; | W1213: 2
A1214: 13121 | B1214: 水晶宫弟子 | C1214: hero_1001 | D1214: 0 | E1214: 0 | F1214: 1411,100;1412,100; | G1214: 0,0; | H1214: 7739*1.5 | I1214: 2852*0.5-500 | J1214: 1213*0.8 | K1214: 866*1.5 | L1214: 435*0.8 | M1214: 1000*LV+100000 | N1214: 0 | O1214: math.max(0,(lv/10)-1) | P1214: math.max(0,(lv/10)-1) | Q1214: math.max(0,(lv/10)-1) | R1214: 0; | S1214: 有药王谷和盘丝洞的弟子在，真是不爽，还是跑路算了！ | T1214: 药王谷和盘丝洞的弟子不在眼前，真是轻松愉快啊！ | U1214: 0 | V1214: 0,0; | W1214: 2
A1215: 13122 | B1215: 水晶宫外门弟子 | C1215: hero_2001 | D1215: 0 | E1215: 0 | F1215: 5309,100; | G1215: 0,0; | H1215: 7739*1.5 | I1215: 2852-500 | J1215: 1213 | K1215: 866*0.5 | L1215: 435*1.2 | M1215: 1000*LV+100000 | N1215: 0 | O1215: math.max(0,(lv/10)-1) | P1215: math.max(0,(lv/10)-1) | Q1215: math.max(0,(lv/10)-1) | R1215: 0; | S1215: 有药王谷和盘丝洞的弟子在，真是不爽，还是跑路算了！ | T1215: 药王谷和盘丝洞的弟子不在眼前，真是轻松愉快啊！ | U1215: 0 | V1215: 0,0; | W1215: 0
A1216: 13123 | B1216: 水晶宫外门弟子 | C1216: hero_2001 | D1216: 0 | E1216: 0 | F1216: 5309,100; | G1216: 0,0; | H1216: 7739*1.5 | I1216: 2852-500 | J1216: 1213 | K1216: 866*0.5 | L1216: 435*1.2 | M1216: 1000*LV+100000 | N1216: 0 | O1216: math.max(0,(lv/10)-1) | P1216: math.max(0,(lv/10)-1) | Q1216: math.max(0,(lv/10)-1) | R1216: 0; | S1216: 有药王谷和盘丝洞的弟子在，真是不爽，还是跑路算了！ | T1216: 药王谷和盘丝洞的弟子不在眼前，真是轻松愉快啊！ | U1216: 0 | V1216: 0,0; | W1216: 0
A1217: 13131 | B1217: 水晶宫弟子 | C1217: hero_1001 | D1217: 0 | E1217: 0 | F1217: 1411,100;1412,100; | G1217: 0,0; | H1217: 7752*1.5 | I1217: 2861*0.5-500 | J1217: 1216*0.8 | K1217: 871*1.5 | L1217: 436*0.8 | M1217: 1000*LV+100000 | N1217: 0 | O1217: math.max(0,(lv/10)-1) | P1217: math.max(0,(lv/10)-1) | Q1217: math.max(0,(lv/10)-1) | R1217: 0; | S1217: 有药王谷和盘丝洞的弟子在，真是不爽，还是跑路算了！ | T1217: 药王谷和盘丝洞的弟子不在眼前，真是轻松愉快啊！ | U1217: 0 | V1217: 0,0; | W1217: 2
A1218: 13132 | B1218: 药王谷弟子 | C1218: hero_1001 | D1218: 0 | E1218: 0 | F1218: 1212,100;1211,100; | G1218: 0,0; | H1218: 7752*1.2*1.5 | I1218: 2861*0.5-500 | J1218: 1216*1.2 | K1218: 871*0.5 | L1218: 436*1.5 | M1218: 1000*LV+100000 | N1218: 0 | O1218: math.max(0,(lv/10)-1) | P1218: math.max(0,(lv/10)-1) | Q1218: math.max(0,(lv/10)-1) | R1218: 0; | S1218: 有药王谷和盘丝洞的弟子在，真是不爽，还是跑路算了！ | T1218: 药王谷和盘丝洞的弟子不在眼前，真是轻松愉快啊！ | U1218: 0 | V1218: 0,0; | W1218: 3
A1219: 13133 | B1219: 兽王弟子 | C1219: hero_1001 | D1219: 0 | E1219: 0 | F1219: 1312,100;1315,100; | G1219: 0,0; | H1219: 7752*1.5 | I1219: 2861-500 | J1219: 1216 | K1219: 871*0.5 | L1219: 436*1.2 | M1219: 1000*LV+100000 | N1219: 0 | O1219: math.max(0,(lv/10)-1) | P1219: math.max(0,(lv/10)-1) | Q1219: math.max(0,(lv/10)-1) | R1219: 0; | S1219: 有药王谷和盘丝洞的弟子在，真是不爽，还是跑路算了！ | T1219: 药王谷和盘丝洞的弟子不在眼前，真是轻松愉快啊！ | U1219: 0 | V1219: 0,0; | W1219: 4
A1220: 13141 | B1220: 兽王弟子 | C1220: hero_1001 | D1220: 0 | E1220: 0 | F1220: 1312,100;1315,100; | G1220: 5103,100; | H1220: 7771*1.5 | I1220: 2869-500 | J1220: 1219 | K1220: 874*0.5 | L1220: 438*1.2 | M1220: 1000*LV+100000 | N1220: 0 | O1220: math.max(0,(lv/10)-1) | P1220: math.max(0,(lv/10)-1) | Q1220: math.max(0,(lv/10)-1) | R1220: 0; | S1220: 有药王谷和盘丝洞的弟子在，真是不爽，还是跑路算了！ | T1220: 药王谷和盘丝洞的弟子不在眼前，真是轻松愉快啊！ | U1220: 0 | V1220: 0,0; | W1220: 4
A1221: 13142 | B1221: 仙鹤童子 | C1221: pet_33 | D1221: 0 | E1221: 0 | F1221: 1212,100;1211,100; | G1221: 5138,100; | H1221: 7771*1.2*1.5 | I1221: 2869*0.5-500 | J1221: 1219*1.2 | K1221: 874*0.5 | L1221: 438*1.5 | M1221: 1000*LV+100000 | N1221: 0 | O1221: math.max(0,(lv/10)-1) | P1221: math.max(0,(lv/10)-1) | Q1221: math.max(0,(lv/10)-1) | R1221: 0; | S1221: 有药王谷和盘丝洞的弟子在，真是不爽，还是跑路算了！ | T1221: 药王谷和盘丝洞的弟子不在眼前，真是轻松愉快啊！ | U1221: 0 | V1221: 0,0; | W1221: 3
A1222: 13143 | B1222: 盘丝弟子 | C1222: hero_2001 | D1222: 0 | E1222: 0 | F1222: 1511,100;1513,100; | G1222: 5110,100; | H1222: 7771*0.8*1.5 | I1222: 2869*0.5-500 | J1222: 1219 | K1222: 874 | L1222: 438*2 | M1222: 1000*LV+100000 | N1222: 0 | O1222: math.max(0,(lv/10)-1) | P1222: math.max(0,(lv/10)-1) | Q1222: math.max(0,(lv/10)-1) | R1222: 0; | S1222: 有药王谷和盘丝洞的弟子在，真是不爽，还是跑路算了！ | T1222: 药王谷和盘丝洞的弟子不在眼前，真是轻松愉快啊！ | U1222: 0 | V1222: 0,0; | W1222: 5
A1223: 13144 | B1223: 兽王弟子 | C1223: hero_1001 | D1223: 0 | E1223: 0 | F1223: 1312,100;1315,100; | G1223: 5103,100; | H1223: 7771*1.5 | I1223: 2869-500 | J1223: 1219 | K1223: 874*0.5 | L1223: 438*1.2 | M1223: 1000*LV+100000 | N1223: 0 | O1223: math.max(0,(lv/10)-1) | P1223: math.max(0,(lv/10)-1) | Q1223: math.max(0,(lv/10)-1) | R1223: 0; | S1223: 有药王谷和盘丝洞的弟子在，真是不爽，还是跑路算了！ | T1223: 药王谷和盘丝洞的弟子不在眼前，真是轻松愉快啊！ | U1223: 0 | V1223: 0,0; | W1223: 4
A1224: 13151 | B1224: 兽王弟子 | C1224: hero_1001 | D1224: 0 | E1224: 0 | F1224: 1312,100;1315,100; | G1224: 5121,100; | H1224: 7790*1.5 | I1224: 2879-500 | J1224: 1222 | K1224: 878*0.5 | L1224: 440*1.2 | M1224: 1000*LV+100000 | N1224: 0 | O1224: math.max(0,(lv/10)-1) | P1224: math.max(0,(lv/10)-1) | Q1224: math.max(0,(lv/10)-1) | R1224: 0; | S1224: 有药王谷和盘丝洞的弟子在，真是不爽，还是跑路算了！ | T1224: 药王谷和盘丝洞的弟子不在眼前，真是轻松愉快啊！ | U1224: 0 | V1224: 0,0; | W1224: 4
A1225: 13152 | B1225: 蛤蟆精 | C1225: pet_3 | D1225: 0 | E1225: 0 | F1225: 0,0; | G1225: 5123,100;5225,100;5104,100;5202,100; | H1225: 7790*1.5 | I1225: 2879-500 | J1225: 1222 | K1225: 878*0.5 | L1225: 440*1.2 | M1225: 1000*LV+100000 | N1225: 0 | O1225: math.max(0,(lv/10)-1) | P1225: math.max(0,(lv/10)-1) | Q1225: math.max(0,(lv/10)-1) | R1225: 0; | S1225: 有药王谷和盘丝洞的弟子在，真是不爽，还是跑路算了！ | T1225: 药王谷和盘丝洞的弟子不在眼前，真是轻松愉快啊！ | U1225: 0 | V1225: 0,0; | W1225: 0
A1226: 13153 | B1226: 熊猫武师 | C1226: pet_13 | D1226: 0 | E1226: 0 | F1226: 1311,100;1315,100;1312,100; | G1226: 5103,100; | H1226: 7790*1.5 | I1226: 2879-500 | J1226: 1222 | K1226: 878*0.5 | L1226: 440*1.2 | M1226: 1000*LV+100000 | N1226: 0 | O1226: math.max(0,(lv/10)-1) | P1226: math.max(0,(lv/10)-1) | Q1226: math.max(0,(lv/10)-1) | R1226: 0; | S1226: 有药王谷和盘丝洞的弟子在，真是不爽，还是跑路算了！ | T1226: 药王谷和盘丝洞的弟子不在眼前，真是轻松愉快啊！ | U1226: 0 | V1226: 0,0; | W1226: 4
A1227: 13161 | B1227: 仙鹤童子 | C1227: pet_33 | D1227: 0 | E1227: 0 | F1227: 1212,100;1211,100; | G1227: 0,0; | H1227: 7924*1.2*1.5 | I1227: 2920*0.5-500 | J1227: 1243*1.2 | K1227: 891*0.5 | L1227: 444*1.5 | M1227: 1000*LV+100000 | N1227: 0 | O1227: math.max(0,(lv/10)-1) | P1227: math.max(0,(lv/10)-1) | Q1227: math.max(0,(lv/10)-1) | R1227: 0; | S1227: 有药王谷和盘丝洞的弟子在，真是不爽，还是跑路算了！ | T1227: 药王谷和盘丝洞的弟子不在眼前，真是轻松愉快啊！ | U1227: 0 | V1227: 0,0; | W1227: 3
A1228: 13162 | B1228: 阴阳师 | C1228: pet_52 | D1228: 0 | E1228: 0 | F1228: 1411,100;1412,100; | G1228: 0,0; | H1228: 7924*1.5 | I1228: 2920*0.5-500 | J1228: 1243*0.8 | K1228: 891*1.5 | L1228: 444*0.8 | M1228: 1000*LV+100000 | N1228: 0 | O1228: math.max(0,(lv/10)-1) | P1228: math.max(0,(lv/10)-1) | Q1228: math.max(0,(lv/10)-1) | R1228: 0; | S1228: 有药王谷和盘丝洞的弟子在，真是不爽，还是跑路算了！ | T1228: 药王谷和盘丝洞的弟子不在眼前，真是轻松愉快啊！ | U1228: 0 | V1228: 0,0; | W1228: 2
A1229: 13163 | B1229: 蛤蟆精 | C1229: pet_3 | D1229: 0 | E1229: 0 | F1229: 0,0; | G1229: 5123,100;5225,100;5104,100;5202,100; | H1229: 7924*1.5 | I1229: 2920-500 | J1229: 1243 | K1229: 891*0.5 | L1229: 444*1.2 | M1229: 1000*LV+100000 | N1229: 0 | O1229: math.max(0,(lv/10)-1) | P1229: math.max(0,(lv/10)-1) | Q1229: math.max(0,(lv/10)-1) | R1229: 0; | S1229: 有药王谷和盘丝洞的弟子在，真是不爽，还是跑路算了！ | T1229: 药王谷和盘丝洞的弟子不在眼前，真是轻松愉快啊！ | U1229: 0 | V1229: 0,0; | W1229: 0
A1230: 13171 | B1230: 水晶宫弟子 | C1230: hero_1001 | D1230: 0 | E1230: 0 | F1230: 1411,100;1412,100; | G1230: 0,0; | H1230: 7943*1.5 | I1230: 2929*0.5-500 | J1230: 1246*0.8 | K1230: 893*1.5 | L1230: 446*0.8 | M1230: 1000*LV+100000 | N1230: 0 | O1230: math.max(0,(lv/10)-1) | P1230: math.max(0,(lv/10)-1) | Q1230: math.max(0,(lv/10)-1) | R1230: 0; | S1230: 有药王谷和盘丝洞的弟子在，真是不爽，还是跑路算了！ | T1230: 药王谷和盘丝洞的弟子不在眼前，真是轻松愉快啊！ | U1230: 0 | V1230: 0,0; | W1230: 2
A1231: 13172 | B1231: 熊猫武师 | C1231: pet_13 | D1231: 0 | E1231: 0 | F1231: 1311,100;1315,100;1312,100; | G1231: 0,0; | H1231: 7943*1.5 | I1231: 2929-500 | J1231: 1246 | K1231: 893*0.5 | L1231: 446*1.2 | M1231: 1000*LV+100000 | N1231: 0 | O1231: math.max(0,(lv/10)-1) | P1231: math.max(0,(lv/10)-1) | Q1231: math.max(0,(lv/10)-1) | R1231: 0; | S1231: 有药王谷和盘丝洞的弟子在，真是不爽，还是跑路算了！ | T1231: 药王谷和盘丝洞的弟子不在眼前，真是轻松愉快啊！ | U1231: 0 | V1231: 0,0; | W1231: 4
A1232: 13173 | B1232: 魔女 | C1232: pet_53 | D1232: 0 | E1232: 0 | F1232: 1511,100;1513,100; | G1232: 0,0; | H1232: 7943*0.8*1.5 | I1232: 2929*0.5-500 | J1232: 1246 | K1232: 893 | L1232: 446*2 | M1232: 1000*LV+100000 | N1232: 0 | O1232: math.max(0,(lv/10)-1) | P1232: math.max(0,(lv/10)-1) | Q1232: math.max(0,(lv/10)-1) | R1232: 0; | S1232: 有药王谷和盘丝洞的弟子在，真是不爽，还是跑路算了！ | T1232: 药王谷和盘丝洞的弟子不在眼前，真是轻松愉快啊！ | U1232: 0 | V1232: 0,0; | W1232: 5
A1233: 13181 | B1233: 熊猫武师 | C1233: pet_13 | D1233: 0 | E1233: 0 | F1233: 1311,100;1315,100;1312,100; | G1233: 0,0; | H1233: 7962*1.5 | I1233: 2938-500 | J1233: 1249 | K1233: 898*0.5 | L1233: 448*1.2 | M1233: 1000*LV+100000 | N1233: 0 | O1233: math.max(0,(lv/10)-1) | P1233: math.max(0,(lv/10)-1) | Q1233: math.max(0,(lv/10)-1) | R1233: 0; | S1233: 有药王谷和盘丝洞的弟子在，真是不爽，还是跑路算了！ | T1233: 药王谷和盘丝洞的弟子不在眼前，真是轻松愉快啊！ | U1233: 0 | V1233: 0,0; | W1233: 4
A1234: 13182 | B1234: 水晶宫弟子 | C1234: hero_1001 | D1234: 0 | E1234: 0 | F1234: 1411,100;1412,100; | G1234: 0,0; | H1234: 7962*1.5 | I1234: 2938*0.5-500 | J1234: 1249*0.8 | K1234: 898*1.5 | L1234: 448*0.8 | M1234: 1000*LV+100000 | N1234: 0 | O1234: math.max(0,(lv/10)-1) | P1234: math.max(0,(lv/10)-1) | Q1234: math.max(0,(lv/10)-1) | R1234: 0; | S1234: 有药王谷和盘丝洞的弟子在，真是不爽，还是跑路算了！ | T1234: 药王谷和盘丝洞的弟子不在眼前，真是轻松愉快啊！ | U1234: 0 | V1234: 0,0; | W1234: 2
A1235: 13183 | B1235: 水晶宫外门弟子 | C1235: hero_2001 | D1235: 0 | E1235: 0 | F1235: 5309,100; | G1235: 0,0; | H1235: 7962*1.5 | I1235: 2938-500 | J1235: 1249 | K1235: 898*0.5 | L1235: 448*1.2 | M1235: 1000*LV+100000 | N1235: 0 | O1235: math.max(0,(lv/10)-1) | P1235: math.max(0,(lv/10)-1) | Q1235: math.max(0,(lv/10)-1) | R1235: 0; | S1235: 有药王谷和盘丝洞的弟子在，真是不爽，还是跑路算了！ | T1235: 药王谷和盘丝洞的弟子不在眼前，真是轻松愉快啊！ | U1235: 0 | V1235: 0,0; | W1235: 0
A1236: 13191 | B1236: 兽王弟子 | C1236: hero_1001 | D1236: 0 | E1236: 0 | F1236: 1312,100;1315,100; | G1236: 5103,100; | H1236: 7981*1.5 | I1236: 2947-500 | J1236: 1251 | K1236: 901*0.5 | L1236: 449*1.2 | M1236: 1000*LV+100000 | N1236: 0 | O1236: math.max(0,(lv/10)-1) | P1236: math.max(0,(lv/10)-1) | Q1236: math.max(0,(lv/10)-1) | R1236: 0; | S1236: 有药王谷和盘丝洞的弟子在，真是不爽，还是跑路算了！ | T1236: 药王谷和盘丝洞的弟子不在眼前，真是轻松愉快啊！ | U1236: 0 | V1236: 0,0; | W1236: 4
A1237: 13192 | B1237: 帮凶 | C1237: pet_43 | D1237: 0 | E1237: 0 | F1237: 1112,100;1111,100; | G1237: 5101,100; | H1237: 7981*1.5 | I1237: 2947-500 | J1237: 1251 | K1237: 901*0.5 | L1237: 449*1.2 | M1237: 1000*LV+100000 | N1237: 0 | O1237: math.max(0,(lv/10)-1) | P1237: math.max(0,(lv/10)-1) | Q1237: math.max(0,(lv/10)-1) | R1237: 0; | S1237: 有药王谷和盘丝洞的弟子在，真是不爽，还是跑路算了！ | T1237: 药王谷和盘丝洞的弟子不在眼前，真是轻松愉快啊！ | U1237: 0 | V1237: 0,0; | W1237: 1
A1238: 13201 | B1238: 兽王弟子 | C1238: hero_1001 | D1238: 0 | E1238: 0 | F1238: 1312,100;1315,100; | G1238: 5103,100;5108,100; | H1238: 8000*1.5 | I1238: 2957-500 | J1238: 1255 | K1238: 905*0.5 | L1238: 451*1.2 | M1238: 1000*LV+100000 | N1238: 0 | O1238: math.max(0,(lv/10)-1) | P1238: math.max(0,(lv/10)-1) | Q1238: math.max(0,(lv/10)-1) | R1238: 0; | S1238: 有药王谷和盘丝洞的弟子在，真是不爽，还是跑路算了！ | T1238: 药王谷和盘丝洞的弟子不在眼前，真是轻松愉快啊！ | U1238: 0 | V1238: 0,0; | W1238: 4
A1239: 13202 | B1239: 帮凶 | C1239: pet_43 | D1239: 0 | E1239: 0 | F1239: 1112,100;1111,100; | G1239: 5124,100;5126,100; | H1239: 8000*1.5 | I1239: 2957-500 | J1239: 1255 | K1239: 905*0.5 | L1239: 451*1.2 | M1239: 1000*LV+100000 | N1239: 0 | O1239: math.max(0,(lv/10)-1) | P1239: math.max(0,(lv/10)-1) | Q1239: math.max(0,(lv/10)-1) | R1239: 0; | S1239: 有药王谷和盘丝洞的弟子在，真是不爽，还是跑路算了！ | T1239: 药王谷和盘丝洞的弟子不在眼前，真是轻松愉快啊！ | U1239: 0 | V1239: 0,0; | W1239: 1
A1240: 13203 | B1240: 魔女 | C1240: pet_53 | D1240: 0 | E1240: 0 | F1240: 1511,100;1513,100; | G1240: 5132,100;5126,100; | H1240: 8000*0.8*1.5 | I1240: 2957*0.5-500 | J1240: 1255 | K1240: 905 | L1240: 451*2 | M1240: 1000*LV+100000 | N1240: 0 | O1240: math.max(0,(lv/10)-1) | P1240: math.max(0,(lv/10)-1) | Q1240: math.max(0,(lv/10)-1) | R1240: 0; | S1240: 有药王谷和盘丝洞的弟子在，真是不爽，还是跑路算了！ | T1240: 药王谷和盘丝洞的弟子不在眼前，真是轻松愉快啊！ | U1240: 0 | V1240: 0,0; | W1240: 5
A1241: 13211 | B1241: 剑灵 | C1241: pet_21 | D1241: 0 | E1241: 0 | F1241: 5309,100; | G1241: 0,0; | H1241: 7593*1.5 | I1241: 3052-500 | J1241: 1339 | K1241: 956*0.5 | L1241: 476*1.2 | M1241: 1000*LV+100000 | N1241: 0 | O1241: math.max(0,(lv/10)-1) | P1241: math.max(0,(lv/10)-1) | Q1241: math.max(0,(lv/10)-1) | R1241: 0; | S1241: 有药王谷和盘丝洞的弟子在，真是不爽，还是跑路算了！ | T1241: 药王谷和盘丝洞的弟子不在眼前，真是轻松愉快啊！ | U1241: 0 | V1241: 0,0; | W1241: 0
A1242: 13212 | B1242: 天策府弟子 | C1242: hero_1001 | D1242: 0 | E1242: 0 | F1242: 1112,100;1111,100; | G1242: 0,0; | H1242: 7593*1.5 | I1242: 3052-500 | J1242: 1339 | K1242: 956*0.5 | L1242: 476*1.2 | M1242: 1000*LV+100000 | N1242: 0 | O1242: math.max(0,(lv/10)-1) | P1242: math.max(0,(lv/10)-1) | Q1242: math.max(0,(lv/10)-1) | R1242: 0; | S1242: 有药王谷和盘丝洞的弟子在，真是不爽，还是跑路算了！ | T1242: 药王谷和盘丝洞的弟子不在眼前，真是轻松愉快啊！ | U1242: 0 | V1242: 0,0; | W1242: 1
A1243: 13213 | B1243: 仙鹤童子 | C1243: pet_33 | D1243: 0 | E1243: 0 | F1243: 1212,100;1211,100; | G1243: 0,0; | H1243: 7593*1.2*1.5 | I1243: 3052*0.5-500 | J1243: 1339*1.2 | K1243: 956*0.5 | L1243: 476*1.5 | M1243: 1000*LV+100000 | N1243: 0 | O1243: math.max(0,(lv/10)-1) | P1243: math.max(0,(lv/10)-1) | Q1243: math.max(0,(lv/10)-1) | R1243: 0; | S1243: 有药王谷和盘丝洞的弟子在，真是不爽，还是跑路算了！ | T1243: 药王谷和盘丝洞的弟子不在眼前，真是轻松愉快啊！ | U1243: 0 | V1243: 0,0; | W1243: 3
A1244: 13221 | B1244: 盘丝弟子 | C1244: hero_2001 | D1244: 0 | E1244: 0 | F1244: 1511,100;1513,100; | G1244: 0,0; | H1244: 7610*0.8*1.5 | I1244: 3062*0.5-500 | J1244: 1343 | K1244: 959 | L1244: 478*2 | M1244: 1000*LV+100000 | N1244: 0 | O1244: math.max(0,(lv/10)-1) | P1244: math.max(0,(lv/10)-1) | Q1244: math.max(0,(lv/10)-1) | R1244: 0; | S1244: 有药王谷和盘丝洞的弟子在，真是不爽，还是跑路算了！ | T1244: 药王谷和盘丝洞的弟子不在眼前，真是轻松愉快啊！ | U1244: 0 | V1244: 0,0; | W1244: 5
A1245: 13222 | B1245: 熊猫武师 | C1245: pet_13 | D1245: 0 | E1245: 0 | F1245: 1311,100;1315,100;1312,100; | G1245: 0,0; | H1245: 7610*1.5 | I1245: 3062-500 | J1245: 1343 | K1245: 959*0.5 | L1245: 478*1.2 | M1245: 1000*LV+100000 | N1245: 0 | O1245: math.max(0,(lv/10)-1) | P1245: math.max(0,(lv/10)-1) | Q1245: math.max(0,(lv/10)-1) | R1245: 0; | S1245: 有药王谷和盘丝洞的弟子在，真是不爽，还是跑路算了！ | T1245: 药王谷和盘丝洞的弟子不在眼前，真是轻松愉快啊！ | U1245: 0 | V1245: 0,0; | W1245: 4
A1246: 13223 | B1246: 天策府弟子 | C1246: hero_1001 | D1246: 0 | E1246: 0 | F1246: 1112,100;1111,100; | G1246: 0,0; | H1246: 7610*1.5 | I1246: 3062-500 | J1246: 1343 | K1246: 959*0.5 | L1246: 478*1.2 | M1246: 1000*LV+100000 | N1246: 0 | O1246: math.max(0,(lv/10)-1) | P1246: math.max(0,(lv/10)-1) | Q1246: math.max(0,(lv/10)-1) | R1246: 0; | S1246: 有药王谷和盘丝洞的弟子在，真是不爽，还是跑路算了！ | T1246: 药王谷和盘丝洞的弟子不在眼前，真是轻松愉快啊！ | U1246: 0 | V1246: 0,0; | W1246: 1
A1247: 13231 | B1247: 水晶宫弟子 | C1247: hero_1001 | D1247: 0 | E1247: 0 | F1247: 1411,100;1412,100; | G1247: 0,0; | H1247: 7627*1.5 | I1247: 3070*0.5-500 | J1247: 1345*0.8 | K1247: 963*1.5 | L1247: 480*0.8 | M1247: 1000*LV+100000 | N1247: 0 | O1247: math.max(0,(lv/10)-1) | P1247: math.max(0,(lv/10)-1) | Q1247: math.max(0,(lv/10)-1) | R1247: 0; | S1247: 有药王谷和盘丝洞的弟子在，真是不爽，还是跑路算了！ | T1247: 药王谷和盘丝洞的弟子不在眼前，真是轻松愉快啊！ | U1247: 0 | V1247: 0,0; | W1247: 2
A1248: 13232 | B1248: 熊猫武师 | C1248: pet_13 | D1248: 0 | E1248: 0 | F1248: 1311,100;1315,100;1312,100; | G1248: 0,0; | H1248: 7627*1.5 | I1248: 3070-500 | J1248: 1345 | K1248: 963*0.5 | L1248: 480*1.2 | M1248: 1000*LV+100000 | N1248: 0 | O1248: math.max(0,(lv/10)-1) | P1248: math.max(0,(lv/10)-1) | Q1248: math.max(0,(lv/10)-1) | R1248: 0; | S1248: 有药王谷和盘丝洞的弟子在，真是不爽，还是跑路算了！ | T1248: 药王谷和盘丝洞的弟子不在眼前，真是轻松愉快啊！ | U1248: 0 | V1248: 0,0; | W1248: 4
A1249: 13233 | B1249: 水晶宫外门弟子 | C1249: hero_2001 | D1249: 0 | E1249: 0 | F1249: 5309,100; | G1249: 5103,100; | H1249: 7627*1.5 | I1249: 3070-500 | J1249: 1345 | K1249: 963*0.5 | L1249: 480*1.2 | M1249: 1000*LV+100000 | N1249: 0 | O1249: math.max(0,(lv/10)-1) | P1249: math.max(0,(lv/10)-1) | Q1249: math.max(0,(lv/10)-1) | R1249: 0; | S1249: 有药王谷和盘丝洞的弟子在，真是不爽，还是跑路算了！ | T1249: 药王谷和盘丝洞的弟子不在眼前，真是轻松愉快啊！ | U1249: 0 | V1249: 0,0; | W1249: 0
A1250: 13241 | B1250: 天策府弟子 | C1250: hero_1001 | D1250: 0 | E1250: 0 | F1250: 1112,100;1111,100; | G1250: 5109,100;5116,100; | H1250: 7644*1.5 | I1250: 3079-500 | J1250: 1348 | K1250: 967*0.5 | L1250: 481*1.2 | M1250: 1000*LV+100000 | N1250: 0 | O1250: math.max(0,(lv/10)-1) | P1250: math.max(0,(lv/10)-1) | Q1250: math.max(0,(lv/10)-1) | R1250: 0; | S1250: 有药王谷和盘丝洞的弟子在，真是不爽，还是跑路算了！ | T1250: 药王谷和盘丝洞的弟子不在眼前，真是轻松愉快啊！ | U1250: 0 | V1250: 0,0; | W1250: 1
A1251: 13242 | B1251: 仙鹤童子 | C1251: pet_33 | D1251: 0 | E1251: 0 | F1251: 1212,100;1211,100; | G1251: 5138,100;5131,100; | H1251: 7644*1.2*1.5 | I1251: 3079*0.5-500 | J1251: 1348*1.2 | K1251: 967*0.5 | L1251: 481*1.5 | M1251: 1000*LV+100000 | N1251: 0 | O1251: math.max(0,(lv/10)-1) | P1251: math.max(0,(lv/10)-1) | Q1251: math.max(0,(lv/10)-1) | R1251: 0; | S1251: 有药王谷和盘丝洞的弟子在，真是不爽，还是跑路算了！ | T1251: 药王谷和盘丝洞的弟子不在眼前，真是轻松愉快啊！ | U1251: 0 | V1251: 0,0; | W1251: 3
A1252: 13243 | B1252: 熊猫武师 | C1252: pet_13 | D1252: 0 | E1252: 0 | F1252: 1311,100;1315,100; | G1252: 5103,100;5108,100; | H1252: 7644*1.5 | I1252: 3079-500 | J1252: 1348 | K1252: 967*0.5 | L1252: 481*1.2 | M1252: 1000*LV+100000 | N1252: 0 | O1252: math.max(0,(lv/10)-1) | P1252: math.max(0,(lv/10)-1) | Q1252: math.max(0,(lv/10)-1) | R1252: 0; | S1252: 有药王谷和盘丝洞的弟子在，真是不爽，还是跑路算了！ | T1252: 药王谷和盘丝洞的弟子不在眼前，真是轻松愉快啊！ | U1252: 0 | V1252: 0,0; | W1252: 4
A1253: 13251 | B1253: 兽王弟子 | C1253: hero_1001 | D1253: 0 | E1253: 0 | F1253: 1312,100;1315,100; | G1253: 5138,100;5122,100; | H1253: 7661*1.5 | I1253: 3087-500 | J1253: 1352 | K1253: 971*0.5 | L1253: 483*1.2 | M1253: 1000*LV+100000 | N1253: 0 | O1253: math.max(0,(lv/10)-1) | P1253: math.max(0,(lv/10)-1) | Q1253: math.max(0,(lv/10)-1) | R1253: 0; | S1253: 有药王谷和盘丝洞的弟子在，真是不爽，还是跑路算了！ | T1253: 药王谷和盘丝洞的弟子不在眼前，真是轻松愉快啊！ | U1253: 0 | V1253: 0,0; | W1253: 4
A1254: 13252 | B1254: 帮凶 | C1254: pet_43 | D1254: 0 | E1254: 0 | F1254: 1112,100;1111,100; | G1254: 5124,100;5126,100; | H1254: 7661*1.5 | I1254: 3087-500 | J1254: 1352 | K1254: 971*0.5 | L1254: 483*1.2 | M1254: 1000*LV+100000 | N1254: 0 | O1254: math.max(0,(lv/10)-1) | P1254: math.max(0,(lv/10)-1) | Q1254: math.max(0,(lv/10)-1) | R1254: 0; | S1254: 有药王谷和盘丝洞的弟子在，真是不爽，还是跑路算了！ | T1254: 药王谷和盘丝洞的弟子不在眼前，真是轻松愉快啊！ | U1254: 0 | V1254: 0,0; | W1254: 1
A1255: 13253 | B1255: 魔女 | C1255: pet_53 | D1255: 0 | E1255: 0 | F1255: 1511,100;1513,100; | G1255: 5132,100;5126,100; | H1255: 7661*0.8*1.5 | I1255: 3087*0.5-500 | J1255: 1352 | K1255: 971 | L1255: 483*2 | M1255: 1000*LV+100000 | N1255: 0 | O1255: math.max(0,(lv/10)-1) | P1255: math.max(0,(lv/10)-1) | Q1255: math.max(0,(lv/10)-1) | R1255: 0; | S1255: 有药王谷和盘丝洞的弟子在，真是不爽，还是跑路算了！ | T1255: 药王谷和盘丝洞的弟子不在眼前，真是轻松愉快啊！ | U1255: 0 | V1255: 0,0; | W1255: 5
A1256: 13254 | B1256: 兽王弟子 | C1256: hero_1001 | D1256: 0 | E1256: 0 | F1256: 1312,100;1315,100; | G1256: 5138,100;5122,100; | H1256: 7661*1.5 | I1256: 3087-500 | J1256: 1352 | K1256: 971*0.5 | L1256: 483*1.2 | M1256: 1000*LV+100000 | N1256: 0 | O1256: math.max(0,(lv/10)-1) | P1256: math.max(0,(lv/10)-1) | Q1256: math.max(0,(lv/10)-1) | R1256: 0; | S1256: 有药王谷和盘丝洞的弟子在，真是不爽，还是跑路算了！ | T1256: 药王谷和盘丝洞的弟子不在眼前，真是轻松愉快啊！ | U1256: 0 | V1256: 0,0; | W1256: 4
A1257: 13261 | B1257: 水晶宫弟子 | C1257: hero_1001 | D1257: 0 | E1257: 0 | F1257: 1411,100;1412,100; | G1257: 0,0; | H1257: 7729*1.5 | I1257: 3113*0.5-500 | J1257: 1363*0.8 | K1257: 979*1.5 | L1257: 486*0.8 | M1257: 1000*LV+100000 | N1257: 0 | O1257: math.max(0,(lv/10)-1) | P1257: math.max(0,(lv/10)-1) | Q1257: math.max(0,(lv/10)-1) | R1257: 0; | S1257: 有药王谷和盘丝洞的弟子在，真是不爽，还是跑路算了！ | T1257: 药王谷和盘丝洞的弟子不在眼前，真是轻松愉快啊！ | U1257: 0 | V1257: 0,0; | W1257: 2
A1258: 13262 | B1258: 药王谷弟子 | C1258: hero_1001 | D1258: 0 | E1258: 0 | F1258: 1212,100;1211,100; | G1258: 0,0; | H1258: 7729*1.2*1.5 | I1258: 3113*0.5-500 | J1258: 1363*1.2 | K1258: 979*0.5 | L1258: 486*1.5 | M1258: 1000*LV+100000 | N1258: 0 | O1258: math.max(0,(lv/10)-1) | P1258: math.max(0,(lv/10)-1) | Q1258: math.max(0,(lv/10)-1) | R1258: 0; | S1258: 有药王谷和盘丝洞的弟子在，真是不爽，还是跑路算了！ | T1258: 药王谷和盘丝洞的弟子不在眼前，真是轻松愉快啊！ | U1258: 0 | V1258: 0,0; | W1258: 3
A1259: 13263 | B1259: 药王谷外门弟子 | C1259: hero_2001 | D1259: 0 | E1259: 0 | F1259: 5305,100; | G1259: 0,0; | H1259: 7729*1.5 | I1259: 3113*0.5-500 | J1259: 1363*0.8 | K1259: 979*1.5 | L1259: 486*0.8 | M1259: 1000*LV+100000 | N1259: 0 | O1259: math.max(0,(lv/10)-1) | P1259: math.max(0,(lv/10)-1) | Q1259: math.max(0,(lv/10)-1) | R1259: 0; | S1259: 有药王谷和盘丝洞的弟子在，真是不爽，还是跑路算了！ | T1259: 药王谷和盘丝洞的弟子不在眼前，真是轻松愉快啊！ | U1259: 0 | V1259: 0,0; | W1259: 0
A1260: 13271 | B1260: 仙鹤童子 | C1260: pet_33 | D1260: 0 | E1260: 0 | F1260: 1212,100;1211,100; | G1260: 0,0; | H1260: 7746*1.2*1.5 | I1260: 3121*0.5-500 | J1260: 1366*1.2 | K1260: 982*0.5 | L1260: 488*1.5 | M1260: 1000*LV+100000 | N1260: 0 | O1260: math.max(0,(lv/10)-1) | P1260: math.max(0,(lv/10)-1) | Q1260: math.max(0,(lv/10)-1) | R1260: 0; | S1260: 有药王谷和盘丝洞的弟子在，真是不爽，还是跑路算了！ | T1260: 药王谷和盘丝洞的弟子不在眼前，真是轻松愉快啊！ | U1260: 0 | V1260: 0,0; | W1260: 3
A1261: 13272 | B1261: 魔女 | C1261: pet_53 | D1261: 0 | E1261: 0 | F1261: 1511,100;1513,100; | G1261: 0,0; | H1261: 7746*0.8*1.5 | I1261: 3121*0.5-500 | J1261: 1366 | K1261: 982 | L1261: 488*2 | M1261: 1000*LV+100000 | N1261: 0 | O1261: math.max(0,(lv/10)-1) | P1261: math.max(0,(lv/10)-1) | Q1261: math.max(0,(lv/10)-1) | R1261: 0; | S1261: 有药王谷和盘丝洞的弟子在，真是不爽，还是跑路算了！ | T1261: 药王谷和盘丝洞的弟子不在眼前，真是轻松愉快啊！ | U1261: 0 | V1261: 0,0; | W1261: 5
A1262: 13273 | B1262: 阴阳师 | C1262: pet_52 | D1262: 0 | E1262: 0 | F1262: 1411,100;1412,100; | G1262: 0,0; | H1262: 7746*1.5 | I1262: 3121*0.5-500 | J1262: 1366*0.8 | K1262: 982*1.5 | L1262: 488*0.8 | M1262: 1000*LV+100000 | N1262: 0 | O1262: math.max(0,(lv/10)-1) | P1262: math.max(0,(lv/10)-1) | Q1262: math.max(0,(lv/10)-1) | R1262: 0; | S1262: 有药王谷和盘丝洞的弟子在，真是不爽，还是跑路算了！ | T1262: 药王谷和盘丝洞的弟子不在眼前，真是轻松愉快啊！ | U1262: 0 | V1262: 0,0; | W1262: 2
A1263: 13281 | B1263: 水晶宫弟子 | C1263: hero_1001 | D1263: 0 | E1263: 0 | F1263: 1411,100;1412,100; | G1263: 0,0; | H1263: 7763*1.5 | I1263: 3130*0.5-500 | J1263: 1369*0.8 | K1263: 986*1.5 | L1263: 489*0.8 | M1263: 1000*LV+100000 | N1263: 0 | O1263: math.max(0,(lv/10)-1) | P1263: math.max(0,(lv/10)-1) | Q1263: math.max(0,(lv/10)-1) | R1263: 0; | S1263: 有药王谷和盘丝洞的弟子在，真是不爽，还是跑路算了！ | T1263: 药王谷和盘丝洞的弟子不在眼前，真是轻松愉快啊！ | U1263: 0 | V1263: 0,0; | W1263: 2
A1264: 13282 | B1264: 阴阳师 | C1264: pet_52 | D1264: 0 | E1264: 0 | F1264: 1411,100;1412,100; | G1264: 0,0; | H1264: 7763*1.5 | I1264: 3130*0.5-500 | J1264: 1369*0.8 | K1264: 986*1.5 | L1264: 489*0.8 | M1264: 1000*LV+100000 | N1264: 0 | O1264: math.max(0,(lv/10)-1) | P1264: math.max(0,(lv/10)-1) | Q1264: math.max(0,(lv/10)-1) | R1264: 0; | S1264: 有药王谷和盘丝洞的弟子在，真是不爽，还是跑路算了！ | T1264: 药王谷和盘丝洞的弟子不在眼前，真是轻松愉快啊！ | U1264: 0 | V1264: 0,0; | W1264: 2
A1265: 13283 | B1265: 水晶宫外门弟子 | C1265: hero_2001 | D1265: 0 | E1265: 0 | F1265: 5309,100; | G1265: 5103,100; | H1265: 7763*1.5 | I1265: 3130-500 | J1265: 1369 | K1265: 986*0.5 | L1265: 489*1.2 | M1265: 1000*LV+100000 | N1265: 0 | O1265: math.max(0,(lv/10)-1) | P1265: math.max(0,(lv/10)-1) | Q1265: math.max(0,(lv/10)-1) | R1265: 0; | S1265: 有药王谷和盘丝洞的弟子在，真是不爽，还是跑路算了！ | T1265: 药王谷和盘丝洞的弟子不在眼前，真是轻松愉快啊！ | U1265: 0 | V1265: 0,0; | W1265: 0
A1266: 13291 | B1266: 天策府弟子 | C1266: hero_1001 | D1266: 0 | E1266: 0 | F1266: 1112,100;1111,100; | G1266: 5109,100;5116,100; | H1266: 7780*1.5 | I1266: 3138-500 | J1266: 1372 | K1266: 990*0.5 | L1266: 491*1.2 | M1266: 1000*LV+100000 | N1266: 0 | O1266: math.max(0,(lv/10)-1) | P1266: math.max(0,(lv/10)-1) | Q1266: math.max(0,(lv/10)-1) | R1266: 0; | S1266: 有药王谷和盘丝洞的弟子在，真是不爽，还是跑路算了！ | T1266: 药王谷和盘丝洞的弟子不在眼前，真是轻松愉快啊！ | U1266: 0 | V1266: 0,0; | W1266: 1
A1267: 13292 | B1267: 盘丝弟子 | C1267: hero_2001 | D1267: 0 | E1267: 0 | F1267: 1511,100;1513,100; | G1267: 5132,100;5126,100; | H1267: 7780*0.8*1.5 | I1267: 3138*0.5-500 | J1267: 1372 | K1267: 990 | L1267: 491*2 | M1267: 1000*LV+100000 | N1267: 0 | O1267: math.max(0,(lv/10)-1) | P1267: math.max(0,(lv/10)-1) | Q1267: math.max(0,(lv/10)-1) | R1267: 0; | S1267: 有药王谷和盘丝洞的弟子在，真是不爽，还是跑路算了！ | T1267: 药王谷和盘丝洞的弟子不在眼前，真是轻松愉快啊！ | U1267: 0 | V1267: 0,0; | W1267: 5
A1268: 13301 | B1268: 熊猫武师 | C1268: pet_13 | D1268: 0 | E1268: 0 | F1268: 1311,100;1315,100;1312,100; | G1268: 5103,100;5108,100; | H1268: 7797*1.5 | I1268: 3148-500 | J1268: 1375 | K1268: 993*0.5 | L1268: 492*1.2 | M1268: 1000*LV+100000 | N1268: 0 | O1268: math.max(0,(lv/10)-1) | P1268: math.max(0,(lv/10)-1) | Q1268: math.max(0,(lv/10)-1) | R1268: 0; | S1268: 有药王谷和盘丝洞的弟子在，真是不爽，还是跑路算了！ | T1268: 药王谷和盘丝洞的弟子不在眼前，真是轻松愉快啊！ | U1268: 0 | V1268: 0,0; | W1268: 4
A1269: 13302 | B1269: 仙鹤童子 | C1269: pet_33 | D1269: 0 | E1269: 0 | F1269: 1212,100;1211,100; | G1269: 5138,100;5131,100; | H1269: 7797*1.2*1.5 | I1269: 3148*0.5-500 | J1269: 1375*1.2 | K1269: 993*0.5 | L1269: 492*1.5 | M1269: 1000*LV+100000 | N1269: 0 | O1269: math.max(0,(lv/10)-1) | P1269: math.max(0,(lv/10)-1) | Q1269: math.max(0,(lv/10)-1) | R1269: 0; | S1269: 有药王谷和盘丝洞的弟子在，真是不爽，还是跑路算了！ | T1269: 药王谷和盘丝洞的弟子不在眼前，真是轻松愉快啊！ | U1269: 0 | V1269: 0,0; | W1269: 3
A1270: 13311 | B1270: 天策府弟子 | C1270: hero_1001 | D1270: 0 | E1270: 0 | F1270: 1112,100;1111,100; | G1270: 0,0; | H1270: 8290*1.5 | I1270: 3329-500 | J1270: 1462 | K1270: 1047*0.5 | L1270: 518*1.2 | M1270: 1000*LV+100000 | N1270: 0 | O1270: math.max(0,(lv/10)-1) | P1270: math.max(0,(lv/10)-1) | Q1270: math.max(0,(lv/10)-1) | R1270: 0; | S1270: 有药王谷和盘丝洞的弟子在，真是不爽，还是跑路算了！ | T1270: 药王谷和盘丝洞的弟子不在眼前，真是轻松愉快啊！ | U1270: 0 | V1270: 0,0; | W1270: 1
A1271: 13312 | B1271: 盘丝弟子 | C1271: hero_2001 | D1271: 0 | E1271: 0 | F1271: 1511,100;1513,100; | G1271: 0,0; | H1271: 8290*0.8*1.5 | I1271: 3329*0.5-500 | J1271: 1462 | K1271: 1047 | L1271: 518*2 | M1271: 1000*LV+100000 | N1271: 0 | O1271: math.max(0,(lv/10)-1) | P1271: math.max(0,(lv/10)-1) | Q1271: math.max(0,(lv/10)-1) | R1271: 0; | S1271: 有药王谷和盘丝洞的弟子在，真是不爽，还是跑路算了！ | T1271: 药王谷和盘丝洞的弟子不在眼前，真是轻松愉快啊！ | U1271: 0 | V1271: 0,0; | W1271: 5
A1272: 13313 | B1272: 天策府弟子 | C1272: hero_1001 | D1272: 0 | E1272: 0 | F1272: 1112,100;1111,100; | G1272: 0,0; | H1272: 8290*1.5 | I1272: 3329-500 | J1272: 1462 | K1272: 1047*0.5 | L1272: 518*1.2 | M1272: 1000*LV+100000 | N1272: 0 | O1272: math.max(0,(lv/10)-1) | P1272: math.max(0,(lv/10)-1) | Q1272: math.max(0,(lv/10)-1) | R1272: 0; | S1272: 有药王谷和盘丝洞的弟子在，真是不爽，还是跑路算了！ | T1272: 药王谷和盘丝洞的弟子不在眼前，真是轻松愉快啊！ | U1272: 0 | V1272: 0,0; | W1272: 1
A1273: 13314 | B1273: 熊猫武师 | C1273: pet_13 | D1273: 0 | E1273: 0 | F1273: 1311,100;1315,100;1312,100; | G1273: 0,0; | H1273: 8290*1.5 | I1273: 3329-500 | J1273: 1462 | K1273: 1047*0.5 | L1273: 518*1.2 | M1273: 1000*LV+100000 | N1273: 0 | O1273: math.max(0,(lv/10)-1) | P1273: math.max(0,(lv/10)-1) | Q1273: math.max(0,(lv/10)-1) | R1273: 0; | S1273: 有药王谷和盘丝洞的弟子在，真是不爽，还是跑路算了！ | T1273: 药王谷和盘丝洞的弟子不在眼前，真是轻松愉快啊！ | U1273: 0 | V1273: 0,0; | W1273: 4
A1274: 13321 | B1274: 兽王弟子 | C1274: hero_1001 | D1274: 0 | E1274: 0 | F1274: 1312,100;1315,100; | G1274: 0,0; | H1274: 8307*1.5 | I1274: 3338-500 | J1274: 1466 | K1274: 1050*0.5 | L1274: 520*1.2 | M1274: 1000*LV+100000 | N1274: 0 | O1274: math.max(0,(lv/10)-1) | P1274: math.max(0,(lv/10)-1) | Q1274: math.max(0,(lv/10)-1) | R1274: 0; | S1274: 有药王谷和盘丝洞的弟子在，真是不爽，还是跑路算了！ | T1274: 药王谷和盘丝洞的弟子不在眼前，真是轻松愉快啊！ | U1274: 0 | V1274: 0,0; | W1274: 4
A1275: 13322 | B1275: 阴阳师 | C1275: pet_52 | D1275: 0 | E1275: 0 | F1275: 1411,100;1412,100; | G1275: 0,0; | H1275: 8307*1.5 | I1275: 3338*0.5-500 | J1275: 1466*0.8 | K1275: 1050*1.5 | L1275: 520*0.8 | M1275: 1000*LV+100000 | N1275: 0 | O1275: math.max(0,(lv/10)-1) | P1275: math.max(0,(lv/10)-1) | Q1275: math.max(0,(lv/10)-1) | R1275: 0; | S1275: 有药王谷和盘丝洞的弟子在，真是不爽，还是跑路算了！ | T1275: 药王谷和盘丝洞的弟子不在眼前，真是轻松愉快啊！ | U1275: 0 | V1275: 0,0; | W1275: 2
A1276: 13323 | B1276: 帮凶 | C1276: pet_43 | D1276: 0 | E1276: 0 | F1276: 1112,100;1111,100; | G1276: 0,0; | H1276: 8307*1.5 | I1276: 3338-500 | J1276: 1466 | K1276: 1050*0.5 | L1276: 520*1.2 | M1276: 1000*LV+100000 | N1276: 0 | O1276: math.max(0,(lv/10)-1) | P1276: math.max(0,(lv/10)-1) | Q1276: math.max(0,(lv/10)-1) | R1276: 0; | S1276: 有药王谷和盘丝洞的弟子在，真是不爽，还是跑路算了！ | T1276: 药王谷和盘丝洞的弟子不在眼前，真是轻松愉快啊！ | U1276: 0 | V1276: 0,0; | W1276: 1
A1277: 13331 | B1277: 水晶宫弟子 | C1277: hero_1001 | D1277: 0 | E1277: 0 | F1277: 1411,100;1412,100; | G1277: 0,0; | H1277: 8324*1.5 | I1277: 3348*0.5-500 | J1277: 1469*0.8 | K1277: 1054*1.5 | L1277: 521*0.8 | M1277: 1000*LV+100000 | N1277: 0 | O1277: math.max(0,(lv/10)-1) | P1277: math.max(0,(lv/10)-1) | Q1277: math.max(0,(lv/10)-1) | R1277: 0; | S1277: 有药王谷和盘丝洞的弟子在，真是不爽，还是跑路算了！ | T1277: 药王谷和盘丝洞的弟子不在眼前，真是轻松愉快啊！ | U1277: 0 | V1277: 0,0; | W1277: 2
A1278: 13332 | B1278: 阴阳师 | C1278: pet_52 | D1278: 0 | E1278: 0 | F1278: 1411,100;1412,100; | G1278: 0,0; | H1278: 8324*1.5 | I1278: 3348*0.5-500 | J1278: 1469*0.8 | K1278: 1054*1.5 | L1278: 521*0.8 | M1278: 1000*LV+100000 | N1278: 0 | O1278: math.max(0,(lv/10)-1) | P1278: math.max(0,(lv/10)-1) | Q1278: math.max(0,(lv/10)-1) | R1278: 0; | S1278: 有药王谷和盘丝洞的弟子在，真是不爽，还是跑路算了！ | T1278: 药王谷和盘丝洞的弟子不在眼前，真是轻松愉快啊！ | U1278: 0 | V1278: 0,0; | W1278: 2
A1279: 13333 | B1279: 水晶宫外门弟子 | C1279: hero_2001 | D1279: 0 | E1279: 0 | F1279: 5309,100; | G1279: 5103,100; | H1279: 8324*1.5 | I1279: 3348-500 | J1279: 1469 | K1279: 1054*0.5 | L1279: 521*1.2 | M1279: 1000*LV+100000 | N1279: 0 | O1279: math.max(0,(lv/10)-1) | P1279: math.max(0,(lv/10)-1) | Q1279: math.max(0,(lv/10)-1) | R1279: 0; | S1279: 有药王谷和盘丝洞的弟子在，真是不爽，还是跑路算了！ | T1279: 药王谷和盘丝洞的弟子不在眼前，真是轻松愉快啊！ | U1279: 0 | V1279: 0,0; | W1279: 0
A1280: 13341 | B1280: 魔女 | C1280: pet_53 | D1280: 0 | E1280: 0 | F1280: 1511,100;1513,100; | G1280: 5132,100;5126,100; | H1280: 8341*0.8*1.5 | I1280: 3356*0.5-500 | J1280: 1472 | K1280: 1058 | L1280: 523*2 | M1280: 1000*LV+100000 | N1280: 0 | O1280: math.max(0,(lv/10)-1) | P1280: math.max(0,(lv/10)-1) | Q1280: math.max(0,(lv/10)-1) | R1280: 0; | S1280: 有药王谷和盘丝洞的弟子在，真是不爽，还是跑路算了！ | T1280: 药王谷和盘丝洞的弟子不在眼前，真是轻松愉快啊！ | U1280: 0 | V1280: 0,0; | W1280: 5
A1281: 13342 | B1281: 熊猫武师 | C1281: pet_13 | D1281: 0 | E1281: 0 | F1281: 1311,100;1315,100;1312,100; | G1281: 5103,100;5108,100; | H1281: 8341*1.5 | I1281: 3356-500 | J1281: 1472 | K1281: 1058*0.5 | L1281: 523*1.2 | M1281: 1000*LV+100000 | N1281: 0 | O1281: math.max(0,(lv/10)-1) | P1281: math.max(0,(lv/10)-1) | Q1281: math.max(0,(lv/10)-1) | R1281: 0; | S1281: 有药王谷和盘丝洞的弟子在，真是不爽，还是跑路算了！ | T1281: 药王谷和盘丝洞的弟子不在眼前，真是轻松愉快啊！ | U1281: 0 | V1281: 0,0; | W1281: 4
A1282: 13343 | B1282: 天策府弟子 | C1282: hero_1001 | D1282: 0 | E1282: 0 | F1282: 1112,100;1111,100; | G1282: 5109,100;5116,100; | H1282: 8341*1.5 | I1282: 3356-500 | J1282: 1472 | K1282: 1058*0.5 | L1282: 523*1.2 | M1282: 1000*LV+100000 | N1282: 0 | O1282: math.max(0,(lv/10)-1) | P1282: math.max(0,(lv/10)-1) | Q1282: math.max(0,(lv/10)-1) | R1282: 0; | S1282: 有药王谷和盘丝洞的弟子在，真是不爽，还是跑路算了！ | T1282: 药王谷和盘丝洞的弟子不在眼前，真是轻松愉快啊！ | U1282: 0 | V1282: 0,0; | W1282: 1
A1283: 13351 | B1283: 熊猫武师 | C1283: pet_13 | D1283: 0 | E1283: 0 | F1283: 1311,100;1315,100;1312,100; | G1283: 5103,100;5108,100; | H1283: 8364*1.5 | I1283: 3365-500 | J1283: 1475 | K1283: 1062*0.5 | L1283: 524*1.2 | M1283: 1000*LV+100000 | N1283: 0 | O1283: math.max(0,(lv/10)-1) | P1283: math.max(0,(lv/10)-1) | Q1283: math.max(0,(lv/10)-1) | R1283: 0; | S1283: 有药王谷和盘丝洞的弟子在，真是不爽，还是跑路算了！ | T1283: 药王谷和盘丝洞的弟子不在眼前，真是轻松愉快啊！ | U1283: 0 | V1283: 0,0; | W1283: 4
A1284: 13352 | B1284: 盘丝弟子 | C1284: hero_2001 | D1284: 0 | E1284: 0 | F1284: 1511,100;1513,100; | G1284: 5132,100;5126,100; | H1284: 8364*0.8*1.5 | I1284: 3365*0.5-500 | J1284: 1475 | K1284: 1062 | L1284: 524*2 | M1284: 1000*LV+100000 | N1284: 0 | O1284: math.max(0,(lv/10)-1) | P1284: math.max(0,(lv/10)-1) | Q1284: math.max(0,(lv/10)-1) | R1284: 0; | S1284: 有药王谷和盘丝洞的弟子在，真是不爽，还是跑路算了！ | T1284: 药王谷和盘丝洞的弟子不在眼前，真是轻松愉快啊！ | U1284: 0 | V1284: 0,0; | W1284: 5
A1285: 13353 | B1285: 仙鹤童子 | C1285: pet_33 | D1285: 0 | E1285: 0 | F1285: 1212,100;1211,100; | G1285: 5138,100;5131,100; | H1285: 8364*1.2*1.5 | I1285: 3365*0.5-500 | J1285: 1475*1.2 | K1285: 1062*0.5 | L1285: 524*1.5 | M1285: 1000*LV+100000 | N1285: 0 | O1285: math.max(0,(lv/10)-1) | P1285: math.max(0,(lv/10)-1) | Q1285: math.max(0,(lv/10)-1) | R1285: 0; | S1285: 有药王谷和盘丝洞的弟子在，真是不爽，还是跑路算了！ | T1285: 药王谷和盘丝洞的弟子不在眼前，真是轻松愉快啊！ | U1285: 0 | V1285: 0,0; | W1285: 3
A1286: 13361 | B1286: 仙鹤童子 | C1286: pet_33 | D1286: 0 | E1286: 0 | F1286: 1212,100;1211,100; | G1286: 0,0; | H1286: 8437*1.2*1.5 | I1286: 3392*0.5-500 | J1286: 1488*1.2 | K1286: 1071*0.5 | L1286: 528*1.5 | M1286: 1000*LV+100000 | N1286: 0 | O1286: math.max(0,(lv/10)-1) | P1286: math.max(0,(lv/10)-1) | Q1286: math.max(0,(lv/10)-1) | R1286: 0; | S1286: 有药王谷和盘丝洞的弟子在，真是不爽，还是跑路算了！ | T1286: 药王谷和盘丝洞的弟子不在眼前，真是轻松愉快啊！ | U1286: 0 | V1286: 0,0; | W1286: 3
A1287: 13362 | B1287: 魔女 | C1287: pet_53 | D1287: 0 | E1287: 0 | F1287: 1511,100;1513,100; | G1287: 0,0; | H1287: 8437*0.8*1.5 | I1287: 3392*0.5-500 | J1287: 1488 | K1287: 1071 | L1287: 528*2 | M1287: 1000*LV+100000 | N1287: 0 | O1287: math.max(0,(lv/10)-1) | P1287: math.max(0,(lv/10)-1) | Q1287: math.max(0,(lv/10)-1) | R1287: 0; | S1287: 有药王谷和盘丝洞的弟子在，真是不爽，还是跑路算了！ | T1287: 药王谷和盘丝洞的弟子不在眼前，真是轻松愉快啊！ | U1287: 0 | V1287: 0,0; | W1287: 5
A1288: 13363 | B1288: 阴阳师 | C1288: pet_52 | D1288: 0 | E1288: 0 | F1288: 1411,100;1412,100; | G1288: 0,0; | H1288: 8437*1.5 | I1288: 3392*0.5-500 | J1288: 1488*0.8 | K1288: 1071*1.5 | L1288: 528*0.8 | M1288: 1000*LV+100000 | N1288: 0 | O1288: math.max(0,(lv/10)-1) | P1288: math.max(0,(lv/10)-1) | Q1288: math.max(0,(lv/10)-1) | R1288: 0; | S1288: 有药王谷和盘丝洞的弟子在，真是不爽，还是跑路算了！ | T1288: 药王谷和盘丝洞的弟子不在眼前，真是轻松愉快啊！ | U1288: 0 | V1288: 0,0; | W1288: 2
A1289: 13364 | B1289: 剑灵 | C1289: pet_21 | D1289: 0 | E1289: 0 | F1289: 5309,100; | G1289: 0,0; | H1289: 8437*1.5 | I1289: 3392-500 | J1289: 1488 | K1289: 1071*0.5 | L1289: 528*1.2 | M1289: 1000*LV+100000 | N1289: 0 | O1289: math.max(0,(lv/10)-1) | P1289: math.max(0,(lv/10)-1) | Q1289: math.max(0,(lv/10)-1) | R1289: 0; | S1289: 有药王谷和盘丝洞的弟子在，真是不爽，还是跑路算了！ | T1289: 药王谷和盘丝洞的弟子不在眼前，真是轻松愉快啊！ | U1289: 0 | V1289: 0,0; | W1289: 0
A1290: 13371 | B1290: 兽王弟子 | C1290: hero_1001 | D1290: 0 | E1290: 0 | F1290: 1312,100;1315,100; | G1290: 0,0; | H1290: 8454*1.5 | I1290: 3400-500 | J1290: 1491 | K1290: 1074*0.5 | L1290: 529*1.2 | M1290: 1000*LV+100000 | N1290: 0 | O1290: math.max(0,(lv/10)-1) | P1290: math.max(0,(lv/10)-1) | Q1290: math.max(0,(lv/10)-1) | R1290: 0; | S1290: 有药王谷和盘丝洞的弟子在，真是不爽，还是跑路算了！ | T1290: 药王谷和盘丝洞的弟子不在眼前，真是轻松愉快啊！ | U1290: 0 | V1290: 0,0; | W1290: 4
A1291: 13372 | B1291: 剑灵 | C1291: pet_21 | D1291: 0 | E1291: 0 | F1291: 5309,100; | G1291: 0,0; | H1291: 8454*1.5 | I1291: 3400-500 | J1291: 1491 | K1291: 1074*0.5 | L1291: 529*1.2 | M1291: 1000*LV+100000 | N1291: 0 | O1291: math.max(0,(lv/10)-1) | P1291: math.max(0,(lv/10)-1) | Q1291: math.max(0,(lv/10)-1) | R1291: 0; | S1291: 有药王谷和盘丝洞的弟子在，真是不爽，还是跑路算了！ | T1291: 药王谷和盘丝洞的弟子不在眼前，真是轻松愉快啊！ | U1291: 0 | V1291: 0,0; | W1291: 0
A1292: 13381 | B1292: 水晶宫弟子 | C1292: hero_1001 | D1292: 0 | E1292: 0 | F1292: 1411,100;1412,100; | G1292: 0,0; | H1292: 8471*1.5 | I1292: 3409*0.5-500 | J1292: 1494*0.8 | K1292: 1079*1.5 | L1292: 531*0.8 | M1292: 1000*LV+100000 | N1292: 0 | O1292: math.max(0,(lv/10)-1) | P1292: math.max(0,(lv/10)-1) | Q1292: math.max(0,(lv/10)-1) | R1292: 0; | S1292: 有药王谷和盘丝洞的弟子在，真是不爽，还是跑路算了！ | T1292: 药王谷和盘丝洞的弟子不在眼前，真是轻松愉快啊！ | U1292: 0 | V1292: 0,0; | W1292: 2
A1293: 13382 | B1293: 天策府弟子 | C1293: hero_1001 | D1293: 0 | E1293: 0 | F1293: 1112,100;1111,100; | G1293: 0,0; | H1293: 8471*1.5 | I1293: 3409-500 | J1293: 1494 | K1293: 1079*0.5 | L1293: 531*1.2 | M1293: 1000*LV+100000 | N1293: 0 | O1293: math.max(0,(lv/10)-1) | P1293: math.max(0,(lv/10)-1) | Q1293: math.max(0,(lv/10)-1) | R1293: 0; | S1293: 有药王谷和盘丝洞的弟子在，真是不爽，还是跑路算了！ | T1293: 药王谷和盘丝洞的弟子不在眼前，真是轻松愉快啊！ | U1293: 0 | V1293: 0,0; | W1293: 1
A1294: 13383 | B1294: 水晶宫外门弟子 | C1294: hero_2001 | D1294: 0 | E1294: 0 | F1294: 5309,100; | G1294: 5103,100; | H1294: 8471*1.5 | I1294: 3409-500 | J1294: 1494 | K1294: 1079*0.5 | L1294: 531*1.2 | M1294: 1000*LV+100000 | N1294: 0 | O1294: math.max(0,(lv/10)-1) | P1294: math.max(0,(lv/10)-1) | Q1294: math.max(0,(lv/10)-1) | R1294: 0; | S1294: 有药王谷和盘丝洞的弟子在，真是不爽，还是跑路算了！ | T1294: 药王谷和盘丝洞的弟子不在眼前，真是轻松愉快啊！ | U1294: 0 | V1294: 0,0; | W1294: 0
A1295: 13391 | B1295: 兽王弟子 | C1295: hero_1001 | D1295: 0 | E1295: 0 | F1295: 1312,100;1315,100; | G1295: 5103,100;5108,100; | H1295: 8488*1.5 | I1295: 3418-500 | J1295: 1497 | K1295: 1082*0.5 | L1295: 532*1.2 | M1295: 1000*LV+100000 | N1295: 0 | O1295: math.max(0,(lv/10)-1) | P1295: math.max(0,(lv/10)-1) | Q1295: math.max(0,(lv/10)-1) | R1295: 0; | S1295: 有药王谷和盘丝洞的弟子在，真是不爽，还是跑路算了！ | T1295: 药王谷和盘丝洞的弟子不在眼前，真是轻松愉快啊！ | U1295: 0 | V1295: 0,0; | W1295: 4
A1296: 13392 | B1296: 熊猫武师 | C1296: pet_13 | D1296: 0 | E1296: 0 | F1296: 1311,100;1315,100;1312,100; | G1296: 5103,100;5108,100; | H1296: 8488*1.5 | I1296: 3418-500 | J1296: 1497 | K1296: 1082*0.5 | L1296: 532*1.2 | M1296: 1000*LV+100000 | N1296: 0 | O1296: math.max(0,(lv/10)-1) | P1296: math.max(0,(lv/10)-1) | Q1296: math.max(0,(lv/10)-1) | R1296: 0; | S1296: 有药王谷和盘丝洞的弟子在，真是不爽，还是跑路算了！ | T1296: 药王谷和盘丝洞的弟子不在眼前，真是轻松愉快啊！ | U1296: 0 | V1296: 0,0; | W1296: 4
A1297: 13401 | B1297: 熊猫武师 | C1297: pet_13 | D1297: 0 | E1297: 0 | F1297: 1311,100;1315,100;1312,100; | G1297: 5103,100;5108,100; | H1297: 8505*1.5 | I1297: 3427-500 | J1297: 1501 | K1297: 1086*0.5 | L1297: 534*1.2 | M1297: 1000*LV+100000 | N1297: 0 | O1297: math.max(0,(lv/10)-1) | P1297: math.max(0,(lv/10)-1) | Q1297: math.max(0,(lv/10)-1) | R1297: 0; | S1297: 有药王谷和盘丝洞的弟子在，真是不爽，还是跑路算了！ | T1297: 药王谷和盘丝洞的弟子不在眼前，真是轻松愉快啊！ | U1297: 0 | V1297: 0,0; | W1297: 4
A1298: 13402 | B1298: 魔女 | C1298: pet_53 | D1298: 0 | E1298: 0 | F1298: 1511,100;1513,100; | G1298: 5132,100;5126,100; | H1298: 8505*0.8*1.5 | I1298: 3427*0.5-500 | J1298: 1501 | K1298: 1086 | L1298: 534*2 | M1298: 1000*LV+100000 | N1298: 0 | O1298: math.max(0,(lv/10)-1) | P1298: math.max(0,(lv/10)-1) | Q1298: math.max(0,(lv/10)-1) | R1298: 0; | S1298: 有药王谷和盘丝洞的弟子在，真是不爽，还是跑路算了！ | T1298: 药王谷和盘丝洞的弟子不在眼前，真是轻松愉快啊！ | U1298: 0 | V1298: 0,0; | W1298: 5
A1299: 13403 | B1299: 帮凶 | C1299: pet_43 | D1299: 0 | E1299: 0 | F1299: 1112,100;1111,100; | G1299: 5205,100;5123,100; | H1299: 8505*1.5 | I1299: 3427-500 | J1299: 1501 | K1299: 1086*0.5 | L1299: 534*1.2 | M1299: 1000*LV+100000 | N1299: 0 | O1299: math.max(0,(lv/10)-1) | P1299: math.max(0,(lv/10)-1) | Q1299: math.max(0,(lv/10)-1) | R1299: 0; | S1299: 有药王谷和盘丝洞的弟子在，真是不爽，还是跑路算了！ | T1299: 药王谷和盘丝洞的弟子不在眼前，真是轻松愉快啊！ | U1299: 0 | V1299: 0,0; | W1299: 1
A1300: 13404 | B1300: 熊猫武师 | C1300: pet_13 | D1300: 0 | E1300: 0 | F1300: 1311,100;1315,100;1312,100; | G1300: 5103,100;5108,100; | H1300: 8505*1.5 | I1300: 3427-500 | J1300: 1501 | K1300: 1086*0.5 | L1300: 534*1.2 | M1300: 1000*LV+100000 | N1300: 0 | O1300: math.max(0,(lv/10)-1) | P1300: math.max(0,(lv/10)-1) | Q1300: math.max(0,(lv/10)-1) | R1300: 0; | S1300: 有药王谷和盘丝洞的弟子在，真是不爽，还是跑路算了！ | T1300: 药王谷和盘丝洞的弟子不在眼前，真是轻松愉快啊！ | U1300: 0 | V1300: 0,0; | W1300: 4
A1301: 13411 | B1301: 水晶宫弟子 | C1301: hero_1001 | D1301: 0 | E1301: 0 | F1301: 1411,100;1412,100; | G1301: 0,0; | H1301: 8175*1.5 | I1301: 3549*0.5-500 | J1301: 1603*0.8 | K1301: 1148*1.5 | L1301: 562*0.8 | M1301: 1000*LV+100000 | N1301: 0 | O1301: math.max(0,(lv/10)-1) | P1301: math.max(0,(lv/10)-1) | Q1301: math.max(0,(lv/10)-1) | R1301: 0; | S1301: 有药王谷和盘丝洞的弟子在，真是不爽，还是跑路算了！ | T1301: 药王谷和盘丝洞的弟子不在眼前，真是轻松愉快啊！ | U1301: 0 | V1301: 0,0; | W1301: 2
A1302: 13412 | B1302: 药王谷弟子 | C1302: hero_1001 | D1302: 0 | E1302: 0 | F1302: 1212,100;1211,100; | G1302: 0,0; | H1302: 8175*1.2*1.5 | I1302: 3549*0.5-500 | J1302: 1603*1.2 | K1302: 1148*0.5 | L1302: 562*1.5 | M1302: 1000*LV+100000 | N1302: 0 | O1302: math.max(0,(lv/10)-1) | P1302: math.max(0,(lv/10)-1) | Q1302: math.max(0,(lv/10)-1) | R1302: 0; | S1302: 有药王谷和盘丝洞的弟子在，真是不爽，还是跑路算了！ | T1302: 药王谷和盘丝洞的弟子不在眼前，真是轻松愉快啊！ | U1302: 0 | V1302: 0,0; | W1302: 3
A1303: 13413 | B1303: 药王谷外门弟子 | C1303: hero_2001 | D1303: 0 | E1303: 0 | F1303: 5305,100; | G1303: 0,0; | H1303: 8175*1.5 | I1303: 3549*0.5-500 | J1303: 1603*0.8 | K1303: 1148*1.5 | L1303: 562*0.8 | M1303: 1000*LV+100000 | N1303: 0 | O1303: math.max(0,(lv/10)-1) | P1303: math.max(0,(lv/10)-1) | Q1303: math.max(0,(lv/10)-1) | R1303: 0; | S1303: 有药王谷和盘丝洞的弟子在，真是不爽，还是跑路算了！ | T1303: 药王谷和盘丝洞的弟子不在眼前，真是轻松愉快啊！ | U1303: 0 | V1303: 0,0; | W1303: 0
A1304: 13414 | B1304: 药王谷外门弟子 | C1304: hero_2001 | D1304: 0 | E1304: 0 | F1304: 5305,100; | G1304: 0,0; | H1304: 8175*1.5 | I1304: 3549*0.5-500 | J1304: 1603*0.8 | K1304: 1148*1.5 | L1304: 562*0.8 | M1304: 1000*LV+100000 | N1304: 0 | O1304: math.max(0,(lv/10)-1) | P1304: math.max(0,(lv/10)-1) | Q1304: math.max(0,(lv/10)-1) | R1304: 0; | S1304: 有药王谷和盘丝洞的弟子在，真是不爽，还是跑路算了！ | T1304: 药王谷和盘丝洞的弟子不在眼前，真是轻松愉快啊！ | U1304: 0 | V1304: 0,0; | W1304: 0
A1305: 13421 | B1305: 水晶宫弟子 | C1305: hero_1001 | D1305: 0 | E1305: 0 | F1305: 1411,100;1412,100; | G1305: 0,0; | H1305: 8195*1.5 | I1305: 3558*0.5-500 | J1305: 1606*0.8 | K1305: 1152*1.5 | L1305: 564*0.8 | M1305: 1000*LV+100000 | N1305: 0 | O1305: math.max(0,(lv/10)-1) | P1305: math.max(0,(lv/10)-1) | Q1305: math.max(0,(lv/10)-1) | R1305: 0; | S1305: 有药王谷和盘丝洞的弟子在，真是不爽，还是跑路算了！ | T1305: 药王谷和盘丝洞的弟子不在眼前，真是轻松愉快啊！ | U1305: 0 | V1305: 0,0; | W1305: 2
A1306: 13422 | B1306: 天策府弟子 | C1306: hero_1001 | D1306: 0 | E1306: 0 | F1306: 1112,100;1111,100; | G1306: 0,0; | H1306: 8195*1.5 | I1306: 3558-500 | J1306: 1606 | K1306: 1152*0.5 | L1306: 564*1.2 | M1306: 1000*LV+100000 | N1306: 0 | O1306: math.max(0,(lv/10)-1) | P1306: math.max(0,(lv/10)-1) | Q1306: math.max(0,(lv/10)-1) | R1306: 0; | S1306: 有药王谷和盘丝洞的弟子在，真是不爽，还是跑路算了！ | T1306: 药王谷和盘丝洞的弟子不在眼前，真是轻松愉快啊！ | U1306: 0 | V1306: 0,0; | W1306: 1
A1307: 13423 | B1307: 水晶宫外门弟子 | C1307: hero_2001 | D1307: 0 | E1307: 0 | F1307: 5309,100; | G1307: 5103,100; | H1307: 8195*1.5 | I1307: 3558-500 | J1307: 1606 | K1307: 1152*0.5 | L1307: 564*1.2 | M1307: 1000*LV+100000 | N1307: 0 | O1307: math.max(0,(lv/10)-1) | P1307: math.max(0,(lv/10)-1) | Q1307: math.max(0,(lv/10)-1) | R1307: 0; | S1307: 有药王谷和盘丝洞的弟子在，真是不爽，还是跑路算了！ | T1307: 药王谷和盘丝洞的弟子不在眼前，真是轻松愉快啊！ | U1307: 0 | V1307: 0,0; | W1307: 0
A1308: 13431 | B1308: 水晶宫弟子 | C1308: hero_1001 | D1308: 0 | E1308: 0 | F1308: 1411,100;1412,100; | G1308: 0,0; | H1308: 8211*1.5 | I1308: 3567*0.5-500 | J1308: 1609*0.8 | K1308: 1156*1.5 | L1308: 565*0.8 | M1308: 1000*LV+100000 | N1308: 0 | O1308: math.max(0,(lv/10)-1) | P1308: math.max(0,(lv/10)-1) | Q1308: math.max(0,(lv/10)-1) | R1308: 0; | S1308: 有药王谷和盘丝洞的弟子在，真是不爽，还是跑路算了！ | T1308: 药王谷和盘丝洞的弟子不在眼前，真是轻松愉快啊！ | U1308: 0 | V1308: 0,0; | W1308: 2
A1309: 13432 | B1309: 仙鹤童子 | C1309: pet_33 | D1309: 0 | E1309: 0 | F1309: 1212,100;1211,100; | G1309: 0,0; | H1309: 8211*1.2*1.5 | I1309: 3567*0.5-500 | J1309: 1609*1.2 | K1309: 1156*0.5 | L1309: 565*1.5 | M1309: 1000*LV+100000 | N1309: 0 | O1309: math.max(0,(lv/10)-1) | P1309: math.max(0,(lv/10)-1) | Q1309: math.max(0,(lv/10)-1) | R1309: 0; | S1309: 有药王谷和盘丝洞的弟子在，真是不爽，还是跑路算了！ | T1309: 药王谷和盘丝洞的弟子不在眼前，真是轻松愉快啊！ | U1309: 0 | V1309: 0,0; | W1309: 3
A1310: 13433 | B1310: 熊猫武师 | C1310: pet_13 | D1310: 0 | E1310: 0 | F1310: 1311,100;1315,100;1312,100; | G1310: 0,0; | H1310: 8211*1.5 | I1310: 3567-500 | J1310: 1609 | K1310: 1156*0.5 | L1310: 565*1.2 | M1310: 1000*LV+100000 | N1310: 0 | O1310: math.max(0,(lv/10)-1) | P1310: math.max(0,(lv/10)-1) | Q1310: math.max(0,(lv/10)-1) | R1310: 0; | S1310: 有药王谷和盘丝洞的弟子在，真是不爽，还是跑路算了！ | T1310: 药王谷和盘丝洞的弟子不在眼前，真是轻松愉快啊！ | U1310: 0 | V1310: 0,0; | W1310: 4
A1311: 13441 | B1311: 熊猫武师 | C1311: pet_13 | D1311: 0 | E1311: 0 | F1311: 1311,100;1315,100;1312,100; | G1311: 5103,100;5108,100; | H1311: 8226*1.5 | I1311: 3575-500 | J1311: 1612 | K1311: 1160*0.5 | L1311: 567*1.2 | M1311: 1000*LV+100000 | N1311: 0 | O1311: math.max(0,(lv/10)-1) | P1311: math.max(0,(lv/10)-1) | Q1311: math.max(0,(lv/10)-1) | R1311: 0; | S1311: 有药王谷和盘丝洞的弟子在，真是不爽，还是跑路算了！ | T1311: 药王谷和盘丝洞的弟子不在眼前，真是轻松愉快啊！ | U1311: 0 | V1311: 0,0; | W1311: 4
A1312: 13442 | B1312: 仙鹤童子 | C1312: pet_33 | D1312: 0 | E1312: 0 | F1312: 1212,100;1211,100; | G1312: 5138,100;5131,100; | H1312: 8226*1.2*1.5 | I1312: 3575*0.5-500 | J1312: 1612*1.2 | K1312: 1160*0.5 | L1312: 567*1.5 | M1312: 1000*LV+100000 | N1312: 0 | O1312: math.max(0,(lv/10)-1) | P1312: math.max(0,(lv/10)-1) | Q1312: math.max(0,(lv/10)-1) | R1312: 0; | S1312: 有药王谷和盘丝洞的弟子在，真是不爽，还是跑路算了！ | T1312: 药王谷和盘丝洞的弟子不在眼前，真是轻松愉快啊！ | U1312: 0 | V1312: 0,0; | W1312: 3
A1313: 13443 | B1313: 魔女 | C1313: pet_53 | D1313: 0 | E1313: 0 | F1313: 1511,100;1513,100; | G1313: 5132,100;5126,100; | H1313: 8226*0.8*1.5 | I1313: 3575*0.5-500 | J1313: 1612 | K1313: 1160 | L1313: 567*2 | M1313: 1000*LV+100000 | N1313: 0 | O1313: math.max(0,(lv/10)-1) | P1313: math.max(0,(lv/10)-1) | Q1313: math.max(0,(lv/10)-1) | R1313: 0; | S1313: 有药王谷和盘丝洞的弟子在，真是不爽，还是跑路算了！ | T1313: 药王谷和盘丝洞的弟子不在眼前，真是轻松愉快啊！ | U1313: 0 | V1313: 0,0; | W1313: 5
A1314: 13451 | B1314: 兽王弟子 | C1314: hero_1001 | D1314: 0 | E1314: 0 | F1314: 1312,100;1315,100; | G1314: 5103,100;5108,100; | H1314: 8241*1.5 | I1314: 3584-500 | J1314: 1616 | K1314: 1163*0.5 | L1314: 568*1.2 | M1314: 1000*LV+100000 | N1314: 0 | O1314: math.max(0,(lv/10)-1) | P1314: math.max(0,(lv/10)-1) | Q1314: math.max(0,(lv/10)-1) | R1314: 0; | S1314: 有药王谷和盘丝洞的弟子在，真是不爽，还是跑路算了！ | T1314: 药王谷和盘丝洞的弟子不在眼前，真是轻松愉快啊！ | U1314: 0 | V1314: 0,0; | W1314: 4
A1315: 13452 | B1315: 魔女 | C1315: pet_53 | D1315: 0 | E1315: 0 | F1315: 1511,100;1513,100; | G1315: 5132,100;5126,100; | H1315: 8241*0.8*1.5 | I1315: 3584*0.5-500 | J1315: 1616 | K1315: 1163 | L1315: 568*2 | M1315: 1000*LV+100000 | N1315: 0 | O1315: math.max(0,(lv/10)-1) | P1315: math.max(0,(lv/10)-1) | Q1315: math.max(0,(lv/10)-1) | R1315: 0; | S1315: 有药王谷和盘丝洞的弟子在，真是不爽，还是跑路算了！ | T1315: 药王谷和盘丝洞的弟子不在眼前，真是轻松愉快啊！ | U1315: 0 | V1315: 0,0; | W1315: 5
A1316: 13461 | B1316: 帮凶 | C1316: pet_43 | D1316: 0 | E1316: 0 | F1316: 1112,100;1111,100; | G1316: 0,0; | H1316: 8262*1.5 | I1316: 3592-500 | J1316: 1619 | K1316: 1168*0.5 | L1316: 570*1.2 | M1316: 1000*LV+100000 | N1316: 0 | O1316: math.max(0,(lv/10)-1) | P1316: math.max(0,(lv/10)-1) | Q1316: math.max(0,(lv/10)-1) | R1316: 0; | S1316: 有药王谷和盘丝洞的弟子在，真是不爽，还是跑路算了！ | T1316: 药王谷和盘丝洞的弟子不在眼前，真是轻松愉快啊！ | U1316: 0 | V1316: 0,0; | W1316: 1
A1317: 13462 | B1317: 仙鹤童子 | C1317: pet_33 | D1317: 0 | E1317: 0 | F1317: 1212,100;1211,100; | G1317: 0,0; | H1317: 8262*1.2*1.5 | I1317: 3592*0.5-500 | J1317: 1619*1.2 | K1317: 1168*0.5 | L1317: 570*1.5 | M1317: 1000*LV+100000 | N1317: 0 | O1317: math.max(0,(lv/10)-1) | P1317: math.max(0,(lv/10)-1) | Q1317: math.max(0,(lv/10)-1) | R1317: 0; | S1317: 有药王谷和盘丝洞的弟子在，真是不爽，还是跑路算了！ | T1317: 药王谷和盘丝洞的弟子不在眼前，真是轻松愉快啊！ | U1317: 0 | V1317: 0,0; | W1317: 3
A1318: 13471 | B1318: 阴阳师 | C1318: pet_52 | D1318: 0 | E1318: 0 | F1318: 1411,100;1412,100; | G1318: 0,0; | H1318: 8277*1.5 | I1318: 3601*0.5-500 | J1318: 1623*0.8 | K1318: 1170*1.5 | L1318: 572*0.8 | M1318: 1000*LV+100000 | N1318: 0 | O1318: math.max(0,(lv/10)-1) | P1318: math.max(0,(lv/10)-1) | Q1318: math.max(0,(lv/10)-1) | R1318: 0; | S1318: 有药王谷和盘丝洞的弟子在，真是不爽，还是跑路算了！ | T1318: 药王谷和盘丝洞的弟子不在眼前，真是轻松愉快啊！ | U1318: 0 | V1318: 0,0; | W1318: 2
A1319: 13472 | B1319: 魔女 | C1319: pet_53 | D1319: 0 | E1319: 0 | F1319: 1511,100;1513,100; | G1319: 0,0; | H1319: 8277*0.8*1.5 | I1319: 3601*0.5-500 | J1319: 1623 | K1319: 1170 | L1319: 572*2 | M1319: 1000*LV+100000 | N1319: 0 | O1319: math.max(0,(lv/10)-1) | P1319: math.max(0,(lv/10)-1) | Q1319: math.max(0,(lv/10)-1) | R1319: 0; | S1319: 有药王谷和盘丝洞的弟子在，真是不爽，还是跑路算了！ | T1319: 药王谷和盘丝洞的弟子不在眼前，真是轻松愉快啊！ | U1319: 0 | V1319: 0,0; | W1319: 5
A1320: 13473 | B1320: 蛤蟆精 | C1320: pet_3 | D1320: 0 | E1320: 0 | F1320: 0,0; | G1320: 5123,100;5225,100;5104,100;5202,100; | H1320: 8277*1.5 | I1320: 3601-500 | J1320: 1623 | K1320: 1170*0.5 | L1320: 572*1.2 | M1320: 1000*LV+100000 | N1320: 0 | O1320: math.max(0,(lv/10)-1) | P1320: math.max(0,(lv/10)-1) | Q1320: math.max(0,(lv/10)-1) | R1320: 0; | S1320: 有药王谷和盘丝洞的弟子在，真是不爽，还是跑路算了！ | T1320: 药王谷和盘丝洞的弟子不在眼前，真是轻松愉快啊！ | U1320: 0 | V1320: 0,0; | W1320: 0
A1321: 13481 | B1321: 盘丝弟子 | C1321: hero_2001 | D1321: 0 | E1321: 0 | F1321: 1511,100;1513,100; | G1321: 0,0; | H1321: 8292*0.8*1.5 | I1321: 3610*0.5-500 | J1321: 1626 | K1321: 1175 | L1321: 573*2 | M1321: 1000*LV+100000 | N1321: 0 | O1321: math.max(0,(lv/10)-1) | P1321: math.max(0,(lv/10)-1) | Q1321: math.max(0,(lv/10)-1) | R1321: 0; | S1321: 有药王谷和盘丝洞的弟子在，真是不爽，还是跑路算了！ | T1321: 药王谷和盘丝洞的弟子不在眼前，真是轻松愉快啊！ | U1321: 0 | V1321: 0,0; | W1321: 5
A1322: 13482 | B1322: 熊猫武师 | C1322: pet_13 | D1322: 0 | E1322: 0 | F1322: 1311,100;1315,100; | G1322: 0,0; | H1322: 8292*1.5 | I1322: 3610-500 | J1322: 1626 | K1322: 1175*0.5 | L1322: 573*1.2 | M1322: 1000*LV+100000 | N1322: 0 | O1322: math.max(0,(lv/10)-1) | P1322: math.max(0,(lv/10)-1) | Q1322: math.max(0,(lv/10)-1) | R1322: 0; | S1322: 有药王谷和盘丝洞的弟子在，真是不爽，还是跑路算了！ | T1322: 药王谷和盘丝洞的弟子不在眼前，真是轻松愉快啊！ | U1322: 0 | V1322: 0,0; | W1322: 4
A1323: 13483 | B1323: 剑灵 | C1323: pet_21 | D1323: 0 | E1323: 0 | F1323: 5309,100; | G1323: 0,0; | H1323: 8292*1.5 | I1323: 3610-500 | J1323: 1626 | K1323: 1175*0.5 | L1323: 573*1.2 | M1323: 1000*LV+100000 | N1323: 0 | O1323: math.max(0,(lv/10)-1) | P1323: math.max(0,(lv/10)-1) | Q1323: math.max(0,(lv/10)-1) | R1323: 0; | S1323: 有药王谷和盘丝洞的弟子在，真是不爽，还是跑路算了！ | T1323: 药王谷和盘丝洞的弟子不在眼前，真是轻松愉快啊！ | U1323: 0 | V1323: 0,0; | W1323: 0
A1324: 13491 | B1324: 兽王弟子 | C1324: hero_1001 | D1324: 0 | E1324: 0 | F1324: 1312,100;1315,100; | G1324: 5103,100;5108,100; | H1324: 8307*1.5 | I1324: 3618-500 | J1324: 1629 | K1324: 1179*0.5 | L1324: 575*1.2 | M1324: 1000*LV+100000 | N1324: 0 | O1324: math.max(0,(lv/10)-1) | P1324: math.max(0,(lv/10)-1) | Q1324: math.max(0,(lv/10)-1) | R1324: 0; | S1324: 有药王谷和盘丝洞的弟子在，真是不爽，还是跑路算了！ | T1324: 药王谷和盘丝洞的弟子不在眼前，真是轻松愉快啊！ | U1324: 0 | V1324: 0,0; | W1324: 4
A1325: 13492 | B1325: 魔女 | C1325: pet_53 | D1325: 0 | E1325: 0 | F1325: 1511,100;1513,100; | G1325: 5132,100;5126,100; | H1325: 8307*0.8*1.5 | I1325: 3618*0.5-500 | J1325: 1629 | K1325: 1179 | L1325: 575*2 | M1325: 1000*LV+100000 | N1325: 0 | O1325: math.max(0,(lv/10)-1) | P1325: math.max(0,(lv/10)-1) | Q1325: math.max(0,(lv/10)-1) | R1325: 0; | S1325: 有药王谷和盘丝洞的弟子在，真是不爽，还是跑路算了！ | T1325: 药王谷和盘丝洞的弟子不在眼前，真是轻松愉快啊！ | U1325: 0 | V1325: 0,0; | W1325: 5
A1326: 13493 | B1326: 帮凶 | C1326: pet_43 | D1326: 0 | E1326: 0 | F1326: 1112,100;1111,100; | G1326: 5205,100;5123,100; | H1326: 8307*1.5 | I1326: 3618-500 | J1326: 1629 | K1326: 1179*0.5 | L1326: 575*1.2 | M1326: 1000*LV+100000 | N1326: 0 | O1326: math.max(0,(lv/10)-1) | P1326: math.max(0,(lv/10)-1) | Q1326: math.max(0,(lv/10)-1) | R1326: 0; | S1326: 有药王谷和盘丝洞的弟子在，真是不爽，还是跑路算了！ | T1326: 药王谷和盘丝洞的弟子不在眼前，真是轻松愉快啊！ | U1326: 0 | V1326: 0,0; | W1326: 1
A1327: 13501 | B1327: 天策府弟子 | C1327: hero_1001 | D1327: 0 | E1327: 0 | F1327: 1112,100;1111,100; | G1327: 5103,100;5209,100;5101,100; | H1327: 8328*1.5 | I1327: 3627-500 | J1327: 1632 | K1327: 1182*0.5 | L1327: 576*1.2 | M1327: 1000*LV+100000 | N1327: 0 | O1327: math.max(0,(lv/10)-1) | P1327: math.max(0,(lv/10)-1) | Q1327: math.max(0,(lv/10)-1) | R1327: 0; | S1327: 有药王谷和盘丝洞的弟子在，真是不爽，还是跑路算了！ | T1327: 药王谷和盘丝洞的弟子不在眼前，真是轻松愉快啊！ | U1327: 0 | V1327: 0,0; | W1327: 1
A1328: 13502 | B1328: 盘丝弟子 | C1328: hero_2001 | D1328: 0 | E1328: 0 | F1328: 1511,100;1513,100; | G1328: 5210,100;5126,100;5131,100; | H1328: 8328*0.8*1.5 | I1328: 3627*0.5-500 | J1328: 1632 | K1328: 1182 | L1328: 576*2 | M1328: 1000*LV+100000 | N1328: 0 | O1328: math.max(0,(lv/10)-1) | P1328: math.max(0,(lv/10)-1) | Q1328: math.max(0,(lv/10)-1) | R1328: 0; | S1328: 有药王谷和盘丝洞的弟子在，真是不爽，还是跑路算了！ | T1328: 药王谷和盘丝洞的弟子不在眼前，真是轻松愉快啊！ | U1328: 0 | V1328: 0,0; | W1328: 5
A1329: 13503 | B1329: 剑灵 | C1329: pet_21 | D1329: 0 | E1329: 0 | F1329: 1511,100;1513,100; | G1329: 5223,100;5124,100;5101,100; | H1329: 8328*1.5 | I1329: 3627-500 | J1329: 1632 | K1329: 1182*0.5 | L1329: 576*1.2 | M1329: 1000*LV+100000 | N1329: 0 | O1329: math.max(0,(lv/10)-1) | P1329: math.max(0,(lv/10)-1) | Q1329: math.max(0,(lv/10)-1) | R1329: 0; | S1329: 有药王谷和盘丝洞的弟子在，真是不爽，还是跑路算了！ | T1329: 药王谷和盘丝洞的弟子不在眼前，真是轻松愉快啊！ | U1329: 0 | V1329: 0,0; | W1329: 0
A1330: 20001 | B1330: 浪人 | C1330: pet_43 | D1330: 0 | E1330: 0 | F1330: 1112,100;1116,100;1111,100;5309,100;1211,100;1212,100;1216,100;5310,100; | G1330: 0,0; | H1330: 130 | I1330: 45 | J1330: 32 | K1330: 24 | L1330: 13 | M1330: 100000 | N1330: 0 | O1330: math.max(0,(lv/10)-1) | P1330: math.max(0,(lv/10)-1) | Q1330: math.max(0,(lv/10)-1) | R1330: 0; | S1330: 有药王谷和盘丝洞的弟子在，真是不爽，还是跑路算了！ | T1330: 药王谷和盘丝洞的弟子不在眼前，真是轻松愉快啊！ | U1330: 0 | V1330: 0,0; | W1330: 0
A1331: 20002 | B1331: 花妖 | C1331: pet_91 | D1331: 0 | E1331: 0 | F1331: 1112,100;1116,100;1111,100;5309,100;1211,100;1212,100;1216,100;5310,100; | G1331: 0,0; | H1331: 130+26*LV | I1331: 45+10.5*LV | J1331: 32+9*LV | K1331: 24+5*LV | L1331: 13+3*LV | M1331: 100000 | N1331: 0 | O1331: math.max(0,(lv/10)-1) | P1331: math.max(0,(lv/10)-1) | Q1331: math.max(0,(lv/10)-1) | R1331: 0; | S1331: 有药王谷和盘丝洞的弟子在，真是不爽，还是跑路算了！ | T1331: 药王谷和盘丝洞的弟子不在眼前，真是轻松愉快啊！ | U1331: 0 | V1331: 0,0; | W1331: 0
A1332: 20003 | B1332: 阴阳师 | C1332: pet_52 | D1332: 0 | E1332: 0 | F1332: 1112,100;1116,100;1111,100;5309,100;1211,100;1212,100;1216,100;5310,100; | G1332: 0,0; | H1332: 130+26*LV | I1332: 45+10.5*LV | J1332: 32+9*LV | K1332: 24+5*LV | L1332: 13+3*LV | M1332: 100000 | N1332: 0 | O1332: math.max(0,(lv/10)-1) | P1332: math.max(0,(lv/10)-1) | Q1332: math.max(0,(lv/10)-1) | R1332: 0; | S1332: 有药王谷和盘丝洞的弟子在，真是不爽，还是跑路算了！ | T1332: 药王谷和盘丝洞的弟子不在眼前，真是轻松愉快啊！ | U1332: 0 | V1332: 0,0; | W1332: 0
A1333: 20004 | B1333: 女魃 | C1333: pet_53 | D1333: 0 | E1333: 0 | F1333: 1112,100;1116,100;1111,100;5309,100;1211,100;1212,100;1216,100;5310,100; | G1333: 0,0; | H1333: 130+26*LV | I1333: 45+10.5*LV | J1333: 32+9*LV | K1333: 24+5*LV | L1333: 13+3*LV | M1333: 100000 | N1333: 0 | O1333: math.max(0,(lv/10)-1) | P1333: math.max(0,(lv/10)-1) | Q1333: math.max(0,(lv/10)-1) | R1333: 0; | S1333: 有药王谷和盘丝洞的弟子在，真是不爽，还是跑路算了！ | T1333: 药王谷和盘丝洞的弟子不在眼前，真是轻松愉快啊！ | U1333: 0 | V1333: 0,0; | W1333: 0
A1334: 20005 | B1334: 罗刹女 | C1334: pet_61 | D1334: 0 | E1334: 0 | F1334: 1112,100;1116,100;1111,100;5309,100;1211,100;1212,100;1216,100;5310,100; | G1334: 0,0; | H1334: 130+26*LV | I1334: 45+10.5*LV | J1334: 32+9*LV | K1334: 24+5*LV | L1334: 13+3*LV | M1334: 100000 | N1334: 0 | O1334: math.max(0,(lv/10)-1) | P1334: math.max(0,(lv/10)-1) | Q1334: math.max(0,(lv/10)-1) | R1334: 0; | S1334: 有药王谷和盘丝洞的弟子在，真是不爽，还是跑路算了！ | T1334: 药王谷和盘丝洞的弟子不在眼前，真是轻松愉快啊！ | U1334: 0 | V1334: 0,0; | W1334: 0
A1335: 20006 | B1335: 泥石人 | C1335: pet_62 | D1335: 0 | E1335: 0 | F1335: 1112,100;1116,100;1111,100;5309,100;1211,100;1212,100;1216,100;5310,100; | G1335: 0,0; | H1335: 130+26*LV | I1335: 45+10.5*LV | J1335: 32+9*LV | K1335: 24+5*LV | L1335: 13+3*LV | M1335: 100000 | N1335: 0 | O1335: math.max(0,(lv/10)-1) | P1335: math.max(0,(lv/10)-1) | Q1335: math.max(0,(lv/10)-1) | R1335: 0; | S1335: 有药王谷和盘丝洞的弟子在，真是不爽，还是跑路算了！ | T1335: 药王谷和盘丝洞的弟子不在眼前，真是轻松愉快啊！ | U1335: 0 | V1335: 0,0; | W1335: 0
A1336: 20007 | B1336: 插翅虎 | C1336: pet_63 | D1336: 0 | E1336: 0 | F1336: 1112,100;1116,100;1111,100;5309,100;1211,100;1212,100;1216,100;5310,100; | G1336: 0,0; | H1336: 130+26*LV | I1336: 45+10.5*LV | J1336: 32+9*LV | K1336: 24+5*LV | L1336: 13+3*LV | M1336: 100000 | N1336: 0 | O1336: math.max(0,(lv/10)-1) | P1336: math.max(0,(lv/10)-1) | Q1336: math.max(0,(lv/10)-1) | R1336: 0; | S1336: 有药王谷和盘丝洞的弟子在，真是不爽，还是跑路算了！ | T1336: 药王谷和盘丝洞的弟子不在眼前，真是轻松愉快啊！ | U1336: 0 | V1336: 0,0; | W1336: 0
A1337: 20008 | B1337: 剑侠 | C1337: pet_71 | D1337: 0 | E1337: 0 | F1337: 1112,100;1116,100;1111,100;5309,100;1211,100;1212,100;1216,100;5310,100; | G1337: 0,0; | H1337: 130+26*LV | I1337: 45+10.5*LV | J1337: 32+9*LV | K1337: 24+5*LV | L1337: 13+3*LV | M1337: 100000 | N1337: 0 | O1337: math.max(0,(lv/10)-1) | P1337: math.max(0,(lv/10)-1) | Q1337: math.max(0,(lv/10)-1) | R1337: 0; | S1337: 有药王谷和盘丝洞的弟子在，真是不爽，还是跑路算了！ | T1337: 药王谷和盘丝洞的弟子不在眼前，真是轻松愉快啊！ | U1337: 0 | V1337: 0,0; | W1337: 0
A1338: 20009 | B1338: 大鹏鸟 | C1338: pet_72 | D1338: 0 | E1338: 0 | F1338: 1112,100;1116,100;1111,100;5309,100;1211,100;1212,100;1216,100;5310,100; | G1338: 0,0; | H1338: 130+26*LV | I1338: 45+10.5*LV | J1338: 32+9*LV | K1338: 24+5*LV | L1338: 13+3*LV | M1338: 100000 | N1338: 0 | O1338: math.max(0,(lv/10)-1) | P1338: math.max(0,(lv/10)-1) | Q1338: math.max(0,(lv/10)-1) | R1338: 0; | S1338: 有药王谷和盘丝洞的弟子在，真是不爽，还是跑路算了！ | T1338: 药王谷和盘丝洞的弟子不在眼前，真是轻松愉快啊！ | U1338: 0 | V1338: 0,0; | W1338: 0
A1339: 20010 | B1339: 猴子 | C1339: pet_73 | D1339: 0 | E1339: 0 | F1339: 1112,100;1116,100;1111,100;5309,100;1211,100;1212,100;1216,100;5310,100; | G1339: 0,0; | H1339: 130+26*LV | I1339: 45+10.5*LV | J1339: 32+9*LV | K1339: 24+5*LV | L1339: 13+3*LV | M1339: 100000 | N1339: 0 | O1339: math.max(0,(lv/10)-1) | P1339: math.max(0,(lv/10)-1) | Q1339: math.max(0,(lv/10)-1) | R1339: 0; | S1339: 有药王谷和盘丝洞的弟子在，真是不爽，还是跑路算了！ | T1339: 药王谷和盘丝洞的弟子不在眼前，真是轻松愉快啊！ | U1339: 0 | V1339: 0,0; | W1339: 0
A1340: 20011 | B1340: 枪天将 | C1340: pet_81 | D1340: 0 | E1340: 0 | F1340: 1112,100;1116,100;1111,100;5309,100;1211,100;1212,100;1216,100;5310,100; | G1340: 0,0; | H1340: 130+26*LV | I1340: 45+10.5*LV | J1340: 32+9*LV | K1340: 24+5*LV | L1340: 13+3*LV | M1340: 100000 | N1340: 0 | O1340: math.max(0,(lv/10)-1) | P1340: math.max(0,(lv/10)-1) | Q1340: math.max(0,(lv/10)-1) | R1340: 0; | S1340: 有药王谷和盘丝洞的弟子在，真是不爽，还是跑路算了！ | T1340: 药王谷和盘丝洞的弟子不在眼前，真是轻松愉快啊！ | U1340: 0 | V1340: 0,0; | W1340: 0
A1341: 20012 | B1341: 虎傀儡 | C1341: pet_102 | D1341: 0 | E1341: 0 | F1341: 1112,100;1116,100;1111,100;5309,100;1211,100;1212,100;1216,100;5310,100; | G1341: 0,0; | H1341: 130+26*LV | I1341: 45+10.5*LV | J1341: 32+9*LV | K1341: 24+5*LV | L1341: 13+3*LV | M1341: 100000 | N1341: 0 | O1341: math.max(0,(lv/10)-1) | P1341: math.max(0,(lv/10)-1) | Q1341: math.max(0,(lv/10)-1) | R1341: 0; | S1341: 有药王谷和盘丝洞的弟子在，真是不爽，还是跑路算了！ | T1341: 药王谷和盘丝洞的弟子不在眼前，真是轻松愉快啊！ | U1341: 0 | V1341: 0,0; | W1341: 0
A1342: 20013 | B1342: 天璇仙子 | C1342: pet_83 | D1342: 0 | E1342: 0 | F1342: 1112,100;1116,100;1111,100;5309,100;1211,100;1212,100;1216,100;5310,100; | G1342: 0,0; | H1342: 130+26*LV | I1342: 45+10.5*LV | J1342: 32+9*LV | K1342: 24+5*LV | L1342: 13+3*LV | M1342: 100000 | N1342: 0 | O1342: math.max(0,(lv/10)-1) | P1342: math.max(0,(lv/10)-1) | Q1342: math.max(0,(lv/10)-1) | R1342: 0; | S1342: 有药王谷和盘丝洞的弟子在，真是不爽，还是跑路算了！ | T1342: 药王谷和盘丝洞的弟子不在眼前，真是轻松愉快啊！ | U1342: 0 | V1342: 0,0; | W1342: 0
A1343: 20014 | B1343: 桃花妖 | C1343: pet_91 | D1343: 0 | E1343: 0 | F1343: 1112,100;1116,100;1111,100;5309,100;1211,100;1212,100;1216,100;5310,100; | G1343: 0,0; | H1343: 130+26*LV | I1343: 45+10.5*LV | J1343: 32+9*LV | K1343: 24+5*LV | L1343: 13+3*LV | M1343: 100000 | N1343: 0 | O1343: math.max(0,(lv/10)-1) | P1343: math.max(0,(lv/10)-1) | Q1343: math.max(0,(lv/10)-1) | R1343: 0; | S1343: 有药王谷和盘丝洞的弟子在，真是不爽，还是跑路算了！ | T1343: 药王谷和盘丝洞的弟子不在眼前，真是轻松愉快啊！ | U1343: 0 | V1343: 0,0; | W1343: 0
A1344: 20015 | B1344: 罗刹女 | C1344: pet_61 | D1344: 0 | E1344: 0 | F1344: 1112,100;1116,100;1111,100;5309,100;1211,100;1212,100;1216,100;5310,100; | G1344: 0,0; | H1344: 130+26*LV | I1344: 45+10.5*LV | J1344: 32+9*LV | K1344: 24+5*LV | L1344: 13+3*LV | M1344: 100000 | N1344: 0 | O1344: math.max(0,(lv/10)-1) | P1344: math.max(0,(lv/10)-1) | Q1344: math.max(0,(lv/10)-1) | R1344: 0; | S1344: 有药王谷和盘丝洞的弟子在，真是不爽，还是跑路算了！ | T1344: 药王谷和盘丝洞的弟子不在眼前，真是轻松愉快啊！ | U1344: 0 | V1344: 0,0; | W1344: 0
A1345: 20016 | B1345: 媚魔 | C1345: pet_93 | D1345: 0 | E1345: 0 | F1345: 1112,100;1116,100;1111,100;5309,100;1211,100;1212,100;1216,100;5310,100; | G1345: 0,0; | H1345: 130+26*LV | I1345: 45+10.5*LV | J1345: 32+9*LV | K1345: 24+5*LV | L1345: 13+3*LV | M1345: 100000 | N1345: 0 | O1345: math.max(0,(lv/10)-1) | P1345: math.max(0,(lv/10)-1) | Q1345: math.max(0,(lv/10)-1) | R1345: 0; | S1345: 有药王谷和盘丝洞的弟子在，真是不爽，还是跑路算了！ | T1345: 药王谷和盘丝洞的弟子不在眼前，真是轻松愉快啊！ | U1345: 0 | V1345: 0,0; | W1345: 0
A1346: 20017 | B1346: 剑灵 | C1346: pet_21 | D1346: 0 | E1346: 0 | F1346: 1112,100;1116,100;1111,100;5309,100;1211,100;1212,100;1216,100;5310,100; | G1346: 0,0; | H1346: 130+26*LV | I1346: 45+10.5*LV | J1346: 32+9*LV | K1346: 24+5*LV | L1346: 13+3*LV | M1346: 100000 | N1346: 0 | O1346: math.max(0,(lv/10)-1) | P1346: math.max(0,(lv/10)-1) | Q1346: math.max(0,(lv/10)-1) | R1346: 0; | S1346: 有药王谷和盘丝洞的弟子在，真是不爽，还是跑路算了！ | T1346: 药王谷和盘丝洞的弟子不在眼前，真是轻松愉快啊！ | U1346: 0 | V1346: 0,0; | W1346: 0
A1347: 20018 | B1347: 虎傀儡 | C1347: pet_102 | D1347: 0 | E1347: 0 | F1347: 1112,100;1116,100;1111,100;5309,100;1211,100;1212,100;1216,100;5310,100; | G1347: 0,0; | H1347: 130+26*LV | I1347: 45+10.5*LV | J1347: 32+9*LV | K1347: 24+5*LV | L1347: 13+3*LV | M1347: 100000 | N1347: 0 | O1347: math.max(0,(lv/10)-1) | P1347: math.max(0,(lv/10)-1) | Q1347: math.max(0,(lv/10)-1) | R1347: 0; | S1347: 有药王谷和盘丝洞的弟子在，真是不爽，还是跑路算了！ | T1347: 药王谷和盘丝洞的弟子不在眼前，真是轻松愉快啊！ | U1347: 0 | V1347: 0,0; | W1347: 0
A1348: 20019 | B1348: 熊猫武师 | C1348: pet_13 | D1348: 0 | E1348: 0 | F1348: 1112,100;1116,100;1111,100;5309,100;1211,100;1212,100;1216,100;5310,100; | G1348: 0,0; | H1348: 130+26*LV | I1348: 45+10.5*LV | J1348: 32+9*LV | K1348: 24+5*LV | L1348: 13+3*LV | M1348: 100000 | N1348: 0 | O1348: math.max(0,(lv/10)-1) | P1348: math.max(0,(lv/10)-1) | Q1348: math.max(0,(lv/10)-1) | R1348: 0; | S1348: 有药王谷和盘丝洞的弟子在，真是不爽，还是跑路算了！ | T1348: 药王谷和盘丝洞的弟子不在眼前，真是轻松愉快啊！ | U1348: 0 | V1348: 0,0; | W1348: 0
A1349: 20020 | B1349: 迦楼罗 | C1349: pet_201 | D1349: 0 | E1349: 0 | F1349: 1112,100;1116,100;1111,100;5309,100;1211,100;1212,100;1216,100;5310,100; | G1349: 0,0; | H1349: 130+26*LV | I1349: 45+10.5*LV | J1349: 32+9*LV | K1349: 24+5*LV | L1349: 13+3*LV | M1349: 100000 | N1349: 0 | O1349: math.max(0,(lv/10)-1) | P1349: math.max(0,(lv/10)-1) | Q1349: math.max(0,(lv/10)-1) | R1349: 0; | S1349: 有药王谷和盘丝洞的弟子在，真是不爽，还是跑路算了！ | T1349: 药王谷和盘丝洞的弟子不在眼前，真是轻松愉快啊！ | U1349: 0 | V1349: 0,0; | W1349: 0
A1350: 20021 | B1350: 猴子 | C1350: pet_73 | D1350: 0 | E1350: 0 | F1350: 1112,100;1116,100;1111,100;5309,100;1211,100;1212,100;1216,100;5310,100; | G1350: 0,0; | H1350: 130+26*LV | I1350: 45+10.5*LV | J1350: 32+9*LV | K1350: 24+5*LV | L1350: 13+3*LV | M1350: 100000 | N1350: 0 | O1350: math.max(0,(lv/10)-1) | P1350: math.max(0,(lv/10)-1) | Q1350: math.max(0,(lv/10)-1) | R1350: 0; | S1350: 有药王谷和盘丝洞的弟子在，真是不爽，还是跑路算了！ | T1350: 药王谷和盘丝洞的弟子不在眼前，真是轻松愉快啊！ | U1350: 0 | V1350: 0,0; | W1350: 0
A1351: 20022 | B1351: 阴阳师 | C1351: pet_52 | D1351: 0 | E1351: 0 | F1351: 1112,100;1116,100;1111,100;5309,100;1211,100;1212,100;1216,100;5310,100; | G1351: 0,0; | H1351: 130+26*LV | I1351: 45+10.5*LV | J1351: 32+9*LV | K1351: 24+5*LV | L1351: 13+3*LV | M1351: 100000 | N1351: 0 | O1351: math.max(0,(lv/10)-1) | P1351: math.max(0,(lv/10)-1) | Q1351: math.max(0,(lv/10)-1) | R1351: 0; | S1351: 有药王谷和盘丝洞的弟子在，真是不爽，还是跑路算了！ | T1351: 药王谷和盘丝洞的弟子不在眼前，真是轻松愉快啊！ | U1351: 0 | V1351: 0,0; | W1351: 0
A1352: 20023 | B1352: 天璇仙子 | C1352: pet_83 | D1352: 0 | E1352: 0 | F1352: 1112,100;1116,100;1111,100;5309,100;1211,100;1212,100;1216,100;5310,100; | G1352: 0,0; | H1352: 130+26*LV | I1352: 45+10.5*LV | J1352: 32+9*LV | K1352: 24+5*LV | L1352: 13+3*LV | M1352: 100000 | N1352: 0 | O1352: math.max(0,(lv/10)-1) | P1352: math.max(0,(lv/10)-1) | Q1352: math.max(0,(lv/10)-1) | R1352: 0; | S1352: 有药王谷和盘丝洞的弟子在，真是不爽，还是跑路算了！ | T1352: 药王谷和盘丝洞的弟子不在眼前，真是轻松愉快啊！ | U1352: 0 | V1352: 0,0; | W1352: 0
A1353: 20024 | B1353: 阴阳师 | C1353: pet_52 | D1353: 0 | E1353: 0 | F1353: 1112,100;1116,100;1111,100;5309,100;1211,100;1212,100;1216,100;5310,100; | G1353: 0,0; | H1353: 130+26*LV | I1353: 45+10.5*LV | J1353: 32+9*LV | K1353: 24+5*LV | L1353: 13+3*LV | M1353: 100000 | N1353: 0 | O1353: math.max(0,(lv/10)-1) | P1353: math.max(0,(lv/10)-1) | Q1353: math.max(0,(lv/10)-1) | R1353: 0; | S1353: 有药王谷和盘丝洞的弟子在，真是不爽，还是跑路算了！ | T1353: 药王谷和盘丝洞的弟子不在眼前，真是轻松愉快啊！ | U1353: 0 | V1353: 0,0; | W1353: 0
A1354: 20025 | B1354: 枪天兵 | C1354: pet_81 | D1354: 0 | E1354: 0 | F1354: 1112,100;1116,100;1111,100;5309,100;1211,100;1212,100;1216,100;5310,100; | G1354: 0,0; | H1354: 130+26*LV | I1354: 45+10.5*LV | J1354: 32+9*LV | K1354: 24+5*LV | L1354: 13+3*LV | M1354: 100000 | N1354: 0 | O1354: math.max(0,(lv/10)-1) | P1354: math.max(0,(lv/10)-1) | Q1354: math.max(0,(lv/10)-1) | R1354: 0; | S1354: 有药王谷和盘丝洞的弟子在，真是不爽，还是跑路算了！ | T1354: 药王谷和盘丝洞的弟子不在眼前，真是轻松愉快啊！ | U1354: 0 | V1354: 0,0; | W1354: 0
A1355: 20026 | B1355: 浪人 | C1355: pet_43 | D1355: 0 | E1355: 0 | F1355: 1112,100;1116,100;1111,100;5309,100;1211,100;1212,100;1216,100;5310,100; | G1355: 0,0; | H1355: 130+26*LV | I1355: 45+10.5*LV | J1355: 32+9*LV | K1355: 24+5*LV | L1355: 13+3*LV | M1355: 100000 | N1355: 0 | O1355: math.max(0,(lv/10)-1) | P1355: math.max(0,(lv/10)-1) | Q1355: math.max(0,(lv/10)-1) | R1355: 0; | S1355: 有药王谷和盘丝洞的弟子在，真是不爽，还是跑路算了！ | T1355: 药王谷和盘丝洞的弟子不在眼前，真是轻松愉快啊！ | U1355: 0 | V1355: 0,0; | W1355: 0
A1356: 20027 | B1356: 兔精 | C1356: pet_11 | D1356: 0 | E1356: 0 | F1356: 1112,100;1116,100;1111,100;5309,100;1211,100;1212,100;1216,100;5310,100; | G1356: 0,0; | H1356: 130+26*LV | I1356: 45+10.5*LV | J1356: 32+9*LV | K1356: 24+5*LV | L1356: 13+3*LV | M1356: 100000 | N1356: 0 | O1356: math.max(0,(lv/10)-1) | P1356: math.max(0,(lv/10)-1) | Q1356: math.max(0,(lv/10)-1) | R1356: 0; | S1356: 有药王谷和盘丝洞的弟子在，真是不爽，还是跑路算了！ | T1356: 药王谷和盘丝洞的弟子不在眼前，真是轻松愉快啊！ | U1356: 0 | V1356: 0,0; | W1356: 0
A1357: 20028 | B1357: 阴阳师 | C1357: pet_52 | D1357: 0 | E1357: 0 | F1357: 1112,100;1116,100;1111,100;5309,100;1211,100;1212,100;1216,100;5310,100; | G1357: 0,0; | H1357: 130+26*LV | I1357: 45+10.5*LV | J1357: 32+9*LV | K1357: 24+5*LV | L1357: 13+3*LV | M1357: 100000 | N1357: 0 | O1357: math.max(0,(lv/10)-1) | P1357: math.max(0,(lv/10)-1) | Q1357: math.max(0,(lv/10)-1) | R1357: 0; | S1357: 有药王谷和盘丝洞的弟子在，真是不爽，还是跑路算了！ | T1357: 药王谷和盘丝洞的弟子不在眼前，真是轻松愉快啊！ | U1357: 0 | V1357: 0,0; | W1357: 0
A1358: 20029 | B1358: 女魃 | C1358: pet_53 | D1358: 0 | E1358: 0 | F1358: 1112,100;1116,100;1111,100;5309,100;1211,100;1212,100;1216,100;5310,100; | G1358: 0,0; | H1358: 130+26*LV | I1358: 45+10.5*LV | J1358: 32+9*LV | K1358: 24+5*LV | L1358: 13+3*LV | M1358: 100000 | N1358: 0 | O1358: math.max(0,(lv/10)-1) | P1358: math.max(0,(lv/10)-1) | Q1358: math.max(0,(lv/10)-1) | R1358: 0; | S1358: 有药王谷和盘丝洞的弟子在，真是不爽，还是跑路算了！ | T1358: 药王谷和盘丝洞的弟子不在眼前，真是轻松愉快啊！ | U1358: 0 | V1358: 0,0; | W1358: 0
A1359: 20030 | B1359: 罗刹女 | C1359: pet_61 | D1359: 0 | E1359: 0 | F1359: 1112,100;1116,100;1111,100;5309,100;1211,100;1212,100;1216,100;5310,100; | G1359: 0,0; | H1359: 130+26*LV | I1359: 45+10.5*LV | J1359: 32+9*LV | K1359: 24+5*LV | L1359: 13+3*LV | M1359: 100000 | N1359: 0 | O1359: math.max(0,(lv/10)-1) | P1359: math.max(0,(lv/10)-1) | Q1359: math.max(0,(lv/10)-1) | R1359: 0; | S1359: 有药王谷和盘丝洞的弟子在，真是不爽，还是跑路算了！ | T1359: 药王谷和盘丝洞的弟子不在眼前，真是轻松愉快啊！ | U1359: 0 | V1359: 0,0; | W1359: 0
A1360: 20031 | B1360: 泥石人 | C1360: pet_62 | D1360: 0 | E1360: 0 | F1360: 1112,100;1116,100;1111,100;5309,100;1211,100;1212,100;1216,100;5310,100; | G1360: 5115,100;5201,100;5202,100;5205,100; | H1360: 130+26*LV | I1360: 45+10.5*LV | J1360: 32+9*LV | K1360: 24+5*LV | L1360: 13+3*LV | M1360: 100000 | N1360: 0 | O1360: math.max(0,(lv/10)-1) | P1360: math.max(0,(lv/10)-1) | Q1360: math.max(0,(lv/10)-1) | R1360: 0; | S1360: 有药王谷和盘丝洞的弟子在，真是不爽，还是跑路算了！ | T1360: 药王谷和盘丝洞的弟子不在眼前，真是轻松愉快啊！ | U1360: 0 | V1360: 0,0; | W1360: 0
A1361: 20032 | B1361: 插翅虎 | C1361: pet_63 | D1361: 0 | E1361: 0 | F1361: 1112,100;1116,100;1111,100;5309,100;1211,100;1212,100;1216,100;5310,100; | G1361: 5115,100;5201,100;5202,100;5205,100; | H1361: 130+26*LV | I1361: 45+10.5*LV | J1361: 32+9*LV | K1361: 24+5*LV | L1361: 13+3*LV | M1361: 100000 | N1361: 0 | O1361: math.max(0,(lv/10)-1) | P1361: math.max(0,(lv/10)-1) | Q1361: math.max(0,(lv/10)-1) | R1361: 0; | S1361: 有药王谷和盘丝洞的弟子在，真是不爽，还是跑路算了！ | T1361: 药王谷和盘丝洞的弟子不在眼前，真是轻松愉快啊！ | U1361: 0 | V1361: 0,0; | W1361: 0
A1362: 20033 | B1362: 剑侠 | C1362: pet_71 | D1362: 0 | E1362: 0 | F1362: 1112,100;1116,100;1111,100;5309,100;1211,100;1212,100;1216,100;5310,100; | G1362: 5115,100;5201,100;5202,100;5205,100; | H1362: 130+26*LV | I1362: 45+10.5*LV | J1362: 32+9*LV | K1362: 24+5*LV | L1362: 13+3*LV | M1362: 100000 | N1362: 0 | O1362: math.max(0,(lv/10)-1) | P1362: math.max(0,(lv/10)-1) | Q1362: math.max(0,(lv/10)-1) | R1362: 0; | S1362: 有药王谷和盘丝洞的弟子在，真是不爽，还是跑路算了！ | T1362: 药王谷和盘丝洞的弟子不在眼前，真是轻松愉快啊！ | U1362: 0 | V1362: 0,0; | W1362: 0
A1363: 20034 | B1363: 大鹏鸟 | C1363: pet_72 | D1363: 0 | E1363: 0 | F1363: 1112,100;1116,100;1111,100;5309,100;1211,100;1212,100;1216,100;5310,100; | G1363: 5115,100;5201,100;5202,100;5205,100; | H1363: 130+26*LV | I1363: 45+10.5*LV | J1363: 32+9*LV | K1363: 24+5*LV | L1363: 13+3*LV | M1363: 100000 | N1363: 0 | O1363: math.max(0,(lv/10)-1) | P1363: math.max(0,(lv/10)-1) | Q1363: math.max(0,(lv/10)-1) | R1363: 0; | S1363: 有药王谷和盘丝洞的弟子在，真是不爽，还是跑路算了！ | T1363: 药王谷和盘丝洞的弟子不在眼前，真是轻松愉快啊！ | U1363: 0 | V1363: 0,0; | W1363: 0
A1364: 20035 | B1364: 猴子 | C1364: pet_73 | D1364: 0 | E1364: 0 | F1364: 1112,100;1116,100;1111,100;5309,100;1211,100;1212,100;1216,100;5310,100; | G1364: 5115,100;5201,100;5202,100;5205,100; | H1364: 130+26*LV | I1364: 45+10.5*LV | J1364: 32+9*LV | K1364: 24+5*LV | L1364: 13+3*LV | M1364: 100000 | N1364: 0 | O1364: math.max(0,(lv/10)-1) | P1364: math.max(0,(lv/10)-1) | Q1364: math.max(0,(lv/10)-1) | R1364: 0; | S1364: 有药王谷和盘丝洞的弟子在，真是不爽，还是跑路算了！ | T1364: 药王谷和盘丝洞的弟子不在眼前，真是轻松愉快啊！ | U1364: 0 | V1364: 0,0; | W1364: 0
A1365: 20036 | B1365: 枪天将 | C1365: pet_81 | D1365: 0 | E1365: 0 | F1365: 1112,100;1116,100;1111,100;5309,100;1211,100;1212,100;1216,100;5310,100; | G1365: 5115,100;5201,100;5202,100;5205,100; | H1365: 130+26*LV | I1365: 45+10.5*LV | J1365: 32+9*LV | K1365: 24+5*LV | L1365: 13+3*LV | M1365: 100000 | N1365: 0 | O1365: math.max(0,(lv/10)-1) | P1365: math.max(0,(lv/10)-1) | Q1365: math.max(0,(lv/10)-1) | R1365: 0; | S1365: 有药王谷和盘丝洞的弟子在，真是不爽，还是跑路算了！ | T1365: 药王谷和盘丝洞的弟子不在眼前，真是轻松愉快啊！ | U1365: 0 | V1365: 0,0; | W1365: 0
A1366: 20037 | B1366: 虎傀儡 | C1366: pet_102 | D1366: 0 | E1366: 0 | F1366: 1112,100;1116,100;1111,100;5309,100;1211,100;1212,100;1216,100;5310,100; | G1366: 5115,100;5201,100;5202,100;5205,100; | H1366: 130+26*LV | I1366: 45+10.5*LV | J1366: 32+9*LV | K1366: 24+5*LV | L1366: 13+3*LV | M1366: 100000 | N1366: 0 | O1366: math.max(0,(lv/10)-1) | P1366: math.max(0,(lv/10)-1) | Q1366: math.max(0,(lv/10)-1) | R1366: 0; | S1366: 有药王谷和盘丝洞的弟子在，真是不爽，还是跑路算了！ | T1366: 药王谷和盘丝洞的弟子不在眼前，真是轻松愉快啊！ | U1366: 0 | V1366: 0,0; | W1366: 0
A1367: 20038 | B1367: 天璇仙子 | C1367: pet_83 | D1367: 0 | E1367: 0 | F1367: 1112,100;1116,100;1111,100;5309,100;1211,100;1212,100;1216,100;5310,100; | G1367: 5115,100;5201,100;5202,100;5205,100; | H1367: 130+26*LV | I1367: 45+10.5*LV | J1367: 32+9*LV | K1367: 24+5*LV | L1367: 13+3*LV | M1367: 100000 | N1367: 0 | O1367: math.max(0,(lv/10)-1) | P1367: math.max(0,(lv/10)-1) | Q1367: math.max(0,(lv/10)-1) | R1367: 0; | S1367: 有药王谷和盘丝洞的弟子在，真是不爽，还是跑路算了！ | T1367: 药王谷和盘丝洞的弟子不在眼前，真是轻松愉快啊！ | U1367: 0 | V1367: 0,0; | W1367: 0
A1368: 20039 | B1368: 桃花妖 | C1368: pet_91 | D1368: 0 | E1368: 0 | F1368: 1112,100;1116,100;1111,100;5309,100;1211,100;1212,100;1216,100;5310,100; | G1368: 5115,100;5201,100;5202,100;5205,100; | H1368: 130+26*LV | I1368: 45+10.5*LV | J1368: 32+9*LV | K1368: 24+5*LV | L1368: 13+3*LV | M1368: 100000 | N1368: 0 | O1368: math.max(0,(lv/10)-1) | P1368: math.max(0,(lv/10)-1) | Q1368: math.max(0,(lv/10)-1) | R1368: 0; | S1368: 有药王谷和盘丝洞的弟子在，真是不爽，还是跑路算了！ | T1368: 药王谷和盘丝洞的弟子不在眼前，真是轻松愉快啊！ | U1368: 0 | V1368: 0,0; | W1368: 0
A1369: 20040 | B1369: 罗刹女 | C1369: pet_61 | D1369: 0 | E1369: 0 | F1369: 1112,100;1116,100;1111,100;5309,100;1211,100;1212,100;1216,100;5310,100; | G1369: 5115,100;5201,100;5202,100;5205,100; | H1369: 130+26*LV | I1369: 45+10.5*LV | J1369: 32+9*LV | K1369: 24+5*LV | L1369: 13+3*LV | M1369: 100000 | N1369: 0 | O1369: math.max(0,(lv/10)-1) | P1369: math.max(0,(lv/10)-1) | Q1369: math.max(0,(lv/10)-1) | R1369: 0; | S1369: 有药王谷和盘丝洞的弟子在，真是不爽，还是跑路算了！ | T1369: 药王谷和盘丝洞的弟子不在眼前，真是轻松愉快啊！ | U1369: 0 | V1369: 0,0; | W1369: 0
A1370: 20041 | B1370: 媚魔 | C1370: pet_93 | D1370: 0 | E1370: 0 | F1370: 1112,100;1116,100;1111,100;5309,100;1211,100;1212,100;1216,100;5310,100; | G1370: 5115,100;5201,100;5202,100;5205,100; | H1370: 130+26*LV | I1370: 45+10.5*LV | J1370: 32+9*LV | K1370: 24+5*LV | L1370: 13+3*LV | M1370: 100000 | N1370: 0 | O1370: math.max(0,(lv/10)-1) | P1370: math.max(0,(lv/10)-1) | Q1370: math.max(0,(lv/10)-1) | R1370: 0; | S1370: 有药王谷和盘丝洞的弟子在，真是不爽，还是跑路算了！ | T1370: 药王谷和盘丝洞的弟子不在眼前，真是轻松愉快啊！ | U1370: 0 | V1370: 0,0; | W1370: 0
A1371: 20042 | B1371: 剑灵 | C1371: pet_21 | D1371: 0 | E1371: 0 | F1371: 1112,100;1116,100;1111,100;5309,100;1211,100;1212,100;1216,100;5310,100; | G1371: 5115,100;5201,100;5202,100;5205,100; | H1371: 130+26*LV | I1371: 45+10.5*LV | J1371: 32+9*LV | K1371: 24+5*LV | L1371: 13+3*LV | M1371: 100000 | N1371: 0 | O1371: math.max(0,(lv/10)-1) | P1371: math.max(0,(lv/10)-1) | Q1371: math.max(0,(lv/10)-1) | R1371: 0; | S1371: 有药王谷和盘丝洞的弟子在，真是不爽，还是跑路算了！ | T1371: 药王谷和盘丝洞的弟子不在眼前，真是轻松愉快啊！ | U1371: 0 | V1371: 0,0; | W1371: 0
A1372: 20043 | B1372: 虎傀儡 | C1372: pet_102 | D1372: 0 | E1372: 0 | F1372: 1112,100;1116,100;1111,100;5309,100;1211,100;1212,100;1216,100;5310,100; | G1372: 5115,100;5201,100;5202,100;5205,100; | H1372: 130+26*LV | I1372: 45+10.5*LV | J1372: 32+9*LV | K1372: 24+5*LV | L1372: 13+3*LV | M1372: 100000 | N1372: 0 | O1372: math.max(0,(lv/10)-1) | P1372: math.max(0,(lv/10)-1) | Q1372: math.max(0,(lv/10)-1) | R1372: 0; | S1372: 有药王谷和盘丝洞的弟子在，真是不爽，还是跑路算了！ | T1372: 药王谷和盘丝洞的弟子不在眼前，真是轻松愉快啊！ | U1372: 0 | V1372: 0,0; | W1372: 0
A1373: 20044 | B1373: 熊猫武师 | C1373: pet_13 | D1373: 0 | E1373: 0 | F1373: 1112,100;1116,100;1111,100;5309,100;1211,100;1212,100;1216,100;5310,100; | G1373: 5115,100;5201,100;5202,100;5205,100; | H1373: 130+26*LV | I1373: 45+10.5*LV | J1373: 32+9*LV | K1373: 24+5*LV | L1373: 13+3*LV | M1373: 100000 | N1373: 0 | O1373: math.max(0,(lv/10)-1) | P1373: math.max(0,(lv/10)-1) | Q1373: math.max(0,(lv/10)-1) | R1373: 0; | S1373: 有药王谷和盘丝洞的弟子在，真是不爽，还是跑路算了！ | T1373: 药王谷和盘丝洞的弟子不在眼前，真是轻松愉快啊！ | U1373: 0 | V1373: 0,0; | W1373: 0
A1374: 20045 | B1374: 迦楼罗 | C1374: pet_201 | D1374: 0 | E1374: 0 | F1374: 1112,100;1116,100;1111,100;5309,100;1211,100;1212,100;1216,100;5310,100; | G1374: 5115,100;5201,100;5202,100;5205,100; | H1374: 130+26*LV | I1374: 45+10.5*LV | J1374: 32+9*LV | K1374: 24+5*LV | L1374: 13+3*LV | M1374: 100000 | N1374: 0 | O1374: math.max(0,(lv/10)-1) | P1374: math.max(0,(lv/10)-1) | Q1374: math.max(0,(lv/10)-1) | R1374: 0; | S1374: 有药王谷和盘丝洞的弟子在，真是不爽，还是跑路算了！ | T1374: 药王谷和盘丝洞的弟子不在眼前，真是轻松愉快啊！ | U1374: 0 | V1374: 0,0; | W1374: 0
A1375: 20046 | B1375: 猴子 | C1375: pet_73 | D1375: 0 | E1375: 0 | F1375: 1112,100;1116,100;1111,100;5309,100;1211,100;1212,100;1216,100;5310,100; | G1375: 5115,100;5201,100;5202,100;5205,100; | H1375: 130+26*LV | I1375: 45+10.5*LV | J1375: 32+9*LV | K1375: 24+5*LV | L1375: 13+3*LV | M1375: 100000 | N1375: 0 | O1375: math.max(0,(lv/10)-1) | P1375: math.max(0,(lv/10)-1) | Q1375: math.max(0,(lv/10)-1) | R1375: 0; | S1375: 有药王谷和盘丝洞的弟子在，真是不爽，还是跑路算了！ | T1375: 药王谷和盘丝洞的弟子不在眼前，真是轻松愉快啊！ | U1375: 0 | V1375: 0,0; | W1375: 0
A1376: 20047 | B1376: 阴阳师 | C1376: pet_52 | D1376: 0 | E1376: 0 | F1376: 1112,100;1116,100;1111,100;5309,100;1211,100;1212,100;1216,100;5310,100; | G1376: 5115,100;5201,100;5202,100;5205,100; | H1376: 130+26*LV | I1376: 45+10.5*LV | J1376: 32+9*LV | K1376: 24+5*LV | L1376: 13+3*LV | M1376: 100000 | N1376: 0 | O1376: math.max(0,(lv/10)-1) | P1376: math.max(0,(lv/10)-1) | Q1376: math.max(0,(lv/10)-1) | R1376: 0; | S1376: 有药王谷和盘丝洞的弟子在，真是不爽，还是跑路算了！ | T1376: 药王谷和盘丝洞的弟子不在眼前，真是轻松愉快啊！ | U1376: 0 | V1376: 0,0; | W1376: 0
A1377: 20048 | B1377: 天璇仙子 | C1377: pet_83 | D1377: 0 | E1377: 0 | F1377: 1112,100;1116,100;1111,100;5309,100;1211,100;1212,100;1216,100;5310,100; | G1377: 5115,100;5201,100;5202,100;5205,100; | H1377: 130+26*LV | I1377: 45+10.5*LV | J1377: 32+9*LV | K1377: 24+5*LV | L1377: 13+3*LV | M1377: 100000 | N1377: 0 | O1377: math.max(0,(lv/10)-1) | P1377: math.max(0,(lv/10)-1) | Q1377: math.max(0,(lv/10)-1) | R1377: 0; | S1377: 有药王谷和盘丝洞的弟子在，真是不爽，还是跑路算了！ | T1377: 药王谷和盘丝洞的弟子不在眼前，真是轻松愉快啊！ | U1377: 0 | V1377: 0,0; | W1377: 0
A1378: 20049 | B1378: 阴阳师 | C1378: pet_52 | D1378: 0 | E1378: 0 | F1378: 1112,100;1116,100;1111,100;5309,100;1211,100;1212,100;1216,100;5310,100; | G1378: 5115,100;5201,100;5202,100;5205,100; | H1378: 130+26*LV | I1378: 45+10.5*LV | J1378: 32+9*LV | K1378: 24+5*LV | L1378: 13+3*LV | M1378: 100000 | N1378: 0 | O1378: math.max(0,(lv/10)-1) | P1378: math.max(0,(lv/10)-1) | Q1378: math.max(0,(lv/10)-1) | R1378: 0; | S1378: 有药王谷和盘丝洞的弟子在，真是不爽，还是跑路算了！ | T1378: 药王谷和盘丝洞的弟子不在眼前，真是轻松愉快啊！ | U1378: 0 | V1378: 0,0; | W1378: 0
A1379: 20050 | B1379: 枪天兵 | C1379: pet_81 | D1379: 0 | E1379: 0 | F1379: 1112,100;1116,100;1111,100;5309,100;1211,100;1212,100;1216,100;5310,100; | G1379: 5115,100;5201,100;5202,100;5205,100; | H1379: 130+26*LV | I1379: 45+10.5*LV | J1379: 32+9*LV | K1379: 24+5*LV | L1379: 13+3*LV | M1379: 100000 | N1379: 0 | O1379: math.max(0,(lv/10)-1) | P1379: math.max(0,(lv/10)-1) | Q1379: math.max(0,(lv/10)-1) | R1379: 0; | S1379: 有药王谷和盘丝洞的弟子在，真是不爽，还是跑路算了！ | T1379: 药王谷和盘丝洞的弟子不在眼前，真是轻松愉快啊！ | U1379: 0 | V1379: 0,0; | W1379: 0
A1380: 20051 | B1380: 浪人 | C1380: pet_43 | D1380: 0 | E1380: 0 | F1380: 1112,100;1116,100;1111,100;5309,100;1211,100;1212,100;1216,100;5310,100; | G1380: 5115,100;5201,100;5202,100;5205,100; | H1380: 130+26*LV | I1380: 45+10.5*LV | J1380: 32+9*LV | K1380: 24+5*LV | L1380: 13+3*LV | M1380: 100000 | N1380: 0 | O1380: math.max(0,(lv/10)-1) | P1380: math.max(0,(lv/10)-1) | Q1380: math.max(0,(lv/10)-1) | R1380: 0; | S1380: 有药王谷和盘丝洞的弟子在，真是不爽，还是跑路算了！ | T1380: 药王谷和盘丝洞的弟子不在眼前，真是轻松愉快啊！ | U1380: 0 | V1380: 0,0; | W1380: 0
A1381: 20052 | B1381: 兔精 | C1381: pet_11 | D1381: 0 | E1381: 0 | F1381: 1112,100;1116,100;1111,100;5309,100;1211,100;1212,100;1216,100;5310,100; | G1381: 5115,100;5201,100;5202,100;5205,100; | H1381: 130+26*LV | I1381: 45+10.5*LV | J1381: 32+9*LV | K1381: 24+5*LV | L1381: 13+3*LV | M1381: 100000 | N1381: 0 | O1381: math.max(0,(lv/10)-1) | P1381: math.max(0,(lv/10)-1) | Q1381: math.max(0,(lv/10)-1) | R1381: 0; | S1381: 有药王谷和盘丝洞的弟子在，真是不爽，还是跑路算了！ | T1381: 药王谷和盘丝洞的弟子不在眼前，真是轻松愉快啊！ | U1381: 0 | V1381: 0,0; | W1381: 0
A1382: 20053 | B1382: 阴阳师 | C1382: pet_52 | D1382: 0 | E1382: 0 | F1382: 1112,100;1116,100;1111,100;5309,100;1211,100;1212,100;1216,100;5310,100; | G1382: 5115,100;5201,100;5202,100;5205,100; | H1382: 130+26*LV | I1382: 45+10.5*LV | J1382: 32+9*LV | K1382: 24+5*LV | L1382: 13+3*LV | M1382: 100000 | N1382: 0 | O1382: math.max(0,(lv/10)-1) | P1382: math.max(0,(lv/10)-1) | Q1382: math.max(0,(lv/10)-1) | R1382: 0; | S1382: 有药王谷和盘丝洞的弟子在，真是不爽，还是跑路算了！ | T1382: 药王谷和盘丝洞的弟子不在眼前，真是轻松愉快啊！ | U1382: 0 | V1382: 0,0; | W1382: 0
A1383: 20054 | B1383: 女魃 | C1383: pet_53 | D1383: 0 | E1383: 0 | F1383: 1112,100;1116,100;1111,100;5309,100;1211,100;1212,100;1216,100;5310,100; | G1383: 5115,100;5201,100;5202,100;5205,100; | H1383: 130+26*LV | I1383: 45+10.5*LV | J1383: 32+9*LV | K1383: 24+5*LV | L1383: 13+3*LV | M1383: 100000 | N1383: 0 | O1383: math.max(0,(lv/10)-1) | P1383: math.max(0,(lv/10)-1) | Q1383: math.max(0,(lv/10)-1) | R1383: 0; | S1383: 有药王谷和盘丝洞的弟子在，真是不爽，还是跑路算了！ | T1383: 药王谷和盘丝洞的弟子不在眼前，真是轻松愉快啊！ | U1383: 0 | V1383: 0,0; | W1383: 0
A1384: 20055 | B1384: 罗刹女 | C1384: pet_61 | D1384: 0 | E1384: 0 | F1384: 1112,100;1116,100;1111,100;5309,100;1211,100;1212,100;1216,100;5310,100; | G1384: 5115,100;5201,100;5202,100;5205,100; | H1384: 130+26*LV | I1384: 45+10.5*LV | J1384: 32+9*LV | K1384: 24+5*LV | L1384: 13+3*LV | M1384: 100000 | N1384: 0 | O1384: math.max(0,(lv/10)-1) | P1384: math.max(0,(lv/10)-1) | Q1384: math.max(0,(lv/10)-1) | R1384: 0; | S1384: 有药王谷和盘丝洞的弟子在，真是不爽，还是跑路算了！ | T1384: 药王谷和盘丝洞的弟子不在眼前，真是轻松愉快啊！ | U1384: 0 | V1384: 0,0; | W1384: 0
A1385: 20056 | B1385: 泥石人 | C1385: pet_62 | D1385: 0 | E1385: 0 | F1385: 1112,100;1116,100;1111,100;5309,100;1211,100;1212,100;1216,100;5310,100; | G1385: 5115,100;5201,100;5202,100;5205,100; | H1385: 130+26*LV | I1385: 45+10.5*LV | J1385: 32+9*LV | K1385: 24+5*LV | L1385: 13+3*LV | M1385: 100000 | N1385: 0 | O1385: math.max(0,(lv/10)-1) | P1385: math.max(0,(lv/10)-1) | Q1385: math.max(0,(lv/10)-1) | R1385: 0; | S1385: 有药王谷和盘丝洞的弟子在，真是不爽，还是跑路算了！ | T1385: 药王谷和盘丝洞的弟子不在眼前，真是轻松愉快啊！ | U1385: 0 | V1385: 0,0; | W1385: 0
A1386: 20057 | B1386: 插翅虎 | C1386: pet_63 | D1386: 0 | E1386: 0 | F1386: 1112,100;1116,100;1111,100;5309,100;1211,100;1212,100;1216,100;5310,100; | G1386: 5115,100;5201,100;5202,100;5205,100; | H1386: 130+26*LV | I1386: 45+10.5*LV | J1386: 32+9*LV | K1386: 24+5*LV | L1386: 13+3*LV | M1386: 100000 | N1386: 0 | O1386: math.max(0,(lv/10)-1) | P1386: math.max(0,(lv/10)-1) | Q1386: math.max(0,(lv/10)-1) | R1386: 0; | S1386: 有药王谷和盘丝洞的弟子在，真是不爽，还是跑路算了！ | T1386: 药王谷和盘丝洞的弟子不在眼前，真是轻松愉快啊！ | U1386: 0 | V1386: 0,0; | W1386: 0
A1387: 20058 | B1387: 剑侠 | C1387: pet_71 | D1387: 0 | E1387: 0 | F1387: 1112,100;1116,100;1111,100;5309,100;1211,100;1212,100;1216,100;5310,100; | G1387: 5115,100;5201,100;5202,100;5205,100; | H1387: 130+26*LV | I1387: 45+10.5*LV | J1387: 32+9*LV | K1387: 24+5*LV | L1387: 13+3*LV | M1387: 100000 | N1387: 0 | O1387: math.max(0,(lv/10)-1) | P1387: math.max(0,(lv/10)-1) | Q1387: math.max(0,(lv/10)-1) | R1387: 0; | S1387: 有药王谷和盘丝洞的弟子在，真是不爽，还是跑路算了！ | T1387: 药王谷和盘丝洞的弟子不在眼前，真是轻松愉快啊！ | U1387: 0 | V1387: 0,0; | W1387: 0
A1388: 20059 | B1388: 大鹏鸟 | C1388: pet_72 | D1388: 0 | E1388: 0 | F1388: 1112,100;1116,100;1111,100;5309,100;1211,100;1212,100;1216,100;5310,100; | G1388: 5115,100;5201,100;5202,100;5205,100; | H1388: 130+26*LV | I1388: 45+10.5*LV | J1388: 32+9*LV | K1388: 24+5*LV | L1388: 13+3*LV | M1388: 100000 | N1388: 0 | O1388: math.max(0,(lv/10)-1) | P1388: math.max(0,(lv/10)-1) | Q1388: math.max(0,(lv/10)-1) | R1388: 0; | S1388: 有药王谷和盘丝洞的弟子在，真是不爽，还是跑路算了！ | T1388: 药王谷和盘丝洞的弟子不在眼前，真是轻松愉快啊！ | U1388: 0 | V1388: 0,0; | W1388: 0
A1389: 20060 | B1389: 猴子 | C1389: pet_73 | D1389: 0 | E1389: 0 | F1389: 1112,100;1116,100;1111,100;5309,100;1211,100;1212,100;1216,100;5310,100; | G1389: 5115,100;5201,100;5202,100;5205,100; | H1389: 130+26*LV | I1389: 45+10.5*LV | J1389: 32+9*LV | K1389: 24+5*LV | L1389: 13+3*LV | M1389: 100000 | N1389: 0 | O1389: math.max(0,(lv/10)-1) | P1389: math.max(0,(lv/10)-1) | Q1389: math.max(0,(lv/10)-1) | R1389: 0; | S1389: 有药王谷和盘丝洞的弟子在，真是不爽，还是跑路算了！ | T1389: 药王谷和盘丝洞的弟子不在眼前，真是轻松愉快啊！ | U1389: 0 | V1389: 0,0; | W1389: 0
A1390: 20061 | B1390: 枪天将 | C1390: pet_81 | D1390: 0 | E1390: 0 | F1390: 1112,100;1116,100;1111,100;5309,100;1211,100;1212,100;1216,100;5310,100; | G1390: 5115,100;5201,100;5202,100;5205,100; | H1390: 130+26*LV | I1390: 45+10.5*LV | J1390: 32+9*LV | K1390: 24+5*LV | L1390: 13+3*LV | M1390: 100000 | N1390: 0 | O1390: math.max(0,(lv/10)-1) | P1390: math.max(0,(lv/10)-1) | Q1390: math.max(0,(lv/10)-1) | R1390: 0; | S1390: 有药王谷和盘丝洞的弟子在，真是不爽，还是跑路算了！ | T1390: 药王谷和盘丝洞的弟子不在眼前，真是轻松愉快啊！ | U1390: 0 | V1390: 0,0; | W1390: 0
A1391: 20062 | B1391: 虎傀儡 | C1391: pet_102 | D1391: 0 | E1391: 0 | F1391: 1112,100;1116,100;1111,100;5309,100;1211,100;1212,100;1216,100;5310,100; | G1391: 5115,100;5201,100;5202,100;5205,100; | H1391: 130+26*LV | I1391: 45+10.5*LV | J1391: 32+9*LV | K1391: 24+5*LV | L1391: 13+3*LV | M1391: 100000 | N1391: 0 | O1391: math.max(0,(lv/10)-1) | P1391: math.max(0,(lv/10)-1) | Q1391: math.max(0,(lv/10)-1) | R1391: 0; | S1391: 有药王谷和盘丝洞的弟子在，真是不爽，还是跑路算了！ | T1391: 药王谷和盘丝洞的弟子不在眼前，真是轻松愉快啊！ | U1391: 0 | V1391: 0,0; | W1391: 0
A1392: 20063 | B1392: 天璇仙子 | C1392: pet_83 | D1392: 0 | E1392: 0 | F1392: 1112,100;1116,100;1111,100;5309,100;1211,100;1212,100;1216,100;5310,100; | G1392: 5115,100;5201,100;5202,100;5205,100; | H1392: 130+26*LV | I1392: 45+10.5*LV | J1392: 32+9*LV | K1392: 24+5*LV | L1392: 13+3*LV | M1392: 100000 | N1392: 0 | O1392: math.max(0,(lv/10)-1) | P1392: math.max(0,(lv/10)-1) | Q1392: math.max(0,(lv/10)-1) | R1392: 0; | S1392: 有药王谷和盘丝洞的弟子在，真是不爽，还是跑路算了！ | T1392: 药王谷和盘丝洞的弟子不在眼前，真是轻松愉快啊！ | U1392: 0 | V1392: 0,0; | W1392: 0
A1393: 20064 | B1393: 桃花妖 | C1393: pet_91 | D1393: 0 | E1393: 0 | F1393: 1112,100;1116,100;1111,100;5309,100;1211,100;1212,100;1216,100;5310,100; | G1393: 5115,100;5201,100;5202,100;5205,100; | H1393: 130+26*LV | I1393: 45+10.5*LV | J1393: 32+9*LV | K1393: 24+5*LV | L1393: 13+3*LV | M1393: 100000 | N1393: 0 | O1393: math.max(0,(lv/10)-1) | P1393: math.max(0,(lv/10)-1) | Q1393: math.max(0,(lv/10)-1) | R1393: 0; | S1393: 有药王谷和盘丝洞的弟子在，真是不爽，还是跑路算了！ | T1393: 药王谷和盘丝洞的弟子不在眼前，真是轻松愉快啊！ | U1393: 0 | V1393: 0,0; | W1393: 0
A1394: 20065 | B1394: 罗刹女 | C1394: pet_61 | D1394: 0 | E1394: 0 | F1394: 1112,100;1116,100;1111,100;5309,100;1211,100;1212,100;1216,100;5310,100; | G1394: 5115,100;5201,100;5202,100;5205,100; | H1394: 130+26*LV | I1394: 45+10.5*LV | J1394: 32+9*LV | K1394: 24+5*LV | L1394: 13+3*LV | M1394: 100000 | N1394: 0 | O1394: math.max(0,(lv/10)-1) | P1394: math.max(0,(lv/10)-1) | Q1394: math.max(0,(lv/10)-1) | R1394: 0; | S1394: 有药王谷和盘丝洞的弟子在，真是不爽，还是跑路算了！ | T1394: 药王谷和盘丝洞的弟子不在眼前，真是轻松愉快啊！ | U1394: 0 | V1394: 0,0; | W1394: 0
A1395: 20066 | B1395: 媚魔 | C1395: pet_93 | D1395: 0 | E1395: 0 | F1395: 1112,100;1116,100;1111,100;5309,100;1211,100;1212,100;1216,100;5310,100; | G1395: 5115,100;5201,100;5202,100;5205,100; | H1395: 130+26*LV | I1395: 45+10.5*LV | J1395: 32+9*LV | K1395: 24+5*LV | L1395: 13+3*LV | M1395: 100000 | N1395: 0 | O1395: math.max(0,(lv/10)-1) | P1395: math.max(0,(lv/10)-1) | Q1395: math.max(0,(lv/10)-1) | R1395: 0; | S1395: 有药王谷和盘丝洞的弟子在，真是不爽，还是跑路算了！ | T1395: 药王谷和盘丝洞的弟子不在眼前，真是轻松愉快啊！ | U1395: 0 | V1395: 0,0; | W1395: 0
A1396: 20067 | B1396: 剑灵 | C1396: pet_21 | D1396: 0 | E1396: 0 | F1396: 1112,100;1116,100;1111,100;5309,100;1211,100;1212,100;1216,100;5310,100; | G1396: 5115,100;5201,100;5202,100;5205,100; | H1396: 130+26*LV | I1396: 45+10.5*LV | J1396: 32+9*LV | K1396: 24+5*LV | L1396: 13+3*LV | M1396: 100000 | N1396: 0 | O1396: math.max(0,(lv/10)-1) | P1396: math.max(0,(lv/10)-1) | Q1396: math.max(0,(lv/10)-1) | R1396: 0; | S1396: 有药王谷和盘丝洞的弟子在，真是不爽，还是跑路算了！ | T1396: 药王谷和盘丝洞的弟子不在眼前，真是轻松愉快啊！ | U1396: 0 | V1396: 0,0; | W1396: 0
A1397: 20068 | B1397: 虎傀儡 | C1397: pet_102 | D1397: 0 | E1397: 0 | F1397: 1112,100;1116,100;1111,100;5309,100;1211,100;1212,100;1216,100;5310,100; | G1397: 5115,100;5201,100;5202,100;5205,100; | H1397: 130+26*LV | I1397: 45+10.5*LV | J1397: 32+9*LV | K1397: 24+5*LV | L1397: 13+3*LV | M1397: 100000 | N1397: 0 | O1397: math.max(0,(lv/10)-1) | P1397: math.max(0,(lv/10)-1) | Q1397: math.max(0,(lv/10)-1) | R1397: 0; | S1397: 有药王谷和盘丝洞的弟子在，真是不爽，还是跑路算了！ | T1397: 药王谷和盘丝洞的弟子不在眼前，真是轻松愉快啊！ | U1397: 0 | V1397: 0,0; | W1397: 0
A1398: 20069 | B1398: 熊猫武师 | C1398: pet_13 | D1398: 0 | E1398: 0 | F1398: 1112,100;1116,100;1111,100;5309,100;1211,100;1212,100;1216,100;5310,100; | G1398: 5115,100;5201,100;5202,100;5205,100; | H1398: 130+26*LV | I1398: 45+10.5*LV | J1398: 32+9*LV | K1398: 24+5*LV | L1398: 13+3*LV | M1398: 100000 | N1398: 0 | O1398: math.max(0,(lv/10)-1) | P1398: math.max(0,(lv/10)-1) | Q1398: math.max(0,(lv/10)-1) | R1398: 0; | S1398: 有药王谷和盘丝洞的弟子在，真是不爽，还是跑路算了！ | T1398: 药王谷和盘丝洞的弟子不在眼前，真是轻松愉快啊！ | U1398: 0 | V1398: 0,0; | W1398: 0
A1399: 20070 | B1399: 迦楼罗 | C1399: pet_201 | D1399: 0 | E1399: 0 | F1399: 1112,100;1116,100;1111,100;5309,100;1211,100;1212,100;1216,100;5310,100; | G1399: 5115,100;5201,100;5202,100;5205,100; | H1399: 130+26*LV | I1399: 45+10.5*LV | J1399: 32+9*LV | K1399: 24+5*LV | L1399: 13+3*LV | M1399: 100000 | N1399: 0 | O1399: math.max(0,(lv/10)-1) | P1399: math.max(0,(lv/10)-1) | Q1399: math.max(0,(lv/10)-1) | R1399: 0; | S1399: 有药王谷和盘丝洞的弟子在，真是不爽，还是跑路算了！ | T1399: 药王谷和盘丝洞的弟子不在眼前，真是轻松愉快啊！ | U1399: 0 | V1399: 0,0; | W1399: 0
A1400: 20071 | B1400: 猴子 | C1400: pet_73 | D1400: 0 | E1400: 0 | F1400: 1112,100;1116,100;1111,100;5309,100;1211,100;1212,100;1216,100;5310,100; | G1400: 5115,100;5201,100;5202,100;5205,100; | H1400: 130+26*LV | I1400: 45+10.5*LV | J1400: 32+9*LV | K1400: 24+5*LV | L1400: 13+3*LV | M1400: 100000 | N1400: 0 | O1400: math.max(0,(lv/10)-1) | P1400: math.max(0,(lv/10)-1) | Q1400: math.max(0,(lv/10)-1) | R1400: 0; | S1400: 有药王谷和盘丝洞的弟子在，真是不爽，还是跑路算了！ | T1400: 药王谷和盘丝洞的弟子不在眼前，真是轻松愉快啊！ | U1400: 0 | V1400: 0,0; | W1400: 0
A1401: 20072 | B1401: 阴阳师 | C1401: pet_52 | D1401: 0 | E1401: 0 | F1401: 1112,100;1116,100;1111,100;5309,100;1211,100;1212,100;1216,100;5310,100; | G1401: 5115,100;5201,100;5202,100;5205,100; | H1401: 130+26*LV | I1401: 45+10.5*LV | J1401: 32+9*LV | K1401: 24+5*LV | L1401: 13+3*LV | M1401: 100000 | N1401: 0 | O1401: math.max(0,(lv/10)-1) | P1401: math.max(0,(lv/10)-1) | Q1401: math.max(0,(lv/10)-1) | R1401: 0; | S1401: 有药王谷和盘丝洞的弟子在，真是不爽，还是跑路算了！ | T1401: 药王谷和盘丝洞的弟子不在眼前，真是轻松愉快啊！ | U1401: 0 | V1401: 0,0; | W1401: 0
A1402: 20073 | B1402: 天璇仙子 | C1402: pet_83 | D1402: 0 | E1402: 0 | F1402: 1112,100;1116,100;1111,100;5309,100;1211,100;1212,100;1216,100;5310,100; | G1402: 5115,100;5201,100;5202,100;5205,100; | H1402: 130+26*LV | I1402: 45+10.5*LV | J1402: 32+9*LV | K1402: 24+5*LV | L1402: 13+3*LV | M1402: 100000 | N1402: 0 | O1402: math.max(0,(lv/10)-1) | P1402: math.max(0,(lv/10)-1) | Q1402: math.max(0,(lv/10)-1) | R1402: 0; | S1402: 有药王谷和盘丝洞的弟子在，真是不爽，还是跑路算了！ | T1402: 药王谷和盘丝洞的弟子不在眼前，真是轻松愉快啊！ | U1402: 0 | V1402: 0,0; | W1402: 0
A1403: 20074 | B1403: 阴阳师 | C1403: pet_52 | D1403: 0 | E1403: 0 | F1403: 1112,100;1116,100;1111,100;5309,100;1211,100;1212,100;1216,100;5310,100; | G1403: 5115,100;5201,100;5202,100;5205,100; | H1403: 130+26*LV | I1403: 45+10.5*LV | J1403: 32+9*LV | K1403: 24+5*LV | L1403: 13+3*LV | M1403: 100000 | N1403: 0 | O1403: math.max(0,(lv/10)-1) | P1403: math.max(0,(lv/10)-1) | Q1403: math.max(0,(lv/10)-1) | R1403: 0; | S1403: 有药王谷和盘丝洞的弟子在，真是不爽，还是跑路算了！ | T1403: 药王谷和盘丝洞的弟子不在眼前，真是轻松愉快啊！ | U1403: 0 | V1403: 0,0; | W1403: 0
A1404: 20075 | B1404: 枪天兵 | C1404: pet_81 | D1404: 0 | E1404: 0 | F1404: 1112,100;1116,100;1111,100;5309,100;1211,100;1212,100;1216,100;5310,100; | G1404: 5115,100;5201,100;5202,100;5205,100; | H1404: 130+26*LV | I1404: 45+10.5*LV | J1404: 32+9*LV | K1404: 24+5*LV | L1404: 13+3*LV | M1404: 100000 | N1404: 0 | O1404: math.max(0,(lv/10)-1) | P1404: math.max(0,(lv/10)-1) | Q1404: math.max(0,(lv/10)-1) | R1404: 0; | S1404: 有药王谷和盘丝洞的弟子在，真是不爽，还是跑路算了！ | T1404: 药王谷和盘丝洞的弟子不在眼前，真是轻松愉快啊！ | U1404: 0 | V1404: 0,0; | W1404: 0
A1405: 20076 | B1405: 浪人 | C1405: pet_43 | D1405: 0 | E1405: 0 | F1405: 1112,100;1116,100;1111,100;5309,100;1211,100;1212,100;1216,100;5310,100; | G1405: 5115,100;5201,100;5202,100;5205,100; | H1405: 130+26*LV | I1405: 45+10.5*LV | J1405: 32+9*LV | K1405: 24+5*LV | L1405: 13+3*LV | M1405: 100000 | N1405: 0 | O1405: math.max(0,(lv/10)-1) | P1405: math.max(0,(lv/10)-1) | Q1405: math.max(0,(lv/10)-1) | R1405: 0; | S1405: 有药王谷和盘丝洞的弟子在，真是不爽，还是跑路算了！ | T1405: 药王谷和盘丝洞的弟子不在眼前，真是轻松愉快啊！ | U1405: 0 | V1405: 0,0; | W1405: 0
A1406: 20077 | B1406: 兔精 | C1406: pet_11 | D1406: 0 | E1406: 0 | F1406: 1112,100;1116,100;1111,100;5309,100;1211,100;1212,100;1216,100;5310,100; | G1406: 5115,100;5201,100;5202,100;5205,100; | H1406: 130+26*LV | I1406: 45+10.5*LV | J1406: 32+9*LV | K1406: 24+5*LV | L1406: 13+3*LV | M1406: 100000 | N1406: 0 | O1406: math.max(0,(lv/10)-1) | P1406: math.max(0,(lv/10)-1) | Q1406: math.max(0,(lv/10)-1) | R1406: 0; | S1406: 有药王谷和盘丝洞的弟子在，真是不爽，还是跑路算了！ | T1406: 药王谷和盘丝洞的弟子不在眼前，真是轻松愉快啊！ | U1406: 0 | V1406: 0,0; | W1406: 0
A1407: 20078 | B1407: 阴阳师 | C1407: pet_52 | D1407: 0 | E1407: 0 | F1407: 1112,100;1116,100;1111,100;5309,100;1211,100;1212,100;1216,100;5310,100; | G1407: 5115,100;5201,100;5202,100;5205,100; | H1407: 130+26*LV | I1407: 45+10.5*LV | J1407: 32+9*LV | K1407: 24+5*LV | L1407: 13+3*LV | M1407: 100000 | N1407: 0 | O1407: math.max(0,(lv/10)-1) | P1407: math.max(0,(lv/10)-1) | Q1407: math.max(0,(lv/10)-1) | R1407: 0; | S1407: 有药王谷和盘丝洞的弟子在，真是不爽，还是跑路算了！ | T1407: 药王谷和盘丝洞的弟子不在眼前，真是轻松愉快啊！ | U1407: 0 | V1407: 0,0; | W1407: 0
A1408: 20079 | B1408: 女魃 | C1408: pet_53 | D1408: 0 | E1408: 0 | F1408: 1112,100;1116,100;1111,100;5309,100;1211,100;1212,100;1216,100;5310,100; | G1408: 5115,100;5201,100;5202,100;5205,100; | H1408: 130+26*LV | I1408: 45+10.5*LV | J1408: 32+9*LV | K1408: 24+5*LV | L1408: 13+3*LV | M1408: 100000 | N1408: 0 | O1408: math.max(0,(lv/10)-1) | P1408: math.max(0,(lv/10)-1) | Q1408: math.max(0,(lv/10)-1) | R1408: 0; | S1408: 有药王谷和盘丝洞的弟子在，真是不爽，还是跑路算了！ | T1408: 药王谷和盘丝洞的弟子不在眼前，真是轻松愉快啊！ | U1408: 0 | V1408: 0,0; | W1408: 0
A1409: 20080 | B1409: 罗刹女 | C1409: pet_61 | D1409: 0 | E1409: 0 | F1409: 1112,100;1116,100;1111,100;5309,100;1211,100;1212,100;1216,100;5310,100; | G1409: 5115,100;5201,100;5202,100;5205,100; | H1409: 130+26*LV | I1409: 45+10.5*LV | J1409: 32+9*LV | K1409: 24+5*LV | L1409: 13+3*LV | M1409: 100000 | N1409: 0 | O1409: math.max(0,(lv/10)-1) | P1409: math.max(0,(lv/10)-1) | Q1409: math.max(0,(lv/10)-1) | R1409: 0; | S1409: 有药王谷和盘丝洞的弟子在，真是不爽，还是跑路算了！ | T1409: 药王谷和盘丝洞的弟子不在眼前，真是轻松愉快啊！ | U1409: 0 | V1409: 0,0; | W1409: 0
A1410: 20081 | B1410: 泥石人 | C1410: pet_62 | D1410: 0 | E1410: 0 | F1410: 1112,100;1116,100;1111,100;5309,100;1211,100;1212,100;1216,100;5310,100; | G1410: 5115,100;5201,100;5202,100;5205,100; | H1410: 130+26*LV | I1410: 45+10.5*LV | J1410: 32+9*LV | K1410: 24+5*LV | L1410: 13+3*LV | M1410: 100000 | N1410: 0 | O1410: math.max(0,(lv/5)-1) | P1410: math.max(0,(lv/5)-1) | Q1410: math.max(0,(lv/5)-1) | R1410: 0; | S1410: 有药王谷和盘丝洞的弟子在，真是不爽，还是跑路算了！ | T1410: 药王谷和盘丝洞的弟子不在眼前，真是轻松愉快啊！ | U1410: 0 | V1410: 0,0; | W1410: 0
A1411: 20082 | B1411: 插翅虎 | C1411: pet_63 | D1411: 0 | E1411: 0 | F1411: 1112,100;1116,100;1111,100;5309,100;1211,100;1212,100;1216,100;5310,100; | G1411: 5115,100;5201,100;5202,100;5205,100; | H1411: 130+26*LV | I1411: 45+10.5*LV | J1411: 32+9*LV | K1411: 24+5*LV | L1411: 13+3*LV | M1411: 100000 | N1411: 0 | O1411: math.max(0,(lv/5)-1) | P1411: math.max(0,(lv/5)-1) | Q1411: math.max(0,(lv/5)-1) | R1411: 0; | S1411: 有药王谷和盘丝洞的弟子在，真是不爽，还是跑路算了！ | T1411: 药王谷和盘丝洞的弟子不在眼前，真是轻松愉快啊！ | U1411: 0 | V1411: 0,0; | W1411: 0
A1412: 20083 | B1412: 剑侠 | C1412: pet_71 | D1412: 0 | E1412: 0 | F1412: 1112,100;1116,100;1111,100;5309,100;1211,100;1212,100;1216,100;5310,100; | G1412: 5115,100;5201,100;5202,100;5205,100; | H1412: 130+26*LV | I1412: 45+10.5*LV | J1412: 32+9*LV | K1412: 24+5*LV | L1412: 13+3*LV | M1412: 100000 | N1412: 0 | O1412: math.max(0,(lv/5)-1) | P1412: math.max(0,(lv/5)-1) | Q1412: math.max(0,(lv/5)-1) | R1412: 0; | S1412: 有药王谷和盘丝洞的弟子在，真是不爽，还是跑路算了！ | T1412: 药王谷和盘丝洞的弟子不在眼前，真是轻松愉快啊！ | U1412: 0 | V1412: 0,0; | W1412: 0
A1413: 20084 | B1413: 大鹏鸟 | C1413: pet_72 | D1413: 0 | E1413: 0 | F1413: 1112,100;1116,100;1111,100;5309,100;1211,100;1212,100;1216,100;5310,100; | G1413: 5115,100;5201,100;5202,100;5205,100; | H1413: 130+26*LV | I1413: 45+10.5*LV | J1413: 32+9*LV | K1413: 24+5*LV | L1413: 13+3*LV | M1413: 100000 | N1413: 0 | O1413: math.max(0,(lv/5)-1) | P1413: math.max(0,(lv/5)-1) | Q1413: math.max(0,(lv/5)-1) | R1413: 0; | S1413: 有药王谷和盘丝洞的弟子在，真是不爽，还是跑路算了！ | T1413: 药王谷和盘丝洞的弟子不在眼前，真是轻松愉快啊！ | U1413: 0 | V1413: 0,0; | W1413: 0
A1414: 20085 | B1414: 猴子 | C1414: pet_73 | D1414: 0 | E1414: 0 | F1414: 1112,100;1116,100;1111,100;5309,100;1211,100;1212,100;1216,100;5310,100; | G1414: 5115,100;5201,100;5202,100;5205,100; | H1414: 130+26*LV | I1414: 45+10.5*LV | J1414: 32+9*LV | K1414: 24+5*LV | L1414: 13+3*LV | M1414: 100000 | N1414: 0 | O1414: math.max(0,(lv/5)-1) | P1414: math.max(0,(lv/5)-1) | Q1414: math.max(0,(lv/5)-1) | R1414: 0; | S1414: 有药王谷和盘丝洞的弟子在，真是不爽，还是跑路算了！ | T1414: 药王谷和盘丝洞的弟子不在眼前，真是轻松愉快啊！ | U1414: 0 | V1414: 0,0; | W1414: 0
A1415: 20086 | B1415: 枪天将 | C1415: pet_81 | D1415: 0 | E1415: 0 | F1415: 1112,100;1116,100;1111,100;5309,100;1211,100;1212,100;1216,100;5310,100; | G1415: 5115,100;5201,100;5202,100;5205,100; | H1415: 130+26*LV | I1415: 45+10.5*LV | J1415: 32+9*LV | K1415: 24+5*LV | L1415: 13+3*LV | M1415: 100000 | N1415: 0 | O1415: math.max(0,(lv/5)-1) | P1415: math.max(0,(lv/5)-1) | Q1415: math.max(0,(lv/5)-1) | R1415: 0; | S1415: 有药王谷和盘丝洞的弟子在，真是不爽，还是跑路算了！ | T1415: 药王谷和盘丝洞的弟子不在眼前，真是轻松愉快啊！ | U1415: 0 | V1415: 0,0; | W1415: 0
A1416: 20087 | B1416: 虎傀儡 | C1416: pet_102 | D1416: 0 | E1416: 0 | F1416: 1112,100;1116,100;1111,100;5309,100;1211,100;1212,100;1216,100;5310,100; | G1416: 5115,100;5201,100;5202,100;5205,100; | H1416: 130+26*LV | I1416: 45+10.5*LV | J1416: 32+9*LV | K1416: 24+5*LV | L1416: 13+3*LV | M1416: 100000 | N1416: 0 | O1416: math.max(0,(lv/5)-1) | P1416: math.max(0,(lv/5)-1) | Q1416: math.max(0,(lv/5)-1) | R1416: 0; | S1416: 有药王谷和盘丝洞的弟子在，真是不爽，还是跑路算了！ | T1416: 药王谷和盘丝洞的弟子不在眼前，真是轻松愉快啊！ | U1416: 0 | V1416: 0,0; | W1416: 0
A1417: 20088 | B1417: 天璇仙子 | C1417: pet_83 | D1417: 0 | E1417: 0 | F1417: 1112,100;1116,100;1111,100;5309,100;1211,100;1212,100;1216,100;5310,100; | G1417: 5115,100;5201,100;5202,100;5205,100; | H1417: 130+26*LV | I1417: 45+10.5*LV | J1417: 32+9*LV | K1417: 24+5*LV | L1417: 13+3*LV | M1417: 100000 | N1417: 0 | O1417: math.max(0,(lv/5)-1) | P1417: math.max(0,(lv/5)-1) | Q1417: math.max(0,(lv/5)-1) | R1417: 0; | S1417: 有药王谷和盘丝洞的弟子在，真是不爽，还是跑路算了！ | T1417: 药王谷和盘丝洞的弟子不在眼前，真是轻松愉快啊！ | U1417: 0 | V1417: 0,0; | W1417: 0
A1418: 20089 | B1418: 桃花妖 | C1418: pet_91 | D1418: 0 | E1418: 0 | F1418: 1112,100;1116,100;1111,100;5309,100;1211,100;1212,100;1216,100;5310,100; | G1418: 5115,100;5201,100;5202,100;5205,100; | H1418: 130+26*LV | I1418: 45+10.5*LV | J1418: 32+9*LV | K1418: 24+5*LV | L1418: 13+3*LV | M1418: 100000 | N1418: 0 | O1418: math.max(0,(lv/5)-1) | P1418: math.max(0,(lv/5)-1) | Q1418: math.max(0,(lv/5)-1) | R1418: 0; | S1418: 有药王谷和盘丝洞的弟子在，真是不爽，还是跑路算了！ | T1418: 药王谷和盘丝洞的弟子不在眼前，真是轻松愉快啊！ | U1418: 0 | V1418: 0,0; | W1418: 0
A1419: 20090 | B1419: 罗刹女 | C1419: pet_61 | D1419: 0 | E1419: 0 | F1419: 1112,100;1116,100;1111,100;5309,100;1211,100;1212,100;1216,100;5310,100; | G1419: 5115,100;5201,100;5202,100;5205,100; | H1419: 130+26*LV | I1419: 45+10.5*LV | J1419: 32+9*LV | K1419: 24+5*LV | L1419: 13+3*LV | M1419: 100000 | N1419: 0 | O1419: math.max(0,(lv/5)-1) | P1419: math.max(0,(lv/5)-1) | Q1419: math.max(0,(lv/5)-1) | R1419: 0; | S1419: 有药王谷和盘丝洞的弟子在，真是不爽，还是跑路算了！ | T1419: 药王谷和盘丝洞的弟子不在眼前，真是轻松愉快啊！ | U1419: 0 | V1419: 0,0; | W1419: 0
A1420: 20091 | B1420: 媚魔 | C1420: pet_93 | D1420: 0 | E1420: 0 | F1420: 1112,100;1116,100;1111,100;5309,100;1211,100;1212,100;1216,100;5310,100; | G1420: 5115,100;5201,100;5202,100;5205,100; | H1420: 130+26*LV | I1420: 45+10.5*LV | J1420: 32+9*LV | K1420: 24+5*LV | L1420: 13+3*LV | M1420: 100000 | N1420: 0 | O1420: math.max(0,(lv/5)-1) | P1420: math.max(0,(lv/5)-1) | Q1420: math.max(0,(lv/5)-1) | R1420: 0; | S1420: 有药王谷和盘丝洞的弟子在，真是不爽，还是跑路算了！ | T1420: 药王谷和盘丝洞的弟子不在眼前，真是轻松愉快啊！ | U1420: 0 | V1420: 0,0; | W1420: 0
A1421: 20092 | B1421: 剑灵 | C1421: pet_21 | D1421: 0 | E1421: 0 | F1421: 1112,100;1116,100;1111,100;5309,100;1211,100;1212,100;1216,100;5310,100; | G1421: 5115,100;5201,100;5202,100;5205,100; | H1421: 130+26*LV | I1421: 45+10.5*LV | J1421: 32+9*LV | K1421: 24+5*LV | L1421: 13+3*LV | M1421: 100000 | N1421: 0 | O1421: math.max(0,(lv/5)-1) | P1421: math.max(0,(lv/5)-1) | Q1421: math.max(0,(lv/5)-1) | R1421: 0; | S1421: 有药王谷和盘丝洞的弟子在，真是不爽，还是跑路算了！ | T1421: 药王谷和盘丝洞的弟子不在眼前，真是轻松愉快啊！ | U1421: 0 | V1421: 0,0; | W1421: 0
A1422: 20093 | B1422: 虎傀儡 | C1422: pet_102 | D1422: 0 | E1422: 0 | F1422: 1112,100;1116,100;1111,100;5309,100;1211,100;1212,100;1216,100;5310,100; | G1422: 5115,100;5201,100;5202,100;5205,100; | H1422: 130+26*LV | I1422: 45+10.5*LV | J1422: 32+9*LV | K1422: 24+5*LV | L1422: 13+3*LV | M1422: 100000 | N1422: 0 | O1422: math.max(0,(lv/5)-1) | P1422: math.max(0,(lv/5)-1) | Q1422: math.max(0,(lv/5)-1) | R1422: 0; | S1422: 有药王谷和盘丝洞的弟子在，真是不爽，还是跑路算了！ | T1422: 药王谷和盘丝洞的弟子不在眼前，真是轻松愉快啊！ | U1422: 0 | V1422: 0,0; | W1422: 0
A1423: 20094 | B1423: 熊猫武师 | C1423: pet_13 | D1423: 0 | E1423: 0 | F1423: 1112,100;1116,100;1111,100;5309,100;1211,100;1212,100;1216,100;5310,100; | G1423: 5115,100;5201,100;5202,100;5205,100; | H1423: 130+26*LV | I1423: 45+10.5*LV | J1423: 32+9*LV | K1423: 24+5*LV | L1423: 13+3*LV | M1423: 100000 | N1423: 0 | O1423: math.max(0,(lv/5)-1) | P1423: math.max(0,(lv/5)-1) | Q1423: math.max(0,(lv/5)-1) | R1423: 0; | S1423: 有药王谷和盘丝洞的弟子在，真是不爽，还是跑路算了！ | T1423: 药王谷和盘丝洞的弟子不在眼前，真是轻松愉快啊！ | U1423: 0 | V1423: 0,0; | W1423: 0
A1424: 20095 | B1424: 迦楼罗 | C1424: pet_201 | D1424: 0 | E1424: 0 | F1424: 1112,100;1116,100;1111,100;5309,100;1211,100;1212,100;1216,100;5310,100; | G1424: 5115,100;5201,100;5202,100;5205,100; | H1424: 130+26*LV | I1424: 45+10.5*LV | J1424: 32+9*LV | K1424: 24+5*LV | L1424: 13+3*LV | M1424: 100000 | N1424: 0 | O1424: math.max(0,(lv/5)-1) | P1424: math.max(0,(lv/5)-1) | Q1424: math.max(0,(lv/5)-1) | R1424: 0; | S1424: 有药王谷和盘丝洞的弟子在，真是不爽，还是跑路算了！ | T1424: 药王谷和盘丝洞的弟子不在眼前，真是轻松愉快啊！ | U1424: 0 | V1424: 0,0; | W1424: 0
A1425: 20096 | B1425: 猴子 | C1425: pet_73 | D1425: 0 | E1425: 0 | F1425: 1112,100;1116,100;1111,100;5309,100;1211,100;1212,100;1216,100;5310,100; | G1425: 5115,100;5201,100;5202,100;5205,100; | H1425: 130+26*LV | I1425: 45+10.5*LV | J1425: 32+9*LV | K1425: 24+5*LV | L1425: 13+3*LV | M1425: 100000 | N1425: 0 | O1425: math.max(0,(lv/5)-1) | P1425: math.max(0,(lv/5)-1) | Q1425: math.max(0,(lv/5)-1) | R1425: 0; | S1425: 有药王谷和盘丝洞的弟子在，真是不爽，还是跑路算了！ | T1425: 药王谷和盘丝洞的弟子不在眼前，真是轻松愉快啊！ | U1425: 0 | V1425: 0,0; | W1425: 0
A1426: 20097 | B1426: 阴阳师 | C1426: pet_52 | D1426: 0 | E1426: 0 | F1426: 1112,100;1116,100;1111,100;5309,100;1211,100;1212,100;1216,100;5310,100; | G1426: 5115,100;5201,100;5202,100;5205,100; | H1426: 130+26*LV | I1426: 45+10.5*LV | J1426: 32+9*LV | K1426: 24+5*LV | L1426: 13+3*LV | M1426: 100000 | N1426: 0 | O1426: math.max(0,(lv/5)-1) | P1426: math.max(0,(lv/5)-1) | Q1426: math.max(0,(lv/5)-1) | R1426: 0; | S1426: 有药王谷和盘丝洞的弟子在，真是不爽，还是跑路算了！ | T1426: 药王谷和盘丝洞的弟子不在眼前，真是轻松愉快啊！ | U1426: 0 | V1426: 0,0; | W1426: 0
A1427: 20098 | B1427: 天璇仙子 | C1427: pet_83 | D1427: 0 | E1427: 0 | F1427: 1112,100;1116,100;1111,100;5309,100;1211,100;1212,100;1216,100;5310,100; | G1427: 5115,100;5201,100;5202,100;5205,100; | H1427: 130+26*LV | I1427: 45+10.5*LV | J1427: 32+9*LV | K1427: 24+5*LV | L1427: 13+3*LV | M1427: 100000 | N1427: 0 | O1427: math.max(0,(lv/5)-1) | P1427: math.max(0,(lv/5)-1) | Q1427: math.max(0,(lv/5)-1) | R1427: 0; | S1427: 有药王谷和盘丝洞的弟子在，真是不爽，还是跑路算了！ | T1427: 药王谷和盘丝洞的弟子不在眼前，真是轻松愉快啊！ | U1427: 0 | V1427: 0,0; | W1427: 0
A1428: 20099 | B1428: 阴阳师 | C1428: pet_52 | D1428: 0 | E1428: 0 | F1428: 1112,100;1116,100;1111,100;5309,100;1211,100;1212,100;1216,100;5310,100; | G1428: 5115,100;5201,100;5202,100;5205,100; | H1428: 130+26*LV | I1428: 45+10.5*LV | J1428: 32+9*LV | K1428: 24+5*LV | L1428: 13+3*LV | M1428: 100000 | N1428: 0 | O1428: math.max(0,(lv/5)-1) | P1428: math.max(0,(lv/5)-1) | Q1428: math.max(0,(lv/5)-1) | R1428: 0; | S1428: 有药王谷和盘丝洞的弟子在，真是不爽，还是跑路算了！ | T1428: 药王谷和盘丝洞的弟子不在眼前，真是轻松愉快啊！ | U1428: 0 | V1428: 0,0; | W1428: 0
A1429: 20100 | B1429: 枪天兵 | C1429: pet_81 | D1429: 0 | E1429: 0 | F1429: 1112,100;1116,100;1111,100;5309,100;1211,100;1212,100;1216,100;5310,100; | G1429: 5115,100;5201,100;5202,100;5205,100; | H1429: 130+26*LV | I1429: 45+10.5*LV | J1429: 32+9*LV | K1429: 24+5*LV | L1429: 13+3*LV | M1429: 100000 | N1429: 0 | O1429: math.max(0,(lv/5)-1) | P1429: math.max(0,(lv/5)-1) | Q1429: math.max(0,(lv/5)-1) | R1429: 0; | S1429: 有药王谷和盘丝洞的弟子在，真是不爽，还是跑路算了！ | T1429: 药王谷和盘丝洞的弟子不在眼前，真是轻松愉快啊！ | U1429: 0 | V1429: 0,0; | W1429: 0
A1430: 20101 | B1430: 喽啰 | C1430: pet_42 | D1430: 0 | E1430: 0 | F1430: 1112,100;1116,100;1111,100; | G1430: 5103,100;5209,100;5101,100; | H1430: 130+26*LV*0.6 | I1430: 45+10.5*LV*0.6 | J1430: 32+9*LV*0.6 | K1430: 24+5*LV*0.6 | L1430: 13+3*LV*0.6 | M1430: 100000 | N1430: 0 | O1430: math.max(0,(lv/10)-1) | P1430: math.max(0,(lv/10)-1) | Q1430: math.max(0,(lv/10)-1) | R1430: 0; | S1430: 有药王谷和盘丝洞的弟子在，真是不爽，还是跑路算了！ | T1430: 药王谷和盘丝洞的弟子不在眼前，真是轻松愉快啊！ | U1430: 0 | V1430: 0,0; | W1430: 1
A1431: 20102 | B1431: 喽啰 | C1431: pet_42 | D1431: 0 | E1431: 0 | F1431: 1112,100;1116,100;1111,100; | G1431: 5103,100;5209,100;5101,100; | H1431: 130+26*LV*0.6 | I1431: 45+10.5*LV*0.6 | J1431: 32+9*LV*0.6 | K1431: 24+5*LV*0.6 | L1431: 13+3*LV*0.6 | M1431: 100000 | N1431: 0 | O1431: math.max(0,(lv/10)-1) | P1431: math.max(0,(lv/10)-1) | Q1431: math.max(0,(lv/10)-1) | R1431: 0; | S1431: 有药王谷和盘丝洞的弟子在，真是不爽，还是跑路算了！ | T1431: 药王谷和盘丝洞的弟子不在眼前，真是轻松愉快啊！ | U1431: 0 | V1431: 0,0; | W1431: 1
A1432: 20103 | B1432: 喽啰 | C1432: pet_42 | D1432: 0 | E1432: 0 | F1432: 1112,100;1116,100;1111,100; | G1432: 5103,100;5209,100;5101,100; | H1432: 130+26*LV*0.6 | I1432: 45+10.5*LV*0.6 | J1432: 32+9*LV*0.6 | K1432: 24+5*LV*0.6 | L1432: 13+3*LV*0.6 | M1432: 100000 | N1432: 0 | O1432: math.max(0,(lv/10)-1) | P1432: math.max(0,(lv/10)-1) | Q1432: math.max(0,(lv/10)-1) | R1432: 0; | S1432: 有药王谷和盘丝洞的弟子在，真是不爽，还是跑路算了！ | T1432: 药王谷和盘丝洞的弟子不在眼前，真是轻松愉快啊！ | U1432: 0 | V1432: 0,0; | W1432: 1
A1433: 20104 | B1433: 喽啰 | C1433: pet_42 | D1433: 0 | E1433: 0 | F1433: 1112,100;1116,100;1111,100; | G1433: 5103,100;5209,100;5101,100; | H1433: 130+26*LV*0.6 | I1433: 45+10.5*LV*0.6 | J1433: 32+9*LV*0.6 | K1433: 24+5*LV*0.6 | L1433: 13+3*LV*0.6 | M1433: 100000 | N1433: 0 | O1433: math.max(0,(lv/10)-1) | P1433: math.max(0,(lv/10)-1) | Q1433: math.max(0,(lv/10)-1) | R1433: 0; | S1433: 有药王谷和盘丝洞的弟子在，真是不爽，还是跑路算了！ | T1433: 药王谷和盘丝洞的弟子不在眼前，真是轻松愉快啊！ | U1433: 0 | V1433: 0,0; | W1433: 1
A1434: 20105 | B1434: 喽啰 | C1434: pet_42 | D1434: 0 | E1434: 0 | F1434: 1112,100;1116,100;1111,100; | G1434: 5103,100;5209,100;5101,100; | H1434: 130+26*LV*0.6 | I1434: 45+10.5*LV*0.6 | J1434: 32+9*LV*0.6 | K1434: 24+5*LV*0.6 | L1434: 13+3*LV*0.6 | M1434: 100000 | N1434: 0 | O1434: math.max(0,(lv/10)-1) | P1434: math.max(0,(lv/10)-1) | Q1434: math.max(0,(lv/10)-1) | R1434: 0; | S1434: 有药王谷和盘丝洞的弟子在，真是不爽，还是跑路算了！ | T1434: 药王谷和盘丝洞的弟子不在眼前，真是轻松愉快啊！ | U1434: 0 | V1434: 0,0; | W1434: 1
A1435: 20106 | B1435: 喽啰 | C1435: pet_13 | D1435: 0 | E1435: 0 | F1435: 1112,100;1116,100;1111,100; | G1435: 5103,100;5209,100;5101,100; | H1435: 130+26*LV*0.6 | I1435: 45+10.5*LV*0.6 | J1435: 32+9*LV*0.6 | K1435: 24+5*LV*0.6 | L1435: 13+3*LV*0.6 | M1435: 100000 | N1435: 0 | O1435: math.max(0,(lv/10)-1) | P1435: math.max(0,(lv/10)-1) | Q1435: math.max(0,(lv/10)-1) | R1435: 0; | S1435: 有药王谷和盘丝洞的弟子在，真是不爽，还是跑路算了！ | T1435: 药王谷和盘丝洞的弟子不在眼前，真是轻松愉快啊！ | U1435: 0 | V1435: 0,0; | W1435: 1
A1436: 20107 | B1436: 喽啰 | C1436: pet_13 | D1436: 0 | E1436: 0 | F1436: 1112,100;1116,100;1111,100; | G1436: 5103,100;5209,100;5101,100; | H1436: 130+26*LV*0.6 | I1436: 45+10.5*LV*0.6 | J1436: 32+9*LV*0.6 | K1436: 24+5*LV*0.6 | L1436: 13+3*LV*0.6 | M1436: 100000 | N1436: 0 | O1436: math.max(0,(lv/10)-1) | P1436: math.max(0,(lv/10)-1) | Q1436: math.max(0,(lv/10)-1) | R1436: 0; | S1436: 有药王谷和盘丝洞的弟子在，真是不爽，还是跑路算了！ | T1436: 药王谷和盘丝洞的弟子不在眼前，真是轻松愉快啊！ | U1436: 0 | V1436: 0,0; | W1436: 1
A1437: 20108 | B1437: 喽啰 | C1437: pet_13 | D1437: 0 | E1437: 0 | F1437: 1112,100;1116,100;1111,100; | G1437: 5103,100;5209,100;5101,100; | H1437: 130+26*LV*0.6 | I1437: 45+10.5*LV*0.6 | J1437: 32+9*LV*0.6 | K1437: 24+5*LV*0.6 | L1437: 13+3*LV*0.6 | M1437: 100000 | N1437: 0 | O1437: math.max(0,(lv/10)-1) | P1437: math.max(0,(lv/10)-1) | Q1437: math.max(0,(lv/10)-1) | R1437: 0; | S1437: 有药王谷和盘丝洞的弟子在，真是不爽，还是跑路算了！ | T1437: 药王谷和盘丝洞的弟子不在眼前，真是轻松愉快啊！ | U1437: 0 | V1437: 0,0; | W1437: 1
A1438: 20109 | B1438: 喽啰 | C1438: pet_13 | D1438: 0 | E1438: 0 | F1438: 1112,100;1116,100;1111,100; | G1438: 5103,100;5209,100;5101,100; | H1438: 130+26*LV*0.6 | I1438: 45+10.5*LV*0.6 | J1438: 32+9*LV*0.6 | K1438: 24+5*LV*0.6 | L1438: 13+3*LV*0.6 | M1438: 100000 | N1438: 0 | O1438: math.max(0,(lv/10)-1) | P1438: math.max(0,(lv/10)-1) | Q1438: math.max(0,(lv/10)-1) | R1438: 0; | S1438: 有药王谷和盘丝洞的弟子在，真是不爽，还是跑路算了！ | T1438: 药王谷和盘丝洞的弟子不在眼前，真是轻松愉快啊！ | U1438: 0 | V1438: 0,0; | W1438: 1
A1439: 20110 | B1439: 喽啰 | C1439: pet_13 | D1439: 0 | E1439: 0 | F1439: 1112,100;1116,100;1111,100; | G1439: 5103,100;5209,100;5101,100; | H1439: 130+26*LV*0.6 | I1439: 45+10.5*LV*0.6 | J1439: 32+9*LV*0.6 | K1439: 24+5*LV*0.6 | L1439: 13+3*LV*0.6 | M1439: 100000 | N1439: 0 | O1439: math.max(0,(lv/10)-1) | P1439: math.max(0,(lv/10)-1) | Q1439: math.max(0,(lv/10)-1) | R1439: 0; | S1439: 有药王谷和盘丝洞的弟子在，真是不爽，还是跑路算了！ | T1439: 药王谷和盘丝洞的弟子不在眼前，真是轻松愉快啊！ | U1439: 0 | V1439: 0,0; | W1439: 1
A1440: 20111 | B1440: 喽啰 | C1440: pet_63 | D1440: 0 | E1440: 0 | F1440: 1112,100;1116,100;1111,100; | G1440: 5103,100;5209,100;5101,100; | H1440: 130+26*LV*0.6 | I1440: 45+10.5*LV*0.6 | J1440: 32+9*LV*0.6 | K1440: 24+5*LV*0.6 | L1440: 13+3*LV*0.6 | M1440: 100000 | N1440: 0 | O1440: math.max(0,(lv/10)-1) | P1440: math.max(0,(lv/10)-1) | Q1440: math.max(0,(lv/10)-1) | R1440: 0; | S1440: 有药王谷和盘丝洞的弟子在，真是不爽，还是跑路算了！ | T1440: 药王谷和盘丝洞的弟子不在眼前，真是轻松愉快啊！ | U1440: 0 | V1440: 0,0; | W1440: 1
A1441: 20112 | B1441: 喽啰 | C1441: hero_1001 | D1441: 0 | E1441: 0 | F1441: 1112,100;1116,100;1111,100; | G1441: 5103,100;5209,100;5101,100; | H1441: 130+26*LV*0.6 | I1441: 45+10.5*LV*0.6 | J1441: 32+9*LV*0.6 | K1441: 24+5*LV*0.6 | L1441: 13+3*LV*0.6 | M1441: 100000 | N1441: 0 | O1441: math.max(0,(lv/10)-1) | P1441: math.max(0,(lv/10)-1) | Q1441: math.max(0,(lv/10)-1) | R1441: 0; | S1441: 有药王谷和盘丝洞的弟子在，真是不爽，还是跑路算了！ | T1441: 药王谷和盘丝洞的弟子不在眼前，真是轻松愉快啊！ | U1441: 0 | V1441: 0,0; | W1441: 1
A1442: 20113 | B1442: 喽啰 | C1442: pet_42 | D1442: 0 | E1442: 0 | F1442: 1112,100;1116,100;1111,100; | G1442: 5103,100;5209,100;5101,100; | H1442: 130+26*LV*0.6 | I1442: 45+10.5*LV*0.6 | J1442: 32+9*LV*0.6 | K1442: 24+5*LV*0.6 | L1442: 13+3*LV*0.6 | M1442: 100000 | N1442: 0 | O1442: math.max(0,(lv/10)-1) | P1442: math.max(0,(lv/10)-1) | Q1442: math.max(0,(lv/10)-1) | R1442: 0; | S1442: 有药王谷和盘丝洞的弟子在，真是不爽，还是跑路算了！ | T1442: 药王谷和盘丝洞的弟子不在眼前，真是轻松愉快啊！ | U1442: 0 | V1442: 0,0; | W1442: 1
A1443: 20114 | B1443: 喽啰 | C1443: hero_1001 | D1443: 0 | E1443: 0 | F1443: 1112,100;1116,100;1111,100; | G1443: 5103,100;5209,100;5101,100; | H1443: 130+26*LV*0.6 | I1443: 45+10.5*LV*0.6 | J1443: 32+9*LV*0.6 | K1443: 24+5*LV*0.6 | L1443: 13+3*LV*0.6 | M1443: 100000 | N1443: 0 | O1443: math.max(0,(lv/10)-1) | P1443: math.max(0,(lv/10)-1) | Q1443: math.max(0,(lv/10)-1) | R1443: 0; | S1443: 有药王谷和盘丝洞的弟子在，真是不爽，还是跑路算了！ | T1443: 药王谷和盘丝洞的弟子不在眼前，真是轻松愉快啊！ | U1443: 0 | V1443: 0,0; | W1443: 1
A1444: 20115 | B1444: 喽啰 | C1444: pet_22 | D1444: 0 | E1444: 0 | F1444: 1112,100;1116,100;1111,100; | G1444: 5103,100;5209,100;5101,100; | H1444: 130+26*LV*0.6 | I1444: 45+10.5*LV*0.6 | J1444: 32+9*LV*0.6 | K1444: 24+5*LV*0.6 | L1444: 13+3*LV*0.6 | M1444: 100000 | N1444: 0 | O1444: math.max(0,(lv/10)-1) | P1444: math.max(0,(lv/10)-1) | Q1444: math.max(0,(lv/10)-1) | R1444: 0; | S1444: 有药王谷和盘丝洞的弟子在，真是不爽，还是跑路算了！ | T1444: 药王谷和盘丝洞的弟子不在眼前，真是轻松愉快啊！ | U1444: 0 | V1444: 0,0; | W1444: 1
A1445: 20116 | B1445: 喽啰 | C1445: pet_63 | D1445: 0 | E1445: 0 | F1445: 1112,100;1116,100;1111,100; | G1445: 5103,100;5209,100;5101,100; | H1445: 130+26*LV*0.6 | I1445: 45+10.5*LV*0.6 | J1445: 32+9*LV*0.6 | K1445: 24+5*LV*0.6 | L1445: 13+3*LV*0.6 | M1445: 100000 | N1445: 0 | O1445: math.max(0,(lv/10)-1) | P1445: math.max(0,(lv/10)-1) | Q1445: math.max(0,(lv/10)-1) | R1445: 0; | S1445: 有药王谷和盘丝洞的弟子在，真是不爽，还是跑路算了！ | T1445: 药王谷和盘丝洞的弟子不在眼前，真是轻松愉快啊！ | U1445: 0 | V1445: 0,0; | W1445: 1
A1446: 20117 | B1446: 喽啰 | C1446: partner_1009 | D1446: 0 | E1446: 0 | F1446: 1112,100;1116,100;1111,100; | G1446: 5103,100;5209,100;5101,100; | H1446: 130+26*LV*0.6 | I1446: 45+10.5*LV*0.6 | J1446: 32+9*LV*0.6 | K1446: 24+5*LV*0.6 | L1446: 13+3*LV*0.6 | M1446: 100000 | N1446: 0 | O1446: math.max(0,(lv/10)-1) | P1446: math.max(0,(lv/10)-1) | Q1446: math.max(0,(lv/10)-1) | R1446: 0; | S1446: 有药王谷和盘丝洞的弟子在，真是不爽，还是跑路算了！ | T1446: 药王谷和盘丝洞的弟子不在眼前，真是轻松愉快啊！ | U1446: 0 | V1446: 0,0; | W1446: 1
A1447: 20118 | B1447: 喽啰 | C1447: partner_1002 | D1447: 0 | E1447: 0 | F1447: 1112,100;1116,100;1111,100; | G1447: 5103,100;5209,100;5101,100; | H1447: 130+26*LV*0.6 | I1447: 45+10.5*LV*0.6 | J1447: 32+9*LV*0.6 | K1447: 24+5*LV*0.6 | L1447: 13+3*LV*0.6 | M1447: 100000 | N1447: 0 | O1447: math.max(0,(lv/10)-1) | P1447: math.max(0,(lv/10)-1) | Q1447: math.max(0,(lv/10)-1) | R1447: 0; | S1447: 有药王谷和盘丝洞的弟子在，真是不爽，还是跑路算了！ | T1447: 药王谷和盘丝洞的弟子不在眼前，真是轻松愉快啊！ | U1447: 0 | V1447: 0,0; | W1447: 1
A1448: 20119 | B1448: 喽啰 | C1448: pet_23 | D1448: 0 | E1448: 0 | F1448: 1112,100;1116,100;1111,100; | G1448: 5103,100;5209,100;5101,100; | H1448: 130+26*LV*0.6 | I1448: 45+10.5*LV*0.6 | J1448: 32+9*LV*0.6 | K1448: 24+5*LV*0.6 | L1448: 13+3*LV*0.6 | M1448: 100000 | N1448: 0 | O1448: math.max(0,(lv/10)-1) | P1448: math.max(0,(lv/10)-1) | Q1448: math.max(0,(lv/10)-1) | R1448: 0; | S1448: 有药王谷和盘丝洞的弟子在，真是不爽，还是跑路算了！ | T1448: 药王谷和盘丝洞的弟子不在眼前，真是轻松愉快啊！ | U1448: 0 | V1448: 0,0; | W1448: 1
A1449: 20120 | B1449: 喽啰 | C1449: pet_23 | D1449: 0 | E1449: 0 | F1449: 1112,100;1116,100;1111,100; | G1449: 5103,100;5209,100;5101,100; | H1449: 130+26*LV*0.6 | I1449: 45+10.5*LV*0.6 | J1449: 32+9*LV*0.6 | K1449: 24+5*LV*0.6 | L1449: 13+3*LV*0.6 | M1449: 100000 | N1449: 0 | O1449: math.max(0,(lv/10)-1) | P1449: math.max(0,(lv/10)-1) | Q1449: math.max(0,(lv/10)-1) | R1449: 0; | S1449: 有药王谷和盘丝洞的弟子在，真是不爽，还是跑路算了！ | T1449: 药王谷和盘丝洞的弟子不在眼前，真是轻松愉快啊！ | U1449: 0 | V1449: 0,0; | W1449: 1
A1450: 20121 | B1450: 喽啰 | C1450: pet_61 | D1450: 0 | E1450: 0 | F1450: 1112,100;1116,100;1111,100; | G1450: 5103,100;5209,100;5101,100; | H1450: 130+26*LV*0.6 | I1450: 45+10.5*LV*0.6 | J1450: 32+9*LV*0.6 | K1450: 24+5*LV*0.6 | L1450: 13+3*LV*0.6 | M1450: 100000 | N1450: 0 | O1450: math.max(0,(lv/10)-1) | P1450: math.max(0,(lv/10)-1) | Q1450: math.max(0,(lv/10)-1) | R1450: 0; | S1450: 有药王谷和盘丝洞的弟子在，真是不爽，还是跑路算了！ | T1450: 药王谷和盘丝洞的弟子不在眼前，真是轻松愉快啊！ | U1450: 0 | V1450: 0,0; | W1450: 1
A1451: 20122 | B1451: 喽啰 | C1451: pet_63 | D1451: 0 | E1451: 0 | F1451: 1112,100;1116,100;1111,100; | G1451: 5103,100;5209,100;5101,100; | H1451: 130+26*LV*0.6 | I1451: 45+10.5*LV*0.6 | J1451: 32+9*LV*0.6 | K1451: 24+5*LV*0.6 | L1451: 13+3*LV*0.6 | M1451: 100000 | N1451: 0 | O1451: math.max(0,(lv/10)-1) | P1451: math.max(0,(lv/10)-1) | Q1451: math.max(0,(lv/10)-1) | R1451: 0; | S1451: 有药王谷和盘丝洞的弟子在，真是不爽，还是跑路算了！ | T1451: 药王谷和盘丝洞的弟子不在眼前，真是轻松愉快啊！ | U1451: 0 | V1451: 0,0; | W1451: 1
A1452: 20123 | B1452: 喽啰 | C1452: hero_1001 | D1452: 0 | E1452: 0 | F1452: 1112,100;1116,100;1111,100; | G1452: 5103,100;5209,100;5101,100; | H1452: 130+26*LV*0.6 | I1452: 45+10.5*LV*0.6 | J1452: 32+9*LV*0.6 | K1452: 24+5*LV*0.6 | L1452: 13+3*LV*0.6 | M1452: 100000 | N1452: 0 | O1452: math.max(0,(lv/10)-1) | P1452: math.max(0,(lv/10)-1) | Q1452: math.max(0,(lv/10)-1) | R1452: 0; | S1452: 有药王谷和盘丝洞的弟子在，真是不爽，还是跑路算了！ | T1452: 药王谷和盘丝洞的弟子不在眼前，真是轻松愉快啊！ | U1452: 0 | V1452: 0,0; | W1452: 1
A1453: 20124 | B1453: 喽啰 | C1453: pet_22 | D1453: 0 | E1453: 0 | F1453: 1112,100;1116,100;1111,100; | G1453: 5103,100;5209,100;5101,100; | H1453: 130+26*LV*0.6 | I1453: 45+10.5*LV*0.6 | J1453: 32+9*LV*0.6 | K1453: 24+5*LV*0.6 | L1453: 13+3*LV*0.6 | M1453: 100000 | N1453: 0 | O1453: math.max(0,(lv/10)-1) | P1453: math.max(0,(lv/10)-1) | Q1453: math.max(0,(lv/10)-1) | R1453: 0; | S1453: 有药王谷和盘丝洞的弟子在，真是不爽，还是跑路算了！ | T1453: 药王谷和盘丝洞的弟子不在眼前，真是轻松愉快啊！ | U1453: 0 | V1453: 0,0; | W1453: 1
A1454: 20125 | B1454: 喽啰 | C1454: pet_62 | D1454: 0 | E1454: 0 | F1454: 1112,100;1116,100;1111,100; | G1454: 5103,100;5209,100;5101,100; | H1454: 130+26*LV*0.6 | I1454: 45+10.5*LV*0.6 | J1454: 32+9*LV*0.6 | K1454: 24+5*LV*0.6 | L1454: 13+3*LV*0.6 | M1454: 100000 | N1454: 0 | O1454: math.max(0,(lv/10)-1) | P1454: math.max(0,(lv/10)-1) | Q1454: math.max(0,(lv/10)-1) | R1454: 0; | S1454: 有药王谷和盘丝洞的弟子在，真是不爽，还是跑路算了！ | T1454: 药王谷和盘丝洞的弟子不在眼前，真是轻松愉快啊！ | U1454: 0 | V1454: 0,0; | W1454: 1
A1455: 20126 | B1455: 喽啰 | C1455: pet_21 | D1455: 0 | E1455: 0 | F1455: 1112,100;1116,100;1111,100; | G1455: 5103,100;5209,100;5101,100; | H1455: 130+26*LV*0.6 | I1455: 45+10.5*LV*0.6 | J1455: 32+9*LV*0.6 | K1455: 24+5*LV*0.6 | L1455: 13+3*LV*0.6 | M1455: 100000 | N1455: 0 | O1455: math.max(0,(lv/10)-1) | P1455: math.max(0,(lv/10)-1) | Q1455: math.max(0,(lv/10)-1) | R1455: 0; | S1455: 有药王谷和盘丝洞的弟子在，真是不爽，还是跑路算了！ | T1455: 药王谷和盘丝洞的弟子不在眼前，真是轻松愉快啊！ | U1455: 0 | V1455: 0,0; | W1455: 1
A1456: 20127 | B1456: 喽啰 | C1456: pet_21 | D1456: 0 | E1456: 0 | F1456: 1112,100;1116,100;1111,100; | G1456: 5103,100;5209,100;5101,100; | H1456: 130+26*LV*0.6 | I1456: 45+10.5*LV*0.6 | J1456: 32+9*LV*0.6 | K1456: 24+5*LV*0.6 | L1456: 13+3*LV*0.6 | M1456: 100000 | N1456: 0 | O1456: math.max(0,(lv/10)-1) | P1456: math.max(0,(lv/10)-1) | Q1456: math.max(0,(lv/10)-1) | R1456: 0; | S1456: 有药王谷和盘丝洞的弟子在，真是不爽，还是跑路算了！ | T1456: 药王谷和盘丝洞的弟子不在眼前，真是轻松愉快啊！ | U1456: 0 | V1456: 0,0; | W1456: 1
A1457: 20128 | B1457: 喽啰 | C1457: pet_81 | D1457: 0 | E1457: 0 | F1457: 1112,100;1116,100;1111,100; | G1457: 5103,100;5209,100;5101,100; | H1457: 130+26*LV*0.6 | I1457: 45+10.5*LV*0.6 | J1457: 32+9*LV*0.6 | K1457: 24+5*LV*0.6 | L1457: 13+3*LV*0.6 | M1457: 100000 | N1457: 0 | O1457: math.max(0,(lv/10)-1) | P1457: math.max(0,(lv/10)-1) | Q1457: math.max(0,(lv/10)-1) | R1457: 0; | S1457: 有药王谷和盘丝洞的弟子在，真是不爽，还是跑路算了！ | T1457: 药王谷和盘丝洞的弟子不在眼前，真是轻松愉快啊！ | U1457: 0 | V1457: 0,0; | W1457: 1
A1458: 20129 | B1458: 喽啰 | C1458: pet_53 | D1458: 0 | E1458: 0 | F1458: 1112,100;1116,100;1111,100; | G1458: 5103,100;5209,100;5101,100; | H1458: 130+26*LV*0.6 | I1458: 45+10.5*LV*0.6 | J1458: 32+9*LV*0.6 | K1458: 24+5*LV*0.6 | L1458: 13+3*LV*0.6 | M1458: 100000 | N1458: 0 | O1458: math.max(0,(lv/10)-1) | P1458: math.max(0,(lv/10)-1) | Q1458: math.max(0,(lv/10)-1) | R1458: 0; | S1458: 有药王谷和盘丝洞的弟子在，真是不爽，还是跑路算了！ | T1458: 药王谷和盘丝洞的弟子不在眼前，真是轻松愉快啊！ | U1458: 0 | V1458: 0,0; | W1458: 1
A1459: 20130 | B1459: 喽啰 | C1459: pet_61 | D1459: 0 | E1459: 0 | F1459: 1112,100;1116,100;1111,100; | G1459: 5103,100;5209,100;5101,100; | H1459: 130+26*LV*0.6 | I1459: 45+10.5*LV*0.6 | J1459: 32+9*LV*0.6 | K1459: 24+5*LV*0.6 | L1459: 13+3*LV*0.6 | M1459: 100000 | N1459: 0 | O1459: math.max(0,(lv/10)-1) | P1459: math.max(0,(lv/10)-1) | Q1459: math.max(0,(lv/10)-1) | R1459: 0; | S1459: 有药王谷和盘丝洞的弟子在，真是不爽，还是跑路算了！ | T1459: 药王谷和盘丝洞的弟子不在眼前，真是轻松愉快啊！ | U1459: 0 | V1459: 0,0; | W1459: 1
A1460: 20131 | B1460: 喽啰 | C1460: partner_1010 | D1460: 0 | E1460: 0 | F1460: 1112,100;1116,100;1111,100; | G1460: 5103,100;5209,100;5101,100; | H1460: 130+26*LV*0.6 | I1460: 45+10.5*LV*0.6 | J1460: 32+9*LV*0.6 | K1460: 24+5*LV*0.6 | L1460: 13+3*LV*0.6 | M1460: 100000 | N1460: 0 | O1460: math.max(0,(lv/10)-1) | P1460: math.max(0,(lv/10)-1) | Q1460: math.max(0,(lv/10)-1) | R1460: 0; | S1460: 有药王谷和盘丝洞的弟子在，真是不爽，还是跑路算了！ | T1460: 药王谷和盘丝洞的弟子不在眼前，真是轻松愉快啊！ | U1460: 0 | V1460: 0,0; | W1460: 1
A1461: 20132 | B1461: 喽啰 | C1461: pet_63 | D1461: 0 | E1461: 0 | F1461: 1112,100;1116,100;1111,100; | G1461: 5103,100;5209,100;5101,100; | H1461: 130+26*LV*0.6 | I1461: 45+10.5*LV*0.6 | J1461: 32+9*LV*0.6 | K1461: 24+5*LV*0.6 | L1461: 13+3*LV*0.6 | M1461: 100000 | N1461: 0 | O1461: math.max(0,(lv/10)-1) | P1461: math.max(0,(lv/10)-1) | Q1461: math.max(0,(lv/10)-1) | R1461: 0; | S1461: 有药王谷和盘丝洞的弟子在，真是不爽，还是跑路算了！ | T1461: 药王谷和盘丝洞的弟子不在眼前，真是轻松愉快啊！ | U1461: 0 | V1461: 0,0; | W1461: 1
A1462: 20133 | B1462: 喽啰 | C1462: hero_1001 | D1462: 0 | E1462: 0 | F1462: 1112,100;1116,100;1111,100; | G1462: 5103,100;5209,100;5101,100; | H1462: 130+26*LV*0.6 | I1462: 45+10.5*LV*0.6 | J1462: 32+9*LV*0.6 | K1462: 24+5*LV*0.6 | L1462: 13+3*LV*0.6 | M1462: 100000 | N1462: 0 | O1462: math.max(0,(lv/10)-1) | P1462: math.max(0,(lv/10)-1) | Q1462: math.max(0,(lv/10)-1) | R1462: 0; | S1462: 有药王谷和盘丝洞的弟子在，真是不爽，还是跑路算了！ | T1462: 药王谷和盘丝洞的弟子不在眼前，真是轻松愉快啊！ | U1462: 0 | V1462: 0,0; | W1462: 1
A1463: 20134 | B1463: 喽啰 | C1463: pet_22 | D1463: 0 | E1463: 0 | F1463: 1112,100;1116,100;1111,100; | G1463: 5103,100;5209,100;5101,100; | H1463: 130+26*LV*0.6 | I1463: 45+10.5*LV*0.6 | J1463: 32+9*LV*0.6 | K1463: 24+5*LV*0.6 | L1463: 13+3*LV*0.6 | M1463: 100000 | N1463: 0 | O1463: math.max(0,(lv/10)-1) | P1463: math.max(0,(lv/10)-1) | Q1463: math.max(0,(lv/10)-1) | R1463: 0; | S1463: 有药王谷和盘丝洞的弟子在，真是不爽，还是跑路算了！ | T1463: 药王谷和盘丝洞的弟子不在眼前，真是轻松愉快啊！ | U1463: 0 | V1463: 0,0; | W1463: 1
A1464: 20135 | B1464: 喽啰 | C1464: pet_21 | D1464: 0 | E1464: 0 | F1464: 1112,100;1116,100;1111,100; | G1464: 5103,100;5209,100;5101,100; | H1464: 130+26*LV*0.6 | I1464: 45+10.5*LV*0.6 | J1464: 32+9*LV*0.6 | K1464: 24+5*LV*0.6 | L1464: 13+3*LV*0.6 | M1464: 100000 | N1464: 0 | O1464: math.max(0,(lv/10)-1) | P1464: math.max(0,(lv/10)-1) | Q1464: math.max(0,(lv/10)-1) | R1464: 0; | S1464: 有药王谷和盘丝洞的弟子在，真是不爽，还是跑路算了！ | T1464: 药王谷和盘丝洞的弟子不在眼前，真是轻松愉快啊！ | U1464: 0 | V1464: 0,0; | W1464: 1
A1465: 20136 | B1465: 喽啰 | C1465: pet_61 | D1465: 0 | E1465: 0 | F1465: 1112,100;1116,100;1111,100; | G1465: 5103,100;5209,100;5101,100; | H1465: 130+26*LV*0.6 | I1465: 45+10.5*LV*0.6 | J1465: 32+9*LV*0.6 | K1465: 24+5*LV*0.6 | L1465: 13+3*LV*0.6 | M1465: 100000 | N1465: 0 | O1465: math.max(0,(lv/10)-1) | P1465: math.max(0,(lv/10)-1) | Q1465: math.max(0,(lv/10)-1) | R1465: 0; | S1465: 有药王谷和盘丝洞的弟子在，真是不爽，还是跑路算了！ | T1465: 药王谷和盘丝洞的弟子不在眼前，真是轻松愉快啊！ | U1465: 0 | V1465: 0,0; | W1465: 1
A1466: 20137 | B1466: 喽啰 | C1466: pet_23 | D1466: 0 | E1466: 0 | F1466: 1112,100;1116,100;1111,100; | G1466: 5103,100;5209,100;5101,100; | H1466: 130+26*LV*0.6 | I1466: 45+10.5*LV*0.6 | J1466: 32+9*LV*0.6 | K1466: 24+5*LV*0.6 | L1466: 13+3*LV*0.6 | M1466: 100000 | N1466: 0 | O1466: math.max(0,(lv/10)-1) | P1466: math.max(0,(lv/10)-1) | Q1466: math.max(0,(lv/10)-1) | R1466: 0; | S1466: 有药王谷和盘丝洞的弟子在，真是不爽，还是跑路算了！ | T1466: 药王谷和盘丝洞的弟子不在眼前，真是轻松愉快啊！ | U1466: 0 | V1466: 0,0; | W1466: 1
A1467: 20138 | B1467: 喽啰 | C1467: pet_63 | D1467: 0 | E1467: 0 | F1467: 1112,100;1116,100;1111,100; | G1467: 5103,100;5209,100;5101,100; | H1467: 130+26*LV*0.6 | I1467: 45+10.5*LV*0.6 | J1467: 32+9*LV*0.6 | K1467: 24+5*LV*0.6 | L1467: 13+3*LV*0.6 | M1467: 100000 | N1467: 0 | O1467: math.max(0,(lv/10)-1) | P1467: math.max(0,(lv/10)-1) | Q1467: math.max(0,(lv/10)-1) | R1467: 0; | S1467: 有药王谷和盘丝洞的弟子在，真是不爽，还是跑路算了！ | T1467: 药王谷和盘丝洞的弟子不在眼前，真是轻松愉快啊！ | U1467: 0 | V1467: 0,0; | W1467: 1
A1468: 20139 | B1468: 喽啰 | C1468: partner_1009 | D1468: 0 | E1468: 0 | F1468: 1112,100;1116,100;1111,100; | G1468: 5103,100;5209,100;5101,100; | H1468: 130+26*LV*0.6 | I1468: 45+10.5*LV*0.6 | J1468: 32+9*LV*0.6 | K1468: 24+5*LV*0.6 | L1468: 13+3*LV*0.6 | M1468: 100000 | N1468: 0 | O1468: math.max(0,(lv/10)-1) | P1468: math.max(0,(lv/10)-1) | Q1468: math.max(0,(lv/10)-1) | R1468: 0; | S1468: 有药王谷和盘丝洞的弟子在，真是不爽，还是跑路算了！ | T1468: 药王谷和盘丝洞的弟子不在眼前，真是轻松愉快啊！ | U1468: 0 | V1468: 0,0; | W1468: 1
A1469: 20140 | B1469: 喽啰 | C1469: pet_62 | D1469: 0 | E1469: 0 | F1469: 1112,100;1116,100;1111,100; | G1469: 5103,100;5209,100;5101,100; | H1469: 130+26*LV*0.6 | I1469: 45+10.5*LV*0.6 | J1469: 32+9*LV*0.6 | K1469: 24+5*LV*0.6 | L1469: 13+3*LV*0.6 | M1469: 100000 | N1469: 0 | O1469: math.max(0,(lv/10)-1) | P1469: math.max(0,(lv/10)-1) | Q1469: math.max(0,(lv/10)-1) | R1469: 0; | S1469: 有药王谷和盘丝洞的弟子在，真是不爽，还是跑路算了！ | T1469: 药王谷和盘丝洞的弟子不在眼前，真是轻松愉快啊！ | U1469: 0 | V1469: 0,0; | W1469: 1
A1470: 20141 | B1470: 喽啰 | C1470: pet_73 | D1470: 0 | E1470: 0 | F1470: 1112,100;1116,100;1111,100; | G1470: 5103,100;5209,100;5101,100; | H1470: 130+26*LV*0.6 | I1470: 45+10.5*LV*0.6 | J1470: 32+9*LV*0.6 | K1470: 24+5*LV*0.6 | L1470: 13+3*LV*0.6 | M1470: 100000 | N1470: 0 | O1470: math.max(0,(lv/10)-1) | P1470: math.max(0,(lv/10)-1) | Q1470: math.max(0,(lv/10)-1) | R1470: 0; | S1470: 有药王谷和盘丝洞的弟子在，真是不爽，还是跑路算了！ | T1470: 药王谷和盘丝洞的弟子不在眼前，真是轻松愉快啊！ | U1470: 0 | V1470: 0,0; | W1470: 1
A1471: 20142 | B1471: 喽啰 | C1471: pet_21 | D1471: 0 | E1471: 0 | F1471: 1112,100;1116,100;1111,100; | G1471: 5103,100;5209,100;5101,100; | H1471: 130+26*LV*0.6 | I1471: 45+10.5*LV*0.6 | J1471: 32+9*LV*0.6 | K1471: 24+5*LV*0.6 | L1471: 13+3*LV*0.6 | M1471: 100000 | N1471: 0 | O1471: math.max(0,(lv/10)-1) | P1471: math.max(0,(lv/10)-1) | Q1471: math.max(0,(lv/10)-1) | R1471: 0; | S1471: 有药王谷和盘丝洞的弟子在，真是不爽，还是跑路算了！ | T1471: 药王谷和盘丝洞的弟子不在眼前，真是轻松愉快啊！ | U1471: 0 | V1471: 0,0; | W1471: 1
A1472: 20143 | B1472: 喽啰 | C1472: pet_62 | D1472: 0 | E1472: 0 | F1472: 1112,100;1116,100;1111,100; | G1472: 5103,100;5209,100;5101,100; | H1472: 130+26*LV*0.6 | I1472: 45+10.5*LV*0.6 | J1472: 32+9*LV*0.6 | K1472: 24+5*LV*0.6 | L1472: 13+3*LV*0.6 | M1472: 100000 | N1472: 0 | O1472: math.max(0,(lv/10)-1) | P1472: math.max(0,(lv/10)-1) | Q1472: math.max(0,(lv/10)-1) | R1472: 0; | S1472: 有药王谷和盘丝洞的弟子在，真是不爽，还是跑路算了！ | T1472: 药王谷和盘丝洞的弟子不在眼前，真是轻松愉快啊！ | U1472: 0 | V1472: 0,0; | W1472: 1
A1473: 20144 | B1473: 喽啰 | C1473: pet_63 | D1473: 0 | E1473: 0 | F1473: 1112,100;1116,100;1111,100; | G1473: 5103,100;5209,100;5101,100; | H1473: 130+26*LV*0.6 | I1473: 45+10.5*LV*0.6 | J1473: 32+9*LV*0.6 | K1473: 24+5*LV*0.6 | L1473: 13+3*LV*0.6 | M1473: 100000 | N1473: 0 | O1473: math.max(0,(lv/10)-1) | P1473: math.max(0,(lv/10)-1) | Q1473: math.max(0,(lv/10)-1) | R1473: 0; | S1473: 有药王谷和盘丝洞的弟子在，真是不爽，还是跑路算了！ | T1473: 药王谷和盘丝洞的弟子不在眼前，真是轻松愉快啊！ | U1473: 0 | V1473: 0,0; | W1473: 1
A1474: 20145 | B1474: 喽啰 | C1474: hero_1001 | D1474: 0 | E1474: 0 | F1474: 1112,100;1116,100;1111,100; | G1474: 5103,100;5209,100;5101,100; | H1474: 130+26*LV*0.6 | I1474: 45+10.5*LV*0.6 | J1474: 32+9*LV*0.6 | K1474: 24+5*LV*0.6 | L1474: 13+3*LV*0.6 | M1474: 100000 | N1474: 0 | O1474: math.max(0,(lv/10)-1) | P1474: math.max(0,(lv/10)-1) | Q1474: math.max(0,(lv/10)-1) | R1474: 0; | S1474: 有药王谷和盘丝洞的弟子在，真是不爽，还是跑路算了！ | T1474: 药王谷和盘丝洞的弟子不在眼前，真是轻松愉快啊！ | U1474: 0 | V1474: 0,0; | W1474: 1
A1475: 20146 | B1475: 喽啰 | C1475: pet_62 | D1475: 0 | E1475: 0 | F1475: 1112,100;1116,100;1111,100; | G1475: 5103,100;5209,100;5101,100; | H1475: 130+26*LV*0.6 | I1475: 45+10.5*LV*0.6 | J1475: 32+9*LV*0.6 | K1475: 24+5*LV*0.6 | L1475: 13+3*LV*0.6 | M1475: 100000 | N1475: 0 | O1475: math.max(0,(lv/10)-1) | P1475: math.max(0,(lv/10)-1) | Q1475: math.max(0,(lv/10)-1) | R1475: 0; | S1475: 有药王谷和盘丝洞的弟子在，真是不爽，还是跑路算了！ | T1475: 药王谷和盘丝洞的弟子不在眼前，真是轻松愉快啊！ | U1475: 0 | V1475: 0,0; | W1475: 1
A1476: 20147 | B1476: 喽啰 | C1476: pet_23 | D1476: 0 | E1476: 0 | F1476: 1112,100;1116,100;1111,100; | G1476: 5103,100;5209,100;5101,100; | H1476: 130+26*LV*0.6 | I1476: 45+10.5*LV*0.6 | J1476: 32+9*LV*0.6 | K1476: 24+5*LV*0.6 | L1476: 13+3*LV*0.6 | M1476: 100000 | N1476: 0 | O1476: math.max(0,(lv/10)-1) | P1476: math.max(0,(lv/10)-1) | Q1476: math.max(0,(lv/10)-1) | R1476: 0; | S1476: 有药王谷和盘丝洞的弟子在，真是不爽，还是跑路算了！ | T1476: 药王谷和盘丝洞的弟子不在眼前，真是轻松愉快啊！ | U1476: 0 | V1476: 0,0; | W1476: 1
A1477: 20148 | B1477: 喽啰 | C1477: pet_61 | D1477: 0 | E1477: 0 | F1477: 1112,100;1116,100;1111,100; | G1477: 5103,100;5209,100;5101,100; | H1477: 130+26*LV*0.6 | I1477: 45+10.5*LV*0.6 | J1477: 32+9*LV*0.6 | K1477: 24+5*LV*0.6 | L1477: 13+3*LV*0.6 | M1477: 100000 | N1477: 0 | O1477: math.max(0,(lv/10)-1) | P1477: math.max(0,(lv/10)-1) | Q1477: math.max(0,(lv/10)-1) | R1477: 0; | S1477: 有药王谷和盘丝洞的弟子在，真是不爽，还是跑路算了！ | T1477: 药王谷和盘丝洞的弟子不在眼前，真是轻松愉快啊！ | U1477: 0 | V1477: 0,0; | W1477: 1
A1478: 20149 | B1478: 喽啰 | C1478: pet_62 | D1478: 0 | E1478: 0 | F1478: 1112,100;1116,100;1111,100; | G1478: 5103,100;5209,100;5101,100; | H1478: 130+26*LV*0.6 | I1478: 45+10.5*LV*0.6 | J1478: 32+9*LV*0.6 | K1478: 24+5*LV*0.6 | L1478: 13+3*LV*0.6 | M1478: 100000 | N1478: 0 | O1478: math.max(0,(lv/10)-1) | P1478: math.max(0,(lv/10)-1) | Q1478: math.max(0,(lv/10)-1) | R1478: 0; | S1478: 有药王谷和盘丝洞的弟子在，真是不爽，还是跑路算了！ | T1478: 药王谷和盘丝洞的弟子不在眼前，真是轻松愉快啊！ | U1478: 0 | V1478: 0,0; | W1478: 1
A1479: 20150 | B1479: 喽啰 | C1479: pet_53 | D1479: 0 | E1479: 0 | F1479: 1112,100;1116,100;1111,100; | G1479: 5103,100;5209,100;5101,100; | H1479: 130+26*LV*0.6 | I1479: 45+10.5*LV*0.6 | J1479: 32+9*LV*0.6 | K1479: 24+5*LV*0.6 | L1479: 13+3*LV*0.6 | M1479: 100000 | N1479: 0 | O1479: math.max(0,(lv/10)-1) | P1479: math.max(0,(lv/10)-1) | Q1479: math.max(0,(lv/10)-1) | R1479: 0; | S1479: 有药王谷和盘丝洞的弟子在，真是不爽，还是跑路算了！ | T1479: 药王谷和盘丝洞的弟子不在眼前，真是轻松愉快啊！ | U1479: 0 | V1479: 0,0; | W1479: 1
A1480: 20151 | B1480: 喽啰 | C1480: pet_23 | D1480: 0 | E1480: 0 | F1480: 1112,100;1116,100;1111,100; | G1480: 5103,100;5209,100;5101,100; | H1480: 130+26*LV*0.6 | I1480: 45+10.5*LV*0.6 | J1480: 32+9*LV*0.6 | K1480: 24+5*LV*0.6 | L1480: 13+3*LV*0.6 | M1480: 100000 | N1480: 0 | O1480: math.max(0,(lv/10)-1) | P1480: math.max(0,(lv/10)-1) | Q1480: math.max(0,(lv/10)-1) | R1480: 0; | S1480: 有药王谷和盘丝洞的弟子在，真是不爽，还是跑路算了！ | T1480: 药王谷和盘丝洞的弟子不在眼前，真是轻松愉快啊！ | U1480: 0 | V1480: 0,0; | W1480: 1
A1481: 20152 | B1481: 喽啰 | C1481: partner_1009 | D1481: 0 | E1481: 0 | F1481: 1112,100;1116,100;1111,100; | G1481: 5103,100;5209,100;5101,100; | H1481: 130+26*LV*0.6 | I1481: 45+10.5*LV*0.6 | J1481: 32+9*LV*0.6 | K1481: 24+5*LV*0.6 | L1481: 13+3*LV*0.6 | M1481: 100000 | N1481: 0 | O1481: math.max(0,(lv/10)-1) | P1481: math.max(0,(lv/10)-1) | Q1481: math.max(0,(lv/10)-1) | R1481: 0; | S1481: 有药王谷和盘丝洞的弟子在，真是不爽，还是跑路算了！ | T1481: 药王谷和盘丝洞的弟子不在眼前，真是轻松愉快啊！ | U1481: 0 | V1481: 0,0; | W1481: 1
A1482: 20153 | B1482: 喽啰 | C1482: pet_21 | D1482: 0 | E1482: 0 | F1482: 1112,100;1116,100;1111,100; | G1482: 5103,100;5209,100;5101,100; | H1482: 130+26*LV*0.6 | I1482: 45+10.5*LV*0.6 | J1482: 32+9*LV*0.6 | K1482: 24+5*LV*0.6 | L1482: 13+3*LV*0.6 | M1482: 100000 | N1482: 0 | O1482: math.max(0,(lv/10)-1) | P1482: math.max(0,(lv/10)-1) | Q1482: math.max(0,(lv/10)-1) | R1482: 0; | S1482: 有药王谷和盘丝洞的弟子在，真是不爽，还是跑路算了！ | T1482: 药王谷和盘丝洞的弟子不在眼前，真是轻松愉快啊！ | U1482: 0 | V1482: 0,0; | W1482: 1
A1483: 20154 | B1483: 喽啰 | C1483: hero_1001 | D1483: 0 | E1483: 0 | F1483: 1112,100;1116,100;1111,100; | G1483: 5103,100;5209,100;5101,100; | H1483: 130+26*LV*0.6 | I1483: 45+10.5*LV*0.6 | J1483: 32+9*LV*0.6 | K1483: 24+5*LV*0.6 | L1483: 13+3*LV*0.6 | M1483: 100000 | N1483: 0 | O1483: math.max(0,(lv/10)-1) | P1483: math.max(0,(lv/10)-1) | Q1483: math.max(0,(lv/10)-1) | R1483: 0; | S1483: 有药王谷和盘丝洞的弟子在，真是不爽，还是跑路算了！ | T1483: 药王谷和盘丝洞的弟子不在眼前，真是轻松愉快啊！ | U1483: 0 | V1483: 0,0; | W1483: 1
A1484: 20155 | B1484: 喽啰 | C1484: pet_33 | D1484: 0 | E1484: 0 | F1484: 1112,100;1116,100;1111,100; | G1484: 5103,100;5209,100;5101,100; | H1484: 130+26*LV*0.6 | I1484: 45+10.5*LV*0.6 | J1484: 32+9*LV*0.6 | K1484: 24+5*LV*0.6 | L1484: 13+3*LV*0.6 | M1484: 100000 | N1484: 0 | O1484: math.max(0,(lv/10)-1) | P1484: math.max(0,(lv/10)-1) | Q1484: math.max(0,(lv/10)-1) | R1484: 0; | S1484: 有药王谷和盘丝洞的弟子在，真是不爽，还是跑路算了！ | T1484: 药王谷和盘丝洞的弟子不在眼前，真是轻松愉快啊！ | U1484: 0 | V1484: 0,0; | W1484: 1
A1485: 20156 | B1485: 喽啰 | C1485: pet_23 | D1485: 0 | E1485: 0 | F1485: 1112,100;1116,100;1111,100; | G1485: 5103,100;5209,100;5101,100; | H1485: 130+26*LV*0.6 | I1485: 45+10.5*LV*0.6 | J1485: 32+9*LV*0.6 | K1485: 24+5*LV*0.6 | L1485: 13+3*LV*0.6 | M1485: 100000 | N1485: 0 | O1485: math.max(0,(lv/10)-1) | P1485: math.max(0,(lv/10)-1) | Q1485: math.max(0,(lv/10)-1) | R1485: 0; | S1485: 有药王谷和盘丝洞的弟子在，真是不爽，还是跑路算了！ | T1485: 药王谷和盘丝洞的弟子不在眼前，真是轻松愉快啊！ | U1485: 0 | V1485: 0,0; | W1485: 1
A1486: 20157 | B1486: 喽啰 | C1486: hero_1001 | D1486: 0 | E1486: 0 | F1486: 1112,100;1116,100;1111,100; | G1486: 5103,100;5209,100;5101,100; | H1486: 130+26*LV*0.6 | I1486: 45+10.5*LV*0.6 | J1486: 32+9*LV*0.6 | K1486: 24+5*LV*0.6 | L1486: 13+3*LV*0.6 | M1486: 100000 | N1486: 0 | O1486: math.max(0,(lv/10)-1) | P1486: math.max(0,(lv/10)-1) | Q1486: math.max(0,(lv/10)-1) | R1486: 0; | S1486: 有药王谷和盘丝洞的弟子在，真是不爽，还是跑路算了！ | T1486: 药王谷和盘丝洞的弟子不在眼前，真是轻松愉快啊！ | U1486: 0 | V1486: 0,0; | W1486: 1
A1487: 20158 | B1487: 喽啰 | C1487: partner_1003 | D1487: 0 | E1487: 0 | F1487: 1112,100;1116,100;1111,100; | G1487: 5103,100;5209,100;5101,100; | H1487: 130+26*LV*0.6 | I1487: 45+10.5*LV*0.6 | J1487: 32+9*LV*0.6 | K1487: 24+5*LV*0.6 | L1487: 13+3*LV*0.6 | M1487: 100000 | N1487: 0 | O1487: math.max(0,(lv/10)-1) | P1487: math.max(0,(lv/10)-1) | Q1487: math.max(0,(lv/10)-1) | R1487: 0; | S1487: 有药王谷和盘丝洞的弟子在，真是不爽，还是跑路算了！ | T1487: 药王谷和盘丝洞的弟子不在眼前，真是轻松愉快啊！ | U1487: 0 | V1487: 0,0; | W1487: 1
A1488: 20159 | B1488: 喽啰 | C1488: pet_1 | D1488: 0 | E1488: 0 | F1488: 1112,100;1116,100;1111,100; | G1488: 5103,100;5209,100;5101,100; | H1488: 130+26*LV*0.6 | I1488: 45+10.5*LV*0.6 | J1488: 32+9*LV*0.6 | K1488: 24+5*LV*0.6 | L1488: 13+3*LV*0.6 | M1488: 100000 | N1488: 0 | O1488: math.max(0,(lv/10)-1) | P1488: math.max(0,(lv/10)-1) | Q1488: math.max(0,(lv/10)-1) | R1488: 0; | S1488: 有药王谷和盘丝洞的弟子在，真是不爽，还是跑路算了！ | T1488: 药王谷和盘丝洞的弟子不在眼前，真是轻松愉快啊！ | U1488: 0 | V1488: 0,0; | W1488: 1
A1489: 20160 | B1489: 喽啰 | C1489: pet_63 | D1489: 0 | E1489: 0 | F1489: 1112,100;1116,100;1111,100; | G1489: 5103,100;5209,100;5101,100; | H1489: 130+26*LV*0.6 | I1489: 45+10.5*LV*0.6 | J1489: 32+9*LV*0.6 | K1489: 24+5*LV*0.6 | L1489: 13+3*LV*0.6 | M1489: 100000 | N1489: 0 | O1489: math.max(0,(lv/10)-1) | P1489: math.max(0,(lv/10)-1) | Q1489: math.max(0,(lv/10)-1) | R1489: 0; | S1489: 有药王谷和盘丝洞的弟子在，真是不爽，还是跑路算了！ | T1489: 药王谷和盘丝洞的弟子不在眼前，真是轻松愉快啊！ | U1489: 0 | V1489: 0,0; | W1489: 1
A1490: 20161 | B1490: 喽啰 | C1490: pet_62 | D1490: 0 | E1490: 0 | F1490: 1112,100;1116,100;1111,100; | G1490: 5103,100;5209,100;5101,100; | H1490: 130+26*LV*0.6 | I1490: 45+10.5*LV*0.6 | J1490: 32+9*LV*0.6 | K1490: 24+5*LV*0.6 | L1490: 13+3*LV*0.6 | M1490: 100000 | N1490: 0 | O1490: math.max(0,(lv/10)-1) | P1490: math.max(0,(lv/10)-1) | Q1490: math.max(0,(lv/10)-1) | R1490: 0; | S1490: 有药王谷和盘丝洞的弟子在，真是不爽，还是跑路算了！ | T1490: 药王谷和盘丝洞的弟子不在眼前，真是轻松愉快啊！ | U1490: 0 | V1490: 0,0; | W1490: 1
A1491: 20162 | B1491: 喽啰 | C1491: pet_93 | D1491: 0 | E1491: 0 | F1491: 1112,100;1116,100;1111,100; | G1491: 5103,100;5209,100;5101,100; | H1491: 130+26*LV*0.6 | I1491: 45+10.5*LV*0.6 | J1491: 32+9*LV*0.6 | K1491: 24+5*LV*0.6 | L1491: 13+3*LV*0.6 | M1491: 100000 | N1491: 0 | O1491: math.max(0,(lv/10)-1) | P1491: math.max(0,(lv/10)-1) | Q1491: math.max(0,(lv/10)-1) | R1491: 0; | S1491: 有药王谷和盘丝洞的弟子在，真是不爽，还是跑路算了！ | T1491: 药王谷和盘丝洞的弟子不在眼前，真是轻松愉快啊！ | U1491: 0 | V1491: 0,0; | W1491: 1
A1492: 20163 | B1492: 喽啰 | C1492: pet_73 | D1492: 0 | E1492: 0 | F1492: 1112,100;1116,100;1111,100; | G1492: 5103,100;5209,100;5101,100; | H1492: 130+26*LV*0.6 | I1492: 45+10.5*LV*0.6 | J1492: 32+9*LV*0.6 | K1492: 24+5*LV*0.6 | L1492: 13+3*LV*0.6 | M1492: 100000 | N1492: 0 | O1492: math.max(0,(lv/10)-1) | P1492: math.max(0,(lv/10)-1) | Q1492: math.max(0,(lv/10)-1) | R1492: 0; | S1492: 有药王谷和盘丝洞的弟子在，真是不爽，还是跑路算了！ | T1492: 药王谷和盘丝洞的弟子不在眼前，真是轻松愉快啊！ | U1492: 0 | V1492: 0,0; | W1492: 1
A1493: 20164 | B1493: 喽啰 | C1493: pet_83 | D1493: 0 | E1493: 0 | F1493: 1112,100;1116,100;1111,100; | G1493: 5103,100;5209,100;5101,100; | H1493: 130+26*LV*0.6 | I1493: 45+10.5*LV*0.6 | J1493: 32+9*LV*0.6 | K1493: 24+5*LV*0.6 | L1493: 13+3*LV*0.6 | M1493: 100000 | N1493: 0 | O1493: math.max(0,(lv/10)-1) | P1493: math.max(0,(lv/10)-1) | Q1493: math.max(0,(lv/10)-1) | R1493: 0; | S1493: 有药王谷和盘丝洞的弟子在，真是不爽，还是跑路算了！ | T1493: 药王谷和盘丝洞的弟子不在眼前，真是轻松愉快啊！ | U1493: 0 | V1493: 0,0; | W1493: 1
A1494: 20165 | B1494: 喽啰 | C1494: pet_22 | D1494: 0 | E1494: 0 | F1494: 1112,100;1116,100;1111,100; | G1494: 5103,100;5209,100;5101,100; | H1494: 130+26*LV*0.6 | I1494: 45+10.5*LV*0.6 | J1494: 32+9*LV*0.6 | K1494: 24+5*LV*0.6 | L1494: 13+3*LV*0.6 | M1494: 100000 | N1494: 0 | O1494: math.max(0,(lv/10)-1) | P1494: math.max(0,(lv/10)-1) | Q1494: math.max(0,(lv/10)-1) | R1494: 0; | S1494: 有药王谷和盘丝洞的弟子在，真是不爽，还是跑路算了！ | T1494: 药王谷和盘丝洞的弟子不在眼前，真是轻松愉快啊！ | U1494: 0 | V1494: 0,0; | W1494: 1
A1495: 20166 | B1495: 喽啰 | C1495: pet_201 | D1495: 0 | E1495: 0 | F1495: 1112,100;1116,100;1111,100; | G1495: 5103,100;5209,100;5101,100; | H1495: 130+26*LV*0.6 | I1495: 45+10.5*LV*0.6 | J1495: 32+9*LV*0.6 | K1495: 24+5*LV*0.6 | L1495: 13+3*LV*0.6 | M1495: 100000 | N1495: 0 | O1495: math.max(0,(lv/10)-1) | P1495: math.max(0,(lv/10)-1) | Q1495: math.max(0,(lv/10)-1) | R1495: 0; | S1495: 有药王谷和盘丝洞的弟子在，真是不爽，还是跑路算了！ | T1495: 药王谷和盘丝洞的弟子不在眼前，真是轻松愉快啊！ | U1495: 0 | V1495: 0,0; | W1495: 1
A1496: 20167 | B1496: 喽啰 | C1496: pet_22 | D1496: 0 | E1496: 0 | F1496: 1112,100;1116,100;1111,100; | G1496: 5103,100;5209,100;5101,100; | H1496: 130+26*LV*0.6 | I1496: 45+10.5*LV*0.6 | J1496: 32+9*LV*0.6 | K1496: 24+5*LV*0.6 | L1496: 13+3*LV*0.6 | M1496: 100000 | N1496: 0 | O1496: math.max(0,(lv/10)-1) | P1496: math.max(0,(lv/10)-1) | Q1496: math.max(0,(lv/10)-1) | R1496: 0; | S1496: 有药王谷和盘丝洞的弟子在，真是不爽，还是跑路算了！ | T1496: 药王谷和盘丝洞的弟子不在眼前，真是轻松愉快啊！ | U1496: 0 | V1496: 0,0; | W1496: 1
A1497: 20168 | B1497: 喽啰 | C1497: pet_62 | D1497: 0 | E1497: 0 | F1497: 1112,100;1116,100;1111,100; | G1497: 5103,100;5209,100;5101,100; | H1497: 130+26*LV*0.6 | I1497: 45+10.5*LV*0.6 | J1497: 32+9*LV*0.6 | K1497: 24+5*LV*0.6 | L1497: 13+3*LV*0.6 | M1497: 100000 | N1497: 0 | O1497: math.max(0,(lv/10)-1) | P1497: math.max(0,(lv/10)-1) | Q1497: math.max(0,(lv/10)-1) | R1497: 0; | S1497: 有药王谷和盘丝洞的弟子在，真是不爽，还是跑路算了！ | T1497: 药王谷和盘丝洞的弟子不在眼前，真是轻松愉快啊！ | U1497: 0 | V1497: 0,0; | W1497: 1
A1498: 20169 | B1498: 喽啰 | C1498: hero_1001 | D1498: 0 | E1498: 0 | F1498: 1112,100;1116,100;1111,100; | G1498: 5103,100;5209,100;5101,100; | H1498: 130+26*LV*0.6 | I1498: 45+10.5*LV*0.6 | J1498: 32+9*LV*0.6 | K1498: 24+5*LV*0.6 | L1498: 13+3*LV*0.6 | M1498: 100000 | N1498: 0 | O1498: math.max(0,(lv/10)-1) | P1498: math.max(0,(lv/10)-1) | Q1498: math.max(0,(lv/10)-1) | R1498: 0; | S1498: 有药王谷和盘丝洞的弟子在，真是不爽，还是跑路算了！ | T1498: 药王谷和盘丝洞的弟子不在眼前，真是轻松愉快啊！ | U1498: 0 | V1498: 0,0; | W1498: 1
A1499: 20170 | B1499: 喽啰 | C1499: hero_1001 | D1499: 0 | E1499: 0 | F1499: 1112,100;1116,100;1111,100; | G1499: 5103,100;5209,100;5101,100; | H1499: 130+26*LV*0.6 | I1499: 45+10.5*LV*0.6 | J1499: 32+9*LV*0.6 | K1499: 24+5*LV*0.6 | L1499: 13+3*LV*0.6 | M1499: 100000 | N1499: 0 | O1499: math.max(0,(lv/10)-1) | P1499: math.max(0,(lv/10)-1) | Q1499: math.max(0,(lv/10)-1) | R1499: 0; | S1499: 有药王谷和盘丝洞的弟子在，真是不爽，还是跑路算了！ | T1499: 药王谷和盘丝洞的弟子不在眼前，真是轻松愉快啊！ | U1499: 0 | V1499: 0,0; | W1499: 1
A1500: 20171 | B1500: 喽啰 | C1500: common_3018 | D1500: 0 | E1500: 0 | F1500: 1112,100;1116,100;1111,100; | G1500: 5103,100;5209,100;5101,100; | H1500: 130+26*LV*0.6 | I1500: 45+10.5*LV*0.6 | J1500: 32+9*LV*0.6 | K1500: 24+5*LV*0.6 | L1500: 13+3*LV*0.6 | M1500: 100000 | N1500: 0 | O1500: math.max(0,(lv/10)-1) | P1500: math.max(0,(lv/10)-1) | Q1500: math.max(0,(lv/10)-1) | R1500: 0; | S1500: 有药王谷和盘丝洞的弟子在，真是不爽，还是跑路算了！ | T1500: 药王谷和盘丝洞的弟子不在眼前，真是轻松愉快啊！ | U1500: 0 | V1500: 0,0; | W1500: 1
A1501: 20172 | B1501: 喽啰 | C1501: hero_1001 | D1501: 0 | E1501: 0 | F1501: 1112,100;1116,100;1111,100; | G1501: 5103,100;5209,100;5101,100; | H1501: 130+26*LV*0.6 | I1501: 45+10.5*LV*0.6 | J1501: 32+9*LV*0.6 | K1501: 24+5*LV*0.6 | L1501: 13+3*LV*0.6 | M1501: 100000 | N1501: 0 | O1501: math.max(0,(lv/10)-1) | P1501: math.max(0,(lv/10)-1) | Q1501: math.max(0,(lv/10)-1) | R1501: 0; | S1501: 有药王谷和盘丝洞的弟子在，真是不爽，还是跑路算了！ | T1501: 药王谷和盘丝洞的弟子不在眼前，真是轻松愉快啊！ | U1501: 0 | V1501: 0,0; | W1501: 1
A1502: 20173 | B1502: 喽啰 | C1502: hero_2001 | D1502: 0 | E1502: 0 | F1502: 1112,100;1116,100;1111,100; | G1502: 5103,100;5209,100;5101,100; | H1502: 130+26*LV*0.6 | I1502: 45+10.5*LV*0.6 | J1502: 32+9*LV*0.6 | K1502: 24+5*LV*0.6 | L1502: 13+3*LV*0.6 | M1502: 100000 | N1502: 0 | O1502: math.max(0,(lv/10)-1) | P1502: math.max(0,(lv/10)-1) | Q1502: math.max(0,(lv/10)-1) | R1502: 0; | S1502: 有药王谷和盘丝洞的弟子在，真是不爽，还是跑路算了！ | T1502: 药王谷和盘丝洞的弟子不在眼前，真是轻松愉快啊！ | U1502: 0 | V1502: 0,0; | W1502: 1
A1503: 20174 | B1503: 喽啰 | C1503: pet_22 | D1503: 0 | E1503: 0 | F1503: 1112,100;1116,100;1111,100; | G1503: 5103,100;5209,100;5101,100; | H1503: 130+26*LV*0.6 | I1503: 45+10.5*LV*0.6 | J1503: 32+9*LV*0.6 | K1503: 24+5*LV*0.6 | L1503: 13+3*LV*0.6 | M1503: 100000 | N1503: 0 | O1503: math.max(0,(lv/10)-1) | P1503: math.max(0,(lv/10)-1) | Q1503: math.max(0,(lv/10)-1) | R1503: 0; | S1503: 有药王谷和盘丝洞的弟子在，真是不爽，还是跑路算了！ | T1503: 药王谷和盘丝洞的弟子不在眼前，真是轻松愉快啊！ | U1503: 0 | V1503: 0,0; | W1503: 1
A1504: 20175 | B1504: 喽啰 | C1504: hero_1001 | D1504: 0 | E1504: 0 | F1504: 1112,100;1116,100;1111,100; | G1504: 5103,100;5209,100;5101,100; | H1504: 130+26*LV*0.6 | I1504: 45+10.5*LV*0.6 | J1504: 32+9*LV*0.6 | K1504: 24+5*LV*0.6 | L1504: 13+3*LV*0.6 | M1504: 100000 | N1504: 0 | O1504: math.max(0,(lv/10)-1) | P1504: math.max(0,(lv/10)-1) | Q1504: math.max(0,(lv/10)-1) | R1504: 0; | S1504: 有药王谷和盘丝洞的弟子在，真是不爽，还是跑路算了！ | T1504: 药王谷和盘丝洞的弟子不在眼前，真是轻松愉快啊！ | U1504: 0 | V1504: 0,0; | W1504: 1
A1505: 20176 | B1505: 喽啰 | C1505: pet_22 | D1505: 0 | E1505: 0 | F1505: 1112,100;1116,100;1111,100; | G1505: 5103,100;5209,100;5101,100; | H1505: 130+26*LV*0.6 | I1505: 45+10.5*LV*0.6 | J1505: 32+9*LV*0.6 | K1505: 24+5*LV*0.6 | L1505: 13+3*LV*0.6 | M1505: 100000 | N1505: 0 | O1505: math.max(0,(lv/10)-1) | P1505: math.max(0,(lv/10)-1) | Q1505: math.max(0,(lv/10)-1) | R1505: 0; | S1505: 有药王谷和盘丝洞的弟子在，真是不爽，还是跑路算了！ | T1505: 药王谷和盘丝洞的弟子不在眼前，真是轻松愉快啊！ | U1505: 0 | V1505: 0,0; | W1505: 1
A1506: 20177 | B1506: 喽啰 | C1506: hero_1001 | D1506: 0 | E1506: 0 | F1506: 1112,100;1116,100;1111,100; | G1506: 5103,100;5209,100;5101,100; | H1506: 130+26*LV*0.6 | I1506: 45+10.5*LV*0.6 | J1506: 32+9*LV*0.6 | K1506: 24+5*LV*0.6 | L1506: 13+3*LV*0.6 | M1506: 100000 | N1506: 0 | O1506: math.max(0,(lv/10)-1) | P1506: math.max(0,(lv/10)-1) | Q1506: math.max(0,(lv/10)-1) | R1506: 0; | S1506: 有药王谷和盘丝洞的弟子在，真是不爽，还是跑路算了！ | T1506: 药王谷和盘丝洞的弟子不在眼前，真是轻松愉快啊！ | U1506: 0 | V1506: 0,0; | W1506: 1
A1507: 20178 | B1507: 喽啰 | C1507: hero_1001 | D1507: 0 | E1507: 0 | F1507: 1112,100;1116,100;1111,100; | G1507: 5103,100;5209,100;5101,100; | H1507: 130+26*LV*0.6 | I1507: 45+10.5*LV*0.6 | J1507: 32+9*LV*0.6 | K1507: 24+5*LV*0.6 | L1507: 13+3*LV*0.6 | M1507: 100000 | N1507: 0 | O1507: math.max(0,(lv/10)-1) | P1507: math.max(0,(lv/10)-1) | Q1507: math.max(0,(lv/10)-1) | R1507: 0; | S1507: 有药王谷和盘丝洞的弟子在，真是不爽，还是跑路算了！ | T1507: 药王谷和盘丝洞的弟子不在眼前，真是轻松愉快啊！ | U1507: 0 | V1507: 0,0; | W1507: 1
A1508: 20179 | B1508: 喽啰 | C1508: common_3007 | D1508: 0 | E1508: 0 | F1508: 1112,100;1116,100;1111,100; | G1508: 5103,100;5209,100;5101,100; | H1508: 130+26*LV*0.6 | I1508: 45+10.5*LV*0.6 | J1508: 32+9*LV*0.6 | K1508: 24+5*LV*0.6 | L1508: 13+3*LV*0.6 | M1508: 100000 | N1508: 0 | O1508: math.max(0,(lv/10)-1) | P1508: math.max(0,(lv/10)-1) | Q1508: math.max(0,(lv/10)-1) | R1508: 0; | S1508: 有药王谷和盘丝洞的弟子在，真是不爽，还是跑路算了！ | T1508: 药王谷和盘丝洞的弟子不在眼前，真是轻松愉快啊！ | U1508: 0 | V1508: 0,0; | W1508: 1
A1509: 20180 | B1509: 喽啰 | C1509: pet_53 | D1509: 0 | E1509: 0 | F1509: 1112,100;1116,100;1111,100; | G1509: 5103,100;5209,100;5101,100; | H1509: 130+26*LV*0.6 | I1509: 45+10.5*LV*0.6 | J1509: 32+9*LV*0.6 | K1509: 24+5*LV*0.6 | L1509: 13+3*LV*0.6 | M1509: 100000 | N1509: 0 | O1509: math.max(0,(lv/10)-1) | P1509: math.max(0,(lv/10)-1) | Q1509: math.max(0,(lv/10)-1) | R1509: 0; | S1509: 有药王谷和盘丝洞的弟子在，真是不爽，还是跑路算了！ | T1509: 药王谷和盘丝洞的弟子不在眼前，真是轻松愉快啊！ | U1509: 0 | V1509: 0,0; | W1509: 1
A1510: 20181 | B1510: 喽啰 | C1510: pet_61 | D1510: 0 | E1510: 0 | F1510: 1112,100;1116,100;1111,100; | G1510: 5103,100;5209,100;5101,100; | H1510: 130+26*LV*0.6 | I1510: 45+10.5*LV*0.6 | J1510: 32+9*LV*0.6 | K1510: 24+5*LV*0.6 | L1510: 13+3*LV*0.6 | M1510: 100000 | N1510: 0 | O1510: math.max(0,(lv/5)-1) | P1510: math.max(0,(lv/5)-1) | Q1510: math.max(0,(lv/5)-1) | R1510: 0; | S1510: 有药王谷和盘丝洞的弟子在，真是不爽，还是跑路算了！ | T1510: 药王谷和盘丝洞的弟子不在眼前，真是轻松愉快啊！ | U1510: 0 | V1510: 0,0; | W1510: 1
A1511: 20182 | B1511: 喽啰 | C1511: common_3018 | D1511: 0 | E1511: 0 | F1511: 1112,100;1116,100;1111,100; | G1511: 5103,100;5209,100;5101,100; | H1511: 130+26*LV*0.6 | I1511: 45+10.5*LV*0.6 | J1511: 32+9*LV*0.6 | K1511: 24+5*LV*0.6 | L1511: 13+3*LV*0.6 | M1511: 100000 | N1511: 0 | O1511: math.max(0,(lv/5)-1) | P1511: math.max(0,(lv/5)-1) | Q1511: math.max(0,(lv/5)-1) | R1511: 0; | S1511: 有药王谷和盘丝洞的弟子在，真是不爽，还是跑路算了！ | T1511: 药王谷和盘丝洞的弟子不在眼前，真是轻松愉快啊！ | U1511: 0 | V1511: 0,0; | W1511: 1
A1512: 20183 | B1512: 喽啰 | C1512: pet_13 | D1512: 0 | E1512: 0 | F1512: 1112,100;1116,100;1111,100; | G1512: 5103,100;5209,100;5101,100; | H1512: 130+26*LV*0.6 | I1512: 45+10.5*LV*0.6 | J1512: 32+9*LV*0.6 | K1512: 24+5*LV*0.6 | L1512: 13+3*LV*0.6 | M1512: 100000 | N1512: 0 | O1512: math.max(0,(lv/5)-1) | P1512: math.max(0,(lv/5)-1) | Q1512: math.max(0,(lv/5)-1) | R1512: 0; | S1512: 有药王谷和盘丝洞的弟子在，真是不爽，还是跑路算了！ | T1512: 药王谷和盘丝洞的弟子不在眼前，真是轻松愉快啊！ | U1512: 0 | V1512: 0,0; | W1512: 1
A1513: 20184 | B1513: 喽啰 | C1513: pet_23 | D1513: 0 | E1513: 0 | F1513: 1112,100;1116,100;1111,100; | G1513: 5103,100;5209,100;5101,100; | H1513: 130+26*LV*0.6 | I1513: 45+10.5*LV*0.6 | J1513: 32+9*LV*0.6 | K1513: 24+5*LV*0.6 | L1513: 13+3*LV*0.6 | M1513: 100000 | N1513: 0 | O1513: math.max(0,(lv/5)-1) | P1513: math.max(0,(lv/5)-1) | Q1513: math.max(0,(lv/5)-1) | R1513: 0; | S1513: 有药王谷和盘丝洞的弟子在，真是不爽，还是跑路算了！ | T1513: 药王谷和盘丝洞的弟子不在眼前，真是轻松愉快啊！ | U1513: 0 | V1513: 0,0; | W1513: 1
A1514: 20185 | B1514: 喽啰 | C1514: common_3018 | D1514: 0 | E1514: 0 | F1514: 1112,100;1116,100;1111,100; | G1514: 5103,100;5209,100;5101,100; | H1514: 130+26*LV*0.6 | I1514: 45+10.5*LV*0.6 | J1514: 32+9*LV*0.6 | K1514: 24+5*LV*0.6 | L1514: 13+3*LV*0.6 | M1514: 100000 | N1514: 0 | O1514: math.max(0,(lv/5)-1) | P1514: math.max(0,(lv/5)-1) | Q1514: math.max(0,(lv/5)-1) | R1514: 0; | S1514: 有药王谷和盘丝洞的弟子在，真是不爽，还是跑路算了！ | T1514: 药王谷和盘丝洞的弟子不在眼前，真是轻松愉快啊！ | U1514: 0 | V1514: 0,0; | W1514: 1
A1515: 20186 | B1515: 喽啰 | C1515: pet_71 | D1515: 0 | E1515: 0 | F1515: 1112,100;1116,100;1111,100; | G1515: 5103,100;5209,100;5101,100; | H1515: 130+26*LV*0.6 | I1515: 45+10.5*LV*0.6 | J1515: 32+9*LV*0.6 | K1515: 24+5*LV*0.6 | L1515: 13+3*LV*0.6 | M1515: 100000 | N1515: 0 | O1515: math.max(0,(lv/5)-1) | P1515: math.max(0,(lv/5)-1) | Q1515: math.max(0,(lv/5)-1) | R1515: 0; | S1515: 有药王谷和盘丝洞的弟子在，真是不爽，还是跑路算了！ | T1515: 药王谷和盘丝洞的弟子不在眼前，真是轻松愉快啊！ | U1515: 0 | V1515: 0,0; | W1515: 1
A1516: 20187 | B1516: 喽啰 | C1516: hero_1001 | D1516: 0 | E1516: 0 | F1516: 1112,100;1116,100;1111,100; | G1516: 5103,100;5209,100;5101,100; | H1516: 130+26*LV*0.6 | I1516: 45+10.5*LV*0.6 | J1516: 32+9*LV*0.6 | K1516: 24+5*LV*0.6 | L1516: 13+3*LV*0.6 | M1516: 100000 | N1516: 0 | O1516: math.max(0,(lv/5)-1) | P1516: math.max(0,(lv/5)-1) | Q1516: math.max(0,(lv/5)-1) | R1516: 0; | S1516: 有药王谷和盘丝洞的弟子在，真是不爽，还是跑路算了！ | T1516: 药王谷和盘丝洞的弟子不在眼前，真是轻松愉快啊！ | U1516: 0 | V1516: 0,0; | W1516: 1
A1517: 20188 | B1517: 喽啰 | C1517: common_3018 | D1517: 0 | E1517: 0 | F1517: 1112,100;1116,100;1111,100; | G1517: 5103,100;5209,100;5101,100; | H1517: 130+26*LV*0.6 | I1517: 45+10.5*LV*0.6 | J1517: 32+9*LV*0.6 | K1517: 24+5*LV*0.6 | L1517: 13+3*LV*0.6 | M1517: 100000 | N1517: 0 | O1517: math.max(0,(lv/5)-1) | P1517: math.max(0,(lv/5)-1) | Q1517: math.max(0,(lv/5)-1) | R1517: 0; | S1517: 有药王谷和盘丝洞的弟子在，真是不爽，还是跑路算了！ | T1517: 药王谷和盘丝洞的弟子不在眼前，真是轻松愉快啊！ | U1517: 0 | V1517: 0,0; | W1517: 1
A1518: 20189 | B1518: 喽啰 | C1518: hero_1001 | D1518: 0 | E1518: 0 | F1518: 1112,100;1116,100;1111,100; | G1518: 5103,100;5209,100;5101,100; | H1518: 130+26*LV*0.6 | I1518: 45+10.5*LV*0.6 | J1518: 32+9*LV*0.6 | K1518: 24+5*LV*0.6 | L1518: 13+3*LV*0.6 | M1518: 100000 | N1518: 0 | O1518: math.max(0,(lv/5)-1) | P1518: math.max(0,(lv/5)-1) | Q1518: math.max(0,(lv/5)-1) | R1518: 0; | S1518: 有药王谷和盘丝洞的弟子在，真是不爽，还是跑路算了！ | T1518: 药王谷和盘丝洞的弟子不在眼前，真是轻松愉快啊！ | U1518: 0 | V1518: 0,0; | W1518: 1
A1519: 20190 | B1519: 喽啰 | C1519: hero_2001 | D1519: 0 | E1519: 0 | F1519: 1112,100;1116,100;1111,100; | G1519: 5103,100;5209,100;5101,100; | H1519: 130+26*LV*0.6 | I1519: 45+10.5*LV*0.6 | J1519: 32+9*LV*0.6 | K1519: 24+5*LV*0.6 | L1519: 13+3*LV*0.6 | M1519: 100000 | N1519: 0 | O1519: math.max(0,(lv/5)-1) | P1519: math.max(0,(lv/5)-1) | Q1519: math.max(0,(lv/5)-1) | R1519: 0; | S1519: 有药王谷和盘丝洞的弟子在，真是不爽，还是跑路算了！ | T1519: 药王谷和盘丝洞的弟子不在眼前，真是轻松愉快啊！ | U1519: 0 | V1519: 0,0; | W1519: 1
A1520: 20191 | B1520: 喽啰 | C1520: pet_23 | D1520: 0 | E1520: 0 | F1520: 1112,100;1116,100;1111,100; | G1520: 5103,100;5209,100;5101,100; | H1520: 130+26*LV*0.6 | I1520: 45+10.5*LV*0.6 | J1520: 32+9*LV*0.6 | K1520: 24+5*LV*0.6 | L1520: 13+3*LV*0.6 | M1520: 100000 | N1520: 0 | O1520: math.max(0,(lv/5)-1) | P1520: math.max(0,(lv/5)-1) | Q1520: math.max(0,(lv/5)-1) | R1520: 0; | S1520: 有药王谷和盘丝洞的弟子在，真是不爽，还是跑路算了！ | T1520: 药王谷和盘丝洞的弟子不在眼前，真是轻松愉快啊！ | U1520: 0 | V1520: 0,0; | W1520: 1
A1521: 20192 | B1521: 喽啰 | C1521: pet_13 | D1521: 0 | E1521: 0 | F1521: 1112,100;1116,100;1111,100; | G1521: 5103,100;5209,100;5101,100; | H1521: 130+26*LV*0.6 | I1521: 45+10.5*LV*0.6 | J1521: 32+9*LV*0.6 | K1521: 24+5*LV*0.6 | L1521: 13+3*LV*0.6 | M1521: 100000 | N1521: 0 | O1521: math.max(0,(lv/5)-1) | P1521: math.max(0,(lv/5)-1) | Q1521: math.max(0,(lv/5)-1) | R1521: 0; | S1521: 有药王谷和盘丝洞的弟子在，真是不爽，还是跑路算了！ | T1521: 药王谷和盘丝洞的弟子不在眼前，真是轻松愉快啊！ | U1521: 0 | V1521: 0,0; | W1521: 1
A1522: 20193 | B1522: 喽啰 | C1522: pet_23 | D1522: 0 | E1522: 0 | F1522: 1112,100;1116,100;1111,100; | G1522: 5103,100;5209,100;5101,100; | H1522: 130+26*LV*0.6 | I1522: 45+10.5*LV*0.6 | J1522: 32+9*LV*0.6 | K1522: 24+5*LV*0.6 | L1522: 13+3*LV*0.6 | M1522: 100000 | N1522: 0 | O1522: math.max(0,(lv/5)-1) | P1522: math.max(0,(lv/5)-1) | Q1522: math.max(0,(lv/5)-1) | R1522: 0; | S1522: 有药王谷和盘丝洞的弟子在，真是不爽，还是跑路算了！ | T1522: 药王谷和盘丝洞的弟子不在眼前，真是轻松愉快啊！ | U1522: 0 | V1522: 0,0; | W1522: 1
A1523: 20194 | B1523: 喽啰 | C1523: pet_22 | D1523: 0 | E1523: 0 | F1523: 1112,100;1116,100;1111,100; | G1523: 5103,100;5209,100;5101,100; | H1523: 130+26*LV*0.6 | I1523: 45+10.5*LV*0.6 | J1523: 32+9*LV*0.6 | K1523: 24+5*LV*0.6 | L1523: 13+3*LV*0.6 | M1523: 100000 | N1523: 0 | O1523: math.max(0,(lv/5)-1) | P1523: math.max(0,(lv/5)-1) | Q1523: math.max(0,(lv/5)-1) | R1523: 0; | S1523: 有药王谷和盘丝洞的弟子在，真是不爽，还是跑路算了！ | T1523: 药王谷和盘丝洞的弟子不在眼前，真是轻松愉快啊！ | U1523: 0 | V1523: 0,0; | W1523: 1
A1524: 20195 | B1524: 喽啰 | C1524: hero_1001 | D1524: 0 | E1524: 0 | F1524: 1112,100;1116,100;1111,100; | G1524: 5103,100;5209,100;5101,100; | H1524: 130+26*LV*0.6 | I1524: 45+10.5*LV*0.6 | J1524: 32+9*LV*0.6 | K1524: 24+5*LV*0.6 | L1524: 13+3*LV*0.6 | M1524: 100000 | N1524: 0 | O1524: math.max(0,(lv/5)-1) | P1524: math.max(0,(lv/5)-1) | Q1524: math.max(0,(lv/5)-1) | R1524: 0; | S1524: 有药王谷和盘丝洞的弟子在，真是不爽，还是跑路算了！ | T1524: 药王谷和盘丝洞的弟子不在眼前，真是轻松愉快啊！ | U1524: 0 | V1524: 0,0; | W1524: 1
A1525: 20196 | B1525: 喽啰 | C1525: pet_22 | D1525: 0 | E1525: 0 | F1525: 1112,100;1116,100;1111,100; | G1525: 5103,100;5209,100;5101,100; | H1525: 130+26*LV*0.6 | I1525: 45+10.5*LV*0.6 | J1525: 32+9*LV*0.6 | K1525: 24+5*LV*0.6 | L1525: 13+3*LV*0.6 | M1525: 100000 | N1525: 0 | O1525: math.max(0,(lv/5)-1) | P1525: math.max(0,(lv/5)-1) | Q1525: math.max(0,(lv/5)-1) | R1525: 0; | S1525: 有药王谷和盘丝洞的弟子在，真是不爽，还是跑路算了！ | T1525: 药王谷和盘丝洞的弟子不在眼前，真是轻松愉快啊！ | U1525: 0 | V1525: 0,0; | W1525: 1
A1526: 20197 | B1526: 喽啰 | C1526: pet_23 | D1526: 0 | E1526: 0 | F1526: 1112,100;1116,100;1111,100; | G1526: 5103,100;5209,100;5101,100; | H1526: 130+26*LV*0.6 | I1526: 45+10.5*LV*0.6 | J1526: 32+9*LV*0.6 | K1526: 24+5*LV*0.6 | L1526: 13+3*LV*0.6 | M1526: 100000 | N1526: 0 | O1526: math.max(0,(lv/5)-1) | P1526: math.max(0,(lv/5)-1) | Q1526: math.max(0,(lv/5)-1) | R1526: 0; | S1526: 有药王谷和盘丝洞的弟子在，真是不爽，还是跑路算了！ | T1526: 药王谷和盘丝洞的弟子不在眼前，真是轻松愉快啊！ | U1526: 0 | V1526: 0,0; | W1526: 1
A1527: 20198 | B1527: 喽啰 | C1527: hero_1001 | D1527: 0 | E1527: 0 | F1527: 1112,100;1116,100;1111,100; | G1527: 5103,100;5209,100;5101,100; | H1527: 130+26*LV*0.6 | I1527: 45+10.5*LV*0.6 | J1527: 32+9*LV*0.6 | K1527: 24+5*LV*0.6 | L1527: 13+3*LV*0.6 | M1527: 100000 | N1527: 0 | O1527: math.max(0,(lv/5)-1) | P1527: math.max(0,(lv/5)-1) | Q1527: math.max(0,(lv/5)-1) | R1527: 0; | S1527: 有药王谷和盘丝洞的弟子在，真是不爽，还是跑路算了！ | T1527: 药王谷和盘丝洞的弟子不在眼前，真是轻松愉快啊！ | U1527: 0 | V1527: 0,0; | W1527: 1
A1528: 20199 | B1528: 喽啰 | C1528: hero_1001 | D1528: 0 | E1528: 0 | F1528: 1112,100;1116,100;1111,100; | G1528: 5103,100;5209,100;5101,100; | H1528: 130+26*LV*0.6 | I1528: 45+10.5*LV*0.6 | J1528: 32+9*LV*0.6 | K1528: 24+5*LV*0.6 | L1528: 13+3*LV*0.6 | M1528: 100000 | N1528: 0 | O1528: math.max(0,(lv/5)-1) | P1528: math.max(0,(lv/5)-1) | Q1528: math.max(0,(lv/5)-1) | R1528: 0; | S1528: 有药王谷和盘丝洞的弟子在，真是不爽，还是跑路算了！ | T1528: 药王谷和盘丝洞的弟子不在眼前，真是轻松愉快啊！ | U1528: 0 | V1528: 0,0; | W1528: 1
A1529: 20200 | B1529: 喽啰 | C1529: pet_43 | D1529: 0 | E1529: 0 | F1529: 1112,100;1116,100;1111,100; | G1529: 5103,100;5209,100;5101,100; | H1529: 130+26*LV*0.6 | I1529: 45+10.5*LV*0.6 | J1529: 32+9*LV*0.6 | K1529: 24+5*LV*0.6 | L1529: 13+3*LV*0.6 | M1529: 100000 | N1529: 0 | O1529: math.max(0,(lv/5)-1) | P1529: math.max(0,(lv/5)-1) | Q1529: math.max(0,(lv/5)-1) | R1529: 0; | S1529: 有药王谷和盘丝洞的弟子在，真是不爽，还是跑路算了！ | T1529: 药王谷和盘丝洞的弟子不在眼前，真是轻松愉快啊！ | U1529: 0 | V1529: 0,0; | W1529: 1
A1530: 20201 | B1530: 喽啰 | C1530: pet_42 | D1530: 0 | E1530: 0 | F1530: 1211,100;1212,100;1216,100;5310,100; | G1530: 5138,100;5131,100; | H1530: 130+26*LV*0.6 | I1530: 45+10.5*LV*0.6 | J1530: 32+9*LV*0.6 | K1530: 24+5*LV*0.6 | L1530: 13+3*LV*0.6 | M1530: 100000 | N1530: 0 | O1530: math.max(0,(lv/10)-1) | P1530: math.max(0,(lv/10)-1) | Q1530: math.max(0,(lv/10)-1) | R1530: 0; | S1530: 有药王谷和盘丝洞的弟子在，真是不爽，还是跑路算了！ | T1530: 药王谷和盘丝洞的弟子不在眼前，真是轻松愉快啊！ | U1530: 0 | V1530: 0,0; | W1530: 3
A1531: 20202 | B1531: 喽啰 | C1531: pet_42 | D1531: 0 | E1531: 0 | F1531: 1311,100;1312,100;1315,100; | G1531: 5138,100;5131,100; | H1531: 130+26*LV*0.6 | I1531: 45+10.5*LV*0.6 | J1531: 32+9*LV*0.6 | K1531: 24+5*LV*0.6 | L1531: 13+3*LV*0.6 | M1531: 100000 | N1531: 0 | O1531: math.max(0,(lv/10)-1) | P1531: math.max(0,(lv/10)-1) | Q1531: math.max(0,(lv/10)-1) | R1531: 0; | S1531: 有药王谷和盘丝洞的弟子在，真是不爽，还是跑路算了！ | T1531: 药王谷和盘丝洞的弟子不在眼前，真是轻松愉快啊！ | U1531: 0 | V1531: 0,0; | W1531: 3
A1532: 20203 | B1532: 喽啰 | C1532: pet_42 | D1532: 0 | E1532: 0 | F1532: 1311,100;1312,100;1315,100; | G1532: 5138,100;5131,100; | H1532: 130+26*LV*0.6 | I1532: 45+10.5*LV*0.6 | J1532: 32+9*LV*0.6 | K1532: 24+5*LV*0.6 | L1532: 13+3*LV*0.6 | M1532: 100000 | N1532: 0 | O1532: math.max(0,(lv/10)-1) | P1532: math.max(0,(lv/10)-1) | Q1532: math.max(0,(lv/10)-1) | R1532: 0; | S1532: 有药王谷和盘丝洞的弟子在，真是不爽，还是跑路算了！ | T1532: 药王谷和盘丝洞的弟子不在眼前，真是轻松愉快啊！ | U1532: 0 | V1532: 0,0; | W1532: 3
A1533: 20204 | B1533: 喽啰 | C1533: pet_42 | D1533: 0 | E1533: 0 | F1533: 1211,100;1212,100;1216,100;5310,100; | G1533: 5138,100;5131,100; | H1533: 130+26*LV*0.6 | I1533: 45+10.5*LV*0.6 | J1533: 32+9*LV*0.6 | K1533: 24+5*LV*0.6 | L1533: 13+3*LV*0.6 | M1533: 100000 | N1533: 0 | O1533: math.max(0,(lv/10)-1) | P1533: math.max(0,(lv/10)-1) | Q1533: math.max(0,(lv/10)-1) | R1533: 0; | S1533: 有药王谷和盘丝洞的弟子在，真是不爽，还是跑路算了！ | T1533: 药王谷和盘丝洞的弟子不在眼前，真是轻松愉快啊！ | U1533: 0 | V1533: 0,0; | W1533: 3
A1534: 20205 | B1534: 喽啰 | C1534: pet_42 | D1534: 0 | E1534: 0 | F1534: 1211,100;1212,100;1216,100;5310,100; | G1534: 5138,100;5131,100; | H1534: 130+26*LV*0.6 | I1534: 45+10.5*LV*0.6 | J1534: 32+9*LV*0.6 | K1534: 24+5*LV*0.6 | L1534: 13+3*LV*0.6 | M1534: 100000 | N1534: 0 | O1534: math.max(0,(lv/10)-1) | P1534: math.max(0,(lv/10)-1) | Q1534: math.max(0,(lv/10)-1) | R1534: 0; | S1534: 有药王谷和盘丝洞的弟子在，真是不爽，还是跑路算了！ | T1534: 药王谷和盘丝洞的弟子不在眼前，真是轻松愉快啊！ | U1534: 0 | V1534: 0,0; | W1534: 3
A1535: 20206 | B1535: 喽啰 | C1535: pet_13 | D1535: 0 | E1535: 0 | F1535: 1211,100;1212,100;1216,100;5310,100; | G1535: 5138,100;5131,100; | H1535: 130+26*LV*0.6 | I1535: 45+10.5*LV*0.6 | J1535: 32+9*LV*0.6 | K1535: 24+5*LV*0.6 | L1535: 13+3*LV*0.6 | M1535: 100000 | N1535: 0 | O1535: math.max(0,(lv/10)-1) | P1535: math.max(0,(lv/10)-1) | Q1535: math.max(0,(lv/10)-1) | R1535: 0; | S1535: 有药王谷和盘丝洞的弟子在，真是不爽，还是跑路算了！ | T1535: 药王谷和盘丝洞的弟子不在眼前，真是轻松愉快啊！ | U1535: 0 | V1535: 0,0; | W1535: 3
A1536: 20207 | B1536: 喽啰 | C1536: pet_13 | D1536: 0 | E1536: 0 | F1536: 1211,100;1212,100;1216,100;5310,100; | G1536: 5138,100;5131,100; | H1536: 130+26*LV*0.6 | I1536: 45+10.5*LV*0.6 | J1536: 32+9*LV*0.6 | K1536: 24+5*LV*0.6 | L1536: 13+3*LV*0.6 | M1536: 100000 | N1536: 0 | O1536: math.max(0,(lv/10)-1) | P1536: math.max(0,(lv/10)-1) | Q1536: math.max(0,(lv/10)-1) | R1536: 0; | S1536: 有药王谷和盘丝洞的弟子在，真是不爽，还是跑路算了！ | T1536: 药王谷和盘丝洞的弟子不在眼前，真是轻松愉快啊！ | U1536: 0 | V1536: 0,0; | W1536: 3
A1537: 20208 | B1537: 喽啰 | C1537: pet_13 | D1537: 0 | E1537: 0 | F1537: 1311,100;1312,100;1315,100; | G1537: 5138,100;5131,100; | H1537: 130+26*LV*0.6 | I1537: 45+10.5*LV*0.6 | J1537: 32+9*LV*0.6 | K1537: 24+5*LV*0.6 | L1537: 13+3*LV*0.6 | M1537: 100000 | N1537: 0 | O1537: math.max(0,(lv/10)-1) | P1537: math.max(0,(lv/10)-1) | Q1537: math.max(0,(lv/10)-1) | R1537: 0; | S1537: 有药王谷和盘丝洞的弟子在，真是不爽，还是跑路算了！ | T1537: 药王谷和盘丝洞的弟子不在眼前，真是轻松愉快啊！ | U1537: 0 | V1537: 0,0; | W1537: 3
A1538: 20209 | B1538: 喽啰 | C1538: pet_13 | D1538: 0 | E1538: 0 | F1538: 1211,100;1212,100;1216,100;5310,100; | G1538: 5138,100;5131,100; | H1538: 130+26*LV*0.6 | I1538: 45+10.5*LV*0.6 | J1538: 32+9*LV*0.6 | K1538: 24+5*LV*0.6 | L1538: 13+3*LV*0.6 | M1538: 100000 | N1538: 0 | O1538: math.max(0,(lv/10)-1) | P1538: math.max(0,(lv/10)-1) | Q1538: math.max(0,(lv/10)-1) | R1538: 0; | S1538: 有药王谷和盘丝洞的弟子在，真是不爽，还是跑路算了！ | T1538: 药王谷和盘丝洞的弟子不在眼前，真是轻松愉快啊！ | U1538: 0 | V1538: 0,0; | W1538: 3
A1539: 20210 | B1539: 喽啰 | C1539: pet_13 | D1539: 0 | E1539: 0 | F1539: 1211,100;1212,100;1216,100;5310,100; | G1539: 5138,100;5131,100; | H1539: 130+26*LV*0.6 | I1539: 45+10.5*LV*0.6 | J1539: 32+9*LV*0.6 | K1539: 24+5*LV*0.6 | L1539: 13+3*LV*0.6 | M1539: 100000 | N1539: 0 | O1539: math.max(0,(lv/10)-1) | P1539: math.max(0,(lv/10)-1) | Q1539: math.max(0,(lv/10)-1) | R1539: 0; | S1539: 有药王谷和盘丝洞的弟子在，真是不爽，还是跑路算了！ | T1539: 药王谷和盘丝洞的弟子不在眼前，真是轻松愉快啊！ | U1539: 0 | V1539: 0,0; | W1539: 3
A1540: 20211 | B1540: 喽啰 | C1540: pet_21 | D1540: 0 | E1540: 0 | F1540: 1311,100;1312,100;1315,100; | G1540: 5138,100;5131,100; | H1540: 130+26*LV*0.6 | I1540: 45+10.5*LV*0.6 | J1540: 32+9*LV*0.6 | K1540: 24+5*LV*0.6 | L1540: 13+3*LV*0.6 | M1540: 100000 | N1540: 0 | O1540: math.max(0,(lv/10)-1) | P1540: math.max(0,(lv/10)-1) | Q1540: math.max(0,(lv/10)-1) | R1540: 0; | S1540: 有药王谷和盘丝洞的弟子在，真是不爽，还是跑路算了！ | T1540: 药王谷和盘丝洞的弟子不在眼前，真是轻松愉快啊！ | U1540: 0 | V1540: 0,0; | W1540: 3
A1541: 20212 | B1541: 喽啰 | C1541: pet_3 | D1541: 0 | E1541: 0 | F1541: 1311,100;1312,100;1315,100; | G1541: 5138,100;5131,100; | H1541: 130+26*LV*0.6 | I1541: 45+10.5*LV*0.6 | J1541: 32+9*LV*0.6 | K1541: 24+5*LV*0.6 | L1541: 13+3*LV*0.6 | M1541: 100000 | N1541: 0 | O1541: math.max(0,(lv/10)-1) | P1541: math.max(0,(lv/10)-1) | Q1541: math.max(0,(lv/10)-1) | R1541: 0; | S1541: 有药王谷和盘丝洞的弟子在，真是不爽，还是跑路算了！ | T1541: 药王谷和盘丝洞的弟子不在眼前，真是轻松愉快啊！ | U1541: 0 | V1541: 0,0; | W1541: 3
A1542: 20213 | B1542: 喽啰 | C1542: partner_1009 | D1542: 0 | E1542: 0 | F1542: 1311,100;1312,100;1315,100; | G1542: 5138,100;5131,100; | H1542: 130+26*LV*0.6 | I1542: 45+10.5*LV*0.6 | J1542: 32+9*LV*0.6 | K1542: 24+5*LV*0.6 | L1542: 13+3*LV*0.6 | M1542: 100000 | N1542: 0 | O1542: math.max(0,(lv/10)-1) | P1542: math.max(0,(lv/10)-1) | Q1542: math.max(0,(lv/10)-1) | R1542: 0; | S1542: 有药王谷和盘丝洞的弟子在，真是不爽，还是跑路算了！ | T1542: 药王谷和盘丝洞的弟子不在眼前，真是轻松愉快啊！ | U1542: 0 | V1542: 0,0; | W1542: 3
A1543: 20214 | B1543: 喽啰 | C1543: hero_1001 | D1543: 0 | E1543: 0 | F1543: 1311,100;1312,100;1315,100; | G1543: 5138,100;5131,100; | H1543: 130+26*LV*0.6 | I1543: 45+10.5*LV*0.6 | J1543: 32+9*LV*0.6 | K1543: 24+5*LV*0.6 | L1543: 13+3*LV*0.6 | M1543: 100000 | N1543: 0 | O1543: math.max(0,(lv/10)-1) | P1543: math.max(0,(lv/10)-1) | Q1543: math.max(0,(lv/10)-1) | R1543: 0; | S1543: 有药王谷和盘丝洞的弟子在，真是不爽，还是跑路算了！ | T1543: 药王谷和盘丝洞的弟子不在眼前，真是轻松愉快啊！ | U1543: 0 | V1543: 0,0; | W1543: 3
A1544: 20215 | B1544: 喽啰 | C1544: pet_33 | D1544: 0 | E1544: 0 | F1544: 1211,100;1212,100;1216,100;5310,100; | G1544: 5138,100;5131,100; | H1544: 130+26*LV*0.6 | I1544: 45+10.5*LV*0.6 | J1544: 32+9*LV*0.6 | K1544: 24+5*LV*0.6 | L1544: 13+3*LV*0.6 | M1544: 100000 | N1544: 0 | O1544: math.max(0,(lv/10)-1) | P1544: math.max(0,(lv/10)-1) | Q1544: math.max(0,(lv/10)-1) | R1544: 0; | S1544: 有药王谷和盘丝洞的弟子在，真是不爽，还是跑路算了！ | T1544: 药王谷和盘丝洞的弟子不在眼前，真是轻松愉快啊！ | U1544: 0 | V1544: 0,0; | W1544: 3
A1545: 20216 | B1545: 喽啰 | C1545: pet_83 | D1545: 0 | E1545: 0 | F1545: 1211,100;1212,100;1216,100;5310,100; | G1545: 5138,100;5131,100; | H1545: 130+26*LV*0.6 | I1545: 45+10.5*LV*0.6 | J1545: 32+9*LV*0.6 | K1545: 24+5*LV*0.6 | L1545: 13+3*LV*0.6 | M1545: 100000 | N1545: 0 | O1545: math.max(0,(lv/10)-1) | P1545: math.max(0,(lv/10)-1) | Q1545: math.max(0,(lv/10)-1) | R1545: 0; | S1545: 有药王谷和盘丝洞的弟子在，真是不爽，还是跑路算了！ | T1545: 药王谷和盘丝洞的弟子不在眼前，真是轻松愉快啊！ | U1545: 0 | V1545: 0,0; | W1545: 3
A1546: 20217 | B1546: 喽啰 | C1546: partner_1002 | D1546: 0 | E1546: 0 | F1546: 1211,100;1212,100;1216,100;5310,100; | G1546: 5138,100;5131,100; | H1546: 130+26*LV*0.6 | I1546: 45+10.5*LV*0.6 | J1546: 32+9*LV*0.6 | K1546: 24+5*LV*0.6 | L1546: 13+3*LV*0.6 | M1546: 100000 | N1546: 0 | O1546: math.max(0,(lv/10)-1) | P1546: math.max(0,(lv/10)-1) | Q1546: math.max(0,(lv/10)-1) | R1546: 0; | S1546: 有药王谷和盘丝洞的弟子在，真是不爽，还是跑路算了！ | T1546: 药王谷和盘丝洞的弟子不在眼前，真是轻松愉快啊！ | U1546: 0 | V1546: 0,0; | W1546: 3
A1547: 20218 | B1547: 喽啰 | C1547: pet_62 | D1547: 0 | E1547: 0 | F1547: 1311,100;1312,100;1315,100; | G1547: 5138,100;5131,100; | H1547: 130+26*LV*0.6 | I1547: 45+10.5*LV*0.6 | J1547: 32+9*LV*0.6 | K1547: 24+5*LV*0.6 | L1547: 13+3*LV*0.6 | M1547: 100000 | N1547: 0 | O1547: math.max(0,(lv/10)-1) | P1547: math.max(0,(lv/10)-1) | Q1547: math.max(0,(lv/10)-1) | R1547: 0; | S1547: 有药王谷和盘丝洞的弟子在，真是不爽，还是跑路算了！ | T1547: 药王谷和盘丝洞的弟子不在眼前，真是轻松愉快啊！ | U1547: 0 | V1547: 0,0; | W1547: 3
A1548: 20219 | B1548: 喽啰 | C1548: pet_83 | D1548: 0 | E1548: 0 | F1548: 1211,100;1212,100;1216,100;5310,100; | G1548: 5138,100;5131,100; | H1548: 130+26*LV*0.6 | I1548: 45+10.5*LV*0.6 | J1548: 32+9*LV*0.6 | K1548: 24+5*LV*0.6 | L1548: 13+3*LV*0.6 | M1548: 100000 | N1548: 0 | O1548: math.max(0,(lv/10)-1) | P1548: math.max(0,(lv/10)-1) | Q1548: math.max(0,(lv/10)-1) | R1548: 0; | S1548: 有药王谷和盘丝洞的弟子在，真是不爽，还是跑路算了！ | T1548: 药王谷和盘丝洞的弟子不在眼前，真是轻松愉快啊！ | U1548: 0 | V1548: 0,0; | W1548: 3
A1549: 20220 | B1549: 喽啰 | C1549: pet_23 | D1549: 0 | E1549: 0 | F1549: 1211,100;1212,100;1216,100;5310,100; | G1549: 5138,100;5131,100; | H1549: 130+26*LV*0.6 | I1549: 45+10.5*LV*0.6 | J1549: 32+9*LV*0.6 | K1549: 24+5*LV*0.6 | L1549: 13+3*LV*0.6 | M1549: 100000 | N1549: 0 | O1549: math.max(0,(lv/10)-1) | P1549: math.max(0,(lv/10)-1) | Q1549: math.max(0,(lv/10)-1) | R1549: 0; | S1549: 有药王谷和盘丝洞的弟子在，真是不爽，还是跑路算了！ | T1549: 药王谷和盘丝洞的弟子不在眼前，真是轻松愉快啊！ | U1549: 0 | V1549: 0,0; | W1549: 3
A1550: 20221 | B1550: 喽啰 | C1550: hero_1001 | D1550: 0 | E1550: 0 | F1550: 1311,100;1312,100;1315,100; | G1550: 5138,100;5131,100; | H1550: 130+26*LV*0.6 | I1550: 45+10.5*LV*0.6 | J1550: 32+9*LV*0.6 | K1550: 24+5*LV*0.6 | L1550: 13+3*LV*0.6 | M1550: 100000 | N1550: 0 | O1550: math.max(0,(lv/10)-1) | P1550: math.max(0,(lv/10)-1) | Q1550: math.max(0,(lv/10)-1) | R1550: 0; | S1550: 有药王谷和盘丝洞的弟子在，真是不爽，还是跑路算了！ | T1550: 药王谷和盘丝洞的弟子不在眼前，真是轻松愉快啊！ | U1550: 0 | V1550: 0,0; | W1550: 3
A1551: 20222 | B1551: 喽啰 | C1551: partner_1001 | D1551: 0 | E1551: 0 | F1551: 1311,100;1312,100;1315,100; | G1551: 5138,100;5131,100; | H1551: 130+26*LV*0.6 | I1551: 45+10.5*LV*0.6 | J1551: 32+9*LV*0.6 | K1551: 24+5*LV*0.6 | L1551: 13+3*LV*0.6 | M1551: 100000 | N1551: 0 | O1551: math.max(0,(lv/10)-1) | P1551: math.max(0,(lv/10)-1) | Q1551: math.max(0,(lv/10)-1) | R1551: 0; | S1551: 有药王谷和盘丝洞的弟子在，真是不爽，还是跑路算了！ | T1551: 药王谷和盘丝洞的弟子不在眼前，真是轻松愉快啊！ | U1551: 0 | V1551: 0,0; | W1551: 3
A1552: 20223 | B1552: 喽啰 | C1552: partner_1009 | D1552: 0 | E1552: 0 | F1552: 1211,100;1212,100;1216,100;5310,100; | G1552: 5138,100;5131,100; | H1552: 130+26*LV*0.6 | I1552: 45+10.5*LV*0.6 | J1552: 32+9*LV*0.6 | K1552: 24+5*LV*0.6 | L1552: 13+3*LV*0.6 | M1552: 100000 | N1552: 0 | O1552: math.max(0,(lv/10)-1) | P1552: math.max(0,(lv/10)-1) | Q1552: math.max(0,(lv/10)-1) | R1552: 0; | S1552: 有药王谷和盘丝洞的弟子在，真是不爽，还是跑路算了！ | T1552: 药王谷和盘丝洞的弟子不在眼前，真是轻松愉快啊！ | U1552: 0 | V1552: 0,0; | W1552: 3
A1553: 20224 | B1553: 喽啰 | C1553: partner_1004 | D1553: 0 | E1553: 0 | F1553: 1211,100;1212,100;1216,100;5310,100; | G1553: 5138,100;5131,100; | H1553: 130+26*LV*0.6 | I1553: 45+10.5*LV*0.6 | J1553: 32+9*LV*0.6 | K1553: 24+5*LV*0.6 | L1553: 13+3*LV*0.6 | M1553: 100000 | N1553: 0 | O1553: math.max(0,(lv/10)-1) | P1553: math.max(0,(lv/10)-1) | Q1553: math.max(0,(lv/10)-1) | R1553: 0; | S1553: 有药王谷和盘丝洞的弟子在，真是不爽，还是跑路算了！ | T1553: 药王谷和盘丝洞的弟子不在眼前，真是轻松愉快啊！ | U1553: 0 | V1553: 0,0; | W1553: 3
A1554: 20225 | B1554: 喽啰 | C1554: pet_21 | D1554: 0 | E1554: 0 | F1554: 1311,100;1312,100;1315,100; | G1554: 5138,100;5131,100; | H1554: 130+26*LV*0.6 | I1554: 45+10.5*LV*0.6 | J1554: 32+9*LV*0.6 | K1554: 24+5*LV*0.6 | L1554: 13+3*LV*0.6 | M1554: 100000 | N1554: 0 | O1554: math.max(0,(lv/10)-1) | P1554: math.max(0,(lv/10)-1) | Q1554: math.max(0,(lv/10)-1) | R1554: 0; | S1554: 有药王谷和盘丝洞的弟子在，真是不爽，还是跑路算了！ | T1554: 药王谷和盘丝洞的弟子不在眼前，真是轻松愉快啊！ | U1554: 0 | V1554: 0,0; | W1554: 3
A1555: 20226 | B1555: 喽啰 | C1555: pet_72 | D1555: 0 | E1555: 0 | F1555: 1311,100;1312,100;1315,100; | G1555: 5138,100;5131,100; | H1555: 130+26*LV*0.6 | I1555: 45+10.5*LV*0.6 | J1555: 32+9*LV*0.6 | K1555: 24+5*LV*0.6 | L1555: 13+3*LV*0.6 | M1555: 100000 | N1555: 0 | O1555: math.max(0,(lv/10)-1) | P1555: math.max(0,(lv/10)-1) | Q1555: math.max(0,(lv/10)-1) | R1555: 0; | S1555: 有药王谷和盘丝洞的弟子在，真是不爽，还是跑路算了！ | T1555: 药王谷和盘丝洞的弟子不在眼前，真是轻松愉快啊！ | U1555: 0 | V1555: 0,0; | W1555: 3
A1556: 20227 | B1556: 喽啰 | C1556: pet_42 | D1556: 0 | E1556: 0 | F1556: 1211,100;1212,100;1216,100;5310,100; | G1556: 5138,100;5131,100; | H1556: 130+26*LV*0.6 | I1556: 45+10.5*LV*0.6 | J1556: 32+9*LV*0.6 | K1556: 24+5*LV*0.6 | L1556: 13+3*LV*0.6 | M1556: 100000 | N1556: 0 | O1556: math.max(0,(lv/10)-1) | P1556: math.max(0,(lv/10)-1) | Q1556: math.max(0,(lv/10)-1) | R1556: 0; | S1556: 有药王谷和盘丝洞的弟子在，真是不爽，还是跑路算了！ | T1556: 药王谷和盘丝洞的弟子不在眼前，真是轻松愉快啊！ | U1556: 0 | V1556: 0,0; | W1556: 3
A1557: 20228 | B1557: 喽啰 | C1557: pet_42 | D1557: 0 | E1557: 0 | F1557: 1211,100;1212,100;1216,100;5310,100; | G1557: 5138,100;5131,100; | H1557: 130+26*LV*0.6 | I1557: 45+10.5*LV*0.6 | J1557: 32+9*LV*0.6 | K1557: 24+5*LV*0.6 | L1557: 13+3*LV*0.6 | M1557: 100000 | N1557: 0 | O1557: math.max(0,(lv/10)-1) | P1557: math.max(0,(lv/10)-1) | Q1557: math.max(0,(lv/10)-1) | R1557: 0; | S1557: 有药王谷和盘丝洞的弟子在，真是不爽，还是跑路算了！ | T1557: 药王谷和盘丝洞的弟子不在眼前，真是轻松愉快啊！ | U1557: 0 | V1557: 0,0; | W1557: 3
A1558: 20229 | B1558: 喽啰 | C1558: pet_72 | D1558: 0 | E1558: 0 | F1558: 1311,100;1312,100;1315,100; | G1558: 5138,100;5131,100; | H1558: 130+26*LV*0.6 | I1558: 45+10.5*LV*0.6 | J1558: 32+9*LV*0.6 | K1558: 24+5*LV*0.6 | L1558: 13+3*LV*0.6 | M1558: 100000 | N1558: 0 | O1558: math.max(0,(lv/10)-1) | P1558: math.max(0,(lv/10)-1) | Q1558: math.max(0,(lv/10)-1) | R1558: 0; | S1558: 有药王谷和盘丝洞的弟子在，真是不爽，还是跑路算了！ | T1558: 药王谷和盘丝洞的弟子不在眼前，真是轻松愉快啊！ | U1558: 0 | V1558: 0,0; | W1558: 3
A1559: 20230 | B1559: 喽啰 | C1559: hero_1001 | D1559: 0 | E1559: 0 | F1559: 1311,100;1312,100;1315,100; | G1559: 5138,100;5131,100; | H1559: 130+26*LV*0.6 | I1559: 45+10.5*LV*0.6 | J1559: 32+9*LV*0.6 | K1559: 24+5*LV*0.6 | L1559: 13+3*LV*0.6 | M1559: 100000 | N1559: 0 | O1559: math.max(0,(lv/10)-1) | P1559: math.max(0,(lv/10)-1) | Q1559: math.max(0,(lv/10)-1) | R1559: 0; | S1559: 有药王谷和盘丝洞的弟子在，真是不爽，还是跑路算了！ | T1559: 药王谷和盘丝洞的弟子不在眼前，真是轻松愉快啊！ | U1559: 0 | V1559: 0,0; | W1559: 3
A1560: 20231 | B1560: 喽啰 | C1560: partner_1002 | D1560: 0 | E1560: 0 | F1560: 1311,100;1312,100;1315,100; | G1560: 5138,100;5131,100; | H1560: 130+26*LV*0.6 | I1560: 45+10.5*LV*0.6 | J1560: 32+9*LV*0.6 | K1560: 24+5*LV*0.6 | L1560: 13+3*LV*0.6 | M1560: 100000 | N1560: 0 | O1560: math.max(0,(lv/10)-1) | P1560: math.max(0,(lv/10)-1) | Q1560: math.max(0,(lv/10)-1) | R1560: 0; | S1560: 有药王谷和盘丝洞的弟子在，真是不爽，还是跑路算了！ | T1560: 药王谷和盘丝洞的弟子不在眼前，真是轻松愉快啊！ | U1560: 0 | V1560: 0,0; | W1560: 3
A1561: 20232 | B1561: 喽啰 | C1561: partner_1009 | D1561: 0 | E1561: 0 | F1561: 1211,100;1212,100;1216,100;5310,100; | G1561: 5138,100;5131,100; | H1561: 130+26*LV*0.6 | I1561: 45+10.5*LV*0.6 | J1561: 32+9*LV*0.6 | K1561: 24+5*LV*0.6 | L1561: 13+3*LV*0.6 | M1561: 100000 | N1561: 0 | O1561: math.max(0,(lv/10)-1) | P1561: math.max(0,(lv/10)-1) | Q1561: math.max(0,(lv/10)-1) | R1561: 0; | S1561: 有药王谷和盘丝洞的弟子在，真是不爽，还是跑路算了！ | T1561: 药王谷和盘丝洞的弟子不在眼前，真是轻松愉快啊！ | U1561: 0 | V1561: 0,0; | W1561: 3
A1562: 20233 | B1562: 喽啰 | C1562: pet_63 | D1562: 0 | E1562: 0 | F1562: 1311,100;1312,100;1315,100; | G1562: 5138,100;5131,100; | H1562: 130+26*LV*0.6 | I1562: 45+10.5*LV*0.6 | J1562: 32+9*LV*0.6 | K1562: 24+5*LV*0.6 | L1562: 13+3*LV*0.6 | M1562: 100000 | N1562: 0 | O1562: math.max(0,(lv/10)-1) | P1562: math.max(0,(lv/10)-1) | Q1562: math.max(0,(lv/10)-1) | R1562: 0; | S1562: 有药王谷和盘丝洞的弟子在，真是不爽，还是跑路算了！ | T1562: 药王谷和盘丝洞的弟子不在眼前，真是轻松愉快啊！ | U1562: 0 | V1562: 0,0; | W1562: 3
A1563: 20234 | B1563: 喽啰 | C1563: hero_1001 | D1563: 0 | E1563: 0 | F1563: 1311,100;1312,100;1315,100; | G1563: 5138,100;5131,100; | H1563: 130+26*LV*0.6 | I1563: 45+10.5*LV*0.6 | J1563: 32+9*LV*0.6 | K1563: 24+5*LV*0.6 | L1563: 13+3*LV*0.6 | M1563: 100000 | N1563: 0 | O1563: math.max(0,(lv/10)-1) | P1563: math.max(0,(lv/10)-1) | Q1563: math.max(0,(lv/10)-1) | R1563: 0; | S1563: 有药王谷和盘丝洞的弟子在，真是不爽，还是跑路算了！ | T1563: 药王谷和盘丝洞的弟子不在眼前，真是轻松愉快啊！ | U1563: 0 | V1563: 0,0; | W1563: 3
A1564: 20235 | B1564: 喽啰 | C1564: pet_42 | D1564: 0 | E1564: 0 | F1564: 1211,100;1212,100;1216,100;5310,100; | G1564: 5138,100;5131,100; | H1564: 130+26*LV*0.6 | I1564: 45+10.5*LV*0.6 | J1564: 32+9*LV*0.6 | K1564: 24+5*LV*0.6 | L1564: 13+3*LV*0.6 | M1564: 100000 | N1564: 0 | O1564: math.max(0,(lv/10)-1) | P1564: math.max(0,(lv/10)-1) | Q1564: math.max(0,(lv/10)-1) | R1564: 0; | S1564: 有药王谷和盘丝洞的弟子在，真是不爽，还是跑路算了！ | T1564: 药王谷和盘丝洞的弟子不在眼前，真是轻松愉快啊！ | U1564: 0 | V1564: 0,0; | W1564: 3
A1565: 20236 | B1565: 喽啰 | C1565: hero_1001 | D1565: 0 | E1565: 0 | F1565: 1211,100;1212,100;1216,100;5310,100; | G1565: 5138,100;5131,100; | H1565: 130+26*LV*0.6 | I1565: 45+10.5*LV*0.6 | J1565: 32+9*LV*0.6 | K1565: 24+5*LV*0.6 | L1565: 13+3*LV*0.6 | M1565: 100000 | N1565: 0 | O1565: math.max(0,(lv/10)-1) | P1565: math.max(0,(lv/10)-1) | Q1565: math.max(0,(lv/10)-1) | R1565: 0; | S1565: 有药王谷和盘丝洞的弟子在，真是不爽，还是跑路算了！ | T1565: 药王谷和盘丝洞的弟子不在眼前，真是轻松愉快啊！ | U1565: 0 | V1565: 0,0; | W1565: 3
A1566: 20237 | B1566: 喽啰 | C1566: pet_22 | D1566: 0 | E1566: 0 | F1566: 1311,100;1312,100;1315,100; | G1566: 5138,100;5131,100; | H1566: 130+26*LV*0.6 | I1566: 45+10.5*LV*0.6 | J1566: 32+9*LV*0.6 | K1566: 24+5*LV*0.6 | L1566: 13+3*LV*0.6 | M1566: 100000 | N1566: 0 | O1566: math.max(0,(lv/10)-1) | P1566: math.max(0,(lv/10)-1) | Q1566: math.max(0,(lv/10)-1) | R1566: 0; | S1566: 有药王谷和盘丝洞的弟子在，真是不爽，还是跑路算了！ | T1566: 药王谷和盘丝洞的弟子不在眼前，真是轻松愉快啊！ | U1566: 0 | V1566: 0,0; | W1566: 3
A1567: 20238 | B1567: 喽啰 | C1567: pet_63 | D1567: 0 | E1567: 0 | F1567: 1311,100;1312,100;1315,100; | G1567: 5138,100;5131,100; | H1567: 130+26*LV*0.6 | I1567: 45+10.5*LV*0.6 | J1567: 32+9*LV*0.6 | K1567: 24+5*LV*0.6 | L1567: 13+3*LV*0.6 | M1567: 100000 | N1567: 0 | O1567: math.max(0,(lv/10)-1) | P1567: math.max(0,(lv/10)-1) | Q1567: math.max(0,(lv/10)-1) | R1567: 0; | S1567: 有药王谷和盘丝洞的弟子在，真是不爽，还是跑路算了！ | T1567: 药王谷和盘丝洞的弟子不在眼前，真是轻松愉快啊！ | U1567: 0 | V1567: 0,0; | W1567: 3
A1568: 20239 | B1568: 喽啰 | C1568: partner_1009 | D1568: 0 | E1568: 0 | F1568: 1311,100;1312,100;1315,100; | G1568: 5138,100;5131,100; | H1568: 130+26*LV*0.6 | I1568: 45+10.5*LV*0.6 | J1568: 32+9*LV*0.6 | K1568: 24+5*LV*0.6 | L1568: 13+3*LV*0.6 | M1568: 100000 | N1568: 0 | O1568: math.max(0,(lv/10)-1) | P1568: math.max(0,(lv/10)-1) | Q1568: math.max(0,(lv/10)-1) | R1568: 0; | S1568: 有药王谷和盘丝洞的弟子在，真是不爽，还是跑路算了！ | T1568: 药王谷和盘丝洞的弟子不在眼前，真是轻松愉快啊！ | U1568: 0 | V1568: 0,0; | W1568: 3
A1569: 20240 | B1569: 喽啰 | C1569: partner_1002 | D1569: 0 | E1569: 0 | F1569: 1211,100;1212,100;1216,100;5310,100; | G1569: 5138,100;5131,100; | H1569: 130+26*LV*0.6 | I1569: 45+10.5*LV*0.6 | J1569: 32+9*LV*0.6 | K1569: 24+5*LV*0.6 | L1569: 13+3*LV*0.6 | M1569: 100000 | N1569: 0 | O1569: math.max(0,(lv/10)-1) | P1569: math.max(0,(lv/10)-1) | Q1569: math.max(0,(lv/10)-1) | R1569: 0; | S1569: 有药王谷和盘丝洞的弟子在，真是不爽，还是跑路算了！ | T1569: 药王谷和盘丝洞的弟子不在眼前，真是轻松愉快啊！ | U1569: 0 | V1569: 0,0; | W1569: 3
A1570: 20241 | B1570: 喽啰 | C1570: pet_23 | D1570: 0 | E1570: 0 | F1570: 1211,100;1212,100;1216,100;5310,100; | G1570: 5138,100;5131,100; | H1570: 130+26*LV*0.6 | I1570: 45+10.5*LV*0.6 | J1570: 32+9*LV*0.6 | K1570: 24+5*LV*0.6 | L1570: 13+3*LV*0.6 | M1570: 100000 | N1570: 0 | O1570: math.max(0,(lv/10)-1) | P1570: math.max(0,(lv/10)-1) | Q1570: math.max(0,(lv/10)-1) | R1570: 0; | S1570: 有药王谷和盘丝洞的弟子在，真是不爽，还是跑路算了！ | T1570: 药王谷和盘丝洞的弟子不在眼前，真是轻松愉快啊！ | U1570: 0 | V1570: 0,0; | W1570: 3
A1571: 20242 | B1571: 喽啰 | C1571: pet_23 | D1571: 0 | E1571: 0 | F1571: 1211,100;1212,100;1216,100;5310,100; | G1571: 5138,100;5131,100; | H1571: 130+26*LV*0.6 | I1571: 45+10.5*LV*0.6 | J1571: 32+9*LV*0.6 | K1571: 24+5*LV*0.6 | L1571: 13+3*LV*0.6 | M1571: 100000 | N1571: 0 | O1571: math.max(0,(lv/10)-1) | P1571: math.max(0,(lv/10)-1) | Q1571: math.max(0,(lv/10)-1) | R1571: 0; | S1571: 有药王谷和盘丝洞的弟子在，真是不爽，还是跑路算了！ | T1571: 药王谷和盘丝洞的弟子不在眼前，真是轻松愉快啊！ | U1571: 0 | V1571: 0,0; | W1571: 3
A1572: 20243 | B1572: 喽啰 | C1572: pet_61 | D1572: 0 | E1572: 0 | F1572: 1311,100;1312,100;1315,100; | G1572: 5138,100;5131,100; | H1572: 130+26*LV*0.6 | I1572: 45+10.5*LV*0.6 | J1572: 32+9*LV*0.6 | K1572: 24+5*LV*0.6 | L1572: 13+3*LV*0.6 | M1572: 100000 | N1572: 0 | O1572: math.max(0,(lv/10)-1) | P1572: math.max(0,(lv/10)-1) | Q1572: math.max(0,(lv/10)-1) | R1572: 0; | S1572: 有药王谷和盘丝洞的弟子在，真是不爽，还是跑路算了！ | T1572: 药王谷和盘丝洞的弟子不在眼前，真是轻松愉快啊！ | U1572: 0 | V1572: 0,0; | W1572: 3
A1573: 20244 | B1573: 喽啰 | C1573: pet_63 | D1573: 0 | E1573: 0 | F1573: 1311,100;1312,100;1315,100; | G1573: 5138,100;5131,100; | H1573: 130+26*LV*0.6 | I1573: 45+10.5*LV*0.6 | J1573: 32+9*LV*0.6 | K1573: 24+5*LV*0.6 | L1573: 13+3*LV*0.6 | M1573: 100000 | N1573: 0 | O1573: math.max(0,(lv/10)-1) | P1573: math.max(0,(lv/10)-1) | Q1573: math.max(0,(lv/10)-1) | R1573: 0; | S1573: 有药王谷和盘丝洞的弟子在，真是不爽，还是跑路算了！ | T1573: 药王谷和盘丝洞的弟子不在眼前，真是轻松愉快啊！ | U1573: 0 | V1573: 0,0; | W1573: 3
A1574: 20245 | B1574: 喽啰 | C1574: hero_1001 | D1574: 0 | E1574: 0 | F1574: 1211,100;1212,100;1216,100;5310,100; | G1574: 5138,100;5131,100; | H1574: 130+26*LV*0.6 | I1574: 45+10.5*LV*0.6 | J1574: 32+9*LV*0.6 | K1574: 24+5*LV*0.6 | L1574: 13+3*LV*0.6 | M1574: 100000 | N1574: 0 | O1574: math.max(0,(lv/10)-1) | P1574: math.max(0,(lv/10)-1) | Q1574: math.max(0,(lv/10)-1) | R1574: 0; | S1574: 有药王谷和盘丝洞的弟子在，真是不爽，还是跑路算了！ | T1574: 药王谷和盘丝洞的弟子不在眼前，真是轻松愉快啊！ | U1574: 0 | V1574: 0,0; | W1574: 3
A1575: 20246 | B1575: 喽啰 | C1575: pet_22 | D1575: 0 | E1575: 0 | F1575: 1311,100;1312,100;1315,100; | G1575: 5138,100;5131,100; | H1575: 130+26*LV*0.6 | I1575: 45+10.5*LV*0.6 | J1575: 32+9*LV*0.6 | K1575: 24+5*LV*0.6 | L1575: 13+3*LV*0.6 | M1575: 100000 | N1575: 0 | O1575: math.max(0,(lv/10)-1) | P1575: math.max(0,(lv/10)-1) | Q1575: math.max(0,(lv/10)-1) | R1575: 0; | S1575: 有药王谷和盘丝洞的弟子在，真是不爽，还是跑路算了！ | T1575: 药王谷和盘丝洞的弟子不在眼前，真是轻松愉快啊！ | U1575: 0 | V1575: 0,0; | W1575: 3
A1576: 20247 | B1576: 喽啰 | C1576: pet_62 | D1576: 0 | E1576: 0 | F1576: 1211,100;1212,100;1216,100;5310,100; | G1576: 5138,100;5131,100; | H1576: 130+26*LV*0.6 | I1576: 45+10.5*LV*0.6 | J1576: 32+9*LV*0.6 | K1576: 24+5*LV*0.6 | L1576: 13+3*LV*0.6 | M1576: 100000 | N1576: 0 | O1576: math.max(0,(lv/10)-1) | P1576: math.max(0,(lv/10)-1) | Q1576: math.max(0,(lv/10)-1) | R1576: 0; | S1576: 有药王谷和盘丝洞的弟子在，真是不爽，还是跑路算了！ | T1576: 药王谷和盘丝洞的弟子不在眼前，真是轻松愉快啊！ | U1576: 0 | V1576: 0,0; | W1576: 3
A1577: 20248 | B1577: 喽啰 | C1577: pet_21 | D1577: 0 | E1577: 0 | F1577: 1311,100;1312,100;1315,100; | G1577: 5138,100;5131,100; | H1577: 130+26*LV*0.6 | I1577: 45+10.5*LV*0.6 | J1577: 32+9*LV*0.6 | K1577: 24+5*LV*0.6 | L1577: 13+3*LV*0.6 | M1577: 100000 | N1577: 0 | O1577: math.max(0,(lv/10)-1) | P1577: math.max(0,(lv/10)-1) | Q1577: math.max(0,(lv/10)-1) | R1577: 0; | S1577: 有药王谷和盘丝洞的弟子在，真是不爽，还是跑路算了！ | T1577: 药王谷和盘丝洞的弟子不在眼前，真是轻松愉快啊！ | U1577: 0 | V1577: 0,0; | W1577: 3
A1578: 20249 | B1578: 喽啰 | C1578: pet_21 | D1578: 0 | E1578: 0 | F1578: 1211,100;1212,100;1216,100;5310,100; | G1578: 5138,100;5131,100; | H1578: 130+26*LV*0.6 | I1578: 45+10.5*LV*0.6 | J1578: 32+9*LV*0.6 | K1578: 24+5*LV*0.6 | L1578: 13+3*LV*0.6 | M1578: 100000 | N1578: 0 | O1578: math.max(0,(lv/10)-1) | P1578: math.max(0,(lv/10)-1) | Q1578: math.max(0,(lv/10)-1) | R1578: 0; | S1578: 有药王谷和盘丝洞的弟子在，真是不爽，还是跑路算了！ | T1578: 药王谷和盘丝洞的弟子不在眼前，真是轻松愉快啊！ | U1578: 0 | V1578: 0,0; | W1578: 3
A1579: 20250 | B1579: 喽啰 | C1579: pet_81 | D1579: 0 | E1579: 0 | F1579: 1211,100;1212,100;1216,100;5310,100; | G1579: 5138,100;5131,100; | H1579: 130+26*LV*0.6 | I1579: 45+10.5*LV*0.6 | J1579: 32+9*LV*0.6 | K1579: 24+5*LV*0.6 | L1579: 13+3*LV*0.6 | M1579: 100000 | N1579: 0 | O1579: math.max(0,(lv/10)-1) | P1579: math.max(0,(lv/10)-1) | Q1579: math.max(0,(lv/10)-1) | R1579: 0; | S1579: 有药王谷和盘丝洞的弟子在，真是不爽，还是跑路算了！ | T1579: 药王谷和盘丝洞的弟子不在眼前，真是轻松愉快啊！ | U1579: 0 | V1579: 0,0; | W1579: 3
A1580: 20251 | B1580: 喽啰 | C1580: pet_53 | D1580: 0 | E1580: 0 | F1580: 1311,100;1312,100;1315,100; | G1580: 5138,100;5131,100; | H1580: 130+26*LV*0.6 | I1580: 45+10.5*LV*0.6 | J1580: 32+9*LV*0.6 | K1580: 24+5*LV*0.6 | L1580: 13+3*LV*0.6 | M1580: 100000 | N1580: 0 | O1580: math.max(0,(lv/10)-1) | P1580: math.max(0,(lv/10)-1) | Q1580: math.max(0,(lv/10)-1) | R1580: 0; | S1580: 有药王谷和盘丝洞的弟子在，真是不爽，还是跑路算了！ | T1580: 药王谷和盘丝洞的弟子不在眼前，真是轻松愉快啊！ | U1580: 0 | V1580: 0,0; | W1580: 3
A1581: 20252 | B1581: 喽啰 | C1581: pet_61 | D1581: 0 | E1581: 0 | F1581: 1311,100;1312,100;1315,100; | G1581: 5138,100;5131,100; | H1581: 130+26*LV*0.6 | I1581: 45+10.5*LV*0.6 | J1581: 32+9*LV*0.6 | K1581: 24+5*LV*0.6 | L1581: 13+3*LV*0.6 | M1581: 100000 | N1581: 0 | O1581: math.max(0,(lv/10)-1) | P1581: math.max(0,(lv/10)-1) | Q1581: math.max(0,(lv/10)-1) | R1581: 0; | S1581: 有药王谷和盘丝洞的弟子在，真是不爽，还是跑路算了！ | T1581: 药王谷和盘丝洞的弟子不在眼前，真是轻松愉快啊！ | U1581: 0 | V1581: 0,0; | W1581: 3
A1582: 20253 | B1582: 喽啰 | C1582: partner_1010 | D1582: 0 | E1582: 0 | F1582: 1311,100;1312,100;1315,100; | G1582: 5138,100;5131,100; | H1582: 130+26*LV*0.6 | I1582: 45+10.5*LV*0.6 | J1582: 32+9*LV*0.6 | K1582: 24+5*LV*0.6 | L1582: 13+3*LV*0.6 | M1582: 100000 | N1582: 0 | O1582: math.max(0,(lv/10)-1) | P1582: math.max(0,(lv/10)-1) | Q1582: math.max(0,(lv/10)-1) | R1582: 0; | S1582: 有药王谷和盘丝洞的弟子在，真是不爽，还是跑路算了！ | T1582: 药王谷和盘丝洞的弟子不在眼前，真是轻松愉快啊！ | U1582: 0 | V1582: 0,0; | W1582: 3
A1583: 20254 | B1583: 喽啰 | C1583: pet_63 | D1583: 0 | E1583: 0 | F1583: 1211,100;1212,100;1216,100;5310,100; | G1583: 5138,100;5131,100; | H1583: 130+26*LV*0.6 | I1583: 45+10.5*LV*0.6 | J1583: 32+9*LV*0.6 | K1583: 24+5*LV*0.6 | L1583: 13+3*LV*0.6 | M1583: 100000 | N1583: 0 | O1583: math.max(0,(lv/10)-1) | P1583: math.max(0,(lv/10)-1) | Q1583: math.max(0,(lv/10)-1) | R1583: 0; | S1583: 有药王谷和盘丝洞的弟子在，真是不爽，还是跑路算了！ | T1583: 药王谷和盘丝洞的弟子不在眼前，真是轻松愉快啊！ | U1583: 0 | V1583: 0,0; | W1583: 3
A1584: 20255 | B1584: 喽啰 | C1584: hero_1001 | D1584: 0 | E1584: 0 | F1584: 1311,100;1312,100;1315,100; | G1584: 5138,100;5131,100; | H1584: 130+26*LV*0.6 | I1584: 45+10.5*LV*0.6 | J1584: 32+9*LV*0.6 | K1584: 24+5*LV*0.6 | L1584: 13+3*LV*0.6 | M1584: 100000 | N1584: 0 | O1584: math.max(0,(lv/10)-1) | P1584: math.max(0,(lv/10)-1) | Q1584: math.max(0,(lv/10)-1) | R1584: 0; | S1584: 有药王谷和盘丝洞的弟子在，真是不爽，还是跑路算了！ | T1584: 药王谷和盘丝洞的弟子不在眼前，真是轻松愉快啊！ | U1584: 0 | V1584: 0,0; | W1584: 3
A1585: 20256 | B1585: 喽啰 | C1585: pet_22 | D1585: 0 | E1585: 0 | F1585: 1311,100;1312,100;1315,100; | G1585: 5138,100;5131,100; | H1585: 130+26*LV*0.6 | I1585: 45+10.5*LV*0.6 | J1585: 32+9*LV*0.6 | K1585: 24+5*LV*0.6 | L1585: 13+3*LV*0.6 | M1585: 100000 | N1585: 0 | O1585: math.max(0,(lv/10)-1) | P1585: math.max(0,(lv/10)-1) | Q1585: math.max(0,(lv/10)-1) | R1585: 0; | S1585: 有药王谷和盘丝洞的弟子在，真是不爽，还是跑路算了！ | T1585: 药王谷和盘丝洞的弟子不在眼前，真是轻松愉快啊！ | U1585: 0 | V1585: 0,0; | W1585: 3
A1586: 20257 | B1586: 喽啰 | C1586: pet_21 | D1586: 0 | E1586: 0 | F1586: 1311,100;1312,100;1315,100; | G1586: 5138,100;5131,100; | H1586: 130+26*LV*0.6 | I1586: 45+10.5*LV*0.6 | J1586: 32+9*LV*0.6 | K1586: 24+5*LV*0.6 | L1586: 13+3*LV*0.6 | M1586: 100000 | N1586: 0 | O1586: math.max(0,(lv/10)-1) | P1586: math.max(0,(lv/10)-1) | Q1586: math.max(0,(lv/10)-1) | R1586: 0; | S1586: 有药王谷和盘丝洞的弟子在，真是不爽，还是跑路算了！ | T1586: 药王谷和盘丝洞的弟子不在眼前，真是轻松愉快啊！ | U1586: 0 | V1586: 0,0; | W1586: 3
A1587: 20258 | B1587: 喽啰 | C1587: pet_61 | D1587: 0 | E1587: 0 | F1587: 1311,100;1312,100;1315,100; | G1587: 5138,100;5131,100; | H1587: 130+26*LV*0.6 | I1587: 45+10.5*LV*0.6 | J1587: 32+9*LV*0.6 | K1587: 24+5*LV*0.6 | L1587: 13+3*LV*0.6 | M1587: 100000 | N1587: 0 | O1587: math.max(0,(lv/10)-1) | P1587: math.max(0,(lv/10)-1) | Q1587: math.max(0,(lv/10)-1) | R1587: 0; | S1587: 有药王谷和盘丝洞的弟子在，真是不爽，还是跑路算了！ | T1587: 药王谷和盘丝洞的弟子不在眼前，真是轻松愉快啊！ | U1587: 0 | V1587: 0,0; | W1587: 3
A1588: 20259 | B1588: 喽啰 | C1588: pet_23 | D1588: 0 | E1588: 0 | F1588: 1211,100;1212,100;1216,100;5310,100; | G1588: 5138,100;5131,100; | H1588: 130+26*LV*0.6 | I1588: 45+10.5*LV*0.6 | J1588: 32+9*LV*0.6 | K1588: 24+5*LV*0.6 | L1588: 13+3*LV*0.6 | M1588: 100000 | N1588: 0 | O1588: math.max(0,(lv/10)-1) | P1588: math.max(0,(lv/10)-1) | Q1588: math.max(0,(lv/10)-1) | R1588: 0; | S1588: 有药王谷和盘丝洞的弟子在，真是不爽，还是跑路算了！ | T1588: 药王谷和盘丝洞的弟子不在眼前，真是轻松愉快啊！ | U1588: 0 | V1588: 0,0; | W1588: 3
A1589: 20260 | B1589: 喽啰 | C1589: pet_63 | D1589: 0 | E1589: 0 | F1589: 1311,100;1312,100;1315,100; | G1589: 5138,100;5131,100; | H1589: 130+26*LV*0.6 | I1589: 45+10.5*LV*0.6 | J1589: 32+9*LV*0.6 | K1589: 24+5*LV*0.6 | L1589: 13+3*LV*0.6 | M1589: 100000 | N1589: 0 | O1589: math.max(0,(lv/10)-1) | P1589: math.max(0,(lv/10)-1) | Q1589: math.max(0,(lv/10)-1) | R1589: 0; | S1589: 有药王谷和盘丝洞的弟子在，真是不爽，还是跑路算了！ | T1589: 药王谷和盘丝洞的弟子不在眼前，真是轻松愉快啊！ | U1589: 0 | V1589: 0,0; | W1589: 3
A1590: 20261 | B1590: 喽啰 | C1590: partner_1009 | D1590: 0 | E1590: 0 | F1590: 1211,100;1212,100;1216,100;5310,100; | G1590: 5138,100;5131,100; | H1590: 130+26*LV*0.6 | I1590: 45+10.5*LV*0.6 | J1590: 32+9*LV*0.6 | K1590: 24+5*LV*0.6 | L1590: 13+3*LV*0.6 | M1590: 100000 | N1590: 0 | O1590: math.max(0,(lv/10)-1) | P1590: math.max(0,(lv/10)-1) | Q1590: math.max(0,(lv/10)-1) | R1590: 0; | S1590: 有药王谷和盘丝洞的弟子在，真是不爽，还是跑路算了！ | T1590: 药王谷和盘丝洞的弟子不在眼前，真是轻松愉快啊！ | U1590: 0 | V1590: 0,0; | W1590: 3
A1591: 20262 | B1591: 喽啰 | C1591: pet_62 | D1591: 0 | E1591: 0 | F1591: 1311,100;1312,100;1315,100; | G1591: 5138,100;5131,100; | H1591: 130+26*LV*0.6 | I1591: 45+10.5*LV*0.6 | J1591: 32+9*LV*0.6 | K1591: 24+5*LV*0.6 | L1591: 13+3*LV*0.6 | M1591: 100000 | N1591: 0 | O1591: math.max(0,(lv/10)-1) | P1591: math.max(0,(lv/10)-1) | Q1591: math.max(0,(lv/10)-1) | R1591: 0; | S1591: 有药王谷和盘丝洞的弟子在，真是不爽，还是跑路算了！ | T1591: 药王谷和盘丝洞的弟子不在眼前，真是轻松愉快啊！ | U1591: 0 | V1591: 0,0; | W1591: 3
A1592: 20263 | B1592: 喽啰 | C1592: pet_73 | D1592: 0 | E1592: 0 | F1592: 1311,100;1312,100;1315,100; | G1592: 5138,100;5131,100; | H1592: 130+26*LV*0.6 | I1592: 45+10.5*LV*0.6 | J1592: 32+9*LV*0.6 | K1592: 24+5*LV*0.6 | L1592: 13+3*LV*0.6 | M1592: 100000 | N1592: 0 | O1592: math.max(0,(lv/10)-1) | P1592: math.max(0,(lv/10)-1) | Q1592: math.max(0,(lv/10)-1) | R1592: 0; | S1592: 有药王谷和盘丝洞的弟子在，真是不爽，还是跑路算了！ | T1592: 药王谷和盘丝洞的弟子不在眼前，真是轻松愉快啊！ | U1592: 0 | V1592: 0,0; | W1592: 3
A1593: 20264 | B1593: 喽啰 | C1593: pet_21 | D1593: 0 | E1593: 0 | F1593: 1211,100;1212,100;1216,100;5310,100; | G1593: 5138,100;5131,100; | H1593: 130+26*LV*0.6 | I1593: 45+10.5*LV*0.6 | J1593: 32+9*LV*0.6 | K1593: 24+5*LV*0.6 | L1593: 13+3*LV*0.6 | M1593: 100000 | N1593: 0 | O1593: math.max(0,(lv/10)-1) | P1593: math.max(0,(lv/10)-1) | Q1593: math.max(0,(lv/10)-1) | R1593: 0; | S1593: 有药王谷和盘丝洞的弟子在，真是不爽，还是跑路算了！ | T1593: 药王谷和盘丝洞的弟子不在眼前，真是轻松愉快啊！ | U1593: 0 | V1593: 0,0; | W1593: 3
A1594: 20265 | B1594: 喽啰 | C1594: pet_62 | D1594: 0 | E1594: 0 | F1594: 1311,100;1312,100;1315,100; | G1594: 5138,100;5131,100; | H1594: 130+26*LV*0.6 | I1594: 45+10.5*LV*0.6 | J1594: 32+9*LV*0.6 | K1594: 24+5*LV*0.6 | L1594: 13+3*LV*0.6 | M1594: 100000 | N1594: 0 | O1594: math.max(0,(lv/10)-1) | P1594: math.max(0,(lv/10)-1) | Q1594: math.max(0,(lv/10)-1) | R1594: 0; | S1594: 有药王谷和盘丝洞的弟子在，真是不爽，还是跑路算了！ | T1594: 药王谷和盘丝洞的弟子不在眼前，真是轻松愉快啊！ | U1594: 0 | V1594: 0,0; | W1594: 3
A1595: 20266 | B1595: 喽啰 | C1595: pet_63 | D1595: 0 | E1595: 0 | F1595: 1311,100;1312,100;1315,100; | G1595: 5138,100;5131,100; | H1595: 130+26*LV*0.6 | I1595: 45+10.5*LV*0.6 | J1595: 32+9*LV*0.6 | K1595: 24+5*LV*0.6 | L1595: 13+3*LV*0.6 | M1595: 100000 | N1595: 0 | O1595: math.max(0,(lv/10)-1) | P1595: math.max(0,(lv/10)-1) | Q1595: math.max(0,(lv/10)-1) | R1595: 0; | S1595: 有药王谷和盘丝洞的弟子在，真是不爽，还是跑路算了！ | T1595: 药王谷和盘丝洞的弟子不在眼前，真是轻松愉快啊！ | U1595: 0 | V1595: 0,0; | W1595: 3
A1596: 20267 | B1596: 喽啰 | C1596: hero_1001 | D1596: 0 | E1596: 0 | F1596: 1211,100;1212,100;1216,100;5310,100; | G1596: 5138,100;5131,100; | H1596: 130+26*LV*0.6 | I1596: 45+10.5*LV*0.6 | J1596: 32+9*LV*0.6 | K1596: 24+5*LV*0.6 | L1596: 13+3*LV*0.6 | M1596: 100000 | N1596: 0 | O1596: math.max(0,(lv/10)-1) | P1596: math.max(0,(lv/10)-1) | Q1596: math.max(0,(lv/10)-1) | R1596: 0; | S1596: 有药王谷和盘丝洞的弟子在，真是不爽，还是跑路算了！ | T1596: 药王谷和盘丝洞的弟子不在眼前，真是轻松愉快啊！ | U1596: 0 | V1596: 0,0; | W1596: 3
A1597: 20268 | B1597: 喽啰 | C1597: pet_62 | D1597: 0 | E1597: 0 | F1597: 1311,100;1312,100;1315,100; | G1597: 5138,100;5131,100; | H1597: 130+26*LV*0.6 | I1597: 45+10.5*LV*0.6 | J1597: 32+9*LV*0.6 | K1597: 24+5*LV*0.6 | L1597: 13+3*LV*0.6 | M1597: 100000 | N1597: 0 | O1597: math.max(0,(lv/10)-1) | P1597: math.max(0,(lv/10)-1) | Q1597: math.max(0,(lv/10)-1) | R1597: 0; | S1597: 有药王谷和盘丝洞的弟子在，真是不爽，还是跑路算了！ | T1597: 药王谷和盘丝洞的弟子不在眼前，真是轻松愉快啊！ | U1597: 0 | V1597: 0,0; | W1597: 3
A1598: 20269 | B1598: 喽啰 | C1598: pet_23 | D1598: 0 | E1598: 0 | F1598: 1211,100;1212,100;1216,100;5310,100; | G1598: 5138,100;5131,100; | H1598: 130+26*LV*0.6 | I1598: 45+10.5*LV*0.6 | J1598: 32+9*LV*0.6 | K1598: 24+5*LV*0.6 | L1598: 13+3*LV*0.6 | M1598: 100000 | N1598: 0 | O1598: math.max(0,(lv/10)-1) | P1598: math.max(0,(lv/10)-1) | Q1598: math.max(0,(lv/10)-1) | R1598: 0; | S1598: 有药王谷和盘丝洞的弟子在，真是不爽，还是跑路算了！ | T1598: 药王谷和盘丝洞的弟子不在眼前，真是轻松愉快啊！ | U1598: 0 | V1598: 0,0; | W1598: 3
A1599: 20270 | B1599: 喽啰 | C1599: pet_61 | D1599: 0 | E1599: 0 | F1599: 1311,100;1312,100;1315,100; | G1599: 5138,100;5131,100; | H1599: 130+26*LV*0.6 | I1599: 45+10.5*LV*0.6 | J1599: 32+9*LV*0.6 | K1599: 24+5*LV*0.6 | L1599: 13+3*LV*0.6 | M1599: 100000 | N1599: 0 | O1599: math.max(0,(lv/10)-1) | P1599: math.max(0,(lv/10)-1) | Q1599: math.max(0,(lv/10)-1) | R1599: 0; | S1599: 有药王谷和盘丝洞的弟子在，真是不爽，还是跑路算了！ | T1599: 药王谷和盘丝洞的弟子不在眼前，真是轻松愉快啊！ | U1599: 0 | V1599: 0,0; | W1599: 3
A1600: 20271 | B1600: 喽啰 | C1600: pet_62 | D1600: 0 | E1600: 0 | F1600: 1211,100;1212,100;1216,100;5310,100; | G1600: 5138,100;5131,100; | H1600: 130+26*LV*0.6 | I1600: 45+10.5*LV*0.6 | J1600: 32+9*LV*0.6 | K1600: 24+5*LV*0.6 | L1600: 13+3*LV*0.6 | M1600: 100000 | N1600: 0 | O1600: math.max(0,(lv/10)-1) | P1600: math.max(0,(lv/10)-1) | Q1600: math.max(0,(lv/10)-1) | R1600: 0; | S1600: 有药王谷和盘丝洞的弟子在，真是不爽，还是跑路算了！ | T1600: 药王谷和盘丝洞的弟子不在眼前，真是轻松愉快啊！ | U1600: 0 | V1600: 0,0; | W1600: 3
A1601: 20272 | B1601: 喽啰 | C1601: pet_53 | D1601: 0 | E1601: 0 | F1601: 1211,100;1212,100;1216,100;5310,100; | G1601: 5138,100;5131,100; | H1601: 130+26*LV*0.6 | I1601: 45+10.5*LV*0.6 | J1601: 32+9*LV*0.6 | K1601: 24+5*LV*0.6 | L1601: 13+3*LV*0.6 | M1601: 100000 | N1601: 0 | O1601: math.max(0,(lv/10)-1) | P1601: math.max(0,(lv/10)-1) | Q1601: math.max(0,(lv/10)-1) | R1601: 0; | S1601: 有药王谷和盘丝洞的弟子在，真是不爽，还是跑路算了！ | T1601: 药王谷和盘丝洞的弟子不在眼前，真是轻松愉快啊！ | U1601: 0 | V1601: 0,0; | W1601: 3
A1602: 20273 | B1602: 喽啰 | C1602: pet_23 | D1602: 0 | E1602: 0 | F1602: 1311,100;1312,100;1315,100; | G1602: 5138,100;5131,100; | H1602: 130+26*LV*0.6 | I1602: 45+10.5*LV*0.6 | J1602: 32+9*LV*0.6 | K1602: 24+5*LV*0.6 | L1602: 13+3*LV*0.6 | M1602: 100000 | N1602: 0 | O1602: math.max(0,(lv/10)-1) | P1602: math.max(0,(lv/10)-1) | Q1602: math.max(0,(lv/10)-1) | R1602: 0; | S1602: 有药王谷和盘丝洞的弟子在，真是不爽，还是跑路算了！ | T1602: 药王谷和盘丝洞的弟子不在眼前，真是轻松愉快啊！ | U1602: 0 | V1602: 0,0; | W1602: 3
A1603: 20274 | B1603: 喽啰 | C1603: partner_1009 | D1603: 0 | E1603: 0 | F1603: 1311,100;1312,100;1315,100; | G1603: 5138,100;5131,100; | H1603: 130+26*LV*0.6 | I1603: 45+10.5*LV*0.6 | J1603: 32+9*LV*0.6 | K1603: 24+5*LV*0.6 | L1603: 13+3*LV*0.6 | M1603: 100000 | N1603: 0 | O1603: math.max(0,(lv/10)-1) | P1603: math.max(0,(lv/10)-1) | Q1603: math.max(0,(lv/10)-1) | R1603: 0; | S1603: 有药王谷和盘丝洞的弟子在，真是不爽，还是跑路算了！ | T1603: 药王谷和盘丝洞的弟子不在眼前，真是轻松愉快啊！ | U1603: 0 | V1603: 0,0; | W1603: 3
A1604: 20275 | B1604: 喽啰 | C1604: pet_21 | D1604: 0 | E1604: 0 | F1604: 1211,100;1212,100;1216,100;5310,100; | G1604: 5138,100;5131,100; | H1604: 130+26*LV*0.6 | I1604: 45+10.5*LV*0.6 | J1604: 32+9*LV*0.6 | K1604: 24+5*LV*0.6 | L1604: 13+3*LV*0.6 | M1604: 100000 | N1604: 0 | O1604: math.max(0,(lv/10)-1) | P1604: math.max(0,(lv/10)-1) | Q1604: math.max(0,(lv/10)-1) | R1604: 0; | S1604: 有药王谷和盘丝洞的弟子在，真是不爽，还是跑路算了！ | T1604: 药王谷和盘丝洞的弟子不在眼前，真是轻松愉快啊！ | U1604: 0 | V1604: 0,0; | W1604: 3
A1605: 20276 | B1605: 喽啰 | C1605: hero_1001 | D1605: 0 | E1605: 0 | F1605: 1311,100;1312,100;1315,100; | G1605: 5138,100;5131,100; | H1605: 130+26*LV*0.6 | I1605: 45+10.5*LV*0.6 | J1605: 32+9*LV*0.6 | K1605: 24+5*LV*0.6 | L1605: 13+3*LV*0.6 | M1605: 100000 | N1605: 0 | O1605: math.max(0,(lv/10)-1) | P1605: math.max(0,(lv/10)-1) | Q1605: math.max(0,(lv/10)-1) | R1605: 0; | S1605: 有药王谷和盘丝洞的弟子在，真是不爽，还是跑路算了！ | T1605: 药王谷和盘丝洞的弟子不在眼前，真是轻松愉快啊！ | U1605: 0 | V1605: 0,0; | W1605: 3
A1606: 20277 | B1606: 喽啰 | C1606: pet_33 | D1606: 0 | E1606: 0 | F1606: 1211,100;1212,100;1216,100;5310,100; | G1606: 5138,100;5131,100; | H1606: 130+26*LV*0.6 | I1606: 45+10.5*LV*0.6 | J1606: 32+9*LV*0.6 | K1606: 24+5*LV*0.6 | L1606: 13+3*LV*0.6 | M1606: 100000 | N1606: 0 | O1606: math.max(0,(lv/10)-1) | P1606: math.max(0,(lv/10)-1) | Q1606: math.max(0,(lv/10)-1) | R1606: 0; | S1606: 有药王谷和盘丝洞的弟子在，真是不爽，还是跑路算了！ | T1606: 药王谷和盘丝洞的弟子不在眼前，真是轻松愉快啊！ | U1606: 0 | V1606: 0,0; | W1606: 3
A1607: 20278 | B1607: 喽啰 | C1607: pet_23 | D1607: 0 | E1607: 0 | F1607: 1311,100;1312,100;1315,100; | G1607: 5138,100;5131,100; | H1607: 130+26*LV*0.6 | I1607: 45+10.5*LV*0.6 | J1607: 32+9*LV*0.6 | K1607: 24+5*LV*0.6 | L1607: 13+3*LV*0.6 | M1607: 100000 | N1607: 0 | O1607: math.max(0,(lv/10)-1) | P1607: math.max(0,(lv/10)-1) | Q1607: math.max(0,(lv/10)-1) | R1607: 0; | S1607: 有药王谷和盘丝洞的弟子在，真是不爽，还是跑路算了！ | T1607: 药王谷和盘丝洞的弟子不在眼前，真是轻松愉快啊！ | U1607: 0 | V1607: 0,0; | W1607: 3
A1608: 20279 | B1608: 喽啰 | C1608: hero_1001 | D1608: 0 | E1608: 0 | F1608: 1211,100;1212,100;1216,100;5310,100; | G1608: 5138,100;5131,100; | H1608: 130+26*LV*0.6 | I1608: 45+10.5*LV*0.6 | J1608: 32+9*LV*0.6 | K1608: 24+5*LV*0.6 | L1608: 13+3*LV*0.6 | M1608: 100000 | N1608: 0 | O1608: math.max(0,(lv/10)-1) | P1608: math.max(0,(lv/10)-1) | Q1608: math.max(0,(lv/10)-1) | R1608: 0; | S1608: 有药王谷和盘丝洞的弟子在，真是不爽，还是跑路算了！ | T1608: 药王谷和盘丝洞的弟子不在眼前，真是轻松愉快啊！ | U1608: 0 | V1608: 0,0; | W1608: 3
A1609: 20280 | B1609: 喽啰 | C1609: partner_1003 | D1609: 0 | E1609: 0 | F1609: 1211,100;1212,100;1216,100;5310,100; | G1609: 5138,100;5131,100; | H1609: 130+26*LV*0.6 | I1609: 45+10.5*LV*0.6 | J1609: 32+9*LV*0.6 | K1609: 24+5*LV*0.6 | L1609: 13+3*LV*0.6 | M1609: 100000 | N1609: 0 | O1609: math.max(0,(lv/10)-1) | P1609: math.max(0,(lv/10)-1) | Q1609: math.max(0,(lv/10)-1) | R1609: 0; | S1609: 有药王谷和盘丝洞的弟子在，真是不爽，还是跑路算了！ | T1609: 药王谷和盘丝洞的弟子不在眼前，真是轻松愉快啊！ | U1609: 0 | V1609: 0,0; | W1609: 3
A1610: 20281 | B1610: 喽啰 | C1610: pet_1 | D1610: 0 | E1610: 0 | F1610: 1311,100;1312,100;1315,100; | G1610: 5138,100;5131,100; | H1610: 130+26*LV*0.6 | I1610: 45+10.5*LV*0.6 | J1610: 32+9*LV*0.6 | K1610: 24+5*LV*0.6 | L1610: 13+3*LV*0.6 | M1610: 100000 | N1610: 0 | O1610: math.max(0,(lv/5)-1) | P1610: math.max(0,(lv/5)-1) | Q1610: math.max(0,(lv/5)-1) | R1610: 0; | S1610: 有药王谷和盘丝洞的弟子在，真是不爽，还是跑路算了！ | T1610: 药王谷和盘丝洞的弟子不在眼前，真是轻松愉快啊！ | U1610: 0 | V1610: 0,0; | W1610: 3
A1611: 20282 | B1611: 喽啰 | C1611: pet_63 | D1611: 0 | E1611: 0 | F1611: 1211,100;1212,100;1216,100;5310,100; | G1611: 5138,100;5131,100; | H1611: 130+26*LV*0.6 | I1611: 45+10.5*LV*0.6 | J1611: 32+9*LV*0.6 | K1611: 24+5*LV*0.6 | L1611: 13+3*LV*0.6 | M1611: 100000 | N1611: 0 | O1611: math.max(0,(lv/5)-1) | P1611: math.max(0,(lv/5)-1) | Q1611: math.max(0,(lv/5)-1) | R1611: 0; | S1611: 有药王谷和盘丝洞的弟子在，真是不爽，还是跑路算了！ | T1611: 药王谷和盘丝洞的弟子不在眼前，真是轻松愉快啊！ | U1611: 0 | V1611: 0,0; | W1611: 3
A1612: 20283 | B1612: 喽啰 | C1612: pet_62 | D1612: 0 | E1612: 0 | F1612: 1311,100;1312,100;1315,100; | G1612: 5138,100;5131,100; | H1612: 130+26*LV*0.6 | I1612: 45+10.5*LV*0.6 | J1612: 32+9*LV*0.6 | K1612: 24+5*LV*0.6 | L1612: 13+3*LV*0.6 | M1612: 100000 | N1612: 0 | O1612: math.max(0,(lv/5)-1) | P1612: math.max(0,(lv/5)-1) | Q1612: math.max(0,(lv/5)-1) | R1612: 0; | S1612: 有药王谷和盘丝洞的弟子在，真是不爽，还是跑路算了！ | T1612: 药王谷和盘丝洞的弟子不在眼前，真是轻松愉快啊！ | U1612: 0 | V1612: 0,0; | W1612: 3
A1613: 20284 | B1613: 喽啰 | C1613: pet_93 | D1613: 0 | E1613: 0 | F1613: 1211,100;1212,100;1216,100;5310,100; | G1613: 5138,100;5131,100; | H1613: 130+26*LV*0.6 | I1613: 45+10.5*LV*0.6 | J1613: 32+9*LV*0.6 | K1613: 24+5*LV*0.6 | L1613: 13+3*LV*0.6 | M1613: 100000 | N1613: 0 | O1613: math.max(0,(lv/5)-1) | P1613: math.max(0,(lv/5)-1) | Q1613: math.max(0,(lv/5)-1) | R1613: 0; | S1613: 有药王谷和盘丝洞的弟子在，真是不爽，还是跑路算了！ | T1613: 药王谷和盘丝洞的弟子不在眼前，真是轻松愉快啊！ | U1613: 0 | V1613: 0,0; | W1613: 3
A1614: 20285 | B1614: 喽啰 | C1614: pet_73 | D1614: 0 | E1614: 0 | F1614: 1311,100;1312,100;1315,100; | G1614: 5138,100;5131,100; | H1614: 130+26*LV*0.6 | I1614: 45+10.5*LV*0.6 | J1614: 32+9*LV*0.6 | K1614: 24+5*LV*0.6 | L1614: 13+3*LV*0.6 | M1614: 100000 | N1614: 0 | O1614: math.max(0,(lv/5)-1) | P1614: math.max(0,(lv/5)-1) | Q1614: math.max(0,(lv/5)-1) | R1614: 0; | S1614: 有药王谷和盘丝洞的弟子在，真是不爽，还是跑路算了！ | T1614: 药王谷和盘丝洞的弟子不在眼前，真是轻松愉快啊！ | U1614: 0 | V1614: 0,0; | W1614: 3
A1615: 20286 | B1615: 喽啰 | C1615: pet_83 | D1615: 0 | E1615: 0 | F1615: 1311,100;1312,100;1315,100; | G1615: 5138,100;5131,100; | H1615: 130+26*LV*0.6 | I1615: 45+10.5*LV*0.6 | J1615: 32+9*LV*0.6 | K1615: 24+5*LV*0.6 | L1615: 13+3*LV*0.6 | M1615: 100000 | N1615: 0 | O1615: math.max(0,(lv/5)-1) | P1615: math.max(0,(lv/5)-1) | Q1615: math.max(0,(lv/5)-1) | R1615: 0; | S1615: 有药王谷和盘丝洞的弟子在，真是不爽，还是跑路算了！ | T1615: 药王谷和盘丝洞的弟子不在眼前，真是轻松愉快啊！ | U1615: 0 | V1615: 0,0; | W1615: 3
A1616: 20287 | B1616: 喽啰 | C1616: pet_22 | D1616: 0 | E1616: 0 | F1616: 1311,100;1312,100;1315,100; | G1616: 5138,100;5131,100; | H1616: 130+26*LV*0.6 | I1616: 45+10.5*LV*0.6 | J1616: 32+9*LV*0.6 | K1616: 24+5*LV*0.6 | L1616: 13+3*LV*0.6 | M1616: 100000 | N1616: 0 | O1616: math.max(0,(lv/5)-1) | P1616: math.max(0,(lv/5)-1) | Q1616: math.max(0,(lv/5)-1) | R1616: 0; | S1616: 有药王谷和盘丝洞的弟子在，真是不爽，还是跑路算了！ | T1616: 药王谷和盘丝洞的弟子不在眼前，真是轻松愉快啊！ | U1616: 0 | V1616: 0,0; | W1616: 3
A1617: 20288 | B1617: 喽啰 | C1617: pet_201 | D1617: 0 | E1617: 0 | F1617: 1311,100;1312,100;1315,100; | G1617: 5138,100;5131,100; | H1617: 130+26*LV*0.6 | I1617: 45+10.5*LV*0.6 | J1617: 32+9*LV*0.6 | K1617: 24+5*LV*0.6 | L1617: 13+3*LV*0.6 | M1617: 100000 | N1617: 0 | O1617: math.max(0,(lv/5)-1) | P1617: math.max(0,(lv/5)-1) | Q1617: math.max(0,(lv/5)-1) | R1617: 0; | S1617: 有药王谷和盘丝洞的弟子在，真是不爽，还是跑路算了！ | T1617: 药王谷和盘丝洞的弟子不在眼前，真是轻松愉快啊！ | U1617: 0 | V1617: 0,0; | W1617: 3
A1618: 20289 | B1618: 喽啰 | C1618: pet_22 | D1618: 0 | E1618: 0 | F1618: 1211,100;1212,100;1216,100;5310,100; | G1618: 5138,100;5131,100; | H1618: 130+26*LV*0.6 | I1618: 45+10.5*LV*0.6 | J1618: 32+9*LV*0.6 | K1618: 24+5*LV*0.6 | L1618: 13+3*LV*0.6 | M1618: 100000 | N1618: 0 | O1618: math.max(0,(lv/5)-1) | P1618: math.max(0,(lv/5)-1) | Q1618: math.max(0,(lv/5)-1) | R1618: 0; | S1618: 有药王谷和盘丝洞的弟子在，真是不爽，还是跑路算了！ | T1618: 药王谷和盘丝洞的弟子不在眼前，真是轻松愉快啊！ | U1618: 0 | V1618: 0,0; | W1618: 3
A1619: 20290 | B1619: 喽啰 | C1619: pet_62 | D1619: 0 | E1619: 0 | F1619: 1311,100;1312,100;1315,100; | G1619: 5138,100;5131,100; | H1619: 130+26*LV*0.6 | I1619: 45+10.5*LV*0.6 | J1619: 32+9*LV*0.6 | K1619: 24+5*LV*0.6 | L1619: 13+3*LV*0.6 | M1619: 100000 | N1619: 0 | O1619: math.max(0,(lv/5)-1) | P1619: math.max(0,(lv/5)-1) | Q1619: math.max(0,(lv/5)-1) | R1619: 0; | S1619: 有药王谷和盘丝洞的弟子在，真是不爽，还是跑路算了！ | T1619: 药王谷和盘丝洞的弟子不在眼前，真是轻松愉快啊！ | U1619: 0 | V1619: 0,0; | W1619: 3
A1620: 20291 | B1620: 喽啰 | C1620: hero_1001 | D1620: 0 | E1620: 0 | F1620: 1311,100;1312,100;1315,100; | G1620: 5138,100;5131,100; | H1620: 130+26*LV*0.6 | I1620: 45+10.5*LV*0.6 | J1620: 32+9*LV*0.6 | K1620: 24+5*LV*0.6 | L1620: 13+3*LV*0.6 | M1620: 100000 | N1620: 0 | O1620: math.max(0,(lv/5)-1) | P1620: math.max(0,(lv/5)-1) | Q1620: math.max(0,(lv/5)-1) | R1620: 0; | S1620: 有药王谷和盘丝洞的弟子在，真是不爽，还是跑路算了！ | T1620: 药王谷和盘丝洞的弟子不在眼前，真是轻松愉快啊！ | U1620: 0 | V1620: 0,0; | W1620: 3
A1621: 20292 | B1621: 喽啰 | C1621: hero_1001 | D1621: 0 | E1621: 0 | F1621: 1211,100;1212,100;1216,100;5310,100; | G1621: 5138,100;5131,100; | H1621: 130+26*LV*0.6 | I1621: 45+10.5*LV*0.6 | J1621: 32+9*LV*0.6 | K1621: 24+5*LV*0.6 | L1621: 13+3*LV*0.6 | M1621: 100000 | N1621: 0 | O1621: math.max(0,(lv/5)-1) | P1621: math.max(0,(lv/5)-1) | Q1621: math.max(0,(lv/5)-1) | R1621: 0; | S1621: 有药王谷和盘丝洞的弟子在，真是不爽，还是跑路算了！ | T1621: 药王谷和盘丝洞的弟子不在眼前，真是轻松愉快啊！ | U1621: 0 | V1621: 0,0; | W1621: 3
A1622: 20293 | B1622: 喽啰 | C1622: common_3018 | D1622: 0 | E1622: 0 | F1622: 1211,100;1212,100;1216,100;5310,100; | G1622: 5138,100;5131,100; | H1622: 130+26*LV*0.6 | I1622: 45+10.5*LV*0.6 | J1622: 32+9*LV*0.6 | K1622: 24+5*LV*0.6 | L1622: 13+3*LV*0.6 | M1622: 100000 | N1622: 0 | O1622: math.max(0,(lv/5)-1) | P1622: math.max(0,(lv/5)-1) | Q1622: math.max(0,(lv/5)-1) | R1622: 0; | S1622: 有药王谷和盘丝洞的弟子在，真是不爽，还是跑路算了！ | T1622: 药王谷和盘丝洞的弟子不在眼前，真是轻松愉快啊！ | U1622: 0 | V1622: 0,0; | W1622: 3
A1623: 20294 | B1623: 喽啰 | C1623: hero_1001 | D1623: 0 | E1623: 0 | F1623: 1311,100;1312,100;1315,100; | G1623: 5138,100;5131,100; | H1623: 130+26*LV*0.6 | I1623: 45+10.5*LV*0.6 | J1623: 32+9*LV*0.6 | K1623: 24+5*LV*0.6 | L1623: 13+3*LV*0.6 | M1623: 100000 | N1623: 0 | O1623: math.max(0,(lv/5)-1) | P1623: math.max(0,(lv/5)-1) | Q1623: math.max(0,(lv/5)-1) | R1623: 0; | S1623: 有药王谷和盘丝洞的弟子在，真是不爽，还是跑路算了！ | T1623: 药王谷和盘丝洞的弟子不在眼前，真是轻松愉快啊！ | U1623: 0 | V1623: 0,0; | W1623: 3
A1624: 20295 | B1624: 喽啰 | C1624: hero_2001 | D1624: 0 | E1624: 0 | F1624: 1311,100;1312,100;1315,100; | G1624: 5138,100;5131,100; | H1624: 130+26*LV*0.6 | I1624: 45+10.5*LV*0.6 | J1624: 32+9*LV*0.6 | K1624: 24+5*LV*0.6 | L1624: 13+3*LV*0.6 | M1624: 100000 | N1624: 0 | O1624: math.max(0,(lv/5)-1) | P1624: math.max(0,(lv/5)-1) | Q1624: math.max(0,(lv/5)-1) | R1624: 0; | S1624: 有药王谷和盘丝洞的弟子在，真是不爽，还是跑路算了！ | T1624: 药王谷和盘丝洞的弟子不在眼前，真是轻松愉快啊！ | U1624: 0 | V1624: 0,0; | W1624: 3
A1625: 20296 | B1625: 喽啰 | C1625: pet_22 | D1625: 0 | E1625: 0 | F1625: 1311,100;1312,100;1315,100; | G1625: 5138,100;5131,100; | H1625: 130+26*LV*0.6 | I1625: 45+10.5*LV*0.6 | J1625: 32+9*LV*0.6 | K1625: 24+5*LV*0.6 | L1625: 13+3*LV*0.6 | M1625: 100000 | N1625: 0 | O1625: math.max(0,(lv/5)-1) | P1625: math.max(0,(lv/5)-1) | Q1625: math.max(0,(lv/5)-1) | R1625: 0; | S1625: 有药王谷和盘丝洞的弟子在，真是不爽，还是跑路算了！ | T1625: 药王谷和盘丝洞的弟子不在眼前，真是轻松愉快啊！ | U1625: 0 | V1625: 0,0; | W1625: 3
A1626: 20297 | B1626: 喽啰 | C1626: hero_1001 | D1626: 0 | E1626: 0 | F1626: 1311,100;1312,100;1315,100; | G1626: 5138,100;5131,100; | H1626: 130+26*LV*0.6 | I1626: 45+10.5*LV*0.6 | J1626: 32+9*LV*0.6 | K1626: 24+5*LV*0.6 | L1626: 13+3*LV*0.6 | M1626: 100000 | N1626: 0 | O1626: math.max(0,(lv/5)-1) | P1626: math.max(0,(lv/5)-1) | Q1626: math.max(0,(lv/5)-1) | R1626: 0; | S1626: 有药王谷和盘丝洞的弟子在，真是不爽，还是跑路算了！ | T1626: 药王谷和盘丝洞的弟子不在眼前，真是轻松愉快啊！ | U1626: 0 | V1626: 0,0; | W1626: 3
A1627: 20298 | B1627: 喽啰 | C1627: pet_22 | D1627: 0 | E1627: 0 | F1627: 1211,100;1212,100;1216,100;5310,100; | G1627: 5138,100;5131,100; | H1627: 130+26*LV*0.6 | I1627: 45+10.5*LV*0.6 | J1627: 32+9*LV*0.6 | K1627: 24+5*LV*0.6 | L1627: 13+3*LV*0.6 | M1627: 100000 | N1627: 0 | O1627: math.max(0,(lv/5)-1) | P1627: math.max(0,(lv/5)-1) | Q1627: math.max(0,(lv/5)-1) | R1627: 0; | S1627: 有药王谷和盘丝洞的弟子在，真是不爽，还是跑路算了！ | T1627: 药王谷和盘丝洞的弟子不在眼前，真是轻松愉快啊！ | U1627: 0 | V1627: 0,0; | W1627: 3
A1628: 20299 | B1628: 喽啰 | C1628: hero_1001 | D1628: 0 | E1628: 0 | F1628: 1311,100;1312,100;1315,100; | G1628: 5138,100;5131,100; | H1628: 130+26*LV*0.6 | I1628: 45+10.5*LV*0.6 | J1628: 32+9*LV*0.6 | K1628: 24+5*LV*0.6 | L1628: 13+3*LV*0.6 | M1628: 100000 | N1628: 0 | O1628: math.max(0,(lv/5)-1) | P1628: math.max(0,(lv/5)-1) | Q1628: math.max(0,(lv/5)-1) | R1628: 0; | S1628: 有药王谷和盘丝洞的弟子在，真是不爽，还是跑路算了！ | T1628: 药王谷和盘丝洞的弟子不在眼前，真是轻松愉快啊！ | U1628: 0 | V1628: 0,0; | W1628: 3
A1629: 20300 | B1629: 喽啰 | C1629: hero_1001 | D1629: 0 | E1629: 0 | F1629: 1211,100;1212,100;1216,100;5310,100; | G1629: 5138,100;5131,100; | H1629: 130+26*LV*0.6 | I1629: 45+10.5*LV*0.6 | J1629: 32+9*LV*0.6 | K1629: 24+5*LV*0.6 | L1629: 13+3*LV*0.6 | M1629: 100000 | N1629: 0 | O1629: math.max(0,(lv/5)-1) | P1629: math.max(0,(lv/5)-1) | Q1629: math.max(0,(lv/5)-1) | R1629: 0; | S1629: 有药王谷和盘丝洞的弟子在，真是不爽，还是跑路算了！ | T1629: 药王谷和盘丝洞的弟子不在眼前，真是轻松愉快啊！ | U1629: 0 | V1629: 0,0; | W1629: 3
A1630: 20301 | B1630: 喽啰 | C1630: pet_42 | D1630: 0 | E1630: 0 | F1630: 1311,100;1312,100;1315,100; | G1630: 5103,100;5108,100; | H1630: 130+26*LV*0.6 | I1630: 45+10.5*LV*0.6 | J1630: 32+9*LV*0.6 | K1630: 24+5*LV*0.6 | L1630: 13+3*LV*0.6 | M1630: 100000 | N1630: 0 | O1630: math.max(0,(lv/10)-1) | P1630: math.max(0,(lv/10)-1) | Q1630: math.max(0,(lv/10)-1) | R1630: 0; | S1630: 有药王谷和盘丝洞的弟子在，真是不爽，还是跑路算了！ | T1630: 药王谷和盘丝洞的弟子不在眼前，真是轻松愉快啊！ | U1630: 0 | V1630: 0,0; | W1630: 4
A1631: 20302 | B1631: 喽啰 | C1631: pet_42 | D1631: 0 | E1631: 0 | F1631: 1311,100;1312,100;1315,100; | G1631: 5103,100;5108,100; | H1631: 130+26*LV*0.6 | I1631: 45+10.5*LV*0.6 | J1631: 32+9*LV*0.6 | K1631: 24+5*LV*0.6 | L1631: 13+3*LV*0.6 | M1631: 100000 | N1631: 0 | O1631: math.max(0,(lv/10)-1) | P1631: math.max(0,(lv/10)-1) | Q1631: math.max(0,(lv/10)-1) | R1631: 0; | S1631: 有药王谷和盘丝洞的弟子在，真是不爽，还是跑路算了！ | T1631: 药王谷和盘丝洞的弟子不在眼前，真是轻松愉快啊！ | U1631: 0 | V1631: 0,0; | W1631: 4
A1632: 20303 | B1632: 喽啰 | C1632: pet_42 | D1632: 0 | E1632: 0 | F1632: 1311,100;1312,100;1315,100; | G1632: 5103,100;5108,100; | H1632: 130+26*LV*0.6 | I1632: 45+10.5*LV*0.6 | J1632: 32+9*LV*0.6 | K1632: 24+5*LV*0.6 | L1632: 13+3*LV*0.6 | M1632: 100000 | N1632: 0 | O1632: math.max(0,(lv/10)-1) | P1632: math.max(0,(lv/10)-1) | Q1632: math.max(0,(lv/10)-1) | R1632: 0; | S1632: 有药王谷和盘丝洞的弟子在，真是不爽，还是跑路算了！ | T1632: 药王谷和盘丝洞的弟子不在眼前，真是轻松愉快啊！ | U1632: 0 | V1632: 0,0; | W1632: 4
A1633: 20304 | B1633: 喽啰 | C1633: pet_42 | D1633: 0 | E1633: 0 | F1633: 1311,100;1312,100;1315,100; | G1633: 5103,100;5108,100; | H1633: 130+26*LV*0.6 | I1633: 45+10.5*LV*0.6 | J1633: 32+9*LV*0.6 | K1633: 24+5*LV*0.6 | L1633: 13+3*LV*0.6 | M1633: 100000 | N1633: 0 | O1633: math.max(0,(lv/10)-1) | P1633: math.max(0,(lv/10)-1) | Q1633: math.max(0,(lv/10)-1) | R1633: 0; | S1633: 有药王谷和盘丝洞的弟子在，真是不爽，还是跑路算了！ | T1633: 药王谷和盘丝洞的弟子不在眼前，真是轻松愉快啊！ | U1633: 0 | V1633: 0,0; | W1633: 4
A1634: 20305 | B1634: 喽啰 | C1634: pet_42 | D1634: 0 | E1634: 0 | F1634: 1311,100;1312,100;1315,100; | G1634: 5103,100;5108,100; | H1634: 130+26*LV*0.6 | I1634: 45+10.5*LV*0.6 | J1634: 32+9*LV*0.6 | K1634: 24+5*LV*0.6 | L1634: 13+3*LV*0.6 | M1634: 100000 | N1634: 0 | O1634: math.max(0,(lv/10)-1) | P1634: math.max(0,(lv/10)-1) | Q1634: math.max(0,(lv/10)-1) | R1634: 0; | S1634: 有药王谷和盘丝洞的弟子在，真是不爽，还是跑路算了！ | T1634: 药王谷和盘丝洞的弟子不在眼前，真是轻松愉快啊！ | U1634: 0 | V1634: 0,0; | W1634: 4
A1635: 20306 | B1635: 喽啰 | C1635: pet_13 | D1635: 0 | E1635: 0 | F1635: 1311,100;1312,100;1315,100; | G1635: 5103,100;5108,100; | H1635: 130+26*LV*0.6 | I1635: 45+10.5*LV*0.6 | J1635: 32+9*LV*0.6 | K1635: 24+5*LV*0.6 | L1635: 13+3*LV*0.6 | M1635: 100000 | N1635: 0 | O1635: math.max(0,(lv/10)-1) | P1635: math.max(0,(lv/10)-1) | Q1635: math.max(0,(lv/10)-1) | R1635: 0; | S1635: 有药王谷和盘丝洞的弟子在，真是不爽，还是跑路算了！ | T1635: 药王谷和盘丝洞的弟子不在眼前，真是轻松愉快啊！ | U1635: 0 | V1635: 0,0; | W1635: 4
A1636: 20307 | B1636: 喽啰 | C1636: pet_13 | D1636: 0 | E1636: 0 | F1636: 1311,100;1312,100;1315,100; | G1636: 5103,100;5108,100; | H1636: 130+26*LV*0.6 | I1636: 45+10.5*LV*0.6 | J1636: 32+9*LV*0.6 | K1636: 24+5*LV*0.6 | L1636: 13+3*LV*0.6 | M1636: 100000 | N1636: 0 | O1636: math.max(0,(lv/10)-1) | P1636: math.max(0,(lv/10)-1) | Q1636: math.max(0,(lv/10)-1) | R1636: 0; | S1636: 有药王谷和盘丝洞的弟子在，真是不爽，还是跑路算了！ | T1636: 药王谷和盘丝洞的弟子不在眼前，真是轻松愉快啊！ | U1636: 0 | V1636: 0,0; | W1636: 4
A1637: 20308 | B1637: 喽啰 | C1637: pet_13 | D1637: 0 | E1637: 0 | F1637: 1311,100;1312,100;1315,100; | G1637: 5103,100;5108,100; | H1637: 130+26*LV*0.6 | I1637: 45+10.5*LV*0.6 | J1637: 32+9*LV*0.6 | K1637: 24+5*LV*0.6 | L1637: 13+3*LV*0.6 | M1637: 100000 | N1637: 0 | O1637: math.max(0,(lv/10)-1) | P1637: math.max(0,(lv/10)-1) | Q1637: math.max(0,(lv/10)-1) | R1637: 0; | S1637: 有药王谷和盘丝洞的弟子在，真是不爽，还是跑路算了！ | T1637: 药王谷和盘丝洞的弟子不在眼前，真是轻松愉快啊！ | U1637: 0 | V1637: 0,0; | W1637: 4
A1638: 20309 | B1638: 喽啰 | C1638: pet_13 | D1638: 0 | E1638: 0 | F1638: 1311,100;1312,100;1315,100; | G1638: 5103,100;5108,100; | H1638: 130+26*LV*0.6 | I1638: 45+10.5*LV*0.6 | J1638: 32+9*LV*0.6 | K1638: 24+5*LV*0.6 | L1638: 13+3*LV*0.6 | M1638: 100000 | N1638: 0 | O1638: math.max(0,(lv/10)-1) | P1638: math.max(0,(lv/10)-1) | Q1638: math.max(0,(lv/10)-1) | R1638: 0; | S1638: 有药王谷和盘丝洞的弟子在，真是不爽，还是跑路算了！ | T1638: 药王谷和盘丝洞的弟子不在眼前，真是轻松愉快啊！ | U1638: 0 | V1638: 0,0; | W1638: 4
A1639: 20310 | B1639: 喽啰 | C1639: pet_13 | D1639: 0 | E1639: 0 | F1639: 1311,100;1312,100;1315,100; | G1639: 5103,100;5108,100; | H1639: 130+26*LV*0.6 | I1639: 45+10.5*LV*0.6 | J1639: 32+9*LV*0.6 | K1639: 24+5*LV*0.6 | L1639: 13+3*LV*0.6 | M1639: 100000 | N1639: 0 | O1639: math.max(0,(lv/10)-1) | P1639: math.max(0,(lv/10)-1) | Q1639: math.max(0,(lv/10)-1) | R1639: 0; | S1639: 有药王谷和盘丝洞的弟子在，真是不爽，还是跑路算了！ | T1639: 药王谷和盘丝洞的弟子不在眼前，真是轻松愉快啊！ | U1639: 0 | V1639: 0,0; | W1639: 4
A1640: 20311 | B1640: 喽啰 | C1640: hero_1001 | D1640: 0 | E1640: 0 | F1640: 1311,100;1312,100;1315,100; | G1640: 5103,100;5108,100; | H1640: 130+26*LV*0.6 | I1640: 45+10.5*LV*0.6 | J1640: 32+9*LV*0.6 | K1640: 24+5*LV*0.6 | L1640: 13+3*LV*0.6 | M1640: 100000 | N1640: 0 | O1640: math.max(0,(lv/10)-1) | P1640: math.max(0,(lv/10)-1) | Q1640: math.max(0,(lv/10)-1) | R1640: 0; | S1640: 有药王谷和盘丝洞的弟子在，真是不爽，还是跑路算了！ | T1640: 药王谷和盘丝洞的弟子不在眼前，真是轻松愉快啊！ | U1640: 0 | V1640: 0,0; | W1640: 4
A1641: 20312 | B1641: 喽啰 | C1641: hero_2001 | D1641: 0 | E1641: 0 | F1641: 1311,100;1312,100;1315,100; | G1641: 5103,100;5108,100; | H1641: 130+26*LV*0.6 | I1641: 45+10.5*LV*0.6 | J1641: 32+9*LV*0.6 | K1641: 24+5*LV*0.6 | L1641: 13+3*LV*0.6 | M1641: 100000 | N1641: 0 | O1641: math.max(0,(lv/10)-1) | P1641: math.max(0,(lv/10)-1) | Q1641: math.max(0,(lv/10)-1) | R1641: 0; | S1641: 有药王谷和盘丝洞的弟子在，真是不爽，还是跑路算了！ | T1641: 药王谷和盘丝洞的弟子不在眼前，真是轻松愉快啊！ | U1641: 0 | V1641: 0,0; | W1641: 4
A1642: 20313 | B1642: 喽啰 | C1642: pet_23 | D1642: 0 | E1642: 0 | F1642: 1311,100;1312,100;1315,100; | G1642: 5103,100;5108,100; | H1642: 130+26*LV*0.6 | I1642: 45+10.5*LV*0.6 | J1642: 32+9*LV*0.6 | K1642: 24+5*LV*0.6 | L1642: 13+3*LV*0.6 | M1642: 100000 | N1642: 0 | O1642: math.max(0,(lv/10)-1) | P1642: math.max(0,(lv/10)-1) | Q1642: math.max(0,(lv/10)-1) | R1642: 0; | S1642: 有药王谷和盘丝洞的弟子在，真是不爽，还是跑路算了！ | T1642: 药王谷和盘丝洞的弟子不在眼前，真是轻松愉快啊！ | U1642: 0 | V1642: 0,0; | W1642: 4
A1643: 20314 | B1643: 喽啰 | C1643: pet_13 | D1643: 0 | E1643: 0 | F1643: 1311,100;1312,100;1315,100; | G1643: 5103,100;5108,100; | H1643: 130+26*LV*0.6 | I1643: 45+10.5*LV*0.6 | J1643: 32+9*LV*0.6 | K1643: 24+5*LV*0.6 | L1643: 13+3*LV*0.6 | M1643: 100000 | N1643: 0 | O1643: math.max(0,(lv/10)-1) | P1643: math.max(0,(lv/10)-1) | Q1643: math.max(0,(lv/10)-1) | R1643: 0; | S1643: 有药王谷和盘丝洞的弟子在，真是不爽，还是跑路算了！ | T1643: 药王谷和盘丝洞的弟子不在眼前，真是轻松愉快啊！ | U1643: 0 | V1643: 0,0; | W1643: 4
A1644: 20315 | B1644: 喽啰 | C1644: pet_23 | D1644: 0 | E1644: 0 | F1644: 1311,100;1312,100;1315,100; | G1644: 5103,100;5108,100; | H1644: 130+26*LV*0.6 | I1644: 45+10.5*LV*0.6 | J1644: 32+9*LV*0.6 | K1644: 24+5*LV*0.6 | L1644: 13+3*LV*0.6 | M1644: 100000 | N1644: 0 | O1644: math.max(0,(lv/10)-1) | P1644: math.max(0,(lv/10)-1) | Q1644: math.max(0,(lv/10)-1) | R1644: 0; | S1644: 有药王谷和盘丝洞的弟子在，真是不爽，还是跑路算了！ | T1644: 药王谷和盘丝洞的弟子不在眼前，真是轻松愉快啊！ | U1644: 0 | V1644: 0,0; | W1644: 4
A1645: 20316 | B1645: 喽啰 | C1645: pet_22 | D1645: 0 | E1645: 0 | F1645: 1311,100;1312,100;1315,100; | G1645: 5103,100;5108,100; | H1645: 130+26*LV*0.6 | I1645: 45+10.5*LV*0.6 | J1645: 32+9*LV*0.6 | K1645: 24+5*LV*0.6 | L1645: 13+3*LV*0.6 | M1645: 100000 | N1645: 0 | O1645: math.max(0,(lv/10)-1) | P1645: math.max(0,(lv/10)-1) | Q1645: math.max(0,(lv/10)-1) | R1645: 0; | S1645: 有药王谷和盘丝洞的弟子在，真是不爽，还是跑路算了！ | T1645: 药王谷和盘丝洞的弟子不在眼前，真是轻松愉快啊！ | U1645: 0 | V1645: 0,0; | W1645: 4
A1646: 20317 | B1646: 喽啰 | C1646: hero_1001 | D1646: 0 | E1646: 0 | F1646: 1311,100;1312,100;1315,100; | G1646: 5103,100;5108,100; | H1646: 130+26*LV*0.6 | I1646: 45+10.5*LV*0.6 | J1646: 32+9*LV*0.6 | K1646: 24+5*LV*0.6 | L1646: 13+3*LV*0.6 | M1646: 100000 | N1646: 0 | O1646: math.max(0,(lv/10)-1) | P1646: math.max(0,(lv/10)-1) | Q1646: math.max(0,(lv/10)-1) | R1646: 0; | S1646: 有药王谷和盘丝洞的弟子在，真是不爽，还是跑路算了！ | T1646: 药王谷和盘丝洞的弟子不在眼前，真是轻松愉快啊！ | U1646: 0 | V1646: 0,0; | W1646: 4
A1647: 20318 | B1647: 喽啰 | C1647: pet_22 | D1647: 0 | E1647: 0 | F1647: 1311,100;1312,100;1315,100; | G1647: 5103,100;5108,100; | H1647: 130+26*LV*0.6 | I1647: 45+10.5*LV*0.6 | J1647: 32+9*LV*0.6 | K1647: 24+5*LV*0.6 | L1647: 13+3*LV*0.6 | M1647: 100000 | N1647: 0 | O1647: math.max(0,(lv/10)-1) | P1647: math.max(0,(lv/10)-1) | Q1647: math.max(0,(lv/10)-1) | R1647: 0; | S1647: 有药王谷和盘丝洞的弟子在，真是不爽，还是跑路算了！ | T1647: 药王谷和盘丝洞的弟子不在眼前，真是轻松愉快啊！ | U1647: 0 | V1647: 0,0; | W1647: 4
A1648: 20319 | B1648: 喽啰 | C1648: pet_23 | D1648: 0 | E1648: 0 | F1648: 1311,100;1312,100;1315,100; | G1648: 5103,100;5108,100; | H1648: 130+26*LV*0.6 | I1648: 45+10.5*LV*0.6 | J1648: 32+9*LV*0.6 | K1648: 24+5*LV*0.6 | L1648: 13+3*LV*0.6 | M1648: 100000 | N1648: 0 | O1648: math.max(0,(lv/10)-1) | P1648: math.max(0,(lv/10)-1) | Q1648: math.max(0,(lv/10)-1) | R1648: 0; | S1648: 有药王谷和盘丝洞的弟子在，真是不爽，还是跑路算了！ | T1648: 药王谷和盘丝洞的弟子不在眼前，真是轻松愉快啊！ | U1648: 0 | V1648: 0,0; | W1648: 4
A1649: 20320 | B1649: 喽啰 | C1649: hero_1001 | D1649: 0 | E1649: 0 | F1649: 1311,100;1312,100;1315,100; | G1649: 5103,100;5108,100; | H1649: 130+26*LV*0.6 | I1649: 45+10.5*LV*0.6 | J1649: 32+9*LV*0.6 | K1649: 24+5*LV*0.6 | L1649: 13+3*LV*0.6 | M1649: 100000 | N1649: 0 | O1649: math.max(0,(lv/10)-1) | P1649: math.max(0,(lv/10)-1) | Q1649: math.max(0,(lv/10)-1) | R1649: 0; | S1649: 有药王谷和盘丝洞的弟子在，真是不爽，还是跑路算了！ | T1649: 药王谷和盘丝洞的弟子不在眼前，真是轻松愉快啊！ | U1649: 0 | V1649: 0,0; | W1649: 4
A1650: 20321 | B1650: 喽啰 | C1650: hero_1001 | D1650: 0 | E1650: 0 | F1650: 1311,100;1312,100;1315,100; | G1650: 5103,100;5108,100; | H1650: 130+26*LV*0.6 | I1650: 45+10.5*LV*0.6 | J1650: 32+9*LV*0.6 | K1650: 24+5*LV*0.6 | L1650: 13+3*LV*0.6 | M1650: 100000 | N1650: 0 | O1650: math.max(0,(lv/10)-1) | P1650: math.max(0,(lv/10)-1) | Q1650: math.max(0,(lv/10)-1) | R1650: 0; | S1650: 有药王谷和盘丝洞的弟子在，真是不爽，还是跑路算了！ | T1650: 药王谷和盘丝洞的弟子不在眼前，真是轻松愉快啊！ | U1650: 0 | V1650: 0,0; | W1650: 4
A1651: 20322 | B1651: 喽啰 | C1651: pet_43 | D1651: 0 | E1651: 0 | F1651: 1311,100;1312,100;1315,100; | G1651: 5103,100;5108,100; | H1651: 130+26*LV*0.6 | I1651: 45+10.5*LV*0.6 | J1651: 32+9*LV*0.6 | K1651: 24+5*LV*0.6 | L1651: 13+3*LV*0.6 | M1651: 100000 | N1651: 0 | O1651: math.max(0,(lv/10)-1) | P1651: math.max(0,(lv/10)-1) | Q1651: math.max(0,(lv/10)-1) | R1651: 0; | S1651: 有药王谷和盘丝洞的弟子在，真是不爽，还是跑路算了！ | T1651: 药王谷和盘丝洞的弟子不在眼前，真是轻松愉快啊！ | U1651: 0 | V1651: 0,0; | W1651: 4
A1652: 20323 | B1652: 喽啰 | C1652: pet_53 | D1652: 0 | E1652: 0 | F1652: 1311,100;1312,100;1315,100; | G1652: 5103,100;5108,100; | H1652: 130+26*LV*0.6 | I1652: 45+10.5*LV*0.6 | J1652: 32+9*LV*0.6 | K1652: 24+5*LV*0.6 | L1652: 13+3*LV*0.6 | M1652: 100000 | N1652: 0 | O1652: math.max(0,(lv/10)-1) | P1652: math.max(0,(lv/10)-1) | Q1652: math.max(0,(lv/10)-1) | R1652: 0; | S1652: 有药王谷和盘丝洞的弟子在，真是不爽，还是跑路算了！ | T1652: 药王谷和盘丝洞的弟子不在眼前，真是轻松愉快啊！ | U1652: 0 | V1652: 0,0; | W1652: 4
A1653: 20324 | B1653: 喽啰 | C1653: pet_61 | D1653: 0 | E1653: 0 | F1653: 1311,100;1312,100;1315,100; | G1653: 5103,100;5108,100; | H1653: 130+26*LV*0.6 | I1653: 45+10.5*LV*0.6 | J1653: 32+9*LV*0.6 | K1653: 24+5*LV*0.6 | L1653: 13+3*LV*0.6 | M1653: 100000 | N1653: 0 | O1653: math.max(0,(lv/10)-1) | P1653: math.max(0,(lv/10)-1) | Q1653: math.max(0,(lv/10)-1) | R1653: 0; | S1653: 有药王谷和盘丝洞的弟子在，真是不爽，还是跑路算了！ | T1653: 药王谷和盘丝洞的弟子不在眼前，真是轻松愉快啊！ | U1653: 0 | V1653: 0,0; | W1653: 4
A1654: 20325 | B1654: 喽啰 | C1654: pet_3 | D1654: 0 | E1654: 0 | F1654: 1311,100;1312,100;1315,100; | G1654: 5103,100;5108,100; | H1654: 130+26*LV*0.6 | I1654: 45+10.5*LV*0.6 | J1654: 32+9*LV*0.6 | K1654: 24+5*LV*0.6 | L1654: 13+3*LV*0.6 | M1654: 100000 | N1654: 0 | O1654: math.max(0,(lv/10)-1) | P1654: math.max(0,(lv/10)-1) | Q1654: math.max(0,(lv/10)-1) | R1654: 0; | S1654: 有药王谷和盘丝洞的弟子在，真是不爽，还是跑路算了！ | T1654: 药王谷和盘丝洞的弟子不在眼前，真是轻松愉快啊！ | U1654: 0 | V1654: 0,0; | W1654: 4
A1655: 20326 | B1655: 喽啰 | C1655: pet_21 | D1655: 0 | E1655: 0 | F1655: 1311,100;1312,100;1315,100; | G1655: 5103,100;5108,100; | H1655: 130+26*LV*0.6 | I1655: 45+10.5*LV*0.6 | J1655: 32+9*LV*0.6 | K1655: 24+5*LV*0.6 | L1655: 13+3*LV*0.6 | M1655: 100000 | N1655: 0 | O1655: math.max(0,(lv/10)-1) | P1655: math.max(0,(lv/10)-1) | Q1655: math.max(0,(lv/10)-1) | R1655: 0; | S1655: 有药王谷和盘丝洞的弟子在，真是不爽，还是跑路算了！ | T1655: 药王谷和盘丝洞的弟子不在眼前，真是轻松愉快啊！ | U1655: 0 | V1655: 0,0; | W1655: 4
A1656: 20327 | B1656: 喽啰 | C1656: pet_23 | D1656: 0 | E1656: 0 | F1656: 1311,100;1312,100;1315,100; | G1656: 5103,100;5108,100; | H1656: 130+26*LV*0.6 | I1656: 45+10.5*LV*0.6 | J1656: 32+9*LV*0.6 | K1656: 24+5*LV*0.6 | L1656: 13+3*LV*0.6 | M1656: 100000 | N1656: 0 | O1656: math.max(0,(lv/10)-1) | P1656: math.max(0,(lv/10)-1) | Q1656: math.max(0,(lv/10)-1) | R1656: 0; | S1656: 有药王谷和盘丝洞的弟子在，真是不爽，还是跑路算了！ | T1656: 药王谷和盘丝洞的弟子不在眼前，真是轻松愉快啊！ | U1656: 0 | V1656: 0,0; | W1656: 4
A1657: 20328 | B1657: 喽啰 | C1657: common_3018 | D1657: 0 | E1657: 0 | F1657: 1311,100;1312,100;1315,100; | G1657: 5103,100;5108,100; | H1657: 130+26*LV*0.6 | I1657: 45+10.5*LV*0.6 | J1657: 32+9*LV*0.6 | K1657: 24+5*LV*0.6 | L1657: 13+3*LV*0.6 | M1657: 100000 | N1657: 0 | O1657: math.max(0,(lv/10)-1) | P1657: math.max(0,(lv/10)-1) | Q1657: math.max(0,(lv/10)-1) | R1657: 0; | S1657: 有药王谷和盘丝洞的弟子在，真是不爽，还是跑路算了！ | T1657: 药王谷和盘丝洞的弟子不在眼前，真是轻松愉快啊！ | U1657: 0 | V1657: 0,0; | W1657: 4
A1658: 20329 | B1658: 喽啰 | C1658: hero_1001 | D1658: 0 | E1658: 0 | F1658: 1311,100;1312,100;1315,100; | G1658: 5103,100;5108,100; | H1658: 130+26*LV*0.6 | I1658: 45+10.5*LV*0.6 | J1658: 32+9*LV*0.6 | K1658: 24+5*LV*0.6 | L1658: 13+3*LV*0.6 | M1658: 100000 | N1658: 0 | O1658: math.max(0,(lv/10)-1) | P1658: math.max(0,(lv/10)-1) | Q1658: math.max(0,(lv/10)-1) | R1658: 0; | S1658: 有药王谷和盘丝洞的弟子在，真是不爽，还是跑路算了！ | T1658: 药王谷和盘丝洞的弟子不在眼前，真是轻松愉快啊！ | U1658: 0 | V1658: 0,0; | W1658: 4
A1659: 20330 | B1659: 喽啰 | C1659: partner_1002 | D1659: 0 | E1659: 0 | F1659: 1311,100;1312,100;1315,100; | G1659: 5103,100;5108,100; | H1659: 130+26*LV*0.6 | I1659: 45+10.5*LV*0.6 | J1659: 32+9*LV*0.6 | K1659: 24+5*LV*0.6 | L1659: 13+3*LV*0.6 | M1659: 100000 | N1659: 0 | O1659: math.max(0,(lv/10)-1) | P1659: math.max(0,(lv/10)-1) | Q1659: math.max(0,(lv/10)-1) | R1659: 0; | S1659: 有药王谷和盘丝洞的弟子在，真是不爽，还是跑路算了！ | T1659: 药王谷和盘丝洞的弟子不在眼前，真是轻松愉快啊！ | U1659: 0 | V1659: 0,0; | W1659: 4
A1660: 20331 | B1660: 喽啰 | C1660: common_3006 | D1660: 0 | E1660: 0 | F1660: 1311,100;1312,100;1315,100; | G1660: 5103,100;5108,100; | H1660: 130+26*LV*0.6 | I1660: 45+10.5*LV*0.6 | J1660: 32+9*LV*0.6 | K1660: 24+5*LV*0.6 | L1660: 13+3*LV*0.6 | M1660: 100000 | N1660: 0 | O1660: math.max(0,(lv/10)-1) | P1660: math.max(0,(lv/10)-1) | Q1660: math.max(0,(lv/10)-1) | R1660: 0; | S1660: 有药王谷和盘丝洞的弟子在，真是不爽，还是跑路算了！ | T1660: 药王谷和盘丝洞的弟子不在眼前，真是轻松愉快啊！ | U1660: 0 | V1660: 0,0; | W1660: 4
A1661: 20332 | B1661: 喽啰 | C1661: partner_1009 | D1661: 0 | E1661: 0 | F1661: 1311,100;1312,100;1315,100; | G1661: 5103,100;5108,100; | H1661: 130+26*LV*0.6 | I1661: 45+10.5*LV*0.6 | J1661: 32+9*LV*0.6 | K1661: 24+5*LV*0.6 | L1661: 13+3*LV*0.6 | M1661: 100000 | N1661: 0 | O1661: math.max(0,(lv/10)-1) | P1661: math.max(0,(lv/10)-1) | Q1661: math.max(0,(lv/10)-1) | R1661: 0; | S1661: 有药王谷和盘丝洞的弟子在，真是不爽，还是跑路算了！ | T1661: 药王谷和盘丝洞的弟子不在眼前，真是轻松愉快啊！ | U1661: 0 | V1661: 0,0; | W1661: 4
A1662: 20333 | B1662: 喽啰 | C1662: pet_21 | D1662: 0 | E1662: 0 | F1662: 1311,100;1312,100;1315,100; | G1662: 5103,100;5108,100; | H1662: 130+26*LV*0.6 | I1662: 45+10.5*LV*0.6 | J1662: 32+9*LV*0.6 | K1662: 24+5*LV*0.6 | L1662: 13+3*LV*0.6 | M1662: 100000 | N1662: 0 | O1662: math.max(0,(lv/10)-1) | P1662: math.max(0,(lv/10)-1) | Q1662: math.max(0,(lv/10)-1) | R1662: 0; | S1662: 有药王谷和盘丝洞的弟子在，真是不爽，还是跑路算了！ | T1662: 药王谷和盘丝洞的弟子不在眼前，真是轻松愉快啊！ | U1662: 0 | V1662: 0,0; | W1662: 4
A1663: 20334 | B1663: 喽啰 | C1663: pet_3 | D1663: 0 | E1663: 0 | F1663: 1311,100;1312,100;1315,100; | G1663: 5103,100;5108,100; | H1663: 130+26*LV*0.6 | I1663: 45+10.5*LV*0.6 | J1663: 32+9*LV*0.6 | K1663: 24+5*LV*0.6 | L1663: 13+3*LV*0.6 | M1663: 100000 | N1663: 0 | O1663: math.max(0,(lv/10)-1) | P1663: math.max(0,(lv/10)-1) | Q1663: math.max(0,(lv/10)-1) | R1663: 0; | S1663: 有药王谷和盘丝洞的弟子在，真是不爽，还是跑路算了！ | T1663: 药王谷和盘丝洞的弟子不在眼前，真是轻松愉快啊！ | U1663: 0 | V1663: 0,0; | W1663: 4
A1664: 20335 | B1664: 喽啰 | C1664: partner_1009 | D1664: 0 | E1664: 0 | F1664: 1311,100;1312,100;1315,100; | G1664: 5103,100;5108,100; | H1664: 130+26*LV*0.6 | I1664: 45+10.5*LV*0.6 | J1664: 32+9*LV*0.6 | K1664: 24+5*LV*0.6 | L1664: 13+3*LV*0.6 | M1664: 100000 | N1664: 0 | O1664: math.max(0,(lv/10)-1) | P1664: math.max(0,(lv/10)-1) | Q1664: math.max(0,(lv/10)-1) | R1664: 0; | S1664: 有药王谷和盘丝洞的弟子在，真是不爽，还是跑路算了！ | T1664: 药王谷和盘丝洞的弟子不在眼前，真是轻松愉快啊！ | U1664: 0 | V1664: 0,0; | W1664: 4
A1665: 20336 | B1665: 喽啰 | C1665: hero_1001 | D1665: 0 | E1665: 0 | F1665: 1311,100;1312,100;1315,100; | G1665: 5103,100;5108,100; | H1665: 130+26*LV*0.6 | I1665: 45+10.5*LV*0.6 | J1665: 32+9*LV*0.6 | K1665: 24+5*LV*0.6 | L1665: 13+3*LV*0.6 | M1665: 100000 | N1665: 0 | O1665: math.max(0,(lv/10)-1) | P1665: math.max(0,(lv/10)-1) | Q1665: math.max(0,(lv/10)-1) | R1665: 0; | S1665: 有药王谷和盘丝洞的弟子在，真是不爽，还是跑路算了！ | T1665: 药王谷和盘丝洞的弟子不在眼前，真是轻松愉快啊！ | U1665: 0 | V1665: 0,0; | W1665: 4
A1666: 20337 | B1666: 喽啰 | C1666: pet_33 | D1666: 0 | E1666: 0 | F1666: 1311,100;1312,100;1315,100; | G1666: 5103,100;5108,100; | H1666: 130+26*LV*0.6 | I1666: 45+10.5*LV*0.6 | J1666: 32+9*LV*0.6 | K1666: 24+5*LV*0.6 | L1666: 13+3*LV*0.6 | M1666: 100000 | N1666: 0 | O1666: math.max(0,(lv/10)-1) | P1666: math.max(0,(lv/10)-1) | Q1666: math.max(0,(lv/10)-1) | R1666: 0; | S1666: 有药王谷和盘丝洞的弟子在，真是不爽，还是跑路算了！ | T1666: 药王谷和盘丝洞的弟子不在眼前，真是轻松愉快啊！ | U1666: 0 | V1666: 0,0; | W1666: 4
A1667: 20338 | B1667: 喽啰 | C1667: pet_83 | D1667: 0 | E1667: 0 | F1667: 1311,100;1312,100;1315,100; | G1667: 5103,100;5108,100; | H1667: 130+26*LV*0.6 | I1667: 45+10.5*LV*0.6 | J1667: 32+9*LV*0.6 | K1667: 24+5*LV*0.6 | L1667: 13+3*LV*0.6 | M1667: 100000 | N1667: 0 | O1667: math.max(0,(lv/10)-1) | P1667: math.max(0,(lv/10)-1) | Q1667: math.max(0,(lv/10)-1) | R1667: 0; | S1667: 有药王谷和盘丝洞的弟子在，真是不爽，还是跑路算了！ | T1667: 药王谷和盘丝洞的弟子不在眼前，真是轻松愉快啊！ | U1667: 0 | V1667: 0,0; | W1667: 4
A1668: 20339 | B1668: 喽啰 | C1668: partner_1002 | D1668: 0 | E1668: 0 | F1668: 1311,100;1312,100;1315,100; | G1668: 5103,100;5108,100; | H1668: 130+26*LV*0.6 | I1668: 45+10.5*LV*0.6 | J1668: 32+9*LV*0.6 | K1668: 24+5*LV*0.6 | L1668: 13+3*LV*0.6 | M1668: 100000 | N1668: 0 | O1668: math.max(0,(lv/10)-1) | P1668: math.max(0,(lv/10)-1) | Q1668: math.max(0,(lv/10)-1) | R1668: 0; | S1668: 有药王谷和盘丝洞的弟子在，真是不爽，还是跑路算了！ | T1668: 药王谷和盘丝洞的弟子不在眼前，真是轻松愉快啊！ | U1668: 0 | V1668: 0,0; | W1668: 4
A1669: 20340 | B1669: 喽啰 | C1669: pet_62 | D1669: 0 | E1669: 0 | F1669: 1311,100;1312,100;1315,100; | G1669: 5103,100;5108,100; | H1669: 130+26*LV*0.6 | I1669: 45+10.5*LV*0.6 | J1669: 32+9*LV*0.6 | K1669: 24+5*LV*0.6 | L1669: 13+3*LV*0.6 | M1669: 100000 | N1669: 0 | O1669: math.max(0,(lv/10)-1) | P1669: math.max(0,(lv/10)-1) | Q1669: math.max(0,(lv/10)-1) | R1669: 0; | S1669: 有药王谷和盘丝洞的弟子在，真是不爽，还是跑路算了！ | T1669: 药王谷和盘丝洞的弟子不在眼前，真是轻松愉快啊！ | U1669: 0 | V1669: 0,0; | W1669: 4
A1670: 20341 | B1670: 喽啰 | C1670: pet_83 | D1670: 0 | E1670: 0 | F1670: 1311,100;1312,100;1315,100; | G1670: 5103,100;5108,100; | H1670: 130+26*LV*0.6 | I1670: 45+10.5*LV*0.6 | J1670: 32+9*LV*0.6 | K1670: 24+5*LV*0.6 | L1670: 13+3*LV*0.6 | M1670: 100000 | N1670: 0 | O1670: math.max(0,(lv/10)-1) | P1670: math.max(0,(lv/10)-1) | Q1670: math.max(0,(lv/10)-1) | R1670: 0; | S1670: 有药王谷和盘丝洞的弟子在，真是不爽，还是跑路算了！ | T1670: 药王谷和盘丝洞的弟子不在眼前，真是轻松愉快啊！ | U1670: 0 | V1670: 0,0; | W1670: 4
A1671: 20342 | B1671: 喽啰 | C1671: pet_23 | D1671: 0 | E1671: 0 | F1671: 1311,100;1312,100;1315,100; | G1671: 5103,100;5108,100; | H1671: 130+26*LV*0.6 | I1671: 45+10.5*LV*0.6 | J1671: 32+9*LV*0.6 | K1671: 24+5*LV*0.6 | L1671: 13+3*LV*0.6 | M1671: 100000 | N1671: 0 | O1671: math.max(0,(lv/10)-1) | P1671: math.max(0,(lv/10)-1) | Q1671: math.max(0,(lv/10)-1) | R1671: 0; | S1671: 有药王谷和盘丝洞的弟子在，真是不爽，还是跑路算了！ | T1671: 药王谷和盘丝洞的弟子不在眼前，真是轻松愉快啊！ | U1671: 0 | V1671: 0,0; | W1671: 4
A1672: 20343 | B1672: 喽啰 | C1672: hero_1001 | D1672: 0 | E1672: 0 | F1672: 1311,100;1312,100;1315,100; | G1672: 5103,100;5108,100; | H1672: 130+26*LV*0.6 | I1672: 45+10.5*LV*0.6 | J1672: 32+9*LV*0.6 | K1672: 24+5*LV*0.6 | L1672: 13+3*LV*0.6 | M1672: 100000 | N1672: 0 | O1672: math.max(0,(lv/10)-1) | P1672: math.max(0,(lv/10)-1) | Q1672: math.max(0,(lv/10)-1) | R1672: 0; | S1672: 有药王谷和盘丝洞的弟子在，真是不爽，还是跑路算了！ | T1672: 药王谷和盘丝洞的弟子不在眼前，真是轻松愉快啊！ | U1672: 0 | V1672: 0,0; | W1672: 4
A1673: 20344 | B1673: 喽啰 | C1673: partner_1001 | D1673: 0 | E1673: 0 | F1673: 1311,100;1312,100;1315,100; | G1673: 5103,100;5108,100; | H1673: 130+26*LV*0.6 | I1673: 45+10.5*LV*0.6 | J1673: 32+9*LV*0.6 | K1673: 24+5*LV*0.6 | L1673: 13+3*LV*0.6 | M1673: 100000 | N1673: 0 | O1673: math.max(0,(lv/10)-1) | P1673: math.max(0,(lv/10)-1) | Q1673: math.max(0,(lv/10)-1) | R1673: 0; | S1673: 有药王谷和盘丝洞的弟子在，真是不爽，还是跑路算了！ | T1673: 药王谷和盘丝洞的弟子不在眼前，真是轻松愉快啊！ | U1673: 0 | V1673: 0,0; | W1673: 4
A1674: 20345 | B1674: 喽啰 | C1674: partner_1009 | D1674: 0 | E1674: 0 | F1674: 1311,100;1312,100;1315,100; | G1674: 5103,100;5108,100; | H1674: 130+26*LV*0.6 | I1674: 45+10.5*LV*0.6 | J1674: 32+9*LV*0.6 | K1674: 24+5*LV*0.6 | L1674: 13+3*LV*0.6 | M1674: 100000 | N1674: 0 | O1674: math.max(0,(lv/10)-1) | P1674: math.max(0,(lv/10)-1) | Q1674: math.max(0,(lv/10)-1) | R1674: 0; | S1674: 有药王谷和盘丝洞的弟子在，真是不爽，还是跑路算了！ | T1674: 药王谷和盘丝洞的弟子不在眼前，真是轻松愉快啊！ | U1674: 0 | V1674: 0,0; | W1674: 4
A1675: 20346 | B1675: 喽啰 | C1675: partner_1004 | D1675: 0 | E1675: 0 | F1675: 1311,100;1312,100;1315,100; | G1675: 5103,100;5108,100; | H1675: 130+26*LV*0.6 | I1675: 45+10.5*LV*0.6 | J1675: 32+9*LV*0.6 | K1675: 24+5*LV*0.6 | L1675: 13+3*LV*0.6 | M1675: 100000 | N1675: 0 | O1675: math.max(0,(lv/10)-1) | P1675: math.max(0,(lv/10)-1) | Q1675: math.max(0,(lv/10)-1) | R1675: 0; | S1675: 有药王谷和盘丝洞的弟子在，真是不爽，还是跑路算了！ | T1675: 药王谷和盘丝洞的弟子不在眼前，真是轻松愉快啊！ | U1675: 0 | V1675: 0,0; | W1675: 4
A1676: 20347 | B1676: 喽啰 | C1676: pet_21 | D1676: 0 | E1676: 0 | F1676: 1311,100;1312,100;1315,100; | G1676: 5103,100;5108,100; | H1676: 130+26*LV*0.6 | I1676: 45+10.5*LV*0.6 | J1676: 32+9*LV*0.6 | K1676: 24+5*LV*0.6 | L1676: 13+3*LV*0.6 | M1676: 100000 | N1676: 0 | O1676: math.max(0,(lv/10)-1) | P1676: math.max(0,(lv/10)-1) | Q1676: math.max(0,(lv/10)-1) | R1676: 0; | S1676: 有药王谷和盘丝洞的弟子在，真是不爽，还是跑路算了！ | T1676: 药王谷和盘丝洞的弟子不在眼前，真是轻松愉快啊！ | U1676: 0 | V1676: 0,0; | W1676: 4
A1677: 20348 | B1677: 喽啰 | C1677: pet_72 | D1677: 0 | E1677: 0 | F1677: 1311,100;1312,100;1315,100; | G1677: 5103,100;5108,100; | H1677: 130+26*LV*0.6 | I1677: 45+10.5*LV*0.6 | J1677: 32+9*LV*0.6 | K1677: 24+5*LV*0.6 | L1677: 13+3*LV*0.6 | M1677: 100000 | N1677: 0 | O1677: math.max(0,(lv/10)-1) | P1677: math.max(0,(lv/10)-1) | Q1677: math.max(0,(lv/10)-1) | R1677: 0; | S1677: 有药王谷和盘丝洞的弟子在，真是不爽，还是跑路算了！ | T1677: 药王谷和盘丝洞的弟子不在眼前，真是轻松愉快啊！ | U1677: 0 | V1677: 0,0; | W1677: 4
A1678: 20349 | B1678: 喽啰 | C1678: pet_42 | D1678: 0 | E1678: 0 | F1678: 1311,100;1312,100;1315,100; | G1678: 5103,100;5108,100; | H1678: 130+26*LV*0.6 | I1678: 45+10.5*LV*0.6 | J1678: 32+9*LV*0.6 | K1678: 24+5*LV*0.6 | L1678: 13+3*LV*0.6 | M1678: 100000 | N1678: 0 | O1678: math.max(0,(lv/10)-1) | P1678: math.max(0,(lv/10)-1) | Q1678: math.max(0,(lv/10)-1) | R1678: 0; | S1678: 有药王谷和盘丝洞的弟子在，真是不爽，还是跑路算了！ | T1678: 药王谷和盘丝洞的弟子不在眼前，真是轻松愉快啊！ | U1678: 0 | V1678: 0,0; | W1678: 4
A1679: 20350 | B1679: 喽啰 | C1679: pet_42 | D1679: 0 | E1679: 0 | F1679: 1311,100;1312,100;1315,100; | G1679: 5103,100;5108,100; | H1679: 130+26*LV*0.6 | I1679: 45+10.5*LV*0.6 | J1679: 32+9*LV*0.6 | K1679: 24+5*LV*0.6 | L1679: 13+3*LV*0.6 | M1679: 100000 | N1679: 0 | O1679: math.max(0,(lv/10)-1) | P1679: math.max(0,(lv/10)-1) | Q1679: math.max(0,(lv/10)-1) | R1679: 0; | S1679: 有药王谷和盘丝洞的弟子在，真是不爽，还是跑路算了！ | T1679: 药王谷和盘丝洞的弟子不在眼前，真是轻松愉快啊！ | U1679: 0 | V1679: 0,0; | W1679: 4
A1680: 20351 | B1680: 喽啰 | C1680: pet_72 | D1680: 0 | E1680: 0 | F1680: 1311,100;1312,100;1315,100; | G1680: 5103,100;5108,100; | H1680: 130+26*LV*0.6 | I1680: 45+10.5*LV*0.6 | J1680: 32+9*LV*0.6 | K1680: 24+5*LV*0.6 | L1680: 13+3*LV*0.6 | M1680: 100000 | N1680: 0 | O1680: math.max(0,(lv/10)-1) | P1680: math.max(0,(lv/10)-1) | Q1680: math.max(0,(lv/10)-1) | R1680: 0; | S1680: 有药王谷和盘丝洞的弟子在，真是不爽，还是跑路算了！ | T1680: 药王谷和盘丝洞的弟子不在眼前，真是轻松愉快啊！ | U1680: 0 | V1680: 0,0; | W1680: 4
A1681: 20352 | B1681: 喽啰 | C1681: hero_1001 | D1681: 0 | E1681: 0 | F1681: 1311,100;1312,100;1315,100; | G1681: 5103,100;5108,100; | H1681: 130+26*LV*0.6 | I1681: 45+10.5*LV*0.6 | J1681: 32+9*LV*0.6 | K1681: 24+5*LV*0.6 | L1681: 13+3*LV*0.6 | M1681: 100000 | N1681: 0 | O1681: math.max(0,(lv/10)-1) | P1681: math.max(0,(lv/10)-1) | Q1681: math.max(0,(lv/10)-1) | R1681: 0; | S1681: 有药王谷和盘丝洞的弟子在，真是不爽，还是跑路算了！ | T1681: 药王谷和盘丝洞的弟子不在眼前，真是轻松愉快啊！ | U1681: 0 | V1681: 0,0; | W1681: 4
A1682: 20353 | B1682: 喽啰 | C1682: partner_1002 | D1682: 0 | E1682: 0 | F1682: 1311,100;1312,100;1315,100; | G1682: 5103,100;5108,100; | H1682: 130+26*LV*0.6 | I1682: 45+10.5*LV*0.6 | J1682: 32+9*LV*0.6 | K1682: 24+5*LV*0.6 | L1682: 13+3*LV*0.6 | M1682: 100000 | N1682: 0 | O1682: math.max(0,(lv/10)-1) | P1682: math.max(0,(lv/10)-1) | Q1682: math.max(0,(lv/10)-1) | R1682: 0; | S1682: 有药王谷和盘丝洞的弟子在，真是不爽，还是跑路算了！ | T1682: 药王谷和盘丝洞的弟子不在眼前，真是轻松愉快啊！ | U1682: 0 | V1682: 0,0; | W1682: 4
A1683: 20354 | B1683: 喽啰 | C1683: partner_1009 | D1683: 0 | E1683: 0 | F1683: 1311,100;1312,100;1315,100; | G1683: 5103,100;5108,100; | H1683: 130+26*LV*0.6 | I1683: 45+10.5*LV*0.6 | J1683: 32+9*LV*0.6 | K1683: 24+5*LV*0.6 | L1683: 13+3*LV*0.6 | M1683: 100000 | N1683: 0 | O1683: math.max(0,(lv/10)-1) | P1683: math.max(0,(lv/10)-1) | Q1683: math.max(0,(lv/10)-1) | R1683: 0; | S1683: 有药王谷和盘丝洞的弟子在，真是不爽，还是跑路算了！ | T1683: 药王谷和盘丝洞的弟子不在眼前，真是轻松愉快啊！ | U1683: 0 | V1683: 0,0; | W1683: 4
A1684: 20355 | B1684: 喽啰 | C1684: pet_63 | D1684: 0 | E1684: 0 | F1684: 1311,100;1312,100;1315,100; | G1684: 5103,100;5108,100; | H1684: 130+26*LV*0.6 | I1684: 45+10.5*LV*0.6 | J1684: 32+9*LV*0.6 | K1684: 24+5*LV*0.6 | L1684: 13+3*LV*0.6 | M1684: 100000 | N1684: 0 | O1684: math.max(0,(lv/10)-1) | P1684: math.max(0,(lv/10)-1) | Q1684: math.max(0,(lv/10)-1) | R1684: 0; | S1684: 有药王谷和盘丝洞的弟子在，真是不爽，还是跑路算了！ | T1684: 药王谷和盘丝洞的弟子不在眼前，真是轻松愉快啊！ | U1684: 0 | V1684: 0,0; | W1684: 4
A1685: 20356 | B1685: 喽啰 | C1685: hero_1001 | D1685: 0 | E1685: 0 | F1685: 1311,100;1312,100;1315,100; | G1685: 5103,100;5108,100; | H1685: 130+26*LV*0.6 | I1685: 45+10.5*LV*0.6 | J1685: 32+9*LV*0.6 | K1685: 24+5*LV*0.6 | L1685: 13+3*LV*0.6 | M1685: 100000 | N1685: 0 | O1685: math.max(0,(lv/10)-1) | P1685: math.max(0,(lv/10)-1) | Q1685: math.max(0,(lv/10)-1) | R1685: 0; | S1685: 有药王谷和盘丝洞的弟子在，真是不爽，还是跑路算了！ | T1685: 药王谷和盘丝洞的弟子不在眼前，真是轻松愉快啊！ | U1685: 0 | V1685: 0,0; | W1685: 4
A1686: 20357 | B1686: 喽啰 | C1686: pet_42 | D1686: 0 | E1686: 0 | F1686: 1311,100;1312,100;1315,100; | G1686: 5103,100;5108,100; | H1686: 130+26*LV*0.6 | I1686: 45+10.5*LV*0.6 | J1686: 32+9*LV*0.6 | K1686: 24+5*LV*0.6 | L1686: 13+3*LV*0.6 | M1686: 100000 | N1686: 0 | O1686: math.max(0,(lv/10)-1) | P1686: math.max(0,(lv/10)-1) | Q1686: math.max(0,(lv/10)-1) | R1686: 0; | S1686: 有药王谷和盘丝洞的弟子在，真是不爽，还是跑路算了！ | T1686: 药王谷和盘丝洞的弟子不在眼前，真是轻松愉快啊！ | U1686: 0 | V1686: 0,0; | W1686: 4
A1687: 20358 | B1687: 喽啰 | C1687: hero_1001 | D1687: 0 | E1687: 0 | F1687: 1311,100;1312,100;1315,100; | G1687: 5103,100;5108,100; | H1687: 130+26*LV*0.6 | I1687: 45+10.5*LV*0.6 | J1687: 32+9*LV*0.6 | K1687: 24+5*LV*0.6 | L1687: 13+3*LV*0.6 | M1687: 100000 | N1687: 0 | O1687: math.max(0,(lv/10)-1) | P1687: math.max(0,(lv/10)-1) | Q1687: math.max(0,(lv/10)-1) | R1687: 0; | S1687: 有药王谷和盘丝洞的弟子在，真是不爽，还是跑路算了！ | T1687: 药王谷和盘丝洞的弟子不在眼前，真是轻松愉快啊！ | U1687: 0 | V1687: 0,0; | W1687: 4
A1688: 20359 | B1688: 喽啰 | C1688: pet_22 | D1688: 0 | E1688: 0 | F1688: 1311,100;1312,100;1315,100; | G1688: 5103,100;5108,100; | H1688: 130+26*LV*0.6 | I1688: 45+10.5*LV*0.6 | J1688: 32+9*LV*0.6 | K1688: 24+5*LV*0.6 | L1688: 13+3*LV*0.6 | M1688: 100000 | N1688: 0 | O1688: math.max(0,(lv/10)-1) | P1688: math.max(0,(lv/10)-1) | Q1688: math.max(0,(lv/10)-1) | R1688: 0; | S1688: 有药王谷和盘丝洞的弟子在，真是不爽，还是跑路算了！ | T1688: 药王谷和盘丝洞的弟子不在眼前，真是轻松愉快啊！ | U1688: 0 | V1688: 0,0; | W1688: 4
A1689: 20360 | B1689: 喽啰 | C1689: pet_63 | D1689: 0 | E1689: 0 | F1689: 1311,100;1312,100;1315,100; | G1689: 5103,100;5108,100; | H1689: 130+26*LV*0.6 | I1689: 45+10.5*LV*0.6 | J1689: 32+9*LV*0.6 | K1689: 24+5*LV*0.6 | L1689: 13+3*LV*0.6 | M1689: 100000 | N1689: 0 | O1689: math.max(0,(lv/10)-1) | P1689: math.max(0,(lv/10)-1) | Q1689: math.max(0,(lv/10)-1) | R1689: 0; | S1689: 有药王谷和盘丝洞的弟子在，真是不爽，还是跑路算了！ | T1689: 药王谷和盘丝洞的弟子不在眼前，真是轻松愉快啊！ | U1689: 0 | V1689: 0,0; | W1689: 4
A1690: 20361 | B1690: 喽啰 | C1690: partner_1009 | D1690: 0 | E1690: 0 | F1690: 1311,100;1312,100;1315,100; | G1690: 5103,100;5108,100; | H1690: 130+26*LV*0.6 | I1690: 45+10.5*LV*0.6 | J1690: 32+9*LV*0.6 | K1690: 24+5*LV*0.6 | L1690: 13+3*LV*0.6 | M1690: 100000 | N1690: 0 | O1690: math.max(0,(lv/10)-1) | P1690: math.max(0,(lv/10)-1) | Q1690: math.max(0,(lv/10)-1) | R1690: 0; | S1690: 有药王谷和盘丝洞的弟子在，真是不爽，还是跑路算了！ | T1690: 药王谷和盘丝洞的弟子不在眼前，真是轻松愉快啊！ | U1690: 0 | V1690: 0,0; | W1690: 4
A1691: 20362 | B1691: 喽啰 | C1691: partner_1002 | D1691: 0 | E1691: 0 | F1691: 1311,100;1312,100;1315,100; | G1691: 5103,100;5108,100; | H1691: 130+26*LV*0.6 | I1691: 45+10.5*LV*0.6 | J1691: 32+9*LV*0.6 | K1691: 24+5*LV*0.6 | L1691: 13+3*LV*0.6 | M1691: 100000 | N1691: 0 | O1691: math.max(0,(lv/10)-1) | P1691: math.max(0,(lv/10)-1) | Q1691: math.max(0,(lv/10)-1) | R1691: 0; | S1691: 有药王谷和盘丝洞的弟子在，真是不爽，还是跑路算了！ | T1691: 药王谷和盘丝洞的弟子不在眼前，真是轻松愉快啊！ | U1691: 0 | V1691: 0,0; | W1691: 4
A1692: 20363 | B1692: 喽啰 | C1692: pet_23 | D1692: 0 | E1692: 0 | F1692: 1311,100;1312,100;1315,100; | G1692: 5103,100;5108,100; | H1692: 130+26*LV*0.6 | I1692: 45+10.5*LV*0.6 | J1692: 32+9*LV*0.6 | K1692: 24+5*LV*0.6 | L1692: 13+3*LV*0.6 | M1692: 100000 | N1692: 0 | O1692: math.max(0,(lv/10)-1) | P1692: math.max(0,(lv/10)-1) | Q1692: math.max(0,(lv/10)-1) | R1692: 0; | S1692: 有药王谷和盘丝洞的弟子在，真是不爽，还是跑路算了！ | T1692: 药王谷和盘丝洞的弟子不在眼前，真是轻松愉快啊！ | U1692: 0 | V1692: 0,0; | W1692: 4
A1693: 20364 | B1693: 喽啰 | C1693: pet_23 | D1693: 0 | E1693: 0 | F1693: 1311,100;1312,100;1315,100; | G1693: 5103,100;5108,100; | H1693: 130+26*LV*0.6 | I1693: 45+10.5*LV*0.6 | J1693: 32+9*LV*0.6 | K1693: 24+5*LV*0.6 | L1693: 13+3*LV*0.6 | M1693: 100000 | N1693: 0 | O1693: math.max(0,(lv/10)-1) | P1693: math.max(0,(lv/10)-1) | Q1693: math.max(0,(lv/10)-1) | R1693: 0; | S1693: 有药王谷和盘丝洞的弟子在，真是不爽，还是跑路算了！ | T1693: 药王谷和盘丝洞的弟子不在眼前，真是轻松愉快啊！ | U1693: 0 | V1693: 0,0; | W1693: 4
A1694: 20365 | B1694: 喽啰 | C1694: pet_61 | D1694: 0 | E1694: 0 | F1694: 1311,100;1312,100;1315,100; | G1694: 5103,100;5108,100; | H1694: 130+26*LV*0.6 | I1694: 45+10.5*LV*0.6 | J1694: 32+9*LV*0.6 | K1694: 24+5*LV*0.6 | L1694: 13+3*LV*0.6 | M1694: 100000 | N1694: 0 | O1694: math.max(0,(lv/10)-1) | P1694: math.max(0,(lv/10)-1) | Q1694: math.max(0,(lv/10)-1) | R1694: 0; | S1694: 有药王谷和盘丝洞的弟子在，真是不爽，还是跑路算了！ | T1694: 药王谷和盘丝洞的弟子不在眼前，真是轻松愉快啊！ | U1694: 0 | V1694: 0,0; | W1694: 4
A1695: 20366 | B1695: 喽啰 | C1695: pet_63 | D1695: 0 | E1695: 0 | F1695: 1311,100;1312,100;1315,100; | G1695: 5103,100;5108,100; | H1695: 130+26*LV*0.6 | I1695: 45+10.5*LV*0.6 | J1695: 32+9*LV*0.6 | K1695: 24+5*LV*0.6 | L1695: 13+3*LV*0.6 | M1695: 100000 | N1695: 0 | O1695: math.max(0,(lv/10)-1) | P1695: math.max(0,(lv/10)-1) | Q1695: math.max(0,(lv/10)-1) | R1695: 0; | S1695: 有药王谷和盘丝洞的弟子在，真是不爽，还是跑路算了！ | T1695: 药王谷和盘丝洞的弟子不在眼前，真是轻松愉快啊！ | U1695: 0 | V1695: 0,0; | W1695: 4
A1696: 20367 | B1696: 喽啰 | C1696: hero_1001 | D1696: 0 | E1696: 0 | F1696: 1311,100;1312,100;1315,100; | G1696: 5103,100;5108,100; | H1696: 130+26*LV*0.6 | I1696: 45+10.5*LV*0.6 | J1696: 32+9*LV*0.6 | K1696: 24+5*LV*0.6 | L1696: 13+3*LV*0.6 | M1696: 100000 | N1696: 0 | O1696: math.max(0,(lv/10)-1) | P1696: math.max(0,(lv/10)-1) | Q1696: math.max(0,(lv/10)-1) | R1696: 0; | S1696: 有药王谷和盘丝洞的弟子在，真是不爽，还是跑路算了！ | T1696: 药王谷和盘丝洞的弟子不在眼前，真是轻松愉快啊！ | U1696: 0 | V1696: 0,0; | W1696: 4
A1697: 20368 | B1697: 喽啰 | C1697: pet_22 | D1697: 0 | E1697: 0 | F1697: 1311,100;1312,100;1315,100; | G1697: 5103,100;5108,100; | H1697: 130+26*LV*0.6 | I1697: 45+10.5*LV*0.6 | J1697: 32+9*LV*0.6 | K1697: 24+5*LV*0.6 | L1697: 13+3*LV*0.6 | M1697: 100000 | N1697: 0 | O1697: math.max(0,(lv/10)-1) | P1697: math.max(0,(lv/10)-1) | Q1697: math.max(0,(lv/10)-1) | R1697: 0; | S1697: 有药王谷和盘丝洞的弟子在，真是不爽，还是跑路算了！ | T1697: 药王谷和盘丝洞的弟子不在眼前，真是轻松愉快啊！ | U1697: 0 | V1697: 0,0; | W1697: 4
A1698: 20369 | B1698: 喽啰 | C1698: pet_62 | D1698: 0 | E1698: 0 | F1698: 1311,100;1312,100;1315,100; | G1698: 5103,100;5108,100; | H1698: 130+26*LV*0.6 | I1698: 45+10.5*LV*0.6 | J1698: 32+9*LV*0.6 | K1698: 24+5*LV*0.6 | L1698: 13+3*LV*0.6 | M1698: 100000 | N1698: 0 | O1698: math.max(0,(lv/10)-1) | P1698: math.max(0,(lv/10)-1) | Q1698: math.max(0,(lv/10)-1) | R1698: 0; | S1698: 有药王谷和盘丝洞的弟子在，真是不爽，还是跑路算了！ | T1698: 药王谷和盘丝洞的弟子不在眼前，真是轻松愉快啊！ | U1698: 0 | V1698: 0,0; | W1698: 4
A1699: 20370 | B1699: 喽啰 | C1699: pet_21 | D1699: 0 | E1699: 0 | F1699: 1311,100;1312,100;1315,100; | G1699: 5103,100;5108,100; | H1699: 130+26*LV*0.6 | I1699: 45+10.5*LV*0.6 | J1699: 32+9*LV*0.6 | K1699: 24+5*LV*0.6 | L1699: 13+3*LV*0.6 | M1699: 100000 | N1699: 0 | O1699: math.max(0,(lv/10)-1) | P1699: math.max(0,(lv/10)-1) | Q1699: math.max(0,(lv/10)-1) | R1699: 0; | S1699: 有药王谷和盘丝洞的弟子在，真是不爽，还是跑路算了！ | T1699: 药王谷和盘丝洞的弟子不在眼前，真是轻松愉快啊！ | U1699: 0 | V1699: 0,0; | W1699: 4
A1700: 20371 | B1700: 喽啰 | C1700: pet_21 | D1700: 0 | E1700: 0 | F1700: 1311,100;1312,100;1315,100; | G1700: 5103,100;5108,100; | H1700: 130+26*LV*0.6 | I1700: 45+10.5*LV*0.6 | J1700: 32+9*LV*0.6 | K1700: 24+5*LV*0.6 | L1700: 13+3*LV*0.6 | M1700: 100000 | N1700: 0 | O1700: math.max(0,(lv/10)-1) | P1700: math.max(0,(lv/10)-1) | Q1700: math.max(0,(lv/10)-1) | R1700: 0; | S1700: 有药王谷和盘丝洞的弟子在，真是不爽，还是跑路算了！ | T1700: 药王谷和盘丝洞的弟子不在眼前，真是轻松愉快啊！ | U1700: 0 | V1700: 0,0; | W1700: 4
A1701: 20372 | B1701: 喽啰 | C1701: pet_81 | D1701: 0 | E1701: 0 | F1701: 1311,100;1312,100;1315,100; | G1701: 5103,100;5108,100; | H1701: 130+26*LV*0.6 | I1701: 45+10.5*LV*0.6 | J1701: 32+9*LV*0.6 | K1701: 24+5*LV*0.6 | L1701: 13+3*LV*0.6 | M1701: 100000 | N1701: 0 | O1701: math.max(0,(lv/10)-1) | P1701: math.max(0,(lv/10)-1) | Q1701: math.max(0,(lv/10)-1) | R1701: 0; | S1701: 有药王谷和盘丝洞的弟子在，真是不爽，还是跑路算了！ | T1701: 药王谷和盘丝洞的弟子不在眼前，真是轻松愉快啊！ | U1701: 0 | V1701: 0,0; | W1701: 4
A1702: 20373 | B1702: 喽啰 | C1702: pet_53 | D1702: 0 | E1702: 0 | F1702: 1311,100;1312,100;1315,100; | G1702: 5103,100;5108,100; | H1702: 130+26*LV*0.6 | I1702: 45+10.5*LV*0.6 | J1702: 32+9*LV*0.6 | K1702: 24+5*LV*0.6 | L1702: 13+3*LV*0.6 | M1702: 100000 | N1702: 0 | O1702: math.max(0,(lv/10)-1) | P1702: math.max(0,(lv/10)-1) | Q1702: math.max(0,(lv/10)-1) | R1702: 0; | S1702: 有药王谷和盘丝洞的弟子在，真是不爽，还是跑路算了！ | T1702: 药王谷和盘丝洞的弟子不在眼前，真是轻松愉快啊！ | U1702: 0 | V1702: 0,0; | W1702: 4
A1703: 20374 | B1703: 喽啰 | C1703: pet_61 | D1703: 0 | E1703: 0 | F1703: 1311,100;1312,100;1315,100; | G1703: 5103,100;5108,100; | H1703: 130+26*LV*0.6 | I1703: 45+10.5*LV*0.6 | J1703: 32+9*LV*0.6 | K1703: 24+5*LV*0.6 | L1703: 13+3*LV*0.6 | M1703: 100000 | N1703: 0 | O1703: math.max(0,(lv/10)-1) | P1703: math.max(0,(lv/10)-1) | Q1703: math.max(0,(lv/10)-1) | R1703: 0; | S1703: 有药王谷和盘丝洞的弟子在，真是不爽，还是跑路算了！ | T1703: 药王谷和盘丝洞的弟子不在眼前，真是轻松愉快啊！ | U1703: 0 | V1703: 0,0; | W1703: 4
A1704: 20375 | B1704: 喽啰 | C1704: partner_1010 | D1704: 0 | E1704: 0 | F1704: 1311,100;1312,100;1315,100; | G1704: 5103,100;5108,100; | H1704: 130+26*LV*0.6 | I1704: 45+10.5*LV*0.6 | J1704: 32+9*LV*0.6 | K1704: 24+5*LV*0.6 | L1704: 13+3*LV*0.6 | M1704: 100000 | N1704: 0 | O1704: math.max(0,(lv/10)-1) | P1704: math.max(0,(lv/10)-1) | Q1704: math.max(0,(lv/10)-1) | R1704: 0; | S1704: 有药王谷和盘丝洞的弟子在，真是不爽，还是跑路算了！ | T1704: 药王谷和盘丝洞的弟子不在眼前，真是轻松愉快啊！ | U1704: 0 | V1704: 0,0; | W1704: 4
A1705: 20376 | B1705: 喽啰 | C1705: pet_63 | D1705: 0 | E1705: 0 | F1705: 1311,100;1312,100;1315,100; | G1705: 5103,100;5108,100; | H1705: 130+26*LV*0.6 | I1705: 45+10.5*LV*0.6 | J1705: 32+9*LV*0.6 | K1705: 24+5*LV*0.6 | L1705: 13+3*LV*0.6 | M1705: 100000 | N1705: 0 | O1705: math.max(0,(lv/10)-1) | P1705: math.max(0,(lv/10)-1) | Q1705: math.max(0,(lv/10)-1) | R1705: 0; | S1705: 有药王谷和盘丝洞的弟子在，真是不爽，还是跑路算了！ | T1705: 药王谷和盘丝洞的弟子不在眼前，真是轻松愉快啊！ | U1705: 0 | V1705: 0,0; | W1705: 4
A1706: 20377 | B1706: 喽啰 | C1706: hero_1001 | D1706: 0 | E1706: 0 | F1706: 1311,100;1312,100;1315,100; | G1706: 5103,100;5108,100; | H1706: 130+26*LV*0.6 | I1706: 45+10.5*LV*0.6 | J1706: 32+9*LV*0.6 | K1706: 24+5*LV*0.6 | L1706: 13+3*LV*0.6 | M1706: 100000 | N1706: 0 | O1706: math.max(0,(lv/10)-1) | P1706: math.max(0,(lv/10)-1) | Q1706: math.max(0,(lv/10)-1) | R1706: 0; | S1706: 有药王谷和盘丝洞的弟子在，真是不爽，还是跑路算了！ | T1706: 药王谷和盘丝洞的弟子不在眼前，真是轻松愉快啊！ | U1706: 0 | V1706: 0,0; | W1706: 4
A1707: 20378 | B1707: 喽啰 | C1707: pet_22 | D1707: 0 | E1707: 0 | F1707: 1311,100;1312,100;1315,100; | G1707: 5103,100;5108,100; | H1707: 130+26*LV*0.6 | I1707: 45+10.5*LV*0.6 | J1707: 32+9*LV*0.6 | K1707: 24+5*LV*0.6 | L1707: 13+3*LV*0.6 | M1707: 100000 | N1707: 0 | O1707: math.max(0,(lv/10)-1) | P1707: math.max(0,(lv/10)-1) | Q1707: math.max(0,(lv/10)-1) | R1707: 0; | S1707: 有药王谷和盘丝洞的弟子在，真是不爽，还是跑路算了！ | T1707: 药王谷和盘丝洞的弟子不在眼前，真是轻松愉快啊！ | U1707: 0 | V1707: 0,0; | W1707: 4
A1708: 20379 | B1708: 喽啰 | C1708: pet_21 | D1708: 0 | E1708: 0 | F1708: 1311,100;1312,100;1315,100; | G1708: 5103,100;5108,100; | H1708: 130+26*LV*0.6 | I1708: 45+10.5*LV*0.6 | J1708: 32+9*LV*0.6 | K1708: 24+5*LV*0.6 | L1708: 13+3*LV*0.6 | M1708: 100000 | N1708: 0 | O1708: math.max(0,(lv/10)-1) | P1708: math.max(0,(lv/10)-1) | Q1708: math.max(0,(lv/10)-1) | R1708: 0; | S1708: 有药王谷和盘丝洞的弟子在，真是不爽，还是跑路算了！ | T1708: 药王谷和盘丝洞的弟子不在眼前，真是轻松愉快啊！ | U1708: 0 | V1708: 0,0; | W1708: 4
A1709: 20380 | B1709: 喽啰 | C1709: pet_61 | D1709: 0 | E1709: 0 | F1709: 1311,100;1312,100;1315,100; | G1709: 5103,100;5108,100; | H1709: 130+26*LV*0.6 | I1709: 45+10.5*LV*0.6 | J1709: 32+9*LV*0.6 | K1709: 24+5*LV*0.6 | L1709: 13+3*LV*0.6 | M1709: 100000 | N1709: 0 | O1709: math.max(0,(lv/10)-1) | P1709: math.max(0,(lv/10)-1) | Q1709: math.max(0,(lv/10)-1) | R1709: 0; | S1709: 有药王谷和盘丝洞的弟子在，真是不爽，还是跑路算了！ | T1709: 药王谷和盘丝洞的弟子不在眼前，真是轻松愉快啊！ | U1709: 0 | V1709: 0,0; | W1709: 4
A1710: 20381 | B1710: 喽啰 | C1710: pet_23 | D1710: 0 | E1710: 0 | F1710: 1311,100;1312,100;1315,100; | G1710: 5103,100;5108,100; | H1710: 130+26*LV*0.6 | I1710: 45+10.5*LV*0.6 | J1710: 32+9*LV*0.6 | K1710: 24+5*LV*0.6 | L1710: 13+3*LV*0.6 | M1710: 100000 | N1710: 0 | O1710: math.max(0,(lv/5)-1) | P1710: math.max(0,(lv/5)-1) | Q1710: math.max(0,(lv/5)-1) | R1710: 0; | S1710: 有药王谷和盘丝洞的弟子在，真是不爽，还是跑路算了！ | T1710: 药王谷和盘丝洞的弟子不在眼前，真是轻松愉快啊！ | U1710: 0 | V1710: 0,0; | W1710: 4
A1711: 20382 | B1711: 喽啰 | C1711: pet_63 | D1711: 0 | E1711: 0 | F1711: 1311,100;1312,100;1315,100; | G1711: 5103,100;5108,100; | H1711: 130+26*LV*0.6 | I1711: 45+10.5*LV*0.6 | J1711: 32+9*LV*0.6 | K1711: 24+5*LV*0.6 | L1711: 13+3*LV*0.6 | M1711: 100000 | N1711: 0 | O1711: math.max(0,(lv/5)-1) | P1711: math.max(0,(lv/5)-1) | Q1711: math.max(0,(lv/5)-1) | R1711: 0; | S1711: 有药王谷和盘丝洞的弟子在，真是不爽，还是跑路算了！ | T1711: 药王谷和盘丝洞的弟子不在眼前，真是轻松愉快啊！ | U1711: 0 | V1711: 0,0; | W1711: 4
A1712: 20383 | B1712: 喽啰 | C1712: partner_1009 | D1712: 0 | E1712: 0 | F1712: 1311,100;1312,100;1315,100; | G1712: 5103,100;5108,100; | H1712: 130+26*LV*0.6 | I1712: 45+10.5*LV*0.6 | J1712: 32+9*LV*0.6 | K1712: 24+5*LV*0.6 | L1712: 13+3*LV*0.6 | M1712: 100000 | N1712: 0 | O1712: math.max(0,(lv/5)-1) | P1712: math.max(0,(lv/5)-1) | Q1712: math.max(0,(lv/5)-1) | R1712: 0; | S1712: 有药王谷和盘丝洞的弟子在，真是不爽，还是跑路算了！ | T1712: 药王谷和盘丝洞的弟子不在眼前，真是轻松愉快啊！ | U1712: 0 | V1712: 0,0; | W1712: 4
A1713: 20384 | B1713: 喽啰 | C1713: pet_62 | D1713: 0 | E1713: 0 | F1713: 1311,100;1312,100;1315,100; | G1713: 5103,100;5108,100; | H1713: 130+26*LV*0.6 | I1713: 45+10.5*LV*0.6 | J1713: 32+9*LV*0.6 | K1713: 24+5*LV*0.6 | L1713: 13+3*LV*0.6 | M1713: 100000 | N1713: 0 | O1713: math.max(0,(lv/5)-1) | P1713: math.max(0,(lv/5)-1) | Q1713: math.max(0,(lv/5)-1) | R1713: 0; | S1713: 有药王谷和盘丝洞的弟子在，真是不爽，还是跑路算了！ | T1713: 药王谷和盘丝洞的弟子不在眼前，真是轻松愉快啊！ | U1713: 0 | V1713: 0,0; | W1713: 4
A1714: 20385 | B1714: 喽啰 | C1714: pet_73 | D1714: 0 | E1714: 0 | F1714: 1311,100;1312,100;1315,100; | G1714: 5103,100;5108,100; | H1714: 130+26*LV*0.6 | I1714: 45+10.5*LV*0.6 | J1714: 32+9*LV*0.6 | K1714: 24+5*LV*0.6 | L1714: 13+3*LV*0.6 | M1714: 100000 | N1714: 0 | O1714: math.max(0,(lv/5)-1) | P1714: math.max(0,(lv/5)-1) | Q1714: math.max(0,(lv/5)-1) | R1714: 0; | S1714: 有药王谷和盘丝洞的弟子在，真是不爽，还是跑路算了！ | T1714: 药王谷和盘丝洞的弟子不在眼前，真是轻松愉快啊！ | U1714: 0 | V1714: 0,0; | W1714: 4
A1715: 20386 | B1715: 喽啰 | C1715: pet_21 | D1715: 0 | E1715: 0 | F1715: 1311,100;1312,100;1315,100; | G1715: 5103,100;5108,100; | H1715: 130+26*LV*0.6 | I1715: 45+10.5*LV*0.6 | J1715: 32+9*LV*0.6 | K1715: 24+5*LV*0.6 | L1715: 13+3*LV*0.6 | M1715: 100000 | N1715: 0 | O1715: math.max(0,(lv/5)-1) | P1715: math.max(0,(lv/5)-1) | Q1715: math.max(0,(lv/5)-1) | R1715: 0; | S1715: 有药王谷和盘丝洞的弟子在，真是不爽，还是跑路算了！ | T1715: 药王谷和盘丝洞的弟子不在眼前，真是轻松愉快啊！ | U1715: 0 | V1715: 0,0; | W1715: 4
A1716: 20387 | B1716: 喽啰 | C1716: pet_62 | D1716: 0 | E1716: 0 | F1716: 1311,100;1312,100;1315,100; | G1716: 5103,100;5108,100; | H1716: 130+26*LV*0.6 | I1716: 45+10.5*LV*0.6 | J1716: 32+9*LV*0.6 | K1716: 24+5*LV*0.6 | L1716: 13+3*LV*0.6 | M1716: 100000 | N1716: 0 | O1716: math.max(0,(lv/5)-1) | P1716: math.max(0,(lv/5)-1) | Q1716: math.max(0,(lv/5)-1) | R1716: 0; | S1716: 有药王谷和盘丝洞的弟子在，真是不爽，还是跑路算了！ | T1716: 药王谷和盘丝洞的弟子不在眼前，真是轻松愉快啊！ | U1716: 0 | V1716: 0,0; | W1716: 4
A1717: 20388 | B1717: 喽啰 | C1717: pet_63 | D1717: 0 | E1717: 0 | F1717: 1311,100;1312,100;1315,100; | G1717: 5103,100;5108,100; | H1717: 130+26*LV*0.6 | I1717: 45+10.5*LV*0.6 | J1717: 32+9*LV*0.6 | K1717: 24+5*LV*0.6 | L1717: 13+3*LV*0.6 | M1717: 100000 | N1717: 0 | O1717: math.max(0,(lv/5)-1) | P1717: math.max(0,(lv/5)-1) | Q1717: math.max(0,(lv/5)-1) | R1717: 0; | S1717: 有药王谷和盘丝洞的弟子在，真是不爽，还是跑路算了！ | T1717: 药王谷和盘丝洞的弟子不在眼前，真是轻松愉快啊！ | U1717: 0 | V1717: 0,0; | W1717: 4
A1718: 20389 | B1718: 喽啰 | C1718: hero_1001 | D1718: 0 | E1718: 0 | F1718: 1311,100;1312,100;1315,100; | G1718: 5103,100;5108,100; | H1718: 130+26*LV*0.6 | I1718: 45+10.5*LV*0.6 | J1718: 32+9*LV*0.6 | K1718: 24+5*LV*0.6 | L1718: 13+3*LV*0.6 | M1718: 100000 | N1718: 0 | O1718: math.max(0,(lv/5)-1) | P1718: math.max(0,(lv/5)-1) | Q1718: math.max(0,(lv/5)-1) | R1718: 0; | S1718: 有药王谷和盘丝洞的弟子在，真是不爽，还是跑路算了！ | T1718: 药王谷和盘丝洞的弟子不在眼前，真是轻松愉快啊！ | U1718: 0 | V1718: 0,0; | W1718: 4
A1719: 20390 | B1719: 喽啰 | C1719: pet_62 | D1719: 0 | E1719: 0 | F1719: 1311,100;1312,100;1315,100; | G1719: 5103,100;5108,100; | H1719: 130+26*LV*0.6 | I1719: 45+10.5*LV*0.6 | J1719: 32+9*LV*0.6 | K1719: 24+5*LV*0.6 | L1719: 13+3*LV*0.6 | M1719: 100000 | N1719: 0 | O1719: math.max(0,(lv/5)-1) | P1719: math.max(0,(lv/5)-1) | Q1719: math.max(0,(lv/5)-1) | R1719: 0; | S1719: 有药王谷和盘丝洞的弟子在，真是不爽，还是跑路算了！ | T1719: 药王谷和盘丝洞的弟子不在眼前，真是轻松愉快啊！ | U1719: 0 | V1719: 0,0; | W1719: 4
A1720: 20391 | B1720: 喽啰 | C1720: pet_23 | D1720: 0 | E1720: 0 | F1720: 1311,100;1312,100;1315,100; | G1720: 5103,100;5108,100; | H1720: 130+26*LV*0.6 | I1720: 45+10.5*LV*0.6 | J1720: 32+9*LV*0.6 | K1720: 24+5*LV*0.6 | L1720: 13+3*LV*0.6 | M1720: 100000 | N1720: 0 | O1720: math.max(0,(lv/5)-1) | P1720: math.max(0,(lv/5)-1) | Q1720: math.max(0,(lv/5)-1) | R1720: 0; | S1720: 有药王谷和盘丝洞的弟子在，真是不爽，还是跑路算了！ | T1720: 药王谷和盘丝洞的弟子不在眼前，真是轻松愉快啊！ | U1720: 0 | V1720: 0,0; | W1720: 4
A1721: 20392 | B1721: 喽啰 | C1721: pet_61 | D1721: 0 | E1721: 0 | F1721: 1311,100;1312,100;1315,100; | G1721: 5103,100;5108,100; | H1721: 130+26*LV*0.6 | I1721: 45+10.5*LV*0.6 | J1721: 32+9*LV*0.6 | K1721: 24+5*LV*0.6 | L1721: 13+3*LV*0.6 | M1721: 100000 | N1721: 0 | O1721: math.max(0,(lv/5)-1) | P1721: math.max(0,(lv/5)-1) | Q1721: math.max(0,(lv/5)-1) | R1721: 0; | S1721: 有药王谷和盘丝洞的弟子在，真是不爽，还是跑路算了！ | T1721: 药王谷和盘丝洞的弟子不在眼前，真是轻松愉快啊！ | U1721: 0 | V1721: 0,0; | W1721: 4
A1722: 20393 | B1722: 喽啰 | C1722: pet_62 | D1722: 0 | E1722: 0 | F1722: 1311,100;1312,100;1315,100; | G1722: 5103,100;5108,100; | H1722: 130+26*LV*0.6 | I1722: 45+10.5*LV*0.6 | J1722: 32+9*LV*0.6 | K1722: 24+5*LV*0.6 | L1722: 13+3*LV*0.6 | M1722: 100000 | N1722: 0 | O1722: math.max(0,(lv/5)-1) | P1722: math.max(0,(lv/5)-1) | Q1722: math.max(0,(lv/5)-1) | R1722: 0; | S1722: 有药王谷和盘丝洞的弟子在，真是不爽，还是跑路算了！ | T1722: 药王谷和盘丝洞的弟子不在眼前，真是轻松愉快啊！ | U1722: 0 | V1722: 0,0; | W1722: 4
A1723: 20394 | B1723: 喽啰 | C1723: pet_53 | D1723: 0 | E1723: 0 | F1723: 1311,100;1312,100;1315,100; | G1723: 5103,100;5108,100; | H1723: 130+26*LV*0.6 | I1723: 45+10.5*LV*0.6 | J1723: 32+9*LV*0.6 | K1723: 24+5*LV*0.6 | L1723: 13+3*LV*0.6 | M1723: 100000 | N1723: 0 | O1723: math.max(0,(lv/5)-1) | P1723: math.max(0,(lv/5)-1) | Q1723: math.max(0,(lv/5)-1) | R1723: 0; | S1723: 有药王谷和盘丝洞的弟子在，真是不爽，还是跑路算了！ | T1723: 药王谷和盘丝洞的弟子不在眼前，真是轻松愉快啊！ | U1723: 0 | V1723: 0,0; | W1723: 4
A1724: 20395 | B1724: 喽啰 | C1724: pet_23 | D1724: 0 | E1724: 0 | F1724: 1311,100;1312,100;1315,100; | G1724: 5103,100;5108,100; | H1724: 130+26*LV*0.6 | I1724: 45+10.5*LV*0.6 | J1724: 32+9*LV*0.6 | K1724: 24+5*LV*0.6 | L1724: 13+3*LV*0.6 | M1724: 100000 | N1724: 0 | O1724: math.max(0,(lv/5)-1) | P1724: math.max(0,(lv/5)-1) | Q1724: math.max(0,(lv/5)-1) | R1724: 0; | S1724: 有药王谷和盘丝洞的弟子在，真是不爽，还是跑路算了！ | T1724: 药王谷和盘丝洞的弟子不在眼前，真是轻松愉快啊！ | U1724: 0 | V1724: 0,0; | W1724: 4
A1725: 20396 | B1725: 喽啰 | C1725: partner_1009 | D1725: 0 | E1725: 0 | F1725: 1311,100;1312,100;1315,100; | G1725: 5103,100;5108,100; | H1725: 130+26*LV*0.6 | I1725: 45+10.5*LV*0.6 | J1725: 32+9*LV*0.6 | K1725: 24+5*LV*0.6 | L1725: 13+3*LV*0.6 | M1725: 100000 | N1725: 0 | O1725: math.max(0,(lv/5)-1) | P1725: math.max(0,(lv/5)-1) | Q1725: math.max(0,(lv/5)-1) | R1725: 0; | S1725: 有药王谷和盘丝洞的弟子在，真是不爽，还是跑路算了！ | T1725: 药王谷和盘丝洞的弟子不在眼前，真是轻松愉快啊！ | U1725: 0 | V1725: 0,0; | W1725: 4
A1726: 20397 | B1726: 喽啰 | C1726: pet_21 | D1726: 0 | E1726: 0 | F1726: 1311,100;1312,100;1315,100; | G1726: 5103,100;5108,100; | H1726: 130+26*LV*0.6 | I1726: 45+10.5*LV*0.6 | J1726: 32+9*LV*0.6 | K1726: 24+5*LV*0.6 | L1726: 13+3*LV*0.6 | M1726: 100000 | N1726: 0 | O1726: math.max(0,(lv/5)-1) | P1726: math.max(0,(lv/5)-1) | Q1726: math.max(0,(lv/5)-1) | R1726: 0; | S1726: 有药王谷和盘丝洞的弟子在，真是不爽，还是跑路算了！ | T1726: 药王谷和盘丝洞的弟子不在眼前，真是轻松愉快啊！ | U1726: 0 | V1726: 0,0; | W1726: 4
A1727: 20398 | B1727: 喽啰 | C1727: hero_1001 | D1727: 0 | E1727: 0 | F1727: 1311,100;1312,100;1315,100; | G1727: 5103,100;5108,100; | H1727: 130+26*LV*0.6 | I1727: 45+10.5*LV*0.6 | J1727: 32+9*LV*0.6 | K1727: 24+5*LV*0.6 | L1727: 13+3*LV*0.6 | M1727: 100000 | N1727: 0 | O1727: math.max(0,(lv/5)-1) | P1727: math.max(0,(lv/5)-1) | Q1727: math.max(0,(lv/5)-1) | R1727: 0; | S1727: 有药王谷和盘丝洞的弟子在，真是不爽，还是跑路算了！ | T1727: 药王谷和盘丝洞的弟子不在眼前，真是轻松愉快啊！ | U1727: 0 | V1727: 0,0; | W1727: 4
A1728: 20399 | B1728: 喽啰 | C1728: pet_33 | D1728: 0 | E1728: 0 | F1728: 1311,100;1312,100;1315,100; | G1728: 5103,100;5108,100; | H1728: 130+26*LV*0.6 | I1728: 45+10.5*LV*0.6 | J1728: 32+9*LV*0.6 | K1728: 24+5*LV*0.6 | L1728: 13+3*LV*0.6 | M1728: 100000 | N1728: 0 | O1728: math.max(0,(lv/5)-1) | P1728: math.max(0,(lv/5)-1) | Q1728: math.max(0,(lv/5)-1) | R1728: 0; | S1728: 有药王谷和盘丝洞的弟子在，真是不爽，还是跑路算了！ | T1728: 药王谷和盘丝洞的弟子不在眼前，真是轻松愉快啊！ | U1728: 0 | V1728: 0,0; | W1728: 4
A1729: 20400 | B1729: 喽啰 | C1729: pet_23 | D1729: 0 | E1729: 0 | F1729: 1311,100;1312,100;1315,100; | G1729: 5103,100;5108,100; | H1729: 130+26*LV*0.6 | I1729: 45+10.5*LV*0.6 | J1729: 32+9*LV*0.6 | K1729: 24+5*LV*0.6 | L1729: 13+3*LV*0.6 | M1729: 100000 | N1729: 0 | O1729: math.max(0,(lv/5)-1) | P1729: math.max(0,(lv/5)-1) | Q1729: math.max(0,(lv/5)-1) | R1729: 0; | S1729: 有药王谷和盘丝洞的弟子在，真是不爽，还是跑路算了！ | T1729: 药王谷和盘丝洞的弟子不在眼前，真是轻松愉快啊！ | U1729: 0 | V1729: 0,0; | W1729: 4
A1730: 20401 | B1730: 喽啰 | C1730: pet_42 | D1730: 0 | E1730: 0 | F1730: 1411,100;1416,100;1412,100; | G1730: 5210,100;5126,100;5131,100; | H1730: 130+26*LV*0.6 | I1730: 45+10.5*LV*0.6 | J1730: 32+9*LV*0.6 | K1730: 24+5*LV*0.6 | L1730: 13+3*LV*0.6 | M1730: 100000 | N1730: 0 | O1730: math.max(0,(lv/10)-1) | P1730: math.max(0,(lv/10)-1) | Q1730: math.max(0,(lv/10)-1) | R1730: 0; | S1730: 有药王谷和盘丝洞的弟子在，真是不爽，还是跑路算了！ | T1730: 药王谷和盘丝洞的弟子不在眼前，真是轻松愉快啊！ | U1730: 0 | V1730: 0,0; | W1730: 2
A1731: 20402 | B1731: 喽啰 | C1731: pet_42 | D1731: 0 | E1731: 0 | F1731: 1411,100;1416,100;1412,100; | G1731: 5210,100;5126,100;5131,100; | H1731: 130+26*LV*0.6 | I1731: 45+10.5*LV*0.6 | J1731: 32+9*LV*0.6 | K1731: 24+5*LV*0.6 | L1731: 13+3*LV*0.6 | M1731: 100000 | N1731: 0 | O1731: math.max(0,(lv/10)-1) | P1731: math.max(0,(lv/10)-1) | Q1731: math.max(0,(lv/10)-1) | R1731: 0; | S1731: 有药王谷和盘丝洞的弟子在，真是不爽，还是跑路算了！ | T1731: 药王谷和盘丝洞的弟子不在眼前，真是轻松愉快啊！ | U1731: 0 | V1731: 0,0; | W1731: 2
A1732: 20403 | B1732: 喽啰 | C1732: pet_42 | D1732: 0 | E1732: 0 | F1732: 1411,100;1416,100;1412,100; | G1732: 5210,100;5126,100;5131,100; | H1732: 130+26*LV*0.6 | I1732: 45+10.5*LV*0.6 | J1732: 32+9*LV*0.6 | K1732: 24+5*LV*0.6 | L1732: 13+3*LV*0.6 | M1732: 100000 | N1732: 0 | O1732: math.max(0,(lv/10)-1) | P1732: math.max(0,(lv/10)-1) | Q1732: math.max(0,(lv/10)-1) | R1732: 0; | S1732: 有药王谷和盘丝洞的弟子在，真是不爽，还是跑路算了！ | T1732: 药王谷和盘丝洞的弟子不在眼前，真是轻松愉快啊！ | U1732: 0 | V1732: 0,0; | W1732: 2
A1733: 20404 | B1733: 喽啰 | C1733: pet_42 | D1733: 0 | E1733: 0 | F1733: 1411,100;1416,100;1412,100; | G1733: 5210,100;5126,100;5131,100; | H1733: 130+26*LV*0.6 | I1733: 45+10.5*LV*0.6 | J1733: 32+9*LV*0.6 | K1733: 24+5*LV*0.6 | L1733: 13+3*LV*0.6 | M1733: 100000 | N1733: 0 | O1733: math.max(0,(lv/10)-1) | P1733: math.max(0,(lv/10)-1) | Q1733: math.max(0,(lv/10)-1) | R1733: 0; | S1733: 有药王谷和盘丝洞的弟子在，真是不爽，还是跑路算了！ | T1733: 药王谷和盘丝洞的弟子不在眼前，真是轻松愉快啊！ | U1733: 0 | V1733: 0,0; | W1733: 2
A1734: 20405 | B1734: 喽啰 | C1734: pet_42 | D1734: 0 | E1734: 0 | F1734: 1411,100;1416,100;1412,100; | G1734: 5210,100;5126,100;5131,100; | H1734: 130+26*LV*0.6 | I1734: 45+10.5*LV*0.6 | J1734: 32+9*LV*0.6 | K1734: 24+5*LV*0.6 | L1734: 13+3*LV*0.6 | M1734: 100000 | N1734: 0 | O1734: math.max(0,(lv/10)-1) | P1734: math.max(0,(lv/10)-1) | Q1734: math.max(0,(lv/10)-1) | R1734: 0; | S1734: 有药王谷和盘丝洞的弟子在，真是不爽，还是跑路算了！ | T1734: 药王谷和盘丝洞的弟子不在眼前，真是轻松愉快啊！ | U1734: 0 | V1734: 0,0; | W1734: 2
A1735: 20406 | B1735: 喽啰 | C1735: pet_13 | D1735: 0 | E1735: 0 | F1735: 1411,100;1416,100;1412,100; | G1735: 5210,100;5126,100;5131,100; | H1735: 130+26*LV*0.6 | I1735: 45+10.5*LV*0.6 | J1735: 32+9*LV*0.6 | K1735: 24+5*LV*0.6 | L1735: 13+3*LV*0.6 | M1735: 100000 | N1735: 0 | O1735: math.max(0,(lv/10)-1) | P1735: math.max(0,(lv/10)-1) | Q1735: math.max(0,(lv/10)-1) | R1735: 0; | S1735: 有药王谷和盘丝洞的弟子在，真是不爽，还是跑路算了！ | T1735: 药王谷和盘丝洞的弟子不在眼前，真是轻松愉快啊！ | U1735: 0 | V1735: 0,0; | W1735: 2
A1736: 20407 | B1736: 喽啰 | C1736: pet_13 | D1736: 0 | E1736: 0 | F1736: 1411,100;1416,100;1412,100; | G1736: 5210,100;5126,100;5131,100; | H1736: 130+26*LV*0.6 | I1736: 45+10.5*LV*0.6 | J1736: 32+9*LV*0.6 | K1736: 24+5*LV*0.6 | L1736: 13+3*LV*0.6 | M1736: 100000 | N1736: 0 | O1736: math.max(0,(lv/10)-1) | P1736: math.max(0,(lv/10)-1) | Q1736: math.max(0,(lv/10)-1) | R1736: 0; | S1736: 有药王谷和盘丝洞的弟子在，真是不爽，还是跑路算了！ | T1736: 药王谷和盘丝洞的弟子不在眼前，真是轻松愉快啊！ | U1736: 0 | V1736: 0,0; | W1736: 2
A1737: 20408 | B1737: 喽啰 | C1737: pet_13 | D1737: 0 | E1737: 0 | F1737: 1411,100;1416,100;1412,100; | G1737: 5210,100;5126,100;5131,100; | H1737: 130+26*LV*0.6 | I1737: 45+10.5*LV*0.6 | J1737: 32+9*LV*0.6 | K1737: 24+5*LV*0.6 | L1737: 13+3*LV*0.6 | M1737: 100000 | N1737: 0 | O1737: math.max(0,(lv/10)-1) | P1737: math.max(0,(lv/10)-1) | Q1737: math.max(0,(lv/10)-1) | R1737: 0; | S1737: 有药王谷和盘丝洞的弟子在，真是不爽，还是跑路算了！ | T1737: 药王谷和盘丝洞的弟子不在眼前，真是轻松愉快啊！ | U1737: 0 | V1737: 0,0; | W1737: 2
A1738: 20409 | B1738: 喽啰 | C1738: pet_13 | D1738: 0 | E1738: 0 | F1738: 1411,100;1416,100;1412,100; | G1738: 5210,100;5126,100;5131,100; | H1738: 130+26*LV*0.6 | I1738: 45+10.5*LV*0.6 | J1738: 32+9*LV*0.6 | K1738: 24+5*LV*0.6 | L1738: 13+3*LV*0.6 | M1738: 100000 | N1738: 0 | O1738: math.max(0,(lv/10)-1) | P1738: math.max(0,(lv/10)-1) | Q1738: math.max(0,(lv/10)-1) | R1738: 0; | S1738: 有药王谷和盘丝洞的弟子在，真是不爽，还是跑路算了！ | T1738: 药王谷和盘丝洞的弟子不在眼前，真是轻松愉快啊！ | U1738: 0 | V1738: 0,0; | W1738: 2
A1739: 20410 | B1739: 喽啰 | C1739: pet_13 | D1739: 0 | E1739: 0 | F1739: 1411,100;1416,100;1412,100; | G1739: 5210,100;5126,100;5131,100; | H1739: 130+26*LV*0.6 | I1739: 45+10.5*LV*0.6 | J1739: 32+9*LV*0.6 | K1739: 24+5*LV*0.6 | L1739: 13+3*LV*0.6 | M1739: 100000 | N1739: 0 | O1739: math.max(0,(lv/10)-1) | P1739: math.max(0,(lv/10)-1) | Q1739: math.max(0,(lv/10)-1) | R1739: 0; | S1739: 有药王谷和盘丝洞的弟子在，真是不爽，还是跑路算了！ | T1739: 药王谷和盘丝洞的弟子不在眼前，真是轻松愉快啊！ | U1739: 0 | V1739: 0,0; | W1739: 2
A1740: 20411 | B1740: 喽啰 | C1740: pet_22 | D1740: 0 | E1740: 0 | F1740: 1411,100;1416,100;1412,100; | G1740: 5210,100;5126,100;5131,100; | H1740: 130+26*LV*0.6 | I1740: 45+10.5*LV*0.6 | J1740: 32+9*LV*0.6 | K1740: 24+5*LV*0.6 | L1740: 13+3*LV*0.6 | M1740: 100000 | N1740: 0 | O1740: math.max(0,(lv/10)-1) | P1740: math.max(0,(lv/10)-1) | Q1740: math.max(0,(lv/10)-1) | R1740: 0; | S1740: 有药王谷和盘丝洞的弟子在，真是不爽，还是跑路算了！ | T1740: 药王谷和盘丝洞的弟子不在眼前，真是轻松愉快啊！ | U1740: 0 | V1740: 0,0; | W1740: 2
A1741: 20412 | B1741: 喽啰 | C1741: pet_62 | D1741: 0 | E1741: 0 | F1741: 1411,100;1416,100;1412,100; | G1741: 5210,100;5126,100;5131,100; | H1741: 130+26*LV*0.6 | I1741: 45+10.5*LV*0.6 | J1741: 32+9*LV*0.6 | K1741: 24+5*LV*0.6 | L1741: 13+3*LV*0.6 | M1741: 100000 | N1741: 0 | O1741: math.max(0,(lv/10)-1) | P1741: math.max(0,(lv/10)-1) | Q1741: math.max(0,(lv/10)-1) | R1741: 0; | S1741: 有药王谷和盘丝洞的弟子在，真是不爽，还是跑路算了！ | T1741: 药王谷和盘丝洞的弟子不在眼前，真是轻松愉快啊！ | U1741: 0 | V1741: 0,0; | W1741: 2
A1742: 20413 | B1742: 喽啰 | C1742: hero_1001 | D1742: 0 | E1742: 0 | F1742: 1411,100;1416,100;1412,100; | G1742: 5210,100;5126,100;5131,100; | H1742: 130+26*LV*0.6 | I1742: 45+10.5*LV*0.6 | J1742: 32+9*LV*0.6 | K1742: 24+5*LV*0.6 | L1742: 13+3*LV*0.6 | M1742: 100000 | N1742: 0 | O1742: math.max(0,(lv/10)-1) | P1742: math.max(0,(lv/10)-1) | Q1742: math.max(0,(lv/10)-1) | R1742: 0; | S1742: 有药王谷和盘丝洞的弟子在，真是不爽，还是跑路算了！ | T1742: 药王谷和盘丝洞的弟子不在眼前，真是轻松愉快啊！ | U1742: 0 | V1742: 0,0; | W1742: 2
A1743: 20414 | B1743: 喽啰 | C1743: hero_1001 | D1743: 0 | E1743: 0 | F1743: 1411,100;1416,100;1412,100; | G1743: 5210,100;5126,100;5131,100; | H1743: 130+26*LV*0.6 | I1743: 45+10.5*LV*0.6 | J1743: 32+9*LV*0.6 | K1743: 24+5*LV*0.6 | L1743: 13+3*LV*0.6 | M1743: 100000 | N1743: 0 | O1743: math.max(0,(lv/10)-1) | P1743: math.max(0,(lv/10)-1) | Q1743: math.max(0,(lv/10)-1) | R1743: 0; | S1743: 有药王谷和盘丝洞的弟子在，真是不爽，还是跑路算了！ | T1743: 药王谷和盘丝洞的弟子不在眼前，真是轻松愉快啊！ | U1743: 0 | V1743: 0,0; | W1743: 2
A1744: 20415 | B1744: 喽啰 | C1744: common_3018 | D1744: 0 | E1744: 0 | F1744: 1411,100;1416,100;1412,100; | G1744: 5210,100;5126,100;5131,100; | H1744: 130+26*LV*0.6 | I1744: 45+10.5*LV*0.6 | J1744: 32+9*LV*0.6 | K1744: 24+5*LV*0.6 | L1744: 13+3*LV*0.6 | M1744: 100000 | N1744: 0 | O1744: math.max(0,(lv/10)-1) | P1744: math.max(0,(lv/10)-1) | Q1744: math.max(0,(lv/10)-1) | R1744: 0; | S1744: 有药王谷和盘丝洞的弟子在，真是不爽，还是跑路算了！ | T1744: 药王谷和盘丝洞的弟子不在眼前，真是轻松愉快啊！ | U1744: 0 | V1744: 0,0; | W1744: 2
A1745: 20416 | B1745: 喽啰 | C1745: hero_1001 | D1745: 0 | E1745: 0 | F1745: 1411,100;1416,100;1412,100; | G1745: 5210,100;5126,100;5131,100; | H1745: 130+26*LV*0.6 | I1745: 45+10.5*LV*0.6 | J1745: 32+9*LV*0.6 | K1745: 24+5*LV*0.6 | L1745: 13+3*LV*0.6 | M1745: 100000 | N1745: 0 | O1745: math.max(0,(lv/10)-1) | P1745: math.max(0,(lv/10)-1) | Q1745: math.max(0,(lv/10)-1) | R1745: 0; | S1745: 有药王谷和盘丝洞的弟子在，真是不爽，还是跑路算了！ | T1745: 药王谷和盘丝洞的弟子不在眼前，真是轻松愉快啊！ | U1745: 0 | V1745: 0,0; | W1745: 2
A1746: 20417 | B1746: 喽啰 | C1746: hero_2001 | D1746: 0 | E1746: 0 | F1746: 1411,100;1416,100;1412,100; | G1746: 5210,100;5126,100;5131,100; | H1746: 130+26*LV*0.6 | I1746: 45+10.5*LV*0.6 | J1746: 32+9*LV*0.6 | K1746: 24+5*LV*0.6 | L1746: 13+3*LV*0.6 | M1746: 100000 | N1746: 0 | O1746: math.max(0,(lv/10)-1) | P1746: math.max(0,(lv/10)-1) | Q1746: math.max(0,(lv/10)-1) | R1746: 0; | S1746: 有药王谷和盘丝洞的弟子在，真是不爽，还是跑路算了！ | T1746: 药王谷和盘丝洞的弟子不在眼前，真是轻松愉快啊！ | U1746: 0 | V1746: 0,0; | W1746: 2
A1747: 20418 | B1747: 喽啰 | C1747: pet_22 | D1747: 0 | E1747: 0 | F1747: 1411,100;1416,100;1412,100; | G1747: 5210,100;5126,100;5131,100; | H1747: 130+26*LV*0.6 | I1747: 45+10.5*LV*0.6 | J1747: 32+9*LV*0.6 | K1747: 24+5*LV*0.6 | L1747: 13+3*LV*0.6 | M1747: 100000 | N1747: 0 | O1747: math.max(0,(lv/10)-1) | P1747: math.max(0,(lv/10)-1) | Q1747: math.max(0,(lv/10)-1) | R1747: 0; | S1747: 有药王谷和盘丝洞的弟子在，真是不爽，还是跑路算了！ | T1747: 药王谷和盘丝洞的弟子不在眼前，真是轻松愉快啊！ | U1747: 0 | V1747: 0,0; | W1747: 2
A1748: 20419 | B1748: 喽啰 | C1748: hero_1001 | D1748: 0 | E1748: 0 | F1748: 1411,100;1416,100;1412,100; | G1748: 5210,100;5126,100;5131,100; | H1748: 130+26*LV*0.6 | I1748: 45+10.5*LV*0.6 | J1748: 32+9*LV*0.6 | K1748: 24+5*LV*0.6 | L1748: 13+3*LV*0.6 | M1748: 100000 | N1748: 0 | O1748: math.max(0,(lv/10)-1) | P1748: math.max(0,(lv/10)-1) | Q1748: math.max(0,(lv/10)-1) | R1748: 0; | S1748: 有药王谷和盘丝洞的弟子在，真是不爽，还是跑路算了！ | T1748: 药王谷和盘丝洞的弟子不在眼前，真是轻松愉快啊！ | U1748: 0 | V1748: 0,0; | W1748: 2
A1749: 20420 | B1749: 喽啰 | C1749: pet_22 | D1749: 0 | E1749: 0 | F1749: 1411,100;1416,100;1412,100; | G1749: 5210,100;5126,100;5131,100; | H1749: 130+26*LV*0.6 | I1749: 45+10.5*LV*0.6 | J1749: 32+9*LV*0.6 | K1749: 24+5*LV*0.6 | L1749: 13+3*LV*0.6 | M1749: 100000 | N1749: 0 | O1749: math.max(0,(lv/10)-1) | P1749: math.max(0,(lv/10)-1) | Q1749: math.max(0,(lv/10)-1) | R1749: 0; | S1749: 有药王谷和盘丝洞的弟子在，真是不爽，还是跑路算了！ | T1749: 药王谷和盘丝洞的弟子不在眼前，真是轻松愉快啊！ | U1749: 0 | V1749: 0,0; | W1749: 2
A1750: 20421 | B1750: 喽啰 | C1750: hero_1001 | D1750: 0 | E1750: 0 | F1750: 1411,100;1416,100;1412,100; | G1750: 5210,100;5126,100;5131,100; | H1750: 130+26*LV*0.6 | I1750: 45+10.5*LV*0.6 | J1750: 32+9*LV*0.6 | K1750: 24+5*LV*0.6 | L1750: 13+3*LV*0.6 | M1750: 100000 | N1750: 0 | O1750: math.max(0,(lv/10)-1) | P1750: math.max(0,(lv/10)-1) | Q1750: math.max(0,(lv/10)-1) | R1750: 0; | S1750: 有药王谷和盘丝洞的弟子在，真是不爽，还是跑路算了！ | T1750: 药王谷和盘丝洞的弟子不在眼前，真是轻松愉快啊！ | U1750: 0 | V1750: 0,0; | W1750: 2
A1751: 20422 | B1751: 喽啰 | C1751: hero_1001 | D1751: 0 | E1751: 0 | F1751: 1411,100;1416,100;1412,100; | G1751: 5210,100;5126,100;5131,100; | H1751: 130+26*LV*0.6 | I1751: 45+10.5*LV*0.6 | J1751: 32+9*LV*0.6 | K1751: 24+5*LV*0.6 | L1751: 13+3*LV*0.6 | M1751: 100000 | N1751: 0 | O1751: math.max(0,(lv/10)-1) | P1751: math.max(0,(lv/10)-1) | Q1751: math.max(0,(lv/10)-1) | R1751: 0; | S1751: 有药王谷和盘丝洞的弟子在，真是不爽，还是跑路算了！ | T1751: 药王谷和盘丝洞的弟子不在眼前，真是轻松愉快啊！ | U1751: 0 | V1751: 0,0; | W1751: 2
A1752: 20423 | B1752: 喽啰 | C1752: common_3007 | D1752: 0 | E1752: 0 | F1752: 1411,100;1416,100;1412,100; | G1752: 5210,100;5126,100;5131,100; | H1752: 130+26*LV*0.6 | I1752: 45+10.5*LV*0.6 | J1752: 32+9*LV*0.6 | K1752: 24+5*LV*0.6 | L1752: 13+3*LV*0.6 | M1752: 100000 | N1752: 0 | O1752: math.max(0,(lv/10)-1) | P1752: math.max(0,(lv/10)-1) | Q1752: math.max(0,(lv/10)-1) | R1752: 0; | S1752: 有药王谷和盘丝洞的弟子在，真是不爽，还是跑路算了！ | T1752: 药王谷和盘丝洞的弟子不在眼前，真是轻松愉快啊！ | U1752: 0 | V1752: 0,0; | W1752: 2
A1753: 20424 | B1753: 喽啰 | C1753: pet_53 | D1753: 0 | E1753: 0 | F1753: 1411,100;1416,100;1412,100; | G1753: 5210,100;5126,100;5131,100; | H1753: 130+26*LV*0.6 | I1753: 45+10.5*LV*0.6 | J1753: 32+9*LV*0.6 | K1753: 24+5*LV*0.6 | L1753: 13+3*LV*0.6 | M1753: 100000 | N1753: 0 | O1753: math.max(0,(lv/10)-1) | P1753: math.max(0,(lv/10)-1) | Q1753: math.max(0,(lv/10)-1) | R1753: 0; | S1753: 有药王谷和盘丝洞的弟子在，真是不爽，还是跑路算了！ | T1753: 药王谷和盘丝洞的弟子不在眼前，真是轻松愉快啊！ | U1753: 0 | V1753: 0,0; | W1753: 2
A1754: 20425 | B1754: 喽啰 | C1754: pet_61 | D1754: 0 | E1754: 0 | F1754: 1411,100;1416,100;1412,100; | G1754: 5210,100;5126,100;5131,100; | H1754: 130+26*LV*0.6 | I1754: 45+10.5*LV*0.6 | J1754: 32+9*LV*0.6 | K1754: 24+5*LV*0.6 | L1754: 13+3*LV*0.6 | M1754: 100000 | N1754: 0 | O1754: math.max(0,(lv/10)-1) | P1754: math.max(0,(lv/10)-1) | Q1754: math.max(0,(lv/10)-1) | R1754: 0; | S1754: 有药王谷和盘丝洞的弟子在，真是不爽，还是跑路算了！ | T1754: 药王谷和盘丝洞的弟子不在眼前，真是轻松愉快啊！ | U1754: 0 | V1754: 0,0; | W1754: 2
A1755: 20426 | B1755: 喽啰 | C1755: common_3018 | D1755: 0 | E1755: 0 | F1755: 1411,100;1416,100;1412,100; | G1755: 5210,100;5126,100;5131,100; | H1755: 130+26*LV*0.6 | I1755: 45+10.5*LV*0.6 | J1755: 32+9*LV*0.6 | K1755: 24+5*LV*0.6 | L1755: 13+3*LV*0.6 | M1755: 100000 | N1755: 0 | O1755: math.max(0,(lv/10)-1) | P1755: math.max(0,(lv/10)-1) | Q1755: math.max(0,(lv/10)-1) | R1755: 0; | S1755: 有药王谷和盘丝洞的弟子在，真是不爽，还是跑路算了！ | T1755: 药王谷和盘丝洞的弟子不在眼前，真是轻松愉快啊！ | U1755: 0 | V1755: 0,0; | W1755: 2
A1756: 20427 | B1756: 喽啰 | C1756: pet_13 | D1756: 0 | E1756: 0 | F1756: 1411,100;1416,100;1412,100; | G1756: 5210,100;5126,100;5131,100; | H1756: 130+26*LV*0.6 | I1756: 45+10.5*LV*0.6 | J1756: 32+9*LV*0.6 | K1756: 24+5*LV*0.6 | L1756: 13+3*LV*0.6 | M1756: 100000 | N1756: 0 | O1756: math.max(0,(lv/10)-1) | P1756: math.max(0,(lv/10)-1) | Q1756: math.max(0,(lv/10)-1) | R1756: 0; | S1756: 有药王谷和盘丝洞的弟子在，真是不爽，还是跑路算了！ | T1756: 药王谷和盘丝洞的弟子不在眼前，真是轻松愉快啊！ | U1756: 0 | V1756: 0,0; | W1756: 2
A1757: 20428 | B1757: 喽啰 | C1757: pet_23 | D1757: 0 | E1757: 0 | F1757: 1411,100;1416,100;1412,100; | G1757: 5210,100;5126,100;5131,100; | H1757: 130+26*LV*0.6 | I1757: 45+10.5*LV*0.6 | J1757: 32+9*LV*0.6 | K1757: 24+5*LV*0.6 | L1757: 13+3*LV*0.6 | M1757: 100000 | N1757: 0 | O1757: math.max(0,(lv/10)-1) | P1757: math.max(0,(lv/10)-1) | Q1757: math.max(0,(lv/10)-1) | R1757: 0; | S1757: 有药王谷和盘丝洞的弟子在，真是不爽，还是跑路算了！ | T1757: 药王谷和盘丝洞的弟子不在眼前，真是轻松愉快啊！ | U1757: 0 | V1757: 0,0; | W1757: 2
A1758: 20429 | B1758: 喽啰 | C1758: common_3018 | D1758: 0 | E1758: 0 | F1758: 1411,100;1416,100;1412,100; | G1758: 5210,100;5126,100;5131,100; | H1758: 130+26*LV*0.6 | I1758: 45+10.5*LV*0.6 | J1758: 32+9*LV*0.6 | K1758: 24+5*LV*0.6 | L1758: 13+3*LV*0.6 | M1758: 100000 | N1758: 0 | O1758: math.max(0,(lv/10)-1) | P1758: math.max(0,(lv/10)-1) | Q1758: math.max(0,(lv/10)-1) | R1758: 0; | S1758: 有药王谷和盘丝洞的弟子在，真是不爽，还是跑路算了！ | T1758: 药王谷和盘丝洞的弟子不在眼前，真是轻松愉快啊！ | U1758: 0 | V1758: 0,0; | W1758: 2
A1759: 20430 | B1759: 喽啰 | C1759: pet_71 | D1759: 0 | E1759: 0 | F1759: 1411,100;1416,100;1412,100; | G1759: 5210,100;5126,100;5131,100; | H1759: 130+26*LV*0.6 | I1759: 45+10.5*LV*0.6 | J1759: 32+9*LV*0.6 | K1759: 24+5*LV*0.6 | L1759: 13+3*LV*0.6 | M1759: 100000 | N1759: 0 | O1759: math.max(0,(lv/10)-1) | P1759: math.max(0,(lv/10)-1) | Q1759: math.max(0,(lv/10)-1) | R1759: 0; | S1759: 有药王谷和盘丝洞的弟子在，真是不爽，还是跑路算了！ | T1759: 药王谷和盘丝洞的弟子不在眼前，真是轻松愉快啊！ | U1759: 0 | V1759: 0,0; | W1759: 2
A1760: 20431 | B1760: 喽啰 | C1760: hero_1001 | D1760: 0 | E1760: 0 | F1760: 1411,100;1416,100;1412,100; | G1760: 5210,100;5126,100;5131,100; | H1760: 130+26*LV*0.6 | I1760: 45+10.5*LV*0.6 | J1760: 32+9*LV*0.6 | K1760: 24+5*LV*0.6 | L1760: 13+3*LV*0.6 | M1760: 100000 | N1760: 0 | O1760: math.max(0,(lv/10)-1) | P1760: math.max(0,(lv/10)-1) | Q1760: math.max(0,(lv/10)-1) | R1760: 0; | S1760: 有药王谷和盘丝洞的弟子在，真是不爽，还是跑路算了！ | T1760: 药王谷和盘丝洞的弟子不在眼前，真是轻松愉快啊！ | U1760: 0 | V1760: 0,0; | W1760: 2
A1761: 20432 | B1761: 喽啰 | C1761: common_3018 | D1761: 0 | E1761: 0 | F1761: 1411,100;1416,100;1412,100; | G1761: 5210,100;5126,100;5131,100; | H1761: 130+26*LV*0.6 | I1761: 45+10.5*LV*0.6 | J1761: 32+9*LV*0.6 | K1761: 24+5*LV*0.6 | L1761: 13+3*LV*0.6 | M1761: 100000 | N1761: 0 | O1761: math.max(0,(lv/10)-1) | P1761: math.max(0,(lv/10)-1) | Q1761: math.max(0,(lv/10)-1) | R1761: 0; | S1761: 有药王谷和盘丝洞的弟子在，真是不爽，还是跑路算了！ | T1761: 药王谷和盘丝洞的弟子不在眼前，真是轻松愉快啊！ | U1761: 0 | V1761: 0,0; | W1761: 2
A1762: 20433 | B1762: 喽啰 | C1762: hero_1001 | D1762: 0 | E1762: 0 | F1762: 1411,100;1416,100;1412,100; | G1762: 5210,100;5126,100;5131,100; | H1762: 130+26*LV*0.6 | I1762: 45+10.5*LV*0.6 | J1762: 32+9*LV*0.6 | K1762: 24+5*LV*0.6 | L1762: 13+3*LV*0.6 | M1762: 100000 | N1762: 0 | O1762: math.max(0,(lv/10)-1) | P1762: math.max(0,(lv/10)-1) | Q1762: math.max(0,(lv/10)-1) | R1762: 0; | S1762: 有药王谷和盘丝洞的弟子在，真是不爽，还是跑路算了！ | T1762: 药王谷和盘丝洞的弟子不在眼前，真是轻松愉快啊！ | U1762: 0 | V1762: 0,0; | W1762: 2
A1763: 20434 | B1763: 喽啰 | C1763: hero_2001 | D1763: 0 | E1763: 0 | F1763: 1411,100;1416,100;1412,100; | G1763: 5210,100;5126,100;5131,100; | H1763: 130+26*LV*0.6 | I1763: 45+10.5*LV*0.6 | J1763: 32+9*LV*0.6 | K1763: 24+5*LV*0.6 | L1763: 13+3*LV*0.6 | M1763: 100000 | N1763: 0 | O1763: math.max(0,(lv/10)-1) | P1763: math.max(0,(lv/10)-1) | Q1763: math.max(0,(lv/10)-1) | R1763: 0; | S1763: 有药王谷和盘丝洞的弟子在，真是不爽，还是跑路算了！ | T1763: 药王谷和盘丝洞的弟子不在眼前，真是轻松愉快啊！ | U1763: 0 | V1763: 0,0; | W1763: 2
A1764: 20435 | B1764: 喽啰 | C1764: pet_23 | D1764: 0 | E1764: 0 | F1764: 1411,100;1416,100;1412,100; | G1764: 5210,100;5126,100;5131,100; | H1764: 130+26*LV*0.6 | I1764: 45+10.5*LV*0.6 | J1764: 32+9*LV*0.6 | K1764: 24+5*LV*0.6 | L1764: 13+3*LV*0.6 | M1764: 100000 | N1764: 0 | O1764: math.max(0,(lv/10)-1) | P1764: math.max(0,(lv/10)-1) | Q1764: math.max(0,(lv/10)-1) | R1764: 0; | S1764: 有药王谷和盘丝洞的弟子在，真是不爽，还是跑路算了！ | T1764: 药王谷和盘丝洞的弟子不在眼前，真是轻松愉快啊！ | U1764: 0 | V1764: 0,0; | W1764: 2
A1765: 20436 | B1765: 喽啰 | C1765: pet_13 | D1765: 0 | E1765: 0 | F1765: 1411,100;1416,100;1412,100; | G1765: 5210,100;5126,100;5131,100; | H1765: 130+26*LV*0.6 | I1765: 45+10.5*LV*0.6 | J1765: 32+9*LV*0.6 | K1765: 24+5*LV*0.6 | L1765: 13+3*LV*0.6 | M1765: 100000 | N1765: 0 | O1765: math.max(0,(lv/10)-1) | P1765: math.max(0,(lv/10)-1) | Q1765: math.max(0,(lv/10)-1) | R1765: 0; | S1765: 有药王谷和盘丝洞的弟子在，真是不爽，还是跑路算了！ | T1765: 药王谷和盘丝洞的弟子不在眼前，真是轻松愉快啊！ | U1765: 0 | V1765: 0,0; | W1765: 2
A1766: 20437 | B1766: 喽啰 | C1766: pet_23 | D1766: 0 | E1766: 0 | F1766: 1411,100;1416,100;1412,100; | G1766: 5210,100;5126,100;5131,100; | H1766: 130+26*LV*0.6 | I1766: 45+10.5*LV*0.6 | J1766: 32+9*LV*0.6 | K1766: 24+5*LV*0.6 | L1766: 13+3*LV*0.6 | M1766: 100000 | N1766: 0 | O1766: math.max(0,(lv/10)-1) | P1766: math.max(0,(lv/10)-1) | Q1766: math.max(0,(lv/10)-1) | R1766: 0; | S1766: 有药王谷和盘丝洞的弟子在，真是不爽，还是跑路算了！ | T1766: 药王谷和盘丝洞的弟子不在眼前，真是轻松愉快啊！ | U1766: 0 | V1766: 0,0; | W1766: 2
A1767: 20438 | B1767: 喽啰 | C1767: pet_22 | D1767: 0 | E1767: 0 | F1767: 1411,100;1416,100;1412,100; | G1767: 5210,100;5126,100;5131,100; | H1767: 130+26*LV*0.6 | I1767: 45+10.5*LV*0.6 | J1767: 32+9*LV*0.6 | K1767: 24+5*LV*0.6 | L1767: 13+3*LV*0.6 | M1767: 100000 | N1767: 0 | O1767: math.max(0,(lv/10)-1) | P1767: math.max(0,(lv/10)-1) | Q1767: math.max(0,(lv/10)-1) | R1767: 0; | S1767: 有药王谷和盘丝洞的弟子在，真是不爽，还是跑路算了！ | T1767: 药王谷和盘丝洞的弟子不在眼前，真是轻松愉快啊！ | U1767: 0 | V1767: 0,0; | W1767: 2
A1768: 20439 | B1768: 喽啰 | C1768: hero_1001 | D1768: 0 | E1768: 0 | F1768: 1411,100;1416,100;1412,100; | G1768: 5210,100;5126,100;5131,100; | H1768: 130+26*LV*0.6 | I1768: 45+10.5*LV*0.6 | J1768: 32+9*LV*0.6 | K1768: 24+5*LV*0.6 | L1768: 13+3*LV*0.6 | M1768: 100000 | N1768: 0 | O1768: math.max(0,(lv/10)-1) | P1768: math.max(0,(lv/10)-1) | Q1768: math.max(0,(lv/10)-1) | R1768: 0; | S1768: 有药王谷和盘丝洞的弟子在，真是不爽，还是跑路算了！ | T1768: 药王谷和盘丝洞的弟子不在眼前，真是轻松愉快啊！ | U1768: 0 | V1768: 0,0; | W1768: 2
A1769: 20440 | B1769: 喽啰 | C1769: pet_22 | D1769: 0 | E1769: 0 | F1769: 1411,100;1416,100;1412,100; | G1769: 5210,100;5126,100;5131,100; | H1769: 130+26*LV*0.6 | I1769: 45+10.5*LV*0.6 | J1769: 32+9*LV*0.6 | K1769: 24+5*LV*0.6 | L1769: 13+3*LV*0.6 | M1769: 100000 | N1769: 0 | O1769: math.max(0,(lv/10)-1) | P1769: math.max(0,(lv/10)-1) | Q1769: math.max(0,(lv/10)-1) | R1769: 0; | S1769: 有药王谷和盘丝洞的弟子在，真是不爽，还是跑路算了！ | T1769: 药王谷和盘丝洞的弟子不在眼前，真是轻松愉快啊！ | U1769: 0 | V1769: 0,0; | W1769: 2
A1770: 20441 | B1770: 喽啰 | C1770: pet_23 | D1770: 0 | E1770: 0 | F1770: 1411,100;1416,100;1412,100; | G1770: 5210,100;5126,100;5131,100; | H1770: 130+26*LV*0.6 | I1770: 45+10.5*LV*0.6 | J1770: 32+9*LV*0.6 | K1770: 24+5*LV*0.6 | L1770: 13+3*LV*0.6 | M1770: 100000 | N1770: 0 | O1770: math.max(0,(lv/10)-1) | P1770: math.max(0,(lv/10)-1) | Q1770: math.max(0,(lv/10)-1) | R1770: 0; | S1770: 有药王谷和盘丝洞的弟子在，真是不爽，还是跑路算了！ | T1770: 药王谷和盘丝洞的弟子不在眼前，真是轻松愉快啊！ | U1770: 0 | V1770: 0,0; | W1770: 2
A1771: 20442 | B1771: 喽啰 | C1771: hero_1001 | D1771: 0 | E1771: 0 | F1771: 1411,100;1416,100;1412,100; | G1771: 5210,100;5126,100;5131,100; | H1771: 130+26*LV*0.6 | I1771: 45+10.5*LV*0.6 | J1771: 32+9*LV*0.6 | K1771: 24+5*LV*0.6 | L1771: 13+3*LV*0.6 | M1771: 100000 | N1771: 0 | O1771: math.max(0,(lv/10)-1) | P1771: math.max(0,(lv/10)-1) | Q1771: math.max(0,(lv/10)-1) | R1771: 0; | S1771: 有药王谷和盘丝洞的弟子在，真是不爽，还是跑路算了！ | T1771: 药王谷和盘丝洞的弟子不在眼前，真是轻松愉快啊！ | U1771: 0 | V1771: 0,0; | W1771: 2
A1772: 20443 | B1772: 喽啰 | C1772: hero_1001 | D1772: 0 | E1772: 0 | F1772: 1411,100;1416,100;1412,100; | G1772: 5210,100;5126,100;5131,100; | H1772: 130+26*LV*0.6 | I1772: 45+10.5*LV*0.6 | J1772: 32+9*LV*0.6 | K1772: 24+5*LV*0.6 | L1772: 13+3*LV*0.6 | M1772: 100000 | N1772: 0 | O1772: math.max(0,(lv/10)-1) | P1772: math.max(0,(lv/10)-1) | Q1772: math.max(0,(lv/10)-1) | R1772: 0; | S1772: 有药王谷和盘丝洞的弟子在，真是不爽，还是跑路算了！ | T1772: 药王谷和盘丝洞的弟子不在眼前，真是轻松愉快啊！ | U1772: 0 | V1772: 0,0; | W1772: 2
A1773: 20444 | B1773: 喽啰 | C1773: pet_43 | D1773: 0 | E1773: 0 | F1773: 1411,100;1416,100;1412,100; | G1773: 5210,100;5126,100;5131,100; | H1773: 130+26*LV*0.6 | I1773: 45+10.5*LV*0.6 | J1773: 32+9*LV*0.6 | K1773: 24+5*LV*0.6 | L1773: 13+3*LV*0.6 | M1773: 100000 | N1773: 0 | O1773: math.max(0,(lv/10)-1) | P1773: math.max(0,(lv/10)-1) | Q1773: math.max(0,(lv/10)-1) | R1773: 0; | S1773: 有药王谷和盘丝洞的弟子在，真是不爽，还是跑路算了！ | T1773: 药王谷和盘丝洞的弟子不在眼前，真是轻松愉快啊！ | U1773: 0 | V1773: 0,0; | W1773: 2
A1774: 20445 | B1774: 喽啰 | C1774: pet_53 | D1774: 0 | E1774: 0 | F1774: 1411,100;1416,100;1412,100; | G1774: 5210,100;5126,100;5131,100; | H1774: 130+26*LV*0.6 | I1774: 45+10.5*LV*0.6 | J1774: 32+9*LV*0.6 | K1774: 24+5*LV*0.6 | L1774: 13+3*LV*0.6 | M1774: 100000 | N1774: 0 | O1774: math.max(0,(lv/10)-1) | P1774: math.max(0,(lv/10)-1) | Q1774: math.max(0,(lv/10)-1) | R1774: 0; | S1774: 有药王谷和盘丝洞的弟子在，真是不爽，还是跑路算了！ | T1774: 药王谷和盘丝洞的弟子不在眼前，真是轻松愉快啊！ | U1774: 0 | V1774: 0,0; | W1774: 2
A1775: 20446 | B1775: 喽啰 | C1775: pet_61 | D1775: 0 | E1775: 0 | F1775: 1411,100;1416,100;1412,100; | G1775: 5210,100;5126,100;5131,100; | H1775: 130+26*LV*0.6 | I1775: 45+10.5*LV*0.6 | J1775: 32+9*LV*0.6 | K1775: 24+5*LV*0.6 | L1775: 13+3*LV*0.6 | M1775: 100000 | N1775: 0 | O1775: math.max(0,(lv/10)-1) | P1775: math.max(0,(lv/10)-1) | Q1775: math.max(0,(lv/10)-1) | R1775: 0; | S1775: 有药王谷和盘丝洞的弟子在，真是不爽，还是跑路算了！ | T1775: 药王谷和盘丝洞的弟子不在眼前，真是轻松愉快啊！ | U1775: 0 | V1775: 0,0; | W1775: 2
A1776: 20447 | B1776: 喽啰 | C1776: pet_3 | D1776: 0 | E1776: 0 | F1776: 1411,100;1416,100;1412,100; | G1776: 5210,100;5126,100;5131,100; | H1776: 130+26*LV*0.6 | I1776: 45+10.5*LV*0.6 | J1776: 32+9*LV*0.6 | K1776: 24+5*LV*0.6 | L1776: 13+3*LV*0.6 | M1776: 100000 | N1776: 0 | O1776: math.max(0,(lv/10)-1) | P1776: math.max(0,(lv/10)-1) | Q1776: math.max(0,(lv/10)-1) | R1776: 0; | S1776: 有药王谷和盘丝洞的弟子在，真是不爽，还是跑路算了！ | T1776: 药王谷和盘丝洞的弟子不在眼前，真是轻松愉快啊！ | U1776: 0 | V1776: 0,0; | W1776: 2
A1777: 20448 | B1777: 喽啰 | C1777: pet_21 | D1777: 0 | E1777: 0 | F1777: 1411,100;1416,100;1412,100; | G1777: 5210,100;5126,100;5131,100; | H1777: 130+26*LV*0.6 | I1777: 45+10.5*LV*0.6 | J1777: 32+9*LV*0.6 | K1777: 24+5*LV*0.6 | L1777: 13+3*LV*0.6 | M1777: 100000 | N1777: 0 | O1777: math.max(0,(lv/10)-1) | P1777: math.max(0,(lv/10)-1) | Q1777: math.max(0,(lv/10)-1) | R1777: 0; | S1777: 有药王谷和盘丝洞的弟子在，真是不爽，还是跑路算了！ | T1777: 药王谷和盘丝洞的弟子不在眼前，真是轻松愉快啊！ | U1777: 0 | V1777: 0,0; | W1777: 2
A1778: 20449 | B1778: 喽啰 | C1778: pet_23 | D1778: 0 | E1778: 0 | F1778: 1411,100;1416,100;1412,100; | G1778: 5210,100;5126,100;5131,100; | H1778: 130+26*LV*0.6 | I1778: 45+10.5*LV*0.6 | J1778: 32+9*LV*0.6 | K1778: 24+5*LV*0.6 | L1778: 13+3*LV*0.6 | M1778: 100000 | N1778: 0 | O1778: math.max(0,(lv/10)-1) | P1778: math.max(0,(lv/10)-1) | Q1778: math.max(0,(lv/10)-1) | R1778: 0; | S1778: 有药王谷和盘丝洞的弟子在，真是不爽，还是跑路算了！ | T1778: 药王谷和盘丝洞的弟子不在眼前，真是轻松愉快啊！ | U1778: 0 | V1778: 0,0; | W1778: 2
A1779: 20450 | B1779: 喽啰 | C1779: common_3018 | D1779: 0 | E1779: 0 | F1779: 1411,100;1416,100;1412,100; | G1779: 5210,100;5126,100;5131,100; | H1779: 130+26*LV*0.6 | I1779: 45+10.5*LV*0.6 | J1779: 32+9*LV*0.6 | K1779: 24+5*LV*0.6 | L1779: 13+3*LV*0.6 | M1779: 100000 | N1779: 0 | O1779: math.max(0,(lv/10)-1) | P1779: math.max(0,(lv/10)-1) | Q1779: math.max(0,(lv/10)-1) | R1779: 0; | S1779: 有药王谷和盘丝洞的弟子在，真是不爽，还是跑路算了！ | T1779: 药王谷和盘丝洞的弟子不在眼前，真是轻松愉快啊！ | U1779: 0 | V1779: 0,0; | W1779: 2
A1780: 20451 | B1780: 喽啰 | C1780: hero_1001 | D1780: 0 | E1780: 0 | F1780: 1411,100;1416,100;1412,100; | G1780: 5210,100;5126,100;5131,100; | H1780: 130+26*LV*0.6 | I1780: 45+10.5*LV*0.6 | J1780: 32+9*LV*0.6 | K1780: 24+5*LV*0.6 | L1780: 13+3*LV*0.6 | M1780: 100000 | N1780: 0 | O1780: math.max(0,(lv/10)-1) | P1780: math.max(0,(lv/10)-1) | Q1780: math.max(0,(lv/10)-1) | R1780: 0; | S1780: 有药王谷和盘丝洞的弟子在，真是不爽，还是跑路算了！ | T1780: 药王谷和盘丝洞的弟子不在眼前，真是轻松愉快啊！ | U1780: 0 | V1780: 0,0; | W1780: 2
A1781: 20452 | B1781: 喽啰 | C1781: partner_1002 | D1781: 0 | E1781: 0 | F1781: 1411,100;1416,100;1412,100; | G1781: 5210,100;5126,100;5131,100; | H1781: 130+26*LV*0.6 | I1781: 45+10.5*LV*0.6 | J1781: 32+9*LV*0.6 | K1781: 24+5*LV*0.6 | L1781: 13+3*LV*0.6 | M1781: 100000 | N1781: 0 | O1781: math.max(0,(lv/10)-1) | P1781: math.max(0,(lv/10)-1) | Q1781: math.max(0,(lv/10)-1) | R1781: 0; | S1781: 有药王谷和盘丝洞的弟子在，真是不爽，还是跑路算了！ | T1781: 药王谷和盘丝洞的弟子不在眼前，真是轻松愉快啊！ | U1781: 0 | V1781: 0,0; | W1781: 2
A1782: 20453 | B1782: 喽啰 | C1782: common_3006 | D1782: 0 | E1782: 0 | F1782: 1411,100;1416,100;1412,100; | G1782: 5210,100;5126,100;5131,100; | H1782: 130+26*LV*0.6 | I1782: 45+10.5*LV*0.6 | J1782: 32+9*LV*0.6 | K1782: 24+5*LV*0.6 | L1782: 13+3*LV*0.6 | M1782: 100000 | N1782: 0 | O1782: math.max(0,(lv/10)-1) | P1782: math.max(0,(lv/10)-1) | Q1782: math.max(0,(lv/10)-1) | R1782: 0; | S1782: 有药王谷和盘丝洞的弟子在，真是不爽，还是跑路算了！ | T1782: 药王谷和盘丝洞的弟子不在眼前，真是轻松愉快啊！ | U1782: 0 | V1782: 0,0; | W1782: 2
A1783: 20454 | B1783: 喽啰 | C1783: partner_1009 | D1783: 0 | E1783: 0 | F1783: 1411,100;1416,100;1412,100; | G1783: 5210,100;5126,100;5131,100; | H1783: 130+26*LV*0.6 | I1783: 45+10.5*LV*0.6 | J1783: 32+9*LV*0.6 | K1783: 24+5*LV*0.6 | L1783: 13+3*LV*0.6 | M1783: 100000 | N1783: 0 | O1783: math.max(0,(lv/10)-1) | P1783: math.max(0,(lv/10)-1) | Q1783: math.max(0,(lv/10)-1) | R1783: 0; | S1783: 有药王谷和盘丝洞的弟子在，真是不爽，还是跑路算了！ | T1783: 药王谷和盘丝洞的弟子不在眼前，真是轻松愉快啊！ | U1783: 0 | V1783: 0,0; | W1783: 2
A1784: 20455 | B1784: 喽啰 | C1784: pet_21 | D1784: 0 | E1784: 0 | F1784: 1411,100;1416,100;1412,100; | G1784: 5210,100;5126,100;5131,100; | H1784: 130+26*LV*0.6 | I1784: 45+10.5*LV*0.6 | J1784: 32+9*LV*0.6 | K1784: 24+5*LV*0.6 | L1784: 13+3*LV*0.6 | M1784: 100000 | N1784: 0 | O1784: math.max(0,(lv/10)-1) | P1784: math.max(0,(lv/10)-1) | Q1784: math.max(0,(lv/10)-1) | R1784: 0; | S1784: 有药王谷和盘丝洞的弟子在，真是不爽，还是跑路算了！ | T1784: 药王谷和盘丝洞的弟子不在眼前，真是轻松愉快啊！ | U1784: 0 | V1784: 0,0; | W1784: 2
A1785: 20456 | B1785: 喽啰 | C1785: pet_3 | D1785: 0 | E1785: 0 | F1785: 1411,100;1416,100;1412,100; | G1785: 5210,100;5126,100;5131,100; | H1785: 130+26*LV*0.6 | I1785: 45+10.5*LV*0.6 | J1785: 32+9*LV*0.6 | K1785: 24+5*LV*0.6 | L1785: 13+3*LV*0.6 | M1785: 100000 | N1785: 0 | O1785: math.max(0,(lv/10)-1) | P1785: math.max(0,(lv/10)-1) | Q1785: math.max(0,(lv/10)-1) | R1785: 0; | S1785: 有药王谷和盘丝洞的弟子在，真是不爽，还是跑路算了！ | T1785: 药王谷和盘丝洞的弟子不在眼前，真是轻松愉快啊！ | U1785: 0 | V1785: 0,0; | W1785: 2
A1786: 20457 | B1786: 喽啰 | C1786: partner_1009 | D1786: 0 | E1786: 0 | F1786: 1411,100;1416,100;1412,100; | G1786: 5210,100;5126,100;5131,100; | H1786: 130+26*LV*0.6 | I1786: 45+10.5*LV*0.6 | J1786: 32+9*LV*0.6 | K1786: 24+5*LV*0.6 | L1786: 13+3*LV*0.6 | M1786: 100000 | N1786: 0 | O1786: math.max(0,(lv/10)-1) | P1786: math.max(0,(lv/10)-1) | Q1786: math.max(0,(lv/10)-1) | R1786: 0; | S1786: 有药王谷和盘丝洞的弟子在，真是不爽，还是跑路算了！ | T1786: 药王谷和盘丝洞的弟子不在眼前，真是轻松愉快啊！ | U1786: 0 | V1786: 0,0; | W1786: 2
A1787: 20458 | B1787: 喽啰 | C1787: hero_1001 | D1787: 0 | E1787: 0 | F1787: 1411,100;1416,100;1412,100; | G1787: 5210,100;5126,100;5131,100; | H1787: 130+26*LV*0.6 | I1787: 45+10.5*LV*0.6 | J1787: 32+9*LV*0.6 | K1787: 24+5*LV*0.6 | L1787: 13+3*LV*0.6 | M1787: 100000 | N1787: 0 | O1787: math.max(0,(lv/10)-1) | P1787: math.max(0,(lv/10)-1) | Q1787: math.max(0,(lv/10)-1) | R1787: 0; | S1787: 有药王谷和盘丝洞的弟子在，真是不爽，还是跑路算了！ | T1787: 药王谷和盘丝洞的弟子不在眼前，真是轻松愉快啊！ | U1787: 0 | V1787: 0,0; | W1787: 2
A1788: 20459 | B1788: 喽啰 | C1788: pet_33 | D1788: 0 | E1788: 0 | F1788: 1411,100;1416,100;1412,100; | G1788: 5210,100;5126,100;5131,100; | H1788: 130+26*LV*0.6 | I1788: 45+10.5*LV*0.6 | J1788: 32+9*LV*0.6 | K1788: 24+5*LV*0.6 | L1788: 13+3*LV*0.6 | M1788: 100000 | N1788: 0 | O1788: math.max(0,(lv/10)-1) | P1788: math.max(0,(lv/10)-1) | Q1788: math.max(0,(lv/10)-1) | R1788: 0; | S1788: 有药王谷和盘丝洞的弟子在，真是不爽，还是跑路算了！ | T1788: 药王谷和盘丝洞的弟子不在眼前，真是轻松愉快啊！ | U1788: 0 | V1788: 0,0; | W1788: 2
A1789: 20460 | B1789: 喽啰 | C1789: pet_83 | D1789: 0 | E1789: 0 | F1789: 1411,100;1416,100;1412,100; | G1789: 5210,100;5126,100;5131,100; | H1789: 130+26*LV*0.6 | I1789: 45+10.5*LV*0.6 | J1789: 32+9*LV*0.6 | K1789: 24+5*LV*0.6 | L1789: 13+3*LV*0.6 | M1789: 100000 | N1789: 0 | O1789: math.max(0,(lv/10)-1) | P1789: math.max(0,(lv/10)-1) | Q1789: math.max(0,(lv/10)-1) | R1789: 0; | S1789: 有药王谷和盘丝洞的弟子在，真是不爽，还是跑路算了！ | T1789: 药王谷和盘丝洞的弟子不在眼前，真是轻松愉快啊！ | U1789: 0 | V1789: 0,0; | W1789: 2
A1790: 20461 | B1790: 喽啰 | C1790: partner_1002 | D1790: 0 | E1790: 0 | F1790: 1411,100;1416,100;1412,100; | G1790: 5210,100;5126,100;5131,100; | H1790: 130+26*LV*0.6 | I1790: 45+10.5*LV*0.6 | J1790: 32+9*LV*0.6 | K1790: 24+5*LV*0.6 | L1790: 13+3*LV*0.6 | M1790: 100000 | N1790: 0 | O1790: math.max(0,(lv/10)-1) | P1790: math.max(0,(lv/10)-1) | Q1790: math.max(0,(lv/10)-1) | R1790: 0; | S1790: 有药王谷和盘丝洞的弟子在，真是不爽，还是跑路算了！ | T1790: 药王谷和盘丝洞的弟子不在眼前，真是轻松愉快啊！ | U1790: 0 | V1790: 0,0; | W1790: 2
A1791: 20462 | B1791: 喽啰 | C1791: pet_62 | D1791: 0 | E1791: 0 | F1791: 1411,100;1416,100;1412,100; | G1791: 5210,100;5126,100;5131,100; | H1791: 130+26*LV*0.6 | I1791: 45+10.5*LV*0.6 | J1791: 32+9*LV*0.6 | K1791: 24+5*LV*0.6 | L1791: 13+3*LV*0.6 | M1791: 100000 | N1791: 0 | O1791: math.max(0,(lv/10)-1) | P1791: math.max(0,(lv/10)-1) | Q1791: math.max(0,(lv/10)-1) | R1791: 0; | S1791: 有药王谷和盘丝洞的弟子在，真是不爽，还是跑路算了！ | T1791: 药王谷和盘丝洞的弟子不在眼前，真是轻松愉快啊！ | U1791: 0 | V1791: 0,0; | W1791: 2
A1792: 20463 | B1792: 喽啰 | C1792: pet_83 | D1792: 0 | E1792: 0 | F1792: 1411,100;1416,100;1412,100; | G1792: 5210,100;5126,100;5131,100; | H1792: 130+26*LV*0.6 | I1792: 45+10.5*LV*0.6 | J1792: 32+9*LV*0.6 | K1792: 24+5*LV*0.6 | L1792: 13+3*LV*0.6 | M1792: 100000 | N1792: 0 | O1792: math.max(0,(lv/10)-1) | P1792: math.max(0,(lv/10)-1) | Q1792: math.max(0,(lv/10)-1) | R1792: 0; | S1792: 有药王谷和盘丝洞的弟子在，真是不爽，还是跑路算了！ | T1792: 药王谷和盘丝洞的弟子不在眼前，真是轻松愉快啊！ | U1792: 0 | V1792: 0,0; | W1792: 2
A1793: 20464 | B1793: 喽啰 | C1793: pet_23 | D1793: 0 | E1793: 0 | F1793: 1411,100;1416,100;1412,100; | G1793: 5210,100;5126,100;5131,100; | H1793: 130+26*LV*0.6 | I1793: 45+10.5*LV*0.6 | J1793: 32+9*LV*0.6 | K1793: 24+5*LV*0.6 | L1793: 13+3*LV*0.6 | M1793: 100000 | N1793: 0 | O1793: math.max(0,(lv/10)-1) | P1793: math.max(0,(lv/10)-1) | Q1793: math.max(0,(lv/10)-1) | R1793: 0; | S1793: 有药王谷和盘丝洞的弟子在，真是不爽，还是跑路算了！ | T1793: 药王谷和盘丝洞的弟子不在眼前，真是轻松愉快啊！ | U1793: 0 | V1793: 0,0; | W1793: 2
A1794: 20465 | B1794: 喽啰 | C1794: hero_1001 | D1794: 0 | E1794: 0 | F1794: 1411,100;1416,100;1412,100; | G1794: 5210,100;5126,100;5131,100; | H1794: 130+26*LV*0.6 | I1794: 45+10.5*LV*0.6 | J1794: 32+9*LV*0.6 | K1794: 24+5*LV*0.6 | L1794: 13+3*LV*0.6 | M1794: 100000 | N1794: 0 | O1794: math.max(0,(lv/10)-1) | P1794: math.max(0,(lv/10)-1) | Q1794: math.max(0,(lv/10)-1) | R1794: 0; | S1794: 有药王谷和盘丝洞的弟子在，真是不爽，还是跑路算了！ | T1794: 药王谷和盘丝洞的弟子不在眼前，真是轻松愉快啊！ | U1794: 0 | V1794: 0,0; | W1794: 2
A1795: 20466 | B1795: 喽啰 | C1795: partner_1001 | D1795: 0 | E1795: 0 | F1795: 1411,100;1416,100;1412,100; | G1795: 5210,100;5126,100;5131,100; | H1795: 130+26*LV*0.6 | I1795: 45+10.5*LV*0.6 | J1795: 32+9*LV*0.6 | K1795: 24+5*LV*0.6 | L1795: 13+3*LV*0.6 | M1795: 100000 | N1795: 0 | O1795: math.max(0,(lv/10)-1) | P1795: math.max(0,(lv/10)-1) | Q1795: math.max(0,(lv/10)-1) | R1795: 0; | S1795: 有药王谷和盘丝洞的弟子在，真是不爽，还是跑路算了！ | T1795: 药王谷和盘丝洞的弟子不在眼前，真是轻松愉快啊！ | U1795: 0 | V1795: 0,0; | W1795: 2
A1796: 20467 | B1796: 喽啰 | C1796: partner_1009 | D1796: 0 | E1796: 0 | F1796: 1411,100;1416,100;1412,100; | G1796: 5210,100;5126,100;5131,100; | H1796: 130+26*LV*0.6 | I1796: 45+10.5*LV*0.6 | J1796: 32+9*LV*0.6 | K1796: 24+5*LV*0.6 | L1796: 13+3*LV*0.6 | M1796: 100000 | N1796: 0 | O1796: math.max(0,(lv/10)-1) | P1796: math.max(0,(lv/10)-1) | Q1796: math.max(0,(lv/10)-1) | R1796: 0; | S1796: 有药王谷和盘丝洞的弟子在，真是不爽，还是跑路算了！ | T1796: 药王谷和盘丝洞的弟子不在眼前，真是轻松愉快啊！ | U1796: 0 | V1796: 0,0; | W1796: 2
A1797: 20468 | B1797: 喽啰 | C1797: partner_1004 | D1797: 0 | E1797: 0 | F1797: 1411,100;1416,100;1412,100; | G1797: 5210,100;5126,100;5131,100; | H1797: 130+26*LV*0.6 | I1797: 45+10.5*LV*0.6 | J1797: 32+9*LV*0.6 | K1797: 24+5*LV*0.6 | L1797: 13+3*LV*0.6 | M1797: 100000 | N1797: 0 | O1797: math.max(0,(lv/10)-1) | P1797: math.max(0,(lv/10)-1) | Q1797: math.max(0,(lv/10)-1) | R1797: 0; | S1797: 有药王谷和盘丝洞的弟子在，真是不爽，还是跑路算了！ | T1797: 药王谷和盘丝洞的弟子不在眼前，真是轻松愉快啊！ | U1797: 0 | V1797: 0,0; | W1797: 2
A1798: 20469 | B1798: 喽啰 | C1798: pet_21 | D1798: 0 | E1798: 0 | F1798: 1411,100;1416,100;1412,100; | G1798: 5210,100;5126,100;5131,100; | H1798: 130+26*LV*0.6 | I1798: 45+10.5*LV*0.6 | J1798: 32+9*LV*0.6 | K1798: 24+5*LV*0.6 | L1798: 13+3*LV*0.6 | M1798: 100000 | N1798: 0 | O1798: math.max(0,(lv/10)-1) | P1798: math.max(0,(lv/10)-1) | Q1798: math.max(0,(lv/10)-1) | R1798: 0; | S1798: 有药王谷和盘丝洞的弟子在，真是不爽，还是跑路算了！ | T1798: 药王谷和盘丝洞的弟子不在眼前，真是轻松愉快啊！ | U1798: 0 | V1798: 0,0; | W1798: 2
A1799: 20470 | B1799: 喽啰 | C1799: pet_72 | D1799: 0 | E1799: 0 | F1799: 1411,100;1416,100;1412,100; | G1799: 5210,100;5126,100;5131,100; | H1799: 130+26*LV*0.6 | I1799: 45+10.5*LV*0.6 | J1799: 32+9*LV*0.6 | K1799: 24+5*LV*0.6 | L1799: 13+3*LV*0.6 | M1799: 100000 | N1799: 0 | O1799: math.max(0,(lv/10)-1) | P1799: math.max(0,(lv/10)-1) | Q1799: math.max(0,(lv/10)-1) | R1799: 0; | S1799: 有药王谷和盘丝洞的弟子在，真是不爽，还是跑路算了！ | T1799: 药王谷和盘丝洞的弟子不在眼前，真是轻松愉快啊！ | U1799: 0 | V1799: 0,0; | W1799: 2
A1800: 20471 | B1800: 喽啰 | C1800: pet_42 | D1800: 0 | E1800: 0 | F1800: 1411,100;1416,100;1412,100; | G1800: 5210,100;5126,100;5131,100; | H1800: 130+26*LV*0.6 | I1800: 45+10.5*LV*0.6 | J1800: 32+9*LV*0.6 | K1800: 24+5*LV*0.6 | L1800: 13+3*LV*0.6 | M1800: 100000 | N1800: 0 | O1800: math.max(0,(lv/10)-1) | P1800: math.max(0,(lv/10)-1) | Q1800: math.max(0,(lv/10)-1) | R1800: 0; | S1800: 有药王谷和盘丝洞的弟子在，真是不爽，还是跑路算了！ | T1800: 药王谷和盘丝洞的弟子不在眼前，真是轻松愉快啊！ | U1800: 0 | V1800: 0,0; | W1800: 2
A1801: 20472 | B1801: 喽啰 | C1801: pet_42 | D1801: 0 | E1801: 0 | F1801: 1411,100;1416,100;1412,100; | G1801: 5210,100;5126,100;5131,100; | H1801: 130+26*LV*0.6 | I1801: 45+10.5*LV*0.6 | J1801: 32+9*LV*0.6 | K1801: 24+5*LV*0.6 | L1801: 13+3*LV*0.6 | M1801: 100000 | N1801: 0 | O1801: math.max(0,(lv/10)-1) | P1801: math.max(0,(lv/10)-1) | Q1801: math.max(0,(lv/10)-1) | R1801: 0; | S1801: 有药王谷和盘丝洞的弟子在，真是不爽，还是跑路算了！ | T1801: 药王谷和盘丝洞的弟子不在眼前，真是轻松愉快啊！ | U1801: 0 | V1801: 0,0; | W1801: 2
A1802: 20473 | B1802: 喽啰 | C1802: pet_72 | D1802: 0 | E1802: 0 | F1802: 1411,100;1416,100;1412,100; | G1802: 5210,100;5126,100;5131,100; | H1802: 130+26*LV*0.6 | I1802: 45+10.5*LV*0.6 | J1802: 32+9*LV*0.6 | K1802: 24+5*LV*0.6 | L1802: 13+3*LV*0.6 | M1802: 100000 | N1802: 0 | O1802: math.max(0,(lv/10)-1) | P1802: math.max(0,(lv/10)-1) | Q1802: math.max(0,(lv/10)-1) | R1802: 0; | S1802: 有药王谷和盘丝洞的弟子在，真是不爽，还是跑路算了！ | T1802: 药王谷和盘丝洞的弟子不在眼前，真是轻松愉快啊！ | U1802: 0 | V1802: 0,0; | W1802: 2
A1803: 20474 | B1803: 喽啰 | C1803: hero_1001 | D1803: 0 | E1803: 0 | F1803: 1411,100;1416,100;1412,100; | G1803: 5210,100;5126,100;5131,100; | H1803: 130+26*LV*0.6 | I1803: 45+10.5*LV*0.6 | J1803: 32+9*LV*0.6 | K1803: 24+5*LV*0.6 | L1803: 13+3*LV*0.6 | M1803: 100000 | N1803: 0 | O1803: math.max(0,(lv/10)-1) | P1803: math.max(0,(lv/10)-1) | Q1803: math.max(0,(lv/10)-1) | R1803: 0; | S1803: 有药王谷和盘丝洞的弟子在，真是不爽，还是跑路算了！ | T1803: 药王谷和盘丝洞的弟子不在眼前，真是轻松愉快啊！ | U1803: 0 | V1803: 0,0; | W1803: 2
A1804: 20475 | B1804: 喽啰 | C1804: partner_1002 | D1804: 0 | E1804: 0 | F1804: 1411,100;1416,100;1412,100; | G1804: 5210,100;5126,100;5131,100; | H1804: 130+26*LV*0.6 | I1804: 45+10.5*LV*0.6 | J1804: 32+9*LV*0.6 | K1804: 24+5*LV*0.6 | L1804: 13+3*LV*0.6 | M1804: 100000 | N1804: 0 | O1804: math.max(0,(lv/10)-1) | P1804: math.max(0,(lv/10)-1) | Q1804: math.max(0,(lv/10)-1) | R1804: 0; | S1804: 有药王谷和盘丝洞的弟子在，真是不爽，还是跑路算了！ | T1804: 药王谷和盘丝洞的弟子不在眼前，真是轻松愉快啊！ | U1804: 0 | V1804: 0,0; | W1804: 2
A1805: 20476 | B1805: 喽啰 | C1805: partner_1009 | D1805: 0 | E1805: 0 | F1805: 1411,100;1416,100;1412,100; | G1805: 5210,100;5126,100;5131,100; | H1805: 130+26*LV*0.6 | I1805: 45+10.5*LV*0.6 | J1805: 32+9*LV*0.6 | K1805: 24+5*LV*0.6 | L1805: 13+3*LV*0.6 | M1805: 100000 | N1805: 0 | O1805: math.max(0,(lv/10)-1) | P1805: math.max(0,(lv/10)-1) | Q1805: math.max(0,(lv/10)-1) | R1805: 0; | S1805: 有药王谷和盘丝洞的弟子在，真是不爽，还是跑路算了！ | T1805: 药王谷和盘丝洞的弟子不在眼前，真是轻松愉快啊！ | U1805: 0 | V1805: 0,0; | W1805: 2
A1806: 20477 | B1806: 喽啰 | C1806: pet_63 | D1806: 0 | E1806: 0 | F1806: 1411,100;1416,100;1412,100; | G1806: 5210,100;5126,100;5131,100; | H1806: 130+26*LV*0.6 | I1806: 45+10.5*LV*0.6 | J1806: 32+9*LV*0.6 | K1806: 24+5*LV*0.6 | L1806: 13+3*LV*0.6 | M1806: 100000 | N1806: 0 | O1806: math.max(0,(lv/10)-1) | P1806: math.max(0,(lv/10)-1) | Q1806: math.max(0,(lv/10)-1) | R1806: 0; | S1806: 有药王谷和盘丝洞的弟子在，真是不爽，还是跑路算了！ | T1806: 药王谷和盘丝洞的弟子不在眼前，真是轻松愉快啊！ | U1806: 0 | V1806: 0,0; | W1806: 2
A1807: 20478 | B1807: 喽啰 | C1807: hero_1001 | D1807: 0 | E1807: 0 | F1807: 1411,100;1416,100;1412,100; | G1807: 5210,100;5126,100;5131,100; | H1807: 130+26*LV*0.6 | I1807: 45+10.5*LV*0.6 | J1807: 32+9*LV*0.6 | K1807: 24+5*LV*0.6 | L1807: 13+3*LV*0.6 | M1807: 100000 | N1807: 0 | O1807: math.max(0,(lv/10)-1) | P1807: math.max(0,(lv/10)-1) | Q1807: math.max(0,(lv/10)-1) | R1807: 0; | S1807: 有药王谷和盘丝洞的弟子在，真是不爽，还是跑路算了！ | T1807: 药王谷和盘丝洞的弟子不在眼前，真是轻松愉快啊！ | U1807: 0 | V1807: 0,0; | W1807: 2
A1808: 20479 | B1808: 喽啰 | C1808: pet_42 | D1808: 0 | E1808: 0 | F1808: 1411,100;1416,100;1412,100; | G1808: 5210,100;5126,100;5131,100; | H1808: 130+26*LV*0.6 | I1808: 45+10.5*LV*0.6 | J1808: 32+9*LV*0.6 | K1808: 24+5*LV*0.6 | L1808: 13+3*LV*0.6 | M1808: 100000 | N1808: 0 | O1808: math.max(0,(lv/10)-1) | P1808: math.max(0,(lv/10)-1) | Q1808: math.max(0,(lv/10)-1) | R1808: 0; | S1808: 有药王谷和盘丝洞的弟子在，真是不爽，还是跑路算了！ | T1808: 药王谷和盘丝洞的弟子不在眼前，真是轻松愉快啊！ | U1808: 0 | V1808: 0,0; | W1808: 2
A1809: 20480 | B1809: 喽啰 | C1809: hero_1001 | D1809: 0 | E1809: 0 | F1809: 1411,100;1416,100;1412,100; | G1809: 5210,100;5126,100;5131,100; | H1809: 130+26*LV*0.6 | I1809: 45+10.5*LV*0.6 | J1809: 32+9*LV*0.6 | K1809: 24+5*LV*0.6 | L1809: 13+3*LV*0.6 | M1809: 100000 | N1809: 0 | O1809: math.max(0,(lv/10)-1) | P1809: math.max(0,(lv/10)-1) | Q1809: math.max(0,(lv/10)-1) | R1809: 0; | S1809: 有药王谷和盘丝洞的弟子在，真是不爽，还是跑路算了！ | T1809: 药王谷和盘丝洞的弟子不在眼前，真是轻松愉快啊！ | U1809: 0 | V1809: 0,0; | W1809: 2
A1810: 20481 | B1810: 喽啰 | C1810: pet_22 | D1810: 0 | E1810: 0 | F1810: 1411,100;1416,100;1412,100; | G1810: 5210,100;5126,100;5131,100; | H1810: 130+26*LV*0.6 | I1810: 45+10.5*LV*0.6 | J1810: 32+9*LV*0.6 | K1810: 24+5*LV*0.6 | L1810: 13+3*LV*0.6 | M1810: 100000 | N1810: 0 | O1810: math.max(0,(lv/5)-1) | P1810: math.max(0,(lv/5)-1) | Q1810: math.max(0,(lv/5)-1) | R1810: 0; | S1810: 有药王谷和盘丝洞的弟子在，真是不爽，还是跑路算了！ | T1810: 药王谷和盘丝洞的弟子不在眼前，真是轻松愉快啊！ | U1810: 0 | V1810: 0,0; | W1810: 2
A1811: 20482 | B1811: 喽啰 | C1811: pet_63 | D1811: 0 | E1811: 0 | F1811: 1411,100;1416,100;1412,100; | G1811: 5210,100;5126,100;5131,100; | H1811: 130+26*LV*0.6 | I1811: 45+10.5*LV*0.6 | J1811: 32+9*LV*0.6 | K1811: 24+5*LV*0.6 | L1811: 13+3*LV*0.6 | M1811: 100000 | N1811: 0 | O1811: math.max(0,(lv/5)-1) | P1811: math.max(0,(lv/5)-1) | Q1811: math.max(0,(lv/5)-1) | R1811: 0; | S1811: 有药王谷和盘丝洞的弟子在，真是不爽，还是跑路算了！ | T1811: 药王谷和盘丝洞的弟子不在眼前，真是轻松愉快啊！ | U1811: 0 | V1811: 0,0; | W1811: 2
A1812: 20483 | B1812: 喽啰 | C1812: partner_1009 | D1812: 0 | E1812: 0 | F1812: 1411,100;1416,100;1412,100; | G1812: 5210,100;5126,100;5131,100; | H1812: 130+26*LV*0.6 | I1812: 45+10.5*LV*0.6 | J1812: 32+9*LV*0.6 | K1812: 24+5*LV*0.6 | L1812: 13+3*LV*0.6 | M1812: 100000 | N1812: 0 | O1812: math.max(0,(lv/5)-1) | P1812: math.max(0,(lv/5)-1) | Q1812: math.max(0,(lv/5)-1) | R1812: 0; | S1812: 有药王谷和盘丝洞的弟子在，真是不爽，还是跑路算了！ | T1812: 药王谷和盘丝洞的弟子不在眼前，真是轻松愉快啊！ | U1812: 0 | V1812: 0,0; | W1812: 2
A1813: 20484 | B1813: 喽啰 | C1813: partner_1002 | D1813: 0 | E1813: 0 | F1813: 1411,100;1416,100;1412,100; | G1813: 5210,100;5126,100;5131,100; | H1813: 130+26*LV*0.6 | I1813: 45+10.5*LV*0.6 | J1813: 32+9*LV*0.6 | K1813: 24+5*LV*0.6 | L1813: 13+3*LV*0.6 | M1813: 100000 | N1813: 0 | O1813: math.max(0,(lv/5)-1) | P1813: math.max(0,(lv/5)-1) | Q1813: math.max(0,(lv/5)-1) | R1813: 0; | S1813: 有药王谷和盘丝洞的弟子在，真是不爽，还是跑路算了！ | T1813: 药王谷和盘丝洞的弟子不在眼前，真是轻松愉快啊！ | U1813: 0 | V1813: 0,0; | W1813: 2
A1814: 20485 | B1814: 喽啰 | C1814: pet_23 | D1814: 0 | E1814: 0 | F1814: 1411,100;1416,100;1412,100; | G1814: 5210,100;5126,100;5131,100; | H1814: 130+26*LV*0.6 | I1814: 45+10.5*LV*0.6 | J1814: 32+9*LV*0.6 | K1814: 24+5*LV*0.6 | L1814: 13+3*LV*0.6 | M1814: 100000 | N1814: 0 | O1814: math.max(0,(lv/5)-1) | P1814: math.max(0,(lv/5)-1) | Q1814: math.max(0,(lv/5)-1) | R1814: 0; | S1814: 有药王谷和盘丝洞的弟子在，真是不爽，还是跑路算了！ | T1814: 药王谷和盘丝洞的弟子不在眼前，真是轻松愉快啊！ | U1814: 0 | V1814: 0,0; | W1814: 2
A1815: 20486 | B1815: 喽啰 | C1815: pet_23 | D1815: 0 | E1815: 0 | F1815: 1411,100;1416,100;1412,100; | G1815: 5210,100;5126,100;5131,100; | H1815: 130+26*LV*0.6 | I1815: 45+10.5*LV*0.6 | J1815: 32+9*LV*0.6 | K1815: 24+5*LV*0.6 | L1815: 13+3*LV*0.6 | M1815: 100000 | N1815: 0 | O1815: math.max(0,(lv/5)-1) | P1815: math.max(0,(lv/5)-1) | Q1815: math.max(0,(lv/5)-1) | R1815: 0; | S1815: 有药王谷和盘丝洞的弟子在，真是不爽，还是跑路算了！ | T1815: 药王谷和盘丝洞的弟子不在眼前，真是轻松愉快啊！ | U1815: 0 | V1815: 0,0; | W1815: 2
A1816: 20487 | B1816: 喽啰 | C1816: pet_61 | D1816: 0 | E1816: 0 | F1816: 1411,100;1416,100;1412,100; | G1816: 5210,100;5126,100;5131,100; | H1816: 130+26*LV*0.6 | I1816: 45+10.5*LV*0.6 | J1816: 32+9*LV*0.6 | K1816: 24+5*LV*0.6 | L1816: 13+3*LV*0.6 | M1816: 100000 | N1816: 0 | O1816: math.max(0,(lv/5)-1) | P1816: math.max(0,(lv/5)-1) | Q1816: math.max(0,(lv/5)-1) | R1816: 0; | S1816: 有药王谷和盘丝洞的弟子在，真是不爽，还是跑路算了！ | T1816: 药王谷和盘丝洞的弟子不在眼前，真是轻松愉快啊！ | U1816: 0 | V1816: 0,0; | W1816: 2
A1817: 20488 | B1817: 喽啰 | C1817: pet_63 | D1817: 0 | E1817: 0 | F1817: 1411,100;1416,100;1412,100; | G1817: 5210,100;5126,100;5131,100; | H1817: 130+26*LV*0.6 | I1817: 45+10.5*LV*0.6 | J1817: 32+9*LV*0.6 | K1817: 24+5*LV*0.6 | L1817: 13+3*LV*0.6 | M1817: 100000 | N1817: 0 | O1817: math.max(0,(lv/5)-1) | P1817: math.max(0,(lv/5)-1) | Q1817: math.max(0,(lv/5)-1) | R1817: 0; | S1817: 有药王谷和盘丝洞的弟子在，真是不爽，还是跑路算了！ | T1817: 药王谷和盘丝洞的弟子不在眼前，真是轻松愉快啊！ | U1817: 0 | V1817: 0,0; | W1817: 2
A1818: 20489 | B1818: 喽啰 | C1818: hero_1001 | D1818: 0 | E1818: 0 | F1818: 1411,100;1416,100;1412,100; | G1818: 5210,100;5126,100;5131,100; | H1818: 130+26*LV*0.6 | I1818: 45+10.5*LV*0.6 | J1818: 32+9*LV*0.6 | K1818: 24+5*LV*0.6 | L1818: 13+3*LV*0.6 | M1818: 100000 | N1818: 0 | O1818: math.max(0,(lv/5)-1) | P1818: math.max(0,(lv/5)-1) | Q1818: math.max(0,(lv/5)-1) | R1818: 0; | S1818: 有药王谷和盘丝洞的弟子在，真是不爽，还是跑路算了！ | T1818: 药王谷和盘丝洞的弟子不在眼前，真是轻松愉快啊！ | U1818: 0 | V1818: 0,0; | W1818: 2
A1819: 20490 | B1819: 喽啰 | C1819: pet_22 | D1819: 0 | E1819: 0 | F1819: 1411,100;1416,100;1412,100; | G1819: 5210,100;5126,100;5131,100; | H1819: 130+26*LV*0.6 | I1819: 45+10.5*LV*0.6 | J1819: 32+9*LV*0.6 | K1819: 24+5*LV*0.6 | L1819: 13+3*LV*0.6 | M1819: 100000 | N1819: 0 | O1819: math.max(0,(lv/5)-1) | P1819: math.max(0,(lv/5)-1) | Q1819: math.max(0,(lv/5)-1) | R1819: 0; | S1819: 有药王谷和盘丝洞的弟子在，真是不爽，还是跑路算了！ | T1819: 药王谷和盘丝洞的弟子不在眼前，真是轻松愉快啊！ | U1819: 0 | V1819: 0,0; | W1819: 2
A1820: 20491 | B1820: 喽啰 | C1820: pet_62 | D1820: 0 | E1820: 0 | F1820: 1411,100;1416,100;1412,100; | G1820: 5210,100;5126,100;5131,100; | H1820: 130+26*LV*0.6 | I1820: 45+10.5*LV*0.6 | J1820: 32+9*LV*0.6 | K1820: 24+5*LV*0.6 | L1820: 13+3*LV*0.6 | M1820: 100000 | N1820: 0 | O1820: math.max(0,(lv/5)-1) | P1820: math.max(0,(lv/5)-1) | Q1820: math.max(0,(lv/5)-1) | R1820: 0; | S1820: 有药王谷和盘丝洞的弟子在，真是不爽，还是跑路算了！ | T1820: 药王谷和盘丝洞的弟子不在眼前，真是轻松愉快啊！ | U1820: 0 | V1820: 0,0; | W1820: 2
A1821: 20492 | B1821: 喽啰 | C1821: pet_21 | D1821: 0 | E1821: 0 | F1821: 1411,100;1416,100;1412,100; | G1821: 5210,100;5126,100;5131,100; | H1821: 130+26*LV*0.6 | I1821: 45+10.5*LV*0.6 | J1821: 32+9*LV*0.6 | K1821: 24+5*LV*0.6 | L1821: 13+3*LV*0.6 | M1821: 100000 | N1821: 0 | O1821: math.max(0,(lv/5)-1) | P1821: math.max(0,(lv/5)-1) | Q1821: math.max(0,(lv/5)-1) | R1821: 0; | S1821: 有药王谷和盘丝洞的弟子在，真是不爽，还是跑路算了！ | T1821: 药王谷和盘丝洞的弟子不在眼前，真是轻松愉快啊！ | U1821: 0 | V1821: 0,0; | W1821: 2
A1822: 20493 | B1822: 喽啰 | C1822: pet_21 | D1822: 0 | E1822: 0 | F1822: 1411,100;1416,100;1412,100; | G1822: 5210,100;5126,100;5131,100; | H1822: 130+26*LV*0.6 | I1822: 45+10.5*LV*0.6 | J1822: 32+9*LV*0.6 | K1822: 24+5*LV*0.6 | L1822: 13+3*LV*0.6 | M1822: 100000 | N1822: 0 | O1822: math.max(0,(lv/5)-1) | P1822: math.max(0,(lv/5)-1) | Q1822: math.max(0,(lv/5)-1) | R1822: 0; | S1822: 有药王谷和盘丝洞的弟子在，真是不爽，还是跑路算了！ | T1822: 药王谷和盘丝洞的弟子不在眼前，真是轻松愉快啊！ | U1822: 0 | V1822: 0,0; | W1822: 2
A1823: 20494 | B1823: 喽啰 | C1823: pet_81 | D1823: 0 | E1823: 0 | F1823: 1411,100;1416,100;1412,100; | G1823: 5210,100;5126,100;5131,100; | H1823: 130+26*LV*0.6 | I1823: 45+10.5*LV*0.6 | J1823: 32+9*LV*0.6 | K1823: 24+5*LV*0.6 | L1823: 13+3*LV*0.6 | M1823: 100000 | N1823: 0 | O1823: math.max(0,(lv/5)-1) | P1823: math.max(0,(lv/5)-1) | Q1823: math.max(0,(lv/5)-1) | R1823: 0; | S1823: 有药王谷和盘丝洞的弟子在，真是不爽，还是跑路算了！ | T1823: 药王谷和盘丝洞的弟子不在眼前，真是轻松愉快啊！ | U1823: 0 | V1823: 0,0; | W1823: 2
A1824: 20495 | B1824: 喽啰 | C1824: pet_53 | D1824: 0 | E1824: 0 | F1824: 1411,100;1416,100;1412,100; | G1824: 5210,100;5126,100;5131,100; | H1824: 130+26*LV*0.6 | I1824: 45+10.5*LV*0.6 | J1824: 32+9*LV*0.6 | K1824: 24+5*LV*0.6 | L1824: 13+3*LV*0.6 | M1824: 100000 | N1824: 0 | O1824: math.max(0,(lv/5)-1) | P1824: math.max(0,(lv/5)-1) | Q1824: math.max(0,(lv/5)-1) | R1824: 0; | S1824: 有药王谷和盘丝洞的弟子在，真是不爽，还是跑路算了！ | T1824: 药王谷和盘丝洞的弟子不在眼前，真是轻松愉快啊！ | U1824: 0 | V1824: 0,0; | W1824: 2
A1825: 20496 | B1825: 喽啰 | C1825: pet_61 | D1825: 0 | E1825: 0 | F1825: 1411,100;1416,100;1412,100; | G1825: 5210,100;5126,100;5131,100; | H1825: 130+26*LV*0.6 | I1825: 45+10.5*LV*0.6 | J1825: 32+9*LV*0.6 | K1825: 24+5*LV*0.6 | L1825: 13+3*LV*0.6 | M1825: 100000 | N1825: 0 | O1825: math.max(0,(lv/5)-1) | P1825: math.max(0,(lv/5)-1) | Q1825: math.max(0,(lv/5)-1) | R1825: 0; | S1825: 有药王谷和盘丝洞的弟子在，真是不爽，还是跑路算了！ | T1825: 药王谷和盘丝洞的弟子不在眼前，真是轻松愉快啊！ | U1825: 0 | V1825: 0,0; | W1825: 2
A1826: 20497 | B1826: 喽啰 | C1826: partner_1010 | D1826: 0 | E1826: 0 | F1826: 1411,100;1416,100;1412,100; | G1826: 5210,100;5126,100;5131,100; | H1826: 130+26*LV*0.6 | I1826: 45+10.5*LV*0.6 | J1826: 32+9*LV*0.6 | K1826: 24+5*LV*0.6 | L1826: 13+3*LV*0.6 | M1826: 100000 | N1826: 0 | O1826: math.max(0,(lv/5)-1) | P1826: math.max(0,(lv/5)-1) | Q1826: math.max(0,(lv/5)-1) | R1826: 0; | S1826: 有药王谷和盘丝洞的弟子在，真是不爽，还是跑路算了！ | T1826: 药王谷和盘丝洞的弟子不在眼前，真是轻松愉快啊！ | U1826: 0 | V1826: 0,0; | W1826: 2
A1827: 20498 | B1827: 喽啰 | C1827: pet_63 | D1827: 0 | E1827: 0 | F1827: 1411,100;1416,100;1412,100; | G1827: 5210,100;5126,100;5131,100; | H1827: 130+26*LV*0.6 | I1827: 45+10.5*LV*0.6 | J1827: 32+9*LV*0.6 | K1827: 24+5*LV*0.6 | L1827: 13+3*LV*0.6 | M1827: 100000 | N1827: 0 | O1827: math.max(0,(lv/5)-1) | P1827: math.max(0,(lv/5)-1) | Q1827: math.max(0,(lv/5)-1) | R1827: 0; | S1827: 有药王谷和盘丝洞的弟子在，真是不爽，还是跑路算了！ | T1827: 药王谷和盘丝洞的弟子不在眼前，真是轻松愉快啊！ | U1827: 0 | V1827: 0,0; | W1827: 2
A1828: 20499 | B1828: 喽啰 | C1828: hero_1001 | D1828: 0 | E1828: 0 | F1828: 1411,100;1416,100;1412,100; | G1828: 5210,100;5126,100;5131,100; | H1828: 130+26*LV*0.6 | I1828: 45+10.5*LV*0.6 | J1828: 32+9*LV*0.6 | K1828: 24+5*LV*0.6 | L1828: 13+3*LV*0.6 | M1828: 100000 | N1828: 0 | O1828: math.max(0,(lv/5)-1) | P1828: math.max(0,(lv/5)-1) | Q1828: math.max(0,(lv/5)-1) | R1828: 0; | S1828: 有药王谷和盘丝洞的弟子在，真是不爽，还是跑路算了！ | T1828: 药王谷和盘丝洞的弟子不在眼前，真是轻松愉快啊！ | U1828: 0 | V1828: 0,0; | W1828: 2
A1829: 20500 | B1829: 喽啰 | C1829: pet_22 | D1829: 0 | E1829: 0 | F1829: 1411,100;1416,100;1412,100; | G1829: 5210,100;5126,100;5131,100; | H1829: 130+26*LV*0.6 | I1829: 45+10.5*LV*0.6 | J1829: 32+9*LV*0.6 | K1829: 24+5*LV*0.6 | L1829: 13+3*LV*0.6 | M1829: 100000 | N1829: 0 | O1829: math.max(0,(lv/5)-1) | P1829: math.max(0,(lv/5)-1) | Q1829: math.max(0,(lv/5)-1) | R1829: 0; | S1829: 有药王谷和盘丝洞的弟子在，真是不爽，还是跑路算了！ | T1829: 药王谷和盘丝洞的弟子不在眼前，真是轻松愉快啊！ | U1829: 0 | V1829: 0,0; | W1829: 2
A1830: 20501 | B1830: 喽啰 | C1830: pet_42 | D1830: 0 | E1830: 0 | F1830: 1511,100;1512,100;1513,100;1514,100; | G1830: 5210,100;5126,100;5131,100; | H1830: 130+26*LV*0.6 | I1830: 45+10.5*LV*0.6 | J1830: 32+9*LV*0.6 | K1830: 24+5*LV*0.6 | L1830: 13+3*LV*0.6 | M1830: 100000 | N1830: 0 | O1830: math.max(0,(lv/10)-1) | P1830: math.max(0,(lv/10)-1) | Q1830: math.max(0,(lv/10)-1) | R1830: 0; | S1830: 有药王谷和盘丝洞的弟子在，真是不爽，还是跑路算了！ | T1830: 药王谷和盘丝洞的弟子不在眼前，真是轻松愉快啊！ | U1830: 0 | V1830: 0,0; | W1830: 5
A1831: 20502 | B1831: 喽啰 | C1831: pet_42 | D1831: 0 | E1831: 0 | F1831: 1511,100;1512,100;1513,100;1514,100; | G1831: 5210,100;5126,100;5131,100; | H1831: 130+26*LV*0.6 | I1831: 45+10.5*LV*0.6 | J1831: 32+9*LV*0.6 | K1831: 24+5*LV*0.6 | L1831: 13+3*LV*0.6 | M1831: 100000 | N1831: 0 | O1831: math.max(0,(lv/10)-1) | P1831: math.max(0,(lv/10)-1) | Q1831: math.max(0,(lv/10)-1) | R1831: 0; | S1831: 有药王谷和盘丝洞的弟子在，真是不爽，还是跑路算了！ | T1831: 药王谷和盘丝洞的弟子不在眼前，真是轻松愉快啊！ | U1831: 0 | V1831: 0,0; | W1831: 5
A1832: 20503 | B1832: 喽啰 | C1832: pet_42 | D1832: 0 | E1832: 0 | F1832: 1511,100;1512,100;1513,100;1514,100; | G1832: 5210,100;5126,100;5131,100; | H1832: 130+26*LV*0.6 | I1832: 45+10.5*LV*0.6 | J1832: 32+9*LV*0.6 | K1832: 24+5*LV*0.6 | L1832: 13+3*LV*0.6 | M1832: 100000 | N1832: 0 | O1832: math.max(0,(lv/10)-1) | P1832: math.max(0,(lv/10)-1) | Q1832: math.max(0,(lv/10)-1) | R1832: 0; | S1832: 有药王谷和盘丝洞的弟子在，真是不爽，还是跑路算了！ | T1832: 药王谷和盘丝洞的弟子不在眼前，真是轻松愉快啊！ | U1832: 0 | V1832: 0,0; | W1832: 5
A1833: 20504 | B1833: 喽啰 | C1833: pet_42 | D1833: 0 | E1833: 0 | F1833: 1511,100;1512,100;1513,100;1514,100; | G1833: 5210,100;5126,100;5131,100; | H1833: 130+26*LV*0.6 | I1833: 45+10.5*LV*0.6 | J1833: 32+9*LV*0.6 | K1833: 24+5*LV*0.6 | L1833: 13+3*LV*0.6 | M1833: 100000 | N1833: 0 | O1833: math.max(0,(lv/10)-1) | P1833: math.max(0,(lv/10)-1) | Q1833: math.max(0,(lv/10)-1) | R1833: 0; | S1833: 有药王谷和盘丝洞的弟子在，真是不爽，还是跑路算了！ | T1833: 药王谷和盘丝洞的弟子不在眼前，真是轻松愉快啊！ | U1833: 0 | V1833: 0,0; | W1833: 5
A1834: 20505 | B1834: 喽啰 | C1834: pet_42 | D1834: 0 | E1834: 0 | F1834: 1511,100;1512,100;1513,100;1514,100; | G1834: 5210,100;5126,100;5131,100; | H1834: 130+26*LV*0.6 | I1834: 45+10.5*LV*0.6 | J1834: 32+9*LV*0.6 | K1834: 24+5*LV*0.6 | L1834: 13+3*LV*0.6 | M1834: 100000 | N1834: 0 | O1834: math.max(0,(lv/10)-1) | P1834: math.max(0,(lv/10)-1) | Q1834: math.max(0,(lv/10)-1) | R1834: 0; | S1834: 有药王谷和盘丝洞的弟子在，真是不爽，还是跑路算了！ | T1834: 药王谷和盘丝洞的弟子不在眼前，真是轻松愉快啊！ | U1834: 0 | V1834: 0,0; | W1834: 5
A1835: 20506 | B1835: 喽啰 | C1835: pet_13 | D1835: 0 | E1835: 0 | F1835: 1511,100;1512,100;1513,100;1514,100; | G1835: 5210,100;5126,100;5131,100; | H1835: 130+26*LV*0.6 | I1835: 45+10.5*LV*0.6 | J1835: 32+9*LV*0.6 | K1835: 24+5*LV*0.6 | L1835: 13+3*LV*0.6 | M1835: 100000 | N1835: 0 | O1835: math.max(0,(lv/10)-1) | P1835: math.max(0,(lv/10)-1) | Q1835: math.max(0,(lv/10)-1) | R1835: 0; | S1835: 有药王谷和盘丝洞的弟子在，真是不爽，还是跑路算了！ | T1835: 药王谷和盘丝洞的弟子不在眼前，真是轻松愉快啊！ | U1835: 0 | V1835: 0,0; | W1835: 5
A1836: 20507 | B1836: 喽啰 | C1836: pet_13 | D1836: 0 | E1836: 0 | F1836: 1511,100;1512,100;1513,100;1514,100; | G1836: 5210,100;5126,100;5131,100; | H1836: 130+26*LV*0.6 | I1836: 45+10.5*LV*0.6 | J1836: 32+9*LV*0.6 | K1836: 24+5*LV*0.6 | L1836: 13+3*LV*0.6 | M1836: 100000 | N1836: 0 | O1836: math.max(0,(lv/10)-1) | P1836: math.max(0,(lv/10)-1) | Q1836: math.max(0,(lv/10)-1) | R1836: 0; | S1836: 有药王谷和盘丝洞的弟子在，真是不爽，还是跑路算了！ | T1836: 药王谷和盘丝洞的弟子不在眼前，真是轻松愉快啊！ | U1836: 0 | V1836: 0,0; | W1836: 5
A1837: 20508 | B1837: 喽啰 | C1837: pet_13 | D1837: 0 | E1837: 0 | F1837: 1511,100;1512,100;1513,100;1514,100; | G1837: 5210,100;5126,100;5131,100; | H1837: 130+26*LV*0.6 | I1837: 45+10.5*LV*0.6 | J1837: 32+9*LV*0.6 | K1837: 24+5*LV*0.6 | L1837: 13+3*LV*0.6 | M1837: 100000 | N1837: 0 | O1837: math.max(0,(lv/10)-1) | P1837: math.max(0,(lv/10)-1) | Q1837: math.max(0,(lv/10)-1) | R1837: 0; | S1837: 有药王谷和盘丝洞的弟子在，真是不爽，还是跑路算了！ | T1837: 药王谷和盘丝洞的弟子不在眼前，真是轻松愉快啊！ | U1837: 0 | V1837: 0,0; | W1837: 5
A1838: 20509 | B1838: 喽啰 | C1838: pet_13 | D1838: 0 | E1838: 0 | F1838: 1511,100;1512,100;1513,100;1514,100; | G1838: 5210,100;5126,100;5131,100; | H1838: 130+26*LV*0.6 | I1838: 45+10.5*LV*0.6 | J1838: 32+9*LV*0.6 | K1838: 24+5*LV*0.6 | L1838: 13+3*LV*0.6 | M1838: 100000 | N1838: 0 | O1838: math.max(0,(lv/10)-1) | P1838: math.max(0,(lv/10)-1) | Q1838: math.max(0,(lv/10)-1) | R1838: 0; | S1838: 有药王谷和盘丝洞的弟子在，真是不爽，还是跑路算了！ | T1838: 药王谷和盘丝洞的弟子不在眼前，真是轻松愉快啊！ | U1838: 0 | V1838: 0,0; | W1838: 5
A1839: 20510 | B1839: 喽啰 | C1839: pet_13 | D1839: 0 | E1839: 0 | F1839: 1511,100;1512,100;1513,100;1514,100; | G1839: 5210,100;5126,100;5131,100; | H1839: 130+26*LV*0.6 | I1839: 45+10.5*LV*0.6 | J1839: 32+9*LV*0.6 | K1839: 24+5*LV*0.6 | L1839: 13+3*LV*0.6 | M1839: 100000 | N1839: 0 | O1839: math.max(0,(lv/10)-1) | P1839: math.max(0,(lv/10)-1) | Q1839: math.max(0,(lv/10)-1) | R1839: 0; | S1839: 有药王谷和盘丝洞的弟子在，真是不爽，还是跑路算了！ | T1839: 药王谷和盘丝洞的弟子不在眼前，真是轻松愉快啊！ | U1839: 0 | V1839: 0,0; | W1839: 5
A1840: 20511 | B1840: 喽啰 | C1840: hero_1001 | D1840: 0 | E1840: 0 | F1840: 1511,100;1512,100;1513,100;1514,100; | G1840: 5210,100;5126,100;5131,100; | H1840: 130+26*LV*0.6 | I1840: 45+10.5*LV*0.6 | J1840: 32+9*LV*0.6 | K1840: 24+5*LV*0.6 | L1840: 13+3*LV*0.6 | M1840: 100000 | N1840: 0 | O1840: math.max(0,(lv/10)-1) | P1840: math.max(0,(lv/10)-1) | Q1840: math.max(0,(lv/10)-1) | R1840: 0; | S1840: 有药王谷和盘丝洞的弟子在，真是不爽，还是跑路算了！ | T1840: 药王谷和盘丝洞的弟子不在眼前，真是轻松愉快啊！ | U1840: 0 | V1840: 0,0; | W1840: 5
A1841: 20512 | B1841: 喽啰 | C1841: pet_62 | D1841: 0 | E1841: 0 | F1841: 1511,100;1512,100;1513,100;1514,100; | G1841: 5210,100;5126,100;5131,100; | H1841: 130+26*LV*0.6 | I1841: 45+10.5*LV*0.6 | J1841: 32+9*LV*0.6 | K1841: 24+5*LV*0.6 | L1841: 13+3*LV*0.6 | M1841: 100000 | N1841: 0 | O1841: math.max(0,(lv/10)-1) | P1841: math.max(0,(lv/10)-1) | Q1841: math.max(0,(lv/10)-1) | R1841: 0; | S1841: 有药王谷和盘丝洞的弟子在，真是不爽，还是跑路算了！ | T1841: 药王谷和盘丝洞的弟子不在眼前，真是轻松愉快啊！ | U1841: 0 | V1841: 0,0; | W1841: 5
A1842: 20513 | B1842: 喽啰 | C1842: pet_23 | D1842: 0 | E1842: 0 | F1842: 1511,100;1512,100;1513,100;1514,100; | G1842: 5210,100;5126,100;5131,100; | H1842: 130+26*LV*0.6 | I1842: 45+10.5*LV*0.6 | J1842: 32+9*LV*0.6 | K1842: 24+5*LV*0.6 | L1842: 13+3*LV*0.6 | M1842: 100000 | N1842: 0 | O1842: math.max(0,(lv/10)-1) | P1842: math.max(0,(lv/10)-1) | Q1842: math.max(0,(lv/10)-1) | R1842: 0; | S1842: 有药王谷和盘丝洞的弟子在，真是不爽，还是跑路算了！ | T1842: 药王谷和盘丝洞的弟子不在眼前，真是轻松愉快啊！ | U1842: 0 | V1842: 0,0; | W1842: 5
A1843: 20514 | B1843: 喽啰 | C1843: pet_61 | D1843: 0 | E1843: 0 | F1843: 1511,100;1512,100;1513,100;1514,100; | G1843: 5210,100;5126,100;5131,100; | H1843: 130+26*LV*0.6 | I1843: 45+10.5*LV*0.6 | J1843: 32+9*LV*0.6 | K1843: 24+5*LV*0.6 | L1843: 13+3*LV*0.6 | M1843: 100000 | N1843: 0 | O1843: math.max(0,(lv/10)-1) | P1843: math.max(0,(lv/10)-1) | Q1843: math.max(0,(lv/10)-1) | R1843: 0; | S1843: 有药王谷和盘丝洞的弟子在，真是不爽，还是跑路算了！ | T1843: 药王谷和盘丝洞的弟子不在眼前，真是轻松愉快啊！ | U1843: 0 | V1843: 0,0; | W1843: 5
A1844: 20515 | B1844: 喽啰 | C1844: pet_62 | D1844: 0 | E1844: 0 | F1844: 1511,100;1512,100;1513,100;1514,100; | G1844: 5210,100;5126,100;5131,100; | H1844: 130+26*LV*0.6 | I1844: 45+10.5*LV*0.6 | J1844: 32+9*LV*0.6 | K1844: 24+5*LV*0.6 | L1844: 13+3*LV*0.6 | M1844: 100000 | N1844: 0 | O1844: math.max(0,(lv/10)-1) | P1844: math.max(0,(lv/10)-1) | Q1844: math.max(0,(lv/10)-1) | R1844: 0; | S1844: 有药王谷和盘丝洞的弟子在，真是不爽，还是跑路算了！ | T1844: 药王谷和盘丝洞的弟子不在眼前，真是轻松愉快啊！ | U1844: 0 | V1844: 0,0; | W1844: 5
A1845: 20516 | B1845: 喽啰 | C1845: pet_53 | D1845: 0 | E1845: 0 | F1845: 1511,100;1512,100;1513,100;1514,100; | G1845: 5210,100;5126,100;5131,100; | H1845: 130+26*LV*0.6 | I1845: 45+10.5*LV*0.6 | J1845: 32+9*LV*0.6 | K1845: 24+5*LV*0.6 | L1845: 13+3*LV*0.6 | M1845: 100000 | N1845: 0 | O1845: math.max(0,(lv/10)-1) | P1845: math.max(0,(lv/10)-1) | Q1845: math.max(0,(lv/10)-1) | R1845: 0; | S1845: 有药王谷和盘丝洞的弟子在，真是不爽，还是跑路算了！ | T1845: 药王谷和盘丝洞的弟子不在眼前，真是轻松愉快啊！ | U1845: 0 | V1845: 0,0; | W1845: 5
A1846: 20517 | B1846: 喽啰 | C1846: pet_23 | D1846: 0 | E1846: 0 | F1846: 1511,100;1512,100;1513,100;1514,100; | G1846: 5210,100;5126,100;5131,100; | H1846: 130+26*LV*0.6 | I1846: 45+10.5*LV*0.6 | J1846: 32+9*LV*0.6 | K1846: 24+5*LV*0.6 | L1846: 13+3*LV*0.6 | M1846: 100000 | N1846: 0 | O1846: math.max(0,(lv/10)-1) | P1846: math.max(0,(lv/10)-1) | Q1846: math.max(0,(lv/10)-1) | R1846: 0; | S1846: 有药王谷和盘丝洞的弟子在，真是不爽，还是跑路算了！ | T1846: 药王谷和盘丝洞的弟子不在眼前，真是轻松愉快啊！ | U1846: 0 | V1846: 0,0; | W1846: 5
A1847: 20518 | B1847: 喽啰 | C1847: partner_1009 | D1847: 0 | E1847: 0 | F1847: 1511,100;1512,100;1513,100;1514,100; | G1847: 5210,100;5126,100;5131,100; | H1847: 130+26*LV*0.6 | I1847: 45+10.5*LV*0.6 | J1847: 32+9*LV*0.6 | K1847: 24+5*LV*0.6 | L1847: 13+3*LV*0.6 | M1847: 100000 | N1847: 0 | O1847: math.max(0,(lv/10)-1) | P1847: math.max(0,(lv/10)-1) | Q1847: math.max(0,(lv/10)-1) | R1847: 0; | S1847: 有药王谷和盘丝洞的弟子在，真是不爽，还是跑路算了！ | T1847: 药王谷和盘丝洞的弟子不在眼前，真是轻松愉快啊！ | U1847: 0 | V1847: 0,0; | W1847: 5
A1848: 20519 | B1848: 喽啰 | C1848: pet_21 | D1848: 0 | E1848: 0 | F1848: 1511,100;1512,100;1513,100;1514,100; | G1848: 5210,100;5126,100;5131,100; | H1848: 130+26*LV*0.6 | I1848: 45+10.5*LV*0.6 | J1848: 32+9*LV*0.6 | K1848: 24+5*LV*0.6 | L1848: 13+3*LV*0.6 | M1848: 100000 | N1848: 0 | O1848: math.max(0,(lv/10)-1) | P1848: math.max(0,(lv/10)-1) | Q1848: math.max(0,(lv/10)-1) | R1848: 0; | S1848: 有药王谷和盘丝洞的弟子在，真是不爽，还是跑路算了！ | T1848: 药王谷和盘丝洞的弟子不在眼前，真是轻松愉快啊！ | U1848: 0 | V1848: 0,0; | W1848: 5
A1849: 20520 | B1849: 喽啰 | C1849: hero_1001 | D1849: 0 | E1849: 0 | F1849: 1511,100;1512,100;1513,100;1514,100; | G1849: 5210,100;5126,100;5131,100; | H1849: 130+26*LV*0.6 | I1849: 45+10.5*LV*0.6 | J1849: 32+9*LV*0.6 | K1849: 24+5*LV*0.6 | L1849: 13+3*LV*0.6 | M1849: 100000 | N1849: 0 | O1849: math.max(0,(lv/10)-1) | P1849: math.max(0,(lv/10)-1) | Q1849: math.max(0,(lv/10)-1) | R1849: 0; | S1849: 有药王谷和盘丝洞的弟子在，真是不爽，还是跑路算了！ | T1849: 药王谷和盘丝洞的弟子不在眼前，真是轻松愉快啊！ | U1849: 0 | V1849: 0,0; | W1849: 5
A1850: 20521 | B1850: 喽啰 | C1850: pet_33 | D1850: 0 | E1850: 0 | F1850: 1511,100;1512,100;1513,100;1514,100; | G1850: 5210,100;5126,100;5131,100; | H1850: 130+26*LV*0.6 | I1850: 45+10.5*LV*0.6 | J1850: 32+9*LV*0.6 | K1850: 24+5*LV*0.6 | L1850: 13+3*LV*0.6 | M1850: 100000 | N1850: 0 | O1850: math.max(0,(lv/10)-1) | P1850: math.max(0,(lv/10)-1) | Q1850: math.max(0,(lv/10)-1) | R1850: 0; | S1850: 有药王谷和盘丝洞的弟子在，真是不爽，还是跑路算了！ | T1850: 药王谷和盘丝洞的弟子不在眼前，真是轻松愉快啊！ | U1850: 0 | V1850: 0,0; | W1850: 5
A1851: 20522 | B1851: 喽啰 | C1851: pet_23 | D1851: 0 | E1851: 0 | F1851: 1511,100;1512,100;1513,100;1514,100; | G1851: 5210,100;5126,100;5131,100; | H1851: 130+26*LV*0.6 | I1851: 45+10.5*LV*0.6 | J1851: 32+9*LV*0.6 | K1851: 24+5*LV*0.6 | L1851: 13+3*LV*0.6 | M1851: 100000 | N1851: 0 | O1851: math.max(0,(lv/10)-1) | P1851: math.max(0,(lv/10)-1) | Q1851: math.max(0,(lv/10)-1) | R1851: 0; | S1851: 有药王谷和盘丝洞的弟子在，真是不爽，还是跑路算了！ | T1851: 药王谷和盘丝洞的弟子不在眼前，真是轻松愉快啊！ | U1851: 0 | V1851: 0,0; | W1851: 5
A1852: 20523 | B1852: 喽啰 | C1852: hero_1001 | D1852: 0 | E1852: 0 | F1852: 1511,100;1512,100;1513,100;1514,100; | G1852: 5210,100;5126,100;5131,100; | H1852: 130+26*LV*0.6 | I1852: 45+10.5*LV*0.6 | J1852: 32+9*LV*0.6 | K1852: 24+5*LV*0.6 | L1852: 13+3*LV*0.6 | M1852: 100000 | N1852: 0 | O1852: math.max(0,(lv/10)-1) | P1852: math.max(0,(lv/10)-1) | Q1852: math.max(0,(lv/10)-1) | R1852: 0; | S1852: 有药王谷和盘丝洞的弟子在，真是不爽，还是跑路算了！ | T1852: 药王谷和盘丝洞的弟子不在眼前，真是轻松愉快啊！ | U1852: 0 | V1852: 0,0; | W1852: 5
A1853: 20524 | B1853: 喽啰 | C1853: partner_1003 | D1853: 0 | E1853: 0 | F1853: 1511,100;1512,100;1513,100;1514,100; | G1853: 5210,100;5126,100;5131,100; | H1853: 130+26*LV*0.6 | I1853: 45+10.5*LV*0.6 | J1853: 32+9*LV*0.6 | K1853: 24+5*LV*0.6 | L1853: 13+3*LV*0.6 | M1853: 100000 | N1853: 0 | O1853: math.max(0,(lv/10)-1) | P1853: math.max(0,(lv/10)-1) | Q1853: math.max(0,(lv/10)-1) | R1853: 0; | S1853: 有药王谷和盘丝洞的弟子在，真是不爽，还是跑路算了！ | T1853: 药王谷和盘丝洞的弟子不在眼前，真是轻松愉快啊！ | U1853: 0 | V1853: 0,0; | W1853: 5
A1854: 20525 | B1854: 喽啰 | C1854: pet_1 | D1854: 0 | E1854: 0 | F1854: 1511,100;1512,100;1513,100;1514,100; | G1854: 5210,100;5126,100;5131,100; | H1854: 130+26*LV*0.6 | I1854: 45+10.5*LV*0.6 | J1854: 32+9*LV*0.6 | K1854: 24+5*LV*0.6 | L1854: 13+3*LV*0.6 | M1854: 100000 | N1854: 0 | O1854: math.max(0,(lv/10)-1) | P1854: math.max(0,(lv/10)-1) | Q1854: math.max(0,(lv/10)-1) | R1854: 0; | S1854: 有药王谷和盘丝洞的弟子在，真是不爽，还是跑路算了！ | T1854: 药王谷和盘丝洞的弟子不在眼前，真是轻松愉快啊！ | U1854: 0 | V1854: 0,0; | W1854: 5
A1855: 20526 | B1855: 喽啰 | C1855: pet_63 | D1855: 0 | E1855: 0 | F1855: 1511,100;1512,100;1513,100;1514,100; | G1855: 5210,100;5126,100;5131,100; | H1855: 130+26*LV*0.6 | I1855: 45+10.5*LV*0.6 | J1855: 32+9*LV*0.6 | K1855: 24+5*LV*0.6 | L1855: 13+3*LV*0.6 | M1855: 100000 | N1855: 0 | O1855: math.max(0,(lv/10)-1) | P1855: math.max(0,(lv/10)-1) | Q1855: math.max(0,(lv/10)-1) | R1855: 0; | S1855: 有药王谷和盘丝洞的弟子在，真是不爽，还是跑路算了！ | T1855: 药王谷和盘丝洞的弟子不在眼前，真是轻松愉快啊！ | U1855: 0 | V1855: 0,0; | W1855: 5
A1856: 20527 | B1856: 喽啰 | C1856: pet_62 | D1856: 0 | E1856: 0 | F1856: 1511,100;1512,100;1513,100;1514,100; | G1856: 5210,100;5126,100;5131,100; | H1856: 130+26*LV*0.6 | I1856: 45+10.5*LV*0.6 | J1856: 32+9*LV*0.6 | K1856: 24+5*LV*0.6 | L1856: 13+3*LV*0.6 | M1856: 100000 | N1856: 0 | O1856: math.max(0,(lv/10)-1) | P1856: math.max(0,(lv/10)-1) | Q1856: math.max(0,(lv/10)-1) | R1856: 0; | S1856: 有药王谷和盘丝洞的弟子在，真是不爽，还是跑路算了！ | T1856: 药王谷和盘丝洞的弟子不在眼前，真是轻松愉快啊！ | U1856: 0 | V1856: 0,0; | W1856: 5
A1857: 20528 | B1857: 喽啰 | C1857: pet_93 | D1857: 0 | E1857: 0 | F1857: 1511,100;1512,100;1513,100;1514,100; | G1857: 5210,100;5126,100;5131,100; | H1857: 130+26*LV*0.6 | I1857: 45+10.5*LV*0.6 | J1857: 32+9*LV*0.6 | K1857: 24+5*LV*0.6 | L1857: 13+3*LV*0.6 | M1857: 100000 | N1857: 0 | O1857: math.max(0,(lv/10)-1) | P1857: math.max(0,(lv/10)-1) | Q1857: math.max(0,(lv/10)-1) | R1857: 0; | S1857: 有药王谷和盘丝洞的弟子在，真是不爽，还是跑路算了！ | T1857: 药王谷和盘丝洞的弟子不在眼前，真是轻松愉快啊！ | U1857: 0 | V1857: 0,0; | W1857: 5
A1858: 20529 | B1858: 喽啰 | C1858: pet_73 | D1858: 0 | E1858: 0 | F1858: 1511,100;1512,100;1513,100;1514,100; | G1858: 5210,100;5126,100;5131,100; | H1858: 130+26*LV*0.6 | I1858: 45+10.5*LV*0.6 | J1858: 32+9*LV*0.6 | K1858: 24+5*LV*0.6 | L1858: 13+3*LV*0.6 | M1858: 100000 | N1858: 0 | O1858: math.max(0,(lv/10)-1) | P1858: math.max(0,(lv/10)-1) | Q1858: math.max(0,(lv/10)-1) | R1858: 0; | S1858: 有药王谷和盘丝洞的弟子在，真是不爽，还是跑路算了！ | T1858: 药王谷和盘丝洞的弟子不在眼前，真是轻松愉快啊！ | U1858: 0 | V1858: 0,0; | W1858: 5
A1859: 20530 | B1859: 喽啰 | C1859: pet_83 | D1859: 0 | E1859: 0 | F1859: 1511,100;1512,100;1513,100;1514,100; | G1859: 5210,100;5126,100;5131,100; | H1859: 130+26*LV*0.6 | I1859: 45+10.5*LV*0.6 | J1859: 32+9*LV*0.6 | K1859: 24+5*LV*0.6 | L1859: 13+3*LV*0.6 | M1859: 100000 | N1859: 0 | O1859: math.max(0,(lv/10)-1) | P1859: math.max(0,(lv/10)-1) | Q1859: math.max(0,(lv/10)-1) | R1859: 0; | S1859: 有药王谷和盘丝洞的弟子在，真是不爽，还是跑路算了！ | T1859: 药王谷和盘丝洞的弟子不在眼前，真是轻松愉快啊！ | U1859: 0 | V1859: 0,0; | W1859: 5
A1860: 20531 | B1860: 喽啰 | C1860: pet_22 | D1860: 0 | E1860: 0 | F1860: 1511,100;1512,100;1513,100;1514,100; | G1860: 5210,100;5126,100;5131,100; | H1860: 130+26*LV*0.6 | I1860: 45+10.5*LV*0.6 | J1860: 32+9*LV*0.6 | K1860: 24+5*LV*0.6 | L1860: 13+3*LV*0.6 | M1860: 100000 | N1860: 0 | O1860: math.max(0,(lv/10)-1) | P1860: math.max(0,(lv/10)-1) | Q1860: math.max(0,(lv/10)-1) | R1860: 0; | S1860: 有药王谷和盘丝洞的弟子在，真是不爽，还是跑路算了！ | T1860: 药王谷和盘丝洞的弟子不在眼前，真是轻松愉快啊！ | U1860: 0 | V1860: 0,0; | W1860: 5
A1861: 20532 | B1861: 喽啰 | C1861: pet_201 | D1861: 0 | E1861: 0 | F1861: 1511,100;1512,100;1513,100;1514,100; | G1861: 5210,100;5126,100;5131,100; | H1861: 130+26*LV*0.6 | I1861: 45+10.5*LV*0.6 | J1861: 32+9*LV*0.6 | K1861: 24+5*LV*0.6 | L1861: 13+3*LV*0.6 | M1861: 100000 | N1861: 0 | O1861: math.max(0,(lv/10)-1) | P1861: math.max(0,(lv/10)-1) | Q1861: math.max(0,(lv/10)-1) | R1861: 0; | S1861: 有药王谷和盘丝洞的弟子在，真是不爽，还是跑路算了！ | T1861: 药王谷和盘丝洞的弟子不在眼前，真是轻松愉快啊！ | U1861: 0 | V1861: 0,0; | W1861: 5
A1862: 20533 | B1862: 喽啰 | C1862: pet_22 | D1862: 0 | E1862: 0 | F1862: 1511,100;1512,100;1513,100;1514,100; | G1862: 5210,100;5126,100;5131,100; | H1862: 130+26*LV*0.6 | I1862: 45+10.5*LV*0.6 | J1862: 32+9*LV*0.6 | K1862: 24+5*LV*0.6 | L1862: 13+3*LV*0.6 | M1862: 100000 | N1862: 0 | O1862: math.max(0,(lv/10)-1) | P1862: math.max(0,(lv/10)-1) | Q1862: math.max(0,(lv/10)-1) | R1862: 0; | S1862: 有药王谷和盘丝洞的弟子在，真是不爽，还是跑路算了！ | T1862: 药王谷和盘丝洞的弟子不在眼前，真是轻松愉快啊！ | U1862: 0 | V1862: 0,0; | W1862: 5
A1863: 20534 | B1863: 喽啰 | C1863: pet_62 | D1863: 0 | E1863: 0 | F1863: 1511,100;1512,100;1513,100;1514,100; | G1863: 5210,100;5126,100;5131,100; | H1863: 130+26*LV*0.6 | I1863: 45+10.5*LV*0.6 | J1863: 32+9*LV*0.6 | K1863: 24+5*LV*0.6 | L1863: 13+3*LV*0.6 | M1863: 100000 | N1863: 0 | O1863: math.max(0,(lv/10)-1) | P1863: math.max(0,(lv/10)-1) | Q1863: math.max(0,(lv/10)-1) | R1863: 0; | S1863: 有药王谷和盘丝洞的弟子在，真是不爽，还是跑路算了！ | T1863: 药王谷和盘丝洞的弟子不在眼前，真是轻松愉快啊！ | U1863: 0 | V1863: 0,0; | W1863: 5
A1864: 20535 | B1864: 喽啰 | C1864: hero_1001 | D1864: 0 | E1864: 0 | F1864: 1511,100;1512,100;1513,100;1514,100; | G1864: 5210,100;5126,100;5131,100; | H1864: 130+26*LV*0.6 | I1864: 45+10.5*LV*0.6 | J1864: 32+9*LV*0.6 | K1864: 24+5*LV*0.6 | L1864: 13+3*LV*0.6 | M1864: 100000 | N1864: 0 | O1864: math.max(0,(lv/10)-1) | P1864: math.max(0,(lv/10)-1) | Q1864: math.max(0,(lv/10)-1) | R1864: 0; | S1864: 有药王谷和盘丝洞的弟子在，真是不爽，还是跑路算了！ | T1864: 药王谷和盘丝洞的弟子不在眼前，真是轻松愉快啊！ | U1864: 0 | V1864: 0,0; | W1864: 5
A1865: 20536 | B1865: 喽啰 | C1865: hero_1001 | D1865: 0 | E1865: 0 | F1865: 1511,100;1512,100;1513,100;1514,100; | G1865: 5210,100;5126,100;5131,100; | H1865: 130+26*LV*0.6 | I1865: 45+10.5*LV*0.6 | J1865: 32+9*LV*0.6 | K1865: 24+5*LV*0.6 | L1865: 13+3*LV*0.6 | M1865: 100000 | N1865: 0 | O1865: math.max(0,(lv/10)-1) | P1865: math.max(0,(lv/10)-1) | Q1865: math.max(0,(lv/10)-1) | R1865: 0; | S1865: 有药王谷和盘丝洞的弟子在，真是不爽，还是跑路算了！ | T1865: 药王谷和盘丝洞的弟子不在眼前，真是轻松愉快啊！ | U1865: 0 | V1865: 0,0; | W1865: 5
A1866: 20537 | B1866: 喽啰 | C1866: common_3018 | D1866: 0 | E1866: 0 | F1866: 1511,100;1512,100;1513,100;1514,100; | G1866: 5210,100;5126,100;5131,100; | H1866: 130+26*LV*0.6 | I1866: 45+10.5*LV*0.6 | J1866: 32+9*LV*0.6 | K1866: 24+5*LV*0.6 | L1866: 13+3*LV*0.6 | M1866: 100000 | N1866: 0 | O1866: math.max(0,(lv/10)-1) | P1866: math.max(0,(lv/10)-1) | Q1866: math.max(0,(lv/10)-1) | R1866: 0; | S1866: 有药王谷和盘丝洞的弟子在，真是不爽，还是跑路算了！ | T1866: 药王谷和盘丝洞的弟子不在眼前，真是轻松愉快啊！ | U1866: 0 | V1866: 0,0; | W1866: 5
A1867: 20538 | B1867: 喽啰 | C1867: hero_1001 | D1867: 0 | E1867: 0 | F1867: 1511,100;1512,100;1513,100;1514,100; | G1867: 5210,100;5126,100;5131,100; | H1867: 130+26*LV*0.6 | I1867: 45+10.5*LV*0.6 | J1867: 32+9*LV*0.6 | K1867: 24+5*LV*0.6 | L1867: 13+3*LV*0.6 | M1867: 100000 | N1867: 0 | O1867: math.max(0,(lv/10)-1) | P1867: math.max(0,(lv/10)-1) | Q1867: math.max(0,(lv/10)-1) | R1867: 0; | S1867: 有药王谷和盘丝洞的弟子在，真是不爽，还是跑路算了！ | T1867: 药王谷和盘丝洞的弟子不在眼前，真是轻松愉快啊！ | U1867: 0 | V1867: 0,0; | W1867: 5
A1868: 20539 | B1868: 喽啰 | C1868: hero_2001 | D1868: 0 | E1868: 0 | F1868: 1511,100;1512,100;1513,100;1514,100; | G1868: 5210,100;5126,100;5131,100; | H1868: 130+26*LV*0.6 | I1868: 45+10.5*LV*0.6 | J1868: 32+9*LV*0.6 | K1868: 24+5*LV*0.6 | L1868: 13+3*LV*0.6 | M1868: 100000 | N1868: 0 | O1868: math.max(0,(lv/10)-1) | P1868: math.max(0,(lv/10)-1) | Q1868: math.max(0,(lv/10)-1) | R1868: 0; | S1868: 有药王谷和盘丝洞的弟子在，真是不爽，还是跑路算了！ | T1868: 药王谷和盘丝洞的弟子不在眼前，真是轻松愉快啊！ | U1868: 0 | V1868: 0,0; | W1868: 5
A1869: 20540 | B1869: 喽啰 | C1869: pet_22 | D1869: 0 | E1869: 0 | F1869: 1511,100;1512,100;1513,100;1514,100; | G1869: 5210,100;5126,100;5131,100; | H1869: 130+26*LV*0.6 | I1869: 45+10.5*LV*0.6 | J1869: 32+9*LV*0.6 | K1869: 24+5*LV*0.6 | L1869: 13+3*LV*0.6 | M1869: 100000 | N1869: 0 | O1869: math.max(0,(lv/10)-1) | P1869: math.max(0,(lv/10)-1) | Q1869: math.max(0,(lv/10)-1) | R1869: 0; | S1869: 有药王谷和盘丝洞的弟子在，真是不爽，还是跑路算了！ | T1869: 药王谷和盘丝洞的弟子不在眼前，真是轻松愉快啊！ | U1869: 0 | V1869: 0,0; | W1869: 5
A1870: 20541 | B1870: 喽啰 | C1870: hero_1001 | D1870: 0 | E1870: 0 | F1870: 1511,100;1512,100;1513,100;1514,100; | G1870: 5210,100;5126,100;5131,100; | H1870: 130+26*LV*0.6 | I1870: 45+10.5*LV*0.6 | J1870: 32+9*LV*0.6 | K1870: 24+5*LV*0.6 | L1870: 13+3*LV*0.6 | M1870: 100000 | N1870: 0 | O1870: math.max(0,(lv/10)-1) | P1870: math.max(0,(lv/10)-1) | Q1870: math.max(0,(lv/10)-1) | R1870: 0; | S1870: 有药王谷和盘丝洞的弟子在，真是不爽，还是跑路算了！ | T1870: 药王谷和盘丝洞的弟子不在眼前，真是轻松愉快啊！ | U1870: 0 | V1870: 0,0; | W1870: 5
A1871: 20542 | B1871: 喽啰 | C1871: pet_22 | D1871: 0 | E1871: 0 | F1871: 1511,100;1512,100;1513,100;1514,100; | G1871: 5210,100;5126,100;5131,100; | H1871: 130+26*LV*0.6 | I1871: 45+10.5*LV*0.6 | J1871: 32+9*LV*0.6 | K1871: 24+5*LV*0.6 | L1871: 13+3*LV*0.6 | M1871: 100000 | N1871: 0 | O1871: math.max(0,(lv/10)-1) | P1871: math.max(0,(lv/10)-1) | Q1871: math.max(0,(lv/10)-1) | R1871: 0; | S1871: 有药王谷和盘丝洞的弟子在，真是不爽，还是跑路算了！ | T1871: 药王谷和盘丝洞的弟子不在眼前，真是轻松愉快啊！ | U1871: 0 | V1871: 0,0; | W1871: 5
A1872: 20543 | B1872: 喽啰 | C1872: hero_1001 | D1872: 0 | E1872: 0 | F1872: 1511,100;1512,100;1513,100;1514,100; | G1872: 5210,100;5126,100;5131,100; | H1872: 130+26*LV*0.6 | I1872: 45+10.5*LV*0.6 | J1872: 32+9*LV*0.6 | K1872: 24+5*LV*0.6 | L1872: 13+3*LV*0.6 | M1872: 100000 | N1872: 0 | O1872: math.max(0,(lv/10)-1) | P1872: math.max(0,(lv/10)-1) | Q1872: math.max(0,(lv/10)-1) | R1872: 0; | S1872: 有药王谷和盘丝洞的弟子在，真是不爽，还是跑路算了！ | T1872: 药王谷和盘丝洞的弟子不在眼前，真是轻松愉快啊！ | U1872: 0 | V1872: 0,0; | W1872: 5
A1873: 20544 | B1873: 喽啰 | C1873: hero_1001 | D1873: 0 | E1873: 0 | F1873: 1511,100;1512,100;1513,100;1514,100; | G1873: 5210,100;5126,100;5131,100; | H1873: 130+26*LV*0.6 | I1873: 45+10.5*LV*0.6 | J1873: 32+9*LV*0.6 | K1873: 24+5*LV*0.6 | L1873: 13+3*LV*0.6 | M1873: 100000 | N1873: 0 | O1873: math.max(0,(lv/10)-1) | P1873: math.max(0,(lv/10)-1) | Q1873: math.max(0,(lv/10)-1) | R1873: 0; | S1873: 有药王谷和盘丝洞的弟子在，真是不爽，还是跑路算了！ | T1873: 药王谷和盘丝洞的弟子不在眼前，真是轻松愉快啊！ | U1873: 0 | V1873: 0,0; | W1873: 5
A1874: 20545 | B1874: 喽啰 | C1874: common_3007 | D1874: 0 | E1874: 0 | F1874: 1511,100;1512,100;1513,100;1514,100; | G1874: 5210,100;5126,100;5131,100; | H1874: 130+26*LV*0.6 | I1874: 45+10.5*LV*0.6 | J1874: 32+9*LV*0.6 | K1874: 24+5*LV*0.6 | L1874: 13+3*LV*0.6 | M1874: 100000 | N1874: 0 | O1874: math.max(0,(lv/10)-1) | P1874: math.max(0,(lv/10)-1) | Q1874: math.max(0,(lv/10)-1) | R1874: 0; | S1874: 有药王谷和盘丝洞的弟子在，真是不爽，还是跑路算了！ | T1874: 药王谷和盘丝洞的弟子不在眼前，真是轻松愉快啊！ | U1874: 0 | V1874: 0,0; | W1874: 5
A1875: 20546 | B1875: 喽啰 | C1875: pet_53 | D1875: 0 | E1875: 0 | F1875: 1511,100;1512,100;1513,100;1514,100; | G1875: 5210,100;5126,100;5131,100; | H1875: 130+26*LV*0.6 | I1875: 45+10.5*LV*0.6 | J1875: 32+9*LV*0.6 | K1875: 24+5*LV*0.6 | L1875: 13+3*LV*0.6 | M1875: 100000 | N1875: 0 | O1875: math.max(0,(lv/10)-1) | P1875: math.max(0,(lv/10)-1) | Q1875: math.max(0,(lv/10)-1) | R1875: 0; | S1875: 有药王谷和盘丝洞的弟子在，真是不爽，还是跑路算了！ | T1875: 药王谷和盘丝洞的弟子不在眼前，真是轻松愉快啊！ | U1875: 0 | V1875: 0,0; | W1875: 5
A1876: 20547 | B1876: 喽啰 | C1876: pet_61 | D1876: 0 | E1876: 0 | F1876: 1511,100;1512,100;1513,100;1514,100; | G1876: 5210,100;5126,100;5131,100; | H1876: 130+26*LV*0.6 | I1876: 45+10.5*LV*0.6 | J1876: 32+9*LV*0.6 | K1876: 24+5*LV*0.6 | L1876: 13+3*LV*0.6 | M1876: 100000 | N1876: 0 | O1876: math.max(0,(lv/10)-1) | P1876: math.max(0,(lv/10)-1) | Q1876: math.max(0,(lv/10)-1) | R1876: 0; | S1876: 有药王谷和盘丝洞的弟子在，真是不爽，还是跑路算了！ | T1876: 药王谷和盘丝洞的弟子不在眼前，真是轻松愉快啊！ | U1876: 0 | V1876: 0,0; | W1876: 5
A1877: 20548 | B1877: 喽啰 | C1877: common_3018 | D1877: 0 | E1877: 0 | F1877: 1511,100;1512,100;1513,100;1514,100; | G1877: 5210,100;5126,100;5131,100; | H1877: 130+26*LV*0.6 | I1877: 45+10.5*LV*0.6 | J1877: 32+9*LV*0.6 | K1877: 24+5*LV*0.6 | L1877: 13+3*LV*0.6 | M1877: 100000 | N1877: 0 | O1877: math.max(0,(lv/10)-1) | P1877: math.max(0,(lv/10)-1) | Q1877: math.max(0,(lv/10)-1) | R1877: 0; | S1877: 有药王谷和盘丝洞的弟子在，真是不爽，还是跑路算了！ | T1877: 药王谷和盘丝洞的弟子不在眼前，真是轻松愉快啊！ | U1877: 0 | V1877: 0,0; | W1877: 5
A1878: 20549 | B1878: 喽啰 | C1878: pet_13 | D1878: 0 | E1878: 0 | F1878: 1511,100;1512,100;1513,100;1514,100; | G1878: 5210,100;5126,100;5131,100; | H1878: 130+26*LV*0.6 | I1878: 45+10.5*LV*0.6 | J1878: 32+9*LV*0.6 | K1878: 24+5*LV*0.6 | L1878: 13+3*LV*0.6 | M1878: 100000 | N1878: 0 | O1878: math.max(0,(lv/10)-1) | P1878: math.max(0,(lv/10)-1) | Q1878: math.max(0,(lv/10)-1) | R1878: 0; | S1878: 有药王谷和盘丝洞的弟子在，真是不爽，还是跑路算了！ | T1878: 药王谷和盘丝洞的弟子不在眼前，真是轻松愉快啊！ | U1878: 0 | V1878: 0,0; | W1878: 5
A1879: 20550 | B1879: 喽啰 | C1879: pet_23 | D1879: 0 | E1879: 0 | F1879: 1511,100;1512,100;1513,100;1514,100; | G1879: 5210,100;5126,100;5131,100; | H1879: 130+26*LV*0.6 | I1879: 45+10.5*LV*0.6 | J1879: 32+9*LV*0.6 | K1879: 24+5*LV*0.6 | L1879: 13+3*LV*0.6 | M1879: 100000 | N1879: 0 | O1879: math.max(0,(lv/10)-1) | P1879: math.max(0,(lv/10)-1) | Q1879: math.max(0,(lv/10)-1) | R1879: 0; | S1879: 有药王谷和盘丝洞的弟子在，真是不爽，还是跑路算了！ | T1879: 药王谷和盘丝洞的弟子不在眼前，真是轻松愉快啊！ | U1879: 0 | V1879: 0,0; | W1879: 5
A1880: 20551 | B1880: 喽啰 | C1880: common_3018 | D1880: 0 | E1880: 0 | F1880: 1511,100;1512,100;1513,100;1514,100; | G1880: 5210,100;5126,100;5131,100; | H1880: 130+26*LV*0.6 | I1880: 45+10.5*LV*0.6 | J1880: 32+9*LV*0.6 | K1880: 24+5*LV*0.6 | L1880: 13+3*LV*0.6 | M1880: 100000 | N1880: 0 | O1880: math.max(0,(lv/10)-1) | P1880: math.max(0,(lv/10)-1) | Q1880: math.max(0,(lv/10)-1) | R1880: 0; | S1880: 有药王谷和盘丝洞的弟子在，真是不爽，还是跑路算了！ | T1880: 药王谷和盘丝洞的弟子不在眼前，真是轻松愉快啊！ | U1880: 0 | V1880: 0,0; | W1880: 5
A1881: 20552 | B1881: 喽啰 | C1881: pet_71 | D1881: 0 | E1881: 0 | F1881: 1511,100;1512,100;1513,100;1514,100; | G1881: 5210,100;5126,100;5131,100; | H1881: 130+26*LV*0.6 | I1881: 45+10.5*LV*0.6 | J1881: 32+9*LV*0.6 | K1881: 24+5*LV*0.6 | L1881: 13+3*LV*0.6 | M1881: 100000 | N1881: 0 | O1881: math.max(0,(lv/10)-1) | P1881: math.max(0,(lv/10)-1) | Q1881: math.max(0,(lv/10)-1) | R1881: 0; | S1881: 有药王谷和盘丝洞的弟子在，真是不爽，还是跑路算了！ | T1881: 药王谷和盘丝洞的弟子不在眼前，真是轻松愉快啊！ | U1881: 0 | V1881: 0,0; | W1881: 5
A1882: 20553 | B1882: 喽啰 | C1882: hero_1001 | D1882: 0 | E1882: 0 | F1882: 1511,100;1512,100;1513,100;1514,100; | G1882: 5210,100;5126,100;5131,100; | H1882: 130+26*LV*0.6 | I1882: 45+10.5*LV*0.6 | J1882: 32+9*LV*0.6 | K1882: 24+5*LV*0.6 | L1882: 13+3*LV*0.6 | M1882: 100000 | N1882: 0 | O1882: math.max(0,(lv/10)-1) | P1882: math.max(0,(lv/10)-1) | Q1882: math.max(0,(lv/10)-1) | R1882: 0; | S1882: 有药王谷和盘丝洞的弟子在，真是不爽，还是跑路算了！ | T1882: 药王谷和盘丝洞的弟子不在眼前，真是轻松愉快啊！ | U1882: 0 | V1882: 0,0; | W1882: 5
A1883: 20554 | B1883: 喽啰 | C1883: common_3018 | D1883: 0 | E1883: 0 | F1883: 1511,100;1512,100;1513,100;1514,100; | G1883: 5210,100;5126,100;5131,100; | H1883: 130+26*LV*0.6 | I1883: 45+10.5*LV*0.6 | J1883: 32+9*LV*0.6 | K1883: 24+5*LV*0.6 | L1883: 13+3*LV*0.6 | M1883: 100000 | N1883: 0 | O1883: math.max(0,(lv/10)-1) | P1883: math.max(0,(lv/10)-1) | Q1883: math.max(0,(lv/10)-1) | R1883: 0; | S1883: 有药王谷和盘丝洞的弟子在，真是不爽，还是跑路算了！ | T1883: 药王谷和盘丝洞的弟子不在眼前，真是轻松愉快啊！ | U1883: 0 | V1883: 0,0; | W1883: 5
A1884: 20555 | B1884: 喽啰 | C1884: hero_1001 | D1884: 0 | E1884: 0 | F1884: 1511,100;1512,100;1513,100;1514,100; | G1884: 5210,100;5126,100;5131,100; | H1884: 130+26*LV*0.6 | I1884: 45+10.5*LV*0.6 | J1884: 32+9*LV*0.6 | K1884: 24+5*LV*0.6 | L1884: 13+3*LV*0.6 | M1884: 100000 | N1884: 0 | O1884: math.max(0,(lv/10)-1) | P1884: math.max(0,(lv/10)-1) | Q1884: math.max(0,(lv/10)-1) | R1884: 0; | S1884: 有药王谷和盘丝洞的弟子在，真是不爽，还是跑路算了！ | T1884: 药王谷和盘丝洞的弟子不在眼前，真是轻松愉快啊！ | U1884: 0 | V1884: 0,0; | W1884: 5
A1885: 20556 | B1885: 喽啰 | C1885: hero_2001 | D1885: 0 | E1885: 0 | F1885: 1511,100;1512,100;1513,100;1514,100; | G1885: 5210,100;5126,100;5131,100; | H1885: 130+26*LV*0.6 | I1885: 45+10.5*LV*0.6 | J1885: 32+9*LV*0.6 | K1885: 24+5*LV*0.6 | L1885: 13+3*LV*0.6 | M1885: 100000 | N1885: 0 | O1885: math.max(0,(lv/10)-1) | P1885: math.max(0,(lv/10)-1) | Q1885: math.max(0,(lv/10)-1) | R1885: 0; | S1885: 有药王谷和盘丝洞的弟子在，真是不爽，还是跑路算了！ | T1885: 药王谷和盘丝洞的弟子不在眼前，真是轻松愉快啊！ | U1885: 0 | V1885: 0,0; | W1885: 5
A1886: 20557 | B1886: 喽啰 | C1886: pet_23 | D1886: 0 | E1886: 0 | F1886: 1511,100;1512,100;1513,100;1514,100; | G1886: 5210,100;5126,100;5131,100; | H1886: 130+26*LV*0.6 | I1886: 45+10.5*LV*0.6 | J1886: 32+9*LV*0.6 | K1886: 24+5*LV*0.6 | L1886: 13+3*LV*0.6 | M1886: 100000 | N1886: 0 | O1886: math.max(0,(lv/10)-1) | P1886: math.max(0,(lv/10)-1) | Q1886: math.max(0,(lv/10)-1) | R1886: 0; | S1886: 有药王谷和盘丝洞的弟子在，真是不爽，还是跑路算了！ | T1886: 药王谷和盘丝洞的弟子不在眼前，真是轻松愉快啊！ | U1886: 0 | V1886: 0,0; | W1886: 5
A1887: 20558 | B1887: 喽啰 | C1887: pet_13 | D1887: 0 | E1887: 0 | F1887: 1511,100;1512,100;1513,100;1514,100; | G1887: 5210,100;5126,100;5131,100; | H1887: 130+26*LV*0.6 | I1887: 45+10.5*LV*0.6 | J1887: 32+9*LV*0.6 | K1887: 24+5*LV*0.6 | L1887: 13+3*LV*0.6 | M1887: 100000 | N1887: 0 | O1887: math.max(0,(lv/10)-1) | P1887: math.max(0,(lv/10)-1) | Q1887: math.max(0,(lv/10)-1) | R1887: 0; | S1887: 有药王谷和盘丝洞的弟子在，真是不爽，还是跑路算了！ | T1887: 药王谷和盘丝洞的弟子不在眼前，真是轻松愉快啊！ | U1887: 0 | V1887: 0,0; | W1887: 5
A1888: 20559 | B1888: 喽啰 | C1888: pet_23 | D1888: 0 | E1888: 0 | F1888: 1511,100;1512,100;1513,100;1514,100; | G1888: 5210,100;5126,100;5131,100; | H1888: 130+26*LV*0.6 | I1888: 45+10.5*LV*0.6 | J1888: 32+9*LV*0.6 | K1888: 24+5*LV*0.6 | L1888: 13+3*LV*0.6 | M1888: 100000 | N1888: 0 | O1888: math.max(0,(lv/10)-1) | P1888: math.max(0,(lv/10)-1) | Q1888: math.max(0,(lv/10)-1) | R1888: 0; | S1888: 有药王谷和盘丝洞的弟子在，真是不爽，还是跑路算了！ | T1888: 药王谷和盘丝洞的弟子不在眼前，真是轻松愉快啊！ | U1888: 0 | V1888: 0,0; | W1888: 5
A1889: 20560 | B1889: 喽啰 | C1889: pet_22 | D1889: 0 | E1889: 0 | F1889: 1511,100;1512,100;1513,100;1514,100; | G1889: 5210,100;5126,100;5131,100; | H1889: 130+26*LV*0.6 | I1889: 45+10.5*LV*0.6 | J1889: 32+9*LV*0.6 | K1889: 24+5*LV*0.6 | L1889: 13+3*LV*0.6 | M1889: 100000 | N1889: 0 | O1889: math.max(0,(lv/10)-1) | P1889: math.max(0,(lv/10)-1) | Q1889: math.max(0,(lv/10)-1) | R1889: 0; | S1889: 有药王谷和盘丝洞的弟子在，真是不爽，还是跑路算了！ | T1889: 药王谷和盘丝洞的弟子不在眼前，真是轻松愉快啊！ | U1889: 0 | V1889: 0,0; | W1889: 5
A1890: 20561 | B1890: 喽啰 | C1890: hero_1001 | D1890: 0 | E1890: 0 | F1890: 1511,100;1512,100;1513,100;1514,100; | G1890: 5210,100;5126,100;5131,100; | H1890: 130+26*LV*0.6 | I1890: 45+10.5*LV*0.6 | J1890: 32+9*LV*0.6 | K1890: 24+5*LV*0.6 | L1890: 13+3*LV*0.6 | M1890: 100000 | N1890: 0 | O1890: math.max(0,(lv/10)-1) | P1890: math.max(0,(lv/10)-1) | Q1890: math.max(0,(lv/10)-1) | R1890: 0; | S1890: 有药王谷和盘丝洞的弟子在，真是不爽，还是跑路算了！ | T1890: 药王谷和盘丝洞的弟子不在眼前，真是轻松愉快啊！ | U1890: 0 | V1890: 0,0; | W1890: 5
A1891: 20562 | B1891: 喽啰 | C1891: pet_22 | D1891: 0 | E1891: 0 | F1891: 1511,100;1512,100;1513,100;1514,100; | G1891: 5210,100;5126,100;5131,100; | H1891: 130+26*LV*0.6 | I1891: 45+10.5*LV*0.6 | J1891: 32+9*LV*0.6 | K1891: 24+5*LV*0.6 | L1891: 13+3*LV*0.6 | M1891: 100000 | N1891: 0 | O1891: math.max(0,(lv/10)-1) | P1891: math.max(0,(lv/10)-1) | Q1891: math.max(0,(lv/10)-1) | R1891: 0; | S1891: 有药王谷和盘丝洞的弟子在，真是不爽，还是跑路算了！ | T1891: 药王谷和盘丝洞的弟子不在眼前，真是轻松愉快啊！ | U1891: 0 | V1891: 0,0; | W1891: 5
A1892: 20563 | B1892: 喽啰 | C1892: pet_23 | D1892: 0 | E1892: 0 | F1892: 1511,100;1512,100;1513,100;1514,100; | G1892: 5210,100;5126,100;5131,100; | H1892: 130+26*LV*0.6 | I1892: 45+10.5*LV*0.6 | J1892: 32+9*LV*0.6 | K1892: 24+5*LV*0.6 | L1892: 13+3*LV*0.6 | M1892: 100000 | N1892: 0 | O1892: math.max(0,(lv/10)-1) | P1892: math.max(0,(lv/10)-1) | Q1892: math.max(0,(lv/10)-1) | R1892: 0; | S1892: 有药王谷和盘丝洞的弟子在，真是不爽，还是跑路算了！ | T1892: 药王谷和盘丝洞的弟子不在眼前，真是轻松愉快啊！ | U1892: 0 | V1892: 0,0; | W1892: 5
A1893: 20564 | B1893: 喽啰 | C1893: hero_1001 | D1893: 0 | E1893: 0 | F1893: 1511,100;1512,100;1513,100;1514,100; | G1893: 5210,100;5126,100;5131,100; | H1893: 130+26*LV*0.6 | I1893: 45+10.5*LV*0.6 | J1893: 32+9*LV*0.6 | K1893: 24+5*LV*0.6 | L1893: 13+3*LV*0.6 | M1893: 100000 | N1893: 0 | O1893: math.max(0,(lv/10)-1) | P1893: math.max(0,(lv/10)-1) | Q1893: math.max(0,(lv/10)-1) | R1893: 0; | S1893: 有药王谷和盘丝洞的弟子在，真是不爽，还是跑路算了！ | T1893: 药王谷和盘丝洞的弟子不在眼前，真是轻松愉快啊！ | U1893: 0 | V1893: 0,0; | W1893: 5
A1894: 20565 | B1894: 喽啰 | C1894: hero_1001 | D1894: 0 | E1894: 0 | F1894: 1511,100;1512,100;1513,100;1514,100; | G1894: 5210,100;5126,100;5131,100; | H1894: 130+26*LV*0.6 | I1894: 45+10.5*LV*0.6 | J1894: 32+9*LV*0.6 | K1894: 24+5*LV*0.6 | L1894: 13+3*LV*0.6 | M1894: 100000 | N1894: 0 | O1894: math.max(0,(lv/10)-1) | P1894: math.max(0,(lv/10)-1) | Q1894: math.max(0,(lv/10)-1) | R1894: 0; | S1894: 有药王谷和盘丝洞的弟子在，真是不爽，还是跑路算了！ | T1894: 药王谷和盘丝洞的弟子不在眼前，真是轻松愉快啊！ | U1894: 0 | V1894: 0,0; | W1894: 5
A1895: 20566 | B1895: 喽啰 | C1895: pet_43 | D1895: 0 | E1895: 0 | F1895: 1511,100;1512,100;1513,100;1514,100; | G1895: 5210,100;5126,100;5131,100; | H1895: 130+26*LV*0.6 | I1895: 45+10.5*LV*0.6 | J1895: 32+9*LV*0.6 | K1895: 24+5*LV*0.6 | L1895: 13+3*LV*0.6 | M1895: 100000 | N1895: 0 | O1895: math.max(0,(lv/10)-1) | P1895: math.max(0,(lv/10)-1) | Q1895: math.max(0,(lv/10)-1) | R1895: 0; | S1895: 有药王谷和盘丝洞的弟子在，真是不爽，还是跑路算了！ | T1895: 药王谷和盘丝洞的弟子不在眼前，真是轻松愉快啊！ | U1895: 0 | V1895: 0,0; | W1895: 5
A1896: 20567 | B1896: 喽啰 | C1896: pet_53 | D1896: 0 | E1896: 0 | F1896: 1511,100;1512,100;1513,100;1514,100; | G1896: 5210,100;5126,100;5131,100; | H1896: 130+26*LV*0.6 | I1896: 45+10.5*LV*0.6 | J1896: 32+9*LV*0.6 | K1896: 24+5*LV*0.6 | L1896: 13+3*LV*0.6 | M1896: 100000 | N1896: 0 | O1896: math.max(0,(lv/10)-1) | P1896: math.max(0,(lv/10)-1) | Q1896: math.max(0,(lv/10)-1) | R1896: 0; | S1896: 有药王谷和盘丝洞的弟子在，真是不爽，还是跑路算了！ | T1896: 药王谷和盘丝洞的弟子不在眼前，真是轻松愉快啊！ | U1896: 0 | V1896: 0,0; | W1896: 5
A1897: 20568 | B1897: 喽啰 | C1897: pet_61 | D1897: 0 | E1897: 0 | F1897: 1511,100;1512,100;1513,100;1514,100; | G1897: 5210,100;5126,100;5131,100; | H1897: 130+26*LV*0.6 | I1897: 45+10.5*LV*0.6 | J1897: 32+9*LV*0.6 | K1897: 24+5*LV*0.6 | L1897: 13+3*LV*0.6 | M1897: 100000 | N1897: 0 | O1897: math.max(0,(lv/10)-1) | P1897: math.max(0,(lv/10)-1) | Q1897: math.max(0,(lv/10)-1) | R1897: 0; | S1897: 有药王谷和盘丝洞的弟子在，真是不爽，还是跑路算了！ | T1897: 药王谷和盘丝洞的弟子不在眼前，真是轻松愉快啊！ | U1897: 0 | V1897: 0,0; | W1897: 5
A1898: 20569 | B1898: 喽啰 | C1898: pet_3 | D1898: 0 | E1898: 0 | F1898: 1511,100;1512,100;1513,100;1514,100; | G1898: 5210,100;5126,100;5131,100; | H1898: 130+26*LV*0.6 | I1898: 45+10.5*LV*0.6 | J1898: 32+9*LV*0.6 | K1898: 24+5*LV*0.6 | L1898: 13+3*LV*0.6 | M1898: 100000 | N1898: 0 | O1898: math.max(0,(lv/10)-1) | P1898: math.max(0,(lv/10)-1) | Q1898: math.max(0,(lv/10)-1) | R1898: 0; | S1898: 有药王谷和盘丝洞的弟子在，真是不爽，还是跑路算了！ | T1898: 药王谷和盘丝洞的弟子不在眼前，真是轻松愉快啊！ | U1898: 0 | V1898: 0,0; | W1898: 5
A1899: 20570 | B1899: 喽啰 | C1899: pet_21 | D1899: 0 | E1899: 0 | F1899: 1511,100;1512,100;1513,100;1514,100; | G1899: 5210,100;5126,100;5131,100; | H1899: 130+26*LV*0.6 | I1899: 45+10.5*LV*0.6 | J1899: 32+9*LV*0.6 | K1899: 24+5*LV*0.6 | L1899: 13+3*LV*0.6 | M1899: 100000 | N1899: 0 | O1899: math.max(0,(lv/10)-1) | P1899: math.max(0,(lv/10)-1) | Q1899: math.max(0,(lv/10)-1) | R1899: 0; | S1899: 有药王谷和盘丝洞的弟子在，真是不爽，还是跑路算了！ | T1899: 药王谷和盘丝洞的弟子不在眼前，真是轻松愉快啊！ | U1899: 0 | V1899: 0,0; | W1899: 5
A1900: 20571 | B1900: 喽啰 | C1900: pet_23 | D1900: 0 | E1900: 0 | F1900: 1511,100;1512,100;1513,100;1514,100; | G1900: 5210,100;5126,100;5131,100; | H1900: 130+26*LV*0.6 | I1900: 45+10.5*LV*0.6 | J1900: 32+9*LV*0.6 | K1900: 24+5*LV*0.6 | L1900: 13+3*LV*0.6 | M1900: 100000 | N1900: 0 | O1900: math.max(0,(lv/10)-1) | P1900: math.max(0,(lv/10)-1) | Q1900: math.max(0,(lv/10)-1) | R1900: 0; | S1900: 有药王谷和盘丝洞的弟子在，真是不爽，还是跑路算了！ | T1900: 药王谷和盘丝洞的弟子不在眼前，真是轻松愉快啊！ | U1900: 0 | V1900: 0,0; | W1900: 5
A1901: 20572 | B1901: 喽啰 | C1901: common_3018 | D1901: 0 | E1901: 0 | F1901: 1511,100;1512,100;1513,100;1514,100; | G1901: 5210,100;5126,100;5131,100; | H1901: 130+26*LV*0.6 | I1901: 45+10.5*LV*0.6 | J1901: 32+9*LV*0.6 | K1901: 24+5*LV*0.6 | L1901: 13+3*LV*0.6 | M1901: 100000 | N1901: 0 | O1901: math.max(0,(lv/10)-1) | P1901: math.max(0,(lv/10)-1) | Q1901: math.max(0,(lv/10)-1) | R1901: 0; | S1901: 有药王谷和盘丝洞的弟子在，真是不爽，还是跑路算了！ | T1901: 药王谷和盘丝洞的弟子不在眼前，真是轻松愉快啊！ | U1901: 0 | V1901: 0,0; | W1901: 5
A1902: 20573 | B1902: 喽啰 | C1902: hero_1001 | D1902: 0 | E1902: 0 | F1902: 1511,100;1512,100;1513,100;1514,100; | G1902: 5210,100;5126,100;5131,100; | H1902: 130+26*LV*0.6 | I1902: 45+10.5*LV*0.6 | J1902: 32+9*LV*0.6 | K1902: 24+5*LV*0.6 | L1902: 13+3*LV*0.6 | M1902: 100000 | N1902: 0 | O1902: math.max(0,(lv/10)-1) | P1902: math.max(0,(lv/10)-1) | Q1902: math.max(0,(lv/10)-1) | R1902: 0; | S1902: 有药王谷和盘丝洞的弟子在，真是不爽，还是跑路算了！ | T1902: 药王谷和盘丝洞的弟子不在眼前，真是轻松愉快啊！ | U1902: 0 | V1902: 0,0; | W1902: 5
A1903: 20574 | B1903: 喽啰 | C1903: partner_1002 | D1903: 0 | E1903: 0 | F1903: 1511,100;1512,100;1513,100;1514,100; | G1903: 5210,100;5126,100;5131,100; | H1903: 130+26*LV*0.6 | I1903: 45+10.5*LV*0.6 | J1903: 32+9*LV*0.6 | K1903: 24+5*LV*0.6 | L1903: 13+3*LV*0.6 | M1903: 100000 | N1903: 0 | O1903: math.max(0,(lv/10)-1) | P1903: math.max(0,(lv/10)-1) | Q1903: math.max(0,(lv/10)-1) | R1903: 0; | S1903: 有药王谷和盘丝洞的弟子在，真是不爽，还是跑路算了！ | T1903: 药王谷和盘丝洞的弟子不在眼前，真是轻松愉快啊！ | U1903: 0 | V1903: 0,0; | W1903: 5
A1904: 20575 | B1904: 喽啰 | C1904: common_3006 | D1904: 0 | E1904: 0 | F1904: 1511,100;1512,100;1513,100;1514,100; | G1904: 5210,100;5126,100;5131,100; | H1904: 130+26*LV*0.6 | I1904: 45+10.5*LV*0.6 | J1904: 32+9*LV*0.6 | K1904: 24+5*LV*0.6 | L1904: 13+3*LV*0.6 | M1904: 100000 | N1904: 0 | O1904: math.max(0,(lv/10)-1) | P1904: math.max(0,(lv/10)-1) | Q1904: math.max(0,(lv/10)-1) | R1904: 0; | S1904: 有药王谷和盘丝洞的弟子在，真是不爽，还是跑路算了！ | T1904: 药王谷和盘丝洞的弟子不在眼前，真是轻松愉快啊！ | U1904: 0 | V1904: 0,0; | W1904: 5
A1905: 20576 | B1905: 喽啰 | C1905: partner_1009 | D1905: 0 | E1905: 0 | F1905: 1511,100;1512,100;1513,100;1514,100; | G1905: 5210,100;5126,100;5131,100; | H1905: 130+26*LV*0.6 | I1905: 45+10.5*LV*0.6 | J1905: 32+9*LV*0.6 | K1905: 24+5*LV*0.6 | L1905: 13+3*LV*0.6 | M1905: 100000 | N1905: 0 | O1905: math.max(0,(lv/10)-1) | P1905: math.max(0,(lv/10)-1) | Q1905: math.max(0,(lv/10)-1) | R1905: 0; | S1905: 有药王谷和盘丝洞的弟子在，真是不爽，还是跑路算了！ | T1905: 药王谷和盘丝洞的弟子不在眼前，真是轻松愉快啊！ | U1905: 0 | V1905: 0,0; | W1905: 5
A1906: 20577 | B1906: 喽啰 | C1906: pet_21 | D1906: 0 | E1906: 0 | F1906: 1511,100;1512,100;1513,100;1514,100; | G1906: 5210,100;5126,100;5131,100; | H1906: 130+26*LV*0.6 | I1906: 45+10.5*LV*0.6 | J1906: 32+9*LV*0.6 | K1906: 24+5*LV*0.6 | L1906: 13+3*LV*0.6 | M1906: 100000 | N1906: 0 | O1906: math.max(0,(lv/10)-1) | P1906: math.max(0,(lv/10)-1) | Q1906: math.max(0,(lv/10)-1) | R1906: 0; | S1906: 有药王谷和盘丝洞的弟子在，真是不爽，还是跑路算了！ | T1906: 药王谷和盘丝洞的弟子不在眼前，真是轻松愉快啊！ | U1906: 0 | V1906: 0,0; | W1906: 5
A1907: 20578 | B1907: 喽啰 | C1907: pet_3 | D1907: 0 | E1907: 0 | F1907: 1511,100;1512,100;1513,100;1514,100; | G1907: 5210,100;5126,100;5131,100; | H1907: 130+26*LV*0.6 | I1907: 45+10.5*LV*0.6 | J1907: 32+9*LV*0.6 | K1907: 24+5*LV*0.6 | L1907: 13+3*LV*0.6 | M1907: 100000 | N1907: 0 | O1907: math.max(0,(lv/10)-1) | P1907: math.max(0,(lv/10)-1) | Q1907: math.max(0,(lv/10)-1) | R1907: 0; | S1907: 有药王谷和盘丝洞的弟子在，真是不爽，还是跑路算了！ | T1907: 药王谷和盘丝洞的弟子不在眼前，真是轻松愉快啊！ | U1907: 0 | V1907: 0,0; | W1907: 5
A1908: 20579 | B1908: 喽啰 | C1908: partner_1009 | D1908: 0 | E1908: 0 | F1908: 1511,100;1512,100;1513,100;1514,100; | G1908: 5210,100;5126,100;5131,100; | H1908: 130+26*LV*0.6 | I1908: 45+10.5*LV*0.6 | J1908: 32+9*LV*0.6 | K1908: 24+5*LV*0.6 | L1908: 13+3*LV*0.6 | M1908: 100000 | N1908: 0 | O1908: math.max(0,(lv/10)-1) | P1908: math.max(0,(lv/10)-1) | Q1908: math.max(0,(lv/10)-1) | R1908: 0; | S1908: 有药王谷和盘丝洞的弟子在，真是不爽，还是跑路算了！ | T1908: 药王谷和盘丝洞的弟子不在眼前，真是轻松愉快啊！ | U1908: 0 | V1908: 0,0; | W1908: 5
A1909: 20580 | B1909: 喽啰 | C1909: hero_1001 | D1909: 0 | E1909: 0 | F1909: 1511,100;1512,100;1513,100;1514,100; | G1909: 5210,100;5126,100;5131,100; | H1909: 130+26*LV*0.6 | I1909: 45+10.5*LV*0.6 | J1909: 32+9*LV*0.6 | K1909: 24+5*LV*0.6 | L1909: 13+3*LV*0.6 | M1909: 100000 | N1909: 0 | O1909: math.max(0,(lv/10)-1) | P1909: math.max(0,(lv/10)-1) | Q1909: math.max(0,(lv/10)-1) | R1909: 0; | S1909: 有药王谷和盘丝洞的弟子在，真是不爽，还是跑路算了！ | T1909: 药王谷和盘丝洞的弟子不在眼前，真是轻松愉快啊！ | U1909: 0 | V1909: 0,0; | W1909: 5
A1910: 20581 | B1910: 喽啰 | C1910: pet_33 | D1910: 0 | E1910: 0 | F1910: 1511,100;1512,100;1513,100;1514,100; | G1910: 5210,100;5126,100;5131,100; | H1910: 130+26*LV*0.6 | I1910: 45+10.5*LV*0.6 | J1910: 32+9*LV*0.6 | K1910: 24+5*LV*0.6 | L1910: 13+3*LV*0.6 | M1910: 100000 | N1910: 0 | O1910: math.max(0,(lv/5)-1) | P1910: math.max(0,(lv/5)-1) | Q1910: math.max(0,(lv/5)-1) | R1910: 0; | S1910: 有药王谷和盘丝洞的弟子在，真是不爽，还是跑路算了！ | T1910: 药王谷和盘丝洞的弟子不在眼前，真是轻松愉快啊！ | U1910: 0 | V1910: 0,0; | W1910: 5
A1911: 20582 | B1911: 喽啰 | C1911: pet_83 | D1911: 0 | E1911: 0 | F1911: 1511,100;1512,100;1513,100;1514,100; | G1911: 5210,100;5126,100;5131,100; | H1911: 130+26*LV*0.6 | I1911: 45+10.5*LV*0.6 | J1911: 32+9*LV*0.6 | K1911: 24+5*LV*0.6 | L1911: 13+3*LV*0.6 | M1911: 100000 | N1911: 0 | O1911: math.max(0,(lv/5)-1) | P1911: math.max(0,(lv/5)-1) | Q1911: math.max(0,(lv/5)-1) | R1911: 0; | S1911: 有药王谷和盘丝洞的弟子在，真是不爽，还是跑路算了！ | T1911: 药王谷和盘丝洞的弟子不在眼前，真是轻松愉快啊！ | U1911: 0 | V1911: 0,0; | W1911: 5
A1912: 20583 | B1912: 喽啰 | C1912: partner_1002 | D1912: 0 | E1912: 0 | F1912: 1511,100;1512,100;1513,100;1514,100; | G1912: 5210,100;5126,100;5131,100; | H1912: 130+26*LV*0.6 | I1912: 45+10.5*LV*0.6 | J1912: 32+9*LV*0.6 | K1912: 24+5*LV*0.6 | L1912: 13+3*LV*0.6 | M1912: 100000 | N1912: 0 | O1912: math.max(0,(lv/5)-1) | P1912: math.max(0,(lv/5)-1) | Q1912: math.max(0,(lv/5)-1) | R1912: 0; | S1912: 有药王谷和盘丝洞的弟子在，真是不爽，还是跑路算了！ | T1912: 药王谷和盘丝洞的弟子不在眼前，真是轻松愉快啊！ | U1912: 0 | V1912: 0,0; | W1912: 5
A1913: 20584 | B1913: 喽啰 | C1913: pet_62 | D1913: 0 | E1913: 0 | F1913: 1511,100;1512,100;1513,100;1514,100; | G1913: 5210,100;5126,100;5131,100; | H1913: 130+26*LV*0.6 | I1913: 45+10.5*LV*0.6 | J1913: 32+9*LV*0.6 | K1913: 24+5*LV*0.6 | L1913: 13+3*LV*0.6 | M1913: 100000 | N1913: 0 | O1913: math.max(0,(lv/5)-1) | P1913: math.max(0,(lv/5)-1) | Q1913: math.max(0,(lv/5)-1) | R1913: 0; | S1913: 有药王谷和盘丝洞的弟子在，真是不爽，还是跑路算了！ | T1913: 药王谷和盘丝洞的弟子不在眼前，真是轻松愉快啊！ | U1913: 0 | V1913: 0,0; | W1913: 5
A1914: 20585 | B1914: 喽啰 | C1914: pet_83 | D1914: 0 | E1914: 0 | F1914: 1511,100;1512,100;1513,100;1514,100; | G1914: 5210,100;5126,100;5131,100; | H1914: 130+26*LV*0.6 | I1914: 45+10.5*LV*0.6 | J1914: 32+9*LV*0.6 | K1914: 24+5*LV*0.6 | L1914: 13+3*LV*0.6 | M1914: 100000 | N1914: 0 | O1914: math.max(0,(lv/5)-1) | P1914: math.max(0,(lv/5)-1) | Q1914: math.max(0,(lv/5)-1) | R1914: 0; | S1914: 有药王谷和盘丝洞的弟子在，真是不爽，还是跑路算了！ | T1914: 药王谷和盘丝洞的弟子不在眼前，真是轻松愉快啊！ | U1914: 0 | V1914: 0,0; | W1914: 5
A1915: 20586 | B1915: 喽啰 | C1915: pet_23 | D1915: 0 | E1915: 0 | F1915: 1511,100;1512,100;1513,100;1514,100; | G1915: 5210,100;5126,100;5131,100; | H1915: 130+26*LV*0.6 | I1915: 45+10.5*LV*0.6 | J1915: 32+9*LV*0.6 | K1915: 24+5*LV*0.6 | L1915: 13+3*LV*0.6 | M1915: 100000 | N1915: 0 | O1915: math.max(0,(lv/5)-1) | P1915: math.max(0,(lv/5)-1) | Q1915: math.max(0,(lv/5)-1) | R1915: 0; | S1915: 有药王谷和盘丝洞的弟子在，真是不爽，还是跑路算了！ | T1915: 药王谷和盘丝洞的弟子不在眼前，真是轻松愉快啊！ | U1915: 0 | V1915: 0,0; | W1915: 5
A1916: 20587 | B1916: 喽啰 | C1916: hero_1001 | D1916: 0 | E1916: 0 | F1916: 1511,100;1512,100;1513,100;1514,100; | G1916: 5210,100;5126,100;5131,100; | H1916: 130+26*LV*0.6 | I1916: 45+10.5*LV*0.6 | J1916: 32+9*LV*0.6 | K1916: 24+5*LV*0.6 | L1916: 13+3*LV*0.6 | M1916: 100000 | N1916: 0 | O1916: math.max(0,(lv/5)-1) | P1916: math.max(0,(lv/5)-1) | Q1916: math.max(0,(lv/5)-1) | R1916: 0; | S1916: 有药王谷和盘丝洞的弟子在，真是不爽，还是跑路算了！ | T1916: 药王谷和盘丝洞的弟子不在眼前，真是轻松愉快啊！ | U1916: 0 | V1916: 0,0; | W1916: 5
A1917: 20588 | B1917: 喽啰 | C1917: partner_1001 | D1917: 0 | E1917: 0 | F1917: 1511,100;1512,100;1513,100;1514,100; | G1917: 5210,100;5126,100;5131,100; | H1917: 130+26*LV*0.6 | I1917: 45+10.5*LV*0.6 | J1917: 32+9*LV*0.6 | K1917: 24+5*LV*0.6 | L1917: 13+3*LV*0.6 | M1917: 100000 | N1917: 0 | O1917: math.max(0,(lv/5)-1) | P1917: math.max(0,(lv/5)-1) | Q1917: math.max(0,(lv/5)-1) | R1917: 0; | S1917: 有药王谷和盘丝洞的弟子在，真是不爽，还是跑路算了！ | T1917: 药王谷和盘丝洞的弟子不在眼前，真是轻松愉快啊！ | U1917: 0 | V1917: 0,0; | W1917: 5
A1918: 20589 | B1918: 喽啰 | C1918: partner_1009 | D1918: 0 | E1918: 0 | F1918: 1511,100;1512,100;1513,100;1514,100; | G1918: 5210,100;5126,100;5131,100; | H1918: 130+26*LV*0.6 | I1918: 45+10.5*LV*0.6 | J1918: 32+9*LV*0.6 | K1918: 24+5*LV*0.6 | L1918: 13+3*LV*0.6 | M1918: 100000 | N1918: 0 | O1918: math.max(0,(lv/5)-1) | P1918: math.max(0,(lv/5)-1) | Q1918: math.max(0,(lv/5)-1) | R1918: 0; | S1918: 有药王谷和盘丝洞的弟子在，真是不爽，还是跑路算了！ | T1918: 药王谷和盘丝洞的弟子不在眼前，真是轻松愉快啊！ | U1918: 0 | V1918: 0,0; | W1918: 5
A1919: 20590 | B1919: 喽啰 | C1919: partner_1004 | D1919: 0 | E1919: 0 | F1919: 1511,100;1512,100;1513,100;1514,100; | G1919: 5210,100;5126,100;5131,100; | H1919: 130+26*LV*0.6 | I1919: 45+10.5*LV*0.6 | J1919: 32+9*LV*0.6 | K1919: 24+5*LV*0.6 | L1919: 13+3*LV*0.6 | M1919: 100000 | N1919: 0 | O1919: math.max(0,(lv/5)-1) | P1919: math.max(0,(lv/5)-1) | Q1919: math.max(0,(lv/5)-1) | R1919: 0; | S1919: 有药王谷和盘丝洞的弟子在，真是不爽，还是跑路算了！ | T1919: 药王谷和盘丝洞的弟子不在眼前，真是轻松愉快啊！ | U1919: 0 | V1919: 0,0; | W1919: 5
A1920: 20591 | B1920: 喽啰 | C1920: pet_21 | D1920: 0 | E1920: 0 | F1920: 1511,100;1512,100;1513,100;1514,100; | G1920: 5210,100;5126,100;5131,100; | H1920: 130+26*LV*0.6 | I1920: 45+10.5*LV*0.6 | J1920: 32+9*LV*0.6 | K1920: 24+5*LV*0.6 | L1920: 13+3*LV*0.6 | M1920: 100000 | N1920: 0 | O1920: math.max(0,(lv/5)-1) | P1920: math.max(0,(lv/5)-1) | Q1920: math.max(0,(lv/5)-1) | R1920: 0; | S1920: 有药王谷和盘丝洞的弟子在，真是不爽，还是跑路算了！ | T1920: 药王谷和盘丝洞的弟子不在眼前，真是轻松愉快啊！ | U1920: 0 | V1920: 0,0; | W1920: 5
A1921: 20592 | B1921: 喽啰 | C1921: pet_72 | D1921: 0 | E1921: 0 | F1921: 1511,100;1512,100;1513,100;1514,100; | G1921: 5210,100;5126,100;5131,100; | H1921: 130+26*LV*0.6 | I1921: 45+10.5*LV*0.6 | J1921: 32+9*LV*0.6 | K1921: 24+5*LV*0.6 | L1921: 13+3*LV*0.6 | M1921: 100000 | N1921: 0 | O1921: math.max(0,(lv/5)-1) | P1921: math.max(0,(lv/5)-1) | Q1921: math.max(0,(lv/5)-1) | R1921: 0; | S1921: 有药王谷和盘丝洞的弟子在，真是不爽，还是跑路算了！ | T1921: 药王谷和盘丝洞的弟子不在眼前，真是轻松愉快啊！ | U1921: 0 | V1921: 0,0; | W1921: 5
A1922: 20593 | B1922: 喽啰 | C1922: pet_42 | D1922: 0 | E1922: 0 | F1922: 1511,100;1512,100;1513,100;1514,100; | G1922: 5210,100;5126,100;5131,100; | H1922: 130+26*LV*0.6 | I1922: 45+10.5*LV*0.6 | J1922: 32+9*LV*0.6 | K1922: 24+5*LV*0.6 | L1922: 13+3*LV*0.6 | M1922: 100000 | N1922: 0 | O1922: math.max(0,(lv/5)-1) | P1922: math.max(0,(lv/5)-1) | Q1922: math.max(0,(lv/5)-1) | R1922: 0; | S1922: 有药王谷和盘丝洞的弟子在，真是不爽，还是跑路算了！ | T1922: 药王谷和盘丝洞的弟子不在眼前，真是轻松愉快啊！ | U1922: 0 | V1922: 0,0; | W1922: 5
A1923: 20594 | B1923: 喽啰 | C1923: pet_42 | D1923: 0 | E1923: 0 | F1923: 1511,100;1512,100;1513,100;1514,100; | G1923: 5210,100;5126,100;5131,100; | H1923: 130+26*LV*0.6 | I1923: 45+10.5*LV*0.6 | J1923: 32+9*LV*0.6 | K1923: 24+5*LV*0.6 | L1923: 13+3*LV*0.6 | M1923: 100000 | N1923: 0 | O1923: math.max(0,(lv/5)-1) | P1923: math.max(0,(lv/5)-1) | Q1923: math.max(0,(lv/5)-1) | R1923: 0; | S1923: 有药王谷和盘丝洞的弟子在，真是不爽，还是跑路算了！ | T1923: 药王谷和盘丝洞的弟子不在眼前，真是轻松愉快啊！ | U1923: 0 | V1923: 0,0; | W1923: 5
A1924: 20595 | B1924: 喽啰 | C1924: pet_72 | D1924: 0 | E1924: 0 | F1924: 1511,100;1512,100;1513,100;1514,100; | G1924: 5210,100;5126,100;5131,100; | H1924: 130+26*LV*0.6 | I1924: 45+10.5*LV*0.6 | J1924: 32+9*LV*0.6 | K1924: 24+5*LV*0.6 | L1924: 13+3*LV*0.6 | M1924: 100000 | N1924: 0 | O1924: math.max(0,(lv/5)-1) | P1924: math.max(0,(lv/5)-1) | Q1924: math.max(0,(lv/5)-1) | R1924: 0; | S1924: 有药王谷和盘丝洞的弟子在，真是不爽，还是跑路算了！ | T1924: 药王谷和盘丝洞的弟子不在眼前，真是轻松愉快啊！ | U1924: 0 | V1924: 0,0; | W1924: 5
A1925: 20596 | B1925: 喽啰 | C1925: hero_1001 | D1925: 0 | E1925: 0 | F1925: 1511,100;1512,100;1513,100;1514,100; | G1925: 5210,100;5126,100;5131,100; | H1925: 130+26*LV*0.6 | I1925: 45+10.5*LV*0.6 | J1925: 32+9*LV*0.6 | K1925: 24+5*LV*0.6 | L1925: 13+3*LV*0.6 | M1925: 100000 | N1925: 0 | O1925: math.max(0,(lv/5)-1) | P1925: math.max(0,(lv/5)-1) | Q1925: math.max(0,(lv/5)-1) | R1925: 0; | S1925: 有药王谷和盘丝洞的弟子在，真是不爽，还是跑路算了！ | T1925: 药王谷和盘丝洞的弟子不在眼前，真是轻松愉快啊！ | U1925: 0 | V1925: 0,0; | W1925: 5
A1926: 20597 | B1926: 喽啰 | C1926: partner_1002 | D1926: 0 | E1926: 0 | F1926: 1511,100;1512,100;1513,100;1514,100; | G1926: 5210,100;5126,100;5131,100; | H1926: 130+26*LV*0.6 | I1926: 45+10.5*LV*0.6 | J1926: 32+9*LV*0.6 | K1926: 24+5*LV*0.6 | L1926: 13+3*LV*0.6 | M1926: 100000 | N1926: 0 | O1926: math.max(0,(lv/5)-1) | P1926: math.max(0,(lv/5)-1) | Q1926: math.max(0,(lv/5)-1) | R1926: 0; | S1926: 有药王谷和盘丝洞的弟子在，真是不爽，还是跑路算了！ | T1926: 药王谷和盘丝洞的弟子不在眼前，真是轻松愉快啊！ | U1926: 0 | V1926: 0,0; | W1926: 5
A1927: 20598 | B1927: 喽啰 | C1927: partner_1009 | D1927: 0 | E1927: 0 | F1927: 1511,100;1512,100;1513,100;1514,100; | G1927: 5210,100;5126,100;5131,100; | H1927: 130+26*LV*0.6 | I1927: 45+10.5*LV*0.6 | J1927: 32+9*LV*0.6 | K1927: 24+5*LV*0.6 | L1927: 13+3*LV*0.6 | M1927: 100000 | N1927: 0 | O1927: math.max(0,(lv/5)-1) | P1927: math.max(0,(lv/5)-1) | Q1927: math.max(0,(lv/5)-1) | R1927: 0; | S1927: 有药王谷和盘丝洞的弟子在，真是不爽，还是跑路算了！ | T1927: 药王谷和盘丝洞的弟子不在眼前，真是轻松愉快啊！ | U1927: 0 | V1927: 0,0; | W1927: 5
A1928: 20599 | B1928: 喽啰 | C1928: pet_63 | D1928: 0 | E1928: 0 | F1928: 1511,100;1512,100;1513,100;1514,100; | G1928: 5210,100;5126,100;5131,100; | H1928: 130+26*LV*0.6 | I1928: 45+10.5*LV*0.6 | J1928: 32+9*LV*0.6 | K1928: 24+5*LV*0.6 | L1928: 13+3*LV*0.6 | M1928: 100000 | N1928: 0 | O1928: math.max(0,(lv/5)-1) | P1928: math.max(0,(lv/5)-1) | Q1928: math.max(0,(lv/5)-1) | R1928: 0; | S1928: 有药王谷和盘丝洞的弟子在，真是不爽，还是跑路算了！ | T1928: 药王谷和盘丝洞的弟子不在眼前，真是轻松愉快啊！ | U1928: 0 | V1928: 0,0; | W1928: 5
A1929: 20600 | B1929: 喽啰 | C1929: hero_1001 | D1929: 0 | E1929: 0 | F1929: 1511,100;1512,100;1513,100;1514,100; | G1929: 5210,100;5126,100;5131,100; | H1929: 130+26*LV*0.6 | I1929: 45+10.5*LV*0.6 | J1929: 32+9*LV*0.6 | K1929: 24+5*LV*0.6 | L1929: 13+3*LV*0.6 | M1929: 100000 | N1929: 0 | O1929: math.max(0,(lv/5)-1) | P1929: math.max(0,(lv/5)-1) | Q1929: math.max(0,(lv/5)-1) | R1929: 0; | S1929: 有药王谷和盘丝洞的弟子在，真是不爽，还是跑路算了！ | T1929: 药王谷和盘丝洞的弟子不在眼前，真是轻松愉快啊！ | U1929: 0 | V1929: 0,0; | W1929: 5

Sheet: Sheet1
B2: 3800 | C2: =RC[-1]&"*1.5" -> 3800*1.5 | F2: 3800 | G2: =RC[-1]&"*1.5" -> 3800*1.5 | K2: 100 | L2: 10 | M2: 10 | N2: 10 | O2: 3 | Q2: =RC[-6]&"*0.8" -> 100*0.8 | R2: =RC[-6]&"*0.5" -> 10*0.5 | S2: =RC[-6]&"*1" -> 10*1 | T2: =RC[-6]&"*1" -> 10*1 | U2: =RC[-6]&"*2" -> 3*2 | X2: 1272*0.5 | Y2: =RC[-1]&"-500" -> 1272*0.5-500 | AA2: 1272 | AB2: =RC[-1]&"-500" -> 1272-500
B3: 3815 | C3: =RC[-1]&"*1.5" -> 3815*1.5 | F3: 3815 | G3: =RC[-1]&"*1.5" -> 3815*1.5 | K3: 150 | L3: 30 | M3: 18 | N3: 16 | O3: 6 | Q3: =RC[-6]&"*0.8" -> 150*0.8 | R3: =RC[-6]&"*0.5" -> 30*0.5 | S3: =RC[-6]&"*1" -> 18*1 | T3: =RC[-6]&"*1" -> 16*1 | U3: =RC[-6]&"*2" -> 6*2 | X3: 1282 | Y3: =RC[-1]&"-500" -> 1282-500 | AA3: 1282 | AB3: =RC[-1]&"-500" -> 1282-500
B4: 3830 | C4: =RC[-1]&"*1.5" -> 3830*1.5 | F4: 3830 | G4: =RC[-1]&"*1.5" -> 3830*1.5 | K4: 200 | L4: 50 | M4: 26 | N4: 22 | O4: 9 | Q4: =RC[-6]&"*0.8" -> 200*0.8 | R4: =RC[-6]&"*0.5" -> 50*0.5 | S4: =RC[-6]&"*1" -> 26*1 | T4: =RC[-6]&"*1" -> 22*1 | U4: =RC[-6]&"*2" -> 9*2 | X4: 1294*0.5 | Y4: =RC[-1]&"-500" -> 1294*0.5-500 | AA4: 1294 | AB4: =RC[-1]&"-500" -> 1294-500
B5: 3842 | C5: =RC[-1]&"*1.5" -> 3842*1.5 | F5: 3830 | G5: =RC[-1]&"*1.5" -> 3830*1.5 | K5: 250 | L5: 70 | M5: 34 | N5: 28 | O5: 12 | Q5: =RC[-6]&"*0.8" -> 250*0.8 | R5: =RC[-6]&"*0.5" -> 70*0.5 | S5: =RC[-6]&"*1" -> 34*1 | T5: =RC[-6]&"*1" -> 28*1 | U5: =RC[-6]&"*2" -> 12*2 | X5: 1125 | Y5: =RC[-1]&"-500" -> 1125-500 | AA5: 1294 | AB5: =RC[-1]&"-500" -> 1294-500
B6: 3867*0.8 | C6: =RC[-1]&"*1.5" -> 3867*0.8*1.5 | F6: 3842*1.2 | G6: =RC[-1]&"*1.5" -> 3842*1.2*1.5 | K6: 300 | L6: 90 | M6: 42 | N6: 34 | O6: 15 | Q6: =RC[-6]&"*0.8" -> 300*0.8 | R6: =RC[-6]&"*0.5" -> 90*0.5 | S6: =RC[-6]&"*1" -> 42*1 | T6: =RC[-6]&"*1" -> 34*1 | U6: =RC[-6]&"*2" -> 15*2 | X6: 1133*0.5 | Y6: =RC[-1]&"-500" -> 1133*0.5-500 | AA6: 1125*0.5 | AB6: =RC[-1]&"-500" -> 1125*0.5-500
B7: 3961 | C7: =RC[-1]&"*1.5" -> 3961*1.5 | F7: 3842 | G7: =RC[-1]&"*1.5" -> 3842*1.5 | K7: 350 | L7: 110 | M7: 50 | N7: 40 | O7: 18 | Q7: =RC[-6]&"*0.8" -> 350*0.8 | R7: =RC[-6]&"*0.5" -> 110*0.5 | S7: =RC[-6]&"*1" -> 50*1 | T7: =RC[-6]&"*1" -> 40*1 | U7: =RC[-6]&"*2" -> 18*2 | X7: 1161*0.5 | Y7: =RC[-1]&"-500" -> 1161*0.5-500 | AA7: 1125 | AB7: =RC[-1]&"-500" -> 1125-500
B8: 3986 | C8: =RC[-1]&"*1.5" -> 3986*1.5 | F8: 3867*1.2 | G8: =RC[-1]&"*1.5" -> 3867*1.2*1.5 | K8: 400 | L8: 130 | M8: 58 | N8: 46 | O8: 21 | Q8: =RC[-6]&"*0.8" -> 400*0.8 | R8: =RC[-6]&"*0.5" -> 130*0.5 | S8: =RC[-6]&"*1" -> 58*1 | T8: =RC[-6]&"*1" -> 46*1 | U8: =RC[-6]&"*2" -> 21*2 | X8: 1170*0.5 | Y8: =RC[-1]&"-500" -> 1170*0.5-500 | AA8: 1133*0.5 | AB8: =RC[-1]&"-500" -> 1133*0.5-500
B9: 4003 | C9: =RC[-1]&"*1.5" -> 4003*1.5 | F9: 3867 | G9: =RC[-1]&"*1.5" -> 3867*1.5 | K9: 450 | L9: 150 | M9: 66 | N9: 52 | O9: 24 | Q9: =RC[-6]&"*0.8" -> 450*0.8 | R9: =RC[-6]&"*0.5" -> 150*0.5 | S9: =RC[-6]&"*1" -> 66*1 | T9: =RC[-6]&"*1" -> 52*1 | U9: =RC[-6]&"*2" -> 24*2 | X9: 1179*0.5 | Y9: =RC[-1]&"-500" -> 1179*0.5-500 | AA9: 1133*0.5 | AB9: =RC[-1]&"-500" -> 1133*0.5-500
B10: 4020*0.8 | C10: =RC[-1]&"*1.5" -> 4020*0.8*1.5 | F10: 3867 | G10: =RC[-1]&"*1.5" -> 3867*1.5 | K10: 500 | L10: 170 | M10: 74 | N10: 58 | O10: 27 | Q10: =RC[-6]&"*0.8" -> 500*0.8 | R10: =RC[-6]&"*0.5" -> 170*0.5 | S10: =RC[-6]&"*1" -> 74*1 | T10: =RC[-6]&"*1" -> 58*1 | U10: =RC[-6]&"*2" -> 27*2 | X10: 1188*0.5 | Y10: =RC[-1]&"-500" -> 1188*0.5-500 | AA10: 1133 | AB10: =RC[-1]&"-500" -> 1133-500
B11: 4046 | C11: =RC[-1]&"*1.5" -> 4046*1.5 | F11: 3961 | G11: =RC[-1]&"*1.5" -> 3961*1.5 | K11: 550 | L11: 190 | M11: 82 | N11: 64 | O11: 30 | Q11: =RC[-6]&"*0.8" -> 550*0.8 | R11: =RC[-6]&"*0.5" -> 190*0.5 | S11: =RC[-6]&"*1" -> 82*1 | T11: =RC[-6]&"*1" -> 64*1 | U11: =RC[-6]&"*2" -> 30*2 | X11: 1198 | Y11: =RC[-1]&"-500" -> 1198-500 | AA11: 1161*0.5 | AB11: =RC[-1]&"-500" -> 1161*0.5-500
B12: 4590*1.2 | C12: =RC[-1]&"*1.5" -> 4590*1.2*1.5 | F12: 3961 | G12: =RC[-1]&"*1.5" -> 3961*1.5 | K12: 600 | L12: 210 | M12: 90 | N12: 70 | O12: 33 | Q12: =RC[-6]&"*0.8" -> 600*0.8 | R12: =RC[-6]&"*0.5" -> 210*0.5 | S12: =RC[-6]&"*1" -> 90*1 | T12: =RC[-6]&"*1" -> 70*1 | U12: =RC[-6]&"*2" -> 33*2 | X12: 1331*0.5 | Y12: =RC[-1]&"-500" -> 1331*0.5-500 | AA12: 1161 | AB12: =RC[-1]&"-500" -> 1161-500
B13: 4615 | C13: =RC[-1]&"*1.5" -> 4615*1.5 | F13: 3986 | G13: =RC[-1]&"*1.5" -> 3986*1.5 | K13: 650 | L13: 230 | M13: 98 | N13: 76 | O13: 36 | Q13: =RC[-6]&"*0.8" -> 650*0.8 | R13: =RC[-6]&"*0.5" -> 230*0.5 | S13: =RC[-6]&"*1" -> 98*1 | T13: =RC[-6]&"*1" -> 76*1 | U13: =RC[-6]&"*2" -> 36*2 | X13: 1339*0.5 | Y13: =RC[-1]&"-500" -> 1339*0.5-500 | AA13: 1170*0.5 | AB13: =RC[-1]&"-500" -> 1170*0.5-500
B14: 4632 | C14: =RC[-1]&"*1.5" -> 4632*1.5 | F14: 3986 | G14: =RC[-1]&"*1.5" -> 3986*1.5 | K14: 700 | L14: 250 | M14: 106 | N14: 82 | O14: 39 | Q14: =RC[-6]&"*0.8" -> 700*0.8 | R14: =RC[-6]&"*0.5" -> 250*0.5 | S14: =RC[-6]&"*1" -> 106*1 | T14: =RC[-6]&"*1" -> 82*1 | U14: =RC[-6]&"*2" -> 39*2 | X14: 1349*0.5 | Y14: =RC[-1]&"-500" -> 1349*0.5-500 | AA14: 1170 | AB14: =RC[-1]&"-500" -> 1170-500
B15: 4658 | C15: =RC[-1]&"*1.5" -> 4658*1.5 | F15: 4003 | G15: =RC[-1]&"*1.5" -> 4003*1.5 | K15: 750 | L15: 270 | M15: 114 | N15: 88 | O15: 42 | Q15: =RC[-6]&"*0.8" -> 750*0.8 | R15: =RC[-6]&"*0.5" -> 270*0.5 | S15: =RC[-6]&"*1" -> 114*1 | T15: =RC[-6]&"*1" -> 88*1 | U15: =RC[-6]&"*2" -> 42*2 | X15: 1358 | Y15: =RC[-1]&"-500" -> 1358-500 | AA15: 1179*0.5 | AB15: =RC[-1]&"-500" -> 1179*0.5-500
B16: 4683 | C16: =RC[-1]&"*1.5" -> 4683*1.5 | F16: 4003*1.2 | G16: =RC[-1]&"*1.5" -> 4003*1.2*1.5 | K16: 800 | L16: 290 | M16: 122 | N16: 94 | O16: 45 | Q16: =RC[-6]&"*0.8" -> 800*0.8 | R16: =RC[-6]&"*0.5" -> 290*0.5 | S16: =RC[-6]&"*1" -> 122*1 | T16: =RC[-6]&"*1" -> 94*1 | U16: =RC[-6]&"*2" -> 45*2 | X16: 1368 | Y16: =RC[-1]&"-500" -> 1368-500 | AA16: 1179*0.5 | AB16: =RC[-1]&"-500" -> 1179*0.5-500
B17: 4785 | C17: =RC[-1]&"*1.5" -> 4785*1.5 | F17: 4003 | G17: =RC[-1]&"*1.5" -> 4003*1.5 | K17: 850 | L17: 310 | M17: 130 | N17: 100 | O17: 48 | Q17: =RC[-6]&"*0.8" -> 850*0.8 | R17: =RC[-6]&"*0.5" -> 310*0.5 | S17: =RC[-6]&"*1" -> 130*1 | T17: =RC[-6]&"*1" -> 100*1 | U17: =RC[-6]&"*2" -> 48*2 | X17: 1396 | Y17: =RC[-1]&"-500" -> 1396-500 | AA17: 1179*0.5 | AB17: =RC[-1]&"-500" -> 1179*0.5-500
B18: 4811 | C18: =RC[-1]&"*1.5" -> 4811*1.5 | F18: 4020 | G18: =RC[-1]&"*1.5" -> 4020*1.5 | K18: 900 | L18: 330 | M18: 138 | N18: 106 | O18: 51 | Q18: =RC[-6]&"*0.8" -> 900*0.8 | R18: =RC[-6]&"*0.5" -> 330*0.5 | S18: =RC[-6]&"*1" -> 138*1 | T18: =RC[-6]&"*1" -> 106*1 | U18: =RC[-6]&"*2" -> 51*2 | X18: 1404*0.5 | Y18: =RC[-1]&"-500" -> 1404*0.5-500 | AA18: 1188 | AB18: =RC[-1]&"-500" -> 1188-500
B19: 4828 | C19: =RC[-1]&"*1.5" -> 4828*1.5 | F19: 4020*1.2 | G19: =RC[-1]&"*1.5" -> 4020*1.2*1.5 | K19: 950 | L19: 350 | M19: 146 | N19: 112 | O19: 54 | Q19: =RC[-6]&"*0.8" -> 950*0.8 | R19: =RC[-6]&"*0.5" -> 350*0.5 | S19: =RC[-6]&"*1" -> 146*1 | T19: =RC[-6]&"*1" -> 112*1 | U19: =RC[-6]&"*2" -> 54*2 | X19: 1414*0.5 | Y19: =RC[-1]&"-500" -> 1414*0.5-500 | AA19: 1188*0.5 | AB19: =RC[-1]&"-500" -> 1188*0.5-500
B20: 4853 | C20: =RC[-1]&"*1.5" -> 4853*1.5 | F20: 4020 | G20: =RC[-1]&"*1.5" -> 4020*1.5 | K20: 1000 | L20: 370 | M20: 154 | N20: 118 | O20: 57 | Q20: =RC[-6]&"*0.8" -> 1000*0.8 | R20: =RC[-6]&"*0.5" -> 370*0.5 | S20: =RC[-6]&"*1" -> 154*1 | T20: =RC[-6]&"*1" -> 118*1 | U20: =RC[-6]&"*2" -> 57*2 | X20: 1423 | Y20: =RC[-1]&"-500" -> 1423-500 | AA20: 1188 | AB20: =RC[-1]&"-500" -> 1188-500
B21: 4870 | C21: =RC[-1]&"*1.5" -> 4870*1.5 | F21: 4046*0.8 | G21: =RC[-1]&"*1.5" -> 4046*0.8*1.5 | K21: 1050 | L21: 390 | M21: 162 | N21: 124 | O21: 60 | Q21: =RC[-6]&"*0.8" -> 1050*0.8 | R21: =RC[-6]&"*0.5" -> 390*0.5 | S21: =RC[-6]&"*1" -> 162*1 | T21: =RC[-6]&"*1" -> 124*1 | U21: =RC[-6]&"*2" -> 60*2 | X21: 1433 | Y21: =RC[-1]&"-500" -> 1433-500 | AA21: 1198*0.5 | AB21: =RC[-1]&"-500" -> 1198*0.5-500
B22: 4779 | C22: =RC[-1]&"*1.5" -> 4779*1.5 | F22: 4046 | G22: =RC[-1]&"*1.5" -> 4046*1.5 | K22: 1100 | L22: 410 | M22: 170 | N22: 130 | O22: 63 | Q22: =RC[-6]&"*0.8" -> 1100*0.8 | R22: =RC[-6]&"*0.5" -> 410*0.5 | S22: =RC[-6]&"*1" -> 170*1 | T22: =RC[-6]&"*1" -> 130*1 | U22: =RC[-6]&"*2" -> 63*2 | X22: 1588 | Y22: =RC[-1]&"-500" -> 1588-500 | AA22: 1198 | AB22: =RC[-1]&"-500" -> 1198-500
B23: 4801 | C23: =RC[-1]&"*1.5" -> 4801*1.5 | F23: 4046 | G23: =RC[-1]&"*1.5" -> 4046*1.5 | K23: 1150 | L23: 430 | M23: 178 | N23: 136 | O23: 66 | Q23: =RC[-6]&"*0.8" -> 1150*0.8 | R23: =RC[-6]&"*0.5" -> 430*0.5 | S23: =RC[-6]&"*1" -> 178*1 | T23: =RC[-6]&"*1" -> 136*1 | U23: =RC[-6]&"*2" -> 66*2 | X23: 1597 | Y23: =RC[-1]&"-500" -> 1597-500 | AA23: 1198 | AB23: =RC[-1]&"-500" -> 1198-500
B24: 4815 | C24: =RC[-1]&"*1.5" -> 4815*1.5 | F24: 4590 | G24: =RC[-1]&"*1.5" -> 4590*1.5 | K24: 1200 | L24: 450 | M24: 186 | N24: 142 | O24: 69 | Q24: =RC[-6]&"*0.8" -> 1200*0.8 | R24: =RC[-6]&"*0.5" -> 450*0.5 | S24: =RC[-6]&"*1" -> 186*1 | T24: =RC[-6]&"*1" -> 142*1 | U24: =RC[-6]&"*2" -> 69*2 | X24: 1606 | Y24: =RC[-1]&"-500" -> 1606-500 | AA24: 1331*0.5 | AB24: =RC[-1]&"-500" -> 1331*0.5-500
B25: 4837*0.8 | C25: =RC[-1]&"*1.5" -> 4837*0.8*1.5 | F25: 4590*1.2 | G25: =RC[-1]&"*1.5" -> 4590*1.2*1.5 | K25: 1250 | L25: 470 | M25: 194 | N25: 148 | O25: 72 | Q25: =RC[-6]&"*0.8" -> 1250*0.8 | R25: =RC[-6]&"*0.5" -> 470*0.5 | S25: =RC[-6]&"*1" -> 194*1 | T25: =RC[-6]&"*1" -> 148*1 | U25: =RC[-6]&"*2" -> 72*2 | X25: 1615*0.5 | Y25: =RC[-1]&"-500" -> 1615*0.5-500 | AA25: 1331*0.5 | AB25: =RC[-1]&"-500" -> 1331*0.5-500
B26: 4859 | C26: =RC[-1]&"*1.5" -> 4859*1.5 | F26: 4590 | G26: =RC[-1]&"*1.5" -> 4590*1.5 | K26: 1300 | L26: 490 | M26: 202 | N26: 154 | O26: 75 | Q26: =RC[-6]&"*0.8" -> 1300*0.8 | R26: =RC[-6]&"*0.5" -> 490*0.5 | S26: =RC[-6]&"*1" -> 202*1 | T26: =RC[-6]&"*1" -> 154*1 | U26: =RC[-6]&"*2" -> 75*2 | X26: 1624 | Y26: =RC[-1]&"-500" -> 1624-500 | AA26: 1331*0.5 | AB26: =RC[-1]&"-500" -> 1331*0.5-500
B27: 4954*1.2 | C27: =RC[-1]&"*1.5" -> 4954*1.2*1.5 | F27: 4615 | G27: =RC[-1]&"*1.5" -> 4615*1.5 | K27: 1350 | L27: 510 | M27: 210 | N27: 160 | O27: 78 | Q27: =RC[-6]&"*0.8" -> 1350*0.8 | R27: =RC[-6]&"*0.5" -> 510*0.5 | S27: =RC[-6]&"*1" -> 210*1 | T27: =RC[-6]&"*1" -> 160*1 | U27: =RC[-6]&"*2" -> 78*2 | X27: 1652*0.5 | Y27: =RC[-1]&"-500" -> 1652*0.5-500 | AA27: 1339*0.5 | AB27: =RC[-1]&"-500" -> 1339*0.5-500
B28: 4976 | C28: =RC[-1]&"*1.5" -> 4976*1.5 | F28: 4615 | G28: =RC[-1]&"*1.5" -> 4615*1.5 | K28: 1400 | L28: 530 | M28: 218 | N28: 166 | O28: 81 | Q28: =RC[-6]&"*0.8" -> 1400*0.8 | R28: =RC[-6]&"*0.5" -> 530*0.5 | S28: =RC[-6]&"*1" -> 218*1 | T28: =RC[-6]&"*1" -> 166*1 | U28: =RC[-6]&"*2" -> 81*2 | X28: 1661*0.5 | Y28: =RC[-1]&"-500" -> 1661*0.5-500 | AA28: 1339 | AB28: =RC[-1]&"-500" -> 1339-500
B29: 4990 | C29: =RC[-1]&"*1.5" -> 4990*1.5 | F29: 4615 | G29: =RC[-1]&"*1.5" -> 4615*1.5 | K29: 1450 | L29: 550 | M29: 226 | N29: 172 | O29: 84 | Q29: =RC[-6]&"*0.8" -> 1450*0.8 | R29: =RC[-6]&"*0.5" -> 550*0.5 | S29: =RC[-6]&"*1" -> 226*1 | T29: =RC[-6]&"*1" -> 172*1 | U29: =RC[-6]&"*2" -> 84*2 | X29: 1670*0.5 | Y29: =RC[-1]&"-500" -> 1670*0.5-500 | AA29: 1339 | AB29: =RC[-1]&"-500" -> 1339-500
B30: 5012 | C30: =RC[-1]&"*1.5" -> 5012*1.5 | F30: 4632 | G30: =RC[-1]&"*1.5" -> 4632*1.5 | K30: 1500 | L30: 570 | M30: 234 | N30: 178 | O30: 87 | Q30: =RC[-6]&"*0.8" -> 1500*0.8 | R30: =RC[-6]&"*0.5" -> 570*0.5 | S30: =RC[-6]&"*1" -> 234*1 | T30: =RC[-6]&"*1" -> 178*1 | U30: =RC[-6]&"*2" -> 87*2 | X30: 1678 | Y30: =RC[-1]&"-500" -> 1678-500 | AA30: 1349*0.5 | AB30: =RC[-1]&"-500" -> 1349*0.5-500
B31: 5034*0.8 | C31: =RC[-1]&"*1.5" -> 5034*0.8*1.5 | F31: 4632*1.2 | G31: =RC[-1]&"*1.5" -> 4632*1.2*1.5 | K31: 1550 | L31: 590 | M31: 242 | N31: 184 | O31: 90 | Q31: =RC[-6]&"*0.8" -> 1550*0.8 | R31: =RC[-6]&"*0.5" -> 590*0.5 | S31: =RC[-6]&"*1" -> 242*1 | T31: =RC[-6]&"*1" -> 184*1 | U31: =RC[-6]&"*2" -> 90*2 | X31: 1687*0.5 | Y31: =RC[-1]&"-500" -> 1687*0.5-500 | AA31: 1349*0.5 | AB31: =RC[-1]&"-500" -> 1349*0.5-500
B32: 5559 | C32: =RC[-1]&"*1.5" -> 5559*1.5 | F32: 4632 | G32: =RC[-1]&"*1.5" -> 4632*1.5 | K32: 1600 | L32: 610 | M32: 250 | N32: 190 | O32: 93 | Q32: =RC[-6]&"*0.8" -> 1600*0.8 | R32: =RC[-6]&"*0.5" -> 610*0.5 | S32: =RC[-6]&"*1" -> 250*1 | T32: =RC[-6]&"*1" -> 190*1 | U32: =RC[-6]&"*2" -> 93*2 | X32: 1835 | Y32: =RC[-1]&"-500" -> 1835-500 | AA32: 1349 | AB32: =RC[-1]&"-500" -> 1349-500
B33: 5580 | C33: =RC[-1]&"*1.5" -> 5580*1.5 | F33: 4658 | G33: =RC[-1]&"*1.5" -> 4658*1.5 | K33: 1625 | L33: 625 | M33: 258 | N33: 196 | O33: 96 | Q33: =RC[-6]&"*0.8" -> 1625*0.8 | R33: =RC[-6]&"*0.5" -> 625*0.5 | S33: =RC[-6]&"*1" -> 258*1 | T33: =RC[-6]&"*1" -> 196*1 | U33: =RC[-6]&"*2" -> 96*2 | X33: 1844 | Y33: =RC[-1]&"-500" -> 1844-500 | AA33: 1358 | AB33: =RC[-1]&"-500" -> 1358-500
B34: 5595 | C34: =RC[-1]&"*1.5" -> 5595*1.5 | F34: 4658*1.2 | G34: =RC[-1]&"*1.5" -> 4658*1.2*1.5 | K34: 1650 | L34: 640 | M34: 266 | N34: 202 | O34: 99 | Q34: =RC[-6]&"*0.8" -> 1650*0.8 | R34: =RC[-6]&"*0.5" -> 640*0.5 | S34: =RC[-6]&"*1" -> 266*1 | T34: =RC[-6]&"*1" -> 202*1 | U34: =RC[-6]&"*2" -> 99*2 | X34: 1853*0.5 | Y34: =RC[-1]&"-500" -> 1853*0.5-500 | AA34: 1358*0.5 | AB34: =RC[-1]&"-500" -> 1358*0.5-500
B35: 5617 | C35: =RC[-1]&"*1.5" -> 5617*1.5 | F35: 4658*0.8 | G35: =RC[-1]&"*1.5" -> 4658*0.8*1.5 | K35: 1675 | L35: 655 | M35: 274 | N35: 208 | O35: 102 | Q35: =RC[-6]&"*0.8" -> 1675*0.8 | R35: =RC[-6]&"*0.5" -> 655*0.5 | S35: =RC[-6]&"*1" -> 274*1 | T35: =RC[-6]&"*1" -> 208*1 | U35: =RC[-6]&"*2" -> 102*2 | X35: 1862 | Y35: =RC[-1]&"-500" -> 1862-500 | AA35: 1358*0.5 | AB35: =RC[-1]&"-500" -> 1358*0.5-500
B36: 5639 | C36: =RC[-1]&"*1.5" -> 5639*1.5 | F36: 4658 | G36: =RC[-1]&"*1.5" -> 4658*1.5 | K36: 1700 | L36: 670 | M36: 282 | N36: 214 | O36: 105 | Q36: =RC[-6]&"*0.8" -> 1700*0.8 | R36: =RC[-6]&"*0.5" -> 670*0.5 | S36: =RC[-6]&"*1" -> 282*1 | T36: =RC[-6]&"*1" -> 214*1 | U36: =RC[-6]&"*2" -> 105*2 | X36: 1871 | Y36: =RC[-1]&"-500" -> 1871-500 | AA36: 1358 | AB36: =RC[-1]&"-500" -> 1358-500
B37: 5741 | C37: =RC[-1]&"*1.5" -> 5741*1.5 | F37: 4683 | G37: =RC[-1]&"*1.5" -> 4683*1.5 | K37: 1725 | L37: 685 | M37: 290 | N37: 220 | O37: 108 | Q37: =RC[-6]&"*0.8" -> 1725*0.8 | R37: =RC[-6]&"*0.5" -> 685*0.5 | S37: =RC[-6]&"*1" -> 290*1 | T37: =RC[-6]&"*1" -> 220*1 | U37: =RC[-6]&"*2" -> 108*2 | X37: 1901*0.5 | Y37: =RC[-1]&"-500" -> 1901*0.5-500 | AA37: 1368 | AB37: =RC[-1]&"-500" -> 1368-500
B38: 5763 | C38: =RC[-1]&"*1.5" -> 5763*1.5 | F38: 4683 | G38: =RC[-1]&"*1.5" -> 4683*1.5 | K38: 1750 | L38: 700 | M38: 298 | N38: 226 | O38: 111 | Q38: =RC[-6]&"*0.8" -> 1750*0.8 | R38: =RC[-6]&"*0.5" -> 700*0.5 | S38: =RC[-6]&"*1" -> 298*1 | T38: =RC[-6]&"*1" -> 226*1 | U38: =RC[-6]&"*2" -> 111*2 | X38: 1910 | Y38: =RC[-1]&"-500" -> 1910-500 | AA38: 1368 | AB38: =RC[-1]&"-500" -> 1368-500
B39: 5784 | C39: =RC[-1]&"*1.5" -> 5784*1.5 | F39: 4683 | G39: =RC[-1]&"*1.5" -> 4683*1.5 | K39: 1775 | L39: 715 | M39: 306 | N39: 232 | O39: 114 | Q39: =RC[-6]&"*0.8" -> 1775*0.8 | R39: =RC[-6]&"*0.5" -> 715*0.5 | S39: =RC[-6]&"*1" -> 306*1 | T39: =RC[-6]&"*1" -> 232*1 | U39: =RC[-6]&"*2" -> 114*2 | X39: 1919*0.5 | Y39: =RC[-1]&"-500" -> 1919*0.5-500 | AA39: 1368 | AB39: =RC[-1]&"-500" -> 1368-500
B40: 5799 | C40: =RC[-1]&"*1.5" -> 5799*1.5 | F40: 4785*1.2 | G40: =RC[-1]&"*1.5" -> 4785*1.2*1.5 | K40: 1800 | L40: 730 | M40: 314 | N40: 238 | O40: 117 | Q40: =RC[-6]&"*0.8" -> 1800*0.8 | R40: =RC[-6]&"*0.5" -> 730*0.5 | S40: =RC[-6]&"*1" -> 314*1 | T40: =RC[-6]&"*1" -> 238*1 | U40: =RC[-6]&"*2" -> 117*2 | X40: 1928 | Y40: =RC[-1]&"-500" -> 1928-500 | AA40: 1396*0.5 | AB40: =RC[-1]&"-500" -> 1396*0.5-500
B41: 5821*0.8 | C41: =RC[-1]&"*1.5" -> 5821*0.8*1.5 | F41: 4785 | G41: =RC[-1]&"*1.5" -> 4785*1.5 | K41: 1825 | L41: 745 | M41: 322 | N41: 244 | O41: 120 | Q41: =RC[-6]&"*0.8" -> 1825*0.8 | R41: =RC[-6]&"*0.5" -> 745*0.5 | S41: =RC[-6]&"*1" -> 322*1 | T41: =RC[-6]&"*1" -> 244*1 | U41: =RC[-6]&"*2" -> 120*2 | X41: 1937*0.5 | Y41: =RC[-1]&"-500" -> 1937*0.5-500 | AA41: 1396*0.5 | AB41: =RC[-1]&"-500" -> 1396*0.5-500
B42: 5686*1.2 | C42: =RC[-1]&"*1.5" -> 5686*1.2*1.5 | F42: 4785 | G42: =RC[-1]&"*1.5" -> 4785*1.5 | K42: 1850 | L42: 760 | M42: 330 | N42: 250 | O42: 123 | Q42: =RC[-6]&"*0.8" -> 1850*0.8 | R42: =RC[-6]&"*0.5" -> 760*0.5 | S42: =RC[-6]&"*1" -> 330*1 | T42: =RC[-6]&"*1" -> 250*1 | U42: =RC[-6]&"*2" -> 123*2 | X42: 2119*0.5 | Y42: =RC[-1]&"-500" -> 2119*0.5-500 | AA42: 1396 | AB42: =RC[-1]&"-500" -> 1396-500
B43: 5705 | C43: =RC[-1]&"*1.5" -> 5705*1.5 | F43: 4811 | G43: =RC[-1]&"*1.5" -> 4811*1.5 | K43: 1875 | L43: 775 | M43: 338 | N43: 256 | O43: 126 | Q43: =RC[-6]&"*0.8" -> 1875*0.8 | R43: =RC[-6]&"*0.5" -> 775*0.5 | S43: =RC[-6]&"*1" -> 338*1 | T43: =RC[-6]&"*1" -> 256*1 | U43: =RC[-6]&"*2" -> 126*2 | X43: 2127*0.5 | Y43: =RC[-1]&"-500" -> 2127*0.5-500 | AA43: 1404*0.5 | AB43: =RC[-1]&"-500" -> 1404*0.5-500
B44: 5724 | C44: =RC[-1]&"*1.5" -> 5724*1.5 | F44: 4811 | G44: =RC[-1]&"*1.5" -> 4811*1.5 | K44: 1900 | L44: 790 | M44: 346 | N44: 262 | O44: 129 | Q44: =RC[-6]&"*0.8" -> 1900*0.8 | R44: =RC[-6]&"*0.5" -> 790*0.5 | S44: =RC[-6]&"*1" -> 346*1 | T44: =RC[-6]&"*1" -> 262*1 | U44: =RC[-6]&"*2" -> 129*2 | X44: 2136*0.5 | Y44: =RC[-1]&"-500" -> 2136*0.5-500 | AA44: 1404 | AB44: =RC[-1]&"-500" -> 1404-500
B45: 5743 | C45: =RC[-1]&"*1.5" -> 5743*1.5 | F45: 4811*0.8 | G45: =RC[-1]&"*1.5" -> 4811*0.8*1.5 | K45: 1925 | L45: 805 | M45: 354 | N45: 268 | O45: 132 | Q45: =RC[-6]&"*0.8" -> 1925*0.8 | R45: =RC[-6]&"*0.5" -> 805*0.5 | S45: =RC[-6]&"*1" -> 354*1 | T45: =RC[-6]&"*1" -> 268*1 | U45: =RC[-6]&"*2" -> 132*2 | X45: 2144 | Y45: =RC[-1]&"-500" -> 2144-500 | AA45: 1404*0.5 | AB45: =RC[-1]&"-500" -> 1404*0.5-500
B46: 5763 | C46: =RC[-1]&"*1.5" -> 5763*1.5 | F46: 4828 | G46: =RC[-1]&"*1.5" -> 4828*1.5 | K46: 1950 | L46: 820 | M46: 362 | N46: 274 | O46: 135 | Q46: =RC[-6]&"*0.8" -> 1950*0.8 | R46: =RC[-6]&"*0.5" -> 820*0.5 | S46: =RC[-6]&"*1" -> 362*1 | T46: =RC[-6]&"*1" -> 274*1 | U46: =RC[-6]&"*2" -> 135*2 | X46: 2153 | Y46: =RC[-1]&"-500" -> 2153-500 | AA46: 1414 | AB46: =RC[-1]&"-500" -> 1414-500
B47: 5858*1.2 | C47: =RC[-1]&"*1.5" -> 5858*1.2*1.5 | F47: 4828 | G47: =RC[-1]&"*1.5" -> 4828*1.5 | K47: 1975 | L47: 835 | M47: 370 | N47: 280 | O47: 138 | Q47: =RC[-6]&"*0.8" -> 1975*0.8 | R47: =RC[-6]&"*0.5" -> 835*0.5 | S47: =RC[-6]&"*1" -> 370*1 | T47: =RC[-6]&"*1" -> 280*1 | U47: =RC[-6]&"*2" -> 138*2 | X47: 2184*0.5 | Y47: =RC[-1]&"-500" -> 2184*0.5-500 | AA47: 1414*0.5 | AB47: =RC[-1]&"-500" -> 1414*0.5-500
B48: 5877 | C48: =RC[-1]&"*1.5" -> 5877*1.5 | F48: 4828 | G48: =RC[-1]&"*1.5" -> 4828*1.5 | K48: 2000 | L48: 850 | M48: 378 | N48: 286 | O48: 141 | Q48: =RC[-6]&"*0.8" -> 2000*0.8 | R48: =RC[-6]&"*0.5" -> 850*0.5 | S48: =RC[-6]&"*1" -> 378*1 | T48: =RC[-6]&"*1" -> 286*1 | U48: =RC[-6]&"*2" -> 141*2 | X48: 2193*0.5 | Y48: =RC[-1]&"-500" -> 2193*0.5-500 | AA48: 1414 | AB48: =RC[-1]&"-500" -> 1414-500
B49: 5896*0.8 | C49: =RC[-1]&"*1.5" -> 5896*0.8*1.5 | F49: 4853 | G49: =RC[-1]&"*1.5" -> 4853*1.5 | K49: 2025 | L49: 865 | M49: 386 | N49: 292 | O49: 144 | Q49: =RC[-6]&"*0.8" -> 2025*0.8 | R49: =RC[-6]&"*0.5" -> 865*0.5 | S49: =RC[-6]&"*1" -> 386*1 | T49: =RC[-6]&"*1" -> 292*1 | U49: =RC[-6]&"*2" -> 144*2 | X49: 2201*0.5 | Y49: =RC[-1]&"-500" -> 2201*0.5-500 | AA49: 1423 | AB49: =RC[-1]&"-500" -> 1423-500
B50: 5909 | C50: =RC[-1]&"*1.5" -> 5909*1.5 | F50: 4853 | G50: =RC[-1]&"*1.5" -> 4853*1.5 | K50: 2050 | L50: 880 | M50: 394 | N50: 298 | O50: 147 | Q50: =RC[-6]&"*0.8" -> 2050*0.8 | R50: =RC[-6]&"*0.5" -> 880*0.5 | S50: =RC[-6]&"*1" -> 394*1 | T50: =RC[-6]&"*1" -> 298*1 | U50: =RC[-6]&"*2" -> 147*2 | X50: 2210 | Y50: =RC[-1]&"-500" -> 2210-500 | AA50: 1423 | AB50: =RC[-1]&"-500" -> 1423-500
B51: 5935 | C51: =RC[-1]&"*1.5" -> 5935*1.5 | F51: 4870 | G51: =RC[-1]&"*1.5" -> 4870*1.5 | K51: 2075 | L51: 895 | M51: 402 | N51: 304 | O51: 150 | Q51: =RC[-6]&"*0.8" -> 2075*0.8 | R51: =RC[-6]&"*0.5" -> 895*0.5 | S51: =RC[-6]&"*1" -> 402*1 | T51: =RC[-6]&"*1" -> 304*1 | U51: =RC[-6]&"*2" -> 150*2 | X51: 2219 | Y51: =RC[-1]&"-500" -> 2219-500 | AA51: 1433 | AB51: =RC[-1]&"-500" -> 1433-500
B52: 9120 | C52: =RC[-1]&"*1.5" -> 9120*1.5 | F52: 4870 | G52: =RC[-1]&"*1.5" -> 4870*1.5 | K52: 2100 | L52: 910 | M52: 410 | N52: 310 | O52: 153 | Q52: =RC[-6]&"*0.8" -> 2100*0.8 | R52: =RC[-6]&"*0.5" -> 910*0.5 | S52: =RC[-6]&"*1" -> 410*1 | T52: =RC[-6]&"*1" -> 310*1 | U52: =RC[-6]&"*2" -> 153*2 | X52: 2756*0.5 | Y52: =RC[-1]&"-500" -> 2756*0.5-500 | AA52: 1433 | AB52: =RC[-1]&"-500" -> 1433-500
B53: 9146 | C53: =RC[-1]&"*1.5" -> 9146*1.5 | F53: 4870*0.8 | G53: =RC[-1]&"*1.5" -> 4870*0.8*1.5 | K53: 2125 | L53: 925 | M53: 418 | N53: 316 | O53: 156 | Q53: =RC[-6]&"*0.8" -> 2125*0.8 | R53: =RC[-6]&"*0.5" -> 925*0.5 | S53: =RC[-6]&"*1" -> 418*1 | T53: =RC[-6]&"*1" -> 316*1 | U53: =RC[-6]&"*2" -> 156*2 | X53: 2766 | Y53: =RC[-1]&"-500" -> 2766-500 | AA53: 1433*0.5 | AB53: =RC[-1]&"-500" -> 1433*0.5-500
B54: 9171 | C54: =RC[-1]&"*1.5" -> 9171*1.5 | F54: 4779 | G54: =RC[-1]&"*1.5" -> 4779*1.5 | K54: 2150 | L54: 940 | M54: 426 | N54: 322 | O54: 159 | Q54: =RC[-6]&"*0.8" -> 2150*0.8 | R54: =RC[-6]&"*0.5" -> 940*0.5 | S54: =RC[-6]&"*1" -> 426*1 | T54: =RC[-6]&"*1" -> 322*1 | U54: =RC[-6]&"*2" -> 159*2 | X54: 2776*0.5 | Y54: =RC[-1]&"-500" -> 2776*0.5-500 | AA54: 1588 | AB54: =RC[-1]&"-500" -> 1588-500
B55: 6897 | C55: =RC[-1]&"*1.5" -> 6897*1.5 | F55: 4779 | G55: =RC[-1]&"*1.5" -> 4779*1.5 | K55: 2175 | L55: 955 | M55: 434 | N55: 328 | O55: 162 | Q55: =RC[-6]&"*0.8" -> 2175*0.8 | R55: =RC[-6]&"*0.5" -> 955*0.5 | S55: =RC[-6]&"*1" -> 434*1 | T55: =RC[-6]&"*1" -> 328*1 | U55: =RC[-6]&"*2" -> 162*2 | X55: 2562 | Y55: =RC[-1]&"-500" -> 2562-500 | AA55: 1588 | AB55: =RC[-1]&"-500" -> 1588-500
B56: 6916*0.8 | C56: =RC[-1]&"*1.5" -> 6916*0.8*1.5 | F56: 4779*1.2 | G56: =RC[-1]&"*1.5" -> 4779*1.2*1.5 | K56: 2200 | L56: 970 | M56: 442 | N56: 334 | O56: 165 | Q56: =RC[-6]&"*0.8" -> 2200*0.8 | R56: =RC[-6]&"*0.5" -> 970*0.5 | S56: =RC[-6]&"*1" -> 442*1 | T56: =RC[-6]&"*1" -> 334*1 | U56: =RC[-6]&"*2" -> 165*2 | X56: 2571*0.5 | Y56: =RC[-1]&"-500" -> 2571*0.5-500 | AA56: 1588*0.5 | AB56: =RC[-1]&"-500" -> 1588*0.5-500
B57: 7044 | C57: =RC[-1]&"*1.5" -> 7044*1.5 | F57: 4801*0.8 | G57: =RC[-1]&"*1.5" -> 4801*0.8*1.5 | K57: 2225 | L57: 985 | M57: 450 | N57: 340 | O57: 168 | Q57: =RC[-6]&"*0.8" -> 2225*0.8 | R57: =RC[-6]&"*0.5" -> 985*0.5 | S57: =RC[-6]&"*1" -> 450*1 | T57: =RC[-6]&"*1" -> 340*1 | U57: =RC[-6]&"*2" -> 168*2 | X57: 2611*0.5 | Y57: =RC[-1]&"-500" -> 2611*0.5-500 | AA57: 1597*0.5 | AB57: =RC[-1]&"-500" -> 1597*0.5-500
B58: 7063 | C58: =RC[-1]&"*1.5" -> 7063*1.5 | F58: 4801 | G58: =RC[-1]&"*1.5" -> 4801*1.5 | K58: 2250 | L58: 1000 | M58: 458 | N58: 346 | O58: 171 | Q58: =RC[-6]&"*0.8" -> 2250*0.8 | R58: =RC[-6]&"*0.5" -> 1000*0.5 | S58: =RC[-6]&"*1" -> 458*1 | T58: =RC[-6]&"*1" -> 346*1 | U58: =RC[-6]&"*2" -> 171*2 | X58: 2620*0.5 | Y58: =RC[-1]&"-500" -> 2620*0.5-500 | AA58: 1597 | AB58: =RC[-1]&"-500" -> 1597-500
B59: 7082 | C59: =RC[-1]&"*1.5" -> 7082*1.5 | F59: 4801 | G59: =RC[-1]&"*1.5" -> 4801*1.5 | K59: 2275 | L59: 1015 | M59: 466 | N59: 352 | O59: 174 | Q59: =RC[-6]&"*0.8" -> 2275*0.8 | R59: =RC[-6]&"*0.5" -> 1015*0.5 | S59: =RC[-6]&"*1" -> 466*1 | T59: =RC[-6]&"*1" -> 352*1 | U59: =RC[-6]&"*2" -> 174*2 | X59: 2629*0.5 | Y59: =RC[-1]&"-500" -> 2629*0.5-500 | AA59: 1597 | AB59: =RC[-1]&"-500" -> 1597-500
B60: 7095*0.8 | C60: =RC[-1]&"*1.5" -> 7095*0.8*1.5 | F60: 4815 | G60: =RC[-1]&"*1.5" -> 4815*1.5 | K60: 2300 | L60: 1030 | M60: 474 | N60: 358 | O60: 177 | Q60: =RC[-6]&"*0.8" -> 2300*0.8 | R60: =RC[-6]&"*0.5" -> 1030*0.5 | S60: =RC[-6]&"*1" -> 474*1 | T60: =RC[-6]&"*1" -> 358*1 | U60: =RC[-6]&"*2" -> 177*2 | X60: 2638*0.5 | Y60: =RC[-1]&"-500" -> 2638*0.5-500 | AA60: 1606*0.5 | AB60: =RC[-1]&"-500" -> 1606*0.5-500
B61: 7120 | C61: =RC[-1]&"*1.5" -> 7120*1.5 | F61: 4815 | G61: =RC[-1]&"*1.5" -> 4815*1.5 | K61: 2325 | L61: 1045 | M61: 482 | N61: 364 | O61: 180 | Q61: =RC[-6]&"*0.8" -> 2325*0.8 | R61: =RC[-6]&"*0.5" -> 1045*0.5 | S61: =RC[-6]&"*1" -> 482*1 | T61: =RC[-6]&"*1" -> 364*1 | U61: =RC[-6]&"*2" -> 180*2 | X61: 2647 | Y61: =RC[-1]&"-500" -> 2647-500 | AA61: 1606 | AB61: =RC[-1]&"-500" -> 1606-500
B62: 7713*1.2 | C62: =RC[-1]&"*1.5" -> 7713*1.2*1.5 | F62: 4815 | G62: =RC[-1]&"*1.5" -> 4815*1.5 | K62: 2350 | L62: 1060 | M62: 490 | N62: 370 | O62: 183 | Q62: =RC[-6]&"*0.8" -> 2350*0.8 | R62: =RC[-6]&"*0.5" -> 1060*0.5 | S62: =RC[-6]&"*1" -> 490*1 | T62: =RC[-6]&"*1" -> 370*1 | U62: =RC[-6]&"*2" -> 183*2 | X62: 2843*0.5 | Y62: =RC[-1]&"-500" -> 2843*0.5-500 | AA62: 1606 | AB62: =RC[-1]&"-500" -> 1606-500
B63: 7739 | C63: =RC[-1]&"*1.5" -> 7739*1.5 | F63: 4837 | G63: =RC[-1]&"*1.5" -> 4837*1.5 | K63: 2375 | L63: 1075 | M63: 498 | N63: 376 | O63: 186 | Q63: =RC[-6]&"*0.8" -> 2375*0.8 | R63: =RC[-6]&"*0.5" -> 1075*0.5 | S63: =RC[-6]&"*1" -> 498*1 | T63: =RC[-6]&"*1" -> 376*1 | U63: =RC[-6]&"*2" -> 186*2 | X63: 2852*0.5 | Y63: =RC[-1]&"-500" -> 2852*0.5-500 | AA63: 1615 | AB63: =RC[-1]&"-500" -> 1615-500
B64: 7752 | C64: =RC[-1]&"*1.5" -> 7752*1.5 | F64: 4837*1.2 | G64: =RC[-1]&"*1.5" -> 4837*1.2*1.5 | K64: 2400 | L64: 1090 | M64: 506 | N64: 382 | O64: 189 | Q64: =RC[-6]&"*0.8" -> 2400*0.8 | R64: =RC[-6]&"*0.5" -> 1090*0.5 | S64: =RC[-6]&"*1" -> 506*1 | T64: =RC[-6]&"*1" -> 382*1 | U64: =RC[-6]&"*2" -> 189*2 | X64: 2861*0.5 | Y64: =RC[-1]&"-500" -> 2861*0.5-500 | AA64: 1615*0.5 | AB64: =RC[-1]&"-500" -> 1615*0.5-500
B65: 7771 | C65: =RC[-1]&"*1.5" -> 7771*1.5 | F65: 4837 | G65: =RC[-1]&"*1.5" -> 4837*1.5 | K65: 2425 | L65: 1105 | M65: 514 | N65: 388 | O65: 192 | Q65: =RC[-6]&"*0.8" -> 2425*0.8 | R65: =RC[-6]&"*0.5" -> 1105*0.5 | S65: =RC[-6]&"*1" -> 514*1 | T65: =RC[-6]&"*1" -> 388*1 | U65: =RC[-6]&"*2" -> 192*2 | X65: 2869 | Y65: =RC[-1]&"-500" -> 2869-500 | AA65: 1615 | AB65: =RC[-1]&"-500" -> 1615-500
B66: 7790 | C66: =RC[-1]&"*1.5" -> 7790*1.5 | F66: 4859 | G66: =RC[-1]&"*1.5" -> 4859*1.5 | K66: 2450 | L66: 1120 | M66: 522 | N66: 394 | O66: 195 | Q66: =RC[-6]&"*0.8" -> 2450*0.8 | R66: =RC[-6]&"*0.5" -> 1120*0.5 | S66: =RC[-6]&"*1" -> 522*1 | T66: =RC[-6]&"*1" -> 394*1 | U66: =RC[-6]&"*2" -> 195*2 | X66: 2879 | Y66: =RC[-1]&"-500" -> 2879-500 | AA66: 1624 | AB66: =RC[-1]&"-500" -> 1624-500
B67: 7924 | C67: =RC[-1]&"*1.5" -> 7924*1.5 | F67: 4859 | G67: =RC[-1]&"*1.5" -> 4859*1.5 | K67: 2475 | L67: 1135 | M67: 530 | N67: 400 | O67: 198 | Q67: =RC[-6]&"*0.8" -> 2475*0.8 | R67: =RC[-6]&"*0.5" -> 1135*0.5 | S67: =RC[-6]&"*1" -> 530*1 | T67: =RC[-6]&"*1" -> 400*1 | U67: =RC[-6]&"*2" -> 198*2 | X67: 2920 | Y67: =RC[-1]&"-500" -> 2920-500 | AA67: 1624 | AB67: =RC[-1]&"-500" -> 1624-500
B68: 7943 | C68: =RC[-1]&"*1.5" -> 7943*1.5 | F68: 4859*0.8 | G68: =RC[-1]&"*1.5" -> 4859*0.8*1.5 | K68: 2500 | L68: 1150 | M68: 538 | N68: 406 | O68: 201 | Q68: =RC[-6]&"*0.8" -> 2500*0.8 | R68: =RC[-6]&"*0.5" -> 1150*0.5 | S68: =RC[-6]&"*1" -> 538*1 | T68: =RC[-6]&"*1" -> 406*1 | U68: =RC[-6]&"*2" -> 201*2 | X68: 2929*0.5 | Y68: =RC[-1]&"-500" -> 2929*0.5-500 | AA68: 1624*0.5 | AB68: =RC[-1]&"-500" -> 1624*0.5-500
B69: 7962 | C69: =RC[-1]&"*1.5" -> 7962*1.5 | F69: 4859 | G69: =RC[-1]&"*1.5" -> 4859*1.5 | K69: 2525 | L69: 1165 | M69: 546 | N69: 412 | O69: 204 | Q69: =RC[-6]&"*0.8" -> 2525*0.8 | R69: =RC[-6]&"*0.5" -> 1165*0.5 | S69: =RC[-6]&"*1" -> 546*1 | T69: =RC[-6]&"*1" -> 412*1 | U69: =RC[-6]&"*2" -> 204*2 | X69: 2938*0.5 | Y69: =RC[-1]&"-500" -> 2938*0.5-500 | AA69: 1624 | AB69: =RC[-1]&"-500" -> 1624-500
B70: 7981 | C70: =RC[-1]&"*1.5" -> 7981*1.5 | F70: 4954 | G70: =RC[-1]&"*1.5" -> 4954*1.5 | K70: 2550 | L70: 1180 | M70: 554 | N70: 418 | O70: 207 | Q70: =RC[-6]&"*0.8" -> 2550*0.8 | R70: =RC[-6]&"*0.5" -> 1180*0.5 | S70: =RC[-6]&"*1" -> 554*1 | T70: =RC[-6]&"*1" -> 418*1 | U70: =RC[-6]&"*2" -> 207*2 | X70: 2947 | Y70: =RC[-1]&"-500" -> 2947-500 | AA70: 1652*0.5 | AB70: =RC[-1]&"-500" -> 1652*0.5-500
B71: 8000 | C71: =RC[-1]&"*1.5" -> 8000*1.5 | F71: 4954*1.2 | G71: =RC[-1]&"*1.5" -> 4954*1.2*1.5 | K71: 2575 | L71: 1195 | M71: 562 | N71: 424 | O71: 210 | Q71: =RC[-6]&"*0.8" -> 2575*0.8 | R71: =RC[-6]&"*0.5" -> 1195*0.5 | S71: =RC[-6]&"*1" -> 562*1 | T71: =RC[-6]&"*1" -> 424*1 | U71: =RC[-6]&"*2" -> 210*2 | X71: 2957 | Y71: =RC[-1]&"-500" -> 2957-500 | AA71: 1652*0.5 | AB71: =RC[-1]&"-500" -> 1652*0.5-500
B72: 7593 | C72: =RC[-1]&"*1.5" -> 7593*1.5 | F72: 4954 | G72: =RC[-1]&"*1.5" -> 4954*1.5 | K72: 2600 | L72: 1210 | M72: 570 | N72: 430 | O72: 213 | Q72: =RC[-6]&"*0.8" -> 2600*0.8 | R72: =RC[-6]&"*0.5" -> 1210*0.5 | S72: =RC[-6]&"*1" -> 570*1 | T72: =RC[-6]&"*1" -> 430*1 | U72: =RC[-6]&"*2" -> 213*2 | X72: 3052 | Y72: =RC[-1]&"-500" -> 3052-500 | AA72: 1652*0.5 | AB72: =RC[-1]&"-500" -> 1652*0.5-500
B73: 7610 | C73: =RC[-1]&"*1.5" -> 7610*1.5 | F73: 4976*1.2 | G73: =RC[-1]&"*1.5" -> 4976*1.2*1.5 | K73: 2625 | L73: 1225 | M73: 578 | N73: 436 | O73: 216 | Q73: =RC[-6]&"*0.8" -> 2625*0.8 | R73: =RC[-6]&"*0.5" -> 1225*0.5 | S73: =RC[-6]&"*1" -> 578*1 | T73: =RC[-6]&"*1" -> 436*1 | U73: =RC[-6]&"*2" -> 216*2 | X73: 3062 | Y73: =RC[-1]&"-500" -> 3062-500 | AA73: 1661*0.5 | AB73: =RC[-1]&"-500" -> 1661*0.5-500
B74: 7627 | C74: =RC[-1]&"*1.5" -> 7627*1.5 | F74: 4976*0.8 | G74: =RC[-1]&"*1.5" -> 4976*0.8*1.5 | K74: 2650 | L74: 1240 | M74: 586 | N74: 442 | O74: 219 | Q74: =RC[-6]&"*0.8" -> 2650*0.8 | R74: =RC[-6]&"*0.5" -> 1240*0.5 | S74: =RC[-6]&"*1" -> 586*1 | T74: =RC[-6]&"*1" -> 442*1 | U74: =RC[-6]&"*2" -> 219*2 | X74: 3070 | Y74: =RC[-1]&"-500" -> 3070-500 | AA74: 1661*0.5 | AB74: =RC[-1]&"-500" -> 1661*0.5-500
B75: 7644*0.8 | C75: =RC[-1]&"*1.5" -> 7644*0.8*1.5 | F75: 4976 | G75: =RC[-1]&"*1.5" -> 4976*1.5 | K75: 2675 | L75: 1255 | M75: 594 | N75: 448 | O75: 222 | Q75: =RC[-6]&"*0.8" -> 2675*0.8 | R75: =RC[-6]&"*0.5" -> 1255*0.5 | S75: =RC[-6]&"*1" -> 594*1 | T75: =RC[-6]&"*1" -> 448*1 | U75: =RC[-6]&"*2" -> 222*2 | X75: 3079*0.5 | Y75: =RC[-1]&"-500" -> 3079*0.5-500 | AA75: 1661*0.5 | AB75: =RC[-1]&"-500" -> 1661*0.5-500
B76: 7661 | C76: =RC[-1]&"*1.5" -> 7661*1.5 | F76: 4990 | G76: =RC[-1]&"*1.5" -> 4990*1.5 | K76: 2700 | L76: 1270 | M76: 602 | N76: 454 | O76: 225 | Q76: =RC[-6]&"*0.8" -> 2700*0.8 | R76: =RC[-6]&"*0.5" -> 1270*0.5 | S76: =RC[-6]&"*1" -> 602*1 | T76: =RC[-6]&"*1" -> 454*1 | U76: =RC[-6]&"*2" -> 225*2 | X76: 3087 | Y76: =RC[-1]&"-500" -> 3087-500 | AA76: 1670*0.5 | AB76: =RC[-1]&"-500" -> 1670*0.5-500
B77: 7729*1.2 | C77: =RC[-1]&"*1.5" -> 7729*1.2*1.5 | F77: 4990 | G77: =RC[-1]&"*1.5" -> 4990*1.5 | K77: 2725 | L77: 1285 | M77: 610 | N77: 460 | O77: 228 | Q77: =RC[-6]&"*0.8" -> 2725*0.8 | R77: =RC[-6]&"*0.5" -> 1285*0.5 | S77: =RC[-6]&"*1" -> 610*1 | T77: =RC[-6]&"*1" -> 460*1 | U77: =RC[-6]&"*2" -> 228*2 | X77: 3113*0.5 | Y77: =RC[-1]&"-500" -> 3113*0.5-500 | AA77: 1670*0.5 | AB77: =RC[-1]&"-500" -> 1670*0.5-500
B78: 7746 | C78: =RC[-1]&"*1.5" -> 7746*1.5 | F78: 4990 | G78: =RC[-1]&"*1.5" -> 4990*1.5 | K78: 2750 | L78: 1300 | M78: 618 | N78: 466 | O78: 231 | Q78: =RC[-6]&"*0.8" -> 2750*0.8 | R78: =RC[-6]&"*0.5" -> 1300*0.5 | S78: =RC[-6]&"*1" -> 618*1 | T78: =RC[-6]&"*1" -> 466*1 | U78: =RC[-6]&"*2" -> 231*2 | X78: 3121*0.5 | Y78: =RC[-1]&"-500" -> 3121*0.5-500 | AA78: 1670 | AB78: =RC[-1]&"-500" -> 1670-500
B79: 7763 | C79: =RC[-1]&"*1.5" -> 7763*1.5 | F79: 5012 | G79: =RC[-1]&"*1.5" -> 5012*1.5 | K79: 2775 | L79: 1315 | M79: 626 | N79: 472 | O79: 234 | Q79: =RC[-6]&"*0.8" -> 2775*0.8 | R79: =RC[-6]&"*0.5" -> 1315*0.5 | S79: =RC[-6]&"*1" -> 626*1 | T79: =RC[-6]&"*1" -> 472*1 | U79: =RC[-6]&"*2" -> 234*2 | X79: 3130*0.5 | Y79: =RC[-1]&"-500" -> 3130*0.5-500 | AA79: 1678 | AB79: =RC[-1]&"-500" -> 1678-500
B80: 7780 | C80: =RC[-1]&"*1.5" -> 7780*1.5 | F80: 5012*0.8 | G80: =RC[-1]&"*1.5" -> 5012*0.8*1.5 | K80: 2800 | L80: 1330 | M80: 634 | N80: 478 | O80: 237 | Q80: =RC[-6]&"*0.8" -> 2800*0.8 | R80: =RC[-6]&"*0.5" -> 1330*0.5 | S80: =RC[-6]&"*1" -> 634*1 | T80: =RC[-6]&"*1" -> 478*1 | U80: =RC[-6]&"*2" -> 237*2 | X80: 3138 | Y80: =RC[-1]&"-500" -> 3138-500 | AA80: 1678*0.5 | AB80: =RC[-1]&"-500" -> 1678*0.5-500
B81: 7797*0.8 | C81: =RC[-1]&"*1.5" -> 7797*0.8*1.5 | F81: 5034 | G81: =RC[-1]&"*1.5" -> 5034*1.5 | K81: 2825 | L81: 1345 | M81: 642 | N81: 484 | O81: 240 | Q81: =RC[-6]&"*0.8" -> 2825*0.8 | R81: =RC[-6]&"*0.5" -> 1345*0.5 | S81: =RC[-6]&"*1" -> 642*1 | T81: =RC[-6]&"*1" -> 484*1 | U81: =RC[-6]&"*2" -> 240*2 | X81: 3148*0.5 | Y81: =RC[-1]&"-500" -> 3148*0.5-500 | AA81: 1687 | AB81: =RC[-1]&"-500" -> 1687-500
B82: 8290 | C82: =RC[-1]&"*1.5" -> 8290*1.5 | F82: 5034*1.2 | G82: =RC[-1]&"*1.5" -> 5034*1.2*1.5 | K82: 2850 | L82: 1360 | M82: 650 | N82: 490 | O82: 243 | Q82: =RC[-6]&"*0.8" -> 2850*0.8 | R82: =RC[-6]&"*0.5" -> 1360*0.5 | S82: =RC[-6]&"*1" -> 650*1 | T82: =RC[-6]&"*1" -> 490*1 | U82: =RC[-6]&"*2" -> 243*2 | X82: 3329 | Y82: =RC[-1]&"-500" -> 3329-500 | AA82: 1687*0.5 | AB82: =RC[-1]&"-500" -> 1687*0.5-500
B83: 8307 | C83: =RC[-1]&"*1.5" -> 8307*1.5 | F83: 5559 | G83: =RC[-1]&"*1.5" -> 5559*1.5 | K83: 2875 | L83: 1375 | M83: 658 | N83: 496 | O83: 246 | Q83: =RC[-6]&"*0.8" -> 2875*0.8 | R83: =RC[-6]&"*0.5" -> 1375*0.5 | S83: =RC[-6]&"*1" -> 658*1 | T83: =RC[-6]&"*1" -> 496*1 | U83: =RC[-6]&"*2" -> 246*2 | X83: 3338 | Y83: =RC[-1]&"-500" -> 3338-500 | AA83: 1835 | AB83: =RC[-1]&"-500" -> 1835-500
B84: 8324 | C84: =RC[-1]&"*1.5" -> 8324*1.5 | F84: 5559*0.8 | G84: =RC[-1]&"*1.5" -> 5559*0.8*1.5 | K84: 2900 | L84: 1390 | M84: 666 | N84: 502 | O84: 249 | Q84: =RC[-6]&"*0.8" -> 2900*0.8 | R84: =RC[-6]&"*0.5" -> 1390*0.5 | S84: =RC[-6]&"*1" -> 666*1 | T84: =RC[-6]&"*1" -> 502*1 | U84: =RC[-6]&"*2" -> 249*2 | X84: 3348*0.5 | Y84: =RC[-1]&"-500" -> 3348*0.5-500 | AA84: 1835*0.5 | AB84: =RC[-1]&"-500" -> 1835*0.5-500
B85: 8341 | C85: =RC[-1]&"*1.5" -> 8341*1.5 | F85: 5559 | G85: =RC[-1]&"*1.5" -> 5559*1.5 | K85: 2925 | L85: 1405 | M85: 674 | N85: 508 | O85: 252 | Q85: =RC[-6]&"*0.8" -> 2925*0.8 | R85: =RC[-6]&"*0.5" -> 1405*0.5 | S85: =RC[-6]&"*1" -> 674*1 | T85: =RC[-6]&"*1" -> 508*1 | U85: =RC[-6]&"*2" -> 252*2 | X85: 3356 | Y85: =RC[-1]&"-500" -> 3356-500 | AA85: 1835 | AB85: =RC[-1]&"-500" -> 1835-500
B86: 8364 | C86: =RC[-1]&"*1.5" -> 8364*1.5 | F86: 5559 | G86: =RC[-1]&"*1.5" -> 5559*1.5 | K86: 2950 | L86: 1420 | M86: 682 | N86: 514 | O86: 255 | Q86: =RC[-6]&"*0.8" -> 2950*0.8 | R86: =RC[-6]&"*0.5" -> 1420*0.5 | S86: =RC[-6]&"*1" -> 682*1 | T86: =RC[-6]&"*1" -> 514*1 | U86: =RC[-6]&"*2" -> 255*2 | X86: 3365 | Y86: =RC[-1]&"-500" -> 3365-500 | AA86: 1835 | AB86: =RC[-1]&"-500" -> 1835-500
B87: 8437 | C87: =RC[-1]&"*1.5" -> 8437*1.5 | F87: 5580 | G87: =RC[-1]&"*1.5" -> 5580*1.5 | K87: 2975 | L87: 1435 | M87: 690 | N87: 520 | O87: 258 | Q87: =RC[-6]&"*0.8" -> 2975*0.8 | R87: =RC[-6]&"*0.5" -> 1435*0.5 | S87: =RC[-6]&"*1" -> 690*1 | T87: =RC[-6]&"*1" -> 520*1 | U87: =RC[-6]&"*2" -> 258*2 | X87: 3392*0.5 | Y87: =RC[-1]&"-500" -> 3392*0.5-500 | AA87: 1844 | AB87: =RC[-1]&"-500" -> 1844-500
B88: 8454 | C88: =RC[-1]&"*1.5" -> 8454*1.5 | F88: 5580 | G88: =RC[-1]&"*1.5" -> 5580*1.5 | K88: 3000 | L88: 1450 | M88: 698 | N88: 526 | O88: 261 | Q88: =RC[-6]&"*0.8" -> 3000*0.8 | R88: =RC[-6]&"*0.5" -> 1450*0.5 | S88: =RC[-6]&"*1" -> 698*1 | T88: =RC[-6]&"*1" -> 526*1 | U88: =RC[-6]&"*2" -> 261*2 | X88: 3400 | Y88: =RC[-1]&"-500" -> 3400-500 | AA88: 1844*0.5 | AB88: =RC[-1]&"-500" -> 1844*0.5-500
B89: 8471 | C89: =RC[-1]&"*1.5" -> 8471*1.5 | F89: 5580 | G89: =RC[-1]&"*1.5" -> 5580*1.5 | K89: 3025 | L89: 1465 | M89: 706 | N89: 532 | O89: 264 | Q89: =RC[-6]&"*0.8" -> 3025*0.8 | R89: =RC[-6]&"*0.5" -> 1465*0.5 | S89: =RC[-6]&"*1" -> 706*1 | T89: =RC[-6]&"*1" -> 532*1 | U89: =RC[-6]&"*2" -> 264*2 | X89: 3409*0.5 | Y89: =RC[-1]&"-500" -> 3409*0.5-500 | AA89: 1844 | AB89: =RC[-1]&"-500" -> 1844-500
B90: 8488 | C90: =RC[-1]&"*1.5" -> 8488*1.5 | F90: 5595 | G90: =RC[-1]&"*1.5" -> 5595*1.5 | K90: 3050 | L90: 1480 | M90: 714 | N90: 538 | O90: 267 | Q90: =RC[-6]&"*0.8" -> 3050*0.8 | R90: =RC[-6]&"*0.5" -> 1480*0.5 | S90: =RC[-6]&"*1" -> 714*1 | T90: =RC[-6]&"*1" -> 538*1 | U90: =RC[-6]&"*2" -> 267*2 | X90: 3418 | Y90: =RC[-1]&"-500" -> 3418-500 | AA90: 1853*0.5 | AB90: =RC[-1]&"-500" -> 1853*0.5-500
B91: 8505*0.8 | C91: =RC[-1]&"*1.5" -> 8505*0.8*1.5 | F91: 5595 | G91: =RC[-1]&"*1.5" -> 5595*1.5 | K91: 3075 | L91: 1495 | M91: 722 | N91: 544 | O91: 270 | Q91: =RC[-6]&"*0.8" -> 3075*0.8 | R91: =RC[-6]&"*0.5" -> 1495*0.5 | S91: =RC[-6]&"*1" -> 722*1 | T91: =RC[-6]&"*1" -> 544*1 | U91: =RC[-6]&"*2" -> 270*2 | X91: 3427*0.5 | Y91: =RC[-1]&"-500" -> 3427*0.5-500 | AA91: 1853*0.5 | AB91: =RC[-1]&"-500" -> 1853*0.5-500
B92: 8175*1.2 | C92: =RC[-1]&"*1.5" -> 8175*1.2*1.5 | F92: 5595 | G92: =RC[-1]&"*1.5" -> 5595*1.5 | K92: 3100 | L92: 1510 | M92: 730 | N92: 550 | O92: 273 | Q92: =RC[-6]&"*0.8" -> 3100*0.8 | R92: =RC[-6]&"*0.5" -> 1510*0.5 | S92: =RC[-6]&"*1" -> 730*1 | T92: =RC[-6]&"*1" -> 550*1 | U92: =RC[-6]&"*2" -> 273*2 | X92: 3549*0.5 | Y92: =RC[-1]&"-500" -> 3549*0.5-500 | AA92: 1853 | AB92: =RC[-1]&"-500" -> 1853-500
B93: 8195 | C93: =RC[-1]&"*1.5" -> 8195*1.5 | F93: 5617*0.8 | G93: =RC[-1]&"*1.5" -> 5617*0.8*1.5 | K93: 3125 | L93: 1525 | M93: 738 | N93: 556 | O93: 276 | Q93: =RC[-6]&"*0.8" -> 3125*0.8 | R93: =RC[-6]&"*0.5" -> 1525*0.5 | S93: =RC[-6]&"*1" -> 738*1 | T93: =RC[-6]&"*1" -> 556*1 | U93: =RC[-6]&"*2" -> 276*2 | X93: 3558*0.5 | Y93: =RC[-1]&"-500" -> 3558*0.5-500 | AA93: 1862*0.5 | AB93: =RC[-1]&"-500" -> 1862*0.5-500
B94: 8211 | C94: =RC[-1]&"*1.5" -> 8211*1.5 | F94: 5617 | G94: =RC[-1]&"*1.5" -> 5617*1.5 | K94: 3150 | L94: 1540 | M94: 746 | N94: 562 | O94: 279 | Q94: =RC[-6]&"*0.8" -> 3150*0.8 | R94: =RC[-6]&"*0.5" -> 1540*0.5 | S94: =RC[-6]&"*1" -> 746*1 | T94: =RC[-6]&"*1" -> 562*1 | U94: =RC[-6]&"*2" -> 279*2 | X94: 3567*0.5 | Y94: =RC[-1]&"-500" -> 3567*0.5-500 | AA94: 1862 | AB94: =RC[-1]&"-500" -> 1862-500
B95: 8226 | C95: =RC[-1]&"*1.5" -> 8226*1.5 | F95: 5617 | G95: =RC[-1]&"*1.5" -> 5617*1.5 | K95: 3175 | L95: 1555 | M95: 754 | N95: 568 | O95: 282 | Q95: =RC[-6]&"*0.8" -> 3175*0.8 | R95: =RC[-6]&"*0.5" -> 1555*0.5 | S95: =RC[-6]&"*1" -> 754*1 | T95: =RC[-6]&"*1" -> 568*1 | U95: =RC[-6]&"*2" -> 282*2 | X95: 3575 | Y95: =RC[-1]&"-500" -> 3575-500 | AA95: 1862 | AB95: =RC[-1]&"-500" -> 1862-500
B96: 8241 | C96: =RC[-1]&"*1.5" -> 8241*1.5 | F96: 5639 | G96: =RC[-1]&"*1.5" -> 5639*1.5 | K96: 3200 | L96: 1570 | M96: 762 | N96: 574 | O96: 285 | Q96: =RC[-6]&"*0.8" -> 3200*0.8 | R96: =RC[-6]&"*0.5" -> 1570*0.5 | S96: =RC[-6]&"*1" -> 762*1 | T96: =RC[-6]&"*1" -> 574*1 | U96: =RC[-6]&"*2" -> 285*2 | X96: 3584 | Y96: =RC[-1]&"-500" -> 3584-500 | AA96: 1871 | AB96: =RC[-1]&"-500" -> 1871-500
B97: 8262*1.2 | C97: =RC[-1]&"*1.5" -> 8262*1.2*1.5 | F97: 5639*0.8 | G97: =RC[-1]&"*1.5" -> 5639*0.8*1.5 | K97: 3225 | L97: 1585 | M97: 770 | N97: 580 | O97: 288 | Q97: =RC[-6]&"*0.8" -> 3225*0.8 | R97: =RC[-6]&"*0.5" -> 1585*0.5 | S97: =RC[-6]&"*1" -> 770*1 | T97: =RC[-6]&"*1" -> 580*1 | U97: =RC[-6]&"*2" -> 288*2 | X97: 3592*0.5 | Y97: =RC[-1]&"-500" -> 3592*0.5-500 | AA97: 1871*0.5 | AB97: =RC[-1]&"-500" -> 1871*0.5-500
B98: 8277 | C98: =RC[-1]&"*1.5" -> 8277*1.5 | F98: 5639*1.2 | G98: =RC[-1]&"*1.5" -> 5639*1.2*1.5 | K98: 3250 | L98: 1600 | M98: 778 | N98: 586 | O98: 291 | Q98: =RC[-6]&"*0.8" -> 3250*0.8 | R98: =RC[-6]&"*0.5" -> 1600*0.5 | S98: =RC[-6]&"*1" -> 778*1 | T98: =RC[-6]&"*1" -> 586*1 | U98: =RC[-6]&"*2" -> 291*2 | X98: 3601*0.5 | Y98: =RC[-1]&"-500" -> 3601*0.5-500 | AA98: 1871*0.5 | AB98: =RC[-1]&"-500" -> 1871*0.5-500
B99: 8292*0.8 | C99: =RC[-1]&"*1.5" -> 8292*0.8*1.5 | F99: 5741*1.2 | G99: =RC[-1]&"*1.5" -> 5741*1.2*1.5 | K99: 3275 | L99: 1615 | M99: 786 | N99: 592 | O99: 294 | Q99: =RC[-6]&"*0.8" -> 3275*0.8 | R99: =RC[-6]&"*0.5" -> 1615*0.5 | S99: =RC[-6]&"*1" -> 786*1 | T99: =RC[-6]&"*1" -> 592*1 | U99: =RC[-6]&"*2" -> 294*2 | X99: 3610*0.5 | Y99: =RC[-1]&"-500" -> 3610*0.5-500 | AA99: 1901*0.5 | AB99: =RC[-1]&"-500" -> 1901*0.5-500
B100: 8307 | C100: =RC[-1]&"*1.5" -> 8307*1.5 | F100: 5741*0.8 | G100: =RC[-1]&"*1.5" -> 5741*0.8*1.5 | K100: 3300 | L100: 1630 | M100: 794 | N100: 598 | O100: 297 | Q100: =RC[-6]&"*0.8" -> 3300*0.8 | R100: =RC[-6]&"*0.5" -> 1630*0.5 | S100: =RC[-6]&"*1" -> 794*1 | T100: =RC[-6]&"*1" -> 598*1 | U100: =RC[-6]&"*2" -> 297*2 | X100: 3618 | Y100: =RC[-1]&"-500" -> 3618-500 | AA100: 1901*0.5 | AB100: =RC[-1]&"-500" -> 1901*0.5-500
B101: 8328 | C101: =RC[-1]&"*1.5" -> 8328*1.5 | F101: 5741 | G101: =RC[-1]&"*1.5" -> 5741*1.5 | K101: 3325 | L101: 1645 | M101: 802 | N101: 604 | O101: 300 | Q101: =RC[-6]&"*0.8" -> 3325*0.8 | R101: =RC[-6]&"*0.5" -> 1645*0.5 | S101: =RC[-6]&"*1" -> 802*1 | T101: =RC[-6]&"*1" -> 604*1 | U101: =RC[-6]&"*2" -> 300*2 | X101: 3627 | Y101: =RC[-1]&"-500" -> 3627-500 | AA101: 1901*0.5 | AB101: =RC[-1]&"-500" -> 1901*0.5-500
F102: 5741 | G102: =RC[-1]&"*1.5" -> 5741*1.5 | AA102: 1901 | AB102: =RC[-1]&"-500" -> 1901-500
F103: 5763 | G103: =RC[-1]&"*1.5" -> 5763*1.5 | AA103: 1910 | AB103: =RC[-1]&"-500" -> 1910-500
F104: 5763 | G104: =RC[-1]&"*1.5" -> 5763*1.5 | AA104: 1910 | AB104: =RC[-1]&"-500" -> 1910-500
F105: 5784 | G105: =RC[-1]&"*1.5" -> 5784*1.5 | AA105: 1919*0.5 | AB105: =RC[-1]&"-500" -> 1919*0.5-500
F106: 5784 | G106: =RC[-1]&"*1.5" -> 5784*1.5 | AA106: 1919 | AB106: =RC[-1]&"-500" -> 1919-500
F107: 5784 | G107: =RC[-1]&"*1.5" -> 5784*1.5 | AA107: 1919 | AB107: =RC[-1]&"-500" -> 1919-500
F108: 5799 | G108: =RC[-1]&"*1.5" -> 5799*1.5 | AA108: 1928 | AB108: =RC[-1]&"-500" -> 1928-500
F109: 5799 | G109: =RC[-1]&"*1.5" -> 5799*1.5 | AA109: 1928 | AB109: =RC[-1]&"-500" -> 1928-500
F110: 5821 | G110: =RC[-1]&"*1.5" -> 5821*1.5 | AA110: 1937 | AB110: =RC[-1]&"-500" -> 1937-500
F111: 5821*0.8 | G111: =RC[-1]&"*1.5" -> 5821*0.8*1.5 | AA111: 1937*0.5 | AB111: =RC[-1]&"-500" -> 1937*0.5-500
F112: 5821 | G112: =RC[-1]&"*1.5" -> 5821*1.5 | AA112: 1937 | AB112: =RC[-1]&"-500" -> 1937-500
F113: 5821 | G113: =RC[-1]&"*1.5" -> 5821*1.5 | AA113: 1937 | AB113: =RC[-1]&"-500" -> 1937-500
F114: 5686 | G114: =RC[-1]&"*1.5" -> 5686*1.5 | AA114: 2119*0.5 | AB114: =RC[-1]&"-500" -> 2119*0.5-500
F115: 5686*1.2 | G115: =RC[-1]&"*1.5" -> 5686*1.2*1.5 | AA115: 2119*0.5 | AB115: =RC[-1]&"-500" -> 2119*0.5-500
F116: 5686 | G116: =RC[-1]&"*1.5" -> 5686*1.5 | AA116: 2119*0.5 | AB116: =RC[-1]&"-500" -> 2119*0.5-500
F117: 5686 | G117: =RC[-1]&"*1.5" -> 5686*1.5 | AA117: 2119*0.5 | AB117: =RC[-1]&"-500" -> 2119*0.5-500
F118: 5705 | G118: =RC[-1]&"*1.5" -> 5705*1.5 | AA118: 2127*0.5 | AB118: =RC[-1]&"-500" -> 2127*0.5-500
F119: 5705 | G119: =RC[-1]&"*1.5" -> 5705*1.5 | AA119: 2127 | AB119: =RC[-1]&"-500" -> 2127-500
F120: 5705 | G120: =RC[-1]&"*1.5" -> 5705*1.5 | AA120: 2127 | AB120: =RC[-1]&"-500" -> 2127-500
F121: 5724 | G121: =RC[-1]&"*1.5" -> 5724*1.5 | AA121: 2136*0.5 | AB121: =RC[-1]&"-500" -> 2136*0.5-500
F122: 5724*1.2 | G122: =RC[-1]&"*1.5" -> 5724*1.2*1.5 | AA122: 2136*0.5 | AB122: =RC[-1]&"-500" -> 2136*0.5-500
F123: 5724 | G123: =RC[-1]&"*1.5" -> 5724*1.5 | AA123: 2136 | AB123: =RC[-1]&"-500" -> 2136-500
F124: 5743 | G124: =RC[-1]&"*1.5" -> 5743*1.5 | AA124: 2144 | AB124: =RC[-1]&"-500" -> 2144-500
F125: 5743*1.2 | G125: =RC[-1]&"*1.5" -> 5743*1.2*1.5 | AA125: 2144*0.5 | AB125: =RC[-1]&"-500" -> 2144*0.5-500
F126: 5743*0.8 | G126: =RC[-1]&"*1.5" -> 5743*0.8*1.5 | AA126: 2144*0.5 | AB126: =RC[-1]&"-500" -> 2144*0.5-500
F127: 5763 | G127: =RC[-1]&"*1.5" -> 5763*1.5 | AA127: 2153 | AB127: =RC[-1]&"-500" -> 2153-500
F128: 5763*0.8 | G128: =RC[-1]&"*1.5" -> 5763*0.8*1.5 | AA128: 2153*0.5 | AB128: =RC[-1]&"-500" -> 2153*0.5-500
F129: 5858 | G129: =RC[-1]&"*1.5" -> 5858*1.5 | AA129: 2184 | AB129: =RC[-1]&"-500" -> 2184-500
F130: 5858*1.2 | G130: =RC[-1]&"*1.5" -> 5858*1.2*1.5 | AA130: 2184*0.5 | AB130: =RC[-1]&"-500" -> 2184*0.5-500
F131: 5877 | G131: =RC[-1]&"*1.5" -> 5877*1.5 | AA131: 2193*0.5 | AB131: =RC[-1]&"-500" -> 2193*0.5-500
F132: 5877*0.8 | G132: =RC[-1]&"*1.5" -> 5877*0.8*1.5 | AA132: 2193*0.5 | AB132: =RC[-1]&"-500" -> 2193*0.5-500
F133: 5877 | G133: =RC[-1]&"*1.5" -> 5877*1.5 | AA133: 2193 | AB133: =RC[-1]&"-500" -> 2193-500
F134: 5896*0.8 | G134: =RC[-1]&"*1.5" -> 5896*0.8*1.5 | AA134: 2201*0.5 | AB134: =RC[-1]&"-500" -> 2201*0.5-500
F135: 5896 | G135: =RC[-1]&"*1.5" -> 5896*1.5 | AA135: 2201 | AB135: =RC[-1]&"-500" -> 2201-500
F136: 5896 | G136: =RC[-1]&"*1.5" -> 5896*1.5 | AA136: 2201 | AB136: =RC[-1]&"-500" -> 2201-500
F137: 5909 | G137: =RC[-1]&"*1.5" -> 5909*1.5 | AA137: 2210 | AB137: =RC[-1]&"-500" -> 2210-500
F138: 5909*0.8 | G138: =RC[-1]&"*1.5" -> 5909*0.8*1.5 | AA138: 2210*0.5 | AB138: =RC[-1]&"-500" -> 2210*0.5-500
F139: 5909 | G139: =RC[-1]&"*1.5" -> 5909*1.5 | AA139: 2210 | AB139: =RC[-1]&"-500" -> 2210-500
F140: 5935 | G140: =RC[-1]&"*1.5" -> 5935*1.5 | AA140: 2219 | AB140: =RC[-1]&"-500" -> 2219-500
F141: 5935*0.8 | G141: =RC[-1]&"*1.5" -> 5935*0.8*1.5 | AA141: 2219*0.5 | AB141: =RC[-1]&"-500" -> 2219*0.5-500
F142: 5935 | G142: =RC[-1]&"*1.5" -> 5935*1.5 | AA142: 2219 | AB142: =RC[-1]&"-500" -> 2219-500
F143: 9120 | G143: =RC[-1]&"*1.5" -> 9120*1.5 | AA143: 2756 | AB143: =RC[-1]&"-500" -> 2756-500
F144: 9146 | G144: =RC[-1]&"*1.5" -> 9146*1.5 | AA144: 2766 | AB144: =RC[-1]&"-500" -> 2766-500
F145: 9171 | G145: =RC[-1]&"*1.5" -> 9171*1.5 | AA145: 2776 | AB145: =RC[-1]&"-500" -> 2776-500
F146: 9171 | G146: =RC[-1]&"*1.5" -> 9171*1.5 | AA146: 2776 | AB146: =RC[-1]&"-500" -> 2776-500
F147: 6897*1.2 | G147: =RC[-1]&"*1.5" -> 6897*1.2*1.5 | AA147: 2562*0.5 | AB147: =RC[-1]&"-500" -> 2562*0.5-500
F148: 6897 | G148: =RC[-1]&"*1.5" -> 6897*1.5 | AA148: 2562 | AB148: =RC[-1]&"-500" -> 2562-500
F149: 6916*1.2 | G149: =RC[-1]&"*1.5" -> 6916*1.2*1.5 | AA149: 2571*0.5 | AB149: =RC[-1]&"-500" -> 2571*0.5-500
F150: 6916 | G150: =RC[-1]&"*1.5" -> 6916*1.5 | AA150: 2571*0.5 | AB150: =RC[-1]&"-500" -> 2571*0.5-500
F151: 6916 | G151: =RC[-1]&"*1.5" -> 6916*1.5 | AA151: 2571 | AB151: =RC[-1]&"-500" -> 2571-500
F152: 7044 | G152: =RC[-1]&"*1.5" -> 7044*1.5 | AA152: 2611*0.5 | AB152: =RC[-1]&"-500" -> 2611*0.5-500
F153: 7044 | G153: =RC[-1]&"*1.5" -> 7044*1.5 | AA153: 2611 | AB153: =RC[-1]&"-500" -> 2611-500
F154: 7063 | G154: =RC[-1]&"*1.5" -> 7063*1.5 | AA154: 2620*0.5 | AB154: =RC[-1]&"-500" -> 2620*0.5-500
F155: 7063 | G155: =RC[-1]&"*1.5" -> 7063*1.5 | AA155: 2620 | AB155: =RC[-1]&"-500" -> 2620-500
F156: 7082 | G156: =RC[-1]&"*1.5" -> 7082*1.5 | AA156: 2629*0.5 | AB156: =RC[-1]&"-500" -> 2629*0.5-500
F157: 7082*1.2 | G157: =RC[-1]&"*1.5" -> 7082*1.2*1.5 | AA157: 2629*0.5 | AB157: =RC[-1]&"-500" -> 2629*0.5-500
F158: 7082 | G158: =RC[-1]&"*1.5" -> 7082*1.5 | AA158: 2629*0.5 | AB158: =RC[-1]&"-500" -> 2629*0.5-500
F159: 7095 | G159: =RC[-1]&"*1.5" -> 7095*1.5 | AA159: 2638 | AB159: =RC[-1]&"-500" -> 2638-500
F160: 7095*1.2 | G160: =RC[-1]&"*1.5" -> 7095*1.2*1.5 | AA160: 2638*0.5 | AB160: =RC[-1]&"-500" -> 2638*0.5-500
F161: 7095 | G161: =RC[-1]&"*1.5" -> 7095*1.5 | AA161: 2638 | AB161: =RC[-1]&"-500" -> 2638-500
F162: 7120*0.8 | G162: =RC[-1]&"*1.5" -> 7120*0.8*1.5 | AA162: 2647*0.5 | AB162: =RC[-1]&"-500" -> 2647*0.5-500
F163: 7120 | G163: =RC[-1]&"*1.5" -> 7120*1.5 | AA163: 2647 | AB163: =RC[-1]&"-500" -> 2647-500
F164: 7120 | G164: =RC[-1]&"*1.5" -> 7120*1.5 | AA164: 2647 | AB164: =RC[-1]&"-500" -> 2647-500
F165: 7713 | G165: =RC[-1]&"*1.5" -> 7713*1.5 | AA165: 2843*0.5 | AB165: =RC[-1]&"-500" -> 2843*0.5-500
F166: 7713*1.2 | G166: =RC[-1]&"*1.5" -> 7713*1.2*1.5 | AA166: 2843*0.5 | AB166: =RC[-1]&"-500" -> 2843*0.5-500
F167: 7713 | G167: =RC[-1]&"*1.5" -> 7713*1.5 | AA167: 2843*0.5 | AB167: =RC[-1]&"-500" -> 2843*0.5-500
F168: 7739 | G168: =RC[-1]&"*1.5" -> 7739*1.5 | AA168: 2852*0.5 | AB168: =RC[-1]&"-500" -> 2852*0.5-500
F169: 7739 | G169: =RC[-1]&"*1.5" -> 7739*1.5 | AA169: 2852 | AB169: =RC[-1]&"-500" -> 2852-500
F170: 7739 | G170: =RC[-1]&"*1.5" -> 7739*1.5 | AA170: 2852 | AB170: =RC[-1]&"-500" -> 2852-500
F171: 7752 | G171: =RC[-1]&"*1.5" -> 7752*1.5 | AA171: 2861*0.5 | AB171: =RC[-1]&"-500" -> 2861*0.5-500
F172: 7752*1.2 | G172: =RC[-1]&"*1.5" -> 7752*1.2*1.5 | AA172: 2861*0.5 | AB172: =RC[-1]&"-500" -> 2861*0.5-500
F173: 7752 | G173: =RC[-1]&"*1.5" -> 7752*1.5 | AA173: 2861 | AB173: =RC[-1]&"-500" -> 2861-500
F174: 7771 | G174: =RC[-1]&"*1.5" -> 7771*1.5 | AA174: 2869 | AB174: =RC[-1]&"-500" -> 2869-500
F175: 7771*1.2 | G175: =RC[-1]&"*1.5" -> 7771*1.2*1.5 | AA175: 2869*0.5 | AB175: =RC[-1]&"-500" -> 2869*0.5-500
F176: 7771*0.8 | G176: =RC[-1]&"*1.5" -> 7771*0.8*1.5 | AA176: 2869*0.5 | AB176: =RC[-1]&"-500" -> 2869*0.5-500
F177: 7771 | G177: =RC[-1]&"*1.5" -> 7771*1.5 | AA177: 2869 | AB177: =RC[-1]&"-500" -> 2869-500
F178: 7790 | G178: =RC[-1]&"*1.5" -> 7790*1.5 | AA178: 2879 | AB178: =RC[-1]&"-500" -> 2879-500
F179: 7790 | G179: =RC[-1]&"*1.5" -> 7790*1.5 | AA179: 2879 | AB179: =RC[-1]&"-500" -> 2879-500
F180: 7790 | G180: =RC[-1]&"*1.5" -> 7790*1.5 | AA180: 2879 | AB180: =RC[-1]&"-500" -> 2879-500
F181: 7924*1.2 | G181: =RC[-1]&"*1.5" -> 7924*1.2*1.5 | AA181: 2920*0.5 | AB181: =RC[-1]&"-500" -> 2920*0.5-500
F182: 7924 | G182: =RC[-1]&"*1.5" -> 7924*1.5 | AA182: 2920*0.5 | AB182: =RC[-1]&"-500" -> 2920*0.5-500
F183: 7924 | G183: =RC[-1]&"*1.5" -> 7924*1.5 | AA183: 2920 | AB183: =RC[-1]&"-500" -> 2920-500
F184: 7943 | G184: =RC[-1]&"*1.5" -> 7943*1.5 | AA184: 2929*0.5 | AB184: =RC[-1]&"-500" -> 2929*0.5-500
F185: 7943 | G185: =RC[-1]&"*1.5" -> 7943*1.5 | AA185: 2929 | AB185: =RC[-1]&"-500" -> 2929-500
F186: 7943*0.8 | G186: =RC[-1]&"*1.5" -> 7943*0.8*1.5 | AA186: 2929*0.5 | AB186: =RC[-1]&"-500" -> 2929*0.5-500
F187: 7962 | G187: =RC[-1]&"*1.5" -> 7962*1.5 | AA187: 2938 | AB187: =RC[-1]&"-500" -> 2938-500
F188: 7962 | G188: =RC[-1]&"*1.5" -> 7962*1.5 | AA188: 2938*0.5 | AB188: =RC[-1]&"-500" -> 2938*0.5-500
F189: 7962 | G189: =RC[-1]&"*1.5" -> 7962*1.5 | AA189: 2938 | AB189: =RC[-1]&"-500" -> 2938-500
F190: 7981 | G190: =RC[-1]&"*1.5" -> 7981*1.5 | AA190: 2947 | AB190: =RC[-1]&"-500" -> 2947-500
F191: 7981 | G191: =RC[-1]&"*1.5" -> 7981*1.5 | AA191: 2947 | AB191: =RC[-1]&"-500" -> 2947-500
F192: 8000 | G192: =RC[-1]&"*1.5" -> 8000*1.5 | AA192: 2957 | AB192: =RC[-1]&"-500" -> 2957-500
F193: 8000 | G193: =RC[-1]&"*1.5" -> 8000*1.5 | AA193: 2957 | AB193: =RC[-1]&"-500" -> 2957-500
F194: 8000*0.8 | G194: =RC[-1]&"*1.5" -> 8000*0.8*1.5 | AA194: 2957*0.5 | AB194: =RC[-1]&"-500" -> 2957*0.5-500
F195: 7593 | G195: =RC[-1]&"*1.5" -> 7593*1.5 | AA195: 3052 | AB195: =RC[-1]&"-500" -> 3052-500
F196: 7593 | G196: =RC[-1]&"*1.5" -> 7593*1.5 | AA196: 3052 | AB196: =RC[-1]&"-500" -> 3052-500
F197: 7593*1.2 | G197: =RC[-1]&"*1.5" -> 7593*1.2*1.5 | AA197: 3052*0.5 | AB197: =RC[-1]&"-500" -> 3052*0.5-500
F198: 7610*0.8 | G198: =RC[-1]&"*1.5" -> 7610*0.8*1.5 | AA198: 3062*0.5 | AB198: =RC[-1]&"-500" -> 3062*0.5-500
F199: 7610 | G199: =RC[-1]&"*1.5" -> 7610*1.5 | AA199: 3062 | AB199: =RC[-1]&"-500" -> 3062-500
F200: 7610 | G200: =RC[-1]&"*1.5" -> 7610*1.5 | AA200: 3062 | AB200: =RC[-1]&"-500" -> 3062-500
F201: 7627 | G201: =RC[-1]&"*1.5" -> 7627*1.5 | AA201: 3070*0.5 | AB201: =RC[-1]&"-500" -> 3070*0.5-500
F202: 7627 | G202: =RC[-1]&"*1.5" -> 7627*1.5 | AA202: 3070 | AB202: =RC[-1]&"-500" -> 3070-500
F203: 7627 | G203: =RC[-1]&"*1.5" -> 7627*1.5 | AA203: 3070 | AB203: =RC[-1]&"-500" -> 3070-500
F204: 7644 | G204: =RC[-1]&"*1.5" -> 7644*1.5 | AA204: 3079 | AB204: =RC[-1]&"-500" -> 3079-500
F205: 7644*1.2 | G205: =RC[-1]&"*1.5" -> 7644*1.2*1.5 | AA205: 3079*0.5 | AB205: =RC[-1]&"-500" -> 3079*0.5-500
F206: 7644 | G206: =RC[-1]&"*1.5" -> 7644*1.5 | AA206: 3079 | AB206: =RC[-1]&"-500" -> 3079-500
F207: 7661 | G207: =RC[-1]&"*1.5" -> 7661*1.5 | AA207: 3087 | AB207: =RC[-1]&"-500" -> 3087-500
F208: 7661 | G208: =RC[-1]&"*1.5" -> 7661*1.5 | AA208: 3087 | AB208: =RC[-1]&"-500" -> 3087-500
F209: 7661*0.8 | G209: =RC[-1]&"*1.5" -> 7661*0.8*1.5 | AA209: 3087*0.5 | AB209: =RC[-1]&"-500" -> 3087*0.5-500
F210: 7661 | G210: =RC[-1]&"*1.5" -> 7661*1.5 | AA210: 3087 | AB210: =RC[-1]&"-500" -> 3087-500
F211: 7729 | G211: =RC[-1]&"*1.5" -> 7729*1.5 | AA211: 3113*0.5 | AB211: =RC[-1]&"-500" -> 3113*0.5-500
F212: 7729*1.2 | G212: =RC[-1]&"*1.5" -> 7729*1.2*1.5 | AA212: 3113*0.5 | AB212: =RC[-1]&"-500" -> 3113*0.5-500
F213: 7729 | G213: =RC[-1]&"*1.5" -> 7729*1.5 | AA213: 3113*0.5 | AB213: =RC[-1]&"-500" -> 3113*0.5-500
F214: 7746*1.2 | G214: =RC[-1]&"*1.5" -> 7746*1.2*1.5 | AA214: 3121*0.5 | AB214: =RC[-1]&"-500" -> 3121*0.5-500
F215: 7746*0.8 | G215: =RC[-1]&"*1.5" -> 7746*0.8*1.5 | AA215: 3121*0.5 | AB215: =RC[-1]&"-500" -> 3121*0.5-500
F216: 7746 | G216: =RC[-1]&"*1.5" -> 7746*1.5 | AA216: 3121*0.5 | AB216: =RC[-1]&"-500" -> 3121*0.5-500
F217: 7763 | G217: =RC[-1]&"*1.5" -> 7763*1.5 | AA217: 3130*0.5 | AB217: =RC[-1]&"-500" -> 3130*0.5-500
F218: 7763 | G218: =RC[-1]&"*1.5" -> 7763*1.5 | AA218: 3130*0.5 | AB218: =RC[-1]&"-500" -> 3130*0.5-500
F219: 7763 | G219: =RC[-1]&"*1.5" -> 7763*1.5 | AA219: 3130 | AB219: =RC[-1]&"-500" -> 3130-500
F220: 7780 | G220: =RC[-1]&"*1.5" -> 7780*1.5 | AA220: 3138 | AB220: =RC[-1]&"-500" -> 3138-500
F221: 7780*0.8 | G221: =RC[-1]&"*1.5" -> 7780*0.8*1.5 | AA221: 3138*0.5 | AB221: =RC[-1]&"-500" -> 3138*0.5-500
F222: 7797 | G222: =RC[-1]&"*1.5" -> 7797*1.5 | AA222: 3148 | AB222: =RC[-1]&"-500" -> 3148-500
F223: 7797*1.2 | G223: =RC[-1]&"*1.5" -> 7797*1.2*1.5 | AA223: 3148*0.5 | AB223: =RC[-1]&"-500" -> 3148*0.5-500
F224: 8290 | G224: =RC[-1]&"*1.5" -> 8290*1.5 | AA224: 3329 | AB224: =RC[-1]&"-500" -> 3329-500
F225: 8290*0.8 | G225: =RC[-1]&"*1.5" -> 8290*0.8*1.5 | AA225: 3329*0.5 | AB225: =RC[-1]&"-500" -> 3329*0.5-500
F226: 8290 | G226: =RC[-1]&"*1.5" -> 8290*1.5 | AA226: 3329 | AB226: =RC[-1]&"-500" -> 3329-500
F227: 8290 | G227: =RC[-1]&"*1.5" -> 8290*1.5 | AA227: 3329 | AB227: =RC[-1]&"-500" -> 3329-500
F228: 8307 | G228: =RC[-1]&"*1.5" -> 8307*1.5 | AA228: 3338 | AB228: =RC[-1]&"-500" -> 3338-500
F229: 8307 | G229: =RC[-1]&"*1.5" -> 8307*1.5 | AA229: 3338*0.5 | AB229: =RC[-1]&"-500" -> 3338*0.5-500
F230: 8307 | G230: =RC[-1]&"*1.5" -> 8307*1.5 | AA230: 3338 | AB230: =RC[-1]&"-500" -> 3338-500
F231: 8324 | G231: =RC[-1]&"*1.5" -> 8324*1.5 | AA231: 3348*0.5 | AB231: =RC[-1]&"-500" -> 3348*0.5-500
F232: 8324 | G232: =RC[-1]&"*1.5" -> 8324*1.5 | AA232: 3348*0.5 | AB232: =RC[-1]&"-500" -> 3348*0.5-500
F233: 8324 | G233: =RC[-1]&"*1.5" -> 8324*1.5 | AA233: 3348 | AB233: =RC[-1]&"-500" -> 3348-500
F234: 8341*0.8 | G234: =RC[-1]&"*1.5" -> 8341*0.8*1.5 | AA234: 3356*0.5 | AB234: =RC[-1]&"-500" -> 3356*0.5-500
F235: 8341 | G235: =RC[-1]&"*1.5" -> 8341*1.5 | AA235: 3356 | AB235: =RC[-1]&"-500" -> 3356-500
F236: 8341 | G236: =RC[-1]&"*1.5" -> 8341*1.5 | AA236: 3356 | AB236: =RC[-1]&"-500" -> 3356-500
F237: 8364 | G237: =RC[-1]&"*1.5" -> 8364*1.5 | AA237: 3365 | AB237: =RC[-1]&"-500" -> 3365-500
F238: 8364*0.8 | G238: =RC[-1]&"*1.5" -> 8364*0.8*1.5 | AA238: 3365*0.5 | AB238: =RC[-1]&"-500" -> 3365*0.5-500
F239: 8364*1.2 | G239: =RC[-1]&"*1.5" -> 8364*1.2*1.5 | AA239: 3365*0.5 | AB239: =RC[-1]&"-500" -> 3365*0.5-500
F240: 8437*1.2 | G240: =RC[-1]&"*1.5" -> 8437*1.2*1.5 | AA240: 3392*0.5 | AB240: =RC[-1]&"-500" -> 3392*0.5-500
F241: 8437*0.8 | G241: =RC[-1]&"*1.5" -> 8437*0.8*1.5 | AA241: 3392*0.5 | AB241: =RC[-1]&"-500" -> 3392*0.5-500
F242: 8437 | G242: =RC[-1]&"*1.5" -> 8437*1.5 | AA242: 3392*0.5 | AB242: =RC[-1]&"-500" -> 3392*0.5-500
F243: 8437 | G243: =RC[-1]&"*1.5" -> 8437*1.5 | AA243: 3392 | AB243: =RC[-1]&"-500" -> 3392-500
F244: 8454 | G244: =RC[-1]&"*1.5" -> 8454*1.5 | AA244: 3400 | AB244: =RC[-1]&"-500" -> 3400-500
F245: 8454 | G245: =RC[-1]&"*1.5" -> 8454*1.5 | AA245: 3400 | AB245: =RC[-1]&"-500" -> 3400-500
F246: 8471 | G246: =RC[-1]&"*1.5" -> 8471*1.5 | AA246: 3409*0.5 | AB246: =RC[-1]&"-500" -> 3409*0.5-500
F247: 8471 | G247: =RC[-1]&"*1.5" -> 8471*1.5 | AA247: 3409 | AB247: =RC[-1]&"-500" -> 3409-500
F248: 8471 | G248: =RC[-1]&"*1.5" -> 8471*1.5 | AA248: 3409 | AB248: =RC[-1]&"-500" -> 3409-500
F249: 8488 | G249: =RC[-1]&"*1.5" -> 8488*1.5 | AA249: 3418 | AB249: =RC[-1]&"-500" -> 3418-500
F250: 8488 | G250: =RC[-1]&"*1.5" -> 8488*1.5 | AA250: 3418 | AB250: =RC[-1]&"-500" -> 3418-500
F251: 8505 | G251: =RC[-1]&"*1.5" -> 8505*1.5 | AA251: 3427 | AB251: =RC[-1]&"-500" -> 3427-500
F252: 8505*0.8 | G252: =RC[-1]&"*1.5" -> 8505*0.8*1.5 | AA252: 3427*0.5 | AB252: =RC[-1]&"-500" -> 3427*0.5-500
F253: 8505 | G253: =RC[-1]&"*1.5" -> 8505*1.5 | AA253: 3427 | AB253: =RC[-1]&"-500" -> 3427-500
F254: 8505 | G254: =RC[-1]&"*1.5" -> 8505*1.5 | AA254: 3427 | AB254: =RC[-1]&"-500" -> 3427-500
F255: 8175 | G255: =RC[-1]&"*1.5" -> 8175*1.5 | AA255: 3549*0.5 | AB255: =RC[-1]&"-500" -> 3549*0.5-500
F256: 8175*1.2 | G256: =RC[-1]&"*1.5" -> 8175*1.2*1.5 | AA256: 3549*0.5 | AB256: =RC[-1]&"-500" -> 3549*0.5-500
F257: 8175 | G257: =RC[-1]&"*1.5" -> 8175*1.5 | AA257: 3549*0.5 | AB257: =RC[-1]&"-500" -> 3549*0.5-500
F258: 8175 | G258: =RC[-1]&"*1.5" -> 8175*1.5 | AA258: 3549*0.5 | AB258: =RC[-1]&"-500" -> 3549*0.5-500
F259: 8195 | G259: =RC[-1]&"*1.5" -> 8195*1.5 | AA259: 3558*0.5 | AB259: =RC[-1]&"-500" -> 3558*0.5-500
F260: 8195 | G260: =RC[-1]&"*1.5" -> 8195*1.5 | AA260: 3558 | AB260: =RC[-1]&"-500" -> 3558-500
F261: 8195 | G261: =RC[-1]&"*1.5" -> 8195*1.5 | AA261: 3558 | AB261: =RC[-1]&"-500" -> 3558-500
F262: 8211 | G262: =RC[-1]&"*1.5" -> 8211*1.5 | AA262: 3567*0.5 | AB262: =RC[-1]&"-500" -> 3567*0.5-500
F263: 8211*1.2 | G263: =RC[-1]&"*1.5" -> 8211*1.2*1.5 | AA263: 3567*0.5 | AB263: =RC[-1]&"-500" -> 3567*0.5-500
F264: 8211 | G264: =RC[-1]&"*1.5" -> 8211*1.5 | AA264: 3567 | AB264: =RC[-1]&"-500" -> 3567-500
F265: 8226 | G265: =RC[-1]&"*1.5" -> 8226*1.5 | AA265: 3575 | AB265: =RC[-1]&"-500" -> 3575-500
F266: 8226*1.2 | G266: =RC[-1]&"*1.5" -> 8226*1.2*1.5 | AA266: 3575*0.5 | AB266: =RC[-1]&"-500" -> 3575*0.5-500
F267: 8226*0.8 | G267: =RC[-1]&"*1.5" -> 8226*0.8*1.5 | AA267: 3575*0.5 | AB267: =RC[-1]&"-500" -> 3575*0.5-500
F268: 8241 | G268: =RC[-1]&"*1.5" -> 8241*1.5 | AA268: 3584 | AB268: =RC[-1]&"-500" -> 3584-500
F269: 8241*0.8 | G269: =RC[-1]&"*1.5" -> 8241*0.8*1.5 | AA269: 3584*0.5 | AB269: =RC[-1]&"-500" -> 3584*0.5-500
F270: 8262 | G270: =RC[-1]&"*1.5" -> 8262*1.5 | AA270: 3592 | AB270: =RC[-1]&"-500" -> 3592-500
F271: 8262*1.2 | G271: =RC[-1]&"*1.5" -> 8262*1.2*1.5 | AA271: 3592*0.5 | AB271: =RC[-1]&"-500" -> 3592*0.5-500
F272: 8277 | G272: =RC[-1]&"*1.5" -> 8277*1.5 | AA272: 3601*0.5 | AB272: =RC[-1]&"-500" -> 3601*0.5-500
F273: 8277*0.8 | G273: =RC[-1]&"*1.5" -> 8277*0.8*1.5 | AA273: 3601*0.5 | AB273: =RC[-1]&"-500" -> 3601*0.5-500
F274: 8277 | G274: =RC[-1]&"*1.5" -> 8277*1.5 | AA274: 3601 | AB274: =RC[-1]&"-500" -> 3601-500
F275: 8292*0.8 | G275: =RC[-1]&"*1.5" -> 8292*0.8*1.5 | AA275: 3610*0.5 | AB275: =RC[-1]&"-500" -> 3610*0.5-500
F276: 8292 | G276: =RC[-1]&"*1.5" -> 8292*1.5 | AA276: 3610 | AB276: =RC[-1]&"-500" -> 3610-500
F277: 8292 | G277: =RC[-1]&"*1.5" -> 8292*1.5 | AA277: 3610 | AB277: =RC[-1]&"-500" -> 3610-500
F278: 8307 | G278: =RC[-1]&"*1.5" -> 8307*1.5 | AA278: 3618 | AB278: =RC[-1]&"-500" -> 3618-500
F279: 8307*0.8 | G279: =RC[-1]&"*1.5" -> 8307*0.8*1.5 | AA279: 3618*0.5 | AB279: =RC[-1]&"-500" -> 3618*0.5-500
F280: 8307 | G280: =RC[-1]&"*1.5" -> 8307*1.5 | AA280: 3618 | AB280: =RC[-1]&"-500" -> 3618-500
F281: 8328 | G281: =RC[-1]&"*1.5" -> 8328*1.5 | AA281: 3627 | AB281: =RC[-1]&"-500" -> 3627-500
F282: 8328*0.8 | G282: =RC[-1]&"*1.5" -> 8328*0.8*1.5 | AA282: 3627*0.5 | AB282: =RC[-1]&"-500" -> 3627*0.5-500
F283: 8328 | G283: =RC[-1]&"*1.5" -> 8328*1.5 | AA283: 3627 | AB283: =RC[-1]&"-500" -> 3627-500