Sheet: ctArenaSeasonConf
A2: nSeasonID | B2: tStartTime | C2: tEndTime
A3: i | B3: t{iiiiii} | C3: t{iiiiii}
A4: 竞技场赛季编号 | B4: 开始时间(年,月,日,时,分,秒) | C4: 结束时间
A5: 1 | B5: 2018,5,21,0,0,0 | C5: 2018,6,20,23,59,59
A6: 2 | B6: 2018,6,21,0,0,0 | C6: 2018,7,20,23,59,59
A7: 3 | B7: 2018,7,21,0,0,0 | C7: 2018,8,20,23,59,59
A8: 4 | B8: 2018,8,21,0,0,0 | C8: 2018,9,20,23,59,59
A9: 5 | B9: 2018,9,21,0,0,0 | C9: 2018,10,20,23,59,59
A10: 6 | B10: 2018,10,21,0,0,0 | C10: 2018,11,20,23,59,59
A11: 7 | B11: 2018,11,21,0,0,0 | C11: 2018,12,20,23,59,59
A12: 8 | B12: 2018,12,21,0,0,0 | C12: 2019,1,20,23,59,59
A13: 9 | B13: 2019,1,21,0,0,0 | C13: 2019,2,20,23,59,59
A14: 10 | B14: 2019,2,21,0,0,0 | C14: 2019,3,20,23,59,59
A15: 11 | B15: 2019,3,21,0,0,0 | C15: 2019,4,20,23,59,59
A16: 12 | B16: 2019,4,21,0,0,0 | C16: 2019,5,20,23,59,59
A17: 13 | B17: 2019,5,21,0,0,0 | C17: 2019,6,20,23,59,59
A18: 14 | B18: 2019,6,21,0,0,0 | C18: 2019,7,20,23,59,59
A19: 15 | B19: 2019,7,21,0,0,0 | C19: 2019,8,20,23,59,59
A20: 16 | B20: 2019,8,21,0,0,0 | C20: 2019,9,20,23,59,59
A21: 17 | B21: 2019,9,21,0,0,0 | C21: 2019,10,20,23,59,59
A22: 18 | B22: 2019,10,21,0,0,0 | C22: 2019,11,20,23,59,59
A23: 19 | B23: 2019,11,21,0,0,0 | C23: 2019,12,20,23,59,59
A24: 20 | B24: 2019,12,21,0,0,0 | C24: 2020,1,20,23,59,59
A25: 21 | B25: 2020,1,21,0,0,0 | C25: 2020,2,20,23,59,59
A26: 22 | B26: 2020,2,21,0,0,0 | C26: 2020,3,20,23,59,59
A27: 23 | B27: 2020,3,21,0,0,0 | C27: 2020,4,20,23,59,59
A28: 24 | B28: 2020,4,21,0,0,0 | C28: 2020,5,20,23,59,59
A29: 25 | B29: 2020,5,21,0,0,0 | C29: 2020,6,20,23,59,59
A30: 26 | B30: 2020,6,21,0,0,0 | C30: 2020,7,20,23,59,59
A31: 27 | B31: 2020,7,21,0,0,0 | C31: 2020,8,20,23,59,59
A32: 28 | B32: 2020,8,21,0,0,0 | C32: 2020,9,20,23,59,59
A33: 29 | B33: 2020,9,21,0,0,0 | C33: 2020,10,20,23,59,59
A34: 30 | B34: 2020,10,21,0,0,0 | C34: 2020,11,20,23,59,59
A35: 31 | B35: 2020,11,21,0,0,0 | C35: 2020,12,20,23,59,59
A36: 32 | B36: 2020,12,21,0,0,0 | C36: 2021,1,20,23,59,59
A37: 33 | B37: 2021,1,21,0,0,0 | C37: 2021,2,20,23,59,59
A38: 34 | B38: 2021,2,21,0,0,0 | C38: 2021,3,20,23,59,59
A39: 35 | B39: 2021,3,21,0,0,0 | C39: 2021,4,20,23,59,59
A40: 36 | B40: 2021,4,21,0,0,0 | C40: 2021,5,20,23,59,59
A41: 37 | B41: 2021,5,21,0,0,0 | C41: 2021,6,20,23,59,59
A42: 38 | B42: 2021,6,21,0,0,0 | C42: 2021,7,20,23,59,59
A43: 39 | B43: 2021,7,21,0,0,0 | C43: 2021,8,20,23,59,59
A44: 40 | B44: 2021,8,21,0,0,0 | C44: 2021,9,20,23,59,59
A45: 41 | B45: 2021,9,21,0,0,0 | C45: 2021,10,20,23,59,59
A46: 42 | B46: 2021,10,21,0,0,0 | C46: 2021,11,20,23,59,59
A47: 43 | B47: 2021,11,21,0,0,0 | C47: 2021,12,20,23,59,59
A48: 44 | B48: 2021,12,21,0,0,0 | C48: 2022,1,20,23,59,59
A49: 45 | B49: 2022,1,21,0,0,0 | C49: 2022,2,20,23,59,59
A50: 46 | B50: 2022,2,21,0,0,0 | C50: 2022,3,20,23,59,59
A51: 47 | B51: 2022,3,21,0,0,0 | C51: 2022,4,20,23,59,59
A52: 48 | B52: 2022,4,21,0,0,0 | C52: 2022,5,20,23,59,59
A53: 49 | B53: 2022,5,21,0,0,0 | C53: 2022,6,20,23,59,59
A54: 50 | B54: 2022,6,21,0,0,0 | C54: 2022,7,20,23,59,59
A55: 51 | B55: 2022,7,21,0,0,0 | C55: 2022,8,20,23,59,59
A56: 52 | B56: 2022,8,21,0,0,0 | C56: 2022,9,20,23,59,59
A57: 53 | B57: 2022,9,21,0,0,0 | C57: 2022,10,20,23,59,59
A58: 54 | B58: 2022,10,21,0,0,0 | C58: 2022,11,20,23,59,59
A59: 55 | B59: 2022,11,21,0,0,0 | C59: 2022,12,20,23,59,59
A60: 56 | B60: 2022,12,21,0,0,0 | C60: 2023,1,20,23,59,59

Sheet: Sheet2
I4: 开始时间(年,月,日,时,分,秒) | J4: 结束时间
I5: 2018,5,21,0,0,0 | J5: 2018,6,20,23,59,59
I6: 2018,6,21,0,0,0 | J6: 2018,7,20,23,59,59
I7: 2018,7,21,0,0,0 | J7: 2018,8,20,23,59,59
I8: 2018,8,21,0,0,0 | J8: 2018,9,20,23,59,59
I9: 2018,9,21,0,0,0 | J9: 2018,10,20,23,59,59
I10: 2018,10,21,0,0,0 | J10: 2018,11,20,23,59,59
I11: 2018,11,21,0,0,0 | J11: 2018,12,20,23,59,59
I12: 2018,12,21,0,0,0 | J12: 2019,1,20,23,59,59
I13: 2019,1,21,0,0,0 | J13: 2019,2,20,23,59,59
I14: 2019,2,21,0,0,0 | J14: 2019,3,20,23,59,59
I15: 2019,3,21,0,0,0 | J15: 2019,4,20,23,59,59
I16: 2019,4,21,0,0,0 | J16: 2019,5,20,23,59,59
I17: 2019,5,21,0,0,0 | J17: 2019,6,20,23,59,59
I18: 2019,6,21,0,0,0 | J18: 2019,7,20,23,59,59
I19: 2019,7,21,0,0,0 | J19: 2019,8,20,23,59,59
I20: 2019,8,21,0,0,0 | J20: 2019,9,20,23,59,59
D21: 2019 | E21: 9 | F21: =IF(RC[1]=1,RC[-2]+1,RC[-2]) -> 2019 | G21: =IF(RC[-2]+1<13,RC[-2]+1,1) -> 10 | I21: =RC4&","&RC5&",21,0,0,0" -> 2019,9,21,0,0,0 | J21: =RC6&","&RC7&",20,23,59,59" -> 2019,10,20,23,59,59
D22: 2019 | E22: 10 | F22: =IF(RC[1]=1,RC[-2]+1,RC[-2]) -> 2019 | G22: =IF(RC[-2]+1<13,RC[-2]+1,1) -> 11 | I22: =RC4&","&RC5&",21,0,0,0" -> 2019,10,21,0,0,0 | J22: =RC6&","&RC7&",20,23,59,59" -> 2019,11,20,23,59,59
D23: 2019 | E23: 11 | F23: =IF(RC[1]=1,RC[-2]+1,RC[-2]) -> 2019 | G23: =IF(RC[-2]+1<13,RC[-2]+1,1) -> 12 | I23: =RC4&","&RC5&",21,0,0,0" -> 2019,11,21,0,0,0 | J23: =RC6&","&RC7&",20,23,59,59" -> 2019,12,20,23,59,59
D24: 2019 | E24: 12 | F24: =IF(RC[1]=1,RC[-2]+1,RC[-2]) -> 2020 | G24: =IF(RC[-2]+1<13,RC[-2]+1,1) -> 1 | I24: =RC4&","&RC5&",21,0,0,0" -> 2019,12,21,0,0,0 | J24: =RC6&","&RC7&",20,23,59,59" -> 2020,1,20,23,59,59
D25: 2020 | E25: 1 | F25: =IF(RC[1]=1,RC[-2]+1,RC[-2]) -> 2020 | G25: =IF(RC[-2]+1<13,RC[-2]+1,1) -> 2 | I25: =RC4&","&RC5&",21,0,0,0" -> 2020,1,21,0,0,0 | J25: =RC6&","&RC7&",20,23,59,59" -> 2020,2,20,23,59,59
D26: 2020 | E26: 2 | F26: =IF(RC[1]=1,RC[-2]+1,RC[-2]) -> 2020 | G26: =IF(RC[-2]+1<13,RC[-2]+1,1) -> 3 | I26: =RC4&","&RC5&",21,0,0,0" -> 2020,2,21,0,0,0 | J26: =RC6&","&RC7&",20,23,59,59" -> 2020,3,20,23,59,59
D27: 2020 | E27: 3 | F27: =IF(RC[1]=1,RC[-2]+1,RC[-2]) -> 2020 | G27: =IF(RC[-2]+1<13,RC[-2]+1,1) -> 4 | I27: =RC4&","&RC5&",21,0,0,0" -> 2020,3,21,0,0,0 | J27: =RC6&","&RC7&",20,23,59,59" -> 2020,4,20,23,59,59
D28: 2020 | E28: 4 | F28: =IF(RC[1]=1,RC[-2]+1,RC[-2]) -> 2020 | G28: =IF(RC[-2]+1<13,RC[-2]+1,1) -> 5 | I28: =RC4&","&RC5&",21,0,0,0" -> 2020,4,21,0,0,0 | J28: =RC6&","&RC7&",20,23,59,59" -> 2020,5,20,23,59,59
D29: 2020 | E29: 5 | F29: =IF(RC[1]=1,RC[-2]+1,RC[-2]) -> 2020 | G29: =IF(RC[-2]+1<13,RC[-2]+1,1) -> 6 | I29: =RC4&","&RC5&",21,0,0,0" -> 2020,5,21,0,0,0 | J29: =RC6&","&RC7&",20,23,59,59" -> 2020,6,20,23,59,59
D30: 2020 | E30: 6 | F30: =IF(RC[1]=1,RC[-2]+1,RC[-2]) -> 2020 | G30: =IF(RC[-2]+1<13,RC[-2]+1,1) -> 7 | I30: =RC4&","&RC5&",21,0,0,0" -> 2020,6,21,0,0,0 | J30: =RC6&","&RC7&",20,23,59,59" -> 2020,7,20,23,59,59
D31: 2020 | E31: 7 | F31: =IF(RC[1]=1,RC[-2]+1,RC[-2]) -> 2020 | G31: =IF(RC[-2]+1<13,RC[-2]+1,1) -> 8 | I31: =RC4&","&RC5&",21,0,0,0" -> 2020,7,21,0,0,0 | J31: =RC6&","&RC7&",20,23,59,59" -> 2020,8,20,23,59,59
D32: 2020 | E32: 8 | F32: =IF(RC[1]=1,RC[-2]+1,RC[-2]) -> 2020 | G32: =IF(RC[-2]+1<13,RC[-2]+1,1) -> 9 | I32: =RC4&","&RC5&",21,0,0,0" -> 2020,8,21,0,0,0 | J32: =RC6&","&RC7&",20,23,59,59" -> 2020,9,20,23,59,59
D33: 2020 | E33: 9 | F33: =IF(RC[1]=1,RC[-2]+1,RC[-2]) -> 2020 | G33: =IF(RC[-2]+1<13,RC[-2]+1,1) -> 10 | I33: =RC4&","&RC5&",21,0,0,0" -> 2020,9,21,0,0,0 | J33: =RC6&","&RC7&",20,23,59,59" -> 2020,10,20,23,59,59
D34: 2020 | E34: 10 | F34: =IF(RC[1]=1,RC[-2]+1,RC[-2]) -> 2020 | G34: =IF(RC[-2]+1<13,RC[-2]+1,1) -> 11 | I34: =RC4&","&RC5&",21,0,0,0" -> 2020,10,21,0,0,0 | J34: =RC6&","&RC7&",20,23,59,59" -> 2020,11,20,23,59,59
D35: 2020 | E35: 11 | F35: =IF(RC[1]=1,RC[-2]+1,RC[-2]) -> 2020 | G35: =IF(RC[-2]+1<13,RC[-2]+1,1) -> 12 | I35: =RC4&","&RC5&",21,0,0,0" -> 2020,11,21,0,0,0 | J35: =RC6&","&RC7&",20,23,59,59" -> 2020,12,20,23,59,59
D36: 2020 | E36: 12 | F36: =IF(RC[1]=1,RC[-2]+1,RC[-2]) -> 2021 | G36: =IF(RC[-2]+1<13,RC[-2]+1,1) -> 1 | I36: =RC4&","&RC5&",21,0,0,0" -> 2020,12,21,0,0,0 | J36: =RC6&","&RC7&",20,23,59,59" -> 2021,1,20,23,59,59
D37: =R[-12]C+1 -> 2021 | E37: =R[-12]C -> 1 | F37: =IF(RC[1]=1,RC[-2]+1,RC[-2]) -> 2021 | G37: =IF(RC[-2]+1<13,RC[-2]+1,1) -> 2 | I37: =RC4&","&RC5&",21,0,0,0" -> 2021,1,21,0,0,0 | J37: =RC6&","&RC7&",20,23,59,59" -> 2021,2,20,23,59,59
D38: =R[-12]C+1 -> 2021 | E38: =R[-12]C -> 2 | F38: =IF(RC[1]=1,RC[-2]+1,RC[-2]) -> 2021 | G38: =IF(RC[-2]+1<13,RC[-2]+1,1) -> 3 | I38: =RC4&","&RC5&",21,0,0,0" -> 2021,2,21,0,0,0 | J38: =RC6&","&RC7&",20,23,59,59" -> 2021,3,20,23,59,59
D39: =R[-12]C+1 -> 2021 | E39: =R[-12]C -> 3 | F39: =IF(RC[1]=1,RC[-2]+1,RC[-2]) -> 2021 | G39: =IF(RC[-2]+1<13,RC[-2]+1,1) -> 4 | I39: =RC4&","&RC5&",21,0,0,0" -> 2021,3,21,0,0,0 | J39: =RC6&","&RC7&",20,23,59,59" -> 2021,4,20,23,59,59
D40: =R[-12]C+1 -> 2021 | E40: =R[-12]C -> 4 | F40: =IF(RC[1]=1,RC[-2]+1,RC[-2]) -> 2021 | G40: =IF(RC[-2]+1<13,RC[-2]+1,1) -> 5 | I40: =RC4&","&RC5&",21,0,0,0" -> 2021,4,21,0,0,0 | J40: =RC6&","&RC7&",20,23,59,59" -> 2021,5,20,23,59,59
D41: =R[-12]C+1 -> 2021 | E41: =R[-12]C -> 5 | F41: =IF(RC[1]=1,RC[-2]+1,RC[-2]) -> 2021 | G41: =IF(RC[-2]+1<13,RC[-2]+1,1) -> 6 | I41: =RC4&","&RC5&",21,0,0,0" -> 2021,5,21,0,0,0 | J41: =RC6&","&RC7&",20,23,59,59" -> 2021,6,20,23,59,59
D42: =R[-12]C+1 -> 2021 | E42: =R[-12]C -> 6 | F42: =IF(RC[1]=1,RC[-2]+1,RC[-2]) -> 2021 | G42: =IF(RC[-2]+1<13,RC[-2]+1,1) -> 7 | I42: =RC4&","&RC5&",21,0,0,0" -> 2021,6,21,0,0,0 | J42: =RC6&","&RC7&",20,23,59,59" -> 2021,7,20,23,59,59
D43: =R[-12]C+1 -> 2021 | E43: =R[-12]C -> 7 | F43: =IF(RC[1]=1,RC[-2]+1,RC[-2]) -> 2021 | G43: =IF(RC[-2]+1<13,RC[-2]+1,1) -> 8 | I43: =RC4&","&RC5&",21,0,0,0" -> 2021,7,21,0,0,0 | J43: =RC6&","&RC7&",20,23,59,59" -> 2021,8,20,23,59,59
D44: =R[-12]C+1 -> 2021 | E44: =R[-12]C -> 8 | F44: =IF(RC[1]=1,RC[-2]+1,RC[-2]) -> 2021 | G44: =IF(RC[-2]+1<13,RC[-2]+1,1) -> 9 | I44: =RC4&","&RC5&",21,0,0,0" -> 2021,8,21,0,0,0 | J44: =RC6&","&RC7&",20,23,59,59" -> 2021,9,20,23,59,59
D45: =R[-12]C+1 -> 2021 | E45: =R[-12]C -> 9 | F45: =IF(RC[1]=1,RC[-2]+1,RC[-2]) -> 2021 | G45: =IF(RC[-2]+1<13,RC[-2]+1,1) -> 10 | I45: =RC4&","&RC5&",21,0,0,0" -> 2021,9,21,0,0,0 | J45: =RC6&","&RC7&",20,23,59,59" -> 2021,10,20,23,59,59
D46: =R[-12]C+1 -> 2021 | E46: =R[-12]C -> 10 | F46: =IF(RC[1]=1,RC[-2]+1,RC[-2]) -> 2021 | G46: =IF(RC[-2]+1<13,RC[-2]+1,1) -> 11 | I46: =RC4&","&RC5&",21,0,0,0" -> 2021,10,21,0,0,0 | J46: =RC6&","&RC7&",20,23,59,59" -> 2021,11,20,23,59,59
D47: =R[-12]C+1 -> 2021 | E47: =R[-12]C -> 11 | F47: =IF(RC[1]=1,RC[-2]+1,RC[-2]) -> 2021 | G47: =IF(RC[-2]+1<13,RC[-2]+1,1) -> 12 | I47: =RC4&","&RC5&",21,0,0,0" -> 2021,11,21,0,0,0 | J47: =RC6&","&RC7&",20,23,59,59" -> 2021,12,20,23,59,59
D48: =R[-12]C+1 -> 2021 | E48: =R[-12]C -> 12 | F48: =IF(RC[1]=1,RC[-2]+1,RC[-2]) -> 2022 | G48: =IF(RC[-2]+1<13,RC[-2]+1,1) -> 1 | I48: =RC4&","&RC5&",21,0,0,0" -> 2021,12,21,0,0,0 | J48: =RC6&","&RC7&",20,23,59,59" -> 2022,1,20,23,59,59
D49: =R[-12]C+1 -> 2022 | E49: =R[-12]C -> 1 | F49: =IF(RC[1]=1,RC[-2]+1,RC[-2]) -> 2022 | G49: =IF(RC[-2]+1<13,RC[-2]+1,1) -> 2 | I49: =RC4&","&RC5&",21,0,0,0" -> 2022,1,21,0,0,0 | J49: =RC6&","&RC7&",20,23,59,59" -> 2022,2,20,23,59,59
D50: =R[-12]C+1 -> 2022 | E50: =R[-12]C -> 2 | F50: =IF(RC[1]=1,RC[-2]+1,RC[-2]) -> 2022 | G50: =IF(RC[-2]+1<13,RC[-2]+1,1) -> 3 | I50: =RC4&","&RC5&",21,0,0,0" -> 2022,2,21,0,0,0 | J50: =RC6&","&RC7&",20,23,59,59" -> 2022,3,20,23,59,59
D51: =R[-12]C+1 -> 2022 | E51: =R[-12]C -> 3 | F51: =IF(RC[1]=1,RC[-2]+1,RC[-2]) -> 2022 | G51: =IF(RC[-2]+1<13,RC[-2]+1,1) -> 4 | I51: =RC4&","&RC5&",21,0,0,0" -> 2022,3,21,0,0,0 | J51: =RC6&","&RC7&",20,23,59,59" -> 2022,4,20,23,59,59
D52: =R[-12]C+1 -> 2022 | E52: =R[-12]C -> 4 | F52: =IF(RC[1]=1,RC[-2]+1,RC[-2]) -> 2022 | G52: =IF(RC[-2]+1<13,RC[-2]+1,1) -> 5 | I52: =RC4&","&RC5&",21,0,0,0" -> 2022,4,21,0,0,0 | J52: =RC6&","&RC7&",20,23,59,59" -> 2022,5,20,23,59,59
D53: =R[-12]C+1 -> 2022 | E53: =R[-12]C -> 5 | F53: =IF(RC[1]=1,RC[-2]+1,RC[-2]) -> 2022 | G53: =IF(RC[-2]+1<13,RC[-2]+1,1) -> 6 | I53: =RC4&","&RC5&",21,0,0,0" -> 2022,5,21,0,0,0 | J53: =RC6&","&RC7&",20,23,59,59" -> 2022,6,20,23,59,59
D54: =R[-12]C+1 -> 2022 | E54: =R[-12]C -> 6 | F54: =IF(RC[1]=1,RC[-2]+1,RC[-2]) -> 2022 | G54: =IF(RC[-2]+1<13,RC[-2]+1,1) -> 7 | I54: =RC4&","&RC5&",21,0,0,0" -> 2022,6,21,0,0,0 | J54: =RC6&","&RC7&",20,23,59,59" -> 2022,7,20,23,59,59
D55: =R[-12]C+1 -> 2022 | E55: =R[-12]C -> 7 | F55: =IF(RC[1]=1,RC[-2]+1,RC[-2]) -> 2022 | G55: =IF(RC[-2]+1<13,RC[-2]+1,1) -> 8 | I55: =RC4&","&RC5&",21,0,0,0" -> 2022,7,21,0,0,0 | J55: =RC6&","&RC7&",20,23,59,59" -> 2022,8,20,23,59,59
D56: =R[-12]C+1 -> 2022 | E56: =R[-12]C -> 8 | F56: =IF(RC[1]=1,RC[-2]+1,RC[-2]) -> 2022 | G56: =IF(RC[-2]+1<13,RC[-2]+1,1) -> 9 | I56: =RC4&","&RC5&",21,0,0,0" -> 2022,8,21,0,0,0 | J56: =RC6&","&RC7&",20,23,59,59" -> 2022,9,20,23,59,59
D57: =R[-12]C+1 -> 2022 | E57: =R[-12]C -> 9 | F57: =IF(RC[1]=1,RC[-2]+1,RC[-2]) -> 2022 | G57: =IF(RC[-2]+1<13,RC[-2]+1,1) -> 10 | I57: =RC4&","&RC5&",21,0,0,0" -> 2022,9,21,0,0,0 | J57: =RC6&","&RC7&",20,23,59,59" -> 2022,10,20,23,59,59
D58: =R[-12]C+1 -> 2022 | E58: =R[-12]C -> 10 | F58: =IF(RC[1]=1,RC[-2]+1,RC[-2]) -> 2022 | G58: =IF(RC[-2]+1<13,RC[-2]+1,1) -> 11 | I58: =RC4&","&RC5&",21,0,0,0" -> 2022,10,21,0,0,0 | J58: =RC6&","&RC7&",20,23,59,59" -> 2022,11,20,23,59,59
D59: =R[-12]C+1 -> 2022 | E59: =R[-12]C -> 11 | F59: =IF(RC[1]=1,RC[-2]+1,RC[-2]) -> 2022 | G59: =IF(RC[-2]+1<13,RC[-2]+1,1) -> 12 | I59: =RC4&","&RC5&",21,0,0,0" -> 2022,11,21,0,0,0 | J59: =RC6&","&RC7&",20,23,59,59" -> 2022,12,20,23,59,59
D60: =R[-12]C+1 -> 2022 | E60: =R[-12]C -> 12 | F60: =IF(RC[1]=1,RC[-2]+1,RC[-2]) -> 2023 | G60: =IF(RC[-2]+1<13,RC[-2]+1,1) -> 1 | I60: =RC4&","&RC5&",21,0,0,0" -> 2022,12,21,0,0,0 | J60: =RC6&","&RC7&",20,23,59,59" -> 2023,1,20,23,59,59
D61: =R[-12]C+1 -> 2023 | E61: =R[-12]C -> 1 | F61: =IF(RC[1]=1,RC[-2]+1,RC[-2]) -> 2023 | G61: =IF(RC[-2]+1<13,RC[-2]+1,1) -> 2 | I61: =RC4&","&RC5&",21,0,0,0" -> 2023,1,21,0,0,0 | J61: =RC6&","&RC7&",20,23,59,59" -> 2023,2,20,23,59,59
D62: =R[-12]C+1 -> 2023 | E62: =R[-12]C -> 2 | F62: =IF(RC[1]=1,RC[-2]+1,RC[-2]) -> 2023 | G62: =IF(RC[-2]+1<13,RC[-2]+1,1) -> 3 | I62: =RC4&","&RC5&",21,0,0,0" -> 2023,2,21,0,0,0 | J62: =RC6&","&RC7&",20,23,59,59" -> 2023,3,20,23,59,59
D63: =R[-12]C+1 -> 2023 | E63: =R[-12]C -> 3 | F63: =IF(RC[1]=1,RC[-2]+1,RC[-2]) -> 2023 | G63: =IF(RC[-2]+1<13,RC[-2]+1,1) -> 4 | I63: =RC4&","&RC5&",21,0,0,0" -> 2023,3,21,0,0,0 | J63: =RC6&","&RC7&",20,23,59,59" -> 2023,4,20,23,59,59
D64: =R[-12]C+1 -> 2023 | E64: =R[-12]C -> 4 | F64: =IF(RC[1]=1,RC[-2]+1,RC[-2]) -> 2023 | G64: =IF(RC[-2]+1<13,RC[-2]+1,1) -> 5 | I64: =RC4&","&RC5&",21,0,0,0" -> 2023,4,21,0,0,0 | J64: =RC6&","&RC7&",20,23,59,59" -> 2023,5,20,23,59,59
D65: =R[-12]C+1 -> 2023 | E65: =R[-12]C -> 5 | F65: =IF(RC[1]=1,RC[-2]+1,RC[-2]) -> 2023 | G65: =IF(RC[-2]+1<13,RC[-2]+1,1) -> 6 | I65: =RC4&","&RC5&",21,0,0,0" -> 2023,5,21,0,0,0 | J65: =RC6&","&RC7&",20,23,59,59" -> 2023,6,20,23,59,59
D66: =R[-12]C+1 -> 2023 | E66: =R[-12]C -> 6 | F66: =IF(RC[1]=1,RC[-2]+1,RC[-2]) -> 2023 | G66: =IF(RC[-2]+1<13,RC[-2]+1,1) -> 7 | I66: =RC4&","&RC5&",21,0,0,0" -> 2023,6,21,0,0,0 | J66: =RC6&","&RC7&",20,23,59,59" -> 2023,7,20,23,59,59
D67: =R[-12]C+1 -> 2023 | E67: =R[-12]C -> 7 | F67: =IF(RC[1]=1,RC[-2]+1,RC[-2]) -> 2023 | G67: =IF(RC[-2]+1<13,RC[-2]+1,1) -> 8 | I67: =RC4&","&RC5&",21,0,0,0" -> 2023,7,21,0,0,0 | J67: =RC6&","&RC7&",20,23,59,59" -> 2023,8,20,23,59,59
D68: =R[-12]C+1 -> 2023 | E68: =R[-12]C -> 8 | F68: =IF(RC[1]=1,RC[-2]+1,RC[-2]) -> 2023 | G68: =IF(RC[-2]+1<13,RC[-2]+1,1) -> 9 | I68: =RC4&","&RC5&",21,0,0,0" -> 2023,8,21,0,0,0 | J68: =RC6&","&RC7&",20,23,59,59" -> 2023,9,20,23,59,59
D69: =R[-12]C+1 -> 2023 | E69: =R[-12]C -> 9 | F69: =IF(RC[1]=1,RC[-2]+1,RC[-2]) -> 2023 | G69: =IF(RC[-2]+1<13,RC[-2]+1,1) -> 10 | I69: =RC4&","&RC5&",21,0,0,0" -> 2023,9,21,0,0,0 | J69: =RC6&","&RC7&",20,23,59,59" -> 2023,10,20,23,59,59
D70: =R[-12]C+1 -> 2023 | E70: =R[-12]C -> 10 | F70: =IF(RC[1]=1,RC[-2]+1,RC[-2]) -> 2023 | G70: =IF(RC[-2]+1<13,RC[-2]+1,1) -> 11 | I70: =RC4&","&RC5&",21,0,0,0" -> 2023,10,21,0,0,0 | J70: =RC6&","&RC7&",20,23,59,59" -> 2023,11,20,23,59,59
D71: =R[-12]C+1 -> 2023 | E71: =R[-12]C -> 11 | F71: =IF(RC[1]=1,RC[-2]+1,RC[-2]) -> 2023 | G71: =IF(RC[-2]+1<13,RC[-2]+1,1) -> 12 | I71: =RC4&","&RC5&",21,0,0,0" -> 2023,11,21,0,0,0 | J71: =RC6&","&RC7&",20,23,59,59" -> 2023,12,20,23,59,59
D72: =R[-12]C+1 -> 2023 | E72: =R[-12]C -> 12 | F72: =IF(RC[1]=1,RC[-2]+1,RC[-2]) -> 2024 | G72: =IF(RC[-2]+1<13,RC[-2]+1,1) -> 1 | I72: =RC4&","&RC5&",21,0,0,0" -> 2023,12,21,0,0,0 | J72: =RC6&","&RC7&",20,23,59,59" -> 2024,1,20,23,59,59
D73: =R[-12]C+1 -> 2024 | E73: =R[-12]C -> 1 | F73: =IF(RC[1]=1,RC[-2]+1,RC[-2]) -> 2024 | G73: =IF(RC[-2]+1<13,RC[-2]+1,1) -> 2 | I73: =RC4&","&RC5&",21,0,0,0" -> 2024,1,21,0,0,0 | J73: =RC6&","&RC7&",20,23,59,59" -> 2024,2,20,23,59,59
D74: =R[-12]C+1 -> 2024 | E74: =R[-12]C -> 2 | F74: =IF(RC[1]=1,RC[-2]+1,RC[-2]) -> 2024 | G74: =IF(RC[-2]+1<13,RC[-2]+1,1) -> 3 | I74: =RC4&","&RC5&",21,0,0,0" -> 2024,2,21,0,0,0 | J74: =RC6&","&RC7&",20,23,59,59" -> 2024,3,20,23,59,59
D75: =R[-12]C+1 -> 2024 | E75: =R[-12]C -> 3 | F75: =IF(RC[1]=1,RC[-2]+1,RC[-2]) -> 2024 | G75: =IF(RC[-2]+1<13,RC[-2]+1,1) -> 4 | I75: =RC4&","&RC5&",21,0,0,0" -> 2024,3,21,0,0,0 | J75: =RC6&","&RC7&",20,23,59,59" -> 2024,4,20,23,59,59
D76: =R[-12]C+1 -> 2024 | E76: =R[-12]C -> 4 | F76: =IF(RC[1]=1,RC[-2]+1,RC[-2]) -> 2024 | G76: =IF(RC[-2]+1<13,RC[-2]+1,1) -> 5 | I76: =RC4&","&RC5&",21,0,0,0" -> 2024,4,21,0,0,0 | J76: =RC6&","&RC7&",20,23,59,59" -> 2024,5,20,23,59,59
D77: =R[-12]C+1 -> 2024 | E77: =R[-12]C -> 5 | F77: =IF(RC[1]=1,RC[-2]+1,RC[-2]) -> 2024 | G77: =IF(RC[-2]+1<13,RC[-2]+1,1) -> 6 | I77: =RC4&","&RC5&",21,0,0,0" -> 2024,5,21,0,0,0 | J77: =RC6&","&RC7&",20,23,59,59" -> 2024,6,20,23,59,59
D78: =R[-12]C+1 -> 2024 | E78: =R[-12]C -> 6 | F78: =IF(RC[1]=1,RC[-2]+1,RC[-2]) -> 2024 | G78: =IF(RC[-2]+1<13,RC[-2]+1,1) -> 7 | I78: =RC4&","&RC5&",21,0,0,0" -> 2024,6,21,0,0,0 | J78: =RC6&","&RC7&",20,23,59,59" -> 2024,7,20,23,59,59
D79: =R[-12]C+1 -> 2024 | E79: =R[-12]C -> 7 | F79: =IF(RC[1]=1,RC[-2]+1,RC[-2]) -> 2024 | G79: =IF(RC[-2]+1<13,RC[-2]+1,1) -> 8 | I79: =RC4&","&RC5&",21,0,0,0" -> 2024,7,21,0,0,0 | J79: =RC6&","&RC7&",20,23,59,59" -> 2024,8,20,23,59,59
D80: =R[-12]C+1 -> 2024 | E80: =R[-12]C -> 8 | F80: =IF(RC[1]=1,RC[-2]+1,RC[-2]) -> 2024 | G80: =IF(RC[-2]+1<13,RC[-2]+1,1) -> 9 | I80: =RC4&","&RC5&",21,0,0,0" -> 2024,8,21,0,0,0 | J80: =RC6&","&RC7&",20,23,59,59" -> 2024,9,20,23,59,59
D81: =R[-12]C+1 -> 2024 | E81: =R[-12]C -> 9 | F81: =IF(RC[1]=1,RC[-2]+1,RC[-2]) -> 2024 | G81: =IF(RC[-2]+1<13,RC[-2]+1,1) -> 10 | I81: =RC4&","&RC5&",21,0,0,0" -> 2024,9,21,0,0,0 | J81: =RC6&","&RC7&",20,23,59,59" -> 2024,10,20,23,59,59
D82: =R[-12]C+1 -> 2024 | E82: =R[-12]C -> 10 | F82: =IF(RC[1]=1,RC[-2]+1,RC[-2]) -> 2024 | G82: =IF(RC[-2]+1<13,RC[-2]+1,1) -> 11 | I82: =RC4&","&RC5&",21,0,0,0" -> 2024,10,21,0,0,0 | J82: =RC6&","&RC7&",20,23,59,59" -> 2024,11,20,23,59,59
D83: =R[-12]C+1 -> 2024 | E83: =R[-12]C -> 11 | F83: =IF(RC[1]=1,RC[-2]+1,RC[-2]) -> 2024 | G83: =IF(RC[-2]+1<13,RC[-2]+1,1) -> 12 | I83: =RC4&","&RC5&",21,0,0,0" -> 2024,11,21,0,0,0 | J83: =RC6&","&RC7&",20,23,59,59" -> 2024,12,20,23,59,59
D84: =R[-12]C+1 -> 2024 | E84: =R[-12]C -> 12 | F84: =IF(RC[1]=1,RC[-2]+1,RC[-2]) -> 2025 | G84: =IF(RC[-2]+1<13,RC[-2]+1,1) -> 1 | I84: =RC4&","&RC5&",21,0,0,0" -> 2024,12,21,0,0,0 | J84: =RC6&","&RC7&",20,23,59,59" -> 2025,1,20,23,59,59
D85: =R[-12]C+1 -> 2025 | E85: =R[-12]C -> 1 | F85: =IF(RC[1]=1,RC[-2]+1,RC[-2]) -> 2025 | G85: =IF(RC[-2]+1<13,RC[-2]+1,1) -> 2 | I85: =RC4&","&RC5&",21,0,0,0" -> 2025,1,21,0,0,0 | J85: =RC6&","&RC7&",20,23,59,59" -> 2025,2,20,23,59,59
D86: =R[-12]C+1 -> 2025 | E86: =R[-12]C -> 2 | F86: =IF(RC[1]=1,RC[-2]+1,RC[-2]) -> 2025 | G86: =IF(RC[-2]+1<13,RC[-2]+1,1) -> 3 | I86: =RC4&","&RC5&",21,0,0,0" -> 2025,2,21,0,0,0 | J86: =RC6&","&RC7&",20,23,59,59" -> 2025,3,20,23,59,59
D87: =R[-12]C+1 -> 2025 | E87: =R[-12]C -> 3 | F87: =IF(RC[1]=1,RC[-2]+1,RC[-2]) -> 2025 | G87: =IF(RC[-2]+1<13,RC[-2]+1,1) -> 4 | I87: =RC4&","&RC5&",21,0,0,0" -> 2025,3,21,0,0,0 | J87: =RC6&","&RC7&",20,23,59,59" -> 2025,4,20,23,59,59
D88: =R[-12]C+1 -> 2025 | E88: =R[-12]C -> 4 | F88: =IF(RC[1]=1,RC[-2]+1,RC[-2]) -> 2025 | G88: =IF(RC[-2]+1<13,RC[-2]+1,1) -> 5 | I88: =RC4&","&RC5&",21,0,0,0" -> 2025,4,21,0,0,0 | J88: =RC6&","&RC7&",20,23,59,59" -> 2025,5,20,23,59,59
D89: =R[-12]C+1 -> 2025 | E89: =R[-12]C -> 5 | F89: =IF(RC[1]=1,RC[-2]+1,RC[-2]) -> 2025 | G89: =IF(RC[-2]+1<13,RC[-2]+1,1) -> 6 | I89: =RC4&","&RC5&",21,0,0,0" -> 2025,5,21,0,0,0 | J89: =RC6&","&RC7&",20,23,59,59" -> 2025,6,20,23,59,59
D90: =R[-12]C+1 -> 2025 | E90: =R[-12]C -> 6 | F90: =IF(RC[1]=1,RC[-2]+1,RC[-2]) -> 2025 | G90: =IF(RC[-2]+1<13,RC[-2]+1,1) -> 7 | I90: =RC4&","&RC5&",21,0,0,0" -> 2025,6,21,0,0,0 | J90: =RC6&","&RC7&",20,23,59,59" -> 2025,7,20,23,59,59
D91: =R[-12]C+1 -> 2025 | E91: =R[-12]C -> 7 | F91: =IF(RC[1]=1,RC[-2]+1,RC[-2]) -> 2025 | G91: =IF(RC[-2]+1<13,RC[-2]+1,1) -> 8 | I91: =RC4&","&RC5&",21,0,0,0" -> 2025,7,21,0,0,0 | J91: =RC6&","&RC7&",20,23,59,59" -> 2025,8,20,23,59,59
D92: =R[-12]C+1 -> 2025 | E92: =R[-12]C -> 8 | F92: =IF(RC[1]=1,RC[-2]+1,RC[-2]) -> 2025 | G92: =IF(RC[-2]+1<13,RC[-2]+1,1) -> 9 | I92: =RC4&","&RC5&",21,0,0,0" -> 2025,8,21,0,0,0 | J92: =RC6&","&RC7&",20,23,59,59" -> 2025,9,20,23,59,59
D93: =R[-12]C+1 -> 2025 | E93: =R[-12]C -> 9 | F93: =IF(RC[1]=1,RC[-2]+1,RC[-2]) -> 2025 | G93: =IF(RC[-2]+1<13,RC[-2]+1,1) -> 10 | I93: =RC4&","&RC5&",21,0,0,0" -> 2025,9,21,0,0,0 | J93: =RC6&","&RC7&",20,23,59,59" -> 2025,10,20,23,59,59
D94: =R[-12]C+1 -> 2025 | E94: =R[-12]C -> 10 | F94: =IF(RC[1]=1,RC[-2]+1,RC[-2]) -> 2025 | G94: =IF(RC[-2]+1<13,RC[-2]+1,1) -> 11 | I94: =RC4&","&RC5&",21,0,0,0" -> 2025,10,21,0,0,0 | J94: =RC6&","&RC7&",20,23,59,59" -> 2025,11,20,23,59,59
D95: =R[-12]C+1 -> 2025 | E95: =R[-12]C -> 11 | F95: =IF(RC[1]=1,RC[-2]+1,RC[-2]) -> 2025 | G95: =IF(RC[-2]+1<13,RC[-2]+1,1) -> 12 | I95: =RC4&","&RC5&",21,0,0,0" -> 2025,11,21,0,0,0 | J95: =RC6&","&RC7&",20,23,59,59" -> 2025,12,20,23,59,59
D96: =R[-12]C+1 -> 2025 | E96: =R[-12]C -> 12 | F96: =IF(RC[1]=1,RC[-2]+1,RC[-2]) -> 2026 | G96: =IF(RC[-2]+1<13,RC[-2]+1,1) -> 1 | I96: =RC4&","&RC5&",21,0,0,0" -> 2025,12,21,0,0,0 | J96: =RC6&","&RC7&",20,23,59,59" -> 2026,1,20,23,59,59
D97: =R[-12]C+1 -> 2026 | E97: =R[-12]C -> 1 | F97: =IF(RC[1]=1,RC[-2]+1,RC[-2]) -> 2026 | G97: =IF(RC[-2]+1<13,RC[-2]+1,1) -> 2 | I97: =RC4&","&RC5&",21,0,0,0" -> 2026,1,21,0,0,0 | J97: =RC6&","&RC7&",20,23,59,59" -> 2026,2,20,23,59,59
D98: =R[-12]C+1 -> 2026 | E98: =R[-12]C -> 2 | F98: =IF(RC[1]=1,RC[-2]+1,RC[-2]) -> 2026 | G98: =IF(RC[-2]+1<13,RC[-2]+1,1) -> 3 | I98: =RC4&","&RC5&",21,0,0,0" -> 2026,2,21,0,0,0 | J98: =RC6&","&RC7&",20,23,59,59" -> 2026,3,20,23,59,59
D99: =R[-12]C+1 -> 2026 | E99: =R[-12]C -> 3 | F99: =IF(RC[1]=1,RC[-2]+1,RC[-2]) -> 2026 | G99: =IF(RC[-2]+1<13,RC[-2]+1,1) -> 4 | I99: =RC4&","&RC5&",21,0,0,0" -> 2026,3,21,0,0,0 | J99: =RC6&","&RC7&",20,23,59,59" -> 2026,4,20,23,59,59
D100: =R[-12]C+1 -> 2026 | E100: =R[-12]C -> 4 | F100: =IF(RC[1]=1,RC[-2]+1,RC[-2]) -> 2026 | G100: =IF(RC[-2]+1<13,RC[-2]+1,1) -> 5 | I100: =RC4&","&RC5&",21,0,0,0" -> 2026,4,21,0,0,0 | J100: =RC6&","&RC7&",20,23,59,59" -> 2026,5,20,23,59,59
D101: =R[-12]C+1 -> 2026 | E101: =R[-12]C -> 5 | F101: =IF(RC[1]=1,RC[-2]+1,RC[-2]) -> 2026 | G101: =IF(RC[-2]+1<13,RC[-2]+1,1) -> 6 | I101: =RC4&","&RC5&",21,0,0,0" -> 2026,5,21,0,0,0 | J101: =RC6&","&RC7&",20,23,59,59" -> 2026,6,20,23,59,59
D102: =R[-12]C+1 -> 2026 | E102: =R[-12]C -> 6 | F102: =IF(RC[1]=1,RC[-2]+1,RC[-2]) -> 2026 | G102: =IF(RC[-2]+1<13,RC[-2]+1,1) -> 7 | I102: =RC4&","&RC5&",21,0,0,0" -> 2026,6,21,0,0,0 | J102: =RC6&","&RC7&",20,23,59,59" -> 2026,7,20,23,59,59
D103: =R[-12]C+1 -> 2026 | E103: =R[-12]C -> 7 | F103: =IF(RC[1]=1,RC[-2]+1,RC[-2]) -> 2026 | G103: =IF(RC[-2]+1<13,RC[-2]+1,1) -> 8 | I103: =RC4&","&RC5&",21,0,0,0" -> 2026,7,21,0,0,0 | J103: =RC6&","&RC7&",20,23,59,59" -> 2026,8,20,23,59,59
D104: =R[-12]C+1 -> 2026 | E104: =R[-12]C -> 8 | F104: =IF(RC[1]=1,RC[-2]+1,RC[-2]) -> 2026 | G104: =IF(RC[-2]+1<13,RC[-2]+1,1) -> 9 | I104: =RC4&","&RC5&",21,0,0,0" -> 2026,8,21,0,0,0 | J104: =RC6&","&RC7&",20,23,59,59" -> 2026,9,20,23,59,59
D105: =R[-12]C+1 -> 2026 | E105: =R[-12]C -> 9 | F105: =IF(RC[1]=1,RC[-2]+1,RC[-2]) -> 2026 | G105: =IF(RC[-2]+1<13,RC[-2]+1,1) -> 10 | I105: =RC4&","&RC5&",21,0,0,0" -> 2026,9,21,0,0,0 | J105: =RC6&","&RC7&",20,23,59,59" -> 2026,10,20,23,59,59
D106: =R[-12]C+1 -> 2026 | E106: =R[-12]C -> 10 | F106: =IF(RC[1]=1,RC[-2]+1,RC[-2]) -> 2026 | G106: =IF(RC[-2]+1<13,RC[-2]+1,1) -> 11 | I106: =RC4&","&RC5&",21,0,0,0" -> 2026,10,21,0,0,0 | J106: =RC6&","&RC7&",20,23,59,59" -> 2026,11,20,23,59,59
D107: =R[-12]C+1 -> 2026 | E107: =R[-12]C -> 11 | F107: =IF(RC[1]=1,RC[-2]+1,RC[-2]) -> 2026 | G107: =IF(RC[-2]+1<13,RC[-2]+1,1) -> 12 | I107: =RC4&","&RC5&",21,0,0,0" -> 2026,11,21,0,0,0 | J107: =RC6&","&RC7&",20,23,59,59" -> 2026,12,20,23,59,59
D108: =R[-12]C+1 -> 2026 | E108: =R[-12]C -> 12 | F108: =IF(RC[1]=1,RC[-2]+1,RC[-2]) -> 2027 | G108: =IF(RC[-2]+1<13,RC[-2]+1,1) -> 1 | I108: =RC4&","&RC5&",21,0,0,0" -> 2026,12,21,0,0,0 | J108: =RC6&","&RC7&",20,23,59,59" -> 2027,1,20,23,59,59
D109: =R[-12]C+1 -> 2027 | E109: =R[-12]C -> 1 | F109: =IF(RC[1]=1,RC[-2]+1,RC[-2]) -> 2027 | G109: =IF(RC[-2]+1<13,RC[-2]+1,1) -> 2 | I109: =RC4&","&RC5&",21,0,0,0" -> 2027,1,21,0,0,0 | J109: =RC6&","&RC7&",20,23,59,59" -> 2027,2,20,23,59,59
D110: =R[-12]C+1 -> 2027 | E110: =R[-12]C -> 2 | F110: =IF(RC[1]=1,RC[-2]+1,RC[-2]) -> 2027 | G110: =IF(RC[-2]+1<13,RC[-2]+1,1) -> 3 | I110: =RC4&","&RC5&",21,0,0,0" -> 2027,2,21,0,0,0 | J110: =RC6&","&RC7&",20,23,59,59" -> 2027,3,20,23,59,59
D111: =R[-12]C+1 -> 2027 | E111: =R[-12]C -> 3 | F111: =IF(RC[1]=1,RC[-2]+1,RC[-2]) -> 2027 | G111: =IF(RC[-2]+1<13,RC[-2]+1,1) -> 4 | I111: =RC4&","&RC5&",21,0,0,0" -> 2027,3,21,0,0,0 | J111: =RC6&","&RC7&",20,23,59,59" -> 2027,4,20,23,59,59
D112: =R[-12]C+1 -> 2027 | E112: =R[-12]C -> 4 | F112: =IF(RC[1]=1,RC[-2]+1,RC[-2]) -> 2027 | G112: =IF(RC[-2]+1<13,RC[-2]+1,1) -> 5 | I112: =RC4&","&RC5&",21,0,0,0" -> 2027,4,21,0,0,0 | J112: =RC6&","&RC7&",20,23,59,59" -> 2027,5,20,23,59,59
D113: =R[-12]C+1 -> 2027 | E113: =R[-12]C -> 5 | F113: =IF(RC[1]=1,RC[-2]+1,RC[-2]) -> 2027 | G113: =IF(RC[-2]+1<13,RC[-2]+1,1) -> 6 | I113: =RC4&","&RC5&",21,0,0,0" -> 2027,5,21,0,0,0 | J113: =RC6&","&RC7&",20,23,59,59" -> 2027,6,20,23,59,59
D114: =R[-12]C+1 -> 2027 | E114: =R[-12]C -> 6 | F114: =IF(RC[1]=1,RC[-2]+1,RC[-2]) -> 2027 | G114: =IF(RC[-2]+1<13,RC[-2]+1,1) -> 7 | I114: =RC4&","&RC5&",21,0,0,0" -> 2027,6,21,0,0,0 | J114: =RC6&","&RC7&",20,23,59,59" -> 2027,7,20,23,59,59
D115: =R[-12]C+1 -> 2027 | E115: =R[-12]C -> 7 | F115: =IF(RC[1]=1,RC[-2]+1,RC[-2]) -> 2027 | G115: =IF(RC[-2]+1<13,RC[-2]+1,1) -> 8 | I115: =RC4&","&RC5&",21,0,0,0" -> 2027,7,21,0,0,0 | J115: =RC6&","&RC7&",20,23,59,59" -> 2027,8,20,23,59,59
D116: =R[-12]C+1 -> 2027 | E116: =R[-12]C -> 8 | F116: =IF(RC[1]=1,RC[-2]+1,RC[-2]) -> 2027 | G116: =IF(RC[-2]+1<13,RC[-2]+1,1) -> 9 | I116: =RC4&","&RC5&",21,0,0,0" -> 2027,8,21,0,0,0 | J116: =RC6&","&RC7&",20,23,59,59" -> 2027,9,20,23,59,59
D117: =R[-12]C+1 -> 2027 | E117: =R[-12]C -> 9 | F117: =IF(RC[1]=1,RC[-2]+1,RC[-2]) -> 2027 | G117: =IF(RC[-2]+1<13,RC[-2]+1,1) -> 10 | I117: =RC4&","&RC5&",21,0,0,0" -> 2027,9,21,0,0,0 | J117: =RC6&","&RC7&",20,23,59,59" -> 2027,10,20,23,59,59
D118: =R[-12]C+1 -> 2027 | E118: =R[-12]C -> 10 | F118: =IF(RC[1]=1,RC[-2]+1,RC[-2]) -> 2027 | G118: =IF(RC[-2]+1<13,RC[-2]+1,1) -> 11 | I118: =RC4&","&RC5&",21,0,0,0" -> 2027,10,21,0,0,0 | J118: =RC6&","&RC7&",20,23,59,59" -> 2027,11,20,23,59,59
D119: =R[-12]C+1 -> 2027 | E119: =R[-12]C -> 11 | F119: =IF(RC[1]=1,RC[-2]+1,RC[-2]) -> 2027 | G119: =IF(RC[-2]+1<13,RC[-2]+1,1) -> 12 | I119: =RC4&","&RC5&",21,0,0,0" -> 2027,11,21,0,0,0 | J119: =RC6&","&RC7&",20,23,59,59" -> 2027,12,20,23,59,59
D120: =R[-12]C+1 -> 2027 | E120: =R[-12]C -> 12 | F120: =IF(RC[1]=1,RC[-2]+1,RC[-2]) -> 2028 | G120: =IF(RC[-2]+1<13,RC[-2]+1,1) -> 1 | I120: =RC4&","&RC5&",21,0,0,0" -> 2027,12,21,0,0,0 | J120: =RC6&","&RC7&",20,23,59,59" -> 2028,1,20,23,59,59
D121: =R[-12]C+1 -> 2028 | E121: =R[-12]C -> 1 | F121: =IF(RC[1]=1,RC[-2]+1,RC[-2]) -> 2028 | G121: =IF(RC[-2]+1<13,RC[-2]+1,1) -> 2 | I121: =RC4&","&RC5&",21,0,0,0" -> 2028,1,21,0,0,0 | J121: =RC6&","&RC7&",20,23,59,59" -> 2028,2,20,23,59,59
D122: =R[-12]C+1 -> 2028 | E122: =R[-12]C -> 2 | F122: =IF(RC[1]=1,RC[-2]+1,RC[-2]) -> 2028 | G122: =IF(RC[-2]+1<13,RC[-2]+1,1) -> 3 | I122: =RC4&","&RC5&",21,0,0,0" -> 2028,2,21,0,0,0 | J122: =RC6&","&RC7&",20,23,59,59" -> 2028,3,20,23,59,59
D123: =R[-12]C+1 -> 2028 | E123: =R[-12]C -> 3 | F123: =IF(RC[1]=1,RC[-2]+1,RC[-2]) -> 2028 | G123: =IF(RC[-2]+1<13,RC[-2]+1,1) -> 4 | I123: =RC4&","&RC5&",21,0,0,0" -> 2028,3,21,0,0,0 | J123: =RC6&","&RC7&",20,23,59,59" -> 2028,4,20,23,59,59
D124: =R[-12]C+1 -> 2028 | E124: =R[-12]C -> 4 | F124: =IF(RC[1]=1,RC[-2]+1,RC[-2]) -> 2028 | G124: =IF(RC[-2]+1<13,RC[-2]+1,1) -> 5 | I124: =RC4&","&RC5&",21,0,0,0" -> 2028,4,21,0,0,0 | J124: =RC6&","&RC7&",20,23,59,59" -> 2028,5,20,23,59,59
D125: =R[-12]C+1 -> 2028 | E125: =R[-12]C -> 5 | F125: =IF(RC[1]=1,RC[-2]+1,RC[-2]) -> 2028 | G125: =IF(RC[-2]+1<13,RC[-2]+1,1) -> 6 | I125: =RC4&","&RC5&",21,0,0,0" -> 2028,5,21,0,0,0 | J125: =RC6&","&RC7&",20,23,59,59" -> 2028,6,20,23,59,59
D126: =R[-12]C+1 -> 2028 | E126: =R[-12]C -> 6 | F126: =IF(RC[1]=1,RC[-2]+1,RC[-2]) -> 2028 | G126: =IF(RC[-2]+1<13,RC[-2]+1,1) -> 7 | I126: =RC4&","&RC5&",21,0,0,0" -> 2028,6,21,0,0,0 | J126: =RC6&","&RC7&",20,23,59,59" -> 2028,7,20,23,59,59
D127: =R[-12]C+1 -> 2028 | E127: =R[-12]C -> 7 | F127: =IF(RC[1]=1,RC[-2]+1,RC[-2]) -> 2028 | G127: =IF(RC[-2]+1<13,RC[-2]+1,1) -> 8 | I127: =RC4&","&RC5&",21,0,0,0" -> 2028,7,21,0,0,0 | J127: =RC6&","&RC7&",20,23,59,59" -> 2028,8,20,23,59,59
D128: =R[-12]C+1 -> 2028 | E128: =R[-12]C -> 8 | F128: =IF(RC[1]=1,RC[-2]+1,RC[-2]) -> 2028 | G128: =IF(RC[-2]+1<13,RC[-2]+1,1) -> 9 | I128: =RC4&","&RC5&",21,0,0,0" -> 2028,8,21,0,0,0 | J128: =RC6&","&RC7&",20,23,59,59" -> 2028,9,20,23,59,59
D129: =R[-12]C+1 -> 2028 | E129: =R[-12]C -> 9 | F129: =IF(RC[1]=1,RC[-2]+1,RC[-2]) -> 2028 | G129: =IF(RC[-2]+1<13,RC[-2]+1,1) -> 10 | I129: =RC4&","&RC5&",21,0,0,0" -> 2028,9,21,0,0,0 | J129: =RC6&","&RC7&",20,23,59,59" -> 2028,10,20,23,59,59
D130: =R[-12]C+1 -> 2028 | E130: =R[-12]C -> 10 | F130: =IF(RC[1]=1,RC[-2]+1,RC[-2]) -> 2028 | G130: =IF(RC[-2]+1<13,RC[-2]+1,1) -> 11 | I130: =RC4&","&RC5&",21,0,0,0" -> 2028,10,21,0,0,0 | J130: =RC6&","&RC7&",20,23,59,59" -> 2028,11,20,23,59,59
D131: =R[-12]C+1 -> 2028 | E131: =R[-12]C -> 11 | F131: =IF(RC[1]=1,RC[-2]+1,RC[-2]) -> 2028 | G131: =IF(RC[-2]+1<13,RC[-2]+1,1) -> 12 | I131: =RC4&","&RC5&",21,0,0,0" -> 2028,11,21,0,0,0 | J131: =RC6&","&RC7&",20,23,59,59" -> 2028,12,20,23,59,59
D132: =R[-12]C+1 -> 2028 | E132: =R[-12]C -> 12 | F132: =IF(RC[1]=1,RC[-2]+1,RC[-2]) -> 2029 | G132: =IF(RC[-2]+1<13,RC[-2]+1,1) -> 1 | I132: =RC4&","&RC5&",21,0,0,0" -> 2028,12,21,0,0,0 | J132: =RC6&","&RC7&",20,23,59,59" -> 2029,1,20,23,59,59
D133: =R[-12]C+1 -> 2029 | E133: =R[-12]C -> 1 | F133: =IF(RC[1]=1,RC[-2]+1,RC[-2]) -> 2029 | G133: =IF(RC[-2]+1<13,RC[-2]+1,1) -> 2 | I133: =RC4&","&RC5&",21,0,0,0" -> 2029,1,21,0,0,0 | J133: =RC6&","&RC7&",20,23,59,59" -> 2029,2,20,23,59,59
D134: =R[-12]C+1 -> 2029 | E134: =R[-12]C -> 2 | F134: =IF(RC[1]=1,RC[-2]+1,RC[-2]) -> 2029 | G134: =IF(RC[-2]+1<13,RC[-2]+1,1) -> 3 | I134: =RC4&","&RC5&",21,0,0,0" -> 2029,2,21,0,0,0 | J134: =RC6&","&RC7&",20,23,59,59" -> 2029,3,20,23,59,59
D135: =R[-12]C+1 -> 2029 | E135: =R[-12]C -> 3 | F135: =IF(RC[1]=1,RC[-2]+1,RC[-2]) -> 2029 | G135: =IF(RC[-2]+1<13,RC[-2]+1,1) -> 4 | I135: =RC4&","&RC5&",21,0,0,0" -> 2029,3,21,0,0,0 | J135: =RC6&","&RC7&",20,23,59,59" -> 2029,4,20,23,59,59
D136: =R[-12]C+1 -> 2029 | E136: =R[-12]C -> 4 | F136: =IF(RC[1]=1,RC[-2]+1,RC[-2]) -> 2029 | G136: =IF(RC[-2]+1<13,RC[-2]+1,1) -> 5 | I136: =RC4&","&RC5&",21,0,0,0" -> 2029,4,21,0,0,0 | J136: =RC6&","&RC7&",20,23,59,59" -> 2029,5,20,23,59,59
D137: =R[-12]C+1 -> 2029 | E137: =R[-12]C -> 5 | F137: =IF(RC[1]=1,RC[-2]+1,RC[-2]) -> 2029 | G137: =IF(RC[-2]+1<13,RC[-2]+1,1) -> 6 | I137: =RC4&","&RC5&",21,0,0,0" -> 2029,5,21,0,0,0 | J137: =RC6&","&RC7&",20,23,59,59" -> 2029,6,20,23,59,59
D138: =R[-12]C+1 -> 2029 | E138: =R[-12]C -> 6 | F138: =IF(RC[1]=1,RC[-2]+1,RC[-2]) -> 2029 | G138: =IF(RC[-2]+1<13,RC[-2]+1,1) -> 7 | I138: =RC4&","&RC5&",21,0,0,0" -> 2029,6,21,0,0,0 | J138: =RC6&","&RC7&",20,23,59,59" -> 2029,7,20,23,59,59
D139: =R[-12]C+1 -> 2029 | E139: =R[-12]C -> 7 | F139: =IF(RC[1]=1,RC[-2]+1,RC[-2]) -> 2029 | G139: =IF(RC[-2]+1<13,RC[-2]+1,1) -> 8 | I139: =RC4&","&RC5&",21,0,0,0" -> 2029,7,21,0,0,0 | J139: =RC6&","&RC7&",20,23,59,59" -> 2029,8,20,23,59,59
D140: =R[-12]C+1 -> 2029 | E140: =R[-12]C -> 8 | F140: =IF(RC[1]=1,RC[-2]+1,RC[-2]) -> 2029 | G140: =IF(RC[-2]+1<13,RC[-2]+1,1) -> 9 | I140: =RC4&","&RC5&",21,0,0,0" -> 2029,8,21,0,0,0 | J140: =RC6&","&RC7&",20,23,59,59" -> 2029,9,20,23,59,59
D141: =R[-12]C+1 -> 2029 | E141: =R[-12]C -> 9 | F141: =IF(RC[1]=1,RC[-2]+1,RC[-2]) -> 2029 | G141: =IF(RC[-2]+1<13,RC[-2]+1,1) -> 10 | I141: =RC4&","&RC5&",21,0,0,0" -> 2029,9,21,0,0,0 | J141: =RC6&","&RC7&",20,23,59,59" -> 2029,10,20,23,59,59
D142: =R[-12]C+1 -> 2029 | E142: =R[-12]C -> 10 | F142: =IF(RC[1]=1,RC[-2]+1,RC[-2]) -> 2029 | G142: =IF(RC[-2]+1<13,RC[-2]+1,1) -> 11 | I142: =RC4&","&RC5&",21,0,0,0" -> 2029,10,21,0,0,0 | J142: =RC6&","&RC7&",20,23,59,59" -> 2029,11,20,23,59,59
D143: =R[-12]C+1 -> 2029 | E143: =R[-12]C -> 11 | F143: =IF(RC[1]=1,RC[-2]+1,RC[-2]) -> 2029 | G143: =IF(RC[-2]+1<13,RC[-2]+1,1) -> 12 | I143: =RC4&","&RC5&",21,0,0,0" -> 2029,11,21,0,0,0 | J143: =RC6&","&RC7&",20,23,59,59" -> 2029,12,20,23,59,59
D144: =R[-12]C+1 -> 2029 | E144: =R[-12]C -> 12 | F144: =IF(RC[1]=1,RC[-2]+1,RC[-2]) -> 2030 | G144: =IF(RC[-2]+1<13,RC[-2]+1,1) -> 1 | I144: =RC4&","&RC5&",21,0,0,0" -> 2029,12,21,0,0,0 | J144: =RC6&","&RC7&",20,23,59,59" -> 2030,1,20,23,59,59
D145: =R[-12]C+1 -> 2030 | E145: =R[-12]C -> 1 | F145: =IF(RC[1]=1,RC[-2]+1,RC[-2]) -> 2030 | G145: =IF(RC[-2]+1<13,RC[-2]+1,1) -> 2 | I145: =RC4&","&RC5&",21,0,0,0" -> 2030,1,21,0,0,0 | J145: =RC6&","&RC7&",20,23,59,59" -> 2030,2,20,23,59,59
D146: =R[-12]C+1 -> 2030 | E146: =R[-12]C -> 2 | F146: =IF(RC[1]=1,RC[-2]+1,RC[-2]) -> 2030 | G146: =IF(RC[-2]+1<13,RC[-2]+1,1) -> 3 | I146: =RC4&","&RC5&",21,0,0,0" -> 2030,2,21,0,0,0 | J146: =RC6&","&RC7&",20,23,59,59" -> 2030,3,20,23,59,59
D147: =R[-12]C+1 -> 2030 | E147: =R[-12]C -> 3 | F147: =IF(RC[1]=1,RC[-2]+1,RC[-2]) -> 2030 | G147: =IF(RC[-2]+1<13,RC[-2]+1,1) -> 4 | I147: =RC4&","&RC5&",21,0,0,0" -> 2030,3,21,0,0,0 | J147: =RC6&","&RC7&",20,23,59,59" -> 2030,4,20,23,59,59
D148: =R[-12]C+1 -> 2030 | E148: =R[-12]C -> 4 | F148: =IF(RC[1]=1,RC[-2]+1,RC[-2]) -> 2030 | G148: =IF(RC[-2]+1<13,RC[-2]+1,1) -> 5 | I148: =RC4&","&RC5&",21,0,0,0" -> 2030,4,21,0,0,0 | J148: =RC6&","&RC7&",20,23,59,59" -> 2030,5,20,23,59,59
D149: =R[-12]C+1 -> 2030 | E149: =R[-12]C -> 5 | F149: =IF(RC[1]=1,RC[-2]+1,RC[-2]) -> 2030 | G149: =IF(RC[-2]+1<13,RC[-2]+1,1) -> 6 | I149: =RC4&","&RC5&",21,0,0,0" -> 2030,5,21,0,0,0 | J149: =RC6&","&RC7&",20,23,59,59" -> 2030,6,20,23,59,59
D150: =R[-12]C+1 -> 2030 | E150: =R[-12]C -> 6 | F150: =IF(RC[1]=1,RC[-2]+1,RC[-2]) -> 2030 | G150: =IF(RC[-2]+1<13,RC[-2]+1,1) -> 7 | I150: =RC4&","&RC5&",21,0,0,0" -> 2030,6,21,0,0,0 | J150: =RC6&","&RC7&",20,23,59,59" -> 2030,7,20,23,59,59
D151: =R[-12]C+1 -> 2030 | E151: =R[-12]C -> 7 | F151: =IF(RC[1]=1,RC[-2]+1,RC[-2]) -> 2030 | G151: =IF(RC[-2]+1<13,RC[-2]+1,1) -> 8 | I151: =RC4&","&RC5&",21,0,0,0" -> 2030,7,21,0,0,0 | J151: =RC6&","&RC7&",20,23,59,59" -> 2030,8,20,23,59,59
D152: =R[-12]C+1 -> 2030 | E152: =R[-12]C -> 8 | F152: =IF(RC[1]=1,RC[-2]+1,RC[-2]) -> 2030 | G152: =IF(RC[-2]+1<13,RC[-2]+1,1) -> 9 | I152: =RC4&","&RC5&",21,0,0,0" -> 2030,8,21,0,0,0 | J152: =RC6&","&RC7&",20,23,59,59" -> 2030,9,20,23,59,59
D153: =R[-12]C+1 -> 2030 | E153: =R[-12]C -> 9 | F153: =IF(RC[1]=1,RC[-2]+1,RC[-2]) -> 2030 | G153: =IF(RC[-2]+1<13,RC[-2]+1,1) -> 10 | I153: =RC4&","&RC5&",21,0,0,0" -> 2030,9,21,0,0,0 | J153: =RC6&","&RC7&",20,23,59,59" -> 2030,10,20,23,59,59
D154: =R[-12]C+1 -> 2030 | E154: =R[-12]C -> 10 | F154: =IF(RC[1]=1,RC[-2]+1,RC[-2]) -> 2030 | G154: =IF(RC[-2]+1<13,RC[-2]+1,1) -> 11 | I154: =RC4&","&RC5&",21,0,0,0" -> 2030,10,21,0,0,0 | J154: =RC6&","&RC7&",20,23,59,59" -> 2030,11,20,23,59,59
D155: =R[-12]C+1 -> 2030 | E155: =R[-12]C -> 11 | F155: =IF(RC[1]=1,RC[-2]+1,RC[-2]) -> 2030 | G155: =IF(RC[-2]+1<13,RC[-2]+1,1) -> 12 | I155: =RC4&","&RC5&",21,0,0,0" -> 2030,11,21,0,0,0 | J155: =RC6&","&RC7&",20,23,59,59" -> 2030,12,20,23,59,59
D156: =R[-12]C+1 -> 2030 | E156: =R[-12]C -> 12 | F156: =IF(RC[1]=1,RC[-2]+1,RC[-2]) -> 2031 | G156: =IF(RC[-2]+1<13,RC[-2]+1,1) -> 1 | I156: =RC4&","&RC5&",21,0,0,0" -> 2030,12,21,0,0,0 | J156: =RC6&","&RC7&",20,23,59,59" -> 2031,1,20,23,59,59
D157: =R[-12]C+1 -> 2031 | E157: =R[-12]C -> 1 | F157: =IF(RC[1]=1,RC[-2]+1,RC[-2]) -> 2031 | G157: =IF(RC[-2]+1<13,RC[-2]+1,1) -> 2 | I157: =RC4&","&RC5&",21,0,0,0" -> 2031,1,21,0,0,0 | J157: =RC6&","&RC7&",20,23,59,59" -> 2031,2,20,23,59,59
D158: =R[-12]C+1 -> 2031 | E158: =R[-12]C -> 2 | F158: =IF(RC[1]=1,RC[-2]+1,RC[-2]) -> 2031 | G158: =IF(RC[-2]+1<13,RC[-2]+1,1) -> 3 | I158: =RC4&","&RC5&",21,0,0,0" -> 2031,2,21,0,0,0 | J158: =RC6&","&RC7&",20,23,59,59" -> 2031,3,20,23,59,59
D159: =R[-12]C+1 -> 2031 | E159: =R[-12]C -> 3 | F159: =IF(RC[1]=1,RC[-2]+1,RC[-2]) -> 2031 | G159: =IF(RC[-2]+1<13,RC[-2]+1,1) -> 4 | I159: =RC4&","&RC5&",21,0,0,0" -> 2031,3,21,0,0,0 | J159: =RC6&","&RC7&",20,23,59,59" -> 2031,4,20,23,59,59
D160: =R[-12]C+1 -> 2031 | E160: =R[-12]C -> 4 | F160: =IF(RC[1]=1,RC[-2]+1,RC[-2]) -> 2031 | G160: =IF(RC[-2]+1<13,RC[-2]+1,1) -> 5 | I160: =RC4&","&RC5&",21,0,0,0" -> 2031,4,21,0,0,0 | J160: =RC6&","&RC7&",20,23,59,59" -> 2031,5,20,23,59,59
D161: =R[-12]C+1 -> 2031 | E161: =R[-12]C -> 5 | F161: =IF(RC[1]=1,RC[-2]+1,RC[-2]) -> 2031 | G161: =IF(RC[-2]+1<13,RC[-2]+1,1) -> 6 | I161: =RC4&","&RC5&",21,0,0,0" -> 2031,5,21,0,0,0 | J161: =RC6&","&RC7&",20,23,59,59" -> 2031,6,20,23,59,59
D162: =R[-12]C+1 -> 2031 | E162: =R[-12]C -> 6 | F162: =IF(RC[1]=1,RC[-2]+1,RC[-2]) -> 2031 | G162: =IF(RC[-2]+1<13,RC[-2]+1,1) -> 7 | I162: =RC4&","&RC5&",21,0,0,0" -> 2031,6,21,0,0,0 | J162: =RC6&","&RC7&",20,23,59,59" -> 2031,7,20,23,59,59
D163: =R[-12]C+1 -> 2031 | E163: =R[-12]C -> 7 | F163: =IF(RC[1]=1,RC[-2]+1,RC[-2]) -> 2031 | G163: =IF(RC[-2]+1<13,RC[-2]+1,1) -> 8 | I163: =RC4&","&RC5&",21,0,0,0" -> 2031,7,21,0,0,0 | J163: =RC6&","&RC7&",20,23,59,59" -> 2031,8,20,23,59,59
D164: =R[-12]C+1 -> 2031 | E164: =R[-12]C -> 8 | F164: =IF(RC[1]=1,RC[-2]+1,RC[-2]) -> 2031 | G164: =IF(RC[-2]+1<13,RC[-2]+1,1) -> 9 | I164: =RC4&","&RC5&",21,0,0,0" -> 2031,8,21,0,0,0 | J164: =RC6&","&RC7&",20,23,59,59" -> 2031,9,20,23,59,59
D165: =R[-12]C+1 -> 2031 | E165: =R[-12]C -> 9 | F165: =IF(RC[1]=1,RC[-2]+1,RC[-2]) -> 2031 | G165: =IF(RC[-2]+1<13,RC[-2]+1,1) -> 10 | I165: =RC4&","&RC5&",21,0,0,0" -> 2031,9,21,0,0,0 | J165: =RC6&","&RC7&",20,23,59,59" -> 2031,10,20,23,59,59
D166: =R[-12]C+1 -> 2031 | E166: =R[-12]C -> 10 | F166: =IF(RC[1]=1,RC[-2]+1,RC[-2]) -> 2031 | G166: =IF(RC[-2]+1<13,RC[-2]+1,1) -> 11 | I166: =RC4&","&RC5&",21,0,0,0" -> 2031,10,21,0,0,0 | J166: =RC6&","&RC7&",20,23,59,59" -> 2031,11,20,23,59,59
D167: =R[-12]C+1 -> 2031 | E167: =R[-12]C -> 11 | F167: =IF(RC[1]=1,RC[-2]+1,RC[-2]) -> 2031 | G167: =IF(RC[-2]+1<13,RC[-2]+1,1) -> 12 | I167: =RC4&","&RC5&",21,0,0,0" -> 2031,11,21,0,0,0 | J167: =RC6&","&RC7&",20,23,59,59" -> 2031,12,20,23,59,59
D168: =R[-12]C+1 -> 2031 | E168: =R[-12]C -> 12 | F168: =IF(RC[1]=1,RC[-2]+1,RC[-2]) -> 2032 | G168: =IF(RC[-2]+1<13,RC[-2]+1,1) -> 1 | I168: =RC4&","&RC5&",21,0,0,0" -> 2031,12,21,0,0,0 | J168: =RC6&","&RC7&",20,23,59,59" -> 2032,1,20,23,59,59
D169: =R[-12]C+1 -> 2032 | E169: =R[-12]C -> 1 | F169: =IF(RC[1]=1,RC[-2]+1,RC[-2]) -> 2032 | G169: =IF(RC[-2]+1<13,RC[-2]+1,1) -> 2 | I169: =RC4&","&RC5&",21,0,0,0" -> 2032,1,21,0,0,0 | J169: =RC6&","&RC7&",20,23,59,59" -> 2032,2,20,23,59,59
D170: =R[-12]C+1 -> 2032 | E170: =R[-12]C -> 2 | F170: =IF(RC[1]=1,RC[-2]+1,RC[-2]) -> 2032 | G170: =IF(RC[-2]+1<13,RC[-2]+1,1) -> 3 | I170: =RC4&","&RC5&",21,0,0,0" -> 2032,2,21,0,0,0 | J170: =RC6&","&RC7&",20,23,59,59" -> 2032,3,20,23,59,59
D171: =R[-12]C+1 -> 2032 | E171: =R[-12]C -> 3 | F171: =IF(RC[1]=1,RC[-2]+1,RC[-2]) -> 2032 | G171: =IF(RC[-2]+1<13,RC[-2]+1,1) -> 4 | I171: =RC4&","&RC5&",21,0,0,0" -> 2032,3,21,0,0,0 | J171: =RC6&","&RC7&",20,23,59,59" -> 2032,4,20,23,59,59
D172: =R[-12]C+1 -> 2032 | E172: =R[-12]C -> 4 | F172: =IF(RC[1]=1,RC[-2]+1,RC[-2]) -> 2032 | G172: =IF(RC[-2]+1<13,RC[-2]+1,1) -> 5 | I172: =RC4&","&RC5&",21,0,0,0" -> 2032,4,21,0,0,0 | J172: =RC6&","&RC7&",20,23,59,59" -> 2032,5,20,23,59,59
D173: =R[-12]C+1 -> 2032 | E173: =R[-12]C -> 5 | F173: =IF(RC[1]=1,RC[-2]+1,RC[-2]) -> 2032 | G173: =IF(RC[-2]+1<13,RC[-2]+1,1) -> 6 | I173: =RC4&","&RC5&",21,0,0,0" -> 2032,5,21,0,0,0 | J173: =RC6&","&RC7&",20,23,59,59" -> 2032,6,20,23,59,59
D174: =R[-12]C+1 -> 2032 | E174: =R[-12]C -> 6 | F174: =IF(RC[1]=1,RC[-2]+1,RC[-2]) -> 2032 | G174: =IF(RC[-2]+1<13,RC[-2]+1,1) -> 7 | I174: =RC4&","&RC5&",21,0,0,0" -> 2032,6,21,0,0,0 | J174: =RC6&","&RC7&",20,23,59,59" -> 2032,7,20,23,59,59
D175: =R[-12]C+1 -> 2032 | E175: =R[-12]C -> 7 | F175: =IF(RC[1]=1,RC[-2]+1,RC[-2]) -> 2032 | G175: =IF(RC[-2]+1<13,RC[-2]+1,1) -> 8 | I175: =RC4&","&RC5&",21,0,0,0" -> 2032,7,21,0,0,0 | J175: =RC6&","&RC7&",20,23,59,59" -> 2032,8,20,23,59,59
D176: =R[-12]C+1 -> 2032 | E176: =R[-12]C -> 8 | F176: =IF(RC[1]=1,RC[-2]+1,RC[-2]) -> 2032 | G176: =IF(RC[-2]+1<13,RC[-2]+1,1) -> 9 | I176: =RC4&","&RC5&",21,0,0,0" -> 2032,8,21,0,0,0 | J176: =RC6&","&RC7&",20,23,59,59" -> 2032,9,20,23,59,59
D177: =R[-12]C+1 -> 2032 | E177: =R[-12]C -> 9 | F177: =IF(RC[1]=1,RC[-2]+1,RC[-2]) -> 2032 | G177: =IF(RC[-2]+1<13,RC[-2]+1,1) -> 10 | I177: =RC4&","&RC5&",21,0,0,0" -> 2032,9,21,0,0,0 | J177: =RC6&","&RC7&",20,23,59,59" -> 2032,10,20,23,59,59
D178: =R[-12]C+1 -> 2032 | E178: =R[-12]C -> 10 | F178: =IF(RC[1]=1,RC[-2]+1,RC[-2]) -> 2032 | G178: =IF(RC[-2]+1<13,RC[-2]+1,1) -> 11 | I178: =RC4&","&RC5&",21,0,0,0" -> 2032,10,21,0,0,0 | J178: =RC6&","&RC7&",20,23,59,59" -> 2032,11,20,23,59,59
D179: =R[-12]C+1 -> 2032 | E179: =R[-12]C -> 11 | F179: =IF(RC[1]=1,RC[-2]+1,RC[-2]) -> 2032 | G179: =IF(RC[-2]+1<13,RC[-2]+1,1) -> 12 | I179: =RC4&","&RC5&",21,0,0,0" -> 2032,11,21,0,0,0 | J179: =RC6&","&RC7&",20,23,59,59" -> 2032,12,20,23,59,59
D180: =R[-12]C+1 -> 2032 | E180: =R[-12]C -> 12 | F180: =IF(RC[1]=1,RC[-2]+1,RC[-2]) -> 2033 | G180: =IF(RC[-2]+1<13,RC[-2]+1,1) -> 1 | I180: =RC4&","&RC5&",21,0,0,0" -> 2032,12,21,0,0,0 | J180: =RC6&","&RC7&",20,23,59,59" -> 2033,1,20,23,59,59
D181: =R[-12]C+1 -> 2033 | E181: =R[-12]C -> 1 | F181: =IF(RC[1]=1,RC[-2]+1,RC[-2]) -> 2033 | G181: =IF(RC[-2]+1<13,RC[-2]+1,1) -> 2 | I181: =RC4&","&RC5&",21,0,0,0" -> 2033,1,21,0,0,0 | J181: =RC6&","&RC7&",20,23,59,59" -> 2033,2,20,23,59,59
D182: =R[-12]C+1 -> 2033 | E182: =R[-12]C -> 2 | F182: =IF(RC[1]=1,RC[-2]+1,RC[-2]) -> 2033 | G182: =IF(RC[-2]+1<13,RC[-2]+1,1) -> 3 | I182: =RC4&","&RC5&",21,0,0,0" -> 2033,2,21,0,0,0 | J182: =RC6&","&RC7&",20,23,59,59" -> 2033,3,20,23,59,59
D183: =R[-12]C+1 -> 2033 | E183: =R[-12]C -> 3 | F183: =IF(RC[1]=1,RC[-2]+1,RC[-2]) -> 2033 | G183: =IF(RC[-2]+1<13,RC[-2]+1,1) -> 4 | I183: =RC4&","&RC5&",21,0,0,0" -> 2033,3,21,0,0,0 | J183: =RC6&","&RC7&",20,23,59,59" -> 2033,4,20,23,59,59
D184: =R[-12]C+1 -> 2033 | E184: =R[-12]C -> 4 | F184: =IF(RC[1]=1,RC[-2]+1,RC[-2]) -> 2033 | G184: =IF(RC[-2]+1<13,RC[-2]+1,1) -> 5 | I184: =RC4&","&RC5&",21,0,0,0" -> 2033,4,21,0,0,0 | J184: =RC6&","&RC7&",20,23,59,59" -> 2033,5,20,23,59,59
D185: =R[-12]C+1 -> 2033 | E185: =R[-12]C -> 5 | F185: =IF(RC[1]=1,RC[-2]+1,RC[-2]) -> 2033 | G185: =IF(RC[-2]+1<13,RC[-2]+1,1) -> 6 | I185: =RC4&","&RC5&",21,0,0,0" -> 2033,5,21,0,0,0 | J185: =RC6&","&RC7&",20,23,59,59" -> 2033,6,20,23,59,59
D186: =R[-12]C+1 -> 2033 | E186: =R[-12]C -> 6 | F186: =IF(RC[1]=1,RC[-2]+1,RC[-2]) -> 2033 | G186: =IF(RC[-2]+1<13,RC[-2]+1,1) -> 7 | I186: =RC4&","&RC5&",21,0,0,0" -> 2033,6,21,0,0,0 | J186: =RC6&","&RC7&",20,23,59,59" -> 2033,7,20,23,59,59
D187: =R[-12]C+1 -> 2033 | E187: =R[-12]C -> 7 | F187: =IF(RC[1]=1,RC[-2]+1,RC[-2]) -> 2033 | G187: =IF(RC[-2]+1<13,RC[-2]+1,1) -> 8 | I187: =RC4&","&RC5&",21,0,0,0" -> 2033,7,21,0,0,0 | J187: =RC6&","&RC7&",20,23,59,59" -> 2033,8,20,23,59,59
D188: =R[-12]C+1 -> 2033 | E188: =R[-12]C -> 8 | F188: =IF(RC[1]=1,RC[-2]+1,RC[-2]) -> 2033 | G188: =IF(RC[-2]+1<13,RC[-2]+1,1) -> 9 | I188: =RC4&","&RC5&",21,0,0,0" -> 2033,8,21,0,0,0 | J188: =RC6&","&RC7&",20,23,59,59" -> 2033,9,20,23,59,59
D189: =R[-12]C+1 -> 2033 | E189: =R[-12]C -> 9 | F189: =IF(RC[1]=1,RC[-2]+1,RC[-2]) -> 2033 | G189: =IF(RC[-2]+1<13,RC[-2]+1,1) -> 10 | I189: =RC4&","&RC5&",21,0,0,0" -> 2033,9,21,0,0,0 | J189: =RC6&","&RC7&",20,23,59,59" -> 2033,10,20,23,59,59
D190: =R[-12]C+1 -> 2033 | E190: =R[-12]C -> 10 | F190: =IF(RC[1]=1,RC[-2]+1,RC[-2]) -> 2033 | G190: =IF(RC[-2]+1<13,RC[-2]+1,1) -> 11 | I190: =RC4&","&RC5&",21,0,0,0" -> 2033,10,21,0,0,0 | J190: =RC6&","&RC7&",20,23,59,59" -> 2033,11,20,23,59,59
D191: =R[-12]C+1 -> 2033 | E191: =R[-12]C -> 11 | F191: =IF(RC[1]=1,RC[-2]+1,RC[-2]) -> 2033 | G191: =IF(RC[-2]+1<13,RC[-2]+1,1) -> 12 | I191: =RC4&","&RC5&",21,0,0,0" -> 2033,11,21,0,0,0 | J191: =RC6&","&RC7&",20,23,59,59" -> 2033,12,20,23,59,59
D192: =R[-12]C+1 -> 2033 | E192: =R[-12]C -> 12 | F192: =IF(RC[1]=1,RC[-2]+1,RC[-2]) -> 2034 | G192: =IF(RC[-2]+1<13,RC[-2]+1,1) -> 1 | I192: =RC4&","&RC5&",21,0,0,0" -> 2033,12,21,0,0,0 | J192: =RC6&","&RC7&",20,23,59,59" -> 2034,1,20,23,59,59
D193: =R[-12]C+1 -> 2034 | E193: =R[-12]C -> 1 | F193: =IF(RC[1]=1,RC[-2]+1,RC[-2]) -> 2034 | G193: =IF(RC[-2]+1<13,RC[-2]+1,1) -> 2 | I193: =RC4&","&RC5&",21,0,0,0" -> 2034,1,21,0,0,0 | J193: =RC6&","&RC7&",20,23,59,59" -> 2034,2,20,23,59,59
D194: =R[-12]C+1 -> 2034 | E194: =R[-12]C -> 2 | F194: =IF(RC[1]=1,RC[-2]+1,RC[-2]) -> 2034 | G194: =IF(RC[-2]+1<13,RC[-2]+1,1) -> 3 | I194: =RC4&","&RC5&",21,0,0,0" -> 2034,2,21,0,0,0 | J194: =RC6&","&RC7&",20,23,59,59" -> 2034,3,20,23,59,59
D195: =R[-12]C+1 -> 2034 | E195: =R[-12]C -> 3 | F195: =IF(RC[1]=1,RC[-2]+1,RC[-2]) -> 2034 | G195: =IF(RC[-2]+1<13,RC[-2]+1,1) -> 4 | I195: =RC4&","&RC5&",21,0,0,0" -> 2034,3,21,0,0,0 | J195: =RC6&","&RC7&",20,23,59,59" -> 2034,4,20,23,59,59
D196: =R[-12]C+1 -> 2034 | E196: =R[-12]C -> 4 | F196: =IF(RC[1]=1,RC[-2]+1,RC[-2]) -> 2034 | G196: =IF(RC[-2]+1<13,RC[-2]+1,1) -> 5 | I196: =RC4&","&RC5&",21,0,0,0" -> 2034,4,21,0,0,0 | J196: =RC6&","&RC7&",20,23,59,59" -> 2034,5,20,23,59,59
D197: =R[-12]C+1 -> 2034 | E197: =R[-12]C -> 5 | F197: =IF(RC[1]=1,RC[-2]+1,RC[-2]) -> 2034 | G197: =IF(RC[-2]+1<13,RC[-2]+1,1) -> 6 | I197: =RC4&","&RC5&",21,0,0,0" -> 2034,5,21,0,0,0 | J197: =RC6&","&RC7&",20,23,59,59" -> 2034,6,20,23,59,59
D198: =R[-12]C+1 -> 2034 | E198: =R[-12]C -> 6 | F198: =IF(RC[1]=1,RC[-2]+1,RC[-2]) -> 2034 | G198: =IF(RC[-2]+1<13,RC[-2]+1,1) -> 7 | I198: =RC4&","&RC5&",21,0,0,0" -> 2034,6,21,0,0,0 | J198: =RC6&","&RC7&",20,23,59,59" -> 2034,7,20,23,59,59
D199: =R[-12]C+1 -> 2034 | E199: =R[-12]C -> 7 | F199: =IF(RC[1]=1,RC[-2]+1,RC[-2]) -> 2034 | G199: =IF(RC[-2]+1<13,RC[-2]+1,1) -> 8 | I199: =RC4&","&RC5&",21,0,0,0" -> 2034,7,21,0,0,0 | J199: =RC6&","&RC7&",20,23,59,59" -> 2034,8,20,23,59,59
D200: =R[-12]C+1 -> 2034 | E200: =R[-12]C -> 8 | F200: =IF(RC[1]=1,RC[-2]+1,RC[-2]) -> 2034 | G200: =IF(RC[-2]+1<13,RC[-2]+1,1) -> 9 | I200: =RC4&","&RC5&",21,0,0,0" -> 2034,8,21,0,0,0 | J200: =RC6&","&RC7&",20,23,59,59" -> 2034,9,20,23,59,59
D201: =R[-12]C+1 -> 2034 | E201: =R[-12]C -> 9 | F201: =IF(RC[1]=1,RC[-2]+1,RC[-2]) -> 2034 | G201: =IF(RC[-2]+1<13,RC[-2]+1,1) -> 10 | I201: =RC4&","&RC5&",21,0,0,0" -> 2034,9,21,0,0,0 | J201: =RC6&","&RC7&",20,23,59,59" -> 2034,10,20,23,59,59
D202: =R[-12]C+1 -> 2034 | E202: =R[-12]C -> 10 | F202: =IF(RC[1]=1,RC[-2]+1,RC[-2]) -> 2034 | G202: =IF(RC[-2]+1<13,RC[-2]+1,1) -> 11 | I202: =RC4&","&RC5&",21,0,0,0" -> 2034,10,21,0,0,0 | J202: =RC6&","&RC7&",20,23,59,59" -> 2034,11,20,23,59,59
D203: =R[-12]C+1 -> 2034 | E203: =R[-12]C -> 11 | F203: =IF(RC[1]=1,RC[-2]+1,RC[-2]) -> 2034 | G203: =IF(RC[-2]+1<13,RC[-2]+1,1) -> 12 | I203: =RC4&","&RC5&",21,0,0,0" -> 2034,11,21,0,0,0 | J203: =RC6&","&RC7&",20,23,59,59" -> 2034,12,20,23,59,59
D204: =R[-12]C+1 -> 2034 | E204: =R[-12]C -> 12 | F204: =IF(RC[1]=1,RC[-2]+1,RC[-2]) -> 2035 | G204: =IF(RC[-2]+1<13,RC[-2]+1,1) -> 1 | I204: =RC4&","&RC5&",21,0,0,0" -> 2034,12,21,0,0,0 | J204: =RC6&","&RC7&",20,23,59,59" -> 2035,1,20,23,59,59
D205: =R[-12]C+1 -> 2035 | E205: =R[-12]C -> 1 | F205: =IF(RC[1]=1,RC[-2]+1,RC[-2]) -> 2035 | G205: =IF(RC[-2]+1<13,RC[-2]+1,1) -> 2 | I205: =RC4&","&RC5&",21,0,0,0" -> 2035,1,21,0,0,0 | J205: =RC6&","&RC7&",20,23,59,59" -> 2035,2,20,23,59,59
D206: =R[-12]C+1 -> 2035 | E206: =R[-12]C -> 2 | F206: =IF(RC[1]=1,RC[-2]+1,RC[-2]) -> 2035 | G206: =IF(RC[-2]+1<13,RC[-2]+1,1) -> 3 | I206: =RC4&","&RC5&",21,0,0,0" -> 2035,2,21,0,0,0 | J206: =RC6&","&RC7&",20,23,59,59" -> 2035,3,20,23,59,59
D207: =R[-12]C+1 -> 2035 | E207: =R[-12]C -> 3 | F207: =IF(RC[1]=1,RC[-2]+1,RC[-2]) -> 2035 | G207: =IF(RC[-2]+1<13,RC[-2]+1,1) -> 4 | I207: =RC4&","&RC5&",21,0,0,0" -> 2035,3,21,0,0,0 | J207: =RC6&","&RC7&",20,23,59,59" -> 2035,4,20,23,59,59
D208: =R[-12]C+1 -> 2035 | E208: =R[-12]C -> 4 | F208: =IF(RC[1]=1,RC[-2]+1,RC[-2]) -> 2035 | G208: =IF(RC[-2]+1<13,RC[-2]+1,1) -> 5 | I208: =RC4&","&RC5&",21,0,0,0" -> 2035,4,21,0,0,0 | J208: =RC6&","&RC7&",20,23,59,59" -> 2035,5,20,23,59,59
D209: =R[-12]C+1 -> 2035 | E209: =R[-12]C -> 5 | F209: =IF(RC[1]=1,RC[-2]+1,RC[-2]) -> 2035 | G209: =IF(RC[-2]+1<13,RC[-2]+1,1) -> 6 | I209: =RC4&","&RC5&",21,0,0,0" -> 2035,5,21,0,0,0 | J209: =RC6&","&RC7&",20,23,59,59" -> 2035,6,20,23,59,59
D210: =R[-12]C+1 -> 2035 | E210: =R[-12]C -> 6 | F210: =IF(RC[1]=1,RC[-2]+1,RC[-2]) -> 2035 | G210: =IF(RC[-2]+1<13,RC[-2]+1,1) -> 7 | I210: =RC4&","&RC5&",21,0,0,0" -> 2035,6,21,0,0,0 | J210: =RC6&","&RC7&",20,23,59,59" -> 2035,7,20,23,59,59
D211: =R[-12]C+1 -> 2035 | E211: =R[-12]C -> 7 | F211: =IF(RC[1]=1,RC[-2]+1,RC[-2]) -> 2035 | G211: =IF(RC[-2]+1<13,RC[-2]+1,1) -> 8 | I211: =RC4&","&RC5&",21,0,0,0" -> 2035,7,21,0,0,0 | J211: =RC6&","&RC7&",20,23,59,59" -> 2035,8,20,23,59,59
D212: =R[-12]C+1 -> 2035 | E212: =R[-12]C -> 8 | F212: =IF(RC[1]=1,RC[-2]+1,RC[-2]) -> 2035 | G212: =IF(RC[-2]+1<13,RC[-2]+1,1) -> 9 | I212: =RC4&","&RC5&",21,0,0,0" -> 2035,8,21,0,0,0 | J212: =RC6&","&RC7&",20,23,59,59" -> 2035,9,20,23,59,59
D213: =R[-12]C+1 -> 2035 | E213: =R[-12]C -> 9 | F213: =IF(RC[1]=1,RC[-2]+1,RC[-2]) -> 2035 | G213: =IF(RC[-2]+1<13,RC[-2]+1,1) -> 10 | I213: =RC4&","&RC5&",21,0,0,0" -> 2035,9,21,0,0,0 | J213: =RC6&","&RC7&",20,23,59,59" -> 2035,10,20,23,59,59
D214: =R[-12]C+1 -> 2035 | E214: =R[-12]C -> 10 | F214: =IF(RC[1]=1,RC[-2]+1,RC[-2]) -> 2035 | G214: =IF(RC[-2]+1<13,RC[-2]+1,1) -> 11 | I214: =RC4&","&RC5&",21,0,0,0" -> 2035,10,21,0,0,0 | J214: =RC6&","&RC7&",20,23,59,59" -> 2035,11,20,23,59,59
D215: =R[-12]C+1 -> 2035 | E215: =R[-12]C -> 11 | F215: =IF(RC[1]=1,RC[-2]+1,RC[-2]) -> 2035 | G215: =IF(RC[-2]+1<13,RC[-2]+1,1) -> 12 | I215: =RC4&","&RC5&",21,0,0,0" -> 2035,11,21,0,0,0 | J215: =RC6&","&RC7&",20,23,59,59" -> 2035,12,20,23,59,59
D216: =R[-12]C+1 -> 2035 | E216: =R[-12]C -> 12 | F216: =IF(RC[1]=1,RC[-2]+1,RC[-2]) -> 2036 | G216: =IF(RC[-2]+1<13,RC[-2]+1,1) -> 1 | I216: =RC4&","&RC5&",21,0,0,0" -> 2035,12,21,0,0,0 | J216: =RC6&","&RC7&",20,23,59,59" -> 2036,1,20,23,59,59
D217: =R[-12]C+1 -> 2036 | E217: =R[-12]C -> 1 | F217: =IF(RC[1]=1,RC[-2]+1,RC[-2]) -> 2036 | G217: =IF(RC[-2]+1<13,RC[-2]+1,1) -> 2 | I217: =RC4&","&RC5&",21,0,0,0" -> 2036,1,21,0,0,0 | J217: =RC6&","&RC7&",20,23,59,59" -> 2036,2,20,23,59,59
D218: =R[-12]C+1 -> 2036 | E218: =R[-12]C -> 2 | F218: =IF(RC[1]=1,RC[-2]+1,RC[-2]) -> 2036 | G218: =IF(RC[-2]+1<13,RC[-2]+1,1) -> 3 | I218: =RC4&","&RC5&",21,0,0,0" -> 2036,2,21,0,0,0 | J218: =RC6&","&RC7&",20,23,59,59" -> 2036,3,20,23,59,59
D219: =R[-12]C+1 -> 2036 | E219: =R[-12]C -> 3 | F219: =IF(RC[1]=1,RC[-2]+1,RC[-2]) -> 2036 | G219: =IF(RC[-2]+1<13,RC[-2]+1,1) -> 4 | I219: =RC4&","&RC5&",21,0,0,0" -> 2036,3,21,0,0,0 | J219: =RC6&","&RC7&",20,23,59,59" -> 2036,4,20,23,59,59
D220: =R[-12]C+1 -> 2036 | E220: =R[-12]C -> 4 | F220: =IF(RC[1]=1,RC[-2]+1,RC[-2]) -> 2036 | G220: =IF(RC[-2]+1<13,RC[-2]+1,1) -> 5 | I220: =RC4&","&RC5&",21,0,0,0" -> 2036,4,21,0,0,0 | J220: =RC6&","&RC7&",20,23,59,59" -> 2036,5,20,23,59,59
D221: =R[-12]C+1 -> 2036 | E221: =R[-12]C -> 5 | F221: =IF(RC[1]=1,RC[-2]+1,RC[-2]) -> 2036 | G221: =IF(RC[-2]+1<13,RC[-2]+1,1) -> 6 | I221: =RC4&","&RC5&",21,0,0,0" -> 2036,5,21,0,0,0 | J221: =RC6&","&RC7&",20,23,59,59" -> 2036,6,20,23,59,59
D222: =R[-12]C+1 -> 2036 | E222: =R[-12]C -> 6 | F222: =IF(RC[1]=1,RC[-2]+1,RC[-2]) -> 2036 | G222: =IF(RC[-2]+1<13,RC[-2]+1,1) -> 7 | I222: =RC4&","&RC5&",21,0,0,0" -> 2036,6,21,0,0,0 | J222: =RC6&","&RC7&",20,23,59,59" -> 2036,7,20,23,59,59
D223: =R[-12]C+1 -> 2036 | E223: =R[-12]C -> 7 | F223: =IF(RC[1]=1,RC[-2]+1,RC[-2]) -> 2036 | G223: =IF(RC[-2]+1<13,RC[-2]+1,1) -> 8 | I223: =RC4&","&RC5&",21,0,0,0" -> 2036,7,21,0,0,0 | J223: =RC6&","&RC7&",20,23,59,59" -> 2036,8,20,23,59,59
D224: =R[-12]C+1 -> 2036 | E224: =R[-12]C -> 8 | F224: =IF(RC[1]=1,RC[-2]+1,RC[-2]) -> 2036 | G224: =IF(RC[-2]+1<13,RC[-2]+1,1) -> 9 | I224: =RC4&","&RC5&",21,0,0,0" -> 2036,8,21,0,0,0 | J224: =RC6&","&RC7&",20,23,59,59" -> 2036,9,20,23,59,59
D225: =R[-12]C+1 -> 2036 | E225: =R[-12]C -> 9 | F225: =IF(RC[1]=1,RC[-2]+1,RC[-2]) -> 2036 | G225: =IF(RC[-2]+1<13,RC[-2]+1,1) -> 10 | I225: =RC4&","&RC5&",21,0,0,0" -> 2036,9,21,0,0,0 | J225: =RC6&","&RC7&",20,23,59,59" -> 2036,10,20,23,59,59
D226: =R[-12]C+1 -> 2036 | E226: =R[-12]C -> 10 | F226: =IF(RC[1]=1,RC[-2]+1,RC[-2]) -> 2036 | G226: =IF(RC[-2]+1<13,RC[-2]+1,1) -> 11 | I226: =RC4&","&RC5&",21,0,0,0" -> 2036,10,21,0,0,0 | J226: =RC6&","&RC7&",20,23,59,59" -> 2036,11,20,23,59,59
D227: =R[-12]C+1 -> 2036 | E227: =R[-12]C -> 11 | F227: =IF(RC[1]=1,RC[-2]+1,RC[-2]) -> 2036 | G227: =IF(RC[-2]+1<13,RC[-2]+1,1) -> 12 | I227: =RC4&","&RC5&",21,0,0,0" -> 2036,11,21,0,0,0 | J227: =RC6&","&RC7&",20,23,59,59" -> 2036,12,20,23,59,59
D228: =R[-12]C+1 -> 2036 | E228: =R[-12]C -> 12 | F228: =IF(RC[1]=1,RC[-2]+1,RC[-2]) -> 2037 | G228: =IF(RC[-2]+1<13,RC[-2]+1,1) -> 1 | I228: =RC4&","&RC5&",21,0,0,0" -> 2036,12,21,0,0,0 | J228: =RC6&","&RC7&",20,23,59,59" -> 2037,1,20,23,59,59
D229: =R[-12]C+1 -> 2037 | E229: =R[-12]C -> 1 | F229: =IF(RC[1]=1,RC[-2]+1,RC[-2]) -> 2037 | G229: =IF(RC[-2]+1<13,RC[-2]+1,1) -> 2 | I229: =RC4&","&RC5&",21,0,0,0" -> 2037,1,21,0,0,0 | J229: =RC6&","&RC7&",20,23,59,59" -> 2037,2,20,23,59,59
D230: =R[-12]C+1 -> 2037 | E230: =R[-12]C -> 2 | F230: =IF(RC[1]=1,RC[-2]+1,RC[-2]) -> 2037 | G230: =IF(RC[-2]+1<13,RC[-2]+1,1) -> 3 | I230: =RC4&","&RC5&",21,0,0,0" -> 2037,2,21,0,0,0 | J230: =RC6&","&RC7&",20,23,59,59" -> 2037,3,20,23,59,59
D231: =R[-12]C+1 -> 2037 | E231: =R[-12]C -> 3 | F231: =IF(RC[1]=1,RC[-2]+1,RC[-2]) -> 2037 | G231: =IF(RC[-2]+1<13,RC[-2]+1,1) -> 4 | I231: =RC4&","&RC5&",21,0,0,0" -> 2037,3,21,0,0,0 | J231: =RC6&","&RC7&",20,23,59,59" -> 2037,4,20,23,59,59
D232: =R[-12]C+1 -> 2037 | E232: =R[-12]C -> 4 | F232: =IF(RC[1]=1,RC[-2]+1,RC[-2]) -> 2037 | G232: =IF(RC[-2]+1<13,RC[-2]+1,1) -> 5 | I232: =RC4&","&RC5&",21,0,0,0" -> 2037,4,21,0,0,0 | J232: =RC6&","&RC7&",20,23,59,59" -> 2037,5,20,23,59,59
D233: =R[-12]C+1 -> 2037 | E233: =R[-12]C -> 5 | F233: =IF(RC[1]=1,RC[-2]+1,RC[-2]) -> 2037 | G233: =IF(RC[-2]+1<13,RC[-2]+1,1) -> 6 | I233: =RC4&","&RC5&",21,0,0,0" -> 2037,5,21,0,0,0 | J233: =RC6&","&RC7&",20,23,59,59" -> 2037,6,20,23,59,59
D234: =R[-12]C+1 -> 2037 | E234: =R[-12]C -> 6 | F234: =IF(RC[1]=1,RC[-2]+1,RC[-2]) -> 2037 | G234: =IF(RC[-2]+1<13,RC[-2]+1,1) -> 7 | I234: =RC4&","&RC5&",21,0,0,0" -> 2037,6,21,0,0,0 | J234: =RC6&","&RC7&",20,23,59,59" -> 2037,7,20,23,59,59
D235: =R[-12]C+1 -> 2037 | E235: =R[-12]C -> 7 | F235: =IF(RC[1]=1,RC[-2]+1,RC[-2]) -> 2037 | G235: =IF(RC[-2]+1<13,RC[-2]+1,1) -> 8 | I235: =RC4&","&RC5&",21,0,0,0" -> 2037,7,21,0,0,0 | J235: =RC6&","&RC7&",20,23,59,59" -> 2037,8,20,23,59,59
D236: =R[-12]C+1 -> 2037 | E236: =R[-12]C -> 8 | F236: =IF(RC[1]=1,RC[-2]+1,RC[-2]) -> 2037 | G236: =IF(RC[-2]+1<13,RC[-2]+1,1) -> 9 | I236: =RC4&","&RC5&",21,0,0,0" -> 2037,8,21,0,0,0 | J236: =RC6&","&RC7&",20,23,59,59" -> 2037,9,20,23,59,59
D237: =R[-12]C+1 -> 2037 | E237: =R[-12]C -> 9 | F237: =IF(RC[1]=1,RC[-2]+1,RC[-2]) -> 2037 | G237: =IF(RC[-2]+1<13,RC[-2]+1,1) -> 10 | I237: =RC4&","&RC5&",21,0,0,0" -> 2037,9,21,0,0,0 | J237: =RC6&","&RC7&",20,23,59,59" -> 2037,10,20,23,59,59
D238: =R[-12]C+1 -> 2037 | E238: =R[-12]C -> 10 | F238: =IF(RC[1]=1,RC[-2]+1,RC[-2]) -> 2037 | G238: =IF(RC[-2]+1<13,RC[-2]+1,1) -> 11 | I238: =RC4&","&RC5&",21,0,0,0" -> 2037,10,21,0,0,0 | J238: =RC6&","&RC7&",20,23,59,59" -> 2037,11,20,23,59,59
D239: =R[-12]C+1 -> 2037 | E239: =R[-12]C -> 11 | F239: =IF(RC[1]=1,RC[-2]+1,RC[-2]) -> 2037 | G239: =IF(RC[-2]+1<13,RC[-2]+1,1) -> 12 | I239: =RC4&","&RC5&",21,0,0,0" -> 2037,11,21,0,0,0 | J239: =RC6&","&RC7&",20,23,59,59" -> 2037,12,20,23,59,59
D240: =R[-12]C+1 -> 2037 | E240: =R[-12]C -> 12 | F240: =IF(RC[1]=1,RC[-2]+1,RC[-2]) -> 2038 | G240: =IF(RC[-2]+1<13,RC[-2]+1,1) -> 1 | I240: =RC4&","&RC5&",21,0,0,0" -> 2037,12,21,0,0,0 | J240: =RC6&","&RC7&",20,23,59,59" -> 2038,1,20,23,59,59
D241: =R[-12]C+1 -> 2038 | E241: =R[-12]C -> 1 | F241: =IF(RC[1]=1,RC[-2]+1,RC[-2]) -> 2038 | G241: =IF(RC[-2]+1<13,RC[-2]+1,1) -> 2 | I241: =RC4&","&RC5&",21,0,0,0" -> 2038,1,21,0,0,0 | J241: =RC6&","&RC7&",20,23,59,59" -> 2038,2,20,23,59,59
D242: =R[-12]C+1 -> 2038 | E242: =R[-12]C -> 2 | F242: =IF(RC[1]=1,RC[-2]+1,RC[-2]) -> 2038 | G242: =IF(RC[-2]+1<13,RC[-2]+1,1) -> 3 | I242: =RC4&","&RC5&",21,0,0,0" -> 2038,2,21,0,0,0 | J242: =RC6&","&RC7&",20,23,59,59" -> 2038,3,20,23,59,59
D243: =R[-12]C+1 -> 2038 | E243: =R[-12]C -> 3 | F243: =IF(RC[1]=1,RC[-2]+1,RC[-2]) -> 2038 | G243: =IF(RC[-2]+1<13,RC[-2]+1,1) -> 4 | I243: =RC4&","&RC5&",21,0,0,0" -> 2038,3,21,0,0,0 | J243: =RC6&","&RC7&",20,23,59,59" -> 2038,4,20,23,59,59
D244: =R[-12]C+1 -> 2038 | E244: =R[-12]C -> 4 | F244: =IF(RC[1]=1,RC[-2]+1,RC[-2]) -> 2038 | G244: =IF(RC[-2]+1<13,RC[-2]+1,1) -> 5 | I244: =RC4&","&RC5&",21,0,0,0" -> 2038,4,21,0,0,0 | J244: =RC6&","&RC7&",20,23,59,59" -> 2038,5,20,23,59,59
D245: =R[-12]C+1 -> 2038 | E245: =R[-12]C -> 5 | F245: =IF(RC[1]=1,RC[-2]+1,RC[-2]) -> 2038 | G245: =IF(RC[-2]+1<13,RC[-2]+1,1) -> 6 | I245: =RC4&","&RC5&",21,0,0,0" -> 2038,5,21,0,0,0 | J245: =RC6&","&RC7&",20,23,59,59" -> 2038,6,20,23,59,59
D246: =R[-12]C+1 -> 2038 | E246: =R[-12]C -> 6 | F246: =IF(RC[1]=1,RC[-2]+1,RC[-2]) -> 2038 | G246: =IF(RC[-2]+1<13,RC[-2]+1,1) -> 7 | I246: =RC4&","&RC5&",21,0,0,0" -> 2038,6,21,0,0,0 | J246: =RC6&","&RC7&",20,23,59,59" -> 2038,7,20,23,59,59
D247: =R[-12]C+1 -> 2038 | E247: =R[-12]C -> 7 | F247: =IF(RC[1]=1,RC[-2]+1,RC[-2]) -> 2038 | G247: =IF(RC[-2]+1<13,RC[-2]+1,1) -> 8 | I247: =RC4&","&RC5&",21,0,0,0" -> 2038,7,21,0,0,0 | J247: =RC6&","&RC7&",20,23,59,59" -> 2038,8,20,23,59,59
D248: =R[-12]C+1 -> 2038 | E248: =R[-12]C -> 8 | F248: =IF(RC[1]=1,RC[-2]+1,RC[-2]) -> 2038 | G248: =IF(RC[-2]+1<13,RC[-2]+1,1) -> 9 | I248: =RC4&","&RC5&",21,0,0,0" -> 2038,8,21,0,0,0 | J248: =RC6&","&RC7&",20,23,59,59" -> 2038,9,20,23,59,59
D249: =R[-12]C+1 -> 2038 | E249: =R[-12]C -> 9 | F249: =IF(RC[1]=1,RC[-2]+1,RC[-2]) -> 2038 | G249: =IF(RC[-2]+1<13,RC[-2]+1,1) -> 10 | I249: =RC4&","&RC5&",21,0,0,0" -> 2038,9,21,0,0,0 | J249: =RC6&","&RC7&",20,23,59,59" -> 2038,10,20,23,59,59
D250: =R[-12]C+1 -> 2038 | E250: =R[-12]C -> 10 | F250: =IF(RC[1]=1,RC[-2]+1,RC[-2]) -> 2038 | G250: =IF(RC[-2]+1<13,RC[-2]+1,1) -> 11 | I250: =RC4&","&RC5&",21,0,0,0" -> 2038,10,21,0,0,0 | J250: =RC6&","&RC7&",20,23,59,59" -> 2038,11,20,23,59,59
D251: =R[-12]C+1 -> 2038 | E251: =R[-12]C -> 11 | F251: =IF(RC[1]=1,RC[-2]+1,RC[-2]) -> 2038 | G251: =IF(RC[-2]+1<13,RC[-2]+1,1) -> 12 | I251: =RC4&","&RC5&",21,0,0,0" -> 2038,11,21,0,0,0 | J251: =RC6&","&RC7&",20,23,59,59" -> 2038,12,20,23,59,59
D252: =R[-12]C+1 -> 2038 | E252: =R[-12]C -> 12 | F252: =IF(RC[1]=1,RC[-2]+1,RC[-2]) -> 2039 | G252: =IF(RC[-2]+1<13,RC[-2]+1,1) -> 1 | I252: =RC4&","&RC5&",21,0,0,0" -> 2038,12,21,0,0,0 | J252: =RC6&","&RC7&",20,23,59,59" -> 2039,1,20,23,59,59
D253: =R[-12]C+1 -> 2039 | E253: =R[-12]C -> 1 | F253: =IF(RC[1]=1,RC[-2]+1,RC[-2]) -> 2039 | G253: =IF(RC[-2]+1<13,RC[-2]+1,1) -> 2 | I253: =RC4&","&RC5&",21,0,0,0" -> 2039,1,21,0,0,0 | J253: =RC6&","&RC7&",20,23,59,59" -> 2039,2,20,23,59,59
D254: =R[-12]C+1 -> 2039 | E254: =R[-12]C -> 2 | F254: =IF(RC[1]=1,RC[-2]+1,RC[-2]) -> 2039 | G254: =IF(RC[-2]+1<13,RC[-2]+1,1) -> 3 | I254: =RC4&","&RC5&",21,0,0,0" -> 2039,2,21,0,0,0 | J254: =RC6&","&RC7&",20,23,59,59" -> 2039,3,20,23,59,59
D255: =R[-12]C+1 -> 2039 | E255: =R[-12]C -> 3 | F255: =IF(RC[1]=1,RC[-2]+1,RC[-2]) -> 2039 | G255: =IF(RC[-2]+1<13,RC[-2]+1,1) -> 4 | I255: =RC4&","&RC5&",21,0,0,0" -> 2039,3,21,0,0,0 | J255: =RC6&","&RC7&",20,23,59,59" -> 2039,4,20,23,59,59
D256: =R[-12]C+1 -> 2039 | E256: =R[-12]C -> 4 | F256: =IF(RC[1]=1,RC[-2]+1,RC[-2]) -> 2039 | G256: =IF(RC[-2]+1<13,RC[-2]+1,1) -> 5 | I256: =RC4&","&RC5&",21,0,0,0" -> 2039,4,21,0,0,0 | J256: =RC6&","&RC7&",20,23,59,59" -> 2039,5,20,23,59,59
D257: =R[-12]C+1 -> 2039 | E257: =R[-12]C -> 5 | F257: =IF(RC[1]=1,RC[-2]+1,RC[-2]) -> 2039 | G257: =IF(RC[-2]+1<13,RC[-2]+1,1) -> 6 | I257: =RC4&","&RC5&",21,0,0,0" -> 2039,5,21,0,0,0 | J257: =RC6&","&RC7&",20,23,59,59" -> 2039,6,20,23,59,59
D258: =R[-12]C+1 -> 2039 | E258: =R[-12]C -> 6 | F258: =IF(RC[1]=1,RC[-2]+1,RC[-2]) -> 2039 | G258: =IF(RC[-2]+1<13,RC[-2]+1,1) -> 7 | I258: =RC4&","&RC5&",21,0,0,0" -> 2039,6,21,0,0,0 | J258: =RC6&","&RC7&",20,23,59,59" -> 2039,7,20,23,59,59
D259: =R[-12]C+1 -> 2039 | E259: =R[-12]C -> 7 | F259: =IF(RC[1]=1,RC[-2]+1,RC[-2]) -> 2039 | G259: =IF(RC[-2]+1<13,RC[-2]+1,1) -> 8 | I259: =RC4&","&RC5&",21,0,0,0" -> 2039,7,21,0,0,0 | J259: =RC6&","&RC7&",20,23,59,59" -> 2039,8,20,23,59,59
D260: =R[-12]C+1 -> 2039 | E260: =R[-12]C -> 8 | F260: =IF(RC[1]=1,RC[-2]+1,RC[-2]) -> 2039 | G260: =IF(RC[-2]+1<13,RC[-2]+1,1) -> 9 | I260: =RC4&","&RC5&",21,0,0,0" -> 2039,8,21,0,0,0 | J260: =RC6&","&RC7&",20,23,59,59" -> 2039,9,20,23,59,59
D261: =R[-12]C+1 -> 2039 | E261: =R[-12]C -> 9 | F261: =IF(RC[1]=1,RC[-2]+1,RC[-2]) -> 2039 | G261: =IF(RC[-2]+1<13,RC[-2]+1,1) -> 10 | I261: =RC4&","&RC5&",21,0,0,0" -> 2039,9,21,0,0,0 | J261: =RC6&","&RC7&",20,23,59,59" -> 2039,10,20,23,59,59
D262: =R[-12]C+1 -> 2039 | E262: =R[-12]C -> 10 | F262: =IF(RC[1]=1,RC[-2]+1,RC[-2]) -> 2039 | G262: =IF(RC[-2]+1<13,RC[-2]+1,1) -> 11 | I262: =RC4&","&RC5&",21,0,0,0" -> 2039,10,21,0,0,0 | J262: =RC6&","&RC7&",20,23,59,59" -> 2039,11,20,23,59,59
D263: =R[-12]C+1 -> 2039 | E263: =R[-12]C -> 11 | F263: =IF(RC[1]=1,RC[-2]+1,RC[-2]) -> 2039 | G263: =IF(RC[-2]+1<13,RC[-2]+1,1) -> 12 | I263: =RC4&","&RC5&",21,0,0,0" -> 2039,11,21,0,0,0 | J263: =RC6&","&RC7&",20,23,59,59" -> 2039,12,20,23,59,59
D264: =R[-12]C+1 -> 2039 | E264: =R[-12]C -> 12 | F264: =IF(RC[1]=1,RC[-2]+1,RC[-2]) -> 2040 | G264: =IF(RC[-2]+1<13,RC[-2]+1,1) -> 1 | I264: =RC4&","&RC5&",21,0,0,0" -> 2039,12,21,0,0,0 | J264: =RC6&","&RC7&",20,23,59,59" -> 2040,1,20,23,59,59
D265: =R[-12]C+1 -> 2040 | E265: =R[-12]C -> 1 | F265: =IF(RC[1]=1,RC[-2]+1,RC[-2]) -> 2040 | G265: =IF(RC[-2]+1<13,RC[-2]+1,1) -> 2 | I265: =RC4&","&RC5&",21,0,0,0" -> 2040,1,21,0,0,0 | J265: =RC6&","&RC7&",20,23,59,59" -> 2040,2,20,23,59,59
D266: =R[-12]C+1 -> 2040 | E266: =R[-12]C -> 2 | F266: =IF(RC[1]=1,RC[-2]+1,RC[-2]) -> 2040 | G266: =IF(RC[-2]+1<13,RC[-2]+1,1) -> 3 | I266: =RC4&","&RC5&",21,0,0,0" -> 2040,2,21,0,0,0 | J266: =RC6&","&RC7&",20,23,59,59" -> 2040,3,20,23,59,59
D267: =R[-12]C+1 -> 2040 | E267: =R[-12]C -> 3 | F267: =IF(RC[1]=1,RC[-2]+1,RC[-2]) -> 2040 | G267: =IF(RC[-2]+1<13,RC[-2]+1,1) -> 4 | I267: =RC4&","&RC5&",21,0,0,0" -> 2040,3,21,0,0,0 | J267: =RC6&","&RC7&",20,23,59,59" -> 2040,4,20,23,59,59
D268: =R[-12]C+1 -> 2040 | E268: =R[-12]C -> 4 | F268: =IF(RC[1]=1,RC[-2]+1,RC[-2]) -> 2040 | G268: =IF(RC[-2]+1<13,RC[-2]+1,1) -> 5 | I268: =RC4&","&RC5&",21,0,0,0" -> 2040,4,21,0,0,0 | J268: =RC6&","&RC7&",20,23,59,59" -> 2040,5,20,23,59,59
D269: =R[-12]C+1 -> 2040 | E269: =R[-12]C -> 5 | F269: =IF(RC[1]=1,RC[-2]+1,RC[-2]) -> 2040 | G269: =IF(RC[-2]+1<13,RC[-2]+1,1) -> 6 | I269: =RC4&","&RC5&",21,0,0,0" -> 2040,5,21,0,0,0 | J269: =RC6&","&RC7&",20,23,59,59" -> 2040,6,20,23,59,59
D270: =R[-12]C+1 -> 2040 | E270: =R[-12]C -> 6 | F270: =IF(RC[1]=1,RC[-2]+1,RC[-2]) -> 2040 | G270: =IF(RC[-2]+1<13,RC[-2]+1,1) -> 7 | I270: =RC4&","&RC5&",21,0,0,0" -> 2040,6,21,0,0,0 | J270: =RC6&","&RC7&",20,23,59,59" -> 2040,7,20,23,59,59
D271: =R[-12]C+1 -> 2040 | E271: =R[-12]C -> 7 | F271: =IF(RC[1]=1,RC[-2]+1,RC[-2]) -> 2040 | G271: =IF(RC[-2]+1<13,RC[-2]+1,1) -> 8 | I271: =RC4&","&RC5&",21,0,0,0" -> 2040,7,21,0,0,0 | J271: =RC6&","&RC7&",20,23,59,59" -> 2040,8,20,23,59,59
D272: =R[-12]C+1 -> 2040 | E272: =R[-12]C -> 8 | F272: =IF(RC[1]=1,RC[-2]+1,RC[-2]) -> 2040 | G272: =IF(RC[-2]+1<13,RC[-2]+1,1) -> 9 | I272: =RC4&","&RC5&",21,0,0,0" -> 2040,8,21,0,0,0 | J272: =RC6&","&RC7&",20,23,59,59" -> 2040,9,20,23,59,59
D273: =R[-12]C+1 -> 2040 | E273: =R[-12]C -> 9 | F273: =IF(RC[1]=1,RC[-2]+1,RC[-2]) -> 2040 | G273: =IF(RC[-2]+1<13,RC[-2]+1,1) -> 10 | I273: =RC4&","&RC5&",21,0,0,0" -> 2040,9,21,0,0,0 | J273: =RC6&","&RC7&",20,23,59,59" -> 2040,10,20,23,59,59
D274: =R[-12]C+1 -> 2040 | E274: =R[-12]C -> 10 | F274: =IF(RC[1]=1,RC[-2]+1,RC[-2]) -> 2040 | G274: =IF(RC[-2]+1<13,RC[-2]+1,1) -> 11 | I274: =RC4&","&RC5&",21,0,0,0" -> 2040,10,21,0,0,0 | J274: =RC6&","&RC7&",20,23,59,59" -> 2040,11,20,23,59,59
D275: =R[-12]C+1 -> 2040 | E275: =R[-12]C -> 11 | F275: =IF(RC[1]=1,RC[-2]+1,RC[-2]) -> 2040 | G275: =IF(RC[-2]+1<13,RC[-2]+1,1) -> 12 | I275: =RC4&","&RC5&",21,0,0,0" -> 2040,11,21,0,0,0 | J275: =RC6&","&RC7&",20,23,59,59" -> 2040,12,20,23,59,59
D276: =R[-12]C+1 -> 2040 | E276: =R[-12]C -> 12 | F276: =IF(RC[1]=1,RC[-2]+1,RC[-2]) -> 2041 | G276: =IF(RC[-2]+1<13,RC[-2]+1,1) -> 1 | I276: =RC4&","&RC5&",21,0,0,0" -> 2040,12,21,0,0,0 | J276: =RC6&","&RC7&",20,23,59,59" -> 2041,1,20,23,59,59
D277: =R[-12]C+1 -> 2041 | E277: =R[-12]C -> 1 | F277: =IF(RC[1]=1,RC[-2]+1,RC[-2]) -> 2041 | G277: =IF(RC[-2]+1<13,RC[-2]+1,1) -> 2 | I277: =RC4&","&RC5&",21,0,0,0" -> 2041,1,21,0,0,0 | J277: =RC6&","&RC7&",20,23,59,59" -> 2041,2,20,23,59,59
D278: =R[-12]C+1 -> 2041 | E278: =R[-12]C -> 2 | F278: =IF(RC[1]=1,RC[-2]+1,RC[-2]) -> 2041 | G278: =IF(RC[-2]+1<13,RC[-2]+1,1) -> 3 | I278: =RC4&","&RC5&",21,0,0,0" -> 2041,2,21,0,0,0 | J278: =RC6&","&RC7&",20,23,59,59" -> 2041,3,20,23,59,59
D279: =R[-12]C+1 -> 2041 | E279: =R[-12]C -> 3 | F279: =IF(RC[1]=1,RC[-2]+1,RC[-2]) -> 2041 | G279: =IF(RC[-2]+1<13,RC[-2]+1,1) -> 4 | I279: =RC4&","&RC5&",21,0,0,0" -> 2041,3,21,0,0,0 | J279: =RC6&","&RC7&",20,23,59,59" -> 2041,4,20,23,59,59
D280: =R[-12]C+1 -> 2041 | E280: =R[-12]C -> 4 | F280: =IF(RC[1]=1,RC[-2]+1,RC[-2]) -> 2041 | G280: =IF(RC[-2]+1<13,RC[-2]+1,1) -> 5 | I280: =RC4&","&RC5&",21,0,0,0" -> 2041,4,21,0,0,0 | J280: =RC6&","&RC7&",20,23,59,59" -> 2041,5,20,23,59,59
D281: =R[-12]C+1 -> 2041 | E281: =R[-12]C -> 5 | F281: =IF(RC[1]=1,RC[-2]+1,RC[-2]) -> 2041 | G281: =IF(RC[-2]+1<13,RC[-2]+1,1) -> 6 | I281: =RC4&","&RC5&",21,0,0,0" -> 2041,5,21,0,0,0 | J281: =RC6&","&RC7&",20,23,59,59" -> 2041,6,20,23,59,59
D282: =R[-12]C+1 -> 2041 | E282: =R[-12]C -> 6 | F282: =IF(RC[1]=1,RC[-2]+1,RC[-2]) -> 2041 | G282: =IF(RC[-2]+1<13,RC[-2]+1,1) -> 7 | I282: =RC4&","&RC5&",21,0,0,0" -> 2041,6,21,0,0,0 | J282: =RC6&","&RC7&",20,23,59,59" -> 2041,7,20,23,59,59
D283: =R[-12]C+1 -> 2041 | E283: =R[-12]C -> 7 | F283: =IF(RC[1]=1,RC[-2]+1,RC[-2]) -> 2041 | G283: =IF(RC[-2]+1<13,RC[-2]+1,1) -> 8 | I283: =RC4&","&RC5&",21,0,0,0" -> 2041,7,21,0,0,0 | J283: =RC6&","&RC7&",20,23,59,59" -> 2041,8,20,23,59,59
D284: =R[-12]C+1 -> 2041 | E284: =R[-12]C -> 8 | F284: =IF(RC[1]=1,RC[-2]+1,RC[-2]) -> 2041 | G284: =IF(RC[-2]+1<13,RC[-2]+1,1) -> 9 | I284: =RC4&","&RC5&",21,0,0,0" -> 2041,8,21,0,0,0 | J284: =RC6&","&RC7&",20,23,59,59" -> 2041,9,20,23,59,59
D285: =R[-12]C+1 -> 2041 | E285: =R[-12]C -> 9 | F285: =IF(RC[1]=1,RC[-2]+1,RC[-2]) -> 2041 | G285: =IF(RC[-2]+1<13,RC[-2]+1,1) -> 10 | I285: =RC4&","&RC5&",21,0,0,0" -> 2041,9,21,0,0,0 | J285: =RC6&","&RC7&",20,23,59,59" -> 2041,10,20,23,59,59
D286: =R[-12]C+1 -> 2041 | E286: =R[-12]C -> 10 | F286: =IF(RC[1]=1,RC[-2]+1,RC[-2]) -> 2041 | G286: =IF(RC[-2]+1<13,RC[-2]+1,1) -> 11 | I286: =RC4&","&RC5&",21,0,0,0" -> 2041,10,21,0,0,0 | J286: =RC6&","&RC7&",20,23,59,59" -> 2041,11,20,23,59,59
D287: =R[-12]C+1 -> 2041 | E287: =R[-12]C -> 11 | F287: =IF(RC[1]=1,RC[-2]+1,RC[-2]) -> 2041 | G287: =IF(RC[-2]+1<13,RC[-2]+1,1) -> 12 | I287: =RC4&","&RC5&",21,0,0,0" -> 2041,11,21,0,0,0 | J287: =RC6&","&RC7&",20,23,59,59" -> 2041,12,20,23,59,59
D288: =R[-12]C+1 -> 2041 | E288: =R[-12]C -> 12 | F288: =IF(RC[1]=1,RC[-2]+1,RC[-2]) -> 2042 | G288: =IF(RC[-2]+1<13,RC[-2]+1,1) -> 1 | I288: =RC4&","&RC5&",21,0,0,0" -> 2041,12,21,0,0,0 | J288: =RC6&","&RC7&",20,23,59,59" -> 2042,1,20,23,59,59
D289: =R[-12]C+1 -> 2042 | E289: =R[-12]C -> 1 | F289: =IF(RC[1]=1,RC[-2]+1,RC[-2]) -> 2042 | G289: =IF(RC[-2]+1<13,RC[-2]+1,1) -> 2 | I289: =RC4&","&RC5&",21,0,0,0" -> 2042,1,21,0,0,0 | J289: =RC6&","&RC7&",20,23,59,59" -> 2042,2,20,23,59,59
D290: =R[-12]C+1 -> 2042 | E290: =R[-12]C -> 2 | F290: =IF(RC[1]=1,RC[-2]+1,RC[-2]) -> 2042 | G290: =IF(RC[-2]+1<13,RC[-2]+1,1) -> 3 | I290: =RC4&","&RC5&",21,0,0,0" -> 2042,2,21,0,0,0 | J290: =RC6&","&RC7&",20,23,59,59" -> 2042,3,20,23,59,59
D291: =R[-12]C+1 -> 2042 | E291: =R[-12]C -> 3 | F291: =IF(RC[1]=1,RC[-2]+1,RC[-2]) -> 2042 | G291: =IF(RC[-2]+1<13,RC[-2]+1,1) -> 4 | I291: =RC4&","&RC5&",21,0,0,0" -> 2042,3,21,0,0,0 | J291: =RC6&","&RC7&",20,23,59,59" -> 2042,4,20,23,59,59
D292: =R[-12]C+1 -> 2042 | E292: =R[-12]C -> 4 | F292: =IF(RC[1]=1,RC[-2]+1,RC[-2]) -> 2042 | G292: =IF(RC[-2]+1<13,RC[-2]+1,1) -> 5 | I292: =RC4&","&RC5&",21,0,0,0" -> 2042,4,21,0,0,0 | J292: =RC6&","&RC7&",20,23,59,59" -> 2042,5,20,23,59,59
D293: =R[-12]C+1 -> 2042 | E293: =R[-12]C -> 5 | F293: =IF(RC[1]=1,RC[-2]+1,RC[-2]) -> 2042 | G293: =IF(RC[-2]+1<13,RC[-2]+1,1) -> 6 | I293: =RC4&","&RC5&",21,0,0,0" -> 2042,5,21,0,0,0 | J293: =RC6&","&RC7&",20,23,59,59" -> 2042,6,20,23,59,59
D294: =R[-12]C+1 -> 2042 | E294: =R[-12]C -> 6 | F294: =IF(RC[1]=1,RC[-2]+1,RC[-2]) -> 2042 | G294: =IF(RC[-2]+1<13,RC[-2]+1,1) -> 7 | I294: =RC4&","&RC5&",21,0,0,0" -> 2042,6,21,0,0,0 | J294: =RC6&","&RC7&",20,23,59,59" -> 2042,7,20,23,59,59
D295: =R[-12]C+1 -> 2042 | E295: =R[-12]C -> 7 | F295: =IF(RC[1]=1,RC[-2]+1,RC[-2]) -> 2042 | G295: =IF(RC[-2]+1<13,RC[-2]+1,1) -> 8 | I295: =RC4&","&RC5&",21,0,0,0" -> 2042,7,21,0,0,0 | J295: =RC6&","&RC7&",20,23,59,59" -> 2042,8,20,23,59,59
D296: =R[-12]C+1 -> 2042 | E296: =R[-12]C -> 8 | F296: =IF(RC[1]=1,RC[-2]+1,RC[-2]) -> 2042 | G296: =IF(RC[-2]+1<13,RC[-2]+1,1) -> 9 | I296: =RC4&","&RC5&",21,0,0,0" -> 2042,8,21,0,0,0 | J296: =RC6&","&RC7&",20,23,59,59" -> 2042,9,20,23,59,59
D297: =R[-12]C+1 -> 2042 | E297: =R[-12]C -> 9 | F297: =IF(RC[1]=1,RC[-2]+1,RC[-2]) -> 2042 | G297: =IF(RC[-2]+1<13,RC[-2]+1,1) -> 10 | I297: =RC4&","&RC5&",21,0,0,0" -> 2042,9,21,0,0,0 | J297: =RC6&","&RC7&",20,23,59,59" -> 2042,10,20,23,59,59
D298: =R[-12]C+1 -> 2042 | E298: =R[-12]C -> 10 | F298: =IF(RC[1]=1,RC[-2]+1,RC[-2]) -> 2042 | G298: =IF(RC[-2]+1<13,RC[-2]+1,1) -> 11 | I298: =RC4&","&RC5&",21,0,0,0" -> 2042,10,21,0,0,0 | J298: =RC6&","&RC7&",20,23,59,59" -> 2042,11,20,23,59,59
D299: =R[-12]C+1 -> 2042 | E299: =R[-12]C -> 11 | F299: =IF(RC[1]=1,RC[-2]+1,RC[-2]) -> 2042 | G299: =IF(RC[-2]+1<13,RC[-2]+1,1) -> 12 | I299: =RC4&","&RC5&",21,0,0,0" -> 2042,11,21,0,0,0 | J299: =RC6&","&RC7&",20,23,59,59" -> 2042,12,20,23,59,59
D300: =R[-12]C+1 -> 2042 | E300: =R[-12]C -> 12 | F300: =IF(RC[1]=1,RC[-2]+1,RC[-2]) -> 2043 | G300: =IF(RC[-2]+1<13,RC[-2]+1,1) -> 1 | I300: =RC4&","&RC5&",21,0,0,0" -> 2042,12,21,0,0,0 | J300: =RC6&","&RC7&",20,23,59,59" -> 2043,1,20,23,59,59
D301: =R[-12]C+1 -> 2043 | E301: =R[-12]C -> 1 | F301: =IF(RC[1]=1,RC[-2]+1,RC[-2]) -> 2043 | G301: =IF(RC[-2]+1<13,RC[-2]+1,1) -> 2 | I301: =RC4&","&RC5&",21,0,0,0" -> 2043,1,21,0,0,0 | J301: =RC6&","&RC7&",20,23,59,59" -> 2043,2,20,23,59,59
D302: =R[-12]C+1 -> 2043 | E302: =R[-12]C -> 2 | F302: =IF(RC[1]=1,RC[-2]+1,RC[-2]) -> 2043 | G302: =IF(RC[-2]+1<13,RC[-2]+1,1) -> 3 | I302: =RC4&","&RC5&",21,0,0,0" -> 2043,2,21,0,0,0 | J302: =RC6&","&RC7&",20,23,59,59" -> 2043,3,20,23,59,59
D303: =R[-12]C+1 -> 2043 | E303: =R[-12]C -> 3 | F303: =IF(RC[1]=1,RC[-2]+1,RC[-2]) -> 2043 | G303: =IF(RC[-2]+1<13,RC[-2]+1,1) -> 4 | I303: =RC4&","&RC5&",21,0,0,0" -> 2043,3,21,0,0,0 | J303: =RC6&","&RC7&",20,23,59,59" -> 2043,4,20,23,59,59
D304: =R[-12]C+1 -> 2043 | E304: =R[-12]C -> 4 | F304: =IF(RC[1]=1,RC[-2]+1,RC[-2]) -> 2043 | G304: =IF(RC[-2]+1<13,RC[-2]+1,1) -> 5 | I304: =RC4&","&RC5&",21,0,0,0" -> 2043,4,21,0,0,0 | J304: =RC6&","&RC7&",20,23,59,59" -> 2043,5,20,23,59,59
D305: =R[-12]C+1 -> 2043 | E305: =R[-12]C -> 5 | F305: =IF(RC[1]=1,RC[-2]+1,RC[-2]) -> 2043 | G305: =IF(RC[-2]+1<13,RC[-2]+1,1) -> 6 | I305: =RC4&","&RC5&",21,0,0,0" -> 2043,5,21,0,0,0 | J305: =RC6&","&RC7&",20,23,59,59" -> 2043,6,20,23,59,59
D306: =R[-12]C+1 -> 2043 | E306: =R[-12]C -> 6 | F306: =IF(RC[1]=1,RC[-2]+1,RC[-2]) -> 2043 | G306: =IF(RC[-2]+1<13,RC[-2]+1,1) -> 7 | I306: =RC4&","&RC5&",21,0,0,0" -> 2043,6,21,0,0,0 | J306: =RC6&","&RC7&",20,23,59,59" -> 2043,7,20,23,59,59
D307: =R[-12]C+1 -> 2043 | E307: =R[-12]C -> 7 | F307: =IF(RC[1]=1,RC[-2]+1,RC[-2]) -> 2043 | G307: =IF(RC[-2]+1<13,RC[-2]+1,1) -> 8 | I307: =RC4&","&RC5&",21,0,0,0" -> 2043,7,21,0,0,0 | J307: =RC6&","&RC7&",20,23,59,59" -> 2043,8,20,23,59,59
D308: =R[-12]C+1 -> 2043 | E308: =R[-12]C -> 8 | F308: =IF(RC[1]=1,RC[-2]+1,RC[-2]) -> 2043 | G308: =IF(RC[-2]+1<13,RC[-2]+1,1) -> 9 | I308: =RC4&","&RC5&",21,0,0,0" -> 2043,8,21,0,0,0 | J308: =RC6&","&RC7&",20,23,59,59" -> 2043,9,20,23,59,59
D309: =R[-12]C+1 -> 2043 | E309: =R[-12]C -> 9 | F309: =IF(RC[1]=1,RC[-2]+1,RC[-2]) -> 2043 | G309: =IF(RC[-2]+1<13,RC[-2]+1,1) -> 10 | I309: =RC4&","&RC5&",21,0,0,0" -> 2043,9,21,0,0,0 | J309: =RC6&","&RC7&",20,23,59,59" -> 2043,10,20,23,59,59
D310: =R[-12]C+1 -> 2043 | E310: =R[-12]C -> 10 | F310: =IF(RC[1]=1,RC[-2]+1,RC[-2]) -> 2043 | G310: =IF(RC[-2]+1<13,RC[-2]+1,1) -> 11 | I310: =RC4&","&RC5&",21,0,0,0" -> 2043,10,21,0,0,0 | J310: =RC6&","&RC7&",20,23,59,59" -> 2043,11,20,23,59,59
D311: =R[-12]C+1 -> 2043 | E311: =R[-12]C -> 11 | F311: =IF(RC[1]=1,RC[-2]+1,RC[-2]) -> 2043 | G311: =IF(RC[-2]+1<13,RC[-2]+1,1) -> 12 | I311: =RC4&","&RC5&",21,0,0,0" -> 2043,11,21,0,0,0 | J311: =RC6&","&RC7&",20,23,59,59" -> 2043,12,20,23,59,59
D312: =R[-12]C+1 -> 2043 | E312: =R[-12]C -> 12 | F312: =IF(RC[1]=1,RC[-2]+1,RC[-2]) -> 2044 | G312: =IF(RC[-2]+1<13,RC[-2]+1,1) -> 1 | I312: =RC4&","&RC5&",21,0,0,0" -> 2043,12,21,0,0,0 | J312: =RC6&","&RC7&",20,23,59,59" -> 2044,1,20,23,59,59
D313: =R[-12]C+1 -> 2044 | E313: =R[-12]C -> 1 | F313: =IF(RC[1]=1,RC[-2]+1,RC[-2]) -> 2044 | G313: =IF(RC[-2]+1<13,RC[-2]+1,1) -> 2 | I313: =RC4&","&RC5&",21,0,0,0" -> 2044,1,21,0,0,0 | J313: =RC6&","&RC7&",20,23,59,59" -> 2044,2,20,23,59,59
D314: =R[-12]C+1 -> 2044 | E314: =R[-12]C -> 2 | F314: =IF(RC[1]=1,RC[-2]+1,RC[-2]) -> 2044 | G314: =IF(RC[-2]+1<13,RC[-2]+1,1) -> 3 | I314: =RC4&","&RC5&",21,0,0,0" -> 2044,2,21,0,0,0 | J314: =RC6&","&RC7&",20,23,59,59" -> 2044,3,20,23,59,59
D315: =R[-12]C+1 -> 2044 | E315: =R[-12]C -> 3 | F315: =IF(RC[1]=1,RC[-2]+1,RC[-2]) -> 2044 | G315: =IF(RC[-2]+1<13,RC[-2]+1,1) -> 4 | I315: =RC4&","&RC5&",21,0,0,0" -> 2044,3,21,0,0,0 | J315: =RC6&","&RC7&",20,23,59,59" -> 2044,4,20,23,59,59
D316: =R[-12]C+1 -> 2044 | E316: =R[-12]C -> 4 | F316: =IF(RC[1]=1,RC[-2]+1,RC[-2]) -> 2044 | G316: =IF(RC[-2]+1<13,RC[-2]+1,1) -> 5 | I316: =RC4&","&RC5&",21,0,0,0" -> 2044,4,21,0,0,0 | J316: =RC6&","&RC7&",20,23,59,59" -> 2044,5,20,23,59,59
D317: =R[-12]C+1 -> 2044 | E317: =R[-12]C -> 5 | F317: =IF(RC[1]=1,RC[-2]+1,RC[-2]) -> 2044 | G317: =IF(RC[-2]+1<13,RC[-2]+1,1) -> 6 | I317: =RC4&","&RC5&",21,0,0,0" -> 2044,5,21,0,0,0 | J317: =RC6&","&RC7&",20,23,59,59" -> 2044,6,20,23,59,59
D318: =R[-12]C+1 -> 2044 | E318: =R[-12]C -> 6 | F318: =IF(RC[1]=1,RC[-2]+1,RC[-2]) -> 2044 | G318: =IF(RC[-2]+1<13,RC[-2]+1,1) -> 7 | I318: =RC4&","&RC5&",21,0,0,0" -> 2044,6,21,0,0,0 | J318: =RC6&","&RC7&",20,23,59,59" -> 2044,7,20,23,59,59
D319: =R[-12]C+1 -> 2044 | E319: =R[-12]C -> 7 | F319: =IF(RC[1]=1,RC[-2]+1,RC[-2]) -> 2044 | G319: =IF(RC[-2]+1<13,RC[-2]+1,1) -> 8 | I319: =RC4&","&RC5&",21,0,0,0" -> 2044,7,21,0,0,0 | J319: =RC6&","&RC7&",20,23,59,59" -> 2044,8,20,23,59,59
D320: =R[-12]C+1 -> 2044 | E320: =R[-12]C -> 8 | F320: =IF(RC[1]=1,RC[-2]+1,RC[-2]) -> 2044 | G320: =IF(RC[-2]+1<13,RC[-2]+1,1) -> 9 | I320: =RC4&","&RC5&",21,0,0,0" -> 2044,8,21,0,0,0 | J320: =RC6&","&RC7&",20,23,59,59" -> 2044,9,20,23,59,59
D321: =R[-12]C+1 -> 2044 | E321: =R[-12]C -> 9 | F321: =IF(RC[1]=1,RC[-2]+1,RC[-2]) -> 2044 | G321: =IF(RC[-2]+1<13,RC[-2]+1,1) -> 10 | I321: =RC4&","&RC5&",21,0,0,0" -> 2044,9,21,0,0,0 | J321: =RC6&","&RC7&",20,23,59,59" -> 2044,10,20,23,59,59
D322: =R[-12]C+1 -> 2044 | E322: =R[-12]C -> 10 | F322: =IF(RC[1]=1,RC[-2]+1,RC[-2]) -> 2044 | G322: =IF(RC[-2]+1<13,RC[-2]+1,1) -> 11 | I322: =RC4&","&RC5&",21,0,0,0" -> 2044,10,21,0,0,0 | J322: =RC6&","&RC7&",20,23,59,59" -> 2044,11,20,23,59,59
D323: =R[-12]C+1 -> 2044 | E323: =R[-12]C -> 11 | F323: =IF(RC[1]=1,RC[-2]+1,RC[-2]) -> 2044 | G323: =IF(RC[-2]+1<13,RC[-2]+1,1) -> 12 | I323: =RC4&","&RC5&",21,0,0,0" -> 2044,11,21,0,0,0 | J323: =RC6&","&RC7&",20,23,59,59" -> 2044,12,20,23,59,59
D324: =R[-12]C+1 -> 2044 | E324: =R[-12]C -> 12 | F324: =IF(RC[1]=1,RC[-2]+1,RC[-2]) -> 2045 | G324: =IF(RC[-2]+1<13,RC[-2]+1,1) -> 1 | I324: =RC4&","&RC5&",21,0,0,0" -> 2044,12,21,0,0,0 | J324: =RC6&","&RC7&",20,23,59,59" -> 2045,1,20,23,59,59
D325: =R[-12]C+1 -> 2045 | E325: =R[-12]C -> 1 | F325: =IF(RC[1]=1,RC[-2]+1,RC[-2]) -> 2045 | G325: =IF(RC[-2]+1<13,RC[-2]+1,1) -> 2 | I325: =RC4&","&RC5&",21,0,0,0" -> 2045,1,21,0,0,0 | J325: =RC6&","&RC7&",20,23,59,59" -> 2045,2,20,23,59,59
D326: =R[-12]C+1 -> 2045 | E326: =R[-12]C -> 2 | F326: =IF(RC[1]=1,RC[-2]+1,RC[-2]) -> 2045 | G326: =IF(RC[-2]+1<13,RC[-2]+1,1) -> 3 | I326: =RC4&","&RC5&",21,0,0,0" -> 2045,2,21,0,0,0 | J326: =RC6&","&RC7&",20,23,59,59" -> 2045,3,20,23,59,59
D327: =R[-12]C+1 -> 2045 | E327: =R[-12]C -> 3 | F327: =IF(RC[1]=1,RC[-2]+1,RC[-2]) -> 2045 | G327: =IF(RC[-2]+1<13,RC[-2]+1,1) -> 4 | I327: =RC4&","&RC5&",21,0,0,0" -> 2045,3,21,0,0,0 | J327: =RC6&","&RC7&",20,23,59,59" -> 2045,4,20,23,59,59
D328: =R[-12]C+1 -> 2045 | E328: =R[-12]C -> 4 | F328: =IF(RC[1]=1,RC[-2]+1,RC[-2]) -> 2045 | G328: =IF(RC[-2]+1<13,RC[-2]+1,1) -> 5 | I328: =RC4&","&RC5&",21,0,0,0" -> 2045,4,21,0,0,0 | J328: =RC6&","&RC7&",20,23,59,59" -> 2045,5,20,23,59,59
D329: =R[-12]C+1 -> 2045 | E329: =R[-12]C -> 5 | F329: =IF(RC[1]=1,RC[-2]+1,RC[-2]) -> 2045 | G329: =IF(RC[-2]+1<13,RC[-2]+1,1) -> 6 | I329: =RC4&","&RC5&",21,0,0,0" -> 2045,5,21,0,0,0 | J329: =RC6&","&RC7&",20,23,59,59" -> 2045,6,20,23,59,59
D330: =R[-12]C+1 -> 2045 | E330: =R[-12]C -> 6 | F330: =IF(RC[1]=1,RC[-2]+1,RC[-2]) -> 2045 | G330: =IF(RC[-2]+1<13,RC[-2]+1,1) -> 7 | I330: =RC4&","&RC5&",21,0,0,0" -> 2045,6,21,0,0,0 | J330: =RC6&","&RC7&",20,23,59,59" -> 2045,7,20,23,59,59
D331: =R[-12]C+1 -> 2045 | E331: =R[-12]C -> 7 | F331: =IF(RC[1]=1,RC[-2]+1,RC[-2]) -> 2045 | G331: =IF(RC[-2]+1<13,RC[-2]+1,1) -> 8 | I331: =RC4&","&RC5&",21,0,0,0" -> 2045,7,21,0,0,0 | J331: =RC6&","&RC7&",20,23,59,59" -> 2045,8,20,23,59,59
D332: =R[-12]C+1 -> 2045 | E332: =R[-12]C -> 8 | F332: =IF(RC[1]=1,RC[-2]+1,RC[-2]) -> 2045 | G332: =IF(RC[-2]+1<13,RC[-2]+1,1) -> 9 | I332: =RC4&","&RC5&",21,0,0,0" -> 2045,8,21,0,0,0 | J332: =RC6&","&RC7&",20,23,59,59" -> 2045,9,20,23,59,59
D333: =R[-12]C+1 -> 2045 | E333: =R[-12]C -> 9 | F333: =IF(RC[1]=1,RC[-2]+1,RC[-2]) -> 2045 | G333: =IF(RC[-2]+1<13,RC[-2]+1,1) -> 10 | I333: =RC4&","&RC5&",21,0,0,0" -> 2045,9,21,0,0,0 | J333: =RC6&","&RC7&",20,23,59,59" -> 2045,10,20,23,59,59
D334: =R[-12]C+1 -> 2045 | E334: =R[-12]C -> 10 | F334: =IF(RC[1]=1,RC[-2]+1,RC[-2]) -> 2045 | G334: =IF(RC[-2]+1<13,RC[-2]+1,1) -> 11 | I334: =RC4&","&RC5&",21,0,0,0" -> 2045,10,21,0,0,0 | J334: =RC6&","&RC7&",20,23,59,59" -> 2045,11,20,23,59,59
D335: =R[-12]C+1 -> 2045 | E335: =R[-12]C -> 11 | F335: =IF(RC[1]=1,RC[-2]+1,RC[-2]) -> 2045 | G335: =IF(RC[-2]+1<13,RC[-2]+1,1) -> 12 | I335: =RC4&","&RC5&",21,0,0,0" -> 2045,11,21,0,0,0 | J335: =RC6&","&RC7&",20,23,59,59" -> 2045,12,20,23,59,59
D336: =R[-12]C+1 -> 2045 | E336: =R[-12]C -> 12 | F336: =IF(RC[1]=1,RC[-2]+1,RC[-2]) -> 2046 | G336: =IF(RC[-2]+1<13,RC[-2]+1,1) -> 1 | I336: =RC4&","&RC5&",21,0,0,0" -> 2045,12,21,0,0,0 | J336: =RC6&","&RC7&",20,23,59,59" -> 2046,1,20,23,59,59
D337: =R[-12]C+1 -> 2046 | E337: =R[-12]C -> 1 | F337: =IF(RC[1]=1,RC[-2]+1,RC[-2]) -> 2046 | G337: =IF(RC[-2]+1<13,RC[-2]+1,1) -> 2 | I337: =RC4&","&RC5&",21,0,0,0" -> 2046,1,21,0,0,0 | J337: =RC6&","&RC7&",20,23,59,59" -> 2046,2,20,23,59,59
D338: =R[-12]C+1 -> 2046 | E338: =R[-12]C -> 2 | F338: =IF(RC[1]=1,RC[-2]+1,RC[-2]) -> 2046 | G338: =IF(RC[-2]+1<13,RC[-2]+1,1) -> 3 | I338: =RC4&","&RC5&",21,0,0,0" -> 2046,2,21,0,0,0 | J338: =RC6&","&RC7&",20,23,59,59" -> 2046,3,20,23,59,59
D339: =R[-12]C+1 -> 2046 | E339: =R[-12]C -> 3 | F339: =IF(RC[1]=1,RC[-2]+1,RC[-2]) -> 2046 | G339: =IF(RC[-2]+1<13,RC[-2]+1,1) -> 4 | I339: =RC4&","&RC5&",21,0,0,0" -> 2046,3,21,0,0,0 | J339: =RC6&","&RC7&",20,23,59,59" -> 2046,4,20,23,59,59
D340: =R[-12]C+1 -> 2046 | E340: =R[-12]C -> 4 | F340: =IF(RC[1]=1,RC[-2]+1,RC[-2]) -> 2046 | G340: =IF(RC[-2]+1<13,RC[-2]+1,1) -> 5 | I340: =RC4&","&RC5&",21,0,0,0" -> 2046,4,21,0,0,0 | J340: =RC6&","&RC7&",20,23,59,59" -> 2046,5,20,23,59,59
D341: =R[-12]C+1 -> 2046 | E341: =R[-12]C -> 5 | F341: =IF(RC[1]=1,RC[-2]+1,RC[-2]) -> 2046 | G341: =IF(RC[-2]+1<13,RC[-2]+1,1) -> 6 | I341: =RC4&","&RC5&",21,0,0,0" -> 2046,5,21,0,0,0 | J341: =RC6&","&RC7&",20,23,59,59" -> 2046,6,20,23,59,59
D342: =R[-12]C+1 -> 2046 | E342: =R[-12]C -> 6 | F342: =IF(RC[1]=1,RC[-2]+1,RC[-2]) -> 2046 | G342: =IF(RC[-2]+1<13,RC[-2]+1,1) -> 7 | I342: =RC4&","&RC5&",21,0,0,0" -> 2046,6,21,0,0,0 | J342: =RC6&","&RC7&",20,23,59,59" -> 2046,7,20,23,59,59
D343: =R[-12]C+1 -> 2046 | E343: =R[-12]C -> 7 | F343: =IF(RC[1]=1,RC[-2]+1,RC[-2]) -> 2046 | G343: =IF(RC[-2]+1<13,RC[-2]+1,1) -> 8 | I343: =RC4&","&RC5&",21,0,0,0" -> 2046,7,21,0,0,0 | J343: =RC6&","&RC7&",20,23,59,59" -> 2046,8,20,23,59,59
D344: =R[-12]C+1 -> 2046 | E344: =R[-12]C -> 8 | F344: =IF(RC[1]=1,RC[-2]+1,RC[-2]) -> 2046 | G344: =IF(RC[-2]+1<13,RC[-2]+1,1) -> 9 | I344: =RC4&","&RC5&",21,0,0,0" -> 2046,8,21,0,0,0 | J344: =RC6&","&RC7&",20,23,59,59" -> 2046,9,20,23,59,59
D345: =R[-12]C+1 -> 2046 | E345: =R[-12]C -> 9 | F345: =IF(RC[1]=1,RC[-2]+1,RC[-2]) -> 2046 | G345: =IF(RC[-2]+1<13,RC[-2]+1,1) -> 10 | I345: =RC4&","&RC5&",21,0,0,0" -> 2046,9,21,0,0,0 | J345: =RC6&","&RC7&",20,23,59,59" -> 2046,10,20,23,59,59
D346: =R[-12]C+1 -> 2046 | E346: =R[-12]C -> 10 | F346: =IF(RC[1]=1,RC[-2]+1,RC[-2]) -> 2046 | G346: =IF(RC[-2]+1<13,RC[-2]+1,1) -> 11 | I346: =RC4&","&RC5&",21,0,0,0" -> 2046,10,21,0,0,0 | J346: =RC6&","&RC7&",20,23,59,59" -> 2046,11,20,23,59,59
D347: =R[-12]C+1 -> 2046 | E347: =R[-12]C -> 11 | F347: =IF(RC[1]=1,RC[-2]+1,RC[-2]) -> 2046 | G347: =IF(RC[-2]+1<13,RC[-2]+1,1) -> 12 | I347: =RC4&","&RC5&",21,0,0,0" -> 2046,11,21,0,0,0 | J347: =RC6&","&RC7&",20,23,59,59" -> 2046,12,20,23,59,59
D348: =R[-12]C+1 -> 2046 | E348: =R[-12]C -> 12 | F348: =IF(RC[1]=1,RC[-2]+1,RC[-2]) -> 2047 | G348: =IF(RC[-2]+1<13,RC[-2]+1,1) -> 1 | I348: =RC4&","&RC5&",21,0,0,0" -> 2046,12,21,0,0,0 | J348: =RC6&","&RC7&",20,23,59,59" -> 2047,1,20,23,59,59
D349: =R[-12]C+1 -> 2047 | E349: =R[-12]C -> 1 | F349: =IF(RC[1]=1,RC[-2]+1,RC[-2]) -> 2047 | G349: =IF(RC[-2]+1<13,RC[-2]+1,1) -> 2 | I349: =RC4&","&RC5&",21,0,0,0" -> 2047,1,21,0,0,0 | J349: =RC6&","&RC7&",20,23,59,59" -> 2047,2,20,23,59,59
D350: =R[-12]C+1 -> 2047 | E350: =R[-12]C -> 2 | F350: =IF(RC[1]=1,RC[-2]+1,RC[-2]) -> 2047 | G350: =IF(RC[-2]+1<13,RC[-2]+1,1) -> 3 | I350: =RC4&","&RC5&",21,0,0,0" -> 2047,2,21,0,0,0 | J350: =RC6&","&RC7&",20,23,59,59" -> 2047,3,20,23,59,59
D351: =R[-12]C+1 -> 2047 | E351: =R[-12]C -> 3 | F351: =IF(RC[1]=1,RC[-2]+1,RC[-2]) -> 2047 | G351: =IF(RC[-2]+1<13,RC[-2]+1,1) -> 4 | I351: =RC4&","&RC5&",21,0,0,0" -> 2047,3,21,0,0,0 | J351: =RC6&","&RC7&",20,23,59,59" -> 2047,4,20,23,59,59
D352: =R[-12]C+1 -> 2047 | E352: =R[-12]C -> 4 | F352: =IF(RC[1]=1,RC[-2]+1,RC[-2]) -> 2047 | G352: =IF(RC[-2]+1<13,RC[-2]+1,1) -> 5 | I352: =RC4&","&RC5&",21,0,0,0" -> 2047,4,21,0,0,0 | J352: =RC6&","&RC7&",20,23,59,59" -> 2047,5,20,23,59,59
D353: =R[-12]C+1 -> 2047 | E353: =R[-12]C -> 5 | F353: =IF(RC[1]=1,RC[-2]+1,RC[-2]) -> 2047 | G353: =IF(RC[-2]+1<13,RC[-2]+1,1) -> 6 | I353: =RC4&","&RC5&",21,0,0,0" -> 2047,5,21,0,0,0 | J353: =RC6&","&RC7&",20,23,59,59" -> 2047,6,20,23,59,59
D354: =R[-12]C+1 -> 2047 | E354: =R[-12]C -> 6 | F354: =IF(RC[1]=1,RC[-2]+1,RC[-2]) -> 2047 | G354: =IF(RC[-2]+1<13,RC[-2]+1,1) -> 7 | I354: =RC4&","&RC5&",21,0,0,0" -> 2047,6,21,0,0,0 | J354: =RC6&","&RC7&",20,23,59,59" -> 2047,7,20,23,59,59
D355: =R[-12]C+1 -> 2047 | E355: =R[-12]C -> 7 | F355: =IF(RC[1]=1,RC[-2]+1,RC[-2]) -> 2047 | G355: =IF(RC[-2]+1<13,RC[-2]+1,1) -> 8 | I355: =RC4&","&RC5&",21,0,0,0" -> 2047,7,21,0,0,0 | J355: =RC6&","&RC7&",20,23,59,59" -> 2047,8,20,23,59,59
D356: =R[-12]C+1 -> 2047 | E356: =R[-12]C -> 8 | F356: =IF(RC[1]=1,RC[-2]+1,RC[-2]) -> 2047 | G356: =IF(RC[-2]+1<13,RC[-2]+1,1) -> 9 | I356: =RC4&","&RC5&",21,0,0,0" -> 2047,8,21,0,0,0 | J356: =RC6&","&RC7&",20,23,59,59" -> 2047,9,20,23,59,59
D357: =R[-12]C+1 -> 2047 | E357: =R[-12]C -> 9 | F357: =IF(RC[1]=1,RC[-2]+1,RC[-2]) -> 2047 | G357: =IF(RC[-2]+1<13,RC[-2]+1,1) -> 10 | I357: =RC4&","&RC5&",21,0,0,0" -> 2047,9,21,0,0,0 | J357: =RC6&","&RC7&",20,23,59,59" -> 2047,10,20,23,59,59
D358: =R[-12]C+1 -> 2047 | E358: =R[-12]C -> 10 | F358: =IF(RC[1]=1,RC[-2]+1,RC[-2]) -> 2047 | G358: =IF(RC[-2]+1<13,RC[-2]+1,1) -> 11 | I358: =RC4&","&RC5&",21,0,0,0" -> 2047,10,21,0,0,0 | J358: =RC6&","&RC7&",20,23,59,59" -> 2047,11,20,23,59,59
D359: =R[-12]C+1 -> 2047 | E359: =R[-12]C -> 11 | F359: =IF(RC[1]=1,RC[-2]+1,RC[-2]) -> 2047 | G359: =IF(RC[-2]+1<13,RC[-2]+1,1) -> 12 | I359: =RC4&","&RC5&",21,0,0,0" -> 2047,11,21,0,0,0 | J359: =RC6&","&RC7&",20,23,59,59" -> 2047,12,20,23,59,59
D360: =R[-12]C+1 -> 2047 | E360: =R[-12]C -> 12 | F360: =IF(RC[1]=1,RC[-2]+1,RC[-2]) -> 2048 | G360: =IF(RC[-2]+1<13,RC[-2]+1,1) -> 1 | I360: =RC4&","&RC5&",21,0,0,0" -> 2047,12,21,0,0,0 | J360: =RC6&","&RC7&",20,23,59,59" -> 2048,1,20,23,59,59
D361: =R[-12]C+1 -> 2048 | E361: =R[-12]C -> 1 | F361: =IF(RC[1]=1,RC[-2]+1,RC[-2]) -> 2048 | G361: =IF(RC[-2]+1<13,RC[-2]+1,1) -> 2 | I361: =RC4&","&RC5&",21,0,0,0" -> 2048,1,21,0,0,0 | J361: =RC6&","&RC7&",20,23,59,59" -> 2048,2,20,23,59,59
D362: =R[-12]C+1 -> 2048 | E362: =R[-12]C -> 2 | F362: =IF(RC[1]=1,RC[-2]+1,RC[-2]) -> 2048 | G362: =IF(RC[-2]+1<13,RC[-2]+1,1) -> 3 | I362: =RC4&","&RC5&",21,0,0,0" -> 2048,2,21,0,0,0 | J362: =RC6&","&RC7&",20,23,59,59" -> 2048,3,20,23,59,59
D363: =R[-12]C+1 -> 2048 | E363: =R[-12]C -> 3 | F363: =IF(RC[1]=1,RC[-2]+1,RC[-2]) -> 2048 | G363: =IF(RC[-2]+1<13,RC[-2]+1,1) -> 4 | I363: =RC4&","&RC5&",21,0,0,0" -> 2048,3,21,0,0,0 | J363: =RC6&","&RC7&",20,23,59,59" -> 2048,4,20,23,59,59
D364: =R[-12]C+1 -> 2048 | E364: =R[-12]C -> 4 | F364: =IF(RC[1]=1,RC[-2]+1,RC[-2]) -> 2048 | G364: =IF(RC[-2]+1<13,RC[-2]+1,1) -> 5 | I364: =RC4&","&RC5&",21,0,0,0" -> 2048,4,21,0,0,0 | J364: =RC6&","&RC7&",20,23,59,59" -> 2048,5,20,23,59,59
D365: =R[-12]C+1 -> 2048 | E365: =R[-12]C -> 5 | F365: =IF(RC[1]=1,RC[-2]+1,RC[-2]) -> 2048 | G365: =IF(RC[-2]+1<13,RC[-2]+1,1) -> 6 | I365: =RC4&","&RC5&",21,0,0,0" -> 2048,5,21,0,0,0 | J365: =RC6&","&RC7&",20,23,59,59" -> 2048,6,20,23,59,59
D366: =R[-12]C+1 -> 2048 | E366: =R[-12]C -> 6 | F366: =IF(RC[1]=1,RC[-2]+1,RC[-2]) -> 2048 | G366: =IF(RC[-2]+1<13,RC[-2]+1,1) -> 7 | I366: =RC4&","&RC5&",21,0,0,0" -> 2048,6,21,0,0,0 | J366: =RC6&","&RC7&",20,23,59,59" -> 2048,7,20,23,59,59
D367: =R[-12]C+1 -> 2048 | E367: =R[-12]C -> 7 | F367: =IF(RC[1]=1,RC[-2]+1,RC[-2]) -> 2048 | G367: =IF(RC[-2]+1<13,RC[-2]+1,1) -> 8 | I367: =RC4&","&RC5&",21,0,0,0" -> 2048,7,21,0,0,0 | J367: =RC6&","&RC7&",20,23,59,59" -> 2048,8,20,23,59,59
D368: =R[-12]C+1 -> 2048 | E368: =R[-12]C -> 8 | F368: =IF(RC[1]=1,RC[-2]+1,RC[-2]) -> 2048 | G368: =IF(RC[-2]+1<13,RC[-2]+1,1) -> 9 | I368: =RC4&","&RC5&",21,0,0,0" -> 2048,8,21,0,0,0 | J368: =RC6&","&RC7&",20,23,59,59" -> 2048,9,20,23,59,59
D369: =R[-12]C+1 -> 2048 | E369: =R[-12]C -> 9 | F369: =IF(RC[1]=1,RC[-2]+1,RC[-2]) -> 2048 | G369: =IF(RC[-2]+1<13,RC[-2]+1,1) -> 10 | I369: =RC4&","&RC5&",21,0,0,0" -> 2048,9,21,0,0,0 | J369: =RC6&","&RC7&",20,23,59,59" -> 2048,10,20,23,59,59
D370: =R[-12]C+1 -> 2048 | E370: =R[-12]C -> 10 | F370: =IF(RC[1]=1,RC[-2]+1,RC[-2]) -> 2048 | G370: =IF(RC[-2]+1<13,RC[-2]+1,1) -> 11 | I370: =RC4&","&RC5&",21,0,0,0" -> 2048,10,21,0,0,0 | J370: =RC6&","&RC7&",20,23,59,59" -> 2048,11,20,23,59,59
D371: =R[-12]C+1 -> 2048 | E371: =R[-12]C -> 11 | F371: =IF(RC[1]=1,RC[-2]+1,RC[-2]) -> 2048 | G371: =IF(RC[-2]+1<13,RC[-2]+1,1) -> 12 | I371: =RC4&","&RC5&",21,0,0,0" -> 2048,11,21,0,0,0 | J371: =RC6&","&RC7&",20,23,59,59" -> 2048,12,20,23,59,59
D372: =R[-12]C+1 -> 2048 | E372: =R[-12]C -> 12 | F372: =IF(RC[1]=1,RC[-2]+1,RC[-2]) -> 2049 | G372: =IF(RC[-2]+1<13,RC[-2]+1,1) -> 1 | I372: =RC4&","&RC5&",21,0,0,0" -> 2048,12,21,0,0,0 | J372: =RC6&","&RC7&",20,23,59,59" -> 2049,1,20,23,59,59
D373: =R[-12]C+1 -> 2049 | E373: =R[-12]C -> 1 | F373: =IF(RC[1]=1,RC[-2]+1,RC[-2]) -> 2049 | G373: =IF(RC[-2]+1<13,RC[-2]+1,1) -> 2 | I373: =RC4&","&RC5&",21,0,0,0" -> 2049,1,21,0,0,0 | J373: =RC6&","&RC7&",20,23,59,59" -> 2049,2,20,23,59,59
D374: =R[-12]C+1 -> 2049 | E374: =R[-12]C -> 2 | F374: =IF(RC[1]=1,RC[-2]+1,RC[-2]) -> 2049 | G374: =IF(RC[-2]+1<13,RC[-2]+1,1) -> 3 | I374: =RC4&","&RC5&",21,0,0,0" -> 2049,2,21,0,0,0 | J374: =RC6&","&RC7&",20,23,59,59" -> 2049,3,20,23,59,59
D375: =R[-12]C+1 -> 2049 | E375: =R[-12]C -> 3 | F375: =IF(RC[1]=1,RC[-2]+1,RC[-2]) -> 2049 | G375: =IF(RC[-2]+1<13,RC[-2]+1,1) -> 4 | I375: =RC4&","&RC5&",21,0,0,0" -> 2049,3,21,0,0,0 | J375: =RC6&","&RC7&",20,23,59,59" -> 2049,4,20,23,59,59
D376: =R[-12]C+1 -> 2049 | E376: =R[-12]C -> 4 | F376: =IF(RC[1]=1,RC[-2]+1,RC[-2]) -> 2049 | G376: =IF(RC[-2]+1<13,RC[-2]+1,1) -> 5 | I376: =RC4&","&RC5&",21,0,0,0" -> 2049,4,21,0,0,0 | J376: =RC6&","&RC7&",20,23,59,59" -> 2049,5,20,23,59,59
D377: =R[-12]C+1 -> 2049 | E377: =R[-12]C -> 5 | F377: =IF(RC[1]=1,RC[-2]+1,RC[-2]) -> 2049 | G377: =IF(RC[-2]+1<13,RC[-2]+1,1) -> 6 | I377: =RC4&","&RC5&",21,0,0,0" -> 2049,5,21,0,0,0 | J377: =RC6&","&RC7&",20,23,59,59" -> 2049,6,20,23,59,59
D378: =R[-12]C+1 -> 2049 | E378: =R[-12]C -> 6 | F378: =IF(RC[1]=1,RC[-2]+1,RC[-2]) -> 2049 | G378: =IF(RC[-2]+1<13,RC[-2]+1,1) -> 7 | I378: =RC4&","&RC5&",21,0,0,0" -> 2049,6,21,0,0,0 | J378: =RC6&","&RC7&",20,23,59,59" -> 2049,7,20,23,59,59
D379: =R[-12]C+1 -> 2049 | E379: =R[-12]C -> 7 | F379: =IF(RC[1]=1,RC[-2]+1,RC[-2]) -> 2049 | G379: =IF(RC[-2]+1<13,RC[-2]+1,1) -> 8 | I379: =RC4&","&RC5&",21,0,0,0" -> 2049,7,21,0,0,0 | J379: =RC6&","&RC7&",20,23,59,59" -> 2049,8,20,23,59,59
D380: =R[-12]C+1 -> 2049 | E380: =R[-12]C -> 8 | F380: =IF(RC[1]=1,RC[-2]+1,RC[-2]) -> 2049 | G380: =IF(RC[-2]+1<13,RC[-2]+1,1) -> 9 | I380: =RC4&","&RC5&",21,0,0,0" -> 2049,8,21,0,0,0 | J380: =RC6&","&RC7&",20,23,59,59" -> 2049,9,20,23,59,59
D381: =R[-12]C+1 -> 2049 | E381: =R[-12]C -> 9 | F381: =IF(RC[1]=1,RC[-2]+1,RC[-2]) -> 2049 | G381: =IF(RC[-2]+1<13,RC[-2]+1,1) -> 10 | I381: =RC4&","&RC5&",21,0,0,0" -> 2049,9,21,0,0,0 | J381: =RC6&","&RC7&",20,23,59,59" -> 2049,10,20,23,59,59
D382: =R[-12]C+1 -> 2049 | E382: =R[-12]C -> 10 | F382: =IF(RC[1]=1,RC[-2]+1,RC[-2]) -> 2049 | G382: =IF(RC[-2]+1<13,RC[-2]+1,1) -> 11 | I382: =RC4&","&RC5&",21,0,0,0" -> 2049,10,21,0,0,0 | J382: =RC6&","&RC7&",20,23,59,59" -> 2049,11,20,23,59,59
D383: =R[-12]C+1 -> 2049 | E383: =R[-12]C -> 11 | F383: =IF(RC[1]=1,RC[-2]+1,RC[-2]) -> 2049 | G383: =IF(RC[-2]+1<13,RC[-2]+1,1) -> 12 | I383: =RC4&","&RC5&",21,0,0,0" -> 2049,11,21,0,0,0 | J383: =RC6&","&RC7&",20,23,59,59" -> 2049,12,20,23,59,59
D384: =R[-12]C+1 -> 2049 | E384: =R[-12]C -> 12 | F384: =IF(RC[1]=1,RC[-2]+1,RC[-2]) -> 2050 | G384: =IF(RC[-2]+1<13,RC[-2]+1,1) -> 1 | I384: =RC4&","&RC5&",21,0,0,0" -> 2049,12,21,0,0,0 | J384: =RC6&","&RC7&",20,23,59,59" -> 2050,1,20,23,59,59
D385: =R[-12]C+1 -> 2050 | E385: =R[-12]C -> 1 | F385: =IF(RC[1]=1,RC[-2]+1,RC[-2]) -> 2050 | G385: =IF(RC[-2]+1<13,RC[-2]+1,1) -> 2 | I385: =RC4&","&RC5&",21,0,0,0" -> 2050,1,21,0,0,0 | J385: =RC6&","&RC7&",20,23,59,59" -> 2050,2,20,23,59,59
D386: =R[-12]C+1 -> 2050 | E386: =R[-12]C -> 2 | F386: =IF(RC[1]=1,RC[-2]+1,RC[-2]) -> 2050 | G386: =IF(RC[-2]+1<13,RC[-2]+1,1) -> 3 | I386: =RC4&","&RC5&",21,0,0,0" -> 2050,2,21,0,0,0 | J386: =RC6&","&RC7&",20,23,59,59" -> 2050,3,20,23,59,59
D387: =R[-12]C+1 -> 2050 | E387: =R[-12]C -> 3 | F387: =IF(RC[1]=1,RC[-2]+1,RC[-2]) -> 2050 | G387: =IF(RC[-2]+1<13,RC[-2]+1,1) -> 4 | I387: =RC4&","&RC5&",21,0,0,0" -> 2050,3,21,0,0,0 | J387: =RC6&","&RC7&",20,23,59,59" -> 2050,4,20,23,59,59
D388: =R[-12]C+1 -> 2050 | E388: =R[-12]C -> 4 | F388: =IF(RC[1]=1,RC[-2]+1,RC[-2]) -> 2050 | G388: =IF(RC[-2]+1<13,RC[-2]+1,1) -> 5 | I388: =RC4&","&RC5&",21,0,0,0" -> 2050,4,21,0,0,0 | J388: =RC6&","&RC7&",20,23,59,59" -> 2050,5,20,23,59,59
D389: =R[-12]C+1 -> 2050 | E389: =R[-12]C -> 5 | F389: =IF(RC[1]=1,RC[-2]+1,RC[-2]) -> 2050 | G389: =IF(RC[-2]+1<13,RC[-2]+1,1) -> 6 | I389: =RC4&","&RC5&",21,0,0,0" -> 2050,5,21,0,0,0 | J389: =RC6&","&RC7&",20,23,59,59" -> 2050,6,20,23,59,59
D390: =R[-12]C+1 -> 2050 | E390: =R[-12]C -> 6 | F390: =IF(RC[1]=1,RC[-2]+1,RC[-2]) -> 2050 | G390: =IF(RC[-2]+1<13,RC[-2]+1,1) -> 7 | I390: =RC4&","&RC5&",21,0,0,0" -> 2050,6,21,0,0,0 | J390: =RC6&","&RC7&",20,23,59,59" -> 2050,7,20,23,59,59
D391: =R[-12]C+1 -> 2050 | E391: =R[-12]C -> 7 | F391: =IF(RC[1]=1,RC[-2]+1,RC[-2]) -> 2050 | G391: =IF(RC[-2]+1<13,RC[-2]+1,1) -> 8 | I391: =RC4&","&RC5&",21,0,0,0" -> 2050,7,21,0,0,0 | J391: =RC6&","&RC7&",20,23,59,59" -> 2050,8,20,23,59,59
D392: =R[-12]C+1 -> 2050 | E392: =R[-12]C -> 8 | F392: =IF(RC[1]=1,RC[-2]+1,RC[-2]) -> 2050 | G392: =IF(RC[-2]+1<13,RC[-2]+1,1) -> 9 | I392: =RC4&","&RC5&",21,0,0,0" -> 2050,8,21,0,0,0 | J392: =RC6&","&RC7&",20,23,59,59" -> 2050,9,20,23,59,59
D393: =R[-12]C+1 -> 2050 | E393: =R[-12]C -> 9 | F393: =IF(RC[1]=1,RC[-2]+1,RC[-2]) -> 2050 | G393: =IF(RC[-2]+1<13,RC[-2]+1,1) -> 10 | I393: =RC4&","&RC5&",21,0,0,0" -> 2050,9,21,0,0,0 | J393: =RC6&","&RC7&",20,23,59,59" -> 2050,10,20,23,59,59
D394: =R[-12]C+1 -> 2050 | E394: =R[-12]C -> 10 | F394: =IF(RC[1]=1,RC[-2]+1,RC[-2]) -> 2050 | G394: =IF(RC[-2]+1<13,RC[-2]+1,1) -> 11 | I394: =RC4&","&RC5&",21,0,0,0" -> 2050,10,21,0,0,0 | J394: =RC6&","&RC7&",20,23,59,59" -> 2050,11,20,23,59,59
D395: =R[-12]C+1 -> 2050 | E395: =R[-12]C -> 11 | F395: =IF(RC[1]=1,RC[-2]+1,RC[-2]) -> 2050 | G395: =IF(RC[-2]+1<13,RC[-2]+1,1) -> 12 | I395: =RC4&","&RC5&",21,0,0,0" -> 2050,11,21,0,0,0 | J395: =RC6&","&RC7&",20,23,59,59" -> 2050,12,20,23,59,59
D396: =R[-12]C+1 -> 2050 | E396: =R[-12]C -> 12 | F396: =IF(RC[1]=1,RC[-2]+1,RC[-2]) -> 2051 | G396: =IF(RC[-2]+1<13,RC[-2]+1,1) -> 1 | I396: =RC4&","&RC5&",21,0,0,0" -> 2050,12,21,0,0,0 | J396: =RC6&","&RC7&",20,23,59,59" -> 2051,1,20,23,59,59
A400: 57 | B400: 2023,1,21,0,0,0 | C400: 2023,2,20,23,59,59
A401: 58 | B401: 2023,2,21,0,0,0 | C401: 2023,3,20,23,59,59
A402: 59 | B402: 2023,3,21,0,0,0 | C402: 2023,4,20,23,59,59
A403: 60 | B403: 2023,4,21,0,0,0 | C403: 2023,5,20,23,59,59
A404: 61 | B404: 2023,5,21,0,0,0 | C404: 2023,6,20,23,59,59
A405: 62 | B405: 2023,6,21,0,0,0 | C405: 2023,7,20,23,59,59
A406: 63 | B406: 2023,7,21,0,0,0 | C406: 2023,8,20,23,59,59
A407: 64 | B407: 2023,8,21,0,0,0 | C407: 2023,9,20,23,59,59
A408: 65 | B408: 2023,9,21,0,0,0 | C408: 2023,10,20,23,59,59
A409: 66 | B409: 2023,10,21,0,0,0 | C409: 2023,11,20,23,59,59
A410: 67 | B410: 2023,11,21,0,0,0 | C410: 2023,12,20,23,59,59
A411: 68 | B411: 2023,12,21,0,0,0 | C411: 2024,1,20,23,59,59
A412: 69 | B412: 2024,1,21,0,0,0 | C412: 2024,2,20,23,59,59
A413: 70 | B413: 2024,2,21,0,0,0 | C413: 2024,3,20,23,59,59
A414: 71 | B414: 2024,3,21,0,0,0 | C414: 2024,4,20,23,59,59
A415: 72 | B415: 2024,4,21,0,0,0 | C415: 2024,5,20,23,59,59
A416: 73 | B416: 2024,5,21,0,0,0 | C416: 2024,6,20,23,59,59
A417: 74 | B417: 2024,6,21,0,0,0 | C417: 2024,7,20,23,59,59
A418: 75 | B418: 2024,7,21,0,0,0 | C418: 2024,8,20,23,59,59
A419: 76 | B419: 2024,8,21,0,0,0 | C419: 2024,9,20,23,59,59
A420: 77 | B420: 2024,9,21,0,0,0 | C420: 2024,10,20,23,59,59
A421: 78 | B421: 2024,10,21,0,0,0 | C421: 2024,11,20,23,59,59
A422: 79 | B422: 2024,11,21,0,0,0 | C422: 2024,12,20,23,59,59
A423: 80 | B423: 2024,12,21,0,0,0 | C423: 2025,1,20,23,59,59
A424: 81 | B424: 2025,1,21,0,0,0 | C424: 2025,2,20,23,59,59
A425: 82 | B425: 2025,2,21,0,0,0 | C425: 2025,3,20,23,59,59
A426: 83 | B426: 2025,3,21,0,0,0 | C426: 2025,4,20,23,59,59
A427: 84 | B427: 2025,4,21,0,0,0 | C427: 2025,5,20,23,59,59
A428: 85 | B428: 2025,5,21,0,0,0 | C428: 2025,6,20,23,59,59
A429: 86 | B429: 2025,6,21,0,0,0 | C429: 2025,7,20,23,59,59
A430: 87 | B430: 2025,7,21,0,0,0 | C430: 2025,8,20,23,59,59
A431: 88 | B431: 2025,8,21,0,0,0 | C431: 2025,9,20,23,59,59
A432: 89 | B432: 2025,9,21,0,0,0 | C432: 2025,10,20,23,59,59
A433: 90 | B433: 2025,10,21,0,0,0 | C433: 2025,11,20,23,59,59
A434: 91 | B434: 2025,11,21,0,0,0 | C434: 2025,12,20,23,59,59
A435: 92 | B435: 2025,12,21,0,0,0 | C435: 2026,1,20,23,59,59
A436: 93 | B436: 2026,1,21,0,0,0 | C436: 2026,2,20,23,59,59
A437: 94 | B437: 2026,2,21,0,0,0 | C437: 2026,3,20,23,59,59
A438: 95 | B438: 2026,3,21,0,0,0 | C438: 2026,4,20,23,59,59
A439: 96 | B439: 2026,4,21,0,0,0 | C439: 2026,5,20,23,59,59
A440: 97 | B440: 2026,5,21,0,0,0 | C440: 2026,6,20,23,59,59
A441: 98 | B441: 2026,6,21,0,0,0 | C441: 2026,7,20,23,59,59
A442: 99 | B442: 2026,7,21,0,0,0 | C442: 2026,8,20,23,59,59
A443: 100 | B443: 2026,8,21,0,0,0 | C443: 2026,9,20,23,59,59
A444: 101 | B444: 2026,9,21,0,0,0 | C444: 2026,10,20,23,59,59
A445: 102 | B445: 2026,10,21,0,0,0 | C445: 2026,11,20,23,59,59
A446: 103 | B446: 2026,11,21,0,0,0 | C446: 2026,12,20,23,59,59
A447: 104 | B447: 2026,12,21,0,0,0 | C447: 2027,1,20,23,59,59
A448: 105 | B448: 2027,1,21,0,0,0 | C448: 2027,2,20,23,59,59
A449: 106 | B449: 2027,2,21,0,0,0 | C449: 2027,3,20,23,59,59
A450: 107 | B450: 2027,3,21,0,0,0 | C450: 2027,4,20,23,59,59
A451: 108 | B451: 2027,4,21,0,0,0 | C451: 2027,5,20,23,59,59
A452: 109 | B452: 2027,5,21,0,0,0 | C452: 2027,6,20,23,59,59
A453: 110 | B453: 2027,6,21,0,0,0 | C453: 2027,7,20,23,59,59
A454: 111 | B454: 2027,7,21,0,0,0 | C454: 2027,8,20,23,59,59
A455: 112 | B455: 2027,8,21,0,0,0 | C455: 2027,9,20,23,59,59
A456: 113 | B456: 2027,9,21,0,0,0 | C456: 2027,10,20,23,59,59
A457: 114 | B457: 2027,10,21,0,0,0 | C457: 2027,11,20,23,59,59
A458: 115 | B458: 2027,11,21,0,0,0 | C458: 2027,12,20,23,59,59
A459: 116 | B459: 2027,12,21,0,0,0 | C459: 2028,1,20,23,59,59
A460: 117 | B460: 2028,1,21,0,0,0 | C460: 2028,2,20,23,59,59
A461: 118 | B461: 2028,2,21,0,0,0 | C461: 2028,3,20,23,59,59
A462: 119 | B462: 2028,3,21,0,0,0 | C462: 2028,4,20,23,59,59
A463: 120 | B463: 2028,4,21,0,0,0 | C463: 2028,5,20,23,59,59
A464: 121 | B464: 2028,5,21,0,0,0 | C464: 2028,6,20,23,59,59
A465: 122 | B465: 2028,6,21,0,0,0 | C465: 2028,7,20,23,59,59
A466: 123 | B466: 2028,7,21,0,0,0 | C466: 2028,8,20,23,59,59
A467: 124 | B467: 2028,8,21,0,0,0 | C467: 2028,9,20,23,59,59
A468: 125 | B468: 2028,9,21,0,0,0 | C468: 2028,10,20,23,59,59
A469: 126 | B469: 2028,10,21,0,0,0 | C469: 2028,11,20,23,59,59
A470: 127 | B470: 2028,11,21,0,0,0 | C470: 2028,12,20,23,59,59
A471: 128 | B471: 2028,12,21,0,0,0 | C471: 2029,1,20,23,59,59
A472: 129 | B472: 2029,1,21,0,0,0 | C472: 2029,2,20,23,59,59
A473: 130 | B473: 2029,2,21,0,0,0 | C473: 2029,3,20,23,59,59
A474: 131 | B474: 2029,3,21,0,0,0 | C474: 2029,4,20,23,59,59
A475: 132 | B475: 2029,4,21,0,0,0 | C475: 2029,5,20,23,59,59
A476: 133 | B476: 2029,5,21,0,0,0 | C476: 2029,6,20,23,59,59
A477: 134 | B477: 2029,6,21,0,0,0 | C477: 2029,7,20,23,59,59
A478: 135 | B478: 2029,7,21,0,0,0 | C478: 2029,8,20,23,59,59
A479: 136 | B479: 2029,8,21,0,0,0 | C479: 2029,9,20,23,59,59
A480: 137 | B480: 2029,9,21,0,0,0 | C480: 2029,10,20,23,59,59
A481: 138 | B481: 2029,10,21,0,0,0 | C481: 2029,11,20,23,59,59
A482: 139 | B482: 2029,11,21,0,0,0 | C482: 2029,12,20,23,59,59
A483: 140 | B483: 2029,12,21,0,0,0 | C483: 2030,1,20,23,59,59
A484: 141 | B484: 2030,1,21,0,0,0 | C484: 2030,2,20,23,59,59
A485: 142 | B485: 2030,2,21,0,0,0 | C485: 2030,3,20,23,59,59
A486: 143 | B486: 2030,3,21,0,0,0 | C486: 2030,4,20,23,59,59
A487: 144 | B487: 2030,4,21,0,0,0 | C487: 2030,5,20,23,59,59
A488: 145 | B488: 2030,5,21,0,0,0 | C488: 2030,6,20,23,59,59
A489: 146 | B489: 2030,6,21,0,0,0 | C489: 2030,7,20,23,59,59
A490: 147 | B490: 2030,7,21,0,0,0 | C490: 2030,8,20,23,59,59
A491: 148 | B491: 2030,8,21,0,0,0 | C491: 2030,9,20,23,59,59
A492: 149 | B492: 2030,9,21,0,0,0 | C492: 2030,10,20,23,59,59
A493: 150 | B493: 2030,10,21,0,0,0 | C493: 2030,11,20,23,59,59
A494: 151 | B494: 2030,11,21,0,0,0 | C494: 2030,12,20,23,59,59
A495: 152 | B495: 2030,12,21,0,0,0 | C495: 2031,1,20,23,59,59
A496: 153 | B496: 2031,1,21,0,0,0 | C496: 2031,2,20,23,59,59
A497: 154 | B497: 2031,2,21,0,0,0 | C497: 2031,3,20,23,59,59
A498: 155 | B498: 2031,3,21,0,0,0 | C498: 2031,4,20,23,59,59
A499: 156 | B499: 2031,4,21,0,0,0 | C499: 2031,5,20,23,59,59
A500: 157 | B500: 2031,5,21,0,0,0 | C500: 2031,6,20,23,59,59
A501: 158 | B501: 2031,6,21,0,0,0 | C501: 2031,7,20,23,59,59
A502: 159 | B502: 2031,7,21,0,0,0 | C502: 2031,8,20,23,59,59
A503: 160 | B503: 2031,8,21,0,0,0 | C503: 2031,9,20,23,59,59
A504: 161 | B504: 2031,9,21,0,0,0 | C504: 2031,10,20,23,59,59
A505: 162 | B505: 2031,10,21,0,0,0 | C505: 2031,11,20,23,59,59
A506: 163 | B506: 2031,11,21,0,0,0 | C506: 2031,12,20,23,59,59
A507: 164 | B507: 2031,12,21,0,0,0 | C507: 2032,1,20,23,59,59
A508: 165 | B508: 2032,1,21,0,0,0 | C508: 2032,2,20,23,59,59
A509: 166 | B509: 2032,2,21,0,0,0 | C509: 2032,3,20,23,59,59
A510: 167 | B510: 2032,3,21,0,0,0 | C510: 2032,4,20,23,59,59
A511: 168 | B511: 2032,4,21,0,0,0 | C511: 2032,5,20,23,59,59
A512: 169 | B512: 2032,5,21,0,0,0 | C512: 2032,6,20,23,59,59
A513: 170 | B513: 2032,6,21,0,0,0 | C513: 2032,7,20,23,59,59
A514: 171 | B514: 2032,7,21,0,0,0 | C514: 2032,8,20,23,59,59
A515: 172 | B515: 2032,8,21,0,0,0 | C515: 2032,9,20,23,59,59
A516: 173 | B516: 2032,9,21,0,0,0 | C516: 2032,10,20,23,59,59
A517: 174 | B517: 2032,10,21,0,0,0 | C517: 2032,11,20,23,59,59
A518: 175 | B518: 2032,11,21,0,0,0 | C518: 2032,12,20,23,59,59
A519: 176 | B519: 2032,12,21,0,0,0 | C519: 2033,1,20,23,59,59
A520: 177 | B520: 2033,1,21,0,0,0 | C520: 2033,2,20,23,59,59
A521: 178 | B521: 2033,2,21,0,0,0 | C521: 2033,3,20,23,59,59
A522: 179 | B522: 2033,3,21,0,0,0 | C522: 2033,4,20,23,59,59
A523: 180 | B523: 2033,4,21,0,0,0 | C523: 2033,5,20,23,59,59
A524: 181 | B524: 2033,5,21,0,0,0 | C524: 2033,6,20,23,59,59
A525: 182 | B525: 2033,6,21,0,0,0 | C525: 2033,7,20,23,59,59
A526: 183 | B526: 2033,7,21,0,0,0 | C526: 2033,8,20,23,59,59
A527: 184 | B527: 2033,8,21,0,0,0 | C527: 2033,9,20,23,59,59
A528: 185 | B528: 2033,9,21,0,0,0 | C528: 2033,10,20,23,59,59
A529: 186 | B529: 2033,10,21,0,0,0 | C529: 2033,11,20,23,59,59
A530: 187 | B530: 2033,11,21,0,0,0 | C530: 2033,12,20,23,59,59
A531: 188 | B531: 2033,12,21,0,0,0 | C531: 2034,1,20,23,59,59
A532: 189 | B532: 2034,1,21,0,0,0 | C532: 2034,2,20,23,59,59
A533: 190 | B533: 2034,2,21,0,0,0 | C533: 2034,3,20,23,59,59
A534: 191 | B534: 2034,3,21,0,0,0 | C534: 2034,4,20,23,59,59
A535: 192 | B535: 2034,4,21,0,0,0 | C535: 2034,5,20,23,59,59
A536: 193 | B536: 2034,5,21,0,0,0 | C536: 2034,6,20,23,59,59
A537: 194 | B537: 2034,6,21,0,0,0 | C537: 2034,7,20,23,59,59
A538: 195 | B538: 2034,7,21,0,0,0 | C538: 2034,8,20,23,59,59
A539: 196 | B539: 2034,8,21,0,0,0 | C539: 2034,9,20,23,59,59
A540: 197 | B540: 2034,9,21,0,0,0 | C540: 2034,10,20,23,59,59
A541: 198 | B541: 2034,10,21,0,0,0 | C541: 2034,11,20,23,59,59
A542: 199 | B542: 2034,11,21,0,0,0 | C542: 2034,12,20,23,59,59
A543: 200 | B543: 2034,12,21,0,0,0 | C543: 2035,1,20,23,59,59
A544: 201 | B544: 2035,1,21,0,0,0 | C544: 2035,2,20,23,59,59
A545: 202 | B545: 2035,2,21,0,0,0 | C545: 2035,3,20,23,59,59
A546: 203 | B546: 2035,3,21,0,0,0 | C546: 2035,4,20,23,59,59
A547: 204 | B547: 2035,4,21,0,0,0 | C547: 2035,5,20,23,59,59
A548: 205 | B548: 2035,5,21,0,0,0 | C548: 2035,6,20,23,59,59
A549: 206 | B549: 2035,6,21,0,0,0 | C549: 2035,7,20,23,59,59
A550: 207 | B550: 2035,7,21,0,0,0 | C550: 2035,8,20,23,59,59
A551: 208 | B551: 2035,8,21,0,0,0 | C551: 2035,9,20,23,59,59
A552: 209 | B552: 2035,9,21,0,0,0 | C552: 2035,10,20,23,59,59
A553: 210 | B553: 2035,10,21,0,0,0 | C553: 2035,11,20,23,59,59
A554: 211 | B554: 2035,11,21,0,0,0 | C554: 2035,12,20,23,59,59
A555: 212 | B555: 2035,12,21,0,0,0 | C555: 2036,1,20,23,59,59
A556: 213 | B556: 2036,1,21,0,0,0 | C556: 2036,2,20,23,59,59
A557: 214 | B557: 2036,2,21,0,0,0 | C557: 2036,3,20,23,59,59
A558: 215 | B558: 2036,3,21,0,0,0 | C558: 2036,4,20,23,59,59
A559: 216 | B559: 2036,4,21,0,0,0 | C559: 2036,5,20,23,59,59
A560: 217 | B560: 2036,5,21,0,0,0 | C560: 2036,6,20,23,59,59
A561: 218 | B561: 2036,6,21,0,0,0 | C561: 2036,7,20,23,59,59
A562: 219 | B562: 2036,7,21,0,0,0 | C562: 2036,8,20,23,59,59
A563: 220 | B563: 2036,8,21,0,0,0 | C563: 2036,9,20,23,59,59
A564: 221 | B564: 2036,9,21,0,0,0 | C564: 2036,10,20,23,59,59
A565: 222 | B565: 2036,10,21,0,0,0 | C565: 2036,11,20,23,59,59
A566: 223 | B566: 2036,11,21,0,0,0 | C566: 2036,12,20,23,59,59
A567: 224 | B567: 2036,12,21,0,0,0 | C567: 2037,1,20,23,59,59
A568: 225 | B568: 2037,1,21,0,0,0 | C568: 2037,2,20,23,59,59
A569: 226 | B569: 2037,2,21,0,0,0 | C569: 2037,3,20,23,59,59
A570: 227 | B570: 2037,3,21,0,0,0 | C570: 2037,4,20,23,59,59
A571: 228 | B571: 2037,4,21,0,0,0 | C571: 2037,5,20,23,59,59
A572: 229 | B572: 2037,5,21,0,0,0 | C572: 2037,6,20,23,59,59
A573: 230 | B573: 2037,6,21,0,0,0 | C573: 2037,7,20,23,59,59
A574: 231 | B574: 2037,7,21,0,0,0 | C574: 2037,8,20,23,59,59
A575: 232 | B575: 2037,8,21,0,0,0 | C575: 2037,9,20,23,59,59
A576: 233 | B576: 2037,9,21,0,0,0 | C576: 2037,10,20,23,59,59
A577: 234 | B577: 2037,10,21,0,0,0 | C577: 2037,11,20,23,59,59
A578: 235 | B578: 2037,11,21,0,0,0 | C578: 2037,12,20,23,59,59
A579: 236 | B579: 2037,12,21,0,0,0 | C579: 2038,1,20,23,59,59
A580: 237 | B580: 2038,1,21,0,0,0 | C580: 2038,2,20,23,59,59
A581: 238 | B581: 2038,2,21,0,0,0 | C581: 2038,3,20,23,59,59
A582: 239 | B582: 2038,3,21,0,0,0 | C582: 2038,4,20,23,59,59
A583: 240 | B583: 2038,4,21,0,0,0 | C583: 2038,5,20,23,59,59
A584: 241 | B584: 2038,5,21,0,0,0 | C584: 2038,6,20,23,59,59
A585: 242 | B585: 2038,6,21,0,0,0 | C585: 2038,7,20,23,59,59
A586: 243 | B586: 2038,7,21,0,0,0 | C586: 2038,8,20,23,59,59
A587: 244 | B587: 2038,8,21,0,0,0 | C587: 2038,9,20,23,59,59
A588: 245 | B588: 2038,9,21,0,0,0 | C588: 2038,10,20,23,59,59
A589: 246 | B589: 2038,10,21,0,0,0 | C589: 2038,11,20,23,59,59
A590: 247 | B590: 2038,11,21,0,0,0 | C590: 2038,12,20,23,59,59
A591: 248 | B591: 2038,12,21,0,0,0 | C591: 2039,1,20,23,59,59
A592: 249 | B592: 2039,1,21,0,0,0 | C592: 2039,2,20,23,59,59
A593: 250 | B593: 2039,2,21,0,0,0 | C593: 2039,3,20,23,59,59
A594: 251 | B594: 2039,3,21,0,0,0 | C594: 2039,4,20,23,59,59
A595: 252 | B595: 2039,4,21,0,0,0 | C595: 2039,5,20,23,59,59
A596: 253 | B596: 2039,5,21,0,0,0 | C596: 2039,6,20,23,59,59
A597: 254 | B597: 2039,6,21,0,0,0 | C597: 2039,7,20,23,59,59
A598: 255 | B598: 2039,7,21,0,0,0 | C598: 2039,8,20,23,59,59
A599: 256 | B599: 2039,8,21,0,0,0 | C599: 2039,9,20,23,59,59
A600: 257 | B600: 2039,9,21,0,0,0 | C600: 2039,10,20,23,59,59
A601: 258 | B601: 2039,10,21,0,0,0 | C601: 2039,11,20,23,59,59
A602: 259 | B602: 2039,11,21,0,0,0 | C602: 2039,12,20,23,59,59
A603: 260 | B603: 2039,12,21,0,0,0 | C603: 2040,1,20,23,59,59
A604: 261 | B604: 2040,1,21,0,0,0 | C604: 2040,2,20,23,59,59
A605: 262 | B605: 2040,2,21,0,0,0 | C605: 2040,3,20,23,59,59
A606: 263 | B606: 2040,3,21,0,0,0 | C606: 2040,4,20,23,59,59
A607: 264 | B607: 2040,4,21,0,0,0 | C607: 2040,5,20,23,59,59
A608: 265 | B608: 2040,5,21,0,0,0 | C608: 2040,6,20,23,59,59
A609: 266 | B609: 2040,6,21,0,0,0 | C609: 2040,7,20,23,59,59
A610: 267 | B610: 2040,7,21,0,0,0 | C610: 2040,8,20,23,59,59
A611: 268 | B611: 2040,8,21,0,0,0 | C611: 2040,9,20,23,59,59
A612: 269 | B612: 2040,9,21,0,0,0 | C612: 2040,10,20,23,59,59
A613: 270 | B613: 2040,10,21,0,0,0 | C613: 2040,11,20,23,59,59
A614: 271 | B614: 2040,11,21,0,0,0 | C614: 2040,12,20,23,59,59
A615: 272 | B615: 2040,12,21,0,0,0 | C615: 2041,1,20,23,59,59
A616: 273 | B616: 2041,1,21,0,0,0 | C616: 2041,2,20,23,59,59
A617: 274 | B617: 2041,2,21,0,0,0 | C617: 2041,3,20,23,59,59
A618: 275 | B618: 2041,3,21,0,0,0 | C618: 2041,4,20,23,59,59
A619: 276 | B619: 2041,4,21,0,0,0 | C619: 2041,5,20,23,59,59
A620: 277 | B620: 2041,5,21,0,0,0 | C620: 2041,6,20,23,59,59
A621: 278 | B621: 2041,6,21,0,0,0 | C621: 2041,7,20,23,59,59
A622: 279 | B622: 2041,7,21,0,0,0 | C622: 2041,8,20,23,59,59
A623: 280 | B623: 2041,8,21,0,0,0 | C623: 2041,9,20,23,59,59
A624: 281 | B624: 2041,9,21,0,0,0 | C624: 2041,10,20,23,59,59
A625: 282 | B625: 2041,10,21,0,0,0 | C625: 2041,11,20,23,59,59
A626: 283 | B626: 2041,11,21,0,0,0 | C626: 2041,12,20,23,59,59
A627: 284 | B627: 2041,12,21,0,0,0 | C627: 2042,1,20,23,59,59
A628: 285 | B628: 2042,1,21,0,0,0 | C628: 2042,2,20,23,59,59
A629: 286 | B629: 2042,2,21,0,0,0 | C629: 2042,3,20,23,59,59
A630: 287 | B630: 2042,3,21,0,0,0 | C630: 2042,4,20,23,59,59
A631: 288 | B631: 2042,4,21,0,0,0 | C631: 2042,5,20,23,59,59
A632: 289 | B632: 2042,5,21,0,0,0 | C632: 2042,6,20,23,59,59
A633: 290 | B633: 2042,6,21,0,0,0 | C633: 2042,7,20,23,59,59
A634: 291 | B634: 2042,7,21,0,0,0 | C634: 2042,8,20,23,59,59
A635: 292 | B635: 2042,8,21,0,0,0 | C635: 2042,9,20,23,59,59
A636: 293 | B636: 2042,9,21,0,0,0 | C636: 2042,10,20,23,59,59
A637: 294 | B637: 2042,10,21,0,0,0 | C637: 2042,11,20,23,59,59
A638: 295 | B638: 2042,11,21,0,0,0 | C638: 2042,12,20,23,59,59
A639: 296 | B639: 2042,12,21,0,0,0 | C639: 2043,1,20,23,59,59
A640: 297 | B640: 2043,1,21,0,0,0 | C640: 2043,2,20,23,59,59
A641: 298 | B641: 2043,2,21,0,0,0 | C641: 2043,3,20,23,59,59
A642: 299 | B642: 2043,3,21,0,0,0 | C642: 2043,4,20,23,59,59
A643: 300 | B643: 2043,4,21,0,0,0 | C643: 2043,5,20,23,59,59
A644: 301 | B644: 2043,5,21,0,0,0 | C644: 2043,6,20,23,59,59
A645: 302 | B645: 2043,6,21,0,0,0 | C645: 2043,7,20,23,59,59
A646: 303 | B646: 2043,7,21,0,0,0 | C646: 2043,8,20,23,59,59
A647: 304 | B647: 2043,8,21,0,0,0 | C647: 2043,9,20,23,59,59
A648: 305 | B648: 2043,9,21,0,0,0 | C648: 2043,10,20,23,59,59
A649: 306 | B649: 2043,10,21,0,0,0 | C649: 2043,11,20,23,59,59
A650: 307 | B650: 2043,11,21,0,0,0 | C650: 2043,12,20,23,59,59
A651: 308 | B651: 2043,12,21,0,0,0 | C651: 2044,1,20,23,59,59
A652: 309 | B652: 2044,1,21,0,0,0 | C652: 2044,2,20,23,59,59
A653: 310 | B653: 2044,2,21,0,0,0 | C653: 2044,3,20,23,59,59
A654: 311 | B654: 2044,3,21,0,0,0 | C654: 2044,4,20,23,59,59
A655: 312 | B655: 2044,4,21,0,0,0 | C655: 2044,5,20,23,59,59
A656: 313 | B656: 2044,5,21,0,0,0 | C656: 2044,6,20,23,59,59
A657: 314 | B657: 2044,6,21,0,0,0 | C657: 2044,7,20,23,59,59
A658: 315 | B658: 2044,7,21,0,0,0 | C658: 2044,8,20,23,59,59
A659: 316 | B659: 2044,8,21,0,0,0 | C659: 2044,9,20,23,59,59
A660: 317 | B660: 2044,9,21,0,0,0 | C660: 2044,10,20,23,59,59
A661: 318 | B661: 2044,10,21,0,0,0 | C661: 2044,11,20,23,59,59
A662: 319 | B662: 2044,11,21,0,0,0 | C662: 2044,12,20,23,59,59
A663: 320 | B663: 2044,12,21,0,0,0 | C663: 2045,1,20,23,59,59
A664: 321 | B664: 2045,1,21,0,0,0 | C664: 2045,2,20,23,59,59
A665: 322 | B665: 2045,2,21,0,0,0 | C665: 2045,3,20,23,59,59
A666: 323 | B666: 2045,3,21,0,0,0 | C666: 2045,4,20,23,59,59
A667: 324 | B667: 2045,4,21,0,0,0 | C667: 2045,5,20,23,59,59
A668: 325 | B668: 2045,5,21,0,0,0 | C668: 2045,6,20,23,59,59
A669: 326 | B669: 2045,6,21,0,0,0 | C669: 2045,7,20,23,59,59
A670: 327 | B670: 2045,7,21,0,0,0 | C670: 2045,8,20,23,59,59
A671: 328 | B671: 2045,8,21,0,0,0 | C671: 2045,9,20,23,59,59
A672: 329 | B672: 2045,9,21,0,0,0 | C672: 2045,10,20,23,59,59
A673: 330 | B673: 2045,10,21,0,0,0 | C673: 2045,11,20,23,59,59
A674: 331 | B674: 2045,11,21,0,0,0 | C674: 2045,12,20,23,59,59
A675: 332 | B675: 2045,12,21,0,0,0 | C675: 2046,1,20,23,59,59
A676: 333 | B676: 2046,1,21,0,0,0 | C676: 2046,2,20,23,59,59
A677: 334 | B677: 2046,2,21,0,0,0 | C677: 2046,3,20,23,59,59
A678: 335 | B678: 2046,3,21,0,0,0 | C678: 2046,4,20,23,59,59
A679: 336 | B679: 2046,4,21,0,0,0 | C679: 2046,5,20,23,59,59
A680: 337 | B680: 2046,5,21,0,0,0 | C680: 2046,6,20,23,59,59
A681: 338 | B681: 2046,6,21,0,0,0 | C681: 2046,7,20,23,59,59
A682: 339 | B682: 2046,7,21,0,0,0 | C682: 2046,8,20,23,59,59
A683: 340 | B683: 2046,8,21,0,0,0 | C683: 2046,9,20,23,59,59
A684: 341 | B684: 2046,9,21,0,0,0 | C684: 2046,10,20,23,59,59
A685: 342 | B685: 2046,10,21,0,0,0 | C685: 2046,11,20,23,59,59
A686: 343 | B686: 2046,11,21,0,0,0 | C686: 2046,12,20,23,59,59
A687: 344 | B687: 2046,12,21,0,0,0 | C687: 2047,1,20,23,59,59
A688: 345 | B688: 2047,1,21,0,0,0 | C688: 2047,2,20,23,59,59
A689: 346 | B689: 2047,2,21,0,0,0 | C689: 2047,3,20,23,59,59
A690: 347 | B690: 2047,3,21,0,0,0 | C690: 2047,4,20,23,59,59
A691: 348 | B691: 2047,4,21,0,0,0 | C691: 2047,5,20,23,59,59
A692: 349 | B692: 2047,5,21,0,0,0 | C692: 2047,6,20,23,59,59
A693: 350 | B693: 2047,6,21,0,0,0 | C693: 2047,7,20,23,59,59
A694: 351 | B694: 2047,7,21,0,0,0 | C694: 2047,8,20,23,59,59
A695: 352 | B695: 2047,8,21,0,0,0 | C695: 2047,9,20,23,59,59
A696: 353 | B696: 2047,9,21,0,0,0 | C696: 2047,10,20,23,59,59
A697: 354 | B697: 2047,10,21,0,0,0 | C697: 2047,11,20,23,59,59
A698: 355 | B698: 2047,11,21,0,0,0 | C698: 2047,12,20,23,59,59
A699: 356 | B699: 2047,12,21,0,0,0 | C699: 2048,1,20,23,59,59
A700: 357 | B700: 2048,1,21,0,0,0 | C700: 2048,2,20,23,59,59
A701: 358 | B701: 2048,2,21,0,0,0 | C701: 2048,3,20,23,59,59
A702: 359 | B702: 2048,3,21,0,0,0 | C702: 2048,4,20,23,59,59
A703: 360 | B703: 2048,4,21,0,0,0 | C703: 2048,5,20,23,59,59
A704: 361 | B704: 2048,5,21,0,0,0 | C704: 2048,6,20,23,59,59
A705: 362 | B705: 2048,6,21,0,0,0 | C705: 2048,7,20,23,59,59
A706: 363 | B706: 2048,7,21,0,0,0 | C706: 2048,8,20,23,59,59
A707: 364 | B707: 2048,8,21,0,0,0 | C707: 2048,9,20,23,59,59
A708: 365 | B708: 2048,9,21,0,0,0 | C708: 2048,10,20,23,59,59
A709: 366 | B709: 2048,10,21,0,0,0 | C709: 2048,11,20,23,59,59
A710: 367 | B710: 2048,11,21,0,0,0 | C710: 2048,12,20,23,59,59
A711: 368 | B711: 2048,12,21,0,0,0 | C711: 2049,1,20,23,59,59
A712: 369 | B712: 2049,1,21,0,0,0 | C712: 2049,2,20,23,59,59
A713: 370 | B713: 2049,2,21,0,0,0 | C713: 2049,3,20,23,59,59
A714: 371 | B714: 2049,3,21,0,0,0 | C714: 2049,4,20,23,59,59
A715: 372 | B715: 2049,4,21,0,0,0 | C715: 2049,5,20,23,59,59
A716: 373 | B716: 2049,5,21,0,0,0 | C716: 2049,6,20,23,59,59
A717: 374 | B717: 2049,6,21,0,0,0 | C717: 2049,7,20,23,59,59
A718: 375 | B718: 2049,7,21,0,0,0 | C718: 2049,8,20,23,59,59
A719: 376 | B719: 2049,8,21,0,0,0 | C719: 2049,9,20,23,59,59
A720: 377 | B720: 2049,9,21,0,0,0 | C720: 2049,10,20,23,59,59
A721: 378 | B721: 2049,10,21,0,0,0 | C721: 2049,11,20,23,59,59
A722: 379 | B722: 2049,11,21,0,0,0 | C722: 2049,12,20,23,59,59
A723: 380 | B723: 2049,12,21,0,0,0 | C723: 2050,1,20,23,59,59
A724: 381 | B724: 2050,1,21,0,0,0 | C724: 2050,2,20,23,59,59
A725: 382 | B725: 2050,2,21,0,0,0 | C725: 2050,3,20,23,59,59
A726: 383 | B726: 2050,3,21,0,0,0 | C726: 2050,4,20,23,59,59
A727: 384 | B727: 2050,4,21,0,0,0 | C727: 2050,5,20,23,59,59
A728: 385 | B728: 2050,5,21,0,0,0 | C728: 2050,6,20,23,59,59
A729: 386 | B729: 2050,6,21,0,0,0 | C729: 2050,7,20,23,59,59
A730: 387 | B730: 2050,7,21,0,0,0 | C730: 2050,8,20,23,59,59
A731: 388 | B731: 2050,8,21,0,0,0 | C731: 2050,9,20,23,59,59
A732: 389 | B732: 2050,9,21,0,0,0 | C732: 2050,10,20,23,59,59
A733: 390 | B733: 2050,10,21,0,0,0 | C733: 2050,11,20,23,59,59
A734: 391 | B734: 2050,11,21,0,0,0 | C734: 2050,12,20,23,59,59
A735: 392 | B735: 2050,12,21,0,0,0 | C735: 2051,1,20,23,59,59