Sheet: ctGuaJiConf
F1: 动画约5秒 | K1: 奖励池ID,奖励次数; | M1: 奖励池ID,奖励次数; | Z1: 1.赠送宠物 2.赠送仙侣
A2: nSeq | B2: nMinGuanQia | C2: nMaxGuanQia | D2: sName | E2: nDupID | F2: nPatrolSec | G2: nChalBossLimit | H2: nBattleGroup | I2: fnAddBossAttrPre | J2: nMaxOfflineMin | K2: tReward | L2: nMonRewardPre | M2: tMonReward | N2: fnRoleExpReward | O2: fnPetExpReward | P2: fnYinBiReward | Q2: fnJinBiReward | R2: fnOfflineRoleExp | S2: fnOfflinePetExp | T2: fnOfflineYinBi | U2: sMonName | V2: sModel | W2: eMonNum | X2: nRobotNum | Y2: tFixReward | Z2: nEventType | AA2: tEventConf | AB2: fnParm
A3: i | B3: i | C3: i | D3: s | E3: i | F3: i | G3: i | H3: i | I3: e | J3: i | K3: t{ii} | L3: i | M3: t{ii} | N3: e | O3: e | P3: e | Q3: e | R3: e | S3: e | T3: e | U3: s | V3: t{s} | W3: i | X3: i | Y3: t{iiii} | Z3: i | AA3: c | AB3: e
A4: 序号 | B4: 最小关卡 | C4: 最大关卡 | D4: 关卡名 | E4: 副本场景ID | F4: 巡逻时间（秒） | G4: 挑战boss所需战斗次数 | H4: boss战斗组ID | I4: boss增强属性百分比 | J4: 最大离线奖励时间(分) | K4: boss掉落奖励库 | L4: 小怪奖励物品百分比 | M4: 小怪掉落奖励库 | N4: 人物经验基数公式 | O4: 宠物经验基数公式 | P4: 银币奖励基数公式 | Q4: 金币奖励基础公式 | R4: 人物离线经验 | S4: 宠物离线经验 | T4: 离线奖励银币 | U4: 小怪名字 | V4: 小怪模型ID | W4: 小怪数量 | X4: 机器人数量 | Y4: BOSS战必出的奖励 | Z4: 后续事件类型 | AA4: 后续事件配置 | AB4: 显示参数
A5: 1 | B5: 1 | C5: 1 | D5: 新手试炼 | E5: 10904 | F5: 5 | G5: 0 | H5: 200001 | I5: 0 | J5: 480 | K5: 5000,0; | L5: 5 | M5: 5000,1; | N5: 10000/3600*(nPatrolSec+3)*(1000+nGuanQia)/1000 | O5: 8000/3600*(nPatrolSec+3)*(1000+nGuanQia)/1000 | P5: 12240/3600*(nPatrolSec+3)*(1000+nGuanQia)/1000 | Q5: nGuanQia + 1000 | R5: 10000/60*nMin*(1000+nGuanQia)/1000 | S5: 8000/60*nMin*(1000+nGuanQia)/1000 | T5: 12240/60*nMin*(1000+nGuanQia)/1000 | U5: 喽啰 | V5: pet_42; | W5: 2 | X5: 5 | Y5: 1,28000,1,0;1,19016,1,0;1,10007,1,0;1,20001,1,0;1,7,150,0;1,8,100,0;1,4,1000,0; | Z5: 0 | AA5: {} | AB5: n/60
A6: 2 | B6: 2 | C6: 2 | D6: 新手试炼 | E6: 10904 | F6: 5 | G6: 0 | H6: 200002 | I6: 0 | J6: 480 | K6: 5000,0; | L6: 5 | M6: 5000,1; | N6: 10250/3600*(nPatrolSec+3)*(1000+nGuanQia)/1000 | O6: 8200/3600*(nPatrolSec+3)*(1000+nGuanQia)/1000 | P6: 12300/3600*(nPatrolSec+3)*(1000+nGuanQia)/1000 | Q6: nGuanQia + 1000 | R6: 10250/60*nMin*(1000+nGuanQia)/1000 | S6: 8200/60*nMin*(1000+nGuanQia)/1000 | T6: 12300/60*nMin*(1000+nGuanQia)/1000 | U6: 喽啰 | V6: pet_42; | W6: 2 | X6: 5 | Y6: 1,28000,1,0;1,19016,1,0;1,10007,1,0;1,20001,1,0;1,7,250,0;1,8,200,0;1,4,1000,0; | Z6: 0 | AA6: {} | AB6: n/60
A7: 3 | B7: 3 | C7: 3 | D7: 新手试炼 | E7: 10904 | F7: 5 | G7: 0 | H7: 200003 | I7: 0 | J7: 480 | K7: 5000,0; | L7: 5 | M7: 5000,1; | N7: 10500/3600*(nPatrolSec+3)*(1000+nGuanQia)/1000 | O7: 8400/3600*(nPatrolSec+3)*(1000+nGuanQia)/1000 | P7: 12360/3600*(nPatrolSec+3)*(1000+nGuanQia)/1000 | Q7: nGuanQia + 1000 | R7: 10500/60*nMin*(1000+nGuanQia)/1000 | S7: 8400/60*nMin*(1000+nGuanQia)/1000 | T7: 12360/60*nMin*(1000+nGuanQia)/1000 | U7: 喽啰 | V7: pet_42; | W7: 2 | X7: 5 | Y7: 1,28000,2,0;1,19016,2,0;1,10007,1,0;1,20001,2,0;1,7,350,0;1,8,300,0;1,4,1000,0; | Z7: 0 | AA7: {} | AB7: n/60
A8: 4 | B8: 4 | C8: 4 | D8: 新手试炼 | E8: 10904 | F8: 5 | G8: 0 | H8: 200004 | I8: 0 | J8: 480 | K8: 5000,0; | L8: 5 | M8: 5000,1; | N8: 10750/3600*(nPatrolSec+3)*(1000+nGuanQia)/1000 | O8: 8600/3600*(nPatrolSec+3)*(1000+nGuanQia)/1000 | P8: 12420/3600*(nPatrolSec+3)*(1000+nGuanQia)/1000 | Q8: nGuanQia + 1000 | R8: 10750/60*nMin*(1000+nGuanQia)/1000 | S8: 8600/60*nMin*(1000+nGuanQia)/1000 | T8: 12420/60*nMin*(1000+nGuanQia)/1000 | U8: 喽啰 | V8: pet_42; | W8: 2 | X8: 5 | Y8: 1,28000,2,0;1,19016,2,0;1,10007,1,0;1,20001,2,0;1,7,450,0;1,8,400,0;1,4,1000,0; | Z8: 0 | AA8: {} | AB8: n/60
A9: 5 | B9: 5 | C9: 5 | D9: 新手试炼 | E9: 10904 | F9: 5 | G9: 0 | H9: 200005 | I9: 0 | J9: 480 | K9: 5000,0; | L9: 5 | M9: 5000,1; | N9: 11000/3600*(nPatrolSec+3)*(1000+nGuanQia)/1000 | O9: 8800/3600*(nPatrolSec+3)*(1000+nGuanQia)/1000 | P9: 12480/3600*(nPatrolSec+3)*(1000+nGuanQia)/1000 | Q9: nGuanQia + 1000 | R9: 11000/60*nMin*(1000+nGuanQia)/1000 | S9: 8800/60*nMin*(1000+nGuanQia)/1000 | T9: 12480/60*nMin*(1000+nGuanQia)/1000 | U9: 喽啰 | V9: pet_42; | W9: 2 | X9: 5 | Y9: 1,28000,3,0;1,19016,3,0;1,10007,1,0;1,20001,3,0;1,7,550,0;1,8,500,0;1,4,1000,0; | Z9: 0 | AA9: {} | AB9: n/60
A10: 6 | B10: 6 | C10: 6 | D10: 新手试炼 | E10: 10904 | F10: 5 | G10: 1 | H10: 200006 | I10: 0 | J10: 480 | K10: 5000,0; | L10: 5 | M10: 5000,1; | N10: 11250/3600*(nPatrolSec+3)*(1000+nGuanQia)/1000 | O10: 9000/3600*(nPatrolSec+3)*(1000+nGuanQia)/1000 | P10: 12540/3600*(nPatrolSec+3)*(1000+nGuanQia)/1000 | Q10: nGuanQia + 1000 | R10: 11250/60*nMin*(1000+nGuanQia)/1000 | S10: 9000/60*nMin*(1000+nGuanQia)/1000 | T10: 12540/60*nMin*(1000+nGuanQia)/1000 | U10: 喽啰 | V10: pet_1;pet_42;pet_13; | W10: 2 | X10: 5 | Y10: 1,28000,3,0;1,19016,3,0;1,10007,1,0;1,20001,3,0;1,7,650,0;1,8,600,0;1,4,1000,0; | Z10: 0 | AA10: {} | AB10: n/60
A11: 7 | B11: 7 | C11: 7 | D11: 新手试炼 | E11: 10904 | F11: 5 | G11: 1 | H11: 200007 | I11: 0 | J11: 480 | K11: 5000,0; | L11: 5 | M11: 5000,1; | N11: 11500/3600*(nPatrolSec+3)*(1000+nGuanQia)/1000 | O11: 9200/3600*(nPatrolSec+3)*(1000+nGuanQia)/1000 | P11: 12600/3600*(nPatrolSec+3)*(1000+nGuanQia)/1000 | Q11: nGuanQia + 1000 | R11: 11500/60*nMin*(1000+nGuanQia)/1000 | S11: 9200/60*nMin*(1000+nGuanQia)/1000 | T11: 12600/60*nMin*(1000+nGuanQia)/1000 | U11: 喽啰 | V11: pet_1;pet_42;pet_13; | W11: 2 | X11: 5 | Y11: 1,28000,4,0;1,19016,4,0;1,10007,1,0;1,20001,4,0;1,7,750,0;1,8,700,0;1,4,1000,0; | Z11: 0 | AA11: {} | AB11: n/60
A12: 8 | B12: 8 | C12: 8 | D12: 新手试炼 | E12: 10904 | F12: 5 | G12: 1 | H12: 200008 | I12: 0 | J12: 480 | K12: 5000,0; | L12: 5 | M12: 5000,1; | N12: 11750/3600*(nPatrolSec+3)*(1000+nGuanQia)/1000 | O12: 9400/3600*(nPatrolSec+3)*(1000+nGuanQia)/1000 | P12: 12660/3600*(nPatrolSec+3)*(1000+nGuanQia)/1000 | Q12: nGuanQia + 1000 | R12: 11750/60*nMin*(1000+nGuanQia)/1000 | S12: 9400/60*nMin*(1000+nGuanQia)/1000 | T12: 12660/60*nMin*(1000+nGuanQia)/1000 | U12: 喽啰 | V12: pet_1;pet_42;pet_13; | W12: 2 | X12: 5 | Y12: 1,28000,4,0;1,19016,4,0;1,10007,1,0;1,20001,4,0;1,7,850,0;1,8,800,0;1,4,1000,0; | Z12: 0 | AA12: {} | AB12: n/60
A13: 9 | B13: 9 | C13: 9 | D13: 新手试炼 | E13: 10904 | F13: 5 | G13: 1 | H13: 200009 | I13: 0 | J13: 480 | K13: 5000,0; | L13: 5 | M13: 5000,1; | N13: 12000/3600*(nPatrolSec+3)*(1000+nGuanQia)/1000 | O13: 9600/3600*(nPatrolSec+3)*(1000+nGuanQia)/1000 | P13: 12720/3600*(nPatrolSec+3)*(1000+nGuanQia)/1000 | Q13: nGuanQia + 1000 | R13: 12000/60*nMin*(1000+nGuanQia)/1000 | S13: 9600/60*nMin*(1000+nGuanQia)/1000 | T13: 12720/60*nMin*(1000+nGuanQia)/1000 | U13: 喽啰 | V13: pet_1;pet_42;pet_13; | W13: 2 | X13: 5 | Y13: 1,28000,5,0;1,19016,5,0;1,10007,1,0;1,20001,5,0;1,7,950,0;1,8,900,0;1,4,1000,0; | Z13: 0 | AA13: {} | AB13: n/60
A14: 10 | B14: 10 | C14: 10 | D14: 新手试炼 | E14: 10904 | F14: 5 | G14: 1 | H14: 200010 | I14: 0 | J14: 480 | K14: 5000,0; | L14: 5 | M14: 5000,1; | N14: 12250/3600*(nPatrolSec+3)*(1000+nGuanQia)/1000 | O14: 9800/3600*(nPatrolSec+3)*(1000+nGuanQia)/1000 | P14: 12780/3600*(nPatrolSec+3)*(1000+nGuanQia)/1000 | Q14: nGuanQia + 1000 | R14: 12250/60*nMin*(1000+nGuanQia)/1000 | S14: 9800/60*nMin*(1000+nGuanQia)/1000 | T14: 12780/60*nMin*(1000+nGuanQia)/1000 | U14: 喽啰 | V14: pet_1;pet_42;pet_13; | W14: 2 | X14: 5 | Y14: 1,28000,5,0;1,19016,5,0;1,10007,1,0;1,20001,5,0;1,7,1000,0;1,8,1000,0;1,4,1000,0; | Z14: 0 | AA14: {} | AB14: n/60
A15: 11 | B15: 11 | C15: 11 | D15: 青铜试炼 | E15: 10501 | F15: 5 | G15: 2 | H15: 200011 | I15: 0 | J15: 480 | K15: 5000,0; | L15: 5 | M15: 5000,1; | N15: 12500/3600*(nPatrolSec+3)*(1000+nGuanQia)/1000 | O15: 10000/3600*(nPatrolSec+3)*(1000+nGuanQia)/1000 | P15: 12960/3600*(nPatrolSec+3)*(1000+nGuanQia)/1000 | Q15: nGuanQia + 1000 | R15: 12500/60*nMin*(1000+nGuanQia)/1000 | S15: 10000/60*nMin*(1000+nGuanQia)/1000 | T15: 12960/60*nMin*(1000+nGuanQia)/1000 | U15: 喽啰 | V15: pet_1;pet_42;pet_13;pet_23; | W15: 2 | X15: 5 | Y15: 1,28000,5,0;1,19016,5,0;1,10007,2,0;1,20001,5,0;1,7,1000,0;1,8,1000,0;1,4,1000,0; | Z15: 0 | AA15: {} | AB15: n/60
A16: 12 | B16: 12 | C16: 12 | D16: 青铜试炼 | E16: 10501 | F16: 5 | G16: 2 | H16: 200012 | I16: 0 | J16: 480 | K16: 5000,0; | L16: 5 | M16: 5000,1; | N16: 12750/3600*(nPatrolSec+3)*(1000+nGuanQia)/1000 | O16: 10200/3600*(nPatrolSec+3)*(1000+nGuanQia)/1000 | P16: 13140/3600*(nPatrolSec+3)*(1000+nGuanQia)/1000 | Q16: nGuanQia + 1000 | R16: 12750/60*nMin*(1000+nGuanQia)/1000 | S16: 10200/60*nMin*(1000+nGuanQia)/1000 | T16: 13140/60*nMin*(1000+nGuanQia)/1000 | U16: 喽啰 | V16: pet_1;pet_42;pet_13;pet_23; | W16: 2 | X16: 5 | Y16: 1,28000,5,0;1,19016,5,0;1,10007,2,0;1,20001,5,0;1,7,1000,0;1,8,1000,0;1,4,1000,0; | Z16: 0 | AA16: {} | AB16: n/60
A17: 13 | B17: 13 | C17: 13 | D17: 青铜试炼 | E17: 10501 | F17: 5 | G17: 2 | H17: 200013 | I17: 0 | J17: 480 | K17: 5000,0; | L17: 5 | M17: 5000,1; | N17: 13000/3600*(nPatrolSec+3)*(1000+nGuanQia)/1000 | O17: 10400/3600*(nPatrolSec+3)*(1000+nGuanQia)/1000 | P17: 13320/3600*(nPatrolSec+3)*(1000+nGuanQia)/1000 | Q17: nGuanQia + 1000 | R17: 13000/60*nMin*(1000+nGuanQia)/1000 | S17: 10400/60*nMin*(1000+nGuanQia)/1000 | T17: 13320/60*nMin*(1000+nGuanQia)/1000 | U17: 喽啰 | V17: pet_1;pet_42;pet_13;pet_23; | W17: 2 | X17: 5 | Y17: 1,28000,5,0;1,19016,5,0;1,10007,2,0;1,20001,5,0;1,7,1000,0;1,8,1000,0;1,4,1000,0; | Z17: 0 | AA17: {} | AB17: n/60
A18: 14 | B18: 14 | C18: 14 | D18: 青铜试炼 | E18: 10501 | F18: 5 | G18: 2 | H18: 200014 | I18: 0 | J18: 480 | K18: 5000,0; | L18: 5 | M18: 5000,1; | N18: 13250/3600*(nPatrolSec+3)*(1000+nGuanQia)/1000 | O18: 10600/3600*(nPatrolSec+3)*(1000+nGuanQia)/1000 | P18: 13500/3600*(nPatrolSec+3)*(1000+nGuanQia)/1000 | Q18: nGuanQia + 1000 | R18: 13250/60*nMin*(1000+nGuanQia)/1000 | S18: 10600/60*nMin*(1000+nGuanQia)/1000 | T18: 13500/60*nMin*(1000+nGuanQia)/1000 | U18: 喽啰 | V18: pet_1;pet_42;pet_13;pet_23; | W18: 2 | X18: 5 | Y18: 1,28000,5,0;1,19016,5,0;1,10007,2,0;1,20001,5,0;1,7,1000,0;1,8,1000,0;1,4,1000,0; | Z18: 0 | AA18: {} | AB18: n/60
A19: 15 | B19: 15 | C19: 15 | D19: 青铜试炼 | E19: 10501 | F19: 5 | G19: 2 | H19: 200015 | I19: 0 | J19: 480 | K19: 5000,0; | L19: 5 | M19: 5000,1; | N19: 13500/3600*(nPatrolSec+3)*(1000+nGuanQia)/1000 | O19: 10800/3600*(nPatrolSec+3)*(1000+nGuanQia)/1000 | P19: 13680/3600*(nPatrolSec+3)*(1000+nGuanQia)/1000 | Q19: nGuanQia + 1000 | R19: 13500/60*nMin*(1000+nGuanQia)/1000 | S19: 10800/60*nMin*(1000+nGuanQia)/1000 | T19: 13680/60*nMin*(1000+nGuanQia)/1000 | U19: 喽啰 | V19: pet_1;pet_42;pet_13;pet_23; | W19: 2 | X19: 5 | Y19: 1,28000,5,0;1,19016,5,0;1,10007,2,0;1,20001,5,0;1,7,1000,0;1,8,1000,0;1,4,1000,0; | Z19: 0 | AA19: {} | AB19: n/60
A20: 16 | B20: 16 | C20: 16 | D20: 青铜试炼 | E20: 10501 | F20: 5 | G20: 3 | H20: 200016 | I20: 0 | J20: 480 | K20: 5000,0; | L20: 5 | M20: 5000,1; | N20: 13750/3600*(nPatrolSec+3)*(1000+nGuanQia)/1000 | O20: 11000/3600*(nPatrolSec+3)*(1000+nGuanQia)/1000 | P20: 13860/3600*(nPatrolSec+3)*(1000+nGuanQia)/1000 | Q20: nGuanQia + 1000 | R20: 13750/60*nMin*(1000+nGuanQia)/1000 | S20: 11000/60*nMin*(1000+nGuanQia)/1000 | T20: 13860/60*nMin*(1000+nGuanQia)/1000 | U20: 喽啰 | V20: pet_1;pet_42;pet_13;pet_23; | W20: 2 | X20: 5 | Y20: 1,28000,5,0;1,19016,5,0;1,10007,2,0;1,20001,5,0;1,7,1000,0;1,8,1000,0;1,4,1000,0; | Z20: 0 | AA20: {} | AB20: n/60
A21: 17 | B21: 17 | C21: 17 | D21: 青铜试炼 | E21: 10501 | F21: 5 | G21: 3 | H21: 200017 | I21: 0 | J21: 480 | K21: 5000,0; | L21: 5 | M21: 5000,1; | N21: 14000/3600*(nPatrolSec+3)*(1000+nGuanQia)/1000 | O21: 11200/3600*(nPatrolSec+3)*(1000+nGuanQia)/1000 | P21: 14040/3600*(nPatrolSec+3)*(1000+nGuanQia)/1000 | Q21: nGuanQia + 1000 | R21: 14000/60*nMin*(1000+nGuanQia)/1000 | S21: 11200/60*nMin*(1000+nGuanQia)/1000 | T21: 14040/60*nMin*(1000+nGuanQia)/1000 | U21: 喽啰 | V21: pet_1;pet_42;pet_13;pet_23; | W21: 2 | X21: 5 | Y21: 1,28000,5,0;1,19016,5,0;1,10007,2,0;1,20001,5,0;1,7,1000,0;1,8,1000,0;1,4,1000,0; | Z21: 0 | AA21: {} | AB21: n/60
A22: 18 | B22: 18 | C22: 18 | D22: 青铜试炼 | E22: 10501 | F22: 5 | G22: 3 | H22: 200018 | I22: 0 | J22: 480 | K22: 5000,0; | L22: 5 | M22: 5000,1; | N22: 14250/3600*(nPatrolSec+3)*(1000+nGuanQia)/1000 | O22: 11400/3600*(nPatrolSec+3)*(1000+nGuanQia)/1000 | P22: 14220/3600*(nPatrolSec+3)*(1000+nGuanQia)/1000 | Q22: nGuanQia + 1000 | R22: 14250/60*nMin*(1000+nGuanQia)/1000 | S22: 11400/60*nMin*(1000+nGuanQia)/1000 | T22: 14220/60*nMin*(1000+nGuanQia)/1000 | U22: 喽啰 | V22: pet_1;pet_42;pet_13;pet_23; | W22: 2 | X22: 5 | Y22: 1,28000,5,0;1,19016,5,0;1,10007,2,0;1,20001,5,0;1,7,1000,0;1,8,1000,0;1,4,1000,0; | Z22: 0 | AA22: {} | AB22: n/60
A23: 19 | B23: 19 | C23: 19 | D23: 青铜试炼 | E23: 10501 | F23: 5 | G23: 3 | H23: 200019 | I23: 0 | J23: 480 | K23: 5000,0; | L23: 5 | M23: 5000,1; | N23: 14500/3600*(nPatrolSec+3)*(1000+nGuanQia)/1000 | O23: 11600/3600*(nPatrolSec+3)*(1000+nGuanQia)/1000 | P23: 14400/3600*(nPatrolSec+3)*(1000+nGuanQia)/1000 | Q23: nGuanQia + 1000 | R23: 14500/60*nMin*(1000+nGuanQia)/1000 | S23: 11600/60*nMin*(1000+nGuanQia)/1000 | T23: 14400/60*nMin*(1000+nGuanQia)/1000 | U23: 喽啰 | V23: pet_1;pet_42;pet_13;pet_23; | W23: 2 | X23: 5 | Y23: 1,28000,5,0;1,19016,5,0;1,10007,2,0;1,20001,5,0;1,7,1000,0;1,8,1000,0;1,4,1000,0; | Z23: 0 | AA23: {} | AB23: n/60
A24: 20 | B24: 20 | C24: 20 | D24: 青铜试炼 | E24: 10501 | F24: 5 | G24: 3 | H24: 200020 | I24: 0 | J24: 480 | K24: 5000,0; | L24: 5 | M24: 5000,1; | N24: 14750/3600*(nPatrolSec+3)*(1000+nGuanQia)/1000 | O24: 11800/3600*(nPatrolSec+3)*(1000+nGuanQia)/1000 | P24: 14520/3600*(nPatrolSec+3)*(1000+nGuanQia)/1000 | Q24: nGuanQia + 1000 | R24: 14750/60*nMin*(1000+nGuanQia)/1000 | S24: 11800/60*nMin*(1000+nGuanQia)/1000 | T24: 14520/60*nMin*(1000+nGuanQia)/1000 | U24: 喽啰 | V24: pet_1;pet_42;pet_13;pet_23; | W24: 2 | X24: 5 | Y24: 1,28000,5,0;1,19016,5,0;1,10007,2,0;1,20001,5,0;1,7,1000,0;1,8,1000,0;1,4,1000,0; | Z24: 0 | AA24: {} | AB24: n/60
A25: 21 | B25: 21 | C25: 21 | D25: 青铜试炼 | E25: 10501 | F25: 5 | G25: 3 | H25: 200021 | I25: 0 | J25: 480 | K25: 5000,0; | L25: 5 | M25: 5000,1; | N25: 15000/3600*(nPatrolSec+3)*(1000+nGuanQia)/1000 | O25: 12000/3600*(nPatrolSec+3)*(1000+nGuanQia)/1000 | P25: 14580/3600*(nPatrolSec+3)*(1000+nGuanQia)/1000 | Q25: nGuanQia + 1000 | R25: 15000/60*nMin*(1000+nGuanQia)/1000 | S25: 12000/60*nMin*(1000+nGuanQia)/1000 | T25: 14580/60*nMin*(1000+nGuanQia)/1000 | U25: 喽啰 | V25: pet_1;pet_42;pet_13;pet_23; | W25: 2 | X25: 5 | Y25: 1,28000,5,0;1,19016,5,0;1,10007,3,0;1,20001,5,0;1,7,2000,0;1,8,2000,0;1,4,1000,0; | Z25: 0 | AA25: {} | AB25: n/60
A26: 22 | B26: 22 | C26: 22 | D26: 青铜试炼 | E26: 10501 | F26: 5 | G26: 3 | H26: 200022 | I26: 0 | J26: 480 | K26: 5000,0; | L26: 5 | M26: 5000,1; | N26: 15250/3600*(nPatrolSec+3)*(1000+nGuanQia)/1000 | O26: 12200/3600*(nPatrolSec+3)*(1000+nGuanQia)/1000 | P26: 14640/3600*(nPatrolSec+3)*(1000+nGuanQia)/1000 | Q26: nGuanQia + 1000 | R26: 15250/60*nMin*(1000+nGuanQia)/1000 | S26: 12200/60*nMin*(1000+nGuanQia)/1000 | T26: 14640/60*nMin*(1000+nGuanQia)/1000 | U26: 喽啰 | V26: pet_1;pet_42;pet_13;pet_23; | W26: 2 | X26: 5 | Y26: 1,28000,5,0;1,19016,5,0;1,10007,3,0;1,20001,5,0;1,7,2000,0;1,8,2000,0;1,4,1000,0; | Z26: 0 | AA26: {} | AB26: n/60
A27: 23 | B27: 23 | C27: 23 | D27: 青铜试炼 | E27: 10501 | F27: 5 | G27: 3 | H27: 200023 | I27: 0 | J27: 480 | K27: 5000,0; | L27: 5 | M27: 5000,1; | N27: 15500/3600*(nPatrolSec+3)*(1000+nGuanQia)/1000 | O27: 12400/3600*(nPatrolSec+3)*(1000+nGuanQia)/1000 | P27: 14700/3600*(nPatrolSec+3)*(1000+nGuanQia)/1000 | Q27: nGuanQia + 1000 | R27: 15500/60*nMin*(1000+nGuanQia)/1000 | S27: 12400/60*nMin*(1000+nGuanQia)/1000 | T27: 14700/60*nMin*(1000+nGuanQia)/1000 | U27: 喽啰 | V27: pet_1;pet_42;pet_13;pet_23; | W27: 2 | X27: 5 | Y27: 1,28000,5,0;1,19016,5,0;1,10007,3,0;1,20001,5,0;1,7,2000,0;1,8,2000,0;1,4,1000,0; | Z27: 0 | AA27: {} | AB27: n/60
A28: 24 | B28: 24 | C28: 24 | D28: 青铜试炼 | E28: 10501 | F28: 5 | G28: 3 | H28: 200024 | I28: 0 | J28: 480 | K28: 5000,0; | L28: 5 | M28: 5000,1; | N28: 15750/3600*(nPatrolSec+3)*(1000+nGuanQia)/1000 | O28: 12600/3600*(nPatrolSec+3)*(1000+nGuanQia)/1000 | P28: 14760/3600*(nPatrolSec+3)*(1000+nGuanQia)/1000 | Q28: nGuanQia + 1000 | R28: 15750/60*nMin*(1000+nGuanQia)/1000 | S28: 12600/60*nMin*(1000+nGuanQia)/1000 | T28: 14760/60*nMin*(1000+nGuanQia)/1000 | U28: 喽啰 | V28: pet_1;pet_42;pet_13;pet_23; | W28: 2 | X28: 5 | Y28: 1,28000,5,0;1,19016,5,0;1,10007,3,0;1,20001,5,0;1,7,2000,0;1,8,2000,0;1,4,1000,0; | Z28: 0 | AA28: {} | AB28: n/60
A29: 25 | B29: 25 | C29: 25 | D29: 青铜试炼 | E29: 10501 | F29: 5 | G29: 3 | H29: 200025 | I29: 0 | J29: 480 | K29: 5000,0; | L29: 5 | M29: 5000,1; | N29: 16000/3600*(nPatrolSec+3)*(1000+nGuanQia)/1000 | O29: 12800/3600*(nPatrolSec+3)*(1000+nGuanQia)/1000 | P29: 14820/3600*(nPatrolSec+3)*(1000+nGuanQia)/1000 | Q29: nGuanQia + 1000 | R29: 16000/60*nMin*(1000+nGuanQia)/1000 | S29: 12800/60*nMin*(1000+nGuanQia)/1000 | T29: 14820/60*nMin*(1000+nGuanQia)/1000 | U29: 喽啰 | V29: pet_1;pet_42;pet_13;pet_23; | W29: 3 | X29: 5 | Y29: 1,28000,5,0;1,19016,5,0;1,10007,3,0;1,20001,5,0;1,7,2000,0;1,8,2000,0;1,4,1000,0; | Z29: 0 | AA29: {} | AB29: n/60
A30: 26 | B30: 26 | C30: 26 | D30: 白银试炼 | E30: 10502 | F30: 5 | G30: 3 | H30: 200026 | I30: 0 | J30: 480 | K30: 5000,0; | L30: 5 | M30: 5000,1; | N30: 16250/3600*(nPatrolSec+3)*(1000+nGuanQia)/1000 | O30: 13000/3600*(nPatrolSec+3)*(1000+nGuanQia)/1000 | P30: 14880/3600*(nPatrolSec+3)*(1000+nGuanQia)/1000 | Q30: nGuanQia + 1000 | R30: 16250/60*nMin*(1000+nGuanQia)/1000 | S30: 13000/60*nMin*(1000+nGuanQia)/1000 | T30: 14880/60*nMin*(1000+nGuanQia)/1000 | U30: 喽啰 | V30: pet_1;pet_42;pet_13;pet_23; | W30: 3 | X30: 5 | Y30: 1,28000,5,0;1,19016,5,0;1,10007,3,0;1,20001,5,0;1,7,2000,0;1,8,2000,0;1,4,1000,0; | Z30: 0 | AA30: {} | AB30: n/60
A31: 27 | B31: 27 | C31: 27 | D31: 白银试炼 | E31: 10502 | F31: 5 | G31: 3 | H31: 200027 | I31: 0 | J31: 480 | K31: 5000,0; | L31: 5 | M31: 5000,1; | N31: 16500/3600*(nPatrolSec+3)*(1000+nGuanQia)/1000 | O31: 13200/3600*(nPatrolSec+3)*(1000+nGuanQia)/1000 | P31: 14940/3600*(nPatrolSec+3)*(1000+nGuanQia)/1000 | Q31: nGuanQia + 1000 | R31: 16500/60*nMin*(1000+nGuanQia)/1000 | S31: 13200/60*nMin*(1000+nGuanQia)/1000 | T31: 14940/60*nMin*(1000+nGuanQia)/1000 | U31: 喽啰 | V31: pet_1;pet_42;pet_13;pet_23; | W31: 3 | X31: 5 | Y31: 1,28000,5,0;1,19016,5,0;1,10007,3,0;1,20001,5,0;1,7,2000,0;1,8,2000,0;1,4,1000,0; | Z31: 0 | AA31: {} | AB31: n/60
A32: 28 | B32: 28 | C32: 28 | D32: 白银试炼 | E32: 10502 | F32: 5 | G32: 3 | H32: 200028 | I32: 0 | J32: 480 | K32: 5000,0; | L32: 5 | M32: 5000,1; | N32: 16750/3600*(nPatrolSec+3)*(1000+nGuanQia)/1000 | O32: 13400/3600*(nPatrolSec+3)*(1000+nGuanQia)/1000 | P32: 15000/3600*(nPatrolSec+3)*(1000+nGuanQia)/1000 | Q32: nGuanQia + 1000 | R32: 16750/60*nMin*(1000+nGuanQia)/1000 | S32: 13400/60*nMin*(1000+nGuanQia)/1000 | T32: 15000/60*nMin*(1000+nGuanQia)/1000 | U32: 喽啰 | V32: pet_1;pet_42;pet_13;pet_23; | W32: 3 | X32: 5 | Y32: 1,28000,5,0;1,19016,5,0;1,10007,3,0;1,20001,5,0;1,7,2000,0;1,8,2000,0;1,4,1000,0; | Z32: 0 | AA32: {} | AB32: n/60
A33: 29 | B33: 29 | C33: 29 | D33: 白银试炼 | E33: 10502 | F33: 5 | G33: 3 | H33: 200029 | I33: 0 | J33: 480 | K33: 5000,0; | L33: 5 | M33: 5000,1; | N33: 17000/3600*(nPatrolSec+3)*(1000+nGuanQia)/1000 | O33: 13600/3600*(nPatrolSec+3)*(1000+nGuanQia)/1000 | P33: 15060/3600*(nPatrolSec+3)*(1000+nGuanQia)/1000 | Q33: nGuanQia + 1000 | R33: 17000/60*nMin*(1000+nGuanQia)/1000 | S33: 13600/60*nMin*(1000+nGuanQia)/1000 | T33: 15060/60*nMin*(1000+nGuanQia)/1000 | U33: 喽啰 | V33: pet_1;pet_42;pet_13;pet_23; | W33: 3 | X33: 5 | Y33: 1,28000,5,0;1,19016,5,0;1,10007,3,0;1,20001,5,0;1,7,2000,0;1,8,2000,0;1,4,1000,0; | Z33: 0 | AA33: {} | AB33: n/60
A34: 30 | B34: 30 | C34: 30 | D34: 白银试炼 | E34: 10502 | F34: 5 | G34: 3 | H34: 200030 | I34: 0 | J34: 480 | K34: 5000,0; | L34: 5 | M34: 5000,1; | N34: 17250/3600*(nPatrolSec+3)*(1000+nGuanQia)/1000 | O34: 13800/3600*(nPatrolSec+3)*(1000+nGuanQia)/1000 | P34: 15120/3600*(nPatrolSec+3)*(1000+nGuanQia)/1000 | Q34: nGuanQia + 1000 | R34: 17250/60*nMin*(1000+nGuanQia)/1000 | S34: 13800/60*nMin*(1000+nGuanQia)/1000 | T34: 15120/60*nMin*(1000+nGuanQia)/1000 | U34: 喽啰 | V34: pet_1;pet_42;pet_13;pet_23; | W34: 3 | X34: 5 | Y34: 1,28000,5,0;1,19016,5,0;1,10007,3,0;1,10108,1,0;1,7,2000,0;1,8,2000,0;1,4,1000,0; | Z34: 0 | AA34: {} | AB34: n/60
A35: 31 | B35: 31 | C35: 31 | D35: 白银试炼 | E35: 10502 | F35: 5 | G35: 3 | H35: 200031 | I35: 0 | J35: 480 | K35: 5000,0; | L35: 5 | M35: 5000,1; | N35: 17500/3600*(nPatrolSec+3)*(1000+nGuanQia)/1000 | O35: 14000/3600*(nPatrolSec+3)*(1000+nGuanQia)/1000 | P35: 15180/3600*(nPatrolSec+3)*(1000+nGuanQia)/1000 | Q35: nGuanQia + 1000 | R35: 17500/60*nMin*(1000+nGuanQia)/1000 | S35: 14000/60*nMin*(1000+nGuanQia)/1000 | T35: 15180/60*nMin*(1000+nGuanQia)/1000 | U35: 喽啰 | V35: pet_43;pet_52;pet_53;pet_62; | W35: 3 | X35: 5 | Y35: 1,28000,5,0;1,19016,5,0;1,10007,4,0;1,10108,1,0;1,7,3000,0;1,8,3000,0;1,4,1000,0; | Z35: 0 | AA35: {} | AB35: n/60
A36: 32 | B36: 32 | C36: 32 | D36: 白银试炼 | E36: 10502 | F36: 5 | G36: 3 | H36: 200032 | I36: 0 | J36: 480 | K36: 5000,0; | L36: 5 | M36: 5000,1; | N36: 17750/3600*(nPatrolSec+3)*(1000+nGuanQia)/1000 | O36: 14200/3600*(nPatrolSec+3)*(1000+nGuanQia)/1000 | P36: 15240/3600*(nPatrolSec+3)*(1000+nGuanQia)/1000 | Q36: nGuanQia + 1000 | R36: 17750/60*nMin*(1000+nGuanQia)/1000 | S36: 14200/60*nMin*(1000+nGuanQia)/1000 | T36: 15240/60*nMin*(1000+nGuanQia)/1000 | U36: 喽啰 | V36: pet_43;pet_52;pet_53;pet_62; | W36: 3 | X36: 5 | Y36: 1,28000,5,0;1,19016,5,0;1,10007,4,0;1,10108,1,0;1,7,3000,0;1,8,3000,0;1,4,1000,0; | Z36: 0 | AA36: {} | AB36: n/60
A37: 33 | B37: 33 | C37: 33 | D37: 白银试炼 | E37: 10502 | F37: 5 | G37: 3 | H37: 200033 | I37: 0 | J37: 480 | K37: 5000,0; | L37: 5 | M37: 5000,1; | N37: 18000/3600*(nPatrolSec+3)*(1000+nGuanQia)/1000 | O37: 14400/3600*(nPatrolSec+3)*(1000+nGuanQia)/1000 | P37: 15300/3600*(nPatrolSec+3)*(1000+nGuanQia)/1000 | Q37: nGuanQia + 1000 | R37: 18000/60*nMin*(1000+nGuanQia)/1000 | S37: 14400/60*nMin*(1000+nGuanQia)/1000 | T37: 15300/60*nMin*(1000+nGuanQia)/1000 | U37: 喽啰 | V37: pet_43;pet_52;pet_53;pet_62; | W37: 3 | X37: 5 | Y37: 1,28000,5,0;1,19016,5,0;1,10007,4,0;1,10108,1,0;1,7,3000,0;1,8,3000,0;1,4,1000,0; | Z37: 0 | AA37: {} | AB37: n/60
A38: 34 | B38: 34 | C38: 34 | D38: 白银试炼 | E38: 10502 | F38: 5 | G38: 3 | H38: 200034 | I38: 0 | J38: 480 | K38: 5000,0; | L38: 5 | M38: 5000,1; | N38: 18250/3600*(nPatrolSec+3)*(1000+nGuanQia)/1000 | O38: 14600/3600*(nPatrolSec+3)*(1000+nGuanQia)/1000 | P38: 15360/3600*(nPatrolSec+3)*(1000+nGuanQia)/1000 | Q38: nGuanQia + 1000 | R38: 18250/60*nMin*(1000+nGuanQia)/1000 | S38: 14600/60*nMin*(1000+nGuanQia)/1000 | T38: 15360/60*nMin*(1000+nGuanQia)/1000 | U38: 喽啰 | V38: pet_43;pet_52;pet_53;pet_62; | W38: 3 | X38: 5 | Y38: 1,28000,5,0;1,19016,5,0;1,10007,4,0;1,10108,1,0;1,7,3000,0;1,8,3000,0;1,4,1000,0; | Z38: 0 | AA38: {} | AB38: n/60
A39: 35 | B39: 35 | C39: 35 | D39: 白银试炼 | E39: 10502 | F39: 5 | G39: 3 | H39: 200035 | I39: 0 | J39: 480 | K39: 5000,0; | L39: 5 | M39: 5000,1; | N39: 18500/3600*(nPatrolSec+3)*(1000+nGuanQia)/1000 | O39: 14800/3600*(nPatrolSec+3)*(1000+nGuanQia)/1000 | P39: 15420/3600*(nPatrolSec+3)*(1000+nGuanQia)/1000 | Q39: nGuanQia + 1000 | R39: 18500/60*nMin*(1000+nGuanQia)/1000 | S39: 14800/60*nMin*(1000+nGuanQia)/1000 | T39: 15420/60*nMin*(1000+nGuanQia)/1000 | U39: 喽啰 | V39: pet_43;pet_52;pet_53;pet_62; | W39: 3 | X39: 5 | Y39: 1,28000,5,0;1,19016,5,0;1,10007,4,0;1,10108,1,0;1,7,3000,0;1,8,3000,0;1,4,1000,0; | Z39: 0 | AA39: {} | AB39: n/60
A40: 36 | B40: 36 | C40: 36 | D40: 白银试炼 | E40: 10502 | F40: 5 | G40: 3 | H40: 200036 | I40: 0 | J40: 480 | K40: 5000,0; | L40: 5 | M40: 5000,1; | N40: 18750/3600*(nPatrolSec+3)*(1000+nGuanQia)/1000 | O40: 15000/3600*(nPatrolSec+3)*(1000+nGuanQia)/1000 | P40: 15480/3600*(nPatrolSec+3)*(1000+nGuanQia)/1000 | Q40: nGuanQia + 1000 | R40: 18750/60*nMin*(1000+nGuanQia)/1000 | S40: 15000/60*nMin*(1000+nGuanQia)/1000 | T40: 15480/60*nMin*(1000+nGuanQia)/1000 | U40: 喽啰 | V40: pet_43;pet_52;pet_53;pet_62; | W40: 3 | X40: 5 | Y40: 1,28000,5,0;1,19016,5,0;1,10007,4,0;1,10108,1,0;1,7,3000,0;1,8,3000,0;1,4,1000,0; | Z40: 0 | AA40: {} | AB40: n/60
A41: 37 | B41: 37 | C41: 37 | D41: 白银试炼 | E41: 10502 | F41: 5 | G41: 3 | H41: 200037 | I41: 0 | J41: 480 | K41: 5000,0; | L41: 5 | M41: 5000,1; | N41: 19000/3600*(nPatrolSec+3)*(1000+nGuanQia)/1000 | O41: 15200/3600*(nPatrolSec+3)*(1000+nGuanQia)/1000 | P41: 15540/3600*(nPatrolSec+3)*(1000+nGuanQia)/1000 | Q41: nGuanQia + 1000 | R41: 19000/60*nMin*(1000+nGuanQia)/1000 | S41: 15200/60*nMin*(1000+nGuanQia)/1000 | T41: 15540/60*nMin*(1000+nGuanQia)/1000 | U41: 喽啰 | V41: pet_43;pet_52;pet_53;pet_62; | W41: 3 | X41: 5 | Y41: 1,28000,5,0;1,19016,5,0;1,10007,4,0;1,10108,1,0;1,7,3000,0;1,8,3000,0;1,4,1000,0; | Z41: 0 | AA41: {} | AB41: n/60
A42: 38 | B42: 38 | C42: 38 | D42: 白银试炼 | E42: 10502 | F42: 5 | G42: 3 | H42: 200038 | I42: 0 | J42: 480 | K42: 5000,0; | L42: 5 | M42: 5000,1; | N42: 19250/3600*(nPatrolSec+3)*(1000+nGuanQia)/1000 | O42: 15400/3600*(nPatrolSec+3)*(1000+nGuanQia)/1000 | P42: 15600/3600*(nPatrolSec+3)*(1000+nGuanQia)/1000 | Q42: nGuanQia + 1000 | R42: 19250/60*nMin*(1000+nGuanQia)/1000 | S42: 15400/60*nMin*(1000+nGuanQia)/1000 | T42: 15600/60*nMin*(1000+nGuanQia)/1000 | U42: 喽啰 | V42: pet_43;pet_52;pet_53;pet_62; | W42: 3 | X42: 5 | Y42: 1,28000,5,0;1,19016,5,0;1,10007,4,0;1,10108,1,0;1,7,3000,0;1,8,3000,0;1,4,1000,0; | Z42: 0 | AA42: {} | AB42: n/60
A43: 39 | B43: 39 | C43: 39 | D43: 白银试炼 | E43: 10502 | F43: 5 | G43: 3 | H43: 200039 | I43: 0 | J43: 480 | K43: 5000,0; | L43: 5 | M43: 5000,1; | N43: 19500/3600*(nPatrolSec+3)*(1000+nGuanQia)/1000 | O43: 15600/3600*(nPatrolSec+3)*(1000+nGuanQia)/1000 | P43: 15660/3600*(nPatrolSec+3)*(1000+nGuanQia)/1000 | Q43: nGuanQia + 1000 | R43: 19500/60*nMin*(1000+nGuanQia)/1000 | S43: 15600/60*nMin*(1000+nGuanQia)/1000 | T43: 15660/60*nMin*(1000+nGuanQia)/1000 | U43: 喽啰 | V43: pet_43;pet_52;pet_53;pet_62; | W43: 3 | X43: 5 | Y43: 1,28000,5,0;1,19016,5,0;1,10007,4,0;1,10108,1,0;1,7,3000,0;1,8,3000,0;1,4,1000,0; | Z43: 0 | AA43: {} | AB43: n/60
A44: 40 | B44: 40 | C44: 40 | D44: 白银试炼 | E44: 10502 | F44: 5 | G44: 3 | H44: 200040 | I44: 0 | J44: 480 | K44: 5000,0; | L44: 5 | M44: 5000,1; | N44: 20700/3600*(nPatrolSec+3)*(1000+nGuanQia)/1000 | O44: 16560/3600*(nPatrolSec+3)*(1000+nGuanQia)/1000 | P44: 15720/3600*(nPatrolSec+3)*(1000+nGuanQia)/1000 | Q44: nGuanQia + 1000 | R44: 20700/60*nMin*(1000+nGuanQia)/1000 | S44: 16560/60*nMin*(1000+nGuanQia)/1000 | T44: 15720/60*nMin*(1000+nGuanQia)/1000 | U44: 喽啰 | V44: pet_43;pet_52;pet_53;pet_62; | W44: 3 | X44: 5 | Y44: 1,28000,5,0;1,19016,5,0;1,10007,4,0;1,10108,1,0;1,7,3000,0;1,8,3000,0;1,4,1000,0; | Z44: 0 | AA44: {} | AB44: n/60
A45: 41 | B45: 41 | C45: 41 | D45: 黄金试炼 | E45: 10503 | F45: 5 | G45: 3 | H45: 200041 | I45: 0 | J45: 480 | K45: 5000,0; | L45: 5 | M45: 5000,1; | N45: 21000/3600*(nPatrolSec+3)*(1000+nGuanQia)/1000 | O45: 16800/3600*(nPatrolSec+3)*(1000+nGuanQia)/1000 | P45: 15780/3600*(nPatrolSec+3)*(1000+nGuanQia)/1000 | Q45: nGuanQia + 1000 | R45: 21000/60*nMin*(1000+nGuanQia)/1000 | S45: 16800/60*nMin*(1000+nGuanQia)/1000 | T45: 15780/60*nMin*(1000+nGuanQia)/1000 | U45: 喽啰 | V45: pet_63;pet_71;pet_73;pet_72; | W45: 3 | X45: 5 | Y45: 1,28000,5,0;1,19016,5,0;1,10007,5,0;1,10108,1,0;1,7,4000,0;1,8,4000,0;1,4,1000,0; | Z45: 0 | AA45: {} | AB45: n/60
A46: 42 | B46: 42 | C46: 42 | D46: 黄金试炼 | E46: 10503 | F46: 5 | G46: 3 | H46: 200042 | I46: 0 | J46: 480 | K46: 5000,0; | L46: 5 | M46: 5000,1; | N46: 21300/3600*(nPatrolSec+3)*(1000+nGuanQia)/1000 | O46: 17040/3600*(nPatrolSec+3)*(1000+nGuanQia)/1000 | P46: 15840/3600*(nPatrolSec+3)*(1000+nGuanQia)/1000 | Q46: nGuanQia + 1000 | R46: 21300/60*nMin*(1000+nGuanQia)/1000 | S46: 17040/60*nMin*(1000+nGuanQia)/1000 | T46: 15840/60*nMin*(1000+nGuanQia)/1000 | U46: 喽啰 | V46: pet_63;pet_71;pet_73;pet_72; | W46: 3 | X46: 5 | Y46: 1,28000,5,0;1,19016,5,0;1,10007,5,0;1,10108,1,0;1,7,4000,0;1,8,4000,0;1,4,1000,0; | Z46: 0 | AA46: {} | AB46: n/60
A47: 43 | B47: 43 | C47: 43 | D47: 黄金试炼 | E47: 10503 | F47: 5 | G47: 3 | H47: 200043 | I47: 0 | J47: 480 | K47: 5000,0; | L47: 5 | M47: 5000,1; | N47: 21600/3600*(nPatrolSec+3)*(1000+nGuanQia)/1000 | O47: 17280/3600*(nPatrolSec+3)*(1000+nGuanQia)/1000 | P47: 15900/3600*(nPatrolSec+3)*(1000+nGuanQia)/1000 | Q47: nGuanQia + 1000 | R47: 21600/60*nMin*(1000+nGuanQia)/1000 | S47: 17280/60*nMin*(1000+nGuanQia)/1000 | T47: 15900/60*nMin*(1000+nGuanQia)/1000 | U47: 喽啰 | V47: pet_63;pet_71;pet_73;pet_72; | W47: 3 | X47: 5 | Y47: 1,28000,5,0;1,19016,5,0;1,10007,5,0;1,10108,1,0;1,7,4000,0;1,8,4000,0;1,4,1000,0; | Z47: 0 | AA47: {} | AB47: n/60
A48: 44 | B48: 44 | C48: 44 | D48: 黄金试炼 | E48: 10503 | F48: 5 | G48: 3 | H48: 200044 | I48: 0 | J48: 480 | K48: 5000,0; | L48: 5 | M48: 5000,1; | N48: 21960/3600*(nPatrolSec+3)*(1000+nGuanQia)/1000 | O48: 17520/3600*(nPatrolSec+3)*(1000+nGuanQia)/1000 | P48: 15960/3600*(nPatrolSec+3)*(1000+nGuanQia)/1000 | Q48: nGuanQia + 1000 | R48: 21960/60*nMin*(1000+nGuanQia)/1000 | S48: 17520/60*nMin*(1000+nGuanQia)/1000 | T48: 15960/60*nMin*(1000+nGuanQia)/1000 | U48: 喽啰 | V48: pet_63;pet_71;pet_73;pet_72; | W48: 3 | X48: 5 | Y48: 1,28000,5,0;1,19016,5,0;1,10007,5,0;1,10108,1,0;1,7,4000,0;1,8,4000,0;1,4,1000,0; | Z48: 0 | AA48: {} | AB48: n/60
A49: 45 | B49: 45 | C49: 45 | D49: 黄金试炼 | E49: 10503 | F49: 5 | G49: 3 | H49: 200045 | I49: 0 | J49: 480 | K49: 5000,0; | L49: 5 | M49: 5000,1; | N49: 22260/3600*(nPatrolSec+3)*(1000+nGuanQia)/1000 | O49: 17820/3600*(nPatrolSec+3)*(1000+nGuanQia)/1000 | P49: 16020/3600*(nPatrolSec+3)*(1000+nGuanQia)/1000 | Q49: nGuanQia + 1000 | R49: 22260/60*nMin*(1000+nGuanQia)/1000 | S49: 17820/60*nMin*(1000+nGuanQia)/1000 | T49: 16020/60*nMin*(1000+nGuanQia)/1000 | U49: 喽啰 | V49: pet_63;pet_71;pet_73;pet_72; | W49: 3 | X49: 5 | Y49: 1,28000,5,0;1,19016,5,0;1,10007,5,0;1,10108,1,0;1,7,4000,0;1,8,4000,0;1,4,1000,0; | Z49: 0 | AA49: {} | AB49: n/60
A50: 46 | B50: 46 | C50: 46 | D50: 黄金试炼 | E50: 10503 | F50: 5 | G50: 3 | H50: 200046 | I50: 0 | J50: 480 | K50: 5000,0; | L50: 5 | M50: 5000,1; | N50: 22560/3600*(nPatrolSec+3)*(1000+nGuanQia)/1000 | O50: 18060/3600*(nPatrolSec+3)*(1000+nGuanQia)/1000 | P50: 16080/3600*(nPatrolSec+3)*(1000+nGuanQia)/1000 | Q50: nGuanQia + 1000 | R50: 22560/60*nMin*(1000+nGuanQia)/1000 | S50: 18060/60*nMin*(1000+nGuanQia)/1000 | T50: 16080/60*nMin*(1000+nGuanQia)/1000 | U50: 喽啰 | V50: pet_63;pet_71;pet_73;pet_72; | W50: 3 | X50: 5 | Y50: 1,28000,5,0;1,19016,5,0;1,10007,5,0;1,10108,1,0;1,7,4000,0;1,8,4000,0;1,4,1000,0; | Z50: 0 | AA50: {} | AB50: n/60
A51: 47 | B51: 47 | C51: 47 | D51: 黄金试炼 | E51: 10503 | F51: 5 | G51: 3 | H51: 200047 | I51: 0 | J51: 480 | K51: 5000,0; | L51: 5 | M51: 5000,1; | N51: 22860/3600*(nPatrolSec+3)*(1000+nGuanQia)/1000 | O51: 18300/3600*(nPatrolSec+3)*(1000+nGuanQia)/1000 | P51: 16140/3600*(nPatrolSec+3)*(1000+nGuanQia)/1000 | Q51: nGuanQia + 1000 | R51: 22860/60*nMin*(1000+nGuanQia)/1000 | S51: 18300/60*nMin*(1000+nGuanQia)/1000 | T51: 16140/60*nMin*(1000+nGuanQia)/1000 | U51: 喽啰 | V51: pet_63;pet_71;pet_73;pet_72; | W51: 3 | X51: 5 | Y51: 1,28000,5,0;1,19016,5,0;1,10007,5,0;1,10108,1,0;1,7,4000,0;1,8,4000,0;1,4,1000,0; | Z51: 0 | AA51: {} | AB51: n/60
A52: 48 | B52: 48 | C52: 48 | D52: 黄金试炼 | E52: 10503 | F52: 5 | G52: 3 | H52: 200048 | I52: 0 | J52: 480 | K52: 5000,0; | L52: 5 | M52: 5000,1; | N52: 23220/3600*(nPatrolSec+3)*(1000+nGuanQia)/1000 | O52: 18540/3600*(nPatrolSec+3)*(1000+nGuanQia)/1000 | P52: 16200/3600*(nPatrolSec+3)*(1000+nGuanQia)/1000 | Q52: nGuanQia + 1000 | R52: 23220/60*nMin*(1000+nGuanQia)/1000 | S52: 18540/60*nMin*(1000+nGuanQia)/1000 | T52: 16200/60*nMin*(1000+nGuanQia)/1000 | U52: 喽啰 | V52: pet_63;pet_71;pet_73;pet_72; | W52: 3 | X52: 5 | Y52: 1,28000,5,0;1,19016,5,0;1,10007,5,0;1,10108,1,0;1,7,4000,0;1,8,4000,0;1,4,1000,0; | Z52: 0 | AA52: {} | AB52: n/60
A53: 49 | B53: 49 | C53: 49 | D53: 黄金试炼 | E53: 10503 | F53: 5 | G53: 3 | H53: 200049 | I53: 0 | J53: 480 | K53: 5000,0; | L53: 5 | M53: 5000,1; | N53: 23520/3600*(nPatrolSec+3)*(1000+nGuanQia)/1000 | O53: 18780/3600*(nPatrolSec+3)*(1000+nGuanQia)/1000 | P53: 16260/3600*(nPatrolSec+3)*(1000+nGuanQia)/1000 | Q53: nGuanQia + 1000 | R53: 23520/60*nMin*(1000+nGuanQia)/1000 | S53: 18780/60*nMin*(1000+nGuanQia)/1000 | T53: 16260/60*nMin*(1000+nGuanQia)/1000 | U53: 喽啰 | V53: pet_63;pet_71;pet_73;pet_72; | W53: 3 | X53: 5 | Y53: 1,28000,5,0;1,19016,5,0;1,10007,5,0;1,10108,1,0;1,7,4000,0;1,8,4000,0;1,4,1000,0; | Z53: 0 | AA53: {} | AB53: n/60
A54: 50 | B54: 50 | C54: 50 | D54: 黄金试炼 | E54: 10503 | F54: 5 | G54: 3 | H54: 200050 | I54: 0 | J54: 480 | K54: 5000,0; | L54: 5 | M54: 5000,1; | N54: 23820/3600*(nPatrolSec+3)*(1000+nGuanQia)/1000 | O54: 19080/3600*(nPatrolSec+3)*(1000+nGuanQia)/1000 | P54: 16320/3600*(nPatrolSec+3)*(1000+nGuanQia)/1000 | Q54: nGuanQia + 1000 | R54: 23820/60*nMin*(1000+nGuanQia)/1000 | S54: 19080/60*nMin*(1000+nGuanQia)/1000 | T54: 16320/60*nMin*(1000+nGuanQia)/1000 | U54: 喽啰 | V54: pet_63;pet_71;pet_73;pet_72; | W54: 3 | X54: 5 | Y54: 1,28000,6,0;1,19016,6,0;1,10007,5,0;1,10108,1,0;1,7,4000,0;1,8,4000,0;1,4,1000,0; | Z54: 0 | AA54: {} | AB54: n/60
A55: 51 | B55: 51 | C55: 51 | D55: 黄金试炼 | E55: 10503 | F55: 5 | G55: 3 | H55: 200051 | I55: 0 | J55: 480 | K55: 5000,0; | L55: 5 | M55: 5000,1; | N55: 24120/3600*(nPatrolSec+3)*(1000+nGuanQia)/1000 | O55: 19320/3600*(nPatrolSec+3)*(1000+nGuanQia)/1000 | P55: 16380/3600*(nPatrolSec+3)*(1000+nGuanQia)/1000 | Q55: nGuanQia + 1000 | R55: 24120/60*nMin*(1000+nGuanQia)/1000 | S55: 19320/60*nMin*(1000+nGuanQia)/1000 | T55: 16380/60*nMin*(1000+nGuanQia)/1000 | U55: 喽啰 | V55: pet_63;pet_71;pet_73;pet_72; | W55: 3 | X55: 5 | Y55: 1,28000,6,0;1,19016,6,0;1,10007,5,0;1,10108,1,0;1,7,5000,0;1,8,5000,0;1,4,1000,0; | Z55: 0 | AA55: {} | AB55: n/60
A56: 52 | B56: 52 | C56: 52 | D56: 黄金试炼 | E56: 10503 | F56: 5 | G56: 3 | H56: 200052 | I56: 0 | J56: 480 | K56: 5000,0; | L56: 5 | M56: 5000,1; | N56: 24480/3600*(nPatrolSec+3)*(1000+nGuanQia)/1000 | O56: 19560/3600*(nPatrolSec+3)*(1000+nGuanQia)/1000 | P56: 16440/3600*(nPatrolSec+3)*(1000+nGuanQia)/1000 | Q56: nGuanQia + 1000 | R56: 24480/60*nMin*(1000+nGuanQia)/1000 | S56: 19560/60*nMin*(1000+nGuanQia)/1000 | T56: 16440/60*nMin*(1000+nGuanQia)/1000 | U56: 喽啰 | V56: pet_63;pet_71;pet_73;pet_72; | W56: 3 | X56: 5 | Y56: 1,28000,6,0;1,19016,6,0;1,10007,5,0;1,10108,1,0;1,7,5000,0;1,8,5000,0;1,4,1000,0; | Z56: 0 | AA56: {} | AB56: n/60
A57: 53 | B57: 53 | C57: 53 | D57: 黄金试炼 | E57: 10503 | F57: 5 | G57: 3 | H57: 200053 | I57: 0 | J57: 480 | K57: 5000,0; | L57: 5 | M57: 5000,1; | N57: 24780/3600*(nPatrolSec+3)*(1000+nGuanQia)/1000 | O57: 19800/3600*(nPatrolSec+3)*(1000+nGuanQia)/1000 | P57: 16500/3600*(nPatrolSec+3)*(1000+nGuanQia)/1000 | Q57: nGuanQia + 1000 | R57: 24780/60*nMin*(1000+nGuanQia)/1000 | S57: 19800/60*nMin*(1000+nGuanQia)/1000 | T57: 16500/60*nMin*(1000+nGuanQia)/1000 | U57: 喽啰 | V57: pet_63;pet_71;pet_73;pet_72; | W57: 3 | X57: 5 | Y57: 1,28000,6,0;1,19016,6,0;1,10007,5,0;1,10108,1,0;1,7,5000,0;1,8,5000,0;1,4,1000,0; | Z57: 0 | AA57: {} | AB57: n/60
A58: 54 | B58: 54 | C58: 54 | D58: 黄金试炼 | E58: 10503 | F58: 5 | G58: 3 | H58: 200054 | I58: 0 | J58: 480 | K58: 5000,0; | L58: 5 | M58: 5000,1; | N58: 25080/3600*(nPatrolSec+3)*(1000+nGuanQia)/1000 | O58: 20040/3600*(nPatrolSec+3)*(1000+nGuanQia)/1000 | P58: 16560/3600*(nPatrolSec+3)*(1000+nGuanQia)/1000 | Q58: nGuanQia + 1000 | R58: 25080/60*nMin*(1000+nGuanQia)/1000 | S58: 20040/60*nMin*(1000+nGuanQia)/1000 | T58: 16560/60*nMin*(1000+nGuanQia)/1000 | U58: 喽啰 | V58: pet_63;pet_71;pet_73;pet_72; | W58: 3 | X58: 5 | Y58: 1,28000,6,0;1,19016,6,0;1,10007,5,0;1,10108,1,0;1,7,5000,0;1,8,5000,0;1,4,1000,0; | Z58: 0 | AA58: {} | AB58: n/60
A59: 55 | B59: 55 | C59: 55 | D59: 黄金试炼 | E59: 10503 | F59: 5 | G59: 3 | H59: 200055 | I59: 0 | J59: 480 | K59: 5000,0; | L59: 5 | M59: 5000,1; | N59: 25380/3600*(nPatrolSec+3)*(1000+nGuanQia)/1000 | O59: 20340/3600*(nPatrolSec+3)*(1000+nGuanQia)/1000 | P59: 16620/3600*(nPatrolSec+3)*(1000+nGuanQia)/1000 | Q59: nGuanQia + 1000 | R59: 25380/60*nMin*(1000+nGuanQia)/1000 | S59: 20340/60*nMin*(1000+nGuanQia)/1000 | T59: 16620/60*nMin*(1000+nGuanQia)/1000 | U59: 喽啰 | V59: pet_63;pet_71;pet_73;pet_72; | W59: 4 | X59: 5 | Y59: 1,28000,6,0;1,19016,6,0;1,10007,5,0;1,10108,1,0;1,7,5000,0;1,8,5000,0;1,4,1000,0; | Z59: 0 | AA59: {} | AB59: n/60
A60: 56 | B60: 56 | C60: 56 | D60: 钻石试炼 | E60: 10504 | F60: 5 | G60: 3 | H60: 200056 | I60: 0 | J60: 480 | K60: 5000,0; | L60: 5 | M60: 5000,1; | N60: 25740/3600*(nPatrolSec+3)*(1000+nGuanQia)/1000 | O60: 20580/3600*(nPatrolSec+3)*(1000+nGuanQia)/1000 | P60: 16680/3600*(nPatrolSec+3)*(1000+nGuanQia)/1000 | Q60: nGuanQia + 1000 | R60: 25740/60*nMin*(1000+nGuanQia)/1000 | S60: 20580/60*nMin*(1000+nGuanQia)/1000 | T60: 16680/60*nMin*(1000+nGuanQia)/1000 | U60: 喽啰 | V60: pet_81;pet_102;pet_83;pet_42; | W60: 4 | X60: 5 | Y60: 1,28000,6,0;1,19016,6,0;1,10007,5,0;1,10108,1,0;1,7,5000,0;1,8,5000,0;1,4,1000,0; | Z60: 0 | AA60: {} | AB60: n/60
A61: 57 | B61: 57 | C61: 57 | D61: 钻石试炼 | E61: 10504 | F61: 5 | G61: 3 | H61: 200057 | I61: 0 | J61: 480 | K61: 5000,0; | L61: 5 | M61: 5000,1; | N61: 26040/3600*(nPatrolSec+3)*(1000+nGuanQia)/1000 | O61: 20820/3600*(nPatrolSec+3)*(1000+nGuanQia)/1000 | P61: 16740/3600*(nPatrolSec+3)*(1000+nGuanQia)/1000 | Q61: nGuanQia + 1000 | R61: 26040/60*nMin*(1000+nGuanQia)/1000 | S61: 20820/60*nMin*(1000+nGuanQia)/1000 | T61: 16740/60*nMin*(1000+nGuanQia)/1000 | U61: 喽啰 | V61: pet_81;pet_102;pet_83;pet_42; | W61: 4 | X61: 5 | Y61: 1,28000,6,0;1,19016,6,0;1,10007,5,0;1,10108,1,0;1,7,5000,0;1,8,5000,0;1,4,1000,0; | Z61: 0 | AA61: {} | AB61: n/60
A62: 58 | B62: 58 | C62: 58 | D62: 钻石试炼 | E62: 10504 | F62: 5 | G62: 3 | H62: 200058 | I62: 0 | J62: 480 | K62: 5000,0; | L62: 5 | M62: 5000,1; | N62: 26340/3600*(nPatrolSec+3)*(1000+nGuanQia)/1000 | O62: 21060/3600*(nPatrolSec+3)*(1000+nGuanQia)/1000 | P62: 16800/3600*(nPatrolSec+3)*(1000+nGuanQia)/1000 | Q62: nGuanQia + 1000 | R62: 26340/60*nMin*(1000+nGuanQia)/1000 | S62: 21060/60*nMin*(1000+nGuanQia)/1000 | T62: 16800/60*nMin*(1000+nGuanQia)/1000 | U62: 喽啰 | V62: pet_81;pet_102;pet_83;pet_42; | W62: 4 | X62: 5 | Y62: 1,28000,6,0;1,19016,6,0;1,10007,5,0;1,10108,1,0;1,7,5000,0;1,8,5000,0;1,4,1000,0; | Z62: 0 | AA62: {} | AB62: n/60
A63: 59 | B63: 59 | C63: 59 | D63: 钻石试炼 | E63: 10504 | F63: 5 | G63: 3 | H63: 200059 | I63: 0 | J63: 480 | K63: 5000,0; | L63: 5 | M63: 5000,1; | N63: 26640/3600*(nPatrolSec+3)*(1000+nGuanQia)/1000 | O63: 21300/3600*(nPatrolSec+3)*(1000+nGuanQia)/1000 | P63: 16860/3600*(nPatrolSec+3)*(1000+nGuanQia)/1000 | Q63: nGuanQia + 1000 | R63: 26640/60*nMin*(1000+nGuanQia)/1000 | S63: 21300/60*nMin*(1000+nGuanQia)/1000 | T63: 16860/60*nMin*(1000+nGuanQia)/1000 | U63: 喽啰 | V63: pet_81;pet_102;pet_83;pet_42; | W63: 4 | X63: 5 | Y63: 1,28000,6,0;1,19016,6,0;1,10007,5,0;1,10108,1,0;1,7,5000,0;1,8,5000,0;1,4,1000,0; | Z63: 0 | AA63: {} | AB63: n/60
A64: 60 | B64: 60 | C64: 60 | D64: 钻石试炼 | E64: 10504 | F64: 5 | G64: 3 | H64: 200060 | I64: 0 | J64: 480 | K64: 5000,0; | L64: 5 | M64: 5000,1; | N64: 27000/3600*(nPatrolSec+3)*(1000+nGuanQia)/1000 | O64: 21600/3600*(nPatrolSec+3)*(1000+nGuanQia)/1000 | P64: 16920/3600*(nPatrolSec+3)*(1000+nGuanQia)/1000 | Q64: nGuanQia + 1000 | R64: 27000/60*nMin*(1000+nGuanQia)/1000 | S64: 21600/60*nMin*(1000+nGuanQia)/1000 | T64: 16920/60*nMin*(1000+nGuanQia)/1000 | U64: 喽啰 | V64: pet_81;pet_102;pet_83;pet_42; | W64: 4 | X64: 5 | Y64: 1,28000,6,0;1,19016,6,0;1,10007,5,0;1,10108,1,0;1,7,5000,0;1,8,5000,0;1,4,1000,0; | Z64: 0 | AA64: {} | AB64: n/60
A65: 61 | B65: 61 | C65: 61 | D65: 钻石试炼 | E65: 10504 | F65: 5 | G65: 3 | H65: 200061 | I65: 0 | J65: 480 | K65: 5000,0; | L65: 5 | M65: 5000,1; | N65: 27300/3600*(nPatrolSec+3)*(1000+nGuanQia)/1000 | O65: 21840/3600*(nPatrolSec+3)*(1000+nGuanQia)/1000 | P65: 16980/3600*(nPatrolSec+3)*(1000+nGuanQia)/1000 | Q65: nGuanQia + 1000 | R65: 27300/60*nMin*(1000+nGuanQia)/1000 | S65: 21840/60*nMin*(1000+nGuanQia)/1000 | T65: 16980/60*nMin*(1000+nGuanQia)/1000 | U65: 喽啰 | V65: pet_81;pet_102;pet_83;pet_42; | W65: 4 | X65: 5 | Y65: 1,28000,6,0;1,19016,6,0;1,10007,5,0;1,10108,1,0;1,7,6000,0;1,8,6000,0;1,4,1000,0; | Z65: 0 | AA65: {} | AB65: n/60
A66: 62 | B66: 62 | C66: 62 | D66: 钻石试炼 | E66: 10504 | F66: 5 | G66: 3 | H66: 200062 | I66: 0 | J66: 480 | K66: 5000,0; | L66: 5 | M66: 5000,1; | N66: 27600/3600*(nPatrolSec+3)*(1000+nGuanQia)/1000 | O66: 22080/3600*(nPatrolSec+3)*(1000+nGuanQia)/1000 | P66: 17040/3600*(nPatrolSec+3)*(1000+nGuanQia)/1000 | Q66: nGuanQia + 1000 | R66: 27600/60*nMin*(1000+nGuanQia)/1000 | S66: 22080/60*nMin*(1000+nGuanQia)/1000 | T66: 17040/60*nMin*(1000+nGuanQia)/1000 | U66: 喽啰 | V66: pet_81;pet_102;pet_83;pet_42; | W66: 4 | X66: 5 | Y66: 1,28000,6,0;1,19016,6,0;1,10007,5,0;1,10108,1,0;1,7,6000,0;1,8,6000,0;1,4,1000,0; | Z66: 0 | AA66: {} | AB66: n/60
A67: 63 | B67: 63 | C67: 63 | D67: 钻石试炼 | E67: 10504 | F67: 5 | G67: 3 | H67: 200063 | I67: 0 | J67: 480 | K67: 5000,0; | L67: 5 | M67: 5000,1; | N67: 27900/3600*(nPatrolSec+3)*(1000+nGuanQia)/1000 | O67: 22320/3600*(nPatrolSec+3)*(1000+nGuanQia)/1000 | P67: 17100/3600*(nPatrolSec+3)*(1000+nGuanQia)/1000 | Q67: nGuanQia + 1000 | R67: 27900/60*nMin*(1000+nGuanQia)/1000 | S67: 22320/60*nMin*(1000+nGuanQia)/1000 | T67: 17100/60*nMin*(1000+nGuanQia)/1000 | U67: 喽啰 | V67: pet_81;pet_102;pet_83;pet_42; | W67: 4 | X67: 5 | Y67: 1,28000,6,0;1,19016,6,0;1,10007,5,0;1,10108,1,0;1,7,6000,0;1,8,6000,0;1,4,1000,0; | Z67: 0 | AA67: {} | AB67: n/60
A68: 64 | B68: 64 | C68: 64 | D68: 钻石试炼 | E68: 10504 | F68: 5 | G68: 3 | H68: 200064 | I68: 0 | J68: 480 | K68: 5000,0; | L68: 5 | M68: 5000,1; | N68: 28260/3600*(nPatrolSec+3)*(1000+nGuanQia)/1000 | O68: 22560/3600*(nPatrolSec+3)*(1000+nGuanQia)/1000 | P68: 17160/3600*(nPatrolSec+3)*(1000+nGuanQia)/1000 | Q68: nGuanQia + 1000 | R68: 28260/60*nMin*(1000+nGuanQia)/1000 | S68: 22560/60*nMin*(1000+nGuanQia)/1000 | T68: 17160/60*nMin*(1000+nGuanQia)/1000 | U68: 喽啰 | V68: pet_81;pet_102;pet_83;pet_42; | W68: 4 | X68: 5 | Y68: 1,28000,6,0;1,19016,6,0;1,10007,5,0;1,10108,1,0;1,7,6000,0;1,8,6000,0;1,4,1000,0; | Z68: 0 | AA68: {} | AB68: n/60
A69: 65 | B69: 65 | C69: 65 | D69: 钻石试炼 | E69: 10504 | F69: 5 | G69: 3 | H69: 200065 | I69: 0 | J69: 480 | K69: 5000,0; | L69: 5 | M69: 5000,1; | N69: 28560/3600*(nPatrolSec+3)*(1000+nGuanQia)/1000 | O69: 22860/3600*(nPatrolSec+3)*(1000+nGuanQia)/1000 | P69: 17220/3600*(nPatrolSec+3)*(1000+nGuanQia)/1000 | Q69: nGuanQia + 1000 | R69: 28560/60*nMin*(1000+nGuanQia)/1000 | S69: 22860/60*nMin*(1000+nGuanQia)/1000 | T69: 17220/60*nMin*(1000+nGuanQia)/1000 | U69: 喽啰 | V69: pet_81;pet_102;pet_83;pet_42; | W69: 4 | X69: 5 | Y69: 1,28000,6,0;1,19016,6,0;1,10007,5,0;1,10108,1,0;1,7,6000,0;1,8,6000,0;1,4,1000,0; | Z69: 0 | AA69: {} | AB69: n/60
A70: 66 | B70: 66 | C70: 66 | D70: 钻石试炼 | E70: 10504 | F70: 5 | G70: 3 | H70: 200066 | I70: 0 | J70: 480 | K70: 5000,0; | L70: 5 | M70: 5000,1; | N70: 28860/3600*(nPatrolSec+3)*(1000+nGuanQia)/1000 | O70: 23100/3600*(nPatrolSec+3)*(1000+nGuanQia)/1000 | P70: 17280/3600*(nPatrolSec+3)*(1000+nGuanQia)/1000 | Q70: nGuanQia + 1000 | R70: 28860/60*nMin*(1000+nGuanQia)/1000 | S70: 23100/60*nMin*(1000+nGuanQia)/1000 | T70: 17280/60*nMin*(1000+nGuanQia)/1000 | U70: 喽啰 | V70: pet_81;pet_102;pet_83;pet_42; | W70: 4 | X70: 5 | Y70: 1,28000,6,0;1,19016,6,0;1,10007,5,0;1,10108,1,0;1,7,6000,0;1,8,6000,0;1,4,1000,0; | Z70: 0 | AA70: {} | AB70: n/60
A71: 67 | B71: 67 | C71: 67 | D71: 钻石试炼 | E71: 10504 | F71: 5 | G71: 3 | H71: 200067 | I71: 0 | J71: 480 | K71: 5000,0; | L71: 5 | M71: 5000,1; | N71: 29160/3600*(nPatrolSec+3)*(1000+nGuanQia)/1000 | O71: 23340/3600*(nPatrolSec+3)*(1000+nGuanQia)/1000 | P71: 17340/3600*(nPatrolSec+3)*(1000+nGuanQia)/1000 | Q71: nGuanQia + 1000 | R71: 29160/60*nMin*(1000+nGuanQia)/1000 | S71: 23340/60*nMin*(1000+nGuanQia)/1000 | T71: 17340/60*nMin*(1000+nGuanQia)/1000 | U71: 喽啰 | V71: pet_81;pet_102;pet_83;pet_42; | W71: 4 | X71: 5 | Y71: 1,28000,6,0;1,19016,6,0;1,10007,5,0;1,10108,1,0;1,7,6000,0;1,8,6000,0;1,4,1000,0; | Z71: 0 | AA71: {} | AB71: n/60
A72: 68 | B72: 68 | C72: 68 | D72: 钻石试炼 | E72: 10504 | F72: 5 | G72: 3 | H72: 200068 | I72: 0 | J72: 480 | K72: 5000,0; | L72: 5 | M72: 5000,1; | N72: 29520/3600*(nPatrolSec+3)*(1000+nGuanQia)/1000 | O72: 23580/3600*(nPatrolSec+3)*(1000+nGuanQia)/1000 | P72: 17400/3600*(nPatrolSec+3)*(1000+nGuanQia)/1000 | Q72: nGuanQia + 1000 | R72: 29520/60*nMin*(1000+nGuanQia)/1000 | S72: 23580/60*nMin*(1000+nGuanQia)/1000 | T72: 17400/60*nMin*(1000+nGuanQia)/1000 | U72: 喽啰 | V72: pet_81;pet_102;pet_83;pet_42; | W72: 4 | X72: 5 | Y72: 1,28000,6,0;1,19016,6,0;1,10007,5,0;1,10108,1,0;1,7,6000,0;1,8,6000,0;1,4,1000,0; | Z72: 0 | AA72: {} | AB72: n/60
A73: 69 | B73: 69 | C73: 69 | D73: 钻石试炼 | E73: 10504 | F73: 5 | G73: 3 | H73: 200069 | I73: 0 | J73: 480 | K73: 5000,0; | L73: 5 | M73: 5000,1; | N73: 29820/3600*(nPatrolSec+3)*(1000+nGuanQia)/1000 | O73: 23820/3600*(nPatrolSec+3)*(1000+nGuanQia)/1000 | P73: 17460/3600*(nPatrolSec+3)*(1000+nGuanQia)/1000 | Q73: nGuanQia + 1000 | R73: 29820/60*nMin*(1000+nGuanQia)/1000 | S73: 23820/60*nMin*(1000+nGuanQia)/1000 | T73: 17460/60*nMin*(1000+nGuanQia)/1000 | U73: 喽啰 | V73: pet_81;pet_102;pet_83;pet_42; | W73: 4 | X73: 5 | Y73: 1,28000,6,0;1,19016,6,0;1,10007,5,0;1,10108,1,0;1,7,6000,0;1,8,6000,0;1,4,1000,0; | Z73: 0 | AA73: {} | AB73: n/60
A74: 70 | B74: 70 | C74: 70 | D74: 钻石试炼 | E74: 10504 | F74: 5 | G74: 3 | H74: 200070 | I74: 0 | J74: 480 | K74: 5000,0; | L74: 5 | M74: 5000,1; | N74: 30120/3600*(nPatrolSec+3)*(1000+nGuanQia)/1000 | O74: 24120/3600*(nPatrolSec+3)*(1000+nGuanQia)/1000 | P74: 17520/3600*(nPatrolSec+3)*(1000+nGuanQia)/1000 | Q74: nGuanQia + 1000 | R74: 30120/60*nMin*(1000+nGuanQia)/1000 | S74: 24120/60*nMin*(1000+nGuanQia)/1000 | T74: 17520/60*nMin*(1000+nGuanQia)/1000 | U74: 喽啰 | V74: pet_81;pet_102;pet_83;pet_42; | W74: 4 | X74: 5 | Y74: 1,28000,7,0;1,19016,7,0;1,10007,5,0;1,10108,2,0;1,7,6000,0;1,8,6000,0;1,4,1000,0; | Z74: 0 | AA74: {} | AB74: n/60
A75: 71 | B75: 71 | C75: 71 | D75: 大师试炼 | E75: 10505 | F75: 5 | G75: 3 | H75: 200071 | I75: 0 | J75: 480 | K75: 5000,0; | L75: 5 | M75: 5000,1; | N75: 30420/3600*(nPatrolSec+3)*(1000+nGuanQia)/1000 | O75: 24360/3600*(nPatrolSec+3)*(1000+nGuanQia)/1000 | P75: 17580/3600*(nPatrolSec+3)*(1000+nGuanQia)/1000 | Q75: nGuanQia + 1000 | R75: 30420/60*nMin*(1000+nGuanQia)/1000 | S75: 24360/60*nMin*(1000+nGuanQia)/1000 | T75: 17580/60*nMin*(1000+nGuanQia)/1000 | U75: 喽啰 | V75: pet_21;pet_201;pet_93;pet_91; | W75: 4 | X75: 5 | Y75: 1,28000,7,0;1,19016,7,0;1,10007,5,0;1,10108,2,0;1,7,7000,0;1,8,7000,0;1,4,1000,0; | Z75: 0 | AA75: {} | AB75: n/60
A76: 72 | B76: 72 | C76: 72 | D76: 大师试炼 | E76: 10505 | F76: 5 | G76: 3 | H76: 200072 | I76: 0 | J76: 480 | K76: 5000,0; | L76: 5 | M76: 5000,1; | N76: 30780/3600*(nPatrolSec+3)*(1000+nGuanQia)/1000 | O76: 24600/3600*(nPatrolSec+3)*(1000+nGuanQia)/1000 | P76: 17640/3600*(nPatrolSec+3)*(1000+nGuanQia)/1000 | Q76: nGuanQia + 1000 | R76: 30780/60*nMin*(1000+nGuanQia)/1000 | S76: 24600/60*nMin*(1000+nGuanQia)/1000 | T76: 17640/60*nMin*(1000+nGuanQia)/1000 | U76: 喽啰 | V76: pet_21;pet_201;pet_93;pet_91; | W76: 4 | X76: 5 | Y76: 1,28000,7,0;1,19016,7,0;1,10007,5,0;1,10108,2,0;1,7,7000,0;1,8,7000,0;1,4,1000,0; | Z76: 0 | AA76: {} | AB76: n/60
A77: 73 | B77: 73 | C77: 73 | D77: 大师试炼 | E77: 10505 | F77: 5 | G77: 3 | H77: 200073 | I77: 0 | J77: 480 | K77: 5000,0; | L77: 5 | M77: 5000,1; | N77: 31080/3600*(nPatrolSec+3)*(1000+nGuanQia)/1000 | O77: 24840/3600*(nPatrolSec+3)*(1000+nGuanQia)/1000 | P77: 17700/3600*(nPatrolSec+3)*(1000+nGuanQia)/1000 | Q77: nGuanQia + 1000 | R77: 31080/60*nMin*(1000+nGuanQia)/1000 | S77: 24840/60*nMin*(1000+nGuanQia)/1000 | T77: 17700/60*nMin*(1000+nGuanQia)/1000 | U77: 喽啰 | V77: pet_21;pet_201;pet_93;pet_91; | W77: 4 | X77: 5 | Y77: 1,28000,7,0;1,19016,7,0;1,10007,5,0;1,10108,2,0;1,7,7000,0;1,8,7000,0;1,4,1000,0; | Z77: 0 | AA77: {} | AB77: n/60
A78: 74 | B78: 74 | C78: 74 | D78: 大师试炼 | E78: 10505 | F78: 5 | G78: 3 | H78: 200074 | I78: 0 | J78: 480 | K78: 5000,0; | L78: 5 | M78: 5000,1; | N78: 31380/3600*(nPatrolSec+3)*(1000+nGuanQia)/1000 | O78: 25080/3600*(nPatrolSec+3)*(1000+nGuanQia)/1000 | P78: 17760/3600*(nPatrolSec+3)*(1000+nGuanQia)/1000 | Q78: nGuanQia + 1000 | R78: 31380/60*nMin*(1000+nGuanQia)/1000 | S78: 25080/60*nMin*(1000+nGuanQia)/1000 | T78: 17760/60*nMin*(1000+nGuanQia)/1000 | U78: 喽啰 | V78: pet_21;pet_201;pet_93;pet_91; | W78: 4 | X78: 5 | Y78: 1,28000,7,0;1,19016,7,0;1,10007,5,0;1,10108,2,0;1,7,7000,0;1,8,7000,0;1,4,1000,0; | Z78: 0 | AA78: {} | AB78: n/60
A79: 75 | B79: 75 | C79: 75 | D79: 大师试炼 | E79: 10505 | F79: 5 | G79: 3 | H79: 200075 | I79: 0 | J79: 480 | K79: 5000,0; | L79: 5 | M79: 5000,1; | N79: 31680/3600*(nPatrolSec+3)*(1000+nGuanQia)/1000 | O79: 25380/3600*(nPatrolSec+3)*(1000+nGuanQia)/1000 | P79: 17820/3600*(nPatrolSec+3)*(1000+nGuanQia)/1000 | Q79: nGuanQia + 1000 | R79: 31680/60*nMin*(1000+nGuanQia)/1000 | S79: 25380/60*nMin*(1000+nGuanQia)/1000 | T79: 17820/60*nMin*(1000+nGuanQia)/1000 | U79: 喽啰 | V79: pet_21;pet_201;pet_93;pet_91; | W79: 4 | X79: 5 | Y79: 1,28000,7,0;1,19016,7,0;1,10007,5,0;1,10108,2,0;1,7,7000,0;1,8,7000,0;1,4,1000,0; | Z79: 0 | AA79: {} | AB79: n/60
A80: 76 | B80: 76 | C80: 76 | D80: 大师试炼 | E80: 10505 | F80: 5 | G80: 3 | H80: 200076 | I80: 0 | J80: 480 | K80: 5000,0; | L80: 5 | M80: 5000,1; | N80: 32040/3600*(nPatrolSec+3)*(1000+nGuanQia)/1000 | O80: 25620/3600*(nPatrolSec+3)*(1000+nGuanQia)/1000 | P80: 17880/3600*(nPatrolSec+3)*(1000+nGuanQia)/1000 | Q80: nGuanQia + 1000 | R80: 32040/60*nMin*(1000+nGuanQia)/1000 | S80: 25620/60*nMin*(1000+nGuanQia)/1000 | T80: 17880/60*nMin*(1000+nGuanQia)/1000 | U80: 喽啰 | V80: pet_21;pet_201;pet_93;pet_91; | W80: 4 | X80: 5 | Y80: 1,28000,7,0;1,19016,7,0;1,10007,5,0;1,10108,2,0;1,7,7000,0;1,8,7000,0;1,4,1000,0; | Z80: 0 | AA80: {} | AB80: n/60
A81: 77 | B81: 77 | C81: 77 | D81: 大师试炼 | E81: 10505 | F81: 5 | G81: 3 | H81: 200077 | I81: 0 | J81: 480 | K81: 5000,0; | L81: 5 | M81: 5000,1; | N81: 32340/3600*(nPatrolSec+3)*(1000+nGuanQia)/1000 | O81: 25860/3600*(nPatrolSec+3)*(1000+nGuanQia)/1000 | P81: 17940/3600*(nPatrolSec+3)*(1000+nGuanQia)/1000 | Q81: nGuanQia + 1000 | R81: 32340/60*nMin*(1000+nGuanQia)/1000 | S81: 25860/60*nMin*(1000+nGuanQia)/1000 | T81: 17940/60*nMin*(1000+nGuanQia)/1000 | U81: 喽啰 | V81: pet_21;pet_201;pet_93;pet_91; | W81: 4 | X81: 5 | Y81: 1,28000,7,0;1,19016,7,0;1,10007,5,0;1,10108,2,0;1,7,7000,0;1,8,7000,0;1,4,1000,0; | Z81: 0 | AA81: {} | AB81: n/60
A82: 78 | B82: 78 | C82: 78 | D82: 大师试炼 | E82: 10505 | F82: 5 | G82: 3 | H82: 200078 | I82: 0 | J82: 480 | K82: 5000,0; | L82: 5 | M82: 5000,1; | N82: 32640/3600*(nPatrolSec+3)*(1000+nGuanQia)/1000 | O82: 26100/3600*(nPatrolSec+3)*(1000+nGuanQia)/1000 | P82: 18000/3600*(nPatrolSec+3)*(1000+nGuanQia)/1000 | Q82: nGuanQia + 1000 | R82: 32640/60*nMin*(1000+nGuanQia)/1000 | S82: 26100/60*nMin*(1000+nGuanQia)/1000 | T82: 18000/60*nMin*(1000+nGuanQia)/1000 | U82: 喽啰 | V82: pet_21;pet_201;pet_93;pet_91; | W82: 4 | X82: 5 | Y82: 1,28000,7,0;1,19016,7,0;1,10007,5,0;1,10108,2,0;1,7,7000,0;1,8,7000,0;1,4,1000,0; | Z82: 0 | AA82: {} | AB82: n/60
A83: 79 | B83: 79 | C83: 79 | D83: 大师试炼 | E83: 10505 | F83: 5 | G83: 3 | H83: 200079 | I83: 0 | J83: 480 | K83: 5000,0; | L83: 5 | M83: 5000,1; | N83: 32940/3600*(nPatrolSec+3)*(1000+nGuanQia)/1000 | O83: 26340/3600*(nPatrolSec+3)*(1000+nGuanQia)/1000 | P83: 18060/3600*(nPatrolSec+3)*(1000+nGuanQia)/1000 | Q83: nGuanQia + 1000 | R83: 32940/60*nMin*(1000+nGuanQia)/1000 | S83: 26340/60*nMin*(1000+nGuanQia)/1000 | T83: 18060/60*nMin*(1000+nGuanQia)/1000 | U83: 喽啰 | V83: pet_21;pet_201;pet_93;pet_91; | W83: 4 | X83: 5 | Y83: 1,28000,7,0;1,19016,7,0;1,10007,5,0;1,10108,2,0;1,7,7000,0;1,8,7000,0;1,4,1000,0; | Z83: 0 | AA83: {} | AB83: n/60
A84: 80 | B84: 80 | C84: 80 | D84: 大师试炼 | E84: 10505 | F84: 5 | G84: 3 | H84: 200080 | I84: 0 | J84: 480 | K84: 5000,0; | L84: 5 | M84: 5000,1; | N84: 33300/3600*(nPatrolSec+3)*(1000+nGuanQia)/1000 | O84: 26640/3600*(nPatrolSec+3)*(1000+nGuanQia)/1000 | P84: 18180/3600*(nPatrolSec+3)*(1000+nGuanQia)/1000 | Q84: nGuanQia + 1000 | R84: 33300/60*nMin*(1000+nGuanQia)/1000 | S84: 26640/60*nMin*(1000+nGuanQia)/1000 | T84: 18180/60*nMin*(1000+nGuanQia)/1000 | U84: 喽啰 | V84: pet_21;pet_201;pet_93;pet_91; | W84: 4 | X84: 5 | Y84: 1,28000,8,0;1,19016,8,0;1,10007,5,0;1,10108,2,0;1,7,7000,0;1,8,7000,0;1,4,1000,0; | Z84: 0 | AA84: {} | AB84: n/60
A85: 81 | B85: 81 | C85: 81 | D85: 大师试炼 | E85: 10505 | F85: 5 | G85: 3 | H85: 200081 | I85: 0 | J85: 480 | K85: 5000,0; | L85: 5 | M85: 5000,1; | N85: 33600/3600*(nPatrolSec+3)*(1000+nGuanQia)/1000 | O85: 26880/3600*(nPatrolSec+3)*(1000+nGuanQia)/1000 | P85: 18240/3600*(nPatrolSec+3)*(1000+nGuanQia)/1000 | Q85: nGuanQia + 1000 | R85: 33600/60*nMin*(1000+nGuanQia)/1000 | S85: 26880/60*nMin*(1000+nGuanQia)/1000 | T85: 18240/60*nMin*(1000+nGuanQia)/1000 | U85: 喽啰 | V85: pet_21;pet_201;pet_93;pet_91; | W85: 4 | X85: 5 | Y85: 1,28000,8,0;1,19016,8,0;1,10007,5,0;1,10108,2,0;1,7,8000,0;1,8,8000,0;1,4,1000,0; | Z85: 0 | AA85: {} | AB85: n/60
A86: 82 | B86: 82 | C86: 82 | D86: 大师试炼 | E86: 10505 | F86: 5 | G86: 3 | H86: 200082 | I86: 0 | J86: 480 | K86: 5000,0; | L86: 5 | M86: 5000,1; | N86: 33900/3600*(nPatrolSec+3)*(1000+nGuanQia)/1000 | O86: 27120/3600*(nPatrolSec+3)*(1000+nGuanQia)/1000 | P86: 18300/3600*(nPatrolSec+3)*(1000+nGuanQia)/1000 | Q86: nGuanQia + 1000 | R86: 33900/60*nMin*(1000+nGuanQia)/1000 | S86: 27120/60*nMin*(1000+nGuanQia)/1000 | T86: 18300/60*nMin*(1000+nGuanQia)/1000 | U86: 喽啰 | V86: pet_21;pet_201;pet_93;pet_91; | W86: 4 | X86: 5 | Y86: 1,28000,8,0;1,19016,8,0;1,10007,5,0;1,10108,2,0;1,7,8000,0;1,8,8000,0;1,4,1000,0; | Z86: 0 | AA86: {} | AB86: n/60
A87: 83 | B87: 83 | C87: 83 | D87: 大师试炼 | E87: 10505 | F87: 5 | G87: 3 | H87: 200083 | I87: 0 | J87: 480 | K87: 5000,0; | L87: 5 | M87: 5000,1; | N87: 34200/3600*(nPatrolSec+3)*(1000+nGuanQia)/1000 | O87: 27360/3600*(nPatrolSec+3)*(1000+nGuanQia)/1000 | P87: 18360/3600*(nPatrolSec+3)*(1000+nGuanQia)/1000 | Q87: nGuanQia + 1000 | R87: 34200/60*nMin*(1000+nGuanQia)/1000 | S87: 27360/60*nMin*(1000+nGuanQia)/1000 | T87: 18360/60*nMin*(1000+nGuanQia)/1000 | U87: 喽啰 | V87: pet_21;pet_201;pet_93;pet_91; | W87: 4 | X87: 5 | Y87: 1,28000,8,0;1,19016,8,0;1,10007,5,0;1,10108,2,0;1,7,8000,0;1,8,8000,0;1,4,1000,0; | Z87: 0 | AA87: {} | AB87: n/60
A88: 84 | B88: 84 | C88: 84 | D88: 大师试炼 | E88: 10505 | F88: 5 | G88: 3 | H88: 200084 | I88: 0 | J88: 480 | K88: 5000,0; | L88: 5 | M88: 5000,1; | N88: 34560/3600*(nPatrolSec+3)*(1000+nGuanQia)/1000 | O88: 27600/3600*(nPatrolSec+3)*(1000+nGuanQia)/1000 | P88: 18420/3600*(nPatrolSec+3)*(1000+nGuanQia)/1000 | Q88: nGuanQia + 1000 | R88: 34560/60*nMin*(1000+nGuanQia)/1000 | S88: 27600/60*nMin*(1000+nGuanQia)/1000 | T88: 18420/60*nMin*(1000+nGuanQia)/1000 | U88: 喽啰 | V88: pet_21;pet_201;pet_93;pet_91; | W88: 4 | X88: 5 | Y88: 1,28000,8,0;1,19016,8,0;1,10007,5,0;1,10108,2,0;1,7,8000,0;1,8,8000,0;1,4,1000,0; | Z88: 0 | AA88: {} | AB88: n/60
A89: 85 | B89: 85 | C89: 85 | D89: 大师试炼 | E89: 10505 | F89: 5 | G89: 3 | H89: 200085 | I89: 0 | J89: 480 | K89: 5000,0; | L89: 5 | M89: 5000,1; | N89: 34860/3600*(nPatrolSec+3)*(1000+nGuanQia)/1000 | O89: 27900/3600*(nPatrolSec+3)*(1000+nGuanQia)/1000 | P89: 18480/3600*(nPatrolSec+3)*(1000+nGuanQia)/1000 | Q89: nGuanQia + 1000 | R89: 34860/60*nMin*(1000+nGuanQia)/1000 | S89: 27900/60*nMin*(1000+nGuanQia)/1000 | T89: 18480/60*nMin*(1000+nGuanQia)/1000 | U89: 喽啰 | V89: pet_21;pet_201;pet_93;pet_91; | W89: 4 | X89: 5 | Y89: 1,28000,8,0;1,19016,8,0;1,10007,5,0;1,10108,2,0;1,7,8000,0;1,8,8000,0;1,4,1000,0; | Z89: 0 | AA89: {} | AB89: n/60
A90: 86 | B90: 86 | C90: 86 | D90: 王者试炼 | E90: 10904 | F90: 5 | G90: 3 | H90: 200086 | I90: 0 | J90: 480 | K90: 5000,0; | L90: 5 | M90: 5000,1; | N90: 35160/3600*(nPatrolSec+3)*(1000+nGuanQia)/1000 | O90: 28140/3600*(nPatrolSec+3)*(1000+nGuanQia)/1000 | P90: 18540/3600*(nPatrolSec+3)*(1000+nGuanQia)/1000 | Q90: nGuanQia + 1000 | R90: 35160/60*nMin*(1000+nGuanQia)/1000 | S90: 28140/60*nMin*(1000+nGuanQia)/1000 | T90: 18540/60*nMin*(1000+nGuanQia)/1000 | U90: 喽啰 | V90: pet_21;pet_201;pet_93;pet_91; | W90: 4 | X90: 5 | Y90: 1,28000,8,0;1,19016,8,0;1,10007,5,0;1,10108,2,0;1,7,8000,0;1,8,8000,0;1,4,1000,0; | Z90: 0 | AA90: {} | AB90: n/60
A91: 87 | B91: 87 | C91: 87 | D91: 王者试炼 | E91: 10904 | F91: 5 | G91: 3 | H91: 200087 | I91: 0 | J91: 480 | K91: 5000,0; | L91: 5 | M91: 5000,1; | N91: 35460/3600*(nPatrolSec+3)*(1000+nGuanQia)/1000 | O91: 28380/3600*(nPatrolSec+3)*(1000+nGuanQia)/1000 | P91: 18600/3600*(nPatrolSec+3)*(1000+nGuanQia)/1000 | Q91: nGuanQia + 1000 | R91: 35460/60*nMin*(1000+nGuanQia)/1000 | S91: 28380/60*nMin*(1000+nGuanQia)/1000 | T91: 18600/60*nMin*(1000+nGuanQia)/1000 | U91: 喽啰 | V91: pet_21;pet_201;pet_93;pet_91; | W91: 4 | X91: 5 | Y91: 1,28000,8,0;1,19016,8,0;1,10007,5,0;1,10108,2,0;1,7,8000,0;1,8,8000,0;1,4,1000,0; | Z91: 0 | AA91: {} | AB91: n/60
A92: 88 | B92: 88 | C92: 88 | D92: 王者试炼 | E92: 10904 | F92: 5 | G92: 3 | H92: 200088 | I92: 0 | J92: 480 | K92: 5000,0; | L92: 5 | M92: 5000,1; | N92: 35820/3600*(nPatrolSec+3)*(1000+nGuanQia)/1000 | O92: 28620/3600*(nPatrolSec+3)*(1000+nGuanQia)/1000 | P92: 18660/3600*(nPatrolSec+3)*(1000+nGuanQia)/1000 | Q92: nGuanQia + 1000 | R92: 35820/60*nMin*(1000+nGuanQia)/1000 | S92: 28620/60*nMin*(1000+nGuanQia)/1000 | T92: 18660/60*nMin*(1000+nGuanQia)/1000 | U92: 喽啰 | V92: pet_21;pet_201;pet_93;pet_91; | W92: 4 | X92: 5 | Y92: 1,28000,8,0;1,19016,8,0;1,10007,5,0;1,10108,2,0;1,7,8000,0;1,8,8000,0;1,4,1000,0; | Z92: 0 | AA92: {} | AB92: n/60
A93: 89 | B93: 89 | C93: 89 | D93: 王者试炼 | E93: 10904 | F93: 5 | G93: 3 | H93: 200089 | I93: 0 | J93: 480 | K93: 5000,0; | L93: 5 | M93: 5000,1; | N93: 36120/3600*(nPatrolSec+3)*(1000+nGuanQia)/1000 | O93: 28860/3600*(nPatrolSec+3)*(1000+nGuanQia)/1000 | P93: 18720/3600*(nPatrolSec+3)*(1000+nGuanQia)/1000 | Q93: nGuanQia + 1000 | R93: 36120/60*nMin*(1000+nGuanQia)/1000 | S93: 28860/60*nMin*(1000+nGuanQia)/1000 | T93: 18720/60*nMin*(1000+nGuanQia)/1000 | U93: 喽啰 | V93: pet_21;pet_201;pet_93;pet_91; | W93: 4 | X93: 5 | Y93: 1,28000,8,0;1,19016,8,0;1,10007,5,0;1,10108,2,0;1,7,8000,0;1,8,8000,0;1,4,1000,0; | Z93: 0 | AA93: {} | AB93: n/60
A94: 90 | B94: 90 | C94: 90 | D94: 王者试炼 | E94: 10904 | F94: 5 | G94: 3 | H94: 200090 | I94: 0 | J94: 480 | K94: 5000,0; | L94: 5 | M94: 5000,1; | N94: 36420/3600*(nPatrolSec+3)*(1000+nGuanQia)/1000 | O94: 29160/3600*(nPatrolSec+3)*(1000+nGuanQia)/1000 | P94: 18780/3600*(nPatrolSec+3)*(1000+nGuanQia)/1000 | Q94: nGuanQia + 1000 | R94: 36420/60*nMin*(1000+nGuanQia)/1000 | S94: 29160/60*nMin*(1000+nGuanQia)/1000 | T94: 18780/60*nMin*(1000+nGuanQia)/1000 | U94: 喽啰 | V94: pet_21;pet_201;pet_93;pet_91; | W94: 4 | X94: 5 | Y94: 1,28000,8,0;1,19016,8,0;1,10007,5,0;1,10108,2,0;1,7,8000,0;1,8,8000,0;1,4,1000,0; | Z94: 0 | AA94: {} | AB94: n/60
A95: 91 | B95: 91 | C95: 91 | D95: 王者试炼 | E95: 10904 | F95: 5 | G95: 3 | H95: 200091 | I95: 0 | J95: 480 | K95: 5000,0; | L95: 5 | M95: 5000,1; | N95: 36720/3600*(nPatrolSec+3)*(1000+nGuanQia)/1000 | O95: 29400/3600*(nPatrolSec+3)*(1000+nGuanQia)/1000 | P95: 18840/3600*(nPatrolSec+3)*(1000+nGuanQia)/1000 | Q95: nGuanQia + 1000 | R95: 36720/60*nMin*(1000+nGuanQia)/1000 | S95: 29400/60*nMin*(1000+nGuanQia)/1000 | T95: 18840/60*nMin*(1000+nGuanQia)/1000 | U95: 喽啰 | V95: pet_21;pet_201;pet_93;pet_91; | W95: 4 | X95: 5 | Y95: 1,28000,8,0;1,19016,8,0;1,10007,5,0;1,10108,2,0;1,7,9000,0;1,8,9000,0;1,4,1000,0; | Z95: 0 | AA95: {} | AB95: n/60
A96: 92 | B96: 92 | C96: 92 | D96: 王者试炼 | E96: 10904 | F96: 5 | G96: 3 | H96: 200092 | I96: 0 | J96: 480 | K96: 5000,0; | L96: 5 | M96: 5000,1; | N96: 37080/3600*(nPatrolSec+3)*(1000+nGuanQia)/1000 | O96: 29640/3600*(nPatrolSec+3)*(1000+nGuanQia)/1000 | P96: 18900/3600*(nPatrolSec+3)*(1000+nGuanQia)/1000 | Q96: nGuanQia + 1000 | R96: 37080/60*nMin*(1000+nGuanQia)/1000 | S96: 29640/60*nMin*(1000+nGuanQia)/1000 | T96: 18900/60*nMin*(1000+nGuanQia)/1000 | U96: 喽啰 | V96: pet_21;pet_201;pet_93;pet_91; | W96: 4 | X96: 5 | Y96: 1,28000,8,0;1,19016,8,0;1,10007,5,0;1,10108,2,0;1,7,9000,0;1,8,9000,0;1,4,1000,0; | Z96: 0 | AA96: {} | AB96: n/60
A97: 93 | B97: 93 | C97: 93 | D97: 王者试炼 | E97: 10904 | F97: 5 | G97: 3 | H97: 200093 | I97: 0 | J97: 480 | K97: 5000,0; | L97: 5 | M97: 5000,1; | N97: 37380/3600*(nPatrolSec+3)*(1000+nGuanQia)/1000 | O97: 29880/3600*(nPatrolSec+3)*(1000+nGuanQia)/1000 | P97: 18960/3600*(nPatrolSec+3)*(1000+nGuanQia)/1000 | Q97: nGuanQia + 1000 | R97: 37380/60*nMin*(1000+nGuanQia)/1000 | S97: 29880/60*nMin*(1000+nGuanQia)/1000 | T97: 18960/60*nMin*(1000+nGuanQia)/1000 | U97: 喽啰 | V97: pet_21;pet_201;pet_93;pet_91; | W97: 4 | X97: 5 | Y97: 1,28000,8,0;1,19016,8,0;1,10007,5,0;1,10108,2,0;1,7,9000,0;1,8,9000,0;1,4,1000,0; | Z97: 0 | AA97: {} | AB97: n/60
A98: 94 | B98: 94 | C98: 94 | D98: 王者试炼 | E98: 10904 | F98: 5 | G98: 3 | H98: 200094 | I98: 0 | J98: 480 | K98: 5000,0; | L98: 5 | M98: 5000,1; | N98: 37680/3600*(nPatrolSec+3)*(1000+nGuanQia)/1000 | O98: 30120/3600*(nPatrolSec+3)*(1000+nGuanQia)/1000 | P98: 19020/3600*(nPatrolSec+3)*(1000+nGuanQia)/1000 | Q98: nGuanQia + 1000 | R98: 37680/60*nMin*(1000+nGuanQia)/1000 | S98: 30120/60*nMin*(1000+nGuanQia)/1000 | T98: 19020/60*nMin*(1000+nGuanQia)/1000 | U98: 喽啰 | V98: pet_21;pet_201;pet_93;pet_91; | W98: 4 | X98: 5 | Y98: 1,28000,8,0;1,19016,8,0;1,10007,5,0;1,10108,2,0;1,7,9000,0;1,8,9000,0;1,4,1000,0; | Z98: 0 | AA98: {} | AB98: n/60
A99: 95 | B99: 95 | C99: 95 | D99: 王者试炼 | E99: 10904 | F99: 5 | G99: 3 | H99: 200095 | I99: 0 | J99: 480 | K99: 5000,0; | L99: 5 | M99: 5000,1; | N99: 37980/3600*(nPatrolSec+3)*(1000+nGuanQia)/1000 | O99: 30420/3600*(nPatrolSec+3)*(1000+nGuanQia)/1000 | P99: 19080/3600*(nPatrolSec+3)*(1000+nGuanQia)/1000 | Q99: nGuanQia + 1000 | R99: 37980/60*nMin*(1000+nGuanQia)/1000 | S99: 30420/60*nMin*(1000+nGuanQia)/1000 | T99: 19080/60*nMin*(1000+nGuanQia)/1000 | U99: 喽啰 | V99: pet_21;pet_201;pet_93;pet_91; | W99: 4 | X99: 5 | Y99: 1,28000,8,0;1,19016,8,0;1,10007,5,0;1,10108,2,0;1,7,9000,0;1,8,9000,0;1,4,1000,0; | Z99: 0 | AA99: {} | AB99: n/60
A100: 96 | B100: 96 | C100: 96 | D100: 王者试炼 | E100: 10904 | F100: 5 | G100: 3 | H100: 200096 | I100: 0 | J100: 480 | K100: 5000,0; | L100: 5 | M100: 5000,1; | N100: 38340/3600*(nPatrolSec+3)*(1000+nGuanQia)/1000 | O100: 30660/3600*(nPatrolSec+3)*(1000+nGuanQia)/1000 | P100: 19140/3600*(nPatrolSec+3)*(1000+nGuanQia)/1000 | Q100: nGuanQia + 1000 | R100: 38340/60*nMin*(1000+nGuanQia)/1000 | S100: 30660/60*nMin*(1000+nGuanQia)/1000 | T100: 19140/60*nMin*(1000+nGuanQia)/1000 | U100: 喽啰 | V100: pet_21;pet_201;pet_93;pet_91; | W100: 4 | X100: 5 | Y100: 1,28000,8,0;1,19016,8,0;1,10007,5,0;1,10108,2,0;1,7,9000,0;1,8,9000,0;1,4,1000,0; | Z100: 0 | AA100: {} | AB100: n/60
A101: 97 | B101: 97 | C101: 97 | D101: 王者试炼 | E101: 10904 | F101: 5 | G101: 3 | H101: 200097 | I101: 0 | J101: 480 | K101: 5000,0; | L101: 5 | M101: 5000,1; | N101: 38640/3600*(nPatrolSec+3)*(1000+nGuanQia)/1000 | O101: 30900/3600*(nPatrolSec+3)*(1000+nGuanQia)/1000 | P101: 19200/3600*(nPatrolSec+3)*(1000+nGuanQia)/1000 | Q101: nGuanQia + 1000 | R101: 38640/60*nMin*(1000+nGuanQia)/1000 | S101: 30900/60*nMin*(1000+nGuanQia)/1000 | T101: 19200/60*nMin*(1000+nGuanQia)/1000 | U101: 喽啰 | V101: pet_21;pet_201;pet_93;pet_91; | W101: 4 | X101: 5 | Y101: 1,28000,8,0;1,19016,8,0;1,10007,5,0;1,10108,2,0;1,7,9000,0;1,8,9000,0;1,4,1000,0; | Z101: 0 | AA101: {} | AB101: n/60
A102: 98 | B102: 98 | C102: 98 | D102: 王者试炼 | E102: 10904 | F102: 5 | G102: 3 | H102: 200098 | I102: 0 | J102: 480 | K102: 5000,0; | L102: 5 | M102: 5000,1; | N102: 38940/3600*(nPatrolSec+3)*(1000+nGuanQia)/1000 | O102: 31140/3600*(nPatrolSec+3)*(1000+nGuanQia)/1000 | P102: 19260/3600*(nPatrolSec+3)*(1000+nGuanQia)/1000 | Q102: nGuanQia + 1000 | R102: 38940/60*nMin*(1000+nGuanQia)/1000 | S102: 31140/60*nMin*(1000+nGuanQia)/1000 | T102: 19260/60*nMin*(1000+nGuanQia)/1000 | U102: 喽啰 | V102: pet_21;pet_201;pet_93;pet_91; | W102: 4 | X102: 5 | Y102: 1,28000,8,0;1,19016,8,0;1,10007,5,0;1,10108,2,0;1,7,9000,0;1,8,9000,0;1,4,1000,0; | Z102: 0 | AA102: {} | AB102: n/60
A103: 99 | B103: 99 | C103: 99 | D103: 王者试炼 | E103: 10904 | F103: 5 | G103: 3 | H103: 200099 | I103: 0 | J103: 480 | K103: 5000,0; | L103: 5 | M103: 5000,1; | N103: 39240/3600*(nPatrolSec+3)*(1000+nGuanQia)/1000 | O103: 31380/3600*(nPatrolSec+3)*(1000+nGuanQia)/1000 | P103: 19320/3600*(nPatrolSec+3)*(1000+nGuanQia)/1000 | Q103: nGuanQia + 1000 | R103: 39240/60*nMin*(1000+nGuanQia)/1000 | S103: 31380/60*nMin*(1000+nGuanQia)/1000 | T103: 19320/60*nMin*(1000+nGuanQia)/1000 | U103: 喽啰 | V103: pet_21;pet_201;pet_93;pet_91; | W103: 4 | X103: 5 | Y103: 1,28000,8,0;1,19016,8,0;1,10007,5,0;1,10108,2,0;1,7,9000,0;1,8,9000,0;1,4,1000,0; | Z103: 0 | AA103: {} | AB103: n/60
A104: 100 | B104: 100 | C104: 100 | D104: 王者试炼 | E104: 10501 | F104: 5 | G104: 3 | H104: 200100 | I104: 0 | J104: 480 | K104: 5000,0; | L104: 5 | M104: 5000,1; | N104: 39240/3600*(nPatrolSec+3)*(1000+nGuanQia)/1000 | O104: 31380/3600*(nPatrolSec+3)*(1000+nGuanQia)/1000 | P104: 19320/3600*(nPatrolSec+3)*(1000+nGuanQia)/1000 | Q104: nGuanQia + 1000 | R104: 39240/60*nMin*(1000+nGuanQia)/1000 | S104: 31380/60*nMin*(1000+nGuanQia)/1000 | T104: 19320/60*nMin*(1000+nGuanQia)/1000 | U104: 喽啰 | V104: pet_21;pet_201;pet_93;pet_91; | W104: 4 | X104: 5 | Y104: 1,28000,8,0;1,19016,8,0;1,10007,5,0;1,10108,2,0;1,7,9000,0;1,8,9000,0;1,4,1000,0; | Z104: 0 | AA104: {} | AB104: n/60
A105: 101 | B105: 101 | C105: 101 | D105: 王者试炼 | E105: 10501 | F105: 5 | G105: 3 | H105: 200101 | I105: 0 | J105: 480 | K105: 5000,0; | L105: 5 | M105: 5000,1; | N105: 39240/3600*(nPatrolSec+3)*(1000+nGuanQia)/1000 | O105: 31380/3600*(nPatrolSec+3)*(1000+nGuanQia)/1000 | P105: 19320/3600*(nPatrolSec+3)*(1000+nGuanQia)/1000 | Q105: nGuanQia + 1000 | R105: 39240/60*nMin*(1000+nGuanQia)/1000 | S105: 31380/60*nMin*(1000+nGuanQia)/1000 | T105: 19320/60*nMin*(1000+nGuanQia)/1000 | U105: 喽啰 | V105: pet_21;pet_201;pet_93;pet_91; | W105: 4 | X105: 5 | Y105: 1,28000,8,0;1,19016,8,0;1,10007,5,0;1,10108,2,0;1,7,9000,0;1,8,9000,0;1,4,1000,0; | Z105: 0 | AA105: {} | AB105: n/60
A106: 102 | B106: 102 | C106: 102 | D106: 王者试炼 | E106: 10501 | F106: 5 | G106: 3 | H106: 200102 | I106: 0 | J106: 480 | K106: 5000,0; | L106: 5 | M106: 5000,1; | N106: 39240/3600*(nPatrolSec+3)*(1000+nGuanQia)/1000 | O106: 31380/3600*(nPatrolSec+3)*(1000+nGuanQia)/1000 | P106: 19320/3600*(nPatrolSec+3)*(1000+nGuanQia)/1000 | Q106: nGuanQia + 1000 | R106: 39240/60*nMin*(1000+nGuanQia)/1000 | S106: 31380/60*nMin*(1000+nGuanQia)/1000 | T106: 19320/60*nMin*(1000+nGuanQia)/1000 | U106: 喽啰 | V106: pet_21;pet_201;pet_93;pet_91; | W106: 4 | X106: 5 | Y106: 1,28000,8,0;1,19016,8,0;1,10007,5,0;1,10108,2,0;1,7,9000,0;1,8,9000,0;1,4,1000,0; | Z106: 0 | AA106: {} | AB106: n/60
A107: 103 | B107: 103 | C107: 103 | D107: 王者试炼 | E107: 10501 | F107: 5 | G107: 3 | H107: 200103 | I107: 0 | J107: 480 | K107: 5000,0; | L107: 5 | M107: 5000,1; | N107: 39240/3600*(nPatrolSec+3)*(1000+nGuanQia)/1000 | O107: 31380/3600*(nPatrolSec+3)*(1000+nGuanQia)/1000 | P107: 19320/3600*(nPatrolSec+3)*(1000+nGuanQia)/1000 | Q107: nGuanQia + 1000 | R107: 39240/60*nMin*(1000+nGuanQia)/1000 | S107: 31380/60*nMin*(1000+nGuanQia)/1000 | T107: 19320/60*nMin*(1000+nGuanQia)/1000 | U107: 喽啰 | V107: pet_21;pet_201;pet_93;pet_91; | W107: 4 | X107: 5 | Y107: 1,28000,8,0;1,19016,8,0;1,10007,5,0;1,10108,2,0;1,7,9000,0;1,8,9000,0;1,4,1000,0; | Z107: 0 | AA107: {} | AB107: n/60
A108: 104 | B108: 104 | C108: 104 | D108: 王者试炼 | E108: 10501 | F108: 5 | G108: 3 | H108: 200104 | I108: 0 | J108: 480 | K108: 5000,0; | L108: 5 | M108: 5000,1; | N108: 39240/3600*(nPatrolSec+3)*(1000+nGuanQia)/1000 | O108: 31380/3600*(nPatrolSec+3)*(1000+nGuanQia)/1000 | P108: 19320/3600*(nPatrolSec+3)*(1000+nGuanQia)/1000 | Q108: nGuanQia + 1000 | R108: 39240/60*nMin*(1000+nGuanQia)/1000 | S108: 31380/60*nMin*(1000+nGuanQia)/1000 | T108: 19320/60*nMin*(1000+nGuanQia)/1000 | U108: 喽啰 | V108: pet_21;pet_201;pet_93;pet_91; | W108: 4 | X108: 5 | Y108: 1,28000,8,0;1,19016,8,0;1,10007,5,0;1,10108,2,0;1,7,9000,0;1,8,9000,0;1,4,1000,0; | Z108: 0 | AA108: {} | AB108: n/60
A109: 105 | B109: 105 | C109: 105 | D109: 王者试炼 | E109: 10501 | F109: 5 | G109: 3 | H109: 200105 | I109: 0 | J109: 480 | K109: 5000,0; | L109: 5 | M109: 5000,1; | N109: 39240/3600*(nPatrolSec+3)*(1000+nGuanQia)/1000 | O109: 31380/3600*(nPatrolSec+3)*(1000+nGuanQia)/1000 | P109: 19320/3600*(nPatrolSec+3)*(1000+nGuanQia)/1000 | Q109: nGuanQia + 1000 | R109: 39240/60*nMin*(1000+nGuanQia)/1000 | S109: 31380/60*nMin*(1000+nGuanQia)/1000 | T109: 19320/60*nMin*(1000+nGuanQia)/1000 | U109: 喽啰 | V109: pet_21;pet_201;pet_93;pet_91; | W109: 4 | X109: 5 | Y109: 1,28000,8,0;1,19016,8,0;1,10007,5,0;1,10108,2,0;1,7,9000,0;1,8,9000,0;1,4,1000,0; | Z109: 0 | AA109: {} | AB109: n/60
A110: 106 | B110: 106 | C110: 106 | D110: 王者试炼 | E110: 10501 | F110: 5 | G110: 3 | H110: 200106 | I110: 0 | J110: 480 | K110: 5000,0; | L110: 5 | M110: 5000,1; | N110: 39240/3600*(nPatrolSec+3)*(1000+nGuanQia)/1000 | O110: 31380/3600*(nPatrolSec+3)*(1000+nGuanQia)/1000 | P110: 19320/3600*(nPatrolSec+3)*(1000+nGuanQia)/1000 | Q110: nGuanQia + 1000 | R110: 39240/60*nMin*(1000+nGuanQia)/1000 | S110: 31380/60*nMin*(1000+nGuanQia)/1000 | T110: 19320/60*nMin*(1000+nGuanQia)/1000 | U110: 喽啰 | V110: pet_21;pet_201;pet_93;pet_91; | W110: 4 | X110: 5 | Y110: 1,28000,8,0;1,19016,8,0;1,10007,5,0;1,10108,2,0;1,7,9000,0;1,8,9000,0;1,4,1000,0; | Z110: 0 | AA110: {} | AB110: n/60
A111: 107 | B111: 107 | C111: 107 | D111: 王者试炼 | E111: 10501 | F111: 5 | G111: 3 | H111: 200107 | I111: 0 | J111: 480 | K111: 5000,0; | L111: 5 | M111: 5000,1; | N111: 39240/3600*(nPatrolSec+3)*(1000+nGuanQia)/1000 | O111: 31380/3600*(nPatrolSec+3)*(1000+nGuanQia)/1000 | P111: 19320/3600*(nPatrolSec+3)*(1000+nGuanQia)/1000 | Q111: nGuanQia + 1000 | R111: 39240/60*nMin*(1000+nGuanQia)/1000 | S111: 31380/60*nMin*(1000+nGuanQia)/1000 | T111: 19320/60*nMin*(1000+nGuanQia)/1000 | U111: 喽啰 | V111: pet_21;pet_201;pet_93;pet_91; | W111: 4 | X111: 5 | Y111: 1,28000,8,0;1,19016,8,0;1,10007,5,0;1,10108,2,0;1,7,9000,0;1,8,9000,0;1,4,1000,0; | Z111: 0 | AA111: {} | AB111: n/60
A112: 108 | B112: 108 | C112: 108 | D112: 王者试炼 | E112: 10501 | F112: 5 | G112: 3 | H112: 200108 | I112: 0 | J112: 480 | K112: 5000,0; | L112: 5 | M112: 5000,1; | N112: 39240/3600*(nPatrolSec+3)*(1000+nGuanQia)/1000 | O112: 31380/3600*(nPatrolSec+3)*(1000+nGuanQia)/1000 | P112: 19320/3600*(nPatrolSec+3)*(1000+nGuanQia)/1000 | Q112: nGuanQia + 1000 | R112: 39240/60*nMin*(1000+nGuanQia)/1000 | S112: 31380/60*nMin*(1000+nGuanQia)/1000 | T112: 19320/60*nMin*(1000+nGuanQia)/1000 | U112: 喽啰 | V112: pet_21;pet_201;pet_93;pet_91; | W112: 4 | X112: 5 | Y112: 1,28000,8,0;1,19016,8,0;1,10007,5,0;1,10108,2,0;1,7,9000,0;1,8,9000,0;1,4,1000,0; | Z112: 0 | AA112: {} | AB112: n/60
A113: 109 | B113: 109 | C113: 109 | D113: 王者试炼 | E113: 10501 | F113: 5 | G113: 3 | H113: 200109 | I113: 0 | J113: 480 | K113: 5000,0; | L113: 5 | M113: 5000,1; | N113: 39240/3600*(nPatrolSec+3)*(1000+nGuanQia)/1000 | O113: 31380/3600*(nPatrolSec+3)*(1000+nGuanQia)/1000 | P113: 19320/3600*(nPatrolSec+3)*(1000+nGuanQia)/1000 | Q113: nGuanQia + 1000 | R113: 39240/60*nMin*(1000+nGuanQia)/1000 | S113: 31380/60*nMin*(1000+nGuanQia)/1000 | T113: 19320/60*nMin*(1000+nGuanQia)/1000 | U113: 喽啰 | V113: pet_21;pet_201;pet_93;pet_91; | W113: 4 | X113: 5 | Y113: 1,28000,8,0;1,19016,8,0;1,10007,5,0;1,10108,2,0;1,7,9000,0;1,8,9000,0;1,4,1000,0; | Z113: 0 | AA113: {} | AB113: n/60
A114: 110 | B114: 110 | C114: 110 | D114: 王者试炼 | E114: 10501 | F114: 5 | G114: 3 | H114: 200110 | I114: 0 | J114: 480 | K114: 5000,0; | L114: 5 | M114: 5000,1; | N114: 39240/3600*(nPatrolSec+3)*(1000+nGuanQia)/1000 | O114: 31380/3600*(nPatrolSec+3)*(1000+nGuanQia)/1000 | P114: 19320/3600*(nPatrolSec+3)*(1000+nGuanQia)/1000 | Q114: nGuanQia + 1000 | R114: 39240/60*nMin*(1000+nGuanQia)/1000 | S114: 31380/60*nMin*(1000+nGuanQia)/1000 | T114: 19320/60*nMin*(1000+nGuanQia)/1000 | U114: 喽啰 | V114: pet_21;pet_201;pet_93;pet_91; | W114: 4 | X114: 5 | Y114: 1,28000,8,0;1,19016,8,0;1,10007,5,0;1,10108,2,0;1,7,9000,0;1,8,9000,0;1,4,1000,0; | Z114: 0 | AA114: {} | AB114: n/60
A115: 111 | B115: 111 | C115: 111 | D115: 王者试炼 | E115: 10501 | F115: 5 | G115: 3 | H115: 200111 | I115: 0 | J115: 480 | K115: 5000,0; | L115: 5 | M115: 5000,1; | N115: 39240/3600*(nPatrolSec+3)*(1000+nGuanQia)/1000 | O115: 31380/3600*(nPatrolSec+3)*(1000+nGuanQia)/1000 | P115: 19320/3600*(nPatrolSec+3)*(1000+nGuanQia)/1000 | Q115: nGuanQia + 1000 | R115: 39240/60*nMin*(1000+nGuanQia)/1000 | S115: 31380/60*nMin*(1000+nGuanQia)/1000 | T115: 19320/60*nMin*(1000+nGuanQia)/1000 | U115: 喽啰 | V115: pet_21;pet_201;pet_93;pet_91; | W115: 4 | X115: 5 | Y115: 1,28000,8,0;1,19016,8,0;1,10007,5,0;1,10108,2,0;1,7,9000,0;1,8,9000,0;1,4,1000,0; | Z115: 0 | AA115: {} | AB115: n/60
A116: 112 | B116: 112 | C116: 112 | D116: 王者试炼 | E116: 10501 | F116: 5 | G116: 3 | H116: 200112 | I116: 0 | J116: 480 | K116: 5000,0; | L116: 5 | M116: 5000,1; | N116: 39240/3600*(nPatrolSec+3)*(1000+nGuanQia)/1000 | O116: 31380/3600*(nPatrolSec+3)*(1000+nGuanQia)/1000 | P116: 19320/3600*(nPatrolSec+3)*(1000+nGuanQia)/1000 | Q116: nGuanQia + 1000 | R116: 39240/60*nMin*(1000+nGuanQia)/1000 | S116: 31380/60*nMin*(1000+nGuanQia)/1000 | T116: 19320/60*nMin*(1000+nGuanQia)/1000 | U116: 喽啰 | V116: pet_21;pet_201;pet_93;pet_91; | W116: 4 | X116: 5 | Y116: 1,28000,8,0;1,19016,8,0;1,10007,5,0;1,10108,2,0;1,7,9000,0;1,8,9000,0;1,4,1000,0; | Z116: 0 | AA116: {} | AB116: n/60
A117: 113 | B117: 113 | C117: 113 | D117: 王者试炼 | E117: 10501 | F117: 5 | G117: 3 | H117: 200113 | I117: 0 | J117: 480 | K117: 5000,0; | L117: 5 | M117: 5000,1; | N117: 39240/3600*(nPatrolSec+3)*(1000+nGuanQia)/1000 | O117: 31380/3600*(nPatrolSec+3)*(1000+nGuanQia)/1000 | P117: 19320/3600*(nPatrolSec+3)*(1000+nGuanQia)/1000 | Q117: nGuanQia + 1000 | R117: 39240/60*nMin*(1000+nGuanQia)/1000 | S117: 31380/60*nMin*(1000+nGuanQia)/1000 | T117: 19320/60*nMin*(1000+nGuanQia)/1000 | U117: 喽啰 | V117: pet_21;pet_201;pet_93;pet_91; | W117: 4 | X117: 5 | Y117: 1,28000,8,0;1,19016,8,0;1,10007,5,0;1,10108,2,0;1,7,9000,0;1,8,9000,0;1,4,1000,0; | Z117: 0 | AA117: {} | AB117: n/60
A118: 114 | B118: 114 | C118: 114 | D118: 王者试炼 | E118: 10501 | F118: 5 | G118: 3 | H118: 200114 | I118: 0 | J118: 480 | K118: 5000,0; | L118: 5 | M118: 5000,1; | N118: 39240/3600*(nPatrolSec+3)*(1000+nGuanQia)/1000 | O118: 31380/3600*(nPatrolSec+3)*(1000+nGuanQia)/1000 | P118: 19320/3600*(nPatrolSec+3)*(1000+nGuanQia)/1000 | Q118: nGuanQia + 1000 | R118: 39240/60*nMin*(1000+nGuanQia)/1000 | S118: 31380/60*nMin*(1000+nGuanQia)/1000 | T118: 19320/60*nMin*(1000+nGuanQia)/1000 | U118: 喽啰 | V118: pet_21;pet_201;pet_93;pet_91; | W118: 4 | X118: 5 | Y118: 1,28000,8,0;1,19016,8,0;1,10007,5,0;1,10108,2,0;1,7,9000,0;1,8,9000,0;1,4,1000,0; | Z118: 0 | AA118: {} | AB118: n/60
A119: 115 | B119: 115 | C119: 115 | D119: 王者试炼 | E119: 10501 | F119: 5 | G119: 3 | H119: 200115 | I119: 0 | J119: 480 | K119: 5000,0; | L119: 5 | M119: 5000,1; | N119: 39240/3600*(nPatrolSec+3)*(1000+nGuanQia)/1000 | O119: 31380/3600*(nPatrolSec+3)*(1000+nGuanQia)/1000 | P119: 19320/3600*(nPatrolSec+3)*(1000+nGuanQia)/1000 | Q119: nGuanQia + 1000 | R119: 39240/60*nMin*(1000+nGuanQia)/1000 | S119: 31380/60*nMin*(1000+nGuanQia)/1000 | T119: 19320/60*nMin*(1000+nGuanQia)/1000 | U119: 喽啰 | V119: pet_21;pet_201;pet_93;pet_91; | W119: 4 | X119: 5 | Y119: 1,28000,8,0;1,19016,8,0;1,10007,5,0;1,10108,2,0;1,7,9000,0;1,8,9000,0;1,4,1000,0; | Z119: 0 | AA119: {} | AB119: n/60
A120: 116 | B120: 116 | C120: 116 | D120: 地狱试炼 | E120: 10502 | F120: 5 | G120: 3 | H120: 200116 | I120: 0 | J120: 480 | K120: 5000,0; | L120: 5 | M120: 5000,1; | N120: 39240/3600*(nPatrolSec+3)*(1000+nGuanQia)/1000 | O120: 31380/3600*(nPatrolSec+3)*(1000+nGuanQia)/1000 | P120: 19320/3600*(nPatrolSec+3)*(1000+nGuanQia)/1000 | Q120: nGuanQia + 1000 | R120: 39240/60*nMin*(1000+nGuanQia)/1000 | S120: 31380/60*nMin*(1000+nGuanQia)/1000 | T120: 19320/60*nMin*(1000+nGuanQia)/1000 | U120: 喽啰 | V120: pet_21;pet_201;pet_93;pet_91; | W120: 4 | X120: 5 | Y120: 1,28000,8,0;1,19016,8,0;1,10007,5,0;1,10108,2,0;1,7,9000,0;1,8,9000,0;1,4,1000,0; | Z120: 0 | AA120: {} | AB120: n/60
A121: 117 | B121: 117 | C121: 117 | D121: 地狱试炼 | E121: 10502 | F121: 5 | G121: 3 | H121: 200117 | I121: 0 | J121: 480 | K121: 5000,0; | L121: 5 | M121: 5000,1; | N121: 39240/3600*(nPatrolSec+3)*(1000+nGuanQia)/1000 | O121: 31380/3600*(nPatrolSec+3)*(1000+nGuanQia)/1000 | P121: 19320/3600*(nPatrolSec+3)*(1000+nGuanQia)/1000 | Q121: nGuanQia + 1000 | R121: 39240/60*nMin*(1000+nGuanQia)/1000 | S121: 31380/60*nMin*(1000+nGuanQia)/1000 | T121: 19320/60*nMin*(1000+nGuanQia)/1000 | U121: 喽啰 | V121: pet_21;pet_201;pet_93;pet_91; | W121: 4 | X121: 5 | Y121: 1,28000,8,0;1,19016,8,0;1,10007,5,0;1,10108,2,0;1,7,9000,0;1,8,9000,0;1,4,1000,0; | Z121: 0 | AA121: {} | AB121: n/60
A122: 118 | B122: 118 | C122: 118 | D122: 地狱试炼 | E122: 10502 | F122: 5 | G122: 3 | H122: 200118 | I122: 0 | J122: 480 | K122: 5000,0; | L122: 5 | M122: 5000,1; | N122: 39240/3600*(nPatrolSec+3)*(1000+nGuanQia)/1000 | O122: 31380/3600*(nPatrolSec+3)*(1000+nGuanQia)/1000 | P122: 19320/3600*(nPatrolSec+3)*(1000+nGuanQia)/1000 | Q122: nGuanQia + 1000 | R122: 39240/60*nMin*(1000+nGuanQia)/1000 | S122: 31380/60*nMin*(1000+nGuanQia)/1000 | T122: 19320/60*nMin*(1000+nGuanQia)/1000 | U122: 喽啰 | V122: pet_21;pet_201;pet_93;pet_91; | W122: 4 | X122: 5 | Y122: 1,28000,8,0;1,19016,8,0;1,10007,5,0;1,10108,2,0;1,7,9000,0;1,8,9000,0;1,4,1000,0; | Z122: 0 | AA122: {} | AB122: n/60
A123: 119 | B123: 119 | C123: 119 | D123: 地狱试炼 | E123: 10502 | F123: 5 | G123: 3 | H123: 200119 | I123: 0 | J123: 480 | K123: 5000,0; | L123: 5 | M123: 5000,1; | N123: 39240/3600*(nPatrolSec+3)*(1000+nGuanQia)/1000 | O123: 31380/3600*(nPatrolSec+3)*(1000+nGuanQia)/1000 | P123: 19320/3600*(nPatrolSec+3)*(1000+nGuanQia)/1000 | Q123: nGuanQia + 1000 | R123: 39240/60*nMin*(1000+nGuanQia)/1000 | S123: 31380/60*nMin*(1000+nGuanQia)/1000 | T123: 19320/60*nMin*(1000+nGuanQia)/1000 | U123: 喽啰 | V123: pet_21;pet_201;pet_93;pet_91; | W123: 4 | X123: 5 | Y123: 1,28000,8,0;1,19016,8,0;1,10007,5,0;1,10108,2,0;1,7,9000,0;1,8,9000,0;1,4,1000,0; | Z123: 0 | AA123: {} | AB123: n/60
A124: 120 | B124: 120 | C124: 120 | D124: 地狱试炼 | E124: 10502 | F124: 5 | G124: 3 | H124: 200120 | I124: 0 | J124: 480 | K124: 5000,0; | L124: 5 | M124: 5000,1; | N124: 39240/3600*(nPatrolSec+3)*(1000+nGuanQia)/1000 | O124: 31380/3600*(nPatrolSec+3)*(1000+nGuanQia)/1000 | P124: 19320/3600*(nPatrolSec+3)*(1000+nGuanQia)/1000 | Q124: nGuanQia + 1000 | R124: 39240/60*nMin*(1000+nGuanQia)/1000 | S124: 31380/60*nMin*(1000+nGuanQia)/1000 | T124: 19320/60*nMin*(1000+nGuanQia)/1000 | U124: 喽啰 | V124: pet_21;pet_201;pet_93;pet_91; | W124: 4 | X124: 5 | Y124: 1,28000,8,0;1,19016,8,0;1,10007,5,0;1,10108,2,0;1,7,9000,0;1,8,9000,0;1,4,1000,0; | Z124: 0 | AA124: {} | AB124: n/60
A125: 121 | B125: 121 | C125: 121 | D125: 地狱试炼 | E125: 10502 | F125: 5 | G125: 3 | H125: 200121 | I125: 0 | J125: 480 | K125: 5000,0; | L125: 5 | M125: 5000,1; | N125: 39240/3600*(nPatrolSec+3)*(1000+nGuanQia)/1000 | O125: 31380/3600*(nPatrolSec+3)*(1000+nGuanQia)/1000 | P125: 19320/3600*(nPatrolSec+3)*(1000+nGuanQia)/1000 | Q125: nGuanQia + 1000 | R125: 39240/60*nMin*(1000+nGuanQia)/1000 | S125: 31380/60*nMin*(1000+nGuanQia)/1000 | T125: 19320/60*nMin*(1000+nGuanQia)/1000 | U125: 喽啰 | V125: pet_21;pet_201;pet_93;pet_91; | W125: 4 | X125: 5 | Y125: 1,28000,8,0;1,19016,8,0;1,10007,5,0;1,10108,2,0;1,7,9000,0;1,8,9000,0;1,4,1000,0; | Z125: 0 | AA125: {} | AB125: n/60
A126: 122 | B126: 122 | C126: 122 | D126: 地狱试炼 | E126: 10502 | F126: 5 | G126: 3 | H126: 200122 | I126: 0 | J126: 480 | K126: 5000,0; | L126: 5 | M126: 5000,1; | N126: 39240/3600*(nPatrolSec+3)*(1000+nGuanQia)/1000 | O126: 31380/3600*(nPatrolSec+3)*(1000+nGuanQia)/1000 | P126: 19320/3600*(nPatrolSec+3)*(1000+nGuanQia)/1000 | Q126: nGuanQia + 1000 | R126: 39240/60*nMin*(1000+nGuanQia)/1000 | S126: 31380/60*nMin*(1000+nGuanQia)/1000 | T126: 19320/60*nMin*(1000+nGuanQia)/1000 | U126: 喽啰 | V126: pet_21;pet_201;pet_93;pet_91; | W126: 4 | X126: 5 | Y126: 1,28000,8,0;1,19016,8,0;1,10007,5,0;1,10108,2,0;1,7,9000,0;1,8,9000,0;1,4,1000,0; | Z126: 0 | AA126: {} | AB126: n/60
A127: 123 | B127: 123 | C127: 123 | D127: 地狱试炼 | E127: 10502 | F127: 5 | G127: 3 | H127: 200123 | I127: 0 | J127: 480 | K127: 5000,0; | L127: 5 | M127: 5000,1; | N127: 39240/3600*(nPatrolSec+3)*(1000+nGuanQia)/1000 | O127: 31380/3600*(nPatrolSec+3)*(1000+nGuanQia)/1000 | P127: 19320/3600*(nPatrolSec+3)*(1000+nGuanQia)/1000 | Q127: nGuanQia + 1000 | R127: 39240/60*nMin*(1000+nGuanQia)/1000 | S127: 31380/60*nMin*(1000+nGuanQia)/1000 | T127: 19320/60*nMin*(1000+nGuanQia)/1000 | U127: 喽啰 | V127: pet_21;pet_201;pet_93;pet_91; | W127: 4 | X127: 5 | Y127: 1,28000,8,0;1,19016,8,0;1,10007,5,0;1,10108,2,0;1,7,9000,0;1,8,9000,0;1,4,1000,0; | Z127: 0 | AA127: {} | AB127: n/60
A128: 124 | B128: 124 | C128: 124 | D128: 地狱试炼 | E128: 10502 | F128: 5 | G128: 3 | H128: 200124 | I128: 0 | J128: 480 | K128: 5000,0; | L128: 5 | M128: 5000,1; | N128: 39240/3600*(nPatrolSec+3)*(1000+nGuanQia)/1000 | O128: 31380/3600*(nPatrolSec+3)*(1000+nGuanQia)/1000 | P128: 19320/3600*(nPatrolSec+3)*(1000+nGuanQia)/1000 | Q128: nGuanQia + 1000 | R128: 39240/60*nMin*(1000+nGuanQia)/1000 | S128: 31380/60*nMin*(1000+nGuanQia)/1000 | T128: 19320/60*nMin*(1000+nGuanQia)/1000 | U128: 喽啰 | V128: pet_21;pet_201;pet_93;pet_91; | W128: 4 | X128: 5 | Y128: 1,28000,8,0;1,19016,8,0;1,10007,5,0;1,10108,2,0;1,7,9000,0;1,8,9000,0;1,4,1000,0; | Z128: 0 | AA128: {} | AB128: n/60
A129: 125 | B129: 125 | C129: 125 | D129: 地狱试炼 | E129: 10502 | F129: 5 | G129: 3 | H129: 200125 | I129: 0 | J129: 480 | K129: 5000,0; | L129: 5 | M129: 5000,1; | N129: 39240/3600*(nPatrolSec+3)*(1000+nGuanQia)/1000 | O129: 31380/3600*(nPatrolSec+3)*(1000+nGuanQia)/1000 | P129: 19320/3600*(nPatrolSec+3)*(1000+nGuanQia)/1000 | Q129: nGuanQia + 1000 | R129: 39240/60*nMin*(1000+nGuanQia)/1000 | S129: 31380/60*nMin*(1000+nGuanQia)/1000 | T129: 19320/60*nMin*(1000+nGuanQia)/1000 | U129: 喽啰 | V129: pet_21;pet_201;pet_93;pet_91; | W129: 4 | X129: 5 | Y129: 1,28000,8,0;1,19016,8,0;1,10007,5,0;1,10108,2,0;1,7,9000,0;1,8,9000,0;1,4,1000,0; | Z129: 0 | AA129: {} | AB129: n/60
A130: 126 | B130: 126 | C130: 126 | D130: 地狱试炼 | E130: 10502 | F130: 5 | G130: 3 | H130: 200126 | I130: 0 | J130: 480 | K130: 5000,0; | L130: 5 | M130: 5000,1; | N130: 39240/3600*(nPatrolSec+3)*(1000+nGuanQia)/1000 | O130: 31380/3600*(nPatrolSec+3)*(1000+nGuanQia)/1000 | P130: 19320/3600*(nPatrolSec+3)*(1000+nGuanQia)/1000 | Q130: nGuanQia + 1000 | R130: 39240/60*nMin*(1000+nGuanQia)/1000 | S130: 31380/60*nMin*(1000+nGuanQia)/1000 | T130: 19320/60*nMin*(1000+nGuanQia)/1000 | U130: 喽啰 | V130: pet_21;pet_201;pet_93;pet_91; | W130: 4 | X130: 5 | Y130: 1,28000,8,0;1,19016,8,0;1,10007,5,0;1,10108,2,0;1,7,9000,0;1,8,9000,0;1,4,1000,0; | Z130: 0 | AA130: {} | AB130: n/60
A131: 127 | B131: 127 | C131: 127 | D131: 地狱试炼 | E131: 10502 | F131: 5 | G131: 3 | H131: 200127 | I131: 0 | J131: 480 | K131: 5000,0; | L131: 5 | M131: 5000,1; | N131: 39240/3600*(nPatrolSec+3)*(1000+nGuanQia)/1000 | O131: 31380/3600*(nPatrolSec+3)*(1000+nGuanQia)/1000 | P131: 19320/3600*(nPatrolSec+3)*(1000+nGuanQia)/1000 | Q131: nGuanQia + 1000 | R131: 39240/60*nMin*(1000+nGuanQia)/1000 | S131: 31380/60*nMin*(1000+nGuanQia)/1000 | T131: 19320/60*nMin*(1000+nGuanQia)/1000 | U131: 喽啰 | V131: pet_21;pet_201;pet_93;pet_91; | W131: 4 | X131: 5 | Y131: 1,28000,8,0;1,19016,8,0;1,10007,5,0;1,10108,2,0;1,7,9000,0;1,8,9000,0;1,4,1000,0; | Z131: 0 | AA131: {} | AB131: n/60
A132: 128 | B132: 128 | C132: 128 | D132: 地狱试炼 | E132: 10502 | F132: 5 | G132: 3 | H132: 200128 | I132: 0 | J132: 480 | K132: 5000,0; | L132: 5 | M132: 5000,1; | N132: 39240/3600*(nPatrolSec+3)*(1000+nGuanQia)/1000 | O132: 31380/3600*(nPatrolSec+3)*(1000+nGuanQia)/1000 | P132: 19320/3600*(nPatrolSec+3)*(1000+nGuanQia)/1000 | Q132: nGuanQia + 1000 | R132: 39240/60*nMin*(1000+nGuanQia)/1000 | S132: 31380/60*nMin*(1000+nGuanQia)/1000 | T132: 19320/60*nMin*(1000+nGuanQia)/1000 | U132: 喽啰 | V132: pet_21;pet_201;pet_93;pet_91; | W132: 4 | X132: 5 | Y132: 1,28000,8,0;1,19016,8,0;1,10007,5,0;1,10108,2,0;1,7,9000,0;1,8,9000,0;1,4,1000,0; | Z132: 0 | AA132: {} | AB132: n/60
A133: 129 | B133: 129 | C133: 129 | D133: 地狱试炼 | E133: 10502 | F133: 5 | G133: 3 | H133: 200129 | I133: 0 | J133: 480 | K133: 5000,0; | L133: 5 | M133: 5000,1; | N133: 39240/3600*(nPatrolSec+3)*(1000+nGuanQia)/1000 | O133: 31380/3600*(nPatrolSec+3)*(1000+nGuanQia)/1000 | P133: 19320/3600*(nPatrolSec+3)*(1000+nGuanQia)/1000 | Q133: nGuanQia + 1000 | R133: 39240/60*nMin*(1000+nGuanQia)/1000 | S133: 31380/60*nMin*(1000+nGuanQia)/1000 | T133: 19320/60*nMin*(1000+nGuanQia)/1000 | U133: 喽啰 | V133: pet_21;pet_201;pet_93;pet_91; | W133: 4 | X133: 5 | Y133: 1,28000,8,0;1,19016,8,0;1,10007,5,0;1,10108,2,0;1,7,9000,0;1,8,9000,0;1,4,1000,0; | Z133: 0 | AA133: {} | AB133: n/60
A134: 130 | B134: 130 | C134: 130 | D134: 地狱试炼 | E134: 10503 | F134: 5 | G134: 3 | H134: 200130 | I134: 0 | J134: 480 | K134: 5000,0; | L134: 5 | M134: 5000,1; | N134: 39240/3600*(nPatrolSec+3)*(1000+nGuanQia)/1000 | O134: 31380/3600*(nPatrolSec+3)*(1000+nGuanQia)/1000 | P134: 19320/3600*(nPatrolSec+3)*(1000+nGuanQia)/1000 | Q134: nGuanQia + 1000 | R134: 39240/60*nMin*(1000+nGuanQia)/1000 | S134: 31380/60*nMin*(1000+nGuanQia)/1000 | T134: 19320/60*nMin*(1000+nGuanQia)/1000 | U134: 喽啰 | V134: pet_21;pet_201;pet_93;pet_91; | W134: 4 | X134: 5 | Y134: 1,28000,8,0;1,19016,8,0;1,10007,5,0;1,10108,2,0;1,7,9000,0;1,8,9000,0;1,4,1000,0; | Z134: 0 | AA134: {} | AB134: n/60
A135: 131 | B135: 131 | C135: 131 | D135: 地狱试炼 | E135: 10503 | F135: 5 | G135: 3 | H135: 200131 | I135: 0 | J135: 480 | K135: 5000,0; | L135: 5 | M135: 5000,1; | N135: 39240/3600*(nPatrolSec+3)*(1000+nGuanQia)/1000 | O135: 31380/3600*(nPatrolSec+3)*(1000+nGuanQia)/1000 | P135: 19320/3600*(nPatrolSec+3)*(1000+nGuanQia)/1000 | Q135: nGuanQia + 1000 | R135: 39240/60*nMin*(1000+nGuanQia)/1000 | S135: 31380/60*nMin*(1000+nGuanQia)/1000 | T135: 19320/60*nMin*(1000+nGuanQia)/1000 | U135: 喽啰 | V135: pet_21;pet_201;pet_93;pet_91; | W135: 4 | X135: 5 | Y135: 1,28000,8,0;1,19016,8,0;1,10007,5,0;1,10108,2,0;1,7,9000,0;1,8,9000,0;1,4,1000,0; | Z135: 0 | AA135: {} | AB135: n/60
A136: 132 | B136: 132 | C136: 132 | D136: 地狱试炼 | E136: 10503 | F136: 5 | G136: 3 | H136: 200132 | I136: 0 | J136: 480 | K136: 5000,0; | L136: 5 | M136: 5000,1; | N136: 39240/3600*(nPatrolSec+3)*(1000+nGuanQia)/1000 | O136: 31380/3600*(nPatrolSec+3)*(1000+nGuanQia)/1000 | P136: 19320/3600*(nPatrolSec+3)*(1000+nGuanQia)/1000 | Q136: nGuanQia + 1000 | R136: 39240/60*nMin*(1000+nGuanQia)/1000 | S136: 31380/60*nMin*(1000+nGuanQia)/1000 | T136: 19320/60*nMin*(1000+nGuanQia)/1000 | U136: 喽啰 | V136: pet_21;pet_201;pet_93;pet_91; | W136: 4 | X136: 5 | Y136: 1,28000,8,0;1,19016,8,0;1,10007,5,0;1,10108,2,0;1,7,9000,0;1,8,9000,0;1,4,1000,0; | Z136: 0 | AA136: {} | AB136: n/60
A137: 133 | B137: 133 | C137: 133 | D137: 地狱试炼 | E137: 10503 | F137: 5 | G137: 3 | H137: 200133 | I137: 0 | J137: 480 | K137: 5000,0; | L137: 5 | M137: 5000,1; | N137: 39240/3600*(nPatrolSec+3)*(1000+nGuanQia)/1000 | O137: 31380/3600*(nPatrolSec+3)*(1000+nGuanQia)/1000 | P137: 19320/3600*(nPatrolSec+3)*(1000+nGuanQia)/1000 | Q137: nGuanQia + 1000 | R137: 39240/60*nMin*(1000+nGuanQia)/1000 | S137: 31380/60*nMin*(1000+nGuanQia)/1000 | T137: 19320/60*nMin*(1000+nGuanQia)/1000 | U137: 喽啰 | V137: pet_21;pet_201;pet_93;pet_91; | W137: 4 | X137: 5 | Y137: 1,28000,8,0;1,19016,8,0;1,10007,5,0;1,10108,2,0;1,7,9000,0;1,8,9000,0;1,4,1000,0; | Z137: 0 | AA137: {} | AB137: n/60
A138: 134 | B138: 134 | C138: 134 | D138: 地狱试炼 | E138: 10503 | F138: 5 | G138: 3 | H138: 200134 | I138: 0 | J138: 480 | K138: 5000,0; | L138: 5 | M138: 5000,1; | N138: 39240/3600*(nPatrolSec+3)*(1000+nGuanQia)/1000 | O138: 31380/3600*(nPatrolSec+3)*(1000+nGuanQia)/1000 | P138: 19320/3600*(nPatrolSec+3)*(1000+nGuanQia)/1000 | Q138: nGuanQia + 1000 | R138: 39240/60*nMin*(1000+nGuanQia)/1000 | S138: 31380/60*nMin*(1000+nGuanQia)/1000 | T138: 19320/60*nMin*(1000+nGuanQia)/1000 | U138: 喽啰 | V138: pet_21;pet_201;pet_93;pet_91; | W138: 4 | X138: 5 | Y138: 1,28000,8,0;1,19016,8,0;1,10007,5,0;1,10108,2,0;1,7,9000,0;1,8,9000,0;1,4,1000,0; | Z138: 0 | AA138: {} | AB138: n/60
A139: 135 | B139: 135 | C139: 135 | D139: 地狱试炼 | E139: 10503 | F139: 5 | G139: 3 | H139: 200135 | I139: 0 | J139: 480 | K139: 5000,0; | L139: 5 | M139: 5000,1; | N139: 39240/3600*(nPatrolSec+3)*(1000+nGuanQia)/1000 | O139: 31380/3600*(nPatrolSec+3)*(1000+nGuanQia)/1000 | P139: 19320/3600*(nPatrolSec+3)*(1000+nGuanQia)/1000 | Q139: nGuanQia + 1000 | R139: 39240/60*nMin*(1000+nGuanQia)/1000 | S139: 31380/60*nMin*(1000+nGuanQia)/1000 | T139: 19320/60*nMin*(1000+nGuanQia)/1000 | U139: 喽啰 | V139: pet_21;pet_201;pet_93;pet_91; | W139: 4 | X139: 5 | Y139: 1,28000,8,0;1,19016,8,0;1,10007,5,0;1,10108,2,0;1,7,9000,0;1,8,9000,0;1,4,1000,0; | Z139: 0 | AA139: {} | AB139: n/60
A140: 136 | B140: 136 | C140: 136 | D140: 地狱试炼 | E140: 10503 | F140: 5 | G140: 3 | H140: 200136 | I140: 0 | J140: 480 | K140: 5000,0; | L140: 5 | M140: 5000,1; | N140: 39240/3600*(nPatrolSec+3)*(1000+nGuanQia)/1000 | O140: 31380/3600*(nPatrolSec+3)*(1000+nGuanQia)/1000 | P140: 19320/3600*(nPatrolSec+3)*(1000+nGuanQia)/1000 | Q140: nGuanQia + 1000 | R140: 39240/60*nMin*(1000+nGuanQia)/1000 | S140: 31380/60*nMin*(1000+nGuanQia)/1000 | T140: 19320/60*nMin*(1000+nGuanQia)/1000 | U140: 喽啰 | V140: pet_21;pet_201;pet_93;pet_91; | W140: 4 | X140: 5 | Y140: 1,28000,8,0;1,19016,8,0;1,10007,5,0;1,10108,2,0;1,7,9000,0;1,8,9000,0;1,4,1000,0; | Z140: 0 | AA140: {} | AB140: n/60
A141: 137 | B141: 137 | C141: 137 | D141: 地狱试炼 | E141: 10503 | F141: 5 | G141: 3 | H141: 200137 | I141: 0 | J141: 480 | K141: 5000,0; | L141: 5 | M141: 5000,1; | N141: 39240/3600*(nPatrolSec+3)*(1000+nGuanQia)/1000 | O141: 31380/3600*(nPatrolSec+3)*(1000+nGuanQia)/1000 | P141: 19320/3600*(nPatrolSec+3)*(1000+nGuanQia)/1000 | Q141: nGuanQia + 1000 | R141: 39240/60*nMin*(1000+nGuanQia)/1000 | S141: 31380/60*nMin*(1000+nGuanQia)/1000 | T141: 19320/60*nMin*(1000+nGuanQia)/1000 | U141: 喽啰 | V141: pet_21;pet_201;pet_93;pet_91; | W141: 4 | X141: 5 | Y141: 1,28000,8,0;1,19016,8,0;1,10007,5,0;1,10108,2,0;1,7,9000,0;1,8,9000,0;1,4,1000,0; | Z141: 0 | AA141: {} | AB141: n/60
A142: 138 | B142: 138 | C142: 138 | D142: 地狱试炼 | E142: 10503 | F142: 5 | G142: 3 | H142: 200138 | I142: 0 | J142: 480 | K142: 5000,0; | L142: 5 | M142: 5000,1; | N142: 39240/3600*(nPatrolSec+3)*(1000+nGuanQia)/1000 | O142: 31380/3600*(nPatrolSec+3)*(1000+nGuanQia)/1000 | P142: 19320/3600*(nPatrolSec+3)*(1000+nGuanQia)/1000 | Q142: nGuanQia + 1000 | R142: 39240/60*nMin*(1000+nGuanQia)/1000 | S142: 31380/60*nMin*(1000+nGuanQia)/1000 | T142: 19320/60*nMin*(1000+nGuanQia)/1000 | U142: 喽啰 | V142: pet_21;pet_201;pet_93;pet_91; | W142: 4 | X142: 5 | Y142: 1,28000,8,0;1,19016,8,0;1,10007,5,0;1,10108,2,0;1,7,9000,0;1,8,9000,0;1,4,1000,0; | Z142: 0 | AA142: {} | AB142: n/60
A143: 139 | B143: 139 | C143: 139 | D143: 地狱试炼 | E143: 10503 | F143: 5 | G143: 3 | H143: 200139 | I143: 0 | J143: 480 | K143: 5000,0; | L143: 5 | M143: 5000,1; | N143: 39240/3600*(nPatrolSec+3)*(1000+nGuanQia)/1000 | O143: 31380/3600*(nPatrolSec+3)*(1000+nGuanQia)/1000 | P143: 19320/3600*(nPatrolSec+3)*(1000+nGuanQia)/1000 | Q143: nGuanQia + 1000 | R143: 39240/60*nMin*(1000+nGuanQia)/1000 | S143: 31380/60*nMin*(1000+nGuanQia)/1000 | T143: 19320/60*nMin*(1000+nGuanQia)/1000 | U143: 喽啰 | V143: pet_21;pet_201;pet_93;pet_91; | W143: 4 | X143: 5 | Y143: 1,28000,8,0;1,19016,8,0;1,10007,5,0;1,10108,2,0;1,7,9000,0;1,8,9000,0;1,4,1000,0; | Z143: 0 | AA143: {} | AB143: n/60
A144: 140 | B144: 140 | C144: 140 | D144: 地狱试炼 | E144: 10503 | F144: 5 | G144: 3 | H144: 200140 | I144: 0 | J144: 480 | K144: 5000,0; | L144: 5 | M144: 5000,1; | N144: 39240/3600*(nPatrolSec+3)*(1000+nGuanQia)/1000 | O144: 31380/3600*(nPatrolSec+3)*(1000+nGuanQia)/1000 | P144: 19320/3600*(nPatrolSec+3)*(1000+nGuanQia)/1000 | Q144: nGuanQia + 1000 | R144: 39240/60*nMin*(1000+nGuanQia)/1000 | S144: 31380/60*nMin*(1000+nGuanQia)/1000 | T144: 19320/60*nMin*(1000+nGuanQia)/1000 | U144: 喽啰 | V144: pet_21;pet_201;pet_93;pet_91; | W144: 4 | X144: 5 | Y144: 1,28000,8,0;1,19016,8,0;1,10007,5,0;1,10108,2,0;1,7,9000,0;1,8,9000,0;1,4,1000,0; | Z144: 0 | AA144: {} | AB144: n/60
A145: 141 | B145: 141 | C145: 141 | D145: 地狱试炼 | E145: 10503 | F145: 5 | G145: 3 | H145: 200141 | I145: 0 | J145: 480 | K145: 5000,0; | L145: 5 | M145: 5000,1; | N145: 39240/3600*(nPatrolSec+3)*(1000+nGuanQia)/1000 | O145: 31380/3600*(nPatrolSec+3)*(1000+nGuanQia)/1000 | P145: 19320/3600*(nPatrolSec+3)*(1000+nGuanQia)/1000 | Q145: nGuanQia + 1000 | R145: 39240/60*nMin*(1000+nGuanQia)/1000 | S145: 31380/60*nMin*(1000+nGuanQia)/1000 | T145: 19320/60*nMin*(1000+nGuanQia)/1000 | U145: 喽啰 | V145: pet_21;pet_201;pet_93;pet_91; | W145: 4 | X145: 5 | Y145: 1,28000,8,0;1,19016,8,0;1,10007,5,0;1,10108,2,0;1,7,9000,0;1,8,9000,0;1,4,1000,0; | Z145: 0 | AA145: {} | AB145: n/60
A146: 142 | B146: 142 | C146: 142 | D146: 地狱试炼 | E146: 10503 | F146: 5 | G146: 3 | H146: 200142 | I146: 0 | J146: 480 | K146: 5000,0; | L146: 5 | M146: 5000,1; | N146: 39240/3600*(nPatrolSec+3)*(1000+nGuanQia)/1000 | O146: 31380/3600*(nPatrolSec+3)*(1000+nGuanQia)/1000 | P146: 19320/3600*(nPatrolSec+3)*(1000+nGuanQia)/1000 | Q146: nGuanQia + 1000 | R146: 39240/60*nMin*(1000+nGuanQia)/1000 | S146: 31380/60*nMin*(1000+nGuanQia)/1000 | T146: 19320/60*nMin*(1000+nGuanQia)/1000 | U146: 喽啰 | V146: pet_21;pet_201;pet_93;pet_91; | W146: 4 | X146: 5 | Y146: 1,28000,8,0;1,19016,8,0;1,10007,5,0;1,10108,2,0;1,7,9000,0;1,8,9000,0;1,4,1000,0; | Z146: 0 | AA146: {} | AB146: n/60
A147: 143 | B147: 143 | C147: 143 | D147: 地狱试炼 | E147: 10503 | F147: 5 | G147: 3 | H147: 200143 | I147: 0 | J147: 480 | K147: 5000,0; | L147: 5 | M147: 5000,1; | N147: 39240/3600*(nPatrolSec+3)*(1000+nGuanQia)/1000 | O147: 31380/3600*(nPatrolSec+3)*(1000+nGuanQia)/1000 | P147: 19320/3600*(nPatrolSec+3)*(1000+nGuanQia)/1000 | Q147: nGuanQia + 1000 | R147: 39240/60*nMin*(1000+nGuanQia)/1000 | S147: 31380/60*nMin*(1000+nGuanQia)/1000 | T147: 19320/60*nMin*(1000+nGuanQia)/1000 | U147: 喽啰 | V147: pet_21;pet_201;pet_93;pet_91; | W147: 4 | X147: 5 | Y147: 1,28000,8,0;1,19016,8,0;1,10007,5,0;1,10108,2,0;1,7,9000,0;1,8,9000,0;1,4,1000,0; | Z147: 0 | AA147: {} | AB147: n/60
A148: 144 | B148: 144 | C148: 144 | D148: 地狱试炼 | E148: 10503 | F148: 5 | G148: 3 | H148: 200144 | I148: 0 | J148: 480 | K148: 5000,0; | L148: 5 | M148: 5000,1; | N148: 39240/3600*(nPatrolSec+3)*(1000+nGuanQia)/1000 | O148: 31380/3600*(nPatrolSec+3)*(1000+nGuanQia)/1000 | P148: 19320/3600*(nPatrolSec+3)*(1000+nGuanQia)/1000 | Q148: nGuanQia + 1000 | R148: 39240/60*nMin*(1000+nGuanQia)/1000 | S148: 31380/60*nMin*(1000+nGuanQia)/1000 | T148: 19320/60*nMin*(1000+nGuanQia)/1000 | U148: 喽啰 | V148: pet_21;pet_201;pet_93;pet_91; | W148: 4 | X148: 5 | Y148: 1,28000,8,0;1,19016,8,0;1,10007,5,0;1,10108,2,0;1,7,9000,0;1,8,9000,0;1,4,1000,0; | Z148: 0 | AA148: {} | AB148: n/60
A149: 145 | B149: 145 | C149: 145 | D149: 地狱试炼 | E149: 10504 | F149: 5 | G149: 3 | H149: 200145 | I149: 0 | J149: 480 | K149: 5000,0; | L149: 5 | M149: 5000,1; | N149: 39240/3600*(nPatrolSec+3)*(1000+nGuanQia)/1000 | O149: 31380/3600*(nPatrolSec+3)*(1000+nGuanQia)/1000 | P149: 19320/3600*(nPatrolSec+3)*(1000+nGuanQia)/1000 | Q149: nGuanQia + 1000 | R149: 39240/60*nMin*(1000+nGuanQia)/1000 | S149: 31380/60*nMin*(1000+nGuanQia)/1000 | T149: 19320/60*nMin*(1000+nGuanQia)/1000 | U149: 喽啰 | V149: pet_21;pet_201;pet_93;pet_91; | W149: 4 | X149: 5 | Y149: 1,28000,8,0;1,19016,8,0;1,10007,5,0;1,10108,2,0;1,7,9000,0;1,8,9000,0;1,4,1000,0; | Z149: 0 | AA149: {} | AB149: n/60
A150: 146 | B150: 146 | C150: 146 | D150: 地狱试炼 | E150: 10504 | F150: 5 | G150: 3 | H150: 200146 | I150: 0 | J150: 480 | K150: 5000,0; | L150: 5 | M150: 5000,1; | N150: 39240/3600*(nPatrolSec+3)*(1000+nGuanQia)/1000 | O150: 31380/3600*(nPatrolSec+3)*(1000+nGuanQia)/1000 | P150: 19320/3600*(nPatrolSec+3)*(1000+nGuanQia)/1000 | Q150: nGuanQia + 1000 | R150: 39240/60*nMin*(1000+nGuanQia)/1000 | S150: 31380/60*nMin*(1000+nGuanQia)/1000 | T150: 19320/60*nMin*(1000+nGuanQia)/1000 | U150: 喽啰 | V150: pet_21;pet_201;pet_93;pet_91; | W150: 4 | X150: 5 | Y150: 1,28000,8,0;1,19016,8,0;1,10007,5,0;1,10108,2,0;1,7,9000,0;1,8,9000,0;1,4,1000,0; | Z150: 0 | AA150: {} | AB150: n/60
A151: 147 | B151: 147 | C151: 147 | D151: 地狱试炼 | E151: 10504 | F151: 5 | G151: 3 | H151: 200147 | I151: 0 | J151: 480 | K151: 5000,0; | L151: 5 | M151: 5000,1; | N151: 39240/3600*(nPatrolSec+3)*(1000+nGuanQia)/1000 | O151: 31380/3600*(nPatrolSec+3)*(1000+nGuanQia)/1000 | P151: 19320/3600*(nPatrolSec+3)*(1000+nGuanQia)/1000 | Q151: nGuanQia + 1000 | R151: 39240/60*nMin*(1000+nGuanQia)/1000 | S151: 31380/60*nMin*(1000+nGuanQia)/1000 | T151: 19320/60*nMin*(1000+nGuanQia)/1000 | U151: 喽啰 | V151: pet_21;pet_201;pet_93;pet_91; | W151: 4 | X151: 5 | Y151: 1,28000,8,0;1,19016,8,0;1,10007,5,0;1,10108,2,0;1,7,9000,0;1,8,9000,0;1,4,1000,0; | Z151: 0 | AA151: {} | AB151: n/60
A152: 148 | B152: 148 | C152: 148 | D152: 地狱试炼 | E152: 10504 | F152: 5 | G152: 3 | H152: 200148 | I152: 0 | J152: 480 | K152: 5000,0; | L152: 5 | M152: 5000,1; | N152: 39240/3600*(nPatrolSec+3)*(1000+nGuanQia)/1000 | O152: 31380/3600*(nPatrolSec+3)*(1000+nGuanQia)/1000 | P152: 19320/3600*(nPatrolSec+3)*(1000+nGuanQia)/1000 | Q152: nGuanQia + 1000 | R152: 39240/60*nMin*(1000+nGuanQia)/1000 | S152: 31380/60*nMin*(1000+nGuanQia)/1000 | T152: 19320/60*nMin*(1000+nGuanQia)/1000 | U152: 喽啰 | V152: pet_21;pet_201;pet_93;pet_91; | W152: 4 | X152: 5 | Y152: 1,28000,8,0;1,19016,8,0;1,10007,5,0;1,10108,2,0;1,7,9000,0;1,8,9000,0;1,4,1000,0; | Z152: 0 | AA152: {} | AB152: n/60
A153: 149 | B153: 149 | C153: 149 | D153: 地狱试炼 | E153: 10504 | F153: 5 | G153: 3 | H153: 200149 | I153: 0 | J153: 480 | K153: 5000,0; | L153: 5 | M153: 5000,1; | N153: 39240/3600*(nPatrolSec+3)*(1000+nGuanQia)/1000 | O153: 31380/3600*(nPatrolSec+3)*(1000+nGuanQia)/1000 | P153: 19320/3600*(nPatrolSec+3)*(1000+nGuanQia)/1000 | Q153: nGuanQia + 1000 | R153: 39240/60*nMin*(1000+nGuanQia)/1000 | S153: 31380/60*nMin*(1000+nGuanQia)/1000 | T153: 19320/60*nMin*(1000+nGuanQia)/1000 | U153: 喽啰 | V153: pet_21;pet_201;pet_93;pet_91; | W153: 4 | X153: 5 | Y153: 1,28000,8,0;1,19016,8,0;1,10007,5,0;1,10108,2,0;1,7,9000,0;1,8,9000,0;1,4,1000,0; | Z153: 0 | AA153: {} | AB153: n/60
A154: 150 | B154: 150 | C154: 150 | D154: 地狱试炼 | E154: 10504 | F154: 5 | G154: 3 | H154: 200150 | I154: 0 | J154: 480 | K154: 5000,0; | L154: 5 | M154: 5000,1; | N154: 39240/3600*(nPatrolSec+3)*(1000+nGuanQia)/1000 | O154: 31380/3600*(nPatrolSec+3)*(1000+nGuanQia)/1000 | P154: 19320/3600*(nPatrolSec+3)*(1000+nGuanQia)/1000 | Q154: nGuanQia + 1000 | R154: 39240/60*nMin*(1000+nGuanQia)/1000 | S154: 31380/60*nMin*(1000+nGuanQia)/1000 | T154: 19320/60*nMin*(1000+nGuanQia)/1000 | U154: 喽啰 | V154: pet_21;pet_201;pet_93;pet_91; | W154: 4 | X154: 5 | Y154: 1,28000,8,0;1,19016,8,0;1,10007,5,0;1,10108,2,0;1,7,9000,0;1,8,9000,0;1,4,1000,0; | Z154: 0 | AA154: {} | AB154: n/60
A155: 151 | B155: 151 | C155: 151 | D155: 地狱试炼 | E155: 10504 | F155: 5 | G155: 3 | H155: 200151 | I155: 0 | J155: 480 | K155: 5000,0; | L155: 5 | M155: 5000,1; | N155: 39240/3600*(nPatrolSec+3)*(1000+nGuanQia)/1000 | O155: 31380/3600*(nPatrolSec+3)*(1000+nGuanQia)/1000 | P155: 19320/3600*(nPatrolSec+3)*(1000+nGuanQia)/1000 | Q155: nGuanQia + 1000 | R155: 39240/60*nMin*(1000+nGuanQia)/1000 | S155: 31380/60*nMin*(1000+nGuanQia)/1000 | T155: 19320/60*nMin*(1000+nGuanQia)/1000 | U155: 喽啰 | V155: pet_21;pet_201;pet_93;pet_91; | W155: 4 | X155: 5 | Y155: 1,28000,8,0;1,19016,8,0;1,10007,5,0;1,10108,2,0;1,7,9000,0;1,8,9000,0;1,4,1000,0; | Z155: 0 | AA155: {} | AB155: n/60
A156: 152 | B156: 152 | C156: 152 | D156: 地狱试炼 | E156: 10504 | F156: 5 | G156: 3 | H156: 200152 | I156: 0 | J156: 480 | K156: 5000,0; | L156: 5 | M156: 5000,1; | N156: 39240/3600*(nPatrolSec+3)*(1000+nGuanQia)/1000 | O156: 31380/3600*(nPatrolSec+3)*(1000+nGuanQia)/1000 | P156: 19320/3600*(nPatrolSec+3)*(1000+nGuanQia)/1000 | Q156: nGuanQia + 1000 | R156: 39240/60*nMin*(1000+nGuanQia)/1000 | S156: 31380/60*nMin*(1000+nGuanQia)/1000 | T156: 19320/60*nMin*(1000+nGuanQia)/1000 | U156: 喽啰 | V156: pet_21;pet_201;pet_93;pet_91; | W156: 4 | X156: 5 | Y156: 1,28000,8,0;1,19016,8,0;1,10007,5,0;1,10108,2,0;1,7,9000,0;1,8,9000,0;1,4,1000,0; | Z156: 0 | AA156: {} | AB156: n/60
A157: 153 | B157: 153 | C157: 153 | D157: 地狱试炼 | E157: 10504 | F157: 5 | G157: 3 | H157: 200153 | I157: 0 | J157: 480 | K157: 5000,0; | L157: 5 | M157: 5000,1; | N157: 39240/3600*(nPatrolSec+3)*(1000+nGuanQia)/1000 | O157: 31380/3600*(nPatrolSec+3)*(1000+nGuanQia)/1000 | P157: 19320/3600*(nPatrolSec+3)*(1000+nGuanQia)/1000 | Q157: nGuanQia + 1000 | R157: 39240/60*nMin*(1000+nGuanQia)/1000 | S157: 31380/60*nMin*(1000+nGuanQia)/1000 | T157: 19320/60*nMin*(1000+nGuanQia)/1000 | U157: 喽啰 | V157: pet_21;pet_201;pet_93;pet_91; | W157: 4 | X157: 5 | Y157: 1,28000,8,0;1,19016,8,0;1,10007,5,0;1,10108,2,0;1,7,9000,0;1,8,9000,0;1,4,1000,0; | Z157: 0 | AA157: {} | AB157: n/60
A158: 154 | B158: 154 | C158: 154 | D158: 地狱试炼 | E158: 10504 | F158: 5 | G158: 3 | H158: 200154 | I158: 0 | J158: 480 | K158: 5000,0; | L158: 5 | M158: 5000,1; | N158: 39240/3600*(nPatrolSec+3)*(1000+nGuanQia)/1000 | O158: 31380/3600*(nPatrolSec+3)*(1000+nGuanQia)/1000 | P158: 19320/3600*(nPatrolSec+3)*(1000+nGuanQia)/1000 | Q158: nGuanQia + 1000 | R158: 39240/60*nMin*(1000+nGuanQia)/1000 | S158: 31380/60*nMin*(1000+nGuanQia)/1000 | T158: 19320/60*nMin*(1000+nGuanQia)/1000 | U158: 喽啰 | V158: pet_21;pet_201;pet_93;pet_91; | W158: 4 | X158: 5 | Y158: 1,28000,8,0;1,19016,8,0;1,10007,5,0;1,10108,2,0;1,7,9000,0;1,8,9000,0;1,4,1000,0; | Z158: 0 | AA158: {} | AB158: n/60
A159: 155 | B159: 155 | C159: 155 | D159: 地狱试炼 | E159: 10504 | F159: 5 | G159: 3 | H159: 200155 | I159: 0 | J159: 480 | K159: 5000,0; | L159: 5 | M159: 5000,1; | N159: 39240/3600*(nPatrolSec+3)*(1000+nGuanQia)/1000 | O159: 31380/3600*(nPatrolSec+3)*(1000+nGuanQia)/1000 | P159: 19320/3600*(nPatrolSec+3)*(1000+nGuanQia)/1000 | Q159: nGuanQia + 1000 | R159: 39240/60*nMin*(1000+nGuanQia)/1000 | S159: 31380/60*nMin*(1000+nGuanQia)/1000 | T159: 19320/60*nMin*(1000+nGuanQia)/1000 | U159: 喽啰 | V159: pet_21;pet_201;pet_93;pet_91; | W159: 4 | X159: 5 | Y159: 1,28000,8,0;1,19016,8,0;1,10007,5,0;1,10108,2,0;1,7,9000,0;1,8,9000,0;1,4,1000,0; | Z159: 0 | AA159: {} | AB159: n/60
A160: 156 | B160: 156 | C160: 156 | D160: 地狱试炼 | E160: 10504 | F160: 5 | G160: 3 | H160: 200156 | I160: 0 | J160: 480 | K160: 5000,0; | L160: 5 | M160: 5000,1; | N160: 39240/3600*(nPatrolSec+3)*(1000+nGuanQia)/1000 | O160: 31380/3600*(nPatrolSec+3)*(1000+nGuanQia)/1000 | P160: 19320/3600*(nPatrolSec+3)*(1000+nGuanQia)/1000 | Q160: nGuanQia + 1000 | R160: 39240/60*nMin*(1000+nGuanQia)/1000 | S160: 31380/60*nMin*(1000+nGuanQia)/1000 | T160: 19320/60*nMin*(1000+nGuanQia)/1000 | U160: 喽啰 | V160: pet_21;pet_201;pet_93;pet_91; | W160: 4 | X160: 5 | Y160: 1,28000,8,0;1,19016,8,0;1,10007,5,0;1,10108,2,0;1,7,9000,0;1,8,9000,0;1,4,1000,0; | Z160: 0 | AA160: {} | AB160: n/60
A161: 157 | B161: 157 | C161: 157 | D161: 地狱试炼 | E161: 10504 | F161: 5 | G161: 3 | H161: 200157 | I161: 0 | J161: 480 | K161: 5000,0; | L161: 5 | M161: 5000,1; | N161: 39240/3600*(nPatrolSec+3)*(1000+nGuanQia)/1000 | O161: 31380/3600*(nPatrolSec+3)*(1000+nGuanQia)/1000 | P161: 19320/3600*(nPatrolSec+3)*(1000+nGuanQia)/1000 | Q161: nGuanQia + 1000 | R161: 39240/60*nMin*(1000+nGuanQia)/1000 | S161: 31380/60*nMin*(1000+nGuanQia)/1000 | T161: 19320/60*nMin*(1000+nGuanQia)/1000 | U161: 喽啰 | V161: pet_21;pet_201;pet_93;pet_91; | W161: 4 | X161: 5 | Y161: 1,28000,8,0;1,19016,8,0;1,10007,5,0;1,10108,2,0;1,7,9000,0;1,8,9000,0;1,4,1000,0; | Z161: 0 | AA161: {} | AB161: n/60
A162: 158 | B162: 158 | C162: 158 | D162: 地狱试炼 | E162: 10504 | F162: 5 | G162: 3 | H162: 200158 | I162: 0 | J162: 480 | K162: 5000,0; | L162: 5 | M162: 5000,1; | N162: 39240/3600*(nPatrolSec+3)*(1000+nGuanQia)/1000 | O162: 31380/3600*(nPatrolSec+3)*(1000+nGuanQia)/1000 | P162: 19320/3600*(nPatrolSec+3)*(1000+nGuanQia)/1000 | Q162: nGuanQia + 1000 | R162: 39240/60*nMin*(1000+nGuanQia)/1000 | S162: 31380/60*nMin*(1000+nGuanQia)/1000 | T162: 19320/60*nMin*(1000+nGuanQia)/1000 | U162: 喽啰 | V162: pet_21;pet_201;pet_93;pet_91; | W162: 4 | X162: 5 | Y162: 1,28000,8,0;1,19016,8,0;1,10007,5,0;1,10108,2,0;1,7,9000,0;1,8,9000,0;1,4,1000,0; | Z162: 0 | AA162: {} | AB162: n/60
A163: 159 | B163: 159 | C163: 159 | D163: 地狱试炼 | E163: 10504 | F163: 5 | G163: 3 | H163: 200159 | I163: 0 | J163: 480 | K163: 5000,0; | L163: 5 | M163: 5000,1; | N163: 39240/3600*(nPatrolSec+3)*(1000+nGuanQia)/1000 | O163: 31380/3600*(nPatrolSec+3)*(1000+nGuanQia)/1000 | P163: 19320/3600*(nPatrolSec+3)*(1000+nGuanQia)/1000 | Q163: nGuanQia + 1000 | R163: 39240/60*nMin*(1000+nGuanQia)/1000 | S163: 31380/60*nMin*(1000+nGuanQia)/1000 | T163: 19320/60*nMin*(1000+nGuanQia)/1000 | U163: 喽啰 | V163: pet_21;pet_201;pet_93;pet_91; | W163: 4 | X163: 5 | Y163: 1,28000,8,0;1,19016,8,0;1,10007,5,0;1,10108,2,0;1,7,9000,0;1,8,9000,0;1,4,1000,0; | Z163: 0 | AA163: {} | AB163: n/60
A164: 160 | B164: 160 | C164: 160 | D164: 地狱试炼 | E164: 10505 | F164: 5 | G164: 3 | H164: 200160 | I164: 0 | J164: 480 | K164: 5000,0; | L164: 5 | M164: 5000,1; | N164: 39240/3600*(nPatrolSec+3)*(1000+nGuanQia)/1000 | O164: 31380/3600*(nPatrolSec+3)*(1000+nGuanQia)/1000 | P164: 19320/3600*(nPatrolSec+3)*(1000+nGuanQia)/1000 | Q164: nGuanQia + 1000 | R164: 39240/60*nMin*(1000+nGuanQia)/1000 | S164: 31380/60*nMin*(1000+nGuanQia)/1000 | T164: 19320/60*nMin*(1000+nGuanQia)/1000 | U164: 喽啰 | V164: pet_21;pet_201;pet_93;pet_91; | W164: 4 | X164: 5 | Y164: 1,28000,8,0;1,19016,8,0;1,10007,5,0;1,10108,2,0;1,7,9000,0;1,8,9000,0;1,4,1000,0; | Z164: 0 | AA164: {} | AB164: n/60
A165: 161 | B165: 161 | C165: 161 | D165: 地狱试炼 | E165: 10505 | F165: 5 | G165: 3 | H165: 200161 | I165: 0 | J165: 480 | K165: 5000,0; | L165: 5 | M165: 5000,1; | N165: 39240/3600*(nPatrolSec+3)*(1000+nGuanQia)/1000 | O165: 31380/3600*(nPatrolSec+3)*(1000+nGuanQia)/1000 | P165: 19320/3600*(nPatrolSec+3)*(1000+nGuanQia)/1000 | Q165: nGuanQia + 1000 | R165: 39240/60*nMin*(1000+nGuanQia)/1000 | S165: 31380/60*nMin*(1000+nGuanQia)/1000 | T165: 19320/60*nMin*(1000+nGuanQia)/1000 | U165: 喽啰 | V165: pet_21;pet_201;pet_93;pet_91; | W165: 4 | X165: 5 | Y165: 1,28000,8,0;1,19016,8,0;1,10007,5,0;1,10108,2,0;1,7,9000,0;1,8,9000,0;1,4,1000,0; | Z165: 0 | AA165: {} | AB165: n/60
A166: 162 | B166: 162 | C166: 162 | D166: 地狱试炼 | E166: 10505 | F166: 5 | G166: 3 | H166: 200162 | I166: 0 | J166: 480 | K166: 5000,0; | L166: 5 | M166: 5000,1; | N166: 39240/3600*(nPatrolSec+3)*(1000+nGuanQia)/1000 | O166: 31380/3600*(nPatrolSec+3)*(1000+nGuanQia)/1000 | P166: 19320/3600*(nPatrolSec+3)*(1000+nGuanQia)/1000 | Q166: nGuanQia + 1000 | R166: 39240/60*nMin*(1000+nGuanQia)/1000 | S166: 31380/60*nMin*(1000+nGuanQia)/1000 | T166: 19320/60*nMin*(1000+nGuanQia)/1000 | U166: 喽啰 | V166: pet_21;pet_201;pet_93;pet_91; | W166: 4 | X166: 5 | Y166: 1,28000,8,0;1,19016,8,0;1,10007,5,0;1,10108,2,0;1,7,9000,0;1,8,9000,0;1,4,1000,0; | Z166: 0 | AA166: {} | AB166: n/60
A167: 163 | B167: 163 | C167: 163 | D167: 地狱试炼 | E167: 10505 | F167: 5 | G167: 3 | H167: 200163 | I167: 0 | J167: 480 | K167: 5000,0; | L167: 5 | M167: 5000,1; | N167: 39240/3600*(nPatrolSec+3)*(1000+nGuanQia)/1000 | O167: 31380/3600*(nPatrolSec+3)*(1000+nGuanQia)/1000 | P167: 19320/3600*(nPatrolSec+3)*(1000+nGuanQia)/1000 | Q167: nGuanQia + 1000 | R167: 39240/60*nMin*(1000+nGuanQia)/1000 | S167: 31380/60*nMin*(1000+nGuanQia)/1000 | T167: 19320/60*nMin*(1000+nGuanQia)/1000 | U167: 喽啰 | V167: pet_21;pet_201;pet_93;pet_91; | W167: 4 | X167: 5 | Y167: 1,28000,8,0;1,19016,8,0;1,10007,5,0;1,10108,2,0;1,7,9000,0;1,8,9000,0;1,4,1000,0; | Z167: 0 | AA167: {} | AB167: n/60
A168: 164 | B168: 164 | C168: 164 | D168: 地狱试炼 | E168: 10505 | F168: 5 | G168: 3 | H168: 200164 | I168: 0 | J168: 480 | K168: 5000,0; | L168: 5 | M168: 5000,1; | N168: 39240/3600*(nPatrolSec+3)*(1000+nGuanQia)/1000 | O168: 31380/3600*(nPatrolSec+3)*(1000+nGuanQia)/1000 | P168: 19320/3600*(nPatrolSec+3)*(1000+nGuanQia)/1000 | Q168: nGuanQia + 1000 | R168: 39240/60*nMin*(1000+nGuanQia)/1000 | S168: 31380/60*nMin*(1000+nGuanQia)/1000 | T168: 19320/60*nMin*(1000+nGuanQia)/1000 | U168: 喽啰 | V168: pet_21;pet_201;pet_93;pet_91; | W168: 4 | X168: 5 | Y168: 1,28000,8,0;1,19016,8,0;1,10007,5,0;1,10108,2,0;1,7,9000,0;1,8,9000,0;1,4,1000,0; | Z168: 0 | AA168: {} | AB168: n/60
A169: 165 | B169: 165 | C169: 165 | D169: 地狱试炼 | E169: 10505 | F169: 5 | G169: 3 | H169: 200165 | I169: 0 | J169: 480 | K169: 5000,0; | L169: 5 | M169: 5000,1; | N169: 39240/3600*(nPatrolSec+3)*(1000+nGuanQia)/1000 | O169: 31380/3600*(nPatrolSec+3)*(1000+nGuanQia)/1000 | P169: 19320/3600*(nPatrolSec+3)*(1000+nGuanQia)/1000 | Q169: nGuanQia + 1000 | R169: 39240/60*nMin*(1000+nGuanQia)/1000 | S169: 31380/60*nMin*(1000+nGuanQia)/1000 | T169: 19320/60*nMin*(1000+nGuanQia)/1000 | U169: 喽啰 | V169: pet_21;pet_201;pet_93;pet_91; | W169: 4 | X169: 5 | Y169: 1,28000,8,0;1,19016,8,0;1,10007,5,0;1,10108,2,0;1,7,9000,0;1,8,9000,0;1,4,1000,0; | Z169: 0 | AA169: {} | AB169: n/60
A170: 166 | B170: 166 | C170: 166 | D170: 涅槃试炼 | E170: 10503 | F170: 5 | G170: 3 | H170: 200166 | I170: 0 | J170: 480 | K170: 5000,0; | L170: 5 | M170: 5000,1; | N170: 39240/3600*(nPatrolSec+3)*(1000+nGuanQia)/1000 | O170: 31380/3600*(nPatrolSec+3)*(1000+nGuanQia)/1000 | P170: 19320/3600*(nPatrolSec+3)*(1000+nGuanQia)/1000 | Q170: nGuanQia + 1000 | R170: 39240/60*nMin*(1000+nGuanQia)/1000 | S170: 31380/60*nMin*(1000+nGuanQia)/1000 | T170: 19320/60*nMin*(1000+nGuanQia)/1000 | U170: 喽啰 | V170: pet_21;pet_201;pet_93;pet_91; | W170: 4 | X170: 5 | Y170: 1,28000,8,0;1,19016,8,0;1,10007,5,0;1,10108,2,0;1,7,9000,0;1,8,9000,0;1,4,1000,0; | Z170: 0 | AA170: {} | AB170: n/60
A171: 167 | B171: 167 | C171: 167 | D171: 涅槃试炼 | E171: 10503 | F171: 5 | G171: 3 | H171: 200167 | I171: 0 | J171: 480 | K171: 5000,0; | L171: 5 | M171: 5000,1; | N171: 39240/3600*(nPatrolSec+3)*(1000+nGuanQia)/1000 | O171: 31380/3600*(nPatrolSec+3)*(1000+nGuanQia)/1000 | P171: 19320/3600*(nPatrolSec+3)*(1000+nGuanQia)/1000 | Q171: nGuanQia + 1000 | R171: 39240/60*nMin*(1000+nGuanQia)/1000 | S171: 31380/60*nMin*(1000+nGuanQia)/1000 | T171: 19320/60*nMin*(1000+nGuanQia)/1000 | U171: 喽啰 | V171: pet_21;pet_201;pet_93;pet_91; | W171: 4 | X171: 5 | Y171: 1,28000,8,0;1,19016,8,0;1,10007,5,0;1,10108,2,0;1,7,9000,0;1,8,9000,0;1,4,1000,0; | Z171: 0 | AA171: {} | AB171: n/60
A172: 168 | B172: 168 | C172: 168 | D172: 涅槃试炼 | E172: 10503 | F172: 5 | G172: 3 | H172: 200168 | I172: 0 | J172: 480 | K172: 5000,0; | L172: 5 | M172: 5000,1; | N172: 39240/3600*(nPatrolSec+3)*(1000+nGuanQia)/1000 | O172: 31380/3600*(nPatrolSec+3)*(1000+nGuanQia)/1000 | P172: 19320/3600*(nPatrolSec+3)*(1000+nGuanQia)/1000 | Q172: nGuanQia + 1000 | R172: 39240/60*nMin*(1000+nGuanQia)/1000 | S172: 31380/60*nMin*(1000+nGuanQia)/1000 | T172: 19320/60*nMin*(1000+nGuanQia)/1000 | U172: 喽啰 | V172: pet_21;pet_201;pet_93;pet_91; | W172: 4 | X172: 5 | Y172: 1,28000,8,0;1,19016,8,0;1,10007,5,0;1,10108,2,0;1,7,9000,0;1,8,9000,0;1,4,1000,0; | Z172: 0 | AA172: {} | AB172: n/60
A173: 169 | B173: 169 | C173: 169 | D173: 涅槃试炼 | E173: 10503 | F173: 5 | G173: 3 | H173: 200169 | I173: 0 | J173: 480 | K173: 5000,0; | L173: 5 | M173: 5000,1; | N173: 39240/3600*(nPatrolSec+3)*(1000+nGuanQia)/1000 | O173: 31380/3600*(nPatrolSec+3)*(1000+nGuanQia)/1000 | P173: 19320/3600*(nPatrolSec+3)*(1000+nGuanQia)/1000 | Q173: nGuanQia + 1000 | R173: 39240/60*nMin*(1000+nGuanQia)/1000 | S173: 31380/60*nMin*(1000+nGuanQia)/1000 | T173: 19320/60*nMin*(1000+nGuanQia)/1000 | U173: 喽啰 | V173: pet_21;pet_201;pet_93;pet_91; | W173: 4 | X173: 5 | Y173: 1,28000,8,0;1,19016,8,0;1,10007,5,0;1,10108,2,0;1,7,9000,0;1,8,9000,0;1,4,1000,0; | Z173: 0 | AA173: {} | AB173: n/60
A174: 170 | B174: 170 | C174: 170 | D174: 涅槃试炼 | E174: 10503 | F174: 5 | G174: 3 | H174: 200170 | I174: 0 | J174: 480 | K174: 5000,0; | L174: 5 | M174: 5000,1; | N174: 39240/3600*(nPatrolSec+3)*(1000+nGuanQia)/1000 | O174: 31380/3600*(nPatrolSec+3)*(1000+nGuanQia)/1000 | P174: 19320/3600*(nPatrolSec+3)*(1000+nGuanQia)/1000 | Q174: nGuanQia + 1000 | R174: 39240/60*nMin*(1000+nGuanQia)/1000 | S174: 31380/60*nMin*(1000+nGuanQia)/1000 | T174: 19320/60*nMin*(1000+nGuanQia)/1000 | U174: 喽啰 | V174: pet_21;pet_201;pet_93;pet_91; | W174: 4 | X174: 5 | Y174: 1,28000,8,0;1,19016,8,0;1,10007,5,0;1,10108,2,0;1,7,9000,0;1,8,9000,0;1,4,1000,0; | Z174: 0 | AA174: {} | AB174: n/60
A175: 171 | B175: 171 | C175: 171 | D175: 涅槃试炼 | E175: 10503 | F175: 5 | G175: 3 | H175: 200171 | I175: 0 | J175: 480 | K175: 5000,0; | L175: 5 | M175: 5000,1; | N175: 39240/3600*(nPatrolSec+3)*(1000+nGuanQia)/1000 | O175: 31380/3600*(nPatrolSec+3)*(1000+nGuanQia)/1000 | P175: 19320/3600*(nPatrolSec+3)*(1000+nGuanQia)/1000 | Q175: nGuanQia + 1000 | R175: 39240/60*nMin*(1000+nGuanQia)/1000 | S175: 31380/60*nMin*(1000+nGuanQia)/1000 | T175: 19320/60*nMin*(1000+nGuanQia)/1000 | U175: 喽啰 | V175: pet_21;pet_201;pet_93;pet_91; | W175: 4 | X175: 5 | Y175: 1,28000,8,0;1,19016,8,0;1,10007,5,0;1,10108,2,0;1,7,9000,0;1,8,9000,0;1,4,1000,0; | Z175: 0 | AA175: {} | AB175: n/60
A176: 172 | B176: 172 | C176: 172 | D176: 涅槃试炼 | E176: 10503 | F176: 5 | G176: 3 | H176: 200172 | I176: 0 | J176: 480 | K176: 5000,0; | L176: 5 | M176: 5000,1; | N176: 39240/3600*(nPatrolSec+3)*(1000+nGuanQia)/1000 | O176: 31380/3600*(nPatrolSec+3)*(1000+nGuanQia)/1000 | P176: 19320/3600*(nPatrolSec+3)*(1000+nGuanQia)/1000 | Q176: nGuanQia + 1000 | R176: 39240/60*nMin*(1000+nGuanQia)/1000 | S176: 31380/60*nMin*(1000+nGuanQia)/1000 | T176: 19320/60*nMin*(1000+nGuanQia)/1000 | U176: 喽啰 | V176: pet_21;pet_201;pet_93;pet_91; | W176: 4 | X176: 5 | Y176: 1,28000,8,0;1,19016,8,0;1,10007,5,0;1,10108,2,0;1,7,9000,0;1,8,9000,0;1,4,1000,0; | Z176: 0 | AA176: {} | AB176: n/60
A177: 173 | B177: 173 | C177: 173 | D177: 涅槃试炼 | E177: 10503 | F177: 5 | G177: 3 | H177: 200173 | I177: 0 | J177: 480 | K177: 5000,0; | L177: 5 | M177: 5000,1; | N177: 39240/3600*(nPatrolSec+3)*(1000+nGuanQia)/1000 | O177: 31380/3600*(nPatrolSec+3)*(1000+nGuanQia)/1000 | P177: 19320/3600*(nPatrolSec+3)*(1000+nGuanQia)/1000 | Q177: nGuanQia + 1000 | R177: 39240/60*nMin*(1000+nGuanQia)/1000 | S177: 31380/60*nMin*(1000+nGuanQia)/1000 | T177: 19320/60*nMin*(1000+nGuanQia)/1000 | U177: 喽啰 | V177: pet_21;pet_201;pet_93;pet_91; | W177: 4 | X177: 5 | Y177: 1,28000,8,0;1,19016,8,0;1,10007,5,0;1,10108,2,0;1,7,9000,0;1,8,9000,0;1,4,1000,0; | Z177: 0 | AA177: {} | AB177: n/60
A178: 174 | B178: 174 | C178: 174 | D178: 涅槃试炼 | E178: 10503 | F178: 5 | G178: 3 | H178: 200174 | I178: 0 | J178: 480 | K178: 5000,0; | L178: 5 | M178: 5000,1; | N178: 39240/3600*(nPatrolSec+3)*(1000+nGuanQia)/1000 | O178: 31380/3600*(nPatrolSec+3)*(1000+nGuanQia)/1000 | P178: 19320/3600*(nPatrolSec+3)*(1000+nGuanQia)/1000 | Q178: nGuanQia + 1000 | R178: 39240/60*nMin*(1000+nGuanQia)/1000 | S178: 31380/60*nMin*(1000+nGuanQia)/1000 | T178: 19320/60*nMin*(1000+nGuanQia)/1000 | U178: 喽啰 | V178: pet_21;pet_201;pet_93;pet_91; | W178: 4 | X178: 5 | Y178: 1,28000,8,0;1,19016,8,0;1,10007,5,0;1,10108,2,0;1,7,9000,0;1,8,9000,0;1,4,1000,0; | Z178: 0 | AA178: {} | AB178: n/60
A179: 175 | B179: 175 | C179: 175 | D179: 涅槃试炼 | E179: 10503 | F179: 5 | G179: 3 | H179: 200175 | I179: 0 | J179: 480 | K179: 5000,0; | L179: 5 | M179: 5000,1; | N179: 39240/3600*(nPatrolSec+3)*(1000+nGuanQia)/1000 | O179: 31380/3600*(nPatrolSec+3)*(1000+nGuanQia)/1000 | P179: 19320/3600*(nPatrolSec+3)*(1000+nGuanQia)/1000 | Q179: nGuanQia + 1000 | R179: 39240/60*nMin*(1000+nGuanQia)/1000 | S179: 31380/60*nMin*(1000+nGuanQia)/1000 | T179: 19320/60*nMin*(1000+nGuanQia)/1000 | U179: 喽啰 | V179: pet_21;pet_201;pet_93;pet_91; | W179: 4 | X179: 5 | Y179: 1,28000,8,0;1,19016,8,0;1,10007,5,0;1,10108,2,0;1,7,9000,0;1,8,9000,0;1,4,1000,0; | Z179: 0 | AA179: {} | AB179: n/60
A180: 176 | B180: 176 | C180: 176 | D180: 涅槃试炼 | E180: 10503 | F180: 5 | G180: 3 | H180: 200176 | I180: 0 | J180: 480 | K180: 5000,0; | L180: 5 | M180: 5000,1; | N180: 39240/3600*(nPatrolSec+3)*(1000+nGuanQia)/1000 | O180: 31380/3600*(nPatrolSec+3)*(1000+nGuanQia)/1000 | P180: 19320/3600*(nPatrolSec+3)*(1000+nGuanQia)/1000 | Q180: nGuanQia + 1000 | R180: 39240/60*nMin*(1000+nGuanQia)/1000 | S180: 31380/60*nMin*(1000+nGuanQia)/1000 | T180: 19320/60*nMin*(1000+nGuanQia)/1000 | U180: 喽啰 | V180: pet_21;pet_201;pet_93;pet_91; | W180: 4 | X180: 5 | Y180: 1,28000,8,0;1,19016,8,0;1,10007,5,0;1,10108,2,0;1,7,9000,0;1,8,9000,0;1,4,1000,0; | Z180: 0 | AA180: {} | AB180: n/60
A181: 177 | B181: 177 | C181: 177 | D181: 涅槃试炼 | E181: 10503 | F181: 5 | G181: 3 | H181: 200177 | I181: 0 | J181: 480 | K181: 5000,0; | L181: 5 | M181: 5000,1; | N181: 39240/3600*(nPatrolSec+3)*(1000+nGuanQia)/1000 | O181: 31380/3600*(nPatrolSec+3)*(1000+nGuanQia)/1000 | P181: 19320/3600*(nPatrolSec+3)*(1000+nGuanQia)/1000 | Q181: nGuanQia + 1000 | R181: 39240/60*nMin*(1000+nGuanQia)/1000 | S181: 31380/60*nMin*(1000+nGuanQia)/1000 | T181: 19320/60*nMin*(1000+nGuanQia)/1000 | U181: 喽啰 | V181: pet_21;pet_201;pet_93;pet_91; | W181: 4 | X181: 5 | Y181: 1,28000,8,0;1,19016,8,0;1,10007,5,0;1,10108,2,0;1,7,9000,0;1,8,9000,0;1,4,1000,0; | Z181: 0 | AA181: {} | AB181: n/60
A182: 178 | B182: 178 | C182: 178 | D182: 涅槃试炼 | E182: 10904 | F182: 5 | G182: 3 | H182: 200178 | I182: 0 | J182: 480 | K182: 5000,0; | L182: 5 | M182: 5000,1; | N182: 39240/3600*(nPatrolSec+3)*(1000+nGuanQia)/1000 | O182: 31380/3600*(nPatrolSec+3)*(1000+nGuanQia)/1000 | P182: 19320/3600*(nPatrolSec+3)*(1000+nGuanQia)/1000 | Q182: nGuanQia + 1000 | R182: 39240/60*nMin*(1000+nGuanQia)/1000 | S182: 31380/60*nMin*(1000+nGuanQia)/1000 | T182: 19320/60*nMin*(1000+nGuanQia)/1000 | U182: 喽啰 | V182: pet_21;pet_201;pet_93;pet_91; | W182: 4 | X182: 5 | Y182: 1,28000,8,0;1,19016,8,0;1,10007,5,0;1,10108,2,0;1,7,9000,0;1,8,9000,0;1,4,1000,0; | Z182: 0 | AA182: {} | AB182: n/60
A183: 179 | B183: 179 | C183: 179 | D183: 涅槃试炼 | E183: 10904 | F183: 5 | G183: 3 | H183: 200179 | I183: 0 | J183: 480 | K183: 5000,0; | L183: 5 | M183: 5000,1; | N183: 39240/3600*(nPatrolSec+3)*(1000+nGuanQia)/1000 | O183: 31380/3600*(nPatrolSec+3)*(1000+nGuanQia)/1000 | P183: 19320/3600*(nPatrolSec+3)*(1000+nGuanQia)/1000 | Q183: nGuanQia + 1000 | R183: 39240/60*nMin*(1000+nGuanQia)/1000 | S183: 31380/60*nMin*(1000+nGuanQia)/1000 | T183: 19320/60*nMin*(1000+nGuanQia)/1000 | U183: 喽啰 | V183: pet_21;pet_201;pet_93;pet_91; | W183: 4 | X183: 5 | Y183: 1,28000,8,0;1,19016,8,0;1,10007,5,0;1,10108,2,0;1,7,9000,0;1,8,9000,0;1,4,1000,0; | Z183: 0 | AA183: {} | AB183: n/60
A184: 180 | B184: 180 | C184: 180 | D184: 涅槃试炼 | E184: 10904 | F184: 5 | G184: 3 | H184: 200180 | I184: 0 | J184: 480 | K184: 5000,0; | L184: 5 | M184: 5000,1; | N184: 39240/3600*(nPatrolSec+3)*(1000+nGuanQia)/1000 | O184: 31380/3600*(nPatrolSec+3)*(1000+nGuanQia)/1000 | P184: 19320/3600*(nPatrolSec+3)*(1000+nGuanQia)/1000 | Q184: nGuanQia + 1000 | R184: 39240/60*nMin*(1000+nGuanQia)/1000 | S184: 31380/60*nMin*(1000+nGuanQia)/1000 | T184: 19320/60*nMin*(1000+nGuanQia)/1000 | U184: 喽啰 | V184: pet_21;pet_201;pet_93;pet_91; | W184: 4 | X184: 5 | Y184: 1,28000,8,0;1,19016,8,0;1,10007,5,0;1,10108,2,0;1,7,9000,0;1,8,9000,0;1,4,1000,0; | Z184: 0 | AA184: {} | AB184: n/60
A185: 181 | B185: 181 | C185: 181 | D185: 涅槃试炼 | E185: 10904 | F185: 5 | G185: 3 | H185: 200181 | I185: 0 | J185: 480 | K185: 5000,0; | L185: 5 | M185: 5000,1; | N185: 39240/3600*(nPatrolSec+3)*(1000+nGuanQia)/1000 | O185: 31380/3600*(nPatrolSec+3)*(1000+nGuanQia)/1000 | P185: 19320/3600*(nPatrolSec+3)*(1000+nGuanQia)/1000 | Q185: nGuanQia + 1000 | R185: 39240/60*nMin*(1000+nGuanQia)/1000 | S185: 31380/60*nMin*(1000+nGuanQia)/1000 | T185: 19320/60*nMin*(1000+nGuanQia)/1000 | U185: 喽啰 | V185: pet_21;pet_201;pet_93;pet_91; | W185: 4 | X185: 5 | Y185: 1,28000,8,0;1,19016,8,0;1,10007,5,0;1,10108,2,0;1,7,9000,0;1,8,9000,0;1,4,1000,0; | Z185: 0 | AA185: {} | AB185: n/60
A186: 182 | B186: 182 | C186: 182 | D186: 涅槃试炼 | E186: 10904 | F186: 5 | G186: 3 | H186: 200182 | I186: 0 | J186: 480 | K186: 5000,0; | L186: 5 | M186: 5000,1; | N186: 39240/3600*(nPatrolSec+3)*(1000+nGuanQia)/1000 | O186: 31380/3600*(nPatrolSec+3)*(1000+nGuanQia)/1000 | P186: 19320/3600*(nPatrolSec+3)*(1000+nGuanQia)/1000 | Q186: nGuanQia + 1000 | R186: 39240/60*nMin*(1000+nGuanQia)/1000 | S186: 31380/60*nMin*(1000+nGuanQia)/1000 | T186: 19320/60*nMin*(1000+nGuanQia)/1000 | U186: 喽啰 | V186: pet_21;pet_201;pet_93;pet_91; | W186: 4 | X186: 5 | Y186: 1,28000,8,0;1,19016,8,0;1,10007,5,0;1,10108,2,0;1,7,9000,0;1,8,9000,0;1,4,1000,0; | Z186: 0 | AA186: {} | AB186: n/60
A187: 183 | B187: 183 | C187: 183 | D187: 涅槃试炼 | E187: 10904 | F187: 5 | G187: 3 | H187: 200183 | I187: 0 | J187: 480 | K187: 5000,0; | L187: 5 | M187: 5000,1; | N187: 39240/3600*(nPatrolSec+3)*(1000+nGuanQia)/1000 | O187: 31380/3600*(nPatrolSec+3)*(1000+nGuanQia)/1000 | P187: 19320/3600*(nPatrolSec+3)*(1000+nGuanQia)/1000 | Q187: nGuanQia + 1000 | R187: 39240/60*nMin*(1000+nGuanQia)/1000 | S187: 31380/60*nMin*(1000+nGuanQia)/1000 | T187: 19320/60*nMin*(1000+nGuanQia)/1000 | U187: 喽啰 | V187: pet_21;pet_201;pet_93;pet_91; | W187: 4 | X187: 5 | Y187: 1,28000,8,0;1,19016,8,0;1,10007,5,0;1,10108,2,0;1,7,9000,0;1,8,9000,0;1,4,1000,0; | Z187: 0 | AA187: {} | AB187: n/60
A188: 184 | B188: 184 | C188: 184 | D188: 涅槃试炼 | E188: 10904 | F188: 5 | G188: 3 | H188: 200184 | I188: 0 | J188: 480 | K188: 5000,0; | L188: 5 | M188: 5000,1; | N188: 39240/3600*(nPatrolSec+3)*(1000+nGuanQia)/1000 | O188: 31380/3600*(nPatrolSec+3)*(1000+nGuanQia)/1000 | P188: 19320/3600*(nPatrolSec+3)*(1000+nGuanQia)/1000 | Q188: nGuanQia + 1000 | R188: 39240/60*nMin*(1000+nGuanQia)/1000 | S188: 31380/60*nMin*(1000+nGuanQia)/1000 | T188: 19320/60*nMin*(1000+nGuanQia)/1000 | U188: 喽啰 | V188: pet_21;pet_201;pet_93;pet_91; | W188: 4 | X188: 5 | Y188: 1,28000,8,0;1,19016,8,0;1,10007,5,0;1,10108,2,0;1,7,9000,0;1,8,9000,0;1,4,1000,0; | Z188: 0 | AA188: {} | AB188: n/60
A189: 185 | B189: 185 | C189: 185 | D189: 涅槃试炼 | E189: 10904 | F189: 5 | G189: 3 | H189: 200185 | I189: 0 | J189: 480 | K189: 5000,0; | L189: 5 | M189: 5000,1; | N189: 39240/3600*(nPatrolSec+3)*(1000+nGuanQia)/1000 | O189: 31380/3600*(nPatrolSec+3)*(1000+nGuanQia)/1000 | P189: 19320/3600*(nPatrolSec+3)*(1000+nGuanQia)/1000 | Q189: nGuanQia + 1000 | R189: 39240/60*nMin*(1000+nGuanQia)/1000 | S189: 31380/60*nMin*(1000+nGuanQia)/1000 | T189: 19320/60*nMin*(1000+nGuanQia)/1000 | U189: 喽啰 | V189: pet_21;pet_201;pet_93;pet_91; | W189: 4 | X189: 5 | Y189: 1,28000,8,0;1,19016,8,0;1,10007,5,0;1,10108,2,0;1,7,9000,0;1,8,9000,0;1,4,1000,0; | Z189: 0 | AA189: {} | AB189: n/60
A190: 186 | B190: 186 | C190: 186 | D190: 涅槃试炼 | E190: 10904 | F190: 5 | G190: 3 | H190: 200186 | I190: 0 | J190: 480 | K190: 5000,0; | L190: 5 | M190: 5000,1; | N190: 39240/3600*(nPatrolSec+3)*(1000+nGuanQia)/1000 | O190: 31380/3600*(nPatrolSec+3)*(1000+nGuanQia)/1000 | P190: 19320/3600*(nPatrolSec+3)*(1000+nGuanQia)/1000 | Q190: nGuanQia + 1000 | R190: 39240/60*nMin*(1000+nGuanQia)/1000 | S190: 31380/60*nMin*(1000+nGuanQia)/1000 | T190: 19320/60*nMin*(1000+nGuanQia)/1000 | U190: 喽啰 | V190: pet_21;pet_201;pet_93;pet_91; | W190: 4 | X190: 5 | Y190: 1,28000,8,0;1,19016,8,0;1,10007,5,0;1,10108,2,0;1,7,9000,0;1,8,9000,0;1,4,1000,0; | Z190: 0 | AA190: {} | AB190: n/60
A191: 187 | B191: 187 | C191: 187 | D191: 涅槃试炼 | E191: 10904 | F191: 5 | G191: 3 | H191: 200187 | I191: 0 | J191: 480 | K191: 5000,0; | L191: 5 | M191: 5000,1; | N191: 39240/3600*(nPatrolSec+3)*(1000+nGuanQia)/1000 | O191: 31380/3600*(nPatrolSec+3)*(1000+nGuanQia)/1000 | P191: 19320/3600*(nPatrolSec+3)*(1000+nGuanQia)/1000 | Q191: nGuanQia + 1000 | R191: 39240/60*nMin*(1000+nGuanQia)/1000 | S191: 31380/60*nMin*(1000+nGuanQia)/1000 | T191: 19320/60*nMin*(1000+nGuanQia)/1000 | U191: 喽啰 | V191: pet_21;pet_201;pet_93;pet_91; | W191: 4 | X191: 5 | Y191: 1,28000,8,0;1,19016,8,0;1,10007,5,0;1,10108,2,0;1,7,9000,0;1,8,9000,0;1,4,1000,0; | Z191: 0 | AA191: {} | AB191: n/60
A192: 188 | B192: 188 | C192: 188 | D192: 涅槃试炼 | E192: 10904 | F192: 5 | G192: 3 | H192: 200188 | I192: 0 | J192: 480 | K192: 5000,0; | L192: 5 | M192: 5000,1; | N192: 39240/3600*(nPatrolSec+3)*(1000+nGuanQia)/1000 | O192: 31380/3600*(nPatrolSec+3)*(1000+nGuanQia)/1000 | P192: 19320/3600*(nPatrolSec+3)*(1000+nGuanQia)/1000 | Q192: nGuanQia + 1000 | R192: 39240/60*nMin*(1000+nGuanQia)/1000 | S192: 31380/60*nMin*(1000+nGuanQia)/1000 | T192: 19320/60*nMin*(1000+nGuanQia)/1000 | U192: 喽啰 | V192: pet_21;pet_201;pet_93;pet_91; | W192: 4 | X192: 5 | Y192: 1,28000,8,0;1,19016,8,0;1,10007,5,0;1,10108,2,0;1,7,9000,0;1,8,9000,0;1,4,1000,0; | Z192: 0 | AA192: {} | AB192: n/60
A193: 189 | B193: 189 | C193: 189 | D193: 涅槃试炼 | E193: 10501 | F193: 5 | G193: 3 | H193: 200189 | I193: 0 | J193: 480 | K193: 5000,0; | L193: 5 | M193: 5000,1; | N193: 39240/3600*(nPatrolSec+3)*(1000+nGuanQia)/1000 | O193: 31380/3600*(nPatrolSec+3)*(1000+nGuanQia)/1000 | P193: 19320/3600*(nPatrolSec+3)*(1000+nGuanQia)/1000 | Q193: nGuanQia + 1000 | R193: 39240/60*nMin*(1000+nGuanQia)/1000 | S193: 31380/60*nMin*(1000+nGuanQia)/1000 | T193: 19320/60*nMin*(1000+nGuanQia)/1000 | U193: 喽啰 | V193: pet_21;pet_201;pet_93;pet_91; | W193: 4 | X193: 5 | Y193: 1,28000,8,0;1,19016,8,0;1,10007,5,0;1,10108,2,0;1,7,9000,0;1,8,9000,0;1,4,1000,0; | Z193: 0 | AA193: {} | AB193: n/60
A194: 190 | B194: 190 | C194: 190 | D194: 涅槃试炼 | E194: 10501 | F194: 5 | G194: 3 | H194: 200190 | I194: 0 | J194: 480 | K194: 5000,0; | L194: 5 | M194: 5000,1; | N194: 39240/3600*(nPatrolSec+3)*(1000+nGuanQia)/1000 | O194: 31380/3600*(nPatrolSec+3)*(1000+nGuanQia)/1000 | P194: 19320/3600*(nPatrolSec+3)*(1000+nGuanQia)/1000 | Q194: nGuanQia + 1000 | R194: 39240/60*nMin*(1000+nGuanQia)/1000 | S194: 31380/60*nMin*(1000+nGuanQia)/1000 | T194: 19320/60*nMin*(1000+nGuanQia)/1000 | U194: 喽啰 | V194: pet_21;pet_201;pet_93;pet_91; | W194: 4 | X194: 5 | Y194: 1,28000,8,0;1,19016,8,0;1,10007,5,0;1,10108,2,0;1,7,9000,0;1,8,9000,0;1,4,1000,0; | Z194: 0 | AA194: {} | AB194: n/60
A195: 191 | B195: 191 | C195: 191 | D195: 涅槃试炼 | E195: 10501 | F195: 5 | G195: 3 | H195: 200191 | I195: 0 | J195: 480 | K195: 5000,0; | L195: 5 | M195: 5000,1; | N195: 39240/3600*(nPatrolSec+3)*(1000+nGuanQia)/1000 | O195: 31380/3600*(nPatrolSec+3)*(1000+nGuanQia)/1000 | P195: 19320/3600*(nPatrolSec+3)*(1000+nGuanQia)/1000 | Q195: nGuanQia + 1000 | R195: 39240/60*nMin*(1000+nGuanQia)/1000 | S195: 31380/60*nMin*(1000+nGuanQia)/1000 | T195: 19320/60*nMin*(1000+nGuanQia)/1000 | U195: 喽啰 | V195: pet_21;pet_201;pet_93;pet_91; | W195: 4 | X195: 5 | Y195: 1,28000,8,0;1,19016,8,0;1,10007,5,0;1,10108,2,0;1,7,9000,0;1,8,9000,0;1,4,1000,0; | Z195: 0 | AA195: {} | AB195: n/60
A196: 192 | B196: 192 | C196: 192 | D196: 涅槃试炼 | E196: 10501 | F196: 5 | G196: 3 | H196: 200192 | I196: 0 | J196: 480 | K196: 5000,0; | L196: 5 | M196: 5000,1; | N196: 39240/3600*(nPatrolSec+3)*(1000+nGuanQia)/1000 | O196: 31380/3600*(nPatrolSec+3)*(1000+nGuanQia)/1000 | P196: 19320/3600*(nPatrolSec+3)*(1000+nGuanQia)/1000 | Q196: nGuanQia + 1000 | R196: 39240/60*nMin*(1000+nGuanQia)/1000 | S196: 31380/60*nMin*(1000+nGuanQia)/1000 | T196: 19320/60*nMin*(1000+nGuanQia)/1000 | U196: 喽啰 | V196: pet_21;pet_201;pet_93;pet_91; | W196: 4 | X196: 5 | Y196: 1,28000,8,0;1,19016,8,0;1,10007,5,0;1,10108,2,0;1,7,9000,0;1,8,9000,0;1,4,1000,0; | Z196: 0 | AA196: {} | AB196: n/60
A197: 193 | B197: 193 | C197: 193 | D197: 涅槃试炼 | E197: 10501 | F197: 5 | G197: 3 | H197: 200193 | I197: 0 | J197: 480 | K197: 5000,0; | L197: 5 | M197: 5000,1; | N197: 39240/3600*(nPatrolSec+3)*(1000+nGuanQia)/1000 | O197: 31380/3600*(nPatrolSec+3)*(1000+nGuanQia)/1000 | P197: 19320/3600*(nPatrolSec+3)*(1000+nGuanQia)/1000 | Q197: nGuanQia + 1000 | R197: 39240/60*nMin*(1000+nGuanQia)/1000 | S197: 31380/60*nMin*(1000+nGuanQia)/1000 | T197: 19320/60*nMin*(1000+nGuanQia)/1000 | U197: 喽啰 | V197: pet_21;pet_201;pet_93;pet_91; | W197: 4 | X197: 5 | Y197: 1,28000,8,0;1,19016,8,0;1,10007,5,0;1,10108,2,0;1,7,9000,0;1,8,9000,0;1,4,1000,0; | Z197: 0 | AA197: {} | AB197: n/60
A198: 194 | B198: 194 | C198: 194 | D198: 涅槃试炼 | E198: 10501 | F198: 5 | G198: 3 | H198: 200194 | I198: 0 | J198: 480 | K198: 5000,0; | L198: 5 | M198: 5000,1; | N198: 39240/3600*(nPatrolSec+3)*(1000+nGuanQia)/1000 | O198: 31380/3600*(nPatrolSec+3)*(1000+nGuanQia)/1000 | P198: 19320/3600*(nPatrolSec+3)*(1000+nGuanQia)/1000 | Q198: nGuanQia + 1000 | R198: 39240/60*nMin*(1000+nGuanQia)/1000 | S198: 31380/60*nMin*(1000+nGuanQia)/1000 | T198: 19320/60*nMin*(1000+nGuanQia)/1000 | U198: 喽啰 | V198: pet_21;pet_201;pet_93;pet_91; | W198: 4 | X198: 5 | Y198: 1,28000,8,0;1,19016,8,0;1,10007,5,0;1,10108,2,0;1,7,9000,0;1,8,9000,0;1,4,1000,0; | Z198: 0 | AA198: {} | AB198: n/60
A199: 195 | B199: 195 | C199: 195 | D199: 涅槃试炼 | E199: 10501 | F199: 5 | G199: 3 | H199: 200195 | I199: 0 | J199: 480 | K199: 5000,0; | L199: 5 | M199: 5000,1; | N199: 39240/3600*(nPatrolSec+3)*(1000+nGuanQia)/1000 | O199: 31380/3600*(nPatrolSec+3)*(1000+nGuanQia)/1000 | P199: 19320/3600*(nPatrolSec+3)*(1000+nGuanQia)/1000 | Q199: nGuanQia + 1000 | R199: 39240/60*nMin*(1000+nGuanQia)/1000 | S199: 31380/60*nMin*(1000+nGuanQia)/1000 | T199: 19320/60*nMin*(1000+nGuanQia)/1000 | U199: 喽啰 | V199: pet_21;pet_201;pet_93;pet_91; | W199: 4 | X199: 5 | Y199: 1,28000,8,0;1,19016,8,0;1,10007,5,0;1,10108,2,0;1,7,9000,0;1,8,9000,0;1,4,1000,0; | Z199: 0 | AA199: {} | AB199: n/60
A200: 196 | B200: 196 | C200: 196 | D200: 涅槃试炼 | E200: 10501 | F200: 5 | G200: 3 | H200: 200196 | I200: 0 | J200: 480 | K200: 5000,0; | L200: 5 | M200: 5000,1; | N200: 39240/3600*(nPatrolSec+3)*(1000+nGuanQia)/1000 | O200: 31380/3600*(nPatrolSec+3)*(1000+nGuanQia)/1000 | P200: 19320/3600*(nPatrolSec+3)*(1000+nGuanQia)/1000 | Q200: nGuanQia + 1000 | R200: 39240/60*nMin*(1000+nGuanQia)/1000 | S200: 31380/60*nMin*(1000+nGuanQia)/1000 | T200: 19320/60*nMin*(1000+nGuanQia)/1000 | U200: 喽啰 | V200: pet_21;pet_201;pet_93;pet_91; | W200: 4 | X200: 5 | Y200: 1,28000,8,0;1,19016,8,0;1,10007,5,0;1,10108,2,0;1,7,9000,0;1,8,9000,0;1,4,1000,0; | Z200: 0 | AA200: {} | AB200: n/60
A201: 197 | B201: 197 | C201: 197 | D201: 涅槃试炼 | E201: 10501 | F201: 5 | G201: 3 | H201: 200197 | I201: 0 | J201: 480 | K201: 5000,0; | L201: 5 | M201: 5000,1; | N201: 39240/3600*(nPatrolSec+3)*(1000+nGuanQia)/1000 | O201: 31380/3600*(nPatrolSec+3)*(1000+nGuanQia)/1000 | P201: 19320/3600*(nPatrolSec+3)*(1000+nGuanQia)/1000 | Q201: nGuanQia + 1000 | R201: 39240/60*nMin*(1000+nGuanQia)/1000 | S201: 31380/60*nMin*(1000+nGuanQia)/1000 | T201: 19320/60*nMin*(1000+nGuanQia)/1000 | U201: 喽啰 | V201: pet_21;pet_201;pet_93;pet_91; | W201: 4 | X201: 5 | Y201: 1,28000,8,0;1,19016,8,0;1,10007,5,0;1,10108,2,0;1,7,9000,0;1,8,9000,0;1,4,1000,0; | Z201: 0 | AA201: {} | AB201: n/60
A202: 198 | B202: 198 | C202: 198 | D202: 涅槃试炼 | E202: 10501 | F202: 5 | G202: 3 | H202: 200198 | I202: 0 | J202: 480 | K202: 5000,0; | L202: 5 | M202: 5000,1; | N202: 39240/3600*(nPatrolSec+3)*(1000+nGuanQia)/1000 | O202: 31380/3600*(nPatrolSec+3)*(1000+nGuanQia)/1000 | P202: 19320/3600*(nPatrolSec+3)*(1000+nGuanQia)/1000 | Q202: nGuanQia + 1000 | R202: 39240/60*nMin*(1000+nGuanQia)/1000 | S202: 31380/60*nMin*(1000+nGuanQia)/1000 | T202: 19320/60*nMin*(1000+nGuanQia)/1000 | U202: 喽啰 | V202: pet_21;pet_201;pet_93;pet_91; | W202: 4 | X202: 5 | Y202: 1,28000,8,0;1,19016,8,0;1,10007,5,0;1,10108,2,0;1,7,9000,0;1,8,9000,0;1,4,1000,0; | Z202: 0 | AA202: {} | AB202: n/60
A203: 199 | B203: 199 | C203: 199 | D203: 涅槃试炼 | E203: 10501 | F203: 5 | G203: 3 | H203: 200199 | I203: 0 | J203: 480 | K203: 5000,0; | L203: 5 | M203: 5000,1; | N203: 39240/3600*(nPatrolSec+3)*(1000+nGuanQia)/1000 | O203: 31380/3600*(nPatrolSec+3)*(1000+nGuanQia)/1000 | P203: 19320/3600*(nPatrolSec+3)*(1000+nGuanQia)/1000 | Q203: nGuanQia + 1000 | R203: 39240/60*nMin*(1000+nGuanQia)/1000 | S203: 31380/60*nMin*(1000+nGuanQia)/1000 | T203: 19320/60*nMin*(1000+nGuanQia)/1000 | U203: 喽啰 | V203: pet_21;pet_201;pet_93;pet_91; | W203: 4 | X203: 5 | Y203: 1,28000,8,0;1,19016,8,0;1,10007,5,0;1,10108,2,0;1,7,9000,0;1,8,9000,0;1,4,1000,0; | Z203: 0 | AA203: {} | AB203: n/60
A204: 200 | B204: 200 | C204: 200 | D204: 涅槃试炼 | E204: 10501 | F204: 5 | G204: 3 | H204: 200200 | I204: 0 | J204: 480 | K204: 5000,0; | L204: 5 | M204: 5000,1; | N204: 39240/3600*(nPatrolSec+3)*(1000+nGuanQia)/1000 | O204: 31380/3600*(nPatrolSec+3)*(1000+nGuanQia)/1000 | P204: 19320/3600*(nPatrolSec+3)*(1000+nGuanQia)/1000 | Q204: nGuanQia + 1000 | R204: 39240/60*nMin*(1000+nGuanQia)/1000 | S204: 31380/60*nMin*(1000+nGuanQia)/1000 | T204: 19320/60*nMin*(1000+nGuanQia)/1000 | U204: 喽啰 | V204: pet_21;pet_201;pet_93;pet_91; | W204: 4 | X204: 5 | Y204: 1,28000,8,0;1,19016,8,0;1,10007,5,0;1,10108,2,0;1,7,9000,0;1,8,9000,0;1,4,1000,0; | Z204: 0 | AA204: {} | AB204: n/60
A205: 201 | B205: 201 | C205: 201 | D205: 涅槃试炼 | E205: 10501 | F205: 5 | G205: 3 | H205: 200201 | I205: 0 | J205: 480 | K205: 5000,0; | L205: 5 | M205: 5000,1; | N205: 39240/3600*(nPatrolSec+3)*(1000+nGuanQia)/1000 | O205: 31380/3600*(nPatrolSec+3)*(1000+nGuanQia)/1000 | P205: 19320/3600*(nPatrolSec+3)*(1000+nGuanQia)/1000 | Q205: nGuanQia + 1000 | R205: 39240/60*nMin*(1000+nGuanQia)/1000 | S205: 31380/60*nMin*(1000+nGuanQia)/1000 | T205: 19320/60*nMin*(1000+nGuanQia)/1000 | U205: 喽啰 | V205: pet_21;pet_201;pet_93;pet_91; | W205: 4 | X205: 5 | Y205: 1,28000,8,0;1,19016,8,0;1,10007,5,0;1,10108,2,0;1,7,9000,0;1,8,9000,0;1,4,1000,0; | Z205: 0 | AA205: {} | AB205: n/60
A206: 202 | B206: 202 | C206: 202 | D206: 涅槃试炼 | E206: 10501 | F206: 5 | G206: 3 | H206: 200202 | I206: 0 | J206: 480 | K206: 5000,0; | L206: 5 | M206: 5000,1; | N206: 39240/3600*(nPatrolSec+3)*(1000+nGuanQia)/1000 | O206: 31380/3600*(nPatrolSec+3)*(1000+nGuanQia)/1000 | P206: 19320/3600*(nPatrolSec+3)*(1000+nGuanQia)/1000 | Q206: nGuanQia + 1000 | R206: 39240/60*nMin*(1000+nGuanQia)/1000 | S206: 31380/60*nMin*(1000+nGuanQia)/1000 | T206: 19320/60*nMin*(1000+nGuanQia)/1000 | U206: 喽啰 | V206: pet_21;pet_201;pet_93;pet_91; | W206: 4 | X206: 5 | Y206: 1,28000,8,0;1,19016,8,0;1,10007,5,0;1,10108,2,0;1,7,9000,0;1,8,9000,0;1,4,1000,0; | Z206: 0 | AA206: {} | AB206: n/60
A207: 203 | B207: 203 | C207: 203 | D207: 涅槃试炼 | E207: 10501 | F207: 5 | G207: 3 | H207: 200203 | I207: 0 | J207: 480 | K207: 5000,0; | L207: 5 | M207: 5000,1; | N207: 39240/3600*(nPatrolSec+3)*(1000+nGuanQia)/1000 | O207: 31380/3600*(nPatrolSec+3)*(1000+nGuanQia)/1000 | P207: 19320/3600*(nPatrolSec+3)*(1000+nGuanQia)/1000 | Q207: nGuanQia + 1000 | R207: 39240/60*nMin*(1000+nGuanQia)/1000 | S207: 31380/60*nMin*(1000+nGuanQia)/1000 | T207: 19320/60*nMin*(1000+nGuanQia)/1000 | U207: 喽啰 | V207: pet_21;pet_201;pet_93;pet_91; | W207: 4 | X207: 5 | Y207: 1,28000,8,0;1,19016,8,0;1,10007,5,0;1,10108,2,0;1,7,9000,0;1,8,9000,0;1,4,1000,0; | Z207: 0 | AA207: {} | AB207: n/60
A208: 204 | B208: 204 | C208: 204 | D208: 涅槃试炼 | E208: 10501 | F208: 5 | G208: 3 | H208: 200204 | I208: 0 | J208: 480 | K208: 5000,0; | L208: 5 | M208: 5000,1; | N208: 39240/3600*(nPatrolSec+3)*(1000+nGuanQia)/1000 | O208: 31380/3600*(nPatrolSec+3)*(1000+nGuanQia)/1000 | P208: 19320/3600*(nPatrolSec+3)*(1000+nGuanQia)/1000 | Q208: nGuanQia + 1000 | R208: 39240/60*nMin*(1000+nGuanQia)/1000 | S208: 31380/60*nMin*(1000+nGuanQia)/1000 | T208: 19320/60*nMin*(1000+nGuanQia)/1000 | U208: 喽啰 | V208: pet_21;pet_201;pet_93;pet_91; | W208: 4 | X208: 5 | Y208: 1,28000,8,0;1,19016,8,0;1,10007,5,0;1,10108,2,0;1,7,9000,0;1,8,9000,0;1,4,1000,0; | Z208: 0 | AA208: {} | AB208: n/60
A209: 205 | B209: 205 | C209: 205 | D209: 涅槃试炼 | E209: 10501 | F209: 5 | G209: 3 | H209: 200205 | I209: 0 | J209: 480 | K209: 5000,0; | L209: 5 | M209: 5000,1; | N209: 39240/3600*(nPatrolSec+3)*(1000+nGuanQia)/1000 | O209: 31380/3600*(nPatrolSec+3)*(1000+nGuanQia)/1000 | P209: 19320/3600*(nPatrolSec+3)*(1000+nGuanQia)/1000 | Q209: nGuanQia + 1000 | R209: 39240/60*nMin*(1000+nGuanQia)/1000 | S209: 31380/60*nMin*(1000+nGuanQia)/1000 | T209: 19320/60*nMin*(1000+nGuanQia)/1000 | U209: 喽啰 | V209: pet_21;pet_201;pet_93;pet_91; | W209: 4 | X209: 5 | Y209: 1,28000,8,0;1,19016,8,0;1,10007,5,0;1,10108,2,0;1,7,9000,0;1,8,9000,0;1,4,1000,0; | Z209: 0 | AA209: {} | AB209: n/60
A210: 206 | B210: 206 | C210: 206 | D210: 涅槃试炼 | E210: 10501 | F210: 5 | G210: 3 | H210: 200206 | I210: 0 | J210: 480 | K210: 5000,0; | L210: 5 | M210: 5000,1; | N210: 39240/3600*(nPatrolSec+3)*(1000+nGuanQia)/1000 | O210: 31380/3600*(nPatrolSec+3)*(1000+nGuanQia)/1000 | P210: 19320/3600*(nPatrolSec+3)*(1000+nGuanQia)/1000 | Q210: nGuanQia + 1000 | R210: 39240/60*nMin*(1000+nGuanQia)/1000 | S210: 31380/60*nMin*(1000+nGuanQia)/1000 | T210: 19320/60*nMin*(1000+nGuanQia)/1000 | U210: 喽啰 | V210: pet_21;pet_201;pet_93;pet_91; | W210: 4 | X210: 5 | Y210: 1,28000,8,0;1,19016,8,0;1,10007,5,0;1,10108,2,0;1,7,9000,0;1,8,9000,0;1,4,1000,0; | Z210: 0 | AA210: {} | AB210: n/60
A211: 207 | B211: 207 | C211: 207 | D211: 涅槃试炼 | E211: 10501 | F211: 5 | G211: 3 | H211: 200207 | I211: 0 | J211: 480 | K211: 5000,0; | L211: 5 | M211: 5000,1; | N211: 39240/3600*(nPatrolSec+3)*(1000+nGuanQia)/1000 | O211: 31380/3600*(nPatrolSec+3)*(1000+nGuanQia)/1000 | P211: 19320/3600*(nPatrolSec+3)*(1000+nGuanQia)/1000 | Q211: nGuanQia + 1000 | R211: 39240/60*nMin*(1000+nGuanQia)/1000 | S211: 31380/60*nMin*(1000+nGuanQia)/1000 | T211: 19320/60*nMin*(1000+nGuanQia)/1000 | U211: 喽啰 | V211: pet_21;pet_201;pet_93;pet_91; | W211: 4 | X211: 5 | Y211: 1,28000,8,0;1,19016,8,0;1,10007,5,0;1,10108,2,0;1,7,9000,0;1,8,9000,0;1,4,1000,0; | Z211: 0 | AA211: {} | AB211: n/60
A212: 208 | B212: 208 | C212: 208 | D212: 涅槃试炼 | E212: 10501 | F212: 5 | G212: 3 | H212: 200208 | I212: 0 | J212: 480 | K212: 5000,0; | L212: 5 | M212: 5000,1; | N212: 39240/3600*(nPatrolSec+3)*(1000+nGuanQia)/1000 | O212: 31380/3600*(nPatrolSec+3)*(1000+nGuanQia)/1000 | P212: 19320/3600*(nPatrolSec+3)*(1000+nGuanQia)/1000 | Q212: nGuanQia + 1000 | R212: 39240/60*nMin*(1000+nGuanQia)/1000 | S212: 31380/60*nMin*(1000+nGuanQia)/1000 | T212: 19320/60*nMin*(1000+nGuanQia)/1000 | U212: 喽啰 | V212: pet_21;pet_201;pet_93;pet_91; | W212: 4 | X212: 5 | Y212: 1,28000,8,0;1,19016,8,0;1,10007,5,0;1,10108,2,0;1,7,9000,0;1,8,9000,0;1,4,1000,0; | Z212: 0 | AA212: {} | AB212: n/60
A213: 209 | B213: 209 | C213: 209 | D213: 涅槃试炼 | E213: 10501 | F213: 5 | G213: 3 | H213: 200209 | I213: 0 | J213: 480 | K213: 5000,0; | L213: 5 | M213: 5000,1; | N213: 39240/3600*(nPatrolSec+3)*(1000+nGuanQia)/1000 | O213: 31380/3600*(nPatrolSec+3)*(1000+nGuanQia)/1000 | P213: 19320/3600*(nPatrolSec+3)*(1000+nGuanQia)/1000 | Q213: nGuanQia + 1000 | R213: 39240/60*nMin*(1000+nGuanQia)/1000 | S213: 31380/60*nMin*(1000+nGuanQia)/1000 | T213: 19320/60*nMin*(1000+nGuanQia)/1000 | U213: 喽啰 | V213: pet_21;pet_201;pet_93;pet_91; | W213: 4 | X213: 5 | Y213: 1,28000,8,0;1,19016,8,0;1,10007,5,0;1,10108,2,0;1,7,9000,0;1,8,9000,0;1,4,1000,0; | Z213: 0 | AA213: {} | AB213: n/60
A214: 210 | B214: 210 | C214: 210 | D214: 涅槃试炼 | E214: 10501 | F214: 5 | G214: 3 | H214: 200210 | I214: 0 | J214: 480 | K214: 5000,0; | L214: 5 | M214: 5000,1; | N214: 39240/3600*(nPatrolSec+3)*(1000+nGuanQia)/1000 | O214: 31380/3600*(nPatrolSec+3)*(1000+nGuanQia)/1000 | P214: 19320/3600*(nPatrolSec+3)*(1000+nGuanQia)/1000 | Q214: nGuanQia + 1000 | R214: 39240/60*nMin*(1000+nGuanQia)/1000 | S214: 31380/60*nMin*(1000+nGuanQia)/1000 | T214: 19320/60*nMin*(1000+nGuanQia)/1000 | U214: 喽啰 | V214: pet_21;pet_201;pet_93;pet_91; | W214: 4 | X214: 5 | Y214: 1,28000,8,0;1,19016,8,0;1,10007,5,0;1,10108,2,0;1,7,9000,0;1,8,9000,0;1,4,1000,0; | Z214: 0 | AA214: {} | AB214: n/60
A215: 211 | B215: 211 | C215: 211 | D215: 涅槃试炼 | E215: 10501 | F215: 5 | G215: 3 | H215: 200211 | I215: 0 | J215: 480 | K215: 5000,0; | L215: 5 | M215: 5000,1; | N215: 39240/3600*(nPatrolSec+3)*(1000+nGuanQia)/1000 | O215: 31380/3600*(nPatrolSec+3)*(1000+nGuanQia)/1000 | P215: 19320/3600*(nPatrolSec+3)*(1000+nGuanQia)/1000 | Q215: nGuanQia + 1000 | R215: 39240/60*nMin*(1000+nGuanQia)/1000 | S215: 31380/60*nMin*(1000+nGuanQia)/1000 | T215: 19320/60*nMin*(1000+nGuanQia)/1000 | U215: 喽啰 | V215: pet_21;pet_201;pet_93;pet_91; | W215: 4 | X215: 5 | Y215: 1,28000,8,0;1,19016,8,0;1,10007,5,0;1,10108,2,0;1,7,9000,0;1,8,9000,0;1,4,1000,0; | Z215: 0 | AA215: {} | AB215: n/60
A216: 212 | B216: 212 | C216: 212 | D216: 涅槃试炼 | E216: 10501 | F216: 5 | G216: 3 | H216: 200212 | I216: 0 | J216: 480 | K216: 5000,0; | L216: 5 | M216: 5000,1; | N216: 39240/3600*(nPatrolSec+3)*(1000+nGuanQia)/1000 | O216: 31380/3600*(nPatrolSec+3)*(1000+nGuanQia)/1000 | P216: 19320/3600*(nPatrolSec+3)*(1000+nGuanQia)/1000 | Q216: nGuanQia + 1000 | R216: 39240/60*nMin*(1000+nGuanQia)/1000 | S216: 31380/60*nMin*(1000+nGuanQia)/1000 | T216: 19320/60*nMin*(1000+nGuanQia)/1000 | U216: 喽啰 | V216: pet_21;pet_201;pet_93;pet_91; | W216: 4 | X216: 5 | Y216: 1,28000,8,0;1,19016,8,0;1,10007,5,0;1,10108,2,0;1,7,9000,0;1,8,9000,0;1,4,1000,0; | Z216: 0 | AA216: {} | AB216: n/60
A217: 213 | B217: 213 | C217: 213 | D217: 涅槃试炼 | E217: 10501 | F217: 5 | G217: 3 | H217: 200213 | I217: 0 | J217: 480 | K217: 5000,0; | L217: 5 | M217: 5000,1; | N217: 39240/3600*(nPatrolSec+3)*(1000+nGuanQia)/1000 | O217: 31380/3600*(nPatrolSec+3)*(1000+nGuanQia)/1000 | P217: 19320/3600*(nPatrolSec+3)*(1000+nGuanQia)/1000 | Q217: nGuanQia + 1000 | R217: 39240/60*nMin*(1000+nGuanQia)/1000 | S217: 31380/60*nMin*(1000+nGuanQia)/1000 | T217: 19320/60*nMin*(1000+nGuanQia)/1000 | U217: 喽啰 | V217: pet_21;pet_201;pet_93;pet_91; | W217: 4 | X217: 5 | Y217: 1,28000,8,0;1,19016,8,0;1,10007,5,0;1,10108,2,0;1,7,9000,0;1,8,9000,0;1,4,1000,0; | Z217: 0 | AA217: {} | AB217: n/60
A218: 214 | B218: 214 | C218: 214 | D218: 涅槃试炼 | E218: 10501 | F218: 5 | G218: 3 | H218: 200214 | I218: 0 | J218: 480 | K218: 5000,0; | L218: 5 | M218: 5000,1; | N218: 39240/3600*(nPatrolSec+3)*(1000+nGuanQia)/1000 | O218: 31380/3600*(nPatrolSec+3)*(1000+nGuanQia)/1000 | P218: 19320/3600*(nPatrolSec+3)*(1000+nGuanQia)/1000 | Q218: nGuanQia + 1000 | R218: 39240/60*nMin*(1000+nGuanQia)/1000 | S218: 31380/60*nMin*(1000+nGuanQia)/1000 | T218: 19320/60*nMin*(1000+nGuanQia)/1000 | U218: 喽啰 | V218: pet_21;pet_201;pet_93;pet_91; | W218: 4 | X218: 5 | Y218: 1,28000,8,0;1,19016,8,0;1,10007,5,0;1,10108,2,0;1,7,9000,0;1,8,9000,0;1,4,1000,0; | Z218: 0 | AA218: {} | AB218: n/60
A219: 215 | B219: 215 | C219: 215 | D219: 涅槃试炼 | E219: 10501 | F219: 5 | G219: 3 | H219: 200215 | I219: 0 | J219: 480 | K219: 5000,0; | L219: 5 | M219: 5000,1; | N219: 39240/3600*(nPatrolSec+3)*(1000+nGuanQia)/1000 | O219: 31380/3600*(nPatrolSec+3)*(1000+nGuanQia)/1000 | P219: 19320/3600*(nPatrolSec+3)*(1000+nGuanQia)/1000 | Q219: nGuanQia + 1000 | R219: 39240/60*nMin*(1000+nGuanQia)/1000 | S219: 31380/60*nMin*(1000+nGuanQia)/1000 | T219: 19320/60*nMin*(1000+nGuanQia)/1000 | U219: 喽啰 | V219: pet_21;pet_201;pet_93;pet_91; | W219: 4 | X219: 5 | Y219: 1,28000,8,0;1,19016,8,0;1,10007,5,0;1,10108,2,0;1,7,9000,0;1,8,9000,0;1,4,1000,0; | Z219: 0 | AA219: {} | AB219: n/60
A220: 216 | B220: 216 | C220: 216 | D220: 涅槃试炼 | E220: 10501 | F220: 5 | G220: 3 | H220: 200216 | I220: 0 | J220: 480 | K220: 5000,0; | L220: 5 | M220: 5000,1; | N220: 39240/3600*(nPatrolSec+3)*(1000+nGuanQia)/1000 | O220: 31380/3600*(nPatrolSec+3)*(1000+nGuanQia)/1000 | P220: 19320/3600*(nPatrolSec+3)*(1000+nGuanQia)/1000 | Q220: nGuanQia + 1000 | R220: 39240/60*nMin*(1000+nGuanQia)/1000 | S220: 31380/60*nMin*(1000+nGuanQia)/1000 | T220: 19320/60*nMin*(1000+nGuanQia)/1000 | U220: 喽啰 | V220: pet_21;pet_201;pet_93;pet_91; | W220: 4 | X220: 5 | Y220: 1,28000,8,0;1,19016,8,0;1,10007,5,0;1,10108,2,0;1,7,9000,0;1,8,9000,0;1,4,1000,0; | Z220: 0 | AA220: {} | AB220: n/60
A221: 217 | B221: 217 | C221: 217 | D221: 涅槃试炼 | E221: 10501 | F221: 5 | G221: 3 | H221: 200217 | I221: 0 | J221: 480 | K221: 5000,0; | L221: 5 | M221: 5000,1; | N221: 39240/3600*(nPatrolSec+3)*(1000+nGuanQia)/1000 | O221: 31380/3600*(nPatrolSec+3)*(1000+nGuanQia)/1000 | P221: 19320/3600*(nPatrolSec+3)*(1000+nGuanQia)/1000 | Q221: nGuanQia + 1000 | R221: 39240/60*nMin*(1000+nGuanQia)/1000 | S221: 31380/60*nMin*(1000+nGuanQia)/1000 | T221: 19320/60*nMin*(1000+nGuanQia)/1000 | U221: 喽啰 | V221: pet_21;pet_201;pet_93;pet_91; | W221: 4 | X221: 5 | Y221: 1,28000,8,0;1,19016,8,0;1,10007,5,0;1,10108,2,0;1,7,9000,0;1,8,9000,0;1,4,1000,0; | Z221: 0 | AA221: {} | AB221: n/60
A222: 218 | B222: 218 | C222: 218 | D222: 涅槃试炼 | E222: 10501 | F222: 5 | G222: 3 | H222: 200218 | I222: 0 | J222: 480 | K222: 5000,0; | L222: 5 | M222: 5000,1; | N222: 39240/3600*(nPatrolSec+3)*(1000+nGuanQia)/1000 | O222: 31380/3600*(nPatrolSec+3)*(1000+nGuanQia)/1000 | P222: 19320/3600*(nPatrolSec+3)*(1000+nGuanQia)/1000 | Q222: nGuanQia + 1000 | R222: 39240/60*nMin*(1000+nGuanQia)/1000 | S222: 31380/60*nMin*(1000+nGuanQia)/1000 | T222: 19320/60*nMin*(1000+nGuanQia)/1000 | U222: 喽啰 | V222: pet_21;pet_201;pet_93;pet_91; | W222: 4 | X222: 5 | Y222: 1,28000,8,0;1,19016,8,0;1,10007,5,0;1,10108,2,0;1,7,9000,0;1,8,9000,0;1,4,1000,0; | Z222: 0 | AA222: {} | AB222: n/60
A223: 219 | B223: 219 | C223: 219 | D223: 涅槃试炼 | E223: 10501 | F223: 5 | G223: 3 | H223: 200219 | I223: 0 | J223: 480 | K223: 5000,0; | L223: 5 | M223: 5000,1; | N223: 39240/3600*(nPatrolSec+3)*(1000+nGuanQia)/1000 | O223: 31380/3600*(nPatrolSec+3)*(1000+nGuanQia)/1000 | P223: 19320/3600*(nPatrolSec+3)*(1000+nGuanQia)/1000 | Q223: nGuanQia + 1000 | R223: 39240/60*nMin*(1000+nGuanQia)/1000 | S223: 31380/60*nMin*(1000+nGuanQia)/1000 | T223: 19320/60*nMin*(1000+nGuanQia)/1000 | U223: 喽啰 | V223: pet_21;pet_201;pet_93;pet_91; | W223: 4 | X223: 5 | Y223: 1,28000,8,0;1,19016,8,0;1,10007,5,0;1,10108,2,0;1,7,9000,0;1,8,9000,0;1,4,1000,0; | Z223: 0 | AA223: {} | AB223: n/60
A224: 220 | B224: 220 | C224: 220 | D224: 涅槃试炼 | E224: 10501 | F224: 5 | G224: 3 | H224: 200220 | I224: 0 | J224: 480 | K224: 5000,0; | L224: 5 | M224: 5000,1; | N224: 39240/3600*(nPatrolSec+3)*(1000+nGuanQia)/1000 | O224: 31380/3600*(nPatrolSec+3)*(1000+nGuanQia)/1000 | P224: 19320/3600*(nPatrolSec+3)*(1000+nGuanQia)/1000 | Q224: nGuanQia + 1000 | R224: 39240/60*nMin*(1000+nGuanQia)/1000 | S224: 31380/60*nMin*(1000+nGuanQia)/1000 | T224: 19320/60*nMin*(1000+nGuanQia)/1000 | U224: 喽啰 | V224: pet_21;pet_201;pet_93;pet_91; | W224: 4 | X224: 5 | Y224: 1,28000,8,0;1,19016,8,0;1,10007,5,0;1,10108,2,0;1,7,9000,0;1,8,9000,0;1,4,1000,0; | Z224: 0 | AA224: {} | AB224: n/60
A225: 221 | B225: 221 | C225: 221 | D225: 涅槃试炼 | E225: 10501 | F225: 5 | G225: 3 | H225: 200221 | I225: 0 | J225: 480 | K225: 5000,0; | L225: 5 | M225: 5000,1; | N225: 39240/3600*(nPatrolSec+3)*(1000+nGuanQia)/1000 | O225: 31380/3600*(nPatrolSec+3)*(1000+nGuanQia)/1000 | P225: 19320/3600*(nPatrolSec+3)*(1000+nGuanQia)/1000 | Q225: nGuanQia + 1000 | R225: 39240/60*nMin*(1000+nGuanQia)/1000 | S225: 31380/60*nMin*(1000+nGuanQia)/1000 | T225: 19320/60*nMin*(1000+nGuanQia)/1000 | U225: 喽啰 | V225: pet_21;pet_201;pet_93;pet_91; | W225: 4 | X225: 5 | Y225: 1,28000,8,0;1,19016,8,0;1,10007,5,0;1,10108,2,0;1,7,9000,0;1,8,9000,0;1,4,1000,0; | Z225: 0 | AA225: {} | AB225: n/60
A226: 222 | B226: 222 | C226: 222 | D226: 涅槃试炼 | E226: 10501 | F226: 5 | G226: 3 | H226: 200222 | I226: 0 | J226: 480 | K226: 5000,0; | L226: 5 | M226: 5000,1; | N226: 39240/3600*(nPatrolSec+3)*(1000+nGuanQia)/1000 | O226: 31380/3600*(nPatrolSec+3)*(1000+nGuanQia)/1000 | P226: 19320/3600*(nPatrolSec+3)*(1000+nGuanQia)/1000 | Q226: nGuanQia + 1000 | R226: 39240/60*nMin*(1000+nGuanQia)/1000 | S226: 31380/60*nMin*(1000+nGuanQia)/1000 | T226: 19320/60*nMin*(1000+nGuanQia)/1000 | U226: 喽啰 | V226: pet_21;pet_201;pet_93;pet_91; | W226: 4 | X226: 5 | Y226: 1,28000,8,0;1,19016,8,0;1,10007,5,0;1,10108,2,0;1,7,9000,0;1,8,9000,0;1,4,1000,0; | Z226: 0 | AA226: {} | AB226: n/60
A227: 223 | B227: 223 | C227: 223 | D227: 涅槃试炼 | E227: 10501 | F227: 5 | G227: 3 | H227: 200223 | I227: 0 | J227: 480 | K227: 5000,0; | L227: 5 | M227: 5000,1; | N227: 39240/3600*(nPatrolSec+3)*(1000+nGuanQia)/1000 | O227: 31380/3600*(nPatrolSec+3)*(1000+nGuanQia)/1000 | P227: 19320/3600*(nPatrolSec+3)*(1000+nGuanQia)/1000 | Q227: nGuanQia + 1000 | R227: 39240/60*nMin*(1000+nGuanQia)/1000 | S227: 31380/60*nMin*(1000+nGuanQia)/1000 | T227: 19320/60*nMin*(1000+nGuanQia)/1000 | U227: 喽啰 | V227: pet_21;pet_201;pet_93;pet_91; | W227: 4 | X227: 5 | Y227: 1,28000,8,0;1,19016,8,0;1,10007,5,0;1,10108,2,0;1,7,9000,0;1,8,9000,0;1,4,1000,0; | Z227: 0 | AA227: {} | AB227: n/60
A228: 224 | B228: 224 | C228: 224 | D228: 涅槃试炼 | E228: 10501 | F228: 5 | G228: 3 | H228: 200224 | I228: 0 | J228: 480 | K228: 5000,0; | L228: 5 | M228: 5000,1; | N228: 39240/3600*(nPatrolSec+3)*(1000+nGuanQia)/1000 | O228: 31380/3600*(nPatrolSec+3)*(1000+nGuanQia)/1000 | P228: 19320/3600*(nPatrolSec+3)*(1000+nGuanQia)/1000 | Q228: nGuanQia + 1000 | R228: 39240/60*nMin*(1000+nGuanQia)/1000 | S228: 31380/60*nMin*(1000+nGuanQia)/1000 | T228: 19320/60*nMin*(1000+nGuanQia)/1000 | U228: 喽啰 | V228: pet_21;pet_201;pet_93;pet_91; | W228: 4 | X228: 5 | Y228: 1,28000,8,0;1,19016,8,0;1,10007,5,0;1,10108,2,0;1,7,9000,0;1,8,9000,0;1,4,1000,0; | Z228: 0 | AA228: {} | AB228: n/60
A229: 225 | B229: 225 | C229: 225 | D229: 涅槃试炼 | E229: 10501 | F229: 5 | G229: 3 | H229: 200225 | I229: 0 | J229: 480 | K229: 5000,0; | L229: 5 | M229: 5000,1; | N229: 39240/3600*(nPatrolSec+3)*(1000+nGuanQia)/1000 | O229: 31380/3600*(nPatrolSec+3)*(1000+nGuanQia)/1000 | P229: 19320/3600*(nPatrolSec+3)*(1000+nGuanQia)/1000 | Q229: nGuanQia + 1000 | R229: 39240/60*nMin*(1000+nGuanQia)/1000 | S229: 31380/60*nMin*(1000+nGuanQia)/1000 | T229: 19320/60*nMin*(1000+nGuanQia)/1000 | U229: 喽啰 | V229: pet_21;pet_201;pet_93;pet_91; | W229: 4 | X229: 5 | Y229: 1,28000,8,0;1,19016,8,0;1,10007,5,0;1,10108,2,0;1,7,9000,0;1,8,9000,0;1,4,1000,0; | Z229: 0 | AA229: {} | AB229: n/60
A230: 226 | B230: 226 | C230: 226 | D230: 涅槃试炼 | E230: 10501 | F230: 5 | G230: 3 | H230: 200226 | I230: 0 | J230: 480 | K230: 5000,0; | L230: 5 | M230: 5000,1; | N230: 39240/3600*(nPatrolSec+3)*(1000+nGuanQia)/1000 | O230: 31380/3600*(nPatrolSec+3)*(1000+nGuanQia)/1000 | P230: 19320/3600*(nPatrolSec+3)*(1000+nGuanQia)/1000 | Q230: nGuanQia + 1000 | R230: 39240/60*nMin*(1000+nGuanQia)/1000 | S230: 31380/60*nMin*(1000+nGuanQia)/1000 | T230: 19320/60*nMin*(1000+nGuanQia)/1000 | U230: 喽啰 | V230: pet_21;pet_201;pet_93;pet_91; | W230: 4 | X230: 5 | Y230: 1,28000,8,0;1,19016,8,0;1,10007,5,0;1,10108,2,0;1,7,9000,0;1,8,9000,0;1,4,1000,0; | Z230: 0 | AA230: {} | AB230: n/60
A231: 227 | B231: 227 | C231: 227 | D231: 涅槃试炼 | E231: 10501 | F231: 5 | G231: 3 | H231: 200227 | I231: 0 | J231: 480 | K231: 5000,0; | L231: 5 | M231: 5000,1; | N231: 39240/3600*(nPatrolSec+3)*(1000+nGuanQia)/1000 | O231: 31380/3600*(nPatrolSec+3)*(1000+nGuanQia)/1000 | P231: 19320/3600*(nPatrolSec+3)*(1000+nGuanQia)/1000 | Q231: nGuanQia + 1000 | R231: 39240/60*nMin*(1000+nGuanQia)/1000 | S231: 31380/60*nMin*(1000+nGuanQia)/1000 | T231: 19320/60*nMin*(1000+nGuanQia)/1000 | U231: 喽啰 | V231: pet_21;pet_201;pet_93;pet_91; | W231: 4 | X231: 5 | Y231: 1,28000,8,0;1,19016,8,0;1,10007,5,0;1,10108,2,0;1,7,9000,0;1,8,9000,0;1,4,1000,0; | Z231: 0 | AA231: {} | AB231: n/60
A232: 228 | B232: 228 | C232: 228 | D232: 涅槃试炼 | E232: 10501 | F232: 5 | G232: 3 | H232: 200228 | I232: 0 | J232: 480 | K232: 5000,0; | L232: 5 | M232: 5000,1; | N232: 39240/3600*(nPatrolSec+3)*(1000+nGuanQia)/1000 | O232: 31380/3600*(nPatrolSec+3)*(1000+nGuanQia)/1000 | P232: 19320/3600*(nPatrolSec+3)*(1000+nGuanQia)/1000 | Q232: nGuanQia + 1000 | R232: 39240/60*nMin*(1000+nGuanQia)/1000 | S232: 31380/60*nMin*(1000+nGuanQia)/1000 | T232: 19320/60*nMin*(1000+nGuanQia)/1000 | U232: 喽啰 | V232: pet_21;pet_201;pet_93;pet_91; | W232: 4 | X232: 5 | Y232: 1,28000,8,0;1,19016,8,0;1,10007,5,0;1,10108,2,0;1,7,9000,0;1,8,9000,0;1,4,1000,0; | Z232: 0 | AA232: {} | AB232: n/60
A233: 229 | B233: 229 | C233: 229 | D233: 涅槃试炼 | E233: 10501 | F233: 5 | G233: 3 | H233: 200229 | I233: 0 | J233: 480 | K233: 5000,0; | L233: 5 | M233: 5000,1; | N233: 39240/3600*(nPatrolSec+3)*(1000+nGuanQia)/1000 | O233: 31380/3600*(nPatrolSec+3)*(1000+nGuanQia)/1000 | P233: 19320/3600*(nPatrolSec+3)*(1000+nGuanQia)/1000 | Q233: nGuanQia + 1000 | R233: 39240/60*nMin*(1000+nGuanQia)/1000 | S233: 31380/60*nMin*(1000+nGuanQia)/1000 | T233: 19320/60*nMin*(1000+nGuanQia)/1000 | U233: 喽啰 | V233: pet_21;pet_201;pet_93;pet_91; | W233: 4 | X233: 5 | Y233: 1,28000,8,0;1,19016,8,0;1,10007,5,0;1,10108,2,0;1,7,9000,0;1,8,9000,0;1,4,1000,0; | Z233: 0 | AA233: {} | AB233: n/60
A234: 230 | B234: 230 | C234: 230 | D234: 涅槃试炼 | E234: 10501 | F234: 5 | G234: 3 | H234: 200230 | I234: 0 | J234: 480 | K234: 5000,0; | L234: 5 | M234: 5000,1; | N234: 39240/3600*(nPatrolSec+3)*(1000+nGuanQia)/1000 | O234: 31380/3600*(nPatrolSec+3)*(1000+nGuanQia)/1000 | P234: 19320/3600*(nPatrolSec+3)*(1000+nGuanQia)/1000 | Q234: nGuanQia + 1000 | R234: 39240/60*nMin*(1000+nGuanQia)/1000 | S234: 31380/60*nMin*(1000+nGuanQia)/1000 | T234: 19320/60*nMin*(1000+nGuanQia)/1000 | U234: 喽啰 | V234: pet_21;pet_201;pet_93;pet_91; | W234: 4 | X234: 5 | Y234: 1,28000,8,0;1,19016,8,0;1,10007,5,0;1,10108,2,0;1,7,9000,0;1,8,9000,0;1,4,1000,0; | Z234: 0 | AA234: {} | AB234: n/60
A235: 231 | B235: 231 | C235: 231 | D235: 涅槃试炼 | E235: 10501 | F235: 5 | G235: 3 | H235: 200231 | I235: 0 | J235: 480 | K235: 5000,0; | L235: 5 | M235: 5000,1; | N235: 39240/3600*(nPatrolSec+3)*(1000+nGuanQia)/1000 | O235: 31380/3600*(nPatrolSec+3)*(1000+nGuanQia)/1000 | P235: 19320/3600*(nPatrolSec+3)*(1000+nGuanQia)/1000 | Q235: nGuanQia + 1000 | R235: 39240/60*nMin*(1000+nGuanQia)/1000 | S235: 31380/60*nMin*(1000+nGuanQia)/1000 | T235: 19320/60*nMin*(1000+nGuanQia)/1000 | U235: 喽啰 | V235: pet_21;pet_201;pet_93;pet_91; | W235: 4 | X235: 5 | Y235: 1,28000,8,0;1,19016,8,0;1,10007,5,0;1,10108,2,0;1,7,9000,0;1,8,9000,0;1,4,1000,0; | Z235: 0 | AA235: {} | AB235: n/60
A236: 232 | B236: 232 | C236: 232 | D236: 涅槃试炼 | E236: 10501 | F236: 5 | G236: 3 | H236: 200232 | I236: 0 | J236: 480 | K236: 5000,0; | L236: 5 | M236: 5000,1; | N236: 39240/3600*(nPatrolSec+3)*(1000+nGuanQia)/1000 | O236: 31380/3600*(nPatrolSec+3)*(1000+nGuanQia)/1000 | P236: 19320/3600*(nPatrolSec+3)*(1000+nGuanQia)/1000 | Q236: nGuanQia + 1000 | R236: 39240/60*nMin*(1000+nGuanQia)/1000 | S236: 31380/60*nMin*(1000+nGuanQia)/1000 | T236: 19320/60*nMin*(1000+nGuanQia)/1000 | U236: 喽啰 | V236: pet_21;pet_201;pet_93;pet_91; | W236: 4 | X236: 5 | Y236: 1,28000,8,0;1,19016,8,0;1,10007,5,0;1,10108,2,0;1,7,9000,0;1,8,9000,0;1,4,1000,0; | Z236: 0 | AA236: {} | AB236: n/60
A237: 233 | B237: 233 | C237: 233 | D237: 涅槃试炼 | E237: 10501 | F237: 5 | G237: 3 | H237: 200233 | I237: 0 | J237: 480 | K237: 5000,0; | L237: 5 | M237: 5000,1; | N237: 39240/3600*(nPatrolSec+3)*(1000+nGuanQia)/1000 | O237: 31380/3600*(nPatrolSec+3)*(1000+nGuanQia)/1000 | P237: 19320/3600*(nPatrolSec+3)*(1000+nGuanQia)/1000 | Q237: nGuanQia + 1000 | R237: 39240/60*nMin*(1000+nGuanQia)/1000 | S237: 31380/60*nMin*(1000+nGuanQia)/1000 | T237: 19320/60*nMin*(1000+nGuanQia)/1000 | U237: 喽啰 | V237: pet_21;pet_201;pet_93;pet_91; | W237: 4 | X237: 5 | Y237: 1,28000,8,0;1,19016,8,0;1,10007,5,0;1,10108,2,0;1,7,9000,0;1,8,9000,0;1,4,1000,0; | Z237: 0 | AA237: {} | AB237: n/60
A238: 234 | B238: 234 | C238: 234 | D238: 涅槃试炼 | E238: 10501 | F238: 5 | G238: 3 | H238: 200234 | I238: 0 | J238: 480 | K238: 5000,0; | L238: 5 | M238: 5000,1; | N238: 39240/3600*(nPatrolSec+3)*(1000+nGuanQia)/1000 | O238: 31380/3600*(nPatrolSec+3)*(1000+nGuanQia)/1000 | P238: 19320/3600*(nPatrolSec+3)*(1000+nGuanQia)/1000 | Q238: nGuanQia + 1000 | R238: 39240/60*nMin*(1000+nGuanQia)/1000 | S238: 31380/60*nMin*(1000+nGuanQia)/1000 | T238: 19320/60*nMin*(1000+nGuanQia)/1000 | U238: 喽啰 | V238: pet_21;pet_201;pet_93;pet_91; | W238: 4 | X238: 5 | Y238: 1,28000,8,0;1,19016,8,0;1,10007,5,0;1,10108,2,0;1,7,9000,0;1,8,9000,0;1,4,1000,0; | Z238: 0 | AA238: {} | AB238: n/60
A239: 235 | B239: 235 | C239: 235 | D239: 涅槃试炼 | E239: 10501 | F239: 5 | G239: 3 | H239: 200235 | I239: 0 | J239: 480 | K239: 5000,0; | L239: 5 | M239: 5000,1; | N239: 39240/3600*(nPatrolSec+3)*(1000+nGuanQia)/1000 | O239: 31380/3600*(nPatrolSec+3)*(1000+nGuanQia)/1000 | P239: 19320/3600*(nPatrolSec+3)*(1000+nGuanQia)/1000 | Q239: nGuanQia + 1000 | R239: 39240/60*nMin*(1000+nGuanQia)/1000 | S239: 31380/60*nMin*(1000+nGuanQia)/1000 | T239: 19320/60*nMin*(1000+nGuanQia)/1000 | U239: 喽啰 | V239: pet_21;pet_201;pet_93;pet_91; | W239: 4 | X239: 5 | Y239: 1,28000,8,0;1,19016,8,0;1,10007,5,0;1,10108,2,0;1,7,9000,0;1,8,9000,0;1,4,1000,0; | Z239: 0 | AA239: {} | AB239: n/60
A240: 236 | B240: 236 | C240: 236 | D240: 涅槃试炼 | E240: 10501 | F240: 5 | G240: 3 | H240: 200236 | I240: 0 | J240: 480 | K240: 5000,0; | L240: 5 | M240: 5000,1; | N240: 39240/3600*(nPatrolSec+3)*(1000+nGuanQia)/1000 | O240: 31380/3600*(nPatrolSec+3)*(1000+nGuanQia)/1000 | P240: 19320/3600*(nPatrolSec+3)*(1000+nGuanQia)/1000 | Q240: nGuanQia + 1000 | R240: 39240/60*nMin*(1000+nGuanQia)/1000 | S240: 31380/60*nMin*(1000+nGuanQia)/1000 | T240: 19320/60*nMin*(1000+nGuanQia)/1000 | U240: 喽啰 | V240: pet_21;pet_201;pet_93;pet_91; | W240: 4 | X240: 5 | Y240: 1,28000,8,0;1,19016,8,0;1,10007,5,0;1,10108,2,0;1,7,9000,0;1,8,9000,0;1,4,1000,0; | Z240: 0 | AA240: {} | AB240: n/60
A241: 237 | B241: 237 | C241: 237 | D241: 涅槃试炼 | E241: 10501 | F241: 5 | G241: 3 | H241: 200237 | I241: 0 | J241: 480 | K241: 5000,0; | L241: 5 | M241: 5000,1; | N241: 39240/3600*(nPatrolSec+3)*(1000+nGuanQia)/1000 | O241: 31380/3600*(nPatrolSec+3)*(1000+nGuanQia)/1000 | P241: 19320/3600*(nPatrolSec+3)*(1000+nGuanQia)/1000 | Q241: nGuanQia + 1000 | R241: 39240/60*nMin*(1000+nGuanQia)/1000 | S241: 31380/60*nMin*(1000+nGuanQia)/1000 | T241: 19320/60*nMin*(1000+nGuanQia)/1000 | U241: 喽啰 | V241: pet_21;pet_201;pet_93;pet_91; | W241: 4 | X241: 5 | Y241: 1,28000,8,0;1,19016,8,0;1,10007,5,0;1,10108,2,0;1,7,9000,0;1,8,9000,0;1,4,1000,0; | Z241: 0 | AA241: {} | AB241: n/60
A242: 238 | B242: 238 | C242: 238 | D242: 涅槃试炼 | E242: 10501 | F242: 5 | G242: 3 | H242: 200238 | I242: 0 | J242: 480 | K242: 5000,0; | L242: 5 | M242: 5000,1; | N242: 39240/3600*(nPatrolSec+3)*(1000+nGuanQia)/1000 | O242: 31380/3600*(nPatrolSec+3)*(1000+nGuanQia)/1000 | P242: 19320/3600*(nPatrolSec+3)*(1000+nGuanQia)/1000 | Q242: nGuanQia + 1000 | R242: 39240/60*nMin*(1000+nGuanQia)/1000 | S242: 31380/60*nMin*(1000+nGuanQia)/1000 | T242: 19320/60*nMin*(1000+nGuanQia)/1000 | U242: 喽啰 | V242: pet_21;pet_201;pet_93;pet_91; | W242: 4 | X242: 5 | Y242: 1,28000,8,0;1,19016,8,0;1,10007,5,0;1,10108,2,0;1,7,9000,0;1,8,9000,0;1,4,1000,0; | Z242: 0 | AA242: {} | AB242: n/60
A243: 239 | B243: 239 | C243: 239 | D243: 涅槃试炼 | E243: 10501 | F243: 5 | G243: 3 | H243: 200239 | I243: 0 | J243: 480 | K243: 5000,0; | L243: 5 | M243: 5000,1; | N243: 39240/3600*(nPatrolSec+3)*(1000+nGuanQia)/1000 | O243: 31380/3600*(nPatrolSec+3)*(1000+nGuanQia)/1000 | P243: 19320/3600*(nPatrolSec+3)*(1000+nGuanQia)/1000 | Q243: nGuanQia + 1000 | R243: 39240/60*nMin*(1000+nGuanQia)/1000 | S243: 31380/60*nMin*(1000+nGuanQia)/1000 | T243: 19320/60*nMin*(1000+nGuanQia)/1000 | U243: 喽啰 | V243: pet_21;pet_201;pet_93;pet_91; | W243: 4 | X243: 5 | Y243: 1,28000,8,0;1,19016,8,0;1,10007,5,0;1,10108,2,0;1,7,9000,0;1,8,9000,0;1,4,1000,0; | Z243: 0 | AA243: {} | AB243: n/60
A244: 240 | B244: 240 | C244: 240 | D244: 涅槃试炼 | E244: 10501 | F244: 5 | G244: 3 | H244: 200240 | I244: 0 | J244: 480 | K244: 5000,0; | L244: 5 | M244: 5000,1; | N244: 39240/3600*(nPatrolSec+3)*(1000+nGuanQia)/1000 | O244: 31380/3600*(nPatrolSec+3)*(1000+nGuanQia)/1000 | P244: 19320/3600*(nPatrolSec+3)*(1000+nGuanQia)/1000 | Q244: nGuanQia + 1000 | R244: 39240/60*nMin*(1000+nGuanQia)/1000 | S244: 31380/60*nMin*(1000+nGuanQia)/1000 | T244: 19320/60*nMin*(1000+nGuanQia)/1000 | U244: 喽啰 | V244: pet_21;pet_201;pet_93;pet_91; | W244: 4 | X244: 5 | Y244: 1,28000,8,0;1,19016,8,0;1,10007,5,0;1,10108,2,0;1,7,9000,0;1,8,9000,0;1,4,1000,0; | Z244: 0 | AA244: {} | AB244: n/60
A245: 241 | B245: 241 | C245: 241 | D245: 涅槃试炼 | E245: 10501 | F245: 5 | G245: 3 | H245: 200241 | I245: 0 | J245: 480 | K245: 5000,0; | L245: 5 | M245: 5000,1; | N245: 39240/3600*(nPatrolSec+3)*(1000+nGuanQia)/1000 | O245: 31380/3600*(nPatrolSec+3)*(1000+nGuanQia)/1000 | P245: 19320/3600*(nPatrolSec+3)*(1000+nGuanQia)/1000 | Q245: nGuanQia + 1000 | R245: 39240/60*nMin*(1000+nGuanQia)/1000 | S245: 31380/60*nMin*(1000+nGuanQia)/1000 | T245: 19320/60*nMin*(1000+nGuanQia)/1000 | U245: 喽啰 | V245: pet_21;pet_201;pet_93;pet_91; | W245: 4 | X245: 5 | Y245: 1,28000,8,0;1,19016,8,0;1,10007,5,0;1,10108,2,0;1,7,9000,0;1,8,9000,0;1,4,1000,0; | Z245: 0 | AA245: {} | AB245: n/60
A246: 242 | B246: 242 | C246: 242 | D246: 涅槃试炼 | E246: 10501 | F246: 5 | G246: 3 | H246: 200242 | I246: 0 | J246: 480 | K246: 5000,0; | L246: 5 | M246: 5000,1; | N246: 39240/3600*(nPatrolSec+3)*(1000+nGuanQia)/1000 | O246: 31380/3600*(nPatrolSec+3)*(1000+nGuanQia)/1000 | P246: 19320/3600*(nPatrolSec+3)*(1000+nGuanQia)/1000 | Q246: nGuanQia + 1000 | R246: 39240/60*nMin*(1000+nGuanQia)/1000 | S246: 31380/60*nMin*(1000+nGuanQia)/1000 | T246: 19320/60*nMin*(1000+nGuanQia)/1000 | U246: 喽啰 | V246: pet_21;pet_201;pet_93;pet_91; | W246: 4 | X246: 5 | Y246: 1,28000,8,0;1,19016,8,0;1,10007,5,0;1,10108,2,0;1,7,9000,0;1,8,9000,0;1,4,1000,0; | Z246: 0 | AA246: {} | AB246: n/60
A247: 243 | B247: 243 | C247: 243 | D247: 涅槃试炼 | E247: 10501 | F247: 5 | G247: 3 | H247: 200243 | I247: 0 | J247: 480 | K247: 5000,0; | L247: 5 | M247: 5000,1; | N247: 39240/3600*(nPatrolSec+3)*(1000+nGuanQia)/1000 | O247: 31380/3600*(nPatrolSec+3)*(1000+nGuanQia)/1000 | P247: 19320/3600*(nPatrolSec+3)*(1000+nGuanQia)/1000 | Q247: nGuanQia + 1000 | R247: 39240/60*nMin*(1000+nGuanQia)/1000 | S247: 31380/60*nMin*(1000+nGuanQia)/1000 | T247: 19320/60*nMin*(1000+nGuanQia)/1000 | U247: 喽啰 | V247: pet_21;pet_201;pet_93;pet_91; | W247: 4 | X247: 5 | Y247: 1,28000,8,0;1,19016,8,0;1,10007,5,0;1,10108,2,0;1,7,9000,0;1,8,9000,0;1,4,1000,0; | Z247: 0 | AA247: {} | AB247: n/60
A248: 244 | B248: 244 | C248: 244 | D248: 涅槃试炼 | E248: 10501 | F248: 5 | G248: 3 | H248: 200244 | I248: 0 | J248: 480 | K248: 5000,0; | L248: 5 | M248: 5000,1; | N248: 39240/3600*(nPatrolSec+3)*(1000+nGuanQia)/1000 | O248: 31380/3600*(nPatrolSec+3)*(1000+nGuanQia)/1000 | P248: 19320/3600*(nPatrolSec+3)*(1000+nGuanQia)/1000 | Q248: nGuanQia + 1000 | R248: 39240/60*nMin*(1000+nGuanQia)/1000 | S248: 31380/60*nMin*(1000+nGuanQia)/1000 | T248: 19320/60*nMin*(1000+nGuanQia)/1000 | U248: 喽啰 | V248: pet_21;pet_201;pet_93;pet_91; | W248: 4 | X248: 5 | Y248: 1,28000,8,0;1,19016,8,0;1,10007,5,0;1,10108,2,0;1,7,9000,0;1,8,9000,0;1,4,1000,0; | Z248: 0 | AA248: {} | AB248: n/60
A249: 245 | B249: 245 | C249: 245 | D249: 涅槃试炼 | E249: 10501 | F249: 5 | G249: 3 | H249: 200245 | I249: 0 | J249: 480 | K249: 5000,0; | L249: 5 | M249: 5000,1; | N249: 39240/3600*(nPatrolSec+3)*(1000+nGuanQia)/1000 | O249: 31380/3600*(nPatrolSec+3)*(1000+nGuanQia)/1000 | P249: 19320/3600*(nPatrolSec+3)*(1000+nGuanQia)/1000 | Q249: nGuanQia + 1000 | R249: 39240/60*nMin*(1000+nGuanQia)/1000 | S249: 31380/60*nMin*(1000+nGuanQia)/1000 | T249: 19320/60*nMin*(1000+nGuanQia)/1000 | U249: 喽啰 | V249: pet_21;pet_201;pet_93;pet_91; | W249: 4 | X249: 5 | Y249: 1,28000,8,0;1,19016,8,0;1,10007,5,0;1,10108,2,0;1,7,9000,0;1,8,9000,0;1,4,1000,0; | Z249: 0 | AA249: {} | AB249: n/60
A250: 246 | B250: 246 | C250: 246 | D250: 涅槃试炼 | E250: 10501 | F250: 5 | G250: 3 | H250: 200246 | I250: 0 | J250: 480 | K250: 5000,0; | L250: 5 | M250: 5000,1; | N250: 39240/3600*(nPatrolSec+3)*(1000+nGuanQia)/1000 | O250: 31380/3600*(nPatrolSec+3)*(1000+nGuanQia)/1000 | P250: 19320/3600*(nPatrolSec+3)*(1000+nGuanQia)/1000 | Q250: nGuanQia + 1000 | R250: 39240/60*nMin*(1000+nGuanQia)/1000 | S250: 31380/60*nMin*(1000+nGuanQia)/1000 | T250: 19320/60*nMin*(1000+nGuanQia)/1000 | U250: 喽啰 | V250: pet_21;pet_201;pet_93;pet_91; | W250: 4 | X250: 5 | Y250: 1,28000,8,0;1,19016,8,0;1,10007,5,0;1,10108,2,0;1,7,9000,0;1,8,9000,0;1,4,1000,0; | Z250: 0 | AA250: {} | AB250: n/60
A251: 247 | B251: 247 | C251: 247 | D251: 涅槃试炼 | E251: 10501 | F251: 5 | G251: 3 | H251: 200247 | I251: 0 | J251: 480 | K251: 5000,0; | L251: 5 | M251: 5000,1; | N251: 39240/3600*(nPatrolSec+3)*(1000+nGuanQia)/1000 | O251: 31380/3600*(nPatrolSec+3)*(1000+nGuanQia)/1000 | P251: 19320/3600*(nPatrolSec+3)*(1000+nGuanQia)/1000 | Q251: nGuanQia + 1000 | R251: 39240/60*nMin*(1000+nGuanQia)/1000 | S251: 31380/60*nMin*(1000+nGuanQia)/1000 | T251: 19320/60*nMin*(1000+nGuanQia)/1000 | U251: 喽啰 | V251: pet_21;pet_201;pet_93;pet_91; | W251: 4 | X251: 5 | Y251: 1,28000,8,0;1,19016,8,0;1,10007,5,0;1,10108,2,0;1,7,9000,0;1,8,9000,0;1,4,1000,0; | Z251: 0 | AA251: {} | AB251: n/60
A252: 248 | B252: 248 | C252: 248 | D252: 涅槃试炼 | E252: 10501 | F252: 5 | G252: 3 | H252: 200248 | I252: 0 | J252: 480 | K252: 5000,0; | L252: 5 | M252: 5000,1; | N252: 39240/3600*(nPatrolSec+3)*(1000+nGuanQia)/1000 | O252: 31380/3600*(nPatrolSec+3)*(1000+nGuanQia)/1000 | P252: 19320/3600*(nPatrolSec+3)*(1000+nGuanQia)/1000 | Q252: nGuanQia + 1000 | R252: 39240/60*nMin*(1000+nGuanQia)/1000 | S252: 31380/60*nMin*(1000+nGuanQia)/1000 | T252: 19320/60*nMin*(1000+nGuanQia)/1000 | U252: 喽啰 | V252: pet_21;pet_201;pet_93;pet_91; | W252: 4 | X252: 5 | Y252: 1,28000,8,0;1,19016,8,0;1,10007,5,0;1,10108,2,0;1,7,9000,0;1,8,9000,0;1,4,1000,0; | Z252: 0 | AA252: {} | AB252: n/60
A253: 249 | B253: 249 | C253: 249 | D253: 涅槃试炼 | E253: 10501 | F253: 5 | G253: 3 | H253: 200249 | I253: 0 | J253: 480 | K253: 5000,0; | L253: 5 | M253: 5000,1; | N253: 39240/3600*(nPatrolSec+3)*(1000+nGuanQia)/1000 | O253: 31380/3600*(nPatrolSec+3)*(1000+nGuanQia)/1000 | P253: 19320/3600*(nPatrolSec+3)*(1000+nGuanQia)/1000 | Q253: nGuanQia + 1000 | R253: 39240/60*nMin*(1000+nGuanQia)/1000 | S253: 31380/60*nMin*(1000+nGuanQia)/1000 | T253: 19320/60*nMin*(1000+nGuanQia)/1000 | U253: 喽啰 | V253: pet_21;pet_201;pet_93;pet_91; | W253: 4 | X253: 5 | Y253: 1,28000,8,0;1,19016,8,0;1,10007,5,0;1,10108,2,0;1,7,9000,0;1,8,9000,0;1,4,1000,0; | Z253: 0 | AA253: {} | AB253: n/60
A254: 250 | B254: 250 | C254: 250 | D254: 涅槃试炼 | E254: 10501 | F254: 5 | G254: 3 | H254: 200250 | I254: 0 | J254: 480 | K254: 5000,0; | L254: 5 | M254: 5000,1; | N254: 39240/3600*(nPatrolSec+3)*(1000+nGuanQia)/1000 | O254: 31380/3600*(nPatrolSec+3)*(1000+nGuanQia)/1000 | P254: 19320/3600*(nPatrolSec+3)*(1000+nGuanQia)/1000 | Q254: nGuanQia + 1000 | R254: 39240/60*nMin*(1000+nGuanQia)/1000 | S254: 31380/60*nMin*(1000+nGuanQia)/1000 | T254: 19320/60*nMin*(1000+nGuanQia)/1000 | U254: 喽啰 | V254: pet_21;pet_201;pet_93;pet_91; | W254: 4 | X254: 5 | Y254: 1,28000,8,0;1,19016,8,0;1,10007,5,0;1,10108,2,0;1,7,9000,0;1,8,9000,0;1,4,1000,0; | Z254: 0 | AA254: {} | AB254: n/60
A255: 251 | B255: 251 | C255: 251 | D255: 弑神试炼 | E255: 10502 | F255: 5 | G255: 3 | H255: 200251 | I255: 0 | J255: 480 | K255: 5000,0; | L255: 5 | M255: 5000,1; | N255: 39240/3600*(nPatrolSec+3)*(1000+nGuanQia)/1000 | O255: 31380/3600*(nPatrolSec+3)*(1000+nGuanQia)/1000 | P255: 19320/3600*(nPatrolSec+3)*(1000+nGuanQia)/1000 | Q255: nGuanQia + 1000 | R255: 39240/60*nMin*(1000+nGuanQia)/1000 | S255: 31380/60*nMin*(1000+nGuanQia)/1000 | T255: 19320/60*nMin*(1000+nGuanQia)/1000 | U255: 喽啰 | V255: pet_21;pet_201;pet_93;pet_91; | W255: 4 | X255: 5 | Y255: 1,28000,8,0;1,19016,8,0;1,10007,5,0;1,10108,2,0;1,7,9000,0;1,8,9000,0;1,4,1000,0; | Z255: 0 | AA255: {} | AB255: n/60
A256: 252 | B256: 252 | C256: 252 | D256: 弑神试炼 | E256: 10502 | F256: 5 | G256: 3 | H256: 200252 | I256: 0 | J256: 480 | K256: 5000,0; | L256: 5 | M256: 5000,1; | N256: 39240/3600*(nPatrolSec+3)*(1000+nGuanQia)/1000 | O256: 31380/3600*(nPatrolSec+3)*(1000+nGuanQia)/1000 | P256: 19320/3600*(nPatrolSec+3)*(1000+nGuanQia)/1000 | Q256: nGuanQia + 1000 | R256: 39240/60*nMin*(1000+nGuanQia)/1000 | S256: 31380/60*nMin*(1000+nGuanQia)/1000 | T256: 19320/60*nMin*(1000+nGuanQia)/1000 | U256: 喽啰 | V256: pet_21;pet_201;pet_93;pet_91; | W256: 4 | X256: 5 | Y256: 1,28000,8,0;1,19016,8,0;1,10007,5,0;1,10108,2,0;1,7,9000,0;1,8,9000,0;1,4,1000,0; | Z256: 0 | AA256: {} | AB256: n/60
A257: 253 | B257: 253 | C257: 253 | D257: 弑神试炼 | E257: 10502 | F257: 5 | G257: 3 | H257: 200253 | I257: 0 | J257: 480 | K257: 5000,0; | L257: 5 | M257: 5000,1; | N257: 39240/3600*(nPatrolSec+3)*(1000+nGuanQia)/1000 | O257: 31380/3600*(nPatrolSec+3)*(1000+nGuanQia)/1000 | P257: 19320/3600*(nPatrolSec+3)*(1000+nGuanQia)/1000 | Q257: nGuanQia + 1000 | R257: 39240/60*nMin*(1000+nGuanQia)/1000 | S257: 31380/60*nMin*(1000+nGuanQia)/1000 | T257: 19320/60*nMin*(1000+nGuanQia)/1000 | U257: 喽啰 | V257: pet_21;pet_201;pet_93;pet_91; | W257: 4 | X257: 5 | Y257: 1,28000,8,0;1,19016,8,0;1,10007,5,0;1,10108,2,0;1,7,9000,0;1,8,9000,0;1,4,1000,0; | Z257: 0 | AA257: {} | AB257: n/60
A258: 254 | B258: 254 | C258: 254 | D258: 弑神试炼 | E258: 10502 | F258: 5 | G258: 3 | H258: 200254 | I258: 0 | J258: 480 | K258: 5000,0; | L258: 5 | M258: 5000,1; | N258: 39240/3600*(nPatrolSec+3)*(1000+nGuanQia)/1000 | O258: 31380/3600*(nPatrolSec+3)*(1000+nGuanQia)/1000 | P258: 19320/3600*(nPatrolSec+3)*(1000+nGuanQia)/1000 | Q258: nGuanQia + 1000 | R258: 39240/60*nMin*(1000+nGuanQia)/1000 | S258: 31380/60*nMin*(1000+nGuanQia)/1000 | T258: 19320/60*nMin*(1000+nGuanQia)/1000 | U258: 喽啰 | V258: pet_21;pet_201;pet_93;pet_91; | W258: 4 | X258: 5 | Y258: 1,28000,8,0;1,19016,8,0;1,10007,5,0;1,10108,2,0;1,7,9000,0;1,8,9000,0;1,4,1000,0; | Z258: 0 | AA258: {} | AB258: n/60
A259: 255 | B259: 255 | C259: 255 | D259: 弑神试炼 | E259: 10502 | F259: 5 | G259: 3 | H259: 200255 | I259: 0 | J259: 480 | K259: 5000,0; | L259: 5 | M259: 5000,1; | N259: 39240/3600*(nPatrolSec+3)*(1000+nGuanQia)/1000 | O259: 31380/3600*(nPatrolSec+3)*(1000+nGuanQia)/1000 | P259: 19320/3600*(nPatrolSec+3)*(1000+nGuanQia)/1000 | Q259: nGuanQia + 1000 | R259: 39240/60*nMin*(1000+nGuanQia)/1000 | S259: 31380/60*nMin*(1000+nGuanQia)/1000 | T259: 19320/60*nMin*(1000+nGuanQia)/1000 | U259: 喽啰 | V259: pet_21;pet_201;pet_93;pet_91; | W259: 4 | X259: 5 | Y259: 1,28000,8,0;1,19016,8,0;1,10007,5,0;1,10108,2,0;1,7,9000,0;1,8,9000,0;1,4,1000,0; | Z259: 0 | AA259: {} | AB259: n/60
A260: 256 | B260: 256 | C260: 256 | D260: 弑神试炼 | E260: 10502 | F260: 5 | G260: 3 | H260: 200256 | I260: 0 | J260: 480 | K260: 5000,0; | L260: 5 | M260: 5000,1; | N260: 39240/3600*(nPatrolSec+3)*(1000+nGuanQia)/1000 | O260: 31380/3600*(nPatrolSec+3)*(1000+nGuanQia)/1000 | P260: 19320/3600*(nPatrolSec+3)*(1000+nGuanQia)/1000 | Q260: nGuanQia + 1000 | R260: 39240/60*nMin*(1000+nGuanQia)/1000 | S260: 31380/60*nMin*(1000+nGuanQia)/1000 | T260: 19320/60*nMin*(1000+nGuanQia)/1000 | U260: 喽啰 | V260: pet_21;pet_201;pet_93;pet_91; | W260: 4 | X260: 5 | Y260: 1,28000,8,0;1,19016,8,0;1,10007,5,0;1,10108,2,0;1,7,9000,0;1,8,9000,0;1,4,1000,0; | Z260: 0 | AA260: {} | AB260: n/60
A261: 257 | B261: 257 | C261: 257 | D261: 弑神试炼 | E261: 10502 | F261: 5 | G261: 3 | H261: 200257 | I261: 0 | J261: 480 | K261: 5000,0; | L261: 5 | M261: 5000,1; | N261: 39240/3600*(nPatrolSec+3)*(1000+nGuanQia)/1000 | O261: 31380/3600*(nPatrolSec+3)*(1000+nGuanQia)/1000 | P261: 19320/3600*(nPatrolSec+3)*(1000+nGuanQia)/1000 | Q261: nGuanQia + 1000 | R261: 39240/60*nMin*(1000+nGuanQia)/1000 | S261: 31380/60*nMin*(1000+nGuanQia)/1000 | T261: 19320/60*nMin*(1000+nGuanQia)/1000 | U261: 喽啰 | V261: pet_21;pet_201;pet_93;pet_91; | W261: 4 | X261: 5 | Y261: 1,28000,8,0;1,19016,8,0;1,10007,5,0;1,10108,2,0;1,7,9000,0;1,8,9000,0;1,4,1000,0; | Z261: 0 | AA261: {} | AB261: n/60
A262: 258 | B262: 258 | C262: 258 | D262: 弑神试炼 | E262: 10502 | F262: 5 | G262: 3 | H262: 200258 | I262: 0 | J262: 480 | K262: 5000,0; | L262: 5 | M262: 5000,1; | N262: 39240/3600*(nPatrolSec+3)*(1000+nGuanQia)/1000 | O262: 31380/3600*(nPatrolSec+3)*(1000+nGuanQia)/1000 | P262: 19320/3600*(nPatrolSec+3)*(1000+nGuanQia)/1000 | Q262: nGuanQia + 1000 | R262: 39240/60*nMin*(1000+nGuanQia)/1000 | S262: 31380/60*nMin*(1000+nGuanQia)/1000 | T262: 19320/60*nMin*(1000+nGuanQia)/1000 | U262: 喽啰 | V262: pet_21;pet_201;pet_93;pet_91; | W262: 4 | X262: 5 | Y262: 1,28000,8,0;1,19016,8,0;1,10007,5,0;1,10108,2,0;1,7,9000,0;1,8,9000,0;1,4,1000,0; | Z262: 0 | AA262: {} | AB262: n/60
A263: 259 | B263: 259 | C263: 259 | D263: 弑神试炼 | E263: 10502 | F263: 5 | G263: 3 | H263: 200259 | I263: 0 | J263: 480 | K263: 5000,0; | L263: 5 | M263: 5000,1; | N263: 39240/3600*(nPatrolSec+3)*(1000+nGuanQia)/1000 | O263: 31380/3600*(nPatrolSec+3)*(1000+nGuanQia)/1000 | P263: 19320/3600*(nPatrolSec+3)*(1000+nGuanQia)/1000 | Q263: nGuanQia + 1000 | R263: 39240/60*nMin*(1000+nGuanQia)/1000 | S263: 31380/60*nMin*(1000+nGuanQia)/1000 | T263: 19320/60*nMin*(1000+nGuanQia)/1000 | U263: 喽啰 | V263: pet_21;pet_201;pet_93;pet_91; | W263: 4 | X263: 5 | Y263: 1,28000,8,0;1,19016,8,0;1,10007,5,0;1,10108,2,0;1,7,9000,0;1,8,9000,0;1,4,1000,0; | Z263: 0 | AA263: {} | AB263: n/60
A264: 260 | B264: 260 | C264: 260 | D264: 弑神试炼 | E264: 10502 | F264: 5 | G264: 3 | H264: 200260 | I264: 0 | J264: 480 | K264: 5000,0; | L264: 5 | M264: 5000,1; | N264: 39240/3600*(nPatrolSec+3)*(1000+nGuanQia)/1000 | O264: 31380/3600*(nPatrolSec+3)*(1000+nGuanQia)/1000 | P264: 19320/3600*(nPatrolSec+3)*(1000+nGuanQia)/1000 | Q264: nGuanQia + 1000 | R264: 39240/60*nMin*(1000+nGuanQia)/1000 | S264: 31380/60*nMin*(1000+nGuanQia)/1000 | T264: 19320/60*nMin*(1000+nGuanQia)/1000 | U264: 喽啰 | V264: pet_21;pet_201;pet_93;pet_91; | W264: 4 | X264: 5 | Y264: 1,28000,8,0;1,19016,8,0;1,10007,5,0;1,10108,2,0;1,7,9000,0;1,8,9000,0;1,4,1000,0; | Z264: 0 | AA264: {} | AB264: n/60
A265: 261 | B265: 261 | C265: 261 | D265: 弑神试炼 | E265: 10502 | F265: 5 | G265: 3 | H265: 200261 | I265: 0 | J265: 480 | K265: 5000,0; | L265: 5 | M265: 5000,1; | N265: 39240/3600*(nPatrolSec+3)*(1000+nGuanQia)/1000 | O265: 31380/3600*(nPatrolSec+3)*(1000+nGuanQia)/1000 | P265: 19320/3600*(nPatrolSec+3)*(1000+nGuanQia)/1000 | Q265: nGuanQia + 1000 | R265: 39240/60*nMin*(1000+nGuanQia)/1000 | S265: 31380/60*nMin*(1000+nGuanQia)/1000 | T265: 19320/60*nMin*(1000+nGuanQia)/1000 | U265: 喽啰 | V265: pet_21;pet_201;pet_93;pet_91; | W265: 4 | X265: 5 | Y265: 1,28000,8,0;1,19016,8,0;1,10007,5,0;1,10108,2,0;1,7,9000,0;1,8,9000,0;1,4,1000,0; | Z265: 0 | AA265: {} | AB265: n/60
A266: 262 | B266: 262 | C266: 262 | D266: 弑神试炼 | E266: 10502 | F266: 5 | G266: 3 | H266: 200262 | I266: 0 | J266: 480 | K266: 5000,0; | L266: 5 | M266: 5000,1; | N266: 39240/3600*(nPatrolSec+3)*(1000+nGuanQia)/1000 | O266: 31380/3600*(nPatrolSec+3)*(1000+nGuanQia)/1000 | P266: 19320/3600*(nPatrolSec+3)*(1000+nGuanQia)/1000 | Q266: nGuanQia + 1000 | R266: 39240/60*nMin*(1000+nGuanQia)/1000 | S266: 31380/60*nMin*(1000+nGuanQia)/1000 | T266: 19320/60*nMin*(1000+nGuanQia)/1000 | U266: 喽啰 | V266: pet_21;pet_201;pet_93;pet_91; | W266: 4 | X266: 5 | Y266: 1,28000,8,0;1,19016,8,0;1,10007,5,0;1,10108,2,0;1,7,9000,0;1,8,9000,0;1,4,1000,0; | Z266: 0 | AA266: {} | AB266: n/60
A267: 263 | B267: 263 | C267: 263 | D267: 弑神试炼 | E267: 10502 | F267: 5 | G267: 3 | H267: 200263 | I267: 0 | J267: 480 | K267: 5000,0; | L267: 5 | M267: 5000,1; | N267: 39240/3600*(nPatrolSec+3)*(1000+nGuanQia)/1000 | O267: 31380/3600*(nPatrolSec+3)*(1000+nGuanQia)/1000 | P267: 19320/3600*(nPatrolSec+3)*(1000+nGuanQia)/1000 | Q267: nGuanQia + 1000 | R267: 39240/60*nMin*(1000+nGuanQia)/1000 | S267: 31380/60*nMin*(1000+nGuanQia)/1000 | T267: 19320/60*nMin*(1000+nGuanQia)/1000 | U267: 喽啰 | V267: pet_21;pet_201;pet_93;pet_91; | W267: 4 | X267: 5 | Y267: 1,28000,8,0;1,19016,8,0;1,10007,5,0;1,10108,2,0;1,7,9000,0;1,8,9000,0;1,4,1000,0; | Z267: 0 | AA267: {} | AB267: n/60
A268: 264 | B268: 264 | C268: 264 | D268: 弑神试炼 | E268: 10502 | F268: 5 | G268: 3 | H268: 200264 | I268: 0 | J268: 480 | K268: 5000,0; | L268: 5 | M268: 5000,1; | N268: 39240/3600*(nPatrolSec+3)*(1000+nGuanQia)/1000 | O268: 31380/3600*(nPatrolSec+3)*(1000+nGuanQia)/1000 | P268: 19320/3600*(nPatrolSec+3)*(1000+nGuanQia)/1000 | Q268: nGuanQia + 1000 | R268: 39240/60*nMin*(1000+nGuanQia)/1000 | S268: 31380/60*nMin*(1000+nGuanQia)/1000 | T268: 19320/60*nMin*(1000+nGuanQia)/1000 | U268: 喽啰 | V268: pet_21;pet_201;pet_93;pet_91; | W268: 4 | X268: 5 | Y268: 1,28000,8,0;1,19016,8,0;1,10007,5,0;1,10108,2,0;1,7,9000,0;1,8,9000,0;1,4,1000,0; | Z268: 0 | AA268: {} | AB268: n/60
A269: 265 | B269: 265 | C269: 265 | D269: 弑神试炼 | E269: 10503 | F269: 5 | G269: 3 | H269: 200265 | I269: 0 | J269: 480 | K269: 5000,0; | L269: 5 | M269: 5000,1; | N269: 39240/3600*(nPatrolSec+3)*(1000+nGuanQia)/1000 | O269: 31380/3600*(nPatrolSec+3)*(1000+nGuanQia)/1000 | P269: 19320/3600*(nPatrolSec+3)*(1000+nGuanQia)/1000 | Q269: nGuanQia + 1000 | R269: 39240/60*nMin*(1000+nGuanQia)/1000 | S269: 31380/60*nMin*(1000+nGuanQia)/1000 | T269: 19320/60*nMin*(1000+nGuanQia)/1000 | U269: 喽啰 | V269: pet_21;pet_201;pet_93;pet_91; | W269: 4 | X269: 5 | Y269: 1,28000,8,0;1,19016,8,0;1,10007,5,0;1,10108,2,0;1,7,9000,0;1,8,9000,0;1,4,1000,0; | Z269: 0 | AA269: {} | AB269: n/60
A270: 266 | B270: 266 | C270: 266 | D270: 弑神试炼 | E270: 10503 | F270: 5 | G270: 3 | H270: 200266 | I270: 0 | J270: 480 | K270: 5000,0; | L270: 5 | M270: 5000,1; | N270: 39240/3600*(nPatrolSec+3)*(1000+nGuanQia)/1000 | O270: 31380/3600*(nPatrolSec+3)*(1000+nGuanQia)/1000 | P270: 19320/3600*(nPatrolSec+3)*(1000+nGuanQia)/1000 | Q270: nGuanQia + 1000 | R270: 39240/60*nMin*(1000+nGuanQia)/1000 | S270: 31380/60*nMin*(1000+nGuanQia)/1000 | T270: 19320/60*nMin*(1000+nGuanQia)/1000 | U270: 喽啰 | V270: pet_21;pet_201;pet_93;pet_91; | W270: 4 | X270: 5 | Y270: 1,28000,8,0;1,19016,8,0;1,10007,5,0;1,10108,2,0;1,7,9000,0;1,8,9000,0;1,4,1000,0; | Z270: 0 | AA270: {} | AB270: n/60
A271: 267 | B271: 267 | C271: 267 | D271: 弑神试炼 | E271: 10503 | F271: 5 | G271: 3 | H271: 200267 | I271: 0 | J271: 480 | K271: 5000,0; | L271: 5 | M271: 5000,1; | N271: 39240/3600*(nPatrolSec+3)*(1000+nGuanQia)/1000 | O271: 31380/3600*(nPatrolSec+3)*(1000+nGuanQia)/1000 | P271: 19320/3600*(nPatrolSec+3)*(1000+nGuanQia)/1000 | Q271: nGuanQia + 1000 | R271: 39240/60*nMin*(1000+nGuanQia)/1000 | S271: 31380/60*nMin*(1000+nGuanQia)/1000 | T271: 19320/60*nMin*(1000+nGuanQia)/1000 | U271: 喽啰 | V271: pet_21;pet_201;pet_93;pet_91; | W271: 4 | X271: 5 | Y271: 1,28000,8,0;1,19016,8,0;1,10007,5,0;1,10108,2,0;1,7,9000,0;1,8,9000,0;1,4,1000,0; | Z271: 0 | AA271: {} | AB271: n/60
A272: 268 | B272: 268 | C272: 268 | D272: 弑神试炼 | E272: 10503 | F272: 5 | G272: 3 | H272: 200268 | I272: 0 | J272: 480 | K272: 5000,0; | L272: 5 | M272: 5000,1; | N272: 39240/3600*(nPatrolSec+3)*(1000+nGuanQia)/1000 | O272: 31380/3600*(nPatrolSec+3)*(1000+nGuanQia)/1000 | P272: 19320/3600*(nPatrolSec+3)*(1000+nGuanQia)/1000 | Q272: nGuanQia + 1000 | R272: 39240/60*nMin*(1000+nGuanQia)/1000 | S272: 31380/60*nMin*(1000+nGuanQia)/1000 | T272: 19320/60*nMin*(1000+nGuanQia)/1000 | U272: 喽啰 | V272: pet_21;pet_201;pet_93;pet_91; | W272: 4 | X272: 5 | Y272: 1,28000,8,0;1,19016,8,0;1,10007,5,0;1,10108,2,0;1,7,9000,0;1,8,9000,0;1,4,1000,0; | Z272: 0 | AA272: {} | AB272: n/60
A273: 269 | B273: 269 | C273: 269 | D273: 弑神试炼 | E273: 10503 | F273: 5 | G273: 3 | H273: 200269 | I273: 0 | J273: 480 | K273: 5000,0; | L273: 5 | M273: 5000,1; | N273: 39240/3600*(nPatrolSec+3)*(1000+nGuanQia)/1000 | O273: 31380/3600*(nPatrolSec+3)*(1000+nGuanQia)/1000 | P273: 19320/3600*(nPatrolSec+3)*(1000+nGuanQia)/1000 | Q273: nGuanQia + 1000 | R273: 39240/60*nMin*(1000+nGuanQia)/1000 | S273: 31380/60*nMin*(1000+nGuanQia)/1000 | T273: 19320/60*nMin*(1000+nGuanQia)/1000 | U273: 喽啰 | V273: pet_21;pet_201;pet_93;pet_91; | W273: 4 | X273: 5 | Y273: 1,28000,8,0;1,19016,8,0;1,10007,5,0;1,10108,2,0;1,7,9000,0;1,8,9000,0;1,4,1000,0; | Z273: 0 | AA273: {} | AB273: n/60
A274: 270 | B274: 270 | C274: 270 | D274: 弑神试炼 | E274: 10503 | F274: 5 | G274: 3 | H274: 200270 | I274: 0 | J274: 480 | K274: 5000,0; | L274: 5 | M274: 5000,1; | N274: 39240/3600*(nPatrolSec+3)*(1000+nGuanQia)/1000 | O274: 31380/3600*(nPatrolSec+3)*(1000+nGuanQia)/1000 | P274: 19320/3600*(nPatrolSec+3)*(1000+nGuanQia)/1000 | Q274: nGuanQia + 1000 | R274: 39240/60*nMin*(1000+nGuanQia)/1000 | S274: 31380/60*nMin*(1000+nGuanQia)/1000 | T274: 19320/60*nMin*(1000+nGuanQia)/1000 | U274: 喽啰 | V274: pet_21;pet_201;pet_93;pet_91; | W274: 4 | X274: 5 | Y274: 1,28000,8,0;1,19016,8,0;1,10007,5,0;1,10108,2,0;1,7,9000,0;1,8,9000,0;1,4,1000,0; | Z274: 0 | AA274: {} | AB274: n/60
A275: 271 | B275: 271 | C275: 271 | D275: 弑神试炼 | E275: 10503 | F275: 5 | G275: 3 | H275: 200271 | I275: 0 | J275: 480 | K275: 5000,0; | L275: 5 | M275: 5000,1; | N275: 39240/3600*(nPatrolSec+3)*(1000+nGuanQia)/1000 | O275: 31380/3600*(nPatrolSec+3)*(1000+nGuanQia)/1000 | P275: 19320/3600*(nPatrolSec+3)*(1000+nGuanQia)/1000 | Q275: nGuanQia + 1000 | R275: 39240/60*nMin*(1000+nGuanQia)/1000 | S275: 31380/60*nMin*(1000+nGuanQia)/1000 | T275: 19320/60*nMin*(1000+nGuanQia)/1000 | U275: 喽啰 | V275: pet_21;pet_201;pet_93;pet_91; | W275: 4 | X275: 5 | Y275: 1,28000,8,0;1,19016,8,0;1,10007,5,0;1,10108,2,0;1,7,9000,0;1,8,9000,0;1,4,1000,0; | Z275: 0 | AA275: {} | AB275: n/60
A276: 272 | B276: 272 | C276: 272 | D276: 弑神试炼 | E276: 10503 | F276: 5 | G276: 3 | H276: 200272 | I276: 0 | J276: 480 | K276: 5000,0; | L276: 5 | M276: 5000,1; | N276: 39240/3600*(nPatrolSec+3)*(1000+nGuanQia)/1000 | O276: 31380/3600*(nPatrolSec+3)*(1000+nGuanQia)/1000 | P276: 19320/3600*(nPatrolSec+3)*(1000+nGuanQia)/1000 | Q276: nGuanQia + 1000 | R276: 39240/60*nMin*(1000+nGuanQia)/1000 | S276: 31380/60*nMin*(1000+nGuanQia)/1000 | T276: 19320/60*nMin*(1000+nGuanQia)/1000 | U276: 喽啰 | V276: pet_21;pet_201;pet_93;pet_91; | W276: 4 | X276: 5 | Y276: 1,28000,8,0;1,19016,8,0;1,10007,5,0;1,10108,2,0;1,7,9000,0;1,8,9000,0;1,4,1000,0; | Z276: 0 | AA276: {} | AB276: n/60
A277: 273 | B277: 273 | C277: 273 | D277: 弑神试炼 | E277: 10503 | F277: 5 | G277: 3 | H277: 200273 | I277: 0 | J277: 480 | K277: 5000,0; | L277: 5 | M277: 5000,1; | N277: 39240/3600*(nPatrolSec+3)*(1000+nGuanQia)/1000 | O277: 31380/3600*(nPatrolSec+3)*(1000+nGuanQia)/1000 | P277: 19320/3600*(nPatrolSec+3)*(1000+nGuanQia)/1000 | Q277: nGuanQia + 1000 | R277: 39240/60*nMin*(1000+nGuanQia)/1000 | S277: 31380/60*nMin*(1000+nGuanQia)/1000 | T277: 19320/60*nMin*(1000+nGuanQia)/1000 | U277: 喽啰 | V277: pet_21;pet_201;pet_93;pet_91; | W277: 4 | X277: 5 | Y277: 1,28000,8,0;1,19016,8,0;1,10007,5,0;1,10108,2,0;1,7,9000,0;1,8,9000,0;1,4,1000,0; | Z277: 0 | AA277: {} | AB277: n/60
A278: 274 | B278: 274 | C278: 274 | D278: 弑神试炼 | E278: 10503 | F278: 5 | G278: 3 | H278: 200274 | I278: 0 | J278: 480 | K278: 5000,0; | L278: 5 | M278: 5000,1; | N278: 39240/3600*(nPatrolSec+3)*(1000+nGuanQia)/1000 | O278: 31380/3600*(nPatrolSec+3)*(1000+nGuanQia)/1000 | P278: 19320/3600*(nPatrolSec+3)*(1000+nGuanQia)/1000 | Q278: nGuanQia + 1000 | R278: 39240/60*nMin*(1000+nGuanQia)/1000 | S278: 31380/60*nMin*(1000+nGuanQia)/1000 | T278: 19320/60*nMin*(1000+nGuanQia)/1000 | U278: 喽啰 | V278: pet_21;pet_201;pet_93;pet_91; | W278: 4 | X278: 5 | Y278: 1,28000,8,0;1,19016,8,0;1,10007,5,0;1,10108,2,0;1,7,9000,0;1,8,9000,0;1,4,1000,0; | Z278: 0 | AA278: {} | AB278: n/60
A279: 275 | B279: 275 | C279: 275 | D279: 弑神试炼 | E279: 10503 | F279: 5 | G279: 3 | H279: 200275 | I279: 0 | J279: 480 | K279: 5000,0; | L279: 5 | M279: 5000,1; | N279: 39240/3600*(nPatrolSec+3)*(1000+nGuanQia)/1000 | O279: 31380/3600*(nPatrolSec+3)*(1000+nGuanQia)/1000 | P279: 19320/3600*(nPatrolSec+3)*(1000+nGuanQia)/1000 | Q279: nGuanQia + 1000 | R279: 39240/60*nMin*(1000+nGuanQia)/1000 | S279: 31380/60*nMin*(1000+nGuanQia)/1000 | T279: 19320/60*nMin*(1000+nGuanQia)/1000 | U279: 喽啰 | V279: pet_21;pet_201;pet_93;pet_91; | W279: 4 | X279: 5 | Y279: 1,28000,8,0;1,19016,8,0;1,10007,5,0;1,10108,2,0;1,7,9000,0;1,8,9000,0;1,4,1000,0; | Z279: 0 | AA279: {} | AB279: n/60
A280: 276 | B280: 276 | C280: 276 | D280: 弑神试炼 | E280: 10503 | F280: 5 | G280: 3 | H280: 200276 | I280: 0 | J280: 480 | K280: 5000,0; | L280: 5 | M280: 5000,1; | N280: 39240/3600*(nPatrolSec+3)*(1000+nGuanQia)/1000 | O280: 31380/3600*(nPatrolSec+3)*(1000+nGuanQia)/1000 | P280: 19320/3600*(nPatrolSec+3)*(1000+nGuanQia)/1000 | Q280: nGuanQia + 1000 | R280: 39240/60*nMin*(1000+nGuanQia)/1000 | S280: 31380/60*nMin*(1000+nGuanQia)/1000 | T280: 19320/60*nMin*(1000+nGuanQia)/1000 | U280: 喽啰 | V280: pet_21;pet_201;pet_93;pet_91; | W280: 4 | X280: 5 | Y280: 1,28000,8,0;1,19016,8,0;1,10007,5,0;1,10108,2,0;1,7,9000,0;1,8,9000,0;1,4,1000,0; | Z280: 0 | AA280: {} | AB280: n/60
A281: 277 | B281: 277 | C281: 277 | D281: 弑神试炼 | E281: 10503 | F281: 5 | G281: 3 | H281: 200277 | I281: 0 | J281: 480 | K281: 5000,0; | L281: 5 | M281: 5000,1; | N281: 39240/3600*(nPatrolSec+3)*(1000+nGuanQia)/1000 | O281: 31380/3600*(nPatrolSec+3)*(1000+nGuanQia)/1000 | P281: 19320/3600*(nPatrolSec+3)*(1000+nGuanQia)/1000 | Q281: nGuanQia + 1000 | R281: 39240/60*nMin*(1000+nGuanQia)/1000 | S281: 31380/60*nMin*(1000+nGuanQia)/1000 | T281: 19320/60*nMin*(1000+nGuanQia)/1000 | U281: 喽啰 | V281: pet_21;pet_201;pet_93;pet_91; | W281: 4 | X281: 5 | Y281: 1,28000,8,0;1,19016,8,0;1,10007,5,0;1,10108,2,0;1,7,9000,0;1,8,9000,0;1,4,1000,0; | Z281: 0 | AA281: {} | AB281: n/60
A282: 278 | B282: 278 | C282: 278 | D282: 弑神试炼 | E282: 10503 | F282: 5 | G282: 3 | H282: 200278 | I282: 0 | J282: 480 | K282: 5000,0; | L282: 5 | M282: 5000,1; | N282: 39240/3600*(nPatrolSec+3)*(1000+nGuanQia)/1000 | O282: 31380/3600*(nPatrolSec+3)*(1000+nGuanQia)/1000 | P282: 19320/3600*(nPatrolSec+3)*(1000+nGuanQia)/1000 | Q282: nGuanQia + 1000 | R282: 39240/60*nMin*(1000+nGuanQia)/1000 | S282: 31380/60*nMin*(1000+nGuanQia)/1000 | T282: 19320/60*nMin*(1000+nGuanQia)/1000 | U282: 喽啰 | V282: pet_21;pet_201;pet_93;pet_91; | W282: 4 | X282: 5 | Y282: 1,28000,8,0;1,19016,8,0;1,10007,5,0;1,10108,2,0;1,7,9000,0;1,8,9000,0;1,4,1000,0; | Z282: 0 | AA282: {} | AB282: n/60
A283: 279 | B283: 279 | C283: 279 | D283: 弑神试炼 | E283: 10503 | F283: 5 | G283: 3 | H283: 200279 | I283: 0 | J283: 480 | K283: 5000,0; | L283: 5 | M283: 5000,1; | N283: 39240/3600*(nPatrolSec+3)*(1000+nGuanQia)/1000 | O283: 31380/3600*(nPatrolSec+3)*(1000+nGuanQia)/1000 | P283: 19320/3600*(nPatrolSec+3)*(1000+nGuanQia)/1000 | Q283: nGuanQia + 1000 | R283: 39240/60*nMin*(1000+nGuanQia)/1000 | S283: 31380/60*nMin*(1000+nGuanQia)/1000 | T283: 19320/60*nMin*(1000+nGuanQia)/1000 | U283: 喽啰 | V283: pet_21;pet_201;pet_93;pet_91; | W283: 4 | X283: 5 | Y283: 1,28000,8,0;1,19016,8,0;1,10007,5,0;1,10108,2,0;1,7,9000,0;1,8,9000,0;1,4,1000,0; | Z283: 0 | AA283: {} | AB283: n/60
A284: 280 | B284: 280 | C284: 280 | D284: 弑神试炼 | E284: 10504 | F284: 5 | G284: 3 | H284: 200280 | I284: 0 | J284: 480 | K284: 5000,0; | L284: 5 | M284: 5000,1; | N284: 39240/3600*(nPatrolSec+3)*(1000+nGuanQia)/1000 | O284: 31380/3600*(nPatrolSec+3)*(1000+nGuanQia)/1000 | P284: 19320/3600*(nPatrolSec+3)*(1000+nGuanQia)/1000 | Q284: nGuanQia + 1000 | R284: 39240/60*nMin*(1000+nGuanQia)/1000 | S284: 31380/60*nMin*(1000+nGuanQia)/1000 | T284: 19320/60*nMin*(1000+nGuanQia)/1000 | U284: 喽啰 | V284: pet_21;pet_201;pet_93;pet_91; | W284: 4 | X284: 5 | Y284: 1,28000,8,0;1,19016,8,0;1,10007,5,0;1,10108,2,0;1,7,9000,0;1,8,9000,0;1,4,1000,0; | Z284: 0 | AA284: {} | AB284: n/60
A285: 281 | B285: 281 | C285: 281 | D285: 弑神试炼 | E285: 10504 | F285: 5 | G285: 3 | H285: 200281 | I285: 0 | J285: 480 | K285: 5000,0; | L285: 5 | M285: 5000,1; | N285: 39240/3600*(nPatrolSec+3)*(1000+nGuanQia)/1000 | O285: 31380/3600*(nPatrolSec+3)*(1000+nGuanQia)/1000 | P285: 19320/3600*(nPatrolSec+3)*(1000+nGuanQia)/1000 | Q285: nGuanQia + 1000 | R285: 39240/60*nMin*(1000+nGuanQia)/1000 | S285: 31380/60*nMin*(1000+nGuanQia)/1000 | T285: 19320/60*nMin*(1000+nGuanQia)/1000 | U285: 喽啰 | V285: pet_21;pet_201;pet_93;pet_91; | W285: 4 | X285: 5 | Y285: 1,28000,8,0;1,19016,8,0;1,10007,5,0;1,10108,2,0;1,7,9000,0;1,8,9000,0;1,4,1000,0; | Z285: 0 | AA285: {} | AB285: n/60
A286: 282 | B286: 282 | C286: 282 | D286: 弑神试炼 | E286: 10504 | F286: 5 | G286: 3 | H286: 200282 | I286: 0 | J286: 480 | K286: 5000,0; | L286: 5 | M286: 5000,1; | N286: 39240/3600*(nPatrolSec+3)*(1000+nGuanQia)/1000 | O286: 31380/3600*(nPatrolSec+3)*(1000+nGuanQia)/1000 | P286: 19320/3600*(nPatrolSec+3)*(1000+nGuanQia)/1000 | Q286: nGuanQia + 1000 | R286: 39240/60*nMin*(1000+nGuanQia)/1000 | S286: 31380/60*nMin*(1000+nGuanQia)/1000 | T286: 19320/60*nMin*(1000+nGuanQia)/1000 | U286: 喽啰 | V286: pet_21;pet_201;pet_93;pet_91; | W286: 4 | X286: 5 | Y286: 1,28000,8,0;1,19016,8,0;1,10007,5,0;1,10108,2,0;1,7,9000,0;1,8,9000,0;1,4,1000,0; | Z286: 0 | AA286: {} | AB286: n/60
A287: 283 | B287: 283 | C287: 283 | D287: 弑神试炼 | E287: 10504 | F287: 5 | G287: 3 | H287: 200283 | I287: 0 | J287: 480 | K287: 5000,0; | L287: 5 | M287: 5000,1; | N287: 39240/3600*(nPatrolSec+3)*(1000+nGuanQia)/1000 | O287: 31380/3600*(nPatrolSec+3)*(1000+nGuanQia)/1000 | P287: 19320/3600*(nPatrolSec+3)*(1000+nGuanQia)/1000 | Q287: nGuanQia + 1000 | R287: 39240/60*nMin*(1000+nGuanQia)/1000 | S287: 31380/60*nMin*(1000+nGuanQia)/1000 | T287: 19320/60*nMin*(1000+nGuanQia)/1000 | U287: 喽啰 | V287: pet_21;pet_201;pet_93;pet_91; | W287: 4 | X287: 5 | Y287: 1,28000,8,0;1,19016,8,0;1,10007,5,0;1,10108,2,0;1,7,9000,0;1,8,9000,0;1,4,1000,0; | Z287: 0 | AA287: {} | AB287: n/60
A288: 284 | B288: 284 | C288: 284 | D288: 弑神试炼 | E288: 10504 | F288: 5 | G288: 3 | H288: 200284 | I288: 0 | J288: 480 | K288: 5000,0; | L288: 5 | M288: 5000,1; | N288: 39240/3600*(nPatrolSec+3)*(1000+nGuanQia)/1000 | O288: 31380/3600*(nPatrolSec+3)*(1000+nGuanQia)/1000 | P288: 19320/3600*(nPatrolSec+3)*(1000+nGuanQia)/1000 | Q288: nGuanQia + 1000 | R288: 39240/60*nMin*(1000+nGuanQia)/1000 | S288: 31380/60*nMin*(1000+nGuanQia)/1000 | T288: 19320/60*nMin*(1000+nGuanQia)/1000 | U288: 喽啰 | V288: pet_21;pet_201;pet_93;pet_91; | W288: 4 | X288: 5 | Y288: 1,28000,8,0;1,19016,8,0;1,10007,5,0;1,10108,2,0;1,7,9000,0;1,8,9000,0;1,4,1000,0; | Z288: 0 | AA288: {} | AB288: n/60
A289: 285 | B289: 285 | C289: 285 | D289: 弑神试炼 | E289: 10504 | F289: 5 | G289: 3 | H289: 200285 | I289: 0 | J289: 480 | K289: 5000,0; | L289: 5 | M289: 5000,1; | N289: 39240/3600*(nPatrolSec+3)*(1000+nGuanQia)/1000 | O289: 31380/3600*(nPatrolSec+3)*(1000+nGuanQia)/1000 | P289: 19320/3600*(nPatrolSec+3)*(1000+nGuanQia)/1000 | Q289: nGuanQia + 1000 | R289: 39240/60*nMin*(1000+nGuanQia)/1000 | S289: 31380/60*nMin*(1000+nGuanQia)/1000 | T289: 19320/60*nMin*(1000+nGuanQia)/1000 | U289: 喽啰 | V289: pet_21;pet_201;pet_93;pet_91; | W289: 4 | X289: 5 | Y289: 1,28000,8,0;1,19016,8,0;1,10007,5,0;1,10108,2,0;1,7,9000,0;1,8,9000,0;1,4,1000,0; | Z289: 0 | AA289: {} | AB289: n/60
A290: 286 | B290: 286 | C290: 286 | D290: 弑神试炼 | E290: 10504 | F290: 5 | G290: 3 | H290: 200286 | I290: 0 | J290: 480 | K290: 5000,0; | L290: 5 | M290: 5000,1; | N290: 39240/3600*(nPatrolSec+3)*(1000+nGuanQia)/1000 | O290: 31380/3600*(nPatrolSec+3)*(1000+nGuanQia)/1000 | P290: 19320/3600*(nPatrolSec+3)*(1000+nGuanQia)/1000 | Q290: nGuanQia + 1000 | R290: 39240/60*nMin*(1000+nGuanQia)/1000 | S290: 31380/60*nMin*(1000+nGuanQia)/1000 | T290: 19320/60*nMin*(1000+nGuanQia)/1000 | U290: 喽啰 | V290: pet_21;pet_201;pet_93;pet_91; | W290: 4 | X290: 5 | Y290: 1,28000,8,0;1,19016,8,0;1,10007,5,0;1,10108,2,0;1,7,9000,0;1,8,9000,0;1,4,1000,0; | Z290: 0 | AA290: {} | AB290: n/60
A291: 287 | B291: 287 | C291: 287 | D291: 弑神试炼 | E291: 10504 | F291: 5 | G291: 3 | H291: 200287 | I291: 0 | J291: 480 | K291: 5000,0; | L291: 5 | M291: 5000,1; | N291: 39240/3600*(nPatrolSec+3)*(1000+nGuanQia)/1000 | O291: 31380/3600*(nPatrolSec+3)*(1000+nGuanQia)/1000 | P291: 19320/3600*(nPatrolSec+3)*(1000+nGuanQia)/1000 | Q291: nGuanQia + 1000 | R291: 39240/60*nMin*(1000+nGuanQia)/1000 | S291: 31380/60*nMin*(1000+nGuanQia)/1000 | T291: 19320/60*nMin*(1000+nGuanQia)/1000 | U291: 喽啰 | V291: pet_21;pet_201;pet_93;pet_91; | W291: 4 | X291: 5 | Y291: 1,28000,8,0;1,19016,8,0;1,10007,5,0;1,10108,2,0;1,7,9000,0;1,8,9000,0;1,4,1000,0; | Z291: 0 | AA291: {} | AB291: n/60
A292: 288 | B292: 288 | C292: 288 | D292: 弑神试炼 | E292: 10504 | F292: 5 | G292: 3 | H292: 200288 | I292: 0 | J292: 480 | K292: 5000,0; | L292: 5 | M292: 5000,1; | N292: 39240/3600*(nPatrolSec+3)*(1000+nGuanQia)/1000 | O292: 31380/3600*(nPatrolSec+3)*(1000+nGuanQia)/1000 | P292: 19320/3600*(nPatrolSec+3)*(1000+nGuanQia)/1000 | Q292: nGuanQia + 1000 | R292: 39240/60*nMin*(1000+nGuanQia)/1000 | S292: 31380/60*nMin*(1000+nGuanQia)/1000 | T292: 19320/60*nMin*(1000+nGuanQia)/1000 | U292: 喽啰 | V292: pet_21;pet_201;pet_93;pet_91; | W292: 4 | X292: 5 | Y292: 1,28000,8,0;1,19016,8,0;1,10007,5,0;1,10108,2,0;1,7,9000,0;1,8,9000,0;1,4,1000,0; | Z292: 0 | AA292: {} | AB292: n/60
A293: 289 | B293: 289 | C293: 289 | D293: 弑神试炼 | E293: 10504 | F293: 5 | G293: 3 | H293: 200289 | I293: 0 | J293: 480 | K293: 5000,0; | L293: 5 | M293: 5000,1; | N293: 39240/3600*(nPatrolSec+3)*(1000+nGuanQia)/1000 | O293: 31380/3600*(nPatrolSec+3)*(1000+nGuanQia)/1000 | P293: 19320/3600*(nPatrolSec+3)*(1000+nGuanQia)/1000 | Q293: nGuanQia + 1000 | R293: 39240/60*nMin*(1000+nGuanQia)/1000 | S293: 31380/60*nMin*(1000+nGuanQia)/1000 | T293: 19320/60*nMin*(1000+nGuanQia)/1000 | U293: 喽啰 | V293: pet_21;pet_201;pet_93;pet_91; | W293: 4 | X293: 5 | Y293: 1,28000,8,0;1,19016,8,0;1,10007,5,0;1,10108,2,0;1,7,9000,0;1,8,9000,0;1,4,1000,0; | Z293: 0 | AA293: {} | AB293: n/60
A294: 290 | B294: 290 | C294: 290 | D294: 弑神试炼 | E294: 10504 | F294: 5 | G294: 3 | H294: 200290 | I294: 0 | J294: 480 | K294: 5000,0; | L294: 5 | M294: 5000,1; | N294: 39240/3600*(nPatrolSec+3)*(1000+nGuanQia)/1000 | O294: 31380/3600*(nPatrolSec+3)*(1000+nGuanQia)/1000 | P294: 19320/3600*(nPatrolSec+3)*(1000+nGuanQia)/1000 | Q294: nGuanQia + 1000 | R294: 39240/60*nMin*(1000+nGuanQia)/1000 | S294: 31380/60*nMin*(1000+nGuanQia)/1000 | T294: 19320/60*nMin*(1000+nGuanQia)/1000 | U294: 喽啰 | V294: pet_21;pet_201;pet_93;pet_91; | W294: 4 | X294: 5 | Y294: 1,28000,8,0;1,19016,8,0;1,10007,5,0;1,10108,2,0;1,7,9000,0;1,8,9000,0;1,4,1000,0; | Z294: 0 | AA294: {} | AB294: n/60
A295: 291 | B295: 291 | C295: 291 | D295: 弑神试炼 | E295: 10504 | F295: 5 | G295: 3 | H295: 200291 | I295: 0 | J295: 480 | K295: 5000,0; | L295: 5 | M295: 5000,1; | N295: 39240/3600*(nPatrolSec+3)*(1000+nGuanQia)/1000 | O295: 31380/3600*(nPatrolSec+3)*(1000+nGuanQia)/1000 | P295: 19320/3600*(nPatrolSec+3)*(1000+nGuanQia)/1000 | Q295: nGuanQia + 1000 | R295: 39240/60*nMin*(1000+nGuanQia)/1000 | S295: 31380/60*nMin*(1000+nGuanQia)/1000 | T295: 19320/60*nMin*(1000+nGuanQia)/1000 | U295: 喽啰 | V295: pet_21;pet_201;pet_93;pet_91; | W295: 4 | X295: 5 | Y295: 1,28000,8,0;1,19016,8,0;1,10007,5,0;1,10108,2,0;1,7,9000,0;1,8,9000,0;1,4,1000,0; | Z295: 0 | AA295: {} | AB295: n/60
A296: 292 | B296: 292 | C296: 292 | D296: 弑神试炼 | E296: 10504 | F296: 5 | G296: 3 | H296: 200292 | I296: 0 | J296: 480 | K296: 5000,0; | L296: 5 | M296: 5000,1; | N296: 39240/3600*(nPatrolSec+3)*(1000+nGuanQia)/1000 | O296: 31380/3600*(nPatrolSec+3)*(1000+nGuanQia)/1000 | P296: 19320/3600*(nPatrolSec+3)*(1000+nGuanQia)/1000 | Q296: nGuanQia + 1000 | R296: 39240/60*nMin*(1000+nGuanQia)/1000 | S296: 31380/60*nMin*(1000+nGuanQia)/1000 | T296: 19320/60*nMin*(1000+nGuanQia)/1000 | U296: 喽啰 | V296: pet_21;pet_201;pet_93;pet_91; | W296: 4 | X296: 5 | Y296: 1,28000,8,0;1,19016,8,0;1,10007,5,0;1,10108,2,0;1,7,9000,0;1,8,9000,0;1,4,1000,0; | Z296: 0 | AA296: {} | AB296: n/60
A297: 293 | B297: 293 | C297: 293 | D297: 弑神试炼 | E297: 10504 | F297: 5 | G297: 3 | H297: 200293 | I297: 0 | J297: 480 | K297: 5000,0; | L297: 5 | M297: 5000,1; | N297: 39240/3600*(nPatrolSec+3)*(1000+nGuanQia)/1000 | O297: 31380/3600*(nPatrolSec+3)*(1000+nGuanQia)/1000 | P297: 19320/3600*(nPatrolSec+3)*(1000+nGuanQia)/1000 | Q297: nGuanQia + 1000 | R297: 39240/60*nMin*(1000+nGuanQia)/1000 | S297: 31380/60*nMin*(1000+nGuanQia)/1000 | T297: 19320/60*nMin*(1000+nGuanQia)/1000 | U297: 喽啰 | V297: pet_21;pet_201;pet_93;pet_91; | W297: 4 | X297: 5 | Y297: 1,28000,8,0;1,19016,8,0;1,10007,5,0;1,10108,2,0;1,7,9000,0;1,8,9000,0;1,4,1000,0; | Z297: 0 | AA297: {} | AB297: n/60
A298: 294 | B298: 294 | C298: 294 | D298: 弑神试炼 | E298: 10504 | F298: 5 | G298: 3 | H298: 200294 | I298: 0 | J298: 480 | K298: 5000,0; | L298: 5 | M298: 5000,1; | N298: 39240/3600*(nPatrolSec+3)*(1000+nGuanQia)/1000 | O298: 31380/3600*(nPatrolSec+3)*(1000+nGuanQia)/1000 | P298: 19320/3600*(nPatrolSec+3)*(1000+nGuanQia)/1000 | Q298: nGuanQia + 1000 | R298: 39240/60*nMin*(1000+nGuanQia)/1000 | S298: 31380/60*nMin*(1000+nGuanQia)/1000 | T298: 19320/60*nMin*(1000+nGuanQia)/1000 | U298: 喽啰 | V298: pet_21;pet_201;pet_93;pet_91; | W298: 4 | X298: 5 | Y298: 1,28000,8,0;1,19016,8,0;1,10007,5,0;1,10108,2,0;1,7,9000,0;1,8,9000,0;1,4,1000,0; | Z298: 0 | AA298: {} | AB298: n/60
A299: 295 | B299: 295 | C299: 295 | D299: 弑神试炼 | E299: 10505 | F299: 5 | G299: 3 | H299: 200295 | I299: 0 | J299: 480 | K299: 5000,0; | L299: 5 | M299: 5000,1; | N299: 39240/3600*(nPatrolSec+3)*(1000+nGuanQia)/1000 | O299: 31380/3600*(nPatrolSec+3)*(1000+nGuanQia)/1000 | P299: 19320/3600*(nPatrolSec+3)*(1000+nGuanQia)/1000 | Q299: nGuanQia + 1000 | R299: 39240/60*nMin*(1000+nGuanQia)/1000 | S299: 31380/60*nMin*(1000+nGuanQia)/1000 | T299: 19320/60*nMin*(1000+nGuanQia)/1000 | U299: 喽啰 | V299: pet_21;pet_201;pet_93;pet_91; | W299: 4 | X299: 5 | Y299: 1,28000,8,0;1,19016,8,0;1,10007,5,0;1,10108,2,0;1,7,9000,0;1,8,9000,0;1,4,1000,0; | Z299: 0 | AA299: {} | AB299: n/60
A300: 296 | B300: 296 | C300: 296 | D300: 弑神试炼 | E300: 10505 | F300: 5 | G300: 3 | H300: 200296 | I300: 0 | J300: 480 | K300: 5000,0; | L300: 5 | M300: 5000,1; | N300: 39240/3600*(nPatrolSec+3)*(1000+nGuanQia)/1000 | O300: 31380/3600*(nPatrolSec+3)*(1000+nGuanQia)/1000 | P300: 19320/3600*(nPatrolSec+3)*(1000+nGuanQia)/1000 | Q300: nGuanQia + 1000 | R300: 39240/60*nMin*(1000+nGuanQia)/1000 | S300: 31380/60*nMin*(1000+nGuanQia)/1000 | T300: 19320/60*nMin*(1000+nGuanQia)/1000 | U300: 喽啰 | V300: pet_21;pet_201;pet_93;pet_91; | W300: 4 | X300: 5 | Y300: 1,28000,8,0;1,19016,8,0;1,10007,5,0;1,10108,2,0;1,7,9000,0;1,8,9000,0;1,4,1000,0; | Z300: 0 | AA300: {} | AB300: n/60
A301: 297 | B301: 297 | C301: 297 | D301: 弑神试炼 | E301: 10505 | F301: 5 | G301: 3 | H301: 200297 | I301: 0 | J301: 480 | K301: 5000,0; | L301: 5 | M301: 5000,1; | N301: 39240/3600*(nPatrolSec+3)*(1000+nGuanQia)/1000 | O301: 31380/3600*(nPatrolSec+3)*(1000+nGuanQia)/1000 | P301: 19320/3600*(nPatrolSec+3)*(1000+nGuanQia)/1000 | Q301: nGuanQia + 1000 | R301: 39240/60*nMin*(1000+nGuanQia)/1000 | S301: 31380/60*nMin*(1000+nGuanQia)/1000 | T301: 19320/60*nMin*(1000+nGuanQia)/1000 | U301: 喽啰 | V301: pet_21;pet_201;pet_93;pet_91; | W301: 4 | X301: 5 | Y301: 1,28000,8,0;1,19016,8,0;1,10007,5,0;1,10108,2,0;1,7,9000,0;1,8,9000,0;1,4,1000,0; | Z301: 0 | AA301: {} | AB301: n/60
A302: 298 | B302: 298 | C302: 298 | D302: 弑神试炼 | E302: 10505 | F302: 5 | G302: 3 | H302: 200298 | I302: 0 | J302: 480 | K302: 5000,0; | L302: 5 | M302: 5000,1; | N302: 39240/3600*(nPatrolSec+3)*(1000+nGuanQia)/1000 | O302: 31380/3600*(nPatrolSec+3)*(1000+nGuanQia)/1000 | P302: 19320/3600*(nPatrolSec+3)*(1000+nGuanQia)/1000 | Q302: nGuanQia + 1000 | R302: 39240/60*nMin*(1000+nGuanQia)/1000 | S302: 31380/60*nMin*(1000+nGuanQia)/1000 | T302: 19320/60*nMin*(1000+nGuanQia)/1000 | U302: 喽啰 | V302: pet_21;pet_201;pet_93;pet_91; | W302: 4 | X302: 5 | Y302: 1,28000,8,0;1,19016,8,0;1,10007,5,0;1,10108,2,0;1,7,9000,0;1,8,9000,0;1,4,1000,0; | Z302: 0 | AA302: {} | AB302: n/60
A303: 299 | B303: 299 | C303: 299 | D303: 弑神试炼 | E303: 10505 | F303: 5 | G303: 3 | H303: 200299 | I303: 0 | J303: 480 | K303: 5000,0; | L303: 5 | M303: 5000,1; | N303: 39240/3600*(nPatrolSec+3)*(1000+nGuanQia)/1000 | O303: 31380/3600*(nPatrolSec+3)*(1000+nGuanQia)/1000 | P303: 19320/3600*(nPatrolSec+3)*(1000+nGuanQia)/1000 | Q303: nGuanQia + 1000 | R303: 39240/60*nMin*(1000+nGuanQia)/1000 | S303: 31380/60*nMin*(1000+nGuanQia)/1000 | T303: 19320/60*nMin*(1000+nGuanQia)/1000 | U303: 喽啰 | V303: pet_21;pet_201;pet_93;pet_91; | W303: 4 | X303: 5 | Y303: 1,28000,8,0;1,19016,8,0;1,10007,5,0;1,10108,2,0;1,7,9000,0;1,8,9000,0;1,4,1000,0; | Z303: 0 | AA303: {} | AB303: n/60
A304: 300 | B304: 300 | C304: 300 | D304: 弑神试炼 | E304: 10505 | F304: 5 | G304: 3 | H304: 200300 | I304: 0 | J304: 480 | K304: 5000,0; | L304: 5 | M304: 5000,1; | N304: 39240/3600*(nPatrolSec+3)*(1000+nGuanQia)/1000 | O304: 31380/3600*(nPatrolSec+3)*(1000+nGuanQia)/1000 | P304: 19320/3600*(nPatrolSec+3)*(1000+nGuanQia)/1000 | Q304: nGuanQia + 1000 | R304: 39240/60*nMin*(1000+nGuanQia)/1000 | S304: 31380/60*nMin*(1000+nGuanQia)/1000 | T304: 19320/60*nMin*(1000+nGuanQia)/1000 | U304: 喽啰 | V304: pet_21;pet_201;pet_93;pet_91; | W304: 4 | X304: 5 | Y304: 1,28000,8,0;1,19016,8,0;1,10007,5,0;1,10108,2,0;1,7,9000,0;1,8,9000,0;1,4,1000,0; | Z304: 0 | AA304: {} | AB304: n/60
A305: 301 | B305: 301 | C305: 301 | D305: 弑神试炼 | E305: 10503 | F305: 5 | G305: 3 | H305: 200301 | I305: 0 | J305: 480 | K305: 5000,0; | L305: 5 | M305: 5000,1; | N305: 39240/3600*(nPatrolSec+3)*(1000+nGuanQia)/1000 | O305: 31380/3600*(nPatrolSec+3)*(1000+nGuanQia)/1000 | P305: 19320/3600*(nPatrolSec+3)*(1000+nGuanQia)/1000 | Q305: nGuanQia + 1000 | R305: 39240/60*nMin*(1000+nGuanQia)/1000 | S305: 31380/60*nMin*(1000+nGuanQia)/1000 | T305: 19320/60*nMin*(1000+nGuanQia)/1000 | U305: 喽啰 | V305: pet_21;pet_201;pet_93;pet_91; | W305: 4 | X305: 5 | Y305: 1,28000,8,0;1,19016,8,0;1,10007,5,0;1,10108,2,0;1,7,9000,0;1,8,9000,0;1,4,1000,0; | Z305: 0 | AA305: {} | AB305: n/60
A306: 302 | B306: 302 | C306: 302 | D306: 弑神试炼 | E306: 10503 | F306: 5 | G306: 3 | H306: 200302 | I306: 0 | J306: 480 | K306: 5000,0; | L306: 5 | M306: 5000,1; | N306: 39240/3600*(nPatrolSec+3)*(1000+nGuanQia)/1000 | O306: 31380/3600*(nPatrolSec+3)*(1000+nGuanQia)/1000 | P306: 19320/3600*(nPatrolSec+3)*(1000+nGuanQia)/1000 | Q306: nGuanQia + 1000 | R306: 39240/60*nMin*(1000+nGuanQia)/1000 | S306: 31380/60*nMin*(1000+nGuanQia)/1000 | T306: 19320/60*nMin*(1000+nGuanQia)/1000 | U306: 喽啰 | V306: pet_21;pet_201;pet_93;pet_91; | W306: 4 | X306: 5 | Y306: 1,28000,8,0;1,19016,8,0;1,10007,5,0;1,10108,2,0;1,7,9000,0;1,8,9000,0;1,4,1000,0; | Z306: 0 | AA306: {} | AB306: n/60
A307: 303 | B307: 303 | C307: 303 | D307: 弑神试炼 | E307: 10503 | F307: 5 | G307: 3 | H307: 200303 | I307: 0 | J307: 480 | K307: 5000,0; | L307: 5 | M307: 5000,1; | N307: 39240/3600*(nPatrolSec+3)*(1000+nGuanQia)/1000 | O307: 31380/3600*(nPatrolSec+3)*(1000+nGuanQia)/1000 | P307: 19320/3600*(nPatrolSec+3)*(1000+nGuanQia)/1000 | Q307: nGuanQia + 1000 | R307: 39240/60*nMin*(1000+nGuanQia)/1000 | S307: 31380/60*nMin*(1000+nGuanQia)/1000 | T307: 19320/60*nMin*(1000+nGuanQia)/1000 | U307: 喽啰 | V307: pet_21;pet_201;pet_93;pet_91; | W307: 4 | X307: 5 | Y307: 1,28000,8,0;1,19016,8,0;1,10007,5,0;1,10108,2,0;1,7,9000,0;1,8,9000,0;1,4,1000,0; | Z307: 0 | AA307: {} | AB307: n/60
A308: 304 | B308: 304 | C308: 304 | D308: 弑神试炼 | E308: 10503 | F308: 5 | G308: 3 | H308: 200304 | I308: 0 | J308: 480 | K308: 5000,0; | L308: 5 | M308: 5000,1; | N308: 39240/3600*(nPatrolSec+3)*(1000+nGuanQia)/1000 | O308: 31380/3600*(nPatrolSec+3)*(1000+nGuanQia)/1000 | P308: 19320/3600*(nPatrolSec+3)*(1000+nGuanQia)/1000 | Q308: nGuanQia + 1000 | R308: 39240/60*nMin*(1000+nGuanQia)/1000 | S308: 31380/60*nMin*(1000+nGuanQia)/1000 | T308: 19320/60*nMin*(1000+nGuanQia)/1000 | U308: 喽啰 | V308: pet_21;pet_201;pet_93;pet_91; | W308: 4 | X308: 5 | Y308: 1,28000,8,0;1,19016,8,0;1,10007,5,0;1,10108,2,0;1,7,9000,0;1,8,9000,0;1,4,1000,0; | Z308: 0 | AA308: {} | AB308: n/60
A309: 305 | B309: 305 | C309: 305 | D309: 弑神试炼 | E309: 10503 | F309: 5 | G309: 3 | H309: 200305 | I309: 0 | J309: 480 | K309: 5000,0; | L309: 5 | M309: 5000,1; | N309: 39240/3600*(nPatrolSec+3)*(1000+nGuanQia)/1000 | O309: 31380/3600*(nPatrolSec+3)*(1000+nGuanQia)/1000 | P309: 19320/3600*(nPatrolSec+3)*(1000+nGuanQia)/1000 | Q309: nGuanQia + 1000 | R309: 39240/60*nMin*(1000+nGuanQia)/1000 | S309: 31380/60*nMin*(1000+nGuanQia)/1000 | T309: 19320/60*nMin*(1000+nGuanQia)/1000 | U309: 喽啰 | V309: pet_21;pet_201;pet_93;pet_91; | W309: 4 | X309: 5 | Y309: 1,28000,8,0;1,19016,8,0;1,10007,5,0;1,10108,2,0;1,7,9000,0;1,8,9000,0;1,4,1000,0; | Z309: 0 | AA309: {} | AB309: n/60
A310: 306 | B310: 306 | C310: 306 | D310: 弑神试炼 | E310: 10503 | F310: 5 | G310: 3 | H310: 200306 | I310: 0 | J310: 480 | K310: 5000,0; | L310: 5 | M310: 5000,1; | N310: 39240/3600*(nPatrolSec+3)*(1000+nGuanQia)/1000 | O310: 31380/3600*(nPatrolSec+3)*(1000+nGuanQia)/1000 | P310: 19320/3600*(nPatrolSec+3)*(1000+nGuanQia)/1000 | Q310: nGuanQia + 1000 | R310: 39240/60*nMin*(1000+nGuanQia)/1000 | S310: 31380/60*nMin*(1000+nGuanQia)/1000 | T310: 19320/60*nMin*(1000+nGuanQia)/1000 | U310: 喽啰 | V310: pet_21;pet_201;pet_93;pet_91; | W310: 4 | X310: 5 | Y310: 1,28000,8,0;1,19016,8,0;1,10007,5,0;1,10108,2,0;1,7,9000,0;1,8,9000,0;1,4,1000,0; | Z310: 0 | AA310: {} | AB310: n/60
A311: 307 | B311: 307 | C311: 307 | D311: 弑神试炼 | E311: 10503 | F311: 5 | G311: 3 | H311: 200307 | I311: 0 | J311: 480 | K311: 5000,0; | L311: 5 | M311: 5000,1; | N311: 39240/3600*(nPatrolSec+3)*(1000+nGuanQia)/1000 | O311: 31380/3600*(nPatrolSec+3)*(1000+nGuanQia)/1000 | P311: 19320/3600*(nPatrolSec+3)*(1000+nGuanQia)/1000 | Q311: nGuanQia + 1000 | R311: 39240/60*nMin*(1000+nGuanQia)/1000 | S311: 31380/60*nMin*(1000+nGuanQia)/1000 | T311: 19320/60*nMin*(1000+nGuanQia)/1000 | U311: 喽啰 | V311: pet_21;pet_201;pet_93;pet_91; | W311: 4 | X311: 5 | Y311: 1,28000,8,0;1,19016,8,0;1,10007,5,0;1,10108,2,0;1,7,9000,0;1,8,9000,0;1,4,1000,0; | Z311: 0 | AA311: {} | AB311: n/60
A312: 308 | B312: 308 | C312: 308 | D312: 弑神试炼 | E312: 10503 | F312: 5 | G312: 3 | H312: 200308 | I312: 0 | J312: 480 | K312: 5000,0; | L312: 5 | M312: 5000,1; | N312: 39240/3600*(nPatrolSec+3)*(1000+nGuanQia)/1000 | O312: 31380/3600*(nPatrolSec+3)*(1000+nGuanQia)/1000 | P312: 19320/3600*(nPatrolSec+3)*(1000+nGuanQia)/1000 | Q312: nGuanQia + 1000 | R312: 39240/60*nMin*(1000+nGuanQia)/1000 | S312: 31380/60*nMin*(1000+nGuanQia)/1000 | T312: 19320/60*nMin*(1000+nGuanQia)/1000 | U312: 喽啰 | V312: pet_21;pet_201;pet_93;pet_91; | W312: 4 | X312: 5 | Y312: 1,28000,8,0;1,19016,8,0;1,10007,5,0;1,10108,2,0;1,7,9000,0;1,8,9000,0;1,4,1000,0; | Z312: 0 | AA312: {} | AB312: n/60
A313: 309 | B313: 309 | C313: 309 | D313: 弑神试炼 | E313: 10503 | F313: 5 | G313: 3 | H313: 200309 | I313: 0 | J313: 480 | K313: 5000,0; | L313: 5 | M313: 5000,1; | N313: 39240/3600*(nPatrolSec+3)*(1000+nGuanQia)/1000 | O313: 31380/3600*(nPatrolSec+3)*(1000+nGuanQia)/1000 | P313: 19320/3600*(nPatrolSec+3)*(1000+nGuanQia)/1000 | Q313: nGuanQia + 1000 | R313: 39240/60*nMin*(1000+nGuanQia)/1000 | S313: 31380/60*nMin*(1000+nGuanQia)/1000 | T313: 19320/60*nMin*(1000+nGuanQia)/1000 | U313: 喽啰 | V313: pet_21;pet_201;pet_93;pet_91; | W313: 4 | X313: 5 | Y313: 1,28000,8,0;1,19016,8,0;1,10007,5,0;1,10108,2,0;1,7,9000,0;1,8,9000,0;1,4,1000,0; | Z313: 0 | AA313: {} | AB313: n/60
A314: 310 | B314: 310 | C314: 310 | D314: 弑神试炼 | E314: 10503 | F314: 5 | G314: 3 | H314: 200310 | I314: 0 | J314: 480 | K314: 5000,0; | L314: 5 | M314: 5000,1; | N314: 39240/3600*(nPatrolSec+3)*(1000+nGuanQia)/1000 | O314: 31380/3600*(nPatrolSec+3)*(1000+nGuanQia)/1000 | P314: 19320/3600*(nPatrolSec+3)*(1000+nGuanQia)/1000 | Q314: nGuanQia + 1000 | R314: 39240/60*nMin*(1000+nGuanQia)/1000 | S314: 31380/60*nMin*(1000+nGuanQia)/1000 | T314: 19320/60*nMin*(1000+nGuanQia)/1000 | U314: 喽啰 | V314: pet_21;pet_201;pet_93;pet_91; | W314: 4 | X314: 5 | Y314: 1,28000,8,0;1,19016,8,0;1,10007,5,0;1,10108,2,0;1,7,9000,0;1,8,9000,0;1,4,1000,0; | Z314: 0 | AA314: {} | AB314: n/60
A315: 311 | B315: 311 | C315: 311 | D315: 弑神试炼 | E315: 10503 | F315: 5 | G315: 3 | H315: 200311 | I315: 0 | J315: 480 | K315: 5000,0; | L315: 5 | M315: 5000,1; | N315: 39240/3600*(nPatrolSec+3)*(1000+nGuanQia)/1000 | O315: 31380/3600*(nPatrolSec+3)*(1000+nGuanQia)/1000 | P315: 19320/3600*(nPatrolSec+3)*(1000+nGuanQia)/1000 | Q315: nGuanQia + 1000 | R315: 39240/60*nMin*(1000+nGuanQia)/1000 | S315: 31380/60*nMin*(1000+nGuanQia)/1000 | T315: 19320/60*nMin*(1000+nGuanQia)/1000 | U315: 喽啰 | V315: pet_21;pet_201;pet_93;pet_91; | W315: 4 | X315: 5 | Y315: 1,28000,8,0;1,19016,8,0;1,10007,5,0;1,10108,2,0;1,7,9000,0;1,8,9000,0;1,4,1000,0; | Z315: 0 | AA315: {} | AB315: n/60
A316: 312 | B316: 312 | C316: 312 | D316: 弑神试炼 | E316: 10503 | F316: 5 | G316: 3 | H316: 200312 | I316: 0 | J316: 480 | K316: 5000,0; | L316: 5 | M316: 5000,1; | N316: 39240/3600*(nPatrolSec+3)*(1000+nGuanQia)/1000 | O316: 31380/3600*(nPatrolSec+3)*(1000+nGuanQia)/1000 | P316: 19320/3600*(nPatrolSec+3)*(1000+nGuanQia)/1000 | Q316: nGuanQia + 1000 | R316: 39240/60*nMin*(1000+nGuanQia)/1000 | S316: 31380/60*nMin*(1000+nGuanQia)/1000 | T316: 19320/60*nMin*(1000+nGuanQia)/1000 | U316: 喽啰 | V316: pet_21;pet_201;pet_93;pet_91; | W316: 4 | X316: 5 | Y316: 1,28000,8,0;1,19016,8,0;1,10007,5,0;1,10108,2,0;1,7,9000,0;1,8,9000,0;1,4,1000,0; | Z316: 0 | AA316: {} | AB316: n/60
A317: 313 | B317: 313 | C317: 313 | D317: 弑神试炼 | E317: 10904 | F317: 5 | G317: 3 | H317: 200313 | I317: 0 | J317: 480 | K317: 5000,0; | L317: 5 | M317: 5000,1; | N317: 39240/3600*(nPatrolSec+3)*(1000+nGuanQia)/1000 | O317: 31380/3600*(nPatrolSec+3)*(1000+nGuanQia)/1000 | P317: 19320/3600*(nPatrolSec+3)*(1000+nGuanQia)/1000 | Q317: nGuanQia + 1000 | R317: 39240/60*nMin*(1000+nGuanQia)/1000 | S317: 31380/60*nMin*(1000+nGuanQia)/1000 | T317: 19320/60*nMin*(1000+nGuanQia)/1000 | U317: 喽啰 | V317: pet_21;pet_201;pet_93;pet_91; | W317: 4 | X317: 5 | Y317: 1,28000,8,0;1,19016,8,0;1,10007,5,0;1,10108,2,0;1,7,9000,0;1,8,9000,0;1,4,1000,0; | Z317: 0 | AA317: {} | AB317: n/60
A318: 314 | B318: 314 | C318: 314 | D318: 弑神试炼 | E318: 10904 | F318: 5 | G318: 3 | H318: 200314 | I318: 0 | J318: 480 | K318: 5000,0; | L318: 5 | M318: 5000,1; | N318: 39240/3600*(nPatrolSec+3)*(1000+nGuanQia)/1000 | O318: 31380/3600*(nPatrolSec+3)*(1000+nGuanQia)/1000 | P318: 19320/3600*(nPatrolSec+3)*(1000+nGuanQia)/1000 | Q318: nGuanQia + 1000 | R318: 39240/60*nMin*(1000+nGuanQia)/1000 | S318: 31380/60*nMin*(1000+nGuanQia)/1000 | T318: 19320/60*nMin*(1000+nGuanQia)/1000 | U318: 喽啰 | V318: pet_21;pet_201;pet_93;pet_91; | W318: 4 | X318: 5 | Y318: 1,28000,8,0;1,19016,8,0;1,10007,5,0;1,10108,2,0;1,7,9000,0;1,8,9000,0;1,4,1000,0; | Z318: 0 | AA318: {} | AB318: n/60
A319: 315 | B319: 315 | C319: 315 | D319: 弑神试炼 | E319: 10904 | F319: 5 | G319: 3 | H319: 200315 | I319: 0 | J319: 480 | K319: 5000,0; | L319: 5 | M319: 5000,1; | N319: 39240/3600*(nPatrolSec+3)*(1000+nGuanQia)/1000 | O319: 31380/3600*(nPatrolSec+3)*(1000+nGuanQia)/1000 | P319: 19320/3600*(nPatrolSec+3)*(1000+nGuanQia)/1000 | Q319: nGuanQia + 1000 | R319: 39240/60*nMin*(1000+nGuanQia)/1000 | S319: 31380/60*nMin*(1000+nGuanQia)/1000 | T319: 19320/60*nMin*(1000+nGuanQia)/1000 | U319: 喽啰 | V319: pet_21;pet_201;pet_93;pet_91; | W319: 4 | X319: 5 | Y319: 1,28000,8,0;1,19016,8,0;1,10007,5,0;1,10108,2,0;1,7,9000,0;1,8,9000,0;1,4,1000,0; | Z319: 0 | AA319: {} | AB319: n/60
A320: 316 | B320: 316 | C320: 316 | D320: 弑神试炼 | E320: 10904 | F320: 5 | G320: 3 | H320: 200316 | I320: 0 | J320: 480 | K320: 5000,0; | L320: 5 | M320: 5000,1; | N320: 39240/3600*(nPatrolSec+3)*(1000+nGuanQia)/1000 | O320: 31380/3600*(nPatrolSec+3)*(1000+nGuanQia)/1000 | P320: 19320/3600*(nPatrolSec+3)*(1000+nGuanQia)/1000 | Q320: nGuanQia + 1000 | R320: 39240/60*nMin*(1000+nGuanQia)/1000 | S320: 31380/60*nMin*(1000+nGuanQia)/1000 | T320: 19320/60*nMin*(1000+nGuanQia)/1000 | U320: 喽啰 | V320: pet_21;pet_201;pet_93;pet_91; | W320: 4 | X320: 5 | Y320: 1,28000,8,0;1,19016,8,0;1,10007,5,0;1,10108,2,0;1,7,9000,0;1,8,9000,0;1,4,1000,0; | Z320: 0 | AA320: {} | AB320: n/60
A321: 317 | B321: 317 | C321: 317 | D321: 弑神试炼 | E321: 10904 | F321: 5 | G321: 3 | H321: 200317 | I321: 0 | J321: 480 | K321: 5000,0; | L321: 5 | M321: 5000,1; | N321: 39240/3600*(nPatrolSec+3)*(1000+nGuanQia)/1000 | O321: 31380/3600*(nPatrolSec+3)*(1000+nGuanQia)/1000 | P321: 19320/3600*(nPatrolSec+3)*(1000+nGuanQia)/1000 | Q321: nGuanQia + 1000 | R321: 39240/60*nMin*(1000+nGuanQia)/1000 | S321: 31380/60*nMin*(1000+nGuanQia)/1000 | T321: 19320/60*nMin*(1000+nGuanQia)/1000 | U321: 喽啰 | V321: pet_21;pet_201;pet_93;pet_91; | W321: 4 | X321: 5 | Y321: 1,28000,8,0;1,19016,8,0;1,10007,5,0;1,10108,2,0;1,7,9000,0;1,8,9000,0;1,4,1000,0; | Z321: 0 | AA321: {} | AB321: n/60
A322: 318 | B322: 318 | C322: 318 | D322: 弑神试炼 | E322: 10904 | F322: 5 | G322: 3 | H322: 200318 | I322: 0 | J322: 480 | K322: 5000,0; | L322: 5 | M322: 5000,1; | N322: 39240/3600*(nPatrolSec+3)*(1000+nGuanQia)/1000 | O322: 31380/3600*(nPatrolSec+3)*(1000+nGuanQia)/1000 | P322: 19320/3600*(nPatrolSec+3)*(1000+nGuanQia)/1000 | Q322: nGuanQia + 1000 | R322: 39240/60*nMin*(1000+nGuanQia)/1000 | S322: 31380/60*nMin*(1000+nGuanQia)/1000 | T322: 19320/60*nMin*(1000+nGuanQia)/1000 | U322: 喽啰 | V322: pet_21;pet_201;pet_93;pet_91; | W322: 4 | X322: 5 | Y322: 1,28000,8,0;1,19016,8,0;1,10007,5,0;1,10108,2,0;1,7,9000,0;1,8,9000,0;1,4,1000,0; | Z322: 0 | AA322: {} | AB322: n/60
A323: 319 | B323: 319 | C323: 319 | D323: 弑神试炼 | E323: 10904 | F323: 5 | G323: 3 | H323: 200319 | I323: 0 | J323: 480 | K323: 5000,0; | L323: 5 | M323: 5000,1; | N323: 39240/3600*(nPatrolSec+3)*(1000+nGuanQia)/1000 | O323: 31380/3600*(nPatrolSec+3)*(1000+nGuanQia)/1000 | P323: 19320/3600*(nPatrolSec+3)*(1000+nGuanQia)/1000 | Q323: nGuanQia + 1000 | R323: 39240/60*nMin*(1000+nGuanQia)/1000 | S323: 31380/60*nMin*(1000+nGuanQia)/1000 | T323: 19320/60*nMin*(1000+nGuanQia)/1000 | U323: 喽啰 | V323: pet_21;pet_201;pet_93;pet_91; | W323: 4 | X323: 5 | Y323: 1,28000,8,0;1,19016,8,0;1,10007,5,0;1,10108,2,0;1,7,9000,0;1,8,9000,0;1,4,1000,0; | Z323: 0 | AA323: {} | AB323: n/60
A324: 320 | B324: 320 | C324: 320 | D324: 弑神试炼 | E324: 10904 | F324: 5 | G324: 3 | H324: 200320 | I324: 0 | J324: 480 | K324: 5000,0; | L324: 5 | M324: 5000,1; | N324: 39240/3600*(nPatrolSec+3)*(1000+nGuanQia)/1000 | O324: 31380/3600*(nPatrolSec+3)*(1000+nGuanQia)/1000 | P324: 19320/3600*(nPatrolSec+3)*(1000+nGuanQia)/1000 | Q324: nGuanQia + 1000 | R324: 39240/60*nMin*(1000+nGuanQia)/1000 | S324: 31380/60*nMin*(1000+nGuanQia)/1000 | T324: 19320/60*nMin*(1000+nGuanQia)/1000 | U324: 喽啰 | V324: pet_21;pet_201;pet_93;pet_91; | W324: 4 | X324: 5 | Y324: 1,28000,8,0;1,19016,8,0;1,10007,5,0;1,10108,2,0;1,7,9000,0;1,8,9000,0;1,4,1000,0; | Z324: 0 | AA324: {} | AB324: n/60
A325: 321 | B325: 321 | C325: 321 | D325: 弑神试炼 | E325: 10904 | F325: 5 | G325: 3 | H325: 200321 | I325: 0 | J325: 480 | K325: 5000,0; | L325: 5 | M325: 5000,1; | N325: 39240/3600*(nPatrolSec+3)*(1000+nGuanQia)/1000 | O325: 31380/3600*(nPatrolSec+3)*(1000+nGuanQia)/1000 | P325: 19320/3600*(nPatrolSec+3)*(1000+nGuanQia)/1000 | Q325: nGuanQia + 1000 | R325: 39240/60*nMin*(1000+nGuanQia)/1000 | S325: 31380/60*nMin*(1000+nGuanQia)/1000 | T325: 19320/60*nMin*(1000+nGuanQia)/1000 | U325: 喽啰 | V325: pet_21;pet_201;pet_93;pet_91; | W325: 4 | X325: 5 | Y325: 1,28000,8,0;1,19016,8,0;1,10007,5,0;1,10108,2,0;1,7,9000,0;1,8,9000,0;1,4,1000,0; | Z325: 0 | AA325: {} | AB325: n/60
A326: 322 | B326: 322 | C326: 322 | D326: 弑神试炼 | E326: 10904 | F326: 5 | G326: 3 | H326: 200322 | I326: 0 | J326: 480 | K326: 5000,0; | L326: 5 | M326: 5000,1; | N326: 39240/3600*(nPatrolSec+3)*(1000+nGuanQia)/1000 | O326: 31380/3600*(nPatrolSec+3)*(1000+nGuanQia)/1000 | P326: 19320/3600*(nPatrolSec+3)*(1000+nGuanQia)/1000 | Q326: nGuanQia + 1000 | R326: 39240/60*nMin*(1000+nGuanQia)/1000 | S326: 31380/60*nMin*(1000+nGuanQia)/1000 | T326: 19320/60*nMin*(1000+nGuanQia)/1000 | U326: 喽啰 | V326: pet_21;pet_201;pet_93;pet_91; | W326: 4 | X326: 5 | Y326: 1,28000,8,0;1,19016,8,0;1,10007,5,0;1,10108,2,0;1,7,9000,0;1,8,9000,0;1,4,1000,0; | Z326: 0 | AA326: {} | AB326: n/60
A327: 323 | B327: 323 | C327: 323 | D327: 弑神试炼 | E327: 10904 | F327: 5 | G327: 3 | H327: 200323 | I327: 0 | J327: 480 | K327: 5000,0; | L327: 5 | M327: 5000,1; | N327: 39240/3600*(nPatrolSec+3)*(1000+nGuanQia)/1000 | O327: 31380/3600*(nPatrolSec+3)*(1000+nGuanQia)/1000 | P327: 19320/3600*(nPatrolSec+3)*(1000+nGuanQia)/1000 | Q327: nGuanQia + 1000 | R327: 39240/60*nMin*(1000+nGuanQia)/1000 | S327: 31380/60*nMin*(1000+nGuanQia)/1000 | T327: 19320/60*nMin*(1000+nGuanQia)/1000 | U327: 喽啰 | V327: pet_21;pet_201;pet_93;pet_91; | W327: 4 | X327: 5 | Y327: 1,28000,8,0;1,19016,8,0;1,10007,5,0;1,10108,2,0;1,7,9000,0;1,8,9000,0;1,4,1000,0; | Z327: 0 | AA327: {} | AB327: n/60
A328: 324 | B328: 324 | C328: 324 | D328: 弑神试炼 | E328: 10501 | F328: 5 | G328: 3 | H328: 200324 | I328: 0 | J328: 480 | K328: 5000,0; | L328: 5 | M328: 5000,1; | N328: 39240/3600*(nPatrolSec+3)*(1000+nGuanQia)/1000 | O328: 31380/3600*(nPatrolSec+3)*(1000+nGuanQia)/1000 | P328: 19320/3600*(nPatrolSec+3)*(1000+nGuanQia)/1000 | Q328: nGuanQia + 1000 | R328: 39240/60*nMin*(1000+nGuanQia)/1000 | S328: 31380/60*nMin*(1000+nGuanQia)/1000 | T328: 19320/60*nMin*(1000+nGuanQia)/1000 | U328: 喽啰 | V328: pet_21;pet_201;pet_93;pet_91; | W328: 4 | X328: 5 | Y328: 1,28000,8,0;1,19016,8,0;1,10007,5,0;1,10108,2,0;1,7,9000,0;1,8,9000,0;1,4,1000,0; | Z328: 0 | AA328: {} | AB328: n/60
A329: 325 | B329: 325 | C329: 325 | D329: 弑神试炼 | E329: 10501 | F329: 5 | G329: 3 | H329: 200325 | I329: 0 | J329: 480 | K329: 5000,0; | L329: 5 | M329: 5000,1; | N329: 39240/3600*(nPatrolSec+3)*(1000+nGuanQia)/1000 | O329: 31380/3600*(nPatrolSec+3)*(1000+nGuanQia)/1000 | P329: 19320/3600*(nPatrolSec+3)*(1000+nGuanQia)/1000 | Q329: nGuanQia + 1000 | R329: 39240/60*nMin*(1000+nGuanQia)/1000 | S329: 31380/60*nMin*(1000+nGuanQia)/1000 | T329: 19320/60*nMin*(1000+nGuanQia)/1000 | U329: 喽啰 | V329: pet_21;pet_201;pet_93;pet_91; | W329: 4 | X329: 5 | Y329: 1,28000,8,0;1,19016,8,0;1,10007,5,0;1,10108,2,0;1,7,9000,0;1,8,9000,0;1,4,1000,0; | Z329: 0 | AA329: {} | AB329: n/60
A330: 326 | B330: 326 | C330: 326 | D330: 弑神试炼 | E330: 10501 | F330: 5 | G330: 3 | H330: 200326 | I330: 0 | J330: 480 | K330: 5000,0; | L330: 5 | M330: 5000,1; | N330: 39240/3600*(nPatrolSec+3)*(1000+nGuanQia)/1000 | O330: 31380/3600*(nPatrolSec+3)*(1000+nGuanQia)/1000 | P330: 19320/3600*(nPatrolSec+3)*(1000+nGuanQia)/1000 | Q330: nGuanQia + 1000 | R330: 39240/60*nMin*(1000+nGuanQia)/1000 | S330: 31380/60*nMin*(1000+nGuanQia)/1000 | T330: 19320/60*nMin*(1000+nGuanQia)/1000 | U330: 喽啰 | V330: pet_21;pet_201;pet_93;pet_91; | W330: 4 | X330: 5 | Y330: 1,28000,8,0;1,19016,8,0;1,10007,5,0;1,10108,2,0;1,7,9000,0;1,8,9000,0;1,4,1000,0; | Z330: 0 | AA330: {} | AB330: n/60
A331: 327 | B331: 327 | C331: 327 | D331: 弑神试炼 | E331: 10501 | F331: 5 | G331: 3 | H331: 200327 | I331: 0 | J331: 480 | K331: 5000,0; | L331: 5 | M331: 5000,1; | N331: 39240/3600*(nPatrolSec+3)*(1000+nGuanQia)/1000 | O331: 31380/3600*(nPatrolSec+3)*(1000+nGuanQia)/1000 | P331: 19320/3600*(nPatrolSec+3)*(1000+nGuanQia)/1000 | Q331: nGuanQia + 1000 | R331: 39240/60*nMin*(1000+nGuanQia)/1000 | S331: 31380/60*nMin*(1000+nGuanQia)/1000 | T331: 19320/60*nMin*(1000+nGuanQia)/1000 | U331: 喽啰 | V331: pet_21;pet_201;pet_93;pet_91; | W331: 4 | X331: 5 | Y331: 1,28000,8,0;1,19016,8,0;1,10007,5,0;1,10108,2,0;1,7,9000,0;1,8,9000,0;1,4,1000,0; | Z331: 0 | AA331: {} | AB331: n/60
A332: 328 | B332: 328 | C332: 328 | D332: 弑神试炼 | E332: 10501 | F332: 5 | G332: 3 | H332: 200328 | I332: 0 | J332: 480 | K332: 5000,0; | L332: 5 | M332: 5000,1; | N332: 39240/3600*(nPatrolSec+3)*(1000+nGuanQia)/1000 | O332: 31380/3600*(nPatrolSec+3)*(1000+nGuanQia)/1000 | P332: 19320/3600*(nPatrolSec+3)*(1000+nGuanQia)/1000 | Q332: nGuanQia + 1000 | R332: 39240/60*nMin*(1000+nGuanQia)/1000 | S332: 31380/60*nMin*(1000+nGuanQia)/1000 | T332: 19320/60*nMin*(1000+nGuanQia)/1000 | U332: 喽啰 | V332: pet_21;pet_201;pet_93;pet_91; | W332: 4 | X332: 5 | Y332: 1,28000,8,0;1,19016,8,0;1,10007,5,0;1,10108,2,0;1,7,9000,0;1,8,9000,0;1,4,1000,0; | Z332: 0 | AA332: {} | AB332: n/60
A333: 329 | B333: 329 | C333: 329 | D333: 弑神试炼 | E333: 10501 | F333: 5 | G333: 3 | H333: 200329 | I333: 0 | J333: 480 | K333: 5000,0; | L333: 5 | M333: 5000,1; | N333: 39240/3600*(nPatrolSec+3)*(1000+nGuanQia)/1000 | O333: 31380/3600*(nPatrolSec+3)*(1000+nGuanQia)/1000 | P333: 19320/3600*(nPatrolSec+3)*(1000+nGuanQia)/1000 | Q333: nGuanQia + 1000 | R333: 39240/60*nMin*(1000+nGuanQia)/1000 | S333: 31380/60*nMin*(1000+nGuanQia)/1000 | T333: 19320/60*nMin*(1000+nGuanQia)/1000 | U333: 喽啰 | V333: pet_21;pet_201;pet_93;pet_91; | W333: 4 | X333: 5 | Y333: 1,28000,8,0;1,19016,8,0;1,10007,5,0;1,10108,2,0;1,7,9000,0;1,8,9000,0;1,4,1000,0; | Z333: 0 | AA333: {} | AB333: n/60
A334: 330 | B334: 330 | C334: 330 | D334: 弑神试炼 | E334: 10501 | F334: 5 | G334: 3 | H334: 200330 | I334: 0 | J334: 480 | K334: 5000,0; | L334: 5 | M334: 5000,1; | N334: 39240/3600*(nPatrolSec+3)*(1000+nGuanQia)/1000 | O334: 31380/3600*(nPatrolSec+3)*(1000+nGuanQia)/1000 | P334: 19320/3600*(nPatrolSec+3)*(1000+nGuanQia)/1000 | Q334: nGuanQia + 1000 | R334: 39240/60*nMin*(1000+nGuanQia)/1000 | S334: 31380/60*nMin*(1000+nGuanQia)/1000 | T334: 19320/60*nMin*(1000+nGuanQia)/1000 | U334: 喽啰 | V334: pet_21;pet_201;pet_93;pet_91; | W334: 4 | X334: 5 | Y334: 1,28000,8,0;1,19016,8,0;1,10007,5,0;1,10108,2,0;1,7,9000,0;1,8,9000,0;1,4,1000,0; | Z334: 0 | AA334: {} | AB334: n/60
A335: 331 | B335: 331 | C335: 331 | D335: 弑神试炼 | E335: 10502 | F335: 5 | G335: 3 | H335: 200331 | I335: 0 | J335: 480 | K335: 5000,0; | L335: 5 | M335: 5000,1; | N335: 39240/3600*(nPatrolSec+3)*(1000+nGuanQia)/1000 | O335: 31380/3600*(nPatrolSec+3)*(1000+nGuanQia)/1000 | P335: 19320/3600*(nPatrolSec+3)*(1000+nGuanQia)/1000 | Q335: nGuanQia + 1000 | R335: 39240/60*nMin*(1000+nGuanQia)/1000 | S335: 31380/60*nMin*(1000+nGuanQia)/1000 | T335: 19320/60*nMin*(1000+nGuanQia)/1000 | U335: 喽啰 | V335: pet_21;pet_201;pet_93;pet_91; | W335: 4 | X335: 5 | Y335: 1,28000,8,0;1,19016,8,0;1,10007,5,0;1,10108,2,0;1,7,9000,0;1,8,9000,0;1,4,1000,0; | Z335: 0 | AA335: {} | AB335: n/60
A336: 332 | B336: 332 | C336: 332 | D336: 弑神试炼 | E336: 10502 | F336: 5 | G336: 3 | H336: 200332 | I336: 0 | J336: 480 | K336: 5000,0; | L336: 5 | M336: 5000,1; | N336: 39240/3600*(nPatrolSec+3)*(1000+nGuanQia)/1000 | O336: 31380/3600*(nPatrolSec+3)*(1000+nGuanQia)/1000 | P336: 19320/3600*(nPatrolSec+3)*(1000+nGuanQia)/1000 | Q336: nGuanQia + 1000 | R336: 39240/60*nMin*(1000+nGuanQia)/1000 | S336: 31380/60*nMin*(1000+nGuanQia)/1000 | T336: 19320/60*nMin*(1000+nGuanQia)/1000 | U336: 喽啰 | V336: pet_21;pet_201;pet_93;pet_91; | W336: 4 | X336: 5 | Y336: 1,28000,8,0;1,19016,8,0;1,10007,5,0;1,10108,2,0;1,7,9000,0;1,8,9000,0;1,4,1000,0; | Z336: 0 | AA336: {} | AB336: n/60
A337: 333 | B337: 333 | C337: 333 | D337: 弑神试炼 | E337: 10502 | F337: 5 | G337: 3 | H337: 200333 | I337: 0 | J337: 480 | K337: 5000,0; | L337: 5 | M337: 5000,1; | N337: 39240/3600*(nPatrolSec+3)*(1000+nGuanQia)/1000 | O337: 31380/3600*(nPatrolSec+3)*(1000+nGuanQia)/1000 | P337: 19320/3600*(nPatrolSec+3)*(1000+nGuanQia)/1000 | Q337: nGuanQia + 1000 | R337: 39240/60*nMin*(1000+nGuanQia)/1000 | S337: 31380/60*nMin*(1000+nGuanQia)/1000 | T337: 19320/60*nMin*(1000+nGuanQia)/1000 | U337: 喽啰 | V337: pet_21;pet_201;pet_93;pet_91; | W337: 4 | X337: 5 | Y337: 1,28000,8,0;1,19016,8,0;1,10007,5,0;1,10108,2,0;1,7,9000,0;1,8,9000,0;1,4,1000,0; | Z337: 0 | AA337: {} | AB337: n/60
A338: 334 | B338: 334 | C338: 334 | D338: 弑神试炼 | E338: 10502 | F338: 5 | G338: 3 | H338: 200334 | I338: 0 | J338: 480 | K338: 5000,0; | L338: 5 | M338: 5000,1; | N338: 39240/3600*(nPatrolSec+3)*(1000+nGuanQia)/1000 | O338: 31380/3600*(nPatrolSec+3)*(1000+nGuanQia)/1000 | P338: 19320/3600*(nPatrolSec+3)*(1000+nGuanQia)/1000 | Q338: nGuanQia + 1000 | R338: 39240/60*nMin*(1000+nGuanQia)/1000 | S338: 31380/60*nMin*(1000+nGuanQia)/1000 | T338: 19320/60*nMin*(1000+nGuanQia)/1000 | U338: 喽啰 | V338: pet_21;pet_201;pet_93;pet_91; | W338: 4 | X338: 5 | Y338: 1,28000,8,0;1,19016,8,0;1,10007,5,0;1,10108,2,0;1,7,9000,0;1,8,9000,0;1,4,1000,0; | Z338: 0 | AA338: {} | AB338: n/60
A339: 335 | B339: 335 | C339: 335 | D339: 弑神试炼 | E339: 10502 | F339: 5 | G339: 3 | H339: 200335 | I339: 0 | J339: 480 | K339: 5000,0; | L339: 5 | M339: 5000,1; | N339: 39240/3600*(nPatrolSec+3)*(1000+nGuanQia)/1000 | O339: 31380/3600*(nPatrolSec+3)*(1000+nGuanQia)/1000 | P339: 19320/3600*(nPatrolSec+3)*(1000+nGuanQia)/1000 | Q339: nGuanQia + 1000 | R339: 39240/60*nMin*(1000+nGuanQia)/1000 | S339: 31380/60*nMin*(1000+nGuanQia)/1000 | T339: 19320/60*nMin*(1000+nGuanQia)/1000 | U339: 喽啰 | V339: pet_21;pet_201;pet_93;pet_91; | W339: 4 | X339: 5 | Y339: 1,28000,8,0;1,19016,8,0;1,10007,5,0;1,10108,2,0;1,7,9000,0;1,8,9000,0;1,4,1000,0; | Z339: 0 | AA339: {} | AB339: n/60
A340: 336 | B340: 336 | C340: 336 | D340: 弑神试炼 | E340: 10502 | F340: 5 | G340: 3 | H340: 200336 | I340: 0 | J340: 480 | K340: 5000,0; | L340: 5 | M340: 5000,1; | N340: 39240/3600*(nPatrolSec+3)*(1000+nGuanQia)/1000 | O340: 31380/3600*(nPatrolSec+3)*(1000+nGuanQia)/1000 | P340: 19320/3600*(nPatrolSec+3)*(1000+nGuanQia)/1000 | Q340: nGuanQia + 1000 | R340: 39240/60*nMin*(1000+nGuanQia)/1000 | S340: 31380/60*nMin*(1000+nGuanQia)/1000 | T340: 19320/60*nMin*(1000+nGuanQia)/1000 | U340: 喽啰 | V340: pet_21;pet_201;pet_93;pet_91; | W340: 4 | X340: 5 | Y340: 1,28000,8,0;1,19016,8,0;1,10007,5,0;1,10108,2,0;1,7,9000,0;1,8,9000,0;1,4,1000,0; | Z340: 0 | AA340: {} | AB340: n/60
A341: 337 | B341: 337 | C341: 337 | D341: 弑神试炼 | E341: 10502 | F341: 5 | G341: 3 | H341: 200337 | I341: 0 | J341: 480 | K341: 5000,0; | L341: 5 | M341: 5000,1; | N341: 39240/3600*(nPatrolSec+3)*(1000+nGuanQia)/1000 | O341: 31380/3600*(nPatrolSec+3)*(1000+nGuanQia)/1000 | P341: 19320/3600*(nPatrolSec+3)*(1000+nGuanQia)/1000 | Q341: nGuanQia + 1000 | R341: 39240/60*nMin*(1000+nGuanQia)/1000 | S341: 31380/60*nMin*(1000+nGuanQia)/1000 | T341: 19320/60*nMin*(1000+nGuanQia)/1000 | U341: 喽啰 | V341: pet_21;pet_201;pet_93;pet_91; | W341: 4 | X341: 5 | Y341: 1,28000,8,0;1,19016,8,0;1,10007,5,0;1,10108,2,0;1,7,9000,0;1,8,9000,0;1,4,1000,0; | Z341: 0 | AA341: {} | AB341: n/60
A342: 338 | B342: 338 | C342: 338 | D342: 弑神试炼 | E342: 10502 | F342: 5 | G342: 3 | H342: 200338 | I342: 0 | J342: 480 | K342: 5000,0; | L342: 5 | M342: 5000,1; | N342: 39240/3600*(nPatrolSec+3)*(1000+nGuanQia)/1000 | O342: 31380/3600*(nPatrolSec+3)*(1000+nGuanQia)/1000 | P342: 19320/3600*(nPatrolSec+3)*(1000+nGuanQia)/1000 | Q342: nGuanQia + 1000 | R342: 39240/60*nMin*(1000+nGuanQia)/1000 | S342: 31380/60*nMin*(1000+nGuanQia)/1000 | T342: 19320/60*nMin*(1000+nGuanQia)/1000 | U342: 喽啰 | V342: pet_21;pet_201;pet_93;pet_91; | W342: 4 | X342: 5 | Y342: 1,28000,8,0;1,19016,8,0;1,10007,5,0;1,10108,2,0;1,7,9000,0;1,8,9000,0;1,4,1000,0; | Z342: 0 | AA342: {} | AB342: n/60
A343: 339 | B343: 339 | C343: 339 | D343: 弑神试炼 | E343: 10502 | F343: 5 | G343: 3 | H343: 200339 | I343: 0 | J343: 480 | K343: 5000,0; | L343: 5 | M343: 5000,1; | N343: 39240/3600*(nPatrolSec+3)*(1000+nGuanQia)/1000 | O343: 31380/3600*(nPatrolSec+3)*(1000+nGuanQia)/1000 | P343: 19320/3600*(nPatrolSec+3)*(1000+nGuanQia)/1000 | Q343: nGuanQia + 1000 | R343: 39240/60*nMin*(1000+nGuanQia)/1000 | S343: 31380/60*nMin*(1000+nGuanQia)/1000 | T343: 19320/60*nMin*(1000+nGuanQia)/1000 | U343: 喽啰 | V343: pet_21;pet_201;pet_93;pet_91; | W343: 4 | X343: 5 | Y343: 1,28000,8,0;1,19016,8,0;1,10007,5,0;1,10108,2,0;1,7,9000,0;1,8,9000,0;1,4,1000,0; | Z343: 0 | AA343: {} | AB343: n/60
A344: 340 | B344: 340 | C344: 340 | D344: 弑神试炼 | E344: 10502 | F344: 5 | G344: 3 | H344: 200340 | I344: 0 | J344: 480 | K344: 5000,0; | L344: 5 | M344: 5000,1; | N344: 39240/3600*(nPatrolSec+3)*(1000+nGuanQia)/1000 | O344: 31380/3600*(nPatrolSec+3)*(1000+nGuanQia)/1000 | P344: 19320/3600*(nPatrolSec+3)*(1000+nGuanQia)/1000 | Q344: nGuanQia + 1000 | R344: 39240/60*nMin*(1000+nGuanQia)/1000 | S344: 31380/60*nMin*(1000+nGuanQia)/1000 | T344: 19320/60*nMin*(1000+nGuanQia)/1000 | U344: 喽啰 | V344: pet_21;pet_201;pet_93;pet_91; | W344: 4 | X344: 5 | Y344: 1,28000,8,0;1,19016,8,0;1,10007,5,0;1,10108,2,0;1,7,9000,0;1,8,9000,0;1,4,1000,0; | Z344: 0 | AA344: {} | AB344: n/60
A345: 341 | B345: 341 | C345: 341 | D345: 弑神试炼 | E345: 10502 | F345: 5 | G345: 3 | H345: 200341 | I345: 0 | J345: 480 | K345: 5000,0; | L345: 5 | M345: 5000,1; | N345: 39240/3600*(nPatrolSec+3)*(1000+nGuanQia)/1000 | O345: 31380/3600*(nPatrolSec+3)*(1000+nGuanQia)/1000 | P345: 19320/3600*(nPatrolSec+3)*(1000+nGuanQia)/1000 | Q345: nGuanQia + 1000 | R345: 39240/60*nMin*(1000+nGuanQia)/1000 | S345: 31380/60*nMin*(1000+nGuanQia)/1000 | T345: 19320/60*nMin*(1000+nGuanQia)/1000 | U345: 喽啰 | V345: pet_21;pet_201;pet_93;pet_91; | W345: 4 | X345: 5 | Y345: 1,28000,8,0;1,19016,8,0;1,10007,5,0;1,10108,2,0;1,7,9000,0;1,8,9000,0;1,4,1000,0; | Z345: 0 | AA345: {} | AB345: n/60
A346: 342 | B346: 342 | C346: 342 | D346: 弑神试炼 | E346: 10502 | F346: 5 | G346: 3 | H346: 200342 | I346: 0 | J346: 480 | K346: 5000,0; | L346: 5 | M346: 5000,1; | N346: 39240/3600*(nPatrolSec+3)*(1000+nGuanQia)/1000 | O346: 31380/3600*(nPatrolSec+3)*(1000+nGuanQia)/1000 | P346: 19320/3600*(nPatrolSec+3)*(1000+nGuanQia)/1000 | Q346: nGuanQia + 1000 | R346: 39240/60*nMin*(1000+nGuanQia)/1000 | S346: 31380/60*nMin*(1000+nGuanQia)/1000 | T346: 19320/60*nMin*(1000+nGuanQia)/1000 | U346: 喽啰 | V346: pet_21;pet_201;pet_93;pet_91; | W346: 4 | X346: 5 | Y346: 1,28000,8,0;1,19016,8,0;1,10007,5,0;1,10108,2,0;1,7,9000,0;1,8,9000,0;1,4,1000,0; | Z346: 0 | AA346: {} | AB346: n/60
A347: 343 | B347: 343 | C347: 343 | D347: 弑神试炼 | E347: 10502 | F347: 5 | G347: 3 | H347: 200343 | I347: 0 | J347: 480 | K347: 5000,0; | L347: 5 | M347: 5000,1; | N347: 39240/3600*(nPatrolSec+3)*(1000+nGuanQia)/1000 | O347: 31380/3600*(nPatrolSec+3)*(1000+nGuanQia)/1000 | P347: 19320/3600*(nPatrolSec+3)*(1000+nGuanQia)/1000 | Q347: nGuanQia + 1000 | R347: 39240/60*nMin*(1000+nGuanQia)/1000 | S347: 31380/60*nMin*(1000+nGuanQia)/1000 | T347: 19320/60*nMin*(1000+nGuanQia)/1000 | U347: 喽啰 | V347: pet_21;pet_201;pet_93;pet_91; | W347: 4 | X347: 5 | Y347: 1,28000,8,0;1,19016,8,0;1,10007,5,0;1,10108,2,0;1,7,9000,0;1,8,9000,0;1,4,1000,0; | Z347: 0 | AA347: {} | AB347: n/60
A348: 344 | B348: 344 | C348: 344 | D348: 弑神试炼 | E348: 10502 | F348: 5 | G348: 3 | H348: 200344 | I348: 0 | J348: 480 | K348: 5000,0; | L348: 5 | M348: 5000,1; | N348: 39240/3600*(nPatrolSec+3)*(1000+nGuanQia)/1000 | O348: 31380/3600*(nPatrolSec+3)*(1000+nGuanQia)/1000 | P348: 19320/3600*(nPatrolSec+3)*(1000+nGuanQia)/1000 | Q348: nGuanQia + 1000 | R348: 39240/60*nMin*(1000+nGuanQia)/1000 | S348: 31380/60*nMin*(1000+nGuanQia)/1000 | T348: 19320/60*nMin*(1000+nGuanQia)/1000 | U348: 喽啰 | V348: pet_21;pet_201;pet_93;pet_91; | W348: 4 | X348: 5 | Y348: 1,28000,8,0;1,19016,8,0;1,10007,5,0;1,10108,2,0;1,7,9000,0;1,8,9000,0;1,4,1000,0; | Z348: 0 | AA348: {} | AB348: n/60
A349: 345 | B349: 345 | C349: 345 | D349: 弑神试炼 | E349: 10503 | F349: 5 | G349: 3 | H349: 200345 | I349: 0 | J349: 480 | K349: 5000,0; | L349: 5 | M349: 5000,1; | N349: 39240/3600*(nPatrolSec+3)*(1000+nGuanQia)/1000 | O349: 31380/3600*(nPatrolSec+3)*(1000+nGuanQia)/1000 | P349: 19320/3600*(nPatrolSec+3)*(1000+nGuanQia)/1000 | Q349: nGuanQia + 1000 | R349: 39240/60*nMin*(1000+nGuanQia)/1000 | S349: 31380/60*nMin*(1000+nGuanQia)/1000 | T349: 19320/60*nMin*(1000+nGuanQia)/1000 | U349: 喽啰 | V349: pet_21;pet_201;pet_93;pet_91; | W349: 4 | X349: 5 | Y349: 1,28000,8,0;1,19016,8,0;1,10007,5,0;1,10108,2,0;1,7,9000,0;1,8,9000,0;1,4,1000,0; | Z349: 0 | AA349: {} | AB349: n/60
A350: 346 | B350: 346 | C350: 346 | D350: 弑神试炼 | E350: 10503 | F350: 5 | G350: 3 | H350: 200346 | I350: 0 | J350: 480 | K350: 5000,0; | L350: 5 | M350: 5000,1; | N350: 39240/3600*(nPatrolSec+3)*(1000+nGuanQia)/1000 | O350: 31380/3600*(nPatrolSec+3)*(1000+nGuanQia)/1000 | P350: 19320/3600*(nPatrolSec+3)*(1000+nGuanQia)/1000 | Q350: nGuanQia + 1000 | R350: 39240/60*nMin*(1000+nGuanQia)/1000 | S350: 31380/60*nMin*(1000+nGuanQia)/1000 | T350: 19320/60*nMin*(1000+nGuanQia)/1000 | U350: 喽啰 | V350: pet_21;pet_201;pet_93;pet_91; | W350: 4 | X350: 5 | Y350: 1,28000,8,0;1,19016,8,0;1,10007,5,0;1,10108,2,0;1,7,9000,0;1,8,9000,0;1,4,1000,0; | Z350: 0 | AA350: {} | AB350: n/60
A351: 347 | B351: 347 | C351: 347 | D351: 弑神试炼 | E351: 10503 | F351: 5 | G351: 3 | H351: 200347 | I351: 0 | J351: 480 | K351: 5000,0; | L351: 5 | M351: 5000,1; | N351: 39240/3600*(nPatrolSec+3)*(1000+nGuanQia)/1000 | O351: 31380/3600*(nPatrolSec+3)*(1000+nGuanQia)/1000 | P351: 19320/3600*(nPatrolSec+3)*(1000+nGuanQia)/1000 | Q351: nGuanQia + 1000 | R351: 39240/60*nMin*(1000+nGuanQia)/1000 | S351: 31380/60*nMin*(1000+nGuanQia)/1000 | T351: 19320/60*nMin*(1000+nGuanQia)/1000 | U351: 喽啰 | V351: pet_21;pet_201;pet_93;pet_91; | W351: 4 | X351: 5 | Y351: 1,28000,8,0;1,19016,8,0;1,10007,5,0;1,10108,2,0;1,7,9000,0;1,8,9000,0;1,4,1000,0; | Z351: 0 | AA351: {} | AB351: n/60
A352: 348 | B352: 348 | C352: 348 | D352: 弑神试炼 | E352: 10503 | F352: 5 | G352: 3 | H352: 200348 | I352: 0 | J352: 480 | K352: 5000,0; | L352: 5 | M352: 5000,1; | N352: 39240/3600*(nPatrolSec+3)*(1000+nGuanQia)/1000 | O352: 31380/3600*(nPatrolSec+3)*(1000+nGuanQia)/1000 | P352: 19320/3600*(nPatrolSec+3)*(1000+nGuanQia)/1000 | Q352: nGuanQia + 1000 | R352: 39240/60*nMin*(1000+nGuanQia)/1000 | S352: 31380/60*nMin*(1000+nGuanQia)/1000 | T352: 19320/60*nMin*(1000+nGuanQia)/1000 | U352: 喽啰 | V352: pet_21;pet_201;pet_93;pet_91; | W352: 4 | X352: 5 | Y352: 1,28000,8,0;1,19016,8,0;1,10007,5,0;1,10108,2,0;1,7,9000,0;1,8,9000,0;1,4,1000,0; | Z352: 0 | AA352: {} | AB352: n/60
A353: 349 | B353: 349 | C353: 349 | D353: 弑神试炼 | E353: 10503 | F353: 5 | G353: 3 | H353: 200349 | I353: 0 | J353: 480 | K353: 5000,0; | L353: 5 | M353: 5000,1; | N353: 39240/3600*(nPatrolSec+3)*(1000+nGuanQia)/1000 | O353: 31380/3600*(nPatrolSec+3)*(1000+nGuanQia)/1000 | P353: 19320/3600*(nPatrolSec+3)*(1000+nGuanQia)/1000 | Q353: nGuanQia + 1000 | R353: 39240/60*nMin*(1000+nGuanQia)/1000 | S353: 31380/60*nMin*(1000+nGuanQia)/1000 | T353: 19320/60*nMin*(1000+nGuanQia)/1000 | U353: 喽啰 | V353: pet_21;pet_201;pet_93;pet_91; | W353: 4 | X353: 5 | Y353: 1,28000,8,0;1,19016,8,0;1,10007,5,0;1,10108,2,0;1,7,9000,0;1,8,9000,0;1,4,1000,0; | Z353: 0 | AA353: {} | AB353: n/60
A354: 350 | B354: 350 | C354: 350 | D354: 弑神试炼 | E354: 10503 | F354: 5 | G354: 3 | H354: 200350 | I354: 0 | J354: 480 | K354: 5000,0; | L354: 5 | M354: 5000,1; | N354: 39240/3600*(nPatrolSec+3)*(1000+nGuanQia)/1000 | O354: 31380/3600*(nPatrolSec+3)*(1000+nGuanQia)/1000 | P354: 19320/3600*(nPatrolSec+3)*(1000+nGuanQia)/1000 | Q354: nGuanQia + 1000 | R354: 39240/60*nMin*(1000+nGuanQia)/1000 | S354: 31380/60*nMin*(1000+nGuanQia)/1000 | T354: 19320/60*nMin*(1000+nGuanQia)/1000 | U354: 喽啰 | V354: pet_21;pet_201;pet_93;pet_91; | W354: 4 | X354: 5 | Y354: 1,28000,8,0;1,19016,8,0;1,10007,5,0;1,10108,2,0;1,7,9000,0;1,8,9000,0;1,4,1000,0; | Z354: 0 | AA354: {} | AB354: n/60
A355: 351 | B355: 351 | C355: 351 | D355: 弑神试炼 | E355: 10503 | F355: 5 | G355: 3 | H355: 200351 | I355: 0 | J355: 480 | K355: 5000,0; | L355: 5 | M355: 5000,1; | N355: 39240/3600*(nPatrolSec+3)*(1000+nGuanQia)/1000 | O355: 31380/3600*(nPatrolSec+3)*(1000+nGuanQia)/1000 | P355: 19320/3600*(nPatrolSec+3)*(1000+nGuanQia)/1000 | Q355: nGuanQia + 1000 | R355: 39240/60*nMin*(1000+nGuanQia)/1000 | S355: 31380/60*nMin*(1000+nGuanQia)/1000 | T355: 19320/60*nMin*(1000+nGuanQia)/1000 | U355: 喽啰 | V355: pet_21;pet_201;pet_93;pet_91; | W355: 4 | X355: 5 | Y355: 1,28000,8,0;1,19016,8,0;1,10007,5,0;1,10108,2,0;1,7,9000,0;1,8,9000,0;1,4,1000,0; | Z355: 0 | AA355: {} | AB355: n/60
A356: 352 | B356: 352 | C356: 352 | D356: 弑神试炼 | E356: 10503 | F356: 5 | G356: 3 | H356: 200352 | I356: 0 | J356: 480 | K356: 5000,0; | L356: 5 | M356: 5000,1; | N356: 39240/3600*(nPatrolSec+3)*(1000+nGuanQia)/1000 | O356: 31380/3600*(nPatrolSec+3)*(1000+nGuanQia)/1000 | P356: 19320/3600*(nPatrolSec+3)*(1000+nGuanQia)/1000 | Q356: nGuanQia + 1000 | R356: 39240/60*nMin*(1000+nGuanQia)/1000 | S356: 31380/60*nMin*(1000+nGuanQia)/1000 | T356: 19320/60*nMin*(1000+nGuanQia)/1000 | U356: 喽啰 | V356: pet_21;pet_201;pet_93;pet_91; | W356: 4 | X356: 5 | Y356: 1,28000,8,0;1,19016,8,0;1,10007,5,0;1,10108,2,0;1,7,9000,0;1,8,9000,0;1,4,1000,0; | Z356: 0 | AA356: {} | AB356: n/60
A357: 353 | B357: 353 | C357: 353 | D357: 弑神试炼 | E357: 10503 | F357: 5 | G357: 3 | H357: 200353 | I357: 0 | J357: 480 | K357: 5000,0; | L357: 5 | M357: 5000,1; | N357: 39240/3600*(nPatrolSec+3)*(1000+nGuanQia)/1000 | O357: 31380/3600*(nPatrolSec+3)*(1000+nGuanQia)/1000 | P357: 19320/3600*(nPatrolSec+3)*(1000+nGuanQia)/1000 | Q357: nGuanQia + 1000 | R357: 39240/60*nMin*(1000+nGuanQia)/1000 | S357: 31380/60*nMin*(1000+nGuanQia)/1000 | T357: 19320/60*nMin*(1000+nGuanQia)/1000 | U357: 喽啰 | V357: pet_21;pet_201;pet_93;pet_91; | W357: 4 | X357: 5 | Y357: 1,28000,8,0;1,19016,8,0;1,10007,5,0;1,10108,2,0;1,7,9000,0;1,8,9000,0;1,4,1000,0; | Z357: 0 | AA357: {} | AB357: n/60
A358: 354 | B358: 354 | C358: 354 | D358: 弑神试炼 | E358: 10503 | F358: 5 | G358: 3 | H358: 200354 | I358: 0 | J358: 480 | K358: 5000,0; | L358: 5 | M358: 5000,1; | N358: 39240/3600*(nPatrolSec+3)*(1000+nGuanQia)/1000 | O358: 31380/3600*(nPatrolSec+3)*(1000+nGuanQia)/1000 | P358: 19320/3600*(nPatrolSec+3)*(1000+nGuanQia)/1000 | Q358: nGuanQia + 1000 | R358: 39240/60*nMin*(1000+nGuanQia)/1000 | S358: 31380/60*nMin*(1000+nGuanQia)/1000 | T358: 19320/60*nMin*(1000+nGuanQia)/1000 | U358: 喽啰 | V358: pet_21;pet_201;pet_93;pet_91; | W358: 4 | X358: 5 | Y358: 1,28000,8,0;1,19016,8,0;1,10007,5,0;1,10108,2,0;1,7,9000,0;1,8,9000,0;1,4,1000,0; | Z358: 0 | AA358: {} | AB358: n/60
A359: 355 | B359: 355 | C359: 355 | D359: 弑神试炼 | E359: 10503 | F359: 5 | G359: 3 | H359: 200355 | I359: 0 | J359: 480 | K359: 5000,0; | L359: 5 | M359: 5000,1; | N359: 39240/3600*(nPatrolSec+3)*(1000+nGuanQia)/1000 | O359: 31380/3600*(nPatrolSec+3)*(1000+nGuanQia)/1000 | P359: 19320/3600*(nPatrolSec+3)*(1000+nGuanQia)/1000 | Q359: nGuanQia + 1000 | R359: 39240/60*nMin*(1000+nGuanQia)/1000 | S359: 31380/60*nMin*(1000+nGuanQia)/1000 | T359: 19320/60*nMin*(1000+nGuanQia)/1000 | U359: 喽啰 | V359: pet_21;pet_201;pet_93;pet_91; | W359: 4 | X359: 5 | Y359: 1,28000,8,0;1,19016,8,0;1,10007,5,0;1,10108,2,0;1,7,9000,0;1,8,9000,0;1,4,1000,0; | Z359: 0 | AA359: {} | AB359: n/60
A360: 356 | B360: 356 | C360: 356 | D360: 弑神试炼 | E360: 10503 | F360: 5 | G360: 3 | H360: 200356 | I360: 0 | J360: 480 | K360: 5000,0; | L360: 5 | M360: 5000,1; | N360: 39240/3600*(nPatrolSec+3)*(1000+nGuanQia)/1000 | O360: 31380/3600*(nPatrolSec+3)*(1000+nGuanQia)/1000 | P360: 19320/3600*(nPatrolSec+3)*(1000+nGuanQia)/1000 | Q360: nGuanQia + 1000 | R360: 39240/60*nMin*(1000+nGuanQia)/1000 | S360: 31380/60*nMin*(1000+nGuanQia)/1000 | T360: 19320/60*nMin*(1000+nGuanQia)/1000 | U360: 喽啰 | V360: pet_21;pet_201;pet_93;pet_91; | W360: 4 | X360: 5 | Y360: 1,28000,8,0;1,19016,8,0;1,10007,5,0;1,10108,2,0;1,7,9000,0;1,8,9000,0;1,4,1000,0; | Z360: 0 | AA360: {} | AB360: n/60
A361: 357 | B361: 357 | C361: 357 | D361: 弑神试炼 | E361: 10503 | F361: 5 | G361: 3 | H361: 200357 | I361: 0 | J361: 480 | K361: 5000,0; | L361: 5 | M361: 5000,1; | N361: 39240/3600*(nPatrolSec+3)*(1000+nGuanQia)/1000 | O361: 31380/3600*(nPatrolSec+3)*(1000+nGuanQia)/1000 | P361: 19320/3600*(nPatrolSec+3)*(1000+nGuanQia)/1000 | Q361: nGuanQia + 1000 | R361: 39240/60*nMin*(1000+nGuanQia)/1000 | S361: 31380/60*nMin*(1000+nGuanQia)/1000 | T361: 19320/60*nMin*(1000+nGuanQia)/1000 | U361: 喽啰 | V361: pet_21;pet_201;pet_93;pet_91; | W361: 4 | X361: 5 | Y361: 1,28000,8,0;1,19016,8,0;1,10007,5,0;1,10108,2,0;1,7,9000,0;1,8,9000,0;1,4,1000,0; | Z361: 0 | AA361: {} | AB361: n/60
A362: 358 | B362: 358 | C362: 358 | D362: 弑神试炼 | E362: 10503 | F362: 5 | G362: 3 | H362: 200358 | I362: 0 | J362: 480 | K362: 5000,0; | L362: 5 | M362: 5000,1; | N362: 39240/3600*(nPatrolSec+3)*(1000+nGuanQia)/1000 | O362: 31380/3600*(nPatrolSec+3)*(1000+nGuanQia)/1000 | P362: 19320/3600*(nPatrolSec+3)*(1000+nGuanQia)/1000 | Q362: nGuanQia + 1000 | R362: 39240/60*nMin*(1000+nGuanQia)/1000 | S362: 31380/60*nMin*(1000+nGuanQia)/1000 | T362: 19320/60*nMin*(1000+nGuanQia)/1000 | U362: 喽啰 | V362: pet_21;pet_201;pet_93;pet_91; | W362: 4 | X362: 5 | Y362: 1,28000,8,0;1,19016,8,0;1,10007,5,0;1,10108,2,0;1,7,9000,0;1,8,9000,0;1,4,1000,0; | Z362: 0 | AA362: {} | AB362: n/60
A363: 359 | B363: 359 | C363: 359 | D363: 弑神试炼 | E363: 10503 | F363: 5 | G363: 3 | H363: 200359 | I363: 0 | J363: 480 | K363: 5000,0; | L363: 5 | M363: 5000,1; | N363: 39240/3600*(nPatrolSec+3)*(1000+nGuanQia)/1000 | O363: 31380/3600*(nPatrolSec+3)*(1000+nGuanQia)/1000 | P363: 19320/3600*(nPatrolSec+3)*(1000+nGuanQia)/1000 | Q363: nGuanQia + 1000 | R363: 39240/60*nMin*(1000+nGuanQia)/1000 | S363: 31380/60*nMin*(1000+nGuanQia)/1000 | T363: 19320/60*nMin*(1000+nGuanQia)/1000 | U363: 喽啰 | V363: pet_21;pet_201;pet_93;pet_91; | W363: 4 | X363: 5 | Y363: 1,28000,8,0;1,19016,8,0;1,10007,5,0;1,10108,2,0;1,7,9000,0;1,8,9000,0;1,4,1000,0; | Z363: 0 | AA363: {} | AB363: n/60
A364: 360 | B364: 360 | C364: 360 | D364: 弑神试炼 | E364: 10504 | F364: 5 | G364: 3 | H364: 200360 | I364: 0 | J364: 480 | K364: 5000,0; | L364: 5 | M364: 5000,1; | N364: 39240/3600*(nPatrolSec+3)*(1000+nGuanQia)/1000 | O364: 31380/3600*(nPatrolSec+3)*(1000+nGuanQia)/1000 | P364: 19320/3600*(nPatrolSec+3)*(1000+nGuanQia)/1000 | Q364: nGuanQia + 1000 | R364: 39240/60*nMin*(1000+nGuanQia)/1000 | S364: 31380/60*nMin*(1000+nGuanQia)/1000 | T364: 19320/60*nMin*(1000+nGuanQia)/1000 | U364: 喽啰 | V364: pet_21;pet_201;pet_93;pet_91; | W364: 4 | X364: 5 | Y364: 1,28000,8,0;1,19016,8,0;1,10007,5,0;1,10108,2,0;1,7,9000,0;1,8,9000,0;1,4,1000,0; | Z364: 0 | AA364: {} | AB364: n/60
A365: 361 | B365: 361 | C365: 361 | D365: 弑神试炼 | E365: 10504 | F365: 5 | G365: 3 | H365: 200361 | I365: 0 | J365: 480 | K365: 5000,0; | L365: 5 | M365: 5000,1; | N365: 39240/3600*(nPatrolSec+3)*(1000+nGuanQia)/1000 | O365: 31380/3600*(nPatrolSec+3)*(1000+nGuanQia)/1000 | P365: 19320/3600*(nPatrolSec+3)*(1000+nGuanQia)/1000 | Q365: nGuanQia + 1000 | R365: 39240/60*nMin*(1000+nGuanQia)/1000 | S365: 31380/60*nMin*(1000+nGuanQia)/1000 | T365: 19320/60*nMin*(1000+nGuanQia)/1000 | U365: 喽啰 | V365: pet_21;pet_201;pet_93;pet_91; | W365: 4 | X365: 5 | Y365: 1,28000,8,0;1,19016,8,0;1,10007,5,0;1,10108,2,0;1,7,9000,0;1,8,9000,0;1,4,1000,0; | Z365: 0 | AA365: {} | AB365: n/60
A366: 362 | B366: 362 | C366: 362 | D366: 弑神试炼 | E366: 10504 | F366: 5 | G366: 3 | H366: 200362 | I366: 0 | J366: 480 | K366: 5000,0; | L366: 5 | M366: 5000,1; | N366: 39240/3600*(nPatrolSec+3)*(1000+nGuanQia)/1000 | O366: 31380/3600*(nPatrolSec+3)*(1000+nGuanQia)/1000 | P366: 19320/3600*(nPatrolSec+3)*(1000+nGuanQia)/1000 | Q366: nGuanQia + 1000 | R366: 39240/60*nMin*(1000+nGuanQia)/1000 | S366: 31380/60*nMin*(1000+nGuanQia)/1000 | T366: 19320/60*nMin*(1000+nGuanQia)/1000 | U366: 喽啰 | V366: pet_21;pet_201;pet_93;pet_91; | W366: 4 | X366: 5 | Y366: 1,28000,8,0;1,19016,8,0;1,10007,5,0;1,10108,2,0;1,7,9000,0;1,8,9000,0;1,4,1000,0; | Z366: 0 | AA366: {} | AB366: n/60
A367: 363 | B367: 363 | C367: 363 | D367: 弑神试炼 | E367: 10504 | F367: 5 | G367: 3 | H367: 200363 | I367: 0 | J367: 480 | K367: 5000,0; | L367: 5 | M367: 5000,1; | N367: 39240/3600*(nPatrolSec+3)*(1000+nGuanQia)/1000 | O367: 31380/3600*(nPatrolSec+3)*(1000+nGuanQia)/1000 | P367: 19320/3600*(nPatrolSec+3)*(1000+nGuanQia)/1000 | Q367: nGuanQia + 1000 | R367: 39240/60*nMin*(1000+nGuanQia)/1000 | S367: 31380/60*nMin*(1000+nGuanQia)/1000 | T367: 19320/60*nMin*(1000+nGuanQia)/1000 | U367: 喽啰 | V367: pet_21;pet_201;pet_93;pet_91; | W367: 4 | X367: 5 | Y367: 1,28000,8,0;1,19016,8,0;1,10007,5,0;1,10108,2,0;1,7,9000,0;1,8,9000,0;1,4,1000,0; | Z367: 0 | AA367: {} | AB367: n/60
A368: 364 | B368: 364 | C368: 364 | D368: 弑神试炼 | E368: 10504 | F368: 5 | G368: 3 | H368: 200364 | I368: 0 | J368: 480 | K368: 5000,0; | L368: 5 | M368: 5000,1; | N368: 39240/3600*(nPatrolSec+3)*(1000+nGuanQia)/1000 | O368: 31380/3600*(nPatrolSec+3)*(1000+nGuanQia)/1000 | P368: 19320/3600*(nPatrolSec+3)*(1000+nGuanQia)/1000 | Q368: nGuanQia + 1000 | R368: 39240/60*nMin*(1000+nGuanQia)/1000 | S368: 31380/60*nMin*(1000+nGuanQia)/1000 | T368: 19320/60*nMin*(1000+nGuanQia)/1000 | U368: 喽啰 | V368: pet_21;pet_201;pet_93;pet_91; | W368: 4 | X368: 5 | Y368: 1,28000,8,0;1,19016,8,0;1,10007,5,0;1,10108,2,0;1,7,9000,0;1,8,9000,0;1,4,1000,0; | Z368: 0 | AA368: {} | AB368: n/60
A369: 365 | B369: 365 | C369: 365 | D369: 弑神试炼 | E369: 10504 | F369: 5 | G369: 3 | H369: 200365 | I369: 0 | J369: 480 | K369: 5000,0; | L369: 5 | M369: 5000,1; | N369: 39240/3600*(nPatrolSec+3)*(1000+nGuanQia)/1000 | O369: 31380/3600*(nPatrolSec+3)*(1000+nGuanQia)/1000 | P369: 19320/3600*(nPatrolSec+3)*(1000+nGuanQia)/1000 | Q369: nGuanQia + 1000 | R369: 39240/60*nMin*(1000+nGuanQia)/1000 | S369: 31380/60*nMin*(1000+nGuanQia)/1000 | T369: 19320/60*nMin*(1000+nGuanQia)/1000 | U369: 喽啰 | V369: pet_21;pet_201;pet_93;pet_91; | W369: 4 | X369: 5 | Y369: 1,28000,8,0;1,19016,8,0;1,10007,5,0;1,10108,2,0;1,7,9000,0;1,8,9000,0;1,4,1000,0; | Z369: 0 | AA369: {} | AB369: n/60
A370: 366 | B370: 366 | C370: 366 | D370: 弑神试炼 | E370: 10504 | F370: 5 | G370: 3 | H370: 200366 | I370: 0 | J370: 480 | K370: 5000,0; | L370: 5 | M370: 5000,1; | N370: 39240/3600*(nPatrolSec+3)*(1000+nGuanQia)/1000 | O370: 31380/3600*(nPatrolSec+3)*(1000+nGuanQia)/1000 | P370: 19320/3600*(nPatrolSec+3)*(1000+nGuanQia)/1000 | Q370: nGuanQia + 1000 | R370: 39240/60*nMin*(1000+nGuanQia)/1000 | S370: 31380/60*nMin*(1000+nGuanQia)/1000 | T370: 19320/60*nMin*(1000+nGuanQia)/1000 | U370: 喽啰 | V370: pet_21;pet_201;pet_93;pet_91; | W370: 4 | X370: 5 | Y370: 1,28000,8,0;1,19016,8,0;1,10007,5,0;1,10108,2,0;1,7,9000,0;1,8,9000,0;1,4,1000,0; | Z370: 0 | AA370: {} | AB370: n/60
A371: 367 | B371: 367 | C371: 367 | D371: 弑神试炼 | E371: 10504 | F371: 5 | G371: 3 | H371: 200367 | I371: 0 | J371: 480 | K371: 5000,0; | L371: 5 | M371: 5000,1; | N371: 39240/3600*(nPatrolSec+3)*(1000+nGuanQia)/1000 | O371: 31380/3600*(nPatrolSec+3)*(1000+nGuanQia)/1000 | P371: 19320/3600*(nPatrolSec+3)*(1000+nGuanQia)/1000 | Q371: nGuanQia + 1000 | R371: 39240/60*nMin*(1000+nGuanQia)/1000 | S371: 31380/60*nMin*(1000+nGuanQia)/1000 | T371: 19320/60*nMin*(1000+nGuanQia)/1000 | U371: 喽啰 | V371: pet_21;pet_201;pet_93;pet_91; | W371: 4 | X371: 5 | Y371: 1,28000,8,0;1,19016,8,0;1,10007,5,0;1,10108,2,0;1,7,9000,0;1,8,9000,0;1,4,1000,0; | Z371: 0 | AA371: {} | AB371: n/60
A372: 368 | B372: 368 | C372: 368 | D372: 弑神试炼 | E372: 10504 | F372: 5 | G372: 3 | H372: 200368 | I372: 0 | J372: 480 | K372: 5000,0; | L372: 5 | M372: 5000,1; | N372: 39240/3600*(nPatrolSec+3)*(1000+nGuanQia)/1000 | O372: 31380/3600*(nPatrolSec+3)*(1000+nGuanQia)/1000 | P372: 19320/3600*(nPatrolSec+3)*(1000+nGuanQia)/1000 | Q372: nGuanQia + 1000 | R372: 39240/60*nMin*(1000+nGuanQia)/1000 | S372: 31380/60*nMin*(1000+nGuanQia)/1000 | T372: 19320/60*nMin*(1000+nGuanQia)/1000 | U372: 喽啰 | V372: pet_21;pet_201;pet_93;pet_91; | W372: 4 | X372: 5 | Y372: 1,28000,8,0;1,19016,8,0;1,10007,5,0;1,10108,2,0;1,7,9000,0;1,8,9000,0;1,4,1000,0; | Z372: 0 | AA372: {} | AB372: n/60
A373: 369 | B373: 369 | C373: 369 | D373: 弑神试炼 | E373: 10504 | F373: 5 | G373: 3 | H373: 200369 | I373: 0 | J373: 480 | K373: 5000,0; | L373: 5 | M373: 5000,1; | N373: 39240/3600*(nPatrolSec+3)*(1000+nGuanQia)/1000 | O373: 31380/3600*(nPatrolSec+3)*(1000+nGuanQia)/1000 | P373: 19320/3600*(nPatrolSec+3)*(1000+nGuanQia)/1000 | Q373: nGuanQia + 1000 | R373: 39240/60*nMin*(1000+nGuanQia)/1000 | S373: 31380/60*nMin*(1000+nGuanQia)/1000 | T373: 19320/60*nMin*(1000+nGuanQia)/1000 | U373: 喽啰 | V373: pet_21;pet_201;pet_93;pet_91; | W373: 4 | X373: 5 | Y373: 1,28000,8,0;1,19016,8,0;1,10007,5,0;1,10108,2,0;1,7,9000,0;1,8,9000,0;1,4,1000,0; | Z373: 0 | AA373: {} | AB373: n/60
A374: 370 | B374: 370 | C374: 370 | D374: 弑神试炼 | E374: 10504 | F374: 5 | G374: 3 | H374: 200370 | I374: 0 | J374: 480 | K374: 5000,0; | L374: 5 | M374: 5000,1; | N374: 39240/3600*(nPatrolSec+3)*(1000+nGuanQia)/1000 | O374: 31380/3600*(nPatrolSec+3)*(1000+nGuanQia)/1000 | P374: 19320/3600*(nPatrolSec+3)*(1000+nGuanQia)/1000 | Q374: nGuanQia + 1000 | R374: 39240/60*nMin*(1000+nGuanQia)/1000 | S374: 31380/60*nMin*(1000+nGuanQia)/1000 | T374: 19320/60*nMin*(1000+nGuanQia)/1000 | U374: 喽啰 | V374: pet_21;pet_201;pet_93;pet_91; | W374: 4 | X374: 5 | Y374: 1,28000,8,0;1,19016,8,0;1,10007,5,0;1,10108,2,0;1,7,9000,0;1,8,9000,0;1,4,1000,0; | Z374: 0 | AA374: {} | AB374: n/60
A375: 371 | B375: 371 | C375: 371 | D375: 弑神试炼 | E375: 10504 | F375: 5 | G375: 3 | H375: 200371 | I375: 0 | J375: 480 | K375: 5000,0; | L375: 5 | M375: 5000,1; | N375: 39240/3600*(nPatrolSec+3)*(1000+nGuanQia)/1000 | O375: 31380/3600*(nPatrolSec+3)*(1000+nGuanQia)/1000 | P375: 19320/3600*(nPatrolSec+3)*(1000+nGuanQia)/1000 | Q375: nGuanQia + 1000 | R375: 39240/60*nMin*(1000+nGuanQia)/1000 | S375: 31380/60*nMin*(1000+nGuanQia)/1000 | T375: 19320/60*nMin*(1000+nGuanQia)/1000 | U375: 喽啰 | V375: pet_21;pet_201;pet_93;pet_91; | W375: 4 | X375: 5 | Y375: 1,28000,8,0;1,19016,8,0;1,10007,5,0;1,10108,2,0;1,7,9000,0;1,8,9000,0;1,4,1000,0; | Z375: 0 | AA375: {} | AB375: n/60
A376: 372 | B376: 372 | C376: 372 | D376: 弑神试炼 | E376: 10504 | F376: 5 | G376: 3 | H376: 200372 | I376: 0 | J376: 480 | K376: 5000,0; | L376: 5 | M376: 5000,1; | N376: 39240/3600*(nPatrolSec+3)*(1000+nGuanQia)/1000 | O376: 31380/3600*(nPatrolSec+3)*(1000+nGuanQia)/1000 | P376: 19320/3600*(nPatrolSec+3)*(1000+nGuanQia)/1000 | Q376: nGuanQia + 1000 | R376: 39240/60*nMin*(1000+nGuanQia)/1000 | S376: 31380/60*nMin*(1000+nGuanQia)/1000 | T376: 19320/60*nMin*(1000+nGuanQia)/1000 | U376: 喽啰 | V376: pet_21;pet_201;pet_93;pet_91; | W376: 4 | X376: 5 | Y376: 1,28000,8,0;1,19016,8,0;1,10007,5,0;1,10108,2,0;1,7,9000,0;1,8,9000,0;1,4,1000,0; | Z376: 0 | AA376: {} | AB376: n/60
A377: 373 | B377: 373 | C377: 373 | D377: 弑神试炼 | E377: 10504 | F377: 5 | G377: 3 | H377: 200373 | I377: 0 | J377: 480 | K377: 5000,0; | L377: 5 | M377: 5000,1; | N377: 39240/3600*(nPatrolSec+3)*(1000+nGuanQia)/1000 | O377: 31380/3600*(nPatrolSec+3)*(1000+nGuanQia)/1000 | P377: 19320/3600*(nPatrolSec+3)*(1000+nGuanQia)/1000 | Q377: nGuanQia + 1000 | R377: 39240/60*nMin*(1000+nGuanQia)/1000 | S377: 31380/60*nMin*(1000+nGuanQia)/1000 | T377: 19320/60*nMin*(1000+nGuanQia)/1000 | U377: 喽啰 | V377: pet_21;pet_201;pet_93;pet_91; | W377: 4 | X377: 5 | Y377: 1,28000,8,0;1,19016,8,0;1,10007,5,0;1,10108,2,0;1,7,9000,0;1,8,9000,0;1,4,1000,0; | Z377: 0 | AA377: {} | AB377: n/60
A378: 374 | B378: 374 | C378: 374 | D378: 弑神试炼 | E378: 10504 | F378: 5 | G378: 3 | H378: 200374 | I378: 0 | J378: 480 | K378: 5000,0; | L378: 5 | M378: 5000,1; | N378: 39240/3600*(nPatrolSec+3)*(1000+nGuanQia)/1000 | O378: 31380/3600*(nPatrolSec+3)*(1000+nGuanQia)/1000 | P378: 19320/3600*(nPatrolSec+3)*(1000+nGuanQia)/1000 | Q378: nGuanQia + 1000 | R378: 39240/60*nMin*(1000+nGuanQia)/1000 | S378: 31380/60*nMin*(1000+nGuanQia)/1000 | T378: 19320/60*nMin*(1000+nGuanQia)/1000 | U378: 喽啰 | V378: pet_21;pet_201;pet_93;pet_91; | W378: 4 | X378: 5 | Y378: 1,28000,8,0;1,19016,8,0;1,10007,5,0;1,10108,2,0;1,7,9000,0;1,8,9000,0;1,4,1000,0; | Z378: 0 | AA378: {} | AB378: n/60
A379: 375 | B379: 375 | C379: 375 | D379: 弑神试炼 | E379: 10505 | F379: 5 | G379: 3 | H379: 200375 | I379: 0 | J379: 480 | K379: 5000,0; | L379: 5 | M379: 5000,1; | N379: 39240/3600*(nPatrolSec+3)*(1000+nGuanQia)/1000 | O379: 31380/3600*(nPatrolSec+3)*(1000+nGuanQia)/1000 | P379: 19320/3600*(nPatrolSec+3)*(1000+nGuanQia)/1000 | Q379: nGuanQia + 1000 | R379: 39240/60*nMin*(1000+nGuanQia)/1000 | S379: 31380/60*nMin*(1000+nGuanQia)/1000 | T379: 19320/60*nMin*(1000+nGuanQia)/1000 | U379: 喽啰 | V379: pet_21;pet_201;pet_93;pet_91; | W379: 4 | X379: 5 | Y379: 1,28000,8,0;1,19016,8,0;1,10007,5,0;1,10108,2,0;1,7,9000,0;1,8,9000,0;1,4,1000,0; | Z379: 0 | AA379: {} | AB379: n/60
A380: 376 | B380: 376 | C380: 376 | D380: 弑神试炼 | E380: 10505 | F380: 5 | G380: 3 | H380: 200376 | I380: 0 | J380: 480 | K380: 5000,0; | L380: 5 | M380: 5000,1; | N380: 39240/3600*(nPatrolSec+3)*(1000+nGuanQia)/1000 | O380: 31380/3600*(nPatrolSec+3)*(1000+nGuanQia)/1000 | P380: 19320/3600*(nPatrolSec+3)*(1000+nGuanQia)/1000 | Q380: nGuanQia + 1000 | R380: 39240/60*nMin*(1000+nGuanQia)/1000 | S380: 31380/60*nMin*(1000+nGuanQia)/1000 | T380: 19320/60*nMin*(1000+nGuanQia)/1000 | U380: 喽啰 | V380: pet_21;pet_201;pet_93;pet_91; | W380: 4 | X380: 5 | Y380: 1,28000,8,0;1,19016,8,0;1,10007,5,0;1,10108,2,0;1,7,9000,0;1,8,9000,0;1,4,1000,0; | Z380: 0 | AA380: {} | AB380: n/60
A381: 377 | B381: 377 | C381: 377 | D381: 弑神试炼 | E381: 10505 | F381: 5 | G381: 3 | H381: 200377 | I381: 0 | J381: 480 | K381: 5000,0; | L381: 5 | M381: 5000,1; | N381: 39240/3600*(nPatrolSec+3)*(1000+nGuanQia)/1000 | O381: 31380/3600*(nPatrolSec+3)*(1000+nGuanQia)/1000 | P381: 19320/3600*(nPatrolSec+3)*(1000+nGuanQia)/1000 | Q381: nGuanQia + 1000 | R381: 39240/60*nMin*(1000+nGuanQia)/1000 | S381: 31380/60*nMin*(1000+nGuanQia)/1000 | T381: 19320/60*nMin*(1000+nGuanQia)/1000 | U381: 喽啰 | V381: pet_21;pet_201;pet_93;pet_91; | W381: 4 | X381: 5 | Y381: 1,28000,8,0;1,19016,8,0;1,10007,5,0;1,10108,2,0;1,7,9000,0;1,8,9000,0;1,4,1000,0; | Z381: 0 | AA381: {} | AB381: n/60
A382: 378 | B382: 378 | C382: 378 | D382: 弑神试炼 | E382: 10505 | F382: 5 | G382: 3 | H382: 200378 | I382: 0 | J382: 480 | K382: 5000,0; | L382: 5 | M382: 5000,1; | N382: 39240/3600*(nPatrolSec+3)*(1000+nGuanQia)/1000 | O382: 31380/3600*(nPatrolSec+3)*(1000+nGuanQia)/1000 | P382: 19320/3600*(nPatrolSec+3)*(1000+nGuanQia)/1000 | Q382: nGuanQia + 1000 | R382: 39240/60*nMin*(1000+nGuanQia)/1000 | S382: 31380/60*nMin*(1000+nGuanQia)/1000 | T382: 19320/60*nMin*(1000+nGuanQia)/1000 | U382: 喽啰 | V382: pet_21;pet_201;pet_93;pet_91; | W382: 4 | X382: 5 | Y382: 1,28000,8,0;1,19016,8,0;1,10007,5,0;1,10108,2,0;1,7,9000,0;1,8,9000,0;1,4,1000,0; | Z382: 0 | AA382: {} | AB382: n/60
A383: 379 | B383: 379 | C383: 379 | D383: 弑神试炼 | E383: 10505 | F383: 5 | G383: 3 | H383: 200379 | I383: 0 | J383: 480 | K383: 5000,0; | L383: 5 | M383: 5000,1; | N383: 39240/3600*(nPatrolSec+3)*(1000+nGuanQia)/1000 | O383: 31380/3600*(nPatrolSec+3)*(1000+nGuanQia)/1000 | P383: 19320/3600*(nPatrolSec+3)*(1000+nGuanQia)/1000 | Q383: nGuanQia + 1000 | R383: 39240/60*nMin*(1000+nGuanQia)/1000 | S383: 31380/60*nMin*(1000+nGuanQia)/1000 | T383: 19320/60*nMin*(1000+nGuanQia)/1000 | U383: 喽啰 | V383: pet_21;pet_201;pet_93;pet_91; | W383: 4 | X383: 5 | Y383: 1,28000,8,0;1,19016,8,0;1,10007,5,0;1,10108,2,0;1,7,9000,0;1,8,9000,0;1,4,1000,0; | Z383: 0 | AA383: {} | AB383: n/60
A384: 380 | B384: 380 | C384: 380 | D384: 弑神试炼 | E384: 10505 | F384: 5 | G384: 3 | H384: 200380 | I384: 0 | J384: 480 | K384: 5000,0; | L384: 5 | M384: 5000,1; | N384: 39240/3600*(nPatrolSec+3)*(1000+nGuanQia)/1000 | O384: 31380/3600*(nPatrolSec+3)*(1000+nGuanQia)/1000 | P384: 19320/3600*(nPatrolSec+3)*(1000+nGuanQia)/1000 | Q384: nGuanQia + 1000 | R384: 39240/60*nMin*(1000+nGuanQia)/1000 | S384: 31380/60*nMin*(1000+nGuanQia)/1000 | T384: 19320/60*nMin*(1000+nGuanQia)/1000 | U384: 喽啰 | V384: pet_21;pet_201;pet_93;pet_91; | W384: 4 | X384: 5 | Y384: 1,28000,8,0;1,19016,8,0;1,10007,5,0;1,10108,2,0;1,7,9000,0;1,8,9000,0;1,4,1000,0; | Z384: 0 | AA384: {} | AB384: n/60
A385: 381 | B385: 381 | C385: 381 | D385: 弑神试炼 | E385: 10503 | F385: 5 | G385: 3 | H385: 200381 | I385: 0 | J385: 480 | K385: 5000,0; | L385: 5 | M385: 5000,1; | N385: 39240/3600*(nPatrolSec+3)*(1000+nGuanQia)/1000 | O385: 31380/3600*(nPatrolSec+3)*(1000+nGuanQia)/1000 | P385: 19320/3600*(nPatrolSec+3)*(1000+nGuanQia)/1000 | Q385: nGuanQia + 1000 | R385: 39240/60*nMin*(1000+nGuanQia)/1000 | S385: 31380/60*nMin*(1000+nGuanQia)/1000 | T385: 19320/60*nMin*(1000+nGuanQia)/1000 | U385: 喽啰 | V385: pet_21;pet_201;pet_93;pet_91; | W385: 4 | X385: 5 | Y385: 1,28000,8,0;1,19016,8,0;1,10007,5,0;1,10108,2,0;1,7,9000,0;1,8,9000,0;1,4,1000,0; | Z385: 0 | AA385: {} | AB385: n/60
A386: 382 | B386: 382 | C386: 382 | D386: 弑神试炼 | E386: 10503 | F386: 5 | G386: 3 | H386: 200382 | I386: 0 | J386: 480 | K386: 5000,0; | L386: 5 | M386: 5000,1; | N386: 39240/3600*(nPatrolSec+3)*(1000+nGuanQia)/1000 | O386: 31380/3600*(nPatrolSec+3)*(1000+nGuanQia)/1000 | P386: 19320/3600*(nPatrolSec+3)*(1000+nGuanQia)/1000 | Q386: nGuanQia + 1000 | R386: 39240/60*nMin*(1000+nGuanQia)/1000 | S386: 31380/60*nMin*(1000+nGuanQia)/1000 | T386: 19320/60*nMin*(1000+nGuanQia)/1000 | U386: 喽啰 | V386: pet_21;pet_201;pet_93;pet_91; | W386: 4 | X386: 5 | Y386: 1,28000,8,0;1,19016,8,0;1,10007,5,0;1,10108,2,0;1,7,9000,0;1,8,9000,0;1,4,1000,0; | Z386: 0 | AA386: {} | AB386: n/60
A387: 383 | B387: 383 | C387: 383 | D387: 弑神试炼 | E387: 10503 | F387: 5 | G387: 3 | H387: 200383 | I387: 0 | J387: 480 | K387: 5000,0; | L387: 5 | M387: 5000,1; | N387: 39240/3600*(nPatrolSec+3)*(1000+nGuanQia)/1000 | O387: 31380/3600*(nPatrolSec+3)*(1000+nGuanQia)/1000 | P387: 19320/3600*(nPatrolSec+3)*(1000+nGuanQia)/1000 | Q387: nGuanQia + 1000 | R387: 39240/60*nMin*(1000+nGuanQia)/1000 | S387: 31380/60*nMin*(1000+nGuanQia)/1000 | T387: 19320/60*nMin*(1000+nGuanQia)/1000 | U387: 喽啰 | V387: pet_21;pet_201;pet_93;pet_91; | W387: 4 | X387: 5 | Y387: 1,28000,8,0;1,19016,8,0;1,10007,5,0;1,10108,2,0;1,7,9000,0;1,8,9000,0;1,4,1000,0; | Z387: 0 | AA387: {} | AB387: n/60
A388: 384 | B388: 384 | C388: 384 | D388: 弑神试炼 | E388: 10503 | F388: 5 | G388: 3 | H388: 200384 | I388: 0 | J388: 480 | K388: 5000,0; | L388: 5 | M388: 5000,1; | N388: 39240/3600*(nPatrolSec+3)*(1000+nGuanQia)/1000 | O388: 31380/3600*(nPatrolSec+3)*(1000+nGuanQia)/1000 | P388: 19320/3600*(nPatrolSec+3)*(1000+nGuanQia)/1000 | Q388: nGuanQia + 1000 | R388: 39240/60*nMin*(1000+nGuanQia)/1000 | S388: 31380/60*nMin*(1000+nGuanQia)/1000 | T388: 19320/60*nMin*(1000+nGuanQia)/1000 | U388: 喽啰 | V388: pet_21;pet_201;pet_93;pet_91; | W388: 4 | X388: 5 | Y388: 1,28000,8,0;1,19016,8,0;1,10007,5,0;1,10108,2,0;1,7,9000,0;1,8,9000,0;1,4,1000,0; | Z388: 0 | AA388: {} | AB388: n/60
A389: 385 | B389: 385 | C389: 385 | D389: 弑神试炼 | E389: 10503 | F389: 5 | G389: 3 | H389: 200385 | I389: 0 | J389: 480 | K389: 5000,0; | L389: 5 | M389: 5000,1; | N389: 39240/3600*(nPatrolSec+3)*(1000+nGuanQia)/1000 | O389: 31380/3600*(nPatrolSec+3)*(1000+nGuanQia)/1000 | P389: 19320/3600*(nPatrolSec+3)*(1000+nGuanQia)/1000 | Q389: nGuanQia + 1000 | R389: 39240/60*nMin*(1000+nGuanQia)/1000 | S389: 31380/60*nMin*(1000+nGuanQia)/1000 | T389: 19320/60*nMin*(1000+nGuanQia)/1000 | U389: 喽啰 | V389: pet_21;pet_201;pet_93;pet_91; | W389: 4 | X389: 5 | Y389: 1,28000,8,0;1,19016,8,0;1,10007,5,0;1,10108,2,0;1,7,9000,0;1,8,9000,0;1,4,1000,0; | Z389: 0 | AA389: {} | AB389: n/60
A390: 386 | B390: 386 | C390: 386 | D390: 弑神试炼 | E390: 10503 | F390: 5 | G390: 3 | H390: 200386 | I390: 0 | J390: 480 | K390: 5000,0; | L390: 5 | M390: 5000,1; | N390: 39240/3600*(nPatrolSec+3)*(1000+nGuanQia)/1000 | O390: 31380/3600*(nPatrolSec+3)*(1000+nGuanQia)/1000 | P390: 19320/3600*(nPatrolSec+3)*(1000+nGuanQia)/1000 | Q390: nGuanQia + 1000 | R390: 39240/60*nMin*(1000+nGuanQia)/1000 | S390: 31380/60*nMin*(1000+nGuanQia)/1000 | T390: 19320/60*nMin*(1000+nGuanQia)/1000 | U390: 喽啰 | V390: pet_21;pet_201;pet_93;pet_91; | W390: 4 | X390: 5 | Y390: 1,28000,8,0;1,19016,8,0;1,10007,5,0;1,10108,2,0;1,7,9000,0;1,8,9000,0;1,4,1000,0; | Z390: 0 | AA390: {} | AB390: n/60
A391: 387 | B391: 387 | C391: 387 | D391: 弑神试炼 | E391: 10503 | F391: 5 | G391: 3 | H391: 200387 | I391: 0 | J391: 480 | K391: 5000,0; | L391: 5 | M391: 5000,1; | N391: 39240/3600*(nPatrolSec+3)*(1000+nGuanQia)/1000 | O391: 31380/3600*(nPatrolSec+3)*(1000+nGuanQia)/1000 | P391: 19320/3600*(nPatrolSec+3)*(1000+nGuanQia)/1000 | Q391: nGuanQia + 1000 | R391: 39240/60*nMin*(1000+nGuanQia)/1000 | S391: 31380/60*nMin*(1000+nGuanQia)/1000 | T391: 19320/60*nMin*(1000+nGuanQia)/1000 | U391: 喽啰 | V391: pet_21;pet_201;pet_93;pet_91; | W391: 4 | X391: 5 | Y391: 1,28000,8,0;1,19016,8,0;1,10007,5,0;1,10108,2,0;1,7,9000,0;1,8,9000,0;1,4,1000,0; | Z391: 0 | AA391: {} | AB391: n/60
A392: 388 | B392: 388 | C392: 388 | D392: 弑神试炼 | E392: 10503 | F392: 5 | G392: 3 | H392: 200388 | I392: 0 | J392: 480 | K392: 5000,0; | L392: 5 | M392: 5000,1; | N392: 39240/3600*(nPatrolSec+3)*(1000+nGuanQia)/1000 | O392: 31380/3600*(nPatrolSec+3)*(1000+nGuanQia)/1000 | P392: 19320/3600*(nPatrolSec+3)*(1000+nGuanQia)/1000 | Q392: nGuanQia + 1000 | R392: 39240/60*nMin*(1000+nGuanQia)/1000 | S392: 31380/60*nMin*(1000+nGuanQia)/1000 | T392: 19320/60*nMin*(1000+nGuanQia)/1000 | U392: 喽啰 | V392: pet_21;pet_201;pet_93;pet_91; | W392: 4 | X392: 5 | Y392: 1,28000,8,0;1,19016,8,0;1,10007,5,0;1,10108,2,0;1,7,9000,0;1,8,9000,0;1,4,1000,0; | Z392: 0 | AA392: {} | AB392: n/60
A393: 389 | B393: 389 | C393: 389 | D393: 弑神试炼 | E393: 10503 | F393: 5 | G393: 3 | H393: 200389 | I393: 0 | J393: 480 | K393: 5000,0; | L393: 5 | M393: 5000,1; | N393: 39240/3600*(nPatrolSec+3)*(1000+nGuanQia)/1000 | O393: 31380/3600*(nPatrolSec+3)*(1000+nGuanQia)/1000 | P393: 19320/3600*(nPatrolSec+3)*(1000+nGuanQia)/1000 | Q393: nGuanQia + 1000 | R393: 39240/60*nMin*(1000+nGuanQia)/1000 | S393: 31380/60*nMin*(1000+nGuanQia)/1000 | T393: 19320/60*nMin*(1000+nGuanQia)/1000 | U393: 喽啰 | V393: pet_21;pet_201;pet_93;pet_91; | W393: 4 | X393: 5 | Y393: 1,28000,8,0;1,19016,8,0;1,10007,5,0;1,10108,2,0;1,7,9000,0;1,8,9000,0;1,4,1000,0; | Z393: 0 | AA393: {} | AB393: n/60
A394: 390 | B394: 390 | C394: 390 | D394: 弑神试炼 | E394: 10503 | F394: 5 | G394: 3 | H394: 200390 | I394: 0 | J394: 480 | K394: 5000,0; | L394: 5 | M394: 5000,1; | N394: 39240/3600*(nPatrolSec+3)*(1000+nGuanQia)/1000 | O394: 31380/3600*(nPatrolSec+3)*(1000+nGuanQia)/1000 | P394: 19320/3600*(nPatrolSec+3)*(1000+nGuanQia)/1000 | Q394: nGuanQia + 1000 | R394: 39240/60*nMin*(1000+nGuanQia)/1000 | S394: 31380/60*nMin*(1000+nGuanQia)/1000 | T394: 19320/60*nMin*(1000+nGuanQia)/1000 | U394: 喽啰 | V394: pet_21;pet_201;pet_93;pet_91; | W394: 4 | X394: 5 | Y394: 1,28000,8,0;1,19016,8,0;1,10007,5,0;1,10108,2,0;1,7,9000,0;1,8,9000,0;1,4,1000,0; | Z394: 0 | AA394: {} | AB394: n/60
A395: 391 | B395: 391 | C395: 391 | D395: 弑神试炼 | E395: 10503 | F395: 5 | G395: 3 | H395: 200391 | I395: 0 | J395: 480 | K395: 5000,0; | L395: 5 | M395: 5000,1; | N395: 39240/3600*(nPatrolSec+3)*(1000+nGuanQia)/1000 | O395: 31380/3600*(nPatrolSec+3)*(1000+nGuanQia)/1000 | P395: 19320/3600*(nPatrolSec+3)*(1000+nGuanQia)/1000 | Q395: nGuanQia + 1000 | R395: 39240/60*nMin*(1000+nGuanQia)/1000 | S395: 31380/60*nMin*(1000+nGuanQia)/1000 | T395: 19320/60*nMin*(1000+nGuanQia)/1000 | U395: 喽啰 | V395: pet_21;pet_201;pet_93;pet_91; | W395: 4 | X395: 5 | Y395: 1,28000,8,0;1,19016,8,0;1,10007,5,0;1,10108,2,0;1,7,9000,0;1,8,9000,0;1,4,1000,0; | Z395: 0 | AA395: {} | AB395: n/60
A396: 392 | B396: 392 | C396: 392 | D396: 弑神试炼 | E396: 10503 | F396: 5 | G396: 3 | H396: 200392 | I396: 0 | J396: 480 | K396: 5000,0; | L396: 5 | M396: 5000,1; | N396: 39240/3600*(nPatrolSec+3)*(1000+nGuanQia)/1000 | O396: 31380/3600*(nPatrolSec+3)*(1000+nGuanQia)/1000 | P396: 19320/3600*(nPatrolSec+3)*(1000+nGuanQia)/1000 | Q396: nGuanQia + 1000 | R396: 39240/60*nMin*(1000+nGuanQia)/1000 | S396: 31380/60*nMin*(1000+nGuanQia)/1000 | T396: 19320/60*nMin*(1000+nGuanQia)/1000 | U396: 喽啰 | V396: pet_21;pet_201;pet_93;pet_91; | W396: 4 | X396: 5 | Y396: 1,28000,8,0;1,19016,8,0;1,10007,5,0;1,10108,2,0;1,7,9000,0;1,8,9000,0;1,4,1000,0; | Z396: 0 | AA396: {} | AB396: n/60
A397: 393 | B397: 393 | C397: 393 | D397: 弑神试炼 | E397: 10904 | F397: 5 | G397: 3 | H397: 200393 | I397: 0 | J397: 480 | K397: 5000,0; | L397: 5 | M397: 5000,1; | N397: 39240/3600*(nPatrolSec+3)*(1000+nGuanQia)/1000 | O397: 31380/3600*(nPatrolSec+3)*(1000+nGuanQia)/1000 | P397: 19320/3600*(nPatrolSec+3)*(1000+nGuanQia)/1000 | Q397: nGuanQia + 1000 | R397: 39240/60*nMin*(1000+nGuanQia)/1000 | S397: 31380/60*nMin*(1000+nGuanQia)/1000 | T397: 19320/60*nMin*(1000+nGuanQia)/1000 | U397: 喽啰 | V397: pet_21;pet_201;pet_93;pet_91; | W397: 4 | X397: 5 | Y397: 1,28000,8,0;1,19016,8,0;1,10007,5,0;1,10108,2,0;1,7,9000,0;1,8,9000,0;1,4,1000,0; | Z397: 0 | AA397: {} | AB397: n/60
A398: 394 | B398: 394 | C398: 394 | D398: 弑神试炼 | E398: 10904 | F398: 5 | G398: 3 | H398: 200394 | I398: 0 | J398: 480 | K398: 5000,0; | L398: 5 | M398: 5000,1; | N398: 39240/3600*(nPatrolSec+3)*(1000+nGuanQia)/1000 | O398: 31380/3600*(nPatrolSec+3)*(1000+nGuanQia)/1000 | P398: 19320/3600*(nPatrolSec+3)*(1000+nGuanQia)/1000 | Q398: nGuanQia + 1000 | R398: 39240/60*nMin*(1000+nGuanQia)/1000 | S398: 31380/60*nMin*(1000+nGuanQia)/1000 | T398: 19320/60*nMin*(1000+nGuanQia)/1000 | U398: 喽啰 | V398: pet_21;pet_201;pet_93;pet_91; | W398: 4 | X398: 5 | Y398: 1,28000,8,0;1,19016,8,0;1,10007,5,0;1,10108,2,0;1,7,9000,0;1,8,9000,0;1,4,1000,0; | Z398: 0 | AA398: {} | AB398: n/60
A399: 395 | B399: 395 | C399: 395 | D399: 弑神试炼 | E399: 10904 | F399: 5 | G399: 3 | H399: 200395 | I399: 0 | J399: 480 | K399: 5000,0; | L399: 5 | M399: 5000,1; | N399: 39240/3600*(nPatrolSec+3)*(1000+nGuanQia)/1000 | O399: 31380/3600*(nPatrolSec+3)*(1000+nGuanQia)/1000 | P399: 19320/3600*(nPatrolSec+3)*(1000+nGuanQia)/1000 | Q399: nGuanQia + 1000 | R399: 39240/60*nMin*(1000+nGuanQia)/1000 | S399: 31380/60*nMin*(1000+nGuanQia)/1000 | T399: 19320/60*nMin*(1000+nGuanQia)/1000 | U399: 喽啰 | V399: pet_21;pet_201;pet_93;pet_91; | W399: 4 | X399: 5 | Y399: 1,28000,8,0;1,19016,8,0;1,10007,5,0;1,10108,2,0;1,7,9000,0;1,8,9000,0;1,4,1000,0; | Z399: 0 | AA399: {} | AB399: n/60
A400: 396 | B400: 396 | C400: 396 | D400: 弑神试炼 | E400: 10904 | F400: 5 | G400: 3 | H400: 200396 | I400: 0 | J400: 480 | K400: 5000,0; | L400: 5 | M400: 5000,1; | N400: 39240/3600*(nPatrolSec+3)*(1000+nGuanQia)/1000 | O400: 31380/3600*(nPatrolSec+3)*(1000+nGuanQia)/1000 | P400: 19320/3600*(nPatrolSec+3)*(1000+nGuanQia)/1000 | Q400: nGuanQia + 1000 | R400: 39240/60*nMin*(1000+nGuanQia)/1000 | S400: 31380/60*nMin*(1000+nGuanQia)/1000 | T400: 19320/60*nMin*(1000+nGuanQia)/1000 | U400: 喽啰 | V400: pet_21;pet_201;pet_93;pet_91; | W400: 4 | X400: 5 | Y400: 1,28000,8,0;1,19016,8,0;1,10007,5,0;1,10108,2,0;1,7,9000,0;1,8,9000,0;1,4,1000,0; | Z400: 0 | AA400: {} | AB400: n/60
A401: 397 | B401: 397 | C401: 397 | D401: 弑神试炼 | E401: 10904 | F401: 5 | G401: 3 | H401: 200397 | I401: 0 | J401: 480 | K401: 5000,0; | L401: 5 | M401: 5000,1; | N401: 39240/3600*(nPatrolSec+3)*(1000+nGuanQia)/1000 | O401: 31380/3600*(nPatrolSec+3)*(1000+nGuanQia)/1000 | P401: 19320/3600*(nPatrolSec+3)*(1000+nGuanQia)/1000 | Q401: nGuanQia + 1000 | R401: 39240/60*nMin*(1000+nGuanQia)/1000 | S401: 31380/60*nMin*(1000+nGuanQia)/1000 | T401: 19320/60*nMin*(1000+nGuanQia)/1000 | U401: 喽啰 | V401: pet_21;pet_201;pet_93;pet_91; | W401: 4 | X401: 5 | Y401: 1,28000,8,0;1,19016,8,0;1,10007,5,0;1,10108,2,0;1,7,9000,0;1,8,9000,0;1,4,1000,0; | Z401: 0 | AA401: {} | AB401: n/60
A402: 398 | B402: 398 | C402: 398 | D402: 弑神试炼 | E402: 10904 | F402: 5 | G402: 3 | H402: 200398 | I402: 0 | J402: 480 | K402: 5000,0; | L402: 5 | M402: 5000,1; | N402: 39240/3600*(nPatrolSec+3)*(1000+nGuanQia)/1000 | O402: 31380/3600*(nPatrolSec+3)*(1000+nGuanQia)/1000 | P402: 19320/3600*(nPatrolSec+3)*(1000+nGuanQia)/1000 | Q402: nGuanQia + 1000 | R402: 39240/60*nMin*(1000+nGuanQia)/1000 | S402: 31380/60*nMin*(1000+nGuanQia)/1000 | T402: 19320/60*nMin*(1000+nGuanQia)/1000 | U402: 喽啰 | V402: pet_21;pet_201;pet_93;pet_91; | W402: 4 | X402: 5 | Y402: 1,28000,8,0;1,19016,8,0;1,10007,5,0;1,10108,2,0;1,7,9000,0;1,8,9000,0;1,4,1000,0; | Z402: 0 | AA402: {} | AB402: n/60
A403: 399 | B403: 399 | C403: 399 | D403: 弑神试炼 | E403: 10904 | F403: 5 | G403: 3 | H403: 200399 | I403: 0 | J403: 480 | K403: 5000,0; | L403: 5 | M403: 5000,1; | N403: 39240/3600*(nPatrolSec+3)*(1000+nGuanQia)/1000 | O403: 31380/3600*(nPatrolSec+3)*(1000+nGuanQia)/1000 | P403: 19320/3600*(nPatrolSec+3)*(1000+nGuanQia)/1000 | Q403: nGuanQia + 1000 | R403: 39240/60*nMin*(1000+nGuanQia)/1000 | S403: 31380/60*nMin*(1000+nGuanQia)/1000 | T403: 19320/60*nMin*(1000+nGuanQia)/1000 | U403: 喽啰 | V403: pet_21;pet_201;pet_93;pet_91; | W403: 4 | X403: 5 | Y403: 1,28000,8,0;1,19016,8,0;1,10007,5,0;1,10108,2,0;1,7,9000,0;1,8,9000,0;1,4,1000,0; | Z403: 0 | AA403: {} | AB403: n/60
A404: 400 | B404: 400 | C404: 400 | D404: 弑神试炼 | E404: 10904 | F404: 5 | G404: 3 | H404: 200400 | I404: 0 | J404: 480 | K404: 5000,0; | L404: 5 | M404: 5000,1; | N404: 39240/3600*(nPatrolSec+3)*(1000+nGuanQia)/1000 | O404: 31380/3600*(nPatrolSec+3)*(1000+nGuanQia)/1000 | P404: 19320/3600*(nPatrolSec+3)*(1000+nGuanQia)/1000 | Q404: nGuanQia + 1000 | R404: 39240/60*nMin*(1000+nGuanQia)/1000 | S404: 31380/60*nMin*(1000+nGuanQia)/1000 | T404: 19320/60*nMin*(1000+nGuanQia)/1000 | U404: 喽啰 | V404: pet_21;pet_201;pet_93;pet_91; | W404: 4 | X404: 5 | Y404: 1,28000,8,0;1,19016,8,0;1,10007,5,0;1,10108,2,0;1,7,9000,0;1,8,9000,0;1,4,1000,0; | Z404: 0 | AA404: {} | AB404: n/60
A405: 401 | B405: 401 | C405: 401 | D405: 弑神试炼 | E405: 10904 | F405: 5 | G405: 3 | H405: 200401 | I405: 0 | J405: 480 | K405: 5000,0; | L405: 5 | M405: 5000,1; | N405: 39240/3600*(nPatrolSec+3)*(1000+nGuanQia)/1000 | O405: 31380/3600*(nPatrolSec+3)*(1000+nGuanQia)/1000 | P405: 19320/3600*(nPatrolSec+3)*(1000+nGuanQia)/1000 | Q405: nGuanQia + 1000 | R405: 39240/60*nMin*(1000+nGuanQia)/1000 | S405: 31380/60*nMin*(1000+nGuanQia)/1000 | T405: 19320/60*nMin*(1000+nGuanQia)/1000 | U405: 喽啰 | V405: pet_21;pet_201;pet_93;pet_91; | W405: 4 | X405: 5 | Y405: 1,28000,8,0;1,19016,8,0;1,10007,5,0;1,10108,2,0;1,7,9000,0;1,8,9000,0;1,4,1000,0; | Z405: 0 | AA405: {} | AB405: n/60
A406: 402 | B406: 402 | C406: 402 | D406: 弑神试炼 | E406: 10904 | F406: 5 | G406: 3 | H406: 200402 | I406: 0 | J406: 480 | K406: 5000,0; | L406: 5 | M406: 5000,1; | N406: 39240/3600*(nPatrolSec+3)*(1000+nGuanQia)/1000 | O406: 31380/3600*(nPatrolSec+3)*(1000+nGuanQia)/1000 | P406: 19320/3600*(nPatrolSec+3)*(1000+nGuanQia)/1000 | Q406: nGuanQia + 1000 | R406: 39240/60*nMin*(1000+nGuanQia)/1000 | S406: 31380/60*nMin*(1000+nGuanQia)/1000 | T406: 19320/60*nMin*(1000+nGuanQia)/1000 | U406: 喽啰 | V406: pet_21;pet_201;pet_93;pet_91; | W406: 4 | X406: 5 | Y406: 1,28000,8,0;1,19016,8,0;1,10007,5,0;1,10108,2,0;1,7,9000,0;1,8,9000,0;1,4,1000,0; | Z406: 0 | AA406: {} | AB406: n/60
A407: 403 | B407: 403 | C407: 403 | D407: 弑神试炼 | E407: 10904 | F407: 5 | G407: 3 | H407: 200403 | I407: 0 | J407: 480 | K407: 5000,0; | L407: 5 | M407: 5000,1; | N407: 39240/3600*(nPatrolSec+3)*(1000+nGuanQia)/1000 | O407: 31380/3600*(nPatrolSec+3)*(1000+nGuanQia)/1000 | P407: 19320/3600*(nPatrolSec+3)*(1000+nGuanQia)/1000 | Q407: nGuanQia + 1000 | R407: 39240/60*nMin*(1000+nGuanQia)/1000 | S407: 31380/60*nMin*(1000+nGuanQia)/1000 | T407: 19320/60*nMin*(1000+nGuanQia)/1000 | U407: 喽啰 | V407: pet_21;pet_201;pet_93;pet_91; | W407: 4 | X407: 5 | Y407: 1,28000,8,0;1,19016,8,0;1,10007,5,0;1,10108,2,0;1,7,9000,0;1,8,9000,0;1,4,1000,0; | Z407: 0 | AA407: {} | AB407: n/60
A408: 404 | B408: 404 | C408: 404 | D408: 弑神试炼 | E408: 10501 | F408: 5 | G408: 3 | H408: 200404 | I408: 0 | J408: 480 | K408: 5000,0; | L408: 5 | M408: 5000,1; | N408: 39240/3600*(nPatrolSec+3)*(1000+nGuanQia)/1000 | O408: 31380/3600*(nPatrolSec+3)*(1000+nGuanQia)/1000 | P408: 19320/3600*(nPatrolSec+3)*(1000+nGuanQia)/1000 | Q408: nGuanQia + 1000 | R408: 39240/60*nMin*(1000+nGuanQia)/1000 | S408: 31380/60*nMin*(1000+nGuanQia)/1000 | T408: 19320/60*nMin*(1000+nGuanQia)/1000 | U408: 喽啰 | V408: pet_21;pet_201;pet_93;pet_91; | W408: 4 | X408: 5 | Y408: 1,28000,8,0;1,19016,8,0;1,10007,5,0;1,10108,2,0;1,7,9000,0;1,8,9000,0;1,4,1000,0; | Z408: 0 | AA408: {} | AB408: n/60
A409: 405 | B409: 405 | C409: 405 | D409: 弑神试炼 | E409: 10501 | F409: 5 | G409: 3 | H409: 200405 | I409: 0 | J409: 480 | K409: 5000,0; | L409: 5 | M409: 5000,1; | N409: 39240/3600*(nPatrolSec+3)*(1000+nGuanQia)/1000 | O409: 31380/3600*(nPatrolSec+3)*(1000+nGuanQia)/1000 | P409: 19320/3600*(nPatrolSec+3)*(1000+nGuanQia)/1000 | Q409: nGuanQia + 1000 | R409: 39240/60*nMin*(1000+nGuanQia)/1000 | S409: 31380/60*nMin*(1000+nGuanQia)/1000 | T409: 19320/60*nMin*(1000+nGuanQia)/1000 | U409: 喽啰 | V409: pet_21;pet_201;pet_93;pet_91; | W409: 4 | X409: 5 | Y409: 1,28000,8,0;1,19016,8,0;1,10007,5,0;1,10108,2,0;1,7,9000,0;1,8,9000,0;1,4,1000,0; | Z409: 0 | AA409: {} | AB409: n/60
A410: 406 | B410: 406 | C410: 406 | D410: 弑神试炼 | E410: 10501 | F410: 5 | G410: 3 | H410: 200406 | I410: 0 | J410: 480 | K410: 5000,0; | L410: 5 | M410: 5000,1; | N410: 39240/3600*(nPatrolSec+3)*(1000+nGuanQia)/1000 | O410: 31380/3600*(nPatrolSec+3)*(1000+nGuanQia)/1000 | P410: 19320/3600*(nPatrolSec+3)*(1000+nGuanQia)/1000 | Q410: nGuanQia + 1000 | R410: 39240/60*nMin*(1000+nGuanQia)/1000 | S410: 31380/60*nMin*(1000+nGuanQia)/1000 | T410: 19320/60*nMin*(1000+nGuanQia)/1000 | U410: 喽啰 | V410: pet_21;pet_201;pet_93;pet_91; | W410: 4 | X410: 5 | Y410: 1,28000,8,0;1,19016,8,0;1,10007,5,0;1,10108,2,0;1,7,9000,0;1,8,9000,0;1,4,1000,0; | Z410: 0 | AA410: {} | AB410: n/60
A411: 407 | B411: 407 | C411: 407 | D411: 弑神试炼 | E411: 10501 | F411: 5 | G411: 3 | H411: 200407 | I411: 0 | J411: 480 | K411: 5000,0; | L411: 5 | M411: 5000,1; | N411: 39240/3600*(nPatrolSec+3)*(1000+nGuanQia)/1000 | O411: 31380/3600*(nPatrolSec+3)*(1000+nGuanQia)/1000 | P411: 19320/3600*(nPatrolSec+3)*(1000+nGuanQia)/1000 | Q411: nGuanQia + 1000 | R411: 39240/60*nMin*(1000+nGuanQia)/1000 | S411: 31380/60*nMin*(1000+nGuanQia)/1000 | T411: 19320/60*nMin*(1000+nGuanQia)/1000 | U411: 喽啰 | V411: pet_21;pet_201;pet_93;pet_91; | W411: 4 | X411: 5 | Y411: 1,28000,8,0;1,19016,8,0;1,10007,5,0;1,10108,2,0;1,7,9000,0;1,8,9000,0;1,4,1000,0; | Z411: 0 | AA411: {} | AB411: n/60
A412: 408 | B412: 408 | C412: 408 | D412: 弑神试炼 | E412: 10501 | F412: 5 | G412: 3 | H412: 200408 | I412: 0 | J412: 480 | K412: 5000,0; | L412: 5 | M412: 5000,1; | N412: 39240/3600*(nPatrolSec+3)*(1000+nGuanQia)/1000 | O412: 31380/3600*(nPatrolSec+3)*(1000+nGuanQia)/1000 | P412: 19320/3600*(nPatrolSec+3)*(1000+nGuanQia)/1000 | Q412: nGuanQia + 1000 | R412: 39240/60*nMin*(1000+nGuanQia)/1000 | S412: 31380/60*nMin*(1000+nGuanQia)/1000 | T412: 19320/60*nMin*(1000+nGuanQia)/1000 | U412: 喽啰 | V412: pet_21;pet_201;pet_93;pet_91; | W412: 4 | X412: 5 | Y412: 1,28000,8,0;1,19016,8,0;1,10007,5,0;1,10108,2,0;1,7,9000,0;1,8,9000,0;1,4,1000,0; | Z412: 0 | AA412: {} | AB412: n/60
A413: 409 | B413: 409 | C413: 409 | D413: 弑神试炼 | E413: 10501 | F413: 5 | G413: 3 | H413: 200409 | I413: 0 | J413: 480 | K413: 5000,0; | L413: 5 | M413: 5000,1; | N413: 39240/3600*(nPatrolSec+3)*(1000+nGuanQia)/1000 | O413: 31380/3600*(nPatrolSec+3)*(1000+nGuanQia)/1000 | P413: 19320/3600*(nPatrolSec+3)*(1000+nGuanQia)/1000 | Q413: nGuanQia + 1000 | R413: 39240/60*nMin*(1000+nGuanQia)/1000 | S413: 31380/60*nMin*(1000+nGuanQia)/1000 | T413: 19320/60*nMin*(1000+nGuanQia)/1000 | U413: 喽啰 | V413: pet_21;pet_201;pet_93;pet_91; | W413: 4 | X413: 5 | Y413: 1,28000,8,0;1,19016,8,0;1,10007,5,0;1,10108,2,0;1,7,9000,0;1,8,9000,0;1,4,1000,0; | Z413: 0 | AA413: {} | AB413: n/60
A414: 410 | B414: 410 | C414: 410 | D414: 弑神试炼 | E414: 10501 | F414: 5 | G414: 3 | H414: 200410 | I414: 0 | J414: 480 | K414: 5000,0; | L414: 5 | M414: 5000,1; | N414: 39240/3600*(nPatrolSec+3)*(1000+nGuanQia)/1000 | O414: 31380/3600*(nPatrolSec+3)*(1000+nGuanQia)/1000 | P414: 19320/3600*(nPatrolSec+3)*(1000+nGuanQia)/1000 | Q414: nGuanQia + 1000 | R414: 39240/60*nMin*(1000+nGuanQia)/1000 | S414: 31380/60*nMin*(1000+nGuanQia)/1000 | T414: 19320/60*nMin*(1000+nGuanQia)/1000 | U414: 喽啰 | V414: pet_21;pet_201;pet_93;pet_91; | W414: 4 | X414: 5 | Y414: 1,28000,8,0;1,19016,8,0;1,10007,5,0;1,10108,2,0;1,7,9000,0;1,8,9000,0;1,4,1000,0; | Z414: 0 | AA414: {} | AB414: n/60
A415: 411 | B415: 411 | C415: 411 | D415: 弑神试炼 | E415: 10501 | F415: 5 | G415: 3 | H415: 200411 | I415: 0 | J415: 480 | K415: 5000,0; | L415: 5 | M415: 5000,1; | N415: 39240/3600*(nPatrolSec+3)*(1000+nGuanQia)/1000 | O415: 31380/3600*(nPatrolSec+3)*(1000+nGuanQia)/1000 | P415: 19320/3600*(nPatrolSec+3)*(1000+nGuanQia)/1000 | Q415: nGuanQia + 1000 | R415: 39240/60*nMin*(1000+nGuanQia)/1000 | S415: 31380/60*nMin*(1000+nGuanQia)/1000 | T415: 19320/60*nMin*(1000+nGuanQia)/1000 | U415: 喽啰 | V415: pet_21;pet_201;pet_93;pet_91; | W415: 4 | X415: 5 | Y415: 1,28000,8,0;1,19016,8,0;1,10007,5,0;1,10108,2,0;1,7,9000,0;1,8,9000,0;1,4,1000,0; | Z415: 0 | AA415: {} | AB415: n/60
A416: 412 | B416: 412 | C416: 412 | D416: 弑神试炼 | E416: 10501 | F416: 5 | G416: 3 | H416: 200412 | I416: 0 | J416: 480 | K416: 5000,0; | L416: 5 | M416: 5000,1; | N416: 39240/3600*(nPatrolSec+3)*(1000+nGuanQia)/1000 | O416: 31380/3600*(nPatrolSec+3)*(1000+nGuanQia)/1000 | P416: 19320/3600*(nPatrolSec+3)*(1000+nGuanQia)/1000 | Q416: nGuanQia + 1000 | R416: 39240/60*nMin*(1000+nGuanQia)/1000 | S416: 31380/60*nMin*(1000+nGuanQia)/1000 | T416: 19320/60*nMin*(1000+nGuanQia)/1000 | U416: 喽啰 | V416: pet_21;pet_201;pet_93;pet_91; | W416: 4 | X416: 5 | Y416: 1,28000,8,0;1,19016,8,0;1,10007,5,0;1,10108,2,0;1,7,9000,0;1,8,9000,0;1,4,1000,0; | Z416: 0 | AA416: {} | AB416: n/60
A417: 413 | B417: 413 | C417: 413 | D417: 弑神试炼 | E417: 10501 | F417: 5 | G417: 3 | H417: 200413 | I417: 0 | J417: 480 | K417: 5000,0; | L417: 5 | M417: 5000,1; | N417: 39240/3600*(nPatrolSec+3)*(1000+nGuanQia)/1000 | O417: 31380/3600*(nPatrolSec+3)*(1000+nGuanQia)/1000 | P417: 19320/3600*(nPatrolSec+3)*(1000+nGuanQia)/1000 | Q417: nGuanQia + 1000 | R417: 39240/60*nMin*(1000+nGuanQia)/1000 | S417: 31380/60*nMin*(1000+nGuanQia)/1000 | T417: 19320/60*nMin*(1000+nGuanQia)/1000 | U417: 喽啰 | V417: pet_21;pet_201;pet_93;pet_91; | W417: 4 | X417: 5 | Y417: 1,28000,8,0;1,19016,8,0;1,10007,5,0;1,10108,2,0;1,7,9000,0;1,8,9000,0;1,4,1000,0; | Z417: 0 | AA417: {} | AB417: n/60
A418: 414 | B418: 414 | C418: 414 | D418: 弑神试炼 | E418: 10501 | F418: 5 | G418: 3 | H418: 200414 | I418: 0 | J418: 480 | K418: 5000,0; | L418: 5 | M418: 5000,1; | N418: 39240/3600*(nPatrolSec+3)*(1000+nGuanQia)/1000 | O418: 31380/3600*(nPatrolSec+3)*(1000+nGuanQia)/1000 | P418: 19320/3600*(nPatrolSec+3)*(1000+nGuanQia)/1000 | Q418: nGuanQia + 1000 | R418: 39240/60*nMin*(1000+nGuanQia)/1000 | S418: 31380/60*nMin*(1000+nGuanQia)/1000 | T418: 19320/60*nMin*(1000+nGuanQia)/1000 | U418: 喽啰 | V418: pet_21;pet_201;pet_93;pet_91; | W418: 4 | X418: 5 | Y418: 1,28000,8,0;1,19016,8,0;1,10007,5,0;1,10108,2,0;1,7,9000,0;1,8,9000,0;1,4,1000,0; | Z418: 0 | AA418: {} | AB418: n/60
A419: 415 | B419: 415 | C419: 415 | D419: 弑神试炼 | E419: 10501 | F419: 5 | G419: 3 | H419: 200415 | I419: 0 | J419: 480 | K419: 5000,0; | L419: 5 | M419: 5000,1; | N419: 39240/3600*(nPatrolSec+3)*(1000+nGuanQia)/1000 | O419: 31380/3600*(nPatrolSec+3)*(1000+nGuanQia)/1000 | P419: 19320/3600*(nPatrolSec+3)*(1000+nGuanQia)/1000 | Q419: nGuanQia + 1000 | R419: 39240/60*nMin*(1000+nGuanQia)/1000 | S419: 31380/60*nMin*(1000+nGuanQia)/1000 | T419: 19320/60*nMin*(1000+nGuanQia)/1000 | U419: 喽啰 | V419: pet_21;pet_201;pet_93;pet_91; | W419: 4 | X419: 5 | Y419: 1,28000,8,0;1,19016,8,0;1,10007,5,0;1,10108,2,0;1,7,9000,0;1,8,9000,0;1,4,1000,0; | Z419: 0 | AA419: {} | AB419: n/60
A420: 416 | B420: 416 | C420: 416 | D420: 弑神试炼 | E420: 10501 | F420: 5 | G420: 3 | H420: 200416 | I420: 0 | J420: 480 | K420: 5000,0; | L420: 5 | M420: 5000,1; | N420: 39240/3600*(nPatrolSec+3)*(1000+nGuanQia)/1000 | O420: 31380/3600*(nPatrolSec+3)*(1000+nGuanQia)/1000 | P420: 19320/3600*(nPatrolSec+3)*(1000+nGuanQia)/1000 | Q420: nGuanQia + 1000 | R420: 39240/60*nMin*(1000+nGuanQia)/1000 | S420: 31380/60*nMin*(1000+nGuanQia)/1000 | T420: 19320/60*nMin*(1000+nGuanQia)/1000 | U420: 喽啰 | V420: pet_21;pet_201;pet_93;pet_91; | W420: 4 | X420: 5 | Y420: 1,28000,8,0;1,19016,8,0;1,10007,5,0;1,10108,2,0;1,7,9000,0;1,8,9000,0;1,4,1000,0; | Z420: 0 | AA420: {} | AB420: n/60
A421: 417 | B421: 417 | C421: 417 | D421: 弑神试炼 | E421: 10501 | F421: 5 | G421: 3 | H421: 200417 | I421: 0 | J421: 480 | K421: 5000,0; | L421: 5 | M421: 5000,1; | N421: 39240/3600*(nPatrolSec+3)*(1000+nGuanQia)/1000 | O421: 31380/3600*(nPatrolSec+3)*(1000+nGuanQia)/1000 | P421: 19320/3600*(nPatrolSec+3)*(1000+nGuanQia)/1000 | Q421: nGuanQia + 1000 | R421: 39240/60*nMin*(1000+nGuanQia)/1000 | S421: 31380/60*nMin*(1000+nGuanQia)/1000 | T421: 19320/60*nMin*(1000+nGuanQia)/1000 | U421: 喽啰 | V421: pet_21;pet_201;pet_93;pet_91; | W421: 4 | X421: 5 | Y421: 1,28000,8,0;1,19016,8,0;1,10007,5,0;1,10108,2,0;1,7,9000,0;1,8,9000,0;1,4,1000,0; | Z421: 0 | AA421: {} | AB421: n/60
A422: 418 | B422: 418 | C422: 418 | D422: 弑神试炼 | E422: 10501 | F422: 5 | G422: 3 | H422: 200418 | I422: 0 | J422: 480 | K422: 5000,0; | L422: 5 | M422: 5000,1; | N422: 39240/3600*(nPatrolSec+3)*(1000+nGuanQia)/1000 | O422: 31380/3600*(nPatrolSec+3)*(1000+nGuanQia)/1000 | P422: 19320/3600*(nPatrolSec+3)*(1000+nGuanQia)/1000 | Q422: nGuanQia + 1000 | R422: 39240/60*nMin*(1000+nGuanQia)/1000 | S422: 31380/60*nMin*(1000+nGuanQia)/1000 | T422: 19320/60*nMin*(1000+nGuanQia)/1000 | U422: 喽啰 | V422: pet_21;pet_201;pet_93;pet_91; | W422: 4 | X422: 5 | Y422: 1,28000,8,0;1,19016,8,0;1,10007,5,0;1,10108,2,0;1,7,9000,0;1,8,9000,0;1,4,1000,0; | Z422: 0 | AA422: {} | AB422: n/60
A423: 419 | B423: 419 | C423: 419 | D423: 弑神试炼 | E423: 10501 | F423: 5 | G423: 3 | H423: 200419 | I423: 0 | J423: 480 | K423: 5000,0; | L423: 5 | M423: 5000,1; | N423: 39240/3600*(nPatrolSec+3)*(1000+nGuanQia)/1000 | O423: 31380/3600*(nPatrolSec+3)*(1000+nGuanQia)/1000 | P423: 19320/3600*(nPatrolSec+3)*(1000+nGuanQia)/1000 | Q423: nGuanQia + 1000 | R423: 39240/60*nMin*(1000+nGuanQia)/1000 | S423: 31380/60*nMin*(1000+nGuanQia)/1000 | T423: 19320/60*nMin*(1000+nGuanQia)/1000 | U423: 喽啰 | V423: pet_21;pet_201;pet_93;pet_91; | W423: 4 | X423: 5 | Y423: 1,28000,8,0;1,19016,8,0;1,10007,5,0;1,10108,2,0;1,7,9000,0;1,8,9000,0;1,4,1000,0; | Z423: 0 | AA423: {} | AB423: n/60
A424: 420 | B424: 420 | C424: 420 | D424: 弑神试炼 | E424: 10501 | F424: 5 | G424: 3 | H424: 200420 | I424: 0 | J424: 480 | K424: 5000,0; | L424: 5 | M424: 5000,1; | N424: 39240/3600*(nPatrolSec+3)*(1000+nGuanQia)/1000 | O424: 31380/3600*(nPatrolSec+3)*(1000+nGuanQia)/1000 | P424: 19320/3600*(nPatrolSec+3)*(1000+nGuanQia)/1000 | Q424: nGuanQia + 1000 | R424: 39240/60*nMin*(1000+nGuanQia)/1000 | S424: 31380/60*nMin*(1000+nGuanQia)/1000 | T424: 19320/60*nMin*(1000+nGuanQia)/1000 | U424: 喽啰 | V424: pet_21;pet_201;pet_93;pet_91; | W424: 4 | X424: 5 | Y424: 1,28000,8,0;1,19016,8,0;1,10007,5,0;1,10108,2,0;1,7,9000,0;1,8,9000,0;1,4,1000,0; | Z424: 0 | AA424: {} | AB424: n/60
A425: 421 | B425: 421 | C425: 421 | D425: 弑神试炼 | E425: 10501 | F425: 5 | G425: 3 | H425: 200421 | I425: 0 | J425: 480 | K425: 5000,0; | L425: 5 | M425: 5000,1; | N425: 39240/3600*(nPatrolSec+3)*(1000+nGuanQia)/1000 | O425: 31380/3600*(nPatrolSec+3)*(1000+nGuanQia)/1000 | P425: 19320/3600*(nPatrolSec+3)*(1000+nGuanQia)/1000 | Q425: nGuanQia + 1000 | R425: 39240/60*nMin*(1000+nGuanQia)/1000 | S425: 31380/60*nMin*(1000+nGuanQia)/1000 | T425: 19320/60*nMin*(1000+nGuanQia)/1000 | U425: 喽啰 | V425: pet_21;pet_201;pet_93;pet_91; | W425: 4 | X425: 5 | Y425: 1,28000,8,0;1,19016,8,0;1,10007,5,0;1,10108,2,0;1,7,9000,0;1,8,9000,0;1,4,1000,0; | Z425: 0 | AA425: {} | AB425: n/60
A426: 422 | B426: 422 | C426: 422 | D426: 弑神试炼 | E426: 10501 | F426: 5 | G426: 3 | H426: 200422 | I426: 0 | J426: 480 | K426: 5000,0; | L426: 5 | M426: 5000,1; | N426: 39240/3600*(nPatrolSec+3)*(1000+nGuanQia)/1000 | O426: 31380/3600*(nPatrolSec+3)*(1000+nGuanQia)/1000 | P426: 19320/3600*(nPatrolSec+3)*(1000+nGuanQia)/1000 | Q426: nGuanQia + 1000 | R426: 39240/60*nMin*(1000+nGuanQia)/1000 | S426: 31380/60*nMin*(1000+nGuanQia)/1000 | T426: 19320/60*nMin*(1000+nGuanQia)/1000 | U426: 喽啰 | V426: pet_21;pet_201;pet_93;pet_91; | W426: 4 | X426: 5 | Y426: 1,28000,8,0;1,19016,8,0;1,10007,5,0;1,10108,2,0;1,7,9000,0;1,8,9000,0;1,4,1000,0; | Z426: 0 | AA426: {} | AB426: n/60
A427: 423 | B427: 423 | C427: 423 | D427: 弑神试炼 | E427: 10501 | F427: 5 | G427: 3 | H427: 200423 | I427: 0 | J427: 480 | K427: 5000,0; | L427: 5 | M427: 5000,1; | N427: 39240/3600*(nPatrolSec+3)*(1000+nGuanQia)/1000 | O427: 31380/3600*(nPatrolSec+3)*(1000+nGuanQia)/1000 | P427: 19320/3600*(nPatrolSec+3)*(1000+nGuanQia)/1000 | Q427: nGuanQia + 1000 | R427: 39240/60*nMin*(1000+nGuanQia)/1000 | S427: 31380/60*nMin*(1000+nGuanQia)/1000 | T427: 19320/60*nMin*(1000+nGuanQia)/1000 | U427: 喽啰 | V427: pet_21;pet_201;pet_93;pet_91; | W427: 4 | X427: 5 | Y427: 1,28000,8,0;1,19016,8,0;1,10007,5,0;1,10108,2,0;1,7,9000,0;1,8,9000,0;1,4,1000,0; | Z427: 0 | AA427: {} | AB427: n/60
A428: 424 | B428: 424 | C428: 424 | D428: 弑神试炼 | E428: 10501 | F428: 5 | G428: 3 | H428: 200424 | I428: 0 | J428: 480 | K428: 5000,0; | L428: 5 | M428: 5000,1; | N428: 39240/3600*(nPatrolSec+3)*(1000+nGuanQia)/1000 | O428: 31380/3600*(nPatrolSec+3)*(1000+nGuanQia)/1000 | P428: 19320/3600*(nPatrolSec+3)*(1000+nGuanQia)/1000 | Q428: nGuanQia + 1000 | R428: 39240/60*nMin*(1000+nGuanQia)/1000 | S428: 31380/60*nMin*(1000+nGuanQia)/1000 | T428: 19320/60*nMin*(1000+nGuanQia)/1000 | U428: 喽啰 | V428: pet_21;pet_201;pet_93;pet_91; | W428: 4 | X428: 5 | Y428: 1,28000,8,0;1,19016,8,0;1,10007,5,0;1,10108,2,0;1,7,9000,0;1,8,9000,0;1,4,1000,0; | Z428: 0 | AA428: {} | AB428: n/60
A429: 425 | B429: 425 | C429: 425 | D429: 弑神试炼 | E429: 10501 | F429: 5 | G429: 3 | H429: 200425 | I429: 0 | J429: 480 | K429: 5000,0; | L429: 5 | M429: 5000,1; | N429: 39240/3600*(nPatrolSec+3)*(1000+nGuanQia)/1000 | O429: 31380/3600*(nPatrolSec+3)*(1000+nGuanQia)/1000 | P429: 19320/3600*(nPatrolSec+3)*(1000+nGuanQia)/1000 | Q429: nGuanQia + 1000 | R429: 39240/60*nMin*(1000+nGuanQia)/1000 | S429: 31380/60*nMin*(1000+nGuanQia)/1000 | T429: 19320/60*nMin*(1000+nGuanQia)/1000 | U429: 喽啰 | V429: pet_21;pet_201;pet_93;pet_91; | W429: 4 | X429: 5 | Y429: 1,28000,8,0;1,19016,8,0;1,10007,5,0;1,10108,2,0;1,7,9000,0;1,8,9000,0;1,4,1000,0; | Z429: 0 | AA429: {} | AB429: n/60
A430: 426 | B430: 426 | C430: 426 | D430: 弑神试炼 | E430: 10501 | F430: 5 | G430: 3 | H430: 200426 | I430: 0 | J430: 480 | K430: 5000,0; | L430: 5 | M430: 5000,1; | N430: 39240/3600*(nPatrolSec+3)*(1000+nGuanQia)/1000 | O430: 31380/3600*(nPatrolSec+3)*(1000+nGuanQia)/1000 | P430: 19320/3600*(nPatrolSec+3)*(1000+nGuanQia)/1000 | Q430: nGuanQia + 1000 | R430: 39240/60*nMin*(1000+nGuanQia)/1000 | S430: 31380/60*nMin*(1000+nGuanQia)/1000 | T430: 19320/60*nMin*(1000+nGuanQia)/1000 | U430: 喽啰 | V430: pet_21;pet_201;pet_93;pet_91; | W430: 4 | X430: 5 | Y430: 1,28000,8,0;1,19016,8,0;1,10007,5,0;1,10108,2,0;1,7,9000,0;1,8,9000,0;1,4,1000,0; | Z430: 0 | AA430: {} | AB430: n/60
A431: 427 | B431: 427 | C431: 427 | D431: 弑神试炼 | E431: 10501 | F431: 5 | G431: 3 | H431: 200427 | I431: 0 | J431: 480 | K431: 5000,0; | L431: 5 | M431: 5000,1; | N431: 39240/3600*(nPatrolSec+3)*(1000+nGuanQia)/1000 | O431: 31380/3600*(nPatrolSec+3)*(1000+nGuanQia)/1000 | P431: 19320/3600*(nPatrolSec+3)*(1000+nGuanQia)/1000 | Q431: nGuanQia + 1000 | R431: 39240/60*nMin*(1000+nGuanQia)/1000 | S431: 31380/60*nMin*(1000+nGuanQia)/1000 | T431: 19320/60*nMin*(1000+nGuanQia)/1000 | U431: 喽啰 | V431: pet_21;pet_201;pet_93;pet_91; | W431: 4 | X431: 5 | Y431: 1,28000,8,0;1,19016,8,0;1,10007,5,0;1,10108,2,0;1,7,9000,0;1,8,9000,0;1,4,1000,0; | Z431: 0 | AA431: {} | AB431: n/60
A432: 428 | B432: 428 | C432: 428 | D432: 弑神试炼 | E432: 10501 | F432: 5 | G432: 3 | H432: 200428 | I432: 0 | J432: 480 | K432: 5000,0; | L432: 5 | M432: 5000,1; | N432: 39240/3600*(nPatrolSec+3)*(1000+nGuanQia)/1000 | O432: 31380/3600*(nPatrolSec+3)*(1000+nGuanQia)/1000 | P432: 19320/3600*(nPatrolSec+3)*(1000+nGuanQia)/1000 | Q432: nGuanQia + 1000 | R432: 39240/60*nMin*(1000+nGuanQia)/1000 | S432: 31380/60*nMin*(1000+nGuanQia)/1000 | T432: 19320/60*nMin*(1000+nGuanQia)/1000 | U432: 喽啰 | V432: pet_21;pet_201;pet_93;pet_91; | W432: 4 | X432: 5 | Y432: 1,28000,8,0;1,19016,8,0;1,10007,5,0;1,10108,2,0;1,7,9000,0;1,8,9000,0;1,4,1000,0; | Z432: 0 | AA432: {} | AB432: n/60
A433: 429 | B433: 429 | C433: 429 | D433: 弑神试炼 | E433: 10501 | F433: 5 | G433: 3 | H433: 200429 | I433: 0 | J433: 480 | K433: 5000,0; | L433: 5 | M433: 5000,1; | N433: 39240/3600*(nPatrolSec+3)*(1000+nGuanQia)/1000 | O433: 31380/3600*(nPatrolSec+3)*(1000+nGuanQia)/1000 | P433: 19320/3600*(nPatrolSec+3)*(1000+nGuanQia)/1000 | Q433: nGuanQia + 1000 | R433: 39240/60*nMin*(1000+nGuanQia)/1000 | S433: 31380/60*nMin*(1000+nGuanQia)/1000 | T433: 19320/60*nMin*(1000+nGuanQia)/1000 | U433: 喽啰 | V433: pet_21;pet_201;pet_93;pet_91; | W433: 4 | X433: 5 | Y433: 1,28000,8,0;1,19016,8,0;1,10007,5,0;1,10108,2,0;1,7,9000,0;1,8,9000,0;1,4,1000,0; | Z433: 0 | AA433: {} | AB433: n/60
A434: 430 | B434: 430 | C434: 430 | D434: 弑神试炼 | E434: 10501 | F434: 5 | G434: 3 | H434: 200430 | I434: 0 | J434: 480 | K434: 5000,0; | L434: 5 | M434: 5000,1; | N434: 39240/3600*(nPatrolSec+3)*(1000+nGuanQia)/1000 | O434: 31380/3600*(nPatrolSec+3)*(1000+nGuanQia)/1000 | P434: 19320/3600*(nPatrolSec+3)*(1000+nGuanQia)/1000 | Q434: nGuanQia + 1000 | R434: 39240/60*nMin*(1000+nGuanQia)/1000 | S434: 31380/60*nMin*(1000+nGuanQia)/1000 | T434: 19320/60*nMin*(1000+nGuanQia)/1000 | U434: 喽啰 | V434: pet_21;pet_201;pet_93;pet_91; | W434: 4 | X434: 5 | Y434: 1,28000,8,0;1,19016,8,0;1,10007,5,0;1,10108,2,0;1,7,9000,0;1,8,9000,0;1,4,1000,0; | Z434: 0 | AA434: {} | AB434: n/60
A435: 431 | B435: 431 | C435: 431 | D435: 弑神试炼 | E435: 10501 | F435: 5 | G435: 3 | H435: 200431 | I435: 0 | J435: 480 | K435: 5000,0; | L435: 5 | M435: 5000,1; | N435: 39240/3600*(nPatrolSec+3)*(1000+nGuanQia)/1000 | O435: 31380/3600*(nPatrolSec+3)*(1000+nGuanQia)/1000 | P435: 19320/3600*(nPatrolSec+3)*(1000+nGuanQia)/1000 | Q435: nGuanQia + 1000 | R435: 39240/60*nMin*(1000+nGuanQia)/1000 | S435: 31380/60*nMin*(1000+nGuanQia)/1000 | T435: 19320/60*nMin*(1000+nGuanQia)/1000 | U435: 喽啰 | V435: pet_21;pet_201;pet_93;pet_91; | W435: 4 | X435: 5 | Y435: 1,28000,8,0;1,19016,8,0;1,10007,5,0;1,10108,2,0;1,7,9000,0;1,8,9000,0;1,4,1000,0; | Z435: 0 | AA435: {} | AB435: n/60
A436: 432 | B436: 432 | C436: 432 | D436: 弑神试炼 | E436: 10501 | F436: 5 | G436: 3 | H436: 200432 | I436: 0 | J436: 480 | K436: 5000,0; | L436: 5 | M436: 5000,1; | N436: 39240/3600*(nPatrolSec+3)*(1000+nGuanQia)/1000 | O436: 31380/3600*(nPatrolSec+3)*(1000+nGuanQia)/1000 | P436: 19320/3600*(nPatrolSec+3)*(1000+nGuanQia)/1000 | Q436: nGuanQia + 1000 | R436: 39240/60*nMin*(1000+nGuanQia)/1000 | S436: 31380/60*nMin*(1000+nGuanQia)/1000 | T436: 19320/60*nMin*(1000+nGuanQia)/1000 | U436: 喽啰 | V436: pet_21;pet_201;pet_93;pet_91; | W436: 4 | X436: 5 | Y436: 1,28000,8,0;1,19016,8,0;1,10007,5,0;1,10108,2,0;1,7,9000,0;1,8,9000,0;1,4,1000,0; | Z436: 0 | AA436: {} | AB436: n/60
A437: 433 | B437: 433 | C437: 433 | D437: 弑神试炼 | E437: 10501 | F437: 5 | G437: 3 | H437: 200433 | I437: 0 | J437: 480 | K437: 5000,0; | L437: 5 | M437: 5000,1; | N437: 39240/3600*(nPatrolSec+3)*(1000+nGuanQia)/1000 | O437: 31380/3600*(nPatrolSec+3)*(1000+nGuanQia)/1000 | P437: 19320/3600*(nPatrolSec+3)*(1000+nGuanQia)/1000 | Q437: nGuanQia + 1000 | R437: 39240/60*nMin*(1000+nGuanQia)/1000 | S437: 31380/60*nMin*(1000+nGuanQia)/1000 | T437: 19320/60*nMin*(1000+nGuanQia)/1000 | U437: 喽啰 | V437: pet_21;pet_201;pet_93;pet_91; | W437: 4 | X437: 5 | Y437: 1,28000,8,0;1,19016,8,0;1,10007,5,0;1,10108,2,0;1,7,9000,0;1,8,9000,0;1,4,1000,0; | Z437: 0 | AA437: {} | AB437: n/60
A438: 434 | B438: 434 | C438: 434 | D438: 弑神试炼 | E438: 10501 | F438: 5 | G438: 3 | H438: 200434 | I438: 0 | J438: 480 | K438: 5000,0; | L438: 5 | M438: 5000,1; | N438: 39240/3600*(nPatrolSec+3)*(1000+nGuanQia)/1000 | O438: 31380/3600*(nPatrolSec+3)*(1000+nGuanQia)/1000 | P438: 19320/3600*(nPatrolSec+3)*(1000+nGuanQia)/1000 | Q438: nGuanQia + 1000 | R438: 39240/60*nMin*(1000+nGuanQia)/1000 | S438: 31380/60*nMin*(1000+nGuanQia)/1000 | T438: 19320/60*nMin*(1000+nGuanQia)/1000 | U438: 喽啰 | V438: pet_21;pet_201;pet_93;pet_91; | W438: 4 | X438: 5 | Y438: 1,28000,8,0;1,19016,8,0;1,10007,5,0;1,10108,2,0;1,7,9000,0;1,8,9000,0;1,4,1000,0; | Z438: 0 | AA438: {} | AB438: n/60
A439: 435 | B439: 435 | C439: 435 | D439: 弑神试炼 | E439: 10501 | F439: 5 | G439: 3 | H439: 200435 | I439: 0 | J439: 480 | K439: 5000,0; | L439: 5 | M439: 5000,1; | N439: 39240/3600*(nPatrolSec+3)*(1000+nGuanQia)/1000 | O439: 31380/3600*(nPatrolSec+3)*(1000+nGuanQia)/1000 | P439: 19320/3600*(nPatrolSec+3)*(1000+nGuanQia)/1000 | Q439: nGuanQia + 1000 | R439: 39240/60*nMin*(1000+nGuanQia)/1000 | S439: 31380/60*nMin*(1000+nGuanQia)/1000 | T439: 19320/60*nMin*(1000+nGuanQia)/1000 | U439: 喽啰 | V439: pet_21;pet_201;pet_93;pet_91; | W439: 4 | X439: 5 | Y439: 1,28000,8,0;1,19016,8,0;1,10007,5,0;1,10108,2,0;1,7,9000,0;1,8,9000,0;1,4,1000,0; | Z439: 0 | AA439: {} | AB439: n/60
A440: 436 | B440: 436 | C440: 436 | D440: 弑神试炼 | E440: 10501 | F440: 5 | G440: 3 | H440: 200436 | I440: 0 | J440: 480 | K440: 5000,0; | L440: 5 | M440: 5000,1; | N440: 39240/3600*(nPatrolSec+3)*(1000+nGuanQia)/1000 | O440: 31380/3600*(nPatrolSec+3)*(1000+nGuanQia)/1000 | P440: 19320/3600*(nPatrolSec+3)*(1000+nGuanQia)/1000 | Q440: nGuanQia + 1000 | R440: 39240/60*nMin*(1000+nGuanQia)/1000 | S440: 31380/60*nMin*(1000+nGuanQia)/1000 | T440: 19320/60*nMin*(1000+nGuanQia)/1000 | U440: 喽啰 | V440: pet_21;pet_201;pet_93;pet_91; | W440: 4 | X440: 5 | Y440: 1,28000,8,0;1,19016,8,0;1,10007,5,0;1,10108,2,0;1,7,9000,0;1,8,9000,0;1,4,1000,0; | Z440: 0 | AA440: {} | AB440: n/60
A441: 437 | B441: 437 | C441: 437 | D441: 弑神试炼 | E441: 10501 | F441: 5 | G441: 3 | H441: 200437 | I441: 0 | J441: 480 | K441: 5000,0; | L441: 5 | M441: 5000,1; | N441: 39240/3600*(nPatrolSec+3)*(1000+nGuanQia)/1000 | O441: 31380/3600*(nPatrolSec+3)*(1000+nGuanQia)/1000 | P441: 19320/3600*(nPatrolSec+3)*(1000+nGuanQia)/1000 | Q441: nGuanQia + 1000 | R441: 39240/60*nMin*(1000+nGuanQia)/1000 | S441: 31380/60*nMin*(1000+nGuanQia)/1000 | T441: 19320/60*nMin*(1000+nGuanQia)/1000 | U441: 喽啰 | V441: pet_21;pet_201;pet_93;pet_91; | W441: 4 | X441: 5 | Y441: 1,28000,8,0;1,19016,8,0;1,10007,5,0;1,10108,2,0;1,7,9000,0;1,8,9000,0;1,4,1000,0; | Z441: 0 | AA441: {} | AB441: n/60
A442: 438 | B442: 438 | C442: 438 | D442: 弑神试炼 | E442: 10501 | F442: 5 | G442: 3 | H442: 200438 | I442: 0 | J442: 480 | K442: 5000,0; | L442: 5 | M442: 5000,1; | N442: 39240/3600*(nPatrolSec+3)*(1000+nGuanQia)/1000 | O442: 31380/3600*(nPatrolSec+3)*(1000+nGuanQia)/1000 | P442: 19320/3600*(nPatrolSec+3)*(1000+nGuanQia)/1000 | Q442: nGuanQia + 1000 | R442: 39240/60*nMin*(1000+nGuanQia)/1000 | S442: 31380/60*nMin*(1000+nGuanQia)/1000 | T442: 19320/60*nMin*(1000+nGuanQia)/1000 | U442: 喽啰 | V442: pet_21;pet_201;pet_93;pet_91; | W442: 4 | X442: 5 | Y442: 1,28000,8,0;1,19016,8,0;1,10007,5,0;1,10108,2,0;1,7,9000,0;1,8,9000,0;1,4,1000,0; | Z442: 0 | AA442: {} | AB442: n/60
A443: 439 | B443: 439 | C443: 439 | D443: 弑神试炼 | E443: 10501 | F443: 5 | G443: 3 | H443: 200439 | I443: 0 | J443: 480 | K443: 5000,0; | L443: 5 | M443: 5000,1; | N443: 39240/3600*(nPatrolSec+3)*(1000+nGuanQia)/1000 | O443: 31380/3600*(nPatrolSec+3)*(1000+nGuanQia)/1000 | P443: 19320/3600*(nPatrolSec+3)*(1000+nGuanQia)/1000 | Q443: nGuanQia + 1000 | R443: 39240/60*nMin*(1000+nGuanQia)/1000 | S443: 31380/60*nMin*(1000+nGuanQia)/1000 | T443: 19320/60*nMin*(1000+nGuanQia)/1000 | U443: 喽啰 | V443: pet_21;pet_201;pet_93;pet_91; | W443: 4 | X443: 5 | Y443: 1,28000,8,0;1,19016,8,0;1,10007,5,0;1,10108,2,0;1,7,9000,0;1,8,9000,0;1,4,1000,0; | Z443: 0 | AA443: {} | AB443: n/60
A444: 440 | B444: 440 | C444: 440 | D444: 弑神试炼 | E444: 10501 | F444: 5 | G444: 3 | H444: 200440 | I444: 0 | J444: 480 | K444: 5000,0; | L444: 5 | M444: 5000,1; | N444: 39240/3600*(nPatrolSec+3)*(1000+nGuanQia)/1000 | O444: 31380/3600*(nPatrolSec+3)*(1000+nGuanQia)/1000 | P444: 19320/3600*(nPatrolSec+3)*(1000+nGuanQia)/1000 | Q444: nGuanQia + 1000 | R444: 39240/60*nMin*(1000+nGuanQia)/1000 | S444: 31380/60*nMin*(1000+nGuanQia)/1000 | T444: 19320/60*nMin*(1000+nGuanQia)/1000 | U444: 喽啰 | V444: pet_21;pet_201;pet_93;pet_91; | W444: 4 | X444: 5 | Y444: 1,28000,8,0;1,19016,8,0;1,10007,5,0;1,10108,2,0;1,7,9000,0;1,8,9000,0;1,4,1000,0; | Z444: 0 | AA444: {} | AB444: n/60
A445: 441 | B445: 441 | C445: 441 | D445: 弑神试炼 | E445: 10501 | F445: 5 | G445: 3 | H445: 200441 | I445: 0 | J445: 480 | K445: 5000,0; | L445: 5 | M445: 5000,1; | N445: 39240/3600*(nPatrolSec+3)*(1000+nGuanQia)/1000 | O445: 31380/3600*(nPatrolSec+3)*(1000+nGuanQia)/1000 | P445: 19320/3600*(nPatrolSec+3)*(1000+nGuanQia)/1000 | Q445: nGuanQia + 1000 | R445: 39240/60*nMin*(1000+nGuanQia)/1000 | S445: 31380/60*nMin*(1000+nGuanQia)/1000 | T445: 19320/60*nMin*(1000+nGuanQia)/1000 | U445: 喽啰 | V445: pet_21;pet_201;pet_93;pet_91; | W445: 4 | X445: 5 | Y445: 1,28000,8,0;1,19016,8,0;1,10007,5,0;1,10108,2,0;1,7,9000,0;1,8,9000,0;1,4,1000,0; | Z445: 0 | AA445: {} | AB445: n/60
A446: 442 | B446: 442 | C446: 442 | D446: 弑神试炼 | E446: 10501 | F446: 5 | G446: 3 | H446: 200442 | I446: 0 | J446: 480 | K446: 5000,0; | L446: 5 | M446: 5000,1; | N446: 39240/3600*(nPatrolSec+3)*(1000+nGuanQia)/1000 | O446: 31380/3600*(nPatrolSec+3)*(1000+nGuanQia)/1000 | P446: 19320/3600*(nPatrolSec+3)*(1000+nGuanQia)/1000 | Q446: nGuanQia + 1000 | R446: 39240/60*nMin*(1000+nGuanQia)/1000 | S446: 31380/60*nMin*(1000+nGuanQia)/1000 | T446: 19320/60*nMin*(1000+nGuanQia)/1000 | U446: 喽啰 | V446: pet_21;pet_201;pet_93;pet_91; | W446: 4 | X446: 5 | Y446: 1,28000,8,0;1,19016,8,0;1,10007,5,0;1,10108,2,0;1,7,9000,0;1,8,9000,0;1,4,1000,0; | Z446: 0 | AA446: {} | AB446: n/60
A447: 443 | B447: 443 | C447: 443 | D447: 弑神试炼 | E447: 10501 | F447: 5 | G447: 3 | H447: 200443 | I447: 0 | J447: 480 | K447: 5000,0; | L447: 5 | M447: 5000,1; | N447: 39240/3600*(nPatrolSec+3)*(1000+nGuanQia)/1000 | O447: 31380/3600*(nPatrolSec+3)*(1000+nGuanQia)/1000 | P447: 19320/3600*(nPatrolSec+3)*(1000+nGuanQia)/1000 | Q447: nGuanQia + 1000 | R447: 39240/60*nMin*(1000+nGuanQia)/1000 | S447: 31380/60*nMin*(1000+nGuanQia)/1000 | T447: 19320/60*nMin*(1000+nGuanQia)/1000 | U447: 喽啰 | V447: pet_21;pet_201;pet_93;pet_91; | W447: 4 | X447: 5 | Y447: 1,28000,8,0;1,19016,8,0;1,10007,5,0;1,10108,2,0;1,7,9000,0;1,8,9000,0;1,4,1000,0; | Z447: 0 | AA447: {} | AB447: n/60
A448: 444 | B448: 444 | C448: 444 | D448: 弑神试炼 | E448: 10501 | F448: 5 | G448: 3 | H448: 200444 | I448: 0 | J448: 480 | K448: 5000,0; | L448: 5 | M448: 5000,1; | N448: 39240/3600*(nPatrolSec+3)*(1000+nGuanQia)/1000 | O448: 31380/3600*(nPatrolSec+3)*(1000+nGuanQia)/1000 | P448: 19320/3600*(nPatrolSec+3)*(1000+nGuanQia)/1000 | Q448: nGuanQia + 1000 | R448: 39240/60*nMin*(1000+nGuanQia)/1000 | S448: 31380/60*nMin*(1000+nGuanQia)/1000 | T448: 19320/60*nMin*(1000+nGuanQia)/1000 | U448: 喽啰 | V448: pet_21;pet_201;pet_93;pet_91; | W448: 4 | X448: 5 | Y448: 1,28000,8,0;1,19016,8,0;1,10007,5,0;1,10108,2,0;1,7,9000,0;1,8,9000,0;1,4,1000,0; | Z448: 0 | AA448: {} | AB448: n/60
A449: 445 | B449: 445 | C449: 445 | D449: 弑神试炼 | E449: 10501 | F449: 5 | G449: 3 | H449: 200445 | I449: 0 | J449: 480 | K449: 5000,0; | L449: 5 | M449: 5000,1; | N449: 39240/3600*(nPatrolSec+3)*(1000+nGuanQia)/1000 | O449: 31380/3600*(nPatrolSec+3)*(1000+nGuanQia)/1000 | P449: 19320/3600*(nPatrolSec+3)*(1000+nGuanQia)/1000 | Q449: nGuanQia + 1000 | R449: 39240/60*nMin*(1000+nGuanQia)/1000 | S449: 31380/60*nMin*(1000+nGuanQia)/1000 | T449: 19320/60*nMin*(1000+nGuanQia)/1000 | U449: 喽啰 | V449: pet_21;pet_201;pet_93;pet_91; | W449: 4 | X449: 5 | Y449: 1,28000,8,0;1,19016,8,0;1,10007,5,0;1,10108,2,0;1,7,9000,0;1,8,9000,0;1,4,1000,0; | Z449: 0 | AA449: {} | AB449: n/60
A450: 446 | B450: 446 | C450: 446 | D450: 弑神试炼 | E450: 10501 | F450: 5 | G450: 3 | H450: 200446 | I450: 0 | J450: 480 | K450: 5000,0; | L450: 5 | M450: 5000,1; | N450: 39240/3600*(nPatrolSec+3)*(1000+nGuanQia)/1000 | O450: 31380/3600*(nPatrolSec+3)*(1000+nGuanQia)/1000 | P450: 19320/3600*(nPatrolSec+3)*(1000+nGuanQia)/1000 | Q450: nGuanQia + 1000 | R450: 39240/60*nMin*(1000+nGuanQia)/1000 | S450: 31380/60*nMin*(1000+nGuanQia)/1000 | T450: 19320/60*nMin*(1000+nGuanQia)/1000 | U450: 喽啰 | V450: pet_21;pet_201;pet_93;pet_91; | W450: 4 | X450: 5 | Y450: 1,28000,8,0;1,19016,8,0;1,10007,5,0;1,10108,2,0;1,7,9000,0;1,8,9000,0;1,4,1000,0; | Z450: 0 | AA450: {} | AB450: n/60
A451: 447 | B451: 447 | C451: 447 | D451: 弑神试炼 | E451: 10501 | F451: 5 | G451: 3 | H451: 200447 | I451: 0 | J451: 480 | K451: 5000,0; | L451: 5 | M451: 5000,1; | N451: 39240/3600*(nPatrolSec+3)*(1000+nGuanQia)/1000 | O451: 31380/3600*(nPatrolSec+3)*(1000+nGuanQia)/1000 | P451: 19320/3600*(nPatrolSec+3)*(1000+nGuanQia)/1000 | Q451: nGuanQia + 1000 | R451: 39240/60*nMin*(1000+nGuanQia)/1000 | S451: 31380/60*nMin*(1000+nGuanQia)/1000 | T451: 19320/60*nMin*(1000+nGuanQia)/1000 | U451: 喽啰 | V451: pet_21;pet_201;pet_93;pet_91; | W451: 4 | X451: 5 | Y451: 1,28000,8,0;1,19016,8,0;1,10007,5,0;1,10108,2,0;1,7,9000,0;1,8,9000,0;1,4,1000,0; | Z451: 0 | AA451: {} | AB451: n/60
A452: 448 | B452: 448 | C452: 448 | D452: 弑神试炼 | E452: 10501 | F452: 5 | G452: 3 | H452: 200448 | I452: 0 | J452: 480 | K452: 5000,0; | L452: 5 | M452: 5000,1; | N452: 39240/3600*(nPatrolSec+3)*(1000+nGuanQia)/1000 | O452: 31380/3600*(nPatrolSec+3)*(1000+nGuanQia)/1000 | P452: 19320/3600*(nPatrolSec+3)*(1000+nGuanQia)/1000 | Q452: nGuanQia + 1000 | R452: 39240/60*nMin*(1000+nGuanQia)/1000 | S452: 31380/60*nMin*(1000+nGuanQia)/1000 | T452: 19320/60*nMin*(1000+nGuanQia)/1000 | U452: 喽啰 | V452: pet_21;pet_201;pet_93;pet_91; | W452: 4 | X452: 5 | Y452: 1,28000,8,0;1,19016,8,0;1,10007,5,0;1,10108,2,0;1,7,9000,0;1,8,9000,0;1,4,1000,0; | Z452: 0 | AA452: {} | AB452: n/60
A453: 449 | B453: 449 | C453: 449 | D453: 弑神试炼 | E453: 10501 | F453: 5 | G453: 3 | H453: 200449 | I453: 0 | J453: 480 | K453: 5000,0; | L453: 5 | M453: 5000,1; | N453: 39240/3600*(nPatrolSec+3)*(1000+nGuanQia)/1000 | O453: 31380/3600*(nPatrolSec+3)*(1000+nGuanQia)/1000 | P453: 19320/3600*(nPatrolSec+3)*(1000+nGuanQia)/1000 | Q453: nGuanQia + 1000 | R453: 39240/60*nMin*(1000+nGuanQia)/1000 | S453: 31380/60*nMin*(1000+nGuanQia)/1000 | T453: 19320/60*nMin*(1000+nGuanQia)/1000 | U453: 喽啰 | V453: pet_21;pet_201;pet_93;pet_91; | W453: 4 | X453: 5 | Y453: 1,28000,8,0;1,19016,8,0;1,10007,5,0;1,10108,2,0;1,7,9000,0;1,8,9000,0;1,4,1000,0; | Z453: 0 | AA453: {} | AB453: n/60
A454: 450 | B454: 450 | C454: 450 | D454: 弑神试炼 | E454: 10501 | F454: 5 | G454: 3 | H454: 200450 | I454: 0 | J454: 480 | K454: 5000,0; | L454: 5 | M454: 5000,1; | N454: 39240/3600*(nPatrolSec+3)*(1000+nGuanQia)/1000 | O454: 31380/3600*(nPatrolSec+3)*(1000+nGuanQia)/1000 | P454: 19320/3600*(nPatrolSec+3)*(1000+nGuanQia)/1000 | Q454: nGuanQia + 1000 | R454: 39240/60*nMin*(1000+nGuanQia)/1000 | S454: 31380/60*nMin*(1000+nGuanQia)/1000 | T454: 19320/60*nMin*(1000+nGuanQia)/1000 | U454: 喽啰 | V454: pet_21;pet_201;pet_93;pet_91; | W454: 4 | X454: 5 | Y454: 1,28000,8,0;1,19016,8,0;1,10007,5,0;1,10108,2,0;1,7,9000,0;1,8,9000,0;1,4,1000,0; | Z454: 0 | AA454: {} | AB454: n/60
A455: 451 | B455: 451 | C455: 451 | D455: 弑神试炼 | E455: 10501 | F455: 5 | G455: 3 | H455: 200451 | I455: 0 | J455: 480 | K455: 5000,0; | L455: 5 | M455: 5000,1; | N455: 39240/3600*(nPatrolSec+3)*(1000+nGuanQia)/1000 | O455: 31380/3600*(nPatrolSec+3)*(1000+nGuanQia)/1000 | P455: 19320/3600*(nPatrolSec+3)*(1000+nGuanQia)/1000 | Q455: nGuanQia + 1000 | R455: 39240/60*nMin*(1000+nGuanQia)/1000 | S455: 31380/60*nMin*(1000+nGuanQia)/1000 | T455: 19320/60*nMin*(1000+nGuanQia)/1000 | U455: 喽啰 | V455: pet_21;pet_201;pet_93;pet_91; | W455: 4 | X455: 5 | Y455: 1,28000,8,0;1,19016,8,0;1,10007,5,0;1,10108,2,0;1,7,9000,0;1,8,9000,0;1,4,1000,0; | Z455: 0 | AA455: {} | AB455: n/60
A456: 452 | B456: 452 | C456: 452 | D456: 弑神试炼 | E456: 10501 | F456: 5 | G456: 3 | H456: 200452 | I456: 0 | J456: 480 | K456: 5000,0; | L456: 5 | M456: 5000,1; | N456: 39240/3600*(nPatrolSec+3)*(1000+nGuanQia)/1000 | O456: 31380/3600*(nPatrolSec+3)*(1000+nGuanQia)/1000 | P456: 19320/3600*(nPatrolSec+3)*(1000+nGuanQia)/1000 | Q456: nGuanQia + 1000 | R456: 39240/60*nMin*(1000+nGuanQia)/1000 | S456: 31380/60*nMin*(1000+nGuanQia)/1000 | T456: 19320/60*nMin*(1000+nGuanQia)/1000 | U456: 喽啰 | V456: pet_21;pet_201;pet_93;pet_91; | W456: 4 | X456: 5 | Y456: 1,28000,8,0;1,19016,8,0;1,10007,5,0;1,10108,2,0;1,7,9000,0;1,8,9000,0;1,4,1000,0; | Z456: 0 | AA456: {} | AB456: n/60
A457: 453 | B457: 453 | C457: 453 | D457: 弑神试炼 | E457: 10501 | F457: 5 | G457: 3 | H457: 200453 | I457: 0 | J457: 480 | K457: 5000,0; | L457: 5 | M457: 5000,1; | N457: 39240/3600*(nPatrolSec+3)*(1000+nGuanQia)/1000 | O457: 31380/3600*(nPatrolSec+3)*(1000+nGuanQia)/1000 | P457: 19320/3600*(nPatrolSec+3)*(1000+nGuanQia)/1000 | Q457: nGuanQia + 1000 | R457: 39240/60*nMin*(1000+nGuanQia)/1000 | S457: 31380/60*nMin*(1000+nGuanQia)/1000 | T457: 19320/60*nMin*(1000+nGuanQia)/1000 | U457: 喽啰 | V457: pet_21;pet_201;pet_93;pet_91; | W457: 4 | X457: 5 | Y457: 1,28000,8,0;1,19016,8,0;1,10007,5,0;1,10108,2,0;1,7,9000,0;1,8,9000,0;1,4,1000,0; | Z457: 0 | AA457: {} | AB457: n/60
A458: 454 | B458: 454 | C458: 454 | D458: 弑神试炼 | E458: 10501 | F458: 5 | G458: 3 | H458: 200454 | I458: 0 | J458: 480 | K458: 5000,0; | L458: 5 | M458: 5000,1; | N458: 39240/3600*(nPatrolSec+3)*(1000+nGuanQia)/1000 | O458: 31380/3600*(nPatrolSec+3)*(1000+nGuanQia)/1000 | P458: 19320/3600*(nPatrolSec+3)*(1000+nGuanQia)/1000 | Q458: nGuanQia + 1000 | R458: 39240/60*nMin*(1000+nGuanQia)/1000 | S458: 31380/60*nMin*(1000+nGuanQia)/1000 | T458: 19320/60*nMin*(1000+nGuanQia)/1000 | U458: 喽啰 | V458: pet_21;pet_201;pet_93;pet_91; | W458: 4 | X458: 5 | Y458: 1,28000,8,0;1,19016,8,0;1,10007,5,0;1,10108,2,0;1,7,9000,0;1,8,9000,0;1,4,1000,0; | Z458: 0 | AA458: {} | AB458: n/60
A459: 455 | B459: 455 | C459: 455 | D459: 弑神试炼 | E459: 10501 | F459: 5 | G459: 3 | H459: 200455 | I459: 0 | J459: 480 | K459: 5000,0; | L459: 5 | M459: 5000,1; | N459: 39240/3600*(nPatrolSec+3)*(1000+nGuanQia)/1000 | O459: 31380/3600*(nPatrolSec+3)*(1000+nGuanQia)/1000 | P459: 19320/3600*(nPatrolSec+3)*(1000+nGuanQia)/1000 | Q459: nGuanQia + 1000 | R459: 39240/60*nMin*(1000+nGuanQia)/1000 | S459: 31380/60*nMin*(1000+nGuanQia)/1000 | T459: 19320/60*nMin*(1000+nGuanQia)/1000 | U459: 喽啰 | V459: pet_21;pet_201;pet_93;pet_91; | W459: 4 | X459: 5 | Y459: 1,28000,8,0;1,19016,8,0;1,10007,5,0;1,10108,2,0;1,7,9000,0;1,8,9000,0;1,4,1000,0; | Z459: 0 | AA459: {} | AB459: n/60
A460: 456 | B460: 456 | C460: 456 | D460: 弑神试炼 | E460: 10501 | F460: 5 | G460: 3 | H460: 200456 | I460: 0 | J460: 480 | K460: 5000,0; | L460: 5 | M460: 5000,1; | N460: 39240/3600*(nPatrolSec+3)*(1000+nGuanQia)/1000 | O460: 31380/3600*(nPatrolSec+3)*(1000+nGuanQia)/1000 | P460: 19320/3600*(nPatrolSec+3)*(1000+nGuanQia)/1000 | Q460: nGuanQia + 1000 | R460: 39240/60*nMin*(1000+nGuanQia)/1000 | S460: 31380/60*nMin*(1000+nGuanQia)/1000 | T460: 19320/60*nMin*(1000+nGuanQia)/1000 | U460: 喽啰 | V460: pet_21;pet_201;pet_93;pet_91; | W460: 4 | X460: 5 | Y460: 1,28000,8,0;1,19016,8,0;1,10007,5,0;1,10108,2,0;1,7,9000,0;1,8,9000,0;1,4,1000,0; | Z460: 0 | AA460: {} | AB460: n/60
A461: 457 | B461: 457 | C461: 457 | D461: 弑神试炼 | E461: 10501 | F461: 5 | G461: 3 | H461: 200457 | I461: 0 | J461: 480 | K461: 5000,0; | L461: 5 | M461: 5000,1; | N461: 39240/3600*(nPatrolSec+3)*(1000+nGuanQia)/1000 | O461: 31380/3600*(nPatrolSec+3)*(1000+nGuanQia)/1000 | P461: 19320/3600*(nPatrolSec+3)*(1000+nGuanQia)/1000 | Q461: nGuanQia + 1000 | R461: 39240/60*nMin*(1000+nGuanQia)/1000 | S461: 31380/60*nMin*(1000+nGuanQia)/1000 | T461: 19320/60*nMin*(1000+nGuanQia)/1000 | U461: 喽啰 | V461: pet_21;pet_201;pet_93;pet_91; | W461: 4 | X461: 5 | Y461: 1,28000,8,0;1,19016,8,0;1,10007,5,0;1,10108,2,0;1,7,9000,0;1,8,9000,0;1,4,1000,0; | Z461: 0 | AA461: {} | AB461: n/60
A462: 458 | B462: 458 | C462: 458 | D462: 弑神试炼 | E462: 10501 | F462: 5 | G462: 3 | H462: 200458 | I462: 0 | J462: 480 | K462: 5000,0; | L462: 5 | M462: 5000,1; | N462: 39240/3600*(nPatrolSec+3)*(1000+nGuanQia)/1000 | O462: 31380/3600*(nPatrolSec+3)*(1000+nGuanQia)/1000 | P462: 19320/3600*(nPatrolSec+3)*(1000+nGuanQia)/1000 | Q462: nGuanQia + 1000 | R462: 39240/60*nMin*(1000+nGuanQia)/1000 | S462: 31380/60*nMin*(1000+nGuanQia)/1000 | T462: 19320/60*nMin*(1000+nGuanQia)/1000 | U462: 喽啰 | V462: pet_21;pet_201;pet_93;pet_91; | W462: 4 | X462: 5 | Y462: 1,28000,8,0;1,19016,8,0;1,10007,5,0;1,10108,2,0;1,7,9000,0;1,8,9000,0;1,4,1000,0; | Z462: 0 | AA462: {} | AB462: n/60
A463: 459 | B463: 459 | C463: 459 | D463: 弑神试炼 | E463: 10501 | F463: 5 | G463: 3 | H463: 200459 | I463: 0 | J463: 480 | K463: 5000,0; | L463: 5 | M463: 5000,1; | N463: 39240/3600*(nPatrolSec+3)*(1000+nGuanQia)/1000 | O463: 31380/3600*(nPatrolSec+3)*(1000+nGuanQia)/1000 | P463: 19320/3600*(nPatrolSec+3)*(1000+nGuanQia)/1000 | Q463: nGuanQia + 1000 | R463: 39240/60*nMin*(1000+nGuanQia)/1000 | S463: 31380/60*nMin*(1000+nGuanQia)/1000 | T463: 19320/60*nMin*(1000+nGuanQia)/1000 | U463: 喽啰 | V463: pet_21;pet_201;pet_93;pet_91; | W463: 4 | X463: 5 | Y463: 1,28000,8,0;1,19016,8,0;1,10007,5,0;1,10108,2,0;1,7,9000,0;1,8,9000,0;1,4,1000,0; | Z463: 0 | AA463: {} | AB463: n/60
A464: 460 | B464: 460 | C464: 460 | D464: 弑神试炼 | E464: 10501 | F464: 5 | G464: 3 | H464: 200460 | I464: 0 | J464: 480 | K464: 5000,0; | L464: 5 | M464: 5000,1; | N464: 39240/3600*(nPatrolSec+3)*(1000+nGuanQia)/1000 | O464: 31380/3600*(nPatrolSec+3)*(1000+nGuanQia)/1000 | P464: 19320/3600*(nPatrolSec+3)*(1000+nGuanQia)/1000 | Q464: nGuanQia + 1000 | R464: 39240/60*nMin*(1000+nGuanQia)/1000 | S464: 31380/60*nMin*(1000+nGuanQia)/1000 | T464: 19320/60*nMin*(1000+nGuanQia)/1000 | U464: 喽啰 | V464: pet_21;pet_201;pet_93;pet_91; | W464: 4 | X464: 5 | Y464: 1,28000,8,0;1,19016,8,0;1,10007,5,0;1,10108,2,0;1,7,9000,0;1,8,9000,0;1,4,1000,0; | Z464: 0 | AA464: {} | AB464: n/60
A465: 461 | B465: 461 | C465: 461 | D465: 弑神试炼 | E465: 10501 | F465: 5 | G465: 3 | H465: 200461 | I465: 0 | J465: 480 | K465: 5000,0; | L465: 5 | M465: 5000,1; | N465: 39240/3600*(nPatrolSec+3)*(1000+nGuanQia)/1000 | O465: 31380/3600*(nPatrolSec+3)*(1000+nGuanQia)/1000 | P465: 19320/3600*(nPatrolSec+3)*(1000+nGuanQia)/1000 | Q465: nGuanQia + 1000 | R465: 39240/60*nMin*(1000+nGuanQia)/1000 | S465: 31380/60*nMin*(1000+nGuanQia)/1000 | T465: 19320/60*nMin*(1000+nGuanQia)/1000 | U465: 喽啰 | V465: pet_21;pet_201;pet_93;pet_91; | W465: 4 | X465: 5 | Y465: 1,28000,8,0;1,19016,8,0;1,10007,5,0;1,10108,2,0;1,7,9000,0;1,8,9000,0;1,4,1000,0; | Z465: 0 | AA465: {} | AB465: n/60
A466: 462 | B466: 462 | C466: 462 | D466: 弑神试炼 | E466: 10501 | F466: 5 | G466: 3 | H466: 200462 | I466: 0 | J466: 480 | K466: 5000,0; | L466: 5 | M466: 5000,1; | N466: 39240/3600*(nPatrolSec+3)*(1000+nGuanQia)/1000 | O466: 31380/3600*(nPatrolSec+3)*(1000+nGuanQia)/1000 | P466: 19320/3600*(nPatrolSec+3)*(1000+nGuanQia)/1000 | Q466: nGuanQia + 1000 | R466: 39240/60*nMin*(1000+nGuanQia)/1000 | S466: 31380/60*nMin*(1000+nGuanQia)/1000 | T466: 19320/60*nMin*(1000+nGuanQia)/1000 | U466: 喽啰 | V466: pet_21;pet_201;pet_93;pet_91; | W466: 4 | X466: 5 | Y466: 1,28000,8,0;1,19016,8,0;1,10007,5,0;1,10108,2,0;1,7,9000,0;1,8,9000,0;1,4,1000,0; | Z466: 0 | AA466: {} | AB466: n/60
A467: 463 | B467: 463 | C467: 463 | D467: 弑神试炼 | E467: 10501 | F467: 5 | G467: 3 | H467: 200463 | I467: 0 | J467: 480 | K467: 5000,0; | L467: 5 | M467: 5000,1; | N467: 39240/3600*(nPatrolSec+3)*(1000+nGuanQia)/1000 | O467: 31380/3600*(nPatrolSec+3)*(1000+nGuanQia)/1000 | P467: 19320/3600*(nPatrolSec+3)*(1000+nGuanQia)/1000 | Q467: nGuanQia + 1000 | R467: 39240/60*nMin*(1000+nGuanQia)/1000 | S467: 31380/60*nMin*(1000+nGuanQia)/1000 | T467: 19320/60*nMin*(1000+nGuanQia)/1000 | U467: 喽啰 | V467: pet_21;pet_201;pet_93;pet_91; | W467: 4 | X467: 5 | Y467: 1,28000,8,0;1,19016,8,0;1,10007,5,0;1,10108,2,0;1,7,9000,0;1,8,9000,0;1,4,1000,0; | Z467: 0 | AA467: {} | AB467: n/60
A468: 464 | B468: 464 | C468: 464 | D468: 弑神试炼 | E468: 10501 | F468: 5 | G468: 3 | H468: 200464 | I468: 0 | J468: 480 | K468: 5000,0; | L468: 5 | M468: 5000,1; | N468: 39240/3600*(nPatrolSec+3)*(1000+nGuanQia)/1000 | O468: 31380/3600*(nPatrolSec+3)*(1000+nGuanQia)/1000 | P468: 19320/3600*(nPatrolSec+3)*(1000+nGuanQia)/1000 | Q468: nGuanQia + 1000 | R468: 39240/60*nMin*(1000+nGuanQia)/1000 | S468: 31380/60*nMin*(1000+nGuanQia)/1000 | T468: 19320/60*nMin*(1000+nGuanQia)/1000 | U468: 喽啰 | V468: pet_21;pet_201;pet_93;pet_91; | W468: 4 | X468: 5 | Y468: 1,28000,8,0;1,19016,8,0;1,10007,5,0;1,10108,2,0;1,7,9000,0;1,8,9000,0;1,4,1000,0; | Z468: 0 | AA468: {} | AB468: n/60
A469: 465 | B469: 465 | C469: 465 | D469: 弑神试炼 | E469: 10501 | F469: 5 | G469: 3 | H469: 200465 | I469: 0 | J469: 480 | K469: 5000,0; | L469: 5 | M469: 5000,1; | N469: 39240/3600*(nPatrolSec+3)*(1000+nGuanQia)/1000 | O469: 31380/3600*(nPatrolSec+3)*(1000+nGuanQia)/1000 | P469: 19320/3600*(nPatrolSec+3)*(1000+nGuanQia)/1000 | Q469: nGuanQia + 1000 | R469: 39240/60*nMin*(1000+nGuanQia)/1000 | S469: 31380/60*nMin*(1000+nGuanQia)/1000 | T469: 19320/60*nMin*(1000+nGuanQia)/1000 | U469: 喽啰 | V469: pet_21;pet_201;pet_93;pet_91; | W469: 4 | X469: 5 | Y469: 1,28000,8,0;1,19016,8,0;1,10007,5,0;1,10108,2,0;1,7,9000,0;1,8,9000,0;1,4,1000,0; | Z469: 0 | AA469: {} | AB469: n/60
A470: 466 | B470: 466 | C470: 466 | D470: 弑神试炼 | E470: 10501 | F470: 5 | G470: 3 | H470: 200466 | I470: 0 | J470: 480 | K470: 5000,0; | L470: 5 | M470: 5000,1; | N470: 39240/3600*(nPatrolSec+3)*(1000+nGuanQia)/1000 | O470: 31380/3600*(nPatrolSec+3)*(1000+nGuanQia)/1000 | P470: 19320/3600*(nPatrolSec+3)*(1000+nGuanQia)/1000 | Q470: nGuanQia + 1000 | R470: 39240/60*nMin*(1000+nGuanQia)/1000 | S470: 31380/60*nMin*(1000+nGuanQia)/1000 | T470: 19320/60*nMin*(1000+nGuanQia)/1000 | U470: 喽啰 | V470: pet_21;pet_201;pet_93;pet_91; | W470: 4 | X470: 5 | Y470: 1,28000,8,0;1,19016,8,0;1,10007,5,0;1,10108,2,0;1,7,9000,0;1,8,9000,0;1,4,1000,0; | Z470: 0 | AA470: {} | AB470: n/60
A471: 467 | B471: 467 | C471: 467 | D471: 弑神试炼 | E471: 10501 | F471: 5 | G471: 3 | H471: 200467 | I471: 0 | J471: 480 | K471: 5000,0; | L471: 5 | M471: 5000,1; | N471: 39240/3600*(nPatrolSec+3)*(1000+nGuanQia)/1000 | O471: 31380/3600*(nPatrolSec+3)*(1000+nGuanQia)/1000 | P471: 19320/3600*(nPatrolSec+3)*(1000+nGuanQia)/1000 | Q471: nGuanQia + 1000 | R471: 39240/60*nMin*(1000+nGuanQia)/1000 | S471: 31380/60*nMin*(1000+nGuanQia)/1000 | T471: 19320/60*nMin*(1000+nGuanQia)/1000 | U471: 喽啰 | V471: pet_21;pet_201;pet_93;pet_91; | W471: 4 | X471: 5 | Y471: 1,28000,8,0;1,19016,8,0;1,10007,5,0;1,10108,2,0;1,7,9000,0;1,8,9000,0;1,4,1000,0; | Z471: 0 | AA471: {} | AB471: n/60
A472: 468 | B472: 468 | C472: 468 | D472: 弑神试炼 | E472: 10501 | F472: 5 | G472: 3 | H472: 200468 | I472: 0 | J472: 480 | K472: 5000,0; | L472: 5 | M472: 5000,1; | N472: 39240/3600*(nPatrolSec+3)*(1000+nGuanQia)/1000 | O472: 31380/3600*(nPatrolSec+3)*(1000+nGuanQia)/1000 | P472: 19320/3600*(nPatrolSec+3)*(1000+nGuanQia)/1000 | Q472: nGuanQia + 1000 | R472: 39240/60*nMin*(1000+nGuanQia)/1000 | S472: 31380/60*nMin*(1000+nGuanQia)/1000 | T472: 19320/60*nMin*(1000+nGuanQia)/1000 | U472: 喽啰 | V472: pet_21;pet_201;pet_93;pet_91; | W472: 4 | X472: 5 | Y472: 1,28000,8,0;1,19016,8,0;1,10007,5,0;1,10108,2,0;1,7,9000,0;1,8,9000,0;1,4,1000,0; | Z472: 0 | AA472: {} | AB472: n/60
A473: 469 | B473: 469 | C473: 469 | D473: 弑神试炼 | E473: 10501 | F473: 5 | G473: 3 | H473: 200469 | I473: 0 | J473: 480 | K473: 5000,0; | L473: 5 | M473: 5000,1; | N473: 39240/3600*(nPatrolSec+3)*(1000+nGuanQia)/1000 | O473: 31380/3600*(nPatrolSec+3)*(1000+nGuanQia)/1000 | P473: 19320/3600*(nPatrolSec+3)*(1000+nGuanQia)/1000 | Q473: nGuanQia + 1000 | R473: 39240/60*nMin*(1000+nGuanQia)/1000 | S473: 31380/60*nMin*(1000+nGuanQia)/1000 | T473: 19320/60*nMin*(1000+nGuanQia)/1000 | U473: 喽啰 | V473: pet_21;pet_201;pet_93;pet_91; | W473: 4 | X473: 5 | Y473: 1,28000,8,0;1,19016,8,0;1,10007,5,0;1,10108,2,0;1,7,9000,0;1,8,9000,0;1,4,1000,0; | Z473: 0 | AA473: {} | AB473: n/60
A474: 470 | B474: 470 | C474: 470 | D474: 弑神试炼 | E474: 10501 | F474: 5 | G474: 3 | H474: 200470 | I474: 0 | J474: 480 | K474: 5000,0; | L474: 5 | M474: 5000,1; | N474: 39240/3600*(nPatrolSec+3)*(1000+nGuanQia)/1000 | O474: 31380/3600*(nPatrolSec+3)*(1000+nGuanQia)/1000 | P474: 19320/3600*(nPatrolSec+3)*(1000+nGuanQia)/1000 | Q474: nGuanQia + 1000 | R474: 39240/60*nMin*(1000+nGuanQia)/1000 | S474: 31380/60*nMin*(1000+nGuanQia)/1000 | T474: 19320/60*nMin*(1000+nGuanQia)/1000 | U474: 喽啰 | V474: pet_21;pet_201;pet_93;pet_91; | W474: 4 | X474: 5 | Y474: 1,28000,8,0;1,19016,8,0;1,10007,5,0;1,10108,2,0;1,7,9000,0;1,8,9000,0;1,4,1000,0; | Z474: 0 | AA474: {} | AB474: n/60
A475: 471 | B475: 471 | C475: 471 | D475: 弑神试炼 | E475: 10501 | F475: 5 | G475: 3 | H475: 200471 | I475: 0 | J475: 480 | K475: 5000,0; | L475: 5 | M475: 5000,1; | N475: 39240/3600*(nPatrolSec+3)*(1000+nGuanQia)/1000 | O475: 31380/3600*(nPatrolSec+3)*(1000+nGuanQia)/1000 | P475: 19320/3600*(nPatrolSec+3)*(1000+nGuanQia)/1000 | Q475: nGuanQia + 1000 | R475: 39240/60*nMin*(1000+nGuanQia)/1000 | S475: 31380/60*nMin*(1000+nGuanQia)/1000 | T475: 19320/60*nMin*(1000+nGuanQia)/1000 | U475: 喽啰 | V475: pet_21;pet_201;pet_93;pet_91; | W475: 4 | X475: 5 | Y475: 1,28000,8,0;1,19016,8,0;1,10007,5,0;1,10108,2,0;1,7,9000,0;1,8,9000,0;1,4,1000,0; | Z475: 0 | AA475: {} | AB475: n/60
A476: 472 | B476: 472 | C476: 472 | D476: 弑神试炼 | E476: 10501 | F476: 5 | G476: 3 | H476: 200472 | I476: 0 | J476: 480 | K476: 5000,0; | L476: 5 | M476: 5000,1; | N476: 39240/3600*(nPatrolSec+3)*(1000+nGuanQia)/1000 | O476: 31380/3600*(nPatrolSec+3)*(1000+nGuanQia)/1000 | P476: 19320/3600*(nPatrolSec+3)*(1000+nGuanQia)/1000 | Q476: nGuanQia + 1000 | R476: 39240/60*nMin*(1000+nGuanQia)/1000 | S476: 31380/60*nMin*(1000+nGuanQia)/1000 | T476: 19320/60*nMin*(1000+nGuanQia)/1000 | U476: 喽啰 | V476: pet_21;pet_201;pet_93;pet_91; | W476: 4 | X476: 5 | Y476: 1,28000,8,0;1,19016,8,0;1,10007,5,0;1,10108,2,0;1,7,9000,0;1,8,9000,0;1,4,1000,0; | Z476: 0 | AA476: {} | AB476: n/60
A477: 473 | B477: 473 | C477: 473 | D477: 弑神试炼 | E477: 10501 | F477: 5 | G477: 3 | H477: 200473 | I477: 0 | J477: 480 | K477: 5000,0; | L477: 5 | M477: 5000,1; | N477: 39240/3600*(nPatrolSec+3)*(1000+nGuanQia)/1000 | O477: 31380/3600*(nPatrolSec+3)*(1000+nGuanQia)/1000 | P477: 19320/3600*(nPatrolSec+3)*(1000+nGuanQia)/1000 | Q477: nGuanQia + 1000 | R477: 39240/60*nMin*(1000+nGuanQia)/1000 | S477: 31380/60*nMin*(1000+nGuanQia)/1000 | T477: 19320/60*nMin*(1000+nGuanQia)/1000 | U477: 喽啰 | V477: pet_21;pet_201;pet_93;pet_91; | W477: 4 | X477: 5 | Y477: 1,28000,8,0;1,19016,8,0;1,10007,5,0;1,10108,2,0;1,7,9000,0;1,8,9000,0;1,4,1000,0; | Z477: 0 | AA477: {} | AB477: n/60
A478: 474 | B478: 474 | C478: 474 | D478: 弑神试炼 | E478: 10501 | F478: 5 | G478: 3 | H478: 200474 | I478: 0 | J478: 480 | K478: 5000,0; | L478: 5 | M478: 5000,1; | N478: 39240/3600*(nPatrolSec+3)*(1000+nGuanQia)/1000 | O478: 31380/3600*(nPatrolSec+3)*(1000+nGuanQia)/1000 | P478: 19320/3600*(nPatrolSec+3)*(1000+nGuanQia)/1000 | Q478: nGuanQia + 1000 | R478: 39240/60*nMin*(1000+nGuanQia)/1000 | S478: 31380/60*nMin*(1000+nGuanQia)/1000 | T478: 19320/60*nMin*(1000+nGuanQia)/1000 | U478: 喽啰 | V478: pet_21;pet_201;pet_93;pet_91; | W478: 4 | X478: 5 | Y478: 1,28000,8,0;1,19016,8,0;1,10007,5,0;1,10108,2,0;1,7,9000,0;1,8,9000,0;1,4,1000,0; | Z478: 0 | AA478: {} | AB478: n/60
A479: 475 | B479: 475 | C479: 475 | D479: 弑神试炼 | E479: 10501 | F479: 5 | G479: 3 | H479: 200475 | I479: 0 | J479: 480 | K479: 5000,0; | L479: 5 | M479: 5000,1; | N479: 39240/3600*(nPatrolSec+3)*(1000+nGuanQia)/1000 | O479: 31380/3600*(nPatrolSec+3)*(1000+nGuanQia)/1000 | P479: 19320/3600*(nPatrolSec+3)*(1000+nGuanQia)/1000 | Q479: nGuanQia + 1000 | R479: 39240/60*nMin*(1000+nGuanQia)/1000 | S479: 31380/60*nMin*(1000+nGuanQia)/1000 | T479: 19320/60*nMin*(1000+nGuanQia)/1000 | U479: 喽啰 | V479: pet_21;pet_201;pet_93;pet_91; | W479: 4 | X479: 5 | Y479: 1,28000,8,0;1,19016,8,0;1,10007,5,0;1,10108,2,0;1,7,9000,0;1,8,9000,0;1,4,1000,0; | Z479: 0 | AA479: {} | AB479: n/60
A480: 476 | B480: 476 | C480: 476 | D480: 弑神试炼 | E480: 10501 | F480: 5 | G480: 3 | H480: 200476 | I480: 0 | J480: 480 | K480: 5000,0; | L480: 5 | M480: 5000,1; | N480: 39240/3600*(nPatrolSec+3)*(1000+nGuanQia)/1000 | O480: 31380/3600*(nPatrolSec+3)*(1000+nGuanQia)/1000 | P480: 19320/3600*(nPatrolSec+3)*(1000+nGuanQia)/1000 | Q480: nGuanQia + 1000 | R480: 39240/60*nMin*(1000+nGuanQia)/1000 | S480: 31380/60*nMin*(1000+nGuanQia)/1000 | T480: 19320/60*nMin*(1000+nGuanQia)/1000 | U480: 喽啰 | V480: pet_21;pet_201;pet_93;pet_91; | W480: 4 | X480: 5 | Y480: 1,28000,8,0;1,19016,8,0;1,10007,5,0;1,10108,2,0;1,7,9000,0;1,8,9000,0;1,4,1000,0; | Z480: 0 | AA480: {} | AB480: n/60
A481: 477 | B481: 477 | C481: 477 | D481: 弑神试炼 | E481: 10501 | F481: 5 | G481: 3 | H481: 200477 | I481: 0 | J481: 480 | K481: 5000,0; | L481: 5 | M481: 5000,1; | N481: 39240/3600*(nPatrolSec+3)*(1000+nGuanQia)/1000 | O481: 31380/3600*(nPatrolSec+3)*(1000+nGuanQia)/1000 | P481: 19320/3600*(nPatrolSec+3)*(1000+nGuanQia)/1000 | Q481: nGuanQia + 1000 | R481: 39240/60*nMin*(1000+nGuanQia)/1000 | S481: 31380/60*nMin*(1000+nGuanQia)/1000 | T481: 19320/60*nMin*(1000+nGuanQia)/1000 | U481: 喽啰 | V481: pet_21;pet_201;pet_93;pet_91; | W481: 4 | X481: 5 | Y481: 1,28000,8,0;1,19016,8,0;1,10007,5,0;1,10108,2,0;1,7,9000,0;1,8,9000,0;1,4,1000,0; | Z481: 0 | AA481: {} | AB481: n/60
A482: 478 | B482: 478 | C482: 478 | D482: 弑神试炼 | E482: 10501 | F482: 5 | G482: 3 | H482: 200478 | I482: 0 | J482: 480 | K482: 5000,0; | L482: 5 | M482: 5000,1; | N482: 39240/3600*(nPatrolSec+3)*(1000+nGuanQia)/1000 | O482: 31380/3600*(nPatrolSec+3)*(1000+nGuanQia)/1000 | P482: 19320/3600*(nPatrolSec+3)*(1000+nGuanQia)/1000 | Q482: nGuanQia + 1000 | R482: 39240/60*nMin*(1000+nGuanQia)/1000 | S482: 31380/60*nMin*(1000+nGuanQia)/1000 | T482: 19320/60*nMin*(1000+nGuanQia)/1000 | U482: 喽啰 | V482: pet_21;pet_201;pet_93;pet_91; | W482: 4 | X482: 5 | Y482: 1,28000,8,0;1,19016,8,0;1,10007,5,0;1,10108,2,0;1,7,9000,0;1,8,9000,0;1,4,1000,0; | Z482: 0 | AA482: {} | AB482: n/60
A483: 479 | B483: 479 | C483: 479 | D483: 弑神试炼 | E483: 10501 | F483: 5 | G483: 3 | H483: 200479 | I483: 0 | J483: 480 | K483: 5000,0; | L483: 5 | M483: 5000,1; | N483: 39240/3600*(nPatrolSec+3)*(1000+nGuanQia)/1000 | O483: 31380/3600*(nPatrolSec+3)*(1000+nGuanQia)/1000 | P483: 19320/3600*(nPatrolSec+3)*(1000+nGuanQia)/1000 | Q483: nGuanQia + 1000 | R483: 39240/60*nMin*(1000+nGuanQia)/1000 | S483: 31380/60*nMin*(1000+nGuanQia)/1000 | T483: 19320/60*nMin*(1000+nGuanQia)/1000 | U483: 喽啰 | V483: pet_21;pet_201;pet_93;pet_91; | W483: 4 | X483: 5 | Y483: 1,28000,8,0;1,19016,8,0;1,10007,5,0;1,10108,2,0;1,7,9000,0;1,8,9000,0;1,4,1000,0; | Z483: 0 | AA483: {} | AB483: n/60
A484: 480 | B484: 480 | C484: 480 | D484: 弑神试炼 | E484: 10501 | F484: 5 | G484: 3 | H484: 200480 | I484: 0 | J484: 480 | K484: 5000,0; | L484: 5 | M484: 5000,1; | N484: 39240/3600*(nPatrolSec+3)*(1000+nGuanQia)/1000 | O484: 31380/3600*(nPatrolSec+3)*(1000+nGuanQia)/1000 | P484: 19320/3600*(nPatrolSec+3)*(1000+nGuanQia)/1000 | Q484: nGuanQia + 1000 | R484: 39240/60*nMin*(1000+nGuanQia)/1000 | S484: 31380/60*nMin*(1000+nGuanQia)/1000 | T484: 19320/60*nMin*(1000+nGuanQia)/1000 | U484: 喽啰 | V484: pet_21;pet_201;pet_93;pet_91; | W484: 4 | X484: 5 | Y484: 1,28000,8,0;1,19016,8,0;1,10007,5,0;1,10108,2,0;1,7,9000,0;1,8,9000,0;1,4,1000,0; | Z484: 0 | AA484: {} | AB484: n/60
A485: 481 | B485: 481 | C485: 481 | D485: 弑神试炼 | E485: 10501 | F485: 5 | G485: 3 | H485: 200481 | I485: 0 | J485: 480 | K485: 5000,0; | L485: 5 | M485: 5000,1; | N485: 39240/3600*(nPatrolSec+3)*(1000+nGuanQia)/1000 | O485: 31380/3600*(nPatrolSec+3)*(1000+nGuanQia)/1000 | P485: 19320/3600*(nPatrolSec+3)*(1000+nGuanQia)/1000 | Q485: nGuanQia + 1000 | R485: 39240/60*nMin*(1000+nGuanQia)/1000 | S485: 31380/60*nMin*(1000+nGuanQia)/1000 | T485: 19320/60*nMin*(1000+nGuanQia)/1000 | U485: 喽啰 | V485: pet_21;pet_201;pet_93;pet_91; | W485: 4 | X485: 5 | Y485: 1,28000,8,0;1,19016,8,0;1,10007,5,0;1,10108,2,0;1,7,9000,0;1,8,9000,0;1,4,1000,0; | Z485: 0 | AA485: {} | AB485: n/60
A486: 482 | B486: 482 | C486: 482 | D486: 弑神试炼 | E486: 10501 | F486: 5 | G486: 3 | H486: 200482 | I486: 0 | J486: 480 | K486: 5000,0; | L486: 5 | M486: 5000,1; | N486: 39240/3600*(nPatrolSec+3)*(1000+nGuanQia)/1000 | O486: 31380/3600*(nPatrolSec+3)*(1000+nGuanQia)/1000 | P486: 19320/3600*(nPatrolSec+3)*(1000+nGuanQia)/1000 | Q486: nGuanQia + 1000 | R486: 39240/60*nMin*(1000+nGuanQia)/1000 | S486: 31380/60*nMin*(1000+nGuanQia)/1000 | T486: 19320/60*nMin*(1000+nGuanQia)/1000 | U486: 喽啰 | V486: pet_21;pet_201;pet_93;pet_91; | W486: 4 | X486: 5 | Y486: 1,28000,8,0;1,19016,8,0;1,10007,5,0;1,10108,2,0;1,7,9000,0;1,8,9000,0;1,4,1000,0; | Z486: 0 | AA486: {} | AB486: n/60
A487: 483 | B487: 483 | C487: 483 | D487: 弑神试炼 | E487: 10501 | F487: 5 | G487: 3 | H487: 200483 | I487: 0 | J487: 480 | K487: 5000,0; | L487: 5 | M487: 5000,1; | N487: 39240/3600*(nPatrolSec+3)*(1000+nGuanQia)/1000 | O487: 31380/3600*(nPatrolSec+3)*(1000+nGuanQia)/1000 | P487: 19320/3600*(nPatrolSec+3)*(1000+nGuanQia)/1000 | Q487: nGuanQia + 1000 | R487: 39240/60*nMin*(1000+nGuanQia)/1000 | S487: 31380/60*nMin*(1000+nGuanQia)/1000 | T487: 19320/60*nMin*(1000+nGuanQia)/1000 | U487: 喽啰 | V487: pet_21;pet_201;pet_93;pet_91; | W487: 4 | X487: 5 | Y487: 1,28000,8,0;1,19016,8,0;1,10007,5,0;1,10108,2,0;1,7,9000,0;1,8,9000,0;1,4,1000,0; | Z487: 0 | AA487: {} | AB487: n/60
A488: 484 | B488: 484 | C488: 484 | D488: 弑神试炼 | E488: 10501 | F488: 5 | G488: 3 | H488: 200484 | I488: 0 | J488: 480 | K488: 5000,0; | L488: 5 | M488: 5000,1; | N488: 39240/3600*(nPatrolSec+3)*(1000+nGuanQia)/1000 | O488: 31380/3600*(nPatrolSec+3)*(1000+nGuanQia)/1000 | P488: 19320/3600*(nPatrolSec+3)*(1000+nGuanQia)/1000 | Q488: nGuanQia + 1000 | R488: 39240/60*nMin*(1000+nGuanQia)/1000 | S488: 31380/60*nMin*(1000+nGuanQia)/1000 | T488: 19320/60*nMin*(1000+nGuanQia)/1000 | U488: 喽啰 | V488: pet_21;pet_201;pet_93;pet_91; | W488: 4 | X488: 5 | Y488: 1,28000,8,0;1,19016,8,0;1,10007,5,0;1,10108,2,0;1,7,9000,0;1,8,9000,0;1,4,1000,0; | Z488: 0 | AA488: {} | AB488: n/60
A489: 485 | B489: 485 | C489: 485 | D489: 弑神试炼 | E489: 10501 | F489: 5 | G489: 3 | H489: 200485 | I489: 0 | J489: 480 | K489: 5000,0; | L489: 5 | M489: 5000,1; | N489: 39240/3600*(nPatrolSec+3)*(1000+nGuanQia)/1000 | O489: 31380/3600*(nPatrolSec+3)*(1000+nGuanQia)/1000 | P489: 19320/3600*(nPatrolSec+3)*(1000+nGuanQia)/1000 | Q489: nGuanQia + 1000 | R489: 39240/60*nMin*(1000+nGuanQia)/1000 | S489: 31380/60*nMin*(1000+nGuanQia)/1000 | T489: 19320/60*nMin*(1000+nGuanQia)/1000 | U489: 喽啰 | V489: pet_21;pet_201;pet_93;pet_91; | W489: 4 | X489: 5 | Y489: 1,28000,8,0;1,19016,8,0;1,10007,5,0;1,10108,2,0;1,7,9000,0;1,8,9000,0;1,4,1000,0; | Z489: 0 | AA489: {} | AB489: n/60
A490: 486 | B490: 486 | C490: 486 | D490: 弑神试炼 | E490: 10501 | F490: 5 | G490: 3 | H490: 200486 | I490: 0 | J490: 480 | K490: 5000,0; | L490: 5 | M490: 5000,1; | N490: 39240/3600*(nPatrolSec+3)*(1000+nGuanQia)/1000 | O490: 31380/3600*(nPatrolSec+3)*(1000+nGuanQia)/1000 | P490: 19320/3600*(nPatrolSec+3)*(1000+nGuanQia)/1000 | Q490: nGuanQia + 1000 | R490: 39240/60*nMin*(1000+nGuanQia)/1000 | S490: 31380/60*nMin*(1000+nGuanQia)/1000 | T490: 19320/60*nMin*(1000+nGuanQia)/1000 | U490: 喽啰 | V490: pet_21;pet_201;pet_93;pet_91; | W490: 4 | X490: 5 | Y490: 1,28000,8,0;1,19016,8,0;1,10007,5,0;1,10108,2,0;1,7,9000,0;1,8,9000,0;1,4,1000,0; | Z490: 0 | AA490: {} | AB490: n/60
A491: 487 | B491: 487 | C491: 487 | D491: 弑神试炼 | E491: 10501 | F491: 5 | G491: 3 | H491: 200487 | I491: 0 | J491: 480 | K491: 5000,0; | L491: 5 | M491: 5000,1; | N491: 39240/3600*(nPatrolSec+3)*(1000+nGuanQia)/1000 | O491: 31380/3600*(nPatrolSec+3)*(1000+nGuanQia)/1000 | P491: 19320/3600*(nPatrolSec+3)*(1000+nGuanQia)/1000 | Q491: nGuanQia + 1000 | R491: 39240/60*nMin*(1000+nGuanQia)/1000 | S491: 31380/60*nMin*(1000+nGuanQia)/1000 | T491: 19320/60*nMin*(1000+nGuanQia)/1000 | U491: 喽啰 | V491: pet_21;pet_201;pet_93;pet_91; | W491: 4 | X491: 5 | Y491: 1,28000,8,0;1,19016,8,0;1,10007,5,0;1,10108,2,0;1,7,9000,0;1,8,9000,0;1,4,1000,0; | Z491: 0 | AA491: {} | AB491: n/60
A492: 488 | B492: 488 | C492: 488 | D492: 弑神试炼 | E492: 10501 | F492: 5 | G492: 3 | H492: 200488 | I492: 0 | J492: 480 | K492: 5000,0; | L492: 5 | M492: 5000,1; | N492: 39240/3600*(nPatrolSec+3)*(1000+nGuanQia)/1000 | O492: 31380/3600*(nPatrolSec+3)*(1000+nGuanQia)/1000 | P492: 19320/3600*(nPatrolSec+3)*(1000+nGuanQia)/1000 | Q492: nGuanQia + 1000 | R492: 39240/60*nMin*(1000+nGuanQia)/1000 | S492: 31380/60*nMin*(1000+nGuanQia)/1000 | T492: 19320/60*nMin*(1000+nGuanQia)/1000 | U492: 喽啰 | V492: pet_21;pet_201;pet_93;pet_91; | W492: 4 | X492: 5 | Y492: 1,28000,8,0;1,19016,8,0;1,10007,5,0;1,10108,2,0;1,7,9000,0;1,8,9000,0;1,4,1000,0; | Z492: 0 | AA492: {} | AB492: n/60
A493: 489 | B493: 489 | C493: 489 | D493: 弑神试炼 | E493: 10501 | F493: 5 | G493: 3 | H493: 200489 | I493: 0 | J493: 480 | K493: 5000,0; | L493: 5 | M493: 5000,1; | N493: 39240/3600*(nPatrolSec+3)*(1000+nGuanQia)/1000 | O493: 31380/3600*(nPatrolSec+3)*(1000+nGuanQia)/1000 | P493: 19320/3600*(nPatrolSec+3)*(1000+nGuanQia)/1000 | Q493: nGuanQia + 1000 | R493: 39240/60*nMin*(1000+nGuanQia)/1000 | S493: 31380/60*nMin*(1000+nGuanQia)/1000 | T493: 19320/60*nMin*(1000+nGuanQia)/1000 | U493: 喽啰 | V493: pet_21;pet_201;pet_93;pet_91; | W493: 4 | X493: 5 | Y493: 1,28000,8,0;1,19016,8,0;1,10007,5,0;1,10108,2,0;1,7,9000,0;1,8,9000,0;1,4,1000,0; | Z493: 0 | AA493: {} | AB493: n/60
A494: 490 | B494: 490 | C494: 490 | D494: 弑神试炼 | E494: 10501 | F494: 5 | G494: 3 | H494: 200490 | I494: 0 | J494: 480 | K494: 5000,0; | L494: 5 | M494: 5000,1; | N494: 39240/3600*(nPatrolSec+3)*(1000+nGuanQia)/1000 | O494: 31380/3600*(nPatrolSec+3)*(1000+nGuanQia)/1000 | P494: 19320/3600*(nPatrolSec+3)*(1000+nGuanQia)/1000 | Q494: nGuanQia + 1000 | R494: 39240/60*nMin*(1000+nGuanQia)/1000 | S494: 31380/60*nMin*(1000+nGuanQia)/1000 | T494: 19320/60*nMin*(1000+nGuanQia)/1000 | U494: 喽啰 | V494: pet_21;pet_201;pet_93;pet_91; | W494: 4 | X494: 5 | Y494: 1,28000,8,0;1,19016,8,0;1,10007,5,0;1,10108,2,0;1,7,9000,0;1,8,9000,0;1,4,1000,0; | Z494: 0 | AA494: {} | AB494: n/60
A495: 491 | B495: 491 | C495: 491 | D495: 弑神试炼 | E495: 10501 | F495: 5 | G495: 3 | H495: 200491 | I495: 0 | J495: 480 | K495: 5000,0; | L495: 5 | M495: 5000,1; | N495: 39240/3600*(nPatrolSec+3)*(1000+nGuanQia)/1000 | O495: 31380/3600*(nPatrolSec+3)*(1000+nGuanQia)/1000 | P495: 19320/3600*(nPatrolSec+3)*(1000+nGuanQia)/1000 | Q495: nGuanQia + 1000 | R495: 39240/60*nMin*(1000+nGuanQia)/1000 | S495: 31380/60*nMin*(1000+nGuanQia)/1000 | T495: 19320/60*nMin*(1000+nGuanQia)/1000 | U495: 喽啰 | V495: pet_21;pet_201;pet_93;pet_91; | W495: 4 | X495: 5 | Y495: 1,28000,8,0;1,19016,8,0;1,10007,5,0;1,10108,2,0;1,7,9000,0;1,8,9000,0;1,4,1000,0; | Z495: 0 | AA495: {} | AB495: n/60
A496: 492 | B496: 492 | C496: 492 | D496: 弑神试炼 | E496: 10501 | F496: 5 | G496: 3 | H496: 200492 | I496: 0 | J496: 480 | K496: 5000,0; | L496: 5 | M496: 5000,1; | N496: 39240/3600*(nPatrolSec+3)*(1000+nGuanQia)/1000 | O496: 31380/3600*(nPatrolSec+3)*(1000+nGuanQia)/1000 | P496: 19320/3600*(nPatrolSec+3)*(1000+nGuanQia)/1000 | Q496: nGuanQia + 1000 | R496: 39240/60*nMin*(1000+nGuanQia)/1000 | S496: 31380/60*nMin*(1000+nGuanQia)/1000 | T496: 19320/60*nMin*(1000+nGuanQia)/1000 | U496: 喽啰 | V496: pet_21;pet_201;pet_93;pet_91; | W496: 4 | X496: 5 | Y496: 1,28000,8,0;1,19016,8,0;1,10007,5,0;1,10108,2,0;1,7,9000,0;1,8,9000,0;1,4,1000,0; | Z496: 0 | AA496: {} | AB496: n/60
A497: 493 | B497: 493 | C497: 493 | D497: 弑神试炼 | E497: 10501 | F497: 5 | G497: 3 | H497: 200493 | I497: 0 | J497: 480 | K497: 5000,0; | L497: 5 | M497: 5000,1; | N497: 39240/3600*(nPatrolSec+3)*(1000+nGuanQia)/1000 | O497: 31380/3600*(nPatrolSec+3)*(1000+nGuanQia)/1000 | P497: 19320/3600*(nPatrolSec+3)*(1000+nGuanQia)/1000 | Q497: nGuanQia + 1000 | R497: 39240/60*nMin*(1000+nGuanQia)/1000 | S497: 31380/60*nMin*(1000+nGuanQia)/1000 | T497: 19320/60*nMin*(1000+nGuanQia)/1000 | U497: 喽啰 | V497: pet_21;pet_201;pet_93;pet_91; | W497: 4 | X497: 5 | Y497: 1,28000,8,0;1,19016,8,0;1,10007,5,0;1,10108,2,0;1,7,9000,0;1,8,9000,0;1,4,1000,0; | Z497: 0 | AA497: {} | AB497: n/60
A498: 494 | B498: 494 | C498: 494 | D498: 弑神试炼 | E498: 10501 | F498: 5 | G498: 3 | H498: 200494 | I498: 0 | J498: 480 | K498: 5000,0; | L498: 5 | M498: 5000,1; | N498: 39240/3600*(nPatrolSec+3)*(1000+nGuanQia)/1000 | O498: 31380/3600*(nPatrolSec+3)*(1000+nGuanQia)/1000 | P498: 19320/3600*(nPatrolSec+3)*(1000+nGuanQia)/1000 | Q498: nGuanQia + 1000 | R498: 39240/60*nMin*(1000+nGuanQia)/1000 | S498: 31380/60*nMin*(1000+nGuanQia)/1000 | T498: 19320/60*nMin*(1000+nGuanQia)/1000 | U498: 喽啰 | V498: pet_21;pet_201;pet_93;pet_91; | W498: 4 | X498: 5 | Y498: 1,28000,8,0;1,19016,8,0;1,10007,5,0;1,10108,2,0;1,7,9000,0;1,8,9000,0;1,4,1000,0; | Z498: 0 | AA498: {} | AB498: n/60
A499: 495 | B499: 495 | C499: 495 | D499: 弑神试炼 | E499: 10501 | F499: 5 | G499: 3 | H499: 200495 | I499: 0 | J499: 480 | K499: 5000,0; | L499: 5 | M499: 5000,1; | N499: 39240/3600*(nPatrolSec+3)*(1000+nGuanQia)/1000 | O499: 31380/3600*(nPatrolSec+3)*(1000+nGuanQia)/1000 | P499: 19320/3600*(nPatrolSec+3)*(1000+nGuanQia)/1000 | Q499: nGuanQia + 1000 | R499: 39240/60*nMin*(1000+nGuanQia)/1000 | S499: 31380/60*nMin*(1000+nGuanQia)/1000 | T499: 19320/60*nMin*(1000+nGuanQia)/1000 | U499: 喽啰 | V499: pet_21;pet_201;pet_93;pet_91; | W499: 4 | X499: 5 | Y499: 1,28000,8,0;1,19016,8,0;1,10007,5,0;1,10108,2,0;1,7,9000,0;1,8,9000,0;1,4,1000,0; | Z499: 0 | AA499: {} | AB499: n/60
A500: 496 | B500: 496 | C500: 496 | D500: 弑神试炼 | E500: 10501 | F500: 5 | G500: 3 | H500: 200496 | I500: 0 | J500: 480 | K500: 5000,0; | L500: 5 | M500: 5000,1; | N500: 39240/3600*(nPatrolSec+3)*(1000+nGuanQia)/1000 | O500: 31380/3600*(nPatrolSec+3)*(1000+nGuanQia)/1000 | P500: 19320/3600*(nPatrolSec+3)*(1000+nGuanQia)/1000 | Q500: nGuanQia + 1000 | R500: 39240/60*nMin*(1000+nGuanQia)/1000 | S500: 31380/60*nMin*(1000+nGuanQia)/1000 | T500: 19320/60*nMin*(1000+nGuanQia)/1000 | U500: 喽啰 | V500: pet_21;pet_201;pet_93;pet_91; | W500: 4 | X500: 5 | Y500: 1,28000,8,0;1,19016,8,0;1,10007,5,0;1,10108,2,0;1,7,9000,0;1,8,9000,0;1,4,1000,0; | Z500: 0 | AA500: {} | AB500: n/60
A501: 497 | B501: 497 | C501: 497 | D501: 弑神试炼 | E501: 10501 | F501: 5 | G501: 3 | H501: 200497 | I501: 0 | J501: 480 | K501: 5000,0; | L501: 5 | M501: 5000,1; | N501: 39240/3600*(nPatrolSec+3)*(1000+nGuanQia)/1000 | O501: 31380/3600*(nPatrolSec+3)*(1000+nGuanQia)/1000 | P501: 19320/3600*(nPatrolSec+3)*(1000+nGuanQia)/1000 | Q501: nGuanQia + 1000 | R501: 39240/60*nMin*(1000+nGuanQia)/1000 | S501: 31380/60*nMin*(1000+nGuanQia)/1000 | T501: 19320/60*nMin*(1000+nGuanQia)/1000 | U501: 喽啰 | V501: pet_21;pet_201;pet_93;pet_91; | W501: 4 | X501: 5 | Y501: 1,28000,8,0;1,19016,8,0;1,10007,5,0;1,10108,2,0;1,7,9000,0;1,8,9000,0;1,4,1000,0; | Z501: 0 | AA501: {} | AB501: n/60
A502: 498 | B502: 498 | C502: 498 | D502: 弑神试炼 | E502: 10501 | F502: 5 | G502: 3 | H502: 200498 | I502: 0 | J502: 480 | K502: 5000,0; | L502: 5 | M502: 5000,1; | N502: 39240/3600*(nPatrolSec+3)*(1000+nGuanQia)/1000 | O502: 31380/3600*(nPatrolSec+3)*(1000+nGuanQia)/1000 | P502: 19320/3600*(nPatrolSec+3)*(1000+nGuanQia)/1000 | Q502: nGuanQia + 1000 | R502: 39240/60*nMin*(1000+nGuanQia)/1000 | S502: 31380/60*nMin*(1000+nGuanQia)/1000 | T502: 19320/60*nMin*(1000+nGuanQia)/1000 | U502: 喽啰 | V502: pet_21;pet_201;pet_93;pet_91; | W502: 4 | X502: 5 | Y502: 1,28000,8,0;1,19016,8,0;1,10007,5,0;1,10108,2,0;1,7,9000,0;1,8,9000,0;1,4,1000,0; | Z502: 0 | AA502: {} | AB502: n/60
A503: 499 | B503: 499 | C503: 499 | D503: 弑神试炼 | E503: 10501 | F503: 5 | G503: 3 | H503: 200499 | I503: 0 | J503: 480 | K503: 5000,0; | L503: 5 | M503: 5000,1; | N503: 39240/3600*(nPatrolSec+3)*(1000+nGuanQia)/1000 | O503: 31380/3600*(nPatrolSec+3)*(1000+nGuanQia)/1000 | P503: 19320/3600*(nPatrolSec+3)*(1000+nGuanQia)/1000 | Q503: nGuanQia + 1000 | R503: 39240/60*nMin*(1000+nGuanQia)/1000 | S503: 31380/60*nMin*(1000+nGuanQia)/1000 | T503: 19320/60*nMin*(1000+nGuanQia)/1000 | U503: 喽啰 | V503: pet_21;pet_201;pet_93;pet_91; | W503: 4 | X503: 5 | Y503: 1,28000,8,0;1,19016,8,0;1,10007,5,0;1,10108,2,0;1,7,9000,0;1,8,9000,0;1,4,1000,0; | Z503: 0 | AA503: {} | AB503: n/60
A504: 500 | B504: 500 | C504: 500 | D504: 弑神试炼 | E504: 10501 | F504: 5 | G504: 3 | H504: 200500 | I504: 0 | J504: 480 | K504: 5000,0; | L504: 5 | M504: 5000,1; | N504: 39240/3600*(nPatrolSec+3)*(1000+nGuanQia)/1000 | O504: 31380/3600*(nPatrolSec+3)*(1000+nGuanQia)/1000 | P504: 19320/3600*(nPatrolSec+3)*(1000+nGuanQia)/1000 | Q504: nGuanQia + 1000 | R504: 39240/60*nMin*(1000+nGuanQia)/1000 | S504: 31380/60*nMin*(1000+nGuanQia)/1000 | T504: 19320/60*nMin*(1000+nGuanQia)/1000 | U504: 喽啰 | V504: pet_21;pet_201;pet_93;pet_91; | W504: 4 | X504: 5 | Y504: 1,28000,8,0;1,19016,8,0;1,10007,5,0;1,10108,2,0;1,7,9000,0;1,8,9000,0;1,4,1000,0; | Z504: 0 | AA504: {} | AB504: n/60
A505: 501 | B505: 501 | C505: 501 | D505: 弑神试炼 | E505: 10501 | F505: 5 | G505: 3 | H505: 200501 | I505: 0 | J505: 480 | K505: 5000,0; | L505: 5 | M505: 5000,1; | N505: 39240/3600*(nPatrolSec+3)*(1000+nGuanQia)/1000 | O505: 31380/3600*(nPatrolSec+3)*(1000+nGuanQia)/1000 | P505: 19320/3600*(nPatrolSec+3)*(1000+nGuanQia)/1000 | Q505: nGuanQia + 1000 | R505: 39240/60*nMin*(1000+nGuanQia)/1000 | S505: 31380/60*nMin*(1000+nGuanQia)/1000 | T505: 19320/60*nMin*(1000+nGuanQia)/1000 | U505: 喽啰 | V505: pet_21;pet_201;pet_93;pet_91; | W505: 4 | X505: 5 | Y505: 1,28000,8,0;1,19016,8,0;1,10007,5,0;1,10108,2,0;1,7,9000,0;1,8,9000,0;1,4,1000,0; | Z505: 0 | AA505: {} | AB505: n/60
A506: 502 | B506: 502 | C506: 502 | D506: 弑神试炼 | E506: 10501 | F506: 5 | G506: 3 | H506: 200502 | I506: 0 | J506: 480 | K506: 5000,0; | L506: 5 | M506: 5000,1; | N506: 39240/3600*(nPatrolSec+3)*(1000+nGuanQia)/1000 | O506: 31380/3600*(nPatrolSec+3)*(1000+nGuanQia)/1000 | P506: 19320/3600*(nPatrolSec+3)*(1000+nGuanQia)/1000 | Q506: nGuanQia + 1000 | R506: 39240/60*nMin*(1000+nGuanQia)/1000 | S506: 31380/60*nMin*(1000+nGuanQia)/1000 | T506: 19320/60*nMin*(1000+nGuanQia)/1000 | U506: 喽啰 | V506: pet_21;pet_201;pet_93;pet_91; | W506: 4 | X506: 5 | Y506: 1,28000,8,0;1,19016,8,0;1,10007,5,0;1,10108,2,0;1,7,9000,0;1,8,9000,0;1,4,1000,0; | Z506: 0 | AA506: {} | AB506: n/60
A507: 503 | B507: 503 | C507: 503 | D507: 弑神试炼 | E507: 10501 | F507: 5 | G507: 3 | H507: 200503 | I507: 0 | J507: 480 | K507: 5000,0; | L507: 5 | M507: 5000,1; | N507: 39240/3600*(nPatrolSec+3)*(1000+nGuanQia)/1000 | O507: 31380/3600*(nPatrolSec+3)*(1000+nGuanQia)/1000 | P507: 19320/3600*(nPatrolSec+3)*(1000+nGuanQia)/1000 | Q507: nGuanQia + 1000 | R507: 39240/60*nMin*(1000+nGuanQia)/1000 | S507: 31380/60*nMin*(1000+nGuanQia)/1000 | T507: 19320/60*nMin*(1000+nGuanQia)/1000 | U507: 喽啰 | V507: pet_21;pet_201;pet_93;pet_91; | W507: 4 | X507: 5 | Y507: 1,28000,8,0;1,19016,8,0;1,10007,5,0;1,10108,2,0;1,7,9000,0;1,8,9000,0;1,4,1000,0; | Z507: 0 | AA507: {} | AB507: n/60
A508: 504 | B508: 504 | C508: 504 | D508: 弑神试炼 | E508: 10501 | F508: 5 | G508: 3 | H508: 200504 | I508: 0 | J508: 480 | K508: 5000,0; | L508: 5 | M508: 5000,1; | N508: 39240/3600*(nPatrolSec+3)*(1000+nGuanQia)/1000 | O508: 31380/3600*(nPatrolSec+3)*(1000+nGuanQia)/1000 | P508: 19320/3600*(nPatrolSec+3)*(1000+nGuanQia)/1000 | Q508: nGuanQia + 1000 | R508: 39240/60*nMin*(1000+nGuanQia)/1000 | S508: 31380/60*nMin*(1000+nGuanQia)/1000 | T508: 19320/60*nMin*(1000+nGuanQia)/1000 | U508: 喽啰 | V508: pet_21;pet_201;pet_93;pet_91; | W508: 4 | X508: 5 | Y508: 1,28000,8,0;1,19016,8,0;1,10007,5,0;1,10108,2,0;1,7,9000,0;1,8,9000,0;1,4,1000,0; | Z508: 0 | AA508: {} | AB508: n/60
A509: 505 | B509: 505 | C509: 505 | D509: 弑神试炼 | E509: 10501 | F509: 5 | G509: 3 | H509: 200505 | I509: 0 | J509: 480 | K509: 5000,0; | L509: 5 | M509: 5000,1; | N509: 39240/3600*(nPatrolSec+3)*(1000+nGuanQia)/1000 | O509: 31380/3600*(nPatrolSec+3)*(1000+nGuanQia)/1000 | P509: 19320/3600*(nPatrolSec+3)*(1000+nGuanQia)/1000 | Q509: nGuanQia + 1000 | R509: 39240/60*nMin*(1000+nGuanQia)/1000 | S509: 31380/60*nMin*(1000+nGuanQia)/1000 | T509: 19320/60*nMin*(1000+nGuanQia)/1000 | U509: 喽啰 | V509: pet_21;pet_201;pet_93;pet_91; | W509: 4 | X509: 5 | Y509: 1,28000,8,0;1,19016,8,0;1,10007,5,0;1,10108,2,0;1,7,9000,0;1,8,9000,0;1,4,1000,0; | Z509: 0 | AA509: {} | AB509: n/60
A510: 506 | B510: 506 | C510: 506 | D510: 弑神试炼 | E510: 10501 | F510: 5 | G510: 3 | H510: 200506 | I510: 0 | J510: 480 | K510: 5000,0; | L510: 5 | M510: 5000,1; | N510: 39240/3600*(nPatrolSec+3)*(1000+nGuanQia)/1000 | O510: 31380/3600*(nPatrolSec+3)*(1000+nGuanQia)/1000 | P510: 19320/3600*(nPatrolSec+3)*(1000+nGuanQia)/1000 | Q510: nGuanQia + 1000 | R510: 39240/60*nMin*(1000+nGuanQia)/1000 | S510: 31380/60*nMin*(1000+nGuanQia)/1000 | T510: 19320/60*nMin*(1000+nGuanQia)/1000 | U510: 喽啰 | V510: pet_21;pet_201;pet_93;pet_91; | W510: 4 | X510: 5 | Y510: 1,28000,8,0;1,19016,8,0;1,10007,5,0;1,10108,2,0;1,7,9000,0;1,8,9000,0;1,4,1000,0; | Z510: 0 | AA510: {} | AB510: n/60
A511: 507 | B511: 507 | C511: 507 | D511: 弑神试炼 | E511: 10501 | F511: 5 | G511: 3 | H511: 200507 | I511: 0 | J511: 480 | K511: 5000,0; | L511: 5 | M511: 5000,1; | N511: 39240/3600*(nPatrolSec+3)*(1000+nGuanQia)/1000 | O511: 31380/3600*(nPatrolSec+3)*(1000+nGuanQia)/1000 | P511: 19320/3600*(nPatrolSec+3)*(1000+nGuanQia)/1000 | Q511: nGuanQia + 1000 | R511: 39240/60*nMin*(1000+nGuanQia)/1000 | S511: 31380/60*nMin*(1000+nGuanQia)/1000 | T511: 19320/60*nMin*(1000+nGuanQia)/1000 | U511: 喽啰 | V511: pet_21;pet_201;pet_93;pet_91; | W511: 4 | X511: 5 | Y511: 1,28000,8,0;1,19016,8,0;1,10007,5,0;1,10108,2,0;1,7,9000,0;1,8,9000,0;1,4,1000,0; | Z511: 0 | AA511: {} | AB511: n/60
A512: 508 | B512: 508 | C512: 508 | D512: 弑神试炼 | E512: 10501 | F512: 5 | G512: 3 | H512: 200508 | I512: 0 | J512: 480 | K512: 5000,0; | L512: 5 | M512: 5000,1; | N512: 39240/3600*(nPatrolSec+3)*(1000+nGuanQia)/1000 | O512: 31380/3600*(nPatrolSec+3)*(1000+nGuanQia)/1000 | P512: 19320/3600*(nPatrolSec+3)*(1000+nGuanQia)/1000 | Q512: nGuanQia + 1000 | R512: 39240/60*nMin*(1000+nGuanQia)/1000 | S512: 31380/60*nMin*(1000+nGuanQia)/1000 | T512: 19320/60*nMin*(1000+nGuanQia)/1000 | U512: 喽啰 | V512: pet_21;pet_201;pet_93;pet_91; | W512: 4 | X512: 5 | Y512: 1,28000,8,0;1,19016,8,0;1,10007,5,0;1,10108,2,0;1,7,9000,0;1,8,9000,0;1,4,1000,0; | Z512: 0 | AA512: {} | AB512: n/60
A513: 509 | B513: 509 | C513: 509 | D513: 弑神试炼 | E513: 10501 | F513: 5 | G513: 3 | H513: 200509 | I513: 0 | J513: 480 | K513: 5000,0; | L513: 5 | M513: 5000,1; | N513: 39240/3600*(nPatrolSec+3)*(1000+nGuanQia)/1000 | O513: 31380/3600*(nPatrolSec+3)*(1000+nGuanQia)/1000 | P513: 19320/3600*(nPatrolSec+3)*(1000+nGuanQia)/1000 | Q513: nGuanQia + 1000 | R513: 39240/60*nMin*(1000+nGuanQia)/1000 | S513: 31380/60*nMin*(1000+nGuanQia)/1000 | T513: 19320/60*nMin*(1000+nGuanQia)/1000 | U513: 喽啰 | V513: pet_21;pet_201;pet_93;pet_91; | W513: 4 | X513: 5 | Y513: 1,28000,8,0;1,19016,8,0;1,10007,5,0;1,10108,2,0;1,7,9000,0;1,8,9000,0;1,4,1000,0; | Z513: 0 | AA513: {} | AB513: n/60
A514: 510 | B514: 510 | C514: 510 | D514: 弑神试炼 | E514: 10501 | F514: 5 | G514: 3 | H514: 200510 | I514: 0 | J514: 480 | K514: 5000,0; | L514: 5 | M514: 5000,1; | N514: 39240/3600*(nPatrolSec+3)*(1000+nGuanQia)/1000 | O514: 31380/3600*(nPatrolSec+3)*(1000+nGuanQia)/1000 | P514: 19320/3600*(nPatrolSec+3)*(1000+nGuanQia)/1000 | Q514: nGuanQia + 1000 | R514: 39240/60*nMin*(1000+nGuanQia)/1000 | S514: 31380/60*nMin*(1000+nGuanQia)/1000 | T514: 19320/60*nMin*(1000+nGuanQia)/1000 | U514: 喽啰 | V514: pet_21;pet_201;pet_93;pet_91; | W514: 4 | X514: 5 | Y514: 1,28000,8,0;1,19016,8,0;1,10007,5,0;1,10108,2,0;1,7,9000,0;1,8,9000,0;1,4,1000,0; | Z514: 0 | AA514: {} | AB514: n/60
A515: 511 | B515: 511 | C515: 511 | D515: 弑神试炼 | E515: 10501 | F515: 5 | G515: 3 | H515: 200511 | I515: 0 | J515: 480 | K515: 5000,0; | L515: 5 | M515: 5000,1; | N515: 39240/3600*(nPatrolSec+3)*(1000+nGuanQia)/1000 | O515: 31380/3600*(nPatrolSec+3)*(1000+nGuanQia)/1000 | P515: 19320/3600*(nPatrolSec+3)*(1000+nGuanQia)/1000 | Q515: nGuanQia + 1000 | R515: 39240/60*nMin*(1000+nGuanQia)/1000 | S515: 31380/60*nMin*(1000+nGuanQia)/1000 | T515: 19320/60*nMin*(1000+nGuanQia)/1000 | U515: 喽啰 | V515: pet_21;pet_201;pet_93;pet_91; | W515: 4 | X515: 5 | Y515: 1,28000,8,0;1,19016,8,0;1,10007,5,0;1,10108,2,0;1,7,9000,0;1,8,9000,0;1,4,1000,0; | Z515: 0 | AA515: {} | AB515: n/60
A516: 512 | B516: 512 | C516: 512 | D516: 弑神试炼 | E516: 10501 | F516: 5 | G516: 3 | H516: 200512 | I516: 0 | J516: 480 | K516: 5000,0; | L516: 5 | M516: 5000,1; | N516: 39240/3600*(nPatrolSec+3)*(1000+nGuanQia)/1000 | O516: 31380/3600*(nPatrolSec+3)*(1000+nGuanQia)/1000 | P516: 19320/3600*(nPatrolSec+3)*(1000+nGuanQia)/1000 | Q516: nGuanQia + 1000 | R516: 39240/60*nMin*(1000+nGuanQia)/1000 | S516: 31380/60*nMin*(1000+nGuanQia)/1000 | T516: 19320/60*nMin*(1000+nGuanQia)/1000 | U516: 喽啰 | V516: pet_21;pet_201;pet_93;pet_91; | W516: 4 | X516: 5 | Y516: 1,28000,8,0;1,19016,8,0;1,10007,5,0;1,10108,2,0;1,7,9000,0;1,8,9000,0;1,4,1000,0; | Z516: 0 | AA516: {} | AB516: n/60
A517: 513 | B517: 513 | C517: 513 | D517: 弑神试炼 | E517: 10501 | F517: 5 | G517: 3 | H517: 200513 | I517: 0 | J517: 480 | K517: 5000,0; | L517: 5 | M517: 5000,1; | N517: 39240/3600*(nPatrolSec+3)*(1000+nGuanQia)/1000 | O517: 31380/3600*(nPatrolSec+3)*(1000+nGuanQia)/1000 | P517: 19320/3600*(nPatrolSec+3)*(1000+nGuanQia)/1000 | Q517: nGuanQia + 1000 | R517: 39240/60*nMin*(1000+nGuanQia)/1000 | S517: 31380/60*nMin*(1000+nGuanQia)/1000 | T517: 19320/60*nMin*(1000+nGuanQia)/1000 | U517: 喽啰 | V517: pet_21;pet_201;pet_93;pet_91; | W517: 4 | X517: 5 | Y517: 1,28000,8,0;1,19016,8,0;1,10007,5,0;1,10108,2,0;1,7,9000,0;1,8,9000,0;1,4,1000,0; | Z517: 0 | AA517: {} | AB517: n/60
A518: 514 | B518: 514 | C518: 514 | D518: 弑神试炼 | E518: 10501 | F518: 5 | G518: 3 | H518: 200514 | I518: 0 | J518: 480 | K518: 5000,0; | L518: 5 | M518: 5000,1; | N518: 39240/3600*(nPatrolSec+3)*(1000+nGuanQia)/1000 | O518: 31380/3600*(nPatrolSec+3)*(1000+nGuanQia)/1000 | P518: 19320/3600*(nPatrolSec+3)*(1000+nGuanQia)/1000 | Q518: nGuanQia + 1000 | R518: 39240/60*nMin*(1000+nGuanQia)/1000 | S518: 31380/60*nMin*(1000+nGuanQia)/1000 | T518: 19320/60*nMin*(1000+nGuanQia)/1000 | U518: 喽啰 | V518: pet_21;pet_201;pet_93;pet_91; | W518: 4 | X518: 5 | Y518: 1,28000,8,0;1,19016,8,0;1,10007,5,0;1,10108,2,0;1,7,9000,0;1,8,9000,0;1,4,1000,0; | Z518: 0 | AA518: {} | AB518: n/60
A519: 515 | B519: 515 | C519: 515 | D519: 弑神试炼 | E519: 10501 | F519: 5 | G519: 3 | H519: 200515 | I519: 0 | J519: 480 | K519: 5000,0; | L519: 5 | M519: 5000,1; | N519: 39240/3600*(nPatrolSec+3)*(1000+nGuanQia)/1000 | O519: 31380/3600*(nPatrolSec+3)*(1000+nGuanQia)/1000 | P519: 19320/3600*(nPatrolSec+3)*(1000+nGuanQia)/1000 | Q519: nGuanQia + 1000 | R519: 39240/60*nMin*(1000+nGuanQia)/1000 | S519: 31380/60*nMin*(1000+nGuanQia)/1000 | T519: 19320/60*nMin*(1000+nGuanQia)/1000 | U519: 喽啰 | V519: pet_21;pet_201;pet_93;pet_91; | W519: 4 | X519: 5 | Y519: 1,28000,8,0;1,19016,8,0;1,10007,5,0;1,10108,2,0;1,7,9000,0;1,8,9000,0;1,4,1000,0; | Z519: 0 | AA519: {} | AB519: n/60
A520: 516 | B520: 516 | C520: 516 | D520: 弑神试炼 | E520: 10501 | F520: 5 | G520: 3 | H520: 200516 | I520: 0 | J520: 480 | K520: 5000,0; | L520: 5 | M520: 5000,1; | N520: 39240/3600*(nPatrolSec+3)*(1000+nGuanQia)/1000 | O520: 31380/3600*(nPatrolSec+3)*(1000+nGuanQia)/1000 | P520: 19320/3600*(nPatrolSec+3)*(1000+nGuanQia)/1000 | Q520: nGuanQia + 1000 | R520: 39240/60*nMin*(1000+nGuanQia)/1000 | S520: 31380/60*nMin*(1000+nGuanQia)/1000 | T520: 19320/60*nMin*(1000+nGuanQia)/1000 | U520: 喽啰 | V520: pet_21;pet_201;pet_93;pet_91; | W520: 4 | X520: 5 | Y520: 1,28000,8,0;1,19016,8,0;1,10007,5,0;1,10108,2,0;1,7,9000,0;1,8,9000,0;1,4,1000,0; | Z520: 0 | AA520: {} | AB520: n/60
A521: 517 | B521: 517 | C521: 517 | D521: 弑神试炼 | E521: 10501 | F521: 5 | G521: 3 | H521: 200517 | I521: 0 | J521: 480 | K521: 5000,0; | L521: 5 | M521: 5000,1; | N521: 39240/3600*(nPatrolSec+3)*(1000+nGuanQia)/1000 | O521: 31380/3600*(nPatrolSec+3)*(1000+nGuanQia)/1000 | P521: 19320/3600*(nPatrolSec+3)*(1000+nGuanQia)/1000 | Q521: nGuanQia + 1000 | R521: 39240/60*nMin*(1000+nGuanQia)/1000 | S521: 31380/60*nMin*(1000+nGuanQia)/1000 | T521: 19320/60*nMin*(1000+nGuanQia)/1000 | U521: 喽啰 | V521: pet_21;pet_201;pet_93;pet_91; | W521: 4 | X521: 5 | Y521: 1,28000,8,0;1,19016,8,0;1,10007,5,0;1,10108,2,0;1,7,9000,0;1,8,9000,0;1,4,1000,0; | Z521: 0 | AA521: {} | AB521: n/60
A522: 518 | B522: 518 | C522: 518 | D522: 弑神试炼 | E522: 10501 | F522: 5 | G522: 3 | H522: 200518 | I522: 0 | J522: 480 | K522: 5000,0; | L522: 5 | M522: 5000,1; | N522: 39240/3600*(nPatrolSec+3)*(1000+nGuanQia)/1000 | O522: 31380/3600*(nPatrolSec+3)*(1000+nGuanQia)/1000 | P522: 19320/3600*(nPatrolSec+3)*(1000+nGuanQia)/1000 | Q522: nGuanQia + 1000 | R522: 39240/60*nMin*(1000+nGuanQia)/1000 | S522: 31380/60*nMin*(1000+nGuanQia)/1000 | T522: 19320/60*nMin*(1000+nGuanQia)/1000 | U522: 喽啰 | V522: pet_21;pet_201;pet_93;pet_91; | W522: 4 | X522: 5 | Y522: 1,28000,8,0;1,19016,8,0;1,10007,5,0;1,10108,2,0;1,7,9000,0;1,8,9000,0;1,4,1000,0; | Z522: 0 | AA522: {} | AB522: n/60
A523: 519 | B523: 519 | C523: 519 | D523: 弑神试炼 | E523: 10501 | F523: 5 | G523: 3 | H523: 200519 | I523: 0 | J523: 480 | K523: 5000,0; | L523: 5 | M523: 5000,1; | N523: 39240/3600*(nPatrolSec+3)*(1000+nGuanQia)/1000 | O523: 31380/3600*(nPatrolSec+3)*(1000+nGuanQia)/1000 | P523: 19320/3600*(nPatrolSec+3)*(1000+nGuanQia)/1000 | Q523: nGuanQia + 1000 | R523: 39240/60*nMin*(1000+nGuanQia)/1000 | S523: 31380/60*nMin*(1000+nGuanQia)/1000 | T523: 19320/60*nMin*(1000+nGuanQia)/1000 | U523: 喽啰 | V523: pet_21;pet_201;pet_93;pet_91; | W523: 4 | X523: 5 | Y523: 1,28000,8,0;1,19016,8,0;1,10007,5,0;1,10108,2,0;1,7,9000,0;1,8,9000,0;1,4,1000,0; | Z523: 0 | AA523: {} | AB523: n/60
A524: 520 | B524: 520 | C524: 520 | D524: 弑神试炼 | E524: 10501 | F524: 5 | G524: 3 | H524: 200520 | I524: 0 | J524: 480 | K524: 5000,0; | L524: 5 | M524: 5000,1; | N524: 39240/3600*(nPatrolSec+3)*(1000+nGuanQia)/1000 | O524: 31380/3600*(nPatrolSec+3)*(1000+nGuanQia)/1000 | P524: 19320/3600*(nPatrolSec+3)*(1000+nGuanQia)/1000 | Q524: nGuanQia + 1000 | R524: 39240/60*nMin*(1000+nGuanQia)/1000 | S524: 31380/60*nMin*(1000+nGuanQia)/1000 | T524: 19320/60*nMin*(1000+nGuanQia)/1000 | U524: 喽啰 | V524: pet_21;pet_201;pet_93;pet_91; | W524: 4 | X524: 5 | Y524: 1,28000,8,0;1,19016,8,0;1,10007,5,0;1,10108,2,0;1,7,9000,0;1,8,9000,0;1,4,1000,0; | Z524: 0 | AA524: {} | AB524: n/60
A525: 521 | B525: 521 | C525: 521 | D525: 弑神试炼 | E525: 10501 | F525: 5 | G525: 3 | H525: 200521 | I525: 0 | J525: 480 | K525: 5000,0; | L525: 5 | M525: 5000,1; | N525: 39240/3600*(nPatrolSec+3)*(1000+nGuanQia)/1000 | O525: 31380/3600*(nPatrolSec+3)*(1000+nGuanQia)/1000 | P525: 19320/3600*(nPatrolSec+3)*(1000+nGuanQia)/1000 | Q525: nGuanQia + 1000 | R525: 39240/60*nMin*(1000+nGuanQia)/1000 | S525: 31380/60*nMin*(1000+nGuanQia)/1000 | T525: 19320/60*nMin*(1000+nGuanQia)/1000 | U525: 喽啰 | V525: pet_21;pet_201;pet_93;pet_91; | W525: 4 | X525: 5 | Y525: 1,28000,8,0;1,19016,8,0;1,10007,5,0;1,10108,2,0;1,7,9000,0;1,8,9000,0;1,4,1000,0; | Z525: 0 | AA525: {} | AB525: n/60
A526: 522 | B526: 522 | C526: 522 | D526: 弑神试炼 | E526: 10501 | F526: 5 | G526: 3 | H526: 200522 | I526: 0 | J526: 480 | K526: 5000,0; | L526: 5 | M526: 5000,1; | N526: 39240/3600*(nPatrolSec+3)*(1000+nGuanQia)/1000 | O526: 31380/3600*(nPatrolSec+3)*(1000+nGuanQia)/1000 | P526: 19320/3600*(nPatrolSec+3)*(1000+nGuanQia)/1000 | Q526: nGuanQia + 1000 | R526: 39240/60*nMin*(1000+nGuanQia)/1000 | S526: 31380/60*nMin*(1000+nGuanQia)/1000 | T526: 19320/60*nMin*(1000+nGuanQia)/1000 | U526: 喽啰 | V526: pet_21;pet_201;pet_93;pet_91; | W526: 4 | X526: 5 | Y526: 1,28000,8,0;1,19016,8,0;1,10007,5,0;1,10108,2,0;1,7,9000,0;1,8,9000,0;1,4,1000,0; | Z526: 0 | AA526: {} | AB526: n/60
A527: 523 | B527: 523 | C527: 523 | D527: 弑神试炼 | E527: 10501 | F527: 5 | G527: 3 | H527: 200523 | I527: 0 | J527: 480 | K527: 5000,0; | L527: 5 | M527: 5000,1; | N527: 39240/3600*(nPatrolSec+3)*(1000+nGuanQia)/1000 | O527: 31380/3600*(nPatrolSec+3)*(1000+nGuanQia)/1000 | P527: 19320/3600*(nPatrolSec+3)*(1000+nGuanQia)/1000 | Q527: nGuanQia + 1000 | R527: 39240/60*nMin*(1000+nGuanQia)/1000 | S527: 31380/60*nMin*(1000+nGuanQia)/1000 | T527: 19320/60*nMin*(1000+nGuanQia)/1000 | U527: 喽啰 | V527: pet_21;pet_201;pet_93;pet_91; | W527: 4 | X527: 5 | Y527: 1,28000,8,0;1,19016,8,0;1,10007,5,0;1,10108,2,0;1,7,9000,0;1,8,9000,0;1,4,1000,0; | Z527: 0 | AA527: {} | AB527: n/60
A528: 524 | B528: 524 | C528: 524 | D528: 弑神试炼 | E528: 10501 | F528: 5 | G528: 3 | H528: 200524 | I528: 0 | J528: 480 | K528: 5000,0; | L528: 5 | M528: 5000,1; | N528: 39240/3600*(nPatrolSec+3)*(1000+nGuanQia)/1000 | O528: 31380/3600*(nPatrolSec+3)*(1000+nGuanQia)/1000 | P528: 19320/3600*(nPatrolSec+3)*(1000+nGuanQia)/1000 | Q528: nGuanQia + 1000 | R528: 39240/60*nMin*(1000+nGuanQia)/1000 | S528: 31380/60*nMin*(1000+nGuanQia)/1000 | T528: 19320/60*nMin*(1000+nGuanQia)/1000 | U528: 喽啰 | V528: pet_21;pet_201;pet_93;pet_91; | W528: 4 | X528: 5 | Y528: 1,28000,8,0;1,19016,8,0;1,10007,5,0;1,10108,2,0;1,7,9000,0;1,8,9000,0;1,4,1000,0; | Z528: 0 | AA528: {} | AB528: n/60
A529: 525 | B529: 525 | C529: 525 | D529: 弑神试炼 | E529: 10501 | F529: 5 | G529: 3 | H529: 200525 | I529: 0 | J529: 480 | K529: 5000,0; | L529: 5 | M529: 5000,1; | N529: 39240/3600*(nPatrolSec+3)*(1000+nGuanQia)/1000 | O529: 31380/3600*(nPatrolSec+3)*(1000+nGuanQia)/1000 | P529: 19320/3600*(nPatrolSec+3)*(1000+nGuanQia)/1000 | Q529: nGuanQia + 1000 | R529: 39240/60*nMin*(1000+nGuanQia)/1000 | S529: 31380/60*nMin*(1000+nGuanQia)/1000 | T529: 19320/60*nMin*(1000+nGuanQia)/1000 | U529: 喽啰 | V529: pet_21;pet_201;pet_93;pet_91; | W529: 4 | X529: 5 | Y529: 1,28000,8,0;1,19016,8,0;1,10007,5,0;1,10108,2,0;1,7,9000,0;1,8,9000,0;1,4,1000,0; | Z529: 0 | AA529: {} | AB529: n/60
A530: 526 | B530: 526 | C530: 526 | D530: 弑神试炼 | E530: 10501 | F530: 5 | G530: 3 | H530: 200526 | I530: 0 | J530: 480 | K530: 5000,0; | L530: 5 | M530: 5000,1; | N530: 39240/3600*(nPatrolSec+3)*(1000+nGuanQia)/1000 | O530: 31380/3600*(nPatrolSec+3)*(1000+nGuanQia)/1000 | P530: 19320/3600*(nPatrolSec+3)*(1000+nGuanQia)/1000 | Q530: nGuanQia + 1000 | R530: 39240/60*nMin*(1000+nGuanQia)/1000 | S530: 31380/60*nMin*(1000+nGuanQia)/1000 | T530: 19320/60*nMin*(1000+nGuanQia)/1000 | U530: 喽啰 | V530: pet_21;pet_201;pet_93;pet_91; | W530: 4 | X530: 5 | Y530: 1,28000,8,0;1,19016,8,0;1,10007,5,0;1,10108,2,0;1,7,9000,0;1,8,9000,0;1,4,1000,0; | Z530: 0 | AA530: {} | AB530: n/60
A531: 527 | B531: 527 | C531: 527 | D531: 弑神试炼 | E531: 10501 | F531: 5 | G531: 3 | H531: 200527 | I531: 0 | J531: 480 | K531: 5000,0; | L531: 5 | M531: 5000,1; | N531: 39240/3600*(nPatrolSec+3)*(1000+nGuanQia)/1000 | O531: 31380/3600*(nPatrolSec+3)*(1000+nGuanQia)/1000 | P531: 19320/3600*(nPatrolSec+3)*(1000+nGuanQia)/1000 | Q531: nGuanQia + 1000 | R531: 39240/60*nMin*(1000+nGuanQia)/1000 | S531: 31380/60*nMin*(1000+nGuanQia)/1000 | T531: 19320/60*nMin*(1000+nGuanQia)/1000 | U531: 喽啰 | V531: pet_21;pet_201;pet_93;pet_91; | W531: 4 | X531: 5 | Y531: 1,28000,8,0;1,19016,8,0;1,10007,5,0;1,10108,2,0;1,7,9000,0;1,8,9000,0;1,4,1000,0; | Z531: 0 | AA531: {} | AB531: n/60
A532: 528 | B532: 528 | C532: 528 | D532: 弑神试炼 | E532: 10501 | F532: 5 | G532: 3 | H532: 200528 | I532: 0 | J532: 480 | K532: 5000,0; | L532: 5 | M532: 5000,1; | N532: 39240/3600*(nPatrolSec+3)*(1000+nGuanQia)/1000 | O532: 31380/3600*(nPatrolSec+3)*(1000+nGuanQia)/1000 | P532: 19320/3600*(nPatrolSec+3)*(1000+nGuanQia)/1000 | Q532: nGuanQia + 1000 | R532: 39240/60*nMin*(1000+nGuanQia)/1000 | S532: 31380/60*nMin*(1000+nGuanQia)/1000 | T532: 19320/60*nMin*(1000+nGuanQia)/1000 | U532: 喽啰 | V532: pet_21;pet_201;pet_93;pet_91; | W532: 4 | X532: 5 | Y532: 1,28000,8,0;1,19016,8,0;1,10007,5,0;1,10108,2,0;1,7,9000,0;1,8,9000,0;1,4,1000,0; | Z532: 0 | AA532: {} | AB532: n/60
A533: 529 | B533: 529 | C533: 529 | D533: 弑神试炼 | E533: 10501 | F533: 5 | G533: 3 | H533: 200529 | I533: 0 | J533: 480 | K533: 5000,0; | L533: 5 | M533: 5000,1; | N533: 39240/3600*(nPatrolSec+3)*(1000+nGuanQia)/1000 | O533: 31380/3600*(nPatrolSec+3)*(1000+nGuanQia)/1000 | P533: 19320/3600*(nPatrolSec+3)*(1000+nGuanQia)/1000 | Q533: nGuanQia + 1000 | R533: 39240/60*nMin*(1000+nGuanQia)/1000 | S533: 31380/60*nMin*(1000+nGuanQia)/1000 | T533: 19320/60*nMin*(1000+nGuanQia)/1000 | U533: 喽啰 | V533: pet_21;pet_201;pet_93;pet_91; | W533: 4 | X533: 5 | Y533: 1,28000,8,0;1,19016,8,0;1,10007,5,0;1,10108,2,0;1,7,9000,0;1,8,9000,0;1,4,1000,0; | Z533: 0 | AA533: {} | AB533: n/60
A534: 530 | B534: 530 | C534: 530 | D534: 弑神试炼 | E534: 10501 | F534: 5 | G534: 3 | H534: 200530 | I534: 0 | J534: 480 | K534: 5000,0; | L534: 5 | M534: 5000,1; | N534: 39240/3600*(nPatrolSec+3)*(1000+nGuanQia)/1000 | O534: 31380/3600*(nPatrolSec+3)*(1000+nGuanQia)/1000 | P534: 19320/3600*(nPatrolSec+3)*(1000+nGuanQia)/1000 | Q534: nGuanQia + 1000 | R534: 39240/60*nMin*(1000+nGuanQia)/1000 | S534: 31380/60*nMin*(1000+nGuanQia)/1000 | T534: 19320/60*nMin*(1000+nGuanQia)/1000 | U534: 喽啰 | V534: pet_21;pet_201;pet_93;pet_91; | W534: 4 | X534: 5 | Y534: 1,28000,8,0;1,19016,8,0;1,10007,5,0;1,10108,2,0;1,7,9000,0;1,8,9000,0;1,4,1000,0; | Z534: 0 | AA534: {} | AB534: n/60
A535: 531 | B535: 531 | C535: 531 | D535: 弑神试炼 | E535: 10501 | F535: 5 | G535: 3 | H535: 200531 | I535: 0 | J535: 480 | K535: 5000,0; | L535: 5 | M535: 5000,1; | N535: 39240/3600*(nPatrolSec+3)*(1000+nGuanQia)/1000 | O535: 31380/3600*(nPatrolSec+3)*(1000+nGuanQia)/1000 | P535: 19320/3600*(nPatrolSec+3)*(1000+nGuanQia)/1000 | Q535: nGuanQia + 1000 | R535: 39240/60*nMin*(1000+nGuanQia)/1000 | S535: 31380/60*nMin*(1000+nGuanQia)/1000 | T535: 19320/60*nMin*(1000+nGuanQia)/1000 | U535: 喽啰 | V535: pet_21;pet_201;pet_93;pet_91; | W535: 4 | X535: 5 | Y535: 1,28000,8,0;1,19016,8,0;1,10007,5,0;1,10108,2,0;1,7,9000,0;1,8,9000,0;1,4,1000,0; | Z535: 0 | AA535: {} | AB535: n/60
A536: 532 | B536: 532 | C536: 532 | D536: 弑神试炼 | E536: 10501 | F536: 5 | G536: 3 | H536: 200532 | I536: 0 | J536: 480 | K536: 5000,0; | L536: 5 | M536: 5000,1; | N536: 39240/3600*(nPatrolSec+3)*(1000+nGuanQia)/1000 | O536: 31380/3600*(nPatrolSec+3)*(1000+nGuanQia)/1000 | P536: 19320/3600*(nPatrolSec+3)*(1000+nGuanQia)/1000 | Q536: nGuanQia + 1000 | R536: 39240/60*nMin*(1000+nGuanQia)/1000 | S536: 31380/60*nMin*(1000+nGuanQia)/1000 | T536: 19320/60*nMin*(1000+nGuanQia)/1000 | U536: 喽啰 | V536: pet_21;pet_201;pet_93;pet_91; | W536: 4 | X536: 5 | Y536: 1,28000,8,0;1,19016,8,0;1,10007,5,0;1,10108,2,0;1,7,9000,0;1,8,9000,0;1,4,1000,0; | Z536: 0 | AA536: {} | AB536: n/60
A537: 533 | B537: 533 | C537: 533 | D537: 弑神试炼 | E537: 10501 | F537: 5 | G537: 3 | H537: 200533 | I537: 0 | J537: 480 | K537: 5000,0; | L537: 5 | M537: 5000,1; | N537: 39240/3600*(nPatrolSec+3)*(1000+nGuanQia)/1000 | O537: 31380/3600*(nPatrolSec+3)*(1000+nGuanQia)/1000 | P537: 19320/3600*(nPatrolSec+3)*(1000+nGuanQia)/1000 | Q537: nGuanQia + 1000 | R537: 39240/60*nMin*(1000+nGuanQia)/1000 | S537: 31380/60*nMin*(1000+nGuanQia)/1000 | T537: 19320/60*nMin*(1000+nGuanQia)/1000 | U537: 喽啰 | V537: pet_21;pet_201;pet_93;pet_91; | W537: 4 | X537: 5 | Y537: 1,28000,8,0;1,19016,8,0;1,10007,5,0;1,10108,2,0;1,7,9000,0;1,8,9000,0;1,4,1000,0; | Z537: 0 | AA537: {} | AB537: n/60
A538: 534 | B538: 534 | C538: 534 | D538: 弑神试炼 | E538: 10501 | F538: 5 | G538: 3 | H538: 200534 | I538: 0 | J538: 480 | K538: 5000,0; | L538: 5 | M538: 5000,1; | N538: 39240/3600*(nPatrolSec+3)*(1000+nGuanQia)/1000 | O538: 31380/3600*(nPatrolSec+3)*(1000+nGuanQia)/1000 | P538: 19320/3600*(nPatrolSec+3)*(1000+nGuanQia)/1000 | Q538: nGuanQia + 1000 | R538: 39240/60*nMin*(1000+nGuanQia)/1000 | S538: 31380/60*nMin*(1000+nGuanQia)/1000 | T538: 19320/60*nMin*(1000+nGuanQia)/1000 | U538: 喽啰 | V538: pet_21;pet_201;pet_93;pet_91; | W538: 4 | X538: 5 | Y538: 1,28000,8,0;1,19016,8,0;1,10007,5,0;1,10108,2,0;1,7,9000,0;1,8,9000,0;1,4,1000,0; | Z538: 0 | AA538: {} | AB538: n/60
A539: 535 | B539: 535 | C539: 535 | D539: 弑神试炼 | E539: 10501 | F539: 5 | G539: 3 | H539: 200535 | I539: 0 | J539: 480 | K539: 5000,0; | L539: 5 | M539: 5000,1; | N539: 39240/3600*(nPatrolSec+3)*(1000+nGuanQia)/1000 | O539: 31380/3600*(nPatrolSec+3)*(1000+nGuanQia)/1000 | P539: 19320/3600*(nPatrolSec+3)*(1000+nGuanQia)/1000 | Q539: nGuanQia + 1000 | R539: 39240/60*nMin*(1000+nGuanQia)/1000 | S539: 31380/60*nMin*(1000+nGuanQia)/1000 | T539: 19320/60*nMin*(1000+nGuanQia)/1000 | U539: 喽啰 | V539: pet_21;pet_201;pet_93;pet_91; | W539: 4 | X539: 5 | Y539: 1,28000,8,0;1,19016,8,0;1,10007,5,0;1,10108,2,0;1,7,9000,0;1,8,9000,0;1,4,1000,0; | Z539: 0 | AA539: {} | AB539: n/60
A540: 536 | B540: 536 | C540: 536 | D540: 弑神试炼 | E540: 10501 | F540: 5 | G540: 3 | H540: 200536 | I540: 0 | J540: 480 | K540: 5000,0; | L540: 5 | M540: 5000,1; | N540: 39240/3600*(nPatrolSec+3)*(1000+nGuanQia)/1000 | O540: 31380/3600*(nPatrolSec+3)*(1000+nGuanQia)/1000 | P540: 19320/3600*(nPatrolSec+3)*(1000+nGuanQia)/1000 | Q540: nGuanQia + 1000 | R540: 39240/60*nMin*(1000+nGuanQia)/1000 | S540: 31380/60*nMin*(1000+nGuanQia)/1000 | T540: 19320/60*nMin*(1000+nGuanQia)/1000 | U540: 喽啰 | V540: pet_21;pet_201;pet_93;pet_91; | W540: 4 | X540: 5 | Y540: 1,28000,8,0;1,19016,8,0;1,10007,5,0;1,10108,2,0;1,7,9000,0;1,8,9000,0;1,4,1000,0; | Z540: 0 | AA540: {} | AB540: n/60
A541: 537 | B541: 537 | C541: 537 | D541: 弑神试炼 | E541: 10501 | F541: 5 | G541: 3 | H541: 200537 | I541: 0 | J541: 480 | K541: 5000,0; | L541: 5 | M541: 5000,1; | N541: 39240/3600*(nPatrolSec+3)*(1000+nGuanQia)/1000 | O541: 31380/3600*(nPatrolSec+3)*(1000+nGuanQia)/1000 | P541: 19320/3600*(nPatrolSec+3)*(1000+nGuanQia)/1000 | Q541: nGuanQia + 1000 | R541: 39240/60*nMin*(1000+nGuanQia)/1000 | S541: 31380/60*nMin*(1000+nGuanQia)/1000 | T541: 19320/60*nMin*(1000+nGuanQia)/1000 | U541: 喽啰 | V541: pet_21;pet_201;pet_93;pet_91; | W541: 4 | X541: 5 | Y541: 1,28000,8,0;1,19016,8,0;1,10007,5,0;1,10108,2,0;1,7,9000,0;1,8,9000,0;1,4,1000,0; | Z541: 0 | AA541: {} | AB541: n/60
A542: 538 | B542: 538 | C542: 538 | D542: 弑神试炼 | E542: 10501 | F542: 5 | G542: 3 | H542: 200538 | I542: 0 | J542: 480 | K542: 5000,0; | L542: 5 | M542: 5000,1; | N542: 39240/3600*(nPatrolSec+3)*(1000+nGuanQia)/1000 | O542: 31380/3600*(nPatrolSec+3)*(1000+nGuanQia)/1000 | P542: 19320/3600*(nPatrolSec+3)*(1000+nGuanQia)/1000 | Q542: nGuanQia + 1000 | R542: 39240/60*nMin*(1000+nGuanQia)/1000 | S542: 31380/60*nMin*(1000+nGuanQia)/1000 | T542: 19320/60*nMin*(1000+nGuanQia)/1000 | U542: 喽啰 | V542: pet_21;pet_201;pet_93;pet_91; | W542: 4 | X542: 5 | Y542: 1,28000,8,0;1,19016,8,0;1,10007,5,0;1,10108,2,0;1,7,9000,0;1,8,9000,0;1,4,1000,0; | Z542: 0 | AA542: {} | AB542: n/60
A543: 539 | B543: 539 | C543: 539 | D543: 弑神试炼 | E543: 10501 | F543: 5 | G543: 3 | H543: 200539 | I543: 0 | J543: 480 | K543: 5000,0; | L543: 5 | M543: 5000,1; | N543: 39240/3600*(nPatrolSec+3)*(1000+nGuanQia)/1000 | O543: 31380/3600*(nPatrolSec+3)*(1000+nGuanQia)/1000 | P543: 19320/3600*(nPatrolSec+3)*(1000+nGuanQia)/1000 | Q543: nGuanQia + 1000 | R543: 39240/60*nMin*(1000+nGuanQia)/1000 | S543: 31380/60*nMin*(1000+nGuanQia)/1000 | T543: 19320/60*nMin*(1000+nGuanQia)/1000 | U543: 喽啰 | V543: pet_21;pet_201;pet_93;pet_91; | W543: 4 | X543: 5 | Y543: 1,28000,8,0;1,19016,8,0;1,10007,5,0;1,10108,2,0;1,7,9000,0;1,8,9000,0;1,4,1000,0; | Z543: 0 | AA543: {} | AB543: n/60
A544: 540 | B544: 540 | C544: 540 | D544: 弑神试炼 | E544: 10501 | F544: 5 | G544: 3 | H544: 200540 | I544: 0 | J544: 480 | K544: 5000,0; | L544: 5 | M544: 5000,1; | N544: 39240/3600*(nPatrolSec+3)*(1000+nGuanQia)/1000 | O544: 31380/3600*(nPatrolSec+3)*(1000+nGuanQia)/1000 | P544: 19320/3600*(nPatrolSec+3)*(1000+nGuanQia)/1000 | Q544: nGuanQia + 1000 | R544: 39240/60*nMin*(1000+nGuanQia)/1000 | S544: 31380/60*nMin*(1000+nGuanQia)/1000 | T544: 19320/60*nMin*(1000+nGuanQia)/1000 | U544: 喽啰 | V544: pet_21;pet_201;pet_93;pet_91; | W544: 4 | X544: 5 | Y544: 1,28000,8,0;1,19016,8,0;1,10007,5,0;1,10108,2,0;1,7,9000,0;1,8,9000,0;1,4,1000,0; | Z544: 0 | AA544: {} | AB544: n/60
A545: 541 | B545: 541 | C545: 541 | D545: 弑神试炼 | E545: 10501 | F545: 5 | G545: 3 | H545: 200541 | I545: 0 | J545: 480 | K545: 5000,0; | L545: 5 | M545: 5000,1; | N545: 39240/3600*(nPatrolSec+3)*(1000+nGuanQia)/1000 | O545: 31380/3600*(nPatrolSec+3)*(1000+nGuanQia)/1000 | P545: 19320/3600*(nPatrolSec+3)*(1000+nGuanQia)/1000 | Q545: nGuanQia + 1000 | R545: 39240/60*nMin*(1000+nGuanQia)/1000 | S545: 31380/60*nMin*(1000+nGuanQia)/1000 | T545: 19320/60*nMin*(1000+nGuanQia)/1000 | U545: 喽啰 | V545: pet_21;pet_201;pet_93;pet_91; | W545: 4 | X545: 5 | Y545: 1,28000,8,0;1,19016,8,0;1,10007,5,0;1,10108,2,0;1,7,9000,0;1,8,9000,0;1,4,1000,0; | Z545: 0 | AA545: {} | AB545: n/60
A546: 542 | B546: 542 | C546: 542 | D546: 弑神试炼 | E546: 10501 | F546: 5 | G546: 3 | H546: 200542 | I546: 0 | J546: 480 | K546: 5000,0; | L546: 5 | M546: 5000,1; | N546: 39240/3600*(nPatrolSec+3)*(1000+nGuanQia)/1000 | O546: 31380/3600*(nPatrolSec+3)*(1000+nGuanQia)/1000 | P546: 19320/3600*(nPatrolSec+3)*(1000+nGuanQia)/1000 | Q546: nGuanQia + 1000 | R546: 39240/60*nMin*(1000+nGuanQia)/1000 | S546: 31380/60*nMin*(1000+nGuanQia)/1000 | T546: 19320/60*nMin*(1000+nGuanQia)/1000 | U546: 喽啰 | V546: pet_21;pet_201;pet_93;pet_91; | W546: 4 | X546: 5 | Y546: 1,28000,8,0;1,19016,8,0;1,10007,5,0;1,10108,2,0;1,7,9000,0;1,8,9000,0;1,4,1000,0; | Z546: 0 | AA546: {} | AB546: n/60
A547: 543 | B547: 543 | C547: 543 | D547: 弑神试炼 | E547: 10501 | F547: 5 | G547: 3 | H547: 200543 | I547: 0 | J547: 480 | K547: 5000,0; | L547: 5 | M547: 5000,1; | N547: 39240/3600*(nPatrolSec+3)*(1000+nGuanQia)/1000 | O547: 31380/3600*(nPatrolSec+3)*(1000+nGuanQia)/1000 | P547: 19320/3600*(nPatrolSec+3)*(1000+nGuanQia)/1000 | Q547: nGuanQia + 1000 | R547: 39240/60*nMin*(1000+nGuanQia)/1000 | S547: 31380/60*nMin*(1000+nGuanQia)/1000 | T547: 19320/60*nMin*(1000+nGuanQia)/1000 | U547: 喽啰 | V547: pet_21;pet_201;pet_93;pet_91; | W547: 4 | X547: 5 | Y547: 1,28000,8,0;1,19016,8,0;1,10007,5,0;1,10108,2,0;1,7,9000,0;1,8,9000,0;1,4,1000,0; | Z547: 0 | AA547: {} | AB547: n/60
A548: 544 | B548: 544 | C548: 544 | D548: 弑神试炼 | E548: 10501 | F548: 5 | G548: 3 | H548: 200544 | I548: 0 | J548: 480 | K548: 5000,0; | L548: 5 | M548: 5000,1; | N548: 39240/3600*(nPatrolSec+3)*(1000+nGuanQia)/1000 | O548: 31380/3600*(nPatrolSec+3)*(1000+nGuanQia)/1000 | P548: 19320/3600*(nPatrolSec+3)*(1000+nGuanQia)/1000 | Q548: nGuanQia + 1000 | R548: 39240/60*nMin*(1000+nGuanQia)/1000 | S548: 31380/60*nMin*(1000+nGuanQia)/1000 | T548: 19320/60*nMin*(1000+nGuanQia)/1000 | U548: 喽啰 | V548: pet_21;pet_201;pet_93;pet_91; | W548: 4 | X548: 5 | Y548: 1,28000,8,0;1,19016,8,0;1,10007,5,0;1,10108,2,0;1,7,9000,0;1,8,9000,0;1,4,1000,0; | Z548: 0 | AA548: {} | AB548: n/60
A549: 545 | B549: 545 | C549: 545 | D549: 弑神试炼 | E549: 10501 | F549: 5 | G549: 3 | H549: 200545 | I549: 0 | J549: 480 | K549: 5000,0; | L549: 5 | M549: 5000,1; | N549: 39240/3600*(nPatrolSec+3)*(1000+nGuanQia)/1000 | O549: 31380/3600*(nPatrolSec+3)*(1000+nGuanQia)/1000 | P549: 19320/3600*(nPatrolSec+3)*(1000+nGuanQia)/1000 | Q549: nGuanQia + 1000 | R549: 39240/60*nMin*(1000+nGuanQia)/1000 | S549: 31380/60*nMin*(1000+nGuanQia)/1000 | T549: 19320/60*nMin*(1000+nGuanQia)/1000 | U549: 喽啰 | V549: pet_21;pet_201;pet_93;pet_91; | W549: 4 | X549: 5 | Y549: 1,28000,8,0;1,19016,8,0;1,10007,5,0;1,10108,2,0;1,7,9000,0;1,8,9000,0;1,4,1000,0; | Z549: 0 | AA549: {} | AB549: n/60
A550: 546 | B550: 546 | C550: 546 | D550: 弑神试炼 | E550: 10501 | F550: 5 | G550: 3 | H550: 200546 | I550: 0 | J550: 480 | K550: 5000,0; | L550: 5 | M550: 5000,1; | N550: 39240/3600*(nPatrolSec+3)*(1000+nGuanQia)/1000 | O550: 31380/3600*(nPatrolSec+3)*(1000+nGuanQia)/1000 | P550: 19320/3600*(nPatrolSec+3)*(1000+nGuanQia)/1000 | Q550: nGuanQia + 1000 | R550: 39240/60*nMin*(1000+nGuanQia)/1000 | S550: 31380/60*nMin*(1000+nGuanQia)/1000 | T550: 19320/60*nMin*(1000+nGuanQia)/1000 | U550: 喽啰 | V550: pet_21;pet_201;pet_93;pet_91; | W550: 4 | X550: 5 | Y550: 1,28000,8,0;1,19016,8,0;1,10007,5,0;1,10108,2,0;1,7,9000,0;1,8,9000,0;1,4,1000,0; | Z550: 0 | AA550: {} | AB550: n/60
A551: 547 | B551: 547 | C551: 547 | D551: 弑神试炼 | E551: 10501 | F551: 5 | G551: 3 | H551: 200547 | I551: 0 | J551: 480 | K551: 5000,0; | L551: 5 | M551: 5000,1; | N551: 39240/3600*(nPatrolSec+3)*(1000+nGuanQia)/1000 | O551: 31380/3600*(nPatrolSec+3)*(1000+nGuanQia)/1000 | P551: 19320/3600*(nPatrolSec+3)*(1000+nGuanQia)/1000 | Q551: nGuanQia + 1000 | R551: 39240/60*nMin*(1000+nGuanQia)/1000 | S551: 31380/60*nMin*(1000+nGuanQia)/1000 | T551: 19320/60*nMin*(1000+nGuanQia)/1000 | U551: 喽啰 | V551: pet_21;pet_201;pet_93;pet_91; | W551: 4 | X551: 5 | Y551: 1,28000,8,0;1,19016,8,0;1,10007,5,0;1,10108,2,0;1,7,9000,0;1,8,9000,0;1,4,1000,0; | Z551: 0 | AA551: {} | AB551: n/60
A552: 548 | B552: 548 | C552: 548 | D552: 弑神试炼 | E552: 10501 | F552: 5 | G552: 3 | H552: 200548 | I552: 0 | J552: 480 | K552: 5000,0; | L552: 5 | M552: 5000,1; | N552: 39240/3600*(nPatrolSec+3)*(1000+nGuanQia)/1000 | O552: 31380/3600*(nPatrolSec+3)*(1000+nGuanQia)/1000 | P552: 19320/3600*(nPatrolSec+3)*(1000+nGuanQia)/1000 | Q552: nGuanQia + 1000 | R552: 39240/60*nMin*(1000+nGuanQia)/1000 | S552: 31380/60*nMin*(1000+nGuanQia)/1000 | T552: 19320/60*nMin*(1000+nGuanQia)/1000 | U552: 喽啰 | V552: pet_21;pet_201;pet_93;pet_91; | W552: 4 | X552: 5 | Y552: 1,28000,8,0;1,19016,8,0;1,10007,5,0;1,10108,2,0;1,7,9000,0;1,8,9000,0;1,4,1000,0; | Z552: 0 | AA552: {} | AB552: n/60
A553: 549 | B553: 549 | C553: 549 | D553: 弑神试炼 | E553: 10501 | F553: 5 | G553: 3 | H553: 200549 | I553: 0 | J553: 480 | K553: 5000,0; | L553: 5 | M553: 5000,1; | N553: 39240/3600*(nPatrolSec+3)*(1000+nGuanQia)/1000 | O553: 31380/3600*(nPatrolSec+3)*(1000+nGuanQia)/1000 | P553: 19320/3600*(nPatrolSec+3)*(1000+nGuanQia)/1000 | Q553: nGuanQia + 1000 | R553: 39240/60*nMin*(1000+nGuanQia)/1000 | S553: 31380/60*nMin*(1000+nGuanQia)/1000 | T553: 19320/60*nMin*(1000+nGuanQia)/1000 | U553: 喽啰 | V553: pet_21;pet_201;pet_93;pet_91; | W553: 4 | X553: 5 | Y553: 1,28000,8,0;1,19016,8,0;1,10007,5,0;1,10108,2,0;1,7,9000,0;1,8,9000,0;1,4,1000,0; | Z553: 0 | AA553: {} | AB553: n/60
A554: 550 | B554: 550 | C554: 550 | D554: 弑神试炼 | E554: 10501 | F554: 5 | G554: 3 | H554: 200550 | I554: 0 | J554: 480 | K554: 5000,0; | L554: 5 | M554: 5000,1; | N554: 39240/3600*(nPatrolSec+3)*(1000+nGuanQia)/1000 | O554: 31380/3600*(nPatrolSec+3)*(1000+nGuanQia)/1000 | P554: 19320/3600*(nPatrolSec+3)*(1000+nGuanQia)/1000 | Q554: nGuanQia + 1000 | R554: 39240/60*nMin*(1000+nGuanQia)/1000 | S554: 31380/60*nMin*(1000+nGuanQia)/1000 | T554: 19320/60*nMin*(1000+nGuanQia)/1000 | U554: 喽啰 | V554: pet_21;pet_201;pet_93;pet_91; | W554: 4 | X554: 5 | Y554: 1,28000,8,0;1,19016,8,0;1,10007,5,0;1,10108,2,0;1,7,9000,0;1,8,9000,0;1,4,1000,0; | Z554: 0 | AA554: {} | AB554: n/60
A555: 551 | B555: 551 | C555: 551 | D555: 弑神试炼 | E555: 10501 | F555: 5 | G555: 3 | H555: 200551 | I555: 0 | J555: 480 | K555: 5000,0; | L555: 5 | M555: 5000,1; | N555: 39240/3600*(nPatrolSec+3)*(1000+nGuanQia)/1000 | O555: 31380/3600*(nPatrolSec+3)*(1000+nGuanQia)/1000 | P555: 19320/3600*(nPatrolSec+3)*(1000+nGuanQia)/1000 | Q555: nGuanQia + 1000 | R555: 39240/60*nMin*(1000+nGuanQia)/1000 | S555: 31380/60*nMin*(1000+nGuanQia)/1000 | T555: 19320/60*nMin*(1000+nGuanQia)/1000 | U555: 喽啰 | V555: pet_21;pet_201;pet_93;pet_91; | W555: 4 | X555: 5 | Y555: 1,28000,8,0;1,19016,8,0;1,10007,5,0;1,10108,2,0;1,7,9000,0;1,8,9000,0;1,4,1000,0; | Z555: 0 | AA555: {} | AB555: n/60
A556: 552 | B556: 552 | C556: 552 | D556: 弑神试炼 | E556: 10501 | F556: 5 | G556: 3 | H556: 200552 | I556: 0 | J556: 480 | K556: 5000,0; | L556: 5 | M556: 5000,1; | N556: 39240/3600*(nPatrolSec+3)*(1000+nGuanQia)/1000 | O556: 31380/3600*(nPatrolSec+3)*(1000+nGuanQia)/1000 | P556: 19320/3600*(nPatrolSec+3)*(1000+nGuanQia)/1000 | Q556: nGuanQia + 1000 | R556: 39240/60*nMin*(1000+nGuanQia)/1000 | S556: 31380/60*nMin*(1000+nGuanQia)/1000 | T556: 19320/60*nMin*(1000+nGuanQia)/1000 | U556: 喽啰 | V556: pet_21;pet_201;pet_93;pet_91; | W556: 4 | X556: 5 | Y556: 1,28000,8,0;1,19016,8,0;1,10007,5,0;1,10108,2,0;1,7,9000,0;1,8,9000,0;1,4,1000,0; | Z556: 0 | AA556: {} | AB556: n/60
A557: 553 | B557: 553 | C557: 553 | D557: 弑神试炼 | E557: 10501 | F557: 5 | G557: 3 | H557: 200553 | I557: 0 | J557: 480 | K557: 5000,0; | L557: 5 | M557: 5000,1; | N557: 39240/3600*(nPatrolSec+3)*(1000+nGuanQia)/1000 | O557: 31380/3600*(nPatrolSec+3)*(1000+nGuanQia)/1000 | P557: 19320/3600*(nPatrolSec+3)*(1000+nGuanQia)/1000 | Q557: nGuanQia + 1000 | R557: 39240/60*nMin*(1000+nGuanQia)/1000 | S557: 31380/60*nMin*(1000+nGuanQia)/1000 | T557: 19320/60*nMin*(1000+nGuanQia)/1000 | U557: 喽啰 | V557: pet_21;pet_201;pet_93;pet_91; | W557: 4 | X557: 5 | Y557: 1,28000,8,0;1,19016,8,0;1,10007,5,0;1,10108,2,0;1,7,9000,0;1,8,9000,0;1,4,1000,0; | Z557: 0 | AA557: {} | AB557: n/60
A558: 554 | B558: 554 | C558: 554 | D558: 弑神试炼 | E558: 10501 | F558: 5 | G558: 3 | H558: 200554 | I558: 0 | J558: 480 | K558: 5000,0; | L558: 5 | M558: 5000,1; | N558: 39240/3600*(nPatrolSec+3)*(1000+nGuanQia)/1000 | O558: 31380/3600*(nPatrolSec+3)*(1000+nGuanQia)/1000 | P558: 19320/3600*(nPatrolSec+3)*(1000+nGuanQia)/1000 | Q558: nGuanQia + 1000 | R558: 39240/60*nMin*(1000+nGuanQia)/1000 | S558: 31380/60*nMin*(1000+nGuanQia)/1000 | T558: 19320/60*nMin*(1000+nGuanQia)/1000 | U558: 喽啰 | V558: pet_21;pet_201;pet_93;pet_91; | W558: 4 | X558: 5 | Y558: 1,28000,8,0;1,19016,8,0;1,10007,5,0;1,10108,2,0;1,7,9000,0;1,8,9000,0;1,4,1000,0; | Z558: 0 | AA558: {} | AB558: n/60
A559: 555 | B559: 555 | C559: 555 | D559: 弑神试炼 | E559: 10501 | F559: 5 | G559: 3 | H559: 200555 | I559: 0 | J559: 480 | K559: 5000,0; | L559: 5 | M559: 5000,1; | N559: 39240/3600*(nPatrolSec+3)*(1000+nGuanQia)/1000 | O559: 31380/3600*(nPatrolSec+3)*(1000+nGuanQia)/1000 | P559: 19320/3600*(nPatrolSec+3)*(1000+nGuanQia)/1000 | Q559: nGuanQia + 1000 | R559: 39240/60*nMin*(1000+nGuanQia)/1000 | S559: 31380/60*nMin*(1000+nGuanQia)/1000 | T559: 19320/60*nMin*(1000+nGuanQia)/1000 | U559: 喽啰 | V559: pet_21;pet_201;pet_93;pet_91; | W559: 4 | X559: 5 | Y559: 1,28000,8,0;1,19016,8,0;1,10007,5,0;1,10108,2,0;1,7,9000,0;1,8,9000,0;1,4,1000,0; | Z559: 0 | AA559: {} | AB559: n/60
A560: 556 | B560: 556 | C560: 556 | D560: 弑神试炼 | E560: 10501 | F560: 5 | G560: 3 | H560: 200556 | I560: 0 | J560: 480 | K560: 5000,0; | L560: 5 | M560: 5000,1; | N560: 39240/3600*(nPatrolSec+3)*(1000+nGuanQia)/1000 | O560: 31380/3600*(nPatrolSec+3)*(1000+nGuanQia)/1000 | P560: 19320/3600*(nPatrolSec+3)*(1000+nGuanQia)/1000 | Q560: nGuanQia + 1000 | R560: 39240/60*nMin*(1000+nGuanQia)/1000 | S560: 31380/60*nMin*(1000+nGuanQia)/1000 | T560: 19320/60*nMin*(1000+nGuanQia)/1000 | U560: 喽啰 | V560: pet_21;pet_201;pet_93;pet_91; | W560: 4 | X560: 5 | Y560: 1,28000,8,0;1,19016,8,0;1,10007,5,0;1,10108,2,0;1,7,9000,0;1,8,9000,0;1,4,1000,0; | Z560: 0 | AA560: {} | AB560: n/60
A561: 557 | B561: 557 | C561: 557 | D561: 弑神试炼 | E561: 10501 | F561: 5 | G561: 3 | H561: 200557 | I561: 0 | J561: 480 | K561: 5000,0; | L561: 5 | M561: 5000,1; | N561: 39240/3600*(nPatrolSec+3)*(1000+nGuanQia)/1000 | O561: 31380/3600*(nPatrolSec+3)*(1000+nGuanQia)/1000 | P561: 19320/3600*(nPatrolSec+3)*(1000+nGuanQia)/1000 | Q561: nGuanQia + 1000 | R561: 39240/60*nMin*(1000+nGuanQia)/1000 | S561: 31380/60*nMin*(1000+nGuanQia)/1000 | T561: 19320/60*nMin*(1000+nGuanQia)/1000 | U561: 喽啰 | V561: pet_21;pet_201;pet_93;pet_91; | W561: 4 | X561: 5 | Y561: 1,28000,8,0;1,19016,8,0;1,10007,5,0;1,10108,2,0;1,7,9000,0;1,8,9000,0;1,4,1000,0; | Z561: 0 | AA561: {} | AB561: n/60
A562: 558 | B562: 558 | C562: 558 | D562: 弑神试炼 | E562: 10501 | F562: 5 | G562: 3 | H562: 200558 | I562: 0 | J562: 480 | K562: 5000,0; | L562: 5 | M562: 5000,1; | N562: 39240/3600*(nPatrolSec+3)*(1000+nGuanQia)/1000 | O562: 31380/3600*(nPatrolSec+3)*(1000+nGuanQia)/1000 | P562: 19320/3600*(nPatrolSec+3)*(1000+nGuanQia)/1000 | Q562: nGuanQia + 1000 | R562: 39240/60*nMin*(1000+nGuanQia)/1000 | S562: 31380/60*nMin*(1000+nGuanQia)/1000 | T562: 19320/60*nMin*(1000+nGuanQia)/1000 | U562: 喽啰 | V562: pet_21;pet_201;pet_93;pet_91; | W562: 4 | X562: 5 | Y562: 1,28000,8,0;1,19016,8,0;1,10007,5,0;1,10108,2,0;1,7,9000,0;1,8,9000,0;1,4,1000,0; | Z562: 0 | AA562: {} | AB562: n/60
A563: 559 | B563: 559 | C563: 559 | D563: 弑神试炼 | E563: 10501 | F563: 5 | G563: 3 | H563: 200559 | I563: 0 | J563: 480 | K563: 5000,0; | L563: 5 | M563: 5000,1; | N563: 39240/3600*(nPatrolSec+3)*(1000+nGuanQia)/1000 | O563: 31380/3600*(nPatrolSec+3)*(1000+nGuanQia)/1000 | P563: 19320/3600*(nPatrolSec+3)*(1000+nGuanQia)/1000 | Q563: nGuanQia + 1000 | R563: 39240/60*nMin*(1000+nGuanQia)/1000 | S563: 31380/60*nMin*(1000+nGuanQia)/1000 | T563: 19320/60*nMin*(1000+nGuanQia)/1000 | U563: 喽啰 | V563: pet_21;pet_201;pet_93;pet_91; | W563: 4 | X563: 5 | Y563: 1,28000,8,0;1,19016,8,0;1,10007,5,0;1,10108,2,0;1,7,9000,0;1,8,9000,0;1,4,1000,0; | Z563: 0 | AA563: {} | AB563: n/60
A564: 560 | B564: 560 | C564: 560 | D564: 弑神试炼 | E564: 10501 | F564: 5 | G564: 3 | H564: 200560 | I564: 0 | J564: 480 | K564: 5000,0; | L564: 5 | M564: 5000,1; | N564: 39240/3600*(nPatrolSec+3)*(1000+nGuanQia)/1000 | O564: 31380/3600*(nPatrolSec+3)*(1000+nGuanQia)/1000 | P564: 19320/3600*(nPatrolSec+3)*(1000+nGuanQia)/1000 | Q564: nGuanQia + 1000 | R564: 39240/60*nMin*(1000+nGuanQia)/1000 | S564: 31380/60*nMin*(1000+nGuanQia)/1000 | T564: 19320/60*nMin*(1000+nGuanQia)/1000 | U564: 喽啰 | V564: pet_21;pet_201;pet_93;pet_91; | W564: 4 | X564: 5 | Y564: 1,28000,8,0;1,19016,8,0;1,10007,5,0;1,10108,2,0;1,7,9000,0;1,8,9000,0;1,4,1000,0; | Z564: 0 | AA564: {} | AB564: n/60
A565: 561 | B565: 561 | C565: 561 | D565: 弑神试炼 | E565: 10501 | F565: 5 | G565: 3 | H565: 200561 | I565: 0 | J565: 480 | K565: 5000,0; | L565: 5 | M565: 5000,1; | N565: 39240/3600*(nPatrolSec+3)*(1000+nGuanQia)/1000 | O565: 31380/3600*(nPatrolSec+3)*(1000+nGuanQia)/1000 | P565: 19320/3600*(nPatrolSec+3)*(1000+nGuanQia)/1000 | Q565: nGuanQia + 1000 | R565: 39240/60*nMin*(1000+nGuanQia)/1000 | S565: 31380/60*nMin*(1000+nGuanQia)/1000 | T565: 19320/60*nMin*(1000+nGuanQia)/1000 | U565: 喽啰 | V565: pet_21;pet_201;pet_93;pet_91; | W565: 4 | X565: 5 | Y565: 1,28000,8,0;1,19016,8,0;1,10007,5,0;1,10108,2,0;1,7,9000,0;1,8,9000,0;1,4,1000,0; | Z565: 0 | AA565: {} | AB565: n/60
A566: 562 | B566: 562 | C566: 562 | D566: 弑神试炼 | E566: 10501 | F566: 5 | G566: 3 | H566: 200562 | I566: 0 | J566: 480 | K566: 5000,0; | L566: 5 | M566: 5000,1; | N566: 39240/3600*(nPatrolSec+3)*(1000+nGuanQia)/1000 | O566: 31380/3600*(nPatrolSec+3)*(1000+nGuanQia)/1000 | P566: 19320/3600*(nPatrolSec+3)*(1000+nGuanQia)/1000 | Q566: nGuanQia + 1000 | R566: 39240/60*nMin*(1000+nGuanQia)/1000 | S566: 31380/60*nMin*(1000+nGuanQia)/1000 | T566: 19320/60*nMin*(1000+nGuanQia)/1000 | U566: 喽啰 | V566: pet_21;pet_201;pet_93;pet_91; | W566: 4 | X566: 5 | Y566: 1,28000,8,0;1,19016,8,0;1,10007,5,0;1,10108,2,0;1,7,9000,0;1,8,9000,0;1,4,1000,0; | Z566: 0 | AA566: {} | AB566: n/60
A567: 563 | B567: 563 | C567: 563 | D567: 弑神试炼 | E567: 10501 | F567: 5 | G567: 3 | H567: 200563 | I567: 0 | J567: 480 | K567: 5000,0; | L567: 5 | M567: 5000,1; | N567: 39240/3600*(nPatrolSec+3)*(1000+nGuanQia)/1000 | O567: 31380/3600*(nPatrolSec+3)*(1000+nGuanQia)/1000 | P567: 19320/3600*(nPatrolSec+3)*(1000+nGuanQia)/1000 | Q567: nGuanQia + 1000 | R567: 39240/60*nMin*(1000+nGuanQia)/1000 | S567: 31380/60*nMin*(1000+nGuanQia)/1000 | T567: 19320/60*nMin*(1000+nGuanQia)/1000 | U567: 喽啰 | V567: pet_21;pet_201;pet_93;pet_91; | W567: 4 | X567: 5 | Y567: 1,28000,8,0;1,19016,8,0;1,10007,5,0;1,10108,2,0;1,7,9000,0;1,8,9000,0;1,4,1000,0; | Z567: 0 | AA567: {} | AB567: n/60
A568: 564 | B568: 564 | C568: 564 | D568: 弑神试炼 | E568: 10501 | F568: 5 | G568: 3 | H568: 200564 | I568: 0 | J568: 480 | K568: 5000,0; | L568: 5 | M568: 5000,1; | N568: 39240/3600*(nPatrolSec+3)*(1000+nGuanQia)/1000 | O568: 31380/3600*(nPatrolSec+3)*(1000+nGuanQia)/1000 | P568: 19320/3600*(nPatrolSec+3)*(1000+nGuanQia)/1000 | Q568: nGuanQia + 1000 | R568: 39240/60*nMin*(1000+nGuanQia)/1000 | S568: 31380/60*nMin*(1000+nGuanQia)/1000 | T568: 19320/60*nMin*(1000+nGuanQia)/1000 | U568: 喽啰 | V568: pet_21;pet_201;pet_93;pet_91; | W568: 4 | X568: 5 | Y568: 1,28000,8,0;1,19016,8,0;1,10007,5,0;1,10108,2,0;1,7,9000,0;1,8,9000,0;1,4,1000,0; | Z568: 0 | AA568: {} | AB568: n/60
A569: 565 | B569: 565 | C569: 565 | D569: 弑神试炼 | E569: 10501 | F569: 5 | G569: 3 | H569: 200565 | I569: 0 | J569: 480 | K569: 5000,0; | L569: 5 | M569: 5000,1; | N569: 39240/3600*(nPatrolSec+3)*(1000+nGuanQia)/1000 | O569: 31380/3600*(nPatrolSec+3)*(1000+nGuanQia)/1000 | P569: 19320/3600*(nPatrolSec+3)*(1000+nGuanQia)/1000 | Q569: nGuanQia + 1000 | R569: 39240/60*nMin*(1000+nGuanQia)/1000 | S569: 31380/60*nMin*(1000+nGuanQia)/1000 | T569: 19320/60*nMin*(1000+nGuanQia)/1000 | U569: 喽啰 | V569: pet_21;pet_201;pet_93;pet_91; | W569: 4 | X569: 5 | Y569: 1,28000,8,0;1,19016,8,0;1,10007,5,0;1,10108,2,0;1,7,9000,0;1,8,9000,0;1,4,1000,0; | Z569: 0 | AA569: {} | AB569: n/60
A570: 566 | B570: 566 | C570: 566 | D570: 弑神试炼 | E570: 10501 | F570: 5 | G570: 3 | H570: 200566 | I570: 0 | J570: 480 | K570: 5000,0; | L570: 5 | M570: 5000,1; | N570: 39240/3600*(nPatrolSec+3)*(1000+nGuanQia)/1000 | O570: 31380/3600*(nPatrolSec+3)*(1000+nGuanQia)/1000 | P570: 19320/3600*(nPatrolSec+3)*(1000+nGuanQia)/1000 | Q570: nGuanQia + 1000 | R570: 39240/60*nMin*(1000+nGuanQia)/1000 | S570: 31380/60*nMin*(1000+nGuanQia)/1000 | T570: 19320/60*nMin*(1000+nGuanQia)/1000 | U570: 喽啰 | V570: pet_21;pet_201;pet_93;pet_91; | W570: 4 | X570: 5 | Y570: 1,28000,8,0;1,19016,8,0;1,10007,5,0;1,10108,2,0;1,7,9000,0;1,8,9000,0;1,4,1000,0; | Z570: 0 | AA570: {} | AB570: n/60
A571: 567 | B571: 567 | C571: 567 | D571: 弑神试炼 | E571: 10501 | F571: 5 | G571: 3 | H571: 200567 | I571: 0 | J571: 480 | K571: 5000,0; | L571: 5 | M571: 5000,1; | N571: 39240/3600*(nPatrolSec+3)*(1000+nGuanQia)/1000 | O571: 31380/3600*(nPatrolSec+3)*(1000+nGuanQia)/1000 | P571: 19320/3600*(nPatrolSec+3)*(1000+nGuanQia)/1000 | Q571: nGuanQia + 1000 | R571: 39240/60*nMin*(1000+nGuanQia)/1000 | S571: 31380/60*nMin*(1000+nGuanQia)/1000 | T571: 19320/60*nMin*(1000+nGuanQia)/1000 | U571: 喽啰 | V571: pet_21;pet_201;pet_93;pet_91; | W571: 4 | X571: 5 | Y571: 1,28000,8,0;1,19016,8,0;1,10007,5,0;1,10108,2,0;1,7,9000,0;1,8,9000,0;1,4,1000,0; | Z571: 0 | AA571: {} | AB571: n/60
A572: 568 | B572: 568 | C572: 568 | D572: 弑神试炼 | E572: 10501 | F572: 5 | G572: 3 | H572: 200568 | I572: 0 | J572: 480 | K572: 5000,0; | L572: 5 | M572: 5000,1; | N572: 39240/3600*(nPatrolSec+3)*(1000+nGuanQia)/1000 | O572: 31380/3600*(nPatrolSec+3)*(1000+nGuanQia)/1000 | P572: 19320/3600*(nPatrolSec+3)*(1000+nGuanQia)/1000 | Q572: nGuanQia + 1000 | R572: 39240/60*nMin*(1000+nGuanQia)/1000 | S572: 31380/60*nMin*(1000+nGuanQia)/1000 | T572: 19320/60*nMin*(1000+nGuanQia)/1000 | U572: 喽啰 | V572: pet_21;pet_201;pet_93;pet_91; | W572: 4 | X572: 5 | Y572: 1,28000,8,0;1,19016,8,0;1,10007,5,0;1,10108,2,0;1,7,9000,0;1,8,9000,0;1,4,1000,0; | Z572: 0 | AA572: {} | AB572: n/60
A573: 569 | B573: 569 | C573: 569 | D573: 弑神试炼 | E573: 10501 | F573: 5 | G573: 3 | H573: 200569 | I573: 0 | J573: 480 | K573: 5000,0; | L573: 5 | M573: 5000,1; | N573: 39240/3600*(nPatrolSec+3)*(1000+nGuanQia)/1000 | O573: 31380/3600*(nPatrolSec+3)*(1000+nGuanQia)/1000 | P573: 19320/3600*(nPatrolSec+3)*(1000+nGuanQia)/1000 | Q573: nGuanQia + 1000 | R573: 39240/60*nMin*(1000+nGuanQia)/1000 | S573: 31380/60*nMin*(1000+nGuanQia)/1000 | T573: 19320/60*nMin*(1000+nGuanQia)/1000 | U573: 喽啰 | V573: pet_21;pet_201;pet_93;pet_91; | W573: 4 | X573: 5 | Y573: 1,28000,8,0;1,19016,8,0;1,10007,5,0;1,10108,2,0;1,7,9000,0;1,8,9000,0;1,4,1000,0; | Z573: 0 | AA573: {} | AB573: n/60
A574: 570 | B574: 570 | C574: 570 | D574: 弑神试炼 | E574: 10501 | F574: 5 | G574: 3 | H574: 200570 | I574: 0 | J574: 480 | K574: 5000,0; | L574: 5 | M574: 5000,1; | N574: 39240/3600*(nPatrolSec+3)*(1000+nGuanQia)/1000 | O574: 31380/3600*(nPatrolSec+3)*(1000+nGuanQia)/1000 | P574: 19320/3600*(nPatrolSec+3)*(1000+nGuanQia)/1000 | Q574: nGuanQia + 1000 | R574: 39240/60*nMin*(1000+nGuanQia)/1000 | S574: 31380/60*nMin*(1000+nGuanQia)/1000 | T574: 19320/60*nMin*(1000+nGuanQia)/1000 | U574: 喽啰 | V574: pet_21;pet_201;pet_93;pet_91; | W574: 4 | X574: 5 | Y574: 1,28000,8,0;1,19016,8,0;1,10007,5,0;1,10108,2,0;1,7,9000,0;1,8,9000,0;1,4,1000,0; | Z574: 0 | AA574: {} | AB574: n/60
A575: 571 | B575: 571 | C575: 571 | D575: 弑神试炼 | E575: 10501 | F575: 5 | G575: 3 | H575: 200571 | I575: 0 | J575: 480 | K575: 5000,0; | L575: 5 | M575: 5000,1; | N575: 39240/3600*(nPatrolSec+3)*(1000+nGuanQia)/1000 | O575: 31380/3600*(nPatrolSec+3)*(1000+nGuanQia)/1000 | P575: 19320/3600*(nPatrolSec+3)*(1000+nGuanQia)/1000 | Q575: nGuanQia + 1000 | R575: 39240/60*nMin*(1000+nGuanQia)/1000 | S575: 31380/60*nMin*(1000+nGuanQia)/1000 | T575: 19320/60*nMin*(1000+nGuanQia)/1000 | U575: 喽啰 | V575: pet_21;pet_201;pet_93;pet_91; | W575: 4 | X575: 5 | Y575: 1,28000,8,0;1,19016,8,0;1,10007,5,0;1,10108,2,0;1,7,9000,0;1,8,9000,0;1,4,1000,0; | Z575: 0 | AA575: {} | AB575: n/60
A576: 572 | B576: 572 | C576: 572 | D576: 弑神试炼 | E576: 10501 | F576: 5 | G576: 3 | H576: 200572 | I576: 0 | J576: 480 | K576: 5000,0; | L576: 5 | M576: 5000,1; | N576: 39240/3600*(nPatrolSec+3)*(1000+nGuanQia)/1000 | O576: 31380/3600*(nPatrolSec+3)*(1000+nGuanQia)/1000 | P576: 19320/3600*(nPatrolSec+3)*(1000+nGuanQia)/1000 | Q576: nGuanQia + 1000 | R576: 39240/60*nMin*(1000+nGuanQia)/1000 | S576: 31380/60*nMin*(1000+nGuanQia)/1000 | T576: 19320/60*nMin*(1000+nGuanQia)/1000 | U576: 喽啰 | V576: pet_21;pet_201;pet_93;pet_91; | W576: 4 | X576: 5 | Y576: 1,28000,8,0;1,19016,8,0;1,10007,5,0;1,10108,2,0;1,7,9000,0;1,8,9000,0;1,4,1000,0; | Z576: 0 | AA576: {} | AB576: n/60
A577: 573 | B577: 573 | C577: 573 | D577: 弑神试炼 | E577: 10501 | F577: 5 | G577: 3 | H577: 200573 | I577: 0 | J577: 480 | K577: 5000,0; | L577: 5 | M577: 5000,1; | N577: 39240/3600*(nPatrolSec+3)*(1000+nGuanQia)/1000 | O577: 31380/3600*(nPatrolSec+3)*(1000+nGuanQia)/1000 | P577: 19320/3600*(nPatrolSec+3)*(1000+nGuanQia)/1000 | Q577: nGuanQia + 1000 | R577: 39240/60*nMin*(1000+nGuanQia)/1000 | S577: 31380/60*nMin*(1000+nGuanQia)/1000 | T577: 19320/60*nMin*(1000+nGuanQia)/1000 | U577: 喽啰 | V577: pet_21;pet_201;pet_93;pet_91; | W577: 4 | X577: 5 | Y577: 1,28000,8,0;1,19016,8,0;1,10007,5,0;1,10108,2,0;1,7,9000,0;1,8,9000,0;1,4,1000,0; | Z577: 0 | AA577: {} | AB577: n/60
A578: 574 | B578: 574 | C578: 574 | D578: 弑神试炼 | E578: 10501 | F578: 5 | G578: 3 | H578: 200574 | I578: 0 | J578: 480 | K578: 5000,0; | L578: 5 | M578: 5000,1; | N578: 39240/3600*(nPatrolSec+3)*(1000+nGuanQia)/1000 | O578: 31380/3600*(nPatrolSec+3)*(1000+nGuanQia)/1000 | P578: 19320/3600*(nPatrolSec+3)*(1000+nGuanQia)/1000 | Q578: nGuanQia + 1000 | R578: 39240/60*nMin*(1000+nGuanQia)/1000 | S578: 31380/60*nMin*(1000+nGuanQia)/1000 | T578: 19320/60*nMin*(1000+nGuanQia)/1000 | U578: 喽啰 | V578: pet_21;pet_201;pet_93;pet_91; | W578: 4 | X578: 5 | Y578: 1,28000,8,0;1,19016,8,0;1,10007,5,0;1,10108,2,0;1,7,9000,0;1,8,9000,0;1,4,1000,0; | Z578: 0 | AA578: {} | AB578: n/60
A579: 575 | B579: 575 | C579: 575 | D579: 弑神试炼 | E579: 10501 | F579: 5 | G579: 3 | H579: 200575 | I579: 0 | J579: 480 | K579: 5000,0; | L579: 5 | M579: 5000,1; | N579: 39240/3600*(nPatrolSec+3)*(1000+nGuanQia)/1000 | O579: 31380/3600*(nPatrolSec+3)*(1000+nGuanQia)/1000 | P579: 19320/3600*(nPatrolSec+3)*(1000+nGuanQia)/1000 | Q579: nGuanQia + 1000 | R579: 39240/60*nMin*(1000+nGuanQia)/1000 | S579: 31380/60*nMin*(1000+nGuanQia)/1000 | T579: 19320/60*nMin*(1000+nGuanQia)/1000 | U579: 喽啰 | V579: pet_21;pet_201;pet_93;pet_91; | W579: 4 | X579: 5 | Y579: 1,28000,8,0;1,19016,8,0;1,10007,5,0;1,10108,2,0;1,7,9000,0;1,8,9000,0;1,4,1000,0; | Z579: 0 | AA579: {} | AB579: n/60
A580: 576 | B580: 576 | C580: 576 | D580: 弑神试炼 | E580: 10501 | F580: 5 | G580: 3 | H580: 200576 | I580: 0 | J580: 480 | K580: 5000,0; | L580: 5 | M580: 5000,1; | N580: 39240/3600*(nPatrolSec+3)*(1000+nGuanQia)/1000 | O580: 31380/3600*(nPatrolSec+3)*(1000+nGuanQia)/1000 | P580: 19320/3600*(nPatrolSec+3)*(1000+nGuanQia)/1000 | Q580: nGuanQia + 1000 | R580: 39240/60*nMin*(1000+nGuanQia)/1000 | S580: 31380/60*nMin*(1000+nGuanQia)/1000 | T580: 19320/60*nMin*(1000+nGuanQia)/1000 | U580: 喽啰 | V580: pet_21;pet_201;pet_93;pet_91; | W580: 4 | X580: 5 | Y580: 1,28000,8,0;1,19016,8,0;1,10007,5,0;1,10108,2,0;1,7,9000,0;1,8,9000,0;1,4,1000,0; | Z580: 0 | AA580: {} | AB580: n/60
A581: 577 | B581: 577 | C581: 577 | D581: 弑神试炼 | E581: 10501 | F581: 5 | G581: 3 | H581: 200577 | I581: 0 | J581: 480 | K581: 5000,0; | L581: 5 | M581: 5000,1; | N581: 39240/3600*(nPatrolSec+3)*(1000+nGuanQia)/1000 | O581: 31380/3600*(nPatrolSec+3)*(1000+nGuanQia)/1000 | P581: 19320/3600*(nPatrolSec+3)*(1000+nGuanQia)/1000 | Q581: nGuanQia + 1000 | R581: 39240/60*nMin*(1000+nGuanQia)/1000 | S581: 31380/60*nMin*(1000+nGuanQia)/1000 | T581: 19320/60*nMin*(1000+nGuanQia)/1000 | U581: 喽啰 | V581: pet_21;pet_201;pet_93;pet_91; | W581: 4 | X581: 5 | Y581: 1,28000,8,0;1,19016,8,0;1,10007,5,0;1,10108,2,0;1,7,9000,0;1,8,9000,0;1,4,1000,0; | Z581: 0 | AA581: {} | AB581: n/60
A582: 578 | B582: 578 | C582: 578 | D582: 弑神试炼 | E582: 10501 | F582: 5 | G582: 3 | H582: 200578 | I582: 0 | J582: 480 | K582: 5000,0; | L582: 5 | M582: 5000,1; | N582: 39240/3600*(nPatrolSec+3)*(1000+nGuanQia)/1000 | O582: 31380/3600*(nPatrolSec+3)*(1000+nGuanQia)/1000 | P582: 19320/3600*(nPatrolSec+3)*(1000+nGuanQia)/1000 | Q582: nGuanQia + 1000 | R582: 39240/60*nMin*(1000+nGuanQia)/1000 | S582: 31380/60*nMin*(1000+nGuanQia)/1000 | T582: 19320/60*nMin*(1000+nGuanQia)/1000 | U582: 喽啰 | V582: pet_21;pet_201;pet_93;pet_91; | W582: 4 | X582: 5 | Y582: 1,28000,8,0;1,19016,8,0;1,10007,5,0;1,10108,2,0;1,7,9000,0;1,8,9000,0;1,4,1000,0; | Z582: 0 | AA582: {} | AB582: n/60
A583: 579 | B583: 579 | C583: 579 | D583: 弑神试炼 | E583: 10501 | F583: 5 | G583: 3 | H583: 200579 | I583: 0 | J583: 480 | K583: 5000,0; | L583: 5 | M583: 5000,1; | N583: 39240/3600*(nPatrolSec+3)*(1000+nGuanQia)/1000 | O583: 31380/3600*(nPatrolSec+3)*(1000+nGuanQia)/1000 | P583: 19320/3600*(nPatrolSec+3)*(1000+nGuanQia)/1000 | Q583: nGuanQia + 1000 | R583: 39240/60*nMin*(1000+nGuanQia)/1000 | S583: 31380/60*nMin*(1000+nGuanQia)/1000 | T583: 19320/60*nMin*(1000+nGuanQia)/1000 | U583: 喽啰 | V583: pet_21;pet_201;pet_93;pet_91; | W583: 4 | X583: 5 | Y583: 1,28000,8,0;1,19016,8,0;1,10007,5,0;1,10108,2,0;1,7,9000,0;1,8,9000,0;1,4,1000,0; | Z583: 0 | AA583: {} | AB583: n/60
A584: 580 | B584: 580 | C584: 580 | D584: 弑神试炼 | E584: 10501 | F584: 5 | G584: 3 | H584: 200580 | I584: 0 | J584: 480 | K584: 5000,0; | L584: 5 | M584: 5000,1; | N584: 39240/3600*(nPatrolSec+3)*(1000+nGuanQia)/1000 | O584: 31380/3600*(nPatrolSec+3)*(1000+nGuanQia)/1000 | P584: 19320/3600*(nPatrolSec+3)*(1000+nGuanQia)/1000 | Q584: nGuanQia + 1000 | R584: 39240/60*nMin*(1000+nGuanQia)/1000 | S584: 31380/60*nMin*(1000+nGuanQia)/1000 | T584: 19320/60*nMin*(1000+nGuanQia)/1000 | U584: 喽啰 | V584: pet_21;pet_201;pet_93;pet_91; | W584: 4 | X584: 5 | Y584: 1,28000,8,0;1,19016,8,0;1,10007,5,0;1,10108,2,0;1,7,9000,0;1,8,9000,0;1,4,1000,0; | Z584: 0 | AA584: {} | AB584: n/60
A585: 581 | B585: 581 | C585: 581 | D585: 弑神试炼 | E585: 10501 | F585: 5 | G585: 3 | H585: 200581 | I585: 0 | J585: 480 | K585: 5000,0; | L585: 5 | M585: 5000,1; | N585: 39240/3600*(nPatrolSec+3)*(1000+nGuanQia)/1000 | O585: 31380/3600*(nPatrolSec+3)*(1000+nGuanQia)/1000 | P585: 19320/3600*(nPatrolSec+3)*(1000+nGuanQia)/1000 | Q585: nGuanQia + 1000 | R585: 39240/60*nMin*(1000+nGuanQia)/1000 | S585: 31380/60*nMin*(1000+nGuanQia)/1000 | T585: 19320/60*nMin*(1000+nGuanQia)/1000 | U585: 喽啰 | V585: pet_21;pet_201;pet_93;pet_91; | W585: 4 | X585: 5 | Y585: 1,28000,8,0;1,19016,8,0;1,10007,5,0;1,10108,2,0;1,7,9000,0;1,8,9000,0;1,4,1000,0; | Z585: 0 | AA585: {} | AB585: n/60
A586: 582 | B586: 582 | C586: 582 | D586: 弑神试炼 | E586: 10501 | F586: 5 | G586: 3 | H586: 200582 | I586: 0 | J586: 480 | K586: 5000,0; | L586: 5 | M586: 5000,1; | N586: 39240/3600*(nPatrolSec+3)*(1000+nGuanQia)/1000 | O586: 31380/3600*(nPatrolSec+3)*(1000+nGuanQia)/1000 | P586: 19320/3600*(nPatrolSec+3)*(1000+nGuanQia)/1000 | Q586: nGuanQia + 1000 | R586: 39240/60*nMin*(1000+nGuanQia)/1000 | S586: 31380/60*nMin*(1000+nGuanQia)/1000 | T586: 19320/60*nMin*(1000+nGuanQia)/1000 | U586: 喽啰 | V586: pet_21;pet_201;pet_93;pet_91; | W586: 4 | X586: 5 | Y586: 1,28000,8,0;1,19016,8,0;1,10007,5,0;1,10108,2,0;1,7,9000,0;1,8,9000,0;1,4,1000,0; | Z586: 0 | AA586: {} | AB586: n/60
A587: 583 | B587: 583 | C587: 583 | D587: 弑神试炼 | E587: 10501 | F587: 5 | G587: 3 | H587: 200583 | I587: 0 | J587: 480 | K587: 5000,0; | L587: 5 | M587: 5000,1; | N587: 39240/3600*(nPatrolSec+3)*(1000+nGuanQia)/1000 | O587: 31380/3600*(nPatrolSec+3)*(1000+nGuanQia)/1000 | P587: 19320/3600*(nPatrolSec+3)*(1000+nGuanQia)/1000 | Q587: nGuanQia + 1000 | R587: 39240/60*nMin*(1000+nGuanQia)/1000 | S587: 31380/60*nMin*(1000+nGuanQia)/1000 | T587: 19320/60*nMin*(1000+nGuanQia)/1000 | U587: 喽啰 | V587: pet_21;pet_201;pet_93;pet_91; | W587: 4 | X587: 5 | Y587: 1,28000,8,0;1,19016,8,0;1,10007,5,0;1,10108,2,0;1,7,9000,0;1,8,9000,0;1,4,1000,0; | Z587: 0 | AA587: {} | AB587: n/60
A588: 584 | B588: 584 | C588: 584 | D588: 弑神试炼 | E588: 10501 | F588: 5 | G588: 3 | H588: 200584 | I588: 0 | J588: 480 | K588: 5000,0; | L588: 5 | M588: 5000,1; | N588: 39240/3600*(nPatrolSec+3)*(1000+nGuanQia)/1000 | O588: 31380/3600*(nPatrolSec+3)*(1000+nGuanQia)/1000 | P588: 19320/3600*(nPatrolSec+3)*(1000+nGuanQia)/1000 | Q588: nGuanQia + 1000 | R588: 39240/60*nMin*(1000+nGuanQia)/1000 | S588: 31380/60*nMin*(1000+nGuanQia)/1000 | T588: 19320/60*nMin*(1000+nGuanQia)/1000 | U588: 喽啰 | V588: pet_21;pet_201;pet_93;pet_91; | W588: 4 | X588: 5 | Y588: 1,28000,8,0;1,19016,8,0;1,10007,5,0;1,10108,2,0;1,7,9000,0;1,8,9000,0;1,4,1000,0; | Z588: 0 | AA588: {} | AB588: n/60
A589: 585 | B589: 585 | C589: 585 | D589: 弑神试炼 | E589: 10501 | F589: 5 | G589: 3 | H589: 200585 | I589: 0 | J589: 480 | K589: 5000,0; | L589: 5 | M589: 5000,1; | N589: 39240/3600*(nPatrolSec+3)*(1000+nGuanQia)/1000 | O589: 31380/3600*(nPatrolSec+3)*(1000+nGuanQia)/1000 | P589: 19320/3600*(nPatrolSec+3)*(1000+nGuanQia)/1000 | Q589: nGuanQia + 1000 | R589: 39240/60*nMin*(1000+nGuanQia)/1000 | S589: 31380/60*nMin*(1000+nGuanQia)/1000 | T589: 19320/60*nMin*(1000+nGuanQia)/1000 | U589: 喽啰 | V589: pet_21;pet_201;pet_93;pet_91; | W589: 4 | X589: 5 | Y589: 1,28000,8,0;1,19016,8,0;1,10007,5,0;1,10108,2,0;1,7,9000,0;1,8,9000,0;1,4,1000,0; | Z589: 0 | AA589: {} | AB589: n/60
A590: 586 | B590: 586 | C590: 586 | D590: 弑神试炼 | E590: 10501 | F590: 5 | G590: 3 | H590: 200586 | I590: 0 | J590: 480 | K590: 5000,0; | L590: 5 | M590: 5000,1; | N590: 39240/3600*(nPatrolSec+3)*(1000+nGuanQia)/1000 | O590: 31380/3600*(nPatrolSec+3)*(1000+nGuanQia)/1000 | P590: 19320/3600*(nPatrolSec+3)*(1000+nGuanQia)/1000 | Q590: nGuanQia + 1000 | R590: 39240/60*nMin*(1000+nGuanQia)/1000 | S590: 31380/60*nMin*(1000+nGuanQia)/1000 | T590: 19320/60*nMin*(1000+nGuanQia)/1000 | U590: 喽啰 | V590: pet_21;pet_201;pet_93;pet_91; | W590: 4 | X590: 5 | Y590: 1,28000,8,0;1,19016,8,0;1,10007,5,0;1,10108,2,0;1,7,9000,0;1,8,9000,0;1,4,1000,0; | Z590: 0 | AA590: {} | AB590: n/60
A591: 587 | B591: 587 | C591: 587 | D591: 弑神试炼 | E591: 10501 | F591: 5 | G591: 3 | H591: 200587 | I591: 0 | J591: 480 | K591: 5000,0; | L591: 5 | M591: 5000,1; | N591: 39240/3600*(nPatrolSec+3)*(1000+nGuanQia)/1000 | O591: 31380/3600*(nPatrolSec+3)*(1000+nGuanQia)/1000 | P591: 19320/3600*(nPatrolSec+3)*(1000+nGuanQia)/1000 | Q591: nGuanQia + 1000 | R591: 39240/60*nMin*(1000+nGuanQia)/1000 | S591: 31380/60*nMin*(1000+nGuanQia)/1000 | T591: 19320/60*nMin*(1000+nGuanQia)/1000 | U591: 喽啰 | V591: pet_21;pet_201;pet_93;pet_91; | W591: 4 | X591: 5 | Y591: 1,28000,8,0;1,19016,8,0;1,10007,5,0;1,10108,2,0;1,7,9000,0;1,8,9000,0;1,4,1000,0; | Z591: 0 | AA591: {} | AB591: n/60
A592: 588 | B592: 588 | C592: 588 | D592: 弑神试炼 | E592: 10501 | F592: 5 | G592: 3 | H592: 200588 | I592: 0 | J592: 480 | K592: 5000,0; | L592: 5 | M592: 5000,1; | N592: 39240/3600*(nPatrolSec+3)*(1000+nGuanQia)/1000 | O592: 31380/3600*(nPatrolSec+3)*(1000+nGuanQia)/1000 | P592: 19320/3600*(nPatrolSec+3)*(1000+nGuanQia)/1000 | Q592: nGuanQia + 1000 | R592: 39240/60*nMin*(1000+nGuanQia)/1000 | S592: 31380/60*nMin*(1000+nGuanQia)/1000 | T592: 19320/60*nMin*(1000+nGuanQia)/1000 | U592: 喽啰 | V592: pet_21;pet_201;pet_93;pet_91; | W592: 4 | X592: 5 | Y592: 1,28000,8,0;1,19016,8,0;1,10007,5,0;1,10108,2,0;1,7,9000,0;1,8,9000,0;1,4,1000,0; | Z592: 0 | AA592: {} | AB592: n/60
A593: 589 | B593: 589 | C593: 589 | D593: 弑神试炼 | E593: 10501 | F593: 5 | G593: 3 | H593: 200589 | I593: 0 | J593: 480 | K593: 5000,0; | L593: 5 | M593: 5000,1; | N593: 39240/3600*(nPatrolSec+3)*(1000+nGuanQia)/1000 | O593: 31380/3600*(nPatrolSec+3)*(1000+nGuanQia)/1000 | P593: 19320/3600*(nPatrolSec+3)*(1000+nGuanQia)/1000 | Q593: nGuanQia + 1000 | R593: 39240/60*nMin*(1000+nGuanQia)/1000 | S593: 31380/60*nMin*(1000+nGuanQia)/1000 | T593: 19320/60*nMin*(1000+nGuanQia)/1000 | U593: 喽啰 | V593: pet_21;pet_201;pet_93;pet_91; | W593: 4 | X593: 5 | Y593: 1,28000,8,0;1,19016,8,0;1,10007,5,0;1,10108,2,0;1,7,9000,0;1,8,9000,0;1,4,1000,0; | Z593: 0 | AA593: {} | AB593: n/60
A594: 590 | B594: 590 | C594: 590 | D594: 弑神试炼 | E594: 10501 | F594: 5 | G594: 3 | H594: 200590 | I594: 0 | J594: 480 | K594: 5000,0; | L594: 5 | M594: 5000,1; | N594: 39240/3600*(nPatrolSec+3)*(1000+nGuanQia)/1000 | O594: 31380/3600*(nPatrolSec+3)*(1000+nGuanQia)/1000 | P594: 19320/3600*(nPatrolSec+3)*(1000+nGuanQia)/1000 | Q594: nGuanQia + 1000 | R594: 39240/60*nMin*(1000+nGuanQia)/1000 | S594: 31380/60*nMin*(1000+nGuanQia)/1000 | T594: 19320/60*nMin*(1000+nGuanQia)/1000 | U594: 喽啰 | V594: pet_21;pet_201;pet_93;pet_91; | W594: 4 | X594: 5 | Y594: 1,28000,8,0;1,19016,8,0;1,10007,5,0;1,10108,2,0;1,7,9000,0;1,8,9000,0;1,4,1000,0; | Z594: 0 | AA594: {} | AB594: n/60
A595: 591 | B595: 591 | C595: 591 | D595: 弑神试炼 | E595: 10501 | F595: 5 | G595: 3 | H595: 200591 | I595: 0 | J595: 480 | K595: 5000,0; | L595: 5 | M595: 5000,1; | N595: 39240/3600*(nPatrolSec+3)*(1000+nGuanQia)/1000 | O595: 31380/3600*(nPatrolSec+3)*(1000+nGuanQia)/1000 | P595: 19320/3600*(nPatrolSec+3)*(1000+nGuanQia)/1000 | Q595: nGuanQia + 1000 | R595: 39240/60*nMin*(1000+nGuanQia)/1000 | S595: 31380/60*nMin*(1000+nGuanQia)/1000 | T595: 19320/60*nMin*(1000+nGuanQia)/1000 | U595: 喽啰 | V595: pet_21;pet_201;pet_93;pet_91; | W595: 4 | X595: 5 | Y595: 1,28000,8,0;1,19016,8,0;1,10007,5,0;1,10108,2,0;1,7,9000,0;1,8,9000,0;1,4,1000,0; | Z595: 0 | AA595: {} | AB595: n/60
A596: 592 | B596: 592 | C596: 592 | D596: 弑神试炼 | E596: 10501 | F596: 5 | G596: 3 | H596: 200592 | I596: 0 | J596: 480 | K596: 5000,0; | L596: 5 | M596: 5000,1; | N596: 39240/3600*(nPatrolSec+3)*(1000+nGuanQia)/1000 | O596: 31380/3600*(nPatrolSec+3)*(1000+nGuanQia)/1000 | P596: 19320/3600*(nPatrolSec+3)*(1000+nGuanQia)/1000 | Q596: nGuanQia + 1000 | R596: 39240/60*nMin*(1000+nGuanQia)/1000 | S596: 31380/60*nMin*(1000+nGuanQia)/1000 | T596: 19320/60*nMin*(1000+nGuanQia)/1000 | U596: 喽啰 | V596: pet_21;pet_201;pet_93;pet_91; | W596: 4 | X596: 5 | Y596: 1,28000,8,0;1,19016,8,0;1,10007,5,0;1,10108,2,0;1,7,9000,0;1,8,9000,0;1,4,1000,0; | Z596: 0 | AA596: {} | AB596: n/60
A597: 593 | B597: 593 | C597: 593 | D597: 弑神试炼 | E597: 10501 | F597: 5 | G597: 3 | H597: 200593 | I597: 0 | J597: 480 | K597: 5000,0; | L597: 5 | M597: 5000,1; | N597: 39240/3600*(nPatrolSec+3)*(1000+nGuanQia)/1000 | O597: 31380/3600*(nPatrolSec+3)*(1000+nGuanQia)/1000 | P597: 19320/3600*(nPatrolSec+3)*(1000+nGuanQia)/1000 | Q597: nGuanQia + 1000 | R597: 39240/60*nMin*(1000+nGuanQia)/1000 | S597: 31380/60*nMin*(1000+nGuanQia)/1000 | T597: 19320/60*nMin*(1000+nGuanQia)/1000 | U597: 喽啰 | V597: pet_21;pet_201;pet_93;pet_91; | W597: 4 | X597: 5 | Y597: 1,28000,8,0;1,19016,8,0;1,10007,5,0;1,10108,2,0;1,7,9000,0;1,8,9000,0;1,4,1000,0; | Z597: 0 | AA597: {} | AB597: n/60
A598: 594 | B598: 594 | C598: 594 | D598: 弑神试炼 | E598: 10501 | F598: 5 | G598: 3 | H598: 200594 | I598: 0 | J598: 480 | K598: 5000,0; | L598: 5 | M598: 5000,1; | N598: 39240/3600*(nPatrolSec+3)*(1000+nGuanQia)/1000 | O598: 31380/3600*(nPatrolSec+3)*(1000+nGuanQia)/1000 | P598: 19320/3600*(nPatrolSec+3)*(1000+nGuanQia)/1000 | Q598: nGuanQia + 1000 | R598: 39240/60*nMin*(1000+nGuanQia)/1000 | S598: 31380/60*nMin*(1000+nGuanQia)/1000 | T598: 19320/60*nMin*(1000+nGuanQia)/1000 | U598: 喽啰 | V598: pet_21;pet_201;pet_93;pet_91; | W598: 4 | X598: 5 | Y598: 1,28000,8,0;1,19016,8,0;1,10007,5,0;1,10108,2,0;1,7,9000,0;1,8,9000,0;1,4,1000,0; | Z598: 0 | AA598: {} | AB598: n/60
A599: 595 | B599: 595 | C599: 595 | D599: 弑神试炼 | E599: 10501 | F599: 5 | G599: 3 | H599: 200595 | I599: 0 | J599: 480 | K599: 5000,0; | L599: 5 | M599: 5000,1; | N599: 39240/3600*(nPatrolSec+3)*(1000+nGuanQia)/1000 | O599: 31380/3600*(nPatrolSec+3)*(1000+nGuanQia)/1000 | P599: 19320/3600*(nPatrolSec+3)*(1000+nGuanQia)/1000 | Q599: nGuanQia + 1000 | R599: 39240/60*nMin*(1000+nGuanQia)/1000 | S599: 31380/60*nMin*(1000+nGuanQia)/1000 | T599: 19320/60*nMin*(1000+nGuanQia)/1000 | U599: 喽啰 | V599: pet_21;pet_201;pet_93;pet_91; | W599: 4 | X599: 5 | Y599: 1,28000,8,0;1,19016,8,0;1,10007,5,0;1,10108,2,0;1,7,9000,0;1,8,9000,0;1,4,1000,0; | Z599: 0 | AA599: {} | AB599: n/60
A600: 596 | B600: 596 | C600: 596 | D600: 弑神试炼 | E600: 10501 | F600: 5 | G600: 3 | H600: 200596 | I600: 0 | J600: 480 | K600: 5000,0; | L600: 5 | M600: 5000,1; | N600: 39240/3600*(nPatrolSec+3)*(1000+nGuanQia)/1000 | O600: 31380/3600*(nPatrolSec+3)*(1000+nGuanQia)/1000 | P600: 19320/3600*(nPatrolSec+3)*(1000+nGuanQia)/1000 | Q600: nGuanQia + 1000 | R600: 39240/60*nMin*(1000+nGuanQia)/1000 | S600: 31380/60*nMin*(1000+nGuanQia)/1000 | T600: 19320/60*nMin*(1000+nGuanQia)/1000 | U600: 喽啰 | V600: pet_21;pet_201;pet_93;pet_91; | W600: 4 | X600: 5 | Y600: 1,28000,8,0;1,19016,8,0;1,10007,5,0;1,10108,2,0;1,7,9000,0;1,8,9000,0;1,4,1000,0; | Z600: 0 | AA600: {} | AB600: n/60
A601: 597 | B601: 597 | C601: 597 | D601: 弑神试炼 | E601: 10501 | F601: 5 | G601: 3 | H601: 200597 | I601: 0 | J601: 480 | K601: 5000,0; | L601: 5 | M601: 5000,1; | N601: 39240/3600*(nPatrolSec+3)*(1000+nGuanQia)/1000 | O601: 31380/3600*(nPatrolSec+3)*(1000+nGuanQia)/1000 | P601: 19320/3600*(nPatrolSec+3)*(1000+nGuanQia)/1000 | Q601: nGuanQia + 1000 | R601: 39240/60*nMin*(1000+nGuanQia)/1000 | S601: 31380/60*nMin*(1000+nGuanQia)/1000 | T601: 19320/60*nMin*(1000+nGuanQia)/1000 | U601: 喽啰 | V601: pet_21;pet_201;pet_93;pet_91; | W601: 4 | X601: 5 | Y601: 1,28000,8,0;1,19016,8,0;1,10007,5,0;1,10108,2,0;1,7,9000,0;1,8,9000,0;1,4,1000,0; | Z601: 0 | AA601: {} | AB601: n/60
A602: 598 | B602: 598 | C602: 598 | D602: 弑神试炼 | E602: 10501 | F602: 5 | G602: 3 | H602: 200598 | I602: 0 | J602: 480 | K602: 5000,0; | L602: 5 | M602: 5000,1; | N602: 39240/3600*(nPatrolSec+3)*(1000+nGuanQia)/1000 | O602: 31380/3600*(nPatrolSec+3)*(1000+nGuanQia)/1000 | P602: 19320/3600*(nPatrolSec+3)*(1000+nGuanQia)/1000 | Q602: nGuanQia + 1000 | R602: 39240/60*nMin*(1000+nGuanQia)/1000 | S602: 31380/60*nMin*(1000+nGuanQia)/1000 | T602: 19320/60*nMin*(1000+nGuanQia)/1000 | U602: 喽啰 | V602: pet_21;pet_201;pet_93;pet_91; | W602: 4 | X602: 5 | Y602: 1,28000,8,0;1,19016,8,0;1,10007,5,0;1,10108,2,0;1,7,9000,0;1,8,9000,0;1,4,1000,0; | Z602: 0 | AA602: {} | AB602: n/60
A603: 599 | B603: 599 | C603: 599 | D603: 弑神试炼 | E603: 10501 | F603: 5 | G603: 3 | H603: 200599 | I603: 0 | J603: 480 | K603: 5000,0; | L603: 5 | M603: 5000,1; | N603: 39240/3600*(nPatrolSec+3)*(1000+nGuanQia)/1000 | O603: 31380/3600*(nPatrolSec+3)*(1000+nGuanQia)/1000 | P603: 19320/3600*(nPatrolSec+3)*(1000+nGuanQia)/1000 | Q603: nGuanQia + 1000 | R603: 39240/60*nMin*(1000+nGuanQia)/1000 | S603: 31380/60*nMin*(1000+nGuanQia)/1000 | T603: 19320/60*nMin*(1000+nGuanQia)/1000 | U603: 喽啰 | V603: pet_21;pet_201;pet_93;pet_91; | W603: 4 | X603: 5 | Y603: 1,28000,8,0;1,19016,8,0;1,10007,5,0;1,10108,2,0;1,7,9000,0;1,8,9000,0;1,4,1000,0; | Z603: 0 | AA603: {} | AB603: n/60
A604: 600 | B604: 600 | C604: 600 | D604: 弑神试炼 | E604: 10501 | F604: 5 | G604: 3 | H604: 200600 | I604: 0 | J604: 480 | K604: 5000,0; | L604: 5 | M604: 5000,1; | N604: 39240/3600*(nPatrolSec+3)*(1000+nGuanQia)/1000 | O604: 31380/3600*(nPatrolSec+3)*(1000+nGuanQia)/1000 | P604: 19320/3600*(nPatrolSec+3)*(1000+nGuanQia)/1000 | Q604: nGuanQia + 1000 | R604: 39240/60*nMin*(1000+nGuanQia)/1000 | S604: 31380/60*nMin*(1000+nGuanQia)/1000 | T604: 19320/60*nMin*(1000+nGuanQia)/1000 | U604: 喽啰 | V604: pet_21;pet_201;pet_93;pet_91; | W604: 4 | X604: 5 | Y604: 1,28000,8,0;1,19016,8,0;1,10007,5,0;1,10108,2,0;1,7,9000,0;1,8,9000,0;1,4,1000,0; | Z604: 0 | AA604: {} | AB604: n/60
A605: 601 | B605: 601 | C605: 601 | D605: 弑神试炼 | E605: 10501 | F605: 5 | G605: 3 | H605: 200601 | I605: 0 | J605: 480 | K605: 5000,0; | L605: 5 | M605: 5000,1; | N605: 39240/3600*(nPatrolSec+3)*(1000+nGuanQia)/1000 | O605: 31380/3600*(nPatrolSec+3)*(1000+nGuanQia)/1000 | P605: 19320/3600*(nPatrolSec+3)*(1000+nGuanQia)/1000 | Q605: nGuanQia + 1000 | R605: 39240/60*nMin*(1000+nGuanQia)/1000 | S605: 31380/60*nMin*(1000+nGuanQia)/1000 | T605: 19320/60*nMin*(1000+nGuanQia)/1000 | U605: 喽啰 | V605: pet_21;pet_201;pet_93;pet_91; | W605: 4 | X605: 5 | Y605: 1,28000,8,0;1,19016,8,0;1,10007,5,0;1,10108,2,0;1,7,9000,0;1,8,9000,0;1,4,1000,0; | Z605: 0 | AA605: {} | AB605: n/60
A606: 602 | B606: 602 | C606: 602 | D606: 弑神试炼 | E606: 10501 | F606: 5 | G606: 3 | H606: 200602 | I606: 0 | J606: 480 | K606: 5000,0; | L606: 5 | M606: 5000,1; | N606: 39240/3600*(nPatrolSec+3)*(1000+nGuanQia)/1000 | O606: 31380/3600*(nPatrolSec+3)*(1000+nGuanQia)/1000 | P606: 19320/3600*(nPatrolSec+3)*(1000+nGuanQia)/1000 | Q606: nGuanQia + 1000 | R606: 39240/60*nMin*(1000+nGuanQia)/1000 | S606: 31380/60*nMin*(1000+nGuanQia)/1000 | T606: 19320/60*nMin*(1000+nGuanQia)/1000 | U606: 喽啰 | V606: pet_21;pet_201;pet_93;pet_91; | W606: 4 | X606: 5 | Y606: 1,28000,8,0;1,19016,8,0;1,10007,5,0;1,10108,2,0;1,7,9000,0;1,8,9000,0;1,4,1000,0; | Z606: 0 | AA606: {} | AB606: n/60
A607: 603 | B607: 603 | C607: 603 | D607: 弑神试炼 | E607: 10501 | F607: 5 | G607: 3 | H607: 200603 | I607: 0 | J607: 480 | K607: 5000,0; | L607: 5 | M607: 5000,1; | N607: 39240/3600*(nPatrolSec+3)*(1000+nGuanQia)/1000 | O607: 31380/3600*(nPatrolSec+3)*(1000+nGuanQia)/1000 | P607: 19320/3600*(nPatrolSec+3)*(1000+nGuanQia)/1000 | Q607: nGuanQia + 1000 | R607: 39240/60*nMin*(1000+nGuanQia)/1000 | S607: 31380/60*nMin*(1000+nGuanQia)/1000 | T607: 19320/60*nMin*(1000+nGuanQia)/1000 | U607: 喽啰 | V607: pet_21;pet_201;pet_93;pet_91; | W607: 4 | X607: 5 | Y607: 1,28000,8,0;1,19016,8,0;1,10007,5,0;1,10108,2,0;1,7,9000,0;1,8,9000,0;1,4,1000,0; | Z607: 0 | AA607: {} | AB607: n/60
A608: 604 | B608: 604 | C608: 604 | D608: 弑神试炼 | E608: 10501 | F608: 5 | G608: 3 | H608: 200604 | I608: 0 | J608: 480 | K608: 5000,0; | L608: 5 | M608: 5000,1; | N608: 39240/3600*(nPatrolSec+3)*(1000+nGuanQia)/1000 | O608: 31380/3600*(nPatrolSec+3)*(1000+nGuanQia)/1000 | P608: 19320/3600*(nPatrolSec+3)*(1000+nGuanQia)/1000 | Q608: nGuanQia + 1000 | R608: 39240/60*nMin*(1000+nGuanQia)/1000 | S608: 31380/60*nMin*(1000+nGuanQia)/1000 | T608: 19320/60*nMin*(1000+nGuanQia)/1000 | U608: 喽啰 | V608: pet_21;pet_201;pet_93;pet_91; | W608: 4 | X608: 5 | Y608: 1,28000,8,0;1,19016,8,0;1,10007,5,0;1,10108,2,0;1,7,9000,0;1,8,9000,0;1,4,1000,0; | Z608: 0 | AA608: {} | AB608: n/60
A609: 605 | B609: 605 | C609: 605 | D609: 弑神试炼 | E609: 10501 | F609: 5 | G609: 3 | H609: 200605 | I609: 0 | J609: 480 | K609: 5000,0; | L609: 5 | M609: 5000,1; | N609: 39240/3600*(nPatrolSec+3)*(1000+nGuanQia)/1000 | O609: 31380/3600*(nPatrolSec+3)*(1000+nGuanQia)/1000 | P609: 19320/3600*(nPatrolSec+3)*(1000+nGuanQia)/1000 | Q609: nGuanQia + 1000 | R609: 39240/60*nMin*(1000+nGuanQia)/1000 | S609: 31380/60*nMin*(1000+nGuanQia)/1000 | T609: 19320/60*nMin*(1000+nGuanQia)/1000 | U609: 喽啰 | V609: pet_21;pet_201;pet_93;pet_91; | W609: 4 | X609: 5 | Y609: 1,28000,8,0;1,19016,8,0;1,10007,5,0;1,10108,2,0;1,7,9000,0;1,8,9000,0;1,4,1000,0; | Z609: 0 | AA609: {} | AB609: n/60
A610: 606 | B610: 606 | C610: 606 | D610: 弑神试炼 | E610: 10501 | F610: 5 | G610: 3 | H610: 200606 | I610: 0 | J610: 480 | K610: 5000,0; | L610: 5 | M610: 5000,1; | N610: 39240/3600*(nPatrolSec+3)*(1000+nGuanQia)/1000 | O610: 31380/3600*(nPatrolSec+3)*(1000+nGuanQia)/1000 | P610: 19320/3600*(nPatrolSec+3)*(1000+nGuanQia)/1000 | Q610: nGuanQia + 1000 | R610: 39240/60*nMin*(1000+nGuanQia)/1000 | S610: 31380/60*nMin*(1000+nGuanQia)/1000 | T610: 19320/60*nMin*(1000+nGuanQia)/1000 | U610: 喽啰 | V610: pet_21;pet_201;pet_93;pet_91; | W610: 4 | X610: 5 | Y610: 1,28000,8,0;1,19016,8,0;1,10007,5,0;1,10108,2,0;1,7,9000,0;1,8,9000,0;1,4,1000,0; | Z610: 0 | AA610: {} | AB610: n/60
A611: 607 | B611: 607 | C611: 607 | D611: 弑神试炼 | E611: 10501 | F611: 5 | G611: 3 | H611: 200607 | I611: 0 | J611: 480 | K611: 5000,0; | L611: 5 | M611: 5000,1; | N611: 39240/3600*(nPatrolSec+3)*(1000+nGuanQia)/1000 | O611: 31380/3600*(nPatrolSec+3)*(1000+nGuanQia)/1000 | P611: 19320/3600*(nPatrolSec+3)*(1000+nGuanQia)/1000 | Q611: nGuanQia + 1000 | R611: 39240/60*nMin*(1000+nGuanQia)/1000 | S611: 31380/60*nMin*(1000+nGuanQia)/1000 | T611: 19320/60*nMin*(1000+nGuanQia)/1000 | U611: 喽啰 | V611: pet_21;pet_201;pet_93;pet_91; | W611: 4 | X611: 5 | Y611: 1,28000,8,0;1,19016,8,0;1,10007,5,0;1,10108,2,0;1,7,9000,0;1,8,9000,0;1,4,1000,0; | Z611: 0 | AA611: {} | AB611: n/60
A612: 608 | B612: 608 | C612: 608 | D612: 弑神试炼 | E612: 10501 | F612: 5 | G612: 3 | H612: 200608 | I612: 0 | J612: 480 | K612: 5000,0; | L612: 5 | M612: 5000,1; | N612: 39240/3600*(nPatrolSec+3)*(1000+nGuanQia)/1000 | O612: 31380/3600*(nPatrolSec+3)*(1000+nGuanQia)/1000 | P612: 19320/3600*(nPatrolSec+3)*(1000+nGuanQia)/1000 | Q612: nGuanQia + 1000 | R612: 39240/60*nMin*(1000+nGuanQia)/1000 | S612: 31380/60*nMin*(1000+nGuanQia)/1000 | T612: 19320/60*nMin*(1000+nGuanQia)/1000 | U612: 喽啰 | V612: pet_21;pet_201;pet_93;pet_91; | W612: 4 | X612: 5 | Y612: 1,28000,8,0;1,19016,8,0;1,10007,5,0;1,10108,2,0;1,7,9000,0;1,8,9000,0;1,4,1000,0; | Z612: 0 | AA612: {} | AB612: n/60
A613: 609 | B613: 609 | C613: 609 | D613: 弑神试炼 | E613: 10501 | F613: 5 | G613: 3 | H613: 200609 | I613: 0 | J613: 480 | K613: 5000,0; | L613: 5 | M613: 5000,1; | N613: 39240/3600*(nPatrolSec+3)*(1000+nGuanQia)/1000 | O613: 31380/3600*(nPatrolSec+3)*(1000+nGuanQia)/1000 | P613: 19320/3600*(nPatrolSec+3)*(1000+nGuanQia)/1000 | Q613: nGuanQia + 1000 | R613: 39240/60*nMin*(1000+nGuanQia)/1000 | S613: 31380/60*nMin*(1000+nGuanQia)/1000 | T613: 19320/60*nMin*(1000+nGuanQia)/1000 | U613: 喽啰 | V613: pet_21;pet_201;pet_93;pet_91; | W613: 4 | X613: 5 | Y613: 1,28000,8,0;1,19016,8,0;1,10007,5,0;1,10108,2,0;1,7,9000,0;1,8,9000,0;1,4,1000,0; | Z613: 0 | AA613: {} | AB613: n/60
A614: 610 | B614: 610 | C614: 610 | D614: 弑神试炼 | E614: 10501 | F614: 5 | G614: 3 | H614: 200610 | I614: 0 | J614: 480 | K614: 5000,0; | L614: 5 | M614: 5000,1; | N614: 39240/3600*(nPatrolSec+3)*(1000+nGuanQia)/1000 | O614: 31380/3600*(nPatrolSec+3)*(1000+nGuanQia)/1000 | P614: 19320/3600*(nPatrolSec+3)*(1000+nGuanQia)/1000 | Q614: nGuanQia + 1000 | R614: 39240/60*nMin*(1000+nGuanQia)/1000 | S614: 31380/60*nMin*(1000+nGuanQia)/1000 | T614: 19320/60*nMin*(1000+nGuanQia)/1000 | U614: 喽啰 | V614: pet_21;pet_201;pet_93;pet_91; | W614: 4 | X614: 5 | Y614: 1,28000,8,0;1,19016,8,0;1,10007,5,0;1,10108,2,0;1,7,9000,0;1,8,9000,0;1,4,1000,0; | Z614: 0 | AA614: {} | AB614: n/60
A615: 611 | B615: 611 | C615: 611 | D615: 弑神试炼 | E615: 10501 | F615: 5 | G615: 3 | H615: 200611 | I615: 0 | J615: 480 | K615: 5000,0; | L615: 5 | M615: 5000,1; | N615: 39240/3600*(nPatrolSec+3)*(1000+nGuanQia)/1000 | O615: 31380/3600*(nPatrolSec+3)*(1000+nGuanQia)/1000 | P615: 19320/3600*(nPatrolSec+3)*(1000+nGuanQia)/1000 | Q615: nGuanQia + 1000 | R615: 39240/60*nMin*(1000+nGuanQia)/1000 | S615: 31380/60*nMin*(1000+nGuanQia)/1000 | T615: 19320/60*nMin*(1000+nGuanQia)/1000 | U615: 喽啰 | V615: pet_21;pet_201;pet_93;pet_91; | W615: 4 | X615: 5 | Y615: 1,28000,8,0;1,19016,8,0;1,10007,5,0;1,10108,2,0;1,7,9000,0;1,8,9000,0;1,4,1000,0; | Z615: 0 | AA615: {} | AB615: n/60
A616: 612 | B616: 612 | C616: 612 | D616: 弑神试炼 | E616: 10501 | F616: 5 | G616: 3 | H616: 200612 | I616: 0 | J616: 480 | K616: 5000,0; | L616: 5 | M616: 5000,1; | N616: 39240/3600*(nPatrolSec+3)*(1000+nGuanQia)/1000 | O616: 31380/3600*(nPatrolSec+3)*(1000+nGuanQia)/1000 | P616: 19320/3600*(nPatrolSec+3)*(1000+nGuanQia)/1000 | Q616: nGuanQia + 1000 | R616: 39240/60*nMin*(1000+nGuanQia)/1000 | S616: 31380/60*nMin*(1000+nGuanQia)/1000 | T616: 19320/60*nMin*(1000+nGuanQia)/1000 | U616: 喽啰 | V616: pet_21;pet_201;pet_93;pet_91; | W616: 4 | X616: 5 | Y616: 1,28000,8,0;1,19016,8,0;1,10007,5,0;1,10108,2,0;1,7,9000,0;1,8,9000,0;1,4,1000,0; | Z616: 0 | AA616: {} | AB616: n/60
A617: 613 | B617: 613 | C617: 613 | D617: 弑神试炼 | E617: 10501 | F617: 5 | G617: 3 | H617: 200613 | I617: 0 | J617: 480 | K617: 5000,0; | L617: 5 | M617: 5000,1; | N617: 39240/3600*(nPatrolSec+3)*(1000+nGuanQia)/1000 | O617: 31380/3600*(nPatrolSec+3)*(1000+nGuanQia)/1000 | P617: 19320/3600*(nPatrolSec+3)*(1000+nGuanQia)/1000 | Q617: nGuanQia + 1000 | R617: 39240/60*nMin*(1000+nGuanQia)/1000 | S617: 31380/60*nMin*(1000+nGuanQia)/1000 | T617: 19320/60*nMin*(1000+nGuanQia)/1000 | U617: 喽啰 | V617: pet_21;pet_201;pet_93;pet_91; | W617: 4 | X617: 5 | Y617: 1,28000,8,0;1,19016,8,0;1,10007,5,0;1,10108,2,0;1,7,9000,0;1,8,9000,0;1,4,1000,0; | Z617: 0 | AA617: {} | AB617: n/60
A618: 614 | B618: 614 | C618: 614 | D618: 弑神试炼 | E618: 10501 | F618: 5 | G618: 3 | H618: 200614 | I618: 0 | J618: 480 | K618: 5000,0; | L618: 5 | M618: 5000,1; | N618: 39240/3600*(nPatrolSec+3)*(1000+nGuanQia)/1000 | O618: 31380/3600*(nPatrolSec+3)*(1000+nGuanQia)/1000 | P618: 19320/3600*(nPatrolSec+3)*(1000+nGuanQia)/1000 | Q618: nGuanQia + 1000 | R618: 39240/60*nMin*(1000+nGuanQia)/1000 | S618: 31380/60*nMin*(1000+nGuanQia)/1000 | T618: 19320/60*nMin*(1000+nGuanQia)/1000 | U618: 喽啰 | V618: pet_21;pet_201;pet_93;pet_91; | W618: 4 | X618: 5 | Y618: 1,28000,8,0;1,19016,8,0;1,10007,5,0;1,10108,2,0;1,7,9000,0;1,8,9000,0;1,4,1000,0; | Z618: 0 | AA618: {} | AB618: n/60
A619: 615 | B619: 615 | C619: 615 | D619: 弑神试炼 | E619: 10501 | F619: 5 | G619: 3 | H619: 200615 | I619: 0 | J619: 480 | K619: 5000,0; | L619: 5 | M619: 5000,1; | N619: 39240/3600*(nPatrolSec+3)*(1000+nGuanQia)/1000 | O619: 31380/3600*(nPatrolSec+3)*(1000+nGuanQia)/1000 | P619: 19320/3600*(nPatrolSec+3)*(1000+nGuanQia)/1000 | Q619: nGuanQia + 1000 | R619: 39240/60*nMin*(1000+nGuanQia)/1000 | S619: 31380/60*nMin*(1000+nGuanQia)/1000 | T619: 19320/60*nMin*(1000+nGuanQia)/1000 | U619: 喽啰 | V619: pet_21;pet_201;pet_93;pet_91; | W619: 4 | X619: 5 | Y619: 1,28000,8,0;1,19016,8,0;1,10007,5,0;1,10108,2,0;1,7,9000,0;1,8,9000,0;1,4,1000,0; | Z619: 0 | AA619: {} | AB619: n/60
A620: 616 | B620: 616 | C620: 616 | D620: 弑神试炼 | E620: 10501 | F620: 5 | G620: 3 | H620: 200616 | I620: 0 | J620: 480 | K620: 5000,0; | L620: 5 | M620: 5000,1; | N620: 39240/3600*(nPatrolSec+3)*(1000+nGuanQia)/1000 | O620: 31380/3600*(nPatrolSec+3)*(1000+nGuanQia)/1000 | P620: 19320/3600*(nPatrolSec+3)*(1000+nGuanQia)/1000 | Q620: nGuanQia + 1000 | R620: 39240/60*nMin*(1000+nGuanQia)/1000 | S620: 31380/60*nMin*(1000+nGuanQia)/1000 | T620: 19320/60*nMin*(1000+nGuanQia)/1000 | U620: 喽啰 | V620: pet_21;pet_201;pet_93;pet_91; | W620: 4 | X620: 5 | Y620: 1,28000,8,0;1,19016,8,0;1,10007,5,0;1,10108,2,0;1,7,9000,0;1,8,9000,0;1,4,1000,0; | Z620: 0 | AA620: {} | AB620: n/60
A621: 617 | B621: 617 | C621: 617 | D621: 弑神试炼 | E621: 10501 | F621: 5 | G621: 3 | H621: 200617 | I621: 0 | J621: 480 | K621: 5000,0; | L621: 5 | M621: 5000,1; | N621: 39240/3600*(nPatrolSec+3)*(1000+nGuanQia)/1000 | O621: 31380/3600*(nPatrolSec+3)*(1000+nGuanQia)/1000 | P621: 19320/3600*(nPatrolSec+3)*(1000+nGuanQia)/1000 | Q621: nGuanQia + 1000 | R621: 39240/60*nMin*(1000+nGuanQia)/1000 | S621: 31380/60*nMin*(1000+nGuanQia)/1000 | T621: 19320/60*nMin*(1000+nGuanQia)/1000 | U621: 喽啰 | V621: pet_21;pet_201;pet_93;pet_91; | W621: 4 | X621: 5 | Y621: 1,28000,8,0;1,19016,8,0;1,10007,5,0;1,10108,2,0;1,7,9000,0;1,8,9000,0;1,4,1000,0; | Z621: 0 | AA621: {} | AB621: n/60
A622: 618 | B622: 618 | C622: 618 | D622: 弑神试炼 | E622: 10501 | F622: 5 | G622: 3 | H622: 200618 | I622: 0 | J622: 480 | K622: 5000,0; | L622: 5 | M622: 5000,1; | N622: 39240/3600*(nPatrolSec+3)*(1000+nGuanQia)/1000 | O622: 31380/3600*(nPatrolSec+3)*(1000+nGuanQia)/1000 | P622: 19320/3600*(nPatrolSec+3)*(1000+nGuanQia)/1000 | Q622: nGuanQia + 1000 | R622: 39240/60*nMin*(1000+nGuanQia)/1000 | S622: 31380/60*nMin*(1000+nGuanQia)/1000 | T622: 19320/60*nMin*(1000+nGuanQia)/1000 | U622: 喽啰 | V622: pet_21;pet_201;pet_93;pet_91; | W622: 4 | X622: 5 | Y622: 1,28000,8,0;1,19016,8,0;1,10007,5,0;1,10108,2,0;1,7,9000,0;1,8,9000,0;1,4,1000,0; | Z622: 0 | AA622: {} | AB622: n/60
A623: 619 | B623: 619 | C623: 619 | D623: 弑神试炼 | E623: 10501 | F623: 5 | G623: 3 | H623: 200619 | I623: 0 | J623: 480 | K623: 5000,0; | L623: 5 | M623: 5000,1; | N623: 39240/3600*(nPatrolSec+3)*(1000+nGuanQia)/1000 | O623: 31380/3600*(nPatrolSec+3)*(1000+nGuanQia)/1000 | P623: 19320/3600*(nPatrolSec+3)*(1000+nGuanQia)/1000 | Q623: nGuanQia + 1000 | R623: 39240/60*nMin*(1000+nGuanQia)/1000 | S623: 31380/60*nMin*(1000+nGuanQia)/1000 | T623: 19320/60*nMin*(1000+nGuanQia)/1000 | U623: 喽啰 | V623: pet_21;pet_201;pet_93;pet_91; | W623: 4 | X623: 5 | Y623: 1,28000,8,0;1,19016,8,0;1,10007,5,0;1,10108,2,0;1,7,9000,0;1,8,9000,0;1,4,1000,0; | Z623: 0 | AA623: {} | AB623: n/60
A624: 620 | B624: 620 | C624: 620 | D624: 弑神试炼 | E624: 10501 | F624: 5 | G624: 3 | H624: 200620 | I624: 0 | J624: 480 | K624: 5000,0; | L624: 5 | M624: 5000,1; | N624: 39240/3600*(nPatrolSec+3)*(1000+nGuanQia)/1000 | O624: 31380/3600*(nPatrolSec+3)*(1000+nGuanQia)/1000 | P624: 19320/3600*(nPatrolSec+3)*(1000+nGuanQia)/1000 | Q624: nGuanQia + 1000 | R624: 39240/60*nMin*(1000+nGuanQia)/1000 | S624: 31380/60*nMin*(1000+nGuanQia)/1000 | T624: 19320/60*nMin*(1000+nGuanQia)/1000 | U624: 喽啰 | V624: pet_21;pet_201;pet_93;pet_91; | W624: 4 | X624: 5 | Y624: 1,28000,8,0;1,19016,8,0;1,10007,5,0;1,10108,2,0;1,7,9000,0;1,8,9000,0;1,4,1000,0; | Z624: 0 | AA624: {} | AB624: n/60
A625: 621 | B625: 621 | C625: 621 | D625: 弑神试炼 | E625: 10501 | F625: 5 | G625: 3 | H625: 200621 | I625: 0 | J625: 480 | K625: 5000,0; | L625: 5 | M625: 5000,1; | N625: 39240/3600*(nPatrolSec+3)*(1000+nGuanQia)/1000 | O625: 31380/3600*(nPatrolSec+3)*(1000+nGuanQia)/1000 | P625: 19320/3600*(nPatrolSec+3)*(1000+nGuanQia)/1000 | Q625: nGuanQia + 1000 | R625: 39240/60*nMin*(1000+nGuanQia)/1000 | S625: 31380/60*nMin*(1000+nGuanQia)/1000 | T625: 19320/60*nMin*(1000+nGuanQia)/1000 | U625: 喽啰 | V625: pet_21;pet_201;pet_93;pet_91; | W625: 4 | X625: 5 | Y625: 1,28000,8,0;1,19016,8,0;1,10007,5,0;1,10108,2,0;1,7,9000,0;1,8,9000,0;1,4,1000,0; | Z625: 0 | AA625: {} | AB625: n/60
A626: 622 | B626: 622 | C626: 622 | D626: 弑神试炼 | E626: 10501 | F626: 5 | G626: 3 | H626: 200622 | I626: 0 | J626: 480 | K626: 5000,0; | L626: 5 | M626: 5000,1; | N626: 39240/3600*(nPatrolSec+3)*(1000+nGuanQia)/1000 | O626: 31380/3600*(nPatrolSec+3)*(1000+nGuanQia)/1000 | P626: 19320/3600*(nPatrolSec+3)*(1000+nGuanQia)/1000 | Q626: nGuanQia + 1000 | R626: 39240/60*nMin*(1000+nGuanQia)/1000 | S626: 31380/60*nMin*(1000+nGuanQia)/1000 | T626: 19320/60*nMin*(1000+nGuanQia)/1000 | U626: 喽啰 | V626: pet_21;pet_201;pet_93;pet_91; | W626: 4 | X626: 5 | Y626: 1,28000,8,0;1,19016,8,0;1,10007,5,0;1,10108,2,0;1,7,9000,0;1,8,9000,0;1,4,1000,0; | Z626: 0 | AA626: {} | AB626: n/60
A627: 623 | B627: 623 | C627: 623 | D627: 弑神试炼 | E627: 10501 | F627: 5 | G627: 3 | H627: 200623 | I627: 0 | J627: 480 | K627: 5000,0; | L627: 5 | M627: 5000,1; | N627: 39240/3600*(nPatrolSec+3)*(1000+nGuanQia)/1000 | O627: 31380/3600*(nPatrolSec+3)*(1000+nGuanQia)/1000 | P627: 19320/3600*(nPatrolSec+3)*(1000+nGuanQia)/1000 | Q627: nGuanQia + 1000 | R627: 39240/60*nMin*(1000+nGuanQia)/1000 | S627: 31380/60*nMin*(1000+nGuanQia)/1000 | T627: 19320/60*nMin*(1000+nGuanQia)/1000 | U627: 喽啰 | V627: pet_21;pet_201;pet_93;pet_91; | W627: 4 | X627: 5 | Y627: 1,28000,8,0;1,19016,8,0;1,10007,5,0;1,10108,2,0;1,7,9000,0;1,8,9000,0;1,4,1000,0; | Z627: 0 | AA627: {} | AB627: n/60
A628: 624 | B628: 624 | C628: 624 | D628: 弑神试炼 | E628: 10501 | F628: 5 | G628: 3 | H628: 200624 | I628: 0 | J628: 480 | K628: 5000,0; | L628: 5 | M628: 5000,1; | N628: 39240/3600*(nPatrolSec+3)*(1000+nGuanQia)/1000 | O628: 31380/3600*(nPatrolSec+3)*(1000+nGuanQia)/1000 | P628: 19320/3600*(nPatrolSec+3)*(1000+nGuanQia)/1000 | Q628: nGuanQia + 1000 | R628: 39240/60*nMin*(1000+nGuanQia)/1000 | S628: 31380/60*nMin*(1000+nGuanQia)/1000 | T628: 19320/60*nMin*(1000+nGuanQia)/1000 | U628: 喽啰 | V628: pet_21;pet_201;pet_93;pet_91; | W628: 4 | X628: 5 | Y628: 1,28000,8,0;1,19016,8,0;1,10007,5,0;1,10108,2,0;1,7,9000,0;1,8,9000,0;1,4,1000,0; | Z628: 0 | AA628: {} | AB628: n/60
A629: 625 | B629: 625 | C629: 625 | D629: 弑神试炼 | E629: 10501 | F629: 5 | G629: 3 | H629: 200625 | I629: 0 | J629: 480 | K629: 5000,0; | L629: 5 | M629: 5000,1; | N629: 39240/3600*(nPatrolSec+3)*(1000+nGuanQia)/1000 | O629: 31380/3600*(nPatrolSec+3)*(1000+nGuanQia)/1000 | P629: 19320/3600*(nPatrolSec+3)*(1000+nGuanQia)/1000 | Q629: nGuanQia + 1000 | R629: 39240/60*nMin*(1000+nGuanQia)/1000 | S629: 31380/60*nMin*(1000+nGuanQia)/1000 | T629: 19320/60*nMin*(1000+nGuanQia)/1000 | U629: 喽啰 | V629: pet_21;pet_201;pet_93;pet_91; | W629: 4 | X629: 5 | Y629: 1,28000,8,0;1,19016,8,0;1,10007,5,0;1,10108,2,0;1,7,9000,0;1,8,9000,0;1,4,1000,0; | Z629: 0 | AA629: {} | AB629: n/60
A630: 626 | B630: 626 | C630: 626 | D630: 弑神试炼 | E630: 10501 | F630: 5 | G630: 3 | H630: 200626 | I630: 0 | J630: 480 | K630: 5000,0; | L630: 5 | M630: 5000,1; | N630: 39240/3600*(nPatrolSec+3)*(1000+nGuanQia)/1000 | O630: 31380/3600*(nPatrolSec+3)*(1000+nGuanQia)/1000 | P630: 19320/3600*(nPatrolSec+3)*(1000+nGuanQia)/1000 | Q630: nGuanQia + 1000 | R630: 39240/60*nMin*(1000+nGuanQia)/1000 | S630: 31380/60*nMin*(1000+nGuanQia)/1000 | T630: 19320/60*nMin*(1000+nGuanQia)/1000 | U630: 喽啰 | V630: pet_21;pet_201;pet_93;pet_91; | W630: 4 | X630: 5 | Y630: 1,28000,8,0;1,19016,8,0;1,10007,5,0;1,10108,2,0;1,7,9000,0;1,8,9000,0;1,4,1000,0; | Z630: 0 | AA630: {} | AB630: n/60
A631: 627 | B631: 627 | C631: 627 | D631: 弑神试炼 | E631: 10501 | F631: 5 | G631: 3 | H631: 200627 | I631: 0 | J631: 480 | K631: 5000,0; | L631: 5 | M631: 5000,1; | N631: 39240/3600*(nPatrolSec+3)*(1000+nGuanQia)/1000 | O631: 31380/3600*(nPatrolSec+3)*(1000+nGuanQia)/1000 | P631: 19320/3600*(nPatrolSec+3)*(1000+nGuanQia)/1000 | Q631: nGuanQia + 1000 | R631: 39240/60*nMin*(1000+nGuanQia)/1000 | S631: 31380/60*nMin*(1000+nGuanQia)/1000 | T631: 19320/60*nMin*(1000+nGuanQia)/1000 | U631: 喽啰 | V631: pet_21;pet_201;pet_93;pet_91; | W631: 4 | X631: 5 | Y631: 1,28000,8,0;1,19016,8,0;1,10007,5,0;1,10108,2,0;1,7,9000,0;1,8,9000,0;1,4,1000,0; | Z631: 0 | AA631: {} | AB631: n/60
A632: 628 | B632: 628 | C632: 628 | D632: 弑神试炼 | E632: 10501 | F632: 5 | G632: 3 | H632: 200628 | I632: 0 | J632: 480 | K632: 5000,0; | L632: 5 | M632: 5000,1; | N632: 39240/3600*(nPatrolSec+3)*(1000+nGuanQia)/1000 | O632: 31380/3600*(nPatrolSec+3)*(1000+nGuanQia)/1000 | P632: 19320/3600*(nPatrolSec+3)*(1000+nGuanQia)/1000 | Q632: nGuanQia + 1000 | R632: 39240/60*nMin*(1000+nGuanQia)/1000 | S632: 31380/60*nMin*(1000+nGuanQia)/1000 | T632: 19320/60*nMin*(1000+nGuanQia)/1000 | U632: 喽啰 | V632: pet_21;pet_201;pet_93;pet_91; | W632: 4 | X632: 5 | Y632: 1,28000,8,0;1,19016,8,0;1,10007,5,0;1,10108,2,0;1,7,9000,0;1,8,9000,0;1,4,1000,0; | Z632: 0 | AA632: {} | AB632: n/60
A633: 629 | B633: 629 | C633: 629 | D633: 弑神试炼 | E633: 10501 | F633: 5 | G633: 3 | H633: 200629 | I633: 0 | J633: 480 | K633: 5000,0; | L633: 5 | M633: 5000,1; | N633: 39240/3600*(nPatrolSec+3)*(1000+nGuanQia)/1000 | O633: 31380/3600*(nPatrolSec+3)*(1000+nGuanQia)/1000 | P633: 19320/3600*(nPatrolSec+3)*(1000+nGuanQia)/1000 | Q633: nGuanQia + 1000 | R633: 39240/60*nMin*(1000+nGuanQia)/1000 | S633: 31380/60*nMin*(1000+nGuanQia)/1000 | T633: 19320/60*nMin*(1000+nGuanQia)/1000 | U633: 喽啰 | V633: pet_21;pet_201;pet_93;pet_91; | W633: 4 | X633: 5 | Y633: 1,28000,8,0;1,19016,8,0;1,10007,5,0;1,10108,2,0;1,7,9000,0;1,8,9000,0;1,4,1000,0; | Z633: 0 | AA633: {} | AB633: n/60
A634: 630 | B634: 630 | C634: 630 | D634: 弑神试炼 | E634: 10501 | F634: 5 | G634: 3 | H634: 200630 | I634: 0 | J634: 480 | K634: 5000,0; | L634: 5 | M634: 5000,1; | N634: 39240/3600*(nPatrolSec+3)*(1000+nGuanQia)/1000 | O634: 31380/3600*(nPatrolSec+3)*(1000+nGuanQia)/1000 | P634: 19320/3600*(nPatrolSec+3)*(1000+nGuanQia)/1000 | Q634: nGuanQia + 1000 | R634: 39240/60*nMin*(1000+nGuanQia)/1000 | S634: 31380/60*nMin*(1000+nGuanQia)/1000 | T634: 19320/60*nMin*(1000+nGuanQia)/1000 | U634: 喽啰 | V634: pet_21;pet_201;pet_93;pet_91; | W634: 4 | X634: 5 | Y634: 1,28000,8,0;1,19016,8,0;1,10007,5,0;1,10108,2,0;1,7,9000,0;1,8,9000,0;1,4,1000,0; | Z634: 0 | AA634: {} | AB634: n/60
A635: 631 | B635: 631 | C635: 631 | D635: 弑神试炼 | E635: 10501 | F635: 5 | G635: 3 | H635: 200631 | I635: 0 | J635: 480 | K635: 5000,0; | L635: 5 | M635: 5000,1; | N635: 39240/3600*(nPatrolSec+3)*(1000+nGuanQia)/1000 | O635: 31380/3600*(nPatrolSec+3)*(1000+nGuanQia)/1000 | P635: 19320/3600*(nPatrolSec+3)*(1000+nGuanQia)/1000 | Q635: nGuanQia + 1000 | R635: 39240/60*nMin*(1000+nGuanQia)/1000 | S635: 31380/60*nMin*(1000+nGuanQia)/1000 | T635: 19320/60*nMin*(1000+nGuanQia)/1000 | U635: 喽啰 | V635: pet_21;pet_201;pet_93;pet_91; | W635: 4 | X635: 5 | Y635: 1,28000,8,0;1,19016,8,0;1,10007,5,0;1,10108,2,0;1,7,9000,0;1,8,9000,0;1,4,1000,0; | Z635: 0 | AA635: {} | AB635: n/60
A636: 632 | B636: 632 | C636: 632 | D636: 弑神试炼 | E636: 10501 | F636: 5 | G636: 3 | H636: 200632 | I636: 0 | J636: 480 | K636: 5000,0; | L636: 5 | M636: 5000,1; | N636: 39240/3600*(nPatrolSec+3)*(1000+nGuanQia)/1000 | O636: 31380/3600*(nPatrolSec+3)*(1000+nGuanQia)/1000 | P636: 19320/3600*(nPatrolSec+3)*(1000+nGuanQia)/1000 | Q636: nGuanQia + 1000 | R636: 39240/60*nMin*(1000+nGuanQia)/1000 | S636: 31380/60*nMin*(1000+nGuanQia)/1000 | T636: 19320/60*nMin*(1000+nGuanQia)/1000 | U636: 喽啰 | V636: pet_21;pet_201;pet_93;pet_91; | W636: 4 | X636: 5 | Y636: 1,28000,8,0;1,19016,8,0;1,10007,5,0;1,10108,2,0;1,7,9000,0;1,8,9000,0;1,4,1000,0; | Z636: 0 | AA636: {} | AB636: n/60
A637: 633 | B637: 633 | C637: 633 | D637: 弑神试炼 | E637: 10501 | F637: 5 | G637: 3 | H637: 200633 | I637: 0 | J637: 480 | K637: 5000,0; | L637: 5 | M637: 5000,1; | N637: 39240/3600*(nPatrolSec+3)*(1000+nGuanQia)/1000 | O637: 31380/3600*(nPatrolSec+3)*(1000+nGuanQia)/1000 | P637: 19320/3600*(nPatrolSec+3)*(1000+nGuanQia)/1000 | Q637: nGuanQia + 1000 | R637: 39240/60*nMin*(1000+nGuanQia)/1000 | S637: 31380/60*nMin*(1000+nGuanQia)/1000 | T637: 19320/60*nMin*(1000+nGuanQia)/1000 | U637: 喽啰 | V637: pet_21;pet_201;pet_93;pet_91; | W637: 4 | X637: 5 | Y637: 1,28000,8,0;1,19016,8,0;1,10007,5,0;1,10108,2,0;1,7,9000,0;1,8,9000,0;1,4,1000,0; | Z637: 0 | AA637: {} | AB637: n/60
A638: 634 | B638: 634 | C638: 634 | D638: 弑神试炼 | E638: 10501 | F638: 5 | G638: 3 | H638: 200634 | I638: 0 | J638: 480 | K638: 5000,0; | L638: 5 | M638: 5000,1; | N638: 39240/3600*(nPatrolSec+3)*(1000+nGuanQia)/1000 | O638: 31380/3600*(nPatrolSec+3)*(1000+nGuanQia)/1000 | P638: 19320/3600*(nPatrolSec+3)*(1000+nGuanQia)/1000 | Q638: nGuanQia + 1000 | R638: 39240/60*nMin*(1000+nGuanQia)/1000 | S638: 31380/60*nMin*(1000+nGuanQia)/1000 | T638: 19320/60*nMin*(1000+nGuanQia)/1000 | U638: 喽啰 | V638: pet_21;pet_201;pet_93;pet_91; | W638: 4 | X638: 5 | Y638: 1,28000,8,0;1,19016,8,0;1,10007,5,0;1,10108,2,0;1,7,9000,0;1,8,9000,0;1,4,1000,0; | Z638: 0 | AA638: {} | AB638: n/60
A639: 635 | B639: 635 | C639: 635 | D639: 弑神试炼 | E639: 10501 | F639: 5 | G639: 3 | H639: 200635 | I639: 0 | J639: 480 | K639: 5000,0; | L639: 5 | M639: 5000,1; | N639: 39240/3600*(nPatrolSec+3)*(1000+nGuanQia)/1000 | O639: 31380/3600*(nPatrolSec+3)*(1000+nGuanQia)/1000 | P639: 19320/3600*(nPatrolSec+3)*(1000+nGuanQia)/1000 | Q639: nGuanQia + 1000 | R639: 39240/60*nMin*(1000+nGuanQia)/1000 | S639: 31380/60*nMin*(1000+nGuanQia)/1000 | T639: 19320/60*nMin*(1000+nGuanQia)/1000 | U639: 喽啰 | V639: pet_21;pet_201;pet_93;pet_91; | W639: 4 | X639: 5 | Y639: 1,28000,8,0;1,19016,8,0;1,10007,5,0;1,10108,2,0;1,7,9000,0;1,8,9000,0;1,4,1000,0; | Z639: 0 | AA639: {} | AB639: n/60
A640: 636 | B640: 636 | C640: 636 | D640: 弑神试炼 | E640: 10501 | F640: 5 | G640: 3 | H640: 200636 | I640: 0 | J640: 480 | K640: 5000,0; | L640: 5 | M640: 5000,1; | N640: 39240/3600*(nPatrolSec+3)*(1000+nGuanQia)/1000 | O640: 31380/3600*(nPatrolSec+3)*(1000+nGuanQia)/1000 | P640: 19320/3600*(nPatrolSec+3)*(1000+nGuanQia)/1000 | Q640: nGuanQia + 1000 | R640: 39240/60*nMin*(1000+nGuanQia)/1000 | S640: 31380/60*nMin*(1000+nGuanQia)/1000 | T640: 19320/60*nMin*(1000+nGuanQia)/1000 | U640: 喽啰 | V640: pet_21;pet_201;pet_93;pet_91; | W640: 4 | X640: 5 | Y640: 1,28000,8,0;1,19016,8,0;1,10007,5,0;1,10108,2,0;1,7,9000,0;1,8,9000,0;1,4,1000,0; | Z640: 0 | AA640: {} | AB640: n/60
A641: 637 | B641: 637 | C641: 637 | D641: 弑神试炼 | E641: 10501 | F641: 5 | G641: 3 | H641: 200637 | I641: 0 | J641: 480 | K641: 5000,0; | L641: 5 | M641: 5000,1; | N641: 39240/3600*(nPatrolSec+3)*(1000+nGuanQia)/1000 | O641: 31380/3600*(nPatrolSec+3)*(1000+nGuanQia)/1000 | P641: 19320/3600*(nPatrolSec+3)*(1000+nGuanQia)/1000 | Q641: nGuanQia + 1000 | R641: 39240/60*nMin*(1000+nGuanQia)/1000 | S641: 31380/60*nMin*(1000+nGuanQia)/1000 | T641: 19320/60*nMin*(1000+nGuanQia)/1000 | U641: 喽啰 | V641: pet_21;pet_201;pet_93;pet_91; | W641: 4 | X641: 5 | Y641: 1,28000,8,0;1,19016,8,0;1,10007,5,0;1,10108,2,0;1,7,9000,0;1,8,9000,0;1,4,1000,0; | Z641: 0 | AA641: {} | AB641: n/60
A642: 638 | B642: 638 | C642: 638 | D642: 弑神试炼 | E642: 10501 | F642: 5 | G642: 3 | H642: 200638 | I642: 0 | J642: 480 | K642: 5000,0; | L642: 5 | M642: 5000,1; | N642: 39240/3600*(nPatrolSec+3)*(1000+nGuanQia)/1000 | O642: 31380/3600*(nPatrolSec+3)*(1000+nGuanQia)/1000 | P642: 19320/3600*(nPatrolSec+3)*(1000+nGuanQia)/1000 | Q642: nGuanQia + 1000 | R642: 39240/60*nMin*(1000+nGuanQia)/1000 | S642: 31380/60*nMin*(1000+nGuanQia)/1000 | T642: 19320/60*nMin*(1000+nGuanQia)/1000 | U642: 喽啰 | V642: pet_21;pet_201;pet_93;pet_91; | W642: 4 | X642: 5 | Y642: 1,28000,8,0;1,19016,8,0;1,10007,5,0;1,10108,2,0;1,7,9000,0;1,8,9000,0;1,4,1000,0; | Z642: 0 | AA642: {} | AB642: n/60
A643: 639 | B643: 639 | C643: 639 | D643: 弑神试炼 | E643: 10501 | F643: 5 | G643: 3 | H643: 200639 | I643: 0 | J643: 480 | K643: 5000,0; | L643: 5 | M643: 5000,1; | N643: 39240/3600*(nPatrolSec+3)*(1000+nGuanQia)/1000 | O643: 31380/3600*(nPatrolSec+3)*(1000+nGuanQia)/1000 | P643: 19320/3600*(nPatrolSec+3)*(1000+nGuanQia)/1000 | Q643: nGuanQia + 1000 | R643: 39240/60*nMin*(1000+nGuanQia)/1000 | S643: 31380/60*nMin*(1000+nGuanQia)/1000 | T643: 19320/60*nMin*(1000+nGuanQia)/1000 | U643: 喽啰 | V643: pet_21;pet_201;pet_93;pet_91; | W643: 4 | X643: 5 | Y643: 1,28000,8,0;1,19016,8,0;1,10007,5,0;1,10108,2,0;1,7,9000,0;1,8,9000,0;1,4,1000,0; | Z643: 0 | AA643: {} | AB643: n/60
A644: 640 | B644: 640 | C644: 640 | D644: 弑神试炼 | E644: 10501 | F644: 5 | G644: 3 | H644: 200640 | I644: 0 | J644: 480 | K644: 5000,0; | L644: 5 | M644: 5000,1; | N644: 39240/3600*(nPatrolSec+3)*(1000+nGuanQia)/1000 | O644: 31380/3600*(nPatrolSec+3)*(1000+nGuanQia)/1000 | P644: 19320/3600*(nPatrolSec+3)*(1000+nGuanQia)/1000 | Q644: nGuanQia + 1000 | R644: 39240/60*nMin*(1000+nGuanQia)/1000 | S644: 31380/60*nMin*(1000+nGuanQia)/1000 | T644: 19320/60*nMin*(1000+nGuanQia)/1000 | U644: 喽啰 | V644: pet_21;pet_201;pet_93;pet_91; | W644: 4 | X644: 5 | Y644: 1,28000,8,0;1,19016,8,0;1,10007,5,0;1,10108,2,0;1,7,9000,0;1,8,9000,0;1,4,1000,0; | Z644: 0 | AA644: {} | AB644: n/60
A645: 641 | B645: 641 | C645: 641 | D645: 弑神试炼 | E645: 10501 | F645: 5 | G645: 3 | H645: 200641 | I645: 0 | J645: 480 | K645: 5000,0; | L645: 5 | M645: 5000,1; | N645: 39240/3600*(nPatrolSec+3)*(1000+nGuanQia)/1000 | O645: 31380/3600*(nPatrolSec+3)*(1000+nGuanQia)/1000 | P645: 19320/3600*(nPatrolSec+3)*(1000+nGuanQia)/1000 | Q645: nGuanQia + 1000 | R645: 39240/60*nMin*(1000+nGuanQia)/1000 | S645: 31380/60*nMin*(1000+nGuanQia)/1000 | T645: 19320/60*nMin*(1000+nGuanQia)/1000 | U645: 喽啰 | V645: pet_21;pet_201;pet_93;pet_91; | W645: 4 | X645: 5 | Y645: 1,28000,8,0;1,19016,8,0;1,10007,5,0;1,10108,2,0;1,7,9000,0;1,8,9000,0;1,4,1000,0; | Z645: 0 | AA645: {} | AB645: n/60
A646: 642 | B646: 642 | C646: 642 | D646: 弑神试炼 | E646: 10501 | F646: 5 | G646: 3 | H646: 200642 | I646: 0 | J646: 480 | K646: 5000,0; | L646: 5 | M646: 5000,1; | N646: 39240/3600*(nPatrolSec+3)*(1000+nGuanQia)/1000 | O646: 31380/3600*(nPatrolSec+3)*(1000+nGuanQia)/1000 | P646: 19320/3600*(nPatrolSec+3)*(1000+nGuanQia)/1000 | Q646: nGuanQia + 1000 | R646: 39240/60*nMin*(1000+nGuanQia)/1000 | S646: 31380/60*nMin*(1000+nGuanQia)/1000 | T646: 19320/60*nMin*(1000+nGuanQia)/1000 | U646: 喽啰 | V646: pet_21;pet_201;pet_93;pet_91; | W646: 4 | X646: 5 | Y646: 1,28000,8,0;1,19016,8,0;1,10007,5,0;1,10108,2,0;1,7,9000,0;1,8,9000,0;1,4,1000,0; | Z646: 0 | AA646: {} | AB646: n/60
A647: 643 | B647: 643 | C647: 643 | D647: 弑神试炼 | E647: 10501 | F647: 5 | G647: 3 | H647: 200643 | I647: 0 | J647: 480 | K647: 5000,0; | L647: 5 | M647: 5000,1; | N647: 39240/3600*(nPatrolSec+3)*(1000+nGuanQia)/1000 | O647: 31380/3600*(nPatrolSec+3)*(1000+nGuanQia)/1000 | P647: 19320/3600*(nPatrolSec+3)*(1000+nGuanQia)/1000 | Q647: nGuanQia + 1000 | R647: 39240/60*nMin*(1000+nGuanQia)/1000 | S647: 31380/60*nMin*(1000+nGuanQia)/1000 | T647: 19320/60*nMin*(1000+nGuanQia)/1000 | U647: 喽啰 | V647: pet_21;pet_201;pet_93;pet_91; | W647: 4 | X647: 5 | Y647: 1,28000,8,0;1,19016,8,0;1,10007,5,0;1,10108,2,0;1,7,9000,0;1,8,9000,0;1,4,1000,0; | Z647: 0 | AA647: {} | AB647: n/60
A648: 644 | B648: 644 | C648: 644 | D648: 弑神试炼 | E648: 10501 | F648: 5 | G648: 3 | H648: 200644 | I648: 0 | J648: 480 | K648: 5000,0; | L648: 5 | M648: 5000,1; | N648: 39240/3600*(nPatrolSec+3)*(1000+nGuanQia)/1000 | O648: 31380/3600*(nPatrolSec+3)*(1000+nGuanQia)/1000 | P648: 19320/3600*(nPatrolSec+3)*(1000+nGuanQia)/1000 | Q648: nGuanQia + 1000 | R648: 39240/60*nMin*(1000+nGuanQia)/1000 | S648: 31380/60*nMin*(1000+nGuanQia)/1000 | T648: 19320/60*nMin*(1000+nGuanQia)/1000 | U648: 喽啰 | V648: pet_21;pet_201;pet_93;pet_91; | W648: 4 | X648: 5 | Y648: 1,28000,8,0;1,19016,8,0;1,10007,5,0;1,10108,2,0;1,7,9000,0;1,8,9000,0;1,4,1000,0; | Z648: 0 | AA648: {} | AB648: n/60
A649: 645 | B649: 645 | C649: 645 | D649: 弑神试炼 | E649: 10501 | F649: 5 | G649: 3 | H649: 200645 | I649: 0 | J649: 480 | K649: 5000,0; | L649: 5 | M649: 5000,1; | N649: 39240/3600*(nPatrolSec+3)*(1000+nGuanQia)/1000 | O649: 31380/3600*(nPatrolSec+3)*(1000+nGuanQia)/1000 | P649: 19320/3600*(nPatrolSec+3)*(1000+nGuanQia)/1000 | Q649: nGuanQia + 1000 | R649: 39240/60*nMin*(1000+nGuanQia)/1000 | S649: 31380/60*nMin*(1000+nGuanQia)/1000 | T649: 19320/60*nMin*(1000+nGuanQia)/1000 | U649: 喽啰 | V649: pet_21;pet_201;pet_93;pet_91; | W649: 4 | X649: 5 | Y649: 1,28000,8,0;1,19016,8,0;1,10007,5,0;1,10108,2,0;1,7,9000,0;1,8,9000,0;1,4,1000,0; | Z649: 0 | AA649: {} | AB649: n/60
A650: 646 | B650: 646 | C650: 646 | D650: 弑神试炼 | E650: 10501 | F650: 5 | G650: 3 | H650: 200646 | I650: 0 | J650: 480 | K650: 5000,0; | L650: 5 | M650: 5000,1; | N650: 39240/3600*(nPatrolSec+3)*(1000+nGuanQia)/1000 | O650: 31380/3600*(nPatrolSec+3)*(1000+nGuanQia)/1000 | P650: 19320/3600*(nPatrolSec+3)*(1000+nGuanQia)/1000 | Q650: nGuanQia + 1000 | R650: 39240/60*nMin*(1000+nGuanQia)/1000 | S650: 31380/60*nMin*(1000+nGuanQia)/1000 | T650: 19320/60*nMin*(1000+nGuanQia)/1000 | U650: 喽啰 | V650: pet_21;pet_201;pet_93;pet_91; | W650: 4 | X650: 5 | Y650: 1,28000,8,0;1,19016,8,0;1,10007,5,0;1,10108,2,0;1,7,9000,0;1,8,9000,0;1,4,1000,0; | Z650: 0 | AA650: {} | AB650: n/60
A651: 647 | B651: 647 | C651: 647 | D651: 弑神试炼 | E651: 10501 | F651: 5 | G651: 3 | H651: 200647 | I651: 0 | J651: 480 | K651: 5000,0; | L651: 5 | M651: 5000,1; | N651: 39240/3600*(nPatrolSec+3)*(1000+nGuanQia)/1000 | O651: 31380/3600*(nPatrolSec+3)*(1000+nGuanQia)/1000 | P651: 19320/3600*(nPatrolSec+3)*(1000+nGuanQia)/1000 | Q651: nGuanQia + 1000 | R651: 39240/60*nMin*(1000+nGuanQia)/1000 | S651: 31380/60*nMin*(1000+nGuanQia)/1000 | T651: 19320/60*nMin*(1000+nGuanQia)/1000 | U651: 喽啰 | V651: pet_21;pet_201;pet_93;pet_91; | W651: 4 | X651: 5 | Y651: 1,28000,8,0;1,19016,8,0;1,10007,5,0;1,10108,2,0;1,7,9000,0;1,8,9000,0;1,4,1000,0; | Z651: 0 | AA651: {} | AB651: n/60
A652: 648 | B652: 648 | C652: 648 | D652: 弑神试炼 | E652: 10501 | F652: 5 | G652: 3 | H652: 200648 | I652: 0 | J652: 480 | K652: 5000,0; | L652: 5 | M652: 5000,1; | N652: 39240/3600*(nPatrolSec+3)*(1000+nGuanQia)/1000 | O652: 31380/3600*(nPatrolSec+3)*(1000+nGuanQia)/1000 | P652: 19320/3600*(nPatrolSec+3)*(1000+nGuanQia)/1000 | Q652: nGuanQia + 1000 | R652: 39240/60*nMin*(1000+nGuanQia)/1000 | S652: 31380/60*nMin*(1000+nGuanQia)/1000 | T652: 19320/60*nMin*(1000+nGuanQia)/1000 | U652: 喽啰 | V652: pet_21;pet_201;pet_93;pet_91; | W652: 4 | X652: 5 | Y652: 1,28000,8,0;1,19016,8,0;1,10007,5,0;1,10108,2,0;1,7,9000,0;1,8,9000,0;1,4,1000,0; | Z652: 0 | AA652: {} | AB652: n/60
A653: 649 | B653: 649 | C653: 649 | D653: 弑神试炼 | E653: 10501 | F653: 5 | G653: 3 | H653: 200649 | I653: 0 | J653: 480 | K653: 5000,0; | L653: 5 | M653: 5000,1; | N653: 39240/3600*(nPatrolSec+3)*(1000+nGuanQia)/1000 | O653: 31380/3600*(nPatrolSec+3)*(1000+nGuanQia)/1000 | P653: 19320/3600*(nPatrolSec+3)*(1000+nGuanQia)/1000 | Q653: nGuanQia + 1000 | R653: 39240/60*nMin*(1000+nGuanQia)/1000 | S653: 31380/60*nMin*(1000+nGuanQia)/1000 | T653: 19320/60*nMin*(1000+nGuanQia)/1000 | U653: 喽啰 | V653: pet_21;pet_201;pet_93;pet_91; | W653: 4 | X653: 5 | Y653: 1,28000,8,0;1,19016,8,0;1,10007,5,0;1,10108,2,0;1,7,9000,0;1,8,9000,0;1,4,1000,0; | Z653: 0 | AA653: {} | AB653: n/60
A654: 650 | B654: 650 | C654: 650 | D654: 弑神试炼 | E654: 10501 | F654: 5 | G654: 3 | H654: 200650 | I654: 0 | J654: 480 | K654: 5000,0; | L654: 5 | M654: 5000,1; | N654: 39240/3600*(nPatrolSec+3)*(1000+nGuanQia)/1000 | O654: 31380/3600*(nPatrolSec+3)*(1000+nGuanQia)/1000 | P654: 19320/3600*(nPatrolSec+3)*(1000+nGuanQia)/1000 | Q654: nGuanQia + 1000 | R654: 39240/60*nMin*(1000+nGuanQia)/1000 | S654: 31380/60*nMin*(1000+nGuanQia)/1000 | T654: 19320/60*nMin*(1000+nGuanQia)/1000 | U654: 喽啰 | V654: pet_21;pet_201;pet_93;pet_91; | W654: 4 | X654: 5 | Y654: 1,28000,8,0;1,19016,8,0;1,10007,5,0;1,10108,2,0;1,7,9000,0;1,8,9000,0;1,4,1000,0; | Z654: 0 | AA654: {} | AB654: n/60
A655: 651 | B655: 651 | C655: 651 | D655: 弑神试炼 | E655: 10501 | F655: 5 | G655: 3 | H655: 200651 | I655: 0 | J655: 480 | K655: 5000,0; | L655: 5 | M655: 5000,1; | N655: 39240/3600*(nPatrolSec+3)*(1000+nGuanQia)/1000 | O655: 31380/3600*(nPatrolSec+3)*(1000+nGuanQia)/1000 | P655: 19320/3600*(nPatrolSec+3)*(1000+nGuanQia)/1000 | Q655: nGuanQia + 1000 | R655: 39240/60*nMin*(1000+nGuanQia)/1000 | S655: 31380/60*nMin*(1000+nGuanQia)/1000 | T655: 19320/60*nMin*(1000+nGuanQia)/1000 | U655: 喽啰 | V655: pet_21;pet_201;pet_93;pet_91; | W655: 4 | X655: 5 | Y655: 1,28000,8,0;1,19016,8,0;1,10007,5,0;1,10108,2,0;1,7,9000,0;1,8,9000,0;1,4,1000,0; | Z655: 0 | AA655: {} | AB655: n/60
A656: 652 | B656: 652 | C656: 652 | D656: 弑神试炼 | E656: 10501 | F656: 5 | G656: 3 | H656: 200652 | I656: 0 | J656: 480 | K656: 5000,0; | L656: 5 | M656: 5000,1; | N656: 39240/3600*(nPatrolSec+3)*(1000+nGuanQia)/1000 | O656: 31380/3600*(nPatrolSec+3)*(1000+nGuanQia)/1000 | P656: 19320/3600*(nPatrolSec+3)*(1000+nGuanQia)/1000 | Q656: nGuanQia + 1000 | R656: 39240/60*nMin*(1000+nGuanQia)/1000 | S656: 31380/60*nMin*(1000+nGuanQia)/1000 | T656: 19320/60*nMin*(1000+nGuanQia)/1000 | U656: 喽啰 | V656: pet_21;pet_201;pet_93;pet_91; | W656: 4 | X656: 5 | Y656: 1,28000,8,0;1,19016,8,0;1,10007,5,0;1,10108,2,0;1,7,9000,0;1,8,9000,0;1,4,1000,0; | Z656: 0 | AA656: {} | AB656: n/60
A657: 653 | B657: 653 | C657: 653 | D657: 弑神试炼 | E657: 10501 | F657: 5 | G657: 3 | H657: 200653 | I657: 0 | J657: 480 | K657: 5000,0; | L657: 5 | M657: 5000,1; | N657: 39240/3600*(nPatrolSec+3)*(1000+nGuanQia)/1000 | O657: 31380/3600*(nPatrolSec+3)*(1000+nGuanQia)/1000 | P657: 19320/3600*(nPatrolSec+3)*(1000+nGuanQia)/1000 | Q657: nGuanQia + 1000 | R657: 39240/60*nMin*(1000+nGuanQia)/1000 | S657: 31380/60*nMin*(1000+nGuanQia)/1000 | T657: 19320/60*nMin*(1000+nGuanQia)/1000 | U657: 喽啰 | V657: pet_21;pet_201;pet_93;pet_91; | W657: 4 | X657: 5 | Y657: 1,28000,8,0;1,19016,8,0;1,10007,5,0;1,10108,2,0;1,7,9000,0;1,8,9000,0;1,4,1000,0; | Z657: 0 | AA657: {} | AB657: n/60
A658: 654 | B658: 654 | C658: 654 | D658: 弑神试炼 | E658: 10501 | F658: 5 | G658: 3 | H658: 200654 | I658: 0 | J658: 480 | K658: 5000,0; | L658: 5 | M658: 5000,1; | N658: 39240/3600*(nPatrolSec+3)*(1000+nGuanQia)/1000 | O658: 31380/3600*(nPatrolSec+3)*(1000+nGuanQia)/1000 | P658: 19320/3600*(nPatrolSec+3)*(1000+nGuanQia)/1000 | Q658: nGuanQia + 1000 | R658: 39240/60*nMin*(1000+nGuanQia)/1000 | S658: 31380/60*nMin*(1000+nGuanQia)/1000 | T658: 19320/60*nMin*(1000+nGuanQia)/1000 | U658: 喽啰 | V658: pet_21;pet_201;pet_93;pet_91; | W658: 4 | X658: 5 | Y658: 1,28000,8,0;1,19016,8,0;1,10007,5,0;1,10108,2,0;1,7,9000,0;1,8,9000,0;1,4,1000,0; | Z658: 0 | AA658: {} | AB658: n/60
A659: 655 | B659: 655 | C659: 655 | D659: 弑神试炼 | E659: 10501 | F659: 5 | G659: 3 | H659: 200655 | I659: 0 | J659: 480 | K659: 5000,0; | L659: 5 | M659: 5000,1; | N659: 39240/3600*(nPatrolSec+3)*(1000+nGuanQia)/1000 | O659: 31380/3600*(nPatrolSec+3)*(1000+nGuanQia)/1000 | P659: 19320/3600*(nPatrolSec+3)*(1000+nGuanQia)/1000 | Q659: nGuanQia + 1000 | R659: 39240/60*nMin*(1000+nGuanQia)/1000 | S659: 31380/60*nMin*(1000+nGuanQia)/1000 | T659: 19320/60*nMin*(1000+nGuanQia)/1000 | U659: 喽啰 | V659: pet_21;pet_201;pet_93;pet_91; | W659: 4 | X659: 5 | Y659: 1,28000,8,0;1,19016,8,0;1,10007,5,0;1,10108,2,0;1,7,9000,0;1,8,9000,0;1,4,1000,0; | Z659: 0 | AA659: {} | AB659: n/60
A660: 656 | B660: 656 | C660: 656 | D660: 弑神试炼 | E660: 10501 | F660: 5 | G660: 3 | H660: 200656 | I660: 0 | J660: 480 | K660: 5000,0; | L660: 5 | M660: 5000,1; | N660: 39240/3600*(nPatrolSec+3)*(1000+nGuanQia)/1000 | O660: 31380/3600*(nPatrolSec+3)*(1000+nGuanQia)/1000 | P660: 19320/3600*(nPatrolSec+3)*(1000+nGuanQia)/1000 | Q660: nGuanQia + 1000 | R660: 39240/60*nMin*(1000+nGuanQia)/1000 | S660: 31380/60*nMin*(1000+nGuanQia)/1000 | T660: 19320/60*nMin*(1000+nGuanQia)/1000 | U660: 喽啰 | V660: pet_21;pet_201;pet_93;pet_91; | W660: 4 | X660: 5 | Y660: 1,28000,8,0;1,19016,8,0;1,10007,5,0;1,10108,2,0;1,7,9000,0;1,8,9000,0;1,4,1000,0; | Z660: 0 | AA660: {} | AB660: n/60
A661: 657 | B661: 657 | C661: 657 | D661: 弑神试炼 | E661: 10501 | F661: 5 | G661: 3 | H661: 200657 | I661: 0 | J661: 480 | K661: 5000,0; | L661: 5 | M661: 5000,1; | N661: 39240/3600*(nPatrolSec+3)*(1000+nGuanQia)/1000 | O661: 31380/3600*(nPatrolSec+3)*(1000+nGuanQia)/1000 | P661: 19320/3600*(nPatrolSec+3)*(1000+nGuanQia)/1000 | Q661: nGuanQia + 1000 | R661: 39240/60*nMin*(1000+nGuanQia)/1000 | S661: 31380/60*nMin*(1000+nGuanQia)/1000 | T661: 19320/60*nMin*(1000+nGuanQia)/1000 | U661: 喽啰 | V661: pet_21;pet_201;pet_93;pet_91; | W661: 4 | X661: 5 | Y661: 1,28000,8,0;1,19016,8,0;1,10007,5,0;1,10108,2,0;1,7,9000,0;1,8,9000,0;1,4,1000,0; | Z661: 0 | AA661: {} | AB661: n/60
A662: 658 | B662: 658 | C662: 658 | D662: 弑神试炼 | E662: 10501 | F662: 5 | G662: 3 | H662: 200658 | I662: 0 | J662: 480 | K662: 5000,0; | L662: 5 | M662: 5000,1; | N662: 39240/3600*(nPatrolSec+3)*(1000+nGuanQia)/1000 | O662: 31380/3600*(nPatrolSec+3)*(1000+nGuanQia)/1000 | P662: 19320/3600*(nPatrolSec+3)*(1000+nGuanQia)/1000 | Q662: nGuanQia + 1000 | R662: 39240/60*nMin*(1000+nGuanQia)/1000 | S662: 31380/60*nMin*(1000+nGuanQia)/1000 | T662: 19320/60*nMin*(1000+nGuanQia)/1000 | U662: 喽啰 | V662: pet_21;pet_201;pet_93;pet_91; | W662: 4 | X662: 5 | Y662: 1,28000,8,0;1,19016,8,0;1,10007,5,0;1,10108,2,0;1,7,9000,0;1,8,9000,0;1,4,1000,0; | Z662: 0 | AA662: {} | AB662: n/60
A663: 659 | B663: 659 | C663: 659 | D663: 弑神试炼 | E663: 10501 | F663: 5 | G663: 3 | H663: 200659 | I663: 0 | J663: 480 | K663: 5000,0; | L663: 5 | M663: 5000,1; | N663: 39240/3600*(nPatrolSec+3)*(1000+nGuanQia)/1000 | O663: 31380/3600*(nPatrolSec+3)*(1000+nGuanQia)/1000 | P663: 19320/3600*(nPatrolSec+3)*(1000+nGuanQia)/1000 | Q663: nGuanQia + 1000 | R663: 39240/60*nMin*(1000+nGuanQia)/1000 | S663: 31380/60*nMin*(1000+nGuanQia)/1000 | T663: 19320/60*nMin*(1000+nGuanQia)/1000 | U663: 喽啰 | V663: pet_21;pet_201;pet_93;pet_91; | W663: 4 | X663: 5 | Y663: 1,28000,8,0;1,19016,8,0;1,10007,5,0;1,10108,2,0;1,7,9000,0;1,8,9000,0;1,4,1000,0; | Z663: 0 | AA663: {} | AB663: n/60
A664: 660 | B664: 660 | C664: 660 | D664: 弑神试炼 | E664: 10501 | F664: 5 | G664: 3 | H664: 200660 | I664: 0 | J664: 480 | K664: 5000,0; | L664: 5 | M664: 5000,1; | N664: 39240/3600*(nPatrolSec+3)*(1000+nGuanQia)/1000 | O664: 31380/3600*(nPatrolSec+3)*(1000+nGuanQia)/1000 | P664: 19320/3600*(nPatrolSec+3)*(1000+nGuanQia)/1000 | Q664: nGuanQia + 1000 | R664: 39240/60*nMin*(1000+nGuanQia)/1000 | S664: 31380/60*nMin*(1000+nGuanQia)/1000 | T664: 19320/60*nMin*(1000+nGuanQia)/1000 | U664: 喽啰 | V664: pet_21;pet_201;pet_93;pet_91; | W664: 4 | X664: 5 | Y664: 1,28000,8,0;1,19016,8,0;1,10007,5,0;1,10108,2,0;1,7,9000,0;1,8,9000,0;1,4,1000,0; | Z664: 0 | AA664: {} | AB664: n/60
A665: 661 | B665: 661 | C665: 661 | D665: 弑神试炼 | E665: 10501 | F665: 5 | G665: 3 | H665: 200661 | I665: 0 | J665: 480 | K665: 5000,0; | L665: 5 | M665: 5000,1; | N665: 39240/3600*(nPatrolSec+3)*(1000+nGuanQia)/1000 | O665: 31380/3600*(nPatrolSec+3)*(1000+nGuanQia)/1000 | P665: 19320/3600*(nPatrolSec+3)*(1000+nGuanQia)/1000 | Q665: nGuanQia + 1000 | R665: 39240/60*nMin*(1000+nGuanQia)/1000 | S665: 31380/60*nMin*(1000+nGuanQia)/1000 | T665: 19320/60*nMin*(1000+nGuanQia)/1000 | U665: 喽啰 | V665: pet_21;pet_201;pet_93;pet_91; | W665: 4 | X665: 5 | Y665: 1,28000,8,0;1,19016,8,0;1,10007,5,0;1,10108,2,0;1,7,9000,0;1,8,9000,0;1,4,1000,0; | Z665: 0 | AA665: {} | AB665: n/60
A666: 662 | B666: 662 | C666: 662 | D666: 弑神试炼 | E666: 10501 | F666: 5 | G666: 3 | H666: 200662 | I666: 0 | J666: 480 | K666: 5000,0; | L666: 5 | M666: 5000,1; | N666: 39240/3600*(nPatrolSec+3)*(1000+nGuanQia)/1000 | O666: 31380/3600*(nPatrolSec+3)*(1000+nGuanQia)/1000 | P666: 19320/3600*(nPatrolSec+3)*(1000+nGuanQia)/1000 | Q666: nGuanQia + 1000 | R666: 39240/60*nMin*(1000+nGuanQia)/1000 | S666: 31380/60*nMin*(1000+nGuanQia)/1000 | T666: 19320/60*nMin*(1000+nGuanQia)/1000 | U666: 喽啰 | V666: pet_21;pet_201;pet_93;pet_91; | W666: 4 | X666: 5 | Y666: 1,28000,8,0;1,19016,8,0;1,10007,5,0;1,10108,2,0;1,7,9000,0;1,8,9000,0;1,4,1000,0; | Z666: 0 | AA666: {} | AB666: n/60
A667: 663 | B667: 663 | C667: 663 | D667: 弑神试炼 | E667: 10501 | F667: 5 | G667: 3 | H667: 200663 | I667: 0 | J667: 480 | K667: 5000,0; | L667: 5 | M667: 5000,1; | N667: 39240/3600*(nPatrolSec+3)*(1000+nGuanQia)/1000 | O667: 31380/3600*(nPatrolSec+3)*(1000+nGuanQia)/1000 | P667: 19320/3600*(nPatrolSec+3)*(1000+nGuanQia)/1000 | Q667: nGuanQia + 1000 | R667: 39240/60*nMin*(1000+nGuanQia)/1000 | S667: 31380/60*nMin*(1000+nGuanQia)/1000 | T667: 19320/60*nMin*(1000+nGuanQia)/1000 | U667: 喽啰 | V667: pet_21;pet_201;pet_93;pet_91; | W667: 4 | X667: 5 | Y667: 1,28000,8,0;1,19016,8,0;1,10007,5,0;1,10108,2,0;1,7,9000,0;1,8,9000,0;1,4,1000,0; | Z667: 0 | AA667: {} | AB667: n/60
A668: 664 | B668: 664 | C668: 664 | D668: 弑神试炼 | E668: 10501 | F668: 5 | G668: 3 | H668: 200664 | I668: 0 | J668: 480 | K668: 5000,0; | L668: 5 | M668: 5000,1; | N668: 39240/3600*(nPatrolSec+3)*(1000+nGuanQia)/1000 | O668: 31380/3600*(nPatrolSec+3)*(1000+nGuanQia)/1000 | P668: 19320/3600*(nPatrolSec+3)*(1000+nGuanQia)/1000 | Q668: nGuanQia + 1000 | R668: 39240/60*nMin*(1000+nGuanQia)/1000 | S668: 31380/60*nMin*(1000+nGuanQia)/1000 | T668: 19320/60*nMin*(1000+nGuanQia)/1000 | U668: 喽啰 | V668: pet_21;pet_201;pet_93;pet_91; | W668: 4 | X668: 5 | Y668: 1,28000,8,0;1,19016,8,0;1,10007,5,0;1,10108,2,0;1,7,9000,0;1,8,9000,0;1,4,1000,0; | Z668: 0 | AA668: {} | AB668: n/60
A669: 665 | B669: 665 | C669: 665 | D669: 弑神试炼 | E669: 10501 | F669: 5 | G669: 3 | H669: 200665 | I669: 0 | J669: 480 | K669: 5000,0; | L669: 5 | M669: 5000,1; | N669: 39240/3600*(nPatrolSec+3)*(1000+nGuanQia)/1000 | O669: 31380/3600*(nPatrolSec+3)*(1000+nGuanQia)/1000 | P669: 19320/3600*(nPatrolSec+3)*(1000+nGuanQia)/1000 | Q669: nGuanQia + 1000 | R669: 39240/60*nMin*(1000+nGuanQia)/1000 | S669: 31380/60*nMin*(1000+nGuanQia)/1000 | T669: 19320/60*nMin*(1000+nGuanQia)/1000 | U669: 喽啰 | V669: pet_21;pet_201;pet_93;pet_91; | W669: 4 | X669: 5 | Y669: 1,28000,8,0;1,19016,8,0;1,10007,5,0;1,10108,2,0;1,7,9000,0;1,8,9000,0;1,4,1000,0; | Z669: 0 | AA669: {} | AB669: n/60
A670: 666 | B670: 666 | C670: 666 | D670: 弑神试炼 | E670: 10501 | F670: 5 | G670: 3 | H670: 200666 | I670: 0 | J670: 480 | K670: 5000,0; | L670: 5 | M670: 5000,1; | N670: 39240/3600*(nPatrolSec+3)*(1000+nGuanQia)/1000 | O670: 31380/3600*(nPatrolSec+3)*(1000+nGuanQia)/1000 | P670: 19320/3600*(nPatrolSec+3)*(1000+nGuanQia)/1000 | Q670: nGuanQia + 1000 | R670: 39240/60*nMin*(1000+nGuanQia)/1000 | S670: 31380/60*nMin*(1000+nGuanQia)/1000 | T670: 19320/60*nMin*(1000+nGuanQia)/1000 | U670: 喽啰 | V670: pet_21;pet_201;pet_93;pet_91; | W670: 4 | X670: 5 | Y670: 1,28000,8,0;1,19016,8,0;1,10007,5,0;1,10108,2,0;1,7,9000,0;1,8,9000,0;1,4,1000,0; | Z670: 0 | AA670: {} | AB670: n/60
A671: 667 | B671: 667 | C671: 667 | D671: 弑神试炼 | E671: 10501 | F671: 5 | G671: 3 | H671: 200667 | I671: 0 | J671: 480 | K671: 5000,0; | L671: 5 | M671: 5000,1; | N671: 39240/3600*(nPatrolSec+3)*(1000+nGuanQia)/1000 | O671: 31380/3600*(nPatrolSec+3)*(1000+nGuanQia)/1000 | P671: 19320/3600*(nPatrolSec+3)*(1000+nGuanQia)/1000 | Q671: nGuanQia + 1000 | R671: 39240/60*nMin*(1000+nGuanQia)/1000 | S671: 31380/60*nMin*(1000+nGuanQia)/1000 | T671: 19320/60*nMin*(1000+nGuanQia)/1000 | U671: 喽啰 | V671: pet_21;pet_201;pet_93;pet_91; | W671: 4 | X671: 5 | Y671: 1,28000,8,0;1,19016,8,0;1,10007,5,0;1,10108,2,0;1,7,9000,0;1,8,9000,0;1,4,1000,0; | Z671: 0 | AA671: {} | AB671: n/60
A672: 668 | B672: 668 | C672: 668 | D672: 弑神试炼 | E672: 10501 | F672: 5 | G672: 3 | H672: 200668 | I672: 0 | J672: 480 | K672: 5000,0; | L672: 5 | M672: 5000,1; | N672: 39240/3600*(nPatrolSec+3)*(1000+nGuanQia)/1000 | O672: 31380/3600*(nPatrolSec+3)*(1000+nGuanQia)/1000 | P672: 19320/3600*(nPatrolSec+3)*(1000+nGuanQia)/1000 | Q672: nGuanQia + 1000 | R672: 39240/60*nMin*(1000+nGuanQia)/1000 | S672: 31380/60*nMin*(1000+nGuanQia)/1000 | T672: 19320/60*nMin*(1000+nGuanQia)/1000 | U672: 喽啰 | V672: pet_21;pet_201;pet_93;pet_91; | W672: 4 | X672: 5 | Y672: 1,28000,8,0;1,19016,8,0;1,10007,5,0;1,10108,2,0;1,7,9000,0;1,8,9000,0;1,4,1000,0; | Z672: 0 | AA672: {} | AB672: n/60
A673: 669 | B673: 669 | C673: 669 | D673: 弑神试炼 | E673: 10501 | F673: 5 | G673: 3 | H673: 200669 | I673: 0 | J673: 480 | K673: 5000,0; | L673: 5 | M673: 5000,1; | N673: 39240/3600*(nPatrolSec+3)*(1000+nGuanQia)/1000 | O673: 31380/3600*(nPatrolSec+3)*(1000+nGuanQia)/1000 | P673: 19320/3600*(nPatrolSec+3)*(1000+nGuanQia)/1000 | Q673: nGuanQia + 1000 | R673: 39240/60*nMin*(1000+nGuanQia)/1000 | S673: 31380/60*nMin*(1000+nGuanQia)/1000 | T673: 19320/60*nMin*(1000+nGuanQia)/1000 | U673: 喽啰 | V673: pet_21;pet_201;pet_93;pet_91; | W673: 4 | X673: 5 | Y673: 1,28000,8,0;1,19016,8,0;1,10007,5,0;1,10108,2,0;1,7,9000,0;1,8,9000,0;1,4,1000,0; | Z673: 0 | AA673: {} | AB673: n/60
A674: 670 | B674: 670 | C674: 670 | D674: 弑神试炼 | E674: 10501 | F674: 5 | G674: 3 | H674: 200670 | I674: 0 | J674: 480 | K674: 5000,0; | L674: 5 | M674: 5000,1; | N674: 39240/3600*(nPatrolSec+3)*(1000+nGuanQia)/1000 | O674: 31380/3600*(nPatrolSec+3)*(1000+nGuanQia)/1000 | P674: 19320/3600*(nPatrolSec+3)*(1000+nGuanQia)/1000 | Q674: nGuanQia + 1000 | R674: 39240/60*nMin*(1000+nGuanQia)/1000 | S674: 31380/60*nMin*(1000+nGuanQia)/1000 | T674: 19320/60*nMin*(1000+nGuanQia)/1000 | U674: 喽啰 | V674: pet_21;pet_201;pet_93;pet_91; | W674: 4 | X674: 5 | Y674: 1,28000,8,0;1,19016,8,0;1,10007,5,0;1,10108,2,0;1,7,9000,0;1,8,9000,0;1,4,1000,0; | Z674: 0 | AA674: {} | AB674: n/60
A675: 671 | B675: 671 | C675: 671 | D675: 弑神试炼 | E675: 10501 | F675: 5 | G675: 3 | H675: 200671 | I675: 0 | J675: 480 | K675: 5000,0; | L675: 5 | M675: 5000,1; | N675: 39240/3600*(nPatrolSec+3)*(1000+nGuanQia)/1000 | O675: 31380/3600*(nPatrolSec+3)*(1000+nGuanQia)/1000 | P675: 19320/3600*(nPatrolSec+3)*(1000+nGuanQia)/1000 | Q675: nGuanQia + 1000 | R675: 39240/60*nMin*(1000+nGuanQia)/1000 | S675: 31380/60*nMin*(1000+nGuanQia)/1000 | T675: 19320/60*nMin*(1000+nGuanQia)/1000 | U675: 喽啰 | V675: pet_21;pet_201;pet_93;pet_91; | W675: 4 | X675: 5 | Y675: 1,28000,8,0;1,19016,8,0;1,10007,5,0;1,10108,2,0;1,7,9000,0;1,8,9000,0;1,4,1000,0; | Z675: 0 | AA675: {} | AB675: n/60
A676: 672 | B676: 672 | C676: 672 | D676: 弑神试炼 | E676: 10501 | F676: 5 | G676: 3 | H676: 200672 | I676: 0 | J676: 480 | K676: 5000,0; | L676: 5 | M676: 5000,1; | N676: 39240/3600*(nPatrolSec+3)*(1000+nGuanQia)/1000 | O676: 31380/3600*(nPatrolSec+3)*(1000+nGuanQia)/1000 | P676: 19320/3600*(nPatrolSec+3)*(1000+nGuanQia)/1000 | Q676: nGuanQia + 1000 | R676: 39240/60*nMin*(1000+nGuanQia)/1000 | S676: 31380/60*nMin*(1000+nGuanQia)/1000 | T676: 19320/60*nMin*(1000+nGuanQia)/1000 | U676: 喽啰 | V676: pet_21;pet_201;pet_93;pet_91; | W676: 4 | X676: 5 | Y676: 1,28000,8,0;1,19016,8,0;1,10007,5,0;1,10108,2,0;1,7,9000,0;1,8,9000,0;1,4,1000,0; | Z676: 0 | AA676: {} | AB676: n/60
A677: 673 | B677: 673 | C677: 673 | D677: 弑神试炼 | E677: 10501 | F677: 5 | G677: 3 | H677: 200673 | I677: 0 | J677: 480 | K677: 5000,0; | L677: 5 | M677: 5000,1; | N677: 39240/3600*(nPatrolSec+3)*(1000+nGuanQia)/1000 | O677: 31380/3600*(nPatrolSec+3)*(1000+nGuanQia)/1000 | P677: 19320/3600*(nPatrolSec+3)*(1000+nGuanQia)/1000 | Q677: nGuanQia + 1000 | R677: 39240/60*nMin*(1000+nGuanQia)/1000 | S677: 31380/60*nMin*(1000+nGuanQia)/1000 | T677: 19320/60*nMin*(1000+nGuanQia)/1000 | U677: 喽啰 | V677: pet_21;pet_201;pet_93;pet_91; | W677: 4 | X677: 5 | Y677: 1,28000,8,0;1,19016,8,0;1,10007,5,0;1,10108,2,0;1,7,9000,0;1,8,9000,0;1,4,1000,0; | Z677: 0 | AA677: {} | AB677: n/60
A678: 674 | B678: 674 | C678: 674 | D678: 弑神试炼 | E678: 10501 | F678: 5 | G678: 3 | H678: 200674 | I678: 0 | J678: 480 | K678: 5000,0; | L678: 5 | M678: 5000,1; | N678: 39240/3600*(nPatrolSec+3)*(1000+nGuanQia)/1000 | O678: 31380/3600*(nPatrolSec+3)*(1000+nGuanQia)/1000 | P678: 19320/3600*(nPatrolSec+3)*(1000+nGuanQia)/1000 | Q678: nGuanQia + 1000 | R678: 39240/60*nMin*(1000+nGuanQia)/1000 | S678: 31380/60*nMin*(1000+nGuanQia)/1000 | T678: 19320/60*nMin*(1000+nGuanQia)/1000 | U678: 喽啰 | V678: pet_21;pet_201;pet_93;pet_91; | W678: 4 | X678: 5 | Y678: 1,28000,8,0;1,19016,8,0;1,10007,5,0;1,10108,2,0;1,7,9000,0;1,8,9000,0;1,4,1000,0; | Z678: 0 | AA678: {} | AB678: n/60
A679: 675 | B679: 675 | C679: 675 | D679: 弑神试炼 | E679: 10501 | F679: 5 | G679: 3 | H679: 200675 | I679: 0 | J679: 480 | K679: 5000,0; | L679: 5 | M679: 5000,1; | N679: 39240/3600*(nPatrolSec+3)*(1000+nGuanQia)/1000 | O679: 31380/3600*(nPatrolSec+3)*(1000+nGuanQia)/1000 | P679: 19320/3600*(nPatrolSec+3)*(1000+nGuanQia)/1000 | Q679: nGuanQia + 1000 | R679: 39240/60*nMin*(1000+nGuanQia)/1000 | S679: 31380/60*nMin*(1000+nGuanQia)/1000 | T679: 19320/60*nMin*(1000+nGuanQia)/1000 | U679: 喽啰 | V679: pet_21;pet_201;pet_93;pet_91; | W679: 4 | X679: 5 | Y679: 1,28000,8,0;1,19016,8,0;1,10007,5,0;1,10108,2,0;1,7,9000,0;1,8,9000,0;1,4,1000,0; | Z679: 0 | AA679: {} | AB679: n/60
A680: 676 | B680: 676 | C680: 676 | D680: 弑神试炼 | E680: 10501 | F680: 5 | G680: 3 | H680: 200676 | I680: 0 | J680: 480 | K680: 5000,0; | L680: 5 | M680: 5000,1; | N680: 39240/3600*(nPatrolSec+3)*(1000+nGuanQia)/1000 | O680: 31380/3600*(nPatrolSec+3)*(1000+nGuanQia)/1000 | P680: 19320/3600*(nPatrolSec+3)*(1000+nGuanQia)/1000 | Q680: nGuanQia + 1000 | R680: 39240/60*nMin*(1000+nGuanQia)/1000 | S680: 31380/60*nMin*(1000+nGuanQia)/1000 | T680: 19320/60*nMin*(1000+nGuanQia)/1000 | U680: 喽啰 | V680: pet_21;pet_201;pet_93;pet_91; | W680: 4 | X680: 5 | Y680: 1,28000,8,0;1,19016,8,0;1,10007,5,0;1,10108,2,0;1,7,9000,0;1,8,9000,0;1,4,1000,0; | Z680: 0 | AA680: {} | AB680: n/60
A681: 677 | B681: 677 | C681: 677 | D681: 弑神试炼 | E681: 10501 | F681: 5 | G681: 3 | H681: 200677 | I681: 0 | J681: 480 | K681: 5000,0; | L681: 5 | M681: 5000,1; | N681: 39240/3600*(nPatrolSec+3)*(1000+nGuanQia)/1000 | O681: 31380/3600*(nPatrolSec+3)*(1000+nGuanQia)/1000 | P681: 19320/3600*(nPatrolSec+3)*(1000+nGuanQia)/1000 | Q681: nGuanQia + 1000 | R681: 39240/60*nMin*(1000+nGuanQia)/1000 | S681: 31380/60*nMin*(1000+nGuanQia)/1000 | T681: 19320/60*nMin*(1000+nGuanQia)/1000 | U681: 喽啰 | V681: pet_21;pet_201;pet_93;pet_91; | W681: 4 | X681: 5 | Y681: 1,28000,8,0;1,19016,8,0;1,10007,5,0;1,10108,2,0;1,7,9000,0;1,8,9000,0;1,4,1000,0; | Z681: 0 | AA681: {} | AB681: n/60
A682: 678 | B682: 678 | C682: 678 | D682: 弑神试炼 | E682: 10501 | F682: 5 | G682: 3 | H682: 200678 | I682: 0 | J682: 480 | K682: 5000,0; | L682: 5 | M682: 5000,1; | N682: 39240/3600*(nPatrolSec+3)*(1000+nGuanQia)/1000 | O682: 31380/3600*(nPatrolSec+3)*(1000+nGuanQia)/1000 | P682: 19320/3600*(nPatrolSec+3)*(1000+nGuanQia)/1000 | Q682: nGuanQia + 1000 | R682: 39240/60*nMin*(1000+nGuanQia)/1000 | S682: 31380/60*nMin*(1000+nGuanQia)/1000 | T682: 19320/60*nMin*(1000+nGuanQia)/1000 | U682: 喽啰 | V682: pet_21;pet_201;pet_93;pet_91; | W682: 4 | X682: 5 | Y682: 1,28000,8,0;1,19016,8,0;1,10007,5,0;1,10108,2,0;1,7,9000,0;1,8,9000,0;1,4,1000,0; | Z682: 0 | AA682: {} | AB682: n/60
A683: 679 | B683: 679 | C683: 679 | D683: 弑神试炼 | E683: 10501 | F683: 5 | G683: 3 | H683: 200679 | I683: 0 | J683: 480 | K683: 5000,0; | L683: 5 | M683: 5000,1; | N683: 39240/3600*(nPatrolSec+3)*(1000+nGuanQia)/1000 | O683: 31380/3600*(nPatrolSec+3)*(1000+nGuanQia)/1000 | P683: 19320/3600*(nPatrolSec+3)*(1000+nGuanQia)/1000 | Q683: nGuanQia + 1000 | R683: 39240/60*nMin*(1000+nGuanQia)/1000 | S683: 31380/60*nMin*(1000+nGuanQia)/1000 | T683: 19320/60*nMin*(1000+nGuanQia)/1000 | U683: 喽啰 | V683: pet_21;pet_201;pet_93;pet_91; | W683: 4 | X683: 5 | Y683: 1,28000,8,0;1,19016,8,0;1,10007,5,0;1,10108,2,0;1,7,9000,0;1,8,9000,0;1,4,1000,0; | Z683: 0 | AA683: {} | AB683: n/60
A684: 680 | B684: 680 | C684: 680 | D684: 弑神试炼 | E684: 10501 | F684: 5 | G684: 3 | H684: 200680 | I684: 0 | J684: 480 | K684: 5000,0; | L684: 5 | M684: 5000,1; | N684: 39240/3600*(nPatrolSec+3)*(1000+nGuanQia)/1000 | O684: 31380/3600*(nPatrolSec+3)*(1000+nGuanQia)/1000 | P684: 19320/3600*(nPatrolSec+3)*(1000+nGuanQia)/1000 | Q684: nGuanQia + 1000 | R684: 39240/60*nMin*(1000+nGuanQia)/1000 | S684: 31380/60*nMin*(1000+nGuanQia)/1000 | T684: 19320/60*nMin*(1000+nGuanQia)/1000 | U684: 喽啰 | V684: pet_21;pet_201;pet_93;pet_91; | W684: 4 | X684: 5 | Y684: 1,28000,8,0;1,19016,8,0;1,10007,5,0;1,10108,2,0;1,7,9000,0;1,8,9000,0;1,4,1000,0; | Z684: 0 | AA684: {} | AB684: n/60
A685: 681 | B685: 681 | C685: 681 | D685: 弑神试炼 | E685: 10501 | F685: 5 | G685: 3 | H685: 200681 | I685: 0 | J685: 480 | K685: 5000,0; | L685: 5 | M685: 5000,1; | N685: 39240/3600*(nPatrolSec+3)*(1000+nGuanQia)/1000 | O685: 31380/3600*(nPatrolSec+3)*(1000+nGuanQia)/1000 | P685: 19320/3600*(nPatrolSec+3)*(1000+nGuanQia)/1000 | Q685: nGuanQia + 1000 | R685: 39240/60*nMin*(1000+nGuanQia)/1000 | S685: 31380/60*nMin*(1000+nGuanQia)/1000 | T685: 19320/60*nMin*(1000+nGuanQia)/1000 | U685: 喽啰 | V685: pet_21;pet_201;pet_93;pet_91; | W685: 4 | X685: 5 | Y685: 1,28000,8,0;1,19016,8,0;1,10007,5,0;1,10108,2,0;1,7,9000,0;1,8,9000,0;1,4,1000,0; | Z685: 0 | AA685: {} | AB685: n/60
A686: 682 | B686: 682 | C686: 682 | D686: 弑神试炼 | E686: 10501 | F686: 5 | G686: 3 | H686: 200682 | I686: 0 | J686: 480 | K686: 5000,0; | L686: 5 | M686: 5000,1; | N686: 39240/3600*(nPatrolSec+3)*(1000+nGuanQia)/1000 | O686: 31380/3600*(nPatrolSec+3)*(1000+nGuanQia)/1000 | P686: 19320/3600*(nPatrolSec+3)*(1000+nGuanQia)/1000 | Q686: nGuanQia + 1000 | R686: 39240/60*nMin*(1000+nGuanQia)/1000 | S686: 31380/60*nMin*(1000+nGuanQia)/1000 | T686: 19320/60*nMin*(1000+nGuanQia)/1000 | U686: 喽啰 | V686: pet_21;pet_201;pet_93;pet_91; | W686: 4 | X686: 5 | Y686: 1,28000,8,0;1,19016,8,0;1,10007,5,0;1,10108,2,0;1,7,9000,0;1,8,9000,0;1,4,1000,0; | Z686: 0 | AA686: {} | AB686: n/60
A687: 683 | B687: 683 | C687: 683 | D687: 弑神试炼 | E687: 10501 | F687: 5 | G687: 3 | H687: 200683 | I687: 0 | J687: 480 | K687: 5000,0; | L687: 5 | M687: 5000,1; | N687: 39240/3600*(nPatrolSec+3)*(1000+nGuanQia)/1000 | O687: 31380/3600*(nPatrolSec+3)*(1000+nGuanQia)/1000 | P687: 19320/3600*(nPatrolSec+3)*(1000+nGuanQia)/1000 | Q687: nGuanQia + 1000 | R687: 39240/60*nMin*(1000+nGuanQia)/1000 | S687: 31380/60*nMin*(1000+nGuanQia)/1000 | T687: 19320/60*nMin*(1000+nGuanQia)/1000 | U687: 喽啰 | V687: pet_21;pet_201;pet_93;pet_91; | W687: 4 | X687: 5 | Y687: 1,28000,8,0;1,19016,8,0;1,10007,5,0;1,10108,2,0;1,7,9000,0;1,8,9000,0;1,4,1000,0; | Z687: 0 | AA687: {} | AB687: n/60
A688: 684 | B688: 684 | C688: 684 | D688: 弑神试炼 | E688: 10501 | F688: 5 | G688: 3 | H688: 200684 | I688: 0 | J688: 480 | K688: 5000,0; | L688: 5 | M688: 5000,1; | N688: 39240/3600*(nPatrolSec+3)*(1000+nGuanQia)/1000 | O688: 31380/3600*(nPatrolSec+3)*(1000+nGuanQia)/1000 | P688: 19320/3600*(nPatrolSec+3)*(1000+nGuanQia)/1000 | Q688: nGuanQia + 1000 | R688: 39240/60*nMin*(1000+nGuanQia)/1000 | S688: 31380/60*nMin*(1000+nGuanQia)/1000 | T688: 19320/60*nMin*(1000+nGuanQia)/1000 | U688: 喽啰 | V688: pet_21;pet_201;pet_93;pet_91; | W688: 4 | X688: 5 | Y688: 1,28000,8,0;1,19016,8,0;1,10007,5,0;1,10108,2,0;1,7,9000,0;1,8,9000,0;1,4,1000,0; | Z688: 0 | AA688: {} | AB688: n/60
A689: 685 | B689: 685 | C689: 685 | D689: 弑神试炼 | E689: 10501 | F689: 5 | G689: 3 | H689: 200685 | I689: 0 | J689: 480 | K689: 5000,0; | L689: 5 | M689: 5000,1; | N689: 39240/3600*(nPatrolSec+3)*(1000+nGuanQia)/1000 | O689: 31380/3600*(nPatrolSec+3)*(1000+nGuanQia)/1000 | P689: 19320/3600*(nPatrolSec+3)*(1000+nGuanQia)/1000 | Q689: nGuanQia + 1000 | R689: 39240/60*nMin*(1000+nGuanQia)/1000 | S689: 31380/60*nMin*(1000+nGuanQia)/1000 | T689: 19320/60*nMin*(1000+nGuanQia)/1000 | U689: 喽啰 | V689: pet_21;pet_201;pet_93;pet_91; | W689: 4 | X689: 5 | Y689: 1,28000,8,0;1,19016,8,0;1,10007,5,0;1,10108,2,0;1,7,9000,0;1,8,9000,0;1,4,1000,0; | Z689: 0 | AA689: {} | AB689: n/60
A690: 686 | B690: 686 | C690: 686 | D690: 弑神试炼 | E690: 10501 | F690: 5 | G690: 3 | H690: 200686 | I690: 0 | J690: 480 | K690: 5000,0; | L690: 5 | M690: 5000,1; | N690: 39240/3600*(nPatrolSec+3)*(1000+nGuanQia)/1000 | O690: 31380/3600*(nPatrolSec+3)*(1000+nGuanQia)/1000 | P690: 19320/3600*(nPatrolSec+3)*(1000+nGuanQia)/1000 | Q690: nGuanQia + 1000 | R690: 39240/60*nMin*(1000+nGuanQia)/1000 | S690: 31380/60*nMin*(1000+nGuanQia)/1000 | T690: 19320/60*nMin*(1000+nGuanQia)/1000 | U690: 喽啰 | V690: pet_21;pet_201;pet_93;pet_91; | W690: 4 | X690: 5 | Y690: 1,28000,8,0;1,19016,8,0;1,10007,5,0;1,10108,2,0;1,7,9000,0;1,8,9000,0;1,4,1000,0; | Z690: 0 | AA690: {} | AB690: n/60
A691: 687 | B691: 687 | C691: 687 | D691: 弑神试炼 | E691: 10501 | F691: 5 | G691: 3 | H691: 200687 | I691: 0 | J691: 480 | K691: 5000,0; | L691: 5 | M691: 5000,1; | N691: 39240/3600*(nPatrolSec+3)*(1000+nGuanQia)/1000 | O691: 31380/3600*(nPatrolSec+3)*(1000+nGuanQia)/1000 | P691: 19320/3600*(nPatrolSec+3)*(1000+nGuanQia)/1000 | Q691: nGuanQia + 1000 | R691: 39240/60*nMin*(1000+nGuanQia)/1000 | S691: 31380/60*nMin*(1000+nGuanQia)/1000 | T691: 19320/60*nMin*(1000+nGuanQia)/1000 | U691: 喽啰 | V691: pet_21;pet_201;pet_93;pet_91; | W691: 4 | X691: 5 | Y691: 1,28000,8,0;1,19016,8,0;1,10007,5,0;1,10108,2,0;1,7,9000,0;1,8,9000,0;1,4,1000,0; | Z691: 0 | AA691: {} | AB691: n/60
A692: 688 | B692: 688 | C692: 688 | D692: 弑神试炼 | E692: 10501 | F692: 5 | G692: 3 | H692: 200688 | I692: 0 | J692: 480 | K692: 5000,0; | L692: 5 | M692: 5000,1; | N692: 39240/3600*(nPatrolSec+3)*(1000+nGuanQia)/1000 | O692: 31380/3600*(nPatrolSec+3)*(1000+nGuanQia)/1000 | P692: 19320/3600*(nPatrolSec+3)*(1000+nGuanQia)/1000 | Q692: nGuanQia + 1000 | R692: 39240/60*nMin*(1000+nGuanQia)/1000 | S692: 31380/60*nMin*(1000+nGuanQia)/1000 | T692: 19320/60*nMin*(1000+nGuanQia)/1000 | U692: 喽啰 | V692: pet_21;pet_201;pet_93;pet_91; | W692: 4 | X692: 5 | Y692: 1,28000,8,0;1,19016,8,0;1,10007,5,0;1,10108,2,0;1,7,9000,0;1,8,9000,0;1,4,1000,0; | Z692: 0 | AA692: {} | AB692: n/60
A693: 689 | B693: 689 | C693: 689 | D693: 弑神试炼 | E693: 10501 | F693: 5 | G693: 3 | H693: 200689 | I693: 0 | J693: 480 | K693: 5000,0; | L693: 5 | M693: 5000,1; | N693: 39240/3600*(nPatrolSec+3)*(1000+nGuanQia)/1000 | O693: 31380/3600*(nPatrolSec+3)*(1000+nGuanQia)/1000 | P693: 19320/3600*(nPatrolSec+3)*(1000+nGuanQia)/1000 | Q693: nGuanQia + 1000 | R693: 39240/60*nMin*(1000+nGuanQia)/1000 | S693: 31380/60*nMin*(1000+nGuanQia)/1000 | T693: 19320/60*nMin*(1000+nGuanQia)/1000 | U693: 喽啰 | V693: pet_21;pet_201;pet_93;pet_91; | W693: 4 | X693: 5 | Y693: 1,28000,8,0;1,19016,8,0;1,10007,5,0;1,10108,2,0;1,7,9000,0;1,8,9000,0;1,4,1000,0; | Z693: 0 | AA693: {} | AB693: n/60
A694: 690 | B694: 690 | C694: 690 | D694: 弑神试炼 | E694: 10501 | F694: 5 | G694: 3 | H694: 200690 | I694: 0 | J694: 480 | K694: 5000,0; | L694: 5 | M694: 5000,1; | N694: 39240/3600*(nPatrolSec+3)*(1000+nGuanQia)/1000 | O694: 31380/3600*(nPatrolSec+3)*(1000+nGuanQia)/1000 | P694: 19320/3600*(nPatrolSec+3)*(1000+nGuanQia)/1000 | Q694: nGuanQia + 1000 | R694: 39240/60*nMin*(1000+nGuanQia)/1000 | S694: 31380/60*nMin*(1000+nGuanQia)/1000 | T694: 19320/60*nMin*(1000+nGuanQia)/1000 | U694: 喽啰 | V694: pet_21;pet_201;pet_93;pet_91; | W694: 4 | X694: 5 | Y694: 1,28000,8,0;1,19016,8,0;1,10007,5,0;1,10108,2,0;1,7,9000,0;1,8,9000,0;1,4,1000,0; | Z694: 0 | AA694: {} | AB694: n/60
A695: 691 | B695: 691 | C695: 691 | D695: 弑神试炼 | E695: 10501 | F695: 5 | G695: 3 | H695: 200691 | I695: 0 | J695: 480 | K695: 5000,0; | L695: 5 | M695: 5000,1; | N695: 39240/3600*(nPatrolSec+3)*(1000+nGuanQia)/1000 | O695: 31380/3600*(nPatrolSec+3)*(1000+nGuanQia)/1000 | P695: 19320/3600*(nPatrolSec+3)*(1000+nGuanQia)/1000 | Q695: nGuanQia + 1000 | R695: 39240/60*nMin*(1000+nGuanQia)/1000 | S695: 31380/60*nMin*(1000+nGuanQia)/1000 | T695: 19320/60*nMin*(1000+nGuanQia)/1000 | U695: 喽啰 | V695: pet_21;pet_201;pet_93;pet_91; | W695: 4 | X695: 5 | Y695: 1,28000,8,0;1,19016,8,0;1,10007,5,0;1,10108,2,0;1,7,9000,0;1,8,9000,0;1,4,1000,0; | Z695: 0 | AA695: {} | AB695: n/60
A696: 692 | B696: 692 | C696: 692 | D696: 弑神试炼 | E696: 10501 | F696: 5 | G696: 3 | H696: 200692 | I696: 0 | J696: 480 | K696: 5000,0; | L696: 5 | M696: 5000,1; | N696: 39240/3600*(nPatrolSec+3)*(1000+nGuanQia)/1000 | O696: 31380/3600*(nPatrolSec+3)*(1000+nGuanQia)/1000 | P696: 19320/3600*(nPatrolSec+3)*(1000+nGuanQia)/1000 | Q696: nGuanQia + 1000 | R696: 39240/60*nMin*(1000+nGuanQia)/1000 | S696: 31380/60*nMin*(1000+nGuanQia)/1000 | T696: 19320/60*nMin*(1000+nGuanQia)/1000 | U696: 喽啰 | V696: pet_21;pet_201;pet_93;pet_91; | W696: 4 | X696: 5 | Y696: 1,28000,8,0;1,19016,8,0;1,10007,5,0;1,10108,2,0;1,7,9000,0;1,8,9000,0;1,4,1000,0; | Z696: 0 | AA696: {} | AB696: n/60
A697: 693 | B697: 693 | C697: 693 | D697: 弑神试炼 | E697: 10501 | F697: 5 | G697: 3 | H697: 200693 | I697: 0 | J697: 480 | K697: 5000,0; | L697: 5 | M697: 5000,1; | N697: 39240/3600*(nPatrolSec+3)*(1000+nGuanQia)/1000 | O697: 31380/3600*(nPatrolSec+3)*(1000+nGuanQia)/1000 | P697: 19320/3600*(nPatrolSec+3)*(1000+nGuanQia)/1000 | Q697: nGuanQia + 1000 | R697: 39240/60*nMin*(1000+nGuanQia)/1000 | S697: 31380/60*nMin*(1000+nGuanQia)/1000 | T697: 19320/60*nMin*(1000+nGuanQia)/1000 | U697: 喽啰 | V697: pet_21;pet_201;pet_93;pet_91; | W697: 4 | X697: 5 | Y697: 1,28000,8,0;1,19016,8,0;1,10007,5,0;1,10108,2,0;1,7,9000,0;1,8,9000,0;1,4,1000,0; | Z697: 0 | AA697: {} | AB697: n/60
A698: 694 | B698: 694 | C698: 694 | D698: 弑神试炼 | E698: 10501 | F698: 5 | G698: 3 | H698: 200694 | I698: 0 | J698: 480 | K698: 5000,0; | L698: 5 | M698: 5000,1; | N698: 39240/3600*(nPatrolSec+3)*(1000+nGuanQia)/1000 | O698: 31380/3600*(nPatrolSec+3)*(1000+nGuanQia)/1000 | P698: 19320/3600*(nPatrolSec+3)*(1000+nGuanQia)/1000 | Q698: nGuanQia + 1000 | R698: 39240/60*nMin*(1000+nGuanQia)/1000 | S698: 31380/60*nMin*(1000+nGuanQia)/1000 | T698: 19320/60*nMin*(1000+nGuanQia)/1000 | U698: 喽啰 | V698: pet_21;pet_201;pet_93;pet_91; | W698: 4 | X698: 5 | Y698: 1,28000,8,0;1,19016,8,0;1,10007,5,0;1,10108,2,0;1,7,9000,0;1,8,9000,0;1,4,1000,0; | Z698: 0 | AA698: {} | AB698: n/60
A699: 695 | B699: 695 | C699: 695 | D699: 弑神试炼 | E699: 10501 | F699: 5 | G699: 3 | H699: 200695 | I699: 0 | J699: 480 | K699: 5000,0; | L699: 5 | M699: 5000,1; | N699: 39240/3600*(nPatrolSec+3)*(1000+nGuanQia)/1000 | O699: 31380/3600*(nPatrolSec+3)*(1000+nGuanQia)/1000 | P699: 19320/3600*(nPatrolSec+3)*(1000+nGuanQia)/1000 | Q699: nGuanQia + 1000 | R699: 39240/60*nMin*(1000+nGuanQia)/1000 | S699: 31380/60*nMin*(1000+nGuanQia)/1000 | T699: 19320/60*nMin*(1000+nGuanQia)/1000 | U699: 喽啰 | V699: pet_21;pet_201;pet_93;pet_91; | W699: 4 | X699: 5 | Y699: 1,28000,8,0;1,19016,8,0;1,10007,5,0;1,10108,2,0;1,7,9000,0;1,8,9000,0;1,4,1000,0; | Z699: 0 | AA699: {} | AB699: n/60
A700: 696 | B700: 696 | C700: 696 | D700: 弑神试炼 | E700: 10501 | F700: 5 | G700: 3 | H700: 200696 | I700: 0 | J700: 480 | K700: 5000,0; | L700: 5 | M700: 5000,1; | N700: 39240/3600*(nPatrolSec+3)*(1000+nGuanQia)/1000 | O700: 31380/3600*(nPatrolSec+3)*(1000+nGuanQia)/1000 | P700: 19320/3600*(nPatrolSec+3)*(1000+nGuanQia)/1000 | Q700: nGuanQia + 1000 | R700: 39240/60*nMin*(1000+nGuanQia)/1000 | S700: 31380/60*nMin*(1000+nGuanQia)/1000 | T700: 19320/60*nMin*(1000+nGuanQia)/1000 | U700: 喽啰 | V700: pet_21;pet_201;pet_93;pet_91; | W700: 4 | X700: 5 | Y700: 1,28000,8,0;1,19016,8,0;1,10007,5,0;1,10108,2,0;1,7,9000,0;1,8,9000,0;1,4,1000,0; | Z700: 0 | AA700: {} | AB700: n/60
A701: 697 | B701: 697 | C701: 697 | D701: 弑神试炼 | E701: 10501 | F701: 5 | G701: 3 | H701: 200697 | I701: 0 | J701: 480 | K701: 5000,0; | L701: 5 | M701: 5000,1; | N701: 39240/3600*(nPatrolSec+3)*(1000+nGuanQia)/1000 | O701: 31380/3600*(nPatrolSec+3)*(1000+nGuanQia)/1000 | P701: 19320/3600*(nPatrolSec+3)*(1000+nGuanQia)/1000 | Q701: nGuanQia + 1000 | R701: 39240/60*nMin*(1000+nGuanQia)/1000 | S701: 31380/60*nMin*(1000+nGuanQia)/1000 | T701: 19320/60*nMin*(1000+nGuanQia)/1000 | U701: 喽啰 | V701: pet_21;pet_201;pet_93;pet_91; | W701: 4 | X701: 5 | Y701: 1,28000,8,0;1,19016,8,0;1,10007,5,0;1,10108,2,0;1,7,9000,0;1,8,9000,0;1,4,1000,0; | Z701: 0 | AA701: {} | AB701: n/60
A702: 698 | B702: 698 | C702: 698 | D702: 弑神试炼 | E702: 10501 | F702: 5 | G702: 3 | H702: 200698 | I702: 0 | J702: 480 | K702: 5000,0; | L702: 5 | M702: 5000,1; | N702: 39240/3600*(nPatrolSec+3)*(1000+nGuanQia)/1000 | O702: 31380/3600*(nPatrolSec+3)*(1000+nGuanQia)/1000 | P702: 19320/3600*(nPatrolSec+3)*(1000+nGuanQia)/1000 | Q702: nGuanQia + 1000 | R702: 39240/60*nMin*(1000+nGuanQia)/1000 | S702: 31380/60*nMin*(1000+nGuanQia)/1000 | T702: 19320/60*nMin*(1000+nGuanQia)/1000 | U702: 喽啰 | V702: pet_21;pet_201;pet_93;pet_91; | W702: 4 | X702: 5 | Y702: 1,28000,8,0;1,19016,8,0;1,10007,5,0;1,10108,2,0;1,7,9000,0;1,8,9000,0;1,4,1000,0; | Z702: 0 | AA702: {} | AB702: n/60
A703: 699 | B703: 699 | C703: 699 | D703: 弑神试炼 | E703: 10501 | F703: 5 | G703: 3 | H703: 200699 | I703: 0 | J703: 480 | K703: 5000,0; | L703: 5 | M703: 5000,1; | N703: 39240/3600*(nPatrolSec+3)*(1000+nGuanQia)/1000 | O703: 31380/3600*(nPatrolSec+3)*(1000+nGuanQia)/1000 | P703: 19320/3600*(nPatrolSec+3)*(1000+nGuanQia)/1000 | Q703: nGuanQia + 1000 | R703: 39240/60*nMin*(1000+nGuanQia)/1000 | S703: 31380/60*nMin*(1000+nGuanQia)/1000 | T703: 19320/60*nMin*(1000+nGuanQia)/1000 | U703: 喽啰 | V703: pet_21;pet_201;pet_93;pet_91; | W703: 4 | X703: 5 | Y703: 1,28000,8,0;1,19016,8,0;1,10007,5,0;1,10108,2,0;1,7,9000,0;1,8,9000,0;1,4,1000,0; | Z703: 0 | AA703: {} | AB703: n/60
A704: 700 | B704: 700 | C704: 700 | D704: 弑神试炼 | E704: 10501 | F704: 5 | G704: 3 | H704: 200700 | I704: 0 | J704: 480 | K704: 5000,0; | L704: 5 | M704: 5000,1; | N704: 39240/3600*(nPatrolSec+3)*(1000+nGuanQia)/1000 | O704: 31380/3600*(nPatrolSec+3)*(1000+nGuanQia)/1000 | P704: 19320/3600*(nPatrolSec+3)*(1000+nGuanQia)/1000 | Q704: nGuanQia + 1000 | R704: 39240/60*nMin*(1000+nGuanQia)/1000 | S704: 31380/60*nMin*(1000+nGuanQia)/1000 | T704: 19320/60*nMin*(1000+nGuanQia)/1000 | U704: 喽啰 | V704: pet_21;pet_201;pet_93;pet_91; | W704: 4 | X704: 5 | Y704: 1,28000,8,0;1,19016,8,0;1,10007,5,0;1,10108,2,0;1,7,9000,0;1,8,9000,0;1,4,1000,0; | Z704: 0 | AA704: {} | AB704: n/60
A705: 701 | B705: 701 | C705: 701 | D705: 弑神试炼 | E705: 10501 | F705: 5 | G705: 3 | H705: 200701 | I705: 0 | J705: 480 | K705: 5000,0; | L705: 5 | M705: 5000,1; | N705: 39240/3600*(nPatrolSec+3)*(1000+nGuanQia)/1000 | O705: 31380/3600*(nPatrolSec+3)*(1000+nGuanQia)/1000 | P705: 19320/3600*(nPatrolSec+3)*(1000+nGuanQia)/1000 | Q705: nGuanQia + 1000 | R705: 39240/60*nMin*(1000+nGuanQia)/1000 | S705: 31380/60*nMin*(1000+nGuanQia)/1000 | T705: 19320/60*nMin*(1000+nGuanQia)/1000 | U705: 喽啰 | V705: pet_21;pet_201;pet_93;pet_91; | W705: 4 | X705: 5 | Y705: 1,28000,8,0;1,19016,8,0;1,10007,5,0;1,10108,2,0;1,7,9000,0;1,8,9000,0;1,4,1000,0; | Z705: 0 | AA705: {} | AB705: n/60
A706: 702 | B706: 702 | C706: 702 | D706: 弑神试炼 | E706: 10501 | F706: 5 | G706: 3 | H706: 200702 | I706: 0 | J706: 480 | K706: 5000,0; | L706: 5 | M706: 5000,1; | N706: 39240/3600*(nPatrolSec+3)*(1000+nGuanQia)/1000 | O706: 31380/3600*(nPatrolSec+3)*(1000+nGuanQia)/1000 | P706: 19320/3600*(nPatrolSec+3)*(1000+nGuanQia)/1000 | Q706: nGuanQia + 1000 | R706: 39240/60*nMin*(1000+nGuanQia)/1000 | S706: 31380/60*nMin*(1000+nGuanQia)/1000 | T706: 19320/60*nMin*(1000+nGuanQia)/1000 | U706: 喽啰 | V706: pet_21;pet_201;pet_93;pet_91; | W706: 4 | X706: 5 | Y706: 1,28000,8,0;1,19016,8,0;1,10007,5,0;1,10108,2,0;1,7,9000,0;1,8,9000,0;1,4,1000,0; | Z706: 0 | AA706: {} | AB706: n/60
A707: 703 | B707: 703 | C707: 703 | D707: 弑神试炼 | E707: 10501 | F707: 5 | G707: 3 | H707: 200703 | I707: 0 | J707: 480 | K707: 5000,0; | L707: 5 | M707: 5000,1; | N707: 39240/3600*(nPatrolSec+3)*(1000+nGuanQia)/1000 | O707: 31380/3600*(nPatrolSec+3)*(1000+nGuanQia)/1000 | P707: 19320/3600*(nPatrolSec+3)*(1000+nGuanQia)/1000 | Q707: nGuanQia + 1000 | R707: 39240/60*nMin*(1000+nGuanQia)/1000 | S707: 31380/60*nMin*(1000+nGuanQia)/1000 | T707: 19320/60*nMin*(1000+nGuanQia)/1000 | U707: 喽啰 | V707: pet_21;pet_201;pet_93;pet_91; | W707: 4 | X707: 5 | Y707: 1,28000,8,0;1,19016,8,0;1,10007,5,0;1,10108,2,0;1,7,9000,0;1,8,9000,0;1,4,1000,0; | Z707: 0 | AA707: {} | AB707: n/60
A708: 704 | B708: 704 | C708: 704 | D708: 弑神试炼 | E708: 10501 | F708: 5 | G708: 3 | H708: 200704 | I708: 0 | J708: 480 | K708: 5000,0; | L708: 5 | M708: 5000,1; | N708: 39240/3600*(nPatrolSec+3)*(1000+nGuanQia)/1000 | O708: 31380/3600*(nPatrolSec+3)*(1000+nGuanQia)/1000 | P708: 19320/3600*(nPatrolSec+3)*(1000+nGuanQia)/1000 | Q708: nGuanQia + 1000 | R708: 39240/60*nMin*(1000+nGuanQia)/1000 | S708: 31380/60*nMin*(1000+nGuanQia)/1000 | T708: 19320/60*nMin*(1000+nGuanQia)/1000 | U708: 喽啰 | V708: pet_21;pet_201;pet_93;pet_91; | W708: 4 | X708: 5 | Y708: 1,28000,8,0;1,19016,8,0;1,10007,5,0;1,10108,2,0;1,7,9000,0;1,8,9000,0;1,4,1000,0; | Z708: 0 | AA708: {} | AB708: n/60
A709: 705 | B709: 705 | C709: 705 | D709: 弑神试炼 | E709: 10501 | F709: 5 | G709: 3 | H709: 200705 | I709: 0 | J709: 480 | K709: 5000,0; | L709: 5 | M709: 5000,1; | N709: 39240/3600*(nPatrolSec+3)*(1000+nGuanQia)/1000 | O709: 31380/3600*(nPatrolSec+3)*(1000+nGuanQia)/1000 | P709: 19320/3600*(nPatrolSec+3)*(1000+nGuanQia)/1000 | Q709: nGuanQia + 1000 | R709: 39240/60*nMin*(1000+nGuanQia)/1000 | S709: 31380/60*nMin*(1000+nGuanQia)/1000 | T709: 19320/60*nMin*(1000+nGuanQia)/1000 | U709: 喽啰 | V709: pet_21;pet_201;pet_93;pet_91; | W709: 4 | X709: 5 | Y709: 1,28000,8,0;1,19016,8,0;1,10007,5,0;1,10108,2,0;1,7,9000,0;1,8,9000,0;1,4,1000,0; | Z709: 0 | AA709: {} | AB709: n/60
A710: 706 | B710: 706 | C710: 706 | D710: 弑神试炼 | E710: 10501 | F710: 5 | G710: 3 | H710: 200706 | I710: 0 | J710: 480 | K710: 5000,0; | L710: 5 | M710: 5000,1; | N710: 39240/3600*(nPatrolSec+3)*(1000+nGuanQia)/1000 | O710: 31380/3600*(nPatrolSec+3)*(1000+nGuanQia)/1000 | P710: 19320/3600*(nPatrolSec+3)*(1000+nGuanQia)/1000 | Q710: nGuanQia + 1000 | R710: 39240/60*nMin*(1000+nGuanQia)/1000 | S710: 31380/60*nMin*(1000+nGuanQia)/1000 | T710: 19320/60*nMin*(1000+nGuanQia)/1000 | U710: 喽啰 | V710: pet_21;pet_201;pet_93;pet_91; | W710: 4 | X710: 5 | Y710: 1,28000,8,0;1,19016,8,0;1,10007,5,0;1,10108,2,0;1,7,9000,0;1,8,9000,0;1,4,1000,0; | Z710: 0 | AA710: {} | AB710: n/60
A711: 707 | B711: 707 | C711: 707 | D711: 弑神试炼 | E711: 10501 | F711: 5 | G711: 3 | H711: 200707 | I711: 0 | J711: 480 | K711: 5000,0; | L711: 5 | M711: 5000,1; | N711: 39240/3600*(nPatrolSec+3)*(1000+nGuanQia)/1000 | O711: 31380/3600*(nPatrolSec+3)*(1000+nGuanQia)/1000 | P711: 19320/3600*(nPatrolSec+3)*(1000+nGuanQia)/1000 | Q711: nGuanQia + 1000 | R711: 39240/60*nMin*(1000+nGuanQia)/1000 | S711: 31380/60*nMin*(1000+nGuanQia)/1000 | T711: 19320/60*nMin*(1000+nGuanQia)/1000 | U711: 喽啰 | V711: pet_21;pet_201;pet_93;pet_91; | W711: 4 | X711: 5 | Y711: 1,28000,8,0;1,19016,8,0;1,10007,5,0;1,10108,2,0;1,7,9000,0;1,8,9000,0;1,4,1000,0; | Z711: 0 | AA711: {} | AB711: n/60
A712: 708 | B712: 708 | C712: 708 | D712: 弑神试炼 | E712: 10501 | F712: 5 | G712: 3 | H712: 200708 | I712: 0 | J712: 480 | K712: 5000,0; | L712: 5 | M712: 5000,1; | N712: 39240/3600*(nPatrolSec+3)*(1000+nGuanQia)/1000 | O712: 31380/3600*(nPatrolSec+3)*(1000+nGuanQia)/1000 | P712: 19320/3600*(nPatrolSec+3)*(1000+nGuanQia)/1000 | Q712: nGuanQia + 1000 | R712: 39240/60*nMin*(1000+nGuanQia)/1000 | S712: 31380/60*nMin*(1000+nGuanQia)/1000 | T712: 19320/60*nMin*(1000+nGuanQia)/1000 | U712: 喽啰 | V712: pet_21;pet_201;pet_93;pet_91; | W712: 4 | X712: 5 | Y712: 1,28000,8,0;1,19016,8,0;1,10007,5,0;1,10108,2,0;1,7,9000,0;1,8,9000,0;1,4,1000,0; | Z712: 0 | AA712: {} | AB712: n/60
A713: 709 | B713: 709 | C713: 709 | D713: 弑神试炼 | E713: 10501 | F713: 5 | G713: 3 | H713: 200709 | I713: 0 | J713: 480 | K713: 5000,0; | L713: 5 | M713: 5000,1; | N713: 39240/3600*(nPatrolSec+3)*(1000+nGuanQia)/1000 | O713: 31380/3600*(nPatrolSec+3)*(1000+nGuanQia)/1000 | P713: 19320/3600*(nPatrolSec+3)*(1000+nGuanQia)/1000 | Q713: nGuanQia + 1000 | R713: 39240/60*nMin*(1000+nGuanQia)/1000 | S713: 31380/60*nMin*(1000+nGuanQia)/1000 | T713: 19320/60*nMin*(1000+nGuanQia)/1000 | U713: 喽啰 | V713: pet_21;pet_201;pet_93;pet_91; | W713: 4 | X713: 5 | Y713: 1,28000,8,0;1,19016,8,0;1,10007,5,0;1,10108,2,0;1,7,9000,0;1,8,9000,0;1,4,1000,0; | Z713: 0 | AA713: {} | AB713: n/60
A714: 710 | B714: 710 | C714: 710 | D714: 弑神试炼 | E714: 10501 | F714: 5 | G714: 3 | H714: 200710 | I714: 0 | J714: 480 | K714: 5000,0; | L714: 5 | M714: 5000,1; | N714: 39240/3600*(nPatrolSec+3)*(1000+nGuanQia)/1000 | O714: 31380/3600*(nPatrolSec+3)*(1000+nGuanQia)/1000 | P714: 19320/3600*(nPatrolSec+3)*(1000+nGuanQia)/1000 | Q714: nGuanQia + 1000 | R714: 39240/60*nMin*(1000+nGuanQia)/1000 | S714: 31380/60*nMin*(1000+nGuanQia)/1000 | T714: 19320/60*nMin*(1000+nGuanQia)/1000 | U714: 喽啰 | V714: pet_21;pet_201;pet_93;pet_91; | W714: 4 | X714: 5 | Y714: 1,28000,8,0;1,19016,8,0;1,10007,5,0;1,10108,2,0;1,7,9000,0;1,8,9000,0;1,4,1000,0; | Z714: 0 | AA714: {} | AB714: n/60
A715: 711 | B715: 711 | C715: 711 | D715: 弑神试炼 | E715: 10501 | F715: 5 | G715: 3 | H715: 200711 | I715: 0 | J715: 480 | K715: 5000,0; | L715: 5 | M715: 5000,1; | N715: 39240/3600*(nPatrolSec+3)*(1000+nGuanQia)/1000 | O715: 31380/3600*(nPatrolSec+3)*(1000+nGuanQia)/1000 | P715: 19320/3600*(nPatrolSec+3)*(1000+nGuanQia)/1000 | Q715: nGuanQia + 1000 | R715: 39240/60*nMin*(1000+nGuanQia)/1000 | S715: 31380/60*nMin*(1000+nGuanQia)/1000 | T715: 19320/60*nMin*(1000+nGuanQia)/1000 | U715: 喽啰 | V715: pet_21;pet_201;pet_93;pet_91; | W715: 4 | X715: 5 | Y715: 1,28000,8,0;1,19016,8,0;1,10007,5,0;1,10108,2,0;1,7,9000,0;1,8,9000,0;1,4,1000,0; | Z715: 0 | AA715: {} | AB715: n/60
A716: 712 | B716: 712 | C716: 712 | D716: 弑神试炼 | E716: 10501 | F716: 5 | G716: 3 | H716: 200712 | I716: 0 | J716: 480 | K716: 5000,0; | L716: 5 | M716: 5000,1; | N716: 39240/3600*(nPatrolSec+3)*(1000+nGuanQia)/1000 | O716: 31380/3600*(nPatrolSec+3)*(1000+nGuanQia)/1000 | P716: 19320/3600*(nPatrolSec+3)*(1000+nGuanQia)/1000 | Q716: nGuanQia + 1000 | R716: 39240/60*nMin*(1000+nGuanQia)/1000 | S716: 31380/60*nMin*(1000+nGuanQia)/1000 | T716: 19320/60*nMin*(1000+nGuanQia)/1000 | U716: 喽啰 | V716: pet_21;pet_201;pet_93;pet_91; | W716: 4 | X716: 5 | Y716: 1,28000,8,0;1,19016,8,0;1,10007,5,0;1,10108,2,0;1,7,9000,0;1,8,9000,0;1,4,1000,0; | Z716: 0 | AA716: {} | AB716: n/60
A717: 713 | B717: 713 | C717: 713 | D717: 弑神试炼 | E717: 10501 | F717: 5 | G717: 3 | H717: 200713 | I717: 0 | J717: 480 | K717: 5000,0; | L717: 5 | M717: 5000,1; | N717: 39240/3600*(nPatrolSec+3)*(1000+nGuanQia)/1000 | O717: 31380/3600*(nPatrolSec+3)*(1000+nGuanQia)/1000 | P717: 19320/3600*(nPatrolSec+3)*(1000+nGuanQia)/1000 | Q717: nGuanQia + 1000 | R717: 39240/60*nMin*(1000+nGuanQia)/1000 | S717: 31380/60*nMin*(1000+nGuanQia)/1000 | T717: 19320/60*nMin*(1000+nGuanQia)/1000 | U717: 喽啰 | V717: pet_21;pet_201;pet_93;pet_91; | W717: 4 | X717: 5 | Y717: 1,28000,8,0;1,19016,8,0;1,10007,5,0;1,10108,2,0;1,7,9000,0;1,8,9000,0;1,4,1000,0; | Z717: 0 | AA717: {} | AB717: n/60
A718: 714 | B718: 714 | C718: 714 | D718: 弑神试炼 | E718: 10501 | F718: 5 | G718: 3 | H718: 200714 | I718: 0 | J718: 480 | K718: 5000,0; | L718: 5 | M718: 5000,1; | N718: 39240/3600*(nPatrolSec+3)*(1000+nGuanQia)/1000 | O718: 31380/3600*(nPatrolSec+3)*(1000+nGuanQia)/1000 | P718: 19320/3600*(nPatrolSec+3)*(1000+nGuanQia)/1000 | Q718: nGuanQia + 1000 | R718: 39240/60*nMin*(1000+nGuanQia)/1000 | S718: 31380/60*nMin*(1000+nGuanQia)/1000 | T718: 19320/60*nMin*(1000+nGuanQia)/1000 | U718: 喽啰 | V718: pet_21;pet_201;pet_93;pet_91; | W718: 4 | X718: 5 | Y718: 1,28000,8,0;1,19016,8,0;1,10007,5,0;1,10108,2,0;1,7,9000,0;1,8,9000,0;1,4,1000,0; | Z718: 0 | AA718: {} | AB718: n/60
A719: 715 | B719: 715 | C719: 715 | D719: 弑神试炼 | E719: 10501 | F719: 5 | G719: 3 | H719: 200715 | I719: 0 | J719: 480 | K719: 5000,0; | L719: 5 | M719: 5000,1; | N719: 39240/3600*(nPatrolSec+3)*(1000+nGuanQia)/1000 | O719: 31380/3600*(nPatrolSec+3)*(1000+nGuanQia)/1000 | P719: 19320/3600*(nPatrolSec+3)*(1000+nGuanQia)/1000 | Q719: nGuanQia + 1000 | R719: 39240/60*nMin*(1000+nGuanQia)/1000 | S719: 31380/60*nMin*(1000+nGuanQia)/1000 | T719: 19320/60*nMin*(1000+nGuanQia)/1000 | U719: 喽啰 | V719: pet_21;pet_201;pet_93;pet_91; | W719: 4 | X719: 5 | Y719: 1,28000,8,0;1,19016,8,0;1,10007,5,0;1,10108,2,0;1,7,9000,0;1,8,9000,0;1,4,1000,0; | Z719: 0 | AA719: {} | AB719: n/60
A720: 716 | B720: 716 | C720: 716 | D720: 弑神试炼 | E720: 10501 | F720: 5 | G720: 3 | H720: 200716 | I720: 0 | J720: 480 | K720: 5000,0; | L720: 5 | M720: 5000,1; | N720: 39240/3600*(nPatrolSec+3)*(1000+nGuanQia)/1000 | O720: 31380/3600*(nPatrolSec+3)*(1000+nGuanQia)/1000 | P720: 19320/3600*(nPatrolSec+3)*(1000+nGuanQia)/1000 | Q720: nGuanQia + 1000 | R720: 39240/60*nMin*(1000+nGuanQia)/1000 | S720: 31380/60*nMin*(1000+nGuanQia)/1000 | T720: 19320/60*nMin*(1000+nGuanQia)/1000 | U720: 喽啰 | V720: pet_21;pet_201;pet_93;pet_91; | W720: 4 | X720: 5 | Y720: 1,28000,8,0;1,19016,8,0;1,10007,5,0;1,10108,2,0;1,7,9000,0;1,8,9000,0;1,4,1000,0; | Z720: 0 | AA720: {} | AB720: n/60
A721: 717 | B721: 717 | C721: 717 | D721: 弑神试炼 | E721: 10501 | F721: 5 | G721: 3 | H721: 200717 | I721: 0 | J721: 480 | K721: 5000,0; | L721: 5 | M721: 5000,1; | N721: 39240/3600*(nPatrolSec+3)*(1000+nGuanQia)/1000 | O721: 31380/3600*(nPatrolSec+3)*(1000+nGuanQia)/1000 | P721: 19320/3600*(nPatrolSec+3)*(1000+nGuanQia)/1000 | Q721: nGuanQia + 1000 | R721: 39240/60*nMin*(1000+nGuanQia)/1000 | S721: 31380/60*nMin*(1000+nGuanQia)/1000 | T721: 19320/60*nMin*(1000+nGuanQia)/1000 | U721: 喽啰 | V721: pet_21;pet_201;pet_93;pet_91; | W721: 4 | X721: 5 | Y721: 1,28000,8,0;1,19016,8,0;1,10007,5,0;1,10108,2,0;1,7,9000,0;1,8,9000,0;1,4,1000,0; | Z721: 0 | AA721: {} | AB721: n/60
A722: 718 | B722: 718 | C722: 718 | D722: 弑神试炼 | E722: 10501 | F722: 5 | G722: 3 | H722: 200718 | I722: 0 | J722: 480 | K722: 5000,0; | L722: 5 | M722: 5000,1; | N722: 39240/3600*(nPatrolSec+3)*(1000+nGuanQia)/1000 | O722: 31380/3600*(nPatrolSec+3)*(1000+nGuanQia)/1000 | P722: 19320/3600*(nPatrolSec+3)*(1000+nGuanQia)/1000 | Q722: nGuanQia + 1000 | R722: 39240/60*nMin*(1000+nGuanQia)/1000 | S722: 31380/60*nMin*(1000+nGuanQia)/1000 | T722: 19320/60*nMin*(1000+nGuanQia)/1000 | U722: 喽啰 | V722: pet_21;pet_201;pet_93;pet_91; | W722: 4 | X722: 5 | Y722: 1,28000,8,0;1,19016,8,0;1,10007,5,0;1,10108,2,0;1,7,9000,0;1,8,9000,0;1,4,1000,0; | Z722: 0 | AA722: {} | AB722: n/60
A723: 719 | B723: 719 | C723: 719 | D723: 弑神试炼 | E723: 10501 | F723: 5 | G723: 3 | H723: 200719 | I723: 0 | J723: 480 | K723: 5000,0; | L723: 5 | M723: 5000,1; | N723: 39240/3600*(nPatrolSec+3)*(1000+nGuanQia)/1000 | O723: 31380/3600*(nPatrolSec+3)*(1000+nGuanQia)/1000 | P723: 19320/3600*(nPatrolSec+3)*(1000+nGuanQia)/1000 | Q723: nGuanQia + 1000 | R723: 39240/60*nMin*(1000+nGuanQia)/1000 | S723: 31380/60*nMin*(1000+nGuanQia)/1000 | T723: 19320/60*nMin*(1000+nGuanQia)/1000 | U723: 喽啰 | V723: pet_21;pet_201;pet_93;pet_91; | W723: 4 | X723: 5 | Y723: 1,28000,8,0;1,19016,8,0;1,10007,5,0;1,10108,2,0;1,7,9000,0;1,8,9000,0;1,4,1000,0; | Z723: 0 | AA723: {} | AB723: n/60
A724: 720 | B724: 720 | C724: 720 | D724: 弑神试炼 | E724: 10501 | F724: 5 | G724: 3 | H724: 200720 | I724: 0 | J724: 480 | K724: 5000,0; | L724: 5 | M724: 5000,1; | N724: 39240/3600*(nPatrolSec+3)*(1000+nGuanQia)/1000 | O724: 31380/3600*(nPatrolSec+3)*(1000+nGuanQia)/1000 | P724: 19320/3600*(nPatrolSec+3)*(1000+nGuanQia)/1000 | Q724: nGuanQia + 1000 | R724: 39240/60*nMin*(1000+nGuanQia)/1000 | S724: 31380/60*nMin*(1000+nGuanQia)/1000 | T724: 19320/60*nMin*(1000+nGuanQia)/1000 | U724: 喽啰 | V724: pet_21;pet_201;pet_93;pet_91; | W724: 4 | X724: 5 | Y724: 1,28000,8,0;1,19016,8,0;1,10007,5,0;1,10108,2,0;1,7,9000,0;1,8,9000,0;1,4,1000,0; | Z724: 0 | AA724: {} | AB724: n/60
A725: 721 | B725: 721 | C725: 721 | D725: 弑神试炼 | E725: 10501 | F725: 5 | G725: 3 | H725: 200721 | I725: 0 | J725: 480 | K725: 5000,0; | L725: 5 | M725: 5000,1; | N725: 39240/3600*(nPatrolSec+3)*(1000+nGuanQia)/1000 | O725: 31380/3600*(nPatrolSec+3)*(1000+nGuanQia)/1000 | P725: 19320/3600*(nPatrolSec+3)*(1000+nGuanQia)/1000 | Q725: nGuanQia + 1000 | R725: 39240/60*nMin*(1000+nGuanQia)/1000 | S725: 31380/60*nMin*(1000+nGuanQia)/1000 | T725: 19320/60*nMin*(1000+nGuanQia)/1000 | U725: 喽啰 | V725: pet_21;pet_201;pet_93;pet_91; | W725: 4 | X725: 5 | Y725: 1,28000,8,0;1,19016,8,0;1,10007,5,0;1,10108,2,0;1,7,9000,0;1,8,9000,0;1,4,1000,0; | Z725: 0 | AA725: {} | AB725: n/60
A726: 722 | B726: 722 | C726: 722 | D726: 弑神试炼 | E726: 10501 | F726: 5 | G726: 3 | H726: 200722 | I726: 0 | J726: 480 | K726: 5000,0; | L726: 5 | M726: 5000,1; | N726: 39240/3600*(nPatrolSec+3)*(1000+nGuanQia)/1000 | O726: 31380/3600*(nPatrolSec+3)*(1000+nGuanQia)/1000 | P726: 19320/3600*(nPatrolSec+3)*(1000+nGuanQia)/1000 | Q726: nGuanQia + 1000 | R726: 39240/60*nMin*(1000+nGuanQia)/1000 | S726: 31380/60*nMin*(1000+nGuanQia)/1000 | T726: 19320/60*nMin*(1000+nGuanQia)/1000 | U726: 喽啰 | V726: pet_21;pet_201;pet_93;pet_91; | W726: 4 | X726: 5 | Y726: 1,28000,8,0;1,19016,8,0;1,10007,5,0;1,10108,2,0;1,7,9000,0;1,8,9000,0;1,4,1000,0; | Z726: 0 | AA726: {} | AB726: n/60
A727: 723 | B727: 723 | C727: 723 | D727: 弑神试炼 | E727: 10501 | F727: 5 | G727: 3 | H727: 200723 | I727: 0 | J727: 480 | K727: 5000,0; | L727: 5 | M727: 5000,1; | N727: 39240/3600*(nPatrolSec+3)*(1000+nGuanQia)/1000 | O727: 31380/3600*(nPatrolSec+3)*(1000+nGuanQia)/1000 | P727: 19320/3600*(nPatrolSec+3)*(1000+nGuanQia)/1000 | Q727: nGuanQia + 1000 | R727: 39240/60*nMin*(1000+nGuanQia)/1000 | S727: 31380/60*nMin*(1000+nGuanQia)/1000 | T727: 19320/60*nMin*(1000+nGuanQia)/1000 | U727: 喽啰 | V727: pet_21;pet_201;pet_93;pet_91; | W727: 4 | X727: 5 | Y727: 1,28000,8,0;1,19016,8,0;1,10007,5,0;1,10108,2,0;1,7,9000,0;1,8,9000,0;1,4,1000,0; | Z727: 0 | AA727: {} | AB727: n/60
A728: 724 | B728: 724 | C728: 724 | D728: 弑神试炼 | E728: 10501 | F728: 5 | G728: 3 | H728: 200724 | I728: 0 | J728: 480 | K728: 5000,0; | L728: 5 | M728: 5000,1; | N728: 39240/3600*(nPatrolSec+3)*(1000+nGuanQia)/1000 | O728: 31380/3600*(nPatrolSec+3)*(1000+nGuanQia)/1000 | P728: 19320/3600*(nPatrolSec+3)*(1000+nGuanQia)/1000 | Q728: nGuanQia + 1000 | R728: 39240/60*nMin*(1000+nGuanQia)/1000 | S728: 31380/60*nMin*(1000+nGuanQia)/1000 | T728: 19320/60*nMin*(1000+nGuanQia)/1000 | U728: 喽啰 | V728: pet_21;pet_201;pet_93;pet_91; | W728: 4 | X728: 5 | Y728: 1,28000,8,0;1,19016,8,0;1,10007,5,0;1,10108,2,0;1,7,9000,0;1,8,9000,0;1,4,1000,0; | Z728: 0 | AA728: {} | AB728: n/60
A729: 725 | B729: 725 | C729: 725 | D729: 弑神试炼 | E729: 10501 | F729: 5 | G729: 3 | H729: 200725 | I729: 0 | J729: 480 | K729: 5000,0; | L729: 5 | M729: 5000,1; | N729: 39240/3600*(nPatrolSec+3)*(1000+nGuanQia)/1000 | O729: 31380/3600*(nPatrolSec+3)*(1000+nGuanQia)/1000 | P729: 19320/3600*(nPatrolSec+3)*(1000+nGuanQia)/1000 | Q729: nGuanQia + 1000 | R729: 39240/60*nMin*(1000+nGuanQia)/1000 | S729: 31380/60*nMin*(1000+nGuanQia)/1000 | T729: 19320/60*nMin*(1000+nGuanQia)/1000 | U729: 喽啰 | V729: pet_21;pet_201;pet_93;pet_91; | W729: 4 | X729: 5 | Y729: 1,28000,8,0;1,19016,8,0;1,10007,5,0;1,10108,2,0;1,7,9000,0;1,8,9000,0;1,4,1000,0; | Z729: 0 | AA729: {} | AB729: n/60
A730: 726 | B730: 726 | C730: 726 | D730: 弑神试炼 | E730: 10501 | F730: 5 | G730: 3 | H730: 200726 | I730: 0 | J730: 480 | K730: 5000,0; | L730: 5 | M730: 5000,1; | N730: 39240/3600*(nPatrolSec+3)*(1000+nGuanQia)/1000 | O730: 31380/3600*(nPatrolSec+3)*(1000+nGuanQia)/1000 | P730: 19320/3600*(nPatrolSec+3)*(1000+nGuanQia)/1000 | Q730: nGuanQia + 1000 | R730: 39240/60*nMin*(1000+nGuanQia)/1000 | S730: 31380/60*nMin*(1000+nGuanQia)/1000 | T730: 19320/60*nMin*(1000+nGuanQia)/1000 | U730: 喽啰 | V730: pet_21;pet_201;pet_93;pet_91; | W730: 4 | X730: 5 | Y730: 1,28000,8,0;1,19016,8,0;1,10007,5,0;1,10108,2,0;1,7,9000,0;1,8,9000,0;1,4,1000,0; | Z730: 0 | AA730: {} | AB730: n/60
A731: 727 | B731: 727 | C731: 727 | D731: 弑神试炼 | E731: 10501 | F731: 5 | G731: 3 | H731: 200727 | I731: 0 | J731: 480 | K731: 5000,0; | L731: 5 | M731: 5000,1; | N731: 39240/3600*(nPatrolSec+3)*(1000+nGuanQia)/1000 | O731: 31380/3600*(nPatrolSec+3)*(1000+nGuanQia)/1000 | P731: 19320/3600*(nPatrolSec+3)*(1000+nGuanQia)/1000 | Q731: nGuanQia + 1000 | R731: 39240/60*nMin*(1000+nGuanQia)/1000 | S731: 31380/60*nMin*(1000+nGuanQia)/1000 | T731: 19320/60*nMin*(1000+nGuanQia)/1000 | U731: 喽啰 | V731: pet_21;pet_201;pet_93;pet_91; | W731: 4 | X731: 5 | Y731: 1,28000,8,0;1,19016,8,0;1,10007,5,0;1,10108,2,0;1,7,9000,0;1,8,9000,0;1,4,1000,0; | Z731: 0 | AA731: {} | AB731: n/60
A732: 728 | B732: 728 | C732: 728 | D732: 弑神试炼 | E732: 10501 | F732: 5 | G732: 3 | H732: 200728 | I732: 0 | J732: 480 | K732: 5000,0; | L732: 5 | M732: 5000,1; | N732: 39240/3600*(nPatrolSec+3)*(1000+nGuanQia)/1000 | O732: 31380/3600*(nPatrolSec+3)*(1000+nGuanQia)/1000 | P732: 19320/3600*(nPatrolSec+3)*(1000+nGuanQia)/1000 | Q732: nGuanQia + 1000 | R732: 39240/60*nMin*(1000+nGuanQia)/1000 | S732: 31380/60*nMin*(1000+nGuanQia)/1000 | T732: 19320/60*nMin*(1000+nGuanQia)/1000 | U732: 喽啰 | V732: pet_21;pet_201;pet_93;pet_91; | W732: 4 | X732: 5 | Y732: 1,28000,8,0;1,19016,8,0;1,10007,5,0;1,10108,2,0;1,7,9000,0;1,8,9000,0;1,4,1000,0; | Z732: 0 | AA732: {} | AB732: n/60
A733: 729 | B733: 729 | C733: 729 | D733: 弑神试炼 | E733: 10501 | F733: 5 | G733: 3 | H733: 200729 | I733: 0 | J733: 480 | K733: 5000,0; | L733: 5 | M733: 5000,1; | N733: 39240/3600*(nPatrolSec+3)*(1000+nGuanQia)/1000 | O733: 31380/3600*(nPatrolSec+3)*(1000+nGuanQia)/1000 | P733: 19320/3600*(nPatrolSec+3)*(1000+nGuanQia)/1000 | Q733: nGuanQia + 1000 | R733: 39240/60*nMin*(1000+nGuanQia)/1000 | S733: 31380/60*nMin*(1000+nGuanQia)/1000 | T733: 19320/60*nMin*(1000+nGuanQia)/1000 | U733: 喽啰 | V733: pet_21;pet_201;pet_93;pet_91; | W733: 4 | X733: 5 | Y733: 1,28000,8,0;1,19016,8,0;1,10007,5,0;1,10108,2,0;1,7,9000,0;1,8,9000,0;1,4,1000,0; | Z733: 0 | AA733: {} | AB733: n/60
A734: 730 | B734: 730 | C734: 730 | D734: 弑神试炼 | E734: 10501 | F734: 5 | G734: 3 | H734: 200730 | I734: 0 | J734: 480 | K734: 5000,0; | L734: 5 | M734: 5000,1; | N734: 39240/3600*(nPatrolSec+3)*(1000+nGuanQia)/1000 | O734: 31380/3600*(nPatrolSec+3)*(1000+nGuanQia)/1000 | P734: 19320/3600*(nPatrolSec+3)*(1000+nGuanQia)/1000 | Q734: nGuanQia + 1000 | R734: 39240/60*nMin*(1000+nGuanQia)/1000 | S734: 31380/60*nMin*(1000+nGuanQia)/1000 | T734: 19320/60*nMin*(1000+nGuanQia)/1000 | U734: 喽啰 | V734: pet_21;pet_201;pet_93;pet_91; | W734: 4 | X734: 5 | Y734: 1,28000,8,0;1,19016,8,0;1,10007,5,0;1,10108,2,0;1,7,9000,0;1,8,9000,0;1,4,1000,0; | Z734: 0 | AA734: {} | AB734: n/60
A735: 731 | B735: 731 | C735: 731 | D735: 弑神试炼 | E735: 10501 | F735: 5 | G735: 3 | H735: 200731 | I735: 0 | J735: 480 | K735: 5000,0; | L735: 5 | M735: 5000,1; | N735: 39240/3600*(nPatrolSec+3)*(1000+nGuanQia)/1000 | O735: 31380/3600*(nPatrolSec+3)*(1000+nGuanQia)/1000 | P735: 19320/3600*(nPatrolSec+3)*(1000+nGuanQia)/1000 | Q735: nGuanQia + 1000 | R735: 39240/60*nMin*(1000+nGuanQia)/1000 | S735: 31380/60*nMin*(1000+nGuanQia)/1000 | T735: 19320/60*nMin*(1000+nGuanQia)/1000 | U735: 喽啰 | V735: pet_21;pet_201;pet_93;pet_91; | W735: 4 | X735: 5 | Y735: 1,28000,8,0;1,19016,8,0;1,10007,5,0;1,10108,2,0;1,7,9000,0;1,8,9000,0;1,4,1000,0; | Z735: 0 | AA735: {} | AB735: n/60
A736: 732 | B736: 732 | C736: 732 | D736: 弑神试炼 | E736: 10501 | F736: 5 | G736: 3 | H736: 200732 | I736: 0 | J736: 480 | K736: 5000,0; | L736: 5 | M736: 5000,1; | N736: 39240/3600*(nPatrolSec+3)*(1000+nGuanQia)/1000 | O736: 31380/3600*(nPatrolSec+3)*(1000+nGuanQia)/1000 | P736: 19320/3600*(nPatrolSec+3)*(1000+nGuanQia)/1000 | Q736: nGuanQia + 1000 | R736: 39240/60*nMin*(1000+nGuanQia)/1000 | S736: 31380/60*nMin*(1000+nGuanQia)/1000 | T736: 19320/60*nMin*(1000+nGuanQia)/1000 | U736: 喽啰 | V736: pet_21;pet_201;pet_93;pet_91; | W736: 4 | X736: 5 | Y736: 1,28000,8,0;1,19016,8,0;1,10007,5,0;1,10108,2,0;1,7,9000,0;1,8,9000,0;1,4,1000,0; | Z736: 0 | AA736: {} | AB736: n/60
A737: 733 | B737: 733 | C737: 733 | D737: 弑神试炼 | E737: 10501 | F737: 5 | G737: 3 | H737: 200733 | I737: 0 | J737: 480 | K737: 5000,0; | L737: 5 | M737: 5000,1; | N737: 39240/3600*(nPatrolSec+3)*(1000+nGuanQia)/1000 | O737: 31380/3600*(nPatrolSec+3)*(1000+nGuanQia)/1000 | P737: 19320/3600*(nPatrolSec+3)*(1000+nGuanQia)/1000 | Q737: nGuanQia + 1000 | R737: 39240/60*nMin*(1000+nGuanQia)/1000 | S737: 31380/60*nMin*(1000+nGuanQia)/1000 | T737: 19320/60*nMin*(1000+nGuanQia)/1000 | U737: 喽啰 | V737: pet_21;pet_201;pet_93;pet_91; | W737: 4 | X737: 5 | Y737: 1,28000,8,0;1,19016,8,0;1,10007,5,0;1,10108,2,0;1,7,9000,0;1,8,9000,0;1,4,1000,0; | Z737: 0 | AA737: {} | AB737: n/60
A738: 734 | B738: 734 | C738: 734 | D738: 弑神试炼 | E738: 10501 | F738: 5 | G738: 3 | H738: 200734 | I738: 0 | J738: 480 | K738: 5000,0; | L738: 5 | M738: 5000,1; | N738: 39240/3600*(nPatrolSec+3)*(1000+nGuanQia)/1000 | O738: 31380/3600*(nPatrolSec+3)*(1000+nGuanQia)/1000 | P738: 19320/3600*(nPatrolSec+3)*(1000+nGuanQia)/1000 | Q738: nGuanQia + 1000 | R738: 39240/60*nMin*(1000+nGuanQia)/1000 | S738: 31380/60*nMin*(1000+nGuanQia)/1000 | T738: 19320/60*nMin*(1000+nGuanQia)/1000 | U738: 喽啰 | V738: pet_21;pet_201;pet_93;pet_91; | W738: 4 | X738: 5 | Y738: 1,28000,8,0;1,19016,8,0;1,10007,5,0;1,10108,2,0;1,7,9000,0;1,8,9000,0;1,4,1000,0; | Z738: 0 | AA738: {} | AB738: n/60
A739: 735 | B739: 735 | C739: 735 | D739: 弑神试炼 | E739: 10501 | F739: 5 | G739: 3 | H739: 200735 | I739: 0 | J739: 480 | K739: 5000,0; | L739: 5 | M739: 5000,1; | N739: 39240/3600*(nPatrolSec+3)*(1000+nGuanQia)/1000 | O739: 31380/3600*(nPatrolSec+3)*(1000+nGuanQia)/1000 | P739: 19320/3600*(nPatrolSec+3)*(1000+nGuanQia)/1000 | Q739: nGuanQia + 1000 | R739: 39240/60*nMin*(1000+nGuanQia)/1000 | S739: 31380/60*nMin*(1000+nGuanQia)/1000 | T739: 19320/60*nMin*(1000+nGuanQia)/1000 | U739: 喽啰 | V739: pet_21;pet_201;pet_93;pet_91; | W739: 4 | X739: 5 | Y739: 1,28000,8,0;1,19016,8,0;1,10007,5,0;1,10108,2,0;1,7,9000,0;1,8,9000,0;1,4,1000,0; | Z739: 0 | AA739: {} | AB739: n/60
A740: 736 | B740: 736 | C740: 736 | D740: 弑神试炼 | E740: 10501 | F740: 5 | G740: 3 | H740: 200736 | I740: 0 | J740: 480 | K740: 5000,0; | L740: 5 | M740: 5000,1; | N740: 39240/3600*(nPatrolSec+3)*(1000+nGuanQia)/1000 | O740: 31380/3600*(nPatrolSec+3)*(1000+nGuanQia)/1000 | P740: 19320/3600*(nPatrolSec+3)*(1000+nGuanQia)/1000 | Q740: nGuanQia + 1000 | R740: 39240/60*nMin*(1000+nGuanQia)/1000 | S740: 31380/60*nMin*(1000+nGuanQia)/1000 | T740: 19320/60*nMin*(1000+nGuanQia)/1000 | U740: 喽啰 | V740: pet_21;pet_201;pet_93;pet_91; | W740: 4 | X740: 5 | Y740: 1,28000,8,0;1,19016,8,0;1,10007,5,0;1,10108,2,0;1,7,9000,0;1,8,9000,0;1,4,1000,0; | Z740: 0 | AA740: {} | AB740: n/60
A741: 737 | B741: 737 | C741: 737 | D741: 弑神试炼 | E741: 10501 | F741: 5 | G741: 3 | H741: 200737 | I741: 0 | J741: 480 | K741: 5000,0; | L741: 5 | M741: 5000,1; | N741: 39240/3600*(nPatrolSec+3)*(1000+nGuanQia)/1000 | O741: 31380/3600*(nPatrolSec+3)*(1000+nGuanQia)/1000 | P741: 19320/3600*(nPatrolSec+3)*(1000+nGuanQia)/1000 | Q741: nGuanQia + 1000 | R741: 39240/60*nMin*(1000+nGuanQia)/1000 | S741: 31380/60*nMin*(1000+nGuanQia)/1000 | T741: 19320/60*nMin*(1000+nGuanQia)/1000 | U741: 喽啰 | V741: pet_21;pet_201;pet_93;pet_91; | W741: 4 | X741: 5 | Y741: 1,28000,8,0;1,19016,8,0;1,10007,5,0;1,10108,2,0;1,7,9000,0;1,8,9000,0;1,4,1000,0; | Z741: 0 | AA741: {} | AB741: n/60
A742: 738 | B742: 738 | C742: 738 | D742: 弑神试炼 | E742: 10501 | F742: 5 | G742: 3 | H742: 200738 | I742: 0 | J742: 480 | K742: 5000,0; | L742: 5 | M742: 5000,1; | N742: 39240/3600*(nPatrolSec+3)*(1000+nGuanQia)/1000 | O742: 31380/3600*(nPatrolSec+3)*(1000+nGuanQia)/1000 | P742: 19320/3600*(nPatrolSec+3)*(1000+nGuanQia)/1000 | Q742: nGuanQia + 1000 | R742: 39240/60*nMin*(1000+nGuanQia)/1000 | S742: 31380/60*nMin*(1000+nGuanQia)/1000 | T742: 19320/60*nMin*(1000+nGuanQia)/1000 | U742: 喽啰 | V742: pet_21;pet_201;pet_93;pet_91; | W742: 4 | X742: 5 | Y742: 1,28000,8,0;1,19016,8,0;1,10007,5,0;1,10108,2,0;1,7,9000,0;1,8,9000,0;1,4,1000,0; | Z742: 0 | AA742: {} | AB742: n/60
A743: 739 | B743: 739 | C743: 739 | D743: 弑神试炼 | E743: 10501 | F743: 5 | G743: 3 | H743: 200739 | I743: 0 | J743: 480 | K743: 5000,0; | L743: 5 | M743: 5000,1; | N743: 39240/3600*(nPatrolSec+3)*(1000+nGuanQia)/1000 | O743: 31380/3600*(nPatrolSec+3)*(1000+nGuanQia)/1000 | P743: 19320/3600*(nPatrolSec+3)*(1000+nGuanQia)/1000 | Q743: nGuanQia + 1000 | R743: 39240/60*nMin*(1000+nGuanQia)/1000 | S743: 31380/60*nMin*(1000+nGuanQia)/1000 | T743: 19320/60*nMin*(1000+nGuanQia)/1000 | U743: 喽啰 | V743: pet_21;pet_201;pet_93;pet_91; | W743: 4 | X743: 5 | Y743: 1,28000,8,0;1,19016,8,0;1,10007,5,0;1,10108,2,0;1,7,9000,0;1,8,9000,0;1,4,1000,0; | Z743: 0 | AA743: {} | AB743: n/60
A744: 740 | B744: 740 | C744: 740 | D744: 弑神试炼 | E744: 10501 | F744: 5 | G744: 3 | H744: 200740 | I744: 0 | J744: 480 | K744: 5000,0; | L744: 5 | M744: 5000,1; | N744: 39240/3600*(nPatrolSec+3)*(1000+nGuanQia)/1000 | O744: 31380/3600*(nPatrolSec+3)*(1000+nGuanQia)/1000 | P744: 19320/3600*(nPatrolSec+3)*(1000+nGuanQia)/1000 | Q744: nGuanQia + 1000 | R744: 39240/60*nMin*(1000+nGuanQia)/1000 | S744: 31380/60*nMin*(1000+nGuanQia)/1000 | T744: 19320/60*nMin*(1000+nGuanQia)/1000 | U744: 喽啰 | V744: pet_21;pet_201;pet_93;pet_91; | W744: 4 | X744: 5 | Y744: 1,28000,8,0;1,19016,8,0;1,10007,5,0;1,10108,2,0;1,7,9000,0;1,8,9000,0;1,4,1000,0; | Z744: 0 | AA744: {} | AB744: n/60
A745: 741 | B745: 741 | C745: 741 | D745: 弑神试炼 | E745: 10501 | F745: 5 | G745: 3 | H745: 200741 | I745: 0 | J745: 480 | K745: 5000,0; | L745: 5 | M745: 5000,1; | N745: 39240/3600*(nPatrolSec+3)*(1000+nGuanQia)/1000 | O745: 31380/3600*(nPatrolSec+3)*(1000+nGuanQia)/1000 | P745: 19320/3600*(nPatrolSec+3)*(1000+nGuanQia)/1000 | Q745: nGuanQia + 1000 | R745: 39240/60*nMin*(1000+nGuanQia)/1000 | S745: 31380/60*nMin*(1000+nGuanQia)/1000 | T745: 19320/60*nMin*(1000+nGuanQia)/1000 | U745: 喽啰 | V745: pet_21;pet_201;pet_93;pet_91; | W745: 4 | X745: 5 | Y745: 1,28000,8,0;1,19016,8,0;1,10007,5,0;1,10108,2,0;1,7,9000,0;1,8,9000,0;1,4,1000,0; | Z745: 0 | AA745: {} | AB745: n/60
A746: 742 | B746: 742 | C746: 742 | D746: 弑神试炼 | E746: 10501 | F746: 5 | G746: 3 | H746: 200742 | I746: 0 | J746: 480 | K746: 5000,0; | L746: 5 | M746: 5000,1; | N746: 39240/3600*(nPatrolSec+3)*(1000+nGuanQia)/1000 | O746: 31380/3600*(nPatrolSec+3)*(1000+nGuanQia)/1000 | P746: 19320/3600*(nPatrolSec+3)*(1000+nGuanQia)/1000 | Q746: nGuanQia + 1000 | R746: 39240/60*nMin*(1000+nGuanQia)/1000 | S746: 31380/60*nMin*(1000+nGuanQia)/1000 | T746: 19320/60*nMin*(1000+nGuanQia)/1000 | U746: 喽啰 | V746: pet_21;pet_201;pet_93;pet_91; | W746: 4 | X746: 5 | Y746: 1,28000,8,0;1,19016,8,0;1,10007,5,0;1,10108,2,0;1,7,9000,0;1,8,9000,0;1,4,1000,0; | Z746: 0 | AA746: {} | AB746: n/60
A747: 743 | B747: 743 | C747: 743 | D747: 弑神试炼 | E747: 10501 | F747: 5 | G747: 3 | H747: 200743 | I747: 0 | J747: 480 | K747: 5000,0; | L747: 5 | M747: 5000,1; | N747: 39240/3600*(nPatrolSec+3)*(1000+nGuanQia)/1000 | O747: 31380/3600*(nPatrolSec+3)*(1000+nGuanQia)/1000 | P747: 19320/3600*(nPatrolSec+3)*(1000+nGuanQia)/1000 | Q747: nGuanQia + 1000 | R747: 39240/60*nMin*(1000+nGuanQia)/1000 | S747: 31380/60*nMin*(1000+nGuanQia)/1000 | T747: 19320/60*nMin*(1000+nGuanQia)/1000 | U747: 喽啰 | V747: pet_21;pet_201;pet_93;pet_91; | W747: 4 | X747: 5 | Y747: 1,28000,8,0;1,19016,8,0;1,10007,5,0;1,10108,2,0;1,7,9000,0;1,8,9000,0;1,4,1000,0; | Z747: 0 | AA747: {} | AB747: n/60
A748: 744 | B748: 744 | C748: 744 | D748: 弑神试炼 | E748: 10501 | F748: 5 | G748: 3 | H748: 200744 | I748: 0 | J748: 480 | K748: 5000,0; | L748: 5 | M748: 5000,1; | N748: 39240/3600*(nPatrolSec+3)*(1000+nGuanQia)/1000 | O748: 31380/3600*(nPatrolSec+3)*(1000+nGuanQia)/1000 | P748: 19320/3600*(nPatrolSec+3)*(1000+nGuanQia)/1000 | Q748: nGuanQia + 1000 | R748: 39240/60*nMin*(1000+nGuanQia)/1000 | S748: 31380/60*nMin*(1000+nGuanQia)/1000 | T748: 19320/60*nMin*(1000+nGuanQia)/1000 | U748: 喽啰 | V748: pet_21;pet_201;pet_93;pet_91; | W748: 4 | X748: 5 | Y748: 1,28000,8,0;1,19016,8,0;1,10007,5,0;1,10108,2,0;1,7,9000,0;1,8,9000,0;1,4,1000,0; | Z748: 0 | AA748: {} | AB748: n/60
A749: 745 | B749: 745 | C749: 745 | D749: 弑神试炼 | E749: 10501 | F749: 5 | G749: 3 | H749: 200745 | I749: 0 | J749: 480 | K749: 5000,0; | L749: 5 | M749: 5000,1; | N749: 39240/3600*(nPatrolSec+3)*(1000+nGuanQia)/1000 | O749: 31380/3600*(nPatrolSec+3)*(1000+nGuanQia)/1000 | P749: 19320/3600*(nPatrolSec+3)*(1000+nGuanQia)/1000 | Q749: nGuanQia + 1000 | R749: 39240/60*nMin*(1000+nGuanQia)/1000 | S749: 31380/60*nMin*(1000+nGuanQia)/1000 | T749: 19320/60*nMin*(1000+nGuanQia)/1000 | U749: 喽啰 | V749: pet_21;pet_201;pet_93;pet_91; | W749: 4 | X749: 5 | Y749: 1,28000,8,0;1,19016,8,0;1,10007,5,0;1,10108,2,0;1,7,9000,0;1,8,9000,0;1,4,1000,0; | Z749: 0 | AA749: {} | AB749: n/60
A750: 746 | B750: 746 | C750: 746 | D750: 弑神试炼 | E750: 10501 | F750: 5 | G750: 3 | H750: 200746 | I750: 0 | J750: 480 | K750: 5000,0; | L750: 5 | M750: 5000,1; | N750: 39240/3600*(nPatrolSec+3)*(1000+nGuanQia)/1000 | O750: 31380/3600*(nPatrolSec+3)*(1000+nGuanQia)/1000 | P750: 19320/3600*(nPatrolSec+3)*(1000+nGuanQia)/1000 | Q750: nGuanQia + 1000 | R750: 39240/60*nMin*(1000+nGuanQia)/1000 | S750: 31380/60*nMin*(1000+nGuanQia)/1000 | T750: 19320/60*nMin*(1000+nGuanQia)/1000 | U750: 喽啰 | V750: pet_21;pet_201;pet_93;pet_91; | W750: 4 | X750: 5 | Y750: 1,28000,8,0;1,19016,8,0;1,10007,5,0;1,10108,2,0;1,7,9000,0;1,8,9000,0;1,4,1000,0; | Z750: 0 | AA750: {} | AB750: n/60
A751: 747 | B751: 747 | C751: 747 | D751: 弑神试炼 | E751: 10501 | F751: 5 | G751: 3 | H751: 200747 | I751: 0 | J751: 480 | K751: 5000,0; | L751: 5 | M751: 5000,1; | N751: 39240/3600*(nPatrolSec+3)*(1000+nGuanQia)/1000 | O751: 31380/3600*(nPatrolSec+3)*(1000+nGuanQia)/1000 | P751: 19320/3600*(nPatrolSec+3)*(1000+nGuanQia)/1000 | Q751: nGuanQia + 1000 | R751: 39240/60*nMin*(1000+nGuanQia)/1000 | S751: 31380/60*nMin*(1000+nGuanQia)/1000 | T751: 19320/60*nMin*(1000+nGuanQia)/1000 | U751: 喽啰 | V751: pet_21;pet_201;pet_93;pet_91; | W751: 4 | X751: 5 | Y751: 1,28000,8,0;1,19016,8,0;1,10007,5,0;1,10108,2,0;1,7,9000,0;1,8,9000,0;1,4,1000,0; | Z751: 0 | AA751: {} | AB751: n/60
A752: 748 | B752: 748 | C752: 748 | D752: 弑神试炼 | E752: 10501 | F752: 5 | G752: 3 | H752: 200748 | I752: 0 | J752: 480 | K752: 5000,0; | L752: 5 | M752: 5000,1; | N752: 39240/3600*(nPatrolSec+3)*(1000+nGuanQia)/1000 | O752: 31380/3600*(nPatrolSec+3)*(1000+nGuanQia)/1000 | P752: 19320/3600*(nPatrolSec+3)*(1000+nGuanQia)/1000 | Q752: nGuanQia + 1000 | R752: 39240/60*nMin*(1000+nGuanQia)/1000 | S752: 31380/60*nMin*(1000+nGuanQia)/1000 | T752: 19320/60*nMin*(1000+nGuanQia)/1000 | U752: 喽啰 | V752: pet_21;pet_201;pet_93;pet_91; | W752: 4 | X752: 5 | Y752: 1,28000,8,0;1,19016,8,0;1,10007,5,0;1,10108,2,0;1,7,9000,0;1,8,9000,0;1,4,1000,0; | Z752: 0 | AA752: {} | AB752: n/60
A753: 749 | B753: 749 | C753: 749 | D753: 弑神试炼 | E753: 10501 | F753: 5 | G753: 3 | H753: 200749 | I753: 0 | J753: 480 | K753: 5000,0; | L753: 5 | M753: 5000,1; | N753: 39240/3600*(nPatrolSec+3)*(1000+nGuanQia)/1000 | O753: 31380/3600*(nPatrolSec+3)*(1000+nGuanQia)/1000 | P753: 19320/3600*(nPatrolSec+3)*(1000+nGuanQia)/1000 | Q753: nGuanQia + 1000 | R753: 39240/60*nMin*(1000+nGuanQia)/1000 | S753: 31380/60*nMin*(1000+nGuanQia)/1000 | T753: 19320/60*nMin*(1000+nGuanQia)/1000 | U753: 喽啰 | V753: pet_21;pet_201;pet_93;pet_91; | W753: 4 | X753: 5 | Y753: 1,28000,8,0;1,19016,8,0;1,10007,5,0;1,10108,2,0;1,7,9000,0;1,8,9000,0;1,4,1000,0; | Z753: 0 | AA753: {} | AB753: n/60
A754: 750 | B754: 750 | C754: 750 | D754: 弑神试炼 | E754: 10501 | F754: 5 | G754: 3 | H754: 200750 | I754: 0 | J754: 480 | K754: 5000,0; | L754: 5 | M754: 5000,1; | N754: 39240/3600*(nPatrolSec+3)*(1000+nGuanQia)/1000 | O754: 31380/3600*(nPatrolSec+3)*(1000+nGuanQia)/1000 | P754: 19320/3600*(nPatrolSec+3)*(1000+nGuanQia)/1000 | Q754: nGuanQia + 1000 | R754: 39240/60*nMin*(1000+nGuanQia)/1000 | S754: 31380/60*nMin*(1000+nGuanQia)/1000 | T754: 19320/60*nMin*(1000+nGuanQia)/1000 | U754: 喽啰 | V754: pet_21;pet_201;pet_93;pet_91; | W754: 4 | X754: 5 | Y754: 1,28000,8,0;1,19016,8,0;1,10007,5,0;1,10108,2,0;1,7,9000,0;1,8,9000,0;1,4,1000,0; | Z754: 0 | AA754: {} | AB754: n/60
A755: 751 | B755: 751 | C755: 751 | D755: 弑神试炼 | E755: 10501 | F755: 5 | G755: 3 | H755: 200751 | I755: 0 | J755: 480 | K755: 5000,0; | L755: 5 | M755: 5000,1; | N755: 39240/3600*(nPatrolSec+3)*(1000+nGuanQia)/1000 | O755: 31380/3600*(nPatrolSec+3)*(1000+nGuanQia)/1000 | P755: 19320/3600*(nPatrolSec+3)*(1000+nGuanQia)/1000 | Q755: nGuanQia + 1000 | R755: 39240/60*nMin*(1000+nGuanQia)/1000 | S755: 31380/60*nMin*(1000+nGuanQia)/1000 | T755: 19320/60*nMin*(1000+nGuanQia)/1000 | U755: 喽啰 | V755: pet_21;pet_201;pet_93;pet_91; | W755: 4 | X755: 5 | Y755: 1,28000,8,0;1,19016,8,0;1,10007,5,0;1,10108,2,0;1,7,9000,0;1,8,9000,0;1,4,1000,0; | Z755: 0 | AA755: {} | AB755: n/60
A756: 752 | B756: 752 | C756: 752 | D756: 弑神试炼 | E756: 10501 | F756: 5 | G756: 3 | H756: 200752 | I756: 0 | J756: 480 | K756: 5000,0; | L756: 5 | M756: 5000,1; | N756: 39240/3600*(nPatrolSec+3)*(1000+nGuanQia)/1000 | O756: 31380/3600*(nPatrolSec+3)*(1000+nGuanQia)/1000 | P756: 19320/3600*(nPatrolSec+3)*(1000+nGuanQia)/1000 | Q756: nGuanQia + 1000 | R756: 39240/60*nMin*(1000+nGuanQia)/1000 | S756: 31380/60*nMin*(1000+nGuanQia)/1000 | T756: 19320/60*nMin*(1000+nGuanQia)/1000 | U756: 喽啰 | V756: pet_21;pet_201;pet_93;pet_91; | W756: 4 | X756: 5 | Y756: 1,28000,8,0;1,19016,8,0;1,10007,5,0;1,10108,2,0;1,7,9000,0;1,8,9000,0;1,4,1000,0; | Z756: 0 | AA756: {} | AB756: n/60
A757: 753 | B757: 753 | C757: 753 | D757: 弑神试炼 | E757: 10501 | F757: 5 | G757: 3 | H757: 200753 | I757: 0 | J757: 480 | K757: 5000,0; | L757: 5 | M757: 5000,1; | N757: 39240/3600*(nPatrolSec+3)*(1000+nGuanQia)/1000 | O757: 31380/3600*(nPatrolSec+3)*(1000+nGuanQia)/1000 | P757: 19320/3600*(nPatrolSec+3)*(1000+nGuanQia)/1000 | Q757: nGuanQia + 1000 | R757: 39240/60*nMin*(1000+nGuanQia)/1000 | S757: 31380/60*nMin*(1000+nGuanQia)/1000 | T757: 19320/60*nMin*(1000+nGuanQia)/1000 | U757: 喽啰 | V757: pet_21;pet_201;pet_93;pet_91; | W757: 4 | X757: 5 | Y757: 1,28000,8,0;1,19016,8,0;1,10007,5,0;1,10108,2,0;1,7,9000,0;1,8,9000,0;1,4,1000,0; | Z757: 0 | AA757: {} | AB757: n/60
A758: 754 | B758: 754 | C758: 754 | D758: 弑神试炼 | E758: 10501 | F758: 5 | G758: 3 | H758: 200754 | I758: 0 | J758: 480 | K758: 5000,0; | L758: 5 | M758: 5000,1; | N758: 39240/3600*(nPatrolSec+3)*(1000+nGuanQia)/1000 | O758: 31380/3600*(nPatrolSec+3)*(1000+nGuanQia)/1000 | P758: 19320/3600*(nPatrolSec+3)*(1000+nGuanQia)/1000 | Q758: nGuanQia + 1000 | R758: 39240/60*nMin*(1000+nGuanQia)/1000 | S758: 31380/60*nMin*(1000+nGuanQia)/1000 | T758: 19320/60*nMin*(1000+nGuanQia)/1000 | U758: 喽啰 | V758: pet_21;pet_201;pet_93;pet_91; | W758: 4 | X758: 5 | Y758: 1,28000,8,0;1,19016,8,0;1,10007,5,0;1,10108,2,0;1,7,9000,0;1,8,9000,0;1,4,1000,0; | Z758: 0 | AA758: {} | AB758: n/60
A759: 755 | B759: 755 | C759: 755 | D759: 弑神试炼 | E759: 10501 | F759: 5 | G759: 3 | H759: 200755 | I759: 0 | J759: 480 | K759: 5000,0; | L759: 5 | M759: 5000,1; | N759: 39240/3600*(nPatrolSec+3)*(1000+nGuanQia)/1000 | O759: 31380/3600*(nPatrolSec+3)*(1000+nGuanQia)/1000 | P759: 19320/3600*(nPatrolSec+3)*(1000+nGuanQia)/1000 | Q759: nGuanQia + 1000 | R759: 39240/60*nMin*(1000+nGuanQia)/1000 | S759: 31380/60*nMin*(1000+nGuanQia)/1000 | T759: 19320/60*nMin*(1000+nGuanQia)/1000 | U759: 喽啰 | V759: pet_21;pet_201;pet_93;pet_91; | W759: 4 | X759: 5 | Y759: 1,28000,8,0;1,19016,8,0;1,10007,5,0;1,10108,2,0;1,7,9000,0;1,8,9000,0;1,4,1000,0; | Z759: 0 | AA759: {} | AB759: n/60
A760: 756 | B760: 756 | C760: 756 | D760: 弑神试炼 | E760: 10501 | F760: 5 | G760: 3 | H760: 200756 | I760: 0 | J760: 480 | K760: 5000,0; | L760: 5 | M760: 5000,1; | N760: 39240/3600*(nPatrolSec+3)*(1000+nGuanQia)/1000 | O760: 31380/3600*(nPatrolSec+3)*(1000+nGuanQia)/1000 | P760: 19320/3600*(nPatrolSec+3)*(1000+nGuanQia)/1000 | Q760: nGuanQia + 1000 | R760: 39240/60*nMin*(1000+nGuanQia)/1000 | S760: 31380/60*nMin*(1000+nGuanQia)/1000 | T760: 19320/60*nMin*(1000+nGuanQia)/1000 | U760: 喽啰 | V760: pet_21;pet_201;pet_93;pet_91; | W760: 4 | X760: 5 | Y760: 1,28000,8,0;1,19016,8,0;1,10007,5,0;1,10108,2,0;1,7,9000,0;1,8,9000,0;1,4,1000,0; | Z760: 0 | AA760: {} | AB760: n/60
A761: 757 | B761: 757 | C761: 757 | D761: 弑神试炼 | E761: 10501 | F761: 5 | G761: 3 | H761: 200757 | I761: 0 | J761: 480 | K761: 5000,0; | L761: 5 | M761: 5000,1; | N761: 39240/3600*(nPatrolSec+3)*(1000+nGuanQia)/1000 | O761: 31380/3600*(nPatrolSec+3)*(1000+nGuanQia)/1000 | P761: 19320/3600*(nPatrolSec+3)*(1000+nGuanQia)/1000 | Q761: nGuanQia + 1000 | R761: 39240/60*nMin*(1000+nGuanQia)/1000 | S761: 31380/60*nMin*(1000+nGuanQia)/1000 | T761: 19320/60*nMin*(1000+nGuanQia)/1000 | U761: 喽啰 | V761: pet_21;pet_201;pet_93;pet_91; | W761: 4 | X761: 5 | Y761: 1,28000,8,0;1,19016,8,0;1,10007,5,0;1,10108,2,0;1,7,9000,0;1,8,9000,0;1,4,1000,0; | Z761: 0 | AA761: {} | AB761: n/60
A762: 758 | B762: 758 | C762: 758 | D762: 弑神试炼 | E762: 10501 | F762: 5 | G762: 3 | H762: 200758 | I762: 0 | J762: 480 | K762: 5000,0; | L762: 5 | M762: 5000,1; | N762: 39240/3600*(nPatrolSec+3)*(1000+nGuanQia)/1000 | O762: 31380/3600*(nPatrolSec+3)*(1000+nGuanQia)/1000 | P762: 19320/3600*(nPatrolSec+3)*(1000+nGuanQia)/1000 | Q762: nGuanQia + 1000 | R762: 39240/60*nMin*(1000+nGuanQia)/1000 | S762: 31380/60*nMin*(1000+nGuanQia)/1000 | T762: 19320/60*nMin*(1000+nGuanQia)/1000 | U762: 喽啰 | V762: pet_21;pet_201;pet_93;pet_91; | W762: 4 | X762: 5 | Y762: 1,28000,8,0;1,19016,8,0;1,10007,5,0;1,10108,2,0;1,7,9000,0;1,8,9000,0;1,4,1000,0; | Z762: 0 | AA762: {} | AB762: n/60
A763: 759 | B763: 759 | C763: 759 | D763: 弑神试炼 | E763: 10501 | F763: 5 | G763: 3 | H763: 200759 | I763: 0 | J763: 480 | K763: 5000,0; | L763: 5 | M763: 5000,1; | N763: 39240/3600*(nPatrolSec+3)*(1000+nGuanQia)/1000 | O763: 31380/3600*(nPatrolSec+3)*(1000+nGuanQia)/1000 | P763: 19320/3600*(nPatrolSec+3)*(1000+nGuanQia)/1000 | Q763: nGuanQia + 1000 | R763: 39240/60*nMin*(1000+nGuanQia)/1000 | S763: 31380/60*nMin*(1000+nGuanQia)/1000 | T763: 19320/60*nMin*(1000+nGuanQia)/1000 | U763: 喽啰 | V763: pet_21;pet_201;pet_93;pet_91; | W763: 4 | X763: 5 | Y763: 1,28000,8,0;1,19016,8,0;1,10007,5,0;1,10108,2,0;1,7,9000,0;1,8,9000,0;1,4,1000,0; | Z763: 0 | AA763: {} | AB763: n/60
A764: 760 | B764: 760 | C764: 760 | D764: 弑神试炼 | E764: 10501 | F764: 5 | G764: 3 | H764: 200760 | I764: 0 | J764: 480 | K764: 5000,0; | L764: 5 | M764: 5000,1; | N764: 39240/3600*(nPatrolSec+3)*(1000+nGuanQia)/1000 | O764: 31380/3600*(nPatrolSec+3)*(1000+nGuanQia)/1000 | P764: 19320/3600*(nPatrolSec+3)*(1000+nGuanQia)/1000 | Q764: nGuanQia + 1000 | R764: 39240/60*nMin*(1000+nGuanQia)/1000 | S764: 31380/60*nMin*(1000+nGuanQia)/1000 | T764: 19320/60*nMin*(1000+nGuanQia)/1000 | U764: 喽啰 | V764: pet_21;pet_201;pet_93;pet_91; | W764: 4 | X764: 5 | Y764: 1,28000,8,0;1,19016,8,0;1,10007,5,0;1,10108,2,0;1,7,9000,0;1,8,9000,0;1,4,1000,0; | Z764: 0 | AA764: {} | AB764: n/60
A765: 761 | B765: 761 | C765: 761 | D765: 弑神试炼 | E765: 10501 | F765: 5 | G765: 3 | H765: 200761 | I765: 0 | J765: 480 | K765: 5000,0; | L765: 5 | M765: 5000,1; | N765: 39240/3600*(nPatrolSec+3)*(1000+nGuanQia)/1000 | O765: 31380/3600*(nPatrolSec+3)*(1000+nGuanQia)/1000 | P765: 19320/3600*(nPatrolSec+3)*(1000+nGuanQia)/1000 | Q765: nGuanQia + 1000 | R765: 39240/60*nMin*(1000+nGuanQia)/1000 | S765: 31380/60*nMin*(1000+nGuanQia)/1000 | T765: 19320/60*nMin*(1000+nGuanQia)/1000 | U765: 喽啰 | V765: pet_21;pet_201;pet_93;pet_91; | W765: 4 | X765: 5 | Y765: 1,28000,8,0;1,19016,8,0;1,10007,5,0;1,10108,2,0;1,7,9000,0;1,8,9000,0;1,4,1000,0; | Z765: 0 | AA765: {} | AB765: n/60
A766: 762 | B766: 762 | C766: 762 | D766: 弑神试炼 | E766: 10501 | F766: 5 | G766: 3 | H766: 200762 | I766: 0 | J766: 480 | K766: 5000,0; | L766: 5 | M766: 5000,1; | N766: 39240/3600*(nPatrolSec+3)*(1000+nGuanQia)/1000 | O766: 31380/3600*(nPatrolSec+3)*(1000+nGuanQia)/1000 | P766: 19320/3600*(nPatrolSec+3)*(1000+nGuanQia)/1000 | Q766: nGuanQia + 1000 | R766: 39240/60*nMin*(1000+nGuanQia)/1000 | S766: 31380/60*nMin*(1000+nGuanQia)/1000 | T766: 19320/60*nMin*(1000+nGuanQia)/1000 | U766: 喽啰 | V766: pet_21;pet_201;pet_93;pet_91; | W766: 4 | X766: 5 | Y766: 1,28000,8,0;1,19016,8,0;1,10007,5,0;1,10108,2,0;1,7,9000,0;1,8,9000,0;1,4,1000,0; | Z766: 0 | AA766: {} | AB766: n/60
A767: 763 | B767: 763 | C767: 763 | D767: 弑神试炼 | E767: 10501 | F767: 5 | G767: 3 | H767: 200763 | I767: 0 | J767: 480 | K767: 5000,0; | L767: 5 | M767: 5000,1; | N767: 39240/3600*(nPatrolSec+3)*(1000+nGuanQia)/1000 | O767: 31380/3600*(nPatrolSec+3)*(1000+nGuanQia)/1000 | P767: 19320/3600*(nPatrolSec+3)*(1000+nGuanQia)/1000 | Q767: nGuanQia + 1000 | R767: 39240/60*nMin*(1000+nGuanQia)/1000 | S767: 31380/60*nMin*(1000+nGuanQia)/1000 | T767: 19320/60*nMin*(1000+nGuanQia)/1000 | U767: 喽啰 | V767: pet_21;pet_201;pet_93;pet_91; | W767: 4 | X767: 5 | Y767: 1,28000,8,0;1,19016,8,0;1,10007,5,0;1,10108,2,0;1,7,9000,0;1,8,9000,0;1,4,1000,0; | Z767: 0 | AA767: {} | AB767: n/60
A768: 764 | B768: 764 | C768: 764 | D768: 弑神试炼 | E768: 10501 | F768: 5 | G768: 3 | H768: 200764 | I768: 0 | J768: 480 | K768: 5000,0; | L768: 5 | M768: 5000,1; | N768: 39240/3600*(nPatrolSec+3)*(1000+nGuanQia)/1000 | O768: 31380/3600*(nPatrolSec+3)*(1000+nGuanQia)/1000 | P768: 19320/3600*(nPatrolSec+3)*(1000+nGuanQia)/1000 | Q768: nGuanQia + 1000 | R768: 39240/60*nMin*(1000+nGuanQia)/1000 | S768: 31380/60*nMin*(1000+nGuanQia)/1000 | T768: 19320/60*nMin*(1000+nGuanQia)/1000 | U768: 喽啰 | V768: pet_21;pet_201;pet_93;pet_91; | W768: 4 | X768: 5 | Y768: 1,28000,8,0;1,19016,8,0;1,10007,5,0;1,10108,2,0;1,7,9000,0;1,8,9000,0;1,4,1000,0; | Z768: 0 | AA768: {} | AB768: n/60
A769: 765 | B769: 765 | C769: 765 | D769: 弑神试炼 | E769: 10501 | F769: 5 | G769: 3 | H769: 200765 | I769: 0 | J769: 480 | K769: 5000,0; | L769: 5 | M769: 5000,1; | N769: 39240/3600*(nPatrolSec+3)*(1000+nGuanQia)/1000 | O769: 31380/3600*(nPatrolSec+3)*(1000+nGuanQia)/1000 | P769: 19320/3600*(nPatrolSec+3)*(1000+nGuanQia)/1000 | Q769: nGuanQia + 1000 | R769: 39240/60*nMin*(1000+nGuanQia)/1000 | S769: 31380/60*nMin*(1000+nGuanQia)/1000 | T769: 19320/60*nMin*(1000+nGuanQia)/1000 | U769: 喽啰 | V769: pet_21;pet_201;pet_93;pet_91; | W769: 4 | X769: 5 | Y769: 1,28000,8,0;1,19016,8,0;1,10007,5,0;1,10108,2,0;1,7,9000,0;1,8,9000,0;1,4,1000,0; | Z769: 0 | AA769: {} | AB769: n/60
A770: 766 | B770: 766 | C770: 766 | D770: 弑神试炼 | E770: 10501 | F770: 5 | G770: 3 | H770: 200766 | I770: 0 | J770: 480 | K770: 5000,0; | L770: 5 | M770: 5000,1; | N770: 39240/3600*(nPatrolSec+3)*(1000+nGuanQia)/1000 | O770: 31380/3600*(nPatrolSec+3)*(1000+nGuanQia)/1000 | P770: 19320/3600*(nPatrolSec+3)*(1000+nGuanQia)/1000 | Q770: nGuanQia + 1000 | R770: 39240/60*nMin*(1000+nGuanQia)/1000 | S770: 31380/60*nMin*(1000+nGuanQia)/1000 | T770: 19320/60*nMin*(1000+nGuanQia)/1000 | U770: 喽啰 | V770: pet_21;pet_201;pet_93;pet_91; | W770: 4 | X770: 5 | Y770: 1,28000,8,0;1,19016,8,0;1,10007,5,0;1,10108,2,0;1,7,9000,0;1,8,9000,0;1,4,1000,0; | Z770: 0 | AA770: {} | AB770: n/60
A771: 767 | B771: 767 | C771: 767 | D771: 弑神试炼 | E771: 10501 | F771: 5 | G771: 3 | H771: 200767 | I771: 0 | J771: 480 | K771: 5000,0; | L771: 5 | M771: 5000,1; | N771: 39240/3600*(nPatrolSec+3)*(1000+nGuanQia)/1000 | O771: 31380/3600*(nPatrolSec+3)*(1000+nGuanQia)/1000 | P771: 19320/3600*(nPatrolSec+3)*(1000+nGuanQia)/1000 | Q771: nGuanQia + 1000 | R771: 39240/60*nMin*(1000+nGuanQia)/1000 | S771: 31380/60*nMin*(1000+nGuanQia)/1000 | T771: 19320/60*nMin*(1000+nGuanQia)/1000 | U771: 喽啰 | V771: pet_21;pet_201;pet_93;pet_91; | W771: 4 | X771: 5 | Y771: 1,28000,8,0;1,19016,8,0;1,10007,5,0;1,10108,2,0;1,7,9000,0;1,8,9000,0;1,4,1000,0; | Z771: 0 | AA771: {} | AB771: n/60
A772: 768 | B772: 768 | C772: 768 | D772: 弑神试炼 | E772: 10501 | F772: 5 | G772: 3 | H772: 200768 | I772: 0 | J772: 480 | K772: 5000,0; | L772: 5 | M772: 5000,1; | N772: 39240/3600*(nPatrolSec+3)*(1000+nGuanQia)/1000 | O772: 31380/3600*(nPatrolSec+3)*(1000+nGuanQia)/1000 | P772: 19320/3600*(nPatrolSec+3)*(1000+nGuanQia)/1000 | Q772: nGuanQia + 1000 | R772: 39240/60*nMin*(1000+nGuanQia)/1000 | S772: 31380/60*nMin*(1000+nGuanQia)/1000 | T772: 19320/60*nMin*(1000+nGuanQia)/1000 | U772: 喽啰 | V772: pet_21;pet_201;pet_93;pet_91; | W772: 4 | X772: 5 | Y772: 1,28000,8,0;1,19016,8,0;1,10007,5,0;1,10108,2,0;1,7,9000,0;1,8,9000,0;1,4,1000,0; | Z772: 0 | AA772: {} | AB772: n/60
A773: 769 | B773: 769 | C773: 769 | D773: 弑神试炼 | E773: 10501 | F773: 5 | G773: 3 | H773: 200769 | I773: 0 | J773: 480 | K773: 5000,0; | L773: 5 | M773: 5000,1; | N773: 39240/3600*(nPatrolSec+3)*(1000+nGuanQia)/1000 | O773: 31380/3600*(nPatrolSec+3)*(1000+nGuanQia)/1000 | P773: 19320/3600*(nPatrolSec+3)*(1000+nGuanQia)/1000 | Q773: nGuanQia + 1000 | R773: 39240/60*nMin*(1000+nGuanQia)/1000 | S773: 31380/60*nMin*(1000+nGuanQia)/1000 | T773: 19320/60*nMin*(1000+nGuanQia)/1000 | U773: 喽啰 | V773: pet_21;pet_201;pet_93;pet_91; | W773: 4 | X773: 5 | Y773: 1,28000,8,0;1,19016,8,0;1,10007,5,0;1,10108,2,0;1,7,9000,0;1,8,9000,0;1,4,1000,0; | Z773: 0 | AA773: {} | AB773: n/60
A774: 770 | B774: 770 | C774: 770 | D774: 弑神试炼 | E774: 10501 | F774: 5 | G774: 3 | H774: 200770 | I774: 0 | J774: 480 | K774: 5000,0; | L774: 5 | M774: 5000,1; | N774: 39240/3600*(nPatrolSec+3)*(1000+nGuanQia)/1000 | O774: 31380/3600*(nPatrolSec+3)*(1000+nGuanQia)/1000 | P774: 19320/3600*(nPatrolSec+3)*(1000+nGuanQia)/1000 | Q774: nGuanQia + 1000 | R774: 39240/60*nMin*(1000+nGuanQia)/1000 | S774: 31380/60*nMin*(1000+nGuanQia)/1000 | T774: 19320/60*nMin*(1000+nGuanQia)/1000 | U774: 喽啰 | V774: pet_21;pet_201;pet_93;pet_91; | W774: 4 | X774: 5 | Y774: 1,28000,8,0;1,19016,8,0;1,10007,5,0;1,10108,2,0;1,7,9000,0;1,8,9000,0;1,4,1000,0; | Z774: 0 | AA774: {} | AB774: n/60
A775: 771 | B775: 771 | C775: 771 | D775: 弑神试炼 | E775: 10501 | F775: 5 | G775: 3 | H775: 200771 | I775: 0 | J775: 480 | K775: 5000,0; | L775: 5 | M775: 5000,1; | N775: 39240/3600*(nPatrolSec+3)*(1000+nGuanQia)/1000 | O775: 31380/3600*(nPatrolSec+3)*(1000+nGuanQia)/1000 | P775: 19320/3600*(nPatrolSec+3)*(1000+nGuanQia)/1000 | Q775: nGuanQia + 1000 | R775: 39240/60*nMin*(1000+nGuanQia)/1000 | S775: 31380/60*nMin*(1000+nGuanQia)/1000 | T775: 19320/60*nMin*(1000+nGuanQia)/1000 | U775: 喽啰 | V775: pet_21;pet_201;pet_93;pet_91; | W775: 4 | X775: 5 | Y775: 1,28000,8,0;1,19016,8,0;1,10007,5,0;1,10108,2,0;1,7,9000,0;1,8,9000,0;1,4,1000,0; | Z775: 0 | AA775: {} | AB775: n/60
A776: 772 | B776: 772 | C776: 772 | D776: 弑神试炼 | E776: 10501 | F776: 5 | G776: 3 | H776: 200772 | I776: 0 | J776: 480 | K776: 5000,0; | L776: 5 | M776: 5000,1; | N776: 39240/3600*(nPatrolSec+3)*(1000+nGuanQia)/1000 | O776: 31380/3600*(nPatrolSec+3)*(1000+nGuanQia)/1000 | P776: 19320/3600*(nPatrolSec+3)*(1000+nGuanQia)/1000 | Q776: nGuanQia + 1000 | R776: 39240/60*nMin*(1000+nGuanQia)/1000 | S776: 31380/60*nMin*(1000+nGuanQia)/1000 | T776: 19320/60*nMin*(1000+nGuanQia)/1000 | U776: 喽啰 | V776: pet_21;pet_201;pet_93;pet_91; | W776: 4 | X776: 5 | Y776: 1,28000,8,0;1,19016,8,0;1,10007,5,0;1,10108,2,0;1,7,9000,0;1,8,9000,0;1,4,1000,0; | Z776: 0 | AA776: {} | AB776: n/60
A777: 773 | B777: 773 | C777: 773 | D777: 弑神试炼 | E777: 10501 | F777: 5 | G777: 3 | H777: 200773 | I777: 0 | J777: 480 | K777: 5000,0; | L777: 5 | M777: 5000,1; | N777: 39240/3600*(nPatrolSec+3)*(1000+nGuanQia)/1000 | O777: 31380/3600*(nPatrolSec+3)*(1000+nGuanQia)/1000 | P777: 19320/3600*(nPatrolSec+3)*(1000+nGuanQia)/1000 | Q777: nGuanQia + 1000 | R777: 39240/60*nMin*(1000+nGuanQia)/1000 | S777: 31380/60*nMin*(1000+nGuanQia)/1000 | T777: 19320/60*nMin*(1000+nGuanQia)/1000 | U777: 喽啰 | V777: pet_21;pet_201;pet_93;pet_91; | W777: 4 | X777: 5 | Y777: 1,28000,8,0;1,19016,8,0;1,10007,5,0;1,10108,2,0;1,7,9000,0;1,8,9000,0;1,4,1000,0; | Z777: 0 | AA777: {} | AB777: n/60
A778: 774 | B778: 774 | C778: 774 | D778: 弑神试炼 | E778: 10501 | F778: 5 | G778: 3 | H778: 200774 | I778: 0 | J778: 480 | K778: 5000,0; | L778: 5 | M778: 5000,1; | N778: 39240/3600*(nPatrolSec+3)*(1000+nGuanQia)/1000 | O778: 31380/3600*(nPatrolSec+3)*(1000+nGuanQia)/1000 | P778: 19320/3600*(nPatrolSec+3)*(1000+nGuanQia)/1000 | Q778: nGuanQia + 1000 | R778: 39240/60*nMin*(1000+nGuanQia)/1000 | S778: 31380/60*nMin*(1000+nGuanQia)/1000 | T778: 19320/60*nMin*(1000+nGuanQia)/1000 | U778: 喽啰 | V778: pet_21;pet_201;pet_93;pet_91; | W778: 4 | X778: 5 | Y778: 1,28000,8,0;1,19016,8,0;1,10007,5,0;1,10108,2,0;1,7,9000,0;1,8,9000,0;1,4,1000,0; | Z778: 0 | AA778: {} | AB778: n/60
A779: 775 | B779: 775 | C779: 775 | D779: 弑神试炼 | E779: 10501 | F779: 5 | G779: 3 | H779: 200775 | I779: 0 | J779: 480 | K779: 5000,0; | L779: 5 | M779: 5000,1; | N779: 39240/3600*(nPatrolSec+3)*(1000+nGuanQia)/1000 | O779: 31380/3600*(nPatrolSec+3)*(1000+nGuanQia)/1000 | P779: 19320/3600*(nPatrolSec+3)*(1000+nGuanQia)/1000 | Q779: nGuanQia + 1000 | R779: 39240/60*nMin*(1000+nGuanQia)/1000 | S779: 31380/60*nMin*(1000+nGuanQia)/1000 | T779: 19320/60*nMin*(1000+nGuanQia)/1000 | U779: 喽啰 | V779: pet_21;pet_201;pet_93;pet_91; | W779: 4 | X779: 5 | Y779: 1,28000,8,0;1,19016,8,0;1,10007,5,0;1,10108,2,0;1,7,9000,0;1,8,9000,0;1,4,1000,0; | Z779: 0 | AA779: {} | AB779: n/60
A780: 776 | B780: 776 | C780: 776 | D780: 弑神试炼 | E780: 10501 | F780: 5 | G780: 3 | H780: 200776 | I780: 0 | J780: 480 | K780: 5000,0; | L780: 5 | M780: 5000,1; | N780: 39240/3600*(nPatrolSec+3)*(1000+nGuanQia)/1000 | O780: 31380/3600*(nPatrolSec+3)*(1000+nGuanQia)/1000 | P780: 19320/3600*(nPatrolSec+3)*(1000+nGuanQia)/1000 | Q780: nGuanQia + 1000 | R780: 39240/60*nMin*(1000+nGuanQia)/1000 | S780: 31380/60*nMin*(1000+nGuanQia)/1000 | T780: 19320/60*nMin*(1000+nGuanQia)/1000 | U780: 喽啰 | V780: pet_21;pet_201;pet_93;pet_91; | W780: 4 | X780: 5 | Y780: 1,28000,8,0;1,19016,8,0;1,10007,5,0;1,10108,2,0;1,7,9000,0;1,8,9000,0;1,4,1000,0; | Z780: 0 | AA780: {} | AB780: n/60
A781: 777 | B781: 777 | C781: 777 | D781: 弑神试炼 | E781: 10501 | F781: 5 | G781: 3 | H781: 200777 | I781: 0 | J781: 480 | K781: 5000,0; | L781: 5 | M781: 5000,1; | N781: 39240/3600*(nPatrolSec+3)*(1000+nGuanQia)/1000 | O781: 31380/3600*(nPatrolSec+3)*(1000+nGuanQia)/1000 | P781: 19320/3600*(nPatrolSec+3)*(1000+nGuanQia)/1000 | Q781: nGuanQia + 1000 | R781: 39240/60*nMin*(1000+nGuanQia)/1000 | S781: 31380/60*nMin*(1000+nGuanQia)/1000 | T781: 19320/60*nMin*(1000+nGuanQia)/1000 | U781: 喽啰 | V781: pet_21;pet_201;pet_93;pet_91; | W781: 4 | X781: 5 | Y781: 1,28000,8,0;1,19016,8,0;1,10007,5,0;1,10108,2,0;1,7,9000,0;1,8,9000,0;1,4,1000,0; | Z781: 0 | AA781: {} | AB781: n/60
A782: 778 | B782: 778 | C782: 778 | D782: 弑神试炼 | E782: 10501 | F782: 5 | G782: 3 | H782: 200778 | I782: 0 | J782: 480 | K782: 5000,0; | L782: 5 | M782: 5000,1; | N782: 39240/3600*(nPatrolSec+3)*(1000+nGuanQia)/1000 | O782: 31380/3600*(nPatrolSec+3)*(1000+nGuanQia)/1000 | P782: 19320/3600*(nPatrolSec+3)*(1000+nGuanQia)/1000 | Q782: nGuanQia + 1000 | R782: 39240/60*nMin*(1000+nGuanQia)/1000 | S782: 31380/60*nMin*(1000+nGuanQia)/1000 | T782: 19320/60*nMin*(1000+nGuanQia)/1000 | U782: 喽啰 | V782: pet_21;pet_201;pet_93;pet_91; | W782: 4 | X782: 5 | Y782: 1,28000,8,0;1,19016,8,0;1,10007,5,0;1,10108,2,0;1,7,9000,0;1,8,9000,0;1,4,1000,0; | Z782: 0 | AA782: {} | AB782: n/60
A783: 779 | B783: 779 | C783: 779 | D783: 弑神试炼 | E783: 10501 | F783: 5 | G783: 3 | H783: 200779 | I783: 0 | J783: 480 | K783: 5000,0; | L783: 5 | M783: 5000,1; | N783: 39240/3600*(nPatrolSec+3)*(1000+nGuanQia)/1000 | O783: 31380/3600*(nPatrolSec+3)*(1000+nGuanQia)/1000 | P783: 19320/3600*(nPatrolSec+3)*(1000+nGuanQia)/1000 | Q783: nGuanQia + 1000 | R783: 39240/60*nMin*(1000+nGuanQia)/1000 | S783: 31380/60*nMin*(1000+nGuanQia)/1000 | T783: 19320/60*nMin*(1000+nGuanQia)/1000 | U783: 喽啰 | V783: pet_21;pet_201;pet_93;pet_91; | W783: 4 | X783: 5 | Y783: 1,28000,8,0;1,19016,8,0;1,10007,5,0;1,10108,2,0;1,7,9000,0;1,8,9000,0;1,4,1000,0; | Z783: 0 | AA783: {} | AB783: n/60
A784: 780 | B784: 780 | C784: 780 | D784: 弑神试炼 | E784: 10501 | F784: 5 | G784: 3 | H784: 200780 | I784: 0 | J784: 480 | K784: 5000,0; | L784: 5 | M784: 5000,1; | N784: 39240/3600*(nPatrolSec+3)*(1000+nGuanQia)/1000 | O784: 31380/3600*(nPatrolSec+3)*(1000+nGuanQia)/1000 | P784: 19320/3600*(nPatrolSec+3)*(1000+nGuanQia)/1000 | Q784: nGuanQia + 1000 | R784: 39240/60*nMin*(1000+nGuanQia)/1000 | S784: 31380/60*nMin*(1000+nGuanQia)/1000 | T784: 19320/60*nMin*(1000+nGuanQia)/1000 | U784: 喽啰 | V784: pet_21;pet_201;pet_93;pet_91; | W784: 4 | X784: 5 | Y784: 1,28000,8,0;1,19016,8,0;1,10007,5,0;1,10108,2,0;1,7,9000,0;1,8,9000,0;1,4,1000,0; | Z784: 0 | AA784: {} | AB784: n/60
A785: 781 | B785: 781 | C785: 781 | D785: 弑神试炼 | E785: 10501 | F785: 5 | G785: 3 | H785: 200781 | I785: 0 | J785: 480 | K785: 5000,0; | L785: 5 | M785: 5000,1; | N785: 39240/3600*(nPatrolSec+3)*(1000+nGuanQia)/1000 | O785: 31380/3600*(nPatrolSec+3)*(1000+nGuanQia)/1000 | P785: 19320/3600*(nPatrolSec+3)*(1000+nGuanQia)/1000 | Q785: nGuanQia + 1000 | R785: 39240/60*nMin*(1000+nGuanQia)/1000 | S785: 31380/60*nMin*(1000+nGuanQia)/1000 | T785: 19320/60*nMin*(1000+nGuanQia)/1000 | U785: 喽啰 | V785: pet_21;pet_201;pet_93;pet_91; | W785: 4 | X785: 5 | Y785: 1,28000,8,0;1,19016,8,0;1,10007,5,0;1,10108,2,0;1,7,9000,0;1,8,9000,0;1,4,1000,0; | Z785: 0 | AA785: {} | AB785: n/60
A786: 782 | B786: 782 | C786: 782 | D786: 弑神试炼 | E786: 10501 | F786: 5 | G786: 3 | H786: 200782 | I786: 0 | J786: 480 | K786: 5000,0; | L786: 5 | M786: 5000,1; | N786: 39240/3600*(nPatrolSec+3)*(1000+nGuanQia)/1000 | O786: 31380/3600*(nPatrolSec+3)*(1000+nGuanQia)/1000 | P786: 19320/3600*(nPatrolSec+3)*(1000+nGuanQia)/1000 | Q786: nGuanQia + 1000 | R786: 39240/60*nMin*(1000+nGuanQia)/1000 | S786: 31380/60*nMin*(1000+nGuanQia)/1000 | T786: 19320/60*nMin*(1000+nGuanQia)/1000 | U786: 喽啰 | V786: pet_21;pet_201;pet_93;pet_91; | W786: 4 | X786: 5 | Y786: 1,28000,8,0;1,19016,8,0;1,10007,5,0;1,10108,2,0;1,7,9000,0;1,8,9000,0;1,4,1000,0; | Z786: 0 | AA786: {} | AB786: n/60
A787: 783 | B787: 783 | C787: 783 | D787: 弑神试炼 | E787: 10501 | F787: 5 | G787: 3 | H787: 200783 | I787: 0 | J787: 480 | K787: 5000,0; | L787: 5 | M787: 5000,1; | N787: 39240/3600*(nPatrolSec+3)*(1000+nGuanQia)/1000 | O787: 31380/3600*(nPatrolSec+3)*(1000+nGuanQia)/1000 | P787: 19320/3600*(nPatrolSec+3)*(1000+nGuanQia)/1000 | Q787: nGuanQia + 1000 | R787: 39240/60*nMin*(1000+nGuanQia)/1000 | S787: 31380/60*nMin*(1000+nGuanQia)/1000 | T787: 19320/60*nMin*(1000+nGuanQia)/1000 | U787: 喽啰 | V787: pet_21;pet_201;pet_93;pet_91; | W787: 4 | X787: 5 | Y787: 1,28000,8,0;1,19016,8,0;1,10007,5,0;1,10108,2,0;1,7,9000,0;1,8,9000,0;1,4,1000,0; | Z787: 0 | AA787: {} | AB787: n/60
A788: 784 | B788: 784 | C788: 784 | D788: 弑神试炼 | E788: 10501 | F788: 5 | G788: 3 | H788: 200784 | I788: 0 | J788: 480 | K788: 5000,0; | L788: 5 | M788: 5000,1; | N788: 39240/3600*(nPatrolSec+3)*(1000+nGuanQia)/1000 | O788: 31380/3600*(nPatrolSec+3)*(1000+nGuanQia)/1000 | P788: 19320/3600*(nPatrolSec+3)*(1000+nGuanQia)/1000 | Q788: nGuanQia + 1000 | R788: 39240/60*nMin*(1000+nGuanQia)/1000 | S788: 31380/60*nMin*(1000+nGuanQia)/1000 | T788: 19320/60*nMin*(1000+nGuanQia)/1000 | U788: 喽啰 | V788: pet_21;pet_201;pet_93;pet_91; | W788: 4 | X788: 5 | Y788: 1,28000,8,0;1,19016,8,0;1,10007,5,0;1,10108,2,0;1,7,9000,0;1,8,9000,0;1,4,1000,0; | Z788: 0 | AA788: {} | AB788: n/60
A789: 785 | B789: 785 | C789: 785 | D789: 弑神试炼 | E789: 10501 | F789: 5 | G789: 3 | H789: 200785 | I789: 0 | J789: 480 | K789: 5000,0; | L789: 5 | M789: 5000,1; | N789: 39240/3600*(nPatrolSec+3)*(1000+nGuanQia)/1000 | O789: 31380/3600*(nPatrolSec+3)*(1000+nGuanQia)/1000 | P789: 19320/3600*(nPatrolSec+3)*(1000+nGuanQia)/1000 | Q789: nGuanQia + 1000 | R789: 39240/60*nMin*(1000+nGuanQia)/1000 | S789: 31380/60*nMin*(1000+nGuanQia)/1000 | T789: 19320/60*nMin*(1000+nGuanQia)/1000 | U789: 喽啰 | V789: pet_21;pet_201;pet_93;pet_91; | W789: 4 | X789: 5 | Y789: 1,28000,8,0;1,19016,8,0;1,10007,5,0;1,10108,2,0;1,7,9000,0;1,8,9000,0;1,4,1000,0; | Z789: 0 | AA789: {} | AB789: n/60
A790: 786 | B790: 786 | C790: 786 | D790: 弑神试炼 | E790: 10501 | F790: 5 | G790: 3 | H790: 200786 | I790: 0 | J790: 480 | K790: 5000,0; | L790: 5 | M790: 5000,1; | N790: 39240/3600*(nPatrolSec+3)*(1000+nGuanQia)/1000 | O790: 31380/3600*(nPatrolSec+3)*(1000+nGuanQia)/1000 | P790: 19320/3600*(nPatrolSec+3)*(1000+nGuanQia)/1000 | Q790: nGuanQia + 1000 | R790: 39240/60*nMin*(1000+nGuanQia)/1000 | S790: 31380/60*nMin*(1000+nGuanQia)/1000 | T790: 19320/60*nMin*(1000+nGuanQia)/1000 | U790: 喽啰 | V790: pet_21;pet_201;pet_93;pet_91; | W790: 4 | X790: 5 | Y790: 1,28000,8,0;1,19016,8,0;1,10007,5,0;1,10108,2,0;1,7,9000,0;1,8,9000,0;1,4,1000,0; | Z790: 0 | AA790: {} | AB790: n/60
A791: 787 | B791: 787 | C791: 787 | D791: 弑神试炼 | E791: 10501 | F791: 5 | G791: 3 | H791: 200787 | I791: 0 | J791: 480 | K791: 5000,0; | L791: 5 | M791: 5000,1; | N791: 39240/3600*(nPatrolSec+3)*(1000+nGuanQia)/1000 | O791: 31380/3600*(nPatrolSec+3)*(1000+nGuanQia)/1000 | P791: 19320/3600*(nPatrolSec+3)*(1000+nGuanQia)/1000 | Q791: nGuanQia + 1000 | R791: 39240/60*nMin*(1000+nGuanQia)/1000 | S791: 31380/60*nMin*(1000+nGuanQia)/1000 | T791: 19320/60*nMin*(1000+nGuanQia)/1000 | U791: 喽啰 | V791: pet_21;pet_201;pet_93;pet_91; | W791: 4 | X791: 5 | Y791: 1,28000,8,0;1,19016,8,0;1,10007,5,0;1,10108,2,0;1,7,9000,0;1,8,9000,0;1,4,1000,0; | Z791: 0 | AA791: {} | AB791: n/60
A792: 788 | B792: 788 | C792: 788 | D792: 弑神试炼 | E792: 10501 | F792: 5 | G792: 3 | H792: 200788 | I792: 0 | J792: 480 | K792: 5000,0; | L792: 5 | M792: 5000,1; | N792: 39240/3600*(nPatrolSec+3)*(1000+nGuanQia)/1000 | O792: 31380/3600*(nPatrolSec+3)*(1000+nGuanQia)/1000 | P792: 19320/3600*(nPatrolSec+3)*(1000+nGuanQia)/1000 | Q792: nGuanQia + 1000 | R792: 39240/60*nMin*(1000+nGuanQia)/1000 | S792: 31380/60*nMin*(1000+nGuanQia)/1000 | T792: 19320/60*nMin*(1000+nGuanQia)/1000 | U792: 喽啰 | V792: pet_21;pet_201;pet_93;pet_91; | W792: 4 | X792: 5 | Y792: 1,28000,8,0;1,19016,8,0;1,10007,5,0;1,10108,2,0;1,7,9000,0;1,8,9000,0;1,4,1000,0; | Z792: 0 | AA792: {} | AB792: n/60
A793: 789 | B793: 789 | C793: 789 | D793: 弑神试炼 | E793: 10501 | F793: 5 | G793: 3 | H793: 200789 | I793: 0 | J793: 480 | K793: 5000,0; | L793: 5 | M793: 5000,1; | N793: 39240/3600*(nPatrolSec+3)*(1000+nGuanQia)/1000 | O793: 31380/3600*(nPatrolSec+3)*(1000+nGuanQia)/1000 | P793: 19320/3600*(nPatrolSec+3)*(1000+nGuanQia)/1000 | Q793: nGuanQia + 1000 | R793: 39240/60*nMin*(1000+nGuanQia)/1000 | S793: 31380/60*nMin*(1000+nGuanQia)/1000 | T793: 19320/60*nMin*(1000+nGuanQia)/1000 | U793: 喽啰 | V793: pet_21;pet_201;pet_93;pet_91; | W793: 4 | X793: 5 | Y793: 1,28000,8,0;1,19016,8,0;1,10007,5,0;1,10108,2,0;1,7,9000,0;1,8,9000,0;1,4,1000,0; | Z793: 0 | AA793: {} | AB793: n/60
A794: 790 | B794: 790 | C794: 790 | D794: 弑神试炼 | E794: 10501 | F794: 5 | G794: 3 | H794: 200790 | I794: 0 | J794: 480 | K794: 5000,0; | L794: 5 | M794: 5000,1; | N794: 39240/3600*(nPatrolSec+3)*(1000+nGuanQia)/1000 | O794: 31380/3600*(nPatrolSec+3)*(1000+nGuanQia)/1000 | P794: 19320/3600*(nPatrolSec+3)*(1000+nGuanQia)/1000 | Q794: nGuanQia + 1000 | R794: 39240/60*nMin*(1000+nGuanQia)/1000 | S794: 31380/60*nMin*(1000+nGuanQia)/1000 | T794: 19320/60*nMin*(1000+nGuanQia)/1000 | U794: 喽啰 | V794: pet_21;pet_201;pet_93;pet_91; | W794: 4 | X794: 5 | Y794: 1,28000,8,0;1,19016,8,0;1,10007,5,0;1,10108,2,0;1,7,9000,0;1,8,9000,0;1,4,1000,0; | Z794: 0 | AA794: {} | AB794: n/60
A795: 791 | B795: 791 | C795: 791 | D795: 弑神试炼 | E795: 10501 | F795: 5 | G795: 3 | H795: 200791 | I795: 0 | J795: 480 | K795: 5000,0; | L795: 5 | M795: 5000,1; | N795: 39240/3600*(nPatrolSec+3)*(1000+nGuanQia)/1000 | O795: 31380/3600*(nPatrolSec+3)*(1000+nGuanQia)/1000 | P795: 19320/3600*(nPatrolSec+3)*(1000+nGuanQia)/1000 | Q795: nGuanQia + 1000 | R795: 39240/60*nMin*(1000+nGuanQia)/1000 | S795: 31380/60*nMin*(1000+nGuanQia)/1000 | T795: 19320/60*nMin*(1000+nGuanQia)/1000 | U795: 喽啰 | V795: pet_21;pet_201;pet_93;pet_91; | W795: 4 | X795: 5 | Y795: 1,28000,8,0;1,19016,8,0;1,10007,5,0;1,10108,2,0;1,7,9000,0;1,8,9000,0;1,4,1000,0; | Z795: 0 | AA795: {} | AB795: n/60
A796: 792 | B796: 792 | C796: 792 | D796: 弑神试炼 | E796: 10501 | F796: 5 | G796: 3 | H796: 200792 | I796: 0 | J796: 480 | K796: 5000,0; | L796: 5 | M796: 5000,1; | N796: 39240/3600*(nPatrolSec+3)*(1000+nGuanQia)/1000 | O796: 31380/3600*(nPatrolSec+3)*(1000+nGuanQia)/1000 | P796: 19320/3600*(nPatrolSec+3)*(1000+nGuanQia)/1000 | Q796: nGuanQia + 1000 | R796: 39240/60*nMin*(1000+nGuanQia)/1000 | S796: 31380/60*nMin*(1000+nGuanQia)/1000 | T796: 19320/60*nMin*(1000+nGuanQia)/1000 | U796: 喽啰 | V796: pet_21;pet_201;pet_93;pet_91; | W796: 4 | X796: 5 | Y796: 1,28000,8,0;1,19016,8,0;1,10007,5,0;1,10108,2,0;1,7,9000,0;1,8,9000,0;1,4,1000,0; | Z796: 0 | AA796: {} | AB796: n/60
A797: 793 | B797: 793 | C797: 793 | D797: 弑神试炼 | E797: 10501 | F797: 5 | G797: 3 | H797: 200793 | I797: 0 | J797: 480 | K797: 5000,0; | L797: 5 | M797: 5000,1; | N797: 39240/3600*(nPatrolSec+3)*(1000+nGuanQia)/1000 | O797: 31380/3600*(nPatrolSec+3)*(1000+nGuanQia)/1000 | P797: 19320/3600*(nPatrolSec+3)*(1000+nGuanQia)/1000 | Q797: nGuanQia + 1000 | R797: 39240/60*nMin*(1000+nGuanQia)/1000 | S797: 31380/60*nMin*(1000+nGuanQia)/1000 | T797: 19320/60*nMin*(1000+nGuanQia)/1000 | U797: 喽啰 | V797: pet_21;pet_201;pet_93;pet_91; | W797: 4 | X797: 5 | Y797: 1,28000,8,0;1,19016,8,0;1,10007,5,0;1,10108,2,0;1,7,9000,0;1,8,9000,0;1,4,1000,0; | Z797: 0 | AA797: {} | AB797: n/60
A798: 794 | B798: 794 | C798: 794 | D798: 弑神试炼 | E798: 10501 | F798: 5 | G798: 3 | H798: 200794 | I798: 0 | J798: 480 | K798: 5000,0; | L798: 5 | M798: 5000,1; | N798: 39240/3600*(nPatrolSec+3)*(1000+nGuanQia)/1000 | O798: 31380/3600*(nPatrolSec+3)*(1000+nGuanQia)/1000 | P798: 19320/3600*(nPatrolSec+3)*(1000+nGuanQia)/1000 | Q798: nGuanQia + 1000 | R798: 39240/60*nMin*(1000+nGuanQia)/1000 | S798: 31380/60*nMin*(1000+nGuanQia)/1000 | T798: 19320/60*nMin*(1000+nGuanQia)/1000 | U798: 喽啰 | V798: pet_21;pet_201;pet_93;pet_91; | W798: 4 | X798: 5 | Y798: 1,28000,8,0;1,19016,8,0;1,10007,5,0;1,10108,2,0;1,7,9000,0;1,8,9000,0;1,4,1000,0; | Z798: 0 | AA798: {} | AB798: n/60
A799: 795 | B799: 795 | C799: 795 | D799: 弑神试炼 | E799: 10501 | F799: 5 | G799: 3 | H799: 200795 | I799: 0 | J799: 480 | K799: 5000,0; | L799: 5 | M799: 5000,1; | N799: 39240/3600*(nPatrolSec+3)*(1000+nGuanQia)/1000 | O799: 31380/3600*(nPatrolSec+3)*(1000+nGuanQia)/1000 | P799: 19320/3600*(nPatrolSec+3)*(1000+nGuanQia)/1000 | Q799: nGuanQia + 1000 | R799: 39240/60*nMin*(1000+nGuanQia)/1000 | S799: 31380/60*nMin*(1000+nGuanQia)/1000 | T799: 19320/60*nMin*(1000+nGuanQia)/1000 | U799: 喽啰 | V799: pet_21;pet_201;pet_93;pet_91; | W799: 4 | X799: 5 | Y799: 1,28000,8,0;1,19016,8,0;1,10007,5,0;1,10108,2,0;1,7,9000,0;1,8,9000,0;1,4,1000,0; | Z799: 0 | AA799: {} | AB799: n/60
A800: 796 | B800: 796 | C800: 796 | D800: 弑神试炼 | E800: 10501 | F800: 5 | G800: 3 | H800: 200796 | I800: 0 | J800: 480 | K800: 5000,0; | L800: 5 | M800: 5000,1; | N800: 39240/3600*(nPatrolSec+3)*(1000+nGuanQia)/1000 | O800: 31380/3600*(nPatrolSec+3)*(1000+nGuanQia)/1000 | P800: 19320/3600*(nPatrolSec+3)*(1000+nGuanQia)/1000 | Q800: nGuanQia + 1000 | R800: 39240/60*nMin*(1000+nGuanQia)/1000 | S800: 31380/60*nMin*(1000+nGuanQia)/1000 | T800: 19320/60*nMin*(1000+nGuanQia)/1000 | U800: 喽啰 | V800: pet_21;pet_201;pet_93;pet_91; | W800: 4 | X800: 5 | Y800: 1,28000,8,0;1,19016,8,0;1,10007,5,0;1,10108,2,0;1,7,9000,0;1,8,9000,0;1,4,1000,0; | Z800: 0 | AA800: {} | AB800: n/60
A801: 797 | B801: 797 | C801: 797 | D801: 弑神试炼 | E801: 10501 | F801: 5 | G801: 3 | H801: 200797 | I801: 0 | J801: 480 | K801: 5000,0; | L801: 5 | M801: 5000,1; | N801: 39240/3600*(nPatrolSec+3)*(1000+nGuanQia)/1000 | O801: 31380/3600*(nPatrolSec+3)*(1000+nGuanQia)/1000 | P801: 19320/3600*(nPatrolSec+3)*(1000+nGuanQia)/1000 | Q801: nGuanQia + 1000 | R801: 39240/60*nMin*(1000+nGuanQia)/1000 | S801: 31380/60*nMin*(1000+nGuanQia)/1000 | T801: 19320/60*nMin*(1000+nGuanQia)/1000 | U801: 喽啰 | V801: pet_21;pet_201;pet_93;pet_91; | W801: 4 | X801: 5 | Y801: 1,28000,8,0;1,19016,8,0;1,10007,5,0;1,10108,2,0;1,7,9000,0;1,8,9000,0;1,4,1000,0; | Z801: 0 | AA801: {} | AB801: n/60
A802: 798 | B802: 798 | C802: 798 | D802: 弑神试炼 | E802: 10501 | F802: 5 | G802: 3 | H802: 200798 | I802: 0 | J802: 480 | K802: 5000,0; | L802: 5 | M802: 5000,1; | N802: 39240/3600*(nPatrolSec+3)*(1000+nGuanQia)/1000 | O802: 31380/3600*(nPatrolSec+3)*(1000+nGuanQia)/1000 | P802: 19320/3600*(nPatrolSec+3)*(1000+nGuanQia)/1000 | Q802: nGuanQia + 1000 | R802: 39240/60*nMin*(1000+nGuanQia)/1000 | S802: 31380/60*nMin*(1000+nGuanQia)/1000 | T802: 19320/60*nMin*(1000+nGuanQia)/1000 | U802: 喽啰 | V802: pet_21;pet_201;pet_93;pet_91; | W802: 4 | X802: 5 | Y802: 1,28000,8,0;1,19016,8,0;1,10007,5,0;1,10108,2,0;1,7,9000,0;1,8,9000,0;1,4,1000,0; | Z802: 0 | AA802: {} | AB802: n/60
A803: 799 | B803: 799 | C803: 799 | D803: 弑神试炼 | E803: 10501 | F803: 5 | G803: 3 | H803: 200799 | I803: 0 | J803: 480 | K803: 5000,0; | L803: 5 | M803: 5000,1; | N803: 39240/3600*(nPatrolSec+3)*(1000+nGuanQia)/1000 | O803: 31380/3600*(nPatrolSec+3)*(1000+nGuanQia)/1000 | P803: 19320/3600*(nPatrolSec+3)*(1000+nGuanQia)/1000 | Q803: nGuanQia + 1000 | R803: 39240/60*nMin*(1000+nGuanQia)/1000 | S803: 31380/60*nMin*(1000+nGuanQia)/1000 | T803: 19320/60*nMin*(1000+nGuanQia)/1000 | U803: 喽啰 | V803: pet_21;pet_201;pet_93;pet_91; | W803: 4 | X803: 5 | Y803: 1,28000,8,0;1,19016,8,0;1,10007,5,0;1,10108,2,0;1,7,9000,0;1,8,9000,0;1,4,1000,0; | Z803: 0 | AA803: {} | AB803: n/60
A804: 800 | B804: 800 | C804: 800 | D804: 弑神试炼 | E804: 10501 | F804: 5 | G804: 3 | H804: 200800 | I804: 0 | J804: 480 | K804: 5000,0; | L804: 5 | M804: 5000,1; | N804: 39240/3600*(nPatrolSec+3)*(1000+nGuanQia)/1000 | O804: 31380/3600*(nPatrolSec+3)*(1000+nGuanQia)/1000 | P804: 19320/3600*(nPatrolSec+3)*(1000+nGuanQia)/1000 | Q804: nGuanQia + 1000 | R804: 39240/60*nMin*(1000+nGuanQia)/1000 | S804: 31380/60*nMin*(1000+nGuanQia)/1000 | T804: 19320/60*nMin*(1000+nGuanQia)/1000 | U804: 喽啰 | V804: pet_21;pet_201;pet_93;pet_91; | W804: 4 | X804: 5 | Y804: 1,28000,8,0;1,19016,8,0;1,10007,5,0;1,10108,2,0;1,7,9000,0;1,8,9000,0;1,4,1000,0; | Z804: 0 | AA804: {} | AB804: n/60
A805: 801 | B805: 801 | C805: 801 | D805: 弑神试炼 | E805: 10501 | F805: 5 | G805: 3 | H805: 200801 | I805: 0 | J805: 480 | K805: 5000,0; | L805: 5 | M805: 5000,1; | N805: 39240/3600*(nPatrolSec+3)*(1000+nGuanQia)/1000 | O805: 31380/3600*(nPatrolSec+3)*(1000+nGuanQia)/1000 | P805: 19320/3600*(nPatrolSec+3)*(1000+nGuanQia)/1000 | Q805: nGuanQia + 1000 | R805: 39240/60*nMin*(1000+nGuanQia)/1000 | S805: 31380/60*nMin*(1000+nGuanQia)/1000 | T805: 19320/60*nMin*(1000+nGuanQia)/1000 | U805: 喽啰 | V805: pet_21;pet_201;pet_93;pet_91; | W805: 4 | X805: 5 | Y805: 1,28000,8,0;1,19016,8,0;1,10007,5,0;1,10108,2,0;1,7,9000,0;1,8,9000,0;1,4,1000,0; | Z805: 0 | AA805: {} | AB805: n/60
A806: 802 | B806: 802 | C806: 802 | D806: 弑神试炼 | E806: 10501 | F806: 5 | G806: 3 | H806: 200802 | I806: 0 | J806: 480 | K806: 5000,0; | L806: 5 | M806: 5000,1; | N806: 39240/3600*(nPatrolSec+3)*(1000+nGuanQia)/1000 | O806: 31380/3600*(nPatrolSec+3)*(1000+nGuanQia)/1000 | P806: 19320/3600*(nPatrolSec+3)*(1000+nGuanQia)/1000 | Q806: nGuanQia + 1000 | R806: 39240/60*nMin*(1000+nGuanQia)/1000 | S806: 31380/60*nMin*(1000+nGuanQia)/1000 | T806: 19320/60*nMin*(1000+nGuanQia)/1000 | U806: 喽啰 | V806: pet_21;pet_201;pet_93;pet_91; | W806: 4 | X806: 5 | Y806: 1,28000,8,0;1,19016,8,0;1,10007,5,0;1,10108,2,0;1,7,9000,0;1,8,9000,0;1,4,1000,0; | Z806: 0 | AA806: {} | AB806: n/60
A807: 803 | B807: 803 | C807: 803 | D807: 弑神试炼 | E807: 10501 | F807: 5 | G807: 3 | H807: 200803 | I807: 0 | J807: 480 | K807: 5000,0; | L807: 5 | M807: 5000,1; | N807: 39240/3600*(nPatrolSec+3)*(1000+nGuanQia)/1000 | O807: 31380/3600*(nPatrolSec+3)*(1000+nGuanQia)/1000 | P807: 19320/3600*(nPatrolSec+3)*(1000+nGuanQia)/1000 | Q807: nGuanQia + 1000 | R807: 39240/60*nMin*(1000+nGuanQia)/1000 | S807: 31380/60*nMin*(1000+nGuanQia)/1000 | T807: 19320/60*nMin*(1000+nGuanQia)/1000 | U807: 喽啰 | V807: pet_21;pet_201;pet_93;pet_91; | W807: 4 | X807: 5 | Y807: 1,28000,8,0;1,19016,8,0;1,10007,5,0;1,10108,2,0;1,7,9000,0;1,8,9000,0;1,4,1000,0; | Z807: 0 | AA807: {} | AB807: n/60
A808: 804 | B808: 804 | C808: 804 | D808: 弑神试炼 | E808: 10501 | F808: 5 | G808: 3 | H808: 200804 | I808: 0 | J808: 480 | K808: 5000,0; | L808: 5 | M808: 5000,1; | N808: 39240/3600*(nPatrolSec+3)*(1000+nGuanQia)/1000 | O808: 31380/3600*(nPatrolSec+3)*(1000+nGuanQia)/1000 | P808: 19320/3600*(nPatrolSec+3)*(1000+nGuanQia)/1000 | Q808: nGuanQia + 1000 | R808: 39240/60*nMin*(1000+nGuanQia)/1000 | S808: 31380/60*nMin*(1000+nGuanQia)/1000 | T808: 19320/60*nMin*(1000+nGuanQia)/1000 | U808: 喽啰 | V808: pet_21;pet_201;pet_93;pet_91; | W808: 4 | X808: 5 | Y808: 1,28000,8,0;1,19016,8,0;1,10007,5,0;1,10108,2,0;1,7,9000,0;1,8,9000,0;1,4,1000,0; | Z808: 0 | AA808: {} | AB808: n/60
A809: 805 | B809: 805 | C809: 805 | D809: 弑神试炼 | E809: 10501 | F809: 5 | G809: 3 | H809: 200805 | I809: 0 | J809: 480 | K809: 5000,0; | L809: 5 | M809: 5000,1; | N809: 39240/3600*(nPatrolSec+3)*(1000+nGuanQia)/1000 | O809: 31380/3600*(nPatrolSec+3)*(1000+nGuanQia)/1000 | P809: 19320/3600*(nPatrolSec+3)*(1000+nGuanQia)/1000 | Q809: nGuanQia + 1000 | R809: 39240/60*nMin*(1000+nGuanQia)/1000 | S809: 31380/60*nMin*(1000+nGuanQia)/1000 | T809: 19320/60*nMin*(1000+nGuanQia)/1000 | U809: 喽啰 | V809: pet_21;pet_201;pet_93;pet_91; | W809: 4 | X809: 5 | Y809: 1,28000,8,0;1,19016,8,0;1,10007,5,0;1,10108,2,0;1,7,9000,0;1,8,9000,0;1,4,1000,0; | Z809: 0 | AA809: {} | AB809: n/60
A810: 806 | B810: 806 | C810: 806 | D810: 弑神试炼 | E810: 10501 | F810: 5 | G810: 3 | H810: 200806 | I810: 0 | J810: 480 | K810: 5000,0; | L810: 5 | M810: 5000,1; | N810: 39240/3600*(nPatrolSec+3)*(1000+nGuanQia)/1000 | O810: 31380/3600*(nPatrolSec+3)*(1000+nGuanQia)/1000 | P810: 19320/3600*(nPatrolSec+3)*(1000+nGuanQia)/1000 | Q810: nGuanQia + 1000 | R810: 39240/60*nMin*(1000+nGuanQia)/1000 | S810: 31380/60*nMin*(1000+nGuanQia)/1000 | T810: 19320/60*nMin*(1000+nGuanQia)/1000 | U810: 喽啰 | V810: pet_21;pet_201;pet_93;pet_91; | W810: 4 | X810: 5 | Y810: 1,28000,8,0;1,19016,8,0;1,10007,5,0;1,10108,2,0;1,7,9000,0;1,8,9000,0;1,4,1000,0; | Z810: 0 | AA810: {} | AB810: n/60
A811: 807 | B811: 807 | C811: 807 | D811: 弑神试炼 | E811: 10501 | F811: 5 | G811: 3 | H811: 200807 | I811: 0 | J811: 480 | K811: 5000,0; | L811: 5 | M811: 5000,1; | N811: 39240/3600*(nPatrolSec+3)*(1000+nGuanQia)/1000 | O811: 31380/3600*(nPatrolSec+3)*(1000+nGuanQia)/1000 | P811: 19320/3600*(nPatrolSec+3)*(1000+nGuanQia)/1000 | Q811: nGuanQia + 1000 | R811: 39240/60*nMin*(1000+nGuanQia)/1000 | S811: 31380/60*nMin*(1000+nGuanQia)/1000 | T811: 19320/60*nMin*(1000+nGuanQia)/1000 | U811: 喽啰 | V811: pet_21;pet_201;pet_93;pet_91; | W811: 4 | X811: 5 | Y811: 1,28000,8,0;1,19016,8,0;1,10007,5,0;1,10108,2,0;1,7,9000,0;1,8,9000,0;1,4,1000,0; | Z811: 0 | AA811: {} | AB811: n/60
A812: 808 | B812: 808 | C812: 808 | D812: 弑神试炼 | E812: 10501 | F812: 5 | G812: 3 | H812: 200808 | I812: 0 | J812: 480 | K812: 5000,0; | L812: 5 | M812: 5000,1; | N812: 39240/3600*(nPatrolSec+3)*(1000+nGuanQia)/1000 | O812: 31380/3600*(nPatrolSec+3)*(1000+nGuanQia)/1000 | P812: 19320/3600*(nPatrolSec+3)*(1000+nGuanQia)/1000 | Q812: nGuanQia + 1000 | R812: 39240/60*nMin*(1000+nGuanQia)/1000 | S812: 31380/60*nMin*(1000+nGuanQia)/1000 | T812: 19320/60*nMin*(1000+nGuanQia)/1000 | U812: 喽啰 | V812: pet_21;pet_201;pet_93;pet_91; | W812: 4 | X812: 5 | Y812: 1,28000,8,0;1,19016,8,0;1,10007,5,0;1,10108,2,0;1,7,9000,0;1,8,9000,0;1,4,1000,0; | Z812: 0 | AA812: {} | AB812: n/60
A813: 809 | B813: 809 | C813: 809 | D813: 弑神试炼 | E813: 10501 | F813: 5 | G813: 3 | H813: 200809 | I813: 0 | J813: 480 | K813: 5000,0; | L813: 5 | M813: 5000,1; | N813: 39240/3600*(nPatrolSec+3)*(1000+nGuanQia)/1000 | O813: 31380/3600*(nPatrolSec+3)*(1000+nGuanQia)/1000 | P813: 19320/3600*(nPatrolSec+3)*(1000+nGuanQia)/1000 | Q813: nGuanQia + 1000 | R813: 39240/60*nMin*(1000+nGuanQia)/1000 | S813: 31380/60*nMin*(1000+nGuanQia)/1000 | T813: 19320/60*nMin*(1000+nGuanQia)/1000 | U813: 喽啰 | V813: pet_21;pet_201;pet_93;pet_91; | W813: 4 | X813: 5 | Y813: 1,28000,8,0;1,19016,8,0;1,10007,5,0;1,10108,2,0;1,7,9000,0;1,8,9000,0;1,4,1000,0; | Z813: 0 | AA813: {} | AB813: n/60
A814: 810 | B814: 810 | C814: 810 | D814: 弑神试炼 | E814: 10501 | F814: 5 | G814: 3 | H814: 200810 | I814: 0 | J814: 480 | K814: 5000,0; | L814: 5 | M814: 5000,1; | N814: 39240/3600*(nPatrolSec+3)*(1000+nGuanQia)/1000 | O814: 31380/3600*(nPatrolSec+3)*(1000+nGuanQia)/1000 | P814: 19320/3600*(nPatrolSec+3)*(1000+nGuanQia)/1000 | Q814: nGuanQia + 1000 | R814: 39240/60*nMin*(1000+nGuanQia)/1000 | S814: 31380/60*nMin*(1000+nGuanQia)/1000 | T814: 19320/60*nMin*(1000+nGuanQia)/1000 | U814: 喽啰 | V814: pet_21;pet_201;pet_93;pet_91; | W814: 4 | X814: 5 | Y814: 1,28000,8,0;1,19016,8,0;1,10007,5,0;1,10108,2,0;1,7,9000,0;1,8,9000,0;1,4,1000,0; | Z814: 0 | AA814: {} | AB814: n/60
A815: 811 | B815: 811 | C815: 811 | D815: 弑神试炼 | E815: 10501 | F815: 5 | G815: 3 | H815: 200811 | I815: 0 | J815: 480 | K815: 5000,0; | L815: 5 | M815: 5000,1; | N815: 39240/3600*(nPatrolSec+3)*(1000+nGuanQia)/1000 | O815: 31380/3600*(nPatrolSec+3)*(1000+nGuanQia)/1000 | P815: 19320/3600*(nPatrolSec+3)*(1000+nGuanQia)/1000 | Q815: nGuanQia + 1000 | R815: 39240/60*nMin*(1000+nGuanQia)/1000 | S815: 31380/60*nMin*(1000+nGuanQia)/1000 | T815: 19320/60*nMin*(1000+nGuanQia)/1000 | U815: 喽啰 | V815: pet_21;pet_201;pet_93;pet_91; | W815: 4 | X815: 5 | Y815: 1,28000,8,0;1,19016,8,0;1,10007,5,0;1,10108,2,0;1,7,9000,0;1,8,9000,0;1,4,1000,0; | Z815: 0 | AA815: {} | AB815: n/60
A816: 812 | B816: 812 | C816: 812 | D816: 弑神试炼 | E816: 10501 | F816: 5 | G816: 3 | H816: 200812 | I816: 0 | J816: 480 | K816: 5000,0; | L816: 5 | M816: 5000,1; | N816: 39240/3600*(nPatrolSec+3)*(1000+nGuanQia)/1000 | O816: 31380/3600*(nPatrolSec+3)*(1000+nGuanQia)/1000 | P816: 19320/3600*(nPatrolSec+3)*(1000+nGuanQia)/1000 | Q816: nGuanQia + 1000 | R816: 39240/60*nMin*(1000+nGuanQia)/1000 | S816: 31380/60*nMin*(1000+nGuanQia)/1000 | T816: 19320/60*nMin*(1000+nGuanQia)/1000 | U816: 喽啰 | V816: pet_21;pet_201;pet_93;pet_91; | W816: 4 | X816: 5 | Y816: 1,28000,8,0;1,19016,8,0;1,10007,5,0;1,10108,2,0;1,7,9000,0;1,8,9000,0;1,4,1000,0; | Z816: 0 | AA816: {} | AB816: n/60
A817: 813 | B817: 813 | C817: 813 | D817: 弑神试炼 | E817: 10501 | F817: 5 | G817: 3 | H817: 200813 | I817: 0 | J817: 480 | K817: 5000,0; | L817: 5 | M817: 5000,1; | N817: 39240/3600*(nPatrolSec+3)*(1000+nGuanQia)/1000 | O817: 31380/3600*(nPatrolSec+3)*(1000+nGuanQia)/1000 | P817: 19320/3600*(nPatrolSec+3)*(1000+nGuanQia)/1000 | Q817: nGuanQia + 1000 | R817: 39240/60*nMin*(1000+nGuanQia)/1000 | S817: 31380/60*nMin*(1000+nGuanQia)/1000 | T817: 19320/60*nMin*(1000+nGuanQia)/1000 | U817: 喽啰 | V817: pet_21;pet_201;pet_93;pet_91; | W817: 4 | X817: 5 | Y817: 1,28000,8,0;1,19016,8,0;1,10007,5,0;1,10108,2,0;1,7,9000,0;1,8,9000,0;1,4,1000,0; | Z817: 0 | AA817: {} | AB817: n/60
A818: 814 | B818: 814 | C818: 814 | D818: 弑神试炼 | E818: 10501 | F818: 5 | G818: 3 | H818: 200814 | I818: 0 | J818: 480 | K818: 5000,0; | L818: 5 | M818: 5000,1; | N818: 39240/3600*(nPatrolSec+3)*(1000+nGuanQia)/1000 | O818: 31380/3600*(nPatrolSec+3)*(1000+nGuanQia)/1000 | P818: 19320/3600*(nPatrolSec+3)*(1000+nGuanQia)/1000 | Q818: nGuanQia + 1000 | R818: 39240/60*nMin*(1000+nGuanQia)/1000 | S818: 31380/60*nMin*(1000+nGuanQia)/1000 | T818: 19320/60*nMin*(1000+nGuanQia)/1000 | U818: 喽啰 | V818: pet_21;pet_201;pet_93;pet_91; | W818: 4 | X818: 5 | Y818: 1,28000,8,0;1,19016,8,0;1,10007,5,0;1,10108,2,0;1,7,9000,0;1,8,9000,0;1,4,1000,0; | Z818: 0 | AA818: {} | AB818: n/60
A819: 815 | B819: 815 | C819: 815 | D819: 弑神试炼 | E819: 10501 | F819: 5 | G819: 3 | H819: 200815 | I819: 0 | J819: 480 | K819: 5000,0; | L819: 5 | M819: 5000,1; | N819: 39240/3600*(nPatrolSec+3)*(1000+nGuanQia)/1000 | O819: 31380/3600*(nPatrolSec+3)*(1000+nGuanQia)/1000 | P819: 19320/3600*(nPatrolSec+3)*(1000+nGuanQia)/1000 | Q819: nGuanQia + 1000 | R819: 39240/60*nMin*(1000+nGuanQia)/1000 | S819: 31380/60*nMin*(1000+nGuanQia)/1000 | T819: 19320/60*nMin*(1000+nGuanQia)/1000 | U819: 喽啰 | V819: pet_21;pet_201;pet_93;pet_91; | W819: 4 | X819: 5 | Y819: 1,28000,8,0;1,19016,8,0;1,10007,5,0;1,10108,2,0;1,7,9000,0;1,8,9000,0;1,4,1000,0; | Z819: 0 | AA819: {} | AB819: n/60
A820: 816 | B820: 816 | C820: 816 | D820: 弑神试炼 | E820: 10501 | F820: 5 | G820: 3 | H820: 200816 | I820: 0 | J820: 480 | K820: 5000,0; | L820: 5 | M820: 5000,1; | N820: 39240/3600*(nPatrolSec+3)*(1000+nGuanQia)/1000 | O820: 31380/3600*(nPatrolSec+3)*(1000+nGuanQia)/1000 | P820: 19320/3600*(nPatrolSec+3)*(1000+nGuanQia)/1000 | Q820: nGuanQia + 1000 | R820: 39240/60*nMin*(1000+nGuanQia)/1000 | S820: 31380/60*nMin*(1000+nGuanQia)/1000 | T820: 19320/60*nMin*(1000+nGuanQia)/1000 | U820: 喽啰 | V820: pet_21;pet_201;pet_93;pet_91; | W820: 4 | X820: 5 | Y820: 1,28000,8,0;1,19016,8,0;1,10007,5,0;1,10108,2,0;1,7,9000,0;1,8,9000,0;1,4,1000,0; | Z820: 0 | AA820: {} | AB820: n/60
A821: 817 | B821: 817 | C821: 817 | D821: 弑神试炼 | E821: 10501 | F821: 5 | G821: 3 | H821: 200817 | I821: 0 | J821: 480 | K821: 5000,0; | L821: 5 | M821: 5000,1; | N821: 39240/3600*(nPatrolSec+3)*(1000+nGuanQia)/1000 | O821: 31380/3600*(nPatrolSec+3)*(1000+nGuanQia)/1000 | P821: 19320/3600*(nPatrolSec+3)*(1000+nGuanQia)/1000 | Q821: nGuanQia + 1000 | R821: 39240/60*nMin*(1000+nGuanQia)/1000 | S821: 31380/60*nMin*(1000+nGuanQia)/1000 | T821: 19320/60*nMin*(1000+nGuanQia)/1000 | U821: 喽啰 | V821: pet_21;pet_201;pet_93;pet_91; | W821: 4 | X821: 5 | Y821: 1,28000,8,0;1,19016,8,0;1,10007,5,0;1,10108,2,0;1,7,9000,0;1,8,9000,0;1,4,1000,0; | Z821: 0 | AA821: {} | AB821: n/60
A822: 818 | B822: 818 | C822: 818 | D822: 弑神试炼 | E822: 10501 | F822: 5 | G822: 3 | H822: 200818 | I822: 0 | J822: 480 | K822: 5000,0; | L822: 5 | M822: 5000,1; | N822: 39240/3600*(nPatrolSec+3)*(1000+nGuanQia)/1000 | O822: 31380/3600*(nPatrolSec+3)*(1000+nGuanQia)/1000 | P822: 19320/3600*(nPatrolSec+3)*(1000+nGuanQia)/1000 | Q822: nGuanQia + 1000 | R822: 39240/60*nMin*(1000+nGuanQia)/1000 | S822: 31380/60*nMin*(1000+nGuanQia)/1000 | T822: 19320/60*nMin*(1000+nGuanQia)/1000 | U822: 喽啰 | V822: pet_21;pet_201;pet_93;pet_91; | W822: 4 | X822: 5 | Y822: 1,28000,8,0;1,19016,8,0;1,10007,5,0;1,10108,2,0;1,7,9000,0;1,8,9000,0;1,4,1000,0; | Z822: 0 | AA822: {} | AB822: n/60
A823: 819 | B823: 819 | C823: 819 | D823: 弑神试炼 | E823: 10501 | F823: 5 | G823: 3 | H823: 200819 | I823: 0 | J823: 480 | K823: 5000,0; | L823: 5 | M823: 5000,1; | N823: 39240/3600*(nPatrolSec+3)*(1000+nGuanQia)/1000 | O823: 31380/3600*(nPatrolSec+3)*(1000+nGuanQia)/1000 | P823: 19320/3600*(nPatrolSec+3)*(1000+nGuanQia)/1000 | Q823: nGuanQia + 1000 | R823: 39240/60*nMin*(1000+nGuanQia)/1000 | S823: 31380/60*nMin*(1000+nGuanQia)/1000 | T823: 19320/60*nMin*(1000+nGuanQia)/1000 | U823: 喽啰 | V823: pet_21;pet_201;pet_93;pet_91; | W823: 4 | X823: 5 | Y823: 1,28000,8,0;1,19016,8,0;1,10007,5,0;1,10108,2,0;1,7,9000,0;1,8,9000,0;1,4,1000,0; | Z823: 0 | AA823: {} | AB823: n/60
A824: 820 | B824: 820 | C824: 820 | D824: 弑神试炼 | E824: 10501 | F824: 5 | G824: 3 | H824: 200820 | I824: 0 | J824: 480 | K824: 5000,0; | L824: 5 | M824: 5000,1; | N824: 39240/3600*(nPatrolSec+3)*(1000+nGuanQia)/1000 | O824: 31380/3600*(nPatrolSec+3)*(1000+nGuanQia)/1000 | P824: 19320/3600*(nPatrolSec+3)*(1000+nGuanQia)/1000 | Q824: nGuanQia + 1000 | R824: 39240/60*nMin*(1000+nGuanQia)/1000 | S824: 31380/60*nMin*(1000+nGuanQia)/1000 | T824: 19320/60*nMin*(1000+nGuanQia)/1000 | U824: 喽啰 | V824: pet_21;pet_201;pet_93;pet_91; | W824: 4 | X824: 5 | Y824: 1,28000,8,0;1,19016,8,0;1,10007,5,0;1,10108,2,0;1,7,9000,0;1,8,9000,0;1,4,1000,0; | Z824: 0 | AA824: {} | AB824: n/60
A825: 821 | B825: 821 | C825: 821 | D825: 弑神试炼 | E825: 10501 | F825: 5 | G825: 3 | H825: 200821 | I825: 0 | J825: 480 | K825: 5000,0; | L825: 5 | M825: 5000,1; | N825: 39240/3600*(nPatrolSec+3)*(1000+nGuanQia)/1000 | O825: 31380/3600*(nPatrolSec+3)*(1000+nGuanQia)/1000 | P825: 19320/3600*(nPatrolSec+3)*(1000+nGuanQia)/1000 | Q825: nGuanQia + 1000 | R825: 39240/60*nMin*(1000+nGuanQia)/1000 | S825: 31380/60*nMin*(1000+nGuanQia)/1000 | T825: 19320/60*nMin*(1000+nGuanQia)/1000 | U825: 喽啰 | V825: pet_21;pet_201;pet_93;pet_91; | W825: 4 | X825: 5 | Y825: 1,28000,8,0;1,19016,8,0;1,10007,5,0;1,10108,2,0;1,7,9000,0;1,8,9000,0;1,4,1000,0; | Z825: 0 | AA825: {} | AB825: n/60
A826: 822 | B826: 822 | C826: 822 | D826: 弑神试炼 | E826: 10501 | F826: 5 | G826: 3 | H826: 200822 | I826: 0 | J826: 480 | K826: 5000,0; | L826: 5 | M826: 5000,1; | N826: 39240/3600*(nPatrolSec+3)*(1000+nGuanQia)/1000 | O826: 31380/3600*(nPatrolSec+3)*(1000+nGuanQia)/1000 | P826: 19320/3600*(nPatrolSec+3)*(1000+nGuanQia)/1000 | Q826: nGuanQia + 1000 | R826: 39240/60*nMin*(1000+nGuanQia)/1000 | S826: 31380/60*nMin*(1000+nGuanQia)/1000 | T826: 19320/60*nMin*(1000+nGuanQia)/1000 | U826: 喽啰 | V826: pet_21;pet_201;pet_93;pet_91; | W826: 4 | X826: 5 | Y826: 1,28000,8,0;1,19016,8,0;1,10007,5,0;1,10108,2,0;1,7,9000,0;1,8,9000,0;1,4,1000,0; | Z826: 0 | AA826: {} | AB826: n/60
A827: 823 | B827: 823 | C827: 823 | D827: 弑神试炼 | E827: 10501 | F827: 5 | G827: 3 | H827: 200823 | I827: 0 | J827: 480 | K827: 5000,0; | L827: 5 | M827: 5000,1; | N827: 39240/3600*(nPatrolSec+3)*(1000+nGuanQia)/1000 | O827: 31380/3600*(nPatrolSec+3)*(1000+nGuanQia)/1000 | P827: 19320/3600*(nPatrolSec+3)*(1000+nGuanQia)/1000 | Q827: nGuanQia + 1000 | R827: 39240/60*nMin*(1000+nGuanQia)/1000 | S827: 31380/60*nMin*(1000+nGuanQia)/1000 | T827: 19320/60*nMin*(1000+nGuanQia)/1000 | U827: 喽啰 | V827: pet_21;pet_201;pet_93;pet_91; | W827: 4 | X827: 5 | Y827: 1,28000,8,0;1,19016,8,0;1,10007,5,0;1,10108,2,0;1,7,9000,0;1,8,9000,0;1,4,1000,0; | Z827: 0 | AA827: {} | AB827: n/60
A828: 824 | B828: 824 | C828: 824 | D828: 弑神试炼 | E828: 10501 | F828: 5 | G828: 3 | H828: 200824 | I828: 0 | J828: 480 | K828: 5000,0; | L828: 5 | M828: 5000,1; | N828: 39240/3600*(nPatrolSec+3)*(1000+nGuanQia)/1000 | O828: 31380/3600*(nPatrolSec+3)*(1000+nGuanQia)/1000 | P828: 19320/3600*(nPatrolSec+3)*(1000+nGuanQia)/1000 | Q828: nGuanQia + 1000 | R828: 39240/60*nMin*(1000+nGuanQia)/1000 | S828: 31380/60*nMin*(1000+nGuanQia)/1000 | T828: 19320/60*nMin*(1000+nGuanQia)/1000 | U828: 喽啰 | V828: pet_21;pet_201;pet_93;pet_91; | W828: 4 | X828: 5 | Y828: 1,28000,8,0;1,19016,8,0;1,10007,5,0;1,10108,2,0;1,7,9000,0;1,8,9000,0;1,4,1000,0; | Z828: 0 | AA828: {} | AB828: n/60
A829: 825 | B829: 825 | C829: 825 | D829: 弑神试炼 | E829: 10501 | F829: 5 | G829: 3 | H829: 200825 | I829: 0 | J829: 480 | K829: 5000,0; | L829: 5 | M829: 5000,1; | N829: 39240/3600*(nPatrolSec+3)*(1000+nGuanQia)/1000 | O829: 31380/3600*(nPatrolSec+3)*(1000+nGuanQia)/1000 | P829: 19320/3600*(nPatrolSec+3)*(1000+nGuanQia)/1000 | Q829: nGuanQia + 1000 | R829: 39240/60*nMin*(1000+nGuanQia)/1000 | S829: 31380/60*nMin*(1000+nGuanQia)/1000 | T829: 19320/60*nMin*(1000+nGuanQia)/1000 | U829: 喽啰 | V829: pet_21;pet_201;pet_93;pet_91; | W829: 4 | X829: 5 | Y829: 1,28000,8,0;1,19016,8,0;1,10007,5,0;1,10108,2,0;1,7,9000,0;1,8,9000,0;1,4,1000,0; | Z829: 0 | AA829: {} | AB829: n/60
A830: 826 | B830: 826 | C830: 826 | D830: 弑神试炼 | E830: 10501 | F830: 5 | G830: 3 | H830: 200826 | I830: 0 | J830: 480 | K830: 5000,0; | L830: 5 | M830: 5000,1; | N830: 39240/3600*(nPatrolSec+3)*(1000+nGuanQia)/1000 | O830: 31380/3600*(nPatrolSec+3)*(1000+nGuanQia)/1000 | P830: 19320/3600*(nPatrolSec+3)*(1000+nGuanQia)/1000 | Q830: nGuanQia + 1000 | R830: 39240/60*nMin*(1000+nGuanQia)/1000 | S830: 31380/60*nMin*(1000+nGuanQia)/1000 | T830: 19320/60*nMin*(1000+nGuanQia)/1000 | U830: 喽啰 | V830: pet_21;pet_201;pet_93;pet_91; | W830: 4 | X830: 5 | Y830: 1,28000,8,0;1,19016,8,0;1,10007,5,0;1,10108,2,0;1,7,9000,0;1,8,9000,0;1,4,1000,0; | Z830: 0 | AA830: {} | AB830: n/60
A831: 827 | B831: 827 | C831: 827 | D831: 弑神试炼 | E831: 10501 | F831: 5 | G831: 3 | H831: 200827 | I831: 0 | J831: 480 | K831: 5000,0; | L831: 5 | M831: 5000,1; | N831: 39240/3600*(nPatrolSec+3)*(1000+nGuanQia)/1000 | O831: 31380/3600*(nPatrolSec+3)*(1000+nGuanQia)/1000 | P831: 19320/3600*(nPatrolSec+3)*(1000+nGuanQia)/1000 | Q831: nGuanQia + 1000 | R831: 39240/60*nMin*(1000+nGuanQia)/1000 | S831: 31380/60*nMin*(1000+nGuanQia)/1000 | T831: 19320/60*nMin*(1000+nGuanQia)/1000 | U831: 喽啰 | V831: pet_21;pet_201;pet_93;pet_91; | W831: 4 | X831: 5 | Y831: 1,28000,8,0;1,19016,8,0;1,10007,5,0;1,10108,2,0;1,7,9000,0;1,8,9000,0;1,4,1000,0; | Z831: 0 | AA831: {} | AB831: n/60
A832: 828 | B832: 828 | C832: 828 | D832: 弑神试炼 | E832: 10501 | F832: 5 | G832: 3 | H832: 200828 | I832: 0 | J832: 480 | K832: 5000,0; | L832: 5 | M832: 5000,1; | N832: 39240/3600*(nPatrolSec+3)*(1000+nGuanQia)/1000 | O832: 31380/3600*(nPatrolSec+3)*(1000+nGuanQia)/1000 | P832: 19320/3600*(nPatrolSec+3)*(1000+nGuanQia)/1000 | Q832: nGuanQia + 1000 | R832: 39240/60*nMin*(1000+nGuanQia)/1000 | S832: 31380/60*nMin*(1000+nGuanQia)/1000 | T832: 19320/60*nMin*(1000+nGuanQia)/1000 | U832: 喽啰 | V832: pet_21;pet_201;pet_93;pet_91; | W832: 4 | X832: 5 | Y832: 1,28000,8,0;1,19016,8,0;1,10007,5,0;1,10108,2,0;1,7,9000,0;1,8,9000,0;1,4,1000,0; | Z832: 0 | AA832: {} | AB832: n/60
A833: 829 | B833: 829 | C833: 829 | D833: 弑神试炼 | E833: 10501 | F833: 5 | G833: 3 | H833: 200829 | I833: 0 | J833: 480 | K833: 5000,0; | L833: 5 | M833: 5000,1; | N833: 39240/3600*(nPatrolSec+3)*(1000+nGuanQia)/1000 | O833: 31380/3600*(nPatrolSec+3)*(1000+nGuanQia)/1000 | P833: 19320/3600*(nPatrolSec+3)*(1000+nGuanQia)/1000 | Q833: nGuanQia + 1000 | R833: 39240/60*nMin*(1000+nGuanQia)/1000 | S833: 31380/60*nMin*(1000+nGuanQia)/1000 | T833: 19320/60*nMin*(1000+nGuanQia)/1000 | U833: 喽啰 | V833: pet_21;pet_201;pet_93;pet_91; | W833: 4 | X833: 5 | Y833: 1,28000,8,0;1,19016,8,0;1,10007,5,0;1,10108,2,0;1,7,9000,0;1,8,9000,0;1,4,1000,0; | Z833: 0 | AA833: {} | AB833: n/60
A834: 830 | B834: 830 | C834: 830 | D834: 弑神试炼 | E834: 10501 | F834: 5 | G834: 3 | H834: 200830 | I834: 0 | J834: 480 | K834: 5000,0; | L834: 5 | M834: 5000,1; | N834: 39240/3600*(nPatrolSec+3)*(1000+nGuanQia)/1000 | O834: 31380/3600*(nPatrolSec+3)*(1000+nGuanQia)/1000 | P834: 19320/3600*(nPatrolSec+3)*(1000+nGuanQia)/1000 | Q834: nGuanQia + 1000 | R834: 39240/60*nMin*(1000+nGuanQia)/1000 | S834: 31380/60*nMin*(1000+nGuanQia)/1000 | T834: 19320/60*nMin*(1000+nGuanQia)/1000 | U834: 喽啰 | V834: pet_21;pet_201;pet_93;pet_91; | W834: 4 | X834: 5 | Y834: 1,28000,8,0;1,19016,8,0;1,10007,5,0;1,10108,2,0;1,7,9000,0;1,8,9000,0;1,4,1000,0; | Z834: 0 | AA834: {} | AB834: n/60
A835: 831 | B835: 831 | C835: 831 | D835: 弑神试炼 | E835: 10501 | F835: 5 | G835: 3 | H835: 200831 | I835: 0 | J835: 480 | K835: 5000,0; | L835: 5 | M835: 5000,1; | N835: 39240/3600*(nPatrolSec+3)*(1000+nGuanQia)/1000 | O835: 31380/3600*(nPatrolSec+3)*(1000+nGuanQia)/1000 | P835: 19320/3600*(nPatrolSec+3)*(1000+nGuanQia)/1000 | Q835: nGuanQia + 1000 | R835: 39240/60*nMin*(1000+nGuanQia)/1000 | S835: 31380/60*nMin*(1000+nGuanQia)/1000 | T835: 19320/60*nMin*(1000+nGuanQia)/1000 | U835: 喽啰 | V835: pet_21;pet_201;pet_93;pet_91; | W835: 4 | X835: 5 | Y835: 1,28000,8,0;1,19016,8,0;1,10007,5,0;1,10108,2,0;1,7,9000,0;1,8,9000,0;1,4,1000,0; | Z835: 0 | AA835: {} | AB835: n/60
A836: 832 | B836: 832 | C836: 832 | D836: 弑神试炼 | E836: 10501 | F836: 5 | G836: 3 | H836: 200832 | I836: 0 | J836: 480 | K836: 5000,0; | L836: 5 | M836: 5000,1; | N836: 39240/3600*(nPatrolSec+3)*(1000+nGuanQia)/1000 | O836: 31380/3600*(nPatrolSec+3)*(1000+nGuanQia)/1000 | P836: 19320/3600*(nPatrolSec+3)*(1000+nGuanQia)/1000 | Q836: nGuanQia + 1000 | R836: 39240/60*nMin*(1000+nGuanQia)/1000 | S836: 31380/60*nMin*(1000+nGuanQia)/1000 | T836: 19320/60*nMin*(1000+nGuanQia)/1000 | U836: 喽啰 | V836: pet_21;pet_201;pet_93;pet_91; | W836: 4 | X836: 5 | Y836: 1,28000,8,0;1,19016,8,0;1,10007,5,0;1,10108,2,0;1,7,9000,0;1,8,9000,0;1,4,1000,0; | Z836: 0 | AA836: {} | AB836: n/60
A837: 833 | B837: 833 | C837: 833 | D837: 弑神试炼 | E837: 10501 | F837: 5 | G837: 3 | H837: 200833 | I837: 0 | J837: 480 | K837: 5000,0; | L837: 5 | M837: 5000,1; | N837: 39240/3600*(nPatrolSec+3)*(1000+nGuanQia)/1000 | O837: 31380/3600*(nPatrolSec+3)*(1000+nGuanQia)/1000 | P837: 19320/3600*(nPatrolSec+3)*(1000+nGuanQia)/1000 | Q837: nGuanQia + 1000 | R837: 39240/60*nMin*(1000+nGuanQia)/1000 | S837: 31380/60*nMin*(1000+nGuanQia)/1000 | T837: 19320/60*nMin*(1000+nGuanQia)/1000 | U837: 喽啰 | V837: pet_21;pet_201;pet_93;pet_91; | W837: 4 | X837: 5 | Y837: 1,28000,8,0;1,19016,8,0;1,10007,5,0;1,10108,2,0;1,7,9000,0;1,8,9000,0;1,4,1000,0; | Z837: 0 | AA837: {} | AB837: n/60
A838: 834 | B838: 834 | C838: 834 | D838: 弑神试炼 | E838: 10501 | F838: 5 | G838: 3 | H838: 200834 | I838: 0 | J838: 480 | K838: 5000,0; | L838: 5 | M838: 5000,1; | N838: 39240/3600*(nPatrolSec+3)*(1000+nGuanQia)/1000 | O838: 31380/3600*(nPatrolSec+3)*(1000+nGuanQia)/1000 | P838: 19320/3600*(nPatrolSec+3)*(1000+nGuanQia)/1000 | Q838: nGuanQia + 1000 | R838: 39240/60*nMin*(1000+nGuanQia)/1000 | S838: 31380/60*nMin*(1000+nGuanQia)/1000 | T838: 19320/60*nMin*(1000+nGuanQia)/1000 | U838: 喽啰 | V838: pet_21;pet_201;pet_93;pet_91; | W838: 4 | X838: 5 | Y838: 1,28000,8,0;1,19016,8,0;1,10007,5,0;1,10108,2,0;1,7,9000,0;1,8,9000,0;1,4,1000,0; | Z838: 0 | AA838: {} | AB838: n/60
A839: 835 | B839: 835 | C839: 835 | D839: 弑神试炼 | E839: 10501 | F839: 5 | G839: 3 | H839: 200835 | I839: 0 | J839: 480 | K839: 5000,0; | L839: 5 | M839: 5000,1; | N839: 39240/3600*(nPatrolSec+3)*(1000+nGuanQia)/1000 | O839: 31380/3600*(nPatrolSec+3)*(1000+nGuanQia)/1000 | P839: 19320/3600*(nPatrolSec+3)*(1000+nGuanQia)/1000 | Q839: nGuanQia + 1000 | R839: 39240/60*nMin*(1000+nGuanQia)/1000 | S839: 31380/60*nMin*(1000+nGuanQia)/1000 | T839: 19320/60*nMin*(1000+nGuanQia)/1000 | U839: 喽啰 | V839: pet_21;pet_201;pet_93;pet_91; | W839: 4 | X839: 5 | Y839: 1,28000,8,0;1,19016,8,0;1,10007,5,0;1,10108,2,0;1,7,9000,0;1,8,9000,0;1,4,1000,0; | Z839: 0 | AA839: {} | AB839: n/60
A840: 836 | B840: 836 | C840: 836 | D840: 弑神试炼 | E840: 10501 | F840: 5 | G840: 3 | H840: 200836 | I840: 0 | J840: 480 | K840: 5000,0; | L840: 5 | M840: 5000,1; | N840: 39240/3600*(nPatrolSec+3)*(1000+nGuanQia)/1000 | O840: 31380/3600*(nPatrolSec+3)*(1000+nGuanQia)/1000 | P840: 19320/3600*(nPatrolSec+3)*(1000+nGuanQia)/1000 | Q840: nGuanQia + 1000 | R840: 39240/60*nMin*(1000+nGuanQia)/1000 | S840: 31380/60*nMin*(1000+nGuanQia)/1000 | T840: 19320/60*nMin*(1000+nGuanQia)/1000 | U840: 喽啰 | V840: pet_21;pet_201;pet_93;pet_91; | W840: 4 | X840: 5 | Y840: 1,28000,8,0;1,19016,8,0;1,10007,5,0;1,10108,2,0;1,7,9000,0;1,8,9000,0;1,4,1000,0; | Z840: 0 | AA840: {} | AB840: n/60
A841: 837 | B841: 837 | C841: 837 | D841: 弑神试炼 | E841: 10501 | F841: 5 | G841: 3 | H841: 200837 | I841: 0 | J841: 480 | K841: 5000,0; | L841: 5 | M841: 5000,1; | N841: 39240/3600*(nPatrolSec+3)*(1000+nGuanQia)/1000 | O841: 31380/3600*(nPatrolSec+3)*(1000+nGuanQia)/1000 | P841: 19320/3600*(nPatrolSec+3)*(1000+nGuanQia)/1000 | Q841: nGuanQia + 1000 | R841: 39240/60*nMin*(1000+nGuanQia)/1000 | S841: 31380/60*nMin*(1000+nGuanQia)/1000 | T841: 19320/60*nMin*(1000+nGuanQia)/1000 | U841: 喽啰 | V841: pet_21;pet_201;pet_93;pet_91; | W841: 4 | X841: 5 | Y841: 1,28000,8,0;1,19016,8,0;1,10007,5,0;1,10108,2,0;1,7,9000,0;1,8,9000,0;1,4,1000,0; | Z841: 0 | AA841: {} | AB841: n/60
A842: 838 | B842: 838 | C842: 838 | D842: 弑神试炼 | E842: 10501 | F842: 5 | G842: 3 | H842: 200838 | I842: 0 | J842: 480 | K842: 5000,0; | L842: 5 | M842: 5000,1; | N842: 39240/3600*(nPatrolSec+3)*(1000+nGuanQia)/1000 | O842: 31380/3600*(nPatrolSec+3)*(1000+nGuanQia)/1000 | P842: 19320/3600*(nPatrolSec+3)*(1000+nGuanQia)/1000 | Q842: nGuanQia + 1000 | R842: 39240/60*nMin*(1000+nGuanQia)/1000 | S842: 31380/60*nMin*(1000+nGuanQia)/1000 | T842: 19320/60*nMin*(1000+nGuanQia)/1000 | U842: 喽啰 | V842: pet_21;pet_201;pet_93;pet_91; | W842: 4 | X842: 5 | Y842: 1,28000,8,0;1,19016,8,0;1,10007,5,0;1,10108,2,0;1,7,9000,0;1,8,9000,0;1,4,1000,0; | Z842: 0 | AA842: {} | AB842: n/60
A843: 839 | B843: 839 | C843: 839 | D843: 弑神试炼 | E843: 10501 | F843: 5 | G843: 3 | H843: 200839 | I843: 0 | J843: 480 | K843: 5000,0; | L843: 5 | M843: 5000,1; | N843: 39240/3600*(nPatrolSec+3)*(1000+nGuanQia)/1000 | O843: 31380/3600*(nPatrolSec+3)*(1000+nGuanQia)/1000 | P843: 19320/3600*(nPatrolSec+3)*(1000+nGuanQia)/1000 | Q843: nGuanQia + 1000 | R843: 39240/60*nMin*(1000+nGuanQia)/1000 | S843: 31380/60*nMin*(1000+nGuanQia)/1000 | T843: 19320/60*nMin*(1000+nGuanQia)/1000 | U843: 喽啰 | V843: pet_21;pet_201;pet_93;pet_91; | W843: 4 | X843: 5 | Y843: 1,28000,8,0;1,19016,8,0;1,10007,5,0;1,10108,2,0;1,7,9000,0;1,8,9000,0;1,4,1000,0; | Z843: 0 | AA843: {} | AB843: n/60
A844: 840 | B844: 840 | C844: 840 | D844: 弑神试炼 | E844: 10501 | F844: 5 | G844: 3 | H844: 200840 | I844: 0 | J844: 480 | K844: 5000,0; | L844: 5 | M844: 5000,1; | N844: 39240/3600*(nPatrolSec+3)*(1000+nGuanQia)/1000 | O844: 31380/3600*(nPatrolSec+3)*(1000+nGuanQia)/1000 | P844: 19320/3600*(nPatrolSec+3)*(1000+nGuanQia)/1000 | Q844: nGuanQia + 1000 | R844: 39240/60*nMin*(1000+nGuanQia)/1000 | S844: 31380/60*nMin*(1000+nGuanQia)/1000 | T844: 19320/60*nMin*(1000+nGuanQia)/1000 | U844: 喽啰 | V844: pet_21;pet_201;pet_93;pet_91; | W844: 4 | X844: 5 | Y844: 1,28000,8,0;1,19016,8,0;1,10007,5,0;1,10108,2,0;1,7,9000,0;1,8,9000,0;1,4,1000,0; | Z844: 0 | AA844: {} | AB844: n/60
A845: 841 | B845: 841 | C845: 841 | D845: 弑神试炼 | E845: 10501 | F845: 5 | G845: 3 | H845: 200841 | I845: 0 | J845: 480 | K845: 5000,0; | L845: 5 | M845: 5000,1; | N845: 39240/3600*(nPatrolSec+3)*(1000+nGuanQia)/1000 | O845: 31380/3600*(nPatrolSec+3)*(1000+nGuanQia)/1000 | P845: 19320/3600*(nPatrolSec+3)*(1000+nGuanQia)/1000 | Q845: nGuanQia + 1000 | R845: 39240/60*nMin*(1000+nGuanQia)/1000 | S845: 31380/60*nMin*(1000+nGuanQia)/1000 | T845: 19320/60*nMin*(1000+nGuanQia)/1000 | U845: 喽啰 | V845: pet_21;pet_201;pet_93;pet_91; | W845: 4 | X845: 5 | Y845: 1,28000,8,0;1,19016,8,0;1,10007,5,0;1,10108,2,0;1,7,9000,0;1,8,9000,0;1,4,1000,0; | Z845: 0 | AA845: {} | AB845: n/60
A846: 842 | B846: 842 | C846: 842 | D846: 弑神试炼 | E846: 10501 | F846: 5 | G846: 3 | H846: 200842 | I846: 0 | J846: 480 | K846: 5000,0; | L846: 5 | M846: 5000,1; | N846: 39240/3600*(nPatrolSec+3)*(1000+nGuanQia)/1000 | O846: 31380/3600*(nPatrolSec+3)*(1000+nGuanQia)/1000 | P846: 19320/3600*(nPatrolSec+3)*(1000+nGuanQia)/1000 | Q846: nGuanQia + 1000 | R846: 39240/60*nMin*(1000+nGuanQia)/1000 | S846: 31380/60*nMin*(1000+nGuanQia)/1000 | T846: 19320/60*nMin*(1000+nGuanQia)/1000 | U846: 喽啰 | V846: pet_21;pet_201;pet_93;pet_91; | W846: 4 | X846: 5 | Y846: 1,28000,8,0;1,19016,8,0;1,10007,5,0;1,10108,2,0;1,7,9000,0;1,8,9000,0;1,4,1000,0; | Z846: 0 | AA846: {} | AB846: n/60
A847: 843 | B847: 843 | C847: 843 | D847: 弑神试炼 | E847: 10501 | F847: 5 | G847: 3 | H847: 200843 | I847: 0 | J847: 480 | K847: 5000,0; | L847: 5 | M847: 5000,1; | N847: 39240/3600*(nPatrolSec+3)*(1000+nGuanQia)/1000 | O847: 31380/3600*(nPatrolSec+3)*(1000+nGuanQia)/1000 | P847: 19320/3600*(nPatrolSec+3)*(1000+nGuanQia)/1000 | Q847: nGuanQia + 1000 | R847: 39240/60*nMin*(1000+nGuanQia)/1000 | S847: 31380/60*nMin*(1000+nGuanQia)/1000 | T847: 19320/60*nMin*(1000+nGuanQia)/1000 | U847: 喽啰 | V847: pet_21;pet_201;pet_93;pet_91; | W847: 4 | X847: 5 | Y847: 1,28000,8,0;1,19016,8,0;1,10007,5,0;1,10108,2,0;1,7,9000,0;1,8,9000,0;1,4,1000,0; | Z847: 0 | AA847: {} | AB847: n/60
A848: 844 | B848: 844 | C848: 844 | D848: 弑神试炼 | E848: 10501 | F848: 5 | G848: 3 | H848: 200844 | I848: 0 | J848: 480 | K848: 5000,0; | L848: 5 | M848: 5000,1; | N848: 39240/3600*(nPatrolSec+3)*(1000+nGuanQia)/1000 | O848: 31380/3600*(nPatrolSec+3)*(1000+nGuanQia)/1000 | P848: 19320/3600*(nPatrolSec+3)*(1000+nGuanQia)/1000 | Q848: nGuanQia + 1000 | R848: 39240/60*nMin*(1000+nGuanQia)/1000 | S848: 31380/60*nMin*(1000+nGuanQia)/1000 | T848: 19320/60*nMin*(1000+nGuanQia)/1000 | U848: 喽啰 | V848: pet_21;pet_201;pet_93;pet_91; | W848: 4 | X848: 5 | Y848: 1,28000,8,0;1,19016,8,0;1,10007,5,0;1,10108,2,0;1,7,9000,0;1,8,9000,0;1,4,1000,0; | Z848: 0 | AA848: {} | AB848: n/60
A849: 845 | B849: 845 | C849: 845 | D849: 弑神试炼 | E849: 10501 | F849: 5 | G849: 3 | H849: 200845 | I849: 0 | J849: 480 | K849: 5000,0; | L849: 5 | M849: 5000,1; | N849: 39240/3600*(nPatrolSec+3)*(1000+nGuanQia)/1000 | O849: 31380/3600*(nPatrolSec+3)*(1000+nGuanQia)/1000 | P849: 19320/3600*(nPatrolSec+3)*(1000+nGuanQia)/1000 | Q849: nGuanQia + 1000 | R849: 39240/60*nMin*(1000+nGuanQia)/1000 | S849: 31380/60*nMin*(1000+nGuanQia)/1000 | T849: 19320/60*nMin*(1000+nGuanQia)/1000 | U849: 喽啰 | V849: pet_21;pet_201;pet_93;pet_91; | W849: 4 | X849: 5 | Y849: 1,28000,8,0;1,19016,8,0;1,10007,5,0;1,10108,2,0;1,7,9000,0;1,8,9000,0;1,4,1000,0; | Z849: 0 | AA849: {} | AB849: n/60
A850: 846 | B850: 846 | C850: 846 | D850: 弑神试炼 | E850: 10501 | F850: 5 | G850: 3 | H850: 200846 | I850: 0 | J850: 480 | K850: 5000,0; | L850: 5 | M850: 5000,1; | N850: 39240/3600*(nPatrolSec+3)*(1000+nGuanQia)/1000 | O850: 31380/3600*(nPatrolSec+3)*(1000+nGuanQia)/1000 | P850: 19320/3600*(nPatrolSec+3)*(1000+nGuanQia)/1000 | Q850: nGuanQia + 1000 | R850: 39240/60*nMin*(1000+nGuanQia)/1000 | S850: 31380/60*nMin*(1000+nGuanQia)/1000 | T850: 19320/60*nMin*(1000+nGuanQia)/1000 | U850: 喽啰 | V850: pet_21;pet_201;pet_93;pet_91; | W850: 4 | X850: 5 | Y850: 1,28000,8,0;1,19016,8,0;1,10007,5,0;1,10108,2,0;1,7,9000,0;1,8,9000,0;1,4,1000,0; | Z850: 0 | AA850: {} | AB850: n/60
A851: 847 | B851: 847 | C851: 847 | D851: 弑神试炼 | E851: 10501 | F851: 5 | G851: 3 | H851: 200847 | I851: 0 | J851: 480 | K851: 5000,0; | L851: 5 | M851: 5000,1; | N851: 39240/3600*(nPatrolSec+3)*(1000+nGuanQia)/1000 | O851: 31380/3600*(nPatrolSec+3)*(1000+nGuanQia)/1000 | P851: 19320/3600*(nPatrolSec+3)*(1000+nGuanQia)/1000 | Q851: nGuanQia + 1000 | R851: 39240/60*nMin*(1000+nGuanQia)/1000 | S851: 31380/60*nMin*(1000+nGuanQia)/1000 | T851: 19320/60*nMin*(1000+nGuanQia)/1000 | U851: 喽啰 | V851: pet_21;pet_201;pet_93;pet_91; | W851: 4 | X851: 5 | Y851: 1,28000,8,0;1,19016,8,0;1,10007,5,0;1,10108,2,0;1,7,9000,0;1,8,9000,0;1,4,1000,0; | Z851: 0 | AA851: {} | AB851: n/60
A852: 848 | B852: 848 | C852: 848 | D852: 弑神试炼 | E852: 10501 | F852: 5 | G852: 3 | H852: 200848 | I852: 0 | J852: 480 | K852: 5000,0; | L852: 5 | M852: 5000,1; | N852: 39240/3600*(nPatrolSec+3)*(1000+nGuanQia)/1000 | O852: 31380/3600*(nPatrolSec+3)*(1000+nGuanQia)/1000 | P852: 19320/3600*(nPatrolSec+3)*(1000+nGuanQia)/1000 | Q852: nGuanQia + 1000 | R852: 39240/60*nMin*(1000+nGuanQia)/1000 | S852: 31380/60*nMin*(1000+nGuanQia)/1000 | T852: 19320/60*nMin*(1000+nGuanQia)/1000 | U852: 喽啰 | V852: pet_21;pet_201;pet_93;pet_91; | W852: 4 | X852: 5 | Y852: 1,28000,8,0;1,19016,8,0;1,10007,5,0;1,10108,2,0;1,7,9000,0;1,8,9000,0;1,4,1000,0; | Z852: 0 | AA852: {} | AB852: n/60
A853: 849 | B853: 849 | C853: 849 | D853: 弑神试炼 | E853: 10501 | F853: 5 | G853: 3 | H853: 200849 | I853: 0 | J853: 480 | K853: 5000,0; | L853: 5 | M853: 5000,1; | N853: 39240/3600*(nPatrolSec+3)*(1000+nGuanQia)/1000 | O853: 31380/3600*(nPatrolSec+3)*(1000+nGuanQia)/1000 | P853: 19320/3600*(nPatrolSec+3)*(1000+nGuanQia)/1000 | Q853: nGuanQia + 1000 | R853: 39240/60*nMin*(1000+nGuanQia)/1000 | S853: 31380/60*nMin*(1000+nGuanQia)/1000 | T853: 19320/60*nMin*(1000+nGuanQia)/1000 | U853: 喽啰 | V853: pet_21;pet_201;pet_93;pet_91; | W853: 4 | X853: 5 | Y853: 1,28000,8,0;1,19016,8,0;1,10007,5,0;1,10108,2,0;1,7,9000,0;1,8,9000,0;1,4,1000,0; | Z853: 0 | AA853: {} | AB853: n/60
A854: 850 | B854: 850 | C854: 850 | D854: 弑神试炼 | E854: 10501 | F854: 5 | G854: 3 | H854: 200850 | I854: 0 | J854: 480 | K854: 5000,0; | L854: 5 | M854: 5000,1; | N854: 39240/3600*(nPatrolSec+3)*(1000+nGuanQia)/1000 | O854: 31380/3600*(nPatrolSec+3)*(1000+nGuanQia)/1000 | P854: 19320/3600*(nPatrolSec+3)*(1000+nGuanQia)/1000 | Q854: nGuanQia + 1000 | R854: 39240/60*nMin*(1000+nGuanQia)/1000 | S854: 31380/60*nMin*(1000+nGuanQia)/1000 | T854: 19320/60*nMin*(1000+nGuanQia)/1000 | U854: 喽啰 | V854: pet_21;pet_201;pet_93;pet_91; | W854: 4 | X854: 5 | Y854: 1,28000,8,0;1,19016,8,0;1,10007,5,0;1,10108,2,0;1,7,9000,0;1,8,9000,0;1,4,1000,0; | Z854: 0 | AA854: {} | AB854: n/60
A855: 851 | B855: 851 | C855: 851 | D855: 弑神试炼 | E855: 10501 | F855: 5 | G855: 3 | H855: 200851 | I855: 0 | J855: 480 | K855: 5000,0; | L855: 5 | M855: 5000,1; | N855: 39240/3600*(nPatrolSec+3)*(1000+nGuanQia)/1000 | O855: 31380/3600*(nPatrolSec+3)*(1000+nGuanQia)/1000 | P855: 19320/3600*(nPatrolSec+3)*(1000+nGuanQia)/1000 | Q855: nGuanQia + 1000 | R855: 39240/60*nMin*(1000+nGuanQia)/1000 | S855: 31380/60*nMin*(1000+nGuanQia)/1000 | T855: 19320/60*nMin*(1000+nGuanQia)/1000 | U855: 喽啰 | V855: pet_21;pet_201;pet_93;pet_91; | W855: 4 | X855: 5 | Y855: 1,28000,8,0;1,19016,8,0;1,10007,5,0;1,10108,2,0;1,7,9000,0;1,8,9000,0;1,4,1000,0; | Z855: 0 | AA855: {} | AB855: n/60
A856: 852 | B856: 852 | C856: 852 | D856: 弑神试炼 | E856: 10501 | F856: 5 | G856: 3 | H856: 200852 | I856: 0 | J856: 480 | K856: 5000,0; | L856: 5 | M856: 5000,1; | N856: 39240/3600*(nPatrolSec+3)*(1000+nGuanQia)/1000 | O856: 31380/3600*(nPatrolSec+3)*(1000+nGuanQia)/1000 | P856: 19320/3600*(nPatrolSec+3)*(1000+nGuanQia)/1000 | Q856: nGuanQia + 1000 | R856: 39240/60*nMin*(1000+nGuanQia)/1000 | S856: 31380/60*nMin*(1000+nGuanQia)/1000 | T856: 19320/60*nMin*(1000+nGuanQia)/1000 | U856: 喽啰 | V856: pet_21;pet_201;pet_93;pet_91; | W856: 4 | X856: 5 | Y856: 1,28000,8,0;1,19016,8,0;1,10007,5,0;1,10108,2,0;1,7,9000,0;1,8,9000,0;1,4,1000,0; | Z856: 0 | AA856: {} | AB856: n/60
A857: 853 | B857: 853 | C857: 853 | D857: 弑神试炼 | E857: 10501 | F857: 5 | G857: 3 | H857: 200853 | I857: 0 | J857: 480 | K857: 5000,0; | L857: 5 | M857: 5000,1; | N857: 39240/3600*(nPatrolSec+3)*(1000+nGuanQia)/1000 | O857: 31380/3600*(nPatrolSec+3)*(1000+nGuanQia)/1000 | P857: 19320/3600*(nPatrolSec+3)*(1000+nGuanQia)/1000 | Q857: nGuanQia + 1000 | R857: 39240/60*nMin*(1000+nGuanQia)/1000 | S857: 31380/60*nMin*(1000+nGuanQia)/1000 | T857: 19320/60*nMin*(1000+nGuanQia)/1000 | U857: 喽啰 | V857: pet_21;pet_201;pet_93;pet_91; | W857: 4 | X857: 5 | Y857: 1,28000,8,0;1,19016,8,0;1,10007,5,0;1,10108,2,0;1,7,9000,0;1,8,9000,0;1,4,1000,0; | Z857: 0 | AA857: {} | AB857: n/60
A858: 854 | B858: 854 | C858: 854 | D858: 弑神试炼 | E858: 10501 | F858: 5 | G858: 3 | H858: 200854 | I858: 0 | J858: 480 | K858: 5000,0; | L858: 5 | M858: 5000,1; | N858: 39240/3600*(nPatrolSec+3)*(1000+nGuanQia)/1000 | O858: 31380/3600*(nPatrolSec+3)*(1000+nGuanQia)/1000 | P858: 19320/3600*(nPatrolSec+3)*(1000+nGuanQia)/1000 | Q858: nGuanQia + 1000 | R858: 39240/60*nMin*(1000+nGuanQia)/1000 | S858: 31380/60*nMin*(1000+nGuanQia)/1000 | T858: 19320/60*nMin*(1000+nGuanQia)/1000 | U858: 喽啰 | V858: pet_21;pet_201;pet_93;pet_91; | W858: 4 | X858: 5 | Y858: 1,28000,8,0;1,19016,8,0;1,10007,5,0;1,10108,2,0;1,7,9000,0;1,8,9000,0;1,4,1000,0; | Z858: 0 | AA858: {} | AB858: n/60
A859: 855 | B859: 855 | C859: 855 | D859: 弑神试炼 | E859: 10501 | F859: 5 | G859: 3 | H859: 200855 | I859: 0 | J859: 480 | K859: 5000,0; | L859: 5 | M859: 5000,1; | N859: 39240/3600*(nPatrolSec+3)*(1000+nGuanQia)/1000 | O859: 31380/3600*(nPatrolSec+3)*(1000+nGuanQia)/1000 | P859: 19320/3600*(nPatrolSec+3)*(1000+nGuanQia)/1000 | Q859: nGuanQia + 1000 | R859: 39240/60*nMin*(1000+nGuanQia)/1000 | S859: 31380/60*nMin*(1000+nGuanQia)/1000 | T859: 19320/60*nMin*(1000+nGuanQia)/1000 | U859: 喽啰 | V859: pet_21;pet_201;pet_93;pet_91; | W859: 4 | X859: 5 | Y859: 1,28000,8,0;1,19016,8,0;1,10007,5,0;1,10108,2,0;1,7,9000,0;1,8,9000,0;1,4,1000,0; | Z859: 0 | AA859: {} | AB859: n/60
A860: 856 | B860: 856 | C860: 856 | D860: 弑神试炼 | E860: 10501 | F860: 5 | G860: 3 | H860: 200856 | I860: 0 | J860: 480 | K860: 5000,0; | L860: 5 | M860: 5000,1; | N860: 39240/3600*(nPatrolSec+3)*(1000+nGuanQia)/1000 | O860: 31380/3600*(nPatrolSec+3)*(1000+nGuanQia)/1000 | P860: 19320/3600*(nPatrolSec+3)*(1000+nGuanQia)/1000 | Q860: nGuanQia + 1000 | R860: 39240/60*nMin*(1000+nGuanQia)/1000 | S860: 31380/60*nMin*(1000+nGuanQia)/1000 | T860: 19320/60*nMin*(1000+nGuanQia)/1000 | U860: 喽啰 | V860: pet_21;pet_201;pet_93;pet_91; | W860: 4 | X860: 5 | Y860: 1,28000,8,0;1,19016,8,0;1,10007,5,0;1,10108,2,0;1,7,9000,0;1,8,9000,0;1,4,1000,0; | Z860: 0 | AA860: {} | AB860: n/60
A861: 857 | B861: 857 | C861: 857 | D861: 弑神试炼 | E861: 10501 | F861: 5 | G861: 3 | H861: 200857 | I861: 0 | J861: 480 | K861: 5000,0; | L861: 5 | M861: 5000,1; | N861: 39240/3600*(nPatrolSec+3)*(1000+nGuanQia)/1000 | O861: 31380/3600*(nPatrolSec+3)*(1000+nGuanQia)/1000 | P861: 19320/3600*(nPatrolSec+3)*(1000+nGuanQia)/1000 | Q861: nGuanQia + 1000 | R861: 39240/60*nMin*(1000+nGuanQia)/1000 | S861: 31380/60*nMin*(1000+nGuanQia)/1000 | T861: 19320/60*nMin*(1000+nGuanQia)/1000 | U861: 喽啰 | V861: pet_21;pet_201;pet_93;pet_91; | W861: 4 | X861: 5 | Y861: 1,28000,8,0;1,19016,8,0;1,10007,5,0;1,10108,2,0;1,7,9000,0;1,8,9000,0;1,4,1000,0; | Z861: 0 | AA861: {} | AB861: n/60
A862: 858 | B862: 858 | C862: 858 | D862: 弑神试炼 | E862: 10501 | F862: 5 | G862: 3 | H862: 200858 | I862: 0 | J862: 480 | K862: 5000,0; | L862: 5 | M862: 5000,1; | N862: 39240/3600*(nPatrolSec+3)*(1000+nGuanQia)/1000 | O862: 31380/3600*(nPatrolSec+3)*(1000+nGuanQia)/1000 | P862: 19320/3600*(nPatrolSec+3)*(1000+nGuanQia)/1000 | Q862: nGuanQia + 1000 | R862: 39240/60*nMin*(1000+nGuanQia)/1000 | S862: 31380/60*nMin*(1000+nGuanQia)/1000 | T862: 19320/60*nMin*(1000+nGuanQia)/1000 | U862: 喽啰 | V862: pet_21;pet_201;pet_93;pet_91; | W862: 4 | X862: 5 | Y862: 1,28000,8,0;1,19016,8,0;1,10007,5,0;1,10108,2,0;1,7,9000,0;1,8,9000,0;1,4,1000,0; | Z862: 0 | AA862: {} | AB862: n/60
A863: 859 | B863: 859 | C863: 859 | D863: 弑神试炼 | E863: 10501 | F863: 5 | G863: 3 | H863: 200859 | I863: 0 | J863: 480 | K863: 5000,0; | L863: 5 | M863: 5000,1; | N863: 39240/3600*(nPatrolSec+3)*(1000+nGuanQia)/1000 | O863: 31380/3600*(nPatrolSec+3)*(1000+nGuanQia)/1000 | P863: 19320/3600*(nPatrolSec+3)*(1000+nGuanQia)/1000 | Q863: nGuanQia + 1000 | R863: 39240/60*nMin*(1000+nGuanQia)/1000 | S863: 31380/60*nMin*(1000+nGuanQia)/1000 | T863: 19320/60*nMin*(1000+nGuanQia)/1000 | U863: 喽啰 | V863: pet_21;pet_201;pet_93;pet_91; | W863: 4 | X863: 5 | Y863: 1,28000,8,0;1,19016,8,0;1,10007,5,0;1,10108,2,0;1,7,9000,0;1,8,9000,0;1,4,1000,0; | Z863: 0 | AA863: {} | AB863: n/60
A864: 860 | B864: 860 | C864: 860 | D864: 弑神试炼 | E864: 10501 | F864: 5 | G864: 3 | H864: 200860 | I864: 0 | J864: 480 | K864: 5000,0; | L864: 5 | M864: 5000,1; | N864: 39240/3600*(nPatrolSec+3)*(1000+nGuanQia)/1000 | O864: 31380/3600*(nPatrolSec+3)*(1000+nGuanQia)/1000 | P864: 19320/3600*(nPatrolSec+3)*(1000+nGuanQia)/1000 | Q864: nGuanQia + 1000 | R864: 39240/60*nMin*(1000+nGuanQia)/1000 | S864: 31380/60*nMin*(1000+nGuanQia)/1000 | T864: 19320/60*nMin*(1000+nGuanQia)/1000 | U864: 喽啰 | V864: pet_21;pet_201;pet_93;pet_91; | W864: 4 | X864: 5 | Y864: 1,28000,8,0;1,19016,8,0;1,10007,5,0;1,10108,2,0;1,7,9000,0;1,8,9000,0;1,4,1000,0; | Z864: 0 | AA864: {} | AB864: n/60
A865: 861 | B865: 861 | C865: 861 | D865: 弑神试炼 | E865: 10501 | F865: 5 | G865: 3 | H865: 200861 | I865: 0 | J865: 480 | K865: 5000,0; | L865: 5 | M865: 5000,1; | N865: 39240/3600*(nPatrolSec+3)*(1000+nGuanQia)/1000 | O865: 31380/3600*(nPatrolSec+3)*(1000+nGuanQia)/1000 | P865: 19320/3600*(nPatrolSec+3)*(1000+nGuanQia)/1000 | Q865: nGuanQia + 1000 | R865: 39240/60*nMin*(1000+nGuanQia)/1000 | S865: 31380/60*nMin*(1000+nGuanQia)/1000 | T865: 19320/60*nMin*(1000+nGuanQia)/1000 | U865: 喽啰 | V865: pet_21;pet_201;pet_93;pet_91; | W865: 4 | X865: 5 | Y865: 1,28000,8,0;1,19016,8,0;1,10007,5,0;1,10108,2,0;1,7,9000,0;1,8,9000,0;1,4,1000,0; | Z865: 0 | AA865: {} | AB865: n/60
A866: 862 | B866: 862 | C866: 862 | D866: 弑神试炼 | E866: 10501 | F866: 5 | G866: 3 | H866: 200862 | I866: 0 | J866: 480 | K866: 5000,0; | L866: 5 | M866: 5000,1; | N866: 39240/3600*(nPatrolSec+3)*(1000+nGuanQia)/1000 | O866: 31380/3600*(nPatrolSec+3)*(1000+nGuanQia)/1000 | P866: 19320/3600*(nPatrolSec+3)*(1000+nGuanQia)/1000 | Q866: nGuanQia + 1000 | R866: 39240/60*nMin*(1000+nGuanQia)/1000 | S866: 31380/60*nMin*(1000+nGuanQia)/1000 | T866: 19320/60*nMin*(1000+nGuanQia)/1000 | U866: 喽啰 | V866: pet_21;pet_201;pet_93;pet_91; | W866: 4 | X866: 5 | Y866: 1,28000,8,0;1,19016,8,0;1,10007,5,0;1,10108,2,0;1,7,9000,0;1,8,9000,0;1,4,1000,0; | Z866: 0 | AA866: {} | AB866: n/60
A867: 863 | B867: 863 | C867: 863 | D867: 弑神试炼 | E867: 10501 | F867: 5 | G867: 3 | H867: 200863 | I867: 0 | J867: 480 | K867: 5000,0; | L867: 5 | M867: 5000,1; | N867: 39240/3600*(nPatrolSec+3)*(1000+nGuanQia)/1000 | O867: 31380/3600*(nPatrolSec+3)*(1000+nGuanQia)/1000 | P867: 19320/3600*(nPatrolSec+3)*(1000+nGuanQia)/1000 | Q867: nGuanQia + 1000 | R867: 39240/60*nMin*(1000+nGuanQia)/1000 | S867: 31380/60*nMin*(1000+nGuanQia)/1000 | T867: 19320/60*nMin*(1000+nGuanQia)/1000 | U867: 喽啰 | V867: pet_21;pet_201;pet_93;pet_91; | W867: 4 | X867: 5 | Y867: 1,28000,8,0;1,19016,8,0;1,10007,5,0;1,10108,2,0;1,7,9000,0;1,8,9000,0;1,4,1000,0; | Z867: 0 | AA867: {} | AB867: n/60
A868: 864 | B868: 864 | C868: 864 | D868: 弑神试炼 | E868: 10501 | F868: 5 | G868: 3 | H868: 200864 | I868: 0 | J868: 480 | K868: 5000,0; | L868: 5 | M868: 5000,1; | N868: 39240/3600*(nPatrolSec+3)*(1000+nGuanQia)/1000 | O868: 31380/3600*(nPatrolSec+3)*(1000+nGuanQia)/1000 | P868: 19320/3600*(nPatrolSec+3)*(1000+nGuanQia)/1000 | Q868: nGuanQia + 1000 | R868: 39240/60*nMin*(1000+nGuanQia)/1000 | S868: 31380/60*nMin*(1000+nGuanQia)/1000 | T868: 19320/60*nMin*(1000+nGuanQia)/1000 | U868: 喽啰 | V868: pet_21;pet_201;pet_93;pet_91; | W868: 4 | X868: 5 | Y868: 1,28000,8,0;1,19016,8,0;1,10007,5,0;1,10108,2,0;1,7,9000,0;1,8,9000,0;1,4,1000,0; | Z868: 0 | AA868: {} | AB868: n/60
A869: 865 | B869: 865 | C869: 865 | D869: 弑神试炼 | E869: 10501 | F869: 5 | G869: 3 | H869: 200865 | I869: 0 | J869: 480 | K869: 5000,0; | L869: 5 | M869: 5000,1; | N869: 39240/3600*(nPatrolSec+3)*(1000+nGuanQia)/1000 | O869: 31380/3600*(nPatrolSec+3)*(1000+nGuanQia)/1000 | P869: 19320/3600*(nPatrolSec+3)*(1000+nGuanQia)/1000 | Q869: nGuanQia + 1000 | R869: 39240/60*nMin*(1000+nGuanQia)/1000 | S869: 31380/60*nMin*(1000+nGuanQia)/1000 | T869: 19320/60*nMin*(1000+nGuanQia)/1000 | U869: 喽啰 | V869: pet_21;pet_201;pet_93;pet_91; | W869: 4 | X869: 5 | Y869: 1,28000,8,0;1,19016,8,0;1,10007,5,0;1,10108,2,0;1,7,9000,0;1,8,9000,0;1,4,1000,0; | Z869: 0 | AA869: {} | AB869: n/60
A870: 866 | B870: 866 | C870: 866 | D870: 弑神试炼 | E870: 10501 | F870: 5 | G870: 3 | H870: 200866 | I870: 0 | J870: 480 | K870: 5000,0; | L870: 5 | M870: 5000,1; | N870: 39240/3600*(nPatrolSec+3)*(1000+nGuanQia)/1000 | O870: 31380/3600*(nPatrolSec+3)*(1000+nGuanQia)/1000 | P870: 19320/3600*(nPatrolSec+3)*(1000+nGuanQia)/1000 | Q870: nGuanQia + 1000 | R870: 39240/60*nMin*(1000+nGuanQia)/1000 | S870: 31380/60*nMin*(1000+nGuanQia)/1000 | T870: 19320/60*nMin*(1000+nGuanQia)/1000 | U870: 喽啰 | V870: pet_21;pet_201;pet_93;pet_91; | W870: 4 | X870: 5 | Y870: 1,28000,8,0;1,19016,8,0;1,10007,5,0;1,10108,2,0;1,7,9000,0;1,8,9000,0;1,4,1000,0; | Z870: 0 | AA870: {} | AB870: n/60
A871: 867 | B871: 867 | C871: 867 | D871: 弑神试炼 | E871: 10501 | F871: 5 | G871: 3 | H871: 200867 | I871: 0 | J871: 480 | K871: 5000,0; | L871: 5 | M871: 5000,1; | N871: 39240/3600*(nPatrolSec+3)*(1000+nGuanQia)/1000 | O871: 31380/3600*(nPatrolSec+3)*(1000+nGuanQia)/1000 | P871: 19320/3600*(nPatrolSec+3)*(1000+nGuanQia)/1000 | Q871: nGuanQia + 1000 | R871: 39240/60*nMin*(1000+nGuanQia)/1000 | S871: 31380/60*nMin*(1000+nGuanQia)/1000 | T871: 19320/60*nMin*(1000+nGuanQia)/1000 | U871: 喽啰 | V871: pet_21;pet_201;pet_93;pet_91; | W871: 4 | X871: 5 | Y871: 1,28000,8,0;1,19016,8,0;1,10007,5,0;1,10108,2,0;1,7,9000,0;1,8,9000,0;1,4,1000,0; | Z871: 0 | AA871: {} | AB871: n/60
A872: 868 | B872: 868 | C872: 868 | D872: 弑神试炼 | E872: 10501 | F872: 5 | G872: 3 | H872: 200868 | I872: 0 | J872: 480 | K872: 5000,0; | L872: 5 | M872: 5000,1; | N872: 39240/3600*(nPatrolSec+3)*(1000+nGuanQia)/1000 | O872: 31380/3600*(nPatrolSec+3)*(1000+nGuanQia)/1000 | P872: 19320/3600*(nPatrolSec+3)*(1000+nGuanQia)/1000 | Q872: nGuanQia + 1000 | R872: 39240/60*nMin*(1000+nGuanQia)/1000 | S872: 31380/60*nMin*(1000+nGuanQia)/1000 | T872: 19320/60*nMin*(1000+nGuanQia)/1000 | U872: 喽啰 | V872: pet_21;pet_201;pet_93;pet_91; | W872: 4 | X872: 5 | Y872: 1,28000,8,0;1,19016,8,0;1,10007,5,0;1,10108,2,0;1,7,9000,0;1,8,9000,0;1,4,1000,0; | Z872: 0 | AA872: {} | AB872: n/60
A873: 869 | B873: 869 | C873: 869 | D873: 弑神试炼 | E873: 10501 | F873: 5 | G873: 3 | H873: 200869 | I873: 0 | J873: 480 | K873: 5000,0; | L873: 5 | M873: 5000,1; | N873: 39240/3600*(nPatrolSec+3)*(1000+nGuanQia)/1000 | O873: 31380/3600*(nPatrolSec+3)*(1000+nGuanQia)/1000 | P873: 19320/3600*(nPatrolSec+3)*(1000+nGuanQia)/1000 | Q873: nGuanQia + 1000 | R873: 39240/60*nMin*(1000+nGuanQia)/1000 | S873: 31380/60*nMin*(1000+nGuanQia)/1000 | T873: 19320/60*nMin*(1000+nGuanQia)/1000 | U873: 喽啰 | V873: pet_21;pet_201;pet_93;pet_91; | W873: 4 | X873: 5 | Y873: 1,28000,8,0;1,19016,8,0;1,10007,5,0;1,10108,2,0;1,7,9000,0;1,8,9000,0;1,4,1000,0; | Z873: 0 | AA873: {} | AB873: n/60
A874: 870 | B874: 870 | C874: 870 | D874: 弑神试炼 | E874: 10501 | F874: 5 | G874: 3 | H874: 200870 | I874: 0 | J874: 480 | K874: 5000,0; | L874: 5 | M874: 5000,1; | N874: 39240/3600*(nPatrolSec+3)*(1000+nGuanQia)/1000 | O874: 31380/3600*(nPatrolSec+3)*(1000+nGuanQia)/1000 | P874: 19320/3600*(nPatrolSec+3)*(1000+nGuanQia)/1000 | Q874: nGuanQia + 1000 | R874: 39240/60*nMin*(1000+nGuanQia)/1000 | S874: 31380/60*nMin*(1000+nGuanQia)/1000 | T874: 19320/60*nMin*(1000+nGuanQia)/1000 | U874: 喽啰 | V874: pet_21;pet_201;pet_93;pet_91; | W874: 4 | X874: 5 | Y874: 1,28000,8,0;1,19016,8,0;1,10007,5,0;1,10108,2,0;1,7,9000,0;1,8,9000,0;1,4,1000,0; | Z874: 0 | AA874: {} | AB874: n/60
A875: 871 | B875: 871 | C875: 871 | D875: 弑神试炼 | E875: 10501 | F875: 5 | G875: 3 | H875: 200871 | I875: 0 | J875: 480 | K875: 5000,0; | L875: 5 | M875: 5000,1; | N875: 39240/3600*(nPatrolSec+3)*(1000+nGuanQia)/1000 | O875: 31380/3600*(nPatrolSec+3)*(1000+nGuanQia)/1000 | P875: 19320/3600*(nPatrolSec+3)*(1000+nGuanQia)/1000 | Q875: nGuanQia + 1000 | R875: 39240/60*nMin*(1000+nGuanQia)/1000 | S875: 31380/60*nMin*(1000+nGuanQia)/1000 | T875: 19320/60*nMin*(1000+nGuanQia)/1000 | U875: 喽啰 | V875: pet_21;pet_201;pet_93;pet_91; | W875: 4 | X875: 5 | Y875: 1,28000,8,0;1,19016,8,0;1,10007,5,0;1,10108,2,0;1,7,9000,0;1,8,9000,0;1,4,1000,0; | Z875: 0 | AA875: {} | AB875: n/60
A876: 872 | B876: 872 | C876: 872 | D876: 弑神试炼 | E876: 10501 | F876: 5 | G876: 3 | H876: 200872 | I876: 0 | J876: 480 | K876: 5000,0; | L876: 5 | M876: 5000,1; | N876: 39240/3600*(nPatrolSec+3)*(1000+nGuanQia)/1000 | O876: 31380/3600*(nPatrolSec+3)*(1000+nGuanQia)/1000 | P876: 19320/3600*(nPatrolSec+3)*(1000+nGuanQia)/1000 | Q876: nGuanQia + 1000 | R876: 39240/60*nMin*(1000+nGuanQia)/1000 | S876: 31380/60*nMin*(1000+nGuanQia)/1000 | T876: 19320/60*nMin*(1000+nGuanQia)/1000 | U876: 喽啰 | V876: pet_21;pet_201;pet_93;pet_91; | W876: 4 | X876: 5 | Y876: 1,28000,8,0;1,19016,8,0;1,10007,5,0;1,10108,2,0;1,7,9000,0;1,8,9000,0;1,4,1000,0; | Z876: 0 | AA876: {} | AB876: n/60
A877: 873 | B877: 873 | C877: 873 | D877: 弑神试炼 | E877: 10501 | F877: 5 | G877: 3 | H877: 200873 | I877: 0 | J877: 480 | K877: 5000,0; | L877: 5 | M877: 5000,1; | N877: 39240/3600*(nPatrolSec+3)*(1000+nGuanQia)/1000 | O877: 31380/3600*(nPatrolSec+3)*(1000+nGuanQia)/1000 | P877: 19320/3600*(nPatrolSec+3)*(1000+nGuanQia)/1000 | Q877: nGuanQia + 1000 | R877: 39240/60*nMin*(1000+nGuanQia)/1000 | S877: 31380/60*nMin*(1000+nGuanQia)/1000 | T877: 19320/60*nMin*(1000+nGuanQia)/1000 | U877: 喽啰 | V877: pet_21;pet_201;pet_93;pet_91; | W877: 4 | X877: 5 | Y877: 1,28000,8,0;1,19016,8,0;1,10007,5,0;1,10108,2,0;1,7,9000,0;1,8,9000,0;1,4,1000,0; | Z877: 0 | AA877: {} | AB877: n/60
A878: 874 | B878: 874 | C878: 874 | D878: 弑神试炼 | E878: 10501 | F878: 5 | G878: 3 | H878: 200874 | I878: 0 | J878: 480 | K878: 5000,0; | L878: 5 | M878: 5000,1; | N878: 39240/3600*(nPatrolSec+3)*(1000+nGuanQia)/1000 | O878: 31380/3600*(nPatrolSec+3)*(1000+nGuanQia)/1000 | P878: 19320/3600*(nPatrolSec+3)*(1000+nGuanQia)/1000 | Q878: nGuanQia + 1000 | R878: 39240/60*nMin*(1000+nGuanQia)/1000 | S878: 31380/60*nMin*(1000+nGuanQia)/1000 | T878: 19320/60*nMin*(1000+nGuanQia)/1000 | U878: 喽啰 | V878: pet_21;pet_201;pet_93;pet_91; | W878: 4 | X878: 5 | Y878: 1,28000,8,0;1,19016,8,0;1,10007,5,0;1,10108,2,0;1,7,9000,0;1,8,9000,0;1,4,1000,0; | Z878: 0 | AA878: {} | AB878: n/60
A879: 875 | B879: 875 | C879: 875 | D879: 弑神试炼 | E879: 10501 | F879: 5 | G879: 3 | H879: 200875 | I879: 0 | J879: 480 | K879: 5000,0; | L879: 5 | M879: 5000,1; | N879: 39240/3600*(nPatrolSec+3)*(1000+nGuanQia)/1000 | O879: 31380/3600*(nPatrolSec+3)*(1000+nGuanQia)/1000 | P879: 19320/3600*(nPatrolSec+3)*(1000+nGuanQia)/1000 | Q879: nGuanQia + 1000 | R879: 39240/60*nMin*(1000+nGuanQia)/1000 | S879: 31380/60*nMin*(1000+nGuanQia)/1000 | T879: 19320/60*nMin*(1000+nGuanQia)/1000 | U879: 喽啰 | V879: pet_21;pet_201;pet_93;pet_91; | W879: 4 | X879: 5 | Y879: 1,28000,8,0;1,19016,8,0;1,10007,5,0;1,10108,2,0;1,7,9000,0;1,8,9000,0;1,4,1000,0; | Z879: 0 | AA879: {} | AB879: n/60
A880: 876 | B880: 876 | C880: 876 | D880: 弑神试炼 | E880: 10501 | F880: 5 | G880: 3 | H880: 200876 | I880: 0 | J880: 480 | K880: 5000,0; | L880: 5 | M880: 5000,1; | N880: 39240/3600*(nPatrolSec+3)*(1000+nGuanQia)/1000 | O880: 31380/3600*(nPatrolSec+3)*(1000+nGuanQia)/1000 | P880: 19320/3600*(nPatrolSec+3)*(1000+nGuanQia)/1000 | Q880: nGuanQia + 1000 | R880: 39240/60*nMin*(1000+nGuanQia)/1000 | S880: 31380/60*nMin*(1000+nGuanQia)/1000 | T880: 19320/60*nMin*(1000+nGuanQia)/1000 | U880: 喽啰 | V880: pet_21;pet_201;pet_93;pet_91; | W880: 4 | X880: 5 | Y880: 1,28000,8,0;1,19016,8,0;1,10007,5,0;1,10108,2,0;1,7,9000,0;1,8,9000,0;1,4,1000,0; | Z880: 0 | AA880: {} | AB880: n/60
A881: 877 | B881: 877 | C881: 877 | D881: 弑神试炼 | E881: 10501 | F881: 5 | G881: 3 | H881: 200877 | I881: 0 | J881: 480 | K881: 5000,0; | L881: 5 | M881: 5000,1; | N881: 39240/3600*(nPatrolSec+3)*(1000+nGuanQia)/1000 | O881: 31380/3600*(nPatrolSec+3)*(1000+nGuanQia)/1000 | P881: 19320/3600*(nPatrolSec+3)*(1000+nGuanQia)/1000 | Q881: nGuanQia + 1000 | R881: 39240/60*nMin*(1000+nGuanQia)/1000 | S881: 31380/60*nMin*(1000+nGuanQia)/1000 | T881: 19320/60*nMin*(1000+nGuanQia)/1000 | U881: 喽啰 | V881: pet_21;pet_201;pet_93;pet_91; | W881: 4 | X881: 5 | Y881: 1,28000,8,0;1,19016,8,0;1,10007,5,0;1,10108,2,0;1,7,9000,0;1,8,9000,0;1,4,1000,0; | Z881: 0 | AA881: {} | AB881: n/60
A882: 878 | B882: 878 | C882: 878 | D882: 弑神试炼 | E882: 10501 | F882: 5 | G882: 3 | H882: 200878 | I882: 0 | J882: 480 | K882: 5000,0; | L882: 5 | M882: 5000,1; | N882: 39240/3600*(nPatrolSec+3)*(1000+nGuanQia)/1000 | O882: 31380/3600*(nPatrolSec+3)*(1000+nGuanQia)/1000 | P882: 19320/3600*(nPatrolSec+3)*(1000+nGuanQia)/1000 | Q882: nGuanQia + 1000 | R882: 39240/60*nMin*(1000+nGuanQia)/1000 | S882: 31380/60*nMin*(1000+nGuanQia)/1000 | T882: 19320/60*nMin*(1000+nGuanQia)/1000 | U882: 喽啰 | V882: pet_21;pet_201;pet_93;pet_91; | W882: 4 | X882: 5 | Y882: 1,28000,8,0;1,19016,8,0;1,10007,5,0;1,10108,2,0;1,7,9000,0;1,8,9000,0;1,4,1000,0; | Z882: 0 | AA882: {} | AB882: n/60
A883: 879 | B883: 879 | C883: 879 | D883: 弑神试炼 | E883: 10501 | F883: 5 | G883: 3 | H883: 200879 | I883: 0 | J883: 480 | K883: 5000,0; | L883: 5 | M883: 5000,1; | N883: 39240/3600*(nPatrolSec+3)*(1000+nGuanQia)/1000 | O883: 31380/3600*(nPatrolSec+3)*(1000+nGuanQia)/1000 | P883: 19320/3600*(nPatrolSec+3)*(1000+nGuanQia)/1000 | Q883: nGuanQia + 1000 | R883: 39240/60*nMin*(1000+nGuanQia)/1000 | S883: 31380/60*nMin*(1000+nGuanQia)/1000 | T883: 19320/60*nMin*(1000+nGuanQia)/1000 | U883: 喽啰 | V883: pet_21;pet_201;pet_93;pet_91; | W883: 4 | X883: 5 | Y883: 1,28000,8,0;1,19016,8,0;1,10007,5,0;1,10108,2,0;1,7,9000,0;1,8,9000,0;1,4,1000,0; | Z883: 0 | AA883: {} | AB883: n/60
A884: 880 | B884: 880 | C884: 880 | D884: 弑神试炼 | E884: 10501 | F884: 5 | G884: 3 | H884: 200880 | I884: 0 | J884: 480 | K884: 5000,0; | L884: 5 | M884: 5000,1; | N884: 39240/3600*(nPatrolSec+3)*(1000+nGuanQia)/1000 | O884: 31380/3600*(nPatrolSec+3)*(1000+nGuanQia)/1000 | P884: 19320/3600*(nPatrolSec+3)*(1000+nGuanQia)/1000 | Q884: nGuanQia + 1000 | R884: 39240/60*nMin*(1000+nGuanQia)/1000 | S884: 31380/60*nMin*(1000+nGuanQia)/1000 | T884: 19320/60*nMin*(1000+nGuanQia)/1000 | U884: 喽啰 | V884: pet_21;pet_201;pet_93;pet_91; | W884: 4 | X884: 5 | Y884: 1,28000,8,0;1,19016,8,0;1,10007,5,0;1,10108,2,0;1,7,9000,0;1,8,9000,0;1,4,1000,0; | Z884: 0 | AA884: {} | AB884: n/60
A885: 881 | B885: 881 | C885: 881 | D885: 弑神试炼 | E885: 10501 | F885: 5 | G885: 3 | H885: 200881 | I885: 0 | J885: 480 | K885: 5000,0; | L885: 5 | M885: 5000,1; | N885: 39240/3600*(nPatrolSec+3)*(1000+nGuanQia)/1000 | O885: 31380/3600*(nPatrolSec+3)*(1000+nGuanQia)/1000 | P885: 19320/3600*(nPatrolSec+3)*(1000+nGuanQia)/1000 | Q885: nGuanQia + 1000 | R885: 39240/60*nMin*(1000+nGuanQia)/1000 | S885: 31380/60*nMin*(1000+nGuanQia)/1000 | T885: 19320/60*nMin*(1000+nGuanQia)/1000 | U885: 喽啰 | V885: pet_21;pet_201;pet_93;pet_91; | W885: 4 | X885: 5 | Y885: 1,28000,8,0;1,19016,8,0;1,10007,5,0;1,10108,2,0;1,7,9000,0;1,8,9000,0;1,4,1000,0; | Z885: 0 | AA885: {} | AB885: n/60
A886: 882 | B886: 882 | C886: 882 | D886: 弑神试炼 | E886: 10501 | F886: 5 | G886: 3 | H886: 200882 | I886: 0 | J886: 480 | K886: 5000,0; | L886: 5 | M886: 5000,1; | N886: 39240/3600*(nPatrolSec+3)*(1000+nGuanQia)/1000 | O886: 31380/3600*(nPatrolSec+3)*(1000+nGuanQia)/1000 | P886: 19320/3600*(nPatrolSec+3)*(1000+nGuanQia)/1000 | Q886: nGuanQia + 1000 | R886: 39240/60*nMin*(1000+nGuanQia)/1000 | S886: 31380/60*nMin*(1000+nGuanQia)/1000 | T886: 19320/60*nMin*(1000+nGuanQia)/1000 | U886: 喽啰 | V886: pet_21;pet_201;pet_93;pet_91; | W886: 4 | X886: 5 | Y886: 1,28000,8,0;1,19016,8,0;1,10007,5,0;1,10108,2,0;1,7,9000,0;1,8,9000,0;1,4,1000,0; | Z886: 0 | AA886: {} | AB886: n/60
A887: 883 | B887: 883 | C887: 883 | D887: 弑神试炼 | E887: 10501 | F887: 5 | G887: 3 | H887: 200883 | I887: 0 | J887: 480 | K887: 5000,0; | L887: 5 | M887: 5000,1; | N887: 39240/3600*(nPatrolSec+3)*(1000+nGuanQia)/1000 | O887: 31380/3600*(nPatrolSec+3)*(1000+nGuanQia)/1000 | P887: 19320/3600*(nPatrolSec+3)*(1000+nGuanQia)/1000 | Q887: nGuanQia + 1000 | R887: 39240/60*nMin*(1000+nGuanQia)/1000 | S887: 31380/60*nMin*(1000+nGuanQia)/1000 | T887: 19320/60*nMin*(1000+nGuanQia)/1000 | U887: 喽啰 | V887: pet_21;pet_201;pet_93;pet_91; | W887: 4 | X887: 5 | Y887: 1,28000,8,0;1,19016,8,0;1,10007,5,0;1,10108,2,0;1,7,9000,0;1,8,9000,0;1,4,1000,0; | Z887: 0 | AA887: {} | AB887: n/60
A888: 884 | B888: 884 | C888: 884 | D888: 弑神试炼 | E888: 10501 | F888: 5 | G888: 3 | H888: 200884 | I888: 0 | J888: 480 | K888: 5000,0; | L888: 5 | M888: 5000,1; | N888: 39240/3600*(nPatrolSec+3)*(1000+nGuanQia)/1000 | O888: 31380/3600*(nPatrolSec+3)*(1000+nGuanQia)/1000 | P888: 19320/3600*(nPatrolSec+3)*(1000+nGuanQia)/1000 | Q888: nGuanQia + 1000 | R888: 39240/60*nMin*(1000+nGuanQia)/1000 | S888: 31380/60*nMin*(1000+nGuanQia)/1000 | T888: 19320/60*nMin*(1000+nGuanQia)/1000 | U888: 喽啰 | V888: pet_21;pet_201;pet_93;pet_91; | W888: 4 | X888: 5 | Y888: 1,28000,8,0;1,19016,8,0;1,10007,5,0;1,10108,2,0;1,7,9000,0;1,8,9000,0;1,4,1000,0; | Z888: 0 | AA888: {} | AB888: n/60
A889: 885 | B889: 885 | C889: 885 | D889: 弑神试炼 | E889: 10501 | F889: 5 | G889: 3 | H889: 200885 | I889: 0 | J889: 480 | K889: 5000,0; | L889: 5 | M889: 5000,1; | N889: 39240/3600*(nPatrolSec+3)*(1000+nGuanQia)/1000 | O889: 31380/3600*(nPatrolSec+3)*(1000+nGuanQia)/1000 | P889: 19320/3600*(nPatrolSec+3)*(1000+nGuanQia)/1000 | Q889: nGuanQia + 1000 | R889: 39240/60*nMin*(1000+nGuanQia)/1000 | S889: 31380/60*nMin*(1000+nGuanQia)/1000 | T889: 19320/60*nMin*(1000+nGuanQia)/1000 | U889: 喽啰 | V889: pet_21;pet_201;pet_93;pet_91; | W889: 4 | X889: 5 | Y889: 1,28000,8,0;1,19016,8,0;1,10007,5,0;1,10108,2,0;1,7,9000,0;1,8,9000,0;1,4,1000,0; | Z889: 0 | AA889: {} | AB889: n/60
A890: 886 | B890: 886 | C890: 886 | D890: 弑神试炼 | E890: 10501 | F890: 5 | G890: 3 | H890: 200886 | I890: 0 | J890: 480 | K890: 5000,0; | L890: 5 | M890: 5000,1; | N890: 39240/3600*(nPatrolSec+3)*(1000+nGuanQia)/1000 | O890: 31380/3600*(nPatrolSec+3)*(1000+nGuanQia)/1000 | P890: 19320/3600*(nPatrolSec+3)*(1000+nGuanQia)/1000 | Q890: nGuanQia + 1000 | R890: 39240/60*nMin*(1000+nGuanQia)/1000 | S890: 31380/60*nMin*(1000+nGuanQia)/1000 | T890: 19320/60*nMin*(1000+nGuanQia)/1000 | U890: 喽啰 | V890: pet_21;pet_201;pet_93;pet_91; | W890: 4 | X890: 5 | Y890: 1,28000,8,0;1,19016,8,0;1,10007,5,0;1,10108,2,0;1,7,9000,0;1,8,9000,0;1,4,1000,0; | Z890: 0 | AA890: {} | AB890: n/60
A891: 887 | B891: 887 | C891: 887 | D891: 弑神试炼 | E891: 10501 | F891: 5 | G891: 3 | H891: 200887 | I891: 0 | J891: 480 | K891: 5000,0; | L891: 5 | M891: 5000,1; | N891: 39240/3600*(nPatrolSec+3)*(1000+nGuanQia)/1000 | O891: 31380/3600*(nPatrolSec+3)*(1000+nGuanQia)/1000 | P891: 19320/3600*(nPatrolSec+3)*(1000+nGuanQia)/1000 | Q891: nGuanQia + 1000 | R891: 39240/60*nMin*(1000+nGuanQia)/1000 | S891: 31380/60*nMin*(1000+nGuanQia)/1000 | T891: 19320/60*nMin*(1000+nGuanQia)/1000 | U891: 喽啰 | V891: pet_21;pet_201;pet_93;pet_91; | W891: 4 | X891: 5 | Y891: 1,28000,8,0;1,19016,8,0;1,10007,5,0;1,10108,2,0;1,7,9000,0;1,8,9000,0;1,4,1000,0; | Z891: 0 | AA891: {} | AB891: n/60
A892: 888 | B892: 888 | C892: 888 | D892: 弑神试炼 | E892: 10501 | F892: 5 | G892: 3 | H892: 200888 | I892: 0 | J892: 480 | K892: 5000,0; | L892: 5 | M892: 5000,1; | N892: 39240/3600*(nPatrolSec+3)*(1000+nGuanQia)/1000 | O892: 31380/3600*(nPatrolSec+3)*(1000+nGuanQia)/1000 | P892: 19320/3600*(nPatrolSec+3)*(1000+nGuanQia)/1000 | Q892: nGuanQia + 1000 | R892: 39240/60*nMin*(1000+nGuanQia)/1000 | S892: 31380/60*nMin*(1000+nGuanQia)/1000 | T892: 19320/60*nMin*(1000+nGuanQia)/1000 | U892: 喽啰 | V892: pet_21;pet_201;pet_93;pet_91; | W892: 4 | X892: 5 | Y892: 1,28000,8,0;1,19016,8,0;1,10007,5,0;1,10108,2,0;1,7,9000,0;1,8,9000,0;1,4,1000,0; | Z892: 0 | AA892: {} | AB892: n/60
A893: 889 | B893: 889 | C893: 889 | D893: 弑神试炼 | E893: 10501 | F893: 5 | G893: 3 | H893: 200889 | I893: 0 | J893: 480 | K893: 5000,0; | L893: 5 | M893: 5000,1; | N893: 39240/3600*(nPatrolSec+3)*(1000+nGuanQia)/1000 | O893: 31380/3600*(nPatrolSec+3)*(1000+nGuanQia)/1000 | P893: 19320/3600*(nPatrolSec+3)*(1000+nGuanQia)/1000 | Q893: nGuanQia + 1000 | R893: 39240/60*nMin*(1000+nGuanQia)/1000 | S893: 31380/60*nMin*(1000+nGuanQia)/1000 | T893: 19320/60*nMin*(1000+nGuanQia)/1000 | U893: 喽啰 | V893: pet_21;pet_201;pet_93;pet_91; | W893: 4 | X893: 5 | Y893: 1,28000,8,0;1,19016,8,0;1,10007,5,0;1,10108,2,0;1,7,9000,0;1,8,9000,0;1,4,1000,0; | Z893: 0 | AA893: {} | AB893: n/60
A894: 890 | B894: 890 | C894: 890 | D894: 弑神试炼 | E894: 10501 | F894: 5 | G894: 3 | H894: 200890 | I894: 0 | J894: 480 | K894: 5000,0; | L894: 5 | M894: 5000,1; | N894: 39240/3600*(nPatrolSec+3)*(1000+nGuanQia)/1000 | O894: 31380/3600*(nPatrolSec+3)*(1000+nGuanQia)/1000 | P894: 19320/3600*(nPatrolSec+3)*(1000+nGuanQia)/1000 | Q894: nGuanQia + 1000 | R894: 39240/60*nMin*(1000+nGuanQia)/1000 | S894: 31380/60*nMin*(1000+nGuanQia)/1000 | T894: 19320/60*nMin*(1000+nGuanQia)/1000 | U894: 喽啰 | V894: pet_21;pet_201;pet_93;pet_91; | W894: 4 | X894: 5 | Y894: 1,28000,8,0;1,19016,8,0;1,10007,5,0;1,10108,2,0;1,7,9000,0;1,8,9000,0;1,4,1000,0; | Z894: 0 | AA894: {} | AB894: n/60
A895: 891 | B895: 891 | C895: 891 | D895: 弑神试炼 | E895: 10501 | F895: 5 | G895: 3 | H895: 200891 | I895: 0 | J895: 480 | K895: 5000,0; | L895: 5 | M895: 5000,1; | N895: 39240/3600*(nPatrolSec+3)*(1000+nGuanQia)/1000 | O895: 31380/3600*(nPatrolSec+3)*(1000+nGuanQia)/1000 | P895: 19320/3600*(nPatrolSec+3)*(1000+nGuanQia)/1000 | Q895: nGuanQia + 1000 | R895: 39240/60*nMin*(1000+nGuanQia)/1000 | S895: 31380/60*nMin*(1000+nGuanQia)/1000 | T895: 19320/60*nMin*(1000+nGuanQia)/1000 | U895: 喽啰 | V895: pet_21;pet_201;pet_93;pet_91; | W895: 4 | X895: 5 | Y895: 1,28000,8,0;1,19016,8,0;1,10007,5,0;1,10108,2,0;1,7,9000,0;1,8,9000,0;1,4,1000,0; | Z895: 0 | AA895: {} | AB895: n/60
A896: 892 | B896: 892 | C896: 892 | D896: 弑神试炼 | E896: 10501 | F896: 5 | G896: 3 | H896: 200892 | I896: 0 | J896: 480 | K896: 5000,0; | L896: 5 | M896: 5000,1; | N896: 39240/3600*(nPatrolSec+3)*(1000+nGuanQia)/1000 | O896: 31380/3600*(nPatrolSec+3)*(1000+nGuanQia)/1000 | P896: 19320/3600*(nPatrolSec+3)*(1000+nGuanQia)/1000 | Q896: nGuanQia + 1000 | R896: 39240/60*nMin*(1000+nGuanQia)/1000 | S896: 31380/60*nMin*(1000+nGuanQia)/1000 | T896: 19320/60*nMin*(1000+nGuanQia)/1000 | U896: 喽啰 | V896: pet_21;pet_201;pet_93;pet_91; | W896: 4 | X896: 5 | Y896: 1,28000,8,0;1,19016,8,0;1,10007,5,0;1,10108,2,0;1,7,9000,0;1,8,9000,0;1,4,1000,0; | Z896: 0 | AA896: {} | AB896: n/60
A897: 893 | B897: 893 | C897: 893 | D897: 弑神试炼 | E897: 10501 | F897: 5 | G897: 3 | H897: 200893 | I897: 0 | J897: 480 | K897: 5000,0; | L897: 5 | M897: 5000,1; | N897: 39240/3600*(nPatrolSec+3)*(1000+nGuanQia)/1000 | O897: 31380/3600*(nPatrolSec+3)*(1000+nGuanQia)/1000 | P897: 19320/3600*(nPatrolSec+3)*(1000+nGuanQia)/1000 | Q897: nGuanQia + 1000 | R897: 39240/60*nMin*(1000+nGuanQia)/1000 | S897: 31380/60*nMin*(1000+nGuanQia)/1000 | T897: 19320/60*nMin*(1000+nGuanQia)/1000 | U897: 喽啰 | V897: pet_21;pet_201;pet_93;pet_91; | W897: 4 | X897: 5 | Y897: 1,28000,8,0;1,19016,8,0;1,10007,5,0;1,10108,2,0;1,7,9000,0;1,8,9000,0;1,4,1000,0; | Z897: 0 | AA897: {} | AB897: n/60
A898: 894 | B898: 894 | C898: 894 | D898: 弑神试炼 | E898: 10501 | F898: 5 | G898: 3 | H898: 200894 | I898: 0 | J898: 480 | K898: 5000,0; | L898: 5 | M898: 5000,1; | N898: 39240/3600*(nPatrolSec+3)*(1000+nGuanQia)/1000 | O898: 31380/3600*(nPatrolSec+3)*(1000+nGuanQia)/1000 | P898: 19320/3600*(nPatrolSec+3)*(1000+nGuanQia)/1000 | Q898: nGuanQia + 1000 | R898: 39240/60*nMin*(1000+nGuanQia)/1000 | S898: 31380/60*nMin*(1000+nGuanQia)/1000 | T898: 19320/60*nMin*(1000+nGuanQia)/1000 | U898: 喽啰 | V898: pet_21;pet_201;pet_93;pet_91; | W898: 4 | X898: 5 | Y898: 1,28000,8,0;1,19016,8,0;1,10007,5,0;1,10108,2,0;1,7,9000,0;1,8,9000,0;1,4,1000,0; | Z898: 0 | AA898: {} | AB898: n/60
A899: 895 | B899: 895 | C899: 895 | D899: 弑神试炼 | E899: 10501 | F899: 5 | G899: 3 | H899: 200895 | I899: 0 | J899: 480 | K899: 5000,0; | L899: 5 | M899: 5000,1; | N899: 39240/3600*(nPatrolSec+3)*(1000+nGuanQia)/1000 | O899: 31380/3600*(nPatrolSec+3)*(1000+nGuanQia)/1000 | P899: 19320/3600*(nPatrolSec+3)*(1000+nGuanQia)/1000 | Q899: nGuanQia + 1000 | R899: 39240/60*nMin*(1000+nGuanQia)/1000 | S899: 31380/60*nMin*(1000+nGuanQia)/1000 | T899: 19320/60*nMin*(1000+nGuanQia)/1000 | U899: 喽啰 | V899: pet_21;pet_201;pet_93;pet_91; | W899: 4 | X899: 5 | Y899: 1,28000,8,0;1,19016,8,0;1,10007,5,0;1,10108,2,0;1,7,9000,0;1,8,9000,0;1,4,1000,0; | Z899: 0 | AA899: {} | AB899: n/60
A900: 896 | B900: 896 | C900: 896 | D900: 弑神试炼 | E900: 10501 | F900: 5 | G900: 3 | H900: 200896 | I900: 0 | J900: 480 | K900: 5000,0; | L900: 5 | M900: 5000,1; | N900: 39240/3600*(nPatrolSec+3)*(1000+nGuanQia)/1000 | O900: 31380/3600*(nPatrolSec+3)*(1000+nGuanQia)/1000 | P900: 19320/3600*(nPatrolSec+3)*(1000+nGuanQia)/1000 | Q900: nGuanQia + 1000 | R900: 39240/60*nMin*(1000+nGuanQia)/1000 | S900: 31380/60*nMin*(1000+nGuanQia)/1000 | T900: 19320/60*nMin*(1000+nGuanQia)/1000 | U900: 喽啰 | V900: pet_21;pet_201;pet_93;pet_91; | W900: 4 | X900: 5 | Y900: 1,28000,8,0;1,19016,8,0;1,10007,5,0;1,10108,2,0;1,7,9000,0;1,8,9000,0;1,4,1000,0; | Z900: 0 | AA900: {} | AB900: n/60
A901: 897 | B901: 897 | C901: 897 | D901: 弑神试炼 | E901: 10501 | F901: 5 | G901: 3 | H901: 200897 | I901: 0 | J901: 480 | K901: 5000,0; | L901: 5 | M901: 5000,1; | N901: 39240/3600*(nPatrolSec+3)*(1000+nGuanQia)/1000 | O901: 31380/3600*(nPatrolSec+3)*(1000+nGuanQia)/1000 | P901: 19320/3600*(nPatrolSec+3)*(1000+nGuanQia)/1000 | Q901: nGuanQia + 1000 | R901: 39240/60*nMin*(1000+nGuanQia)/1000 | S901: 31380/60*nMin*(1000+nGuanQia)/1000 | T901: 19320/60*nMin*(1000+nGuanQia)/1000 | U901: 喽啰 | V901: pet_21;pet_201;pet_93;pet_91; | W901: 4 | X901: 5 | Y901: 1,28000,8,0;1,19016,8,0;1,10007,5,0;1,10108,2,0;1,7,9000,0;1,8,9000,0;1,4,1000,0; | Z901: 0 | AA901: {} | AB901: n/60
A902: 898 | B902: 898 | C902: 898 | D902: 弑神试炼 | E902: 10501 | F902: 5 | G902: 3 | H902: 200898 | I902: 0 | J902: 480 | K902: 5000,0; | L902: 5 | M902: 5000,1; | N902: 39240/3600*(nPatrolSec+3)*(1000+nGuanQia)/1000 | O902: 31380/3600*(nPatrolSec+3)*(1000+nGuanQia)/1000 | P902: 19320/3600*(nPatrolSec+3)*(1000+nGuanQia)/1000 | Q902: nGuanQia + 1000 | R902: 39240/60*nMin*(1000+nGuanQia)/1000 | S902: 31380/60*nMin*(1000+nGuanQia)/1000 | T902: 19320/60*nMin*(1000+nGuanQia)/1000 | U902: 喽啰 | V902: pet_21;pet_201;pet_93;pet_91; | W902: 4 | X902: 5 | Y902: 1,28000,8,0;1,19016,8,0;1,10007,5,0;1,10108,2,0;1,7,9000,0;1,8,9000,0;1,4,1000,0; | Z902: 0 | AA902: {} | AB902: n/60
A903: 899 | B903: 899 | C903: 899 | D903: 弑神试炼 | E903: 10501 | F903: 5 | G903: 3 | H903: 200899 | I903: 0 | J903: 480 | K903: 5000,0; | L903: 5 | M903: 5000,1; | N903: 39240/3600*(nPatrolSec+3)*(1000+nGuanQia)/1000 | O903: 31380/3600*(nPatrolSec+3)*(1000+nGuanQia)/1000 | P903: 19320/3600*(nPatrolSec+3)*(1000+nGuanQia)/1000 | Q903: nGuanQia + 1000 | R903: 39240/60*nMin*(1000+nGuanQia)/1000 | S903: 31380/60*nMin*(1000+nGuanQia)/1000 | T903: 19320/60*nMin*(1000+nGuanQia)/1000 | U903: 喽啰 | V903: pet_21;pet_201;pet_93;pet_91; | W903: 4 | X903: 5 | Y903: 1,28000,8,0;1,19016,8,0;1,10007,5,0;1,10108,2,0;1,7,9000,0;1,8,9000,0;1,4,1000,0; | Z903: 0 | AA903: {} | AB903: n/60
A904: 900 | B904: 900 | C904: 900 | D904: 弑神试炼 | E904: 10501 | F904: 5 | G904: 3 | H904: 200900 | I904: 0 | J904: 480 | K904: 5000,0; | L904: 5 | M904: 5000,1; | N904: 39240/3600*(nPatrolSec+3)*(1000+nGuanQia)/1000 | O904: 31380/3600*(nPatrolSec+3)*(1000+nGuanQia)/1000 | P904: 19320/3600*(nPatrolSec+3)*(1000+nGuanQia)/1000 | Q904: nGuanQia + 1000 | R904: 39240/60*nMin*(1000+nGuanQia)/1000 | S904: 31380/60*nMin*(1000+nGuanQia)/1000 | T904: 19320/60*nMin*(1000+nGuanQia)/1000 | U904: 喽啰 | V904: pet_21;pet_201;pet_93;pet_91; | W904: 4 | X904: 5 | Y904: 1,28000,8,0;1,19016,8,0;1,10007,5,0;1,10108,2,0;1,7,9000,0;1,8,9000,0;1,4,1000,0; | Z904: 0 | AA904: {} | AB904: n/60
A905: 901 | B905: 901 | C905: 901 | D905: 弑神试炼 | E905: 10501 | F905: 5 | G905: 3 | H905: 200901 | I905: 0 | J905: 480 | K905: 5000,0; | L905: 5 | M905: 5000,1; | N905: 39240/3600*(nPatrolSec+3)*(1000+nGuanQia)/1000 | O905: 31380/3600*(nPatrolSec+3)*(1000+nGuanQia)/1000 | P905: 19320/3600*(nPatrolSec+3)*(1000+nGuanQia)/1000 | Q905: nGuanQia + 1000 | R905: 39240/60*nMin*(1000+nGuanQia)/1000 | S905: 31380/60*nMin*(1000+nGuanQia)/1000 | T905: 19320/60*nMin*(1000+nGuanQia)/1000 | U905: 喽啰 | V905: pet_21;pet_201;pet_93;pet_91; | W905: 4 | X905: 5 | Y905: 1,28000,8,0;1,19016,8,0;1,10007,5,0;1,10108,2,0;1,7,9000,0;1,8,9000,0;1,4,1000,0; | Z905: 0 | AA905: {} | AB905: n/60
A906: 902 | B906: 902 | C906: 902 | D906: 弑神试炼 | E906: 10501 | F906: 5 | G906: 3 | H906: 200902 | I906: 0 | J906: 480 | K906: 5000,0; | L906: 5 | M906: 5000,1; | N906: 39240/3600*(nPatrolSec+3)*(1000+nGuanQia)/1000 | O906: 31380/3600*(nPatrolSec+3)*(1000+nGuanQia)/1000 | P906: 19320/3600*(nPatrolSec+3)*(1000+nGuanQia)/1000 | Q906: nGuanQia + 1000 | R906: 39240/60*nMin*(1000+nGuanQia)/1000 | S906: 31380/60*nMin*(1000+nGuanQia)/1000 | T906: 19320/60*nMin*(1000+nGuanQia)/1000 | U906: 喽啰 | V906: pet_21;pet_201;pet_93;pet_91; | W906: 4 | X906: 5 | Y906: 1,28000,8,0;1,19016,8,0;1,10007,5,0;1,10108,2,0;1,7,9000,0;1,8,9000,0;1,4,1000,0; | Z906: 0 | AA906: {} | AB906: n/60
A907: 903 | B907: 903 | C907: 903 | D907: 弑神试炼 | E907: 10501 | F907: 5 | G907: 3 | H907: 200903 | I907: 0 | J907: 480 | K907: 5000,0; | L907: 5 | M907: 5000,1; | N907: 39240/3600*(nPatrolSec+3)*(1000+nGuanQia)/1000 | O907: 31380/3600*(nPatrolSec+3)*(1000+nGuanQia)/1000 | P907: 19320/3600*(nPatrolSec+3)*(1000+nGuanQia)/1000 | Q907: nGuanQia + 1000 | R907: 39240/60*nMin*(1000+nGuanQia)/1000 | S907: 31380/60*nMin*(1000+nGuanQia)/1000 | T907: 19320/60*nMin*(1000+nGuanQia)/1000 | U907: 喽啰 | V907: pet_21;pet_201;pet_93;pet_91; | W907: 4 | X907: 5 | Y907: 1,28000,8,0;1,19016,8,0;1,10007,5,0;1,10108,2,0;1,7,9000,0;1,8,9000,0;1,4,1000,0; | Z907: 0 | AA907: {} | AB907: n/60
A908: 904 | B908: 904 | C908: 904 | D908: 弑神试炼 | E908: 10501 | F908: 5 | G908: 3 | H908: 200904 | I908: 0 | J908: 480 | K908: 5000,0; | L908: 5 | M908: 5000,1; | N908: 39240/3600*(nPatrolSec+3)*(1000+nGuanQia)/1000 | O908: 31380/3600*(nPatrolSec+3)*(1000+nGuanQia)/1000 | P908: 19320/3600*(nPatrolSec+3)*(1000+nGuanQia)/1000 | Q908: nGuanQia + 1000 | R908: 39240/60*nMin*(1000+nGuanQia)/1000 | S908: 31380/60*nMin*(1000+nGuanQia)/1000 | T908: 19320/60*nMin*(1000+nGuanQia)/1000 | U908: 喽啰 | V908: pet_21;pet_201;pet_93;pet_91; | W908: 4 | X908: 5 | Y908: 1,28000,8,0;1,19016,8,0;1,10007,5,0;1,10108,2,0;1,7,9000,0;1,8,9000,0;1,4,1000,0; | Z908: 0 | AA908: {} | AB908: n/60
A909: 905 | B909: 905 | C909: 905 | D909: 弑神试炼 | E909: 10501 | F909: 5 | G909: 3 | H909: 200905 | I909: 0 | J909: 480 | K909: 5000,0; | L909: 5 | M909: 5000,1; | N909: 39240/3600*(nPatrolSec+3)*(1000+nGuanQia)/1000 | O909: 31380/3600*(nPatrolSec+3)*(1000+nGuanQia)/1000 | P909: 19320/3600*(nPatrolSec+3)*(1000+nGuanQia)/1000 | Q909: nGuanQia + 1000 | R909: 39240/60*nMin*(1000+nGuanQia)/1000 | S909: 31380/60*nMin*(1000+nGuanQia)/1000 | T909: 19320/60*nMin*(1000+nGuanQia)/1000 | U909: 喽啰 | V909: pet_21;pet_201;pet_93;pet_91; | W909: 4 | X909: 5 | Y909: 1,28000,8,0;1,19016,8,0;1,10007,5,0;1,10108,2,0;1,7,9000,0;1,8,9000,0;1,4,1000,0; | Z909: 0 | AA909: {} | AB909: n/60
A910: 906 | B910: 906 | C910: 906 | D910: 弑神试炼 | E910: 10501 | F910: 5 | G910: 3 | H910: 200906 | I910: 0 | J910: 480 | K910: 5000,0; | L910: 5 | M910: 5000,1; | N910: 39240/3600*(nPatrolSec+3)*(1000+nGuanQia)/1000 | O910: 31380/3600*(nPatrolSec+3)*(1000+nGuanQia)/1000 | P910: 19320/3600*(nPatrolSec+3)*(1000+nGuanQia)/1000 | Q910: nGuanQia + 1000 | R910: 39240/60*nMin*(1000+nGuanQia)/1000 | S910: 31380/60*nMin*(1000+nGuanQia)/1000 | T910: 19320/60*nMin*(1000+nGuanQia)/1000 | U910: 喽啰 | V910: pet_21;pet_201;pet_93;pet_91; | W910: 4 | X910: 5 | Y910: 1,28000,8,0;1,19016,8,0;1,10007,5,0;1,10108,2,0;1,7,9000,0;1,8,9000,0;1,4,1000,0; | Z910: 0 | AA910: {} | AB910: n/60
A911: 907 | B911: 907 | C911: 907 | D911: 弑神试炼 | E911: 10501 | F911: 5 | G911: 3 | H911: 200907 | I911: 0 | J911: 480 | K911: 5000,0; | L911: 5 | M911: 5000,1; | N911: 39240/3600*(nPatrolSec+3)*(1000+nGuanQia)/1000 | O911: 31380/3600*(nPatrolSec+3)*(1000+nGuanQia)/1000 | P911: 19320/3600*(nPatrolSec+3)*(1000+nGuanQia)/1000 | Q911: nGuanQia + 1000 | R911: 39240/60*nMin*(1000+nGuanQia)/1000 | S911: 31380/60*nMin*(1000+nGuanQia)/1000 | T911: 19320/60*nMin*(1000+nGuanQia)/1000 | U911: 喽啰 | V911: pet_21;pet_201;pet_93;pet_91; | W911: 4 | X911: 5 | Y911: 1,28000,8,0;1,19016,8,0;1,10007,5,0;1,10108,2,0;1,7,9000,0;1,8,9000,0;1,4,1000,0; | Z911: 0 | AA911: {} | AB911: n/60
A912: 908 | B912: 908 | C912: 908 | D912: 弑神试炼 | E912: 10501 | F912: 5 | G912: 3 | H912: 200908 | I912: 0 | J912: 480 | K912: 5000,0; | L912: 5 | M912: 5000,1; | N912: 39240/3600*(nPatrolSec+3)*(1000+nGuanQia)/1000 | O912: 31380/3600*(nPatrolSec+3)*(1000+nGuanQia)/1000 | P912: 19320/3600*(nPatrolSec+3)*(1000+nGuanQia)/1000 | Q912: nGuanQia + 1000 | R912: 39240/60*nMin*(1000+nGuanQia)/1000 | S912: 31380/60*nMin*(1000+nGuanQia)/1000 | T912: 19320/60*nMin*(1000+nGuanQia)/1000 | U912: 喽啰 | V912: pet_21;pet_201;pet_93;pet_91; | W912: 4 | X912: 5 | Y912: 1,28000,8,0;1,19016,8,0;1,10007,5,0;1,10108,2,0;1,7,9000,0;1,8,9000,0;1,4,1000,0; | Z912: 0 | AA912: {} | AB912: n/60
A913: 909 | B913: 909 | C913: 909 | D913: 弑神试炼 | E913: 10501 | F913: 5 | G913: 3 | H913: 200909 | I913: 0 | J913: 480 | K913: 5000,0; | L913: 5 | M913: 5000,1; | N913: 39240/3600*(nPatrolSec+3)*(1000+nGuanQia)/1000 | O913: 31380/3600*(nPatrolSec+3)*(1000+nGuanQia)/1000 | P913: 19320/3600*(nPatrolSec+3)*(1000+nGuanQia)/1000 | Q913: nGuanQia + 1000 | R913: 39240/60*nMin*(1000+nGuanQia)/1000 | S913: 31380/60*nMin*(1000+nGuanQia)/1000 | T913: 19320/60*nMin*(1000+nGuanQia)/1000 | U913: 喽啰 | V913: pet_21;pet_201;pet_93;pet_91; | W913: 4 | X913: 5 | Y913: 1,28000,8,0;1,19016,8,0;1,10007,5,0;1,10108,2,0;1,7,9000,0;1,8,9000,0;1,4,1000,0; | Z913: 0 | AA913: {} | AB913: n/60
A914: 910 | B914: 910 | C914: 910 | D914: 弑神试炼 | E914: 10501 | F914: 5 | G914: 3 | H914: 200910 | I914: 0 | J914: 480 | K914: 5000,0; | L914: 5 | M914: 5000,1; | N914: 39240/3600*(nPatrolSec+3)*(1000+nGuanQia)/1000 | O914: 31380/3600*(nPatrolSec+3)*(1000+nGuanQia)/1000 | P914: 19320/3600*(nPatrolSec+3)*(1000+nGuanQia)/1000 | Q914: nGuanQia + 1000 | R914: 39240/60*nMin*(1000+nGuanQia)/1000 | S914: 31380/60*nMin*(1000+nGuanQia)/1000 | T914: 19320/60*nMin*(1000+nGuanQia)/1000 | U914: 喽啰 | V914: pet_21;pet_201;pet_93;pet_91; | W914: 4 | X914: 5 | Y914: 1,28000,8,0;1,19016,8,0;1,10007,5,0;1,10108,2,0;1,7,9000,0;1,8,9000,0;1,4,1000,0; | Z914: 0 | AA914: {} | AB914: n/60
A915: 911 | B915: 911 | C915: 911 | D915: 弑神试炼 | E915: 10501 | F915: 5 | G915: 3 | H915: 200911 | I915: 0 | J915: 480 | K915: 5000,0; | L915: 5 | M915: 5000,1; | N915: 39240/3600*(nPatrolSec+3)*(1000+nGuanQia)/1000 | O915: 31380/3600*(nPatrolSec+3)*(1000+nGuanQia)/1000 | P915: 19320/3600*(nPatrolSec+3)*(1000+nGuanQia)/1000 | Q915: nGuanQia + 1000 | R915: 39240/60*nMin*(1000+nGuanQia)/1000 | S915: 31380/60*nMin*(1000+nGuanQia)/1000 | T915: 19320/60*nMin*(1000+nGuanQia)/1000 | U915: 喽啰 | V915: pet_21;pet_201;pet_93;pet_91; | W915: 4 | X915: 5 | Y915: 1,28000,8,0;1,19016,8,0;1,10007,5,0;1,10108,2,0;1,7,9000,0;1,8,9000,0;1,4,1000,0; | Z915: 0 | AA915: {} | AB915: n/60
A916: 912 | B916: 912 | C916: 912 | D916: 弑神试炼 | E916: 10501 | F916: 5 | G916: 3 | H916: 200912 | I916: 0 | J916: 480 | K916: 5000,0; | L916: 5 | M916: 5000,1; | N916: 39240/3600*(nPatrolSec+3)*(1000+nGuanQia)/1000 | O916: 31380/3600*(nPatrolSec+3)*(1000+nGuanQia)/1000 | P916: 19320/3600*(nPatrolSec+3)*(1000+nGuanQia)/1000 | Q916: nGuanQia + 1000 | R916: 39240/60*nMin*(1000+nGuanQia)/1000 | S916: 31380/60*nMin*(1000+nGuanQia)/1000 | T916: 19320/60*nMin*(1000+nGuanQia)/1000 | U916: 喽啰 | V916: pet_21;pet_201;pet_93;pet_91; | W916: 4 | X916: 5 | Y916: 1,28000,8,0;1,19016,8,0;1,10007,5,0;1,10108,2,0;1,7,9000,0;1,8,9000,0;1,4,1000,0; | Z916: 0 | AA916: {} | AB916: n/60
A917: 913 | B917: 913 | C917: 913 | D917: 弑神试炼 | E917: 10501 | F917: 5 | G917: 3 | H917: 200913 | I917: 0 | J917: 480 | K917: 5000,0; | L917: 5 | M917: 5000,1; | N917: 39240/3600*(nPatrolSec+3)*(1000+nGuanQia)/1000 | O917: 31380/3600*(nPatrolSec+3)*(1000+nGuanQia)/1000 | P917: 19320/3600*(nPatrolSec+3)*(1000+nGuanQia)/1000 | Q917: nGuanQia + 1000 | R917: 39240/60*nMin*(1000+nGuanQia)/1000 | S917: 31380/60*nMin*(1000+nGuanQia)/1000 | T917: 19320/60*nMin*(1000+nGuanQia)/1000 | U917: 喽啰 | V917: pet_21;pet_201;pet_93;pet_91; | W917: 4 | X917: 5 | Y917: 1,28000,8,0;1,19016,8,0;1,10007,5,0;1,10108,2,0;1,7,9000,0;1,8,9000,0;1,4,1000,0; | Z917: 0 | AA917: {} | AB917: n/60
A918: 914 | B918: 914 | C918: 914 | D918: 弑神试炼 | E918: 10501 | F918: 5 | G918: 3 | H918: 200914 | I918: 0 | J918: 480 | K918: 5000,0; | L918: 5 | M918: 5000,1; | N918: 39240/3600*(nPatrolSec+3)*(1000+nGuanQia)/1000 | O918: 31380/3600*(nPatrolSec+3)*(1000+nGuanQia)/1000 | P918: 19320/3600*(nPatrolSec+3)*(1000+nGuanQia)/1000 | Q918: nGuanQia + 1000 | R918: 39240/60*nMin*(1000+nGuanQia)/1000 | S918: 31380/60*nMin*(1000+nGuanQia)/1000 | T918: 19320/60*nMin*(1000+nGuanQia)/1000 | U918: 喽啰 | V918: pet_21;pet_201;pet_93;pet_91; | W918: 4 | X918: 5 | Y918: 1,28000,8,0;1,19016,8,0;1,10007,5,0;1,10108,2,0;1,7,9000,0;1,8,9000,0;1,4,1000,0; | Z918: 0 | AA918: {} | AB918: n/60
A919: 915 | B919: 915 | C919: 915 | D919: 弑神试炼 | E919: 10501 | F919: 5 | G919: 3 | H919: 200915 | I919: 0 | J919: 480 | K919: 5000,0; | L919: 5 | M919: 5000,1; | N919: 39240/3600*(nPatrolSec+3)*(1000+nGuanQia)/1000 | O919: 31380/3600*(nPatrolSec+3)*(1000+nGuanQia)/1000 | P919: 19320/3600*(nPatrolSec+3)*(1000+nGuanQia)/1000 | Q919: nGuanQia + 1000 | R919: 39240/60*nMin*(1000+nGuanQia)/1000 | S919: 31380/60*nMin*(1000+nGuanQia)/1000 | T919: 19320/60*nMin*(1000+nGuanQia)/1000 | U919: 喽啰 | V919: pet_21;pet_201;pet_93;pet_91; | W919: 4 | X919: 5 | Y919: 1,28000,8,0;1,19016,8,0;1,10007,5,0;1,10108,2,0;1,7,9000,0;1,8,9000,0;1,4,1000,0; | Z919: 0 | AA919: {} | AB919: n/60
A920: 916 | B920: 916 | C920: 916 | D920: 弑神试炼 | E920: 10501 | F920: 5 | G920: 3 | H920: 200916 | I920: 0 | J920: 480 | K920: 5000,0; | L920: 5 | M920: 5000,1; | N920: 39240/3600*(nPatrolSec+3)*(1000+nGuanQia)/1000 | O920: 31380/3600*(nPatrolSec+3)*(1000+nGuanQia)/1000 | P920: 19320/3600*(nPatrolSec+3)*(1000+nGuanQia)/1000 | Q920: nGuanQia + 1000 | R920: 39240/60*nMin*(1000+nGuanQia)/1000 | S920: 31380/60*nMin*(1000+nGuanQia)/1000 | T920: 19320/60*nMin*(1000+nGuanQia)/1000 | U920: 喽啰 | V920: pet_21;pet_201;pet_93;pet_91; | W920: 4 | X920: 5 | Y920: 1,28000,8,0;1,19016,8,0;1,10007,5,0;1,10108,2,0;1,7,9000,0;1,8,9000,0;1,4,1000,0; | Z920: 0 | AA920: {} | AB920: n/60
A921: 917 | B921: 917 | C921: 917 | D921: 弑神试炼 | E921: 10501 | F921: 5 | G921: 3 | H921: 200917 | I921: 0 | J921: 480 | K921: 5000,0; | L921: 5 | M921: 5000,1; | N921: 39240/3600*(nPatrolSec+3)*(1000+nGuanQia)/1000 | O921: 31380/3600*(nPatrolSec+3)*(1000+nGuanQia)/1000 | P921: 19320/3600*(nPatrolSec+3)*(1000+nGuanQia)/1000 | Q921: nGuanQia + 1000 | R921: 39240/60*nMin*(1000+nGuanQia)/1000 | S921: 31380/60*nMin*(1000+nGuanQia)/1000 | T921: 19320/60*nMin*(1000+nGuanQia)/1000 | U921: 喽啰 | V921: pet_21;pet_201;pet_93;pet_91; | W921: 4 | X921: 5 | Y921: 1,28000,8,0;1,19016,8,0;1,10007,5,0;1,10108,2,0;1,7,9000,0;1,8,9000,0;1,4,1000,0; | Z921: 0 | AA921: {} | AB921: n/60
A922: 918 | B922: 918 | C922: 918 | D922: 弑神试炼 | E922: 10501 | F922: 5 | G922: 3 | H922: 200918 | I922: 0 | J922: 480 | K922: 5000,0; | L922: 5 | M922: 5000,1; | N922: 39240/3600*(nPatrolSec+3)*(1000+nGuanQia)/1000 | O922: 31380/3600*(nPatrolSec+3)*(1000+nGuanQia)/1000 | P922: 19320/3600*(nPatrolSec+3)*(1000+nGuanQia)/1000 | Q922: nGuanQia + 1000 | R922: 39240/60*nMin*(1000+nGuanQia)/1000 | S922: 31380/60*nMin*(1000+nGuanQia)/1000 | T922: 19320/60*nMin*(1000+nGuanQia)/1000 | U922: 喽啰 | V922: pet_21;pet_201;pet_93;pet_91; | W922: 4 | X922: 5 | Y922: 1,28000,8,0;1,19016,8,0;1,10007,5,0;1,10108,2,0;1,7,9000,0;1,8,9000,0;1,4,1000,0; | Z922: 0 | AA922: {} | AB922: n/60
A923: 919 | B923: 919 | C923: 919 | D923: 弑神试炼 | E923: 10501 | F923: 5 | G923: 3 | H923: 200919 | I923: 0 | J923: 480 | K923: 5000,0; | L923: 5 | M923: 5000,1; | N923: 39240/3600*(nPatrolSec+3)*(1000+nGuanQia)/1000 | O923: 31380/3600*(nPatrolSec+3)*(1000+nGuanQia)/1000 | P923: 19320/3600*(nPatrolSec+3)*(1000+nGuanQia)/1000 | Q923: nGuanQia + 1000 | R923: 39240/60*nMin*(1000+nGuanQia)/1000 | S923: 31380/60*nMin*(1000+nGuanQia)/1000 | T923: 19320/60*nMin*(1000+nGuanQia)/1000 | U923: 喽啰 | V923: pet_21;pet_201;pet_93;pet_91; | W923: 4 | X923: 5 | Y923: 1,28000,8,0;1,19016,8,0;1,10007,5,0;1,10108,2,0;1,7,9000,0;1,8,9000,0;1,4,1000,0; | Z923: 0 | AA923: {} | AB923: n/60
A924: 920 | B924: 920 | C924: 920 | D924: 弑神试炼 | E924: 10501 | F924: 5 | G924: 3 | H924: 200920 | I924: 0 | J924: 480 | K924: 5000,0; | L924: 5 | M924: 5000,1; | N924: 39240/3600*(nPatrolSec+3)*(1000+nGuanQia)/1000 | O924: 31380/3600*(nPatrolSec+3)*(1000+nGuanQia)/1000 | P924: 19320/3600*(nPatrolSec+3)*(1000+nGuanQia)/1000 | Q924: nGuanQia + 1000 | R924: 39240/60*nMin*(1000+nGuanQia)/1000 | S924: 31380/60*nMin*(1000+nGuanQia)/1000 | T924: 19320/60*nMin*(1000+nGuanQia)/1000 | U924: 喽啰 | V924: pet_21;pet_201;pet_93;pet_91; | W924: 4 | X924: 5 | Y924: 1,28000,8,0;1,19016,8,0;1,10007,5,0;1,10108,2,0;1,7,9000,0;1,8,9000,0;1,4,1000,0; | Z924: 0 | AA924: {} | AB924: n/60
A925: 921 | B925: 921 | C925: 921 | D925: 弑神试炼 | E925: 10501 | F925: 5 | G925: 3 | H925: 200921 | I925: 0 | J925: 480 | K925: 5000,0; | L925: 5 | M925: 5000,1; | N925: 39240/3600*(nPatrolSec+3)*(1000+nGuanQia)/1000 | O925: 31380/3600*(nPatrolSec+3)*(1000+nGuanQia)/1000 | P925: 19320/3600*(nPatrolSec+3)*(1000+nGuanQia)/1000 | Q925: nGuanQia + 1000 | R925: 39240/60*nMin*(1000+nGuanQia)/1000 | S925: 31380/60*nMin*(1000+nGuanQia)/1000 | T925: 19320/60*nMin*(1000+nGuanQia)/1000 | U925: 喽啰 | V925: pet_21;pet_201;pet_93;pet_91; | W925: 4 | X925: 5 | Y925: 1,28000,8,0;1,19016,8,0;1,10007,5,0;1,10108,2,0;1,7,9000,0;1,8,9000,0;1,4,1000,0; | Z925: 0 | AA925: {} | AB925: n/60
A926: 922 | B926: 922 | C926: 922 | D926: 弑神试炼 | E926: 10501 | F926: 5 | G926: 3 | H926: 200922 | I926: 0 | J926: 480 | K926: 5000,0; | L926: 5 | M926: 5000,1; | N926: 39240/3600*(nPatrolSec+3)*(1000+nGuanQia)/1000 | O926: 31380/3600*(nPatrolSec+3)*(1000+nGuanQia)/1000 | P926: 19320/3600*(nPatrolSec+3)*(1000+nGuanQia)/1000 | Q926: nGuanQia + 1000 | R926: 39240/60*nMin*(1000+nGuanQia)/1000 | S926: 31380/60*nMin*(1000+nGuanQia)/1000 | T926: 19320/60*nMin*(1000+nGuanQia)/1000 | U926: 喽啰 | V926: pet_21;pet_201;pet_93;pet_91; | W926: 4 | X926: 5 | Y926: 1,28000,8,0;1,19016,8,0;1,10007,5,0;1,10108,2,0;1,7,9000,0;1,8,9000,0;1,4,1000,0; | Z926: 0 | AA926: {} | AB926: n/60
A927: 923 | B927: 923 | C927: 923 | D927: 弑神试炼 | E927: 10501 | F927: 5 | G927: 3 | H927: 200923 | I927: 0 | J927: 480 | K927: 5000,0; | L927: 5 | M927: 5000,1; | N927: 39240/3600*(nPatrolSec+3)*(1000+nGuanQia)/1000 | O927: 31380/3600*(nPatrolSec+3)*(1000+nGuanQia)/1000 | P927: 19320/3600*(nPatrolSec+3)*(1000+nGuanQia)/1000 | Q927: nGuanQia + 1000 | R927: 39240/60*nMin*(1000+nGuanQia)/1000 | S927: 31380/60*nMin*(1000+nGuanQia)/1000 | T927: 19320/60*nMin*(1000+nGuanQia)/1000 | U927: 喽啰 | V927: pet_21;pet_201;pet_93;pet_91; | W927: 4 | X927: 5 | Y927: 1,28000,8,0;1,19016,8,0;1,10007,5,0;1,10108,2,0;1,7,9000,0;1,8,9000,0;1,4,1000,0; | Z927: 0 | AA927: {} | AB927: n/60
A928: 924 | B928: 924 | C928: 924 | D928: 弑神试炼 | E928: 10501 | F928: 5 | G928: 3 | H928: 200924 | I928: 0 | J928: 480 | K928: 5000,0; | L928: 5 | M928: 5000,1; | N928: 39240/3600*(nPatrolSec+3)*(1000+nGuanQia)/1000 | O928: 31380/3600*(nPatrolSec+3)*(1000+nGuanQia)/1000 | P928: 19320/3600*(nPatrolSec+3)*(1000+nGuanQia)/1000 | Q928: nGuanQia + 1000 | R928: 39240/60*nMin*(1000+nGuanQia)/1000 | S928: 31380/60*nMin*(1000+nGuanQia)/1000 | T928: 19320/60*nMin*(1000+nGuanQia)/1000 | U928: 喽啰 | V928: pet_21;pet_201;pet_93;pet_91; | W928: 4 | X928: 5 | Y928: 1,28000,8,0;1,19016,8,0;1,10007,5,0;1,10108,2,0;1,7,9000,0;1,8,9000,0;1,4,1000,0; | Z928: 0 | AA928: {} | AB928: n/60
A929: 925 | B929: 925 | C929: 925 | D929: 弑神试炼 | E929: 10501 | F929: 5 | G929: 3 | H929: 200925 | I929: 0 | J929: 480 | K929: 5000,0; | L929: 5 | M929: 5000,1; | N929: 39240/3600*(nPatrolSec+3)*(1000+nGuanQia)/1000 | O929: 31380/3600*(nPatrolSec+3)*(1000+nGuanQia)/1000 | P929: 19320/3600*(nPatrolSec+3)*(1000+nGuanQia)/1000 | Q929: nGuanQia + 1000 | R929: 39240/60*nMin*(1000+nGuanQia)/1000 | S929: 31380/60*nMin*(1000+nGuanQia)/1000 | T929: 19320/60*nMin*(1000+nGuanQia)/1000 | U929: 喽啰 | V929: pet_21;pet_201;pet_93;pet_91; | W929: 4 | X929: 5 | Y929: 1,28000,8,0;1,19016,8,0;1,10007,5,0;1,10108,2,0;1,7,9000,0;1,8,9000,0;1,4,1000,0; | Z929: 0 | AA929: {} | AB929: n/60
A930: 926 | B930: 926 | C930: 926 | D930: 弑神试炼 | E930: 10501 | F930: 5 | G930: 3 | H930: 200926 | I930: 0 | J930: 480 | K930: 5000,0; | L930: 5 | M930: 5000,1; | N930: 39240/3600*(nPatrolSec+3)*(1000+nGuanQia)/1000 | O930: 31380/3600*(nPatrolSec+3)*(1000+nGuanQia)/1000 | P930: 19320/3600*(nPatrolSec+3)*(1000+nGuanQia)/1000 | Q930: nGuanQia + 1000 | R930: 39240/60*nMin*(1000+nGuanQia)/1000 | S930: 31380/60*nMin*(1000+nGuanQia)/1000 | T930: 19320/60*nMin*(1000+nGuanQia)/1000 | U930: 喽啰 | V930: pet_21;pet_201;pet_93;pet_91; | W930: 4 | X930: 5 | Y930: 1,28000,8,0;1,19016,8,0;1,10007,5,0;1,10108,2,0;1,7,9000,0;1,8,9000,0;1,4,1000,0; | Z930: 0 | AA930: {} | AB930: n/60
A931: 927 | B931: 927 | C931: 927 | D931: 弑神试炼 | E931: 10501 | F931: 5 | G931: 3 | H931: 200927 | I931: 0 | J931: 480 | K931: 5000,0; | L931: 5 | M931: 5000,1; | N931: 39240/3600*(nPatrolSec+3)*(1000+nGuanQia)/1000 | O931: 31380/3600*(nPatrolSec+3)*(1000+nGuanQia)/1000 | P931: 19320/3600*(nPatrolSec+3)*(1000+nGuanQia)/1000 | Q931: nGuanQia + 1000 | R931: 39240/60*nMin*(1000+nGuanQia)/1000 | S931: 31380/60*nMin*(1000+nGuanQia)/1000 | T931: 19320/60*nMin*(1000+nGuanQia)/1000 | U931: 喽啰 | V931: pet_21;pet_201;pet_93;pet_91; | W931: 4 | X931: 5 | Y931: 1,28000,8,0;1,19016,8,0;1,10007,5,0;1,10108,2,0;1,7,9000,0;1,8,9000,0;1,4,1000,0; | Z931: 0 | AA931: {} | AB931: n/60
A932: 928 | B932: 928 | C932: 928 | D932: 弑神试炼 | E932: 10501 | F932: 5 | G932: 3 | H932: 200928 | I932: 0 | J932: 480 | K932: 5000,0; | L932: 5 | M932: 5000,1; | N932: 39240/3600*(nPatrolSec+3)*(1000+nGuanQia)/1000 | O932: 31380/3600*(nPatrolSec+3)*(1000+nGuanQia)/1000 | P932: 19320/3600*(nPatrolSec+3)*(1000+nGuanQia)/1000 | Q932: nGuanQia + 1000 | R932: 39240/60*nMin*(1000+nGuanQia)/1000 | S932: 31380/60*nMin*(1000+nGuanQia)/1000 | T932: 19320/60*nMin*(1000+nGuanQia)/1000 | U932: 喽啰 | V932: pet_21;pet_201;pet_93;pet_91; | W932: 4 | X932: 5 | Y932: 1,28000,8,0;1,19016,8,0;1,10007,5,0;1,10108,2,0;1,7,9000,0;1,8,9000,0;1,4,1000,0; | Z932: 0 | AA932: {} | AB932: n/60
A933: 929 | B933: 929 | C933: 929 | D933: 弑神试炼 | E933: 10501 | F933: 5 | G933: 3 | H933: 200929 | I933: 0 | J933: 480 | K933: 5000,0; | L933: 5 | M933: 5000,1; | N933: 39240/3600*(nPatrolSec+3)*(1000+nGuanQia)/1000 | O933: 31380/3600*(nPatrolSec+3)*(1000+nGuanQia)/1000 | P933: 19320/3600*(nPatrolSec+3)*(1000+nGuanQia)/1000 | Q933: nGuanQia + 1000 | R933: 39240/60*nMin*(1000+nGuanQia)/1000 | S933: 31380/60*nMin*(1000+nGuanQia)/1000 | T933: 19320/60*nMin*(1000+nGuanQia)/1000 | U933: 喽啰 | V933: pet_21;pet_201;pet_93;pet_91; | W933: 4 | X933: 5 | Y933: 1,28000,8,0;1,19016,8,0;1,10007,5,0;1,10108,2,0;1,7,9000,0;1,8,9000,0;1,4,1000,0; | Z933: 0 | AA933: {} | AB933: n/60
A934: 930 | B934: 930 | C934: 930 | D934: 弑神试炼 | E934: 10501 | F934: 5 | G934: 3 | H934: 200930 | I934: 0 | J934: 480 | K934: 5000,0; | L934: 5 | M934: 5000,1; | N934: 39240/3600*(nPatrolSec+3)*(1000+nGuanQia)/1000 | O934: 31380/3600*(nPatrolSec+3)*(1000+nGuanQia)/1000 | P934: 19320/3600*(nPatrolSec+3)*(1000+nGuanQia)/1000 | Q934: nGuanQia + 1000 | R934: 39240/60*nMin*(1000+nGuanQia)/1000 | S934: 31380/60*nMin*(1000+nGuanQia)/1000 | T934: 19320/60*nMin*(1000+nGuanQia)/1000 | U934: 喽啰 | V934: pet_21;pet_201;pet_93;pet_91; | W934: 4 | X934: 5 | Y934: 1,28000,8,0;1,19016,8,0;1,10007,5,0;1,10108,2,0;1,7,9000,0;1,8,9000,0;1,4,1000,0; | Z934: 0 | AA934: {} | AB934: n/60
A935: 931 | B935: 931 | C935: 931 | D935: 弑神试炼 | E935: 10501 | F935: 5 | G935: 3 | H935: 200931 | I935: 0 | J935: 480 | K935: 5000,0; | L935: 5 | M935: 5000,1; | N935: 39240/3600*(nPatrolSec+3)*(1000+nGuanQia)/1000 | O935: 31380/3600*(nPatrolSec+3)*(1000+nGuanQia)/1000 | P935: 19320/3600*(nPatrolSec+3)*(1000+nGuanQia)/1000 | Q935: nGuanQia + 1000 | R935: 39240/60*nMin*(1000+nGuanQia)/1000 | S935: 31380/60*nMin*(1000+nGuanQia)/1000 | T935: 19320/60*nMin*(1000+nGuanQia)/1000 | U935: 喽啰 | V935: pet_21;pet_201;pet_93;pet_91; | W935: 4 | X935: 5 | Y935: 1,28000,8,0;1,19016,8,0;1,10007,5,0;1,10108,2,0;1,7,9000,0;1,8,9000,0;1,4,1000,0; | Z935: 0 | AA935: {} | AB935: n/60
A936: 932 | B936: 932 | C936: 932 | D936: 弑神试炼 | E936: 10501 | F936: 5 | G936: 3 | H936: 200932 | I936: 0 | J936: 480 | K936: 5000,0; | L936: 5 | M936: 5000,1; | N936: 39240/3600*(nPatrolSec+3)*(1000+nGuanQia)/1000 | O936: 31380/3600*(nPatrolSec+3)*(1000+nGuanQia)/1000 | P936: 19320/3600*(nPatrolSec+3)*(1000+nGuanQia)/1000 | Q936: nGuanQia + 1000 | R936: 39240/60*nMin*(1000+nGuanQia)/1000 | S936: 31380/60*nMin*(1000+nGuanQia)/1000 | T936: 19320/60*nMin*(1000+nGuanQia)/1000 | U936: 喽啰 | V936: pet_21;pet_201;pet_93;pet_91; | W936: 4 | X936: 5 | Y936: 1,28000,8,0;1,19016,8,0;1,10007,5,0;1,10108,2,0;1,7,9000,0;1,8,9000,0;1,4,1000,0; | Z936: 0 | AA936: {} | AB936: n/60
A937: 933 | B937: 933 | C937: 933 | D937: 弑神试炼 | E937: 10501 | F937: 5 | G937: 3 | H937: 200933 | I937: 0 | J937: 480 | K937: 5000,0; | L937: 5 | M937: 5000,1; | N937: 39240/3600*(nPatrolSec+3)*(1000+nGuanQia)/1000 | O937: 31380/3600*(nPatrolSec+3)*(1000+nGuanQia)/1000 | P937: 19320/3600*(nPatrolSec+3)*(1000+nGuanQia)/1000 | Q937: nGuanQia + 1000 | R937: 39240/60*nMin*(1000+nGuanQia)/1000 | S937: 31380/60*nMin*(1000+nGuanQia)/1000 | T937: 19320/60*nMin*(1000+nGuanQia)/1000 | U937: 喽啰 | V937: pet_21;pet_201;pet_93;pet_91; | W937: 4 | X937: 5 | Y937: 1,28000,8,0;1,19016,8,0;1,10007,5,0;1,10108,2,0;1,7,9000,0;1,8,9000,0;1,4,1000,0; | Z937: 0 | AA937: {} | AB937: n/60
A938: 934 | B938: 934 | C938: 934 | D938: 弑神试炼 | E938: 10501 | F938: 5 | G938: 3 | H938: 200934 | I938: 0 | J938: 480 | K938: 5000,0; | L938: 5 | M938: 5000,1; | N938: 39240/3600*(nPatrolSec+3)*(1000+nGuanQia)/1000 | O938: 31380/3600*(nPatrolSec+3)*(1000+nGuanQia)/1000 | P938: 19320/3600*(nPatrolSec+3)*(1000+nGuanQia)/1000 | Q938: nGuanQia + 1000 | R938: 39240/60*nMin*(1000+nGuanQia)/1000 | S938: 31380/60*nMin*(1000+nGuanQia)/1000 | T938: 19320/60*nMin*(1000+nGuanQia)/1000 | U938: 喽啰 | V938: pet_21;pet_201;pet_93;pet_91; | W938: 4 | X938: 5 | Y938: 1,28000,8,0;1,19016,8,0;1,10007,5,0;1,10108,2,0;1,7,9000,0;1,8,9000,0;1,4,1000,0; | Z938: 0 | AA938: {} | AB938: n/60
A939: 935 | B939: 935 | C939: 935 | D939: 弑神试炼 | E939: 10501 | F939: 5 | G939: 3 | H939: 200935 | I939: 0 | J939: 480 | K939: 5000,0; | L939: 5 | M939: 5000,1; | N939: 39240/3600*(nPatrolSec+3)*(1000+nGuanQia)/1000 | O939: 31380/3600*(nPatrolSec+3)*(1000+nGuanQia)/1000 | P939: 19320/3600*(nPatrolSec+3)*(1000+nGuanQia)/1000 | Q939: nGuanQia + 1000 | R939: 39240/60*nMin*(1000+nGuanQia)/1000 | S939: 31380/60*nMin*(1000+nGuanQia)/1000 | T939: 19320/60*nMin*(1000+nGuanQia)/1000 | U939: 喽啰 | V939: pet_21;pet_201;pet_93;pet_91; | W939: 4 | X939: 5 | Y939: 1,28000,8,0;1,19016,8,0;1,10007,5,0;1,10108,2,0;1,7,9000,0;1,8,9000,0;1,4,1000,0; | Z939: 0 | AA939: {} | AB939: n/60
A940: 936 | B940: 936 | C940: 936 | D940: 弑神试炼 | E940: 10501 | F940: 5 | G940: 3 | H940: 200936 | I940: 0 | J940: 480 | K940: 5000,0; | L940: 5 | M940: 5000,1; | N940: 39240/3600*(nPatrolSec+3)*(1000+nGuanQia)/1000 | O940: 31380/3600*(nPatrolSec+3)*(1000+nGuanQia)/1000 | P940: 19320/3600*(nPatrolSec+3)*(1000+nGuanQia)/1000 | Q940: nGuanQia + 1000 | R940: 39240/60*nMin*(1000+nGuanQia)/1000 | S940: 31380/60*nMin*(1000+nGuanQia)/1000 | T940: 19320/60*nMin*(1000+nGuanQia)/1000 | U940: 喽啰 | V940: pet_21;pet_201;pet_93;pet_91; | W940: 4 | X940: 5 | Y940: 1,28000,8,0;1,19016,8,0;1,10007,5,0;1,10108,2,0;1,7,9000,0;1,8,9000,0;1,4,1000,0; | Z940: 0 | AA940: {} | AB940: n/60
A941: 937 | B941: 937 | C941: 937 | D941: 弑神试炼 | E941: 10501 | F941: 5 | G941: 3 | H941: 200937 | I941: 0 | J941: 480 | K941: 5000,0; | L941: 5 | M941: 5000,1; | N941: 39240/3600*(nPatrolSec+3)*(1000+nGuanQia)/1000 | O941: 31380/3600*(nPatrolSec+3)*(1000+nGuanQia)/1000 | P941: 19320/3600*(nPatrolSec+3)*(1000+nGuanQia)/1000 | Q941: nGuanQia + 1000 | R941: 39240/60*nMin*(1000+nGuanQia)/1000 | S941: 31380/60*nMin*(1000+nGuanQia)/1000 | T941: 19320/60*nMin*(1000+nGuanQia)/1000 | U941: 喽啰 | V941: pet_21;pet_201;pet_93;pet_91; | W941: 4 | X941: 5 | Y941: 1,28000,8,0;1,19016,8,0;1,10007,5,0;1,10108,2,0;1,7,9000,0;1,8,9000,0;1,4,1000,0; | Z941: 0 | AA941: {} | AB941: n/60
A942: 938 | B942: 938 | C942: 938 | D942: 弑神试炼 | E942: 10501 | F942: 5 | G942: 3 | H942: 200938 | I942: 0 | J942: 480 | K942: 5000,0; | L942: 5 | M942: 5000,1; | N942: 39240/3600*(nPatrolSec+3)*(1000+nGuanQia)/1000 | O942: 31380/3600*(nPatrolSec+3)*(1000+nGuanQia)/1000 | P942: 19320/3600*(nPatrolSec+3)*(1000+nGuanQia)/1000 | Q942: nGuanQia + 1000 | R942: 39240/60*nMin*(1000+nGuanQia)/1000 | S942: 31380/60*nMin*(1000+nGuanQia)/1000 | T942: 19320/60*nMin*(1000+nGuanQia)/1000 | U942: 喽啰 | V942: pet_21;pet_201;pet_93;pet_91; | W942: 4 | X942: 5 | Y942: 1,28000,8,0;1,19016,8,0;1,10007,5,0;1,10108,2,0;1,7,9000,0;1,8,9000,0;1,4,1000,0; | Z942: 0 | AA942: {} | AB942: n/60
A943: 939 | B943: 939 | C943: 939 | D943: 弑神试炼 | E943: 10501 | F943: 5 | G943: 3 | H943: 200939 | I943: 0 | J943: 480 | K943: 5000,0; | L943: 5 | M943: 5000,1; | N943: 39240/3600*(nPatrolSec+3)*(1000+nGuanQia)/1000 | O943: 31380/3600*(nPatrolSec+3)*(1000+nGuanQia)/1000 | P943: 19320/3600*(nPatrolSec+3)*(1000+nGuanQia)/1000 | Q943: nGuanQia + 1000 | R943: 39240/60*nMin*(1000+nGuanQia)/1000 | S943: 31380/60*nMin*(1000+nGuanQia)/1000 | T943: 19320/60*nMin*(1000+nGuanQia)/1000 | U943: 喽啰 | V943: pet_21;pet_201;pet_93;pet_91; | W943: 4 | X943: 5 | Y943: 1,28000,8,0;1,19016,8,0;1,10007,5,0;1,10108,2,0;1,7,9000,0;1,8,9000,0;1,4,1000,0; | Z943: 0 | AA943: {} | AB943: n/60
A944: 940 | B944: 940 | C944: 940 | D944: 弑神试炼 | E944: 10501 | F944: 5 | G944: 3 | H944: 200940 | I944: 0 | J944: 480 | K944: 5000,0; | L944: 5 | M944: 5000,1; | N944: 39240/3600*(nPatrolSec+3)*(1000+nGuanQia)/1000 | O944: 31380/3600*(nPatrolSec+3)*(1000+nGuanQia)/1000 | P944: 19320/3600*(nPatrolSec+3)*(1000+nGuanQia)/1000 | Q944: nGuanQia + 1000 | R944: 39240/60*nMin*(1000+nGuanQia)/1000 | S944: 31380/60*nMin*(1000+nGuanQia)/1000 | T944: 19320/60*nMin*(1000+nGuanQia)/1000 | U944: 喽啰 | V944: pet_21;pet_201;pet_93;pet_91; | W944: 4 | X944: 5 | Y944: 1,28000,8,0;1,19016,8,0;1,10007,5,0;1,10108,2,0;1,7,9000,0;1,8,9000,0;1,4,1000,0; | Z944: 0 | AA944: {} | AB944: n/60
A945: 941 | B945: 941 | C945: 941 | D945: 弑神试炼 | E945: 10501 | F945: 5 | G945: 3 | H945: 200941 | I945: 0 | J945: 480 | K945: 5000,0; | L945: 5 | M945: 5000,1; | N945: 39240/3600*(nPatrolSec+3)*(1000+nGuanQia)/1000 | O945: 31380/3600*(nPatrolSec+3)*(1000+nGuanQia)/1000 | P945: 19320/3600*(nPatrolSec+3)*(1000+nGuanQia)/1000 | Q945: nGuanQia + 1000 | R945: 39240/60*nMin*(1000+nGuanQia)/1000 | S945: 31380/60*nMin*(1000+nGuanQia)/1000 | T945: 19320/60*nMin*(1000+nGuanQia)/1000 | U945: 喽啰 | V945: pet_21;pet_201;pet_93;pet_91; | W945: 4 | X945: 5 | Y945: 1,28000,8,0;1,19016,8,0;1,10007,5,0;1,10108,2,0;1,7,9000,0;1,8,9000,0;1,4,1000,0; | Z945: 0 | AA945: {} | AB945: n/60
A946: 942 | B946: 942 | C946: 942 | D946: 弑神试炼 | E946: 10501 | F946: 5 | G946: 3 | H946: 200942 | I946: 0 | J946: 480 | K946: 5000,0; | L946: 5 | M946: 5000,1; | N946: 39240/3600*(nPatrolSec+3)*(1000+nGuanQia)/1000 | O946: 31380/3600*(nPatrolSec+3)*(1000+nGuanQia)/1000 | P946: 19320/3600*(nPatrolSec+3)*(1000+nGuanQia)/1000 | Q946: nGuanQia + 1000 | R946: 39240/60*nMin*(1000+nGuanQia)/1000 | S946: 31380/60*nMin*(1000+nGuanQia)/1000 | T946: 19320/60*nMin*(1000+nGuanQia)/1000 | U946: 喽啰 | V946: pet_21;pet_201;pet_93;pet_91; | W946: 4 | X946: 5 | Y946: 1,28000,8,0;1,19016,8,0;1,10007,5,0;1,10108,2,0;1,7,9000,0;1,8,9000,0;1,4,1000,0; | Z946: 0 | AA946: {} | AB946: n/60
A947: 943 | B947: 943 | C947: 943 | D947: 弑神试炼 | E947: 10501 | F947: 5 | G947: 3 | H947: 200943 | I947: 0 | J947: 480 | K947: 5000,0; | L947: 5 | M947: 5000,1; | N947: 39240/3600*(nPatrolSec+3)*(1000+nGuanQia)/1000 | O947: 31380/3600*(nPatrolSec+3)*(1000+nGuanQia)/1000 | P947: 19320/3600*(nPatrolSec+3)*(1000+nGuanQia)/1000 | Q947: nGuanQia + 1000 | R947: 39240/60*nMin*(1000+nGuanQia)/1000 | S947: 31380/60*nMin*(1000+nGuanQia)/1000 | T947: 19320/60*nMin*(1000+nGuanQia)/1000 | U947: 喽啰 | V947: pet_21;pet_201;pet_93;pet_91; | W947: 4 | X947: 5 | Y947: 1,28000,8,0;1,19016,8,0;1,10007,5,0;1,10108,2,0;1,7,9000,0;1,8,9000,0;1,4,1000,0; | Z947: 0 | AA947: {} | AB947: n/60
A948: 944 | B948: 944 | C948: 944 | D948: 弑神试炼 | E948: 10501 | F948: 5 | G948: 3 | H948: 200944 | I948: 0 | J948: 480 | K948: 5000,0; | L948: 5 | M948: 5000,1; | N948: 39240/3600*(nPatrolSec+3)*(1000+nGuanQia)/1000 | O948: 31380/3600*(nPatrolSec+3)*(1000+nGuanQia)/1000 | P948: 19320/3600*(nPatrolSec+3)*(1000+nGuanQia)/1000 | Q948: nGuanQia + 1000 | R948: 39240/60*nMin*(1000+nGuanQia)/1000 | S948: 31380/60*nMin*(1000+nGuanQia)/1000 | T948: 19320/60*nMin*(1000+nGuanQia)/1000 | U948: 喽啰 | V948: pet_21;pet_201;pet_93;pet_91; | W948: 4 | X948: 5 | Y948: 1,28000,8,0;1,19016,8,0;1,10007,5,0;1,10108,2,0;1,7,9000,0;1,8,9000,0;1,4,1000,0; | Z948: 0 | AA948: {} | AB948: n/60
A949: 945 | B949: 945 | C949: 945 | D949: 弑神试炼 | E949: 10501 | F949: 5 | G949: 3 | H949: 200945 | I949: 0 | J949: 480 | K949: 5000,0; | L949: 5 | M949: 5000,1; | N949: 39240/3600*(nPatrolSec+3)*(1000+nGuanQia)/1000 | O949: 31380/3600*(nPatrolSec+3)*(1000+nGuanQia)/1000 | P949: 19320/3600*(nPatrolSec+3)*(1000+nGuanQia)/1000 | Q949: nGuanQia + 1000 | R949: 39240/60*nMin*(1000+nGuanQia)/1000 | S949: 31380/60*nMin*(1000+nGuanQia)/1000 | T949: 19320/60*nMin*(1000+nGuanQia)/1000 | U949: 喽啰 | V949: pet_21;pet_201;pet_93;pet_91; | W949: 4 | X949: 5 | Y949: 1,28000,8,0;1,19016,8,0;1,10007,5,0;1,10108,2,0;1,7,9000,0;1,8,9000,0;1,4,1000,0; | Z949: 0 | AA949: {} | AB949: n/60
A950: 946 | B950: 946 | C950: 946 | D950: 弑神试炼 | E950: 10501 | F950: 5 | G950: 3 | H950: 200946 | I950: 0 | J950: 480 | K950: 5000,0; | L950: 5 | M950: 5000,1; | N950: 39240/3600*(nPatrolSec+3)*(1000+nGuanQia)/1000 | O950: 31380/3600*(nPatrolSec+3)*(1000+nGuanQia)/1000 | P950: 19320/3600*(nPatrolSec+3)*(1000+nGuanQia)/1000 | Q950: nGuanQia + 1000 | R950: 39240/60*nMin*(1000+nGuanQia)/1000 | S950: 31380/60*nMin*(1000+nGuanQia)/1000 | T950: 19320/60*nMin*(1000+nGuanQia)/1000 | U950: 喽啰 | V950: pet_21;pet_201;pet_93;pet_91; | W950: 4 | X950: 5 | Y950: 1,28000,8,0;1,19016,8,0;1,10007,5,0;1,10108,2,0;1,7,9000,0;1,8,9000,0;1,4,1000,0; | Z950: 0 | AA950: {} | AB950: n/60
A951: 947 | B951: 947 | C951: 947 | D951: 弑神试炼 | E951: 10501 | F951: 5 | G951: 3 | H951: 200947 | I951: 0 | J951: 480 | K951: 5000,0; | L951: 5 | M951: 5000,1; | N951: 39240/3600*(nPatrolSec+3)*(1000+nGuanQia)/1000 | O951: 31380/3600*(nPatrolSec+3)*(1000+nGuanQia)/1000 | P951: 19320/3600*(nPatrolSec+3)*(1000+nGuanQia)/1000 | Q951: nGuanQia + 1000 | R951: 39240/60*nMin*(1000+nGuanQia)/1000 | S951: 31380/60*nMin*(1000+nGuanQia)/1000 | T951: 19320/60*nMin*(1000+nGuanQia)/1000 | U951: 喽啰 | V951: pet_21;pet_201;pet_93;pet_91; | W951: 4 | X951: 5 | Y951: 1,28000,8,0;1,19016,8,0;1,10007,5,0;1,10108,2,0;1,7,9000,0;1,8,9000,0;1,4,1000,0; | Z951: 0 | AA951: {} | AB951: n/60
A952: 948 | B952: 948 | C952: 948 | D952: 弑神试炼 | E952: 10501 | F952: 5 | G952: 3 | H952: 200948 | I952: 0 | J952: 480 | K952: 5000,0; | L952: 5 | M952: 5000,1; | N952: 39240/3600*(nPatrolSec+3)*(1000+nGuanQia)/1000 | O952: 31380/3600*(nPatrolSec+3)*(1000+nGuanQia)/1000 | P952: 19320/3600*(nPatrolSec+3)*(1000+nGuanQia)/1000 | Q952: nGuanQia + 1000 | R952: 39240/60*nMin*(1000+nGuanQia)/1000 | S952: 31380/60*nMin*(1000+nGuanQia)/1000 | T952: 19320/60*nMin*(1000+nGuanQia)/1000 | U952: 喽啰 | V952: pet_21;pet_201;pet_93;pet_91; | W952: 4 | X952: 5 | Y952: 1,28000,8,0;1,19016,8,0;1,10007,5,0;1,10108,2,0;1,7,9000,0;1,8,9000,0;1,4,1000,0; | Z952: 0 | AA952: {} | AB952: n/60
A953: 949 | B953: 949 | C953: 949 | D953: 弑神试炼 | E953: 10501 | F953: 5 | G953: 3 | H953: 200949 | I953: 0 | J953: 480 | K953: 5000,0; | L953: 5 | M953: 5000,1; | N953: 39240/3600*(nPatrolSec+3)*(1000+nGuanQia)/1000 | O953: 31380/3600*(nPatrolSec+3)*(1000+nGuanQia)/1000 | P953: 19320/3600*(nPatrolSec+3)*(1000+nGuanQia)/1000 | Q953: nGuanQia + 1000 | R953: 39240/60*nMin*(1000+nGuanQia)/1000 | S953: 31380/60*nMin*(1000+nGuanQia)/1000 | T953: 19320/60*nMin*(1000+nGuanQia)/1000 | U953: 喽啰 | V953: pet_21;pet_201;pet_93;pet_91; | W953: 4 | X953: 5 | Y953: 1,28000,8,0;1,19016,8,0;1,10007,5,0;1,10108,2,0;1,7,9000,0;1,8,9000,0;1,4,1000,0; | Z953: 0 | AA953: {} | AB953: n/60
A954: 950 | B954: 950 | C954: 950 | D954: 弑神试炼 | E954: 10501 | F954: 5 | G954: 3 | H954: 200950 | I954: 0 | J954: 480 | K954: 5000,0; | L954: 5 | M954: 5000,1; | N954: 39240/3600*(nPatrolSec+3)*(1000+nGuanQia)/1000 | O954: 31380/3600*(nPatrolSec+3)*(1000+nGuanQia)/1000 | P954: 19320/3600*(nPatrolSec+3)*(1000+nGuanQia)/1000 | Q954: nGuanQia + 1000 | R954: 39240/60*nMin*(1000+nGuanQia)/1000 | S954: 31380/60*nMin*(1000+nGuanQia)/1000 | T954: 19320/60*nMin*(1000+nGuanQia)/1000 | U954: 喽啰 | V954: pet_21;pet_201;pet_93;pet_91; | W954: 4 | X954: 5 | Y954: 1,28000,8,0;1,19016,8,0;1,10007,5,0;1,10108,2,0;1,7,9000,0;1,8,9000,0;1,4,1000,0; | Z954: 0 | AA954: {} | AB954: n/60
A955: 951 | B955: 951 | C955: 951 | D955: 弑神试炼 | E955: 10501 | F955: 5 | G955: 3 | H955: 200951 | I955: 0 | J955: 480 | K955: 5000,0; | L955: 5 | M955: 5000,1; | N955: 39240/3600*(nPatrolSec+3)*(1000+nGuanQia)/1000 | O955: 31380/3600*(nPatrolSec+3)*(1000+nGuanQia)/1000 | P955: 19320/3600*(nPatrolSec+3)*(1000+nGuanQia)/1000 | Q955: nGuanQia + 1000 | R955: 39240/60*nMin*(1000+nGuanQia)/1000 | S955: 31380/60*nMin*(1000+nGuanQia)/1000 | T955: 19320/60*nMin*(1000+nGuanQia)/1000 | U955: 喽啰 | V955: pet_21;pet_201;pet_93;pet_91; | W955: 4 | X955: 5 | Y955: 1,28000,8,0;1,19016,8,0;1,10007,5,0;1,10108,2,0;1,7,9000,0;1,8,9000,0;1,4,1000,0; | Z955: 0 | AA955: {} | AB955: n/60
A956: 952 | B956: 952 | C956: 952 | D956: 弑神试炼 | E956: 10501 | F956: 5 | G956: 3 | H956: 200952 | I956: 0 | J956: 480 | K956: 5000,0; | L956: 5 | M956: 5000,1; | N956: 39240/3600*(nPatrolSec+3)*(1000+nGuanQia)/1000 | O956: 31380/3600*(nPatrolSec+3)*(1000+nGuanQia)/1000 | P956: 19320/3600*(nPatrolSec+3)*(1000+nGuanQia)/1000 | Q956: nGuanQia + 1000 | R956: 39240/60*nMin*(1000+nGuanQia)/1000 | S956: 31380/60*nMin*(1000+nGuanQia)/1000 | T956: 19320/60*nMin*(1000+nGuanQia)/1000 | U956: 喽啰 | V956: pet_21;pet_201;pet_93;pet_91; | W956: 4 | X956: 5 | Y956: 1,28000,8,0;1,19016,8,0;1,10007,5,0;1,10108,2,0;1,7,9000,0;1,8,9000,0;1,4,1000,0; | Z956: 0 | AA956: {} | AB956: n/60
A957: 953 | B957: 953 | C957: 953 | D957: 弑神试炼 | E957: 10501 | F957: 5 | G957: 3 | H957: 200953 | I957: 0 | J957: 480 | K957: 5000,0; | L957: 5 | M957: 5000,1; | N957: 39240/3600*(nPatrolSec+3)*(1000+nGuanQia)/1000 | O957: 31380/3600*(nPatrolSec+3)*(1000+nGuanQia)/1000 | P957: 19320/3600*(nPatrolSec+3)*(1000+nGuanQia)/1000 | Q957: nGuanQia + 1000 | R957: 39240/60*nMin*(1000+nGuanQia)/1000 | S957: 31380/60*nMin*(1000+nGuanQia)/1000 | T957: 19320/60*nMin*(1000+nGuanQia)/1000 | U957: 喽啰 | V957: pet_21;pet_201;pet_93;pet_91; | W957: 4 | X957: 5 | Y957: 1,28000,8,0;1,19016,8,0;1,10007,5,0;1,10108,2,0;1,7,9000,0;1,8,9000,0;1,4,1000,0; | Z957: 0 | AA957: {} | AB957: n/60
A958: 954 | B958: 954 | C958: 954 | D958: 弑神试炼 | E958: 10501 | F958: 5 | G958: 3 | H958: 200954 | I958: 0 | J958: 480 | K958: 5000,0; | L958: 5 | M958: 5000,1; | N958: 39240/3600*(nPatrolSec+3)*(1000+nGuanQia)/1000 | O958: 31380/3600*(nPatrolSec+3)*(1000+nGuanQia)/1000 | P958: 19320/3600*(nPatrolSec+3)*(1000+nGuanQia)/1000 | Q958: nGuanQia + 1000 | R958: 39240/60*nMin*(1000+nGuanQia)/1000 | S958: 31380/60*nMin*(1000+nGuanQia)/1000 | T958: 19320/60*nMin*(1000+nGuanQia)/1000 | U958: 喽啰 | V958: pet_21;pet_201;pet_93;pet_91; | W958: 4 | X958: 5 | Y958: 1,28000,8,0;1,19016,8,0;1,10007,5,0;1,10108,2,0;1,7,9000,0;1,8,9000,0;1,4,1000,0; | Z958: 0 | AA958: {} | AB958: n/60
A959: 955 | B959: 955 | C959: 955 | D959: 弑神试炼 | E959: 10501 | F959: 5 | G959: 3 | H959: 200955 | I959: 0 | J959: 480 | K959: 5000,0; | L959: 5 | M959: 5000,1; | N959: 39240/3600*(nPatrolSec+3)*(1000+nGuanQia)/1000 | O959: 31380/3600*(nPatrolSec+3)*(1000+nGuanQia)/1000 | P959: 19320/3600*(nPatrolSec+3)*(1000+nGuanQia)/1000 | Q959: nGuanQia + 1000 | R959: 39240/60*nMin*(1000+nGuanQia)/1000 | S959: 31380/60*nMin*(1000+nGuanQia)/1000 | T959: 19320/60*nMin*(1000+nGuanQia)/1000 | U959: 喽啰 | V959: pet_21;pet_201;pet_93;pet_91; | W959: 4 | X959: 5 | Y959: 1,28000,8,0;1,19016,8,0;1,10007,5,0;1,10108,2,0;1,7,9000,0;1,8,9000,0;1,4,1000,0; | Z959: 0 | AA959: {} | AB959: n/60
A960: 956 | B960: 956 | C960: 956 | D960: 弑神试炼 | E960: 10501 | F960: 5 | G960: 3 | H960: 200956 | I960: 0 | J960: 480 | K960: 5000,0; | L960: 5 | M960: 5000,1; | N960: 39240/3600*(nPatrolSec+3)*(1000+nGuanQia)/1000 | O960: 31380/3600*(nPatrolSec+3)*(1000+nGuanQia)/1000 | P960: 19320/3600*(nPatrolSec+3)*(1000+nGuanQia)/1000 | Q960: nGuanQia + 1000 | R960: 39240/60*nMin*(1000+nGuanQia)/1000 | S960: 31380/60*nMin*(1000+nGuanQia)/1000 | T960: 19320/60*nMin*(1000+nGuanQia)/1000 | U960: 喽啰 | V960: pet_21;pet_201;pet_93;pet_91; | W960: 4 | X960: 5 | Y960: 1,28000,8,0;1,19016,8,0;1,10007,5,0;1,10108,2,0;1,7,9000,0;1,8,9000,0;1,4,1000,0; | Z960: 0 | AA960: {} | AB960: n/60
A961: 957 | B961: 957 | C961: 957 | D961: 弑神试炼 | E961: 10501 | F961: 5 | G961: 3 | H961: 200957 | I961: 0 | J961: 480 | K961: 5000,0; | L961: 5 | M961: 5000,1; | N961: 39240/3600*(nPatrolSec+3)*(1000+nGuanQia)/1000 | O961: 31380/3600*(nPatrolSec+3)*(1000+nGuanQia)/1000 | P961: 19320/3600*(nPatrolSec+3)*(1000+nGuanQia)/1000 | Q961: nGuanQia + 1000 | R961: 39240/60*nMin*(1000+nGuanQia)/1000 | S961: 31380/60*nMin*(1000+nGuanQia)/1000 | T961: 19320/60*nMin*(1000+nGuanQia)/1000 | U961: 喽啰 | V961: pet_21;pet_201;pet_93;pet_91; | W961: 4 | X961: 5 | Y961: 1,28000,8,0;1,19016,8,0;1,10007,5,0;1,10108,2,0;1,7,9000,0;1,8,9000,0;1,4,1000,0; | Z961: 0 | AA961: {} | AB961: n/60
A962: 958 | B962: 958 | C962: 958 | D962: 弑神试炼 | E962: 10501 | F962: 5 | G962: 3 | H962: 200958 | I962: 0 | J962: 480 | K962: 5000,0; | L962: 5 | M962: 5000,1; | N962: 39240/3600*(nPatrolSec+3)*(1000+nGuanQia)/1000 | O962: 31380/3600*(nPatrolSec+3)*(1000+nGuanQia)/1000 | P962: 19320/3600*(nPatrolSec+3)*(1000+nGuanQia)/1000 | Q962: nGuanQia + 1000 | R962: 39240/60*nMin*(1000+nGuanQia)/1000 | S962: 31380/60*nMin*(1000+nGuanQia)/1000 | T962: 19320/60*nMin*(1000+nGuanQia)/1000 | U962: 喽啰 | V962: pet_21;pet_201;pet_93;pet_91; | W962: 4 | X962: 5 | Y962: 1,28000,8,0;1,19016,8,0;1,10007,5,0;1,10108,2,0;1,7,9000,0;1,8,9000,0;1,4,1000,0; | Z962: 0 | AA962: {} | AB962: n/60
A963: 959 | B963: 959 | C963: 959 | D963: 弑神试炼 | E963: 10501 | F963: 5 | G963: 3 | H963: 200959 | I963: 0 | J963: 480 | K963: 5000,0; | L963: 5 | M963: 5000,1; | N963: 39240/3600*(nPatrolSec+3)*(1000+nGuanQia)/1000 | O963: 31380/3600*(nPatrolSec+3)*(1000+nGuanQia)/1000 | P963: 19320/3600*(nPatrolSec+3)*(1000+nGuanQia)/1000 | Q963: nGuanQia + 1000 | R963: 39240/60*nMin*(1000+nGuanQia)/1000 | S963: 31380/60*nMin*(1000+nGuanQia)/1000 | T963: 19320/60*nMin*(1000+nGuanQia)/1000 | U963: 喽啰 | V963: pet_21;pet_201;pet_93;pet_91; | W963: 4 | X963: 5 | Y963: 1,28000,8,0;1,19016,8,0;1,10007,5,0;1,10108,2,0;1,7,9000,0;1,8,9000,0;1,4,1000,0; | Z963: 0 | AA963: {} | AB963: n/60
A964: 960 | B964: 960 | C964: 960 | D964: 弑神试炼 | E964: 10501 | F964: 5 | G964: 3 | H964: 200960 | I964: 0 | J964: 480 | K964: 5000,0; | L964: 5 | M964: 5000,1; | N964: 39240/3600*(nPatrolSec+3)*(1000+nGuanQia)/1000 | O964: 31380/3600*(nPatrolSec+3)*(1000+nGuanQia)/1000 | P964: 19320/3600*(nPatrolSec+3)*(1000+nGuanQia)/1000 | Q964: nGuanQia + 1000 | R964: 39240/60*nMin*(1000+nGuanQia)/1000 | S964: 31380/60*nMin*(1000+nGuanQia)/1000 | T964: 19320/60*nMin*(1000+nGuanQia)/1000 | U964: 喽啰 | V964: pet_21;pet_201;pet_93;pet_91; | W964: 4 | X964: 5 | Y964: 1,28000,8,0;1,19016,8,0;1,10007,5,0;1,10108,2,0;1,7,9000,0;1,8,9000,0;1,4,1000,0; | Z964: 0 | AA964: {} | AB964: n/60
A965: 961 | B965: 961 | C965: 961 | D965: 弑神试炼 | E965: 10501 | F965: 5 | G965: 3 | H965: 200961 | I965: 0 | J965: 480 | K965: 5000,0; | L965: 5 | M965: 5000,1; | N965: 39240/3600*(nPatrolSec+3)*(1000+nGuanQia)/1000 | O965: 31380/3600*(nPatrolSec+3)*(1000+nGuanQia)/1000 | P965: 19320/3600*(nPatrolSec+3)*(1000+nGuanQia)/1000 | Q965: nGuanQia + 1000 | R965: 39240/60*nMin*(1000+nGuanQia)/1000 | S965: 31380/60*nMin*(1000+nGuanQia)/1000 | T965: 19320/60*nMin*(1000+nGuanQia)/1000 | U965: 喽啰 | V965: pet_21;pet_201;pet_93;pet_91; | W965: 4 | X965: 5 | Y965: 1,28000,8,0;1,19016,8,0;1,10007,5,0;1,10108,2,0;1,7,9000,0;1,8,9000,0;1,4,1000,0; | Z965: 0 | AA965: {} | AB965: n/60
A966: 962 | B966: 962 | C966: 962 | D966: 弑神试炼 | E966: 10501 | F966: 5 | G966: 3 | H966: 200962 | I966: 0 | J966: 480 | K966: 5000,0; | L966: 5 | M966: 5000,1; | N966: 39240/3600*(nPatrolSec+3)*(1000+nGuanQia)/1000 | O966: 31380/3600*(nPatrolSec+3)*(1000+nGuanQia)/1000 | P966: 19320/3600*(nPatrolSec+3)*(1000+nGuanQia)/1000 | Q966: nGuanQia + 1000 | R966: 39240/60*nMin*(1000+nGuanQia)/1000 | S966: 31380/60*nMin*(1000+nGuanQia)/1000 | T966: 19320/60*nMin*(1000+nGuanQia)/1000 | U966: 喽啰 | V966: pet_21;pet_201;pet_93;pet_91; | W966: 4 | X966: 5 | Y966: 1,28000,8,0;1,19016,8,0;1,10007,5,0;1,10108,2,0;1,7,9000,0;1,8,9000,0;1,4,1000,0; | Z966: 0 | AA966: {} | AB966: n/60
A967: 963 | B967: 963 | C967: 963 | D967: 弑神试炼 | E967: 10501 | F967: 5 | G967: 3 | H967: 200963 | I967: 0 | J967: 480 | K967: 5000,0; | L967: 5 | M967: 5000,1; | N967: 39240/3600*(nPatrolSec+3)*(1000+nGuanQia)/1000 | O967: 31380/3600*(nPatrolSec+3)*(1000+nGuanQia)/1000 | P967: 19320/3600*(nPatrolSec+3)*(1000+nGuanQia)/1000 | Q967: nGuanQia + 1000 | R967: 39240/60*nMin*(1000+nGuanQia)/1000 | S967: 31380/60*nMin*(1000+nGuanQia)/1000 | T967: 19320/60*nMin*(1000+nGuanQia)/1000 | U967: 喽啰 | V967: pet_21;pet_201;pet_93;pet_91; | W967: 4 | X967: 5 | Y967: 1,28000,8,0;1,19016,8,0;1,10007,5,0;1,10108,2,0;1,7,9000,0;1,8,9000,0;1,4,1000,0; | Z967: 0 | AA967: {} | AB967: n/60
A968: 964 | B968: 964 | C968: 964 | D968: 弑神试炼 | E968: 10501 | F968: 5 | G968: 3 | H968: 200964 | I968: 0 | J968: 480 | K968: 5000,0; | L968: 5 | M968: 5000,1; | N968: 39240/3600*(nPatrolSec+3)*(1000+nGuanQia)/1000 | O968: 31380/3600*(nPatrolSec+3)*(1000+nGuanQia)/1000 | P968: 19320/3600*(nPatrolSec+3)*(1000+nGuanQia)/1000 | Q968: nGuanQia + 1000 | R968: 39240/60*nMin*(1000+nGuanQia)/1000 | S968: 31380/60*nMin*(1000+nGuanQia)/1000 | T968: 19320/60*nMin*(1000+nGuanQia)/1000 | U968: 喽啰 | V968: pet_21;pet_201;pet_93;pet_91; | W968: 4 | X968: 5 | Y968: 1,28000,8,0;1,19016,8,0;1,10007,5,0;1,10108,2,0;1,7,9000,0;1,8,9000,0;1,4,1000,0; | Z968: 0 | AA968: {} | AB968: n/60
A969: 965 | B969: 965 | C969: 965 | D969: 弑神试炼 | E969: 10501 | F969: 5 | G969: 3 | H969: 200965 | I969: 0 | J969: 480 | K969: 5000,0; | L969: 5 | M969: 5000,1; | N969: 39240/3600*(nPatrolSec+3)*(1000+nGuanQia)/1000 | O969: 31380/3600*(nPatrolSec+3)*(1000+nGuanQia)/1000 | P969: 19320/3600*(nPatrolSec+3)*(1000+nGuanQia)/1000 | Q969: nGuanQia + 1000 | R969: 39240/60*nMin*(1000+nGuanQia)/1000 | S969: 31380/60*nMin*(1000+nGuanQia)/1000 | T969: 19320/60*nMin*(1000+nGuanQia)/1000 | U969: 喽啰 | V969: pet_21;pet_201;pet_93;pet_91; | W969: 4 | X969: 5 | Y969: 1,28000,8,0;1,19016,8,0;1,10007,5,0;1,10108,2,0;1,7,9000,0;1,8,9000,0;1,4,1000,0; | Z969: 0 | AA969: {} | AB969: n/60
A970: 966 | B970: 966 | C970: 966 | D970: 弑神试炼 | E970: 10501 | F970: 5 | G970: 3 | H970: 200966 | I970: 0 | J970: 480 | K970: 5000,0; | L970: 5 | M970: 5000,1; | N970: 39240/3600*(nPatrolSec+3)*(1000+nGuanQia)/1000 | O970: 31380/3600*(nPatrolSec+3)*(1000+nGuanQia)/1000 | P970: 19320/3600*(nPatrolSec+3)*(1000+nGuanQia)/1000 | Q970: nGuanQia + 1000 | R970: 39240/60*nMin*(1000+nGuanQia)/1000 | S970: 31380/60*nMin*(1000+nGuanQia)/1000 | T970: 19320/60*nMin*(1000+nGuanQia)/1000 | U970: 喽啰 | V970: pet_21;pet_201;pet_93;pet_91; | W970: 4 | X970: 5 | Y970: 1,28000,8,0;1,19016,8,0;1,10007,5,0;1,10108,2,0;1,7,9000,0;1,8,9000,0;1,4,1000,0; | Z970: 0 | AA970: {} | AB970: n/60
A971: 967 | B971: 967 | C971: 967 | D971: 弑神试炼 | E971: 10501 | F971: 5 | G971: 3 | H971: 200967 | I971: 0 | J971: 480 | K971: 5000,0; | L971: 5 | M971: 5000,1; | N971: 39240/3600*(nPatrolSec+3)*(1000+nGuanQia)/1000 | O971: 31380/3600*(nPatrolSec+3)*(1000+nGuanQia)/1000 | P971: 19320/3600*(nPatrolSec+3)*(1000+nGuanQia)/1000 | Q971: nGuanQia + 1000 | R971: 39240/60*nMin*(1000+nGuanQia)/1000 | S971: 31380/60*nMin*(1000+nGuanQia)/1000 | T971: 19320/60*nMin*(1000+nGuanQia)/1000 | U971: 喽啰 | V971: pet_21;pet_201;pet_93;pet_91; | W971: 4 | X971: 5 | Y971: 1,28000,8,0;1,19016,8,0;1,10007,5,0;1,10108,2,0;1,7,9000,0;1,8,9000,0;1,4,1000,0; | Z971: 0 | AA971: {} | AB971: n/60
A972: 968 | B972: 968 | C972: 968 | D972: 弑神试炼 | E972: 10501 | F972: 5 | G972: 3 | H972: 200968 | I972: 0 | J972: 480 | K972: 5000,0; | L972: 5 | M972: 5000,1; | N972: 39240/3600*(nPatrolSec+3)*(1000+nGuanQia)/1000 | O972: 31380/3600*(nPatrolSec+3)*(1000+nGuanQia)/1000 | P972: 19320/3600*(nPatrolSec+3)*(1000+nGuanQia)/1000 | Q972: nGuanQia + 1000 | R972: 39240/60*nMin*(1000+nGuanQia)/1000 | S972: 31380/60*nMin*(1000+nGuanQia)/1000 | T972: 19320/60*nMin*(1000+nGuanQia)/1000 | U972: 喽啰 | V972: pet_21;pet_201;pet_93;pet_91; | W972: 4 | X972: 5 | Y972: 1,28000,8,0;1,19016,8,0;1,10007,5,0;1,10108,2,0;1,7,9000,0;1,8,9000,0;1,4,1000,0; | Z972: 0 | AA972: {} | AB972: n/60
A973: 969 | B973: 969 | C973: 969 | D973: 弑神试炼 | E973: 10501 | F973: 5 | G973: 3 | H973: 200969 | I973: 0 | J973: 480 | K973: 5000,0; | L973: 5 | M973: 5000,1; | N973: 39240/3600*(nPatrolSec+3)*(1000+nGuanQia)/1000 | O973: 31380/3600*(nPatrolSec+3)*(1000+nGuanQia)/1000 | P973: 19320/3600*(nPatrolSec+3)*(1000+nGuanQia)/1000 | Q973: nGuanQia + 1000 | R973: 39240/60*nMin*(1000+nGuanQia)/1000 | S973: 31380/60*nMin*(1000+nGuanQia)/1000 | T973: 19320/60*nMin*(1000+nGuanQia)/1000 | U973: 喽啰 | V973: pet_21;pet_201;pet_93;pet_91; | W973: 4 | X973: 5 | Y973: 1,28000,8,0;1,19016,8,0;1,10007,5,0;1,10108,2,0;1,7,9000,0;1,8,9000,0;1,4,1000,0; | Z973: 0 | AA973: {} | AB973: n/60
A974: 970 | B974: 970 | C974: 970 | D974: 弑神试炼 | E974: 10501 | F974: 5 | G974: 3 | H974: 200970 | I974: 0 | J974: 480 | K974: 5000,0; | L974: 5 | M974: 5000,1; | N974: 39240/3600*(nPatrolSec+3)*(1000+nGuanQia)/1000 | O974: 31380/3600*(nPatrolSec+3)*(1000+nGuanQia)/1000 | P974: 19320/3600*(nPatrolSec+3)*(1000+nGuanQia)/1000 | Q974: nGuanQia + 1000 | R974: 39240/60*nMin*(1000+nGuanQia)/1000 | S974: 31380/60*nMin*(1000+nGuanQia)/1000 | T974: 19320/60*nMin*(1000+nGuanQia)/1000 | U974: 喽啰 | V974: pet_21;pet_201;pet_93;pet_91; | W974: 4 | X974: 5 | Y974: 1,28000,8,0;1,19016,8,0;1,10007,5,0;1,10108,2,0;1,7,9000,0;1,8,9000,0;1,4,1000,0; | Z974: 0 | AA974: {} | AB974: n/60
A975: 971 | B975: 971 | C975: 971 | D975: 弑神试炼 | E975: 10501 | F975: 5 | G975: 3 | H975: 200971 | I975: 0 | J975: 480 | K975: 5000,0; | L975: 5 | M975: 5000,1; | N975: 39240/3600*(nPatrolSec+3)*(1000+nGuanQia)/1000 | O975: 31380/3600*(nPatrolSec+3)*(1000+nGuanQia)/1000 | P975: 19320/3600*(nPatrolSec+3)*(1000+nGuanQia)/1000 | Q975: nGuanQia + 1000 | R975: 39240/60*nMin*(1000+nGuanQia)/1000 | S975: 31380/60*nMin*(1000+nGuanQia)/1000 | T975: 19320/60*nMin*(1000+nGuanQia)/1000 | U975: 喽啰 | V975: pet_21;pet_201;pet_93;pet_91; | W975: 4 | X975: 5 | Y975: 1,28000,8,0;1,19016,8,0;1,10007,5,0;1,10108,2,0;1,7,9000,0;1,8,9000,0;1,4,1000,0; | Z975: 0 | AA975: {} | AB975: n/60
A976: 972 | B976: 972 | C976: 972 | D976: 弑神试炼 | E976: 10501 | F976: 5 | G976: 3 | H976: 200972 | I976: 0 | J976: 480 | K976: 5000,0; | L976: 5 | M976: 5000,1; | N976: 39240/3600*(nPatrolSec+3)*(1000+nGuanQia)/1000 | O976: 31380/3600*(nPatrolSec+3)*(1000+nGuanQia)/1000 | P976: 19320/3600*(nPatrolSec+3)*(1000+nGuanQia)/1000 | Q976: nGuanQia + 1000 | R976: 39240/60*nMin*(1000+nGuanQia)/1000 | S976: 31380/60*nMin*(1000+nGuanQia)/1000 | T976: 19320/60*nMin*(1000+nGuanQia)/1000 | U976: 喽啰 | V976: pet_21;pet_201;pet_93;pet_91; | W976: 4 | X976: 5 | Y976: 1,28000,8,0;1,19016,8,0;1,10007,5,0;1,10108,2,0;1,7,9000,0;1,8,9000,0;1,4,1000,0; | Z976: 0 | AA976: {} | AB976: n/60
A977: 973 | B977: 973 | C977: 973 | D977: 弑神试炼 | E977: 10501 | F977: 5 | G977: 3 | H977: 200973 | I977: 0 | J977: 480 | K977: 5000,0; | L977: 5 | M977: 5000,1; | N977: 39240/3600*(nPatrolSec+3)*(1000+nGuanQia)/1000 | O977: 31380/3600*(nPatrolSec+3)*(1000+nGuanQia)/1000 | P977: 19320/3600*(nPatrolSec+3)*(1000+nGuanQia)/1000 | Q977: nGuanQia + 1000 | R977: 39240/60*nMin*(1000+nGuanQia)/1000 | S977: 31380/60*nMin*(1000+nGuanQia)/1000 | T977: 19320/60*nMin*(1000+nGuanQia)/1000 | U977: 喽啰 | V977: pet_21;pet_201;pet_93;pet_91; | W977: 4 | X977: 5 | Y977: 1,28000,8,0;1,19016,8,0;1,10007,5,0;1,10108,2,0;1,7,9000,0;1,8,9000,0;1,4,1000,0; | Z977: 0 | AA977: {} | AB977: n/60
A978: 974 | B978: 974 | C978: 974 | D978: 弑神试炼 | E978: 10501 | F978: 5 | G978: 3 | H978: 200974 | I978: 0 | J978: 480 | K978: 5000,0; | L978: 5 | M978: 5000,1; | N978: 39240/3600*(nPatrolSec+3)*(1000+nGuanQia)/1000 | O978: 31380/3600*(nPatrolSec+3)*(1000+nGuanQia)/1000 | P978: 19320/3600*(nPatrolSec+3)*(1000+nGuanQia)/1000 | Q978: nGuanQia + 1000 | R978: 39240/60*nMin*(1000+nGuanQia)/1000 | S978: 31380/60*nMin*(1000+nGuanQia)/1000 | T978: 19320/60*nMin*(1000+nGuanQia)/1000 | U978: 喽啰 | V978: pet_21;pet_201;pet_93;pet_91; | W978: 4 | X978: 5 | Y978: 1,28000,8,0;1,19016,8,0;1,10007,5,0;1,10108,2,0;1,7,9000,0;1,8,9000,0;1,4,1000,0; | Z978: 0 | AA978: {} | AB978: n/60
A979: 975 | B979: 975 | C979: 975 | D979: 弑神试炼 | E979: 10501 | F979: 5 | G979: 3 | H979: 200975 | I979: 0 | J979: 480 | K979: 5000,0; | L979: 5 | M979: 5000,1; | N979: 39240/3600*(nPatrolSec+3)*(1000+nGuanQia)/1000 | O979: 31380/3600*(nPatrolSec+3)*(1000+nGuanQia)/1000 | P979: 19320/3600*(nPatrolSec+3)*(1000+nGuanQia)/1000 | Q979: nGuanQia + 1000 | R979: 39240/60*nMin*(1000+nGuanQia)/1000 | S979: 31380/60*nMin*(1000+nGuanQia)/1000 | T979: 19320/60*nMin*(1000+nGuanQia)/1000 | U979: 喽啰 | V979: pet_21;pet_201;pet_93;pet_91; | W979: 4 | X979: 5 | Y979: 1,28000,8,0;1,19016,8,0;1,10007,5,0;1,10108,2,0;1,7,9000,0;1,8,9000,0;1,4,1000,0; | Z979: 0 | AA979: {} | AB979: n/60
A980: 976 | B980: 976 | C980: 976 | D980: 弑神试炼 | E980: 10501 | F980: 5 | G980: 3 | H980: 200976 | I980: 0 | J980: 480 | K980: 5000,0; | L980: 5 | M980: 5000,1; | N980: 39240/3600*(nPatrolSec+3)*(1000+nGuanQia)/1000 | O980: 31380/3600*(nPatrolSec+3)*(1000+nGuanQia)/1000 | P980: 19320/3600*(nPatrolSec+3)*(1000+nGuanQia)/1000 | Q980: nGuanQia + 1000 | R980: 39240/60*nMin*(1000+nGuanQia)/1000 | S980: 31380/60*nMin*(1000+nGuanQia)/1000 | T980: 19320/60*nMin*(1000+nGuanQia)/1000 | U980: 喽啰 | V980: pet_21;pet_201;pet_93;pet_91; | W980: 4 | X980: 5 | Y980: 1,28000,8,0;1,19016,8,0;1,10007,5,0;1,10108,2,0;1,7,9000,0;1,8,9000,0;1,4,1000,0; | Z980: 0 | AA980: {} | AB980: n/60
A981: 977 | B981: 977 | C981: 977 | D981: 弑神试炼 | E981: 10501 | F981: 5 | G981: 3 | H981: 200977 | I981: 0 | J981: 480 | K981: 5000,0; | L981: 5 | M981: 5000,1; | N981: 39240/3600*(nPatrolSec+3)*(1000+nGuanQia)/1000 | O981: 31380/3600*(nPatrolSec+3)*(1000+nGuanQia)/1000 | P981: 19320/3600*(nPatrolSec+3)*(1000+nGuanQia)/1000 | Q981: nGuanQia + 1000 | R981: 39240/60*nMin*(1000+nGuanQia)/1000 | S981: 31380/60*nMin*(1000+nGuanQia)/1000 | T981: 19320/60*nMin*(1000+nGuanQia)/1000 | U981: 喽啰 | V981: pet_21;pet_201;pet_93;pet_91; | W981: 4 | X981: 5 | Y981: 1,28000,8,0;1,19016,8,0;1,10007,5,0;1,10108,2,0;1,7,9000,0;1,8,9000,0;1,4,1000,0; | Z981: 0 | AA981: {} | AB981: n/60
A982: 978 | B982: 978 | C982: 978 | D982: 弑神试炼 | E982: 10501 | F982: 5 | G982: 3 | H982: 200978 | I982: 0 | J982: 480 | K982: 5000,0; | L982: 5 | M982: 5000,1; | N982: 39240/3600*(nPatrolSec+3)*(1000+nGuanQia)/1000 | O982: 31380/3600*(nPatrolSec+3)*(1000+nGuanQia)/1000 | P982: 19320/3600*(nPatrolSec+3)*(1000+nGuanQia)/1000 | Q982: nGuanQia + 1000 | R982: 39240/60*nMin*(1000+nGuanQia)/1000 | S982: 31380/60*nMin*(1000+nGuanQia)/1000 | T982: 19320/60*nMin*(1000+nGuanQia)/1000 | U982: 喽啰 | V982: pet_21;pet_201;pet_93;pet_91; | W982: 4 | X982: 5 | Y982: 1,28000,8,0;1,19016,8,0;1,10007,5,0;1,10108,2,0;1,7,9000,0;1,8,9000,0;1,4,1000,0; | Z982: 0 | AA982: {} | AB982: n/60
A983: 979 | B983: 979 | C983: 979 | D983: 弑神试炼 | E983: 10501 | F983: 5 | G983: 3 | H983: 200979 | I983: 0 | J983: 480 | K983: 5000,0; | L983: 5 | M983: 5000,1; | N983: 39240/3600*(nPatrolSec+3)*(1000+nGuanQia)/1000 | O983: 31380/3600*(nPatrolSec+3)*(1000+nGuanQia)/1000 | P983: 19320/3600*(nPatrolSec+3)*(1000+nGuanQia)/1000 | Q983: nGuanQia + 1000 | R983: 39240/60*nMin*(1000+nGuanQia)/1000 | S983: 31380/60*nMin*(1000+nGuanQia)/1000 | T983: 19320/60*nMin*(1000+nGuanQia)/1000 | U983: 喽啰 | V983: pet_21;pet_201;pet_93;pet_91; | W983: 4 | X983: 5 | Y983: 1,28000,8,0;1,19016,8,0;1,10007,5,0;1,10108,2,0;1,7,9000,0;1,8,9000,0;1,4,1000,0; | Z983: 0 | AA983: {} | AB983: n/60
A984: 980 | B984: 980 | C984: 980 | D984: 弑神试炼 | E984: 10501 | F984: 5 | G984: 3 | H984: 200980 | I984: 0 | J984: 480 | K984: 5000,0; | L984: 5 | M984: 5000,1; | N984: 39240/3600*(nPatrolSec+3)*(1000+nGuanQia)/1000 | O984: 31380/3600*(nPatrolSec+3)*(1000+nGuanQia)/1000 | P984: 19320/3600*(nPatrolSec+3)*(1000+nGuanQia)/1000 | Q984: nGuanQia + 1000 | R984: 39240/60*nMin*(1000+nGuanQia)/1000 | S984: 31380/60*nMin*(1000+nGuanQia)/1000 | T984: 19320/60*nMin*(1000+nGuanQia)/1000 | U984: 喽啰 | V984: pet_21;pet_201;pet_93;pet_91; | W984: 4 | X984: 5 | Y984: 1,28000,8,0;1,19016,8,0;1,10007,5,0;1,10108,2,0;1,7,9000,0;1,8,9000,0;1,4,1000,0; | Z984: 0 | AA984: {} | AB984: n/60
A985: 981 | B985: 981 | C985: 981 | D985: 弑神试炼 | E985: 10501 | F985: 5 | G985: 3 | H985: 200981 | I985: 0 | J985: 480 | K985: 5000,0; | L985: 5 | M985: 5000,1; | N985: 39240/3600*(nPatrolSec+3)*(1000+nGuanQia)/1000 | O985: 31380/3600*(nPatrolSec+3)*(1000+nGuanQia)/1000 | P985: 19320/3600*(nPatrolSec+3)*(1000+nGuanQia)/1000 | Q985: nGuanQia + 1000 | R985: 39240/60*nMin*(1000+nGuanQia)/1000 | S985: 31380/60*nMin*(1000+nGuanQia)/1000 | T985: 19320/60*nMin*(1000+nGuanQia)/1000 | U985: 喽啰 | V985: pet_21;pet_201;pet_93;pet_91; | W985: 4 | X985: 5 | Y985: 1,28000,8,0;1,19016,8,0;1,10007,5,0;1,10108,2,0;1,7,9000,0;1,8,9000,0;1,4,1000,0; | Z985: 0 | AA985: {} | AB985: n/60
A986: 982 | B986: 982 | C986: 982 | D986: 弑神试炼 | E986: 10501 | F986: 5 | G986: 3 | H986: 200982 | I986: 0 | J986: 480 | K986: 5000,0; | L986: 5 | M986: 5000,1; | N986: 39240/3600*(nPatrolSec+3)*(1000+nGuanQia)/1000 | O986: 31380/3600*(nPatrolSec+3)*(1000+nGuanQia)/1000 | P986: 19320/3600*(nPatrolSec+3)*(1000+nGuanQia)/1000 | Q986: nGuanQia + 1000 | R986: 39240/60*nMin*(1000+nGuanQia)/1000 | S986: 31380/60*nMin*(1000+nGuanQia)/1000 | T986: 19320/60*nMin*(1000+nGuanQia)/1000 | U986: 喽啰 | V986: pet_21;pet_201;pet_93;pet_91; | W986: 4 | X986: 5 | Y986: 1,28000,8,0;1,19016,8,0;1,10007,5,0;1,10108,2,0;1,7,9000,0;1,8,9000,0;1,4,1000,0; | Z986: 0 | AA986: {} | AB986: n/60
A987: 983 | B987: 983 | C987: 983 | D987: 弑神试炼 | E987: 10501 | F987: 5 | G987: 3 | H987: 200983 | I987: 0 | J987: 480 | K987: 5000,0; | L987: 5 | M987: 5000,1; | N987: 39240/3600*(nPatrolSec+3)*(1000+nGuanQia)/1000 | O987: 31380/3600*(nPatrolSec+3)*(1000+nGuanQia)/1000 | P987: 19320/3600*(nPatrolSec+3)*(1000+nGuanQia)/1000 | Q987: nGuanQia + 1000 | R987: 39240/60*nMin*(1000+nGuanQia)/1000 | S987: 31380/60*nMin*(1000+nGuanQia)/1000 | T987: 19320/60*nMin*(1000+nGuanQia)/1000 | U987: 喽啰 | V987: pet_21;pet_201;pet_93;pet_91; | W987: 4 | X987: 5 | Y987: 1,28000,8,0;1,19016,8,0;1,10007,5,0;1,10108,2,0;1,7,9000,0;1,8,9000,0;1,4,1000,0; | Z987: 0 | AA987: {} | AB987: n/60
A988: 984 | B988: 984 | C988: 984 | D988: 弑神试炼 | E988: 10501 | F988: 5 | G988: 3 | H988: 200984 | I988: 0 | J988: 480 | K988: 5000,0; | L988: 5 | M988: 5000,1; | N988: 39240/3600*(nPatrolSec+3)*(1000+nGuanQia)/1000 | O988: 31380/3600*(nPatrolSec+3)*(1000+nGuanQia)/1000 | P988: 19320/3600*(nPatrolSec+3)*(1000+nGuanQia)/1000 | Q988: nGuanQia + 1000 | R988: 39240/60*nMin*(1000+nGuanQia)/1000 | S988: 31380/60*nMin*(1000+nGuanQia)/1000 | T988: 19320/60*nMin*(1000+nGuanQia)/1000 | U988: 喽啰 | V988: pet_21;pet_201;pet_93;pet_91; | W988: 4 | X988: 5 | Y988: 1,28000,8,0;1,19016,8,0;1,10007,5,0;1,10108,2,0;1,7,9000,0;1,8,9000,0;1,4,1000,0; | Z988: 0 | AA988: {} | AB988: n/60
A989: 985 | B989: 985 | C989: 985 | D989: 弑神试炼 | E989: 10501 | F989: 5 | G989: 3 | H989: 200985 | I989: 0 | J989: 480 | K989: 5000,0; | L989: 5 | M989: 5000,1; | N989: 39240/3600*(nPatrolSec+3)*(1000+nGuanQia)/1000 | O989: 31380/3600*(nPatrolSec+3)*(1000+nGuanQia)/1000 | P989: 19320/3600*(nPatrolSec+3)*(1000+nGuanQia)/1000 | Q989: nGuanQia + 1000 | R989: 39240/60*nMin*(1000+nGuanQia)/1000 | S989: 31380/60*nMin*(1000+nGuanQia)/1000 | T989: 19320/60*nMin*(1000+nGuanQia)/1000 | U989: 喽啰 | V989: pet_21;pet_201;pet_93;pet_91; | W989: 4 | X989: 5 | Y989: 1,28000,8,0;1,19016,8,0;1,10007,5,0;1,10108,2,0;1,7,9000,0;1,8,9000,0;1,4,1000,0; | Z989: 0 | AA989: {} | AB989: n/60
A990: 986 | B990: 986 | C990: 986 | D990: 弑神试炼 | E990: 10501 | F990: 5 | G990: 3 | H990: 200986 | I990: 0 | J990: 480 | K990: 5000,0; | L990: 5 | M990: 5000,1; | N990: 39240/3600*(nPatrolSec+3)*(1000+nGuanQia)/1000 | O990: 31380/3600*(nPatrolSec+3)*(1000+nGuanQia)/1000 | P990: 19320/3600*(nPatrolSec+3)*(1000+nGuanQia)/1000 | Q990: nGuanQia + 1000 | R990: 39240/60*nMin*(1000+nGuanQia)/1000 | S990: 31380/60*nMin*(1000+nGuanQia)/1000 | T990: 19320/60*nMin*(1000+nGuanQia)/1000 | U990: 喽啰 | V990: pet_21;pet_201;pet_93;pet_91; | W990: 4 | X990: 5 | Y990: 1,28000,8,0;1,19016,8,0;1,10007,5,0;1,10108,2,0;1,7,9000,0;1,8,9000,0;1,4,1000,0; | Z990: 0 | AA990: {} | AB990: n/60
A991: 987 | B991: 987 | C991: 987 | D991: 弑神试炼 | E991: 10501 | F991: 5 | G991: 3 | H991: 200987 | I991: 0 | J991: 480 | K991: 5000,0; | L991: 5 | M991: 5000,1; | N991: 39240/3600*(nPatrolSec+3)*(1000+nGuanQia)/1000 | O991: 31380/3600*(nPatrolSec+3)*(1000+nGuanQia)/1000 | P991: 19320/3600*(nPatrolSec+3)*(1000+nGuanQia)/1000 | Q991: nGuanQia + 1000 | R991: 39240/60*nMin*(1000+nGuanQia)/1000 | S991: 31380/60*nMin*(1000+nGuanQia)/1000 | T991: 19320/60*nMin*(1000+nGuanQia)/1000 | U991: 喽啰 | V991: pet_21;pet_201;pet_93;pet_91; | W991: 4 | X991: 5 | Y991: 1,28000,8,0;1,19016,8,0;1,10007,5,0;1,10108,2,0;1,7,9000,0;1,8,9000,0;1,4,1000,0; | Z991: 0 | AA991: {} | AB991: n/60
A992: 988 | B992: 988 | C992: 988 | D992: 弑神试炼 | E992: 10501 | F992: 5 | G992: 3 | H992: 200988 | I992: 0 | J992: 480 | K992: 5000,0; | L992: 5 | M992: 5000,1; | N992: 39240/3600*(nPatrolSec+3)*(1000+nGuanQia)/1000 | O992: 31380/3600*(nPatrolSec+3)*(1000+nGuanQia)/1000 | P992: 19320/3600*(nPatrolSec+3)*(1000+nGuanQia)/1000 | Q992: nGuanQia + 1000 | R992: 39240/60*nMin*(1000+nGuanQia)/1000 | S992: 31380/60*nMin*(1000+nGuanQia)/1000 | T992: 19320/60*nMin*(1000+nGuanQia)/1000 | U992: 喽啰 | V992: pet_21;pet_201;pet_93;pet_91; | W992: 4 | X992: 5 | Y992: 1,28000,8,0;1,19016,8,0;1,10007,5,0;1,10108,2,0;1,7,9000,0;1,8,9000,0;1,4,1000,0; | Z992: 0 | AA992: {} | AB992: n/60
A993: 989 | B993: 989 | C993: 989 | D993: 弑神试炼 | E993: 10501 | F993: 5 | G993: 3 | H993: 200989 | I993: 0 | J993: 480 | K993: 5000,0; | L993: 5 | M993: 5000,1; | N993: 39240/3600*(nPatrolSec+3)*(1000+nGuanQia)/1000 | O993: 31380/3600*(nPatrolSec+3)*(1000+nGuanQia)/1000 | P993: 19320/3600*(nPatrolSec+3)*(1000+nGuanQia)/1000 | Q993: nGuanQia + 1000 | R993: 39240/60*nMin*(1000+nGuanQia)/1000 | S993: 31380/60*nMin*(1000+nGuanQia)/1000 | T993: 19320/60*nMin*(1000+nGuanQia)/1000 | U993: 喽啰 | V993: pet_21;pet_201;pet_93;pet_91; | W993: 4 | X993: 5 | Y993: 1,28000,8,0;1,19016,8,0;1,10007,5,0;1,10108,2,0;1,7,9000,0;1,8,9000,0;1,4,1000,0; | Z993: 0 | AA993: {} | AB993: n/60
A994: 990 | B994: 990 | C994: 990 | D994: 弑神试炼 | E994: 10501 | F994: 5 | G994: 3 | H994: 200990 | I994: 0 | J994: 480 | K994: 5000,0; | L994: 5 | M994: 5000,1; | N994: 39240/3600*(nPatrolSec+3)*(1000+nGuanQia)/1000 | O994: 31380/3600*(nPatrolSec+3)*(1000+nGuanQia)/1000 | P994: 19320/3600*(nPatrolSec+3)*(1000+nGuanQia)/1000 | Q994: nGuanQia + 1000 | R994: 39240/60*nMin*(1000+nGuanQia)/1000 | S994: 31380/60*nMin*(1000+nGuanQia)/1000 | T994: 19320/60*nMin*(1000+nGuanQia)/1000 | U994: 喽啰 | V994: pet_21;pet_201;pet_93;pet_91; | W994: 4 | X994: 5 | Y994: 1,28000,8,0;1,19016,8,0;1,10007,5,0;1,10108,2,0;1,7,9000,0;1,8,9000,0;1,4,1000,0; | Z994: 0 | AA994: {} | AB994: n/60
A995: 991 | B995: 991 | C995: 991 | D995: 弑神试炼 | E995: 10501 | F995: 5 | G995: 3 | H995: 200991 | I995: 0 | J995: 480 | K995: 5000,0; | L995: 5 | M995: 5000,1; | N995: 39240/3600*(nPatrolSec+3)*(1000+nGuanQia)/1000 | O995: 31380/3600*(nPatrolSec+3)*(1000+nGuanQia)/1000 | P995: 19320/3600*(nPatrolSec+3)*(1000+nGuanQia)/1000 | Q995: nGuanQia + 1000 | R995: 39240/60*nMin*(1000+nGuanQia)/1000 | S995: 31380/60*nMin*(1000+nGuanQia)/1000 | T995: 19320/60*nMin*(1000+nGuanQia)/1000 | U995: 喽啰 | V995: pet_21;pet_201;pet_93;pet_91; | W995: 4 | X995: 5 | Y995: 1,28000,8,0;1,19016,8,0;1,10007,5,0;1,10108,2,0;1,7,9000,0;1,8,9000,0;1,4,1000,0; | Z995: 0 | AA995: {} | AB995: n/60
A996: 992 | B996: 992 | C996: 992 | D996: 弑神试炼 | E996: 10501 | F996: 5 | G996: 3 | H996: 200992 | I996: 0 | J996: 480 | K996: 5000,0; | L996: 5 | M996: 5000,1; | N996: 39240/3600*(nPatrolSec+3)*(1000+nGuanQia)/1000 | O996: 31380/3600*(nPatrolSec+3)*(1000+nGuanQia)/1000 | P996: 19320/3600*(nPatrolSec+3)*(1000+nGuanQia)/1000 | Q996: nGuanQia + 1000 | R996: 39240/60*nMin*(1000+nGuanQia)/1000 | S996: 31380/60*nMin*(1000+nGuanQia)/1000 | T996: 19320/60*nMin*(1000+nGuanQia)/1000 | U996: 喽啰 | V996: pet_21;pet_201;pet_93;pet_91; | W996: 4 | X996: 5 | Y996: 1,28000,8,0;1,19016,8,0;1,10007,5,0;1,10108,2,0;1,7,9000,0;1,8,9000,0;1,4,1000,0; | Z996: 0 | AA996: {} | AB996: n/60
A997: 993 | B997: 993 | C997: 993 | D997: 弑神试炼 | E997: 10501 | F997: 5 | G997: 3 | H997: 200993 | I997: 0 | J997: 480 | K997: 5000,0; | L997: 5 | M997: 5000,1; | N997: 39240/3600*(nPatrolSec+3)*(1000+nGuanQia)/1000 | O997: 31380/3600*(nPatrolSec+3)*(1000+nGuanQia)/1000 | P997: 19320/3600*(nPatrolSec+3)*(1000+nGuanQia)/1000 | Q997: nGuanQia + 1000 | R997: 39240/60*nMin*(1000+nGuanQia)/1000 | S997: 31380/60*nMin*(1000+nGuanQia)/1000 | T997: 19320/60*nMin*(1000+nGuanQia)/1000 | U997: 喽啰 | V997: pet_21;pet_201;pet_93;pet_91; | W997: 4 | X997: 5 | Y997: 1,28000,8,0;1,19016,8,0;1,10007,5,0;1,10108,2,0;1,7,9000,0;1,8,9000,0;1,4,1000,0; | Z997: 0 | AA997: {} | AB997: n/60
A998: 994 | B998: 994 | C998: 994 | D998: 弑神试炼 | E998: 10501 | F998: 5 | G998: 3 | H998: 200994 | I998: 0 | J998: 480 | K998: 5000,0; | L998: 5 | M998: 5000,1; | N998: 39240/3600*(nPatrolSec+3)*(1000+nGuanQia)/1000 | O998: 31380/3600*(nPatrolSec+3)*(1000+nGuanQia)/1000 | P998: 19320/3600*(nPatrolSec+3)*(1000+nGuanQia)/1000 | Q998: nGuanQia + 1000 | R998: 39240/60*nMin*(1000+nGuanQia)/1000 | S998: 31380/60*nMin*(1000+nGuanQia)/1000 | T998: 19320/60*nMin*(1000+nGuanQia)/1000 | U998: 喽啰 | V998: pet_21;pet_201;pet_93;pet_91; | W998: 4 | X998: 5 | Y998: 1,28000,8,0;1,19016,8,0;1,10007,5,0;1,10108,2,0;1,7,9000,0;1,8,9000,0;1,4,1000,0; | Z998: 0 | AA998: {} | AB998: n/60
A999: 995 | B999: 995 | C999: 995 | D999: 弑神试炼 | E999: 10501 | F999: 5 | G999: 3 | H999: 200995 | I999: 0 | J999: 480 | K999: 5000,0; | L999: 5 | M999: 5000,1; | N999: 39240/3600*(nPatrolSec+3)*(1000+nGuanQia)/1000 | O999: 31380/3600*(nPatrolSec+3)*(1000+nGuanQia)/1000 | P999: 19320/3600*(nPatrolSec+3)*(1000+nGuanQia)/1000 | Q999: nGuanQia + 1000 | R999: 39240/60*nMin*(1000+nGuanQia)/1000 | S999: 31380/60*nMin*(1000+nGuanQia)/1000 | T999: 19320/60*nMin*(1000+nGuanQia)/1000 | U999: 喽啰 | V999: pet_21;pet_201;pet_93;pet_91; | W999: 4 | X999: 5 | Y999: 1,28000,8,0;1,19016,8,0;1,10007,5,0;1,10108,2,0;1,7,9000,0;1,8,9000,0;1,4,1000,0; | Z999: 0 | AA999: {} | AB999: n/60
A1000: 996 | B1000: 996 | C1000: 996 | D1000: 弑神试炼 | E1000: 10501 | F1000: 5 | G1000: 3 | H1000: 200996 | I1000: 0 | J1000: 480 | K1000: 5000,0; | L1000: 5 | M1000: 5000,1; | N1000: 39240/3600*(nPatrolSec+3)*(1000+nGuanQia)/1000 | O1000: 31380/3600*(nPatrolSec+3)*(1000+nGuanQia)/1000 | P1000: 19320/3600*(nPatrolSec+3)*(1000+nGuanQia)/1000 | Q1000: nGuanQia + 1000 | R1000: 39240/60*nMin*(1000+nGuanQia)/1000 | S1000: 31380/60*nMin*(1000+nGuanQia)/1000 | T1000: 19320/60*nMin*(1000+nGuanQia)/1000 | U1000: 喽啰 | V1000: pet_21;pet_201;pet_93;pet_91; | W1000: 4 | X1000: 5 | Y1000: 1,28000,8,0;1,19016,8,0;1,10007,5,0;1,10108,2,0;1,7,9000,0;1,8,9000,0;1,4,1000,0; | Z1000: 0 | AA1000: {} | AB1000: n/60
A1001: 997 | B1001: 997 | C1001: 997 | D1001: 弑神试炼 | E1001: 10501 | F1001: 5 | G1001: 3 | H1001: 200997 | I1001: 0 | J1001: 480 | K1001: 5000,0; | L1001: 5 | M1001: 5000,1; | N1001: 39240/3600*(nPatrolSec+3)*(1000+nGuanQia)/1000 | O1001: 31380/3600*(nPatrolSec+3)*(1000+nGuanQia)/1000 | P1001: 19320/3600*(nPatrolSec+3)*(1000+nGuanQia)/1000 | Q1001: nGuanQia + 1000 | R1001: 39240/60*nMin*(1000+nGuanQia)/1000 | S1001: 31380/60*nMin*(1000+nGuanQia)/1000 | T1001: 19320/60*nMin*(1000+nGuanQia)/1000 | U1001: 喽啰 | V1001: pet_21;pet_201;pet_93;pet_91; | W1001: 4 | X1001: 5 | Y1001: 1,28000,8,0;1,19016,8,0;1,10007,5,0;1,10108,2,0;1,7,9000,0;1,8,9000,0;1,4,1000,0; | Z1001: 0 | AA1001: {} | AB1001: n/60
A1002: 998 | B1002: 998 | C1002: 998 | D1002: 弑神试炼 | E1002: 10501 | F1002: 5 | G1002: 3 | H1002: 200998 | I1002: 0 | J1002: 480 | K1002: 5000,0; | L1002: 5 | M1002: 5000,1; | N1002: 39240/3600*(nPatrolSec+3)*(1000+nGuanQia)/1000 | O1002: 31380/3600*(nPatrolSec+3)*(1000+nGuanQia)/1000 | P1002: 19320/3600*(nPatrolSec+3)*(1000+nGuanQia)/1000 | Q1002: nGuanQia + 1000 | R1002: 39240/60*nMin*(1000+nGuanQia)/1000 | S1002: 31380/60*nMin*(1000+nGuanQia)/1000 | T1002: 19320/60*nMin*(1000+nGuanQia)/1000 | U1002: 喽啰 | V1002: pet_21;pet_201;pet_93;pet_91; | W1002: 4 | X1002: 5 | Y1002: 1,28000,8,0;1,19016,8,0;1,10007,5,0;1,10108,2,0;1,7,9000,0;1,8,9000,0;1,4,1000,0; | Z1002: 0 | AA1002: {} | AB1002: n/60
A1003: 999 | B1003: 999 | C1003: 999 | D1003: 弑神试炼 | E1003: 10501 | F1003: 5 | G1003: 3 | H1003: 200999 | I1003: 0 | J1003: 480 | K1003: 5000,0; | L1003: 5 | M1003: 5000,1; | N1003: 39240/3600*(nPatrolSec+3)*(1000+nGuanQia)/1000 | O1003: 31380/3600*(nPatrolSec+3)*(1000+nGuanQia)/1000 | P1003: 19320/3600*(nPatrolSec+3)*(1000+nGuanQia)/1000 | Q1003: nGuanQia + 1000 | R1003: 39240/60*nMin*(1000+nGuanQia)/1000 | S1003: 31380/60*nMin*(1000+nGuanQia)/1000 | T1003: 19320/60*nMin*(1000+nGuanQia)/1000 | U1003: 喽啰 | V1003: pet_21;pet_201;pet_93;pet_91; | W1003: 4 | X1003: 5 | Y1003: 1,28000,8,0;1,19016,8,0;1,10007,5,0;1,10108,2,0;1,7,9000,0;1,8,9000,0;1,4,1000,0; | Z1003: 0 | AA1003: {} | AB1003: n/60
A1004: 1000 | B1004: 1000 | C1004: 9999 | D1004: 弑神试炼 | E1004: 10501 | F1004: 5 | G1004: 3 | H1004: 201000 | I1004: (nGuanQia-999)/200 | J1004: 480 | K1004: 5000,0; | L1004: 5 | M1004: 5000,1; | N1004: 39240/3600*(nPatrolSec+3)*(1000+nGuanQia)/1000 | O1004: 31380/3600*(nPatrolSec+3)*(1000+nGuanQia)/1000 | P1004: 19320/3600*(nPatrolSec+3)*(1000+nGuanQia)/1000 | Q1004: nGuanQia + 1000 | R1004: 39240/60*nMin*(1000+nGuanQia)/1000 | S1004: 31380/60*nMin*(1000+nGuanQia)/1000 | T1004: 19320/60*nMin*(1000+nGuanQia)/1000 | U1004: 喽啰 | V1004: pet_21;pet_201;pet_93;pet_91; | W1004: 4 | X1004: 5 | Y1004: 1,28000,8,0;1,19016,8,0;1,10007,5,0;1,10108,2,0;1,7,9000,0;1,8,9000,0;1,4,1000,0; | Z1004: 0 | AA1004: {} | AB1004: n/60

Sheet: Sheet2
A1: 宋玉 | B1: 多想为你奉上最美的鲜花
A2: 潘安 | B2: 留不住的，始终是那刹那消逝的芳华
A3: 卫玠 | B3: 天涯海角，但求无他，只望君安，叔宝便已知足
A4: 赵云 | B4: 若为伊故，子龙再度七进七出又何妨！
A5: 司马相如 | B5: 能与娘娘相伴，真乃微臣之辛
A6: 孙策 | B6: =R[-1]C -> 能与娘娘相伴，真乃微臣之辛
A7: 韩子高 | B7: 伊人独舞，倾城之姿。舞中带忧，我见犹怜
A8: 高长恭 | B8: 不要动，再动的话，我可不敢保证会发生什么!
A9: 嵇康 | B9: 人生难免不如意，娘娘懂得排遣便好
A10: 慕容冲 | B10: 你是白痴吗？这种话还需要我当面跟你说清楚吗！
A11: 诸葛亮 | B11: 今日夜观星象，乌云盖顶，却奈何遮不住对你的思念
A12: 卫青 | B12: 有时候莫名其妙的笑了，只因为想到了你
A13: 荀彧 | B13: 大千世界，能遇上娘娘，真好
A14: 子画 | B14: 没有我，你要好好的，这是你唯一能为我做的
A15: 白玉堂 | B15: 不要怕什么路途遥远。走一步有一步的风景
A16: 曹操 | B16: 我从来不怕天下人看错我，却唯怕你看错我
A17: 李白 | B17: 陪你地老天荒，只为伊人独醉
A18: 杜甫 | B18: 你站在哪里 哪里就自成风景
A19: 展昭 | B19: 只要展某认为值得，纵管前方是刀山火海还是千军万马，我也会义无反顾！
A20: 周瑜 | B20: 聆听吧，这首献给您的醉赤壁
A21: 苏轼 | B21: 小楼一夜听风雨，深巷明朝卖杏花
A22: 元稹 | B22: 在你需要我时，我总会出现在你身边
A23: 阮籍 | B23: 世间纵有风雪寒寒，亦终有人万死不离
A24: 霍去病 | B24: 娘娘，和你在一起总会令我忘记时间的存在
A25: 邹忌 | B25: 我不思进取，因为只思你！
A26: 唐伯虎 | B26: 笔走龙蛇绘江山，却绘不出娘娘的惊鸿之姿
A27: 柳永 | B27: 云淡风轻，细水长流
A28: 魏无忌 | B28: 凤兮凤兮归故乡，遨游四海求其凰
A29: 扶苏 | B29: 此刻看着你，就好比我在晴朗的天气，眺望远处的青山
A30: 欧阳修 | B30: 娘娘，好风、好景，倒不如来一场春风得意马蹄疾。
A31: 郭嘉 | B31: 有的路，是脚去走。而有的路，确是用心去走
A32: 蒙恬 | B32: 你若需要，大可拿走我的心，可是别把你的微笑拿掉
A33: 白居易 | B33: 娘娘，樱树只有华美落尽，生命脉络才历历可见
A34: 刘彻 | B34: 一腔孤勇与余生，只愿能陪在你的身边

Sheet: Sheet3
T5: 血量公式 | U5: 攻击力公式 | V5: 防御公式 | W5: 灵力公式 | X5: 速度公式 | Y5: 法力公式
T6: 3325*0.8*0.7 | U6: 1645*0.5*0.7 | V6: 802*1 | W6: 604*1 | X6: 300*2*0.75 | Y6: 1000*LV+100000
A7: 序号 | B7: 最小关卡 | C7: 最大关卡 | D7: 关卡名 | E7: 人物经验基数公式 | F7: 宠物经验基数公式 | G7: 银币奖励基数公式 | J7: 金币奖励基础公式 | K7: 人物离线经验 | L7: 宠物离线经验 | M7: 离线奖励银币
A8: 1 | B8: 1 | C8: 1 | D8: 新手试炼 | E8: 50000/3600*(nPatrolSec+3)*(100+nGuanQia)/100 | F8: 50000/3600*(nPatrolSec+3)*(100+nGuanQia)/100*0.4 | G8: 50000/3600*(nPatrolSec+3)*(100+nGuanQia)/100*20 | H8: =RC[1]&"/15/3600*(nPatrolSec+3)*(nGuanQia+0)/"&INT((RC[-6]+RC[-5])/2) -> 2000000/15/3600*(nPatrolSec+3)*(nGuanQia+0)/1 | I8: 2000000 | J8: nGuanQia + 100 | K8: 50000/60*nMin*(100+nGuanQia)/100 | L8: 50000/60*nMin*(100+nGuanQia)/100*0.4 | M8: 50000/60*nMin*(100+nGuanQia)/100*20 | N8: =RC[-5]&"/20/60*nMin*(nGuanQia+0)/"&INT((RC[-12]+RC[-11])/2) -> 2000000/20/60*nMin*(nGuanQia+0)/1
A9: 2 | B9: 2 | C9: 2 | D9: 新手试炼 | E9: 50000/3600*(nPatrolSec+3)*(100+nGuanQia)/100 | F9: 50000/3600*(nPatrolSec+3)*(100+nGuanQia)/100*0.4 | G9: 50000/3600*(nPatrolSec+3)*(100+nGuanQia)/100*20 | H9: =RC[1]&"/15/3600*(nPatrolSec+3)*(nGuanQia+0)/"&INT((RC[-6]+RC[-5])/2) -> 2600000/15/3600*(nPatrolSec+3)*(nGuanQia+0)/2 | I9: =(R18C9-R8C9)/(R18C1-R8C1)+R[-1]C -> 2600000 | J9: nGuanQia + 100 | K9: 50000/60*nMin*(100+nGuanQia)/100 | L9: 50000/60*nMin*(100+nGuanQia)/100*0.4 | M9: 50000/60*nMin*(100+nGuanQia)/100*20 | N9: =RC[-5]&"/20/60*nMin*(nGuanQia+0)/"&INT((RC[-12]+RC[-11])/2) -> 2600000/20/60*nMin*(nGuanQia+0)/2
A10: 3 | B10: 3 | C10: 3 | D10: 新手试炼 | E10: 50000/3600*(nPatrolSec+3)*(100+nGuanQia)/100 | F10: 50000/3600*(nPatrolSec+3)*(100+nGuanQia)/100*0.4 | G10: 50000/3600*(nPatrolSec+3)*(100+nGuanQia)/100*20 | H10: =RC[1]&"/15/3600*(nPatrolSec+3)*(nGuanQia+0)/"&INT((RC[-6]+RC[-5])/2) -> 3200000/15/3600*(nPatrolSec+3)*(nGuanQia+0)/3 | I10: =(R18C9-R8C9)/(R18C1-R8C1)+R[-1]C -> 3200000 | J10: nGuanQia + 100 | K10: 50000/60*nMin*(100+nGuanQia)/100 | L10: 50000/60*nMin*(100+nGuanQia)/100*0.4 | M10: 50000/60*nMin*(100+nGuanQia)/100*20 | N10: =RC[-5]&"/20/60*nMin*(nGuanQia+0)/"&INT((RC[-12]+RC[-11])/2) -> 3200000/20/60*nMin*(nGuanQia+0)/3
A11: 4 | B11: 4 | C11: 4 | D11: 新手试炼 | E11: 50000/3600*(nPatrolSec+3)*(100+nGuanQia)/100 | F11: 50000/3600*(nPatrolSec+3)*(100+nGuanQia)/100*0.4 | G11: 50000/3600*(nPatrolSec+3)*(100+nGuanQia)/100*20 | H11: =RC[1]&"/15/3600*(nPatrolSec+3)*(nGuanQia+0)/"&INT((RC[-6]+RC[-5])/2) -> 3800000/15/3600*(nPatrolSec+3)*(nGuanQia+0)/4 | I11: =(R18C9-R8C9)/(R18C1-R8C1)+R[-1]C -> 3800000 | J11: nGuanQia + 100 | K11: 50000/60*nMin*(100+nGuanQia)/100 | L11: 50000/60*nMin*(100+nGuanQia)/100*0.4 | M11: 50000/60*nMin*(100+nGuanQia)/100*20 | N11: =RC[-5]&"/20/60*nMin*(nGuanQia+0)/"&INT((RC[-12]+RC[-11])/2) -> 3800000/20/60*nMin*(nGuanQia+0)/4
A12: 5 | B12: 5 | C12: 5 | D12: 新手试炼 | E12: 50000/3600*(nPatrolSec+3)*(100+nGuanQia)/100 | F12: 50000/3600*(nPatrolSec+3)*(100+nGuanQia)/100*0.4 | G12: 50000/3600*(nPatrolSec+3)*(100+nGuanQia)/100*20 | H12: =RC[1]&"/15/3600*(nPatrolSec+3)*(nGuanQia+0)/"&INT((RC[-6]+RC[-5])/2) -> 4400000/15/3600*(nPatrolSec+3)*(nGuanQia+0)/5 | I12: =(R18C9-R8C9)/(R18C1-R8C1)+R[-1]C -> 4400000 | J12: nGuanQia + 100 | K12: 50000/60*nMin*(100+nGuanQia)/100 | L12: 50000/60*nMin*(100+nGuanQia)/100*0.4 | M12: 50000/60*nMin*(100+nGuanQia)/100*20 | N12: =RC[-5]&"/20/60*nMin*(nGuanQia+0)/"&INT((RC[-12]+RC[-11])/2) -> 4400000/20/60*nMin*(nGuanQia+0)/5
A13: 6 | B13: 6 | C13: 20 | D13: 新手试炼 | E13: 50000/3600*(nPatrolSec+3)*(100+nGuanQia)/100 | F13: 50000/3600*(nPatrolSec+3)*(100+nGuanQia)/100*0.4 | G13: 50000/3600*(nPatrolSec+3)*(100+nGuanQia)/100*20 | H13: =RC[1]&"/15/3600*(nPatrolSec+3)*(nGuanQia+0)/"&INT((RC[-6]+RC[-5])/2) -> 5000000/15/3600*(nPatrolSec+3)*(nGuanQia+0)/13 | I13: =(R18C9-R8C9)/(R18C1-R8C1)+R[-1]C -> 5000000 | J13: nGuanQia + 100 | K13: 50000/60*nMin*(100+nGuanQia)/100 | L13: 50000/60*nMin*(100+nGuanQia)/100*0.4 | M13: 50000/60*nMin*(100+nGuanQia)/100*20 | N13: =RC[-5]&"/20/60*nMin*(nGuanQia+0)/"&INT((RC[-12]+RC[-11])/2) -> 5000000/20/60*nMin*(nGuanQia+0)/13
A14: 7 | B14: 21 | C14: 50 | D14: 青铜试炼 | E14: 60000/3600*(nPatrolSec+3)*(100+nGuanQia)/100 | F14: 60000/3600*(nPatrolSec+3)*(100+nGuanQia)/100*0.4 | G14: 60000/3600*(nPatrolSec+3)*(100+nGuanQia)/100*20 | H14: =RC[1]&"/15/3600*(nPatrolSec+3)*(nGuanQia+0)/"&INT((RC[-6]+RC[-5])/2) -> 5600000/15/3600*(nPatrolSec+3)*(nGuanQia+0)/35 | I14: =(R18C9-R8C9)/(R18C1-R8C1)+R[-1]C -> 5600000 | J14: nGuanQia + 100 | K14: 60000/60*nMin*(100+nGuanQia)/100 | L14: 60000/60*nMin*(100+nGuanQia)/100*0.4 | M14: 60000/60*nMin*(100+nGuanQia)/100*20 | N14: =RC[-5]&"/20/60*nMin*(nGuanQia+0)/"&INT((RC[-12]+RC[-11])/2) -> 5600000/20/60*nMin*(nGuanQia+0)/35
A15: 8 | B15: 51 | C15: 100 | D15: 白银试炼 | E15: 70000/3600*(nPatrolSec+3)*(100+nGuanQia)/100 | F15: 70000/3600*(nPatrolSec+3)*(100+nGuanQia)/100*0.4 | G15: 70000/3600*(nPatrolSec+3)*(100+nGuanQia)/100*20 | H15: =RC[1]&"/15/3600*(nPatrolSec+3)*(nGuanQia+0)/"&INT((RC[-6]+RC[-5])/2) -> 6200000/15/3600*(nPatrolSec+3)*(nGuanQia+0)/75 | I15: =(R18C9-R8C9)/(R18C1-R8C1)+R[-1]C -> 6200000 | J15: nGuanQia + 100 | K15: 70000/60*nMin*(100+nGuanQia)/100 | L15: 70000/60*nMin*(100+nGuanQia)/100*0.4 | M15: 70000/60*nMin*(100+nGuanQia)/100*20 | N15: =RC[-5]&"/20/60*nMin*(nGuanQia+0)/"&INT((RC[-12]+RC[-11])/2) -> 6200000/20/60*nMin*(nGuanQia+0)/75
A16: 9 | B16: 101 | C16: 200 | D16: 黄金试炼 | E16: 80000/3600*(nPatrolSec+3)*(100+nGuanQia)/100 | F16: 80000/3600*(nPatrolSec+3)*(100+nGuanQia)/100*0.4 | G16: 80000/3600*(nPatrolSec+3)*(100+nGuanQia)/100*20 | H16: =RC[1]&"/15/3600*(nPatrolSec+3)*(nGuanQia+0)/"&INT((RC[-6]+RC[-5])/2) -> 6800000/15/3600*(nPatrolSec+3)*(nGuanQia+0)/150 | I16: =(R18C9-R8C9)/(R18C1-R8C1)+R[-1]C -> 6800000 | J16: nGuanQia + 100 | K16: 80000/60*nMin*(100+nGuanQia)/100 | L16: 80000/60*nMin*(100+nGuanQia)/100*0.4 | M16: 80000/60*nMin*(100+nGuanQia)/100*20 | N16: =RC[-5]&"/20/60*nMin*(nGuanQia+0)/"&INT((RC[-12]+RC[-11])/2) -> 6800000/20/60*nMin*(nGuanQia+0)/150
A17: 10 | B17: 201 | C17: 300 | D17: 钻石试炼 | E17: 90000/3600*(nPatrolSec+3)*(100+nGuanQia)/100 | F17: 90000/3600*(nPatrolSec+3)*(100+nGuanQia)/100*0.4 | G17: 90000/3600*(nPatrolSec+3)*(100+nGuanQia)/100*20 | H17: =RC[1]&"/15/3600*(nPatrolSec+3)*(nGuanQia+0)/"&INT((RC[-6]+RC[-5])/2) -> 7400000/15/3600*(nPatrolSec+3)*(nGuanQia+0)/250 | I17: =(R18C9-R8C9)/(R18C1-R8C1)+R[-1]C -> 7400000 | J17: nGuanQia + 100 | K17: 90000/60*nMin*(100+nGuanQia)/100 | L17: 90000/60*nMin*(100+nGuanQia)/100*0.4 | M17: 90000/60*nMin*(100+nGuanQia)/100*20 | N17: =RC[-5]&"/20/60*nMin*(nGuanQia+0)/"&INT((RC[-12]+RC[-11])/2) -> 7400000/20/60*nMin*(nGuanQia+0)/250
A18: 11 | B18: 301 | C18: 400 | D18: 王者试炼 | E18: 100000/3600*(nPatrolSec+3)*(100+nGuanQia)/100 | F18: 100000/3600*(nPatrolSec+3)*(100+nGuanQia)/100*0.4 | G18: 100000/3600*(nPatrolSec+3)*(100+nGuanQia)/100*20 | H18: =RC[1]&"/15/3600*(nPatrolSec+3)*(nGuanQia+0)/"&INT((RC[-6]+RC[-5])/2) -> 8000000/15/3600*(nPatrolSec+3)*(nGuanQia+0)/350 | I18: 8000000 | J18: nGuanQia + 100 | K18: 100000/60*nMin*(100+nGuanQia)/100 | L18: 100000/60*nMin*(100+nGuanQia)/100*0.4 | M18: 100000/60*nMin*(100+nGuanQia)/100*20 | N18: =RC[-5]&"/20/60*nMin*(nGuanQia+0)/"&INT((RC[-12]+RC[-11])/2) -> 8000000/20/60*nMin*(nGuanQia+0)/350
A19: 12 | B19: 401 | C19: 9999 | D19: 大师试炼 | E19: 100000/3600*(nPatrolSec+3)*(100+nGuanQia)/100 | F19: 100000/3600*(nPatrolSec+3)*(100+nGuanQia)/100*0.4 | G19: 100000/3600*(nPatrolSec+3)*(100+nGuanQia)/100*20 | I19: 8000000 | J19: nGuanQia + 100 | K19: 100000/60*nMin*(100+nGuanQia)/100 | L19: 100000/60*nMin*(100+nGuanQia)/100*0.4 | M19: 100000/60*nMin*(100+nGuanQia)/100*20

Sheet: Sheet4
B2: 人物等级 | C2: 攻击 | D2: 防御 | E2: 气血 | F2: 灵力 | G2: 速度 | H2: 法力 | K2: 几A | L2: 攻击 | M2: 防御 | N2: 气血 | O2: 灵力 | P2: 速度 | Q2: 法力
B3: ='\svn3\策划文档\=95 数值相关\[人物理论最高属性及战力参考-川.xlsx]人物属性&战力'!R[101]C[2] -> 90 | C3: ='\svn3\策划文档\=95 数值相关\[人物理论最高属性及战力参考-川.xlsx]人物属性&战力'!R[101]C[2] -> 2427 | D3: ='\svn3\策划文档\=95 数值相关\[人物理论最高属性及战力参考-川.xlsx]人物属性&战力'!R[101]C[2] -> 2116 | E3: ='\svn3\策划文档\=95 数值相关\[人物理论最高属性及战力参考-川.xlsx]人物属性&战力'!R[101]C[2] -> 5491 | F3: ='\svn3\策划文档\=95 数值相关\[人物理论最高属性及战力参考-川.xlsx]人物属性&战力'!R[101]C[2] -> 960 | G3: ='\svn3\策划文档\=95 数值相关\[人物理论最高属性及战力参考-川.xlsx]人物属性&战力'!R[101]C[2] -> 538 | H3: ='\svn3\策划文档\=95 数值相关\[人物理论最高属性及战力参考-川.xlsx]人物属性&战力'!R[101]C[2] -> 6444
B4: ='\svn3\策划文档\=95 数值相关\[人物理论最高属性及战力参考-川.xlsx]人物属性&战力'!R[101]C[2] -> 91 | C4: ='\svn3\策划文档\=95 数值相关\[人物理论最高属性及战力参考-川.xlsx]人物属性&战力'!R[101]C[2] -> 2434 | D4: ='\svn3\策划文档\=95 数值相关\[人物理论最高属性及战力参考-川.xlsx]人物属性&战力'!R[101]C[2] -> 2122 | E4: ='\svn3\策划文档\=95 数值相关\[人物理论最高属性及战力参考-川.xlsx]人物属性&战力'!R[101]C[2] -> 5518 | F4: ='\svn3\策划文档\=95 数值相关\[人物理论最高属性及战力参考-川.xlsx]人物属性&战力'!R[101]C[2] -> 963 | G4: ='\svn3\策划文档\=95 数值相关\[人物理论最高属性及战力参考-川.xlsx]人物属性&战力'!R[101]C[2] -> 540 | H4: ='\svn3\策划文档\=95 数值相关\[人物理论最高属性及战力参考-川.xlsx]人物属性&战力'!R[101]C[2] -> 6471
B5: ='\svn3\策划文档\=95 数值相关\[人物理论最高属性及战力参考-川.xlsx]人物属性&战力'!R[101]C[2] -> 92 | C5: ='\svn3\策划文档\=95 数值相关\[人物理论最高属性及战力参考-川.xlsx]人物属性&战力'!R[101]C[2] -> 2439 | D5: ='\svn3\策划文档\=95 数值相关\[人物理论最高属性及战力参考-川.xlsx]人物属性&战力'!R[101]C[2] -> 2127 | E5: ='\svn3\策划文档\=95 数值相关\[人物理论最高属性及战力参考-川.xlsx]人物属性&战力'!R[101]C[2] -> 5545 | F5: ='\svn3\策划文档\=95 数值相关\[人物理论最高属性及战力参考-川.xlsx]人物属性&战力'!R[101]C[2] -> 968 | G5: ='\svn3\策划文档\=95 数值相关\[人物理论最高属性及战力参考-川.xlsx]人物属性&战力'!R[101]C[2] -> 542 | H5: ='\svn3\策划文档\=95 数值相关\[人物理论最高属性及战力参考-川.xlsx]人物属性&战力'!R[101]C[2] -> 6498
B6: ='\svn3\策划文档\=95 数值相关\[人物理论最高属性及战力参考-川.xlsx]人物属性&战力'!R[101]C[2] -> 93 | C6: ='\svn3\策划文档\=95 数值相关\[人物理论最高属性及战力参考-川.xlsx]人物属性&战力'!R[101]C[2] -> 2445 | D6: ='\svn3\策划文档\=95 数值相关\[人物理论最高属性及战力参考-川.xlsx]人物属性&战力'!R[101]C[2] -> 2132 | E6: ='\svn3\策划文档\=95 数值相关\[人物理论最高属性及战力参考-川.xlsx]人物属性&战力'!R[101]C[2] -> 5572 | F6: ='\svn3\策划文档\=95 数值相关\[人物理论最高属性及战力参考-川.xlsx]人物属性&战力'!R[101]C[2] -> 972 | G6: ='\svn3\策划文档\=95 数值相关\[人物理论最高属性及战力参考-川.xlsx]人物属性&战力'!R[101]C[2] -> 544 | H6: ='\svn3\策划文档\=95 数值相关\[人物理论最高属性及战力参考-川.xlsx]人物属性&战力'!R[101]C[2] -> 6525
B7: ='\svn3\策划文档\=95 数值相关\[人物理论最高属性及战力参考-川.xlsx]人物属性&战力'!R[101]C[2] -> 94 | C7: ='\svn3\策划文档\=95 数值相关\[人物理论最高属性及战力参考-川.xlsx]人物属性&战力'!R[101]C[2] -> 2451 | D7: ='\svn3\策划文档\=95 数值相关\[人物理论最高属性及战力参考-川.xlsx]人物属性&战力'!R[101]C[2] -> 2138 | E7: ='\svn3\策划文档\=95 数值相关\[人物理论最高属性及战力参考-川.xlsx]人物属性&战力'!R[101]C[2] -> 5599 | F7: ='\svn3\策划文档\=95 数值相关\[人物理论最高属性及战力参考-川.xlsx]人物属性&战力'!R[101]C[2] -> 976 | G7: ='\svn3\策划文档\=95 数值相关\[人物理论最高属性及战力参考-川.xlsx]人物属性&战力'!R[101]C[2] -> 546 | H7: ='\svn3\策划文档\=95 数值相关\[人物理论最高属性及战力参考-川.xlsx]人物属性&战力'!R[101]C[2] -> 6552
B8: ='\svn3\策划文档\=95 数值相关\[人物理论最高属性及战力参考-川.xlsx]人物属性&战力'!R[101]C[2] -> 95 | C8: ='\svn3\策划文档\=95 数值相关\[人物理论最高属性及战力参考-川.xlsx]人物属性&战力'!R[101]C[2] -> 2491 | D8: ='\svn3\策划文档\=95 数值相关\[人物理论最高属性及战力参考-川.xlsx]人物属性&战力'!R[101]C[2] -> 2170 | E8: ='\svn3\策划文档\=95 数值相关\[人物理论最高属性及战力参考-川.xlsx]人物属性&战力'!R[101]C[2] -> 5653 | F8: ='\svn3\策划文档\=95 数值相关\[人物理论最高属性及战力参考-川.xlsx]人物属性&战力'!R[101]C[2] -> 989 | G8: ='\svn3\策划文档\=95 数值相关\[人物理论最高属性及战力参考-川.xlsx]人物属性&战力'!R[101]C[2] -> 552 | H8: ='\svn3\策划文档\=95 数值相关\[人物理论最高属性及战力参考-川.xlsx]人物属性&战力'!R[101]C[2] -> 6622
B9: ='\svn3\策划文档\=95 数值相关\[人物理论最高属性及战力参考-川.xlsx]人物属性&战力'!R[101]C[2] -> 96 | C9: ='\svn3\策划文档\=95 数值相关\[人物理论最高属性及战力参考-川.xlsx]人物属性&战力'!R[101]C[2] -> 2497 | D9: ='\svn3\策划文档\=95 数值相关\[人物理论最高属性及战力参考-川.xlsx]人物属性&战力'!R[101]C[2] -> 2175 | E9: ='\svn3\策划文档\=95 数值相关\[人物理论最高属性及战力参考-川.xlsx]人物属性&战力'!R[101]C[2] -> 5680 | F9: ='\svn3\策划文档\=95 数值相关\[人物理论最高属性及战力参考-川.xlsx]人物属性&战力'!R[101]C[2] -> 992 | G9: ='\svn3\策划文档\=95 数值相关\[人物理论最高属性及战力参考-川.xlsx]人物属性&战力'!R[101]C[2] -> 554 | H9: ='\svn3\策划文档\=95 数值相关\[人物理论最高属性及战力参考-川.xlsx]人物属性&战力'!R[101]C[2] -> 6649
B10: ='\svn3\策划文档\=95 数值相关\[人物理论最高属性及战力参考-川.xlsx]人物属性&战力'!R[101]C[2] -> 97 | C10: ='\svn3\策划文档\=95 数值相关\[人物理论最高属性及战力参考-川.xlsx]人物属性&战力'!R[101]C[2] -> 2503 | D10: ='\svn3\策划文档\=95 数值相关\[人物理论最高属性及战力参考-川.xlsx]人物属性&战力'!R[101]C[2] -> 2181 | E10: ='\svn3\策划文档\=95 数值相关\[人物理论最高属性及战力参考-川.xlsx]人物属性&战力'!R[101]C[2] -> 5707 | F10: ='\svn3\策划文档\=95 数值相关\[人物理论最高属性及战力参考-川.xlsx]人物属性&战力'!R[101]C[2] -> 997 | G10: ='\svn3\策划文档\=95 数值相关\[人物理论最高属性及战力参考-川.xlsx]人物属性&战力'!R[101]C[2] -> 556 | H10: ='\svn3\策划文档\=95 数值相关\[人物理论最高属性及战力参考-川.xlsx]人物属性&战力'!R[101]C[2] -> 6676
B11: ='\svn3\策划文档\=95 数值相关\[人物理论最高属性及战力参考-川.xlsx]人物属性&战力'!R[101]C[2] -> 98 | C11: ='\svn3\策划文档\=95 数值相关\[人物理论最高属性及战力参考-川.xlsx]人物属性&战力'!R[101]C[2] -> 2508 | D11: ='\svn3\策划文档\=95 数值相关\[人物理论最高属性及战力参考-川.xlsx]人物属性&战力'!R[101]C[2] -> 2186 | E11: ='\svn3\策划文档\=95 数值相关\[人物理论最高属性及战力参考-川.xlsx]人物属性&战力'!R[101]C[2] -> 5734 | F11: ='\svn3\策划文档\=95 数值相关\[人物理论最高属性及战力参考-川.xlsx]人物属性&战力'!R[101]C[2] -> 1001 | G11: ='\svn3\策划文档\=95 数值相关\[人物理论最高属性及战力参考-川.xlsx]人物属性&战力'!R[101]C[2] -> 558 | H11: ='\svn3\策划文档\=95 数值相关\[人物理论最高属性及战力参考-川.xlsx]人物属性&战力'!R[101]C[2] -> 6703
B12: ='\svn3\策划文档\=95 数值相关\[人物理论最高属性及战力参考-川.xlsx]人物属性&战力'!R[101]C[2] -> 99 | C12: ='\svn3\策划文档\=95 数值相关\[人物理论最高属性及战力参考-川.xlsx]人物属性&战力'!R[101]C[2] -> 2515 | D12: ='\svn3\策划文档\=95 数值相关\[人物理论最高属性及战力参考-川.xlsx]人物属性&战力'!R[101]C[2] -> 2192 | E12: ='\svn3\策划文档\=95 数值相关\[人物理论最高属性及战力参考-川.xlsx]人物属性&战力'!R[101]C[2] -> 5761 | F12: ='\svn3\策划文档\=95 数值相关\[人物理论最高属性及战力参考-川.xlsx]人物属性&战力'!R[101]C[2] -> 1005 | G12: ='\svn3\策划文档\=95 数值相关\[人物理论最高属性及战力参考-川.xlsx]人物属性&战力'!R[101]C[2] -> 560 | H12: ='\svn3\策划文档\=95 数值相关\[人物理论最高属性及战力参考-川.xlsx]人物属性&战力'!R[101]C[2] -> 6730
B13: ='\svn3\策划文档\=95 数值相关\[人物理论最高属性及战力参考-川.xlsx]人物属性&战力'!R[101]C[2] -> 100 | C13: ='\svn3\策划文档\=95 数值相关\[人物理论最高属性及战力参考-川.xlsx]人物属性&战力'!R[101]C[2] -> 2687 | D13: ='\svn3\策划文档\=95 数值相关\[人物理论最高属性及战力参考-川.xlsx]人物属性&战力'!R[101]C[2] -> 2343 | E13: ='\svn3\策划文档\=95 数值相关\[人物理论最高属性及战力参考-川.xlsx]人物属性&战力'!R[101]C[2] -> 6032 | F13: ='\svn3\策划文档\=95 数值相关\[人物理论最高属性及战力参考-川.xlsx]人物属性&战力'!R[101]C[2] -> 1063 | G13: ='\svn3\策划文档\=95 数值相关\[人物理论最高属性及战力参考-川.xlsx]人物属性&战力'!R[101]C[2] -> 592 | H13: ='\svn3\策划文档\=95 数值相关\[人物理论最高属性及战力参考-川.xlsx]人物属性&战力'!R[101]C[2] -> 7327
B14: ='\svn3\策划文档\=95 数值相关\[人物理论最高属性及战力参考-川.xlsx]人物属性&战力'!R[101]C[2] -> 101 | C14: ='\svn3\策划文档\=95 数值相关\[人物理论最高属性及战力参考-川.xlsx]人物属性&战力'!R[101]C[2] -> 2694 | D14: ='\svn3\策划文档\=95 数值相关\[人物理论最高属性及战力参考-川.xlsx]人物属性&战力'!R[101]C[2] -> 2349 | E14: ='\svn3\策划文档\=95 数值相关\[人物理论最高属性及战力参考-川.xlsx]人物属性&战力'!R[101]C[2] -> 6059 | F14: ='\svn3\策划文档\=95 数值相关\[人物理论最高属性及战力参考-川.xlsx]人物属性&战力'!R[101]C[2] -> 1066 | G14: ='\svn3\策划文档\=95 数值相关\[人物理论最高属性及战力参考-川.xlsx]人物属性&战力'!R[101]C[2] -> 594 | H14: ='\svn3\策划文档\=95 数值相关\[人物理论最高属性及战力参考-川.xlsx]人物属性&战力'!R[101]C[2] -> 7354
B15: ='\svn3\策划文档\=95 数值相关\[人物理论最高属性及战力参考-川.xlsx]人物属性&战力'!R[101]C[2] -> 102 | C15: ='\svn3\策划文档\=95 数值相关\[人物理论最高属性及战力参考-川.xlsx]人物属性&战力'!R[101]C[2] -> 2699 | D15: ='\svn3\策划文档\=95 数值相关\[人物理论最高属性及战力参考-川.xlsx]人物属性&战力'!R[101]C[2] -> 2354 | E15: ='\svn3\策划文档\=95 数值相关\[人物理论最高属性及战力参考-川.xlsx]人物属性&战力'!R[101]C[2] -> 6086 | F15: ='\svn3\策划文档\=95 数值相关\[人物理论最高属性及战力参考-川.xlsx]人物属性&战力'!R[101]C[2] -> 1071 | G15: ='\svn3\策划文档\=95 数值相关\[人物理论最高属性及战力参考-川.xlsx]人物属性&战力'!R[101]C[2] -> 596 | H15: ='\svn3\策划文档\=95 数值相关\[人物理论最高属性及战力参考-川.xlsx]人物属性&战力'!R[101]C[2] -> 7381
B16: ='\svn3\策划文档\=95 数值相关\[人物理论最高属性及战力参考-川.xlsx]人物属性&战力'!R[101]C[2] -> 103 | C16: ='\svn3\策划文档\=95 数值相关\[人物理论最高属性及战力参考-川.xlsx]人物属性&战力'!R[101]C[2] -> 2705 | D16: ='\svn3\策划文档\=95 数值相关\[人物理论最高属性及战力参考-川.xlsx]人物属性&战力'!R[101]C[2] -> 2360 | E16: ='\svn3\策划文档\=95 数值相关\[人物理论最高属性及战力参考-川.xlsx]人物属性&战力'!R[101]C[2] -> 6113 | F16: ='\svn3\策划文档\=95 数值相关\[人物理论最高属性及战力参考-川.xlsx]人物属性&战力'!R[101]C[2] -> 1075 | G16: ='\svn3\策划文档\=95 数值相关\[人物理论最高属性及战力参考-川.xlsx]人物属性&战力'!R[101]C[2] -> 598 | H16: ='\svn3\策划文档\=95 数值相关\[人物理论最高属性及战力参考-川.xlsx]人物属性&战力'!R[101]C[2] -> 7408
B17: ='\svn3\策划文档\=95 数值相关\[人物理论最高属性及战力参考-川.xlsx]人物属性&战力'!R[101]C[2] -> 104 | C17: ='\svn3\策划文档\=95 数值相关\[人物理论最高属性及战力参考-川.xlsx]人物属性&战力'!R[101]C[2] -> 2712 | D17: ='\svn3\策划文档\=95 数值相关\[人物理论最高属性及战力参考-川.xlsx]人物属性&战力'!R[101]C[2] -> 2365 | E17: ='\svn3\策划文档\=95 数值相关\[人物理论最高属性及战力参考-川.xlsx]人物属性&战力'!R[101]C[2] -> 6140 | F17: ='\svn3\策划文档\=95 数值相关\[人物理论最高属性及战力参考-川.xlsx]人物属性&战力'!R[101]C[2] -> 1079 | G17: ='\svn3\策划文档\=95 数值相关\[人物理论最高属性及战力参考-川.xlsx]人物属性&战力'!R[101]C[2] -> 600 | H17: ='\svn3\策划文档\=95 数值相关\[人物理论最高属性及战力参考-川.xlsx]人物属性&战力'!R[101]C[2] -> 7435
B18: ='\svn3\策划文档\=95 数值相关\[人物理论最高属性及战力参考-川.xlsx]人物属性&战力'!R[101]C[2] -> 105 | C18: ='\svn3\策划文档\=95 数值相关\[人物理论最高属性及战力参考-川.xlsx]人物属性&战力'!R[101]C[2] -> 2737 | D18: ='\svn3\策划文档\=95 数值相关\[人物理论最高属性及战力参考-川.xlsx]人物属性&战力'!R[101]C[2] -> 2387 | E18: ='\svn3\策划文档\=95 数值相关\[人物理论最高属性及战力参考-川.xlsx]人物属性&战力'!R[101]C[2] -> 6182 | F18: ='\svn3\策划文档\=95 数值相关\[人物理论最高属性及战力参考-川.xlsx]人物属性&战力'!R[101]C[2] -> 1088 | G18: ='\svn3\策划文档\=95 数值相关\[人物理论最高属性及战力参考-川.xlsx]人物属性&战力'!R[101]C[2] -> 604 | H18: ='\svn3\策划文档\=95 数值相关\[人物理论最高属性及战力参考-川.xlsx]人物属性&战力'!R[101]C[2] -> 7487
B19: ='\svn3\策划文档\=95 数值相关\[人物理论最高属性及战力参考-川.xlsx]人物属性&战力'!R[101]C[2] -> 106 | C19: ='\svn3\策划文档\=95 数值相关\[人物理论最高属性及战力参考-川.xlsx]人物属性&战力'!R[101]C[2] -> 2743 | D19: ='\svn3\策划文档\=95 数值相关\[人物理论最高属性及战力参考-川.xlsx]人物属性&战力'!R[101]C[2] -> 2392 | E19: ='\svn3\策划文档\=95 数值相关\[人物理论最高属性及战力参考-川.xlsx]人物属性&战力'!R[101]C[2] -> 6209 | F19: ='\svn3\策划文档\=95 数值相关\[人物理论最高属性及战力参考-川.xlsx]人物属性&战力'!R[101]C[2] -> 1092 | G19: ='\svn3\策划文档\=95 数值相关\[人物理论最高属性及战力参考-川.xlsx]人物属性&战力'!R[101]C[2] -> 606 | H19: ='\svn3\策划文档\=95 数值相关\[人物理论最高属性及战力参考-川.xlsx]人物属性&战力'!R[101]C[2] -> 7514
B20: ='\svn3\策划文档\=95 数值相关\[人物理论最高属性及战力参考-川.xlsx]人物属性&战力'!R[101]C[2] -> 107 | C20: ='\svn3\策划文档\=95 数值相关\[人物理论最高属性及战力参考-川.xlsx]人物属性&战力'!R[101]C[2] -> 2749 | D20: ='\svn3\策划文档\=95 数值相关\[人物理论最高属性及战力参考-川.xlsx]人物属性&战力'!R[101]C[2] -> 2398 | E20: ='\svn3\策划文档\=95 数值相关\[人物理论最高属性及战力参考-川.xlsx]人物属性&战力'!R[101]C[2] -> 6236 | F20: ='\svn3\策划文档\=95 数值相关\[人物理论最高属性及战力参考-川.xlsx]人物属性&战力'!R[101]C[2] -> 1096 | G20: ='\svn3\策划文档\=95 数值相关\[人物理论最高属性及战力参考-川.xlsx]人物属性&战力'!R[101]C[2] -> 608 | H20: ='\svn3\策划文档\=95 数值相关\[人物理论最高属性及战力参考-川.xlsx]人物属性&战力'!R[101]C[2] -> 7541
B21: ='\svn3\策划文档\=95 数值相关\[人物理论最高属性及战力参考-川.xlsx]人物属性&战力'!R[101]C[2] -> 108 | C21: ='\svn3\策划文档\=95 数值相关\[人物理论最高属性及战力参考-川.xlsx]人物属性&战力'!R[101]C[2] -> 2755 | D21: ='\svn3\策划文档\=95 数值相关\[人物理论最高属性及战力参考-川.xlsx]人物属性&战力'!R[101]C[2] -> 2403 | E21: ='\svn3\策划文档\=95 数值相关\[人物理论最高属性及战力参考-川.xlsx]人物属性&战力'!R[101]C[2] -> 6263 | F21: ='\svn3\策划文档\=95 数值相关\[人物理论最高属性及战力参考-川.xlsx]人物属性&战力'!R[101]C[2] -> 1101 | G21: ='\svn3\策划文档\=95 数值相关\[人物理论最高属性及战力参考-川.xlsx]人物属性&战力'!R[101]C[2] -> 610 | H21: ='\svn3\策划文档\=95 数值相关\[人物理论最高属性及战力参考-川.xlsx]人物属性&战力'!R[101]C[2] -> 7568
B22: ='\svn3\策划文档\=95 数值相关\[人物理论最高属性及战力参考-川.xlsx]人物属性&战力'!R[101]C[2] -> 109 | C22: ='\svn3\策划文档\=95 数值相关\[人物理论最高属性及战力参考-川.xlsx]人物属性&战力'!R[101]C[2] -> 2761 | D22: ='\svn3\策划文档\=95 数值相关\[人物理论最高属性及战力参考-川.xlsx]人物属性&战力'!R[101]C[2] -> 2409 | E22: ='\svn3\策划文档\=95 数值相关\[人物理论最高属性及战力参考-川.xlsx]人物属性&战力'!R[101]C[2] -> 6290 | F22: ='\svn3\策划文档\=95 数值相关\[人物理论最高属性及战力参考-川.xlsx]人物属性&战力'!R[101]C[2] -> 1104 | G22: ='\svn3\策划文档\=95 数值相关\[人物理论最高属性及战力参考-川.xlsx]人物属性&战力'!R[101]C[2] -> 612 | H22: ='\svn3\策划文档\=95 数值相关\[人物理论最高属性及战力参考-川.xlsx]人物属性&战力'!R[101]C[2] -> 7595
B23: ='\svn3\策划文档\=95 数值相关\[人物理论最高属性及战力参考-川.xlsx]人物属性&战力'!R[101]C[2] -> 110 | C23: ='\svn3\策划文档\=95 数值相关\[人物理论最高属性及战力参考-川.xlsx]人物属性&战力'!R[101]C[2] -> 2939 | D23: ='\svn3\策划文档\=95 数值相关\[人物理论最高属性及战力参考-川.xlsx]人物属性&战力'!R[101]C[2] -> 2561 | E23: ='\svn3\策划文档\=95 数值相关\[人物理论最高属性及战力参考-川.xlsx]人物属性&战力'!R[101]C[2] -> 6565 | F23: ='\svn3\策划文档\=95 数值相关\[人物理论最高属性及战力参考-川.xlsx]人物属性&战力'!R[101]C[2] -> 1165 | G23: ='\svn3\策划文档\=95 数值相关\[人物理论最高属性及战力参考-川.xlsx]人物属性&战力'!R[101]C[2] -> 644 | H23: ='\svn3\策划文档\=95 数值相关\[人物理论最高属性及战力参考-川.xlsx]人物属性&战力'!R[101]C[2] -> 8231
B24: ='\svn3\策划文档\=95 数值相关\[人物理论最高属性及战力参考-川.xlsx]人物属性&战力'!R[101]C[2] -> 111 | C24: ='\svn3\策划文档\=95 数值相关\[人物理论最高属性及战力参考-川.xlsx]人物属性&战力'!R[101]C[2] -> 2946 | D24: ='\svn3\策划文档\=95 数值相关\[人物理论最高属性及战力参考-川.xlsx]人物属性&战力'!R[101]C[2] -> 2567 | E24: ='\svn3\策划文档\=95 数值相关\[人物理论最高属性及战力参考-川.xlsx]人物属性&战力'!R[101]C[2] -> 6592 | F24: ='\svn3\策划文档\=95 数值相关\[人物理论最高属性及战力参考-川.xlsx]人物属性&战力'!R[101]C[2] -> 1168 | G24: ='\svn3\策划文档\=95 数值相关\[人物理论最高属性及战力参考-川.xlsx]人物属性&战力'!R[101]C[2] -> 646 | H24: ='\svn3\策划文档\=95 数值相关\[人物理论最高属性及战力参考-川.xlsx]人物属性&战力'!R[101]C[2] -> 8258
B25: ='\svn3\策划文档\=95 数值相关\[人物理论最高属性及战力参考-川.xlsx]人物属性&战力'!R[101]C[2] -> 112 | C25: ='\svn3\策划文档\=95 数值相关\[人物理论最高属性及战力参考-川.xlsx]人物属性&战力'!R[101]C[2] -> 2952 | D25: ='\svn3\策划文档\=95 数值相关\[人物理论最高属性及战力参考-川.xlsx]人物属性&战力'!R[101]C[2] -> 2573 | E25: ='\svn3\策划文档\=95 数值相关\[人物理论最高属性及战力参考-川.xlsx]人物属性&战力'!R[101]C[2] -> 6619 | F25: ='\svn3\策划文档\=95 数值相关\[人物理论最高属性及战力参考-川.xlsx]人物属性&战力'!R[101]C[2] -> 1173 | G25: ='\svn3\策划文档\=95 数值相关\[人物理论最高属性及战力参考-川.xlsx]人物属性&战力'!R[101]C[2] -> 648 | H25: ='\svn3\策划文档\=95 数值相关\[人物理论最高属性及战力参考-川.xlsx]人物属性&战力'!R[101]C[2] -> 8285
B26: ='\svn3\策划文档\=95 数值相关\[人物理论最高属性及战力参考-川.xlsx]人物属性&战力'!R[101]C[2] -> 113 | C26: ='\svn3\策划文档\=95 数值相关\[人物理论最高属性及战力参考-川.xlsx]人物属性&战力'!R[101]C[2] -> 2958 | D26: ='\svn3\策划文档\=95 数值相关\[人物理论最高属性及战力参考-川.xlsx]人物属性&战力'!R[101]C[2] -> 2578 | E26: ='\svn3\策划文档\=95 数值相关\[人物理论最高属性及战力参考-川.xlsx]人物属性&战力'!R[101]C[2] -> 6646 | F26: ='\svn3\策划文档\=95 数值相关\[人物理论最高属性及战力参考-川.xlsx]人物属性&战力'!R[101]C[2] -> 1177 | G26: ='\svn3\策划文档\=95 数值相关\[人物理论最高属性及战力参考-川.xlsx]人物属性&战力'!R[101]C[2] -> 650 | H26: ='\svn3\策划文档\=95 数值相关\[人物理论最高属性及战力参考-川.xlsx]人物属性&战力'!R[101]C[2] -> 8312
B27: ='\svn3\策划文档\=95 数值相关\[人物理论最高属性及战力参考-川.xlsx]人物属性&战力'!R[101]C[2] -> 114 | C27: ='\svn3\策划文档\=95 数值相关\[人物理论最高属性及战力参考-川.xlsx]人物属性&战力'!R[101]C[2] -> 2965 | D27: ='\svn3\策划文档\=95 数值相关\[人物理论最高属性及战力参考-川.xlsx]人物属性&战力'!R[101]C[2] -> 2584 | E27: ='\svn3\策划文档\=95 数值相关\[人物理论最高属性及战力参考-川.xlsx]人物属性&战力'!R[101]C[2] -> 6673 | F27: ='\svn3\策划文档\=95 数值相关\[人物理论最高属性及战力参考-川.xlsx]人物属性&战力'!R[101]C[2] -> 1181 | G27: ='\svn3\策划文档\=95 数值相关\[人物理论最高属性及战力参考-川.xlsx]人物属性&战力'!R[101]C[2] -> 652 | H27: ='\svn3\策划文档\=95 数值相关\[人物理论最高属性及战力参考-川.xlsx]人物属性&战力'!R[101]C[2] -> 8339
B28: ='\svn3\策划文档\=95 数值相关\[人物理论最高属性及战力参考-川.xlsx]人物属性&战力'!R[101]C[2] -> 115 | C28: ='\svn3\策划文档\=95 数值相关\[人物理论最高属性及战力参考-川.xlsx]人物属性&战力'!R[101]C[2] -> 2992 | D28: ='\svn3\策划文档\=95 数值相关\[人物理论最高属性及战力参考-川.xlsx]人物属性&战力'!R[101]C[2] -> 2607 | E28: ='\svn3\策划文档\=95 数值相关\[人物理论最高属性及战力参考-川.xlsx]人物属性&战力'!R[101]C[2] -> 6717 | F28: ='\svn3\策划文档\=95 数值相关\[人物理论最高属性及战力参考-川.xlsx]人物属性&战力'!R[101]C[2] -> 1193 | G28: ='\svn3\策划文档\=95 数值相关\[人物理论最高属性及战力参考-川.xlsx]人物属性&战力'!R[101]C[2] -> 656 | H28: ='\svn3\策划文档\=95 数值相关\[人物理论最高属性及战力参考-川.xlsx]人物属性&战力'!R[101]C[2] -> 8393
B29: ='\svn3\策划文档\=95 数值相关\[人物理论最高属性及战力参考-川.xlsx]人物属性&战力'!R[101]C[2] -> 116 | C29: ='\svn3\策划文档\=95 数值相关\[人物理论最高属性及战力参考-川.xlsx]人物属性&战力'!R[101]C[2] -> 2998 | D29: ='\svn3\策划文档\=95 数值相关\[人物理论最高属性及战力参考-川.xlsx]人物属性&战力'!R[101]C[2] -> 2612 | E29: ='\svn3\策划文档\=95 数值相关\[人物理论最高属性及战力参考-川.xlsx]人物属性&战力'!R[101]C[2] -> 6744 | F29: ='\svn3\策划文档\=95 数值相关\[人物理论最高属性及战力参考-川.xlsx]人物属性&战力'!R[101]C[2] -> 1196 | G29: ='\svn3\策划文档\=95 数值相关\[人物理论最高属性及战力参考-川.xlsx]人物属性&战力'!R[101]C[2] -> 658 | H29: ='\svn3\策划文档\=95 数值相关\[人物理论最高属性及战力参考-川.xlsx]人物属性&战力'!R[101]C[2] -> 8420
B30: ='\svn3\策划文档\=95 数值相关\[人物理论最高属性及战力参考-川.xlsx]人物属性&战力'!R[101]C[2] -> 117 | C30: ='\svn3\策划文档\=95 数值相关\[人物理论最高属性及战力参考-川.xlsx]人物属性&战力'!R[101]C[2] -> 3004 | D30: ='\svn3\策划文档\=95 数值相关\[人物理论最高属性及战力参考-川.xlsx]人物属性&战力'!R[101]C[2] -> 2618 | E30: ='\svn3\策划文档\=95 数值相关\[人物理论最高属性及战力参考-川.xlsx]人物属性&战力'!R[101]C[2] -> 6771 | F30: ='\svn3\策划文档\=95 数值相关\[人物理论最高属性及战力参考-川.xlsx]人物属性&战力'!R[101]C[2] -> 1201 | G30: ='\svn3\策划文档\=95 数值相关\[人物理论最高属性及战力参考-川.xlsx]人物属性&战力'!R[101]C[2] -> 660 | H30: ='\svn3\策划文档\=95 数值相关\[人物理论最高属性及战力参考-川.xlsx]人物属性&战力'!R[101]C[2] -> 8447
B31: ='\svn3\策划文档\=95 数值相关\[人物理论最高属性及战力参考-川.xlsx]人物属性&战力'!R[101]C[2] -> 118 | C31: ='\svn3\策划文档\=95 数值相关\[人物理论最高属性及战力参考-川.xlsx]人物属性&战力'!R[101]C[2] -> 3010 | D31: ='\svn3\策划文档\=95 数值相关\[人物理论最高属性及战力参考-川.xlsx]人物属性&战力'!R[101]C[2] -> 2624 | E31: ='\svn3\策划文档\=95 数值相关\[人物理论最高属性及战力参考-川.xlsx]人物属性&战力'!R[101]C[2] -> 6798 | F31: ='\svn3\策划文档\=95 数值相关\[人物理论最高属性及战力参考-川.xlsx]人物属性&战力'!R[101]C[2] -> 1205 | G31: ='\svn3\策划文档\=95 数值相关\[人物理论最高属性及战力参考-川.xlsx]人物属性&战力'!R[101]C[2] -> 662 | H31: ='\svn3\策划文档\=95 数值相关\[人物理论最高属性及战力参考-川.xlsx]人物属性&战力'!R[101]C[2] -> 8474
B32: ='\svn3\策划文档\=95 数值相关\[人物理论最高属性及战力参考-川.xlsx]人物属性&战力'!R[101]C[2] -> 119 | C32: ='\svn3\策划文档\=95 数值相关\[人物理论最高属性及战力参考-川.xlsx]人物属性&战力'!R[101]C[2] -> 3017 | D32: ='\svn3\策划文档\=95 数值相关\[人物理论最高属性及战力参考-川.xlsx]人物属性&战力'!R[101]C[2] -> 2629 | E32: ='\svn3\策划文档\=95 数值相关\[人物理论最高属性及战力参考-川.xlsx]人物属性&战力'!R[101]C[2] -> 6825 | F32: ='\svn3\策划文档\=95 数值相关\[人物理论最高属性及战力参考-川.xlsx]人物属性&战力'!R[101]C[2] -> 1209 | G32: ='\svn3\策划文档\=95 数值相关\[人物理论最高属性及战力参考-川.xlsx]人物属性&战力'!R[101]C[2] -> 664 | H32: ='\svn3\策划文档\=95 数值相关\[人物理论最高属性及战力参考-川.xlsx]人物属性&战力'!R[101]C[2] -> 8501
B33: ='\svn3\策划文档\=95 数值相关\[人物理论最高属性及战力参考-川.xlsx]人物属性&战力'!R[101]C[2] -> 120 | C33: ='\svn3\策划文档\=95 数值相关\[人物理论最高属性及战力参考-川.xlsx]人物属性&战力'!R[101]C[2] -> 3228 | D33: ='\svn3\策划文档\=95 数值相关\[人物理论最高属性及战力参考-川.xlsx]人物属性&战力'!R[101]C[2] -> 2806 | E33: ='\svn3\策划文档\=95 数值相关\[人物理论最高属性及战力参考-川.xlsx]人物属性&战力'!R[101]C[2] -> 7122 | F33: ='\svn3\策划文档\=95 数值相关\[人物理论最高属性及战力参考-川.xlsx]人物属性&战力'!R[101]C[2] -> 1280 | G33: ='\svn3\策划文档\=95 数值相关\[人物理论最高属性及战力参考-川.xlsx]人物属性&战力'!R[101]C[2] -> 700 | H33: ='\svn3\策划文档\=95 数值相关\[人物理论最高属性及战力参考-川.xlsx]人物属性&战力'!R[101]C[2] -> 9209
B34: ='\svn3\策划文档\=95 数值相关\[人物理论最高属性及战力参考-川.xlsx]人物属性&战力'!R[101]C[2] -> 121 | C34: ='\svn3\策划文档\=95 数值相关\[人物理论最高属性及战力参考-川.xlsx]人物属性&战力'!R[101]C[2] -> 3235 | D34: ='\svn3\策划文档\=95 数值相关\[人物理论最高属性及战力参考-川.xlsx]人物属性&战力'!R[101]C[2] -> 2812 | E34: ='\svn3\策划文档\=95 数值相关\[人物理论最高属性及战力参考-川.xlsx]人物属性&战力'!R[101]C[2] -> 7149 | F34: ='\svn3\策划文档\=95 数值相关\[人物理论最高属性及战力参考-川.xlsx]人物属性&战力'!R[101]C[2] -> 1284 | G34: ='\svn3\策划文档\=95 数值相关\[人物理论最高属性及战力参考-川.xlsx]人物属性&战力'!R[101]C[2] -> 702 | H34: ='\svn3\策划文档\=95 数值相关\[人物理论最高属性及战力参考-川.xlsx]人物属性&战力'!R[101]C[2] -> 9236
B35: ='\svn3\策划文档\=95 数值相关\[人物理论最高属性及战力参考-川.xlsx]人物属性&战力'!R[101]C[2] -> 122 | C35: ='\svn3\策划文档\=95 数值相关\[人物理论最高属性及战力参考-川.xlsx]人物属性&战力'!R[101]C[2] -> 3241 | D35: ='\svn3\策划文档\=95 数值相关\[人物理论最高属性及战力参考-川.xlsx]人物属性&战力'!R[101]C[2] -> 2818 | E35: ='\svn3\策划文档\=95 数值相关\[人物理论最高属性及战力参考-川.xlsx]人物属性&战力'!R[101]C[2] -> 7176 | F35: ='\svn3\策划文档\=95 数值相关\[人物理论最高属性及战力参考-川.xlsx]人物属性&战力'!R[101]C[2] -> 1289 | G35: ='\svn3\策划文档\=95 数值相关\[人物理论最高属性及战力参考-川.xlsx]人物属性&战力'!R[101]C[2] -> 704 | H35: ='\svn3\策划文档\=95 数值相关\[人物理论最高属性及战力参考-川.xlsx]人物属性&战力'!R[101]C[2] -> 9263
B36: ='\svn3\策划文档\=95 数值相关\[人物理论最高属性及战力参考-川.xlsx]人物属性&战力'!R[101]C[2] -> 123 | C36: ='\svn3\策划文档\=95 数值相关\[人物理论最高属性及战力参考-川.xlsx]人物属性&战力'!R[101]C[2] -> 3247 | D36: ='\svn3\策划文档\=95 数值相关\[人物理论最高属性及战力参考-川.xlsx]人物属性&战力'!R[101]C[2] -> 2823 | E36: ='\svn3\策划文档\=95 数值相关\[人物理论最高属性及战力参考-川.xlsx]人物属性&战力'!R[101]C[2] -> 7203 | F36: ='\svn3\策划文档\=95 数值相关\[人物理论最高属性及战力参考-川.xlsx]人物属性&战力'!R[101]C[2] -> 1293 | G36: ='\svn3\策划文档\=95 数值相关\[人物理论最高属性及战力参考-川.xlsx]人物属性&战力'!R[101]C[2] -> 706 | H36: ='\svn3\策划文档\=95 数值相关\[人物理论最高属性及战力参考-川.xlsx]人物属性&战力'!R[101]C[2] -> 9290
B37: ='\svn3\策划文档\=95 数值相关\[人物理论最高属性及战力参考-川.xlsx]人物属性&战力'!R[101]C[2] -> 124 | C37: ='\svn3\策划文档\=95 数值相关\[人物理论最高属性及战力参考-川.xlsx]人物属性&战力'!R[101]C[2] -> 3254 | D37: ='\svn3\策划文档\=95 数值相关\[人物理论最高属性及战力参考-川.xlsx]人物属性&战力'!R[101]C[2] -> 2829 | E37: ='\svn3\策划文档\=95 数值相关\[人物理论最高属性及战力参考-川.xlsx]人物属性&战力'!R[101]C[2] -> 7230 | F37: ='\svn3\策划文档\=95 数值相关\[人物理论最高属性及战力参考-川.xlsx]人物属性&战力'!R[101]C[2] -> 1297 | G37: ='\svn3\策划文档\=95 数值相关\[人物理论最高属性及战力参考-川.xlsx]人物属性&战力'!R[101]C[2] -> 708 | H37: ='\svn3\策划文档\=95 数值相关\[人物理论最高属性及战力参考-川.xlsx]人物属性&战力'!R[101]C[2] -> 9317
B38: ='\svn3\策划文档\=95 数值相关\[人物理论最高属性及战力参考-川.xlsx]人物属性&战力'!R[101]C[2] -> 125 | C38: ='\svn3\策划文档\=95 数值相关\[人物理论最高属性及战力参考-川.xlsx]人物属性&战力'!R[101]C[2] -> 3261 | D38: ='\svn3\策划文档\=95 数值相关\[人物理论最高属性及战力参考-川.xlsx]人物属性&战力'!R[101]C[2] -> 2835 | E38: ='\svn3\策划文档\=95 数值相关\[人物理论最高属性及战力参考-川.xlsx]人物属性&战力'!R[101]C[2] -> 7257 | F38: ='\svn3\策划文档\=95 数值相关\[人物理论最高属性及战力参考-川.xlsx]人物属性&战力'!R[101]C[2] -> 1302 | G38: ='\svn3\策划文档\=95 数值相关\[人物理论最高属性及战力参考-川.xlsx]人物属性&战力'!R[101]C[2] -> 710 | H38: ='\svn3\策划文档\=95 数值相关\[人物理论最高属性及战力参考-川.xlsx]人物属性&战力'!R[101]C[2] -> 9344
B39: ='\svn3\策划文档\=95 数值相关\[人物理论最高属性及战力参考-川.xlsx]人物属性&战力'!R[101]C[2] -> 126 | C39: ='\svn3\策划文档\=95 数值相关\[人物理论最高属性及战力参考-川.xlsx]人物属性&战力'!R[101]C[2] -> 3268 | D39: ='\svn3\策划文档\=95 数值相关\[人物理论最高属性及战力参考-川.xlsx]人物属性&战力'!R[101]C[2] -> 2841 | E39: ='\svn3\策划文档\=95 数值相关\[人物理论最高属性及战力参考-川.xlsx]人物属性&战力'!R[101]C[2] -> 7284 | F39: ='\svn3\策划文档\=95 数值相关\[人物理论最高属性及战力参考-川.xlsx]人物属性&战力'!R[101]C[2] -> 1305 | G39: ='\svn3\策划文档\=95 数值相关\[人物理论最高属性及战力参考-川.xlsx]人物属性&战力'!R[101]C[2] -> 712 | H39: ='\svn3\策划文档\=95 数值相关\[人物理论最高属性及战力参考-川.xlsx]人物属性&战力'!R[101]C[2] -> 9371
B40: ='\svn3\策划文档\=95 数值相关\[人物理论最高属性及战力参考-川.xlsx]人物属性&战力'!R[101]C[2] -> 127 | C40: ='\svn3\策划文档\=95 数值相关\[人物理论最高属性及战力参考-川.xlsx]人物属性&战力'!R[101]C[2] -> 3274 | D40: ='\svn3\策划文档\=95 数值相关\[人物理论最高属性及战力参考-川.xlsx]人物属性&战力'!R[101]C[2] -> 2847 | E40: ='\svn3\策划文档\=95 数值相关\[人物理论最高属性及战力参考-川.xlsx]人物属性&战力'!R[101]C[2] -> 7311 | F40: ='\svn3\策划文档\=95 数值相关\[人物理论最高属性及战力参考-川.xlsx]人物属性&战力'!R[101]C[2] -> 1310 | G40: ='\svn3\策划文档\=95 数值相关\[人物理论最高属性及战力参考-川.xlsx]人物属性&战力'!R[101]C[2] -> 714 | H40: ='\svn3\策划文档\=95 数值相关\[人物理论最高属性及战力参考-川.xlsx]人物属性&战力'!R[101]C[2] -> 9398
B41: ='\svn3\策划文档\=95 数值相关\[人物理论最高属性及战力参考-川.xlsx]人物属性&战力'!R[101]C[2] -> 128 | C41: ='\svn3\策划文档\=95 数值相关\[人物理论最高属性及战力参考-川.xlsx]人物属性&战力'!R[101]C[2] -> 3280 | D41: ='\svn3\策划文档\=95 数值相关\[人物理论最高属性及战力参考-川.xlsx]人物属性&战力'!R[101]C[2] -> 2852 | E41: ='\svn3\策划文档\=95 数值相关\[人物理论最高属性及战力参考-川.xlsx]人物属性&战力'!R[101]C[2] -> 7338 | F41: ='\svn3\策划文档\=95 数值相关\[人物理论最高属性及战力参考-川.xlsx]人物属性&战力'!R[101]C[2] -> 1315 | G41: ='\svn3\策划文档\=95 数值相关\[人物理论最高属性及战力参考-川.xlsx]人物属性&战力'!R[101]C[2] -> 716 | H41: ='\svn3\策划文档\=95 数值相关\[人物理论最高属性及战力参考-川.xlsx]人物属性&战力'!R[101]C[2] -> 9425
B42: ='\svn3\策划文档\=95 数值相关\[人物理论最高属性及战力参考-川.xlsx]人物属性&战力'!R[101]C[2] -> 129 | C42: ='\svn3\策划文档\=95 数值相关\[人物理论最高属性及战力参考-川.xlsx]人物属性&战力'!R[101]C[2] -> 3287 | D42: ='\svn3\策划文档\=95 数值相关\[人物理论最高属性及战力参考-川.xlsx]人物属性&战力'!R[101]C[2] -> 2858 | E42: ='\svn3\策划文档\=95 数值相关\[人物理论最高属性及战力参考-川.xlsx]人物属性&战力'!R[101]C[2] -> 7365 | F42: ='\svn3\策划文档\=95 数值相关\[人物理论最高属性及战力参考-川.xlsx]人物属性&战力'!R[101]C[2] -> 1318 | G42: ='\svn3\策划文档\=95 数值相关\[人物理论最高属性及战力参考-川.xlsx]人物属性&战力'!R[101]C[2] -> 718 | H42: ='\svn3\策划文档\=95 数值相关\[人物理论最高属性及战力参考-川.xlsx]人物属性&战力'!R[101]C[2] -> 9452
B43: ='\svn3\策划文档\=95 数值相关\[人物理论最高属性及战力参考-川.xlsx]人物属性&战力'!R[101]C[2] -> 130 | C43: ='\svn3\策划文档\=95 数值相关\[人物理论最高属性及战力参考-川.xlsx]人物属性&战力'!R[101]C[2] -> 3451 | D43: ='\svn3\策划文档\=95 数值相关\[人物理论最高属性及战力参考-川.xlsx]人物属性&战力'!R[101]C[2] -> 3001 | E43: ='\svn3\策划文档\=95 数值相关\[人物理论最高属性及战力参考-川.xlsx]人物属性&战力'!R[101]C[2] -> 7629 | F43: ='\svn3\策划文档\=95 数值相关\[人物理论最高属性及战力参考-川.xlsx]人物属性&战力'!R[101]C[2] -> 1375 | G43: ='\svn3\策划文档\=95 数值相关\[人物理论最高属性及战力参考-川.xlsx]人物属性&战力'!R[101]C[2] -> 748 | H43: ='\svn3\策划文档\=95 数值相关\[人物理论最高属性及战力参考-川.xlsx]人物属性&战力'!R[101]C[2] -> 10140
B44: ='\svn3\策划文档\=95 数值相关\[人物理论最高属性及战力参考-川.xlsx]人物属性&战力'!R[101]C[2] -> 131 | C44: ='\svn3\策划文档\=95 数值相关\[人物理论最高属性及战力参考-川.xlsx]人物属性&战力'!R[101]C[2] -> 3458 | D44: ='\svn3\策划文档\=95 数值相关\[人物理论最高属性及战力参考-川.xlsx]人物属性&战力'!R[101]C[2] -> 3007 | E44: ='\svn3\策划文档\=95 数值相关\[人物理论最高属性及战力参考-川.xlsx]人物属性&战力'!R[101]C[2] -> 7656 | F44: ='\svn3\策划文档\=95 数值相关\[人物理论最高属性及战力参考-川.xlsx]人物属性&战力'!R[101]C[2] -> 1379 | G44: ='\svn3\策划文档\=95 数值相关\[人物理论最高属性及战力参考-川.xlsx]人物属性&战力'!R[101]C[2] -> 750 | H44: ='\svn3\策划文档\=95 数值相关\[人物理论最高属性及战力参考-川.xlsx]人物属性&战力'!R[101]C[2] -> 10167
B45: ='\svn3\策划文档\=95 数值相关\[人物理论最高属性及战力参考-川.xlsx]人物属性&战力'!R[101]C[2] -> 132 | C45: ='\svn3\策划文档\=95 数值相关\[人物理论最高属性及战力参考-川.xlsx]人物属性&战力'!R[101]C[2] -> 3465 | D45: ='\svn3\策划文档\=95 数值相关\[人物理论最高属性及战力参考-川.xlsx]人物属性&战力'!R[101]C[2] -> 3013 | E45: ='\svn3\策划文档\=95 数值相关\[人物理论最高属性及战力参考-川.xlsx]人物属性&战力'!R[101]C[2] -> 7683 | F45: ='\svn3\策划文档\=95 数值相关\[人物理论最高属性及战力参考-川.xlsx]人物属性&战力'!R[101]C[2] -> 1383 | G45: ='\svn3\策划文档\=95 数值相关\[人物理论最高属性及战力参考-川.xlsx]人物属性&战力'!R[101]C[2] -> 752 | H45: ='\svn3\策划文档\=95 数值相关\[人物理论最高属性及战力参考-川.xlsx]人物属性&战力'!R[101]C[2] -> 10194
B46: ='\svn3\策划文档\=95 数值相关\[人物理论最高属性及战力参考-川.xlsx]人物属性&战力'!R[101]C[2] -> 133 | C46: ='\svn3\策划文档\=95 数值相关\[人物理论最高属性及战力参考-川.xlsx]人物属性&战力'!R[101]C[2] -> 3471 | D46: ='\svn3\策划文档\=95 数值相关\[人物理论最高属性及战力参考-川.xlsx]人物属性&战力'!R[101]C[2] -> 3019 | E46: ='\svn3\策划文档\=95 数值相关\[人物理论最高属性及战力参考-川.xlsx]人物属性&战力'!R[101]C[2] -> 7710 | F46: ='\svn3\策划文档\=95 数值相关\[人物理论最高属性及战力参考-川.xlsx]人物属性&战力'!R[101]C[2] -> 1388 | G46: ='\svn3\策划文档\=95 数值相关\[人物理论最高属性及战力参考-川.xlsx]人物属性&战力'!R[101]C[2] -> 754 | H46: ='\svn3\策划文档\=95 数值相关\[人物理论最高属性及战力参考-川.xlsx]人物属性&战力'!R[101]C[2] -> 10221
B47: ='\svn3\策划文档\=95 数值相关\[人物理论最高属性及战力参考-川.xlsx]人物属性&战力'!R[101]C[2] -> 134 | C47: ='\svn3\策划文档\=95 数值相关\[人物理论最高属性及战力参考-川.xlsx]人物属性&战力'!R[101]C[2] -> 3478 | D47: ='\svn3\策划文档\=95 数值相关\[人物理论最高属性及战力参考-川.xlsx]人物属性&战力'!R[101]C[2] -> 3025 | E47: ='\svn3\策划文档\=95 数值相关\[人物理论最高属性及战力参考-川.xlsx]人物属性&战力'!R[101]C[2] -> 7737 | F47: ='\svn3\策划文档\=95 数值相关\[人物理论最高属性及战力参考-川.xlsx]人物属性&战力'!R[101]C[2] -> 1392 | G47: ='\svn3\策划文档\=95 数值相关\[人物理论最高属性及战力参考-川.xlsx]人物属性&战力'!R[101]C[2] -> 756 | H47: ='\svn3\策划文档\=95 数值相关\[人物理论最高属性及战力参考-川.xlsx]人物属性&战力'!R[101]C[2] -> 10248
B48: ='\svn3\策划文档\=95 数值相关\[人物理论最高属性及战力参考-川.xlsx]人物属性&战力'!R[101]C[2] -> 135 | C48: ='\svn3\策划文档\=95 数值相关\[人物理论最高属性及战力参考-川.xlsx]人物属性&战力'!R[101]C[2] -> 3485 | D48: ='\svn3\策划文档\=95 数值相关\[人物理论最高属性及战力参考-川.xlsx]人物属性&战力'!R[101]C[2] -> 3031 | E48: ='\svn3\策划文档\=95 数值相关\[人物理论最高属性及战力参考-川.xlsx]人物属性&战力'!R[101]C[2] -> 7764 | F48: ='\svn3\策划文档\=95 数值相关\[人物理论最高属性及战力参考-川.xlsx]人物属性&战力'!R[101]C[2] -> 1397 | G48: ='\svn3\策划文档\=95 数值相关\[人物理论最高属性及战力参考-川.xlsx]人物属性&战力'!R[101]C[2] -> 758 | H48: ='\svn3\策划文档\=95 数值相关\[人物理论最高属性及战力参考-川.xlsx]人物属性&战力'!R[101]C[2] -> 10275
B49: ='\svn3\策划文档\=95 数值相关\[人物理论最高属性及战力参考-川.xlsx]人物属性&战力'!R[101]C[2] -> 136 | C49: ='\svn3\策划文档\=95 数值相关\[人物理论最高属性及战力参考-川.xlsx]人物属性&战力'!R[101]C[2] -> 3492 | D49: ='\svn3\策划文档\=95 数值相关\[人物理论最高属性及战力参考-川.xlsx]人物属性&战力'!R[101]C[2] -> 3037 | E49: ='\svn3\策划文档\=95 数值相关\[人物理论最高属性及战力参考-川.xlsx]人物属性&战力'!R[101]C[2] -> 7791 | F49: ='\svn3\策划文档\=95 数值相关\[人物理论最高属性及战力参考-川.xlsx]人物属性&战力'!R[101]C[2] -> 1400 | G49: ='\svn3\策划文档\=95 数值相关\[人物理论最高属性及战力参考-川.xlsx]人物属性&战力'!R[101]C[2] -> 760 | H49: ='\svn3\策划文档\=95 数值相关\[人物理论最高属性及战力参考-川.xlsx]人物属性&战力'!R[101]C[2] -> 10302
B50: ='\svn3\策划文档\=95 数值相关\[人物理论最高属性及战力参考-川.xlsx]人物属性&战力'!R[101]C[2] -> 137 | C50: ='\svn3\策划文档\=95 数值相关\[人物理论最高属性及战力参考-川.xlsx]人物属性&战力'!R[101]C[2] -> 3498 | D50: ='\svn3\策划文档\=95 数值相关\[人物理论最高属性及战力参考-川.xlsx]人物属性&战力'!R[101]C[2] -> 3043 | E50: ='\svn3\策划文档\=95 数值相关\[人物理论最高属性及战力参考-川.xlsx]人物属性&战力'!R[101]C[2] -> 7818 | F50: ='\svn3\策划文档\=95 数值相关\[人物理论最高属性及战力参考-川.xlsx]人物属性&战力'!R[101]C[2] -> 1405 | G50: ='\svn3\策划文档\=95 数值相关\[人物理论最高属性及战力参考-川.xlsx]人物属性&战力'!R[101]C[2] -> 762 | H50: ='\svn3\策划文档\=95 数值相关\[人物理论最高属性及战力参考-川.xlsx]人物属性&战力'!R[101]C[2] -> 10329
B51: ='\svn3\策划文档\=95 数值相关\[人物理论最高属性及战力参考-川.xlsx]人物属性&战力'!R[101]C[2] -> 138 | C51: ='\svn3\策划文档\=95 数值相关\[人物理论最高属性及战力参考-川.xlsx]人物属性&战力'!R[101]C[2] -> 3504 | D51: ='\svn3\策划文档\=95 数值相关\[人物理论最高属性及战力参考-川.xlsx]人物属性&战力'!R[101]C[2] -> 3049 | E51: ='\svn3\策划文档\=95 数值相关\[人物理论最高属性及战力参考-川.xlsx]人物属性&战力'!R[101]C[2] -> 7845 | F51: ='\svn3\策划文档\=95 数值相关\[人物理论最高属性及战力参考-川.xlsx]人物属性&战力'!R[101]C[2] -> 1410 | G51: ='\svn3\策划文档\=95 数值相关\[人物理论最高属性及战力参考-川.xlsx]人物属性&战力'!R[101]C[2] -> 764 | H51: ='\svn3\策划文档\=95 数值相关\[人物理论最高属性及战力参考-川.xlsx]人物属性&战力'!R[101]C[2] -> 10356
B52: ='\svn3\策划文档\=95 数值相关\[人物理论最高属性及战力参考-川.xlsx]人物属性&战力'!R[101]C[2] -> 139 | C52: ='\svn3\策划文档\=95 数值相关\[人物理论最高属性及战力参考-川.xlsx]人物属性&战力'!R[101]C[2] -> 3512 | D52: ='\svn3\策划文档\=95 数值相关\[人物理论最高属性及战力参考-川.xlsx]人物属性&战力'!R[101]C[2] -> 3055 | E52: ='\svn3\策划文档\=95 数值相关\[人物理论最高属性及战力参考-川.xlsx]人物属性&战力'!R[101]C[2] -> 7872 | F52: ='\svn3\策划文档\=95 数值相关\[人物理论最高属性及战力参考-川.xlsx]人物属性&战力'!R[101]C[2] -> 1414 | G52: ='\svn3\策划文档\=95 数值相关\[人物理论最高属性及战力参考-川.xlsx]人物属性&战力'!R[101]C[2] -> 766 | H52: ='\svn3\策划文档\=95 数值相关\[人物理论最高属性及战力参考-川.xlsx]人物属性&战力'!R[101]C[2] -> 10383
B53: ='\svn3\策划文档\=95 数值相关\[人物理论最高属性及战力参考-川.xlsx]人物属性&战力'!R[101]C[2] -> 140 | C53: ='\svn3\策划文档\=95 数值相关\[人物理论最高属性及战力参考-川.xlsx]人物属性&战力'!R[101]C[2] -> 3681 | D53: ='\svn3\策划文档\=95 数值相关\[人物理论最高属性及战力参考-川.xlsx]人物属性&战力'!R[101]C[2] -> 3197 | E53: ='\svn3\策划文档\=95 数值相关\[人物理论最高属性及战力参考-川.xlsx]人物属性&战力'!R[101]C[2] -> 8136 | F53: ='\svn3\策划文档\=95 数值相关\[人物理论最高属性及战力参考-川.xlsx]人物属性&战力'!R[101]C[2] -> 1469 | G53: ='\svn3\策划文档\=95 数值相关\[人物理论最高属性及战力参考-川.xlsx]人物属性&战力'!R[101]C[2] -> 801 | H53: ='\svn3\策划文档\=95 数值相关\[人物理论最高属性及战力参考-川.xlsx]人物属性&战力'!R[101]C[2] -> 11107
B54: ='\svn3\策划文档\=95 数值相关\[人物理论最高属性及战力参考-川.xlsx]人物属性&战力'!R[101]C[2] -> 141 | C54: ='\svn3\策划文档\=95 数值相关\[人物理论最高属性及战力参考-川.xlsx]人物属性&战力'!R[101]C[2] -> 3689 | D54: ='\svn3\策划文档\=95 数值相关\[人物理论最高属性及战力参考-川.xlsx]人物属性&战力'!R[101]C[2] -> 3203 | E54: ='\svn3\策划文档\=95 数值相关\[人物理论最高属性及战力参考-川.xlsx]人物属性&战力'!R[101]C[2] -> 8163 | F54: ='\svn3\策划文档\=95 数值相关\[人物理论最高属性及战力参考-川.xlsx]人物属性&战力'!R[101]C[2] -> 1473 | G54: ='\svn3\策划文档\=95 数值相关\[人物理论最高属性及战力参考-川.xlsx]人物属性&战力'!R[101]C[2] -> 803 | H54: ='\svn3\策划文档\=95 数值相关\[人物理论最高属性及战力参考-川.xlsx]人物属性&战力'!R[101]C[2] -> 11134
B55: ='\svn3\策划文档\=95 数值相关\[人物理论最高属性及战力参考-川.xlsx]人物属性&战力'!R[101]C[2] -> 142 | C55: ='\svn3\策划文档\=95 数值相关\[人物理论最高属性及战力参考-川.xlsx]人物属性&战力'!R[101]C[2] -> 3695 | D55: ='\svn3\策划文档\=95 数值相关\[人物理论最高属性及战力参考-川.xlsx]人物属性&战力'!R[101]C[2] -> 3209 | E55: ='\svn3\策划文档\=95 数值相关\[人物理论最高属性及战力参考-川.xlsx]人物属性&战力'!R[101]C[2] -> 8190 | F55: ='\svn3\策划文档\=95 数值相关\[人物理论最高属性及战力参考-川.xlsx]人物属性&战力'!R[101]C[2] -> 1478 | G55: ='\svn3\策划文档\=95 数值相关\[人物理论最高属性及战力参考-川.xlsx]人物属性&战力'!R[101]C[2] -> 805 | H55: ='\svn3\策划文档\=95 数值相关\[人物理论最高属性及战力参考-川.xlsx]人物属性&战力'!R[101]C[2] -> 11161
B56: ='\svn3\策划文档\=95 数值相关\[人物理论最高属性及战力参考-川.xlsx]人物属性&战力'!R[101]C[2] -> 143 | C56: ='\svn3\策划文档\=95 数值相关\[人物理论最高属性及战力参考-川.xlsx]人物属性&战力'!R[101]C[2] -> 3702 | D56: ='\svn3\策划文档\=95 数值相关\[人物理论最高属性及战力参考-川.xlsx]人物属性&战力'!R[101]C[2] -> 3215 | E56: ='\svn3\策划文档\=95 数值相关\[人物理论最高属性及战力参考-川.xlsx]人物属性&战力'!R[101]C[2] -> 8217 | F56: ='\svn3\策划文档\=95 数值相关\[人物理论最高属性及战力参考-川.xlsx]人物属性&战力'!R[101]C[2] -> 1483 | G56: ='\svn3\策划文档\=95 数值相关\[人物理论最高属性及战力参考-川.xlsx]人物属性&战力'!R[101]C[2] -> 807 | H56: ='\svn3\策划文档\=95 数值相关\[人物理论最高属性及战力参考-川.xlsx]人物属性&战力'!R[101]C[2] -> 11188
B57: ='\svn3\策划文档\=95 数值相关\[人物理论最高属性及战力参考-川.xlsx]人物属性&战力'!R[101]C[2] -> 144 | C57: ='\svn3\策划文档\=95 数值相关\[人物理论最高属性及战力参考-川.xlsx]人物属性&战力'!R[101]C[2] -> 3709 | D57: ='\svn3\策划文档\=95 数值相关\[人物理论最高属性及战力参考-川.xlsx]人物属性&战力'!R[101]C[2] -> 3221 | E57: ='\svn3\策划文档\=95 数值相关\[人物理论最高属性及战力参考-川.xlsx]人物属性&战力'!R[101]C[2] -> 8244 | F57: ='\svn3\策划文档\=95 数值相关\[人物理论最高属性及战力参考-川.xlsx]人物属性&战力'!R[101]C[2] -> 1487 | G57: ='\svn3\策划文档\=95 数值相关\[人物理论最高属性及战力参考-川.xlsx]人物属性&战力'!R[101]C[2] -> 809 | H57: ='\svn3\策划文档\=95 数值相关\[人物理论最高属性及战力参考-川.xlsx]人物属性&战力'!R[101]C[2] -> 11215
B58: ='\svn3\策划文档\=95 数值相关\[人物理论最高属性及战力参考-川.xlsx]人物属性&战力'!R[101]C[2] -> 145 | C58: ='\svn3\策划文档\=95 数值相关\[人物理论最高属性及战力参考-川.xlsx]人物属性&战力'!R[101]C[2] -> 3716 | D58: ='\svn3\策划文档\=95 数值相关\[人物理论最高属性及战力参考-川.xlsx]人物属性&战力'!R[101]C[2] -> 3227 | E58: ='\svn3\策划文档\=95 数值相关\[人物理论最高属性及战力参考-川.xlsx]人物属性&战力'!R[101]C[2] -> 8271 | F58: ='\svn3\策划文档\=95 数值相关\[人物理论最高属性及战力参考-川.xlsx]人物属性&战力'!R[101]C[2] -> 1492 | G58: ='\svn3\策划文档\=95 数值相关\[人物理论最高属性及战力参考-川.xlsx]人物属性&战力'!R[101]C[2] -> 811 | H58: ='\svn3\策划文档\=95 数值相关\[人物理论最高属性及战力参考-川.xlsx]人物属性&战力'!R[101]C[2] -> 11242
B59: ='\svn3\策划文档\=95 数值相关\[人物理论最高属性及战力参考-川.xlsx]人物属性&战力'!R[101]C[2] -> 146 | C59: ='\svn3\策划文档\=95 数值相关\[人物理论最高属性及战力参考-川.xlsx]人物属性&战力'!R[101]C[2] -> 3723 | D59: ='\svn3\策划文档\=95 数值相关\[人物理论最高属性及战力参考-川.xlsx]人物属性&战力'!R[101]C[2] -> 3233 | E59: ='\svn3\策划文档\=95 数值相关\[人物理论最高属性及战力参考-川.xlsx]人物属性&战力'!R[101]C[2] -> 8298 | F59: ='\svn3\策划文档\=95 数值相关\[人物理论最高属性及战力参考-川.xlsx]人物属性&战力'!R[101]C[2] -> 1495 | G59: ='\svn3\策划文档\=95 数值相关\[人物理论最高属性及战力参考-川.xlsx]人物属性&战力'!R[101]C[2] -> 813 | H59: ='\svn3\策划文档\=95 数值相关\[人物理论最高属性及战力参考-川.xlsx]人物属性&战力'!R[101]C[2] -> 11269
B60: ='\svn3\策划文档\=95 数值相关\[人物理论最高属性及战力参考-川.xlsx]人物属性&战力'!R[101]C[2] -> 147 | C60: ='\svn3\策划文档\=95 数值相关\[人物理论最高属性及战力参考-川.xlsx]人物属性&战力'!R[101]C[2] -> 3730 | D60: ='\svn3\策划文档\=95 数值相关\[人物理论最高属性及战力参考-川.xlsx]人物属性&战力'!R[101]C[2] -> 3239 | E60: ='\svn3\策划文档\=95 数值相关\[人物理论最高属性及战力参考-川.xlsx]人物属性&战力'!R[101]C[2] -> 8325 | F60: ='\svn3\策划文档\=95 数值相关\[人物理论最高属性及战力参考-川.xlsx]人物属性&战力'!R[101]C[2] -> 1500 | G60: ='\svn3\策划文档\=95 数值相关\[人物理论最高属性及战力参考-川.xlsx]人物属性&战力'!R[101]C[2] -> 815 | H60: ='\svn3\策划文档\=95 数值相关\[人物理论最高属性及战力参考-川.xlsx]人物属性&战力'!R[101]C[2] -> 11296
B61: ='\svn3\策划文档\=95 数值相关\[人物理论最高属性及战力参考-川.xlsx]人物属性&战力'!R[101]C[2] -> 148 | C61: ='\svn3\策划文档\=95 数值相关\[人物理论最高属性及战力参考-川.xlsx]人物属性&战力'!R[101]C[2] -> 3736 | D61: ='\svn3\策划文档\=95 数值相关\[人物理论最高属性及战力参考-川.xlsx]人物属性&战力'!R[101]C[2] -> 3245 | E61: ='\svn3\策划文档\=95 数值相关\[人物理论最高属性及战力参考-川.xlsx]人物属性&战力'!R[101]C[2] -> 8352 | F61: ='\svn3\策划文档\=95 数值相关\[人物理论最高属性及战力参考-川.xlsx]人物属性&战力'!R[101]C[2] -> 1505 | G61: ='\svn3\策划文档\=95 数值相关\[人物理论最高属性及战力参考-川.xlsx]人物属性&战力'!R[101]C[2] -> 817 | H61: ='\svn3\策划文档\=95 数值相关\[人物理论最高属性及战力参考-川.xlsx]人物属性&战力'!R[101]C[2] -> 11323
B62: ='\svn3\策划文档\=95 数值相关\[人物理论最高属性及战力参考-川.xlsx]人物属性&战力'!R[101]C[2] -> 149 | C62: ='\svn3\策划文档\=95 数值相关\[人物理论最高属性及战力参考-川.xlsx]人物属性&战力'!R[101]C[2] -> 3744 | D62: ='\svn3\策划文档\=95 数值相关\[人物理论最高属性及战力参考-川.xlsx]人物属性&战力'!R[101]C[2] -> 3251 | E62: ='\svn3\策划文档\=95 数值相关\[人物理论最高属性及战力参考-川.xlsx]人物属性&战力'!R[101]C[2] -> 8379 | F62: ='\svn3\策划文档\=95 数值相关\[人物理论最高属性及战力参考-川.xlsx]人物属性&战力'!R[101]C[2] -> 1509 | G62: ='\svn3\策划文档\=95 数值相关\[人物理论最高属性及战力参考-川.xlsx]人物属性&战力'!R[101]C[2] -> 819 | H62: ='\svn3\策划文档\=95 数值相关\[人物理论最高属性及战力参考-川.xlsx]人物属性&战力'!R[101]C[2] -> 11350
B63: ='\svn3\策划文档\=95 数值相关\[人物理论最高属性及战力参考-川.xlsx]人物属性&战力'!R[101]C[2] -> 150 | C63: ='\svn3\策划文档\=95 数值相关\[人物理论最高属性及战力参考-川.xlsx]人物属性&战力'!R[101]C[2] -> 3908 | D63: ='\svn3\策划文档\=95 数值相关\[人物理论最高属性及战力参考-川.xlsx]人物属性&战力'!R[101]C[2] -> 3393 | E63: ='\svn3\策划文档\=95 数值相关\[人物理论最高属性及战力参考-川.xlsx]人物属性&战力'!R[101]C[2] -> 8643 | F63: ='\svn3\策划文档\=95 数值相关\[人物理论最高属性及战力参考-川.xlsx]人物属性&战力'!R[101]C[2] -> 1570 | G63: ='\svn3\策划文档\=95 数值相关\[人物理论最高属性及战力参考-川.xlsx]人物属性&战力'!R[101]C[2] -> 849 | H63: ='\svn3\策划文档\=95 数值相关\[人物理论最高属性及战力参考-川.xlsx]人物属性&战力'!R[101]C[2] -> 12109 | J63: 0.9 | K63: 2 | L63: =RC[-9]*(RC11+1) -> 11724 | M63: =INT(RC[-9]*(RC11+1)*RC[-3]) -> 9161 | N63: =RC[-9]*(RC11+1) -> 25929 | O63: =RC[-9]*(RC11+1) -> 4710 | P63: =RC[-9]*(RC11+1) -> 2547 | Q63: =RC[-9]*(RC11+1) -> 36327
B64: ='\svn3\策划文档\=95 数值相关\[人物理论最高属性及战力参考-川.xlsx]人物属性&战力'!R[101]C[2] -> 151 | C64: ='\svn3\策划文档\=95 数值相关\[人物理论最高属性及战力参考-川.xlsx]人物属性&战力'!R[101]C[2] -> 3916 | D64: ='\svn3\策划文档\=95 数值相关\[人物理论最高属性及战力参考-川.xlsx]人物属性&战力'!R[101]C[2] -> 3400 | E64: ='\svn3\策划文档\=95 数值相关\[人物理论最高属性及战力参考-川.xlsx]人物属性&战力'!R[101]C[2] -> 8670 | F64: ='\svn3\策划文档\=95 数值相关\[人物理论最高属性及战力参考-川.xlsx]人物属性&战力'!R[101]C[2] -> 1574 | G64: ='\svn3\策划文档\=95 数值相关\[人物理论最高属性及战力参考-川.xlsx]人物属性&战力'!R[101]C[2] -> 851 | H64: ='\svn3\策划文档\=95 数值相关\[人物理论最高属性及战力参考-川.xlsx]人物属性&战力'!R[101]C[2] -> 12136
B65: ='\svn3\策划文档\=95 数值相关\[人物理论最高属性及战力参考-川.xlsx]人物属性&战力'!R[101]C[2] -> 152 | C65: ='\svn3\策划文档\=95 数值相关\[人物理论最高属性及战力参考-川.xlsx]人物属性&战力'!R[101]C[2] -> 3922 | D65: ='\svn3\策划文档\=95 数值相关\[人物理论最高属性及战力参考-川.xlsx]人物属性&战力'!R[101]C[2] -> 3406 | E65: ='\svn3\策划文档\=95 数值相关\[人物理论最高属性及战力参考-川.xlsx]人物属性&战力'!R[101]C[2] -> 8697 | F65: ='\svn3\策划文档\=95 数值相关\[人物理论最高属性及战力参考-川.xlsx]人物属性&战力'!R[101]C[2] -> 1579 | G65: ='\svn3\策划文档\=95 数值相关\[人物理论最高属性及战力参考-川.xlsx]人物属性&战力'!R[101]C[2] -> 853 | H65: ='\svn3\策划文档\=95 数值相关\[人物理论最高属性及战力参考-川.xlsx]人物属性&战力'!R[101]C[2] -> 12163
B66: ='\svn3\策划文档\=95 数值相关\[人物理论最高属性及战力参考-川.xlsx]人物属性&战力'!R[101]C[2] -> 153 | C66: ='\svn3\策划文档\=95 数值相关\[人物理论最高属性及战力参考-川.xlsx]人物属性&战力'!R[101]C[2] -> 3929 | D66: ='\svn3\策划文档\=95 数值相关\[人物理论最高属性及战力参考-川.xlsx]人物属性&战力'!R[101]C[2] -> 3412 | E66: ='\svn3\策划文档\=95 数值相关\[人物理论最高属性及战力参考-川.xlsx]人物属性&战力'!R[101]C[2] -> 8724 | F66: ='\svn3\策划文档\=95 数值相关\[人物理论最高属性及战力参考-川.xlsx]人物属性&战力'!R[101]C[2] -> 1583 | G66: ='\svn3\策划文档\=95 数值相关\[人物理论最高属性及战力参考-川.xlsx]人物属性&战力'!R[101]C[2] -> 855 | H66: ='\svn3\策划文档\=95 数值相关\[人物理论最高属性及战力参考-川.xlsx]人物属性&战力'!R[101]C[2] -> 12190
B67: ='\svn3\策划文档\=95 数值相关\[人物理论最高属性及战力参考-川.xlsx]人物属性&战力'!R[101]C[2] -> 154 | C67: ='\svn3\策划文档\=95 数值相关\[人物理论最高属性及战力参考-川.xlsx]人物属性&战力'!R[101]C[2] -> 3937 | D67: ='\svn3\策划文档\=95 数值相关\[人物理论最高属性及战力参考-川.xlsx]人物属性&战力'!R[101]C[2] -> 3418 | E67: ='\svn3\策划文档\=95 数值相关\[人物理论最高属性及战力参考-川.xlsx]人物属性&战力'!R[101]C[2] -> 8751 | F67: ='\svn3\策划文档\=95 数值相关\[人物理论最高属性及战力参考-川.xlsx]人物属性&战力'!R[101]C[2] -> 1587 | G67: ='\svn3\策划文档\=95 数值相关\[人物理论最高属性及战力参考-川.xlsx]人物属性&战力'!R[101]C[2] -> 857 | H67: ='\svn3\策划文档\=95 数值相关\[人物理论最高属性及战力参考-川.xlsx]人物属性&战力'!R[101]C[2] -> 12217
B68: ='\svn3\策划文档\=95 数值相关\[人物理论最高属性及战力参考-川.xlsx]人物属性&战力'!R[101]C[2] -> 155 | C68: ='\svn3\策划文档\=95 数值相关\[人物理论最高属性及战力参考-川.xlsx]人物属性&战力'!R[101]C[2] -> 3944 | D68: ='\svn3\策划文档\=95 数值相关\[人物理论最高属性及战力参考-川.xlsx]人物属性&战力'!R[101]C[2] -> 3424 | E68: ='\svn3\策划文档\=95 数值相关\[人物理论最高属性及战力参考-川.xlsx]人物属性&战力'!R[101]C[2] -> 8778 | F68: ='\svn3\策划文档\=95 数值相关\[人物理论最高属性及战力参考-川.xlsx]人物属性&战力'!R[101]C[2] -> 1592 | G68: ='\svn3\策划文档\=95 数值相关\[人物理论最高属性及战力参考-川.xlsx]人物属性&战力'!R[101]C[2] -> 859 | H68: ='\svn3\策划文档\=95 数值相关\[人物理论最高属性及战力参考-川.xlsx]人物属性&战力'!R[101]C[2] -> 12244
B69: ='\svn3\策划文档\=95 数值相关\[人物理论最高属性及战力参考-川.xlsx]人物属性&战力'!R[101]C[2] -> 156 | C69: ='\svn3\策划文档\=95 数值相关\[人物理论最高属性及战力参考-川.xlsx]人物属性&战力'!R[101]C[2] -> 3951 | D69: ='\svn3\策划文档\=95 数值相关\[人物理论最高属性及战力参考-川.xlsx]人物属性&战力'!R[101]C[2] -> 3431 | E69: ='\svn3\策划文档\=95 数值相关\[人物理论最高属性及战力参考-川.xlsx]人物属性&战力'!R[101]C[2] -> 8805 | F69: ='\svn3\策划文档\=95 数值相关\[人物理论最高属性及战力参考-川.xlsx]人物属性&战力'!R[101]C[2] -> 1596 | G69: ='\svn3\策划文档\=95 数值相关\[人物理论最高属性及战力参考-川.xlsx]人物属性&战力'!R[101]C[2] -> 861 | H69: ='\svn3\策划文档\=95 数值相关\[人物理论最高属性及战力参考-川.xlsx]人物属性&战力'!R[101]C[2] -> 12271
B70: ='\svn3\策划文档\=95 数值相关\[人物理论最高属性及战力参考-川.xlsx]人物属性&战力'!R[101]C[2] -> 157 | C70: ='\svn3\策划文档\=95 数值相关\[人物理论最高属性及战力参考-川.xlsx]人物属性&战力'!R[101]C[2] -> 3958 | D70: ='\svn3\策划文档\=95 数值相关\[人物理论最高属性及战力参考-川.xlsx]人物属性&战力'!R[101]C[2] -> 3437 | E70: ='\svn3\策划文档\=95 数值相关\[人物理论最高属性及战力参考-川.xlsx]人物属性&战力'!R[101]C[2] -> 8832 | F70: ='\svn3\策划文档\=95 数值相关\[人物理论最高属性及战力参考-川.xlsx]人物属性&战力'!R[101]C[2] -> 1601 | G70: ='\svn3\策划文档\=95 数值相关\[人物理论最高属性及战力参考-川.xlsx]人物属性&战力'!R[101]C[2] -> 863 | H70: ='\svn3\策划文档\=95 数值相关\[人物理论最高属性及战力参考-川.xlsx]人物属性&战力'!R[101]C[2] -> 12298
B71: ='\svn3\策划文档\=95 数值相关\[人物理论最高属性及战力参考-川.xlsx]人物属性&战力'!R[101]C[2] -> 158 | C71: ='\svn3\策划文档\=95 数值相关\[人物理论最高属性及战力参考-川.xlsx]人物属性&战力'!R[101]C[2] -> 3965 | D71: ='\svn3\策划文档\=95 数值相关\[人物理论最高属性及战力参考-川.xlsx]人物属性&战力'!R[101]C[2] -> 3443 | E71: ='\svn3\策划文档\=95 数值相关\[人物理论最高属性及战力参考-川.xlsx]人物属性&战力'!R[101]C[2] -> 8859 | F71: ='\svn3\策划文档\=95 数值相关\[人物理论最高属性及战力参考-川.xlsx]人物属性&战力'!R[101]C[2] -> 1606 | G71: ='\svn3\策划文档\=95 数值相关\[人物理论最高属性及战力参考-川.xlsx]人物属性&战力'!R[101]C[2] -> 865 | H71: ='\svn3\策划文档\=95 数值相关\[人物理论最高属性及战力参考-川.xlsx]人物属性&战力'!R[101]C[2] -> 12325
B72: ='\svn3\策划文档\=95 数值相关\[人物理论最高属性及战力参考-川.xlsx]人物属性&战力'!R[101]C[2] -> 159 | C72: ='\svn3\策划文档\=95 数值相关\[人物理论最高属性及战力参考-川.xlsx]人物属性&战力'!R[101]C[2] -> 3972 | D72: ='\svn3\策划文档\=95 数值相关\[人物理论最高属性及战力参考-川.xlsx]人物属性&战力'!R[101]C[2] -> 3449 | E72: ='\svn3\策划文档\=95 数值相关\[人物理论最高属性及战力参考-川.xlsx]人物属性&战力'!R[101]C[2] -> 8886 | F72: ='\svn3\策划文档\=95 数值相关\[人物理论最高属性及战力参考-川.xlsx]人物属性&战力'!R[101]C[2] -> 1610 | G72: ='\svn3\策划文档\=95 数值相关\[人物理论最高属性及战力参考-川.xlsx]人物属性&战力'!R[101]C[2] -> 867 | H72: ='\svn3\策划文档\=95 数值相关\[人物理论最高属性及战力参考-川.xlsx]人物属性&战力'!R[101]C[2] -> 12352
B73: ='\svn3\策划文档\=95 数值相关\[人物理论最高属性及战力参考-川.xlsx]人物属性&战力'!R[101]C[2] -> 160 | C73: ='\svn3\策划文档\=95 数值相关\[人物理论最高属性及战力参考-川.xlsx]人物属性&战力'!R[101]C[2] -> 4137 | D73: ='\svn3\策划文档\=95 数值相关\[人物理论最高属性及战力参考-川.xlsx]人物属性&战力'!R[101]C[2] -> 3592 | E73: ='\svn3\策划文档\=95 数值相关\[人物理论最高属性及战力参考-川.xlsx]人物属性&战力'!R[101]C[2] -> 9150 | F73: ='\svn3\策划文档\=95 数值相关\[人物理论最高属性及战力参考-川.xlsx]人物属性&战力'!R[101]C[2] -> 1666 | G73: ='\svn3\策划文档\=95 数值相关\[人物理论最高属性及战力参考-川.xlsx]人物属性&战力'!R[101]C[2] -> 898 | H73: ='\svn3\策划文档\=95 数值相关\[人物理论最高属性及战力参考-川.xlsx]人物属性&战力'!R[101]C[2] -> 13146
B74: ='\svn3\策划文档\=95 数值相关\[人物理论最高属性及战力参考-川.xlsx]人物属性&战力'!R[101]C[2] -> 161 | C74: ='\svn3\策划文档\=95 数值相关\[人物理论最高属性及战力参考-川.xlsx]人物属性&战力'!R[101]C[2] -> 4145 | D74: ='\svn3\策划文档\=95 数值相关\[人物理论最高属性及战力参考-川.xlsx]人物属性&战力'!R[101]C[2] -> 3598 | E74: ='\svn3\策划文档\=95 数值相关\[人物理论最高属性及战力参考-川.xlsx]人物属性&战力'!R[101]C[2] -> 9177 | F74: ='\svn3\策划文档\=95 数值相关\[人物理论最高属性及战力参考-川.xlsx]人物属性&战力'!R[101]C[2] -> 1670 | G74: ='\svn3\策划文档\=95 数值相关\[人物理论最高属性及战力参考-川.xlsx]人物属性&战力'!R[101]C[2] -> 900 | H74: ='\svn3\策划文档\=95 数值相关\[人物理论最高属性及战力参考-川.xlsx]人物属性&战力'!R[101]C[2] -> 13173
B75: ='\svn3\策划文档\=95 数值相关\[人物理论最高属性及战力参考-川.xlsx]人物属性&战力'!R[101]C[2] -> 162 | C75: ='\svn3\策划文档\=95 数值相关\[人物理论最高属性及战力参考-川.xlsx]人物属性&战力'!R[101]C[2] -> 4152 | D75: ='\svn3\策划文档\=95 数值相关\[人物理论最高属性及战力参考-川.xlsx]人物属性&战力'!R[101]C[2] -> 3604 | E75: ='\svn3\策划文档\=95 数值相关\[人物理论最高属性及战力参考-川.xlsx]人物属性&战力'!R[101]C[2] -> 9204 | F75: ='\svn3\策划文档\=95 数值相关\[人物理论最高属性及战力参考-川.xlsx]人物属性&战力'!R[101]C[2] -> 1675 | G75: ='\svn3\策划文档\=95 数值相关\[人物理论最高属性及战力参考-川.xlsx]人物属性&战力'!R[101]C[2] -> 902 | H75: ='\svn3\策划文档\=95 数值相关\[人物理论最高属性及战力参考-川.xlsx]人物属性&战力'!R[101]C[2] -> 13200
B76: ='\svn3\策划文档\=95 数值相关\[人物理论最高属性及战力参考-川.xlsx]人物属性&战力'!R[101]C[2] -> 163 | C76: ='\svn3\策划文档\=95 数值相关\[人物理论最高属性及战力参考-川.xlsx]人物属性&战力'!R[101]C[2] -> 4159 | D76: ='\svn3\策划文档\=95 数值相关\[人物理论最高属性及战力参考-川.xlsx]人物属性&战力'!R[101]C[2] -> 3611 | E76: ='\svn3\策划文档\=95 数值相关\[人物理论最高属性及战力参考-川.xlsx]人物属性&战力'!R[101]C[2] -> 9231 | F76: ='\svn3\策划文档\=95 数值相关\[人物理论最高属性及战力参考-川.xlsx]人物属性&战力'!R[101]C[2] -> 1680 | G76: ='\svn3\策划文档\=95 数值相关\[人物理论最高属性及战力参考-川.xlsx]人物属性&战力'!R[101]C[2] -> 904 | H76: ='\svn3\策划文档\=95 数值相关\[人物理论最高属性及战力参考-川.xlsx]人物属性&战力'!R[101]C[2] -> 13227
B77: ='\svn3\策划文档\=95 数值相关\[人物理论最高属性及战力参考-川.xlsx]人物属性&战力'!R[101]C[2] -> 164 | C77: ='\svn3\策划文档\=95 数值相关\[人物理论最高属性及战力参考-川.xlsx]人物属性&战力'!R[101]C[2] -> 4167 | D77: ='\svn3\策划文档\=95 数值相关\[人物理论最高属性及战力参考-川.xlsx]人物属性&战力'!R[101]C[2] -> 3617 | E77: ='\svn3\策划文档\=95 数值相关\[人物理论最高属性及战力参考-川.xlsx]人物属性&战力'!R[101]C[2] -> 9258 | F77: ='\svn3\策划文档\=95 数值相关\[人物理论最高属性及战力参考-川.xlsx]人物属性&战力'!R[101]C[2] -> 1684 | G77: ='\svn3\策划文档\=95 数值相关\[人物理论最高属性及战力参考-川.xlsx]人物属性&战力'!R[101]C[2] -> 906 | H77: ='\svn3\策划文档\=95 数值相关\[人物理论最高属性及战力参考-川.xlsx]人物属性&战力'!R[101]C[2] -> 13254
B78: ='\svn3\策划文档\=95 数值相关\[人物理论最高属性及战力参考-川.xlsx]人物属性&战力'!R[101]C[2] -> 165 | C78: ='\svn3\策划文档\=95 数值相关\[人物理论最高属性及战力参考-川.xlsx]人物属性&战力'!R[101]C[2] -> 4174 | D78: ='\svn3\策划文档\=95 数值相关\[人物理论最高属性及战力参考-川.xlsx]人物属性&战力'!R[101]C[2] -> 3623 | E78: ='\svn3\策划文档\=95 数值相关\[人物理论最高属性及战力参考-川.xlsx]人物属性&战力'!R[101]C[2] -> 9285 | F78: ='\svn3\策划文档\=95 数值相关\[人物理论最高属性及战力参考-川.xlsx]人物属性&战力'!R[101]C[2] -> 1689 | G78: ='\svn3\策划文档\=95 数值相关\[人物理论最高属性及战力参考-川.xlsx]人物属性&战力'!R[101]C[2] -> 908 | H78: ='\svn3\策划文档\=95 数值相关\[人物理论最高属性及战力参考-川.xlsx]人物属性&战力'!R[101]C[2] -> 13281
B79: ='\svn3\策划文档\=95 数值相关\[人物理论最高属性及战力参考-川.xlsx]人物属性&战力'!R[101]C[2] -> 166 | C79: ='\svn3\策划文档\=95 数值相关\[人物理论最高属性及战力参考-川.xlsx]人物属性&战力'!R[101]C[2] -> 4181 | D79: ='\svn3\策划文档\=95 数值相关\[人物理论最高属性及战力参考-川.xlsx]人物属性&战力'!R[101]C[2] -> 3630 | E79: ='\svn3\策划文档\=95 数值相关\[人物理论最高属性及战力参考-川.xlsx]人物属性&战力'!R[101]C[2] -> 9312 | F79: ='\svn3\策划文档\=95 数值相关\[人物理论最高属性及战力参考-川.xlsx]人物属性&战力'!R[101]C[2] -> 1693 | G79: ='\svn3\策划文档\=95 数值相关\[人物理论最高属性及战力参考-川.xlsx]人物属性&战力'!R[101]C[2] -> 910 | H79: ='\svn3\策划文档\=95 数值相关\[人物理论最高属性及战力参考-川.xlsx]人物属性&战力'!R[101]C[2] -> 13308
B80: ='\svn3\策划文档\=95 数值相关\[人物理论最高属性及战力参考-川.xlsx]人物属性&战力'!R[101]C[2] -> 167 | C80: ='\svn3\策划文档\=95 数值相关\[人物理论最高属性及战力参考-川.xlsx]人物属性&战力'!R[101]C[2] -> 4188 | D80: ='\svn3\策划文档\=95 数值相关\[人物理论最高属性及战力参考-川.xlsx]人物属性&战力'!R[101]C[2] -> 3636 | E80: ='\svn3\策划文档\=95 数值相关\[人物理论最高属性及战力参考-川.xlsx]人物属性&战力'!R[101]C[2] -> 9339 | F80: ='\svn3\策划文档\=95 数值相关\[人物理论最高属性及战力参考-川.xlsx]人物属性&战力'!R[101]C[2] -> 1698 | G80: ='\svn3\策划文档\=95 数值相关\[人物理论最高属性及战力参考-川.xlsx]人物属性&战力'!R[101]C[2] -> 912 | H80: ='\svn3\策划文档\=95 数值相关\[人物理论最高属性及战力参考-川.xlsx]人物属性&战力'!R[101]C[2] -> 13335
B81: ='\svn3\策划文档\=95 数值相关\[人物理论最高属性及战力参考-川.xlsx]人物属性&战力'!R[101]C[2] -> 168 | C81: ='\svn3\策划文档\=95 数值相关\[人物理论最高属性及战力参考-川.xlsx]人物属性&战力'!R[101]C[2] -> 4195 | D81: ='\svn3\策划文档\=95 数值相关\[人物理论最高属性及战力参考-川.xlsx]人物属性&战力'!R[101]C[2] -> 3642 | E81: ='\svn3\策划文档\=95 数值相关\[人物理论最高属性及战力参考-川.xlsx]人物属性&战力'!R[101]C[2] -> 9366 | F81: ='\svn3\策划文档\=95 数值相关\[人物理论最高属性及战力参考-川.xlsx]人物属性&战力'!R[101]C[2] -> 1703 | G81: ='\svn3\策划文档\=95 数值相关\[人物理论最高属性及战力参考-川.xlsx]人物属性&战力'!R[101]C[2] -> 914 | H81: ='\svn3\策划文档\=95 数值相关\[人物理论最高属性及战力参考-川.xlsx]人物属性&战力'!R[101]C[2] -> 13362
B82: ='\svn3\策划文档\=95 数值相关\[人物理论最高属性及战力参考-川.xlsx]人物属性&战力'!R[101]C[2] -> 169 | C82: ='\svn3\策划文档\=95 数值相关\[人物理论最高属性及战力参考-川.xlsx]人物属性&战力'!R[101]C[2] -> 4203 | D82: ='\svn3\策划文档\=95 数值相关\[人物理论最高属性及战力参考-川.xlsx]人物属性&战力'!R[101]C[2] -> 3649 | E82: ='\svn3\策划文档\=95 数值相关\[人物理论最高属性及战力参考-川.xlsx]人物属性&战力'!R[101]C[2] -> 9393 | F82: ='\svn3\策划文档\=95 数值相关\[人物理论最高属性及战力参考-川.xlsx]人物属性&战力'!R[101]C[2] -> 1707 | G82: ='\svn3\策划文档\=95 数值相关\[人物理论最高属性及战力参考-川.xlsx]人物属性&战力'!R[101]C[2] -> 916 | H82: ='\svn3\策划文档\=95 数值相关\[人物理论最高属性及战力参考-川.xlsx]人物属性&战力'!R[101]C[2] -> 13389
B83: ='\svn3\策划文档\=95 数值相关\[人物理论最高属性及战力参考-川.xlsx]人物属性&战力'!R[101]C[2] -> 170 | C83: ='\svn3\策划文档\=95 数值相关\[人物理论最高属性及战力参考-川.xlsx]人物属性&战力'!R[101]C[2] -> 4373 | D83: ='\svn3\策划文档\=95 数值相关\[人物理论最高属性及战力参考-川.xlsx]人物属性&战力'!R[101]C[2] -> 3791 | E83: ='\svn3\策划文档\=95 数值相关\[人物理论最高属性及战力参考-川.xlsx]人物属性&战力'!R[101]C[2] -> 9658 | F83: ='\svn3\策划文档\=95 数值相关\[人物理论最高属性及战力参考-川.xlsx]人物属性&战力'!R[101]C[2] -> 1764 | G83: ='\svn3\策划文档\=95 数值相关\[人物理论最高属性及战力参考-川.xlsx]人物属性&战力'!R[101]C[2] -> 946 | H83: ='\svn3\策划文档\=95 数值相关\[人物理论最高属性及战力参考-川.xlsx]人物属性&战力'!R[101]C[2] -> 14216
B84: ='\svn3\策划文档\=95 数值相关\[人物理论最高属性及战力参考-川.xlsx]人物属性&战力'!R[101]C[2] -> 171 | C84: ='\svn3\策划文档\=95 数值相关\[人物理论最高属性及战力参考-川.xlsx]人物属性&战力'!R[101]C[2] -> 4381 | D84: ='\svn3\策划文档\=95 数值相关\[人物理论最高属性及战力参考-川.xlsx]人物属性&战力'!R[101]C[2] -> 3798 | E84: ='\svn3\策划文档\=95 数值相关\[人物理论最高属性及战力参考-川.xlsx]人物属性&战力'!R[101]C[2] -> 9685 | F84: ='\svn3\策划文档\=95 数值相关\[人物理论最高属性及战力参考-川.xlsx]人物属性&战力'!R[101]C[2] -> 1768 | G84: ='\svn3\策划文档\=95 数值相关\[人物理论最高属性及战力参考-川.xlsx]人物属性&战力'!R[101]C[2] -> 948 | H84: ='\svn3\策划文档\=95 数值相关\[人物理论最高属性及战力参考-川.xlsx]人物属性&战力'!R[101]C[2] -> 14243
B85: ='\svn3\策划文档\=95 数值相关\[人物理论最高属性及战力参考-川.xlsx]人物属性&战力'!R[101]C[2] -> 172 | C85: ='\svn3\策划文档\=95 数值相关\[人物理论最高属性及战力参考-川.xlsx]人物属性&战力'!R[101]C[2] -> 4388 | D85: ='\svn3\策划文档\=95 数值相关\[人物理论最高属性及战力参考-川.xlsx]人物属性&战力'!R[101]C[2] -> 3804 | E85: ='\svn3\策划文档\=95 数值相关\[人物理论最高属性及战力参考-川.xlsx]人物属性&战力'!R[101]C[2] -> 9712 | F85: ='\svn3\策划文档\=95 数值相关\[人物理论最高属性及战力参考-川.xlsx]人物属性&战力'!R[101]C[2] -> 1773 | G85: ='\svn3\策划文档\=95 数值相关\[人物理论最高属性及战力参考-川.xlsx]人物属性&战力'!R[101]C[2] -> 950 | H85: ='\svn3\策划文档\=95 数值相关\[人物理论最高属性及战力参考-川.xlsx]人物属性&战力'!R[101]C[2] -> 14270
B86: ='\svn3\策划文档\=95 数值相关\[人物理论最高属性及战力参考-川.xlsx]人物属性&战力'!R[101]C[2] -> 173 | C86: ='\svn3\策划文档\=95 数值相关\[人物理论最高属性及战力参考-川.xlsx]人物属性&战力'!R[101]C[2] -> 4395 | D86: ='\svn3\策划文档\=95 数值相关\[人物理论最高属性及战力参考-川.xlsx]人物属性&战力'!R[101]C[2] -> 3811 | E86: ='\svn3\策划文档\=95 数值相关\[人物理论最高属性及战力参考-川.xlsx]人物属性&战力'!R[101]C[2] -> 9739 | F86: ='\svn3\策划文档\=95 数值相关\[人物理论最高属性及战力参考-川.xlsx]人物属性&战力'!R[101]C[2] -> 1778 | G86: ='\svn3\策划文档\=95 数值相关\[人物理论最高属性及战力参考-川.xlsx]人物属性&战力'!R[101]C[2] -> 952 | H86: ='\svn3\策划文档\=95 数值相关\[人物理论最高属性及战力参考-川.xlsx]人物属性&战力'!R[101]C[2] -> 14297
B87: ='\svn3\策划文档\=95 数值相关\[人物理论最高属性及战力参考-川.xlsx]人物属性&战力'!R[101]C[2] -> 174 | C87: ='\svn3\策划文档\=95 数值相关\[人物理论最高属性及战力参考-川.xlsx]人物属性&战力'!R[101]C[2] -> 4403 | D87: ='\svn3\策划文档\=95 数值相关\[人物理论最高属性及战力参考-川.xlsx]人物属性&战力'!R[101]C[2] -> 3817 | E87: ='\svn3\策划文档\=95 数值相关\[人物理论最高属性及战力参考-川.xlsx]人物属性&战力'!R[101]C[2] -> 9766 | F87: ='\svn3\策划文档\=95 数值相关\[人物理论最高属性及战力参考-川.xlsx]人物属性&战力'!R[101]C[2] -> 1782 | G87: ='\svn3\策划文档\=95 数值相关\[人物理论最高属性及战力参考-川.xlsx]人物属性&战力'!R[101]C[2] -> 954 | H87: ='\svn3\策划文档\=95 数值相关\[人物理论最高属性及战力参考-川.xlsx]人物属性&战力'!R[101]C[2] -> 14324
B88: ='\svn3\策划文档\=95 数值相关\[人物理论最高属性及战力参考-川.xlsx]人物属性&战力'!R[101]C[2] -> 175 | C88: ='\svn3\策划文档\=95 数值相关\[人物理论最高属性及战力参考-川.xlsx]人物属性&战力'!R[101]C[2] -> 4411 | D88: ='\svn3\策划文档\=95 数值相关\[人物理论最高属性及战力参考-川.xlsx]人物属性&战力'!R[101]C[2] -> 3824 | E88: ='\svn3\策划文档\=95 数值相关\[人物理论最高属性及战力参考-川.xlsx]人物属性&战力'!R[101]C[2] -> 9793 | F88: ='\svn3\策划文档\=95 数值相关\[人物理论最高属性及战力参考-川.xlsx]人物属性&战力'!R[101]C[2] -> 1788 | G88: ='\svn3\策划文档\=95 数值相关\[人物理论最高属性及战力参考-川.xlsx]人物属性&战力'!R[101]C[2] -> 956 | H88: ='\svn3\策划文档\=95 数值相关\[人物理论最高属性及战力参考-川.xlsx]人物属性&战力'!R[101]C[2] -> 14351
B89: ='\svn3\策划文档\=95 数值相关\[人物理论最高属性及战力参考-川.xlsx]人物属性&战力'!R[101]C[2] -> 176 | C89: ='\svn3\策划文档\=95 数值相关\[人物理论最高属性及战力参考-川.xlsx]人物属性&战力'!R[101]C[2] -> 4419 | D89: ='\svn3\策划文档\=95 数值相关\[人物理论最高属性及战力参考-川.xlsx]人物属性&战力'!R[101]C[2] -> 3830 | E89: ='\svn3\策划文档\=95 数值相关\[人物理论最高属性及战力参考-川.xlsx]人物属性&战力'!R[101]C[2] -> 9820 | F89: ='\svn3\策划文档\=95 数值相关\[人物理论最高属性及战力参考-川.xlsx]人物属性&战力'!R[101]C[2] -> 1792 | G89: ='\svn3\策划文档\=95 数值相关\[人物理论最高属性及战力参考-川.xlsx]人物属性&战力'!R[101]C[2] -> 958 | H89: ='\svn3\策划文档\=95 数值相关\[人物理论最高属性及战力参考-川.xlsx]人物属性&战力'!R[101]C[2] -> 14378
B90: ='\svn3\策划文档\=95 数值相关\[人物理论最高属性及战力参考-川.xlsx]人物属性&战力'!R[101]C[2] -> 177 | C90: ='\svn3\策划文档\=95 数值相关\[人物理论最高属性及战力参考-川.xlsx]人物属性&战力'!R[101]C[2] -> 4426 | D90: ='\svn3\策划文档\=95 数值相关\[人物理论最高属性及战力参考-川.xlsx]人物属性&战力'!R[101]C[2] -> 3837 | E90: ='\svn3\策划文档\=95 数值相关\[人物理论最高属性及战力参考-川.xlsx]人物属性&战力'!R[101]C[2] -> 9847 | F90: ='\svn3\策划文档\=95 数值相关\[人物理论最高属性及战力参考-川.xlsx]人物属性&战力'!R[101]C[2] -> 1797 | G90: ='\svn3\策划文档\=95 数值相关\[人物理论最高属性及战力参考-川.xlsx]人物属性&战力'!R[101]C[2] -> 960 | H90: ='\svn3\策划文档\=95 数值相关\[人物理论最高属性及战力参考-川.xlsx]人物属性&战力'!R[101]C[2] -> 14405

Sheet: Sheet5
B3: 序号 | C3: 系数 | D3: 难度增量 | F3: 攻击 | G3: 防御 | H3: 气血 | I3: 灵力 | J3: 速度 | K3: 法力 | M3: 系数
B4: 1 | C4: 0 | D4: 1 | F4: =ROUND(RC13*R[999]C,0) -> 59 | G4: =ROUND(RC13*R[999]C,0) -> 46 | H4: =ROUND(RC13*R[999]C,0) -> 130 | I4: =ROUND(RC13*R[999]C,0) -> 24 | J4: =ROUND(RC13*R[999]C,0) -> 13 | K4: =ROUND(RC13*R[999]C,0) -> 182 | M4: 5.0000000000000001E-3 | R4: =INDIRECT("f"&RC[-16]+3) -> 59 | T4: 攻击 | U4: 防御 | V4: 气血 | W4: 灵力 | X4: 速度 | Y4: 法力
B5: 1 | C5: =R[-1]C+RC[1] -> 1 | D5: 1 | F5: =ROUND((R1003C-R4C)/(R1003C3)*RC3,0)+R4C -> 71 | G5: =ROUND((R1003C-R4C)/(R1003C3)*RC3,0)+R4C -> 55 | H5: =ROUND((R1003C-R4C)/(R1003C3)*RC3,0)+R4C -> 156 | I5: =ROUND((R1003C-R4C)/(R1003C3)*RC3,0)+R4C -> 29 | J5: =ROUND((R1003C-R4C)/(R1003C3)*RC3,0)+R4C -> 16 | K5: =ROUND((R1003C-R4C)/(R1003C3)*RC3,0)+R4C -> 218 | O5: =RC[-4]-R[-1]C[-4] -> 36 | R5: =INDIRECT("f"&RC[-16]+3) -> 59 | T5: =RC[-14]-R[-1]C[-14] -> 12 | U5: =RC[-14]-R[-1]C[-14] -> 9 | V5: =RC[-14]-R[-1]C[-14] -> 26 | W5: =RC[-14]-R[-1]C[-14] -> 5 | X5: =RC[-14]-R[-1]C[-14] -> 3 | Y5: =RC[-14]-R[-1]C[-14] -> 36
B6: 1 | C6: =R[-1]C+RC[1] -> 2 | D6: 1 | F6: =ROUND((R1003C-R4C)/(R1003C3)*RC3,0)+R4C -> 82 | G6: =ROUND((R1003C-R4C)/(R1003C3)*RC3,0)+R4C -> 64 | H6: =ROUND((R1003C-R4C)/(R1003C3)*RC3,0)+R4C -> 182 | I6: =ROUND((R1003C-R4C)/(R1003C3)*RC3,0)+R4C -> 33 | J6: =ROUND((R1003C-R4C)/(R1003C3)*RC3,0)+R4C -> 18 | K6: =ROUND((R1003C-R4C)/(R1003C3)*RC3,0)+R4C -> 254 | O6: =RC[-4]-R[-1]C[-4] -> 36 | P6: =RC[-1]-R[-1]C[-1] -> 0 | R6: =INDIRECT("f"&RC[-16]+3) -> 59
B7: =R[-3]C+1 -> 2 | C7: =R[-1]C+RC[1] -> 3 | D7: 1 | F7: =ROUND((R1003C-R4C)/(R1003C3)*RC3,0)+R4C -> 94 | G7: =ROUND((R1003C-R4C)/(R1003C3)*RC3,0)+R4C -> 73 | H7: =ROUND((R1003C-R4C)/(R1003C3)*RC3,0)+R4C -> 207 | I7: =ROUND((R1003C-R4C)/(R1003C3)*RC3,0)+R4C -> 38 | J7: =ROUND((R1003C-R4C)/(R1003C3)*RC3,0)+R4C -> 21 | K7: =ROUND((R1003C-R4C)/(R1003C3)*RC3,0)+R4C -> 291 | O7: =RC[-4]-R[-1]C[-4] -> 37 | P7: =RC[-1]-R[-1]C[-1] -> 1 | R7: =INDIRECT("f"&RC[-16]+3) -> 71
B8: =R[-3]C+1 -> 2 | C8: =R[-1]C+RC[1] -> 4 | D8: 1 | F8: =ROUND((R1003C-R4C)/(R1003C3)*RC3,0)+R4C -> 106 | G8: =ROUND((R1003C-R4C)/(R1003C3)*RC3,0)+R4C -> 82 | H8: =ROUND((R1003C-R4C)/(R1003C3)*RC3,0)+R4C -> 233 | I8: =ROUND((R1003C-R4C)/(R1003C3)*RC3,0)+R4C -> 43 | J8: =ROUND((R1003C-R4C)/(R1003C3)*RC3,0)+R4C -> 23 | K8: =ROUND((R1003C-R4C)/(R1003C3)*RC3,0)+R4C -> 327 | O8: =RC[-4]-R[-1]C[-4] -> 36 | P8: =RC[-1]-R[-1]C[-1] -> -1 | R8: =INDIRECT("f"&RC[-16]+3) -> 71
B9: =R[-3]C+1 -> 2 | C9: =R[-1]C+RC[1] -> 5 | D9: 1 | F9: =ROUND((R1003C-R4C)/(R1003C3)*RC3,0)+R4C -> 117 | G9: =ROUND((R1003C-R4C)/(R1003C3)*RC3,0)+R4C -> 92 | H9: =ROUND((R1003C-R4C)/(R1003C3)*RC3,0)+R4C -> 259 | I9: =ROUND((R1003C-R4C)/(R1003C3)*RC3,0)+R4C -> 47 | J9: =ROUND((R1003C-R4C)/(R1003C3)*RC3,0)+R4C -> 26 | K9: =ROUND((R1003C-R4C)/(R1003C3)*RC3,0)+R4C -> 363 | O9: =RC[-4]-R[-1]C[-4] -> 36 | P9: =RC[-1]-R[-1]C[-1] -> 0 | R9: =INDIRECT("f"&RC[-16]+3) -> 71
B10: =R[-3]C+1 -> 3 | C10: =R[-1]C+RC[1] -> 6 | D10: 1 | F10: =ROUND((R1003C-R4C)/(R1003C3)*RC3,0)+R4C -> 129 | G10: =ROUND((R1003C-R4C)/(R1003C3)*RC3,0)+R4C -> 101 | H10: =ROUND((R1003C-R4C)/(R1003C3)*RC3,0)+R4C -> 285 | I10: =ROUND((R1003C-R4C)/(R1003C3)*RC3,0)+R4C -> 52 | J10: =ROUND((R1003C-R4C)/(R1003C3)*RC3,0)+R4C -> 28 | K10: =ROUND((R1003C-R4C)/(R1003C3)*RC3,0)+R4C -> 399 | O10: =RC[-4]-R[-1]C[-4] -> 36 | P10: =RC[-1]-R[-1]C[-1] -> 0 | R10: =INDIRECT("f"&RC[-16]+3) -> 82
B11: =R[-3]C+1 -> 3 | C11: =R[-1]C+RC[1] -> 7 | D11: 1 | F11: =ROUND((R1003C-R4C)/(R1003C3)*RC3,0)+R4C -> 141 | G11: =ROUND((R1003C-R4C)/(R1003C3)*RC3,0)+R4C -> 110 | H11: =ROUND((R1003C-R4C)/(R1003C3)*RC3,0)+R4C -> 311 | I11: =ROUND((R1003C-R4C)/(R1003C3)*RC3,0)+R4C -> 57 | J11: =ROUND((R1003C-R4C)/(R1003C3)*RC3,0)+R4C -> 31 | K11: =ROUND((R1003C-R4C)/(R1003C3)*RC3,0)+R4C -> 435 | O11: =RC[-4]-R[-1]C[-4] -> 36 | P11: =RC[-1]-R[-1]C[-1] -> 0 | R11: =INDIRECT("f"&RC[-16]+3) -> 82
B12: =R[-3]C+1 -> 3 | C12: =R[-1]C+RC[1] -> 8 | D12: 1 | F12: =ROUND((R1003C-R4C)/(R1003C3)*RC3,0)+R4C -> 152 | G12: =ROUND((R1003C-R4C)/(R1003C3)*RC3,0)+R4C -> 119 | H12: =ROUND((R1003C-R4C)/(R1003C3)*RC3,0)+R4C -> 337 | I12: =ROUND((R1003C-R4C)/(R1003C3)*RC3,0)+R4C -> 62 | J12: =ROUND((R1003C-R4C)/(R1003C3)*RC3,0)+R4C -> 33 | K12: =ROUND((R1003C-R4C)/(R1003C3)*RC3,0)+R4C -> 471 | O12: =RC[-4]-R[-1]C[-4] -> 36 | P12: =RC[-1]-R[-1]C[-1] -> 0 | R12: =INDIRECT("f"&RC[-16]+3) -> 82
B13: =R[-3]C+1 -> 4 | C13: =R[-1]C+RC[1] -> 9 | D13: 1 | F13: =ROUND((R1003C-R4C)/(R1003C3)*RC3,0)+R4C -> 164 | G13: =ROUND((R1003C-R4C)/(R1003C3)*RC3,0)+R4C -> 128 | H13: =ROUND((R1003C-R4C)/(R1003C3)*RC3,0)+R4C -> 362 | I13: =ROUND((R1003C-R4C)/(R1003C3)*RC3,0)+R4C -> 66 | J13: =ROUND((R1003C-R4C)/(R1003C3)*RC3,0)+R4C -> 36 | K13: =ROUND((R1003C-R4C)/(R1003C3)*RC3,0)+R4C -> 508 | O13: =RC[-4]-R[-1]C[-4] -> 37 | P13: =RC[-1]-R[-1]C[-1] -> 1 | R13: =INDIRECT("f"&RC[-16]+3) -> 94
B14: =R[-3]C+1 -> 4 | C14: =R[-1]C+RC[1] -> 10 | D14: 1 | F14: =ROUND((R1003C-R4C)/(R1003C3)*RC3,0)+R4C -> 176 | G14: =ROUND((R1003C-R4C)/(R1003C3)*RC3,0)+R4C -> 137 | H14: =ROUND((R1003C-R4C)/(R1003C3)*RC3,0)+R4C -> 388 | I14: =ROUND((R1003C-R4C)/(R1003C3)*RC3,0)+R4C -> 71 | J14: =ROUND((R1003C-R4C)/(R1003C3)*RC3,0)+R4C -> 38 | K14: =ROUND((R1003C-R4C)/(R1003C3)*RC3,0)+R4C -> 544 | O14: =RC[-4]-R[-1]C[-4] -> 36 | P14: =RC[-1]-R[-1]C[-1] -> -1 | R14: =INDIRECT("f"&RC[-16]+3) -> 94
B15: =R[-3]C+1 -> 4 | C15: =R[-1]C+RC[1] -> 11 | D15: 1 | F15: =ROUND((R1003C-R4C)/(R1003C3)*RC3,0)+R4C -> 187 | G15: =ROUND((R1003C-R4C)/(R1003C3)*RC3,0)+R4C -> 146 | H15: =ROUND((R1003C-R4C)/(R1003C3)*RC3,0)+R4C -> 414 | I15: =ROUND((R1003C-R4C)/(R1003C3)*RC3,0)+R4C -> 76 | J15: =ROUND((R1003C-R4C)/(R1003C3)*RC3,0)+R4C -> 41 | K15: =ROUND((R1003C-R4C)/(R1003C3)*RC3,0)+R4C -> 580 | O15: =RC[-4]-R[-1]C[-4] -> 36 | P15: =RC[-1]-R[-1]C[-1] -> 0 | R15: =INDIRECT("f"&RC[-16]+3) -> 94
B16: =R[-3]C+1 -> 5 | C16: =R[-1]C+RC[1] -> 12 | D16: 1 | F16: =ROUND((R1003C-R4C)/(R1003C3)*RC3,0)+R4C -> 199 | G16: =ROUND((R1003C-R4C)/(R1003C3)*RC3,0)+R4C -> 155 | H16: =ROUND((R1003C-R4C)/(R1003C3)*RC3,0)+R4C -> 440 | I16: =ROUND((R1003C-R4C)/(R1003C3)*RC3,0)+R4C -> 80 | J16: =ROUND((R1003C-R4C)/(R1003C3)*RC3,0)+R4C -> 43 | K16: =ROUND((R1003C-R4C)/(R1003C3)*RC3,0)+R4C -> 616 | O16: =RC[-4]-R[-1]C[-4] -> 36 | P16: =RC[-1]-R[-1]C[-1] -> 0 | R16: =INDIRECT("f"&RC[-16]+3) -> 106
B17: =R[-3]C+1 -> 5 | C17: =R[-1]C+RC[1] -> 13 | D17: 1 | F17: =ROUND((R1003C-R4C)/(R1003C3)*RC3,0)+R4C -> 211 | G17: =ROUND((R1003C-R4C)/(R1003C3)*RC3,0)+R4C -> 165 | H17: =ROUND((R1003C-R4C)/(R1003C3)*RC3,0)+R4C -> 466 | I17: =ROUND((R1003C-R4C)/(R1003C3)*RC3,0)+R4C -> 85 | J17: =ROUND((R1003C-R4C)/(R1003C3)*RC3,0)+R4C -> 46 | K17: =ROUND((R1003C-R4C)/(R1003C3)*RC3,0)+R4C -> 652 | O17: =RC[-4]-R[-1]C[-4] -> 36 | P17: =RC[-1]-R[-1]C[-1] -> 0
B18: =R[-3]C+1 -> 5 | C18: =R[-1]C+RC[1] -> 14 | D18: 1 | F18: =ROUND((R1003C-R4C)/(R1003C3)*RC3,0)+R4C -> 222 | G18: =ROUND((R1003C-R4C)/(R1003C3)*RC3,0)+R4C -> 174 | H18: =ROUND((R1003C-R4C)/(R1003C3)*RC3,0)+R4C -> 492 | I18: =ROUND((R1003C-R4C)/(R1003C3)*RC3,0)+R4C -> 90 | J18: =ROUND((R1003C-R4C)/(R1003C3)*RC3,0)+R4C -> 49 | K18: =ROUND((R1003C-R4C)/(R1003C3)*RC3,0)+R4C -> 689 | O18: =RC[-4]-R[-1]C[-4] -> 37 | P18: =RC[-1]-R[-1]C[-1] -> 1
B19: =R[-3]C+1 -> 6 | C19: =R[-1]C+RC[1] -> 15 | D19: 1 | F19: =ROUND((R1003C-R4C)/(R1003C3)*RC3,0)+R4C -> 234 | G19: =ROUND((R1003C-R4C)/(R1003C3)*RC3,0)+R4C -> 183 | H19: =ROUND((R1003C-R4C)/(R1003C3)*RC3,0)+R4C -> 517 | I19: =ROUND((R1003C-R4C)/(R1003C3)*RC3,0)+R4C -> 94 | J19: =ROUND((R1003C-R4C)/(R1003C3)*RC3,0)+R4C -> 51 | K19: =ROUND((R1003C-R4C)/(R1003C3)*RC3,0)+R4C -> 725 | O19: =RC[-4]-R[-1]C[-4] -> 36 | P19: =RC[-1]-R[-1]C[-1] -> -1
B20: =R[-3]C+1 -> 6 | C20: =R[-1]C+RC[1] -> 16 | D20: 1 | F20: =ROUND((R1003C-R4C)/(R1003C3)*RC3,0)+R4C -> 246 | G20: =ROUND((R1003C-R4C)/(R1003C3)*RC3,0)+R4C -> 192 | H20: =ROUND((R1003C-R4C)/(R1003C3)*RC3,0)+R4C -> 543 | I20: =ROUND((R1003C-R4C)/(R1003C3)*RC3,0)+R4C -> 99 | J20: =ROUND((R1003C-R4C)/(R1003C3)*RC3,0)+R4C -> 54 | K20: =ROUND((R1003C-R4C)/(R1003C3)*RC3,0)+R4C -> 761 | O20: =RC[-4]-R[-1]C[-4] -> 36 | P20: =RC[-1]-R[-1]C[-1] -> 0
B21: =R[-3]C+1 -> 6 | C21: =R[-1]C+RC[1] -> 17 | D21: 1 | F21: =ROUND((R1003C-R4C)/(R1003C3)*RC3,0)+R4C -> 258 | G21: =ROUND((R1003C-R4C)/(R1003C3)*RC3,0)+R4C -> 201 | H21: =ROUND((R1003C-R4C)/(R1003C3)*RC3,0)+R4C -> 569 | I21: =ROUND((R1003C-R4C)/(R1003C3)*RC3,0)+R4C -> 104 | J21: =ROUND((R1003C-R4C)/(R1003C3)*RC3,0)+R4C -> 56 | K21: =ROUND((R1003C-R4C)/(R1003C3)*RC3,0)+R4C -> 797 | O21: =RC[-4]-R[-1]C[-4] -> 36 | P21: =RC[-1]-R[-1]C[-1] -> 0
B22: =R[-3]C+1 -> 7 | C22: =R[-1]C+RC[1] -> 18 | D22: 1 | F22: =ROUND((R1003C-R4C)/(R1003C3)*RC3,0)+R4C -> 269 | G22: =ROUND((R1003C-R4C)/(R1003C3)*RC3,0)+R4C -> 210 | H22: =ROUND((R1003C-R4C)/(R1003C3)*RC3,0)+R4C -> 595 | I22: =ROUND((R1003C-R4C)/(R1003C3)*RC3,0)+R4C -> 108 | J22: =ROUND((R1003C-R4C)/(R1003C3)*RC3,0)+R4C -> 59 | K22: =ROUND((R1003C-R4C)/(R1003C3)*RC3,0)+R4C -> 833 | O22: =RC[-4]-R[-1]C[-4] -> 36 | P22: =RC[-1]-R[-1]C[-1] -> 0
B23: =R[-3]C+1 -> 7 | C23: =R[-1]C+RC[1] -> 19 | D23: 1 | F23: =ROUND((R1003C-R4C)/(R1003C3)*RC3,0)+R4C -> 281 | G23: =ROUND((R1003C-R4C)/(R1003C3)*RC3,0)+R4C -> 219 | H23: =ROUND((R1003C-R4C)/(R1003C3)*RC3,0)+R4C -> 621 | I23: =ROUND((R1003C-R4C)/(R1003C3)*RC3,0)+R4C -> 113 | J23: =ROUND((R1003C-R4C)/(R1003C3)*RC3,0)+R4C -> 61 | K23: =ROUND((R1003C-R4C)/(R1003C3)*RC3,0)+R4C -> 869 | O23: =RC[-4]-R[-1]C[-4] -> 36 | P23: =RC[-1]-R[-1]C[-1] -> 0
B24: =R[-3]C+1 -> 7 | C24: =R[-1]C+RC[1] -> 20 | D24: 1 | F24: =ROUND((R1003C-R4C)/(R1003C3)*RC3,0)+R4C -> 293 | G24: =ROUND((R1003C-R4C)/(R1003C3)*RC3,0)+R4C -> 228 | H24: =ROUND((R1003C-R4C)/(R1003C3)*RC3,0)+R4C -> 646 | I24: =ROUND((R1003C-R4C)/(R1003C3)*RC3,0)+R4C -> 118 | J24: =ROUND((R1003C-R4C)/(R1003C3)*RC3,0)+R4C -> 64 | K24: =ROUND((R1003C-R4C)/(R1003C3)*RC3,0)+R4C -> 906 | O24: =RC[-4]-R[-1]C[-4] -> 37 | P24: =RC[-1]-R[-1]C[-1] -> 1
B25: =R[-3]C+1 -> 8 | C25: =R[-1]C+RC[1] -> 21 | D25: 1 | F25: =ROUND((R1003C-R4C)/(R1003C3)*RC3,0)+R4C -> 304 | G25: =ROUND((R1003C-R4C)/(R1003C3)*RC3,0)+R4C -> 238 | H25: =ROUND((R1003C-R4C)/(R1003C3)*RC3,0)+R4C -> 672 | I25: =ROUND((R1003C-R4C)/(R1003C3)*RC3,0)+R4C -> 123 | J25: =ROUND((R1003C-R4C)/(R1003C3)*RC3,0)+R4C -> 66 | K25: =ROUND((R1003C-R4C)/(R1003C3)*RC3,0)+R4C -> 942 | O25: =RC[-4]-R[-1]C[-4] -> 36 | P25: =RC[-1]-R[-1]C[-1] -> -1
B26: =R[-3]C+1 -> 8 | C26: =R[-1]C+RC[1] -> 22 | D26: 1 | F26: =ROUND((R1003C-R4C)/(R1003C3)*RC3,0)+R4C -> 316 | G26: =ROUND((R1003C-R4C)/(R1003C3)*RC3,0)+R4C -> 247 | H26: =ROUND((R1003C-R4C)/(R1003C3)*RC3,0)+R4C -> 698 | I26: =ROUND((R1003C-R4C)/(R1003C3)*RC3,0)+R4C -> 127 | J26: =ROUND((R1003C-R4C)/(R1003C3)*RC3,0)+R4C -> 69 | K26: =ROUND((R1003C-R4C)/(R1003C3)*RC3,0)+R4C -> 978 | O26: =RC[-4]-R[-1]C[-4] -> 36 | P26: =RC[-1]-R[-1]C[-1] -> 0
B27: =R[-3]C+1 -> 8 | C27: =R[-1]C+RC[1] -> 23 | D27: 1 | F27: =ROUND((R1003C-R4C)/(R1003C3)*RC3,0)+R4C -> 328 | G27: =ROUND((R1003C-R4C)/(R1003C3)*RC3,0)+R4C -> 256 | H27: =ROUND((R1003C-R4C)/(R1003C3)*RC3,0)+R4C -> 724 | I27: =ROUND((R1003C-R4C)/(R1003C3)*RC3,0)+R4C -> 132 | J27: =ROUND((R1003C-R4C)/(R1003C3)*RC3,0)+R4C -> 71 | K27: =ROUND((R1003C-R4C)/(R1003C3)*RC3,0)+R4C -> 1014 | O27: =RC[-4]-R[-1]C[-4] -> 36 | P27: =RC[-1]-R[-1]C[-1] -> 0
B28: =R[-3]C+1 -> 9 | C28: =R[-1]C+RC[1] -> 24 | D28: 1 | F28: =ROUND((R1003C-R4C)/(R1003C3)*RC3,0)+R4C -> 339 | G28: =ROUND((R1003C-R4C)/(R1003C3)*RC3,0)+R4C -> 265 | H28: =ROUND((R1003C-R4C)/(R1003C3)*RC3,0)+R4C -> 750 | I28: =ROUND((R1003C-R4C)/(R1003C3)*RC3,0)+R4C -> 137 | J28: =ROUND((R1003C-R4C)/(R1003C3)*RC3,0)+R4C -> 74 | K28: =ROUND((R1003C-R4C)/(R1003C3)*RC3,0)+R4C -> 1050 | O28: =RC[-4]-R[-1]C[-4] -> 36 | P28: =RC[-1]-R[-1]C[-1] -> 0
B29: =R[-3]C+1 -> 9 | C29: =R[-1]C+RC[1] -> 25 | D29: 1 | F29: =ROUND((R1003C-R4C)/(R1003C3)*RC3,0)+R4C -> 351 | G29: =ROUND((R1003C-R4C)/(R1003C3)*RC3,0)+R4C -> 274 | H29: =ROUND((R1003C-R4C)/(R1003C3)*RC3,0)+R4C -> 776 | I29: =ROUND((R1003C-R4C)/(R1003C3)*RC3,0)+R4C -> 141 | J29: =ROUND((R1003C-R4C)/(R1003C3)*RC3,0)+R4C -> 76 | K29: =ROUND((R1003C-R4C)/(R1003C3)*RC3,0)+R4C -> 1087 | O29: =RC[-4]-R[-1]C[-4] -> 37 | P29: =RC[-1]-R[-1]C[-1] -> 1
B30: =R[-3]C+1 -> 9 | C30: =R[-1]C+RC[1] -> 26 | D30: 1 | F30: =ROUND((R1003C-R4C)/(R1003C3)*RC3,0)+R4C -> 363 | G30: =ROUND((R1003C-R4C)/(R1003C3)*RC3,0)+R4C -> 283 | H30: =ROUND((R1003C-R4C)/(R1003C3)*RC3,0)+R4C -> 801 | I30: =ROUND((R1003C-R4C)/(R1003C3)*RC3,0)+R4C -> 146 | J30: =ROUND((R1003C-R4C)/(R1003C3)*RC3,0)+R4C -> 79 | K30: =ROUND((R1003C-R4C)/(R1003C3)*RC3,0)+R4C -> 1123 | O30: =RC[-4]-R[-1]C[-4] -> 36 | P30: =RC[-1]-R[-1]C[-1] -> -1
B31: =R[-3]C+1 -> 10 | C31: =R[-1]C+RC[1] -> 27 | D31: 1 | F31: =ROUND((R1003C-R4C)/(R1003C3)*RC3,0)+R4C -> 374 | G31: =ROUND((R1003C-R4C)/(R1003C3)*RC3,0)+R4C -> 292 | H31: =ROUND((R1003C-R4C)/(R1003C3)*RC3,0)+R4C -> 827 | I31: =ROUND((R1003C-R4C)/(R1003C3)*RC3,0)+R4C -> 151 | J31: =ROUND((R1003C-R4C)/(R1003C3)*RC3,0)+R4C -> 81 | K31: =ROUND((R1003C-R4C)/(R1003C3)*RC3,0)+R4C -> 1159 | O31: =RC[-4]-R[-1]C[-4] -> 36 | P31: =RC[-1]-R[-1]C[-1] -> 0
B32: =R[-3]C+1 -> 10 | C32: =R[-1]C+RC[1] -> 28 | D32: 1 | F32: =ROUND((R1003C-R4C)/(R1003C3)*RC3,0)+R4C -> 386 | G32: =ROUND((R1003C-R4C)/(R1003C3)*RC3,0)+R4C -> 301 | H32: =ROUND((R1003C-R4C)/(R1003C3)*RC3,0)+R4C -> 853 | I32: =ROUND((R1003C-R4C)/(R1003C3)*RC3,0)+R4C -> 155 | J32: =ROUND((R1003C-R4C)/(R1003C3)*RC3,0)+R4C -> 84 | K32: =ROUND((R1003C-R4C)/(R1003C3)*RC3,0)+R4C -> 1195 | O32: =RC[-4]-R[-1]C[-4] -> 36 | P32: =RC[-1]-R[-1]C[-1] -> 0
B33: =R[-3]C+1 -> 10 | C33: =R[-1]C+RC[1] -> 29 | D33: 1 | F33: =ROUND((R1003C-R4C)/(R1003C3)*RC3,0)+R4C -> 398 | G33: =ROUND((R1003C-R4C)/(R1003C3)*RC3,0)+R4C -> 311 | H33: =ROUND((R1003C-R4C)/(R1003C3)*RC3,0)+R4C -> 879 | I33: =ROUND((R1003C-R4C)/(R1003C3)*RC3,0)+R4C -> 160 | J33: =ROUND((R1003C-R4C)/(R1003C3)*RC3,0)+R4C -> 87 | K33: =ROUND((R1003C-R4C)/(R1003C3)*RC3,0)+R4C -> 1231 | O33: =RC[-4]-R[-1]C[-4] -> 36 | P33: =RC[-1]-R[-1]C[-1] -> 0
B34: =R[-3]C+1 -> 11 | C34: =R[-1]C+RC[1] -> 30 | D34: 1 | F34: =ROUND((R1003C-R4C)/(R1003C3)*RC3,0)+R4C -> 409 | G34: =ROUND((R1003C-R4C)/(R1003C3)*RC3,0)+R4C -> 320 | H34: =ROUND((R1003C-R4C)/(R1003C3)*RC3,0)+R4C -> 905 | I34: =ROUND((R1003C-R4C)/(R1003C3)*RC3,0)+R4C -> 165 | J34: =ROUND((R1003C-R4C)/(R1003C3)*RC3,0)+R4C -> 89 | K34: =ROUND((R1003C-R4C)/(R1003C3)*RC3,0)+R4C -> 1267 | O34: =RC[-4]-R[-1]C[-4] -> 36 | P34: =RC[-1]-R[-1]C[-1] -> 0
B35: =R[-3]C+1 -> 11 | C35: =R[-1]C+RC[1] -> 31 | D35: 1 | F35: =ROUND((R1003C-R4C)/(R1003C3)*RC3,0)+R4C -> 421 | G35: =ROUND((R1003C-R4C)/(R1003C3)*RC3,0)+R4C -> 329 | H35: =ROUND((R1003C-R4C)/(R1003C3)*RC3,0)+R4C -> 931 | I35: =ROUND((R1003C-R4C)/(R1003C3)*RC3,0)+R4C -> 169 | J35: =ROUND((R1003C-R4C)/(R1003C3)*RC3,0)+R4C -> 92 | K35: =ROUND((R1003C-R4C)/(R1003C3)*RC3,0)+R4C -> 1304 | O35: =RC[-4]-R[-1]C[-4] -> 37 | P35: =RC[-1]-R[-1]C[-1] -> 1
B36: =R[-3]C+1 -> 11 | C36: =R[-1]C+RC[1] -> 32 | D36: 1 | F36: =ROUND((R1003C-R4C)/(R1003C3)*RC3,0)+R4C -> 433 | G36: =ROUND((R1003C-R4C)/(R1003C3)*RC3,0)+R4C -> 338 | H36: =ROUND((R1003C-R4C)/(R1003C3)*RC3,0)+R4C -> 956 | I36: =ROUND((R1003C-R4C)/(R1003C3)*RC3,0)+R4C -> 174 | J36: =ROUND((R1003C-R4C)/(R1003C3)*RC3,0)+R4C -> 94 | K36: =ROUND((R1003C-R4C)/(R1003C3)*RC3,0)+R4C -> 1340 | O36: =RC[-4]-R[-1]C[-4] -> 36 | P36: =RC[-1]-R[-1]C[-1] -> -1
B37: =R[-3]C+1 -> 12 | C37: =R[-1]C+RC[1] -> 33 | D37: 1 | F37: =ROUND((R1003C-R4C)/(R1003C3)*RC3,0)+R4C -> 444 | G37: =ROUND((R1003C-R4C)/(R1003C3)*RC3,0)+R4C -> 347 | H37: =ROUND((R1003C-R4C)/(R1003C3)*RC3,0)+R4C -> 982 | I37: =ROUND((R1003C-R4C)/(R1003C3)*RC3,0)+R4C -> 179 | J37: =ROUND((R1003C-R4C)/(R1003C3)*RC3,0)+R4C -> 97 | K37: =ROUND((R1003C-R4C)/(R1003C3)*RC3,0)+R4C -> 1376 | O37: =RC[-4]-R[-1]C[-4] -> 36 | P37: =RC[-1]-R[-1]C[-1] -> 0
B38: =R[-3]C+1 -> 12 | C38: =R[-1]C+RC[1] -> 34 | D38: 1 | F38: =ROUND((R1003C-R4C)/(R1003C3)*RC3,0)+R4C -> 456 | G38: =ROUND((R1003C-R4C)/(R1003C3)*RC3,0)+R4C -> 356 | H38: =ROUND((R1003C-R4C)/(R1003C3)*RC3,0)+R4C -> 1008 | I38: =ROUND((R1003C-R4C)/(R1003C3)*RC3,0)+R4C -> 183 | J38: =ROUND((R1003C-R4C)/(R1003C3)*RC3,0)+R4C -> 99 | K38: =ROUND((R1003C-R4C)/(R1003C3)*RC3,0)+R4C -> 1412 | O38: =RC[-4]-R[-1]C[-4] -> 36 | P38: =RC[-1]-R[-1]C[-1] -> 0
B39: =R[-3]C+1 -> 12 | C39: =R[-1]C+RC[1] -> 35 | D39: 1 | F39: =ROUND((R1003C-R4C)/(R1003C3)*RC3,0)+R4C -> 468 | G39: =ROUND((R1003C-R4C)/(R1003C3)*RC3,0)+R4C -> 365 | H39: =ROUND((R1003C-R4C)/(R1003C3)*RC3,0)+R4C -> 1034 | I39: =ROUND((R1003C-R4C)/(R1003C3)*RC3,0)+R4C -> 188 | J39: =ROUND((R1003C-R4C)/(R1003C3)*RC3,0)+R4C -> 102 | K39: =ROUND((R1003C-R4C)/(R1003C3)*RC3,0)+R4C -> 1448 | O39: =RC[-4]-R[-1]C[-4] -> 36 | P39: =RC[-1]-R[-1]C[-1] -> 0
B40: =R[-3]C+1 -> 13 | C40: =R[-1]C+RC[1] -> 36 | D40: 1 | F40: =ROUND((R1003C-R4C)/(R1003C3)*RC3,0)+R4C -> 479 | G40: =ROUND((R1003C-R4C)/(R1003C3)*RC3,0)+R4C -> 374 | H40: =ROUND((R1003C-R4C)/(R1003C3)*RC3,0)+R4C -> 1060 | I40: =ROUND((R1003C-R4C)/(R1003C3)*RC3,0)+R4C -> 193 | J40: =ROUND((R1003C-R4C)/(R1003C3)*RC3,0)+R4C -> 104 | K40: =ROUND((R1003C-R4C)/(R1003C3)*RC3,0)+R4C -> 1485 | O40: =RC[-4]-R[-1]C[-4] -> 37 | P40: =RC[-1]-R[-1]C[-1] -> 1
B41: =R[-3]C+1 -> 13 | C41: =R[-1]C+RC[1] -> 37 | D41: 1 | F41: =ROUND((R1003C-R4C)/(R1003C3)*RC3,0)+R4C -> 491 | G41: =ROUND((R1003C-R4C)/(R1003C3)*RC3,0)+R4C -> 384 | H41: =ROUND((R1003C-R4C)/(R1003C3)*RC3,0)+R4C -> 1086 | I41: =ROUND((R1003C-R4C)/(R1003C3)*RC3,0)+R4C -> 198 | J41: =ROUND((R1003C-R4C)/(R1003C3)*RC3,0)+R4C -> 107 | K41: =ROUND((R1003C-R4C)/(R1003C3)*RC3,0)+R4C -> 1521 | O41: =RC[-4]-R[-1]C[-4] -> 36 | P41: =RC[-1]-R[-1]C[-1] -> -1
B42: =R[-3]C+1 -> 13 | C42: =R[-1]C+RC[1] -> 38 | D42: 1 | F42: =ROUND((R1003C-R4C)/(R1003C3)*RC3,0)+R4C -> 503 | G42: =ROUND((R1003C-R4C)/(R1003C3)*RC3,0)+R4C -> 393 | H42: =ROUND((R1003C-R4C)/(R1003C3)*RC3,0)+R4C -> 1111 | I42: =ROUND((R1003C-R4C)/(R1003C3)*RC3,0)+R4C -> 202 | J42: =ROUND((R1003C-R4C)/(R1003C3)*RC3,0)+R4C -> 109 | K42: =ROUND((R1003C-R4C)/(R1003C3)*RC3,0)+R4C -> 1557 | O42: =RC[-4]-R[-1]C[-4] -> 36 | P42: =RC[-1]-R[-1]C[-1] -> 0
B43: =R[-3]C+1 -> 14 | C43: =R[-1]C+RC[1] -> 39 | D43: 1 | F43: =ROUND((R1003C-R4C)/(R1003C3)*RC3,0)+R4C -> 514 | G43: =ROUND((R1003C-R4C)/(R1003C3)*RC3,0)+R4C -> 402 | H43: =ROUND((R1003C-R4C)/(R1003C3)*RC3,0)+R4C -> 1137 | I43: =ROUND((R1003C-R4C)/(R1003C3)*RC3,0)+R4C -> 207 | J43: =ROUND((R1003C-R4C)/(R1003C3)*RC3,0)+R4C -> 112 | K43: =ROUND((R1003C-R4C)/(R1003C3)*RC3,0)+R4C -> 1593 | O43: =RC[-4]-R[-1]C[-4] -> 36 | P43: =RC[-1]-R[-1]C[-1] -> 0
B44: =R[-3]C+1 -> 14 | C44: =R[-1]C+RC[1] -> 40 | D44: 1 | F44: =ROUND((R1003C-R4C)/(R1003C3)*RC3,0)+R4C -> 526 | G44: =ROUND((R1003C-R4C)/(R1003C3)*RC3,0)+R4C -> 411 | H44: =ROUND((R1003C-R4C)/(R1003C3)*RC3,0)+R4C -> 1163 | I44: =ROUND((R1003C-R4C)/(R1003C3)*RC3,0)+R4C -> 212 | J44: =ROUND((R1003C-R4C)/(R1003C3)*RC3,0)+R4C -> 114 | K44: =ROUND((R1003C-R4C)/(R1003C3)*RC3,0)+R4C -> 1629 | O44: =RC[-4]-R[-1]C[-4] -> 36 | P44: =RC[-1]-R[-1]C[-1] -> 0
B45: =R[-3]C+1 -> 14 | C45: =R[-1]C+RC[1] -> 41 | D45: 1 | F45: =ROUND((R1003C-R4C)/(R1003C3)*RC3,0)+R4C -> 538 | G45: =ROUND((R1003C-R4C)/(R1003C3)*RC3,0)+R4C -> 420 | H45: =ROUND((R1003C-R4C)/(R1003C3)*RC3,0)+R4C -> 1189 | I45: =ROUND((R1003C-R4C)/(R1003C3)*RC3,0)+R4C -> 216 | J45: =ROUND((R1003C-R4C)/(R1003C3)*RC3,0)+R4C -> 117 | K45: =ROUND((R1003C-R4C)/(R1003C3)*RC3,0)+R4C -> 1665 | O45: =RC[-4]-R[-1]C[-4] -> 36 | P45: =RC[-1]-R[-1]C[-1] -> 0
B46: =R[-3]C+1 -> 15 | C46: =R[-1]C+RC[1] -> 42 | D46: 1 | F46: =ROUND((R1003C-R4C)/(R1003C3)*RC3,0)+R4C -> 549 | G46: =ROUND((R1003C-R4C)/(R1003C3)*RC3,0)+R4C -> 429 | H46: =ROUND((R1003C-R4C)/(R1003C3)*RC3,0)+R4C -> 1215 | I46: =ROUND((R1003C-R4C)/(R1003C3)*RC3,0)+R4C -> 221 | J46: =ROUND((R1003C-R4C)/(R1003C3)*RC3,0)+R4C -> 120 | K46: =ROUND((R1003C-R4C)/(R1003C3)*RC3,0)+R4C -> 1702 | O46: =RC[-4]-R[-1]C[-4] -> 37 | P46: =RC[-1]-R[-1]C[-1] -> 1
B47: =R[-3]C+1 -> 15 | C47: =R[-1]C+RC[1] -> 43 | D47: 1 | F47: =ROUND((R1003C-R4C)/(R1003C3)*RC3,0)+R4C -> 561 | G47: =ROUND((R1003C-R4C)/(R1003C3)*RC3,0)+R4C -> 438 | H47: =ROUND((R1003C-R4C)/(R1003C3)*RC3,0)+R4C -> 1240 | I47: =ROUND((R1003C-R4C)/(R1003C3)*RC3,0)+R4C -> 226 | J47: =ROUND((R1003C-R4C)/(R1003C3)*RC3,0)+R4C -> 122 | K47: =ROUND((R1003C-R4C)/(R1003C3)*RC3,0)+R4C -> 1738 | O47: =RC[-4]-R[-1]C[-4] -> 36 | P47: =RC[-1]-R[-1]C[-1] -> -1
B48: =R[-3]C+1 -> 15 | C48: =R[-1]C+RC[1] -> 44 | D48: 1 | F48: =ROUND((R1003C-R4C)/(R1003C3)*RC3,0)+R4C -> 573 | G48: =ROUND((R1003C-R4C)/(R1003C3)*RC3,0)+R4C -> 447 | H48: =ROUND((R1003C-R4C)/(R1003C3)*RC3,0)+R4C -> 1266 | I48: =ROUND((R1003C-R4C)/(R1003C3)*RC3,0)+R4C -> 230 | J48: =ROUND((R1003C-R4C)/(R1003C3)*RC3,0)+R4C -> 125 | K48: =ROUND((R1003C-R4C)/(R1003C3)*RC3,0)+R4C -> 1774 | O48: =RC[-4]-R[-1]C[-4] -> 36 | P48: =RC[-1]-R[-1]C[-1] -> 0
B49: =R[-3]C+1 -> 16 | C49: =R[-1]C+RC[1] -> 45 | D49: 1 | F49: =ROUND((R1003C-R4C)/(R1003C3)*RC3,0)+R4C -> 584 | G49: =ROUND((R1003C-R4C)/(R1003C3)*RC3,0)+R4C -> 457 | H49: =ROUND((R1003C-R4C)/(R1003C3)*RC3,0)+R4C -> 1292 | I49: =ROUND((R1003C-R4C)/(R1003C3)*RC3,0)+R4C -> 235 | J49: =ROUND((R1003C-R4C)/(R1003C3)*RC3,0)+R4C -> 127 | K49: =ROUND((R1003C-R4C)/(R1003C3)*RC3,0)+R4C -> 1810 | O49: =RC[-4]-R[-1]C[-4] -> 36 | P49: =RC[-1]-R[-1]C[-1] -> 0
B50: =R[-3]C+1 -> 16 | C50: =R[-1]C+RC[1] -> 46 | D50: 1 | F50: =ROUND((R1003C-R4C)/(R1003C3)*RC3,0)+R4C -> 596 | G50: =ROUND((R1003C-R4C)/(R1003C3)*RC3,0)+R4C -> 466 | H50: =ROUND((R1003C-R4C)/(R1003C3)*RC3,0)+R4C -> 1318 | I50: =ROUND((R1003C-R4C)/(R1003C3)*RC3,0)+R4C -> 240 | J50: =ROUND((R1003C-R4C)/(R1003C3)*RC3,0)+R4C -> 130 | K50: =ROUND((R1003C-R4C)/(R1003C3)*RC3,0)+R4C -> 1846 | O50: =RC[-4]-R[-1]C[-4] -> 36 | P50: =RC[-1]-R[-1]C[-1] -> 0
B51: =R[-3]C+1 -> 16 | C51: =R[-1]C+RC[1] -> 47 | D51: 1 | F51: =ROUND((R1003C-R4C)/(R1003C3)*RC3,0)+R4C -> 608 | G51: =ROUND((R1003C-R4C)/(R1003C3)*RC3,0)+R4C -> 475 | H51: =ROUND((R1003C-R4C)/(R1003C3)*RC3,0)+R4C -> 1344 | I51: =ROUND((R1003C-R4C)/(R1003C3)*RC3,0)+R4C -> 244 | J51: =ROUND((R1003C-R4C)/(R1003C3)*RC3,0)+R4C -> 132 | K51: =ROUND((R1003C-R4C)/(R1003C3)*RC3,0)+R4C -> 1883 | O51: =RC[-4]-R[-1]C[-4] -> 37 | P51: =RC[-1]-R[-1]C[-1] -> 1
B52: =R[-3]C+1 -> 17 | C52: =R[-1]C+RC[1] -> 48 | D52: 1 | F52: =ROUND((R1003C-R4C)/(R1003C3)*RC3,0)+R4C -> 619 | G52: =ROUND((R1003C-R4C)/(R1003C3)*RC3,0)+R4C -> 484 | H52: =ROUND((R1003C-R4C)/(R1003C3)*RC3,0)+R4C -> 1370 | I52: =ROUND((R1003C-R4C)/(R1003C3)*RC3,0)+R4C -> 249 | J52: =ROUND((R1003C-R4C)/(R1003C3)*RC3,0)+R4C -> 135 | K52: =ROUND((R1003C-R4C)/(R1003C3)*RC3,0)+R4C -> 1919 | O52: =RC[-4]-R[-1]C[-4] -> 36 | P52: =RC[-1]-R[-1]C[-1] -> -1
B53: =R[-3]C+1 -> 17 | C53: =R[-1]C+RC[1] -> 49 | D53: 1 | F53: =ROUND((R1003C-R4C)/(R1003C3)*RC3,0)+R4C -> 631 | G53: =ROUND((R1003C-R4C)/(R1003C3)*RC3,0)+R4C -> 493 | H53: =ROUND((R1003C-R4C)/(R1003C3)*RC3,0)+R4C -> 1395 | I53: =ROUND((R1003C-R4C)/(R1003C3)*RC3,0)+R4C -> 254 | J53: =ROUND((R1003C-R4C)/(R1003C3)*RC3,0)+R4C -> 137 | K53: =ROUND((R1003C-R4C)/(R1003C3)*RC3,0)+R4C -> 1955 | O53: =RC[-4]-R[-1]C[-4] -> 36 | P53: =RC[-1]-R[-1]C[-1] -> 0
B54: =R[-3]C+1 -> 17 | C54: =R[-1]C+RC[1] -> 50 | D54: 1 | F54: =ROUND((R1003C-R4C)/(R1003C3)*RC3,0)+R4C -> 643 | G54: =ROUND((R1003C-R4C)/(R1003C3)*RC3,0)+R4C -> 502 | H54: =ROUND((R1003C-R4C)/(R1003C3)*RC3,0)+R4C -> 1421 | I54: =ROUND((R1003C-R4C)/(R1003C3)*RC3,0)+R4C -> 259 | J54: =ROUND((R1003C-R4C)/(R1003C3)*RC3,0)+R4C -> 140 | K54: =ROUND((R1003C-R4C)/(R1003C3)*RC3,0)+R4C -> 1991 | O54: =RC[-4]-R[-1]C[-4] -> 36 | P54: =RC[-1]-R[-1]C[-1] -> 0
B55: =R[-3]C+1 -> 18 | C55: =R[-1]C+RC[1] -> 51 | D55: 1 | F55: =ROUND((R1003C-R4C)/(R1003C3)*RC3,0)+R4C -> 655 | G55: =ROUND((R1003C-R4C)/(R1003C3)*RC3,0)+R4C -> 511 | H55: =ROUND((R1003C-R4C)/(R1003C3)*RC3,0)+R4C -> 1447 | I55: =ROUND((R1003C-R4C)/(R1003C3)*RC3,0)+R4C -> 263 | J55: =ROUND((R1003C-R4C)/(R1003C3)*RC3,0)+R4C -> 142 | K55: =ROUND((R1003C-R4C)/(R1003C3)*RC3,0)+R4C -> 2027 | O55: =RC[-4]-R[-1]C[-4] -> 36 | P55: =RC[-1]-R[-1]C[-1] -> 0
B56: =R[-3]C+1 -> 18 | C56: =R[-1]C+RC[1] -> 52 | D56: 1 | F56: =ROUND((R1003C-R4C)/(R1003C3)*RC3,0)+R4C -> 666 | G56: =ROUND((R1003C-R4C)/(R1003C3)*RC3,0)+R4C -> 520 | H56: =ROUND((R1003C-R4C)/(R1003C3)*RC3,0)+R4C -> 1473 | I56: =ROUND((R1003C-R4C)/(R1003C3)*RC3,0)+R4C -> 268 | J56: =ROUND((R1003C-R4C)/(R1003C3)*RC3,0)+R4C -> 145 | K56: =ROUND((R1003C-R4C)/(R1003C3)*RC3,0)+R4C -> 2063 | O56: =RC[-4]-R[-1]C[-4] -> 36 | P56: =RC[-1]-R[-1]C[-1] -> 0
B57: =R[-3]C+1 -> 18 | C57: =R[-1]C+RC[1] -> 53 | D57: 1 | F57: =ROUND((R1003C-R4C)/(R1003C3)*RC3,0)+R4C -> 678 | G57: =ROUND((R1003C-R4C)/(R1003C3)*RC3,0)+R4C -> 530 | H57: =ROUND((R1003C-R4C)/(R1003C3)*RC3,0)+R4C -> 1499 | I57: =ROUND((R1003C-R4C)/(R1003C3)*RC3,0)+R4C -> 273 | J57: =ROUND((R1003C-R4C)/(R1003C3)*RC3,0)+R4C -> 147 | K57: =ROUND((R1003C-R4C)/(R1003C3)*RC3,0)+R4C -> 2100 | O57: =RC[-4]-R[-1]C[-4] -> 37 | P57: =RC[-1]-R[-1]C[-1] -> 1
B58: =R[-3]C+1 -> 19 | C58: =R[-1]C+RC[1] -> 54 | D58: 1 | F58: =ROUND((R1003C-R4C)/(R1003C3)*RC3,0)+R4C -> 690 | G58: =ROUND((R1003C-R4C)/(R1003C3)*RC3,0)+R4C -> 539 | H58: =ROUND((R1003C-R4C)/(R1003C3)*RC3,0)+R4C -> 1525 | I58: =ROUND((R1003C-R4C)/(R1003C3)*RC3,0)+R4C -> 277 | J58: =ROUND((R1003C-R4C)/(R1003C3)*RC3,0)+R4C -> 150 | K58: =ROUND((R1003C-R4C)/(R1003C3)*RC3,0)+R4C -> 2136 | O58: =RC[-4]-R[-1]C[-4] -> 36 | P58: =RC[-1]-R[-1]C[-1] -> -1
B59: =R[-3]C+1 -> 19 | C59: =R[-1]C+RC[1] -> 55 | D59: 1 | F59: =ROUND((R1003C-R4C)/(R1003C3)*RC3,0)+R4C -> 701 | G59: =ROUND((R1003C-R4C)/(R1003C3)*RC3,0)+R4C -> 548 | H59: =ROUND((R1003C-R4C)/(R1003C3)*RC3,0)+R4C -> 1550 | I59: =ROUND((R1003C-R4C)/(R1003C3)*RC3,0)+R4C -> 282 | J59: =ROUND((R1003C-R4C)/(R1003C3)*RC3,0)+R4C -> 153 | K59: =ROUND((R1003C-R4C)/(R1003C3)*RC3,0)+R4C -> 2172 | O59: =RC[-4]-R[-1]C[-4] -> 36 | P59: =RC[-1]-R[-1]C[-1] -> 0
B60: =R[-3]C+1 -> 19 | C60: =R[-1]C+RC[1] -> 56 | D60: 1 | F60: =ROUND((R1003C-R4C)/(R1003C3)*RC3,0)+R4C -> 713 | G60: =ROUND((R1003C-R4C)/(R1003C3)*RC3,0)+R4C -> 557 | H60: =ROUND((R1003C-R4C)/(R1003C3)*RC3,0)+R4C -> 1576 | I60: =ROUND((R1003C-R4C)/(R1003C3)*RC3,0)+R4C -> 287 | J60: =ROUND((R1003C-R4C)/(R1003C3)*RC3,0)+R4C -> 155 | K60: =ROUND((R1003C-R4C)/(R1003C3)*RC3,0)+R4C -> 2208 | O60: =RC[-4]-R[-1]C[-4] -> 36 | P60: =RC[-1]-R[-1]C[-1] -> 0
B61: =R[-3]C+1 -> 20 | C61: =R[-1]C+RC[1] -> 57 | D61: 1 | F61: =ROUND((R1003C-R4C)/(R1003C3)*RC3,0)+R4C -> 725 | G61: =ROUND((R1003C-R4C)/(R1003C3)*RC3,0)+R4C -> 566 | H61: =ROUND((R1003C-R4C)/(R1003C3)*RC3,0)+R4C -> 1602 | I61: =ROUND((R1003C-R4C)/(R1003C3)*RC3,0)+R4C -> 291 | J61: =ROUND((R1003C-R4C)/(R1003C3)*RC3,0)+R4C -> 158 | K61: =ROUND((R1003C-R4C)/(R1003C3)*RC3,0)+R4C -> 2244 | O61: =RC[-4]-R[-1]C[-4] -> 36 | P61: =RC[-1]-R[-1]C[-1] -> 0
B62: =R[-3]C+1 -> 20 | C62: =R[-1]C+RC[1] -> 58 | D62: 1 | F62: =ROUND((R1003C-R4C)/(R1003C3)*RC3,0)+R4C -> 736 | G62: =ROUND((R1003C-R4C)/(R1003C3)*RC3,0)+R4C -> 575 | H62: =ROUND((R1003C-R4C)/(R1003C3)*RC3,0)+R4C -> 1628 | I62: =ROUND((R1003C-R4C)/(R1003C3)*RC3,0)+R4C -> 296 | J62: =ROUND((R1003C-R4C)/(R1003C3)*RC3,0)+R4C -> 160 | K62: =ROUND((R1003C-R4C)/(R1003C3)*RC3,0)+R4C -> 2281 | O62: =RC[-4]-R[-1]C[-4] -> 37 | P62: =RC[-1]-R[-1]C[-1] -> 1
B63: =R[-3]C+1 -> 20 | C63: =R[-1]C+RC[1] -> 59 | D63: 1 | F63: =ROUND((R1003C-R4C)/(R1003C3)*RC3,0)+R4C -> 748 | G63: =ROUND((R1003C-R4C)/(R1003C3)*RC3,0)+R4C -> 584 | H63: =ROUND((R1003C-R4C)/(R1003C3)*RC3,0)+R4C -> 1654 | I63: =ROUND((R1003C-R4C)/(R1003C3)*RC3,0)+R4C -> 301 | J63: =ROUND((R1003C-R4C)/(R1003C3)*RC3,0)+R4C -> 163 | K63: =ROUND((R1003C-R4C)/(R1003C3)*RC3,0)+R4C -> 2317 | O63: =RC[-4]-R[-1]C[-4] -> 36 | P63: =RC[-1]-R[-1]C[-1] -> -1
B64: =R[-3]C+1 -> 21 | C64: =R[-1]C+RC[1] -> 60 | D64: 1 | F64: =ROUND((R1003C-R4C)/(R1003C3)*RC3,0)+R4C -> 760 | G64: =ROUND((R1003C-R4C)/(R1003C3)*RC3,0)+R4C -> 593 | H64: =ROUND((R1003C-R4C)/(R1003C3)*RC3,0)+R4C -> 1679 | I64: =ROUND((R1003C-R4C)/(R1003C3)*RC3,0)+R4C -> 305 | J64: =ROUND((R1003C-R4C)/(R1003C3)*RC3,0)+R4C -> 165 | K64: =ROUND((R1003C-R4C)/(R1003C3)*RC3,0)+R4C -> 2353 | O64: =RC[-4]-R[-1]C[-4] -> 36 | P64: =RC[-1]-R[-1]C[-1] -> 0
B65: =R[-3]C+1 -> 21 | C65: =R[-1]C+RC[1] -> 61 | D65: 1 | F65: =ROUND((R1003C-R4C)/(R1003C3)*RC3,0)+R4C -> 771 | G65: =ROUND((R1003C-R4C)/(R1003C3)*RC3,0)+R4C -> 603 | H65: =ROUND((R1003C-R4C)/(R1003C3)*RC3,0)+R4C -> 1705 | I65: =ROUND((R1003C-R4C)/(R1003C3)*RC3,0)+R4C -> 310 | J65: =ROUND((R1003C-R4C)/(R1003C3)*RC3,0)+R4C -> 168 | K65: =ROUND((R1003C-R4C)/(R1003C3)*RC3,0)+R4C -> 2389 | O65: =RC[-4]-R[-1]C[-4] -> 36 | P65: =RC[-1]-R[-1]C[-1] -> 0
B66: =R[-3]C+1 -> 21 | C66: =R[-1]C+RC[1] -> 62 | D66: 1 | F66: =ROUND((R1003C-R4C)/(R1003C3)*RC3,0)+R4C -> 783 | G66: =ROUND((R1003C-R4C)/(R1003C3)*RC3,0)+R4C -> 612 | H66: =ROUND((R1003C-R4C)/(R1003C3)*RC3,0)+R4C -> 1731 | I66: =ROUND((R1003C-R4C)/(R1003C3)*RC3,0)+R4C -> 315 | J66: =ROUND((R1003C-R4C)/(R1003C3)*RC3,0)+R4C -> 170 | K66: =ROUND((R1003C-R4C)/(R1003C3)*RC3,0)+R4C -> 2425 | O66: =RC[-4]-R[-1]C[-4] -> 36 | P66: =RC[-1]-R[-1]C[-1] -> 0
B67: =R[-3]C+1 -> 22 | C67: =R[-1]C+RC[1] -> 63 | D67: 1 | F67: =ROUND((R1003C-R4C)/(R1003C3)*RC3,0)+R4C -> 795 | G67: =ROUND((R1003C-R4C)/(R1003C3)*RC3,0)+R4C -> 621 | H67: =ROUND((R1003C-R4C)/(R1003C3)*RC3,0)+R4C -> 1757 | I67: =ROUND((R1003C-R4C)/(R1003C3)*RC3,0)+R4C -> 320 | J67: =ROUND((R1003C-R4C)/(R1003C3)*RC3,0)+R4C -> 173 | K67: =ROUND((R1003C-R4C)/(R1003C3)*RC3,0)+R4C -> 2461 | O67: =RC[-4]-R[-1]C[-4] -> 36 | P67: =RC[-1]-R[-1]C[-1] -> 0
B68: =R[-3]C+1 -> 22 | C68: =R[-1]C+RC[1] -> 64 | D68: 1 | F68: =ROUND((R1003C-R4C)/(R1003C3)*RC3,0)+R4C -> 806 | G68: =ROUND((R1003C-R4C)/(R1003C3)*RC3,0)+R4C -> 630 | H68: =ROUND((R1003C-R4C)/(R1003C3)*RC3,0)+R4C -> 1783 | I68: =ROUND((R1003C-R4C)/(R1003C3)*RC3,0)+R4C -> 324 | J68: =ROUND((R1003C-R4C)/(R1003C3)*RC3,0)+R4C -> 175 | K68: =ROUND((R1003C-R4C)/(R1003C3)*RC3,0)+R4C -> 2498 | O68: =RC[-4]-R[-1]C[-4] -> 37 | P68: =RC[-1]-R[-1]C[-1] -> 1
B69: =R[-3]C+1 -> 22 | C69: =R[-1]C+RC[1] -> 65 | D69: 1 | F69: =ROUND((R1003C-R4C)/(R1003C3)*RC3,0)+R4C -> 818 | G69: =ROUND((R1003C-R4C)/(R1003C3)*RC3,0)+R4C -> 639 | H69: =ROUND((R1003C-R4C)/(R1003C3)*RC3,0)+R4C -> 1809 | I69: =ROUND((R1003C-R4C)/(R1003C3)*RC3,0)+R4C -> 329 | J69: =ROUND((R1003C-R4C)/(R1003C3)*RC3,0)+R4C -> 178 | K69: =ROUND((R1003C-R4C)/(R1003C3)*RC3,0)+R4C -> 2534 | O69: =RC[-4]-R[-1]C[-4] -> 36 | P69: =RC[-1]-R[-1]C[-1] -> -1
B70: =R[-3]C+1 -> 23 | C70: =R[-1]C+RC[1] -> 66 | D70: 1 | F70: =ROUND((R1003C-R4C)/(R1003C3)*RC3,0)+R4C -> 830 | G70: =ROUND((R1003C-R4C)/(R1003C3)*RC3,0)+R4C -> 648 | H70: =ROUND((R1003C-R4C)/(R1003C3)*RC3,0)+R4C -> 1834 | I70: =ROUND((R1003C-R4C)/(R1003C3)*RC3,0)+R4C -> 334 | J70: =ROUND((R1003C-R4C)/(R1003C3)*RC3,0)+R4C -> 180 | K70: =ROUND((R1003C-R4C)/(R1003C3)*RC3,0)+R4C -> 2570 | O70: =RC[-4]-R[-1]C[-4] -> 36 | P70: =RC[-1]-R[-1]C[-1] -> 0
B71: =R[-3]C+1 -> 23 | C71: =R[-1]C+RC[1] -> 67 | D71: 1 | F71: =ROUND((R1003C-R4C)/(R1003C3)*RC3,0)+R4C -> 841 | G71: =ROUND((R1003C-R4C)/(R1003C3)*RC3,0)+R4C -> 657 | H71: =ROUND((R1003C-R4C)/(R1003C3)*RC3,0)+R4C -> 1860 | I71: =ROUND((R1003C-R4C)/(R1003C3)*RC3,0)+R4C -> 338 | J71: =ROUND((R1003C-R4C)/(R1003C3)*RC3,0)+R4C -> 183 | K71: =ROUND((R1003C-R4C)/(R1003C3)*RC3,0)+R4C -> 2606 | O71: =RC[-4]-R[-1]C[-4] -> 36 | P71: =RC[-1]-R[-1]C[-1] -> 0
B72: =R[-3]C+1 -> 23 | C72: =R[-1]C+RC[1] -> 68 | D72: 1 | F72: =ROUND((R1003C-R4C)/(R1003C3)*RC3,0)+R4C -> 853 | G72: =ROUND((R1003C-R4C)/(R1003C3)*RC3,0)+R4C -> 666 | H72: =ROUND((R1003C-R4C)/(R1003C3)*RC3,0)+R4C -> 1886 | I72: =ROUND((R1003C-R4C)/(R1003C3)*RC3,0)+R4C -> 343 | J72: =ROUND((R1003C-R4C)/(R1003C3)*RC3,0)+R4C -> 185 | K72: =ROUND((R1003C-R4C)/(R1003C3)*RC3,0)+R4C -> 2642 | O72: =RC[-4]-R[-1]C[-4] -> 36 | P72: =RC[-1]-R[-1]C[-1] -> 0
B73: =R[-3]C+1 -> 24 | C73: =R[-1]C+RC[1] -> 69 | D73: 1 | F73: =ROUND((R1003C-R4C)/(R1003C3)*RC3,0)+R4C -> 865 | G73: =ROUND((R1003C-R4C)/(R1003C3)*RC3,0)+R4C -> 676 | H73: =ROUND((R1003C-R4C)/(R1003C3)*RC3,0)+R4C -> 1912 | I73: =ROUND((R1003C-R4C)/(R1003C3)*RC3,0)+R4C -> 348 | J73: =ROUND((R1003C-R4C)/(R1003C3)*RC3,0)+R4C -> 188 | K73: =ROUND((R1003C-R4C)/(R1003C3)*RC3,0)+R4C -> 2679 | O73: =RC[-4]-R[-1]C[-4] -> 37 | P73: =RC[-1]-R[-1]C[-1] -> 1
B74: =R[-3]C+1 -> 24 | C74: =R[-1]C+RC[1] -> 70 | D74: 1 | F74: =ROUND((R1003C-R4C)/(R1003C3)*RC3,0)+R4C -> 876 | G74: =ROUND((R1003C-R4C)/(R1003C3)*RC3,0)+R4C -> 685 | H74: =ROUND((R1003C-R4C)/(R1003C3)*RC3,0)+R4C -> 1938 | I74: =ROUND((R1003C-R4C)/(R1003C3)*RC3,0)+R4C -> 352 | J74: =ROUND((R1003C-R4C)/(R1003C3)*RC3,0)+R4C -> 191 | K74: =ROUND((R1003C-R4C)/(R1003C3)*RC3,0)+R4C -> 2715 | O74: =RC[-4]-R[-1]C[-4] -> 36 | P74: =RC[-1]-R[-1]C[-1] -> -1
B75: =R[-3]C+1 -> 24 | C75: =R[-1]C+RC[1] -> 71 | D75: 1 | F75: =ROUND((R1003C-R4C)/(R1003C3)*RC3,0)+R4C -> 888 | G75: =ROUND((R1003C-R4C)/(R1003C3)*RC3,0)+R4C -> 694 | H75: =ROUND((R1003C-R4C)/(R1003C3)*RC3,0)+R4C -> 1964 | I75: =ROUND((R1003C-R4C)/(R1003C3)*RC3,0)+R4C -> 357 | J75: =ROUND((R1003C-R4C)/(R1003C3)*RC3,0)+R4C -> 193 | K75: =ROUND((R1003C-R4C)/(R1003C3)*RC3,0)+R4C -> 2751 | O75: =RC[-4]-R[-1]C[-4] -> 36 | P75: =RC[-1]-R[-1]C[-1] -> 0
B76: =R[-3]C+1 -> 25 | C76: =R[-1]C+RC[1] -> 72 | D76: 1 | F76: =ROUND((R1003C-R4C)/(R1003C3)*RC3,0)+R4C -> 900 | G76: =ROUND((R1003C-R4C)/(R1003C3)*RC3,0)+R4C -> 703 | H76: =ROUND((R1003C-R4C)/(R1003C3)*RC3,0)+R4C -> 1989 | I76: =ROUND((R1003C-R4C)/(R1003C3)*RC3,0)+R4C -> 362 | J76: =ROUND((R1003C-R4C)/(R1003C3)*RC3,0)+R4C -> 196 | K76: =ROUND((R1003C-R4C)/(R1003C3)*RC3,0)+R4C -> 2787 | O76: =RC[-4]-R[-1]C[-4] -> 36 | P76: =RC[-1]-R[-1]C[-1] -> 0
B77: =R[-3]C+1 -> 25 | C77: =R[-1]C+RC[1] -> 73 | D77: 1 | F77: =ROUND((R1003C-R4C)/(R1003C3)*RC3,0)+R4C -> 911 | G77: =ROUND((R1003C-R4C)/(R1003C3)*RC3,0)+R4C -> 712 | H77: =ROUND((R1003C-R4C)/(R1003C3)*RC3,0)+R4C -> 2015 | I77: =ROUND((R1003C-R4C)/(R1003C3)*RC3,0)+R4C -> 366 | J77: =ROUND((R1003C-R4C)/(R1003C3)*RC3,0)+R4C -> 198 | K77: =ROUND((R1003C-R4C)/(R1003C3)*RC3,0)+R4C -> 2823 | O77: =RC[-4]-R[-1]C[-4] -> 36 | P77: =RC[-1]-R[-1]C[-1] -> 0
B78: =R[-3]C+1 -> 25 | C78: =R[-1]C+RC[1] -> 74 | D78: 1 | F78: =ROUND((R1003C-R4C)/(R1003C3)*RC3,0)+R4C -> 923 | G78: =ROUND((R1003C-R4C)/(R1003C3)*RC3,0)+R4C -> 721 | H78: =ROUND((R1003C-R4C)/(R1003C3)*RC3,0)+R4C -> 2041 | I78: =ROUND((R1003C-R4C)/(R1003C3)*RC3,0)+R4C -> 371 | J78: =ROUND((R1003C-R4C)/(R1003C3)*RC3,0)+R4C -> 201 | K78: =ROUND((R1003C-R4C)/(R1003C3)*RC3,0)+R4C -> 2859 | O78: =RC[-4]-R[-1]C[-4] -> 36 | P78: =RC[-1]-R[-1]C[-1] -> 0
B79: =R[-3]C+1 -> 26 | C79: =R[-1]C+RC[1] -> 75 | D79: 1 | F79: =ROUND((R1003C-R4C)/(R1003C3)*RC3,0)+R4C -> 935 | G79: =ROUND((R1003C-R4C)/(R1003C3)*RC3,0)+R4C -> 730 | H79: =ROUND((R1003C-R4C)/(R1003C3)*RC3,0)+R4C -> 2067 | I79: =ROUND((R1003C-R4C)/(R1003C3)*RC3,0)+R4C -> 376 | J79: =ROUND((R1003C-R4C)/(R1003C3)*RC3,0)+R4C -> 203 | K79: =ROUND((R1003C-R4C)/(R1003C3)*RC3,0)+R4C -> 2896 | O79: =RC[-4]-R[-1]C[-4] -> 37 | P79: =RC[-1]-R[-1]C[-1] -> 1
B80: =R[-3]C+1 -> 26 | C80: =R[-1]C+RC[1] -> 76 | D80: 1 | F80: =ROUND((R1003C-R4C)/(R1003C3)*RC3,0)+R4C -> 946 | G80: =ROUND((R1003C-R4C)/(R1003C3)*RC3,0)+R4C -> 739 | H80: =ROUND((R1003C-R4C)/(R1003C3)*RC3,0)+R4C -> 2093 | I80: =ROUND((R1003C-R4C)/(R1003C3)*RC3,0)+R4C -> 380 | J80: =ROUND((R1003C-R4C)/(R1003C3)*RC3,0)+R4C -> 206 | K80: =ROUND((R1003C-R4C)/(R1003C3)*RC3,0)+R4C -> 2932 | O80: =RC[-4]-R[-1]C[-4] -> 36 | P80: =RC[-1]-R[-1]C[-1] -> -1
B81: =R[-3]C+1 -> 26 | C81: =R[-1]C+RC[1] -> 77 | D81: 1 | F81: =ROUND((R1003C-R4C)/(R1003C3)*RC3,0)+R4C -> 958 | G81: =ROUND((R1003C-R4C)/(R1003C3)*RC3,0)+R4C -> 749 | H81: =ROUND((R1003C-R4C)/(R1003C3)*RC3,0)+R4C -> 2119 | I81: =ROUND((R1003C-R4C)/(R1003C3)*RC3,0)+R4C -> 385 | J81: =ROUND((R1003C-R4C)/(R1003C3)*RC3,0)+R4C -> 208 | K81: =ROUND((R1003C-R4C)/(R1003C3)*RC3,0)+R4C -> 2968 | O81: =RC[-4]-R[-1]C[-4] -> 36 | P81: =RC[-1]-R[-1]C[-1] -> 0
B82: =R[-3]C+1 -> 27 | C82: =R[-1]C+RC[1] -> 78 | D82: 1 | F82: =ROUND((R1003C-R4C)/(R1003C3)*RC3,0)+R4C -> 970 | G82: =ROUND((R1003C-R4C)/(R1003C3)*RC3,0)+R4C -> 758 | H82: =ROUND((R1003C-R4C)/(R1003C3)*RC3,0)+R4C -> 2144 | I82: =ROUND((R1003C-R4C)/(R1003C3)*RC3,0)+R4C -> 390 | J82: =ROUND((R1003C-R4C)/(R1003C3)*RC3,0)+R4C -> 211 | K82: =ROUND((R1003C-R4C)/(R1003C3)*RC3,0)+R4C -> 3004 | O82: =RC[-4]-R[-1]C[-4] -> 36 | P82: =RC[-1]-R[-1]C[-1] -> 0
B83: =R[-3]C+1 -> 27 | C83: =R[-1]C+RC[1] -> 79 | D83: 1 | F83: =ROUND((R1003C-R4C)/(R1003C3)*RC3,0)+R4C -> 981 | G83: =ROUND((R1003C-R4C)/(R1003C3)*RC3,0)+R4C -> 767 | H83: =ROUND((R1003C-R4C)/(R1003C3)*RC3,0)+R4C -> 2170 | I83: =ROUND((R1003C-R4C)/(R1003C3)*RC3,0)+R4C -> 395 | J83: =ROUND((R1003C-R4C)/(R1003C3)*RC3,0)+R4C -> 213 | K83: =ROUND((R1003C-R4C)/(R1003C3)*RC3,0)+R4C -> 3040 | O83: =RC[-4]-R[-1]C[-4] -> 36 | P83: =RC[-1]-R[-1]C[-1] -> 0
B84: =R[-3]C+1 -> 27 | C84: =R[-1]C+RC[1] -> 80 | D84: 1 | F84: =ROUND((R1003C-R4C)/(R1003C3)*RC3,0)+R4C -> 993 | G84: =ROUND((R1003C-R4C)/(R1003C3)*RC3,0)+R4C -> 776 | H84: =ROUND((R1003C-R4C)/(R1003C3)*RC3,0)+R4C -> 2196 | I84: =ROUND((R1003C-R4C)/(R1003C3)*RC3,0)+R4C -> 399 | J84: =ROUND((R1003C-R4C)/(R1003C3)*RC3,0)+R4C -> 216 | K84: =ROUND((R1003C-R4C)/(R1003C3)*RC3,0)+R4C -> 3076 | O84: =RC[-4]-R[-1]C[-4] -> 36 | P84: =RC[-1]-R[-1]C[-1] -> 0
B85: =R[-3]C+1 -> 28 | C85: =R[-1]C+RC[1] -> 81 | D85: 1 | F85: =ROUND((R1003C-R4C)/(R1003C3)*RC3,0)+R4C -> 1005 | G85: =ROUND((R1003C-R4C)/(R1003C3)*RC3,0)+R4C -> 785 | H85: =ROUND((R1003C-R4C)/(R1003C3)*RC3,0)+R4C -> 2222 | I85: =ROUND((R1003C-R4C)/(R1003C3)*RC3,0)+R4C -> 404 | J85: =ROUND((R1003C-R4C)/(R1003C3)*RC3,0)+R4C -> 218 | K85: =ROUND((R1003C-R4C)/(R1003C3)*RC3,0)+R4C -> 3113 | O85: =RC[-4]-R[-1]C[-4] -> 37 | P85: =RC[-1]-R[-1]C[-1] -> 1
B86: =R[-3]C+1 -> 28 | C86: =R[-1]C+RC[1] -> 82 | D86: 1 | F86: =ROUND((R1003C-R4C)/(R1003C3)*RC3,0)+R4C -> 1016 | G86: =ROUND((R1003C-R4C)/(R1003C3)*RC3,0)+R4C -> 794 | H86: =ROUND((R1003C-R4C)/(R1003C3)*RC3,0)+R4C -> 2248 | I86: =ROUND((R1003C-R4C)/(R1003C3)*RC3,0)+R4C -> 409 | J86: =ROUND((R1003C-R4C)/(R1003C3)*RC3,0)+R4C -> 221 | K86: =ROUND((R1003C-R4C)/(R1003C3)*RC3,0)+R4C -> 3149 | O86: =RC[-4]-R[-1]C[-4] -> 36 | P86: =RC[-1]-R[-1]C[-1] -> -1
B87: =R[-3]C+1 -> 28 | C87: =R[-1]C+RC[1] -> 83 | D87: 1 | F87: =ROUND((R1003C-R4C)/(R1003C3)*RC3,0)+R4C -> 1028 | G87: =ROUND((R1003C-R4C)/(R1003C3)*RC3,0)+R4C -> 803 | H87: =ROUND((R1003C-R4C)/(R1003C3)*RC3,0)+R4C -> 2273 | I87: =ROUND((R1003C-R4C)/(R1003C3)*RC3,0)+R4C -> 413 | J87: =ROUND((R1003C-R4C)/(R1003C3)*RC3,0)+R4C -> 224 | K87: =ROUND((R1003C-R4C)/(R1003C3)*RC3,0)+R4C -> 3185 | O87: =RC[-4]-R[-1]C[-4] -> 36 | P87: =RC[-1]-R[-1]C[-1] -> 0
B88: =R[-3]C+1 -> 29 | C88: =R[-1]C+RC[1] -> 84 | D88: 1 | F88: =ROUND((R1003C-R4C)/(R1003C3)*RC3,0)+R4C -> 1040 | G88: =ROUND((R1003C-R4C)/(R1003C3)*RC3,0)+R4C -> 812 | H88: =ROUND((R1003C-R4C)/(R1003C3)*RC3,0)+R4C -> 2299 | I88: =ROUND((R1003C-R4C)/(R1003C3)*RC3,0)+R4C -> 418 | J88: =ROUND((R1003C-R4C)/(R1003C3)*RC3,0)+R4C -> 226 | K88: =ROUND((R1003C-R4C)/(R1003C3)*RC3,0)+R4C -> 3221 | O88: =RC[-4]-R[-1]C[-4] -> 36 | P88: =RC[-1]-R[-1]C[-1] -> 0
B89: =R[-3]C+1 -> 29 | C89: =R[-1]C+RC[1] -> 85 | D89: 1 | F89: =ROUND((R1003C-R4C)/(R1003C3)*RC3,0)+R4C -> 1052 | G89: =ROUND((R1003C-R4C)/(R1003C3)*RC3,0)+R4C -> 822 | H89: =ROUND((R1003C-R4C)/(R1003C3)*RC3,0)+R4C -> 2325 | I89: =ROUND((R1003C-R4C)/(R1003C3)*RC3,0)+R4C -> 423 | J89: =ROUND((R1003C-R4C)/(R1003C3)*RC3,0)+R4C -> 229 | K89: =ROUND((R1003C-R4C)/(R1003C3)*RC3,0)+R4C -> 3257 | O89: =RC[-4]-R[-1]C[-4] -> 36 | P89: =RC[-1]-R[-1]C[-1] -> 0
B90: =R[-3]C+1 -> 29 | C90: =R[-1]C+RC[1] -> 86 | D90: 1 | F90: =ROUND((R1003C-R4C)/(R1003C3)*RC3,0)+R4C -> 1063 | G90: =ROUND((R1003C-R4C)/(R1003C3)*RC3,0)+R4C -> 831 | H90: =ROUND((R1003C-R4C)/(R1003C3)*RC3,0)+R4C -> 2351 | I90: =ROUND((R1003C-R4C)/(R1003C3)*RC3,0)+R4C -> 427 | J90: =ROUND((R1003C-R4C)/(R1003C3)*RC3,0)+R4C -> 231 | K90: =ROUND((R1003C-R4C)/(R1003C3)*RC3,0)+R4C -> 3294 | O90: =RC[-4]-R[-1]C[-4] -> 37 | P90: =RC[-1]-R[-1]C[-1] -> 1
B91: =R[-3]C+1 -> 30 | C91: =R[-1]C+RC[1] -> 87 | D91: 1 | F91: =ROUND((R1003C-R4C)/(R1003C3)*RC3,0)+R4C -> 1075 | G91: =ROUND((R1003C-R4C)/(R1003C3)*RC3,0)+R4C -> 840 | H91: =ROUND((R1003C-R4C)/(R1003C3)*RC3,0)+R4C -> 2377 | I91: =ROUND((R1003C-R4C)/(R1003C3)*RC3,0)+R4C -> 432 | J91: =ROUND((R1003C-R4C)/(R1003C3)*RC3,0)+R4C -> 234 | K91: =ROUND((R1003C-R4C)/(R1003C3)*RC3,0)+R4C -> 3330 | O91: =RC[-4]-R[-1]C[-4] -> 36 | P91: =RC[-1]-R[-1]C[-1] -> -1
B92: =R[-3]C+1 -> 30 | C92: =R[-1]C+RC[1] -> 88 | D92: 1 | F92: =ROUND((R1003C-R4C)/(R1003C3)*RC3,0)+R4C -> 1087 | G92: =ROUND((R1003C-R4C)/(R1003C3)*RC3,0)+R4C -> 849 | H92: =ROUND((R1003C-R4C)/(R1003C3)*RC3,0)+R4C -> 2403 | I92: =ROUND((R1003C-R4C)/(R1003C3)*RC3,0)+R4C -> 437 | J92: =ROUND((R1003C-R4C)/(R1003C3)*RC3,0)+R4C -> 236 | K92: =ROUND((R1003C-R4C)/(R1003C3)*RC3,0)+R4C -> 3366 | O92: =RC[-4]-R[-1]C[-4] -> 36 | P92: =RC[-1]-R[-1]C[-1] -> 0
B93: =R[-3]C+1 -> 30 | C93: =R[-1]C+RC[1] -> 89 | D93: 1 | F93: =ROUND((R1003C-R4C)/(R1003C3)*RC3,0)+R4C -> 1098 | G93: =ROUND((R1003C-R4C)/(R1003C3)*RC3,0)+R4C -> 858 | H93: =ROUND((R1003C-R4C)/(R1003C3)*RC3,0)+R4C -> 2428 | I93: =ROUND((R1003C-R4C)/(R1003C3)*RC3,0)+R4C -> 441 | J93: =ROUND((R1003C-R4C)/(R1003C3)*RC3,0)+R4C -> 239 | K93: =ROUND((R1003C-R4C)/(R1003C3)*RC3,0)+R4C -> 3402 | O93: =RC[-4]-R[-1]C[-4] -> 36 | P93: =RC[-1]-R[-1]C[-1] -> 0
B94: =R[-3]C+1 -> 31 | C94: =R[-1]C+RC[1] -> 90 | D94: 1 | F94: =ROUND((R1003C-R4C)/(R1003C3)*RC3,0)+R4C -> 1110 | G94: =ROUND((R1003C-R4C)/(R1003C3)*RC3,0)+R4C -> 867 | H94: =ROUND((R1003C-R4C)/(R1003C3)*RC3,0)+R4C -> 2454 | I94: =ROUND((R1003C-R4C)/(R1003C3)*RC3,0)+R4C -> 446 | J94: =ROUND((R1003C-R4C)/(R1003C3)*RC3,0)+R4C -> 241 | K94: =ROUND((R1003C-R4C)/(R1003C3)*RC3,0)+R4C -> 3438 | O94: =RC[-4]-R[-1]C[-4] -> 36 | P94: =RC[-1]-R[-1]C[-1] -> 0
B95: =R[-3]C+1 -> 31 | C95: =R[-1]C+RC[1] -> 91 | D95: 1 | F95: =ROUND((R1003C-R4C)/(R1003C3)*RC3,0)+R4C -> 1122 | G95: =ROUND((R1003C-R4C)/(R1003C3)*RC3,0)+R4C -> 876 | H95: =ROUND((R1003C-R4C)/(R1003C3)*RC3,0)+R4C -> 2480 | I95: =ROUND((R1003C-R4C)/(R1003C3)*RC3,0)+R4C -> 451 | J95: =ROUND((R1003C-R4C)/(R1003C3)*RC3,0)+R4C -> 244 | K95: =ROUND((R1003C-R4C)/(R1003C3)*RC3,0)+R4C -> 3474 | O95: =RC[-4]-R[-1]C[-4] -> 36 | P95: =RC[-1]-R[-1]C[-1] -> 0
B96: =R[-3]C+1 -> 31 | C96: =R[-1]C+RC[1] -> 92 | D96: 1 | F96: =ROUND((R1003C-R4C)/(R1003C3)*RC3,0)+R4C -> 1133 | G96: =ROUND((R1003C-R4C)/(R1003C3)*RC3,0)+R4C -> 885 | H96: =ROUND((R1003C-R4C)/(R1003C3)*RC3,0)+R4C -> 2506 | I96: =ROUND((R1003C-R4C)/(R1003C3)*RC3,0)+R4C -> 456 | J96: =ROUND((R1003C-R4C)/(R1003C3)*RC3,0)+R4C -> 246 | K96: =ROUND((R1003C-R4C)/(R1003C3)*RC3,0)+R4C -> 3511 | O96: =RC[-4]-R[-1]C[-4] -> 37 | P96: =RC[-1]-R[-1]C[-1] -> 1
B97: =R[-3]C+1 -> 32 | C97: =R[-1]C+RC[1] -> 93 | D97: 1 | F97: =ROUND((R1003C-R4C)/(R1003C3)*RC3,0)+R4C -> 1145 | G97: =ROUND((R1003C-R4C)/(R1003C3)*RC3,0)+R4C -> 895 | H97: =ROUND((R1003C-R4C)/(R1003C3)*RC3,0)+R4C -> 2532 | I97: =ROUND((R1003C-R4C)/(R1003C3)*RC3,0)+R4C -> 460 | J97: =ROUND((R1003C-R4C)/(R1003C3)*RC3,0)+R4C -> 249 | K97: =ROUND((R1003C-R4C)/(R1003C3)*RC3,0)+R4C -> 3547 | O97: =RC[-4]-R[-1]C[-4] -> 36 | P97: =RC[-1]-R[-1]C[-1] -> -1
B98: =R[-3]C+1 -> 32 | C98: =R[-1]C+RC[1] -> 94 | D98: 1 | F98: =ROUND((R1003C-R4C)/(R1003C3)*RC3,0)+R4C -> 1157 | G98: =ROUND((R1003C-R4C)/(R1003C3)*RC3,0)+R4C -> 904 | H98: =ROUND((R1003C-R4C)/(R1003C3)*RC3,0)+R4C -> 2558 | I98: =ROUND((R1003C-R4C)/(R1003C3)*RC3,0)+R4C -> 465 | J98: =ROUND((R1003C-R4C)/(R1003C3)*RC3,0)+R4C -> 251 | K98: =ROUND((R1003C-R4C)/(R1003C3)*RC3,0)+R4C -> 3583 | O98: =RC[-4]-R[-1]C[-4] -> 36 | P98: =RC[-1]-R[-1]C[-1] -> 0
B99: =R[-3]C+1 -> 32 | C99: =R[-1]C+RC[1] -> 95 | D99: 1 | F99: =ROUND((R1003C-R4C)/(R1003C3)*RC3,0)+R4C -> 1168 | G99: =ROUND((R1003C-R4C)/(R1003C3)*RC3,0)+R4C -> 913 | H99: =ROUND((R1003C-R4C)/(R1003C3)*RC3,0)+R4C -> 2583 | I99: =ROUND((R1003C-R4C)/(R1003C3)*RC3,0)+R4C -> 470 | J99: =ROUND((R1003C-R4C)/(R1003C3)*RC3,0)+R4C -> 254 | K99: =ROUND((R1003C-R4C)/(R1003C3)*RC3,0)+R4C -> 3619 | O99: =RC[-4]-R[-1]C[-4] -> 36 | P99: =RC[-1]-R[-1]C[-1] -> 0
B100: =R[-3]C+1 -> 33 | C100: =R[-1]C+RC[1] -> 96 | D100: 1 | F100: =ROUND((R1003C-R4C)/(R1003C3)*RC3,0)+R4C -> 1180 | G100: =ROUND((R1003C-R4C)/(R1003C3)*RC3,0)+R4C -> 922 | H100: =ROUND((R1003C-R4C)/(R1003C3)*RC3,0)+R4C -> 2609 | I100: =ROUND((R1003C-R4C)/(R1003C3)*RC3,0)+R4C -> 474 | J100: =ROUND((R1003C-R4C)/(R1003C3)*RC3,0)+R4C -> 257 | K100: =ROUND((R1003C-R4C)/(R1003C3)*RC3,0)+R4C -> 3655 | O100: =RC[-4]-R[-1]C[-4] -> 36 | P100: =RC[-1]-R[-1]C[-1] -> 0
B101: =R[-3]C+1 -> 33 | C101: =R[-1]C+RC[1] -> 97 | D101: 1 | F101: =ROUND((R1003C-R4C)/(R1003C3)*RC3,0)+R4C -> 1192 | G101: =ROUND((R1003C-R4C)/(R1003C3)*RC3,0)+R4C -> 931 | H101: =ROUND((R1003C-R4C)/(R1003C3)*RC3,0)+R4C -> 2635 | I101: =ROUND((R1003C-R4C)/(R1003C3)*RC3,0)+R4C -> 479 | J101: =ROUND((R1003C-R4C)/(R1003C3)*RC3,0)+R4C -> 259 | K101: =ROUND((R1003C-R4C)/(R1003C3)*RC3,0)+R4C -> 3692 | O101: =RC[-4]-R[-1]C[-4] -> 37 | P101: =RC[-1]-R[-1]C[-1] -> 1
B102: =R[-3]C+1 -> 33 | C102: =R[-1]C+RC[1] -> 98 | D102: 1 | F102: =ROUND((R1003C-R4C)/(R1003C3)*RC3,0)+R4C -> 1203 | G102: =ROUND((R1003C-R4C)/(R1003C3)*RC3,0)+R4C -> 940 | H102: =ROUND((R1003C-R4C)/(R1003C3)*RC3,0)+R4C -> 2661 | I102: =ROUND((R1003C-R4C)/(R1003C3)*RC3,0)+R4C -> 484 | J102: =ROUND((R1003C-R4C)/(R1003C3)*RC3,0)+R4C -> 262 | K102: =ROUND((R1003C-R4C)/(R1003C3)*RC3,0)+R4C -> 3728 | O102: =RC[-4]-R[-1]C[-4] -> 36 | P102: =RC[-1]-R[-1]C[-1] -> -1
B103: =R[-3]C+1 -> 34 | C103: =R[-1]C+RC[1] -> 99 | D103: 1 | F103: =ROUND((R1003C-R4C)/(R1003C3)*RC3,0)+R4C -> 1215 | G103: =ROUND((R1003C-R4C)/(R1003C3)*RC3,0)+R4C -> 949 | H103: =ROUND((R1003C-R4C)/(R1003C3)*RC3,0)+R4C -> 2687 | I103: =ROUND((R1003C-R4C)/(R1003C3)*RC3,0)+R4C -> 488 | J103: =ROUND((R1003C-R4C)/(R1003C3)*RC3,0)+R4C -> 264 | K103: =ROUND((R1003C-R4C)/(R1003C3)*RC3,0)+R4C -> 3764 | O103: =RC[-4]-R[-1]C[-4] -> 36 | P103: =RC[-1]-R[-1]C[-1] -> 0
B104: =R[-3]C+1 -> 34 | C104: =R[-1]C+RC[1] -> 100 | D104: 1 | F104: =ROUND((R1003C-R4C)/(R1003C3)*RC3,0)+R4C -> 1227 | G104: =ROUND((R1003C-R4C)/(R1003C3)*RC3,0)+R4C -> 958 | H104: =ROUND((R1003C-R4C)/(R1003C3)*RC3,0)+R4C -> 2712 | I104: =ROUND((R1003C-R4C)/(R1003C3)*RC3,0)+R4C -> 493 | J104: =ROUND((R1003C-R4C)/(R1003C3)*RC3,0)+R4C -> 267 | K104: =ROUND((R1003C-R4C)/(R1003C3)*RC3,0)+R4C -> 3800 | O104: =RC[-4]-R[-1]C[-4] -> 36 | P104: =RC[-1]-R[-1]C[-1] -> 0
B105: =R[-3]C+1 -> 34 | C105: =R[-1]C+RC[1] -> 101 | D105: 1 | F105: =ROUND((R1003C-R4C)/(R1003C3)*RC3,0)+R4C -> 1238 | G105: =ROUND((R1003C-R4C)/(R1003C3)*RC3,0)+R4C -> 968 | H105: =ROUND((R1003C-R4C)/(R1003C3)*RC3,0)+R4C -> 2738 | I105: =ROUND((R1003C-R4C)/(R1003C3)*RC3,0)+R4C -> 498 | J105: =ROUND((R1003C-R4C)/(R1003C3)*RC3,0)+R4C -> 269 | K105: =ROUND((R1003C-R4C)/(R1003C3)*RC3,0)+R4C -> 3836 | O105: =RC[-4]-R[-1]C[-4] -> 36 | P105: =RC[-1]-R[-1]C[-1] -> 0
B106: =R[-3]C+1 -> 35 | C106: =R[-1]C+RC[1] -> 102 | D106: 1 | F106: =ROUND((R1003C-R4C)/(R1003C3)*RC3,0)+R4C -> 1250 | G106: =ROUND((R1003C-R4C)/(R1003C3)*RC3,0)+R4C -> 977 | H106: =ROUND((R1003C-R4C)/(R1003C3)*RC3,0)+R4C -> 2764 | I106: =ROUND((R1003C-R4C)/(R1003C3)*RC3,0)+R4C -> 502 | J106: =ROUND((R1003C-R4C)/(R1003C3)*RC3,0)+R4C -> 272 | K106: =ROUND((R1003C-R4C)/(R1003C3)*RC3,0)+R4C -> 3872 | O106: =RC[-4]-R[-1]C[-4] -> 36 | P106: =RC[-1]-R[-1]C[-1] -> 0
B107: =R[-3]C+1 -> 35 | C107: =R[-1]C+RC[1] -> 103 | D107: 1 | F107: =ROUND((R1003C-R4C)/(R1003C3)*RC3,0)+R4C -> 1262 | G107: =ROUND((R1003C-R4C)/(R1003C3)*RC3,0)+R4C -> 986 | H107: =ROUND((R1003C-R4C)/(R1003C3)*RC3,0)+R4C -> 2790 | I107: =ROUND((R1003C-R4C)/(R1003C3)*RC3,0)+R4C -> 507 | J107: =ROUND((R1003C-R4C)/(R1003C3)*RC3,0)+R4C -> 274 | K107: =ROUND((R1003C-R4C)/(R1003C3)*RC3,0)+R4C -> 3909 | O107: =RC[-4]-R[-1]C[-4] -> 37 | P107: =RC[-1]-R[-1]C[-1] -> 1
B108: =R[-3]C+1 -> 35 | C108: =R[-1]C+RC[1] -> 104 | D108: 1 | F108: =ROUND((R1003C-R4C)/(R1003C3)*RC3,0)+R4C -> 1273 | G108: =ROUND((R1003C-R4C)/(R1003C3)*RC3,0)+R4C -> 995 | H108: =ROUND((R1003C-R4C)/(R1003C3)*RC3,0)+R4C -> 2816 | I108: =ROUND((R1003C-R4C)/(R1003C3)*RC3,0)+R4C -> 512 | J108: =ROUND((R1003C-R4C)/(R1003C3)*RC3,0)+R4C -> 277 | K108: =ROUND((R1003C-R4C)/(R1003C3)*RC3,0)+R4C -> 3945 | O108: =RC[-4]-R[-1]C[-4] -> 36 | P108: =RC[-1]-R[-1]C[-1] -> -1
B109: =R[-3]C+1 -> 36 | C109: =R[-1]C+RC[1] -> 105 | D109: 1 | F109: =ROUND((R1003C-R4C)/(R1003C3)*RC3,0)+R4C -> 1285 | G109: =ROUND((R1003C-R4C)/(R1003C3)*RC3,0)+R4C -> 1004 | H109: =ROUND((R1003C-R4C)/(R1003C3)*RC3,0)+R4C -> 2842 | I109: =ROUND((R1003C-R4C)/(R1003C3)*RC3,0)+R4C -> 517 | J109: =ROUND((R1003C-R4C)/(R1003C3)*RC3,0)+R4C -> 279 | K109: =ROUND((R1003C-R4C)/(R1003C3)*RC3,0)+R4C -> 3981 | O109: =RC[-4]-R[-1]C[-4] -> 36 | P109: =RC[-1]-R[-1]C[-1] -> 0
B110: =R[-3]C+1 -> 36 | C110: =R[-1]C+RC[1] -> 106 | D110: 1 | F110: =ROUND((R1003C-R4C)/(R1003C3)*RC3,0)+R4C -> 1297 | G110: =ROUND((R1003C-R4C)/(R1003C3)*RC3,0)+R4C -> 1013 | H110: =ROUND((R1003C-R4C)/(R1003C3)*RC3,0)+R4C -> 2867 | I110: =ROUND((R1003C-R4C)/(R1003C3)*RC3,0)+R4C -> 521 | J110: =ROUND((R1003C-R4C)/(R1003C3)*RC3,0)+R4C -> 282 | K110: =ROUND((R1003C-R4C)/(R1003C3)*RC3,0)+R4C -> 4017 | O110: =RC[-4]-R[-1]C[-4] -> 36 | P110: =RC[-1]-R[-1]C[-1] -> 0
B111: =R[-3]C+1 -> 36 | C111: =R[-1]C+RC[1] -> 107 | D111: 1 | F111: =ROUND((R1003C-R4C)/(R1003C3)*RC3,0)+R4C -> 1308 | G111: =ROUND((R1003C-R4C)/(R1003C3)*RC3,0)+R4C -> 1022 | H111: =ROUND((R1003C-R4C)/(R1003C3)*RC3,0)+R4C -> 2893 | I111: =ROUND((R1003C-R4C)/(R1003C3)*RC3,0)+R4C -> 526 | J111: =ROUND((R1003C-R4C)/(R1003C3)*RC3,0)+R4C -> 284 | K111: =ROUND((R1003C-R4C)/(R1003C3)*RC3,0)+R4C -> 4053 | O111: =RC[-4]-R[-1]C[-4] -> 36 | P111: =RC[-1]-R[-1]C[-1] -> 0
B112: =R[-3]C+1 -> 37 | C112: =R[-1]C+RC[1] -> 108 | D112: 1 | F112: =ROUND((R1003C-R4C)/(R1003C3)*RC3,0)+R4C -> 1320 | G112: =ROUND((R1003C-R4C)/(R1003C3)*RC3,0)+R4C -> 1031 | H112: =ROUND((R1003C-R4C)/(R1003C3)*RC3,0)+R4C -> 2919 | I112: =ROUND((R1003C-R4C)/(R1003C3)*RC3,0)+R4C -> 531 | J112: =ROUND((R1003C-R4C)/(R1003C3)*RC3,0)+R4C -> 287 | K112: =ROUND((R1003C-R4C)/(R1003C3)*RC3,0)+R4C -> 4090 | O112: =RC[-4]-R[-1]C[-4] -> 37 | P112: =RC[-1]-R[-1]C[-1] -> 1
B113: =R[-3]C+1 -> 37 | C113: =R[-1]C+RC[1] -> 109 | D113: 1 | F113: =ROUND((R1003C-R4C)/(R1003C3)*RC3,0)+R4C -> 1332 | G113: =ROUND((R1003C-R4C)/(R1003C3)*RC3,0)+R4C -> 1041 | H113: =ROUND((R1003C-R4C)/(R1003C3)*RC3,0)+R4C -> 2945 | I113: =ROUND((R1003C-R4C)/(R1003C3)*RC3,0)+R4C -> 535 | J113: =ROUND((R1003C-R4C)/(R1003C3)*RC3,0)+R4C -> 289 | K113: =ROUND((R1003C-R4C)/(R1003C3)*RC3,0)+R4C -> 4126 | O113: =RC[-4]-R[-1]C[-4] -> 36 | P113: =RC[-1]-R[-1]C[-1] -> -1
B114: =R[-3]C+1 -> 37 | C114: =R[-1]C+RC[1] -> 110 | D114: 1 | F114: =ROUND((R1003C-R4C)/(R1003C3)*RC3,0)+R4C -> 1343 | G114: =ROUND((R1003C-R4C)/(R1003C3)*RC3,0)+R4C -> 1050 | H114: =ROUND((R1003C-R4C)/(R1003C3)*RC3,0)+R4C -> 2971 | I114: =ROUND((R1003C-R4C)/(R1003C3)*RC3,0)+R4C -> 540 | J114: =ROUND((R1003C-R4C)/(R1003C3)*RC3,0)+R4C -> 292 | K114: =ROUND((R1003C-R4C)/(R1003C3)*RC3,0)+R4C -> 4162 | O114: =RC[-4]-R[-1]C[-4] -> 36 | P114: =RC[-1]-R[-1]C[-1] -> 0
B115: =R[-3]C+1 -> 38 | C115: =R[-1]C+RC[1] -> 111 | D115: 1 | F115: =ROUND((R1003C-R4C)/(R1003C3)*RC3,0)+R4C -> 1355 | G115: =ROUND((R1003C-R4C)/(R1003C3)*RC3,0)+R4C -> 1059 | H115: =ROUND((R1003C-R4C)/(R1003C3)*RC3,0)+R4C -> 2997 | I115: =ROUND((R1003C-R4C)/(R1003C3)*RC3,0)+R4C -> 545 | J115: =ROUND((R1003C-R4C)/(R1003C3)*RC3,0)+R4C -> 295 | K115: =ROUND((R1003C-R4C)/(R1003C3)*RC3,0)+R4C -> 4198 | O115: =RC[-4]-R[-1]C[-4] -> 36 | P115: =RC[-1]-R[-1]C[-1] -> 0
B116: =R[-3]C+1 -> 38 | C116: =R[-1]C+RC[1] -> 112 | D116: 1 | F116: =ROUND((R1003C-R4C)/(R1003C3)*RC3,0)+R4C -> 1367 | G116: =ROUND((R1003C-R4C)/(R1003C3)*RC3,0)+R4C -> 1068 | H116: =ROUND((R1003C-R4C)/(R1003C3)*RC3,0)+R4C -> 3022 | I116: =ROUND((R1003C-R4C)/(R1003C3)*RC3,0)+R4C -> 549 | J116: =ROUND((R1003C-R4C)/(R1003C3)*RC3,0)+R4C -> 297 | K116: =ROUND((R1003C-R4C)/(R1003C3)*RC3,0)+R4C -> 4234 | O116: =RC[-4]-R[-1]C[-4] -> 36 | P116: =RC[-1]-R[-1]C[-1] -> 0
B117: =R[-3]C+1 -> 38 | C117: =R[-1]C+RC[1] -> 113 | D117: 1 | F117: =ROUND((R1003C-R4C)/(R1003C3)*RC3,0)+R4C -> 1378 | G117: =ROUND((R1003C-R4C)/(R1003C3)*RC3,0)+R4C -> 1077 | H117: =ROUND((R1003C-R4C)/(R1003C3)*RC3,0)+R4C -> 3048 | I117: =ROUND((R1003C-R4C)/(R1003C3)*RC3,0)+R4C -> 554 | J117: =ROUND((R1003C-R4C)/(R1003C3)*RC3,0)+R4C -> 300 | K117: =ROUND((R1003C-R4C)/(R1003C3)*RC3,0)+R4C -> 4270 | O117: =RC[-4]-R[-1]C[-4] -> 36 | P117: =RC[-1]-R[-1]C[-1] -> 0
B118: =R[-3]C+1 -> 39 | C118: =R[-1]C+RC[1] -> 114 | D118: 1 | F118: =ROUND((R1003C-R4C)/(R1003C3)*RC3,0)+R4C -> 1390 | G118: =ROUND((R1003C-R4C)/(R1003C3)*RC3,0)+R4C -> 1086 | H118: =ROUND((R1003C-R4C)/(R1003C3)*RC3,0)+R4C -> 3074 | I118: =ROUND((R1003C-R4C)/(R1003C3)*RC3,0)+R4C -> 559 | J118: =ROUND((R1003C-R4C)/(R1003C3)*RC3,0)+R4C -> 302 | K118: =ROUND((R1003C-R4C)/(R1003C3)*RC3,0)+R4C -> 4307 | O118: =RC[-4]-R[-1]C[-4] -> 37 | P118: =RC[-1]-R[-1]C[-1] -> 1
B119: =R[-3]C+1 -> 39 | C119: =R[-1]C+RC[1] -> 115 | D119: 1 | F119: =ROUND((R1003C-R4C)/(R1003C3)*RC3,0)+R4C -> 1402 | G119: =ROUND((R1003C-R4C)/(R1003C3)*RC3,0)+R4C -> 1095 | H119: =ROUND((R1003C-R4C)/(R1003C3)*RC3,0)+R4C -> 3100 | I119: =ROUND((R1003C-R4C)/(R1003C3)*RC3,0)+R4C -> 563 | J119: =ROUND((R1003C-R4C)/(R1003C3)*RC3,0)+R4C -> 305 | K119: =ROUND((R1003C-R4C)/(R1003C3)*RC3,0)+R4C -> 4343 | O119: =RC[-4]-R[-1]C[-4] -> 36 | P119: =RC[-1]-R[-1]C[-1] -> -1
B120: =R[-3]C+1 -> 39 | C120: =R[-1]C+RC[1] -> 116 | D120: 1 | F120: =ROUND((R1003C-R4C)/(R1003C3)*RC3,0)+R4C -> 1413 | G120: =ROUND((R1003C-R4C)/(R1003C3)*RC3,0)+R4C -> 1104 | H120: =ROUND((R1003C-R4C)/(R1003C3)*RC3,0)+R4C -> 3126 | I120: =ROUND((R1003C-R4C)/(R1003C3)*RC3,0)+R4C -> 568 | J120: =ROUND((R1003C-R4C)/(R1003C3)*RC3,0)+R4C -> 307 | K120: =ROUND((R1003C-R4C)/(R1003C3)*RC3,0)+R4C -> 4379 | O120: =RC[-4]-R[-1]C[-4] -> 36 | P120: =RC[-1]-R[-1]C[-1] -> 0
B121: =R[-3]C+1 -> 40 | C121: =R[-1]C+RC[1] -> 117 | D121: 1 | F121: =ROUND((R1003C-R4C)/(R1003C3)*RC3,0)+R4C -> 1425 | G121: =ROUND((R1003C-R4C)/(R1003C3)*RC3,0)+R4C -> 1114 | H121: =ROUND((R1003C-R4C)/(R1003C3)*RC3,0)+R4C -> 3152 | I121: =ROUND((R1003C-R4C)/(R1003C3)*RC3,0)+R4C -> 573 | J121: =ROUND((R1003C-R4C)/(R1003C3)*RC3,0)+R4C -> 310 | K121: =ROUND((R1003C-R4C)/(R1003C3)*RC3,0)+R4C -> 4415 | O121: =RC[-4]-R[-1]C[-4] -> 36 | P121: =RC[-1]-R[-1]C[-1] -> 0
B122: =R[-3]C+1 -> 40 | C122: =R[-1]C+RC[1] -> 118 | D122: 1 | F122: =ROUND((R1003C-R4C)/(R1003C3)*RC3,0)+R4C -> 1437 | G122: =ROUND((R1003C-R4C)/(R1003C3)*RC3,0)+R4C -> 1123 | H122: =ROUND((R1003C-R4C)/(R1003C3)*RC3,0)+R4C -> 3177 | I122: =ROUND((R1003C-R4C)/(R1003C3)*RC3,0)+R4C -> 578 | J122: =ROUND((R1003C-R4C)/(R1003C3)*RC3,0)+R4C -> 312 | K122: =ROUND((R1003C-R4C)/(R1003C3)*RC3,0)+R4C -> 4451 | O122: =RC[-4]-R[-1]C[-4] -> 36 | P122: =RC[-1]-R[-1]C[-1] -> 0
B123: =R[-3]C+1 -> 40 | C123: =R[-1]C+RC[1] -> 119 | D123: 1 | F123: =ROUND((R1003C-R4C)/(R1003C3)*RC3,0)+R4C -> 1449 | G123: =ROUND((R1003C-R4C)/(R1003C3)*RC3,0)+R4C -> 1132 | H123: =ROUND((R1003C-R4C)/(R1003C3)*RC3,0)+R4C -> 3203 | I123: =ROUND((R1003C-R4C)/(R1003C3)*RC3,0)+R4C -> 582 | J123: =ROUND((R1003C-R4C)/(R1003C3)*RC3,0)+R4C -> 315 | K123: =ROUND((R1003C-R4C)/(R1003C3)*RC3,0)+R4C -> 4488 | O123: =RC[-4]-R[-1]C[-4] -> 37 | P123: =RC[-1]-R[-1]C[-1] -> 1
B124: =R[-3]C+1 -> 41 | C124: =R[-1]C+RC[1] -> 120 | D124: 1 | F124: =ROUND((R1003C-R4C)/(R1003C3)*RC3,0)+R4C -> 1460 | G124: =ROUND((R1003C-R4C)/(R1003C3)*RC3,0)+R4C -> 1141 | H124: =ROUND((R1003C-R4C)/(R1003C3)*RC3,0)+R4C -> 3229 | I124: =ROUND((R1003C-R4C)/(R1003C3)*RC3,0)+R4C -> 587 | J124: =ROUND((R1003C-R4C)/(R1003C3)*RC3,0)+R4C -> 317 | K124: =ROUND((R1003C-R4C)/(R1003C3)*RC3,0)+R4C -> 4524 | O124: =RC[-4]-R[-1]C[-4] -> 36 | P124: =RC[-1]-R[-1]C[-1] -> -1
B125: =R[-3]C+1 -> 41 | C125: =R[-1]C+RC[1] -> 121 | D125: 1 | F125: =ROUND((R1003C-R4C)/(R1003C3)*RC3,0)+R4C -> 1472 | G125: =ROUND((R1003C-R4C)/(R1003C3)*RC3,0)+R4C -> 1150 | H125: =ROUND((R1003C-R4C)/(R1003C3)*RC3,0)+R4C -> 3255 | I125: =ROUND((R1003C-R4C)/(R1003C3)*RC3,0)+R4C -> 592 | J125: =ROUND((R1003C-R4C)/(R1003C3)*RC3,0)+R4C -> 320 | K125: =ROUND((R1003C-R4C)/(R1003C3)*RC3,0)+R4C -> 4560 | O125: =RC[-4]-R[-1]C[-4] -> 36 | P125: =RC[-1]-R[-1]C[-1] -> 0
B126: =R[-3]C+1 -> 41 | C126: =R[-1]C+RC[1] -> 122 | D126: 1 | F126: =ROUND((R1003C-R4C)/(R1003C3)*RC3,0)+R4C -> 1484 | G126: =ROUND((R1003C-R4C)/(R1003C3)*RC3,0)+R4C -> 1159 | H126: =ROUND((R1003C-R4C)/(R1003C3)*RC3,0)+R4C -> 3281 | I126: =ROUND((R1003C-R4C)/(R1003C3)*RC3,0)+R4C -> 596 | J126: =ROUND((R1003C-R4C)/(R1003C3)*RC3,0)+R4C -> 322 | K126: =ROUND((R1003C-R4C)/(R1003C3)*RC3,0)+R4C -> 4596 | O126: =RC[-4]-R[-1]C[-4] -> 36 | P126: =RC[-1]-R[-1]C[-1] -> 0
B127: =R[-3]C+1 -> 42 | C127: =R[-1]C+RC[1] -> 123 | D127: 1 | F127: =ROUND((R1003C-R4C)/(R1003C3)*RC3,0)+R4C -> 1495 | G127: =ROUND((R1003C-R4C)/(R1003C3)*RC3,0)+R4C -> 1168 | H127: =ROUND((R1003C-R4C)/(R1003C3)*RC3,0)+R4C -> 3306 | I127: =ROUND((R1003C-R4C)/(R1003C3)*RC3,0)+R4C -> 601 | J127: =ROUND((R1003C-R4C)/(R1003C3)*RC3,0)+R4C -> 325 | K127: =ROUND((R1003C-R4C)/(R1003C3)*RC3,0)+R4C -> 4632 | O127: =RC[-4]-R[-1]C[-4] -> 36 | P127: =RC[-1]-R[-1]C[-1] -> 0
B128: =R[-3]C+1 -> 42 | C128: =R[-1]C+RC[1] -> 124 | D128: 1 | F128: =ROUND((R1003C-R4C)/(R1003C3)*RC3,0)+R4C -> 1507 | G128: =ROUND((R1003C-R4C)/(R1003C3)*RC3,0)+R4C -> 1177 | H128: =ROUND((R1003C-R4C)/(R1003C3)*RC3,0)+R4C -> 3332 | I128: =ROUND((R1003C-R4C)/(R1003C3)*RC3,0)+R4C -> 606 | J128: =ROUND((R1003C-R4C)/(R1003C3)*RC3,0)+R4C -> 328 | K128: =ROUND((R1003C-R4C)/(R1003C3)*RC3,0)+R4C -> 4668 | O128: =RC[-4]-R[-1]C[-4] -> 36 | P128: =RC[-1]-R[-1]C[-1] -> 0
B129: =R[-3]C+1 -> 42 | C129: =R[-1]C+RC[1] -> 125 | D129: 1 | F129: =ROUND((R1003C-R4C)/(R1003C3)*RC3,0)+R4C -> 1519 | G129: =ROUND((R1003C-R4C)/(R1003C3)*RC3,0)+R4C -> 1187 | H129: =ROUND((R1003C-R4C)/(R1003C3)*RC3,0)+R4C -> 3358 | I129: =ROUND((R1003C-R4C)/(R1003C3)*RC3,0)+R4C -> 610 | J129: =ROUND((R1003C-R4C)/(R1003C3)*RC3,0)+R4C -> 330 | K129: =ROUND((R1003C-R4C)/(R1003C3)*RC3,0)+R4C -> 4705 | O129: =RC[-4]-R[-1]C[-4] -> 37 | P129: =RC[-1]-R[-1]C[-1] -> 1
B130: =R[-3]C+1 -> 43 | C130: =R[-1]C+RC[1] -> 126 | D130: 1 | F130: =ROUND((R1003C-R4C)/(R1003C3)*RC3,0)+R4C -> 1530 | G130: =ROUND((R1003C-R4C)/(R1003C3)*RC3,0)+R4C -> 1196 | H130: =ROUND((R1003C-R4C)/(R1003C3)*RC3,0)+R4C -> 3384 | I130: =ROUND((R1003C-R4C)/(R1003C3)*RC3,0)+R4C -> 615 | J130: =ROUND((R1003C-R4C)/(R1003C3)*RC3,0)+R4C -> 333 | K130: =ROUND((R1003C-R4C)/(R1003C3)*RC3,0)+R4C -> 4741 | O130: =RC[-4]-R[-1]C[-4] -> 36 | P130: =RC[-1]-R[-1]C[-1] -> -1
B131: =R[-3]C+1 -> 43 | C131: =R[-1]C+RC[1] -> 127 | D131: 1 | F131: =ROUND((R1003C-R4C)/(R1003C3)*RC3,0)+R4C -> 1542 | G131: =ROUND((R1003C-R4C)/(R1003C3)*RC3,0)+R4C -> 1205 | H131: =ROUND((R1003C-R4C)/(R1003C3)*RC3,0)+R4C -> 3410 | I131: =ROUND((R1003C-R4C)/(R1003C3)*RC3,0)+R4C -> 620 | J131: =ROUND((R1003C-R4C)/(R1003C3)*RC3,0)+R4C -> 335 | K131: =ROUND((R1003C-R4C)/(R1003C3)*RC3,0)+R4C -> 4777 | O131: =RC[-4]-R[-1]C[-4] -> 36 | P131: =RC[-1]-R[-1]C[-1] -> 0
B132: =R[-3]C+1 -> 43 | C132: =R[-1]C+RC[1] -> 128 | D132: 1 | F132: =ROUND((R1003C-R4C)/(R1003C3)*RC3,0)+R4C -> 1554 | G132: =ROUND((R1003C-R4C)/(R1003C3)*RC3,0)+R4C -> 1214 | H132: =ROUND((R1003C-R4C)/(R1003C3)*RC3,0)+R4C -> 3436 | I132: =ROUND((R1003C-R4C)/(R1003C3)*RC3,0)+R4C -> 624 | J132: =ROUND((R1003C-R4C)/(R1003C3)*RC3,0)+R4C -> 338 | K132: =ROUND((R1003C-R4C)/(R1003C3)*RC3,0)+R4C -> 4813 | O132: =RC[-4]-R[-1]C[-4] -> 36 | P132: =RC[-1]-R[-1]C[-1] -> 0
B133: =R[-3]C+1 -> 44 | C133: =R[-1]C+RC[1] -> 129 | D133: 1 | F133: =ROUND((R1003C-R4C)/(R1003C3)*RC3,0)+R4C -> 1565 | G133: =ROUND((R1003C-R4C)/(R1003C3)*RC3,0)+R4C -> 1223 | H133: =ROUND((R1003C-R4C)/(R1003C3)*RC3,0)+R4C -> 3461 | I133: =ROUND((R1003C-R4C)/(R1003C3)*RC3,0)+R4C -> 629 | J133: =ROUND((R1003C-R4C)/(R1003C3)*RC3,0)+R4C -> 340 | K133: =ROUND((R1003C-R4C)/(R1003C3)*RC3,0)+R4C -> 4849 | O133: =RC[-4]-R[-1]C[-4] -> 36 | P133: =RC[-1]-R[-1]C[-1] -> 0
B134: =R[-3]C+1 -> 44 | C134: =R[-1]C+RC[1] -> 130 | D134: 1 | F134: =ROUND((R1003C-R4C)/(R1003C3)*RC3,0)+R4C -> 1577 | G134: =ROUND((R1003C-R4C)/(R1003C3)*RC3,0)+R4C -> 1232 | H134: =ROUND((R1003C-R4C)/(R1003C3)*RC3,0)+R4C -> 3487 | I134: =ROUND((R1003C-R4C)/(R1003C3)*RC3,0)+R4C -> 634 | J134: =ROUND((R1003C-R4C)/(R1003C3)*RC3,0)+R4C -> 343 | K134: =ROUND((R1003C-R4C)/(R1003C3)*RC3,0)+R4C -> 4886 | O134: =RC[-4]-R[-1]C[-4] -> 37 | P134: =RC[-1]-R[-1]C[-1] -> 1
B135: =R[-3]C+1 -> 44 | C135: =R[-1]C+RC[1] -> 131 | D135: 1 | F135: =ROUND((R1003C-R4C)/(R1003C3)*RC3,0)+R4C -> 1589 | G135: =ROUND((R1003C-R4C)/(R1003C3)*RC3,0)+R4C -> 1241 | H135: =ROUND((R1003C-R4C)/(R1003C3)*RC3,0)+R4C -> 3513 | I135: =ROUND((R1003C-R4C)/(R1003C3)*RC3,0)+R4C -> 638 | J135: =ROUND((R1003C-R4C)/(R1003C3)*RC3,0)+R4C -> 345 | K135: =ROUND((R1003C-R4C)/(R1003C3)*RC3,0)+R4C -> 4922 | O135: =RC[-4]-R[-1]C[-4] -> 36 | P135: =RC[-1]-R[-1]C[-1] -> -1
B136: =R[-3]C+1 -> 45 | C136: =R[-1]C+RC[1] -> 132 | D136: 1 | F136: =ROUND((R1003C-R4C)/(R1003C3)*RC3,0)+R4C -> 1600 | G136: =ROUND((R1003C-R4C)/(R1003C3)*RC3,0)+R4C -> 1250 | H136: =ROUND((R1003C-R4C)/(R1003C3)*RC3,0)+R4C -> 3539 | I136: =ROUND((R1003C-R4C)/(R1003C3)*RC3,0)+R4C -> 643 | J136: =ROUND((R1003C-R4C)/(R1003C3)*RC3,0)+R4C -> 348 | K136: =ROUND((R1003C-R4C)/(R1003C3)*RC3,0)+R4C -> 4958 | O136: =RC[-4]-R[-1]C[-4] -> 36 | P136: =RC[-1]-R[-1]C[-1] -> 0
B137: =R[-3]C+1 -> 45 | C137: =R[-1]C+RC[1] -> 133 | D137: 1 | F137: =ROUND((R1003C-R4C)/(R1003C3)*RC3,0)+R4C -> 1612 | G137: =ROUND((R1003C-R4C)/(R1003C3)*RC3,0)+R4C -> 1260 | H137: =ROUND((R1003C-R4C)/(R1003C3)*RC3,0)+R4C -> 3565 | I137: =ROUND((R1003C-R4C)/(R1003C3)*RC3,0)+R4C -> 648 | J137: =ROUND((R1003C-R4C)/(R1003C3)*RC3,0)+R4C -> 350 | K137: =ROUND((R1003C-R4C)/(R1003C3)*RC3,0)+R4C -> 4994 | O137: =RC[-4]-R[-1]C[-4] -> 36 | P137: =RC[-1]-R[-1]C[-1] -> 0
B138: =R[-3]C+1 -> 45 | C138: =R[-1]C+RC[1] -> 134 | D138: 1 | F138: =ROUND((R1003C-R4C)/(R1003C3)*RC3,0)+R4C -> 1624 | G138: =ROUND((R1003C-R4C)/(R1003C3)*RC3,0)+R4C -> 1269 | H138: =ROUND((R1003C-R4C)/(R1003C3)*RC3,0)+R4C -> 3591 | I138: =ROUND((R1003C-R4C)/(R1003C3)*RC3,0)+R4C -> 653 | J138: =ROUND((R1003C-R4C)/(R1003C3)*RC3,0)+R4C -> 353 | K138: =ROUND((R1003C-R4C)/(R1003C3)*RC3,0)+R4C -> 5030 | O138: =RC[-4]-R[-1]C[-4] -> 36 | P138: =RC[-1]-R[-1]C[-1] -> 0
B139: =R[-3]C+1 -> 46 | C139: =R[-1]C+RC[1] -> 135 | D139: 1 | F139: =ROUND((R1003C-R4C)/(R1003C3)*RC3,0)+R4C -> 1635 | G139: =ROUND((R1003C-R4C)/(R1003C3)*RC3,0)+R4C -> 1278 | H139: =ROUND((R1003C-R4C)/(R1003C3)*RC3,0)+R4C -> 3616 | I139: =ROUND((R1003C-R4C)/(R1003C3)*RC3,0)+R4C -> 657 | J139: =ROUND((R1003C-R4C)/(R1003C3)*RC3,0)+R4C -> 355 | K139: =ROUND((R1003C-R4C)/(R1003C3)*RC3,0)+R4C -> 5066 | O139: =RC[-4]-R[-1]C[-4] -> 36 | P139: =RC[-1]-R[-1]C[-1] -> 0
B140: =R[-3]C+1 -> 46 | C140: =R[-1]C+RC[1] -> 136 | D140: 1 | F140: =ROUND((R1003C-R4C)/(R1003C3)*RC3,0)+R4C -> 1647 | G140: =ROUND((R1003C-R4C)/(R1003C3)*RC3,0)+R4C -> 1287 | H140: =ROUND((R1003C-R4C)/(R1003C3)*RC3,0)+R4C -> 3642 | I140: =ROUND((R1003C-R4C)/(R1003C3)*RC3,0)+R4C -> 662 | J140: =ROUND((R1003C-R4C)/(R1003C3)*RC3,0)+R4C -> 358 | K140: =ROUND((R1003C-R4C)/(R1003C3)*RC3,0)+R4C -> 5103 | O140: =RC[-4]-R[-1]C[-4] -> 37 | P140: =RC[-1]-R[-1]C[-1] -> 1
B141: =R[-3]C+1 -> 46 | C141: =R[-1]C+RC[1] -> 137 | D141: 1 | F141: =ROUND((R1003C-R4C)/(R1003C3)*RC3,0)+R4C -> 1659 | G141: =ROUND((R1003C-R4C)/(R1003C3)*RC3,0)+R4C -> 1296 | H141: =ROUND((R1003C-R4C)/(R1003C3)*RC3,0)+R4C -> 3668 | I141: =ROUND((R1003C-R4C)/(R1003C3)*RC3,0)+R4C -> 667 | J141: =ROUND((R1003C-R4C)/(R1003C3)*RC3,0)+R4C -> 361 | K141: =ROUND((R1003C-R4C)/(R1003C3)*RC3,0)+R4C -> 5139 | O141: =RC[-4]-R[-1]C[-4] -> 36 | P141: =RC[-1]-R[-1]C[-1] -> -1
B142: =R[-3]C+1 -> 47 | C142: =R[-1]C+RC[1] -> 138 | D142: 1 | F142: =ROUND((R1003C-R4C)/(R1003C3)*RC3,0)+R4C -> 1670 | G142: =ROUND((R1003C-R4C)/(R1003C3)*RC3,0)+R4C -> 1305 | H142: =ROUND((R1003C-R4C)/(R1003C3)*RC3,0)+R4C -> 3694 | I142: =ROUND((R1003C-R4C)/(R1003C3)*RC3,0)+R4C -> 671 | J142: =ROUND((R1003C-R4C)/(R1003C3)*RC3,0)+R4C -> 363 | K142: =ROUND((R1003C-R4C)/(R1003C3)*RC3,0)+R4C -> 5175 | O142: =RC[-4]-R[-1]C[-4] -> 36 | P142: =RC[-1]-R[-1]C[-1] -> 0
B143: =R[-3]C+1 -> 47 | C143: =R[-1]C+RC[1] -> 139 | D143: 1 | F143: =ROUND((R1003C-R4C)/(R1003C3)*RC3,0)+R4C -> 1682 | G143: =ROUND((R1003C-R4C)/(R1003C3)*RC3,0)+R4C -> 1314 | H143: =ROUND((R1003C-R4C)/(R1003C3)*RC3,0)+R4C -> 3720 | I143: =ROUND((R1003C-R4C)/(R1003C3)*RC3,0)+R4C -> 676 | J143: =ROUND((R1003C-R4C)/(R1003C3)*RC3,0)+R4C -> 366 | K143: =ROUND((R1003C-R4C)/(R1003C3)*RC3,0)+R4C -> 5211 | O143: =RC[-4]-R[-1]C[-4] -> 36 | P143: =RC[-1]-R[-1]C[-1] -> 0
B144: =R[-3]C+1 -> 47 | C144: =R[-1]C+RC[1] -> 140 | D144: 1 | F144: =ROUND((R1003C-R4C)/(R1003C3)*RC3,0)+R4C -> 1694 | G144: =ROUND((R1003C-R4C)/(R1003C3)*RC3,0)+R4C -> 1323 | H144: =ROUND((R1003C-R4C)/(R1003C3)*RC3,0)+R4C -> 3745 | I144: =ROUND((R1003C-R4C)/(R1003C3)*RC3,0)+R4C -> 681 | J144: =ROUND((R1003C-R4C)/(R1003C3)*RC3,0)+R4C -> 368 | K144: =ROUND((R1003C-R4C)/(R1003C3)*RC3,0)+R4C -> 5247 | O144: =RC[-4]-R[-1]C[-4] -> 36 | P144: =RC[-1]-R[-1]C[-1] -> 0
B145: =R[-3]C+1 -> 48 | C145: =R[-1]C+RC[1] -> 141 | D145: 1 | F145: =ROUND((R1003C-R4C)/(R1003C3)*RC3,0)+R4C -> 1705 | G145: =ROUND((R1003C-R4C)/(R1003C3)*RC3,0)+R4C -> 1333 | H145: =ROUND((R1003C-R4C)/(R1003C3)*RC3,0)+R4C -> 3771 | I145: =ROUND((R1003C-R4C)/(R1003C3)*RC3,0)+R4C -> 685 | J145: =ROUND((R1003C-R4C)/(R1003C3)*RC3,0)+R4C -> 371 | K145: =ROUND((R1003C-R4C)/(R1003C3)*RC3,0)+R4C -> 5284 | O145: =RC[-4]-R[-1]C[-4] -> 37 | P145: =RC[-1]-R[-1]C[-1] -> 1
B146: =R[-3]C+1 -> 48 | C146: =R[-1]C+RC[1] -> 142 | D146: 1 | F146: =ROUND((R1003C-R4C)/(R1003C3)*RC3,0)+R4C -> 1717 | G146: =ROUND((R1003C-R4C)/(R1003C3)*RC3,0)+R4C -> 1342 | H146: =ROUND((R1003C-R4C)/(R1003C3)*RC3,0)+R4C -> 3797 | I146: =ROUND((R1003C-R4C)/(R1003C3)*RC3,0)+R4C -> 690 | J146: =ROUND((R1003C-R4C)/(R1003C3)*RC3,0)+R4C -> 373 | K146: =ROUND((R1003C-R4C)/(R1003C3)*RC3,0)+R4C -> 5320 | O146: =RC[-4]-R[-1]C[-4] -> 36 | P146: =RC[-1]-R[-1]C[-1] -> -1
B147: =R[-3]C+1 -> 48 | C147: =R[-1]C+RC[1] -> 143 | D147: 1 | F147: =ROUND((R1003C-R4C)/(R1003C3)*RC3,0)+R4C -> 1729 | G147: =ROUND((R1003C-R4C)/(R1003C3)*RC3,0)+R4C -> 1351 | H147: =ROUND((R1003C-R4C)/(R1003C3)*RC3,0)+R4C -> 3823 | I147: =ROUND((R1003C-R4C)/(R1003C3)*RC3,0)+R4C -> 695 | J147: =ROUND((R1003C-R4C)/(R1003C3)*RC3,0)+R4C -> 376 | K147: =ROUND((R1003C-R4C)/(R1003C3)*RC3,0)+R4C -> 5356 | O147: =RC[-4]-R[-1]C[-4] -> 36 | P147: =RC[-1]-R[-1]C[-1] -> 0
B148: =R[-3]C+1 -> 49 | C148: =R[-1]C+RC[1] -> 144 | D148: 1 | F148: =ROUND((R1003C-R4C)/(R1003C3)*RC3,0)+R4C -> 1740 | G148: =ROUND((R1003C-R4C)/(R1003C3)*RC3,0)+R4C -> 1360 | H148: =ROUND((R1003C-R4C)/(R1003C3)*RC3,0)+R4C -> 3849 | I148: =ROUND((R1003C-R4C)/(R1003C3)*RC3,0)+R4C -> 699 | J148: =ROUND((R1003C-R4C)/(R1003C3)*RC3,0)+R4C -> 378 | K148: =ROUND((R1003C-R4C)/(R1003C3)*RC3,0)+R4C -> 5392 | O148: =RC[-4]-R[-1]C[-4] -> 36 | P148: =RC[-1]-R[-1]C[-1] -> 0
B149: =R[-3]C+1 -> 49 | C149: =R[-1]C+RC[1] -> 145 | D149: 1 | F149: =ROUND((R1003C-R4C)/(R1003C3)*RC3,0)+R4C -> 1752 | G149: =ROUND((R1003C-R4C)/(R1003C3)*RC3,0)+R4C -> 1369 | H149: =ROUND((R1003C-R4C)/(R1003C3)*RC3,0)+R4C -> 3875 | I149: =ROUND((R1003C-R4C)/(R1003C3)*RC3,0)+R4C -> 704 | J149: =ROUND((R1003C-R4C)/(R1003C3)*RC3,0)+R4C -> 381 | K149: =ROUND((R1003C-R4C)/(R1003C3)*RC3,0)+R4C -> 5428 | O149: =RC[-4]-R[-1]C[-4] -> 36 | P149: =RC[-1]-R[-1]C[-1] -> 0
B150: =R[-3]C+1 -> 49 | C150: =R[-1]C+RC[1] -> 146 | D150: 1 | F150: =ROUND((R1003C-R4C)/(R1003C3)*RC3,0)+R4C -> 1764 | G150: =ROUND((R1003C-R4C)/(R1003C3)*RC3,0)+R4C -> 1378 | H150: =ROUND((R1003C-R4C)/(R1003C3)*RC3,0)+R4C -> 3900 | I150: =ROUND((R1003C-R4C)/(R1003C3)*RC3,0)+R4C -> 709 | J150: =ROUND((R1003C-R4C)/(R1003C3)*RC3,0)+R4C -> 383 | K150: =ROUND((R1003C-R4C)/(R1003C3)*RC3,0)+R4C -> 5464 | O150: =RC[-4]-R[-1]C[-4] -> 36 | P150: =RC[-1]-R[-1]C[-1] -> 0
B151: =R[-3]C+1 -> 50 | C151: =R[-1]C+RC[1] -> 147 | D151: 1 | F151: =ROUND((R1003C-R4C)/(R1003C3)*RC3,0)+R4C -> 1775 | G151: =ROUND((R1003C-R4C)/(R1003C3)*RC3,0)+R4C -> 1387 | H151: =ROUND((R1003C-R4C)/(R1003C3)*RC3,0)+R4C -> 3926 | I151: =ROUND((R1003C-R4C)/(R1003C3)*RC3,0)+R4C -> 714 | J151: =ROUND((R1003C-R4C)/(R1003C3)*RC3,0)+R4C -> 386 | K151: =ROUND((R1003C-R4C)/(R1003C3)*RC3,0)+R4C -> 5501 | O151: =RC[-4]-R[-1]C[-4] -> 37 | P151: =RC[-1]-R[-1]C[-1] -> 1
B152: =R[-3]C+1 -> 50 | C152: =R[-1]C+RC[1] -> 148 | D152: 1 | F152: =ROUND((R1003C-R4C)/(R1003C3)*RC3,0)+R4C -> 1787 | G152: =ROUND((R1003C-R4C)/(R1003C3)*RC3,0)+R4C -> 1396 | H152: =ROUND((R1003C-R4C)/(R1003C3)*RC3,0)+R4C -> 3952 | I152: =ROUND((R1003C-R4C)/(R1003C3)*RC3,0)+R4C -> 718 | J152: =ROUND((R1003C-R4C)/(R1003C3)*RC3,0)+R4C -> 388 | K152: =ROUND((R1003C-R4C)/(R1003C3)*RC3,0)+R4C -> 5537 | O152: =RC[-4]-R[-1]C[-4] -> 36 | P152: =RC[-1]-R[-1]C[-1] -> -1
B153: =R[-3]C+1 -> 50 | C153: =R[-1]C+RC[1] -> 149 | D153: 1 | F153: =ROUND((R1003C-R4C)/(R1003C3)*RC3,0)+R4C -> 1799 | G153: =ROUND((R1003C-R4C)/(R1003C3)*RC3,0)+R4C -> 1405 | H153: =ROUND((R1003C-R4C)/(R1003C3)*RC3,0)+R4C -> 3978 | I153: =ROUND((R1003C-R4C)/(R1003C3)*RC3,0)+R4C -> 723 | J153: =ROUND((R1003C-R4C)/(R1003C3)*RC3,0)+R4C -> 391 | K153: =ROUND((R1003C-R4C)/(R1003C3)*RC3,0)+R4C -> 5573 | O153: =RC[-4]-R[-1]C[-4] -> 36 | P153: =RC[-1]-R[-1]C[-1] -> 0
B154: =R[-3]C+1 -> 51 | C154: =R[-1]C+RC[1] -> 150 | D154: 1 | F154: =ROUND((R1003C-R4C)/(R1003C3)*RC3,0)+R4C -> 1811 | G154: =ROUND((R1003C-R4C)/(R1003C3)*RC3,0)+R4C -> 1415 | H154: =ROUND((R1003C-R4C)/(R1003C3)*RC3,0)+R4C -> 4004 | I154: =ROUND((R1003C-R4C)/(R1003C3)*RC3,0)+R4C -> 728 | J154: =ROUND((R1003C-R4C)/(R1003C3)*RC3,0)+R4C -> 393 | K154: =ROUND((R1003C-R4C)/(R1003C3)*RC3,0)+R4C -> 5609 | O154: =RC[-4]-R[-1]C[-4] -> 36 | P154: =RC[-1]-R[-1]C[-1] -> 0
B155: =R[-3]C+1 -> 51 | C155: =R[-1]C+RC[1] -> 151 | D155: 1 | F155: =ROUND((R1003C-R4C)/(R1003C3)*RC3,0)+R4C -> 1822 | G155: =ROUND((R1003C-R4C)/(R1003C3)*RC3,0)+R4C -> 1424 | H155: =ROUND((R1003C-R4C)/(R1003C3)*RC3,0)+R4C -> 4030 | I155: =ROUND((R1003C-R4C)/(R1003C3)*RC3,0)+R4C -> 732 | J155: =ROUND((R1003C-R4C)/(R1003C3)*RC3,0)+R4C -> 396 | K155: =ROUND((R1003C-R4C)/(R1003C3)*RC3,0)+R4C -> 5645 | O155: =RC[-4]-R[-1]C[-4] -> 36 | P155: =RC[-1]-R[-1]C[-1] -> 0
B156: =R[-3]C+1 -> 51 | C156: =R[-1]C+RC[1] -> 152 | D156: 1 | F156: =ROUND((R1003C-R4C)/(R1003C3)*RC3,0)+R4C -> 1834 | G156: =ROUND((R1003C-R4C)/(R1003C3)*RC3,0)+R4C -> 1433 | H156: =ROUND((R1003C-R4C)/(R1003C3)*RC3,0)+R4C -> 4055 | I156: =ROUND((R1003C-R4C)/(R1003C3)*RC3,0)+R4C -> 737 | J156: =ROUND((R1003C-R4C)/(R1003C3)*RC3,0)+R4C -> 399 | K156: =ROUND((R1003C-R4C)/(R1003C3)*RC3,0)+R4C -> 5682 | O156: =RC[-4]-R[-1]C[-4] -> 37 | P156: =RC[-1]-R[-1]C[-1] -> 1
B157: =R[-3]C+1 -> 52 | C157: =R[-1]C+RC[1] -> 153 | D157: 1 | F157: =ROUND((R1003C-R4C)/(R1003C3)*RC3,0)+R4C -> 1846 | G157: =ROUND((R1003C-R4C)/(R1003C3)*RC3,0)+R4C -> 1442 | H157: =ROUND((R1003C-R4C)/(R1003C3)*RC3,0)+R4C -> 4081 | I157: =ROUND((R1003C-R4C)/(R1003C3)*RC3,0)+R4C -> 742 | J157: =ROUND((R1003C-R4C)/(R1003C3)*RC3,0)+R4C -> 401 | K157: =ROUND((R1003C-R4C)/(R1003C3)*RC3,0)+R4C -> 5718 | O157: =RC[-4]-R[-1]C[-4] -> 36 | P157: =RC[-1]-R[-1]C[-1] -> -1
B158: =R[-3]C+1 -> 52 | C158: =R[-1]C+RC[1] -> 154 | D158: 1 | F158: =ROUND((R1003C-R4C)/(R1003C3)*RC3,0)+R4C -> 1857 | G158: =ROUND((R1003C-R4C)/(R1003C3)*RC3,0)+R4C -> 1451 | H158: =ROUND((R1003C-R4C)/(R1003C3)*RC3,0)+R4C -> 4107 | I158: =ROUND((R1003C-R4C)/(R1003C3)*RC3,0)+R4C -> 746 | J158: =ROUND((R1003C-R4C)/(R1003C3)*RC3,0)+R4C -> 404 | K158: =ROUND((R1003C-R4C)/(R1003C3)*RC3,0)+R4C -> 5754 | O158: =RC[-4]-R[-1]C[-4] -> 36 | P158: =RC[-1]-R[-1]C[-1] -> 0
B159: =R[-3]C+1 -> 52 | C159: =R[-1]C+RC[1] -> 155 | D159: 1 | F159: =ROUND((R1003C-R4C)/(R1003C3)*RC3,0)+R4C -> 1869 | G159: =ROUND((R1003C-R4C)/(R1003C3)*RC3,0)+R4C -> 1460 | H159: =ROUND((R1003C-R4C)/(R1003C3)*RC3,0)+R4C -> 4133 | I159: =ROUND((R1003C-R4C)/(R1003C3)*RC3,0)+R4C -> 751 | J159: =ROUND((R1003C-R4C)/(R1003C3)*RC3,0)+R4C -> 406 | K159: =ROUND((R1003C-R4C)/(R1003C3)*RC3,0)+R4C -> 5790 | O159: =RC[-4]-R[-1]C[-4] -> 36 | P159: =RC[-1]-R[-1]C[-1] -> 0
B160: =R[-3]C+1 -> 53 | C160: =R[-1]C+RC[1] -> 156 | D160: 1 | F160: =ROUND((R1003C-R4C)/(R1003C3)*RC3,0)+R4C -> 1881 | G160: =ROUND((R1003C-R4C)/(R1003C3)*RC3,0)+R4C -> 1469 | H160: =ROUND((R1003C-R4C)/(R1003C3)*RC3,0)+R4C -> 4159 | I160: =ROUND((R1003C-R4C)/(R1003C3)*RC3,0)+R4C -> 756 | J160: =ROUND((R1003C-R4C)/(R1003C3)*RC3,0)+R4C -> 409 | K160: =ROUND((R1003C-R4C)/(R1003C3)*RC3,0)+R4C -> 5826 | O160: =RC[-4]-R[-1]C[-4] -> 36 | P160: =RC[-1]-R[-1]C[-1] -> 0
B161: =R[-3]C+1 -> 53 | C161: =R[-1]C+RC[1] -> 157 | D161: 1 | F161: =ROUND((R1003C-R4C)/(R1003C3)*RC3,0)+R4C -> 1892 | G161: =ROUND((R1003C-R4C)/(R1003C3)*RC3,0)+R4C -> 1478 | H161: =ROUND((R1003C-R4C)/(R1003C3)*RC3,0)+R4C -> 4184 | I161: =ROUND((R1003C-R4C)/(R1003C3)*RC3,0)+R4C -> 760 | J161: =ROUND((R1003C-R4C)/(R1003C3)*RC3,0)+R4C -> 411 | K161: =ROUND((R1003C-R4C)/(R1003C3)*RC3,0)+R4C -> 5862 | O161: =RC[-4]-R[-1]C[-4] -> 36 | P161: =RC[-1]-R[-1]C[-1] -> 0
B162: =R[-3]C+1 -> 53 | C162: =R[-1]C+RC[1] -> 158 | D162: 1 | F162: =ROUND((R1003C-R4C)/(R1003C3)*RC3,0)+R4C -> 1904 | G162: =ROUND((R1003C-R4C)/(R1003C3)*RC3,0)+R4C -> 1488 | H162: =ROUND((R1003C-R4C)/(R1003C3)*RC3,0)+R4C -> 4210 | I162: =ROUND((R1003C-R4C)/(R1003C3)*RC3,0)+R4C -> 765 | J162: =ROUND((R1003C-R4C)/(R1003C3)*RC3,0)+R4C -> 414 | K162: =ROUND((R1003C-R4C)/(R1003C3)*RC3,0)+R4C -> 5899 | O162: =RC[-4]-R[-1]C[-4] -> 37 | P162: =RC[-1]-R[-1]C[-1] -> 1
B163: =R[-3]C+1 -> 54 | C163: =R[-1]C+RC[1] -> 159 | D163: 1 | F163: =ROUND((R1003C-R4C)/(R1003C3)*RC3,0)+R4C -> 1916 | G163: =ROUND((R1003C-R4C)/(R1003C3)*RC3,0)+R4C -> 1497 | H163: =ROUND((R1003C-R4C)/(R1003C3)*RC3,0)+R4C -> 4236 | I163: =ROUND((R1003C-R4C)/(R1003C3)*RC3,0)+R4C -> 770 | J163: =ROUND((R1003C-R4C)/(R1003C3)*RC3,0)+R4C -> 416 | K163: =ROUND((R1003C-R4C)/(R1003C3)*RC3,0)+R4C -> 5935 | O163: =RC[-4]-R[-1]C[-4] -> 36 | P163: =RC[-1]-R[-1]C[-1] -> -1
B164: =R[-3]C+1 -> 54 | C164: =R[-1]C+RC[1] -> 160 | D164: 1 | F164: =ROUND((R1003C-R4C)/(R1003C3)*RC3,0)+R4C -> 1927 | G164: =ROUND((R1003C-R4C)/(R1003C3)*RC3,0)+R4C -> 1506 | H164: =ROUND((R1003C-R4C)/(R1003C3)*RC3,0)+R4C -> 4262 | I164: =ROUND((R1003C-R4C)/(R1003C3)*RC3,0)+R4C -> 775 | J164: =ROUND((R1003C-R4C)/(R1003C3)*RC3,0)+R4C -> 419 | K164: =ROUND((R1003C-R4C)/(R1003C3)*RC3,0)+R4C -> 5971 | O164: =RC[-4]-R[-1]C[-4] -> 36 | P164: =RC[-1]-R[-1]C[-1] -> 0
B165: =R[-3]C+1 -> 54 | C165: =R[-1]C+RC[1] -> 161 | D165: 1 | F165: =ROUND((R1003C-R4C)/(R1003C3)*RC3,0)+R4C -> 1939 | G165: =ROUND((R1003C-R4C)/(R1003C3)*RC3,0)+R4C -> 1515 | H165: =ROUND((R1003C-R4C)/(R1003C3)*RC3,0)+R4C -> 4288 | I165: =ROUND((R1003C-R4C)/(R1003C3)*RC3,0)+R4C -> 779 | J165: =ROUND((R1003C-R4C)/(R1003C3)*RC3,0)+R4C -> 421 | K165: =ROUND((R1003C-R4C)/(R1003C3)*RC3,0)+R4C -> 6007 | O165: =RC[-4]-R[-1]C[-4] -> 36 | P165: =RC[-1]-R[-1]C[-1] -> 0
B166: =R[-3]C+1 -> 55 | C166: =R[-1]C+RC[1] -> 162 | D166: 1 | F166: =ROUND((R1003C-R4C)/(R1003C3)*RC3,0)+R4C -> 1951 | G166: =ROUND((R1003C-R4C)/(R1003C3)*RC3,0)+R4C -> 1524 | H166: =ROUND((R1003C-R4C)/(R1003C3)*RC3,0)+R4C -> 4314 | I166: =ROUND((R1003C-R4C)/(R1003C3)*RC3,0)+R4C -> 784 | J166: =ROUND((R1003C-R4C)/(R1003C3)*RC3,0)+R4C -> 424 | K166: =ROUND((R1003C-R4C)/(R1003C3)*RC3,0)+R4C -> 6043 | O166: =RC[-4]-R[-1]C[-4] -> 36 | P166: =RC[-1]-R[-1]C[-1] -> 0
B167: =R[-3]C+1 -> 55 | C167: =R[-1]C+RC[1] -> 163 | D167: 1 | F167: =ROUND((R1003C-R4C)/(R1003C3)*RC3,0)+R4C -> 1962 | G167: =ROUND((R1003C-R4C)/(R1003C3)*RC3,0)+R4C -> 1533 | H167: =ROUND((R1003C-R4C)/(R1003C3)*RC3,0)+R4C -> 4339 | I167: =ROUND((R1003C-R4C)/(R1003C3)*RC3,0)+R4C -> 789 | J167: =ROUND((R1003C-R4C)/(R1003C3)*RC3,0)+R4C -> 426 | K167: =ROUND((R1003C-R4C)/(R1003C3)*RC3,0)+R4C -> 6080 | O167: =RC[-4]-R[-1]C[-4] -> 37 | P167: =RC[-1]-R[-1]C[-1] -> 1
B168: =R[-3]C+1 -> 55 | C168: =R[-1]C+RC[1] -> 164 | D168: 1 | F168: =ROUND((R1003C-R4C)/(R1003C3)*RC3,0)+R4C -> 1974 | G168: =ROUND((R1003C-R4C)/(R1003C3)*RC3,0)+R4C -> 1542 | H168: =ROUND((R1003C-R4C)/(R1003C3)*RC3,0)+R4C -> 4365 | I168: =ROUND((R1003C-R4C)/(R1003C3)*RC3,0)+R4C -> 793 | J168: =ROUND((R1003C-R4C)/(R1003C3)*RC3,0)+R4C -> 429 | K168: =ROUND((R1003C-R4C)/(R1003C3)*RC3,0)+R4C -> 6116 | O168: =RC[-4]-R[-1]C[-4] -> 36 | P168: =RC[-1]-R[-1]C[-1] -> -1
B169: =R[-3]C+1 -> 56 | C169: =R[-1]C+RC[1] -> 165 | D169: 1 | F169: =ROUND((R1003C-R4C)/(R1003C3)*RC3,0)+R4C -> 1986 | G169: =ROUND((R1003C-R4C)/(R1003C3)*RC3,0)+R4C -> 1551 | H169: =ROUND((R1003C-R4C)/(R1003C3)*RC3,0)+R4C -> 4391 | I169: =ROUND((R1003C-R4C)/(R1003C3)*RC3,0)+R4C -> 798 | J169: =ROUND((R1003C-R4C)/(R1003C3)*RC3,0)+R4C -> 432 | K169: =ROUND((R1003C-R4C)/(R1003C3)*RC3,0)+R4C -> 6152 | O169: =RC[-4]-R[-1]C[-4] -> 36 | P169: =RC[-1]-R[-1]C[-1] -> 0
B170: =R[-3]C+1 -> 56 | C170: =R[-1]C+RC[1] -> 166 | D170: 1 | F170: =ROUND((R1003C-R4C)/(R1003C3)*RC3,0)+R4C -> 1997 | G170: =ROUND((R1003C-R4C)/(R1003C3)*RC3,0)+R4C -> 1561 | H170: =ROUND((R1003C-R4C)/(R1003C3)*RC3,0)+R4C -> 4417 | I170: =ROUND((R1003C-R4C)/(R1003C3)*RC3,0)+R4C -> 803 | J170: =ROUND((R1003C-R4C)/(R1003C3)*RC3,0)+R4C -> 434 | K170: =ROUND((R1003C-R4C)/(R1003C3)*RC3,0)+R4C -> 6188 | O170: =RC[-4]-R[-1]C[-4] -> 36 | P170: =RC[-1]-R[-1]C[-1] -> 0
B171: =R[-3]C+1 -> 56 | C171: =R[-1]C+RC[1] -> 167 | D171: 1 | F171: =ROUND((R1003C-R4C)/(R1003C3)*RC3,0)+R4C -> 2009 | G171: =ROUND((R1003C-R4C)/(R1003C3)*RC3,0)+R4C -> 1570 | H171: =ROUND((R1003C-R4C)/(R1003C3)*RC3,0)+R4C -> 4443 | I171: =ROUND((R1003C-R4C)/(R1003C3)*RC3,0)+R4C -> 807 | J171: =ROUND((R1003C-R4C)/(R1003C3)*RC3,0)+R4C -> 437 | K171: =ROUND((R1003C-R4C)/(R1003C3)*RC3,0)+R4C -> 6224 | O171: =RC[-4]-R[-1]C[-4] -> 36 | P171: =RC[-1]-R[-1]C[-1] -> 0
B172: =R[-3]C+1 -> 57 | C172: =R[-1]C+RC[1] -> 168 | D172: 1 | F172: =ROUND((R1003C-R4C)/(R1003C3)*RC3,0)+R4C -> 2021 | G172: =ROUND((R1003C-R4C)/(R1003C3)*RC3,0)+R4C -> 1579 | H172: =ROUND((R1003C-R4C)/(R1003C3)*RC3,0)+R4C -> 4469 | I172: =ROUND((R1003C-R4C)/(R1003C3)*RC3,0)+R4C -> 812 | J172: =ROUND((R1003C-R4C)/(R1003C3)*RC3,0)+R4C -> 439 | K172: =ROUND((R1003C-R4C)/(R1003C3)*RC3,0)+R4C -> 6260 | O172: =RC[-4]-R[-1]C[-4] -> 36 | P172: =RC[-1]-R[-1]C[-1] -> 0
B173: =R[-3]C+1 -> 57 | C173: =R[-1]C+RC[1] -> 169 | D173: 1 | F173: =ROUND((R1003C-R4C)/(R1003C3)*RC3,0)+R4C -> 2032 | G173: =ROUND((R1003C-R4C)/(R1003C3)*RC3,0)+R4C -> 1588 | H173: =ROUND((R1003C-R4C)/(R1003C3)*RC3,0)+R4C -> 4494 | I173: =ROUND((R1003C-R4C)/(R1003C3)*RC3,0)+R4C -> 817 | J173: =ROUND((R1003C-R4C)/(R1003C3)*RC3,0)+R4C -> 442 | K173: =ROUND((R1003C-R4C)/(R1003C3)*RC3,0)+R4C -> 6297 | O173: =RC[-4]-R[-1]C[-4] -> 37 | P173: =RC[-1]-R[-1]C[-1] -> 1
B174: =R[-3]C+1 -> 57 | C174: =R[-1]C+RC[1] -> 170 | D174: 1 | F174: =ROUND((R1003C-R4C)/(R1003C3)*RC3,0)+R4C -> 2044 | G174: =ROUND((R1003C-R4C)/(R1003C3)*RC3,0)+R4C -> 1597 | H174: =ROUND((R1003C-R4C)/(R1003C3)*RC3,0)+R4C -> 4520 | I174: =ROUND((R1003C-R4C)/(R1003C3)*RC3,0)+R4C -> 821 | J174: =ROUND((R1003C-R4C)/(R1003C3)*RC3,0)+R4C -> 444 | K174: =ROUND((R1003C-R4C)/(R1003C3)*RC3,0)+R4C -> 6333 | O174: =RC[-4]-R[-1]C[-4] -> 36 | P174: =RC[-1]-R[-1]C[-1] -> -1
B175: =R[-3]C+1 -> 58 | C175: =R[-1]C+RC[1] -> 171 | D175: 1 | F175: =ROUND((R1003C-R4C)/(R1003C3)*RC3,0)+R4C -> 2056 | G175: =ROUND((R1003C-R4C)/(R1003C3)*RC3,0)+R4C -> 1606 | H175: =ROUND((R1003C-R4C)/(R1003C3)*RC3,0)+R4C -> 4546 | I175: =ROUND((R1003C-R4C)/(R1003C3)*RC3,0)+R4C -> 826 | J175: =ROUND((R1003C-R4C)/(R1003C3)*RC3,0)+R4C -> 447 | K175: =ROUND((R1003C-R4C)/(R1003C3)*RC3,0)+R4C -> 6369 | O175: =RC[-4]-R[-1]C[-4] -> 36 | P175: =RC[-1]-R[-1]C[-1] -> 0
B176: =R[-3]C+1 -> 58 | C176: =R[-1]C+RC[1] -> 172 | D176: 1 | F176: =ROUND((R1003C-R4C)/(R1003C3)*RC3,0)+R4C -> 2067 | G176: =ROUND((R1003C-R4C)/(R1003C3)*RC3,0)+R4C -> 1615 | H176: =ROUND((R1003C-R4C)/(R1003C3)*RC3,0)+R4C -> 4572 | I176: =ROUND((R1003C-R4C)/(R1003C3)*RC3,0)+R4C -> 831 | J176: =ROUND((R1003C-R4C)/(R1003C3)*RC3,0)+R4C -> 449 | K176: =ROUND((R1003C-R4C)/(R1003C3)*RC3,0)+R4C -> 6405 | O176: =RC[-4]-R[-1]C[-4] -> 36 | P176: =RC[-1]-R[-1]C[-1] -> 0
B177: =R[-3]C+1 -> 58 | C177: =R[-1]C+RC[1] -> 173 | D177: 1 | F177: =ROUND((R1003C-R4C)/(R1003C3)*RC3,0)+R4C -> 2079 | G177: =ROUND((R1003C-R4C)/(R1003C3)*RC3,0)+R4C -> 1624 | H177: =ROUND((R1003C-R4C)/(R1003C3)*RC3,0)+R4C -> 4598 | I177: =ROUND((R1003C-R4C)/(R1003C3)*RC3,0)+R4C -> 835 | J177: =ROUND((R1003C-R4C)/(R1003C3)*RC3,0)+R4C -> 452 | K177: =ROUND((R1003C-R4C)/(R1003C3)*RC3,0)+R4C -> 6441 | O177: =RC[-4]-R[-1]C[-4] -> 36 | P177: =RC[-1]-R[-1]C[-1] -> 0
B178: =R[-3]C+1 -> 59 | C178: =R[-1]C+RC[1] -> 174 | D178: 1 | F178: =ROUND((R1003C-R4C)/(R1003C3)*RC3,0)+R4C -> 2091 | G178: =ROUND((R1003C-R4C)/(R1003C3)*RC3,0)+R4C -> 1634 | H178: =ROUND((R1003C-R4C)/(R1003C3)*RC3,0)+R4C -> 4624 | I178: =ROUND((R1003C-R4C)/(R1003C3)*RC3,0)+R4C -> 840 | J178: =ROUND((R1003C-R4C)/(R1003C3)*RC3,0)+R4C -> 454 | K178: =ROUND((R1003C-R4C)/(R1003C3)*RC3,0)+R4C -> 6478 | O178: =RC[-4]-R[-1]C[-4] -> 37 | P178: =RC[-1]-R[-1]C[-1] -> 1
B179: =R[-3]C+1 -> 59 | C179: =R[-1]C+RC[1] -> 175 | D179: 1 | F179: =ROUND((R1003C-R4C)/(R1003C3)*RC3,0)+R4C -> 2102 | G179: =ROUND((R1003C-R4C)/(R1003C3)*RC3,0)+R4C -> 1643 | H179: =ROUND((R1003C-R4C)/(R1003C3)*RC3,0)+R4C -> 4649 | I179: =ROUND((R1003C-R4C)/(R1003C3)*RC3,0)+R4C -> 845 | J179: =ROUND((R1003C-R4C)/(R1003C3)*RC3,0)+R4C -> 457 | K179: =ROUND((R1003C-R4C)/(R1003C3)*RC3,0)+R4C -> 6514 | O179: =RC[-4]-R[-1]C[-4] -> 36 | P179: =RC[-1]-R[-1]C[-1] -> -1
B180: =R[-3]C+1 -> 59 | C180: =R[-1]C+RC[1] -> 176 | D180: 1 | F180: =ROUND((R1003C-R4C)/(R1003C3)*RC3,0)+R4C -> 2114 | G180: =ROUND((R1003C-R4C)/(R1003C3)*RC3,0)+R4C -> 1652 | H180: =ROUND((R1003C-R4C)/(R1003C3)*RC3,0)+R4C -> 4675 | I180: =ROUND((R1003C-R4C)/(R1003C3)*RC3,0)+R4C -> 850 | J180: =ROUND((R1003C-R4C)/(R1003C3)*RC3,0)+R4C -> 459 | K180: =ROUND((R1003C-R4C)/(R1003C3)*RC3,0)+R4C -> 6550 | O180: =RC[-4]-R[-1]C[-4] -> 36 | P180: =RC[-1]-R[-1]C[-1] -> 0
B181: =R[-3]C+1 -> 60 | C181: =R[-1]C+RC[1] -> 177 | D181: 1 | F181: =ROUND((R1003C-R4C)/(R1003C3)*RC3,0)+R4C -> 2126 | G181: =ROUND((R1003C-R4C)/(R1003C3)*RC3,0)+R4C -> 1661 | H181: =ROUND((R1003C-R4C)/(R1003C3)*RC3,0)+R4C -> 4701 | I181: =ROUND((R1003C-R4C)/(R1003C3)*RC3,0)+R4C -> 854 | J181: =ROUND((R1003C-R4C)/(R1003C3)*RC3,0)+R4C -> 462 | K181: =ROUND((R1003C-R4C)/(R1003C3)*RC3,0)+R4C -> 6586 | O181: =RC[-4]-R[-1]C[-4] -> 36 | P181: =RC[-1]-R[-1]C[-1] -> 0
B182: =R[-3]C+1 -> 60 | C182: =R[-1]C+RC[1] -> 178 | D182: 1 | F182: =ROUND((R1003C-R4C)/(R1003C3)*RC3,0)+R4C -> 2137 | G182: =ROUND((R1003C-R4C)/(R1003C3)*RC3,0)+R4C -> 1670 | H182: =ROUND((R1003C-R4C)/(R1003C3)*RC3,0)+R4C -> 4727 | I182: =ROUND((R1003C-R4C)/(R1003C3)*RC3,0)+R4C -> 859 | J182: =ROUND((R1003C-R4C)/(R1003C3)*RC3,0)+R4C -> 465 | K182: =ROUND((R1003C-R4C)/(R1003C3)*RC3,0)+R4C -> 6622 | O182: =RC[-4]-R[-1]C[-4] -> 36 | P182: =RC[-1]-R[-1]C[-1] -> 0
B183: =R[-3]C+1 -> 60 | C183: =R[-1]C+RC[1] -> 179 | D183: 1 | F183: =ROUND((R1003C-R4C)/(R1003C3)*RC3,0)+R4C -> 2149 | G183: =ROUND((R1003C-R4C)/(R1003C3)*RC3,0)+R4C -> 1679 | H183: =ROUND((R1003C-R4C)/(R1003C3)*RC3,0)+R4C -> 4753 | I183: =ROUND((R1003C-R4C)/(R1003C3)*RC3,0)+R4C -> 864 | J183: =ROUND((R1003C-R4C)/(R1003C3)*RC3,0)+R4C -> 467 | K183: =ROUND((R1003C-R4C)/(R1003C3)*RC3,0)+R4C -> 6658 | O183: =RC[-4]-R[-1]C[-4] -> 36 | P183: =RC[-1]-R[-1]C[-1] -> 0
B184: =R[-3]C+1 -> 61 | C184: =R[-1]C+RC[1] -> 180 | D184: 1 | F184: =ROUND((R1003C-R4C)/(R1003C3)*RC3,0)+R4C -> 2161 | G184: =ROUND((R1003C-R4C)/(R1003C3)*RC3,0)+R4C -> 1688 | H184: =ROUND((R1003C-R4C)/(R1003C3)*RC3,0)+R4C -> 4778 | I184: =ROUND((R1003C-R4C)/(R1003C3)*RC3,0)+R4C -> 868 | J184: =ROUND((R1003C-R4C)/(R1003C3)*RC3,0)+R4C -> 470 | K184: =ROUND((R1003C-R4C)/(R1003C3)*RC3,0)+R4C -> 6695 | O184: =RC[-4]-R[-1]C[-4] -> 37 | P184: =RC[-1]-R[-1]C[-1] -> 1
B185: =R[-3]C+1 -> 61 | C185: =R[-1]C+RC[1] -> 181 | D185: 1 | F185: =ROUND((R1003C-R4C)/(R1003C3)*RC3,0)+R4C -> 2172 | G185: =ROUND((R1003C-R4C)/(R1003C3)*RC3,0)+R4C -> 1697 | H185: =ROUND((R1003C-R4C)/(R1003C3)*RC3,0)+R4C -> 4804 | I185: =ROUND((R1003C-R4C)/(R1003C3)*RC3,0)+R4C -> 873 | J185: =ROUND((R1003C-R4C)/(R1003C3)*RC3,0)+R4C -> 472 | K185: =ROUND((R1003C-R4C)/(R1003C3)*RC3,0)+R4C -> 6731 | O185: =RC[-4]-R[-1]C[-4] -> 36 | P185: =RC[-1]-R[-1]C[-1] -> -1
B186: =R[-3]C+1 -> 61 | C186: =R[-1]C+RC[1] -> 182 | D186: 1 | F186: =ROUND((R1003C-R4C)/(R1003C3)*RC3,0)+R4C -> 2184 | G186: =ROUND((R1003C-R4C)/(R1003C3)*RC3,0)+R4C -> 1707 | H186: =ROUND((R1003C-R4C)/(R1003C3)*RC3,0)+R4C -> 4830 | I186: =ROUND((R1003C-R4C)/(R1003C3)*RC3,0)+R4C -> 878 | J186: =ROUND((R1003C-R4C)/(R1003C3)*RC3,0)+R4C -> 475 | K186: =ROUND((R1003C-R4C)/(R1003C3)*RC3,0)+R4C -> 6767 | O186: =RC[-4]-R[-1]C[-4] -> 36 | P186: =RC[-1]-R[-1]C[-1] -> 0
B187: =R[-3]C+1 -> 62 | C187: =R[-1]C+RC[1] -> 183 | D187: 1 | F187: =ROUND((R1003C-R4C)/(R1003C3)*RC3,0)+R4C -> 2196 | G187: =ROUND((R1003C-R4C)/(R1003C3)*RC3,0)+R4C -> 1716 | H187: =ROUND((R1003C-R4C)/(R1003C3)*RC3,0)+R4C -> 4856 | I187: =ROUND((R1003C-R4C)/(R1003C3)*RC3,0)+R4C -> 882 | J187: =ROUND((R1003C-R4C)/(R1003C3)*RC3,0)+R4C -> 477 | K187: =ROUND((R1003C-R4C)/(R1003C3)*RC3,0)+R4C -> 6803 | O187: =RC[-4]-R[-1]C[-4] -> 36 | P187: =RC[-1]-R[-1]C[-1] -> 0
B188: =R[-3]C+1 -> 62 | C188: =R[-1]C+RC[1] -> 184 | D188: 1 | F188: =ROUND((R1003C-R4C)/(R1003C3)*RC3,0)+R4C -> 2208 | G188: =ROUND((R1003C-R4C)/(R1003C3)*RC3,0)+R4C -> 1725 | H188: =ROUND((R1003C-R4C)/(R1003C3)*RC3,0)+R4C -> 4882 | I188: =ROUND((R1003C-R4C)/(R1003C3)*RC3,0)+R4C -> 887 | J188: =ROUND((R1003C-R4C)/(R1003C3)*RC3,0)+R4C -> 480 | K188: =ROUND((R1003C-R4C)/(R1003C3)*RC3,0)+R4C -> 6839 | O188: =RC[-4]-R[-1]C[-4] -> 36 | P188: =RC[-1]-R[-1]C[-1] -> 0
B189: =R[-3]C+1 -> 62 | C189: =R[-1]C+RC[1] -> 185 | D189: 1 | F189: =ROUND((R1003C-R4C)/(R1003C3)*RC3,0)+R4C -> 2219 | G189: =ROUND((R1003C-R4C)/(R1003C3)*RC3,0)+R4C -> 1734 | H189: =ROUND((R1003C-R4C)/(R1003C3)*RC3,0)+R4C -> 4908 | I189: =ROUND((R1003C-R4C)/(R1003C3)*RC3,0)+R4C -> 892 | J189: =ROUND((R1003C-R4C)/(R1003C3)*RC3,0)+R4C -> 482 | K189: =ROUND((R1003C-R4C)/(R1003C3)*RC3,0)+R4C -> 6876 | O189: =RC[-4]-R[-1]C[-4] -> 37 | P189: =RC[-1]-R[-1]C[-1] -> 1
B190: =R[-3]C+1 -> 63 | C190: =R[-1]C+RC[1] -> 186 | D190: 1 | F190: =ROUND((R1003C-R4C)/(R1003C3)*RC3,0)+R4C -> 2231 | G190: =ROUND((R1003C-R4C)/(R1003C3)*RC3,0)+R4C -> 1743 | H190: =ROUND((R1003C-R4C)/(R1003C3)*RC3,0)+R4C -> 4933 | I190: =ROUND((R1003C-R4C)/(R1003C3)*RC3,0)+R4C -> 896 | J190: =ROUND((R1003C-R4C)/(R1003C3)*RC3,0)+R4C -> 485 | K190: =ROUND((R1003C-R4C)/(R1003C3)*RC3,0)+R4C -> 6912 | O190: =RC[-4]-R[-1]C[-4] -> 36 | P190: =RC[-1]-R[-1]C[-1] -> -1
B191: =R[-3]C+1 -> 63 | C191: =R[-1]C+RC[1] -> 187 | D191: 1 | F191: =ROUND((R1003C-R4C)/(R1003C3)*RC3,0)+R4C -> 2243 | G191: =ROUND((R1003C-R4C)/(R1003C3)*RC3,0)+R4C -> 1752 | H191: =ROUND((R1003C-R4C)/(R1003C3)*RC3,0)+R4C -> 4959 | I191: =ROUND((R1003C-R4C)/(R1003C3)*RC3,0)+R4C -> 901 | J191: =ROUND((R1003C-R4C)/(R1003C3)*RC3,0)+R4C -> 487 | K191: =ROUND((R1003C-R4C)/(R1003C3)*RC3,0)+R4C -> 6948 | O191: =RC[-4]-R[-1]C[-4] -> 36 | P191: =RC[-1]-R[-1]C[-1] -> 0
B192: =R[-3]C+1 -> 63 | C192: =R[-1]C+RC[1] -> 188 | D192: 1 | F192: =ROUND((R1003C-R4C)/(R1003C3)*RC3,0)+R4C -> 2254 | G192: =ROUND((R1003C-R4C)/(R1003C3)*RC3,0)+R4C -> 1761 | H192: =ROUND((R1003C-R4C)/(R1003C3)*RC3,0)+R4C -> 4985 | I192: =ROUND((R1003C-R4C)/(R1003C3)*RC3,0)+R4C -> 906 | J192: =ROUND((R1003C-R4C)/(R1003C3)*RC3,0)+R4C -> 490 | K192: =ROUND((R1003C-R4C)/(R1003C3)*RC3,0)+R4C -> 6984 | O192: =RC[-4]-R[-1]C[-4] -> 36 | P192: =RC[-1]-R[-1]C[-1] -> 0
B193: =R[-3]C+1 -> 64 | C193: =R[-1]C+RC[1] -> 189 | D193: 1 | F193: =ROUND((R1003C-R4C)/(R1003C3)*RC3,0)+R4C -> 2266 | G193: =ROUND((R1003C-R4C)/(R1003C3)*RC3,0)+R4C -> 1770 | H193: =ROUND((R1003C-R4C)/(R1003C3)*RC3,0)+R4C -> 5011 | I193: =ROUND((R1003C-R4C)/(R1003C3)*RC3,0)+R4C -> 911 | J193: =ROUND((R1003C-R4C)/(R1003C3)*RC3,0)+R4C -> 492 | K193: =ROUND((R1003C-R4C)/(R1003C3)*RC3,0)+R4C -> 7020 | O193: =RC[-4]-R[-1]C[-4] -> 36 | P193: =RC[-1]-R[-1]C[-1] -> 0
B194: =R[-3]C+1 -> 64 | C194: =R[-1]C+RC[1] -> 190 | D194: 1 | F194: =ROUND((R1003C-R4C)/(R1003C3)*RC3,0)+R4C -> 2278 | G194: =ROUND((R1003C-R4C)/(R1003C3)*RC3,0)+R4C -> 1780 | H194: =ROUND((R1003C-R4C)/(R1003C3)*RC3,0)+R4C -> 5037 | I194: =ROUND((R1003C-R4C)/(R1003C3)*RC3,0)+R4C -> 915 | J194: =ROUND((R1003C-R4C)/(R1003C3)*RC3,0)+R4C -> 495 | K194: =ROUND((R1003C-R4C)/(R1003C3)*RC3,0)+R4C -> 7056 | O194: =RC[-4]-R[-1]C[-4] -> 36 | P194: =RC[-1]-R[-1]C[-1] -> 0
B195: =R[-3]C+1 -> 64 | C195: =R[-1]C+RC[1] -> 191 | D195: 1 | F195: =ROUND((R1003C-R4C)/(R1003C3)*RC3,0)+R4C -> 2289 | G195: =ROUND((R1003C-R4C)/(R1003C3)*RC3,0)+R4C -> 1789 | H195: =ROUND((R1003C-R4C)/(R1003C3)*RC3,0)+R4C -> 5063 | I195: =ROUND((R1003C-R4C)/(R1003C3)*RC3,0)+R4C -> 920 | J195: =ROUND((R1003C-R4C)/(R1003C3)*RC3,0)+R4C -> 497 | K195: =ROUND((R1003C-R4C)/(R1003C3)*RC3,0)+R4C -> 7093 | O195: =RC[-4]-R[-1]C[-4] -> 37 | P195: =RC[-1]-R[-1]C[-1] -> 1
B196: =R[-3]C+1 -> 65 | C196: =R[-1]C+RC[1] -> 192 | D196: 1 | F196: =ROUND((R1003C-R4C)/(R1003C3)*RC3,0)+R4C -> 2301 | G196: =ROUND((R1003C-R4C)/(R1003C3)*RC3,0)+R4C -> 1798 | H196: =ROUND((R1003C-R4C)/(R1003C3)*RC3,0)+R4C -> 5088 | I196: =ROUND((R1003C-R4C)/(R1003C3)*RC3,0)+R4C -> 925 | J196: =ROUND((R1003C-R4C)/(R1003C3)*RC3,0)+R4C -> 500 | K196: =ROUND((R1003C-R4C)/(R1003C3)*RC3,0)+R4C -> 7129 | O196: =RC[-4]-R[-1]C[-4] -> 36 | P196: =RC[-1]-R[-1]C[-1] -> -1
B197: =R[-3]C+1 -> 65 | C197: =R[-1]C+RC[1] -> 193 | D197: 1 | F197: =ROUND((R1003C-R4C)/(R1003C3)*RC3,0)+R4C -> 2313 | G197: =ROUND((R1003C-R4C)/(R1003C3)*RC3,0)+R4C -> 1807 | H197: =ROUND((R1003C-R4C)/(R1003C3)*RC3,0)+R4C -> 5114 | I197: =ROUND((R1003C-R4C)/(R1003C3)*RC3,0)+R4C -> 929 | J197: =ROUND((R1003C-R4C)/(R1003C3)*RC3,0)+R4C -> 503 | K197: =ROUND((R1003C-R4C)/(R1003C3)*RC3,0)+R4C -> 7165 | O197: =RC[-4]-R[-1]C[-4] -> 36 | P197: =RC[-1]-R[-1]C[-1] -> 0
B198: =R[-3]C+1 -> 65 | C198: =R[-1]C+RC[1] -> 194 | D198: 1 | F198: =ROUND((R1003C-R4C)/(R1003C3)*RC3,0)+R4C -> 2324 | G198: =ROUND((R1003C-R4C)/(R1003C3)*RC3,0)+R4C -> 1816 | H198: =ROUND((R1003C-R4C)/(R1003C3)*RC3,0)+R4C -> 5140 | I198: =ROUND((R1003C-R4C)/(R1003C3)*RC3,0)+R4C -> 934 | J198: =ROUND((R1003C-R4C)/(R1003C3)*RC3,0)+R4C -> 505 | K198: =ROUND((R1003C-R4C)/(R1003C3)*RC3,0)+R4C -> 7201 | O198: =RC[-4]-R[-1]C[-4] -> 36 | P198: =RC[-1]-R[-1]C[-1] -> 0
B199: =R[-3]C+1 -> 66 | C199: =R[-1]C+RC[1] -> 195 | D199: 1 | F199: =ROUND((R1003C-R4C)/(R1003C3)*RC3,0)+R4C -> 2336 | G199: =ROUND((R1003C-R4C)/(R1003C3)*RC3,0)+R4C -> 1825 | H199: =ROUND((R1003C-R4C)/(R1003C3)*RC3,0)+R4C -> 5166 | I199: =ROUND((R1003C-R4C)/(R1003C3)*RC3,0)+R4C -> 939 | J199: =ROUND((R1003C-R4C)/(R1003C3)*RC3,0)+R4C -> 508 | K199: =ROUND((R1003C-R4C)/(R1003C3)*RC3,0)+R4C -> 7237 | O199: =RC[-4]-R[-1]C[-4] -> 36 | P199: =RC[-1]-R[-1]C[-1] -> 0
B200: =R[-3]C+1 -> 66 | C200: =R[-1]C+RC[1] -> 196 | D200: 1 | F200: =ROUND((R1003C-R4C)/(R1003C3)*RC3,0)+R4C -> 2348 | G200: =ROUND((R1003C-R4C)/(R1003C3)*RC3,0)+R4C -> 1834 | H200: =ROUND((R1003C-R4C)/(R1003C3)*RC3,0)+R4C -> 5192 | I200: =ROUND((R1003C-R4C)/(R1003C3)*RC3,0)+R4C -> 943 | J200: =ROUND((R1003C-R4C)/(R1003C3)*RC3,0)+R4C -> 510 | K200: =ROUND((R1003C-R4C)/(R1003C3)*RC3,0)+R4C -> 7274 | O200: =RC[-4]-R[-1]C[-4] -> 37 | P200: =RC[-1]-R[-1]C[-1] -> 1
B201: =R[-3]C+1 -> 66 | C201: =R[-1]C+RC[1] -> 197 | D201: 1 | F201: =ROUND((R1003C-R4C)/(R1003C3)*RC3,0)+R4C -> 2359 | G201: =ROUND((R1003C-R4C)/(R1003C3)*RC3,0)+R4C -> 1843 | H201: =ROUND((R1003C-R4C)/(R1003C3)*RC3,0)+R4C -> 5217 | I201: =ROUND((R1003C-R4C)/(R1003C3)*RC3,0)+R4C -> 948 | J201: =ROUND((R1003C-R4C)/(R1003C3)*RC3,0)+R4C -> 513 | K201: =ROUND((R1003C-R4C)/(R1003C3)*RC3,0)+R4C -> 7310 | O201: =RC[-4]-R[-1]C[-4] -> 36 | P201: =RC[-1]-R[-1]C[-1] -> -1
B202: =R[-3]C+1 -> 67 | C202: =R[-1]C+RC[1] -> 198 | D202: 1 | F202: =ROUND((R1003C-R4C)/(R1003C3)*RC3,0)+R4C -> 2371 | G202: =ROUND((R1003C-R4C)/(R1003C3)*RC3,0)+R4C -> 1853 | H202: =ROUND((R1003C-R4C)/(R1003C3)*RC3,0)+R4C -> 5243 | I202: =ROUND((R1003C-R4C)/(R1003C3)*RC3,0)+R4C -> 953 | J202: =ROUND((R1003C-R4C)/(R1003C3)*RC3,0)+R4C -> 515 | K202: =ROUND((R1003C-R4C)/(R1003C3)*RC3,0)+R4C -> 7346 | O202: =RC[-4]-R[-1]C[-4] -> 36 | P202: =RC[-1]-R[-1]C[-1] -> 0
B203: =R[-3]C+1 -> 67 | C203: =R[-1]C+RC[1] -> 199 | D203: 1 | F203: =ROUND((R1003C-R4C)/(R1003C3)*RC3,0)+R4C -> 2383 | G203: =ROUND((R1003C-R4C)/(R1003C3)*RC3,0)+R4C -> 1862 | H203: =ROUND((R1003C-R4C)/(R1003C3)*RC3,0)+R4C -> 5269 | I203: =ROUND((R1003C-R4C)/(R1003C3)*RC3,0)+R4C -> 957 | J203: =ROUND((R1003C-R4C)/(R1003C3)*RC3,0)+R4C -> 518 | K203: =ROUND((R1003C-R4C)/(R1003C3)*RC3,0)+R4C -> 7382 | O203: =RC[-4]-R[-1]C[-4] -> 36 | P203: =RC[-1]-R[-1]C[-1] -> 0
B204: =R[-3]C+1 -> 67 | C204: =R[-1]C+RC[1] -> 200 | D204: 1 | F204: =ROUND((R1003C-R4C)/(R1003C3)*RC3,0)+R4C -> 2394 | G204: =ROUND((R1003C-R4C)/(R1003C3)*RC3,0)+R4C -> 1871 | H204: =ROUND((R1003C-R4C)/(R1003C3)*RC3,0)+R4C -> 5295 | I204: =ROUND((R1003C-R4C)/(R1003C3)*RC3,0)+R4C -> 962 | J204: =ROUND((R1003C-R4C)/(R1003C3)*RC3,0)+R4C -> 520 | K204: =ROUND((R1003C-R4C)/(R1003C3)*RC3,0)+R4C -> 7418 | O204: =RC[-4]-R[-1]C[-4] -> 36 | P204: =RC[-1]-R[-1]C[-1] -> 0
B205: =R[-3]C+1 -> 68 | C205: =R[-1]C+RC[1] -> 201 | D205: 1 | F205: =ROUND((R1003C-R4C)/(R1003C3)*RC3,0)+R4C -> 2406 | G205: =ROUND((R1003C-R4C)/(R1003C3)*RC3,0)+R4C -> 1880 | H205: =ROUND((R1003C-R4C)/(R1003C3)*RC3,0)+R4C -> 5321 | I205: =ROUND((R1003C-R4C)/(R1003C3)*RC3,0)+R4C -> 967 | J205: =ROUND((R1003C-R4C)/(R1003C3)*RC3,0)+R4C -> 523 | K205: =ROUND((R1003C-R4C)/(R1003C3)*RC3,0)+R4C -> 7454 | O205: =RC[-4]-R[-1]C[-4] -> 36 | P205: =RC[-1]-R[-1]C[-1] -> 0
B206: =R[-3]C+1 -> 68 | C206: =R[-1]C+RC[1] -> 202 | D206: 1 | F206: =ROUND((R1003C-R4C)/(R1003C3)*RC3,0)+R4C -> 2418 | G206: =ROUND((R1003C-R4C)/(R1003C3)*RC3,0)+R4C -> 1889 | H206: =ROUND((R1003C-R4C)/(R1003C3)*RC3,0)+R4C -> 5347 | I206: =ROUND((R1003C-R4C)/(R1003C3)*RC3,0)+R4C -> 972 | J206: =ROUND((R1003C-R4C)/(R1003C3)*RC3,0)+R4C -> 525 | K206: =ROUND((R1003C-R4C)/(R1003C3)*RC3,0)+R4C -> 7491 | O206: =RC[-4]-R[-1]C[-4] -> 37 | P206: =RC[-1]-R[-1]C[-1] -> 1
B207: =R[-3]C+1 -> 68 | C207: =R[-1]C+RC[1] -> 203 | D207: 1 | F207: =ROUND((R1003C-R4C)/(R1003C3)*RC3,0)+R4C -> 2429 | G207: =ROUND((R1003C-R4C)/(R1003C3)*RC3,0)+R4C -> 1898 | H207: =ROUND((R1003C-R4C)/(R1003C3)*RC3,0)+R4C -> 5372 | I207: =ROUND((R1003C-R4C)/(R1003C3)*RC3,0)+R4C -> 976 | J207: =ROUND((R1003C-R4C)/(R1003C3)*RC3,0)+R4C -> 528 | K207: =ROUND((R1003C-R4C)/(R1003C3)*RC3,0)+R4C -> 7527 | O207: =RC[-4]-R[-1]C[-4] -> 36 | P207: =RC[-1]-R[-1]C[-1] -> -1
B208: =R[-3]C+1 -> 69 | C208: =R[-1]C+RC[1] -> 204 | D208: 1 | F208: =ROUND((R1003C-R4C)/(R1003C3)*RC3,0)+R4C -> 2441 | G208: =ROUND((R1003C-R4C)/(R1003C3)*RC3,0)+R4C -> 1907 | H208: =ROUND((R1003C-R4C)/(R1003C3)*RC3,0)+R4C -> 5398 | I208: =ROUND((R1003C-R4C)/(R1003C3)*RC3,0)+R4C -> 981 | J208: =ROUND((R1003C-R4C)/(R1003C3)*RC3,0)+R4C -> 530 | K208: =ROUND((R1003C-R4C)/(R1003C3)*RC3,0)+R4C -> 7563 | O208: =RC[-4]-R[-1]C[-4] -> 36 | P208: =RC[-1]-R[-1]C[-1] -> 0
B209: =R[-3]C+1 -> 69 | C209: =R[-1]C+RC[1] -> 205 | D209: 1 | F209: =ROUND((R1003C-R4C)/(R1003C3)*RC3,0)+R4C -> 2453 | G209: =ROUND((R1003C-R4C)/(R1003C3)*RC3,0)+R4C -> 1916 | H209: =ROUND((R1003C-R4C)/(R1003C3)*RC3,0)+R4C -> 5424 | I209: =ROUND((R1003C-R4C)/(R1003C3)*RC3,0)+R4C -> 986 | J209: =ROUND((R1003C-R4C)/(R1003C3)*RC3,0)+R4C -> 533 | K209: =ROUND((R1003C-R4C)/(R1003C3)*RC3,0)+R4C -> 7599 | O209: =RC[-4]-R[-1]C[-4] -> 36 | P209: =RC[-1]-R[-1]C[-1] -> 0
B210: =R[-3]C+1 -> 69 | C210: =R[-1]C+RC[1] -> 206 | D210: 1 | F210: =ROUND((R1003C-R4C)/(R1003C3)*RC3,0)+R4C -> 2464 | G210: =ROUND((R1003C-R4C)/(R1003C3)*RC3,0)+R4C -> 1926 | H210: =ROUND((R1003C-R4C)/(R1003C3)*RC3,0)+R4C -> 5450 | I210: =ROUND((R1003C-R4C)/(R1003C3)*RC3,0)+R4C -> 990 | J210: =ROUND((R1003C-R4C)/(R1003C3)*RC3,0)+R4C -> 536 | K210: =ROUND((R1003C-R4C)/(R1003C3)*RC3,0)+R4C -> 7635 | O210: =RC[-4]-R[-1]C[-4] -> 36 | P210: =RC[-1]-R[-1]C[-1] -> 0
B211: =R[-3]C+1 -> 70 | C211: =R[-1]C+RC[1] -> 207 | D211: 1 | F211: =ROUND((R1003C-R4C)/(R1003C3)*RC3,0)+R4C -> 2476 | G211: =ROUND((R1003C-R4C)/(R1003C3)*RC3,0)+R4C -> 1935 | H211: =ROUND((R1003C-R4C)/(R1003C3)*RC3,0)+R4C -> 5476 | I211: =ROUND((R1003C-R4C)/(R1003C3)*RC3,0)+R4C -> 995 | J211: =ROUND((R1003C-R4C)/(R1003C3)*RC3,0)+R4C -> 538 | K211: =ROUND((R1003C-R4C)/(R1003C3)*RC3,0)+R4C -> 7672 | O211: =RC[-4]-R[-1]C[-4] -> 37 | P211: =RC[-1]-R[-1]C[-1] -> 1
B212: =R[-3]C+1 -> 70 | C212: =R[-1]C+RC[1] -> 208 | D212: 1 | F212: =ROUND((R1003C-R4C)/(R1003C3)*RC3,0)+R4C -> 2488 | G212: =ROUND((R1003C-R4C)/(R1003C3)*RC3,0)+R4C -> 1944 | H212: =ROUND((R1003C-R4C)/(R1003C3)*RC3,0)+R4C -> 5502 | I212: =ROUND((R1003C-R4C)/(R1003C3)*RC3,0)+R4C -> 1000 | J212: =ROUND((R1003C-R4C)/(R1003C3)*RC3,0)+R4C -> 541 | K212: =ROUND((R1003C-R4C)/(R1003C3)*RC3,0)+R4C -> 7708 | O212: =RC[-4]-R[-1]C[-4] -> 36 | P212: =RC[-1]-R[-1]C[-1] -> -1
B213: =R[-3]C+1 -> 70 | C213: =R[-1]C+RC[1] -> 209 | D213: 1 | F213: =ROUND((R1003C-R4C)/(R1003C3)*RC3,0)+R4C -> 2499 | G213: =ROUND((R1003C-R4C)/(R1003C3)*RC3,0)+R4C -> 1953 | H213: =ROUND((R1003C-R4C)/(R1003C3)*RC3,0)+R4C -> 5527 | I213: =ROUND((R1003C-R4C)/(R1003C3)*RC3,0)+R4C -> 1004 | J213: =ROUND((R1003C-R4C)/(R1003C3)*RC3,0)+R4C -> 543 | K213: =ROUND((R1003C-R4C)/(R1003C3)*RC3,0)+R4C -> 7744 | O213: =RC[-4]-R[-1]C[-4] -> 36 | P213: =RC[-1]-R[-1]C[-1] -> 0
B214: =R[-3]C+1 -> 71 | C214: =R[-1]C+RC[1] -> 210 | D214: 1 | F214: =ROUND((R1003C-R4C)/(R1003C3)*RC3,0)+R4C -> 2511 | G214: =ROUND((R1003C-R4C)/(R1003C3)*RC3,0)+R4C -> 1962 | H214: =ROUND((R1003C-R4C)/(R1003C3)*RC3,0)+R4C -> 5553 | I214: =ROUND((R1003C-R4C)/(R1003C3)*RC3,0)+R4C -> 1009 | J214: =ROUND((R1003C-R4C)/(R1003C3)*RC3,0)+R4C -> 546 | K214: =ROUND((R1003C-R4C)/(R1003C3)*RC3,0)+R4C -> 7780 | O214: =RC[-4]-R[-1]C[-4] -> 36 | P214: =RC[-1]-R[-1]C[-1] -> 0
B215: =R[-3]C+1 -> 71 | C215: =R[-1]C+RC[1] -> 211 | D215: 1 | F215: =ROUND((R1003C-R4C)/(R1003C3)*RC3,0)+R4C -> 2523 | G215: =ROUND((R1003C-R4C)/(R1003C3)*RC3,0)+R4C -> 1971 | H215: =ROUND((R1003C-R4C)/(R1003C3)*RC3,0)+R4C -> 5579 | I215: =ROUND((R1003C-R4C)/(R1003C3)*RC3,0)+R4C -> 1014 | J215: =ROUND((R1003C-R4C)/(R1003C3)*RC3,0)+R4C -> 548 | K215: =ROUND((R1003C-R4C)/(R1003C3)*RC3,0)+R4C -> 7816 | O215: =RC[-4]-R[-1]C[-4] -> 36 | P215: =RC[-1]-R[-1]C[-1] -> 0
B216: =R[-3]C+1 -> 71 | C216: =R[-1]C+RC[1] -> 212 | D216: 1 | F216: =ROUND((R1003C-R4C)/(R1003C3)*RC3,0)+R4C -> 2534 | G216: =ROUND((R1003C-R4C)/(R1003C3)*RC3,0)+R4C -> 1980 | H216: =ROUND((R1003C-R4C)/(R1003C3)*RC3,0)+R4C -> 5605 | I216: =ROUND((R1003C-R4C)/(R1003C3)*RC3,0)+R4C -> 1018 | J216: =ROUND((R1003C-R4C)/(R1003C3)*RC3,0)+R4C -> 551 | K216: =ROUND((R1003C-R4C)/(R1003C3)*RC3,0)+R4C -> 7852 | O216: =RC[-4]-R[-1]C[-4] -> 36 | P216: =RC[-1]-R[-1]C[-1] -> 0
B217: =R[-3]C+1 -> 72 | C217: =R[-1]C+RC[1] -> 213 | D217: 1 | F217: =ROUND((R1003C-R4C)/(R1003C3)*RC3,0)+R4C -> 2546 | G217: =ROUND((R1003C-R4C)/(R1003C3)*RC3,0)+R4C -> 1989 | H217: =ROUND((R1003C-R4C)/(R1003C3)*RC3,0)+R4C -> 5631 | I217: =ROUND((R1003C-R4C)/(R1003C3)*RC3,0)+R4C -> 1023 | J217: =ROUND((R1003C-R4C)/(R1003C3)*RC3,0)+R4C -> 553 | K217: =ROUND((R1003C-R4C)/(R1003C3)*RC3,0)+R4C -> 7889 | O217: =RC[-4]-R[-1]C[-4] -> 37 | P217: =RC[-1]-R[-1]C[-1] -> 1
B218: =R[-3]C+1 -> 72 | C218: =R[-1]C+RC[1] -> 214 | D218: 1 | F218: =ROUND((R1003C-R4C)/(R1003C3)*RC3,0)+R4C -> 2558 | G218: =ROUND((R1003C-R4C)/(R1003C3)*RC3,0)+R4C -> 1999 | H218: =ROUND((R1003C-R4C)/(R1003C3)*RC3,0)+R4C -> 5657 | I218: =ROUND((R1003C-R4C)/(R1003C3)*RC3,0)+R4C -> 1028 | J218: =ROUND((R1003C-R4C)/(R1003C3)*RC3,0)+R4C -> 556 | K218: =ROUND((R1003C-R4C)/(R1003C3)*RC3,0)+R4C -> 7925 | O218: =RC[-4]-R[-1]C[-4] -> 36 | P218: =RC[-1]-R[-1]C[-1] -> -1
B219: =R[-3]C+1 -> 72 | C219: =R[-1]C+RC[1] -> 215 | D219: 1 | F219: =ROUND((R1003C-R4C)/(R1003C3)*RC3,0)+R4C -> 2569 | G219: =ROUND((R1003C-R4C)/(R1003C3)*RC3,0)+R4C -> 2008 | H219: =ROUND((R1003C-R4C)/(R1003C3)*RC3,0)+R4C -> 5682 | I219: =ROUND((R1003C-R4C)/(R1003C3)*RC3,0)+R4C -> 1032 | J219: =ROUND((R1003C-R4C)/(R1003C3)*RC3,0)+R4C -> 558 | K219: =ROUND((R1003C-R4C)/(R1003C3)*RC3,0)+R4C -> 7961 | O219: =RC[-4]-R[-1]C[-4] -> 36 | P219: =RC[-1]-R[-1]C[-1] -> 0
B220: =R[-3]C+1 -> 73 | C220: =R[-1]C+RC[1] -> 216 | D220: 1 | F220: =ROUND((R1003C-R4C)/(R1003C3)*RC3,0)+R4C -> 2581 | G220: =ROUND((R1003C-R4C)/(R1003C3)*RC3,0)+R4C -> 2017 | H220: =ROUND((R1003C-R4C)/(R1003C3)*RC3,0)+R4C -> 5708 | I220: =ROUND((R1003C-R4C)/(R1003C3)*RC3,0)+R4C -> 1037 | J220: =ROUND((R1003C-R4C)/(R1003C3)*RC3,0)+R4C -> 561 | K220: =ROUND((R1003C-R4C)/(R1003C3)*RC3,0)+R4C -> 7997 | O220: =RC[-4]-R[-1]C[-4] -> 36 | P220: =RC[-1]-R[-1]C[-1] -> 0
B221: =R[-3]C+1 -> 73 | C221: =R[-1]C+RC[1] -> 217 | D221: 1 | F221: =ROUND((R1003C-R4C)/(R1003C3)*RC3,0)+R4C -> 2593 | G221: =ROUND((R1003C-R4C)/(R1003C3)*RC3,0)+R4C -> 2026 | H221: =ROUND((R1003C-R4C)/(R1003C3)*RC3,0)+R4C -> 5734 | I221: =ROUND((R1003C-R4C)/(R1003C3)*RC3,0)+R4C -> 1042 | J221: =ROUND((R1003C-R4C)/(R1003C3)*RC3,0)+R4C -> 563 | K221: =ROUND((R1003C-R4C)/(R1003C3)*RC3,0)+R4C -> 8033 | O221: =RC[-4]-R[-1]C[-4] -> 36 | P221: =RC[-1]-R[-1]C[-1] -> 0
B222: =R[-3]C+1 -> 73 | C222: =R[-1]C+RC[1] -> 218 | D222: 1 | F222: =ROUND((R1003C-R4C)/(R1003C3)*RC3,0)+R4C -> 2605 | G222: =ROUND((R1003C-R4C)/(R1003C3)*RC3,0)+R4C -> 2035 | H222: =ROUND((R1003C-R4C)/(R1003C3)*RC3,0)+R4C -> 5760 | I222: =ROUND((R1003C-R4C)/(R1003C3)*RC3,0)+R4C -> 1047 | J222: =ROUND((R1003C-R4C)/(R1003C3)*RC3,0)+R4C -> 566 | K222: =ROUND((R1003C-R4C)/(R1003C3)*RC3,0)+R4C -> 8069 | O222: =RC[-4]-R[-1]C[-4] -> 36 | P222: =RC[-1]-R[-1]C[-1] -> 0
B223: =R[-3]C+1 -> 74 | C223: =R[-1]C+RC[1] -> 219 | D223: 1 | F223: =ROUND((R1003C-R4C)/(R1003C3)*RC3,0)+R4C -> 2616 | G223: =ROUND((R1003C-R4C)/(R1003C3)*RC3,0)+R4C -> 2044 | H223: =ROUND((R1003C-R4C)/(R1003C3)*RC3,0)+R4C -> 5786 | I223: =ROUND((R1003C-R4C)/(R1003C3)*RC3,0)+R4C -> 1051 | J223: =ROUND((R1003C-R4C)/(R1003C3)*RC3,0)+R4C -> 569 | K223: =ROUND((R1003C-R4C)/(R1003C3)*RC3,0)+R4C -> 8106 | O223: =RC[-4]-R[-1]C[-4] -> 37 | P223: =RC[-1]-R[-1]C[-1] -> 1
B224: =R[-3]C+1 -> 74 | C224: =R[-1]C+RC[1] -> 220 | D224: 1 | F224: =ROUND((R1003C-R4C)/(R1003C3)*RC3,0)+R4C -> 2628 | G224: =ROUND((R1003C-R4C)/(R1003C3)*RC3,0)+R4C -> 2053 | H224: =ROUND((R1003C-R4C)/(R1003C3)*RC3,0)+R4C -> 5811 | I224: =ROUND((R1003C-R4C)/(R1003C3)*RC3,0)+R4C -> 1056 | J224: =ROUND((R1003C-R4C)/(R1003C3)*RC3,0)+R4C -> 571 | K224: =ROUND((R1003C-R4C)/(R1003C3)*RC3,0)+R4C -> 8142 | O224: =RC[-4]-R[-1]C[-4] -> 36 | P224: =RC[-1]-R[-1]C[-1] -> -1
B225: =R[-3]C+1 -> 74 | C225: =R[-1]C+RC[1] -> 221 | D225: 1 | F225: =ROUND((R1003C-R4C)/(R1003C3)*RC3,0)+R4C -> 2640 | G225: =ROUND((R1003C-R4C)/(R1003C3)*RC3,0)+R4C -> 2062 | H225: =ROUND((R1003C-R4C)/(R1003C3)*RC3,0)+R4C -> 5837 | I225: =ROUND((R1003C-R4C)/(R1003C3)*RC3,0)+R4C -> 1061 | J225: =ROUND((R1003C-R4C)/(R1003C3)*RC3,0)+R4C -> 574 | K225: =ROUND((R1003C-R4C)/(R1003C3)*RC3,0)+R4C -> 8178 | O225: =RC[-4]-R[-1]C[-4] -> 36 | P225: =RC[-1]-R[-1]C[-1] -> 0
B226: =R[-3]C+1 -> 75 | C226: =R[-1]C+RC[1] -> 222 | D226: 1 | F226: =ROUND((R1003C-R4C)/(R1003C3)*RC3,0)+R4C -> 2651 | G226: =ROUND((R1003C-R4C)/(R1003C3)*RC3,0)+R4C -> 2072 | H226: =ROUND((R1003C-R4C)/(R1003C3)*RC3,0)+R4C -> 5863 | I226: =ROUND((R1003C-R4C)/(R1003C3)*RC3,0)+R4C -> 1065 | J226: =ROUND((R1003C-R4C)/(R1003C3)*RC3,0)+R4C -> 576 | K226: =ROUND((R1003C-R4C)/(R1003C3)*RC3,0)+R4C -> 8214 | O226: =RC[-4]-R[-1]C[-4] -> 36 | P226: =RC[-1]-R[-1]C[-1] -> 0
B227: =R[-3]C+1 -> 75 | C227: =R[-1]C+RC[1] -> 223 | D227: 1 | F227: =ROUND((R1003C-R4C)/(R1003C3)*RC3,0)+R4C -> 2663 | G227: =ROUND((R1003C-R4C)/(R1003C3)*RC3,0)+R4C -> 2081 | H227: =ROUND((R1003C-R4C)/(R1003C3)*RC3,0)+R4C -> 5889 | I227: =ROUND((R1003C-R4C)/(R1003C3)*RC3,0)+R4C -> 1070 | J227: =ROUND((R1003C-R4C)/(R1003C3)*RC3,0)+R4C -> 579 | K227: =ROUND((R1003C-R4C)/(R1003C3)*RC3,0)+R4C -> 8250 | O227: =RC[-4]-R[-1]C[-4] -> 36 | P227: =RC[-1]-R[-1]C[-1] -> 0
B228: =R[-3]C+1 -> 75 | C228: =R[-1]C+RC[1] -> 224 | D228: 1 | F228: =ROUND((R1003C-R4C)/(R1003C3)*RC3,0)+R4C -> 2675 | G228: =ROUND((R1003C-R4C)/(R1003C3)*RC3,0)+R4C -> 2090 | H228: =ROUND((R1003C-R4C)/(R1003C3)*RC3,0)+R4C -> 5915 | I228: =ROUND((R1003C-R4C)/(R1003C3)*RC3,0)+R4C -> 1075 | J228: =ROUND((R1003C-R4C)/(R1003C3)*RC3,0)+R4C -> 581 | K228: =ROUND((R1003C-R4C)/(R1003C3)*RC3,0)+R4C -> 8287 | O228: =RC[-4]-R[-1]C[-4] -> 37 | P228: =RC[-1]-R[-1]C[-1] -> 1
B229: =R[-3]C+1 -> 76 | C229: =R[-1]C+RC[1] -> 225 | D229: 1 | F229: =ROUND((R1003C-R4C)/(R1003C3)*RC3,0)+R4C -> 2686 | G229: =ROUND((R1003C-R4C)/(R1003C3)*RC3,0)+R4C -> 2099 | H229: =ROUND((R1003C-R4C)/(R1003C3)*RC3,0)+R4C -> 5941 | I229: =ROUND((R1003C-R4C)/(R1003C3)*RC3,0)+R4C -> 1079 | J229: =ROUND((R1003C-R4C)/(R1003C3)*RC3,0)+R4C -> 584 | K229: =ROUND((R1003C-R4C)/(R1003C3)*RC3,0)+R4C -> 8323 | O229: =RC[-4]-R[-1]C[-4] -> 36 | P229: =RC[-1]-R[-1]C[-1] -> -1
B230: =R[-3]C+1 -> 76 | C230: =R[-1]C+RC[1] -> 226 | D230: 1 | F230: =ROUND((R1003C-R4C)/(R1003C3)*RC3,0)+R4C -> 2698 | G230: =ROUND((R1003C-R4C)/(R1003C3)*RC3,0)+R4C -> 2108 | H230: =ROUND((R1003C-R4C)/(R1003C3)*RC3,0)+R4C -> 5966 | I230: =ROUND((R1003C-R4C)/(R1003C3)*RC3,0)+R4C -> 1084 | J230: =ROUND((R1003C-R4C)/(R1003C3)*RC3,0)+R4C -> 586 | K230: =ROUND((R1003C-R4C)/(R1003C3)*RC3,0)+R4C -> 8359 | O230: =RC[-4]-R[-1]C[-4] -> 36 | P230: =RC[-1]-R[-1]C[-1] -> 0
B231: =R[-3]C+1 -> 76 | C231: =R[-1]C+RC[1] -> 227 | D231: 1 | F231: =ROUND((R1003C-R4C)/(R1003C3)*RC3,0)+R4C -> 2710 | G231: =ROUND((R1003C-R4C)/(R1003C3)*RC3,0)+R4C -> 2117 | H231: =ROUND((R1003C-R4C)/(R1003C3)*RC3,0)+R4C -> 5992 | I231: =ROUND((R1003C-R4C)/(R1003C3)*RC3,0)+R4C -> 1089 | J231: =ROUND((R1003C-R4C)/(R1003C3)*RC3,0)+R4C -> 589 | K231: =ROUND((R1003C-R4C)/(R1003C3)*RC3,0)+R4C -> 8395 | O231: =RC[-4]-R[-1]C[-4] -> 36 | P231: =RC[-1]-R[-1]C[-1] -> 0
B232: =R[-3]C+1 -> 77 | C232: =R[-1]C+RC[1] -> 228 | D232: 1 | F232: =ROUND((R1003C-R4C)/(R1003C3)*RC3,0)+R4C -> 2721 | G232: =ROUND((R1003C-R4C)/(R1003C3)*RC3,0)+R4C -> 2126 | H232: =ROUND((R1003C-R4C)/(R1003C3)*RC3,0)+R4C -> 6018 | I232: =ROUND((R1003C-R4C)/(R1003C3)*RC3,0)+R4C -> 1093 | J232: =ROUND((R1003C-R4C)/(R1003C3)*RC3,0)+R4C -> 591 | K232: =ROUND((R1003C-R4C)/(R1003C3)*RC3,0)+R4C -> 8431 | O232: =RC[-4]-R[-1]C[-4] -> 36 | P232: =RC[-1]-R[-1]C[-1] -> 0
B233: =R[-3]C+1 -> 77 | C233: =R[-1]C+RC[1] -> 229 | D233: 1 | F233: =ROUND((R1003C-R4C)/(R1003C3)*RC3,0)+R4C -> 2733 | G233: =ROUND((R1003C-R4C)/(R1003C3)*RC3,0)+R4C -> 2135 | H233: =ROUND((R1003C-R4C)/(R1003C3)*RC3,0)+R4C -> 6044 | I233: =ROUND((R1003C-R4C)/(R1003C3)*RC3,0)+R4C -> 1098 | J233: =ROUND((R1003C-R4C)/(R1003C3)*RC3,0)+R4C -> 594 | K233: =ROUND((R1003C-R4C)/(R1003C3)*RC3,0)+R4C -> 8467 | O233: =RC[-4]-R[-1]C[-4] -> 36 | P233: =RC[-1]-R[-1]C[-1] -> 0
B234: =R[-3]C+1 -> 77 | C234: =R[-1]C+RC[1] -> 230 | D234: 1 | F234: =ROUND((R1003C-R4C)/(R1003C3)*RC3,0)+R4C -> 2745 | G234: =ROUND((R1003C-R4C)/(R1003C3)*RC3,0)+R4C -> 2145 | H234: =ROUND((R1003C-R4C)/(R1003C3)*RC3,0)+R4C -> 6070 | I234: =ROUND((R1003C-R4C)/(R1003C3)*RC3,0)+R4C -> 1103 | J234: =ROUND((R1003C-R4C)/(R1003C3)*RC3,0)+R4C -> 596 | K234: =ROUND((R1003C-R4C)/(R1003C3)*RC3,0)+R4C -> 8504 | O234: =RC[-4]-R[-1]C[-4] -> 37 | P234: =RC[-1]-R[-1]C[-1] -> 1
B235: =R[-3]C+1 -> 78 | C235: =R[-1]C+RC[1] -> 231 | D235: 1 | F235: =ROUND((R1003C-R4C)/(R1003C3)*RC3,0)+R4C -> 2756 | G235: =ROUND((R1003C-R4C)/(R1003C3)*RC3,0)+R4C -> 2154 | H235: =ROUND((R1003C-R4C)/(R1003C3)*RC3,0)+R4C -> 6096 | I235: =ROUND((R1003C-R4C)/(R1003C3)*RC3,0)+R4C -> 1108 | J235: =ROUND((R1003C-R4C)/(R1003C3)*RC3,0)+R4C -> 599 | K235: =ROUND((R1003C-R4C)/(R1003C3)*RC3,0)+R4C -> 8540 | O235: =RC[-4]-R[-1]C[-4] -> 36 | P235: =RC[-1]-R[-1]C[-1] -> -1
B236: =R[-3]C+1 -> 78 | C236: =R[-1]C+RC[1] -> 232 | D236: 1 | F236: =ROUND((R1003C-R4C)/(R1003C3)*RC3,0)+R4C -> 2768 | G236: =ROUND((R1003C-R4C)/(R1003C3)*RC3,0)+R4C -> 2163 | H236: =ROUND((R1003C-R4C)/(R1003C3)*RC3,0)+R4C -> 6121 | I236: =ROUND((R1003C-R4C)/(R1003C3)*RC3,0)+R4C -> 1112 | J236: =ROUND((R1003C-R4C)/(R1003C3)*RC3,0)+R4C -> 601 | K236: =ROUND((R1003C-R4C)/(R1003C3)*RC3,0)+R4C -> 8576 | O236: =RC[-4]-R[-1]C[-4] -> 36 | P236: =RC[-1]-R[-1]C[-1] -> 0
B237: =R[-3]C+1 -> 78 | C237: =R[-1]C+RC[1] -> 233 | D237: 1 | F237: =ROUND((R1003C-R4C)/(R1003C3)*RC3,0)+R4C -> 2780 | G237: =ROUND((R1003C-R4C)/(R1003C3)*RC3,0)+R4C -> 2172 | H237: =ROUND((R1003C-R4C)/(R1003C3)*RC3,0)+R4C -> 6147 | I237: =ROUND((R1003C-R4C)/(R1003C3)*RC3,0)+R4C -> 1117 | J237: =ROUND((R1003C-R4C)/(R1003C3)*RC3,0)+R4C -> 604 | K237: =ROUND((R1003C-R4C)/(R1003C3)*RC3,0)+R4C -> 8612 | O237: =RC[-4]-R[-1]C[-4] -> 36 | P237: =RC[-1]-R[-1]C[-1] -> 0
B238: =R[-3]C+1 -> 79 | C238: =R[-1]C+RC[1] -> 234 | D238: 1 | F238: =ROUND((R1003C-R4C)/(R1003C3)*RC3,0)+R4C -> 2791 | G238: =ROUND((R1003C-R4C)/(R1003C3)*RC3,0)+R4C -> 2181 | H238: =ROUND((R1003C-R4C)/(R1003C3)*RC3,0)+R4C -> 6173 | I238: =ROUND((R1003C-R4C)/(R1003C3)*RC3,0)+R4C -> 1122 | J238: =ROUND((R1003C-R4C)/(R1003C3)*RC3,0)+R4C -> 607 | K238: =ROUND((R1003C-R4C)/(R1003C3)*RC3,0)+R4C -> 8648 | O238: =RC[-4]-R[-1]C[-4] -> 36 | P238: =RC[-1]-R[-1]C[-1] -> 0
B239: =R[-3]C+1 -> 79 | C239: =R[-1]C+RC[1] -> 235 | D239: 1 | F239: =ROUND((R1003C-R4C)/(R1003C3)*RC3,0)+R4C -> 2803 | G239: =ROUND((R1003C-R4C)/(R1003C3)*RC3,0)+R4C -> 2190 | H239: =ROUND((R1003C-R4C)/(R1003C3)*RC3,0)+R4C -> 6199 | I239: =ROUND((R1003C-R4C)/(R1003C3)*RC3,0)+R4C -> 1126 | J239: =ROUND((R1003C-R4C)/(R1003C3)*RC3,0)+R4C -> 609 | K239: =ROUND((R1003C-R4C)/(R1003C3)*RC3,0)+R4C -> 8685 | O239: =RC[-4]-R[-1]C[-4] -> 37 | P239: =RC[-1]-R[-1]C[-1] -> 1
B240: =R[-3]C+1 -> 79 | C240: =R[-1]C+RC[1] -> 236 | D240: 1 | F240: =ROUND((R1003C-R4C)/(R1003C3)*RC3,0)+R4C -> 2815 | G240: =ROUND((R1003C-R4C)/(R1003C3)*RC3,0)+R4C -> 2199 | H240: =ROUND((R1003C-R4C)/(R1003C3)*RC3,0)+R4C -> 6225 | I240: =ROUND((R1003C-R4C)/(R1003C3)*RC3,0)+R4C -> 1131 | J240: =ROUND((R1003C-R4C)/(R1003C3)*RC3,0)+R4C -> 612 | K240: =ROUND((R1003C-R4C)/(R1003C3)*RC3,0)+R4C -> 8721 | O240: =RC[-4]-R[-1]C[-4] -> 36 | P240: =RC[-1]-R[-1]C[-1] -> -1
B241: =R[-3]C+1 -> 80 | C241: =R[-1]C+RC[1] -> 237 | D241: 1 | F241: =ROUND((R1003C-R4C)/(R1003C3)*RC3,0)+R4C -> 2826 | G241: =ROUND((R1003C-R4C)/(R1003C3)*RC3,0)+R4C -> 2208 | H241: =ROUND((R1003C-R4C)/(R1003C3)*RC3,0)+R4C -> 6250 | I241: =ROUND((R1003C-R4C)/(R1003C3)*RC3,0)+R4C -> 1136 | J241: =ROUND((R1003C-R4C)/(R1003C3)*RC3,0)+R4C -> 614 | K241: =ROUND((R1003C-R4C)/(R1003C3)*RC3,0)+R4C -> 8757 | O241: =RC[-4]-R[-1]C[-4] -> 36 | P241: =RC[-1]-R[-1]C[-1] -> 0
B242: =R[-3]C+1 -> 80 | C242: =R[-1]C+RC[1] -> 238 | D242: 1 | F242: =ROUND((R1003C-R4C)/(R1003C3)*RC3,0)+R4C -> 2838 | G242: =ROUND((R1003C-R4C)/(R1003C3)*RC3,0)+R4C -> 2218 | H242: =ROUND((R1003C-R4C)/(R1003C3)*RC3,0)+R4C -> 6276 | I242: =ROUND((R1003C-R4C)/(R1003C3)*RC3,0)+R4C -> 1140 | J242: =ROUND((R1003C-R4C)/(R1003C3)*RC3,0)+R4C -> 617 | K242: =ROUND((R1003C-R4C)/(R1003C3)*RC3,0)+R4C -> 8793 | O242: =RC[-4]-R[-1]C[-4] -> 36 | P242: =RC[-1]-R[-1]C[-1] -> 0
B243: =R[-3]C+1 -> 80 | C243: =R[-1]C+RC[1] -> 239 | D243: 1 | F243: =ROUND((R1003C-R4C)/(R1003C3)*RC3,0)+R4C -> 2850 | G243: =ROUND((R1003C-R4C)/(R1003C3)*RC3,0)+R4C -> 2227 | H243: =ROUND((R1003C-R4C)/(R1003C3)*RC3,0)+R4C -> 6302 | I243: =ROUND((R1003C-R4C)/(R1003C3)*RC3,0)+R4C -> 1145 | J243: =ROUND((R1003C-R4C)/(R1003C3)*RC3,0)+R4C -> 619 | K243: =ROUND((R1003C-R4C)/(R1003C3)*RC3,0)+R4C -> 8829 | O243: =RC[-4]-R[-1]C[-4] -> 36 | P243: =RC[-1]-R[-1]C[-1] -> 0
B244: =R[-3]C+1 -> 81 | C244: =R[-1]C+RC[1] -> 240 | D244: 1 | F244: =ROUND((R1003C-R4C)/(R1003C3)*RC3,0)+R4C -> 2861 | G244: =ROUND((R1003C-R4C)/(R1003C3)*RC3,0)+R4C -> 2236 | H244: =ROUND((R1003C-R4C)/(R1003C3)*RC3,0)+R4C -> 6328 | I244: =ROUND((R1003C-R4C)/(R1003C3)*RC3,0)+R4C -> 1150 | J244: =ROUND((R1003C-R4C)/(R1003C3)*RC3,0)+R4C -> 622 | K244: =ROUND((R1003C-R4C)/(R1003C3)*RC3,0)+R4C -> 8865 | O244: =RC[-4]-R[-1]C[-4] -> 36 | P244: =RC[-1]-R[-1]C[-1] -> 0
B245: =R[-3]C+1 -> 81 | C245: =R[-1]C+RC[1] -> 241 | D245: 1 | F245: =ROUND((R1003C-R4C)/(R1003C3)*RC3,0)+R4C -> 2873 | G245: =ROUND((R1003C-R4C)/(R1003C3)*RC3,0)+R4C -> 2245 | H245: =ROUND((R1003C-R4C)/(R1003C3)*RC3,0)+R4C -> 6354 | I245: =ROUND((R1003C-R4C)/(R1003C3)*RC3,0)+R4C -> 1154 | J245: =ROUND((R1003C-R4C)/(R1003C3)*RC3,0)+R4C -> 624 | K245: =ROUND((R1003C-R4C)/(R1003C3)*RC3,0)+R4C -> 8902 | O245: =RC[-4]-R[-1]C[-4] -> 37 | P245: =RC[-1]-R[-1]C[-1] -> 1
B246: =R[-3]C+1 -> 81 | C246: =R[-1]C+RC[1] -> 242 | D246: 1 | F246: =ROUND((R1003C-R4C)/(R1003C3)*RC3,0)+R4C -> 2885 | G246: =ROUND((R1003C-R4C)/(R1003C3)*RC3,0)+R4C -> 2254 | H246: =ROUND((R1003C-R4C)/(R1003C3)*RC3,0)+R4C -> 6380 | I246: =ROUND((R1003C-R4C)/(R1003C3)*RC3,0)+R4C -> 1159 | J246: =ROUND((R1003C-R4C)/(R1003C3)*RC3,0)+R4C -> 627 | K246: =ROUND((R1003C-R4C)/(R1003C3)*RC3,0)+R4C -> 8938 | O246: =RC[-4]-R[-1]C[-4] -> 36 | P246: =RC[-1]-R[-1]C[-1] -> -1
B247: =R[-3]C+1 -> 82 | C247: =R[-1]C+RC[1] -> 243 | D247: 1 | F247: =ROUND((R1003C-R4C)/(R1003C3)*RC3,0)+R4C -> 2896 | G247: =ROUND((R1003C-R4C)/(R1003C3)*RC3,0)+R4C -> 2263 | H247: =ROUND((R1003C-R4C)/(R1003C3)*RC3,0)+R4C -> 6405 | I247: =ROUND((R1003C-R4C)/(R1003C3)*RC3,0)+R4C -> 1164 | J247: =ROUND((R1003C-R4C)/(R1003C3)*RC3,0)+R4C -> 629 | K247: =ROUND((R1003C-R4C)/(R1003C3)*RC3,0)+R4C -> 8974 | O247: =RC[-4]-R[-1]C[-4] -> 36 | P247: =RC[-1]-R[-1]C[-1] -> 0
B248: =R[-3]C+1 -> 82 | C248: =R[-1]C+RC[1] -> 244 | D248: 1 | F248: =ROUND((R1003C-R4C)/(R1003C3)*RC3,0)+R4C -> 2908 | G248: =ROUND((R1003C-R4C)/(R1003C3)*RC3,0)+R4C -> 2272 | H248: =ROUND((R1003C-R4C)/(R1003C3)*RC3,0)+R4C -> 6431 | I248: =ROUND((R1003C-R4C)/(R1003C3)*RC3,0)+R4C -> 1169 | J248: =ROUND((R1003C-R4C)/(R1003C3)*RC3,0)+R4C -> 632 | K248: =ROUND((R1003C-R4C)/(R1003C3)*RC3,0)+R4C -> 9010 | O248: =RC[-4]-R[-1]C[-4] -> 36 | P248: =RC[-1]-R[-1]C[-1] -> 0
B249: =R[-3]C+1 -> 82 | C249: =R[-1]C+RC[1] -> 245 | D249: 1 | F249: =ROUND((R1003C-R4C)/(R1003C3)*RC3,0)+R4C -> 2920 | G249: =ROUND((R1003C-R4C)/(R1003C3)*RC3,0)+R4C -> 2281 | H249: =ROUND((R1003C-R4C)/(R1003C3)*RC3,0)+R4C -> 6457 | I249: =ROUND((R1003C-R4C)/(R1003C3)*RC3,0)+R4C -> 1173 | J249: =ROUND((R1003C-R4C)/(R1003C3)*RC3,0)+R4C -> 634 | K249: =ROUND((R1003C-R4C)/(R1003C3)*RC3,0)+R4C -> 9046 | O249: =RC[-4]-R[-1]C[-4] -> 36 | P249: =RC[-1]-R[-1]C[-1] -> 0
B250: =R[-3]C+1 -> 83 | C250: =R[-1]C+RC[1] -> 246 | D250: 1 | F250: =ROUND((R1003C-R4C)/(R1003C3)*RC3,0)+R4C -> 2931 | G250: =ROUND((R1003C-R4C)/(R1003C3)*RC3,0)+R4C -> 2291 | H250: =ROUND((R1003C-R4C)/(R1003C3)*RC3,0)+R4C -> 6483 | I250: =ROUND((R1003C-R4C)/(R1003C3)*RC3,0)+R4C -> 1178 | J250: =ROUND((R1003C-R4C)/(R1003C3)*RC3,0)+R4C -> 637 | K250: =ROUND((R1003C-R4C)/(R1003C3)*RC3,0)+R4C -> 9083 | O250: =RC[-4]-R[-1]C[-4] -> 37 | P250: =RC[-1]-R[-1]C[-1] -> 1
B251: =R[-3]C+1 -> 83 | C251: =R[-1]C+RC[1] -> 247 | D251: 1 | F251: =ROUND((R1003C-R4C)/(R1003C3)*RC3,0)+R4C -> 2943 | G251: =ROUND((R1003C-R4C)/(R1003C3)*RC3,0)+R4C -> 2300 | H251: =ROUND((R1003C-R4C)/(R1003C3)*RC3,0)+R4C -> 6509 | I251: =ROUND((R1003C-R4C)/(R1003C3)*RC3,0)+R4C -> 1183 | J251: =ROUND((R1003C-R4C)/(R1003C3)*RC3,0)+R4C -> 640 | K251: =ROUND((R1003C-R4C)/(R1003C3)*RC3,0)+R4C -> 9119 | O251: =RC[-4]-R[-1]C[-4] -> 36 | P251: =RC[-1]-R[-1]C[-1] -> -1
B252: =R[-3]C+1 -> 83 | C252: =R[-1]C+RC[1] -> 248 | D252: 1 | F252: =ROUND((R1003C-R4C)/(R1003C3)*RC3,0)+R4C -> 2955 | G252: =ROUND((R1003C-R4C)/(R1003C3)*RC3,0)+R4C -> 2309 | H252: =ROUND((R1003C-R4C)/(R1003C3)*RC3,0)+R4C -> 6535 | I252: =ROUND((R1003C-R4C)/(R1003C3)*RC3,0)+R4C -> 1187 | J252: =ROUND((R1003C-R4C)/(R1003C3)*RC3,0)+R4C -> 642 | K252: =ROUND((R1003C-R4C)/(R1003C3)*RC3,0)+R4C -> 9155 | O252: =RC[-4]-R[-1]C[-4] -> 36 | P252: =RC[-1]-R[-1]C[-1] -> 0
B253: =R[-3]C+1 -> 84 | C253: =R[-1]C+RC[1] -> 249 | D253: 1 | F253: =ROUND((R1003C-R4C)/(R1003C3)*RC3,0)+R4C -> 2966 | G253: =ROUND((R1003C-R4C)/(R1003C3)*RC3,0)+R4C -> 2318 | H253: =ROUND((R1003C-R4C)/(R1003C3)*RC3,0)+R4C -> 6560 | I253: =ROUND((R1003C-R4C)/(R1003C3)*RC3,0)+R4C -> 1192 | J253: =ROUND((R1003C-R4C)/(R1003C3)*RC3,0)+R4C -> 645 | K253: =ROUND((R1003C-R4C)/(R1003C3)*RC3,0)+R4C -> 9191 | O253: =RC[-4]-R[-1]C[-4] -> 36 | P253: =RC[-1]-R[-1]C[-1] -> 0
B254: =R[-3]C+1 -> 84 | C254: =R[-1]C+RC[1] -> 250 | D254: 1 | F254: =ROUND((R1003C-R4C)/(R1003C3)*RC3,0)+R4C -> 2978 | G254: =ROUND((R1003C-R4C)/(R1003C3)*RC3,0)+R4C -> 2327 | H254: =ROUND((R1003C-R4C)/(R1003C3)*RC3,0)+R4C -> 6586 | I254: =ROUND((R1003C-R4C)/(R1003C3)*RC3,0)+R4C -> 1197 | J254: =ROUND((R1003C-R4C)/(R1003C3)*RC3,0)+R4C -> 647 | K254: =ROUND((R1003C-R4C)/(R1003C3)*RC3,0)+R4C -> 9227 | O254: =RC[-4]-R[-1]C[-4] -> 36 | P254: =RC[-1]-R[-1]C[-1] -> 0
B255: =R[-3]C+1 -> 84 | C255: =R[-1]C+RC[1] -> 251 | D255: 1 | F255: =ROUND((R1003C-R4C)/(R1003C3)*RC3,0)+R4C -> 2990 | G255: =ROUND((R1003C-R4C)/(R1003C3)*RC3,0)+R4C -> 2336 | H255: =ROUND((R1003C-R4C)/(R1003C3)*RC3,0)+R4C -> 6612 | I255: =ROUND((R1003C-R4C)/(R1003C3)*RC3,0)+R4C -> 1201 | J255: =ROUND((R1003C-R4C)/(R1003C3)*RC3,0)+R4C -> 650 | K255: =ROUND((R1003C-R4C)/(R1003C3)*RC3,0)+R4C -> 9263 | O255: =RC[-4]-R[-1]C[-4] -> 36 | P255: =RC[-1]-R[-1]C[-1] -> 0
B256: =R[-3]C+1 -> 85 | C256: =R[-1]C+RC[1] -> 252 | D256: 1 | F256: =ROUND((R1003C-R4C)/(R1003C3)*RC3,0)+R4C -> 3002 | G256: =ROUND((R1003C-R4C)/(R1003C3)*RC3,0)+R4C -> 2345 | H256: =ROUND((R1003C-R4C)/(R1003C3)*RC3,0)+R4C -> 6638 | I256: =ROUND((R1003C-R4C)/(R1003C3)*RC3,0)+R4C -> 1206 | J256: =ROUND((R1003C-R4C)/(R1003C3)*RC3,0)+R4C -> 652 | K256: =ROUND((R1003C-R4C)/(R1003C3)*RC3,0)+R4C -> 9300 | O256: =RC[-4]-R[-1]C[-4] -> 37 | P256: =RC[-1]-R[-1]C[-1] -> 1
B257: =R[-3]C+1 -> 85 | C257: =R[-1]C+RC[1] -> 253 | D257: 1 | F257: =ROUND((R1003C-R4C)/(R1003C3)*RC3,0)+R4C -> 3013 | G257: =ROUND((R1003C-R4C)/(R1003C3)*RC3,0)+R4C -> 2354 | H257: =ROUND((R1003C-R4C)/(R1003C3)*RC3,0)+R4C -> 6664 | I257: =ROUND((R1003C-R4C)/(R1003C3)*RC3,0)+R4C -> 1211 | J257: =ROUND((R1003C-R4C)/(R1003C3)*RC3,0)+R4C -> 655 | K257: =ROUND((R1003C-R4C)/(R1003C3)*RC3,0)+R4C -> 9336 | O257: =RC[-4]-R[-1]C[-4] -> 36 | P257: =RC[-1]-R[-1]C[-1] -> -1
B258: =R[-3]C+1 -> 85 | C258: =R[-1]C+RC[1] -> 254 | D258: 1 | F258: =ROUND((R1003C-R4C)/(R1003C3)*RC3,0)+R4C -> 3025 | G258: =ROUND((R1003C-R4C)/(R1003C3)*RC3,0)+R4C -> 2364 | H258: =ROUND((R1003C-R4C)/(R1003C3)*RC3,0)+R4C -> 6690 | I258: =ROUND((R1003C-R4C)/(R1003C3)*RC3,0)+R4C -> 1215 | J258: =ROUND((R1003C-R4C)/(R1003C3)*RC3,0)+R4C -> 657 | K258: =ROUND((R1003C-R4C)/(R1003C3)*RC3,0)+R4C -> 9372 | O258: =RC[-4]-R[-1]C[-4] -> 36 | P258: =RC[-1]-R[-1]C[-1] -> 0
B259: =R[-3]C+1 -> 86 | C259: =R[-1]C+RC[1] -> 255 | D259: 1 | F259: =ROUND((R1003C-R4C)/(R1003C3)*RC3,0)+R4C -> 3037 | G259: =ROUND((R1003C-R4C)/(R1003C3)*RC3,0)+R4C -> 2373 | H259: =ROUND((R1003C-R4C)/(R1003C3)*RC3,0)+R4C -> 6715 | I259: =ROUND((R1003C-R4C)/(R1003C3)*RC3,0)+R4C -> 1220 | J259: =ROUND((R1003C-R4C)/(R1003C3)*RC3,0)+R4C -> 660 | K259: =ROUND((R1003C-R4C)/(R1003C3)*RC3,0)+R4C -> 9408 | O259: =RC[-4]-R[-1]C[-4] -> 36 | P259: =RC[-1]-R[-1]C[-1] -> 0
B260: =R[-3]C+1 -> 86 | C260: =R[-1]C+RC[1] -> 256 | D260: 1 | F260: =ROUND((R1003C-R4C)/(R1003C3)*RC3,0)+R4C -> 3048 | G260: =ROUND((R1003C-R4C)/(R1003C3)*RC3,0)+R4C -> 2382 | H260: =ROUND((R1003C-R4C)/(R1003C3)*RC3,0)+R4C -> 6741 | I260: =ROUND((R1003C-R4C)/(R1003C3)*RC3,0)+R4C -> 1225 | J260: =ROUND((R1003C-R4C)/(R1003C3)*RC3,0)+R4C -> 662 | K260: =ROUND((R1003C-R4C)/(R1003C3)*RC3,0)+R4C -> 9444 | O260: =RC[-4]-R[-1]C[-4] -> 36 | P260: =RC[-1]-R[-1]C[-1] -> 0
B261: =R[-3]C+1 -> 86 | C261: =R[-1]C+RC[1] -> 257 | D261: 1 | F261: =ROUND((R1003C-R4C)/(R1003C3)*RC3,0)+R4C -> 3060 | G261: =ROUND((R1003C-R4C)/(R1003C3)*RC3,0)+R4C -> 2391 | H261: =ROUND((R1003C-R4C)/(R1003C3)*RC3,0)+R4C -> 6767 | I261: =ROUND((R1003C-R4C)/(R1003C3)*RC3,0)+R4C -> 1230 | J261: =ROUND((R1003C-R4C)/(R1003C3)*RC3,0)+R4C -> 665 | K261: =ROUND((R1003C-R4C)/(R1003C3)*RC3,0)+R4C -> 9481 | O261: =RC[-4]-R[-1]C[-4] -> 37 | P261: =RC[-1]-R[-1]C[-1] -> 1
B262: =R[-3]C+1 -> 87 | C262: =R[-1]C+RC[1] -> 258 | D262: 1 | F262: =ROUND((R1003C-R4C)/(R1003C3)*RC3,0)+R4C -> 3072 | G262: =ROUND((R1003C-R4C)/(R1003C3)*RC3,0)+R4C -> 2400 | H262: =ROUND((R1003C-R4C)/(R1003C3)*RC3,0)+R4C -> 6793 | I262: =ROUND((R1003C-R4C)/(R1003C3)*RC3,0)+R4C -> 1234 | J262: =ROUND((R1003C-R4C)/(R1003C3)*RC3,0)+R4C -> 667 | K262: =ROUND((R1003C-R4C)/(R1003C3)*RC3,0)+R4C -> 9517 | O262: =RC[-4]-R[-1]C[-4] -> 36 | P262: =RC[-1]-R[-1]C[-1] -> -1
B263: =R[-3]C+1 -> 87 | C263: =R[-1]C+RC[1] -> 259 | D263: 1 | F263: =ROUND((R1003C-R4C)/(R1003C3)*RC3,0)+R4C -> 3083 | G263: =ROUND((R1003C-R4C)/(R1003C3)*RC3,0)+R4C -> 2409 | H263: =ROUND((R1003C-R4C)/(R1003C3)*RC3,0)+R4C -> 6819 | I263: =ROUND((R1003C-R4C)/(R1003C3)*RC3,0)+R4C -> 1239 | J263: =ROUND((R1003C-R4C)/(R1003C3)*RC3,0)+R4C -> 670 | K263: =ROUND((R1003C-R4C)/(R1003C3)*RC3,0)+R4C -> 9553 | O263: =RC[-4]-R[-1]C[-4] -> 36 | P263: =RC[-1]-R[-1]C[-1] -> 0
B264: =R[-3]C+1 -> 87 | C264: =R[-1]C+RC[1] -> 260 | D264: 1 | F264: =ROUND((R1003C-R4C)/(R1003C3)*RC3,0)+R4C -> 3095 | G264: =ROUND((R1003C-R4C)/(R1003C3)*RC3,0)+R4C -> 2418 | H264: =ROUND((R1003C-R4C)/(R1003C3)*RC3,0)+R4C -> 6844 | I264: =ROUND((R1003C-R4C)/(R1003C3)*RC3,0)+R4C -> 1244 | J264: =ROUND((R1003C-R4C)/(R1003C3)*RC3,0)+R4C -> 672 | K264: =ROUND((R1003C-R4C)/(R1003C3)*RC3,0)+R4C -> 9589 | O264: =RC[-4]-R[-1]C[-4] -> 36 | P264: =RC[-1]-R[-1]C[-1] -> 0
B265: =R[-3]C+1 -> 88 | C265: =R[-1]C+RC[1] -> 261 | D265: 1 | F265: =ROUND((R1003C-R4C)/(R1003C3)*RC3,0)+R4C -> 3107 | G265: =ROUND((R1003C-R4C)/(R1003C3)*RC3,0)+R4C -> 2427 | H265: =ROUND((R1003C-R4C)/(R1003C3)*RC3,0)+R4C -> 6870 | I265: =ROUND((R1003C-R4C)/(R1003C3)*RC3,0)+R4C -> 1248 | J265: =ROUND((R1003C-R4C)/(R1003C3)*RC3,0)+R4C -> 675 | K265: =ROUND((R1003C-R4C)/(R1003C3)*RC3,0)+R4C -> 9625 | O265: =RC[-4]-R[-1]C[-4] -> 36 | P265: =RC[-1]-R[-1]C[-1] -> 0
B266: =R[-3]C+1 -> 88 | C266: =R[-1]C+RC[1] -> 262 | D266: 1 | F266: =ROUND((R1003C-R4C)/(R1003C3)*RC3,0)+R4C -> 3118 | G266: =ROUND((R1003C-R4C)/(R1003C3)*RC3,0)+R4C -> 2437 | H266: =ROUND((R1003C-R4C)/(R1003C3)*RC3,0)+R4C -> 6896 | I266: =ROUND((R1003C-R4C)/(R1003C3)*RC3,0)+R4C -> 1253 | J266: =ROUND((R1003C-R4C)/(R1003C3)*RC3,0)+R4C -> 678 | K266: =ROUND((R1003C-R4C)/(R1003C3)*RC3,0)+R4C -> 9661 | O266: =RC[-4]-R[-1]C[-4] -> 36 | P266: =RC[-1]-R[-1]C[-1] -> 0
B267: =R[-3]C+1 -> 88 | C267: =R[-1]C+RC[1] -> 263 | D267: 1 | F267: =ROUND((R1003C-R4C)/(R1003C3)*RC3,0)+R4C -> 3130 | G267: =ROUND((R1003C-R4C)/(R1003C3)*RC3,0)+R4C -> 2446 | H267: =ROUND((R1003C-R4C)/(R1003C3)*RC3,0)+R4C -> 6922 | I267: =ROUND((R1003C-R4C)/(R1003C3)*RC3,0)+R4C -> 1258 | J267: =ROUND((R1003C-R4C)/(R1003C3)*RC3,0)+R4C -> 680 | K267: =ROUND((R1003C-R4C)/(R1003C3)*RC3,0)+R4C -> 9698 | O267: =RC[-4]-R[-1]C[-4] -> 37 | P267: =RC[-1]-R[-1]C[-1] -> 1
B268: =R[-3]C+1 -> 89 | C268: =R[-1]C+RC[1] -> 264 | D268: 1 | F268: =ROUND((R1003C-R4C)/(R1003C3)*RC3,0)+R4C -> 3142 | G268: =ROUND((R1003C-R4C)/(R1003C3)*RC3,0)+R4C -> 2455 | H268: =ROUND((R1003C-R4C)/(R1003C3)*RC3,0)+R4C -> 6948 | I268: =ROUND((R1003C-R4C)/(R1003C3)*RC3,0)+R4C -> 1262 | J268: =ROUND((R1003C-R4C)/(R1003C3)*RC3,0)+R4C -> 683 | K268: =ROUND((R1003C-R4C)/(R1003C3)*RC3,0)+R4C -> 9734 | O268: =RC[-4]-R[-1]C[-4] -> 36 | P268: =RC[-1]-R[-1]C[-1] -> -1
B269: =R[-3]C+1 -> 89 | C269: =R[-1]C+RC[1] -> 265 | D269: 1 | F269: =ROUND((R1003C-R4C)/(R1003C3)*RC3,0)+R4C -> 3153 | G269: =ROUND((R1003C-R4C)/(R1003C3)*RC3,0)+R4C -> 2464 | H269: =ROUND((R1003C-R4C)/(R1003C3)*RC3,0)+R4C -> 6974 | I269: =ROUND((R1003C-R4C)/(R1003C3)*RC3,0)+R4C -> 1267 | J269: =ROUND((R1003C-R4C)/(R1003C3)*RC3,0)+R4C -> 685 | K269: =ROUND((R1003C-R4C)/(R1003C3)*RC3,0)+R4C -> 9770 | O269: =RC[-4]-R[-1]C[-4] -> 36 | P269: =RC[-1]-R[-1]C[-1] -> 0
B270: =R[-3]C+1 -> 89 | C270: =R[-1]C+RC[1] -> 266 | D270: 1 | F270: =ROUND((R1003C-R4C)/(R1003C3)*RC3,0)+R4C -> 3165 | G270: =ROUND((R1003C-R4C)/(R1003C3)*RC3,0)+R4C -> 2473 | H270: =ROUND((R1003C-R4C)/(R1003C3)*RC3,0)+R4C -> 6999 | I270: =ROUND((R1003C-R4C)/(R1003C3)*RC3,0)+R4C -> 1272 | J270: =ROUND((R1003C-R4C)/(R1003C3)*RC3,0)+R4C -> 688 | K270: =ROUND((R1003C-R4C)/(R1003C3)*RC3,0)+R4C -> 9806 | O270: =RC[-4]-R[-1]C[-4] -> 36 | P270: =RC[-1]-R[-1]C[-1] -> 0
B271: =R[-3]C+1 -> 90 | C271: =R[-1]C+RC[1] -> 267 | D271: 1 | F271: =ROUND((R1003C-R4C)/(R1003C3)*RC3,0)+R4C -> 3177 | G271: =ROUND((R1003C-R4C)/(R1003C3)*RC3,0)+R4C -> 2482 | H271: =ROUND((R1003C-R4C)/(R1003C3)*RC3,0)+R4C -> 7025 | I271: =ROUND((R1003C-R4C)/(R1003C3)*RC3,0)+R4C -> 1276 | J271: =ROUND((R1003C-R4C)/(R1003C3)*RC3,0)+R4C -> 690 | K271: =ROUND((R1003C-R4C)/(R1003C3)*RC3,0)+R4C -> 9842 | O271: =RC[-4]-R[-1]C[-4] -> 36 | P271: =RC[-1]-R[-1]C[-1] -> 0
B272: =R[-3]C+1 -> 90 | C272: =R[-1]C+RC[1] -> 268 | D272: 1 | F272: =ROUND((R1003C-R4C)/(R1003C3)*RC3,0)+R4C -> 3188 | G272: =ROUND((R1003C-R4C)/(R1003C3)*RC3,0)+R4C -> 2491 | H272: =ROUND((R1003C-R4C)/(R1003C3)*RC3,0)+R4C -> 7051 | I272: =ROUND((R1003C-R4C)/(R1003C3)*RC3,0)+R4C -> 1281 | J272: =ROUND((R1003C-R4C)/(R1003C3)*RC3,0)+R4C -> 693 | K272: =ROUND((R1003C-R4C)/(R1003C3)*RC3,0)+R4C -> 9879 | O272: =RC[-4]-R[-1]C[-4] -> 37 | P272: =RC[-1]-R[-1]C[-1] -> 1
B273: =R[-3]C+1 -> 90 | C273: =R[-1]C+RC[1] -> 269 | D273: 1 | F273: =ROUND((R1003C-R4C)/(R1003C3)*RC3,0)+R4C -> 3200 | G273: =ROUND((R1003C-R4C)/(R1003C3)*RC3,0)+R4C -> 2500 | H273: =ROUND((R1003C-R4C)/(R1003C3)*RC3,0)+R4C -> 7077 | I273: =ROUND((R1003C-R4C)/(R1003C3)*RC3,0)+R4C -> 1286 | J273: =ROUND((R1003C-R4C)/(R1003C3)*RC3,0)+R4C -> 695 | K273: =ROUND((R1003C-R4C)/(R1003C3)*RC3,0)+R4C -> 9915 | O273: =RC[-4]-R[-1]C[-4] -> 36 | P273: =RC[-1]-R[-1]C[-1] -> -1
B274: =R[-3]C+1 -> 91 | C274: =R[-1]C+RC[1] -> 270 | D274: 1 | F274: =ROUND((R1003C-R4C)/(R1003C3)*RC3,0)+R4C -> 3212 | G274: =ROUND((R1003C-R4C)/(R1003C3)*RC3,0)+R4C -> 2510 | H274: =ROUND((R1003C-R4C)/(R1003C3)*RC3,0)+R4C -> 7103 | I274: =ROUND((R1003C-R4C)/(R1003C3)*RC3,0)+R4C -> 1290 | J274: =ROUND((R1003C-R4C)/(R1003C3)*RC3,0)+R4C -> 698 | K274: =ROUND((R1003C-R4C)/(R1003C3)*RC3,0)+R4C -> 9951 | O274: =RC[-4]-R[-1]C[-4] -> 36 | P274: =RC[-1]-R[-1]C[-1] -> 0
B275: =R[-3]C+1 -> 91 | C275: =R[-1]C+RC[1] -> 271 | D275: 1 | F275: =ROUND((R1003C-R4C)/(R1003C3)*RC3,0)+R4C -> 3223 | G275: =ROUND((R1003C-R4C)/(R1003C3)*RC3,0)+R4C -> 2519 | H275: =ROUND((R1003C-R4C)/(R1003C3)*RC3,0)+R4C -> 7129 | I275: =ROUND((R1003C-R4C)/(R1003C3)*RC3,0)+R4C -> 1295 | J275: =ROUND((R1003C-R4C)/(R1003C3)*RC3,0)+R4C -> 700 | K275: =ROUND((R1003C-R4C)/(R1003C3)*RC3,0)+R4C -> 9987 | O275: =RC[-4]-R[-1]C[-4] -> 36 | P275: =RC[-1]-R[-1]C[-1] -> 0
B276: =R[-3]C+1 -> 91 | C276: =R[-1]C+RC[1] -> 272 | D276: 1 | F276: =ROUND((R1003C-R4C)/(R1003C3)*RC3,0)+R4C -> 3235 | G276: =ROUND((R1003C-R4C)/(R1003C3)*RC3,0)+R4C -> 2528 | H276: =ROUND((R1003C-R4C)/(R1003C3)*RC3,0)+R4C -> 7154 | I276: =ROUND((R1003C-R4C)/(R1003C3)*RC3,0)+R4C -> 1300 | J276: =ROUND((R1003C-R4C)/(R1003C3)*RC3,0)+R4C -> 703 | K276: =ROUND((R1003C-R4C)/(R1003C3)*RC3,0)+R4C -> 10023 | O276: =RC[-4]-R[-1]C[-4] -> 36 | P276: =RC[-1]-R[-1]C[-1] -> 0
B277: =R[-3]C+1 -> 92 | C277: =R[-1]C+RC[1] -> 273 | D277: 1 | F277: =ROUND((R1003C-R4C)/(R1003C3)*RC3,0)+R4C -> 3247 | G277: =ROUND((R1003C-R4C)/(R1003C3)*RC3,0)+R4C -> 2537 | H277: =ROUND((R1003C-R4C)/(R1003C3)*RC3,0)+R4C -> 7180 | I277: =ROUND((R1003C-R4C)/(R1003C3)*RC3,0)+R4C -> 1305 | J277: =ROUND((R1003C-R4C)/(R1003C3)*RC3,0)+R4C -> 705 | K277: =ROUND((R1003C-R4C)/(R1003C3)*RC3,0)+R4C -> 10059 | O277: =RC[-4]-R[-1]C[-4] -> 36 | P277: =RC[-1]-R[-1]C[-1] -> 0
B278: =R[-3]C+1 -> 92 | C278: =R[-1]C+RC[1] -> 274 | D278: 1 | F278: =ROUND((R1003C-R4C)/(R1003C3)*RC3,0)+R4C -> 3258 | G278: =ROUND((R1003C-R4C)/(R1003C3)*RC3,0)+R4C -> 2546 | H278: =ROUND((R1003C-R4C)/(R1003C3)*RC3,0)+R4C -> 7206 | I278: =ROUND((R1003C-R4C)/(R1003C3)*RC3,0)+R4C -> 1309 | J278: =ROUND((R1003C-R4C)/(R1003C3)*RC3,0)+R4C -> 708 | K278: =ROUND((R1003C-R4C)/(R1003C3)*RC3,0)+R4C -> 10096 | O278: =RC[-4]-R[-1]C[-4] -> 37 | P278: =RC[-1]-R[-1]C[-1] -> 1
B279: =R[-3]C+1 -> 92 | C279: =R[-1]C+RC[1] -> 275 | D279: 1 | F279: =ROUND((R1003C-R4C)/(R1003C3)*RC3,0)+R4C -> 3270 | G279: =ROUND((R1003C-R4C)/(R1003C3)*RC3,0)+R4C -> 2555 | H279: =ROUND((R1003C-R4C)/(R1003C3)*RC3,0)+R4C -> 7232 | I279: =ROUND((R1003C-R4C)/(R1003C3)*RC3,0)+R4C -> 1314 | J279: =ROUND((R1003C-R4C)/(R1003C3)*RC3,0)+R4C -> 711 | K279: =ROUND((R1003C-R4C)/(R1003C3)*RC3,0)+R4C -> 10132 | O279: =RC[-4]-R[-1]C[-4] -> 36 | P279: =RC[-1]-R[-1]C[-1] -> -1
B280: =R[-3]C+1 -> 93 | C280: =R[-1]C+RC[1] -> 276 | D280: 1 | F280: =ROUND((R1003C-R4C)/(R1003C3)*RC3,0)+R4C -> 3282 | G280: =ROUND((R1003C-R4C)/(R1003C3)*RC3,0)+R4C -> 2564 | H280: =ROUND((R1003C-R4C)/(R1003C3)*RC3,0)+R4C -> 7258 | I280: =ROUND((R1003C-R4C)/(R1003C3)*RC3,0)+R4C -> 1319 | J280: =ROUND((R1003C-R4C)/(R1003C3)*RC3,0)+R4C -> 713 | K280: =ROUND((R1003C-R4C)/(R1003C3)*RC3,0)+R4C -> 10168 | O280: =RC[-4]-R[-1]C[-4] -> 36 | P280: =RC[-1]-R[-1]C[-1] -> 0
B281: =R[-3]C+1 -> 93 | C281: =R[-1]C+RC[1] -> 277 | D281: 1 | F281: =ROUND((R1003C-R4C)/(R1003C3)*RC3,0)+R4C -> 3293 | G281: =ROUND((R1003C-R4C)/(R1003C3)*RC3,0)+R4C -> 2573 | H281: =ROUND((R1003C-R4C)/(R1003C3)*RC3,0)+R4C -> 7283 | I281: =ROUND((R1003C-R4C)/(R1003C3)*RC3,0)+R4C -> 1323 | J281: =ROUND((R1003C-R4C)/(R1003C3)*RC3,0)+R4C -> 716 | K281: =ROUND((R1003C-R4C)/(R1003C3)*RC3,0)+R4C -> 10204 | O281: =RC[-4]-R[-1]C[-4] -> 36 | P281: =RC[-1]-R[-1]C[-1] -> 0
B282: =R[-3]C+1 -> 93 | C282: =R[-1]C+RC[1] -> 278 | D282: 1 | F282: =ROUND((R1003C-R4C)/(R1003C3)*RC3,0)+R4C -> 3305 | G282: =ROUND((R1003C-R4C)/(R1003C3)*RC3,0)+R4C -> 2583 | H282: =ROUND((R1003C-R4C)/(R1003C3)*RC3,0)+R4C -> 7309 | I282: =ROUND((R1003C-R4C)/(R1003C3)*RC3,0)+R4C -> 1328 | J282: =ROUND((R1003C-R4C)/(R1003C3)*RC3,0)+R4C -> 718 | K282: =ROUND((R1003C-R4C)/(R1003C3)*RC3,0)+R4C -> 10240 | O282: =RC[-4]-R[-1]C[-4] -> 36 | P282: =RC[-1]-R[-1]C[-1] -> 0
B283: =R[-3]C+1 -> 94 | C283: =R[-1]C+RC[1] -> 279 | D283: 1 | F283: =ROUND((R1003C-R4C)/(R1003C3)*RC3,0)+R4C -> 3317 | G283: =ROUND((R1003C-R4C)/(R1003C3)*RC3,0)+R4C -> 2592 | H283: =ROUND((R1003C-R4C)/(R1003C3)*RC3,0)+R4C -> 7335 | I283: =ROUND((R1003C-R4C)/(R1003C3)*RC3,0)+R4C -> 1333 | J283: =ROUND((R1003C-R4C)/(R1003C3)*RC3,0)+R4C -> 721 | K283: =ROUND((R1003C-R4C)/(R1003C3)*RC3,0)+R4C -> 10277 | O283: =RC[-4]-R[-1]C[-4] -> 37 | P283: =RC[-1]-R[-1]C[-1] -> 1
B284: =R[-3]C+1 -> 94 | C284: =R[-1]C+RC[1] -> 280 | D284: 1 | F284: =ROUND((R1003C-R4C)/(R1003C3)*RC3,0)+R4C -> 3328 | G284: =ROUND((R1003C-R4C)/(R1003C3)*RC3,0)+R4C -> 2601 | H284: =ROUND((R1003C-R4C)/(R1003C3)*RC3,0)+R4C -> 7361 | I284: =ROUND((R1003C-R4C)/(R1003C3)*RC3,0)+R4C -> 1337 | J284: =ROUND((R1003C-R4C)/(R1003C3)*RC3,0)+R4C -> 723 | K284: =ROUND((R1003C-R4C)/(R1003C3)*RC3,0)+R4C -> 10313 | O284: =RC[-4]-R[-1]C[-4] -> 36 | P284: =RC[-1]-R[-1]C[-1] -> -1
B285: =R[-3]C+1 -> 94 | C285: =R[-1]C+RC[1] -> 281 | D285: 1 | F285: =ROUND((R1003C-R4C)/(R1003C3)*RC3,0)+R4C -> 3340 | G285: =ROUND((R1003C-R4C)/(R1003C3)*RC3,0)+R4C -> 2610 | H285: =ROUND((R1003C-R4C)/(R1003C3)*RC3,0)+R4C -> 7387 | I285: =ROUND((R1003C-R4C)/(R1003C3)*RC3,0)+R4C -> 1342 | J285: =ROUND((R1003C-R4C)/(R1003C3)*RC3,0)+R4C -> 726 | K285: =ROUND((R1003C-R4C)/(R1003C3)*RC3,0)+R4C -> 10349 | O285: =RC[-4]-R[-1]C[-4] -> 36 | P285: =RC[-1]-R[-1]C[-1] -> 0
B286: =R[-3]C+1 -> 95 | C286: =R[-1]C+RC[1] -> 282 | D286: 1 | F286: =ROUND((R1003C-R4C)/(R1003C3)*RC3,0)+R4C -> 3352 | G286: =ROUND((R1003C-R4C)/(R1003C3)*RC3,0)+R4C -> 2619 | H286: =ROUND((R1003C-R4C)/(R1003C3)*RC3,0)+R4C -> 7413 | I286: =ROUND((R1003C-R4C)/(R1003C3)*RC3,0)+R4C -> 1347 | J286: =ROUND((R1003C-R4C)/(R1003C3)*RC3,0)+R4C -> 728 | K286: =ROUND((R1003C-R4C)/(R1003C3)*RC3,0)+R4C -> 10385 | O286: =RC[-4]-R[-1]C[-4] -> 36 | P286: =RC[-1]-R[-1]C[-1] -> 0
B287: =R[-3]C+1 -> 95 | C287: =R[-1]C+RC[1] -> 283 | D287: 1 | F287: =ROUND((R1003C-R4C)/(R1003C3)*RC3,0)+R4C -> 3363 | G287: =ROUND((R1003C-R4C)/(R1003C3)*RC3,0)+R4C -> 2628 | H287: =ROUND((R1003C-R4C)/(R1003C3)*RC3,0)+R4C -> 7438 | I287: =ROUND((R1003C-R4C)/(R1003C3)*RC3,0)+R4C -> 1351 | J287: =ROUND((R1003C-R4C)/(R1003C3)*RC3,0)+R4C -> 731 | K287: =ROUND((R1003C-R4C)/(R1003C3)*RC3,0)+R4C -> 10421 | O287: =RC[-4]-R[-1]C[-4] -> 36 | P287: =RC[-1]-R[-1]C[-1] -> 0
B288: =R[-3]C+1 -> 95 | C288: =R[-1]C+RC[1] -> 284 | D288: 1 | F288: =ROUND((R1003C-R4C)/(R1003C3)*RC3,0)+R4C -> 3375 | G288: =ROUND((R1003C-R4C)/(R1003C3)*RC3,0)+R4C -> 2637 | H288: =ROUND((R1003C-R4C)/(R1003C3)*RC3,0)+R4C -> 7464 | I288: =ROUND((R1003C-R4C)/(R1003C3)*RC3,0)+R4C -> 1356 | J288: =ROUND((R1003C-R4C)/(R1003C3)*RC3,0)+R4C -> 733 | K288: =ROUND((R1003C-R4C)/(R1003C3)*RC3,0)+R4C -> 10457 | O288: =RC[-4]-R[-1]C[-4] -> 36 | P288: =RC[-1]-R[-1]C[-1] -> 0
B289: =R[-3]C+1 -> 96 | C289: =R[-1]C+RC[1] -> 285 | D289: 1 | F289: =ROUND((R1003C-R4C)/(R1003C3)*RC3,0)+R4C -> 3387 | G289: =ROUND((R1003C-R4C)/(R1003C3)*RC3,0)+R4C -> 2646 | H289: =ROUND((R1003C-R4C)/(R1003C3)*RC3,0)+R4C -> 7490 | I289: =ROUND((R1003C-R4C)/(R1003C3)*RC3,0)+R4C -> 1361 | J289: =ROUND((R1003C-R4C)/(R1003C3)*RC3,0)+R4C -> 736 | K289: =ROUND((R1003C-R4C)/(R1003C3)*RC3,0)+R4C -> 10494 | O289: =RC[-4]-R[-1]C[-4] -> 37 | P289: =RC[-1]-R[-1]C[-1] -> 1
B290: =R[-3]C+1 -> 96 | C290: =R[-1]C+RC[1] -> 286 | D290: 1 | F290: =ROUND((R1003C-R4C)/(R1003C3)*RC3,0)+R4C -> 3399 | G290: =ROUND((R1003C-R4C)/(R1003C3)*RC3,0)+R4C -> 2655 | H290: =ROUND((R1003C-R4C)/(R1003C3)*RC3,0)+R4C -> 7516 | I290: =ROUND((R1003C-R4C)/(R1003C3)*RC3,0)+R4C -> 1366 | J290: =ROUND((R1003C-R4C)/(R1003C3)*RC3,0)+R4C -> 738 | K290: =ROUND((R1003C-R4C)/(R1003C3)*RC3,0)+R4C -> 10530 | O290: =RC[-4]-R[-1]C[-4] -> 36 | P290: =RC[-1]-R[-1]C[-1] -> -1
B291: =R[-3]C+1 -> 96 | C291: =R[-1]C+RC[1] -> 287 | D291: 1 | F291: =ROUND((R1003C-R4C)/(R1003C3)*RC3,0)+R4C -> 3410 | G291: =ROUND((R1003C-R4C)/(R1003C3)*RC3,0)+R4C -> 2665 | H291: =ROUND((R1003C-R4C)/(R1003C3)*RC3,0)+R4C -> 7542 | I291: =ROUND((R1003C-R4C)/(R1003C3)*RC3,0)+R4C -> 1370 | J291: =ROUND((R1003C-R4C)/(R1003C3)*RC3,0)+R4C -> 741 | K291: =ROUND((R1003C-R4C)/(R1003C3)*RC3,0)+R4C -> 10566 | O291: =RC[-4]-R[-1]C[-4] -> 36 | P291: =RC[-1]-R[-1]C[-1] -> 0
B292: =R[-3]C+1 -> 97 | C292: =R[-1]C+RC[1] -> 288 | D292: 1 | F292: =ROUND((R1003C-R4C)/(R1003C3)*RC3,0)+R4C -> 3422 | G292: =ROUND((R1003C-R4C)/(R1003C3)*RC3,0)+R4C -> 2674 | H292: =ROUND((R1003C-R4C)/(R1003C3)*RC3,0)+R4C -> 7568 | I292: =ROUND((R1003C-R4C)/(R1003C3)*RC3,0)+R4C -> 1375 | J292: =ROUND((R1003C-R4C)/(R1003C3)*RC3,0)+R4C -> 744 | K292: =ROUND((R1003C-R4C)/(R1003C3)*RC3,0)+R4C -> 10602 | O292: =RC[-4]-R[-1]C[-4] -> 36 | P292: =RC[-1]-R[-1]C[-1] -> 0
B293: =R[-3]C+1 -> 97 | C293: =R[-1]C+RC[1] -> 289 | D293: 1 | F293: =ROUND((R1003C-R4C)/(R1003C3)*RC3,0)+R4C -> 3434 | G293: =ROUND((R1003C-R4C)/(R1003C3)*RC3,0)+R4C -> 2683 | H293: =ROUND((R1003C-R4C)/(R1003C3)*RC3,0)+R4C -> 7593 | I293: =ROUND((R1003C-R4C)/(R1003C3)*RC3,0)+R4C -> 1380 | J293: =ROUND((R1003C-R4C)/(R1003C3)*RC3,0)+R4C -> 746 | K293: =ROUND((R1003C-R4C)/(R1003C3)*RC3,0)+R4C -> 10638 | O293: =RC[-4]-R[-1]C[-4] -> 36 | P293: =RC[-1]-R[-1]C[-1] -> 0
B294: =R[-3]C+1 -> 97 | C294: =R[-1]C+RC[1] -> 290 | D294: 1 | F294: =ROUND((R1003C-R4C)/(R1003C3)*RC3,0)+R4C -> 3445 | G294: =ROUND((R1003C-R4C)/(R1003C3)*RC3,0)+R4C -> 2692 | H294: =ROUND((R1003C-R4C)/(R1003C3)*RC3,0)+R4C -> 7619 | I294: =ROUND((R1003C-R4C)/(R1003C3)*RC3,0)+R4C -> 1384 | J294: =ROUND((R1003C-R4C)/(R1003C3)*RC3,0)+R4C -> 749 | K294: =ROUND((R1003C-R4C)/(R1003C3)*RC3,0)+R4C -> 10675 | O294: =RC[-4]-R[-1]C[-4] -> 37 | P294: =RC[-1]-R[-1]C[-1] -> 1
B295: =R[-3]C+1 -> 98 | C295: =R[-1]C+RC[1] -> 291 | D295: 1 | F295: =ROUND((R1003C-R4C)/(R1003C3)*RC3,0)+R4C -> 3457 | G295: =ROUND((R1003C-R4C)/(R1003C3)*RC3,0)+R4C -> 2701 | H295: =ROUND((R1003C-R4C)/(R1003C3)*RC3,0)+R4C -> 7645 | I295: =ROUND((R1003C-R4C)/(R1003C3)*RC3,0)+R4C -> 1389 | J295: =ROUND((R1003C-R4C)/(R1003C3)*RC3,0)+R4C -> 751 | K295: =ROUND((R1003C-R4C)/(R1003C3)*RC3,0)+R4C -> 10711 | O295: =RC[-4]-R[-1]C[-4] -> 36 | P295: =RC[-1]-R[-1]C[-1] -> -1
B296: =R[-3]C+1 -> 98 | C296: =R[-1]C+RC[1] -> 292 | D296: 1 | F296: =ROUND((R1003C-R4C)/(R1003C3)*RC3,0)+R4C -> 3469 | G296: =ROUND((R1003C-R4C)/(R1003C3)*RC3,0)+R4C -> 2710 | H296: =ROUND((R1003C-R4C)/(R1003C3)*RC3,0)+R4C -> 7671 | I296: =ROUND((R1003C-R4C)/(R1003C3)*RC3,0)+R4C -> 1394 | J296: =ROUND((R1003C-R4C)/(R1003C3)*RC3,0)+R4C -> 754 | K296: =ROUND((R1003C-R4C)/(R1003C3)*RC3,0)+R4C -> 10747 | O296: =RC[-4]-R[-1]C[-4] -> 36 | P296: =RC[-1]-R[-1]C[-1] -> 0
B297: =R[-3]C+1 -> 98 | C297: =R[-1]C+RC[1] -> 293 | D297: 1 | F297: =ROUND((R1003C-R4C)/(R1003C3)*RC3,0)+R4C -> 3480 | G297: =ROUND((R1003C-R4C)/(R1003C3)*RC3,0)+R4C -> 2719 | H297: =ROUND((R1003C-R4C)/(R1003C3)*RC3,0)+R4C -> 7697 | I297: =ROUND((R1003C-R4C)/(R1003C3)*RC3,0)+R4C -> 1398 | J297: =ROUND((R1003C-R4C)/(R1003C3)*RC3,0)+R4C -> 756 | K297: =ROUND((R1003C-R4C)/(R1003C3)*RC3,0)+R4C -> 10783 | O297: =RC[-4]-R[-1]C[-4] -> 36 | P297: =RC[-1]-R[-1]C[-1] -> 0
B298: =R[-3]C+1 -> 99 | C298: =R[-1]C+RC[1] -> 294 | D298: 1 | F298: =ROUND((R1003C-R4C)/(R1003C3)*RC3,0)+R4C -> 3492 | G298: =ROUND((R1003C-R4C)/(R1003C3)*RC3,0)+R4C -> 2728 | H298: =ROUND((R1003C-R4C)/(R1003C3)*RC3,0)+R4C -> 7722 | I298: =ROUND((R1003C-R4C)/(R1003C3)*RC3,0)+R4C -> 1403 | J298: =ROUND((R1003C-R4C)/(R1003C3)*RC3,0)+R4C -> 759 | K298: =ROUND((R1003C-R4C)/(R1003C3)*RC3,0)+R4C -> 10819 | O298: =RC[-4]-R[-1]C[-4] -> 36 | P298: =RC[-1]-R[-1]C[-1] -> 0
B299: =R[-3]C+1 -> 99 | C299: =R[-1]C+RC[1] -> 295 | D299: 1 | F299: =ROUND((R1003C-R4C)/(R1003C3)*RC3,0)+R4C -> 3504 | G299: =ROUND((R1003C-R4C)/(R1003C3)*RC3,0)+R4C -> 2738 | H299: =ROUND((R1003C-R4C)/(R1003C3)*RC3,0)+R4C -> 7748 | I299: =ROUND((R1003C-R4C)/(R1003C3)*RC3,0)+R4C -> 1408 | J299: =ROUND((R1003C-R4C)/(R1003C3)*RC3,0)+R4C -> 761 | K299: =ROUND((R1003C-R4C)/(R1003C3)*RC3,0)+R4C -> 10855 | O299: =RC[-4]-R[-1]C[-4] -> 36 | P299: =RC[-1]-R[-1]C[-1] -> 0
B300: =R[-3]C+1 -> 99 | C300: =R[-1]C+RC[1] -> 296 | D300: 1 | F300: =ROUND((R1003C-R4C)/(R1003C3)*RC3,0)+R4C -> 3515 | G300: =ROUND((R1003C-R4C)/(R1003C3)*RC3,0)+R4C -> 2747 | H300: =ROUND((R1003C-R4C)/(R1003C3)*RC3,0)+R4C -> 7774 | I300: =ROUND((R1003C-R4C)/(R1003C3)*RC3,0)+R4C -> 1412 | J300: =ROUND((R1003C-R4C)/(R1003C3)*RC3,0)+R4C -> 764 | K300: =ROUND((R1003C-R4C)/(R1003C3)*RC3,0)+R4C -> 10892 | O300: =RC[-4]-R[-1]C[-4] -> 37 | P300: =RC[-1]-R[-1]C[-1] -> 1
B301: =R[-3]C+1 -> 100 | C301: =R[-1]C+RC[1] -> 297 | D301: 1 | F301: =ROUND((R1003C-R4C)/(R1003C3)*RC3,0)+R4C -> 3527 | G301: =ROUND((R1003C-R4C)/(R1003C3)*RC3,0)+R4C -> 2756 | H301: =ROUND((R1003C-R4C)/(R1003C3)*RC3,0)+R4C -> 7800 | I301: =ROUND((R1003C-R4C)/(R1003C3)*RC3,0)+R4C -> 1417 | J301: =ROUND((R1003C-R4C)/(R1003C3)*RC3,0)+R4C -> 766 | K301: =ROUND((R1003C-R4C)/(R1003C3)*RC3,0)+R4C -> 10928 | O301: =RC[-4]-R[-1]C[-4] -> 36 | P301: =RC[-1]-R[-1]C[-1] -> -1
B302: =R[-3]C+1 -> 100 | C302: =R[-1]C+RC[1] -> 298 | D302: 1 | F302: =ROUND((R1003C-R4C)/(R1003C3)*RC3,0)+R4C -> 3539 | G302: =ROUND((R1003C-R4C)/(R1003C3)*RC3,0)+R4C -> 2765 | H302: =ROUND((R1003C-R4C)/(R1003C3)*RC3,0)+R4C -> 7826 | I302: =ROUND((R1003C-R4C)/(R1003C3)*RC3,0)+R4C -> 1422 | J302: =ROUND((R1003C-R4C)/(R1003C3)*RC3,0)+R4C -> 769 | K302: =ROUND((R1003C-R4C)/(R1003C3)*RC3,0)+R4C -> 10964 | O302: =RC[-4]-R[-1]C[-4] -> 36 | P302: =RC[-1]-R[-1]C[-1] -> 0
B303: =R[-3]C+1 -> 100 | C303: =R[-1]C+RC[1] -> 299 | D303: 1 | F303: =ROUND((R1003C-R4C)/(R1003C3)*RC3,0)+R4C -> 3550 | G303: =ROUND((R1003C-R4C)/(R1003C3)*RC3,0)+R4C -> 2774 | H303: =ROUND((R1003C-R4C)/(R1003C3)*RC3,0)+R4C -> 7852 | I303: =ROUND((R1003C-R4C)/(R1003C3)*RC3,0)+R4C -> 1427 | J303: =ROUND((R1003C-R4C)/(R1003C3)*RC3,0)+R4C -> 771 | K303: =ROUND((R1003C-R4C)/(R1003C3)*RC3,0)+R4C -> 11000 | O303: =RC[-4]-R[-1]C[-4] -> 36 | P303: =RC[-1]-R[-1]C[-1] -> 0
B304: =R[-3]C+1 -> 101 | C304: =R[-1]C+RC[1] -> 300 | D304: 1 | F304: =ROUND((R1003C-R4C)/(R1003C3)*RC3,0)+R4C -> 3562 | G304: =ROUND((R1003C-R4C)/(R1003C3)*RC3,0)+R4C -> 2783 | H304: =ROUND((R1003C-R4C)/(R1003C3)*RC3,0)+R4C -> 7877 | I304: =ROUND((R1003C-R4C)/(R1003C3)*RC3,0)+R4C -> 1431 | J304: =ROUND((R1003C-R4C)/(R1003C3)*RC3,0)+R4C -> 774 | K304: =ROUND((R1003C-R4C)/(R1003C3)*RC3,0)+R4C -> 11036 | O304: =RC[-4]-R[-1]C[-4] -> 36 | P304: =RC[-1]-R[-1]C[-1] -> 0
B305: =R[-3]C+1 -> 101 | C305: =R[-1]C+RC[1] -> 301 | D305: 1 | F305: =ROUND((R1003C-R4C)/(R1003C3)*RC3,0)+R4C -> 3574 | G305: =ROUND((R1003C-R4C)/(R1003C3)*RC3,0)+R4C -> 2792 | H305: =ROUND((R1003C-R4C)/(R1003C3)*RC3,0)+R4C -> 7903 | I305: =ROUND((R1003C-R4C)/(R1003C3)*RC3,0)+R4C -> 1436 | J305: =ROUND((R1003C-R4C)/(R1003C3)*RC3,0)+R4C -> 776 | K305: =ROUND((R1003C-R4C)/(R1003C3)*RC3,0)+R4C -> 11073 | O305: =RC[-4]-R[-1]C[-4] -> 37 | P305: =RC[-1]-R[-1]C[-1] -> 1
B306: =R[-3]C+1 -> 101 | C306: =R[-1]C+RC[1] -> 302 | D306: 1 | F306: =ROUND((R1003C-R4C)/(R1003C3)*RC3,0)+R4C -> 3585 | G306: =ROUND((R1003C-R4C)/(R1003C3)*RC3,0)+R4C -> 2801 | H306: =ROUND((R1003C-R4C)/(R1003C3)*RC3,0)+R4C -> 7929 | I306: =ROUND((R1003C-R4C)/(R1003C3)*RC3,0)+R4C -> 1441 | J306: =ROUND((R1003C-R4C)/(R1003C3)*RC3,0)+R4C -> 779 | K306: =ROUND((R1003C-R4C)/(R1003C3)*RC3,0)+R4C -> 11109 | O306: =RC[-4]-R[-1]C[-4] -> 36 | P306: =RC[-1]-R[-1]C[-1] -> -1
B307: =R[-3]C+1 -> 102 | C307: =R[-1]C+RC[1] -> 303 | D307: 1 | F307: =ROUND((R1003C-R4C)/(R1003C3)*RC3,0)+R4C -> 3597 | G307: =ROUND((R1003C-R4C)/(R1003C3)*RC3,0)+R4C -> 2811 | H307: =ROUND((R1003C-R4C)/(R1003C3)*RC3,0)+R4C -> 7955 | I307: =ROUND((R1003C-R4C)/(R1003C3)*RC3,0)+R4C -> 1445 | J307: =ROUND((R1003C-R4C)/(R1003C3)*RC3,0)+R4C -> 782 | K307: =ROUND((R1003C-R4C)/(R1003C3)*RC3,0)+R4C -> 11145 | O307: =RC[-4]-R[-1]C[-4] -> 36 | P307: =RC[-1]-R[-1]C[-1] -> 0
B308: =R[-3]C+1 -> 102 | C308: =R[-1]C+RC[1] -> 304 | D308: 1 | F308: =ROUND((R1003C-R4C)/(R1003C3)*RC3,0)+R4C -> 3609 | G308: =ROUND((R1003C-R4C)/(R1003C3)*RC3,0)+R4C -> 2820 | H308: =ROUND((R1003C-R4C)/(R1003C3)*RC3,0)+R4C -> 7981 | I308: =ROUND((R1003C-R4C)/(R1003C3)*RC3,0)+R4C -> 1450 | J308: =ROUND((R1003C-R4C)/(R1003C3)*RC3,0)+R4C -> 784 | K308: =ROUND((R1003C-R4C)/(R1003C3)*RC3,0)+R4C -> 11181 | O308: =RC[-4]-R[-1]C[-4] -> 36 | P308: =RC[-1]-R[-1]C[-1] -> 0
B309: =R[-3]C+1 -> 102 | C309: =R[-1]C+RC[1] -> 305 | D309: 1 | F309: =ROUND((R1003C-R4C)/(R1003C3)*RC3,0)+R4C -> 3620 | G309: =ROUND((R1003C-R4C)/(R1003C3)*RC3,0)+R4C -> 2829 | H309: =ROUND((R1003C-R4C)/(R1003C3)*RC3,0)+R4C -> 8007 | I309: =ROUND((R1003C-R4C)/(R1003C3)*RC3,0)+R4C -> 1455 | J309: =ROUND((R1003C-R4C)/(R1003C3)*RC3,0)+R4C -> 787 | K309: =ROUND((R1003C-R4C)/(R1003C3)*RC3,0)+R4C -> 11217 | O309: =RC[-4]-R[-1]C[-4] -> 36 | P309: =RC[-1]-R[-1]C[-1] -> 0
B310: =R[-3]C+1 -> 103 | C310: =R[-1]C+RC[1] -> 306 | D310: 1 | F310: =ROUND((R1003C-R4C)/(R1003C3)*RC3,0)+R4C -> 3632 | G310: =ROUND((R1003C-R4C)/(R1003C3)*RC3,0)+R4C -> 2838 | H310: =ROUND((R1003C-R4C)/(R1003C3)*RC3,0)+R4C -> 8032 | I310: =ROUND((R1003C-R4C)/(R1003C3)*RC3,0)+R4C -> 1459 | J310: =ROUND((R1003C-R4C)/(R1003C3)*RC3,0)+R4C -> 789 | K310: =ROUND((R1003C-R4C)/(R1003C3)*RC3,0)+R4C -> 11253 | O310: =RC[-4]-R[-1]C[-4] -> 36 | P310: =RC[-1]-R[-1]C[-1] -> 0
B311: =R[-3]C+1 -> 103 | C311: =R[-1]C+RC[1] -> 307 | D311: 1 | F311: =ROUND((R1003C-R4C)/(R1003C3)*RC3,0)+R4C -> 3644 | G311: =ROUND((R1003C-R4C)/(R1003C3)*RC3,0)+R4C -> 2847 | H311: =ROUND((R1003C-R4C)/(R1003C3)*RC3,0)+R4C -> 8058 | I311: =ROUND((R1003C-R4C)/(R1003C3)*RC3,0)+R4C -> 1464 | J311: =ROUND((R1003C-R4C)/(R1003C3)*RC3,0)+R4C -> 792 | K311: =ROUND((R1003C-R4C)/(R1003C3)*RC3,0)+R4C -> 11290 | O311: =RC[-4]-R[-1]C[-4] -> 37 | P311: =RC[-1]-R[-1]C[-1] -> 1
B312: =R[-3]C+1 -> 103 | C312: =R[-1]C+RC[1] -> 308 | D312: 1 | F312: =ROUND((R1003C-R4C)/(R1003C3)*RC3,0)+R4C -> 3655 | G312: =ROUND((R1003C-R4C)/(R1003C3)*RC3,0)+R4C -> 2856 | H312: =ROUND((R1003C-R4C)/(R1003C3)*RC3,0)+R4C -> 8084 | I312: =ROUND((R1003C-R4C)/(R1003C3)*RC3,0)+R4C -> 1469 | J312: =ROUND((R1003C-R4C)/(R1003C3)*RC3,0)+R4C -> 794 | K312: =ROUND((R1003C-R4C)/(R1003C3)*RC3,0)+R4C -> 11326 | O312: =RC[-4]-R[-1]C[-4] -> 36 | P312: =RC[-1]-R[-1]C[-1] -> -1
B313: =R[-3]C+1 -> 104 | C313: =R[-1]C+RC[1] -> 309 | D313: 1 | F313: =ROUND((R1003C-R4C)/(R1003C3)*RC3,0)+R4C -> 3667 | G313: =ROUND((R1003C-R4C)/(R1003C3)*RC3,0)+R4C -> 2865 | H313: =ROUND((R1003C-R4C)/(R1003C3)*RC3,0)+R4C -> 8110 | I313: =ROUND((R1003C-R4C)/(R1003C3)*RC3,0)+R4C -> 1473 | J313: =ROUND((R1003C-R4C)/(R1003C3)*RC3,0)+R4C -> 797 | K313: =ROUND((R1003C-R4C)/(R1003C3)*RC3,0)+R4C -> 11362 | O313: =RC[-4]-R[-1]C[-4] -> 36 | P313: =RC[-1]-R[-1]C[-1] -> 0
B314: =R[-3]C+1 -> 104 | C314: =R[-1]C+RC[1] -> 310 | D314: 1 | F314: =ROUND((R1003C-R4C)/(R1003C3)*RC3,0)+R4C -> 3679 | G314: =ROUND((R1003C-R4C)/(R1003C3)*RC3,0)+R4C -> 2874 | H314: =ROUND((R1003C-R4C)/(R1003C3)*RC3,0)+R4C -> 8136 | I314: =ROUND((R1003C-R4C)/(R1003C3)*RC3,0)+R4C -> 1478 | J314: =ROUND((R1003C-R4C)/(R1003C3)*RC3,0)+R4C -> 799 | K314: =ROUND((R1003C-R4C)/(R1003C3)*RC3,0)+R4C -> 11398 | O314: =RC[-4]-R[-1]C[-4] -> 36 | P314: =RC[-1]-R[-1]C[-1] -> 0
B315: =R[-3]C+1 -> 104 | C315: =R[-1]C+RC[1] -> 311 | D315: 1 | F315: =ROUND((R1003C-R4C)/(R1003C3)*RC3,0)+R4C -> 3690 | G315: =ROUND((R1003C-R4C)/(R1003C3)*RC3,0)+R4C -> 2884 | H315: =ROUND((R1003C-R4C)/(R1003C3)*RC3,0)+R4C -> 8162 | I315: =ROUND((R1003C-R4C)/(R1003C3)*RC3,0)+R4C -> 1483 | J315: =ROUND((R1003C-R4C)/(R1003C3)*RC3,0)+R4C -> 802 | K315: =ROUND((R1003C-R4C)/(R1003C3)*RC3,0)+R4C -> 11434 | O315: =RC[-4]-R[-1]C[-4] -> 36 | P315: =RC[-1]-R[-1]C[-1] -> 0
B316: =R[-3]C+1 -> 105 | C316: =R[-1]C+RC[1] -> 312 | D316: 1 | F316: =ROUND((R1003C-R4C)/(R1003C3)*RC3,0)+R4C -> 3702 | G316: =ROUND((R1003C-R4C)/(R1003C3)*RC3,0)+R4C -> 2893 | H316: =ROUND((R1003C-R4C)/(R1003C3)*RC3,0)+R4C -> 8187 | I316: =ROUND((R1003C-R4C)/(R1003C3)*RC3,0)+R4C -> 1487 | J316: =ROUND((R1003C-R4C)/(R1003C3)*RC3,0)+R4C -> 804 | K316: =ROUND((R1003C-R4C)/(R1003C3)*RC3,0)+R4C -> 11471 | O316: =RC[-4]-R[-1]C[-4] -> 37 | P316: =RC[-1]-R[-1]C[-1] -> 1
B317: =R[-3]C+1 -> 105 | C317: =R[-1]C+RC[1] -> 313 | D317: 1 | F317: =ROUND((R1003C-R4C)/(R1003C3)*RC3,0)+R4C -> 3714 | G317: =ROUND((R1003C-R4C)/(R1003C3)*RC3,0)+R4C -> 2902 | H317: =ROUND((R1003C-R4C)/(R1003C3)*RC3,0)+R4C -> 8213 | I317: =ROUND((R1003C-R4C)/(R1003C3)*RC3,0)+R4C -> 1492 | J317: =ROUND((R1003C-R4C)/(R1003C3)*RC3,0)+R4C -> 807 | K317: =ROUND((R1003C-R4C)/(R1003C3)*RC3,0)+R4C -> 11507 | O317: =RC[-4]-R[-1]C[-4] -> 36 | P317: =RC[-1]-R[-1]C[-1] -> -1
B318: =R[-3]C+1 -> 105 | C318: =R[-1]C+RC[1] -> 314 | D318: 1 | F318: =ROUND((R1003C-R4C)/(R1003C3)*RC3,0)+R4C -> 3725 | G318: =ROUND((R1003C-R4C)/(R1003C3)*RC3,0)+R4C -> 2911 | H318: =ROUND((R1003C-R4C)/(R1003C3)*RC3,0)+R4C -> 8239 | I318: =ROUND((R1003C-R4C)/(R1003C3)*RC3,0)+R4C -> 1497 | J318: =ROUND((R1003C-R4C)/(R1003C3)*RC3,0)+R4C -> 809 | K318: =ROUND((R1003C-R4C)/(R1003C3)*RC3,0)+R4C -> 11543 | O318: =RC[-4]-R[-1]C[-4] -> 36 | P318: =RC[-1]-R[-1]C[-1] -> 0
B319: =R[-3]C+1 -> 106 | C319: =R[-1]C+RC[1] -> 315 | D319: 1 | F319: =ROUND((R1003C-R4C)/(R1003C3)*RC3,0)+R4C -> 3737 | G319: =ROUND((R1003C-R4C)/(R1003C3)*RC3,0)+R4C -> 2920 | H319: =ROUND((R1003C-R4C)/(R1003C3)*RC3,0)+R4C -> 8265 | I319: =ROUND((R1003C-R4C)/(R1003C3)*RC3,0)+R4C -> 1502 | J319: =ROUND((R1003C-R4C)/(R1003C3)*RC3,0)+R4C -> 812 | K319: =ROUND((R1003C-R4C)/(R1003C3)*RC3,0)+R4C -> 11579 | O319: =RC[-4]-R[-1]C[-4] -> 36 | P319: =RC[-1]-R[-1]C[-1] -> 0
B320: =R[-3]C+1 -> 106 | C320: =R[-1]C+RC[1] -> 316 | D320: 1 | F320: =ROUND((R1003C-R4C)/(R1003C3)*RC3,0)+R4C -> 3749 | G320: =ROUND((R1003C-R4C)/(R1003C3)*RC3,0)+R4C -> 2929 | H320: =ROUND((R1003C-R4C)/(R1003C3)*RC3,0)+R4C -> 8291 | I320: =ROUND((R1003C-R4C)/(R1003C3)*RC3,0)+R4C -> 1506 | J320: =ROUND((R1003C-R4C)/(R1003C3)*RC3,0)+R4C -> 815 | K320: =ROUND((R1003C-R4C)/(R1003C3)*RC3,0)+R4C -> 11615 | O320: =RC[-4]-R[-1]C[-4] -> 36 | P320: =RC[-1]-R[-1]C[-1] -> 0
B321: =R[-3]C+1 -> 106 | C321: =R[-1]C+RC[1] -> 317 | D321: 1 | F321: =ROUND((R1003C-R4C)/(R1003C3)*RC3,0)+R4C -> 3761 | G321: =ROUND((R1003C-R4C)/(R1003C3)*RC3,0)+R4C -> 2938 | H321: =ROUND((R1003C-R4C)/(R1003C3)*RC3,0)+R4C -> 8316 | I321: =ROUND((R1003C-R4C)/(R1003C3)*RC3,0)+R4C -> 1511 | J321: =ROUND((R1003C-R4C)/(R1003C3)*RC3,0)+R4C -> 817 | K321: =ROUND((R1003C-R4C)/(R1003C3)*RC3,0)+R4C -> 11651 | O321: =RC[-4]-R[-1]C[-4] -> 36 | P321: =RC[-1]-R[-1]C[-1] -> 0
B322: =R[-3]C+1 -> 107 | C322: =R[-1]C+RC[1] -> 318 | D322: 1 | F322: =ROUND((R1003C-R4C)/(R1003C3)*RC3,0)+R4C -> 3772 | G322: =ROUND((R1003C-R4C)/(R1003C3)*RC3,0)+R4C -> 2947 | H322: =ROUND((R1003C-R4C)/(R1003C3)*RC3,0)+R4C -> 8342 | I322: =ROUND((R1003C-R4C)/(R1003C3)*RC3,0)+R4C -> 1516 | J322: =ROUND((R1003C-R4C)/(R1003C3)*RC3,0)+R4C -> 820 | K322: =ROUND((R1003C-R4C)/(R1003C3)*RC3,0)+R4C -> 11688 | O322: =RC[-4]-R[-1]C[-4] -> 37 | P322: =RC[-1]-R[-1]C[-1] -> 1
B323: =R[-3]C+1 -> 107 | C323: =R[-1]C+RC[1] -> 319 | D323: 1 | F323: =ROUND((R1003C-R4C)/(R1003C3)*RC3,0)+R4C -> 3784 | G323: =ROUND((R1003C-R4C)/(R1003C3)*RC3,0)+R4C -> 2957 | H323: =ROUND((R1003C-R4C)/(R1003C3)*RC3,0)+R4C -> 8368 | I323: =ROUND((R1003C-R4C)/(R1003C3)*RC3,0)+R4C -> 1520 | J323: =ROUND((R1003C-R4C)/(R1003C3)*RC3,0)+R4C -> 822 | K323: =ROUND((R1003C-R4C)/(R1003C3)*RC3,0)+R4C -> 11724 | O323: =RC[-4]-R[-1]C[-4] -> 36 | P323: =RC[-1]-R[-1]C[-1] -> -1
B324: =R[-3]C+1 -> 107 | C324: =R[-1]C+RC[1] -> 320 | D324: 1 | F324: =ROUND((R1003C-R4C)/(R1003C3)*RC3,0)+R4C -> 3796 | G324: =ROUND((R1003C-R4C)/(R1003C3)*RC3,0)+R4C -> 2966 | H324: =ROUND((R1003C-R4C)/(R1003C3)*RC3,0)+R4C -> 8394 | I324: =ROUND((R1003C-R4C)/(R1003C3)*RC3,0)+R4C -> 1525 | J324: =ROUND((R1003C-R4C)/(R1003C3)*RC3,0)+R4C -> 825 | K324: =ROUND((R1003C-R4C)/(R1003C3)*RC3,0)+R4C -> 11760 | O324: =RC[-4]-R[-1]C[-4] -> 36 | P324: =RC[-1]-R[-1]C[-1] -> 0
B325: =R[-3]C+1 -> 108 | C325: =R[-1]C+RC[1] -> 321 | D325: 1 | F325: =ROUND((R1003C-R4C)/(R1003C3)*RC3,0)+R4C -> 3807 | G325: =ROUND((R1003C-R4C)/(R1003C3)*RC3,0)+R4C -> 2975 | H325: =ROUND((R1003C-R4C)/(R1003C3)*RC3,0)+R4C -> 8420 | I325: =ROUND((R1003C-R4C)/(R1003C3)*RC3,0)+R4C -> 1530 | J325: =ROUND((R1003C-R4C)/(R1003C3)*RC3,0)+R4C -> 827 | K325: =ROUND((R1003C-R4C)/(R1003C3)*RC3,0)+R4C -> 11796 | O325: =RC[-4]-R[-1]C[-4] -> 36 | P325: =RC[-1]-R[-1]C[-1] -> 0
B326: =R[-3]C+1 -> 108 | C326: =R[-1]C+RC[1] -> 322 | D326: 1 | F326: =ROUND((R1003C-R4C)/(R1003C3)*RC3,0)+R4C -> 3819 | G326: =ROUND((R1003C-R4C)/(R1003C3)*RC3,0)+R4C -> 2984 | H326: =ROUND((R1003C-R4C)/(R1003C3)*RC3,0)+R4C -> 8446 | I326: =ROUND((R1003C-R4C)/(R1003C3)*RC3,0)+R4C -> 1534 | J326: =ROUND((R1003C-R4C)/(R1003C3)*RC3,0)+R4C -> 830 | K326: =ROUND((R1003C-R4C)/(R1003C3)*RC3,0)+R4C -> 11832 | O326: =RC[-4]-R[-1]C[-4] -> 36 | P326: =RC[-1]-R[-1]C[-1] -> 0
B327: =R[-3]C+1 -> 108 | C327: =R[-1]C+RC[1] -> 323 | D327: 1 | F327: =ROUND((R1003C-R4C)/(R1003C3)*RC3,0)+R4C -> 3831 | G327: =ROUND((R1003C-R4C)/(R1003C3)*RC3,0)+R4C -> 2993 | H327: =ROUND((R1003C-R4C)/(R1003C3)*RC3,0)+R4C -> 8471 | I327: =ROUND((R1003C-R4C)/(R1003C3)*RC3,0)+R4C -> 1539 | J327: =ROUND((R1003C-R4C)/(R1003C3)*RC3,0)+R4C -> 832 | K327: =ROUND((R1003C-R4C)/(R1003C3)*RC3,0)+R4C -> 11869 | O327: =RC[-4]-R[-1]C[-4] -> 37 | P327: =RC[-1]-R[-1]C[-1] -> 1
B328: =R[-3]C+1 -> 109 | C328: =R[-1]C+RC[1] -> 324 | D328: 1 | F328: =ROUND((R1003C-R4C)/(R1003C3)*RC3,0)+R4C -> 3842 | G328: =ROUND((R1003C-R4C)/(R1003C3)*RC3,0)+R4C -> 3002 | H328: =ROUND((R1003C-R4C)/(R1003C3)*RC3,0)+R4C -> 8497 | I328: =ROUND((R1003C-R4C)/(R1003C3)*RC3,0)+R4C -> 1544 | J328: =ROUND((R1003C-R4C)/(R1003C3)*RC3,0)+R4C -> 835 | K328: =ROUND((R1003C-R4C)/(R1003C3)*RC3,0)+R4C -> 11905 | O328: =RC[-4]-R[-1]C[-4] -> 36 | P328: =RC[-1]-R[-1]C[-1] -> -1
B329: =R[-3]C+1 -> 109 | C329: =R[-1]C+RC[1] -> 325 | D329: 1 | F329: =ROUND((R1003C-R4C)/(R1003C3)*RC3,0)+R4C -> 3854 | G329: =ROUND((R1003C-R4C)/(R1003C3)*RC3,0)+R4C -> 3011 | H329: =ROUND((R1003C-R4C)/(R1003C3)*RC3,0)+R4C -> 8523 | I329: =ROUND((R1003C-R4C)/(R1003C3)*RC3,0)+R4C -> 1548 | J329: =ROUND((R1003C-R4C)/(R1003C3)*RC3,0)+R4C -> 837 | K329: =ROUND((R1003C-R4C)/(R1003C3)*RC3,0)+R4C -> 11941 | O329: =RC[-4]-R[-1]C[-4] -> 36 | P329: =RC[-1]-R[-1]C[-1] -> 0
B330: =R[-3]C+1 -> 109 | C330: =R[-1]C+RC[1] -> 326 | D330: 1 | F330: =ROUND((R1003C-R4C)/(R1003C3)*RC3,0)+R4C -> 3866 | G330: =ROUND((R1003C-R4C)/(R1003C3)*RC3,0)+R4C -> 3020 | H330: =ROUND((R1003C-R4C)/(R1003C3)*RC3,0)+R4C -> 8549 | I330: =ROUND((R1003C-R4C)/(R1003C3)*RC3,0)+R4C -> 1553 | J330: =ROUND((R1003C-R4C)/(R1003C3)*RC3,0)+R4C -> 840 | K330: =ROUND((R1003C-R4C)/(R1003C3)*RC3,0)+R4C -> 11977 | O330: =RC[-4]-R[-1]C[-4] -> 36 | P330: =RC[-1]-R[-1]C[-1] -> 0
B331: =R[-3]C+1 -> 110 | C331: =R[-1]C+RC[1] -> 327 | D331: 1 | F331: =ROUND((R1003C-R4C)/(R1003C3)*RC3,0)+R4C -> 3877 | G331: =ROUND((R1003C-R4C)/(R1003C3)*RC3,0)+R4C -> 3030 | H331: =ROUND((R1003C-R4C)/(R1003C3)*RC3,0)+R4C -> 8575 | I331: =ROUND((R1003C-R4C)/(R1003C3)*RC3,0)+R4C -> 1558 | J331: =ROUND((R1003C-R4C)/(R1003C3)*RC3,0)+R4C -> 842 | K331: =ROUND((R1003C-R4C)/(R1003C3)*RC3,0)+R4C -> 12013 | O331: =RC[-4]-R[-1]C[-4] -> 36 | P331: =RC[-1]-R[-1]C[-1] -> 0
B332: =R[-3]C+1 -> 110 | C332: =R[-1]C+RC[1] -> 328 | D332: 1 | F332: =ROUND((R1003C-R4C)/(R1003C3)*RC3,0)+R4C -> 3889 | G332: =ROUND((R1003C-R4C)/(R1003C3)*RC3,0)+R4C -> 3039 | H332: =ROUND((R1003C-R4C)/(R1003C3)*RC3,0)+R4C -> 8601 | I332: =ROUND((R1003C-R4C)/(R1003C3)*RC3,0)+R4C -> 1563 | J332: =ROUND((R1003C-R4C)/(R1003C3)*RC3,0)+R4C -> 845 | K332: =ROUND((R1003C-R4C)/(R1003C3)*RC3,0)+R4C -> 12049 | O332: =RC[-4]-R[-1]C[-4] -> 36 | P332: =RC[-1]-R[-1]C[-1] -> 0
B333: =R[-3]C+1 -> 110 | C333: =R[-1]C+RC[1] -> 329 | D333: 1 | F333: =ROUND((R1003C-R4C)/(R1003C3)*RC3,0)+R4C -> 3901 | G333: =ROUND((R1003C-R4C)/(R1003C3)*RC3,0)+R4C -> 3048 | H333: =ROUND((R1003C-R4C)/(R1003C3)*RC3,0)+R4C -> 8626 | I333: =ROUND((R1003C-R4C)/(R1003C3)*RC3,0)+R4C -> 1567 | J333: =ROUND((R1003C-R4C)/(R1003C3)*RC3,0)+R4C -> 848 | K333: =ROUND((R1003C-R4C)/(R1003C3)*RC3,0)+R4C -> 12086 | O333: =RC[-4]-R[-1]C[-4] -> 37 | P333: =RC[-1]-R[-1]C[-1] -> 1
B334: =R[-3]C+1 -> 111 | C334: =R[-1]C+RC[1] -> 330 | D334: 1 | F334: =ROUND((R1003C-R4C)/(R1003C3)*RC3,0)+R4C -> 3912 | G334: =ROUND((R1003C-R4C)/(R1003C3)*RC3,0)+R4C -> 3057 | H334: =ROUND((R1003C-R4C)/(R1003C3)*RC3,0)+R4C -> 8652 | I334: =ROUND((R1003C-R4C)/(R1003C3)*RC3,0)+R4C -> 1572 | J334: =ROUND((R1003C-R4C)/(R1003C3)*RC3,0)+R4C -> 850 | K334: =ROUND((R1003C-R4C)/(R1003C3)*RC3,0)+R4C -> 12122 | O334: =RC[-4]-R[-1]C[-4] -> 36 | P334: =RC[-1]-R[-1]C[-1] -> -1
B335: =R[-3]C+1 -> 111 | C335: =R[-1]C+RC[1] -> 331 | D335: 1 | F335: =ROUND((R1003C-R4C)/(R1003C3)*RC3,0)+R4C -> 3924 | G335: =ROUND((R1003C-R4C)/(R1003C3)*RC3,0)+R4C -> 3066 | H335: =ROUND((R1003C-R4C)/(R1003C3)*RC3,0)+R4C -> 8678 | I335: =ROUND((R1003C-R4C)/(R1003C3)*RC3,0)+R4C -> 1577 | J335: =ROUND((R1003C-R4C)/(R1003C3)*RC3,0)+R4C -> 853 | K335: =ROUND((R1003C-R4C)/(R1003C3)*RC3,0)+R4C -> 12158 | O335: =RC[-4]-R[-1]C[-4] -> 36 | P335: =RC[-1]-R[-1]C[-1] -> 0
B336: =R[-3]C+1 -> 111 | C336: =R[-1]C+RC[1] -> 332 | D336: 1 | F336: =ROUND((R1003C-R4C)/(R1003C3)*RC3,0)+R4C -> 3936 | G336: =ROUND((R1003C-R4C)/(R1003C3)*RC3,0)+R4C -> 3075 | H336: =ROUND((R1003C-R4C)/(R1003C3)*RC3,0)+R4C -> 8704 | I336: =ROUND((R1003C-R4C)/(R1003C3)*RC3,0)+R4C -> 1581 | J336: =ROUND((R1003C-R4C)/(R1003C3)*RC3,0)+R4C -> 855 | K336: =ROUND((R1003C-R4C)/(R1003C3)*RC3,0)+R4C -> 12194 | O336: =RC[-4]-R[-1]C[-4] -> 36 | P336: =RC[-1]-R[-1]C[-1] -> 0
B337: =R[-3]C+1 -> 112 | C337: =R[-1]C+RC[1] -> 333 | D337: 1 | F337: =ROUND((R1003C-R4C)/(R1003C3)*RC3,0)+R4C -> 3947 | G337: =ROUND((R1003C-R4C)/(R1003C3)*RC3,0)+R4C -> 3084 | H337: =ROUND((R1003C-R4C)/(R1003C3)*RC3,0)+R4C -> 8730 | I337: =ROUND((R1003C-R4C)/(R1003C3)*RC3,0)+R4C -> 1586 | J337: =ROUND((R1003C-R4C)/(R1003C3)*RC3,0)+R4C -> 858 | K337: =ROUND((R1003C-R4C)/(R1003C3)*RC3,0)+R4C -> 12230 | O337: =RC[-4]-R[-1]C[-4] -> 36 | P337: =RC[-1]-R[-1]C[-1] -> 0
B338: =R[-3]C+1 -> 112 | C338: =R[-1]C+RC[1] -> 334 | D338: 1 | F338: =ROUND((R1003C-R4C)/(R1003C3)*RC3,0)+R4C -> 3959 | G338: =ROUND((R1003C-R4C)/(R1003C3)*RC3,0)+R4C -> 3093 | H338: =ROUND((R1003C-R4C)/(R1003C3)*RC3,0)+R4C -> 8755 | I338: =ROUND((R1003C-R4C)/(R1003C3)*RC3,0)+R4C -> 1591 | J338: =ROUND((R1003C-R4C)/(R1003C3)*RC3,0)+R4C -> 860 | K338: =ROUND((R1003C-R4C)/(R1003C3)*RC3,0)+R4C -> 12267 | O338: =RC[-4]-R[-1]C[-4] -> 37 | P338: =RC[-1]-R[-1]C[-1] -> 1
B339: =R[-3]C+1 -> 112 | C339: =R[-1]C+RC[1] -> 335 | D339: 1 | F339: =ROUND((R1003C-R4C)/(R1003C3)*RC3,0)+R4C -> 3971 | G339: =ROUND((R1003C-R4C)/(R1003C3)*RC3,0)+R4C -> 3103 | H339: =ROUND((R1003C-R4C)/(R1003C3)*RC3,0)+R4C -> 8781 | I339: =ROUND((R1003C-R4C)/(R1003C3)*RC3,0)+R4C -> 1595 | J339: =ROUND((R1003C-R4C)/(R1003C3)*RC3,0)+R4C -> 863 | K339: =ROUND((R1003C-R4C)/(R1003C3)*RC3,0)+R4C -> 12303 | O339: =RC[-4]-R[-1]C[-4] -> 36 | P339: =RC[-1]-R[-1]C[-1] -> -1
B340: =R[-3]C+1 -> 113 | C340: =R[-1]C+RC[1] -> 336 | D340: 1 | F340: =ROUND((R1003C-R4C)/(R1003C3)*RC3,0)+R4C -> 3982 | G340: =ROUND((R1003C-R4C)/(R1003C3)*RC3,0)+R4C -> 3112 | H340: =ROUND((R1003C-R4C)/(R1003C3)*RC3,0)+R4C -> 8807 | I340: =ROUND((R1003C-R4C)/(R1003C3)*RC3,0)+R4C -> 1600 | J340: =ROUND((R1003C-R4C)/(R1003C3)*RC3,0)+R4C -> 865 | K340: =ROUND((R1003C-R4C)/(R1003C3)*RC3,0)+R4C -> 12339 | O340: =RC[-4]-R[-1]C[-4] -> 36 | P340: =RC[-1]-R[-1]C[-1] -> 0
B341: =R[-3]C+1 -> 113 | C341: =R[-1]C+RC[1] -> 337 | D341: 1 | F341: =ROUND((R1003C-R4C)/(R1003C3)*RC3,0)+R4C -> 3994 | G341: =ROUND((R1003C-R4C)/(R1003C3)*RC3,0)+R4C -> 3121 | H341: =ROUND((R1003C-R4C)/(R1003C3)*RC3,0)+R4C -> 8833 | I341: =ROUND((R1003C-R4C)/(R1003C3)*RC3,0)+R4C -> 1605 | J341: =ROUND((R1003C-R4C)/(R1003C3)*RC3,0)+R4C -> 868 | K341: =ROUND((R1003C-R4C)/(R1003C3)*RC3,0)+R4C -> 12375 | O341: =RC[-4]-R[-1]C[-4] -> 36 | P341: =RC[-1]-R[-1]C[-1] -> 0
B342: =R[-3]C+1 -> 113 | C342: =R[-1]C+RC[1] -> 338 | D342: 1 | F342: =ROUND((R1003C-R4C)/(R1003C3)*RC3,0)+R4C -> 4006 | G342: =ROUND((R1003C-R4C)/(R1003C3)*RC3,0)+R4C -> 3130 | H342: =ROUND((R1003C-R4C)/(R1003C3)*RC3,0)+R4C -> 8859 | I342: =ROUND((R1003C-R4C)/(R1003C3)*RC3,0)+R4C -> 1609 | J342: =ROUND((R1003C-R4C)/(R1003C3)*RC3,0)+R4C -> 870 | K342: =ROUND((R1003C-R4C)/(R1003C3)*RC3,0)+R4C -> 12411 | O342: =RC[-4]-R[-1]C[-4] -> 36 | P342: =RC[-1]-R[-1]C[-1] -> 0
B343: =R[-3]C+1 -> 114 | C343: =R[-1]C+RC[1] -> 339 | D343: 1 | F343: =ROUND((R1003C-R4C)/(R1003C3)*RC3,0)+R4C -> 4017 | G343: =ROUND((R1003C-R4C)/(R1003C3)*RC3,0)+R4C -> 3139 | H343: =ROUND((R1003C-R4C)/(R1003C3)*RC3,0)+R4C -> 8885 | I343: =ROUND((R1003C-R4C)/(R1003C3)*RC3,0)+R4C -> 1614 | J343: =ROUND((R1003C-R4C)/(R1003C3)*RC3,0)+R4C -> 873 | K343: =ROUND((R1003C-R4C)/(R1003C3)*RC3,0)+R4C -> 12447 | O343: =RC[-4]-R[-1]C[-4] -> 36 | P343: =RC[-1]-R[-1]C[-1] -> 0
B344: =R[-3]C+1 -> 114 | C344: =R[-1]C+RC[1] -> 340 | D344: 1 | F344: =ROUND((R1003C-R4C)/(R1003C3)*RC3,0)+R4C -> 4029 | G344: =ROUND((R1003C-R4C)/(R1003C3)*RC3,0)+R4C -> 3148 | H344: =ROUND((R1003C-R4C)/(R1003C3)*RC3,0)+R4C -> 8910 | I344: =ROUND((R1003C-R4C)/(R1003C3)*RC3,0)+R4C -> 1619 | J344: =ROUND((R1003C-R4C)/(R1003C3)*RC3,0)+R4C -> 875 | K344: =ROUND((R1003C-R4C)/(R1003C3)*RC3,0)+R4C -> 12484 | O344: =RC[-4]-R[-1]C[-4] -> 37 | P344: =RC[-1]-R[-1]C[-1] -> 1
B345: =R[-3]C+1 -> 114 | C345: =R[-1]C+RC[1] -> 341 | D345: 1 | F345: =ROUND((R1003C-R4C)/(R1003C3)*RC3,0)+R4C -> 4041 | G345: =ROUND((R1003C-R4C)/(R1003C3)*RC3,0)+R4C -> 3157 | H345: =ROUND((R1003C-R4C)/(R1003C3)*RC3,0)+R4C -> 8936 | I345: =ROUND((R1003C-R4C)/(R1003C3)*RC3,0)+R4C -> 1624 | J345: =ROUND((R1003C-R4C)/(R1003C3)*RC3,0)+R4C -> 878 | K345: =ROUND((R1003C-R4C)/(R1003C3)*RC3,0)+R4C -> 12520 | O345: =RC[-4]-R[-1]C[-4] -> 36 | P345: =RC[-1]-R[-1]C[-1] -> -1
B346: =R[-3]C+1 -> 115 | C346: =R[-1]C+RC[1] -> 342 | D346: 1 | F346: =ROUND((R1003C-R4C)/(R1003C3)*RC3,0)+R4C -> 4052 | G346: =ROUND((R1003C-R4C)/(R1003C3)*RC3,0)+R4C -> 3166 | H346: =ROUND((R1003C-R4C)/(R1003C3)*RC3,0)+R4C -> 8962 | I346: =ROUND((R1003C-R4C)/(R1003C3)*RC3,0)+R4C -> 1628 | J346: =ROUND((R1003C-R4C)/(R1003C3)*RC3,0)+R4C -> 880 | K346: =ROUND((R1003C-R4C)/(R1003C3)*RC3,0)+R4C -> 12556 | O346: =RC[-4]-R[-1]C[-4] -> 36 | P346: =RC[-1]-R[-1]C[-1] -> 0
B347: =R[-3]C+1 -> 115 | C347: =R[-1]C+RC[1] -> 343 | D347: 1 | F347: =ROUND((R1003C-R4C)/(R1003C3)*RC3,0)+R4C -> 4064 | G347: =ROUND((R1003C-R4C)/(R1003C3)*RC3,0)+R4C -> 3176 | H347: =ROUND((R1003C-R4C)/(R1003C3)*RC3,0)+R4C -> 8988 | I347: =ROUND((R1003C-R4C)/(R1003C3)*RC3,0)+R4C -> 1633 | J347: =ROUND((R1003C-R4C)/(R1003C3)*RC3,0)+R4C -> 883 | K347: =ROUND((R1003C-R4C)/(R1003C3)*RC3,0)+R4C -> 12592 | O347: =RC[-4]-R[-1]C[-4] -> 36 | P347: =RC[-1]-R[-1]C[-1] -> 0
B348: =R[-3]C+1 -> 115 | C348: =R[-1]C+RC[1] -> 344 | D348: 1 | F348: =ROUND((R1003C-R4C)/(R1003C3)*RC3,0)+R4C -> 4076 | G348: =ROUND((R1003C-R4C)/(R1003C3)*RC3,0)+R4C -> 3185 | H348: =ROUND((R1003C-R4C)/(R1003C3)*RC3,0)+R4C -> 9014 | I348: =ROUND((R1003C-R4C)/(R1003C3)*RC3,0)+R4C -> 1638 | J348: =ROUND((R1003C-R4C)/(R1003C3)*RC3,0)+R4C -> 886 | K348: =ROUND((R1003C-R4C)/(R1003C3)*RC3,0)+R4C -> 12628 | O348: =RC[-4]-R[-1]C[-4] -> 36 | P348: =RC[-1]-R[-1]C[-1] -> 0
B349: =R[-3]C+1 -> 116 | C349: =R[-1]C+RC[1] -> 345 | D349: 1 | F349: =ROUND((R1003C-R4C)/(R1003C3)*RC3,0)+R4C -> 4087 | G349: =ROUND((R1003C-R4C)/(R1003C3)*RC3,0)+R4C -> 3194 | H349: =ROUND((R1003C-R4C)/(R1003C3)*RC3,0)+R4C -> 9040 | I349: =ROUND((R1003C-R4C)/(R1003C3)*RC3,0)+R4C -> 1642 | J349: =ROUND((R1003C-R4C)/(R1003C3)*RC3,0)+R4C -> 888 | K349: =ROUND((R1003C-R4C)/(R1003C3)*RC3,0)+R4C -> 12665 | O349: =RC[-4]-R[-1]C[-4] -> 37 | P349: =RC[-1]-R[-1]C[-1] -> 1
B350: =R[-3]C+1 -> 116 | C350: =R[-1]C+RC[1] -> 346 | D350: 1 | F350: =ROUND((R1003C-R4C)/(R1003C3)*RC3,0)+R4C -> 4099 | G350: =ROUND((R1003C-R4C)/(R1003C3)*RC3,0)+R4C -> 3203 | H350: =ROUND((R1003C-R4C)/(R1003C3)*RC3,0)+R4C -> 9065 | I350: =ROUND((R1003C-R4C)/(R1003C3)*RC3,0)+R4C -> 1647 | J350: =ROUND((R1003C-R4C)/(R1003C3)*RC3,0)+R4C -> 891 | K350: =ROUND((R1003C-R4C)/(R1003C3)*RC3,0)+R4C -> 12701 | O350: =RC[-4]-R[-1]C[-4] -> 36 | P350: =RC[-1]-R[-1]C[-1] -> -1
B351: =R[-3]C+1 -> 116 | C351: =R[-1]C+RC[1] -> 347 | D351: 1 | F351: =ROUND((R1003C-R4C)/(R1003C3)*RC3,0)+R4C -> 4111 | G351: =ROUND((R1003C-R4C)/(R1003C3)*RC3,0)+R4C -> 3212 | H351: =ROUND((R1003C-R4C)/(R1003C3)*RC3,0)+R4C -> 9091 | I351: =ROUND((R1003C-R4C)/(R1003C3)*RC3,0)+R4C -> 1652 | J351: =ROUND((R1003C-R4C)/(R1003C3)*RC3,0)+R4C -> 893 | K351: =ROUND((R1003C-R4C)/(R1003C3)*RC3,0)+R4C -> 12737 | O351: =RC[-4]-R[-1]C[-4] -> 36 | P351: =RC[-1]-R[-1]C[-1] -> 0
B352: =R[-3]C+1 -> 117 | C352: =R[-1]C+RC[1] -> 348 | D352: 1 | F352: =ROUND((R1003C-R4C)/(R1003C3)*RC3,0)+R4C -> 4122 | G352: =ROUND((R1003C-R4C)/(R1003C3)*RC3,0)+R4C -> 3221 | H352: =ROUND((R1003C-R4C)/(R1003C3)*RC3,0)+R4C -> 9117 | I352: =ROUND((R1003C-R4C)/(R1003C3)*RC3,0)+R4C -> 1656 | J352: =ROUND((R1003C-R4C)/(R1003C3)*RC3,0)+R4C -> 896 | K352: =ROUND((R1003C-R4C)/(R1003C3)*RC3,0)+R4C -> 12773 | O352: =RC[-4]-R[-1]C[-4] -> 36 | P352: =RC[-1]-R[-1]C[-1] -> 0
B353: =R[-3]C+1 -> 117 | C353: =R[-1]C+RC[1] -> 349 | D353: 1 | F353: =ROUND((R1003C-R4C)/(R1003C3)*RC3,0)+R4C -> 4134 | G353: =ROUND((R1003C-R4C)/(R1003C3)*RC3,0)+R4C -> 3230 | H353: =ROUND((R1003C-R4C)/(R1003C3)*RC3,0)+R4C -> 9143 | I353: =ROUND((R1003C-R4C)/(R1003C3)*RC3,0)+R4C -> 1661 | J353: =ROUND((R1003C-R4C)/(R1003C3)*RC3,0)+R4C -> 898 | K353: =ROUND((R1003C-R4C)/(R1003C3)*RC3,0)+R4C -> 12809 | O353: =RC[-4]-R[-1]C[-4] -> 36 | P353: =RC[-1]-R[-1]C[-1] -> 0
B354: =R[-3]C+1 -> 117 | C354: =R[-1]C+RC[1] -> 350 | D354: 1 | F354: =ROUND((R1003C-R4C)/(R1003C3)*RC3,0)+R4C -> 4146 | G354: =ROUND((R1003C-R4C)/(R1003C3)*RC3,0)+R4C -> 3239 | H354: =ROUND((R1003C-R4C)/(R1003C3)*RC3,0)+R4C -> 9169 | I354: =ROUND((R1003C-R4C)/(R1003C3)*RC3,0)+R4C -> 1666 | J354: =ROUND((R1003C-R4C)/(R1003C3)*RC3,0)+R4C -> 901 | K354: =ROUND((R1003C-R4C)/(R1003C3)*RC3,0)+R4C -> 12845 | O354: =RC[-4]-R[-1]C[-4] -> 36 | P354: =RC[-1]-R[-1]C[-1] -> 0
B355: =R[-3]C+1 -> 118 | C355: =R[-1]C+RC[1] -> 351 | D355: 1 | F355: =ROUND((R1003C-R4C)/(R1003C3)*RC3,0)+R4C -> 4158 | G355: =ROUND((R1003C-R4C)/(R1003C3)*RC3,0)+R4C -> 3249 | H355: =ROUND((R1003C-R4C)/(R1003C3)*RC3,0)+R4C -> 9195 | I355: =ROUND((R1003C-R4C)/(R1003C3)*RC3,0)+R4C -> 1670 | J355: =ROUND((R1003C-R4C)/(R1003C3)*RC3,0)+R4C -> 903 | K355: =ROUND((R1003C-R4C)/(R1003C3)*RC3,0)+R4C -> 12882 | O355: =RC[-4]-R[-1]C[-4] -> 37 | P355: =RC[-1]-R[-1]C[-1] -> 1
B356: =R[-3]C+1 -> 118 | C356: =R[-1]C+RC[1] -> 352 | D356: 1 | F356: =ROUND((R1003C-R4C)/(R1003C3)*RC3,0)+R4C -> 4169 | G356: =ROUND((R1003C-R4C)/(R1003C3)*RC3,0)+R4C -> 3258 | H356: =ROUND((R1003C-R4C)/(R1003C3)*RC3,0)+R4C -> 9220 | I356: =ROUND((R1003C-R4C)/(R1003C3)*RC3,0)+R4C -> 1675 | J356: =ROUND((R1003C-R4C)/(R1003C3)*RC3,0)+R4C -> 906 | K356: =ROUND((R1003C-R4C)/(R1003C3)*RC3,0)+R4C -> 12918 | O356: =RC[-4]-R[-1]C[-4] -> 36 | P356: =RC[-1]-R[-1]C[-1] -> -1
B357: =R[-3]C+1 -> 118 | C357: =R[-1]C+RC[1] -> 353 | D357: 1 | F357: =ROUND((R1003C-R4C)/(R1003C3)*RC3,0)+R4C -> 4181 | G357: =ROUND((R1003C-R4C)/(R1003C3)*RC3,0)+R4C -> 3267 | H357: =ROUND((R1003C-R4C)/(R1003C3)*RC3,0)+R4C -> 9246 | I357: =ROUND((R1003C-R4C)/(R1003C3)*RC3,0)+R4C -> 1680 | J357: =ROUND((R1003C-R4C)/(R1003C3)*RC3,0)+R4C -> 908 | K357: =ROUND((R1003C-R4C)/(R1003C3)*RC3,0)+R4C -> 12954 | O357: =RC[-4]-R[-1]C[-4] -> 36 | P357: =RC[-1]-R[-1]C[-1] -> 0
B358: =R[-3]C+1 -> 119 | C358: =R[-1]C+RC[1] -> 354 | D358: 1 | F358: =ROUND((R1003C-R4C)/(R1003C3)*RC3,0)+R4C -> 4193 | G358: =ROUND((R1003C-R4C)/(R1003C3)*RC3,0)+R4C -> 3276 | H358: =ROUND((R1003C-R4C)/(R1003C3)*RC3,0)+R4C -> 9272 | I358: =ROUND((R1003C-R4C)/(R1003C3)*RC3,0)+R4C -> 1685 | J358: =ROUND((R1003C-R4C)/(R1003C3)*RC3,0)+R4C -> 911 | K358: =ROUND((R1003C-R4C)/(R1003C3)*RC3,0)+R4C -> 12990 | O358: =RC[-4]-R[-1]C[-4] -> 36 | P358: =RC[-1]-R[-1]C[-1] -> 0
B359: =R[-3]C+1 -> 119 | C359: =R[-1]C+RC[1] -> 355 | D359: 1 | F359: =ROUND((R1003C-R4C)/(R1003C3)*RC3,0)+R4C -> 4204 | G359: =ROUND((R1003C-R4C)/(R1003C3)*RC3,0)+R4C -> 3285 | H359: =ROUND((R1003C-R4C)/(R1003C3)*RC3,0)+R4C -> 9298 | I359: =ROUND((R1003C-R4C)/(R1003C3)*RC3,0)+R4C -> 1689 | J359: =ROUND((R1003C-R4C)/(R1003C3)*RC3,0)+R4C -> 913 | K359: =ROUND((R1003C-R4C)/(R1003C3)*RC3,0)+R4C -> 13026 | O359: =RC[-4]-R[-1]C[-4] -> 36 | P359: =RC[-1]-R[-1]C[-1] -> 0
B360: =R[-3]C+1 -> 119 | C360: =R[-1]C+RC[1] -> 356 | D360: 1 | F360: =ROUND((R1003C-R4C)/(R1003C3)*RC3,0)+R4C -> 4216 | G360: =ROUND((R1003C-R4C)/(R1003C3)*RC3,0)+R4C -> 3294 | H360: =ROUND((R1003C-R4C)/(R1003C3)*RC3,0)+R4C -> 9324 | I360: =ROUND((R1003C-R4C)/(R1003C3)*RC3,0)+R4C -> 1694 | J360: =ROUND((R1003C-R4C)/(R1003C3)*RC3,0)+R4C -> 916 | K360: =ROUND((R1003C-R4C)/(R1003C3)*RC3,0)+R4C -> 13063 | O360: =RC[-4]-R[-1]C[-4] -> 37 | P360: =RC[-1]-R[-1]C[-1] -> 1
B361: =R[-3]C+1 -> 120 | C361: =R[-1]C+RC[1] -> 357 | D361: 1 | F361: =ROUND((R1003C-R4C)/(R1003C3)*RC3,0)+R4C -> 4228 | G361: =ROUND((R1003C-R4C)/(R1003C3)*RC3,0)+R4C -> 3303 | H361: =ROUND((R1003C-R4C)/(R1003C3)*RC3,0)+R4C -> 9349 | I361: =ROUND((R1003C-R4C)/(R1003C3)*RC3,0)+R4C -> 1699 | J361: =ROUND((R1003C-R4C)/(R1003C3)*RC3,0)+R4C -> 919 | K361: =ROUND((R1003C-R4C)/(R1003C3)*RC3,0)+R4C -> 13099 | O361: =RC[-4]-R[-1]C[-4] -> 36 | P361: =RC[-1]-R[-1]C[-1] -> -1
B362: =R[-3]C+1 -> 120 | C362: =R[-1]C+RC[1] -> 358 | D362: 1 | F362: =ROUND((R1003C-R4C)/(R1003C3)*RC3,0)+R4C -> 4239 | G362: =ROUND((R1003C-R4C)/(R1003C3)*RC3,0)+R4C -> 3312 | H362: =ROUND((R1003C-R4C)/(R1003C3)*RC3,0)+R4C -> 9375 | I362: =ROUND((R1003C-R4C)/(R1003C3)*RC3,0)+R4C -> 1703 | J362: =ROUND((R1003C-R4C)/(R1003C3)*RC3,0)+R4C -> 921 | K362: =ROUND((R1003C-R4C)/(R1003C3)*RC3,0)+R4C -> 13135 | O362: =RC[-4]-R[-1]C[-4] -> 36 | P362: =RC[-1]-R[-1]C[-1] -> 0
B363: =R[-3]C+1 -> 120 | C363: =R[-1]C+RC[1] -> 359 | D363: 1 | F363: =ROUND((R1003C-R4C)/(R1003C3)*RC3,0)+R4C -> 4251 | G363: =ROUND((R1003C-R4C)/(R1003C3)*RC3,0)+R4C -> 3322 | H363: =ROUND((R1003C-R4C)/(R1003C3)*RC3,0)+R4C -> 9401 | I363: =ROUND((R1003C-R4C)/(R1003C3)*RC3,0)+R4C -> 1708 | J363: =ROUND((R1003C-R4C)/(R1003C3)*RC3,0)+R4C -> 924 | K363: =ROUND((R1003C-R4C)/(R1003C3)*RC3,0)+R4C -> 13171 | O363: =RC[-4]-R[-1]C[-4] -> 36 | P363: =RC[-1]-R[-1]C[-1] -> 0
B364: =R[-3]C+1 -> 121 | C364: =R[-1]C+RC[1] -> 360 | D364: 1 | F364: =ROUND((R1003C-R4C)/(R1003C3)*RC3,0)+R4C -> 4263 | G364: =ROUND((R1003C-R4C)/(R1003C3)*RC3,0)+R4C -> 3331 | H364: =ROUND((R1003C-R4C)/(R1003C3)*RC3,0)+R4C -> 9427 | I364: =ROUND((R1003C-R4C)/(R1003C3)*RC3,0)+R4C -> 1713 | J364: =ROUND((R1003C-R4C)/(R1003C3)*RC3,0)+R4C -> 926 | K364: =ROUND((R1003C-R4C)/(R1003C3)*RC3,0)+R4C -> 13207 | O364: =RC[-4]-R[-1]C[-4] -> 36 | P364: =RC[-1]-R[-1]C[-1] -> 0
B365: =R[-3]C+1 -> 121 | C365: =R[-1]C+RC[1] -> 361 | D365: 1 | F365: =ROUND((R1003C-R4C)/(R1003C3)*RC3,0)+R4C -> 4274 | G365: =ROUND((R1003C-R4C)/(R1003C3)*RC3,0)+R4C -> 3340 | H365: =ROUND((R1003C-R4C)/(R1003C3)*RC3,0)+R4C -> 9453 | I365: =ROUND((R1003C-R4C)/(R1003C3)*RC3,0)+R4C -> 1717 | J365: =ROUND((R1003C-R4C)/(R1003C3)*RC3,0)+R4C -> 929 | K365: =ROUND((R1003C-R4C)/(R1003C3)*RC3,0)+R4C -> 13243 | O365: =RC[-4]-R[-1]C[-4] -> 36 | P365: =RC[-1]-R[-1]C[-1] -> 0
B366: =R[-3]C+1 -> 121 | C366: =R[-1]C+RC[1] -> 362 | D366: 1 | F366: =ROUND((R1003C-R4C)/(R1003C3)*RC3,0)+R4C -> 4286 | G366: =ROUND((R1003C-R4C)/(R1003C3)*RC3,0)+R4C -> 3349 | H366: =ROUND((R1003C-R4C)/(R1003C3)*RC3,0)+R4C -> 9479 | I366: =ROUND((R1003C-R4C)/(R1003C3)*RC3,0)+R4C -> 1722 | J366: =ROUND((R1003C-R4C)/(R1003C3)*RC3,0)+R4C -> 931 | K366: =ROUND((R1003C-R4C)/(R1003C3)*RC3,0)+R4C -> 13280 | O366: =RC[-4]-R[-1]C[-4] -> 37 | P366: =RC[-1]-R[-1]C[-1] -> 1
B367: =R[-3]C+1 -> 122 | C367: =R[-1]C+RC[1] -> 363 | D367: 1 | F367: =ROUND((R1003C-R4C)/(R1003C3)*RC3,0)+R4C -> 4298 | G367: =ROUND((R1003C-R4C)/(R1003C3)*RC3,0)+R4C -> 3358 | H367: =ROUND((R1003C-R4C)/(R1003C3)*RC3,0)+R4C -> 9504 | I367: =ROUND((R1003C-R4C)/(R1003C3)*RC3,0)+R4C -> 1727 | J367: =ROUND((R1003C-R4C)/(R1003C3)*RC3,0)+R4C -> 934 | K367: =ROUND((R1003C-R4C)/(R1003C3)*RC3,0)+R4C -> 13316 | O367: =RC[-4]-R[-1]C[-4] -> 36 | P367: =RC[-1]-R[-1]C[-1] -> -1
B368: =R[-3]C+1 -> 122 | C368: =R[-1]C+RC[1] -> 364 | D368: 1 | F368: =ROUND((R1003C-R4C)/(R1003C3)*RC3,0)+R4C -> 4309 | G368: =ROUND((R1003C-R4C)/(R1003C3)*RC3,0)+R4C -> 3367 | H368: =ROUND((R1003C-R4C)/(R1003C3)*RC3,0)+R4C -> 9530 | I368: =ROUND((R1003C-R4C)/(R1003C3)*RC3,0)+R4C -> 1731 | J368: =ROUND((R1003C-R4C)/(R1003C3)*RC3,0)+R4C -> 936 | K368: =ROUND((R1003C-R4C)/(R1003C3)*RC3,0)+R4C -> 13352 | O368: =RC[-4]-R[-1]C[-4] -> 36 | P368: =RC[-1]-R[-1]C[-1] -> 0
B369: =R[-3]C+1 -> 122 | C369: =R[-1]C+RC[1] -> 365 | D369: 1 | F369: =ROUND((R1003C-R4C)/(R1003C3)*RC3,0)+R4C -> 4321 | G369: =ROUND((R1003C-R4C)/(R1003C3)*RC3,0)+R4C -> 3376 | H369: =ROUND((R1003C-R4C)/(R1003C3)*RC3,0)+R4C -> 9556 | I369: =ROUND((R1003C-R4C)/(R1003C3)*RC3,0)+R4C -> 1736 | J369: =ROUND((R1003C-R4C)/(R1003C3)*RC3,0)+R4C -> 939 | K369: =ROUND((R1003C-R4C)/(R1003C3)*RC3,0)+R4C -> 13388 | O369: =RC[-4]-R[-1]C[-4] -> 36 | P369: =RC[-1]-R[-1]C[-1] -> 0
B370: =R[-3]C+1 -> 123 | C370: =R[-1]C+RC[1] -> 366 | D370: 1 | F370: =ROUND((R1003C-R4C)/(R1003C3)*RC3,0)+R4C -> 4333 | G370: =ROUND((R1003C-R4C)/(R1003C3)*RC3,0)+R4C -> 3385 | H370: =ROUND((R1003C-R4C)/(R1003C3)*RC3,0)+R4C -> 9582 | I370: =ROUND((R1003C-R4C)/(R1003C3)*RC3,0)+R4C -> 1741 | J370: =ROUND((R1003C-R4C)/(R1003C3)*RC3,0)+R4C -> 941 | K370: =ROUND((R1003C-R4C)/(R1003C3)*RC3,0)+R4C -> 13424 | O370: =RC[-4]-R[-1]C[-4] -> 36 | P370: =RC[-1]-R[-1]C[-1] -> 0
B371: =R[-3]C+1 -> 123 | C371: =R[-1]C+RC[1] -> 367 | D371: 1 | F371: =ROUND((R1003C-R4C)/(R1003C3)*RC3,0)+R4C -> 4344 | G371: =ROUND((R1003C-R4C)/(R1003C3)*RC3,0)+R4C -> 3395 | H371: =ROUND((R1003C-R4C)/(R1003C3)*RC3,0)+R4C -> 9608 | I371: =ROUND((R1003C-R4C)/(R1003C3)*RC3,0)+R4C -> 1745 | J371: =ROUND((R1003C-R4C)/(R1003C3)*RC3,0)+R4C -> 944 | K371: =ROUND((R1003C-R4C)/(R1003C3)*RC3,0)+R4C -> 13460 | O371: =RC[-4]-R[-1]C[-4] -> 36 | P371: =RC[-1]-R[-1]C[-1] -> 0
B372: =R[-3]C+1 -> 123 | C372: =R[-1]C+RC[1] -> 368 | D372: 1 | F372: =ROUND((R1003C-R4C)/(R1003C3)*RC3,0)+R4C -> 4356 | G372: =ROUND((R1003C-R4C)/(R1003C3)*RC3,0)+R4C -> 3404 | H372: =ROUND((R1003C-R4C)/(R1003C3)*RC3,0)+R4C -> 9634 | I372: =ROUND((R1003C-R4C)/(R1003C3)*RC3,0)+R4C -> 1750 | J372: =ROUND((R1003C-R4C)/(R1003C3)*RC3,0)+R4C -> 946 | K372: =ROUND((R1003C-R4C)/(R1003C3)*RC3,0)+R4C -> 13497 | O372: =RC[-4]-R[-1]C[-4] -> 37 | P372: =RC[-1]-R[-1]C[-1] -> 1
B373: =R[-3]C+1 -> 124 | C373: =R[-1]C+RC[1] -> 369 | D373: 1 | F373: =ROUND((R1003C-R4C)/(R1003C3)*RC3,0)+R4C -> 4368 | G373: =ROUND((R1003C-R4C)/(R1003C3)*RC3,0)+R4C -> 3413 | H373: =ROUND((R1003C-R4C)/(R1003C3)*RC3,0)+R4C -> 9659 | I373: =ROUND((R1003C-R4C)/(R1003C3)*RC3,0)+R4C -> 1755 | J373: =ROUND((R1003C-R4C)/(R1003C3)*RC3,0)+R4C -> 949 | K373: =ROUND((R1003C-R4C)/(R1003C3)*RC3,0)+R4C -> 13533 | O373: =RC[-4]-R[-1]C[-4] -> 36 | P373: =RC[-1]-R[-1]C[-1] -> -1
B374: =R[-3]C+1 -> 124 | C374: =R[-1]C+RC[1] -> 370 | D374: 1 | F374: =ROUND((R1003C-R4C)/(R1003C3)*RC3,0)+R4C -> 4379 | G374: =ROUND((R1003C-R4C)/(R1003C3)*RC3,0)+R4C -> 3422 | H374: =ROUND((R1003C-R4C)/(R1003C3)*RC3,0)+R4C -> 9685 | I374: =ROUND((R1003C-R4C)/(R1003C3)*RC3,0)+R4C -> 1760 | J374: =ROUND((R1003C-R4C)/(R1003C3)*RC3,0)+R4C -> 952 | K374: =ROUND((R1003C-R4C)/(R1003C3)*RC3,0)+R4C -> 13569 | O374: =RC[-4]-R[-1]C[-4] -> 36 | P374: =RC[-1]-R[-1]C[-1] -> 0
B375: =R[-3]C+1 -> 124 | C375: =R[-1]C+RC[1] -> 371 | D375: 1 | F375: =ROUND((R1003C-R4C)/(R1003C3)*RC3,0)+R4C -> 4391 | G375: =ROUND((R1003C-R4C)/(R1003C3)*RC3,0)+R4C -> 3431 | H375: =ROUND((R1003C-R4C)/(R1003C3)*RC3,0)+R4C -> 9711 | I375: =ROUND((R1003C-R4C)/(R1003C3)*RC3,0)+R4C -> 1764 | J375: =ROUND((R1003C-R4C)/(R1003C3)*RC3,0)+R4C -> 954 | K375: =ROUND((R1003C-R4C)/(R1003C3)*RC3,0)+R4C -> 13605 | O375: =RC[-4]-R[-1]C[-4] -> 36 | P375: =RC[-1]-R[-1]C[-1] -> 0
B376: =R[-3]C+1 -> 125 | C376: =R[-1]C+RC[1] -> 372 | D376: 1 | F376: =ROUND((R1003C-R4C)/(R1003C3)*RC3,0)+R4C -> 4403 | G376: =ROUND((R1003C-R4C)/(R1003C3)*RC3,0)+R4C -> 3440 | H376: =ROUND((R1003C-R4C)/(R1003C3)*RC3,0)+R4C -> 9737 | I376: =ROUND((R1003C-R4C)/(R1003C3)*RC3,0)+R4C -> 1769 | J376: =ROUND((R1003C-R4C)/(R1003C3)*RC3,0)+R4C -> 957 | K376: =ROUND((R1003C-R4C)/(R1003C3)*RC3,0)+R4C -> 13641 | O376: =RC[-4]-R[-1]C[-4] -> 36 | P376: =RC[-1]-R[-1]C[-1] -> 0
B377: =R[-3]C+1 -> 125 | C377: =R[-1]C+RC[1] -> 373 | D377: 1 | F377: =ROUND((R1003C-R4C)/(R1003C3)*RC3,0)+R4C -> 4414 | G377: =ROUND((R1003C-R4C)/(R1003C3)*RC3,0)+R4C -> 3449 | H377: =ROUND((R1003C-R4C)/(R1003C3)*RC3,0)+R4C -> 9763 | I377: =ROUND((R1003C-R4C)/(R1003C3)*RC3,0)+R4C -> 1774 | J377: =ROUND((R1003C-R4C)/(R1003C3)*RC3,0)+R4C -> 959 | K377: =ROUND((R1003C-R4C)/(R1003C3)*RC3,0)+R4C -> 13678 | O377: =RC[-4]-R[-1]C[-4] -> 37 | P377: =RC[-1]-R[-1]C[-1] -> 1
B378: =R[-3]C+1 -> 125 | C378: =R[-1]C+RC[1] -> 374 | D378: 1 | F378: =ROUND((R1003C-R4C)/(R1003C3)*RC3,0)+R4C -> 4426 | G378: =ROUND((R1003C-R4C)/(R1003C3)*RC3,0)+R4C -> 3458 | H378: =ROUND((R1003C-R4C)/(R1003C3)*RC3,0)+R4C -> 9788 | I378: =ROUND((R1003C-R4C)/(R1003C3)*RC3,0)+R4C -> 1778 | J378: =ROUND((R1003C-R4C)/(R1003C3)*RC3,0)+R4C -> 962 | K378: =ROUND((R1003C-R4C)/(R1003C3)*RC3,0)+R4C -> 13714 | O378: =RC[-4]-R[-1]C[-4] -> 36 | P378: =RC[-1]-R[-1]C[-1] -> -1
B379: =R[-3]C+1 -> 126 | C379: =R[-1]C+RC[1] -> 375 | D379: 1 | F379: =ROUND((R1003C-R4C)/(R1003C3)*RC3,0)+R4C -> 4438 | G379: =ROUND((R1003C-R4C)/(R1003C3)*RC3,0)+R4C -> 3468 | H379: =ROUND((R1003C-R4C)/(R1003C3)*RC3,0)+R4C -> 9814 | I379: =ROUND((R1003C-R4C)/(R1003C3)*RC3,0)+R4C -> 1783 | J379: =ROUND((R1003C-R4C)/(R1003C3)*RC3,0)+R4C -> 964 | K379: =ROUND((R1003C-R4C)/(R1003C3)*RC3,0)+R4C -> 13750 | O379: =RC[-4]-R[-1]C[-4] -> 36 | P379: =RC[-1]-R[-1]C[-1] -> 0
B380: =R[-3]C+1 -> 126 | C380: =R[-1]C+RC[1] -> 376 | D380: 1 | F380: =ROUND((R1003C-R4C)/(R1003C3)*RC3,0)+R4C -> 4449 | G380: =ROUND((R1003C-R4C)/(R1003C3)*RC3,0)+R4C -> 3477 | H380: =ROUND((R1003C-R4C)/(R1003C3)*RC3,0)+R4C -> 9840 | I380: =ROUND((R1003C-R4C)/(R1003C3)*RC3,0)+R4C -> 1788 | J380: =ROUND((R1003C-R4C)/(R1003C3)*RC3,0)+R4C -> 967 | K380: =ROUND((R1003C-R4C)/(R1003C3)*RC3,0)+R4C -> 13786 | O380: =RC[-4]-R[-1]C[-4] -> 36 | P380: =RC[-1]-R[-1]C[-1] -> 0
B381: =R[-3]C+1 -> 126 | C381: =R[-1]C+RC[1] -> 377 | D381: 1 | F381: =ROUND((R1003C-R4C)/(R1003C3)*RC3,0)+R4C -> 4461 | G381: =ROUND((R1003C-R4C)/(R1003C3)*RC3,0)+R4C -> 3486 | H381: =ROUND((R1003C-R4C)/(R1003C3)*RC3,0)+R4C -> 9866 | I381: =ROUND((R1003C-R4C)/(R1003C3)*RC3,0)+R4C -> 1792 | J381: =ROUND((R1003C-R4C)/(R1003C3)*RC3,0)+R4C -> 969 | K381: =ROUND((R1003C-R4C)/(R1003C3)*RC3,0)+R4C -> 13822 | O381: =RC[-4]-R[-1]C[-4] -> 36 | P381: =RC[-1]-R[-1]C[-1] -> 0
B382: =R[-3]C+1 -> 127 | C382: =R[-1]C+RC[1] -> 378 | D382: 1 | F382: =ROUND((R1003C-R4C)/(R1003C3)*RC3,0)+R4C -> 4473 | G382: =ROUND((R1003C-R4C)/(R1003C3)*RC3,0)+R4C -> 3495 | H382: =ROUND((R1003C-R4C)/(R1003C3)*RC3,0)+R4C -> 9892 | I382: =ROUND((R1003C-R4C)/(R1003C3)*RC3,0)+R4C -> 1797 | J382: =ROUND((R1003C-R4C)/(R1003C3)*RC3,0)+R4C -> 972 | K382: =ROUND((R1003C-R4C)/(R1003C3)*RC3,0)+R4C -> 13858 | O382: =RC[-4]-R[-1]C[-4] -> 36 | P382: =RC[-1]-R[-1]C[-1] -> 0
B383: =R[-3]C+1 -> 127 | C383: =R[-1]C+RC[1] -> 379 | D383: 1 | F383: =ROUND((R1003C-R4C)/(R1003C3)*RC3,0)+R4C -> 4484 | G383: =ROUND((R1003C-R4C)/(R1003C3)*RC3,0)+R4C -> 3504 | H383: =ROUND((R1003C-R4C)/(R1003C3)*RC3,0)+R4C -> 9918 | I383: =ROUND((R1003C-R4C)/(R1003C3)*RC3,0)+R4C -> 1802 | J383: =ROUND((R1003C-R4C)/(R1003C3)*RC3,0)+R4C -> 974 | K383: =ROUND((R1003C-R4C)/(R1003C3)*RC3,0)+R4C -> 13895 | O383: =RC[-4]-R[-1]C[-4] -> 37 | P383: =RC[-1]-R[-1]C[-1] -> 1
B384: =R[-3]C+1 -> 127 | C384: =R[-1]C+RC[1] -> 380 | D384: 1 | F384: =ROUND((R1003C-R4C)/(R1003C3)*RC3,0)+R4C -> 4496 | G384: =ROUND((R1003C-R4C)/(R1003C3)*RC3,0)+R4C -> 3513 | H384: =ROUND((R1003C-R4C)/(R1003C3)*RC3,0)+R4C -> 9943 | I384: =ROUND((R1003C-R4C)/(R1003C3)*RC3,0)+R4C -> 1806 | J384: =ROUND((R1003C-R4C)/(R1003C3)*RC3,0)+R4C -> 977 | K384: =ROUND((R1003C-R4C)/(R1003C3)*RC3,0)+R4C -> 13931 | O384: =RC[-4]-R[-1]C[-4] -> 36 | P384: =RC[-1]-R[-1]C[-1] -> -1
B385: =R[-3]C+1 -> 128 | C385: =R[-1]C+RC[1] -> 381 | D385: 1 | F385: =ROUND((R1003C-R4C)/(R1003C3)*RC3,0)+R4C -> 4508 | G385: =ROUND((R1003C-R4C)/(R1003C3)*RC3,0)+R4C -> 3522 | H385: =ROUND((R1003C-R4C)/(R1003C3)*RC3,0)+R4C -> 9969 | I385: =ROUND((R1003C-R4C)/(R1003C3)*RC3,0)+R4C -> 1811 | J385: =ROUND((R1003C-R4C)/(R1003C3)*RC3,0)+R4C -> 979 | K385: =ROUND((R1003C-R4C)/(R1003C3)*RC3,0)+R4C -> 13967 | O385: =RC[-4]-R[-1]C[-4] -> 36 | P385: =RC[-1]-R[-1]C[-1] -> 0
B386: =R[-3]C+1 -> 128 | C386: =R[-1]C+RC[1] -> 382 | D386: 1 | F386: =ROUND((R1003C-R4C)/(R1003C3)*RC3,0)+R4C -> 4519 | G386: =ROUND((R1003C-R4C)/(R1003C3)*RC3,0)+R4C -> 3531 | H386: =ROUND((R1003C-R4C)/(R1003C3)*RC3,0)+R4C -> 9995 | I386: =ROUND((R1003C-R4C)/(R1003C3)*RC3,0)+R4C -> 1816 | J386: =ROUND((R1003C-R4C)/(R1003C3)*RC3,0)+R4C -> 982 | K386: =ROUND((R1003C-R4C)/(R1003C3)*RC3,0)+R4C -> 14003 | O386: =RC[-4]-R[-1]C[-4] -> 36 | P386: =RC[-1]-R[-1]C[-1] -> 0
B387: =R[-3]C+1 -> 128 | C387: =R[-1]C+RC[1] -> 383 | D387: 1 | F387: =ROUND((R1003C-R4C)/(R1003C3)*RC3,0)+R4C -> 4531 | G387: =ROUND((R1003C-R4C)/(R1003C3)*RC3,0)+R4C -> 3541 | H387: =ROUND((R1003C-R4C)/(R1003C3)*RC3,0)+R4C -> 10021 | I387: =ROUND((R1003C-R4C)/(R1003C3)*RC3,0)+R4C -> 1821 | J387: =ROUND((R1003C-R4C)/(R1003C3)*RC3,0)+R4C -> 984 | K387: =ROUND((R1003C-R4C)/(R1003C3)*RC3,0)+R4C -> 14039 | O387: =RC[-4]-R[-1]C[-4] -> 36 | P387: =RC[-1]-R[-1]C[-1] -> 0
B388: =R[-3]C+1 -> 129 | C388: =R[-1]C+RC[1] -> 384 | D388: 1 | F388: =ROUND((R1003C-R4C)/(R1003C3)*RC3,0)+R4C -> 4543 | G388: =ROUND((R1003C-R4C)/(R1003C3)*RC3,0)+R4C -> 3550 | H388: =ROUND((R1003C-R4C)/(R1003C3)*RC3,0)+R4C -> 10047 | I388: =ROUND((R1003C-R4C)/(R1003C3)*RC3,0)+R4C -> 1825 | J388: =ROUND((R1003C-R4C)/(R1003C3)*RC3,0)+R4C -> 987 | K388: =ROUND((R1003C-R4C)/(R1003C3)*RC3,0)+R4C -> 14076 | O388: =RC[-4]-R[-1]C[-4] -> 37 | P388: =RC[-1]-R[-1]C[-1] -> 1
B389: =R[-3]C+1 -> 129 | C389: =R[-1]C+RC[1] -> 385 | D389: 1 | F389: =ROUND((R1003C-R4C)/(R1003C3)*RC3,0)+R4C -> 4555 | G389: =ROUND((R1003C-R4C)/(R1003C3)*RC3,0)+R4C -> 3559 | H389: =ROUND((R1003C-R4C)/(R1003C3)*RC3,0)+R4C -> 10073 | I389: =ROUND((R1003C-R4C)/(R1003C3)*RC3,0)+R4C -> 1830 | J389: =ROUND((R1003C-R4C)/(R1003C3)*RC3,0)+R4C -> 990 | K389: =ROUND((R1003C-R4C)/(R1003C3)*RC3,0)+R4C -> 14112 | O389: =RC[-4]-R[-1]C[-4] -> 36 | P389: =RC[-1]-R[-1]C[-1] -> -1
B390: =R[-3]C+1 -> 129 | C390: =R[-1]C+RC[1] -> 386 | D390: 1 | F390: =ROUND((R1003C-R4C)/(R1003C3)*RC3,0)+R4C -> 4566 | G390: =ROUND((R1003C-R4C)/(R1003C3)*RC3,0)+R4C -> 3568 | H390: =ROUND((R1003C-R4C)/(R1003C3)*RC3,0)+R4C -> 10098 | I390: =ROUND((R1003C-R4C)/(R1003C3)*RC3,0)+R4C -> 1835 | J390: =ROUND((R1003C-R4C)/(R1003C3)*RC3,0)+R4C -> 992 | K390: =ROUND((R1003C-R4C)/(R1003C3)*RC3,0)+R4C -> 14148 | O390: =RC[-4]-R[-1]C[-4] -> 36 | P390: =RC[-1]-R[-1]C[-1] -> 0
B391: =R[-3]C+1 -> 130 | C391: =R[-1]C+RC[1] -> 387 | D391: 1 | F391: =ROUND((R1003C-R4C)/(R1003C3)*RC3,0)+R4C -> 4578 | G391: =ROUND((R1003C-R4C)/(R1003C3)*RC3,0)+R4C -> 3577 | H391: =ROUND((R1003C-R4C)/(R1003C3)*RC3,0)+R4C -> 10124 | I391: =ROUND((R1003C-R4C)/(R1003C3)*RC3,0)+R4C -> 1839 | J391: =ROUND((R1003C-R4C)/(R1003C3)*RC3,0)+R4C -> 995 | K391: =ROUND((R1003C-R4C)/(R1003C3)*RC3,0)+R4C -> 14184 | O391: =RC[-4]-R[-1]C[-4] -> 36 | P391: =RC[-1]-R[-1]C[-1] -> 0
B392: =R[-3]C+1 -> 130 | C392: =R[-1]C+RC[1] -> 388 | D392: 1 | F392: =ROUND((R1003C-R4C)/(R1003C3)*RC3,0)+R4C -> 4590 | G392: =ROUND((R1003C-R4C)/(R1003C3)*RC3,0)+R4C -> 3586 | H392: =ROUND((R1003C-R4C)/(R1003C3)*RC3,0)+R4C -> 10150 | I392: =ROUND((R1003C-R4C)/(R1003C3)*RC3,0)+R4C -> 1844 | J392: =ROUND((R1003C-R4C)/(R1003C3)*RC3,0)+R4C -> 997 | K392: =ROUND((R1003C-R4C)/(R1003C3)*RC3,0)+R4C -> 14220 | O392: =RC[-4]-R[-1]C[-4] -> 36 | P392: =RC[-1]-R[-1]C[-1] -> 0
B393: =R[-3]C+1 -> 130 | C393: =R[-1]C+RC[1] -> 389 | D393: 1 | F393: =ROUND((R1003C-R4C)/(R1003C3)*RC3,0)+R4C -> 4601 | G393: =ROUND((R1003C-R4C)/(R1003C3)*RC3,0)+R4C -> 3595 | H393: =ROUND((R1003C-R4C)/(R1003C3)*RC3,0)+R4C -> 10176 | I393: =ROUND((R1003C-R4C)/(R1003C3)*RC3,0)+R4C -> 1849 | J393: =ROUND((R1003C-R4C)/(R1003C3)*RC3,0)+R4C -> 1000 | K393: =ROUND((R1003C-R4C)/(R1003C3)*RC3,0)+R4C -> 14256 | O393: =RC[-4]-R[-1]C[-4] -> 36 | P393: =RC[-1]-R[-1]C[-1] -> 0
B394: =R[-3]C+1 -> 131 | C394: =R[-1]C+RC[1] -> 390 | D394: 1 | F394: =ROUND((R1003C-R4C)/(R1003C3)*RC3,0)+R4C -> 4613 | G394: =ROUND((R1003C-R4C)/(R1003C3)*RC3,0)+R4C -> 3604 | H394: =ROUND((R1003C-R4C)/(R1003C3)*RC3,0)+R4C -> 10202 | I394: =ROUND((R1003C-R4C)/(R1003C3)*RC3,0)+R4C -> 1853 | J394: =ROUND((R1003C-R4C)/(R1003C3)*RC3,0)+R4C -> 1002 | K394: =ROUND((R1003C-R4C)/(R1003C3)*RC3,0)+R4C -> 14293 | O394: =RC[-4]-R[-1]C[-4] -> 37 | P394: =RC[-1]-R[-1]C[-1] -> 1
B395: =R[-3]C+1 -> 131 | C395: =R[-1]C+RC[1] -> 391 | D395: 1 | F395: =ROUND((R1003C-R4C)/(R1003C3)*RC3,0)+R4C -> 4625 | G395: =ROUND((R1003C-R4C)/(R1003C3)*RC3,0)+R4C -> 3614 | H395: =ROUND((R1003C-R4C)/(R1003C3)*RC3,0)+R4C -> 10228 | I395: =ROUND((R1003C-R4C)/(R1003C3)*RC3,0)+R4C -> 1858 | J395: =ROUND((R1003C-R4C)/(R1003C3)*RC3,0)+R4C -> 1005 | K395: =ROUND((R1003C-R4C)/(R1003C3)*RC3,0)+R4C -> 14329 | O395: =RC[-4]-R[-1]C[-4] -> 36 | P395: =RC[-1]-R[-1]C[-1] -> -1
B396: =R[-3]C+1 -> 131 | C396: =R[-1]C+RC[1] -> 392 | D396: 1 | F396: =ROUND((R1003C-R4C)/(R1003C3)*RC3,0)+R4C -> 4636 | G396: =ROUND((R1003C-R4C)/(R1003C3)*RC3,0)+R4C -> 3623 | H396: =ROUND((R1003C-R4C)/(R1003C3)*RC3,0)+R4C -> 10253 | I396: =ROUND((R1003C-R4C)/(R1003C3)*RC3,0)+R4C -> 1863 | J396: =ROUND((R1003C-R4C)/(R1003C3)*RC3,0)+R4C -> 1007 | K396: =ROUND((R1003C-R4C)/(R1003C3)*RC3,0)+R4C -> 14365 | O396: =RC[-4]-R[-1]C[-4] -> 36 | P396: =RC[-1]-R[-1]C[-1] -> 0
B397: =R[-3]C+1 -> 132 | C397: =R[-1]C+RC[1] -> 393 | D397: 1 | F397: =ROUND((R1003C-R4C)/(R1003C3)*RC3,0)+R4C -> 4648 | G397: =ROUND((R1003C-R4C)/(R1003C3)*RC3,0)+R4C -> 3632 | H397: =ROUND((R1003C-R4C)/(R1003C3)*RC3,0)+R4C -> 10279 | I397: =ROUND((R1003C-R4C)/(R1003C3)*RC3,0)+R4C -> 1867 | J397: =ROUND((R1003C-R4C)/(R1003C3)*RC3,0)+R4C -> 1010 | K397: =ROUND((R1003C-R4C)/(R1003C3)*RC3,0)+R4C -> 14401 | O397: =RC[-4]-R[-1]C[-4] -> 36 | P397: =RC[-1]-R[-1]C[-1] -> 0
B398: =R[-3]C+1 -> 132 | C398: =R[-1]C+RC[1] -> 394 | D398: 1 | F398: =ROUND((R1003C-R4C)/(R1003C3)*RC3,0)+R4C -> 4660 | G398: =ROUND((R1003C-R4C)/(R1003C3)*RC3,0)+R4C -> 3641 | H398: =ROUND((R1003C-R4C)/(R1003C3)*RC3,0)+R4C -> 10305 | I398: =ROUND((R1003C-R4C)/(R1003C3)*RC3,0)+R4C -> 1872 | J398: =ROUND((R1003C-R4C)/(R1003C3)*RC3,0)+R4C -> 1012 | K398: =ROUND((R1003C-R4C)/(R1003C3)*RC3,0)+R4C -> 14437 | O398: =RC[-4]-R[-1]C[-4] -> 36 | P398: =RC[-1]-R[-1]C[-1] -> 0
B399: =R[-3]C+1 -> 132 | C399: =R[-1]C+RC[1] -> 395 | D399: 1 | F399: =ROUND((R1003C-R4C)/(R1003C3)*RC3,0)+R4C -> 4671 | G399: =ROUND((R1003C-R4C)/(R1003C3)*RC3,0)+R4C -> 3650 | H399: =ROUND((R1003C-R4C)/(R1003C3)*RC3,0)+R4C -> 10331 | I399: =ROUND((R1003C-R4C)/(R1003C3)*RC3,0)+R4C -> 1877 | J399: =ROUND((R1003C-R4C)/(R1003C3)*RC3,0)+R4C -> 1015 | K399: =ROUND((R1003C-R4C)/(R1003C3)*RC3,0)+R4C -> 14474 | O399: =RC[-4]-R[-1]C[-4] -> 37 | P399: =RC[-1]-R[-1]C[-1] -> 1
B400: =R[-3]C+1 -> 133 | C400: =R[-1]C+RC[1] -> 396 | D400: 1 | F400: =ROUND((R1003C-R4C)/(R1003C3)*RC3,0)+R4C -> 4683 | G400: =ROUND((R1003C-R4C)/(R1003C3)*RC3,0)+R4C -> 3659 | H400: =ROUND((R1003C-R4C)/(R1003C3)*RC3,0)+R4C -> 10357 | I400: =ROUND((R1003C-R4C)/(R1003C3)*RC3,0)+R4C -> 1882 | J400: =ROUND((R1003C-R4C)/(R1003C3)*RC3,0)+R4C -> 1017 | K400: =ROUND((R1003C-R4C)/(R1003C3)*RC3,0)+R4C -> 14510 | O400: =RC[-4]-R[-1]C[-4] -> 36 | P400: =RC[-1]-R[-1]C[-1] -> -1
B401: =R[-3]C+1 -> 133 | C401: =R[-1]C+RC[1] -> 397 | D401: 1 | F401: =ROUND((R1003C-R4C)/(R1003C3)*RC3,0)+R4C -> 4695 | G401: =ROUND((R1003C-R4C)/(R1003C3)*RC3,0)+R4C -> 3668 | H401: =ROUND((R1003C-R4C)/(R1003C3)*RC3,0)+R4C -> 10382 | I401: =ROUND((R1003C-R4C)/(R1003C3)*RC3,0)+R4C -> 1886 | J401: =ROUND((R1003C-R4C)/(R1003C3)*RC3,0)+R4C -> 1020 | K401: =ROUND((R1003C-R4C)/(R1003C3)*RC3,0)+R4C -> 14546 | O401: =RC[-4]-R[-1]C[-4] -> 36 | P401: =RC[-1]-R[-1]C[-1] -> 0
B402: =R[-3]C+1 -> 133 | C402: =R[-1]C+RC[1] -> 398 | D402: 1 | F402: =ROUND((R1003C-R4C)/(R1003C3)*RC3,0)+R4C -> 4706 | G402: =ROUND((R1003C-R4C)/(R1003C3)*RC3,0)+R4C -> 3677 | H402: =ROUND((R1003C-R4C)/(R1003C3)*RC3,0)+R4C -> 10408 | I402: =ROUND((R1003C-R4C)/(R1003C3)*RC3,0)+R4C -> 1891 | J402: =ROUND((R1003C-R4C)/(R1003C3)*RC3,0)+R4C -> 1023 | K402: =ROUND((R1003C-R4C)/(R1003C3)*RC3,0)+R4C -> 14582 | O402: =RC[-4]-R[-1]C[-4] -> 36 | P402: =RC[-1]-R[-1]C[-1] -> 0
B403: =R[-3]C+1 -> 134 | C403: =R[-1]C+RC[1] -> 399 | D403: 1 | F403: =ROUND((R1003C-R4C)/(R1003C3)*RC3,0)+R4C -> 4718 | G403: =ROUND((R1003C-R4C)/(R1003C3)*RC3,0)+R4C -> 3687 | H403: =ROUND((R1003C-R4C)/(R1003C3)*RC3,0)+R4C -> 10434 | I403: =ROUND((R1003C-R4C)/(R1003C3)*RC3,0)+R4C -> 1896 | J403: =ROUND((R1003C-R4C)/(R1003C3)*RC3,0)+R4C -> 1025 | K403: =ROUND((R1003C-R4C)/(R1003C3)*RC3,0)+R4C -> 14618 | O403: =RC[-4]-R[-1]C[-4] -> 36 | P403: =RC[-1]-R[-1]C[-1] -> 0
B404: =R[-3]C+1 -> 134 | C404: =R[-1]C+RC[1] -> 400 | D404: 1 | F404: =ROUND((R1003C-R4C)/(R1003C3)*RC3,0)+R4C -> 4730 | G404: =ROUND((R1003C-R4C)/(R1003C3)*RC3,0)+R4C -> 3696 | H404: =ROUND((R1003C-R4C)/(R1003C3)*RC3,0)+R4C -> 10460 | I404: =ROUND((R1003C-R4C)/(R1003C3)*RC3,0)+R4C -> 1900 | J404: =ROUND((R1003C-R4C)/(R1003C3)*RC3,0)+R4C -> 1028 | K404: =ROUND((R1003C-R4C)/(R1003C3)*RC3,0)+R4C -> 14654 | O404: =RC[-4]-R[-1]C[-4] -> 36 | P404: =RC[-1]-R[-1]C[-1] -> 0
B405: =R[-3]C+1 -> 134 | C405: =R[-1]C+RC[1] -> 401 | D405: 1 | F405: =ROUND((R1003C-R4C)/(R1003C3)*RC3,0)+R4C -> 4741 | G405: =ROUND((R1003C-R4C)/(R1003C3)*RC3,0)+R4C -> 3705 | H405: =ROUND((R1003C-R4C)/(R1003C3)*RC3,0)+R4C -> 10486 | I405: =ROUND((R1003C-R4C)/(R1003C3)*RC3,0)+R4C -> 1905 | J405: =ROUND((R1003C-R4C)/(R1003C3)*RC3,0)+R4C -> 1030 | K405: =ROUND((R1003C-R4C)/(R1003C3)*RC3,0)+R4C -> 14691 | O405: =RC[-4]-R[-1]C[-4] -> 37 | P405: =RC[-1]-R[-1]C[-1] -> 1
B406: =R[-3]C+1 -> 135 | C406: =R[-1]C+RC[1] -> 402 | D406: 1 | F406: =ROUND((R1003C-R4C)/(R1003C3)*RC3,0)+R4C -> 4753 | G406: =ROUND((R1003C-R4C)/(R1003C3)*RC3,0)+R4C -> 3714 | H406: =ROUND((R1003C-R4C)/(R1003C3)*RC3,0)+R4C -> 10512 | I406: =ROUND((R1003C-R4C)/(R1003C3)*RC3,0)+R4C -> 1910 | J406: =ROUND((R1003C-R4C)/(R1003C3)*RC3,0)+R4C -> 1033 | K406: =ROUND((R1003C-R4C)/(R1003C3)*RC3,0)+R4C -> 14727 | O406: =RC[-4]-R[-1]C[-4] -> 36 | P406: =RC[-1]-R[-1]C[-1] -> -1
B407: =R[-3]C+1 -> 135 | C407: =R[-1]C+RC[1] -> 403 | D407: 1 | F407: =ROUND((R1003C-R4C)/(R1003C3)*RC3,0)+R4C -> 4765 | G407: =ROUND((R1003C-R4C)/(R1003C3)*RC3,0)+R4C -> 3723 | H407: =ROUND((R1003C-R4C)/(R1003C3)*RC3,0)+R4C -> 10537 | I407: =ROUND((R1003C-R4C)/(R1003C3)*RC3,0)+R4C -> 1914 | J407: =ROUND((R1003C-R4C)/(R1003C3)*RC3,0)+R4C -> 1035 | K407: =ROUND((R1003C-R4C)/(R1003C3)*RC3,0)+R4C -> 14763 | O407: =RC[-4]-R[-1]C[-4] -> 36 | P407: =RC[-1]-R[-1]C[-1] -> 0
B408: =R[-3]C+1 -> 135 | C408: =R[-1]C+RC[1] -> 404 | D408: 1 | F408: =ROUND((R1003C-R4C)/(R1003C3)*RC3,0)+R4C -> 4776 | G408: =ROUND((R1003C-R4C)/(R1003C3)*RC3,0)+R4C -> 3732 | H408: =ROUND((R1003C-R4C)/(R1003C3)*RC3,0)+R4C -> 10563 | I408: =ROUND((R1003C-R4C)/(R1003C3)*RC3,0)+R4C -> 1919 | J408: =ROUND((R1003C-R4C)/(R1003C3)*RC3,0)+R4C -> 1038 | K408: =ROUND((R1003C-R4C)/(R1003C3)*RC3,0)+R4C -> 14799 | O408: =RC[-4]-R[-1]C[-4] -> 36 | P408: =RC[-1]-R[-1]C[-1] -> 0
B409: =R[-3]C+1 -> 136 | C409: =R[-1]C+RC[1] -> 405 | D409: 1 | F409: =ROUND((R1003C-R4C)/(R1003C3)*RC3,0)+R4C -> 4788 | G409: =ROUND((R1003C-R4C)/(R1003C3)*RC3,0)+R4C -> 3741 | H409: =ROUND((R1003C-R4C)/(R1003C3)*RC3,0)+R4C -> 10589 | I409: =ROUND((R1003C-R4C)/(R1003C3)*RC3,0)+R4C -> 1924 | J409: =ROUND((R1003C-R4C)/(R1003C3)*RC3,0)+R4C -> 1040 | K409: =ROUND((R1003C-R4C)/(R1003C3)*RC3,0)+R4C -> 14835 | O409: =RC[-4]-R[-1]C[-4] -> 36 | P409: =RC[-1]-R[-1]C[-1] -> 0
B410: =R[-3]C+1 -> 136 | C410: =R[-1]C+RC[1] -> 406 | D410: 1 | F410: =ROUND((R1003C-R4C)/(R1003C3)*RC3,0)+R4C -> 4800 | G410: =ROUND((R1003C-R4C)/(R1003C3)*RC3,0)+R4C -> 3750 | H410: =ROUND((R1003C-R4C)/(R1003C3)*RC3,0)+R4C -> 10615 | I410: =ROUND((R1003C-R4C)/(R1003C3)*RC3,0)+R4C -> 1928 | J410: =ROUND((R1003C-R4C)/(R1003C3)*RC3,0)+R4C -> 1043 | K410: =ROUND((R1003C-R4C)/(R1003C3)*RC3,0)+R4C -> 14872 | O410: =RC[-4]-R[-1]C[-4] -> 37 | P410: =RC[-1]-R[-1]C[-1] -> 1
B411: =R[-3]C+1 -> 136 | C411: =R[-1]C+RC[1] -> 407 | D411: 1 | F411: =ROUND((R1003C-R4C)/(R1003C3)*RC3,0)+R4C -> 4811 | G411: =ROUND((R1003C-R4C)/(R1003C3)*RC3,0)+R4C -> 3760 | H411: =ROUND((R1003C-R4C)/(R1003C3)*RC3,0)+R4C -> 10641 | I411: =ROUND((R1003C-R4C)/(R1003C3)*RC3,0)+R4C -> 1933 | J411: =ROUND((R1003C-R4C)/(R1003C3)*RC3,0)+R4C -> 1045 | K411: =ROUND((R1003C-R4C)/(R1003C3)*RC3,0)+R4C -> 14908 | O411: =RC[-4]-R[-1]C[-4] -> 36 | P411: =RC[-1]-R[-1]C[-1] -> -1
B412: =R[-3]C+1 -> 137 | C412: =R[-1]C+RC[1] -> 408 | D412: 1 | F412: =ROUND((R1003C-R4C)/(R1003C3)*RC3,0)+R4C -> 4823 | G412: =ROUND((R1003C-R4C)/(R1003C3)*RC3,0)+R4C -> 3769 | H412: =ROUND((R1003C-R4C)/(R1003C3)*RC3,0)+R4C -> 10667 | I412: =ROUND((R1003C-R4C)/(R1003C3)*RC3,0)+R4C -> 1938 | J412: =ROUND((R1003C-R4C)/(R1003C3)*RC3,0)+R4C -> 1048 | K412: =ROUND((R1003C-R4C)/(R1003C3)*RC3,0)+R4C -> 14944 | O412: =RC[-4]-R[-1]C[-4] -> 36 | P412: =RC[-1]-R[-1]C[-1] -> 0
B413: =R[-3]C+1 -> 137 | C413: =R[-1]C+RC[1] -> 409 | D413: 1 | F413: =ROUND((R1003C-R4C)/(R1003C3)*RC3,0)+R4C -> 4835 | G413: =ROUND((R1003C-R4C)/(R1003C3)*RC3,0)+R4C -> 3778 | H413: =ROUND((R1003C-R4C)/(R1003C3)*RC3,0)+R4C -> 10692 | I413: =ROUND((R1003C-R4C)/(R1003C3)*RC3,0)+R4C -> 1942 | J413: =ROUND((R1003C-R4C)/(R1003C3)*RC3,0)+R4C -> 1050 | K413: =ROUND((R1003C-R4C)/(R1003C3)*RC3,0)+R4C -> 14980 | O413: =RC[-4]-R[-1]C[-4] -> 36 | P413: =RC[-1]-R[-1]C[-1] -> 0
B414: =R[-3]C+1 -> 137 | C414: =R[-1]C+RC[1] -> 410 | D414: 1 | F414: =ROUND((R1003C-R4C)/(R1003C3)*RC3,0)+R4C -> 4846 | G414: =ROUND((R1003C-R4C)/(R1003C3)*RC3,0)+R4C -> 3787 | H414: =ROUND((R1003C-R4C)/(R1003C3)*RC3,0)+R4C -> 10718 | I414: =ROUND((R1003C-R4C)/(R1003C3)*RC3,0)+R4C -> 1947 | J414: =ROUND((R1003C-R4C)/(R1003C3)*RC3,0)+R4C -> 1053 | K414: =ROUND((R1003C-R4C)/(R1003C3)*RC3,0)+R4C -> 15016 | O414: =RC[-4]-R[-1]C[-4] -> 36 | P414: =RC[-1]-R[-1]C[-1] -> 0
B415: =R[-3]C+1 -> 138 | C415: =R[-1]C+RC[1] -> 411 | D415: 1 | F415: =ROUND((R1003C-R4C)/(R1003C3)*RC3,0)+R4C -> 4858 | G415: =ROUND((R1003C-R4C)/(R1003C3)*RC3,0)+R4C -> 3796 | H415: =ROUND((R1003C-R4C)/(R1003C3)*RC3,0)+R4C -> 10744 | I415: =ROUND((R1003C-R4C)/(R1003C3)*RC3,0)+R4C -> 1952 | J415: =ROUND((R1003C-R4C)/(R1003C3)*RC3,0)+R4C -> 1056 | K415: =ROUND((R1003C-R4C)/(R1003C3)*RC3,0)+R4C -> 15052 | O415: =RC[-4]-R[-1]C[-4] -> 36 | P415: =RC[-1]-R[-1]C[-1] -> 0
B416: =R[-3]C+1 -> 138 | C416: =R[-1]C+RC[1] -> 412 | D416: 1 | F416: =ROUND((R1003C-R4C)/(R1003C3)*RC3,0)+R4C -> 4870 | G416: =ROUND((R1003C-R4C)/(R1003C3)*RC3,0)+R4C -> 3805 | H416: =ROUND((R1003C-R4C)/(R1003C3)*RC3,0)+R4C -> 10770 | I416: =ROUND((R1003C-R4C)/(R1003C3)*RC3,0)+R4C -> 1957 | J416: =ROUND((R1003C-R4C)/(R1003C3)*RC3,0)+R4C -> 1058 | K416: =ROUND((R1003C-R4C)/(R1003C3)*RC3,0)+R4C -> 15089 | O416: =RC[-4]-R[-1]C[-4] -> 37 | P416: =RC[-1]-R[-1]C[-1] -> 1
B417: =R[-3]C+1 -> 138 | C417: =R[-1]C+RC[1] -> 413 | D417: 1 | F417: =ROUND((R1003C-R4C)/(R1003C3)*RC3,0)+R4C -> 4881 | G417: =ROUND((R1003C-R4C)/(R1003C3)*RC3,0)+R4C -> 3814 | H417: =ROUND((R1003C-R4C)/(R1003C3)*RC3,0)+R4C -> 10796 | I417: =ROUND((R1003C-R4C)/(R1003C3)*RC3,0)+R4C -> 1961 | J417: =ROUND((R1003C-R4C)/(R1003C3)*RC3,0)+R4C -> 1061 | K417: =ROUND((R1003C-R4C)/(R1003C3)*RC3,0)+R4C -> 15125 | O417: =RC[-4]-R[-1]C[-4] -> 36 | P417: =RC[-1]-R[-1]C[-1] -> -1
B418: =R[-3]C+1 -> 139 | C418: =R[-1]C+RC[1] -> 414 | D418: 1 | F418: =ROUND((R1003C-R4C)/(R1003C3)*RC3,0)+R4C -> 4893 | G418: =ROUND((R1003C-R4C)/(R1003C3)*RC3,0)+R4C -> 3823 | H418: =ROUND((R1003C-R4C)/(R1003C3)*RC3,0)+R4C -> 10821 | I418: =ROUND((R1003C-R4C)/(R1003C3)*RC3,0)+R4C -> 1966 | J418: =ROUND((R1003C-R4C)/(R1003C3)*RC3,0)+R4C -> 1063 | K418: =ROUND((R1003C-R4C)/(R1003C3)*RC3,0)+R4C -> 15161 | O418: =RC[-4]-R[-1]C[-4] -> 36 | P418: =RC[-1]-R[-1]C[-1] -> 0
B419: =R[-3]C+1 -> 139 | C419: =R[-1]C+RC[1] -> 415 | D419: 1 | F419: =ROUND((R1003C-R4C)/(R1003C3)*RC3,0)+R4C -> 4905 | G419: =ROUND((R1003C-R4C)/(R1003C3)*RC3,0)+R4C -> 3833 | H419: =ROUND((R1003C-R4C)/(R1003C3)*RC3,0)+R4C -> 10847 | I419: =ROUND((R1003C-R4C)/(R1003C3)*RC3,0)+R4C -> 1971 | J419: =ROUND((R1003C-R4C)/(R1003C3)*RC3,0)+R4C -> 1066 | K419: =ROUND((R1003C-R4C)/(R1003C3)*RC3,0)+R4C -> 15197 | O419: =RC[-4]-R[-1]C[-4] -> 36 | P419: =RC[-1]-R[-1]C[-1] -> 0
B420: =R[-3]C+1 -> 139 | C420: =R[-1]C+RC[1] -> 416 | D420: 1 | F420: =ROUND((R1003C-R4C)/(R1003C3)*RC3,0)+R4C -> 4916 | G420: =ROUND((R1003C-R4C)/(R1003C3)*RC3,0)+R4C -> 3842 | H420: =ROUND((R1003C-R4C)/(R1003C3)*RC3,0)+R4C -> 10873 | I420: =ROUND((R1003C-R4C)/(R1003C3)*RC3,0)+R4C -> 1975 | J420: =ROUND((R1003C-R4C)/(R1003C3)*RC3,0)+R4C -> 1068 | K420: =ROUND((R1003C-R4C)/(R1003C3)*RC3,0)+R4C -> 15233 | O420: =RC[-4]-R[-1]C[-4] -> 36 | P420: =RC[-1]-R[-1]C[-1] -> 0
B421: =R[-3]C+1 -> 140 | C421: =R[-1]C+RC[1] -> 417 | D421: 1 | F421: =ROUND((R1003C-R4C)/(R1003C3)*RC3,0)+R4C -> 4928 | G421: =ROUND((R1003C-R4C)/(R1003C3)*RC3,0)+R4C -> 3851 | H421: =ROUND((R1003C-R4C)/(R1003C3)*RC3,0)+R4C -> 10899 | I421: =ROUND((R1003C-R4C)/(R1003C3)*RC3,0)+R4C -> 1980 | J421: =ROUND((R1003C-R4C)/(R1003C3)*RC3,0)+R4C -> 1071 | K421: =ROUND((R1003C-R4C)/(R1003C3)*RC3,0)+R4C -> 15270 | O421: =RC[-4]-R[-1]C[-4] -> 37 | P421: =RC[-1]-R[-1]C[-1] -> 1
B422: =R[-3]C+1 -> 140 | C422: =R[-1]C+RC[1] -> 418 | D422: 1 | F422: =ROUND((R1003C-R4C)/(R1003C3)*RC3,0)+R4C -> 4940 | G422: =ROUND((R1003C-R4C)/(R1003C3)*RC3,0)+R4C -> 3860 | H422: =ROUND((R1003C-R4C)/(R1003C3)*RC3,0)+R4C -> 10925 | I422: =ROUND((R1003C-R4C)/(R1003C3)*RC3,0)+R4C -> 1985 | J422: =ROUND((R1003C-R4C)/(R1003C3)*RC3,0)+R4C -> 1073 | K422: =ROUND((R1003C-R4C)/(R1003C3)*RC3,0)+R4C -> 15306 | O422: =RC[-4]-R[-1]C[-4] -> 36 | P422: =RC[-1]-R[-1]C[-1] -> -1
B423: =R[-3]C+1 -> 140 | C423: =R[-1]C+RC[1] -> 419 | D423: 1 | F423: =ROUND((R1003C-R4C)/(R1003C3)*RC3,0)+R4C -> 4952 | G423: =ROUND((R1003C-R4C)/(R1003C3)*RC3,0)+R4C -> 3869 | H423: =ROUND((R1003C-R4C)/(R1003C3)*RC3,0)+R4C -> 10951 | I423: =ROUND((R1003C-R4C)/(R1003C3)*RC3,0)+R4C -> 1989 | J423: =ROUND((R1003C-R4C)/(R1003C3)*RC3,0)+R4C -> 1076 | K423: =ROUND((R1003C-R4C)/(R1003C3)*RC3,0)+R4C -> 15342 | O423: =RC[-4]-R[-1]C[-4] -> 36 | P423: =RC[-1]-R[-1]C[-1] -> 0
B424: =R[-3]C+1 -> 141 | C424: =R[-1]C+RC[1] -> 420 | D424: 1 | F424: =ROUND((R1003C-R4C)/(R1003C3)*RC3,0)+R4C -> 4963 | G424: =ROUND((R1003C-R4C)/(R1003C3)*RC3,0)+R4C -> 3878 | H424: =ROUND((R1003C-R4C)/(R1003C3)*RC3,0)+R4C -> 10976 | I424: =ROUND((R1003C-R4C)/(R1003C3)*RC3,0)+R4C -> 1994 | J424: =ROUND((R1003C-R4C)/(R1003C3)*RC3,0)+R4C -> 1078 | K424: =ROUND((R1003C-R4C)/(R1003C3)*RC3,0)+R4C -> 15378 | O424: =RC[-4]-R[-1]C[-4] -> 36 | P424: =RC[-1]-R[-1]C[-1] -> 0
B425: =R[-3]C+1 -> 141 | C425: =R[-1]C+RC[1] -> 421 | D425: 1 | F425: =ROUND((R1003C-R4C)/(R1003C3)*RC3,0)+R4C -> 4975 | G425: =ROUND((R1003C-R4C)/(R1003C3)*RC3,0)+R4C -> 3887 | H425: =ROUND((R1003C-R4C)/(R1003C3)*RC3,0)+R4C -> 11002 | I425: =ROUND((R1003C-R4C)/(R1003C3)*RC3,0)+R4C -> 1999 | J425: =ROUND((R1003C-R4C)/(R1003C3)*RC3,0)+R4C -> 1081 | K425: =ROUND((R1003C-R4C)/(R1003C3)*RC3,0)+R4C -> 15414 | O425: =RC[-4]-R[-1]C[-4] -> 36 | P425: =RC[-1]-R[-1]C[-1] -> 0
B426: =R[-3]C+1 -> 141 | C426: =R[-1]C+RC[1] -> 422 | D426: 1 | F426: =ROUND((R1003C-R4C)/(R1003C3)*RC3,0)+R4C -> 4987 | G426: =ROUND((R1003C-R4C)/(R1003C3)*RC3,0)+R4C -> 3896 | H426: =ROUND((R1003C-R4C)/(R1003C3)*RC3,0)+R4C -> 11028 | I426: =ROUND((R1003C-R4C)/(R1003C3)*RC3,0)+R4C -> 2003 | J426: =ROUND((R1003C-R4C)/(R1003C3)*RC3,0)+R4C -> 1083 | K426: =ROUND((R1003C-R4C)/(R1003C3)*RC3,0)+R4C -> 15450 | O426: =RC[-4]-R[-1]C[-4] -> 36 | P426: =RC[-1]-R[-1]C[-1] -> 0
B427: =R[-3]C+1 -> 142 | C427: =R[-1]C+RC[1] -> 423 | D427: 1 | F427: =ROUND((R1003C-R4C)/(R1003C3)*RC3,0)+R4C -> 4998 | G427: =ROUND((R1003C-R4C)/(R1003C3)*RC3,0)+R4C -> 3906 | H427: =ROUND((R1003C-R4C)/(R1003C3)*RC3,0)+R4C -> 11054 | I427: =ROUND((R1003C-R4C)/(R1003C3)*RC3,0)+R4C -> 2008 | J427: =ROUND((R1003C-R4C)/(R1003C3)*RC3,0)+R4C -> 1086 | K427: =ROUND((R1003C-R4C)/(R1003C3)*RC3,0)+R4C -> 15487 | O427: =RC[-4]-R[-1]C[-4] -> 37 | P427: =RC[-1]-R[-1]C[-1] -> 1
B428: =R[-3]C+1 -> 142 | C428: =R[-1]C+RC[1] -> 424 | D428: 1 | F428: =ROUND((R1003C-R4C)/(R1003C3)*RC3,0)+R4C -> 5010 | G428: =ROUND((R1003C-R4C)/(R1003C3)*RC3,0)+R4C -> 3915 | H428: =ROUND((R1003C-R4C)/(R1003C3)*RC3,0)+R4C -> 11080 | I428: =ROUND((R1003C-R4C)/(R1003C3)*RC3,0)+R4C -> 2013 | J428: =ROUND((R1003C-R4C)/(R1003C3)*RC3,0)+R4C -> 1088 | K428: =ROUND((R1003C-R4C)/(R1003C3)*RC3,0)+R4C -> 15523 | O428: =RC[-4]-R[-1]C[-4] -> 36 | P428: =RC[-1]-R[-1]C[-1] -> -1
B429: =R[-3]C+1 -> 142 | C429: =R[-1]C+RC[1] -> 425 | D429: 1 | F429: =ROUND((R1003C-R4C)/(R1003C3)*RC3,0)+R4C -> 5022 | G429: =ROUND((R1003C-R4C)/(R1003C3)*RC3,0)+R4C -> 3924 | H429: =ROUND((R1003C-R4C)/(R1003C3)*RC3,0)+R4C -> 11106 | I429: =ROUND((R1003C-R4C)/(R1003C3)*RC3,0)+R4C -> 2018 | J429: =ROUND((R1003C-R4C)/(R1003C3)*RC3,0)+R4C -> 1091 | K429: =ROUND((R1003C-R4C)/(R1003C3)*RC3,0)+R4C -> 15559 | O429: =RC[-4]-R[-1]C[-4] -> 36 | P429: =RC[-1]-R[-1]C[-1] -> 0
B430: =R[-3]C+1 -> 143 | C430: =R[-1]C+RC[1] -> 426 | D430: 1 | F430: =ROUND((R1003C-R4C)/(R1003C3)*RC3,0)+R4C -> 5033 | G430: =ROUND((R1003C-R4C)/(R1003C3)*RC3,0)+R4C -> 3933 | H430: =ROUND((R1003C-R4C)/(R1003C3)*RC3,0)+R4C -> 11131 | I430: =ROUND((R1003C-R4C)/(R1003C3)*RC3,0)+R4C -> 2022 | J430: =ROUND((R1003C-R4C)/(R1003C3)*RC3,0)+R4C -> 1094 | K430: =ROUND((R1003C-R4C)/(R1003C3)*RC3,0)+R4C -> 15595 | O430: =RC[-4]-R[-1]C[-4] -> 36 | P430: =RC[-1]-R[-1]C[-1] -> 0
B431: =R[-3]C+1 -> 143 | C431: =R[-1]C+RC[1] -> 427 | D431: 1 | F431: =ROUND((R1003C-R4C)/(R1003C3)*RC3,0)+R4C -> 5045 | G431: =ROUND((R1003C-R4C)/(R1003C3)*RC3,0)+R4C -> 3942 | H431: =ROUND((R1003C-R4C)/(R1003C3)*RC3,0)+R4C -> 11157 | I431: =ROUND((R1003C-R4C)/(R1003C3)*RC3,0)+R4C -> 2027 | J431: =ROUND((R1003C-R4C)/(R1003C3)*RC3,0)+R4C -> 1096 | K431: =ROUND((R1003C-R4C)/(R1003C3)*RC3,0)+R4C -> 15631 | O431: =RC[-4]-R[-1]C[-4] -> 36 | P431: =RC[-1]-R[-1]C[-1] -> 0
B432: =R[-3]C+1 -> 143 | C432: =R[-1]C+RC[1] -> 428 | D432: 1 | F432: =ROUND((R1003C-R4C)/(R1003C3)*RC3,0)+R4C -> 5057 | G432: =ROUND((R1003C-R4C)/(R1003C3)*RC3,0)+R4C -> 3951 | H432: =ROUND((R1003C-R4C)/(R1003C3)*RC3,0)+R4C -> 11183 | I432: =ROUND((R1003C-R4C)/(R1003C3)*RC3,0)+R4C -> 2032 | J432: =ROUND((R1003C-R4C)/(R1003C3)*RC3,0)+R4C -> 1099 | K432: =ROUND((R1003C-R4C)/(R1003C3)*RC3,0)+R4C -> 15668 | O432: =RC[-4]-R[-1]C[-4] -> 37 | P432: =RC[-1]-R[-1]C[-1] -> 1
B433: =R[-3]C+1 -> 144 | C433: =R[-1]C+RC[1] -> 429 | D433: 1 | F433: =ROUND((R1003C-R4C)/(R1003C3)*RC3,0)+R4C -> 5068 | G433: =ROUND((R1003C-R4C)/(R1003C3)*RC3,0)+R4C -> 3960 | H433: =ROUND((R1003C-R4C)/(R1003C3)*RC3,0)+R4C -> 11209 | I433: =ROUND((R1003C-R4C)/(R1003C3)*RC3,0)+R4C -> 2036 | J433: =ROUND((R1003C-R4C)/(R1003C3)*RC3,0)+R4C -> 1101 | K433: =ROUND((R1003C-R4C)/(R1003C3)*RC3,0)+R4C -> 15704 | O433: =RC[-4]-R[-1]C[-4] -> 36 | P433: =RC[-1]-R[-1]C[-1] -> -1
B434: =R[-3]C+1 -> 144 | C434: =R[-1]C+RC[1] -> 430 | D434: 1 | F434: =ROUND((R1003C-R4C)/(R1003C3)*RC3,0)+R4C -> 5080 | G434: =ROUND((R1003C-R4C)/(R1003C3)*RC3,0)+R4C -> 3969 | H434: =ROUND((R1003C-R4C)/(R1003C3)*RC3,0)+R4C -> 11235 | I434: =ROUND((R1003C-R4C)/(R1003C3)*RC3,0)+R4C -> 2041 | J434: =ROUND((R1003C-R4C)/(R1003C3)*RC3,0)+R4C -> 1104 | K434: =ROUND((R1003C-R4C)/(R1003C3)*RC3,0)+R4C -> 15740 | O434: =RC[-4]-R[-1]C[-4] -> 36 | P434: =RC[-1]-R[-1]C[-1] -> 0
B435: =R[-3]C+1 -> 144 | C435: =R[-1]C+RC[1] -> 431 | D435: 1 | F435: =ROUND((R1003C-R4C)/(R1003C3)*RC3,0)+R4C -> 5092 | G435: =ROUND((R1003C-R4C)/(R1003C3)*RC3,0)+R4C -> 3978 | H435: =ROUND((R1003C-R4C)/(R1003C3)*RC3,0)+R4C -> 11260 | I435: =ROUND((R1003C-R4C)/(R1003C3)*RC3,0)+R4C -> 2046 | J435: =ROUND((R1003C-R4C)/(R1003C3)*RC3,0)+R4C -> 1106 | K435: =ROUND((R1003C-R4C)/(R1003C3)*RC3,0)+R4C -> 15776 | O435: =RC[-4]-R[-1]C[-4] -> 36 | P435: =RC[-1]-R[-1]C[-1] -> 0
B436: =R[-3]C+1 -> 145 | C436: =R[-1]C+RC[1] -> 432 | D436: 1 | F436: =ROUND((R1003C-R4C)/(R1003C3)*RC3,0)+R4C -> 5103 | G436: =ROUND((R1003C-R4C)/(R1003C3)*RC3,0)+R4C -> 3988 | H436: =ROUND((R1003C-R4C)/(R1003C3)*RC3,0)+R4C -> 11286 | I436: =ROUND((R1003C-R4C)/(R1003C3)*RC3,0)+R4C -> 2050 | J436: =ROUND((R1003C-R4C)/(R1003C3)*RC3,0)+R4C -> 1109 | K436: =ROUND((R1003C-R4C)/(R1003C3)*RC3,0)+R4C -> 15812 | O436: =RC[-4]-R[-1]C[-4] -> 36 | P436: =RC[-1]-R[-1]C[-1] -> 0
B437: =R[-3]C+1 -> 145 | C437: =R[-1]C+RC[1] -> 433 | D437: 1 | F437: =ROUND((R1003C-R4C)/(R1003C3)*RC3,0)+R4C -> 5115 | G437: =ROUND((R1003C-R4C)/(R1003C3)*RC3,0)+R4C -> 3997 | H437: =ROUND((R1003C-R4C)/(R1003C3)*RC3,0)+R4C -> 11312 | I437: =ROUND((R1003C-R4C)/(R1003C3)*RC3,0)+R4C -> 2055 | J437: =ROUND((R1003C-R4C)/(R1003C3)*RC3,0)+R4C -> 1111 | K437: =ROUND((R1003C-R4C)/(R1003C3)*RC3,0)+R4C -> 15848 | O437: =RC[-4]-R[-1]C[-4] -> 36 | P437: =RC[-1]-R[-1]C[-1] -> 0
B438: =R[-3]C+1 -> 145 | C438: =R[-1]C+RC[1] -> 434 | D438: 1 | F438: =ROUND((R1003C-R4C)/(R1003C3)*RC3,0)+R4C -> 5127 | G438: =ROUND((R1003C-R4C)/(R1003C3)*RC3,0)+R4C -> 4006 | H438: =ROUND((R1003C-R4C)/(R1003C3)*RC3,0)+R4C -> 11338 | I438: =ROUND((R1003C-R4C)/(R1003C3)*RC3,0)+R4C -> 2060 | J438: =ROUND((R1003C-R4C)/(R1003C3)*RC3,0)+R4C -> 1114 | K438: =ROUND((R1003C-R4C)/(R1003C3)*RC3,0)+R4C -> 15885 | O438: =RC[-4]-R[-1]C[-4] -> 37 | P438: =RC[-1]-R[-1]C[-1] -> 1
B439: =R[-3]C+1 -> 146 | C439: =R[-1]C+RC[1] -> 435 | D439: 1 | F439: =ROUND((R1003C-R4C)/(R1003C3)*RC3,0)+R4C -> 5138 | G439: =ROUND((R1003C-R4C)/(R1003C3)*RC3,0)+R4C -> 4015 | H439: =ROUND((R1003C-R4C)/(R1003C3)*RC3,0)+R4C -> 11364 | I439: =ROUND((R1003C-R4C)/(R1003C3)*RC3,0)+R4C -> 2064 | J439: =ROUND((R1003C-R4C)/(R1003C3)*RC3,0)+R4C -> 1116 | K439: =ROUND((R1003C-R4C)/(R1003C3)*RC3,0)+R4C -> 15921 | O439: =RC[-4]-R[-1]C[-4] -> 36 | P439: =RC[-1]-R[-1]C[-1] -> -1
B440: =R[-3]C+1 -> 146 | C440: =R[-1]C+RC[1] -> 436 | D440: 1 | F440: =ROUND((R1003C-R4C)/(R1003C3)*RC3,0)+R4C -> 5150 | G440: =ROUND((R1003C-R4C)/(R1003C3)*RC3,0)+R4C -> 4024 | H440: =ROUND((R1003C-R4C)/(R1003C3)*RC3,0)+R4C -> 11390 | I440: =ROUND((R1003C-R4C)/(R1003C3)*RC3,0)+R4C -> 2069 | J440: =ROUND((R1003C-R4C)/(R1003C3)*RC3,0)+R4C -> 1119 | K440: =ROUND((R1003C-R4C)/(R1003C3)*RC3,0)+R4C -> 15957 | O440: =RC[-4]-R[-1]C[-4] -> 36 | P440: =RC[-1]-R[-1]C[-1] -> 0
B441: =R[-3]C+1 -> 146 | C441: =R[-1]C+RC[1] -> 437 | D441: 1 | F441: =ROUND((R1003C-R4C)/(R1003C3)*RC3,0)+R4C -> 5162 | G441: =ROUND((R1003C-R4C)/(R1003C3)*RC3,0)+R4C -> 4033 | H441: =ROUND((R1003C-R4C)/(R1003C3)*RC3,0)+R4C -> 11415 | I441: =ROUND((R1003C-R4C)/(R1003C3)*RC3,0)+R4C -> 2074 | J441: =ROUND((R1003C-R4C)/(R1003C3)*RC3,0)+R4C -> 1121 | K441: =ROUND((R1003C-R4C)/(R1003C3)*RC3,0)+R4C -> 15993 | O441: =RC[-4]-R[-1]C[-4] -> 36 | P441: =RC[-1]-R[-1]C[-1] -> 0
B442: =R[-3]C+1 -> 147 | C442: =R[-1]C+RC[1] -> 438 | D442: 1 | F442: =ROUND((R1003C-R4C)/(R1003C3)*RC3,0)+R4C -> 5173 | G442: =ROUND((R1003C-R4C)/(R1003C3)*RC3,0)+R4C -> 4042 | H442: =ROUND((R1003C-R4C)/(R1003C3)*RC3,0)+R4C -> 11441 | I442: =ROUND((R1003C-R4C)/(R1003C3)*RC3,0)+R4C -> 2079 | J442: =ROUND((R1003C-R4C)/(R1003C3)*RC3,0)+R4C -> 1124 | K442: =ROUND((R1003C-R4C)/(R1003C3)*RC3,0)+R4C -> 16029 | O442: =RC[-4]-R[-1]C[-4] -> 36 | P442: =RC[-1]-R[-1]C[-1] -> 0
B443: =R[-3]C+1 -> 147 | C443: =R[-1]C+RC[1] -> 439 | D443: 1 | F443: =ROUND((R1003C-R4C)/(R1003C3)*RC3,0)+R4C -> 5185 | G443: =ROUND((R1003C-R4C)/(R1003C3)*RC3,0)+R4C -> 4051 | H443: =ROUND((R1003C-R4C)/(R1003C3)*RC3,0)+R4C -> 11467 | I443: =ROUND((R1003C-R4C)/(R1003C3)*RC3,0)+R4C -> 2083 | J443: =ROUND((R1003C-R4C)/(R1003C3)*RC3,0)+R4C -> 1127 | K443: =ROUND((R1003C-R4C)/(R1003C3)*RC3,0)+R4C -> 16066 | O443: =RC[-4]-R[-1]C[-4] -> 37 | P443: =RC[-1]-R[-1]C[-1] -> 1
B444: =R[-3]C+1 -> 147 | C444: =R[-1]C+RC[1] -> 440 | D444: 1 | F444: =ROUND((R1003C-R4C)/(R1003C3)*RC3,0)+R4C -> 5197 | G444: =ROUND((R1003C-R4C)/(R1003C3)*RC3,0)+R4C -> 4061 | H444: =ROUND((R1003C-R4C)/(R1003C3)*RC3,0)+R4C -> 11493 | I444: =ROUND((R1003C-R4C)/(R1003C3)*RC3,0)+R4C -> 2088 | J444: =ROUND((R1003C-R4C)/(R1003C3)*RC3,0)+R4C -> 1129 | K444: =ROUND((R1003C-R4C)/(R1003C3)*RC3,0)+R4C -> 16102 | O444: =RC[-4]-R[-1]C[-4] -> 36 | P444: =RC[-1]-R[-1]C[-1] -> -1
B445: =R[-3]C+1 -> 148 | C445: =R[-1]C+RC[1] -> 441 | D445: 1 | F445: =ROUND((R1003C-R4C)/(R1003C3)*RC3,0)+R4C -> 5208 | G445: =ROUND((R1003C-R4C)/(R1003C3)*RC3,0)+R4C -> 4070 | H445: =ROUND((R1003C-R4C)/(R1003C3)*RC3,0)+R4C -> 11519 | I445: =ROUND((R1003C-R4C)/(R1003C3)*RC3,0)+R4C -> 2093 | J445: =ROUND((R1003C-R4C)/(R1003C3)*RC3,0)+R4C -> 1132 | K445: =ROUND((R1003C-R4C)/(R1003C3)*RC3,0)+R4C -> 16138 | O445: =RC[-4]-R[-1]C[-4] -> 36 | P445: =RC[-1]-R[-1]C[-1] -> 0
B446: =R[-3]C+1 -> 148 | C446: =R[-1]C+RC[1] -> 442 | D446: 1 | F446: =ROUND((R1003C-R4C)/(R1003C3)*RC3,0)+R4C -> 5220 | G446: =ROUND((R1003C-R4C)/(R1003C3)*RC3,0)+R4C -> 4079 | H446: =ROUND((R1003C-R4C)/(R1003C3)*RC3,0)+R4C -> 11545 | I446: =ROUND((R1003C-R4C)/(R1003C3)*RC3,0)+R4C -> 2097 | J446: =ROUND((R1003C-R4C)/(R1003C3)*RC3,0)+R4C -> 1134 | K446: =ROUND((R1003C-R4C)/(R1003C3)*RC3,0)+R4C -> 16174 | O446: =RC[-4]-R[-1]C[-4] -> 36 | P446: =RC[-1]-R[-1]C[-1] -> 0
B447: =R[-3]C+1 -> 148 | C447: =R[-1]C+RC[1] -> 443 | D447: 1 | F447: =ROUND((R1003C-R4C)/(R1003C3)*RC3,0)+R4C -> 5232 | G447: =ROUND((R1003C-R4C)/(R1003C3)*RC3,0)+R4C -> 4088 | H447: =ROUND((R1003C-R4C)/(R1003C3)*RC3,0)+R4C -> 11570 | I447: =ROUND((R1003C-R4C)/(R1003C3)*RC3,0)+R4C -> 2102 | J447: =ROUND((R1003C-R4C)/(R1003C3)*RC3,0)+R4C -> 1137 | K447: =ROUND((R1003C-R4C)/(R1003C3)*RC3,0)+R4C -> 16210 | O447: =RC[-4]-R[-1]C[-4] -> 36 | P447: =RC[-1]-R[-1]C[-1] -> 0
B448: =R[-3]C+1 -> 149 | C448: =R[-1]C+RC[1] -> 444 | D448: 1 | F448: =ROUND((R1003C-R4C)/(R1003C3)*RC3,0)+R4C -> 5243 | G448: =ROUND((R1003C-R4C)/(R1003C3)*RC3,0)+R4C -> 4097 | H448: =ROUND((R1003C-R4C)/(R1003C3)*RC3,0)+R4C -> 11596 | I448: =ROUND((R1003C-R4C)/(R1003C3)*RC3,0)+R4C -> 2107 | J448: =ROUND((R1003C-R4C)/(R1003C3)*RC3,0)+R4C -> 1139 | K448: =ROUND((R1003C-R4C)/(R1003C3)*RC3,0)+R4C -> 16246 | O448: =RC[-4]-R[-1]C[-4] -> 36 | P448: =RC[-1]-R[-1]C[-1] -> 0
B449: =R[-3]C+1 -> 149 | C449: =R[-1]C+RC[1] -> 445 | D449: 1 | F449: =ROUND((R1003C-R4C)/(R1003C3)*RC3,0)+R4C -> 5255 | G449: =ROUND((R1003C-R4C)/(R1003C3)*RC3,0)+R4C -> 4106 | H449: =ROUND((R1003C-R4C)/(R1003C3)*RC3,0)+R4C -> 11622 | I449: =ROUND((R1003C-R4C)/(R1003C3)*RC3,0)+R4C -> 2111 | J449: =ROUND((R1003C-R4C)/(R1003C3)*RC3,0)+R4C -> 1142 | K449: =ROUND((R1003C-R4C)/(R1003C3)*RC3,0)+R4C -> 16283 | O449: =RC[-4]-R[-1]C[-4] -> 37 | P449: =RC[-1]-R[-1]C[-1] -> 1
B450: =R[-3]C+1 -> 149 | C450: =R[-1]C+RC[1] -> 446 | D450: 1 | F450: =ROUND((R1003C-R4C)/(R1003C3)*RC3,0)+R4C -> 5267 | G450: =ROUND((R1003C-R4C)/(R1003C3)*RC3,0)+R4C -> 4115 | H450: =ROUND((R1003C-R4C)/(R1003C3)*RC3,0)+R4C -> 11648 | I450: =ROUND((R1003C-R4C)/(R1003C3)*RC3,0)+R4C -> 2116 | J450: =ROUND((R1003C-R4C)/(R1003C3)*RC3,0)+R4C -> 1144 | K450: =ROUND((R1003C-R4C)/(R1003C3)*RC3,0)+R4C -> 16319 | O450: =RC[-4]-R[-1]C[-4] -> 36 | P450: =RC[-1]-R[-1]C[-1] -> -1
B451: =R[-3]C+1 -> 150 | C451: =R[-1]C+RC[1] -> 447 | D451: 1 | F451: =ROUND((R1003C-R4C)/(R1003C3)*RC3,0)+R4C -> 5278 | G451: =ROUND((R1003C-R4C)/(R1003C3)*RC3,0)+R4C -> 4124 | H451: =ROUND((R1003C-R4C)/(R1003C3)*RC3,0)+R4C -> 11674 | I451: =ROUND((R1003C-R4C)/(R1003C3)*RC3,0)+R4C -> 2121 | J451: =ROUND((R1003C-R4C)/(R1003C3)*RC3,0)+R4C -> 1147 | K451: =ROUND((R1003C-R4C)/(R1003C3)*RC3,0)+R4C -> 16355 | O451: =RC[-4]-R[-1]C[-4] -> 36 | P451: =RC[-1]-R[-1]C[-1] -> 0
B452: =R[-3]C+1 -> 150 | C452: =R[-1]C+RC[1] -> 448 | D452: 1 | F452: =ROUND((R1003C-R4C)/(R1003C3)*RC3,0)+R4C -> 5290 | G452: =ROUND((R1003C-R4C)/(R1003C3)*RC3,0)+R4C -> 4134 | H452: =ROUND((R1003C-R4C)/(R1003C3)*RC3,0)+R4C -> 11700 | I452: =ROUND((R1003C-R4C)/(R1003C3)*RC3,0)+R4C -> 2125 | J452: =ROUND((R1003C-R4C)/(R1003C3)*RC3,0)+R4C -> 1149 | K452: =ROUND((R1003C-R4C)/(R1003C3)*RC3,0)+R4C -> 16391 | O452: =RC[-4]-R[-1]C[-4] -> 36 | P452: =RC[-1]-R[-1]C[-1] -> 0
B453: =R[-3]C+1 -> 150 | C453: =R[-1]C+RC[1] -> 449 | D453: 1 | F453: =ROUND((R1003C-R4C)/(R1003C3)*RC3,0)+R4C -> 5302 | G453: =ROUND((R1003C-R4C)/(R1003C3)*RC3,0)+R4C -> 4143 | H453: =ROUND((R1003C-R4C)/(R1003C3)*RC3,0)+R4C -> 11725 | I453: =ROUND((R1003C-R4C)/(R1003C3)*RC3,0)+R4C -> 2130 | J453: =ROUND((R1003C-R4C)/(R1003C3)*RC3,0)+R4C -> 1152 | K453: =ROUND((R1003C-R4C)/(R1003C3)*RC3,0)+R4C -> 16427 | O453: =RC[-4]-R[-1]C[-4] -> 36 | P453: =RC[-1]-R[-1]C[-1] -> 0
B454: =R[-3]C+1 -> 151 | C454: =R[-1]C+RC[1] -> 450 | D454: 1 | F454: =ROUND((R1003C-R4C)/(R1003C3)*RC3,0)+R4C -> 5314 | G454: =ROUND((R1003C-R4C)/(R1003C3)*RC3,0)+R4C -> 4152 | H454: =ROUND((R1003C-R4C)/(R1003C3)*RC3,0)+R4C -> 11751 | I454: =ROUND((R1003C-R4C)/(R1003C3)*RC3,0)+R4C -> 2135 | J454: =ROUND((R1003C-R4C)/(R1003C3)*RC3,0)+R4C -> 1154 | K454: =ROUND((R1003C-R4C)/(R1003C3)*RC3,0)+R4C -> 16464 | O454: =RC[-4]-R[-1]C[-4] -> 37 | P454: =RC[-1]-R[-1]C[-1] -> 1
B455: =R[-3]C+1 -> 151 | C455: =R[-1]C+RC[1] -> 451 | D455: 1 | F455: =ROUND((R1003C-R4C)/(R1003C3)*RC3,0)+R4C -> 5325 | G455: =ROUND((R1003C-R4C)/(R1003C3)*RC3,0)+R4C -> 4161 | H455: =ROUND((R1003C-R4C)/(R1003C3)*RC3,0)+R4C -> 11777 | I455: =ROUND((R1003C-R4C)/(R1003C3)*RC3,0)+R4C -> 2140 | J455: =ROUND((R1003C-R4C)/(R1003C3)*RC3,0)+R4C -> 1157 | K455: =ROUND((R1003C-R4C)/(R1003C3)*RC3,0)+R4C -> 16500 | O455: =RC[-4]-R[-1]C[-4] -> 36 | P455: =RC[-1]-R[-1]C[-1] -> -1
B456: =R[-3]C+1 -> 151 | C456: =R[-1]C+RC[1] -> 452 | D456: 1 | F456: =ROUND((R1003C-R4C)/(R1003C3)*RC3,0)+R4C -> 5337 | G456: =ROUND((R1003C-R4C)/(R1003C3)*RC3,0)+R4C -> 4170 | H456: =ROUND((R1003C-R4C)/(R1003C3)*RC3,0)+R4C -> 11803 | I456: =ROUND((R1003C-R4C)/(R1003C3)*RC3,0)+R4C -> 2144 | J456: =ROUND((R1003C-R4C)/(R1003C3)*RC3,0)+R4C -> 1160 | K456: =ROUND((R1003C-R4C)/(R1003C3)*RC3,0)+R4C -> 16536 | O456: =RC[-4]-R[-1]C[-4] -> 36 | P456: =RC[-1]-R[-1]C[-1] -> 0
B457: =R[-3]C+1 -> 152 | C457: =R[-1]C+RC[1] -> 453 | D457: 1 | F457: =ROUND((R1003C-R4C)/(R1003C3)*RC3,0)+R4C -> 5349 | G457: =ROUND((R1003C-R4C)/(R1003C3)*RC3,0)+R4C -> 4179 | H457: =ROUND((R1003C-R4C)/(R1003C3)*RC3,0)+R4C -> 11829 | I457: =ROUND((R1003C-R4C)/(R1003C3)*RC3,0)+R4C -> 2149 | J457: =ROUND((R1003C-R4C)/(R1003C3)*RC3,0)+R4C -> 1162 | K457: =ROUND((R1003C-R4C)/(R1003C3)*RC3,0)+R4C -> 16572 | O457: =RC[-4]-R[-1]C[-4] -> 36 | P457: =RC[-1]-R[-1]C[-1] -> 0
B458: =R[-3]C+1 -> 152 | C458: =R[-1]C+RC[1] -> 454 | D458: 1 | F458: =ROUND((R1003C-R4C)/(R1003C3)*RC3,0)+R4C -> 5360 | G458: =ROUND((R1003C-R4C)/(R1003C3)*RC3,0)+R4C -> 4188 | H458: =ROUND((R1003C-R4C)/(R1003C3)*RC3,0)+R4C -> 11854 | I458: =ROUND((R1003C-R4C)/(R1003C3)*RC3,0)+R4C -> 2154 | J458: =ROUND((R1003C-R4C)/(R1003C3)*RC3,0)+R4C -> 1165 | K458: =ROUND((R1003C-R4C)/(R1003C3)*RC3,0)+R4C -> 16608 | O458: =RC[-4]-R[-1]C[-4] -> 36 | P458: =RC[-1]-R[-1]C[-1] -> 0
B459: =R[-3]C+1 -> 152 | C459: =R[-1]C+RC[1] -> 455 | D459: 1 | F459: =ROUND((R1003C-R4C)/(R1003C3)*RC3,0)+R4C -> 5372 | G459: =ROUND((R1003C-R4C)/(R1003C3)*RC3,0)+R4C -> 4197 | H459: =ROUND((R1003C-R4C)/(R1003C3)*RC3,0)+R4C -> 11880 | I459: =ROUND((R1003C-R4C)/(R1003C3)*RC3,0)+R4C -> 2158 | J459: =ROUND((R1003C-R4C)/(R1003C3)*RC3,0)+R4C -> 1167 | K459: =ROUND((R1003C-R4C)/(R1003C3)*RC3,0)+R4C -> 16644 | O459: =RC[-4]-R[-1]C[-4] -> 36 | P459: =RC[-1]-R[-1]C[-1] -> 0
B460: =R[-3]C+1 -> 153 | C460: =R[-1]C+RC[1] -> 456 | D460: 1 | F460: =ROUND((R1003C-R4C)/(R1003C3)*RC3,0)+R4C -> 5384 | G460: =ROUND((R1003C-R4C)/(R1003C3)*RC3,0)+R4C -> 4207 | H460: =ROUND((R1003C-R4C)/(R1003C3)*RC3,0)+R4C -> 11906 | I460: =ROUND((R1003C-R4C)/(R1003C3)*RC3,0)+R4C -> 2163 | J460: =ROUND((R1003C-R4C)/(R1003C3)*RC3,0)+R4C -> 1170 | K460: =ROUND((R1003C-R4C)/(R1003C3)*RC3,0)+R4C -> 16681 | O460: =RC[-4]-R[-1]C[-4] -> 37 | P460: =RC[-1]-R[-1]C[-1] -> 1
B461: =R[-3]C+1 -> 153 | C461: =R[-1]C+RC[1] -> 457 | D461: 1 | F461: =ROUND((R1003C-R4C)/(R1003C3)*RC3,0)+R4C -> 5395 | G461: =ROUND((R1003C-R4C)/(R1003C3)*RC3,0)+R4C -> 4216 | H461: =ROUND((R1003C-R4C)/(R1003C3)*RC3,0)+R4C -> 11932 | I461: =ROUND((R1003C-R4C)/(R1003C3)*RC3,0)+R4C -> 2168 | J461: =ROUND((R1003C-R4C)/(R1003C3)*RC3,0)+R4C -> 1172 | K461: =ROUND((R1003C-R4C)/(R1003C3)*RC3,0)+R4C -> 16717 | O461: =RC[-4]-R[-1]C[-4] -> 36 | P461: =RC[-1]-R[-1]C[-1] -> -1
B462: =R[-3]C+1 -> 153 | C462: =R[-1]C+RC[1] -> 458 | D462: 1 | F462: =ROUND((R1003C-R4C)/(R1003C3)*RC3,0)+R4C -> 5407 | G462: =ROUND((R1003C-R4C)/(R1003C3)*RC3,0)+R4C -> 4225 | H462: =ROUND((R1003C-R4C)/(R1003C3)*RC3,0)+R4C -> 11958 | I462: =ROUND((R1003C-R4C)/(R1003C3)*RC3,0)+R4C -> 2172 | J462: =ROUND((R1003C-R4C)/(R1003C3)*RC3,0)+R4C -> 1175 | K462: =ROUND((R1003C-R4C)/(R1003C3)*RC3,0)+R4C -> 16753 | O462: =RC[-4]-R[-1]C[-4] -> 36 | P462: =RC[-1]-R[-1]C[-1] -> 0
B463: =R[-3]C+1 -> 154 | C463: =R[-1]C+RC[1] -> 459 | D463: 1 | F463: =ROUND((R1003C-R4C)/(R1003C3)*RC3,0)+R4C -> 5419 | G463: =ROUND((R1003C-R4C)/(R1003C3)*RC3,0)+R4C -> 4234 | H463: =ROUND((R1003C-R4C)/(R1003C3)*RC3,0)+R4C -> 11984 | I463: =ROUND((R1003C-R4C)/(R1003C3)*RC3,0)+R4C -> 2177 | J463: =ROUND((R1003C-R4C)/(R1003C3)*RC3,0)+R4C -> 1177 | K463: =ROUND((R1003C-R4C)/(R1003C3)*RC3,0)+R4C -> 16789 | O463: =RC[-4]-R[-1]C[-4] -> 36 | P463: =RC[-1]-R[-1]C[-1] -> 0
B464: =R[-3]C+1 -> 154 | C464: =R[-1]C+RC[1] -> 460 | D464: 1 | F464: =ROUND((R1003C-R4C)/(R1003C3)*RC3,0)+R4C -> 5430 | G464: =ROUND((R1003C-R4C)/(R1003C3)*RC3,0)+R4C -> 4243 | H464: =ROUND((R1003C-R4C)/(R1003C3)*RC3,0)+R4C -> 12009 | I464: =ROUND((R1003C-R4C)/(R1003C3)*RC3,0)+R4C -> 2182 | J464: =ROUND((R1003C-R4C)/(R1003C3)*RC3,0)+R4C -> 1180 | K464: =ROUND((R1003C-R4C)/(R1003C3)*RC3,0)+R4C -> 16825 | O464: =RC[-4]-R[-1]C[-4] -> 36 | P464: =RC[-1]-R[-1]C[-1] -> 0
B465: =R[-3]C+1 -> 154 | C465: =R[-1]C+RC[1] -> 461 | D465: 1 | F465: =ROUND((R1003C-R4C)/(R1003C3)*RC3,0)+R4C -> 5442 | G465: =ROUND((R1003C-R4C)/(R1003C3)*RC3,0)+R4C -> 4252 | H465: =ROUND((R1003C-R4C)/(R1003C3)*RC3,0)+R4C -> 12035 | I465: =ROUND((R1003C-R4C)/(R1003C3)*RC3,0)+R4C -> 2186 | J465: =ROUND((R1003C-R4C)/(R1003C3)*RC3,0)+R4C -> 1182 | K465: =ROUND((R1003C-R4C)/(R1003C3)*RC3,0)+R4C -> 16862 | O465: =RC[-4]-R[-1]C[-4] -> 37 | P465: =RC[-1]-R[-1]C[-1] -> 1
B466: =R[-3]C+1 -> 155 | C466: =R[-1]C+RC[1] -> 462 | D466: 1 | F466: =ROUND((R1003C-R4C)/(R1003C3)*RC3,0)+R4C -> 5454 | G466: =ROUND((R1003C-R4C)/(R1003C3)*RC3,0)+R4C -> 4261 | H466: =ROUND((R1003C-R4C)/(R1003C3)*RC3,0)+R4C -> 12061 | I466: =ROUND((R1003C-R4C)/(R1003C3)*RC3,0)+R4C -> 2191 | J466: =ROUND((R1003C-R4C)/(R1003C3)*RC3,0)+R4C -> 1185 | K466: =ROUND((R1003C-R4C)/(R1003C3)*RC3,0)+R4C -> 16898 | O466: =RC[-4]-R[-1]C[-4] -> 36 | P466: =RC[-1]-R[-1]C[-1] -> -1
B467: =R[-3]C+1 -> 155 | C467: =R[-1]C+RC[1] -> 463 | D467: 1 | F467: =ROUND((R1003C-R4C)/(R1003C3)*RC3,0)+R4C -> 5465 | G467: =ROUND((R1003C-R4C)/(R1003C3)*RC3,0)+R4C -> 4270 | H467: =ROUND((R1003C-R4C)/(R1003C3)*RC3,0)+R4C -> 12087 | I467: =ROUND((R1003C-R4C)/(R1003C3)*RC3,0)+R4C -> 2196 | J467: =ROUND((R1003C-R4C)/(R1003C3)*RC3,0)+R4C -> 1187 | K467: =ROUND((R1003C-R4C)/(R1003C3)*RC3,0)+R4C -> 16934 | O467: =RC[-4]-R[-1]C[-4] -> 36 | P467: =RC[-1]-R[-1]C[-1] -> 0
B468: =R[-3]C+1 -> 155 | C468: =R[-1]C+RC[1] -> 464 | D468: 1 | F468: =ROUND((R1003C-R4C)/(R1003C3)*RC3,0)+R4C -> 5477 | G468: =ROUND((R1003C-R4C)/(R1003C3)*RC3,0)+R4C -> 4280 | H468: =ROUND((R1003C-R4C)/(R1003C3)*RC3,0)+R4C -> 12113 | I468: =ROUND((R1003C-R4C)/(R1003C3)*RC3,0)+R4C -> 2200 | J468: =ROUND((R1003C-R4C)/(R1003C3)*RC3,0)+R4C -> 1190 | K468: =ROUND((R1003C-R4C)/(R1003C3)*RC3,0)+R4C -> 16970 | O468: =RC[-4]-R[-1]C[-4] -> 36 | P468: =RC[-1]-R[-1]C[-1] -> 0
B469: =R[-3]C+1 -> 156 | C469: =R[-1]C+RC[1] -> 465 | D469: 1 | F469: =ROUND((R1003C-R4C)/(R1003C3)*RC3,0)+R4C -> 5489 | G469: =ROUND((R1003C-R4C)/(R1003C3)*RC3,0)+R4C -> 4289 | H469: =ROUND((R1003C-R4C)/(R1003C3)*RC3,0)+R4C -> 12139 | I469: =ROUND((R1003C-R4C)/(R1003C3)*RC3,0)+R4C -> 2205 | J469: =ROUND((R1003C-R4C)/(R1003C3)*RC3,0)+R4C -> 1192 | K469: =ROUND((R1003C-R4C)/(R1003C3)*RC3,0)+R4C -> 17006 | O469: =RC[-4]-R[-1]C[-4] -> 36 | P469: =RC[-1]-R[-1]C[-1] -> 0
B470: =R[-3]C+1 -> 156 | C470: =R[-1]C+RC[1] -> 466 | D470: 1 | F470: =ROUND((R1003C-R4C)/(R1003C3)*RC3,0)+R4C -> 5500 | G470: =ROUND((R1003C-R4C)/(R1003C3)*RC3,0)+R4C -> 4298 | H470: =ROUND((R1003C-R4C)/(R1003C3)*RC3,0)+R4C -> 12164 | I470: =ROUND((R1003C-R4C)/(R1003C3)*RC3,0)+R4C -> 2210 | J470: =ROUND((R1003C-R4C)/(R1003C3)*RC3,0)+R4C -> 1195 | K470: =ROUND((R1003C-R4C)/(R1003C3)*RC3,0)+R4C -> 17042 | O470: =RC[-4]-R[-1]C[-4] -> 36 | P470: =RC[-1]-R[-1]C[-1] -> 0
B471: =R[-3]C+1 -> 156 | C471: =R[-1]C+RC[1] -> 467 | D471: 1 | F471: =ROUND((R1003C-R4C)/(R1003C3)*RC3,0)+R4C -> 5512 | G471: =ROUND((R1003C-R4C)/(R1003C3)*RC3,0)+R4C -> 4307 | H471: =ROUND((R1003C-R4C)/(R1003C3)*RC3,0)+R4C -> 12190 | I471: =ROUND((R1003C-R4C)/(R1003C3)*RC3,0)+R4C -> 2215 | J471: =ROUND((R1003C-R4C)/(R1003C3)*RC3,0)+R4C -> 1198 | K471: =ROUND((R1003C-R4C)/(R1003C3)*RC3,0)+R4C -> 17079 | O471: =RC[-4]-R[-1]C[-4] -> 37 | P471: =RC[-1]-R[-1]C[-1] -> 1
B472: =R[-3]C+1 -> 157 | C472: =R[-1]C+RC[1] -> 468 | D472: 1 | F472: =ROUND((R1003C-R4C)/(R1003C3)*RC3,0)+R4C -> 5524 | G472: =ROUND((R1003C-R4C)/(R1003C3)*RC3,0)+R4C -> 4316 | H472: =ROUND((R1003C-R4C)/(R1003C3)*RC3,0)+R4C -> 12216 | I472: =ROUND((R1003C-R4C)/(R1003C3)*RC3,0)+R4C -> 2219 | J472: =ROUND((R1003C-R4C)/(R1003C3)*RC3,0)+R4C -> 1200 | K472: =ROUND((R1003C-R4C)/(R1003C3)*RC3,0)+R4C -> 17115 | O472: =RC[-4]-R[-1]C[-4] -> 36 | P472: =RC[-1]-R[-1]C[-1] -> -1
B473: =R[-3]C+1 -> 157 | C473: =R[-1]C+RC[1] -> 469 | D473: 1 | F473: =ROUND((R1003C-R4C)/(R1003C3)*RC3,0)+R4C -> 5535 | G473: =ROUND((R1003C-R4C)/(R1003C3)*RC3,0)+R4C -> 4325 | H473: =ROUND((R1003C-R4C)/(R1003C3)*RC3,0)+R4C -> 12242 | I473: =ROUND((R1003C-R4C)/(R1003C3)*RC3,0)+R4C -> 2224 | J473: =ROUND((R1003C-R4C)/(R1003C3)*RC3,0)+R4C -> 1203 | K473: =ROUND((R1003C-R4C)/(R1003C3)*RC3,0)+R4C -> 17151 | O473: =RC[-4]-R[-1]C[-4] -> 36 | P473: =RC[-1]-R[-1]C[-1] -> 0
B474: =R[-3]C+1 -> 157 | C474: =R[-1]C+RC[1] -> 470 | D474: 1 | F474: =ROUND((R1003C-R4C)/(R1003C3)*RC3,0)+R4C -> 5547 | G474: =ROUND((R1003C-R4C)/(R1003C3)*RC3,0)+R4C -> 4334 | H474: =ROUND((R1003C-R4C)/(R1003C3)*RC3,0)+R4C -> 12268 | I474: =ROUND((R1003C-R4C)/(R1003C3)*RC3,0)+R4C -> 2229 | J474: =ROUND((R1003C-R4C)/(R1003C3)*RC3,0)+R4C -> 1205 | K474: =ROUND((R1003C-R4C)/(R1003C3)*RC3,0)+R4C -> 17187 | O474: =RC[-4]-R[-1]C[-4] -> 36 | P474: =RC[-1]-R[-1]C[-1] -> 0
B475: =R[-3]C+1 -> 158 | C475: =R[-1]C+RC[1] -> 471 | D475: 1 | F475: =ROUND((R1003C-R4C)/(R1003C3)*RC3,0)+R4C -> 5559 | G475: =ROUND((R1003C-R4C)/(R1003C3)*RC3,0)+R4C -> 4343 | H475: =ROUND((R1003C-R4C)/(R1003C3)*RC3,0)+R4C -> 12293 | I475: =ROUND((R1003C-R4C)/(R1003C3)*RC3,0)+R4C -> 2233 | J475: =ROUND((R1003C-R4C)/(R1003C3)*RC3,0)+R4C -> 1208 | K475: =ROUND((R1003C-R4C)/(R1003C3)*RC3,0)+R4C -> 17223 | O475: =RC[-4]-R[-1]C[-4] -> 36 | P475: =RC[-1]-R[-1]C[-1] -> 0
B476: =R[-3]C+1 -> 158 | C476: =R[-1]C+RC[1] -> 472 | D476: 1 | F476: =ROUND((R1003C-R4C)/(R1003C3)*RC3,0)+R4C -> 5570 | G476: =ROUND((R1003C-R4C)/(R1003C3)*RC3,0)+R4C -> 4353 | H476: =ROUND((R1003C-R4C)/(R1003C3)*RC3,0)+R4C -> 12319 | I476: =ROUND((R1003C-R4C)/(R1003C3)*RC3,0)+R4C -> 2238 | J476: =ROUND((R1003C-R4C)/(R1003C3)*RC3,0)+R4C -> 1210 | K476: =ROUND((R1003C-R4C)/(R1003C3)*RC3,0)+R4C -> 17260 | O476: =RC[-4]-R[-1]C[-4] -> 37 | P476: =RC[-1]-R[-1]C[-1] -> 1
B477: =R[-3]C+1 -> 158 | C477: =R[-1]C+RC[1] -> 473 | D477: 1 | F477: =ROUND((R1003C-R4C)/(R1003C3)*RC3,0)+R4C -> 5582 | G477: =ROUND((R1003C-R4C)/(R1003C3)*RC3,0)+R4C -> 4362 | H477: =ROUND((R1003C-R4C)/(R1003C3)*RC3,0)+R4C -> 12345 | I477: =ROUND((R1003C-R4C)/(R1003C3)*RC3,0)+R4C -> 2243 | J477: =ROUND((R1003C-R4C)/(R1003C3)*RC3,0)+R4C -> 1213 | K477: =ROUND((R1003C-R4C)/(R1003C3)*RC3,0)+R4C -> 17296 | O477: =RC[-4]-R[-1]C[-4] -> 36 | P477: =RC[-1]-R[-1]C[-1] -> -1
B478: =R[-3]C+1 -> 159 | C478: =R[-1]C+RC[1] -> 474 | D478: 1 | F478: =ROUND((R1003C-R4C)/(R1003C3)*RC3,0)+R4C -> 5594 | G478: =ROUND((R1003C-R4C)/(R1003C3)*RC3,0)+R4C -> 4371 | H478: =ROUND((R1003C-R4C)/(R1003C3)*RC3,0)+R4C -> 12371 | I478: =ROUND((R1003C-R4C)/(R1003C3)*RC3,0)+R4C -> 2247 | J478: =ROUND((R1003C-R4C)/(R1003C3)*RC3,0)+R4C -> 1215 | K478: =ROUND((R1003C-R4C)/(R1003C3)*RC3,0)+R4C -> 17332 | O478: =RC[-4]-R[-1]C[-4] -> 36 | P478: =RC[-1]-R[-1]C[-1] -> 0
B479: =R[-3]C+1 -> 159 | C479: =R[-1]C+RC[1] -> 475 | D479: 1 | F479: =ROUND((R1003C-R4C)/(R1003C3)*RC3,0)+R4C -> 5605 | G479: =ROUND((R1003C-R4C)/(R1003C3)*RC3,0)+R4C -> 4380 | H479: =ROUND((R1003C-R4C)/(R1003C3)*RC3,0)+R4C -> 12397 | I479: =ROUND((R1003C-R4C)/(R1003C3)*RC3,0)+R4C -> 2252 | J479: =ROUND((R1003C-R4C)/(R1003C3)*RC3,0)+R4C -> 1218 | K479: =ROUND((R1003C-R4C)/(R1003C3)*RC3,0)+R4C -> 17368 | O479: =RC[-4]-R[-1]C[-4] -> 36 | P479: =RC[-1]-R[-1]C[-1] -> 0
B480: =R[-3]C+1 -> 159 | C480: =R[-1]C+RC[1] -> 476 | D480: 1 | F480: =ROUND((R1003C-R4C)/(R1003C3)*RC3,0)+R4C -> 5617 | G480: =ROUND((R1003C-R4C)/(R1003C3)*RC3,0)+R4C -> 4389 | H480: =ROUND((R1003C-R4C)/(R1003C3)*RC3,0)+R4C -> 12423 | I480: =ROUND((R1003C-R4C)/(R1003C3)*RC3,0)+R4C -> 2257 | J480: =ROUND((R1003C-R4C)/(R1003C3)*RC3,0)+R4C -> 1220 | K480: =ROUND((R1003C-R4C)/(R1003C3)*RC3,0)+R4C -> 17404 | O480: =RC[-4]-R[-1]C[-4] -> 36 | P480: =RC[-1]-R[-1]C[-1] -> 0
B481: =R[-3]C+1 -> 160 | C481: =R[-1]C+RC[1] -> 477 | D481: 1 | F481: =ROUND((R1003C-R4C)/(R1003C3)*RC3,0)+R4C -> 5629 | G481: =ROUND((R1003C-R4C)/(R1003C3)*RC3,0)+R4C -> 4398 | H481: =ROUND((R1003C-R4C)/(R1003C3)*RC3,0)+R4C -> 12448 | I481: =ROUND((R1003C-R4C)/(R1003C3)*RC3,0)+R4C -> 2261 | J481: =ROUND((R1003C-R4C)/(R1003C3)*RC3,0)+R4C -> 1223 | K481: =ROUND((R1003C-R4C)/(R1003C3)*RC3,0)+R4C -> 17440 | O481: =RC[-4]-R[-1]C[-4] -> 36 | P481: =RC[-1]-R[-1]C[-1] -> 0
B482: =R[-3]C+1 -> 160 | C482: =R[-1]C+RC[1] -> 478 | D482: 1 | F482: =ROUND((R1003C-R4C)/(R1003C3)*RC3,0)+R4C -> 5640 | G482: =ROUND((R1003C-R4C)/(R1003C3)*RC3,0)+R4C -> 4407 | H482: =ROUND((R1003C-R4C)/(R1003C3)*RC3,0)+R4C -> 12474 | I482: =ROUND((R1003C-R4C)/(R1003C3)*RC3,0)+R4C -> 2266 | J482: =ROUND((R1003C-R4C)/(R1003C3)*RC3,0)+R4C -> 1225 | K482: =ROUND((R1003C-R4C)/(R1003C3)*RC3,0)+R4C -> 17477 | O482: =RC[-4]-R[-1]C[-4] -> 37 | P482: =RC[-1]-R[-1]C[-1] -> 1
B483: =R[-3]C+1 -> 160 | C483: =R[-1]C+RC[1] -> 479 | D483: 1 | F483: =ROUND((R1003C-R4C)/(R1003C3)*RC3,0)+R4C -> 5652 | G483: =ROUND((R1003C-R4C)/(R1003C3)*RC3,0)+R4C -> 4416 | H483: =ROUND((R1003C-R4C)/(R1003C3)*RC3,0)+R4C -> 12500 | I483: =ROUND((R1003C-R4C)/(R1003C3)*RC3,0)+R4C -> 2271 | J483: =ROUND((R1003C-R4C)/(R1003C3)*RC3,0)+R4C -> 1228 | K483: =ROUND((R1003C-R4C)/(R1003C3)*RC3,0)+R4C -> 17513 | O483: =RC[-4]-R[-1]C[-4] -> 36 | P483: =RC[-1]-R[-1]C[-1] -> -1
B484: =R[-3]C+1 -> 161 | C484: =R[-1]C+RC[1] -> 480 | D484: 1 | F484: =ROUND((R1003C-R4C)/(R1003C3)*RC3,0)+R4C -> 5664 | G484: =ROUND((R1003C-R4C)/(R1003C3)*RC3,0)+R4C -> 4426 | H484: =ROUND((R1003C-R4C)/(R1003C3)*RC3,0)+R4C -> 12526 | I484: =ROUND((R1003C-R4C)/(R1003C3)*RC3,0)+R4C -> 2276 | J484: =ROUND((R1003C-R4C)/(R1003C3)*RC3,0)+R4C -> 1231 | K484: =ROUND((R1003C-R4C)/(R1003C3)*RC3,0)+R4C -> 17549 | O484: =RC[-4]-R[-1]C[-4] -> 36 | P484: =RC[-1]-R[-1]C[-1] -> 0
B485: =R[-3]C+1 -> 161 | C485: =R[-1]C+RC[1] -> 481 | D485: 1 | F485: =ROUND((R1003C-R4C)/(R1003C3)*RC3,0)+R4C -> 5675 | G485: =ROUND((R1003C-R4C)/(R1003C3)*RC3,0)+R4C -> 4435 | H485: =ROUND((R1003C-R4C)/(R1003C3)*RC3,0)+R4C -> 12552 | I485: =ROUND((R1003C-R4C)/(R1003C3)*RC3,0)+R4C -> 2280 | J485: =ROUND((R1003C-R4C)/(R1003C3)*RC3,0)+R4C -> 1233 | K485: =ROUND((R1003C-R4C)/(R1003C3)*RC3,0)+R4C -> 17585 | O485: =RC[-4]-R[-1]C[-4] -> 36 | P485: =RC[-1]-R[-1]C[-1] -> 0
B486: =R[-3]C+1 -> 161 | C486: =R[-1]C+RC[1] -> 482 | D486: 1 | F486: =ROUND((R1003C-R4C)/(R1003C3)*RC3,0)+R4C -> 5687 | G486: =ROUND((R1003C-R4C)/(R1003C3)*RC3,0)+R4C -> 4444 | H486: =ROUND((R1003C-R4C)/(R1003C3)*RC3,0)+R4C -> 12578 | I486: =ROUND((R1003C-R4C)/(R1003C3)*RC3,0)+R4C -> 2285 | J486: =ROUND((R1003C-R4C)/(R1003C3)*RC3,0)+R4C -> 1236 | K486: =ROUND((R1003C-R4C)/(R1003C3)*RC3,0)+R4C -> 17621 | O486: =RC[-4]-R[-1]C[-4] -> 36 | P486: =RC[-1]-R[-1]C[-1] -> 0
B487: =R[-3]C+1 -> 162 | C487: =R[-1]C+RC[1] -> 483 | D487: 1 | F487: =ROUND((R1003C-R4C)/(R1003C3)*RC3,0)+R4C -> 5699 | G487: =ROUND((R1003C-R4C)/(R1003C3)*RC3,0)+R4C -> 4453 | H487: =ROUND((R1003C-R4C)/(R1003C3)*RC3,0)+R4C -> 12603 | I487: =ROUND((R1003C-R4C)/(R1003C3)*RC3,0)+R4C -> 2290 | J487: =ROUND((R1003C-R4C)/(R1003C3)*RC3,0)+R4C -> 1238 | K487: =ROUND((R1003C-R4C)/(R1003C3)*RC3,0)+R4C -> 17658 | O487: =RC[-4]-R[-1]C[-4] -> 37 | P487: =RC[-1]-R[-1]C[-1] -> 1
B488: =R[-3]C+1 -> 162 | C488: =R[-1]C+RC[1] -> 484 | D488: 1 | F488: =ROUND((R1003C-R4C)/(R1003C3)*RC3,0)+R4C -> 5711 | G488: =ROUND((R1003C-R4C)/(R1003C3)*RC3,0)+R4C -> 4462 | H488: =ROUND((R1003C-R4C)/(R1003C3)*RC3,0)+R4C -> 12629 | I488: =ROUND((R1003C-R4C)/(R1003C3)*RC3,0)+R4C -> 2294 | J488: =ROUND((R1003C-R4C)/(R1003C3)*RC3,0)+R4C -> 1241 | K488: =ROUND((R1003C-R4C)/(R1003C3)*RC3,0)+R4C -> 17694 | O488: =RC[-4]-R[-1]C[-4] -> 36 | P488: =RC[-1]-R[-1]C[-1] -> -1
B489: =R[-3]C+1 -> 162 | C489: =R[-1]C+RC[1] -> 485 | D489: 1 | F489: =ROUND((R1003C-R4C)/(R1003C3)*RC3,0)+R4C -> 5722 | G489: =ROUND((R1003C-R4C)/(R1003C3)*RC3,0)+R4C -> 4471 | H489: =ROUND((R1003C-R4C)/(R1003C3)*RC3,0)+R4C -> 12655 | I489: =ROUND((R1003C-R4C)/(R1003C3)*RC3,0)+R4C -> 2299 | J489: =ROUND((R1003C-R4C)/(R1003C3)*RC3,0)+R4C -> 1243 | K489: =ROUND((R1003C-R4C)/(R1003C3)*RC3,0)+R4C -> 17730 | O489: =RC[-4]-R[-1]C[-4] -> 36 | P489: =RC[-1]-R[-1]C[-1] -> 0
B490: =R[-3]C+1 -> 163 | C490: =R[-1]C+RC[1] -> 486 | D490: 1 | F490: =ROUND((R1003C-R4C)/(R1003C3)*RC3,0)+R4C -> 5734 | G490: =ROUND((R1003C-R4C)/(R1003C3)*RC3,0)+R4C -> 4480 | H490: =ROUND((R1003C-R4C)/(R1003C3)*RC3,0)+R4C -> 12681 | I490: =ROUND((R1003C-R4C)/(R1003C3)*RC3,0)+R4C -> 2304 | J490: =ROUND((R1003C-R4C)/(R1003C3)*RC3,0)+R4C -> 1246 | K490: =ROUND((R1003C-R4C)/(R1003C3)*RC3,0)+R4C -> 17766 | O490: =RC[-4]-R[-1]C[-4] -> 36 | P490: =RC[-1]-R[-1]C[-1] -> 0
B491: =R[-3]C+1 -> 163 | C491: =R[-1]C+RC[1] -> 487 | D491: 1 | F491: =ROUND((R1003C-R4C)/(R1003C3)*RC3,0)+R4C -> 5746 | G491: =ROUND((R1003C-R4C)/(R1003C3)*RC3,0)+R4C -> 4489 | H491: =ROUND((R1003C-R4C)/(R1003C3)*RC3,0)+R4C -> 12707 | I491: =ROUND((R1003C-R4C)/(R1003C3)*RC3,0)+R4C -> 2308 | J491: =ROUND((R1003C-R4C)/(R1003C3)*RC3,0)+R4C -> 1248 | K491: =ROUND((R1003C-R4C)/(R1003C3)*RC3,0)+R4C -> 17802 | O491: =RC[-4]-R[-1]C[-4] -> 36 | P491: =RC[-1]-R[-1]C[-1] -> 0
B492: =R[-3]C+1 -> 163 | C492: =R[-1]C+RC[1] -> 488 | D492: 1 | F492: =ROUND((R1003C-R4C)/(R1003C3)*RC3,0)+R4C -> 5757 | G492: =ROUND((R1003C-R4C)/(R1003C3)*RC3,0)+R4C -> 4499 | H492: =ROUND((R1003C-R4C)/(R1003C3)*RC3,0)+R4C -> 12733 | I492: =ROUND((R1003C-R4C)/(R1003C3)*RC3,0)+R4C -> 2313 | J492: =ROUND((R1003C-R4C)/(R1003C3)*RC3,0)+R4C -> 1251 | K492: =ROUND((R1003C-R4C)/(R1003C3)*RC3,0)+R4C -> 17838 | O492: =RC[-4]-R[-1]C[-4] -> 36 | P492: =RC[-1]-R[-1]C[-1] -> 0
B493: =R[-3]C+1 -> 164 | C493: =R[-1]C+RC[1] -> 489 | D493: 1 | F493: =ROUND((R1003C-R4C)/(R1003C3)*RC3,0)+R4C -> 5769 | G493: =ROUND((R1003C-R4C)/(R1003C3)*RC3,0)+R4C -> 4508 | H493: =ROUND((R1003C-R4C)/(R1003C3)*RC3,0)+R4C -> 12758 | I493: =ROUND((R1003C-R4C)/(R1003C3)*RC3,0)+R4C -> 2318 | J493: =ROUND((R1003C-R4C)/(R1003C3)*RC3,0)+R4C -> 1253 | K493: =ROUND((R1003C-R4C)/(R1003C3)*RC3,0)+R4C -> 17875 | O493: =RC[-4]-R[-1]C[-4] -> 37 | P493: =RC[-1]-R[-1]C[-1] -> 1
B494: =R[-3]C+1 -> 164 | C494: =R[-1]C+RC[1] -> 490 | D494: 1 | F494: =ROUND((R1003C-R4C)/(R1003C3)*RC3,0)+R4C -> 5781 | G494: =ROUND((R1003C-R4C)/(R1003C3)*RC3,0)+R4C -> 4517 | H494: =ROUND((R1003C-R4C)/(R1003C3)*RC3,0)+R4C -> 12784 | I494: =ROUND((R1003C-R4C)/(R1003C3)*RC3,0)+R4C -> 2322 | J494: =ROUND((R1003C-R4C)/(R1003C3)*RC3,0)+R4C -> 1256 | K494: =ROUND((R1003C-R4C)/(R1003C3)*RC3,0)+R4C -> 17911 | O494: =RC[-4]-R[-1]C[-4] -> 36 | P494: =RC[-1]-R[-1]C[-1] -> -1
B495: =R[-3]C+1 -> 164 | C495: =R[-1]C+RC[1] -> 491 | D495: 1 | F495: =ROUND((R1003C-R4C)/(R1003C3)*RC3,0)+R4C -> 5792 | G495: =ROUND((R1003C-R4C)/(R1003C3)*RC3,0)+R4C -> 4526 | H495: =ROUND((R1003C-R4C)/(R1003C3)*RC3,0)+R4C -> 12810 | I495: =ROUND((R1003C-R4C)/(R1003C3)*RC3,0)+R4C -> 2327 | J495: =ROUND((R1003C-R4C)/(R1003C3)*RC3,0)+R4C -> 1258 | K495: =ROUND((R1003C-R4C)/(R1003C3)*RC3,0)+R4C -> 17947 | O495: =RC[-4]-R[-1]C[-4] -> 36 | P495: =RC[-1]-R[-1]C[-1] -> 0
B496: =R[-3]C+1 -> 165 | C496: =R[-1]C+RC[1] -> 492 | D496: 1 | F496: =ROUND((R1003C-R4C)/(R1003C3)*RC3,0)+R4C -> 5804 | G496: =ROUND((R1003C-R4C)/(R1003C3)*RC3,0)+R4C -> 4535 | H496: =ROUND((R1003C-R4C)/(R1003C3)*RC3,0)+R4C -> 12836 | I496: =ROUND((R1003C-R4C)/(R1003C3)*RC3,0)+R4C -> 2332 | J496: =ROUND((R1003C-R4C)/(R1003C3)*RC3,0)+R4C -> 1261 | K496: =ROUND((R1003C-R4C)/(R1003C3)*RC3,0)+R4C -> 17983 | O496: =RC[-4]-R[-1]C[-4] -> 36 | P496: =RC[-1]-R[-1]C[-1] -> 0
B497: =R[-3]C+1 -> 165 | C497: =R[-1]C+RC[1] -> 493 | D497: 1 | F497: =ROUND((R1003C-R4C)/(R1003C3)*RC3,0)+R4C -> 5816 | G497: =ROUND((R1003C-R4C)/(R1003C3)*RC3,0)+R4C -> 4544 | H497: =ROUND((R1003C-R4C)/(R1003C3)*RC3,0)+R4C -> 12862 | I497: =ROUND((R1003C-R4C)/(R1003C3)*RC3,0)+R4C -> 2337 | J497: =ROUND((R1003C-R4C)/(R1003C3)*RC3,0)+R4C -> 1264 | K497: =ROUND((R1003C-R4C)/(R1003C3)*RC3,0)+R4C -> 18019 | O497: =RC[-4]-R[-1]C[-4] -> 36 | P497: =RC[-1]-R[-1]C[-1] -> 0
B498: =R[-3]C+1 -> 165 | C498: =R[-1]C+RC[1] -> 494 | D498: 1 | F498: =ROUND((R1003C-R4C)/(R1003C3)*RC3,0)+R4C -> 5827 | G498: =ROUND((R1003C-R4C)/(R1003C3)*RC3,0)+R4C -> 4553 | H498: =ROUND((R1003C-R4C)/(R1003C3)*RC3,0)+R4C -> 12887 | I498: =ROUND((R1003C-R4C)/(R1003C3)*RC3,0)+R4C -> 2341 | J498: =ROUND((R1003C-R4C)/(R1003C3)*RC3,0)+R4C -> 1266 | K498: =ROUND((R1003C-R4C)/(R1003C3)*RC3,0)+R4C -> 18056 | O498: =RC[-4]-R[-1]C[-4] -> 37 | P498: =RC[-1]-R[-1]C[-1] -> 1
B499: =R[-3]C+1 -> 166 | C499: =R[-1]C+RC[1] -> 495 | D499: 1 | F499: =ROUND((R1003C-R4C)/(R1003C3)*RC3,0)+R4C -> 5839 | G499: =ROUND((R1003C-R4C)/(R1003C3)*RC3,0)+R4C -> 4562 | H499: =ROUND((R1003C-R4C)/(R1003C3)*RC3,0)+R4C -> 12913 | I499: =ROUND((R1003C-R4C)/(R1003C3)*RC3,0)+R4C -> 2346 | J499: =ROUND((R1003C-R4C)/(R1003C3)*RC3,0)+R4C -> 1269 | K499: =ROUND((R1003C-R4C)/(R1003C3)*RC3,0)+R4C -> 18092 | O499: =RC[-4]-R[-1]C[-4] -> 36 | P499: =RC[-1]-R[-1]C[-1] -> -1
B500: =R[-3]C+1 -> 166 | C500: =R[-1]C+RC[1] -> 496 | D500: 1 | F500: =ROUND((R1003C-R4C)/(R1003C3)*RC3,0)+R4C -> 5851 | G500: =ROUND((R1003C-R4C)/(R1003C3)*RC3,0)+R4C -> 4572 | H500: =ROUND((R1003C-R4C)/(R1003C3)*RC3,0)+R4C -> 12939 | I500: =ROUND((R1003C-R4C)/(R1003C3)*RC3,0)+R4C -> 2351 | J500: =ROUND((R1003C-R4C)/(R1003C3)*RC3,0)+R4C -> 1271 | K500: =ROUND((R1003C-R4C)/(R1003C3)*RC3,0)+R4C -> 18128 | O500: =RC[-4]-R[-1]C[-4] -> 36 | P500: =RC[-1]-R[-1]C[-1] -> 0
B501: =R[-3]C+1 -> 166 | C501: =R[-1]C+RC[1] -> 497 | D501: 1 | F501: =ROUND((R1003C-R4C)/(R1003C3)*RC3,0)+R4C -> 5862 | G501: =ROUND((R1003C-R4C)/(R1003C3)*RC3,0)+R4C -> 4581 | H501: =ROUND((R1003C-R4C)/(R1003C3)*RC3,0)+R4C -> 12965 | I501: =ROUND((R1003C-R4C)/(R1003C3)*RC3,0)+R4C -> 2355 | J501: =ROUND((R1003C-R4C)/(R1003C3)*RC3,0)+R4C -> 1274 | K501: =ROUND((R1003C-R4C)/(R1003C3)*RC3,0)+R4C -> 18164 | O501: =RC[-4]-R[-1]C[-4] -> 36 | P501: =RC[-1]-R[-1]C[-1] -> 0
B502: =R[-3]C+1 -> 167 | C502: =R[-1]C+RC[1] -> 498 | D502: 1 | F502: =ROUND((R1003C-R4C)/(R1003C3)*RC3,0)+R4C -> 5874 | G502: =ROUND((R1003C-R4C)/(R1003C3)*RC3,0)+R4C -> 4590 | H502: =ROUND((R1003C-R4C)/(R1003C3)*RC3,0)+R4C -> 12991 | I502: =ROUND((R1003C-R4C)/(R1003C3)*RC3,0)+R4C -> 2360 | J502: =ROUND((R1003C-R4C)/(R1003C3)*RC3,0)+R4C -> 1276 | K502: =ROUND((R1003C-R4C)/(R1003C3)*RC3,0)+R4C -> 18200 | O502: =RC[-4]-R[-1]C[-4] -> 36 | P502: =RC[-1]-R[-1]C[-1] -> 0
B503: =R[-3]C+1 -> 167 | C503: =R[-1]C+RC[1] -> 499 | D503: 1 | F503: =ROUND((R1003C-R4C)/(R1003C3)*RC3,0)+R4C -> 5886 | G503: =ROUND((R1003C-R4C)/(R1003C3)*RC3,0)+R4C -> 4599 | H503: =ROUND((R1003C-R4C)/(R1003C3)*RC3,0)+R4C -> 13017 | I503: =ROUND((R1003C-R4C)/(R1003C3)*RC3,0)+R4C -> 2365 | J503: =ROUND((R1003C-R4C)/(R1003C3)*RC3,0)+R4C -> 1279 | K503: =ROUND((R1003C-R4C)/(R1003C3)*RC3,0)+R4C -> 18236 | O503: =RC[-4]-R[-1]C[-4] -> 36 | P503: =RC[-1]-R[-1]C[-1] -> 0
B504: =R[-3]C+1 -> 167 | C504: =R[-1]C+RC[1] -> 500 | D504: 1 | F504: =ROUND((R1003C-R4C)/(R1003C3)*RC3,0)+R4C -> 5897 | G504: =ROUND((R1003C-R4C)/(R1003C3)*RC3,0)+R4C -> 4608 | H504: =ROUND((R1003C-R4C)/(R1003C3)*RC3,0)+R4C -> 13042 | I504: =ROUND((R1003C-R4C)/(R1003C3)*RC3,0)+R4C -> 2369 | J504: =ROUND((R1003C-R4C)/(R1003C3)*RC3,0)+R4C -> 1281 | K504: =ROUND((R1003C-R4C)/(R1003C3)*RC3,0)+R4C -> 18273 | O504: =RC[-4]-R[-1]C[-4] -> 37 | P504: =RC[-1]-R[-1]C[-1] -> 1
B505: =R[-3]C+1 -> 168 | C505: =R[-1]C+RC[1] -> 501 | D505: 1 | F505: =ROUND((R1003C-R4C)/(R1003C3)*RC3,0)+R4C -> 5909 | G505: =ROUND((R1003C-R4C)/(R1003C3)*RC3,0)+R4C -> 4617 | H505: =ROUND((R1003C-R4C)/(R1003C3)*RC3,0)+R4C -> 13068 | I505: =ROUND((R1003C-R4C)/(R1003C3)*RC3,0)+R4C -> 2374 | J505: =ROUND((R1003C-R4C)/(R1003C3)*RC3,0)+R4C -> 1284 | K505: =ROUND((R1003C-R4C)/(R1003C3)*RC3,0)+R4C -> 18309 | O505: =RC[-4]-R[-1]C[-4] -> 36 | P505: =RC[-1]-R[-1]C[-1] -> -1
B506: =R[-3]C+1 -> 168 | C506: =R[-1]C+RC[1] -> 502 | D506: 1 | F506: =ROUND((R1003C-R4C)/(R1003C3)*RC3,0)+R4C -> 5921 | G506: =ROUND((R1003C-R4C)/(R1003C3)*RC3,0)+R4C -> 4626 | H506: =ROUND((R1003C-R4C)/(R1003C3)*RC3,0)+R4C -> 13094 | I506: =ROUND((R1003C-R4C)/(R1003C3)*RC3,0)+R4C -> 2379 | J506: =ROUND((R1003C-R4C)/(R1003C3)*RC3,0)+R4C -> 1286 | K506: =ROUND((R1003C-R4C)/(R1003C3)*RC3,0)+R4C -> 18345 | O506: =RC[-4]-R[-1]C[-4] -> 36 | P506: =RC[-1]-R[-1]C[-1] -> 0
B507: =R[-3]C+1 -> 168 | C507: =R[-1]C+RC[1] -> 503 | D507: 1 | F507: =ROUND((R1003C-R4C)/(R1003C3)*RC3,0)+R4C -> 5932 | G507: =ROUND((R1003C-R4C)/(R1003C3)*RC3,0)+R4C -> 4635 | H507: =ROUND((R1003C-R4C)/(R1003C3)*RC3,0)+R4C -> 13120 | I507: =ROUND((R1003C-R4C)/(R1003C3)*RC3,0)+R4C -> 2383 | J507: =ROUND((R1003C-R4C)/(R1003C3)*RC3,0)+R4C -> 1289 | K507: =ROUND((R1003C-R4C)/(R1003C3)*RC3,0)+R4C -> 18381 | O507: =RC[-4]-R[-1]C[-4] -> 36 | P507: =RC[-1]-R[-1]C[-1] -> 0
B508: =R[-3]C+1 -> 169 | C508: =R[-1]C+RC[1] -> 504 | D508: 1 | F508: =ROUND((R1003C-R4C)/(R1003C3)*RC3,0)+R4C -> 5944 | G508: =ROUND((R1003C-R4C)/(R1003C3)*RC3,0)+R4C -> 4645 | H508: =ROUND((R1003C-R4C)/(R1003C3)*RC3,0)+R4C -> 13146 | I508: =ROUND((R1003C-R4C)/(R1003C3)*RC3,0)+R4C -> 2388 | J508: =ROUND((R1003C-R4C)/(R1003C3)*RC3,0)+R4C -> 1291 | K508: =ROUND((R1003C-R4C)/(R1003C3)*RC3,0)+R4C -> 18417 | O508: =RC[-4]-R[-1]C[-4] -> 36 | P508: =RC[-1]-R[-1]C[-1] -> 0
B509: =R[-3]C+1 -> 169 | C509: =R[-1]C+RC[1] -> 505 | D509: 1 | F509: =ROUND((R1003C-R4C)/(R1003C3)*RC3,0)+R4C -> 5956 | G509: =ROUND((R1003C-R4C)/(R1003C3)*RC3,0)+R4C -> 4654 | H509: =ROUND((R1003C-R4C)/(R1003C3)*RC3,0)+R4C -> 13172 | I509: =ROUND((R1003C-R4C)/(R1003C3)*RC3,0)+R4C -> 2393 | J509: =ROUND((R1003C-R4C)/(R1003C3)*RC3,0)+R4C -> 1294 | K509: =ROUND((R1003C-R4C)/(R1003C3)*RC3,0)+R4C -> 18453 | O509: =RC[-4]-R[-1]C[-4] -> 36 | P509: =RC[-1]-R[-1]C[-1] -> 0
B510: =R[-3]C+1 -> 169 | C510: =R[-1]C+RC[1] -> 506 | D510: 1 | F510: =ROUND((R1003C-R4C)/(R1003C3)*RC3,0)+R4C -> 5967 | G510: =ROUND((R1003C-R4C)/(R1003C3)*RC3,0)+R4C -> 4663 | H510: =ROUND((R1003C-R4C)/(R1003C3)*RC3,0)+R4C -> 13197 | I510: =ROUND((R1003C-R4C)/(R1003C3)*RC3,0)+R4C -> 2397 | J510: =ROUND((R1003C-R4C)/(R1003C3)*RC3,0)+R4C -> 1296 | K510: =ROUND((R1003C-R4C)/(R1003C3)*RC3,0)+R4C -> 18490 | O510: =RC[-4]-R[-1]C[-4] -> 37 | P510: =RC[-1]-R[-1]C[-1] -> 1
B511: =R[-3]C+1 -> 170 | C511: =R[-1]C+RC[1] -> 507 | D511: 1 | F511: =ROUND((R1003C-R4C)/(R1003C3)*RC3,0)+R4C -> 5979 | G511: =ROUND((R1003C-R4C)/(R1003C3)*RC3,0)+R4C -> 4672 | H511: =ROUND((R1003C-R4C)/(R1003C3)*RC3,0)+R4C -> 13223 | I511: =ROUND((R1003C-R4C)/(R1003C3)*RC3,0)+R4C -> 2402 | J511: =ROUND((R1003C-R4C)/(R1003C3)*RC3,0)+R4C -> 1299 | K511: =ROUND((R1003C-R4C)/(R1003C3)*RC3,0)+R4C -> 18526 | O511: =RC[-4]-R[-1]C[-4] -> 36 | P511: =RC[-1]-R[-1]C[-1] -> -1
B512: =R[-3]C+1 -> 170 | C512: =R[-1]C+RC[1] -> 508 | D512: 1 | F512: =ROUND((R1003C-R4C)/(R1003C3)*RC3,0)+R4C -> 5991 | G512: =ROUND((R1003C-R4C)/(R1003C3)*RC3,0)+R4C -> 4681 | H512: =ROUND((R1003C-R4C)/(R1003C3)*RC3,0)+R4C -> 13249 | I512: =ROUND((R1003C-R4C)/(R1003C3)*RC3,0)+R4C -> 2407 | J512: =ROUND((R1003C-R4C)/(R1003C3)*RC3,0)+R4C -> 1302 | K512: =ROUND((R1003C-R4C)/(R1003C3)*RC3,0)+R4C -> 18562 | O512: =RC[-4]-R[-1]C[-4] -> 36 | P512: =RC[-1]-R[-1]C[-1] -> 0
B513: =R[-3]C+1 -> 170 | C513: =R[-1]C+RC[1] -> 509 | D513: 1 | F513: =ROUND((R1003C-R4C)/(R1003C3)*RC3,0)+R4C -> 6002 | G513: =ROUND((R1003C-R4C)/(R1003C3)*RC3,0)+R4C -> 4690 | H513: =ROUND((R1003C-R4C)/(R1003C3)*RC3,0)+R4C -> 13275 | I513: =ROUND((R1003C-R4C)/(R1003C3)*RC3,0)+R4C -> 2412 | J513: =ROUND((R1003C-R4C)/(R1003C3)*RC3,0)+R4C -> 1304 | K513: =ROUND((R1003C-R4C)/(R1003C3)*RC3,0)+R4C -> 18598 | O513: =RC[-4]-R[-1]C[-4] -> 36 | P513: =RC[-1]-R[-1]C[-1] -> 0
B514: =R[-3]C+1 -> 171 | C514: =R[-1]C+RC[1] -> 510 | D514: 1 | F514: =ROUND((R1003C-R4C)/(R1003C3)*RC3,0)+R4C -> 6014 | G514: =ROUND((R1003C-R4C)/(R1003C3)*RC3,0)+R4C -> 4699 | H514: =ROUND((R1003C-R4C)/(R1003C3)*RC3,0)+R4C -> 13301 | I514: =ROUND((R1003C-R4C)/(R1003C3)*RC3,0)+R4C -> 2416 | J514: =ROUND((R1003C-R4C)/(R1003C3)*RC3,0)+R4C -> 1307 | K514: =ROUND((R1003C-R4C)/(R1003C3)*RC3,0)+R4C -> 18634 | O514: =RC[-4]-R[-1]C[-4] -> 36 | P514: =RC[-1]-R[-1]C[-1] -> 0
B515: =R[-3]C+1 -> 171 | C515: =R[-1]C+RC[1] -> 511 | D515: 1 | F515: =ROUND((R1003C-R4C)/(R1003C3)*RC3,0)+R4C -> 6026 | G515: =ROUND((R1003C-R4C)/(R1003C3)*RC3,0)+R4C -> 4708 | H515: =ROUND((R1003C-R4C)/(R1003C3)*RC3,0)+R4C -> 13326 | I515: =ROUND((R1003C-R4C)/(R1003C3)*RC3,0)+R4C -> 2421 | J515: =ROUND((R1003C-R4C)/(R1003C3)*RC3,0)+R4C -> 1309 | K515: =ROUND((R1003C-R4C)/(R1003C3)*RC3,0)+R4C -> 18671 | O515: =RC[-4]-R[-1]C[-4] -> 37 | P515: =RC[-1]-R[-1]C[-1] -> 1
B516: =R[-3]C+1 -> 171 | C516: =R[-1]C+RC[1] -> 512 | D516: 1 | F516: =ROUND((R1003C-R4C)/(R1003C3)*RC3,0)+R4C -> 6037 | G516: =ROUND((R1003C-R4C)/(R1003C3)*RC3,0)+R4C -> 4718 | H516: =ROUND((R1003C-R4C)/(R1003C3)*RC3,0)+R4C -> 13352 | I516: =ROUND((R1003C-R4C)/(R1003C3)*RC3,0)+R4C -> 2426 | J516: =ROUND((R1003C-R4C)/(R1003C3)*RC3,0)+R4C -> 1312 | K516: =ROUND((R1003C-R4C)/(R1003C3)*RC3,0)+R4C -> 18707 | O516: =RC[-4]-R[-1]C[-4] -> 36 | P516: =RC[-1]-R[-1]C[-1] -> -1
B517: =R[-3]C+1 -> 172 | C517: =R[-1]C+RC[1] -> 513 | D517: 1 | F517: =ROUND((R1003C-R4C)/(R1003C3)*RC3,0)+R4C -> 6049 | G517: =ROUND((R1003C-R4C)/(R1003C3)*RC3,0)+R4C -> 4727 | H517: =ROUND((R1003C-R4C)/(R1003C3)*RC3,0)+R4C -> 13378 | I517: =ROUND((R1003C-R4C)/(R1003C3)*RC3,0)+R4C -> 2430 | J517: =ROUND((R1003C-R4C)/(R1003C3)*RC3,0)+R4C -> 1314 | K517: =ROUND((R1003C-R4C)/(R1003C3)*RC3,0)+R4C -> 18743 | O517: =RC[-4]-R[-1]C[-4] -> 36 | P517: =RC[-1]-R[-1]C[-1] -> 0
B518: =R[-3]C+1 -> 172 | C518: =R[-1]C+RC[1] -> 514 | D518: 1 | F518: =ROUND((R1003C-R4C)/(R1003C3)*RC3,0)+R4C -> 6061 | G518: =ROUND((R1003C-R4C)/(R1003C3)*RC3,0)+R4C -> 4736 | H518: =ROUND((R1003C-R4C)/(R1003C3)*RC3,0)+R4C -> 13404 | I518: =ROUND((R1003C-R4C)/(R1003C3)*RC3,0)+R4C -> 2435 | J518: =ROUND((R1003C-R4C)/(R1003C3)*RC3,0)+R4C -> 1317 | K518: =ROUND((R1003C-R4C)/(R1003C3)*RC3,0)+R4C -> 18779 | O518: =RC[-4]-R[-1]C[-4] -> 36 | P518: =RC[-1]-R[-1]C[-1] -> 0
B519: =R[-3]C+1 -> 172 | C519: =R[-1]C+RC[1] -> 515 | D519: 1 | F519: =ROUND((R1003C-R4C)/(R1003C3)*RC3,0)+R4C -> 6072 | G519: =ROUND((R1003C-R4C)/(R1003C3)*RC3,0)+R4C -> 4745 | H519: =ROUND((R1003C-R4C)/(R1003C3)*RC3,0)+R4C -> 13430 | I519: =ROUND((R1003C-R4C)/(R1003C3)*RC3,0)+R4C -> 2440 | J519: =ROUND((R1003C-R4C)/(R1003C3)*RC3,0)+R4C -> 1319 | K519: =ROUND((R1003C-R4C)/(R1003C3)*RC3,0)+R4C -> 18815 | O519: =RC[-4]-R[-1]C[-4] -> 36 | P519: =RC[-1]-R[-1]C[-1] -> 0
B520: =R[-3]C+1 -> 173 | C520: =R[-1]C+RC[1] -> 516 | D520: 1 | F520: =ROUND((R1003C-R4C)/(R1003C3)*RC3,0)+R4C -> 6084 | G520: =ROUND((R1003C-R4C)/(R1003C3)*RC3,0)+R4C -> 4754 | H520: =ROUND((R1003C-R4C)/(R1003C3)*RC3,0)+R4C -> 13456 | I520: =ROUND((R1003C-R4C)/(R1003C3)*RC3,0)+R4C -> 2444 | J520: =ROUND((R1003C-R4C)/(R1003C3)*RC3,0)+R4C -> 1322 | K520: =ROUND((R1003C-R4C)/(R1003C3)*RC3,0)+R4C -> 18851 | O520: =RC[-4]-R[-1]C[-4] -> 36 | P520: =RC[-1]-R[-1]C[-1] -> 0
B521: =R[-3]C+1 -> 173 | C521: =R[-1]C+RC[1] -> 517 | D521: 1 | F521: =ROUND((R1003C-R4C)/(R1003C3)*RC3,0)+R4C -> 6096 | G521: =ROUND((R1003C-R4C)/(R1003C3)*RC3,0)+R4C -> 4763 | H521: =ROUND((R1003C-R4C)/(R1003C3)*RC3,0)+R4C -> 13481 | I521: =ROUND((R1003C-R4C)/(R1003C3)*RC3,0)+R4C -> 2449 | J521: =ROUND((R1003C-R4C)/(R1003C3)*RC3,0)+R4C -> 1324 | K521: =ROUND((R1003C-R4C)/(R1003C3)*RC3,0)+R4C -> 18888 | O521: =RC[-4]-R[-1]C[-4] -> 37 | P521: =RC[-1]-R[-1]C[-1] -> 1
B522: =R[-3]C+1 -> 173 | C522: =R[-1]C+RC[1] -> 518 | D522: 1 | F522: =ROUND((R1003C-R4C)/(R1003C3)*RC3,0)+R4C -> 6108 | G522: =ROUND((R1003C-R4C)/(R1003C3)*RC3,0)+R4C -> 4772 | H522: =ROUND((R1003C-R4C)/(R1003C3)*RC3,0)+R4C -> 13507 | I522: =ROUND((R1003C-R4C)/(R1003C3)*RC3,0)+R4C -> 2454 | J522: =ROUND((R1003C-R4C)/(R1003C3)*RC3,0)+R4C -> 1327 | K522: =ROUND((R1003C-R4C)/(R1003C3)*RC3,0)+R4C -> 18924 | O522: =RC[-4]-R[-1]C[-4] -> 36 | P522: =RC[-1]-R[-1]C[-1] -> -1
B523: =R[-3]C+1 -> 174 | C523: =R[-1]C+RC[1] -> 519 | D523: 1 | F523: =ROUND((R1003C-R4C)/(R1003C3)*RC3,0)+R4C -> 6119 | G523: =ROUND((R1003C-R4C)/(R1003C3)*RC3,0)+R4C -> 4781 | H523: =ROUND((R1003C-R4C)/(R1003C3)*RC3,0)+R4C -> 13533 | I523: =ROUND((R1003C-R4C)/(R1003C3)*RC3,0)+R4C -> 2458 | J523: =ROUND((R1003C-R4C)/(R1003C3)*RC3,0)+R4C -> 1329 | K523: =ROUND((R1003C-R4C)/(R1003C3)*RC3,0)+R4C -> 18960 | O523: =RC[-4]-R[-1]C[-4] -> 36 | P523: =RC[-1]-R[-1]C[-1] -> 0
B524: =R[-3]C+1 -> 174 | C524: =R[-1]C+RC[1] -> 520 | D524: 1 | F524: =ROUND((R1003C-R4C)/(R1003C3)*RC3,0)+R4C -> 6131 | G524: =ROUND((R1003C-R4C)/(R1003C3)*RC3,0)+R4C -> 4791 | H524: =ROUND((R1003C-R4C)/(R1003C3)*RC3,0)+R4C -> 13559 | I524: =ROUND((R1003C-R4C)/(R1003C3)*RC3,0)+R4C -> 2463 | J524: =ROUND((R1003C-R4C)/(R1003C3)*RC3,0)+R4C -> 1332 | K524: =ROUND((R1003C-R4C)/(R1003C3)*RC3,0)+R4C -> 18996 | O524: =RC[-4]-R[-1]C[-4] -> 36 | P524: =RC[-1]-R[-1]C[-1] -> 0
B525: =R[-3]C+1 -> 174 | C525: =R[-1]C+RC[1] -> 521 | D525: 1 | F525: =ROUND((R1003C-R4C)/(R1003C3)*RC3,0)+R4C -> 6143 | G525: =ROUND((R1003C-R4C)/(R1003C3)*RC3,0)+R4C -> 4800 | H525: =ROUND((R1003C-R4C)/(R1003C3)*RC3,0)+R4C -> 13585 | I525: =ROUND((R1003C-R4C)/(R1003C3)*RC3,0)+R4C -> 2468 | J525: =ROUND((R1003C-R4C)/(R1003C3)*RC3,0)+R4C -> 1335 | K525: =ROUND((R1003C-R4C)/(R1003C3)*RC3,0)+R4C -> 19032 | O525: =RC[-4]-R[-1]C[-4] -> 36 | P525: =RC[-1]-R[-1]C[-1] -> 0
B526: =R[-3]C+1 -> 175 | C526: =R[-1]C+RC[1] -> 522 | D526: 1 | F526: =ROUND((R1003C-R4C)/(R1003C3)*RC3,0)+R4C -> 6154 | G526: =ROUND((R1003C-R4C)/(R1003C3)*RC3,0)+R4C -> 4809 | H526: =ROUND((R1003C-R4C)/(R1003C3)*RC3,0)+R4C -> 13611 | I526: =ROUND((R1003C-R4C)/(R1003C3)*RC3,0)+R4C -> 2473 | J526: =ROUND((R1003C-R4C)/(R1003C3)*RC3,0)+R4C -> 1337 | K526: =ROUND((R1003C-R4C)/(R1003C3)*RC3,0)+R4C -> 19069 | O526: =RC[-4]-R[-1]C[-4] -> 37 | P526: =RC[-1]-R[-1]C[-1] -> 1
B527: =R[-3]C+1 -> 175 | C527: =R[-1]C+RC[1] -> 523 | D527: 1 | F527: =ROUND((R1003C-R4C)/(R1003C3)*RC3,0)+R4C -> 6166 | G527: =ROUND((R1003C-R4C)/(R1003C3)*RC3,0)+R4C -> 4818 | H527: =ROUND((R1003C-R4C)/(R1003C3)*RC3,0)+R4C -> 13636 | I527: =ROUND((R1003C-R4C)/(R1003C3)*RC3,0)+R4C -> 2477 | J527: =ROUND((R1003C-R4C)/(R1003C3)*RC3,0)+R4C -> 1340 | K527: =ROUND((R1003C-R4C)/(R1003C3)*RC3,0)+R4C -> 19105 | O527: =RC[-4]-R[-1]C[-4] -> 36 | P527: =RC[-1]-R[-1]C[-1] -> -1
B528: =R[-3]C+1 -> 175 | C528: =R[-1]C+RC[1] -> 524 | D528: 1 | F528: =ROUND((R1003C-R4C)/(R1003C3)*RC3,0)+R4C -> 6178 | G528: =ROUND((R1003C-R4C)/(R1003C3)*RC3,0)+R4C -> 4827 | H528: =ROUND((R1003C-R4C)/(R1003C3)*RC3,0)+R4C -> 13662 | I528: =ROUND((R1003C-R4C)/(R1003C3)*RC3,0)+R4C -> 2482 | J528: =ROUND((R1003C-R4C)/(R1003C3)*RC3,0)+R4C -> 1342 | K528: =ROUND((R1003C-R4C)/(R1003C3)*RC3,0)+R4C -> 19141 | O528: =RC[-4]-R[-1]C[-4] -> 36 | P528: =RC[-1]-R[-1]C[-1] -> 0
B529: =R[-3]C+1 -> 176 | C529: =R[-1]C+RC[1] -> 525 | D529: 1 | F529: =ROUND((R1003C-R4C)/(R1003C3)*RC3,0)+R4C -> 6189 | G529: =ROUND((R1003C-R4C)/(R1003C3)*RC3,0)+R4C -> 4836 | H529: =ROUND((R1003C-R4C)/(R1003C3)*RC3,0)+R4C -> 13688 | I529: =ROUND((R1003C-R4C)/(R1003C3)*RC3,0)+R4C -> 2487 | J529: =ROUND((R1003C-R4C)/(R1003C3)*RC3,0)+R4C -> 1345 | K529: =ROUND((R1003C-R4C)/(R1003C3)*RC3,0)+R4C -> 19177 | O529: =RC[-4]-R[-1]C[-4] -> 36 | P529: =RC[-1]-R[-1]C[-1] -> 0
B530: =R[-3]C+1 -> 176 | C530: =R[-1]C+RC[1] -> 526 | D530: 1 | F530: =ROUND((R1003C-R4C)/(R1003C3)*RC3,0)+R4C -> 6201 | G530: =ROUND((R1003C-R4C)/(R1003C3)*RC3,0)+R4C -> 4845 | H530: =ROUND((R1003C-R4C)/(R1003C3)*RC3,0)+R4C -> 13714 | I530: =ROUND((R1003C-R4C)/(R1003C3)*RC3,0)+R4C -> 2491 | J530: =ROUND((R1003C-R4C)/(R1003C3)*RC3,0)+R4C -> 1347 | K530: =ROUND((R1003C-R4C)/(R1003C3)*RC3,0)+R4C -> 19213 | O530: =RC[-4]-R[-1]C[-4] -> 36 | P530: =RC[-1]-R[-1]C[-1] -> 0
B531: =R[-3]C+1 -> 176 | C531: =R[-1]C+RC[1] -> 527 | D531: 1 | F531: =ROUND((R1003C-R4C)/(R1003C3)*RC3,0)+R4C -> 6213 | G531: =ROUND((R1003C-R4C)/(R1003C3)*RC3,0)+R4C -> 4854 | H531: =ROUND((R1003C-R4C)/(R1003C3)*RC3,0)+R4C -> 13740 | I531: =ROUND((R1003C-R4C)/(R1003C3)*RC3,0)+R4C -> 2496 | J531: =ROUND((R1003C-R4C)/(R1003C3)*RC3,0)+R4C -> 1350 | K531: =ROUND((R1003C-R4C)/(R1003C3)*RC3,0)+R4C -> 19249 | O531: =RC[-4]-R[-1]C[-4] -> 36 | P531: =RC[-1]-R[-1]C[-1] -> 0
B532: =R[-3]C+1 -> 177 | C532: =R[-1]C+RC[1] -> 528 | D532: 1 | F532: =ROUND((R1003C-R4C)/(R1003C3)*RC3,0)+R4C -> 6224 | G532: =ROUND((R1003C-R4C)/(R1003C3)*RC3,0)+R4C -> 4864 | H532: =ROUND((R1003C-R4C)/(R1003C3)*RC3,0)+R4C -> 13766 | I532: =ROUND((R1003C-R4C)/(R1003C3)*RC3,0)+R4C -> 2501 | J532: =ROUND((R1003C-R4C)/(R1003C3)*RC3,0)+R4C -> 1352 | K532: =ROUND((R1003C-R4C)/(R1003C3)*RC3,0)+R4C -> 19286 | O532: =RC[-4]-R[-1]C[-4] -> 37 | P532: =RC[-1]-R[-1]C[-1] -> 1
B533: =R[-3]C+1 -> 177 | C533: =R[-1]C+RC[1] -> 529 | D533: 1 | F533: =ROUND((R1003C-R4C)/(R1003C3)*RC3,0)+R4C -> 6236 | G533: =ROUND((R1003C-R4C)/(R1003C3)*RC3,0)+R4C -> 4873 | H533: =ROUND((R1003C-R4C)/(R1003C3)*RC3,0)+R4C -> 13791 | I533: =ROUND((R1003C-R4C)/(R1003C3)*RC3,0)+R4C -> 2505 | J533: =ROUND((R1003C-R4C)/(R1003C3)*RC3,0)+R4C -> 1355 | K533: =ROUND((R1003C-R4C)/(R1003C3)*RC3,0)+R4C -> 19322 | O533: =RC[-4]-R[-1]C[-4] -> 36 | P533: =RC[-1]-R[-1]C[-1] -> -1
B534: =R[-3]C+1 -> 177 | C534: =R[-1]C+RC[1] -> 530 | D534: 1 | F534: =ROUND((R1003C-R4C)/(R1003C3)*RC3,0)+R4C -> 6248 | G534: =ROUND((R1003C-R4C)/(R1003C3)*RC3,0)+R4C -> 4882 | H534: =ROUND((R1003C-R4C)/(R1003C3)*RC3,0)+R4C -> 13817 | I534: =ROUND((R1003C-R4C)/(R1003C3)*RC3,0)+R4C -> 2510 | J534: =ROUND((R1003C-R4C)/(R1003C3)*RC3,0)+R4C -> 1357 | K534: =ROUND((R1003C-R4C)/(R1003C3)*RC3,0)+R4C -> 19358 | O534: =RC[-4]-R[-1]C[-4] -> 36 | P534: =RC[-1]-R[-1]C[-1] -> 0
B535: =R[-3]C+1 -> 178 | C535: =R[-1]C+RC[1] -> 531 | D535: 1 | F535: =ROUND((R1003C-R4C)/(R1003C3)*RC3,0)+R4C -> 6259 | G535: =ROUND((R1003C-R4C)/(R1003C3)*RC3,0)+R4C -> 4891 | H535: =ROUND((R1003C-R4C)/(R1003C3)*RC3,0)+R4C -> 13843 | I535: =ROUND((R1003C-R4C)/(R1003C3)*RC3,0)+R4C -> 2515 | J535: =ROUND((R1003C-R4C)/(R1003C3)*RC3,0)+R4C -> 1360 | K535: =ROUND((R1003C-R4C)/(R1003C3)*RC3,0)+R4C -> 19394 | O535: =RC[-4]-R[-1]C[-4] -> 36 | P535: =RC[-1]-R[-1]C[-1] -> 0
B536: =R[-3]C+1 -> 178 | C536: =R[-1]C+RC[1] -> 532 | D536: 1 | F536: =ROUND((R1003C-R4C)/(R1003C3)*RC3,0)+R4C -> 6271 | G536: =ROUND((R1003C-R4C)/(R1003C3)*RC3,0)+R4C -> 4900 | H536: =ROUND((R1003C-R4C)/(R1003C3)*RC3,0)+R4C -> 13869 | I536: =ROUND((R1003C-R4C)/(R1003C3)*RC3,0)+R4C -> 2519 | J536: =ROUND((R1003C-R4C)/(R1003C3)*RC3,0)+R4C -> 1362 | K536: =ROUND((R1003C-R4C)/(R1003C3)*RC3,0)+R4C -> 19430 | O536: =RC[-4]-R[-1]C[-4] -> 36 | P536: =RC[-1]-R[-1]C[-1] -> 0
B537: =R[-3]C+1 -> 178 | C537: =R[-1]C+RC[1] -> 533 | D537: 1 | F537: =ROUND((R1003C-R4C)/(R1003C3)*RC3,0)+R4C -> 6283 | G537: =ROUND((R1003C-R4C)/(R1003C3)*RC3,0)+R4C -> 4909 | H537: =ROUND((R1003C-R4C)/(R1003C3)*RC3,0)+R4C -> 13895 | I537: =ROUND((R1003C-R4C)/(R1003C3)*RC3,0)+R4C -> 2524 | J537: =ROUND((R1003C-R4C)/(R1003C3)*RC3,0)+R4C -> 1365 | K537: =ROUND((R1003C-R4C)/(R1003C3)*RC3,0)+R4C -> 19467 | O537: =RC[-4]-R[-1]C[-4] -> 37 | P537: =RC[-1]-R[-1]C[-1] -> 1
B538: =R[-3]C+1 -> 179 | C538: =R[-1]C+RC[1] -> 534 | D538: 1 | F538: =ROUND((R1003C-R4C)/(R1003C3)*RC3,0)+R4C -> 6294 | G538: =ROUND((R1003C-R4C)/(R1003C3)*RC3,0)+R4C -> 4918 | H538: =ROUND((R1003C-R4C)/(R1003C3)*RC3,0)+R4C -> 13920 | I538: =ROUND((R1003C-R4C)/(R1003C3)*RC3,0)+R4C -> 2529 | J538: =ROUND((R1003C-R4C)/(R1003C3)*RC3,0)+R4C -> 1368 | K538: =ROUND((R1003C-R4C)/(R1003C3)*RC3,0)+R4C -> 19503 | O538: =RC[-4]-R[-1]C[-4] -> 36 | P538: =RC[-1]-R[-1]C[-1] -> -1
B539: =R[-3]C+1 -> 179 | C539: =R[-1]C+RC[1] -> 535 | D539: 1 | F539: =ROUND((R1003C-R4C)/(R1003C3)*RC3,0)+R4C -> 6306 | G539: =ROUND((R1003C-R4C)/(R1003C3)*RC3,0)+R4C -> 4927 | H539: =ROUND((R1003C-R4C)/(R1003C3)*RC3,0)+R4C -> 13946 | I539: =ROUND((R1003C-R4C)/(R1003C3)*RC3,0)+R4C -> 2534 | J539: =ROUND((R1003C-R4C)/(R1003C3)*RC3,0)+R4C -> 1370 | K539: =ROUND((R1003C-R4C)/(R1003C3)*RC3,0)+R4C -> 19539 | O539: =RC[-4]-R[-1]C[-4] -> 36 | P539: =RC[-1]-R[-1]C[-1] -> 0
B540: =R[-3]C+1 -> 179 | C540: =R[-1]C+RC[1] -> 536 | D540: 1 | F540: =ROUND((R1003C-R4C)/(R1003C3)*RC3,0)+R4C -> 6318 | G540: =ROUND((R1003C-R4C)/(R1003C3)*RC3,0)+R4C -> 4937 | H540: =ROUND((R1003C-R4C)/(R1003C3)*RC3,0)+R4C -> 13972 | I540: =ROUND((R1003C-R4C)/(R1003C3)*RC3,0)+R4C -> 2538 | J540: =ROUND((R1003C-R4C)/(R1003C3)*RC3,0)+R4C -> 1373 | K540: =ROUND((R1003C-R4C)/(R1003C3)*RC3,0)+R4C -> 19575 | O540: =RC[-4]-R[-1]C[-4] -> 36 | P540: =RC[-1]-R[-1]C[-1] -> 0
B541: =R[-3]C+1 -> 180 | C541: =R[-1]C+RC[1] -> 537 | D541: 1 | F541: =ROUND((R1003C-R4C)/(R1003C3)*RC3,0)+R4C -> 6329 | G541: =ROUND((R1003C-R4C)/(R1003C3)*RC3,0)+R4C -> 4946 | H541: =ROUND((R1003C-R4C)/(R1003C3)*RC3,0)+R4C -> 13998 | I541: =ROUND((R1003C-R4C)/(R1003C3)*RC3,0)+R4C -> 2543 | J541: =ROUND((R1003C-R4C)/(R1003C3)*RC3,0)+R4C -> 1375 | K541: =ROUND((R1003C-R4C)/(R1003C3)*RC3,0)+R4C -> 19611 | O541: =RC[-4]-R[-1]C[-4] -> 36 | P541: =RC[-1]-R[-1]C[-1] -> 0
B542: =R[-3]C+1 -> 180 | C542: =R[-1]C+RC[1] -> 538 | D542: 1 | F542: =ROUND((R1003C-R4C)/(R1003C3)*RC3,0)+R4C -> 6341 | G542: =ROUND((R1003C-R4C)/(R1003C3)*RC3,0)+R4C -> 4955 | H542: =ROUND((R1003C-R4C)/(R1003C3)*RC3,0)+R4C -> 14024 | I542: =ROUND((R1003C-R4C)/(R1003C3)*RC3,0)+R4C -> 2548 | J542: =ROUND((R1003C-R4C)/(R1003C3)*RC3,0)+R4C -> 1378 | K542: =ROUND((R1003C-R4C)/(R1003C3)*RC3,0)+R4C -> 19647 | O542: =RC[-4]-R[-1]C[-4] -> 36 | P542: =RC[-1]-R[-1]C[-1] -> 0
B543: =R[-3]C+1 -> 180 | C543: =R[-1]C+RC[1] -> 539 | D543: 1 | F543: =ROUND((R1003C-R4C)/(R1003C3)*RC3,0)+R4C -> 6353 | G543: =ROUND((R1003C-R4C)/(R1003C3)*RC3,0)+R4C -> 4964 | H543: =ROUND((R1003C-R4C)/(R1003C3)*RC3,0)+R4C -> 14050 | I543: =ROUND((R1003C-R4C)/(R1003C3)*RC3,0)+R4C -> 2552 | J543: =ROUND((R1003C-R4C)/(R1003C3)*RC3,0)+R4C -> 1380 | K543: =ROUND((R1003C-R4C)/(R1003C3)*RC3,0)+R4C -> 19684 | O543: =RC[-4]-R[-1]C[-4] -> 37 | P543: =RC[-1]-R[-1]C[-1] -> 1
B544: =R[-3]C+1 -> 181 | C544: =R[-1]C+RC[1] -> 540 | D544: 1 | F544: =ROUND((R1003C-R4C)/(R1003C3)*RC3,0)+R4C -> 6364 | G544: =ROUND((R1003C-R4C)/(R1003C3)*RC3,0)+R4C -> 4973 | H544: =ROUND((R1003C-R4C)/(R1003C3)*RC3,0)+R4C -> 14075 | I544: =ROUND((R1003C-R4C)/(R1003C3)*RC3,0)+R4C -> 2557 | J544: =ROUND((R1003C-R4C)/(R1003C3)*RC3,0)+R4C -> 1383 | K544: =ROUND((R1003C-R4C)/(R1003C3)*RC3,0)+R4C -> 19720 | O544: =RC[-4]-R[-1]C[-4] -> 36 | P544: =RC[-1]-R[-1]C[-1] -> -1
B545: =R[-3]C+1 -> 181 | C545: =R[-1]C+RC[1] -> 541 | D545: 1 | F545: =ROUND((R1003C-R4C)/(R1003C3)*RC3,0)+R4C -> 6376 | G545: =ROUND((R1003C-R4C)/(R1003C3)*RC3,0)+R4C -> 4982 | H545: =ROUND((R1003C-R4C)/(R1003C3)*RC3,0)+R4C -> 14101 | I545: =ROUND((R1003C-R4C)/(R1003C3)*RC3,0)+R4C -> 2562 | J545: =ROUND((R1003C-R4C)/(R1003C3)*RC3,0)+R4C -> 1385 | K545: =ROUND((R1003C-R4C)/(R1003C3)*RC3,0)+R4C -> 19756 | O545: =RC[-4]-R[-1]C[-4] -> 36 | P545: =RC[-1]-R[-1]C[-1] -> 0
B546: =R[-3]C+1 -> 181 | C546: =R[-1]C+RC[1] -> 542 | D546: 1 | F546: =ROUND((R1003C-R4C)/(R1003C3)*RC3,0)+R4C -> 6388 | G546: =ROUND((R1003C-R4C)/(R1003C3)*RC3,0)+R4C -> 4991 | H546: =ROUND((R1003C-R4C)/(R1003C3)*RC3,0)+R4C -> 14127 | I546: =ROUND((R1003C-R4C)/(R1003C3)*RC3,0)+R4C -> 2566 | J546: =ROUND((R1003C-R4C)/(R1003C3)*RC3,0)+R4C -> 1388 | K546: =ROUND((R1003C-R4C)/(R1003C3)*RC3,0)+R4C -> 19792 | O546: =RC[-4]-R[-1]C[-4] -> 36 | P546: =RC[-1]-R[-1]C[-1] -> 0
B547: =R[-3]C+1 -> 182 | C547: =R[-1]C+RC[1] -> 543 | D547: 1 | F547: =ROUND((R1003C-R4C)/(R1003C3)*RC3,0)+R4C -> 6399 | G547: =ROUND((R1003C-R4C)/(R1003C3)*RC3,0)+R4C -> 5000 | H547: =ROUND((R1003C-R4C)/(R1003C3)*RC3,0)+R4C -> 14153 | I547: =ROUND((R1003C-R4C)/(R1003C3)*RC3,0)+R4C -> 2571 | J547: =ROUND((R1003C-R4C)/(R1003C3)*RC3,0)+R4C -> 1390 | K547: =ROUND((R1003C-R4C)/(R1003C3)*RC3,0)+R4C -> 19828 | O547: =RC[-4]-R[-1]C[-4] -> 36 | P547: =RC[-1]-R[-1]C[-1] -> 0
B548: =R[-3]C+1 -> 182 | C548: =R[-1]C+RC[1] -> 544 | D548: 1 | F548: =ROUND((R1003C-R4C)/(R1003C3)*RC3,0)+R4C -> 6411 | G548: =ROUND((R1003C-R4C)/(R1003C3)*RC3,0)+R4C -> 5010 | H548: =ROUND((R1003C-R4C)/(R1003C3)*RC3,0)+R4C -> 14179 | I548: =ROUND((R1003C-R4C)/(R1003C3)*RC3,0)+R4C -> 2576 | J548: =ROUND((R1003C-R4C)/(R1003C3)*RC3,0)+R4C -> 1393 | K548: =ROUND((R1003C-R4C)/(R1003C3)*RC3,0)+R4C -> 19865 | O548: =RC[-4]-R[-1]C[-4] -> 37 | P548: =RC[-1]-R[-1]C[-1] -> 1
B549: =R[-3]C+1 -> 182 | C549: =R[-1]C+RC[1] -> 545 | D549: 1 | F549: =ROUND((R1003C-R4C)/(R1003C3)*RC3,0)+R4C -> 6423 | G549: =ROUND((R1003C-R4C)/(R1003C3)*RC3,0)+R4C -> 5019 | H549: =ROUND((R1003C-R4C)/(R1003C3)*RC3,0)+R4C -> 14205 | I549: =ROUND((R1003C-R4C)/(R1003C3)*RC3,0)+R4C -> 2580 | J549: =ROUND((R1003C-R4C)/(R1003C3)*RC3,0)+R4C -> 1395 | K549: =ROUND((R1003C-R4C)/(R1003C3)*RC3,0)+R4C -> 19901 | O549: =RC[-4]-R[-1]C[-4] -> 36 | P549: =RC[-1]-R[-1]C[-1] -> -1
B550: =R[-3]C+1 -> 183 | C550: =R[-1]C+RC[1] -> 546 | D550: 1 | F550: =ROUND((R1003C-R4C)/(R1003C3)*RC3,0)+R4C -> 6434 | G550: =ROUND((R1003C-R4C)/(R1003C3)*RC3,0)+R4C -> 5028 | H550: =ROUND((R1003C-R4C)/(R1003C3)*RC3,0)+R4C -> 14230 | I550: =ROUND((R1003C-R4C)/(R1003C3)*RC3,0)+R4C -> 2585 | J550: =ROUND((R1003C-R4C)/(R1003C3)*RC3,0)+R4C -> 1398 | K550: =ROUND((R1003C-R4C)/(R1003C3)*RC3,0)+R4C -> 19937 | O550: =RC[-4]-R[-1]C[-4] -> 36 | P550: =RC[-1]-R[-1]C[-1] -> 0
B551: =R[-3]C+1 -> 183 | C551: =R[-1]C+RC[1] -> 547 | D551: 1 | F551: =ROUND((R1003C-R4C)/(R1003C3)*RC3,0)+R4C -> 6446 | G551: =ROUND((R1003C-R4C)/(R1003C3)*RC3,0)+R4C -> 5037 | H551: =ROUND((R1003C-R4C)/(R1003C3)*RC3,0)+R4C -> 14256 | I551: =ROUND((R1003C-R4C)/(R1003C3)*RC3,0)+R4C -> 2590 | J551: =ROUND((R1003C-R4C)/(R1003C3)*RC3,0)+R4C -> 1400 | K551: =ROUND((R1003C-R4C)/(R1003C3)*RC3,0)+R4C -> 19973 | O551: =RC[-4]-R[-1]C[-4] -> 36 | P551: =RC[-1]-R[-1]C[-1] -> 0
B552: =R[-3]C+1 -> 183 | C552: =R[-1]C+RC[1] -> 548 | D552: 1 | F552: =ROUND((R1003C-R4C)/(R1003C3)*RC3,0)+R4C -> 6458 | G552: =ROUND((R1003C-R4C)/(R1003C3)*RC3,0)+R4C -> 5046 | H552: =ROUND((R1003C-R4C)/(R1003C3)*RC3,0)+R4C -> 14282 | I552: =ROUND((R1003C-R4C)/(R1003C3)*RC3,0)+R4C -> 2594 | J552: =ROUND((R1003C-R4C)/(R1003C3)*RC3,0)+R4C -> 1403 | K552: =ROUND((R1003C-R4C)/(R1003C3)*RC3,0)+R4C -> 20009 | O552: =RC[-4]-R[-1]C[-4] -> 36 | P552: =RC[-1]-R[-1]C[-1] -> 0
B553: =R[-3]C+1 -> 184 | C553: =R[-1]C+RC[1] -> 549 | D553: 1 | F553: =ROUND((R1003C-R4C)/(R1003C3)*RC3,0)+R4C -> 6469 | G553: =ROUND((R1003C-R4C)/(R1003C3)*RC3,0)+R4C -> 5055 | H553: =ROUND((R1003C-R4C)/(R1003C3)*RC3,0)+R4C -> 14308 | I553: =ROUND((R1003C-R4C)/(R1003C3)*RC3,0)+R4C -> 2599 | J553: =ROUND((R1003C-R4C)/(R1003C3)*RC3,0)+R4C -> 1406 | K553: =ROUND((R1003C-R4C)/(R1003C3)*RC3,0)+R4C -> 20045 | O553: =RC[-4]-R[-1]C[-4] -> 36 | P553: =RC[-1]-R[-1]C[-1] -> 0
B554: =R[-3]C+1 -> 184 | C554: =R[-1]C+RC[1] -> 550 | D554: 1 | F554: =ROUND((R1003C-R4C)/(R1003C3)*RC3,0)+R4C -> 6481 | G554: =ROUND((R1003C-R4C)/(R1003C3)*RC3,0)+R4C -> 5064 | H554: =ROUND((R1003C-R4C)/(R1003C3)*RC3,0)+R4C -> 14334 | I554: =ROUND((R1003C-R4C)/(R1003C3)*RC3,0)+R4C -> 2604 | J554: =ROUND((R1003C-R4C)/(R1003C3)*RC3,0)+R4C -> 1408 | K554: =ROUND((R1003C-R4C)/(R1003C3)*RC3,0)+R4C -> 20082 | O554: =RC[-4]-R[-1]C[-4] -> 37 | P554: =RC[-1]-R[-1]C[-1] -> 1
B555: =R[-3]C+1 -> 184 | C555: =R[-1]C+RC[1] -> 551 | D555: 1 | F555: =ROUND((R1003C-R4C)/(R1003C3)*RC3,0)+R4C -> 6493 | G555: =ROUND((R1003C-R4C)/(R1003C3)*RC3,0)+R4C -> 5073 | H555: =ROUND((R1003C-R4C)/(R1003C3)*RC3,0)+R4C -> 14359 | I555: =ROUND((R1003C-R4C)/(R1003C3)*RC3,0)+R4C -> 2609 | J555: =ROUND((R1003C-R4C)/(R1003C3)*RC3,0)+R4C -> 1411 | K555: =ROUND((R1003C-R4C)/(R1003C3)*RC3,0)+R4C -> 20118 | O555: =RC[-4]-R[-1]C[-4] -> 36 | P555: =RC[-1]-R[-1]C[-1] -> -1
B556: =R[-3]C+1 -> 185 | C556: =R[-1]C+RC[1] -> 552 | D556: 1 | F556: =ROUND((R1003C-R4C)/(R1003C3)*RC3,0)+R4C -> 6505 | G556: =ROUND((R1003C-R4C)/(R1003C3)*RC3,0)+R4C -> 5083 | H556: =ROUND((R1003C-R4C)/(R1003C3)*RC3,0)+R4C -> 14385 | I556: =ROUND((R1003C-R4C)/(R1003C3)*RC3,0)+R4C -> 2613 | J556: =ROUND((R1003C-R4C)/(R1003C3)*RC3,0)+R4C -> 1413 | K556: =ROUND((R1003C-R4C)/(R1003C3)*RC3,0)+R4C -> 20154 | O556: =RC[-4]-R[-1]C[-4] -> 36 | P556: =RC[-1]-R[-1]C[-1] -> 0
B557: =R[-3]C+1 -> 185 | C557: =R[-1]C+RC[1] -> 553 | D557: 1 | F557: =ROUND((R1003C-R4C)/(R1003C3)*RC3,0)+R4C -> 6516 | G557: =ROUND((R1003C-R4C)/(R1003C3)*RC3,0)+R4C -> 5092 | H557: =ROUND((R1003C-R4C)/(R1003C3)*RC3,0)+R4C -> 14411 | I557: =ROUND((R1003C-R4C)/(R1003C3)*RC3,0)+R4C -> 2618 | J557: =ROUND((R1003C-R4C)/(R1003C3)*RC3,0)+R4C -> 1416 | K557: =ROUND((R1003C-R4C)/(R1003C3)*RC3,0)+R4C -> 20190 | O557: =RC[-4]-R[-1]C[-4] -> 36 | P557: =RC[-1]-R[-1]C[-1] -> 0
B558: =R[-3]C+1 -> 185 | C558: =R[-1]C+RC[1] -> 554 | D558: 1 | F558: =ROUND((R1003C-R4C)/(R1003C3)*RC3,0)+R4C -> 6528 | G558: =ROUND((R1003C-R4C)/(R1003C3)*RC3,0)+R4C -> 5101 | H558: =ROUND((R1003C-R4C)/(R1003C3)*RC3,0)+R4C -> 14437 | I558: =ROUND((R1003C-R4C)/(R1003C3)*RC3,0)+R4C -> 2623 | J558: =ROUND((R1003C-R4C)/(R1003C3)*RC3,0)+R4C -> 1418 | K558: =ROUND((R1003C-R4C)/(R1003C3)*RC3,0)+R4C -> 20226 | O558: =RC[-4]-R[-1]C[-4] -> 36 | P558: =RC[-1]-R[-1]C[-1] -> 0
B559: =R[-3]C+1 -> 186 | C559: =R[-1]C+RC[1] -> 555 | D559: 1 | F559: =ROUND((R1003C-R4C)/(R1003C3)*RC3,0)+R4C -> 6540 | G559: =ROUND((R1003C-R4C)/(R1003C3)*RC3,0)+R4C -> 5110 | H559: =ROUND((R1003C-R4C)/(R1003C3)*RC3,0)+R4C -> 14463 | I559: =ROUND((R1003C-R4C)/(R1003C3)*RC3,0)+R4C -> 2627 | J559: =ROUND((R1003C-R4C)/(R1003C3)*RC3,0)+R4C -> 1421 | K559: =ROUND((R1003C-R4C)/(R1003C3)*RC3,0)+R4C -> 20263 | O559: =RC[-4]-R[-1]C[-4] -> 37 | P559: =RC[-1]-R[-1]C[-1] -> 1
B560: =R[-3]C+1 -> 186 | C560: =R[-1]C+RC[1] -> 556 | D560: 1 | F560: =ROUND((R1003C-R4C)/(R1003C3)*RC3,0)+R4C -> 6551 | G560: =ROUND((R1003C-R4C)/(R1003C3)*RC3,0)+R4C -> 5119 | H560: =ROUND((R1003C-R4C)/(R1003C3)*RC3,0)+R4C -> 14489 | I560: =ROUND((R1003C-R4C)/(R1003C3)*RC3,0)+R4C -> 2632 | J560: =ROUND((R1003C-R4C)/(R1003C3)*RC3,0)+R4C -> 1423 | K560: =ROUND((R1003C-R4C)/(R1003C3)*RC3,0)+R4C -> 20299 | O560: =RC[-4]-R[-1]C[-4] -> 36 | P560: =RC[-1]-R[-1]C[-1] -> -1
B561: =R[-3]C+1 -> 186 | C561: =R[-1]C+RC[1] -> 557 | D561: 1 | F561: =ROUND((R1003C-R4C)/(R1003C3)*RC3,0)+R4C -> 6563 | G561: =ROUND((R1003C-R4C)/(R1003C3)*RC3,0)+R4C -> 5128 | H561: =ROUND((R1003C-R4C)/(R1003C3)*RC3,0)+R4C -> 14514 | I561: =ROUND((R1003C-R4C)/(R1003C3)*RC3,0)+R4C -> 2637 | J561: =ROUND((R1003C-R4C)/(R1003C3)*RC3,0)+R4C -> 1426 | K561: =ROUND((R1003C-R4C)/(R1003C3)*RC3,0)+R4C -> 20335 | O561: =RC[-4]-R[-1]C[-4] -> 36 | P561: =RC[-1]-R[-1]C[-1] -> 0
B562: =R[-3]C+1 -> 187 | C562: =R[-1]C+RC[1] -> 558 | D562: 1 | F562: =ROUND((R1003C-R4C)/(R1003C3)*RC3,0)+R4C -> 6575 | G562: =ROUND((R1003C-R4C)/(R1003C3)*RC3,0)+R4C -> 5137 | H562: =ROUND((R1003C-R4C)/(R1003C3)*RC3,0)+R4C -> 14540 | I562: =ROUND((R1003C-R4C)/(R1003C3)*RC3,0)+R4C -> 2641 | J562: =ROUND((R1003C-R4C)/(R1003C3)*RC3,0)+R4C -> 1428 | K562: =ROUND((R1003C-R4C)/(R1003C3)*RC3,0)+R4C -> 20371 | O562: =RC[-4]-R[-1]C[-4] -> 36 | P562: =RC[-1]-R[-1]C[-1] -> 0
B563: =R[-3]C+1 -> 187 | C563: =R[-1]C+RC[1] -> 559 | D563: 1 | F563: =ROUND((R1003C-R4C)/(R1003C3)*RC3,0)+R4C -> 6586 | G563: =ROUND((R1003C-R4C)/(R1003C3)*RC3,0)+R4C -> 5146 | H563: =ROUND((R1003C-R4C)/(R1003C3)*RC3,0)+R4C -> 14566 | I563: =ROUND((R1003C-R4C)/(R1003C3)*RC3,0)+R4C -> 2646 | J563: =ROUND((R1003C-R4C)/(R1003C3)*RC3,0)+R4C -> 1431 | K563: =ROUND((R1003C-R4C)/(R1003C3)*RC3,0)+R4C -> 20407 | O563: =RC[-4]-R[-1]C[-4] -> 36 | P563: =RC[-1]-R[-1]C[-1] -> 0
B564: =R[-3]C+1 -> 187 | C564: =R[-1]C+RC[1] -> 560 | D564: 1 | F564: =ROUND((R1003C-R4C)/(R1003C3)*RC3,0)+R4C -> 6598 | G564: =ROUND((R1003C-R4C)/(R1003C3)*RC3,0)+R4C -> 5156 | H564: =ROUND((R1003C-R4C)/(R1003C3)*RC3,0)+R4C -> 14592 | I564: =ROUND((R1003C-R4C)/(R1003C3)*RC3,0)+R4C -> 2651 | J564: =ROUND((R1003C-R4C)/(R1003C3)*RC3,0)+R4C -> 1433 | K564: =ROUND((R1003C-R4C)/(R1003C3)*RC3,0)+R4C -> 20443 | O564: =RC[-4]-R[-1]C[-4] -> 36 | P564: =RC[-1]-R[-1]C[-1] -> 0
B565: =R[-3]C+1 -> 188 | C565: =R[-1]C+RC[1] -> 561 | D565: 1 | F565: =ROUND((R1003C-R4C)/(R1003C3)*RC3,0)+R4C -> 6610 | G565: =ROUND((R1003C-R4C)/(R1003C3)*RC3,0)+R4C -> 5165 | H565: =ROUND((R1003C-R4C)/(R1003C3)*RC3,0)+R4C -> 14618 | I565: =ROUND((R1003C-R4C)/(R1003C3)*RC3,0)+R4C -> 2655 | J565: =ROUND((R1003C-R4C)/(R1003C3)*RC3,0)+R4C -> 1436 | K565: =ROUND((R1003C-R4C)/(R1003C3)*RC3,0)+R4C -> 20480 | O565: =RC[-4]-R[-1]C[-4] -> 37 | P565: =RC[-1]-R[-1]C[-1] -> 1
B566: =R[-3]C+1 -> 188 | C566: =R[-1]C+RC[1] -> 562 | D566: 1 | F566: =ROUND((R1003C-R4C)/(R1003C3)*RC3,0)+R4C -> 6621 | G566: =ROUND((R1003C-R4C)/(R1003C3)*RC3,0)+R4C -> 5174 | H566: =ROUND((R1003C-R4C)/(R1003C3)*RC3,0)+R4C -> 14644 | I566: =ROUND((R1003C-R4C)/(R1003C3)*RC3,0)+R4C -> 2660 | J566: =ROUND((R1003C-R4C)/(R1003C3)*RC3,0)+R4C -> 1439 | K566: =ROUND((R1003C-R4C)/(R1003C3)*RC3,0)+R4C -> 20516 | O566: =RC[-4]-R[-1]C[-4] -> 36 | P566: =RC[-1]-R[-1]C[-1] -> -1
B567: =R[-3]C+1 -> 188 | C567: =R[-1]C+RC[1] -> 563 | D567: 1 | F567: =ROUND((R1003C-R4C)/(R1003C3)*RC3,0)+R4C -> 6633 | G567: =ROUND((R1003C-R4C)/(R1003C3)*RC3,0)+R4C -> 5183 | H567: =ROUND((R1003C-R4C)/(R1003C3)*RC3,0)+R4C -> 14669 | I567: =ROUND((R1003C-R4C)/(R1003C3)*RC3,0)+R4C -> 2665 | J567: =ROUND((R1003C-R4C)/(R1003C3)*RC3,0)+R4C -> 1441 | K567: =ROUND((R1003C-R4C)/(R1003C3)*RC3,0)+R4C -> 20552 | O567: =RC[-4]-R[-1]C[-4] -> 36 | P567: =RC[-1]-R[-1]C[-1] -> 0
B568: =R[-3]C+1 -> 189 | C568: =R[-1]C+RC[1] -> 564 | D568: 1 | F568: =ROUND((R1003C-R4C)/(R1003C3)*RC3,0)+R4C -> 6645 | G568: =ROUND((R1003C-R4C)/(R1003C3)*RC3,0)+R4C -> 5192 | H568: =ROUND((R1003C-R4C)/(R1003C3)*RC3,0)+R4C -> 14695 | I568: =ROUND((R1003C-R4C)/(R1003C3)*RC3,0)+R4C -> 2670 | J568: =ROUND((R1003C-R4C)/(R1003C3)*RC3,0)+R4C -> 1444 | K568: =ROUND((R1003C-R4C)/(R1003C3)*RC3,0)+R4C -> 20588 | O568: =RC[-4]-R[-1]C[-4] -> 36 | P568: =RC[-1]-R[-1]C[-1] -> 0
B569: =R[-3]C+1 -> 189 | C569: =R[-1]C+RC[1] -> 565 | D569: 1 | F569: =ROUND((R1003C-R4C)/(R1003C3)*RC3,0)+R4C -> 6656 | G569: =ROUND((R1003C-R4C)/(R1003C3)*RC3,0)+R4C -> 5201 | H569: =ROUND((R1003C-R4C)/(R1003C3)*RC3,0)+R4C -> 14721 | I569: =ROUND((R1003C-R4C)/(R1003C3)*RC3,0)+R4C -> 2674 | J569: =ROUND((R1003C-R4C)/(R1003C3)*RC3,0)+R4C -> 1446 | K569: =ROUND((R1003C-R4C)/(R1003C3)*RC3,0)+R4C -> 20624 | O569: =RC[-4]-R[-1]C[-4] -> 36 | P569: =RC[-1]-R[-1]C[-1] -> 0
B570: =R[-3]C+1 -> 189 | C570: =R[-1]C+RC[1] -> 566 | D570: 1 | F570: =ROUND((R1003C-R4C)/(R1003C3)*RC3,0)+R4C -> 6668 | G570: =ROUND((R1003C-R4C)/(R1003C3)*RC3,0)+R4C -> 5210 | H570: =ROUND((R1003C-R4C)/(R1003C3)*RC3,0)+R4C -> 14747 | I570: =ROUND((R1003C-R4C)/(R1003C3)*RC3,0)+R4C -> 2679 | J570: =ROUND((R1003C-R4C)/(R1003C3)*RC3,0)+R4C -> 1449 | K570: =ROUND((R1003C-R4C)/(R1003C3)*RC3,0)+R4C -> 20661 | O570: =RC[-4]-R[-1]C[-4] -> 37 | P570: =RC[-1]-R[-1]C[-1] -> 1
B571: =R[-3]C+1 -> 190 | C571: =R[-1]C+RC[1] -> 567 | D571: 1 | F571: =ROUND((R1003C-R4C)/(R1003C3)*RC3,0)+R4C -> 6680 | G571: =ROUND((R1003C-R4C)/(R1003C3)*RC3,0)+R4C -> 5219 | H571: =ROUND((R1003C-R4C)/(R1003C3)*RC3,0)+R4C -> 14773 | I571: =ROUND((R1003C-R4C)/(R1003C3)*RC3,0)+R4C -> 2684 | J571: =ROUND((R1003C-R4C)/(R1003C3)*RC3,0)+R4C -> 1451 | K571: =ROUND((R1003C-R4C)/(R1003C3)*RC3,0)+R4C -> 20697 | O571: =RC[-4]-R[-1]C[-4] -> 36 | P571: =RC[-1]-R[-1]C[-1] -> -1
B572: =R[-3]C+1 -> 190 | C572: =R[-1]C+RC[1] -> 568 | D572: 1 | F572: =ROUND((R1003C-R4C)/(R1003C3)*RC3,0)+R4C -> 6691 | G572: =ROUND((R1003C-R4C)/(R1003C3)*RC3,0)+R4C -> 5229 | H572: =ROUND((R1003C-R4C)/(R1003C3)*RC3,0)+R4C -> 14799 | I572: =ROUND((R1003C-R4C)/(R1003C3)*RC3,0)+R4C -> 2688 | J572: =ROUND((R1003C-R4C)/(R1003C3)*RC3,0)+R4C -> 1454 | K572: =ROUND((R1003C-R4C)/(R1003C3)*RC3,0)+R4C -> 20733 | O572: =RC[-4]-R[-1]C[-4] -> 36 | P572: =RC[-1]-R[-1]C[-1] -> 0
B573: =R[-3]C+1 -> 190 | C573: =R[-1]C+RC[1] -> 569 | D573: 1 | F573: =ROUND((R1003C-R4C)/(R1003C3)*RC3,0)+R4C -> 6703 | G573: =ROUND((R1003C-R4C)/(R1003C3)*RC3,0)+R4C -> 5238 | H573: =ROUND((R1003C-R4C)/(R1003C3)*RC3,0)+R4C -> 14824 | I573: =ROUND((R1003C-R4C)/(R1003C3)*RC3,0)+R4C -> 2693 | J573: =ROUND((R1003C-R4C)/(R1003C3)*RC3,0)+R4C -> 1456 | K573: =ROUND((R1003C-R4C)/(R1003C3)*RC3,0)+R4C -> 20769 | O573: =RC[-4]-R[-1]C[-4] -> 36 | P573: =RC[-1]-R[-1]C[-1] -> 0
B574: =R[-3]C+1 -> 191 | C574: =R[-1]C+RC[1] -> 570 | D574: 1 | F574: =ROUND((R1003C-R4C)/(R1003C3)*RC3,0)+R4C -> 6715 | G574: =ROUND((R1003C-R4C)/(R1003C3)*RC3,0)+R4C -> 5247 | H574: =ROUND((R1003C-R4C)/(R1003C3)*RC3,0)+R4C -> 14850 | I574: =ROUND((R1003C-R4C)/(R1003C3)*RC3,0)+R4C -> 2698 | J574: =ROUND((R1003C-R4C)/(R1003C3)*RC3,0)+R4C -> 1459 | K574: =ROUND((R1003C-R4C)/(R1003C3)*RC3,0)+R4C -> 20805 | O574: =RC[-4]-R[-1]C[-4] -> 36 | P574: =RC[-1]-R[-1]C[-1] -> 0
B575: =R[-3]C+1 -> 191 | C575: =R[-1]C+RC[1] -> 571 | D575: 1 | F575: =ROUND((R1003C-R4C)/(R1003C3)*RC3,0)+R4C -> 6726 | G575: =ROUND((R1003C-R4C)/(R1003C3)*RC3,0)+R4C -> 5256 | H575: =ROUND((R1003C-R4C)/(R1003C3)*RC3,0)+R4C -> 14876 | I575: =ROUND((R1003C-R4C)/(R1003C3)*RC3,0)+R4C -> 2702 | J575: =ROUND((R1003C-R4C)/(R1003C3)*RC3,0)+R4C -> 1461 | K575: =ROUND((R1003C-R4C)/(R1003C3)*RC3,0)+R4C -> 20841 | O575: =RC[-4]-R[-1]C[-4] -> 36 | P575: =RC[-1]-R[-1]C[-1] -> 0
B576: =R[-3]C+1 -> 191 | C576: =R[-1]C+RC[1] -> 572 | D576: 1 | F576: =ROUND((R1003C-R4C)/(R1003C3)*RC3,0)+R4C -> 6738 | G576: =ROUND((R1003C-R4C)/(R1003C3)*RC3,0)+R4C -> 5265 | H576: =ROUND((R1003C-R4C)/(R1003C3)*RC3,0)+R4C -> 14902 | I576: =ROUND((R1003C-R4C)/(R1003C3)*RC3,0)+R4C -> 2707 | J576: =ROUND((R1003C-R4C)/(R1003C3)*RC3,0)+R4C -> 1464 | K576: =ROUND((R1003C-R4C)/(R1003C3)*RC3,0)+R4C -> 20878 | O576: =RC[-4]-R[-1]C[-4] -> 37 | P576: =RC[-1]-R[-1]C[-1] -> 1
B577: =R[-3]C+1 -> 192 | C577: =R[-1]C+RC[1] -> 573 | D577: 1 | F577: =ROUND((R1003C-R4C)/(R1003C3)*RC3,0)+R4C -> 6750 | G577: =ROUND((R1003C-R4C)/(R1003C3)*RC3,0)+R4C -> 5274 | H577: =ROUND((R1003C-R4C)/(R1003C3)*RC3,0)+R4C -> 14928 | I577: =ROUND((R1003C-R4C)/(R1003C3)*RC3,0)+R4C -> 2712 | J577: =ROUND((R1003C-R4C)/(R1003C3)*RC3,0)+R4C -> 1466 | K577: =ROUND((R1003C-R4C)/(R1003C3)*RC3,0)+R4C -> 20914 | O577: =RC[-4]-R[-1]C[-4] -> 36 | P577: =RC[-1]-R[-1]C[-1] -> -1
B578: =R[-3]C+1 -> 192 | C578: =R[-1]C+RC[1] -> 574 | D578: 1 | F578: =ROUND((R1003C-R4C)/(R1003C3)*RC3,0)+R4C -> 6761 | G578: =ROUND((R1003C-R4C)/(R1003C3)*RC3,0)+R4C -> 5283 | H578: =ROUND((R1003C-R4C)/(R1003C3)*RC3,0)+R4C -> 14953 | I578: =ROUND((R1003C-R4C)/(R1003C3)*RC3,0)+R4C -> 2716 | J578: =ROUND((R1003C-R4C)/(R1003C3)*RC3,0)+R4C -> 1469 | K578: =ROUND((R1003C-R4C)/(R1003C3)*RC3,0)+R4C -> 20950 | O578: =RC[-4]-R[-1]C[-4] -> 36 | P578: =RC[-1]-R[-1]C[-1] -> 0
B579: =R[-3]C+1 -> 192 | C579: =R[-1]C+RC[1] -> 575 | D579: 1 | F579: =ROUND((R1003C-R4C)/(R1003C3)*RC3,0)+R4C -> 6773 | G579: =ROUND((R1003C-R4C)/(R1003C3)*RC3,0)+R4C -> 5292 | H579: =ROUND((R1003C-R4C)/(R1003C3)*RC3,0)+R4C -> 14979 | I579: =ROUND((R1003C-R4C)/(R1003C3)*RC3,0)+R4C -> 2721 | J579: =ROUND((R1003C-R4C)/(R1003C3)*RC3,0)+R4C -> 1472 | K579: =ROUND((R1003C-R4C)/(R1003C3)*RC3,0)+R4C -> 20986 | O579: =RC[-4]-R[-1]C[-4] -> 36 | P579: =RC[-1]-R[-1]C[-1] -> 0
B580: =R[-3]C+1 -> 193 | C580: =R[-1]C+RC[1] -> 576 | D580: 1 | F580: =ROUND((R1003C-R4C)/(R1003C3)*RC3,0)+R4C -> 6785 | G580: =ROUND((R1003C-R4C)/(R1003C3)*RC3,0)+R4C -> 5301 | H580: =ROUND((R1003C-R4C)/(R1003C3)*RC3,0)+R4C -> 15005 | I580: =ROUND((R1003C-R4C)/(R1003C3)*RC3,0)+R4C -> 2726 | J580: =ROUND((R1003C-R4C)/(R1003C3)*RC3,0)+R4C -> 1474 | K580: =ROUND((R1003C-R4C)/(R1003C3)*RC3,0)+R4C -> 21022 | O580: =RC[-4]-R[-1]C[-4] -> 36 | P580: =RC[-1]-R[-1]C[-1] -> 0
B581: =R[-3]C+1 -> 193 | C581: =R[-1]C+RC[1] -> 577 | D581: 1 | F581: =ROUND((R1003C-R4C)/(R1003C3)*RC3,0)+R4C -> 6796 | G581: =ROUND((R1003C-R4C)/(R1003C3)*RC3,0)+R4C -> 5311 | H581: =ROUND((R1003C-R4C)/(R1003C3)*RC3,0)+R4C -> 15031 | I581: =ROUND((R1003C-R4C)/(R1003C3)*RC3,0)+R4C -> 2731 | J581: =ROUND((R1003C-R4C)/(R1003C3)*RC3,0)+R4C -> 1477 | K581: =ROUND((R1003C-R4C)/(R1003C3)*RC3,0)+R4C -> 21059 | O581: =RC[-4]-R[-1]C[-4] -> 37 | P581: =RC[-1]-R[-1]C[-1] -> 1
B582: =R[-3]C+1 -> 193 | C582: =R[-1]C+RC[1] -> 578 | D582: 1 | F582: =ROUND((R1003C-R4C)/(R1003C3)*RC3,0)+R4C -> 6808 | G582: =ROUND((R1003C-R4C)/(R1003C3)*RC3,0)+R4C -> 5320 | H582: =ROUND((R1003C-R4C)/(R1003C3)*RC3,0)+R4C -> 15057 | I582: =ROUND((R1003C-R4C)/(R1003C3)*RC3,0)+R4C -> 2735 | J582: =ROUND((R1003C-R4C)/(R1003C3)*RC3,0)+R4C -> 1479 | K582: =ROUND((R1003C-R4C)/(R1003C3)*RC3,0)+R4C -> 21095 | O582: =RC[-4]-R[-1]C[-4] -> 36 | P582: =RC[-1]-R[-1]C[-1] -> -1
B583: =R[-3]C+1 -> 194 | C583: =R[-1]C+RC[1] -> 579 | D583: 1 | F583: =ROUND((R1003C-R4C)/(R1003C3)*RC3,0)+R4C -> 6820 | G583: =ROUND((R1003C-R4C)/(R1003C3)*RC3,0)+R4C -> 5329 | H583: =ROUND((R1003C-R4C)/(R1003C3)*RC3,0)+R4C -> 15083 | I583: =ROUND((R1003C-R4C)/(R1003C3)*RC3,0)+R4C -> 2740 | J583: =ROUND((R1003C-R4C)/(R1003C3)*RC3,0)+R4C -> 1482 | K583: =ROUND((R1003C-R4C)/(R1003C3)*RC3,0)+R4C -> 21131 | O583: =RC[-4]-R[-1]C[-4] -> 36 | P583: =RC[-1]-R[-1]C[-1] -> 0
B584: =R[-3]C+1 -> 194 | C584: =R[-1]C+RC[1] -> 580 | D584: 1 | F584: =ROUND((R1003C-R4C)/(R1003C3)*RC3,0)+R4C -> 6831 | G584: =ROUND((R1003C-R4C)/(R1003C3)*RC3,0)+R4C -> 5338 | H584: =ROUND((R1003C-R4C)/(R1003C3)*RC3,0)+R4C -> 15108 | I584: =ROUND((R1003C-R4C)/(R1003C3)*RC3,0)+R4C -> 2745 | J584: =ROUND((R1003C-R4C)/(R1003C3)*RC3,0)+R4C -> 1484 | K584: =ROUND((R1003C-R4C)/(R1003C3)*RC3,0)+R4C -> 21167 | O584: =RC[-4]-R[-1]C[-4] -> 36 | P584: =RC[-1]-R[-1]C[-1] -> 0
B585: =R[-3]C+1 -> 194 | C585: =R[-1]C+RC[1] -> 581 | D585: 1 | F585: =ROUND((R1003C-R4C)/(R1003C3)*RC3,0)+R4C -> 6843 | G585: =ROUND((R1003C-R4C)/(R1003C3)*RC3,0)+R4C -> 5347 | H585: =ROUND((R1003C-R4C)/(R1003C3)*RC3,0)+R4C -> 15134 | I585: =ROUND((R1003C-R4C)/(R1003C3)*RC3,0)+R4C -> 2749 | J585: =ROUND((R1003C-R4C)/(R1003C3)*RC3,0)+R4C -> 1487 | K585: =ROUND((R1003C-R4C)/(R1003C3)*RC3,0)+R4C -> 21203 | O585: =RC[-4]-R[-1]C[-4] -> 36 | P585: =RC[-1]-R[-1]C[-1] -> 0
B586: =R[-3]C+1 -> 195 | C586: =R[-1]C+RC[1] -> 582 | D586: 1 | F586: =ROUND((R1003C-R4C)/(R1003C3)*RC3,0)+R4C -> 6855 | G586: =ROUND((R1003C-R4C)/(R1003C3)*RC3,0)+R4C -> 5356 | H586: =ROUND((R1003C-R4C)/(R1003C3)*RC3,0)+R4C -> 15160 | I586: =ROUND((R1003C-R4C)/(R1003C3)*RC3,0)+R4C -> 2754 | J586: =ROUND((R1003C-R4C)/(R1003C3)*RC3,0)+R4C -> 1489 | K586: =ROUND((R1003C-R4C)/(R1003C3)*RC3,0)+R4C -> 21239 | O586: =RC[-4]-R[-1]C[-4] -> 36 | P586: =RC[-1]-R[-1]C[-1] -> 0
B587: =R[-3]C+1 -> 195 | C587: =R[-1]C+RC[1] -> 583 | D587: 1 | F587: =ROUND((R1003C-R4C)/(R1003C3)*RC3,0)+R4C -> 6867 | G587: =ROUND((R1003C-R4C)/(R1003C3)*RC3,0)+R4C -> 5365 | H587: =ROUND((R1003C-R4C)/(R1003C3)*RC3,0)+R4C -> 15186 | I587: =ROUND((R1003C-R4C)/(R1003C3)*RC3,0)+R4C -> 2759 | J587: =ROUND((R1003C-R4C)/(R1003C3)*RC3,0)+R4C -> 1492 | K587: =ROUND((R1003C-R4C)/(R1003C3)*RC3,0)+R4C -> 21276 | O587: =RC[-4]-R[-1]C[-4] -> 37 | P587: =RC[-1]-R[-1]C[-1] -> 1
B588: =R[-3]C+1 -> 195 | C588: =R[-1]C+RC[1] -> 584 | D588: 1 | F588: =ROUND((R1003C-R4C)/(R1003C3)*RC3,0)+R4C -> 6878 | G588: =ROUND((R1003C-R4C)/(R1003C3)*RC3,0)+R4C -> 5374 | H588: =ROUND((R1003C-R4C)/(R1003C3)*RC3,0)+R4C -> 15212 | I588: =ROUND((R1003C-R4C)/(R1003C3)*RC3,0)+R4C -> 2763 | J588: =ROUND((R1003C-R4C)/(R1003C3)*RC3,0)+R4C -> 1494 | K588: =ROUND((R1003C-R4C)/(R1003C3)*RC3,0)+R4C -> 21312 | O588: =RC[-4]-R[-1]C[-4] -> 36 | P588: =RC[-1]-R[-1]C[-1] -> -1
B589: =R[-3]C+1 -> 196 | C589: =R[-1]C+RC[1] -> 585 | D589: 1 | F589: =ROUND((R1003C-R4C)/(R1003C3)*RC3,0)+R4C -> 6890 | G589: =ROUND((R1003C-R4C)/(R1003C3)*RC3,0)+R4C -> 5384 | H589: =ROUND((R1003C-R4C)/(R1003C3)*RC3,0)+R4C -> 15238 | I589: =ROUND((R1003C-R4C)/(R1003C3)*RC3,0)+R4C -> 2768 | J589: =ROUND((R1003C-R4C)/(R1003C3)*RC3,0)+R4C -> 1497 | K589: =ROUND((R1003C-R4C)/(R1003C3)*RC3,0)+R4C -> 21348 | O589: =RC[-4]-R[-1]C[-4] -> 36 | P589: =RC[-1]-R[-1]C[-1] -> 0
B590: =R[-3]C+1 -> 196 | C590: =R[-1]C+RC[1] -> 586 | D590: 1 | F590: =ROUND((R1003C-R4C)/(R1003C3)*RC3,0)+R4C -> 6902 | G590: =ROUND((R1003C-R4C)/(R1003C3)*RC3,0)+R4C -> 5393 | H590: =ROUND((R1003C-R4C)/(R1003C3)*RC3,0)+R4C -> 15263 | I590: =ROUND((R1003C-R4C)/(R1003C3)*RC3,0)+R4C -> 2773 | J590: =ROUND((R1003C-R4C)/(R1003C3)*RC3,0)+R4C -> 1499 | K590: =ROUND((R1003C-R4C)/(R1003C3)*RC3,0)+R4C -> 21384 | O590: =RC[-4]-R[-1]C[-4] -> 36 | P590: =RC[-1]-R[-1]C[-1] -> 0
B591: =R[-3]C+1 -> 196 | C591: =R[-1]C+RC[1] -> 587 | D591: 1 | F591: =ROUND((R1003C-R4C)/(R1003C3)*RC3,0)+R4C -> 6913 | G591: =ROUND((R1003C-R4C)/(R1003C3)*RC3,0)+R4C -> 5402 | H591: =ROUND((R1003C-R4C)/(R1003C3)*RC3,0)+R4C -> 15289 | I591: =ROUND((R1003C-R4C)/(R1003C3)*RC3,0)+R4C -> 2777 | J591: =ROUND((R1003C-R4C)/(R1003C3)*RC3,0)+R4C -> 1502 | K591: =ROUND((R1003C-R4C)/(R1003C3)*RC3,0)+R4C -> 21420 | O591: =RC[-4]-R[-1]C[-4] -> 36 | P591: =RC[-1]-R[-1]C[-1] -> 0
B592: =R[-3]C+1 -> 197 | C592: =R[-1]C+RC[1] -> 588 | D592: 1 | F592: =ROUND((R1003C-R4C)/(R1003C3)*RC3,0)+R4C -> 6925 | G592: =ROUND((R1003C-R4C)/(R1003C3)*RC3,0)+R4C -> 5411 | H592: =ROUND((R1003C-R4C)/(R1003C3)*RC3,0)+R4C -> 15315 | I592: =ROUND((R1003C-R4C)/(R1003C3)*RC3,0)+R4C -> 2782 | J592: =ROUND((R1003C-R4C)/(R1003C3)*RC3,0)+R4C -> 1504 | K592: =ROUND((R1003C-R4C)/(R1003C3)*RC3,0)+R4C -> 21457 | O592: =RC[-4]-R[-1]C[-4] -> 37 | P592: =RC[-1]-R[-1]C[-1] -> 1
B593: =R[-3]C+1 -> 197 | C593: =R[-1]C+RC[1] -> 589 | D593: 1 | F593: =ROUND((R1003C-R4C)/(R1003C3)*RC3,0)+R4C -> 6937 | G593: =ROUND((R1003C-R4C)/(R1003C3)*RC3,0)+R4C -> 5420 | H593: =ROUND((R1003C-R4C)/(R1003C3)*RC3,0)+R4C -> 15341 | I593: =ROUND((R1003C-R4C)/(R1003C3)*RC3,0)+R4C -> 2787 | J593: =ROUND((R1003C-R4C)/(R1003C3)*RC3,0)+R4C -> 1507 | K593: =ROUND((R1003C-R4C)/(R1003C3)*RC3,0)+R4C -> 21493 | O593: =RC[-4]-R[-1]C[-4] -> 36 | P593: =RC[-1]-R[-1]C[-1] -> -1
B594: =R[-3]C+1 -> 197 | C594: =R[-1]C+RC[1] -> 590 | D594: 1 | F594: =ROUND((R1003C-R4C)/(R1003C3)*RC3,0)+R4C -> 6948 | G594: =ROUND((R1003C-R4C)/(R1003C3)*RC3,0)+R4C -> 5429 | H594: =ROUND((R1003C-R4C)/(R1003C3)*RC3,0)+R4C -> 15367 | I594: =ROUND((R1003C-R4C)/(R1003C3)*RC3,0)+R4C -> 2792 | J594: =ROUND((R1003C-R4C)/(R1003C3)*RC3,0)+R4C -> 1510 | K594: =ROUND((R1003C-R4C)/(R1003C3)*RC3,0)+R4C -> 21529 | O594: =RC[-4]-R[-1]C[-4] -> 36 | P594: =RC[-1]-R[-1]C[-1] -> 0
B595: =R[-3]C+1 -> 198 | C595: =R[-1]C+RC[1] -> 591 | D595: 1 | F595: =ROUND((R1003C-R4C)/(R1003C3)*RC3,0)+R4C -> 6960 | G595: =ROUND((R1003C-R4C)/(R1003C3)*RC3,0)+R4C -> 5438 | H595: =ROUND((R1003C-R4C)/(R1003C3)*RC3,0)+R4C -> 15392 | I595: =ROUND((R1003C-R4C)/(R1003C3)*RC3,0)+R4C -> 2796 | J595: =ROUND((R1003C-R4C)/(R1003C3)*RC3,0)+R4C -> 1512 | K595: =ROUND((R1003C-R4C)/(R1003C3)*RC3,0)+R4C -> 21565 | O595: =RC[-4]-R[-1]C[-4] -> 36 | P595: =RC[-1]-R[-1]C[-1] -> 0
B596: =R[-3]C+1 -> 198 | C596: =R[-1]C+RC[1] -> 592 | D596: 1 | F596: =ROUND((R1003C-R4C)/(R1003C3)*RC3,0)+R4C -> 6972 | G596: =ROUND((R1003C-R4C)/(R1003C3)*RC3,0)+R4C -> 5447 | H596: =ROUND((R1003C-R4C)/(R1003C3)*RC3,0)+R4C -> 15418 | I596: =ROUND((R1003C-R4C)/(R1003C3)*RC3,0)+R4C -> 2801 | J596: =ROUND((R1003C-R4C)/(R1003C3)*RC3,0)+R4C -> 1515 | K596: =ROUND((R1003C-R4C)/(R1003C3)*RC3,0)+R4C -> 21601 | O596: =RC[-4]-R[-1]C[-4] -> 36 | P596: =RC[-1]-R[-1]C[-1] -> 0
B597: =R[-3]C+1 -> 198 | C597: =R[-1]C+RC[1] -> 593 | D597: 1 | F597: =ROUND((R1003C-R4C)/(R1003C3)*RC3,0)+R4C -> 6983 | G597: =ROUND((R1003C-R4C)/(R1003C3)*RC3,0)+R4C -> 5457 | H597: =ROUND((R1003C-R4C)/(R1003C3)*RC3,0)+R4C -> 15444 | I597: =ROUND((R1003C-R4C)/(R1003C3)*RC3,0)+R4C -> 2806 | J597: =ROUND((R1003C-R4C)/(R1003C3)*RC3,0)+R4C -> 1517 | K597: =ROUND((R1003C-R4C)/(R1003C3)*RC3,0)+R4C -> 21637 | O597: =RC[-4]-R[-1]C[-4] -> 36 | P597: =RC[-1]-R[-1]C[-1] -> 0
B598: =R[-3]C+1 -> 199 | C598: =R[-1]C+RC[1] -> 594 | D598: 1 | F598: =ROUND((R1003C-R4C)/(R1003C3)*RC3,0)+R4C -> 6995 | G598: =ROUND((R1003C-R4C)/(R1003C3)*RC3,0)+R4C -> 5466 | H598: =ROUND((R1003C-R4C)/(R1003C3)*RC3,0)+R4C -> 15470 | I598: =ROUND((R1003C-R4C)/(R1003C3)*RC3,0)+R4C -> 2810 | J598: =ROUND((R1003C-R4C)/(R1003C3)*RC3,0)+R4C -> 1520 | K598: =ROUND((R1003C-R4C)/(R1003C3)*RC3,0)+R4C -> 21674 | O598: =RC[-4]-R[-1]C[-4] -> 37 | P598: =RC[-1]-R[-1]C[-1] -> 1
B599: =R[-3]C+1 -> 199 | C599: =R[-1]C+RC[1] -> 595 | D599: 1 | F599: =ROUND((R1003C-R4C)/(R1003C3)*RC3,0)+R4C -> 7007 | G599: =ROUND((R1003C-R4C)/(R1003C3)*RC3,0)+R4C -> 5475 | H599: =ROUND((R1003C-R4C)/(R1003C3)*RC3,0)+R4C -> 15496 | I599: =ROUND((R1003C-R4C)/(R1003C3)*RC3,0)+R4C -> 2815 | J599: =ROUND((R1003C-R4C)/(R1003C3)*RC3,0)+R4C -> 1522 | K599: =ROUND((R1003C-R4C)/(R1003C3)*RC3,0)+R4C -> 21710 | O599: =RC[-4]-R[-1]C[-4] -> 36 | P599: =RC[-1]-R[-1]C[-1] -> -1
B600: =R[-3]C+1 -> 199 | C600: =R[-1]C+RC[1] -> 596 | D600: 1 | F600: =ROUND((R1003C-R4C)/(R1003C3)*RC3,0)+R4C -> 7018 | G600: =ROUND((R1003C-R4C)/(R1003C3)*RC3,0)+R4C -> 5484 | H600: =ROUND((R1003C-R4C)/(R1003C3)*RC3,0)+R4C -> 15522 | I600: =ROUND((R1003C-R4C)/(R1003C3)*RC3,0)+R4C -> 2820 | J600: =ROUND((R1003C-R4C)/(R1003C3)*RC3,0)+R4C -> 1525 | K600: =ROUND((R1003C-R4C)/(R1003C3)*RC3,0)+R4C -> 21746 | O600: =RC[-4]-R[-1]C[-4] -> 36 | P600: =RC[-1]-R[-1]C[-1] -> 0
B601: =R[-3]C+1 -> 200 | C601: =R[-1]C+RC[1] -> 597 | D601: 1 | F601: =ROUND((R1003C-R4C)/(R1003C3)*RC3,0)+R4C -> 7030 | G601: =ROUND((R1003C-R4C)/(R1003C3)*RC3,0)+R4C -> 5493 | H601: =ROUND((R1003C-R4C)/(R1003C3)*RC3,0)+R4C -> 15547 | I601: =ROUND((R1003C-R4C)/(R1003C3)*RC3,0)+R4C -> 2824 | J601: =ROUND((R1003C-R4C)/(R1003C3)*RC3,0)+R4C -> 1527 | K601: =ROUND((R1003C-R4C)/(R1003C3)*RC3,0)+R4C -> 21782 | O601: =RC[-4]-R[-1]C[-4] -> 36 | P601: =RC[-1]-R[-1]C[-1] -> 0
B602: =R[-3]C+1 -> 200 | C602: =R[-1]C+RC[1] -> 598 | D602: 1 | F602: =ROUND((R1003C-R4C)/(R1003C3)*RC3,0)+R4C -> 7042 | G602: =ROUND((R1003C-R4C)/(R1003C3)*RC3,0)+R4C -> 5502 | H602: =ROUND((R1003C-R4C)/(R1003C3)*RC3,0)+R4C -> 15573 | I602: =ROUND((R1003C-R4C)/(R1003C3)*RC3,0)+R4C -> 2829 | J602: =ROUND((R1003C-R4C)/(R1003C3)*RC3,0)+R4C -> 1530 | K602: =ROUND((R1003C-R4C)/(R1003C3)*RC3,0)+R4C -> 21818 | O602: =RC[-4]-R[-1]C[-4] -> 36 | P602: =RC[-1]-R[-1]C[-1] -> 0
B603: =R[-3]C+1 -> 200 | C603: =R[-1]C+RC[1] -> 599 | D603: 1 | F603: =ROUND((R1003C-R4C)/(R1003C3)*RC3,0)+R4C -> 7053 | G603: =ROUND((R1003C-R4C)/(R1003C3)*RC3,0)+R4C -> 5511 | H603: =ROUND((R1003C-R4C)/(R1003C3)*RC3,0)+R4C -> 15599 | I603: =ROUND((R1003C-R4C)/(R1003C3)*RC3,0)+R4C -> 2834 | J603: =ROUND((R1003C-R4C)/(R1003C3)*RC3,0)+R4C -> 1532 | K603: =ROUND((R1003C-R4C)/(R1003C3)*RC3,0)+R4C -> 21855 | O603: =RC[-4]-R[-1]C[-4] -> 37 | P603: =RC[-1]-R[-1]C[-1] -> 1
B604: =R[-3]C+1 -> 201 | C604: =R[-1]C+RC[1] -> 600 | D604: 1 | F604: =ROUND((R1003C-R4C)/(R1003C3)*RC3,0)+R4C -> 7065 | G604: =ROUND((R1003C-R4C)/(R1003C3)*RC3,0)+R4C -> 5520 | H604: =ROUND((R1003C-R4C)/(R1003C3)*RC3,0)+R4C -> 15625 | I604: =ROUND((R1003C-R4C)/(R1003C3)*RC3,0)+R4C -> 2838 | J604: =ROUND((R1003C-R4C)/(R1003C3)*RC3,0)+R4C -> 1535 | K604: =ROUND((R1003C-R4C)/(R1003C3)*RC3,0)+R4C -> 21891 | O604: =RC[-4]-R[-1]C[-4] -> 36 | P604: =RC[-1]-R[-1]C[-1] -> -1
B605: =R[-3]C+1 -> 201 | C605: =R[-1]C+RC[1] -> 601 | D605: 1 | F605: =ROUND((R1003C-R4C)/(R1003C3)*RC3,0)+R4C -> 7077 | G605: =ROUND((R1003C-R4C)/(R1003C3)*RC3,0)+R4C -> 5530 | H605: =ROUND((R1003C-R4C)/(R1003C3)*RC3,0)+R4C -> 15651 | I605: =ROUND((R1003C-R4C)/(R1003C3)*RC3,0)+R4C -> 2843 | J605: =ROUND((R1003C-R4C)/(R1003C3)*RC3,0)+R4C -> 1537 | K605: =ROUND((R1003C-R4C)/(R1003C3)*RC3,0)+R4C -> 21927 | O605: =RC[-4]-R[-1]C[-4] -> 36 | P605: =RC[-1]-R[-1]C[-1] -> 0
B606: =R[-3]C+1 -> 201 | C606: =R[-1]C+RC[1] -> 602 | D606: 1 | F606: =ROUND((R1003C-R4C)/(R1003C3)*RC3,0)+R4C -> 7088 | G606: =ROUND((R1003C-R4C)/(R1003C3)*RC3,0)+R4C -> 5539 | H606: =ROUND((R1003C-R4C)/(R1003C3)*RC3,0)+R4C -> 15677 | I606: =ROUND((R1003C-R4C)/(R1003C3)*RC3,0)+R4C -> 2848 | J606: =ROUND((R1003C-R4C)/(R1003C3)*RC3,0)+R4C -> 1540 | K606: =ROUND((R1003C-R4C)/(R1003C3)*RC3,0)+R4C -> 21963 | O606: =RC[-4]-R[-1]C[-4] -> 36 | P606: =RC[-1]-R[-1]C[-1] -> 0
B607: =R[-3]C+1 -> 202 | C607: =R[-1]C+RC[1] -> 603 | D607: 1 | F607: =ROUND((R1003C-R4C)/(R1003C3)*RC3,0)+R4C -> 7100 | G607: =ROUND((R1003C-R4C)/(R1003C3)*RC3,0)+R4C -> 5548 | H607: =ROUND((R1003C-R4C)/(R1003C3)*RC3,0)+R4C -> 15702 | I607: =ROUND((R1003C-R4C)/(R1003C3)*RC3,0)+R4C -> 2852 | J607: =ROUND((R1003C-R4C)/(R1003C3)*RC3,0)+R4C -> 1543 | K607: =ROUND((R1003C-R4C)/(R1003C3)*RC3,0)+R4C -> 21999 | O607: =RC[-4]-R[-1]C[-4] -> 36 | P607: =RC[-1]-R[-1]C[-1] -> 0
B608: =R[-3]C+1 -> 202 | C608: =R[-1]C+RC[1] -> 604 | D608: 1 | F608: =ROUND((R1003C-R4C)/(R1003C3)*RC3,0)+R4C -> 7112 | G608: =ROUND((R1003C-R4C)/(R1003C3)*RC3,0)+R4C -> 5557 | H608: =ROUND((R1003C-R4C)/(R1003C3)*RC3,0)+R4C -> 15728 | I608: =ROUND((R1003C-R4C)/(R1003C3)*RC3,0)+R4C -> 2857 | J608: =ROUND((R1003C-R4C)/(R1003C3)*RC3,0)+R4C -> 1545 | K608: =ROUND((R1003C-R4C)/(R1003C3)*RC3,0)+R4C -> 22035 | O608: =RC[-4]-R[-1]C[-4] -> 36 | P608: =RC[-1]-R[-1]C[-1] -> 0
B609: =R[-3]C+1 -> 202 | C609: =R[-1]C+RC[1] -> 605 | D609: 1 | F609: =ROUND((R1003C-R4C)/(R1003C3)*RC3,0)+R4C -> 7123 | G609: =ROUND((R1003C-R4C)/(R1003C3)*RC3,0)+R4C -> 5566 | H609: =ROUND((R1003C-R4C)/(R1003C3)*RC3,0)+R4C -> 15754 | I609: =ROUND((R1003C-R4C)/(R1003C3)*RC3,0)+R4C -> 2862 | J609: =ROUND((R1003C-R4C)/(R1003C3)*RC3,0)+R4C -> 1548 | K609: =ROUND((R1003C-R4C)/(R1003C3)*RC3,0)+R4C -> 22072 | O609: =RC[-4]-R[-1]C[-4] -> 37 | P609: =RC[-1]-R[-1]C[-1] -> 1
B610: =R[-3]C+1 -> 203 | C610: =R[-1]C+RC[1] -> 606 | D610: 1 | F610: =ROUND((R1003C-R4C)/(R1003C3)*RC3,0)+R4C -> 7135 | G610: =ROUND((R1003C-R4C)/(R1003C3)*RC3,0)+R4C -> 5575 | H610: =ROUND((R1003C-R4C)/(R1003C3)*RC3,0)+R4C -> 15780 | I610: =ROUND((R1003C-R4C)/(R1003C3)*RC3,0)+R4C -> 2867 | J610: =ROUND((R1003C-R4C)/(R1003C3)*RC3,0)+R4C -> 1550 | K610: =ROUND((R1003C-R4C)/(R1003C3)*RC3,0)+R4C -> 22108 | O610: =RC[-4]-R[-1]C[-4] -> 36 | P610: =RC[-1]-R[-1]C[-1] -> -1
B611: =R[-3]C+1 -> 203 | C611: =R[-1]C+RC[1] -> 607 | D611: 1 | F611: =ROUND((R1003C-R4C)/(R1003C3)*RC3,0)+R4C -> 7147 | G611: =ROUND((R1003C-R4C)/(R1003C3)*RC3,0)+R4C -> 5584 | H611: =ROUND((R1003C-R4C)/(R1003C3)*RC3,0)+R4C -> 15806 | I611: =ROUND((R1003C-R4C)/(R1003C3)*RC3,0)+R4C -> 2871 | J611: =ROUND((R1003C-R4C)/(R1003C3)*RC3,0)+R4C -> 1553 | K611: =ROUND((R1003C-R4C)/(R1003C3)*RC3,0)+R4C -> 22144 | O611: =RC[-4]-R[-1]C[-4] -> 36 | P611: =RC[-1]-R[-1]C[-1] -> 0
B612: =R[-3]C+1 -> 203 | C612: =R[-1]C+RC[1] -> 608 | D612: 1 | F612: =ROUND((R1003C-R4C)/(R1003C3)*RC3,0)+R4C -> 7158 | G612: =ROUND((R1003C-R4C)/(R1003C3)*RC3,0)+R4C -> 5593 | H612: =ROUND((R1003C-R4C)/(R1003C3)*RC3,0)+R4C -> 15831 | I612: =ROUND((R1003C-R4C)/(R1003C3)*RC3,0)+R4C -> 2876 | J612: =ROUND((R1003C-R4C)/(R1003C3)*RC3,0)+R4C -> 1555 | K612: =ROUND((R1003C-R4C)/(R1003C3)*RC3,0)+R4C -> 22180 | O612: =RC[-4]-R[-1]C[-4] -> 36 | P612: =RC[-1]-R[-1]C[-1] -> 0
B613: =R[-3]C+1 -> 204 | C613: =R[-1]C+RC[1] -> 609 | D613: 1 | F613: =ROUND((R1003C-R4C)/(R1003C3)*RC3,0)+R4C -> 7170 | G613: =ROUND((R1003C-R4C)/(R1003C3)*RC3,0)+R4C -> 5603 | H613: =ROUND((R1003C-R4C)/(R1003C3)*RC3,0)+R4C -> 15857 | I613: =ROUND((R1003C-R4C)/(R1003C3)*RC3,0)+R4C -> 2881 | J613: =ROUND((R1003C-R4C)/(R1003C3)*RC3,0)+R4C -> 1558 | K613: =ROUND((R1003C-R4C)/(R1003C3)*RC3,0)+R4C -> 22216 | O613: =RC[-4]-R[-1]C[-4] -> 36 | P613: =RC[-1]-R[-1]C[-1] -> 0
B614: =R[-3]C+1 -> 204 | C614: =R[-1]C+RC[1] -> 610 | D614: 1 | F614: =ROUND((R1003C-R4C)/(R1003C3)*RC3,0)+R4C -> 7182 | G614: =ROUND((R1003C-R4C)/(R1003C3)*RC3,0)+R4C -> 5612 | H614: =ROUND((R1003C-R4C)/(R1003C3)*RC3,0)+R4C -> 15883 | I614: =ROUND((R1003C-R4C)/(R1003C3)*RC3,0)+R4C -> 2885 | J614: =ROUND((R1003C-R4C)/(R1003C3)*RC3,0)+R4C -> 1560 | K614: =ROUND((R1003C-R4C)/(R1003C3)*RC3,0)+R4C -> 22253 | O614: =RC[-4]-R[-1]C[-4] -> 37 | P614: =RC[-1]-R[-1]C[-1] -> 1
B615: =R[-3]C+1 -> 204 | C615: =R[-1]C+RC[1] -> 611 | D615: 1 | F615: =ROUND((R1003C-R4C)/(R1003C3)*RC3,0)+R4C -> 7193 | G615: =ROUND((R1003C-R4C)/(R1003C3)*RC3,0)+R4C -> 5621 | H615: =ROUND((R1003C-R4C)/(R1003C3)*RC3,0)+R4C -> 15909 | I615: =ROUND((R1003C-R4C)/(R1003C3)*RC3,0)+R4C -> 2890 | J615: =ROUND((R1003C-R4C)/(R1003C3)*RC3,0)+R4C -> 1563 | K615: =ROUND((R1003C-R4C)/(R1003C3)*RC3,0)+R4C -> 22289 | O615: =RC[-4]-R[-1]C[-4] -> 36 | P615: =RC[-1]-R[-1]C[-1] -> -1
B616: =R[-3]C+1 -> 205 | C616: =R[-1]C+RC[1] -> 612 | D616: 1 | F616: =ROUND((R1003C-R4C)/(R1003C3)*RC3,0)+R4C -> 7205 | G616: =ROUND((R1003C-R4C)/(R1003C3)*RC3,0)+R4C -> 5630 | H616: =ROUND((R1003C-R4C)/(R1003C3)*RC3,0)+R4C -> 15935 | I616: =ROUND((R1003C-R4C)/(R1003C3)*RC3,0)+R4C -> 2895 | J616: =ROUND((R1003C-R4C)/(R1003C3)*RC3,0)+R4C -> 1565 | K616: =ROUND((R1003C-R4C)/(R1003C3)*RC3,0)+R4C -> 22325 | O616: =RC[-4]-R[-1]C[-4] -> 36 | P616: =RC[-1]-R[-1]C[-1] -> 0
B617: =R[-3]C+1 -> 205 | C617: =R[-1]C+RC[1] -> 613 | D617: 1 | F617: =ROUND((R1003C-R4C)/(R1003C3)*RC3,0)+R4C -> 7217 | G617: =ROUND((R1003C-R4C)/(R1003C3)*RC3,0)+R4C -> 5639 | H617: =ROUND((R1003C-R4C)/(R1003C3)*RC3,0)+R4C -> 15961 | I617: =ROUND((R1003C-R4C)/(R1003C3)*RC3,0)+R4C -> 2899 | J617: =ROUND((R1003C-R4C)/(R1003C3)*RC3,0)+R4C -> 1568 | K617: =ROUND((R1003C-R4C)/(R1003C3)*RC3,0)+R4C -> 22361 | O617: =RC[-4]-R[-1]C[-4] -> 36 | P617: =RC[-1]-R[-1]C[-1] -> 0
B618: =R[-3]C+1 -> 205 | C618: =R[-1]C+RC[1] -> 614 | D618: 1 | F618: =ROUND((R1003C-R4C)/(R1003C3)*RC3,0)+R4C -> 7228 | G618: =ROUND((R1003C-R4C)/(R1003C3)*RC3,0)+R4C -> 5648 | H618: =ROUND((R1003C-R4C)/(R1003C3)*RC3,0)+R4C -> 15986 | I618: =ROUND((R1003C-R4C)/(R1003C3)*RC3,0)+R4C -> 2904 | J618: =ROUND((R1003C-R4C)/(R1003C3)*RC3,0)+R4C -> 1570 | K618: =ROUND((R1003C-R4C)/(R1003C3)*RC3,0)+R4C -> 22397 | O618: =RC[-4]-R[-1]C[-4] -> 36 | P618: =RC[-1]-R[-1]C[-1] -> 0
B619: =R[-3]C+1 -> 206 | C619: =R[-1]C+RC[1] -> 615 | D619: 1 | F619: =ROUND((R1003C-R4C)/(R1003C3)*RC3,0)+R4C -> 7240 | G619: =ROUND((R1003C-R4C)/(R1003C3)*RC3,0)+R4C -> 5657 | H619: =ROUND((R1003C-R4C)/(R1003C3)*RC3,0)+R4C -> 16012 | I619: =ROUND((R1003C-R4C)/(R1003C3)*RC3,0)+R4C -> 2909 | J619: =ROUND((R1003C-R4C)/(R1003C3)*RC3,0)+R4C -> 1573 | K619: =ROUND((R1003C-R4C)/(R1003C3)*RC3,0)+R4C -> 22433 | O619: =RC[-4]-R[-1]C[-4] -> 36 | P619: =RC[-1]-R[-1]C[-1] -> 0
B620: =R[-3]C+1 -> 206 | C620: =R[-1]C+RC[1] -> 616 | D620: 1 | F620: =ROUND((R1003C-R4C)/(R1003C3)*RC3,0)+R4C -> 7252 | G620: =ROUND((R1003C-R4C)/(R1003C3)*RC3,0)+R4C -> 5666 | H620: =ROUND((R1003C-R4C)/(R1003C3)*RC3,0)+R4C -> 16038 | I620: =ROUND((R1003C-R4C)/(R1003C3)*RC3,0)+R4C -> 2913 | J620: =ROUND((R1003C-R4C)/(R1003C3)*RC3,0)+R4C -> 1576 | K620: =ROUND((R1003C-R4C)/(R1003C3)*RC3,0)+R4C -> 22470 | O620: =RC[-4]-R[-1]C[-4] -> 37 | P620: =RC[-1]-R[-1]C[-1] -> 1
B621: =R[-3]C+1 -> 206 | C621: =R[-1]C+RC[1] -> 617 | D621: 1 | F621: =ROUND((R1003C-R4C)/(R1003C3)*RC3,0)+R4C -> 7264 | G621: =ROUND((R1003C-R4C)/(R1003C3)*RC3,0)+R4C -> 5676 | H621: =ROUND((R1003C-R4C)/(R1003C3)*RC3,0)+R4C -> 16064 | I621: =ROUND((R1003C-R4C)/(R1003C3)*RC3,0)+R4C -> 2918 | J621: =ROUND((R1003C-R4C)/(R1003C3)*RC3,0)+R4C -> 1578 | K621: =ROUND((R1003C-R4C)/(R1003C3)*RC3,0)+R4C -> 22506 | O621: =RC[-4]-R[-1]C[-4] -> 36 | P621: =RC[-1]-R[-1]C[-1] -> -1
B622: =R[-3]C+1 -> 207 | C622: =R[-1]C+RC[1] -> 618 | D622: 1 | F622: =ROUND((R1003C-R4C)/(R1003C3)*RC3,0)+R4C -> 7275 | G622: =ROUND((R1003C-R4C)/(R1003C3)*RC3,0)+R4C -> 5685 | H622: =ROUND((R1003C-R4C)/(R1003C3)*RC3,0)+R4C -> 16090 | I622: =ROUND((R1003C-R4C)/(R1003C3)*RC3,0)+R4C -> 2923 | J622: =ROUND((R1003C-R4C)/(R1003C3)*RC3,0)+R4C -> 1581 | K622: =ROUND((R1003C-R4C)/(R1003C3)*RC3,0)+R4C -> 22542 | O622: =RC[-4]-R[-1]C[-4] -> 36 | P622: =RC[-1]-R[-1]C[-1] -> 0
B623: =R[-3]C+1 -> 207 | C623: =R[-1]C+RC[1] -> 619 | D623: 1 | F623: =ROUND((R1003C-R4C)/(R1003C3)*RC3,0)+R4C -> 7287 | G623: =ROUND((R1003C-R4C)/(R1003C3)*RC3,0)+R4C -> 5694 | H623: =ROUND((R1003C-R4C)/(R1003C3)*RC3,0)+R4C -> 16116 | I623: =ROUND((R1003C-R4C)/(R1003C3)*RC3,0)+R4C -> 2928 | J623: =ROUND((R1003C-R4C)/(R1003C3)*RC3,0)+R4C -> 1583 | K623: =ROUND((R1003C-R4C)/(R1003C3)*RC3,0)+R4C -> 22578 | O623: =RC[-4]-R[-1]C[-4] -> 36 | P623: =RC[-1]-R[-1]C[-1] -> 0
B624: =R[-3]C+1 -> 207 | C624: =R[-1]C+RC[1] -> 620 | D624: 1 | F624: =ROUND((R1003C-R4C)/(R1003C3)*RC3,0)+R4C -> 7299 | G624: =ROUND((R1003C-R4C)/(R1003C3)*RC3,0)+R4C -> 5703 | H624: =ROUND((R1003C-R4C)/(R1003C3)*RC3,0)+R4C -> 16141 | I624: =ROUND((R1003C-R4C)/(R1003C3)*RC3,0)+R4C -> 2932 | J624: =ROUND((R1003C-R4C)/(R1003C3)*RC3,0)+R4C -> 1586 | K624: =ROUND((R1003C-R4C)/(R1003C3)*RC3,0)+R4C -> 22614 | O624: =RC[-4]-R[-1]C[-4] -> 36 | P624: =RC[-1]-R[-1]C[-1] -> 0
B625: =R[-3]C+1 -> 208 | C625: =R[-1]C+RC[1] -> 621 | D625: 1 | F625: =ROUND((R1003C-R4C)/(R1003C3)*RC3,0)+R4C -> 7310 | G625: =ROUND((R1003C-R4C)/(R1003C3)*RC3,0)+R4C -> 5712 | H625: =ROUND((R1003C-R4C)/(R1003C3)*RC3,0)+R4C -> 16167 | I625: =ROUND((R1003C-R4C)/(R1003C3)*RC3,0)+R4C -> 2937 | J625: =ROUND((R1003C-R4C)/(R1003C3)*RC3,0)+R4C -> 1588 | K625: =ROUND((R1003C-R4C)/(R1003C3)*RC3,0)+R4C -> 22651 | O625: =RC[-4]-R[-1]C[-4] -> 37 | P625: =RC[-1]-R[-1]C[-1] -> 1
B626: =R[-3]C+1 -> 208 | C626: =R[-1]C+RC[1] -> 622 | D626: 1 | F626: =ROUND((R1003C-R4C)/(R1003C3)*RC3,0)+R4C -> 7322 | G626: =ROUND((R1003C-R4C)/(R1003C3)*RC3,0)+R4C -> 5721 | H626: =ROUND((R1003C-R4C)/(R1003C3)*RC3,0)+R4C -> 16193 | I626: =ROUND((R1003C-R4C)/(R1003C3)*RC3,0)+R4C -> 2942 | J626: =ROUND((R1003C-R4C)/(R1003C3)*RC3,0)+R4C -> 1591 | K626: =ROUND((R1003C-R4C)/(R1003C3)*RC3,0)+R4C -> 22687 | O626: =RC[-4]-R[-1]C[-4] -> 36 | P626: =RC[-1]-R[-1]C[-1] -> -1
B627: =R[-3]C+1 -> 208 | C627: =R[-1]C+RC[1] -> 623 | D627: 1 | F627: =ROUND((R1003C-R4C)/(R1003C3)*RC3,0)+R4C -> 7334 | G627: =ROUND((R1003C-R4C)/(R1003C3)*RC3,0)+R4C -> 5730 | H627: =ROUND((R1003C-R4C)/(R1003C3)*RC3,0)+R4C -> 16219 | I627: =ROUND((R1003C-R4C)/(R1003C3)*RC3,0)+R4C -> 2946 | J627: =ROUND((R1003C-R4C)/(R1003C3)*RC3,0)+R4C -> 1593 | K627: =ROUND((R1003C-R4C)/(R1003C3)*RC3,0)+R4C -> 22723 | O627: =RC[-4]-R[-1]C[-4] -> 36 | P627: =RC[-1]-R[-1]C[-1] -> 0
B628: =R[-3]C+1 -> 209 | C628: =R[-1]C+RC[1] -> 624 | D628: 1 | F628: =ROUND((R1003C-R4C)/(R1003C3)*RC3,0)+R4C -> 7345 | G628: =ROUND((R1003C-R4C)/(R1003C3)*RC3,0)+R4C -> 5739 | H628: =ROUND((R1003C-R4C)/(R1003C3)*RC3,0)+R4C -> 16245 | I628: =ROUND((R1003C-R4C)/(R1003C3)*RC3,0)+R4C -> 2951 | J628: =ROUND((R1003C-R4C)/(R1003C3)*RC3,0)+R4C -> 1596 | K628: =ROUND((R1003C-R4C)/(R1003C3)*RC3,0)+R4C -> 22759 | O628: =RC[-4]-R[-1]C[-4] -> 36 | P628: =RC[-1]-R[-1]C[-1] -> 0
B629: =R[-3]C+1 -> 209 | C629: =R[-1]C+RC[1] -> 625 | D629: 1 | F629: =ROUND((R1003C-R4C)/(R1003C3)*RC3,0)+R4C -> 7357 | G629: =ROUND((R1003C-R4C)/(R1003C3)*RC3,0)+R4C -> 5749 | H629: =ROUND((R1003C-R4C)/(R1003C3)*RC3,0)+R4C -> 16271 | I629: =ROUND((R1003C-R4C)/(R1003C3)*RC3,0)+R4C -> 2956 | J629: =ROUND((R1003C-R4C)/(R1003C3)*RC3,0)+R4C -> 1598 | K629: =ROUND((R1003C-R4C)/(R1003C3)*RC3,0)+R4C -> 22795 | O629: =RC[-4]-R[-1]C[-4] -> 36 | P629: =RC[-1]-R[-1]C[-1] -> 0
B630: =R[-3]C+1 -> 209 | C630: =R[-1]C+RC[1] -> 626 | D630: 1 | F630: =ROUND((R1003C-R4C)/(R1003C3)*RC3,0)+R4C -> 7369 | G630: =ROUND((R1003C-R4C)/(R1003C3)*RC3,0)+R4C -> 5758 | H630: =ROUND((R1003C-R4C)/(R1003C3)*RC3,0)+R4C -> 16296 | I630: =ROUND((R1003C-R4C)/(R1003C3)*RC3,0)+R4C -> 2960 | J630: =ROUND((R1003C-R4C)/(R1003C3)*RC3,0)+R4C -> 1601 | K630: =ROUND((R1003C-R4C)/(R1003C3)*RC3,0)+R4C -> 22831 | O630: =RC[-4]-R[-1]C[-4] -> 36 | P630: =RC[-1]-R[-1]C[-1] -> 0
B631: =R[-3]C+1 -> 210 | C631: =R[-1]C+RC[1] -> 627 | D631: 1 | F631: =ROUND((R1003C-R4C)/(R1003C3)*RC3,0)+R4C -> 7380 | G631: =ROUND((R1003C-R4C)/(R1003C3)*RC3,0)+R4C -> 5767 | H631: =ROUND((R1003C-R4C)/(R1003C3)*RC3,0)+R4C -> 16322 | I631: =ROUND((R1003C-R4C)/(R1003C3)*RC3,0)+R4C -> 2965 | J631: =ROUND((R1003C-R4C)/(R1003C3)*RC3,0)+R4C -> 1603 | K631: =ROUND((R1003C-R4C)/(R1003C3)*RC3,0)+R4C -> 22868 | O631: =RC[-4]-R[-1]C[-4] -> 37 | P631: =RC[-1]-R[-1]C[-1] -> 1
B632: =R[-3]C+1 -> 210 | C632: =R[-1]C+RC[1] -> 628 | D632: 1 | F632: =ROUND((R1003C-R4C)/(R1003C3)*RC3,0)+R4C -> 7392 | G632: =ROUND((R1003C-R4C)/(R1003C3)*RC3,0)+R4C -> 5776 | H632: =ROUND((R1003C-R4C)/(R1003C3)*RC3,0)+R4C -> 16348 | I632: =ROUND((R1003C-R4C)/(R1003C3)*RC3,0)+R4C -> 2970 | J632: =ROUND((R1003C-R4C)/(R1003C3)*RC3,0)+R4C -> 1606 | K632: =ROUND((R1003C-R4C)/(R1003C3)*RC3,0)+R4C -> 22904 | O632: =RC[-4]-R[-1]C[-4] -> 36 | P632: =RC[-1]-R[-1]C[-1] -> -1
B633: =R[-3]C+1 -> 210 | C633: =R[-1]C+RC[1] -> 629 | D633: 1 | F633: =ROUND((R1003C-R4C)/(R1003C3)*RC3,0)+R4C -> 7404 | G633: =ROUND((R1003C-R4C)/(R1003C3)*RC3,0)+R4C -> 5785 | H633: =ROUND((R1003C-R4C)/(R1003C3)*RC3,0)+R4C -> 16374 | I633: =ROUND((R1003C-R4C)/(R1003C3)*RC3,0)+R4C -> 2974 | J633: =ROUND((R1003C-R4C)/(R1003C3)*RC3,0)+R4C -> 1608 | K633: =ROUND((R1003C-R4C)/(R1003C3)*RC3,0)+R4C -> 22940 | O633: =RC[-4]-R[-1]C[-4] -> 36 | P633: =RC[-1]-R[-1]C[-1] -> 0
B634: =R[-3]C+1 -> 211 | C634: =R[-1]C+RC[1] -> 630 | D634: 1 | F634: =ROUND((R1003C-R4C)/(R1003C3)*RC3,0)+R4C -> 7415 | G634: =ROUND((R1003C-R4C)/(R1003C3)*RC3,0)+R4C -> 5794 | H634: =ROUND((R1003C-R4C)/(R1003C3)*RC3,0)+R4C -> 16400 | I634: =ROUND((R1003C-R4C)/(R1003C3)*RC3,0)+R4C -> 2979 | J634: =ROUND((R1003C-R4C)/(R1003C3)*RC3,0)+R4C -> 1611 | K634: =ROUND((R1003C-R4C)/(R1003C3)*RC3,0)+R4C -> 22976 | O634: =RC[-4]-R[-1]C[-4] -> 36 | P634: =RC[-1]-R[-1]C[-1] -> 0
B635: =R[-3]C+1 -> 211 | C635: =R[-1]C+RC[1] -> 631 | D635: 1 | F635: =ROUND((R1003C-R4C)/(R1003C3)*RC3,0)+R4C -> 7427 | G635: =ROUND((R1003C-R4C)/(R1003C3)*RC3,0)+R4C -> 5803 | H635: =ROUND((R1003C-R4C)/(R1003C3)*RC3,0)+R4C -> 16425 | I635: =ROUND((R1003C-R4C)/(R1003C3)*RC3,0)+R4C -> 2984 | J635: =ROUND((R1003C-R4C)/(R1003C3)*RC3,0)+R4C -> 1614 | K635: =ROUND((R1003C-R4C)/(R1003C3)*RC3,0)+R4C -> 23012 | O635: =RC[-4]-R[-1]C[-4] -> 36 | P635: =RC[-1]-R[-1]C[-1] -> 0
B636: =R[-3]C+1 -> 211 | C636: =R[-1]C+RC[1] -> 632 | D636: 1 | F636: =ROUND((R1003C-R4C)/(R1003C3)*RC3,0)+R4C -> 7439 | G636: =ROUND((R1003C-R4C)/(R1003C3)*RC3,0)+R4C -> 5812 | H636: =ROUND((R1003C-R4C)/(R1003C3)*RC3,0)+R4C -> 16451 | I636: =ROUND((R1003C-R4C)/(R1003C3)*RC3,0)+R4C -> 2989 | J636: =ROUND((R1003C-R4C)/(R1003C3)*RC3,0)+R4C -> 1616 | K636: =ROUND((R1003C-R4C)/(R1003C3)*RC3,0)+R4C -> 23049 | O636: =RC[-4]-R[-1]C[-4] -> 37 | P636: =RC[-1]-R[-1]C[-1] -> 1
B637: =R[-3]C+1 -> 212 | C637: =R[-1]C+RC[1] -> 633 | D637: 1 | F637: =ROUND((R1003C-R4C)/(R1003C3)*RC3,0)+R4C -> 7450 | G637: =ROUND((R1003C-R4C)/(R1003C3)*RC3,0)+R4C -> 5822 | H637: =ROUND((R1003C-R4C)/(R1003C3)*RC3,0)+R4C -> 16477 | I637: =ROUND((R1003C-R4C)/(R1003C3)*RC3,0)+R4C -> 2993 | J637: =ROUND((R1003C-R4C)/(R1003C3)*RC3,0)+R4C -> 1619 | K637: =ROUND((R1003C-R4C)/(R1003C3)*RC3,0)+R4C -> 23085 | O637: =RC[-4]-R[-1]C[-4] -> 36 | P637: =RC[-1]-R[-1]C[-1] -> -1
B638: =R[-3]C+1 -> 212 | C638: =R[-1]C+RC[1] -> 634 | D638: 1 | F638: =ROUND((R1003C-R4C)/(R1003C3)*RC3,0)+R4C -> 7462 | G638: =ROUND((R1003C-R4C)/(R1003C3)*RC3,0)+R4C -> 5831 | H638: =ROUND((R1003C-R4C)/(R1003C3)*RC3,0)+R4C -> 16503 | I638: =ROUND((R1003C-R4C)/(R1003C3)*RC3,0)+R4C -> 2998 | J638: =ROUND((R1003C-R4C)/(R1003C3)*RC3,0)+R4C -> 1621 | K638: =ROUND((R1003C-R4C)/(R1003C3)*RC3,0)+R4C -> 23121 | O638: =RC[-4]-R[-1]C[-4] -> 36 | P638: =RC[-1]-R[-1]C[-1] -> 0
B639: =R[-3]C+1 -> 212 | C639: =R[-1]C+RC[1] -> 635 | D639: 1 | F639: =ROUND((R1003C-R4C)/(R1003C3)*RC3,0)+R4C -> 7474 | G639: =ROUND((R1003C-R4C)/(R1003C3)*RC3,0)+R4C -> 5840 | H639: =ROUND((R1003C-R4C)/(R1003C3)*RC3,0)+R4C -> 16529 | I639: =ROUND((R1003C-R4C)/(R1003C3)*RC3,0)+R4C -> 3003 | J639: =ROUND((R1003C-R4C)/(R1003C3)*RC3,0)+R4C -> 1624 | K639: =ROUND((R1003C-R4C)/(R1003C3)*RC3,0)+R4C -> 23157 | O639: =RC[-4]-R[-1]C[-4] -> 36 | P639: =RC[-1]-R[-1]C[-1] -> 0
B640: =R[-3]C+1 -> 213 | C640: =R[-1]C+RC[1] -> 636 | D640: 1 | F640: =ROUND((R1003C-R4C)/(R1003C3)*RC3,0)+R4C -> 7485 | G640: =ROUND((R1003C-R4C)/(R1003C3)*RC3,0)+R4C -> 5849 | H640: =ROUND((R1003C-R4C)/(R1003C3)*RC3,0)+R4C -> 16555 | I640: =ROUND((R1003C-R4C)/(R1003C3)*RC3,0)+R4C -> 3007 | J640: =ROUND((R1003C-R4C)/(R1003C3)*RC3,0)+R4C -> 1626 | K640: =ROUND((R1003C-R4C)/(R1003C3)*RC3,0)+R4C -> 23193 | O640: =RC[-4]-R[-1]C[-4] -> 36 | P640: =RC[-1]-R[-1]C[-1] -> 0
B641: =R[-3]C+1 -> 213 | C641: =R[-1]C+RC[1] -> 637 | D641: 1 | F641: =ROUND((R1003C-R4C)/(R1003C3)*RC3,0)+R4C -> 7497 | G641: =ROUND((R1003C-R4C)/(R1003C3)*RC3,0)+R4C -> 5858 | H641: =ROUND((R1003C-R4C)/(R1003C3)*RC3,0)+R4C -> 16580 | I641: =ROUND((R1003C-R4C)/(R1003C3)*RC3,0)+R4C -> 3012 | J641: =ROUND((R1003C-R4C)/(R1003C3)*RC3,0)+R4C -> 1629 | K641: =ROUND((R1003C-R4C)/(R1003C3)*RC3,0)+R4C -> 23229 | O641: =RC[-4]-R[-1]C[-4] -> 36 | P641: =RC[-1]-R[-1]C[-1] -> 0
B642: =R[-3]C+1 -> 213 | C642: =R[-1]C+RC[1] -> 638 | D642: 1 | F642: =ROUND((R1003C-R4C)/(R1003C3)*RC3,0)+R4C -> 7509 | G642: =ROUND((R1003C-R4C)/(R1003C3)*RC3,0)+R4C -> 5867 | H642: =ROUND((R1003C-R4C)/(R1003C3)*RC3,0)+R4C -> 16606 | I642: =ROUND((R1003C-R4C)/(R1003C3)*RC3,0)+R4C -> 3017 | J642: =ROUND((R1003C-R4C)/(R1003C3)*RC3,0)+R4C -> 1631 | K642: =ROUND((R1003C-R4C)/(R1003C3)*RC3,0)+R4C -> 23266 | O642: =RC[-4]-R[-1]C[-4] -> 37 | P642: =RC[-1]-R[-1]C[-1] -> 1
B643: =R[-3]C+1 -> 214 | C643: =R[-1]C+RC[1] -> 639 | D643: 1 | F643: =ROUND((R1003C-R4C)/(R1003C3)*RC3,0)+R4C -> 7520 | G643: =ROUND((R1003C-R4C)/(R1003C3)*RC3,0)+R4C -> 5876 | H643: =ROUND((R1003C-R4C)/(R1003C3)*RC3,0)+R4C -> 16632 | I643: =ROUND((R1003C-R4C)/(R1003C3)*RC3,0)+R4C -> 3021 | J643: =ROUND((R1003C-R4C)/(R1003C3)*RC3,0)+R4C -> 1634 | K643: =ROUND((R1003C-R4C)/(R1003C3)*RC3,0)+R4C -> 23302 | O643: =RC[-4]-R[-1]C[-4] -> 36 | P643: =RC[-1]-R[-1]C[-1] -> -1
B644: =R[-3]C+1 -> 214 | C644: =R[-1]C+RC[1] -> 640 | D644: 1 | F644: =ROUND((R1003C-R4C)/(R1003C3)*RC3,0)+R4C -> 7532 | G644: =ROUND((R1003C-R4C)/(R1003C3)*RC3,0)+R4C -> 5885 | H644: =ROUND((R1003C-R4C)/(R1003C3)*RC3,0)+R4C -> 16658 | I644: =ROUND((R1003C-R4C)/(R1003C3)*RC3,0)+R4C -> 3026 | J644: =ROUND((R1003C-R4C)/(R1003C3)*RC3,0)+R4C -> 1636 | K644: =ROUND((R1003C-R4C)/(R1003C3)*RC3,0)+R4C -> 23338 | O644: =RC[-4]-R[-1]C[-4] -> 36 | P644: =RC[-1]-R[-1]C[-1] -> 0
B645: =R[-3]C+1 -> 214 | C645: =R[-1]C+RC[1] -> 641 | D645: 1 | F645: =ROUND((R1003C-R4C)/(R1003C3)*RC3,0)+R4C -> 7544 | G645: =ROUND((R1003C-R4C)/(R1003C3)*RC3,0)+R4C -> 5895 | H645: =ROUND((R1003C-R4C)/(R1003C3)*RC3,0)+R4C -> 16684 | I645: =ROUND((R1003C-R4C)/(R1003C3)*RC3,0)+R4C -> 3031 | J645: =ROUND((R1003C-R4C)/(R1003C3)*RC3,0)+R4C -> 1639 | K645: =ROUND((R1003C-R4C)/(R1003C3)*RC3,0)+R4C -> 23374 | O645: =RC[-4]-R[-1]C[-4] -> 36 | P645: =RC[-1]-R[-1]C[-1] -> 0
B646: =R[-3]C+1 -> 215 | C646: =R[-1]C+RC[1] -> 642 | D646: 1 | F646: =ROUND((R1003C-R4C)/(R1003C3)*RC3,0)+R4C -> 7555 | G646: =ROUND((R1003C-R4C)/(R1003C3)*RC3,0)+R4C -> 5904 | H646: =ROUND((R1003C-R4C)/(R1003C3)*RC3,0)+R4C -> 16710 | I646: =ROUND((R1003C-R4C)/(R1003C3)*RC3,0)+R4C -> 3035 | J646: =ROUND((R1003C-R4C)/(R1003C3)*RC3,0)+R4C -> 1641 | K646: =ROUND((R1003C-R4C)/(R1003C3)*RC3,0)+R4C -> 23410 | O646: =RC[-4]-R[-1]C[-4] -> 36 | P646: =RC[-1]-R[-1]C[-1] -> 0
B647: =R[-3]C+1 -> 215 | C647: =R[-1]C+RC[1] -> 643 | D647: 1 | F647: =ROUND((R1003C-R4C)/(R1003C3)*RC3,0)+R4C -> 7567 | G647: =ROUND((R1003C-R4C)/(R1003C3)*RC3,0)+R4C -> 5913 | H647: =ROUND((R1003C-R4C)/(R1003C3)*RC3,0)+R4C -> 16735 | I647: =ROUND((R1003C-R4C)/(R1003C3)*RC3,0)+R4C -> 3040 | J647: =ROUND((R1003C-R4C)/(R1003C3)*RC3,0)+R4C -> 1644 | K647: =ROUND((R1003C-R4C)/(R1003C3)*RC3,0)+R4C -> 23446 | O647: =RC[-4]-R[-1]C[-4] -> 36 | P647: =RC[-1]-R[-1]C[-1] -> 0
B648: =R[-3]C+1 -> 215 | C648: =R[-1]C+RC[1] -> 644 | D648: 1 | F648: =ROUND((R1003C-R4C)/(R1003C3)*RC3,0)+R4C -> 7579 | G648: =ROUND((R1003C-R4C)/(R1003C3)*RC3,0)+R4C -> 5922 | H648: =ROUND((R1003C-R4C)/(R1003C3)*RC3,0)+R4C -> 16761 | I648: =ROUND((R1003C-R4C)/(R1003C3)*RC3,0)+R4C -> 3045 | J648: =ROUND((R1003C-R4C)/(R1003C3)*RC3,0)+R4C -> 1647 | K648: =ROUND((R1003C-R4C)/(R1003C3)*RC3,0)+R4C -> 23483 | O648: =RC[-4]-R[-1]C[-4] -> 37 | P648: =RC[-1]-R[-1]C[-1] -> 1
B649: =R[-3]C+1 -> 216 | C649: =R[-1]C+RC[1] -> 645 | D649: 1 | F649: =ROUND((R1003C-R4C)/(R1003C3)*RC3,0)+R4C -> 7590 | G649: =ROUND((R1003C-R4C)/(R1003C3)*RC3,0)+R4C -> 5931 | H649: =ROUND((R1003C-R4C)/(R1003C3)*RC3,0)+R4C -> 16787 | I649: =ROUND((R1003C-R4C)/(R1003C3)*RC3,0)+R4C -> 3049 | J649: =ROUND((R1003C-R4C)/(R1003C3)*RC3,0)+R4C -> 1649 | K649: =ROUND((R1003C-R4C)/(R1003C3)*RC3,0)+R4C -> 23519 | O649: =RC[-4]-R[-1]C[-4] -> 36 | P649: =RC[-1]-R[-1]C[-1] -> -1
B650: =R[-3]C+1 -> 216 | C650: =R[-1]C+RC[1] -> 646 | D650: 1 | F650: =ROUND((R1003C-R4C)/(R1003C3)*RC3,0)+R4C -> 7602 | G650: =ROUND((R1003C-R4C)/(R1003C3)*RC3,0)+R4C -> 5940 | H650: =ROUND((R1003C-R4C)/(R1003C3)*RC3,0)+R4C -> 16813 | I650: =ROUND((R1003C-R4C)/(R1003C3)*RC3,0)+R4C -> 3054 | J650: =ROUND((R1003C-R4C)/(R1003C3)*RC3,0)+R4C -> 1652 | K650: =ROUND((R1003C-R4C)/(R1003C3)*RC3,0)+R4C -> 23555 | O650: =RC[-4]-R[-1]C[-4] -> 36 | P650: =RC[-1]-R[-1]C[-1] -> 0
B651: =R[-3]C+1 -> 216 | C651: =R[-1]C+RC[1] -> 647 | D651: 1 | F651: =ROUND((R1003C-R4C)/(R1003C3)*RC3,0)+R4C -> 7614 | G651: =ROUND((R1003C-R4C)/(R1003C3)*RC3,0)+R4C -> 5949 | H651: =ROUND((R1003C-R4C)/(R1003C3)*RC3,0)+R4C -> 16839 | I651: =ROUND((R1003C-R4C)/(R1003C3)*RC3,0)+R4C -> 3059 | J651: =ROUND((R1003C-R4C)/(R1003C3)*RC3,0)+R4C -> 1654 | K651: =ROUND((R1003C-R4C)/(R1003C3)*RC3,0)+R4C -> 23591 | O651: =RC[-4]-R[-1]C[-4] -> 36 | P651: =RC[-1]-R[-1]C[-1] -> 0
B652: =R[-3]C+1 -> 217 | C652: =R[-1]C+RC[1] -> 648 | D652: 1 | F652: =ROUND((R1003C-R4C)/(R1003C3)*RC3,0)+R4C -> 7625 | G652: =ROUND((R1003C-R4C)/(R1003C3)*RC3,0)+R4C -> 5958 | H652: =ROUND((R1003C-R4C)/(R1003C3)*RC3,0)+R4C -> 16864 | I652: =ROUND((R1003C-R4C)/(R1003C3)*RC3,0)+R4C -> 3064 | J652: =ROUND((R1003C-R4C)/(R1003C3)*RC3,0)+R4C -> 1657 | K652: =ROUND((R1003C-R4C)/(R1003C3)*RC3,0)+R4C -> 23627 | O652: =RC[-4]-R[-1]C[-4] -> 36 | P652: =RC[-1]-R[-1]C[-1] -> 0
B653: =R[-3]C+1 -> 217 | C653: =R[-1]C+RC[1] -> 649 | D653: 1 | F653: =ROUND((R1003C-R4C)/(R1003C3)*RC3,0)+R4C -> 7637 | G653: =ROUND((R1003C-R4C)/(R1003C3)*RC3,0)+R4C -> 5968 | H653: =ROUND((R1003C-R4C)/(R1003C3)*RC3,0)+R4C -> 16890 | I653: =ROUND((R1003C-R4C)/(R1003C3)*RC3,0)+R4C -> 3068 | J653: =ROUND((R1003C-R4C)/(R1003C3)*RC3,0)+R4C -> 1659 | K653: =ROUND((R1003C-R4C)/(R1003C3)*RC3,0)+R4C -> 23664 | O653: =RC[-4]-R[-1]C[-4] -> 37 | P653: =RC[-1]-R[-1]C[-1] -> 1
B654: =R[-3]C+1 -> 217 | C654: =R[-1]C+RC[1] -> 650 | D654: 1 | F654: =ROUND((R1003C-R4C)/(R1003C3)*RC3,0)+R4C -> 7649 | G654: =ROUND((R1003C-R4C)/(R1003C3)*RC3,0)+R4C -> 5977 | H654: =ROUND((R1003C-R4C)/(R1003C3)*RC3,0)+R4C -> 16916 | I654: =ROUND((R1003C-R4C)/(R1003C3)*RC3,0)+R4C -> 3073 | J654: =ROUND((R1003C-R4C)/(R1003C3)*RC3,0)+R4C -> 1662 | K654: =ROUND((R1003C-R4C)/(R1003C3)*RC3,0)+R4C -> 23700 | O654: =RC[-4]-R[-1]C[-4] -> 36 | P654: =RC[-1]-R[-1]C[-1] -> -1
B655: =R[-3]C+1 -> 218 | C655: =R[-1]C+RC[1] -> 651 | D655: 1 | F655: =ROUND((R1003C-R4C)/(R1003C3)*RC3,0)+R4C -> 7661 | G655: =ROUND((R1003C-R4C)/(R1003C3)*RC3,0)+R4C -> 5986 | H655: =ROUND((R1003C-R4C)/(R1003C3)*RC3,0)+R4C -> 16942 | I655: =ROUND((R1003C-R4C)/(R1003C3)*RC3,0)+R4C -> 3078 | J655: =ROUND((R1003C-R4C)/(R1003C3)*RC3,0)+R4C -> 1664 | K655: =ROUND((R1003C-R4C)/(R1003C3)*RC3,0)+R4C -> 23736 | O655: =RC[-4]-R[-1]C[-4] -> 36 | P655: =RC[-1]-R[-1]C[-1] -> 0
B656: =R[-3]C+1 -> 218 | C656: =R[-1]C+RC[1] -> 652 | D656: 1 | F656: =ROUND((R1003C-R4C)/(R1003C3)*RC3,0)+R4C -> 7672 | G656: =ROUND((R1003C-R4C)/(R1003C3)*RC3,0)+R4C -> 5995 | H656: =ROUND((R1003C-R4C)/(R1003C3)*RC3,0)+R4C -> 16968 | I656: =ROUND((R1003C-R4C)/(R1003C3)*RC3,0)+R4C -> 3082 | J656: =ROUND((R1003C-R4C)/(R1003C3)*RC3,0)+R4C -> 1667 | K656: =ROUND((R1003C-R4C)/(R1003C3)*RC3,0)+R4C -> 23772 | O656: =RC[-4]-R[-1]C[-4] -> 36 | P656: =RC[-1]-R[-1]C[-1] -> 0
B657: =R[-3]C+1 -> 218 | C657: =R[-1]C+RC[1] -> 653 | D657: 1 | F657: =ROUND((R1003C-R4C)/(R1003C3)*RC3,0)+R4C -> 7684 | G657: =ROUND((R1003C-R4C)/(R1003C3)*RC3,0)+R4C -> 6004 | H657: =ROUND((R1003C-R4C)/(R1003C3)*RC3,0)+R4C -> 16994 | I657: =ROUND((R1003C-R4C)/(R1003C3)*RC3,0)+R4C -> 3087 | J657: =ROUND((R1003C-R4C)/(R1003C3)*RC3,0)+R4C -> 1669 | K657: =ROUND((R1003C-R4C)/(R1003C3)*RC3,0)+R4C -> 23808 | O657: =RC[-4]-R[-1]C[-4] -> 36 | P657: =RC[-1]-R[-1]C[-1] -> 0
B658: =R[-3]C+1 -> 219 | C658: =R[-1]C+RC[1] -> 654 | D658: 1 | F658: =ROUND((R1003C-R4C)/(R1003C3)*RC3,0)+R4C -> 7696 | G658: =ROUND((R1003C-R4C)/(R1003C3)*RC3,0)+R4C -> 6013 | H658: =ROUND((R1003C-R4C)/(R1003C3)*RC3,0)+R4C -> 17019 | I658: =ROUND((R1003C-R4C)/(R1003C3)*RC3,0)+R4C -> 3092 | J658: =ROUND((R1003C-R4C)/(R1003C3)*RC3,0)+R4C -> 1672 | K658: =ROUND((R1003C-R4C)/(R1003C3)*RC3,0)+R4C -> 23844 | O658: =RC[-4]-R[-1]C[-4] -> 36 | P658: =RC[-1]-R[-1]C[-1] -> 0
B659: =R[-3]C+1 -> 219 | C659: =R[-1]C+RC[1] -> 655 | D659: 1 | F659: =ROUND((R1003C-R4C)/(R1003C3)*RC3,0)+R4C -> 7707 | G659: =ROUND((R1003C-R4C)/(R1003C3)*RC3,0)+R4C -> 6022 | H659: =ROUND((R1003C-R4C)/(R1003C3)*RC3,0)+R4C -> 17045 | I659: =ROUND((R1003C-R4C)/(R1003C3)*RC3,0)+R4C -> 3096 | J659: =ROUND((R1003C-R4C)/(R1003C3)*RC3,0)+R4C -> 1674 | K659: =ROUND((R1003C-R4C)/(R1003C3)*RC3,0)+R4C -> 23881 | O659: =RC[-4]-R[-1]C[-4] -> 37 | P659: =RC[-1]-R[-1]C[-1] -> 1
B660: =R[-3]C+1 -> 219 | C660: =R[-1]C+RC[1] -> 656 | D660: 1 | F660: =ROUND((R1003C-R4C)/(R1003C3)*RC3,0)+R4C -> 7719 | G660: =ROUND((R1003C-R4C)/(R1003C3)*RC3,0)+R4C -> 6031 | H660: =ROUND((R1003C-R4C)/(R1003C3)*RC3,0)+R4C -> 17071 | I660: =ROUND((R1003C-R4C)/(R1003C3)*RC3,0)+R4C -> 3101 | J660: =ROUND((R1003C-R4C)/(R1003C3)*RC3,0)+R4C -> 1677 | K660: =ROUND((R1003C-R4C)/(R1003C3)*RC3,0)+R4C -> 23917 | O660: =RC[-4]-R[-1]C[-4] -> 36 | P660: =RC[-1]-R[-1]C[-1] -> -1
B661: =R[-3]C+1 -> 220 | C661: =R[-1]C+RC[1] -> 657 | D661: 1 | F661: =ROUND((R1003C-R4C)/(R1003C3)*RC3,0)+R4C -> 7731 | G661: =ROUND((R1003C-R4C)/(R1003C3)*RC3,0)+R4C -> 6041 | H661: =ROUND((R1003C-R4C)/(R1003C3)*RC3,0)+R4C -> 17097 | I661: =ROUND((R1003C-R4C)/(R1003C3)*RC3,0)+R4C -> 3106 | J661: =ROUND((R1003C-R4C)/(R1003C3)*RC3,0)+R4C -> 1680 | K661: =ROUND((R1003C-R4C)/(R1003C3)*RC3,0)+R4C -> 23953 | O661: =RC[-4]-R[-1]C[-4] -> 36 | P661: =RC[-1]-R[-1]C[-1] -> 0
B662: =R[-3]C+1 -> 220 | C662: =R[-1]C+RC[1] -> 658 | D662: 1 | F662: =ROUND((R1003C-R4C)/(R1003C3)*RC3,0)+R4C -> 7742 | G662: =ROUND((R1003C-R4C)/(R1003C3)*RC3,0)+R4C -> 6050 | H662: =ROUND((R1003C-R4C)/(R1003C3)*RC3,0)+R4C -> 17123 | I662: =ROUND((R1003C-R4C)/(R1003C3)*RC3,0)+R4C -> 3110 | J662: =ROUND((R1003C-R4C)/(R1003C3)*RC3,0)+R4C -> 1682 | K662: =ROUND((R1003C-R4C)/(R1003C3)*RC3,0)+R4C -> 23989 | O662: =RC[-4]-R[-1]C[-4] -> 36 | P662: =RC[-1]-R[-1]C[-1] -> 0
B663: =R[-3]C+1 -> 220 | C663: =R[-1]C+RC[1] -> 659 | D663: 1 | F663: =ROUND((R1003C-R4C)/(R1003C3)*RC3,0)+R4C -> 7754 | G663: =ROUND((R1003C-R4C)/(R1003C3)*RC3,0)+R4C -> 6059 | H663: =ROUND((R1003C-R4C)/(R1003C3)*RC3,0)+R4C -> 17149 | I663: =ROUND((R1003C-R4C)/(R1003C3)*RC3,0)+R4C -> 3115 | J663: =ROUND((R1003C-R4C)/(R1003C3)*RC3,0)+R4C -> 1685 | K663: =ROUND((R1003C-R4C)/(R1003C3)*RC3,0)+R4C -> 24025 | O663: =RC[-4]-R[-1]C[-4] -> 36 | P663: =RC[-1]-R[-1]C[-1] -> 0
B664: =R[-3]C+1 -> 221 | C664: =R[-1]C+RC[1] -> 660 | D664: 1 | F664: =ROUND((R1003C-R4C)/(R1003C3)*RC3,0)+R4C -> 7766 | G664: =ROUND((R1003C-R4C)/(R1003C3)*RC3,0)+R4C -> 6068 | H664: =ROUND((R1003C-R4C)/(R1003C3)*RC3,0)+R4C -> 17174 | I664: =ROUND((R1003C-R4C)/(R1003C3)*RC3,0)+R4C -> 3120 | J664: =ROUND((R1003C-R4C)/(R1003C3)*RC3,0)+R4C -> 1687 | K664: =ROUND((R1003C-R4C)/(R1003C3)*RC3,0)+R4C -> 24062 | O664: =RC[-4]-R[-1]C[-4] -> 37 | P664: =RC[-1]-R[-1]C[-1] -> 1
B665: =R[-3]C+1 -> 221 | C665: =R[-1]C+RC[1] -> 661 | D665: 1 | F665: =ROUND((R1003C-R4C)/(R1003C3)*RC3,0)+R4C -> 7777 | G665: =ROUND((R1003C-R4C)/(R1003C3)*RC3,0)+R4C -> 6077 | H665: =ROUND((R1003C-R4C)/(R1003C3)*RC3,0)+R4C -> 17200 | I665: =ROUND((R1003C-R4C)/(R1003C3)*RC3,0)+R4C -> 3125 | J665: =ROUND((R1003C-R4C)/(R1003C3)*RC3,0)+R4C -> 1690 | K665: =ROUND((R1003C-R4C)/(R1003C3)*RC3,0)+R4C -> 24098 | O665: =RC[-4]-R[-1]C[-4] -> 36 | P665: =RC[-1]-R[-1]C[-1] -> -1
B666: =R[-3]C+1 -> 221 | C666: =R[-1]C+RC[1] -> 662 | D666: 1 | F666: =ROUND((R1003C-R4C)/(R1003C3)*RC3,0)+R4C -> 7789 | G666: =ROUND((R1003C-R4C)/(R1003C3)*RC3,0)+R4C -> 6086 | H666: =ROUND((R1003C-R4C)/(R1003C3)*RC3,0)+R4C -> 17226 | I666: =ROUND((R1003C-R4C)/(R1003C3)*RC3,0)+R4C -> 3129 | J666: =ROUND((R1003C-R4C)/(R1003C3)*RC3,0)+R4C -> 1692 | K666: =ROUND((R1003C-R4C)/(R1003C3)*RC3,0)+R4C -> 24134 | O666: =RC[-4]-R[-1]C[-4] -> 36 | P666: =RC[-1]-R[-1]C[-1] -> 0
B667: =R[-3]C+1 -> 222 | C667: =R[-1]C+RC[1] -> 663 | D667: 1 | F667: =ROUND((R1003C-R4C)/(R1003C3)*RC3,0)+R4C -> 7801 | G667: =ROUND((R1003C-R4C)/(R1003C3)*RC3,0)+R4C -> 6095 | H667: =ROUND((R1003C-R4C)/(R1003C3)*RC3,0)+R4C -> 17252 | I667: =ROUND((R1003C-R4C)/(R1003C3)*RC3,0)+R4C -> 3134 | J667: =ROUND((R1003C-R4C)/(R1003C3)*RC3,0)+R4C -> 1695 | K667: =ROUND((R1003C-R4C)/(R1003C3)*RC3,0)+R4C -> 24170 | O667: =RC[-4]-R[-1]C[-4] -> 36 | P667: =RC[-1]-R[-1]C[-1] -> 0
B668: =R[-3]C+1 -> 222 | C668: =R[-1]C+RC[1] -> 664 | D668: 1 | F668: =ROUND((R1003C-R4C)/(R1003C3)*RC3,0)+R4C -> 7812 | G668: =ROUND((R1003C-R4C)/(R1003C3)*RC3,0)+R4C -> 6104 | H668: =ROUND((R1003C-R4C)/(R1003C3)*RC3,0)+R4C -> 17278 | I668: =ROUND((R1003C-R4C)/(R1003C3)*RC3,0)+R4C -> 3139 | J668: =ROUND((R1003C-R4C)/(R1003C3)*RC3,0)+R4C -> 1697 | K668: =ROUND((R1003C-R4C)/(R1003C3)*RC3,0)+R4C -> 24206 | O668: =RC[-4]-R[-1]C[-4] -> 36 | P668: =RC[-1]-R[-1]C[-1] -> 0
B669: =R[-3]C+1 -> 222 | C669: =R[-1]C+RC[1] -> 665 | D669: 1 | F669: =ROUND((R1003C-R4C)/(R1003C3)*RC3,0)+R4C -> 7824 | G669: =ROUND((R1003C-R4C)/(R1003C3)*RC3,0)+R4C -> 6114 | H669: =ROUND((R1003C-R4C)/(R1003C3)*RC3,0)+R4C -> 17304 | I669: =ROUND((R1003C-R4C)/(R1003C3)*RC3,0)+R4C -> 3143 | J669: =ROUND((R1003C-R4C)/(R1003C3)*RC3,0)+R4C -> 1700 | K669: =ROUND((R1003C-R4C)/(R1003C3)*RC3,0)+R4C -> 24242 | O669: =RC[-4]-R[-1]C[-4] -> 36 | P669: =RC[-1]-R[-1]C[-1] -> 0
B670: =R[-3]C+1 -> 223 | C670: =R[-1]C+RC[1] -> 666 | D670: 1 | F670: =ROUND((R1003C-R4C)/(R1003C3)*RC3,0)+R4C -> 7836 | G670: =ROUND((R1003C-R4C)/(R1003C3)*RC3,0)+R4C -> 6123 | H670: =ROUND((R1003C-R4C)/(R1003C3)*RC3,0)+R4C -> 17329 | I670: =ROUND((R1003C-R4C)/(R1003C3)*RC3,0)+R4C -> 3148 | J670: =ROUND((R1003C-R4C)/(R1003C3)*RC3,0)+R4C -> 1702 | K670: =ROUND((R1003C-R4C)/(R1003C3)*RC3,0)+R4C -> 24279 | O670: =RC[-4]-R[-1]C[-4] -> 37 | P670: =RC[-1]-R[-1]C[-1] -> 1
B671: =R[-3]C+1 -> 223 | C671: =R[-1]C+RC[1] -> 667 | D671: 1 | F671: =ROUND((R1003C-R4C)/(R1003C3)*RC3,0)+R4C -> 7847 | G671: =ROUND((R1003C-R4C)/(R1003C3)*RC3,0)+R4C -> 6132 | H671: =ROUND((R1003C-R4C)/(R1003C3)*RC3,0)+R4C -> 17355 | I671: =ROUND((R1003C-R4C)/(R1003C3)*RC3,0)+R4C -> 3153 | J671: =ROUND((R1003C-R4C)/(R1003C3)*RC3,0)+R4C -> 1705 | K671: =ROUND((R1003C-R4C)/(R1003C3)*RC3,0)+R4C -> 24315 | O671: =RC[-4]-R[-1]C[-4] -> 36 | P671: =RC[-1]-R[-1]C[-1] -> -1
B672: =R[-3]C+1 -> 223 | C672: =R[-1]C+RC[1] -> 668 | D672: 1 | F672: =ROUND((R1003C-R4C)/(R1003C3)*RC3,0)+R4C -> 7859 | G672: =ROUND((R1003C-R4C)/(R1003C3)*RC3,0)+R4C -> 6141 | H672: =ROUND((R1003C-R4C)/(R1003C3)*RC3,0)+R4C -> 17381 | I672: =ROUND((R1003C-R4C)/(R1003C3)*RC3,0)+R4C -> 3157 | J672: =ROUND((R1003C-R4C)/(R1003C3)*RC3,0)+R4C -> 1707 | K672: =ROUND((R1003C-R4C)/(R1003C3)*RC3,0)+R4C -> 24351 | O672: =RC[-4]-R[-1]C[-4] -> 36 | P672: =RC[-1]-R[-1]C[-1] -> 0
B673: =R[-3]C+1 -> 224 | C673: =R[-1]C+RC[1] -> 669 | D673: 1 | F673: =ROUND((R1003C-R4C)/(R1003C3)*RC3,0)+R4C -> 7871 | G673: =ROUND((R1003C-R4C)/(R1003C3)*RC3,0)+R4C -> 6150 | H673: =ROUND((R1003C-R4C)/(R1003C3)*RC3,0)+R4C -> 17407 | I673: =ROUND((R1003C-R4C)/(R1003C3)*RC3,0)+R4C -> 3162 | J673: =ROUND((R1003C-R4C)/(R1003C3)*RC3,0)+R4C -> 1710 | K673: =ROUND((R1003C-R4C)/(R1003C3)*RC3,0)+R4C -> 24387 | O673: =RC[-4]-R[-1]C[-4] -> 36 | P673: =RC[-1]-R[-1]C[-1] -> 0
B674: =R[-3]C+1 -> 224 | C674: =R[-1]C+RC[1] -> 670 | D674: 1 | F674: =ROUND((R1003C-R4C)/(R1003C3)*RC3,0)+R4C -> 7882 | G674: =ROUND((R1003C-R4C)/(R1003C3)*RC3,0)+R4C -> 6159 | H674: =ROUND((R1003C-R4C)/(R1003C3)*RC3,0)+R4C -> 17433 | I674: =ROUND((R1003C-R4C)/(R1003C3)*RC3,0)+R4C -> 3167 | J674: =ROUND((R1003C-R4C)/(R1003C3)*RC3,0)+R4C -> 1712 | K674: =ROUND((R1003C-R4C)/(R1003C3)*RC3,0)+R4C -> 24423 | O674: =RC[-4]-R[-1]C[-4] -> 36 | P674: =RC[-1]-R[-1]C[-1] -> 0
B675: =R[-3]C+1 -> 224 | C675: =R[-1]C+RC[1] -> 671 | D675: 1 | F675: =ROUND((R1003C-R4C)/(R1003C3)*RC3,0)+R4C -> 7894 | G675: =ROUND((R1003C-R4C)/(R1003C3)*RC3,0)+R4C -> 6168 | H675: =ROUND((R1003C-R4C)/(R1003C3)*RC3,0)+R4C -> 17458 | I675: =ROUND((R1003C-R4C)/(R1003C3)*RC3,0)+R4C -> 3171 | J675: =ROUND((R1003C-R4C)/(R1003C3)*RC3,0)+R4C -> 1715 | K675: =ROUND((R1003C-R4C)/(R1003C3)*RC3,0)+R4C -> 24460 | O675: =RC[-4]-R[-1]C[-4] -> 37 | P675: =RC[-1]-R[-1]C[-1] -> 1
B676: =R[-3]C+1 -> 225 | C676: =R[-1]C+RC[1] -> 672 | D676: 1 | F676: =ROUND((R1003C-R4C)/(R1003C3)*RC3,0)+R4C -> 7906 | G676: =ROUND((R1003C-R4C)/(R1003C3)*RC3,0)+R4C -> 6177 | H676: =ROUND((R1003C-R4C)/(R1003C3)*RC3,0)+R4C -> 17484 | I676: =ROUND((R1003C-R4C)/(R1003C3)*RC3,0)+R4C -> 3176 | J676: =ROUND((R1003C-R4C)/(R1003C3)*RC3,0)+R4C -> 1718 | K676: =ROUND((R1003C-R4C)/(R1003C3)*RC3,0)+R4C -> 24496 | O676: =RC[-4]-R[-1]C[-4] -> 36 | P676: =RC[-1]-R[-1]C[-1] -> -1
B677: =R[-3]C+1 -> 225 | C677: =R[-1]C+RC[1] -> 673 | D677: 1 | F677: =ROUND((R1003C-R4C)/(R1003C3)*RC3,0)+R4C -> 7917 | G677: =ROUND((R1003C-R4C)/(R1003C3)*RC3,0)+R4C -> 6187 | H677: =ROUND((R1003C-R4C)/(R1003C3)*RC3,0)+R4C -> 17510 | I677: =ROUND((R1003C-R4C)/(R1003C3)*RC3,0)+R4C -> 3181 | J677: =ROUND((R1003C-R4C)/(R1003C3)*RC3,0)+R4C -> 1720 | K677: =ROUND((R1003C-R4C)/(R1003C3)*RC3,0)+R4C -> 24532 | O677: =RC[-4]-R[-1]C[-4] -> 36 | P677: =RC[-1]-R[-1]C[-1] -> 0
B678: =R[-3]C+1 -> 225 | C678: =R[-1]C+RC[1] -> 674 | D678: 1 | F678: =ROUND((R1003C-R4C)/(R1003C3)*RC3,0)+R4C -> 7929 | G678: =ROUND((R1003C-R4C)/(R1003C3)*RC3,0)+R4C -> 6196 | H678: =ROUND((R1003C-R4C)/(R1003C3)*RC3,0)+R4C -> 17536 | I678: =ROUND((R1003C-R4C)/(R1003C3)*RC3,0)+R4C -> 3186 | J678: =ROUND((R1003C-R4C)/(R1003C3)*RC3,0)+R4C -> 1723 | K678: =ROUND((R1003C-R4C)/(R1003C3)*RC3,0)+R4C -> 24568 | O678: =RC[-4]-R[-1]C[-4] -> 36 | P678: =RC[-1]-R[-1]C[-1] -> 0
B679: =R[-3]C+1 -> 226 | C679: =R[-1]C+RC[1] -> 675 | D679: 1 | F679: =ROUND((R1003C-R4C)/(R1003C3)*RC3,0)+R4C -> 7941 | G679: =ROUND((R1003C-R4C)/(R1003C3)*RC3,0)+R4C -> 6205 | H679: =ROUND((R1003C-R4C)/(R1003C3)*RC3,0)+R4C -> 17562 | I679: =ROUND((R1003C-R4C)/(R1003C3)*RC3,0)+R4C -> 3190 | J679: =ROUND((R1003C-R4C)/(R1003C3)*RC3,0)+R4C -> 1725 | K679: =ROUND((R1003C-R4C)/(R1003C3)*RC3,0)+R4C -> 24604 | O679: =RC[-4]-R[-1]C[-4] -> 36 | P679: =RC[-1]-R[-1]C[-1] -> 0
B680: =R[-3]C+1 -> 226 | C680: =R[-1]C+RC[1] -> 676 | D680: 1 | F680: =ROUND((R1003C-R4C)/(R1003C3)*RC3,0)+R4C -> 7952 | G680: =ROUND((R1003C-R4C)/(R1003C3)*RC3,0)+R4C -> 6214 | H680: =ROUND((R1003C-R4C)/(R1003C3)*RC3,0)+R4C -> 17588 | I680: =ROUND((R1003C-R4C)/(R1003C3)*RC3,0)+R4C -> 3195 | J680: =ROUND((R1003C-R4C)/(R1003C3)*RC3,0)+R4C -> 1728 | K680: =ROUND((R1003C-R4C)/(R1003C3)*RC3,0)+R4C -> 24640 | O680: =RC[-4]-R[-1]C[-4] -> 36 | P680: =RC[-1]-R[-1]C[-1] -> 0
B681: =R[-3]C+1 -> 226 | C681: =R[-1]C+RC[1] -> 677 | D681: 1 | F681: =ROUND((R1003C-R4C)/(R1003C3)*RC3,0)+R4C -> 7964 | G681: =ROUND((R1003C-R4C)/(R1003C3)*RC3,0)+R4C -> 6223 | H681: =ROUND((R1003C-R4C)/(R1003C3)*RC3,0)+R4C -> 17613 | I681: =ROUND((R1003C-R4C)/(R1003C3)*RC3,0)+R4C -> 3200 | J681: =ROUND((R1003C-R4C)/(R1003C3)*RC3,0)+R4C -> 1730 | K681: =ROUND((R1003C-R4C)/(R1003C3)*RC3,0)+R4C -> 24677 | O681: =RC[-4]-R[-1]C[-4] -> 37 | P681: =RC[-1]-R[-1]C[-1] -> 1
B682: =R[-3]C+1 -> 227 | C682: =R[-1]C+RC[1] -> 678 | D682: 1 | F682: =ROUND((R1003C-R4C)/(R1003C3)*RC3,0)+R4C -> 7976 | G682: =ROUND((R1003C-R4C)/(R1003C3)*RC3,0)+R4C -> 6232 | H682: =ROUND((R1003C-R4C)/(R1003C3)*RC3,0)+R4C -> 17639 | I682: =ROUND((R1003C-R4C)/(R1003C3)*RC3,0)+R4C -> 3204 | J682: =ROUND((R1003C-R4C)/(R1003C3)*RC3,0)+R4C -> 1733 | K682: =ROUND((R1003C-R4C)/(R1003C3)*RC3,0)+R4C -> 24713 | O682: =RC[-4]-R[-1]C[-4] -> 36 | P682: =RC[-1]-R[-1]C[-1] -> -1
B683: =R[-3]C+1 -> 227 | C683: =R[-1]C+RC[1] -> 679 | D683: 1 | F683: =ROUND((R1003C-R4C)/(R1003C3)*RC3,0)+R4C -> 7987 | G683: =ROUND((R1003C-R4C)/(R1003C3)*RC3,0)+R4C -> 6241 | H683: =ROUND((R1003C-R4C)/(R1003C3)*RC3,0)+R4C -> 17665 | I683: =ROUND((R1003C-R4C)/(R1003C3)*RC3,0)+R4C -> 3209 | J683: =ROUND((R1003C-R4C)/(R1003C3)*RC3,0)+R4C -> 1735 | K683: =ROUND((R1003C-R4C)/(R1003C3)*RC3,0)+R4C -> 24749 | O683: =RC[-4]-R[-1]C[-4] -> 36 | P683: =RC[-1]-R[-1]C[-1] -> 0
B684: =R[-3]C+1 -> 227 | C684: =R[-1]C+RC[1] -> 680 | D684: 1 | F684: =ROUND((R1003C-R4C)/(R1003C3)*RC3,0)+R4C -> 7999 | G684: =ROUND((R1003C-R4C)/(R1003C3)*RC3,0)+R4C -> 6250 | H684: =ROUND((R1003C-R4C)/(R1003C3)*RC3,0)+R4C -> 17691 | I684: =ROUND((R1003C-R4C)/(R1003C3)*RC3,0)+R4C -> 3214 | J684: =ROUND((R1003C-R4C)/(R1003C3)*RC3,0)+R4C -> 1738 | K684: =ROUND((R1003C-R4C)/(R1003C3)*RC3,0)+R4C -> 24785 | O684: =RC[-4]-R[-1]C[-4] -> 36 | P684: =RC[-1]-R[-1]C[-1] -> 0
B685: =R[-3]C+1 -> 228 | C685: =R[-1]C+RC[1] -> 681 | D685: 1 | F685: =ROUND((R1003C-R4C)/(R1003C3)*RC3,0)+R4C -> 8011 | G685: =ROUND((R1003C-R4C)/(R1003C3)*RC3,0)+R4C -> 6260 | H685: =ROUND((R1003C-R4C)/(R1003C3)*RC3,0)+R4C -> 17717 | I685: =ROUND((R1003C-R4C)/(R1003C3)*RC3,0)+R4C -> 3218 | J685: =ROUND((R1003C-R4C)/(R1003C3)*RC3,0)+R4C -> 1740 | K685: =ROUND((R1003C-R4C)/(R1003C3)*RC3,0)+R4C -> 24821 | O685: =RC[-4]-R[-1]C[-4] -> 36 | P685: =RC[-1]-R[-1]C[-1] -> 0
B686: =R[-3]C+1 -> 228 | C686: =R[-1]C+RC[1] -> 682 | D686: 1 | F686: =ROUND((R1003C-R4C)/(R1003C3)*RC3,0)+R4C -> 8022 | G686: =ROUND((R1003C-R4C)/(R1003C3)*RC3,0)+R4C -> 6269 | H686: =ROUND((R1003C-R4C)/(R1003C3)*RC3,0)+R4C -> 17743 | I686: =ROUND((R1003C-R4C)/(R1003C3)*RC3,0)+R4C -> 3223 | J686: =ROUND((R1003C-R4C)/(R1003C3)*RC3,0)+R4C -> 1743 | K686: =ROUND((R1003C-R4C)/(R1003C3)*RC3,0)+R4C -> 24858 | O686: =RC[-4]-R[-1]C[-4] -> 37 | P686: =RC[-1]-R[-1]C[-1] -> 1
B687: =R[-3]C+1 -> 228 | C687: =R[-1]C+RC[1] -> 683 | D687: 1 | F687: =ROUND((R1003C-R4C)/(R1003C3)*RC3,0)+R4C -> 8034 | G687: =ROUND((R1003C-R4C)/(R1003C3)*RC3,0)+R4C -> 6278 | H687: =ROUND((R1003C-R4C)/(R1003C3)*RC3,0)+R4C -> 17768 | I687: =ROUND((R1003C-R4C)/(R1003C3)*RC3,0)+R4C -> 3228 | J687: =ROUND((R1003C-R4C)/(R1003C3)*RC3,0)+R4C -> 1745 | K687: =ROUND((R1003C-R4C)/(R1003C3)*RC3,0)+R4C -> 24894 | O687: =RC[-4]-R[-1]C[-4] -> 36 | P687: =RC[-1]-R[-1]C[-1] -> -1
B688: =R[-3]C+1 -> 229 | C688: =R[-1]C+RC[1] -> 684 | D688: 1 | F688: =ROUND((R1003C-R4C)/(R1003C3)*RC3,0)+R4C -> 8046 | G688: =ROUND((R1003C-R4C)/(R1003C3)*RC3,0)+R4C -> 6287 | H688: =ROUND((R1003C-R4C)/(R1003C3)*RC3,0)+R4C -> 17794 | I688: =ROUND((R1003C-R4C)/(R1003C3)*RC3,0)+R4C -> 3232 | J688: =ROUND((R1003C-R4C)/(R1003C3)*RC3,0)+R4C -> 1748 | K688: =ROUND((R1003C-R4C)/(R1003C3)*RC3,0)+R4C -> 24930 | O688: =RC[-4]-R[-1]C[-4] -> 36 | P688: =RC[-1]-R[-1]C[-1] -> 0
B689: =R[-3]C+1 -> 229 | C689: =R[-1]C+RC[1] -> 685 | D689: 1 | F689: =ROUND((R1003C-R4C)/(R1003C3)*RC3,0)+R4C -> 8058 | G689: =ROUND((R1003C-R4C)/(R1003C3)*RC3,0)+R4C -> 6296 | H689: =ROUND((R1003C-R4C)/(R1003C3)*RC3,0)+R4C -> 17820 | I689: =ROUND((R1003C-R4C)/(R1003C3)*RC3,0)+R4C -> 3237 | J689: =ROUND((R1003C-R4C)/(R1003C3)*RC3,0)+R4C -> 1751 | K689: =ROUND((R1003C-R4C)/(R1003C3)*RC3,0)+R4C -> 24966 | O689: =RC[-4]-R[-1]C[-4] -> 36 | P689: =RC[-1]-R[-1]C[-1] -> 0
B690: =R[-3]C+1 -> 229 | C690: =R[-1]C+RC[1] -> 686 | D690: 1 | F690: =ROUND((R1003C-R4C)/(R1003C3)*RC3,0)+R4C -> 8069 | G690: =ROUND((R1003C-R4C)/(R1003C3)*RC3,0)+R4C -> 6305 | H690: =ROUND((R1003C-R4C)/(R1003C3)*RC3,0)+R4C -> 17846 | I690: =ROUND((R1003C-R4C)/(R1003C3)*RC3,0)+R4C -> 3242 | J690: =ROUND((R1003C-R4C)/(R1003C3)*RC3,0)+R4C -> 1753 | K690: =ROUND((R1003C-R4C)/(R1003C3)*RC3,0)+R4C -> 25002 | O690: =RC[-4]-R[-1]C[-4] -> 36 | P690: =RC[-1]-R[-1]C[-1] -> 0
B691: =R[-3]C+1 -> 230 | C691: =R[-1]C+RC[1] -> 687 | D691: 1 | F691: =ROUND((R1003C-R4C)/(R1003C3)*RC3,0)+R4C -> 8081 | G691: =ROUND((R1003C-R4C)/(R1003C3)*RC3,0)+R4C -> 6314 | H691: =ROUND((R1003C-R4C)/(R1003C3)*RC3,0)+R4C -> 17872 | I691: =ROUND((R1003C-R4C)/(R1003C3)*RC3,0)+R4C -> 3247 | J691: =ROUND((R1003C-R4C)/(R1003C3)*RC3,0)+R4C -> 1756 | K691: =ROUND((R1003C-R4C)/(R1003C3)*RC3,0)+R4C -> 25038 | O691: =RC[-4]-R[-1]C[-4] -> 36 | P691: =RC[-1]-R[-1]C[-1] -> 0
B692: =R[-3]C+1 -> 230 | C692: =R[-1]C+RC[1] -> 688 | D692: 1 | F692: =ROUND((R1003C-R4C)/(R1003C3)*RC3,0)+R4C -> 8093 | G692: =ROUND((R1003C-R4C)/(R1003C3)*RC3,0)+R4C -> 6323 | H692: =ROUND((R1003C-R4C)/(R1003C3)*RC3,0)+R4C -> 17897 | I692: =ROUND((R1003C-R4C)/(R1003C3)*RC3,0)+R4C -> 3251 | J692: =ROUND((R1003C-R4C)/(R1003C3)*RC3,0)+R4C -> 1758 | K692: =ROUND((R1003C-R4C)/(R1003C3)*RC3,0)+R4C -> 25075 | O692: =RC[-4]-R[-1]C[-4] -> 37 | P692: =RC[-1]-R[-1]C[-1] -> 1
B693: =R[-3]C+1 -> 230 | C693: =R[-1]C+RC[1] -> 689 | D693: 1 | F693: =ROUND((R1003C-R4C)/(R1003C3)*RC3,0)+R4C -> 8104 | G693: =ROUND((R1003C-R4C)/(R1003C3)*RC3,0)+R4C -> 6333 | H693: =ROUND((R1003C-R4C)/(R1003C3)*RC3,0)+R4C -> 17923 | I693: =ROUND((R1003C-R4C)/(R1003C3)*RC3,0)+R4C -> 3256 | J693: =ROUND((R1003C-R4C)/(R1003C3)*RC3,0)+R4C -> 1761 | K693: =ROUND((R1003C-R4C)/(R1003C3)*RC3,0)+R4C -> 25111 | O693: =RC[-4]-R[-1]C[-4] -> 36 | P693: =RC[-1]-R[-1]C[-1] -> -1
B694: =R[-3]C+1 -> 231 | C694: =R[-1]C+RC[1] -> 690 | D694: 1 | F694: =ROUND((R1003C-R4C)/(R1003C3)*RC3,0)+R4C -> 8116 | G694: =ROUND((R1003C-R4C)/(R1003C3)*RC3,0)+R4C -> 6342 | H694: =ROUND((R1003C-R4C)/(R1003C3)*RC3,0)+R4C -> 17949 | I694: =ROUND((R1003C-R4C)/(R1003C3)*RC3,0)+R4C -> 3261 | J694: =ROUND((R1003C-R4C)/(R1003C3)*RC3,0)+R4C -> 1763 | K694: =ROUND((R1003C-R4C)/(R1003C3)*RC3,0)+R4C -> 25147 | O694: =RC[-4]-R[-1]C[-4] -> 36 | P694: =RC[-1]-R[-1]C[-1] -> 0
B695: =R[-3]C+1 -> 231 | C695: =R[-1]C+RC[1] -> 691 | D695: 1 | F695: =ROUND((R1003C-R4C)/(R1003C3)*RC3,0)+R4C -> 8128 | G695: =ROUND((R1003C-R4C)/(R1003C3)*RC3,0)+R4C -> 6351 | H695: =ROUND((R1003C-R4C)/(R1003C3)*RC3,0)+R4C -> 17975 | I695: =ROUND((R1003C-R4C)/(R1003C3)*RC3,0)+R4C -> 3265 | J695: =ROUND((R1003C-R4C)/(R1003C3)*RC3,0)+R4C -> 1766 | K695: =ROUND((R1003C-R4C)/(R1003C3)*RC3,0)+R4C -> 25183 | O695: =RC[-4]-R[-1]C[-4] -> 36 | P695: =RC[-1]-R[-1]C[-1] -> 0
B696: =R[-3]C+1 -> 231 | C696: =R[-1]C+RC[1] -> 692 | D696: 1 | F696: =ROUND((R1003C-R4C)/(R1003C3)*RC3,0)+R4C -> 8139 | G696: =ROUND((R1003C-R4C)/(R1003C3)*RC3,0)+R4C -> 6360 | H696: =ROUND((R1003C-R4C)/(R1003C3)*RC3,0)+R4C -> 18001 | I696: =ROUND((R1003C-R4C)/(R1003C3)*RC3,0)+R4C -> 3270 | J696: =ROUND((R1003C-R4C)/(R1003C3)*RC3,0)+R4C -> 1768 | K696: =ROUND((R1003C-R4C)/(R1003C3)*RC3,0)+R4C -> 25219 | O696: =RC[-4]-R[-1]C[-4] -> 36 | P696: =RC[-1]-R[-1]C[-1] -> 0
B697: =R[-3]C+1 -> 232 | C697: =R[-1]C+RC[1] -> 693 | D697: 1 | F697: =ROUND((R1003C-R4C)/(R1003C3)*RC3,0)+R4C -> 8151 | G697: =ROUND((R1003C-R4C)/(R1003C3)*RC3,0)+R4C -> 6369 | H697: =ROUND((R1003C-R4C)/(R1003C3)*RC3,0)+R4C -> 18027 | I697: =ROUND((R1003C-R4C)/(R1003C3)*RC3,0)+R4C -> 3275 | J697: =ROUND((R1003C-R4C)/(R1003C3)*RC3,0)+R4C -> 1771 | K697: =ROUND((R1003C-R4C)/(R1003C3)*RC3,0)+R4C -> 25256 | O697: =RC[-4]-R[-1]C[-4] -> 37 | P697: =RC[-1]-R[-1]C[-1] -> 1
B698: =R[-3]C+1 -> 232 | C698: =R[-1]C+RC[1] -> 694 | D698: 1 | F698: =ROUND((R1003C-R4C)/(R1003C3)*RC3,0)+R4C -> 8163 | G698: =ROUND((R1003C-R4C)/(R1003C3)*RC3,0)+R4C -> 6378 | H698: =ROUND((R1003C-R4C)/(R1003C3)*RC3,0)+R4C -> 18052 | I698: =ROUND((R1003C-R4C)/(R1003C3)*RC3,0)+R4C -> 3279 | J698: =ROUND((R1003C-R4C)/(R1003C3)*RC3,0)+R4C -> 1773 | K698: =ROUND((R1003C-R4C)/(R1003C3)*RC3,0)+R4C -> 25292 | O698: =RC[-4]-R[-1]C[-4] -> 36 | P698: =RC[-1]-R[-1]C[-1] -> -1
B699: =R[-3]C+1 -> 232 | C699: =R[-1]C+RC[1] -> 695 | D699: 1 | F699: =ROUND((R1003C-R4C)/(R1003C3)*RC3,0)+R4C -> 8174 | G699: =ROUND((R1003C-R4C)/(R1003C3)*RC3,0)+R4C -> 6387 | H699: =ROUND((R1003C-R4C)/(R1003C3)*RC3,0)+R4C -> 18078 | I699: =ROUND((R1003C-R4C)/(R1003C3)*RC3,0)+R4C -> 3284 | J699: =ROUND((R1003C-R4C)/(R1003C3)*RC3,0)+R4C -> 1776 | K699: =ROUND((R1003C-R4C)/(R1003C3)*RC3,0)+R4C -> 25328 | O699: =RC[-4]-R[-1]C[-4] -> 36 | P699: =RC[-1]-R[-1]C[-1] -> 0
B700: =R[-3]C+1 -> 233 | C700: =R[-1]C+RC[1] -> 696 | D700: 1 | F700: =ROUND((R1003C-R4C)/(R1003C3)*RC3,0)+R4C -> 8186 | G700: =ROUND((R1003C-R4C)/(R1003C3)*RC3,0)+R4C -> 6396 | H700: =ROUND((R1003C-R4C)/(R1003C3)*RC3,0)+R4C -> 18104 | I700: =ROUND((R1003C-R4C)/(R1003C3)*RC3,0)+R4C -> 3289 | J700: =ROUND((R1003C-R4C)/(R1003C3)*RC3,0)+R4C -> 1778 | K700: =ROUND((R1003C-R4C)/(R1003C3)*RC3,0)+R4C -> 25364 | O700: =RC[-4]-R[-1]C[-4] -> 36 | P700: =RC[-1]-R[-1]C[-1] -> 0
B701: =R[-3]C+1 -> 233 | C701: =R[-1]C+RC[1] -> 697 | D701: 1 | F701: =ROUND((R1003C-R4C)/(R1003C3)*RC3,0)+R4C -> 8198 | G701: =ROUND((R1003C-R4C)/(R1003C3)*RC3,0)+R4C -> 6406 | H701: =ROUND((R1003C-R4C)/(R1003C3)*RC3,0)+R4C -> 18130 | I701: =ROUND((R1003C-R4C)/(R1003C3)*RC3,0)+R4C -> 3293 | J701: =ROUND((R1003C-R4C)/(R1003C3)*RC3,0)+R4C -> 1781 | K701: =ROUND((R1003C-R4C)/(R1003C3)*RC3,0)+R4C -> 25400 | O701: =RC[-4]-R[-1]C[-4] -> 36 | P701: =RC[-1]-R[-1]C[-1] -> 0
B702: =R[-3]C+1 -> 233 | C702: =R[-1]C+RC[1] -> 698 | D702: 1 | F702: =ROUND((R1003C-R4C)/(R1003C3)*RC3,0)+R4C -> 8209 | G702: =ROUND((R1003C-R4C)/(R1003C3)*RC3,0)+R4C -> 6415 | H702: =ROUND((R1003C-R4C)/(R1003C3)*RC3,0)+R4C -> 18156 | I702: =ROUND((R1003C-R4C)/(R1003C3)*RC3,0)+R4C -> 3298 | J702: =ROUND((R1003C-R4C)/(R1003C3)*RC3,0)+R4C -> 1784 | K702: =ROUND((R1003C-R4C)/(R1003C3)*RC3,0)+R4C -> 25436 | O702: =RC[-4]-R[-1]C[-4] -> 36 | P702: =RC[-1]-R[-1]C[-1] -> 0
B703: =R[-3]C+1 -> 234 | C703: =R[-1]C+RC[1] -> 699 | D703: 1 | F703: =ROUND((R1003C-R4C)/(R1003C3)*RC3,0)+R4C -> 8221 | G703: =ROUND((R1003C-R4C)/(R1003C3)*RC3,0)+R4C -> 6424 | H703: =ROUND((R1003C-R4C)/(R1003C3)*RC3,0)+R4C -> 18182 | I703: =ROUND((R1003C-R4C)/(R1003C3)*RC3,0)+R4C -> 3303 | J703: =ROUND((R1003C-R4C)/(R1003C3)*RC3,0)+R4C -> 1786 | K703: =ROUND((R1003C-R4C)/(R1003C3)*RC3,0)+R4C -> 25473 | O703: =RC[-4]-R[-1]C[-4] -> 37 | P703: =RC[-1]-R[-1]C[-1] -> 1
B704: =R[-3]C+1 -> 234 | C704: =R[-1]C+RC[1] -> 700 | D704: 1 | F704: =ROUND((R1003C-R4C)/(R1003C3)*RC3,0)+R4C -> 8233 | G704: =ROUND((R1003C-R4C)/(R1003C3)*RC3,0)+R4C -> 6433 | H704: =ROUND((R1003C-R4C)/(R1003C3)*RC3,0)+R4C -> 18207 | I704: =ROUND((R1003C-R4C)/(R1003C3)*RC3,0)+R4C -> 3307 | J704: =ROUND((R1003C-R4C)/(R1003C3)*RC3,0)+R4C -> 1789 | K704: =ROUND((R1003C-R4C)/(R1003C3)*RC3,0)+R4C -> 25509 | O704: =RC[-4]-R[-1]C[-4] -> 36 | P704: =RC[-1]-R[-1]C[-1] -> -1
B705: =R[-3]C+1 -> 234 | C705: =R[-1]C+RC[1] -> 701 | D705: 1 | F705: =ROUND((R1003C-R4C)/(R1003C3)*RC3,0)+R4C -> 8244 | G705: =ROUND((R1003C-R4C)/(R1003C3)*RC3,0)+R4C -> 6442 | H705: =ROUND((R1003C-R4C)/(R1003C3)*RC3,0)+R4C -> 18233 | I705: =ROUND((R1003C-R4C)/(R1003C3)*RC3,0)+R4C -> 3312 | J705: =ROUND((R1003C-R4C)/(R1003C3)*RC3,0)+R4C -> 1791 | K705: =ROUND((R1003C-R4C)/(R1003C3)*RC3,0)+R4C -> 25545 | O705: =RC[-4]-R[-1]C[-4] -> 36 | P705: =RC[-1]-R[-1]C[-1] -> 0
B706: =R[-3]C+1 -> 235 | C706: =R[-1]C+RC[1] -> 702 | D706: 1 | F706: =ROUND((R1003C-R4C)/(R1003C3)*RC3,0)+R4C -> 8256 | G706: =ROUND((R1003C-R4C)/(R1003C3)*RC3,0)+R4C -> 6451 | H706: =ROUND((R1003C-R4C)/(R1003C3)*RC3,0)+R4C -> 18259 | I706: =ROUND((R1003C-R4C)/(R1003C3)*RC3,0)+R4C -> 3317 | J706: =ROUND((R1003C-R4C)/(R1003C3)*RC3,0)+R4C -> 1794 | K706: =ROUND((R1003C-R4C)/(R1003C3)*RC3,0)+R4C -> 25581 | O706: =RC[-4]-R[-1]C[-4] -> 36 | P706: =RC[-1]-R[-1]C[-1] -> 0
B707: =R[-3]C+1 -> 235 | C707: =R[-1]C+RC[1] -> 703 | D707: 1 | F707: =ROUND((R1003C-R4C)/(R1003C3)*RC3,0)+R4C -> 8268 | G707: =ROUND((R1003C-R4C)/(R1003C3)*RC3,0)+R4C -> 6460 | H707: =ROUND((R1003C-R4C)/(R1003C3)*RC3,0)+R4C -> 18285 | I707: =ROUND((R1003C-R4C)/(R1003C3)*RC3,0)+R4C -> 3322 | J707: =ROUND((R1003C-R4C)/(R1003C3)*RC3,0)+R4C -> 1796 | K707: =ROUND((R1003C-R4C)/(R1003C3)*RC3,0)+R4C -> 25617 | O707: =RC[-4]-R[-1]C[-4] -> 36 | P707: =RC[-1]-R[-1]C[-1] -> 0
B708: =R[-3]C+1 -> 235 | C708: =R[-1]C+RC[1] -> 704 | D708: 1 | F708: =ROUND((R1003C-R4C)/(R1003C3)*RC3,0)+R4C -> 8279 | G708: =ROUND((R1003C-R4C)/(R1003C3)*RC3,0)+R4C -> 6469 | H708: =ROUND((R1003C-R4C)/(R1003C3)*RC3,0)+R4C -> 18311 | I708: =ROUND((R1003C-R4C)/(R1003C3)*RC3,0)+R4C -> 3326 | J708: =ROUND((R1003C-R4C)/(R1003C3)*RC3,0)+R4C -> 1799 | K708: =ROUND((R1003C-R4C)/(R1003C3)*RC3,0)+R4C -> 25654 | O708: =RC[-4]-R[-1]C[-4] -> 37 | P708: =RC[-1]-R[-1]C[-1] -> 1
B709: =R[-3]C+1 -> 236 | C709: =R[-1]C+RC[1] -> 705 | D709: 1 | F709: =ROUND((R1003C-R4C)/(R1003C3)*RC3,0)+R4C -> 8291 | G709: =ROUND((R1003C-R4C)/(R1003C3)*RC3,0)+R4C -> 6479 | H709: =ROUND((R1003C-R4C)/(R1003C3)*RC3,0)+R4C -> 18337 | I709: =ROUND((R1003C-R4C)/(R1003C3)*RC3,0)+R4C -> 3331 | J709: =ROUND((R1003C-R4C)/(R1003C3)*RC3,0)+R4C -> 1801 | K709: =ROUND((R1003C-R4C)/(R1003C3)*RC3,0)+R4C -> 25690 | O709: =RC[-4]-R[-1]C[-4] -> 36 | P709: =RC[-1]-R[-1]C[-1] -> -1
B710: =R[-3]C+1 -> 236 | C710: =R[-1]C+RC[1] -> 706 | D710: 1 | F710: =ROUND((R1003C-R4C)/(R1003C3)*RC3,0)+R4C -> 8303 | G710: =ROUND((R1003C-R4C)/(R1003C3)*RC3,0)+R4C -> 6488 | H710: =ROUND((R1003C-R4C)/(R1003C3)*RC3,0)+R4C -> 18362 | I710: =ROUND((R1003C-R4C)/(R1003C3)*RC3,0)+R4C -> 3336 | J710: =ROUND((R1003C-R4C)/(R1003C3)*RC3,0)+R4C -> 1804 | K710: =ROUND((R1003C-R4C)/(R1003C3)*RC3,0)+R4C -> 25726 | O710: =RC[-4]-R[-1]C[-4] -> 36 | P710: =RC[-1]-R[-1]C[-1] -> 0
B711: =R[-3]C+1 -> 236 | C711: =R[-1]C+RC[1] -> 707 | D711: 1 | F711: =ROUND((R1003C-R4C)/(R1003C3)*RC3,0)+R4C -> 8314 | G711: =ROUND((R1003C-R4C)/(R1003C3)*RC3,0)+R4C -> 6497 | H711: =ROUND((R1003C-R4C)/(R1003C3)*RC3,0)+R4C -> 18388 | I711: =ROUND((R1003C-R4C)/(R1003C3)*RC3,0)+R4C -> 3340 | J711: =ROUND((R1003C-R4C)/(R1003C3)*RC3,0)+R4C -> 1806 | K711: =ROUND((R1003C-R4C)/(R1003C3)*RC3,0)+R4C -> 25762 | O711: =RC[-4]-R[-1]C[-4] -> 36 | P711: =RC[-1]-R[-1]C[-1] -> 0
B712: =R[-3]C+1 -> 237 | C712: =R[-1]C+RC[1] -> 708 | D712: 1 | F712: =ROUND((R1003C-R4C)/(R1003C3)*RC3,0)+R4C -> 8326 | G712: =ROUND((R1003C-R4C)/(R1003C3)*RC3,0)+R4C -> 6506 | H712: =ROUND((R1003C-R4C)/(R1003C3)*RC3,0)+R4C -> 18414 | I712: =ROUND((R1003C-R4C)/(R1003C3)*RC3,0)+R4C -> 3345 | J712: =ROUND((R1003C-R4C)/(R1003C3)*RC3,0)+R4C -> 1809 | K712: =ROUND((R1003C-R4C)/(R1003C3)*RC3,0)+R4C -> 25798 | O712: =RC[-4]-R[-1]C[-4] -> 36 | P712: =RC[-1]-R[-1]C[-1] -> 0
B713: =R[-3]C+1 -> 237 | C713: =R[-1]C+RC[1] -> 709 | D713: 1 | F713: =ROUND((R1003C-R4C)/(R1003C3)*RC3,0)+R4C -> 8338 | G713: =ROUND((R1003C-R4C)/(R1003C3)*RC3,0)+R4C -> 6515 | H713: =ROUND((R1003C-R4C)/(R1003C3)*RC3,0)+R4C -> 18440 | I713: =ROUND((R1003C-R4C)/(R1003C3)*RC3,0)+R4C -> 3350 | J713: =ROUND((R1003C-R4C)/(R1003C3)*RC3,0)+R4C -> 1811 | K713: =ROUND((R1003C-R4C)/(R1003C3)*RC3,0)+R4C -> 25834 | O713: =RC[-4]-R[-1]C[-4] -> 36 | P713: =RC[-1]-R[-1]C[-1] -> 0
B714: =R[-3]C+1 -> 237 | C714: =R[-1]C+RC[1] -> 710 | D714: 1 | F714: =ROUND((R1003C-R4C)/(R1003C3)*RC3,0)+R4C -> 8349 | G714: =ROUND((R1003C-R4C)/(R1003C3)*RC3,0)+R4C -> 6524 | H714: =ROUND((R1003C-R4C)/(R1003C3)*RC3,0)+R4C -> 18466 | I714: =ROUND((R1003C-R4C)/(R1003C3)*RC3,0)+R4C -> 3354 | J714: =ROUND((R1003C-R4C)/(R1003C3)*RC3,0)+R4C -> 1814 | K714: =ROUND((R1003C-R4C)/(R1003C3)*RC3,0)+R4C -> 25871 | O714: =RC[-4]-R[-1]C[-4] -> 37 | P714: =RC[-1]-R[-1]C[-1] -> 1
B715: =R[-3]C+1 -> 238 | C715: =R[-1]C+RC[1] -> 711 | D715: 1 | F715: =ROUND((R1003C-R4C)/(R1003C3)*RC3,0)+R4C -> 8361 | G715: =ROUND((R1003C-R4C)/(R1003C3)*RC3,0)+R4C -> 6533 | H715: =ROUND((R1003C-R4C)/(R1003C3)*RC3,0)+R4C -> 18491 | I715: =ROUND((R1003C-R4C)/(R1003C3)*RC3,0)+R4C -> 3359 | J715: =ROUND((R1003C-R4C)/(R1003C3)*RC3,0)+R4C -> 1816 | K715: =ROUND((R1003C-R4C)/(R1003C3)*RC3,0)+R4C -> 25907 | O715: =RC[-4]-R[-1]C[-4] -> 36 | P715: =RC[-1]-R[-1]C[-1] -> -1
B716: =R[-3]C+1 -> 238 | C716: =R[-1]C+RC[1] -> 712 | D716: 1 | F716: =ROUND((R1003C-R4C)/(R1003C3)*RC3,0)+R4C -> 8373 | G716: =ROUND((R1003C-R4C)/(R1003C3)*RC3,0)+R4C -> 6542 | H716: =ROUND((R1003C-R4C)/(R1003C3)*RC3,0)+R4C -> 18517 | I716: =ROUND((R1003C-R4C)/(R1003C3)*RC3,0)+R4C -> 3364 | J716: =ROUND((R1003C-R4C)/(R1003C3)*RC3,0)+R4C -> 1819 | K716: =ROUND((R1003C-R4C)/(R1003C3)*RC3,0)+R4C -> 25943 | O716: =RC[-4]-R[-1]C[-4] -> 36 | P716: =RC[-1]-R[-1]C[-1] -> 0
B717: =R[-3]C+1 -> 238 | C717: =R[-1]C+RC[1] -> 713 | D717: 1 | F717: =ROUND((R1003C-R4C)/(R1003C3)*RC3,0)+R4C -> 8384 | G717: =ROUND((R1003C-R4C)/(R1003C3)*RC3,0)+R4C -> 6552 | H717: =ROUND((R1003C-R4C)/(R1003C3)*RC3,0)+R4C -> 18543 | I717: =ROUND((R1003C-R4C)/(R1003C3)*RC3,0)+R4C -> 3368 | J717: =ROUND((R1003C-R4C)/(R1003C3)*RC3,0)+R4C -> 1822 | K717: =ROUND((R1003C-R4C)/(R1003C3)*RC3,0)+R4C -> 25979 | O717: =RC[-4]-R[-1]C[-4] -> 36 | P717: =RC[-1]-R[-1]C[-1] -> 0
B718: =R[-3]C+1 -> 239 | C718: =R[-1]C+RC[1] -> 714 | D718: 1 | F718: =ROUND((R1003C-R4C)/(R1003C3)*RC3,0)+R4C -> 8396 | G718: =ROUND((R1003C-R4C)/(R1003C3)*RC3,0)+R4C -> 6561 | H718: =ROUND((R1003C-R4C)/(R1003C3)*RC3,0)+R4C -> 18569 | I718: =ROUND((R1003C-R4C)/(R1003C3)*RC3,0)+R4C -> 3373 | J718: =ROUND((R1003C-R4C)/(R1003C3)*RC3,0)+R4C -> 1824 | K718: =ROUND((R1003C-R4C)/(R1003C3)*RC3,0)+R4C -> 26015 | O718: =RC[-4]-R[-1]C[-4] -> 36 | P718: =RC[-1]-R[-1]C[-1] -> 0
B719: =R[-3]C+1 -> 239 | C719: =R[-1]C+RC[1] -> 715 | D719: 1 | F719: =ROUND((R1003C-R4C)/(R1003C3)*RC3,0)+R4C -> 8408 | G719: =ROUND((R1003C-R4C)/(R1003C3)*RC3,0)+R4C -> 6570 | H719: =ROUND((R1003C-R4C)/(R1003C3)*RC3,0)+R4C -> 18595 | I719: =ROUND((R1003C-R4C)/(R1003C3)*RC3,0)+R4C -> 3378 | J719: =ROUND((R1003C-R4C)/(R1003C3)*RC3,0)+R4C -> 1827 | K719: =ROUND((R1003C-R4C)/(R1003C3)*RC3,0)+R4C -> 26052 | O719: =RC[-4]-R[-1]C[-4] -> 37 | P719: =RC[-1]-R[-1]C[-1] -> 1
B720: =R[-3]C+1 -> 239 | C720: =R[-1]C+RC[1] -> 716 | D720: 1 | F720: =ROUND((R1003C-R4C)/(R1003C3)*RC3,0)+R4C -> 8420 | G720: =ROUND((R1003C-R4C)/(R1003C3)*RC3,0)+R4C -> 6579 | H720: =ROUND((R1003C-R4C)/(R1003C3)*RC3,0)+R4C -> 18621 | I720: =ROUND((R1003C-R4C)/(R1003C3)*RC3,0)+R4C -> 3383 | J720: =ROUND((R1003C-R4C)/(R1003C3)*RC3,0)+R4C -> 1829 | K720: =ROUND((R1003C-R4C)/(R1003C3)*RC3,0)+R4C -> 26088 | O720: =RC[-4]-R[-1]C[-4] -> 36 | P720: =RC[-1]-R[-1]C[-1] -> -1
B721: =R[-3]C+1 -> 240 | C721: =R[-1]C+RC[1] -> 717 | D721: 1 | F721: =ROUND((R1003C-R4C)/(R1003C3)*RC3,0)+R4C -> 8431 | G721: =ROUND((R1003C-R4C)/(R1003C3)*RC3,0)+R4C -> 6588 | H721: =ROUND((R1003C-R4C)/(R1003C3)*RC3,0)+R4C -> 18646 | I721: =ROUND((R1003C-R4C)/(R1003C3)*RC3,0)+R4C -> 3387 | J721: =ROUND((R1003C-R4C)/(R1003C3)*RC3,0)+R4C -> 1832 | K721: =ROUND((R1003C-R4C)/(R1003C3)*RC3,0)+R4C -> 26124 | O721: =RC[-4]-R[-1]C[-4] -> 36 | P721: =RC[-1]-R[-1]C[-1] -> 0
B722: =R[-3]C+1 -> 240 | C722: =R[-1]C+RC[1] -> 718 | D722: 1 | F722: =ROUND((R1003C-R4C)/(R1003C3)*RC3,0)+R4C -> 8443 | G722: =ROUND((R1003C-R4C)/(R1003C3)*RC3,0)+R4C -> 6597 | H722: =ROUND((R1003C-R4C)/(R1003C3)*RC3,0)+R4C -> 18672 | I722: =ROUND((R1003C-R4C)/(R1003C3)*RC3,0)+R4C -> 3392 | J722: =ROUND((R1003C-R4C)/(R1003C3)*RC3,0)+R4C -> 1834 | K722: =ROUND((R1003C-R4C)/(R1003C3)*RC3,0)+R4C -> 26160 | O722: =RC[-4]-R[-1]C[-4] -> 36 | P722: =RC[-1]-R[-1]C[-1] -> 0
B723: =R[-3]C+1 -> 240 | C723: =R[-1]C+RC[1] -> 719 | D723: 1 | F723: =ROUND((R1003C-R4C)/(R1003C3)*RC3,0)+R4C -> 8455 | G723: =ROUND((R1003C-R4C)/(R1003C3)*RC3,0)+R4C -> 6606 | H723: =ROUND((R1003C-R4C)/(R1003C3)*RC3,0)+R4C -> 18698 | I723: =ROUND((R1003C-R4C)/(R1003C3)*RC3,0)+R4C -> 3397 | J723: =ROUND((R1003C-R4C)/(R1003C3)*RC3,0)+R4C -> 1837 | K723: =ROUND((R1003C-R4C)/(R1003C3)*RC3,0)+R4C -> 26196 | O723: =RC[-4]-R[-1]C[-4] -> 36 | P723: =RC[-1]-R[-1]C[-1] -> 0
B724: =R[-3]C+1 -> 241 | C724: =R[-1]C+RC[1] -> 720 | D724: 1 | F724: =ROUND((R1003C-R4C)/(R1003C3)*RC3,0)+R4C -> 8466 | G724: =ROUND((R1003C-R4C)/(R1003C3)*RC3,0)+R4C -> 6615 | H724: =ROUND((R1003C-R4C)/(R1003C3)*RC3,0)+R4C -> 18724 | I724: =ROUND((R1003C-R4C)/(R1003C3)*RC3,0)+R4C -> 3401 | J724: =ROUND((R1003C-R4C)/(R1003C3)*RC3,0)+R4C -> 1839 | K724: =ROUND((R1003C-R4C)/(R1003C3)*RC3,0)+R4C -> 26232 | O724: =RC[-4]-R[-1]C[-4] -> 36 | P724: =RC[-1]-R[-1]C[-1] -> 0
B725: =R[-3]C+1 -> 241 | C725: =R[-1]C+RC[1] -> 721 | D725: 1 | F725: =ROUND((R1003C-R4C)/(R1003C3)*RC3,0)+R4C -> 8478 | G725: =ROUND((R1003C-R4C)/(R1003C3)*RC3,0)+R4C -> 6624 | H725: =ROUND((R1003C-R4C)/(R1003C3)*RC3,0)+R4C -> 18750 | I725: =ROUND((R1003C-R4C)/(R1003C3)*RC3,0)+R4C -> 3406 | J725: =ROUND((R1003C-R4C)/(R1003C3)*RC3,0)+R4C -> 1842 | K725: =ROUND((R1003C-R4C)/(R1003C3)*RC3,0)+R4C -> 26269 | O725: =RC[-4]-R[-1]C[-4] -> 37 | P725: =RC[-1]-R[-1]C[-1] -> 1
B726: =R[-3]C+1 -> 241 | C726: =R[-1]C+RC[1] -> 722 | D726: 1 | F726: =ROUND((R1003C-R4C)/(R1003C3)*RC3,0)+R4C -> 8490 | G726: =ROUND((R1003C-R4C)/(R1003C3)*RC3,0)+R4C -> 6634 | H726: =ROUND((R1003C-R4C)/(R1003C3)*RC3,0)+R4C -> 18776 | I726: =ROUND((R1003C-R4C)/(R1003C3)*RC3,0)+R4C -> 3411 | J726: =ROUND((R1003C-R4C)/(R1003C3)*RC3,0)+R4C -> 1844 | K726: =ROUND((R1003C-R4C)/(R1003C3)*RC3,0)+R4C -> 26305 | O726: =RC[-4]-R[-1]C[-4] -> 36 | P726: =RC[-1]-R[-1]C[-1] -> -1
B727: =R[-3]C+1 -> 242 | C727: =R[-1]C+RC[1] -> 723 | D727: 1 | F727: =ROUND((R1003C-R4C)/(R1003C3)*RC3,0)+R4C -> 8501 | G727: =ROUND((R1003C-R4C)/(R1003C3)*RC3,0)+R4C -> 6643 | H727: =ROUND((R1003C-R4C)/(R1003C3)*RC3,0)+R4C -> 18801 | I727: =ROUND((R1003C-R4C)/(R1003C3)*RC3,0)+R4C -> 3415 | J727: =ROUND((R1003C-R4C)/(R1003C3)*RC3,0)+R4C -> 1847 | K727: =ROUND((R1003C-R4C)/(R1003C3)*RC3,0)+R4C -> 26341 | O727: =RC[-4]-R[-1]C[-4] -> 36 | P727: =RC[-1]-R[-1]C[-1] -> 0
B728: =R[-3]C+1 -> 242 | C728: =R[-1]C+RC[1] -> 724 | D728: 1 | F728: =ROUND((R1003C-R4C)/(R1003C3)*RC3,0)+R4C -> 8513 | G728: =ROUND((R1003C-R4C)/(R1003C3)*RC3,0)+R4C -> 6652 | H728: =ROUND((R1003C-R4C)/(R1003C3)*RC3,0)+R4C -> 18827 | I728: =ROUND((R1003C-R4C)/(R1003C3)*RC3,0)+R4C -> 3420 | J728: =ROUND((R1003C-R4C)/(R1003C3)*RC3,0)+R4C -> 1849 | K728: =ROUND((R1003C-R4C)/(R1003C3)*RC3,0)+R4C -> 26377 | O728: =RC[-4]-R[-1]C[-4] -> 36 | P728: =RC[-1]-R[-1]C[-1] -> 0
B729: =R[-3]C+1 -> 242 | C729: =R[-1]C+RC[1] -> 725 | D729: 1 | F729: =ROUND((R1003C-R4C)/(R1003C3)*RC3,0)+R4C -> 8525 | G729: =ROUND((R1003C-R4C)/(R1003C3)*RC3,0)+R4C -> 6661 | H729: =ROUND((R1003C-R4C)/(R1003C3)*RC3,0)+R4C -> 18853 | I729: =ROUND((R1003C-R4C)/(R1003C3)*RC3,0)+R4C -> 3425 | J729: =ROUND((R1003C-R4C)/(R1003C3)*RC3,0)+R4C -> 1852 | K729: =ROUND((R1003C-R4C)/(R1003C3)*RC3,0)+R4C -> 26413 | O729: =RC[-4]-R[-1]C[-4] -> 36 | P729: =RC[-1]-R[-1]C[-1] -> 0
B730: =R[-3]C+1 -> 243 | C730: =R[-1]C+RC[1] -> 726 | D730: 1 | F730: =ROUND((R1003C-R4C)/(R1003C3)*RC3,0)+R4C -> 8536 | G730: =ROUND((R1003C-R4C)/(R1003C3)*RC3,0)+R4C -> 6670 | H730: =ROUND((R1003C-R4C)/(R1003C3)*RC3,0)+R4C -> 18879 | I730: =ROUND((R1003C-R4C)/(R1003C3)*RC3,0)+R4C -> 3429 | J730: =ROUND((R1003C-R4C)/(R1003C3)*RC3,0)+R4C -> 1855 | K730: =ROUND((R1003C-R4C)/(R1003C3)*RC3,0)+R4C -> 26450 | O730: =RC[-4]-R[-1]C[-4] -> 37 | P730: =RC[-1]-R[-1]C[-1] -> 1
B731: =R[-3]C+1 -> 243 | C731: =R[-1]C+RC[1] -> 727 | D731: 1 | F731: =ROUND((R1003C-R4C)/(R1003C3)*RC3,0)+R4C -> 8548 | G731: =ROUND((R1003C-R4C)/(R1003C3)*RC3,0)+R4C -> 6679 | H731: =ROUND((R1003C-R4C)/(R1003C3)*RC3,0)+R4C -> 18905 | I731: =ROUND((R1003C-R4C)/(R1003C3)*RC3,0)+R4C -> 3434 | J731: =ROUND((R1003C-R4C)/(R1003C3)*RC3,0)+R4C -> 1857 | K731: =ROUND((R1003C-R4C)/(R1003C3)*RC3,0)+R4C -> 26486 | O731: =RC[-4]-R[-1]C[-4] -> 36 | P731: =RC[-1]-R[-1]C[-1] -> -1
B732: =R[-3]C+1 -> 243 | C732: =R[-1]C+RC[1] -> 728 | D732: 1 | F732: =ROUND((R1003C-R4C)/(R1003C3)*RC3,0)+R4C -> 8560 | G732: =ROUND((R1003C-R4C)/(R1003C3)*RC3,0)+R4C -> 6688 | H732: =ROUND((R1003C-R4C)/(R1003C3)*RC3,0)+R4C -> 18930 | I732: =ROUND((R1003C-R4C)/(R1003C3)*RC3,0)+R4C -> 3439 | J732: =ROUND((R1003C-R4C)/(R1003C3)*RC3,0)+R4C -> 1860 | K732: =ROUND((R1003C-R4C)/(R1003C3)*RC3,0)+R4C -> 26522 | O732: =RC[-4]-R[-1]C[-4] -> 36 | P732: =RC[-1]-R[-1]C[-1] -> 0
B733: =R[-3]C+1 -> 244 | C733: =R[-1]C+RC[1] -> 729 | D733: 1 | F733: =ROUND((R1003C-R4C)/(R1003C3)*RC3,0)+R4C -> 8571 | G733: =ROUND((R1003C-R4C)/(R1003C3)*RC3,0)+R4C -> 6697 | H733: =ROUND((R1003C-R4C)/(R1003C3)*RC3,0)+R4C -> 18956 | I733: =ROUND((R1003C-R4C)/(R1003C3)*RC3,0)+R4C -> 3444 | J733: =ROUND((R1003C-R4C)/(R1003C3)*RC3,0)+R4C -> 1862 | K733: =ROUND((R1003C-R4C)/(R1003C3)*RC3,0)+R4C -> 26558 | O733: =RC[-4]-R[-1]C[-4] -> 36 | P733: =RC[-1]-R[-1]C[-1] -> 0
B734: =R[-3]C+1 -> 244 | C734: =R[-1]C+RC[1] -> 730 | D734: 1 | F734: =ROUND((R1003C-R4C)/(R1003C3)*RC3,0)+R4C -> 8583 | G734: =ROUND((R1003C-R4C)/(R1003C3)*RC3,0)+R4C -> 6707 | H734: =ROUND((R1003C-R4C)/(R1003C3)*RC3,0)+R4C -> 18982 | I734: =ROUND((R1003C-R4C)/(R1003C3)*RC3,0)+R4C -> 3448 | J734: =ROUND((R1003C-R4C)/(R1003C3)*RC3,0)+R4C -> 1865 | K734: =ROUND((R1003C-R4C)/(R1003C3)*RC3,0)+R4C -> 26594 | O734: =RC[-4]-R[-1]C[-4] -> 36 | P734: =RC[-1]-R[-1]C[-1] -> 0
B735: =R[-3]C+1 -> 244 | C735: =R[-1]C+RC[1] -> 731 | D735: 1 | F735: =ROUND((R1003C-R4C)/(R1003C3)*RC3,0)+R4C -> 8595 | G735: =ROUND((R1003C-R4C)/(R1003C3)*RC3,0)+R4C -> 6716 | H735: =ROUND((R1003C-R4C)/(R1003C3)*RC3,0)+R4C -> 19008 | I735: =ROUND((R1003C-R4C)/(R1003C3)*RC3,0)+R4C -> 3453 | J735: =ROUND((R1003C-R4C)/(R1003C3)*RC3,0)+R4C -> 1867 | K735: =ROUND((R1003C-R4C)/(R1003C3)*RC3,0)+R4C -> 26630 | O735: =RC[-4]-R[-1]C[-4] -> 36 | P735: =RC[-1]-R[-1]C[-1] -> 0
B736: =R[-3]C+1 -> 245 | C736: =R[-1]C+RC[1] -> 732 | D736: 1 | F736: =ROUND((R1003C-R4C)/(R1003C3)*RC3,0)+R4C -> 8606 | G736: =ROUND((R1003C-R4C)/(R1003C3)*RC3,0)+R4C -> 6725 | H736: =ROUND((R1003C-R4C)/(R1003C3)*RC3,0)+R4C -> 19034 | I736: =ROUND((R1003C-R4C)/(R1003C3)*RC3,0)+R4C -> 3458 | J736: =ROUND((R1003C-R4C)/(R1003C3)*RC3,0)+R4C -> 1870 | K736: =ROUND((R1003C-R4C)/(R1003C3)*RC3,0)+R4C -> 26667 | O736: =RC[-4]-R[-1]C[-4] -> 37 | P736: =RC[-1]-R[-1]C[-1] -> 1
B737: =R[-3]C+1 -> 245 | C737: =R[-1]C+RC[1] -> 733 | D737: 1 | F737: =ROUND((R1003C-R4C)/(R1003C3)*RC3,0)+R4C -> 8618 | G737: =ROUND((R1003C-R4C)/(R1003C3)*RC3,0)+R4C -> 6734 | H737: =ROUND((R1003C-R4C)/(R1003C3)*RC3,0)+R4C -> 19060 | I737: =ROUND((R1003C-R4C)/(R1003C3)*RC3,0)+R4C -> 3462 | J737: =ROUND((R1003C-R4C)/(R1003C3)*RC3,0)+R4C -> 1872 | K737: =ROUND((R1003C-R4C)/(R1003C3)*RC3,0)+R4C -> 26703 | O737: =RC[-4]-R[-1]C[-4] -> 36 | P737: =RC[-1]-R[-1]C[-1] -> -1
B738: =R[-3]C+1 -> 245 | C738: =R[-1]C+RC[1] -> 734 | D738: 1 | F738: =ROUND((R1003C-R4C)/(R1003C3)*RC3,0)+R4C -> 8630 | G738: =ROUND((R1003C-R4C)/(R1003C3)*RC3,0)+R4C -> 6743 | H738: =ROUND((R1003C-R4C)/(R1003C3)*RC3,0)+R4C -> 19085 | I738: =ROUND((R1003C-R4C)/(R1003C3)*RC3,0)+R4C -> 3467 | J738: =ROUND((R1003C-R4C)/(R1003C3)*RC3,0)+R4C -> 1875 | K738: =ROUND((R1003C-R4C)/(R1003C3)*RC3,0)+R4C -> 26739 | O738: =RC[-4]-R[-1]C[-4] -> 36 | P738: =RC[-1]-R[-1]C[-1] -> 0
B739: =R[-3]C+1 -> 246 | C739: =R[-1]C+RC[1] -> 735 | D739: 1 | F739: =ROUND((R1003C-R4C)/(R1003C3)*RC3,0)+R4C -> 8641 | G739: =ROUND((R1003C-R4C)/(R1003C3)*RC3,0)+R4C -> 6752 | H739: =ROUND((R1003C-R4C)/(R1003C3)*RC3,0)+R4C -> 19111 | I739: =ROUND((R1003C-R4C)/(R1003C3)*RC3,0)+R4C -> 3472 | J739: =ROUND((R1003C-R4C)/(R1003C3)*RC3,0)+R4C -> 1877 | K739: =ROUND((R1003C-R4C)/(R1003C3)*RC3,0)+R4C -> 26775 | O739: =RC[-4]-R[-1]C[-4] -> 36 | P739: =RC[-1]-R[-1]C[-1] -> 0
B740: =R[-3]C+1 -> 246 | C740: =R[-1]C+RC[1] -> 736 | D740: 1 | F740: =ROUND((R1003C-R4C)/(R1003C3)*RC3,0)+R4C -> 8653 | G740: =ROUND((R1003C-R4C)/(R1003C3)*RC3,0)+R4C -> 6761 | H740: =ROUND((R1003C-R4C)/(R1003C3)*RC3,0)+R4C -> 19137 | I740: =ROUND((R1003C-R4C)/(R1003C3)*RC3,0)+R4C -> 3476 | J740: =ROUND((R1003C-R4C)/(R1003C3)*RC3,0)+R4C -> 1880 | K740: =ROUND((R1003C-R4C)/(R1003C3)*RC3,0)+R4C -> 26811 | O740: =RC[-4]-R[-1]C[-4] -> 36 | P740: =RC[-1]-R[-1]C[-1] -> 0
B741: =R[-3]C+1 -> 246 | C741: =R[-1]C+RC[1] -> 737 | D741: 1 | F741: =ROUND((R1003C-R4C)/(R1003C3)*RC3,0)+R4C -> 8665 | G741: =ROUND((R1003C-R4C)/(R1003C3)*RC3,0)+R4C -> 6770 | H741: =ROUND((R1003C-R4C)/(R1003C3)*RC3,0)+R4C -> 19163 | I741: =ROUND((R1003C-R4C)/(R1003C3)*RC3,0)+R4C -> 3481 | J741: =ROUND((R1003C-R4C)/(R1003C3)*RC3,0)+R4C -> 1882 | K741: =ROUND((R1003C-R4C)/(R1003C3)*RC3,0)+R4C -> 26848 | O741: =RC[-4]-R[-1]C[-4] -> 37 | P741: =RC[-1]-R[-1]C[-1] -> 1
B742: =R[-3]C+1 -> 247 | C742: =R[-1]C+RC[1] -> 738 | D742: 1 | F742: =ROUND((R1003C-R4C)/(R1003C3)*RC3,0)+R4C -> 8676 | G742: =ROUND((R1003C-R4C)/(R1003C3)*RC3,0)+R4C -> 6780 | H742: =ROUND((R1003C-R4C)/(R1003C3)*RC3,0)+R4C -> 19189 | I742: =ROUND((R1003C-R4C)/(R1003C3)*RC3,0)+R4C -> 3486 | J742: =ROUND((R1003C-R4C)/(R1003C3)*RC3,0)+R4C -> 1885 | K742: =ROUND((R1003C-R4C)/(R1003C3)*RC3,0)+R4C -> 26884 | O742: =RC[-4]-R[-1]C[-4] -> 36 | P742: =RC[-1]-R[-1]C[-1] -> -1
B743: =R[-3]C+1 -> 247 | C743: =R[-1]C+RC[1] -> 739 | D743: 1 | F743: =ROUND((R1003C-R4C)/(R1003C3)*RC3,0)+R4C -> 8688 | G743: =ROUND((R1003C-R4C)/(R1003C3)*RC3,0)+R4C -> 6789 | H743: =ROUND((R1003C-R4C)/(R1003C3)*RC3,0)+R4C -> 19215 | I743: =ROUND((R1003C-R4C)/(R1003C3)*RC3,0)+R4C -> 3490 | J743: =ROUND((R1003C-R4C)/(R1003C3)*RC3,0)+R4C -> 1888 | K743: =ROUND((R1003C-R4C)/(R1003C3)*RC3,0)+R4C -> 26920 | O743: =RC[-4]-R[-1]C[-4] -> 36 | P743: =RC[-1]-R[-1]C[-1] -> 0
B744: =R[-3]C+1 -> 247 | C744: =R[-1]C+RC[1] -> 740 | D744: 1 | F744: =ROUND((R1003C-R4C)/(R1003C3)*RC3,0)+R4C -> 8700 | G744: =ROUND((R1003C-R4C)/(R1003C3)*RC3,0)+R4C -> 6798 | H744: =ROUND((R1003C-R4C)/(R1003C3)*RC3,0)+R4C -> 19240 | I744: =ROUND((R1003C-R4C)/(R1003C3)*RC3,0)+R4C -> 3495 | J744: =ROUND((R1003C-R4C)/(R1003C3)*RC3,0)+R4C -> 1890 | K744: =ROUND((R1003C-R4C)/(R1003C3)*RC3,0)+R4C -> 26956 | O744: =RC[-4]-R[-1]C[-4] -> 36 | P744: =RC[-1]-R[-1]C[-1] -> 0
B745: =R[-3]C+1 -> 248 | C745: =R[-1]C+RC[1] -> 741 | D745: 1 | F745: =ROUND((R1003C-R4C)/(R1003C3)*RC3,0)+R4C -> 8711 | G745: =ROUND((R1003C-R4C)/(R1003C3)*RC3,0)+R4C -> 6807 | H745: =ROUND((R1003C-R4C)/(R1003C3)*RC3,0)+R4C -> 19266 | I745: =ROUND((R1003C-R4C)/(R1003C3)*RC3,0)+R4C -> 3500 | J745: =ROUND((R1003C-R4C)/(R1003C3)*RC3,0)+R4C -> 1893 | K745: =ROUND((R1003C-R4C)/(R1003C3)*RC3,0)+R4C -> 26992 | O745: =RC[-4]-R[-1]C[-4] -> 36 | P745: =RC[-1]-R[-1]C[-1] -> 0
B746: =R[-3]C+1 -> 248 | C746: =R[-1]C+RC[1] -> 742 | D746: 1 | F746: =ROUND((R1003C-R4C)/(R1003C3)*RC3,0)+R4C -> 8723 | G746: =ROUND((R1003C-R4C)/(R1003C3)*RC3,0)+R4C -> 6816 | H746: =ROUND((R1003C-R4C)/(R1003C3)*RC3,0)+R4C -> 19292 | I746: =ROUND((R1003C-R4C)/(R1003C3)*RC3,0)+R4C -> 3504 | J746: =ROUND((R1003C-R4C)/(R1003C3)*RC3,0)+R4C -> 1895 | K746: =ROUND((R1003C-R4C)/(R1003C3)*RC3,0)+R4C -> 27028 | O746: =RC[-4]-R[-1]C[-4] -> 36 | P746: =RC[-1]-R[-1]C[-1] -> 0
B747: =R[-3]C+1 -> 248 | C747: =R[-1]C+RC[1] -> 743 | D747: 1 | F747: =ROUND((R1003C-R4C)/(R1003C3)*RC3,0)+R4C -> 8735 | G747: =ROUND((R1003C-R4C)/(R1003C3)*RC3,0)+R4C -> 6825 | H747: =ROUND((R1003C-R4C)/(R1003C3)*RC3,0)+R4C -> 19318 | I747: =ROUND((R1003C-R4C)/(R1003C3)*RC3,0)+R4C -> 3509 | J747: =ROUND((R1003C-R4C)/(R1003C3)*RC3,0)+R4C -> 1898 | K747: =ROUND((R1003C-R4C)/(R1003C3)*RC3,0)+R4C -> 27065 | O747: =RC[-4]-R[-1]C[-4] -> 37 | P747: =RC[-1]-R[-1]C[-1] -> 1
B748: =R[-3]C+1 -> 249 | C748: =R[-1]C+RC[1] -> 744 | D748: 1 | F748: =ROUND((R1003C-R4C)/(R1003C3)*RC3,0)+R4C -> 8746 | G748: =ROUND((R1003C-R4C)/(R1003C3)*RC3,0)+R4C -> 6834 | H748: =ROUND((R1003C-R4C)/(R1003C3)*RC3,0)+R4C -> 19344 | I748: =ROUND((R1003C-R4C)/(R1003C3)*RC3,0)+R4C -> 3514 | J748: =ROUND((R1003C-R4C)/(R1003C3)*RC3,0)+R4C -> 1900 | K748: =ROUND((R1003C-R4C)/(R1003C3)*RC3,0)+R4C -> 27101 | O748: =RC[-4]-R[-1]C[-4] -> 36 | P748: =RC[-1]-R[-1]C[-1] -> -1
B749: =R[-3]C+1 -> 249 | C749: =R[-1]C+RC[1] -> 745 | D749: 1 | F749: =ROUND((R1003C-R4C)/(R1003C3)*RC3,0)+R4C -> 8758 | G749: =ROUND((R1003C-R4C)/(R1003C3)*RC3,0)+R4C -> 6843 | H749: =ROUND((R1003C-R4C)/(R1003C3)*RC3,0)+R4C -> 19369 | I749: =ROUND((R1003C-R4C)/(R1003C3)*RC3,0)+R4C -> 3519 | J749: =ROUND((R1003C-R4C)/(R1003C3)*RC3,0)+R4C -> 1903 | K749: =ROUND((R1003C-R4C)/(R1003C3)*RC3,0)+R4C -> 27137 | O749: =RC[-4]-R[-1]C[-4] -> 36 | P749: =RC[-1]-R[-1]C[-1] -> 0
B750: =R[-3]C+1 -> 249 | C750: =R[-1]C+RC[1] -> 746 | D750: 1 | F750: =ROUND((R1003C-R4C)/(R1003C3)*RC3,0)+R4C -> 8770 | G750: =ROUND((R1003C-R4C)/(R1003C3)*RC3,0)+R4C -> 6853 | H750: =ROUND((R1003C-R4C)/(R1003C3)*RC3,0)+R4C -> 19395 | I750: =ROUND((R1003C-R4C)/(R1003C3)*RC3,0)+R4C -> 3523 | J750: =ROUND((R1003C-R4C)/(R1003C3)*RC3,0)+R4C -> 1905 | K750: =ROUND((R1003C-R4C)/(R1003C3)*RC3,0)+R4C -> 27173 | O750: =RC[-4]-R[-1]C[-4] -> 36 | P750: =RC[-1]-R[-1]C[-1] -> 0
B751: =R[-3]C+1 -> 250 | C751: =R[-1]C+RC[1] -> 747 | D751: 1 | F751: =ROUND((R1003C-R4C)/(R1003C3)*RC3,0)+R4C -> 8781 | G751: =ROUND((R1003C-R4C)/(R1003C3)*RC3,0)+R4C -> 6862 | H751: =ROUND((R1003C-R4C)/(R1003C3)*RC3,0)+R4C -> 19421 | I751: =ROUND((R1003C-R4C)/(R1003C3)*RC3,0)+R4C -> 3528 | J751: =ROUND((R1003C-R4C)/(R1003C3)*RC3,0)+R4C -> 1908 | K751: =ROUND((R1003C-R4C)/(R1003C3)*RC3,0)+R4C -> 27209 | O751: =RC[-4]-R[-1]C[-4] -> 36 | P751: =RC[-1]-R[-1]C[-1] -> 0
B752: =R[-3]C+1 -> 250 | C752: =R[-1]C+RC[1] -> 748 | D752: 1 | F752: =ROUND((R1003C-R4C)/(R1003C3)*RC3,0)+R4C -> 8793 | G752: =ROUND((R1003C-R4C)/(R1003C3)*RC3,0)+R4C -> 6871 | H752: =ROUND((R1003C-R4C)/(R1003C3)*RC3,0)+R4C -> 19447 | I752: =ROUND((R1003C-R4C)/(R1003C3)*RC3,0)+R4C -> 3533 | J752: =ROUND((R1003C-R4C)/(R1003C3)*RC3,0)+R4C -> 1910 | K752: =ROUND((R1003C-R4C)/(R1003C3)*RC3,0)+R4C -> 27246 | O752: =RC[-4]-R[-1]C[-4] -> 37 | P752: =RC[-1]-R[-1]C[-1] -> 1
B753: =R[-3]C+1 -> 250 | C753: =R[-1]C+RC[1] -> 749 | D753: 1 | F753: =ROUND((R1003C-R4C)/(R1003C3)*RC3,0)+R4C -> 8805 | G753: =ROUND((R1003C-R4C)/(R1003C3)*RC3,0)+R4C -> 6880 | H753: =ROUND((R1003C-R4C)/(R1003C3)*RC3,0)+R4C -> 19473 | I753: =ROUND((R1003C-R4C)/(R1003C3)*RC3,0)+R4C -> 3537 | J753: =ROUND((R1003C-R4C)/(R1003C3)*RC3,0)+R4C -> 1913 | K753: =ROUND((R1003C-R4C)/(R1003C3)*RC3,0)+R4C -> 27282 | O753: =RC[-4]-R[-1]C[-4] -> 36 | P753: =RC[-1]-R[-1]C[-1] -> -1
B754: =R[-3]C+1 -> 251 | C754: =R[-1]C+RC[1] -> 750 | D754: 1 | F754: =ROUND((R1003C-R4C)/(R1003C3)*RC3,0)+R4C -> 8817 | G754: =ROUND((R1003C-R4C)/(R1003C3)*RC3,0)+R4C -> 6889 | H754: =ROUND((R1003C-R4C)/(R1003C3)*RC3,0)+R4C -> 19499 | I754: =ROUND((R1003C-R4C)/(R1003C3)*RC3,0)+R4C -> 3542 | J754: =ROUND((R1003C-R4C)/(R1003C3)*RC3,0)+R4C -> 1915 | K754: =ROUND((R1003C-R4C)/(R1003C3)*RC3,0)+R4C -> 27318 | O754: =RC[-4]-R[-1]C[-4] -> 36 | P754: =RC[-1]-R[-1]C[-1] -> 0
B755: =R[-3]C+1 -> 251 | C755: =R[-1]C+RC[1] -> 751 | D755: 1 | F755: =ROUND((R1003C-R4C)/(R1003C3)*RC3,0)+R4C -> 8828 | G755: =ROUND((R1003C-R4C)/(R1003C3)*RC3,0)+R4C -> 6898 | H755: =ROUND((R1003C-R4C)/(R1003C3)*RC3,0)+R4C -> 19524 | I755: =ROUND((R1003C-R4C)/(R1003C3)*RC3,0)+R4C -> 3547 | J755: =ROUND((R1003C-R4C)/(R1003C3)*RC3,0)+R4C -> 1918 | K755: =ROUND((R1003C-R4C)/(R1003C3)*RC3,0)+R4C -> 27354 | O755: =RC[-4]-R[-1]C[-4] -> 36 | P755: =RC[-1]-R[-1]C[-1] -> 0
B756: =R[-3]C+1 -> 251 | C756: =R[-1]C+RC[1] -> 752 | D756: 1 | F756: =ROUND((R1003C-R4C)/(R1003C3)*RC3,0)+R4C -> 8840 | G756: =ROUND((R1003C-R4C)/(R1003C3)*RC3,0)+R4C -> 6907 | H756: =ROUND((R1003C-R4C)/(R1003C3)*RC3,0)+R4C -> 19550 | I756: =ROUND((R1003C-R4C)/(R1003C3)*RC3,0)+R4C -> 3551 | J756: =ROUND((R1003C-R4C)/(R1003C3)*RC3,0)+R4C -> 1920 | K756: =ROUND((R1003C-R4C)/(R1003C3)*RC3,0)+R4C -> 27390 | O756: =RC[-4]-R[-1]C[-4] -> 36 | P756: =RC[-1]-R[-1]C[-1] -> 0
B757: =R[-3]C+1 -> 252 | C757: =R[-1]C+RC[1] -> 753 | D757: 1 | F757: =ROUND((R1003C-R4C)/(R1003C3)*RC3,0)+R4C -> 8852 | G757: =ROUND((R1003C-R4C)/(R1003C3)*RC3,0)+R4C -> 6916 | H757: =ROUND((R1003C-R4C)/(R1003C3)*RC3,0)+R4C -> 19576 | I757: =ROUND((R1003C-R4C)/(R1003C3)*RC3,0)+R4C -> 3556 | J757: =ROUND((R1003C-R4C)/(R1003C3)*RC3,0)+R4C -> 1923 | K757: =ROUND((R1003C-R4C)/(R1003C3)*RC3,0)+R4C -> 27426 | O757: =RC[-4]-R[-1]C[-4] -> 36 | P757: =RC[-1]-R[-1]C[-1] -> 0
B758: =R[-3]C+1 -> 252 | C758: =R[-1]C+RC[1] -> 754 | D758: 1 | F758: =ROUND((R1003C-R4C)/(R1003C3)*RC3,0)+R4C -> 8863 | G758: =ROUND((R1003C-R4C)/(R1003C3)*RC3,0)+R4C -> 6926 | H758: =ROUND((R1003C-R4C)/(R1003C3)*RC3,0)+R4C -> 19602 | I758: =ROUND((R1003C-R4C)/(R1003C3)*RC3,0)+R4C -> 3561 | J758: =ROUND((R1003C-R4C)/(R1003C3)*RC3,0)+R4C -> 1926 | K758: =ROUND((R1003C-R4C)/(R1003C3)*RC3,0)+R4C -> 27463 | O758: =RC[-4]-R[-1]C[-4] -> 37 | P758: =RC[-1]-R[-1]C[-1] -> 1
B759: =R[-3]C+1 -> 252 | C759: =R[-1]C+RC[1] -> 755 | D759: 1 | F759: =ROUND((R1003C-R4C)/(R1003C3)*RC3,0)+R4C -> 8875 | G759: =ROUND((R1003C-R4C)/(R1003C3)*RC3,0)+R4C -> 6935 | H759: =ROUND((R1003C-R4C)/(R1003C3)*RC3,0)+R4C -> 19628 | I759: =ROUND((R1003C-R4C)/(R1003C3)*RC3,0)+R4C -> 3565 | J759: =ROUND((R1003C-R4C)/(R1003C3)*RC3,0)+R4C -> 1928 | K759: =ROUND((R1003C-R4C)/(R1003C3)*RC3,0)+R4C -> 27499 | O759: =RC[-4]-R[-1]C[-4] -> 36 | P759: =RC[-1]-R[-1]C[-1] -> -1
B760: =R[-3]C+1 -> 253 | C760: =R[-1]C+RC[1] -> 756 | D760: 1 | F760: =ROUND((R1003C-R4C)/(R1003C3)*RC3,0)+R4C -> 8887 | G760: =ROUND((R1003C-R4C)/(R1003C3)*RC3,0)+R4C -> 6944 | H760: =ROUND((R1003C-R4C)/(R1003C3)*RC3,0)+R4C -> 19654 | I760: =ROUND((R1003C-R4C)/(R1003C3)*RC3,0)+R4C -> 3570 | J760: =ROUND((R1003C-R4C)/(R1003C3)*RC3,0)+R4C -> 1931 | K760: =ROUND((R1003C-R4C)/(R1003C3)*RC3,0)+R4C -> 27535 | O760: =RC[-4]-R[-1]C[-4] -> 36 | P760: =RC[-1]-R[-1]C[-1] -> 0
B761: =R[-3]C+1 -> 253 | C761: =R[-1]C+RC[1] -> 757 | D761: 1 | F761: =ROUND((R1003C-R4C)/(R1003C3)*RC3,0)+R4C -> 8898 | G761: =ROUND((R1003C-R4C)/(R1003C3)*RC3,0)+R4C -> 6953 | H761: =ROUND((R1003C-R4C)/(R1003C3)*RC3,0)+R4C -> 19679 | I761: =ROUND((R1003C-R4C)/(R1003C3)*RC3,0)+R4C -> 3575 | J761: =ROUND((R1003C-R4C)/(R1003C3)*RC3,0)+R4C -> 1933 | K761: =ROUND((R1003C-R4C)/(R1003C3)*RC3,0)+R4C -> 27571 | O761: =RC[-4]-R[-1]C[-4] -> 36 | P761: =RC[-1]-R[-1]C[-1] -> 0
B762: =R[-3]C+1 -> 253 | C762: =R[-1]C+RC[1] -> 758 | D762: 1 | F762: =ROUND((R1003C-R4C)/(R1003C3)*RC3,0)+R4C -> 8910 | G762: =ROUND((R1003C-R4C)/(R1003C3)*RC3,0)+R4C -> 6962 | H762: =ROUND((R1003C-R4C)/(R1003C3)*RC3,0)+R4C -> 19705 | I762: =ROUND((R1003C-R4C)/(R1003C3)*RC3,0)+R4C -> 3580 | J762: =ROUND((R1003C-R4C)/(R1003C3)*RC3,0)+R4C -> 1936 | K762: =ROUND((R1003C-R4C)/(R1003C3)*RC3,0)+R4C -> 27607 | O762: =RC[-4]-R[-1]C[-4] -> 36 | P762: =RC[-1]-R[-1]C[-1] -> 0
B763: =R[-3]C+1 -> 254 | C763: =R[-1]C+RC[1] -> 759 | D763: 1 | F763: =ROUND((R1003C-R4C)/(R1003C3)*RC3,0)+R4C -> 8922 | G763: =ROUND((R1003C-R4C)/(R1003C3)*RC3,0)+R4C -> 6971 | H763: =ROUND((R1003C-R4C)/(R1003C3)*RC3,0)+R4C -> 19731 | I763: =ROUND((R1003C-R4C)/(R1003C3)*RC3,0)+R4C -> 3584 | J763: =ROUND((R1003C-R4C)/(R1003C3)*RC3,0)+R4C -> 1938 | K763: =ROUND((R1003C-R4C)/(R1003C3)*RC3,0)+R4C -> 27644 | O763: =RC[-4]-R[-1]C[-4] -> 37 | P763: =RC[-1]-R[-1]C[-1] -> 1
B764: =R[-3]C+1 -> 254 | C764: =R[-1]C+RC[1] -> 760 | D764: 1 | F764: =ROUND((R1003C-R4C)/(R1003C3)*RC3,0)+R4C -> 8933 | G764: =ROUND((R1003C-R4C)/(R1003C3)*RC3,0)+R4C -> 6980 | H764: =ROUND((R1003C-R4C)/(R1003C3)*RC3,0)+R4C -> 19757 | I764: =ROUND((R1003C-R4C)/(R1003C3)*RC3,0)+R4C -> 3589 | J764: =ROUND((R1003C-R4C)/(R1003C3)*RC3,0)+R4C -> 1941 | K764: =ROUND((R1003C-R4C)/(R1003C3)*RC3,0)+R4C -> 27680 | O764: =RC[-4]-R[-1]C[-4] -> 36 | P764: =RC[-1]-R[-1]C[-1] -> -1
B765: =R[-3]C+1 -> 254 | C765: =R[-1]C+RC[1] -> 761 | D765: 1 | F765: =ROUND((R1003C-R4C)/(R1003C3)*RC3,0)+R4C -> 8945 | G765: =ROUND((R1003C-R4C)/(R1003C3)*RC3,0)+R4C -> 6989 | H765: =ROUND((R1003C-R4C)/(R1003C3)*RC3,0)+R4C -> 19783 | I765: =ROUND((R1003C-R4C)/(R1003C3)*RC3,0)+R4C -> 3594 | J765: =ROUND((R1003C-R4C)/(R1003C3)*RC3,0)+R4C -> 1943 | K765: =ROUND((R1003C-R4C)/(R1003C3)*RC3,0)+R4C -> 27716 | O765: =RC[-4]-R[-1]C[-4] -> 36 | P765: =RC[-1]-R[-1]C[-1] -> 0
B766: =R[-3]C+1 -> 255 | C766: =R[-1]C+RC[1] -> 762 | D766: 1 | F766: =ROUND((R1003C-R4C)/(R1003C3)*RC3,0)+R4C -> 8957 | G766: =ROUND((R1003C-R4C)/(R1003C3)*RC3,0)+R4C -> 6999 | H766: =ROUND((R1003C-R4C)/(R1003C3)*RC3,0)+R4C -> 19809 | I766: =ROUND((R1003C-R4C)/(R1003C3)*RC3,0)+R4C -> 3598 | J766: =ROUND((R1003C-R4C)/(R1003C3)*RC3,0)+R4C -> 1946 | K766: =ROUND((R1003C-R4C)/(R1003C3)*RC3,0)+R4C -> 27752 | O766: =RC[-4]-R[-1]C[-4] -> 36 | P766: =RC[-1]-R[-1]C[-1] -> 0
B767: =R[-3]C+1 -> 255 | C767: =R[-1]C+RC[1] -> 763 | D767: 1 | F767: =ROUND((R1003C-R4C)/(R1003C3)*RC3,0)+R4C -> 8968 | G767: =ROUND((R1003C-R4C)/(R1003C3)*RC3,0)+R4C -> 7008 | H767: =ROUND((R1003C-R4C)/(R1003C3)*RC3,0)+R4C -> 19834 | I767: =ROUND((R1003C-R4C)/(R1003C3)*RC3,0)+R4C -> 3603 | J767: =ROUND((R1003C-R4C)/(R1003C3)*RC3,0)+R4C -> 1948 | K767: =ROUND((R1003C-R4C)/(R1003C3)*RC3,0)+R4C -> 27788 | O767: =RC[-4]-R[-1]C[-4] -> 36 | P767: =RC[-1]-R[-1]C[-1] -> 0
B768: =R[-3]C+1 -> 255 | C768: =R[-1]C+RC[1] -> 764 | D768: 1 | F768: =ROUND((R1003C-R4C)/(R1003C3)*RC3,0)+R4C -> 8980 | G768: =ROUND((R1003C-R4C)/(R1003C3)*RC3,0)+R4C -> 7017 | H768: =ROUND((R1003C-R4C)/(R1003C3)*RC3,0)+R4C -> 19860 | I768: =ROUND((R1003C-R4C)/(R1003C3)*RC3,0)+R4C -> 3608 | J768: =ROUND((R1003C-R4C)/(R1003C3)*RC3,0)+R4C -> 1951 | K768: =ROUND((R1003C-R4C)/(R1003C3)*RC3,0)+R4C -> 27824 | O768: =RC[-4]-R[-1]C[-4] -> 36 | P768: =RC[-1]-R[-1]C[-1] -> 0
B769: =R[-3]C+1 -> 256 | C769: =R[-1]C+RC[1] -> 765 | D769: 1 | F769: =ROUND((R1003C-R4C)/(R1003C3)*RC3,0)+R4C -> 8992 | G769: =ROUND((R1003C-R4C)/(R1003C3)*RC3,0)+R4C -> 7026 | H769: =ROUND((R1003C-R4C)/(R1003C3)*RC3,0)+R4C -> 19886 | I769: =ROUND((R1003C-R4C)/(R1003C3)*RC3,0)+R4C -> 3612 | J769: =ROUND((R1003C-R4C)/(R1003C3)*RC3,0)+R4C -> 1953 | K769: =ROUND((R1003C-R4C)/(R1003C3)*RC3,0)+R4C -> 27861 | O769: =RC[-4]-R[-1]C[-4] -> 37 | P769: =RC[-1]-R[-1]C[-1] -> 1
B770: =R[-3]C+1 -> 256 | C770: =R[-1]C+RC[1] -> 766 | D770: 1 | F770: =ROUND((R1003C-R4C)/(R1003C3)*RC3,0)+R4C -> 9003 | G770: =ROUND((R1003C-R4C)/(R1003C3)*RC3,0)+R4C -> 7035 | H770: =ROUND((R1003C-R4C)/(R1003C3)*RC3,0)+R4C -> 19912 | I770: =ROUND((R1003C-R4C)/(R1003C3)*RC3,0)+R4C -> 3617 | J770: =ROUND((R1003C-R4C)/(R1003C3)*RC3,0)+R4C -> 1956 | K770: =ROUND((R1003C-R4C)/(R1003C3)*RC3,0)+R4C -> 27897 | O770: =RC[-4]-R[-1]C[-4] -> 36 | P770: =RC[-1]-R[-1]C[-1] -> -1
B771: =R[-3]C+1 -> 256 | C771: =R[-1]C+RC[1] -> 767 | D771: 1 | F771: =ROUND((R1003C-R4C)/(R1003C3)*RC3,0)+R4C -> 9015 | G771: =ROUND((R1003C-R4C)/(R1003C3)*RC3,0)+R4C -> 7044 | H771: =ROUND((R1003C-R4C)/(R1003C3)*RC3,0)+R4C -> 19938 | I771: =ROUND((R1003C-R4C)/(R1003C3)*RC3,0)+R4C -> 3622 | J771: =ROUND((R1003C-R4C)/(R1003C3)*RC3,0)+R4C -> 1959 | K771: =ROUND((R1003C-R4C)/(R1003C3)*RC3,0)+R4C -> 27933 | O771: =RC[-4]-R[-1]C[-4] -> 36 | P771: =RC[-1]-R[-1]C[-1] -> 0
B772: =R[-3]C+1 -> 257 | C772: =R[-1]C+RC[1] -> 768 | D772: 1 | F772: =ROUND((R1003C-R4C)/(R1003C3)*RC3,0)+R4C -> 9027 | G772: =ROUND((R1003C-R4C)/(R1003C3)*RC3,0)+R4C -> 7053 | H772: =ROUND((R1003C-R4C)/(R1003C3)*RC3,0)+R4C -> 19963 | I772: =ROUND((R1003C-R4C)/(R1003C3)*RC3,0)+R4C -> 3626 | J772: =ROUND((R1003C-R4C)/(R1003C3)*RC3,0)+R4C -> 1961 | K772: =ROUND((R1003C-R4C)/(R1003C3)*RC3,0)+R4C -> 27969 | O772: =RC[-4]-R[-1]C[-4] -> 36 | P772: =RC[-1]-R[-1]C[-1] -> 0
B773: =R[-3]C+1 -> 257 | C773: =R[-1]C+RC[1] -> 769 | D773: 1 | F773: =ROUND((R1003C-R4C)/(R1003C3)*RC3,0)+R4C -> 9038 | G773: =ROUND((R1003C-R4C)/(R1003C3)*RC3,0)+R4C -> 7062 | H773: =ROUND((R1003C-R4C)/(R1003C3)*RC3,0)+R4C -> 19989 | I773: =ROUND((R1003C-R4C)/(R1003C3)*RC3,0)+R4C -> 3631 | J773: =ROUND((R1003C-R4C)/(R1003C3)*RC3,0)+R4C -> 1964 | K773: =ROUND((R1003C-R4C)/(R1003C3)*RC3,0)+R4C -> 28005 | O773: =RC[-4]-R[-1]C[-4] -> 36 | P773: =RC[-1]-R[-1]C[-1] -> 0
B774: =R[-3]C+1 -> 257 | C774: =R[-1]C+RC[1] -> 770 | D774: 1 | F774: =ROUND((R1003C-R4C)/(R1003C3)*RC3,0)+R4C -> 9050 | G774: =ROUND((R1003C-R4C)/(R1003C3)*RC3,0)+R4C -> 7072 | H774: =ROUND((R1003C-R4C)/(R1003C3)*RC3,0)+R4C -> 20015 | I774: =ROUND((R1003C-R4C)/(R1003C3)*RC3,0)+R4C -> 3636 | J774: =ROUND((R1003C-R4C)/(R1003C3)*RC3,0)+R4C -> 1966 | K774: =ROUND((R1003C-R4C)/(R1003C3)*RC3,0)+R4C -> 28042 | O774: =RC[-4]-R[-1]C[-4] -> 37 | P774: =RC[-1]-R[-1]C[-1] -> 1
B775: =R[-3]C+1 -> 258 | C775: =R[-1]C+RC[1] -> 771 | D775: 1 | F775: =ROUND((R1003C-R4C)/(R1003C3)*RC3,0)+R4C -> 9062 | G775: =ROUND((R1003C-R4C)/(R1003C3)*RC3,0)+R4C -> 7081 | H775: =ROUND((R1003C-R4C)/(R1003C3)*RC3,0)+R4C -> 20041 | I775: =ROUND((R1003C-R4C)/(R1003C3)*RC3,0)+R4C -> 3641 | J775: =ROUND((R1003C-R4C)/(R1003C3)*RC3,0)+R4C -> 1969 | K775: =ROUND((R1003C-R4C)/(R1003C3)*RC3,0)+R4C -> 28078 | O775: =RC[-4]-R[-1]C[-4] -> 36 | P775: =RC[-1]-R[-1]C[-1] -> -1
B776: =R[-3]C+1 -> 258 | C776: =R[-1]C+RC[1] -> 772 | D776: 1 | F776: =ROUND((R1003C-R4C)/(R1003C3)*RC3,0)+R4C -> 9073 | G776: =ROUND((R1003C-R4C)/(R1003C3)*RC3,0)+R4C -> 7090 | H776: =ROUND((R1003C-R4C)/(R1003C3)*RC3,0)+R4C -> 20067 | I776: =ROUND((R1003C-R4C)/(R1003C3)*RC3,0)+R4C -> 3645 | J776: =ROUND((R1003C-R4C)/(R1003C3)*RC3,0)+R4C -> 1971 | K776: =ROUND((R1003C-R4C)/(R1003C3)*RC3,0)+R4C -> 28114 | O776: =RC[-4]-R[-1]C[-4] -> 36 | P776: =RC[-1]-R[-1]C[-1] -> 0
B777: =R[-3]C+1 -> 258 | C777: =R[-1]C+RC[1] -> 773 | D777: 1 | F777: =ROUND((R1003C-R4C)/(R1003C3)*RC3,0)+R4C -> 9085 | G777: =ROUND((R1003C-R4C)/(R1003C3)*RC3,0)+R4C -> 7099 | H777: =ROUND((R1003C-R4C)/(R1003C3)*RC3,0)+R4C -> 20093 | I777: =ROUND((R1003C-R4C)/(R1003C3)*RC3,0)+R4C -> 3650 | J777: =ROUND((R1003C-R4C)/(R1003C3)*RC3,0)+R4C -> 1974 | K777: =ROUND((R1003C-R4C)/(R1003C3)*RC3,0)+R4C -> 28150 | O777: =RC[-4]-R[-1]C[-4] -> 36 | P777: =RC[-1]-R[-1]C[-1] -> 0
B778: =R[-3]C+1 -> 259 | C778: =R[-1]C+RC[1] -> 774 | D778: 1 | F778: =ROUND((R1003C-R4C)/(R1003C3)*RC3,0)+R4C -> 9097 | G778: =ROUND((R1003C-R4C)/(R1003C3)*RC3,0)+R4C -> 7108 | H778: =ROUND((R1003C-R4C)/(R1003C3)*RC3,0)+R4C -> 20118 | I778: =ROUND((R1003C-R4C)/(R1003C3)*RC3,0)+R4C -> 3655 | J778: =ROUND((R1003C-R4C)/(R1003C3)*RC3,0)+R4C -> 1976 | K778: =ROUND((R1003C-R4C)/(R1003C3)*RC3,0)+R4C -> 28186 | O778: =RC[-4]-R[-1]C[-4] -> 36 | P778: =RC[-1]-R[-1]C[-1] -> 0
B779: =R[-3]C+1 -> 259 | C779: =R[-1]C+RC[1] -> 775 | D779: 1 | F779: =ROUND((R1003C-R4C)/(R1003C3)*RC3,0)+R4C -> 9108 | G779: =ROUND((R1003C-R4C)/(R1003C3)*RC3,0)+R4C -> 7117 | H779: =ROUND((R1003C-R4C)/(R1003C3)*RC3,0)+R4C -> 20144 | I779: =ROUND((R1003C-R4C)/(R1003C3)*RC3,0)+R4C -> 3659 | J779: =ROUND((R1003C-R4C)/(R1003C3)*RC3,0)+R4C -> 1979 | K779: =ROUND((R1003C-R4C)/(R1003C3)*RC3,0)+R4C -> 28222 | O779: =RC[-4]-R[-1]C[-4] -> 36 | P779: =RC[-1]-R[-1]C[-1] -> 0
B780: =R[-3]C+1 -> 259 | C780: =R[-1]C+RC[1] -> 776 | D780: 1 | F780: =ROUND((R1003C-R4C)/(R1003C3)*RC3,0)+R4C -> 9120 | G780: =ROUND((R1003C-R4C)/(R1003C3)*RC3,0)+R4C -> 7126 | H780: =ROUND((R1003C-R4C)/(R1003C3)*RC3,0)+R4C -> 20170 | I780: =ROUND((R1003C-R4C)/(R1003C3)*RC3,0)+R4C -> 3664 | J780: =ROUND((R1003C-R4C)/(R1003C3)*RC3,0)+R4C -> 1981 | K780: =ROUND((R1003C-R4C)/(R1003C3)*RC3,0)+R4C -> 28259 | O780: =RC[-4]-R[-1]C[-4] -> 37 | P780: =RC[-1]-R[-1]C[-1] -> 1
B781: =R[-3]C+1 -> 260 | C781: =R[-1]C+RC[1] -> 777 | D781: 1 | F781: =ROUND((R1003C-R4C)/(R1003C3)*RC3,0)+R4C -> 9132 | G781: =ROUND((R1003C-R4C)/(R1003C3)*RC3,0)+R4C -> 7135 | H781: =ROUND((R1003C-R4C)/(R1003C3)*RC3,0)+R4C -> 20196 | I781: =ROUND((R1003C-R4C)/(R1003C3)*RC3,0)+R4C -> 3669 | J781: =ROUND((R1003C-R4C)/(R1003C3)*RC3,0)+R4C -> 1984 | K781: =ROUND((R1003C-R4C)/(R1003C3)*RC3,0)+R4C -> 28295 | O781: =RC[-4]-R[-1]C[-4] -> 36 | P781: =RC[-1]-R[-1]C[-1] -> -1
B782: =R[-3]C+1 -> 260 | C782: =R[-1]C+RC[1] -> 778 | D782: 1 | F782: =ROUND((R1003C-R4C)/(R1003C3)*RC3,0)+R4C -> 9143 | G782: =ROUND((R1003C-R4C)/(R1003C3)*RC3,0)+R4C -> 7145 | H782: =ROUND((R1003C-R4C)/(R1003C3)*RC3,0)+R4C -> 20222 | I782: =ROUND((R1003C-R4C)/(R1003C3)*RC3,0)+R4C -> 3673 | J782: =ROUND((R1003C-R4C)/(R1003C3)*RC3,0)+R4C -> 1986 | K782: =ROUND((R1003C-R4C)/(R1003C3)*RC3,0)+R4C -> 28331 | O782: =RC[-4]-R[-1]C[-4] -> 36 | P782: =RC[-1]-R[-1]C[-1] -> 0
B783: =R[-3]C+1 -> 260 | C783: =R[-1]C+RC[1] -> 779 | D783: 1 | F783: =ROUND((R1003C-R4C)/(R1003C3)*RC3,0)+R4C -> 9155 | G783: =ROUND((R1003C-R4C)/(R1003C3)*RC3,0)+R4C -> 7154 | H783: =ROUND((R1003C-R4C)/(R1003C3)*RC3,0)+R4C -> 20248 | I783: =ROUND((R1003C-R4C)/(R1003C3)*RC3,0)+R4C -> 3678 | J783: =ROUND((R1003C-R4C)/(R1003C3)*RC3,0)+R4C -> 1989 | K783: =ROUND((R1003C-R4C)/(R1003C3)*RC3,0)+R4C -> 28367 | O783: =RC[-4]-R[-1]C[-4] -> 36 | P783: =RC[-1]-R[-1]C[-1] -> 0
B784: =R[-3]C+1 -> 261 | C784: =R[-1]C+RC[1] -> 780 | D784: 1 | F784: =ROUND((R1003C-R4C)/(R1003C3)*RC3,0)+R4C -> 9167 | G784: =ROUND((R1003C-R4C)/(R1003C3)*RC3,0)+R4C -> 7163 | H784: =ROUND((R1003C-R4C)/(R1003C3)*RC3,0)+R4C -> 20273 | I784: =ROUND((R1003C-R4C)/(R1003C3)*RC3,0)+R4C -> 3683 | J784: =ROUND((R1003C-R4C)/(R1003C3)*RC3,0)+R4C -> 1991 | K784: =ROUND((R1003C-R4C)/(R1003C3)*RC3,0)+R4C -> 28403 | O784: =RC[-4]-R[-1]C[-4] -> 36 | P784: =RC[-1]-R[-1]C[-1] -> 0
B785: =R[-3]C+1 -> 261 | C785: =R[-1]C+RC[1] -> 781 | D785: 1 | F785: =ROUND((R1003C-R4C)/(R1003C3)*RC3,0)+R4C -> 9178 | G785: =ROUND((R1003C-R4C)/(R1003C3)*RC3,0)+R4C -> 7172 | H785: =ROUND((R1003C-R4C)/(R1003C3)*RC3,0)+R4C -> 20299 | I785: =ROUND((R1003C-R4C)/(R1003C3)*RC3,0)+R4C -> 3687 | J785: =ROUND((R1003C-R4C)/(R1003C3)*RC3,0)+R4C -> 1994 | K785: =ROUND((R1003C-R4C)/(R1003C3)*RC3,0)+R4C -> 28440 | O785: =RC[-4]-R[-1]C[-4] -> 37 | P785: =RC[-1]-R[-1]C[-1] -> 1
B786: =R[-3]C+1 -> 261 | C786: =R[-1]C+RC[1] -> 782 | D786: 1 | F786: =ROUND((R1003C-R4C)/(R1003C3)*RC3,0)+R4C -> 9190 | G786: =ROUND((R1003C-R4C)/(R1003C3)*RC3,0)+R4C -> 7181 | H786: =ROUND((R1003C-R4C)/(R1003C3)*RC3,0)+R4C -> 20325 | I786: =ROUND((R1003C-R4C)/(R1003C3)*RC3,0)+R4C -> 3692 | J786: =ROUND((R1003C-R4C)/(R1003C3)*RC3,0)+R4C -> 1997 | K786: =ROUND((R1003C-R4C)/(R1003C3)*RC3,0)+R4C -> 28476 | O786: =RC[-4]-R[-1]C[-4] -> 36 | P786: =RC[-1]-R[-1]C[-1] -> -1
B787: =R[-3]C+1 -> 262 | C787: =R[-1]C+RC[1] -> 783 | D787: 1 | F787: =ROUND((R1003C-R4C)/(R1003C3)*RC3,0)+R4C -> 9202 | G787: =ROUND((R1003C-R4C)/(R1003C3)*RC3,0)+R4C -> 7190 | H787: =ROUND((R1003C-R4C)/(R1003C3)*RC3,0)+R4C -> 20351 | I787: =ROUND((R1003C-R4C)/(R1003C3)*RC3,0)+R4C -> 3697 | J787: =ROUND((R1003C-R4C)/(R1003C3)*RC3,0)+R4C -> 1999 | K787: =ROUND((R1003C-R4C)/(R1003C3)*RC3,0)+R4C -> 28512 | O787: =RC[-4]-R[-1]C[-4] -> 36 | P787: =RC[-1]-R[-1]C[-1] -> 0
B788: =R[-3]C+1 -> 262 | C788: =R[-1]C+RC[1] -> 784 | D788: 1 | F788: =ROUND((R1003C-R4C)/(R1003C3)*RC3,0)+R4C -> 9214 | G788: =ROUND((R1003C-R4C)/(R1003C3)*RC3,0)+R4C -> 7199 | H788: =ROUND((R1003C-R4C)/(R1003C3)*RC3,0)+R4C -> 20377 | I788: =ROUND((R1003C-R4C)/(R1003C3)*RC3,0)+R4C -> 3702 | J788: =ROUND((R1003C-R4C)/(R1003C3)*RC3,0)+R4C -> 2002 | K788: =ROUND((R1003C-R4C)/(R1003C3)*RC3,0)+R4C -> 28548 | O788: =RC[-4]-R[-1]C[-4] -> 36 | P788: =RC[-1]-R[-1]C[-1] -> 0
B789: =R[-3]C+1 -> 262 | C789: =R[-1]C+RC[1] -> 785 | D789: 1 | F789: =ROUND((R1003C-R4C)/(R1003C3)*RC3,0)+R4C -> 9225 | G789: =ROUND((R1003C-R4C)/(R1003C3)*RC3,0)+R4C -> 7208 | H789: =ROUND((R1003C-R4C)/(R1003C3)*RC3,0)+R4C -> 20402 | I789: =ROUND((R1003C-R4C)/(R1003C3)*RC3,0)+R4C -> 3706 | J789: =ROUND((R1003C-R4C)/(R1003C3)*RC3,0)+R4C -> 2004 | K789: =ROUND((R1003C-R4C)/(R1003C3)*RC3,0)+R4C -> 28584 | O789: =RC[-4]-R[-1]C[-4] -> 36 | P789: =RC[-1]-R[-1]C[-1] -> 0
B790: =R[-3]C+1 -> 263 | C790: =R[-1]C+RC[1] -> 786 | D790: 1 | F790: =ROUND((R1003C-R4C)/(R1003C3)*RC3,0)+R4C -> 9237 | G790: =ROUND((R1003C-R4C)/(R1003C3)*RC3,0)+R4C -> 7218 | H790: =ROUND((R1003C-R4C)/(R1003C3)*RC3,0)+R4C -> 20428 | I790: =ROUND((R1003C-R4C)/(R1003C3)*RC3,0)+R4C -> 3711 | J790: =ROUND((R1003C-R4C)/(R1003C3)*RC3,0)+R4C -> 2007 | K790: =ROUND((R1003C-R4C)/(R1003C3)*RC3,0)+R4C -> 28620 | O790: =RC[-4]-R[-1]C[-4] -> 36 | P790: =RC[-1]-R[-1]C[-1] -> 0
B791: =R[-3]C+1 -> 263 | C791: =R[-1]C+RC[1] -> 787 | D791: 1 | F791: =ROUND((R1003C-R4C)/(R1003C3)*RC3,0)+R4C -> 9249 | G791: =ROUND((R1003C-R4C)/(R1003C3)*RC3,0)+R4C -> 7227 | H791: =ROUND((R1003C-R4C)/(R1003C3)*RC3,0)+R4C -> 20454 | I791: =ROUND((R1003C-R4C)/(R1003C3)*RC3,0)+R4C -> 3716 | J791: =ROUND((R1003C-R4C)/(R1003C3)*RC3,0)+R4C -> 2009 | K791: =ROUND((R1003C-R4C)/(R1003C3)*RC3,0)+R4C -> 28657 | O791: =RC[-4]-R[-1]C[-4] -> 37 | P791: =RC[-1]-R[-1]C[-1] -> 1
B792: =R[-3]C+1 -> 263 | C792: =R[-1]C+RC[1] -> 788 | D792: 1 | F792: =ROUND((R1003C-R4C)/(R1003C3)*RC3,0)+R4C -> 9260 | G792: =ROUND((R1003C-R4C)/(R1003C3)*RC3,0)+R4C -> 7236 | H792: =ROUND((R1003C-R4C)/(R1003C3)*RC3,0)+R4C -> 20480 | I792: =ROUND((R1003C-R4C)/(R1003C3)*RC3,0)+R4C -> 3720 | J792: =ROUND((R1003C-R4C)/(R1003C3)*RC3,0)+R4C -> 2012 | K792: =ROUND((R1003C-R4C)/(R1003C3)*RC3,0)+R4C -> 28693 | O792: =RC[-4]-R[-1]C[-4] -> 36 | P792: =RC[-1]-R[-1]C[-1] -> -1
B793: =R[-3]C+1 -> 264 | C793: =R[-1]C+RC[1] -> 789 | D793: 1 | F793: =ROUND((R1003C-R4C)/(R1003C3)*RC3,0)+R4C -> 9272 | G793: =ROUND((R1003C-R4C)/(R1003C3)*RC3,0)+R4C -> 7245 | H793: =ROUND((R1003C-R4C)/(R1003C3)*RC3,0)+R4C -> 20506 | I793: =ROUND((R1003C-R4C)/(R1003C3)*RC3,0)+R4C -> 3725 | J793: =ROUND((R1003C-R4C)/(R1003C3)*RC3,0)+R4C -> 2014 | K793: =ROUND((R1003C-R4C)/(R1003C3)*RC3,0)+R4C -> 28729 | O793: =RC[-4]-R[-1]C[-4] -> 36 | P793: =RC[-1]-R[-1]C[-1] -> 0
B794: =R[-3]C+1 -> 264 | C794: =R[-1]C+RC[1] -> 790 | D794: 1 | F794: =ROUND((R1003C-R4C)/(R1003C3)*RC3,0)+R4C -> 9284 | G794: =ROUND((R1003C-R4C)/(R1003C3)*RC3,0)+R4C -> 7254 | H794: =ROUND((R1003C-R4C)/(R1003C3)*RC3,0)+R4C -> 20532 | I794: =ROUND((R1003C-R4C)/(R1003C3)*RC3,0)+R4C -> 3730 | J794: =ROUND((R1003C-R4C)/(R1003C3)*RC3,0)+R4C -> 2017 | K794: =ROUND((R1003C-R4C)/(R1003C3)*RC3,0)+R4C -> 28765 | O794: =RC[-4]-R[-1]C[-4] -> 36 | P794: =RC[-1]-R[-1]C[-1] -> 0
B795: =R[-3]C+1 -> 264 | C795: =R[-1]C+RC[1] -> 791 | D795: 1 | F795: =ROUND((R1003C-R4C)/(R1003C3)*RC3,0)+R4C -> 9295 | G795: =ROUND((R1003C-R4C)/(R1003C3)*RC3,0)+R4C -> 7263 | H795: =ROUND((R1003C-R4C)/(R1003C3)*RC3,0)+R4C -> 20557 | I795: =ROUND((R1003C-R4C)/(R1003C3)*RC3,0)+R4C -> 3734 | J795: =ROUND((R1003C-R4C)/(R1003C3)*RC3,0)+R4C -> 2019 | K795: =ROUND((R1003C-R4C)/(R1003C3)*RC3,0)+R4C -> 28801 | O795: =RC[-4]-R[-1]C[-4] -> 36 | P795: =RC[-1]-R[-1]C[-1] -> 0
B796: =R[-3]C+1 -> 265 | C796: =R[-1]C+RC[1] -> 792 | D796: 1 | F796: =ROUND((R1003C-R4C)/(R1003C3)*RC3,0)+R4C -> 9307 | G796: =ROUND((R1003C-R4C)/(R1003C3)*RC3,0)+R4C -> 7272 | H796: =ROUND((R1003C-R4C)/(R1003C3)*RC3,0)+R4C -> 20583 | I796: =ROUND((R1003C-R4C)/(R1003C3)*RC3,0)+R4C -> 3739 | J796: =ROUND((R1003C-R4C)/(R1003C3)*RC3,0)+R4C -> 2022 | K796: =ROUND((R1003C-R4C)/(R1003C3)*RC3,0)+R4C -> 28837 | O796: =RC[-4]-R[-1]C[-4] -> 36 | P796: =RC[-1]-R[-1]C[-1] -> 0
B797: =R[-3]C+1 -> 265 | C797: =R[-1]C+RC[1] -> 793 | D797: 1 | F797: =ROUND((R1003C-R4C)/(R1003C3)*RC3,0)+R4C -> 9319 | G797: =ROUND((R1003C-R4C)/(R1003C3)*RC3,0)+R4C -> 7281 | H797: =ROUND((R1003C-R4C)/(R1003C3)*RC3,0)+R4C -> 20609 | I797: =ROUND((R1003C-R4C)/(R1003C3)*RC3,0)+R4C -> 3744 | J797: =ROUND((R1003C-R4C)/(R1003C3)*RC3,0)+R4C -> 2024 | K797: =ROUND((R1003C-R4C)/(R1003C3)*RC3,0)+R4C -> 28874 | O797: =RC[-4]-R[-1]C[-4] -> 37 | P797: =RC[-1]-R[-1]C[-1] -> 1
B798: =R[-3]C+1 -> 265 | C798: =R[-1]C+RC[1] -> 794 | D798: 1 | F798: =ROUND((R1003C-R4C)/(R1003C3)*RC3,0)+R4C -> 9330 | G798: =ROUND((R1003C-R4C)/(R1003C3)*RC3,0)+R4C -> 7291 | H798: =ROUND((R1003C-R4C)/(R1003C3)*RC3,0)+R4C -> 20635 | I798: =ROUND((R1003C-R4C)/(R1003C3)*RC3,0)+R4C -> 3748 | J798: =ROUND((R1003C-R4C)/(R1003C3)*RC3,0)+R4C -> 2027 | K798: =ROUND((R1003C-R4C)/(R1003C3)*RC3,0)+R4C -> 28910 | O798: =RC[-4]-R[-1]C[-4] -> 36 | P798: =RC[-1]-R[-1]C[-1] -> -1
B799: =R[-3]C+1 -> 266 | C799: =R[-1]C+RC[1] -> 795 | D799: 1 | F799: =ROUND((R1003C-R4C)/(R1003C3)*RC3,0)+R4C -> 9342 | G799: =ROUND((R1003C-R4C)/(R1003C3)*RC3,0)+R4C -> 7300 | H799: =ROUND((R1003C-R4C)/(R1003C3)*RC3,0)+R4C -> 20661 | I799: =ROUND((R1003C-R4C)/(R1003C3)*RC3,0)+R4C -> 3753 | J799: =ROUND((R1003C-R4C)/(R1003C3)*RC3,0)+R4C -> 2030 | K799: =ROUND((R1003C-R4C)/(R1003C3)*RC3,0)+R4C -> 28946 | O799: =RC[-4]-R[-1]C[-4] -> 36 | P799: =RC[-1]-R[-1]C[-1] -> 0
B800: =R[-3]C+1 -> 266 | C800: =R[-1]C+RC[1] -> 796 | D800: 1 | F800: =ROUND((R1003C-R4C)/(R1003C3)*RC3,0)+R4C -> 9354 | G800: =ROUND((R1003C-R4C)/(R1003C3)*RC3,0)+R4C -> 7309 | H800: =ROUND((R1003C-R4C)/(R1003C3)*RC3,0)+R4C -> 20687 | I800: =ROUND((R1003C-R4C)/(R1003C3)*RC3,0)+R4C -> 3758 | J800: =ROUND((R1003C-R4C)/(R1003C3)*RC3,0)+R4C -> 2032 | K800: =ROUND((R1003C-R4C)/(R1003C3)*RC3,0)+R4C -> 28982 | O800: =RC[-4]-R[-1]C[-4] -> 36 | P800: =RC[-1]-R[-1]C[-1] -> 0
B801: =R[-3]C+1 -> 266 | C801: =R[-1]C+RC[1] -> 797 | D801: 1 | F801: =ROUND((R1003C-R4C)/(R1003C3)*RC3,0)+R4C -> 9365 | G801: =ROUND((R1003C-R4C)/(R1003C3)*RC3,0)+R4C -> 7318 | H801: =ROUND((R1003C-R4C)/(R1003C3)*RC3,0)+R4C -> 20712 | I801: =ROUND((R1003C-R4C)/(R1003C3)*RC3,0)+R4C -> 3762 | J801: =ROUND((R1003C-R4C)/(R1003C3)*RC3,0)+R4C -> 2035 | K801: =ROUND((R1003C-R4C)/(R1003C3)*RC3,0)+R4C -> 29018 | O801: =RC[-4]-R[-1]C[-4] -> 36 | P801: =RC[-1]-R[-1]C[-1] -> 0
B802: =R[-3]C+1 -> 267 | C802: =R[-1]C+RC[1] -> 798 | D802: 1 | F802: =ROUND((R1003C-R4C)/(R1003C3)*RC3,0)+R4C -> 9377 | G802: =ROUND((R1003C-R4C)/(R1003C3)*RC3,0)+R4C -> 7327 | H802: =ROUND((R1003C-R4C)/(R1003C3)*RC3,0)+R4C -> 20738 | I802: =ROUND((R1003C-R4C)/(R1003C3)*RC3,0)+R4C -> 3767 | J802: =ROUND((R1003C-R4C)/(R1003C3)*RC3,0)+R4C -> 2037 | K802: =ROUND((R1003C-R4C)/(R1003C3)*RC3,0)+R4C -> 29055 | O802: =RC[-4]-R[-1]C[-4] -> 37 | P802: =RC[-1]-R[-1]C[-1] -> 1
B803: =R[-3]C+1 -> 267 | C803: =R[-1]C+RC[1] -> 799 | D803: 1 | F803: =ROUND((R1003C-R4C)/(R1003C3)*RC3,0)+R4C -> 9389 | G803: =ROUND((R1003C-R4C)/(R1003C3)*RC3,0)+R4C -> 7336 | H803: =ROUND((R1003C-R4C)/(R1003C3)*RC3,0)+R4C -> 20764 | I803: =ROUND((R1003C-R4C)/(R1003C3)*RC3,0)+R4C -> 3772 | J803: =ROUND((R1003C-R4C)/(R1003C3)*RC3,0)+R4C -> 2040 | K803: =ROUND((R1003C-R4C)/(R1003C3)*RC3,0)+R4C -> 29091 | O803: =RC[-4]-R[-1]C[-4] -> 36 | P803: =RC[-1]-R[-1]C[-1] -> -1
B804: =R[-3]C+1 -> 267 | C804: =R[-1]C+RC[1] -> 800 | D804: 1 | F804: =ROUND((R1003C-R4C)/(R1003C3)*RC3,0)+R4C -> 9400 | G804: =ROUND((R1003C-R4C)/(R1003C3)*RC3,0)+R4C -> 7345 | H804: =ROUND((R1003C-R4C)/(R1003C3)*RC3,0)+R4C -> 20790 | I804: =ROUND((R1003C-R4C)/(R1003C3)*RC3,0)+R4C -> 3777 | J804: =ROUND((R1003C-R4C)/(R1003C3)*RC3,0)+R4C -> 2042 | K804: =ROUND((R1003C-R4C)/(R1003C3)*RC3,0)+R4C -> 29127 | O804: =RC[-4]-R[-1]C[-4] -> 36 | P804: =RC[-1]-R[-1]C[-1] -> 0
B805: =R[-3]C+1 -> 268 | C805: =R[-1]C+RC[1] -> 801 | D805: 1 | F805: =ROUND((R1003C-R4C)/(R1003C3)*RC3,0)+R4C -> 9412 | G805: =ROUND((R1003C-R4C)/(R1003C3)*RC3,0)+R4C -> 7354 | H805: =ROUND((R1003C-R4C)/(R1003C3)*RC3,0)+R4C -> 20816 | I805: =ROUND((R1003C-R4C)/(R1003C3)*RC3,0)+R4C -> 3781 | J805: =ROUND((R1003C-R4C)/(R1003C3)*RC3,0)+R4C -> 2045 | K805: =ROUND((R1003C-R4C)/(R1003C3)*RC3,0)+R4C -> 29163 | O805: =RC[-4]-R[-1]C[-4] -> 36 | P805: =RC[-1]-R[-1]C[-1] -> 0
B806: =R[-3]C+1 -> 268 | C806: =R[-1]C+RC[1] -> 802 | D806: 1 | F806: =ROUND((R1003C-R4C)/(R1003C3)*RC3,0)+R4C -> 9424 | G806: =ROUND((R1003C-R4C)/(R1003C3)*RC3,0)+R4C -> 7364 | H806: =ROUND((R1003C-R4C)/(R1003C3)*RC3,0)+R4C -> 20842 | I806: =ROUND((R1003C-R4C)/(R1003C3)*RC3,0)+R4C -> 3786 | J806: =ROUND((R1003C-R4C)/(R1003C3)*RC3,0)+R4C -> 2047 | K806: =ROUND((R1003C-R4C)/(R1003C3)*RC3,0)+R4C -> 29199 | O806: =RC[-4]-R[-1]C[-4] -> 36 | P806: =RC[-1]-R[-1]C[-1] -> 0
B807: =R[-3]C+1 -> 268 | C807: =R[-1]C+RC[1] -> 803 | D807: 1 | F807: =ROUND((R1003C-R4C)/(R1003C3)*RC3,0)+R4C -> 9435 | G807: =ROUND((R1003C-R4C)/(R1003C3)*RC3,0)+R4C -> 7373 | H807: =ROUND((R1003C-R4C)/(R1003C3)*RC3,0)+R4C -> 20867 | I807: =ROUND((R1003C-R4C)/(R1003C3)*RC3,0)+R4C -> 3791 | J807: =ROUND((R1003C-R4C)/(R1003C3)*RC3,0)+R4C -> 2050 | K807: =ROUND((R1003C-R4C)/(R1003C3)*RC3,0)+R4C -> 29235 | O807: =RC[-4]-R[-1]C[-4] -> 36 | P807: =RC[-1]-R[-1]C[-1] -> 0
B808: =R[-3]C+1 -> 269 | C808: =R[-1]C+RC[1] -> 804 | D808: 1 | F808: =ROUND((R1003C-R4C)/(R1003C3)*RC3,0)+R4C -> 9447 | G808: =ROUND((R1003C-R4C)/(R1003C3)*RC3,0)+R4C -> 7382 | H808: =ROUND((R1003C-R4C)/(R1003C3)*RC3,0)+R4C -> 20893 | I808: =ROUND((R1003C-R4C)/(R1003C3)*RC3,0)+R4C -> 3795 | J808: =ROUND((R1003C-R4C)/(R1003C3)*RC3,0)+R4C -> 2052 | K808: =ROUND((R1003C-R4C)/(R1003C3)*RC3,0)+R4C -> 29272 | O808: =RC[-4]-R[-1]C[-4] -> 37 | P808: =RC[-1]-R[-1]C[-1] -> 1
B809: =R[-3]C+1 -> 269 | C809: =R[-1]C+RC[1] -> 805 | D809: 1 | F809: =ROUND((R1003C-R4C)/(R1003C3)*RC3,0)+R4C -> 9459 | G809: =ROUND((R1003C-R4C)/(R1003C3)*RC3,0)+R4C -> 7391 | H809: =ROUND((R1003C-R4C)/(R1003C3)*RC3,0)+R4C -> 20919 | I809: =ROUND((R1003C-R4C)/(R1003C3)*RC3,0)+R4C -> 3800 | J809: =ROUND((R1003C-R4C)/(R1003C3)*RC3,0)+R4C -> 2055 | K809: =ROUND((R1003C-R4C)/(R1003C3)*RC3,0)+R4C -> 29308 | O809: =RC[-4]-R[-1]C[-4] -> 36 | P809: =RC[-1]-R[-1]C[-1] -> -1
B810: =R[-3]C+1 -> 269 | C810: =R[-1]C+RC[1] -> 806 | D810: 1 | F810: =ROUND((R1003C-R4C)/(R1003C3)*RC3,0)+R4C -> 9470 | G810: =ROUND((R1003C-R4C)/(R1003C3)*RC3,0)+R4C -> 7400 | H810: =ROUND((R1003C-R4C)/(R1003C3)*RC3,0)+R4C -> 20945 | I810: =ROUND((R1003C-R4C)/(R1003C3)*RC3,0)+R4C -> 3805 | J810: =ROUND((R1003C-R4C)/(R1003C3)*RC3,0)+R4C -> 2057 | K810: =ROUND((R1003C-R4C)/(R1003C3)*RC3,0)+R4C -> 29344 | O810: =RC[-4]-R[-1]C[-4] -> 36 | P810: =RC[-1]-R[-1]C[-1] -> 0
B811: =R[-3]C+1 -> 270 | C811: =R[-1]C+RC[1] -> 807 | D811: 1 | F811: =ROUND((R1003C-R4C)/(R1003C3)*RC3,0)+R4C -> 9482 | G811: =ROUND((R1003C-R4C)/(R1003C3)*RC3,0)+R4C -> 7409 | H811: =ROUND((R1003C-R4C)/(R1003C3)*RC3,0)+R4C -> 20971 | I811: =ROUND((R1003C-R4C)/(R1003C3)*RC3,0)+R4C -> 3809 | J811: =ROUND((R1003C-R4C)/(R1003C3)*RC3,0)+R4C -> 2060 | K811: =ROUND((R1003C-R4C)/(R1003C3)*RC3,0)+R4C -> 29380 | O811: =RC[-4]-R[-1]C[-4] -> 36 | P811: =RC[-1]-R[-1]C[-1] -> 0
B812: =R[-3]C+1 -> 270 | C812: =R[-1]C+RC[1] -> 808 | D812: 1 | F812: =ROUND((R1003C-R4C)/(R1003C3)*RC3,0)+R4C -> 9494 | G812: =ROUND((R1003C-R4C)/(R1003C3)*RC3,0)+R4C -> 7418 | H812: =ROUND((R1003C-R4C)/(R1003C3)*RC3,0)+R4C -> 20996 | I812: =ROUND((R1003C-R4C)/(R1003C3)*RC3,0)+R4C -> 3814 | J812: =ROUND((R1003C-R4C)/(R1003C3)*RC3,0)+R4C -> 2063 | K812: =ROUND((R1003C-R4C)/(R1003C3)*RC3,0)+R4C -> 29416 | O812: =RC[-4]-R[-1]C[-4] -> 36 | P812: =RC[-1]-R[-1]C[-1] -> 0
B813: =R[-3]C+1 -> 270 | C813: =R[-1]C+RC[1] -> 809 | D813: 1 | F813: =ROUND((R1003C-R4C)/(R1003C3)*RC3,0)+R4C -> 9505 | G813: =ROUND((R1003C-R4C)/(R1003C3)*RC3,0)+R4C -> 7427 | H813: =ROUND((R1003C-R4C)/(R1003C3)*RC3,0)+R4C -> 21022 | I813: =ROUND((R1003C-R4C)/(R1003C3)*RC3,0)+R4C -> 3819 | J813: =ROUND((R1003C-R4C)/(R1003C3)*RC3,0)+R4C -> 2065 | K813: =ROUND((R1003C-R4C)/(R1003C3)*RC3,0)+R4C -> 29453 | O813: =RC[-4]-R[-1]C[-4] -> 37 | P813: =RC[-1]-R[-1]C[-1] -> 1
B814: =R[-3]C+1 -> 271 | C814: =R[-1]C+RC[1] -> 810 | D814: 1 | F814: =ROUND((R1003C-R4C)/(R1003C3)*RC3,0)+R4C -> 9517 | G814: =ROUND((R1003C-R4C)/(R1003C3)*RC3,0)+R4C -> 7437 | H814: =ROUND((R1003C-R4C)/(R1003C3)*RC3,0)+R4C -> 21048 | I814: =ROUND((R1003C-R4C)/(R1003C3)*RC3,0)+R4C -> 3823 | J814: =ROUND((R1003C-R4C)/(R1003C3)*RC3,0)+R4C -> 2068 | K814: =ROUND((R1003C-R4C)/(R1003C3)*RC3,0)+R4C -> 29489 | O814: =RC[-4]-R[-1]C[-4] -> 36 | P814: =RC[-1]-R[-1]C[-1] -> -1
B815: =R[-3]C+1 -> 271 | C815: =R[-1]C+RC[1] -> 811 | D815: 1 | F815: =ROUND((R1003C-R4C)/(R1003C3)*RC3,0)+R4C -> 9529 | G815: =ROUND((R1003C-R4C)/(R1003C3)*RC3,0)+R4C -> 7446 | H815: =ROUND((R1003C-R4C)/(R1003C3)*RC3,0)+R4C -> 21074 | I815: =ROUND((R1003C-R4C)/(R1003C3)*RC3,0)+R4C -> 3828 | J815: =ROUND((R1003C-R4C)/(R1003C3)*RC3,0)+R4C -> 2070 | K815: =ROUND((R1003C-R4C)/(R1003C3)*RC3,0)+R4C -> 29525 | O815: =RC[-4]-R[-1]C[-4] -> 36 | P815: =RC[-1]-R[-1]C[-1] -> 0
B816: =R[-3]C+1 -> 271 | C816: =R[-1]C+RC[1] -> 812 | D816: 1 | F816: =ROUND((R1003C-R4C)/(R1003C3)*RC3,0)+R4C -> 9540 | G816: =ROUND((R1003C-R4C)/(R1003C3)*RC3,0)+R4C -> 7455 | H816: =ROUND((R1003C-R4C)/(R1003C3)*RC3,0)+R4C -> 21100 | I816: =ROUND((R1003C-R4C)/(R1003C3)*RC3,0)+R4C -> 3833 | J816: =ROUND((R1003C-R4C)/(R1003C3)*RC3,0)+R4C -> 2073 | K816: =ROUND((R1003C-R4C)/(R1003C3)*RC3,0)+R4C -> 29561 | O816: =RC[-4]-R[-1]C[-4] -> 36 | P816: =RC[-1]-R[-1]C[-1] -> 0
B817: =R[-3]C+1 -> 272 | C817: =R[-1]C+RC[1] -> 813 | D817: 1 | F817: =ROUND((R1003C-R4C)/(R1003C3)*RC3,0)+R4C -> 9552 | G817: =ROUND((R1003C-R4C)/(R1003C3)*RC3,0)+R4C -> 7464 | H817: =ROUND((R1003C-R4C)/(R1003C3)*RC3,0)+R4C -> 21126 | I817: =ROUND((R1003C-R4C)/(R1003C3)*RC3,0)+R4C -> 3838 | J817: =ROUND((R1003C-R4C)/(R1003C3)*RC3,0)+R4C -> 2075 | K817: =ROUND((R1003C-R4C)/(R1003C3)*RC3,0)+R4C -> 29597 | O817: =RC[-4]-R[-1]C[-4] -> 36 | P817: =RC[-1]-R[-1]C[-1] -> 0
B818: =R[-3]C+1 -> 272 | C818: =R[-1]C+RC[1] -> 814 | D818: 1 | F818: =ROUND((R1003C-R4C)/(R1003C3)*RC3,0)+R4C -> 9564 | G818: =ROUND((R1003C-R4C)/(R1003C3)*RC3,0)+R4C -> 7473 | H818: =ROUND((R1003C-R4C)/(R1003C3)*RC3,0)+R4C -> 21151 | I818: =ROUND((R1003C-R4C)/(R1003C3)*RC3,0)+R4C -> 3842 | J818: =ROUND((R1003C-R4C)/(R1003C3)*RC3,0)+R4C -> 2078 | K818: =ROUND((R1003C-R4C)/(R1003C3)*RC3,0)+R4C -> 29633 | O818: =RC[-4]-R[-1]C[-4] -> 36 | P818: =RC[-1]-R[-1]C[-1] -> 0
B819: =R[-3]C+1 -> 272 | C819: =R[-1]C+RC[1] -> 815 | D819: 1 | F819: =ROUND((R1003C-R4C)/(R1003C3)*RC3,0)+R4C -> 9575 | G819: =ROUND((R1003C-R4C)/(R1003C3)*RC3,0)+R4C -> 7482 | H819: =ROUND((R1003C-R4C)/(R1003C3)*RC3,0)+R4C -> 21177 | I819: =ROUND((R1003C-R4C)/(R1003C3)*RC3,0)+R4C -> 3847 | J819: =ROUND((R1003C-R4C)/(R1003C3)*RC3,0)+R4C -> 2080 | K819: =ROUND((R1003C-R4C)/(R1003C3)*RC3,0)+R4C -> 29670 | O819: =RC[-4]-R[-1]C[-4] -> 37 | P819: =RC[-1]-R[-1]C[-1] -> 1
B820: =R[-3]C+1 -> 273 | C820: =R[-1]C+RC[1] -> 816 | D820: 1 | F820: =ROUND((R1003C-R4C)/(R1003C3)*RC3,0)+R4C -> 9587 | G820: =ROUND((R1003C-R4C)/(R1003C3)*RC3,0)+R4C -> 7491 | H820: =ROUND((R1003C-R4C)/(R1003C3)*RC3,0)+R4C -> 21203 | I820: =ROUND((R1003C-R4C)/(R1003C3)*RC3,0)+R4C -> 3852 | J820: =ROUND((R1003C-R4C)/(R1003C3)*RC3,0)+R4C -> 2083 | K820: =ROUND((R1003C-R4C)/(R1003C3)*RC3,0)+R4C -> 29706 | O820: =RC[-4]-R[-1]C[-4] -> 36 | P820: =RC[-1]-R[-1]C[-1] -> -1
B821: =R[-3]C+1 -> 273 | C821: =R[-1]C+RC[1] -> 817 | D821: 1 | F821: =ROUND((R1003C-R4C)/(R1003C3)*RC3,0)+R4C -> 9599 | G821: =ROUND((R1003C-R4C)/(R1003C3)*RC3,0)+R4C -> 7500 | H821: =ROUND((R1003C-R4C)/(R1003C3)*RC3,0)+R4C -> 21229 | I821: =ROUND((R1003C-R4C)/(R1003C3)*RC3,0)+R4C -> 3856 | J821: =ROUND((R1003C-R4C)/(R1003C3)*RC3,0)+R4C -> 2085 | K821: =ROUND((R1003C-R4C)/(R1003C3)*RC3,0)+R4C -> 29742 | O821: =RC[-4]-R[-1]C[-4] -> 36 | P821: =RC[-1]-R[-1]C[-1] -> 0
B822: =R[-3]C+1 -> 273 | C822: =R[-1]C+RC[1] -> 818 | D822: 1 | F822: =ROUND((R1003C-R4C)/(R1003C3)*RC3,0)+R4C -> 9611 | G822: =ROUND((R1003C-R4C)/(R1003C3)*RC3,0)+R4C -> 7510 | H822: =ROUND((R1003C-R4C)/(R1003C3)*RC3,0)+R4C -> 21255 | I822: =ROUND((R1003C-R4C)/(R1003C3)*RC3,0)+R4C -> 3861 | J822: =ROUND((R1003C-R4C)/(R1003C3)*RC3,0)+R4C -> 2088 | K822: =ROUND((R1003C-R4C)/(R1003C3)*RC3,0)+R4C -> 29778 | O822: =RC[-4]-R[-1]C[-4] -> 36 | P822: =RC[-1]-R[-1]C[-1] -> 0
B823: =R[-3]C+1 -> 274 | C823: =R[-1]C+RC[1] -> 819 | D823: 1 | F823: =ROUND((R1003C-R4C)/(R1003C3)*RC3,0)+R4C -> 9622 | G823: =ROUND((R1003C-R4C)/(R1003C3)*RC3,0)+R4C -> 7519 | H823: =ROUND((R1003C-R4C)/(R1003C3)*RC3,0)+R4C -> 21281 | I823: =ROUND((R1003C-R4C)/(R1003C3)*RC3,0)+R4C -> 3866 | J823: =ROUND((R1003C-R4C)/(R1003C3)*RC3,0)+R4C -> 2090 | K823: =ROUND((R1003C-R4C)/(R1003C3)*RC3,0)+R4C -> 29814 | O823: =RC[-4]-R[-1]C[-4] -> 36 | P823: =RC[-1]-R[-1]C[-1] -> 0
B824: =R[-3]C+1 -> 274 | C824: =R[-1]C+RC[1] -> 820 | D824: 1 | F824: =ROUND((R1003C-R4C)/(R1003C3)*RC3,0)+R4C -> 9634 | G824: =ROUND((R1003C-R4C)/(R1003C3)*RC3,0)+R4C -> 7528 | H824: =ROUND((R1003C-R4C)/(R1003C3)*RC3,0)+R4C -> 21306 | I824: =ROUND((R1003C-R4C)/(R1003C3)*RC3,0)+R4C -> 3870 | J824: =ROUND((R1003C-R4C)/(R1003C3)*RC3,0)+R4C -> 2093 | K824: =ROUND((R1003C-R4C)/(R1003C3)*RC3,0)+R4C -> 29851 | O824: =RC[-4]-R[-1]C[-4] -> 37 | P824: =RC[-1]-R[-1]C[-1] -> 1
B825: =R[-3]C+1 -> 274 | C825: =R[-1]C+RC[1] -> 821 | D825: 1 | F825: =ROUND((R1003C-R4C)/(R1003C3)*RC3,0)+R4C -> 9646 | G825: =ROUND((R1003C-R4C)/(R1003C3)*RC3,0)+R4C -> 7537 | H825: =ROUND((R1003C-R4C)/(R1003C3)*RC3,0)+R4C -> 21332 | I825: =ROUND((R1003C-R4C)/(R1003C3)*RC3,0)+R4C -> 3875 | J825: =ROUND((R1003C-R4C)/(R1003C3)*RC3,0)+R4C -> 2095 | K825: =ROUND((R1003C-R4C)/(R1003C3)*RC3,0)+R4C -> 29887 | O825: =RC[-4]-R[-1]C[-4] -> 36 | P825: =RC[-1]-R[-1]C[-1] -> -1
B826: =R[-3]C+1 -> 275 | C826: =R[-1]C+RC[1] -> 822 | D826: 1 | F826: =ROUND((R1003C-R4C)/(R1003C3)*RC3,0)+R4C -> 9657 | G826: =ROUND((R1003C-R4C)/(R1003C3)*RC3,0)+R4C -> 7546 | H826: =ROUND((R1003C-R4C)/(R1003C3)*RC3,0)+R4C -> 21358 | I826: =ROUND((R1003C-R4C)/(R1003C3)*RC3,0)+R4C -> 3880 | J826: =ROUND((R1003C-R4C)/(R1003C3)*RC3,0)+R4C -> 2098 | K826: =ROUND((R1003C-R4C)/(R1003C3)*RC3,0)+R4C -> 29923 | O826: =RC[-4]-R[-1]C[-4] -> 36 | P826: =RC[-1]-R[-1]C[-1] -> 0
B827: =R[-3]C+1 -> 275 | C827: =R[-1]C+RC[1] -> 823 | D827: 1 | F827: =ROUND((R1003C-R4C)/(R1003C3)*RC3,0)+R4C -> 9669 | G827: =ROUND((R1003C-R4C)/(R1003C3)*RC3,0)+R4C -> 7555 | H827: =ROUND((R1003C-R4C)/(R1003C3)*RC3,0)+R4C -> 21384 | I827: =ROUND((R1003C-R4C)/(R1003C3)*RC3,0)+R4C -> 3884 | J827: =ROUND((R1003C-R4C)/(R1003C3)*RC3,0)+R4C -> 2101 | K827: =ROUND((R1003C-R4C)/(R1003C3)*RC3,0)+R4C -> 29959 | O827: =RC[-4]-R[-1]C[-4] -> 36 | P827: =RC[-1]-R[-1]C[-1] -> 0
B828: =R[-3]C+1 -> 275 | C828: =R[-1]C+RC[1] -> 824 | D828: 1 | F828: =ROUND((R1003C-R4C)/(R1003C3)*RC3,0)+R4C -> 9681 | G828: =ROUND((R1003C-R4C)/(R1003C3)*RC3,0)+R4C -> 7564 | H828: =ROUND((R1003C-R4C)/(R1003C3)*RC3,0)+R4C -> 21410 | I828: =ROUND((R1003C-R4C)/(R1003C3)*RC3,0)+R4C -> 3889 | J828: =ROUND((R1003C-R4C)/(R1003C3)*RC3,0)+R4C -> 2103 | K828: =ROUND((R1003C-R4C)/(R1003C3)*RC3,0)+R4C -> 29995 | O828: =RC[-4]-R[-1]C[-4] -> 36 | P828: =RC[-1]-R[-1]C[-1] -> 0
B829: =R[-3]C+1 -> 276 | C829: =R[-1]C+RC[1] -> 825 | D829: 1 | F829: =ROUND((R1003C-R4C)/(R1003C3)*RC3,0)+R4C -> 9692 | G829: =ROUND((R1003C-R4C)/(R1003C3)*RC3,0)+R4C -> 7573 | H829: =ROUND((R1003C-R4C)/(R1003C3)*RC3,0)+R4C -> 21435 | I829: =ROUND((R1003C-R4C)/(R1003C3)*RC3,0)+R4C -> 3894 | J829: =ROUND((R1003C-R4C)/(R1003C3)*RC3,0)+R4C -> 2106 | K829: =ROUND((R1003C-R4C)/(R1003C3)*RC3,0)+R4C -> 30031 | O829: =RC[-4]-R[-1]C[-4] -> 36 | P829: =RC[-1]-R[-1]C[-1] -> 0
B830: =R[-3]C+1 -> 276 | C830: =R[-1]C+RC[1] -> 826 | D830: 1 | F830: =ROUND((R1003C-R4C)/(R1003C3)*RC3,0)+R4C -> 9704 | G830: =ROUND((R1003C-R4C)/(R1003C3)*RC3,0)+R4C -> 7583 | H830: =ROUND((R1003C-R4C)/(R1003C3)*RC3,0)+R4C -> 21461 | I830: =ROUND((R1003C-R4C)/(R1003C3)*RC3,0)+R4C -> 3899 | J830: =ROUND((R1003C-R4C)/(R1003C3)*RC3,0)+R4C -> 2108 | K830: =ROUND((R1003C-R4C)/(R1003C3)*RC3,0)+R4C -> 30068 | O830: =RC[-4]-R[-1]C[-4] -> 37 | P830: =RC[-1]-R[-1]C[-1] -> 1
B831: =R[-3]C+1 -> 276 | C831: =R[-1]C+RC[1] -> 827 | D831: 1 | F831: =ROUND((R1003C-R4C)/(R1003C3)*RC3,0)+R4C -> 9716 | G831: =ROUND((R1003C-R4C)/(R1003C3)*RC3,0)+R4C -> 7592 | H831: =ROUND((R1003C-R4C)/(R1003C3)*RC3,0)+R4C -> 21487 | I831: =ROUND((R1003C-R4C)/(R1003C3)*RC3,0)+R4C -> 3903 | J831: =ROUND((R1003C-R4C)/(R1003C3)*RC3,0)+R4C -> 2111 | K831: =ROUND((R1003C-R4C)/(R1003C3)*RC3,0)+R4C -> 30104 | O831: =RC[-4]-R[-1]C[-4] -> 36 | P831: =RC[-1]-R[-1]C[-1] -> -1
B832: =R[-3]C+1 -> 277 | C832: =R[-1]C+RC[1] -> 828 | D832: 1 | F832: =ROUND((R1003C-R4C)/(R1003C3)*RC3,0)+R4C -> 9727 | G832: =ROUND((R1003C-R4C)/(R1003C3)*RC3,0)+R4C -> 7601 | H832: =ROUND((R1003C-R4C)/(R1003C3)*RC3,0)+R4C -> 21513 | I832: =ROUND((R1003C-R4C)/(R1003C3)*RC3,0)+R4C -> 3908 | J832: =ROUND((R1003C-R4C)/(R1003C3)*RC3,0)+R4C -> 2113 | K832: =ROUND((R1003C-R4C)/(R1003C3)*RC3,0)+R4C -> 30140 | O832: =RC[-4]-R[-1]C[-4] -> 36 | P832: =RC[-1]-R[-1]C[-1] -> 0
B833: =R[-3]C+1 -> 277 | C833: =R[-1]C+RC[1] -> 829 | D833: 1 | F833: =ROUND((R1003C-R4C)/(R1003C3)*RC3,0)+R4C -> 9739 | G833: =ROUND((R1003C-R4C)/(R1003C3)*RC3,0)+R4C -> 7610 | H833: =ROUND((R1003C-R4C)/(R1003C3)*RC3,0)+R4C -> 21539 | I833: =ROUND((R1003C-R4C)/(R1003C3)*RC3,0)+R4C -> 3913 | J833: =ROUND((R1003C-R4C)/(R1003C3)*RC3,0)+R4C -> 2116 | K833: =ROUND((R1003C-R4C)/(R1003C3)*RC3,0)+R4C -> 30176 | O833: =RC[-4]-R[-1]C[-4] -> 36 | P833: =RC[-1]-R[-1]C[-1] -> 0
B834: =R[-3]C+1 -> 277 | C834: =R[-1]C+RC[1] -> 830 | D834: 1 | F834: =ROUND((R1003C-R4C)/(R1003C3)*RC3,0)+R4C -> 9751 | G834: =ROUND((R1003C-R4C)/(R1003C3)*RC3,0)+R4C -> 7619 | H834: =ROUND((R1003C-R4C)/(R1003C3)*RC3,0)+R4C -> 21565 | I834: =ROUND((R1003C-R4C)/(R1003C3)*RC3,0)+R4C -> 3917 | J834: =ROUND((R1003C-R4C)/(R1003C3)*RC3,0)+R4C -> 2118 | K834: =ROUND((R1003C-R4C)/(R1003C3)*RC3,0)+R4C -> 30212 | O834: =RC[-4]-R[-1]C[-4] -> 36 | P834: =RC[-1]-R[-1]C[-1] -> 0
B835: =R[-3]C+1 -> 278 | C835: =R[-1]C+RC[1] -> 831 | D835: 1 | F835: =ROUND((R1003C-R4C)/(R1003C3)*RC3,0)+R4C -> 9762 | G835: =ROUND((R1003C-R4C)/(R1003C3)*RC3,0)+R4C -> 7628 | H835: =ROUND((R1003C-R4C)/(R1003C3)*RC3,0)+R4C -> 21590 | I835: =ROUND((R1003C-R4C)/(R1003C3)*RC3,0)+R4C -> 3922 | J835: =ROUND((R1003C-R4C)/(R1003C3)*RC3,0)+R4C -> 2121 | K835: =ROUND((R1003C-R4C)/(R1003C3)*RC3,0)+R4C -> 30249 | O835: =RC[-4]-R[-1]C[-4] -> 37 | P835: =RC[-1]-R[-1]C[-1] -> 1
B836: =R[-3]C+1 -> 278 | C836: =R[-1]C+RC[1] -> 832 | D836: 1 | F836: =ROUND((R1003C-R4C)/(R1003C3)*RC3,0)+R4C -> 9774 | G836: =ROUND((R1003C-R4C)/(R1003C3)*RC3,0)+R4C -> 7637 | H836: =ROUND((R1003C-R4C)/(R1003C3)*RC3,0)+R4C -> 21616 | I836: =ROUND((R1003C-R4C)/(R1003C3)*RC3,0)+R4C -> 3927 | J836: =ROUND((R1003C-R4C)/(R1003C3)*RC3,0)+R4C -> 2123 | K836: =ROUND((R1003C-R4C)/(R1003C3)*RC3,0)+R4C -> 30285 | O836: =RC[-4]-R[-1]C[-4] -> 36 | P836: =RC[-1]-R[-1]C[-1] -> -1
B837: =R[-3]C+1 -> 278 | C837: =R[-1]C+RC[1] -> 833 | D837: 1 | F837: =ROUND((R1003C-R4C)/(R1003C3)*RC3,0)+R4C -> 9786 | G837: =ROUND((R1003C-R4C)/(R1003C3)*RC3,0)+R4C -> 7646 | H837: =ROUND((R1003C-R4C)/(R1003C3)*RC3,0)+R4C -> 21642 | I837: =ROUND((R1003C-R4C)/(R1003C3)*RC3,0)+R4C -> 3931 | J837: =ROUND((R1003C-R4C)/(R1003C3)*RC3,0)+R4C -> 2126 | K837: =ROUND((R1003C-R4C)/(R1003C3)*RC3,0)+R4C -> 30321 | O837: =RC[-4]-R[-1]C[-4] -> 36 | P837: =RC[-1]-R[-1]C[-1] -> 0
B838: =R[-3]C+1 -> 279 | C838: =R[-1]C+RC[1] -> 834 | D838: 1 | F838: =ROUND((R1003C-R4C)/(R1003C3)*RC3,0)+R4C -> 9797 | G838: =ROUND((R1003C-R4C)/(R1003C3)*RC3,0)+R4C -> 7656 | H838: =ROUND((R1003C-R4C)/(R1003C3)*RC3,0)+R4C -> 21668 | I838: =ROUND((R1003C-R4C)/(R1003C3)*RC3,0)+R4C -> 3936 | J838: =ROUND((R1003C-R4C)/(R1003C3)*RC3,0)+R4C -> 2128 | K838: =ROUND((R1003C-R4C)/(R1003C3)*RC3,0)+R4C -> 30357 | O838: =RC[-4]-R[-1]C[-4] -> 36 | P838: =RC[-1]-R[-1]C[-1] -> 0
B839: =R[-3]C+1 -> 279 | C839: =R[-1]C+RC[1] -> 835 | D839: 1 | F839: =ROUND((R1003C-R4C)/(R1003C3)*RC3,0)+R4C -> 9809 | G839: =ROUND((R1003C-R4C)/(R1003C3)*RC3,0)+R4C -> 7665 | H839: =ROUND((R1003C-R4C)/(R1003C3)*RC3,0)+R4C -> 21694 | I839: =ROUND((R1003C-R4C)/(R1003C3)*RC3,0)+R4C -> 3941 | J839: =ROUND((R1003C-R4C)/(R1003C3)*RC3,0)+R4C -> 2131 | K839: =ROUND((R1003C-R4C)/(R1003C3)*RC3,0)+R4C -> 30393 | O839: =RC[-4]-R[-1]C[-4] -> 36 | P839: =RC[-1]-R[-1]C[-1] -> 0
B840: =R[-3]C+1 -> 279 | C840: =R[-1]C+RC[1] -> 836 | D840: 1 | F840: =ROUND((R1003C-R4C)/(R1003C3)*RC3,0)+R4C -> 9821 | G840: =ROUND((R1003C-R4C)/(R1003C3)*RC3,0)+R4C -> 7674 | H840: =ROUND((R1003C-R4C)/(R1003C3)*RC3,0)+R4C -> 21720 | I840: =ROUND((R1003C-R4C)/(R1003C3)*RC3,0)+R4C -> 3945 | J840: =ROUND((R1003C-R4C)/(R1003C3)*RC3,0)+R4C -> 2134 | K840: =ROUND((R1003C-R4C)/(R1003C3)*RC3,0)+R4C -> 30429 | O840: =RC[-4]-R[-1]C[-4] -> 36 | P840: =RC[-1]-R[-1]C[-1] -> 0
B841: =R[-3]C+1 -> 280 | C841: =R[-1]C+RC[1] -> 837 | D841: 1 | F841: =ROUND((R1003C-R4C)/(R1003C3)*RC3,0)+R4C -> 9832 | G841: =ROUND((R1003C-R4C)/(R1003C3)*RC3,0)+R4C -> 7683 | H841: =ROUND((R1003C-R4C)/(R1003C3)*RC3,0)+R4C -> 21745 | I841: =ROUND((R1003C-R4C)/(R1003C3)*RC3,0)+R4C -> 3950 | J841: =ROUND((R1003C-R4C)/(R1003C3)*RC3,0)+R4C -> 2136 | K841: =ROUND((R1003C-R4C)/(R1003C3)*RC3,0)+R4C -> 30466 | O841: =RC[-4]-R[-1]C[-4] -> 37 | P841: =RC[-1]-R[-1]C[-1] -> 1
B842: =R[-3]C+1 -> 280 | C842: =R[-1]C+RC[1] -> 838 | D842: 1 | F842: =ROUND((R1003C-R4C)/(R1003C3)*RC3,0)+R4C -> 9844 | G842: =ROUND((R1003C-R4C)/(R1003C3)*RC3,0)+R4C -> 7692 | H842: =ROUND((R1003C-R4C)/(R1003C3)*RC3,0)+R4C -> 21771 | I842: =ROUND((R1003C-R4C)/(R1003C3)*RC3,0)+R4C -> 3955 | J842: =ROUND((R1003C-R4C)/(R1003C3)*RC3,0)+R4C -> 2139 | K842: =ROUND((R1003C-R4C)/(R1003C3)*RC3,0)+R4C -> 30502 | O842: =RC[-4]-R[-1]C[-4] -> 36 | P842: =RC[-1]-R[-1]C[-1] -> -1
B843: =R[-3]C+1 -> 280 | C843: =R[-1]C+RC[1] -> 839 | D843: 1 | F843: =ROUND((R1003C-R4C)/(R1003C3)*RC3,0)+R4C -> 9856 | G843: =ROUND((R1003C-R4C)/(R1003C3)*RC3,0)+R4C -> 7701 | H843: =ROUND((R1003C-R4C)/(R1003C3)*RC3,0)+R4C -> 21797 | I843: =ROUND((R1003C-R4C)/(R1003C3)*RC3,0)+R4C -> 3959 | J843: =ROUND((R1003C-R4C)/(R1003C3)*RC3,0)+R4C -> 2141 | K843: =ROUND((R1003C-R4C)/(R1003C3)*RC3,0)+R4C -> 30538 | O843: =RC[-4]-R[-1]C[-4] -> 36 | P843: =RC[-1]-R[-1]C[-1] -> 0
B844: =R[-3]C+1 -> 281 | C844: =R[-1]C+RC[1] -> 840 | D844: 1 | F844: =ROUND((R1003C-R4C)/(R1003C3)*RC3,0)+R4C -> 9867 | G844: =ROUND((R1003C-R4C)/(R1003C3)*RC3,0)+R4C -> 7710 | H844: =ROUND((R1003C-R4C)/(R1003C3)*RC3,0)+R4C -> 21823 | I844: =ROUND((R1003C-R4C)/(R1003C3)*RC3,0)+R4C -> 3964 | J844: =ROUND((R1003C-R4C)/(R1003C3)*RC3,0)+R4C -> 2144 | K844: =ROUND((R1003C-R4C)/(R1003C3)*RC3,0)+R4C -> 30574 | O844: =RC[-4]-R[-1]C[-4] -> 36 | P844: =RC[-1]-R[-1]C[-1] -> 0
B845: =R[-3]C+1 -> 281 | C845: =R[-1]C+RC[1] -> 841 | D845: 1 | F845: =ROUND((R1003C-R4C)/(R1003C3)*RC3,0)+R4C -> 9879 | G845: =ROUND((R1003C-R4C)/(R1003C3)*RC3,0)+R4C -> 7719 | H845: =ROUND((R1003C-R4C)/(R1003C3)*RC3,0)+R4C -> 21849 | I845: =ROUND((R1003C-R4C)/(R1003C3)*RC3,0)+R4C -> 3969 | J845: =ROUND((R1003C-R4C)/(R1003C3)*RC3,0)+R4C -> 2146 | K845: =ROUND((R1003C-R4C)/(R1003C3)*RC3,0)+R4C -> 30610 | O845: =RC[-4]-R[-1]C[-4] -> 36 | P845: =RC[-1]-R[-1]C[-1] -> 0
B846: =R[-3]C+1 -> 281 | C846: =R[-1]C+RC[1] -> 842 | D846: 1 | F846: =ROUND((R1003C-R4C)/(R1003C3)*RC3,0)+R4C -> 9891 | G846: =ROUND((R1003C-R4C)/(R1003C3)*RC3,0)+R4C -> 7729 | H846: =ROUND((R1003C-R4C)/(R1003C3)*RC3,0)+R4C -> 21875 | I846: =ROUND((R1003C-R4C)/(R1003C3)*RC3,0)+R4C -> 3974 | J846: =ROUND((R1003C-R4C)/(R1003C3)*RC3,0)+R4C -> 2149 | K846: =ROUND((R1003C-R4C)/(R1003C3)*RC3,0)+R4C -> 30647 | O846: =RC[-4]-R[-1]C[-4] -> 37 | P846: =RC[-1]-R[-1]C[-1] -> 1
B847: =R[-3]C+1 -> 282 | C847: =R[-1]C+RC[1] -> 843 | D847: 1 | F847: =ROUND((R1003C-R4C)/(R1003C3)*RC3,0)+R4C -> 9902 | G847: =ROUND((R1003C-R4C)/(R1003C3)*RC3,0)+R4C -> 7738 | H847: =ROUND((R1003C-R4C)/(R1003C3)*RC3,0)+R4C -> 21900 | I847: =ROUND((R1003C-R4C)/(R1003C3)*RC3,0)+R4C -> 3978 | J847: =ROUND((R1003C-R4C)/(R1003C3)*RC3,0)+R4C -> 2151 | K847: =ROUND((R1003C-R4C)/(R1003C3)*RC3,0)+R4C -> 30683 | O847: =RC[-4]-R[-1]C[-4] -> 36 | P847: =RC[-1]-R[-1]C[-1] -> -1
B848: =R[-3]C+1 -> 282 | C848: =R[-1]C+RC[1] -> 844 | D848: 1 | F848: =ROUND((R1003C-R4C)/(R1003C3)*RC3,0)+R4C -> 9914 | G848: =ROUND((R1003C-R4C)/(R1003C3)*RC3,0)+R4C -> 7747 | H848: =ROUND((R1003C-R4C)/(R1003C3)*RC3,0)+R4C -> 21926 | I848: =ROUND((R1003C-R4C)/(R1003C3)*RC3,0)+R4C -> 3983 | J848: =ROUND((R1003C-R4C)/(R1003C3)*RC3,0)+R4C -> 2154 | K848: =ROUND((R1003C-R4C)/(R1003C3)*RC3,0)+R4C -> 30719 | O848: =RC[-4]-R[-1]C[-4] -> 36 | P848: =RC[-1]-R[-1]C[-1] -> 0
B849: =R[-3]C+1 -> 282 | C849: =R[-1]C+RC[1] -> 845 | D849: 1 | F849: =ROUND((R1003C-R4C)/(R1003C3)*RC3,0)+R4C -> 9926 | G849: =ROUND((R1003C-R4C)/(R1003C3)*RC3,0)+R4C -> 7756 | H849: =ROUND((R1003C-R4C)/(R1003C3)*RC3,0)+R4C -> 21952 | I849: =ROUND((R1003C-R4C)/(R1003C3)*RC3,0)+R4C -> 3988 | J849: =ROUND((R1003C-R4C)/(R1003C3)*RC3,0)+R4C -> 2156 | K849: =ROUND((R1003C-R4C)/(R1003C3)*RC3,0)+R4C -> 30755 | O849: =RC[-4]-R[-1]C[-4] -> 36 | P849: =RC[-1]-R[-1]C[-1] -> 0
B850: =R[-3]C+1 -> 283 | C850: =R[-1]C+RC[1] -> 846 | D850: 1 | F850: =ROUND((R1003C-R4C)/(R1003C3)*RC3,0)+R4C -> 9937 | G850: =ROUND((R1003C-R4C)/(R1003C3)*RC3,0)+R4C -> 7765 | H850: =ROUND((R1003C-R4C)/(R1003C3)*RC3,0)+R4C -> 21978 | I850: =ROUND((R1003C-R4C)/(R1003C3)*RC3,0)+R4C -> 3992 | J850: =ROUND((R1003C-R4C)/(R1003C3)*RC3,0)+R4C -> 2159 | K850: =ROUND((R1003C-R4C)/(R1003C3)*RC3,0)+R4C -> 30791 | O850: =RC[-4]-R[-1]C[-4] -> 36 | P850: =RC[-1]-R[-1]C[-1] -> 0
B851: =R[-3]C+1 -> 283 | C851: =R[-1]C+RC[1] -> 847 | D851: 1 | F851: =ROUND((R1003C-R4C)/(R1003C3)*RC3,0)+R4C -> 9949 | G851: =ROUND((R1003C-R4C)/(R1003C3)*RC3,0)+R4C -> 7774 | H851: =ROUND((R1003C-R4C)/(R1003C3)*RC3,0)+R4C -> 22004 | I851: =ROUND((R1003C-R4C)/(R1003C3)*RC3,0)+R4C -> 3997 | J851: =ROUND((R1003C-R4C)/(R1003C3)*RC3,0)+R4C -> 2161 | K851: =ROUND((R1003C-R4C)/(R1003C3)*RC3,0)+R4C -> 30827 | O851: =RC[-4]-R[-1]C[-4] -> 36 | P851: =RC[-1]-R[-1]C[-1] -> 0
B852: =R[-3]C+1 -> 283 | C852: =R[-1]C+RC[1] -> 848 | D852: 1 | F852: =ROUND((R1003C-R4C)/(R1003C3)*RC3,0)+R4C -> 9961 | G852: =ROUND((R1003C-R4C)/(R1003C3)*RC3,0)+R4C -> 7783 | H852: =ROUND((R1003C-R4C)/(R1003C3)*RC3,0)+R4C -> 22029 | I852: =ROUND((R1003C-R4C)/(R1003C3)*RC3,0)+R4C -> 4002 | J852: =ROUND((R1003C-R4C)/(R1003C3)*RC3,0)+R4C -> 2164 | K852: =ROUND((R1003C-R4C)/(R1003C3)*RC3,0)+R4C -> 30864 | O852: =RC[-4]-R[-1]C[-4] -> 37 | P852: =RC[-1]-R[-1]C[-1] -> 1
B853: =R[-3]C+1 -> 284 | C853: =R[-1]C+RC[1] -> 849 | D853: 1 | F853: =ROUND((R1003C-R4C)/(R1003C3)*RC3,0)+R4C -> 9972 | G853: =ROUND((R1003C-R4C)/(R1003C3)*RC3,0)+R4C -> 7792 | H853: =ROUND((R1003C-R4C)/(R1003C3)*RC3,0)+R4C -> 22055 | I853: =ROUND((R1003C-R4C)/(R1003C3)*RC3,0)+R4C -> 4006 | J853: =ROUND((R1003C-R4C)/(R1003C3)*RC3,0)+R4C -> 2167 | K853: =ROUND((R1003C-R4C)/(R1003C3)*RC3,0)+R4C -> 30900 | O853: =RC[-4]-R[-1]C[-4] -> 36 | P853: =RC[-1]-R[-1]C[-1] -> -1
B854: =R[-3]C+1 -> 284 | C854: =R[-1]C+RC[1] -> 850 | D854: 1 | F854: =ROUND((R1003C-R4C)/(R1003C3)*RC3,0)+R4C -> 9984 | G854: =ROUND((R1003C-R4C)/(R1003C3)*RC3,0)+R4C -> 7802 | H854: =ROUND((R1003C-R4C)/(R1003C3)*RC3,0)+R4C -> 22081 | I854: =ROUND((R1003C-R4C)/(R1003C3)*RC3,0)+R4C -> 4011 | J854: =ROUND((R1003C-R4C)/(R1003C3)*RC3,0)+R4C -> 2169 | K854: =ROUND((R1003C-R4C)/(R1003C3)*RC3,0)+R4C -> 30936 | O854: =RC[-4]-R[-1]C[-4] -> 36 | P854: =RC[-1]-R[-1]C[-1] -> 0
B855: =R[-3]C+1 -> 284 | C855: =R[-1]C+RC[1] -> 851 | D855: 1 | F855: =ROUND((R1003C-R4C)/(R1003C3)*RC3,0)+R4C -> 9996 | G855: =ROUND((R1003C-R4C)/(R1003C3)*RC3,0)+R4C -> 7811 | H855: =ROUND((R1003C-R4C)/(R1003C3)*RC3,0)+R4C -> 22107 | I855: =ROUND((R1003C-R4C)/(R1003C3)*RC3,0)+R4C -> 4016 | J855: =ROUND((R1003C-R4C)/(R1003C3)*RC3,0)+R4C -> 2172 | K855: =ROUND((R1003C-R4C)/(R1003C3)*RC3,0)+R4C -> 30972 | O855: =RC[-4]-R[-1]C[-4] -> 36 | P855: =RC[-1]-R[-1]C[-1] -> 0
B856: =R[-3]C+1 -> 285 | C856: =R[-1]C+RC[1] -> 852 | D856: 1 | F856: =ROUND((R1003C-R4C)/(R1003C3)*RC3,0)+R4C -> 10008 | G856: =ROUND((R1003C-R4C)/(R1003C3)*RC3,0)+R4C -> 7820 | H856: =ROUND((R1003C-R4C)/(R1003C3)*RC3,0)+R4C -> 22133 | I856: =ROUND((R1003C-R4C)/(R1003C3)*RC3,0)+R4C -> 4020 | J856: =ROUND((R1003C-R4C)/(R1003C3)*RC3,0)+R4C -> 2174 | K856: =ROUND((R1003C-R4C)/(R1003C3)*RC3,0)+R4C -> 31008 | O856: =RC[-4]-R[-1]C[-4] -> 36 | P856: =RC[-1]-R[-1]C[-1] -> 0
B857: =R[-3]C+1 -> 285 | C857: =R[-1]C+RC[1] -> 853 | D857: 1 | F857: =ROUND((R1003C-R4C)/(R1003C3)*RC3,0)+R4C -> 10019 | G857: =ROUND((R1003C-R4C)/(R1003C3)*RC3,0)+R4C -> 7829 | H857: =ROUND((R1003C-R4C)/(R1003C3)*RC3,0)+R4C -> 22159 | I857: =ROUND((R1003C-R4C)/(R1003C3)*RC3,0)+R4C -> 4025 | J857: =ROUND((R1003C-R4C)/(R1003C3)*RC3,0)+R4C -> 2177 | K857: =ROUND((R1003C-R4C)/(R1003C3)*RC3,0)+R4C -> 31045 | O857: =RC[-4]-R[-1]C[-4] -> 37 | P857: =RC[-1]-R[-1]C[-1] -> 1
B858: =R[-3]C+1 -> 285 | C858: =R[-1]C+RC[1] -> 854 | D858: 1 | F858: =ROUND((R1003C-R4C)/(R1003C3)*RC3,0)+R4C -> 10031 | G858: =ROUND((R1003C-R4C)/(R1003C3)*RC3,0)+R4C -> 7838 | H858: =ROUND((R1003C-R4C)/(R1003C3)*RC3,0)+R4C -> 22184 | I858: =ROUND((R1003C-R4C)/(R1003C3)*RC3,0)+R4C -> 4030 | J858: =ROUND((R1003C-R4C)/(R1003C3)*RC3,0)+R4C -> 2179 | K858: =ROUND((R1003C-R4C)/(R1003C3)*RC3,0)+R4C -> 31081 | O858: =RC[-4]-R[-1]C[-4] -> 36 | P858: =RC[-1]-R[-1]C[-1] -> -1
B859: =R[-3]C+1 -> 286 | C859: =R[-1]C+RC[1] -> 855 | D859: 1 | F859: =ROUND((R1003C-R4C)/(R1003C3)*RC3,0)+R4C -> 10043 | G859: =ROUND((R1003C-R4C)/(R1003C3)*RC3,0)+R4C -> 7847 | H859: =ROUND((R1003C-R4C)/(R1003C3)*RC3,0)+R4C -> 22210 | I859: =ROUND((R1003C-R4C)/(R1003C3)*RC3,0)+R4C -> 4035 | J859: =ROUND((R1003C-R4C)/(R1003C3)*RC3,0)+R4C -> 2182 | K859: =ROUND((R1003C-R4C)/(R1003C3)*RC3,0)+R4C -> 31117 | O859: =RC[-4]-R[-1]C[-4] -> 36 | P859: =RC[-1]-R[-1]C[-1] -> 0
B860: =R[-3]C+1 -> 286 | C860: =R[-1]C+RC[1] -> 856 | D860: 1 | F860: =ROUND((R1003C-R4C)/(R1003C3)*RC3,0)+R4C -> 10054 | G860: =ROUND((R1003C-R4C)/(R1003C3)*RC3,0)+R4C -> 7856 | H860: =ROUND((R1003C-R4C)/(R1003C3)*RC3,0)+R4C -> 22236 | I860: =ROUND((R1003C-R4C)/(R1003C3)*RC3,0)+R4C -> 4039 | J860: =ROUND((R1003C-R4C)/(R1003C3)*RC3,0)+R4C -> 2184 | K860: =ROUND((R1003C-R4C)/(R1003C3)*RC3,0)+R4C -> 31153 | O860: =RC[-4]-R[-1]C[-4] -> 36 | P860: =RC[-1]-R[-1]C[-1] -> 0
B861: =R[-3]C+1 -> 286 | C861: =R[-1]C+RC[1] -> 857 | D861: 1 | F861: =ROUND((R1003C-R4C)/(R1003C3)*RC3,0)+R4C -> 10066 | G861: =ROUND((R1003C-R4C)/(R1003C3)*RC3,0)+R4C -> 7865 | H861: =ROUND((R1003C-R4C)/(R1003C3)*RC3,0)+R4C -> 22262 | I861: =ROUND((R1003C-R4C)/(R1003C3)*RC3,0)+R4C -> 4044 | J861: =ROUND((R1003C-R4C)/(R1003C3)*RC3,0)+R4C -> 2187 | K861: =ROUND((R1003C-R4C)/(R1003C3)*RC3,0)+R4C -> 31189 | O861: =RC[-4]-R[-1]C[-4] -> 36 | P861: =RC[-1]-R[-1]C[-1] -> 0
B862: =R[-3]C+1 -> 287 | C862: =R[-1]C+RC[1] -> 858 | D862: 1 | F862: =ROUND((R1003C-R4C)/(R1003C3)*RC3,0)+R4C -> 10078 | G862: =ROUND((R1003C-R4C)/(R1003C3)*RC3,0)+R4C -> 7874 | H862: =ROUND((R1003C-R4C)/(R1003C3)*RC3,0)+R4C -> 22288 | I862: =ROUND((R1003C-R4C)/(R1003C3)*RC3,0)+R4C -> 4049 | J862: =ROUND((R1003C-R4C)/(R1003C3)*RC3,0)+R4C -> 2189 | K862: =ROUND((R1003C-R4C)/(R1003C3)*RC3,0)+R4C -> 31225 | O862: =RC[-4]-R[-1]C[-4] -> 36 | P862: =RC[-1]-R[-1]C[-1] -> 0
B863: =R[-3]C+1 -> 287 | C863: =R[-1]C+RC[1] -> 859 | D863: 1 | F863: =ROUND((R1003C-R4C)/(R1003C3)*RC3,0)+R4C -> 10089 | G863: =ROUND((R1003C-R4C)/(R1003C3)*RC3,0)+R4C -> 7884 | H863: =ROUND((R1003C-R4C)/(R1003C3)*RC3,0)+R4C -> 22314 | I863: =ROUND((R1003C-R4C)/(R1003C3)*RC3,0)+R4C -> 4053 | J863: =ROUND((R1003C-R4C)/(R1003C3)*RC3,0)+R4C -> 2192 | K863: =ROUND((R1003C-R4C)/(R1003C3)*RC3,0)+R4C -> 31262 | O863: =RC[-4]-R[-1]C[-4] -> 37 | P863: =RC[-1]-R[-1]C[-1] -> 1
B864: =R[-3]C+1 -> 287 | C864: =R[-1]C+RC[1] -> 860 | D864: 1 | F864: =ROUND((R1003C-R4C)/(R1003C3)*RC3,0)+R4C -> 10101 | G864: =ROUND((R1003C-R4C)/(R1003C3)*RC3,0)+R4C -> 7893 | H864: =ROUND((R1003C-R4C)/(R1003C3)*RC3,0)+R4C -> 22339 | I864: =ROUND((R1003C-R4C)/(R1003C3)*RC3,0)+R4C -> 4058 | J864: =ROUND((R1003C-R4C)/(R1003C3)*RC3,0)+R4C -> 2194 | K864: =ROUND((R1003C-R4C)/(R1003C3)*RC3,0)+R4C -> 31298 | O864: =RC[-4]-R[-1]C[-4] -> 36 | P864: =RC[-1]-R[-1]C[-1] -> -1
B865: =R[-3]C+1 -> 288 | C865: =R[-1]C+RC[1] -> 861 | D865: 1 | F865: =ROUND((R1003C-R4C)/(R1003C3)*RC3,0)+R4C -> 10113 | G865: =ROUND((R1003C-R4C)/(R1003C3)*RC3,0)+R4C -> 7902 | H865: =ROUND((R1003C-R4C)/(R1003C3)*RC3,0)+R4C -> 22365 | I865: =ROUND((R1003C-R4C)/(R1003C3)*RC3,0)+R4C -> 4063 | J865: =ROUND((R1003C-R4C)/(R1003C3)*RC3,0)+R4C -> 2197 | K865: =ROUND((R1003C-R4C)/(R1003C3)*RC3,0)+R4C -> 31334 | O865: =RC[-4]-R[-1]C[-4] -> 36 | P865: =RC[-1]-R[-1]C[-1] -> 0
B866: =R[-3]C+1 -> 288 | C866: =R[-1]C+RC[1] -> 862 | D866: 1 | F866: =ROUND((R1003C-R4C)/(R1003C3)*RC3,0)+R4C -> 10124 | G866: =ROUND((R1003C-R4C)/(R1003C3)*RC3,0)+R4C -> 7911 | H866: =ROUND((R1003C-R4C)/(R1003C3)*RC3,0)+R4C -> 22391 | I866: =ROUND((R1003C-R4C)/(R1003C3)*RC3,0)+R4C -> 4067 | J866: =ROUND((R1003C-R4C)/(R1003C3)*RC3,0)+R4C -> 2199 | K866: =ROUND((R1003C-R4C)/(R1003C3)*RC3,0)+R4C -> 31370 | O866: =RC[-4]-R[-1]C[-4] -> 36 | P866: =RC[-1]-R[-1]C[-1] -> 0
B867: =R[-3]C+1 -> 288 | C867: =R[-1]C+RC[1] -> 863 | D867: 1 | F867: =ROUND((R1003C-R4C)/(R1003C3)*RC3,0)+R4C -> 10136 | G867: =ROUND((R1003C-R4C)/(R1003C3)*RC3,0)+R4C -> 7920 | H867: =ROUND((R1003C-R4C)/(R1003C3)*RC3,0)+R4C -> 22417 | I867: =ROUND((R1003C-R4C)/(R1003C3)*RC3,0)+R4C -> 4072 | J867: =ROUND((R1003C-R4C)/(R1003C3)*RC3,0)+R4C -> 2202 | K867: =ROUND((R1003C-R4C)/(R1003C3)*RC3,0)+R4C -> 31406 | O867: =RC[-4]-R[-1]C[-4] -> 36 | P867: =RC[-1]-R[-1]C[-1] -> 0
B868: =R[-3]C+1 -> 289 | C868: =R[-1]C+RC[1] -> 864 | D868: 1 | F868: =ROUND((R1003C-R4C)/(R1003C3)*RC3,0)+R4C -> 10148 | G868: =ROUND((R1003C-R4C)/(R1003C3)*RC3,0)+R4C -> 7929 | H868: =ROUND((R1003C-R4C)/(R1003C3)*RC3,0)+R4C -> 22443 | I868: =ROUND((R1003C-R4C)/(R1003C3)*RC3,0)+R4C -> 4077 | J868: =ROUND((R1003C-R4C)/(R1003C3)*RC3,0)+R4C -> 2205 | K868: =ROUND((R1003C-R4C)/(R1003C3)*RC3,0)+R4C -> 31443 | O868: =RC[-4]-R[-1]C[-4] -> 37 | P868: =RC[-1]-R[-1]C[-1] -> 1
B869: =R[-3]C+1 -> 289 | C869: =R[-1]C+RC[1] -> 865 | D869: 1 | F869: =ROUND((R1003C-R4C)/(R1003C3)*RC3,0)+R4C -> 10159 | G869: =ROUND((R1003C-R4C)/(R1003C3)*RC3,0)+R4C -> 7938 | H869: =ROUND((R1003C-R4C)/(R1003C3)*RC3,0)+R4C -> 22468 | I869: =ROUND((R1003C-R4C)/(R1003C3)*RC3,0)+R4C -> 4081 | J869: =ROUND((R1003C-R4C)/(R1003C3)*RC3,0)+R4C -> 2207 | K869: =ROUND((R1003C-R4C)/(R1003C3)*RC3,0)+R4C -> 31479 | O869: =RC[-4]-R[-1]C[-4] -> 36 | P869: =RC[-1]-R[-1]C[-1] -> -1
B870: =R[-3]C+1 -> 289 | C870: =R[-1]C+RC[1] -> 866 | D870: 1 | F870: =ROUND((R1003C-R4C)/(R1003C3)*RC3,0)+R4C -> 10171 | G870: =ROUND((R1003C-R4C)/(R1003C3)*RC3,0)+R4C -> 7947 | H870: =ROUND((R1003C-R4C)/(R1003C3)*RC3,0)+R4C -> 22494 | I870: =ROUND((R1003C-R4C)/(R1003C3)*RC3,0)+R4C -> 4086 | J870: =ROUND((R1003C-R4C)/(R1003C3)*RC3,0)+R4C -> 2210 | K870: =ROUND((R1003C-R4C)/(R1003C3)*RC3,0)+R4C -> 31515 | O870: =RC[-4]-R[-1]C[-4] -> 36 | P870: =RC[-1]-R[-1]C[-1] -> 0
B871: =R[-3]C+1 -> 290 | C871: =R[-1]C+RC[1] -> 867 | D871: 1 | F871: =ROUND((R1003C-R4C)/(R1003C3)*RC3,0)+R4C -> 10183 | G871: =ROUND((R1003C-R4C)/(R1003C3)*RC3,0)+R4C -> 7957 | H871: =ROUND((R1003C-R4C)/(R1003C3)*RC3,0)+R4C -> 22520 | I871: =ROUND((R1003C-R4C)/(R1003C3)*RC3,0)+R4C -> 4091 | J871: =ROUND((R1003C-R4C)/(R1003C3)*RC3,0)+R4C -> 2212 | K871: =ROUND((R1003C-R4C)/(R1003C3)*RC3,0)+R4C -> 31551 | O871: =RC[-4]-R[-1]C[-4] -> 36 | P871: =RC[-1]-R[-1]C[-1] -> 0
B872: =R[-3]C+1 -> 290 | C872: =R[-1]C+RC[1] -> 868 | D872: 1 | F872: =ROUND((R1003C-R4C)/(R1003C3)*RC3,0)+R4C -> 10194 | G872: =ROUND((R1003C-R4C)/(R1003C3)*RC3,0)+R4C -> 7966 | H872: =ROUND((R1003C-R4C)/(R1003C3)*RC3,0)+R4C -> 22546 | I872: =ROUND((R1003C-R4C)/(R1003C3)*RC3,0)+R4C -> 4096 | J872: =ROUND((R1003C-R4C)/(R1003C3)*RC3,0)+R4C -> 2215 | K872: =ROUND((R1003C-R4C)/(R1003C3)*RC3,0)+R4C -> 31587 | O872: =RC[-4]-R[-1]C[-4] -> 36 | P872: =RC[-1]-R[-1]C[-1] -> 0
B873: =R[-3]C+1 -> 290 | C873: =R[-1]C+RC[1] -> 869 | D873: 1 | F873: =ROUND((R1003C-R4C)/(R1003C3)*RC3,0)+R4C -> 10206 | G873: =ROUND((R1003C-R4C)/(R1003C3)*RC3,0)+R4C -> 7975 | H873: =ROUND((R1003C-R4C)/(R1003C3)*RC3,0)+R4C -> 22572 | I873: =ROUND((R1003C-R4C)/(R1003C3)*RC3,0)+R4C -> 4100 | J873: =ROUND((R1003C-R4C)/(R1003C3)*RC3,0)+R4C -> 2217 | K873: =ROUND((R1003C-R4C)/(R1003C3)*RC3,0)+R4C -> 31623 | O873: =RC[-4]-R[-1]C[-4] -> 36 | P873: =RC[-1]-R[-1]C[-1] -> 0
B874: =R[-3]C+1 -> 291 | C874: =R[-1]C+RC[1] -> 870 | D874: 1 | F874: =ROUND((R1003C-R4C)/(R1003C3)*RC3,0)+R4C -> 10218 | G874: =ROUND((R1003C-R4C)/(R1003C3)*RC3,0)+R4C -> 7984 | H874: =ROUND((R1003C-R4C)/(R1003C3)*RC3,0)+R4C -> 22598 | I874: =ROUND((R1003C-R4C)/(R1003C3)*RC3,0)+R4C -> 4105 | J874: =ROUND((R1003C-R4C)/(R1003C3)*RC3,0)+R4C -> 2220 | K874: =ROUND((R1003C-R4C)/(R1003C3)*RC3,0)+R4C -> 31660 | O874: =RC[-4]-R[-1]C[-4] -> 37 | P874: =RC[-1]-R[-1]C[-1] -> 1
B875: =R[-3]C+1 -> 291 | C875: =R[-1]C+RC[1] -> 871 | D875: 1 | F875: =ROUND((R1003C-R4C)/(R1003C3)*RC3,0)+R4C -> 10229 | G875: =ROUND((R1003C-R4C)/(R1003C3)*RC3,0)+R4C -> 7993 | H875: =ROUND((R1003C-R4C)/(R1003C3)*RC3,0)+R4C -> 22623 | I875: =ROUND((R1003C-R4C)/(R1003C3)*RC3,0)+R4C -> 4110 | J875: =ROUND((R1003C-R4C)/(R1003C3)*RC3,0)+R4C -> 2222 | K875: =ROUND((R1003C-R4C)/(R1003C3)*RC3,0)+R4C -> 31696 | O875: =RC[-4]-R[-1]C[-4] -> 36 | P875: =RC[-1]-R[-1]C[-1] -> -1
B876: =R[-3]C+1 -> 291 | C876: =R[-1]C+RC[1] -> 872 | D876: 1 | F876: =ROUND((R1003C-R4C)/(R1003C3)*RC3,0)+R4C -> 10241 | G876: =ROUND((R1003C-R4C)/(R1003C3)*RC3,0)+R4C -> 8002 | H876: =ROUND((R1003C-R4C)/(R1003C3)*RC3,0)+R4C -> 22649 | I876: =ROUND((R1003C-R4C)/(R1003C3)*RC3,0)+R4C -> 4114 | J876: =ROUND((R1003C-R4C)/(R1003C3)*RC3,0)+R4C -> 2225 | K876: =ROUND((R1003C-R4C)/(R1003C3)*RC3,0)+R4C -> 31732 | O876: =RC[-4]-R[-1]C[-4] -> 36 | P876: =RC[-1]-R[-1]C[-1] -> 0
B877: =R[-3]C+1 -> 292 | C877: =R[-1]C+RC[1] -> 873 | D877: 1 | F877: =ROUND((R1003C-R4C)/(R1003C3)*RC3,0)+R4C -> 10253 | G877: =ROUND((R1003C-R4C)/(R1003C3)*RC3,0)+R4C -> 8011 | H877: =ROUND((R1003C-R4C)/(R1003C3)*RC3,0)+R4C -> 22675 | I877: =ROUND((R1003C-R4C)/(R1003C3)*RC3,0)+R4C -> 4119 | J877: =ROUND((R1003C-R4C)/(R1003C3)*RC3,0)+R4C -> 2227 | K877: =ROUND((R1003C-R4C)/(R1003C3)*RC3,0)+R4C -> 31768 | O877: =RC[-4]-R[-1]C[-4] -> 36 | P877: =RC[-1]-R[-1]C[-1] -> 0
B878: =R[-3]C+1 -> 292 | C878: =R[-1]C+RC[1] -> 874 | D878: 1 | F878: =ROUND((R1003C-R4C)/(R1003C3)*RC3,0)+R4C -> 10264 | G878: =ROUND((R1003C-R4C)/(R1003C3)*RC3,0)+R4C -> 8020 | H878: =ROUND((R1003C-R4C)/(R1003C3)*RC3,0)+R4C -> 22701 | I878: =ROUND((R1003C-R4C)/(R1003C3)*RC3,0)+R4C -> 4124 | J878: =ROUND((R1003C-R4C)/(R1003C3)*RC3,0)+R4C -> 2230 | K878: =ROUND((R1003C-R4C)/(R1003C3)*RC3,0)+R4C -> 31804 | O878: =RC[-4]-R[-1]C[-4] -> 36 | P878: =RC[-1]-R[-1]C[-1] -> 0
B879: =R[-3]C+1 -> 292 | C879: =R[-1]C+RC[1] -> 875 | D879: 1 | F879: =ROUND((R1003C-R4C)/(R1003C3)*RC3,0)+R4C -> 10276 | G879: =ROUND((R1003C-R4C)/(R1003C3)*RC3,0)+R4C -> 8030 | H879: =ROUND((R1003C-R4C)/(R1003C3)*RC3,0)+R4C -> 22727 | I879: =ROUND((R1003C-R4C)/(R1003C3)*RC3,0)+R4C -> 4128 | J879: =ROUND((R1003C-R4C)/(R1003C3)*RC3,0)+R4C -> 2232 | K879: =ROUND((R1003C-R4C)/(R1003C3)*RC3,0)+R4C -> 31841 | O879: =RC[-4]-R[-1]C[-4] -> 37 | P879: =RC[-1]-R[-1]C[-1] -> 1
B880: =R[-3]C+1 -> 293 | C880: =R[-1]C+RC[1] -> 876 | D880: 1 | F880: =ROUND((R1003C-R4C)/(R1003C3)*RC3,0)+R4C -> 10288 | G880: =ROUND((R1003C-R4C)/(R1003C3)*RC3,0)+R4C -> 8039 | H880: =ROUND((R1003C-R4C)/(R1003C3)*RC3,0)+R4C -> 22753 | I880: =ROUND((R1003C-R4C)/(R1003C3)*RC3,0)+R4C -> 4133 | J880: =ROUND((R1003C-R4C)/(R1003C3)*RC3,0)+R4C -> 2235 | K880: =ROUND((R1003C-R4C)/(R1003C3)*RC3,0)+R4C -> 31877 | O880: =RC[-4]-R[-1]C[-4] -> 36 | P880: =RC[-1]-R[-1]C[-1] -> -1
B881: =R[-3]C+1 -> 293 | C881: =R[-1]C+RC[1] -> 877 | D881: 1 | F881: =ROUND((R1003C-R4C)/(R1003C3)*RC3,0)+R4C -> 10299 | G881: =ROUND((R1003C-R4C)/(R1003C3)*RC3,0)+R4C -> 8048 | H881: =ROUND((R1003C-R4C)/(R1003C3)*RC3,0)+R4C -> 22778 | I881: =ROUND((R1003C-R4C)/(R1003C3)*RC3,0)+R4C -> 4138 | J881: =ROUND((R1003C-R4C)/(R1003C3)*RC3,0)+R4C -> 2238 | K881: =ROUND((R1003C-R4C)/(R1003C3)*RC3,0)+R4C -> 31913 | O881: =RC[-4]-R[-1]C[-4] -> 36 | P881: =RC[-1]-R[-1]C[-1] -> 0
B882: =R[-3]C+1 -> 293 | C882: =R[-1]C+RC[1] -> 878 | D882: 1 | F882: =ROUND((R1003C-R4C)/(R1003C3)*RC3,0)+R4C -> 10311 | G882: =ROUND((R1003C-R4C)/(R1003C3)*RC3,0)+R4C -> 8057 | H882: =ROUND((R1003C-R4C)/(R1003C3)*RC3,0)+R4C -> 22804 | I882: =ROUND((R1003C-R4C)/(R1003C3)*RC3,0)+R4C -> 4142 | J882: =ROUND((R1003C-R4C)/(R1003C3)*RC3,0)+R4C -> 2240 | K882: =ROUND((R1003C-R4C)/(R1003C3)*RC3,0)+R4C -> 31949 | O882: =RC[-4]-R[-1]C[-4] -> 36 | P882: =RC[-1]-R[-1]C[-1] -> 0
B883: =R[-3]C+1 -> 294 | C883: =R[-1]C+RC[1] -> 879 | D883: 1 | F883: =ROUND((R1003C-R4C)/(R1003C3)*RC3,0)+R4C -> 10323 | G883: =ROUND((R1003C-R4C)/(R1003C3)*RC3,0)+R4C -> 8066 | H883: =ROUND((R1003C-R4C)/(R1003C3)*RC3,0)+R4C -> 22830 | I883: =ROUND((R1003C-R4C)/(R1003C3)*RC3,0)+R4C -> 4147 | J883: =ROUND((R1003C-R4C)/(R1003C3)*RC3,0)+R4C -> 2243 | K883: =ROUND((R1003C-R4C)/(R1003C3)*RC3,0)+R4C -> 31985 | O883: =RC[-4]-R[-1]C[-4] -> 36 | P883: =RC[-1]-R[-1]C[-1] -> 0
B884: =R[-3]C+1 -> 294 | C884: =R[-1]C+RC[1] -> 880 | D884: 1 | F884: =ROUND((R1003C-R4C)/(R1003C3)*RC3,0)+R4C -> 10334 | G884: =ROUND((R1003C-R4C)/(R1003C3)*RC3,0)+R4C -> 8075 | H884: =ROUND((R1003C-R4C)/(R1003C3)*RC3,0)+R4C -> 22856 | I884: =ROUND((R1003C-R4C)/(R1003C3)*RC3,0)+R4C -> 4152 | J884: =ROUND((R1003C-R4C)/(R1003C3)*RC3,0)+R4C -> 2245 | K884: =ROUND((R1003C-R4C)/(R1003C3)*RC3,0)+R4C -> 32021 | O884: =RC[-4]-R[-1]C[-4] -> 36 | P884: =RC[-1]-R[-1]C[-1] -> 0
B885: =R[-3]C+1 -> 294 | C885: =R[-1]C+RC[1] -> 881 | D885: 1 | F885: =ROUND((R1003C-R4C)/(R1003C3)*RC3,0)+R4C -> 10346 | G885: =ROUND((R1003C-R4C)/(R1003C3)*RC3,0)+R4C -> 8084 | H885: =ROUND((R1003C-R4C)/(R1003C3)*RC3,0)+R4C -> 22882 | I885: =ROUND((R1003C-R4C)/(R1003C3)*RC3,0)+R4C -> 4156 | J885: =ROUND((R1003C-R4C)/(R1003C3)*RC3,0)+R4C -> 2248 | K885: =ROUND((R1003C-R4C)/(R1003C3)*RC3,0)+R4C -> 32058 | O885: =RC[-4]-R[-1]C[-4] -> 37 | P885: =RC[-1]-R[-1]C[-1] -> 1
B886: =R[-3]C+1 -> 295 | C886: =R[-1]C+RC[1] -> 882 | D886: 1 | F886: =ROUND((R1003C-R4C)/(R1003C3)*RC3,0)+R4C -> 10358 | G886: =ROUND((R1003C-R4C)/(R1003C3)*RC3,0)+R4C -> 8093 | H886: =ROUND((R1003C-R4C)/(R1003C3)*RC3,0)+R4C -> 22907 | I886: =ROUND((R1003C-R4C)/(R1003C3)*RC3,0)+R4C -> 4161 | J886: =ROUND((R1003C-R4C)/(R1003C3)*RC3,0)+R4C -> 2250 | K886: =ROUND((R1003C-R4C)/(R1003C3)*RC3,0)+R4C -> 32094 | O886: =RC[-4]-R[-1]C[-4] -> 36 | P886: =RC[-1]-R[-1]C[-1] -> -1
B887: =R[-3]C+1 -> 295 | C887: =R[-1]C+RC[1] -> 883 | D887: 1 | F887: =ROUND((R1003C-R4C)/(R1003C3)*RC3,0)+R4C -> 10370 | G887: =ROUND((R1003C-R4C)/(R1003C3)*RC3,0)+R4C -> 8103 | H887: =ROUND((R1003C-R4C)/(R1003C3)*RC3,0)+R4C -> 22933 | I887: =ROUND((R1003C-R4C)/(R1003C3)*RC3,0)+R4C -> 4166 | J887: =ROUND((R1003C-R4C)/(R1003C3)*RC3,0)+R4C -> 2253 | K887: =ROUND((R1003C-R4C)/(R1003C3)*RC3,0)+R4C -> 32130 | O887: =RC[-4]-R[-1]C[-4] -> 36 | P887: =RC[-1]-R[-1]C[-1] -> 0
B888: =R[-3]C+1 -> 295 | C888: =R[-1]C+RC[1] -> 884 | D888: 1 | F888: =ROUND((R1003C-R4C)/(R1003C3)*RC3,0)+R4C -> 10381 | G888: =ROUND((R1003C-R4C)/(R1003C3)*RC3,0)+R4C -> 8112 | H888: =ROUND((R1003C-R4C)/(R1003C3)*RC3,0)+R4C -> 22959 | I888: =ROUND((R1003C-R4C)/(R1003C3)*RC3,0)+R4C -> 4171 | J888: =ROUND((R1003C-R4C)/(R1003C3)*RC3,0)+R4C -> 2255 | K888: =ROUND((R1003C-R4C)/(R1003C3)*RC3,0)+R4C -> 32166 | O888: =RC[-4]-R[-1]C[-4] -> 36 | P888: =RC[-1]-R[-1]C[-1] -> 0
B889: =R[-3]C+1 -> 296 | C889: =R[-1]C+RC[1] -> 885 | D889: 1 | F889: =ROUND((R1003C-R4C)/(R1003C3)*RC3,0)+R4C -> 10393 | G889: =ROUND((R1003C-R4C)/(R1003C3)*RC3,0)+R4C -> 8121 | H889: =ROUND((R1003C-R4C)/(R1003C3)*RC3,0)+R4C -> 22985 | I889: =ROUND((R1003C-R4C)/(R1003C3)*RC3,0)+R4C -> 4175 | J889: =ROUND((R1003C-R4C)/(R1003C3)*RC3,0)+R4C -> 2258 | K889: =ROUND((R1003C-R4C)/(R1003C3)*RC3,0)+R4C -> 32202 | O889: =RC[-4]-R[-1]C[-4] -> 36 | P889: =RC[-1]-R[-1]C[-1] -> 0
B890: =R[-3]C+1 -> 296 | C890: =R[-1]C+RC[1] -> 886 | D890: 1 | F890: =ROUND((R1003C-R4C)/(R1003C3)*RC3,0)+R4C -> 10405 | G890: =ROUND((R1003C-R4C)/(R1003C3)*RC3,0)+R4C -> 8130 | H890: =ROUND((R1003C-R4C)/(R1003C3)*RC3,0)+R4C -> 23011 | I890: =ROUND((R1003C-R4C)/(R1003C3)*RC3,0)+R4C -> 4180 | J890: =ROUND((R1003C-R4C)/(R1003C3)*RC3,0)+R4C -> 2260 | K890: =ROUND((R1003C-R4C)/(R1003C3)*RC3,0)+R4C -> 32239 | O890: =RC[-4]-R[-1]C[-4] -> 37 | P890: =RC[-1]-R[-1]C[-1] -> 1
B891: =R[-3]C+1 -> 296 | C891: =R[-1]C+RC[1] -> 887 | D891: 1 | F891: =ROUND((R1003C-R4C)/(R1003C3)*RC3,0)+R4C -> 10416 | G891: =ROUND((R1003C-R4C)/(R1003C3)*RC3,0)+R4C -> 8139 | H891: =ROUND((R1003C-R4C)/(R1003C3)*RC3,0)+R4C -> 23037 | I891: =ROUND((R1003C-R4C)/(R1003C3)*RC3,0)+R4C -> 4185 | J891: =ROUND((R1003C-R4C)/(R1003C3)*RC3,0)+R4C -> 2263 | K891: =ROUND((R1003C-R4C)/(R1003C3)*RC3,0)+R4C -> 32275 | O891: =RC[-4]-R[-1]C[-4] -> 36 | P891: =RC[-1]-R[-1]C[-1] -> -1
B892: =R[-3]C+1 -> 297 | C892: =R[-1]C+RC[1] -> 888 | D892: 1 | F892: =ROUND((R1003C-R4C)/(R1003C3)*RC3,0)+R4C -> 10428 | G892: =ROUND((R1003C-R4C)/(R1003C3)*RC3,0)+R4C -> 8148 | H892: =ROUND((R1003C-R4C)/(R1003C3)*RC3,0)+R4C -> 23062 | I892: =ROUND((R1003C-R4C)/(R1003C3)*RC3,0)+R4C -> 4189 | J892: =ROUND((R1003C-R4C)/(R1003C3)*RC3,0)+R4C -> 2265 | K892: =ROUND((R1003C-R4C)/(R1003C3)*RC3,0)+R4C -> 32311 | O892: =RC[-4]-R[-1]C[-4] -> 36 | P892: =RC[-1]-R[-1]C[-1] -> 0
B893: =R[-3]C+1 -> 297 | C893: =R[-1]C+RC[1] -> 889 | D893: 1 | F893: =ROUND((R1003C-R4C)/(R1003C3)*RC3,0)+R4C -> 10440 | G893: =ROUND((R1003C-R4C)/(R1003C3)*RC3,0)+R4C -> 8157 | H893: =ROUND((R1003C-R4C)/(R1003C3)*RC3,0)+R4C -> 23088 | I893: =ROUND((R1003C-R4C)/(R1003C3)*RC3,0)+R4C -> 4194 | J893: =ROUND((R1003C-R4C)/(R1003C3)*RC3,0)+R4C -> 2268 | K893: =ROUND((R1003C-R4C)/(R1003C3)*RC3,0)+R4C -> 32347 | O893: =RC[-4]-R[-1]C[-4] -> 36 | P893: =RC[-1]-R[-1]C[-1] -> 0
B894: =R[-3]C+1 -> 297 | C894: =R[-1]C+RC[1] -> 890 | D894: 1 | F894: =ROUND((R1003C-R4C)/(R1003C3)*RC3,0)+R4C -> 10451 | G894: =ROUND((R1003C-R4C)/(R1003C3)*RC3,0)+R4C -> 8166 | H894: =ROUND((R1003C-R4C)/(R1003C3)*RC3,0)+R4C -> 23114 | I894: =ROUND((R1003C-R4C)/(R1003C3)*RC3,0)+R4C -> 4199 | J894: =ROUND((R1003C-R4C)/(R1003C3)*RC3,0)+R4C -> 2271 | K894: =ROUND((R1003C-R4C)/(R1003C3)*RC3,0)+R4C -> 32383 | O894: =RC[-4]-R[-1]C[-4] -> 36 | P894: =RC[-1]-R[-1]C[-1] -> 0
B895: =R[-3]C+1 -> 298 | C895: =R[-1]C+RC[1] -> 891 | D895: 1 | F895: =ROUND((R1003C-R4C)/(R1003C3)*RC3,0)+R4C -> 10463 | G895: =ROUND((R1003C-R4C)/(R1003C3)*RC3,0)+R4C -> 8176 | H895: =ROUND((R1003C-R4C)/(R1003C3)*RC3,0)+R4C -> 23140 | I895: =ROUND((R1003C-R4C)/(R1003C3)*RC3,0)+R4C -> 4203 | J895: =ROUND((R1003C-R4C)/(R1003C3)*RC3,0)+R4C -> 2273 | K895: =ROUND((R1003C-R4C)/(R1003C3)*RC3,0)+R4C -> 32419 | O895: =RC[-4]-R[-1]C[-4] -> 36 | P895: =RC[-1]-R[-1]C[-1] -> 0
B896: =R[-3]C+1 -> 298 | C896: =R[-1]C+RC[1] -> 892 | D896: 1 | F896: =ROUND((R1003C-R4C)/(R1003C3)*RC3,0)+R4C -> 10475 | G896: =ROUND((R1003C-R4C)/(R1003C3)*RC3,0)+R4C -> 8185 | H896: =ROUND((R1003C-R4C)/(R1003C3)*RC3,0)+R4C -> 23166 | I896: =ROUND((R1003C-R4C)/(R1003C3)*RC3,0)+R4C -> 4208 | J896: =ROUND((R1003C-R4C)/(R1003C3)*RC3,0)+R4C -> 2276 | K896: =ROUND((R1003C-R4C)/(R1003C3)*RC3,0)+R4C -> 32456 | O896: =RC[-4]-R[-1]C[-4] -> 37 | P896: =RC[-1]-R[-1]C[-1] -> 1
B897: =R[-3]C+1 -> 298 | C897: =R[-1]C+RC[1] -> 893 | D897: 1 | F897: =ROUND((R1003C-R4C)/(R1003C3)*RC3,0)+R4C -> 10486 | G897: =ROUND((R1003C-R4C)/(R1003C3)*RC3,0)+R4C -> 8194 | H897: =ROUND((R1003C-R4C)/(R1003C3)*RC3,0)+R4C -> 23192 | I897: =ROUND((R1003C-R4C)/(R1003C3)*RC3,0)+R4C -> 4213 | J897: =ROUND((R1003C-R4C)/(R1003C3)*RC3,0)+R4C -> 2278 | K897: =ROUND((R1003C-R4C)/(R1003C3)*RC3,0)+R4C -> 32492 | O897: =RC[-4]-R[-1]C[-4] -> 36 | P897: =RC[-1]-R[-1]C[-1] -> -1
B898: =R[-3]C+1 -> 299 | C898: =R[-1]C+RC[1] -> 894 | D898: 1 | F898: =ROUND((R1003C-R4C)/(R1003C3)*RC3,0)+R4C -> 10498 | G898: =ROUND((R1003C-R4C)/(R1003C3)*RC3,0)+R4C -> 8203 | H898: =ROUND((R1003C-R4C)/(R1003C3)*RC3,0)+R4C -> 23217 | I898: =ROUND((R1003C-R4C)/(R1003C3)*RC3,0)+R4C -> 4217 | J898: =ROUND((R1003C-R4C)/(R1003C3)*RC3,0)+R4C -> 2281 | K898: =ROUND((R1003C-R4C)/(R1003C3)*RC3,0)+R4C -> 32528 | O898: =RC[-4]-R[-1]C[-4] -> 36 | P898: =RC[-1]-R[-1]C[-1] -> 0
B899: =R[-3]C+1 -> 299 | C899: =R[-1]C+RC[1] -> 895 | D899: 1 | F899: =ROUND((R1003C-R4C)/(R1003C3)*RC3,0)+R4C -> 10510 | G899: =ROUND((R1003C-R4C)/(R1003C3)*RC3,0)+R4C -> 8212 | H899: =ROUND((R1003C-R4C)/(R1003C3)*RC3,0)+R4C -> 23243 | I899: =ROUND((R1003C-R4C)/(R1003C3)*RC3,0)+R4C -> 4222 | J899: =ROUND((R1003C-R4C)/(R1003C3)*RC3,0)+R4C -> 2283 | K899: =ROUND((R1003C-R4C)/(R1003C3)*RC3,0)+R4C -> 32564 | O899: =RC[-4]-R[-1]C[-4] -> 36 | P899: =RC[-1]-R[-1]C[-1] -> 0
B900: =R[-3]C+1 -> 299 | C900: =R[-1]C+RC[1] -> 896 | D900: 1 | F900: =ROUND((R1003C-R4C)/(R1003C3)*RC3,0)+R4C -> 10521 | G900: =ROUND((R1003C-R4C)/(R1003C3)*RC3,0)+R4C -> 8221 | H900: =ROUND((R1003C-R4C)/(R1003C3)*RC3,0)+R4C -> 23269 | I900: =ROUND((R1003C-R4C)/(R1003C3)*RC3,0)+R4C -> 4227 | J900: =ROUND((R1003C-R4C)/(R1003C3)*RC3,0)+R4C -> 2286 | K900: =ROUND((R1003C-R4C)/(R1003C3)*RC3,0)+R4C -> 32600 | O900: =RC[-4]-R[-1]C[-4] -> 36 | P900: =RC[-1]-R[-1]C[-1] -> 0
B901: =R[-3]C+1 -> 300 | C901: =R[-1]C+RC[1] -> 897 | D901: 1 | F901: =ROUND((R1003C-R4C)/(R1003C3)*RC3,0)+R4C -> 10533 | G901: =ROUND((R1003C-R4C)/(R1003C3)*RC3,0)+R4C -> 8230 | H901: =ROUND((R1003C-R4C)/(R1003C3)*RC3,0)+R4C -> 23295 | I901: =ROUND((R1003C-R4C)/(R1003C3)*RC3,0)+R4C -> 4232 | J901: =ROUND((R1003C-R4C)/(R1003C3)*RC3,0)+R4C -> 2288 | K901: =ROUND((R1003C-R4C)/(R1003C3)*RC3,0)+R4C -> 32637 | O901: =RC[-4]-R[-1]C[-4] -> 37 | P901: =RC[-1]-R[-1]C[-1] -> 1
B902: =R[-3]C+1 -> 300 | C902: =R[-1]C+RC[1] -> 898 | D902: 1 | F902: =ROUND((R1003C-R4C)/(R1003C3)*RC3,0)+R4C -> 10545 | G902: =ROUND((R1003C-R4C)/(R1003C3)*RC3,0)+R4C -> 8239 | H902: =ROUND((R1003C-R4C)/(R1003C3)*RC3,0)+R4C -> 23321 | I902: =ROUND((R1003C-R4C)/(R1003C3)*RC3,0)+R4C -> 4236 | J902: =ROUND((R1003C-R4C)/(R1003C3)*RC3,0)+R4C -> 2291 | K902: =ROUND((R1003C-R4C)/(R1003C3)*RC3,0)+R4C -> 32673 | O902: =RC[-4]-R[-1]C[-4] -> 36 | P902: =RC[-1]-R[-1]C[-1] -> -1
B903: =R[-3]C+1 -> 300 | C903: =R[-1]C+RC[1] -> 899 | D903: 1 | F903: =ROUND((R1003C-R4C)/(R1003C3)*RC3,0)+R4C -> 10556 | G903: =ROUND((R1003C-R4C)/(R1003C3)*RC3,0)+R4C -> 8249 | H903: =ROUND((R1003C-R4C)/(R1003C3)*RC3,0)+R4C -> 23347 | I903: =ROUND((R1003C-R4C)/(R1003C3)*RC3,0)+R4C -> 4241 | J903: =ROUND((R1003C-R4C)/(R1003C3)*RC3,0)+R4C -> 2293 | K903: =ROUND((R1003C-R4C)/(R1003C3)*RC3,0)+R4C -> 32709 | O903: =RC[-4]-R[-1]C[-4] -> 36 | P903: =RC[-1]-R[-1]C[-1] -> 0
B904: =R[-3]C+1 -> 301 | C904: =R[-1]C+RC[1] -> 900 | D904: 1 | F904: =ROUND((R1003C-R4C)/(R1003C3)*RC3,0)+R4C -> 10568 | G904: =ROUND((R1003C-R4C)/(R1003C3)*RC3,0)+R4C -> 8258 | H904: =ROUND((R1003C-R4C)/(R1003C3)*RC3,0)+R4C -> 23372 | I904: =ROUND((R1003C-R4C)/(R1003C3)*RC3,0)+R4C -> 4246 | J904: =ROUND((R1003C-R4C)/(R1003C3)*RC3,0)+R4C -> 2296 | K904: =ROUND((R1003C-R4C)/(R1003C3)*RC3,0)+R4C -> 32745 | O904: =RC[-4]-R[-1]C[-4] -> 36 | P904: =RC[-1]-R[-1]C[-1] -> 0
B905: =R[-3]C+1 -> 301 | C905: =R[-1]C+RC[1] -> 901 | D905: 1 | F905: =ROUND((R1003C-R4C)/(R1003C3)*RC3,0)+R4C -> 10580 | G905: =ROUND((R1003C-R4C)/(R1003C3)*RC3,0)+R4C -> 8267 | H905: =ROUND((R1003C-R4C)/(R1003C3)*RC3,0)+R4C -> 23398 | I905: =ROUND((R1003C-R4C)/(R1003C3)*RC3,0)+R4C -> 4250 | J905: =ROUND((R1003C-R4C)/(R1003C3)*RC3,0)+R4C -> 2298 | K905: =ROUND((R1003C-R4C)/(R1003C3)*RC3,0)+R4C -> 32781 | O905: =RC[-4]-R[-1]C[-4] -> 36 | P905: =RC[-1]-R[-1]C[-1] -> 0
B906: =R[-3]C+1 -> 301 | C906: =R[-1]C+RC[1] -> 902 | D906: 1 | F906: =ROUND((R1003C-R4C)/(R1003C3)*RC3,0)+R4C -> 10591 | G906: =ROUND((R1003C-R4C)/(R1003C3)*RC3,0)+R4C -> 8276 | H906: =ROUND((R1003C-R4C)/(R1003C3)*RC3,0)+R4C -> 23424 | I906: =ROUND((R1003C-R4C)/(R1003C3)*RC3,0)+R4C -> 4255 | J906: =ROUND((R1003C-R4C)/(R1003C3)*RC3,0)+R4C -> 2301 | K906: =ROUND((R1003C-R4C)/(R1003C3)*RC3,0)+R4C -> 32817 | O906: =RC[-4]-R[-1]C[-4] -> 36 | P906: =RC[-1]-R[-1]C[-1] -> 0
B907: =R[-3]C+1 -> 302 | C907: =R[-1]C+RC[1] -> 903 | D907: 1 | F907: =ROUND((R1003C-R4C)/(R1003C3)*RC3,0)+R4C -> 10603 | G907: =ROUND((R1003C-R4C)/(R1003C3)*RC3,0)+R4C -> 8285 | H907: =ROUND((R1003C-R4C)/(R1003C3)*RC3,0)+R4C -> 23450 | I907: =ROUND((R1003C-R4C)/(R1003C3)*RC3,0)+R4C -> 4260 | J907: =ROUND((R1003C-R4C)/(R1003C3)*RC3,0)+R4C -> 2303 | K907: =ROUND((R1003C-R4C)/(R1003C3)*RC3,0)+R4C -> 32854 | O907: =RC[-4]-R[-1]C[-4] -> 37 | P907: =RC[-1]-R[-1]C[-1] -> 1
B908: =R[-3]C+1 -> 302 | C908: =R[-1]C+RC[1] -> 904 | D908: 1 | F908: =ROUND((R1003C-R4C)/(R1003C3)*RC3,0)+R4C -> 10615 | G908: =ROUND((R1003C-R4C)/(R1003C3)*RC3,0)+R4C -> 8294 | H908: =ROUND((R1003C-R4C)/(R1003C3)*RC3,0)+R4C -> 23476 | I908: =ROUND((R1003C-R4C)/(R1003C3)*RC3,0)+R4C -> 4264 | J908: =ROUND((R1003C-R4C)/(R1003C3)*RC3,0)+R4C -> 2306 | K908: =ROUND((R1003C-R4C)/(R1003C3)*RC3,0)+R4C -> 32890 | O908: =RC[-4]-R[-1]C[-4] -> 36 | P908: =RC[-1]-R[-1]C[-1] -> -1
B909: =R[-3]C+1 -> 302 | C909: =R[-1]C+RC[1] -> 905 | D909: 1 | F909: =ROUND((R1003C-R4C)/(R1003C3)*RC3,0)+R4C -> 10626 | G909: =ROUND((R1003C-R4C)/(R1003C3)*RC3,0)+R4C -> 8303 | H909: =ROUND((R1003C-R4C)/(R1003C3)*RC3,0)+R4C -> 23501 | I909: =ROUND((R1003C-R4C)/(R1003C3)*RC3,0)+R4C -> 4269 | J909: =ROUND((R1003C-R4C)/(R1003C3)*RC3,0)+R4C -> 2309 | K909: =ROUND((R1003C-R4C)/(R1003C3)*RC3,0)+R4C -> 32926 | O909: =RC[-4]-R[-1]C[-4] -> 36 | P909: =RC[-1]-R[-1]C[-1] -> 0
B910: =R[-3]C+1 -> 303 | C910: =R[-1]C+RC[1] -> 906 | D910: 1 | F910: =ROUND((R1003C-R4C)/(R1003C3)*RC3,0)+R4C -> 10638 | G910: =ROUND((R1003C-R4C)/(R1003C3)*RC3,0)+R4C -> 8312 | H910: =ROUND((R1003C-R4C)/(R1003C3)*RC3,0)+R4C -> 23527 | I910: =ROUND((R1003C-R4C)/(R1003C3)*RC3,0)+R4C -> 4274 | J910: =ROUND((R1003C-R4C)/(R1003C3)*RC3,0)+R4C -> 2311 | K910: =ROUND((R1003C-R4C)/(R1003C3)*RC3,0)+R4C -> 32962 | O910: =RC[-4]-R[-1]C[-4] -> 36 | P910: =RC[-1]-R[-1]C[-1] -> 0
B911: =R[-3]C+1 -> 303 | C911: =R[-1]C+RC[1] -> 907 | D911: 1 | F911: =ROUND((R1003C-R4C)/(R1003C3)*RC3,0)+R4C -> 10650 | G911: =ROUND((R1003C-R4C)/(R1003C3)*RC3,0)+R4C -> 8322 | H911: =ROUND((R1003C-R4C)/(R1003C3)*RC3,0)+R4C -> 23553 | I911: =ROUND((R1003C-R4C)/(R1003C3)*RC3,0)+R4C -> 4278 | J911: =ROUND((R1003C-R4C)/(R1003C3)*RC3,0)+R4C -> 2314 | K911: =ROUND((R1003C-R4C)/(R1003C3)*RC3,0)+R4C -> 32998 | O911: =RC[-4]-R[-1]C[-4] -> 36 | P911: =RC[-1]-R[-1]C[-1] -> 0
B912: =R[-3]C+1 -> 303 | C912: =R[-1]C+RC[1] -> 908 | D912: 1 | F912: =ROUND((R1003C-R4C)/(R1003C3)*RC3,0)+R4C -> 10661 | G912: =ROUND((R1003C-R4C)/(R1003C3)*RC3,0)+R4C -> 8331 | H912: =ROUND((R1003C-R4C)/(R1003C3)*RC3,0)+R4C -> 23579 | I912: =ROUND((R1003C-R4C)/(R1003C3)*RC3,0)+R4C -> 4283 | J912: =ROUND((R1003C-R4C)/(R1003C3)*RC3,0)+R4C -> 2316 | K912: =ROUND((R1003C-R4C)/(R1003C3)*RC3,0)+R4C -> 33035 | O912: =RC[-4]-R[-1]C[-4] -> 37 | P912: =RC[-1]-R[-1]C[-1] -> 1
B913: =R[-3]C+1 -> 304 | C913: =R[-1]C+RC[1] -> 909 | D913: 1 | F913: =ROUND((R1003C-R4C)/(R1003C3)*RC3,0)+R4C -> 10673 | G913: =ROUND((R1003C-R4C)/(R1003C3)*RC3,0)+R4C -> 8340 | H913: =ROUND((R1003C-R4C)/(R1003C3)*RC3,0)+R4C -> 23605 | I913: =ROUND((R1003C-R4C)/(R1003C3)*RC3,0)+R4C -> 4288 | J913: =ROUND((R1003C-R4C)/(R1003C3)*RC3,0)+R4C -> 2319 | K913: =ROUND((R1003C-R4C)/(R1003C3)*RC3,0)+R4C -> 33071 | O913: =RC[-4]-R[-1]C[-4] -> 36 | P913: =RC[-1]-R[-1]C[-1] -> -1
B914: =R[-3]C+1 -> 304 | C914: =R[-1]C+RC[1] -> 910 | D914: 1 | F914: =ROUND((R1003C-R4C)/(R1003C3)*RC3,0)+R4C -> 10685 | G914: =ROUND((R1003C-R4C)/(R1003C3)*RC3,0)+R4C -> 8349 | H914: =ROUND((R1003C-R4C)/(R1003C3)*RC3,0)+R4C -> 23631 | I914: =ROUND((R1003C-R4C)/(R1003C3)*RC3,0)+R4C -> 4293 | J914: =ROUND((R1003C-R4C)/(R1003C3)*RC3,0)+R4C -> 2321 | K914: =ROUND((R1003C-R4C)/(R1003C3)*RC3,0)+R4C -> 33107 | O914: =RC[-4]-R[-1]C[-4] -> 36 | P914: =RC[-1]-R[-1]C[-1] -> 0
B915: =R[-3]C+1 -> 304 | C915: =R[-1]C+RC[1] -> 911 | D915: 1 | F915: =ROUND((R1003C-R4C)/(R1003C3)*RC3,0)+R4C -> 10696 | G915: =ROUND((R1003C-R4C)/(R1003C3)*RC3,0)+R4C -> 8358 | H915: =ROUND((R1003C-R4C)/(R1003C3)*RC3,0)+R4C -> 23656 | I915: =ROUND((R1003C-R4C)/(R1003C3)*RC3,0)+R4C -> 4297 | J915: =ROUND((R1003C-R4C)/(R1003C3)*RC3,0)+R4C -> 2324 | K915: =ROUND((R1003C-R4C)/(R1003C3)*RC3,0)+R4C -> 33143 | O915: =RC[-4]-R[-1]C[-4] -> 36 | P915: =RC[-1]-R[-1]C[-1] -> 0
B916: =R[-3]C+1 -> 305 | C916: =R[-1]C+RC[1] -> 912 | D916: 1 | F916: =ROUND((R1003C-R4C)/(R1003C3)*RC3,0)+R4C -> 10708 | G916: =ROUND((R1003C-R4C)/(R1003C3)*RC3,0)+R4C -> 8367 | H916: =ROUND((R1003C-R4C)/(R1003C3)*RC3,0)+R4C -> 23682 | I916: =ROUND((R1003C-R4C)/(R1003C3)*RC3,0)+R4C -> 4302 | J916: =ROUND((R1003C-R4C)/(R1003C3)*RC3,0)+R4C -> 2326 | K916: =ROUND((R1003C-R4C)/(R1003C3)*RC3,0)+R4C -> 33179 | O916: =RC[-4]-R[-1]C[-4] -> 36 | P916: =RC[-1]-R[-1]C[-1] -> 0
B917: =R[-3]C+1 -> 305 | C917: =R[-1]C+RC[1] -> 913 | D917: 1 | F917: =ROUND((R1003C-R4C)/(R1003C3)*RC3,0)+R4C -> 10720 | G917: =ROUND((R1003C-R4C)/(R1003C3)*RC3,0)+R4C -> 8376 | H917: =ROUND((R1003C-R4C)/(R1003C3)*RC3,0)+R4C -> 23708 | I917: =ROUND((R1003C-R4C)/(R1003C3)*RC3,0)+R4C -> 4307 | J917: =ROUND((R1003C-R4C)/(R1003C3)*RC3,0)+R4C -> 2329 | K917: =ROUND((R1003C-R4C)/(R1003C3)*RC3,0)+R4C -> 33215 | O917: =RC[-4]-R[-1]C[-4] -> 36 | P917: =RC[-1]-R[-1]C[-1] -> 0
B918: =R[-3]C+1 -> 305 | C918: =R[-1]C+RC[1] -> 914 | D918: 1 | F918: =ROUND((R1003C-R4C)/(R1003C3)*RC3,0)+R4C -> 10731 | G918: =ROUND((R1003C-R4C)/(R1003C3)*RC3,0)+R4C -> 8385 | H918: =ROUND((R1003C-R4C)/(R1003C3)*RC3,0)+R4C -> 23734 | I918: =ROUND((R1003C-R4C)/(R1003C3)*RC3,0)+R4C -> 4311 | J918: =ROUND((R1003C-R4C)/(R1003C3)*RC3,0)+R4C -> 2331 | K918: =ROUND((R1003C-R4C)/(R1003C3)*RC3,0)+R4C -> 33252 | O918: =RC[-4]-R[-1]C[-4] -> 37 | P918: =RC[-1]-R[-1]C[-1] -> 1
B919: =R[-3]C+1 -> 306 | C919: =R[-1]C+RC[1] -> 915 | D919: 1 | F919: =ROUND((R1003C-R4C)/(R1003C3)*RC3,0)+R4C -> 10743 | G919: =ROUND((R1003C-R4C)/(R1003C3)*RC3,0)+R4C -> 8395 | H919: =ROUND((R1003C-R4C)/(R1003C3)*RC3,0)+R4C -> 23760 | I919: =ROUND((R1003C-R4C)/(R1003C3)*RC3,0)+R4C -> 4316 | J919: =ROUND((R1003C-R4C)/(R1003C3)*RC3,0)+R4C -> 2334 | K919: =ROUND((R1003C-R4C)/(R1003C3)*RC3,0)+R4C -> 33288 | O919: =RC[-4]-R[-1]C[-4] -> 36 | P919: =RC[-1]-R[-1]C[-1] -> -1
B920: =R[-3]C+1 -> 306 | C920: =R[-1]C+RC[1] -> 916 | D920: 1 | F920: =ROUND((R1003C-R4C)/(R1003C3)*RC3,0)+R4C -> 10755 | G920: =ROUND((R1003C-R4C)/(R1003C3)*RC3,0)+R4C -> 8404 | H920: =ROUND((R1003C-R4C)/(R1003C3)*RC3,0)+R4C -> 23786 | I920: =ROUND((R1003C-R4C)/(R1003C3)*RC3,0)+R4C -> 4321 | J920: =ROUND((R1003C-R4C)/(R1003C3)*RC3,0)+R4C -> 2336 | K920: =ROUND((R1003C-R4C)/(R1003C3)*RC3,0)+R4C -> 33324 | O920: =RC[-4]-R[-1]C[-4] -> 36 | P920: =RC[-1]-R[-1]C[-1] -> 0
B921: =R[-3]C+1 -> 306 | C921: =R[-1]C+RC[1] -> 917 | D921: 1 | F921: =ROUND((R1003C-R4C)/(R1003C3)*RC3,0)+R4C -> 10767 | G921: =ROUND((R1003C-R4C)/(R1003C3)*RC3,0)+R4C -> 8413 | H921: =ROUND((R1003C-R4C)/(R1003C3)*RC3,0)+R4C -> 23811 | I921: =ROUND((R1003C-R4C)/(R1003C3)*RC3,0)+R4C -> 4325 | J921: =ROUND((R1003C-R4C)/(R1003C3)*RC3,0)+R4C -> 2339 | K921: =ROUND((R1003C-R4C)/(R1003C3)*RC3,0)+R4C -> 33360 | O921: =RC[-4]-R[-1]C[-4] -> 36 | P921: =RC[-1]-R[-1]C[-1] -> 0
B922: =R[-3]C+1 -> 307 | C922: =R[-1]C+RC[1] -> 918 | D922: 1 | F922: =ROUND((R1003C-R4C)/(R1003C3)*RC3,0)+R4C -> 10778 | G922: =ROUND((R1003C-R4C)/(R1003C3)*RC3,0)+R4C -> 8422 | H922: =ROUND((R1003C-R4C)/(R1003C3)*RC3,0)+R4C -> 23837 | I922: =ROUND((R1003C-R4C)/(R1003C3)*RC3,0)+R4C -> 4330 | J922: =ROUND((R1003C-R4C)/(R1003C3)*RC3,0)+R4C -> 2342 | K922: =ROUND((R1003C-R4C)/(R1003C3)*RC3,0)+R4C -> 33396 | O922: =RC[-4]-R[-1]C[-4] -> 36 | P922: =RC[-1]-R[-1]C[-1] -> 0
B923: =R[-3]C+1 -> 307 | C923: =R[-1]C+RC[1] -> 919 | D923: 1 | F923: =ROUND((R1003C-R4C)/(R1003C3)*RC3,0)+R4C -> 10790 | G923: =ROUND((R1003C-R4C)/(R1003C3)*RC3,0)+R4C -> 8431 | H923: =ROUND((R1003C-R4C)/(R1003C3)*RC3,0)+R4C -> 23863 | I923: =ROUND((R1003C-R4C)/(R1003C3)*RC3,0)+R4C -> 4335 | J923: =ROUND((R1003C-R4C)/(R1003C3)*RC3,0)+R4C -> 2344 | K923: =ROUND((R1003C-R4C)/(R1003C3)*RC3,0)+R4C -> 33433 | O923: =RC[-4]-R[-1]C[-4] -> 37 | P923: =RC[-1]-R[-1]C[-1] -> 1
B924: =R[-3]C+1 -> 307 | C924: =R[-1]C+RC[1] -> 920 | D924: 1 | F924: =ROUND((R1003C-R4C)/(R1003C3)*RC3,0)+R4C -> 10802 | G924: =ROUND((R1003C-R4C)/(R1003C3)*RC3,0)+R4C -> 8440 | H924: =ROUND((R1003C-R4C)/(R1003C3)*RC3,0)+R4C -> 23889 | I924: =ROUND((R1003C-R4C)/(R1003C3)*RC3,0)+R4C -> 4339 | J924: =ROUND((R1003C-R4C)/(R1003C3)*RC3,0)+R4C -> 2347 | K924: =ROUND((R1003C-R4C)/(R1003C3)*RC3,0)+R4C -> 33469 | O924: =RC[-4]-R[-1]C[-4] -> 36 | P924: =RC[-1]-R[-1]C[-1] -> -1
B925: =R[-3]C+1 -> 308 | C925: =R[-1]C+RC[1] -> 921 | D925: 1 | F925: =ROUND((R1003C-R4C)/(R1003C3)*RC3,0)+R4C -> 10813 | G925: =ROUND((R1003C-R4C)/(R1003C3)*RC3,0)+R4C -> 8449 | H925: =ROUND((R1003C-R4C)/(R1003C3)*RC3,0)+R4C -> 23915 | I925: =ROUND((R1003C-R4C)/(R1003C3)*RC3,0)+R4C -> 4344 | J925: =ROUND((R1003C-R4C)/(R1003C3)*RC3,0)+R4C -> 2349 | K925: =ROUND((R1003C-R4C)/(R1003C3)*RC3,0)+R4C -> 33505 | O925: =RC[-4]-R[-1]C[-4] -> 36 | P925: =RC[-1]-R[-1]C[-1] -> 0
B926: =R[-3]C+1 -> 308 | C926: =R[-1]C+RC[1] -> 922 | D926: 1 | F926: =ROUND((R1003C-R4C)/(R1003C3)*RC3,0)+R4C -> 10825 | G926: =ROUND((R1003C-R4C)/(R1003C3)*RC3,0)+R4C -> 8458 | H926: =ROUND((R1003C-R4C)/(R1003C3)*RC3,0)+R4C -> 23940 | I926: =ROUND((R1003C-R4C)/(R1003C3)*RC3,0)+R4C -> 4349 | J926: =ROUND((R1003C-R4C)/(R1003C3)*RC3,0)+R4C -> 2352 | K926: =ROUND((R1003C-R4C)/(R1003C3)*RC3,0)+R4C -> 33541 | O926: =RC[-4]-R[-1]C[-4] -> 36 | P926: =RC[-1]-R[-1]C[-1] -> 0
B927: =R[-3]C+1 -> 308 | C927: =R[-1]C+RC[1] -> 923 | D927: 1 | F927: =ROUND((R1003C-R4C)/(R1003C3)*RC3,0)+R4C -> 10837 | G927: =ROUND((R1003C-R4C)/(R1003C3)*RC3,0)+R4C -> 8468 | H927: =ROUND((R1003C-R4C)/(R1003C3)*RC3,0)+R4C -> 23966 | I927: =ROUND((R1003C-R4C)/(R1003C3)*RC3,0)+R4C -> 4354 | J927: =ROUND((R1003C-R4C)/(R1003C3)*RC3,0)+R4C -> 2354 | K927: =ROUND((R1003C-R4C)/(R1003C3)*RC3,0)+R4C -> 33577 | O927: =RC[-4]-R[-1]C[-4] -> 36 | P927: =RC[-1]-R[-1]C[-1] -> 0
B928: =R[-3]C+1 -> 309 | C928: =R[-1]C+RC[1] -> 924 | D928: 1 | F928: =ROUND((R1003C-R4C)/(R1003C3)*RC3,0)+R4C -> 10848 | G928: =ROUND((R1003C-R4C)/(R1003C3)*RC3,0)+R4C -> 8477 | H928: =ROUND((R1003C-R4C)/(R1003C3)*RC3,0)+R4C -> 23992 | I928: =ROUND((R1003C-R4C)/(R1003C3)*RC3,0)+R4C -> 4358 | J928: =ROUND((R1003C-R4C)/(R1003C3)*RC3,0)+R4C -> 2357 | K928: =ROUND((R1003C-R4C)/(R1003C3)*RC3,0)+R4C -> 33613 | O928: =RC[-4]-R[-1]C[-4] -> 36 | P928: =RC[-1]-R[-1]C[-1] -> 0
B929: =R[-3]C+1 -> 309 | C929: =R[-1]C+RC[1] -> 925 | D929: 1 | F929: =ROUND((R1003C-R4C)/(R1003C3)*RC3,0)+R4C -> 10860 | G929: =ROUND((R1003C-R4C)/(R1003C3)*RC3,0)+R4C -> 8486 | H929: =ROUND((R1003C-R4C)/(R1003C3)*RC3,0)+R4C -> 24018 | I929: =ROUND((R1003C-R4C)/(R1003C3)*RC3,0)+R4C -> 4363 | J929: =ROUND((R1003C-R4C)/(R1003C3)*RC3,0)+R4C -> 2359 | K929: =ROUND((R1003C-R4C)/(R1003C3)*RC3,0)+R4C -> 33650 | O929: =RC[-4]-R[-1]C[-4] -> 37 | P929: =RC[-1]-R[-1]C[-1] -> 1
B930: =R[-3]C+1 -> 309 | C930: =R[-1]C+RC[1] -> 926 | D930: 1 | F930: =ROUND((R1003C-R4C)/(R1003C3)*RC3,0)+R4C -> 10872 | G930: =ROUND((R1003C-R4C)/(R1003C3)*RC3,0)+R4C -> 8495 | H930: =ROUND((R1003C-R4C)/(R1003C3)*RC3,0)+R4C -> 24044 | I930: =ROUND((R1003C-R4C)/(R1003C3)*RC3,0)+R4C -> 4368 | J930: =ROUND((R1003C-R4C)/(R1003C3)*RC3,0)+R4C -> 2362 | K930: =ROUND((R1003C-R4C)/(R1003C3)*RC3,0)+R4C -> 33686 | O930: =RC[-4]-R[-1]C[-4] -> 36 | P930: =RC[-1]-R[-1]C[-1] -> -1
B931: =R[-3]C+1 -> 310 | C931: =R[-1]C+RC[1] -> 927 | D931: 1 | F931: =ROUND((R1003C-R4C)/(R1003C3)*RC3,0)+R4C -> 10883 | G931: =ROUND((R1003C-R4C)/(R1003C3)*RC3,0)+R4C -> 8504 | H931: =ROUND((R1003C-R4C)/(R1003C3)*RC3,0)+R4C -> 24070 | I931: =ROUND((R1003C-R4C)/(R1003C3)*RC3,0)+R4C -> 4372 | J931: =ROUND((R1003C-R4C)/(R1003C3)*RC3,0)+R4C -> 2364 | K931: =ROUND((R1003C-R4C)/(R1003C3)*RC3,0)+R4C -> 33722 | O931: =RC[-4]-R[-1]C[-4] -> 36 | P931: =RC[-1]-R[-1]C[-1] -> 0
B932: =R[-3]C+1 -> 310 | C932: =R[-1]C+RC[1] -> 928 | D932: 1 | F932: =ROUND((R1003C-R4C)/(R1003C3)*RC3,0)+R4C -> 10895 | G932: =ROUND((R1003C-R4C)/(R1003C3)*RC3,0)+R4C -> 8513 | H932: =ROUND((R1003C-R4C)/(R1003C3)*RC3,0)+R4C -> 24095 | I932: =ROUND((R1003C-R4C)/(R1003C3)*RC3,0)+R4C -> 4377 | J932: =ROUND((R1003C-R4C)/(R1003C3)*RC3,0)+R4C -> 2367 | K932: =ROUND((R1003C-R4C)/(R1003C3)*RC3,0)+R4C -> 33758 | O932: =RC[-4]-R[-1]C[-4] -> 36 | P932: =RC[-1]-R[-1]C[-1] -> 0
B933: =R[-3]C+1 -> 310 | C933: =R[-1]C+RC[1] -> 929 | D933: 1 | F933: =ROUND((R1003C-R4C)/(R1003C3)*RC3,0)+R4C -> 10907 | G933: =ROUND((R1003C-R4C)/(R1003C3)*RC3,0)+R4C -> 8522 | H933: =ROUND((R1003C-R4C)/(R1003C3)*RC3,0)+R4C -> 24121 | I933: =ROUND((R1003C-R4C)/(R1003C3)*RC3,0)+R4C -> 4382 | J933: =ROUND((R1003C-R4C)/(R1003C3)*RC3,0)+R4C -> 2369 | K933: =ROUND((R1003C-R4C)/(R1003C3)*RC3,0)+R4C -> 33794 | O933: =RC[-4]-R[-1]C[-4] -> 36 | P933: =RC[-1]-R[-1]C[-1] -> 0
B934: =R[-3]C+1 -> 311 | C934: =R[-1]C+RC[1] -> 930 | D934: 1 | F934: =ROUND((R1003C-R4C)/(R1003C3)*RC3,0)+R4C -> 10918 | G934: =ROUND((R1003C-R4C)/(R1003C3)*RC3,0)+R4C -> 8531 | H934: =ROUND((R1003C-R4C)/(R1003C3)*RC3,0)+R4C -> 24147 | I934: =ROUND((R1003C-R4C)/(R1003C3)*RC3,0)+R4C -> 4386 | J934: =ROUND((R1003C-R4C)/(R1003C3)*RC3,0)+R4C -> 2372 | K934: =ROUND((R1003C-R4C)/(R1003C3)*RC3,0)+R4C -> 33830 | O934: =RC[-4]-R[-1]C[-4] -> 36 | P934: =RC[-1]-R[-1]C[-1] -> 0
B935: =R[-3]C+1 -> 311 | C935: =R[-1]C+RC[1] -> 931 | D935: 1 | F935: =ROUND((R1003C-R4C)/(R1003C3)*RC3,0)+R4C -> 10930 | G935: =ROUND((R1003C-R4C)/(R1003C3)*RC3,0)+R4C -> 8541 | H935: =ROUND((R1003C-R4C)/(R1003C3)*RC3,0)+R4C -> 24173 | I935: =ROUND((R1003C-R4C)/(R1003C3)*RC3,0)+R4C -> 4391 | J935: =ROUND((R1003C-R4C)/(R1003C3)*RC3,0)+R4C -> 2375 | K935: =ROUND((R1003C-R4C)/(R1003C3)*RC3,0)+R4C -> 33867 | O935: =RC[-4]-R[-1]C[-4] -> 37 | P935: =RC[-1]-R[-1]C[-1] -> 1
B936: =R[-3]C+1 -> 311 | C936: =R[-1]C+RC[1] -> 932 | D936: 1 | F936: =ROUND((R1003C-R4C)/(R1003C3)*RC3,0)+R4C -> 10942 | G936: =ROUND((R1003C-R4C)/(R1003C3)*RC3,0)+R4C -> 8550 | H936: =ROUND((R1003C-R4C)/(R1003C3)*RC3,0)+R4C -> 24199 | I936: =ROUND((R1003C-R4C)/(R1003C3)*RC3,0)+R4C -> 4396 | J936: =ROUND((R1003C-R4C)/(R1003C3)*RC3,0)+R4C -> 2377 | K936: =ROUND((R1003C-R4C)/(R1003C3)*RC3,0)+R4C -> 33903 | O936: =RC[-4]-R[-1]C[-4] -> 36 | P936: =RC[-1]-R[-1]C[-1] -> -1
B937: =R[-3]C+1 -> 312 | C937: =R[-1]C+RC[1] -> 933 | D937: 1 | F937: =ROUND((R1003C-R4C)/(R1003C3)*RC3,0)+R4C -> 10953 | G937: =ROUND((R1003C-R4C)/(R1003C3)*RC3,0)+R4C -> 8559 | H937: =ROUND((R1003C-R4C)/(R1003C3)*RC3,0)+R4C -> 24225 | I937: =ROUND((R1003C-R4C)/(R1003C3)*RC3,0)+R4C -> 4400 | J937: =ROUND((R1003C-R4C)/(R1003C3)*RC3,0)+R4C -> 2380 | K937: =ROUND((R1003C-R4C)/(R1003C3)*RC3,0)+R4C -> 33939 | O937: =RC[-4]-R[-1]C[-4] -> 36 | P937: =RC[-1]-R[-1]C[-1] -> 0
B938: =R[-3]C+1 -> 312 | C938: =R[-1]C+RC[1] -> 934 | D938: 1 | F938: =ROUND((R1003C-R4C)/(R1003C3)*RC3,0)+R4C -> 10965 | G938: =ROUND((R1003C-R4C)/(R1003C3)*RC3,0)+R4C -> 8568 | H938: =ROUND((R1003C-R4C)/(R1003C3)*RC3,0)+R4C -> 24250 | I938: =ROUND((R1003C-R4C)/(R1003C3)*RC3,0)+R4C -> 4405 | J938: =ROUND((R1003C-R4C)/(R1003C3)*RC3,0)+R4C -> 2382 | K938: =ROUND((R1003C-R4C)/(R1003C3)*RC3,0)+R4C -> 33975 | O938: =RC[-4]-R[-1]C[-4] -> 36 | P938: =RC[-1]-R[-1]C[-1] -> 0
B939: =R[-3]C+1 -> 312 | C939: =R[-1]C+RC[1] -> 935 | D939: 1 | F939: =ROUND((R1003C-R4C)/(R1003C3)*RC3,0)+R4C -> 10977 | G939: =ROUND((R1003C-R4C)/(R1003C3)*RC3,0)+R4C -> 8577 | H939: =ROUND((R1003C-R4C)/(R1003C3)*RC3,0)+R4C -> 24276 | I939: =ROUND((R1003C-R4C)/(R1003C3)*RC3,0)+R4C -> 4410 | J939: =ROUND((R1003C-R4C)/(R1003C3)*RC3,0)+R4C -> 2385 | K939: =ROUND((R1003C-R4C)/(R1003C3)*RC3,0)+R4C -> 34011 | O939: =RC[-4]-R[-1]C[-4] -> 36 | P939: =RC[-1]-R[-1]C[-1] -> 0
B940: =R[-3]C+1 -> 313 | C940: =R[-1]C+RC[1] -> 936 | D940: 1 | F940: =ROUND((R1003C-R4C)/(R1003C3)*RC3,0)+R4C -> 10988 | G940: =ROUND((R1003C-R4C)/(R1003C3)*RC3,0)+R4C -> 8586 | H940: =ROUND((R1003C-R4C)/(R1003C3)*RC3,0)+R4C -> 24302 | I940: =ROUND((R1003C-R4C)/(R1003C3)*RC3,0)+R4C -> 4414 | J940: =ROUND((R1003C-R4C)/(R1003C3)*RC3,0)+R4C -> 2387 | K940: =ROUND((R1003C-R4C)/(R1003C3)*RC3,0)+R4C -> 34048 | O940: =RC[-4]-R[-1]C[-4] -> 37 | P940: =RC[-1]-R[-1]C[-1] -> 1
B941: =R[-3]C+1 -> 313 | C941: =R[-1]C+RC[1] -> 937 | D941: 1 | F941: =ROUND((R1003C-R4C)/(R1003C3)*RC3,0)+R4C -> 11000 | G941: =ROUND((R1003C-R4C)/(R1003C3)*RC3,0)+R4C -> 8595 | H941: =ROUND((R1003C-R4C)/(R1003C3)*RC3,0)+R4C -> 24328 | I941: =ROUND((R1003C-R4C)/(R1003C3)*RC3,0)+R4C -> 4419 | J941: =ROUND((R1003C-R4C)/(R1003C3)*RC3,0)+R4C -> 2390 | K941: =ROUND((R1003C-R4C)/(R1003C3)*RC3,0)+R4C -> 34084 | O941: =RC[-4]-R[-1]C[-4] -> 36 | P941: =RC[-1]-R[-1]C[-1] -> -1
B942: =R[-3]C+1 -> 313 | C942: =R[-1]C+RC[1] -> 938 | D942: 1 | F942: =ROUND((R1003C-R4C)/(R1003C3)*RC3,0)+R4C -> 11012 | G942: =ROUND((R1003C-R4C)/(R1003C3)*RC3,0)+R4C -> 8604 | H942: =ROUND((R1003C-R4C)/(R1003C3)*RC3,0)+R4C -> 24354 | I942: =ROUND((R1003C-R4C)/(R1003C3)*RC3,0)+R4C -> 4424 | J942: =ROUND((R1003C-R4C)/(R1003C3)*RC3,0)+R4C -> 2392 | K942: =ROUND((R1003C-R4C)/(R1003C3)*RC3,0)+R4C -> 34120 | O942: =RC[-4]-R[-1]C[-4] -> 36 | P942: =RC[-1]-R[-1]C[-1] -> 0
B943: =R[-3]C+1 -> 314 | C943: =R[-1]C+RC[1] -> 939 | D943: 1 | F943: =ROUND((R1003C-R4C)/(R1003C3)*RC3,0)+R4C -> 11023 | G943: =ROUND((R1003C-R4C)/(R1003C3)*RC3,0)+R4C -> 8614 | H943: =ROUND((R1003C-R4C)/(R1003C3)*RC3,0)+R4C -> 24380 | I943: =ROUND((R1003C-R4C)/(R1003C3)*RC3,0)+R4C -> 4429 | J943: =ROUND((R1003C-R4C)/(R1003C3)*RC3,0)+R4C -> 2395 | K943: =ROUND((R1003C-R4C)/(R1003C3)*RC3,0)+R4C -> 34156 | O943: =RC[-4]-R[-1]C[-4] -> 36 | P943: =RC[-1]-R[-1]C[-1] -> 0
B944: =R[-3]C+1 -> 314 | C944: =R[-1]C+RC[1] -> 940 | D944: 1 | F944: =ROUND((R1003C-R4C)/(R1003C3)*RC3,0)+R4C -> 11035 | G944: =ROUND((R1003C-R4C)/(R1003C3)*RC3,0)+R4C -> 8623 | H944: =ROUND((R1003C-R4C)/(R1003C3)*RC3,0)+R4C -> 24405 | I944: =ROUND((R1003C-R4C)/(R1003C3)*RC3,0)+R4C -> 4433 | J944: =ROUND((R1003C-R4C)/(R1003C3)*RC3,0)+R4C -> 2397 | K944: =ROUND((R1003C-R4C)/(R1003C3)*RC3,0)+R4C -> 34192 | O944: =RC[-4]-R[-1]C[-4] -> 36 | P944: =RC[-1]-R[-1]C[-1] -> 0
B945: =R[-3]C+1 -> 314 | C945: =R[-1]C+RC[1] -> 941 | D945: 1 | F945: =ROUND((R1003C-R4C)/(R1003C3)*RC3,0)+R4C -> 11047 | G945: =ROUND((R1003C-R4C)/(R1003C3)*RC3,0)+R4C -> 8632 | H945: =ROUND((R1003C-R4C)/(R1003C3)*RC3,0)+R4C -> 24431 | I945: =ROUND((R1003C-R4C)/(R1003C3)*RC3,0)+R4C -> 4438 | J945: =ROUND((R1003C-R4C)/(R1003C3)*RC3,0)+R4C -> 2400 | K945: =ROUND((R1003C-R4C)/(R1003C3)*RC3,0)+R4C -> 34228 | O945: =RC[-4]-R[-1]C[-4] -> 36 | P945: =RC[-1]-R[-1]C[-1] -> 0
B946: =R[-3]C+1 -> 315 | C946: =R[-1]C+RC[1] -> 942 | D946: 1 | F946: =ROUND((R1003C-R4C)/(R1003C3)*RC3,0)+R4C -> 11058 | G946: =ROUND((R1003C-R4C)/(R1003C3)*RC3,0)+R4C -> 8641 | H946: =ROUND((R1003C-R4C)/(R1003C3)*RC3,0)+R4C -> 24457 | I946: =ROUND((R1003C-R4C)/(R1003C3)*RC3,0)+R4C -> 4443 | J946: =ROUND((R1003C-R4C)/(R1003C3)*RC3,0)+R4C -> 2402 | K946: =ROUND((R1003C-R4C)/(R1003C3)*RC3,0)+R4C -> 34265 | O946: =RC[-4]-R[-1]C[-4] -> 37 | P946: =RC[-1]-R[-1]C[-1] -> 1
B947: =R[-3]C+1 -> 315 | C947: =R[-1]C+RC[1] -> 943 | D947: 1 | F947: =ROUND((R1003C-R4C)/(R1003C3)*RC3,0)+R4C -> 11070 | G947: =ROUND((R1003C-R4C)/(R1003C3)*RC3,0)+R4C -> 8650 | H947: =ROUND((R1003C-R4C)/(R1003C3)*RC3,0)+R4C -> 24483 | I947: =ROUND((R1003C-R4C)/(R1003C3)*RC3,0)+R4C -> 4447 | J947: =ROUND((R1003C-R4C)/(R1003C3)*RC3,0)+R4C -> 2405 | K947: =ROUND((R1003C-R4C)/(R1003C3)*RC3,0)+R4C -> 34301 | O947: =RC[-4]-R[-1]C[-4] -> 36 | P947: =RC[-1]-R[-1]C[-1] -> -1
B948: =R[-3]C+1 -> 315 | C948: =R[-1]C+RC[1] -> 944 | D948: 1 | F948: =ROUND((R1003C-R4C)/(R1003C3)*RC3,0)+R4C -> 11082 | G948: =ROUND((R1003C-R4C)/(R1003C3)*RC3,0)+R4C -> 8659 | H948: =ROUND((R1003C-R4C)/(R1003C3)*RC3,0)+R4C -> 24509 | I948: =ROUND((R1003C-R4C)/(R1003C3)*RC3,0)+R4C -> 4452 | J948: =ROUND((R1003C-R4C)/(R1003C3)*RC3,0)+R4C -> 2407 | K948: =ROUND((R1003C-R4C)/(R1003C3)*RC3,0)+R4C -> 34337 | O948: =RC[-4]-R[-1]C[-4] -> 36 | P948: =RC[-1]-R[-1]C[-1] -> 0
B949: =R[-3]C+1 -> 316 | C949: =R[-1]C+RC[1] -> 945 | D949: 1 | F949: =ROUND((R1003C-R4C)/(R1003C3)*RC3,0)+R4C -> 11093 | G949: =ROUND((R1003C-R4C)/(R1003C3)*RC3,0)+R4C -> 8668 | H949: =ROUND((R1003C-R4C)/(R1003C3)*RC3,0)+R4C -> 24534 | I949: =ROUND((R1003C-R4C)/(R1003C3)*RC3,0)+R4C -> 4457 | J949: =ROUND((R1003C-R4C)/(R1003C3)*RC3,0)+R4C -> 2410 | K949: =ROUND((R1003C-R4C)/(R1003C3)*RC3,0)+R4C -> 34373 | O949: =RC[-4]-R[-1]C[-4] -> 36 | P949: =RC[-1]-R[-1]C[-1] -> 0
B950: =R[-3]C+1 -> 316 | C950: =R[-1]C+RC[1] -> 946 | D950: 1 | F950: =ROUND((R1003C-R4C)/(R1003C3)*RC3,0)+R4C -> 11105 | G950: =ROUND((R1003C-R4C)/(R1003C3)*RC3,0)+R4C -> 8677 | H950: =ROUND((R1003C-R4C)/(R1003C3)*RC3,0)+R4C -> 24560 | I950: =ROUND((R1003C-R4C)/(R1003C3)*RC3,0)+R4C -> 4461 | J950: =ROUND((R1003C-R4C)/(R1003C3)*RC3,0)+R4C -> 2413 | K950: =ROUND((R1003C-R4C)/(R1003C3)*RC3,0)+R4C -> 34409 | O950: =RC[-4]-R[-1]C[-4] -> 36 | P950: =RC[-1]-R[-1]C[-1] -> 0
B951: =R[-3]C+1 -> 316 | C951: =R[-1]C+RC[1] -> 947 | D951: 1 | F951: =ROUND((R1003C-R4C)/(R1003C3)*RC3,0)+R4C -> 11117 | G951: =ROUND((R1003C-R4C)/(R1003C3)*RC3,0)+R4C -> 8687 | H951: =ROUND((R1003C-R4C)/(R1003C3)*RC3,0)+R4C -> 24586 | I951: =ROUND((R1003C-R4C)/(R1003C3)*RC3,0)+R4C -> 4466 | J951: =ROUND((R1003C-R4C)/(R1003C3)*RC3,0)+R4C -> 2415 | K951: =ROUND((R1003C-R4C)/(R1003C3)*RC3,0)+R4C -> 34446 | O951: =RC[-4]-R[-1]C[-4] -> 37 | P951: =RC[-1]-R[-1]C[-1] -> 1
B952: =R[-3]C+1 -> 317 | C952: =R[-1]C+RC[1] -> 948 | D952: 1 | F952: =ROUND((R1003C-R4C)/(R1003C3)*RC3,0)+R4C -> 11128 | G952: =ROUND((R1003C-R4C)/(R1003C3)*RC3,0)+R4C -> 8696 | H952: =ROUND((R1003C-R4C)/(R1003C3)*RC3,0)+R4C -> 24612 | I952: =ROUND((R1003C-R4C)/(R1003C3)*RC3,0)+R4C -> 4471 | J952: =ROUND((R1003C-R4C)/(R1003C3)*RC3,0)+R4C -> 2418 | K952: =ROUND((R1003C-R4C)/(R1003C3)*RC3,0)+R4C -> 34482 | O952: =RC[-4]-R[-1]C[-4] -> 36 | P952: =RC[-1]-R[-1]C[-1] -> -1
B953: =R[-3]C+1 -> 317 | C953: =R[-1]C+RC[1] -> 949 | D953: 1 | F953: =ROUND((R1003C-R4C)/(R1003C3)*RC3,0)+R4C -> 11140 | G953: =ROUND((R1003C-R4C)/(R1003C3)*RC3,0)+R4C -> 8705 | H953: =ROUND((R1003C-R4C)/(R1003C3)*RC3,0)+R4C -> 24638 | I953: =ROUND((R1003C-R4C)/(R1003C3)*RC3,0)+R4C -> 4475 | J953: =ROUND((R1003C-R4C)/(R1003C3)*RC3,0)+R4C -> 2420 | K953: =ROUND((R1003C-R4C)/(R1003C3)*RC3,0)+R4C -> 34518 | O953: =RC[-4]-R[-1]C[-4] -> 36 | P953: =RC[-1]-R[-1]C[-1] -> 0
B954: =R[-3]C+1 -> 317 | C954: =R[-1]C+RC[1] -> 950 | D954: 1 | F954: =ROUND((R1003C-R4C)/(R1003C3)*RC3,0)+R4C -> 11152 | G954: =ROUND((R1003C-R4C)/(R1003C3)*RC3,0)+R4C -> 8714 | H954: =ROUND((R1003C-R4C)/(R1003C3)*RC3,0)+R4C -> 24664 | I954: =ROUND((R1003C-R4C)/(R1003C3)*RC3,0)+R4C -> 4480 | J954: =ROUND((R1003C-R4C)/(R1003C3)*RC3,0)+R4C -> 2423 | K954: =ROUND((R1003C-R4C)/(R1003C3)*RC3,0)+R4C -> 34554 | O954: =RC[-4]-R[-1]C[-4] -> 36 | P954: =RC[-1]-R[-1]C[-1] -> 0
B955: =R[-3]C+1 -> 318 | C955: =R[-1]C+RC[1] -> 951 | D955: 1 | F955: =ROUND((R1003C-R4C)/(R1003C3)*RC3,0)+R4C -> 11164 | G955: =ROUND((R1003C-R4C)/(R1003C3)*RC3,0)+R4C -> 8723 | H955: =ROUND((R1003C-R4C)/(R1003C3)*RC3,0)+R4C -> 24689 | I955: =ROUND((R1003C-R4C)/(R1003C3)*RC3,0)+R4C -> 4485 | J955: =ROUND((R1003C-R4C)/(R1003C3)*RC3,0)+R4C -> 2425 | K955: =ROUND((R1003C-R4C)/(R1003C3)*RC3,0)+R4C -> 34590 | O955: =RC[-4]-R[-1]C[-4] -> 36 | P955: =RC[-1]-R[-1]C[-1] -> 0
B956: =R[-3]C+1 -> 318 | C956: =R[-1]C+RC[1] -> 952 | D956: 1 | F956: =ROUND((R1003C-R4C)/(R1003C3)*RC3,0)+R4C -> 11175 | G956: =ROUND((R1003C-R4C)/(R1003C3)*RC3,0)+R4C -> 8732 | H956: =ROUND((R1003C-R4C)/(R1003C3)*RC3,0)+R4C -> 24715 | I956: =ROUND((R1003C-R4C)/(R1003C3)*RC3,0)+R4C -> 4490 | J956: =ROUND((R1003C-R4C)/(R1003C3)*RC3,0)+R4C -> 2428 | K956: =ROUND((R1003C-R4C)/(R1003C3)*RC3,0)+R4C -> 34626 | O956: =RC[-4]-R[-1]C[-4] -> 36 | P956: =RC[-1]-R[-1]C[-1] -> 0
B957: =R[-3]C+1 -> 318 | C957: =R[-1]C+RC[1] -> 953 | D957: 1 | F957: =ROUND((R1003C-R4C)/(R1003C3)*RC3,0)+R4C -> 11187 | G957: =ROUND((R1003C-R4C)/(R1003C3)*RC3,0)+R4C -> 8741 | H957: =ROUND((R1003C-R4C)/(R1003C3)*RC3,0)+R4C -> 24741 | I957: =ROUND((R1003C-R4C)/(R1003C3)*RC3,0)+R4C -> 4494 | J957: =ROUND((R1003C-R4C)/(R1003C3)*RC3,0)+R4C -> 2430 | K957: =ROUND((R1003C-R4C)/(R1003C3)*RC3,0)+R4C -> 34663 | O957: =RC[-4]-R[-1]C[-4] -> 37 | P957: =RC[-1]-R[-1]C[-1] -> 1
B958: =R[-3]C+1 -> 319 | C958: =R[-1]C+RC[1] -> 954 | D958: 1 | F958: =ROUND((R1003C-R4C)/(R1003C3)*RC3,0)+R4C -> 11199 | G958: =ROUND((R1003C-R4C)/(R1003C3)*RC3,0)+R4C -> 8750 | H958: =ROUND((R1003C-R4C)/(R1003C3)*RC3,0)+R4C -> 24767 | I958: =ROUND((R1003C-R4C)/(R1003C3)*RC3,0)+R4C -> 4499 | J958: =ROUND((R1003C-R4C)/(R1003C3)*RC3,0)+R4C -> 2433 | K958: =ROUND((R1003C-R4C)/(R1003C3)*RC3,0)+R4C -> 34699 | O958: =RC[-4]-R[-1]C[-4] -> 36 | P958: =RC[-1]-R[-1]C[-1] -> -1
B959: =R[-3]C+1 -> 319 | C959: =R[-1]C+RC[1] -> 955 | D959: 1 | F959: =ROUND((R1003C-R4C)/(R1003C3)*RC3,0)+R4C -> 11210 | G959: =ROUND((R1003C-R4C)/(R1003C3)*RC3,0)+R4C -> 8760 | H959: =ROUND((R1003C-R4C)/(R1003C3)*RC3,0)+R4C -> 24793 | I959: =ROUND((R1003C-R4C)/(R1003C3)*RC3,0)+R4C -> 4504 | J959: =ROUND((R1003C-R4C)/(R1003C3)*RC3,0)+R4C -> 2435 | K959: =ROUND((R1003C-R4C)/(R1003C3)*RC3,0)+R4C -> 34735 | O959: =RC[-4]-R[-1]C[-4] -> 36 | P959: =RC[-1]-R[-1]C[-1] -> 0
B960: =R[-3]C+1 -> 319 | C960: =R[-1]C+RC[1] -> 956 | D960: 1 | F960: =ROUND((R1003C-R4C)/(R1003C3)*RC3,0)+R4C -> 11222 | G960: =ROUND((R1003C-R4C)/(R1003C3)*RC3,0)+R4C -> 8769 | H960: =ROUND((R1003C-R4C)/(R1003C3)*RC3,0)+R4C -> 24819 | I960: =ROUND((R1003C-R4C)/(R1003C3)*RC3,0)+R4C -> 4508 | J960: =ROUND((R1003C-R4C)/(R1003C3)*RC3,0)+R4C -> 2438 | K960: =ROUND((R1003C-R4C)/(R1003C3)*RC3,0)+R4C -> 34771 | O960: =RC[-4]-R[-1]C[-4] -> 36 | P960: =RC[-1]-R[-1]C[-1] -> 0
B961: =R[-3]C+1 -> 320 | C961: =R[-1]C+RC[1] -> 957 | D961: 1 | F961: =ROUND((R1003C-R4C)/(R1003C3)*RC3,0)+R4C -> 11234 | G961: =ROUND((R1003C-R4C)/(R1003C3)*RC3,0)+R4C -> 8778 | H961: =ROUND((R1003C-R4C)/(R1003C3)*RC3,0)+R4C -> 24844 | I961: =ROUND((R1003C-R4C)/(R1003C3)*RC3,0)+R4C -> 4513 | J961: =ROUND((R1003C-R4C)/(R1003C3)*RC3,0)+R4C -> 2440 | K961: =ROUND((R1003C-R4C)/(R1003C3)*RC3,0)+R4C -> 34807 | O961: =RC[-4]-R[-1]C[-4] -> 36 | P961: =RC[-1]-R[-1]C[-1] -> 0
B962: =R[-3]C+1 -> 320 | C962: =R[-1]C+RC[1] -> 958 | D962: 1 | F962: =ROUND((R1003C-R4C)/(R1003C3)*RC3,0)+R4C -> 11245 | G962: =ROUND((R1003C-R4C)/(R1003C3)*RC3,0)+R4C -> 8787 | H962: =ROUND((R1003C-R4C)/(R1003C3)*RC3,0)+R4C -> 24870 | I962: =ROUND((R1003C-R4C)/(R1003C3)*RC3,0)+R4C -> 4518 | J962: =ROUND((R1003C-R4C)/(R1003C3)*RC3,0)+R4C -> 2443 | K962: =ROUND((R1003C-R4C)/(R1003C3)*RC3,0)+R4C -> 34844 | O962: =RC[-4]-R[-1]C[-4] -> 37 | P962: =RC[-1]-R[-1]C[-1] -> 1
B963: =R[-3]C+1 -> 320 | C963: =R[-1]C+RC[1] -> 959 | D963: 1 | F963: =ROUND((R1003C-R4C)/(R1003C3)*RC3,0)+R4C -> 11257 | G963: =ROUND((R1003C-R4C)/(R1003C3)*RC3,0)+R4C -> 8796 | H963: =ROUND((R1003C-R4C)/(R1003C3)*RC3,0)+R4C -> 24896 | I963: =ROUND((R1003C-R4C)/(R1003C3)*RC3,0)+R4C -> 4522 | J963: =ROUND((R1003C-R4C)/(R1003C3)*RC3,0)+R4C -> 2446 | K963: =ROUND((R1003C-R4C)/(R1003C3)*RC3,0)+R4C -> 34880 | O963: =RC[-4]-R[-1]C[-4] -> 36 | P963: =RC[-1]-R[-1]C[-1] -> -1
B964: =R[-3]C+1 -> 321 | C964: =R[-1]C+RC[1] -> 960 | D964: 1 | F964: =ROUND((R1003C-R4C)/(R1003C3)*RC3,0)+R4C -> 11269 | G964: =ROUND((R1003C-R4C)/(R1003C3)*RC3,0)+R4C -> 8805 | H964: =ROUND((R1003C-R4C)/(R1003C3)*RC3,0)+R4C -> 24922 | I964: =ROUND((R1003C-R4C)/(R1003C3)*RC3,0)+R4C -> 4527 | J964: =ROUND((R1003C-R4C)/(R1003C3)*RC3,0)+R4C -> 2448 | K964: =ROUND((R1003C-R4C)/(R1003C3)*RC3,0)+R4C -> 34916 | O964: =RC[-4]-R[-1]C[-4] -> 36 | P964: =RC[-1]-R[-1]C[-1] -> 0
B965: =R[-3]C+1 -> 321 | C965: =R[-1]C+RC[1] -> 961 | D965: 1 | F965: =ROUND((R1003C-R4C)/(R1003C3)*RC3,0)+R4C -> 11280 | G965: =ROUND((R1003C-R4C)/(R1003C3)*RC3,0)+R4C -> 8814 | H965: =ROUND((R1003C-R4C)/(R1003C3)*RC3,0)+R4C -> 24948 | I965: =ROUND((R1003C-R4C)/(R1003C3)*RC3,0)+R4C -> 4532 | J965: =ROUND((R1003C-R4C)/(R1003C3)*RC3,0)+R4C -> 2451 | K965: =ROUND((R1003C-R4C)/(R1003C3)*RC3,0)+R4C -> 34952 | O965: =RC[-4]-R[-1]C[-4] -> 36 | P965: =RC[-1]-R[-1]C[-1] -> 0
B966: =R[-3]C+1 -> 321 | C966: =R[-1]C+RC[1] -> 962 | D966: 1 | F966: =ROUND((R1003C-R4C)/(R1003C3)*RC3,0)+R4C -> 11292 | G966: =ROUND((R1003C-R4C)/(R1003C3)*RC3,0)+R4C -> 8823 | H966: =ROUND((R1003C-R4C)/(R1003C3)*RC3,0)+R4C -> 24973 | I966: =ROUND((R1003C-R4C)/(R1003C3)*RC3,0)+R4C -> 4536 | J966: =ROUND((R1003C-R4C)/(R1003C3)*RC3,0)+R4C -> 2453 | K966: =ROUND((R1003C-R4C)/(R1003C3)*RC3,0)+R4C -> 34988 | O966: =RC[-4]-R[-1]C[-4] -> 36 | P966: =RC[-1]-R[-1]C[-1] -> 0
B967: =R[-3]C+1 -> 322 | C967: =R[-1]C+RC[1] -> 963 | D967: 1 | F967: =ROUND((R1003C-R4C)/(R1003C3)*RC3,0)+R4C -> 11304 | G967: =ROUND((R1003C-R4C)/(R1003C3)*RC3,0)+R4C -> 8833 | H967: =ROUND((R1003C-R4C)/(R1003C3)*RC3,0)+R4C -> 24999 | I967: =ROUND((R1003C-R4C)/(R1003C3)*RC3,0)+R4C -> 4541 | J967: =ROUND((R1003C-R4C)/(R1003C3)*RC3,0)+R4C -> 2456 | K967: =ROUND((R1003C-R4C)/(R1003C3)*RC3,0)+R4C -> 35024 | O967: =RC[-4]-R[-1]C[-4] -> 36 | P967: =RC[-1]-R[-1]C[-1] -> 0
B968: =R[-3]C+1 -> 322 | C968: =R[-1]C+RC[1] -> 964 | D968: 1 | F968: =ROUND((R1003C-R4C)/(R1003C3)*RC3,0)+R4C -> 11315 | G968: =ROUND((R1003C-R4C)/(R1003C3)*RC3,0)+R4C -> 8842 | H968: =ROUND((R1003C-R4C)/(R1003C3)*RC3,0)+R4C -> 25025 | I968: =ROUND((R1003C-R4C)/(R1003C3)*RC3,0)+R4C -> 4546 | J968: =ROUND((R1003C-R4C)/(R1003C3)*RC3,0)+R4C -> 2458 | K968: =ROUND((R1003C-R4C)/(R1003C3)*RC3,0)+R4C -> 35061 | O968: =RC[-4]-R[-1]C[-4] -> 37 | P968: =RC[-1]-R[-1]C[-1] -> 1
B969: =R[-3]C+1 -> 322 | C969: =R[-1]C+RC[1] -> 965 | D969: 1 | F969: =ROUND((R1003C-R4C)/(R1003C3)*RC3,0)+R4C -> 11327 | G969: =ROUND((R1003C-R4C)/(R1003C3)*RC3,0)+R4C -> 8851 | H969: =ROUND((R1003C-R4C)/(R1003C3)*RC3,0)+R4C -> 25051 | I969: =ROUND((R1003C-R4C)/(R1003C3)*RC3,0)+R4C -> 4551 | J969: =ROUND((R1003C-R4C)/(R1003C3)*RC3,0)+R4C -> 2461 | K969: =ROUND((R1003C-R4C)/(R1003C3)*RC3,0)+R4C -> 35097 | O969: =RC[-4]-R[-1]C[-4] -> 36 | P969: =RC[-1]-R[-1]C[-1] -> -1
B970: =R[-3]C+1 -> 323 | C970: =R[-1]C+RC[1] -> 966 | D970: 1 | F970: =ROUND((R1003C-R4C)/(R1003C3)*RC3,0)+R4C -> 11339 | G970: =ROUND((R1003C-R4C)/(R1003C3)*RC3,0)+R4C -> 8860 | H970: =ROUND((R1003C-R4C)/(R1003C3)*RC3,0)+R4C -> 25077 | I970: =ROUND((R1003C-R4C)/(R1003C3)*RC3,0)+R4C -> 4555 | J970: =ROUND((R1003C-R4C)/(R1003C3)*RC3,0)+R4C -> 2463 | K970: =ROUND((R1003C-R4C)/(R1003C3)*RC3,0)+R4C -> 35133 | O970: =RC[-4]-R[-1]C[-4] -> 36 | P970: =RC[-1]-R[-1]C[-1] -> 0
B971: =R[-3]C+1 -> 323 | C971: =R[-1]C+RC[1] -> 967 | D971: 1 | F971: =ROUND((R1003C-R4C)/(R1003C3)*RC3,0)+R4C -> 11350 | G971: =ROUND((R1003C-R4C)/(R1003C3)*RC3,0)+R4C -> 8869 | H971: =ROUND((R1003C-R4C)/(R1003C3)*RC3,0)+R4C -> 25103 | I971: =ROUND((R1003C-R4C)/(R1003C3)*RC3,0)+R4C -> 4560 | J971: =ROUND((R1003C-R4C)/(R1003C3)*RC3,0)+R4C -> 2466 | K971: =ROUND((R1003C-R4C)/(R1003C3)*RC3,0)+R4C -> 35169 | O971: =RC[-4]-R[-1]C[-4] -> 36 | P971: =RC[-1]-R[-1]C[-1] -> 0
B972: =R[-3]C+1 -> 323 | C972: =R[-1]C+RC[1] -> 968 | D972: 1 | F972: =ROUND((R1003C-R4C)/(R1003C3)*RC3,0)+R4C -> 11362 | G972: =ROUND((R1003C-R4C)/(R1003C3)*RC3,0)+R4C -> 8878 | H972: =ROUND((R1003C-R4C)/(R1003C3)*RC3,0)+R4C -> 25128 | I972: =ROUND((R1003C-R4C)/(R1003C3)*RC3,0)+R4C -> 4565 | J972: =ROUND((R1003C-R4C)/(R1003C3)*RC3,0)+R4C -> 2468 | K972: =ROUND((R1003C-R4C)/(R1003C3)*RC3,0)+R4C -> 35205 | O972: =RC[-4]-R[-1]C[-4] -> 36 | P972: =RC[-1]-R[-1]C[-1] -> 0
B973: =R[-3]C+1 -> 324 | C973: =R[-1]C+RC[1] -> 969 | D973: 1 | F973: =ROUND((R1003C-R4C)/(R1003C3)*RC3,0)+R4C -> 11374 | G973: =ROUND((R1003C-R4C)/(R1003C3)*RC3,0)+R4C -> 8887 | H973: =ROUND((R1003C-R4C)/(R1003C3)*RC3,0)+R4C -> 25154 | I973: =ROUND((R1003C-R4C)/(R1003C3)*RC3,0)+R4C -> 4569 | J973: =ROUND((R1003C-R4C)/(R1003C3)*RC3,0)+R4C -> 2471 | K973: =ROUND((R1003C-R4C)/(R1003C3)*RC3,0)+R4C -> 35242 | O973: =RC[-4]-R[-1]C[-4] -> 37 | P973: =RC[-1]-R[-1]C[-1] -> 1
B974: =R[-3]C+1 -> 324 | C974: =R[-1]C+RC[1] -> 970 | D974: 1 | F974: =ROUND((R1003C-R4C)/(R1003C3)*RC3,0)+R4C -> 11385 | G974: =ROUND((R1003C-R4C)/(R1003C3)*RC3,0)+R4C -> 8896 | H974: =ROUND((R1003C-R4C)/(R1003C3)*RC3,0)+R4C -> 25180 | I974: =ROUND((R1003C-R4C)/(R1003C3)*RC3,0)+R4C -> 4574 | J974: =ROUND((R1003C-R4C)/(R1003C3)*RC3,0)+R4C -> 2473 | K974: =ROUND((R1003C-R4C)/(R1003C3)*RC3,0)+R4C -> 35278 | O974: =RC[-4]-R[-1]C[-4] -> 36 | P974: =RC[-1]-R[-1]C[-1] -> -1
B975: =R[-3]C+1 -> 324 | C975: =R[-1]C+RC[1] -> 971 | D975: 1 | F975: =ROUND((R1003C-R4C)/(R1003C3)*RC3,0)+R4C -> 11397 | G975: =ROUND((R1003C-R4C)/(R1003C3)*RC3,0)+R4C -> 8906 | H975: =ROUND((R1003C-R4C)/(R1003C3)*RC3,0)+R4C -> 25206 | I975: =ROUND((R1003C-R4C)/(R1003C3)*RC3,0)+R4C -> 4579 | J975: =ROUND((R1003C-R4C)/(R1003C3)*RC3,0)+R4C -> 2476 | K975: =ROUND((R1003C-R4C)/(R1003C3)*RC3,0)+R4C -> 35314 | O975: =RC[-4]-R[-1]C[-4] -> 36 | P975: =RC[-1]-R[-1]C[-1] -> 0
B976: =R[-3]C+1 -> 325 | C976: =R[-1]C+RC[1] -> 972 | D976: 1 | F976: =ROUND((R1003C-R4C)/(R1003C3)*RC3,0)+R4C -> 11409 | G976: =ROUND((R1003C-R4C)/(R1003C3)*RC3,0)+R4C -> 8915 | H976: =ROUND((R1003C-R4C)/(R1003C3)*RC3,0)+R4C -> 25232 | I976: =ROUND((R1003C-R4C)/(R1003C3)*RC3,0)+R4C -> 4583 | J976: =ROUND((R1003C-R4C)/(R1003C3)*RC3,0)+R4C -> 2479 | K976: =ROUND((R1003C-R4C)/(R1003C3)*RC3,0)+R4C -> 35350 | O976: =RC[-4]-R[-1]C[-4] -> 36 | P976: =RC[-1]-R[-1]C[-1] -> 0
B977: =R[-3]C+1 -> 325 | C977: =R[-1]C+RC[1] -> 973 | D977: 1 | F977: =ROUND((R1003C-R4C)/(R1003C3)*RC3,0)+R4C -> 11420 | G977: =ROUND((R1003C-R4C)/(R1003C3)*RC3,0)+R4C -> 8924 | H977: =ROUND((R1003C-R4C)/(R1003C3)*RC3,0)+R4C -> 25258 | I977: =ROUND((R1003C-R4C)/(R1003C3)*RC3,0)+R4C -> 4588 | J977: =ROUND((R1003C-R4C)/(R1003C3)*RC3,0)+R4C -> 2481 | K977: =ROUND((R1003C-R4C)/(R1003C3)*RC3,0)+R4C -> 35386 | O977: =RC[-4]-R[-1]C[-4] -> 36 | P977: =RC[-1]-R[-1]C[-1] -> 0
B978: =R[-3]C+1 -> 325 | C978: =R[-1]C+RC[1] -> 974 | D978: 1 | F978: =ROUND((R1003C-R4C)/(R1003C3)*RC3,0)+R4C -> 11432 | G978: =ROUND((R1003C-R4C)/(R1003C3)*RC3,0)+R4C -> 8933 | H978: =ROUND((R1003C-R4C)/(R1003C3)*RC3,0)+R4C -> 25283 | I978: =ROUND((R1003C-R4C)/(R1003C3)*RC3,0)+R4C -> 4593 | J978: =ROUND((R1003C-R4C)/(R1003C3)*RC3,0)+R4C -> 2484 | K978: =ROUND((R1003C-R4C)/(R1003C3)*RC3,0)+R4C -> 35422 | O978: =RC[-4]-R[-1]C[-4] -> 36 | P978: =RC[-1]-R[-1]C[-1] -> 0
B979: =R[-3]C+1 -> 326 | C979: =R[-1]C+RC[1] -> 975 | D979: 1 | F979: =ROUND((R1003C-R4C)/(R1003C3)*RC3,0)+R4C -> 11444 | G979: =ROUND((R1003C-R4C)/(R1003C3)*RC3,0)+R4C -> 8942 | H979: =ROUND((R1003C-R4C)/(R1003C3)*RC3,0)+R4C -> 25309 | I979: =ROUND((R1003C-R4C)/(R1003C3)*RC3,0)+R4C -> 4597 | J979: =ROUND((R1003C-R4C)/(R1003C3)*RC3,0)+R4C -> 2486 | K979: =ROUND((R1003C-R4C)/(R1003C3)*RC3,0)+R4C -> 35459 | O979: =RC[-4]-R[-1]C[-4] -> 37 | P979: =RC[-1]-R[-1]C[-1] -> 1
B980: =R[-3]C+1 -> 326 | C980: =R[-1]C+RC[1] -> 976 | D980: 1 | F980: =ROUND((R1003C-R4C)/(R1003C3)*RC3,0)+R4C -> 11455 | G980: =ROUND((R1003C-R4C)/(R1003C3)*RC3,0)+R4C -> 8951 | H980: =ROUND((R1003C-R4C)/(R1003C3)*RC3,0)+R4C -> 25335 | I980: =ROUND((R1003C-R4C)/(R1003C3)*RC3,0)+R4C -> 4602 | J980: =ROUND((R1003C-R4C)/(R1003C3)*RC3,0)+R4C -> 2489 | K980: =ROUND((R1003C-R4C)/(R1003C3)*RC3,0)+R4C -> 35495 | O980: =RC[-4]-R[-1]C[-4] -> 36 | P980: =RC[-1]-R[-1]C[-1] -> -1
B981: =R[-3]C+1 -> 326 | C981: =R[-1]C+RC[1] -> 977 | D981: 1 | F981: =ROUND((R1003C-R4C)/(R1003C3)*RC3,0)+R4C -> 11467 | G981: =ROUND((R1003C-R4C)/(R1003C3)*RC3,0)+R4C -> 8960 | H981: =ROUND((R1003C-R4C)/(R1003C3)*RC3,0)+R4C -> 25361 | I981: =ROUND((R1003C-R4C)/(R1003C3)*RC3,0)+R4C -> 4607 | J981: =ROUND((R1003C-R4C)/(R1003C3)*RC3,0)+R4C -> 2491 | K981: =ROUND((R1003C-R4C)/(R1003C3)*RC3,0)+R4C -> 35531 | O981: =RC[-4]-R[-1]C[-4] -> 36 | P981: =RC[-1]-R[-1]C[-1] -> 0
B982: =R[-3]C+1 -> 327 | C982: =R[-1]C+RC[1] -> 978 | D982: 1 | F982: =ROUND((R1003C-R4C)/(R1003C3)*RC3,0)+R4C -> 11479 | G982: =ROUND((R1003C-R4C)/(R1003C3)*RC3,0)+R4C -> 8969 | H982: =ROUND((R1003C-R4C)/(R1003C3)*RC3,0)+R4C -> 25387 | I982: =ROUND((R1003C-R4C)/(R1003C3)*RC3,0)+R4C -> 4611 | J982: =ROUND((R1003C-R4C)/(R1003C3)*RC3,0)+R4C -> 2494 | K982: =ROUND((R1003C-R4C)/(R1003C3)*RC3,0)+R4C -> 35567 | O982: =RC[-4]-R[-1]C[-4] -> 36 | P982: =RC[-1]-R[-1]C[-1] -> 0
B983: =R[-3]C+1 -> 327 | C983: =R[-1]C+RC[1] -> 979 | D983: 1 | F983: =ROUND((R1003C-R4C)/(R1003C3)*RC3,0)+R4C -> 11490 | G983: =ROUND((R1003C-R4C)/(R1003C3)*RC3,0)+R4C -> 8979 | H983: =ROUND((R1003C-R4C)/(R1003C3)*RC3,0)+R4C -> 25413 | I983: =ROUND((R1003C-R4C)/(R1003C3)*RC3,0)+R4C -> 4616 | J983: =ROUND((R1003C-R4C)/(R1003C3)*RC3,0)+R4C -> 2496 | K983: =ROUND((R1003C-R4C)/(R1003C3)*RC3,0)+R4C -> 35603 | O983: =RC[-4]-R[-1]C[-4] -> 36 | P983: =RC[-1]-R[-1]C[-1] -> 0
B984: =R[-3]C+1 -> 327 | C984: =R[-1]C+RC[1] -> 980 | D984: 1 | F984: =ROUND((R1003C-R4C)/(R1003C3)*RC3,0)+R4C -> 11502 | G984: =ROUND((R1003C-R4C)/(R1003C3)*RC3,0)+R4C -> 8988 | H984: =ROUND((R1003C-R4C)/(R1003C3)*RC3,0)+R4C -> 25438 | I984: =ROUND((R1003C-R4C)/(R1003C3)*RC3,0)+R4C -> 4621 | J984: =ROUND((R1003C-R4C)/(R1003C3)*RC3,0)+R4C -> 2499 | K984: =ROUND((R1003C-R4C)/(R1003C3)*RC3,0)+R4C -> 35640 | O984: =RC[-4]-R[-1]C[-4] -> 37 | P984: =RC[-1]-R[-1]C[-1] -> 1
B985: =R[-3]C+1 -> 328 | C985: =R[-1]C+RC[1] -> 981 | D985: 1 | F985: =ROUND((R1003C-R4C)/(R1003C3)*RC3,0)+R4C -> 11514 | G985: =ROUND((R1003C-R4C)/(R1003C3)*RC3,0)+R4C -> 8997 | H985: =ROUND((R1003C-R4C)/(R1003C3)*RC3,0)+R4C -> 25464 | I985: =ROUND((R1003C-R4C)/(R1003C3)*RC3,0)+R4C -> 4626 | J985: =ROUND((R1003C-R4C)/(R1003C3)*RC3,0)+R4C -> 2501 | K985: =ROUND((R1003C-R4C)/(R1003C3)*RC3,0)+R4C -> 35676 | O985: =RC[-4]-R[-1]C[-4] -> 36 | P985: =RC[-1]-R[-1]C[-1] -> -1
B986: =R[-3]C+1 -> 328 | C986: =R[-1]C+RC[1] -> 982 | D986: 1 | F986: =ROUND((R1003C-R4C)/(R1003C3)*RC3,0)+R4C -> 11525 | G986: =ROUND((R1003C-R4C)/(R1003C3)*RC3,0)+R4C -> 9006 | H986: =ROUND((R1003C-R4C)/(R1003C3)*RC3,0)+R4C -> 25490 | I986: =ROUND((R1003C-R4C)/(R1003C3)*RC3,0)+R4C -> 4630 | J986: =ROUND((R1003C-R4C)/(R1003C3)*RC3,0)+R4C -> 2504 | K986: =ROUND((R1003C-R4C)/(R1003C3)*RC3,0)+R4C -> 35712 | O986: =RC[-4]-R[-1]C[-4] -> 36 | P986: =RC[-1]-R[-1]C[-1] -> 0
B987: =R[-3]C+1 -> 328 | C987: =R[-1]C+RC[1] -> 983 | D987: 1 | F987: =ROUND((R1003C-R4C)/(R1003C3)*RC3,0)+R4C -> 11537 | G987: =ROUND((R1003C-R4C)/(R1003C3)*RC3,0)+R4C -> 9015 | H987: =ROUND((R1003C-R4C)/(R1003C3)*RC3,0)+R4C -> 25516 | I987: =ROUND((R1003C-R4C)/(R1003C3)*RC3,0)+R4C -> 4635 | J987: =ROUND((R1003C-R4C)/(R1003C3)*RC3,0)+R4C -> 2506 | K987: =ROUND((R1003C-R4C)/(R1003C3)*RC3,0)+R4C -> 35748 | O987: =RC[-4]-R[-1]C[-4] -> 36 | P987: =RC[-1]-R[-1]C[-1] -> 0
B988: =R[-3]C+1 -> 329 | C988: =R[-1]C+RC[1] -> 984 | D988: 1 | F988: =ROUND((R1003C-R4C)/(R1003C3)*RC3,0)+R4C -> 11549 | G988: =ROUND((R1003C-R4C)/(R1003C3)*RC3,0)+R4C -> 9024 | H988: =ROUND((R1003C-R4C)/(R1003C3)*RC3,0)+R4C -> 25542 | I988: =ROUND((R1003C-R4C)/(R1003C3)*RC3,0)+R4C -> 4640 | J988: =ROUND((R1003C-R4C)/(R1003C3)*RC3,0)+R4C -> 2509 | K988: =ROUND((R1003C-R4C)/(R1003C3)*RC3,0)+R4C -> 35784 | O988: =RC[-4]-R[-1]C[-4] -> 36 | P988: =RC[-1]-R[-1]C[-1] -> 0
B989: =R[-3]C+1 -> 329 | C989: =R[-1]C+RC[1] -> 985 | D989: 1 | F989: =ROUND((R1003C-R4C)/(R1003C3)*RC3,0)+R4C -> 11561 | G989: =ROUND((R1003C-R4C)/(R1003C3)*RC3,0)+R4C -> 9033 | H989: =ROUND((R1003C-R4C)/(R1003C3)*RC3,0)+R4C -> 25567 | I989: =ROUND((R1003C-R4C)/(R1003C3)*RC3,0)+R4C -> 4644 | J989: =ROUND((R1003C-R4C)/(R1003C3)*RC3,0)+R4C -> 2511 | K989: =ROUND((R1003C-R4C)/(R1003C3)*RC3,0)+R4C -> 35820 | O989: =RC[-4]-R[-1]C[-4] -> 36 | P989: =RC[-1]-R[-1]C[-1] -> 0
B990: =R[-3]C+1 -> 329 | C990: =R[-1]C+RC[1] -> 986 | D990: 1 | F990: =ROUND((R1003C-R4C)/(R1003C3)*RC3,0)+R4C -> 11572 | G990: =ROUND((R1003C-R4C)/(R1003C3)*RC3,0)+R4C -> 9042 | H990: =ROUND((R1003C-R4C)/(R1003C3)*RC3,0)+R4C -> 25593 | I990: =ROUND((R1003C-R4C)/(R1003C3)*RC3,0)+R4C -> 4649 | J990: =ROUND((R1003C-R4C)/(R1003C3)*RC3,0)+R4C -> 2514 | K990: =ROUND((R1003C-R4C)/(R1003C3)*RC3,0)+R4C -> 35857 | O990: =RC[-4]-R[-1]C[-4] -> 37 | P990: =RC[-1]-R[-1]C[-1] -> 1
B991: =R[-3]C+1 -> 330 | C991: =R[-1]C+RC[1] -> 987 | D991: 1 | F991: =ROUND((R1003C-R4C)/(R1003C3)*RC3,0)+R4C -> 11584 | G991: =ROUND((R1003C-R4C)/(R1003C3)*RC3,0)+R4C -> 9052 | H991: =ROUND((R1003C-R4C)/(R1003C3)*RC3,0)+R4C -> 25619 | I991: =ROUND((R1003C-R4C)/(R1003C3)*RC3,0)+R4C -> 4654 | J991: =ROUND((R1003C-R4C)/(R1003C3)*RC3,0)+R4C -> 2517 | K991: =ROUND((R1003C-R4C)/(R1003C3)*RC3,0)+R4C -> 35893 | O991: =RC[-4]-R[-1]C[-4] -> 36 | P991: =RC[-1]-R[-1]C[-1] -> -1
B992: =R[-3]C+1 -> 330 | C992: =R[-1]C+RC[1] -> 988 | D992: 1 | F992: =ROUND((R1003C-R4C)/(R1003C3)*RC3,0)+R4C -> 11596 | G992: =ROUND((R1003C-R4C)/(R1003C3)*RC3,0)+R4C -> 9061 | H992: =ROUND((R1003C-R4C)/(R1003C3)*RC3,0)+R4C -> 25645 | I992: =ROUND((R1003C-R4C)/(R1003C3)*RC3,0)+R4C -> 4658 | J992: =ROUND((R1003C-R4C)/(R1003C3)*RC3,0)+R4C -> 2519 | K992: =ROUND((R1003C-R4C)/(R1003C3)*RC3,0)+R4C -> 35929 | O992: =RC[-4]-R[-1]C[-4] -> 36 | P992: =RC[-1]-R[-1]C[-1] -> 0
B993: =R[-3]C+1 -> 330 | C993: =R[-1]C+RC[1] -> 989 | D993: 1 | F993: =ROUND((R1003C-R4C)/(R1003C3)*RC3,0)+R4C -> 11607 | G993: =ROUND((R1003C-R4C)/(R1003C3)*RC3,0)+R4C -> 9070 | H993: =ROUND((R1003C-R4C)/(R1003C3)*RC3,0)+R4C -> 25671 | I993: =ROUND((R1003C-R4C)/(R1003C3)*RC3,0)+R4C -> 4663 | J993: =ROUND((R1003C-R4C)/(R1003C3)*RC3,0)+R4C -> 2522 | K993: =ROUND((R1003C-R4C)/(R1003C3)*RC3,0)+R4C -> 35965 | O993: =RC[-4]-R[-1]C[-4] -> 36 | P993: =RC[-1]-R[-1]C[-1] -> 0
B994: =R[-3]C+1 -> 331 | C994: =R[-1]C+RC[1] -> 990 | D994: 1 | F994: =ROUND((R1003C-R4C)/(R1003C3)*RC3,0)+R4C -> 11619 | G994: =ROUND((R1003C-R4C)/(R1003C3)*RC3,0)+R4C -> 9079 | H994: =ROUND((R1003C-R4C)/(R1003C3)*RC3,0)+R4C -> 25697 | I994: =ROUND((R1003C-R4C)/(R1003C3)*RC3,0)+R4C -> 4668 | J994: =ROUND((R1003C-R4C)/(R1003C3)*RC3,0)+R4C -> 2524 | K994: =ROUND((R1003C-R4C)/(R1003C3)*RC3,0)+R4C -> 36001 | O994: =RC[-4]-R[-1]C[-4] -> 36 | P994: =RC[-1]-R[-1]C[-1] -> 0
B995: =R[-3]C+1 -> 331 | C995: =R[-1]C+RC[1] -> 991 | D995: 1 | F995: =ROUND((R1003C-R4C)/(R1003C3)*RC3,0)+R4C -> 11631 | G995: =ROUND((R1003C-R4C)/(R1003C3)*RC3,0)+R4C -> 9088 | H995: =ROUND((R1003C-R4C)/(R1003C3)*RC3,0)+R4C -> 25722 | I995: =ROUND((R1003C-R4C)/(R1003C3)*RC3,0)+R4C -> 4672 | J995: =ROUND((R1003C-R4C)/(R1003C3)*RC3,0)+R4C -> 2527 | K995: =ROUND((R1003C-R4C)/(R1003C3)*RC3,0)+R4C -> 36038 | O995: =RC[-4]-R[-1]C[-4] -> 37 | P995: =RC[-1]-R[-1]C[-1] -> 1
B996: =R[-3]C+1 -> 331 | C996: =R[-1]C+RC[1] -> 992 | D996: 1 | F996: =ROUND((R1003C-R4C)/(R1003C3)*RC3,0)+R4C -> 11642 | G996: =ROUND((R1003C-R4C)/(R1003C3)*RC3,0)+R4C -> 9097 | H996: =ROUND((R1003C-R4C)/(R1003C3)*RC3,0)+R4C -> 25748 | I996: =ROUND((R1003C-R4C)/(R1003C3)*RC3,0)+R4C -> 4677 | J996: =ROUND((R1003C-R4C)/(R1003C3)*RC3,0)+R4C -> 2529 | K996: =ROUND((R1003C-R4C)/(R1003C3)*RC3,0)+R4C -> 36074 | O996: =RC[-4]-R[-1]C[-4] -> 36 | P996: =RC[-1]-R[-1]C[-1] -> -1
B997: =R[-3]C+1 -> 332 | C997: =R[-1]C+RC[1] -> 993 | D997: 1 | F997: =ROUND((R1003C-R4C)/(R1003C3)*RC3,0)+R4C -> 11654 | G997: =ROUND((R1003C-R4C)/(R1003C3)*RC3,0)+R4C -> 9106 | H997: =ROUND((R1003C-R4C)/(R1003C3)*RC3,0)+R4C -> 25774 | I997: =ROUND((R1003C-R4C)/(R1003C3)*RC3,0)+R4C -> 4682 | J997: =ROUND((R1003C-R4C)/(R1003C3)*RC3,0)+R4C -> 2532 | K997: =ROUND((R1003C-R4C)/(R1003C3)*RC3,0)+R4C -> 36110 | O997: =RC[-4]-R[-1]C[-4] -> 36 | P997: =RC[-1]-R[-1]C[-1] -> 0
B998: =R[-3]C+1 -> 332 | C998: =R[-1]C+RC[1] -> 994 | D998: 1 | F998: =ROUND((R1003C-R4C)/(R1003C3)*RC3,0)+R4C -> 11666 | G998: =ROUND((R1003C-R4C)/(R1003C3)*RC3,0)+R4C -> 9115 | H998: =ROUND((R1003C-R4C)/(R1003C3)*RC3,0)+R4C -> 25800 | I998: =ROUND((R1003C-R4C)/(R1003C3)*RC3,0)+R4C -> 4687 | J998: =ROUND((R1003C-R4C)/(R1003C3)*RC3,0)+R4C -> 2534 | K998: =ROUND((R1003C-R4C)/(R1003C3)*RC3,0)+R4C -> 36146 | O998: =RC[-4]-R[-1]C[-4] -> 36 | P998: =RC[-1]-R[-1]C[-1] -> 0
B999: =R[-3]C+1 -> 332 | C999: =R[-1]C+RC[1] -> 995 | D999: 1 | F999: =ROUND((R1003C-R4C)/(R1003C3)*RC3,0)+R4C -> 11677 | G999: =ROUND((R1003C-R4C)/(R1003C3)*RC3,0)+R4C -> 9125 | H999: =ROUND((R1003C-R4C)/(R1003C3)*RC3,0)+R4C -> 25826 | I999: =ROUND((R1003C-R4C)/(R1003C3)*RC3,0)+R4C -> 4691 | J999: =ROUND((R1003C-R4C)/(R1003C3)*RC3,0)+R4C -> 2537 | K999: =ROUND((R1003C-R4C)/(R1003C3)*RC3,0)+R4C -> 36182 | O999: =RC[-4]-R[-1]C[-4] -> 36 | P999: =RC[-1]-R[-1]C[-1] -> 0
B1000: =R[-3]C+1 -> 333 | C1000: =R[-1]C+RC[1] -> 996 | D1000: 1 | F1000: =ROUND((R1003C-R4C)/(R1003C3)*RC3,0)+R4C -> 11689 | G1000: =ROUND((R1003C-R4C)/(R1003C3)*RC3,0)+R4C -> 9134 | H1000: =ROUND((R1003C-R4C)/(R1003C3)*RC3,0)+R4C -> 25852 | I1000: =ROUND((R1003C-R4C)/(R1003C3)*RC3,0)+R4C -> 4696 | J1000: =ROUND((R1003C-R4C)/(R1003C3)*RC3,0)+R4C -> 2539 | K1000: =ROUND((R1003C-R4C)/(R1003C3)*RC3,0)+R4C -> 36218 | O1000: =RC[-4]-R[-1]C[-4] -> 36 | P1000: =RC[-1]-R[-1]C[-1] -> 0
B1001: =R[-3]C+1 -> 333 | C1001: =R[-1]C+RC[1] -> 997 | D1001: 1 | F1001: =ROUND((R1003C-R4C)/(R1003C3)*RC3,0)+R4C -> 11701 | G1001: =ROUND((R1003C-R4C)/(R1003C3)*RC3,0)+R4C -> 9143 | H1001: =ROUND((R1003C-R4C)/(R1003C3)*RC3,0)+R4C -> 25877 | I1001: =ROUND((R1003C-R4C)/(R1003C3)*RC3,0)+R4C -> 4701 | J1001: =ROUND((R1003C-R4C)/(R1003C3)*RC3,0)+R4C -> 2542 | K1001: =ROUND((R1003C-R4C)/(R1003C3)*RC3,0)+R4C -> 36255 | O1001: =RC[-4]-R[-1]C[-4] -> 37 | P1001: =RC[-1]-R[-1]C[-1] -> 1
B1002: =R[-3]C+1 -> 333 | C1002: =R[-1]C+RC[1] -> 998 | D1002: 1 | F1002: =ROUND((R1003C-R4C)/(R1003C3)*RC3,0)+R4C -> 11712 | G1002: =ROUND((R1003C-R4C)/(R1003C3)*RC3,0)+R4C -> 9152 | H1002: =ROUND((R1003C-R4C)/(R1003C3)*RC3,0)+R4C -> 25903 | I1002: =ROUND((R1003C-R4C)/(R1003C3)*RC3,0)+R4C -> 4705 | J1002: =ROUND((R1003C-R4C)/(R1003C3)*RC3,0)+R4C -> 2544 | K1002: =ROUND((R1003C-R4C)/(R1003C3)*RC3,0)+R4C -> 36291 | O1002: =RC[-4]-R[-1]C[-4] -> 36 | P1002: =RC[-1]-R[-1]C[-1] -> -1
B1003: =R[-3]C+1 -> 334 | C1003: =R[-1]C+RC[1] -> 999 | D1003: 1 | F1003: =Sheet4!R[-940]C[6] -> 11724 | G1003: =Sheet4!R[-940]C[6] -> 9161 | H1003: =Sheet4!R[-940]C[6] -> 25929 | I1003: =Sheet4!R[-940]C[6] -> 4710 | J1003: =Sheet4!R[-940]C[6] -> 2547 | K1003: =Sheet4!R[-940]C[6] -> 36327 | O1003: =RC[-4]-R[-1]C[-4] -> 36 | P1003: =RC[-1]-R[-1]C[-1] -> 0