Sheet: ctGiftConf
A1: 礼包ID,要跟道具表一致 | C1: 1 随机出一个 2 全部随机(此类型下，掉落配置，权重参数为掉率百分比，而不是权重) | D1: 品质：0，不指定品质 1 - 5, 对应 白 - 橙 目前只有装备，实现了指定品质的 | E1: 1获取时开启 0获取时不开启 | F1: 0=强行绑定 1=不改变原来的状态
A2: nID | B2: sName | C2: nType | D2: tDrop | E2: bUse | F2: bLock
A3: i | B3: s | C3: i | D3: t{iiiiii} | E3: b | F3: b
A4: 礼包ID | B4: 名字 | C4: 礼包类型 | D4: 掉落配置(角色配置ID,权重,物品类型,物品ID,数量，品质) | F4: 是否绑定
A5: 1 | B5: 慕夕的荷包 | C5: 1 | D5: 0,100,1,11,100000,0; | E5: 0 | F5: 1
A6: 11000 | B6: 10000银币 | C6: 2 | D6: 0,100,1,4,10000,0; | E6: 0 | F6: 1
A7: 11001 | B7: 100000银币 | C7: 2 | D7: 0,100,1,4,100000,0; | E7: 0 | F7: 1
A8: 11004 | B8: 5000金币 | C8: 2 | D8: 0,100,1,3,5000,0; | E8: 0 | F8: 1
A9: 11005 | B9: 50000金币 | C9: 2 | D9: 0,100,1,3,50000,0; | E9: 0 | F9: 1
A10: 11007 | B10: 低级宠物技能包 | C10: 1 | D10: 0,100,1,16001,1,0;0,100,1,16002,1,0;0,100,1,16003,1,0;0,100,1,16004,1,0;0,100,1,16005,1,0;0,100,1,16006,1,0;0,100,1,16007,1,0;0,100,1,16008,1,0;0,100,1,16009,1,0;0,100,1,16010,1,0;0,100,1,16011,1,0;0,100,1,16012,1,0;0,100,1,16013,1,0;0,100,1,16014,1,0;0,100,1,16015,1,0;0,100,1,16016,1,0;0,100,1,16017,1,0;0,100,1,16018,1,0;0,100,1,16019,1,0;0,100,1,16020,1,0;0,100,1,16021,1,0;0,100,1,16022,1,0;0,100,1,16023,1,0;0,100,1,16024,1,0;0,100,1,16025,1,0;0,100,1,16026,1,0;0,100,1,16027,1,0;0,100,1,16028,1,0;0,100,1,16029,1,0;0,100,1,16030,1,0;0,100,1,16031,1,0;0,100,1,16032,1,0;0,100,1,16033,1,0;0,100,1,16034,1,0;0,100,1,16035,1,0;0,100,1,16036,1,0;0,100,1,16037,1,0;0,100,1,16038,1,0;0,100,1,16101,1,0;0,100,1,16102,1,0;0,100,1,16103,1,0;0,100,1,16104,1,0; | E10: 0 | F10: 1
A11: 11008 | B11: 高级宠物技能包 | C11: 1 | D11: 0,100,1,17001,1,0;0,100,1,17002,1,0;0,100,1,17003,1,0;0,100,1,17004,1,0;0,100,1,17005,1,0;0,100,1,17006,1,0;0,100,1,17007,1,0;0,100,1,17008,1,0;0,100,1,17009,1,0;0,100,1,17010,1,0;0,100,1,17011,1,0;0,100,1,17012,1,0;0,100,1,17013,1,0;0,100,1,17014,1,0;0,100,1,17015,1,0;0,100,1,17016,1,0;0,100,1,17017,1,0;0,100,1,17018,1,0;0,100,1,17019,1,0;0,100,1,17020,1,0;0,100,1,17021,1,0;0,100,1,17022,1,0;0,100,1,17023,1,0;0,100,1,17024,1,0;0,100,1,17025,1,0;0,100,1,17026,1,0;0,100,1,17027,1,0;0,100,1,17028,1,0;0,100,1,17029,1,0;0,100,1,17030,1,0;0,100,1,17031,1,0;0,100,1,17032,1,0;0,100,1,17033,1,0;0,100,1,17034,1,0;0,100,1,17035,1,0;0,100,1,17036,1,0;0,100,1,17037,1,0;0,100,1,17038,1,0;0,100,1,17101,1,0;0,100,1,17102,1,0;0,100,1,17103,1,0;0,100,1,17104,1,0;0,100,1,17105,1,0; | E11: 0 | F11: 1
A12: 11009 | B12: 喜糖 | C12: 1 | D12: 0,100,1,30001,1,0;0,100,1,30002,1,0;0,100,1,30003,1,0;0,100,1,30004,1,0;0,100,1,30005,1,0;0,100,1,30006,1,0;0,100,1,30007,1,0;0,100,1,30008,1,0;0,100,1,30009,1,0;0,100,1,28000,1,0;0,100,1,19016,1,0; | E12: 0 | F12: 1
A13: 11010 | B13: 30000银币 | C13: 2 | D13: 0,100,1,4,30000,0; | E13: 0 | F13: 1
A14: 11011 | B14: 1000金锭 | C14: 2 | D14: 0,100,1,12,1000,0; | E14: 0 | F14: 1
A15: 11012 | B15: 20000银币 | C15: 2 | D15: 0,100,1,4,20000,0; | E15: 0 | F15: 1
A16: 11013 | B16: 50000银币 | C16: 2 | D16: 0,100,1,4,50000,0; | E16: 0 | F16: 1
A17: 11014 | B17: 100000银币 | C17: 2 | D17: 0,100,1,4,100000,0; | E17: 0 | F17: 1
A18: 11015 | B18: 200000银币 | C18: 2 | D18: 0,100,1,4,200000,0; | E18: 0 | F18: 1
A19: 11016 | B19: 300000银币 | C19: 2 | D19: 0,100,1,4,300000,0; | E19: 0 | F19: 1
A20: 11017 | B20: 400000银币 | C20: 2 | D20: 0,100,1,4,400000,0; | E20: 0 | F20: 1
A21: 11018 | B21: 500000银币 | C21: 2 | D21: 0,100,1,4,500000,0; | E21: 0 | F21: 1
A22: 11019 | B22: 600000银币 | C22: 2 | D22: 0,100,1,4,600000,0; | E22: 0 | F22: 1
A23: 11020 | B23: 700000银币 | C23: 2 | D23: 0,100,1,4,700000,0; | E23: 0 | F23: 1
A24: 11021 | B24: 800000银币 | C24: 2 | D24: 0,100,1,4,800000,0; | E24: 0 | F24: 1
A25: 11022 | B25: 900000银币 | C25: 2 | D25: 0,100,1,4,900000,0; | E25: 0 | F25: 1
A26: 11023 | B26: 1000000银币 | C26: 2 | D26: 0,100,1,4,1000000,0; | E26: 0 | F26: 1
A27: 11024 | B27: 2000000银币 | C27: 2 | D27: 0,100,1,4,2000000,0; | E27: 0 | F27: 1
A28: 11025 | B28: 3000000银币 | C28: 2 | D28: 0,100,1,4,3000000,0; | E28: 0 | F28: 1
A29: 11026 | B29: 4000000银币 | C29: 2 | D29: 0,100,1,4,4000000,0; | E29: 0 | F29: 1
A30: 11027 | B30: 5000000银币 | C30: 2 | D30: 0,100,1,4,5000000,0; | E30: 0 | F30: 1
A31: 11028 | B31: 10000000银币 | C31: 2 | D31: 0,100,1,4,10000000,0; | E31: 0 | F31: 1
A32: 11101 | B32: 238元宝 | C32: 2 | D32: 0,100,1,2,238,0; | E32: 0 | F32: 1
A33: 11102 | B33: 288元宝 | C33: 2 | D33: 0,100,1,2,288,0; | E33: 0 | F33: 1
A34: 11103 | B34: 588元宝 | C34: 2 | D34: 0,100,1,2,588,0; | E34: 0 | F34: 1
A35: 11104 | B35: 1888元宝 | C35: 2 | D35: 0,100,1,2,1888,0; | E35: 0 | F35: 1
A36: 11105 | B36: 2888元宝 | C36: 2 | D36: 0,100,1,2,2888,0; | E36: 0 | F36: 1
A37: 11106 | B37: 3288元宝 | C37: 2 | D37: 0,100,1,2,3288,0; | E37: 0 | F37: 1
A38: 11201 | B38: 2000金币 | C38: 2 | D38: 0,100,1,3,2000,0; | E38: 0 | F38: 1
A39: 11202 | B39: 6000金币 | C39: 2 | D39: 0,100,1,3,6000,0; | E39: 0 | F39: 1
A40: 11203 | B40: 15000金币 | C40: 2 | D40: 0,100,1,3,15000,0; | E40: 0 | F40: 1
A41: 11204 | B41: 25000金币 | C41: 2 | D41: 0,100,1,3,25000,0; | E41: 0 | F41: 1
A42: 11205 | B42: 800金币 | C42: 2 | D42: 0,100,1,3,800,0; | E42: 0 | F42: 1
A43: 11206 | B43: 1000金币 | C43: 2 | D43: 0,100,1,3,1000,0; | E43: 0 | F43: 1
A44: 11207 | B44: 1500金币 | C44: 2 | D44: 0,100,1,3,1500,0; | E44: 0 | F44: 1
A45: 11208 | B45: 2000金币 | C45: 2 | D45: 0,100,1,3,2000,0; | E45: 0 | F45: 1
A46: 11209 | B46: 2500金币 | C46: 2 | D46: 0,100,1,3,2500,0; | E46: 0 | F46: 1
A47: 11210 | B47: 3000金币 | C47: 2 | D47: 0,100,1,3,3000,0; | E47: 0 | F47: 1
A48: 11211 | B48: 3500金币 | C48: 2 | D48: 0,100,1,3,3500,0; | E48: 0 | F48: 1
A49: 11212 | B49: 4000金币 | C49: 2 | D49: 0,100,1,3,4000,0; | E49: 0 | F49: 1
A50: 11213 | B50: 4500金币 | C50: 2 | D50: 0,100,1,3,4500,0; | E50: 0 | F50: 1
A51: 11214 | B51: 5000金币 | C51: 2 | D51: 0,100,1,3,5000,0; | E51: 0 | F51: 1
A52: 11215 | B52: 5500金币 | C52: 2 | D52: 0,100,1,3,5500,0; | E52: 0 | F52: 1
A53: 11216 | B53: 6000金币 | C53: 2 | D53: 0,100,1,3,6000,0; | E53: 0 | F53: 1
A54: 11217 | B54: 6500金币 | C54: 2 | D54: 0,100,1,3,6500,0; | E54: 0 | F54: 1
A55: 11218 | B55: 7000金币 | C55: 2 | D55: 0,100,1,3,7000,0; | E55: 0 | F55: 1
A56: 11219 | B56: 7500金币 | C56: 2 | D56: 0,100,1,3,7500,0; | E56: 0 | F56: 1
A57: 11220 | B57: 8000金币 | C57: 2 | D57: 0,100,1,3,8000,0; | E57: 0 | F57: 1
A58: 11221 | B58: 8500金币 | C58: 2 | D58: 0,100,1,3,8500,0; | E58: 0 | F58: 1
A59: 11222 | B59: 9000金币 | C59: 2 | D59: 0,100,1,3,9000,0; | E59: 0 | F59: 1
A60: 11223 | B60: 9500金币 | C60: 2 | D60: 0,100,1,3,9500,0; | E60: 0 | F60: 1
A61: 11224 | B61: 10000金币 | C61: 2 | D61: 0,100,1,3,10000,0; | E61: 0 | F61: 1
A62: 11301 | B62: 首席大弟子礼包 | C62: 2 | D62: 0,58,1,17001,1,0;0,58,1,17002,1,0;0,58,1,17003,1,0;0,58,1,17004,1,0;0,58,1,17005,1,0;0,58,1,17006,1,0;0,58,1,17007,1,0;0,58,1,17008,1,0;0,58,1,17009,1,0;0,58,1,17010,1,0;0,58,1,17011,1,0;0,58,1,17012,1,0;0,58,1,17013,1,0;0,58,1,17014,1,0;0,58,1,17015,1,0;0,58,1,17016,1,0;0,58,1,17017,1,0;0,58,1,17018,1,0;0,58,1,17019,1,0;0,58,1,17020,1,0;0,58,1,17021,1,0;0,58,1,17022,1,0;0,58,1,17023,1,0;0,58,1,17024,1,0;0,58,1,17025,1,0;0,58,1,17026,1,0;0,58,1,17027,1,0;0,58,1,17028,1,0;0,58,1,17029,1,0;0,58,1,17030,1,0;0,58,1,17031,1,0;0,58,1,17032,1,0;0,58,1,17033,1,0;0,58,1,17034,1,0;0,58,1,17035,1,0;0,58,1,17036,1,0;0,58,1,17037,1,0;0,58,1,17038,1,0;0,58,1,17101,1,0;0,58,1,17102,1,0;0,58,1,17103,1,0;0,58,1,17104,1,0;0,58,1,17105,1,0;0,1500,1,19011,1,0;0,3000,1,11003,4,0;0,3000,1,10008,4,0; | E62: 0 | F62: 1
A63: 11302 | B63: 首席二弟子礼包 | C63: 2 | D63: 0,47,1,17001,1,0;0,47,1,17002,1,0;0,47,1,17003,1,0;0,47,1,17004,1,0;0,47,1,17005,1,0;0,47,1,17006,1,0;0,47,1,17007,1,0;0,47,1,17008,1,0;0,47,1,17009,1,0;0,47,1,17010,1,0;0,47,1,17011,1,0;0,47,1,17012,1,0;0,47,1,17013,1,0;0,47,1,17014,1,0;0,47,1,17015,1,0;0,47,1,17016,1,0;0,47,1,17017,1,0;0,47,1,17018,1,0;0,47,1,17019,1,0;0,47,1,17020,1,0;0,47,1,17021,1,0;0,47,1,17022,1,0;0,47,1,17023,1,0;0,47,1,17024,1,0;0,47,1,17025,1,0;0,47,1,17026,1,0;0,47,1,17027,1,0;0,47,1,17028,1,0;0,47,1,17029,1,0;0,47,1,17030,1,0;0,47,1,17031,1,0;0,47,1,17032,1,0;0,47,1,17033,1,0;0,47,1,17034,1,0;0,47,1,17035,1,0;0,47,1,17036,1,0;0,47,1,17037,1,0;0,47,1,17038,1,0;0,47,1,17101,1,0;0,47,1,17102,1,0;0,47,1,17103,1,0;0,47,1,17104,1,0;0,47,1,17105,1,0;0,3975,1,11003,3,0;0,3975,1,10008,3,0; | E63: 0 | F63: 1
A64: 11303 | B64: 首席季军礼包 | C64: 2 | D64: 0,5000,1,11003,2,0;0,5000,1,10008,2,0; | E64: 0 | F64: 1
A65: 11304 | B65: 首席前十礼包 | C65: 2 | D65: 0,3000,1,11003,1,0;0,3000,1,10008,1,0;0,800,1,19005,1,0;0,800,1,19006,1,0;0,800,1,19007,1,0;0,800,1,19008,1,0;0,800,1,19009,1,0; | E65: 0 | F65: 1
A66: 11305 | B66: 首席参与礼包 | C66: 2 | D66: 0,100,1,4,100000,0; | E66: 0 | F66: 1
A67: 11311 | B67: 会武冠军礼包 | C67: 2 | D67: 0,58,1,17001,1,0;0,58,1,17002,1,0;0,58,1,17003,1,0;0,58,1,17004,1,0;0,58,1,17005,1,0;0,58,1,17006,1,0;0,58,1,17007,1,0;0,58,1,17008,1,0;0,58,1,17009,1,0;0,58,1,17010,1,0;0,58,1,17011,1,0;0,58,1,17012,1,0;0,58,1,17013,1,0;0,58,1,17014,1,0;0,58,1,17015,1,0;0,58,1,17016,1,0;0,58,1,17017,1,0;0,58,1,17018,1,0;0,58,1,17019,1,0;0,58,1,17020,1,0;0,58,1,17021,1,0;0,58,1,17022,1,0;0,58,1,17023,1,0;0,58,1,17024,1,0;0,58,1,17025,1,0;0,58,1,17026,1,0;0,58,1,17027,1,0;0,58,1,17028,1,0;0,58,1,17029,1,0;0,58,1,17030,1,0;0,58,1,17031,1,0;0,58,1,17032,1,0;0,58,1,17033,1,0;0,58,1,17034,1,0;0,58,1,17035,1,0;0,58,1,17036,1,0;0,58,1,17037,1,0;0,58,1,17038,1,0;0,58,1,17101,1,0;0,58,1,17102,1,0;0,58,1,17103,1,0;0,58,1,17104,1,0;0,58,1,17105,1,0;0,1500,1,19011,1,0;0,3000,1,11003,4,0;0,3000,1,10008,4,0; | E67: 0 | F67: 1
A68: 11312 | B68: 会武亚军礼包 | C68: 2 | D68: 0,47,1,17001,1,0;0,47,1,17002,1,0;0,47,1,17003,1,0;0,47,1,17004,1,0;0,47,1,17005,1,0;0,47,1,17006,1,0;0,47,1,17007,1,0;0,47,1,17008,1,0;0,47,1,17009,1,0;0,47,1,17010,1,0;0,47,1,17011,1,0;0,47,1,17012,1,0;0,47,1,17013,1,0;0,47,1,17014,1,0;0,47,1,17015,1,0;0,47,1,17016,1,0;0,47,1,17017,1,0;0,47,1,17018,1,0;0,47,1,17019,1,0;0,47,1,17020,1,0;0,47,1,17021,1,0;0,47,1,17022,1,0;0,47,1,17023,1,0;0,47,1,17024,1,0;0,47,1,17025,1,0;0,47,1,17026,1,0;0,47,1,17027,1,0;0,47,1,17028,1,0;0,47,1,17029,1,0;0,47,1,17030,1,0;0,47,1,17031,1,0;0,47,1,17032,1,0;0,47,1,17033,1,0;0,47,1,17034,1,0;0,47,1,17035,1,0;0,47,1,17036,1,0;0,47,1,17037,1,0;0,47,1,17038,1,0;0,47,1,17101,1,0;0,47,1,17102,1,0;0,47,1,17103,1,0;0,47,1,17104,1,0;0,47,1,17105,1,0;0,3975,1,11003,3,0;0,3975,1,10008,3,0; | E68: 0 | F68: 1
A69: 11313 | B69: 会武季军礼包 | C69: 2 | D69: 0,5000,1,11003,2,0;0,5000,1,10008,2,0; | E69: 0 | F69: 1
A70: 11314 | B70: 会武前十礼包 | C70: 2 | D70: 0,3000,1,11003,1,0;0,3000,1,10008,1,0;0,800,1,19005,1,0;0,800,1,19006,1,0;0,800,1,19007,1,0;0,800,1,19008,1,0;0,800,1,19009,1,0; | E70: 0 | F70: 1
A71: 11315 | B71: 会武参与礼包 | C71: 2 | D71: 0,100,1,4,100000,0; | E71: 0 | F71: 1
A72: 11321 | B72: 萌仙冠军礼包 | C72: 2 | D72: 0,58,1,17001,1,0;0,58,1,17002,1,0;0,58,1,17003,1,0;0,58,1,17004,1,0;0,58,1,17005,1,0;0,58,1,17006,1,0;0,58,1,17007,1,0;0,58,1,17008,1,0;0,58,1,17009,1,0;0,58,1,17010,1,0;0,58,1,17011,1,0;0,58,1,17012,1,0;0,58,1,17013,1,0;0,58,1,17014,1,0;0,58,1,17015,1,0;0,58,1,17016,1,0;0,58,1,17017,1,0;0,58,1,17018,1,0;0,58,1,17019,1,0;0,58,1,17020,1,0;0,58,1,17021,1,0;0,58,1,17022,1,0;0,58,1,17023,1,0;0,58,1,17024,1,0;0,58,1,17025,1,0;0,58,1,17026,1,0;0,58,1,17027,1,0;0,58,1,17028,1,0;0,58,1,17029,1,0;0,58,1,17030,1,0;0,58,1,17031,1,0;0,58,1,17032,1,0;0,58,1,17033,1,0;0,58,1,17034,1,0;0,58,1,17035,1,0;0,58,1,17036,1,0;0,58,1,17037,1,0;0,58,1,17038,1,0;0,58,1,17101,1,0;0,58,1,17102,1,0;0,58,1,17103,1,0;0,58,1,17104,1,0;0,58,1,17105,1,0;0,1500,1,19011,1,0;0,3000,1,11003,4,0;0,3000,1,10008,4,0; | E72: 0 | F72: 1
A73: 11322 | B73: 萌仙亚军礼包 | C73: 2 | D73: 0,47,1,17001,1,0;0,47,1,17002,1,0;0,47,1,17003,1,0;0,47,1,17004,1,0;0,47,1,17005,1,0;0,47,1,17006,1,0;0,47,1,17007,1,0;0,47,1,17008,1,0;0,47,1,17009,1,0;0,47,1,17010,1,0;0,47,1,17011,1,0;0,47,1,17012,1,0;0,47,1,17013,1,0;0,47,1,17014,1,0;0,47,1,17015,1,0;0,47,1,17016,1,0;0,47,1,17017,1,0;0,47,1,17018,1,0;0,47,1,17019,1,0;0,47,1,17020,1,0;0,47,1,17021,1,0;0,47,1,17022,1,0;0,47,1,17023,1,0;0,47,1,17024,1,0;0,47,1,17025,1,0;0,47,1,17026,1,0;0,47,1,17027,1,0;0,47,1,17028,1,0;0,47,1,17029,1,0;0,47,1,17030,1,0;0,47,1,17031,1,0;0,47,1,17032,1,0;0,47,1,17033,1,0;0,47,1,17034,1,0;0,47,1,17035,1,0;0,47,1,17036,1,0;0,47,1,17037,1,0;0,47,1,17038,1,0;0,47,1,17101,1,0;0,47,1,17102,1,0;0,47,1,17103,1,0;0,47,1,17104,1,0;0,47,1,17105,1,0;0,3975,1,11003,3,0;0,3975,1,10008,3,0; | E73: 0 | F73: 1
A74: 11323 | B74: 萌仙季军礼包 | C74: 2 | D74: 0,5000,1,11003,2,0;0,5000,1,10008,2,0; | E74: 0 | F74: 1
A75: 11324 | B75: 萌仙前十礼包 | C75: 2 | D75: 0,3000,1,11003,1,0;0,3000,1,10008,1,0;0,800,1,19005,1,0;0,800,1,19006,1,0;0,800,1,19007,1,0;0,800,1,19008,1,0;0,800,1,19009,1,0; | E75: 0 | F75: 1
A76: 11325 | B76: 萌仙参与礼包 | C76: 2 | D76: 0,100,1,4,100000,0; | E76: 0 | F76: 1
A77: 11331 | B77: 神魔录礼包 | C77: 1 | D77: 0,100,1,10009,1,0; | E77: 0 | F77: 1
A78: 11341 | B78: 帮派礼包 | C78: 1 | D78: 0,100,1,10009,1,0; | E78: 0 | F78: 1
A79: 11342 | B79: 帮派礼盒 | C79: 1 | D79: 0,300,1,18000,1,0;0,300,1,18001,1,0;0,300,1,18002,1,0;0,300,1,18003,1,0;0,300,1,18004,1,0;0,700,1,11008,1,0;0,1836,1,11007,1,0;0,103,1,2000102,1,0;0,103,1,2000202,1,0;0,53,1,2000103,1,0;0,53,1,2000203,1,0;0,28,1,2000104,1,0;0,28,1,2000204,1,0;0,43,1,2000302,1,0; | E79: 0 | F79: 1
A80: 90001 | B80: 天剑男武器 | C80: 2 | D80: 0,100,1,1101100,1,0;0,100,1,1101101,1,0;0,100,1,1101102,1,0;0,100,1,1101103,1,0;0,100,1,1101104,1,0;0,100,1,1101105,1,0;0,100,1,1101106,1,0;0,100,1,1101107,1,0;0,100,1,1101108,1,0;0,100,1,1101109,1,0;0,100,1,1101110,1,0; | E80: 0 | F80: 1
A81: 90002 | B81: 天剑女武器 | C81: 1 | D81: 0,10,1,1101200,1,0;0,10,1,1101201,1,0;0,10,1,1101202,1,0;0,10,1,1101203,1,0;0,10,1,1101204,1,0;0,10,1,1101205,1,0;0,10,1,1101206,1,0;0,10,1,1101207,1,0;0,10,1,1101208,1,0;0,10,1,1101209,1,0; | E81: 0 | F81: 1
A82: 90003 | B82: 10级武器 | C82: 1 | D82: 1,100,1,1101101,1,3;2,100,1,1101201,1,3;3,100,1,1102101,1,3;4,100,1,1102201,1,3;5,100,1,1103101,1,3;6,100,1,1103201,1,3;7,100,1,1104101,1,3;8,100,1,1104201,1,3;9,100,1,1105101,1,3;10,100,1,1105201,1,3; | E82: 0 | F82: 1
A83: 90004 | B83: 20级武器 | C83: 1 | D83: 1,100,1,1101102,1,3;2,100,1,1101202,1,3;3,100,1,1102102,1,3;4,100,1,1102202,1,3;5,100,1,1103102,1,3;6,100,1,1103202,1,3;7,100,1,1104102,1,3;8,100,1,1104202,1,3;9,100,1,1105102,1,3;10,100,1,1105202,1,3; | E83: 0 | F83: 1
A84: 90005 | B84: 20级全套 | C84: 2 | D84: 1,100,1,1200102,1,1;2,100,1,1200202,1,1;1,100,1,1300102,1,1;2,100,1,1300202,1,1;3,100,1,1200102,1,1;4,100,1,1200202,1,1;3,100,1,1300102,1,1;4,100,1,1300202,1,1;5,100,1,1200102,1,1;6,100,1,1200202,1,1;5,100,1,1300102,1,1;6,100,1,1300202,1,1;7,100,1,1200102,1,1;8,100,1,1200202,1,1;7,100,1,1300102,1,1;8,100,1,1300202,1,1;9,100,1,1200102,1,1;10,100,1,1200202,1,1;9,100,1,1300102,1,1;10,100,1,1300202,1,1;0,100,1,1400002,1,1;0,100,1,1500002,1,1;0,100,1,1600002,1,1; | E84: 0 | F84: 1
A85: 90006 | B85: 新手装备 | C85: 2 | D85: 0,100,1,1400000,1,1;0,100,1,1600000,1,1; | E85: 1 | F85: 1
A86: 90007 | B86: 法宝礼包 | C86: 2 | D86: 0,100,5,32001,1,0;0,100,5,32002,1,0;0,100,5,32003,1,0;0,100,5,32101,1,0;0,100,5,32102,1,0;0,100,5,32103,1,0;0,100,5,32201,1,0;0,100,5,32202,1,0;0,100,5,32203,1,0;0,100,5,32301,1,0;0,100,5,32302,1,0;0,100,5,32303,1,0;0,100,5,32304,1,0;0,100,5,32305,1,0;0,100,5,32306,1,0;0,100,5,32401,1,0;0,100,5,32402,1,0;0,100,5,32403,1,0;0,100,5,32404,1,0;0,100,5,32405,1,0;0,100,5,32406,1,0;0,100,5,32501,1,0;0,100,5,32502,1,0;0,100,5,32503,1,0;0,100,5,32504,1,0;0,100,5,32505,1,0;0,100,5,32506,1,0;0,100,5,32507,1,0;0,100,5,32508,1,0;0,100,5,32509,1,0;0,100,5,32510,1,0;0,100,5,32511,1,0;0,100,5,32512,1,0; | E86: 0 | F86: 1
A87: 90008 | B87: 神器礼包 | C87: 2 | D87: 0,100,1,33001,1,0;0,100,1,33011,1,0;0,100,1,33021,1,0;0,100,1,33031,1,0;0,100,1,33041,1,0;0,100,1,33051,1,0;0,100,1,33061,1,0;0,100,1,33071,1,0;0,100,1,33081,1,0;0,100,1,33091,1,0;0,100,1,33101,1,0;0,100,1,33111,1,0;0,100,1,33121,1,0;0,100,1,33131,1,0;0,100,1,33141,1,0;0,100,1,33151,1,0;0,100,1,33161,1,0;0,100,1,33171,1,0; | E87: 0 | F87: 1
A88: 11401 | B88: 师门活动找回礼包 | C88: 2 | D88: 0,100,1,4,73180,0; | E88: 1 | F88: 1
A89: 11402 | B89: 师门活动找回礼包 | C89: 2 | D89: 0,100,1,4,76750,0;0,30,1,10007,2,0; | E89: 1 | F89: 1
A90: 11403 | B90: 师门活动找回礼包 | C90: 2 | D90: 0,100,1,4,83890,0;0,30,1,10007,2,0; | E90: 1 | F90: 1
A91: 11404 | B91: 师门活动找回礼包 | C91: 2 | D91: 0,100,1,4,94600,0;0,30,1,10007,2,0; | E91: 1 | F91: 1
A92: 11405 | B92: 师门活动找回礼包 | C92: 2 | D92: 0,100,1,4,101740,0;0,30,1,10007,2,0; | E92: 1 | F92: 1
A93: 11406 | B93: 赏金活动找回礼包 | C93: 2 | D93: 0,100,1,4,25500,0; | E93: 1 | F93: 1
A94: 11407 | B94: 赏金活动找回礼包 | C94: 2 | D94: 0,100,1,4,25500,0; | E94: 1 | F94: 1
A95: 11408 | B95: 赏金活动找回礼包 | C95: 2 | D95: 0,100,1,4,25500,0;0,80,1,31000,1,0; | E95: 1 | F95: 1
A96: 11409 | B96: 赏金活动找回礼包 | C96: 2 | D96: 0,100,1,4,25500,0;0,80,1,31000,1,0; | E96: 1 | F96: 1
A97: 11410 | B97: 赏金活动找回礼包 | C97: 2 | D97: 0,100,1,4,25500,0;0,80,1,31000,1,0; | E97: 1 | F97: 1
A98: 11411 | B98: 捉妖活动找回礼包 | C98: 2 | D98: 0,100,1,4,11154,0;0,1,1,10108,1,0;0,2,1,10007,2,0;0,1,1,12000,1,0;0,1,1,12001,1,0;0,1,1,12002,1,0;0,1,1,12003,1,0;0,1,1,12004,1,0;0,1,1,12005,1,0;0,1,1,12006,1,0;0,1,1,12007,1,0;0,2,1,10001,1,0;0,1,1,10002,1,0; | E98: 1 | F98: 1
A99: 11412 | B99: 捉妖活动找回礼包 | C99: 2 | D99: 0,100,1,4,12216,0;0,1,1,10108,1,0;0,2,1,10007,2,0;0,1,1,12000,1,0;0,1,1,12001,1,0;0,1,1,12002,1,0;0,1,1,12003,1,0;0,1,1,12004,1,0;0,1,1,12005,1,0;0,1,1,12006,1,0;0,1,1,12007,1,0;0,2,1,10001,1,0;0,1,1,10002,1,0; | E99: 1 | F99: 1
A100: 11413 | B100: 捉妖活动找回礼包 | C100: 2 | D100: 0,100,1,4,14342,0;0,1,1,10108,1,0;0,2,1,10007,2,0;0,1,1,12000,1,0;0,1,1,12001,1,0;0,1,1,12002,1,0;0,1,1,12003,1,0;0,1,1,12004,1,0;0,1,1,12005,1,0;0,1,1,12006,1,0;0,1,1,12007,1,0;0,2,1,10001,1,0;0,1,1,10002,1,0; | E100: 1 | F100: 1
A101: 11414 | B101: 捉妖活动找回礼包 | C101: 2 | D101: 0,100,1,4,17530,0;0,1,1,10108,1,0;0,2,1,10007,2,0;0,1,1,12000,1,0;0,1,1,12001,1,0;0,1,1,12002,1,0;0,1,1,12003,1,0;0,1,1,12004,1,0;0,1,1,12005,1,0;0,1,1,12006,1,0;0,1,1,12007,1,0;0,2,1,10001,1,0;0,1,1,10002,1,0; | E101: 1 | F101: 1
A102: 11415 | B102: 捉妖活动找回礼包 | C102: 2 | D102: 0,100,1,4,19654,0;0,1,1,10108,1,0;0,2,1,10007,2,0;0,1,1,12000,1,0;0,1,1,12001,1,0;0,1,1,12002,1,0;0,1,1,12003,1,0;0,1,1,12004,1,0;0,1,1,12005,1,0;0,1,1,12006,1,0;0,1,1,12007,1,0;0,2,1,10001,1,0;0,1,1,10002,1,0; | E102: 1 | F102: 1
A103: 11416 | B103: 萌仙轶事找回礼包 | C103: 2 | D103: 0,100,1,4,28500,0; | E103: 1 | F103: 1
A104: 11417 | B104: 萌仙轶事找回礼包 | C104: 2 | D104: 0,100,1,4,28500,0; | E104: 1 | F104: 1
A105: 11418 | B105: 萌仙轶事找回礼包 | C105: 2 | D105: 0,100,1,4,28500,0; | E105: 1 | F105: 1
A106: 11419 | B106: 萌仙轶事找回礼包 | C106: 2 | D106: 0,100,1,4,28500,0; | E106: 1 | F106: 1
A107: 11420 | B107: 萌仙轶事找回礼包 | C107: 2 | D107: 0,100,1,4,28500,0; | E107: 1 | F107: 1
A108: 11421 | B108: 萌仙课堂找回礼包 | C108: 2 | D108: 0,100,1,4,26000,0; | E108: 1 | F108: 1
A109: 11422 | B109: 萌仙课堂找回礼包 | C109: 2 | D109: 0,100,1,4,26000,0; | E109: 1 | F109: 1
A110: 11423 | B110: 萌仙课堂找回礼包 | C110: 2 | D110: 0,100,1,4,26000,0; | E110: 1 | F110: 1
A111: 11424 | B111: 萌仙课堂找回礼包 | C111: 2 | D111: 0,100,1,4,26000,0; | E111: 1 | F111: 1
A112: 11425 | B112: 萌仙课堂找回礼包 | C112: 2 | D112: 0,100,1,4,26000,0; | E112: 1 | F112: 1
A113: 11426 | B113: 妖兽突袭找回礼包 | C113: 2 | D113: 0,100,1,4,3825,0; | E113: 1 | F113: 1
A114: 11427 | B114: 妖兽突袭找回礼包 | C114: 2 | D114: 0,100,1,4,3825,0; | E114: 1 | F114: 1
A115: 11428 | B115: 妖兽突袭找回礼包 | C115: 2 | D115: 0,100,1,4,3825,0; | E115: 1 | F115: 1
A116: 11429 | B116: 妖兽突袭找回礼包 | C116: 2 | D116: 0,100,1,4,3825,0;0,8,1,19016,15,0;0,16,1,11007,1,0;0,2,1,11008,1,0;0,8,1,28000,15,0; | E116: 1 | F116: 1
A117: 11430 | B117: 妖兽突袭找回礼包 | C117: 2 | D117: 0,100,1,4,3825,0;0,8,1,19016,15,0;0,16,1,11007,1,0;0,2,1,11008,1,0;0,8,1,28000,15,0; | E117: 1 | F117: 1
A118: 11431 | B118: 降妖伏魔找回礼包 | C118: 2 | D118: 0,100,1,4,35700,0; | E118: 1 | F118: 1
A119: 11432 | B119: 降妖伏魔找回礼包 | C119: 2 | D119: 0,100,1,4,39100,0; | E119: 1 | F119: 1
A120: 11433 | B120: 降妖伏魔找回礼包 | C120: 2 | D120: 0,100,1,4,45900,0;0,30,1,19016,5,0;0,30,1,28000,5,0;0,30,1,10108,1,0;0,30,1,27002,2,0; | E120: 1 | F120: 1
A121: 11434 | B121: 降妖伏魔找回礼包 | C121: 2 | D121: 0,100,1,4,56100,0;0,30,1,19016,7,0;0,30,1,28000,7,0;0,30,1,10108,1,0;0,30,1,27003,2,0; | E121: 1 | F121: 1
A122: 11435 | B122: 降妖伏魔找回礼包 | C122: 2 | D122: 0,100,1,4,62900,0;0,30,1,19016,8,0;0,30,1,28000,8,0;0,30,1,10108,2,0;0,30,1,27005,2,0; | E122: 1 | F122: 1
A123: 11436 | B123: 诛心魔找回礼包 | C123: 2 | D123: 0,100,1,4,170000,0; | E123: 1 | F123: 1
A124: 11437 | B124: 诛心魔找回礼包 | C124: 2 | D124: 0,100,1,4,170000,0; | E124: 1 | F124: 1
A125: 11438 | B125: 诛心魔找回礼包 | C125: 2 | D125: 0,100,1,4,170000,0; | E125: 1 | F125: 1
A126: 11439 | B126: 诛心魔找回礼包 | C126: 2 | D126: 0,100,1,4,170000,0;0,12,1,10008,1,0;0,2,1,18000,1,0;0,2,1,18001,1,0;0,2,1,18002,1,0;0,2,1,18003,1,0;0,2,1,18004,1,0;0,12,1,11008,1,0;0,2,1,19005,1,0;0,2,1,19006,1,0;0,2,1,19007,1,0;0,2,1,19008,1,0;0,2,1,19009,1,0;0,2,1,2000103,1,0;0,2,1,2000203,1,0;0,2,1,2000303,1,0; | E126: 1 | F126: 1
A127: 11440 | B127: 诛心魔找回礼包 | C127: 2 | D127: 0,100,1,4,170000,0;0,12,1,10008,1,0;0,2,1,18000,1,0;0,2,1,18001,1,0;0,2,1,18002,1,0;0,2,1,18003,1,0;0,2,1,18004,1,0;0,12,1,11008,1,0;0,2,1,19005,1,0;0,2,1,19006,1,0;0,2,1,19007,1,0;0,2,1,19008,1,0;0,2,1,19009,1,0;0,2,1,2000103,1,0;0,2,1,2000203,1,0;0,2,1,2000303,1,0; | E127: 1 | F127: 1
A128: =R[-40]C+100 -> 11501 | B128: 师门活动找回礼包 | C128: 2 | D128: 0,100,1,4,100,0;0,100,1,3,6000,0; | E128: 1 | F128: 1
A129: =R[-40]C+100 -> 11502 | B129: 师门活动找回礼包 | C129: 2 | D129: 0,100,1,4,145152,0;0,70,1,10007,2,0; | E129: 1 | F129: 1
A130: =R[-40]C+100 -> 11503 | B130: 师门活动找回礼包 | C130: 2 | D130: 0,100,1,4,148512,0;0,70,1,10007,2,0; | E130: 1 | F130: 1
A131: =R[-40]C+100 -> 11504 | B131: 师门活动找回礼包 | C131: 2 | D131: 0,100,1,4,168672,0;0,70,1,10007,2,0; | E131: 1 | F131: 1
A132: =R[-40]C+100 -> 11505 | B132: 师门活动找回礼包 | C132: 2 | D132: 0,100,1,4,182112,0;0,70,1,10007,2,0; | E132: 1 | F132: 1
A133: =R[-40]C+100 -> 11506 | B133: 赏金活动找回礼包 | C133: 2 | D133: 0,100,1,4,10,0;0,100,1,3,600,0; | E133: 1 | F133: 1
A134: =R[-40]C+100 -> 11507 | B134: 赏金活动找回礼包 | C134: 2 | D134: 0,100,1,4,10,0;0,100,1,3,600,0; | E134: 1 | F134: 1
A135: =R[-40]C+100 -> 11508 | B135: 赏金活动找回礼包 | C135: 2 | D135: 0,100,1,4,51000,0;0,80,1,31000,1,0;0,80,1,11007,1,0; | E135: 1 | F135: 1
A136: =R[-40]C+100 -> 11509 | B136: 赏金活动找回礼包 | C136: 2 | D136: 0,100,1,4,51000,0;0,80,1,31000,1,0;0,80,1,11007,1,0; | E136: 1 | F136: 1
A137: =R[-40]C+100 -> 11510 | B137: 赏金活动找回礼包 | C137: 2 | D137: 0,100,1,4,51000,0;0,80,1,31000,1,0;0,80,1,11007,1,0; | E137: 1 | F137: 1
A138: =R[-40]C+100 -> 11511 | B138: 捉妖活动找回礼包 | C138: 2 | D138: 0,100,1,4,25248,0;0,3,1,10108,1,0;0,5,1,10007,2,0;0,3,1,12000,1,0;0,3,1,12001,1,0;0,3,1,12002,1,0;0,3,1,12003,1,0;0,3,1,12004,1,0;0,3,1,12005,1,0;0,3,1,12006,1,0;0,3,1,12007,1,0;0,4,1,10001,1,0;0,2,1,10002,1,0; | E138: 1 | F138: 1
A139: =R[-40]C+100 -> 11512 | B139: 捉妖活动找回礼包 | C139: 2 | D139: 0,100,1,4,27748,0;0,3,1,10108,1,0;0,5,1,10007,2,0;0,3,1,12000,1,0;0,3,1,12001,1,0;0,3,1,12002,1,0;0,3,1,12003,1,0;0,3,1,12004,1,0;0,3,1,12005,1,0;0,3,1,12006,1,0;0,3,1,12007,1,0;0,4,1,10001,1,0;0,2,1,10002,1,0; | E139: 1 | F139: 1
A140: =R[-40]C+100 -> 11513 | B140: 捉妖活动找回礼包 | C140: 2 | D140: 0,100,1,4,30248,0;0,3,1,10108,1,0;0,5,1,10007,2,0;0,3,1,12000,1,0;0,3,1,12001,1,0;0,3,1,12002,1,0;0,3,1,12003,1,0;0,3,1,12004,1,0;0,3,1,12005,1,0;0,3,1,12006,1,0;0,3,1,12007,1,0;0,4,1,10001,1,0;0,2,1,10002,1,0;0,1,1,1200103,1,1;0,1,1,1200203,1,1;0,1,1,1300103,1,1;0,1,1,1300203,1,1;0,1,1,1400003,1,1;0,1,1,1500003,1,1;0,1,1,1600003,1,1; | E140: 1 | F140: 1
A141: =R[-40]C+100 -> 11514 | B141: 捉妖活动找回礼包 | C141: 2 | D141: 0,100,1,4,37500,0;0,3,1,10108,1,0;0,5,1,10007,2,0;0,3,1,12000,1,0;0,3,1,12001,1,0;0,3,1,12002,1,0;0,3,1,12003,1,0;0,3,1,12004,1,0;0,3,1,12005,1,0;0,3,1,12006,1,0;0,3,1,12007,1,0;0,4,1,10001,1,0;0,2,1,10002,1,0;0,1,1,1200105,1,1;0,1,1,1200205,1,1;0,1,1,1300105,1,1;0,1,1,1300205,1,1;0,1,1,1400005,1,1;0,1,1,1500005,1,1;0,1,1,1600005,1,1; | E141: 1 | F141: 1
A142: =R[-40]C+100 -> 11515 | B142: 捉妖活动找回礼包 | C142: 2 | D142: 0,100,1,4,42500,0;0,3,1,10108,1,0;0,5,1,10007,2,0;0,3,1,12000,1,0;0,3,1,12001,1,0;0,3,1,12002,1,0;0,3,1,12003,1,0;0,3,1,12004,1,0;0,3,1,12005,1,0;0,3,1,12006,1,0;0,3,1,12007,1,0;0,4,1,10001,1,0;0,2,1,10002,1,0;0,1,1,1200107,1,1;0,1,1,1200207,1,1;0,1,1,1300107,1,1;0,1,1,1300207,1,1;0,1,1,1400007,1,1;0,1,1,1500007,1,1;0,1,1,1600007,1,1; | E142: 1 | F142: 1
A143: =R[-40]C+100 -> 11516 | B143: 萌仙轶事找回礼包 | C143: 2 | D143: 0,100,1,4,10,0;0,100,1,3,600,0; | E143: 1 | F143: 1
A144: =R[-40]C+100 -> 11517 | B144: 萌仙轶事找回礼包 | C144: 2 | D144: 0,100,1,4,10,0;0,100,1,3,600,0; | E144: 1 | F144: 1
A145: =R[-40]C+100 -> 11518 | B145: 萌仙轶事找回礼包 | C145: 2 | D145: 0,100,1,4,57000,0; | E145: 1 | F145: 1
A146: =R[-40]C+100 -> 11519 | B146: 萌仙轶事找回礼包 | C146: 2 | D146: 0,100,1,4,57000,0; | E146: 1 | F146: 1
A147: =R[-40]C+100 -> 11520 | B147: 萌仙轶事找回礼包 | C147: 2 | D147: 0,100,1,4,57000,0; | E147: 1 | F147: 1
A148: =R[-40]C+100 -> 11521 | B148: 萌仙课堂找回礼包 | C148: 2 | D148: 0,100,1,4,10,0;0,100,1,3,600,0; | E148: 1 | F148: 1
A149: =R[-40]C+100 -> 11522 | B149: 萌仙课堂找回礼包 | C149: 2 | D149: 0,100,1,4,10,0;0,100,1,3,600,0; | E149: 1 | F149: 1
A150: =R[-40]C+100 -> 11523 | B150: 萌仙课堂找回礼包 | C150: 2 | D150: 0,100,1,4,52000,0; | E150: 1 | F150: 1
A151: =R[-40]C+100 -> 11524 | B151: 萌仙课堂找回礼包 | C151: 2 | D151: 0,100,1,4,52000,0; | E151: 1 | F151: 1
A152: =R[-40]C+100 -> 11525 | B152: 萌仙课堂找回礼包 | C152: 2 | D152: 0,100,1,4,52000,0; | E152: 1 | F152: 1
A153: =R[-40]C+100 -> 11526 | B153: 妖兽突袭找回礼包 | C153: 2 | D153: 0,100,1,4,15,0;0,100,1,3,900,0; | E153: 1 | F153: 1
A154: =R[-40]C+100 -> 11527 | B154: 妖兽突袭找回礼包 | C154: 2 | D154: 0,100,1,4,15,0;0,100,1,3,900,0; | E154: 1 | F154: 1
A155: =R[-40]C+100 -> 11528 | B155: 妖兽突袭找回礼包 | C155: 2 | D155: 0,100,1,4,15,0;0,100,1,3,900,0; | E155: 1 | F155: 1
A156: =R[-40]C+100 -> 11529 | B156: 妖兽突袭找回礼包 | C156: 2 | D156: 0,100,1,4,7648,0;0,16,1,19016,15,0;0,32,1,11007,1,0;0,4,1,11008,1,0;0,16,1,28000,15,0; | E156: 1 | F156: 1
A157: =R[-40]C+100 -> 11530 | B157: 妖兽突袭找回礼包 | C157: 2 | D157: 0,100,1,4,7648,0;0,16,1,19016,15,0;0,32,1,11007,1,0;0,4,1,11008,1,0;0,16,1,28000,15,0; | E157: 1 | F157: 1
A158: =R[-40]C+100 -> 11531 | B158: 降妖伏魔找回礼包 | C158: 2 | D158: 0,100,1,4,100,0;0,100,1,3,6000,0; | E158: 1 | F158: 1
A159: =R[-40]C+100 -> 11532 | B159: 降妖伏魔找回礼包 | C159: 2 | D159: 0,100,1,4,100,0;0,100,1,3,6000,0; | E159: 1 | F159: 1
A160: =R[-40]C+100 -> 11533 | B160: 降妖伏魔找回礼包 | C160: 2 | D160: 0,100,1,4,91800,0;0,70,1,19016,5,0;0,70,1,28000,5,0;0,70,1,10108,1,0;0,70,1,27002,2,0; | E160: 1 | F160: 1
A161: =R[-40]C+100 -> 11534 | B161: 降妖伏魔找回礼包 | C161: 2 | D161: 0,100,1,4,112200,0;0,70,1,19016,7,0;0,70,1,28000,7,0;0,70,1,10108,1,0;0,70,1,27003,2,0; | E161: 1 | F161: 1
A162: =R[-40]C+100 -> 11535 | B162: 降妖伏魔找回礼包 | C162: 2 | D162: 0,100,1,4,125800,0;0,70,1,19016,8,0;0,70,1,28000,8,0;0,70,1,10108,2,0;0,70,1,27005,2,0; | E162: 1 | F162: 1
A163: =R[-40]C+100 -> 11536 | B163: 诛心魔找回礼包 | C163: 2 | D163: 0,100,1,4,10,0;0,100,1,3,600,0; | E163: 1 | F163: 1
A164: =R[-40]C+100 -> 11537 | B164: 诛心魔找回礼包 | C164: 2 | D164: 0,100,1,4,10,0;0,100,1,3,600,0; | E164: 1 | F164: 1
A165: =R[-40]C+100 -> 11538 | B165: 诛心魔找回礼包 | C165: 2 | D165: 0,100,1,4,10,0;0,100,1,3,600,0; | E165: 1 | F165: 1
A166: =R[-40]C+100 -> 11539 | B166: 诛心魔找回礼包 | C166: 2 | D166: 0,100,1,4,340000,0;0,24,1,10008,1,0;0,4,1,18000,1,0;0,4,1,18001,1,0;0,4,1,18002,1,0;0,4,1,18003,1,0;0,4,1,18004,1,0;0,24,1,11008,1,0;0,4,1,19005,1,0;0,4,1,19006,1,0;0,4,1,19007,1,0;0,4,1,19008,1,0;0,4,1,19009,1,0;0,4,1,2000103,1,0;0,4,1,2000203,1,0;0,4,1,2000303,1,0; | E166: 1 | F166: 1
A167: =R[-40]C+100 -> 11540 | B167: 诛心魔找回礼包 | C167: 2 | D167: 0,100,1,4,340000,0;0,24,1,10008,1,0;0,4,1,18000,1,0;0,4,1,18001,1,0;0,4,1,18002,1,0;0,4,1,18003,1,0;0,4,1,18004,1,0;0,24,1,11008,1,0;0,4,1,19005,1,0;0,4,1,19006,1,0;0,4,1,19007,1,0;0,4,1,19008,1,0;0,4,1,19009,1,0;0,4,1,2000103,1,0;0,4,1,2000203,1,0;0,4,1,2000303,1,0; | E167: 1 | F167: 1
A168: =R[-40]C+100 -> 11601 | B168: 师门活动找回礼包 | C168: 2 | D168: 0,100,1,4,100,0;0,100,1,3,6000,0; | E168: 1 | F168: 1
A169: =R[-40]C+100 -> 11602 | B169: 师门活动找回礼包 | C169: 2 | D169: 0,100,1,4,181440,0;0,90,1,10007,2,0; | E169: 1 | F169: 1
A170: =R[-40]C+100 -> 11603 | B170: 师门活动找回礼包 | C170: 2 | D170: 0,100,1,4,185640,0;0,90,1,10007,2,0; | E170: 1 | F170: 1
A171: =R[-40]C+100 -> 11604 | B171: 师门活动找回礼包 | C171: 2 | D171: 0,100,1,4,210840,0;0,90,1,10007,2,0; | E171: 1 | F171: 1
A172: =R[-40]C+100 -> 11605 | B172: 师门活动找回礼包 | C172: 2 | D172: 0,100,1,4,227640,0;0,90,1,10007,2,0; | E172: 1 | F172: 1
A173: =R[-40]C+100 -> 11606 | B173: 赏金活动找回礼包 | C173: 2 | D173: 0,100,1,4,10,0;0,100,1,3,600,0; | E173: 1 | F173: 1
A174: =R[-40]C+100 -> 11607 | B174: 赏金活动找回礼包 | C174: 2 | D174: 0,100,1,4,10,0;0,100,1,3,600,0; | E174: 1 | F174: 1
A175: =R[-40]C+100 -> 11608 | B175: 赏金活动找回礼包 | C175: 2 | D175: 0,100,1,4,63750,0;0,80,1,11007,1,0;0,80,1,31000,1,0;0,80,1,11008,1,0; | E175: 1 | F175: 1
A176: =R[-40]C+100 -> 11609 | B176: 赏金活动找回礼包 | C176: 2 | D176: 0,100,1,4,63750,0;0,80,1,11007,1,0;0,80,1,31000,1,0;0,80,1,11008,1,0; | E176: 1 | F176: 1
A177: =R[-40]C+100 -> 11610 | B177: 赏金活动找回礼包 | C177: 2 | D177: 0,100,1,4,63750,0;0,80,1,11007,1,0;0,80,1,31000,1,0;0,80,1,11008,1,0; | E177: 1 | F177: 1
A178: =R[-40]C+100 -> 11611 | B178: 捉妖活动找回礼包 | C178: 2 | D178: 0,100,1,4,31560,0;0,4,1,10108,1,0;0,7,1,10007,2,0;0,4,1,12000,1,0;0,4,1,12001,1,0;0,4,1,12002,1,0;0,4,1,12003,1,0;0,4,1,12004,1,0;0,4,1,12005,1,0;0,4,1,12006,1,0;0,4,1,12007,1,0;0,5,1,10001,1,0;0,3,1,10002,1,0; | E178: 1 | F178: 1
A179: =R[-40]C+100 -> 11612 | B179: 捉妖活动找回礼包 | C179: 2 | D179: 0,100,1,4,34685,0;0,4,1,10108,1,0;0,7,1,10007,2,0;0,4,1,12000,1,0;0,4,1,12001,1,0;0,4,1,12002,1,0;0,4,1,12003,1,0;0,4,1,12004,1,0;0,4,1,12005,1,0;0,4,1,12006,1,0;0,4,1,12007,1,0;0,5,1,10001,1,0;0,3,1,10002,1,0; | E179: 1 | F179: 1
A180: =R[-40]C+100 -> 11613 | B180: 捉妖活动找回礼包 | C180: 2 | D180: 0,100,1,4,37810,0;0,4,1,10108,1,0;0,7,1,10007,2,0;0,4,1,12000,1,0;0,4,1,12001,1,0;0,4,1,12002,1,0;0,4,1,12003,1,0;0,4,1,12004,1,0;0,4,1,12005,1,0;0,4,1,12006,1,0;0,4,1,12007,1,0;0,5,1,10001,1,0;0,3,1,10002,1,0;0,1,1,1101103,1,1;0,1,1,1101203,1,1;0,1,1,1102103,1,1;0,1,1,1102203,1,1;0,1,1,1103103,1,1;0,1,1,1103203,1,1;0,1,1,1104103,1,1;0,1,1,1104203,1,1;0,1,1,1105103,1,1;0,1,1,1105203,1,1;0,1,1,1200103,1,1;0,1,1,1200203,1,1;0,1,1,1300103,1,1;0,1,1,1300203,1,1;0,1,1,1400003,1,1;0,1,1,1500003,1,1;0,1,1,1600003,1,1; | E180: 1 | F180: 1
A181: =R[-40]C+100 -> 11614 | B181: 捉妖活动找回礼包 | C181: 2 | D181: 0,100,1,4,46875,0;0,4,1,10108,1,0;0,7,1,10007,2,0;0,4,1,12000,1,0;0,4,1,12001,1,0;0,4,1,12002,1,0;0,4,1,12003,1,0;0,4,1,12004,1,0;0,4,1,12005,1,0;0,4,1,12006,1,0;0,4,1,12007,1,0;0,5,1,10001,1,0;0,3,1,10002,1,0;0,1,1,1101105,1,1;0,1,1,1101205,1,1;0,1,1,1102105,1,1;0,1,1,1102205,1,1;0,1,1,1103105,1,1;0,1,1,1103205,1,1;0,1,1,1104105,1,1;0,1,1,1104205,1,1;0,1,1,1105105,1,1;0,1,1,1105205,1,1;0,1,1,1200105,1,1;0,1,1,1200205,1,1;0,1,1,1300105,1,1;0,1,1,1300205,1,1;0,1,1,1400005,1,1;0,1,1,1500005,1,1;0,1,1,1600005,1,1; | E181: 1 | F181: 1
A182: =R[-40]C+100 -> 11615 | B182: 捉妖活动找回礼包 | C182: 2 | D182: 0,100,1,4,53125,0;0,4,1,10108,1,0;0,7,1,10007,2,0;0,4,1,12000,1,0;0,4,1,12001,1,0;0,4,1,12002,1,0;0,4,1,12003,1,0;0,4,1,12004,1,0;0,4,1,12005,1,0;0,4,1,12006,1,0;0,4,1,12007,1,0;0,5,1,10001,1,0;0,3,1,10002,1,0;0,1,1,1101107,1,1;0,1,1,1101207,1,1;0,1,1,1102107,1,1;0,1,1,1102207,1,1;0,1,1,1103107,1,1;0,1,1,1103207,1,1;0,1,1,1104107,1,1;0,1,1,1104207,1,1;0,1,1,1105107,1,1;0,1,1,1105207,1,1;0,1,1,1200107,1,1;0,1,1,1200207,1,1;0,1,1,1300107,1,1;0,1,1,1300207,1,1;0,1,1,1400007,1,1;0,1,1,1500007,1,1;0,1,1,1600007,1,1; | E182: 1 | F182: 1
A183: =R[-40]C+100 -> 11616 | B183: 萌仙轶事找回礼包 | C183: 2 | D183: 0,100,1,4,10,0;0,100,1,3,600,0; | E183: 1 | F183: 1
A184: =R[-40]C+100 -> 11617 | B184: 萌仙轶事找回礼包 | C184: 2 | D184: 0,100,1,4,10,0;0,100,1,3,600,0; | E184: 1 | F184: 1
A185: =R[-40]C+100 -> 11618 | B185: 萌仙轶事找回礼包 | C185: 2 | D185: 0,100,1,4,71250,0; | E185: 1 | F185: 1
A186: =R[-40]C+100 -> 11619 | B186: 萌仙轶事找回礼包 | C186: 2 | D186: 0,100,1,4,71250,0; | E186: 1 | F186: 1
A187: =R[-40]C+100 -> 11620 | B187: 萌仙轶事找回礼包 | C187: 2 | D187: 0,100,1,4,71250,0; | E187: 1 | F187: 1
A188: =R[-40]C+100 -> 11621 | B188: 萌仙课堂找回礼包 | C188: 2 | D188: 0,100,1,4,10,0;0,100,1,3,600,0; | E188: 1 | F188: 1
A189: =R[-40]C+100 -> 11622 | B189: 萌仙课堂找回礼包 | C189: 2 | D189: 0,100,1,4,10,0;0,100,1,3,600,0; | E189: 1 | F189: 1
A190: =R[-40]C+100 -> 11623 | B190: 萌仙课堂找回礼包 | C190: 2 | D190: 0,100,1,4,65000,0; | E190: 1 | F190: 1
A191: =R[-40]C+100 -> 11624 | B191: 萌仙课堂找回礼包 | C191: 2 | D191: 0,100,1,4,65000,0; | E191: 1 | F191: 1
A192: =R[-40]C+100 -> 11625 | B192: 萌仙课堂找回礼包 | C192: 2 | D192: 0,100,1,4,65000,0; | E192: 1 | F192: 1
A193: =R[-40]C+100 -> 11626 | B193: 妖兽突袭找回礼包 | C193: 2 | D193: 0,100,1,4,15,0;0,100,1,3,900,0; | E193: 1 | F193: 1
A194: =R[-40]C+100 -> 11627 | B194: 妖兽突袭找回礼包 | C194: 2 | D194: 0,100,1,4,15,0;0,100,1,3,900,0; | E194: 1 | F194: 1
A195: =R[-40]C+100 -> 11628 | B195: 妖兽突袭找回礼包 | C195: 2 | D195: 0,100,1,4,15,0;0,100,1,3,900,0; | E195: 1 | F195: 1
A196: =R[-40]C+100 -> 11629 | B196: 妖兽突袭找回礼包 | C196: 2 | D196: 0,100,1,4,9560,0;0,20,1,19016,15,0;0,40,1,11007,1,0;0,5,1,11008,1,0;0,20,1,28000,15,0; | E196: 1 | F196: 1
A197: =R[-40]C+100 -> 11630 | B197: 妖兽突袭找回礼包 | C197: 2 | D197: 0,100,1,4,9560,0;0,20,1,19016,15,0;0,40,1,11007,1,0;0,5,1,11008,1,0;0,20,1,28000,15,0; | E197: 1 | F197: 1
A198: =R[-40]C+100 -> 11631 | B198: 降妖伏魔找回礼包 | C198: 2 | D198: 0,100,1,4,100,0;0,100,1,3,6000,0; | E198: 1 | F198: 1
A199: =R[-40]C+100 -> 11632 | B199: 降妖伏魔找回礼包 | C199: 2 | D199: 0,100,1,4,100,0;0,100,1,3,6000,0; | E199: 1 | F199: 1
A200: =R[-40]C+100 -> 11633 | B200: 降妖伏魔找回礼包 | C200: 2 | D200: 0,100,1,4,114750,0;0,90,1,19016,5,0;0,90,1,28000,5,0;0,90,1,10108,1,0;0,90,1,27002,2,0; | E200: 1 | F200: 1
A201: =R[-40]C+100 -> 11634 | B201: 降妖伏魔找回礼包 | C201: 2 | D201: 0,100,1,4,140250,0;0,90,1,19016,7,0;0,90,1,28000,7,0;0,90,1,10108,1,0;0,90,1,27003,2,0; | E201: 1 | F201: 1
A202: =R[-40]C+100 -> 11635 | B202: 降妖伏魔找回礼包 | C202: 2 | D202: 0,100,1,4,157250,0;0,90,1,19016,8,0;0,90,1,28000,8,0;0,90,1,10108,2,0;0,90,1,27005,2,0; | E202: 1 | F202: 1
A203: =R[-40]C+100 -> 11636 | B203: 诛心魔找回礼包 | C203: 2 | D203: 0,100,1,4,10,0;0,100,1,3,600,0; | E203: 1 | F203: 1
A204: =R[-40]C+100 -> 11637 | B204: 诛心魔找回礼包 | C204: 2 | D204: 0,100,1,4,10,0;0,100,1,3,600,0; | E204: 1 | F204: 1
A205: =R[-40]C+100 -> 11638 | B205: 诛心魔找回礼包 | C205: 2 | D205: 0,100,1,4,10,0;0,100,1,3,600,0; | E205: 1 | F205: 1
A206: =R[-40]C+100 -> 11639 | B206: 诛心魔找回礼包 | C206: 2 | D206: 0,100,1,4,425000,0;0,30,1,10008,1,0;0,5,1,18000,1,0;0,5,1,18001,1,0;0,5,1,18002,1,0;0,5,1,18003,1,0;0,5,1,18004,1,0;0,30,1,11008,1,0;0,5,1,19005,1,0;0,5,1,19006,1,0;0,5,1,19007,1,0;0,5,1,19008,1,0;0,5,1,19009,1,0;0,5,1,2000103,1,0;0,5,1,2000203,1,0;0,5,1,2000303,1,0; | E206: 1 | F206: 1
A207: =R[-40]C+100 -> 11640 | B207: 诛心魔找回礼包 | C207: 2 | D207: 0,100,1,4,425000,0;0,30,1,10008,1,0;0,5,1,18000,1,0;0,5,1,18001,1,0;0,5,1,18002,1,0;0,5,1,18003,1,0;0,5,1,18004,1,0;0,30,1,11008,1,0;0,5,1,19005,1,0;0,5,1,19006,1,0;0,5,1,19007,1,0;0,5,1,19008,1,0;0,5,1,19009,1,0;0,5,1,2000103,1,0;0,5,1,2000203,1,0;0,5,1,2000303,1,0; | E207: 1 | F207: 1
A208: 13303 | B208: 邀请大礼包 | C208: 1 | D208: 0,100,1,3,1000,0;0,100,1,4,100000,0;0,100,1,18005,1,0;0,100,1,28000,3,0;0,100,1,19016,3,0;0,100,1,19018,1,0;0,100,1,10009,1,0;0,30,1,2000101,1,0;0,30,1,2000201,1,0;0,30,1,2000301,1,0;0,100,1,10008,2,0;0,100,1,10007,2,0; | E208: 0 | F208: 1
A209: 13302 | B209: 神兽锦盒 | C209: 2 | D209: 0,30,1,13358,1,0;0,100,1,3,10000,0; | E209: 0 | F209: 1
A210: 13304 | B210: 跨服帮战获胜礼包 | C210: 1 | D210: 0,100,1,16001,1,0;0,100,1,16002,1,0;0,100,1,16003,1,0;0,100,1,16004,1,0;0,100,1,16005,1,0;0,100,1,16006,1,0;0,100,1,16007,1,0;0,100,1,16008,1,0;0,100,1,16009,1,0;0,100,1,16010,1,0;0,100,1,16011,1,0;0,100,1,16012,1,0;0,100,1,16013,1,0;0,100,1,16014,1,0;0,100,1,16015,1,0;0,100,1,16016,1,0;0,100,1,16017,1,0;0,100,1,16018,1,0;0,100,1,16019,1,0;0,100,1,16020,1,0;0,100,1,16021,1,0;0,100,1,16022,1,0;0,100,1,16023,1,0;0,100,1,16024,1,0;0,100,1,16025,1,0;0,100,1,16026,1,0;0,100,1,16027,1,0;0,100,1,16028,1,0;0,100,1,16029,1,0;0,100,1,16030,1,0;0,100,1,16031,1,0;0,100,1,16032,1,0;0,100,1,16033,1,0;0,100,1,16034,1,0;0,100,1,16035,1,0;0,100,1,16036,1,0;0,100,1,16037,1,0;0,100,1,16038,1,0;0,100,1,16101,1,0;0,100,1,16102,1,0;0,100,1,16103,1,0;0,100,1,16104,1,0; | E210: 0 | F210: 1
A211: 40001 | B211: 小礼物 | C211: 1 | D211: 0,100,1,4,20000,0; | E211: 0 | F211: 4
A212: 40002 | B212: 大礼包 | C212: 1 | D212: 0,100,1,3,2000,0; | E212: 0 | F212: 4
A213: 40003 | B213: 豪华礼包 | C213: 1 | D213: 0,100,1,3,10000,0; | E213: 0 | F213: 4
A214: 11002 | B214: 宝石袋 | C214: 1 | D214: 0,100,1,30001,1,0;0,100,1,30002,1,0;0,100,1,30003,1,0;0,100,1,30004,1,0;0,100,1,30005,1,0;0,100,1,30006,1,0;0,100,1,30007,1,0;0,100,1,30008,1,0;0,100,1,30009,1,0; | E214: 0 | F214: 1
A215: 11003 | B215: 大宝石袋 | C215: 1 | D215: 0,100,1,30001,5,0;0,100,1,30002,5,0;0,100,1,30003,5,0;0,100,1,30004,5,0;0,100,1,30005,5,0;0,100,1,30006,5,0;0,100,1,30007,5,0;0,100,1,30008,5,0;0,100,1,30009,5,0; | E215: 0 | F215: 1
A216: 13301 | B216: 萌仙同行称谓 | C216: 1 | D216: 0,100,6,91,1,0; | E216: 0 | F216: 1
A217: 13307 | B217: 10级装备礼包 | C217: 2 | D217: 1,100,1,1200101,1,3;2,100,1,1200201,1,3;1,100,1,1300101,1,3;2,100,1,1300201,1,3;3,100,1,1200101,1,3;4,100,1,1200201,1,3;3,100,1,1300101,1,3;4,100,1,1300201,1,3;5,100,1,1200101,1,3;6,100,1,1200201,1,3;5,100,1,1300101,1,3;6,100,1,1300201,1,3;7,100,1,1200101,1,3;8,100,1,1200201,1,3;7,100,1,1300101,1,3;8,100,1,1300201,1,3;9,100,1,1200101,1,3;10,100,1,1200201,1,3;9,100,1,1300101,1,3;10,100,1,1300201,1,3;0,100,1,1400001,1,3;0,100,1,1500001,1,3;0,100,1,1600001,1,3;1,100,1,1101101,1,4;2,100,1,1101201,1,4;3,100,1,1102101,1,4;4,100,1,1102201,1,4;5,100,1,1103101,1,4;6,100,1,1103201,1,4;7,100,1,1104101,1,4;8,100,1,1104201,1,4;9,100,1,1105101,1,4;10,100,1,1105201,1,4; | E217: 1 | F217: 1
A218: 13308 | B218: 20级装备礼包 | C218: 2 | D218: 1,100,1,1200102,1,3;2,100,1,1200202,1,3;1,100,1,1300102,1,3;2,100,1,1300202,1,3;3,100,1,1200102,1,3;4,100,1,1200202,1,3;3,100,1,1300102,1,3;4,100,1,1300202,1,3;5,100,1,1200102,1,3;6,100,1,1200202,1,3;5,100,1,1300102,1,3;6,100,1,1300202,1,3;7,100,1,1200102,1,3;8,100,1,1200202,1,3;7,100,1,1300102,1,3;8,100,1,1300202,1,3;9,100,1,1200102,1,3;10,100,1,1200202,1,3;9,100,1,1300102,1,3;10,100,1,1300202,1,3;0,100,1,1400002,1,3;0,100,1,1500002,1,3;0,100,1,1600002,1,3;1,100,1,1101102,1,4;2,100,1,1101202,1,4;3,100,1,1102102,1,4;4,100,1,1102202,1,4;5,100,1,1103102,1,4;6,100,1,1103202,1,4;7,100,1,1104102,1,4;8,100,1,1104202,1,4;9,100,1,1105102,1,4;10,100,1,1105202,1,4; | E218: 1 | F218: 1
A219: 13309 | B219: 30级装备礼包 | C219: 2 | D219: 1,100,1,1200103,1,3;2,100,1,1200203,1,3;1,100,1,1300103,1,3;2,100,1,1300203,1,3;3,100,1,1200103,1,3;4,100,1,1200203,1,3;3,100,1,1300103,1,3;4,100,1,1300203,1,3;5,100,1,1200103,1,3;6,100,1,1200203,1,3;5,100,1,1300103,1,3;6,100,1,1300203,1,3;7,100,1,1200103,1,3;8,100,1,1200203,1,3;7,100,1,1300103,1,3;8,100,1,1300203,1,3;9,100,1,1200103,1,3;10,100,1,1200203,1,3;9,100,1,1300103,1,3;10,100,1,1300203,1,3;0,100,1,1400003,1,3;0,100,1,1500003,1,3;0,100,1,1600003,1,3;1,100,1,1101103,1,4;2,100,1,1101203,1,4;3,100,1,1102103,1,4;4,100,1,1102203,1,4;5,100,1,1103103,1,4;6,100,1,1103203,1,4;7,100,1,1104103,1,4;8,100,1,1104203,1,4;9,100,1,1105103,1,4;10,100,1,1105203,1,4; | E219: 1 | F219: 1
A220: 13310 | B220: 40级装备礼包 | C220: 2 | D220: 1,100,1,1200104,1,3;2,100,1,1200204,1,3;1,100,1,1300104,1,3;2,100,1,1300204,1,3;3,100,1,1200104,1,3;4,100,1,1200204,1,3;3,100,1,1300104,1,3;4,100,1,1300204,1,3;5,100,1,1200104,1,3;6,100,1,1200204,1,3;5,100,1,1300104,1,3;6,100,1,1300204,1,3;7,100,1,1200104,1,3;8,100,1,1200204,1,3;7,100,1,1300104,1,3;8,100,1,1300204,1,3;9,100,1,1200104,1,3;10,100,1,1200204,1,3;9,100,1,1300104,1,3;10,100,1,1300204,1,3;0,100,1,1400004,1,3;0,100,1,1500004,1,3;0,100,1,1600004,1,3;1,100,1,1101104,1,4;2,100,1,1101204,1,4;3,100,1,1102104,1,4;4,100,1,1102204,1,4;5,100,1,1103104,1,4;6,100,1,1103204,1,4;7,100,1,1104104,1,4;8,100,1,1104204,1,4;9,100,1,1105104,1,4;10,100,1,1105204,1,4; | E220: 1 | F220: 1
A221: 13311 | B221: 50级装备礼包 | C221: 2 | D221: 1,100,1,1200105,1,3;2,100,1,1200205,1,3;1,100,1,1300105,1,3;2,100,1,1300205,1,3;3,100,1,1200105,1,3;4,100,1,1200205,1,3;3,100,1,1300105,1,3;4,100,1,1300205,1,3;5,100,1,1200105,1,3;6,100,1,1200205,1,3;5,100,1,1300105,1,3;6,100,1,1300205,1,3;7,100,1,1200105,1,3;8,100,1,1200205,1,3;7,100,1,1300105,1,3;8,100,1,1300205,1,3;9,100,1,1200105,1,3;10,100,1,1200205,1,3;9,100,1,1300105,1,3;10,100,1,1300205,1,3;0,100,1,1400005,1,3;0,100,1,1500005,1,3;0,100,1,1600005,1,3;1,100,1,1101105,1,4;2,100,1,1101205,1,4;3,100,1,1102105,1,4;4,100,1,1102205,1,4;5,100,1,1103105,1,4;6,100,1,1103205,1,4;7,100,1,1104105,1,4;8,100,1,1104205,1,4;9,100,1,1105105,1,4;10,100,1,1105205,1,4; | E221: 1 | F221: 1
A222: 11006 | B222: 随机五宝盒 | C222: 1 | D222: 0,100,1,18000,1,0;0,100,1,18001,1,0;0,100,1,18002,1,0;0,100,1,18003,1,0;0,100,1,18004,1,0; | E222: 0 | F222: 1
A223: 13312 | B223: 30级法宝礼包 | C223: 2 | D223: 0,100,5,32001,1,0; | E223: 1 | F223: 1
A224: 13313 | B224: 40级法宝礼包 | C224: 2 | D224: 0,100,5,32002,1,0; | E224: 1 | F224: 1
A225: 13314 | B225: 50级法宝礼包 | C225: 2 | D225: 0,100,5,32003,1,0; | E225: 1 | F225: 1
A226: 13315 | B226: 60级法宝礼包 | C226: 2 | D226: 0,100,5,32001,1,0;0,100,5,32002,1,0;0,100,5,32003,1,0; | E226: 1 | F226: 1
A227: 13316 | B227: 70级法宝礼包 | C227: 2 | D227: 0,100,5,32001,1,0;0,100,5,32002,1,0;0,100,5,32003,1,0; | E227: 1 | F227: 1
A228: 13317 | B228: 称谓测试包 | C228: 2 | D228: 0,100,6,94,1,0;0,100,6,95,1,0;0,100,6,96,1,0;0,100,6,97,1,0;0,100,6,98,1,0;0,100,6,99,1,0; | E228: 0 | F228: 1
A229: 13331 | B229: 1星法宝礼包 | C229: 1 | D229: 0,100,5,32001,1,0;0,100,5,32002,1,0;0,100,5,32003,1,0; | E229: 1 | F229: 1
A230: 13332 | B230: 仙侣灵珠礼包 | C230: 2 | D230: 0,100,1,20051,1,0;0,100,1,20052,1,0;0,100,1,20053,1,0;0,100,1,20054,1,0;0,100,1,20055,1,0;0,100,1,20056,1,0; | E230: 1 | F230: 1
A231: 13335 | B231: 萌仙新丁称谓 | C231: 1 | D231: 0,100,6,100,1,0; | E231: 0 | F231: 1
A232: 13336 | B232: 强化石礼包 | C232: 1 | D232: 0,100,1,28000,10,2; | E232: 0 | F232: 1
A233: 13337 | B233: 洗髓丹礼包 | C233: 2 | D233: 0,100,1,19016,10,3; | E233: 0 | F233: 1
A234: 13338 | B234: 祭炼石礼包 | C234: 2 | D234: 0,100,1,10113,10,4; | E234: 0 | F234: 1
A235: 13339 | B235: 10人团购礼包 | C235: 2 | D235: 0,100,1,28000,150,2;0,100,1,28002,10,5; | E235: 0 | F235: 1
A236: 13340 | B236: 50人团购礼包 | C236: 2 | D236: 0,100,1,19016,150,3;0,100,1,19020,5,5; | E236: 0 | F236: 1
A237: 13341 | B237: 100人团购礼包 | C237: 2 | D237: 0,100,1,19022,100,3;0,100,1,10014,5,4; | E237: 0 | F237: 1
A238: 13342 | B238: 200人团购礼包 | C238: 2 | D238: 0,100,1,10113,100,4;0,100,1,10014,5,4; | E238: 0 | F238: 1
A239: 13343 | B239: 仙侣大礼包 | C239: 2 | D239: 0,100,1,20057,1,4;0,100,1,20058,1,4;0,100,1,20059,1,4;0,100,1,20060,1,4;0,100,1,20061,1,4;0,100,1,20062,1,4; | E239: 0 | F239: 1
A240: 13344 | B240: 仙侣礼包 | C240: 2 | D240: 0,100,1,20051,1,3;0,100,1,20052,1,3;0,100,1,20053,1,3;0,100,1,20054,1,3;0,100,1,20055,1,3;0,100,1,20056,1,3; | E240: 0 | F240: 1
A241: 13359 | B241: 师门礼包 | C241: 2 | D241: 0,100,1,13333,1,0;0,100,1,10007,5,0;0,100,1,18005,1,0; | E241: 0 | F241: 1
A242: 13349 | B242: 富甲天下 | C242: 2 | D242: 0,100,6,65,1,0; | E242: 0 | F242: 1
A243: 13350 | B243: 壕不犹豫 | C243: 2 | D243: 0,100,6,64,1,0; | E243: 0 | F243: 1
A244: 13351 | B244: 再世财神 | C244: 2 | D244: 0,100,6,81,1,0; | E244: 0 | F244: 1
A245: 13352 | B245: 财神下凡 | C245: 2 | D245: 0,100,6,83,1,0; | E245: 0 | F245: 1
A246: 13353 | B246: 一掷千金 | C246: 2 | D246: 0,100,6,62,1,0; | E246: 0 | F246: 1
A247: 13354 | B247: 有钱任性 | C247: 2 | D247: 0,100,6,63,1,0; | E247: 0 | F247: 1
A248: 13355 | B248: 人民币战神 | C248: 2 | D248: 0,100,6,85,1,0; | E248: 0 | F248: 1
A249: 13356 | B249: 穷得只剩钱 | C249: 2 | D249: 0,100,6,82,1,0; | E249: 0 | F249: 1
A250: 13503 | B250: 铁无双礼包 | C250: 2 | D250: 0,100,1,13500,67,0; | E250: 0 | F250: 1
A251: 13507 | B251: 内丹礼包 | C251: 2 | D251: 0,100,1,15,5000,0; | E251: 0 | F251: 1
A252: 13510 | B252: 镇元大仙礼包 | C252: 2 | D252: 0,100,1,13508,20,0; | E252: 0 | F252: 1
A253: 13511 | B253: 燕赤霞礼包 | C253: 2 | D253: 0,100,1,13509,20,0; | E253: 0 | F253: 1
A254: 13512 | B254: 神兽之灵锦盒 | C254: 2 | D254: 0,100,1,19011,1,0; | E254: 0 | F254: 1
A255: 13513 | B255: 举世无双礼包 | C255: 2 | D255: 0,100,6,23,1,0; | E255: 0 | F255: 1
A256: 13514 | B256: 傲视群雄礼包 | C256: 2 | D256: 0,100,6,24,1,0; | E256: 0 | F256: 1
A257: 13515 | B257: 法宝大礼包 | C257: 2 | D257: 0,100,5,32101,1,0;0,100,5,32102,1,0;0,100,5,32103,1,0; | E257: 0 | F257: 1
A258: 13516 | B258: 6元家具抽奖券 | C258: 2 | D258: 0,100,1,3,1000,0;0,1,1,35013,1,0;0,1,1,35015,1,0; | E258: 0 | F258: 1
A259: 13517 | B259: 30元家具抽奖券 | C259: 2 | D259: 0,100,1,3,5000,0;0,1,1,35023,1,0;0,1,1,35025,1,0; | E259: 0 | F259: 1
A260: 13518 | B260: 30级装备礼包 | C260: 2 | D260: 1,100,1,1200103,1,4;2,100,1,1200203,1,4;1,100,1,1300103,1,4;2,100,1,1300203,1,4;3,100,1,1200103,1,4;4,100,1,1200203,1,4;3,100,1,1300103,1,4;4,100,1,1300203,1,4;5,100,1,1200103,1,4;6,100,1,1200203,1,4;5,100,1,1300103,1,4;6,100,1,1300203,1,4;7,100,1,1200103,1,4;8,100,1,1200203,1,4;7,100,1,1300103,1,4;8,100,1,1300203,1,4;9,100,1,1200103,1,4;10,100,1,1200203,1,4;9,100,1,1300103,1,4;10,100,1,1300203,1,4; | E260: 0 | F260: 1
A261: 13519 | B261: 40级装备礼包 | C261: 2 | D261: 1,100,1,1200104,1,4;2,100,1,1200204,1,4;1,100,1,1300104,1,4;2,100,1,1300204,1,4;3,100,1,1200104,1,4;4,100,1,1200204,1,4;3,100,1,1300104,1,4;4,100,1,1300204,1,4;5,100,1,1200104,1,4;6,100,1,1200204,1,4;5,100,1,1300104,1,4;6,100,1,1300204,1,4;7,100,1,1200104,1,4;8,100,1,1200204,1,4;7,100,1,1300104,1,4;8,100,1,1300204,1,4;9,100,1,1200104,1,4;10,100,1,1200204,1,4;9,100,1,1300104,1,4;10,100,1,1300204,1,4; | E261: 0 | F261: 1
A262: 13520 | B262: 50级装备礼包 | C262: 2 | D262: 1,100,1,1200105,1,4;2,100,1,1200205,1,4;1,100,1,1300105,1,4;2,100,1,1300205,1,4;3,100,1,1200105,1,4;4,100,1,1200205,1,4;3,100,1,1300105,1,4;4,100,1,1300205,1,4;5,100,1,1200105,1,4;6,100,1,1200205,1,4;5,100,1,1300105,1,4;6,100,1,1300205,1,4;7,100,1,1200105,1,4;8,100,1,1200205,1,4;7,100,1,1300105,1,4;8,100,1,1300205,1,4;9,100,1,1200105,1,4;10,100,1,1200205,1,4;9,100,1,1300105,1,4;10,100,1,1300205,1,4; | E262: 0 | F262: 1
A263: 13521 | B263: 30级装备礼包 | C263: 2 | D263: 0,100,1,1400003,1,4;0,100,1,1500003,1,4;0,100,1,1600003,1,4; | E263: 0 | F263: 1
A264: 13522 | B264: 40级装备礼包 | C264: 2 | D264: 0,100,1,1400004,1,4;0,100,1,1500004,1,4;0,100,1,1600004,1,4; | E264: 0 | F264: 1
A265: 13523 | B265: 50级装备礼包 | C265: 2 | D265: 0,100,1,1400005,1,4;0,100,1,1500005,1,4;0,100,1,1600005,1,4; | E265: 0 | F265: 1
A266: 13524 | B266: 宠物三级礼包 | C266: 2 | D266: 0,100,1,2000103,1,0;0,100,1,2000203,1,0; | E266: 0 | F266: 1
A267: 13525 | B267: 法宝幸运大礼包 | C267: 1 | D267: 0,3000,5,32101,1,0;0,3000,5,32102,1,0;0,3000,5,32103,1,0;0,500,5,32201,1,0;0,500,5,32202,1,0;0,500,5,32203,1,0;0,50,5,32301,1,0;0,50,5,32302,1,0;0,50,5,32303,1,0;0,50,5,32304,1,0;0,50,5,32305,1,0;0,50,5,32306,1,0;0,10,5,32401,1,0;0,10,5,32402,1,0;0,10,5,32403,1,0;0,10,5,32404,1,0;0,10,5,32405,1,0;0,10,5,32406,1,0;0,1,5,32501,1,0;0,1,5,32502,1,0;0,1,5,32503,1,0;0,1,5,32504,1,0;0,1,5,32505,1,0;0,1,5,32506,1,0;0,1,5,32507,1,0;0,1,5,32508,1,0;0,1,5,32509,1,0;0,1,5,32510,1,0;0,1,5,32511,1,0;0,1,5,32512,1,0; | E267: 0 | F267: 1
A268: 13526 | B268: 家园宝箱 | C268: 1 | D268: 0,100,1,3,1000,0;0,100,1,28000,2,0;0,100,1,19016,2,0;0,100,5,32001,1,0;0,100,5,32002,1,0;0,100,5,32003,1,0; | E268: 0 | F268: 1
A269: 13527 | B269: 初级法宝礼包 | C269: 1 | D269: 0,1667,5,32001,1,0;0,1667,5,32002,1,0;0,1667,5,32003,1,0;0,667,5,32101,1,0;0,667,5,32102,1,0;0,667,5,32103,1,0;0,166,5,32201,1,0;0,166,5,32202,1,0;0,166,5,32203,1,0;0,33,5,32301,1,0;0,33,5,32302,1,0;0,33,5,32303,1,0;0,33,5,32304,1,0;0,33,5,32305,1,0;0,33,5,32306,1,0;0,8,5,32401,1,0;0,8,5,32402,1,0;0,8,5,32403,1,0;0,8,5,32404,1,0;0,8,5,32405,1,0;0,8,5,32406,1,0;0,2,5,32501,1,0;0,1,5,32502,1,0;0,2,5,32503,1,0;0,1,5,32504,1,0;0,2,5,32505,1,0;0,1,5,32506,1,0;0,2,5,32507,1,0;0,2,5,32508,1,0;0,2,5,32509,1,0;0,2,5,32510,1,0;0,2,5,32511,1,0;0,2,5,32512,1,0; | E269: 0 | F269: 1
A270: 13528 | B270: 中级法宝礼包 | C270: 1 | D270: 0,1667,5,32101,1,0;0,1667,5,32102,1,0;0,1667,5,32103,1,0;0,833,5,32201,1,0;0,833,5,32202,1,0;0,833,5,32203,1,0;0,33,5,32301,1,0;0,33,5,32302,1,0;0,33,5,32303,1,0;0,33,5,32304,1,0;0,33,5,32305,1,0;0,33,5,32306,1,0;0,8,5,32401,1,0;0,8,5,32402,1,0;0,8,5,32403,1,0;0,8,5,32404,1,0;0,8,5,32405,1,0;0,8,5,32406,1,0;0,2,5,32501,1,0;0,1,5,32502,1,0;0,2,5,32503,1,0;0,1,5,32504,1,0;0,2,5,32505,1,0;0,1,5,32506,1,0;0,2,5,32507,1,0;0,2,5,32508,1,0;0,2,5,32509,1,0;0,2,5,32510,1,0;0,2,5,32511,1,0;0,2,5,32512,1,0; | E270: 0 | F270: 1
A271: 13529 | B271: 高级法宝礼包 | C271: 1 | D271: 0,2500,5,32201,1,0;0,2500,5,32202,1,0;0,2500,5,32203,1,0;0,33,5,32301,1,0;0,33,5,32302,1,0;0,33,5,32303,1,0;0,33,5,32304,1,0;0,33,5,32305,1,0;0,33,5,32306,1,0;0,8,5,32401,1,0;0,8,5,32402,1,0;0,8,5,32403,1,0;0,8,5,32404,1,0;0,8,5,32405,1,0;0,8,5,32406,1,0;0,2,5,32501,1,0;0,1,5,32502,1,0;0,2,5,32503,1,0;0,1,5,32504,1,0;0,2,5,32505,1,0;0,1,5,32506,1,0;0,2,5,32507,1,0;0,2,5,32508,1,0;0,2,5,32509,1,0;0,2,5,32510,1,0;0,2,5,32511,1,0;0,2,5,32512,1,0; | E271: 0 | F271: 1
A272: 13530 | B272: 每日小礼包 | C272: 1 | D272: 0,97,1,3,1000,0;0,3,1,35013,1,0; | E272: 0 | F272: 1
A273: 13531 | B273: 每日大礼包 | C273: 1 | D273: 0,97,1,3,6000,0;0,3,1,35015,1,0; | E273: 0 | F273: 1
A274: 13532 | B274: 每日超级礼包 | C274: 1 | D274: 0,99,1,3,18000,0;0,1,1,35023,1,0; | E274: 0 | F274: 1
A275: 13533 | B275: 每日豪华礼包 | C275: 1 | D275: 0,99,1,3,30000,0;0,1,1,35025,1,0; | E275: 0 | F275: 1
A276: 13534 | B276: 仙侣礼盒 | C276: 1 | D276: 0,100,1,20057,1,0;0,100,1,20058,1,0;0,100,1,20059,1,0;0,100,1,20060,1,0;0,100,1,20061,1,0;0,100,1,20062,1,0; | E276: 0 | F276: 1
A277: 11029 | B277: 月老的礼品 | C277: 1 | D277: 0,100,1,30001,1,0;0,100,1,30002,1,0;0,100,1,30003,1,0;0,100,1,30004,1,0;0,100,1,30005,1,0;0,100,1,30006,1,0;0,100,1,30007,1,0;0,100,1,30008,1,0;0,100,1,30009,1,0;0,100,1,28000,1,0;0,100,1,19016,1,0;0,20,1,10001,1,0;0,20,1,10002,1,0; | E277: 0 | F277: 1
A278: 13601 | B278: 宠物装备包 | C278: 1 | D278: 0,100,1,2000103,1,0;0,100,1,2000104,1,0;0,100,1,2000203,1,0;0,100,1,2000204,1,0;0,100,1,2000303,1,0;0,100,1,2000304,1,0; | E278: 0 | F278: 1
A279: 13602 | B279: 随机资质丹包 | C279: 1 | D279: 0,100,1,19005,1,0;0,100,1,19006,1,0;0,100,1,19007,1,0;0,100,1,19008,1,0;0,100,1,19009,1,0; | E279: 0 | F279: 1
A280: 13603 | B280: 神兵礼包 | C280: 1 | D280: 0,100,1,140009900,1,0;0,100,1,150009900,1,0;0,100,1,160009900,1,0; | E280: 0 | F280: 1
A281: 13604 | B281: 六星法宝礼包 | C281: 1 | D281: 0,2,5,32501,1,0;0,1,5,32502,1,0;0,2,5,32503,1,0;0,1,5,32504,1,0;0,2,5,32505,1,0;0,1,5,32506,1,0;0,2,5,32507,1,0;0,2,5,32508,1,0;0,2,5,32509,1,0;0,2,5,32510,1,0;0,2,5,32511,1,0;0,2,5,32512,1,0; | E281: 0 | F281: 1
A282: 13701 | B282: 强化石礼包 | C282: 2 | D282: 0,100,1,28000,80,0; | E282: 0 | F282: 1
A283: 13731 | B283: 仙阵进阶小礼包 | C283: 2 | D283: 0,100,1,28001,36,0; | E283: 0 | F283: 1
A284: 13761 | B284: 情义进阶小礼包 | C284: 2 | D284: 0,100,1,28002,15,0; | E284: 0 | F284: 1
A285: 13702 | B285: 阵法礼包 | C285: 2 | D285: 0,100,1,10204,64,0; | E285: 0 | F285: 1
A286: 13732 | B286: 御兽进阶小礼包 | C286: 2 | D286: 0,100,1,10204,147,0; | E286: 0 | F286: 1
A287: 13762 | B287: 修炼礼包 | C287: 2 | D287: 0,100,1,10204,368,0; | E287: 0 | F287: 1
A288: 13703 | B288: 宝石礼包 | C288: 2 | D288: 0,100,1,10207,64,0; | E288: 0 | F288: 1
A289: 13733 | B289: 法宝祭炼石礼包 | C289: 2 | D289: 0,100,1,10207,147,0; | E289: 0 | F289: 1
A290: 13763 | B290: 内丹礼包 | C290: 2 | D290: 0,100,1,10207,368,0; | E290: 0 | F290: 1
A291: 13704 | B291: 仙羽进阶小礼包 | C291: 2 | D291: 0,100,1,31000,16,0; | E291: 0 | F291: 1
A292: 13734 | B292: 器灵小礼包 | C292: 2 | D292: 0,100,1,31000,36,0; | E292: 0 | F292: 1
A293: 13764 | B293: 宠物觉醒礼包 | C293: 2 | D293: 0,100,1,31000,92,0; | E293: 0 | F293: 1
A294: 13705 | B294: 定灵玉礼包 | C294: 2 | D294: 0,100,1,10203,64,0; | E294: 0 | F294: 1
A295: 13735 | B295: 仙阵进阶大礼包 | C295: 2 | D295: 0,100,1,10203,147,0; | E295: 0 | F295: 1
A296: 13765 | B296: 情义进阶大礼包 | C296: 2 | D296: 0,100,1,10203,368,0; | E296: 0 | F296: 1
A297: 13706 | B297: 阵法大礼包 | C297: 2 | D297: 0,100,1,10008,64,0; | E297: 0 | F297: 1
A298: 13736 | B298: 御兽进阶大礼包 | C298: 2 | D298: 0,100,1,10008,147,0; | E298: 0 | F298: 1
A299: 13766 | B299: 修炼大礼包 | C299: 2 | D299: 0,100,1,10008,368,0; | E299: 0 | F299: 1
A300: 13707 | B300: 宝石大礼包 | C300: 2 | D300: 0,100,1,11002,16,0; | E300: 0 | F300: 1
A301: 13737 | B301: 法宝祭炼大礼包 | C301: 2 | D301: 0,100,1,11002,36,0; | E301: 0 | F301: 1
A302: 13767 | B302: 内丹大礼包 | C302: 2 | D302: 0,100,1,11002,92,0; | E302: 0 | F302: 1
A303: 13708 | B303: 仙羽进阶大礼包 | C303: 2 | D303: 0,100,1,10113,26,0; | E303: 0 | F303: 1
A304: 13738 | B304: 器灵大礼包 | C304: 2 | D304: 0,100,1,10113,61,0; | E304: 0 | F304: 1
A305: 13768 | B305: 宠物觉醒大礼包 | C305: 2 | D305: 0,100,1,10113,153,0; | E305: 0 | F305: 1
A306: 13709 | B306: 幸运符礼包 | C306: 2 | D306: 0,100,1,15,16000,0; | E306: 0 | F306: 1
A307: 13739 | B307: 仙阵进阶豪华礼包 | C307: 2 | D307: 0,100,1,15,36750,0; | E307: 0 | F307: 1
A308: 13769 | B308: 情义进阶豪华礼包 | C308: 2 | D308: 0,100,1,15,92000,0; | E308: 0 | F308: 1
A309: 13710 | B309: 阵法豪华礼包 | C309: 2 | D309: 0,100,1,10201,64,0; | E309: 0 | F309: 1
A310: 13740 | B310: 御兽进阶豪华礼包 | C310: 2 | D310: 0,100,1,10201,147,0; | E310: 0 | F310: 1
A311: 13770 | B311: 修炼豪华礼包 | C311: 2 | D311: 0,100,1,10201,368,0; | E311: 0 | F311: 1
A312: 13711 | B312: 宝石豪华礼包 | C312: 2 | D312: 0,100,1,10108,16,0; | E312: 0 | F312: 1
A313: 13741 | B313: 法宝祭炼豪华礼包 | C313: 2 | D313: 0,100,1,10108,36,0; | E313: 0 | F313: 1
A314: 13771 | B314: 内丹豪华礼包 | C314: 2 | D314: 0,100,1,10108,92,0; | E314: 0 | F314: 1
A315: 13712 | B315: 仙羽进阶豪华礼包 | C315: 2 | D315: 0,100,1,10209,12,0; | E315: 0 | F315: 1
A316: 13742 | B316: 器灵豪华礼包 | C316: 2 | D316: 0,100,1,10209,29,0; | E316: 0 | F316: 1
A317: 13772 | B317: 宠物觉醒豪华礼包 | C317: 2 | D317: 0,100,1,10209,73,0; | E317: 0 | F317: 1
A318: 13801 | B318: 极品宠物礼包 | C318: 2 | D318: 0,100,1,2000304,1,0;0,100,1,2000104,1,0;0,100,1,2000204,1,0;0,100,1,18006,5,0;0,100,1,11008,5,0;0,100,1,19000,99,0;0,100,1,19020,10,0;0,100,1,19018,30,0;0,100,1,10209,99,0; | E318: 0 | F318: 1
A319: 13802 | B319: 豪华装备礼包 | C319: 2 | D319: 0,100,1,11003,10,0;0,100,1,28000,200,0;0,100,1,28001,30,0;0,100,1,28002,10,0;0,100,1,28007,10,0;0,100,1,10014,10,0; | E319: 0 | F319: 1
A320: 13803 | B320: 惊喜大礼包 | C320: 2 | D320: 0,100,1,11006,20,0;0,100,1,11002,20,0;0,100,1,31000,100,0;0,100,1,11007,30,0; | E320: 0 | F320: 1
A321: 13804 | B321: 灵珠礼包 | C321: 2 | D321: 0,100,1,20057,3,0;0,100,1,20058,3,0;0,100,1,20059,3,0;0,100,1,20060,3,0;0,100,1,20061,3,0;0,100,1,20062,3,0; | E321: 0 | F321: 1
A322: 13805 | B322: 超级仙缘礼包 | C322: 2 | D322: 0,100,1,11006,10,0;0,100,1,11007,10,0;0,100,1,31000,50,0;0,100,1,10014,10,0;0,100,1,11003,10,0;0,100,1,10100,10,0; | E322: 0 | F322: 1
A323: 13806 | B323: 进阶丹大礼包 | C323: 2 | D323: 0,100,1,10200,48,0;0,100,1,10201,48,0;0,100,1,10206,48,0;0,100,1,10203,48,0;0,100,1,10204,48,0;0,100,1,10205,48,0; | E323: 0 | F323: 1
A324: 13807 | B324: 宠物养成礼包 | C324: 2 | D324: 0,100,1,19018,10,0;0,100,1,19019,5,0;0,100,1,19016,50,0;0,100,1,19000,30,0;0,100,1,13602,10,0;0,100,1,19013,2,0;0,100,1,10209,40,0; | E324: 0 | F324: 1
A325: 13808 | B325: 仙侣养成礼包 | C325: 2 | D325: 0,100,1,20051,10,0;0,100,1,20052,10,0;0,100,1,20053,10,0;0,100,1,20054,10,0;0,100,1,20055,10,0;0,100,1,20056,10,0;0,100,1,10208,40,0; | E325: 0 | F325: 1
A326: 13809 | B326: 大捆经验书 | C326: 2 | D326: 0,100,1,19000,20,0; | E326: 0 | F326: 1
A327: 13810 | B327: 大包洗髓丹 | C327: 2 | D327: 0,100,1,19016,50,0; | E327: 0 | F327: 1
A328: 11030 | B328: 魂石礼包 | C328: 1 | D328: 0,100,1,10020,1,0;0,100,1,10021,1,0;0,100,1,10022,1,0;0,100,1,10023,1,0; | E328: 0 | F328: 1
A329: 14001 | B329: 新手礼包 | C329: 2 | D329: 0,100,1,28000,10,0;0,100,1,30005,2,0;0,100,1,10008,10,0; | E329: 0 | F329: 1
A330: 14002 | B330: 幸运大礼包 | C330: 2 | D330: 0,100,1,28000,20,0;0,100,1,30005,3,0;0,100,1,10008,15,0; | E330: 0 | F330: 1
A331: 14101 | B331: 幻月宝箱 | C331: 1 | D331: 0,100,1,10200,1,0;0,100,1,10201,1,0;0,100,1,10202,1,0; | E331: 0 | F331: 0
A332: 14102 | B332: 妖兽宝箱 | C332: 1 | D332: 0,100,1,19016,1,1;0,100,1,10204,1,1;0,100,1,10203,1,1; | E332: 0 | F332: 0
A333: 14103 | B333: 墓穴宝藏 | C333: 1 | D333: 0,100,1,19016,1,1;0,100,1,28000,1,1;0,100,1,10207,1,1;0,100,1,10201,1,1; | E333: 0 | F333: 0