Sheet: ctRoleLevelConf
A2: nLevel | B2: nNeedExp
A3: i | B3: i
A4: 等级 | B4: 下级需要经验
A5: 0 | B5: =Sheet3!R[1]C[2] -> 100
A6: 1 | B6: =Sheet3!R[1]C[2] -> 381
A7: 2 | B7: =Sheet3!R[1]C[2] -> 730
A8: 3 | B8: =Sheet3!R[1]C[2] -> 955
A9: 4 | B9: =Sheet3!R[1]C[2] -> 1163
A10: 5 | B10: =Sheet3!R[1]C[2] -> 1362
A11: 6 | B11: =Sheet3!R[1]C[2] -> 1560
A12: 7 | B12: =Sheet3!R[1]C[2] -> 1765
A13: 8 | B13: =Sheet3!R[1]C[2] -> 1985
A14: 9 | B14: =Sheet3!R[1]C[2] -> 2227
A15: 10 | B15: =Sheet3!R[1]C[2] -> 2500
A16: 11 | B16: =Sheet3!R[1]C[2] -> 2810
A17: 12 | B17: =Sheet3!R[1]C[2] -> 3166
A18: 13 | B18: =Sheet3!R[1]C[2] -> 3576
A19: 14 | B19: =Sheet3!R[1]C[2] -> 4047
A20: 15 | B20: =Sheet3!R[1]C[2] -> 4587
A21: 16 | B21: =Sheet3!R[1]C[2] -> 5204
A22: 17 | B22: =Sheet3!R[1]C[2] -> 5906
A23: 18 | B23: =Sheet3!R[1]C[2] -> 9251
A24: 19 | B24: =Sheet3!R[1]C[2] -> 10296
A25: 20 | B25: =Sheet3!R[1]C[2] -> 22400
A26: 21 | B26: =Sheet3!R[1]C[2] -> 12110
A27: 22 | B27: =Sheet3!R[1]C[2] -> 13081
A28: 23 | B28: =Sheet3!R[1]C[2] -> 14119
A29: 24 | B29: =Sheet3!R[1]C[2] -> 15226
A30: 25 | B30: =Sheet3!R[1]C[2] -> 16406
A31: 26 | B31: =Sheet3!R[1]C[2] -> 17664
A32: 27 | B32: =Sheet3!R[1]C[2] -> 19004
A33: 28 | B33: =Sheet3!R[1]C[2] -> 20429
A34: 29 | B34: =Sheet3!R[1]C[2] -> 21943
A35: 30 | B35: =Sheet3!R[1]C[2] -> 23550
A36: 31 | B36: =Sheet3!R[1]C[2] -> 25254
A37: 32 | B37: =Sheet3!R[1]C[2] -> 27059
A38: 33 | B38: =Sheet3!R[1]C[2] -> 28969
A39: 34 | B39: =Sheet3!R[1]C[2] -> 30988
A40: 35 | B40: =Sheet3!R[1]C[2] -> 65619
A41: 36 | B41: =Sheet3!R[1]C[2] -> 68616
A42: 37 | B42: =Sheet3!R[1]C[2] -> 71734
A43: 38 | B43: =Sheet3!R[1]C[2] -> 74977
A44: 39 | B44: =Sheet3!R[1]C[2] -> 78347
A45: 40 | B45: =Sheet3!R[1]C[2] -> 78980
A46: 41 | B46: =Sheet3!R[1]C[2] -> 92001
A47: 42 | B47: =Sheet3!R[1]C[2] -> 106333
A48: 43 | B48: =Sheet3!R[1]C[2] -> 122065
A49: 44 | B49: =Sheet3!R[1]C[2] -> 139289
A50: 45 | B50: =Sheet3!R[1]C[2] -> 158100
A51: 46 | B51: =Sheet3!R[1]C[2] -> 178597
A52: 47 | B52: =Sheet3!R[1]C[2] -> 200880
A53: 48 | B53: =Sheet3!R[1]C[2] -> 225054
A54: 49 | B54: =Sheet3!R[1]C[2] -> 251227
A55: 50 | B55: =Sheet3!R[1]C[2] -> 251811
A56: 51 | B56: =Sheet3!R[1]C[2] -> 281570
A57: 52 | B57: =Sheet3!R[1]C[2] -> 313767
A58: 53 | B58: =Sheet3!R[1]C[2] -> 348528
A59: 54 | B59: =Sheet3!R[1]C[2] -> 385983
A60: 55 | B60: =Sheet3!R[1]C[2] -> 426264
A61: 56 | B61: =Sheet3!R[1]C[2] -> 469505
A62: 57 | B62: =Sheet3!R[1]C[2] -> 515847
A63: 58 | B63: =Sheet3!R[1]C[2] -> 565429
A64: 59 | B64: =Sheet3!R[1]C[2] -> 618398
A65: 60 | B65: =Sheet3!R[1]C[2] -> 674901
A66: 61 | B66: =Sheet3!R[1]C[2] -> 882107
A67: 62 | B67: =Sheet3!R[1]C[2] -> 1118762
A68: 63 | B68: =Sheet3!R[1]C[2] -> 1387423
A69: 64 | B69: =Sheet3!R[1]C[2] -> 1690776
A70: 65 | B70: =Sheet3!R[1]C[2] -> 2031642
A71: 66 | B71: =Sheet3!R[1]C[2] -> 2193618
A72: 67 | B72: =Sheet3!R[1]C[2] -> 2364906
A73: 68 | B73: =Sheet3!R[1]C[2] -> 2545854
A74: 69 | B74: =Sheet3!R[1]C[2] -> 2736814
A75: 70 | B75: =Sheet3!R[1]C[2] -> 2938142
A76: 71 | B76: =Sheet3!R[1]C[2] -> 3150204
A77: 72 | B77: =Sheet3!R[1]C[2] -> 3373371
A78: 73 | B78: =Sheet3!R[1]C[2] -> 3608018
A79: 74 | B79: =Sheet3!R[1]C[2] -> 3854531
A80: 75 | B80: =Sheet3!R[1]C[2] -> 4113297
A81: 76 | B81: =Sheet3!R[1]C[2] -> 4384713
A82: 77 | B82: =Sheet3!R[1]C[2] -> 4669180
A83: 78 | B83: =Sheet3!R[1]C[2] -> 4967106
A84: 79 | B84: =Sheet3!R[1]C[2] -> 5278907
A85: 80 | B85: =Sheet3!R[1]C[2] -> 6165502
A86: 81 | B86: =Sheet3!R[1]C[2] -> 7134982
A87: 82 | B87: =Sheet3!R[1]C[2] -> 8192326
A88: 83 | B88: =Sheet3!R[1]C[2] -> 9342695
A89: 84 | B89: =Sheet3!R[1]C[2] -> 10591436
A90: 85 | B90: =Sheet3!R[1]C[2] -> 11944083
A91: 86 | B91: =Sheet3!R[1]C[2] -> 13406363
A92: 87 | B92: =Sheet3!R[1]C[2] -> 14984196
A93: 88 | B93: =Sheet3!R[1]C[2] -> 16683700
A94: 89 | B94: =Sheet3!R[1]C[2] -> 18511193
A95: 90 | B95: =Sheet3!R[1]C[2] -> 20473198
A96: 91 | B96: =Sheet3!R[1]C[2] -> 22576445
A97: 92 | B97: =Sheet3!R[1]C[2] -> 24827873
A98: 93 | B98: =Sheet3!R[1]C[2] -> 27234635
A99: 94 | B99: =Sheet3!R[1]C[2] -> 29804099
A100: 95 | B100: =Sheet3!R[1]C[2] -> 32543854
A101: 96 | B101: =Sheet3!R[1]C[2] -> 35461711
A102: 97 | B102: =Sheet3!R[1]C[2] -> 38565707
A103: 98 | B103: =Sheet3!R[1]C[2] -> 41864106
A104: 99 | B104: =Sheet3!R[1]C[2] -> 45365405
A105: 100 | B105: =Sheet3!R[1]C[2] -> 61347923
A106: 101 | B106: =Sheet3!R[1]C[2] -> 66264843
A107: 102 | B107: =Sheet3!R[1]C[2] -> 71469032
A108: 103 | B108: =Sheet3!R[1]C[2] -> 76972309
A109: 104 | B109: =Sheet3!R[1]C[2] -> 82786804
A110: 105 | B110: =Sheet3!R[1]C[2] -> 88924959
A111: 106 | B111: =Sheet3!R[1]C[2] -> 95399534
A112: 107 | B112: =Sheet3!R[1]C[2] -> 102223610
A113: 108 | B113: =Sheet3!R[1]C[2] -> 109410593
A114: 109 | B114: =Sheet3!R[1]C[2] -> 116974216
A115: 110 | B115: =Sheet3!R[1]C[2] -> 124928548
A116: 111 | B116: =Sheet3!R[1]C[2] -> 133287992
A117: 112 | B117: =Sheet3!R[1]C[2] -> 142067293
A118: 113 | B118: =Sheet3!R[1]C[2] -> 151281540
A119: 114 | B119: =Sheet3!R[1]C[2] -> 160946170
A120: 115 | B120: =Sheet3!R[1]C[2] -> 171076973
A121: 116 | B121: =Sheet3!R[1]C[2] -> 181690094
A122: 117 | B122: =Sheet3!R[1]C[2] -> 192802041
A123: 118 | B123: =Sheet3!R[1]C[2] -> 204429681
A124: 119 | B124: =Sheet3!R[1]C[2] -> 216590254
A125: 120 | B125: =Sheet3!R[1]C[2] -> 229301368
A126: 121 | B126: =Sheet3!R[1]C[2] -> 291097210
A127: 122 | B127: =Sheet3!R[1]C[2] -> 307737048
A128: 123 | B128: =Sheet3!R[1]C[2] -> 325103653
A129: 124 | B129: =Sheet3!R[1]C[2] -> 343219988
A130: 125 | B130: =Sheet3!R[1]C[2] -> 362109485
A131: 126 | B131: =Sheet3!R[1]C[2] -> 381796050
A132: 127 | B132: =Sheet3!R[1]C[2] -> 402304068
A133: 128 | B133: =Sheet3!R[1]C[2] -> 423658407
A134: 129 | B134: =Sheet3!R[1]C[2] -> 445884426
A135: 130 | B135: =Sheet3!R[1]C[2] -> 469007973
A136: 131 | B136: =Sheet3!R[1]C[2] -> 493055397
A137: 132 | B137: =Sheet3!R[1]C[2] -> 518053546
A138: 133 | B138: =Sheet3!R[1]C[2] -> 544029777
A139: 134 | B139: =Sheet3!R[1]C[2] -> 571011960
A140: 135 | B140: =Sheet3!R[1]C[2] -> 599028477
A141: 136 | B141: =Sheet3!R[1]C[2] -> 628108236
A142: 137 | B142: =Sheet3!R[1]C[2] -> 658280666
A143: 138 | B143: =Sheet3!R[1]C[2] -> 689575731
A144: 139 | B144: =Sheet3!R[1]C[2] -> 722023926
A145: 140 | B145: =Sheet3!R[1]C[2] -> 755656287
A146: 141 | B146: =Sheet3!R[1]C[2] -> 790504396
A147: 142 | B147: =Sheet3!R[1]C[2] -> 826600383
A148: 143 | B148: =Sheet3!R[1]C[2] -> 863976930
A149: 144 | B149: =Sheet3!R[1]C[2] -> 902667281
A150: 145 | B150: =Sheet3!R[1]C[2] -> 942705239
A151: 146 | B151: =Sheet3!R[1]C[2] -> 984125178
A152: 147 | B152: =Sheet3!R[1]C[2] -> 1026962044
A153: 148 | B153: =Sheet3!R[1]C[2] -> 1071251358
A154: 149 | B154: =Sheet3!R[1]C[2] -> 1117029226
A155: 150 | B155: =Sheet3!R[1]C[2] -> 1164332337
A156: 151 | B156: =Sheet3!R[1]C[2] -> 1213197975
A157: 152 | B157: =Sheet3!R[1]C[2] -> 1263664017
A158: 153 | B158: =Sheet3!R[1]C[2] -> 1315768942
A159: 154 | B159: =Sheet3!R[1]C[2] -> 1369551833
A160: 155 | B160: =Sheet3!R[1]C[2] -> 1425052383
A161: 156 | B161: =Sheet3!R[1]C[2] -> 1482310902
A162: 157 | B162: =Sheet3!R[1]C[2] -> 1541368317
A163: 158 | B163: =Sheet3!R[1]C[2] -> 1602266179
A164: 159 | B164: =Sheet3!R[1]C[2] -> 1665046668
A165: 160 | B165: =Sheet3!R[1]C[2] -> 1729752597
A166: 161 | B166: =Sheet3!R[1]C[2] -> 1796427419
A167: 162 | B167: =Sheet3!R[1]C[2] -> 1865115227
A168: 163 | B168: =Sheet3!R[1]C[2] -> 1935860762
A169: 164 | B169: =Sheet3!R[1]C[2] -> 2008709418
A170: 165 | B170: =Sheet3!R[1]C[2] -> 2083707245
A171: 166 | B171: =Sheet3!R[1]C[2] -> 2160900955
A172: 167 | B172: =Sheet3!R[1]C[2] -> 2240337924
A173: 168 | B173: =Sheet3!R[1]C[2] -> 2322066203
A174: 169 | B174: =Sheet3!R[1]C[2] -> 2406134514
A175: 170 | B175: =Sheet3!R[1]C[2] -> 2492592261
A176: 171 | B176: =Sheet3!R[1]C[2] -> 2581489534
A177: 172 | B177: =Sheet3!R[1]C[2] -> 2672877109
A178: 173 | B178: =Sheet3!R[1]C[2] -> 2766806460
A179: 174 | B179: =Sheet3!R[1]C[2] -> 2863329758
A180: 175 | B180: =Sheet3!R[1]C[2] -> 2962499877
A181: 176 | B181: =Sheet3!R[1]C[2] -> 3064370401
A182: 177 | B182: =Sheet3!R[1]C[2] -> 3168995624
A183: 178 | B183: =Sheet3!R[1]C[2] -> 3276430561
A184: 179 | B184: =Sheet3!R[1]C[2] -> 3386730947
A185: 180 | B185: =Sheet3!R[1]C[2] -> 3499953243
A186: 181 | B186: =Sheet3!R[1]C[2] -> 3616154645
A187: 182 | B187: =Sheet3!R[1]C[2] -> 3735393083
A188: 183 | B188: =Sheet3!R[1]C[2] -> 3857727228
A189: 184 | B189: =Sheet3!R[1]C[2] -> 3983216496
A190: 185 | B190: =Sheet3!R[1]C[2] -> 4111921055
A191: 186 | B191: =Sheet3!R[1]C[2] -> 4243901827
A192: 187 | B192: =Sheet3!R[1]C[2] -> 4379220494
A193: 188 | B193: =Sheet3!R[1]C[2] -> 4517939502
A194: 189 | B194: =Sheet3!R[1]C[2] -> 4660122067
A195: 190 | B195: =Sheet3!R[1]C[2] -> 4805832177
A196: 191 | B196: =Sheet3!R[1]C[2] -> 4955134600
A197: 192 | B197: =Sheet3!R[1]C[2] -> 5108094886
A198: 193 | B198: =Sheet3!R[1]C[2] -> 5264779373
A199: 194 | B199: =Sheet3!R[1]C[2] -> 5425255193
A200: 195 | B200: =Sheet3!R[1]C[2] -> 5589590271
A201: 196 | B201: =Sheet3!R[1]C[2] -> 5757853339
A202: 197 | B202: =Sheet3!R[1]C[2] -> 5930113932
A203: 198 | B203: =Sheet3!R[1]C[2] -> 6106442398
A204: 199 | B204: =Sheet3!R[1]C[2] -> 6286909898
A205: 200 | B205: =Sheet3!R[1]C[2] -> 6471588417
A206: 201 | B206: =Sheet3!R[1]C[2] -> 6660550764
A207: 202 | B207: =Sheet3!R[1]C[2] -> 6853870576
A208: 203 | B208: =Sheet3!R[1]C[2] -> 7051622328
A209: 204 | B209: =Sheet3!R[1]C[2] -> 7253881331
A210: 205 | B210: =Sheet3!R[1]C[2] -> 7460723741
A211: 206 | B211: =Sheet3!R[1]C[2] -> 7672226563
A212: 207 | B212: =Sheet3!R[1]C[2] -> 7888467657
A213: 208 | B213: =Sheet3!R[1]C[2] -> 8109525736

Sheet: Sheet2
B1: 原数值 | C1: 挂机放大经验 | D1: 新数值
A2: nLevel | B2: nNeedExp
A3: i | B3: i
A4: 等级 | B4: 下级需要经验
A5: 0 | B5: 100 | C5: 0 | D5: =RC[-2]+RC[-1] -> 100
A6: 1 | B6: 381 | C6: 0 | D6: =RC[-2]+RC[-1] -> 381
A7: 2 | B7: 730 | C7: 0 | D7: =RC[-2]+RC[-1] -> 730
A8: 3 | B8: 955 | C8: 0 | D8: =RC[-2]+RC[-1] -> 955
A9: 4 | B9: 1163 | C9: 0 | D9: =RC[-2]+RC[-1] -> 1163
A10: 5 | B10: 1362 | C10: 0 | D10: =RC[-2]+RC[-1] -> 1362
A11: 6 | B11: 1560 | C11: 0 | D11: =RC[-2]+RC[-1] -> 1560
A12: 7 | B12: 1765 | C12: 0 | D12: =RC[-2]+RC[-1] -> 1765
A13: 8 | B13: 1985 | C13: 0 | D13: =RC[-2]+RC[-1] -> 1985
A14: 9 | B14: 2227 | C14: 0 | D14: =RC[-2]+RC[-1] -> 2227
A15: 10 | B15: 2500 | C15: 0 | D15: =RC[-2]+RC[-1] -> 2500
A16: 11 | B16: 2810 | C16: 0 | D16: =RC[-2]+RC[-1] -> 2810
A17: 12 | B17: 3166 | C17: 0 | D17: =RC[-2]+RC[-1] -> 3166
A18: 13 | B18: 3576 | C18: 0 | D18: =RC[-2]+RC[-1] -> 3576
A19: 14 | B19: 4047 | C19: 0 | D19: =RC[-2]+RC[-1] -> 4047
A20: 15 | B20: 4587 | C20: =10*RC[-2]*RC[-2] -> 2250 | D20: =RC[-2]+RC[-1] -> 6837
A21: 16 | B21: 5204 | C21: =10*RC[-2]*RC[-2] -> 2560 | D21: =RC[-2]+RC[-1] -> 7764
A22: 17 | B22: 5906 | C22: =10*RC[-2]*RC[-2] -> 2890 | D22: =RC[-2]+RC[-1] -> 8796
A23: 18 | B23: 9251 | C23: =10*RC[-2]*RC[-2] -> 3240 | D23: =RC[-2]+RC[-1] -> 12491
A24: 19 | B24: 10296 | C24: =10*RC[-2]*RC[-2] -> 3610 | D24: =RC[-2]+RC[-1] -> 13906
A25: 20 | B25: 22400 | C25: =10*RC[-2]*RC[-2] -> 4000 | D25: =RC[-2]+RC[-1] -> 26400
A26: 21 | B26: 24219 | C26: =10*RC[-2]*RC[-2] -> 4410 | D26: =RC[-2]+RC[-1] -> 28629
A27: 22 | B27: 26162 | C27: =10*RC[-2]*RC[-2] -> 4840 | D27: =RC[-2]+RC[-1] -> 31002
A28: 23 | B28: 28237 | C28: =10*RC[-2]*RC[-2] -> 5290 | D28: =RC[-2]+RC[-1] -> 33527
A29: 24 | B29: 30451 | C29: =10*RC[-2]*RC[-2] -> 5760 | D29: =RC[-2]+RC[-1] -> 36211
A30: 25 | B30: 32812 | C30: =10*RC[-2]*RC[-2] -> 6250 | D30: =RC[-2]+RC[-1] -> 39062
A31: 26 | B31: 35328 | C31: =10*RC[-2]*RC[-2] -> 6760 | D31: =RC[-2]+RC[-1] -> 42088
A32: 27 | B32: 38007 | C32: =10*RC[-2]*RC[-2] -> 7290 | D32: =RC[-2]+RC[-1] -> 45297
A33: 28 | B33: 40857 | C33: =10*RC[-2]*RC[-2] -> 7840 | D33: =RC[-2]+RC[-1] -> 48697
A34: 29 | B34: 43885 | C34: =10*RC[-2]*RC[-2] -> 8410 | D34: =RC[-2]+RC[-1] -> 52295
A35: 30 | B35: 47100 | C35: =10*RC[-2]*RC[-2] -> 9000 | D35: =RC[-2]+RC[-1] -> 56100
A36: 31 | B36: 50508 | C36: =10*RC[-2]*RC[-2] -> 9610 | D36: =RC[-2]+RC[-1] -> 60118
A37: 32 | B37: 54118 | C37: =10*RC[-2]*RC[-2] -> 10240 | D37: =RC[-2]+RC[-1] -> 64358
A38: 33 | B38: 57938 | C38: =10*RC[-2]*RC[-2] -> 10890 | D38: =RC[-2]+RC[-1] -> 68828
A39: 34 | B39: 61975 | C39: =10*RC[-2]*RC[-2] -> 11560 | D39: =RC[-2]+RC[-1] -> 73535
A40: 35 | B40: 131237 | C40: =100*RC[-2]*RC[-2] -> 122500 | D40: =RC[-2]+RC[-1] -> 253737
A41: 36 | B41: 137232 | C41: =100*RC[-2]*RC[-2] -> 129600 | D41: =RC[-2]+RC[-1] -> 266832
A42: 37 | B42: 143468 | C42: =100*RC[-2]*RC[-2] -> 136900 | D42: =RC[-2]+RC[-1] -> 280368
A43: 38 | B43: 149953 | C43: =100*RC[-2]*RC[-2] -> 144400 | D43: =RC[-2]+RC[-1] -> 294353
A44: 39 | B44: 156694 | C44: =100*RC[-2]*RC[-2] -> 152100 | D44: =RC[-2]+RC[-1] -> 308794
A45: 40 | B45: 157960 | C45: =200*RC[-2]*RC[-2] -> 320000 | D45: =RC[-2]+RC[-1] -> 477960
A46: 41 | B46: 184001 | C46: =200*RC[-2]*RC[-2] -> 336200 | D46: =RC[-2]+RC[-1] -> 520201
A47: 42 | B47: 212665 | C47: =200*RC[-2]*RC[-2] -> 352800 | D47: =RC[-2]+RC[-1] -> 565465
A48: 43 | B48: 244129 | C48: =200*RC[-2]*RC[-2] -> 369800 | D48: =RC[-2]+RC[-1] -> 613929
A49: 44 | B49: 278577 | C49: =200*RC[-2]*RC[-2] -> 387200 | D49: =RC[-2]+RC[-1] -> 665777
A50: 45 | B50: 316200 | C50: =200*RC[-2]*RC[-2] -> 405000 | D50: =RC[-2]+RC[-1] -> 721200
A51: 46 | B51: 357193 | C51: =200*RC[-2]*RC[-2] -> 423200 | D51: =RC[-2]+RC[-1] -> 780393
A52: 47 | B52: 401759 | C52: =200*RC[-2]*RC[-2] -> 441800 | D52: =RC[-2]+RC[-1] -> 843559
A53: 48 | B53: 450108 | C53: =200*RC[-2]*RC[-2] -> 460800 | D53: =RC[-2]+RC[-1] -> 910908
A54: 49 | B54: 502454 | C54: =200*RC[-2]*RC[-2] -> 480200 | D54: =RC[-2]+RC[-1] -> 982654
A55: 50 | B55: 503622 | C55: =200*RC[-2]*RC[-2] -> 500000 | D55: =RC[-2]+RC[-1] -> 1003622
A56: 51 | B56: 563140 | C56: =200*RC[-2]*RC[-2] -> 520200 | D56: =RC[-2]+RC[-1] -> 1083340
A57: 52 | B57: 627534 | C57: =200*RC[-2]*RC[-2] -> 540800 | D57: =RC[-2]+RC[-1] -> 1168334
A58: 53 | B58: 697056 | C58: =200*RC[-2]*RC[-2] -> 561800 | D58: =RC[-2]+RC[-1] -> 1258856
A59: 54 | B59: 771966 | C59: =200*RC[-2]*RC[-2] -> 583200 | D59: =RC[-2]+RC[-1] -> 1355166
A60: 55 | B60: 852527 | C60: =200*RC[-2]*RC[-2] -> 605000 | D60: =RC[-2]+RC[-1] -> 1457527
A61: 56 | B61: 939010 | C61: =200*RC[-2]*RC[-2] -> 627200 | D61: =RC[-2]+RC[-1] -> 1566210
A62: 57 | B62: 1031693 | C62: =200*RC[-2]*RC[-2] -> 649800 | D62: =RC[-2]+RC[-1] -> 1681493
A63: 58 | B63: 1130858 | C63: =200*RC[-2]*RC[-2] -> 672800 | D63: =RC[-2]+RC[-1] -> 1803658
A64: 59 | B64: 1236796 | C64: =200*RC[-2]*RC[-2] -> 696200 | D64: =RC[-2]+RC[-1] -> 1932996
A65: 60 | B65: 1349802 | C65: =200*RC[-2]*RC[-2] -> 720000 | D65: =RC[-2]+RC[-1] -> 2069802
A66: 61 | B66: 1470178 | C66: =200*RC[-2]*RC[-2] -> 744200 | D66: =RC[-2]+RC[-1] -> 2214378
A67: 62 | B67: 1598232 | C67: =200*RC[-2]*RC[-2] -> 768800 | D67: =RC[-2]+RC[-1] -> 2367032
A68: 63 | B68: 1734279 | C68: =200*RC[-2]*RC[-2] -> 793800 | D68: =RC[-2]+RC[-1] -> 2528079
A69: 64 | B69: 1878640 | C69: =200*RC[-2]*RC[-2] -> 819200 | D69: =RC[-2]+RC[-1] -> 2697840
A70: 65 | B70: 2031642 | C70: =200*RC[-2]*RC[-2] -> 845000 | D70: =RC[-2]+RC[-1] -> 2876642
A71: 66 | B71: 2193618 | C71: =200*RC[-2]*RC[-2] -> 871200 | D71: =RC[-2]+RC[-1] -> 3064818
A72: 67 | B72: 2364906 | C72: =200*RC[-2]*RC[-2] -> 897800 | D72: =RC[-2]+RC[-1] -> 3262706
A73: 68 | B73: 2545854 | C73: =200*RC[-2]*RC[-2] -> 924800 | D73: =RC[-2]+RC[-1] -> 3470654
A74: 69 | B74: 2736814 | C74: =200*RC[-2]*RC[-2] -> 952200 | D74: =RC[-2]+RC[-1] -> 3689014
A75: 70 | B75: 2938142 | C75: =200*RC[-2]*RC[-2] -> 980000 | D75: =RC[-2]+RC[-1] -> 3918142
A76: 71 | B76: 3150204 | C76: =200*RC[-2]*RC[-2] -> 1008200 | D76: =RC[-2]+RC[-1] -> 4158404
A77: 72 | B77: 3373371 | C77: =200*RC[-2]*RC[-2] -> 1036800 | D77: =RC[-2]+RC[-1] -> 4410171
A78: 73 | B78: 3608018 | C78: =200*RC[-2]*RC[-2] -> 1065800 | D78: =RC[-2]+RC[-1] -> 4673818
A79: 74 | B79: 3854531 | C79: =200*RC[-2]*RC[-2] -> 1095200 | D79: =RC[-2]+RC[-1] -> 4949731
A80: 75 | B80: 4113297 | C80: =200*RC[-2]*RC[-2] -> 1125000 | D80: =RC[-2]+RC[-1] -> 5238297
A81: 76 | B81: 4384713 | C81: =200*RC[-2]*RC[-2] -> 1155200 | D81: =RC[-2]+RC[-1] -> 5539913
A82: 77 | B82: 4669180 | C82: =200*RC[-2]*RC[-2] -> 1185800 | D82: =RC[-2]+RC[-1] -> 5854980
A83: 78 | B83: 4967106 | C83: =200*RC[-2]*RC[-2] -> 1216800 | D83: =RC[-2]+RC[-1] -> 6183906
A84: 79 | B84: 5278907 | C84: =200*RC[-2]*RC[-2] -> 1248200 | D84: =RC[-2]+RC[-1] -> 6527107
A85: 80 | B85: 6165502 | C85: =200*RC[-2]*RC[-2] -> 1280000 | D85: =RC[-2]+RC[-1] -> 7445502
A86: 81 | B86: 7134982 | C86: =200*RC[-2]*RC[-2] -> 1312200 | D86: =RC[-2]+RC[-1] -> 8447182
A87: 82 | B87: 8192326 | C87: =200*RC[-2]*RC[-2] -> 1344800 | D87: =RC[-2]+RC[-1] -> 9537126
A88: 83 | B88: 9342695 | C88: =200*RC[-2]*RC[-2] -> 1377800 | D88: =RC[-2]+RC[-1] -> 10720495
A89: 84 | B89: 10591436 | C89: =200*RC[-2]*RC[-2] -> 1411200 | D89: =RC[-2]+RC[-1] -> 12002636
A90: 85 | B90: 11944083 | C90: =200*RC[-2]*RC[-2] -> 1445000 | D90: =RC[-2]+RC[-1] -> 13389083
A91: 86 | B91: 13406363 | C91: =200*RC[-2]*RC[-2] -> 1479200 | D91: =RC[-2]+RC[-1] -> 14885563
A92: 87 | B92: 14984196 | C92: =200*RC[-2]*RC[-2] -> 1513800 | D92: =RC[-2]+RC[-1] -> 16497996
A93: 88 | B93: 16683700 | C93: =200*RC[-2]*RC[-2] -> 1548800 | D93: =RC[-2]+RC[-1] -> 18232500
A94: 89 | B94: 18511193 | C94: =200*RC[-2]*RC[-2] -> 1584200 | D94: =RC[-2]+RC[-1] -> 20095393
A95: 90 | B95: 20473198 | C95: =200*RC[-2]*RC[-2] -> 1620000 | D95: =RC[-2]+RC[-1] -> 22093198
A96: 91 | B96: 22576445 | C96: =200*RC[-2]*RC[-2] -> 1656200 | D96: =RC[-2]+RC[-1] -> 24232645
A97: 92 | B97: 24827873 | C97: =200*RC[-2]*RC[-2] -> 1692800 | D97: =RC[-2]+RC[-1] -> 26520673
A98: 93 | B98: 27234635 | C98: =200*RC[-2]*RC[-2] -> 1729800 | D98: =RC[-2]+RC[-1] -> 28964435
A99: 94 | B99: 29804099 | C99: =200*RC[-2]*RC[-2] -> 1767200 | D99: =RC[-2]+RC[-1] -> 31571299
A100: 95 | B100: 32543854 | C100: =200*RC[-2]*RC[-2] -> 1805000 | D100: =RC[-2]+RC[-1] -> 34348854
A101: 96 | B101: 35461711 | C101: =200*RC[-2]*RC[-2] -> 1843200 | D101: =RC[-2]+RC[-1] -> 37304911
A102: 97 | B102: 38565707 | C102: =200*RC[-2]*RC[-2] -> 1881800 | D102: =RC[-2]+RC[-1] -> 40447507
A103: 98 | B103: 41864106 | C103: =200*RC[-2]*RC[-2] -> 1920800 | D103: =RC[-2]+RC[-1] -> 43784906
A104: 99 | B104: 45365405 | C104: =200*RC[-2]*RC[-2] -> 1960200 | D104: =RC[-2]+RC[-1] -> 47325605
A105: 100 | B105: 61347923 | C105: =200*RC[-2]*RC[-2] -> 2000000 | D105: =RC[-2]+RC[-1] -> 63347923
A106: 101 | B106: 66264843 | C106: =200*RC[-2]*RC[-2] -> 2040200 | D106: =RC[-2]+RC[-1] -> 68305043
A107: 102 | B107: 71469032 | C107: =200*RC[-2]*RC[-2] -> 2080800 | D107: =RC[-2]+RC[-1] -> 73549832
A108: 103 | B108: 76972309 | C108: =200*RC[-2]*RC[-2] -> 2121800 | D108: =RC[-2]+RC[-1] -> 79094109
A109: 104 | B109: 82786804 | C109: =200*RC[-2]*RC[-2] -> 2163200 | D109: =RC[-2]+RC[-1] -> 84950004
A110: 105 | B110: 88924959 | C110: =200*RC[-2]*RC[-2] -> 2205000 | D110: =RC[-2]+RC[-1] -> 91129959
A111: 106 | B111: 95399534 | C111: =200*RC[-2]*RC[-2] -> 2247200 | D111: =RC[-2]+RC[-1] -> 97646734
A112: 107 | B112: 102223610 | C112: =200*RC[-2]*RC[-2] -> 2289800 | D112: =RC[-2]+RC[-1] -> 104513410
A113: 108 | B113: 109410593 | C113: =200*RC[-2]*RC[-2] -> 2332800 | D113: =RC[-2]+RC[-1] -> 111743393
A114: 109 | B114: 116974216 | C114: =200*RC[-2]*RC[-2] -> 2376200 | D114: =RC[-2]+RC[-1] -> 119350416
A115: 110 | B115: 124928548 | C115: =200*RC[-2]*RC[-2] -> 2420000 | D115: =RC[-2]+RC[-1] -> 127348548
A116: 111 | B116: 133287992 | C116: =200*RC[-2]*RC[-2] -> 2464200 | D116: =RC[-2]+RC[-1] -> 135752192
A117: 112 | B117: 142067293 | C117: =200*RC[-2]*RC[-2] -> 2508800 | D117: =RC[-2]+RC[-1] -> 144576093
A118: 113 | B118: 151281540 | C118: =200*RC[-2]*RC[-2] -> 2553800 | D118: =RC[-2]+RC[-1] -> 153835340
A119: 114 | B119: 160946170 | C119: =200*RC[-2]*RC[-2] -> 2599200 | D119: =RC[-2]+RC[-1] -> 163545370
A120: 115 | B120: 171076973 | C120: =200*RC[-2]*RC[-2] -> 2645000 | D120: =RC[-2]+RC[-1] -> 173721973
A121: 116 | B121: 181690094 | C121: =200*RC[-2]*RC[-2] -> 2691200 | D121: =RC[-2]+RC[-1] -> 184381294
A122: 117 | B122: 192802041 | C122: =200*RC[-2]*RC[-2] -> 2737800 | D122: =RC[-2]+RC[-1] -> 195539841
A123: 118 | B123: 204429681 | C123: =200*RC[-2]*RC[-2] -> 2784800 | D123: =RC[-2]+RC[-1] -> 207214481
A124: 119 | B124: 216590254 | C124: =200*RC[-2]*RC[-2] -> 2832200 | D124: =RC[-2]+RC[-1] -> 219422454
A125: 120 | B125: 229301368 | C125: =200*RC[-2]*RC[-2] -> 2880000 | D125: =RC[-2]+RC[-1] -> 232181368
A126: 121 | B126: 291097210 | C126: =200*RC[-2]*RC[-2] -> 2928200 | D126: =RC[-2]+RC[-1] -> 294025410
A127: 122 | B127: 307737048 | C127: =200*RC[-2]*RC[-2] -> 2976800 | D127: =RC[-2]+RC[-1] -> 310713848
A128: 123 | B128: 325103653 | C128: =200*RC[-2]*RC[-2] -> 3025800 | D128: =RC[-2]+RC[-1] -> 328129453
A129: 124 | B129: 343219988 | C129: =200*RC[-2]*RC[-2] -> 3075200 | D129: =RC[-2]+RC[-1] -> 346295188
A130: 125 | B130: 362109485 | C130: =200*RC[-2]*RC[-2] -> 3125000 | D130: =RC[-2]+RC[-1] -> 365234485
A131: 126 | B131: 381796050 | C131: =200*RC[-2]*RC[-2] -> 3175200 | D131: =RC[-2]+RC[-1] -> 384971250
A132: 127 | B132: 402304068 | C132: =200*RC[-2]*RC[-2] -> 3225800 | D132: =RC[-2]+RC[-1] -> 405529868
A133: 128 | B133: 423658407 | C133: =200*RC[-2]*RC[-2] -> 3276800 | D133: =RC[-2]+RC[-1] -> 426935207
A134: 129 | B134: 445884426 | C134: =200*RC[-2]*RC[-2] -> 3328200 | D134: =RC[-2]+RC[-1] -> 449212626
A135: 130 | B135: 469007973 | C135: =200*RC[-2]*RC[-2] -> 3380000 | D135: =RC[-2]+RC[-1] -> 472387973
A136: 131 | B136: 493055397 | C136: =200*RC[-2]*RC[-2] -> 3432200 | D136: =RC[-2]+RC[-1] -> 496487597
A137: 132 | B137: 518053546 | C137: =200*RC[-2]*RC[-2] -> 3484800 | D137: =RC[-2]+RC[-1] -> 521538346
A138: 133 | B138: 544029777 | C138: =200*RC[-2]*RC[-2] -> 3537800 | D138: =RC[-2]+RC[-1] -> 547567577
A139: 134 | B139: 571011960 | C139: =200*RC[-2]*RC[-2] -> 3591200 | D139: =RC[-2]+RC[-1] -> 574603160
A140: 135 | B140: 599028477 | C140: =200*RC[-2]*RC[-2] -> 3645000 | D140: =RC[-2]+RC[-1] -> 602673477
A141: 136 | B141: 628108236 | C141: =200*RC[-2]*RC[-2] -> 3699200 | D141: =RC[-2]+RC[-1] -> 631807436
A142: 137 | B142: 658280666 | C142: =200*RC[-2]*RC[-2] -> 3753800 | D142: =RC[-2]+RC[-1] -> 662034466
A143: 138 | B143: 689575731 | C143: =200*RC[-2]*RC[-2] -> 3808800 | D143: =RC[-2]+RC[-1] -> 693384531
A144: 139 | B144: 722023926 | C144: =200*RC[-2]*RC[-2] -> 3864200 | D144: =RC[-2]+RC[-1] -> 725888126
A145: 140 | B145: 755656287 | C145: =200*RC[-2]*RC[-2] -> 3920000 | D145: =RC[-2]+RC[-1] -> 759576287
A146: 141 | B146: 790504396 | C146: =200*RC[-2]*RC[-2] -> 3976200 | D146: =RC[-2]+RC[-1] -> 794480596
A147: 142 | B147: 826600383 | C147: =200*RC[-2]*RC[-2] -> 4032800 | D147: =RC[-2]+RC[-1] -> 830633183
A148: 143 | B148: 863976930 | C148: =200*RC[-2]*RC[-2] -> 4089800 | D148: =RC[-2]+RC[-1] -> 868066730
A149: 144 | B149: 902667281 | C149: =200*RC[-2]*RC[-2] -> 4147200 | D149: =RC[-2]+RC[-1] -> 906814481
A150: 145 | B150: 942705239 | C150: =200*RC[-2]*RC[-2] -> 4205000 | D150: =RC[-2]+RC[-1] -> 946910239
A151: 146 | B151: 984125178 | C151: =200*RC[-2]*RC[-2] -> 4263200 | D151: =RC[-2]+RC[-1] -> 988388378
A152: 147 | B152: 1026962044 | C152: =200*RC[-2]*RC[-2] -> 4321800 | D152: =RC[-2]+RC[-1] -> 1031283844
A153: 148 | B153: 1071251358 | C153: =200*RC[-2]*RC[-2] -> 4380800 | D153: =RC[-2]+RC[-1] -> 1075632158
A154: 149 | B154: 1117029226 | C154: =200*RC[-2]*RC[-2] -> 4440200 | D154: =RC[-2]+RC[-1] -> 1121469426
A155: 150 | B155: 1164332337 | C155: =200*RC[-2]*RC[-2] -> 4500000 | D155: =RC[-2]+RC[-1] -> 1168832337
A156: 151 | B156: 1213197975 | C156: =200*RC[-2]*RC[-2] -> 4560200 | D156: =RC[-2]+RC[-1] -> 1217758175
A157: 152 | B157: 1263664017 | C157: =200*RC[-2]*RC[-2] -> 4620800 | D157: =RC[-2]+RC[-1] -> 1268284817
A158: 153 | B158: 1315768942 | C158: =200*RC[-2]*RC[-2] -> 4681800 | D158: =RC[-2]+RC[-1] -> 1320450742
A159: 154 | B159: 1369551833 | C159: =200*RC[-2]*RC[-2] -> 4743200 | D159: =RC[-2]+RC[-1] -> 1374295033
A160: 155 | B160: 1425052383 | C160: =200*RC[-2]*RC[-2] -> 4805000 | D160: =RC[-2]+RC[-1] -> 1429857383
A161: 156 | B161: 1482310902 | C161: =200*RC[-2]*RC[-2] -> 4867200 | D161: =RC[-2]+RC[-1] -> 1487178102
A162: 157 | B162: 1541368317 | C162: =200*RC[-2]*RC[-2] -> 4929800 | D162: =RC[-2]+RC[-1] -> 1546298117
A163: 158 | B163: 1602266179 | C163: =200*RC[-2]*RC[-2] -> 4992800 | D163: =RC[-2]+RC[-1] -> 1607258979
A164: 159 | B164: 1665046668 | C164: =200*RC[-2]*RC[-2] -> 5056200 | D164: =RC[-2]+RC[-1] -> 1670102868
A165: 160 | B165: 1729752597 | C165: =200*RC[-2]*RC[-2] -> 5120000 | D165: =RC[-2]+RC[-1] -> 1734872597
A166: 161 | B166: 1796427419 | C166: =200*RC[-2]*RC[-2] -> 5184200 | D166: =RC[-2]+RC[-1] -> 1801611619
A167: 162 | B167: 1865115227 | C167: =200*RC[-2]*RC[-2] -> 5248800 | D167: =RC[-2]+RC[-1] -> 1870364027
A168: 163 | B168: 1935860762 | C168: =200*RC[-2]*RC[-2] -> 5313800 | D168: =RC[-2]+RC[-1] -> 1941174562
A169: 164 | B169: 2008709418 | C169: =200*RC[-2]*RC[-2] -> 5379200 | D169: =RC[-2]+RC[-1] -> 2014088618
A170: 165 | B170: 2083707245 | C170: =200*RC[-2]*RC[-2] -> 5445000 | D170: =RC[-2]+RC[-1] -> 2089152245
A171: 166 | B171: 2160900955 | C171: =200*RC[-2]*RC[-2] -> 5511200 | D171: =RC[-2]+RC[-1] -> 2166412155
A172: 167 | B172: 2240337924 | C172: =200*RC[-2]*RC[-2] -> 5577800 | D172: =RC[-2]+RC[-1] -> 2245915724
A173: 168 | B173: 2322066203 | C173: =200*RC[-2]*RC[-2] -> 5644800 | D173: =RC[-2]+RC[-1] -> 2327711003
A174: 169 | B174: 2406134514 | C174: =200*RC[-2]*RC[-2] -> 5712200 | D174: =RC[-2]+RC[-1] -> 2411846714
A175: 170 | B175: 2492592261 | C175: =200*RC[-2]*RC[-2] -> 5780000 | D175: =RC[-2]+RC[-1] -> 2498372261
A176: 171 | B176: 2581489534 | C176: =200*RC[-2]*RC[-2] -> 5848200 | D176: =RC[-2]+RC[-1] -> 2587337734
A177: 172 | B177: 2672877109 | C177: =200*RC[-2]*RC[-2] -> 5916800 | D177: =RC[-2]+RC[-1] -> 2678793909
A178: 173 | B178: 2766806460 | C178: =200*RC[-2]*RC[-2] -> 5985800 | D178: =RC[-2]+RC[-1] -> 2772792260
A179: 174 | B179: 2863329758 | C179: =200*RC[-2]*RC[-2] -> 6055200 | D179: =RC[-2]+RC[-1] -> 2869384958
A180: 175 | B180: 2962499877 | C180: =200*RC[-2]*RC[-2] -> 6125000 | D180: =RC[-2]+RC[-1] -> 2968624877
A181: 176 | B181: 3064370401 | C181: =200*RC[-2]*RC[-2] -> 6195200 | D181: =RC[-2]+RC[-1] -> 3070565601
A182: 177 | B182: 3168995624 | C182: =200*RC[-2]*RC[-2] -> 6265800 | D182: =RC[-2]+RC[-1] -> 3175261424
A183: 178 | B183: 3276430561 | C183: =200*RC[-2]*RC[-2] -> 6336800 | D183: =RC[-2]+RC[-1] -> 3282767361
A184: 179 | B184: 3386730947 | C184: =200*RC[-2]*RC[-2] -> 6408200 | D184: =RC[-2]+RC[-1] -> 3393139147
A185: 180 | B185: 3499953243 | C185: =200*RC[-2]*RC[-2] -> 6480000 | D185: =RC[-2]+RC[-1] -> 3506433243
A186: 181 | B186: 3616154645 | C186: =200*RC[-2]*RC[-2] -> 6552200 | D186: =RC[-2]+RC[-1] -> 3622706845
A187: 182 | B187: 3735393083 | C187: =200*RC[-2]*RC[-2] -> 6624800 | D187: =RC[-2]+RC[-1] -> 3742017883
A188: 183 | B188: 3857727228 | C188: =200*RC[-2]*RC[-2] -> 6697800 | D188: =RC[-2]+RC[-1] -> 3864425028
A189: 184 | B189: 3983216496 | C189: =200*RC[-2]*RC[-2] -> 6771200 | D189: =RC[-2]+RC[-1] -> 3989987696
A190: 185 | B190: 4111921055 | C190: =200*RC[-2]*RC[-2] -> 6845000 | D190: =RC[-2]+RC[-1] -> 4118766055
A191: 186 | B191: 4243901827 | C191: =200*RC[-2]*RC[-2] -> 6919200 | D191: =RC[-2]+RC[-1] -> 4250821027
A192: 187 | B192: 4379220494 | C192: =200*RC[-2]*RC[-2] -> 6993800 | D192: =RC[-2]+RC[-1] -> 4386214294
A193: 188 | B193: 4517939502 | C193: =200*RC[-2]*RC[-2] -> 7068800 | D193: =RC[-2]+RC[-1] -> 4525008302
A194: 189 | B194: 4660122067 | C194: =200*RC[-2]*RC[-2] -> 7144200 | D194: =RC[-2]+RC[-1] -> 4667266267
A195: 190 | B195: 4805832177 | C195: =200*RC[-2]*RC[-2] -> 7220000 | D195: =RC[-2]+RC[-1] -> 4813052177
A196: 191 | B196: 4955134600 | C196: =200*RC[-2]*RC[-2] -> 7296200 | D196: =RC[-2]+RC[-1] -> 4962430800
A197: 192 | B197: 5108094886 | C197: =200*RC[-2]*RC[-2] -> 7372800 | D197: =RC[-2]+RC[-1] -> 5115467686
A198: 193 | B198: 5264779373 | C198: =200*RC[-2]*RC[-2] -> 7449800 | D198: =RC[-2]+RC[-1] -> 5272229173
A199: 194 | B199: 5425255193 | C199: =200*RC[-2]*RC[-2] -> 7527200 | D199: =RC[-2]+RC[-1] -> 5432782393
A200: 195 | B200: 5589590271 | C200: =200*RC[-2]*RC[-2] -> 7605000 | D200: =RC[-2]+RC[-1] -> 5597195271
A201: 196 | B201: 5757853339 | C201: =200*RC[-2]*RC[-2] -> 7683200 | D201: =RC[-2]+RC[-1] -> 5765536539
A202: 197 | B202: 5930113932 | C202: =200*RC[-2]*RC[-2] -> 7761800 | D202: =RC[-2]+RC[-1] -> 5937875732
A203: 198 | B203: 6106442398 | C203: =200*RC[-2]*RC[-2] -> 7840800 | D203: =RC[-2]+RC[-1] -> 6114283198
A204: 199 | B204: 6286909898 | C204: =200*RC[-2]*RC[-2] -> 7920200 | D204: =RC[-2]+RC[-1] -> 6294830098
A205: 200 | B205: 6471588417 | C205: =200*RC[-2]*RC[-2] -> 8000000 | D205: =RC[-2]+RC[-1] -> 6479588417
A206: 201 | B206: 6660550764 | C206: =200*RC[-2]*RC[-2] -> 8080200 | D206: =RC[-2]+RC[-1] -> 6668630964
A207: 202 | B207: 6853870576 | C207: =200*RC[-2]*RC[-2] -> 8160800 | D207: =RC[-2]+RC[-1] -> 6862031376
A208: 203 | B208: 7051622328 | C208: =200*RC[-2]*RC[-2] -> 8241800 | D208: =RC[-2]+RC[-1] -> 7059864128
A209: 204 | B209: 7253881331 | C209: =200*RC[-2]*RC[-2] -> 8323200 | D209: =RC[-2]+RC[-1] -> 7262204531
A210: 205 | B210: 7460723741 | C210: =200*RC[-2]*RC[-2] -> 8405000 | D210: =RC[-2]+RC[-1] -> 7469128741
A211: 206 | B211: 7672226563 | C211: =200*RC[-2]*RC[-2] -> 8487200 | D211: =RC[-2]+RC[-1] -> 7680713763
A212: 207 | B212: 7888467657 | C212: =200*RC[-2]*RC[-2] -> 8569800 | D212: =RC[-2]+RC[-1] -> 7897037457
A213: 208 | B213: 8109525736 | C213: =200*RC[-2]*RC[-2] -> 8652800 | D213: =RC[-2]+RC[-1] -> 8118178536

Sheet: Sheet3
B5: 等级 | C5: 下级需要经验 | E5: 变化系数
B6: 0 | C6: 100 | D6: =ROUND(RC[-1]*RC[1],0) -> 100 | E6: 1 | G6: =SUM(R6C[-4]:RC[-4]) -> 100 | H6: =SUM(R6C[-4]:RC[-4]) -> 100
B7: 1 | C7: 381 | D7: =ROUND(RC[-1]*RC[1],0) -> 381 | E7: 1 | G7: =SUM(R6C[-4]:RC[-4]) -> 481 | H7: =SUM(R6C[-4]:RC[-4]) -> 481
B8: 2 | C8: 730 | D8: =ROUND(RC[-1]*RC[1],0) -> 730 | E8: 1 | G8: =SUM(R6C[-4]:RC[-4]) -> 1211 | H8: =SUM(R6C[-4]:RC[-4]) -> 1211
B9: 3 | C9: 955 | D9: =ROUND(RC[-1]*RC[1],0) -> 955 | E9: 1 | G9: =SUM(R6C[-4]:RC[-4]) -> 2166 | H9: =SUM(R6C[-4]:RC[-4]) -> 2166
B10: 4 | C10: 1163 | D10: =ROUND(RC[-1]*RC[1],0) -> 1163 | E10: 1 | G10: =SUM(R6C[-4]:RC[-4]) -> 3329 | H10: =SUM(R6C[-4]:RC[-4]) -> 3329
B11: 5 | C11: 1362 | D11: =ROUND(RC[-1]*RC[1],0) -> 1362 | E11: 1 | G11: =SUM(R6C[-4]:RC[-4]) -> 4691 | H11: =SUM(R6C[-4]:RC[-4]) -> 4691
B12: 6 | C12: 1560 | D12: =ROUND(RC[-1]*RC[1],0) -> 1560 | E12: 1 | G12: =SUM(R6C[-4]:RC[-4]) -> 6251 | H12: =SUM(R6C[-4]:RC[-4]) -> 6251
B13: 7 | C13: 1765 | D13: =ROUND(RC[-1]*RC[1],0) -> 1765 | E13: 1 | G13: =SUM(R6C[-4]:RC[-4]) -> 8016 | H13: =SUM(R6C[-4]:RC[-4]) -> 8016
B14: 8 | C14: 1985 | D14: =ROUND(RC[-1]*RC[1],0) -> 1985 | E14: 1 | G14: =SUM(R6C[-4]:RC[-4]) -> 10001 | H14: =SUM(R6C[-4]:RC[-4]) -> 10001
B15: 9 | C15: 2227 | D15: =ROUND(RC[-1]*RC[1],0) -> 2227 | E15: 1 | G15: =SUM(R6C[-4]:RC[-4]) -> 12228 | H15: =SUM(R6C[-4]:RC[-4]) -> 12228
B16: 10 | C16: 2500 | D16: =ROUND(RC[-1]*RC[1],0) -> 2500 | E16: 1 | G16: =SUM(R6C[-4]:RC[-4]) -> 14728 | H16: =SUM(R6C[-4]:RC[-4]) -> 14728
B17: 11 | C17: 2810 | D17: =ROUND(RC[-1]*RC[1],0) -> 2810 | E17: 1 | G17: =SUM(R6C[-4]:RC[-4]) -> 17538 | H17: =SUM(R6C[-4]:RC[-4]) -> 17538
B18: 12 | C18: 3166 | D18: =ROUND(RC[-1]*RC[1],0) -> 3166 | E18: 1 | G18: =SUM(R6C[-4]:RC[-4]) -> 20704 | H18: =SUM(R6C[-4]:RC[-4]) -> 20704
B19: 13 | C19: 3576 | D19: =ROUND(RC[-1]*RC[1],0) -> 3576 | E19: 1 | G19: =SUM(R6C[-4]:RC[-4]) -> 24280 | H19: =SUM(R6C[-4]:RC[-4]) -> 24280
B20: 14 | C20: 4047 | D20: =ROUND(RC[-1]*RC[1],0) -> 4047 | E20: 1 | G20: =SUM(R6C[-4]:RC[-4]) -> 28327 | H20: =SUM(R6C[-4]:RC[-4]) -> 28327
B21: 15 | C21: 4587 | D21: =ROUND(RC[-1]*RC[1],0) -> 4587 | E21: 1 | G21: =SUM(R6C[-4]:RC[-4]) -> 32914 | H21: =SUM(R6C[-4]:RC[-4]) -> 32914
B22: 16 | C22: 5204 | D22: =ROUND(RC[-1]*RC[1],0) -> 5204 | E22: 1 | G22: =SUM(R6C[-4]:RC[-4]) -> 38118 | H22: =SUM(R6C[-4]:RC[-4]) -> 38118
B23: 17 | C23: 5906 | D23: =ROUND(RC[-1]*RC[1],0) -> 5906 | E23: 1 | G23: =SUM(R6C[-4]:RC[-4]) -> 44024 | H23: =SUM(R6C[-4]:RC[-4]) -> 44024
B24: 18 | C24: 9251 | D24: =ROUND(RC[-1]*RC[1],0) -> 9251 | E24: 1 | G24: =SUM(R6C[-4]:RC[-4]) -> 53275 | H24: =SUM(R6C[-4]:RC[-4]) -> 53275
B25: 19 | C25: 10296 | D25: =ROUND(RC[-1]*RC[1],0) -> 10296 | E25: 1 | G25: =SUM(R6C[-4]:RC[-4]) -> 63571 | H25: =SUM(R6C[-4]:RC[-4]) -> 63571
B26: 20 | C26: 22400 | D26: =ROUND(RC[-1]*RC[1],0) -> 22400 | E26: 1 | G26: =SUM(R6C[-4]:RC[-4]) -> 85971 | H26: =SUM(R6C[-4]:RC[-4]) -> 85971
B27: 21 | C27: 24219 | D27: =ROUND(RC[-1]*RC[1],0) -> 12110 | E27: 0.5 | G27: =SUM(R6C[-4]:RC[-4]) -> 110190 | H27: =SUM(R6C[-4]:RC[-4]) -> 98081
B28: 22 | C28: 26162 | D28: =ROUND(RC[-1]*RC[1],0) -> 13081 | E28: 0.5 | G28: =SUM(R6C[-4]:RC[-4]) -> 136352 | H28: =SUM(R6C[-4]:RC[-4]) -> 111162
B29: 23 | C29: 28237 | D29: =ROUND(RC[-1]*RC[1],0) -> 14119 | E29: 0.5 | G29: =SUM(R6C[-4]:RC[-4]) -> 164589 | H29: =SUM(R6C[-4]:RC[-4]) -> 125281
B30: 24 | C30: 30451 | D30: =ROUND(RC[-1]*RC[1],0) -> 15226 | E30: 0.5 | G30: =SUM(R6C[-4]:RC[-4]) -> 195040 | H30: =SUM(R6C[-4]:RC[-4]) -> 140507
B31: 25 | C31: 32812 | D31: =ROUND(RC[-1]*RC[1],0) -> 16406 | E31: 0.5 | G31: =SUM(R6C[-4]:RC[-4]) -> 227852 | H31: =SUM(R6C[-4]:RC[-4]) -> 156913
B32: 26 | C32: 35328 | D32: =ROUND(RC[-1]*RC[1],0) -> 17664 | E32: 0.5 | G32: =SUM(R6C[-4]:RC[-4]) -> 263180 | H32: =SUM(R6C[-4]:RC[-4]) -> 174577
B33: 27 | C33: 38007 | D33: =ROUND(RC[-1]*RC[1],0) -> 19004 | E33: 0.5 | G33: =SUM(R6C[-4]:RC[-4]) -> 301187 | H33: =SUM(R6C[-4]:RC[-4]) -> 193581
B34: 28 | C34: 40857 | D34: =ROUND(RC[-1]*RC[1],0) -> 20429 | E34: 0.5 | G34: =SUM(R6C[-4]:RC[-4]) -> 342044 | H34: =SUM(R6C[-4]:RC[-4]) -> 214010
B35: 29 | C35: 43885 | D35: =ROUND(RC[-1]*RC[1],0) -> 21943 | E35: 0.5 | G35: =SUM(R6C[-4]:RC[-4]) -> 385929 | H35: =SUM(R6C[-4]:RC[-4]) -> 235953
B36: 30 | C36: 47100 | D36: =ROUND(RC[-1]*RC[1],0) -> 23550 | E36: 0.5 | G36: =SUM(R6C[-4]:RC[-4]) -> 433029 | H36: =SUM(R6C[-4]:RC[-4]) -> 259503
B37: 31 | C37: 50508 | D37: =ROUND(RC[-1]*RC[1],0) -> 25254 | E37: 0.5 | G37: =SUM(R6C[-4]:RC[-4]) -> 483537 | H37: =SUM(R6C[-4]:RC[-4]) -> 284757
B38: 32 | C38: 54118 | D38: =ROUND(RC[-1]*RC[1],0) -> 27059 | E38: 0.5 | G38: =SUM(R6C[-4]:RC[-4]) -> 537655 | H38: =SUM(R6C[-4]:RC[-4]) -> 311816
B39: 33 | C39: 57938 | D39: =ROUND(RC[-1]*RC[1],0) -> 28969 | E39: 0.5 | G39: =SUM(R6C[-4]:RC[-4]) -> 595593 | H39: =SUM(R6C[-4]:RC[-4]) -> 340785
B40: 34 | C40: 61975 | D40: =ROUND(RC[-1]*RC[1],0) -> 30988 | E40: 0.5 | G40: =SUM(R6C[-4]:RC[-4]) -> 657568 | H40: =SUM(R6C[-4]:RC[-4]) -> 371773
B41: 35 | C41: 131237 | D41: =ROUND(RC[-1]*RC[1],0) -> 65619 | E41: 0.5 | G41: =SUM(R6C[-4]:RC[-4]) -> 788805 | H41: =SUM(R6C[-4]:RC[-4]) -> 437392
B42: 36 | C42: 137232 | D42: =ROUND(RC[-1]*RC[1],0) -> 68616 | E42: 0.5 | G42: =SUM(R6C[-4]:RC[-4]) -> 926037 | H42: =SUM(R6C[-4]:RC[-4]) -> 506008
B43: 37 | C43: 143468 | D43: =ROUND(RC[-1]*RC[1],0) -> 71734 | E43: 0.5 | G43: =SUM(R6C[-4]:RC[-4]) -> 1069505 | H43: =SUM(R6C[-4]:RC[-4]) -> 577742
B44: 38 | C44: 149953 | D44: =ROUND(RC[-1]*RC[1],0) -> 74977 | E44: 0.5 | G44: =SUM(R6C[-4]:RC[-4]) -> 1219458 | H44: =SUM(R6C[-4]:RC[-4]) -> 652719
B45: 39 | C45: 156694 | D45: =ROUND(RC[-1]*RC[1],0) -> 78347 | E45: 0.5 | G45: =SUM(R6C[-4]:RC[-4]) -> 1376152 | H45: =SUM(R6C[-4]:RC[-4]) -> 731066
B46: 40 | C46: 157960 | D46: =ROUND(RC[-1]*RC[1],0) -> 78980 | E46: 0.5 | G46: =SUM(R6C[-4]:RC[-4]) -> 1534112 | H46: =SUM(R6C[-4]:RC[-4]) -> 810046
B47: 41 | C47: 184001 | D47: =ROUND(RC[-1]*RC[1],0) -> 92001 | E47: 0.5 | G47: =SUM(R6C[-4]:RC[-4]) -> 1718113 | H47: =SUM(R6C[-4]:RC[-4]) -> 902047
B48: 42 | C48: 212665 | D48: =ROUND(RC[-1]*RC[1],0) -> 106333 | E48: 0.5 | G48: =SUM(R6C[-4]:RC[-4]) -> 1930778 | H48: =SUM(R6C[-4]:RC[-4]) -> 1008380
B49: 43 | C49: 244129 | D49: =ROUND(RC[-1]*RC[1],0) -> 122065 | E49: 0.5 | G49: =SUM(R6C[-4]:RC[-4]) -> 2174907 | H49: =SUM(R6C[-4]:RC[-4]) -> 1130445
B50: 44 | C50: 278577 | D50: =ROUND(RC[-1]*RC[1],0) -> 139289 | E50: 0.5 | G50: =SUM(R6C[-4]:RC[-4]) -> 2453484 | H50: =SUM(R6C[-4]:RC[-4]) -> 1269734
B51: 45 | C51: 316200 | D51: =ROUND(RC[-1]*RC[1],0) -> 158100 | E51: 0.5 | G51: =SUM(R6C[-4]:RC[-4]) -> 2769684 | H51: =SUM(R6C[-4]:RC[-4]) -> 1427834
B52: 46 | C52: 357193 | D52: =ROUND(RC[-1]*RC[1],0) -> 178597 | E52: 0.5 | G52: =SUM(R6C[-4]:RC[-4]) -> 3126877 | H52: =SUM(R6C[-4]:RC[-4]) -> 1606431
B53: 47 | C53: 401759 | D53: =ROUND(RC[-1]*RC[1],0) -> 200880 | E53: 0.5 | G53: =SUM(R6C[-4]:RC[-4]) -> 3528636 | H53: =SUM(R6C[-4]:RC[-4]) -> 1807311
B54: 48 | C54: 450108 | D54: =ROUND(RC[-1]*RC[1],0) -> 225054 | E54: 0.5 | G54: =SUM(R6C[-4]:RC[-4]) -> 3978744 | H54: =SUM(R6C[-4]:RC[-4]) -> 2032365
B55: 49 | C55: 502454 | D55: =ROUND(RC[-1]*RC[1],0) -> 251227 | E55: 0.5 | G55: =SUM(R6C[-4]:RC[-4]) -> 4481198 | H55: =SUM(R6C[-4]:RC[-4]) -> 2283592
B56: 50 | C56: 503622 | D56: =ROUND(RC[-1]*RC[1],0) -> 251811 | E56: 0.5 | G56: =SUM(R6C[-4]:RC[-4]) -> 4984820 | H56: =SUM(R6C[-4]:RC[-4]) -> 2535403
B57: 51 | C57: 563140 | D57: =ROUND(RC[-1]*RC[1],0) -> 281570 | E57: 0.5 | G57: =SUM(R6C[-4]:RC[-4]) -> 5547960 | H57: =SUM(R6C[-4]:RC[-4]) -> 2816973
B58: 52 | C58: 627534 | D58: =ROUND(RC[-1]*RC[1],0) -> 313767 | E58: 0.5 | G58: =SUM(R6C[-4]:RC[-4]) -> 6175494 | H58: =SUM(R6C[-4]:RC[-4]) -> 3130740
B59: 53 | C59: 697056 | D59: =ROUND(RC[-1]*RC[1],0) -> 348528 | E59: 0.5 | G59: =SUM(R6C[-4]:RC[-4]) -> 6872550 | H59: =SUM(R6C[-4]:RC[-4]) -> 3479268
B60: 54 | C60: 771966 | D60: =ROUND(RC[-1]*RC[1],0) -> 385983 | E60: 0.5 | G60: =SUM(R6C[-4]:RC[-4]) -> 7644516 | H60: =SUM(R6C[-4]:RC[-4]) -> 3865251
B61: 55 | C61: 852527 | D61: =ROUND(RC[-1]*RC[1],0) -> 426264 | E61: 0.5 | G61: =SUM(R6C[-4]:RC[-4]) -> 8497043 | H61: =SUM(R6C[-4]:RC[-4]) -> 4291515
B62: 56 | C62: 939010 | D62: =ROUND(RC[-1]*RC[1],0) -> 469505 | E62: 0.5 | G62: =SUM(R6C[-4]:RC[-4]) -> 9436053 | H62: =SUM(R6C[-4]:RC[-4]) -> 4761020
B63: 57 | C63: 1031693 | D63: =ROUND(RC[-1]*RC[1],0) -> 515847 | E63: 0.5 | G63: =SUM(R6C[-4]:RC[-4]) -> 10467746 | H63: =SUM(R6C[-4]:RC[-4]) -> 5276867
B64: 58 | C64: 1130858 | D64: =ROUND(RC[-1]*RC[1],0) -> 565429 | E64: 0.5 | G64: =SUM(R6C[-4]:RC[-4]) -> 11598604 | H64: =SUM(R6C[-4]:RC[-4]) -> 5842296
B65: 59 | C65: 1236796 | D65: =ROUND(RC[-1]*RC[1],0) -> 618398 | E65: 0.5 | G65: =SUM(R6C[-4]:RC[-4]) -> 12835400 | H65: =SUM(R6C[-4]:RC[-4]) -> 6460694
B66: 60 | C66: 1349802 | D66: =ROUND(RC[-1]*RC[1],0) -> 674901 | E66: 0.5 | G66: =SUM(R6C[-4]:RC[-4]) -> 14185202 | H66: =SUM(R6C[-4]:RC[-4]) -> 7135595
B67: 61 | C67: 1470178 | D67: =ROUND(RC[-1]*RC[1],0) -> 882107 | E67: 0.6 | G67: =SUM(R6C[-4]:RC[-4]) -> 15655380 | H67: =SUM(R6C[-4]:RC[-4]) -> 8017702
B68: 62 | C68: 1598232 | D68: =ROUND(RC[-1]*RC[1],0) -> 1118762 | E68: 0.7 | G68: =SUM(R6C[-4]:RC[-4]) -> 17253612 | H68: =SUM(R6C[-4]:RC[-4]) -> 9136464
B69: 63 | C69: 1734279 | D69: =ROUND(RC[-1]*RC[1],0) -> 1387423 | E69: 0.8 | G69: =SUM(R6C[-4]:RC[-4]) -> 18987891 | H69: =SUM(R6C[-4]:RC[-4]) -> 10523887
B70: 64 | C70: 1878640 | D70: =ROUND(RC[-1]*RC[1],0) -> 1690776 | E70: 0.9 | G70: =SUM(R6C[-4]:RC[-4]) -> 20866531 | H70: =SUM(R6C[-4]:RC[-4]) -> 12214663
B71: 65 | C71: 2031642 | D71: =ROUND(RC[-1]*RC[1],0) -> 2031642 | E71: 1 | G71: =SUM(R6C[-4]:RC[-4]) -> 22898173 | H71: =SUM(R6C[-4]:RC[-4]) -> 14246305
B72: 66 | C72: 2193618 | D72: =ROUND(RC[-1]*RC[1],0) -> 2193618 | E72: 1 | G72: =SUM(R6C[-4]:RC[-4]) -> 25091791 | H72: =SUM(R6C[-4]:RC[-4]) -> 16439923
B73: 67 | C73: 2364906 | D73: =ROUND(RC[-1]*RC[1],0) -> 2364906 | E73: 1 | G73: =SUM(R6C[-4]:RC[-4]) -> 27456697 | H73: =SUM(R6C[-4]:RC[-4]) -> 18804829
B74: 68 | C74: 2545854 | D74: =ROUND(RC[-1]*RC[1],0) -> 2545854 | E74: 1 | G74: =SUM(R6C[-4]:RC[-4]) -> 30002551 | H74: =SUM(R6C[-4]:RC[-4]) -> 21350683
B75: 69 | C75: 2736814 | D75: =ROUND(RC[-1]*RC[1],0) -> 2736814 | E75: 1 | G75: =SUM(R6C[-4]:RC[-4]) -> 32739365 | H75: =SUM(R6C[-4]:RC[-4]) -> 24087497
B76: 70 | C76: 2938142 | D76: =ROUND(RC[-1]*RC[1],0) -> 2938142 | E76: 1 | G76: =SUM(R6C[-4]:RC[-4]) -> 35677507 | H76: =SUM(R6C[-4]:RC[-4]) -> 27025639
B77: 71 | C77: 3150204 | D77: =ROUND(RC[-1]*RC[1],0) -> 3150204 | E77: 1 | G77: =SUM(R6C[-4]:RC[-4]) -> 38827711 | H77: =SUM(R6C[-4]:RC[-4]) -> 30175843
B78: 72 | C78: 3373371 | D78: =ROUND(RC[-1]*RC[1],0) -> 3373371 | E78: 1 | G78: =SUM(R6C[-4]:RC[-4]) -> 42201082 | H78: =SUM(R6C[-4]:RC[-4]) -> 33549214
B79: 73 | C79: 3608018 | D79: =ROUND(RC[-1]*RC[1],0) -> 3608018 | E79: 1 | G79: =SUM(R6C[-4]:RC[-4]) -> 45809100 | H79: =SUM(R6C[-4]:RC[-4]) -> 37157232
B80: 74 | C80: 3854531 | D80: =ROUND(RC[-1]*RC[1],0) -> 3854531 | E80: 1 | G80: =SUM(R6C[-4]:RC[-4]) -> 49663631 | H80: =SUM(R6C[-4]:RC[-4]) -> 41011763
B81: 75 | C81: 4113297 | D81: =ROUND(RC[-1]*RC[1],0) -> 4113297 | E81: 1 | G81: =SUM(R6C[-4]:RC[-4]) -> 53776928 | H81: =SUM(R6C[-4]:RC[-4]) -> 45125060
B82: 76 | C82: 4384713 | D82: =ROUND(RC[-1]*RC[1],0) -> 4384713 | E82: 1 | G82: =SUM(R6C[-4]:RC[-4]) -> 58161641 | H82: =SUM(R6C[-4]:RC[-4]) -> 49509773
B83: 77 | C83: 4669180 | D83: =ROUND(RC[-1]*RC[1],0) -> 4669180 | E83: 1 | G83: =SUM(R6C[-4]:RC[-4]) -> 62830821 | H83: =SUM(R6C[-4]:RC[-4]) -> 54178953
B84: 78 | C84: 4967106 | D84: =ROUND(RC[-1]*RC[1],0) -> 4967106 | E84: 1 | G84: =SUM(R6C[-4]:RC[-4]) -> 67797927 | H84: =SUM(R6C[-4]:RC[-4]) -> 59146059
B85: 79 | C85: 5278907 | D85: =ROUND(RC[-1]*RC[1],0) -> 5278907 | E85: 1 | G85: =SUM(R6C[-4]:RC[-4]) -> 73076834 | H85: =SUM(R6C[-4]:RC[-4]) -> 64424966
B86: 80 | C86: 6165502 | D86: =ROUND(RC[-1]*RC[1],0) -> 6165502 | E86: 1 | G86: =SUM(R6C[-4]:RC[-4]) -> 79242336 | H86: =SUM(R6C[-4]:RC[-4]) -> 70590468
B87: 81 | C87: 7134982 | D87: =ROUND(RC[-1]*RC[1],0) -> 7134982 | E87: 1 | G87: =SUM(R6C[-4]:RC[-4]) -> 86377318 | H87: =SUM(R6C[-4]:RC[-4]) -> 77725450
B88: 82 | C88: 8192326 | D88: =ROUND(RC[-1]*RC[1],0) -> 8192326 | E88: 1 | G88: =SUM(R6C[-4]:RC[-4]) -> 94569644 | H88: =SUM(R6C[-4]:RC[-4]) -> 85917776
B89: 83 | C89: 9342695 | D89: =ROUND(RC[-1]*RC[1],0) -> 9342695 | E89: 1 | G89: =SUM(R6C[-4]:RC[-4]) -> 103912339 | H89: =SUM(R6C[-4]:RC[-4]) -> 95260471
B90: 84 | C90: 10591436 | D90: =ROUND(RC[-1]*RC[1],0) -> 10591436 | E90: 1 | G90: =SUM(R6C[-4]:RC[-4]) -> 114503775 | H90: =SUM(R6C[-4]:RC[-4]) -> 105851907
B91: 85 | C91: 11944083 | D91: =ROUND(RC[-1]*RC[1],0) -> 11944083 | E91: 1 | G91: =SUM(R6C[-4]:RC[-4]) -> 126447858 | H91: =SUM(R6C[-4]:RC[-4]) -> 117795990
B92: 86 | C92: 13406363 | D92: =ROUND(RC[-1]*RC[1],0) -> 13406363 | E92: 1 | G92: =SUM(R6C[-4]:RC[-4]) -> 139854221 | H92: =SUM(R6C[-4]:RC[-4]) -> 131202353
B93: 87 | C93: 14984196 | D93: =ROUND(RC[-1]*RC[1],0) -> 14984196 | E93: 1 | G93: =SUM(R6C[-4]:RC[-4]) -> 154838417 | H93: =SUM(R6C[-4]:RC[-4]) -> 146186549
B94: 88 | C94: 16683700 | D94: =ROUND(RC[-1]*RC[1],0) -> 16683700 | E94: 1 | G94: =SUM(R6C[-4]:RC[-4]) -> 171522117 | H94: =SUM(R6C[-4]:RC[-4]) -> 162870249
B95: 89 | C95: 18511193 | D95: =ROUND(RC[-1]*RC[1],0) -> 18511193 | E95: 1 | G95: =SUM(R6C[-4]:RC[-4]) -> 190033310 | H95: =SUM(R6C[-4]:RC[-4]) -> 181381442
B96: 90 | C96: 20473198 | D96: =ROUND(RC[-1]*RC[1],0) -> 20473198 | E96: 1 | G96: =SUM(R6C[-4]:RC[-4]) -> 210506508 | H96: =SUM(R6C[-4]:RC[-4]) -> 201854640
B97: 91 | C97: 22576445 | D97: =ROUND(RC[-1]*RC[1],0) -> 22576445 | E97: 1 | G97: =SUM(R6C[-4]:RC[-4]) -> 233082953 | H97: =SUM(R6C[-4]:RC[-4]) -> 224431085
B98: 92 | C98: 24827873 | D98: =ROUND(RC[-1]*RC[1],0) -> 24827873 | E98: 1 | G98: =SUM(R6C[-4]:RC[-4]) -> 257910826 | H98: =SUM(R6C[-4]:RC[-4]) -> 249258958
B99: 93 | C99: 27234635 | D99: =ROUND(RC[-1]*RC[1],0) -> 27234635 | E99: 1 | G99: =SUM(R6C[-4]:RC[-4]) -> 285145461 | H99: =SUM(R6C[-4]:RC[-4]) -> 276493593
B100: 94 | C100: 29804099 | D100: =ROUND(RC[-1]*RC[1],0) -> 29804099 | E100: 1 | G100: =SUM(R6C[-4]:RC[-4]) -> 314949560 | H100: =SUM(R6C[-4]:RC[-4]) -> 306297692
B101: 95 | C101: 32543854 | D101: =ROUND(RC[-1]*RC[1],0) -> 32543854 | E101: 1 | G101: =SUM(R6C[-4]:RC[-4]) -> 347493414 | H101: =SUM(R6C[-4]:RC[-4]) -> 338841546
B102: 96 | C102: 35461711 | D102: =ROUND(RC[-1]*RC[1],0) -> 35461711 | E102: 1 | G102: =SUM(R6C[-4]:RC[-4]) -> 382955125 | H102: =SUM(R6C[-4]:RC[-4]) -> 374303257
B103: 97 | C103: 38565707 | D103: =ROUND(RC[-1]*RC[1],0) -> 38565707 | E103: 1 | G103: =SUM(R6C[-4]:RC[-4]) -> 421520832 | H103: =SUM(R6C[-4]:RC[-4]) -> 412868964
B104: 98 | C104: 41864106 | D104: =ROUND(RC[-1]*RC[1],0) -> 41864106 | E104: 1 | G104: =SUM(R6C[-4]:RC[-4]) -> 463384938 | H104: =SUM(R6C[-4]:RC[-4]) -> 454733070
B105: 99 | C105: 45365405 | D105: =ROUND(RC[-1]*RC[1],0) -> 45365405 | E105: 1 | G105: =SUM(R6C[-4]:RC[-4]) -> 508750343 | H105: =SUM(R6C[-4]:RC[-4]) -> 500098475
B106: 100 | C106: 61347923 | D106: =ROUND(RC[-1]*RC[1],0) -> 61347923 | E106: 1 | G106: =SUM(R6C[-4]:RC[-4]) -> 570098266 | H106: =SUM(R6C[-4]:RC[-4]) -> 561446398
B107: 101 | C107: 66264843 | D107: =ROUND(RC[-1]*RC[1],0) -> 66264843 | E107: 1 | G107: =SUM(R6C[-4]:RC[-4]) -> 636363109 | H107: =SUM(R6C[-4]:RC[-4]) -> 627711241
B108: 102 | C108: 71469032 | D108: =ROUND(RC[-1]*RC[1],0) -> 71469032 | E108: 1 | G108: =SUM(R6C[-4]:RC[-4]) -> 707832141 | H108: =SUM(R6C[-4]:RC[-4]) -> 699180273
B109: 103 | C109: 76972309 | D109: =ROUND(RC[-1]*RC[1],0) -> 76972309 | E109: 1 | G109: =SUM(R6C[-4]:RC[-4]) -> 784804450 | H109: =SUM(R6C[-4]:RC[-4]) -> 776152582
B110: 104 | C110: 82786804 | D110: =ROUND(RC[-1]*RC[1],0) -> 82786804 | E110: 1 | G110: =SUM(R6C[-4]:RC[-4]) -> 867591254 | H110: =SUM(R6C[-4]:RC[-4]) -> 858939386
B111: 105 | C111: 88924959 | D111: =ROUND(RC[-1]*RC[1],0) -> 88924959 | E111: 1 | G111: =SUM(R6C[-4]:RC[-4]) -> 956516213 | H111: =SUM(R6C[-4]:RC[-4]) -> 947864345
B112: 106 | C112: 95399534 | D112: =ROUND(RC[-1]*RC[1],0) -> 95399534 | E112: 1 | G112: =SUM(R6C[-4]:RC[-4]) -> 1051915747 | H112: =SUM(R6C[-4]:RC[-4]) -> 1043263879
B113: 107 | C113: 102223610 | D113: =ROUND(RC[-1]*RC[1],0) -> 102223610 | E113: 1 | G113: =SUM(R6C[-4]:RC[-4]) -> 1154139357 | H113: =SUM(R6C[-4]:RC[-4]) -> 1145487489
B114: 108 | C114: 109410593 | D114: =ROUND(RC[-1]*RC[1],0) -> 109410593 | E114: 1 | G114: =SUM(R6C[-4]:RC[-4]) -> 1263549950 | H114: =SUM(R6C[-4]:RC[-4]) -> 1254898082
B115: 109 | C115: 116974216 | D115: =ROUND(RC[-1]*RC[1],0) -> 116974216 | E115: 1 | G115: =SUM(R6C[-4]:RC[-4]) -> 1380524166 | H115: =SUM(R6C[-4]:RC[-4]) -> 1371872298
B116: 110 | C116: 124928548 | D116: =ROUND(RC[-1]*RC[1],0) -> 124928548 | E116: 1 | G116: =SUM(R6C[-4]:RC[-4]) -> 1505452714 | H116: =SUM(R6C[-4]:RC[-4]) -> 1496800846
B117: 111 | C117: 133287992 | D117: =ROUND(RC[-1]*RC[1],0) -> 133287992 | E117: 1 | G117: =SUM(R6C[-4]:RC[-4]) -> 1638740706 | H117: =SUM(R6C[-4]:RC[-4]) -> 1630088838
B118: 112 | C118: 142067293 | D118: =ROUND(RC[-1]*RC[1],0) -> 142067293 | E118: 1 | G118: =SUM(R6C[-4]:RC[-4]) -> 1780807999 | H118: =SUM(R6C[-4]:RC[-4]) -> 1772156131
B119: 113 | C119: 151281540 | D119: =ROUND(RC[-1]*RC[1],0) -> 151281540 | E119: 1 | G119: =SUM(R6C[-4]:RC[-4]) -> 1932089539 | H119: =SUM(R6C[-4]:RC[-4]) -> 1923437671
B120: 114 | C120: 160946170 | D120: =ROUND(RC[-1]*RC[1],0) -> 160946170 | E120: 1 | G120: =SUM(R6C[-4]:RC[-4]) -> 2093035709 | H120: =SUM(R6C[-4]:RC[-4]) -> 2084383841
B121: 115 | C121: 171076973 | D121: =ROUND(RC[-1]*RC[1],0) -> 171076973 | E121: 1 | G121: =SUM(R6C[-4]:RC[-4]) -> 2264112682 | H121: =SUM(R6C[-4]:RC[-4]) -> 2255460814
B122: 116 | C122: 181690094 | D122: =ROUND(RC[-1]*RC[1],0) -> 181690094 | E122: 1 | G122: =SUM(R6C[-4]:RC[-4]) -> 2445802776 | H122: =SUM(R6C[-4]:RC[-4]) -> 2437150908
B123: 117 | C123: 192802041 | D123: =ROUND(RC[-1]*RC[1],0) -> 192802041 | E123: 1 | G123: =SUM(R6C[-4]:RC[-4]) -> 2638604817 | H123: =SUM(R6C[-4]:RC[-4]) -> 2629952949
B124: 118 | C124: 204429681 | D124: =ROUND(RC[-1]*RC[1],0) -> 204429681 | E124: 1 | G124: =SUM(R6C[-4]:RC[-4]) -> 2843034498 | H124: =SUM(R6C[-4]:RC[-4]) -> 2834382630
B125: 119 | C125: 216590254 | D125: =ROUND(RC[-1]*RC[1],0) -> 216590254 | E125: 1 | G125: =SUM(R6C[-4]:RC[-4]) -> 3059624752 | H125: =SUM(R6C[-4]:RC[-4]) -> 3050972884
B126: 120 | C126: 229301368 | D126: =ROUND(RC[-1]*RC[1],0) -> 229301368 | E126: 1 | G126: =SUM(R6C[-4]:RC[-4]) -> 3288926120 | H126: =SUM(R6C[-4]:RC[-4]) -> 3280274252
B127: 121 | C127: 291097210 | D127: =ROUND(RC[-1]*RC[1],0) -> 291097210 | E127: 1 | G127: =SUM(R6C[-4]:RC[-4]) -> 3580023330 | H127: =SUM(R6C[-4]:RC[-4]) -> 3571371462
B128: 122 | C128: 307737048 | D128: =ROUND(RC[-1]*RC[1],0) -> 307737048 | E128: 1 | G128: =SUM(R6C[-4]:RC[-4]) -> 3887760378 | H128: =SUM(R6C[-4]:RC[-4]) -> 3879108510
B129: 123 | C129: 325103653 | D129: =ROUND(RC[-1]*RC[1],0) -> 325103653 | E129: 1 | G129: =SUM(R6C[-4]:RC[-4]) -> 4212864031 | H129: =SUM(R6C[-4]:RC[-4]) -> 4204212163
B130: 124 | C130: 343219988 | D130: =ROUND(RC[-1]*RC[1],0) -> 343219988 | E130: 1 | G130: =SUM(R6C[-4]:RC[-4]) -> 4556084019 | H130: =SUM(R6C[-4]:RC[-4]) -> 4547432151
B131: 125 | C131: 362109485 | D131: =ROUND(RC[-1]*RC[1],0) -> 362109485 | E131: 1 | G131: =SUM(R6C[-4]:RC[-4]) -> 4918193504 | H131: =SUM(R6C[-4]:RC[-4]) -> 4909541636
B132: 126 | C132: 381796050 | D132: =ROUND(RC[-1]*RC[1],0) -> 381796050 | E132: 1 | G132: =SUM(R6C[-4]:RC[-4]) -> 5299989554 | H132: =SUM(R6C[-4]:RC[-4]) -> 5291337686
B133: 127 | C133: 402304068 | D133: =ROUND(RC[-1]*RC[1],0) -> 402304068 | E133: 1 | G133: =SUM(R6C[-4]:RC[-4]) -> 5702293622 | H133: =SUM(R6C[-4]:RC[-4]) -> 5693641754
B134: 128 | C134: 423658407 | D134: =ROUND(RC[-1]*RC[1],0) -> 423658407 | E134: 1 | G134: =SUM(R6C[-4]:RC[-4]) -> 6125952029 | H134: =SUM(R6C[-4]:RC[-4]) -> 6117300161
B135: 129 | C135: 445884426 | D135: =ROUND(RC[-1]*RC[1],0) -> 445884426 | E135: 1 | G135: =SUM(R6C[-4]:RC[-4]) -> 6571836455 | H135: =SUM(R6C[-4]:RC[-4]) -> 6563184587
B136: 130 | C136: 469007973 | D136: =ROUND(RC[-1]*RC[1],0) -> 469007973 | E136: 1 | G136: =SUM(R6C[-4]:RC[-4]) -> 7040844428 | H136: =SUM(R6C[-4]:RC[-4]) -> 7032192560
B137: 131 | C137: 493055397 | D137: =ROUND(RC[-1]*RC[1],0) -> 493055397 | E137: 1 | G137: =SUM(R6C[-4]:RC[-4]) -> 7533899825 | H137: =SUM(R6C[-4]:RC[-4]) -> 7525247957
B138: 132 | C138: 518053546 | D138: =ROUND(RC[-1]*RC[1],0) -> 518053546 | E138: 1 | G138: =SUM(R6C[-4]:RC[-4]) -> 8051953371 | H138: =SUM(R6C[-4]:RC[-4]) -> 8043301503
B139: 133 | C139: 544029777 | D139: =ROUND(RC[-1]*RC[1],0) -> 544029777 | E139: 1 | G139: =SUM(R6C[-4]:RC[-4]) -> 8595983148 | H139: =SUM(R6C[-4]:RC[-4]) -> 8587331280
B140: 134 | C140: 571011960 | D140: =ROUND(RC[-1]*RC[1],0) -> 571011960 | E140: 1 | G140: =SUM(R6C[-4]:RC[-4]) -> 9166995108 | H140: =SUM(R6C[-4]:RC[-4]) -> 9158343240
B141: 135 | C141: 599028477 | D141: =ROUND(RC[-1]*RC[1],0) -> 599028477 | E141: 1 | G141: =SUM(R6C[-4]:RC[-4]) -> 9766023585 | H141: =SUM(R6C[-4]:RC[-4]) -> 9757371717
B142: 136 | C142: 628108236 | D142: =ROUND(RC[-1]*RC[1],0) -> 628108236 | E142: 1 | G142: =SUM(R6C[-4]:RC[-4]) -> 10394131821 | H142: =SUM(R6C[-4]:RC[-4]) -> 10385479953
B143: 137 | C143: 658280666 | D143: =ROUND(RC[-1]*RC[1],0) -> 658280666 | E143: 1 | G143: =SUM(R6C[-4]:RC[-4]) -> 11052412487 | H143: =SUM(R6C[-4]:RC[-4]) -> 11043760619
B144: 138 | C144: 689575731 | D144: =ROUND(RC[-1]*RC[1],0) -> 689575731 | E144: 1 | G144: =SUM(R6C[-4]:RC[-4]) -> 11741988218 | H144: =SUM(R6C[-4]:RC[-4]) -> 11733336350
B145: 139 | C145: 722023926 | D145: =ROUND(RC[-1]*RC[1],0) -> 722023926 | E145: 1 | G145: =SUM(R6C[-4]:RC[-4]) -> 12464012144 | H145: =SUM(R6C[-4]:RC[-4]) -> 12455360276
B146: 140 | C146: 755656287 | D146: =ROUND(RC[-1]*RC[1],0) -> 755656287 | E146: 1 | G146: =SUM(R6C[-4]:RC[-4]) -> 13219668431 | H146: =SUM(R6C[-4]:RC[-4]) -> 13211016563
B147: 141 | C147: 790504396 | D147: =ROUND(RC[-1]*RC[1],0) -> 790504396 | E147: 1 | G147: =SUM(R6C[-4]:RC[-4]) -> 14010172827 | H147: =SUM(R6C[-4]:RC[-4]) -> 14001520959
B148: 142 | C148: 826600383 | D148: =ROUND(RC[-1]*RC[1],0) -> 826600383 | E148: 1 | G148: =SUM(R6C[-4]:RC[-4]) -> 14836773210 | H148: =SUM(R6C[-4]:RC[-4]) -> 14828121342
B149: 143 | C149: 863976930 | D149: =ROUND(RC[-1]*RC[1],0) -> 863976930 | E149: 1 | G149: =SUM(R6C[-4]:RC[-4]) -> 15700750140 | H149: =SUM(R6C[-4]:RC[-4]) -> 15692098272
B150: 144 | C150: 902667281 | D150: =ROUND(RC[-1]*RC[1],0) -> 902667281 | E150: 1 | G150: =SUM(R6C[-4]:RC[-4]) -> 16603417421 | H150: =SUM(R6C[-4]:RC[-4]) -> 16594765553
B151: 145 | C151: 942705239 | D151: =ROUND(RC[-1]*RC[1],0) -> 942705239 | E151: 1 | G151: =SUM(R6C[-4]:RC[-4]) -> 17546122660 | H151: =SUM(R6C[-4]:RC[-4]) -> 17537470792
B152: 146 | C152: 984125178 | D152: =ROUND(RC[-1]*RC[1],0) -> 984125178 | E152: 1 | G152: =SUM(R6C[-4]:RC[-4]) -> 18530247838 | H152: =SUM(R6C[-4]:RC[-4]) -> 18521595970
B153: 147 | C153: 1026962044 | D153: =ROUND(RC[-1]*RC[1],0) -> 1026962044 | E153: 1 | G153: =SUM(R6C[-4]:RC[-4]) -> 19557209882 | H153: =SUM(R6C[-4]:RC[-4]) -> 19548558014
B154: 148 | C154: 1071251358 | D154: =ROUND(RC[-1]*RC[1],0) -> 1071251358 | E154: 1 | G154: =SUM(R6C[-4]:RC[-4]) -> 20628461240 | H154: =SUM(R6C[-4]:RC[-4]) -> 20619809372
B155: 149 | C155: 1117029226 | D155: =ROUND(RC[-1]*RC[1],0) -> 1117029226 | E155: 1 | G155: =SUM(R6C[-4]:RC[-4]) -> 21745490466 | H155: =SUM(R6C[-4]:RC[-4]) -> 21736838598
B156: 150 | C156: 1164332337 | D156: =ROUND(RC[-1]*RC[1],0) -> 1164332337 | E156: 1 | G156: =SUM(R6C[-4]:RC[-4]) -> 22909822803 | H156: =SUM(R6C[-4]:RC[-4]) -> 22901170935
B157: 151 | C157: 1213197975 | D157: =ROUND(RC[-1]*RC[1],0) -> 1213197975 | E157: 1 | G157: =SUM(R6C[-4]:RC[-4]) -> 24123020778 | H157: =SUM(R6C[-4]:RC[-4]) -> 24114368910
B158: 152 | C158: 1263664017 | D158: =ROUND(RC[-1]*RC[1],0) -> 1263664017 | E158: 1 | G158: =SUM(R6C[-4]:RC[-4]) -> 25386684795 | H158: =SUM(R6C[-4]:RC[-4]) -> 25378032927
B159: 153 | C159: 1315768942 | D159: =ROUND(RC[-1]*RC[1],0) -> 1315768942 | E159: 1 | G159: =SUM(R6C[-4]:RC[-4]) -> 26702453737 | H159: =SUM(R6C[-4]:RC[-4]) -> 26693801869
B160: 154 | C160: 1369551833 | D160: =ROUND(RC[-1]*RC[1],0) -> 1369551833 | E160: 1 | G160: =SUM(R6C[-4]:RC[-4]) -> 28072005570 | H160: =SUM(R6C[-4]:RC[-4]) -> 28063353702
B161: 155 | C161: 1425052383 | D161: =ROUND(RC[-1]*RC[1],0) -> 1425052383 | E161: 1 | G161: =SUM(R6C[-4]:RC[-4]) -> 29497057953 | H161: =SUM(R6C[-4]:RC[-4]) -> 29488406085
B162: 156 | C162: 1482310902 | D162: =ROUND(RC[-1]*RC[1],0) -> 1482310902 | E162: 1 | G162: =SUM(R6C[-4]:RC[-4]) -> 30979368855 | H162: =SUM(R6C[-4]:RC[-4]) -> 30970716987
B163: 157 | C163: 1541368317 | D163: =ROUND(RC[-1]*RC[1],0) -> 1541368317 | E163: 1 | G163: =SUM(R6C[-4]:RC[-4]) -> 32520737172 | H163: =SUM(R6C[-4]:RC[-4]) -> 32512085304
B164: 158 | C164: 1602266179 | D164: =ROUND(RC[-1]*RC[1],0) -> 1602266179 | E164: 1 | G164: =SUM(R6C[-4]:RC[-4]) -> 34123003351 | H164: =SUM(R6C[-4]:RC[-4]) -> 34114351483
B165: 159 | C165: 1665046668 | D165: =ROUND(RC[-1]*RC[1],0) -> 1665046668 | E165: 1 | G165: =SUM(R6C[-4]:RC[-4]) -> 35788050019 | H165: =SUM(R6C[-4]:RC[-4]) -> 35779398151
B166: 160 | C166: 1729752597 | D166: =ROUND(RC[-1]*RC[1],0) -> 1729752597 | E166: 1 | G166: =SUM(R6C[-4]:RC[-4]) -> 37517802616 | H166: =SUM(R6C[-4]:RC[-4]) -> 37509150748
B167: 161 | C167: 1796427419 | D167: =ROUND(RC[-1]*RC[1],0) -> 1796427419 | E167: 1 | G167: =SUM(R6C[-4]:RC[-4]) -> 39314230035 | H167: =SUM(R6C[-4]:RC[-4]) -> 39305578167
B168: 162 | C168: 1865115227 | D168: =ROUND(RC[-1]*RC[1],0) -> 1865115227 | E168: 1 | G168: =SUM(R6C[-4]:RC[-4]) -> 41179345262 | H168: =SUM(R6C[-4]:RC[-4]) -> 41170693394
B169: 163 | C169: 1935860762 | D169: =ROUND(RC[-1]*RC[1],0) -> 1935860762 | E169: 1 | G169: =SUM(R6C[-4]:RC[-4]) -> 43115206024 | H169: =SUM(R6C[-4]:RC[-4]) -> 43106554156
B170: 164 | C170: 2008709418 | D170: =ROUND(RC[-1]*RC[1],0) -> 2008709418 | E170: 1 | G170: =SUM(R6C[-4]:RC[-4]) -> 45123915442 | H170: =SUM(R6C[-4]:RC[-4]) -> 45115263574
B171: 165 | C171: 2083707245 | D171: =ROUND(RC[-1]*RC[1],0) -> 2083707245 | E171: 1 | G171: =SUM(R6C[-4]:RC[-4]) -> 47207622687 | H171: =SUM(R6C[-4]:RC[-4]) -> 47198970819
B172: 166 | C172: 2160900955 | D172: =ROUND(RC[-1]*RC[1],0) -> 2160900955 | E172: 1 | G172: =SUM(R6C[-4]:RC[-4]) -> 49368523642 | H172: =SUM(R6C[-4]:RC[-4]) -> 49359871774
B173: 167 | C173: 2240337924 | D173: =ROUND(RC[-1]*RC[1],0) -> 2240337924 | E173: 1 | G173: =SUM(R6C[-4]:RC[-4]) -> 51608861566 | H173: =SUM(R6C[-4]:RC[-4]) -> 51600209698
B174: 168 | C174: 2322066203 | D174: =ROUND(RC[-1]*RC[1],0) -> 2322066203 | E174: 1 | G174: =SUM(R6C[-4]:RC[-4]) -> 53930927769 | H174: =SUM(R6C[-4]:RC[-4]) -> 53922275901
B175: 169 | C175: 2406134514 | D175: =ROUND(RC[-1]*RC[1],0) -> 2406134514 | E175: 1 | G175: =SUM(R6C[-4]:RC[-4]) -> 56337062283 | H175: =SUM(R6C[-4]:RC[-4]) -> 56328410415
B176: 170 | C176: 2492592261 | D176: =ROUND(RC[-1]*RC[1],0) -> 2492592261 | E176: 1 | G176: =SUM(R6C[-4]:RC[-4]) -> 58829654544 | H176: =SUM(R6C[-4]:RC[-4]) -> 58821002676
B177: 171 | C177: 2581489534 | D177: =ROUND(RC[-1]*RC[1],0) -> 2581489534 | E177: 1 | G177: =SUM(R6C[-4]:RC[-4]) -> 61411144078 | H177: =SUM(R6C[-4]:RC[-4]) -> 61402492210
B178: 172 | C178: 2672877109 | D178: =ROUND(RC[-1]*RC[1],0) -> 2672877109 | E178: 1 | G178: =SUM(R6C[-4]:RC[-4]) -> 64084021187 | H178: =SUM(R6C[-4]:RC[-4]) -> 64075369319
B179: 173 | C179: 2766806460 | D179: =ROUND(RC[-1]*RC[1],0) -> 2766806460 | E179: 1 | G179: =SUM(R6C[-4]:RC[-4]) -> 66850827647 | H179: =SUM(R6C[-4]:RC[-4]) -> 66842175779
B180: 174 | C180: 2863329758 | D180: =ROUND(RC[-1]*RC[1],0) -> 2863329758 | E180: 1 | G180: =SUM(R6C[-4]:RC[-4]) -> 69714157405 | H180: =SUM(R6C[-4]:RC[-4]) -> 69705505537
B181: 175 | C181: 2962499877 | D181: =ROUND(RC[-1]*RC[1],0) -> 2962499877 | E181: 1 | G181: =SUM(R6C[-4]:RC[-4]) -> 72676657282 | H181: =SUM(R6C[-4]:RC[-4]) -> 72668005414
B182: 176 | C182: 3064370401 | D182: =ROUND(RC[-1]*RC[1],0) -> 3064370401 | E182: 1 | G182: =SUM(R6C[-4]:RC[-4]) -> 75741027683 | H182: =SUM(R6C[-4]:RC[-4]) -> 75732375815
B183: 177 | C183: 3168995624 | D183: =ROUND(RC[-1]*RC[1],0) -> 3168995624 | E183: 1 | G183: =SUM(R6C[-4]:RC[-4]) -> 78910023307 | H183: =SUM(R6C[-4]:RC[-4]) -> 78901371439
B184: 178 | C184: 3276430561 | D184: =ROUND(RC[-1]*RC[1],0) -> 3276430561 | E184: 1 | G184: =SUM(R6C[-4]:RC[-4]) -> 82186453868 | H184: =SUM(R6C[-4]:RC[-4]) -> 82177802000
B185: 179 | C185: 3386730947 | D185: =ROUND(RC[-1]*RC[1],0) -> 3386730947 | E185: 1 | G185: =SUM(R6C[-4]:RC[-4]) -> 85573184815 | H185: =SUM(R6C[-4]:RC[-4]) -> 85564532947
B186: 180 | C186: 3499953243 | D186: =ROUND(RC[-1]*RC[1],0) -> 3499953243 | E186: 1 | G186: =SUM(R6C[-4]:RC[-4]) -> 89073138058 | H186: =SUM(R6C[-4]:RC[-4]) -> 89064486190
B187: 181 | C187: 3616154645 | D187: =ROUND(RC[-1]*RC[1],0) -> 3616154645 | E187: 1 | G187: =SUM(R6C[-4]:RC[-4]) -> 92689292703 | H187: =SUM(R6C[-4]:RC[-4]) -> 92680640835
B188: 182 | C188: 3735393083 | D188: =ROUND(RC[-1]*RC[1],0) -> 3735393083 | E188: 1 | G188: =SUM(R6C[-4]:RC[-4]) -> 96424685786 | H188: =SUM(R6C[-4]:RC[-4]) -> 96416033918
B189: 183 | C189: 3857727228 | D189: =ROUND(RC[-1]*RC[1],0) -> 3857727228 | E189: 1 | G189: =SUM(R6C[-4]:RC[-4]) -> 100282413014 | H189: =SUM(R6C[-4]:RC[-4]) -> 100273761146
B190: 184 | C190: 3983216496 | D190: =ROUND(RC[-1]*RC[1],0) -> 3983216496 | E190: 1 | G190: =SUM(R6C[-4]:RC[-4]) -> 104265629510 | H190: =SUM(R6C[-4]:RC[-4]) -> 104256977642
B191: 185 | C191: 4111921055 | D191: =ROUND(RC[-1]*RC[1],0) -> 4111921055 | E191: 1 | G191: =SUM(R6C[-4]:RC[-4]) -> 108377550565 | H191: =SUM(R6C[-4]:RC[-4]) -> 108368898697
B192: 186 | C192: 4243901827 | D192: =ROUND(RC[-1]*RC[1],0) -> 4243901827 | E192: 1 | G192: =SUM(R6C[-4]:RC[-4]) -> 112621452392 | H192: =SUM(R6C[-4]:RC[-4]) -> 112612800524
B193: 187 | C193: 4379220494 | D193: =ROUND(RC[-1]*RC[1],0) -> 4379220494 | E193: 1 | G193: =SUM(R6C[-4]:RC[-4]) -> 117000672886 | H193: =SUM(R6C[-4]:RC[-4]) -> 116992021018
B194: 188 | C194: 4517939502 | D194: =ROUND(RC[-1]*RC[1],0) -> 4517939502 | E194: 1 | G194: =SUM(R6C[-4]:RC[-4]) -> 121518612388 | H194: =SUM(R6C[-4]:RC[-4]) -> 121509960520
B195: 189 | C195: 4660122067 | D195: =ROUND(RC[-1]*RC[1],0) -> 4660122067 | E195: 1 | G195: =SUM(R6C[-4]:RC[-4]) -> 126178734455 | H195: =SUM(R6C[-4]:RC[-4]) -> 126170082587
B196: 190 | C196: 4805832177 | D196: =ROUND(RC[-1]*RC[1],0) -> 4805832177 | E196: 1 | G196: =SUM(R6C[-4]:RC[-4]) -> 130984566632 | H196: =SUM(R6C[-4]:RC[-4]) -> 130975914764
B197: 191 | C197: 4955134600 | D197: =ROUND(RC[-1]*RC[1],0) -> 4955134600 | E197: 1 | G197: =SUM(R6C[-4]:RC[-4]) -> 135939701232 | H197: =SUM(R6C[-4]:RC[-4]) -> 135931049364
B198: 192 | C198: 5108094886 | D198: =ROUND(RC[-1]*RC[1],0) -> 5108094886 | E198: 1 | G198: =SUM(R6C[-4]:RC[-4]) -> 141047796118 | H198: =SUM(R6C[-4]:RC[-4]) -> 141039144250
B199: 193 | C199: 5264779373 | D199: =ROUND(RC[-1]*RC[1],0) -> 5264779373 | E199: 1 | G199: =SUM(R6C[-4]:RC[-4]) -> 146312575491 | H199: =SUM(R6C[-4]:RC[-4]) -> 146303923623
B200: 194 | C200: 5425255193 | D200: =ROUND(RC[-1]*RC[1],0) -> 5425255193 | E200: 1 | G200: =SUM(R6C[-4]:RC[-4]) -> 151737830684 | H200: =SUM(R6C[-4]:RC[-4]) -> 151729178816
B201: 195 | C201: 5589590271 | D201: =ROUND(RC[-1]*RC[1],0) -> 5589590271 | E201: 1 | G201: =SUM(R6C[-4]:RC[-4]) -> 157327420955 | H201: =SUM(R6C[-4]:RC[-4]) -> 157318769087
B202: 196 | C202: 5757853339 | D202: =ROUND(RC[-1]*RC[1],0) -> 5757853339 | E202: 1 | G202: =SUM(R6C[-4]:RC[-4]) -> 163085274294 | H202: =SUM(R6C[-4]:RC[-4]) -> 163076622426
B203: 197 | C203: 5930113932 | D203: =ROUND(RC[-1]*RC[1],0) -> 5930113932 | E203: 1 | G203: =SUM(R6C[-4]:RC[-4]) -> 169015388226 | H203: =SUM(R6C[-4]:RC[-4]) -> 169006736358
B204: 198 | C204: 6106442398 | D204: =ROUND(RC[-1]*RC[1],0) -> 6106442398 | E204: 1 | G204: =SUM(R6C[-4]:RC[-4]) -> 175121830624 | H204: =SUM(R6C[-4]:RC[-4]) -> 175113178756
B205: 199 | C205: 6286909898 | D205: =ROUND(RC[-1]*RC[1],0) -> 6286909898 | E205: 1 | G205: =SUM(R6C[-4]:RC[-4]) -> 181408740522 | H205: =SUM(R6C[-4]:RC[-4]) -> 181400088654
B206: 200 | C206: 6471588417 | D206: =ROUND(RC[-1]*RC[1],0) -> 6471588417 | E206: 1 | G206: =SUM(R6C[-4]:RC[-4]) -> 187880328939 | H206: =SUM(R6C[-4]:RC[-4]) -> 187871677071
B207: 201 | C207: 6660550764 | D207: =ROUND(RC[-1]*RC[1],0) -> 6660550764 | E207: 1 | G207: =SUM(R6C[-4]:RC[-4]) -> 194540879703 | H207: =SUM(R6C[-4]:RC[-4]) -> 194532227835
B208: 202 | C208: 6853870576 | D208: =ROUND(RC[-1]*RC[1],0) -> 6853870576 | E208: 1 | G208: =SUM(R6C[-4]:RC[-4]) -> 201394750279 | H208: =SUM(R6C[-4]:RC[-4]) -> 201386098411
B209: 203 | C209: 7051622328 | D209: =ROUND(RC[-1]*RC[1],0) -> 7051622328 | E209: 1 | G209: =SUM(R6C[-4]:RC[-4]) -> 208446372607 | H209: =SUM(R6C[-4]:RC[-4]) -> 208437720739
B210: 204 | C210: 7253881331 | D210: =ROUND(RC[-1]*RC[1],0) -> 7253881331 | E210: 1 | G210: =SUM(R6C[-4]:RC[-4]) -> 215700253938 | H210: =SUM(R6C[-4]:RC[-4]) -> 215691602070
B211: 205 | C211: 7460723741 | D211: =ROUND(RC[-1]*RC[1],0) -> 7460723741 | E211: 1 | G211: =SUM(R6C[-4]:RC[-4]) -> 223160977679 | H211: =SUM(R6C[-4]:RC[-4]) -> 223152325811
B212: 206 | C212: 7672226563 | D212: =ROUND(RC[-1]*RC[1],0) -> 7672226563 | E212: 1 | G212: =SUM(R6C[-4]:RC[-4]) -> 230833204242 | H212: =SUM(R6C[-4]:RC[-4]) -> 230824552374
B213: 207 | C213: 7888467657 | D213: =ROUND(RC[-1]*RC[1],0) -> 7888467657 | E213: 1 | G213: =SUM(R6C[-4]:RC[-4]) -> 238721671899 | H213: =SUM(R6C[-4]:RC[-4]) -> 238713020031
B214: 208 | C214: 8109525736 | D214: =ROUND(RC[-1]*RC[1],0) -> 8109525736 | E214: 1 | G214: =SUM(R6C[-4]:RC[-4]) -> 246831197635 | H214: =SUM(R6C[-4]:RC[-4]) -> 246822545767