Sheet: ctTianDiBaoWuConf
B1: 轮次 | C1: 1-仙侣召唤,2宠物召唤 | F1: 物品:1,物品ID,数量，权重; | G1: 奖励ID，奖励池对应的展示物品ID; 奖励ID有可能时装ID，有可能奖励池ID 例： 时装ID,展示物ID; 奖励池ID,展示物品ID; | M1: 2--非绑元宝 3--绑定元宝 230, --所有元宝(取数量,消耗可用,增加不可用) | O1: 客户端up物品ID列表 | P1: 道具ID,是否翻倍,翻的倍数(这个权重翻倍跟天官次福活动开启有关,活动ID为44) | Q1: 奖励池:2,奖池ID,抽取次数,权重,是否是特殊奖池 | R1: 场景ID，x坐标，y坐标; | S1: 活动图片 | T1: 展示的仙侣或宠物点击跳转（类型，id）填两组一左一右
A2: nIndex | B2: nSeq | C2: nType | D2: nNumTotal | E2: nInterval | F2: tShiZhuangIDList | G2: tViewItemList | H2: nItemID | I2: nOnceNum | J2: nTemNum | K2: nCostOnce | L2: nCostTen | M2: nCostCurrType | N2: nGetFuYuan | O2: tUpList | P2: tWeightDoubleProp | Q2: tAwardPoolID | R2: tPosList | S2: sActivityImg | T2: tShowInfo
A3: i | B3: i | C3: i | D3: i | E3: i | F3: t{iiii} | G3: t{iiiiiiiiiiii} | H3: i | I3: i | J3: i | K3: i | L3: i | M3: i | N3: i | O3: t{i} | P3: t{ibi} | Q3: t{iiiib} | R3: t{iii} | S3: s | T3: t{ii}
A4: 唯一索引 | B4: 序号 | C4: 抽奖类型 | D4: 总的宝箱数量 | E4: 刷新时间间隔（分钟） | F4: 本周特有时装ID列表 | G4: 展示物品ID列表 | H4: 开启消耗物品ID | I4: 开启一次消耗物品数量 | J4: 开启十次消耗物品数量 | K4: 开启一次消耗元宝 | L4: 开启十次消耗元宝 | M4: 消耗的元宝类型(也可以是其他类型) | N4: 开启获得的福缘值 | O4: 召唤活动翻倍的权重道具 | P4: 召唤活动翻倍的权重道具 | Q4: 奖品池列表 | R4: 坐标列表 | S4: 活动图片 | T4: 详情跳转
A5: 1 | B5: 1 | C5: 1 | D5: 2 | E5: 30 | F5: 1,50011,1,1 | G5: 50011,50012,50000,50001,50002,50003,50004,50005,50006,50007,50009,50008; | H5: 10014 | I5: 1 | J5: 9 | K5: =10*500 -> 5000 | L5: =RC[-1]*10*0.9 -> 45000 | M5: 230 | N5: 3 | O5: 13004;13104;13204; | P5: 13054,1,2;13154,1,2;13254,1,2; | Q5: 2,2101,1,1000,0;2,2102,1,1000,1; | R5: 1,400,990;1,1170,670; | S5: bg_shenshouhuodong | T5: 4,20011;4,20014;
A6: 2 | B6: 2 | C6: 1 | D6: 2 | E6: 30 | F6: 1,50011,1,1 | G6: 50013,50015,50000,50001,50002,50003,50004,50005,50006,50007,50009,50008; | H6: 10014 | I6: 1 | J6: 9 | K6: =10*500 -> 5000 | L6: =RC[-1]*10*0.9 -> 45000 | M6: 230 | N6: 3 | O6: 13005;13105;13205; | P6: 13055,1,2;13155,1,2;13255,1,2; | Q6: 2,2111,1,1000,0;2,2112,1,1000,1; | R6: 1,400,990;1,1170,670; | S6: bg_shenshouhuodong2 | T6: 4,20016;4,20015;
A7: 3 | B7: 1 | C7: 2 | D7: 2 | E7: 30 | F7: 1,50011,1,1 | G7: 50011,50012,50000,50001,50002,50003,50004,50005,50006,50007,50009,50008; | H7: 10100 | I7: 1 | J7: 9 | K7: =10*500 -> 5000 | L7: =RC[-1]*10*0.9 -> 45000 | M7: 230 | N7: 3 | O7: 13004;13104;13204; | P7: 13054,1,2;13154,1,2;13254,1,2; | Q7: 2,2201,1,1000,0;2,2202,1,1000,1; | R7: 1,400,990;1,1170,670; | S7: bg_shenshouhuodong3 | T7: 3,3103;3,3201;
A8: 4 | B8: 2 | C8: 2 | D8: 2 | E8: 30 | F8: 1,50011,1,1 | G8: 50013,50015,50000,50001,50002,50003,50004,50005,50006,50007,50009,50008; | H8: 10100 | I8: 1 | J8: 9 | K8: =10*500 -> 5000 | L8: =RC[-1]*10*0.9 -> 45000 | M8: 230 | N8: 3 | O8: 13005;13105;13205; | P8: 13055,1,2;13155,1,2;13255,1,2; | Q8: 2,2201,1,1000,0;2,2202,1,1000,1; | R8: 1,400,990;1,1170,670; | S8: bg_shenshouhuodong3 | T8: 3,3103;3,3201;