Sheet: ctPartnerStoneCollectConf
A2: nRewardID | B2: nColor | C2: nWeight | D2: nRewardNum
A3: i | B3: i | C3: i | D3: t{ii}
A4: 奖励ID | B4: 灵石颜色(1绿2蓝3紫4橙) | C4: 权重 | D4: 奖励数量最小值，最大值
A5: 1 | B5: 1 | C5: 25 | D5: 200,250;
A6: 2 | B6: 1 | C6: 35 | D6: 150,199;
A7: 3 | B7: 1 | C7: 40 | D7: 100,149;
A8: 4 | B8: =R[-3]C+1 -> 2 | C8: 20 | D8: 82,100;
A9: 5 | B9: =R[-3]C+1 -> 2 | C9: 30 | D9: 60,81;
A10: 6 | B10: =R[-3]C+1 -> 2 | C10: 50 | D10: 40,59;
A11: 7 | B11: =R[-3]C+1 -> 3 | C11: 10 | D11: 30,35;
A12: 8 | B12: =R[-3]C+1 -> 3 | C12: 25 | D12: 20,29;
A13: 9 | B13: =R[-3]C+1 -> 3 | C13: 65 | D13: 14,19;
A14: 10 | B14: =R[-3]C+1 -> 4 | C14: 7 | D14: 7,9;
A15: 11 | B15: =R[-3]C+1 -> 4 | C15: 30 | D15: 5,6;
A16: 12 | B16: =R[-3]C+1 -> 4 | C16: 63 | D16: 3,4;