Sheet: ctArenaRobotConf
A2: nID | B2: sName | C2: nRobotLv | D2: nFmt | E2: nFmtLv | F2: nRoleConfID | G2: nAttrConf | H2: nPetID | I2: nPetAttr | J2: tPartner
A3: i | B3: s | C3: i | D3: i | E3: i | F3: i | G3: i | H3: i | I3: i | J3: t{i}
A4: 机器人ID(1 - 9999之间) | B4: 名称 | C4: 机器人等级 | D4: 阵法ID | E4: 阵法等级 | F4: 对应的玩家配置ID | G4: 属性配置 | H4: 宠物 | I4: 宠物 | J4: 伙伴列表
A5: 1 | B5: 张三一 | C5: 25 | D5: 0 | E5: 0 | F5: 1 | G5: 108007 | H5: 3003 | I5: 107002 | J5: 20009;20001;20002;20003
A6: 2 | B6: 李谈莲 | C6: 25 | D6: 0 | E6: 0 | F6: 1 | G6: 108007 | H6: 3051 | I6: 107002 | J6: 20005;20007;20002;20003
A7: 3 | B7: 王五风 | C7: 25 | D7: 0 | E7: 0 | F7: 1 | G7: 108007 | H7: 3011 | I7: 107002 | J7: 20004;20001;20002;20003
A8: 4 | B8: 赵六一 | C8: 25 | D8: 0 | E8: 0 | F8: 1 | G8: 108007 | H8: 3051 | I8: 107002 | J8: 20004;20001;20002;20003
A9: 5 | B9: 钱七一 | C9: 25 | D9: 0 | E9: 0 | F9: 1 | G9: 108007 | H9: 3051 | I9: 107002 | J9: 20009;20001;20002;20003
A10: 6 | B10: 马美立 | C10: 25 | D10: 0 | E10: 0 | F10: 1 | G10: 108007 | H10: 3003 | I10: 107002 | J10: 20009;20001;20002;20003
A11: 7 | B11: 韩四山 | C11: =R[-6]C+4 -> 29 | D11: 0 | E11: 0 | F11: 1 | G11: 108007 | H11: 3051 | I11: 107002 | J11: 20004;20001;20002;20003
A12: 8 | B12: 黄大二 | C12: =R[-6]C+4 -> 29 | D12: 0 | E12: 0 | F12: 1 | G12: 108007 | H12: 3051 | I12: 107002 | J12: 20005;20007;20002;20003
A13: 9 | B13: 章环楚 | C13: =R[-6]C+4 -> 29 | D13: 0 | E13: 0 | F13: 1 | G13: 108007 | H13: 3051 | I13: 107002 | J13: 20004;20001;20002;20003
A14: 10 | B14: 梁七塔 | C14: =R[-5]C+6 -> 31 | D14: 0 | E14: 0 | F14: 1 | G14: 108007 | H14: 3051 | I14: 107002 | J14: 20004;20001;20002;20003
A15: 11 | B15: 孟三三 | C15: =R[-5]C+6 -> 31 | D15: 0 | E15: 0 | F15: 1 | G15: 108007 | H15: 3003 | I15: 107002 | J15: 20004;20001;20002;20003
A16: 12 | B16: 刘四三 | C16: =R[-5]C+6 -> 35 | D16: 0 | E16: 0 | F16: 1 | G16: 108007 | H16: 3003 | I16: 107002 | J16: 20009;20001;20002;20003
A17: 13 | B17: 冯五三 | C17: =R[-5]C+6 -> 35 | D17: 0 | E17: 0 | F17: 1 | G17: 108008 | H17: 3051 | I17: 107002 | J17: 20009;20001;20002;20003
A18: 14 | B18: 赵六三 | C18: =R[-5]C+6 -> 35 | D18: 0 | E18: 0 | F18: 1 | G18: 108008 | H18: 3051 | I18: 107002 | J18: 20004;20001;20002;20003
A19: 15 | B19: 勒七三 | C19: =R[-5]C+6 -> 37 | D19: 0 | E19: 0 | F19: 1 | G19: 108008 | H19: 3003 | I19: 107002 | J19: 20004;20001;20002;20003
A20: 16 | B20: 张三四 | C20: =R[-5]C+6 -> 37 | D20: 0 | E20: 0 | F20: 1 | G20: 108008 | H20: 3003 | I20: 107002 | J20: 20009;20001;20002;20003
A21: 17 | B21: 榜四剑 | C21: =R[-5]C+6 -> 41 | D21: 0 | E21: 0 | F21: 1 | G21: 108008 | H21: 3051 | I21: 107002 | J21: 20009;20001;20002;20003
A22: 18 | B22: 青五霸 | C22: =R[-5]C+6 -> 41 | D22: 0 | E22: 0 | F22: 1 | G22: 108008 | H22: 3051 | I22: 107002 | J22: 20009;20001;20002;20003
A23: 19 | B23: =LEFT(R[-18]C,1)&MID(R[-17]C,2,2) -> 张谈莲 | C23: =R[-5]C+6 -> 41 | D23: 0 | E23: 0 | F23: 1 | G23: 108008 | H23: 3051 | I23: 107002 | J23: 20004;20001;20002;20003
A24: 20 | B24: =LEFT(R[-18]C,1)&MID(R[-17]C,2,2) -> 李五风 | C24: =R[-5]C+6 -> 43 | D24: 0 | E24: 0 | F24: 1 | G24: 108008 | H24: 3051 | I24: 107002 | J24: 20004;20001;20002;20003
A25: 21 | B25: =LEFT(R[-18]C,1)&MID(R[-17]C,2,2) -> 王六一 | C25: =R[-5]C+6 -> 43 | D25: 0 | E25: 0 | F25: 1 | G25: 108007 | H25: 3003 | I25: 107002 | J25: 20004;20001;20002;20003
A26: 22 | B26: =LEFT(R[-18]C,1)&MID(R[-17]C,2,2) -> 赵七一 | C26: =R[-5]C+6 -> 47 | D26: 0 | E26: 0 | F26: 1 | G26: 108007 | H26: 3003 | I26: 107002 | J26: 20009;20001;20002;20003
A27: 23 | B27: =LEFT(R[-18]C,1)&MID(R[-17]C,2,2) -> 钱美立 | C27: =R[-5]C+6 -> 47 | D27: 0 | E27: 0 | F27: 1 | G27: 108007 | H27: 3003 | I27: 107002 | J27: 20004;20007;20002;20003
A28: 24 | B28: =LEFT(R[-18]C,1)&MID(R[-17]C,2,2) -> 马四山 | C28: =R[-5]C+6 -> 47 | D28: 0 | E28: 0 | F28: 1 | G28: 108007 | H28: 3051 | I28: 107002 | J28: 20009;20001;20002;20003
A29: 25 | B29: =LEFT(R[-18]C,1)&MID(R[-17]C,2,2) -> 韩大二 | C29: =R[-5]C+6 -> 49 | D29: 0 | E29: 0 | F29: 1 | G29: 108007 | H29: 3003 | I29: 107002 | J29: 20004;20007;20002;20003
A30: 26 | B30: =LEFT(R[-18]C,1)&MID(R[-17]C,2,2) -> 黄环楚 | C30: =R[-5]C+6 -> 49 | D30: 0 | E30: 0 | F30: 1 | G30: 108007 | H30: 3003 | I30: 107002 | J30: 20004;20007;20002;20003
A31: 27 | B31: =LEFT(R[-18]C,1)&MID(R[-17]C,2,2) -> 章七塔 | C31: =R[-5]C+6 -> 53 | D31: 0 | E31: 0 | F31: 1 | G31: 108007 | H31: 3051 | I31: 107002 | J31: 20009;20001;20002;20003
A32: 28 | B32: =LEFT(R[-18]C,1)&MID(R[-17]C,2,2) -> 梁三三 | C32: =R[-5]C+6 -> 53 | D32: 0 | E32: 0 | F32: 1 | G32: 108007 | H32: 3051 | I32: 107002 | J32: 20004;20007;20002;20003
A33: 29 | B33: =LEFT(R[-18]C,1)&MID(R[-17]C,2,2) -> 孟四三 | C33: =R[-5]C+6 -> 53 | D33: 0 | E33: 0 | F33: 1 | G33: 108007 | H33: 3051 | I33: 107002 | J33: 20004;20007;20002;20003
A34: 30 | B34: =LEFT(R[-18]C,1)&MID(R[-17]C,2,2) -> 刘五三 | C34: =R[-5]C+6 -> 55 | D34: 0 | E34: 0 | F34: 1 | G34: 108007 | H34: 3003 | I34: 107002 | J34: 20004;20007;20002;20003
A35: 31 | B35: =LEFT(R[-18]C,1)&MID(R[-17]C,2,2) -> 冯六三 | C35: =R[-5]C+6 -> 55 | D35: 0 | E35: 0 | F35: 1 | G35: 108007 | H35: 3003 | I35: 107002 | J35: 20009;20001;20002;20003
A36: 32 | B36: =LEFT(R[-18]C,1)&MID(R[-17]C,2,2) -> 赵七三 | C36: =R[-5]C+6 -> 59 | D36: 0 | E36: 0 | F36: 1 | G36: 108007 | H36: 3051 | I36: 107002 | J36: 20004;20007;20002;20003
A37: 33 | B37: =LEFT(R[-18]C,1)&MID(R[-17]C,2,2) -> 勒三四 | C37: =R[-5]C+6 -> 59 | D37: 0 | E37: 0 | F37: 1 | G37: 108008 | H37: 3051 | I37: 107002 | J37: 20004;20007;20002;20003
A38: 34 | B38: =LEFT(R[-18]C,1)&MID(R[-17]C,2,2) -> 张四剑 | C38: =R[-5]C+6 -> 59 | D38: 0 | E38: 0 | F38: 1 | G38: 108008 | H38: 3003 | I38: 107002 | J38: 20005;20007;20002;20003
A39: 35 | B39: =LEFT(R[-18]C,1)&MID(R[-17]C,2,2) -> 榜五霸 | C39: =R[-5]C+6 -> 61 | D39: 0 | E39: 0 | F39: 1 | G39: 108008 | H39: 3003 | I39: 107002 | J39: 20005;20007;20002;20003
A40: 36 | B40: =LEFT(R[-18]C,1)&MID(R[-17]C,2,2) -> 青谈莲 | C40: =R[-5]C+6 -> 61 | D40: 0 | E40: 0 | F40: 1 | G40: 108008 | H40: 3051 | I40: 107002 | J40: 20005;20007;20002;20003
A41: 37 | B41: =LEFT(R[-18]C,1)&MID(R[-17]C,2,2) -> 张五风 | C41: =R[-5]C+6 -> 65 | D41: 0 | E41: 0 | F41: 1 | G41: 108008 | H41: 3003 | I41: 107002 | J41: 20004;20007;20002;20003
A42: 38 | B42: =LEFT(R[-18]C,1)&MID(R[-17]C,2,2) -> 李六一 | C42: =R[-5]C+6 -> 65 | D42: 0 | E42: 0 | F42: 1 | G42: 108008 | H42: 3003 | I42: 107002 | J42: 20005;20007;20002;20003
A43: 39 | B43: =LEFT(R[-18]C,1)&MID(R[-17]C,2,2) -> 王七一 | C43: =R[-5]C+6 -> 65 | D43: 0 | E43: 0 | F43: 1 | G43: 108008 | H43: 3051 | I43: 107002 | J43: 20005;20007;20002;20003
A44: 40 | B44: =LEFT(R[-18]C,1)&MID(R[-17]C,2,2) -> 赵美立 | C44: =R[-5]C+8 -> 69 | D44: 0 | E44: 0 | F44: 1 | G44: 108008 | H44: 3051 | I44: 107002 | J44: 20005;20007;20002;20003
A45: 41 | B45: =LEFT(R[-18]C,1)&MID(R[-17]C,2,2) -> 钱四山 | C45: =R[-5]C+8 -> 69 | D45: 0 | E45: 0 | F45: 1 | G45: 108008 | H45: 3051 | I45: 107002 | J45: 20009;20001;20002;20003
A46: 42 | B46: =LEFT(R[-18]C,1)&MID(R[-17]C,2,2) -> 马大二 | C46: =R[-5]C+8 -> 73 | D46: 0 | E46: 0 | F46: 1 | G46: 108008 | H46: 3051 | I46: 107002 | J46: 20009;20001;20002;20003
A47: 43 | B47: =LEFT(R[-18]C,1)&MID(R[-17]C,2,2) -> 韩环楚 | C47: =R[-5]C+8 -> 73 | D47: 0 | E47: 0 | F47: 1 | G47: 108008 | H47: 3003 | I47: 107002 | J47: 20009;20001;20002;20003
A48: 44 | B48: =LEFT(R[-18]C,1)&MID(R[-17]C,2,2) -> 黄七塔 | C48: =R[-5]C+8 -> 73 | D48: 0 | E48: 0 | F48: 1 | G48: 108008 | H48: 3003 | I48: 107002 | J48: 20009;20001;20002;20003
A49: 45 | B49: =LEFT(R[-18]C,1)&MID(R[-17]C,2,2) -> 章三三 | C49: =R[-5]C+8 -> 77 | D49: 0 | E49: 0 | F49: 1 | G49: 108008 | H49: 3051 | I49: 107002 | J49: 20005;20007;20002;20003
A50: 46 | B50: =LEFT(R[-18]C,1)&MID(R[-17]C,2,2) -> 梁四三 | C50: =R[-5]C+8 -> 77 | D50: 0 | E50: 0 | F50: 1 | G50: 108008 | H50: 3003 | I50: 107002 | J50: 20004;20007;20002;20003
A51: 47 | B51: =LEFT(R[-18]C,1)&MID(R[-17]C,2,2) -> 孟五三 | C51: =R[-5]C+8 -> 81 | D51: 0 | E51: 0 | F51: 1 | G51: 108008 | H51: 3003 | I51: 107002 | J51: 20005;20007;20002;20003
A52: 48 | B52: =LEFT(R[-18]C,1)&MID(R[-17]C,2,2) -> 刘六三 | C52: =R[-5]C+8 -> 81 | D52: 0 | E52: 0 | F52: 1 | G52: 108008 | H52: 3051 | I52: 107002 | J52: 20009;20001;20002;20003
A53: 49 | B53: =LEFT(R[-18]C,1)&MID(R[-17]C,2,2) -> 冯七三 | C53: =R[-5]C+8 -> 81 | D53: 0 | E53: 0 | F53: 1 | G53: 108008 | H53: 3051 | I53: 107002 | J53: 20005;20007;20002;20003
A54: 50 | B54: =LEFT(R[-18]C,1)&MID(R[-17]C,2,2) -> 赵三四 | C54: =R[-5]C+8 -> 85 | D54: 0 | E54: 0 | F54: 1 | G54: 108008 | H54: 3051 | I54: 107002 | J54: 20005;20007;20002;20003
A55: 51 | B55: =LEFT(R[-18]C,1)&MID(R[-17]C,2,2) -> 勒四剑 | C55: =R[-5]C+8 -> 85 | D55: 0 | E55: 0 | F55: 1 | G55: 108008 | H55: 3051 | I55: 107002 | J55: 20005;20007;20002;20003
A56: 52 | B56: =LEFT(R[-18]C,1)&MID(R[-17]C,2,2) -> 张五霸 | C56: =R[-5]C+8 -> 89 | D56: 0 | E56: 0 | F56: 1 | G56: 108008 | H56: 3003 | I56: 107002 | J56: 20004;20007;20002;20003
A57: 53 | B57: =LEFT(R[-18]C,1)&MID(R[-17]C,2,2) -> 榜谈莲 | C57: =R[-5]C+8 -> 89 | D57: 0 | E57: 0 | F57: 1 | G57: 108008 | H57: 3003 | I57: 107002 | J57: 20005;20007;20002;20003
A58: 54 | B58: =LEFT(R[-18]C,1)&MID(R[-17]C,2,2) -> 青五风 | C58: =R[-5]C+8 -> 89 | D58: 0 | E58: 0 | F58: 1 | G58: 108008 | H58: 3051 | I58: 107002 | J58: 20005;20007;20002;20003
A59: 55 | B59: =LEFT(R[-18]C,1)&MID(R[-17]C,2,2) -> 张六一 | C59: =R[-5]C+8 -> 93 | D59: 0 | E59: 0 | F59: 1 | G59: 108008 | H59: 3051 | I59: 107002 | J59: 20009;20001;20002;20003
A60: 56 | B60: =LEFT(R[-18]C,1)&MID(R[-17]C,2,2) -> 李七一 | C60: =R[-5]C+8 -> 93 | D60: 0 | E60: 0 | F60: 1 | G60: 108008 | H60: 3003 | I60: 107002 | J60: 20009;20001;20002;20003
A61: 57 | B61: =LEFT(R[-18]C,1)&MID(R[-17]C,2,2) -> 王美立 | C61: =R[-5]C+8 -> 97 | D61: 0 | E61: 0 | F61: 1 | G61: 108008 | H61: 3003 | I61: 107002 | J61: 20005;20007;20002;20003
A62: 58 | B62: =LEFT(R[-18]C,1)&MID(R[-17]C,2,2) -> 赵四山 | C62: =R[-5]C+8 -> 97 | D62: 0 | E62: 0 | F62: 1 | G62: 108008 | H62: 3051 | I62: 107002 | J62: 20005;20007;20002;20003
A63: 59 | B63: =LEFT(R[-18]C,1)&MID(R[-17]C,2,2) -> 钱大二 | C63: =R[-5]C+8 -> 97 | D63: 0 | E63: 0 | F63: 1 | G63: 108008 | H63: 3003 | I63: 107002 | J63: 20004;20007;20002;20003
A64: 60 | B64: =LEFT(R[-18]C,1)&MID(R[-17]C,2,2) -> 马环楚 | C64: =R[-5]C+8 -> 101 | D64: 0 | E64: 0 | F64: 1 | G64: 108008 | H64: 3051 | I64: 107002 | J64: 20005;20007;20002;20003

Sheet: Sheet2
C3: 宠物编号 | D3: 宠物名称
C4: 3003 | D4: 大黄
C5: 3011 | D5: 天兵
C6: 3021 | D6: 冰雪蚌仙子
C7: 3032 | D7: 龙女
C8: 3041 | D8: 赤背斗魁
C9: 3051 | D9: 小灰
C10: 3063 | D10: 幼态火龙
C11: 3071 | D11: 冰灵宝宝
C12: 3073 | D12: 金化白狐
C13: 3091 | D13: 钛晶牛头
C14: 3081 | D14: 芙蓉仙女
C15: 3101 | D15: 吸血鬼
C16: 3061 | D16: 裟娜
C17: 3083 | D17: 御龙仙女
C18: 3002 | D18: 哮天犬
C19: 3103 | D19: 南疆圣女
C20: 3201 | D20: 赤瞳剑魔
C21: 3202 | D21: 花神君
C22: 3013 | D22: 帝之妖灵
C23: 3023 | D23: 斗战龙女
C24: 3031 | D24: 佑圣真君
C25: 3043 | D25: 冰灵兽女王
C26: 3053 | D26: 飞天火龙
C27: 3093 | D27: 神犬骑兵