Sheet: ctArenaSeasonConf
A2: nSeasonID | B2: tStartTime | C2: tEndTime
A3: i | B3: t{iiiiii} | C3: t{iiiiii}
A4: 竞技场赛季编号 | B4: 开始时间(年,月,日,时,分,秒) | C4: 结束时间
A5: 14 | B5: 2019,6,24,0,0,0 | C5: 2019,6,30,23,59,59
A6: 15 | B6: 2019,7,1,0,0,0 | C6: 2019,7,7,23,59,59
A7: 16 | B7: 2019,7,8,0,0,0 | C7: 2019,7,14,23,59,59
A8: 17 | B8: 2019,7,15,0,0,0 | C8: 2019,7,21,23,59,59
A9: 18 | B9: 2019,7,22,0,0,0 | C9: 2019,7,28,23,59,59
A10: 19 | B10: 2019,7,29,0,0,0 | C10: 2019,8,4,23,59,59
A11: 20 | B11: 2019,8,5,0,0,0 | C11: 2019,8,11,23,59,59
A12: 21 | B12: 2019,8,12,0,0,0 | C12: 2019,8,18,23,59,59
A13: 22 | B13: 2019,8,19,0,0,0 | C13: 2019,8,25,23,59,59
A14: 23 | B14: 2019,8,26,0,0,0 | C14: 2019,9,1,23,59,59
A15: 24 | B15: 2019,9,2,0,0,0 | C15: 2019,9,8,23,59,59
A16: 25 | B16: 2019,9,9,0,0,0 | C16: 2019,9,15,23,59,59
A17: 26 | B17: 2019,9,16,0,0,0 | C17: 2019,9,22,23,59,59
A18: 27 | B18: 2019,9,23,0,0,0 | C18: 2019,9,29,23,59,59
A19: 28 | B19: 2019,9,30,0,0,0 | C19: 2019,10,6,23,59,59
A20: 29 | B20: 2019,10,7,0,0,0 | C20: 2019,10,13,23,59,59
A21: 30 | B21: 2019,10,14,0,0,0 | C21: 2019,10,20,23,59,59
A22: 31 | B22: 2019,10,21,0,0,0 | C22: 2019,10,27,23,59,59
A23: 32 | B23: 2019,10,28,0,0,0 | C23: 2019,11,3,23,59,59
A24: 33 | B24: 2019,11,4,0,0,0 | C24: 2019,11,10,23,59,59
A25: 34 | B25: 2019,11,11,0,0,0 | C25: 2019,11,17,23,59,59
A26: 35 | B26: 2019,11,18,0,0,0 | C26: 2019,11,24,23,59,59
A27: 36 | B27: 2019,11,25,0,0,0 | C27: 2019,12,1,23,59,59
A28: 37 | B28: 2019,12,2,0,0,0 | C28: 2019,12,8,23,59,59
A29: 38 | B29: 2019,12,9,0,0,0 | C29: 2019,12,15,23,59,59
A30: 39 | B30: 2019,12,16,0,0,0 | C30: 2019,12,22,23,59,59
A31: 40 | B31: 2019,12,23,0,0,0 | C31: 2019,12,29,23,59,59
A32: 41 | B32: 2019,12,30,0,0,0 | C32: 2020,1,5,23,59,59
A33: 42 | B33: 2020,1,6,0,0,0 | C33: 2020,1,12,23,59,59
A34: 43 | B34: 2020,1,13,0,0,0 | C34: 2020,1,19,23,59,59
A35: 44 | B35: 2020,1,20,0,0,0 | C35: 2020,1,26,23,59,59
A36: 45 | B36: 2020,1,27,0,0,0 | C36: 2020,2,2,23,59,59
A37: 46 | B37: 2020,2,3,0,0,0 | C37: 2020,2,9,23,59,59
A38: 47 | B38: 2020,2,10,0,0,0 | C38: 2020,2,16,23,59,59
A39: 48 | B39: 2020,2,17,0,0,0 | C39: 2020,2,23,23,59,59
A40: 49 | B40: 2020,2,24,0,0,0 | C40: 2020,3,1,23,59,59
A41: 50 | B41: 2020,3,2,0,0,0 | C41: 2020,3,8,23,59,59
A42: 51 | B42: 2020,3,9,0,0,0 | C42: 2020,3,15,23,59,59
A43: 52 | B43: 2020,3,16,0,0,0 | C43: 2020,3,22,23,59,59
A44: 53 | B44: 2020,3,23,0,0,0 | C44: 2020,3,29,23,59,59
A45: 54 | B45: 2020,3,30,0,0,0 | C45: 2020,4,5,23,59,59
A46: 55 | B46: 2020,4,6,0,0,0 | C46: 2020,4,12,23,59,59
A47: 56 | B47: 2020,4,13,0,0,0 | C47: 2020,4,19,23,59,59
A48: 57 | B48: 2020,4,20,0,0,0 | C48: 2020,4,26,23,59,59
A49: 58 | B49: 2020,4,27,0,0,0 | C49: 2020,5,3,23,59,59
A50: 59 | B50: 2020,5,4,0,0,0 | C50: 2020,5,10,23,59,59
A51: 60 | B51: 2020,5,11,0,0,0 | C51: 2020,5,17,23,59,59
A52: 61 | B52: 2020,5,18,0,0,0 | C52: 2020,5,24,23,59,59
A53: 62 | B53: 2020,5,25,0,0,0 | C53: 2020,5,31,23,59,59
A54: 63 | B54: 2020,6,1,0,0,0 | C54: 2020,6,7,23,59,59
A55: 64 | B55: 2020,6,8,0,0,0 | C55: 2020,6,14,23,59,59
A56: 65 | B56: 2020,6,15,0,0,0 | C56: 2020,6,21,23,59,59
A57: 66 | B57: 2020,6,22,0,0,0 | C57: 2020,6,28,23,59,59
A58: 67 | B58: 2020,6,29,0,0,0 | C58: 2020,7,5,23,59,59
A59: 68 | B59: 2020,7,6,0,0,0 | C59: 2020,7,12,23,59,59
A60: 69 | B60: 2020,7,13,0,0,0 | C60: 2020,7,19,23,59,59
A61: 70 | B61: 2020,7,20,0,0,0 | C61: 2020,7,26,23,59,59
A62: 71 | B62: 2020,7,27,0,0,0 | C62: 2020,8,2,23,59,59
A63: 72 | B63: 2020,8,3,0,0,0 | C63: 2020,8,9,23,59,59
A64: 73 | B64: 2020,8,10,0,0,0 | C64: 2020,8,16,23,59,59
A65: 74 | B65: 2020,8,17,0,0,0 | C65: 2020,8,23,23,59,59
A66: 75 | B66: 2020,8,24,0,0,0 | C66: 2020,8,30,23,59,59
A67: 76 | B67: 2020,8,31,0,0,0 | C67: 2020,9,6,23,59,59
A68: 77 | B68: 2020,9,7,0,0,0 | C68: 2020,9,13,23,59,59
A69: 78 | B69: 2020,9,14,0,0,0 | C69: 2020,9,20,23,59,59
A70: 79 | B70: 2020,9,21,0,0,0 | C70: 2020,9,27,23,59,59
A71: 80 | B71: 2020,9,28,0,0,0 | C71: 2020,10,4,23,59,59
A72: 81 | B72: 2020,10,5,0,0,0 | C72: 2020,10,11,23,59,59
A73: 82 | B73: 2020,10,12,0,0,0 | C73: 2020,10,18,23,59,59
A74: 83 | B74: 2020,10,19,0,0,0 | C74: 2020,10,25,23,59,59
A75: 84 | B75: 2020,10,26,0,0,0 | C75: 2020,11,1,23,59,59
A76: 85 | B76: 2020,11,2,0,0,0 | C76: 2020,11,8,23,59,59
A77: 86 | B77: 2020,11,9,0,0,0 | C77: 2020,11,15,23,59,59
A78: 87 | B78: 2020,11,16,0,0,0 | C78: 2020,11,22,23,59,59
A79: 88 | B79: 2020,11,23,0,0,0 | C79: 2020,11,29,23,59,59
A80: 89 | B80: 2020,11,30,0,0,0 | C80: 2020,12,6,23,59,59
A81: 90 | B81: 2020,12,7,0,0,0 | C81: 2020,12,13,23,59,59
A82: 91 | B82: 2020,12,14,0,0,0 | C82: 2020,12,20,23,59,59
A83: 92 | B83: 2020,12,21,0,0,0 | C83: 2020,12,27,23,59,59
A84: 93 | B84: 2020,12,28,0,0,0 | C84: 2021,1,3,23,59,59
A85: 94 | B85: 2021,1,4,0,0,0 | C85: 2021,1,10,23,59,59
A86: 95 | B86: 2021,1,11,0,0,0 | C86: 2021,1,17,23,59,59
A87: 96 | B87: 2021,1,18,0,0,0 | C87: 2021,1,24,23,59,59
A88: 97 | B88: 2021,1,25,0,0,0 | C88: 2021,1,31,23,59,59
A89: 98 | B89: 2021,2,1,0,0,0 | C89: 2021,2,7,23,59,59
A90: 99 | B90: 2021,2,8,0,0,0 | C90: 2021,2,14,23,59,59
A91: 100 | B91: 2021,2,15,0,0,0 | C91: 2021,2,21,23,59,59

Sheet: Sheet2
S1: ,
W3: 开始时间(年,月,日,时,分,秒) | X3: 结束时间
B4: 开始时间(年,月,日,时,分,秒) | C4: 结束时间 | W4: 2019,6,21,0,0,0 | X4: 2019,7,20,23,59,59
B5: 2019,6,21,0,0,0 | C5: 2019,7,20,23,59,59 | E5: 年 | F5: 月 | H5: 天数
B6: 2019,7,21,0,0,0 | C6: 2019,8,20,23,59,59 | E6: 2019 | F6: 1 | G6: =RC[-2]&RC[-1] -> 20191 | H6: 31 | K6: 2019 | L6: 6 | M6: =RC[-2]&RC[-1] -> 20196 | N6: 10 | P6: 2019 | Q6: 6 | R6: =RC[-2]&RC[-1] -> 20196 | S6: 16 | U6: 1 | W6: =RC[-12]&R1C19&RC[-11]&R1C19&RC[-9]&",0,0,0" -> 2019,6,10,0,0,0 | X6: =RC[-8]&R1C19&RC[-7]&R1C19&RC[-5]&",23,59,59" -> 2019,6,16,23,59,59
B7: 2019,8,21,0,0,0 | C7: 2019,9,20,23,59,59 | E7: 2019 | F7: 2 | G7: =RC[-2]&RC[-1] -> 20192 | H7: 28 | K7: =IF(AND(RC[1]=1,RC[3]=1),R[-1]C[5]+1,R[-1]C[5]) -> 2019 | L7: =IF(RC[2]=1,IF((R[-1]C[5]+1)<13,(R[-1]C[5]+1),(1)),R[-1]C[5]) -> 6 | M7: =RC[-2]&RC[-1] -> 20196 | N7: =IF((R[-1]C[5]+1)<=VLOOKUP(R[-1]C[4],C7:C8,2,FALSE),(R[-1]C[5]+1),1) -> 17 | P7: =IF(AND(RC[1]=1,RC[3]<7),RC[-5]+1,RC[-5]) -> 2019 | Q7: =IF(RC[2]<7,IF((RC[-5]+1)<13,(RC[-5]+1),(1)),RC[-5]) -> 6 | R7: =RC[-2]&RC[-1] -> 20196 | S7: =IF((RC[-5]+6)<=VLOOKUP(RC[-6],C7:C8,2,FALSE),(RC[-5]+6),(RC[-5]+6)-VLOOKUP(RC[-6],C7:C8,2,FALSE)) -> 23 | U7: 2 | W7: =RC[-12]&R1C19&RC[-11]&R1C19&RC[-9]&",0,0,0" -> 2019,6,17,0,0,0 | X7: =RC[-8]&R1C19&RC[-7]&R1C19&RC[-5]&",23,59,59" -> 2019,6,23,23,59,59
B8: 2019,9,21,0,0,0 | C8: 2019,10,20,23,59,59 | E8: 2019 | F8: 3 | G8: =RC[-2]&RC[-1] -> 20193 | H8: 31 | K8: =IF(AND(RC[1]=1,RC[3]=1),R[-1]C[5]+1,R[-1]C[5]) -> 2019 | L8: =IF(RC[2]=1,IF((R[-1]C[5]+1)<13,(R[-1]C[5]+1),(1)),R[-1]C[5]) -> 6 | M8: =RC[-2]&RC[-1] -> 20196 | N8: =IF((R[-1]C[5]+1)<=VLOOKUP(R[-1]C[4],C7:C8,2,FALSE),(R[-1]C[5]+1),1) -> 24 | P8: =IF(AND(RC[1]=1,RC[3]<7),RC[-5]+1,RC[-5]) -> 2019 | Q8: =IF(RC[2]<7,IF((RC[-5]+1)<13,(RC[-5]+1),(1)),RC[-5]) -> 6 | R8: =RC[-2]&RC[-1] -> 20196 | S8: =IF((RC[-5]+6)<=VLOOKUP(RC[-6],C7:C8,2,FALSE),(RC[-5]+6),(RC[-5]+6)-VLOOKUP(RC[-6],C7:C8,2,FALSE)) -> 30 | U8: 3 | W8: =RC[-12]&R1C19&RC[-11]&R1C19&RC[-9]&",0,0,0" -> 2019,6,24,0,0,0 | X8: =RC[-8]&R1C19&RC[-7]&R1C19&RC[-5]&",23,59,59" -> 2019,6,30,23,59,59
B9: 2019,10,21,0,0,0 | C9: 2019,11,20,23,59,59 | E9: 2019 | F9: 4 | G9: =RC[-2]&RC[-1] -> 20194 | H9: 30 | K9: =IF(AND(RC[1]=1,RC[3]=1),R[-1]C[5]+1,R[-1]C[5]) -> 2019 | L9: =IF(RC[2]=1,IF((R[-1]C[5]+1)<13,(R[-1]C[5]+1),(1)),R[-1]C[5]) -> 7 | M9: =RC[-2]&RC[-1] -> 20197 | N9: =IF((R[-1]C[5]+1)<=VLOOKUP(R[-1]C[4],C7:C8,2,FALSE),(R[-1]C[5]+1),1) -> 1 | P9: =IF(AND(RC[1]=1,RC[3]<7),RC[-5]+1,RC[-5]) -> 2019 | Q9: =IF(RC[2]<7,IF((RC[-5]+1)<13,(RC[-5]+1),(1)),RC[-5]) -> 7 | R9: =RC[-2]&RC[-1] -> 20197 | S9: =IF((RC[-5]+6)<=VLOOKUP(RC[-6],C7:C8,2,FALSE),(RC[-5]+6),(RC[-5]+6)-VLOOKUP(RC[-6],C7:C8,2,FALSE)) -> 7 | U9: 4 | W9: =RC[-12]&R1C19&RC[-11]&R1C19&RC[-9]&",0,0,0" -> 2019,7,1,0,0,0 | X9: =RC[-8]&R1C19&RC[-7]&R1C19&RC[-5]&",23,59,59" -> 2019,7,7,23,59,59
B10: 2019,11,21,0,0,0 | C10: 2019,12,20,23,59,59 | E10: 2019 | F10: 5 | G10: =RC[-2]&RC[-1] -> 20195 | H10: 31 | K10: =IF(AND(RC[1]=1,RC[3]=1),R[-1]C[5]+1,R[-1]C[5]) -> 2019 | L10: =IF(RC[2]=1,IF((R[-1]C[5]+1)<13,(R[-1]C[5]+1),(1)),R[-1]C[5]) -> 7 | M10: =RC[-2]&RC[-1] -> 20197 | N10: =IF((R[-1]C[5]+1)<=VLOOKUP(R[-1]C[4],C7:C8,2,FALSE),(R[-1]C[5]+1),1) -> 8 | P10: =IF(AND(RC[1]=1,RC[3]<7),RC[-5]+1,RC[-5]) -> 2019 | Q10: =IF(RC[2]<7,IF((RC[-5]+1)<13,(RC[-5]+1),(1)),RC[-5]) -> 7 | R10: =RC[-2]&RC[-1] -> 20197 | S10: =IF((RC[-5]+6)<=VLOOKUP(RC[-6],C7:C8,2,FALSE),(RC[-5]+6),(RC[-5]+6)-VLOOKUP(RC[-6],C7:C8,2,FALSE)) -> 14 | U10: 5 | W10: =RC[-12]&R1C19&RC[-11]&R1C19&RC[-9]&",0,0,0" -> 2019,7,8,0,0,0 | X10: =RC[-8]&R1C19&RC[-7]&R1C19&RC[-5]&",23,59,59" -> 2019,7,14,23,59,59
B11: 2019,12,21,0,0,0 | C11: 2020,1,20,23,59,59 | E11: 2019 | F11: 6 | G11: =RC[-2]&RC[-1] -> 20196 | H11: 30 | K11: =IF(AND(RC[1]=1,RC[3]=1),R[-1]C[5]+1,R[-1]C[5]) -> 2019 | L11: =IF(RC[2]=1,IF((R[-1]C[5]+1)<13,(R[-1]C[5]+1),(1)),R[-1]C[5]) -> 7 | M11: =RC[-2]&RC[-1] -> 20197 | N11: =IF((R[-1]C[5]+1)<=VLOOKUP(R[-1]C[4],C7:C8,2,FALSE),(R[-1]C[5]+1),1) -> 15 | P11: =IF(AND(RC[1]=1,RC[3]<7),RC[-5]+1,RC[-5]) -> 2019 | Q11: =IF(RC[2]<7,IF((RC[-5]+1)<13,(RC[-5]+1),(1)),RC[-5]) -> 7 | R11: =RC[-2]&RC[-1] -> 20197 | S11: =IF((RC[-5]+6)<=VLOOKUP(RC[-6],C7:C8,2,FALSE),(RC[-5]+6),(RC[-5]+6)-VLOOKUP(RC[-6],C7:C8,2,FALSE)) -> 21 | U11: 6 | W11: =RC[-12]&R1C19&RC[-11]&R1C19&RC[-9]&",0,0,0" -> 2019,7,15,0,0,0 | X11: =RC[-8]&R1C19&RC[-7]&R1C19&RC[-5]&",23,59,59" -> 2019,7,21,23,59,59
B12: 2020,1,21,0,0,0 | C12: 2020,2,20,23,59,59 | E12: 2019 | F12: 7 | G12: =RC[-2]&RC[-1] -> 20197 | H12: 31 | K12: =IF(AND(RC[1]=1,RC[3]=1),R[-1]C[5]+1,R[-1]C[5]) -> 2019 | L12: =IF(RC[2]=1,IF((R[-1]C[5]+1)<13,(R[-1]C[5]+1),(1)),R[-1]C[5]) -> 7 | M12: =RC[-2]&RC[-1] -> 20197 | N12: =IF((R[-1]C[5]+1)<=VLOOKUP(R[-1]C[4],C7:C8,2,FALSE),(R[-1]C[5]+1),1) -> 22 | P12: =IF(AND(RC[1]=1,RC[3]<7),RC[-5]+1,RC[-5]) -> 2019 | Q12: =IF(RC[2]<7,IF((RC[-5]+1)<13,(RC[-5]+1),(1)),RC[-5]) -> 7 | R12: =RC[-2]&RC[-1] -> 20197 | S12: =IF((RC[-5]+6)<=VLOOKUP(RC[-6],C7:C8,2,FALSE),(RC[-5]+6),(RC[-5]+6)-VLOOKUP(RC[-6],C7:C8,2,FALSE)) -> 28 | U12: 7 | W12: =RC[-12]&R1C19&RC[-11]&R1C19&RC[-9]&",0,0,0" -> 2019,7,22,0,0,0 | X12: =RC[-8]&R1C19&RC[-7]&R1C19&RC[-5]&",23,59,59" -> 2019,7,28,23,59,59
B13: 2020,2,21,0,0,0 | C13: 2020,3,20,23,59,59 | E13: 2019 | F13: 8 | G13: =RC[-2]&RC[-1] -> 20198 | H13: 31 | K13: =IF(AND(RC[1]=1,RC[3]=1),R[-1]C[5]+1,R[-1]C[5]) -> 2019 | L13: =IF(RC[2]=1,IF((R[-1]C[5]+1)<13,(R[-1]C[5]+1),(1)),R[-1]C[5]) -> 7 | M13: =RC[-2]&RC[-1] -> 20197 | N13: =IF((R[-1]C[5]+1)<=VLOOKUP(R[-1]C[4],C7:C8,2,FALSE),(R[-1]C[5]+1),1) -> 29 | P13: =IF(AND(RC[1]=1,RC[3]<7),RC[-5]+1,RC[-5]) -> 2019 | Q13: =IF(RC[2]<7,IF((RC[-5]+1)<13,(RC[-5]+1),(1)),RC[-5]) -> 8 | R13: =RC[-2]&RC[-1] -> 20198 | S13: =IF((RC[-5]+6)<=VLOOKUP(RC[-6],C7:C8,2,FALSE),(RC[-5]+6),(RC[-5]+6)-VLOOKUP(RC[-6],C7:C8,2,FALSE)) -> 4 | U13: 8 | W13: =RC[-12]&R1C19&RC[-11]&R1C19&RC[-9]&",0,0,0" -> 2019,7,29,0,0,0 | X13: =RC[-8]&R1C19&RC[-7]&R1C19&RC[-5]&",23,59,59" -> 2019,8,4,23,59,59
B14: 2020,3,21,0,0,0 | C14: 2020,4,20,23,59,59 | E14: 2019 | F14: 9 | G14: =RC[-2]&RC[-1] -> 20199 | H14: 30 | K14: =IF(AND(RC[1]=1,RC[3]=1),R[-1]C[5]+1,R[-1]C[5]) -> 2019 | L14: =IF(RC[2]=1,IF((R[-1]C[5]+1)<13,(R[-1]C[5]+1),(1)),R[-1]C[5]) -> 8 | M14: =RC[-2]&RC[-1] -> 20198 | N14: =IF((R[-1]C[5]+1)<=VLOOKUP(R[-1]C[4],C7:C8,2,FALSE),(R[-1]C[5]+1),1) -> 5 | P14: =IF(AND(RC[1]=1,RC[3]<7),RC[-5]+1,RC[-5]) -> 2019 | Q14: =IF(RC[2]<7,IF((RC[-5]+1)<13,(RC[-5]+1),(1)),RC[-5]) -> 8 | R14: =RC[-2]&RC[-1] -> 20198 | S14: =IF((RC[-5]+6)<=VLOOKUP(RC[-6],C7:C8,2,FALSE),(RC[-5]+6),(RC[-5]+6)-VLOOKUP(RC[-6],C7:C8,2,FALSE)) -> 11 | U14: 9 | W14: =RC[-12]&R1C19&RC[-11]&R1C19&RC[-9]&",0,0,0" -> 2019,8,5,0,0,0 | X14: =RC[-8]&R1C19&RC[-7]&R1C19&RC[-5]&",23,59,59" -> 2019,8,11,23,59,59
B15: 2020,4,21,0,0,0 | C15: 2020,5,20,23,59,59 | E15: 2019 | F15: 10 | G15: =RC[-2]&RC[-1] -> 201910 | H15: 31 | K15: =IF(AND(RC[1]=1,RC[3]=1),R[-1]C[5]+1,R[-1]C[5]) -> 2019 | L15: =IF(RC[2]=1,IF((R[-1]C[5]+1)<13,(R[-1]C[5]+1),(1)),R[-1]C[5]) -> 8 | M15: =RC[-2]&RC[-1] -> 20198 | N15: =IF((R[-1]C[5]+1)<=VLOOKUP(R[-1]C[4],C7:C8,2,FALSE),(R[-1]C[5]+1),1) -> 12 | P15: =IF(AND(RC[1]=1,RC[3]<7),RC[-5]+1,RC[-5]) -> 2019 | Q15: =IF(RC[2]<7,IF((RC[-5]+1)<13,(RC[-5]+1),(1)),RC[-5]) -> 8 | R15: =RC[-2]&RC[-1] -> 20198 | S15: =IF((RC[-5]+6)<=VLOOKUP(RC[-6],C7:C8,2,FALSE),(RC[-5]+6),(RC[-5]+6)-VLOOKUP(RC[-6],C7:C8,2,FALSE)) -> 18 | U15: 10 | W15: =RC[-12]&R1C19&RC[-11]&R1C19&RC[-9]&",0,0,0" -> 2019,8,12,0,0,0 | X15: =RC[-8]&R1C19&RC[-7]&R1C19&RC[-5]&",23,59,59" -> 2019,8,18,23,59,59
B16: 2020,5,21,0,0,0 | C16: 2020,6,20,23,59,59 | E16: 2019 | F16: 11 | G16: =RC[-2]&RC[-1] -> 201911 | H16: 30 | K16: =IF(AND(RC[1]=1,RC[3]=1),R[-1]C[5]+1,R[-1]C[5]) -> 2019 | L16: =IF(RC[2]=1,IF((R[-1]C[5]+1)<13,(R[-1]C[5]+1),(1)),R[-1]C[5]) -> 8 | M16: =RC[-2]&RC[-1] -> 20198 | N16: =IF((R[-1]C[5]+1)<=VLOOKUP(R[-1]C[4],C7:C8,2,FALSE),(R[-1]C[5]+1),1) -> 19 | P16: =IF(AND(RC[1]=1,RC[3]<7),RC[-5]+1,RC[-5]) -> 2019 | Q16: =IF(RC[2]<7,IF((RC[-5]+1)<13,(RC[-5]+1),(1)),RC[-5]) -> 8 | R16: =RC[-2]&RC[-1] -> 20198 | S16: =IF((RC[-5]+6)<=VLOOKUP(RC[-6],C7:C8,2,FALSE),(RC[-5]+6),(RC[-5]+6)-VLOOKUP(RC[-6],C7:C8,2,FALSE)) -> 25 | U16: 11 | W16: =RC[-12]&R1C19&RC[-11]&R1C19&RC[-9]&",0,0,0" -> 2019,8,19,0,0,0 | X16: =RC[-8]&R1C19&RC[-7]&R1C19&RC[-5]&",23,59,59" -> 2019,8,25,23,59,59
B17: 2020,6,21,0,0,0 | C17: 2020,7,20,23,59,59 | E17: 2019 | F17: 12 | G17: =RC[-2]&RC[-1] -> 201912 | H17: 31 | K17: =IF(AND(RC[1]=1,RC[3]=1),R[-1]C[5]+1,R[-1]C[5]) -> 2019 | L17: =IF(RC[2]=1,IF((R[-1]C[5]+1)<13,(R[-1]C[5]+1),(1)),R[-1]C[5]) -> 8 | M17: =RC[-2]&RC[-1] -> 20198 | N17: =IF((R[-1]C[5]+1)<=VLOOKUP(R[-1]C[4],C7:C8,2,FALSE),(R[-1]C[5]+1),1) -> 26 | P17: =IF(AND(RC[1]=1,RC[3]<7),RC[-5]+1,RC[-5]) -> 2019 | Q17: =IF(RC[2]<7,IF((RC[-5]+1)<13,(RC[-5]+1),(1)),RC[-5]) -> 9 | R17: =RC[-2]&RC[-1] -> 20199 | S17: =IF((RC[-5]+6)<=VLOOKUP(RC[-6],C7:C8,2,FALSE),(RC[-5]+6),(RC[-5]+6)-VLOOKUP(RC[-6],C7:C8,2,FALSE)) -> 1 | U17: 12 | W17: =RC[-12]&R1C19&RC[-11]&R1C19&RC[-9]&",0,0,0" -> 2019,8,26,0,0,0 | X17: =RC[-8]&R1C19&RC[-7]&R1C19&RC[-5]&",23,59,59" -> 2019,9,1,23,59,59
B18: 2020,7,21,0,0,0 | C18: 2020,8,20,23,59,59 | E18: =R[-12]C+1 -> 2020 | F18: =R[-12]C -> 1 | G18: =RC[-2]&RC[-1] -> 20201 | H18: 31 | K18: =IF(AND(RC[1]=1,RC[3]=1),R[-1]C[5]+1,R[-1]C[5]) -> 2019 | L18: =IF(RC[2]=1,IF((R[-1]C[5]+1)<13,(R[-1]C[5]+1),(1)),R[-1]C[5]) -> 9 | M18: =RC[-2]&RC[-1] -> 20199 | N18: =IF((R[-1]C[5]+1)<=VLOOKUP(R[-1]C[4],C7:C8,2,FALSE),(R[-1]C[5]+1),1) -> 2 | P18: =IF(AND(RC[1]=1,RC[3]<7),RC[-5]+1,RC[-5]) -> 2019 | Q18: =IF(RC[2]<7,IF((RC[-5]+1)<13,(RC[-5]+1),(1)),RC[-5]) -> 9 | R18: =RC[-2]&RC[-1] -> 20199 | S18: =IF((RC[-5]+6)<=VLOOKUP(RC[-6],C7:C8,2,FALSE),(RC[-5]+6),(RC[-5]+6)-VLOOKUP(RC[-6],C7:C8,2,FALSE)) -> 8 | U18: 13 | W18: =RC[-12]&R1C19&RC[-11]&R1C19&RC[-9]&",0,0,0" -> 2019,9,2,0,0,0 | X18: =RC[-8]&R1C19&RC[-7]&R1C19&RC[-5]&",23,59,59" -> 2019,9,8,23,59,59
B19: 2020,8,21,0,0,0 | C19: 2020,9,20,23,59,59 | E19: =R[-12]C+1 -> 2020 | F19: =R[-12]C -> 2 | G19: =RC[-2]&RC[-1] -> 20202 | H19: 29 | K19: =IF(AND(RC[1]=1,RC[3]=1),R[-1]C[5]+1,R[-1]C[5]) -> 2019 | L19: =IF(RC[2]=1,IF((R[-1]C[5]+1)<13,(R[-1]C[5]+1),(1)),R[-1]C[5]) -> 9 | M19: =RC[-2]&RC[-1] -> 20199 | N19: =IF((R[-1]C[5]+1)<=VLOOKUP(R[-1]C[4],C7:C8,2,FALSE),(R[-1]C[5]+1),1) -> 9 | P19: =IF(AND(RC[1]=1,RC[3]<7),RC[-5]+1,RC[-5]) -> 2019 | Q19: =IF(RC[2]<7,IF((RC[-5]+1)<13,(RC[-5]+1),(1)),RC[-5]) -> 9 | R19: =RC[-2]&RC[-1] -> 20199 | S19: =IF((RC[-5]+6)<=VLOOKUP(RC[-6],C7:C8,2,FALSE),(RC[-5]+6),(RC[-5]+6)-VLOOKUP(RC[-6],C7:C8,2,FALSE)) -> 15 | U19: 14 | W19: =RC[-12]&R1C19&RC[-11]&R1C19&RC[-9]&",0,0,0" -> 2019,9,9,0,0,0 | X19: =RC[-8]&R1C19&RC[-7]&R1C19&RC[-5]&",23,59,59" -> 2019,9,15,23,59,59
B20: 2020,9,21,0,0,0 | C20: 2020,10,20,23,59,59 | E20: =R[-12]C+1 -> 2020 | F20: =R[-12]C -> 3 | G20: =RC[-2]&RC[-1] -> 20203 | H20: 31 | K20: =IF(AND(RC[1]=1,RC[3]=1),R[-1]C[5]+1,R[-1]C[5]) -> 2019 | L20: =IF(RC[2]=1,IF((R[-1]C[5]+1)<13,(R[-1]C[5]+1),(1)),R[-1]C[5]) -> 9 | M20: =RC[-2]&RC[-1] -> 20199 | N20: =IF((R[-1]C[5]+1)<=VLOOKUP(R[-1]C[4],C7:C8,2,FALSE),(R[-1]C[5]+1),1) -> 16 | P20: =IF(AND(RC[1]=1,RC[3]<7),RC[-5]+1,RC[-5]) -> 2019 | Q20: =IF(RC[2]<7,IF((RC[-5]+1)<13,(RC[-5]+1),(1)),RC[-5]) -> 9 | R20: =RC[-2]&RC[-1] -> 20199 | S20: =IF((RC[-5]+6)<=VLOOKUP(RC[-6],C7:C8,2,FALSE),(RC[-5]+6),(RC[-5]+6)-VLOOKUP(RC[-6],C7:C8,2,FALSE)) -> 22 | U20: 15 | W20: =RC[-12]&R1C19&RC[-11]&R1C19&RC[-9]&",0,0,0" -> 2019,9,16,0,0,0 | X20: =RC[-8]&R1C19&RC[-7]&R1C19&RC[-5]&",23,59,59" -> 2019,9,22,23,59,59
B21: 2020,10,21,0,0,0 | C21: 2020,11,20,23,59,59 | E21: =R[-12]C+1 -> 2020 | F21: =R[-12]C -> 4 | G21: =RC[-2]&RC[-1] -> 20204 | H21: 30 | K21: =IF(AND(RC[1]=1,RC[3]=1),R[-1]C[5]+1,R[-1]C[5]) -> 2019 | L21: =IF(RC[2]=1,IF((R[-1]C[5]+1)<13,(R[-1]C[5]+1),(1)),R[-1]C[5]) -> 9 | M21: =RC[-2]&RC[-1] -> 20199 | N21: =IF((R[-1]C[5]+1)<=VLOOKUP(R[-1]C[4],C7:C8,2,FALSE),(R[-1]C[5]+1),1) -> 23 | P21: =IF(AND(RC[1]=1,RC[3]<7),RC[-5]+1,RC[-5]) -> 2019 | Q21: =IF(RC[2]<7,IF((RC[-5]+1)<13,(RC[-5]+1),(1)),RC[-5]) -> 9 | R21: =RC[-2]&RC[-1] -> 20199 | S21: =IF((RC[-5]+6)<=VLOOKUP(RC[-6],C7:C8,2,FALSE),(RC[-5]+6),(RC[-5]+6)-VLOOKUP(RC[-6],C7:C8,2,FALSE)) -> 29 | U21: 16 | W21: =RC[-12]&R1C19&RC[-11]&R1C19&RC[-9]&",0,0,0" -> 2019,9,23,0,0,0 | X21: =RC[-8]&R1C19&RC[-7]&R1C19&RC[-5]&",23,59,59" -> 2019,9,29,23,59,59
B22: 2020,11,21,0,0,0 | C22: 2020,12,20,23,59,59 | E22: =R[-12]C+1 -> 2020 | F22: =R[-12]C -> 5 | G22: =RC[-2]&RC[-1] -> 20205 | H22: 31 | K22: =IF(AND(RC[1]=1,RC[3]=1),R[-1]C[5]+1,R[-1]C[5]) -> 2019 | L22: =IF(RC[2]=1,IF((R[-1]C[5]+1)<13,(R[-1]C[5]+1),(1)),R[-1]C[5]) -> 9 | M22: =RC[-2]&RC[-1] -> 20199 | N22: =IF((R[-1]C[5]+1)<=VLOOKUP(R[-1]C[4],C7:C8,2,FALSE),(R[-1]C[5]+1),1) -> 30 | P22: =IF(AND(RC[1]=1,RC[3]<7),RC[-5]+1,RC[-5]) -> 2019 | Q22: =IF(RC[2]<7,IF((RC[-5]+1)<13,(RC[-5]+1),(1)),RC[-5]) -> 10 | R22: =RC[-2]&RC[-1] -> 201910 | S22: =IF((RC[-5]+6)<=VLOOKUP(RC[-6],C7:C8,2,FALSE),(RC[-5]+6),(RC[-5]+6)-VLOOKUP(RC[-6],C7:C8,2,FALSE)) -> 6 | U22: 17 | W22: =RC[-12]&R1C19&RC[-11]&R1C19&RC[-9]&",0,0,0" -> 2019,9,30,0,0,0 | X22: =RC[-8]&R1C19&RC[-7]&R1C19&RC[-5]&",23,59,59" -> 2019,10,6,23,59,59
B23: 2020,12,21,0,0,0 | C23: 2021,1,20,23,59,59 | E23: =R[-12]C+1 -> 2020 | F23: =R[-12]C -> 6 | G23: =RC[-2]&RC[-1] -> 20206 | H23: 30 | K23: =IF(AND(RC[1]=1,RC[3]=1),R[-1]C[5]+1,R[-1]C[5]) -> 2019 | L23: =IF(RC[2]=1,IF((R[-1]C[5]+1)<13,(R[-1]C[5]+1),(1)),R[-1]C[5]) -> 10 | M23: =RC[-2]&RC[-1] -> 201910 | N23: =IF((R[-1]C[5]+1)<=VLOOKUP(R[-1]C[4],C7:C8,2,FALSE),(R[-1]C[5]+1),1) -> 7 | P23: =IF(AND(RC[1]=1,RC[3]<7),RC[-5]+1,RC[-5]) -> 2019 | Q23: =IF(RC[2]<7,IF((RC[-5]+1)<13,(RC[-5]+1),(1)),RC[-5]) -> 10 | R23: =RC[-2]&RC[-1] -> 201910 | S23: =IF((RC[-5]+6)<=VLOOKUP(RC[-6],C7:C8,2,FALSE),(RC[-5]+6),(RC[-5]+6)-VLOOKUP(RC[-6],C7:C8,2,FALSE)) -> 13 | U23: 18 | W23: =RC[-12]&R1C19&RC[-11]&R1C19&RC[-9]&",0,0,0" -> 2019,10,7,0,0,0 | X23: =RC[-8]&R1C19&RC[-7]&R1C19&RC[-5]&",23,59,59" -> 2019,10,13,23,59,59
B24: 2021,1,21,0,0,0 | C24: 2021,2,20,23,59,59 | E24: =R[-12]C+1 -> 2020 | F24: =R[-12]C -> 7 | G24: =RC[-2]&RC[-1] -> 20207 | H24: 31 | K24: =IF(AND(RC[1]=1,RC[3]=1),R[-1]C[5]+1,R[-1]C[5]) -> 2019 | L24: =IF(RC[2]=1,IF((R[-1]C[5]+1)<13,(R[-1]C[5]+1),(1)),R[-1]C[5]) -> 10 | M24: =RC[-2]&RC[-1] -> 201910 | N24: =IF((R[-1]C[5]+1)<=VLOOKUP(R[-1]C[4],C7:C8,2,FALSE),(R[-1]C[5]+1),1) -> 14 | P24: =IF(AND(RC[1]=1,RC[3]<7),RC[-5]+1,RC[-5]) -> 2019 | Q24: =IF(RC[2]<7,IF((RC[-5]+1)<13,(RC[-5]+1),(1)),RC[-5]) -> 10 | R24: =RC[-2]&RC[-1] -> 201910 | S24: =IF((RC[-5]+6)<=VLOOKUP(RC[-6],C7:C8,2,FALSE),(RC[-5]+6),(RC[-5]+6)-VLOOKUP(RC[-6],C7:C8,2,FALSE)) -> 20 | U24: 19 | W24: =RC[-12]&R1C19&RC[-11]&R1C19&RC[-9]&",0,0,0" -> 2019,10,14,0,0,0 | X24: =RC[-8]&R1C19&RC[-7]&R1C19&RC[-5]&",23,59,59" -> 2019,10,20,23,59,59
B25: 2021,2,21,0,0,0 | C25: 2021,3,20,23,59,59 | E25: =R[-12]C+1 -> 2020 | F25: =R[-12]C -> 8 | G25: =RC[-2]&RC[-1] -> 20208 | H25: 31 | K25: =IF(AND(RC[1]=1,RC[3]=1),R[-1]C[5]+1,R[-1]C[5]) -> 2019 | L25: =IF(RC[2]=1,IF((R[-1]C[5]+1)<13,(R[-1]C[5]+1),(1)),R[-1]C[5]) -> 10 | M25: =RC[-2]&RC[-1] -> 201910 | N25: =IF((R[-1]C[5]+1)<=VLOOKUP(R[-1]C[4],C7:C8,2,FALSE),(R[-1]C[5]+1),1) -> 21 | P25: =IF(AND(RC[1]=1,RC[3]<7),RC[-5]+1,RC[-5]) -> 2019 | Q25: =IF(RC[2]<7,IF((RC[-5]+1)<13,(RC[-5]+1),(1)),RC[-5]) -> 10 | R25: =RC[-2]&RC[-1] -> 201910 | S25: =IF((RC[-5]+6)<=VLOOKUP(RC[-6],C7:C8,2,FALSE),(RC[-5]+6),(RC[-5]+6)-VLOOKUP(RC[-6],C7:C8,2,FALSE)) -> 27 | U25: 20 | W25: =RC[-12]&R1C19&RC[-11]&R1C19&RC[-9]&",0,0,0" -> 2019,10,21,0,0,0 | X25: =RC[-8]&R1C19&RC[-7]&R1C19&RC[-5]&",23,59,59" -> 2019,10,27,23,59,59
B26: 2021,3,21,0,0,0 | C26: 2021,4,20,23,59,59 | E26: =R[-12]C+1 -> 2020 | F26: =R[-12]C -> 9 | G26: =RC[-2]&RC[-1] -> 20209 | H26: 30 | K26: =IF(AND(RC[1]=1,RC[3]=1),R[-1]C[5]+1,R[-1]C[5]) -> 2019 | L26: =IF(RC[2]=1,IF((R[-1]C[5]+1)<13,(R[-1]C[5]+1),(1)),R[-1]C[5]) -> 10 | M26: =RC[-2]&RC[-1] -> 201910 | N26: =IF((R[-1]C[5]+1)<=VLOOKUP(R[-1]C[4],C7:C8,2,FALSE),(R[-1]C[5]+1),1) -> 28 | P26: =IF(AND(RC[1]=1,RC[3]<7),RC[-5]+1,RC[-5]) -> 2019 | Q26: =IF(RC[2]<7,IF((RC[-5]+1)<13,(RC[-5]+1),(1)),RC[-5]) -> 11 | R26: =RC[-2]&RC[-1] -> 201911 | S26: =IF((RC[-5]+6)<=VLOOKUP(RC[-6],C7:C8,2,FALSE),(RC[-5]+6),(RC[-5]+6)-VLOOKUP(RC[-6],C7:C8,2,FALSE)) -> 3 | U26: 21 | W26: =RC[-12]&R1C19&RC[-11]&R1C19&RC[-9]&",0,0,0" -> 2019,10,28,0,0,0 | X26: =RC[-8]&R1C19&RC[-7]&R1C19&RC[-5]&",23,59,59" -> 2019,11,3,23,59,59
B27: 2021,4,21,0,0,0 | C27: 2021,5,20,23,59,59 | E27: =R[-12]C+1 -> 2020 | F27: =R[-12]C -> 10 | G27: =RC[-2]&RC[-1] -> 202010 | H27: 31 | K27: =IF(AND(RC[1]=1,RC[3]=1),R[-1]C[5]+1,R[-1]C[5]) -> 2019 | L27: =IF(RC[2]=1,IF((R[-1]C[5]+1)<13,(R[-1]C[5]+1),(1)),R[-1]C[5]) -> 11 | M27: =RC[-2]&RC[-1] -> 201911 | N27: =IF((R[-1]C[5]+1)<=VLOOKUP(R[-1]C[4],C7:C8,2,FALSE),(R[-1]C[5]+1),1) -> 4 | P27: =IF(AND(RC[1]=1,RC[3]<7),RC[-5]+1,RC[-5]) -> 2019 | Q27: =IF(RC[2]<7,IF((RC[-5]+1)<13,(RC[-5]+1),(1)),RC[-5]) -> 11 | R27: =RC[-2]&RC[-1] -> 201911 | S27: =IF((RC[-5]+6)<=VLOOKUP(RC[-6],C7:C8,2,FALSE),(RC[-5]+6),(RC[-5]+6)-VLOOKUP(RC[-6],C7:C8,2,FALSE)) -> 10 | U27: 22 | W27: =RC[-12]&R1C19&RC[-11]&R1C19&RC[-9]&",0,0,0" -> 2019,11,4,0,0,0 | X27: =RC[-8]&R1C19&RC[-7]&R1C19&RC[-5]&",23,59,59" -> 2019,11,10,23,59,59
B28: 2021,5,21,0,0,0 | C28: 2021,6,20,23,59,59 | E28: =R[-12]C+1 -> 2020 | F28: =R[-12]C -> 11 | G28: =RC[-2]&RC[-1] -> 202011 | H28: 30 | K28: =IF(AND(RC[1]=1,RC[3]=1),R[-1]C[5]+1,R[-1]C[5]) -> 2019 | L28: =IF(RC[2]=1,IF((R[-1]C[5]+1)<13,(R[-1]C[5]+1),(1)),R[-1]C[5]) -> 11 | M28: =RC[-2]&RC[-1] -> 201911 | N28: =IF((R[-1]C[5]+1)<=VLOOKUP(R[-1]C[4],C7:C8,2,FALSE),(R[-1]C[5]+1),1) -> 11 | P28: =IF(AND(RC[1]=1,RC[3]<7),RC[-5]+1,RC[-5]) -> 2019 | Q28: =IF(RC[2]<7,IF((RC[-5]+1)<13,(RC[-5]+1),(1)),RC[-5]) -> 11 | R28: =RC[-2]&RC[-1] -> 201911 | S28: =IF((RC[-5]+6)<=VLOOKUP(RC[-6],C7:C8,2,FALSE),(RC[-5]+6),(RC[-5]+6)-VLOOKUP(RC[-6],C7:C8,2,FALSE)) -> 17 | U28: 23 | W28: =RC[-12]&R1C19&RC[-11]&R1C19&RC[-9]&",0,0,0" -> 2019,11,11,0,0,0 | X28: =RC[-8]&R1C19&RC[-7]&R1C19&RC[-5]&",23,59,59" -> 2019,11,17,23,59,59
B29: 2021,6,21,0,0,0 | C29: 2021,7,20,23,59,59 | E29: =R[-12]C+1 -> 2020 | F29: =R[-12]C -> 12 | G29: =RC[-2]&RC[-1] -> 202012 | H29: 31 | K29: =IF(AND(RC[1]=1,RC[3]=1),R[-1]C[5]+1,R[-1]C[5]) -> 2019 | L29: =IF(RC[2]=1,IF((R[-1]C[5]+1)<13,(R[-1]C[5]+1),(1)),R[-1]C[5]) -> 11 | M29: =RC[-2]&RC[-1] -> 201911 | N29: =IF((R[-1]C[5]+1)<=VLOOKUP(R[-1]C[4],C7:C8,2,FALSE),(R[-1]C[5]+1),1) -> 18 | P29: =IF(AND(RC[1]=1,RC[3]<7),RC[-5]+1,RC[-5]) -> 2019 | Q29: =IF(RC[2]<7,IF((RC[-5]+1)<13,(RC[-5]+1),(1)),RC[-5]) -> 11 | R29: =RC[-2]&RC[-1] -> 201911 | S29: =IF((RC[-5]+6)<=VLOOKUP(RC[-6],C7:C8,2,FALSE),(RC[-5]+6),(RC[-5]+6)-VLOOKUP(RC[-6],C7:C8,2,FALSE)) -> 24 | U29: 24 | W29: =RC[-12]&R1C19&RC[-11]&R1C19&RC[-9]&",0,0,0" -> 2019,11,18,0,0,0 | X29: =RC[-8]&R1C19&RC[-7]&R1C19&RC[-5]&",23,59,59" -> 2019,11,24,23,59,59
B30: 2021,7,21,0,0,0 | C30: 2021,8,20,23,59,59 | E30: =R[-12]C+1 -> 2021 | F30: =R[-12]C -> 1 | G30: =RC[-2]&RC[-1] -> 20211 | H30: 31 | K30: =IF(AND(RC[1]=1,RC[3]=1),R[-1]C[5]+1,R[-1]C[5]) -> 2019 | L30: =IF(RC[2]=1,IF((R[-1]C[5]+1)<13,(R[-1]C[5]+1),(1)),R[-1]C[5]) -> 11 | M30: =RC[-2]&RC[-1] -> 201911 | N30: =IF((R[-1]C[5]+1)<=VLOOKUP(R[-1]C[4],C7:C8,2,FALSE),(R[-1]C[5]+1),1) -> 25 | P30: =IF(AND(RC[1]=1,RC[3]<7),RC[-5]+1,RC[-5]) -> 2019 | Q30: =IF(RC[2]<7,IF((RC[-5]+1)<13,(RC[-5]+1),(1)),RC[-5]) -> 12 | R30: =RC[-2]&RC[-1] -> 201912 | S30: =IF((RC[-5]+6)<=VLOOKUP(RC[-6],C7:C8,2,FALSE),(RC[-5]+6),(RC[-5]+6)-VLOOKUP(RC[-6],C7:C8,2,FALSE)) -> 1 | U30: 25 | W30: =RC[-12]&R1C19&RC[-11]&R1C19&RC[-9]&",0,0,0" -> 2019,11,25,0,0,0 | X30: =RC[-8]&R1C19&RC[-7]&R1C19&RC[-5]&",23,59,59" -> 2019,12,1,23,59,59
B31: 2021,8,21,0,0,0 | C31: 2021,9,20,23,59,59 | E31: =R[-12]C+1 -> 2021 | F31: =R[-12]C -> 2 | G31: =RC[-2]&RC[-1] -> 20212 | H31: 28 | K31: =IF(AND(RC[1]=1,RC[3]=1),R[-1]C[5]+1,R[-1]C[5]) -> 2019 | L31: =IF(RC[2]=1,IF((R[-1]C[5]+1)<13,(R[-1]C[5]+1),(1)),R[-1]C[5]) -> 12 | M31: =RC[-2]&RC[-1] -> 201912 | N31: =IF((R[-1]C[5]+1)<=VLOOKUP(R[-1]C[4],C7:C8,2,FALSE),(R[-1]C[5]+1),1) -> 2 | P31: =IF(AND(RC[1]=1,RC[3]<7),RC[-5]+1,RC[-5]) -> 2019 | Q31: =IF(RC[2]<7,IF((RC[-5]+1)<13,(RC[-5]+1),(1)),RC[-5]) -> 12 | R31: =RC[-2]&RC[-1] -> 201912 | S31: =IF((RC[-5]+6)<=VLOOKUP(RC[-6],C7:C8,2,FALSE),(RC[-5]+6),(RC[-5]+6)-VLOOKUP(RC[-6],C7:C8,2,FALSE)) -> 8 | U31: 26 | W31: =RC[-12]&R1C19&RC[-11]&R1C19&RC[-9]&",0,0,0" -> 2019,12,2,0,0,0 | X31: =RC[-8]&R1C19&RC[-7]&R1C19&RC[-5]&",23,59,59" -> 2019,12,8,23,59,59
B32: 2021,9,21,0,0,0 | C32: 2021,10,20,23,59,59 | E32: =R[-12]C+1 -> 2021 | F32: =R[-12]C -> 3 | G32: =RC[-2]&RC[-1] -> 20213 | H32: 31 | K32: =IF(AND(RC[1]=1,RC[3]=1),R[-1]C[5]+1,R[-1]C[5]) -> 2019 | L32: =IF(RC[2]=1,IF((R[-1]C[5]+1)<13,(R[-1]C[5]+1),(1)),R[-1]C[5]) -> 12 | M32: =RC[-2]&RC[-1] -> 201912 | N32: =IF((R[-1]C[5]+1)<=VLOOKUP(R[-1]C[4],C7:C8,2,FALSE),(R[-1]C[5]+1),1) -> 9 | P32: =IF(AND(RC[1]=1,RC[3]<7),RC[-5]+1,RC[-5]) -> 2019 | Q32: =IF(RC[2]<7,IF((RC[-5]+1)<13,(RC[-5]+1),(1)),RC[-5]) -> 12 | R32: =RC[-2]&RC[-1] -> 201912 | S32: =IF((RC[-5]+6)<=VLOOKUP(RC[-6],C7:C8,2,FALSE),(RC[-5]+6),(RC[-5]+6)-VLOOKUP(RC[-6],C7:C8,2,FALSE)) -> 15 | U32: 27 | W32: =RC[-12]&R1C19&RC[-11]&R1C19&RC[-9]&",0,0,0" -> 2019,12,9,0,0,0 | X32: =RC[-8]&R1C19&RC[-7]&R1C19&RC[-5]&",23,59,59" -> 2019,12,15,23,59,59
B33: 2021,10,21,0,0,0 | C33: 2021,11,20,23,59,59 | E33: =R[-12]C+1 -> 2021 | F33: =R[-12]C -> 4 | G33: =RC[-2]&RC[-1] -> 20214 | H33: 30 | K33: =IF(AND(RC[1]=1,RC[3]=1),R[-1]C[5]+1,R[-1]C[5]) -> 2019 | L33: =IF(RC[2]=1,IF((R[-1]C[5]+1)<13,(R[-1]C[5]+1),(1)),R[-1]C[5]) -> 12 | M33: =RC[-2]&RC[-1] -> 201912 | N33: =IF((R[-1]C[5]+1)<=VLOOKUP(R[-1]C[4],C7:C8,2,FALSE),(R[-1]C[5]+1),1) -> 16 | P33: =IF(AND(RC[1]=1,RC[3]<7),RC[-5]+1,RC[-5]) -> 2019 | Q33: =IF(RC[2]<7,IF((RC[-5]+1)<13,(RC[-5]+1),(1)),RC[-5]) -> 12 | R33: =RC[-2]&RC[-1] -> 201912 | S33: =IF((RC[-5]+6)<=VLOOKUP(RC[-6],C7:C8,2,FALSE),(RC[-5]+6),(RC[-5]+6)-VLOOKUP(RC[-6],C7:C8,2,FALSE)) -> 22 | U33: 28 | W33: =RC[-12]&R1C19&RC[-11]&R1C19&RC[-9]&",0,0,0" -> 2019,12,16,0,0,0 | X33: =RC[-8]&R1C19&RC[-7]&R1C19&RC[-5]&",23,59,59" -> 2019,12,22,23,59,59
B34: 2021,11,21,0,0,0 | C34: 2021,12,20,23,59,59 | E34: =R[-12]C+1 -> 2021 | F34: =R[-12]C -> 5 | G34: =RC[-2]&RC[-1] -> 20215 | H34: 31 | K34: =IF(AND(RC[1]=1,RC[3]=1),R[-1]C[5]+1,R[-1]C[5]) -> 2019 | L34: =IF(RC[2]=1,IF((R[-1]C[5]+1)<13,(R[-1]C[5]+1),(1)),R[-1]C[5]) -> 12 | M34: =RC[-2]&RC[-1] -> 201912 | N34: =IF((R[-1]C[5]+1)<=VLOOKUP(R[-1]C[4],C7:C8,2,FALSE),(R[-1]C[5]+1),1) -> 23 | P34: =IF(AND(RC[1]=1,RC[3]<7),RC[-5]+1,RC[-5]) -> 2019 | Q34: =IF(RC[2]<7,IF((RC[-5]+1)<13,(RC[-5]+1),(1)),RC[-5]) -> 12 | R34: =RC[-2]&RC[-1] -> 201912 | S34: =IF((RC[-5]+6)<=VLOOKUP(RC[-6],C7:C8,2,FALSE),(RC[-5]+6),(RC[-5]+6)-VLOOKUP(RC[-6],C7:C8,2,FALSE)) -> 29 | U34: 29 | W34: =RC[-12]&R1C19&RC[-11]&R1C19&RC[-9]&",0,0,0" -> 2019,12,23,0,0,0 | X34: =RC[-8]&R1C19&RC[-7]&R1C19&RC[-5]&",23,59,59" -> 2019,12,29,23,59,59
B35: 2021,12,21,0,0,0 | C35: 2022,1,20,23,59,59 | E35: =R[-12]C+1 -> 2021 | F35: =R[-12]C -> 6 | G35: =RC[-2]&RC[-1] -> 20216 | H35: 30 | K35: =IF(AND(RC[1]=1,RC[3]=1),R[-1]C[5]+1,R[-1]C[5]) -> 2019 | L35: =IF(RC[2]=1,IF((R[-1]C[5]+1)<13,(R[-1]C[5]+1),(1)),R[-1]C[5]) -> 12 | M35: =RC[-2]&RC[-1] -> 201912 | N35: =IF((R[-1]C[5]+1)<=VLOOKUP(R[-1]C[4],C7:C8,2,FALSE),(R[-1]C[5]+1),1) -> 30 | P35: =IF(AND(RC[1]=1,RC[3]<7),RC[-5]+1,RC[-5]) -> 2020 | Q35: =IF(RC[2]<7,IF((RC[-5]+1)<13,(RC[-5]+1),(1)),RC[-5]) -> 1 | R35: =RC[-2]&RC[-1] -> 20201 | S35: =IF((RC[-5]+6)<=VLOOKUP(RC[-6],C7:C8,2,FALSE),(RC[-5]+6),(RC[-5]+6)-VLOOKUP(RC[-6],C7:C8,2,FALSE)) -> 5 | U35: 30 | W35: =RC[-12]&R1C19&RC[-11]&R1C19&RC[-9]&",0,0,0" -> 2019,12,30,0,0,0 | X35: =RC[-8]&R1C19&RC[-7]&R1C19&RC[-5]&",23,59,59" -> 2020,1,5,23,59,59
B36: 2022,1,21,0,0,0 | C36: 2022,2,20,23,59,59 | E36: =R[-12]C+1 -> 2021 | F36: =R[-12]C -> 7 | G36: =RC[-2]&RC[-1] -> 20217 | H36: 31 | K36: =IF(AND(RC[1]=1,RC[3]=1),R[-1]C[5]+1,R[-1]C[5]) -> 2020 | L36: =IF(RC[2]=1,IF((R[-1]C[5]+1)<13,(R[-1]C[5]+1),(1)),R[-1]C[5]) -> 1 | M36: =RC[-2]&RC[-1] -> 20201 | N36: =IF((R[-1]C[5]+1)<=VLOOKUP(R[-1]C[4],C7:C8,2,FALSE),(R[-1]C[5]+1),1) -> 6 | P36: =IF(AND(RC[1]=1,RC[3]<7),RC[-5]+1,RC[-5]) -> 2020 | Q36: =IF(RC[2]<7,IF((RC[-5]+1)<13,(RC[-5]+1),(1)),RC[-5]) -> 1 | R36: =RC[-2]&RC[-1] -> 20201 | S36: =IF((RC[-5]+6)<=VLOOKUP(RC[-6],C7:C8,2,FALSE),(RC[-5]+6),(RC[-5]+6)-VLOOKUP(RC[-6],C7:C8,2,FALSE)) -> 12 | U36: 31 | W36: =RC[-12]&R1C19&RC[-11]&R1C19&RC[-9]&",0,0,0" -> 2020,1,6,0,0,0 | X36: =RC[-8]&R1C19&RC[-7]&R1C19&RC[-5]&",23,59,59" -> 2020,1,12,23,59,59
B37: 2022,2,21,0,0,0 | C37: 2022,3,20,23,59,59 | E37: =R[-12]C+1 -> 2021 | F37: =R[-12]C -> 8 | G37: =RC[-2]&RC[-1] -> 20218 | H37: 31 | K37: =IF(AND(RC[1]=1,RC[3]=1),R[-1]C[5]+1,R[-1]C[5]) -> 2020 | L37: =IF(RC[2]=1,IF((R[-1]C[5]+1)<13,(R[-1]C[5]+1),(1)),R[-1]C[5]) -> 1 | M37: =RC[-2]&RC[-1] -> 20201 | N37: =IF((R[-1]C[5]+1)<=VLOOKUP(R[-1]C[4],C7:C8,2,FALSE),(R[-1]C[5]+1),1) -> 13 | P37: =IF(AND(RC[1]=1,RC[3]<7),RC[-5]+1,RC[-5]) -> 2020 | Q37: =IF(RC[2]<7,IF((RC[-5]+1)<13,(RC[-5]+1),(1)),RC[-5]) -> 1 | R37: =RC[-2]&RC[-1] -> 20201 | S37: =IF((RC[-5]+6)<=VLOOKUP(RC[-6],C7:C8,2,FALSE),(RC[-5]+6),(RC[-5]+6)-VLOOKUP(RC[-6],C7:C8,2,FALSE)) -> 19 | U37: 32 | W37: =RC[-12]&R1C19&RC[-11]&R1C19&RC[-9]&",0,0,0" -> 2020,1,13,0,0,0 | X37: =RC[-8]&R1C19&RC[-7]&R1C19&RC[-5]&",23,59,59" -> 2020,1,19,23,59,59
B38: 2022,3,21,0,0,0 | C38: 2022,4,20,23,59,59 | E38: =R[-12]C+1 -> 2021 | F38: =R[-12]C -> 9 | G38: =RC[-2]&RC[-1] -> 20219 | H38: 30 | K38: =IF(AND(RC[1]=1,RC[3]=1),R[-1]C[5]+1,R[-1]C[5]) -> 2020 | L38: =IF(RC[2]=1,IF((R[-1]C[5]+1)<13,(R[-1]C[5]+1),(1)),R[-1]C[5]) -> 1 | M38: =RC[-2]&RC[-1] -> 20201 | N38: =IF((R[-1]C[5]+1)<=VLOOKUP(R[-1]C[4],C7:C8,2,FALSE),(R[-1]C[5]+1),1) -> 20 | P38: =IF(AND(RC[1]=1,RC[3]<7),RC[-5]+1,RC[-5]) -> 2020 | Q38: =IF(RC[2]<7,IF((RC[-5]+1)<13,(RC[-5]+1),(1)),RC[-5]) -> 1 | R38: =RC[-2]&RC[-1] -> 20201 | S38: =IF((RC[-5]+6)<=VLOOKUP(RC[-6],C7:C8,2,FALSE),(RC[-5]+6),(RC[-5]+6)-VLOOKUP(RC[-6],C7:C8,2,FALSE)) -> 26 | U38: 33 | W38: =RC[-12]&R1C19&RC[-11]&R1C19&RC[-9]&",0,0,0" -> 2020,1,20,0,0,0 | X38: =RC[-8]&R1C19&RC[-7]&R1C19&RC[-5]&",23,59,59" -> 2020,1,26,23,59,59
B39: 2022,4,21,0,0,0 | C39: 2022,5,20,23,59,59 | E39: =R[-12]C+1 -> 2021 | F39: =R[-12]C -> 10 | G39: =RC[-2]&RC[-1] -> 202110 | H39: 31 | K39: =IF(AND(RC[1]=1,RC[3]=1),R[-1]C[5]+1,R[-1]C[5]) -> 2020 | L39: =IF(RC[2]=1,IF((R[-1]C[5]+1)<13,(R[-1]C[5]+1),(1)),R[-1]C[5]) -> 1 | M39: =RC[-2]&RC[-1] -> 20201 | N39: =IF((R[-1]C[5]+1)<=VLOOKUP(R[-1]C[4],C7:C8,2,FALSE),(R[-1]C[5]+1),1) -> 27 | P39: =IF(AND(RC[1]=1,RC[3]<7),RC[-5]+1,RC[-5]) -> 2020 | Q39: =IF(RC[2]<7,IF((RC[-5]+1)<13,(RC[-5]+1),(1)),RC[-5]) -> 2 | R39: =RC[-2]&RC[-1] -> 20202 | S39: =IF((RC[-5]+6)<=VLOOKUP(RC[-6],C7:C8,2,FALSE),(RC[-5]+6),(RC[-5]+6)-VLOOKUP(RC[-6],C7:C8,2,FALSE)) -> 2 | U39: 34 | W39: =RC[-12]&R1C19&RC[-11]&R1C19&RC[-9]&",0,0,0" -> 2020,1,27,0,0,0 | X39: =RC[-8]&R1C19&RC[-7]&R1C19&RC[-5]&",23,59,59" -> 2020,2,2,23,59,59
B40: 2022,5,21,0,0,0 | C40: 2022,6,20,23,59,59 | E40: =R[-12]C+1 -> 2021 | F40: =R[-12]C -> 11 | G40: =RC[-2]&RC[-1] -> 202111 | H40: 30 | K40: =IF(AND(RC[1]=1,RC[3]=1),R[-1]C[5]+1,R[-1]C[5]) -> 2020 | L40: =IF(RC[2]=1,IF((R[-1]C[5]+1)<13,(R[-1]C[5]+1),(1)),R[-1]C[5]) -> 2 | M40: =RC[-2]&RC[-1] -> 20202 | N40: =IF((R[-1]C[5]+1)<=VLOOKUP(R[-1]C[4],C7:C8,2,FALSE),(R[-1]C[5]+1),1) -> 3 | P40: =IF(AND(RC[1]=1,RC[3]<7),RC[-5]+1,RC[-5]) -> 2020 | Q40: =IF(RC[2]<7,IF((RC[-5]+1)<13,(RC[-5]+1),(1)),RC[-5]) -> 2 | R40: =RC[-2]&RC[-1] -> 20202 | S40: =IF((RC[-5]+6)<=VLOOKUP(RC[-6],C7:C8,2,FALSE),(RC[-5]+6),(RC[-5]+6)-VLOOKUP(RC[-6],C7:C8,2,FALSE)) -> 9 | U40: 35 | W40: =RC[-12]&R1C19&RC[-11]&R1C19&RC[-9]&",0,0,0" -> 2020,2,3,0,0,0 | X40: =RC[-8]&R1C19&RC[-7]&R1C19&RC[-5]&",23,59,59" -> 2020,2,9,23,59,59
B41: 2022,6,21,0,0,0 | C41: 2022,7,20,23,59,59 | E41: =R[-12]C+1 -> 2021 | F41: =R[-12]C -> 12 | G41: =RC[-2]&RC[-1] -> 202112 | H41: 31 | K41: =IF(AND(RC[1]=1,RC[3]=1),R[-1]C[5]+1,R[-1]C[5]) -> 2020 | L41: =IF(RC[2]=1,IF((R[-1]C[5]+1)<13,(R[-1]C[5]+1),(1)),R[-1]C[5]) -> 2 | M41: =RC[-2]&RC[-1] -> 20202 | N41: =IF((R[-1]C[5]+1)<=VLOOKUP(R[-1]C[4],C7:C8,2,FALSE),(R[-1]C[5]+1),1) -> 10 | P41: =IF(AND(RC[1]=1,RC[3]<7),RC[-5]+1,RC[-5]) -> 2020 | Q41: =IF(RC[2]<7,IF((RC[-5]+1)<13,(RC[-5]+1),(1)),RC[-5]) -> 2 | R41: =RC[-2]&RC[-1] -> 20202 | S41: =IF((RC[-5]+6)<=VLOOKUP(RC[-6],C7:C8,2,FALSE),(RC[-5]+6),(RC[-5]+6)-VLOOKUP(RC[-6],C7:C8,2,FALSE)) -> 16 | U41: 36 | W41: =RC[-12]&R1C19&RC[-11]&R1C19&RC[-9]&",0,0,0" -> 2020,2,10,0,0,0 | X41: =RC[-8]&R1C19&RC[-7]&R1C19&RC[-5]&",23,59,59" -> 2020,2,16,23,59,59
B42: 2022,7,21,0,0,0 | C42: 2022,8,20,23,59,59 | E42: =R[-12]C+1 -> 2022 | F42: =R[-12]C -> 1 | G42: =RC[-2]&RC[-1] -> 20221 | H42: 31 | K42: =IF(AND(RC[1]=1,RC[3]=1),R[-1]C[5]+1,R[-1]C[5]) -> 2020 | L42: =IF(RC[2]=1,IF((R[-1]C[5]+1)<13,(R[-1]C[5]+1),(1)),R[-1]C[5]) -> 2 | M42: =RC[-2]&RC[-1] -> 20202 | N42: =IF((R[-1]C[5]+1)<=VLOOKUP(R[-1]C[4],C7:C8,2,FALSE),(R[-1]C[5]+1),1) -> 17 | P42: =IF(AND(RC[1]=1,RC[3]<7),RC[-5]+1,RC[-5]) -> 2020 | Q42: =IF(RC[2]<7,IF((RC[-5]+1)<13,(RC[-5]+1),(1)),RC[-5]) -> 2 | R42: =RC[-2]&RC[-1] -> 20202 | S42: =IF((RC[-5]+6)<=VLOOKUP(RC[-6],C7:C8,2,FALSE),(RC[-5]+6),(RC[-5]+6)-VLOOKUP(RC[-6],C7:C8,2,FALSE)) -> 23 | U42: 37 | W42: =RC[-12]&R1C19&RC[-11]&R1C19&RC[-9]&",0,0,0" -> 2020,2,17,0,0,0 | X42: =RC[-8]&R1C19&RC[-7]&R1C19&RC[-5]&",23,59,59" -> 2020,2,23,23,59,59
B43: 2022,8,21,0,0,0 | C43: 2022,9,20,23,59,59 | E43: =R[-12]C+1 -> 2022 | F43: =R[-12]C -> 2 | G43: =RC[-2]&RC[-1] -> 20222 | H43: 28 | K43: =IF(AND(RC[1]=1,RC[3]=1),R[-1]C[5]+1,R[-1]C[5]) -> 2020 | L43: =IF(RC[2]=1,IF((R[-1]C[5]+1)<13,(R[-1]C[5]+1),(1)),R[-1]C[5]) -> 2 | M43: =RC[-2]&RC[-1] -> 20202 | N43: =IF((R[-1]C[5]+1)<=VLOOKUP(R[-1]C[4],C7:C8,2,FALSE),(R[-1]C[5]+1),1) -> 24 | P43: =IF(AND(RC[1]=1,RC[3]<7),RC[-5]+1,RC[-5]) -> 2020 | Q43: =IF(RC[2]<7,IF((RC[-5]+1)<13,(RC[-5]+1),(1)),RC[-5]) -> 3 | R43: =RC[-2]&RC[-1] -> 20203 | S43: =IF((RC[-5]+6)<=VLOOKUP(RC[-6],C7:C8,2,FALSE),(RC[-5]+6),(RC[-5]+6)-VLOOKUP(RC[-6],C7:C8,2,FALSE)) -> 1 | U43: 38 | W43: =RC[-12]&R1C19&RC[-11]&R1C19&RC[-9]&",0,0,0" -> 2020,2,24,0,0,0 | X43: =RC[-8]&R1C19&RC[-7]&R1C19&RC[-5]&",23,59,59" -> 2020,3,1,23,59,59
B44: 2022,9,21,0,0,0 | C44: 2022,10,20,23,59,59 | E44: =R[-12]C+1 -> 2022 | F44: =R[-12]C -> 3 | G44: =RC[-2]&RC[-1] -> 20223 | H44: 31 | K44: =IF(AND(RC[1]=1,RC[3]=1),R[-1]C[5]+1,R[-1]C[5]) -> 2020 | L44: =IF(RC[2]=1,IF((R[-1]C[5]+1)<13,(R[-1]C[5]+1),(1)),R[-1]C[5]) -> 3 | M44: =RC[-2]&RC[-1] -> 20203 | N44: =IF((R[-1]C[5]+1)<=VLOOKUP(R[-1]C[4],C7:C8,2,FALSE),(R[-1]C[5]+1),1) -> 2 | P44: =IF(AND(RC[1]=1,RC[3]<7),RC[-5]+1,RC[-5]) -> 2020 | Q44: =IF(RC[2]<7,IF((RC[-5]+1)<13,(RC[-5]+1),(1)),RC[-5]) -> 3 | R44: =RC[-2]&RC[-1] -> 20203 | S44: =IF((RC[-5]+6)<=VLOOKUP(RC[-6],C7:C8,2,FALSE),(RC[-5]+6),(RC[-5]+6)-VLOOKUP(RC[-6],C7:C8,2,FALSE)) -> 8 | U44: 39 | W44: =RC[-12]&R1C19&RC[-11]&R1C19&RC[-9]&",0,0,0" -> 2020,3,2,0,0,0 | X44: =RC[-8]&R1C19&RC[-7]&R1C19&RC[-5]&",23,59,59" -> 2020,3,8,23,59,59
B45: 2022,10,21,0,0,0 | C45: 2022,11,20,23,59,59 | E45: =R[-12]C+1 -> 2022 | F45: =R[-12]C -> 4 | G45: =RC[-2]&RC[-1] -> 20224 | H45: 30 | K45: =IF(AND(RC[1]=1,RC[3]=1),R[-1]C[5]+1,R[-1]C[5]) -> 2020 | L45: =IF(RC[2]=1,IF((R[-1]C[5]+1)<13,(R[-1]C[5]+1),(1)),R[-1]C[5]) -> 3 | M45: =RC[-2]&RC[-1] -> 20203 | N45: =IF((R[-1]C[5]+1)<=VLOOKUP(R[-1]C[4],C7:C8,2,FALSE),(R[-1]C[5]+1),1) -> 9 | P45: =IF(AND(RC[1]=1,RC[3]<7),RC[-5]+1,RC[-5]) -> 2020 | Q45: =IF(RC[2]<7,IF((RC[-5]+1)<13,(RC[-5]+1),(1)),RC[-5]) -> 3 | R45: =RC[-2]&RC[-1] -> 20203 | S45: =IF((RC[-5]+6)<=VLOOKUP(RC[-6],C7:C8,2,FALSE),(RC[-5]+6),(RC[-5]+6)-VLOOKUP(RC[-6],C7:C8,2,FALSE)) -> 15 | U45: 40 | W45: =RC[-12]&R1C19&RC[-11]&R1C19&RC[-9]&",0,0,0" -> 2020,3,9,0,0,0 | X45: =RC[-8]&R1C19&RC[-7]&R1C19&RC[-5]&",23,59,59" -> 2020,3,15,23,59,59
B46: 2022,11,21,0,0,0 | C46: 2022,12,20,23,59,59 | E46: =R[-12]C+1 -> 2022 | F46: =R[-12]C -> 5 | G46: =RC[-2]&RC[-1] -> 20225 | H46: 31 | K46: =IF(AND(RC[1]=1,RC[3]=1),R[-1]C[5]+1,R[-1]C[5]) -> 2020 | L46: =IF(RC[2]=1,IF((R[-1]C[5]+1)<13,(R[-1]C[5]+1),(1)),R[-1]C[5]) -> 3 | M46: =RC[-2]&RC[-1] -> 20203 | N46: =IF((R[-1]C[5]+1)<=VLOOKUP(R[-1]C[4],C7:C8,2,FALSE),(R[-1]C[5]+1),1) -> 16 | P46: =IF(AND(RC[1]=1,RC[3]<7),RC[-5]+1,RC[-5]) -> 2020 | Q46: =IF(RC[2]<7,IF((RC[-5]+1)<13,(RC[-5]+1),(1)),RC[-5]) -> 3 | R46: =RC[-2]&RC[-1] -> 20203 | S46: =IF((RC[-5]+6)<=VLOOKUP(RC[-6],C7:C8,2,FALSE),(RC[-5]+6),(RC[-5]+6)-VLOOKUP(RC[-6],C7:C8,2,FALSE)) -> 22 | U46: 41 | W46: =RC[-12]&R1C19&RC[-11]&R1C19&RC[-9]&",0,0,0" -> 2020,3,16,0,0,0 | X46: =RC[-8]&R1C19&RC[-7]&R1C19&RC[-5]&",23,59,59" -> 2020,3,22,23,59,59
B47: 2022,12,21,0,0,0 | C47: 2023,1,20,23,59,59 | E47: =R[-12]C+1 -> 2022 | F47: =R[-12]C -> 6 | G47: =RC[-2]&RC[-1] -> 20226 | H47: 30 | K47: =IF(AND(RC[1]=1,RC[3]=1),R[-1]C[5]+1,R[-1]C[5]) -> 2020 | L47: =IF(RC[2]=1,IF((R[-1]C[5]+1)<13,(R[-1]C[5]+1),(1)),R[-1]C[5]) -> 3 | M47: =RC[-2]&RC[-1] -> 20203 | N47: =IF((R[-1]C[5]+1)<=VLOOKUP(R[-1]C[4],C7:C8,2,FALSE),(R[-1]C[5]+1),1) -> 23 | P47: =IF(AND(RC[1]=1,RC[3]<7),RC[-5]+1,RC[-5]) -> 2020 | Q47: =IF(RC[2]<7,IF((RC[-5]+1)<13,(RC[-5]+1),(1)),RC[-5]) -> 3 | R47: =RC[-2]&RC[-1] -> 20203 | S47: =IF((RC[-5]+6)<=VLOOKUP(RC[-6],C7:C8,2,FALSE),(RC[-5]+6),(RC[-5]+6)-VLOOKUP(RC[-6],C7:C8,2,FALSE)) -> 29 | U47: 42 | W47: =RC[-12]&R1C19&RC[-11]&R1C19&RC[-9]&",0,0,0" -> 2020,3,23,0,0,0 | X47: =RC[-8]&R1C19&RC[-7]&R1C19&RC[-5]&",23,59,59" -> 2020,3,29,23,59,59
E48: =R[-12]C+1 -> 2022 | F48: =R[-12]C -> 7 | G48: =RC[-2]&RC[-1] -> 20227 | H48: 31 | K48: =IF(AND(RC[1]=1,RC[3]=1),R[-1]C[5]+1,R[-1]C[5]) -> 2020 | L48: =IF(RC[2]=1,IF((R[-1]C[5]+1)<13,(R[-1]C[5]+1),(1)),R[-1]C[5]) -> 3 | M48: =RC[-2]&RC[-1] -> 20203 | N48: =IF((R[-1]C[5]+1)<=VLOOKUP(R[-1]C[4],C7:C8,2,FALSE),(R[-1]C[5]+1),1) -> 30 | P48: =IF(AND(RC[1]=1,RC[3]<7),RC[-5]+1,RC[-5]) -> 2020 | Q48: =IF(RC[2]<7,IF((RC[-5]+1)<13,(RC[-5]+1),(1)),RC[-5]) -> 4 | R48: =RC[-2]&RC[-1] -> 20204 | S48: =IF((RC[-5]+6)<=VLOOKUP(RC[-6],C7:C8,2,FALSE),(RC[-5]+6),(RC[-5]+6)-VLOOKUP(RC[-6],C7:C8,2,FALSE)) -> 5 | U48: 43 | W48: =RC[-12]&R1C19&RC[-11]&R1C19&RC[-9]&",0,0,0" -> 2020,3,30,0,0,0 | X48: =RC[-8]&R1C19&RC[-7]&R1C19&RC[-5]&",23,59,59" -> 2020,4,5,23,59,59
E49: =R[-12]C+1 -> 2022 | F49: =R[-12]C -> 8 | G49: =RC[-2]&RC[-1] -> 20228 | H49: 31 | K49: =IF(AND(RC[1]=1,RC[3]=1),R[-1]C[5]+1,R[-1]C[5]) -> 2020 | L49: =IF(RC[2]=1,IF((R[-1]C[5]+1)<13,(R[-1]C[5]+1),(1)),R[-1]C[5]) -> 4 | M49: =RC[-2]&RC[-1] -> 20204 | N49: =IF((R[-1]C[5]+1)<=VLOOKUP(R[-1]C[4],C7:C8,2,FALSE),(R[-1]C[5]+1),1) -> 6 | P49: =IF(AND(RC[1]=1,RC[3]<7),RC[-5]+1,RC[-5]) -> 2020 | Q49: =IF(RC[2]<7,IF((RC[-5]+1)<13,(RC[-5]+1),(1)),RC[-5]) -> 4 | R49: =RC[-2]&RC[-1] -> 20204 | S49: =IF((RC[-5]+6)<=VLOOKUP(RC[-6],C7:C8,2,FALSE),(RC[-5]+6),(RC[-5]+6)-VLOOKUP(RC[-6],C7:C8,2,FALSE)) -> 12 | U49: 44 | W49: =RC[-12]&R1C19&RC[-11]&R1C19&RC[-9]&",0,0,0" -> 2020,4,6,0,0,0 | X49: =RC[-8]&R1C19&RC[-7]&R1C19&RC[-5]&",23,59,59" -> 2020,4,12,23,59,59
E50: =R[-12]C+1 -> 2022 | F50: =R[-12]C -> 9 | G50: =RC[-2]&RC[-1] -> 20229 | H50: 30 | K50: =IF(AND(RC[1]=1,RC[3]=1),R[-1]C[5]+1,R[-1]C[5]) -> 2020 | L50: =IF(RC[2]=1,IF((R[-1]C[5]+1)<13,(R[-1]C[5]+1),(1)),R[-1]C[5]) -> 4 | M50: =RC[-2]&RC[-1] -> 20204 | N50: =IF((R[-1]C[5]+1)<=VLOOKUP(R[-1]C[4],C7:C8,2,FALSE),(R[-1]C[5]+1),1) -> 13 | P50: =IF(AND(RC[1]=1,RC[3]<7),RC[-5]+1,RC[-5]) -> 2020 | Q50: =IF(RC[2]<7,IF((RC[-5]+1)<13,(RC[-5]+1),(1)),RC[-5]) -> 4 | R50: =RC[-2]&RC[-1] -> 20204 | S50: =IF((RC[-5]+6)<=VLOOKUP(RC[-6],C7:C8,2,FALSE),(RC[-5]+6),(RC[-5]+6)-VLOOKUP(RC[-6],C7:C8,2,FALSE)) -> 19 | U50: 45 | W50: =RC[-12]&R1C19&RC[-11]&R1C19&RC[-9]&",0,0,0" -> 2020,4,13,0,0,0 | X50: =RC[-8]&R1C19&RC[-7]&R1C19&RC[-5]&",23,59,59" -> 2020,4,19,23,59,59
E51: =R[-12]C+1 -> 2022 | F51: =R[-12]C -> 10 | G51: =RC[-2]&RC[-1] -> 202210 | H51: 31 | K51: =IF(AND(RC[1]=1,RC[3]=1),R[-1]C[5]+1,R[-1]C[5]) -> 2020 | L51: =IF(RC[2]=1,IF((R[-1]C[5]+1)<13,(R[-1]C[5]+1),(1)),R[-1]C[5]) -> 4 | M51: =RC[-2]&RC[-1] -> 20204 | N51: =IF((R[-1]C[5]+1)<=VLOOKUP(R[-1]C[4],C7:C8,2,FALSE),(R[-1]C[5]+1),1) -> 20 | P51: =IF(AND(RC[1]=1,RC[3]<7),RC[-5]+1,RC[-5]) -> 2020 | Q51: =IF(RC[2]<7,IF((RC[-5]+1)<13,(RC[-5]+1),(1)),RC[-5]) -> 4 | R51: =RC[-2]&RC[-1] -> 20204 | S51: =IF((RC[-5]+6)<=VLOOKUP(RC[-6],C7:C8,2,FALSE),(RC[-5]+6),(RC[-5]+6)-VLOOKUP(RC[-6],C7:C8,2,FALSE)) -> 26 | U51: 46 | W51: =RC[-12]&R1C19&RC[-11]&R1C19&RC[-9]&",0,0,0" -> 2020,4,20,0,0,0 | X51: =RC[-8]&R1C19&RC[-7]&R1C19&RC[-5]&",23,59,59" -> 2020,4,26,23,59,59
E52: =R[-12]C+1 -> 2022 | F52: =R[-12]C -> 11 | G52: =RC[-2]&RC[-1] -> 202211 | H52: 30 | K52: =IF(AND(RC[1]=1,RC[3]=1),R[-1]C[5]+1,R[-1]C[5]) -> 2020 | L52: =IF(RC[2]=1,IF((R[-1]C[5]+1)<13,(R[-1]C[5]+1),(1)),R[-1]C[5]) -> 4 | M52: =RC[-2]&RC[-1] -> 20204 | N52: =IF((R[-1]C[5]+1)<=VLOOKUP(R[-1]C[4],C7:C8,2,FALSE),(R[-1]C[5]+1),1) -> 27 | P52: =IF(AND(RC[1]=1,RC[3]<7),RC[-5]+1,RC[-5]) -> 2020 | Q52: =IF(RC[2]<7,IF((RC[-5]+1)<13,(RC[-5]+1),(1)),RC[-5]) -> 5 | R52: =RC[-2]&RC[-1] -> 20205 | S52: =IF((RC[-5]+6)<=VLOOKUP(RC[-6],C7:C8,2,FALSE),(RC[-5]+6),(RC[-5]+6)-VLOOKUP(RC[-6],C7:C8,2,FALSE)) -> 3 | U52: 47 | W52: =RC[-12]&R1C19&RC[-11]&R1C19&RC[-9]&",0,0,0" -> 2020,4,27,0,0,0 | X52: =RC[-8]&R1C19&RC[-7]&R1C19&RC[-5]&",23,59,59" -> 2020,5,3,23,59,59
E53: =R[-12]C+1 -> 2022 | F53: =R[-12]C -> 12 | G53: =RC[-2]&RC[-1] -> 202212 | H53: 31 | K53: =IF(AND(RC[1]=1,RC[3]=1),R[-1]C[5]+1,R[-1]C[5]) -> 2020 | L53: =IF(RC[2]=1,IF((R[-1]C[5]+1)<13,(R[-1]C[5]+1),(1)),R[-1]C[5]) -> 5 | M53: =RC[-2]&RC[-1] -> 20205 | N53: =IF((R[-1]C[5]+1)<=VLOOKUP(R[-1]C[4],C7:C8,2,FALSE),(R[-1]C[5]+1),1) -> 4 | P53: =IF(AND(RC[1]=1,RC[3]<7),RC[-5]+1,RC[-5]) -> 2020 | Q53: =IF(RC[2]<7,IF((RC[-5]+1)<13,(RC[-5]+1),(1)),RC[-5]) -> 5 | R53: =RC[-2]&RC[-1] -> 20205 | S53: =IF((RC[-5]+6)<=VLOOKUP(RC[-6],C7:C8,2,FALSE),(RC[-5]+6),(RC[-5]+6)-VLOOKUP(RC[-6],C7:C8,2,FALSE)) -> 10 | U53: 48 | W53: =RC[-12]&R1C19&RC[-11]&R1C19&RC[-9]&",0,0,0" -> 2020,5,4,0,0,0 | X53: =RC[-8]&R1C19&RC[-7]&R1C19&RC[-5]&",23,59,59" -> 2020,5,10,23,59,59
E54: =R[-12]C+1 -> 2023 | F54: =R[-12]C -> 1 | G54: =RC[-2]&RC[-1] -> 20231 | H54: 31 | K54: =IF(AND(RC[1]=1,RC[3]=1),R[-1]C[5]+1,R[-1]C[5]) -> 2020 | L54: =IF(RC[2]=1,IF((R[-1]C[5]+1)<13,(R[-1]C[5]+1),(1)),R[-1]C[5]) -> 5 | M54: =RC[-2]&RC[-1] -> 20205 | N54: =IF((R[-1]C[5]+1)<=VLOOKUP(R[-1]C[4],C7:C8,2,FALSE),(R[-1]C[5]+1),1) -> 11 | P54: =IF(AND(RC[1]=1,RC[3]<7),RC[-5]+1,RC[-5]) -> 2020 | Q54: =IF(RC[2]<7,IF((RC[-5]+1)<13,(RC[-5]+1),(1)),RC[-5]) -> 5 | R54: =RC[-2]&RC[-1] -> 20205 | S54: =IF((RC[-5]+6)<=VLOOKUP(RC[-6],C7:C8,2,FALSE),(RC[-5]+6),(RC[-5]+6)-VLOOKUP(RC[-6],C7:C8,2,FALSE)) -> 17 | U54: 49 | W54: =RC[-12]&R1C19&RC[-11]&R1C19&RC[-9]&",0,0,0" -> 2020,5,11,0,0,0 | X54: =RC[-8]&R1C19&RC[-7]&R1C19&RC[-5]&",23,59,59" -> 2020,5,17,23,59,59
E55: =R[-12]C+1 -> 2023 | F55: =R[-12]C -> 2 | G55: =RC[-2]&RC[-1] -> 20232 | H55: 28 | K55: =IF(AND(RC[1]=1,RC[3]=1),R[-1]C[5]+1,R[-1]C[5]) -> 2020 | L55: =IF(RC[2]=1,IF((R[-1]C[5]+1)<13,(R[-1]C[5]+1),(1)),R[-1]C[5]) -> 5 | M55: =RC[-2]&RC[-1] -> 20205 | N55: =IF((R[-1]C[5]+1)<=VLOOKUP(R[-1]C[4],C7:C8,2,FALSE),(R[-1]C[5]+1),1) -> 18 | P55: =IF(AND(RC[1]=1,RC[3]<7),RC[-5]+1,RC[-5]) -> 2020 | Q55: =IF(RC[2]<7,IF((RC[-5]+1)<13,(RC[-5]+1),(1)),RC[-5]) -> 5 | R55: =RC[-2]&RC[-1] -> 20205 | S55: =IF((RC[-5]+6)<=VLOOKUP(RC[-6],C7:C8,2,FALSE),(RC[-5]+6),(RC[-5]+6)-VLOOKUP(RC[-6],C7:C8,2,FALSE)) -> 24 | U55: 50 | W55: =RC[-12]&R1C19&RC[-11]&R1C19&RC[-9]&",0,0,0" -> 2020,5,18,0,0,0 | X55: =RC[-8]&R1C19&RC[-7]&R1C19&RC[-5]&",23,59,59" -> 2020,5,24,23,59,59
E56: =R[-12]C+1 -> 2023 | F56: =R[-12]C -> 3 | G56: =RC[-2]&RC[-1] -> 20233 | H56: 31 | K56: =IF(AND(RC[1]=1,RC[3]=1),R[-1]C[5]+1,R[-1]C[5]) -> 2020 | L56: =IF(RC[2]=1,IF((R[-1]C[5]+1)<13,(R[-1]C[5]+1),(1)),R[-1]C[5]) -> 5 | M56: =RC[-2]&RC[-1] -> 20205 | N56: =IF((R[-1]C[5]+1)<=VLOOKUP(R[-1]C[4],C7:C8,2,FALSE),(R[-1]C[5]+1),1) -> 25 | P56: =IF(AND(RC[1]=1,RC[3]<7),RC[-5]+1,RC[-5]) -> 2020 | Q56: =IF(RC[2]<7,IF((RC[-5]+1)<13,(RC[-5]+1),(1)),RC[-5]) -> 5 | R56: =RC[-2]&RC[-1] -> 20205 | S56: =IF((RC[-5]+6)<=VLOOKUP(RC[-6],C7:C8,2,FALSE),(RC[-5]+6),(RC[-5]+6)-VLOOKUP(RC[-6],C7:C8,2,FALSE)) -> 31 | U56: 51 | W56: =RC[-12]&R1C19&RC[-11]&R1C19&RC[-9]&",0,0,0" -> 2020,5,25,0,0,0 | X56: =RC[-8]&R1C19&RC[-7]&R1C19&RC[-5]&",23,59,59" -> 2020,5,31,23,59,59
E57: =R[-12]C+1 -> 2023 | F57: =R[-12]C -> 4 | G57: =RC[-2]&RC[-1] -> 20234 | H57: 30 | K57: =IF(AND(RC[1]=1,RC[3]=1),R[-1]C[5]+1,R[-1]C[5]) -> 2020 | L57: =IF(RC[2]=1,IF((R[-1]C[5]+1)<13,(R[-1]C[5]+1),(1)),R[-1]C[5]) -> 6 | M57: =RC[-2]&RC[-1] -> 20206 | N57: =IF((R[-1]C[5]+1)<=VLOOKUP(R[-1]C[4],C7:C8,2,FALSE),(R[-1]C[5]+1),1) -> 1 | P57: =IF(AND(RC[1]=1,RC[3]<7),RC[-5]+1,RC[-5]) -> 2020 | Q57: =IF(RC[2]<7,IF((RC[-5]+1)<13,(RC[-5]+1),(1)),RC[-5]) -> 6 | R57: =RC[-2]&RC[-1] -> 20206 | S57: =IF((RC[-5]+6)<=VLOOKUP(RC[-6],C7:C8,2,FALSE),(RC[-5]+6),(RC[-5]+6)-VLOOKUP(RC[-6],C7:C8,2,FALSE)) -> 7 | U57: 52 | W57: =RC[-12]&R1C19&RC[-11]&R1C19&RC[-9]&",0,0,0" -> 2020,6,1,0,0,0 | X57: =RC[-8]&R1C19&RC[-7]&R1C19&RC[-5]&",23,59,59" -> 2020,6,7,23,59,59
E58: =R[-12]C+1 -> 2023 | F58: =R[-12]C -> 5 | G58: =RC[-2]&RC[-1] -> 20235 | H58: 31 | K58: =IF(AND(RC[1]=1,RC[3]=1),R[-1]C[5]+1,R[-1]C[5]) -> 2020 | L58: =IF(RC[2]=1,IF((R[-1]C[5]+1)<13,(R[-1]C[5]+1),(1)),R[-1]C[5]) -> 6 | M58: =RC[-2]&RC[-1] -> 20206 | N58: =IF((R[-1]C[5]+1)<=VLOOKUP(R[-1]C[4],C7:C8,2,FALSE),(R[-1]C[5]+1),1) -> 8 | P58: =IF(AND(RC[1]=1,RC[3]<7),RC[-5]+1,RC[-5]) -> 2020 | Q58: =IF(RC[2]<7,IF((RC[-5]+1)<13,(RC[-5]+1),(1)),RC[-5]) -> 6 | R58: =RC[-2]&RC[-1] -> 20206 | S58: =IF((RC[-5]+6)<=VLOOKUP(RC[-6],C7:C8,2,FALSE),(RC[-5]+6),(RC[-5]+6)-VLOOKUP(RC[-6],C7:C8,2,FALSE)) -> 14 | U58: 53 | W58: =RC[-12]&R1C19&RC[-11]&R1C19&RC[-9]&",0,0,0" -> 2020,6,8,0,0,0 | X58: =RC[-8]&R1C19&RC[-7]&R1C19&RC[-5]&",23,59,59" -> 2020,6,14,23,59,59
E59: =R[-12]C+1 -> 2023 | F59: =R[-12]C -> 6 | G59: =RC[-2]&RC[-1] -> 20236 | H59: 30 | K59: =IF(AND(RC[1]=1,RC[3]=1),R[-1]C[5]+1,R[-1]C[5]) -> 2020 | L59: =IF(RC[2]=1,IF((R[-1]C[5]+1)<13,(R[-1]C[5]+1),(1)),R[-1]C[5]) -> 6 | M59: =RC[-2]&RC[-1] -> 20206 | N59: =IF((R[-1]C[5]+1)<=VLOOKUP(R[-1]C[4],C7:C8,2,FALSE),(R[-1]C[5]+1),1) -> 15 | P59: =IF(AND(RC[1]=1,RC[3]<7),RC[-5]+1,RC[-5]) -> 2020 | Q59: =IF(RC[2]<7,IF((RC[-5]+1)<13,(RC[-5]+1),(1)),RC[-5]) -> 6 | R59: =RC[-2]&RC[-1] -> 20206 | S59: =IF((RC[-5]+6)<=VLOOKUP(RC[-6],C7:C8,2,FALSE),(RC[-5]+6),(RC[-5]+6)-VLOOKUP(RC[-6],C7:C8,2,FALSE)) -> 21 | U59: 54 | W59: =RC[-12]&R1C19&RC[-11]&R1C19&RC[-9]&",0,0,0" -> 2020,6,15,0,0,0 | X59: =RC[-8]&R1C19&RC[-7]&R1C19&RC[-5]&",23,59,59" -> 2020,6,21,23,59,59
E60: =R[-12]C+1 -> 2023 | F60: =R[-12]C -> 7 | G60: =RC[-2]&RC[-1] -> 20237 | H60: 31 | K60: =IF(AND(RC[1]=1,RC[3]=1),R[-1]C[5]+1,R[-1]C[5]) -> 2020 | L60: =IF(RC[2]=1,IF((R[-1]C[5]+1)<13,(R[-1]C[5]+1),(1)),R[-1]C[5]) -> 6 | M60: =RC[-2]&RC[-1] -> 20206 | N60: =IF((R[-1]C[5]+1)<=VLOOKUP(R[-1]C[4],C7:C8,2,FALSE),(R[-1]C[5]+1),1) -> 22 | P60: =IF(AND(RC[1]=1,RC[3]<7),RC[-5]+1,RC[-5]) -> 2020 | Q60: =IF(RC[2]<7,IF((RC[-5]+1)<13,(RC[-5]+1),(1)),RC[-5]) -> 6 | R60: =RC[-2]&RC[-1] -> 20206 | S60: =IF((RC[-5]+6)<=VLOOKUP(RC[-6],C7:C8,2,FALSE),(RC[-5]+6),(RC[-5]+6)-VLOOKUP(RC[-6],C7:C8,2,FALSE)) -> 28 | U60: 55 | W60: =RC[-12]&R1C19&RC[-11]&R1C19&RC[-9]&",0,0,0" -> 2020,6,22,0,0,0 | X60: =RC[-8]&R1C19&RC[-7]&R1C19&RC[-5]&",23,59,59" -> 2020,6,28,23,59,59
E61: =R[-12]C+1 -> 2023 | F61: =R[-12]C -> 8 | G61: =RC[-2]&RC[-1] -> 20238 | H61: 31 | K61: =IF(AND(RC[1]=1,RC[3]=1),R[-1]C[5]+1,R[-1]C[5]) -> 2020 | L61: =IF(RC[2]=1,IF((R[-1]C[5]+1)<13,(R[-1]C[5]+1),(1)),R[-1]C[5]) -> 6 | M61: =RC[-2]&RC[-1] -> 20206 | N61: =IF((R[-1]C[5]+1)<=VLOOKUP(R[-1]C[4],C7:C8,2,FALSE),(R[-1]C[5]+1),1) -> 29 | P61: =IF(AND(RC[1]=1,RC[3]<7),RC[-5]+1,RC[-5]) -> 2020 | Q61: =IF(RC[2]<7,IF((RC[-5]+1)<13,(RC[-5]+1),(1)),RC[-5]) -> 7 | R61: =RC[-2]&RC[-1] -> 20207 | S61: =IF((RC[-5]+6)<=VLOOKUP(RC[-6],C7:C8,2,FALSE),(RC[-5]+6),(RC[-5]+6)-VLOOKUP(RC[-6],C7:C8,2,FALSE)) -> 5 | U61: 56 | W61: =RC[-12]&R1C19&RC[-11]&R1C19&RC[-9]&",0,0,0" -> 2020,6,29,0,0,0 | X61: =RC[-8]&R1C19&RC[-7]&R1C19&RC[-5]&",23,59,59" -> 2020,7,5,23,59,59
E62: =R[-12]C+1 -> 2023 | F62: =R[-12]C -> 9 | G62: =RC[-2]&RC[-1] -> 20239 | H62: 30 | K62: =IF(AND(RC[1]=1,RC[3]=1),R[-1]C[5]+1,R[-1]C[5]) -> 2020 | L62: =IF(RC[2]=1,IF((R[-1]C[5]+1)<13,(R[-1]C[5]+1),(1)),R[-1]C[5]) -> 7 | M62: =RC[-2]&RC[-1] -> 20207 | N62: =IF((R[-1]C[5]+1)<=VLOOKUP(R[-1]C[4],C7:C8,2,FALSE),(R[-1]C[5]+1),1) -> 6 | P62: =IF(AND(RC[1]=1,RC[3]<7),RC[-5]+1,RC[-5]) -> 2020 | Q62: =IF(RC[2]<7,IF((RC[-5]+1)<13,(RC[-5]+1),(1)),RC[-5]) -> 7 | R62: =RC[-2]&RC[-1] -> 20207 | S62: =IF((RC[-5]+6)<=VLOOKUP(RC[-6],C7:C8,2,FALSE),(RC[-5]+6),(RC[-5]+6)-VLOOKUP(RC[-6],C7:C8,2,FALSE)) -> 12 | U62: 57 | W62: =RC[-12]&R1C19&RC[-11]&R1C19&RC[-9]&",0,0,0" -> 2020,7,6,0,0,0 | X62: =RC[-8]&R1C19&RC[-7]&R1C19&RC[-5]&",23,59,59" -> 2020,7,12,23,59,59
E63: =R[-12]C+1 -> 2023 | F63: =R[-12]C -> 10 | G63: =RC[-2]&RC[-1] -> 202310 | H63: 31 | K63: =IF(AND(RC[1]=1,RC[3]=1),R[-1]C[5]+1,R[-1]C[5]) -> 2020 | L63: =IF(RC[2]=1,IF((R[-1]C[5]+1)<13,(R[-1]C[5]+1),(1)),R[-1]C[5]) -> 7 | M63: =RC[-2]&RC[-1] -> 20207 | N63: =IF((R[-1]C[5]+1)<=VLOOKUP(R[-1]C[4],C7:C8,2,FALSE),(R[-1]C[5]+1),1) -> 13 | P63: =IF(AND(RC[1]=1,RC[3]<7),RC[-5]+1,RC[-5]) -> 2020 | Q63: =IF(RC[2]<7,IF((RC[-5]+1)<13,(RC[-5]+1),(1)),RC[-5]) -> 7 | R63: =RC[-2]&RC[-1] -> 20207 | S63: =IF((RC[-5]+6)<=VLOOKUP(RC[-6],C7:C8,2,FALSE),(RC[-5]+6),(RC[-5]+6)-VLOOKUP(RC[-6],C7:C8,2,FALSE)) -> 19 | U63: 58 | W63: =RC[-12]&R1C19&RC[-11]&R1C19&RC[-9]&",0,0,0" -> 2020,7,13,0,0,0 | X63: =RC[-8]&R1C19&RC[-7]&R1C19&RC[-5]&",23,59,59" -> 2020,7,19,23,59,59
E64: =R[-12]C+1 -> 2023 | F64: =R[-12]C -> 11 | G64: =RC[-2]&RC[-1] -> 202311 | H64: 30 | K64: =IF(AND(RC[1]=1,RC[3]=1),R[-1]C[5]+1,R[-1]C[5]) -> 2020 | L64: =IF(RC[2]=1,IF((R[-1]C[5]+1)<13,(R[-1]C[5]+1),(1)),R[-1]C[5]) -> 7 | M64: =RC[-2]&RC[-1] -> 20207 | N64: =IF((R[-1]C[5]+1)<=VLOOKUP(R[-1]C[4],C7:C8,2,FALSE),(R[-1]C[5]+1),1) -> 20 | P64: =IF(AND(RC[1]=1,RC[3]<7),RC[-5]+1,RC[-5]) -> 2020 | Q64: =IF(RC[2]<7,IF((RC[-5]+1)<13,(RC[-5]+1),(1)),RC[-5]) -> 7 | R64: =RC[-2]&RC[-1] -> 20207 | S64: =IF((RC[-5]+6)<=VLOOKUP(RC[-6],C7:C8,2,FALSE),(RC[-5]+6),(RC[-5]+6)-VLOOKUP(RC[-6],C7:C8,2,FALSE)) -> 26 | U64: 59 | W64: =RC[-12]&R1C19&RC[-11]&R1C19&RC[-9]&",0,0,0" -> 2020,7,20,0,0,0 | X64: =RC[-8]&R1C19&RC[-7]&R1C19&RC[-5]&",23,59,59" -> 2020,7,26,23,59,59
E65: =R[-12]C+1 -> 2023 | F65: =R[-12]C -> 12 | G65: =RC[-2]&RC[-1] -> 202312 | H65: 31 | K65: =IF(AND(RC[1]=1,RC[3]=1),R[-1]C[5]+1,R[-1]C[5]) -> 2020 | L65: =IF(RC[2]=1,IF((R[-1]C[5]+1)<13,(R[-1]C[5]+1),(1)),R[-1]C[5]) -> 7 | M65: =RC[-2]&RC[-1] -> 20207 | N65: =IF((R[-1]C[5]+1)<=VLOOKUP(R[-1]C[4],C7:C8,2,FALSE),(R[-1]C[5]+1),1) -> 27 | P65: =IF(AND(RC[1]=1,RC[3]<7),RC[-5]+1,RC[-5]) -> 2020 | Q65: =IF(RC[2]<7,IF((RC[-5]+1)<13,(RC[-5]+1),(1)),RC[-5]) -> 8 | R65: =RC[-2]&RC[-1] -> 20208 | S65: =IF((RC[-5]+6)<=VLOOKUP(RC[-6],C7:C8,2,FALSE),(RC[-5]+6),(RC[-5]+6)-VLOOKUP(RC[-6],C7:C8,2,FALSE)) -> 2 | U65: 60 | W65: =RC[-12]&R1C19&RC[-11]&R1C19&RC[-9]&",0,0,0" -> 2020,7,27,0,0,0 | X65: =RC[-8]&R1C19&RC[-7]&R1C19&RC[-5]&",23,59,59" -> 2020,8,2,23,59,59
E66: =R[-12]C+1 -> 2024 | F66: =R[-12]C -> 1 | G66: =RC[-2]&RC[-1] -> 20241 | H66: 31 | K66: =IF(AND(RC[1]=1,RC[3]=1),R[-1]C[5]+1,R[-1]C[5]) -> 2020 | L66: =IF(RC[2]=1,IF((R[-1]C[5]+1)<13,(R[-1]C[5]+1),(1)),R[-1]C[5]) -> 8 | M66: =RC[-2]&RC[-1] -> 20208 | N66: =IF((R[-1]C[5]+1)<=VLOOKUP(R[-1]C[4],C7:C8,2,FALSE),(R[-1]C[5]+1),1) -> 3 | P66: =IF(AND(RC[1]=1,RC[3]<7),RC[-5]+1,RC[-5]) -> 2020 | Q66: =IF(RC[2]<7,IF((RC[-5]+1)<13,(RC[-5]+1),(1)),RC[-5]) -> 8 | R66: =RC[-2]&RC[-1] -> 20208 | S66: =IF((RC[-5]+6)<=VLOOKUP(RC[-6],C7:C8,2,FALSE),(RC[-5]+6),(RC[-5]+6)-VLOOKUP(RC[-6],C7:C8,2,FALSE)) -> 9 | U66: 61 | W66: =RC[-12]&R1C19&RC[-11]&R1C19&RC[-9]&",0,0,0" -> 2020,8,3,0,0,0 | X66: =RC[-8]&R1C19&RC[-7]&R1C19&RC[-5]&",23,59,59" -> 2020,8,9,23,59,59
E67: =R[-12]C+1 -> 2024 | F67: =R[-12]C -> 2 | G67: =RC[-2]&RC[-1] -> 20242 | H67: 29 | K67: =IF(AND(RC[1]=1,RC[3]=1),R[-1]C[5]+1,R[-1]C[5]) -> 2020 | L67: =IF(RC[2]=1,IF((R[-1]C[5]+1)<13,(R[-1]C[5]+1),(1)),R[-1]C[5]) -> 8 | M67: =RC[-2]&RC[-1] -> 20208 | N67: =IF((R[-1]C[5]+1)<=VLOOKUP(R[-1]C[4],C7:C8,2,FALSE),(R[-1]C[5]+1),1) -> 10 | P67: =IF(AND(RC[1]=1,RC[3]<7),RC[-5]+1,RC[-5]) -> 2020 | Q67: =IF(RC[2]<7,IF((RC[-5]+1)<13,(RC[-5]+1),(1)),RC[-5]) -> 8 | R67: =RC[-2]&RC[-1] -> 20208 | S67: =IF((RC[-5]+6)<=VLOOKUP(RC[-6],C7:C8,2,FALSE),(RC[-5]+6),(RC[-5]+6)-VLOOKUP(RC[-6],C7:C8,2,FALSE)) -> 16 | U67: 62 | W67: =RC[-12]&R1C19&RC[-11]&R1C19&RC[-9]&",0,0,0" -> 2020,8,10,0,0,0 | X67: =RC[-8]&R1C19&RC[-7]&R1C19&RC[-5]&",23,59,59" -> 2020,8,16,23,59,59
E68: =R[-12]C+1 -> 2024 | F68: =R[-12]C -> 3 | G68: =RC[-2]&RC[-1] -> 20243 | H68: 31 | K68: =IF(AND(RC[1]=1,RC[3]=1),R[-1]C[5]+1,R[-1]C[5]) -> 2020 | L68: =IF(RC[2]=1,IF((R[-1]C[5]+1)<13,(R[-1]C[5]+1),(1)),R[-1]C[5]) -> 8 | M68: =RC[-2]&RC[-1] -> 20208 | N68: =IF((R[-1]C[5]+1)<=VLOOKUP(R[-1]C[4],C7:C8,2,FALSE),(R[-1]C[5]+1),1) -> 17 | P68: =IF(AND(RC[1]=1,RC[3]<7),RC[-5]+1,RC[-5]) -> 2020 | Q68: =IF(RC[2]<7,IF((RC[-5]+1)<13,(RC[-5]+1),(1)),RC[-5]) -> 8 | R68: =RC[-2]&RC[-1] -> 20208 | S68: =IF((RC[-5]+6)<=VLOOKUP(RC[-6],C7:C8,2,FALSE),(RC[-5]+6),(RC[-5]+6)-VLOOKUP(RC[-6],C7:C8,2,FALSE)) -> 23 | U68: 63 | W68: =RC[-12]&R1C19&RC[-11]&R1C19&RC[-9]&",0,0,0" -> 2020,8,17,0,0,0 | X68: =RC[-8]&R1C19&RC[-7]&R1C19&RC[-5]&",23,59,59" -> 2020,8,23,23,59,59
E69: =R[-12]C+1 -> 2024 | F69: =R[-12]C -> 4 | G69: =RC[-2]&RC[-1] -> 20244 | H69: 30 | K69: =IF(AND(RC[1]=1,RC[3]=1),R[-1]C[5]+1,R[-1]C[5]) -> 2020 | L69: =IF(RC[2]=1,IF((R[-1]C[5]+1)<13,(R[-1]C[5]+1),(1)),R[-1]C[5]) -> 8 | M69: =RC[-2]&RC[-1] -> 20208 | N69: =IF((R[-1]C[5]+1)<=VLOOKUP(R[-1]C[4],C7:C8,2,FALSE),(R[-1]C[5]+1),1) -> 24 | P69: =IF(AND(RC[1]=1,RC[3]<7),RC[-5]+1,RC[-5]) -> 2020 | Q69: =IF(RC[2]<7,IF((RC[-5]+1)<13,(RC[-5]+1),(1)),RC[-5]) -> 8 | R69: =RC[-2]&RC[-1] -> 20208 | S69: =IF((RC[-5]+6)<=VLOOKUP(RC[-6],C7:C8,2,FALSE),(RC[-5]+6),(RC[-5]+6)-VLOOKUP(RC[-6],C7:C8,2,FALSE)) -> 30 | U69: 64 | W69: =RC[-12]&R1C19&RC[-11]&R1C19&RC[-9]&",0,0,0" -> 2020,8,24,0,0,0 | X69: =RC[-8]&R1C19&RC[-7]&R1C19&RC[-5]&",23,59,59" -> 2020,8,30,23,59,59
E70: =R[-12]C+1 -> 2024 | F70: =R[-12]C -> 5 | G70: =RC[-2]&RC[-1] -> 20245 | H70: 31 | K70: =IF(AND(RC[1]=1,RC[3]=1),R[-1]C[5]+1,R[-1]C[5]) -> 2020 | L70: =IF(RC[2]=1,IF((R[-1]C[5]+1)<13,(R[-1]C[5]+1),(1)),R[-1]C[5]) -> 8 | M70: =RC[-2]&RC[-1] -> 20208 | N70: =IF((R[-1]C[5]+1)<=VLOOKUP(R[-1]C[4],C7:C8,2,FALSE),(R[-1]C[5]+1),1) -> 31 | P70: =IF(AND(RC[1]=1,RC[3]<7),RC[-5]+1,RC[-5]) -> 2020 | Q70: =IF(RC[2]<7,IF((RC[-5]+1)<13,(RC[-5]+1),(1)),RC[-5]) -> 9 | R70: =RC[-2]&RC[-1] -> 20209 | S70: =IF((RC[-5]+6)<=VLOOKUP(RC[-6],C7:C8,2,FALSE),(RC[-5]+6),(RC[-5]+6)-VLOOKUP(RC[-6],C7:C8,2,FALSE)) -> 6 | U70: 65 | W70: =RC[-12]&R1C19&RC[-11]&R1C19&RC[-9]&",0,0,0" -> 2020,8,31,0,0,0 | X70: =RC[-8]&R1C19&RC[-7]&R1C19&RC[-5]&",23,59,59" -> 2020,9,6,23,59,59
E71: =R[-12]C+1 -> 2024 | F71: =R[-12]C -> 6 | G71: =RC[-2]&RC[-1] -> 20246 | H71: 30 | K71: =IF(AND(RC[1]=1,RC[3]=1),R[-1]C[5]+1,R[-1]C[5]) -> 2020 | L71: =IF(RC[2]=1,IF((R[-1]C[5]+1)<13,(R[-1]C[5]+1),(1)),R[-1]C[5]) -> 9 | M71: =RC[-2]&RC[-1] -> 20209 | N71: =IF((R[-1]C[5]+1)<=VLOOKUP(R[-1]C[4],C7:C8,2,FALSE),(R[-1]C[5]+1),1) -> 7 | P71: =IF(AND(RC[1]=1,RC[3]<7),RC[-5]+1,RC[-5]) -> 2020 | Q71: =IF(RC[2]<7,IF((RC[-5]+1)<13,(RC[-5]+1),(1)),RC[-5]) -> 9 | R71: =RC[-2]&RC[-1] -> 20209 | S71: =IF((RC[-5]+6)<=VLOOKUP(RC[-6],C7:C8,2,FALSE),(RC[-5]+6),(RC[-5]+6)-VLOOKUP(RC[-6],C7:C8,2,FALSE)) -> 13 | U71: 66 | W71: =RC[-12]&R1C19&RC[-11]&R1C19&RC[-9]&",0,0,0" -> 2020,9,7,0,0,0 | X71: =RC[-8]&R1C19&RC[-7]&R1C19&RC[-5]&",23,59,59" -> 2020,9,13,23,59,59
E72: =R[-12]C+1 -> 2024 | F72: =R[-12]C -> 7 | G72: =RC[-2]&RC[-1] -> 20247 | H72: 31 | K72: =IF(AND(RC[1]=1,RC[3]=1),R[-1]C[5]+1,R[-1]C[5]) -> 2020 | L72: =IF(RC[2]=1,IF((R[-1]C[5]+1)<13,(R[-1]C[5]+1),(1)),R[-1]C[5]) -> 9 | M72: =RC[-2]&RC[-1] -> 20209 | N72: =IF((R[-1]C[5]+1)<=VLOOKUP(R[-1]C[4],C7:C8,2,FALSE),(R[-1]C[5]+1),1) -> 14 | P72: =IF(AND(RC[1]=1,RC[3]<7),RC[-5]+1,RC[-5]) -> 2020 | Q72: =IF(RC[2]<7,IF((RC[-5]+1)<13,(RC[-5]+1),(1)),RC[-5]) -> 9 | R72: =RC[-2]&RC[-1] -> 20209 | S72: =IF((RC[-5]+6)<=VLOOKUP(RC[-6],C7:C8,2,FALSE),(RC[-5]+6),(RC[-5]+6)-VLOOKUP(RC[-6],C7:C8,2,FALSE)) -> 20 | U72: 67 | W72: =RC[-12]&R1C19&RC[-11]&R1C19&RC[-9]&",0,0,0" -> 2020,9,14,0,0,0 | X72: =RC[-8]&R1C19&RC[-7]&R1C19&RC[-5]&",23,59,59" -> 2020,9,20,23,59,59
E73: =R[-12]C+1 -> 2024 | F73: =R[-12]C -> 8 | G73: =RC[-2]&RC[-1] -> 20248 | H73: 31 | K73: =IF(AND(RC[1]=1,RC[3]=1),R[-1]C[5]+1,R[-1]C[5]) -> 2020 | L73: =IF(RC[2]=1,IF((R[-1]C[5]+1)<13,(R[-1]C[5]+1),(1)),R[-1]C[5]) -> 9 | M73: =RC[-2]&RC[-1] -> 20209 | N73: =IF((R[-1]C[5]+1)<=VLOOKUP(R[-1]C[4],C7:C8,2,FALSE),(R[-1]C[5]+1),1) -> 21 | P73: =IF(AND(RC[1]=1,RC[3]<7),RC[-5]+1,RC[-5]) -> 2020 | Q73: =IF(RC[2]<7,IF((RC[-5]+1)<13,(RC[-5]+1),(1)),RC[-5]) -> 9 | R73: =RC[-2]&RC[-1] -> 20209 | S73: =IF((RC[-5]+6)<=VLOOKUP(RC[-6],C7:C8,2,FALSE),(RC[-5]+6),(RC[-5]+6)-VLOOKUP(RC[-6],C7:C8,2,FALSE)) -> 27 | U73: 68 | W73: =RC[-12]&R1C19&RC[-11]&R1C19&RC[-9]&",0,0,0" -> 2020,9,21,0,0,0 | X73: =RC[-8]&R1C19&RC[-7]&R1C19&RC[-5]&",23,59,59" -> 2020,9,27,23,59,59
E74: =R[-12]C+1 -> 2024 | F74: =R[-12]C -> 9 | G74: =RC[-2]&RC[-1] -> 20249 | H74: 30 | K74: =IF(AND(RC[1]=1,RC[3]=1),R[-1]C[5]+1,R[-1]C[5]) -> 2020 | L74: =IF(RC[2]=1,IF((R[-1]C[5]+1)<13,(R[-1]C[5]+1),(1)),R[-1]C[5]) -> 9 | M74: =RC[-2]&RC[-1] -> 20209 | N74: =IF((R[-1]C[5]+1)<=VLOOKUP(R[-1]C[4],C7:C8,2,FALSE),(R[-1]C[5]+1),1) -> 28 | P74: =IF(AND(RC[1]=1,RC[3]<7),RC[-5]+1,RC[-5]) -> 2020 | Q74: =IF(RC[2]<7,IF((RC[-5]+1)<13,(RC[-5]+1),(1)),RC[-5]) -> 10 | R74: =RC[-2]&RC[-1] -> 202010 | S74: =IF((RC[-5]+6)<=VLOOKUP(RC[-6],C7:C8,2,FALSE),(RC[-5]+6),(RC[-5]+6)-VLOOKUP(RC[-6],C7:C8,2,FALSE)) -> 4 | U74: 69 | W74: =RC[-12]&R1C19&RC[-11]&R1C19&RC[-9]&",0,0,0" -> 2020,9,28,0,0,0 | X74: =RC[-8]&R1C19&RC[-7]&R1C19&RC[-5]&",23,59,59" -> 2020,10,4,23,59,59
E75: =R[-12]C+1 -> 2024 | F75: =R[-12]C -> 10 | G75: =RC[-2]&RC[-1] -> 202410 | H75: 31 | K75: =IF(AND(RC[1]=1,RC[3]=1),R[-1]C[5]+1,R[-1]C[5]) -> 2020 | L75: =IF(RC[2]=1,IF((R[-1]C[5]+1)<13,(R[-1]C[5]+1),(1)),R[-1]C[5]) -> 10 | M75: =RC[-2]&RC[-1] -> 202010 | N75: =IF((R[-1]C[5]+1)<=VLOOKUP(R[-1]C[4],C7:C8,2,FALSE),(R[-1]C[5]+1),1) -> 5 | P75: =IF(AND(RC[1]=1,RC[3]<7),RC[-5]+1,RC[-5]) -> 2020 | Q75: =IF(RC[2]<7,IF((RC[-5]+1)<13,(RC[-5]+1),(1)),RC[-5]) -> 10 | R75: =RC[-2]&RC[-1] -> 202010 | S75: =IF((RC[-5]+6)<=VLOOKUP(RC[-6],C7:C8,2,FALSE),(RC[-5]+6),(RC[-5]+6)-VLOOKUP(RC[-6],C7:C8,2,FALSE)) -> 11 | U75: 70 | W75: =RC[-12]&R1C19&RC[-11]&R1C19&RC[-9]&",0,0,0" -> 2020,10,5,0,0,0 | X75: =RC[-8]&R1C19&RC[-7]&R1C19&RC[-5]&",23,59,59" -> 2020,10,11,23,59,59
E76: =R[-12]C+1 -> 2024 | F76: =R[-12]C -> 11 | G76: =RC[-2]&RC[-1] -> 202411 | H76: 30 | K76: =IF(AND(RC[1]=1,RC[3]=1),R[-1]C[5]+1,R[-1]C[5]) -> 2020 | L76: =IF(RC[2]=1,IF((R[-1]C[5]+1)<13,(R[-1]C[5]+1),(1)),R[-1]C[5]) -> 10 | M76: =RC[-2]&RC[-1] -> 202010 | N76: =IF((R[-1]C[5]+1)<=VLOOKUP(R[-1]C[4],C7:C8,2,FALSE),(R[-1]C[5]+1),1) -> 12 | P76: =IF(AND(RC[1]=1,RC[3]<7),RC[-5]+1,RC[-5]) -> 2020 | Q76: =IF(RC[2]<7,IF((RC[-5]+1)<13,(RC[-5]+1),(1)),RC[-5]) -> 10 | R76: =RC[-2]&RC[-1] -> 202010 | S76: =IF((RC[-5]+6)<=VLOOKUP(RC[-6],C7:C8,2,FALSE),(RC[-5]+6),(RC[-5]+6)-VLOOKUP(RC[-6],C7:C8,2,FALSE)) -> 18 | U76: 71 | W76: =RC[-12]&R1C19&RC[-11]&R1C19&RC[-9]&",0,0,0" -> 2020,10,12,0,0,0 | X76: =RC[-8]&R1C19&RC[-7]&R1C19&RC[-5]&",23,59,59" -> 2020,10,18,23,59,59
E77: =R[-12]C+1 -> 2024 | F77: =R[-12]C -> 12 | G77: =RC[-2]&RC[-1] -> 202412 | H77: 31 | K77: =IF(AND(RC[1]=1,RC[3]=1),R[-1]C[5]+1,R[-1]C[5]) -> 2020 | L77: =IF(RC[2]=1,IF((R[-1]C[5]+1)<13,(R[-1]C[5]+1),(1)),R[-1]C[5]) -> 10 | M77: =RC[-2]&RC[-1] -> 202010 | N77: =IF((R[-1]C[5]+1)<=VLOOKUP(R[-1]C[4],C7:C8,2,FALSE),(R[-1]C[5]+1),1) -> 19 | P77: =IF(AND(RC[1]=1,RC[3]<7),RC[-5]+1,RC[-5]) -> 2020 | Q77: =IF(RC[2]<7,IF((RC[-5]+1)<13,(RC[-5]+1),(1)),RC[-5]) -> 10 | R77: =RC[-2]&RC[-1] -> 202010 | S77: =IF((RC[-5]+6)<=VLOOKUP(RC[-6],C7:C8,2,FALSE),(RC[-5]+6),(RC[-5]+6)-VLOOKUP(RC[-6],C7:C8,2,FALSE)) -> 25 | U77: 72 | W77: =RC[-12]&R1C19&RC[-11]&R1C19&RC[-9]&",0,0,0" -> 2020,10,19,0,0,0 | X77: =RC[-8]&R1C19&RC[-7]&R1C19&RC[-5]&",23,59,59" -> 2020,10,25,23,59,59
E78: =R[-12]C+1 -> 2025 | F78: =R[-12]C -> 1 | G78: =RC[-2]&RC[-1] -> 20251 | H78: 31 | K78: =IF(AND(RC[1]=1,RC[3]=1),R[-1]C[5]+1,R[-1]C[5]) -> 2020 | L78: =IF(RC[2]=1,IF((R[-1]C[5]+1)<13,(R[-1]C[5]+1),(1)),R[-1]C[5]) -> 10 | M78: =RC[-2]&RC[-1] -> 202010 | N78: =IF((R[-1]C[5]+1)<=VLOOKUP(R[-1]C[4],C7:C8,2,FALSE),(R[-1]C[5]+1),1) -> 26 | P78: =IF(AND(RC[1]=1,RC[3]<7),RC[-5]+1,RC[-5]) -> 2020 | Q78: =IF(RC[2]<7,IF((RC[-5]+1)<13,(RC[-5]+1),(1)),RC[-5]) -> 11 | R78: =RC[-2]&RC[-1] -> 202011 | S78: =IF((RC[-5]+6)<=VLOOKUP(RC[-6],C7:C8,2,FALSE),(RC[-5]+6),(RC[-5]+6)-VLOOKUP(RC[-6],C7:C8,2,FALSE)) -> 1 | U78: 73 | W78: =RC[-12]&R1C19&RC[-11]&R1C19&RC[-9]&",0,0,0" -> 2020,10,26,0,0,0 | X78: =RC[-8]&R1C19&RC[-7]&R1C19&RC[-5]&",23,59,59" -> 2020,11,1,23,59,59
E79: =R[-12]C+1 -> 2025 | F79: =R[-12]C -> 2 | G79: =RC[-2]&RC[-1] -> 20252 | H79: 28 | K79: =IF(AND(RC[1]=1,RC[3]=1),R[-1]C[5]+1,R[-1]C[5]) -> 2020 | L79: =IF(RC[2]=1,IF((R[-1]C[5]+1)<13,(R[-1]C[5]+1),(1)),R[-1]C[5]) -> 11 | M79: =RC[-2]&RC[-1] -> 202011 | N79: =IF((R[-1]C[5]+1)<=VLOOKUP(R[-1]C[4],C7:C8,2,FALSE),(R[-1]C[5]+1),1) -> 2 | P79: =IF(AND(RC[1]=1,RC[3]<7),RC[-5]+1,RC[-5]) -> 2020 | Q79: =IF(RC[2]<7,IF((RC[-5]+1)<13,(RC[-5]+1),(1)),RC[-5]) -> 11 | R79: =RC[-2]&RC[-1] -> 202011 | S79: =IF((RC[-5]+6)<=VLOOKUP(RC[-6],C7:C8,2,FALSE),(RC[-5]+6),(RC[-5]+6)-VLOOKUP(RC[-6],C7:C8,2,FALSE)) -> 8 | U79: 74 | W79: =RC[-12]&R1C19&RC[-11]&R1C19&RC[-9]&",0,0,0" -> 2020,11,2,0,0,0 | X79: =RC[-8]&R1C19&RC[-7]&R1C19&RC[-5]&",23,59,59" -> 2020,11,8,23,59,59
E80: =R[-12]C+1 -> 2025 | F80: =R[-12]C -> 3 | G80: =RC[-2]&RC[-1] -> 20253 | H80: 31 | K80: =IF(AND(RC[1]=1,RC[3]=1),R[-1]C[5]+1,R[-1]C[5]) -> 2020 | L80: =IF(RC[2]=1,IF((R[-1]C[5]+1)<13,(R[-1]C[5]+1),(1)),R[-1]C[5]) -> 11 | M80: =RC[-2]&RC[-1] -> 202011 | N80: =IF((R[-1]C[5]+1)<=VLOOKUP(R[-1]C[4],C7:C8,2,FALSE),(R[-1]C[5]+1),1) -> 9 | P80: =IF(AND(RC[1]=1,RC[3]<7),RC[-5]+1,RC[-5]) -> 2020 | Q80: =IF(RC[2]<7,IF((RC[-5]+1)<13,(RC[-5]+1),(1)),RC[-5]) -> 11 | R80: =RC[-2]&RC[-1] -> 202011 | S80: =IF((RC[-5]+6)<=VLOOKUP(RC[-6],C7:C8,2,FALSE),(RC[-5]+6),(RC[-5]+6)-VLOOKUP(RC[-6],C7:C8,2,FALSE)) -> 15 | U80: 75 | W80: =RC[-12]&R1C19&RC[-11]&R1C19&RC[-9]&",0,0,0" -> 2020,11,9,0,0,0 | X80: =RC[-8]&R1C19&RC[-7]&R1C19&RC[-5]&",23,59,59" -> 2020,11,15,23,59,59
E81: =R[-12]C+1 -> 2025 | F81: =R[-12]C -> 4 | G81: =RC[-2]&RC[-1] -> 20254 | H81: 30 | K81: =IF(AND(RC[1]=1,RC[3]=1),R[-1]C[5]+1,R[-1]C[5]) -> 2020 | L81: =IF(RC[2]=1,IF((R[-1]C[5]+1)<13,(R[-1]C[5]+1),(1)),R[-1]C[5]) -> 11 | M81: =RC[-2]&RC[-1] -> 202011 | N81: =IF((R[-1]C[5]+1)<=VLOOKUP(R[-1]C[4],C7:C8,2,FALSE),(R[-1]C[5]+1),1) -> 16 | P81: =IF(AND(RC[1]=1,RC[3]<7),RC[-5]+1,RC[-5]) -> 2020 | Q81: =IF(RC[2]<7,IF((RC[-5]+1)<13,(RC[-5]+1),(1)),RC[-5]) -> 11 | R81: =RC[-2]&RC[-1] -> 202011 | S81: =IF((RC[-5]+6)<=VLOOKUP(RC[-6],C7:C8,2,FALSE),(RC[-5]+6),(RC[-5]+6)-VLOOKUP(RC[-6],C7:C8,2,FALSE)) -> 22 | U81: 76 | W81: =RC[-12]&R1C19&RC[-11]&R1C19&RC[-9]&",0,0,0" -> 2020,11,16,0,0,0 | X81: =RC[-8]&R1C19&RC[-7]&R1C19&RC[-5]&",23,59,59" -> 2020,11,22,23,59,59
E82: =R[-12]C+1 -> 2025 | F82: =R[-12]C -> 5 | G82: =RC[-2]&RC[-1] -> 20255 | H82: 31 | K82: =IF(AND(RC[1]=1,RC[3]=1),R[-1]C[5]+1,R[-1]C[5]) -> 2020 | L82: =IF(RC[2]=1,IF((R[-1]C[5]+1)<13,(R[-1]C[5]+1),(1)),R[-1]C[5]) -> 11 | M82: =RC[-2]&RC[-1] -> 202011 | N82: =IF((R[-1]C[5]+1)<=VLOOKUP(R[-1]C[4],C7:C8,2,FALSE),(R[-1]C[5]+1),1) -> 23 | P82: =IF(AND(RC[1]=1,RC[3]<7),RC[-5]+1,RC[-5]) -> 2020 | Q82: =IF(RC[2]<7,IF((RC[-5]+1)<13,(RC[-5]+1),(1)),RC[-5]) -> 11 | R82: =RC[-2]&RC[-1] -> 202011 | S82: =IF((RC[-5]+6)<=VLOOKUP(RC[-6],C7:C8,2,FALSE),(RC[-5]+6),(RC[-5]+6)-VLOOKUP(RC[-6],C7:C8,2,FALSE)) -> 29 | U82: 77 | W82: =RC[-12]&R1C19&RC[-11]&R1C19&RC[-9]&",0,0,0" -> 2020,11,23,0,0,0 | X82: =RC[-8]&R1C19&RC[-7]&R1C19&RC[-5]&",23,59,59" -> 2020,11,29,23,59,59
E83: =R[-12]C+1 -> 2025 | F83: =R[-12]C -> 6 | G83: =RC[-2]&RC[-1] -> 20256 | H83: 30 | K83: =IF(AND(RC[1]=1,RC[3]=1),R[-1]C[5]+1,R[-1]C[5]) -> 2020 | L83: =IF(RC[2]=1,IF((R[-1]C[5]+1)<13,(R[-1]C[5]+1),(1)),R[-1]C[5]) -> 11 | M83: =RC[-2]&RC[-1] -> 202011 | N83: =IF((R[-1]C[5]+1)<=VLOOKUP(R[-1]C[4],C7:C8,2,FALSE),(R[-1]C[5]+1),1) -> 30 | P83: =IF(AND(RC[1]=1,RC[3]<7),RC[-5]+1,RC[-5]) -> 2020 | Q83: =IF(RC[2]<7,IF((RC[-5]+1)<13,(RC[-5]+1),(1)),RC[-5]) -> 12 | R83: =RC[-2]&RC[-1] -> 202012 | S83: =IF((RC[-5]+6)<=VLOOKUP(RC[-6],C7:C8,2,FALSE),(RC[-5]+6),(RC[-5]+6)-VLOOKUP(RC[-6],C7:C8,2,FALSE)) -> 6 | U83: 78 | W83: =RC[-12]&R1C19&RC[-11]&R1C19&RC[-9]&",0,0,0" -> 2020,11,30,0,0,0 | X83: =RC[-8]&R1C19&RC[-7]&R1C19&RC[-5]&",23,59,59" -> 2020,12,6,23,59,59
E84: =R[-12]C+1 -> 2025 | F84: =R[-12]C -> 7 | G84: =RC[-2]&RC[-1] -> 20257 | H84: 31 | K84: =IF(AND(RC[1]=1,RC[3]=1),R[-1]C[5]+1,R[-1]C[5]) -> 2020 | L84: =IF(RC[2]=1,IF((R[-1]C[5]+1)<13,(R[-1]C[5]+1),(1)),R[-1]C[5]) -> 12 | M84: =RC[-2]&RC[-1] -> 202012 | N84: =IF((R[-1]C[5]+1)<=VLOOKUP(R[-1]C[4],C7:C8,2,FALSE),(R[-1]C[5]+1),1) -> 7 | P84: =IF(AND(RC[1]=1,RC[3]<7),RC[-5]+1,RC[-5]) -> 2020 | Q84: =IF(RC[2]<7,IF((RC[-5]+1)<13,(RC[-5]+1),(1)),RC[-5]) -> 12 | R84: =RC[-2]&RC[-1] -> 202012 | S84: =IF((RC[-5]+6)<=VLOOKUP(RC[-6],C7:C8,2,FALSE),(RC[-5]+6),(RC[-5]+6)-VLOOKUP(RC[-6],C7:C8,2,FALSE)) -> 13 | U84: 79 | W84: =RC[-12]&R1C19&RC[-11]&R1C19&RC[-9]&",0,0,0" -> 2020,12,7,0,0,0 | X84: =RC[-8]&R1C19&RC[-7]&R1C19&RC[-5]&",23,59,59" -> 2020,12,13,23,59,59
E85: =R[-12]C+1 -> 2025 | F85: =R[-12]C -> 8 | G85: =RC[-2]&RC[-1] -> 20258 | H85: 31 | K85: =IF(AND(RC[1]=1,RC[3]=1),R[-1]C[5]+1,R[-1]C[5]) -> 2020 | L85: =IF(RC[2]=1,IF((R[-1]C[5]+1)<13,(R[-1]C[5]+1),(1)),R[-1]C[5]) -> 12 | M85: =RC[-2]&RC[-1] -> 202012 | N85: =IF((R[-1]C[5]+1)<=VLOOKUP(R[-1]C[4],C7:C8,2,FALSE),(R[-1]C[5]+1),1) -> 14 | P85: =IF(AND(RC[1]=1,RC[3]<7),RC[-5]+1,RC[-5]) -> 2020 | Q85: =IF(RC[2]<7,IF((RC[-5]+1)<13,(RC[-5]+1),(1)),RC[-5]) -> 12 | R85: =RC[-2]&RC[-1] -> 202012 | S85: =IF((RC[-5]+6)<=VLOOKUP(RC[-6],C7:C8,2,FALSE),(RC[-5]+6),(RC[-5]+6)-VLOOKUP(RC[-6],C7:C8,2,FALSE)) -> 20 | U85: 80 | W85: =RC[-12]&R1C19&RC[-11]&R1C19&RC[-9]&",0,0,0" -> 2020,12,14,0,0,0 | X85: =RC[-8]&R1C19&RC[-7]&R1C19&RC[-5]&",23,59,59" -> 2020,12,20,23,59,59
E86: =R[-12]C+1 -> 2025 | F86: =R[-12]C -> 9 | G86: =RC[-2]&RC[-1] -> 20259 | H86: 30 | K86: =IF(AND(RC[1]=1,RC[3]=1),R[-1]C[5]+1,R[-1]C[5]) -> 2020 | L86: =IF(RC[2]=1,IF((R[-1]C[5]+1)<13,(R[-1]C[5]+1),(1)),R[-1]C[5]) -> 12 | M86: =RC[-2]&RC[-1] -> 202012 | N86: =IF((R[-1]C[5]+1)<=VLOOKUP(R[-1]C[4],C7:C8,2,FALSE),(R[-1]C[5]+1),1) -> 21 | P86: =IF(AND(RC[1]=1,RC[3]<7),RC[-5]+1,RC[-5]) -> 2020 | Q86: =IF(RC[2]<7,IF((RC[-5]+1)<13,(RC[-5]+1),(1)),RC[-5]) -> 12 | R86: =RC[-2]&RC[-1] -> 202012 | S86: =IF((RC[-5]+6)<=VLOOKUP(RC[-6],C7:C8,2,FALSE),(RC[-5]+6),(RC[-5]+6)-VLOOKUP(RC[-6],C7:C8,2,FALSE)) -> 27 | U86: 81 | W86: =RC[-12]&R1C19&RC[-11]&R1C19&RC[-9]&",0,0,0" -> 2020,12,21,0,0,0 | X86: =RC[-8]&R1C19&RC[-7]&R1C19&RC[-5]&",23,59,59" -> 2020,12,27,23,59,59
E87: =R[-12]C+1 -> 2025 | F87: =R[-12]C -> 10 | G87: =RC[-2]&RC[-1] -> 202510 | H87: 31 | K87: =IF(AND(RC[1]=1,RC[3]=1),R[-1]C[5]+1,R[-1]C[5]) -> 2020 | L87: =IF(RC[2]=1,IF((R[-1]C[5]+1)<13,(R[-1]C[5]+1),(1)),R[-1]C[5]) -> 12 | M87: =RC[-2]&RC[-1] -> 202012 | N87: =IF((R[-1]C[5]+1)<=VLOOKUP(R[-1]C[4],C7:C8,2,FALSE),(R[-1]C[5]+1),1) -> 28 | P87: =IF(AND(RC[1]=1,RC[3]<7),RC[-5]+1,RC[-5]) -> 2021 | Q87: =IF(RC[2]<7,IF((RC[-5]+1)<13,(RC[-5]+1),(1)),RC[-5]) -> 1 | R87: =RC[-2]&RC[-1] -> 20211 | S87: =IF((RC[-5]+6)<=VLOOKUP(RC[-6],C7:C8,2,FALSE),(RC[-5]+6),(RC[-5]+6)-VLOOKUP(RC[-6],C7:C8,2,FALSE)) -> 3 | U87: 82 | W87: =RC[-12]&R1C19&RC[-11]&R1C19&RC[-9]&",0,0,0" -> 2020,12,28,0,0,0 | X87: =RC[-8]&R1C19&RC[-7]&R1C19&RC[-5]&",23,59,59" -> 2021,1,3,23,59,59
E88: =R[-12]C+1 -> 2025 | F88: =R[-12]C -> 11 | G88: =RC[-2]&RC[-1] -> 202511 | H88: 30 | K88: =IF(AND(RC[1]=1,RC[3]=1),R[-1]C[5]+1,R[-1]C[5]) -> 2021 | L88: =IF(RC[2]=1,IF((R[-1]C[5]+1)<13,(R[-1]C[5]+1),(1)),R[-1]C[5]) -> 1 | M88: =RC[-2]&RC[-1] -> 20211 | N88: =IF((R[-1]C[5]+1)<=VLOOKUP(R[-1]C[4],C7:C8,2,FALSE),(R[-1]C[5]+1),1) -> 4 | P88: =IF(AND(RC[1]=1,RC[3]<7),RC[-5]+1,RC[-5]) -> 2021 | Q88: =IF(RC[2]<7,IF((RC[-5]+1)<13,(RC[-5]+1),(1)),RC[-5]) -> 1 | R88: =RC[-2]&RC[-1] -> 20211 | S88: =IF((RC[-5]+6)<=VLOOKUP(RC[-6],C7:C8,2,FALSE),(RC[-5]+6),(RC[-5]+6)-VLOOKUP(RC[-6],C7:C8,2,FALSE)) -> 10 | U88: 83 | W88: =RC[-12]&R1C19&RC[-11]&R1C19&RC[-9]&",0,0,0" -> 2021,1,4,0,0,0 | X88: =RC[-8]&R1C19&RC[-7]&R1C19&RC[-5]&",23,59,59" -> 2021,1,10,23,59,59
E89: =R[-12]C+1 -> 2025 | F89: =R[-12]C -> 12 | G89: =RC[-2]&RC[-1] -> 202512 | H89: 31 | K89: =IF(AND(RC[1]=1,RC[3]=1),R[-1]C[5]+1,R[-1]C[5]) -> 2021 | L89: =IF(RC[2]=1,IF((R[-1]C[5]+1)<13,(R[-1]C[5]+1),(1)),R[-1]C[5]) -> 1 | M89: =RC[-2]&RC[-1] -> 20211 | N89: =IF((R[-1]C[5]+1)<=VLOOKUP(R[-1]C[4],C7:C8,2,FALSE),(R[-1]C[5]+1),1) -> 11 | P89: =IF(AND(RC[1]=1,RC[3]<7),RC[-5]+1,RC[-5]) -> 2021 | Q89: =IF(RC[2]<7,IF((RC[-5]+1)<13,(RC[-5]+1),(1)),RC[-5]) -> 1 | R89: =RC[-2]&RC[-1] -> 20211 | S89: =IF((RC[-5]+6)<=VLOOKUP(RC[-6],C7:C8,2,FALSE),(RC[-5]+6),(RC[-5]+6)-VLOOKUP(RC[-6],C7:C8,2,FALSE)) -> 17 | U89: 84 | W89: =RC[-12]&R1C19&RC[-11]&R1C19&RC[-9]&",0,0,0" -> 2021,1,11,0,0,0 | X89: =RC[-8]&R1C19&RC[-7]&R1C19&RC[-5]&",23,59,59" -> 2021,1,17,23,59,59
K90: =IF(AND(RC[1]=1,RC[3]=1),R[-1]C[5]+1,R[-1]C[5]) -> 2021 | L90: =IF(RC[2]=1,IF((R[-1]C[5]+1)<13,(R[-1]C[5]+1),(1)),R[-1]C[5]) -> 1 | M90: =RC[-2]&RC[-1] -> 20211 | N90: =IF((R[-1]C[5]+1)<=VLOOKUP(R[-1]C[4],C7:C8,2,FALSE),(R[-1]C[5]+1),1) -> 18 | P90: =IF(AND(RC[1]=1,RC[3]<7),RC[-5]+1,RC[-5]) -> 2021 | Q90: =IF(RC[2]<7,IF((RC[-5]+1)<13,(RC[-5]+1),(1)),RC[-5]) -> 1 | R90: =RC[-2]&RC[-1] -> 20211 | S90: =IF((RC[-5]+6)<=VLOOKUP(RC[-6],C7:C8,2,FALSE),(RC[-5]+6),(RC[-5]+6)-VLOOKUP(RC[-6],C7:C8,2,FALSE)) -> 24 | U90: 85 | W90: =RC[-12]&R1C19&RC[-11]&R1C19&RC[-9]&",0,0,0" -> 2021,1,18,0,0,0 | X90: =RC[-8]&R1C19&RC[-7]&R1C19&RC[-5]&",23,59,59" -> 2021,1,24,23,59,59
K91: =IF(AND(RC[1]=1,RC[3]=1),R[-1]C[5]+1,R[-1]C[5]) -> 2021 | L91: =IF(RC[2]=1,IF((R[-1]C[5]+1)<13,(R[-1]C[5]+1),(1)),R[-1]C[5]) -> 1 | M91: =RC[-2]&RC[-1] -> 20211 | N91: =IF((R[-1]C[5]+1)<=VLOOKUP(R[-1]C[4],C7:C8,2,FALSE),(R[-1]C[5]+1),1) -> 25 | P91: =IF(AND(RC[1]=1,RC[3]<7),RC[-5]+1,RC[-5]) -> 2021 | Q91: =IF(RC[2]<7,IF((RC[-5]+1)<13,(RC[-5]+1),(1)),RC[-5]) -> 1 | R91: =RC[-2]&RC[-1] -> 20211 | S91: =IF((RC[-5]+6)<=VLOOKUP(RC[-6],C7:C8,2,FALSE),(RC[-5]+6),(RC[-5]+6)-VLOOKUP(RC[-6],C7:C8,2,FALSE)) -> 31 | U91: 86 | W91: =RC[-12]&R1C19&RC[-11]&R1C19&RC[-9]&",0,0,0" -> 2021,1,25,0,0,0 | X91: =RC[-8]&R1C19&RC[-7]&R1C19&RC[-5]&",23,59,59" -> 2021,1,31,23,59,59
K92: =IF(AND(RC[1]=1,RC[3]=1),R[-1]C[5]+1,R[-1]C[5]) -> 2021 | L92: =IF(RC[2]=1,IF((R[-1]C[5]+1)<13,(R[-1]C[5]+1),(1)),R[-1]C[5]) -> 2 | M92: =RC[-2]&RC[-1] -> 20212 | N92: =IF((R[-1]C[5]+1)<=VLOOKUP(R[-1]C[4],C7:C8,2,FALSE),(R[-1]C[5]+1),1) -> 1 | P92: =IF(AND(RC[1]=1,RC[3]<7),RC[-5]+1,RC[-5]) -> 2021 | Q92: =IF(RC[2]<7,IF((RC[-5]+1)<13,(RC[-5]+1),(1)),RC[-5]) -> 2 | R92: =RC[-2]&RC[-1] -> 20212 | S92: =IF((RC[-5]+6)<=VLOOKUP(RC[-6],C7:C8,2,FALSE),(RC[-5]+6),(RC[-5]+6)-VLOOKUP(RC[-6],C7:C8,2,FALSE)) -> 7 | U92: 87 | W92: =RC[-12]&R1C19&RC[-11]&R1C19&RC[-9]&",0,0,0" -> 2021,2,1,0,0,0 | X92: =RC[-8]&R1C19&RC[-7]&R1C19&RC[-5]&",23,59,59" -> 2021,2,7,23,59,59
K93: =IF(AND(RC[1]=1,RC[3]=1),R[-1]C[5]+1,R[-1]C[5]) -> 2021 | L93: =IF(RC[2]=1,IF((R[-1]C[5]+1)<13,(R[-1]C[5]+1),(1)),R[-1]C[5]) -> 2 | M93: =RC[-2]&RC[-1] -> 20212 | N93: =IF((R[-1]C[5]+1)<=VLOOKUP(R[-1]C[4],C7:C8,2,FALSE),(R[-1]C[5]+1),1) -> 8 | P93: =IF(AND(RC[1]=1,RC[3]<7),RC[-5]+1,RC[-5]) -> 2021 | Q93: =IF(RC[2]<7,IF((RC[-5]+1)<13,(RC[-5]+1),(1)),RC[-5]) -> 2 | R93: =RC[-2]&RC[-1] -> 20212 | S93: =IF((RC[-5]+6)<=VLOOKUP(RC[-6],C7:C8,2,FALSE),(RC[-5]+6),(RC[-5]+6)-VLOOKUP(RC[-6],C7:C8,2,FALSE)) -> 14 | U93: 88 | W93: =RC[-12]&R1C19&RC[-11]&R1C19&RC[-9]&",0,0,0" -> 2021,2,8,0,0,0 | X93: =RC[-8]&R1C19&RC[-7]&R1C19&RC[-5]&",23,59,59" -> 2021,2,14,23,59,59
K94: =IF(AND(RC[1]=1,RC[3]=1),R[-1]C[5]+1,R[-1]C[5]) -> 2021 | L94: =IF(RC[2]=1,IF((R[-1]C[5]+1)<13,(R[-1]C[5]+1),(1)),R[-1]C[5]) -> 2 | M94: =RC[-2]&RC[-1] -> 20212 | N94: =IF((R[-1]C[5]+1)<=VLOOKUP(R[-1]C[4],C7:C8,2,FALSE),(R[-1]C[5]+1),1) -> 15 | P94: =IF(AND(RC[1]=1,RC[3]<7),RC[-5]+1,RC[-5]) -> 2021 | Q94: =IF(RC[2]<7,IF((RC[-5]+1)<13,(RC[-5]+1),(1)),RC[-5]) -> 2 | R94: =RC[-2]&RC[-1] -> 20212 | S94: =IF((RC[-5]+6)<=VLOOKUP(RC[-6],C7:C8,2,FALSE),(RC[-5]+6),(RC[-5]+6)-VLOOKUP(RC[-6],C7:C8,2,FALSE)) -> 21 | U94: 89 | W94: =RC[-12]&R1C19&RC[-11]&R1C19&RC[-9]&",0,0,0" -> 2021,2,15,0,0,0 | X94: =RC[-8]&R1C19&RC[-7]&R1C19&RC[-5]&",23,59,59" -> 2021,2,21,23,59,59
K95: =IF(AND(RC[1]=1,RC[3]=1),R[-1]C[5]+1,R[-1]C[5]) -> 2021 | L95: =IF(RC[2]=1,IF((R[-1]C[5]+1)<13,(R[-1]C[5]+1),(1)),R[-1]C[5]) -> 2 | M95: =RC[-2]&RC[-1] -> 20212 | N95: =IF((R[-1]C[5]+1)<=VLOOKUP(R[-1]C[4],C7:C8,2,FALSE),(R[-1]C[5]+1),1) -> 22 | P95: =IF(AND(RC[1]=1,RC[3]<7),RC[-5]+1,RC[-5]) -> 2021 | Q95: =IF(RC[2]<7,IF((RC[-5]+1)<13,(RC[-5]+1),(1)),RC[-5]) -> 2 | R95: =RC[-2]&RC[-1] -> 20212 | S95: =IF((RC[-5]+6)<=VLOOKUP(RC[-6],C7:C8,2,FALSE),(RC[-5]+6),(RC[-5]+6)-VLOOKUP(RC[-6],C7:C8,2,FALSE)) -> 28 | U95: 90 | W95: =RC[-12]&R1C19&RC[-11]&R1C19&RC[-9]&",0,0,0" -> 2021,2,22,0,0,0 | X95: =RC[-8]&R1C19&RC[-7]&R1C19&RC[-5]&",23,59,59" -> 2021,2,28,23,59,59
K96: =IF(AND(RC[1]=1,RC[3]=1),R[-1]C[5]+1,R[-1]C[5]) -> 2021 | L96: =IF(RC[2]=1,IF((R[-1]C[5]+1)<13,(R[-1]C[5]+1),(1)),R[-1]C[5]) -> 3 | M96: =RC[-2]&RC[-1] -> 20213 | N96: =IF((R[-1]C[5]+1)<=VLOOKUP(R[-1]C[4],C7:C8,2,FALSE),(R[-1]C[5]+1),1) -> 1 | P96: =IF(AND(RC[1]=1,RC[3]<7),RC[-5]+1,RC[-5]) -> 2021 | Q96: =IF(RC[2]<7,IF((RC[-5]+1)<13,(RC[-5]+1),(1)),RC[-5]) -> 3 | R96: =RC[-2]&RC[-1] -> 20213 | S96: =IF((RC[-5]+6)<=VLOOKUP(RC[-6],C7:C8,2,FALSE),(RC[-5]+6),(RC[-5]+6)-VLOOKUP(RC[-6],C7:C8,2,FALSE)) -> 7 | U96: 91 | W96: =RC[-12]&R1C19&RC[-11]&R1C19&RC[-9]&",0,0,0" -> 2021,3,1,0,0,0 | X96: =RC[-8]&R1C19&RC[-7]&R1C19&RC[-5]&",23,59,59" -> 2021,3,7,23,59,59
K97: =IF(AND(RC[1]=1,RC[3]=1),R[-1]C[5]+1,R[-1]C[5]) -> 2021 | L97: =IF(RC[2]=1,IF((R[-1]C[5]+1)<13,(R[-1]C[5]+1),(1)),R[-1]C[5]) -> 3 | M97: =RC[-2]&RC[-1] -> 20213 | N97: =IF((R[-1]C[5]+1)<=VLOOKUP(R[-1]C[4],C7:C8,2,FALSE),(R[-1]C[5]+1),1) -> 8 | P97: =IF(AND(RC[1]=1,RC[3]<7),RC[-5]+1,RC[-5]) -> 2021 | Q97: =IF(RC[2]<7,IF((RC[-5]+1)<13,(RC[-5]+1),(1)),RC[-5]) -> 3 | R97: =RC[-2]&RC[-1] -> 20213 | S97: =IF((RC[-5]+6)<=VLOOKUP(RC[-6],C7:C8,2,FALSE),(RC[-5]+6),(RC[-5]+6)-VLOOKUP(RC[-6],C7:C8,2,FALSE)) -> 14 | U97: 92 | W97: =RC[-12]&R1C19&RC[-11]&R1C19&RC[-9]&",0,0,0" -> 2021,3,8,0,0,0 | X97: =RC[-8]&R1C19&RC[-7]&R1C19&RC[-5]&",23,59,59" -> 2021,3,14,23,59,59
K98: =IF(AND(RC[1]=1,RC[3]=1),R[-1]C[5]+1,R[-1]C[5]) -> 2021 | L98: =IF(RC[2]=1,IF((R[-1]C[5]+1)<13,(R[-1]C[5]+1),(1)),R[-1]C[5]) -> 3 | M98: =RC[-2]&RC[-1] -> 20213 | N98: =IF((R[-1]C[5]+1)<=VLOOKUP(R[-1]C[4],C7:C8,2,FALSE),(R[-1]C[5]+1),1) -> 15 | P98: =IF(AND(RC[1]=1,RC[3]<7),RC[-5]+1,RC[-5]) -> 2021 | Q98: =IF(RC[2]<7,IF((RC[-5]+1)<13,(RC[-5]+1),(1)),RC[-5]) -> 3 | R98: =RC[-2]&RC[-1] -> 20213 | S98: =IF((RC[-5]+6)<=VLOOKUP(RC[-6],C7:C8,2,FALSE),(RC[-5]+6),(RC[-5]+6)-VLOOKUP(RC[-6],C7:C8,2,FALSE)) -> 21 | U98: 93 | W98: =RC[-12]&R1C19&RC[-11]&R1C19&RC[-9]&",0,0,0" -> 2021,3,15,0,0,0 | X98: =RC[-8]&R1C19&RC[-7]&R1C19&RC[-5]&",23,59,59" -> 2021,3,21,23,59,59
K99: =IF(AND(RC[1]=1,RC[3]=1),R[-1]C[5]+1,R[-1]C[5]) -> 2021 | L99: =IF(RC[2]=1,IF((R[-1]C[5]+1)<13,(R[-1]C[5]+1),(1)),R[-1]C[5]) -> 3 | M99: =RC[-2]&RC[-1] -> 20213 | N99: =IF((R[-1]C[5]+1)<=VLOOKUP(R[-1]C[4],C7:C8,2,FALSE),(R[-1]C[5]+1),1) -> 22 | P99: =IF(AND(RC[1]=1,RC[3]<7),RC[-5]+1,RC[-5]) -> 2021 | Q99: =IF(RC[2]<7,IF((RC[-5]+1)<13,(RC[-5]+1),(1)),RC[-5]) -> 3 | R99: =RC[-2]&RC[-1] -> 20213 | S99: =IF((RC[-5]+6)<=VLOOKUP(RC[-6],C7:C8,2,FALSE),(RC[-5]+6),(RC[-5]+6)-VLOOKUP(RC[-6],C7:C8,2,FALSE)) -> 28 | U99: 94 | W99: =RC[-12]&R1C19&RC[-11]&R1C19&RC[-9]&",0,0,0" -> 2021,3,22,0,0,0 | X99: =RC[-8]&R1C19&RC[-7]&R1C19&RC[-5]&",23,59,59" -> 2021,3,28,23,59,59
K100: =IF(AND(RC[1]=1,RC[3]=1),R[-1]C[5]+1,R[-1]C[5]) -> 2021 | L100: =IF(RC[2]=1,IF((R[-1]C[5]+1)<13,(R[-1]C[5]+1),(1)),R[-1]C[5]) -> 3 | M100: =RC[-2]&RC[-1] -> 20213 | N100: =IF((R[-1]C[5]+1)<=VLOOKUP(R[-1]C[4],C7:C8,2,FALSE),(R[-1]C[5]+1),1) -> 29 | P100: =IF(AND(RC[1]=1,RC[3]<7),RC[-5]+1,RC[-5]) -> 2021 | Q100: =IF(RC[2]<7,IF((RC[-5]+1)<13,(RC[-5]+1),(1)),RC[-5]) -> 4 | R100: =RC[-2]&RC[-1] -> 20214 | S100: =IF((RC[-5]+6)<=VLOOKUP(RC[-6],C7:C8,2,FALSE),(RC[-5]+6),(RC[-5]+6)-VLOOKUP(RC[-6],C7:C8,2,FALSE)) -> 4 | U100: 95 | W100: =RC[-12]&R1C19&RC[-11]&R1C19&RC[-9]&",0,0,0" -> 2021,3,29,0,0,0 | X100: =RC[-8]&R1C19&RC[-7]&R1C19&RC[-5]&",23,59,59" -> 2021,4,4,23,59,59
K101: =IF(AND(RC[1]=1,RC[3]=1),R[-1]C[5]+1,R[-1]C[5]) -> 2021 | L101: =IF(RC[2]=1,IF((R[-1]C[5]+1)<13,(R[-1]C[5]+1),(1)),R[-1]C[5]) -> 4 | M101: =RC[-2]&RC[-1] -> 20214 | N101: =IF((R[-1]C[5]+1)<=VLOOKUP(R[-1]C[4],C7:C8,2,FALSE),(R[-1]C[5]+1),1) -> 5 | P101: =IF(AND(RC[1]=1,RC[3]<7),RC[-5]+1,RC[-5]) -> 2021 | Q101: =IF(RC[2]<7,IF((RC[-5]+1)<13,(RC[-5]+1),(1)),RC[-5]) -> 4 | R101: =RC[-2]&RC[-1] -> 20214 | S101: =IF((RC[-5]+6)<=VLOOKUP(RC[-6],C7:C8,2,FALSE),(RC[-5]+6),(RC[-5]+6)-VLOOKUP(RC[-6],C7:C8,2,FALSE)) -> 11 | U101: 96 | W101: =RC[-12]&R1C19&RC[-11]&R1C19&RC[-9]&",0,0,0" -> 2021,4,5,0,0,0 | X101: =RC[-8]&R1C19&RC[-7]&R1C19&RC[-5]&",23,59,59" -> 2021,4,11,23,59,59
K102: =IF(AND(RC[1]=1,RC[3]=1),R[-1]C[5]+1,R[-1]C[5]) -> 2021 | L102: =IF(RC[2]=1,IF((R[-1]C[5]+1)<13,(R[-1]C[5]+1),(1)),R[-1]C[5]) -> 4 | M102: =RC[-2]&RC[-1] -> 20214 | N102: =IF((R[-1]C[5]+1)<=VLOOKUP(R[-1]C[4],C7:C8,2,FALSE),(R[-1]C[5]+1),1) -> 12 | P102: =IF(AND(RC[1]=1,RC[3]<7),RC[-5]+1,RC[-5]) -> 2021 | Q102: =IF(RC[2]<7,IF((RC[-5]+1)<13,(RC[-5]+1),(1)),RC[-5]) -> 4 | R102: =RC[-2]&RC[-1] -> 20214 | S102: =IF((RC[-5]+6)<=VLOOKUP(RC[-6],C7:C8,2,FALSE),(RC[-5]+6),(RC[-5]+6)-VLOOKUP(RC[-6],C7:C8,2,FALSE)) -> 18 | U102: 97 | W102: =RC[-12]&R1C19&RC[-11]&R1C19&RC[-9]&",0,0,0" -> 2021,4,12,0,0,0 | X102: =RC[-8]&R1C19&RC[-7]&R1C19&RC[-5]&",23,59,59" -> 2021,4,18,23,59,59
K103: =IF(AND(RC[1]=1,RC[3]=1),R[-1]C[5]+1,R[-1]C[5]) -> 2021 | L103: =IF(RC[2]=1,IF((R[-1]C[5]+1)<13,(R[-1]C[5]+1),(1)),R[-1]C[5]) -> 4 | M103: =RC[-2]&RC[-1] -> 20214 | N103: =IF((R[-1]C[5]+1)<=VLOOKUP(R[-1]C[4],C7:C8,2,FALSE),(R[-1]C[5]+1),1) -> 19 | P103: =IF(AND(RC[1]=1,RC[3]<7),RC[-5]+1,RC[-5]) -> 2021 | Q103: =IF(RC[2]<7,IF((RC[-5]+1)<13,(RC[-5]+1),(1)),RC[-5]) -> 4 | R103: =RC[-2]&RC[-1] -> 20214 | S103: =IF((RC[-5]+6)<=VLOOKUP(RC[-6],C7:C8,2,FALSE),(RC[-5]+6),(RC[-5]+6)-VLOOKUP(RC[-6],C7:C8,2,FALSE)) -> 25 | U103: 98 | W103: =RC[-12]&R1C19&RC[-11]&R1C19&RC[-9]&",0,0,0" -> 2021,4,19,0,0,0 | X103: =RC[-8]&R1C19&RC[-7]&R1C19&RC[-5]&",23,59,59" -> 2021,4,25,23,59,59
K104: =IF(AND(RC[1]=1,RC[3]=1),R[-1]C[5]+1,R[-1]C[5]) -> 2021 | L104: =IF(RC[2]=1,IF((R[-1]C[5]+1)<13,(R[-1]C[5]+1),(1)),R[-1]C[5]) -> 4 | M104: =RC[-2]&RC[-1] -> 20214 | N104: =IF((R[-1]C[5]+1)<=VLOOKUP(R[-1]C[4],C7:C8,2,FALSE),(R[-1]C[5]+1),1) -> 26 | P104: =IF(AND(RC[1]=1,RC[3]<7),RC[-5]+1,RC[-5]) -> 2021 | Q104: =IF(RC[2]<7,IF((RC[-5]+1)<13,(RC[-5]+1),(1)),RC[-5]) -> 5 | R104: =RC[-2]&RC[-1] -> 20215 | S104: =IF((RC[-5]+6)<=VLOOKUP(RC[-6],C7:C8,2,FALSE),(RC[-5]+6),(RC[-5]+6)-VLOOKUP(RC[-6],C7:C8,2,FALSE)) -> 2 | U104: 99 | W104: =RC[-12]&R1C19&RC[-11]&R1C19&RC[-9]&",0,0,0" -> 2021,4,26,0,0,0 | X104: =RC[-8]&R1C19&RC[-7]&R1C19&RC[-5]&",23,59,59" -> 2021,5,2,23,59,59
K105: =IF(AND(RC[1]=1,RC[3]=1),R[-1]C[5]+1,R[-1]C[5]) -> 2021 | L105: =IF(RC[2]=1,IF((R[-1]C[5]+1)<13,(R[-1]C[5]+1),(1)),R[-1]C[5]) -> 5 | M105: =RC[-2]&RC[-1] -> 20215 | N105: =IF((R[-1]C[5]+1)<=VLOOKUP(R[-1]C[4],C7:C8,2,FALSE),(R[-1]C[5]+1),1) -> 3 | P105: =IF(AND(RC[1]=1,RC[3]<7),RC[-5]+1,RC[-5]) -> 2021 | Q105: =IF(RC[2]<7,IF((RC[-5]+1)<13,(RC[-5]+1),(1)),RC[-5]) -> 5 | R105: =RC[-2]&RC[-1] -> 20215 | S105: =IF((RC[-5]+6)<=VLOOKUP(RC[-6],C7:C8,2,FALSE),(RC[-5]+6),(RC[-5]+6)-VLOOKUP(RC[-6],C7:C8,2,FALSE)) -> 9 | U105: 100 | W105: =RC[-12]&R1C19&RC[-11]&R1C19&RC[-9]&",0,0,0" -> 2021,5,3,0,0,0 | X105: =RC[-8]&R1C19&RC[-7]&R1C19&RC[-5]&",23,59,59" -> 2021,5,9,23,59,59
K106: =IF(AND(RC[1]=1,RC[3]=1),R[-1]C[5]+1,R[-1]C[5]) -> 2021 | L106: =IF(RC[2]=1,IF((R[-1]C[5]+1)<13,(R[-1]C[5]+1),(1)),R[-1]C[5]) -> 5 | M106: =RC[-2]&RC[-1] -> 20215 | N106: =IF((R[-1]C[5]+1)<=VLOOKUP(R[-1]C[4],C7:C8,2,FALSE),(R[-1]C[5]+1),1) -> 10 | P106: =IF(AND(RC[1]=1,RC[3]<7),RC[-5]+1,RC[-5]) -> 2021 | Q106: =IF(RC[2]<7,IF((RC[-5]+1)<13,(RC[-5]+1),(1)),RC[-5]) -> 5 | R106: =RC[-2]&RC[-1] -> 20215 | S106: =IF((RC[-5]+6)<=VLOOKUP(RC[-6],C7:C8,2,FALSE),(RC[-5]+6),(RC[-5]+6)-VLOOKUP(RC[-6],C7:C8,2,FALSE)) -> 16 | U106: 101 | W106: =RC[-12]&R1C19&RC[-11]&R1C19&RC[-9]&",0,0,0" -> 2021,5,10,0,0,0 | X106: =RC[-8]&R1C19&RC[-7]&R1C19&RC[-5]&",23,59,59" -> 2021,5,16,23,59,59
K107: =IF(AND(RC[1]=1,RC[3]=1),R[-1]C[5]+1,R[-1]C[5]) -> 2021 | L107: =IF(RC[2]=1,IF((R[-1]C[5]+1)<13,(R[-1]C[5]+1),(1)),R[-1]C[5]) -> 5 | M107: =RC[-2]&RC[-1] -> 20215 | N107: =IF((R[-1]C[5]+1)<=VLOOKUP(R[-1]C[4],C7:C8,2,FALSE),(R[-1]C[5]+1),1) -> 17 | P107: =IF(AND(RC[1]=1,RC[3]<7),RC[-5]+1,RC[-5]) -> 2021 | Q107: =IF(RC[2]<7,IF((RC[-5]+1)<13,(RC[-5]+1),(1)),RC[-5]) -> 5 | R107: =RC[-2]&RC[-1] -> 20215 | S107: =IF((RC[-5]+6)<=VLOOKUP(RC[-6],C7:C8,2,FALSE),(RC[-5]+6),(RC[-5]+6)-VLOOKUP(RC[-6],C7:C8,2,FALSE)) -> 23 | U107: 102 | W107: =RC[-12]&R1C19&RC[-11]&R1C19&RC[-9]&",0,0,0" -> 2021,5,17,0,0,0 | X107: =RC[-8]&R1C19&RC[-7]&R1C19&RC[-5]&",23,59,59" -> 2021,5,23,23,59,59
K108: =IF(AND(RC[1]=1,RC[3]=1),R[-1]C[5]+1,R[-1]C[5]) -> 2021 | L108: =IF(RC[2]=1,IF((R[-1]C[5]+1)<13,(R[-1]C[5]+1),(1)),R[-1]C[5]) -> 5 | M108: =RC[-2]&RC[-1] -> 20215 | N108: =IF((R[-1]C[5]+1)<=VLOOKUP(R[-1]C[4],C7:C8,2,FALSE),(R[-1]C[5]+1),1) -> 24 | P108: =IF(AND(RC[1]=1,RC[3]<7),RC[-5]+1,RC[-5]) -> 2021 | Q108: =IF(RC[2]<7,IF((RC[-5]+1)<13,(RC[-5]+1),(1)),RC[-5]) -> 5 | R108: =RC[-2]&RC[-1] -> 20215 | S108: =IF((RC[-5]+6)<=VLOOKUP(RC[-6],C7:C8,2,FALSE),(RC[-5]+6),(RC[-5]+6)-VLOOKUP(RC[-6],C7:C8,2,FALSE)) -> 30 | U108: 103 | W108: =RC[-12]&R1C19&RC[-11]&R1C19&RC[-9]&",0,0,0" -> 2021,5,24,0,0,0 | X108: =RC[-8]&R1C19&RC[-7]&R1C19&RC[-5]&",23,59,59" -> 2021,5,30,23,59,59
K109: =IF(AND(RC[1]=1,RC[3]=1),R[-1]C[5]+1,R[-1]C[5]) -> 2021 | L109: =IF(RC[2]=1,IF((R[-1]C[5]+1)<13,(R[-1]C[5]+1),(1)),R[-1]C[5]) -> 5 | M109: =RC[-2]&RC[-1] -> 20215 | N109: =IF((R[-1]C[5]+1)<=VLOOKUP(R[-1]C[4],C7:C8,2,FALSE),(R[-1]C[5]+1),1) -> 31 | P109: =IF(AND(RC[1]=1,RC[3]<7),RC[-5]+1,RC[-5]) -> 2021 | Q109: =IF(RC[2]<7,IF((RC[-5]+1)<13,(RC[-5]+1),(1)),RC[-5]) -> 6 | R109: =RC[-2]&RC[-1] -> 20216 | S109: =IF((RC[-5]+6)<=VLOOKUP(RC[-6],C7:C8,2,FALSE),(RC[-5]+6),(RC[-5]+6)-VLOOKUP(RC[-6],C7:C8,2,FALSE)) -> 6 | U109: 104 | W109: =RC[-12]&R1C19&RC[-11]&R1C19&RC[-9]&",0,0,0" -> 2021,5,31,0,0,0 | X109: =RC[-8]&R1C19&RC[-7]&R1C19&RC[-5]&",23,59,59" -> 2021,6,6,23,59,59
K110: =IF(AND(RC[1]=1,RC[3]=1),R[-1]C[5]+1,R[-1]C[5]) -> 2021 | L110: =IF(RC[2]=1,IF((R[-1]C[5]+1)<13,(R[-1]C[5]+1),(1)),R[-1]C[5]) -> 6 | M110: =RC[-2]&RC[-1] -> 20216 | N110: =IF((R[-1]C[5]+1)<=VLOOKUP(R[-1]C[4],C7:C8,2,FALSE),(R[-1]C[5]+1),1) -> 7 | P110: =IF(AND(RC[1]=1,RC[3]<7),RC[-5]+1,RC[-5]) -> 2021 | Q110: =IF(RC[2]<7,IF((RC[-5]+1)<13,(RC[-5]+1),(1)),RC[-5]) -> 6 | R110: =RC[-2]&RC[-1] -> 20216 | S110: =IF((RC[-5]+6)<=VLOOKUP(RC[-6],C7:C8,2,FALSE),(RC[-5]+6),(RC[-5]+6)-VLOOKUP(RC[-6],C7:C8,2,FALSE)) -> 13 | U110: 105 | W110: =RC[-12]&R1C19&RC[-11]&R1C19&RC[-9]&",0,0,0" -> 2021,6,7,0,0,0 | X110: =RC[-8]&R1C19&RC[-7]&R1C19&RC[-5]&",23,59,59" -> 2021,6,13,23,59,59
K111: =IF(AND(RC[1]=1,RC[3]=1),R[-1]C[5]+1,R[-1]C[5]) -> 2021 | L111: =IF(RC[2]=1,IF((R[-1]C[5]+1)<13,(R[-1]C[5]+1),(1)),R[-1]C[5]) -> 6 | M111: =RC[-2]&RC[-1] -> 20216 | N111: =IF((R[-1]C[5]+1)<=VLOOKUP(R[-1]C[4],C7:C8,2,FALSE),(R[-1]C[5]+1),1) -> 14 | P111: =IF(AND(RC[1]=1,RC[3]<7),RC[-5]+1,RC[-5]) -> 2021 | Q111: =IF(RC[2]<7,IF((RC[-5]+1)<13,(RC[-5]+1),(1)),RC[-5]) -> 6 | R111: =RC[-2]&RC[-1] -> 20216 | S111: =IF((RC[-5]+6)<=VLOOKUP(RC[-6],C7:C8,2,FALSE),(RC[-5]+6),(RC[-5]+6)-VLOOKUP(RC[-6],C7:C8,2,FALSE)) -> 20 | U111: 106 | W111: =RC[-12]&R1C19&RC[-11]&R1C19&RC[-9]&",0,0,0" -> 2021,6,14,0,0,0 | X111: =RC[-8]&R1C19&RC[-7]&R1C19&RC[-5]&",23,59,59" -> 2021,6,20,23,59,59
K112: =IF(AND(RC[1]=1,RC[3]=1),R[-1]C[5]+1,R[-1]C[5]) -> 2021 | L112: =IF(RC[2]=1,IF((R[-1]C[5]+1)<13,(R[-1]C[5]+1),(1)),R[-1]C[5]) -> 6 | M112: =RC[-2]&RC[-1] -> 20216 | N112: =IF((R[-1]C[5]+1)<=VLOOKUP(R[-1]C[4],C7:C8,2,FALSE),(R[-1]C[5]+1),1) -> 21 | P112: =IF(AND(RC[1]=1,RC[3]<7),RC[-5]+1,RC[-5]) -> 2021 | Q112: =IF(RC[2]<7,IF((RC[-5]+1)<13,(RC[-5]+1),(1)),RC[-5]) -> 6 | R112: =RC[-2]&RC[-1] -> 20216 | S112: =IF((RC[-5]+6)<=VLOOKUP(RC[-6],C7:C8,2,FALSE),(RC[-5]+6),(RC[-5]+6)-VLOOKUP(RC[-6],C7:C8,2,FALSE)) -> 27 | U112: 107 | W112: =RC[-12]&R1C19&RC[-11]&R1C19&RC[-9]&",0,0,0" -> 2021,6,21,0,0,0 | X112: =RC[-8]&R1C19&RC[-7]&R1C19&RC[-5]&",23,59,59" -> 2021,6,27,23,59,59
K113: =IF(AND(RC[1]=1,RC[3]=1),R[-1]C[5]+1,R[-1]C[5]) -> 2021 | L113: =IF(RC[2]=1,IF((R[-1]C[5]+1)<13,(R[-1]C[5]+1),(1)),R[-1]C[5]) -> 6 | M113: =RC[-2]&RC[-1] -> 20216 | N113: =IF((R[-1]C[5]+1)<=VLOOKUP(R[-1]C[4],C7:C8,2,FALSE),(R[-1]C[5]+1),1) -> 28 | P113: =IF(AND(RC[1]=1,RC[3]<7),RC[-5]+1,RC[-5]) -> 2021 | Q113: =IF(RC[2]<7,IF((RC[-5]+1)<13,(RC[-5]+1),(1)),RC[-5]) -> 7 | R113: =RC[-2]&RC[-1] -> 20217 | S113: =IF((RC[-5]+6)<=VLOOKUP(RC[-6],C7:C8,2,FALSE),(RC[-5]+6),(RC[-5]+6)-VLOOKUP(RC[-6],C7:C8,2,FALSE)) -> 4 | U113: 108 | W113: =RC[-12]&R1C19&RC[-11]&R1C19&RC[-9]&",0,0,0" -> 2021,6,28,0,0,0 | X113: =RC[-8]&R1C19&RC[-7]&R1C19&RC[-5]&",23,59,59" -> 2021,7,4,23,59,59
K114: =IF(AND(RC[1]=1,RC[3]=1),R[-1]C[5]+1,R[-1]C[5]) -> 2021 | L114: =IF(RC[2]=1,IF((R[-1]C[5]+1)<13,(R[-1]C[5]+1),(1)),R[-1]C[5]) -> 7 | M114: =RC[-2]&RC[-1] -> 20217 | N114: =IF((R[-1]C[5]+1)<=VLOOKUP(R[-1]C[4],C7:C8,2,FALSE),(R[-1]C[5]+1),1) -> 5 | P114: =IF(AND(RC[1]=1,RC[3]<7),RC[-5]+1,RC[-5]) -> 2021 | Q114: =IF(RC[2]<7,IF((RC[-5]+1)<13,(RC[-5]+1),(1)),RC[-5]) -> 7 | R114: =RC[-2]&RC[-1] -> 20217 | S114: =IF((RC[-5]+6)<=VLOOKUP(RC[-6],C7:C8,2,FALSE),(RC[-5]+6),(RC[-5]+6)-VLOOKUP(RC[-6],C7:C8,2,FALSE)) -> 11 | U114: 109 | W114: =RC[-12]&R1C19&RC[-11]&R1C19&RC[-9]&",0,0,0" -> 2021,7,5,0,0,0 | X114: =RC[-8]&R1C19&RC[-7]&R1C19&RC[-5]&",23,59,59" -> 2021,7,11,23,59,59
K115: =IF(AND(RC[1]=1,RC[3]=1),R[-1]C[5]+1,R[-1]C[5]) -> 2021 | L115: =IF(RC[2]=1,IF((R[-1]C[5]+1)<13,(R[-1]C[5]+1),(1)),R[-1]C[5]) -> 7 | M115: =RC[-2]&RC[-1] -> 20217 | N115: =IF((R[-1]C[5]+1)<=VLOOKUP(R[-1]C[4],C7:C8,2,FALSE),(R[-1]C[5]+1),1) -> 12 | P115: =IF(AND(RC[1]=1,RC[3]<7),RC[-5]+1,RC[-5]) -> 2021 | Q115: =IF(RC[2]<7,IF((RC[-5]+1)<13,(RC[-5]+1),(1)),RC[-5]) -> 7 | R115: =RC[-2]&RC[-1] -> 20217 | S115: =IF((RC[-5]+6)<=VLOOKUP(RC[-6],C7:C8,2,FALSE),(RC[-5]+6),(RC[-5]+6)-VLOOKUP(RC[-6],C7:C8,2,FALSE)) -> 18 | U115: 110 | W115: =RC[-12]&R1C19&RC[-11]&R1C19&RC[-9]&",0,0,0" -> 2021,7,12,0,0,0 | X115: =RC[-8]&R1C19&RC[-7]&R1C19&RC[-5]&",23,59,59" -> 2021,7,18,23,59,59
K116: =IF(AND(RC[1]=1,RC[3]=1),R[-1]C[5]+1,R[-1]C[5]) -> 2021 | L116: =IF(RC[2]=1,IF((R[-1]C[5]+1)<13,(R[-1]C[5]+1),(1)),R[-1]C[5]) -> 7 | M116: =RC[-2]&RC[-1] -> 20217 | N116: =IF((R[-1]C[5]+1)<=VLOOKUP(R[-1]C[4],C7:C8,2,FALSE),(R[-1]C[5]+1),1) -> 19 | P116: =IF(AND(RC[1]=1,RC[3]<7),RC[-5]+1,RC[-5]) -> 2021 | Q116: =IF(RC[2]<7,IF((RC[-5]+1)<13,(RC[-5]+1),(1)),RC[-5]) -> 7 | R116: =RC[-2]&RC[-1] -> 20217 | S116: =IF((RC[-5]+6)<=VLOOKUP(RC[-6],C7:C8,2,FALSE),(RC[-5]+6),(RC[-5]+6)-VLOOKUP(RC[-6],C7:C8,2,FALSE)) -> 25 | U116: 111 | W116: =RC[-12]&R1C19&RC[-11]&R1C19&RC[-9]&",0,0,0" -> 2021,7,19,0,0,0 | X116: =RC[-8]&R1C19&RC[-7]&R1C19&RC[-5]&",23,59,59" -> 2021,7,25,23,59,59
K117: =IF(AND(RC[1]=1,RC[3]=1),R[-1]C[5]+1,R[-1]C[5]) -> 2021 | L117: =IF(RC[2]=1,IF((R[-1]C[5]+1)<13,(R[-1]C[5]+1),(1)),R[-1]C[5]) -> 7 | M117: =RC[-2]&RC[-1] -> 20217 | N117: =IF((R[-1]C[5]+1)<=VLOOKUP(R[-1]C[4],C7:C8,2,FALSE),(R[-1]C[5]+1),1) -> 26 | P117: =IF(AND(RC[1]=1,RC[3]<7),RC[-5]+1,RC[-5]) -> 2021 | Q117: =IF(RC[2]<7,IF((RC[-5]+1)<13,(RC[-5]+1),(1)),RC[-5]) -> 8 | R117: =RC[-2]&RC[-1] -> 20218 | S117: =IF((RC[-5]+6)<=VLOOKUP(RC[-6],C7:C8,2,FALSE),(RC[-5]+6),(RC[-5]+6)-VLOOKUP(RC[-6],C7:C8,2,FALSE)) -> 1 | U117: 112 | W117: =RC[-12]&R1C19&RC[-11]&R1C19&RC[-9]&",0,0,0" -> 2021,7,26,0,0,0 | X117: =RC[-8]&R1C19&RC[-7]&R1C19&RC[-5]&",23,59,59" -> 2021,8,1,23,59,59
K118: =IF(AND(RC[1]=1,RC[3]=1),R[-1]C[5]+1,R[-1]C[5]) -> 2021 | L118: =IF(RC[2]=1,IF((R[-1]C[5]+1)<13,(R[-1]C[5]+1),(1)),R[-1]C[5]) -> 8 | M118: =RC[-2]&RC[-1] -> 20218 | N118: =IF((R[-1]C[5]+1)<=VLOOKUP(R[-1]C[4],C7:C8,2,FALSE),(R[-1]C[5]+1),1) -> 2 | P118: =IF(AND(RC[1]=1,RC[3]<7),RC[-5]+1,RC[-5]) -> 2021 | Q118: =IF(RC[2]<7,IF((RC[-5]+1)<13,(RC[-5]+1),(1)),RC[-5]) -> 8 | R118: =RC[-2]&RC[-1] -> 20218 | S118: =IF((RC[-5]+6)<=VLOOKUP(RC[-6],C7:C8,2,FALSE),(RC[-5]+6),(RC[-5]+6)-VLOOKUP(RC[-6],C7:C8,2,FALSE)) -> 8 | U118: 113 | W118: =RC[-12]&R1C19&RC[-11]&R1C19&RC[-9]&",0,0,0" -> 2021,8,2,0,0,0 | X118: =RC[-8]&R1C19&RC[-7]&R1C19&RC[-5]&",23,59,59" -> 2021,8,8,23,59,59
K119: =IF(AND(RC[1]=1,RC[3]=1),R[-1]C[5]+1,R[-1]C[5]) -> 2021 | L119: =IF(RC[2]=1,IF((R[-1]C[5]+1)<13,(R[-1]C[5]+1),(1)),R[-1]C[5]) -> 8 | M119: =RC[-2]&RC[-1] -> 20218 | N119: =IF((R[-1]C[5]+1)<=VLOOKUP(R[-1]C[4],C7:C8,2,FALSE),(R[-1]C[5]+1),1) -> 9 | P119: =IF(AND(RC[1]=1,RC[3]<7),RC[-5]+1,RC[-5]) -> 2021 | Q119: =IF(RC[2]<7,IF((RC[-5]+1)<13,(RC[-5]+1),(1)),RC[-5]) -> 8 | R119: =RC[-2]&RC[-1] -> 20218 | S119: =IF((RC[-5]+6)<=VLOOKUP(RC[-6],C7:C8,2,FALSE),(RC[-5]+6),(RC[-5]+6)-VLOOKUP(RC[-6],C7:C8,2,FALSE)) -> 15 | U119: 114 | W119: =RC[-12]&R1C19&RC[-11]&R1C19&RC[-9]&",0,0,0" -> 2021,8,9,0,0,0 | X119: =RC[-8]&R1C19&RC[-7]&R1C19&RC[-5]&",23,59,59" -> 2021,8,15,23,59,59
K120: =IF(AND(RC[1]=1,RC[3]=1),R[-1]C[5]+1,R[-1]C[5]) -> 2021 | L120: =IF(RC[2]=1,IF((R[-1]C[5]+1)<13,(R[-1]C[5]+1),(1)),R[-1]C[5]) -> 8 | M120: =RC[-2]&RC[-1] -> 20218 | N120: =IF((R[-1]C[5]+1)<=VLOOKUP(R[-1]C[4],C7:C8,2,FALSE),(R[-1]C[5]+1),1) -> 16 | P120: =IF(AND(RC[1]=1,RC[3]<7),RC[-5]+1,RC[-5]) -> 2021 | Q120: =IF(RC[2]<7,IF((RC[-5]+1)<13,(RC[-5]+1),(1)),RC[-5]) -> 8 | R120: =RC[-2]&RC[-1] -> 20218 | S120: =IF((RC[-5]+6)<=VLOOKUP(RC[-6],C7:C8,2,FALSE),(RC[-5]+6),(RC[-5]+6)-VLOOKUP(RC[-6],C7:C8,2,FALSE)) -> 22 | U120: 115 | W120: =RC[-12]&R1C19&RC[-11]&R1C19&RC[-9]&",0,0,0" -> 2021,8,16,0,0,0 | X120: =RC[-8]&R1C19&RC[-7]&R1C19&RC[-5]&",23,59,59" -> 2021,8,22,23,59,59
K121: =IF(AND(RC[1]=1,RC[3]=1),R[-1]C[5]+1,R[-1]C[5]) -> 2021 | L121: =IF(RC[2]=1,IF((R[-1]C[5]+1)<13,(R[-1]C[5]+1),(1)),R[-1]C[5]) -> 8 | M121: =RC[-2]&RC[-1] -> 20218 | N121: =IF((R[-1]C[5]+1)<=VLOOKUP(R[-1]C[4],C7:C8,2,FALSE),(R[-1]C[5]+1),1) -> 23 | P121: =IF(AND(RC[1]=1,RC[3]<7),RC[-5]+1,RC[-5]) -> 2021 | Q121: =IF(RC[2]<7,IF((RC[-5]+1)<13,(RC[-5]+1),(1)),RC[-5]) -> 8 | R121: =RC[-2]&RC[-1] -> 20218 | S121: =IF((RC[-5]+6)<=VLOOKUP(RC[-6],C7:C8,2,FALSE),(RC[-5]+6),(RC[-5]+6)-VLOOKUP(RC[-6],C7:C8,2,FALSE)) -> 29 | U121: 116 | W121: =RC[-12]&R1C19&RC[-11]&R1C19&RC[-9]&",0,0,0" -> 2021,8,23,0,0,0 | X121: =RC[-8]&R1C19&RC[-7]&R1C19&RC[-5]&",23,59,59" -> 2021,8,29,23,59,59
K122: =IF(AND(RC[1]=1,RC[3]=1),R[-1]C[5]+1,R[-1]C[5]) -> 2021 | L122: =IF(RC[2]=1,IF((R[-1]C[5]+1)<13,(R[-1]C[5]+1),(1)),R[-1]C[5]) -> 8 | M122: =RC[-2]&RC[-1] -> 20218 | N122: =IF((R[-1]C[5]+1)<=VLOOKUP(R[-1]C[4],C7:C8,2,FALSE),(R[-1]C[5]+1),1) -> 30 | P122: =IF(AND(RC[1]=1,RC[3]<7),RC[-5]+1,RC[-5]) -> 2021 | Q122: =IF(RC[2]<7,IF((RC[-5]+1)<13,(RC[-5]+1),(1)),RC[-5]) -> 9 | R122: =RC[-2]&RC[-1] -> 20219 | S122: =IF((RC[-5]+6)<=VLOOKUP(RC[-6],C7:C8,2,FALSE),(RC[-5]+6),(RC[-5]+6)-VLOOKUP(RC[-6],C7:C8,2,FALSE)) -> 5 | U122: 117 | W122: =RC[-12]&R1C19&RC[-11]&R1C19&RC[-9]&",0,0,0" -> 2021,8,30,0,0,0 | X122: =RC[-8]&R1C19&RC[-7]&R1C19&RC[-5]&",23,59,59" -> 2021,9,5,23,59,59
K123: =IF(AND(RC[1]=1,RC[3]=1),R[-1]C[5]+1,R[-1]C[5]) -> 2021 | L123: =IF(RC[2]=1,IF((R[-1]C[5]+1)<13,(R[-1]C[5]+1),(1)),R[-1]C[5]) -> 9 | M123: =RC[-2]&RC[-1] -> 20219 | N123: =IF((R[-1]C[5]+1)<=VLOOKUP(R[-1]C[4],C7:C8,2,FALSE),(R[-1]C[5]+1),1) -> 6 | P123: =IF(AND(RC[1]=1,RC[3]<7),RC[-5]+1,RC[-5]) -> 2021 | Q123: =IF(RC[2]<7,IF((RC[-5]+1)<13,(RC[-5]+1),(1)),RC[-5]) -> 9 | R123: =RC[-2]&RC[-1] -> 20219 | S123: =IF((RC[-5]+6)<=VLOOKUP(RC[-6],C7:C8,2,FALSE),(RC[-5]+6),(RC[-5]+6)-VLOOKUP(RC[-6],C7:C8,2,FALSE)) -> 12 | U123: 118 | W123: =RC[-12]&R1C19&RC[-11]&R1C19&RC[-9]&",0,0,0" -> 2021,9,6,0,0,0 | X123: =RC[-8]&R1C19&RC[-7]&R1C19&RC[-5]&",23,59,59" -> 2021,9,12,23,59,59
K124: =IF(AND(RC[1]=1,RC[3]=1),R[-1]C[5]+1,R[-1]C[5]) -> 2021 | L124: =IF(RC[2]=1,IF((R[-1]C[5]+1)<13,(R[-1]C[5]+1),(1)),R[-1]C[5]) -> 9 | M124: =RC[-2]&RC[-1] -> 20219 | N124: =IF((R[-1]C[5]+1)<=VLOOKUP(R[-1]C[4],C7:C8,2,FALSE),(R[-1]C[5]+1),1) -> 13 | P124: =IF(AND(RC[1]=1,RC[3]<7),RC[-5]+1,RC[-5]) -> 2021 | Q124: =IF(RC[2]<7,IF((RC[-5]+1)<13,(RC[-5]+1),(1)),RC[-5]) -> 9 | R124: =RC[-2]&RC[-1] -> 20219 | S124: =IF((RC[-5]+6)<=VLOOKUP(RC[-6],C7:C8,2,FALSE),(RC[-5]+6),(RC[-5]+6)-VLOOKUP(RC[-6],C7:C8,2,FALSE)) -> 19 | U124: 119 | W124: =RC[-12]&R1C19&RC[-11]&R1C19&RC[-9]&",0,0,0" -> 2021,9,13,0,0,0 | X124: =RC[-8]&R1C19&RC[-7]&R1C19&RC[-5]&",23,59,59" -> 2021,9,19,23,59,59
K125: =IF(AND(RC[1]=1,RC[3]=1),R[-1]C[5]+1,R[-1]C[5]) -> 2021 | L125: =IF(RC[2]=1,IF((R[-1]C[5]+1)<13,(R[-1]C[5]+1),(1)),R[-1]C[5]) -> 9 | M125: =RC[-2]&RC[-1] -> 20219 | N125: =IF((R[-1]C[5]+1)<=VLOOKUP(R[-1]C[4],C7:C8,2,FALSE),(R[-1]C[5]+1),1) -> 20 | P125: =IF(AND(RC[1]=1,RC[3]<7),RC[-5]+1,RC[-5]) -> 2021 | Q125: =IF(RC[2]<7,IF((RC[-5]+1)<13,(RC[-5]+1),(1)),RC[-5]) -> 9 | R125: =RC[-2]&RC[-1] -> 20219 | S125: =IF((RC[-5]+6)<=VLOOKUP(RC[-6],C7:C8,2,FALSE),(RC[-5]+6),(RC[-5]+6)-VLOOKUP(RC[-6],C7:C8,2,FALSE)) -> 26 | U125: 120 | W125: =RC[-12]&R1C19&RC[-11]&R1C19&RC[-9]&",0,0,0" -> 2021,9,20,0,0,0 | X125: =RC[-8]&R1C19&RC[-7]&R1C19&RC[-5]&",23,59,59" -> 2021,9,26,23,59,59
K126: =IF(AND(RC[1]=1,RC[3]=1),R[-1]C[5]+1,R[-1]C[5]) -> 2021 | L126: =IF(RC[2]=1,IF((R[-1]C[5]+1)<13,(R[-1]C[5]+1),(1)),R[-1]C[5]) -> 9 | M126: =RC[-2]&RC[-1] -> 20219 | N126: =IF((R[-1]C[5]+1)<=VLOOKUP(R[-1]C[4],C7:C8,2,FALSE),(R[-1]C[5]+1),1) -> 27 | P126: =IF(AND(RC[1]=1,RC[3]<7),RC[-5]+1,RC[-5]) -> 2021 | Q126: =IF(RC[2]<7,IF((RC[-5]+1)<13,(RC[-5]+1),(1)),RC[-5]) -> 10 | R126: =RC[-2]&RC[-1] -> 202110 | S126: =IF((RC[-5]+6)<=VLOOKUP(RC[-6],C7:C8,2,FALSE),(RC[-5]+6),(RC[-5]+6)-VLOOKUP(RC[-6],C7:C8,2,FALSE)) -> 3 | U126: 121 | W126: =RC[-12]&R1C19&RC[-11]&R1C19&RC[-9]&",0,0,0" -> 2021,9,27,0,0,0 | X126: =RC[-8]&R1C19&RC[-7]&R1C19&RC[-5]&",23,59,59" -> 2021,10,3,23,59,59
K127: =IF(AND(RC[1]=1,RC[3]=1),R[-1]C[5]+1,R[-1]C[5]) -> 2021 | L127: =IF(RC[2]=1,IF((R[-1]C[5]+1)<13,(R[-1]C[5]+1),(1)),R[-1]C[5]) -> 10 | M127: =RC[-2]&RC[-1] -> 202110 | N127: =IF((R[-1]C[5]+1)<=VLOOKUP(R[-1]C[4],C7:C8,2,FALSE),(R[-1]C[5]+1),1) -> 4 | P127: =IF(AND(RC[1]=1,RC[3]<7),RC[-5]+1,RC[-5]) -> 2021 | Q127: =IF(RC[2]<7,IF((RC[-5]+1)<13,(RC[-5]+1),(1)),RC[-5]) -> 10 | R127: =RC[-2]&RC[-1] -> 202110 | S127: =IF((RC[-5]+6)<=VLOOKUP(RC[-6],C7:C8,2,FALSE),(RC[-5]+6),(RC[-5]+6)-VLOOKUP(RC[-6],C7:C8,2,FALSE)) -> 10 | U127: 122 | W127: =RC[-12]&R1C19&RC[-11]&R1C19&RC[-9]&",0,0,0" -> 2021,10,4,0,0,0 | X127: =RC[-8]&R1C19&RC[-7]&R1C19&RC[-5]&",23,59,59" -> 2021,10,10,23,59,59
K128: =IF(AND(RC[1]=1,RC[3]=1),R[-1]C[5]+1,R[-1]C[5]) -> 2021 | L128: =IF(RC[2]=1,IF((R[-1]C[5]+1)<13,(R[-1]C[5]+1),(1)),R[-1]C[5]) -> 10 | M128: =RC[-2]&RC[-1] -> 202110 | N128: =IF((R[-1]C[5]+1)<=VLOOKUP(R[-1]C[4],C7:C8,2,FALSE),(R[-1]C[5]+1),1) -> 11 | P128: =IF(AND(RC[1]=1,RC[3]<7),RC[-5]+1,RC[-5]) -> 2021 | Q128: =IF(RC[2]<7,IF((RC[-5]+1)<13,(RC[-5]+1),(1)),RC[-5]) -> 10 | R128: =RC[-2]&RC[-1] -> 202110 | S128: =IF((RC[-5]+6)<=VLOOKUP(RC[-6],C7:C8,2,FALSE),(RC[-5]+6),(RC[-5]+6)-VLOOKUP(RC[-6],C7:C8,2,FALSE)) -> 17 | U128: 123 | W128: =RC[-12]&R1C19&RC[-11]&R1C19&RC[-9]&",0,0,0" -> 2021,10,11,0,0,0 | X128: =RC[-8]&R1C19&RC[-7]&R1C19&RC[-5]&",23,59,59" -> 2021,10,17,23,59,59
K129: =IF(AND(RC[1]=1,RC[3]=1),R[-1]C[5]+1,R[-1]C[5]) -> 2021 | L129: =IF(RC[2]=1,IF((R[-1]C[5]+1)<13,(R[-1]C[5]+1),(1)),R[-1]C[5]) -> 10 | M129: =RC[-2]&RC[-1] -> 202110 | N129: =IF((R[-1]C[5]+1)<=VLOOKUP(R[-1]C[4],C7:C8,2,FALSE),(R[-1]C[5]+1),1) -> 18 | P129: =IF(AND(RC[1]=1,RC[3]<7),RC[-5]+1,RC[-5]) -> 2021 | Q129: =IF(RC[2]<7,IF((RC[-5]+1)<13,(RC[-5]+1),(1)),RC[-5]) -> 10 | R129: =RC[-2]&RC[-1] -> 202110 | S129: =IF((RC[-5]+6)<=VLOOKUP(RC[-6],C7:C8,2,FALSE),(RC[-5]+6),(RC[-5]+6)-VLOOKUP(RC[-6],C7:C8,2,FALSE)) -> 24 | U129: 124 | W129: =RC[-12]&R1C19&RC[-11]&R1C19&RC[-9]&",0,0,0" -> 2021,10,18,0,0,0 | X129: =RC[-8]&R1C19&RC[-7]&R1C19&RC[-5]&",23,59,59" -> 2021,10,24,23,59,59
K130: =IF(AND(RC[1]=1,RC[3]=1),R[-1]C[5]+1,R[-1]C[5]) -> 2021 | L130: =IF(RC[2]=1,IF((R[-1]C[5]+1)<13,(R[-1]C[5]+1),(1)),R[-1]C[5]) -> 10 | M130: =RC[-2]&RC[-1] -> 202110 | N130: =IF((R[-1]C[5]+1)<=VLOOKUP(R[-1]C[4],C7:C8,2,FALSE),(R[-1]C[5]+1),1) -> 25 | P130: =IF(AND(RC[1]=1,RC[3]<7),RC[-5]+1,RC[-5]) -> 2021 | Q130: =IF(RC[2]<7,IF((RC[-5]+1)<13,(RC[-5]+1),(1)),RC[-5]) -> 10 | R130: =RC[-2]&RC[-1] -> 202110 | S130: =IF((RC[-5]+6)<=VLOOKUP(RC[-6],C7:C8,2,FALSE),(RC[-5]+6),(RC[-5]+6)-VLOOKUP(RC[-6],C7:C8,2,FALSE)) -> 31 | U130: 125 | W130: =RC[-12]&R1C19&RC[-11]&R1C19&RC[-9]&",0,0,0" -> 2021,10,25,0,0,0 | X130: =RC[-8]&R1C19&RC[-7]&R1C19&RC[-5]&",23,59,59" -> 2021,10,31,23,59,59
K131: =IF(AND(RC[1]=1,RC[3]=1),R[-1]C[5]+1,R[-1]C[5]) -> 2021 | L131: =IF(RC[2]=1,IF((R[-1]C[5]+1)<13,(R[-1]C[5]+1),(1)),R[-1]C[5]) -> 11 | M131: =RC[-2]&RC[-1] -> 202111 | N131: =IF((R[-1]C[5]+1)<=VLOOKUP(R[-1]C[4],C7:C8,2,FALSE),(R[-1]C[5]+1),1) -> 1 | P131: =IF(AND(RC[1]=1,RC[3]<7),RC[-5]+1,RC[-5]) -> 2021 | Q131: =IF(RC[2]<7,IF((RC[-5]+1)<13,(RC[-5]+1),(1)),RC[-5]) -> 11 | R131: =RC[-2]&RC[-1] -> 202111 | S131: =IF((RC[-5]+6)<=VLOOKUP(RC[-6],C7:C8,2,FALSE),(RC[-5]+6),(RC[-5]+6)-VLOOKUP(RC[-6],C7:C8,2,FALSE)) -> 7 | U131: 126 | W131: =RC[-12]&R1C19&RC[-11]&R1C19&RC[-9]&",0,0,0" -> 2021,11,1,0,0,0 | X131: =RC[-8]&R1C19&RC[-7]&R1C19&RC[-5]&",23,59,59" -> 2021,11,7,23,59,59
K132: =IF(AND(RC[1]=1,RC[3]=1),R[-1]C[5]+1,R[-1]C[5]) -> 2021 | L132: =IF(RC[2]=1,IF((R[-1]C[5]+1)<13,(R[-1]C[5]+1),(1)),R[-1]C[5]) -> 11 | M132: =RC[-2]&RC[-1] -> 202111 | N132: =IF((R[-1]C[5]+1)<=VLOOKUP(R[-1]C[4],C7:C8,2,FALSE),(R[-1]C[5]+1),1) -> 8 | P132: =IF(AND(RC[1]=1,RC[3]<7),RC[-5]+1,RC[-5]) -> 2021 | Q132: =IF(RC[2]<7,IF((RC[-5]+1)<13,(RC[-5]+1),(1)),RC[-5]) -> 11 | R132: =RC[-2]&RC[-1] -> 202111 | S132: =IF((RC[-5]+6)<=VLOOKUP(RC[-6],C7:C8,2,FALSE),(RC[-5]+6),(RC[-5]+6)-VLOOKUP(RC[-6],C7:C8,2,FALSE)) -> 14 | U132: 127 | W132: =RC[-12]&R1C19&RC[-11]&R1C19&RC[-9]&",0,0,0" -> 2021,11,8,0,0,0 | X132: =RC[-8]&R1C19&RC[-7]&R1C19&RC[-5]&",23,59,59" -> 2021,11,14,23,59,59
K133: =IF(AND(RC[1]=1,RC[3]=1),R[-1]C[5]+1,R[-1]C[5]) -> 2021 | L133: =IF(RC[2]=1,IF((R[-1]C[5]+1)<13,(R[-1]C[5]+1),(1)),R[-1]C[5]) -> 11 | M133: =RC[-2]&RC[-1] -> 202111 | N133: =IF((R[-1]C[5]+1)<=VLOOKUP(R[-1]C[4],C7:C8,2,FALSE),(R[-1]C[5]+1),1) -> 15 | P133: =IF(AND(RC[1]=1,RC[3]<7),RC[-5]+1,RC[-5]) -> 2021 | Q133: =IF(RC[2]<7,IF((RC[-5]+1)<13,(RC[-5]+1),(1)),RC[-5]) -> 11 | R133: =RC[-2]&RC[-1] -> 202111 | S133: =IF((RC[-5]+6)<=VLOOKUP(RC[-6],C7:C8,2,FALSE),(RC[-5]+6),(RC[-5]+6)-VLOOKUP(RC[-6],C7:C8,2,FALSE)) -> 21 | U133: 128 | W133: =RC[-12]&R1C19&RC[-11]&R1C19&RC[-9]&",0,0,0" -> 2021,11,15,0,0,0 | X133: =RC[-8]&R1C19&RC[-7]&R1C19&RC[-5]&",23,59,59" -> 2021,11,21,23,59,59
K134: =IF(AND(RC[1]=1,RC[3]=1),R[-1]C[5]+1,R[-1]C[5]) -> 2021 | L134: =IF(RC[2]=1,IF((R[-1]C[5]+1)<13,(R[-1]C[5]+1),(1)),R[-1]C[5]) -> 11 | M134: =RC[-2]&RC[-1] -> 202111 | N134: =IF((R[-1]C[5]+1)<=VLOOKUP(R[-1]C[4],C7:C8,2,FALSE),(R[-1]C[5]+1),1) -> 22 | P134: =IF(AND(RC[1]=1,RC[3]<7),RC[-5]+1,RC[-5]) -> 2021 | Q134: =IF(RC[2]<7,IF((RC[-5]+1)<13,(RC[-5]+1),(1)),RC[-5]) -> 11 | R134: =RC[-2]&RC[-1] -> 202111 | S134: =IF((RC[-5]+6)<=VLOOKUP(RC[-6],C7:C8,2,FALSE),(RC[-5]+6),(RC[-5]+6)-VLOOKUP(RC[-6],C7:C8,2,FALSE)) -> 28 | U134: 129 | W134: =RC[-12]&R1C19&RC[-11]&R1C19&RC[-9]&",0,0,0" -> 2021,11,22,0,0,0 | X134: =RC[-8]&R1C19&RC[-7]&R1C19&RC[-5]&",23,59,59" -> 2021,11,28,23,59,59
K135: =IF(AND(RC[1]=1,RC[3]=1),R[-1]C[5]+1,R[-1]C[5]) -> 2021 | L135: =IF(RC[2]=1,IF((R[-1]C[5]+1)<13,(R[-1]C[5]+1),(1)),R[-1]C[5]) -> 11 | M135: =RC[-2]&RC[-1] -> 202111 | N135: =IF((R[-1]C[5]+1)<=VLOOKUP(R[-1]C[4],C7:C8,2,FALSE),(R[-1]C[5]+1),1) -> 29 | P135: =IF(AND(RC[1]=1,RC[3]<7),RC[-5]+1,RC[-5]) -> 2021 | Q135: =IF(RC[2]<7,IF((RC[-5]+1)<13,(RC[-5]+1),(1)),RC[-5]) -> 12 | R135: =RC[-2]&RC[-1] -> 202112 | S135: =IF((RC[-5]+6)<=VLOOKUP(RC[-6],C7:C8,2,FALSE),(RC[-5]+6),(RC[-5]+6)-VLOOKUP(RC[-6],C7:C8,2,FALSE)) -> 5 | U135: 130 | W135: =RC[-12]&R1C19&RC[-11]&R1C19&RC[-9]&",0,0,0" -> 2021,11,29,0,0,0 | X135: =RC[-8]&R1C19&RC[-7]&R1C19&RC[-5]&",23,59,59" -> 2021,12,5,23,59,59
K136: =IF(AND(RC[1]=1,RC[3]=1),R[-1]C[5]+1,R[-1]C[5]) -> 2021 | L136: =IF(RC[2]=1,IF((R[-1]C[5]+1)<13,(R[-1]C[5]+1),(1)),R[-1]C[5]) -> 12 | M136: =RC[-2]&RC[-1] -> 202112 | N136: =IF((R[-1]C[5]+1)<=VLOOKUP(R[-1]C[4],C7:C8,2,FALSE),(R[-1]C[5]+1),1) -> 6 | P136: =IF(AND(RC[1]=1,RC[3]<7),RC[-5]+1,RC[-5]) -> 2021 | Q136: =IF(RC[2]<7,IF((RC[-5]+1)<13,(RC[-5]+1),(1)),RC[-5]) -> 12 | R136: =RC[-2]&RC[-1] -> 202112 | S136: =IF((RC[-5]+6)<=VLOOKUP(RC[-6],C7:C8,2,FALSE),(RC[-5]+6),(RC[-5]+6)-VLOOKUP(RC[-6],C7:C8,2,FALSE)) -> 12 | U136: 131 | W136: =RC[-12]&R1C19&RC[-11]&R1C19&RC[-9]&",0,0,0" -> 2021,12,6,0,0,0 | X136: =RC[-8]&R1C19&RC[-7]&R1C19&RC[-5]&",23,59,59" -> 2021,12,12,23,59,59
K137: =IF(AND(RC[1]=1,RC[3]=1),R[-1]C[5]+1,R[-1]C[5]) -> 2021 | L137: =IF(RC[2]=1,IF((R[-1]C[5]+1)<13,(R[-1]C[5]+1),(1)),R[-1]C[5]) -> 12 | M137: =RC[-2]&RC[-1] -> 202112 | N137: =IF((R[-1]C[5]+1)<=VLOOKUP(R[-1]C[4],C7:C8,2,FALSE),(R[-1]C[5]+1),1) -> 13 | P137: =IF(AND(RC[1]=1,RC[3]<7),RC[-5]+1,RC[-5]) -> 2021 | Q137: =IF(RC[2]<7,IF((RC[-5]+1)<13,(RC[-5]+1),(1)),RC[-5]) -> 12 | R137: =RC[-2]&RC[-1] -> 202112 | S137: =IF((RC[-5]+6)<=VLOOKUP(RC[-6],C7:C8,2,FALSE),(RC[-5]+6),(RC[-5]+6)-VLOOKUP(RC[-6],C7:C8,2,FALSE)) -> 19 | U137: 132 | W137: =RC[-12]&R1C19&RC[-11]&R1C19&RC[-9]&",0,0,0" -> 2021,12,13,0,0,0 | X137: =RC[-8]&R1C19&RC[-7]&R1C19&RC[-5]&",23,59,59" -> 2021,12,19,23,59,59
K138: =IF(AND(RC[1]=1,RC[3]=1),R[-1]C[5]+1,R[-1]C[5]) -> 2021 | L138: =IF(RC[2]=1,IF((R[-1]C[5]+1)<13,(R[-1]C[5]+1),(1)),R[-1]C[5]) -> 12 | M138: =RC[-2]&RC[-1] -> 202112 | N138: =IF((R[-1]C[5]+1)<=VLOOKUP(R[-1]C[4],C7:C8,2,FALSE),(R[-1]C[5]+1),1) -> 20 | P138: =IF(AND(RC[1]=1,RC[3]<7),RC[-5]+1,RC[-5]) -> 2021 | Q138: =IF(RC[2]<7,IF((RC[-5]+1)<13,(RC[-5]+1),(1)),RC[-5]) -> 12 | R138: =RC[-2]&RC[-1] -> 202112 | S138: =IF((RC[-5]+6)<=VLOOKUP(RC[-6],C7:C8,2,FALSE),(RC[-5]+6),(RC[-5]+6)-VLOOKUP(RC[-6],C7:C8,2,FALSE)) -> 26 | U138: 133 | W138: =RC[-12]&R1C19&RC[-11]&R1C19&RC[-9]&",0,0,0" -> 2021,12,20,0,0,0 | X138: =RC[-8]&R1C19&RC[-7]&R1C19&RC[-5]&",23,59,59" -> 2021,12,26,23,59,59
K139: =IF(AND(RC[1]=1,RC[3]=1),R[-1]C[5]+1,R[-1]C[5]) -> 2021 | L139: =IF(RC[2]=1,IF((R[-1]C[5]+1)<13,(R[-1]C[5]+1),(1)),R[-1]C[5]) -> 12 | M139: =RC[-2]&RC[-1] -> 202112 | N139: =IF((R[-1]C[5]+1)<=VLOOKUP(R[-1]C[4],C7:C8,2,FALSE),(R[-1]C[5]+1),1) -> 27 | P139: =IF(AND(RC[1]=1,RC[3]<7),RC[-5]+1,RC[-5]) -> 2022 | Q139: =IF(RC[2]<7,IF((RC[-5]+1)<13,(RC[-5]+1),(1)),RC[-5]) -> 1 | R139: =RC[-2]&RC[-1] -> 20221 | S139: =IF((RC[-5]+6)<=VLOOKUP(RC[-6],C7:C8,2,FALSE),(RC[-5]+6),(RC[-5]+6)-VLOOKUP(RC[-6],C7:C8,2,FALSE)) -> 2 | U139: 134 | W139: =RC[-12]&R1C19&RC[-11]&R1C19&RC[-9]&",0,0,0" -> 2021,12,27,0,0,0 | X139: =RC[-8]&R1C19&RC[-7]&R1C19&RC[-5]&",23,59,59" -> 2022,1,2,23,59,59
K140: =IF(AND(RC[1]=1,RC[3]=1),R[-1]C[5]+1,R[-1]C[5]) -> 2022 | L140: =IF(RC[2]=1,IF((R[-1]C[5]+1)<13,(R[-1]C[5]+1),(1)),R[-1]C[5]) -> 1 | M140: =RC[-2]&RC[-1] -> 20221 | N140: =IF((R[-1]C[5]+1)<=VLOOKUP(R[-1]C[4],C7:C8,2,FALSE),(R[-1]C[5]+1),1) -> 3 | P140: =IF(AND(RC[1]=1,RC[3]<7),RC[-5]+1,RC[-5]) -> 2022 | Q140: =IF(RC[2]<7,IF((RC[-5]+1)<13,(RC[-5]+1),(1)),RC[-5]) -> 1 | R140: =RC[-2]&RC[-1] -> 20221 | S140: =IF((RC[-5]+6)<=VLOOKUP(RC[-6],C7:C8,2,FALSE),(RC[-5]+6),(RC[-5]+6)-VLOOKUP(RC[-6],C7:C8,2,FALSE)) -> 9 | U140: 135 | W140: =RC[-12]&R1C19&RC[-11]&R1C19&RC[-9]&",0,0,0" -> 2022,1,3,0,0,0 | X140: =RC[-8]&R1C19&RC[-7]&R1C19&RC[-5]&",23,59,59" -> 2022,1,9,23,59,59
K141: =IF(AND(RC[1]=1,RC[3]=1),R[-1]C[5]+1,R[-1]C[5]) -> 2022 | L141: =IF(RC[2]=1,IF((R[-1]C[5]+1)<13,(R[-1]C[5]+1),(1)),R[-1]C[5]) -> 1 | M141: =RC[-2]&RC[-1] -> 20221 | N141: =IF((R[-1]C[5]+1)<=VLOOKUP(R[-1]C[4],C7:C8,2,FALSE),(R[-1]C[5]+1),1) -> 10 | P141: =IF(AND(RC[1]=1,RC[3]<7),RC[-5]+1,RC[-5]) -> 2022 | Q141: =IF(RC[2]<7,IF((RC[-5]+1)<13,(RC[-5]+1),(1)),RC[-5]) -> 1 | R141: =RC[-2]&RC[-1] -> 20221 | S141: =IF((RC[-5]+6)<=VLOOKUP(RC[-6],C7:C8,2,FALSE),(RC[-5]+6),(RC[-5]+6)-VLOOKUP(RC[-6],C7:C8,2,FALSE)) -> 16 | U141: 136 | W141: =RC[-12]&R1C19&RC[-11]&R1C19&RC[-9]&",0,0,0" -> 2022,1,10,0,0,0 | X141: =RC[-8]&R1C19&RC[-7]&R1C19&RC[-5]&",23,59,59" -> 2022,1,16,23,59,59
K142: =IF(AND(RC[1]=1,RC[3]=1),R[-1]C[5]+1,R[-1]C[5]) -> 2022 | L142: =IF(RC[2]=1,IF((R[-1]C[5]+1)<13,(R[-1]C[5]+1),(1)),R[-1]C[5]) -> 1 | M142: =RC[-2]&RC[-1] -> 20221 | N142: =IF((R[-1]C[5]+1)<=VLOOKUP(R[-1]C[4],C7:C8,2,FALSE),(R[-1]C[5]+1),1) -> 17 | P142: =IF(AND(RC[1]=1,RC[3]<7),RC[-5]+1,RC[-5]) -> 2022 | Q142: =IF(RC[2]<7,IF((RC[-5]+1)<13,(RC[-5]+1),(1)),RC[-5]) -> 1 | R142: =RC[-2]&RC[-1] -> 20221 | S142: =IF((RC[-5]+6)<=VLOOKUP(RC[-6],C7:C8,2,FALSE),(RC[-5]+6),(RC[-5]+6)-VLOOKUP(RC[-6],C7:C8,2,FALSE)) -> 23 | U142: 137 | W142: =RC[-12]&R1C19&RC[-11]&R1C19&RC[-9]&",0,0,0" -> 2022,1,17,0,0,0 | X142: =RC[-8]&R1C19&RC[-7]&R1C19&RC[-5]&",23,59,59" -> 2022,1,23,23,59,59
K143: =IF(AND(RC[1]=1,RC[3]=1),R[-1]C[5]+1,R[-1]C[5]) -> 2022 | L143: =IF(RC[2]=1,IF((R[-1]C[5]+1)<13,(R[-1]C[5]+1),(1)),R[-1]C[5]) -> 1 | M143: =RC[-2]&RC[-1] -> 20221 | N143: =IF((R[-1]C[5]+1)<=VLOOKUP(R[-1]C[4],C7:C8,2,FALSE),(R[-1]C[5]+1),1) -> 24 | P143: =IF(AND(RC[1]=1,RC[3]<7),RC[-5]+1,RC[-5]) -> 2022 | Q143: =IF(RC[2]<7,IF((RC[-5]+1)<13,(RC[-5]+1),(1)),RC[-5]) -> 1 | R143: =RC[-2]&RC[-1] -> 20221 | S143: =IF((RC[-5]+6)<=VLOOKUP(RC[-6],C7:C8,2,FALSE),(RC[-5]+6),(RC[-5]+6)-VLOOKUP(RC[-6],C7:C8,2,FALSE)) -> 30 | U143: 138 | W143: =RC[-12]&R1C19&RC[-11]&R1C19&RC[-9]&",0,0,0" -> 2022,1,24,0,0,0 | X143: =RC[-8]&R1C19&RC[-7]&R1C19&RC[-5]&",23,59,59" -> 2022,1,30,23,59,59
K144: =IF(AND(RC[1]=1,RC[3]=1),R[-1]C[5]+1,R[-1]C[5]) -> 2022 | L144: =IF(RC[2]=1,IF((R[-1]C[5]+1)<13,(R[-1]C[5]+1),(1)),R[-1]C[5]) -> 1 | M144: =RC[-2]&RC[-1] -> 20221 | N144: =IF((R[-1]C[5]+1)<=VLOOKUP(R[-1]C[4],C7:C8,2,FALSE),(R[-1]C[5]+1),1) -> 31 | P144: =IF(AND(RC[1]=1,RC[3]<7),RC[-5]+1,RC[-5]) -> 2022 | Q144: =IF(RC[2]<7,IF((RC[-5]+1)<13,(RC[-5]+1),(1)),RC[-5]) -> 2 | R144: =RC[-2]&RC[-1] -> 20222 | S144: =IF((RC[-5]+6)<=VLOOKUP(RC[-6],C7:C8,2,FALSE),(RC[-5]+6),(RC[-5]+6)-VLOOKUP(RC[-6],C7:C8,2,FALSE)) -> 6 | U144: 139 | W144: =RC[-12]&R1C19&RC[-11]&R1C19&RC[-9]&",0,0,0" -> 2022,1,31,0,0,0 | X144: =RC[-8]&R1C19&RC[-7]&R1C19&RC[-5]&",23,59,59" -> 2022,2,6,23,59,59
K145: =IF(AND(RC[1]=1,RC[3]=1),R[-1]C[5]+1,R[-1]C[5]) -> 2022 | L145: =IF(RC[2]=1,IF((R[-1]C[5]+1)<13,(R[-1]C[5]+1),(1)),R[-1]C[5]) -> 2 | M145: =RC[-2]&RC[-1] -> 20222 | N145: =IF((R[-1]C[5]+1)<=VLOOKUP(R[-1]C[4],C7:C8,2,FALSE),(R[-1]C[5]+1),1) -> 7 | P145: =IF(AND(RC[1]=1,RC[3]<7),RC[-5]+1,RC[-5]) -> 2022 | Q145: =IF(RC[2]<7,IF((RC[-5]+1)<13,(RC[-5]+1),(1)),RC[-5]) -> 2 | R145: =RC[-2]&RC[-1] -> 20222 | S145: =IF((RC[-5]+6)<=VLOOKUP(RC[-6],C7:C8,2,FALSE),(RC[-5]+6),(RC[-5]+6)-VLOOKUP(RC[-6],C7:C8,2,FALSE)) -> 13 | U145: 140 | W145: =RC[-12]&R1C19&RC[-11]&R1C19&RC[-9]&",0,0,0" -> 2022,2,7,0,0,0 | X145: =RC[-8]&R1C19&RC[-7]&R1C19&RC[-5]&",23,59,59" -> 2022,2,13,23,59,59
K146: =IF(AND(RC[1]=1,RC[3]=1),R[-1]C[5]+1,R[-1]C[5]) -> 2022 | L146: =IF(RC[2]=1,IF((R[-1]C[5]+1)<13,(R[-1]C[5]+1),(1)),R[-1]C[5]) -> 2 | M146: =RC[-2]&RC[-1] -> 20222 | N146: =IF((R[-1]C[5]+1)<=VLOOKUP(R[-1]C[4],C7:C8,2,FALSE),(R[-1]C[5]+1),1) -> 14 | P146: =IF(AND(RC[1]=1,RC[3]<7),RC[-5]+1,RC[-5]) -> 2022 | Q146: =IF(RC[2]<7,IF((RC[-5]+1)<13,(RC[-5]+1),(1)),RC[-5]) -> 2 | R146: =RC[-2]&RC[-1] -> 20222 | S146: =IF((RC[-5]+6)<=VLOOKUP(RC[-6],C7:C8,2,FALSE),(RC[-5]+6),(RC[-5]+6)-VLOOKUP(RC[-6],C7:C8,2,FALSE)) -> 20 | U146: 141 | W146: =RC[-12]&R1C19&RC[-11]&R1C19&RC[-9]&",0,0,0" -> 2022,2,14,0,0,0 | X146: =RC[-8]&R1C19&RC[-7]&R1C19&RC[-5]&",23,59,59" -> 2022,2,20,23,59,59
K147: =IF(AND(RC[1]=1,RC[3]=1),R[-1]C[5]+1,R[-1]C[5]) -> 2022 | L147: =IF(RC[2]=1,IF((R[-1]C[5]+1)<13,(R[-1]C[5]+1),(1)),R[-1]C[5]) -> 2 | M147: =RC[-2]&RC[-1] -> 20222 | N147: =IF((R[-1]C[5]+1)<=VLOOKUP(R[-1]C[4],C7:C8,2,FALSE),(R[-1]C[5]+1),1) -> 21 | P147: =IF(AND(RC[1]=1,RC[3]<7),RC[-5]+1,RC[-5]) -> 2022 | Q147: =IF(RC[2]<7,IF((RC[-5]+1)<13,(RC[-5]+1),(1)),RC[-5]) -> 2 | R147: =RC[-2]&RC[-1] -> 20222 | S147: =IF((RC[-5]+6)<=VLOOKUP(RC[-6],C7:C8,2,FALSE),(RC[-5]+6),(RC[-5]+6)-VLOOKUP(RC[-6],C7:C8,2,FALSE)) -> 27 | U147: 142 | W147: =RC[-12]&R1C19&RC[-11]&R1C19&RC[-9]&",0,0,0" -> 2022,2,21,0,0,0 | X147: =RC[-8]&R1C19&RC[-7]&R1C19&RC[-5]&",23,59,59" -> 2022,2,27,23,59,59
K148: =IF(AND(RC[1]=1,RC[3]=1),R[-1]C[5]+1,R[-1]C[5]) -> 2022 | L148: =IF(RC[2]=1,IF((R[-1]C[5]+1)<13,(R[-1]C[5]+1),(1)),R[-1]C[5]) -> 2 | M148: =RC[-2]&RC[-1] -> 20222 | N148: =IF((R[-1]C[5]+1)<=VLOOKUP(R[-1]C[4],C7:C8,2,FALSE),(R[-1]C[5]+1),1) -> 28 | P148: =IF(AND(RC[1]=1,RC[3]<7),RC[-5]+1,RC[-5]) -> 2022 | Q148: =IF(RC[2]<7,IF((RC[-5]+1)<13,(RC[-5]+1),(1)),RC[-5]) -> 3 | R148: =RC[-2]&RC[-1] -> 20223 | S148: =IF((RC[-5]+6)<=VLOOKUP(RC[-6],C7:C8,2,FALSE),(RC[-5]+6),(RC[-5]+6)-VLOOKUP(RC[-6],C7:C8,2,FALSE)) -> 6 | U148: 143 | W148: =RC[-12]&R1C19&RC[-11]&R1C19&RC[-9]&",0,0,0" -> 2022,2,28,0,0,0 | X148: =RC[-8]&R1C19&RC[-7]&R1C19&RC[-5]&",23,59,59" -> 2022,3,6,23,59,59
K149: =IF(AND(RC[1]=1,RC[3]=1),R[-1]C[5]+1,R[-1]C[5]) -> 2022 | L149: =IF(RC[2]=1,IF((R[-1]C[5]+1)<13,(R[-1]C[5]+1),(1)),R[-1]C[5]) -> 3 | M149: =RC[-2]&RC[-1] -> 20223 | N149: =IF((R[-1]C[5]+1)<=VLOOKUP(R[-1]C[4],C7:C8,2,FALSE),(R[-1]C[5]+1),1) -> 7 | P149: =IF(AND(RC[1]=1,RC[3]<7),RC[-5]+1,RC[-5]) -> 2022 | Q149: =IF(RC[2]<7,IF((RC[-5]+1)<13,(RC[-5]+1),(1)),RC[-5]) -> 3 | R149: =RC[-2]&RC[-1] -> 20223 | S149: =IF((RC[-5]+6)<=VLOOKUP(RC[-6],C7:C8,2,FALSE),(RC[-5]+6),(RC[-5]+6)-VLOOKUP(RC[-6],C7:C8,2,FALSE)) -> 13 | U149: 144 | W149: =RC[-12]&R1C19&RC[-11]&R1C19&RC[-9]&",0,0,0" -> 2022,3,7,0,0,0 | X149: =RC[-8]&R1C19&RC[-7]&R1C19&RC[-5]&",23,59,59" -> 2022,3,13,23,59,59
K150: =IF(AND(RC[1]=1,RC[3]=1),R[-1]C[5]+1,R[-1]C[5]) -> 2022 | L150: =IF(RC[2]=1,IF((R[-1]C[5]+1)<13,(R[-1]C[5]+1),(1)),R[-1]C[5]) -> 3 | M150: =RC[-2]&RC[-1] -> 20223 | N150: =IF((R[-1]C[5]+1)<=VLOOKUP(R[-1]C[4],C7:C8,2,FALSE),(R[-1]C[5]+1),1) -> 14 | P150: =IF(AND(RC[1]=1,RC[3]<7),RC[-5]+1,RC[-5]) -> 2022 | Q150: =IF(RC[2]<7,IF((RC[-5]+1)<13,(RC[-5]+1),(1)),RC[-5]) -> 3 | R150: =RC[-2]&RC[-1] -> 20223 | S150: =IF((RC[-5]+6)<=VLOOKUP(RC[-6],C7:C8,2,FALSE),(RC[-5]+6),(RC[-5]+6)-VLOOKUP(RC[-6],C7:C8,2,FALSE)) -> 20 | U150: 145 | W150: =RC[-12]&R1C19&RC[-11]&R1C19&RC[-9]&",0,0,0" -> 2022,3,14,0,0,0 | X150: =RC[-8]&R1C19&RC[-7]&R1C19&RC[-5]&",23,59,59" -> 2022,3,20,23,59,59
K151: =IF(AND(RC[1]=1,RC[3]=1),R[-1]C[5]+1,R[-1]C[5]) -> 2022 | L151: =IF(RC[2]=1,IF((R[-1]C[5]+1)<13,(R[-1]C[5]+1),(1)),R[-1]C[5]) -> 3 | M151: =RC[-2]&RC[-1] -> 20223 | N151: =IF((R[-1]C[5]+1)<=VLOOKUP(R[-1]C[4],C7:C8,2,FALSE),(R[-1]C[5]+1),1) -> 21 | P151: =IF(AND(RC[1]=1,RC[3]<7),RC[-5]+1,RC[-5]) -> 2022 | Q151: =IF(RC[2]<7,IF((RC[-5]+1)<13,(RC[-5]+1),(1)),RC[-5]) -> 3 | R151: =RC[-2]&RC[-1] -> 20223 | S151: =IF((RC[-5]+6)<=VLOOKUP(RC[-6],C7:C8,2,FALSE),(RC[-5]+6),(RC[-5]+6)-VLOOKUP(RC[-6],C7:C8,2,FALSE)) -> 27 | U151: 146 | W151: =RC[-12]&R1C19&RC[-11]&R1C19&RC[-9]&",0,0,0" -> 2022,3,21,0,0,0 | X151: =RC[-8]&R1C19&RC[-7]&R1C19&RC[-5]&",23,59,59" -> 2022,3,27,23,59,59
K152: =IF(AND(RC[1]=1,RC[3]=1),R[-1]C[5]+1,R[-1]C[5]) -> 2022 | L152: =IF(RC[2]=1,IF((R[-1]C[5]+1)<13,(R[-1]C[5]+1),(1)),R[-1]C[5]) -> 3 | M152: =RC[-2]&RC[-1] -> 20223 | N152: =IF((R[-1]C[5]+1)<=VLOOKUP(R[-1]C[4],C7:C8,2,FALSE),(R[-1]C[5]+1),1) -> 28 | P152: =IF(AND(RC[1]=1,RC[3]<7),RC[-5]+1,RC[-5]) -> 2022 | Q152: =IF(RC[2]<7,IF((RC[-5]+1)<13,(RC[-5]+1),(1)),RC[-5]) -> 4 | R152: =RC[-2]&RC[-1] -> 20224 | S152: =IF((RC[-5]+6)<=VLOOKUP(RC[-6],C7:C8,2,FALSE),(RC[-5]+6),(RC[-5]+6)-VLOOKUP(RC[-6],C7:C8,2,FALSE)) -> 3 | U152: 147 | W152: =RC[-12]&R1C19&RC[-11]&R1C19&RC[-9]&",0,0,0" -> 2022,3,28,0,0,0 | X152: =RC[-8]&R1C19&RC[-7]&R1C19&RC[-5]&",23,59,59" -> 2022,4,3,23,59,59
K153: =IF(AND(RC[1]=1,RC[3]=1),R[-1]C[5]+1,R[-1]C[5]) -> 2022 | L153: =IF(RC[2]=1,IF((R[-1]C[5]+1)<13,(R[-1]C[5]+1),(1)),R[-1]C[5]) -> 4 | M153: =RC[-2]&RC[-1] -> 20224 | N153: =IF((R[-1]C[5]+1)<=VLOOKUP(R[-1]C[4],C7:C8,2,FALSE),(R[-1]C[5]+1),1) -> 4 | P153: =IF(AND(RC[1]=1,RC[3]<7),RC[-5]+1,RC[-5]) -> 2022 | Q153: =IF(RC[2]<7,IF((RC[-5]+1)<13,(RC[-5]+1),(1)),RC[-5]) -> 4 | R153: =RC[-2]&RC[-1] -> 20224 | S153: =IF((RC[-5]+6)<=VLOOKUP(RC[-6],C7:C8,2,FALSE),(RC[-5]+6),(RC[-5]+6)-VLOOKUP(RC[-6],C7:C8,2,FALSE)) -> 10 | U153: 148 | W153: =RC[-12]&R1C19&RC[-11]&R1C19&RC[-9]&",0,0,0" -> 2022,4,4,0,0,0 | X153: =RC[-8]&R1C19&RC[-7]&R1C19&RC[-5]&",23,59,59" -> 2022,4,10,23,59,59
K154: =IF(AND(RC[1]=1,RC[3]=1),R[-1]C[5]+1,R[-1]C[5]) -> 2022 | L154: =IF(RC[2]=1,IF((R[-1]C[5]+1)<13,(R[-1]C[5]+1),(1)),R[-1]C[5]) -> 4 | M154: =RC[-2]&RC[-1] -> 20224 | N154: =IF((R[-1]C[5]+1)<=VLOOKUP(R[-1]C[4],C7:C8,2,FALSE),(R[-1]C[5]+1),1) -> 11 | P154: =IF(AND(RC[1]=1,RC[3]<7),RC[-5]+1,RC[-5]) -> 2022 | Q154: =IF(RC[2]<7,IF((RC[-5]+1)<13,(RC[-5]+1),(1)),RC[-5]) -> 4 | R154: =RC[-2]&RC[-1] -> 20224 | S154: =IF((RC[-5]+6)<=VLOOKUP(RC[-6],C7:C8,2,FALSE),(RC[-5]+6),(RC[-5]+6)-VLOOKUP(RC[-6],C7:C8,2,FALSE)) -> 17 | U154: 149 | W154: =RC[-12]&R1C19&RC[-11]&R1C19&RC[-9]&",0,0,0" -> 2022,4,11,0,0,0 | X154: =RC[-8]&R1C19&RC[-7]&R1C19&RC[-5]&",23,59,59" -> 2022,4,17,23,59,59
K155: =IF(AND(RC[1]=1,RC[3]=1),R[-1]C[5]+1,R[-1]C[5]) -> 2022 | L155: =IF(RC[2]=1,IF((R[-1]C[5]+1)<13,(R[-1]C[5]+1),(1)),R[-1]C[5]) -> 4 | M155: =RC[-2]&RC[-1] -> 20224 | N155: =IF((R[-1]C[5]+1)<=VLOOKUP(R[-1]C[4],C7:C8,2,FALSE),(R[-1]C[5]+1),1) -> 18 | P155: =IF(AND(RC[1]=1,RC[3]<7),RC[-5]+1,RC[-5]) -> 2022 | Q155: =IF(RC[2]<7,IF((RC[-5]+1)<13,(RC[-5]+1),(1)),RC[-5]) -> 4 | R155: =RC[-2]&RC[-1] -> 20224 | S155: =IF((RC[-5]+6)<=VLOOKUP(RC[-6],C7:C8,2,FALSE),(RC[-5]+6),(RC[-5]+6)-VLOOKUP(RC[-6],C7:C8,2,FALSE)) -> 24 | U155: 150 | W155: =RC[-12]&R1C19&RC[-11]&R1C19&RC[-9]&",0,0,0" -> 2022,4,18,0,0,0 | X155: =RC[-8]&R1C19&RC[-7]&R1C19&RC[-5]&",23,59,59" -> 2022,4,24,23,59,59
K156: =IF(AND(RC[1]=1,RC[3]=1),R[-1]C[5]+1,R[-1]C[5]) -> 2022 | L156: =IF(RC[2]=1,IF((R[-1]C[5]+1)<13,(R[-1]C[5]+1),(1)),R[-1]C[5]) -> 4 | M156: =RC[-2]&RC[-1] -> 20224 | N156: =IF((R[-1]C[5]+1)<=VLOOKUP(R[-1]C[4],C7:C8,2,FALSE),(R[-1]C[5]+1),1) -> 25 | P156: =IF(AND(RC[1]=1,RC[3]<7),RC[-5]+1,RC[-5]) -> 2022 | Q156: =IF(RC[2]<7,IF((RC[-5]+1)<13,(RC[-5]+1),(1)),RC[-5]) -> 5 | R156: =RC[-2]&RC[-1] -> 20225 | S156: =IF((RC[-5]+6)<=VLOOKUP(RC[-6],C7:C8,2,FALSE),(RC[-5]+6),(RC[-5]+6)-VLOOKUP(RC[-6],C7:C8,2,FALSE)) -> 1 | U156: 151 | W156: =RC[-12]&R1C19&RC[-11]&R1C19&RC[-9]&",0,0,0" -> 2022,4,25,0,0,0 | X156: =RC[-8]&R1C19&RC[-7]&R1C19&RC[-5]&",23,59,59" -> 2022,5,1,23,59,59
K157: =IF(AND(RC[1]=1,RC[3]=1),R[-1]C[5]+1,R[-1]C[5]) -> 2022 | L157: =IF(RC[2]=1,IF((R[-1]C[5]+1)<13,(R[-1]C[5]+1),(1)),R[-1]C[5]) -> 5 | M157: =RC[-2]&RC[-1] -> 20225 | N157: =IF((R[-1]C[5]+1)<=VLOOKUP(R[-1]C[4],C7:C8,2,FALSE),(R[-1]C[5]+1),1) -> 2 | P157: =IF(AND(RC[1]=1,RC[3]<7),RC[-5]+1,RC[-5]) -> 2022 | Q157: =IF(RC[2]<7,IF((RC[-5]+1)<13,(RC[-5]+1),(1)),RC[-5]) -> 5 | R157: =RC[-2]&RC[-1] -> 20225 | S157: =IF((RC[-5]+6)<=VLOOKUP(RC[-6],C7:C8,2,FALSE),(RC[-5]+6),(RC[-5]+6)-VLOOKUP(RC[-6],C7:C8,2,FALSE)) -> 8 | U157: 152 | W157: =RC[-12]&R1C19&RC[-11]&R1C19&RC[-9]&",0,0,0" -> 2022,5,2,0,0,0 | X157: =RC[-8]&R1C19&RC[-7]&R1C19&RC[-5]&",23,59,59" -> 2022,5,8,23,59,59
K158: =IF(AND(RC[1]=1,RC[3]=1),R[-1]C[5]+1,R[-1]C[5]) -> 2022 | L158: =IF(RC[2]=1,IF((R[-1]C[5]+1)<13,(R[-1]C[5]+1),(1)),R[-1]C[5]) -> 5 | M158: =RC[-2]&RC[-1] -> 20225 | N158: =IF((R[-1]C[5]+1)<=VLOOKUP(R[-1]C[4],C7:C8,2,FALSE),(R[-1]C[5]+1),1) -> 9 | P158: =IF(AND(RC[1]=1,RC[3]<7),RC[-5]+1,RC[-5]) -> 2022 | Q158: =IF(RC[2]<7,IF((RC[-5]+1)<13,(RC[-5]+1),(1)),RC[-5]) -> 5 | R158: =RC[-2]&RC[-1] -> 20225 | S158: =IF((RC[-5]+6)<=VLOOKUP(RC[-6],C7:C8,2,FALSE),(RC[-5]+6),(RC[-5]+6)-VLOOKUP(RC[-6],C7:C8,2,FALSE)) -> 15 | U158: 153 | W158: =RC[-12]&R1C19&RC[-11]&R1C19&RC[-9]&",0,0,0" -> 2022,5,9,0,0,0 | X158: =RC[-8]&R1C19&RC[-7]&R1C19&RC[-5]&",23,59,59" -> 2022,5,15,23,59,59
K159: =IF(AND(RC[1]=1,RC[3]=1),R[-1]C[5]+1,R[-1]C[5]) -> 2022 | L159: =IF(RC[2]=1,IF((R[-1]C[5]+1)<13,(R[-1]C[5]+1),(1)),R[-1]C[5]) -> 5 | M159: =RC[-2]&RC[-1] -> 20225 | N159: =IF((R[-1]C[5]+1)<=VLOOKUP(R[-1]C[4],C7:C8,2,FALSE),(R[-1]C[5]+1),1) -> 16 | P159: =IF(AND(RC[1]=1,RC[3]<7),RC[-5]+1,RC[-5]) -> 2022 | Q159: =IF(RC[2]<7,IF((RC[-5]+1)<13,(RC[-5]+1),(1)),RC[-5]) -> 5 | R159: =RC[-2]&RC[-1] -> 20225 | S159: =IF((RC[-5]+6)<=VLOOKUP(RC[-6],C7:C8,2,FALSE),(RC[-5]+6),(RC[-5]+6)-VLOOKUP(RC[-6],C7:C8,2,FALSE)) -> 22 | U159: 154 | W159: =RC[-12]&R1C19&RC[-11]&R1C19&RC[-9]&",0,0,0" -> 2022,5,16,0,0,0 | X159: =RC[-8]&R1C19&RC[-7]&R1C19&RC[-5]&",23,59,59" -> 2022,5,22,23,59,59
K160: =IF(AND(RC[1]=1,RC[3]=1),R[-1]C[5]+1,R[-1]C[5]) -> 2022 | L160: =IF(RC[2]=1,IF((R[-1]C[5]+1)<13,(R[-1]C[5]+1),(1)),R[-1]C[5]) -> 5 | M160: =RC[-2]&RC[-1] -> 20225 | N160: =IF((R[-1]C[5]+1)<=VLOOKUP(R[-1]C[4],C7:C8,2,FALSE),(R[-1]C[5]+1),1) -> 23 | P160: =IF(AND(RC[1]=1,RC[3]<7),RC[-5]+1,RC[-5]) -> 2022 | Q160: =IF(RC[2]<7,IF((RC[-5]+1)<13,(RC[-5]+1),(1)),RC[-5]) -> 5 | R160: =RC[-2]&RC[-1] -> 20225 | S160: =IF((RC[-5]+6)<=VLOOKUP(RC[-6],C7:C8,2,FALSE),(RC[-5]+6),(RC[-5]+6)-VLOOKUP(RC[-6],C7:C8,2,FALSE)) -> 29 | U160: 155 | W160: =RC[-12]&R1C19&RC[-11]&R1C19&RC[-9]&",0,0,0" -> 2022,5,23,0,0,0 | X160: =RC[-8]&R1C19&RC[-7]&R1C19&RC[-5]&",23,59,59" -> 2022,5,29,23,59,59
K161: =IF(AND(RC[1]=1,RC[3]=1),R[-1]C[5]+1,R[-1]C[5]) -> 2022 | L161: =IF(RC[2]=1,IF((R[-1]C[5]+1)<13,(R[-1]C[5]+1),(1)),R[-1]C[5]) -> 5 | M161: =RC[-2]&RC[-1] -> 20225 | N161: =IF((R[-1]C[5]+1)<=VLOOKUP(R[-1]C[4],C7:C8,2,FALSE),(R[-1]C[5]+1),1) -> 30 | P161: =IF(AND(RC[1]=1,RC[3]<7),RC[-5]+1,RC[-5]) -> 2022 | Q161: =IF(RC[2]<7,IF((RC[-5]+1)<13,(RC[-5]+1),(1)),RC[-5]) -> 6 | R161: =RC[-2]&RC[-1] -> 20226 | S161: =IF((RC[-5]+6)<=VLOOKUP(RC[-6],C7:C8,2,FALSE),(RC[-5]+6),(RC[-5]+6)-VLOOKUP(RC[-6],C7:C8,2,FALSE)) -> 5 | U161: 156 | W161: =RC[-12]&R1C19&RC[-11]&R1C19&RC[-9]&",0,0,0" -> 2022,5,30,0,0,0 | X161: =RC[-8]&R1C19&RC[-7]&R1C19&RC[-5]&",23,59,59" -> 2022,6,5,23,59,59
K162: =IF(AND(RC[1]=1,RC[3]=1),R[-1]C[5]+1,R[-1]C[5]) -> 2022 | L162: =IF(RC[2]=1,IF((R[-1]C[5]+1)<13,(R[-1]C[5]+1),(1)),R[-1]C[5]) -> 6 | M162: =RC[-2]&RC[-1] -> 20226 | N162: =IF((R[-1]C[5]+1)<=VLOOKUP(R[-1]C[4],C7:C8,2,FALSE),(R[-1]C[5]+1),1) -> 6 | P162: =IF(AND(RC[1]=1,RC[3]<7),RC[-5]+1,RC[-5]) -> 2022 | Q162: =IF(RC[2]<7,IF((RC[-5]+1)<13,(RC[-5]+1),(1)),RC[-5]) -> 6 | R162: =RC[-2]&RC[-1] -> 20226 | S162: =IF((RC[-5]+6)<=VLOOKUP(RC[-6],C7:C8,2,FALSE),(RC[-5]+6),(RC[-5]+6)-VLOOKUP(RC[-6],C7:C8,2,FALSE)) -> 12 | U162: 157 | W162: =RC[-12]&R1C19&RC[-11]&R1C19&RC[-9]&",0,0,0" -> 2022,6,6,0,0,0 | X162: =RC[-8]&R1C19&RC[-7]&R1C19&RC[-5]&",23,59,59" -> 2022,6,12,23,59,59
K163: =IF(AND(RC[1]=1,RC[3]=1),R[-1]C[5]+1,R[-1]C[5]) -> 2022 | L163: =IF(RC[2]=1,IF((R[-1]C[5]+1)<13,(R[-1]C[5]+1),(1)),R[-1]C[5]) -> 6 | M163: =RC[-2]&RC[-1] -> 20226 | N163: =IF((R[-1]C[5]+1)<=VLOOKUP(R[-1]C[4],C7:C8,2,FALSE),(R[-1]C[5]+1),1) -> 13 | P163: =IF(AND(RC[1]=1,RC[3]<7),RC[-5]+1,RC[-5]) -> 2022 | Q163: =IF(RC[2]<7,IF((RC[-5]+1)<13,(RC[-5]+1),(1)),RC[-5]) -> 6 | R163: =RC[-2]&RC[-1] -> 20226 | S163: =IF((RC[-5]+6)<=VLOOKUP(RC[-6],C7:C8,2,FALSE),(RC[-5]+6),(RC[-5]+6)-VLOOKUP(RC[-6],C7:C8,2,FALSE)) -> 19 | U163: 158 | W163: =RC[-12]&R1C19&RC[-11]&R1C19&RC[-9]&",0,0,0" -> 2022,6,13,0,0,0 | X163: =RC[-8]&R1C19&RC[-7]&R1C19&RC[-5]&",23,59,59" -> 2022,6,19,23,59,59
K164: =IF(AND(RC[1]=1,RC[3]=1),R[-1]C[5]+1,R[-1]C[5]) -> 2022 | L164: =IF(RC[2]=1,IF((R[-1]C[5]+1)<13,(R[-1]C[5]+1),(1)),R[-1]C[5]) -> 6 | M164: =RC[-2]&RC[-1] -> 20226 | N164: =IF((R[-1]C[5]+1)<=VLOOKUP(R[-1]C[4],C7:C8,2,FALSE),(R[-1]C[5]+1),1) -> 20 | P164: =IF(AND(RC[1]=1,RC[3]<7),RC[-5]+1,RC[-5]) -> 2022 | Q164: =IF(RC[2]<7,IF((RC[-5]+1)<13,(RC[-5]+1),(1)),RC[-5]) -> 6 | R164: =RC[-2]&RC[-1] -> 20226 | S164: =IF((RC[-5]+6)<=VLOOKUP(RC[-6],C7:C8,2,FALSE),(RC[-5]+6),(RC[-5]+6)-VLOOKUP(RC[-6],C7:C8,2,FALSE)) -> 26 | U164: 159 | W164: =RC[-12]&R1C19&RC[-11]&R1C19&RC[-9]&",0,0,0" -> 2022,6,20,0,0,0 | X164: =RC[-8]&R1C19&RC[-7]&R1C19&RC[-5]&",23,59,59" -> 2022,6,26,23,59,59
K165: =IF(AND(RC[1]=1,RC[3]=1),R[-1]C[5]+1,R[-1]C[5]) -> 2022 | L165: =IF(RC[2]=1,IF((R[-1]C[5]+1)<13,(R[-1]C[5]+1),(1)),R[-1]C[5]) -> 6 | M165: =RC[-2]&RC[-1] -> 20226 | N165: =IF((R[-1]C[5]+1)<=VLOOKUP(R[-1]C[4],C7:C8,2,FALSE),(R[-1]C[5]+1),1) -> 27 | P165: =IF(AND(RC[1]=1,RC[3]<7),RC[-5]+1,RC[-5]) -> 2022 | Q165: =IF(RC[2]<7,IF((RC[-5]+1)<13,(RC[-5]+1),(1)),RC[-5]) -> 7 | R165: =RC[-2]&RC[-1] -> 20227 | S165: =IF((RC[-5]+6)<=VLOOKUP(RC[-6],C7:C8,2,FALSE),(RC[-5]+6),(RC[-5]+6)-VLOOKUP(RC[-6],C7:C8,2,FALSE)) -> 3 | U165: 160 | W165: =RC[-12]&R1C19&RC[-11]&R1C19&RC[-9]&",0,0,0" -> 2022,6,27,0,0,0 | X165: =RC[-8]&R1C19&RC[-7]&R1C19&RC[-5]&",23,59,59" -> 2022,7,3,23,59,59
K166: =IF(AND(RC[1]=1,RC[3]=1),R[-1]C[5]+1,R[-1]C[5]) -> 2022 | L166: =IF(RC[2]=1,IF((R[-1]C[5]+1)<13,(R[-1]C[5]+1),(1)),R[-1]C[5]) -> 7 | M166: =RC[-2]&RC[-1] -> 20227 | N166: =IF((R[-1]C[5]+1)<=VLOOKUP(R[-1]C[4],C7:C8,2,FALSE),(R[-1]C[5]+1),1) -> 4 | P166: =IF(AND(RC[1]=1,RC[3]<7),RC[-5]+1,RC[-5]) -> 2022 | Q166: =IF(RC[2]<7,IF((RC[-5]+1)<13,(RC[-5]+1),(1)),RC[-5]) -> 7 | R166: =RC[-2]&RC[-1] -> 20227 | S166: =IF((RC[-5]+6)<=VLOOKUP(RC[-6],C7:C8,2,FALSE),(RC[-5]+6),(RC[-5]+6)-VLOOKUP(RC[-6],C7:C8,2,FALSE)) -> 10 | U166: 161 | W166: =RC[-12]&R1C19&RC[-11]&R1C19&RC[-9]&",0,0,0" -> 2022,7,4,0,0,0 | X166: =RC[-8]&R1C19&RC[-7]&R1C19&RC[-5]&",23,59,59" -> 2022,7,10,23,59,59
K167: =IF(AND(RC[1]=1,RC[3]=1),R[-1]C[5]+1,R[-1]C[5]) -> 2022 | L167: =IF(RC[2]=1,IF((R[-1]C[5]+1)<13,(R[-1]C[5]+1),(1)),R[-1]C[5]) -> 7 | M167: =RC[-2]&RC[-1] -> 20227 | N167: =IF((R[-1]C[5]+1)<=VLOOKUP(R[-1]C[4],C7:C8,2,FALSE),(R[-1]C[5]+1),1) -> 11 | P167: =IF(AND(RC[1]=1,RC[3]<7),RC[-5]+1,RC[-5]) -> 2022 | Q167: =IF(RC[2]<7,IF((RC[-5]+1)<13,(RC[-5]+1),(1)),RC[-5]) -> 7 | R167: =RC[-2]&RC[-1] -> 20227 | S167: =IF((RC[-5]+6)<=VLOOKUP(RC[-6],C7:C8,2,FALSE),(RC[-5]+6),(RC[-5]+6)-VLOOKUP(RC[-6],C7:C8,2,FALSE)) -> 17 | U167: 162 | W167: =RC[-12]&R1C19&RC[-11]&R1C19&RC[-9]&",0,0,0" -> 2022,7,11,0,0,0 | X167: =RC[-8]&R1C19&RC[-7]&R1C19&RC[-5]&",23,59,59" -> 2022,7,17,23,59,59
K168: =IF(AND(RC[1]=1,RC[3]=1),R[-1]C[5]+1,R[-1]C[5]) -> 2022 | L168: =IF(RC[2]=1,IF((R[-1]C[5]+1)<13,(R[-1]C[5]+1),(1)),R[-1]C[5]) -> 7 | M168: =RC[-2]&RC[-1] -> 20227 | N168: =IF((R[-1]C[5]+1)<=VLOOKUP(R[-1]C[4],C7:C8,2,FALSE),(R[-1]C[5]+1),1) -> 18 | P168: =IF(AND(RC[1]=1,RC[3]<7),RC[-5]+1,RC[-5]) -> 2022 | Q168: =IF(RC[2]<7,IF((RC[-5]+1)<13,(RC[-5]+1),(1)),RC[-5]) -> 7 | R168: =RC[-2]&RC[-1] -> 20227 | S168: =IF((RC[-5]+6)<=VLOOKUP(RC[-6],C7:C8,2,FALSE),(RC[-5]+6),(RC[-5]+6)-VLOOKUP(RC[-6],C7:C8,2,FALSE)) -> 24 | U168: 163 | W168: =RC[-12]&R1C19&RC[-11]&R1C19&RC[-9]&",0,0,0" -> 2022,7,18,0,0,0 | X168: =RC[-8]&R1C19&RC[-7]&R1C19&RC[-5]&",23,59,59" -> 2022,7,24,23,59,59
K169: =IF(AND(RC[1]=1,RC[3]=1),R[-1]C[5]+1,R[-1]C[5]) -> 2022 | L169: =IF(RC[2]=1,IF((R[-1]C[5]+1)<13,(R[-1]C[5]+1),(1)),R[-1]C[5]) -> 7 | M169: =RC[-2]&RC[-1] -> 20227 | N169: =IF((R[-1]C[5]+1)<=VLOOKUP(R[-1]C[4],C7:C8,2,FALSE),(R[-1]C[5]+1),1) -> 25 | P169: =IF(AND(RC[1]=1,RC[3]<7),RC[-5]+1,RC[-5]) -> 2022 | Q169: =IF(RC[2]<7,IF((RC[-5]+1)<13,(RC[-5]+1),(1)),RC[-5]) -> 7 | R169: =RC[-2]&RC[-1] -> 20227 | S169: =IF((RC[-5]+6)<=VLOOKUP(RC[-6],C7:C8,2,FALSE),(RC[-5]+6),(RC[-5]+6)-VLOOKUP(RC[-6],C7:C8,2,FALSE)) -> 31 | U169: 164 | W169: =RC[-12]&R1C19&RC[-11]&R1C19&RC[-9]&",0,0,0" -> 2022,7,25,0,0,0 | X169: =RC[-8]&R1C19&RC[-7]&R1C19&RC[-5]&",23,59,59" -> 2022,7,31,23,59,59
K170: =IF(AND(RC[1]=1,RC[3]=1),R[-1]C[5]+1,R[-1]C[5]) -> 2022 | L170: =IF(RC[2]=1,IF((R[-1]C[5]+1)<13,(R[-1]C[5]+1),(1)),R[-1]C[5]) -> 8 | M170: =RC[-2]&RC[-1] -> 20228 | N170: =IF((R[-1]C[5]+1)<=VLOOKUP(R[-1]C[4],C7:C8,2,FALSE),(R[-1]C[5]+1),1) -> 1 | P170: =IF(AND(RC[1]=1,RC[3]<7),RC[-5]+1,RC[-5]) -> 2022 | Q170: =IF(RC[2]<7,IF((RC[-5]+1)<13,(RC[-5]+1),(1)),RC[-5]) -> 8 | R170: =RC[-2]&RC[-1] -> 20228 | S170: =IF((RC[-5]+6)<=VLOOKUP(RC[-6],C7:C8,2,FALSE),(RC[-5]+6),(RC[-5]+6)-VLOOKUP(RC[-6],C7:C8,2,FALSE)) -> 7 | U170: 165 | W170: =RC[-12]&R1C19&RC[-11]&R1C19&RC[-9]&",0,0,0" -> 2022,8,1,0,0,0 | X170: =RC[-8]&R1C19&RC[-7]&R1C19&RC[-5]&",23,59,59" -> 2022,8,7,23,59,59
K171: =IF(AND(RC[1]=1,RC[3]=1),R[-1]C[5]+1,R[-1]C[5]) -> 2022 | L171: =IF(RC[2]=1,IF((R[-1]C[5]+1)<13,(R[-1]C[5]+1),(1)),R[-1]C[5]) -> 8 | M171: =RC[-2]&RC[-1] -> 20228 | N171: =IF((R[-1]C[5]+1)<=VLOOKUP(R[-1]C[4],C7:C8,2,FALSE),(R[-1]C[5]+1),1) -> 8 | P171: =IF(AND(RC[1]=1,RC[3]<7),RC[-5]+1,RC[-5]) -> 2022 | Q171: =IF(RC[2]<7,IF((RC[-5]+1)<13,(RC[-5]+1),(1)),RC[-5]) -> 8 | R171: =RC[-2]&RC[-1] -> 20228 | S171: =IF((RC[-5]+6)<=VLOOKUP(RC[-6],C7:C8,2,FALSE),(RC[-5]+6),(RC[-5]+6)-VLOOKUP(RC[-6],C7:C8,2,FALSE)) -> 14 | U171: 166 | W171: =RC[-12]&R1C19&RC[-11]&R1C19&RC[-9]&",0,0,0" -> 2022,8,8,0,0,0 | X171: =RC[-8]&R1C19&RC[-7]&R1C19&RC[-5]&",23,59,59" -> 2022,8,14,23,59,59
K172: =IF(AND(RC[1]=1,RC[3]=1),R[-1]C[5]+1,R[-1]C[5]) -> 2022 | L172: =IF(RC[2]=1,IF((R[-1]C[5]+1)<13,(R[-1]C[5]+1),(1)),R[-1]C[5]) -> 8 | M172: =RC[-2]&RC[-1] -> 20228 | N172: =IF((R[-1]C[5]+1)<=VLOOKUP(R[-1]C[4],C7:C8,2,FALSE),(R[-1]C[5]+1),1) -> 15 | P172: =IF(AND(RC[1]=1,RC[3]<7),RC[-5]+1,RC[-5]) -> 2022 | Q172: =IF(RC[2]<7,IF((RC[-5]+1)<13,(RC[-5]+1),(1)),RC[-5]) -> 8 | R172: =RC[-2]&RC[-1] -> 20228 | S172: =IF((RC[-5]+6)<=VLOOKUP(RC[-6],C7:C8,2,FALSE),(RC[-5]+6),(RC[-5]+6)-VLOOKUP(RC[-6],C7:C8,2,FALSE)) -> 21 | U172: 167 | W172: =RC[-12]&R1C19&RC[-11]&R1C19&RC[-9]&",0,0,0" -> 2022,8,15,0,0,0 | X172: =RC[-8]&R1C19&RC[-7]&R1C19&RC[-5]&",23,59,59" -> 2022,8,21,23,59,59
K173: =IF(AND(RC[1]=1,RC[3]=1),R[-1]C[5]+1,R[-1]C[5]) -> 2022 | L173: =IF(RC[2]=1,IF((R[-1]C[5]+1)<13,(R[-1]C[5]+1),(1)),R[-1]C[5]) -> 8 | M173: =RC[-2]&RC[-1] -> 20228 | N173: =IF((R[-1]C[5]+1)<=VLOOKUP(R[-1]C[4],C7:C8,2,FALSE),(R[-1]C[5]+1),1) -> 22 | P173: =IF(AND(RC[1]=1,RC[3]<7),RC[-5]+1,RC[-5]) -> 2022 | Q173: =IF(RC[2]<7,IF((RC[-5]+1)<13,(RC[-5]+1),(1)),RC[-5]) -> 8 | R173: =RC[-2]&RC[-1] -> 20228 | S173: =IF((RC[-5]+6)<=VLOOKUP(RC[-6],C7:C8,2,FALSE),(RC[-5]+6),(RC[-5]+6)-VLOOKUP(RC[-6],C7:C8,2,FALSE)) -> 28 | U173: 168 | W173: =RC[-12]&R1C19&RC[-11]&R1C19&RC[-9]&",0,0,0" -> 2022,8,22,0,0,0 | X173: =RC[-8]&R1C19&RC[-7]&R1C19&RC[-5]&",23,59,59" -> 2022,8,28,23,59,59
K174: =IF(AND(RC[1]=1,RC[3]=1),R[-1]C[5]+1,R[-1]C[5]) -> 2022 | L174: =IF(RC[2]=1,IF((R[-1]C[5]+1)<13,(R[-1]C[5]+1),(1)),R[-1]C[5]) -> 8 | M174: =RC[-2]&RC[-1] -> 20228 | N174: =IF((R[-1]C[5]+1)<=VLOOKUP(R[-1]C[4],C7:C8,2,FALSE),(R[-1]C[5]+1),1) -> 29 | P174: =IF(AND(RC[1]=1,RC[3]<7),RC[-5]+1,RC[-5]) -> 2022 | Q174: =IF(RC[2]<7,IF((RC[-5]+1)<13,(RC[-5]+1),(1)),RC[-5]) -> 9 | R174: =RC[-2]&RC[-1] -> 20229 | S174: =IF((RC[-5]+6)<=VLOOKUP(RC[-6],C7:C8,2,FALSE),(RC[-5]+6),(RC[-5]+6)-VLOOKUP(RC[-6],C7:C8,2,FALSE)) -> 4 | U174: 169 | W174: =RC[-12]&R1C19&RC[-11]&R1C19&RC[-9]&",0,0,0" -> 2022,8,29,0,0,0 | X174: =RC[-8]&R1C19&RC[-7]&R1C19&RC[-5]&",23,59,59" -> 2022,9,4,23,59,59
K175: =IF(AND(RC[1]=1,RC[3]=1),R[-1]C[5]+1,R[-1]C[5]) -> 2022 | L175: =IF(RC[2]=1,IF((R[-1]C[5]+1)<13,(R[-1]C[5]+1),(1)),R[-1]C[5]) -> 9 | M175: =RC[-2]&RC[-1] -> 20229 | N175: =IF((R[-1]C[5]+1)<=VLOOKUP(R[-1]C[4],C7:C8,2,FALSE),(R[-1]C[5]+1),1) -> 5 | P175: =IF(AND(RC[1]=1,RC[3]<7),RC[-5]+1,RC[-5]) -> 2022 | Q175: =IF(RC[2]<7,IF((RC[-5]+1)<13,(RC[-5]+1),(1)),RC[-5]) -> 9 | R175: =RC[-2]&RC[-1] -> 20229 | S175: =IF((RC[-5]+6)<=VLOOKUP(RC[-6],C7:C8,2,FALSE),(RC[-5]+6),(RC[-5]+6)-VLOOKUP(RC[-6],C7:C8,2,FALSE)) -> 11 | U175: 170 | W175: =RC[-12]&R1C19&RC[-11]&R1C19&RC[-9]&",0,0,0" -> 2022,9,5,0,0,0 | X175: =RC[-8]&R1C19&RC[-7]&R1C19&RC[-5]&",23,59,59" -> 2022,9,11,23,59,59
K176: =IF(AND(RC[1]=1,RC[3]=1),R[-1]C[5]+1,R[-1]C[5]) -> 2022 | L176: =IF(RC[2]=1,IF((R[-1]C[5]+1)<13,(R[-1]C[5]+1),(1)),R[-1]C[5]) -> 9 | M176: =RC[-2]&RC[-1] -> 20229 | N176: =IF((R[-1]C[5]+1)<=VLOOKUP(R[-1]C[4],C7:C8,2,FALSE),(R[-1]C[5]+1),1) -> 12 | P176: =IF(AND(RC[1]=1,RC[3]<7),RC[-5]+1,RC[-5]) -> 2022 | Q176: =IF(RC[2]<7,IF((RC[-5]+1)<13,(RC[-5]+1),(1)),RC[-5]) -> 9 | R176: =RC[-2]&RC[-1] -> 20229 | S176: =IF((RC[-5]+6)<=VLOOKUP(RC[-6],C7:C8,2,FALSE),(RC[-5]+6),(RC[-5]+6)-VLOOKUP(RC[-6],C7:C8,2,FALSE)) -> 18 | U176: 171 | W176: =RC[-12]&R1C19&RC[-11]&R1C19&RC[-9]&",0,0,0" -> 2022,9,12,0,0,0 | X176: =RC[-8]&R1C19&RC[-7]&R1C19&RC[-5]&",23,59,59" -> 2022,9,18,23,59,59
K177: =IF(AND(RC[1]=1,RC[3]=1),R[-1]C[5]+1,R[-1]C[5]) -> 2022 | L177: =IF(RC[2]=1,IF((R[-1]C[5]+1)<13,(R[-1]C[5]+1),(1)),R[-1]C[5]) -> 9 | M177: =RC[-2]&RC[-1] -> 20229 | N177: =IF((R[-1]C[5]+1)<=VLOOKUP(R[-1]C[4],C7:C8,2,FALSE),(R[-1]C[5]+1),1) -> 19 | P177: =IF(AND(RC[1]=1,RC[3]<7),RC[-5]+1,RC[-5]) -> 2022 | Q177: =IF(RC[2]<7,IF((RC[-5]+1)<13,(RC[-5]+1),(1)),RC[-5]) -> 9 | R177: =RC[-2]&RC[-1] -> 20229 | S177: =IF((RC[-5]+6)<=VLOOKUP(RC[-6],C7:C8,2,FALSE),(RC[-5]+6),(RC[-5]+6)-VLOOKUP(RC[-6],C7:C8,2,FALSE)) -> 25 | U177: 172 | W177: =RC[-12]&R1C19&RC[-11]&R1C19&RC[-9]&",0,0,0" -> 2022,9,19,0,0,0 | X177: =RC[-8]&R1C19&RC[-7]&R1C19&RC[-5]&",23,59,59" -> 2022,9,25,23,59,59
K178: =IF(AND(RC[1]=1,RC[3]=1),R[-1]C[5]+1,R[-1]C[5]) -> 2022 | L178: =IF(RC[2]=1,IF((R[-1]C[5]+1)<13,(R[-1]C[5]+1),(1)),R[-1]C[5]) -> 9 | M178: =RC[-2]&RC[-1] -> 20229 | N178: =IF((R[-1]C[5]+1)<=VLOOKUP(R[-1]C[4],C7:C8,2,FALSE),(R[-1]C[5]+1),1) -> 26 | P178: =IF(AND(RC[1]=1,RC[3]<7),RC[-5]+1,RC[-5]) -> 2022 | Q178: =IF(RC[2]<7,IF((RC[-5]+1)<13,(RC[-5]+1),(1)),RC[-5]) -> 10 | R178: =RC[-2]&RC[-1] -> 202210 | S178: =IF((RC[-5]+6)<=VLOOKUP(RC[-6],C7:C8,2,FALSE),(RC[-5]+6),(RC[-5]+6)-VLOOKUP(RC[-6],C7:C8,2,FALSE)) -> 2 | U178: 173 | W178: =RC[-12]&R1C19&RC[-11]&R1C19&RC[-9]&",0,0,0" -> 2022,9,26,0,0,0 | X178: =RC[-8]&R1C19&RC[-7]&R1C19&RC[-5]&",23,59,59" -> 2022,10,2,23,59,59
K179: =IF(AND(RC[1]=1,RC[3]=1),R[-1]C[5]+1,R[-1]C[5]) -> 2022 | L179: =IF(RC[2]=1,IF((R[-1]C[5]+1)<13,(R[-1]C[5]+1),(1)),R[-1]C[5]) -> 10 | M179: =RC[-2]&RC[-1] -> 202210 | N179: =IF((R[-1]C[5]+1)<=VLOOKUP(R[-1]C[4],C7:C8,2,FALSE),(R[-1]C[5]+1),1) -> 3 | P179: =IF(AND(RC[1]=1,RC[3]<7),RC[-5]+1,RC[-5]) -> 2022 | Q179: =IF(RC[2]<7,IF((RC[-5]+1)<13,(RC[-5]+1),(1)),RC[-5]) -> 10 | R179: =RC[-2]&RC[-1] -> 202210 | S179: =IF((RC[-5]+6)<=VLOOKUP(RC[-6],C7:C8,2,FALSE),(RC[-5]+6),(RC[-5]+6)-VLOOKUP(RC[-6],C7:C8,2,FALSE)) -> 9 | U179: 174 | W179: =RC[-12]&R1C19&RC[-11]&R1C19&RC[-9]&",0,0,0" -> 2022,10,3,0,0,0 | X179: =RC[-8]&R1C19&RC[-7]&R1C19&RC[-5]&",23,59,59" -> 2022,10,9,23,59,59
K180: =IF(AND(RC[1]=1,RC[3]=1),R[-1]C[5]+1,R[-1]C[5]) -> 2022 | L180: =IF(RC[2]=1,IF((R[-1]C[5]+1)<13,(R[-1]C[5]+1),(1)),R[-1]C[5]) -> 10 | M180: =RC[-2]&RC[-1] -> 202210 | N180: =IF((R[-1]C[5]+1)<=VLOOKUP(R[-1]C[4],C7:C8,2,FALSE),(R[-1]C[5]+1),1) -> 10 | P180: =IF(AND(RC[1]=1,RC[3]<7),RC[-5]+1,RC[-5]) -> 2022 | Q180: =IF(RC[2]<7,IF((RC[-5]+1)<13,(RC[-5]+1),(1)),RC[-5]) -> 10 | R180: =RC[-2]&RC[-1] -> 202210 | S180: =IF((RC[-5]+6)<=VLOOKUP(RC[-6],C7:C8,2,FALSE),(RC[-5]+6),(RC[-5]+6)-VLOOKUP(RC[-6],C7:C8,2,FALSE)) -> 16 | U180: 175 | W180: =RC[-12]&R1C19&RC[-11]&R1C19&RC[-9]&",0,0,0" -> 2022,10,10,0,0,0 | X180: =RC[-8]&R1C19&RC[-7]&R1C19&RC[-5]&",23,59,59" -> 2022,10,16,23,59,59
K181: =IF(AND(RC[1]=1,RC[3]=1),R[-1]C[5]+1,R[-1]C[5]) -> 2022 | L181: =IF(RC[2]=1,IF((R[-1]C[5]+1)<13,(R[-1]C[5]+1),(1)),R[-1]C[5]) -> 10 | M181: =RC[-2]&RC[-1] -> 202210 | N181: =IF((R[-1]C[5]+1)<=VLOOKUP(R[-1]C[4],C7:C8,2,FALSE),(R[-1]C[5]+1),1) -> 17 | P181: =IF(AND(RC[1]=1,RC[3]<7),RC[-5]+1,RC[-5]) -> 2022 | Q181: =IF(RC[2]<7,IF((RC[-5]+1)<13,(RC[-5]+1),(1)),RC[-5]) -> 10 | R181: =RC[-2]&RC[-1] -> 202210 | S181: =IF((RC[-5]+6)<=VLOOKUP(RC[-6],C7:C8,2,FALSE),(RC[-5]+6),(RC[-5]+6)-VLOOKUP(RC[-6],C7:C8,2,FALSE)) -> 23 | U181: 176 | W181: =RC[-12]&R1C19&RC[-11]&R1C19&RC[-9]&",0,0,0" -> 2022,10,17,0,0,0 | X181: =RC[-8]&R1C19&RC[-7]&R1C19&RC[-5]&",23,59,59" -> 2022,10,23,23,59,59
K182: =IF(AND(RC[1]=1,RC[3]=1),R[-1]C[5]+1,R[-1]C[5]) -> 2022 | L182: =IF(RC[2]=1,IF((R[-1]C[5]+1)<13,(R[-1]C[5]+1),(1)),R[-1]C[5]) -> 10 | M182: =RC[-2]&RC[-1] -> 202210 | N182: =IF((R[-1]C[5]+1)<=VLOOKUP(R[-1]C[4],C7:C8,2,FALSE),(R[-1]C[5]+1),1) -> 24 | P182: =IF(AND(RC[1]=1,RC[3]<7),RC[-5]+1,RC[-5]) -> 2022 | Q182: =IF(RC[2]<7,IF((RC[-5]+1)<13,(RC[-5]+1),(1)),RC[-5]) -> 10 | R182: =RC[-2]&RC[-1] -> 202210 | S182: =IF((RC[-5]+6)<=VLOOKUP(RC[-6],C7:C8,2,FALSE),(RC[-5]+6),(RC[-5]+6)-VLOOKUP(RC[-6],C7:C8,2,FALSE)) -> 30 | U182: 177 | W182: =RC[-12]&R1C19&RC[-11]&R1C19&RC[-9]&",0,0,0" -> 2022,10,24,0,0,0 | X182: =RC[-8]&R1C19&RC[-7]&R1C19&RC[-5]&",23,59,59" -> 2022,10,30,23,59,59
K183: =IF(AND(RC[1]=1,RC[3]=1),R[-1]C[5]+1,R[-1]C[5]) -> 2022 | L183: =IF(RC[2]=1,IF((R[-1]C[5]+1)<13,(R[-1]C[5]+1),(1)),R[-1]C[5]) -> 10 | M183: =RC[-2]&RC[-1] -> 202210 | N183: =IF((R[-1]C[5]+1)<=VLOOKUP(R[-1]C[4],C7:C8,2,FALSE),(R[-1]C[5]+1),1) -> 31 | P183: =IF(AND(RC[1]=1,RC[3]<7),RC[-5]+1,RC[-5]) -> 2022 | Q183: =IF(RC[2]<7,IF((RC[-5]+1)<13,(RC[-5]+1),(1)),RC[-5]) -> 11 | R183: =RC[-2]&RC[-1] -> 202211 | S183: =IF((RC[-5]+6)<=VLOOKUP(RC[-6],C7:C8,2,FALSE),(RC[-5]+6),(RC[-5]+6)-VLOOKUP(RC[-6],C7:C8,2,FALSE)) -> 6 | U183: 178 | W183: =RC[-12]&R1C19&RC[-11]&R1C19&RC[-9]&",0,0,0" -> 2022,10,31,0,0,0 | X183: =RC[-8]&R1C19&RC[-7]&R1C19&RC[-5]&",23,59,59" -> 2022,11,6,23,59,59
K184: =IF(AND(RC[1]=1,RC[3]=1),R[-1]C[5]+1,R[-1]C[5]) -> 2022 | L184: =IF(RC[2]=1,IF((R[-1]C[5]+1)<13,(R[-1]C[5]+1),(1)),R[-1]C[5]) -> 11 | M184: =RC[-2]&RC[-1] -> 202211 | N184: =IF((R[-1]C[5]+1)<=VLOOKUP(R[-1]C[4],C7:C8,2,FALSE),(R[-1]C[5]+1),1) -> 7 | P184: =IF(AND(RC[1]=1,RC[3]<7),RC[-5]+1,RC[-5]) -> 2022 | Q184: =IF(RC[2]<7,IF((RC[-5]+1)<13,(RC[-5]+1),(1)),RC[-5]) -> 11 | R184: =RC[-2]&RC[-1] -> 202211 | S184: =IF((RC[-5]+6)<=VLOOKUP(RC[-6],C7:C8,2,FALSE),(RC[-5]+6),(RC[-5]+6)-VLOOKUP(RC[-6],C7:C8,2,FALSE)) -> 13 | U184: 179 | W184: =RC[-12]&R1C19&RC[-11]&R1C19&RC[-9]&",0,0,0" -> 2022,11,7,0,0,0 | X184: =RC[-8]&R1C19&RC[-7]&R1C19&RC[-5]&",23,59,59" -> 2022,11,13,23,59,59
K185: =IF(AND(RC[1]=1,RC[3]=1),R[-1]C[5]+1,R[-1]C[5]) -> 2022 | L185: =IF(RC[2]=1,IF((R[-1]C[5]+1)<13,(R[-1]C[5]+1),(1)),R[-1]C[5]) -> 11 | M185: =RC[-2]&RC[-1] -> 202211 | N185: =IF((R[-1]C[5]+1)<=VLOOKUP(R[-1]C[4],C7:C8,2,FALSE),(R[-1]C[5]+1),1) -> 14 | P185: =IF(AND(RC[1]=1,RC[3]<7),RC[-5]+1,RC[-5]) -> 2022 | Q185: =IF(RC[2]<7,IF((RC[-5]+1)<13,(RC[-5]+1),(1)),RC[-5]) -> 11 | R185: =RC[-2]&RC[-1] -> 202211 | S185: =IF((RC[-5]+6)<=VLOOKUP(RC[-6],C7:C8,2,FALSE),(RC[-5]+6),(RC[-5]+6)-VLOOKUP(RC[-6],C7:C8,2,FALSE)) -> 20 | U185: 180 | W185: =RC[-12]&R1C19&RC[-11]&R1C19&RC[-9]&",0,0,0" -> 2022,11,14,0,0,0 | X185: =RC[-8]&R1C19&RC[-7]&R1C19&RC[-5]&",23,59,59" -> 2022,11,20,23,59,59
K186: =IF(AND(RC[1]=1,RC[3]=1),R[-1]C[5]+1,R[-1]C[5]) -> 2022 | L186: =IF(RC[2]=1,IF((R[-1]C[5]+1)<13,(R[-1]C[5]+1),(1)),R[-1]C[5]) -> 11 | M186: =RC[-2]&RC[-1] -> 202211 | N186: =IF((R[-1]C[5]+1)<=VLOOKUP(R[-1]C[4],C7:C8,2,FALSE),(R[-1]C[5]+1),1) -> 21 | P186: =IF(AND(RC[1]=1,RC[3]<7),RC[-5]+1,RC[-5]) -> 2022 | Q186: =IF(RC[2]<7,IF((RC[-5]+1)<13,(RC[-5]+1),(1)),RC[-5]) -> 11 | R186: =RC[-2]&RC[-1] -> 202211 | S186: =IF((RC[-5]+6)<=VLOOKUP(RC[-6],C7:C8,2,FALSE),(RC[-5]+6),(RC[-5]+6)-VLOOKUP(RC[-6],C7:C8,2,FALSE)) -> 27 | U186: 181 | W186: =RC[-12]&R1C19&RC[-11]&R1C19&RC[-9]&",0,0,0" -> 2022,11,21,0,0,0 | X186: =RC[-8]&R1C19&RC[-7]&R1C19&RC[-5]&",23,59,59" -> 2022,11,27,23,59,59
K187: =IF(AND(RC[1]=1,RC[3]=1),R[-1]C[5]+1,R[-1]C[5]) -> 2022 | L187: =IF(RC[2]=1,IF((R[-1]C[5]+1)<13,(R[-1]C[5]+1),(1)),R[-1]C[5]) -> 11 | M187: =RC[-2]&RC[-1] -> 202211 | N187: =IF((R[-1]C[5]+1)<=VLOOKUP(R[-1]C[4],C7:C8,2,FALSE),(R[-1]C[5]+1),1) -> 28 | P187: =IF(AND(RC[1]=1,RC[3]<7),RC[-5]+1,RC[-5]) -> 2022 | Q187: =IF(RC[2]<7,IF((RC[-5]+1)<13,(RC[-5]+1),(1)),RC[-5]) -> 12 | R187: =RC[-2]&RC[-1] -> 202212 | S187: =IF((RC[-5]+6)<=VLOOKUP(RC[-6],C7:C8,2,FALSE),(RC[-5]+6),(RC[-5]+6)-VLOOKUP(RC[-6],C7:C8,2,FALSE)) -> 4 | U187: 182 | W187: =RC[-12]&R1C19&RC[-11]&R1C19&RC[-9]&",0,0,0" -> 2022,11,28,0,0,0 | X187: =RC[-8]&R1C19&RC[-7]&R1C19&RC[-5]&",23,59,59" -> 2022,12,4,23,59,59
K188: =IF(AND(RC[1]=1,RC[3]=1),R[-1]C[5]+1,R[-1]C[5]) -> 2022 | L188: =IF(RC[2]=1,IF((R[-1]C[5]+1)<13,(R[-1]C[5]+1),(1)),R[-1]C[5]) -> 12 | M188: =RC[-2]&RC[-1] -> 202212 | N188: =IF((R[-1]C[5]+1)<=VLOOKUP(R[-1]C[4],C7:C8,2,FALSE),(R[-1]C[5]+1),1) -> 5 | P188: =IF(AND(RC[1]=1,RC[3]<7),RC[-5]+1,RC[-5]) -> 2022 | Q188: =IF(RC[2]<7,IF((RC[-5]+1)<13,(RC[-5]+1),(1)),RC[-5]) -> 12 | R188: =RC[-2]&RC[-1] -> 202212 | S188: =IF((RC[-5]+6)<=VLOOKUP(RC[-6],C7:C8,2,FALSE),(RC[-5]+6),(RC[-5]+6)-VLOOKUP(RC[-6],C7:C8,2,FALSE)) -> 11 | U188: 183 | W188: =RC[-12]&R1C19&RC[-11]&R1C19&RC[-9]&",0,0,0" -> 2022,12,5,0,0,0 | X188: =RC[-8]&R1C19&RC[-7]&R1C19&RC[-5]&",23,59,59" -> 2022,12,11,23,59,59
K189: =IF(AND(RC[1]=1,RC[3]=1),R[-1]C[5]+1,R[-1]C[5]) -> 2022 | L189: =IF(RC[2]=1,IF((R[-1]C[5]+1)<13,(R[-1]C[5]+1),(1)),R[-1]C[5]) -> 12 | M189: =RC[-2]&RC[-1] -> 202212 | N189: =IF((R[-1]C[5]+1)<=VLOOKUP(R[-1]C[4],C7:C8,2,FALSE),(R[-1]C[5]+1),1) -> 12 | P189: =IF(AND(RC[1]=1,RC[3]<7),RC[-5]+1,RC[-5]) -> 2022 | Q189: =IF(RC[2]<7,IF((RC[-5]+1)<13,(RC[-5]+1),(1)),RC[-5]) -> 12 | R189: =RC[-2]&RC[-1] -> 202212 | S189: =IF((RC[-5]+6)<=VLOOKUP(RC[-6],C7:C8,2,FALSE),(RC[-5]+6),(RC[-5]+6)-VLOOKUP(RC[-6],C7:C8,2,FALSE)) -> 18 | U189: 184 | W189: =RC[-12]&R1C19&RC[-11]&R1C19&RC[-9]&",0,0,0" -> 2022,12,12,0,0,0 | X189: =RC[-8]&R1C19&RC[-7]&R1C19&RC[-5]&",23,59,59" -> 2022,12,18,23,59,59
K190: =IF(AND(RC[1]=1,RC[3]=1),R[-1]C[5]+1,R[-1]C[5]) -> 2022 | L190: =IF(RC[2]=1,IF((R[-1]C[5]+1)<13,(R[-1]C[5]+1),(1)),R[-1]C[5]) -> 12 | M190: =RC[-2]&RC[-1] -> 202212 | N190: =IF((R[-1]C[5]+1)<=VLOOKUP(R[-1]C[4],C7:C8,2,FALSE),(R[-1]C[5]+1),1) -> 19 | P190: =IF(AND(RC[1]=1,RC[3]<7),RC[-5]+1,RC[-5]) -> 2022 | Q190: =IF(RC[2]<7,IF((RC[-5]+1)<13,(RC[-5]+1),(1)),RC[-5]) -> 12 | R190: =RC[-2]&RC[-1] -> 202212 | S190: =IF((RC[-5]+6)<=VLOOKUP(RC[-6],C7:C8,2,FALSE),(RC[-5]+6),(RC[-5]+6)-VLOOKUP(RC[-6],C7:C8,2,FALSE)) -> 25 | U190: 185 | W190: =RC[-12]&R1C19&RC[-11]&R1C19&RC[-9]&",0,0,0" -> 2022,12,19,0,0,0 | X190: =RC[-8]&R1C19&RC[-7]&R1C19&RC[-5]&",23,59,59" -> 2022,12,25,23,59,59
K191: =IF(AND(RC[1]=1,RC[3]=1),R[-1]C[5]+1,R[-1]C[5]) -> 2022 | L191: =IF(RC[2]=1,IF((R[-1]C[5]+1)<13,(R[-1]C[5]+1),(1)),R[-1]C[5]) -> 12 | M191: =RC[-2]&RC[-1] -> 202212 | N191: =IF((R[-1]C[5]+1)<=VLOOKUP(R[-1]C[4],C7:C8,2,FALSE),(R[-1]C[5]+1),1) -> 26 | P191: =IF(AND(RC[1]=1,RC[3]<7),RC[-5]+1,RC[-5]) -> 2023 | Q191: =IF(RC[2]<7,IF((RC[-5]+1)<13,(RC[-5]+1),(1)),RC[-5]) -> 1 | R191: =RC[-2]&RC[-1] -> 20231 | S191: =IF((RC[-5]+6)<=VLOOKUP(RC[-6],C7:C8,2,FALSE),(RC[-5]+6),(RC[-5]+6)-VLOOKUP(RC[-6],C7:C8,2,FALSE)) -> 1 | U191: 186 | W191: =RC[-12]&R1C19&RC[-11]&R1C19&RC[-9]&",0,0,0" -> 2022,12,26,0,0,0 | X191: =RC[-8]&R1C19&RC[-7]&R1C19&RC[-5]&",23,59,59" -> 2023,1,1,23,59,59
K192: =IF(AND(RC[1]=1,RC[3]=1),R[-1]C[5]+1,R[-1]C[5]) -> 2023 | L192: =IF(RC[2]=1,IF((R[-1]C[5]+1)<13,(R[-1]C[5]+1),(1)),R[-1]C[5]) -> 1 | M192: =RC[-2]&RC[-1] -> 20231 | N192: =IF((R[-1]C[5]+1)<=VLOOKUP(R[-1]C[4],C7:C8,2,FALSE),(R[-1]C[5]+1),1) -> 2 | P192: =IF(AND(RC[1]=1,RC[3]<7),RC[-5]+1,RC[-5]) -> 2023 | Q192: =IF(RC[2]<7,IF((RC[-5]+1)<13,(RC[-5]+1),(1)),RC[-5]) -> 1 | R192: =RC[-2]&RC[-1] -> 20231 | S192: =IF((RC[-5]+6)<=VLOOKUP(RC[-6],C7:C8,2,FALSE),(RC[-5]+6),(RC[-5]+6)-VLOOKUP(RC[-6],C7:C8,2,FALSE)) -> 8 | U192: 187 | W192: =RC[-12]&R1C19&RC[-11]&R1C19&RC[-9]&",0,0,0" -> 2023,1,2,0,0,0 | X192: =RC[-8]&R1C19&RC[-7]&R1C19&RC[-5]&",23,59,59" -> 2023,1,8,23,59,59
K193: =IF(AND(RC[1]=1,RC[3]=1),R[-1]C[5]+1,R[-1]C[5]) -> 2023 | L193: =IF(RC[2]=1,IF((R[-1]C[5]+1)<13,(R[-1]C[5]+1),(1)),R[-1]C[5]) -> 1 | M193: =RC[-2]&RC[-1] -> 20231 | N193: =IF((R[-1]C[5]+1)<=VLOOKUP(R[-1]C[4],C7:C8,2,FALSE),(R[-1]C[5]+1),1) -> 9 | P193: =IF(AND(RC[1]=1,RC[3]<7),RC[-5]+1,RC[-5]) -> 2023 | Q193: =IF(RC[2]<7,IF((RC[-5]+1)<13,(RC[-5]+1),(1)),RC[-5]) -> 1 | R193: =RC[-2]&RC[-1] -> 20231 | S193: =IF((RC[-5]+6)<=VLOOKUP(RC[-6],C7:C8,2,FALSE),(RC[-5]+6),(RC[-5]+6)-VLOOKUP(RC[-6],C7:C8,2,FALSE)) -> 15 | U193: 188 | W193: =RC[-12]&R1C19&RC[-11]&R1C19&RC[-9]&",0,0,0" -> 2023,1,9,0,0,0 | X193: =RC[-8]&R1C19&RC[-7]&R1C19&RC[-5]&",23,59,59" -> 2023,1,15,23,59,59
K194: =IF(AND(RC[1]=1,RC[3]=1),R[-1]C[5]+1,R[-1]C[5]) -> 2023 | L194: =IF(RC[2]=1,IF((R[-1]C[5]+1)<13,(R[-1]C[5]+1),(1)),R[-1]C[5]) -> 1 | M194: =RC[-2]&RC[-1] -> 20231 | N194: =IF((R[-1]C[5]+1)<=VLOOKUP(R[-1]C[4],C7:C8,2,FALSE),(R[-1]C[5]+1),1) -> 16 | P194: =IF(AND(RC[1]=1,RC[3]<7),RC[-5]+1,RC[-5]) -> 2023 | Q194: =IF(RC[2]<7,IF((RC[-5]+1)<13,(RC[-5]+1),(1)),RC[-5]) -> 1 | R194: =RC[-2]&RC[-1] -> 20231 | S194: =IF((RC[-5]+6)<=VLOOKUP(RC[-6],C7:C8,2,FALSE),(RC[-5]+6),(RC[-5]+6)-VLOOKUP(RC[-6],C7:C8,2,FALSE)) -> 22 | U194: 189 | W194: =RC[-12]&R1C19&RC[-11]&R1C19&RC[-9]&",0,0,0" -> 2023,1,16,0,0,0 | X194: =RC[-8]&R1C19&RC[-7]&R1C19&RC[-5]&",23,59,59" -> 2023,1,22,23,59,59
K195: =IF(AND(RC[1]=1,RC[3]=1),R[-1]C[5]+1,R[-1]C[5]) -> 2023 | L195: =IF(RC[2]=1,IF((R[-1]C[5]+1)<13,(R[-1]C[5]+1),(1)),R[-1]C[5]) -> 1 | M195: =RC[-2]&RC[-1] -> 20231 | N195: =IF((R[-1]C[5]+1)<=VLOOKUP(R[-1]C[4],C7:C8,2,FALSE),(R[-1]C[5]+1),1) -> 23 | P195: =IF(AND(RC[1]=1,RC[3]<7),RC[-5]+1,RC[-5]) -> 2023 | Q195: =IF(RC[2]<7,IF((RC[-5]+1)<13,(RC[-5]+1),(1)),RC[-5]) -> 1 | R195: =RC[-2]&RC[-1] -> 20231 | S195: =IF((RC[-5]+6)<=VLOOKUP(RC[-6],C7:C8,2,FALSE),(RC[-5]+6),(RC[-5]+6)-VLOOKUP(RC[-6],C7:C8,2,FALSE)) -> 29 | U195: 190 | W195: =RC[-12]&R1C19&RC[-11]&R1C19&RC[-9]&",0,0,0" -> 2023,1,23,0,0,0 | X195: =RC[-8]&R1C19&RC[-7]&R1C19&RC[-5]&",23,59,59" -> 2023,1,29,23,59,59
K196: =IF(AND(RC[1]=1,RC[3]=1),R[-1]C[5]+1,R[-1]C[5]) -> 2023 | L196: =IF(RC[2]=1,IF((R[-1]C[5]+1)<13,(R[-1]C[5]+1),(1)),R[-1]C[5]) -> 1 | M196: =RC[-2]&RC[-1] -> 20231 | N196: =IF((R[-1]C[5]+1)<=VLOOKUP(R[-1]C[4],C7:C8,2,FALSE),(R[-1]C[5]+1),1) -> 30 | P196: =IF(AND(RC[1]=1,RC[3]<7),RC[-5]+1,RC[-5]) -> 2023 | Q196: =IF(RC[2]<7,IF((RC[-5]+1)<13,(RC[-5]+1),(1)),RC[-5]) -> 2 | R196: =RC[-2]&RC[-1] -> 20232 | S196: =IF((RC[-5]+6)<=VLOOKUP(RC[-6],C7:C8,2,FALSE),(RC[-5]+6),(RC[-5]+6)-VLOOKUP(RC[-6],C7:C8,2,FALSE)) -> 5 | U196: 191 | W196: =RC[-12]&R1C19&RC[-11]&R1C19&RC[-9]&",0,0,0" -> 2023,1,30,0,0,0 | X196: =RC[-8]&R1C19&RC[-7]&R1C19&RC[-5]&",23,59,59" -> 2023,2,5,23,59,59
K197: =IF(AND(RC[1]=1,RC[3]=1),R[-1]C[5]+1,R[-1]C[5]) -> 2023 | L197: =IF(RC[2]=1,IF((R[-1]C[5]+1)<13,(R[-1]C[5]+1),(1)),R[-1]C[5]) -> 2 | M197: =RC[-2]&RC[-1] -> 20232 | N197: =IF((R[-1]C[5]+1)<=VLOOKUP(R[-1]C[4],C7:C8,2,FALSE),(R[-1]C[5]+1),1) -> 6 | P197: =IF(AND(RC[1]=1,RC[3]<7),RC[-5]+1,RC[-5]) -> 2023 | Q197: =IF(RC[2]<7,IF((RC[-5]+1)<13,(RC[-5]+1),(1)),RC[-5]) -> 2 | R197: =RC[-2]&RC[-1] -> 20232 | S197: =IF((RC[-5]+6)<=VLOOKUP(RC[-6],C7:C8,2,FALSE),(RC[-5]+6),(RC[-5]+6)-VLOOKUP(RC[-6],C7:C8,2,FALSE)) -> 12 | U197: 192 | W197: =RC[-12]&R1C19&RC[-11]&R1C19&RC[-9]&",0,0,0" -> 2023,2,6,0,0,0 | X197: =RC[-8]&R1C19&RC[-7]&R1C19&RC[-5]&",23,59,59" -> 2023,2,12,23,59,59
K198: =IF(AND(RC[1]=1,RC[3]=1),R[-1]C[5]+1,R[-1]C[5]) -> 2023 | L198: =IF(RC[2]=1,IF((R[-1]C[5]+1)<13,(R[-1]C[5]+1),(1)),R[-1]C[5]) -> 2 | M198: =RC[-2]&RC[-1] -> 20232 | N198: =IF((R[-1]C[5]+1)<=VLOOKUP(R[-1]C[4],C7:C8,2,FALSE),(R[-1]C[5]+1),1) -> 13 | P198: =IF(AND(RC[1]=1,RC[3]<7),RC[-5]+1,RC[-5]) -> 2023 | Q198: =IF(RC[2]<7,IF((RC[-5]+1)<13,(RC[-5]+1),(1)),RC[-5]) -> 2 | R198: =RC[-2]&RC[-1] -> 20232 | S198: =IF((RC[-5]+6)<=VLOOKUP(RC[-6],C7:C8,2,FALSE),(RC[-5]+6),(RC[-5]+6)-VLOOKUP(RC[-6],C7:C8,2,FALSE)) -> 19 | U198: 193 | W198: =RC[-12]&R1C19&RC[-11]&R1C19&RC[-9]&",0,0,0" -> 2023,2,13,0,0,0 | X198: =RC[-8]&R1C19&RC[-7]&R1C19&RC[-5]&",23,59,59" -> 2023,2,19,23,59,59
K199: =IF(AND(RC[1]=1,RC[3]=1),R[-1]C[5]+1,R[-1]C[5]) -> 2023 | L199: =IF(RC[2]=1,IF((R[-1]C[5]+1)<13,(R[-1]C[5]+1),(1)),R[-1]C[5]) -> 2 | M199: =RC[-2]&RC[-1] -> 20232 | N199: =IF((R[-1]C[5]+1)<=VLOOKUP(R[-1]C[4],C7:C8,2,FALSE),(R[-1]C[5]+1),1) -> 20 | P199: =IF(AND(RC[1]=1,RC[3]<7),RC[-5]+1,RC[-5]) -> 2023 | Q199: =IF(RC[2]<7,IF((RC[-5]+1)<13,(RC[-5]+1),(1)),RC[-5]) -> 2 | R199: =RC[-2]&RC[-1] -> 20232 | S199: =IF((RC[-5]+6)<=VLOOKUP(RC[-6],C7:C8,2,FALSE),(RC[-5]+6),(RC[-5]+6)-VLOOKUP(RC[-6],C7:C8,2,FALSE)) -> 26 | U199: 194 | W199: =RC[-12]&R1C19&RC[-11]&R1C19&RC[-9]&",0,0,0" -> 2023,2,20,0,0,0 | X199: =RC[-8]&R1C19&RC[-7]&R1C19&RC[-5]&",23,59,59" -> 2023,2,26,23,59,59
K200: =IF(AND(RC[1]=1,RC[3]=1),R[-1]C[5]+1,R[-1]C[5]) -> 2023 | L200: =IF(RC[2]=1,IF((R[-1]C[5]+1)<13,(R[-1]C[5]+1),(1)),R[-1]C[5]) -> 2 | M200: =RC[-2]&RC[-1] -> 20232 | N200: =IF((R[-1]C[5]+1)<=VLOOKUP(R[-1]C[4],C7:C8,2,FALSE),(R[-1]C[5]+1),1) -> 27 | P200: =IF(AND(RC[1]=1,RC[3]<7),RC[-5]+1,RC[-5]) -> 2023 | Q200: =IF(RC[2]<7,IF((RC[-5]+1)<13,(RC[-5]+1),(1)),RC[-5]) -> 3 | R200: =RC[-2]&RC[-1] -> 20233 | S200: =IF((RC[-5]+6)<=VLOOKUP(RC[-6],C7:C8,2,FALSE),(RC[-5]+6),(RC[-5]+6)-VLOOKUP(RC[-6],C7:C8,2,FALSE)) -> 5 | U200: 195 | W200: =RC[-12]&R1C19&RC[-11]&R1C19&RC[-9]&",0,0,0" -> 2023,2,27,0,0,0 | X200: =RC[-8]&R1C19&RC[-7]&R1C19&RC[-5]&",23,59,59" -> 2023,3,5,23,59,59
K201: =IF(AND(RC[1]=1,RC[3]=1),R[-1]C[5]+1,R[-1]C[5]) -> 2023 | L201: =IF(RC[2]=1,IF((R[-1]C[5]+1)<13,(R[-1]C[5]+1),(1)),R[-1]C[5]) -> 3 | M201: =RC[-2]&RC[-1] -> 20233 | N201: =IF((R[-1]C[5]+1)<=VLOOKUP(R[-1]C[4],C7:C8,2,FALSE),(R[-1]C[5]+1),1) -> 6 | P201: =IF(AND(RC[1]=1,RC[3]<7),RC[-5]+1,RC[-5]) -> 2023 | Q201: =IF(RC[2]<7,IF((RC[-5]+1)<13,(RC[-5]+1),(1)),RC[-5]) -> 3 | R201: =RC[-2]&RC[-1] -> 20233 | S201: =IF((RC[-5]+6)<=VLOOKUP(RC[-6],C7:C8,2,FALSE),(RC[-5]+6),(RC[-5]+6)-VLOOKUP(RC[-6],C7:C8,2,FALSE)) -> 12 | U201: 196 | W201: =RC[-12]&R1C19&RC[-11]&R1C19&RC[-9]&",0,0,0" -> 2023,3,6,0,0,0 | X201: =RC[-8]&R1C19&RC[-7]&R1C19&RC[-5]&",23,59,59" -> 2023,3,12,23,59,59
K202: =IF(AND(RC[1]=1,RC[3]=1),R[-1]C[5]+1,R[-1]C[5]) -> 2023 | L202: =IF(RC[2]=1,IF((R[-1]C[5]+1)<13,(R[-1]C[5]+1),(1)),R[-1]C[5]) -> 3 | M202: =RC[-2]&RC[-1] -> 20233 | N202: =IF((R[-1]C[5]+1)<=VLOOKUP(R[-1]C[4],C7:C8,2,FALSE),(R[-1]C[5]+1),1) -> 13 | P202: =IF(AND(RC[1]=1,RC[3]<7),RC[-5]+1,RC[-5]) -> 2023 | Q202: =IF(RC[2]<7,IF((RC[-5]+1)<13,(RC[-5]+1),(1)),RC[-5]) -> 3 | R202: =RC[-2]&RC[-1] -> 20233 | S202: =IF((RC[-5]+6)<=VLOOKUP(RC[-6],C7:C8,2,FALSE),(RC[-5]+6),(RC[-5]+6)-VLOOKUP(RC[-6],C7:C8,2,FALSE)) -> 19 | U202: 197 | W202: =RC[-12]&R1C19&RC[-11]&R1C19&RC[-9]&",0,0,0" -> 2023,3,13,0,0,0 | X202: =RC[-8]&R1C19&RC[-7]&R1C19&RC[-5]&",23,59,59" -> 2023,3,19,23,59,59
K203: =IF(AND(RC[1]=1,RC[3]=1),R[-1]C[5]+1,R[-1]C[5]) -> 2023 | L203: =IF(RC[2]=1,IF((R[-1]C[5]+1)<13,(R[-1]C[5]+1),(1)),R[-1]C[5]) -> 3 | M203: =RC[-2]&RC[-1] -> 20233 | N203: =IF((R[-1]C[5]+1)<=VLOOKUP(R[-1]C[4],C7:C8,2,FALSE),(R[-1]C[5]+1),1) -> 20 | P203: =IF(AND(RC[1]=1,RC[3]<7),RC[-5]+1,RC[-5]) -> 2023 | Q203: =IF(RC[2]<7,IF((RC[-5]+1)<13,(RC[-5]+1),(1)),RC[-5]) -> 3 | R203: =RC[-2]&RC[-1] -> 20233 | S203: =IF((RC[-5]+6)<=VLOOKUP(RC[-6],C7:C8,2,FALSE),(RC[-5]+6),(RC[-5]+6)-VLOOKUP(RC[-6],C7:C8,2,FALSE)) -> 26 | U203: 198 | W203: =RC[-12]&R1C19&RC[-11]&R1C19&RC[-9]&",0,0,0" -> 2023,3,20,0,0,0 | X203: =RC[-8]&R1C19&RC[-7]&R1C19&RC[-5]&",23,59,59" -> 2023,3,26,23,59,59
K204: =IF(AND(RC[1]=1,RC[3]=1),R[-1]C[5]+1,R[-1]C[5]) -> 2023 | L204: =IF(RC[2]=1,IF((R[-1]C[5]+1)<13,(R[-1]C[5]+1),(1)),R[-1]C[5]) -> 3 | M204: =RC[-2]&RC[-1] -> 20233 | N204: =IF((R[-1]C[5]+1)<=VLOOKUP(R[-1]C[4],C7:C8,2,FALSE),(R[-1]C[5]+1),1) -> 27 | P204: =IF(AND(RC[1]=1,RC[3]<7),RC[-5]+1,RC[-5]) -> 2023 | Q204: =IF(RC[2]<7,IF((RC[-5]+1)<13,(RC[-5]+1),(1)),RC[-5]) -> 4 | R204: =RC[-2]&RC[-1] -> 20234 | S204: =IF((RC[-5]+6)<=VLOOKUP(RC[-6],C7:C8,2,FALSE),(RC[-5]+6),(RC[-5]+6)-VLOOKUP(RC[-6],C7:C8,2,FALSE)) -> 2 | U204: 199 | W204: =RC[-12]&R1C19&RC[-11]&R1C19&RC[-9]&",0,0,0" -> 2023,3,27,0,0,0 | X204: =RC[-8]&R1C19&RC[-7]&R1C19&RC[-5]&",23,59,59" -> 2023,4,2,23,59,59
K205: =IF(AND(RC[1]=1,RC[3]=1),R[-1]C[5]+1,R[-1]C[5]) -> 2023 | L205: =IF(RC[2]=1,IF((R[-1]C[5]+1)<13,(R[-1]C[5]+1),(1)),R[-1]C[5]) -> 4 | M205: =RC[-2]&RC[-1] -> 20234 | N205: =IF((R[-1]C[5]+1)<=VLOOKUP(R[-1]C[4],C7:C8,2,FALSE),(R[-1]C[5]+1),1) -> 3 | P205: =IF(AND(RC[1]=1,RC[3]<7),RC[-5]+1,RC[-5]) -> 2023 | Q205: =IF(RC[2]<7,IF((RC[-5]+1)<13,(RC[-5]+1),(1)),RC[-5]) -> 4 | R205: =RC[-2]&RC[-1] -> 20234 | S205: =IF((RC[-5]+6)<=VLOOKUP(RC[-6],C7:C8,2,FALSE),(RC[-5]+6),(RC[-5]+6)-VLOOKUP(RC[-6],C7:C8,2,FALSE)) -> 9 | U205: 200 | W205: =RC[-12]&R1C19&RC[-11]&R1C19&RC[-9]&",0,0,0" -> 2023,4,3,0,0,0 | X205: =RC[-8]&R1C19&RC[-7]&R1C19&RC[-5]&",23,59,59" -> 2023,4,9,23,59,59
K206: =IF(AND(RC[1]=1,RC[3]=1),R[-1]C[5]+1,R[-1]C[5]) -> 2023 | L206: =IF(RC[2]=1,IF((R[-1]C[5]+1)<13,(R[-1]C[5]+1),(1)),R[-1]C[5]) -> 4 | M206: =RC[-2]&RC[-1] -> 20234 | N206: =IF((R[-1]C[5]+1)<=VLOOKUP(R[-1]C[4],C7:C8,2,FALSE),(R[-1]C[5]+1),1) -> 10 | P206: =IF(AND(RC[1]=1,RC[3]<7),RC[-5]+1,RC[-5]) -> 2023 | Q206: =IF(RC[2]<7,IF((RC[-5]+1)<13,(RC[-5]+1),(1)),RC[-5]) -> 4 | R206: =RC[-2]&RC[-1] -> 20234 | S206: =IF((RC[-5]+6)<=VLOOKUP(RC[-6],C7:C8,2,FALSE),(RC[-5]+6),(RC[-5]+6)-VLOOKUP(RC[-6],C7:C8,2,FALSE)) -> 16 | U206: 201 | W206: =RC[-12]&R1C19&RC[-11]&R1C19&RC[-9]&",0,0,0" -> 2023,4,10,0,0,0 | X206: =RC[-8]&R1C19&RC[-7]&R1C19&RC[-5]&",23,59,59" -> 2023,4,16,23,59,59
K207: =IF(AND(RC[1]=1,RC[3]=1),R[-1]C[5]+1,R[-1]C[5]) -> 2023 | L207: =IF(RC[2]=1,IF((R[-1]C[5]+1)<13,(R[-1]C[5]+1),(1)),R[-1]C[5]) -> 4 | M207: =RC[-2]&RC[-1] -> 20234 | N207: =IF((R[-1]C[5]+1)<=VLOOKUP(R[-1]C[4],C7:C8,2,FALSE),(R[-1]C[5]+1),1) -> 17 | P207: =IF(AND(RC[1]=1,RC[3]<7),RC[-5]+1,RC[-5]) -> 2023 | Q207: =IF(RC[2]<7,IF((RC[-5]+1)<13,(RC[-5]+1),(1)),RC[-5]) -> 4 | R207: =RC[-2]&RC[-1] -> 20234 | S207: =IF((RC[-5]+6)<=VLOOKUP(RC[-6],C7:C8,2,FALSE),(RC[-5]+6),(RC[-5]+6)-VLOOKUP(RC[-6],C7:C8,2,FALSE)) -> 23 | U207: 202 | W207: =RC[-12]&R1C19&RC[-11]&R1C19&RC[-9]&",0,0,0" -> 2023,4,17,0,0,0 | X207: =RC[-8]&R1C19&RC[-7]&R1C19&RC[-5]&",23,59,59" -> 2023,4,23,23,59,59
K208: =IF(AND(RC[1]=1,RC[3]=1),R[-1]C[5]+1,R[-1]C[5]) -> 2023 | L208: =IF(RC[2]=1,IF((R[-1]C[5]+1)<13,(R[-1]C[5]+1),(1)),R[-1]C[5]) -> 4 | M208: =RC[-2]&RC[-1] -> 20234 | N208: =IF((R[-1]C[5]+1)<=VLOOKUP(R[-1]C[4],C7:C8,2,FALSE),(R[-1]C[5]+1),1) -> 24 | P208: =IF(AND(RC[1]=1,RC[3]<7),RC[-5]+1,RC[-5]) -> 2023 | Q208: =IF(RC[2]<7,IF((RC[-5]+1)<13,(RC[-5]+1),(1)),RC[-5]) -> 4 | R208: =RC[-2]&RC[-1] -> 20234 | S208: =IF((RC[-5]+6)<=VLOOKUP(RC[-6],C7:C8,2,FALSE),(RC[-5]+6),(RC[-5]+6)-VLOOKUP(RC[-6],C7:C8,2,FALSE)) -> 30 | U208: 203 | W208: =RC[-12]&R1C19&RC[-11]&R1C19&RC[-9]&",0,0,0" -> 2023,4,24,0,0,0 | X208: =RC[-8]&R1C19&RC[-7]&R1C19&RC[-5]&",23,59,59" -> 2023,4,30,23,59,59
K209: =IF(AND(RC[1]=1,RC[3]=1),R[-1]C[5]+1,R[-1]C[5]) -> 2023 | L209: =IF(RC[2]=1,IF((R[-1]C[5]+1)<13,(R[-1]C[5]+1),(1)),R[-1]C[5]) -> 5 | M209: =RC[-2]&RC[-1] -> 20235 | N209: =IF((R[-1]C[5]+1)<=VLOOKUP(R[-1]C[4],C7:C8,2,FALSE),(R[-1]C[5]+1),1) -> 1 | P209: =IF(AND(RC[1]=1,RC[3]<7),RC[-5]+1,RC[-5]) -> 2023 | Q209: =IF(RC[2]<7,IF((RC[-5]+1)<13,(RC[-5]+1),(1)),RC[-5]) -> 5 | R209: =RC[-2]&RC[-1] -> 20235 | S209: =IF((RC[-5]+6)<=VLOOKUP(RC[-6],C7:C8,2,FALSE),(RC[-5]+6),(RC[-5]+6)-VLOOKUP(RC[-6],C7:C8,2,FALSE)) -> 7 | U209: 204 | W209: =RC[-12]&R1C19&RC[-11]&R1C19&RC[-9]&",0,0,0" -> 2023,5,1,0,0,0 | X209: =RC[-8]&R1C19&RC[-7]&R1C19&RC[-5]&",23,59,59" -> 2023,5,7,23,59,59
K210: =IF(AND(RC[1]=1,RC[3]=1),R[-1]C[5]+1,R[-1]C[5]) -> 2023 | L210: =IF(RC[2]=1,IF((R[-1]C[5]+1)<13,(R[-1]C[5]+1),(1)),R[-1]C[5]) -> 5 | M210: =RC[-2]&RC[-1] -> 20235 | N210: =IF((R[-1]C[5]+1)<=VLOOKUP(R[-1]C[4],C7:C8,2,FALSE),(R[-1]C[5]+1),1) -> 8 | P210: =IF(AND(RC[1]=1,RC[3]<7),RC[-5]+1,RC[-5]) -> 2023 | Q210: =IF(RC[2]<7,IF((RC[-5]+1)<13,(RC[-5]+1),(1)),RC[-5]) -> 5 | R210: =RC[-2]&RC[-1] -> 20235 | S210: =IF((RC[-5]+6)<=VLOOKUP(RC[-6],C7:C8,2,FALSE),(RC[-5]+6),(RC[-5]+6)-VLOOKUP(RC[-6],C7:C8,2,FALSE)) -> 14 | U210: 205 | W210: =RC[-12]&R1C19&RC[-11]&R1C19&RC[-9]&",0,0,0" -> 2023,5,8,0,0,0 | X210: =RC[-8]&R1C19&RC[-7]&R1C19&RC[-5]&",23,59,59" -> 2023,5,14,23,59,59
K211: =IF(AND(RC[1]=1,RC[3]=1),R[-1]C[5]+1,R[-1]C[5]) -> 2023 | L211: =IF(RC[2]=1,IF((R[-1]C[5]+1)<13,(R[-1]C[5]+1),(1)),R[-1]C[5]) -> 5 | M211: =RC[-2]&RC[-1] -> 20235 | N211: =IF((R[-1]C[5]+1)<=VLOOKUP(R[-1]C[4],C7:C8,2,FALSE),(R[-1]C[5]+1),1) -> 15 | P211: =IF(AND(RC[1]=1,RC[3]<7),RC[-5]+1,RC[-5]) -> 2023 | Q211: =IF(RC[2]<7,IF((RC[-5]+1)<13,(RC[-5]+1),(1)),RC[-5]) -> 5 | R211: =RC[-2]&RC[-1] -> 20235 | S211: =IF((RC[-5]+6)<=VLOOKUP(RC[-6],C7:C8,2,FALSE),(RC[-5]+6),(RC[-5]+6)-VLOOKUP(RC[-6],C7:C8,2,FALSE)) -> 21 | U211: 206 | W211: =RC[-12]&R1C19&RC[-11]&R1C19&RC[-9]&",0,0,0" -> 2023,5,15,0,0,0 | X211: =RC[-8]&R1C19&RC[-7]&R1C19&RC[-5]&",23,59,59" -> 2023,5,21,23,59,59
K212: =IF(AND(RC[1]=1,RC[3]=1),R[-1]C[5]+1,R[-1]C[5]) -> 2023 | L212: =IF(RC[2]=1,IF((R[-1]C[5]+1)<13,(R[-1]C[5]+1),(1)),R[-1]C[5]) -> 5 | M212: =RC[-2]&RC[-1] -> 20235 | N212: =IF((R[-1]C[5]+1)<=VLOOKUP(R[-1]C[4],C7:C8,2,FALSE),(R[-1]C[5]+1),1) -> 22 | P212: =IF(AND(RC[1]=1,RC[3]<7),RC[-5]+1,RC[-5]) -> 2023 | Q212: =IF(RC[2]<7,IF((RC[-5]+1)<13,(RC[-5]+1),(1)),RC[-5]) -> 5 | R212: =RC[-2]&RC[-1] -> 20235 | S212: =IF((RC[-5]+6)<=VLOOKUP(RC[-6],C7:C8,2,FALSE),(RC[-5]+6),(RC[-5]+6)-VLOOKUP(RC[-6],C7:C8,2,FALSE)) -> 28 | U212: 207 | W212: =RC[-12]&R1C19&RC[-11]&R1C19&RC[-9]&",0,0,0" -> 2023,5,22,0,0,0 | X212: =RC[-8]&R1C19&RC[-7]&R1C19&RC[-5]&",23,59,59" -> 2023,5,28,23,59,59
K213: =IF(AND(RC[1]=1,RC[3]=1),R[-1]C[5]+1,R[-1]C[5]) -> 2023 | L213: =IF(RC[2]=1,IF((R[-1]C[5]+1)<13,(R[-1]C[5]+1),(1)),R[-1]C[5]) -> 5 | M213: =RC[-2]&RC[-1] -> 20235 | N213: =IF((R[-1]C[5]+1)<=VLOOKUP(R[-1]C[4],C7:C8,2,FALSE),(R[-1]C[5]+1),1) -> 29 | P213: =IF(AND(RC[1]=1,RC[3]<7),RC[-5]+1,RC[-5]) -> 2023 | Q213: =IF(RC[2]<7,IF((RC[-5]+1)<13,(RC[-5]+1),(1)),RC[-5]) -> 6 | R213: =RC[-2]&RC[-1] -> 20236 | S213: =IF((RC[-5]+6)<=VLOOKUP(RC[-6],C7:C8,2,FALSE),(RC[-5]+6),(RC[-5]+6)-VLOOKUP(RC[-6],C7:C8,2,FALSE)) -> 4 | U213: 208 | W213: =RC[-12]&R1C19&RC[-11]&R1C19&RC[-9]&",0,0,0" -> 2023,5,29,0,0,0 | X213: =RC[-8]&R1C19&RC[-7]&R1C19&RC[-5]&",23,59,59" -> 2023,6,4,23,59,59
K214: =IF(AND(RC[1]=1,RC[3]=1),R[-1]C[5]+1,R[-1]C[5]) -> 2023 | L214: =IF(RC[2]=1,IF((R[-1]C[5]+1)<13,(R[-1]C[5]+1),(1)),R[-1]C[5]) -> 6 | M214: =RC[-2]&RC[-1] -> 20236 | N214: =IF((R[-1]C[5]+1)<=VLOOKUP(R[-1]C[4],C7:C8,2,FALSE),(R[-1]C[5]+1),1) -> 5 | P214: =IF(AND(RC[1]=1,RC[3]<7),RC[-5]+1,RC[-5]) -> 2023 | Q214: =IF(RC[2]<7,IF((RC[-5]+1)<13,(RC[-5]+1),(1)),RC[-5]) -> 6 | R214: =RC[-2]&RC[-1] -> 20236 | S214: =IF((RC[-5]+6)<=VLOOKUP(RC[-6],C7:C8,2,FALSE),(RC[-5]+6),(RC[-5]+6)-VLOOKUP(RC[-6],C7:C8,2,FALSE)) -> 11 | U214: 209 | W214: =RC[-12]&R1C19&RC[-11]&R1C19&RC[-9]&",0,0,0" -> 2023,6,5,0,0,0 | X214: =RC[-8]&R1C19&RC[-7]&R1C19&RC[-5]&",23,59,59" -> 2023,6,11,23,59,59
K215: =IF(AND(RC[1]=1,RC[3]=1),R[-1]C[5]+1,R[-1]C[5]) -> 2023 | L215: =IF(RC[2]=1,IF((R[-1]C[5]+1)<13,(R[-1]C[5]+1),(1)),R[-1]C[5]) -> 6 | M215: =RC[-2]&RC[-1] -> 20236 | N215: =IF((R[-1]C[5]+1)<=VLOOKUP(R[-1]C[4],C7:C8,2,FALSE),(R[-1]C[5]+1),1) -> 12 | P215: =IF(AND(RC[1]=1,RC[3]<7),RC[-5]+1,RC[-5]) -> 2023 | Q215: =IF(RC[2]<7,IF((RC[-5]+1)<13,(RC[-5]+1),(1)),RC[-5]) -> 6 | R215: =RC[-2]&RC[-1] -> 20236 | S215: =IF((RC[-5]+6)<=VLOOKUP(RC[-6],C7:C8,2,FALSE),(RC[-5]+6),(RC[-5]+6)-VLOOKUP(RC[-6],C7:C8,2,FALSE)) -> 18 | U215: 210 | W215: =RC[-12]&R1C19&RC[-11]&R1C19&RC[-9]&",0,0,0" -> 2023,6,12,0,0,0 | X215: =RC[-8]&R1C19&RC[-7]&R1C19&RC[-5]&",23,59,59" -> 2023,6,18,23,59,59
K216: =IF(AND(RC[1]=1,RC[3]=1),R[-1]C[5]+1,R[-1]C[5]) -> 2023 | L216: =IF(RC[2]=1,IF((R[-1]C[5]+1)<13,(R[-1]C[5]+1),(1)),R[-1]C[5]) -> 6 | M216: =RC[-2]&RC[-1] -> 20236 | N216: =IF((R[-1]C[5]+1)<=VLOOKUP(R[-1]C[4],C7:C8,2,FALSE),(R[-1]C[5]+1),1) -> 19 | P216: =IF(AND(RC[1]=1,RC[3]<7),RC[-5]+1,RC[-5]) -> 2023 | Q216: =IF(RC[2]<7,IF((RC[-5]+1)<13,(RC[-5]+1),(1)),RC[-5]) -> 6 | R216: =RC[-2]&RC[-1] -> 20236 | S216: =IF((RC[-5]+6)<=VLOOKUP(RC[-6],C7:C8,2,FALSE),(RC[-5]+6),(RC[-5]+6)-VLOOKUP(RC[-6],C7:C8,2,FALSE)) -> 25 | U216: 211 | W216: =RC[-12]&R1C19&RC[-11]&R1C19&RC[-9]&",0,0,0" -> 2023,6,19,0,0,0 | X216: =RC[-8]&R1C19&RC[-7]&R1C19&RC[-5]&",23,59,59" -> 2023,6,25,23,59,59
K217: =IF(AND(RC[1]=1,RC[3]=1),R[-1]C[5]+1,R[-1]C[5]) -> 2023 | L217: =IF(RC[2]=1,IF((R[-1]C[5]+1)<13,(R[-1]C[5]+1),(1)),R[-1]C[5]) -> 6 | M217: =RC[-2]&RC[-1] -> 20236 | N217: =IF((R[-1]C[5]+1)<=VLOOKUP(R[-1]C[4],C7:C8,2,FALSE),(R[-1]C[5]+1),1) -> 26 | P217: =IF(AND(RC[1]=1,RC[3]<7),RC[-5]+1,RC[-5]) -> 2023 | Q217: =IF(RC[2]<7,IF((RC[-5]+1)<13,(RC[-5]+1),(1)),RC[-5]) -> 7 | R217: =RC[-2]&RC[-1] -> 20237 | S217: =IF((RC[-5]+6)<=VLOOKUP(RC[-6],C7:C8,2,FALSE),(RC[-5]+6),(RC[-5]+6)-VLOOKUP(RC[-6],C7:C8,2,FALSE)) -> 2 | U217: 212 | W217: =RC[-12]&R1C19&RC[-11]&R1C19&RC[-9]&",0,0,0" -> 2023,6,26,0,0,0 | X217: =RC[-8]&R1C19&RC[-7]&R1C19&RC[-5]&",23,59,59" -> 2023,7,2,23,59,59
K218: =IF(AND(RC[1]=1,RC[3]=1),R[-1]C[5]+1,R[-1]C[5]) -> 2023 | L218: =IF(RC[2]=1,IF((R[-1]C[5]+1)<13,(R[-1]C[5]+1),(1)),R[-1]C[5]) -> 7 | M218: =RC[-2]&RC[-1] -> 20237 | N218: =IF((R[-1]C[5]+1)<=VLOOKUP(R[-1]C[4],C7:C8,2,FALSE),(R[-1]C[5]+1),1) -> 3 | P218: =IF(AND(RC[1]=1,RC[3]<7),RC[-5]+1,RC[-5]) -> 2023 | Q218: =IF(RC[2]<7,IF((RC[-5]+1)<13,(RC[-5]+1),(1)),RC[-5]) -> 7 | R218: =RC[-2]&RC[-1] -> 20237 | S218: =IF((RC[-5]+6)<=VLOOKUP(RC[-6],C7:C8,2,FALSE),(RC[-5]+6),(RC[-5]+6)-VLOOKUP(RC[-6],C7:C8,2,FALSE)) -> 9 | U218: 213 | W218: =RC[-12]&R1C19&RC[-11]&R1C19&RC[-9]&",0,0,0" -> 2023,7,3,0,0,0 | X218: =RC[-8]&R1C19&RC[-7]&R1C19&RC[-5]&",23,59,59" -> 2023,7,9,23,59,59
K219: =IF(AND(RC[1]=1,RC[3]=1),R[-1]C[5]+1,R[-1]C[5]) -> 2023 | L219: =IF(RC[2]=1,IF((R[-1]C[5]+1)<13,(R[-1]C[5]+1),(1)),R[-1]C[5]) -> 7 | M219: =RC[-2]&RC[-1] -> 20237 | N219: =IF((R[-1]C[5]+1)<=VLOOKUP(R[-1]C[4],C7:C8,2,FALSE),(R[-1]C[5]+1),1) -> 10 | P219: =IF(AND(RC[1]=1,RC[3]<7),RC[-5]+1,RC[-5]) -> 2023 | Q219: =IF(RC[2]<7,IF((RC[-5]+1)<13,(RC[-5]+1),(1)),RC[-5]) -> 7 | R219: =RC[-2]&RC[-1] -> 20237 | S219: =IF((RC[-5]+6)<=VLOOKUP(RC[-6],C7:C8,2,FALSE),(RC[-5]+6),(RC[-5]+6)-VLOOKUP(RC[-6],C7:C8,2,FALSE)) -> 16 | U219: 214 | W219: =RC[-12]&R1C19&RC[-11]&R1C19&RC[-9]&",0,0,0" -> 2023,7,10,0,0,0 | X219: =RC[-8]&R1C19&RC[-7]&R1C19&RC[-5]&",23,59,59" -> 2023,7,16,23,59,59
K220: =IF(AND(RC[1]=1,RC[3]=1),R[-1]C[5]+1,R[-1]C[5]) -> 2023 | L220: =IF(RC[2]=1,IF((R[-1]C[5]+1)<13,(R[-1]C[5]+1),(1)),R[-1]C[5]) -> 7 | M220: =RC[-2]&RC[-1] -> 20237 | N220: =IF((R[-1]C[5]+1)<=VLOOKUP(R[-1]C[4],C7:C8,2,FALSE),(R[-1]C[5]+1),1) -> 17 | P220: =IF(AND(RC[1]=1,RC[3]<7),RC[-5]+1,RC[-5]) -> 2023 | Q220: =IF(RC[2]<7,IF((RC[-5]+1)<13,(RC[-5]+1),(1)),RC[-5]) -> 7 | R220: =RC[-2]&RC[-1] -> 20237 | S220: =IF((RC[-5]+6)<=VLOOKUP(RC[-6],C7:C8,2,FALSE),(RC[-5]+6),(RC[-5]+6)-VLOOKUP(RC[-6],C7:C8,2,FALSE)) -> 23 | U220: 215 | W220: =RC[-12]&R1C19&RC[-11]&R1C19&RC[-9]&",0,0,0" -> 2023,7,17,0,0,0 | X220: =RC[-8]&R1C19&RC[-7]&R1C19&RC[-5]&",23,59,59" -> 2023,7,23,23,59,59
K221: =IF(AND(RC[1]=1,RC[3]=1),R[-1]C[5]+1,R[-1]C[5]) -> 2023 | L221: =IF(RC[2]=1,IF((R[-1]C[5]+1)<13,(R[-1]C[5]+1),(1)),R[-1]C[5]) -> 7 | M221: =RC[-2]&RC[-1] -> 20237 | N221: =IF((R[-1]C[5]+1)<=VLOOKUP(R[-1]C[4],C7:C8,2,FALSE),(R[-1]C[5]+1),1) -> 24 | P221: =IF(AND(RC[1]=1,RC[3]<7),RC[-5]+1,RC[-5]) -> 2023 | Q221: =IF(RC[2]<7,IF((RC[-5]+1)<13,(RC[-5]+1),(1)),RC[-5]) -> 7 | R221: =RC[-2]&RC[-1] -> 20237 | S221: =IF((RC[-5]+6)<=VLOOKUP(RC[-6],C7:C8,2,FALSE),(RC[-5]+6),(RC[-5]+6)-VLOOKUP(RC[-6],C7:C8,2,FALSE)) -> 30 | U221: 216 | W221: =RC[-12]&R1C19&RC[-11]&R1C19&RC[-9]&",0,0,0" -> 2023,7,24,0,0,0 | X221: =RC[-8]&R1C19&RC[-7]&R1C19&RC[-5]&",23,59,59" -> 2023,7,30,23,59,59
K222: =IF(AND(RC[1]=1,RC[3]=1),R[-1]C[5]+1,R[-1]C[5]) -> 2023 | L222: =IF(RC[2]=1,IF((R[-1]C[5]+1)<13,(R[-1]C[5]+1),(1)),R[-1]C[5]) -> 7 | M222: =RC[-2]&RC[-1] -> 20237 | N222: =IF((R[-1]C[5]+1)<=VLOOKUP(R[-1]C[4],C7:C8,2,FALSE),(R[-1]C[5]+1),1) -> 31 | P222: =IF(AND(RC[1]=1,RC[3]<7),RC[-5]+1,RC[-5]) -> 2023 | Q222: =IF(RC[2]<7,IF((RC[-5]+1)<13,(RC[-5]+1),(1)),RC[-5]) -> 8 | R222: =RC[-2]&RC[-1] -> 20238 | S222: =IF((RC[-5]+6)<=VLOOKUP(RC[-6],C7:C8,2,FALSE),(RC[-5]+6),(RC[-5]+6)-VLOOKUP(RC[-6],C7:C8,2,FALSE)) -> 6 | U222: 217 | W222: =RC[-12]&R1C19&RC[-11]&R1C19&RC[-9]&",0,0,0" -> 2023,7,31,0,0,0 | X222: =RC[-8]&R1C19&RC[-7]&R1C19&RC[-5]&",23,59,59" -> 2023,8,6,23,59,59
K223: =IF(AND(RC[1]=1,RC[3]=1),R[-1]C[5]+1,R[-1]C[5]) -> 2023 | L223: =IF(RC[2]=1,IF((R[-1]C[5]+1)<13,(R[-1]C[5]+1),(1)),R[-1]C[5]) -> 8 | M223: =RC[-2]&RC[-1] -> 20238 | N223: =IF((R[-1]C[5]+1)<=VLOOKUP(R[-1]C[4],C7:C8,2,FALSE),(R[-1]C[5]+1),1) -> 7 | P223: =IF(AND(RC[1]=1,RC[3]<7),RC[-5]+1,RC[-5]) -> 2023 | Q223: =IF(RC[2]<7,IF((RC[-5]+1)<13,(RC[-5]+1),(1)),RC[-5]) -> 8 | R223: =RC[-2]&RC[-1] -> 20238 | S223: =IF((RC[-5]+6)<=VLOOKUP(RC[-6],C7:C8,2,FALSE),(RC[-5]+6),(RC[-5]+6)-VLOOKUP(RC[-6],C7:C8,2,FALSE)) -> 13 | U223: 218 | W223: =RC[-12]&R1C19&RC[-11]&R1C19&RC[-9]&",0,0,0" -> 2023,8,7,0,0,0 | X223: =RC[-8]&R1C19&RC[-7]&R1C19&RC[-5]&",23,59,59" -> 2023,8,13,23,59,59
K224: =IF(AND(RC[1]=1,RC[3]=1),R[-1]C[5]+1,R[-1]C[5]) -> 2023 | L224: =IF(RC[2]=1,IF((R[-1]C[5]+1)<13,(R[-1]C[5]+1),(1)),R[-1]C[5]) -> 8 | M224: =RC[-2]&RC[-1] -> 20238 | N224: =IF((R[-1]C[5]+1)<=VLOOKUP(R[-1]C[4],C7:C8,2,FALSE),(R[-1]C[5]+1),1) -> 14 | P224: =IF(AND(RC[1]=1,RC[3]<7),RC[-5]+1,RC[-5]) -> 2023 | Q224: =IF(RC[2]<7,IF((RC[-5]+1)<13,(RC[-5]+1),(1)),RC[-5]) -> 8 | R224: =RC[-2]&RC[-1] -> 20238 | S224: =IF((RC[-5]+6)<=VLOOKUP(RC[-6],C7:C8,2,FALSE),(RC[-5]+6),(RC[-5]+6)-VLOOKUP(RC[-6],C7:C8,2,FALSE)) -> 20 | U224: 219 | W224: =RC[-12]&R1C19&RC[-11]&R1C19&RC[-9]&",0,0,0" -> 2023,8,14,0,0,0 | X224: =RC[-8]&R1C19&RC[-7]&R1C19&RC[-5]&",23,59,59" -> 2023,8,20,23,59,59
K225: =IF(AND(RC[1]=1,RC[3]=1),R[-1]C[5]+1,R[-1]C[5]) -> 2023 | L225: =IF(RC[2]=1,IF((R[-1]C[5]+1)<13,(R[-1]C[5]+1),(1)),R[-1]C[5]) -> 8 | M225: =RC[-2]&RC[-1] -> 20238 | N225: =IF((R[-1]C[5]+1)<=VLOOKUP(R[-1]C[4],C7:C8,2,FALSE),(R[-1]C[5]+1),1) -> 21 | P225: =IF(AND(RC[1]=1,RC[3]<7),RC[-5]+1,RC[-5]) -> 2023 | Q225: =IF(RC[2]<7,IF((RC[-5]+1)<13,(RC[-5]+1),(1)),RC[-5]) -> 8 | R225: =RC[-2]&RC[-1] -> 20238 | S225: =IF((RC[-5]+6)<=VLOOKUP(RC[-6],C7:C8,2,FALSE),(RC[-5]+6),(RC[-5]+6)-VLOOKUP(RC[-6],C7:C8,2,FALSE)) -> 27 | U225: 220 | W225: =RC[-12]&R1C19&RC[-11]&R1C19&RC[-9]&",0,0,0" -> 2023,8,21,0,0,0 | X225: =RC[-8]&R1C19&RC[-7]&R1C19&RC[-5]&",23,59,59" -> 2023,8,27,23,59,59
K226: =IF(AND(RC[1]=1,RC[3]=1),R[-1]C[5]+1,R[-1]C[5]) -> 2023 | L226: =IF(RC[2]=1,IF((R[-1]C[5]+1)<13,(R[-1]C[5]+1),(1)),R[-1]C[5]) -> 8 | M226: =RC[-2]&RC[-1] -> 20238 | N226: =IF((R[-1]C[5]+1)<=VLOOKUP(R[-1]C[4],C7:C8,2,FALSE),(R[-1]C[5]+1),1) -> 28 | P226: =IF(AND(RC[1]=1,RC[3]<7),RC[-5]+1,RC[-5]) -> 2023 | Q226: =IF(RC[2]<7,IF((RC[-5]+1)<13,(RC[-5]+1),(1)),RC[-5]) -> 9 | R226: =RC[-2]&RC[-1] -> 20239 | S226: =IF((RC[-5]+6)<=VLOOKUP(RC[-6],C7:C8,2,FALSE),(RC[-5]+6),(RC[-5]+6)-VLOOKUP(RC[-6],C7:C8,2,FALSE)) -> 3 | U226: 221 | W226: =RC[-12]&R1C19&RC[-11]&R1C19&RC[-9]&",0,0,0" -> 2023,8,28,0,0,0 | X226: =RC[-8]&R1C19&RC[-7]&R1C19&RC[-5]&",23,59,59" -> 2023,9,3,23,59,59
K227: =IF(AND(RC[1]=1,RC[3]=1),R[-1]C[5]+1,R[-1]C[5]) -> 2023 | L227: =IF(RC[2]=1,IF((R[-1]C[5]+1)<13,(R[-1]C[5]+1),(1)),R[-1]C[5]) -> 9 | M227: =RC[-2]&RC[-1] -> 20239 | N227: =IF((R[-1]C[5]+1)<=VLOOKUP(R[-1]C[4],C7:C8,2,FALSE),(R[-1]C[5]+1),1) -> 4 | P227: =IF(AND(RC[1]=1,RC[3]<7),RC[-5]+1,RC[-5]) -> 2023 | Q227: =IF(RC[2]<7,IF((RC[-5]+1)<13,(RC[-5]+1),(1)),RC[-5]) -> 9 | R227: =RC[-2]&RC[-1] -> 20239 | S227: =IF((RC[-5]+6)<=VLOOKUP(RC[-6],C7:C8,2,FALSE),(RC[-5]+6),(RC[-5]+6)-VLOOKUP(RC[-6],C7:C8,2,FALSE)) -> 10 | U227: 222 | W227: =RC[-12]&R1C19&RC[-11]&R1C19&RC[-9]&",0,0,0" -> 2023,9,4,0,0,0 | X227: =RC[-8]&R1C19&RC[-7]&R1C19&RC[-5]&",23,59,59" -> 2023,9,10,23,59,59
K228: =IF(AND(RC[1]=1,RC[3]=1),R[-1]C[5]+1,R[-1]C[5]) -> 2023 | L228: =IF(RC[2]=1,IF((R[-1]C[5]+1)<13,(R[-1]C[5]+1),(1)),R[-1]C[5]) -> 9 | M228: =RC[-2]&RC[-1] -> 20239 | N228: =IF((R[-1]C[5]+1)<=VLOOKUP(R[-1]C[4],C7:C8,2,FALSE),(R[-1]C[5]+1),1) -> 11 | P228: =IF(AND(RC[1]=1,RC[3]<7),RC[-5]+1,RC[-5]) -> 2023 | Q228: =IF(RC[2]<7,IF((RC[-5]+1)<13,(RC[-5]+1),(1)),RC[-5]) -> 9 | R228: =RC[-2]&RC[-1] -> 20239 | S228: =IF((RC[-5]+6)<=VLOOKUP(RC[-6],C7:C8,2,FALSE),(RC[-5]+6),(RC[-5]+6)-VLOOKUP(RC[-6],C7:C8,2,FALSE)) -> 17 | U228: 223 | W228: =RC[-12]&R1C19&RC[-11]&R1C19&RC[-9]&",0,0,0" -> 2023,9,11,0,0,0 | X228: =RC[-8]&R1C19&RC[-7]&R1C19&RC[-5]&",23,59,59" -> 2023,9,17,23,59,59
K229: =IF(AND(RC[1]=1,RC[3]=1),R[-1]C[5]+1,R[-1]C[5]) -> 2023 | L229: =IF(RC[2]=1,IF((R[-1]C[5]+1)<13,(R[-1]C[5]+1),(1)),R[-1]C[5]) -> 9 | M229: =RC[-2]&RC[-1] -> 20239 | N229: =IF((R[-1]C[5]+1)<=VLOOKUP(R[-1]C[4],C7:C8,2,FALSE),(R[-1]C[5]+1),1) -> 18 | P229: =IF(AND(RC[1]=1,RC[3]<7),RC[-5]+1,RC[-5]) -> 2023 | Q229: =IF(RC[2]<7,IF((RC[-5]+1)<13,(RC[-5]+1),(1)),RC[-5]) -> 9 | R229: =RC[-2]&RC[-1] -> 20239 | S229: =IF((RC[-5]+6)<=VLOOKUP(RC[-6],C7:C8,2,FALSE),(RC[-5]+6),(RC[-5]+6)-VLOOKUP(RC[-6],C7:C8,2,FALSE)) -> 24 | U229: 224 | W229: =RC[-12]&R1C19&RC[-11]&R1C19&RC[-9]&",0,0,0" -> 2023,9,18,0,0,0 | X229: =RC[-8]&R1C19&RC[-7]&R1C19&RC[-5]&",23,59,59" -> 2023,9,24,23,59,59
K230: =IF(AND(RC[1]=1,RC[3]=1),R[-1]C[5]+1,R[-1]C[5]) -> 2023 | L230: =IF(RC[2]=1,IF((R[-1]C[5]+1)<13,(R[-1]C[5]+1),(1)),R[-1]C[5]) -> 9 | M230: =RC[-2]&RC[-1] -> 20239 | N230: =IF((R[-1]C[5]+1)<=VLOOKUP(R[-1]C[4],C7:C8,2,FALSE),(R[-1]C[5]+1),1) -> 25 | P230: =IF(AND(RC[1]=1,RC[3]<7),RC[-5]+1,RC[-5]) -> 2023 | Q230: =IF(RC[2]<7,IF((RC[-5]+1)<13,(RC[-5]+1),(1)),RC[-5]) -> 10 | R230: =RC[-2]&RC[-1] -> 202310 | S230: =IF((RC[-5]+6)<=VLOOKUP(RC[-6],C7:C8,2,FALSE),(RC[-5]+6),(RC[-5]+6)-VLOOKUP(RC[-6],C7:C8,2,FALSE)) -> 1 | U230: 225 | W230: =RC[-12]&R1C19&RC[-11]&R1C19&RC[-9]&",0,0,0" -> 2023,9,25,0,0,0 | X230: =RC[-8]&R1C19&RC[-7]&R1C19&RC[-5]&",23,59,59" -> 2023,10,1,23,59,59
K231: =IF(AND(RC[1]=1,RC[3]=1),R[-1]C[5]+1,R[-1]C[5]) -> 2023 | L231: =IF(RC[2]=1,IF((R[-1]C[5]+1)<13,(R[-1]C[5]+1),(1)),R[-1]C[5]) -> 10 | M231: =RC[-2]&RC[-1] -> 202310 | N231: =IF((R[-1]C[5]+1)<=VLOOKUP(R[-1]C[4],C7:C8,2,FALSE),(R[-1]C[5]+1),1) -> 2 | P231: =IF(AND(RC[1]=1,RC[3]<7),RC[-5]+1,RC[-5]) -> 2023 | Q231: =IF(RC[2]<7,IF((RC[-5]+1)<13,(RC[-5]+1),(1)),RC[-5]) -> 10 | R231: =RC[-2]&RC[-1] -> 202310 | S231: =IF((RC[-5]+6)<=VLOOKUP(RC[-6],C7:C8,2,FALSE),(RC[-5]+6),(RC[-5]+6)-VLOOKUP(RC[-6],C7:C8,2,FALSE)) -> 8 | U231: 226 | W231: =RC[-12]&R1C19&RC[-11]&R1C19&RC[-9]&",0,0,0" -> 2023,10,2,0,0,0 | X231: =RC[-8]&R1C19&RC[-7]&R1C19&RC[-5]&",23,59,59" -> 2023,10,8,23,59,59
K232: =IF(AND(RC[1]=1,RC[3]=1),R[-1]C[5]+1,R[-1]C[5]) -> 2023 | L232: =IF(RC[2]=1,IF((R[-1]C[5]+1)<13,(R[-1]C[5]+1),(1)),R[-1]C[5]) -> 10 | M232: =RC[-2]&RC[-1] -> 202310 | N232: =IF((R[-1]C[5]+1)<=VLOOKUP(R[-1]C[4],C7:C8,2,FALSE),(R[-1]C[5]+1),1) -> 9 | P232: =IF(AND(RC[1]=1,RC[3]<7),RC[-5]+1,RC[-5]) -> 2023 | Q232: =IF(RC[2]<7,IF((RC[-5]+1)<13,(RC[-5]+1),(1)),RC[-5]) -> 10 | R232: =RC[-2]&RC[-1] -> 202310 | S232: =IF((RC[-5]+6)<=VLOOKUP(RC[-6],C7:C8,2,FALSE),(RC[-5]+6),(RC[-5]+6)-VLOOKUP(RC[-6],C7:C8,2,FALSE)) -> 15 | U232: 227 | W232: =RC[-12]&R1C19&RC[-11]&R1C19&RC[-9]&",0,0,0" -> 2023,10,9,0,0,0 | X232: =RC[-8]&R1C19&RC[-7]&R1C19&RC[-5]&",23,59,59" -> 2023,10,15,23,59,59
K233: =IF(AND(RC[1]=1,RC[3]=1),R[-1]C[5]+1,R[-1]C[5]) -> 2023 | L233: =IF(RC[2]=1,IF((R[-1]C[5]+1)<13,(R[-1]C[5]+1),(1)),R[-1]C[5]) -> 10 | M233: =RC[-2]&RC[-1] -> 202310 | N233: =IF((R[-1]C[5]+1)<=VLOOKUP(R[-1]C[4],C7:C8,2,FALSE),(R[-1]C[5]+1),1) -> 16 | P233: =IF(AND(RC[1]=1,RC[3]<7),RC[-5]+1,RC[-5]) -> 2023 | Q233: =IF(RC[2]<7,IF((RC[-5]+1)<13,(RC[-5]+1),(1)),RC[-5]) -> 10 | R233: =RC[-2]&RC[-1] -> 202310 | S233: =IF((RC[-5]+6)<=VLOOKUP(RC[-6],C7:C8,2,FALSE),(RC[-5]+6),(RC[-5]+6)-VLOOKUP(RC[-6],C7:C8,2,FALSE)) -> 22 | U233: 228 | W233: =RC[-12]&R1C19&RC[-11]&R1C19&RC[-9]&",0,0,0" -> 2023,10,16,0,0,0 | X233: =RC[-8]&R1C19&RC[-7]&R1C19&RC[-5]&",23,59,59" -> 2023,10,22,23,59,59
K234: =IF(AND(RC[1]=1,RC[3]=1),R[-1]C[5]+1,R[-1]C[5]) -> 2023 | L234: =IF(RC[2]=1,IF((R[-1]C[5]+1)<13,(R[-1]C[5]+1),(1)),R[-1]C[5]) -> 10 | M234: =RC[-2]&RC[-1] -> 202310 | N234: =IF((R[-1]C[5]+1)<=VLOOKUP(R[-1]C[4],C7:C8,2,FALSE),(R[-1]C[5]+1),1) -> 23 | P234: =IF(AND(RC[1]=1,RC[3]<7),RC[-5]+1,RC[-5]) -> 2023 | Q234: =IF(RC[2]<7,IF((RC[-5]+1)<13,(RC[-5]+1),(1)),RC[-5]) -> 10 | R234: =RC[-2]&RC[-1] -> 202310 | S234: =IF((RC[-5]+6)<=VLOOKUP(RC[-6],C7:C8,2,FALSE),(RC[-5]+6),(RC[-5]+6)-VLOOKUP(RC[-6],C7:C8,2,FALSE)) -> 29 | U234: 229 | W234: =RC[-12]&R1C19&RC[-11]&R1C19&RC[-9]&",0,0,0" -> 2023,10,23,0,0,0 | X234: =RC[-8]&R1C19&RC[-7]&R1C19&RC[-5]&",23,59,59" -> 2023,10,29,23,59,59
K235: =IF(AND(RC[1]=1,RC[3]=1),R[-1]C[5]+1,R[-1]C[5]) -> 2023 | L235: =IF(RC[2]=1,IF((R[-1]C[5]+1)<13,(R[-1]C[5]+1),(1)),R[-1]C[5]) -> 10 | M235: =RC[-2]&RC[-1] -> 202310 | N235: =IF((R[-1]C[5]+1)<=VLOOKUP(R[-1]C[4],C7:C8,2,FALSE),(R[-1]C[5]+1),1) -> 30 | P235: =IF(AND(RC[1]=1,RC[3]<7),RC[-5]+1,RC[-5]) -> 2023 | Q235: =IF(RC[2]<7,IF((RC[-5]+1)<13,(RC[-5]+1),(1)),RC[-5]) -> 11 | R235: =RC[-2]&RC[-1] -> 202311 | S235: =IF((RC[-5]+6)<=VLOOKUP(RC[-6],C7:C8,2,FALSE),(RC[-5]+6),(RC[-5]+6)-VLOOKUP(RC[-6],C7:C8,2,FALSE)) -> 5 | U235: 230 | W235: =RC[-12]&R1C19&RC[-11]&R1C19&RC[-9]&",0,0,0" -> 2023,10,30,0,0,0 | X235: =RC[-8]&R1C19&RC[-7]&R1C19&RC[-5]&",23,59,59" -> 2023,11,5,23,59,59
K236: =IF(AND(RC[1]=1,RC[3]=1),R[-1]C[5]+1,R[-1]C[5]) -> 2023 | L236: =IF(RC[2]=1,IF((R[-1]C[5]+1)<13,(R[-1]C[5]+1),(1)),R[-1]C[5]) -> 11 | M236: =RC[-2]&RC[-1] -> 202311 | N236: =IF((R[-1]C[5]+1)<=VLOOKUP(R[-1]C[4],C7:C8,2,FALSE),(R[-1]C[5]+1),1) -> 6 | P236: =IF(AND(RC[1]=1,RC[3]<7),RC[-5]+1,RC[-5]) -> 2023 | Q236: =IF(RC[2]<7,IF((RC[-5]+1)<13,(RC[-5]+1),(1)),RC[-5]) -> 11 | R236: =RC[-2]&RC[-1] -> 202311 | S236: =IF((RC[-5]+6)<=VLOOKUP(RC[-6],C7:C8,2,FALSE),(RC[-5]+6),(RC[-5]+6)-VLOOKUP(RC[-6],C7:C8,2,FALSE)) -> 12 | U236: 231 | W236: =RC[-12]&R1C19&RC[-11]&R1C19&RC[-9]&",0,0,0" -> 2023,11,6,0,0,0 | X236: =RC[-8]&R1C19&RC[-7]&R1C19&RC[-5]&",23,59,59" -> 2023,11,12,23,59,59
K237: =IF(AND(RC[1]=1,RC[3]=1),R[-1]C[5]+1,R[-1]C[5]) -> 2023 | L237: =IF(RC[2]=1,IF((R[-1]C[5]+1)<13,(R[-1]C[5]+1),(1)),R[-1]C[5]) -> 11 | M237: =RC[-2]&RC[-1] -> 202311 | N237: =IF((R[-1]C[5]+1)<=VLOOKUP(R[-1]C[4],C7:C8,2,FALSE),(R[-1]C[5]+1),1) -> 13 | P237: =IF(AND(RC[1]=1,RC[3]<7),RC[-5]+1,RC[-5]) -> 2023 | Q237: =IF(RC[2]<7,IF((RC[-5]+1)<13,(RC[-5]+1),(1)),RC[-5]) -> 11 | R237: =RC[-2]&RC[-1] -> 202311 | S237: =IF((RC[-5]+6)<=VLOOKUP(RC[-6],C7:C8,2,FALSE),(RC[-5]+6),(RC[-5]+6)-VLOOKUP(RC[-6],C7:C8,2,FALSE)) -> 19 | U237: 232 | W237: =RC[-12]&R1C19&RC[-11]&R1C19&RC[-9]&",0,0,0" -> 2023,11,13,0,0,0 | X237: =RC[-8]&R1C19&RC[-7]&R1C19&RC[-5]&",23,59,59" -> 2023,11,19,23,59,59
K238: =IF(AND(RC[1]=1,RC[3]=1),R[-1]C[5]+1,R[-1]C[5]) -> 2023 | L238: =IF(RC[2]=1,IF((R[-1]C[5]+1)<13,(R[-1]C[5]+1),(1)),R[-1]C[5]) -> 11 | M238: =RC[-2]&RC[-1] -> 202311 | N238: =IF((R[-1]C[5]+1)<=VLOOKUP(R[-1]C[4],C7:C8,2,FALSE),(R[-1]C[5]+1),1) -> 20 | P238: =IF(AND(RC[1]=1,RC[3]<7),RC[-5]+1,RC[-5]) -> 2023 | Q238: =IF(RC[2]<7,IF((RC[-5]+1)<13,(RC[-5]+1),(1)),RC[-5]) -> 11 | R238: =RC[-2]&RC[-1] -> 202311 | S238: =IF((RC[-5]+6)<=VLOOKUP(RC[-6],C7:C8,2,FALSE),(RC[-5]+6),(RC[-5]+6)-VLOOKUP(RC[-6],C7:C8,2,FALSE)) -> 26 | U238: 233 | W238: =RC[-12]&R1C19&RC[-11]&R1C19&RC[-9]&",0,0,0" -> 2023,11,20,0,0,0 | X238: =RC[-8]&R1C19&RC[-7]&R1C19&RC[-5]&",23,59,59" -> 2023,11,26,23,59,59
K239: =IF(AND(RC[1]=1,RC[3]=1),R[-1]C[5]+1,R[-1]C[5]) -> 2023 | L239: =IF(RC[2]=1,IF((R[-1]C[5]+1)<13,(R[-1]C[5]+1),(1)),R[-1]C[5]) -> 11 | M239: =RC[-2]&RC[-1] -> 202311 | N239: =IF((R[-1]C[5]+1)<=VLOOKUP(R[-1]C[4],C7:C8,2,FALSE),(R[-1]C[5]+1),1) -> 27 | P239: =IF(AND(RC[1]=1,RC[3]<7),RC[-5]+1,RC[-5]) -> 2023 | Q239: =IF(RC[2]<7,IF((RC[-5]+1)<13,(RC[-5]+1),(1)),RC[-5]) -> 12 | R239: =RC[-2]&RC[-1] -> 202312 | S239: =IF((RC[-5]+6)<=VLOOKUP(RC[-6],C7:C8,2,FALSE),(RC[-5]+6),(RC[-5]+6)-VLOOKUP(RC[-6],C7:C8,2,FALSE)) -> 3 | U239: 234 | W239: =RC[-12]&R1C19&RC[-11]&R1C19&RC[-9]&",0,0,0" -> 2023,11,27,0,0,0 | X239: =RC[-8]&R1C19&RC[-7]&R1C19&RC[-5]&",23,59,59" -> 2023,12,3,23,59,59
K240: =IF(AND(RC[1]=1,RC[3]=1),R[-1]C[5]+1,R[-1]C[5]) -> 2023 | L240: =IF(RC[2]=1,IF((R[-1]C[5]+1)<13,(R[-1]C[5]+1),(1)),R[-1]C[5]) -> 12 | M240: =RC[-2]&RC[-1] -> 202312 | N240: =IF((R[-1]C[5]+1)<=VLOOKUP(R[-1]C[4],C7:C8,2,FALSE),(R[-1]C[5]+1),1) -> 4 | P240: =IF(AND(RC[1]=1,RC[3]<7),RC[-5]+1,RC[-5]) -> 2023 | Q240: =IF(RC[2]<7,IF((RC[-5]+1)<13,(RC[-5]+1),(1)),RC[-5]) -> 12 | R240: =RC[-2]&RC[-1] -> 202312 | S240: =IF((RC[-5]+6)<=VLOOKUP(RC[-6],C7:C8,2,FALSE),(RC[-5]+6),(RC[-5]+6)-VLOOKUP(RC[-6],C7:C8,2,FALSE)) -> 10 | U240: 235 | W240: =RC[-12]&R1C19&RC[-11]&R1C19&RC[-9]&",0,0,0" -> 2023,12,4,0,0,0 | X240: =RC[-8]&R1C19&RC[-7]&R1C19&RC[-5]&",23,59,59" -> 2023,12,10,23,59,59
K241: =IF(AND(RC[1]=1,RC[3]=1),R[-1]C[5]+1,R[-1]C[5]) -> 2023 | L241: =IF(RC[2]=1,IF((R[-1]C[5]+1)<13,(R[-1]C[5]+1),(1)),R[-1]C[5]) -> 12 | M241: =RC[-2]&RC[-1] -> 202312 | N241: =IF((R[-1]C[5]+1)<=VLOOKUP(R[-1]C[4],C7:C8,2,FALSE),(R[-1]C[5]+1),1) -> 11 | P241: =IF(AND(RC[1]=1,RC[3]<7),RC[-5]+1,RC[-5]) -> 2023 | Q241: =IF(RC[2]<7,IF((RC[-5]+1)<13,(RC[-5]+1),(1)),RC[-5]) -> 12 | R241: =RC[-2]&RC[-1] -> 202312 | S241: =IF((RC[-5]+6)<=VLOOKUP(RC[-6],C7:C8,2,FALSE),(RC[-5]+6),(RC[-5]+6)-VLOOKUP(RC[-6],C7:C8,2,FALSE)) -> 17 | U241: 236 | W241: =RC[-12]&R1C19&RC[-11]&R1C19&RC[-9]&",0,0,0" -> 2023,12,11,0,0,0 | X241: =RC[-8]&R1C19&RC[-7]&R1C19&RC[-5]&",23,59,59" -> 2023,12,17,23,59,59
K242: =IF(AND(RC[1]=1,RC[3]=1),R[-1]C[5]+1,R[-1]C[5]) -> 2023 | L242: =IF(RC[2]=1,IF((R[-1]C[5]+1)<13,(R[-1]C[5]+1),(1)),R[-1]C[5]) -> 12 | M242: =RC[-2]&RC[-1] -> 202312 | N242: =IF((R[-1]C[5]+1)<=VLOOKUP(R[-1]C[4],C7:C8,2,FALSE),(R[-1]C[5]+1),1) -> 18 | P242: =IF(AND(RC[1]=1,RC[3]<7),RC[-5]+1,RC[-5]) -> 2023 | Q242: =IF(RC[2]<7,IF((RC[-5]+1)<13,(RC[-5]+1),(1)),RC[-5]) -> 12 | R242: =RC[-2]&RC[-1] -> 202312 | S242: =IF((RC[-5]+6)<=VLOOKUP(RC[-6],C7:C8,2,FALSE),(RC[-5]+6),(RC[-5]+6)-VLOOKUP(RC[-6],C7:C8,2,FALSE)) -> 24 | U242: 237 | W242: =RC[-12]&R1C19&RC[-11]&R1C19&RC[-9]&",0,0,0" -> 2023,12,18,0,0,0 | X242: =RC[-8]&R1C19&RC[-7]&R1C19&RC[-5]&",23,59,59" -> 2023,12,24,23,59,59
K243: =IF(AND(RC[1]=1,RC[3]=1),R[-1]C[5]+1,R[-1]C[5]) -> 2023 | L243: =IF(RC[2]=1,IF((R[-1]C[5]+1)<13,(R[-1]C[5]+1),(1)),R[-1]C[5]) -> 12 | M243: =RC[-2]&RC[-1] -> 202312 | N243: =IF((R[-1]C[5]+1)<=VLOOKUP(R[-1]C[4],C7:C8,2,FALSE),(R[-1]C[5]+1),1) -> 25 | P243: =IF(AND(RC[1]=1,RC[3]<7),RC[-5]+1,RC[-5]) -> 2023 | Q243: =IF(RC[2]<7,IF((RC[-5]+1)<13,(RC[-5]+1),(1)),RC[-5]) -> 12 | R243: =RC[-2]&RC[-1] -> 202312 | S243: =IF((RC[-5]+6)<=VLOOKUP(RC[-6],C7:C8,2,FALSE),(RC[-5]+6),(RC[-5]+6)-VLOOKUP(RC[-6],C7:C8,2,FALSE)) -> 31 | U243: 238 | W243: =RC[-12]&R1C19&RC[-11]&R1C19&RC[-9]&",0,0,0" -> 2023,12,25,0,0,0 | X243: =RC[-8]&R1C19&RC[-7]&R1C19&RC[-5]&",23,59,59" -> 2023,12,31,23,59,59
K244: =IF(AND(RC[1]=1,RC[3]=1),R[-1]C[5]+1,R[-1]C[5]) -> 2024 | L244: =IF(RC[2]=1,IF((R[-1]C[5]+1)<13,(R[-1]C[5]+1),(1)),R[-1]C[5]) -> 1 | M244: =RC[-2]&RC[-1] -> 20241 | N244: =IF((R[-1]C[5]+1)<=VLOOKUP(R[-1]C[4],C7:C8,2,FALSE),(R[-1]C[5]+1),1) -> 1 | P244: =IF(AND(RC[1]=1,RC[3]<7),RC[-5]+1,RC[-5]) -> 2024 | Q244: =IF(RC[2]<7,IF((RC[-5]+1)<13,(RC[-5]+1),(1)),RC[-5]) -> 1 | R244: =RC[-2]&RC[-1] -> 20241 | S244: =IF((RC[-5]+6)<=VLOOKUP(RC[-6],C7:C8,2,FALSE),(RC[-5]+6),(RC[-5]+6)-VLOOKUP(RC[-6],C7:C8,2,FALSE)) -> 7 | U244: 239 | W244: =RC[-12]&R1C19&RC[-11]&R1C19&RC[-9]&",0,0,0" -> 2024,1,1,0,0,0 | X244: =RC[-8]&R1C19&RC[-7]&R1C19&RC[-5]&",23,59,59" -> 2024,1,7,23,59,59
K245: =IF(AND(RC[1]=1,RC[3]=1),R[-1]C[5]+1,R[-1]C[5]) -> 2024 | L245: =IF(RC[2]=1,IF((R[-1]C[5]+1)<13,(R[-1]C[5]+1),(1)),R[-1]C[5]) -> 1 | M245: =RC[-2]&RC[-1] -> 20241 | N245: =IF((R[-1]C[5]+1)<=VLOOKUP(R[-1]C[4],C7:C8,2,FALSE),(R[-1]C[5]+1),1) -> 8 | P245: =IF(AND(RC[1]=1,RC[3]<7),RC[-5]+1,RC[-5]) -> 2024 | Q245: =IF(RC[2]<7,IF((RC[-5]+1)<13,(RC[-5]+1),(1)),RC[-5]) -> 1 | R245: =RC[-2]&RC[-1] -> 20241 | S245: =IF((RC[-5]+6)<=VLOOKUP(RC[-6],C7:C8,2,FALSE),(RC[-5]+6),(RC[-5]+6)-VLOOKUP(RC[-6],C7:C8,2,FALSE)) -> 14 | U245: 240 | W245: =RC[-12]&R1C19&RC[-11]&R1C19&RC[-9]&",0,0,0" -> 2024,1,8,0,0,0 | X245: =RC[-8]&R1C19&RC[-7]&R1C19&RC[-5]&",23,59,59" -> 2024,1,14,23,59,59
K246: =IF(AND(RC[1]=1,RC[3]=1),R[-1]C[5]+1,R[-1]C[5]) -> 2024 | L246: =IF(RC[2]=1,IF((R[-1]C[5]+1)<13,(R[-1]C[5]+1),(1)),R[-1]C[5]) -> 1 | M246: =RC[-2]&RC[-1] -> 20241 | N246: =IF((R[-1]C[5]+1)<=VLOOKUP(R[-1]C[4],C7:C8,2,FALSE),(R[-1]C[5]+1),1) -> 15 | P246: =IF(AND(RC[1]=1,RC[3]<7),RC[-5]+1,RC[-5]) -> 2024 | Q246: =IF(RC[2]<7,IF((RC[-5]+1)<13,(RC[-5]+1),(1)),RC[-5]) -> 1 | R246: =RC[-2]&RC[-1] -> 20241 | S246: =IF((RC[-5]+6)<=VLOOKUP(RC[-6],C7:C8,2,FALSE),(RC[-5]+6),(RC[-5]+6)-VLOOKUP(RC[-6],C7:C8,2,FALSE)) -> 21 | U246: 241 | W246: =RC[-12]&R1C19&RC[-11]&R1C19&RC[-9]&",0,0,0" -> 2024,1,15,0,0,0 | X246: =RC[-8]&R1C19&RC[-7]&R1C19&RC[-5]&",23,59,59" -> 2024,1,21,23,59,59
K247: =IF(AND(RC[1]=1,RC[3]=1),R[-1]C[5]+1,R[-1]C[5]) -> 2024 | L247: =IF(RC[2]=1,IF((R[-1]C[5]+1)<13,(R[-1]C[5]+1),(1)),R[-1]C[5]) -> 1 | M247: =RC[-2]&RC[-1] -> 20241 | N247: =IF((R[-1]C[5]+1)<=VLOOKUP(R[-1]C[4],C7:C8,2,FALSE),(R[-1]C[5]+1),1) -> 22 | P247: =IF(AND(RC[1]=1,RC[3]<7),RC[-5]+1,RC[-5]) -> 2024 | Q247: =IF(RC[2]<7,IF((RC[-5]+1)<13,(RC[-5]+1),(1)),RC[-5]) -> 1 | R247: =RC[-2]&RC[-1] -> 20241 | S247: =IF((RC[-5]+6)<=VLOOKUP(RC[-6],C7:C8,2,FALSE),(RC[-5]+6),(RC[-5]+6)-VLOOKUP(RC[-6],C7:C8,2,FALSE)) -> 28 | U247: 242 | W247: =RC[-12]&R1C19&RC[-11]&R1C19&RC[-9]&",0,0,0" -> 2024,1,22,0,0,0 | X247: =RC[-8]&R1C19&RC[-7]&R1C19&RC[-5]&",23,59,59" -> 2024,1,28,23,59,59
K248: =IF(AND(RC[1]=1,RC[3]=1),R[-1]C[5]+1,R[-1]C[5]) -> 2024 | L248: =IF(RC[2]=1,IF((R[-1]C[5]+1)<13,(R[-1]C[5]+1),(1)),R[-1]C[5]) -> 1 | M248: =RC[-2]&RC[-1] -> 20241 | N248: =IF((R[-1]C[5]+1)<=VLOOKUP(R[-1]C[4],C7:C8,2,FALSE),(R[-1]C[5]+1),1) -> 29 | P248: =IF(AND(RC[1]=1,RC[3]<7),RC[-5]+1,RC[-5]) -> 2024 | Q248: =IF(RC[2]<7,IF((RC[-5]+1)<13,(RC[-5]+1),(1)),RC[-5]) -> 2 | R248: =RC[-2]&RC[-1] -> 20242 | S248: =IF((RC[-5]+6)<=VLOOKUP(RC[-6],C7:C8,2,FALSE),(RC[-5]+6),(RC[-5]+6)-VLOOKUP(RC[-6],C7:C8,2,FALSE)) -> 4 | U248: 243 | W248: =RC[-12]&R1C19&RC[-11]&R1C19&RC[-9]&",0,0,0" -> 2024,1,29,0,0,0 | X248: =RC[-8]&R1C19&RC[-7]&R1C19&RC[-5]&",23,59,59" -> 2024,2,4,23,59,59
K249: =IF(AND(RC[1]=1,RC[3]=1),R[-1]C[5]+1,R[-1]C[5]) -> 2024 | L249: =IF(RC[2]=1,IF((R[-1]C[5]+1)<13,(R[-1]C[5]+1),(1)),R[-1]C[5]) -> 2 | M249: =RC[-2]&RC[-1] -> 20242 | N249: =IF((R[-1]C[5]+1)<=VLOOKUP(R[-1]C[4],C7:C8,2,FALSE),(R[-1]C[5]+1),1) -> 5 | P249: =IF(AND(RC[1]=1,RC[3]<7),RC[-5]+1,RC[-5]) -> 2024 | Q249: =IF(RC[2]<7,IF((RC[-5]+1)<13,(RC[-5]+1),(1)),RC[-5]) -> 2 | R249: =RC[-2]&RC[-1] -> 20242 | S249: =IF((RC[-5]+6)<=VLOOKUP(RC[-6],C7:C8,2,FALSE),(RC[-5]+6),(RC[-5]+6)-VLOOKUP(RC[-6],C7:C8,2,FALSE)) -> 11 | U249: 244 | W249: =RC[-12]&R1C19&RC[-11]&R1C19&RC[-9]&",0,0,0" -> 2024,2,5,0,0,0 | X249: =RC[-8]&R1C19&RC[-7]&R1C19&RC[-5]&",23,59,59" -> 2024,2,11,23,59,59
K250: =IF(AND(RC[1]=1,RC[3]=1),R[-1]C[5]+1,R[-1]C[5]) -> 2024 | L250: =IF(RC[2]=1,IF((R[-1]C[5]+1)<13,(R[-1]C[5]+1),(1)),R[-1]C[5]) -> 2 | M250: =RC[-2]&RC[-1] -> 20242 | N250: =IF((R[-1]C[5]+1)<=VLOOKUP(R[-1]C[4],C7:C8,2,FALSE),(R[-1]C[5]+1),1) -> 12 | P250: =IF(AND(RC[1]=1,RC[3]<7),RC[-5]+1,RC[-5]) -> 2024 | Q250: =IF(RC[2]<7,IF((RC[-5]+1)<13,(RC[-5]+1),(1)),RC[-5]) -> 2 | R250: =RC[-2]&RC[-1] -> 20242 | S250: =IF((RC[-5]+6)<=VLOOKUP(RC[-6],C7:C8,2,FALSE),(RC[-5]+6),(RC[-5]+6)-VLOOKUP(RC[-6],C7:C8,2,FALSE)) -> 18 | U250: 245 | W250: =RC[-12]&R1C19&RC[-11]&R1C19&RC[-9]&",0,0,0" -> 2024,2,12,0,0,0 | X250: =RC[-8]&R1C19&RC[-7]&R1C19&RC[-5]&",23,59,59" -> 2024,2,18,23,59,59
K251: =IF(AND(RC[1]=1,RC[3]=1),R[-1]C[5]+1,R[-1]C[5]) -> 2024 | L251: =IF(RC[2]=1,IF((R[-1]C[5]+1)<13,(R[-1]C[5]+1),(1)),R[-1]C[5]) -> 2 | M251: =RC[-2]&RC[-1] -> 20242 | N251: =IF((R[-1]C[5]+1)<=VLOOKUP(R[-1]C[4],C7:C8,2,FALSE),(R[-1]C[5]+1),1) -> 19 | P251: =IF(AND(RC[1]=1,RC[3]<7),RC[-5]+1,RC[-5]) -> 2024 | Q251: =IF(RC[2]<7,IF((RC[-5]+1)<13,(RC[-5]+1),(1)),RC[-5]) -> 2 | R251: =RC[-2]&RC[-1] -> 20242 | S251: =IF((RC[-5]+6)<=VLOOKUP(RC[-6],C7:C8,2,FALSE),(RC[-5]+6),(RC[-5]+6)-VLOOKUP(RC[-6],C7:C8,2,FALSE)) -> 25 | U251: 246 | W251: =RC[-12]&R1C19&RC[-11]&R1C19&RC[-9]&",0,0,0" -> 2024,2,19,0,0,0 | X251: =RC[-8]&R1C19&RC[-7]&R1C19&RC[-5]&",23,59,59" -> 2024,2,25,23,59,59
K252: =IF(AND(RC[1]=1,RC[3]=1),R[-1]C[5]+1,R[-1]C[5]) -> 2024 | L252: =IF(RC[2]=1,IF((R[-1]C[5]+1)<13,(R[-1]C[5]+1),(1)),R[-1]C[5]) -> 2 | M252: =RC[-2]&RC[-1] -> 20242 | N252: =IF((R[-1]C[5]+1)<=VLOOKUP(R[-1]C[4],C7:C8,2,FALSE),(R[-1]C[5]+1),1) -> 26 | P252: =IF(AND(RC[1]=1,RC[3]<7),RC[-5]+1,RC[-5]) -> 2024 | Q252: =IF(RC[2]<7,IF((RC[-5]+1)<13,(RC[-5]+1),(1)),RC[-5]) -> 3 | R252: =RC[-2]&RC[-1] -> 20243 | S252: =IF((RC[-5]+6)<=VLOOKUP(RC[-6],C7:C8,2,FALSE),(RC[-5]+6),(RC[-5]+6)-VLOOKUP(RC[-6],C7:C8,2,FALSE)) -> 3 | U252: 247 | W252: =RC[-12]&R1C19&RC[-11]&R1C19&RC[-9]&",0,0,0" -> 2024,2,26,0,0,0 | X252: =RC[-8]&R1C19&RC[-7]&R1C19&RC[-5]&",23,59,59" -> 2024,3,3,23,59,59
K253: =IF(AND(RC[1]=1,RC[3]=1),R[-1]C[5]+1,R[-1]C[5]) -> 2024 | L253: =IF(RC[2]=1,IF((R[-1]C[5]+1)<13,(R[-1]C[5]+1),(1)),R[-1]C[5]) -> 3 | M253: =RC[-2]&RC[-1] -> 20243 | N253: =IF((R[-1]C[5]+1)<=VLOOKUP(R[-1]C[4],C7:C8,2,FALSE),(R[-1]C[5]+1),1) -> 4 | P253: =IF(AND(RC[1]=1,RC[3]<7),RC[-5]+1,RC[-5]) -> 2024 | Q253: =IF(RC[2]<7,IF((RC[-5]+1)<13,(RC[-5]+1),(1)),RC[-5]) -> 3 | R253: =RC[-2]&RC[-1] -> 20243 | S253: =IF((RC[-5]+6)<=VLOOKUP(RC[-6],C7:C8,2,FALSE),(RC[-5]+6),(RC[-5]+6)-VLOOKUP(RC[-6],C7:C8,2,FALSE)) -> 10 | U253: 248 | W253: =RC[-12]&R1C19&RC[-11]&R1C19&RC[-9]&",0,0,0" -> 2024,3,4,0,0,0 | X253: =RC[-8]&R1C19&RC[-7]&R1C19&RC[-5]&",23,59,59" -> 2024,3,10,23,59,59
K254: =IF(AND(RC[1]=1,RC[3]=1),R[-1]C[5]+1,R[-1]C[5]) -> 2024 | L254: =IF(RC[2]=1,IF((R[-1]C[5]+1)<13,(R[-1]C[5]+1),(1)),R[-1]C[5]) -> 3 | M254: =RC[-2]&RC[-1] -> 20243 | N254: =IF((R[-1]C[5]+1)<=VLOOKUP(R[-1]C[4],C7:C8,2,FALSE),(R[-1]C[5]+1),1) -> 11 | P254: =IF(AND(RC[1]=1,RC[3]<7),RC[-5]+1,RC[-5]) -> 2024 | Q254: =IF(RC[2]<7,IF((RC[-5]+1)<13,(RC[-5]+1),(1)),RC[-5]) -> 3 | R254: =RC[-2]&RC[-1] -> 20243 | S254: =IF((RC[-5]+6)<=VLOOKUP(RC[-6],C7:C8,2,FALSE),(RC[-5]+6),(RC[-5]+6)-VLOOKUP(RC[-6],C7:C8,2,FALSE)) -> 17 | U254: 249 | W254: =RC[-12]&R1C19&RC[-11]&R1C19&RC[-9]&",0,0,0" -> 2024,3,11,0,0,0 | X254: =RC[-8]&R1C19&RC[-7]&R1C19&RC[-5]&",23,59,59" -> 2024,3,17,23,59,59
K255: =IF(AND(RC[1]=1,RC[3]=1),R[-1]C[5]+1,R[-1]C[5]) -> 2024 | L255: =IF(RC[2]=1,IF((R[-1]C[5]+1)<13,(R[-1]C[5]+1),(1)),R[-1]C[5]) -> 3 | M255: =RC[-2]&RC[-1] -> 20243 | N255: =IF((R[-1]C[5]+1)<=VLOOKUP(R[-1]C[4],C7:C8,2,FALSE),(R[-1]C[5]+1),1) -> 18 | P255: =IF(AND(RC[1]=1,RC[3]<7),RC[-5]+1,RC[-5]) -> 2024 | Q255: =IF(RC[2]<7,IF((RC[-5]+1)<13,(RC[-5]+1),(1)),RC[-5]) -> 3 | R255: =RC[-2]&RC[-1] -> 20243 | S255: =IF((RC[-5]+6)<=VLOOKUP(RC[-6],C7:C8,2,FALSE),(RC[-5]+6),(RC[-5]+6)-VLOOKUP(RC[-6],C7:C8,2,FALSE)) -> 24 | U255: 250 | W255: =RC[-12]&R1C19&RC[-11]&R1C19&RC[-9]&",0,0,0" -> 2024,3,18,0,0,0 | X255: =RC[-8]&R1C19&RC[-7]&R1C19&RC[-5]&",23,59,59" -> 2024,3,24,23,59,59
K256: =IF(AND(RC[1]=1,RC[3]=1),R[-1]C[5]+1,R[-1]C[5]) -> 2024 | L256: =IF(RC[2]=1,IF((R[-1]C[5]+1)<13,(R[-1]C[5]+1),(1)),R[-1]C[5]) -> 3 | M256: =RC[-2]&RC[-1] -> 20243 | N256: =IF((R[-1]C[5]+1)<=VLOOKUP(R[-1]C[4],C7:C8,2,FALSE),(R[-1]C[5]+1),1) -> 25 | P256: =IF(AND(RC[1]=1,RC[3]<7),RC[-5]+1,RC[-5]) -> 2024 | Q256: =IF(RC[2]<7,IF((RC[-5]+1)<13,(RC[-5]+1),(1)),RC[-5]) -> 3 | R256: =RC[-2]&RC[-1] -> 20243 | S256: =IF((RC[-5]+6)<=VLOOKUP(RC[-6],C7:C8,2,FALSE),(RC[-5]+6),(RC[-5]+6)-VLOOKUP(RC[-6],C7:C8,2,FALSE)) -> 31 | U256: 251 | W256: =RC[-12]&R1C19&RC[-11]&R1C19&RC[-9]&",0,0,0" -> 2024,3,25,0,0,0 | X256: =RC[-8]&R1C19&RC[-7]&R1C19&RC[-5]&",23,59,59" -> 2024,3,31,23,59,59
K257: =IF(AND(RC[1]=1,RC[3]=1),R[-1]C[5]+1,R[-1]C[5]) -> 2024 | L257: =IF(RC[2]=1,IF((R[-1]C[5]+1)<13,(R[-1]C[5]+1),(1)),R[-1]C[5]) -> 4 | M257: =RC[-2]&RC[-1] -> 20244 | N257: =IF((R[-1]C[5]+1)<=VLOOKUP(R[-1]C[4],C7:C8,2,FALSE),(R[-1]C[5]+1),1) -> 1 | P257: =IF(AND(RC[1]=1,RC[3]<7),RC[-5]+1,RC[-5]) -> 2024 | Q257: =IF(RC[2]<7,IF((RC[-5]+1)<13,(RC[-5]+1),(1)),RC[-5]) -> 4 | R257: =RC[-2]&RC[-1] -> 20244 | S257: =IF((RC[-5]+6)<=VLOOKUP(RC[-6],C7:C8,2,FALSE),(RC[-5]+6),(RC[-5]+6)-VLOOKUP(RC[-6],C7:C8,2,FALSE)) -> 7 | U257: 252 | W257: =RC[-12]&R1C19&RC[-11]&R1C19&RC[-9]&",0,0,0" -> 2024,4,1,0,0,0 | X257: =RC[-8]&R1C19&RC[-7]&R1C19&RC[-5]&",23,59,59" -> 2024,4,7,23,59,59
K258: =IF(AND(RC[1]=1,RC[3]=1),R[-1]C[5]+1,R[-1]C[5]) -> 2024 | L258: =IF(RC[2]=1,IF((R[-1]C[5]+1)<13,(R[-1]C[5]+1),(1)),R[-1]C[5]) -> 4 | M258: =RC[-2]&RC[-1] -> 20244 | N258: =IF((R[-1]C[5]+1)<=VLOOKUP(R[-1]C[4],C7:C8,2,FALSE),(R[-1]C[5]+1),1) -> 8 | P258: =IF(AND(RC[1]=1,RC[3]<7),RC[-5]+1,RC[-5]) -> 2024 | Q258: =IF(RC[2]<7,IF((RC[-5]+1)<13,(RC[-5]+1),(1)),RC[-5]) -> 4 | R258: =RC[-2]&RC[-1] -> 20244 | S258: =IF((RC[-5]+6)<=VLOOKUP(RC[-6],C7:C8,2,FALSE),(RC[-5]+6),(RC[-5]+6)-VLOOKUP(RC[-6],C7:C8,2,FALSE)) -> 14 | U258: 253 | W258: =RC[-12]&R1C19&RC[-11]&R1C19&RC[-9]&",0,0,0" -> 2024,4,8,0,0,0 | X258: =RC[-8]&R1C19&RC[-7]&R1C19&RC[-5]&",23,59,59" -> 2024,4,14,23,59,59
K259: =IF(AND(RC[1]=1,RC[3]=1),R[-1]C[5]+1,R[-1]C[5]) -> 2024 | L259: =IF(RC[2]=1,IF((R[-1]C[5]+1)<13,(R[-1]C[5]+1),(1)),R[-1]C[5]) -> 4 | M259: =RC[-2]&RC[-1] -> 20244 | N259: =IF((R[-1]C[5]+1)<=VLOOKUP(R[-1]C[4],C7:C8,2,FALSE),(R[-1]C[5]+1),1) -> 15 | P259: =IF(AND(RC[1]=1,RC[3]<7),RC[-5]+1,RC[-5]) -> 2024 | Q259: =IF(RC[2]<7,IF((RC[-5]+1)<13,(RC[-5]+1),(1)),RC[-5]) -> 4 | R259: =RC[-2]&RC[-1] -> 20244 | S259: =IF((RC[-5]+6)<=VLOOKUP(RC[-6],C7:C8,2,FALSE),(RC[-5]+6),(RC[-5]+6)-VLOOKUP(RC[-6],C7:C8,2,FALSE)) -> 21 | U259: 254 | W259: =RC[-12]&R1C19&RC[-11]&R1C19&RC[-9]&",0,0,0" -> 2024,4,15,0,0,0 | X259: =RC[-8]&R1C19&RC[-7]&R1C19&RC[-5]&",23,59,59" -> 2024,4,21,23,59,59
K260: =IF(AND(RC[1]=1,RC[3]=1),R[-1]C[5]+1,R[-1]C[5]) -> 2024 | L260: =IF(RC[2]=1,IF((R[-1]C[5]+1)<13,(R[-1]C[5]+1),(1)),R[-1]C[5]) -> 4 | M260: =RC[-2]&RC[-1] -> 20244 | N260: =IF((R[-1]C[5]+1)<=VLOOKUP(R[-1]C[4],C7:C8,2,FALSE),(R[-1]C[5]+1),1) -> 22 | P260: =IF(AND(RC[1]=1,RC[3]<7),RC[-5]+1,RC[-5]) -> 2024 | Q260: =IF(RC[2]<7,IF((RC[-5]+1)<13,(RC[-5]+1),(1)),RC[-5]) -> 4 | R260: =RC[-2]&RC[-1] -> 20244 | S260: =IF((RC[-5]+6)<=VLOOKUP(RC[-6],C7:C8,2,FALSE),(RC[-5]+6),(RC[-5]+6)-VLOOKUP(RC[-6],C7:C8,2,FALSE)) -> 28 | U260: 255 | W260: =RC[-12]&R1C19&RC[-11]&R1C19&RC[-9]&",0,0,0" -> 2024,4,22,0,0,0 | X260: =RC[-8]&R1C19&RC[-7]&R1C19&RC[-5]&",23,59,59" -> 2024,4,28,23,59,59
K261: =IF(AND(RC[1]=1,RC[3]=1),R[-1]C[5]+1,R[-1]C[5]) -> 2024 | L261: =IF(RC[2]=1,IF((R[-1]C[5]+1)<13,(R[-1]C[5]+1),(1)),R[-1]C[5]) -> 4 | M261: =RC[-2]&RC[-1] -> 20244 | N261: =IF((R[-1]C[5]+1)<=VLOOKUP(R[-1]C[4],C7:C8,2,FALSE),(R[-1]C[5]+1),1) -> 29 | P261: =IF(AND(RC[1]=1,RC[3]<7),RC[-5]+1,RC[-5]) -> 2024 | Q261: =IF(RC[2]<7,IF((RC[-5]+1)<13,(RC[-5]+1),(1)),RC[-5]) -> 5 | R261: =RC[-2]&RC[-1] -> 20245 | S261: =IF((RC[-5]+6)<=VLOOKUP(RC[-6],C7:C8,2,FALSE),(RC[-5]+6),(RC[-5]+6)-VLOOKUP(RC[-6],C7:C8,2,FALSE)) -> 5 | U261: 256 | W261: =RC[-12]&R1C19&RC[-11]&R1C19&RC[-9]&",0,0,0" -> 2024,4,29,0,0,0 | X261: =RC[-8]&R1C19&RC[-7]&R1C19&RC[-5]&",23,59,59" -> 2024,5,5,23,59,59
K262: =IF(AND(RC[1]=1,RC[3]=1),R[-1]C[5]+1,R[-1]C[5]) -> 2024 | L262: =IF(RC[2]=1,IF((R[-1]C[5]+1)<13,(R[-1]C[5]+1),(1)),R[-1]C[5]) -> 5 | M262: =RC[-2]&RC[-1] -> 20245 | N262: =IF((R[-1]C[5]+1)<=VLOOKUP(R[-1]C[4],C7:C8,2,FALSE),(R[-1]C[5]+1),1) -> 6 | P262: =IF(AND(RC[1]=1,RC[3]<7),RC[-5]+1,RC[-5]) -> 2024 | Q262: =IF(RC[2]<7,IF((RC[-5]+1)<13,(RC[-5]+1),(1)),RC[-5]) -> 5 | R262: =RC[-2]&RC[-1] -> 20245 | S262: =IF((RC[-5]+6)<=VLOOKUP(RC[-6],C7:C8,2,FALSE),(RC[-5]+6),(RC[-5]+6)-VLOOKUP(RC[-6],C7:C8,2,FALSE)) -> 12 | U262: 257 | W262: =RC[-12]&R1C19&RC[-11]&R1C19&RC[-9]&",0,0,0" -> 2024,5,6,0,0,0 | X262: =RC[-8]&R1C19&RC[-7]&R1C19&RC[-5]&",23,59,59" -> 2024,5,12,23,59,59
K263: =IF(AND(RC[1]=1,RC[3]=1),R[-1]C[5]+1,R[-1]C[5]) -> 2024 | L263: =IF(RC[2]=1,IF((R[-1]C[5]+1)<13,(R[-1]C[5]+1),(1)),R[-1]C[5]) -> 5 | M263: =RC[-2]&RC[-1] -> 20245 | N263: =IF((R[-1]C[5]+1)<=VLOOKUP(R[-1]C[4],C7:C8,2,FALSE),(R[-1]C[5]+1),1) -> 13 | P263: =IF(AND(RC[1]=1,RC[3]<7),RC[-5]+1,RC[-5]) -> 2024 | Q263: =IF(RC[2]<7,IF((RC[-5]+1)<13,(RC[-5]+1),(1)),RC[-5]) -> 5 | R263: =RC[-2]&RC[-1] -> 20245 | S263: =IF((RC[-5]+6)<=VLOOKUP(RC[-6],C7:C8,2,FALSE),(RC[-5]+6),(RC[-5]+6)-VLOOKUP(RC[-6],C7:C8,2,FALSE)) -> 19 | U263: 258 | W263: =RC[-12]&R1C19&RC[-11]&R1C19&RC[-9]&",0,0,0" -> 2024,5,13,0,0,0 | X263: =RC[-8]&R1C19&RC[-7]&R1C19&RC[-5]&",23,59,59" -> 2024,5,19,23,59,59