Sheet: ctGuaJiConf
F1: 动画约5秒 | K1: 奖励池ID,奖励次数; | W1: 类型,ID,数量,是否绑定
A2: nSeq | B2: nMinGuanQia | C2: nMaxGuanQia | D2: sName | E2: nDupID | F2: nPatrolSec | G2: nChalBossLimit | H2: nBattleGroup | I2: fnAddBossAttrPre | J2: nMaxOfflineMin | K2: tReward | L2: fnRoleExpReward | M2: fnPetExpReward | N2: fnYinBiReward | O2: fnJinBiReward | P2: fnOfflineRoleExp | Q2: fnOfflinePetExp | R2: fnOfflineYinBi | S2: sMonName | T2: sModel | U2: eMonNum | V2: nRobotNum | W2: tFixReward
A3: i | B3: i | C3: i | D3: s | E3: i | F3: i | G3: i | H3: i | I3: e | J3: i | K3: t{ii} | L3: e | M3: e | N3: e | O3: e | P3: e | Q3: e | R3: e | S3: s | T3: t{s} | U3: i | V3: i | W3: t{iiib}
A4: 序号 | B4: 最小关卡 | C4: 最大关卡 | D4: 关卡名 | E4: 副本场景ID | F4: 巡逻时间（秒） | G4: 挑战boss所需战斗次数 | H4: boss战斗组ID | I4: boss增强属性倍数 | J4: 最大离线奖励时间(分) | K4: boss掉落奖励库 | L4: 人物经验基数公式 | M4: 宠物经验基数公式 | N4: 银币奖励基数公式 | O4: 金币奖励基础公式 | P4: 人物离线经验 | Q4: 宠物离线经验 | R4: 离线奖励银币 | S4: 小怪名字 | T4: 小怪模型ID | U4: 小怪数量 | V4: 机器人数量 | W4: BOSS战必出的奖励
A5: 1 | B5: 1 | C5: 1 | D5: 炼气期 | E5: 10904 | F5: 5 | G5: 0 | H5: 200001 | I5: 0 | J5: 480 | K5: 5000,0; | L5: 100/36*(nPatrolSec+3)*(1000+nGuanQia)/1000 | M5: 8000/3600*(nPatrolSec+3)*(1000+nGuanQia)/1000 | N5: 12240/3600*(nPatrolSec+3)*(1000+nGuanQia)/1000 | O5: 0 | P5: 10000/60*nMin*(1000+nGuanQia)/1000 | Q5: 8000/60*nMin*(1000+nGuanQia)/1000 | R5: 12240/60*nMin*(1000+nGuanQia)/1000 | S5: =LEFT(RC[-15],2)&"小妖" -> 炼气小妖 | T5: pet_1; | U5: 2 | V5: 3 | W5: 1,28000,1,0;1,19016,1,0;1,4,10000,0;1,10007,1,0;1,7,150,0;1,8,2500,0;1,3,5000,0;1,50001,5,1;
A6: 2 | B6: =R[-1]C[1]+1 -> 2 | C6: 2 | D6: 炼气期 | E6: 10904 | F6: 5 | G6: 0 | H6: 200002 | I6: 0 | J6: 480 | K6: 5000,0; | L6: 102/36*(nPatrolSec+3)*(1000+nGuanQia)/1000 | M6: 8200/3600*(nPatrolSec+3)*(1000+nGuanQia)/1000 | N6: 12240/3600*(nPatrolSec+3)*(1000+nGuanQia)/1000 | O6: 0 | P6: 10000/60*nMin*(1000+nGuanQia)/1000 | Q6: 8000/60*nMin*(1000+nGuanQia)/1000 | R6: 12240/60*nMin*(1000+nGuanQia)/1000 | S6: =LEFT(RC[-15],2)&"小妖" -> 炼气小妖 | T6: pet_1; | U6: 2 | V6: 3 | W6: 1,28000,1,0;1,19016,1,0;1,4,10000,0;1,10007,1,0;1,7,250,0;1,8,2500,0;1,3,5000,0;1,50001,5,1;
A7: 3 | B7: =R[-1]C[1]+1 -> 3 | C7: 3 | D7: 炼气期 | E7: 10904 | F7: 5 | G7: 0 | H7: 200003 | I7: 1 | J7: 480 | K7: 5000,0; | L7: 104/36*(nPatrolSec+3)*(1000+nGuanQia)/1000 | M7: 8400/3600*(nPatrolSec+3)*(1000+nGuanQia)/1000 | N7: 12240/3600*(nPatrolSec+3)*(1000+nGuanQia)/1000 | O7: 0 | P7: 10000/60*nMin*(1000+nGuanQia)/1000 | Q7: 8000/60*nMin*(1000+nGuanQia)/1000 | R7: 12240/60*nMin*(1000+nGuanQia)/1000 | S7: =LEFT(RC[-15],2)&"小妖" -> 炼气小妖 | T7: pet_1; | U7: 2 | V7: 4 | W7: 1,28000,2,0;1,19016,2,0;1,4,10000,0;1,10007,2,0;1,7,350,0;1,8,2500,0;1,3,5000,0;1,50001,5,1;
A8: 4 | B8: =R[-1]C[1]+1 -> 4 | C8: 4 | D8: 炼气期 | E8: 10904 | F8: 5 | G8: 0 | H8: 200004 | I8: 1 | J8: 480 | K8: 5000,0; | L8: 106/36*(nPatrolSec+3)*(1000+nGuanQia)/1000 | M8: 8600/3600*(nPatrolSec+3)*(1000+nGuanQia)/1000 | N8: 12240/3600*(nPatrolSec+3)*(1000+nGuanQia)/1000 | O8: 0 | P8: 10000/60*nMin*(1000+nGuanQia)/1000 | Q8: 8000/60*nMin*(1000+nGuanQia)/1000 | R8: 12240/60*nMin*(1000+nGuanQia)/1000 | S8: =LEFT(RC[-15],2)&"小妖" -> 炼气小妖 | T8: pet_1; | U8: 2 | V8: 4 | W8: 1,28000,2,0;1,19016,2,0;1,4,10000,0;1,10007,2,0;1,7,450,0;1,8,2500,0;1,3,5000,0;1,50001,5,1;
A9: 5 | B9: =R[-1]C[1]+1 -> 5 | C9: 5 | D9: 炼气期 | E9: 10904 | F9: 5 | G9: 0 | H9: 200005 | I9: 1 | J9: 480 | K9: 5000,0; | L9: 108/36*(nPatrolSec+3)*(1000+nGuanQia)/1000 | M9: 8800/3600*(nPatrolSec+3)*(1000+nGuanQia)/1000 | N9: 12240/3600*(nPatrolSec+3)*(1000+nGuanQia)/1000 | O9: 0 | P9: 10000/60*nMin*(1000+nGuanQia)/1000 | Q9: 8000/60*nMin*(1000+nGuanQia)/1000 | R9: 12240/60*nMin*(1000+nGuanQia)/1000 | S9: =LEFT(RC[-15],2)&"小妖" -> 炼气小妖 | T9: pet_1; | U9: 2 | V9: 4 | W9: 1,28000,3,0;1,19016,3,0;1,4,10000,0;1,10007,3,0;1,7,550,0;1,8,2500,0;1,3,5000,0;1,50001,5,1;
A10: 6 | B10: =R[-1]C[1]+1 -> 6 | C10: 6 | D10: 筑基期 | E10: 10904 | F10: 5 | G10: 0 | H10: 200006 | I10: 0 | J10: 480 | K10: 5000,0; | L10: 110/36*(nPatrolSec+3)*(1000+nGuanQia)/1000 | M10: 9000/3600*(nPatrolSec+3)*(1000+nGuanQia)/1000 | N10: 12540/3600*(nPatrolSec+3)*(1000+nGuanQia)/1000 | O10: 0 | P10: 11250/60*nMin*(1000+nGuanQia)/1000 | Q10: 9000/60*nMin*(1000+nGuanQia)/1000 | R10: 12540/60*nMin*(1000+nGuanQia)/1000 | S10: =LEFT(RC[-15],2)&"小妖" -> 筑基小妖 | T10: pet_1;pet_23; | U10: 2 | V10: 4 | W10: 1,28000,3,0;1,19016,3,0;1,4,10000,0;1,10007,3,0;1,7,650,0;1,8,2500,0;1,3,5000,0;1,50001,5,1;
A11: 7 | B11: =R[-1]C[1]+1 -> 7 | C11: 7 | D11: 筑基期 | E11: 10904 | F11: 5 | G11: 0 | H11: 200007 | I11: 0 | J11: 480 | K11: 5000,0; | L11: 112/36*(nPatrolSec+3)*(1000+nGuanQia)/1000 | M11: 9200/3600*(nPatrolSec+3)*(1000+nGuanQia)/1000 | N11: 12540/3600*(nPatrolSec+3)*(1000+nGuanQia)/1000 | O11: 0 | P11: 11250/60*nMin*(1000+nGuanQia)/1000 | Q11: 9000/60*nMin*(1000+nGuanQia)/1000 | R11: 12540/60*nMin*(1000+nGuanQia)/1000 | S11: =LEFT(RC[-15],2)&"小妖" -> 筑基小妖 | T11: pet_1;pet_23; | U11: 2 | V11: 4 | W11: 1,28000,4,0;1,19016,4,0;1,4,10000,0;1,10007,4,0;1,7,750,0;1,8,2500,0;1,3,5000,0;1,50001,5,1;
A12: 8 | B12: =R[-1]C[1]+1 -> 8 | C12: 8 | D12: 筑基期 | E12: 10501 | F12: 5 | G12: 0 | H12: 200008 | I12: 0.1 | J12: 480 | K12: 5000,0; | L12: 114/36*(nPatrolSec+3)*(1000+nGuanQia)/1000 | M12: 9400/3600*(nPatrolSec+3)*(1000+nGuanQia)/1000 | N12: 12540/3600*(nPatrolSec+3)*(1000+nGuanQia)/1000 | O12: 0 | P12: 11250/60*nMin*(1000+nGuanQia)/1000 | Q12: 9000/60*nMin*(1000+nGuanQia)/1000 | R12: 12540/60*nMin*(1000+nGuanQia)/1000 | S12: =LEFT(RC[-15],2)&"小妖" -> 筑基小妖 | T12: pet_1;pet_23; | U12: 2 | V12: 4 | W12: 1,28000,4,0;1,19016,4,0;1,4,10000,0;1,10007,4,0;1,7,850,0;1,8,2500,0;1,3,5000,0;1,50001,5,1;
A13: 9 | B13: =R[-1]C[1]+1 -> 9 | C13: 9 | D13: 筑基期 | E13: 10501 | F13: 5 | G13: 0 | H13: 200009 | I13: 0.15 | J13: 480 | K13: 5000,0; | L13: 116/36*(nPatrolSec+3)*(1000+nGuanQia)/1000 | M13: 9600/3600*(nPatrolSec+3)*(1000+nGuanQia)/1000 | N13: 12540/3600*(nPatrolSec+3)*(1000+nGuanQia)/1000 | O13: 0 | P13: 11250/60*nMin*(1000+nGuanQia)/1000 | Q13: 9000/60*nMin*(1000+nGuanQia)/1000 | R13: 12540/60*nMin*(1000+nGuanQia)/1000 | S13: =LEFT(RC[-15],2)&"小妖" -> 筑基小妖 | T13: pet_1;pet_23; | U13: 2 | V13: 4 | W13: 1,28000,5,0;1,19016,5,0;1,10007,1,1;1,7,2000,0;1,8,2500,0;1,3,5000,0;
A14: 10 | B14: =R[-1]C[1]+1 -> 10 | C14: 11 | D14: 金丹期 | E14: 10501 | F14: 5 | G14: 0 | H14: 200010 | I14: 0.2 | J14: 480 | K14: 5000,0; | L14: 118/36*(nPatrolSec+3)*(1000+nGuanQia)/1000 | M14: 9800/3600*(nPatrolSec+3)*(1000+nGuanQia)/1000 | N14: 12540/3600*(nPatrolSec+3)*(1000+nGuanQia)/1000 | O14: 0 | P14: 11250/60*nMin*(1000+nGuanQia)/1000 | Q14: 9000/60*nMin*(1000+nGuanQia)/1000 | R14: 12540/60*nMin*(1000+nGuanQia)/1000 | S14: =LEFT(RC[-15],2)&"小妖" -> 金丹小妖 | T14: pet_1;pet_23; | U14: 2 | V14: 4 | W14: 1,28000,5,0;1,19016,5,0;1,12001,1,0;1,7,10000,0;1,8,5000,0;1,3,5000,0;
A15: 11 | B15: =R[-1]C[1]+1 -> 12 | C15: 20 | D15: 金丹期 | E15: 10501 | F15: 5 | G15: 1 | H15: 200011 | I15: (nGuanQia-10)*0.16+0.2 | J15: 480 | K15: 5000,0; | L15: 122/36*(nPatrolSec+3)*(1000+nGuanQia)/1000 | M15: 10000/3600*(nPatrolSec+3)*(1000+nGuanQia)/1000 | N15: 12960/3600*(nPatrolSec+3)*(1000+nGuanQia)/1000 | O15: 0 | P15: 12500/60*nMin*(1000+nGuanQia)/1000 | Q15: 10000/60*nMin*(1000+nGuanQia)/1000 | R15: 12960/60*nMin*(1000+nGuanQia)/1000 | S15: =LEFT(RC[-15],2)&"小妖" -> 金丹小妖 | T15: pet_1;pet_23; | U15: 2 | V15: 4 | W15: 1,28000,5,0;1,19016,5,0;1,4,10000,0;1,7,10000,0;1,8,5000,0;1,3,5000,0;
A16: 12 | B16: =R[-1]C[1]+1 -> 21 | C16: 50 | D16: 元婴期 | E16: 10502 | F16: 5 | G16: 2 | H16: =R[-1]C+10 -> 200021 | I16: (nGuanQia-10)*0.06+0.9 | J16: 480 | K16: 5000,0; | L16: 155/36*(nPatrolSec+3)*(1000+nGuanQia)/1000 | M16: 12000/3600*(nPatrolSec+3)*(1000+nGuanQia)/1000 | N16: 14580/3600*(nPatrolSec+3)*(1000+nGuanQia)/1000 | O16: 0 | P16: 15000/60*nMin*(1000+nGuanQia)/1000 | Q16: 12000/60*nMin*(1000+nGuanQia)/1000 | R16: 14580/60*nMin*(1000+nGuanQia)/1000 | S16: =LEFT(RC[-15],2)&"小妖" -> 元婴小妖 | T16: pet_61;pet_23; | U16: 2 | V16: 4 | W16: 1,28000,5,0;1,19016,5,0;1,4,10000,0;1,7,10000,0;1,8,5000,0;1,3,5000,0;
A17: 13 | B17: =R[-1]C[1]+1 -> 51 | C17: 80 | D17: 出窍期 | E17: 10503 | F17: 5 | G17: 2 | H17: =R[-1]C+10 -> 200031 | I17: (nGuanQia-10)*0.023+1.8 | J17: 480 | K17: 5000,0; | L17: 210/36*(nPatrolSec+3)*(1000+nGuanQia)/1000 | M17: 12200/3600*(nPatrolSec+3)*(1000+nGuanQia)/1000 | N17: 14640/3600*(nPatrolSec+3)*(1000+nGuanQia)/1000 | O17: 0 | P17: 15250/60*nMin*(1000+nGuanQia)/1000 | Q17: 12200/60*nMin*(1000+nGuanQia)/1000 | R17: 14640/60*nMin*(1000+nGuanQia)/1000 | S17: =LEFT(RC[-15],2)&"小妖" -> 出窍小妖 | T17: pet_61;pet_23; | U17: 2 | V17: 5 | W17: 1,28000,6,0;1,19016,6,0;1,4,10000,0;1,7,10000,0;1,8,5000,0;1,3,5000,0;
A18: 14 | B18: =R[-1]C[1]+1 -> 81 | C18: 130 | D18: 分神期 | E18: 10504 | F18: 5 | G18: 3 | H18: =R[-1]C+10 -> 200041 | I18: (nGuanQia-10)*0.01+1.88 | J18: 480 | K18: 5000,0; | L18: 350/36*(nPatrolSec+3)*(1000+nGuanQia)/1000 | M18: 12400/3600*(nPatrolSec+3)*(1000+nGuanQia)/1000 | N18: 14700/3600*(nPatrolSec+3)*(1000+nGuanQia)/1000 | O18: 0 | P18: 15500/60*nMin*(1000+nGuanQia)/1000 | Q18: 12400/60*nMin*(1000+nGuanQia)/1000 | R18: 14700/60*nMin*(1000+nGuanQia)/1000 | S18: =LEFT(RC[-15],2)&"小妖" -> 分神小妖 | T18: pet_61;pet_23; | U18: 2 | V18: 5 | W18: 1,28000,7,0;1,19016,7,0;1,4,10000,0;1,7,10000,0;1,8,9000,0;1,3,5000,0;
A19: 15 | B19: =R[-1]C[1]+1 -> 131 | C19: 180 | D19: 合体期 | E19: 10504 | F19: 5 | G19: 3 | H19: =R[-1]C+10 -> 200051 | I19: (nGuanQia-10)*0.008+1.5 | J19: 480 | K19: 5000,0; | L19: 400/36*(nPatrolSec+3)*(1000+nGuanQia)/1000 | M19: 12600/3600*(nPatrolSec+3)*(1000+nGuanQia)/1000 | N19: 14760/3600*(nPatrolSec+3)*(1000+nGuanQia)/1000 | O19: 0 | P19: 15750/60*nMin*(1000+nGuanQia)/1000 | Q19: 12600/60*nMin*(1000+nGuanQia)/1000 | R19: 14760/60*nMin*(1000+nGuanQia)/1000 | S19: =LEFT(RC[-15],2)&"小妖" -> 合体小妖 | T19: pet_61;pet_23; | U19: 3 | V19: 5 | W19: 1,28000,8,0;1,19016,8,0;1,4,10000,0;1,7,10000,0;1,8,9000,0;1,3,5000,0;
A20: 16 | B20: =R[-1]C[1]+1 -> 181 | C20: 230 | D20: 洞虚期 | E20: 10505 | F20: 5 | G20: 3 | H20: =R[-1]C+10 -> 200061 | I20: (nGuanQia-10)*0.007+1.25 | J20: 480 | K20: 5000,0; | L20: 400/36*(nPatrolSec+3)*(1000+nGuanQia)/1000 | M20: 12800/3600*(nPatrolSec+3)*(1000+nGuanQia)/1000 | N20: 14820/3600*(nPatrolSec+3)*(1000+nGuanQia)/1000 | O20: 0 | P20: 16000/60*nMin*(1000+nGuanQia)/1000 | Q20: 12800/60*nMin*(1000+nGuanQia)/1000 | R20: 14820/60*nMin*(1000+nGuanQia)/1000 | S20: =LEFT(RC[-15],2)&"小妖" -> 洞虚小妖 | T20: pet_61;pet_23; | U20: 3 | V20: 5 | W20: 1,28000,8,0;1,19016,8,0;1,4,10000,0;1,7,10000,0;1,8,9000,0;1,3,5000,0;
A21: 17 | B21: =R[-1]C[1]+1 -> 231 | C21: 300 | D21: 大乘境界 | E21: 10904 | F21: 5 | G21: 3 | H21: =R[-1]C+10 -> 200071 | I21: (nGuanQia-10)*0.006+1.07 | J21: 480 | K21: 5000,0; | L21: 400/36*(nPatrolSec+3)*(1000+nGuanQia)/1000 | M21: 13000/3600*(nPatrolSec+3)*(1000+nGuanQia)/1000 | N21: 14880/3600*(nPatrolSec+3)*(1000+nGuanQia)/1000 | O21: 0 | P21: 16250/60*nMin*(1000+nGuanQia)/1000 | Q21: 13000/60*nMin*(1000+nGuanQia)/1000 | R21: 14880/60*nMin*(1000+nGuanQia)/1000 | S21: =LEFT(RC[-15],2)&"小妖" -> 大乘小妖 | T21: pet_61;pet_23; | U21: 3 | V21: 5 | W21: 1,28000,8,0;1,19016,8,0;1,4,10000,0;1,7,10000,0;1,8,9000,0;1,3,5000,0;
A22: 18 | B22: =R[-1]C[1]+1 -> 301 | C22: =R[-1]C+100 -> 400 | D22: 炼真境界 | E22: 10501 | F22: 5 | G22: 3 | H22: =R[-1]C+10 -> 200081 | I22: (nGuanQia-10)*0.005+0.94 | J22: 480 | K22: 5000,0; | L22: 400/36*(nPatrolSec+3)*(1000+nGuanQia)/1000 | M22: 13200/3600*(nPatrolSec+3)*(1000+nGuanQia)/1000 | N22: 14940/3600*(nPatrolSec+3)*(1000+nGuanQia)/1000 | O22: 0 | P22: 16500/60*nMin*(1000+nGuanQia)/1000 | Q22: 13200/60*nMin*(1000+nGuanQia)/1000 | R22: 14940/60*nMin*(1000+nGuanQia)/1000 | S22: =LEFT(RC[-15],2)&"小妖" -> 炼真小妖 | T22: pet_61;pet_23; | U22: 3 | V22: 5 | W22: 1,28000,8,0;1,19016,8,0;1,4,10000,0;1,7,10000,0;1,8,9000,0;1,3,5000,0;
A23: 19 | B23: =R[-1]C[1]+1 -> 401 | C23: =R[-1]C+100 -> 500 | D23: 散仙境界 | E23: 10504 | F23: 5 | G23: 3 | H23: =R[-1]C+10 -> 200091 | I23: (nGuanQia-10)*0.004+0.83 | J23: 480 | K23: 5000,0; | L23: 400/36*(nPatrolSec+3)*(1000+nGuanQia)/1000 | M23: 13400/3600*(nPatrolSec+3)*(1000+nGuanQia)/1000 | N23: 15000/3600*(nPatrolSec+3)*(1000+nGuanQia)/1000 | O23: 0 | P23: 16750/60*nMin*(1000+nGuanQia)/1000 | Q23: 13400/60*nMin*(1000+nGuanQia)/1000 | R23: 15000/60*nMin*(1000+nGuanQia)/1000 | S23: =LEFT(RC[-15],2)&"小妖" -> 散仙小妖 | T23: pet_61;pet_23; | U23: 3 | V23: 5 | W23: 1,28000,8,0;1,19016,8,0;1,4,10000,0;1,7,10000,0;1,8,9000,0;1,3,5000,0;
A24: 20 | B24: =R[-1]C[1]+1 -> 501 | C24: =R[-1]C+100 -> 600 | D24: 游仙境界 | E24: 10504 | F24: 5 | G24: 3 | H24: =R[-1]C+10 -> 200101 | I24: (nGuanQia-10)*0.004+0.75 | J24: 480 | K24: 5000,0; | L24: 400/36*(nPatrolSec+3)*(1000+nGuanQia)/1000 | M24: 13600/3600*(nPatrolSec+3)*(1000+nGuanQia)/1000 | N24: 15060/3600*(nPatrolSec+3)*(1000+nGuanQia)/1000 | O24: 0 | P24: 17000/60*nMin*(1000+nGuanQia)/1000 | Q24: 13600/60*nMin*(1000+nGuanQia)/1000 | R24: 15060/60*nMin*(1000+nGuanQia)/1000 | S24: =LEFT(RC[-15],2)&"小妖" -> 游仙小妖 | T24: pet_61;pet_23; | U24: 3 | V24: 5 | W24: 1,28000,8,0;1,19016,8,0;1,4,10000,0;1,7,10000,0;1,8,9000,0;1,3,5000,0;
A25: 21 | B25: =R[-1]C[1]+1 -> 601 | C25: =R[-1]C+100 -> 700 | D25: 地仙境界 | E25: 10503 | F25: 5 | G25: 3 | H25: =R[-1]C+10 -> 200111 | I25: (nGuanQia-10)*0.004+0.75 | J25: 480 | K25: 5000,0; | L25: 400/36*(nPatrolSec+3)*(1000+nGuanQia)/1000 | M25: 13800/3600*(nPatrolSec+3)*(1000+nGuanQia)/1000 | N25: 15120/3600*(nPatrolSec+3)*(1000+nGuanQia)/1000 | O25: 0 | P25: 17250/60*nMin*(1000+nGuanQia)/1000 | Q25: 13800/60*nMin*(1000+nGuanQia)/1000 | R25: 15120/60*nMin*(1000+nGuanQia)/1000 | S25: =LEFT(RC[-15],2)&"小妖" -> 地仙小妖 | T25: pet_61;pet_23; | U25: 3 | V25: 5 | W25: 1,28000,8,0;1,19016,8,0;1,4,10000,0;1,7,10000,0;1,8,9000,0;1,3,5000,0;
A26: 22 | B26: =R[-1]C[1]+1 -> 701 | C26: =R[-1]C+100 -> 800 | D26: 天仙境界 | E26: 10502 | F26: 5 | G26: 3 | H26: =R[-1]C+10 -> 200121 | I26: (nGuanQia-10)*0.004+0.75 | J26: 480 | K26: 5000,0; | L26: 400/36*(nPatrolSec+3)*(1000+nGuanQia)/1000 | M26: 14000/3600*(nPatrolSec+3)*(1000+nGuanQia)/1000 | N26: 15180/3600*(nPatrolSec+3)*(1000+nGuanQia)/1000 | O26: 0 | P26: 17500/60*nMin*(1000+nGuanQia)/1000 | Q26: 14000/60*nMin*(1000+nGuanQia)/1000 | R26: 15180/60*nMin*(1000+nGuanQia)/1000 | S26: =LEFT(RC[-15],2)&"小妖" -> 天仙小妖 | T26: pet_61;pet_23; | U26: 3 | V26: 5 | W26: 1,28000,8,0;1,19016,8,0;1,4,10000,0;1,7,10000,0;1,8,9000,0;1,3,5000,0;
A27: 23 | B27: =R[-1]C[1]+1 -> 801 | C27: =R[-1]C+100 -> 900 | D27: 金仙境界 | E27: 10505 | F27: 5 | G27: 3 | H27: =R[-1]C+10 -> 200131 | I27: (nGuanQia-10)*0.004+0.75 | J27: 480 | K27: 5000,0; | L27: 400/36*(nPatrolSec+3)*(1000+nGuanQia)/1000 | M27: 14200/3600*(nPatrolSec+3)*(1000+nGuanQia)/1000 | N27: 15240/3600*(nPatrolSec+3)*(1000+nGuanQia)/1000 | O27: 0 | P27: 17750/60*nMin*(1000+nGuanQia)/1000 | Q27: 14200/60*nMin*(1000+nGuanQia)/1000 | R27: 15240/60*nMin*(1000+nGuanQia)/1000 | S27: =LEFT(RC[-15],2)&"小妖" -> 金仙小妖 | T27: pet_61;pet_23; | U27: 3 | V27: 5 | W27: 1,28000,8,0;1,19016,8,0;1,4,10000,0;1,7,10000,0;1,8,9000,0;1,3,5000,0;
A28: 24 | B28: =R[-1]C[1]+1 -> 901 | C28: 9999 | D28: 大罗金仙 | E28: 10504 | F28: 5 | G28: 3 | H28: =R[-1]C+10 -> 200141 | I28: (nGuanQia-10)*0.004+0.75 | J28: 480 | K28: 5000,0; | L28: 400/36*(nPatrolSec+3)*(1000+nGuanQia)/1000 | M28: 14400/3600*(nPatrolSec+3)*(1000+nGuanQia)/1000 | N28: 15300/3600*(nPatrolSec+3)*(1000+nGuanQia)/1000 | O28: 0 | P28: 18000/60*nMin*(1000+nGuanQia)/1000 | Q28: 14400/60*nMin*(1000+nGuanQia)/1000 | R28: 15300/60*nMin*(1000+nGuanQia)/1000 | S28: =LEFT(RC[-15],2)&"小妖" -> 大罗小妖 | T28: pet_61;pet_23; | U28: 3 | V28: 5 | W28: 1,28000,8,0;1,19016,8,0;1,4,10000,0;1,7,10000,0;1,8,9000,0;1,3,5000,0;