Sheet: ctServerLevelConf
A2: nIndex | B2: nDays | C2: nLevel
A3: i | B3: i | C3: i
A4: 标识而已 | B4: 开服第几天 | C4: 服务器等级
A5: 1 | B5: 1 | C5: 50
A6: 2 | B6: 2 | C6: =R[-1]C+5 -> 55
A7: 3 | B7: 3 | C7: =R[-1]C+5 -> 60
A8: 4 | B8: 5 | C8: =R[-1]C+5 -> 65
A9: 5 | B9: 7 | C9: =R[-1]C+5 -> 70
A10: 6 | B10: 10 | C10: =R[-1]C+5 -> 75
A11: 7 | B11: 15 | C11: =R[-1]C+5 -> 80
A12: 8 | B12: 22 | C12: =R[-1]C+5 -> 85
A13: 9 | B13: 32 | C13: =R[-1]C+5 -> 90
A14: 10 | B14: 46 | C14: =R[-1]C+5 -> 95
A15: 11 | B15: 66 | C15: =R[-1]C+5 -> 100
A16: 12 | B16: 94 | C16: =R[-1]C+5 -> 105
A17: 13 | B17: 124 | C17: =R[-1]C+5 -> 110
A18: 14 | B18: 154 | C18: =R[-1]C+5 -> 115
A19: 15 | B19: 189 | C19: =R[-1]C+5 -> 120
A20: 16 | B20: 224 | C20: =R[-1]C+5 -> 125
A21: 17 | B21: 264 | C21: =R[-1]C+5 -> 130
A22: 18 | B22: 304 | C22: =R[-1]C+5 -> 135
A23: 19 | B23: 349 | C23: =R[-1]C+5 -> 140
A24: 20 | B24: 394 | C24: =R[-1]C+5 -> 145
A25: 21 | B25: 444 | C25: =R[-1]C+5 -> 150