Sheet: ctShenMoZhiConf
C1: 1 普通 2 精英 3 英雄
A2: 0 | B2: 0 | C2: 0 | D2: 0 | E2: 0 | F2: 0 | G2: 1 | H2: 0 | I2: 0 | J2: 0 | K2: 0 | L2: 0
A3: nID | B3: sName | C3: nType | D3: nChapter | E3: nOpenLv | F3: sIcon | G3: nFightID | H3: sDesc | I3: fnRoleExpReward | J3: fnGoldReward | K3: fnSilverReward | L3: nCombatEffectiveness
A4: i | B4: s | C4: i | D4: i | E4: i | F4: s | G4: i | H4: s | I4: e | J4: e | K4: e | L4: i
A5: 关卡ID | B5: 名字 | C5: 类型 | D5: 章节 | E5: 开启等级 | F5: 显示头像 | G5: 对应战斗关（monster） | H5: 关卡描述 | I5: 首通关卡经验奖励 | J5: 首通关卡金币奖励 | K5: 单环银币奖励 | L5: 推荐战力
A6: 1 | B6: 1 | C6: 1 | D6: 1 | E6: 30 | F6: hero_1003 | G6: 900001 | H6: 首通可获以下奖励 | I6: 19000 | J6: 75000 | K6: 100000 | L6: 4264
A7: 2 | B7: 2 | C7: 1 | D7: 1 | E7: 30 | F7: hero_2003 | G7: 900002 | H7: 首通可获以下奖励 | I7: 29140 | J7: 76000 | K7: 101000 | L7: 4295
A8: 3 | B8: 3 | C8: 1 | D8: 1 | E8: 30 | F8: partner_1006 | G8: 900003 | H8: 首通可获以下奖励 | I8: 39280 | J8: 77000 | K8: 102000 | L8: 4326
A9: 4 | B9: 4 | C9: 1 | D9: 1 | E9: 30 | F9: hero_1003 | G9: 900004 | H9: 首通可获以下奖励 | I9: 49420 | J9: 78000 | K9: 103000 | L9: 4357
A10: 5 | B10: 5 | C10: 1 | D10: 1 | E10: 30 | F10: partner_1003 | G10: 900005 | H10: 首通可获以下奖励 | I10: 148680 | J10: 137000 | K10: 312000 | L10: 4388
A11: 6 | B11: 1 | C11: 1 | D11: 2 | E11: 35 | F11: partner_1007 | G11: 900006 | H11: 首通可获以下奖励 | I11: 49700 | J11: 80000 | K11: 105000 | L11: 4433
A12: 7 | B12: 2 | C12: 1 | D12: 2 | E12: 35 | F12: hero_2003 | G12: 900007 | H12: 首通可获以下奖励 | I12: 49840 | J12: 81000 | K12: 106000 | L12: 4465
A13: 8 | B13: 3 | C13: 1 | D13: 2 | E13: 35 | F13: partner_1012 | G13: 900008 | H13: 首通可获以下奖励 | I13: 49980 | J13: 82000 | K13: 107000 | L13: 4496
A14: 9 | B14: 4 | C14: 1 | D14: 2 | E14: 35 | F14: partner_1003 | G14: 900009 | H14: 首通可获以下奖励 | I14: 50120 | J14: 83000 | K14: 108000 | L14: 4527
A15: 10 | B15: 5 | C15: 1 | D15: 2 | E15: 35 | F15: pet_71 | G15: 900010 | H15: 首通可获以下奖励 | I15: 151410 | J15: 152000 | K15: 327000 | L15: 4558
A16: 11 | B16: 1 | C16: 1 | D16: 3 | E16: 40 | F16: partner_1005 | G16: 900011 | H16: 首通可获以下奖励，金宝箱可得50级紫装 | I16: 50820 | J16: 85000 | K16: 110000 | L16: 4685
A17: 12 | B17: 2 | C17: 1 | D17: 3 | E17: 40 | F17: hero_1003 | G17: 900012 | H17: 首通可获以下奖励，金宝箱可得50级紫装 | I17: 51170 | J17: 86000 | K17: 111000 | L17: 4716
A18: 13 | B18: 3 | C18: 1 | D18: 3 | E18: 40 | F18: partner_1008 | G18: 900013 | H18: 首通可获以下奖励，金宝箱可得50级紫装 | I18: 51520 | J18: 87000 | K18: 112000 | L18: 4746
A19: 14 | B19: 4 | C19: 1 | D19: 3 | E19: 40 | F19: pet_61 | G19: 900014 | H19: 首通可获以下奖励，金宝箱可得50级紫装 | I19: 51870 | J19: 89500 | K19: 113000 | L19: 4777
A20: 15 | B20: 5 | C20: 1 | D20: 3 | E20: 40 | F20: hero_1003 | G20: 900015 | H20: 首通可获以下奖励，金宝箱可得50级紫装 | I20: 156660 | J20: 176000 | K20: 342000 | L20: 4808
A21: 16 | B21: 1 | C21: 1 | D21: 4 | E21: 45 | F21: pet_52 | G21: 900016 | H21: 首通可获以下奖励，金宝箱可得50级紫装 | I21: 52570 | J21: 94500 | K21: 115000 | L21: 4854
A22: 17 | B22: 2 | C22: 1 | D22: 4 | E22: 45 | F22: hero_2003 | G22: 900017 | H22: 首通可获以下奖励，金宝箱可得50级紫装 | I22: 53270 | J22: 97000 | K22: 116000 | L22: 4885
A23: 18 | B23: 3 | C23: 1 | D23: 4 | E23: 45 | F23: partner_1006 | G23: 900018 | H23: 首通可获以下奖励，金宝箱可得50级紫装 | I23: 53970 | J23: 99500 | K23: 117000 | L23: 4915
A24: 19 | B24: 4 | C24: 1 | D24: 4 | E24: 45 | F24: pet_72 | G24: 900019 | H24: 首通可获以下奖励，金宝箱可得50级紫装 | I24: 54670 | J24: 102000 | K24: 118000 | L24: 4947
A25: 20 | B25: 5 | C25: 1 | D25: 4 | E25: 45 | F25: partner_1009 | G25: 900020 | H25: 首通可获以下奖励，金宝箱可得50级紫装 | I25: 166110 | J25: 213500 | K25: 357000 | L25: 4979
A26: 21 | B26: 1 | C26: 1 | D26: 5 | E26: 50 | F26: pet_61 | G26: 900021 | H26: 首通可获以下奖励，金宝箱可得2星法宝--鸣鸿刀 | I26: 56070 | J26: 107000 | K26: 120000 | L26: 5111
A27: 22 | B27: 2 | C27: 1 | D27: 5 | E27: 50 | F27: pet_73 | G27: 900022 | H27: 首通可获以下奖励，金宝箱可得2星法宝--鸣鸿刀 | I27: 56770 | J27: 109500 | K27: 121000 | L27: 5142
A28: 23 | B28: 3 | C28: 1 | D28: 5 | E28: 50 | F28: pet_71 | G28: 900023 | H28: 首通可获以下奖励，金宝箱可得2星法宝--鸣鸿刀 | I28: 57470 | J28: 112000 | K28: 122000 | L28: 5172
A29: 24 | B29: 4 | C29: 1 | D29: 5 | E29: 50 | F29: pet_71 | G29: 900024 | H29: 首通可获以下奖励，金宝箱可得2星法宝--鸣鸿刀 | I29: 58170 | J29: 114500 | K29: 123000 | L29: 5203
A30: 25 | B30: 5 | C30: 1 | D30: 5 | E30: 50 | F30: partner_1002 | G30: 900025 | H30: 首通可获以下奖励，金宝箱可得2星法宝--鸣鸿刀 | I30: 176610 | J30: 251000 | K30: 372000 | L30: 5234
A31: 26 | B31: 1 | C31: 1 | D31: 6 | E31: 55 | F31: partner_1011 | G31: 900026 | H31: 首通可获以下奖励 | I31: 59570 | J31: 119500 | K31: 125000 | L31: 5280
A32: 27 | B32: 2 | C32: 1 | D32: 6 | E32: 55 | F32: partner_1008 | G32: 900027 | H32: 首通可获以下奖励 | I32: 60270 | J32: 122000 | K32: 126000 | L32: 5311
A33: 28 | B33: 3 | C33: 1 | D33: 6 | E33: 55 | F33: pet_42 | G33: 900028 | H33: 首通可获以下奖励 | I33: 60970 | J33: 124500 | K33: 127000 | L33: 5342
A34: 29 | B34: 4 | C34: 1 | D34: 6 | E34: 55 | F34: hero_1003 | G34: 900029 | H34: 首通可获以下奖励 | I34: 61670 | J34: 127000 | K34: 128000 | L34: 5373
A35: 30 | B35: 5 | C35: 1 | D35: 6 | E35: 55 | F35: pet_22 | G35: 900030 | H35: 首通可获以下奖励 | I35: 187110 | J35: 288500 | K35: 387000 | L35: 5404
A36: 31 | B36: 1 | C36: 1 | D36: 7 | E36: 60 | F36: pet_53 | G36: 900031 | H36: 首通可获以下奖励 | I36: 63070 | J36: 132000 | K36: 130000 | L36: 5597
A37: 32 | B37: 2 | C37: 1 | D37: 7 | E37: 60 | F37: hero_1003 | G37: 900032 | H37: 首通可获以下奖励 | I37: 63770 | J37: 134500 | K37: 131000 | L37: 5628
A38: 33 | B38: 3 | C38: 1 | D38: 7 | E38: 60 | F38: partner_1010 | G38: 900033 | H38: 首通可获以下奖励 | I38: 65170 | J38: 139500 | K38: 132000 | L38: 5658
A39: 34 | B39: 4 | C39: 1 | D39: 7 | E39: 60 | F39: pet_61 | G39: 900034 | H39: 首通可获以下奖励 | I39: 66570 | J39: 144500 | K39: 133000 | L39: 5689
A40: 35 | B40: 5 | C40: 1 | D40: 7 | E40: 60 | F40: pet_63 | G40: 900035 | H40: 首通可获以下奖励 | I40: 203910 | J40: 348500 | K40: 402000 | L40: 5720
A41: 36 | B41: 1 | C41: 1 | D41: 8 | E41: 65 | F41: partner_1006 | G41: 900036 | H41: 首通可获以下奖励，宝箱可得稀有神器--冥王盾 | I41: 69370 | J41: 154500 | K41: 135000 | L41: 5769
A42: 37 | B42: 2 | C42: 1 | D42: 8 | E42: 65 | F42: pet_61 | G42: 900037 | H42: 首通可获以下奖励，宝箱可得稀有神器--冥王盾 | I42: 70770 | J42: 159500 | K42: 136000 | L42: 5800
A43: 38 | B43: 3 | C43: 1 | D43: 8 | E43: 65 | F43: partner_1006 | G43: 900038 | H43: 首通可获以下奖励，宝箱可得稀有神器--冥王盾 | I43: 72170 | J43: 164500 | K43: 137000 | L43: 5829
A44: 39 | B44: 4 | C44: 1 | D44: 8 | E44: 65 | F44: partner_1002 | G44: 900039 | H44: 首通可获以下奖励，宝箱可得稀有神器--冥王盾 | I44: 73570 | J44: 169500 | K44: 138000 | L44: 5860
A45: 40 | B45: 5 | C45: 1 | D45: 8 | E45: 65 | F45: partner_1003 | G45: 900040 | H45: 首通可获以下奖励，宝箱可得稀有神器--冥王盾 | I45: 224910 | J45: 423500 | K45: 417000 | L45: 5891
A46: 41 | B46: 1 | C46: 1 | D46: 9 | E46: 70 | F46: partner_1011 | G46: 900041 | H46: 首通可获以下奖励 | I46: 76370 | J46: 179500 | K46: 140000 | L46: 6043
A47: 42 | B47: 2 | C47: 1 | D47: 9 | E47: 70 | F47: partner_1010 | G47: 900042 | H47: 首通可获以下奖励 | I47: 77770 | J47: 184500 | K47: 141000 | L47: 6074
A48: 43 | B48: 3 | C48: 1 | D48: 9 | E48: 70 | F48: pet_53 | G48: 900043 | H48: 首通可获以下奖励 | I48: 79170 | J48: 189500 | K48: 142000 | L48: 6105
A49: 44 | B49: 4 | C49: 1 | D49: 9 | E49: 70 | F49: hero_1003 | G49: 900044 | H49: 首通可获以下奖励 | I49: 80570 | J49: 194500 | K49: 143000 | L49: 6134
A50: 45 | B50: 5 | C50: 1 | D50: 9 | E50: 70 | F50: partner_1009 | G50: 900045 | H50: 首通可获以下奖励 | I50: 252210 | J50: 498500 | K50: 432000 | L50: 6165
A51: 46 | B51: 1 | C51: 1 | D51: 10 | E51: 75 | F51: partner_1005 | G51: 900046 | H51: 首通可获以下奖励，金宝箱可得3星法宝--照妖镜 | I51: 87570 | J51: 204500 | K51: 145000 | L51: 6217
A52: 47 | B52: 2 | C52: 1 | D52: 10 | E52: 75 | F52: pet_71 | G52: 900047 | H52: 首通可获以下奖励，金宝箱可得3星法宝--照妖镜 | I52: 91070 | J52: 209500 | K52: 146000 | L52: 6248
A53: 48 | B53: 3 | C53: 1 | D53: 10 | E53: 75 | F53: pet_71 | G53: 900048 | H53: 首通可获以下奖励，金宝箱可得3星法宝--照妖镜 | I53: 94570 | J53: 219500 | K53: 147000 | L53: 6278
A54: 49 | B54: 4 | C54: 1 | D54: 10 | E54: 75 | F54: partner_1002 | G54: 900049 | H54: 首通可获以下奖励，金宝箱可得3星法宝--照妖镜 | I54: 98070 | J54: 229500 | K54: 148000 | L54: 6308
A55: 50 | B55: 5 | C55: 1 | D55: 10 | E55: 75 | F55: partner_1001 | G55: 900050 | H55: 首通可获以下奖励，金宝箱可得3星法宝--照妖镜 | I55: 315210 | J55: 618500 | K55: 447000 | L55: 6339
A56: 51 | B56: 1 | C56: 2 | D56: 1 | E56: 40 | F56: hero_1003 | G56: =R[-50]C+100 -> 900101 | H56: 首通可获以下奖励 | I56: 63700 | J56: 82500 | K56: 150000 | L56: 5027
A57: 52 | B57: 2 | C57: 2 | D57: 1 | E57: 40 | F57: hero_2003 | G57: =R[-50]C+100 -> 900102 | H57: 首通可获以下奖励 | I57: 63882 | J57: 83500 | K57: 151500 | L57: 5058
A58: 53 | B58: 3 | C58: 2 | D58: 1 | E58: 40 | F58: partner_1006 | G58: =R[-50]C+100 -> 900103 | H58: 首通可获以下奖励 | I58: 64064 | J58: 85000 | K58: 153000 | L58: 5090
A59: 54 | B59: 4 | C59: 2 | D59: 1 | E59: 40 | F59: hero_1003 | G59: =R[-50]C+100 -> 900104 | H59: 首通可获以下奖励 | I59: 64246 | J59: 86000 | K59: 154500 | L59: 5121
A60: 55 | B60: 5 | C60: 2 | D60: 1 | E60: 40 | F60: partner_1003 | G60: =R[-50]C+100 -> 900105 | H60: 首通可获以下奖励 | I60: 193284 | J60: 162500 | K60: 468000 | L60: 5153
A61: 56 | B61: 1 | C61: 2 | D61: 2 | E61: 45 | F61: partner_1007 | G61: =R[-50]C+100 -> 900106 | H61: 首通可获以下奖励 | I61: 64610 | J61: 89000 | K61: 157500 | L61: 5204
A62: 57 | B62: 2 | C62: 2 | D62: 2 | E62: 45 | F62: hero_2003 | G62: =R[-50]C+100 -> 900107 | H62: 首通可获以下奖励 | I62: 64792 | J62: 90000 | K62: 159000 | L62: 5236
A63: 58 | B63: 3 | C63: 2 | D63: 2 | E63: 45 | F63: partner_1012 | G63: =R[-50]C+100 -> 900108 | H63: 首通可获以下奖励 | I63: 64974 | J63: 91500 | K63: 160500 | L63: 5268
A64: 59 | B64: 4 | C64: 2 | D64: 2 | E64: 45 | F64: partner_1003 | G64: =R[-50]C+100 -> 900109 | H64: 首通可获以下奖励 | I64: 65156 | J64: 92500 | K64: 162000 | L64: 5300
A65: 60 | B65: 5 | C65: 2 | D65: 2 | E65: 45 | F65: pet_71 | G65: =R[-50]C+100 -> 900110 | H65: 首通可获以下奖励 | I65: 196833 | J65: 182000 | K65: 490500 | L65: 5332
A66: 61 | B66: 1 | C66: 2 | D66: 3 | E66: 50 | F66: partner_1005 | G66: =R[-50]C+100 -> 900111 | H66: 首通可获以下奖励 | I66: 66066 | J66: 95500 | K66: 165000 | L66: 5495
A67: 62 | B67: 2 | C67: 2 | D67: 3 | E67: 50 | F67: hero_1003 | G67: =R[-50]C+100 -> 900112 | H67: 首通可获以下奖励 | I67: 66521 | J67: 96500 | K67: 166500 | L67: 5526
A68: 63 | B68: 3 | C68: 2 | D68: 3 | E68: 50 | F68: partner_1008 | G68: =R[-50]C+100 -> 900113 | H68: 首通可获以下奖励 | I68: 66976 | J68: 98000 | K68: 168000 | L68: 5558
A69: 64 | B69: 4 | C69: 2 | D69: 3 | E69: 50 | F69: pet_61 | G69: =R[-50]C+100 -> 900114 | H69: 首通可获以下奖励 | I69: 67431 | J69: 101000 | K69: 169500 | L69: 5589
A70: 65 | B70: 5 | C70: 2 | D70: 3 | E70: 50 | F70: hero_1003 | G70: =R[-50]C+100 -> 900115 | H70: 首通可获以下奖励 | I70: 203658 | J70: 213500 | K70: 513000 | L70: 5621
A71: 66 | B71: 1 | C71: 2 | D71: 4 | E71: 55 | F71: pet_52 | G71: =R[-50]C+100 -> 900116 | H71: 首通可获以下奖励 | I71: 68341 | J71: 107500 | K71: 172500 | L71: 5673
A72: 67 | B72: 2 | C72: 2 | D72: 4 | E72: 55 | F72: hero_2003 | G72: =R[-50]C+100 -> 900117 | H72: 首通可获以下奖励 | I72: 69251 | J72: 111000 | K72: 174000 | L72: 5705
A73: 68 | B73: 3 | C73: 2 | D73: 4 | E73: 55 | F73: partner_1006 | G73: =R[-50]C+100 -> 900118 | H73: 首通可获以下奖励 | I73: 70161 | J73: 114000 | K73: 175500 | L73: 5736
A74: 69 | B74: 4 | C74: 2 | D74: 4 | E74: 55 | F74: pet_72 | G74: =R[-50]C+100 -> 900119 | H74: 首通可获以下奖励 | I74: 71071 | J74: 117500 | K74: 177000 | L74: 5767
A75: 70 | B75: 5 | C75: 2 | D75: 4 | E75: 55 | F75: partner_1009 | G75: =R[-50]C+100 -> 900120 | H75: 首通可获以下奖励 | I75: 215943 | J75: 261500 | K75: 535500 | L75: 5799
A76: 71 | B76: 1 | C76: 2 | D76: 5 | E76: 60 | F76: pet_61 | G76: =R[-50]C+100 -> 900121 | H76: 首通可获以下奖励，宝箱可得稀有神器--归元弓 | I76: 72891 | J76: 124000 | K76: 180000 | L76: 6035
A77: 72 | B77: 2 | C77: 2 | D77: 5 | E77: 60 | F77: pet_73 | G77: =R[-50]C+100 -> 900122 | H77: 首通可获以下奖励，宝箱可得稀有神器--归元弓 | I77: 73801 | J77: 127000 | K77: 181500 | L77: 6067
A78: 73 | B78: 3 | C78: 2 | D78: 5 | E78: 60 | F78: pet_71 | G78: =R[-50]C+100 -> 900123 | H78: 首通可获以下奖励，宝箱可得稀有神器--归元弓 | I78: 74711 | J78: 130500 | K78: 183000 | L78: 6098
A79: 74 | B79: 4 | C79: 2 | D79: 5 | E79: 60 | F79: pet_71 | G79: =R[-50]C+100 -> 900124 | H79: 首通可获以下奖励，宝箱可得稀有神器--归元弓 | I79: 75621 | J79: 133500 | K79: 184500 | L79: 6129
A80: 75 | B80: 5 | C80: 2 | D80: 5 | E80: 60 | F80: partner_1002 | G80: =R[-50]C+100 -> 900125 | H80: 首通可获以下奖励，宝箱可得稀有神器--归元弓 | I80: 229593 | J80: 311000 | K80: 558000 | L80: 6161
A81: 76 | B81: 1 | C81: 2 | D81: 6 | E81: 65 | F81: partner_1011 | G81: =R[-50]C+100 -> 900126 | H81: 首通可获以下奖励 | I81: 77441 | J81: 140000 | K81: 187500 | L81: 6215
A82: 77 | B82: 2 | C82: 2 | D82: 6 | E82: 65 | F82: partner_1008 | G82: =R[-50]C+100 -> 900127 | H82: 首通可获以下奖励 | I82: 78351 | J82: 143500 | K82: 189000 | L82: 6247
A83: 78 | B83: 3 | C83: 2 | D83: 6 | E83: 65 | F83: pet_42 | G83: =R[-50]C+100 -> 900128 | H83: 首通可获以下奖励 | I83: 79261 | J83: 146500 | K83: 190500 | L83: 6277
A84: 79 | B84: 4 | C84: 2 | D84: 6 | E84: 65 | F84: hero_1003 | G84: =R[-50]C+100 -> 900129 | H84: 首通可获以下奖励 | I84: 80171 | J84: 150000 | K84: 192000 | L84: 6309
A85: 80 | B85: 5 | C85: 2 | D85: 6 | E85: 65 | F85: pet_22 | G85: =R[-50]C+100 -> 900130 | H85: 首通可获以下奖励 | I85: 243243 | J85: 359000 | K85: 580500 | L85: 6340
A86: 81 | B86: 1 | C86: 2 | D86: 7 | E86: 70 | F86: pet_53 | G86: =R[-50]C+100 -> 900131 | H86: 首通可获以下奖励，宝箱可得稀有神器--玄都杖 | I86: 81991 | J86: 156500 | K86: 195000 | L86: 6528
A87: 82 | B87: 2 | C87: 2 | D87: 7 | E87: 70 | F87: hero_1003 | G87: =R[-50]C+100 -> 900132 | H87: 首通可获以下奖励，宝箱可得稀有神器--玄都杖 | I87: 82901 | J87: 159500 | K87: 196500 | L87: 6560
A88: 83 | B88: 3 | C88: 2 | D88: 7 | E88: 70 | F88: partner_1010 | G88: =R[-50]C+100 -> 900133 | H88: 首通可获以下奖励，宝箱可得稀有神器--玄都杖 | I88: 84721 | J88: 166000 | K88: 198000 | L88: 6592
A89: 84 | B89: 4 | C89: 2 | D89: 7 | E89: 70 | F89: pet_61 | G89: =R[-50]C+100 -> 900134 | H89: 首通可获以下奖励，宝箱可得稀有神器--玄都杖 | I89: 86541 | J89: 172500 | K89: 199500 | L89: 6622
A90: 85 | B90: 5 | C90: 2 | D90: 7 | E90: 70 | F90: pet_63 | G90: =R[-50]C+100 -> 900135 | H90: 首通可获以下奖励，宝箱可得稀有神器--玄都杖 | I90: 265083 | J90: 437000 | K90: 603000 | L90: 6653
A91: 86 | B91: 1 | C91: 2 | D91: 8 | E91: 75 | F91: partner_1006 | G91: =R[-50]C+100 -> 900136 | H91: 首通可获以下奖励 | I91: 90181 | J91: 185500 | K91: 202500 | L91: 6710
A92: 87 | B92: 2 | C92: 2 | D92: 8 | E92: 75 | F92: pet_61 | G92: =R[-50]C+100 -> 900137 | H92: 首通可获以下奖励 | I92: 92001 | J92: 192000 | K92: 204000 | L92: 6741
A93: 88 | B93: 3 | C93: 2 | D93: 8 | E93: 75 | F93: partner_1006 | G93: =R[-50]C+100 -> 900138 | H93: 首通可获以下奖励 | I93: 93821 | J93: 198500 | K93: 205500 | L93: 6773
A94: 89 | B94: 4 | C94: 2 | D94: 8 | E94: 75 | F94: partner_1002 | G94: =R[-50]C+100 -> 900139 | H94: 首通可获以下奖励 | I94: 95641 | J94: 205000 | K94: 207000 | L94: 6803
A95: 90 | B95: 5 | C95: 2 | D95: 8 | E95: 75 | F95: partner_1003 | G95: =R[-50]C+100 -> 900140 | H95: 首通可获以下奖励 | I95: 292383 | J95: 534500 | K95: 625500 | L95: 6835
A96: 91 | B96: 1 | C96: 2 | D96: 9 | E96: 80 | F96: partner_1011 | G96: =R[-50]C+100 -> 900141 | H96: 首通可获以下奖励，宝箱可得稀有时装--七星剑飞行器 | I96: 99281 | J96: 218000 | K96: 210000 | L96: 7120
A97: 92 | B97: 2 | C97: 2 | D97: 9 | E97: 80 | F97: partner_1010 | G97: =R[-50]C+100 -> 900142 | H97: 首通可获以下奖励，宝箱可得稀有时装--七星剑飞行器 | I97: 101101 | J97: 224500 | K97: 211500 | L97: 7152
A98: 93 | B98: 3 | C98: 2 | D98: 9 | E98: 80 | F98: pet_53 | G98: =R[-50]C+100 -> 900143 | H98: 首通可获以下奖励，宝箱可得稀有时装--七星剑飞行器 | I98: 102921 | J98: 231000 | K98: 213000 | L98: 7182
A99: 94 | B99: 4 | C99: 2 | D99: 9 | E99: 80 | F99: hero_1003 | G99: =R[-50]C+100 -> 900144 | H99: 首通可获以下奖励，宝箱可得稀有时装--七星剑飞行器 | I99: 104741 | J99: 237500 | K99: 214500 | L99: 7213
A100: 95 | B100: 5 | C100: 2 | D100: 9 | E100: 80 | F100: partner_1009 | G100: =R[-50]C+100 -> 900145 | H100: 首通可获以下奖励，宝箱可得稀有时装--七星剑飞行器 | I100: 327873 | J100: 632000 | K100: 648000 | L100: 7245
A101: 96 | B101: 1 | C101: 2 | D101: 10 | E101: 85 | F101: partner_1005 | G101: =R[-50]C+100 -> 900146 | H101: 首通可获以下奖励 | I101: 113841 | J101: 250500 | K101: 217500 | L101: 7301
A102: 97 | B102: 2 | C102: 2 | D102: 10 | E102: 85 | F102: pet_71 | G102: =R[-50]C+100 -> 900147 | H102: 首通可获以下奖励 | I102: 118391 | J102: 257000 | K102: 219000 | L102: 7333
A103: 98 | B103: 3 | C103: 2 | D103: 10 | E103: 85 | F103: pet_71 | G103: =R[-50]C+100 -> 900148 | H103: 首通可获以下奖励 | I103: 122941 | J103: 270000 | K103: 220500 | L103: 7365
A104: 99 | B104: 4 | C104: 2 | D104: 10 | E104: 85 | F104: partner_1002 | G104: =R[-50]C+100 -> 900149 | H104: 首通可获以下奖励 | I104: 127491 | J104: 283000 | K104: 222000 | L104: 7396
A105: 100 | B105: 5 | C105: 2 | D105: 10 | E105: 85 | F105: partner_1001 | G105: =R[-50]C+100 -> 900150 | H105: 首通可获以下奖励 | I105: 409773 | J105: 788000 | K105: 670500 | L105: 7426
A106: 101 | B106: 1 | C106: 3 | D106: 1 | E106: 50 | F106: hero_1003 | G106: =R[-50]C+100 -> 900201 | H106: 首通可获以下奖励 | I106: 82810 | J106: 92000 | K106: 270000 | L106: 8006
A107: 102 | B107: 2 | C107: 3 | D107: 1 | E107: 50 | F107: hero_2003 | G107: =R[-50]C+100 -> 900202 | H107: 首通可获以下奖励 | I107: 83041 | J107: 93500 | K107: 272700 | L107: 8039
A108: 103 | B108: 3 | C108: 3 | D108: 1 | E108: 50 | F108: partner_1006 | G108: =R[-50]C+100 -> 900203 | H108: 首通可获以下奖励 | I108: 83279 | J108: 95500 | K108: 275400 | L108: 8069
A109: 104 | B109: 4 | C109: 3 | D109: 1 | E109: 50 | F109: hero_1003 | G109: =R[-50]C+100 -> 900204 | H109: 首通可获以下奖励 | I109: 83517 | J109: 96500 | K109: 278100 | L109: 8101
A110: 105 | B110: 5 | C110: 3 | D110: 1 | E110: 50 | F110: partner_1003 | G110: =R[-50]C+100 -> 900205 | H110: 首通可获以下奖励 | I110: 251265 | J110: 195500 | K110: 842400 | L110: 8134
A111: 106 | B111: 1 | C111: 3 | D111: 2 | E111: 55 | F111: partner_1007 | G111: =R[-50]C+100 -> 900206 | H111: 首通可获以下奖励 | I111: 83993 | J111: 100500 | K111: 283500 | L111: 8195
A112: 107 | B112: 2 | C112: 3 | D112: 2 | E112: =R[-5]C+5 -> 55 | F112: hero_2003 | G112: =R[-50]C+100 -> 900207 | H112: 首通可获以下奖励 | I112: 84224 | J112: 102000 | K112: 286200 | L112: 8228
A113: 108 | B113: 3 | C113: 3 | D113: 2 | E113: =R[-5]C+5 -> 55 | F113: partner_1012 | G113: =R[-50]C+100 -> 900208 | H113: 首通可获以下奖励 | I113: 84462 | J113: 103500 | K113: 288900 | L113: 8260
A114: 109 | B114: 4 | C114: 3 | D114: 2 | E114: =R[-5]C+5 -> 55 | F114: partner_1003 | G114: =R[-50]C+100 -> 900209 | H114: 首通可获以下奖励 | I114: 84700 | J114: 105000 | K114: 291600 | L114: 8292
A115: 110 | B115: 5 | C115: 3 | D115: 2 | E115: =R[-5]C+5 -> 55 | F115: pet_71 | G115: =R[-50]C+100 -> 900210 | H115: 首通可获以下奖励 | I115: 255864 | J115: 221000 | K115: 882900 | L115: 8323
A116: 111 | B116: 1 | C116: 3 | D116: 3 | E116: =R[-5]C+5 -> 60 | F116: partner_1005 | G116: =R[-50]C+100 -> 900211 | H116: 首通可获以下奖励 | I116: 85883 | J116: 109000 | K116: 297000 | L116: 8565
A117: 112 | B117: 2 | C117: 3 | D117: 3 | E117: =R[-5]C+5 -> 60 | F117: hero_1003 | G117: =R[-50]C+100 -> 900212 | H117: 首通可获以下奖励 | I117: 86471 | J117: 110000 | K117: 299700 | L117: 8598
A118: 113 | B118: 3 | C118: 3 | D118: 3 | E118: =R[-5]C+5 -> 60 | F118: partner_1008 | G118: =R[-50]C+100 -> 900213 | H118: 首通可获以下奖励 | I118: 87066 | J118: 112000 | K118: 302400 | L118: 8628
A119: 114 | B119: 4 | C119: 3 | D119: 3 | E119: =R[-5]C+5 -> 60 | F119: pet_61 | G119: =R[-50]C+100 -> 900214 | H119: 首通可获以下奖励 | I119: 87654 | J119: 116000 | K119: 305100 | L119: 8660
A120: 115 | B120: 5 | C120: 3 | D120: 3 | E120: =R[-5]C+5 -> 60 | F120: hero_1003 | G120: =R[-50]C+100 -> 900215 | H120: 首通可获以下奖励 | I120: 264747 | J120: 261500 | K120: 923400 | L120: 8691
A121: 116 | B121: 1 | C121: 3 | D121: 4 | E121: =R[-5]C+5 -> 65 | F121: pet_52 | G121: =R[-50]C+100 -> 900216 | H121: 首通可获以下奖励 | I121: 88837 | J121: 124500 | K121: 310500 | L121: 8756
A122: 117 | B122: 2 | C122: 3 | D122: 4 | E122: =R[-5]C+5 -> 65 | F122: hero_2003 | G122: =R[-50]C+100 -> 900217 | H122: 首通可获以下奖励 | I122: 90020 | J122: 129000 | K122: 313200 | L122: 8789
A123: 118 | B123: 3 | C123: 3 | D123: 4 | E123: =R[-5]C+5 -> 65 | F123: partner_1006 | G123: =R[-50]C+100 -> 900218 | H123: 首通可获以下奖励 | I123: 91203 | J123: 133000 | K123: 315900 | L123: 8819
A124: 119 | B124: 4 | C124: 3 | D124: 4 | E124: =R[-5]C+5 -> 65 | F124: pet_72 | G124: =R[-50]C+100 -> 900219 | H124: 首通可获以下奖励 | I124: 92386 | J124: 137500 | K124: 318600 | L124: 8851
A125: 120 | B125: 5 | C125: 3 | D125: 4 | E125: =R[-5]C+5 -> 65 | F125: partner_1009 | G125: =R[-50]C+100 -> 900220 | H125: 首通可获以下奖励 | I125: 280707 | J125: 324500 | K125: 963900 | L125: 8882
A126: 121 | B126: 1 | C126: 3 | D126: 5 | E126: =R[-5]C+5 -> 70 | F126: pet_61 | G126: =R[-50]C+100 -> 900221 | H126: 首通可获以下奖励，金宝箱可得3星法宝--乌金锤 | I126: 94752 | J126: 146000 | K126: 324000 | L126: 9118
A127: 122 | B127: 2 | C127: 3 | D127: 5 | E127: =R[-5]C+5 -> 70 | F127: pet_73 | G127: =R[-50]C+100 -> 900222 | H127: 首通可获以下奖励，金宝箱可得3星法宝--乌金锤 | I127: 95935 | J127: 150000 | K127: 326700 | L127: 9150
A128: 123 | B128: 3 | C128: 3 | D128: 5 | E128: =R[-5]C+5 -> 70 | F128: pet_71 | G128: =R[-50]C+100 -> 900223 | H128: 首通可获以下奖励，金宝箱可得3星法宝--乌金锤 | I128: 97118 | J128: 154500 | K128: 329400 | L128: 9181
A129: 124 | B129: 4 | C129: 3 | D129: 5 | E129: =R[-5]C+5 -> 70 | F129: pet_71 | G129: =R[-50]C+100 -> 900224 | H129: 首通可获以下奖励，金宝箱可得3星法宝--乌金锤 | I129: 98301 | J129: 158500 | K129: 332100 | L129: 9213
A130: 125 | B130: 5 | C130: 3 | D130: 5 | E130: =R[-5]C+5 -> 70 | F130: partner_1002 | G130: =R[-50]C+100 -> 900225 | H130: 首通可获以下奖励，金宝箱可得3星法宝--乌金锤 | I130: 298452 | J130: 389000 | K130: 1004400 | L130: 9244
A131: 126 | B131: 1 | C131: 3 | D131: 6 | E131: =R[-5]C+5 -> 75 | F131: partner_1011 | G131: =R[-50]C+100 -> 900226 | H131: 首通可获以下奖励 | I131: 100667 | J131: 167000 | K131: 337500 | L131: 9294
A132: 127 | B132: 2 | C132: 3 | D132: 6 | E132: =R[-5]C+5 -> 75 | F132: partner_1008 | G132: =R[-50]C+100 -> 900227 | H132: 首通可获以下奖励 | I132: 101850 | J132: 171500 | K132: 340200 | L132: 9325
A133: 128 | B133: 3 | C133: 3 | D133: 6 | E133: =R[-5]C+5 -> 75 | F133: pet_42 | G133: =R[-50]C+100 -> 900228 | H133: 首通可获以下奖励 | I133: 103033 | J133: 175000 | K133: 342900 | L133: 9357
A134: 129 | B134: 4 | C134: 3 | D134: 6 | E134: =R[-5]C+5 -> 75 | F134: hero_1003 | G134: =R[-50]C+100 -> 900229 | H134: 首通可获以下奖励 | I134: 104216 | J134: 180000 | K134: 345600 | L134: 9388
A135: 130 | B135: 5 | C135: 3 | D135: 6 | E135: =R[-5]C+5 -> 75 | F135: pet_22 | G135: =R[-50]C+100 -> 900230 | H135: 首通可获以下奖励 | I135: 316197 | J135: 450500 | K135: 1044900 | L135: 9420
A136: 131 | B136: 1 | C136: 3 | D136: 7 | E136: =R[-5]C+5 -> 80 | F136: pet_53 | G136: =R[-50]C+100 -> 900231 | H136: 首通可获以下奖励 | I136: 106582 | J136: 188000 | K136: 351000 | L136: 9661
A137: 132 | B137: 2 | C137: 3 | D137: 7 | E137: =R[-5]C+5 -> 80 | F137: hero_1003 | G137: =R[-50]C+100 -> 900232 | H137: 首通可获以下奖励 | I137: 107765 | J137: 192000 | K137: 353700 | L137: 9693
A138: 133 | B138: 3 | C138: 3 | D138: 7 | E138: =R[-5]C+5 -> 80 | F138: partner_1010 | G138: =R[-50]C+100 -> 900233 | H138: 首通可获以下奖励 | I138: 110131 | J138: 200500 | K138: 356400 | L138: 9724
A139: 134 | B139: 4 | C139: 3 | D139: 7 | E139: =R[-5]C+5 -> 80 | F139: pet_61 | G139: =R[-50]C+100 -> 900234 | H139: 首通可获以下奖励 | I139: 112497 | J139: 209000 | K139: 359100 | L139: 9756
A140: 135 | B140: 5 | C140: 3 | D140: 7 | E140: =R[-5]C+5 -> 80 | F140: pet_63 | G140: =R[-50]C+100 -> 900235 | H140: 首通可获以下奖励 | I140: 344589 | J140: 552500 | K140: 1085400 | L140: 9787
A141: 136 | B141: 1 | C141: 3 | D141: 8 | E141: =R[-5]C+5 -> 85 | F141: partner_1006 | G141: =R[-50]C+100 -> 900236 | H141: 首通可获以下奖励 | I141: 117229 | J141: 226000 | K141: 364500 | L141: 9838
A142: 137 | B142: 2 | C142: 3 | D142: 8 | E142: =R[-5]C+5 -> 85 | F142: pet_61 | G142: =R[-50]C+100 -> 900237 | H142: 首通可获以下奖励 | I142: 119595 | J142: 234500 | K142: 367200 | L142: 9871
A143: 138 | B143: 3 | C143: 3 | D143: 8 | E143: =R[-5]C+5 -> 85 | F143: partner_1006 | G143: =R[-50]C+100 -> 900238 | H143: 首通可获以下奖励 | I143: 121961 | J143: 243000 | K143: 369900 | L143: 9901
A144: 139 | B144: 4 | C144: 3 | D144: 8 | E144: =R[-5]C+5 -> 85 | F144: partner_1002 | G144: =R[-50]C+100 -> 900239 | H144: 首通可获以下奖励 | I144: 124327 | J144: 251500 | K144: 372600 | L144: 9933
A145: 140 | B145: 5 | C145: 3 | D145: 8 | E145: =R[-5]C+5 -> 85 | F145: partner_1003 | G145: =R[-50]C+100 -> 900240 | H145: 首通可获以下奖励 | I145: 380079 | J145: 678500 | K145: 1125900 | L145: 9964
A146: 141 | B146: 1 | C146: 3 | D146: 9 | E146: =R[-5]C+5 -> 90 | F146: partner_1011 | G146: =R[-50]C+100 -> 900241 | H146: 首通可获以下奖励，金宝箱可得4星法宝--金钟罩 | I146: 129059 | J146: 268000 | K146: 378000 | L146: 10239
A147: 142 | B147: 2 | C147: 3 | D147: 9 | E147: =R[-5]C+5 -> 90 | F147: partner_1010 | G147: =R[-50]C+100 -> 900242 | H147: 首通可获以下奖励，金宝箱可得4星法宝--金钟罩 | I147: 131425 | J147: 276500 | K147: 380700 | L147: 10270
A148: 143 | B148: 3 | C148: 3 | D148: 9 | E148: =R[-5]C+5 -> 90 | F148: pet_53 | G148: =R[-50]C+100 -> 900243 | H148: 首通可获以下奖励，金宝箱可得4星法宝--金钟罩 | I148: 133791 | J148: 285000 | K148: 383400 | L148: 10300
A149: 144 | B149: 4 | C149: 3 | D149: 9 | E149: =R[-5]C+5 -> 90 | F149: hero_1003 | G149: =R[-50]C+100 -> 900244 | H149: 首通可获以下奖励，金宝箱可得4星法宝--金钟罩 | I149: 136157 | J149: 293500 | K149: 386100 | L149: 10332
A150: 145 | B150: 5 | C150: 3 | D150: 9 | E150: =R[-5]C+5 -> 90 | F150: partner_1009 | G150: =R[-50]C+100 -> 900245 | H150: 首通可获以下奖励，金宝箱可得4星法宝--金钟罩 | I150: 426216 | J150: 806000 | K150: 1166400 | L150: 10363
A151: 146 | B151: 1 | C151: 3 | D151: 10 | E151: =R[-5]C+5 -> 95 | F151: partner_1005 | G151: =R[-50]C+100 -> 900246 | H151: 首通可获以下奖励，宝箱可得稀有时装--天空之羽翅膀 | I151: 147987 | J151: 310500 | K151: 391500 | L151: 10394
A152: 147 | B152: 2 | C152: 3 | D152: 10 | E152: =R[-5]C+5 -> 95 | F152: pet_71 | G152: =R[-50]C+100 -> 900247 | H152: 首通可获以下奖励，宝箱可得稀有时装--天空之羽翅膀 | I152: 153902 | J152: 319000 | K152: 394200 | L152: 10426
A153: 148 | B153: 3 | C153: 3 | D153: 10 | E153: =R[-5]C+5 -> 95 | F153: pet_71 | G153: =R[-50]C+100 -> 900248 | H153: 首通可获以下奖励，宝箱可得稀有时装--天空之羽翅膀 | I153: 159817 | J153: 336000 | K153: 396900 | L153: 10457
A154: 149 | B154: 4 | C154: 3 | D154: 10 | E154: =R[-5]C+5 -> 95 | F154: partner_1002 | G154: =R[-50]C+100 -> 900249 | H154: 首通可获以下奖励，宝箱可得稀有时装--天空之羽翅膀 | I154: 165732 | J154: 352500 | K154: 399600 | L154: 10487
A155: 150 | B155: 5 | C155: 3 | D155: 10 | E155: =R[-5]C+5 -> 95 | F155: partner_1001 | G155: =R[-50]C+100 -> 900250 | H155: 首通可获以下奖励，宝箱可得稀有时装--天空之羽翅膀 | I155: 532686 | J155: 1008500 | K155: 1206900 | L155: 10519

Sheet: Sheet2
D3: 首通关卡经验奖励 | F3: 首通关卡金币奖励 | H3: 单环银币奖励
B4: 1 | D4: 7000 | F4: 50 | H4: 10000 | L4: 426485 | M4: =INT(RC[-1]/100) -> 4264
B5: 2 | C5: 20 | D5: =R[-1]C+RC[-1] -> 7020 | E5: 2 | F5: =R[-1]C+RC[-1] -> 52 | G5: 100 | H5: =R[-1]C+RC[-1] -> 10100 | L5: 429590 | M5: =INT(RC[-1]/100) -> 4295
B6: 3 | C6: 20 | D6: =R[-1]C+RC[-1] -> 7040 | E6: 2 | F6: =R[-1]C+RC[-1] -> 54 | G6: 100 | H6: =R[-1]C+RC[-1] -> 10200 | L6: 432650 | M6: =INT(RC[-1]/100) -> 4326
B7: 4 | C7: 20 | D7: =R[-1]C+RC[-1] -> 7060 | E7: 2 | F7: =R[-1]C+RC[-1] -> 56 | G7: 100 | H7: =R[-1]C+RC[-1] -> 10300 | L7: 435713 | M7: =INT(RC[-1]/100) -> 4357
B8: 5 | C8: 20 | D8: =R[-1]C+RC[-1] -> 7080 | E8: 2 | F8: =R[-1]C+RC[-1] -> 58 | G8: 100 | H8: =R[-1]C+RC[-1] -> 10400 | L8: 438814 | M8: =INT(RC[-1]/100) -> 4388
B9: 6 | C9: 20 | D9: =R[-1]C+RC[-1] -> 7100 | E9: 2 | F9: =R[-1]C+RC[-1] -> 60 | G9: 100 | H9: =R[-1]C+RC[-1] -> 10500 | L9: 443326 | M9: =INT(RC[-1]/100) -> 4433
B10: 7 | C10: 20 | D10: =R[-1]C+RC[-1] -> 7120 | E10: 2 | F10: =R[-1]C+RC[-1] -> 62 | G10: 100 | H10: =R[-1]C+RC[-1] -> 10600 | L10: 446573 | M10: =INT(RC[-1]/100) -> 4465
B11: 8 | C11: 20 | D11: =R[-1]C+RC[-1] -> 7140 | E11: 2 | F11: =R[-1]C+RC[-1] -> 64 | G11: 100 | H11: =R[-1]C+RC[-1] -> 10700 | L11: 449633 | M11: =INT(RC[-1]/100) -> 4496
B12: 9 | C12: 20 | D12: =R[-1]C+RC[-1] -> 7160 | E12: 2 | F12: =R[-1]C+RC[-1] -> 66 | G12: 100 | H12: =R[-1]C+RC[-1] -> 10800 | L12: 452703 | M12: =INT(RC[-1]/100) -> 4527
B13: 10 | C13: 50 | D13: =R[-1]C+RC[-1] -> 7210 | E13: 2 | F13: =R[-1]C+RC[-1] -> 68 | G13: 100 | H13: =R[-1]C+RC[-1] -> 10900 | L13: 455807 | M13: =INT(RC[-1]/100) -> 4558
B14: 11 | C14: 50 | D14: =R[-1]C+RC[-1] -> 7260 | E14: 2 | F14: =R[-1]C+RC[-1] -> 70 | G14: 100 | H14: =R[-1]C+RC[-1] -> 11000 | L14: 468503 | M14: =INT(RC[-1]/100) -> 4685
B15: 12 | C15: 50 | D15: =R[-1]C+RC[-1] -> 7310 | E15: 2 | F15: =R[-1]C+RC[-1] -> 72 | G15: 100 | H15: =R[-1]C+RC[-1] -> 11100 | L15: 471606 | M15: =INT(RC[-1]/100) -> 4716
B16: 13 | C16: 50 | D16: =R[-1]C+RC[-1] -> 7360 | E16: 2 | F16: =R[-1]C+RC[-1] -> 74 | G16: 100 | H16: =R[-1]C+RC[-1] -> 11200 | L16: 474667 | M16: =INT(RC[-1]/100) -> 4746
B17: 14 | C17: 50 | D17: =R[-1]C+RC[-1] -> 7410 | E17: 5 | F17: =R[-1]C+RC[-1] -> 79 | G17: 100 | H17: =R[-1]C+RC[-1] -> 11300 | L17: 477731 | M17: =INT(RC[-1]/100) -> 4777
B18: 15 | C18: 50 | D18: =R[-1]C+RC[-1] -> 7460 | E18: 5 | F18: =R[-1]C+RC[-1] -> 84 | G18: 100 | H18: =R[-1]C+RC[-1] -> 11400 | L18: 480832 | M18: =INT(RC[-1]/100) -> 4808
B19: 16 | C19: 50 | D19: =R[-1]C+RC[-1] -> 7510 | E19: 5 | F19: =R[-1]C+RC[-1] -> 89 | G19: 100 | H19: =R[-1]C+RC[-1] -> 11500 | L19: 485418 | M19: =INT(RC[-1]/100) -> 4854
B20: 17 | C20: 100 | D20: =R[-1]C+RC[-1] -> 7610 | E20: 5 | F20: =R[-1]C+RC[-1] -> 94 | G20: 100 | H20: =R[-1]C+RC[-1] -> 11600 | L20: 488522 | M20: =INT(RC[-1]/100) -> 4885
B21: 18 | C21: 100 | D21: =R[-1]C+RC[-1] -> 7710 | E21: 5 | F21: =R[-1]C+RC[-1] -> 99 | G21: 100 | H21: =R[-1]C+RC[-1] -> 11700 | L21: 491583 | M21: =INT(RC[-1]/100) -> 4915
B22: 19 | C22: 100 | D22: =R[-1]C+RC[-1] -> 7810 | E22: 5 | F22: =R[-1]C+RC[-1] -> 104 | G22: 100 | H22: =R[-1]C+RC[-1] -> 11800 | L22: 494795 | M22: =INT(RC[-1]/100) -> 4947
B23: 20 | C23: 100 | D23: =R[-1]C+RC[-1] -> 7910 | E23: 5 | F23: =R[-1]C+RC[-1] -> 109 | G23: 100 | H23: =R[-1]C+RC[-1] -> 11900 | L23: 497900 | M23: =INT(RC[-1]/100) -> 4979
B24: 21 | C24: 100 | D24: =R[-1]C+RC[-1] -> 8010 | E24: 5 | F24: =R[-1]C+RC[-1] -> 114 | G24: 100 | H24: =R[-1]C+RC[-1] -> 12000 | L24: 511106 | M24: =INT(RC[-1]/100) -> 5111
B25: 22 | C25: 100 | D25: =R[-1]C+RC[-1] -> 8110 | E25: 5 | F25: =R[-1]C+RC[-1] -> 119 | G25: 100 | H25: =R[-1]C+RC[-1] -> 12100 | L25: 514201 | M25: =INT(RC[-1]/100) -> 5142
B26: 23 | C26: 100 | D26: =R[-1]C+RC[-1] -> 8210 | E26: 5 | F26: =R[-1]C+RC[-1] -> 124 | G26: 100 | H26: =R[-1]C+RC[-1] -> 12200 | L26: 517270 | M26: =INT(RC[-1]/100) -> 5172
B27: 24 | C27: 100 | D27: =R[-1]C+RC[-1] -> 8310 | E27: 5 | F27: =R[-1]C+RC[-1] -> 129 | G27: 100 | H27: =R[-1]C+RC[-1] -> 12300 | L27: 520324 | M27: =INT(RC[-1]/100) -> 5203
B28: 25 | C28: 100 | D28: =R[-1]C+RC[-1] -> 8410 | E28: 5 | F28: =R[-1]C+RC[-1] -> 134 | G28: 100 | H28: =R[-1]C+RC[-1] -> 12400 | L28: 523435 | M28: =INT(RC[-1]/100) -> 5234
B29: 26 | C29: 100 | D29: =R[-1]C+RC[-1] -> 8510 | E29: 5 | F29: =R[-1]C+RC[-1] -> 139 | G29: 100 | H29: =R[-1]C+RC[-1] -> 12500 | L29: 528083 | M29: =INT(RC[-1]/100) -> 5280
B30: 27 | C30: 100 | D30: =R[-1]C+RC[-1] -> 8610 | E30: 5 | F30: =R[-1]C+RC[-1] -> 144 | G30: 100 | H30: =R[-1]C+RC[-1] -> 12600 | L30: 531194 | M30: =INT(RC[-1]/100) -> 5311
B31: 28 | C31: 100 | D31: =R[-1]C+RC[-1] -> 8710 | E31: 5 | F31: =R[-1]C+RC[-1] -> 149 | G31: 100 | H31: =R[-1]C+RC[-1] -> 12700 | L31: 534254 | M31: =INT(RC[-1]/100) -> 5342
B32: 29 | C32: 100 | D32: =R[-1]C+RC[-1] -> 8810 | E32: 5 | F32: =R[-1]C+RC[-1] -> 154 | G32: 100 | H32: =R[-1]C+RC[-1] -> 12800 | L32: 537318 | M32: =INT(RC[-1]/100) -> 5373
B33: 30 | C33: 100 | D33: =R[-1]C+RC[-1] -> 8910 | E33: 5 | F33: =R[-1]C+RC[-1] -> 159 | G33: 100 | H33: =R[-1]C+RC[-1] -> 12900 | L33: 540419 | M33: =INT(RC[-1]/100) -> 5404
B34: 31 | C34: 100 | D34: =R[-1]C+RC[-1] -> 9010 | E34: 5 | F34: =R[-1]C+RC[-1] -> 164 | G34: 100 | H34: =R[-1]C+RC[-1] -> 13000 | L34: 559721 | M34: =INT(RC[-1]/100) -> 5597
B35: 32 | C35: 100 | D35: =R[-1]C+RC[-1] -> 9110 | E35: 5 | F35: =R[-1]C+RC[-1] -> 169 | G35: 100 | H35: =R[-1]C+RC[-1] -> 13100 | L35: 562826 | M35: =INT(RC[-1]/100) -> 5628
B36: 33 | C36: 200 | D36: =R[-1]C+RC[-1] -> 9310 | E36: 10 | F36: =R[-1]C+RC[-1] -> 179 | G36: 100 | H36: =R[-1]C+RC[-1] -> 13200 | L36: 565886 | M36: =INT(RC[-1]/100) -> 5658
B37: 34 | C37: 200 | D37: =R[-1]C+RC[-1] -> 9510 | E37: 10 | F37: =R[-1]C+RC[-1] -> 189 | G37: 100 | H37: =R[-1]C+RC[-1] -> 13300 | L37: 568950 | M37: =INT(RC[-1]/100) -> 5689
B38: 35 | C38: 200 | D38: =R[-1]C+RC[-1] -> 9710 | E38: 10 | F38: =R[-1]C+RC[-1] -> 199 | G38: 100 | H38: =R[-1]C+RC[-1] -> 13400 | L38: 572050 | M38: =INT(RC[-1]/100) -> 5720
B39: 36 | C39: 200 | D39: =R[-1]C+RC[-1] -> 9910 | E39: 10 | F39: =R[-1]C+RC[-1] -> 209 | G39: 100 | H39: =R[-1]C+RC[-1] -> 13500 | L39: 576949 | M39: =INT(RC[-1]/100) -> 5769
B40: 37 | C40: 200 | D40: =R[-1]C+RC[-1] -> 10110 | E40: 10 | F40: =R[-1]C+RC[-1] -> 219 | G40: 100 | H40: =R[-1]C+RC[-1] -> 13600 | L40: 580061 | M40: =INT(RC[-1]/100) -> 5800
B41: 38 | C41: 200 | D41: =R[-1]C+RC[-1] -> 10310 | E41: 10 | F41: =R[-1]C+RC[-1] -> 229 | G41: 100 | H41: =R[-1]C+RC[-1] -> 13700 | L41: 582978 | M41: =INT(RC[-1]/100) -> 5829
B42: 39 | C42: 200 | D42: =R[-1]C+RC[-1] -> 10510 | E42: 10 | F42: =R[-1]C+RC[-1] -> 239 | G42: 100 | H42: =R[-1]C+RC[-1] -> 13800 | L42: 586042 | M42: =INT(RC[-1]/100) -> 5860
B43: 40 | C43: 200 | D43: =R[-1]C+RC[-1] -> 10710 | E43: 10 | F43: =R[-1]C+RC[-1] -> 249 | G43: 100 | H43: =R[-1]C+RC[-1] -> 13900 | L43: 589142 | M43: =INT(RC[-1]/100) -> 5891
B44: 41 | C44: 200 | D44: =R[-1]C+RC[-1] -> 10910 | E44: 10 | F44: =R[-1]C+RC[-1] -> 259 | G44: 100 | H44: =R[-1]C+RC[-1] -> 14000 | L44: 604383 | M44: =INT(RC[-1]/100) -> 6043
B45: 42 | C45: 200 | D45: =R[-1]C+RC[-1] -> 11110 | E45: 10 | F45: =R[-1]C+RC[-1] -> 269 | G45: 100 | H45: =R[-1]C+RC[-1] -> 14100 | L45: 607477 | M45: =INT(RC[-1]/100) -> 6074
B46: 43 | C46: 200 | D46: =R[-1]C+RC[-1] -> 11310 | E46: 10 | F46: =R[-1]C+RC[-1] -> 279 | G46: 100 | H46: =R[-1]C+RC[-1] -> 14200 | L46: 610548 | M46: =INT(RC[-1]/100) -> 6105
B47: 44 | C47: 200 | D47: =R[-1]C+RC[-1] -> 11510 | E47: 10 | F47: =R[-1]C+RC[-1] -> 289 | G47: 100 | H47: =R[-1]C+RC[-1] -> 14300 | L47: 613465 | M47: =INT(RC[-1]/100) -> 6134
B48: 45 | C48: 500 | D48: =R[-1]C+RC[-1] -> 12010 | E48: 10 | F48: =R[-1]C+RC[-1] -> 299 | G48: 100 | H48: =R[-1]C+RC[-1] -> 14400 | L48: 616569 | M48: =INT(RC[-1]/100) -> 6165
B49: 46 | C49: 500 | D49: =R[-1]C+RC[-1] -> 12510 | E49: 10 | F49: =R[-1]C+RC[-1] -> 309 | G49: 100 | H49: =R[-1]C+RC[-1] -> 14500 | L49: 621727 | M49: =INT(RC[-1]/100) -> 6217
B50: 47 | C50: 500 | D50: =R[-1]C+RC[-1] -> 13010 | E50: 10 | F50: =R[-1]C+RC[-1] -> 319 | G50: 100 | H50: =R[-1]C+RC[-1] -> 14600 | L50: 624820 | M50: =INT(RC[-1]/100) -> 6248
B51: 48 | C51: 500 | D51: =R[-1]C+RC[-1] -> 13510 | E51: 20 | F51: =R[-1]C+RC[-1] -> 339 | G51: 100 | H51: =R[-1]C+RC[-1] -> 14700 | L51: 627891 | M51: =INT(RC[-1]/100) -> 6278
B52: 49 | C52: 500 | D52: =R[-1]C+RC[-1] -> 14010 | E52: 20 | F52: =R[-1]C+RC[-1] -> 359 | G52: 100 | H52: =R[-1]C+RC[-1] -> 14800 | L52: 630819 | M52: =INT(RC[-1]/100) -> 6308
B53: 50 | C53: 1000 | D53: =R[-1]C+RC[-1] -> 15010 | E53: 20 | F53: =R[-1]C+RC[-1] -> 379 | G53: 100 | H53: =R[-1]C+RC[-1] -> 14900 | L53: 633912 | M53: =INT(RC[-1]/100) -> 6339
B54: 51 | C54: 200 | D54: =INT(R[-50]C*1.3) -> 9100 | F54: =INT(R[-50]C*1.3) -> 65 | G54: 100 | H54: =INT(R[-50]C*1.5) -> 15000 | L54: 502702 | M54: =INT(RC[-1]/100) -> 5027
B55: 52 | C55: 200 | D55: =INT(R[-50]C*1.3) -> 9126 | F55: =INT(R[-50]C*1.3) -> 67 | G55: 100 | H55: =INT(R[-50]C*1.5) -> 15150 | L55: 505885 | M55: =INT(RC[-1]/100) -> 5058
B56: 53 | C56: 200 | D56: =INT(R[-50]C*1.3) -> 9152 | F56: =INT(R[-50]C*1.3) -> 70 | G56: 100 | H56: =INT(R[-50]C*1.5) -> 15300 | L56: 509028 | M56: =INT(RC[-1]/100) -> 5090
B57: 54 | C57: 200 | D57: =INT(R[-50]C*1.3) -> 9178 | F57: =INT(R[-50]C*1.3) -> 72 | G57: 100 | H57: =INT(R[-50]C*1.5) -> 15450 | L57: 512171 | M57: =INT(RC[-1]/100) -> 5121
B58: 55 | C58: 200 | D58: =INT(R[-50]C*1.3) -> 9204 | F58: =INT(R[-50]C*1.3) -> 75 | G58: 100 | H58: =INT(R[-50]C*1.5) -> 15600 | L58: 515354 | M58: =INT(RC[-1]/100) -> 5153
B59: 56 | C59: 200 | D59: =INT(R[-50]C*1.3) -> 9230 | F59: =INT(R[-50]C*1.3) -> 78 | G59: 100 | H59: =INT(R[-50]C*1.5) -> 15750 | L59: 520485 | M59: =INT(RC[-1]/100) -> 5204
B60: 57 | C60: 200 | D60: =INT(R[-50]C*1.3) -> 9256 | F60: =INT(R[-50]C*1.3) -> 80 | G60: 100 | H60: =INT(R[-50]C*1.5) -> 15900 | L60: 523668 | M60: =INT(RC[-1]/100) -> 5236
B61: 58 | C61: 200 | D61: =INT(R[-50]C*1.3) -> 9282 | F61: =INT(R[-50]C*1.3) -> 83 | G61: 100 | H61: =INT(R[-50]C*1.5) -> 16050 | L61: 526811 | M61: =INT(RC[-1]/100) -> 5268
B62: 59 | C62: 200 | D62: =INT(R[-50]C*1.3) -> 9308 | F62: =INT(R[-50]C*1.3) -> 85 | G62: 100 | H62: =INT(R[-50]C*1.5) -> 16200 | L62: 530096 | M62: =INT(RC[-1]/100) -> 5300
B63: 60 | C63: 200 | D63: =INT(R[-50]C*1.3) -> 9373 | F63: =INT(R[-50]C*1.3) -> 88 | G63: 100 | H63: =INT(R[-50]C*1.5) -> 16350 | L63: 533279 | M63: =INT(RC[-1]/100) -> 5332
B64: 61 | C64: 200 | D64: =INT(R[-50]C*1.3) -> 9438 | F64: =INT(R[-50]C*1.3) -> 91 | G64: 100 | H64: =INT(R[-50]C*1.5) -> 16500 | L64: 549511 | M64: =INT(RC[-1]/100) -> 5495
B65: 62 | C65: 200 | D65: =INT(R[-50]C*1.3) -> 9503 | F65: =INT(R[-50]C*1.3) -> 93 | G65: 100 | H65: =INT(R[-50]C*1.5) -> 16650 | L65: 552695 | M65: =INT(RC[-1]/100) -> 5526
B66: 63 | C66: 200 | D66: =INT(R[-50]C*1.3) -> 9568 | F66: =INT(R[-50]C*1.3) -> 96 | G66: 100 | H66: =INT(R[-50]C*1.5) -> 16800 | L66: 555837 | M66: =INT(RC[-1]/100) -> 5558
B67: 64 | C67: 200 | D67: =INT(R[-50]C*1.3) -> 9633 | F67: =INT(R[-50]C*1.3) -> 102 | G67: 100 | H67: =INT(R[-50]C*1.5) -> 16950 | L67: 558980 | M67: =INT(RC[-1]/100) -> 5589
B68: 65 | C68: 200 | D68: =INT(R[-50]C*1.3) -> 9698 | F68: =INT(R[-50]C*1.3) -> 109 | G68: 100 | H68: =INT(R[-50]C*1.5) -> 17100 | L68: 562163 | M68: =INT(RC[-1]/100) -> 5621
B69: 66 | C69: 200 | D69: =INT(R[-50]C*1.3) -> 9763 | F69: =INT(R[-50]C*1.3) -> 115 | G69: 100 | H69: =INT(R[-50]C*1.5) -> 17250 | L69: 567318 | M69: =INT(RC[-1]/100) -> 5673
B70: 67 | C70: 200 | D70: =INT(R[-50]C*1.3) -> 9893 | F70: =INT(R[-50]C*1.3) -> 122 | G70: 100 | H70: =INT(R[-50]C*1.5) -> 17400 | L70: 570501 | M70: =INT(RC[-1]/100) -> 5705
B71: 68 | C71: 200 | D71: =INT(R[-50]C*1.3) -> 10023 | F71: =INT(R[-50]C*1.3) -> 128 | G71: 100 | H71: =INT(R[-50]C*1.5) -> 17550 | L71: 573644 | M71: =INT(RC[-1]/100) -> 5736
B72: 69 | C72: 200 | D72: =INT(R[-50]C*1.3) -> 10153 | F72: =INT(R[-50]C*1.3) -> 135 | G72: 100 | H72: =INT(R[-50]C*1.5) -> 17700 | L72: 576787 | M72: =INT(RC[-1]/100) -> 5767
B73: 70 | C73: 200 | D73: =INT(R[-50]C*1.3) -> 10283 | F73: =INT(R[-50]C*1.3) -> 141 | G73: 100 | H73: =INT(R[-50]C*1.5) -> 17850 | L73: 579969 | M73: =INT(RC[-1]/100) -> 5799
B74: 71 | C74: 200 | D74: =INT(R[-50]C*1.3) -> 10413 | F74: =INT(R[-50]C*1.3) -> 148 | G74: 100 | H74: =INT(R[-50]C*1.5) -> 18000 | L74: 603520 | M74: =INT(RC[-1]/100) -> 6035
B75: 72 | C75: 200 | D75: =INT(R[-50]C*1.3) -> 10543 | F75: =INT(R[-50]C*1.3) -> 154 | G75: 100 | H75: =INT(R[-50]C*1.5) -> 18150 | L75: 606703 | M75: =INT(RC[-1]/100) -> 6067
B76: 73 | C76: 200 | D76: =INT(R[-50]C*1.3) -> 10673 | F76: =INT(R[-50]C*1.3) -> 161 | G76: 100 | H76: =INT(R[-50]C*1.5) -> 18300 | L76: 609846 | M76: =INT(RC[-1]/100) -> 6098
B77: 74 | C77: 200 | D77: =INT(R[-50]C*1.3) -> 10803 | F77: =INT(R[-50]C*1.3) -> 167 | G77: 100 | H77: =INT(R[-50]C*1.5) -> 18450 | L77: 612989 | M77: =INT(RC[-1]/100) -> 6129
B78: 75 | C78: 200 | D78: =INT(R[-50]C*1.3) -> 10933 | F78: =INT(R[-50]C*1.3) -> 174 | G78: 100 | H78: =INT(R[-50]C*1.5) -> 18600 | L78: 616171 | M78: =INT(RC[-1]/100) -> 6161
B79: 76 | C79: 200 | D79: =INT(R[-50]C*1.3) -> 11063 | F79: =INT(R[-50]C*1.3) -> 180 | G79: 100 | H79: =INT(R[-50]C*1.5) -> 18750 | L79: 621574 | M79: =INT(RC[-1]/100) -> 6215
B80: 77 | C80: 200 | D80: =INT(R[-50]C*1.3) -> 11193 | F80: =INT(R[-50]C*1.3) -> 187 | G80: 100 | H80: =INT(R[-50]C*1.5) -> 18900 | L80: 624758 | M80: =INT(RC[-1]/100) -> 6247
B81: 78 | C81: 200 | D81: =INT(R[-50]C*1.3) -> 11323 | F81: =INT(R[-50]C*1.3) -> 193 | G81: 100 | H81: =INT(R[-50]C*1.5) -> 19050 | L81: 627758 | M81: =INT(RC[-1]/100) -> 6277
B82: 79 | C82: 200 | D82: =INT(R[-50]C*1.3) -> 11453 | F82: =INT(R[-50]C*1.3) -> 200 | G82: 100 | H82: =INT(R[-50]C*1.5) -> 19200 | L82: 630900 | M82: =INT(RC[-1]/100) -> 6309
B83: 80 | C83: 200 | D83: =INT(R[-50]C*1.3) -> 11583 | F83: =INT(R[-50]C*1.3) -> 206 | G83: 100 | H83: =INT(R[-50]C*1.5) -> 19350 | L83: 634083 | M83: =INT(RC[-1]/100) -> 6340
B84: 81 | C84: 200 | D84: =INT(R[-50]C*1.3) -> 11713 | F84: =INT(R[-50]C*1.3) -> 213 | G84: 100 | H84: =INT(R[-50]C*1.5) -> 19500 | L84: 652879 | M84: =INT(RC[-1]/100) -> 6528
B85: 82 | C85: 200 | D85: =INT(R[-50]C*1.3) -> 11843 | F85: =INT(R[-50]C*1.3) -> 219 | G85: 100 | H85: =INT(R[-50]C*1.5) -> 19650 | L85: 656062 | M85: =INT(RC[-1]/100) -> 6560
B86: 83 | C86: 200 | D86: =INT(R[-50]C*1.3) -> 12103 | F86: =INT(R[-50]C*1.3) -> 232 | G86: 100 | H86: =INT(R[-50]C*1.5) -> 19800 | L86: 659205 | M86: =INT(RC[-1]/100) -> 6592
B87: 84 | C87: 200 | D87: =INT(R[-50]C*1.3) -> 12363 | F87: =INT(R[-50]C*1.3) -> 245 | G87: 100 | H87: =INT(R[-50]C*1.5) -> 19950 | L87: 662205 | M87: =INT(RC[-1]/100) -> 6622
B88: 85 | C88: 200 | D88: =INT(R[-50]C*1.3) -> 12623 | F88: =INT(R[-50]C*1.3) -> 258 | G88: 100 | H88: =INT(R[-50]C*1.5) -> 20100 | L88: 665388 | M88: =INT(RC[-1]/100) -> 6653
B89: 86 | C89: 200 | D89: =INT(R[-50]C*1.3) -> 12883 | F89: =INT(R[-50]C*1.3) -> 271 | G89: 100 | H89: =INT(R[-50]C*1.5) -> 20250 | L89: 671005 | M89: =INT(RC[-1]/100) -> 6710
B90: 87 | C90: 200 | D90: =INT(R[-50]C*1.3) -> 13143 | F90: =INT(R[-50]C*1.3) -> 284 | G90: 100 | H90: =INT(R[-50]C*1.5) -> 20400 | L90: 674188 | M90: =INT(RC[-1]/100) -> 6741
B91: 88 | C91: 200 | D91: =INT(R[-50]C*1.3) -> 13403 | F91: =INT(R[-50]C*1.3) -> 297 | G91: 100 | H91: =INT(R[-50]C*1.5) -> 20550 | L91: 677330 | M91: =INT(RC[-1]/100) -> 6773
B92: 89 | C92: 200 | D92: =INT(R[-50]C*1.3) -> 13663 | F92: =INT(R[-50]C*1.3) -> 310 | G92: 100 | H92: =INT(R[-50]C*1.5) -> 20700 | L92: 680330 | M92: =INT(RC[-1]/100) -> 6803
B93: 90 | C93: 200 | D93: =INT(R[-50]C*1.3) -> 13923 | F93: =INT(R[-50]C*1.3) -> 323 | G93: 100 | H93: =INT(R[-50]C*1.5) -> 20850 | L93: 683513 | M93: =INT(RC[-1]/100) -> 6835
B94: 91 | C94: 200 | D94: =INT(R[-50]C*1.3) -> 14183 | F94: =INT(R[-50]C*1.3) -> 336 | G94: 100 | H94: =INT(R[-50]C*1.5) -> 21000 | L94: 712023 | M94: =INT(RC[-1]/100) -> 7120
B95: 92 | C95: 200 | D95: =INT(R[-50]C*1.3) -> 14443 | F95: =INT(R[-50]C*1.3) -> 349 | G95: 100 | H95: =INT(R[-50]C*1.5) -> 21150 | L95: 715206 | M95: =INT(RC[-1]/100) -> 7152
B96: 93 | C96: 200 | D96: =INT(R[-50]C*1.3) -> 14703 | F96: =INT(R[-50]C*1.3) -> 362 | G96: 100 | H96: =INT(R[-50]C*1.5) -> 21300 | L96: 718206 | M96: =INT(RC[-1]/100) -> 7182
B97: 94 | C97: 200 | D97: =INT(R[-50]C*1.3) -> 14963 | F97: =INT(R[-50]C*1.3) -> 375 | G97: 100 | H97: =INT(R[-50]C*1.5) -> 21450 | L97: 721349 | M97: =INT(RC[-1]/100) -> 7213
B98: 95 | C98: 200 | D98: =INT(R[-50]C*1.3) -> 15613 | F98: =INT(R[-50]C*1.3) -> 388 | G98: 100 | H98: =INT(R[-50]C*1.5) -> 21600 | L98: 724532 | M98: =INT(RC[-1]/100) -> 7245
B99: 96 | C99: 200 | D99: =INT(R[-50]C*1.3) -> 16263 | F99: =INT(R[-50]C*1.3) -> 401 | G99: 100 | H99: =INT(R[-50]C*1.5) -> 21750 | L99: 730179 | M99: =INT(RC[-1]/100) -> 7301
B100: 97 | C100: 200 | D100: =INT(R[-50]C*1.3) -> 16913 | F100: =INT(R[-50]C*1.3) -> 414 | G100: 100 | H100: =INT(R[-50]C*1.5) -> 21900 | L100: 733363 | M100: =INT(RC[-1]/100) -> 7333
B101: 98 | C101: 200 | D101: =INT(R[-50]C*1.3) -> 17563 | F101: =INT(R[-50]C*1.3) -> 440 | G101: 100 | H101: =INT(R[-50]C*1.5) -> 22050 | L101: 736505 | M101: =INT(RC[-1]/100) -> 7365
B102: 99 | C102: 200 | D102: =INT(R[-50]C*1.3) -> 18213 | F102: =INT(R[-50]C*1.3) -> 466 | G102: 100 | H102: =INT(R[-50]C*1.5) -> 22200 | L102: 739648 | M102: =INT(RC[-1]/100) -> 7396
B103: 100 | C103: 200 | D103: =INT(R[-50]C*1.3) -> 19513 | F103: =INT(R[-50]C*1.3) -> 492 | G103: 100 | H103: =INT(R[-50]C*1.5) -> 22350 | L103: 742688 | M103: =INT(RC[-1]/100) -> 7426
B104: 101 | C104: 200 | D104: =INT(R[-50]C*1.3) -> 11830 | F104: =INT(R[-50]C*1.3) -> 84 | G104: 100 | H104: =INT(R[-50]C*1.8) -> 27000 | L104: 800676 | M104: =INT(RC[-1]/100) -> 8006
B105: 102 | C105: 200 | D105: =INT(R[-50]C*1.3) -> 11863 | F105: =INT(R[-50]C*1.3) -> 87 | G105: 100 | H105: =INT(R[-50]C*1.8) -> 27270 | L105: 803914 | M105: =INT(RC[-1]/100) -> 8039
B106: 103 | C106: 200 | D106: =INT(R[-50]C*1.3) -> 11897 | F106: =INT(R[-50]C*1.3) -> 91 | G106: 100 | H106: =INT(R[-50]C*1.8) -> 27540 | L106: 806969 | M106: =INT(RC[-1]/100) -> 8069
B107: 104 | C107: 200 | D107: =INT(R[-50]C*1.3) -> 11931 | F107: =INT(R[-50]C*1.3) -> 93 | G107: 100 | H107: =INT(R[-50]C*1.8) -> 27810 | L107: 810166 | M107: =INT(RC[-1]/100) -> 8101
B108: 105 | C108: 200 | D108: =INT(R[-50]C*1.3) -> 11965 | F108: =INT(R[-50]C*1.3) -> 97 | G108: 100 | H108: =INT(R[-50]C*1.8) -> 28080 | L108: 813405 | M108: =INT(RC[-1]/100) -> 8134
B109: 106 | C109: 200 | D109: =INT(R[-50]C*1.3) -> 11999 | F109: =INT(R[-50]C*1.3) -> 101 | G109: 100 | H109: =INT(R[-50]C*1.8) -> 28350 | L109: 819590 | M109: =INT(RC[-1]/100) -> 8195
B110: 107 | C110: 200 | D110: =INT(R[-50]C*1.3) -> 12032 | F110: =INT(R[-50]C*1.3) -> 104 | G110: 100 | H110: =INT(R[-50]C*1.8) -> 28620 | L110: 822828 | M110: =INT(RC[-1]/100) -> 8228
B111: 108 | C111: 200 | D111: =INT(R[-50]C*1.3) -> 12066 | F111: =INT(R[-50]C*1.3) -> 107 | G111: 100 | H111: =INT(R[-50]C*1.8) -> 28890 | L111: 826026 | M111: =INT(RC[-1]/100) -> 8260
B112: 109 | C112: 200 | D112: =INT(R[-50]C*1.3) -> 12100 | F112: =INT(R[-50]C*1.3) -> 110 | G112: 100 | H112: =INT(R[-50]C*1.8) -> 29160 | L112: 829223 | M112: =INT(RC[-1]/100) -> 8292
B113: 110 | C113: 200 | D113: =INT(R[-50]C*1.3) -> 12184 | F113: =INT(R[-50]C*1.3) -> 114 | G113: 100 | H113: =INT(R[-50]C*1.8) -> 29430 | L113: 832319 | M113: =INT(RC[-1]/100) -> 8323
B114: 111 | C114: 200 | D114: =INT(R[-50]C*1.3) -> 12269 | F114: =INT(R[-50]C*1.3) -> 118 | G114: 100 | H114: =INT(R[-50]C*1.8) -> 29700 | L114: 856590 | M114: =INT(RC[-1]/100) -> 8565
B115: 112 | C115: 200 | D115: =INT(R[-50]C*1.3) -> 12353 | F115: =INT(R[-50]C*1.3) -> 120 | G115: 100 | H115: =INT(R[-50]C*1.8) -> 29970 | L115: 859829 | M115: =INT(RC[-1]/100) -> 8598
B116: 113 | C116: 200 | D116: =INT(R[-50]C*1.3) -> 12438 | F116: =INT(R[-50]C*1.3) -> 124 | G116: 100 | H116: =INT(R[-50]C*1.8) -> 30240 | L116: 862884 | M116: =INT(RC[-1]/100) -> 8628
B117: 114 | C117: 200 | D117: =INT(R[-50]C*1.3) -> 12522 | F117: =INT(R[-50]C*1.3) -> 132 | G117: 100 | H117: =INT(R[-50]C*1.8) -> 30510 | L117: 866081 | M117: =INT(RC[-1]/100) -> 8660
B118: 115 | C118: 200 | D118: =INT(R[-50]C*1.3) -> 12607 | F118: =INT(R[-50]C*1.3) -> 141 | G118: 100 | H118: =INT(R[-50]C*1.8) -> 30780 | L118: 869177 | M118: =INT(RC[-1]/100) -> 8691
B119: 116 | C119: 200 | D119: =INT(R[-50]C*1.3) -> 12691 | F119: =INT(R[-50]C*1.3) -> 149 | G119: 100 | H119: =INT(R[-50]C*1.8) -> 31050 | L119: 875678 | M119: =INT(RC[-1]/100) -> 8756
B120: 117 | C120: 200 | D120: =INT(R[-50]C*1.3) -> 12860 | F120: =INT(R[-50]C*1.3) -> 158 | G120: 100 | H120: =INT(R[-50]C*1.8) -> 31320 | L120: 878917 | M120: =INT(RC[-1]/100) -> 8789
B121: 118 | C121: 200 | D121: =INT(R[-50]C*1.3) -> 13029 | F121: =INT(R[-50]C*1.3) -> 166 | G121: 100 | H121: =INT(R[-50]C*1.8) -> 31590 | L121: 881971 | M121: =INT(RC[-1]/100) -> 8819
B122: 119 | C122: 200 | D122: =INT(R[-50]C*1.3) -> 13198 | F122: =INT(R[-50]C*1.3) -> 175 | G122: 100 | H122: =INT(R[-50]C*1.8) -> 31860 | L122: 885168 | M122: =INT(RC[-1]/100) -> 8851
B123: 120 | C123: 200 | D123: =INT(R[-50]C*1.3) -> 13367 | F123: =INT(R[-50]C*1.3) -> 183 | G123: 100 | H123: =INT(R[-50]C*1.8) -> 32130 | L123: 888264 | M123: =INT(RC[-1]/100) -> 8882
B124: 121 | C124: 200 | D124: =INT(R[-50]C*1.3) -> 13536 | F124: =INT(R[-50]C*1.3) -> 192 | G124: 100 | H124: =INT(R[-50]C*1.8) -> 32400 | L124: 911857 | M124: =INT(RC[-1]/100) -> 9118
B125: 122 | C125: 200 | D125: =INT(R[-50]C*1.3) -> 13705 | F125: =INT(R[-50]C*1.3) -> 200 | G125: 100 | H125: =INT(R[-50]C*1.8) -> 32670 | L125: 915095 | M125: =INT(RC[-1]/100) -> 9150
B126: 123 | C126: 200 | D126: =INT(R[-50]C*1.3) -> 13874 | F126: =INT(R[-50]C*1.3) -> 209 | G126: 100 | H126: =INT(R[-50]C*1.8) -> 32940 | L126: 918150 | M126: =INT(RC[-1]/100) -> 9181
B127: 124 | C127: 200 | D127: =INT(R[-50]C*1.3) -> 14043 | F127: =INT(R[-50]C*1.3) -> 217 | G127: 100 | H127: =INT(R[-50]C*1.8) -> 33210 | L127: 921347 | M127: =INT(RC[-1]/100) -> 9213
B128: 125 | C128: 200 | D128: =INT(R[-50]C*1.3) -> 14212 | F128: =INT(R[-50]C*1.3) -> 226 | G128: 100 | H128: =INT(R[-50]C*1.8) -> 33480 | L128: 924443 | M128: =INT(RC[-1]/100) -> 9244
B129: 126 | C129: 200 | D129: =INT(R[-50]C*1.3) -> 14381 | F129: =INT(R[-50]C*1.3) -> 234 | G129: 100 | H129: =INT(R[-50]C*1.8) -> 33750 | L129: 929486 | M129: =INT(RC[-1]/100) -> 9294
B130: 127 | C130: 200 | D130: =INT(R[-50]C*1.3) -> 14550 | F130: =INT(R[-50]C*1.3) -> 243 | G130: 100 | H130: =INT(R[-50]C*1.8) -> 34020 | L130: 932582 | M130: =INT(RC[-1]/100) -> 9325
B131: 128 | C131: 200 | D131: =INT(R[-50]C*1.3) -> 14719 | F131: =INT(R[-50]C*1.3) -> 250 | G131: 100 | H131: =INT(R[-50]C*1.8) -> 34290 | L131: 935779 | M131: =INT(RC[-1]/100) -> 9357
B132: 129 | C132: 200 | D132: =INT(R[-50]C*1.3) -> 14888 | F132: =INT(R[-50]C*1.3) -> 260 | G132: 100 | H132: =INT(R[-50]C*1.8) -> 34560 | L132: 938834 | M132: =INT(RC[-1]/100) -> 9388
B133: 130 | C133: 200 | D133: =INT(R[-50]C*1.3) -> 15057 | F133: =INT(R[-50]C*1.3) -> 267 | G133: 100 | H133: =INT(R[-50]C*1.8) -> 34830 | L133: 942072 | M133: =INT(RC[-1]/100) -> 9420
B134: 131 | C134: 200 | D134: =INT(R[-50]C*1.3) -> 15226 | F134: =INT(R[-50]C*1.3) -> 276 | G134: 100 | H134: =INT(R[-50]C*1.8) -> 35100 | L134: 966145 | M134: =INT(RC[-1]/100) -> 9661
B135: 132 | C135: 200 | D135: =INT(R[-50]C*1.3) -> 15395 | F135: =INT(R[-50]C*1.3) -> 284 | G135: 100 | H135: =INT(R[-50]C*1.8) -> 35370 | L135: 969383 | M135: =INT(RC[-1]/100) -> 9693
B136: 133 | C136: 200 | D136: =INT(R[-50]C*1.3) -> 15733 | F136: =INT(R[-50]C*1.3) -> 301 | G136: 100 | H136: =INT(R[-50]C*1.8) -> 35640 | L136: 972438 | M136: =INT(RC[-1]/100) -> 9724
B137: 134 | C137: 200 | D137: =INT(R[-50]C*1.3) -> 16071 | F137: =INT(R[-50]C*1.3) -> 318 | G137: 100 | H137: =INT(R[-50]C*1.8) -> 35910 | L137: 975635 | M137: =INT(RC[-1]/100) -> 9756
B138: 135 | C138: 200 | D138: =INT(R[-50]C*1.3) -> 16409 | F138: =INT(R[-50]C*1.3) -> 335 | G138: 100 | H138: =INT(R[-50]C*1.8) -> 36180 | L138: 978731 | M138: =INT(RC[-1]/100) -> 9787
B139: 136 | C139: 200 | D139: =INT(R[-50]C*1.3) -> 16747 | F139: =INT(R[-50]C*1.3) -> 352 | G139: 100 | H139: =INT(R[-50]C*1.8) -> 36450 | L139: 983866 | M139: =INT(RC[-1]/100) -> 9838
B140: 137 | C140: 200 | D140: =INT(R[-50]C*1.3) -> 17085 | F140: =INT(R[-50]C*1.3) -> 369 | G140: 100 | H140: =INT(R[-50]C*1.8) -> 36720 | L140: 987104 | M140: =INT(RC[-1]/100) -> 9871
B141: 138 | C141: 200 | D141: =INT(R[-50]C*1.3) -> 17423 | F141: =INT(R[-50]C*1.3) -> 386 | G141: 100 | H141: =INT(R[-50]C*1.8) -> 36990 | L141: 990159 | M141: =INT(RC[-1]/100) -> 9901
B142: 139 | C142: 200 | D142: =INT(R[-50]C*1.3) -> 17761 | F142: =INT(R[-50]C*1.3) -> 403 | G142: 100 | H142: =INT(R[-50]C*1.8) -> 37260 | L142: 993356 | M142: =INT(RC[-1]/100) -> 9933
B143: 140 | C143: 200 | D143: =INT(R[-50]C*1.3) -> 18099 | F143: =INT(R[-50]C*1.3) -> 419 | G143: 100 | H143: =INT(R[-50]C*1.8) -> 37530 | L143: 996452 | M143: =INT(RC[-1]/100) -> 9964
B144: 141 | C144: 200 | D144: =INT(R[-50]C*1.3) -> 18437 | F144: =INT(R[-50]C*1.3) -> 436 | G144: 100 | H144: =INT(R[-50]C*1.8) -> 37800 | L144: 1023912 | M144: =INT(RC[-1]/100) -> 10239
B145: 142 | C145: 200 | D145: =INT(R[-50]C*1.3) -> 18775 | F145: =INT(R[-50]C*1.3) -> 453 | G145: 100 | H145: =INT(R[-50]C*1.8) -> 38070 | L145: 1027007 | M145: =INT(RC[-1]/100) -> 10270
B146: 143 | C146: 200 | D146: =INT(R[-50]C*1.3) -> 19113 | F146: =INT(R[-50]C*1.3) -> 470 | G146: 100 | H146: =INT(R[-50]C*1.8) -> 38340 | L146: 1030062 | M146: =INT(RC[-1]/100) -> 10300
B147: 144 | C147: 200 | D147: =INT(R[-50]C*1.3) -> 19451 | F147: =INT(R[-50]C*1.3) -> 487 | G147: 100 | H147: =INT(R[-50]C*1.8) -> 38610 | L147: 1033259 | M147: =INT(RC[-1]/100) -> 10332
B148: 145 | C148: 200 | D148: =INT(R[-50]C*1.3) -> 20296 | F148: =INT(R[-50]C*1.3) -> 504 | G148: 100 | H148: =INT(R[-50]C*1.8) -> 38880 | L148: 1036354 | M148: =INT(RC[-1]/100) -> 10363
B149: 146 | C149: 200 | D149: =INT(R[-50]C*1.3) -> 21141 | F149: =INT(R[-50]C*1.3) -> 521 | G149: 100 | H149: =INT(R[-50]C*1.8) -> 39150 | L149: 1039409 | M149: =INT(RC[-1]/100) -> 10394
B150: 147 | C150: 200 | D150: =INT(R[-50]C*1.3) -> 21986 | F150: =INT(R[-50]C*1.3) -> 538 | G150: 100 | H150: =INT(R[-50]C*1.8) -> 39420 | L150: 1042648 | M150: =INT(RC[-1]/100) -> 10426
B151: 148 | C151: 200 | D151: =INT(R[-50]C*1.3) -> 22831 | F151: =INT(R[-50]C*1.3) -> 572 | G151: 100 | H151: =INT(R[-50]C*1.8) -> 39690 | L151: 1045702 | M151: =INT(RC[-1]/100) -> 10457
B152: 149 | C152: 200 | D152: =INT(R[-50]C*1.3) -> 23676 | F152: =INT(R[-50]C*1.3) -> 605 | G152: 100 | H152: =INT(R[-50]C*1.8) -> 39960 | L152: 1048756 | M152: =INT(RC[-1]/100) -> 10487
B153: 150 | C153: 200 | D153: =INT(R[-50]C*1.3) -> 25366 | F153: =INT(R[-50]C*1.3) -> 639 | G153: 100 | H153: =INT(R[-50]C*1.8) -> 40230 | L153: 1051995 | M153: =INT(RC[-1]/100) -> 10519

Sheet: Sheet3
J1: 关卡ID
C2: 3762 | D2: =RC[-1]*100 -> 376200 | G2: 7000 | H2: 50 | I2: 10000 | J2: 1 | K2: =RC[-4]*7 -> 49000 | L2: =RC[-4]*10 -> 500 | M2: =RC[-4]*10 -> 100000 | P2: 500 | Q2: =RC[-1]+1000 -> 1500
C3: 3795 | D3: =RC[-1]*100 -> 379500 | G3: 7020 | H3: 52 | I3: 10100 | J3: 2 | K3: =RC[-4]*7 -> 49140 | L3: =RC[-4]*10 -> 520 | M3: =RC[-4]*10 -> 101000 | P3: 520 | Q3: =RC[-1]+1000 -> 1520
C4: 3828 | D4: =RC[-1]*100 -> 382800 | G4: 7040 | H4: 54 | I4: 10200 | J4: 3 | K4: =RC[-4]*7 -> 49280 | L4: =RC[-4]*10 -> 540 | M4: =RC[-4]*10 -> 102000 | P4: 540 | Q4: =RC[-1]+1000 -> 1540
C5: 3861 | D5: =RC[-1]*100 -> 386100 | G5: 7060 | H5: 56 | I5: 10300 | J5: 4 | K5: =RC[-4]*7 -> 49420 | L5: =RC[-4]*10 -> 560 | M5: =RC[-4]*10 -> 103000 | P5: 560 | Q5: =RC[-1]+1000 -> 1560
C6: 3895 | D6: =RC[-1]*100 -> 389500 | G6: 7080 | H6: 58 | I6: 10400 | J6: 5 | K6: =RC[-4]*7*3 -> 148680 | L6: =RC[-4]*10*3 -> 1740 | M6: =RC[-4]*10*3 -> 312000 | P6: 1740 | Q6: =RC[-1]+1000 -> 2740
C7: 3938 | D7: =RC[-1]*100 -> 393800 | G7: 7100 | H7: 60 | I7: 10500 | J7: 6 | K7: =RC[-4]*7 -> 49700 | L7: =RC[-4]*10 -> 600 | M7: =RC[-4]*10 -> 105000 | P7: 600 | Q7: =RC[-1]+1000 -> 1600
C8: 3973 | D8: =RC[-1]*100 -> 397300 | G8: 7120 | H8: 62 | I8: 10600 | J8: 7 | K8: =RC[-4]*7 -> 49840 | L8: =RC[-4]*10 -> 620 | M8: =RC[-4]*10 -> 106000 | P8: 620 | Q8: =RC[-1]+1000 -> 1620
C9: 4006 | D9: =RC[-1]*100 -> 400600 | G9: 7140 | H9: 64 | I9: 10700 | J9: 8 | K9: =RC[-4]*7 -> 49980 | L9: =RC[-4]*10 -> 640 | M9: =RC[-4]*10 -> 107000 | P9: 640 | Q9: =RC[-1]+1000 -> 1640
C10: 4039 | D10: =RC[-1]*100 -> 403900 | G10: 7160 | H10: 66 | I10: 10800 | J10: 9 | K10: =RC[-4]*7 -> 50120 | L10: =RC[-4]*10 -> 660 | M10: =RC[-4]*10 -> 108000 | P10: 660 | Q10: =RC[-1]+1000 -> 1660
C11: 4072 | D11: =RC[-1]*100 -> 407200 | G11: 7210 | H11: 68 | I11: 10900 | J11: 10 | K11: =RC[-4]*7*3 -> 151410 | L11: =RC[-4]*10*3 -> 2040 | M11: =RC[-4]*10*3 -> 327000 | P11: 2040 | Q11: =RC[-1]+1000 -> 3040
C12: 4203 | D12: =RC[-1]*100 -> 420300 | G12: 7260 | H12: 70 | I12: 11000 | J12: 11 | K12: =RC[-4]*7 -> 50820 | L12: =RC[-4]*10 -> 700 | M12: =RC[-4]*10 -> 110000 | P12: 700 | Q12: =RC[-1]+1000 -> 1700
C13: 4237 | D13: =RC[-1]*100 -> 423700 | G13: 7310 | H13: 72 | I13: 11100 | J13: 12 | K13: =RC[-4]*7 -> 51170 | L13: =RC[-4]*10 -> 720 | M13: =RC[-4]*10 -> 111000 | P13: 720 | Q13: =RC[-1]+1000 -> 1720
C14: 4269 | D14: =RC[-1]*100 -> 426900 | G14: 7360 | H14: 74 | I14: 11200 | J14: 13 | K14: =RC[-4]*7 -> 51520 | L14: =RC[-4]*10 -> 740 | M14: =RC[-4]*10 -> 112000 | P14: 740 | Q14: =RC[-1]+1000 -> 1740
C15: 4303 | D15: =RC[-1]*100 -> 430300 | G15: 7410 | H15: 79 | I15: 11300 | J15: 14 | K15: =RC[-4]*7 -> 51870 | L15: =RC[-4]*10 -> 790 | M15: =RC[-4]*10 -> 113000 | P15: 790 | Q15: =RC[-1]+1000 -> 1790
C16: 4336 | D16: =RC[-1]*100 -> 433600 | G16: 7460 | H16: 84 | I16: 11400 | J16: 15 | K16: =RC[-4]*7*3 -> 156660 | L16: =RC[-4]*10*3 -> 2520 | M16: =RC[-4]*10*3 -> 342000 | P16: 2520 | Q16: =RC[-1]+1000 -> 3520
C17: 4381 | D17: =RC[-1]*100 -> 438100 | G17: 7510 | H17: 89 | I17: 11500 | J17: 16 | K17: =RC[-4]*7 -> 52570 | L17: =RC[-4]*10 -> 890 | M17: =RC[-4]*10 -> 115000 | P17: 890 | Q17: =RC[-1]+1000 -> 1890
C18: 4415 | D18: =RC[-1]*100 -> 441500 | G18: 7610 | H18: 94 | I18: 11600 | J18: 17 | K18: =RC[-4]*7 -> 53270 | L18: =RC[-4]*10 -> 940 | M18: =RC[-4]*10 -> 116000 | P18: 940 | Q18: =RC[-1]+1000 -> 1940
C19: 4447 | D19: =RC[-1]*100 -> 444700 | G19: 7710 | H19: 99 | I19: 11700 | J19: 18 | K19: =RC[-4]*7 -> 53970 | L19: =RC[-4]*10 -> 990 | M19: =RC[-4]*10 -> 117000 | P19: 990 | Q19: =RC[-1]+1000 -> 1990
C20: 4481 | D20: =RC[-1]*100 -> 448100 | G20: 7810 | H20: 104 | I20: 11800 | J20: 19 | K20: =RC[-4]*7 -> 54670 | L20: =RC[-4]*10 -> 1040 | M20: =RC[-4]*10 -> 118000 | P20: 1040 | Q20: =RC[-1]+1000 -> 2040
C21: 4515 | D21: =RC[-1]*100 -> 451500 | G21: 7910 | H21: 109 | I21: 11900 | J21: 20 | K21: =RC[-4]*7*3 -> 166110 | L21: =RC[-4]*10*3 -> 3270 | M21: =RC[-4]*10*3 -> 357000 | P21: 3270 | Q21: =RC[-1]+1000 -> 4270
C22: 4649 | D22: =RC[-1]*100 -> 464900 | G22: 8010 | H22: 114 | I22: 12000 | J22: 21 | K22: =RC[-4]*7 -> 56070 | L22: =RC[-4]*10 -> 1140 | M22: =RC[-4]*10 -> 120000 | P22: 1140 | Q22: =RC[-1]+1000 -> 2140
C23: 4683 | D23: =RC[-1]*100 -> 468300 | G23: 8110 | H23: 119 | I23: 12100 | J23: 22 | K23: =RC[-4]*7 -> 56770 | L23: =RC[-4]*10 -> 1190 | M23: =RC[-4]*10 -> 121000 | P23: 1190 | Q23: =RC[-1]+1000 -> 2190
C24: 4716 | D24: =RC[-1]*100 -> 471600 | G24: 8210 | H24: 124 | I24: 12200 | J24: 23 | K24: =RC[-4]*7 -> 57470 | L24: =RC[-4]*10 -> 1240 | M24: =RC[-4]*10 -> 122000 | P24: 1240 | Q24: =RC[-1]+1000 -> 2240
C25: 4749 | D25: =RC[-1]*100 -> 474900 | G25: 8310 | H25: 129 | I25: 12300 | J25: 24 | K25: =RC[-4]*7 -> 58170 | L25: =RC[-4]*10 -> 1290 | M25: =RC[-4]*10 -> 123000 | P25: 1290 | Q25: =RC[-1]+1000 -> 2290
C26: 4782 | D26: =RC[-1]*100 -> 478200 | G26: 8410 | H26: 134 | I26: 12400 | J26: 25 | K26: =RC[-4]*7*3 -> 176610 | L26: =RC[-4]*10*3 -> 4020 | M26: =RC[-4]*10*3 -> 372000 | P26: 4020 | Q26: =RC[-1]+1000 -> 5020
C27: 4827 | D27: =RC[-1]*100 -> 482700 | G27: 8510 | H27: 139 | I27: 12500 | J27: 26 | K27: =RC[-4]*7 -> 59570 | L27: =RC[-4]*10 -> 1390 | M27: =RC[-4]*10 -> 125000 | P27: 1390 | Q27: =RC[-1]+1000 -> 2390
C28: 4860 | D28: =RC[-1]*100 -> 486000 | G28: 8610 | H28: 144 | I28: 12600 | J28: 27 | K28: =RC[-4]*7 -> 60270 | L28: =RC[-4]*10 -> 1440 | M28: =RC[-4]*10 -> 126000 | P28: 1440 | Q28: =RC[-1]+1000 -> 2440
C29: 4893 | D29: =RC[-1]*100 -> 489300 | G29: 8710 | H29: 149 | I29: 12700 | J29: 28 | K29: =RC[-4]*7 -> 60970 | L29: =RC[-4]*10 -> 1490 | M29: =RC[-4]*10 -> 127000 | P29: 1490 | Q29: =RC[-1]+1000 -> 2490
C30: 4925 | D30: =RC[-1]*100 -> 492500 | G30: 8810 | H30: 154 | I30: 12800 | J30: 29 | K30: =RC[-4]*7 -> 61670 | L30: =RC[-4]*10 -> 1540 | M30: =RC[-4]*10 -> 128000 | P30: 1540 | Q30: =RC[-1]+1000 -> 2540
C31: 4959 | D31: =RC[-1]*100 -> 495900 | G31: 8910 | H31: 159 | I31: 12900 | J31: 30 | K31: =RC[-4]*7*3 -> 187110 | L31: =RC[-4]*10*3 -> 4770 | M31: =RC[-4]*10*3 -> 387000 | P31: 4770 | Q31: =RC[-1]+1000 -> 5770
C32: 5177 | D32: =RC[-1]*100 -> 517700 | G32: 9010 | H32: 164 | I32: 13000 | J32: 31 | K32: =RC[-4]*7 -> 63070 | L32: =RC[-4]*10 -> 1640 | M32: =RC[-4]*10 -> 130000 | P32: 1640 | Q32: =RC[-1]+1000 -> 2640
C33: 5211 | D33: =RC[-1]*100 -> 521100 | G33: 9110 | H33: 169 | I33: 13100 | J33: 32 | K33: =RC[-4]*7 -> 63770 | L33: =RC[-4]*10 -> 1690 | M33: =RC[-4]*10 -> 131000 | P33: 1690 | Q33: =RC[-1]+1000 -> 2690
C34: 5244 | D34: =RC[-1]*100 -> 524400 | G34: 9310 | H34: 179 | I34: 13200 | J34: 33 | K34: =RC[-4]*7 -> 65170 | L34: =RC[-4]*10 -> 1790 | M34: =RC[-4]*10 -> 132000 | P34: 1790 | Q34: =RC[-1]+1000 -> 2790
C35: 5277 | D35: =RC[-1]*100 -> 527700 | G35: 9510 | H35: 189 | I35: 13300 | J35: 34 | K35: =RC[-4]*7 -> 66570 | L35: =RC[-4]*10 -> 1890 | M35: =RC[-4]*10 -> 133000 | P35: 1890 | Q35: =RC[-1]+1000 -> 2890
C36: 5310 | D36: =RC[-1]*100 -> 531000 | G36: 9710 | H36: 199 | I36: 13400 | J36: 35 | K36: =RC[-4]*7*3 -> 203910 | L36: =RC[-4]*10*3 -> 5970 | M36: =RC[-4]*10*3 -> 402000 | P36: 5970 | Q36: =RC[-1]+1000 -> 6970
C37: 5357 | D37: =RC[-1]*100 -> 535700 | G37: 9910 | H37: 209 | I37: 13500 | J37: 36 | K37: =RC[-4]*7 -> 69370 | L37: =RC[-4]*10 -> 2090 | M37: =RC[-4]*10 -> 135000 | P37: 2090 | Q37: =RC[-1]+1000 -> 3090
C38: 5390 | D38: =RC[-1]*100 -> 539000 | G38: 10110 | H38: 219 | I38: 13600 | J38: 37 | K38: =RC[-4]*7 -> 70770 | L38: =RC[-4]*10 -> 2190 | M38: =RC[-4]*10 -> 136000 | P38: 2190 | Q38: =RC[-1]+1000 -> 3190
C39: 5422 | D39: =RC[-1]*100 -> 542200 | G39: 10310 | H39: 229 | I39: 13700 | J39: 38 | K39: =RC[-4]*7 -> 72170 | L39: =RC[-4]*10 -> 2290 | M39: =RC[-4]*10 -> 137000 | P39: 2290 | Q39: =RC[-1]+1000 -> 3290
C40: 5455 | D40: =RC[-1]*100 -> 545500 | G40: 10510 | H40: 239 | I40: 13800 | J40: 39 | K40: =RC[-4]*7 -> 73570 | L40: =RC[-4]*10 -> 2390 | M40: =RC[-4]*10 -> 138000 | P40: 2390 | Q40: =RC[-1]+1000 -> 3390
C41: 5488 | D41: =RC[-1]*100 -> 548800 | G41: 10710 | H41: 249 | I41: 13900 | J41: 40 | K41: =RC[-4]*7*3 -> 224910 | L41: =RC[-4]*10*3 -> 7470 | M41: =RC[-4]*10*3 -> 417000 | P41: 7470 | Q41: =RC[-1]+1000 -> 8470
C42: 5647 | D42: =RC[-1]*100 -> 564700 | G42: 10910 | H42: 259 | I42: 14000 | J42: 41 | K42: =RC[-4]*7 -> 76370 | L42: =RC[-4]*10 -> 2590 | M42: =RC[-4]*10 -> 140000 | P42: 2590 | Q42: =RC[-1]+1000 -> 3590
C43: 5681 | D43: =RC[-1]*100 -> 568100 | G43: 11110 | H43: 269 | I43: 14100 | J43: 42 | K43: =RC[-4]*7 -> 77770 | L43: =RC[-4]*10 -> 2690 | M43: =RC[-4]*10 -> 141000 | P43: 2690 | Q43: =RC[-1]+1000 -> 3690
C44: 5713 | D44: =RC[-1]*100 -> 571300 | G44: 11310 | H44: 279 | I44: 14200 | J44: 43 | K44: =RC[-4]*7 -> 79170 | L44: =RC[-4]*10 -> 2790 | M44: =RC[-4]*10 -> 142000 | P44: 2790 | Q44: =RC[-1]+1000 -> 3790
C45: 5745 | D45: =RC[-1]*100 -> 574500 | G45: 11510 | H45: 289 | I45: 14300 | J45: 44 | K45: =RC[-4]*7 -> 80570 | L45: =RC[-4]*10 -> 2890 | M45: =RC[-4]*10 -> 143000 | P45: 2890 | Q45: =RC[-1]+1000 -> 3890
C46: 5778 | D46: =RC[-1]*100 -> 577800 | G46: 12010 | H46: 299 | I46: 14400 | J46: 45 | K46: =RC[-4]*7*3 -> 252210 | L46: =RC[-4]*10*3 -> 8970 | M46: =RC[-4]*10*3 -> 432000 | P46: 8970 | Q46: =RC[-1]+1000 -> 9970
C47: 5827 | D47: =RC[-1]*100 -> 582700 | G47: 12510 | H47: 309 | I47: 14500 | J47: 46 | K47: =RC[-4]*7 -> 87570 | L47: =RC[-4]*10 -> 3090 | M47: =RC[-4]*10 -> 145000 | P47: 3090 | Q47: =RC[-1]+1000 -> 4090
C48: 5860 | D48: =RC[-1]*100 -> 586000 | G48: 13010 | H48: 319 | I48: 14600 | J48: 47 | K48: =RC[-4]*7 -> 91070 | L48: =RC[-4]*10 -> 3190 | M48: =RC[-4]*10 -> 146000 | P48: 3190 | Q48: =RC[-1]+1000 -> 4190
C49: 5893 | D49: =RC[-1]*100 -> 589300 | G49: 13510 | H49: 339 | I49: 14700 | J49: 48 | K49: =RC[-4]*7 -> 94570 | L49: =RC[-4]*10 -> 3390 | M49: =RC[-4]*10 -> 147000 | P49: 3390 | Q49: =RC[-1]+1000 -> 4390
C50: 5924 | D50: =RC[-1]*100 -> 592400 | G50: 14010 | H50: 359 | I50: 14800 | J50: 49 | K50: =RC[-4]*7 -> 98070 | L50: =RC[-4]*10 -> 3590 | M50: =RC[-4]*10 -> 148000 | P50: 3590 | Q50: =RC[-1]+1000 -> 4590
C51: 5958 | D51: =RC[-1]*100 -> 595800 | G51: 15010 | H51: 379 | I51: 14900 | J51: 50 | K51: =RC[-4]*7*3 -> 315210 | L51: =RC[-4]*10*3 -> 11370 | M51: =RC[-4]*10*3 -> 447000 | P51: 11370 | Q51: =RC[-1]+1000 -> 12370
C52: 4482 | D52: =RC[-1]*100 -> 448200 | G52: 9100 | H52: 65 | I52: 15000 | J52: 51 | K52: =RC[-4]*7 -> 63700 | L52: =RC[-4]*10 -> 650 | M52: =RC[-4]*10 -> 150000 | P52: 650 | Q52: =RC[-1]+1000 -> 1650
C53: 4519 | D53: =RC[-1]*100 -> 451900 | G53: 9126 | H53: 67 | I53: 15150 | J53: 52 | K53: =RC[-4]*7 -> 63882 | L53: =RC[-4]*10 -> 670 | M53: =RC[-4]*10 -> 151500 | P53: 670 | Q53: =RC[-1]+1000 -> 1670
C54: 4555 | D54: =RC[-1]*100 -> 455500 | G54: 9152 | H54: 70 | I54: 15300 | J54: 53 | K54: =RC[-4]*7 -> 64064 | L54: =RC[-4]*10 -> 700 | M54: =RC[-4]*10 -> 153000 | P54: 700 | Q54: =RC[-1]+1000 -> 1700
C55: 4591 | D55: =RC[-1]*100 -> 459100 | G55: 9178 | H55: 72 | I55: 15450 | J55: 54 | K55: =RC[-4]*7 -> 64246 | L55: =RC[-4]*10 -> 720 | M55: =RC[-4]*10 -> 154500 | P55: 720 | Q55: =RC[-1]+1000 -> 1720
C56: 4626 | D56: =RC[-1]*100 -> 462600 | G56: 9204 | H56: 75 | I56: 15600 | J56: 55 | K56: =RC[-4]*7*3 -> 193284 | L56: =RC[-4]*10*3 -> 2250 | M56: =RC[-4]*10*3 -> 468000 | P56: 2250 | Q56: =RC[-1]+1000 -> 3250
C57: 4678 | D57: =RC[-1]*100 -> 467800 | G57: 9230 | H57: 78 | I57: 15750 | J57: 56 | K57: =RC[-4]*7 -> 64610 | L57: =RC[-4]*10 -> 780 | M57: =RC[-4]*10 -> 157500 | P57: 780 | Q57: =RC[-1]+1000 -> 1780
C58: 4714 | D58: =RC[-1]*100 -> 471400 | G58: 9256 | H58: 80 | I58: 15900 | J58: 57 | K58: =RC[-4]*7 -> 64792 | L58: =RC[-4]*10 -> 800 | M58: =RC[-4]*10 -> 159000 | P58: 800 | Q58: =RC[-1]+1000 -> 1800
C59: 4750 | D59: =RC[-1]*100 -> 475000 | G59: 9282 | H59: 83 | I59: 16050 | J59: 58 | K59: =RC[-4]*7 -> 64974 | L59: =RC[-4]*10 -> 830 | M59: =RC[-4]*10 -> 160500 | P59: 830 | Q59: =RC[-1]+1000 -> 1830
C60: 4787 | D60: =RC[-1]*100 -> 478700 | G60: 9308 | H60: 85 | I60: 16200 | J60: 59 | K60: =RC[-4]*7 -> 65156 | L60: =RC[-4]*10 -> 850 | M60: =RC[-4]*10 -> 162000 | P60: 850 | Q60: =RC[-1]+1000 -> 1850
C61: 4824 | D61: =RC[-1]*100 -> 482400 | G61: 9373 | H61: 88 | I61: 16350 | J61: 60 | K61: =RC[-4]*7*3 -> 196833 | L61: =RC[-4]*10*3 -> 2640 | M61: =RC[-4]*10*3 -> 490500 | P61: 2640 | Q61: =RC[-1]+1000 -> 3640
C62: 4978 | D62: =RC[-1]*100 -> 497800 | G62: 9438 | H62: 91 | I62: 16500 | J62: 61 | K62: =RC[-4]*7 -> 66066 | L62: =RC[-4]*10 -> 910 | M62: =RC[-4]*10 -> 165000 | P62: 910 | Q62: =RC[-1]+1000 -> 1910
C63: 5014 | D63: =RC[-1]*100 -> 501400 | G63: 9503 | H63: 93 | I63: 16650 | J63: 62 | K63: =RC[-4]*7 -> 66521 | L63: =RC[-4]*10 -> 930 | M63: =RC[-4]*10 -> 166500 | P63: 930 | Q63: =RC[-1]+1000 -> 1930
C64: 5051 | D64: =RC[-1]*100 -> 505100 | G64: 9568 | H64: 96 | I64: 16800 | J64: 63 | K64: =RC[-4]*7 -> 66976 | L64: =RC[-4]*10 -> 960 | M64: =RC[-4]*10 -> 168000 | P64: 960 | Q64: =RC[-1]+1000 -> 1960
C65: 5086 | D65: =RC[-1]*100 -> 508600 | G65: 9633 | H65: 102 | I65: 16950 | J65: 64 | K65: =RC[-4]*7 -> 67431 | L65: =RC[-4]*10 -> 1020 | M65: =RC[-4]*10 -> 169500 | P65: 1020 | Q65: =RC[-1]+1000 -> 2020
C66: 5123 | D66: =RC[-1]*100 -> 512300 | G66: 9698 | H66: 109 | I66: 17100 | J66: 65 | K66: =RC[-4]*7*3 -> 203658 | L66: =RC[-4]*10*3 -> 3270 | M66: =RC[-4]*10*3 -> 513000 | P66: 3270 | Q66: =RC[-1]+1000 -> 4270
C67: 5174 | D67: =RC[-1]*100 -> 517400 | G67: 9763 | H67: 115 | I67: 17250 | J67: 66 | K67: =RC[-4]*7 -> 68341 | L67: =RC[-4]*10 -> 1150 | M67: =RC[-4]*10 -> 172500 | P67: 1150 | Q67: =RC[-1]+1000 -> 2150
C68: 5211 | D68: =RC[-1]*100 -> 521100 | G68: 9893 | H68: 122 | I68: 17400 | J68: 67 | K68: =RC[-4]*7 -> 69251 | L68: =RC[-4]*10 -> 1220 | M68: =RC[-4]*10 -> 174000 | P68: 1220 | Q68: =RC[-1]+1000 -> 2220
C69: 5247 | D69: =RC[-1]*100 -> 524700 | G69: 10023 | H69: 128 | I69: 17550 | J69: 68 | K69: =RC[-4]*7 -> 70161 | L69: =RC[-4]*10 -> 1280 | M69: =RC[-4]*10 -> 175500 | P69: 1280 | Q69: =RC[-1]+1000 -> 2280
C70: 5283 | D70: =RC[-1]*100 -> 528300 | G70: 10153 | H70: 135 | I70: 17700 | J70: 69 | K70: =RC[-4]*7 -> 71071 | L70: =RC[-4]*10 -> 1350 | M70: =RC[-4]*10 -> 177000 | P70: 1350 | Q70: =RC[-1]+1000 -> 2350
C71: 5319 | D71: =RC[-1]*100 -> 531900 | G71: 10283 | H71: 141 | I71: 17850 | J71: 70 | K71: =RC[-4]*7*3 -> 215943 | L71: =RC[-4]*10*3 -> 4230 | M71: =RC[-4]*10*3 -> 535500 | P71: 4230 | Q71: =RC[-1]+1000 -> 5230
C72: 5575 | D72: =RC[-1]*100 -> 557500 | G72: 10413 | H72: 148 | I72: 18000 | J72: 71 | K72: =RC[-4]*7 -> 72891 | L72: =RC[-4]*10 -> 1480 | M72: =RC[-4]*10 -> 180000 | P72: 1480 | Q72: =RC[-1]+1000 -> 2480
C73: 5612 | D73: =RC[-1]*100 -> 561200 | G73: 10543 | H73: 154 | I73: 18150 | J73: 72 | K73: =RC[-4]*7 -> 73801 | L73: =RC[-4]*10 -> 1540 | M73: =RC[-4]*10 -> 181500 | P73: 1540 | Q73: =RC[-1]+1000 -> 2540
C74: 5647 | D74: =RC[-1]*100 -> 564700 | G74: 10673 | H74: 161 | I74: 18300 | J74: 73 | K74: =RC[-4]*7 -> 74711 | L74: =RC[-4]*10 -> 1610 | M74: =RC[-4]*10 -> 183000 | P74: 1610 | Q74: =RC[-1]+1000 -> 2610
C75: 5683 | D75: =RC[-1]*100 -> 568300 | G75: 10803 | H75: 167 | I75: 18450 | J75: 74 | K75: =RC[-4]*7 -> 75621 | L75: =RC[-4]*10 -> 1670 | M75: =RC[-4]*10 -> 184500 | P75: 1670 | Q75: =RC[-1]+1000 -> 2670
C76: 5719 | D76: =RC[-1]*100 -> 571900 | G76: 10933 | H76: 174 | I76: 18600 | J76: 75 | K76: =RC[-4]*7*3 -> 229593 | L76: =RC[-4]*10*3 -> 5220 | M76: =RC[-4]*10*3 -> 558000 | P76: 5220 | Q76: =RC[-1]+1000 -> 6220
C77: 5774 | D77: =RC[-1]*100 -> 577400 | G77: 11063 | H77: 180 | I77: 18750 | J77: 76 | K77: =RC[-4]*7 -> 77441 | L77: =RC[-4]*10 -> 1800 | M77: =RC[-4]*10 -> 187500 | P77: 1800 | Q77: =RC[-1]+1000 -> 2800
C78: 5810 | D78: =RC[-1]*100 -> 581000 | G78: 11193 | H78: 187 | I78: 18900 | J78: 77 | K78: =RC[-4]*7 -> 78351 | L78: =RC[-4]*10 -> 1870 | M78: =RC[-4]*10 -> 189000 | P78: 1870 | Q78: =RC[-1]+1000 -> 2870
C79: 5844 | D79: =RC[-1]*100 -> 584400 | G79: 11323 | H79: 193 | I79: 19050 | J79: 78 | K79: =RC[-4]*7 -> 79261 | L79: =RC[-4]*10 -> 1930 | M79: =RC[-4]*10 -> 190500 | P79: 1930 | Q79: =RC[-1]+1000 -> 2930
C80: 5880 | D80: =RC[-1]*100 -> 588000 | G80: 11453 | H80: 200 | I80: 19200 | J80: 79 | K80: =RC[-4]*7 -> 80171 | L80: =RC[-4]*10 -> 2000 | M80: =RC[-4]*10 -> 192000 | P80: 2000 | Q80: =RC[-1]+1000 -> 3000
C81: 5916 | D81: =RC[-1]*100 -> 591600 | G81: 11583 | H81: 206 | I81: 19350 | J81: 80 | K81: =RC[-4]*7*3 -> 243243 | L81: =RC[-4]*10*3 -> 6180 | M81: =RC[-4]*10*3 -> 580500 | P81: 6180 | Q81: =RC[-1]+1000 -> 7180
C82: 6100 | D82: =RC[-1]*100 -> 610000 | G82: 11713 | H82: 213 | I82: 19500 | J82: 81 | K82: =RC[-4]*7 -> 81991 | L82: =RC[-4]*10 -> 2130 | M82: =RC[-4]*10 -> 195000 | P82: 2130 | Q82: =RC[-1]+1000 -> 3130
C83: 6136 | D83: =RC[-1]*100 -> 613600 | G83: 11843 | H83: 219 | I83: 19650 | J83: 82 | K83: =RC[-4]*7 -> 82901 | L83: =RC[-4]*10 -> 2190 | M83: =RC[-4]*10 -> 196500 | P83: 2190 | Q83: =RC[-1]+1000 -> 3190
C84: 6172 | D84: =RC[-1]*100 -> 617200 | G84: 12103 | H84: 232 | I84: 19800 | J84: 83 | K84: =RC[-4]*7 -> 84721 | L84: =RC[-4]*10 -> 2320 | M84: =RC[-4]*10 -> 198000 | P84: 2320 | Q84: =RC[-1]+1000 -> 3320
C85: 6207 | D85: =RC[-1]*100 -> 620700 | G85: 12363 | H85: 245 | I85: 19950 | J85: 84 | K85: =RC[-4]*7 -> 86541 | L85: =RC[-4]*10 -> 2450 | M85: =RC[-4]*10 -> 199500 | P85: 2450 | Q85: =RC[-1]+1000 -> 3450
C86: 6242 | D86: =RC[-1]*100 -> 624200 | G86: 12623 | H86: 258 | I86: 20100 | J86: 85 | K86: =RC[-4]*7*3 -> 265083 | L86: =RC[-4]*10*3 -> 7740 | M86: =RC[-4]*10*3 -> 603000 | P86: 7740 | Q86: =RC[-1]+1000 -> 8740
C87: 6299 | D87: =RC[-1]*100 -> 629900 | G87: 12883 | H87: 271 | I87: 20250 | J87: 86 | K87: =RC[-4]*7 -> 90181 | L87: =RC[-4]*10 -> 2710 | M87: =RC[-4]*10 -> 202500 | P87: 2710 | Q87: =RC[-1]+1000 -> 3710
C88: 6336 | D88: =RC[-1]*100 -> 633600 | G88: 13143 | H88: 284 | I88: 20400 | J88: 87 | K88: =RC[-4]*7 -> 92001 | L88: =RC[-4]*10 -> 2840 | M88: =RC[-4]*10 -> 204000 | P88: 2840 | Q88: =RC[-1]+1000 -> 3840
C89: 6371 | D89: =RC[-1]*100 -> 637100 | G89: 13403 | H89: 297 | I89: 20550 | J89: 88 | K89: =RC[-4]*7 -> 93821 | L89: =RC[-4]*10 -> 2970 | M89: =RC[-4]*10 -> 205500 | P89: 2970 | Q89: =RC[-1]+1000 -> 3970
C90: 6406 | D90: =RC[-1]*100 -> 640600 | G90: 13663 | H90: 310 | I90: 20700 | J90: 89 | K90: =RC[-4]*7 -> 95641 | L90: =RC[-4]*10 -> 3100 | M90: =RC[-4]*10 -> 207000 | P90: 3100 | Q90: =RC[-1]+1000 -> 4100
C91: 6442 | D91: =RC[-1]*100 -> 644200 | G91: 13923 | H91: 323 | I91: 20850 | J91: 90 | K91: =RC[-4]*7*3 -> 292383 | L91: =RC[-4]*10*3 -> 9690 | M91: =RC[-4]*10*3 -> 625500 | P91: 9690 | Q91: =RC[-1]+1000 -> 10690
C92: 6763 | D92: =RC[-1]*100 -> 676300 | G92: 14183 | H92: 336 | I92: 21000 | J92: 91 | K92: =RC[-4]*7 -> 99281 | L92: =RC[-4]*10 -> 3360 | M92: =RC[-4]*10 -> 210000 | P92: 3360 | Q92: =RC[-1]+1000 -> 4360
C93: 6800 | D93: =RC[-1]*100 -> 680000 | G93: 14443 | H93: 349 | I93: 21150 | J93: 92 | K93: =RC[-4]*7 -> 101101 | L93: =RC[-4]*10 -> 3490 | M93: =RC[-4]*10 -> 211500 | P93: 3490 | Q93: =RC[-1]+1000 -> 4490
C94: 6834 | D94: =RC[-1]*100 -> 683400 | G94: 14703 | H94: 362 | I94: 21300 | J94: 93 | K94: =RC[-4]*7 -> 102921 | L94: =RC[-4]*10 -> 3620 | M94: =RC[-4]*10 -> 213000 | P94: 3620 | Q94: =RC[-1]+1000 -> 4620
C95: 6869 | D95: =RC[-1]*100 -> 686900 | G95: 14963 | H95: 375 | I95: 21450 | J95: 94 | K95: =RC[-4]*7 -> 104741 | L95: =RC[-4]*10 -> 3750 | M95: =RC[-4]*10 -> 214500 | P95: 3750 | Q95: =RC[-1]+1000 -> 4750
C96: 6906 | D96: =RC[-1]*100 -> 690600 | G96: 15613 | H96: 388 | I96: 21600 | J96: 95 | K96: =RC[-4]*7*3 -> 327873 | L96: =RC[-4]*10*3 -> 11640 | M96: =RC[-4]*10*3 -> 648000 | P96: 11640 | Q96: =RC[-1]+1000 -> 12640
C97: 6962 | D97: =RC[-1]*100 -> 696200 | G97: 16263 | H97: 401 | I97: 21750 | J97: 96 | K97: =RC[-4]*7 -> 113841 | L97: =RC[-4]*10 -> 4010 | M97: =RC[-4]*10 -> 217500 | P97: 4010 | Q97: =RC[-1]+1000 -> 5010
C98: 6998 | D98: =RC[-1]*100 -> 699800 | G98: 16913 | H98: 414 | I98: 21900 | J98: 97 | K98: =RC[-4]*7 -> 118391 | L98: =RC[-4]*10 -> 4140 | M98: =RC[-4]*10 -> 219000 | P98: 4140 | Q98: =RC[-1]+1000 -> 5140
C99: 7034 | D99: =RC[-1]*100 -> 703400 | G99: 17563 | H99: 440 | I99: 22050 | J99: 98 | K99: =RC[-4]*7 -> 122941 | L99: =RC[-4]*10 -> 4400 | M99: =RC[-4]*10 -> 220500 | P99: 4400 | Q99: =RC[-1]+1000 -> 5400
C100: 7069 | D100: =RC[-1]*100 -> 706900 | G100: 18213 | H100: 466 | I100: 22200 | J100: 99 | K100: =RC[-4]*7 -> 127491 | L100: =RC[-4]*10 -> 4660 | M100: =RC[-4]*10 -> 222000 | P100: 4660 | Q100: =RC[-1]+1000 -> 5660
C101: 7104 | D101: =RC[-1]*100 -> 710400 | G101: 19513 | H101: 492 | I101: 22350 | J101: 100 | K101: =RC[-4]*7*3 -> 409773 | L101: =RC[-4]*10*3 -> 14760 | M101: =RC[-4]*10*3 -> 670500 | P101: 14760 | Q101: =RC[-1]+1000 -> 15760
C102: 8738 | D102: =RC[-1]*100 -> 873800 | G102: 11830 | H102: 84 | I102: 27000 | J102: 101 | K102: =RC[-4]*7 -> 82810 | L102: =RC[-4]*10 -> 840 | M102: =RC[-4]*10 -> 270000 | P102: 840 | Q102: =RC[-1]+1000 -> 1840
C103: 8777 | D103: =RC[-1]*100 -> 877700 | G103: 11863 | H103: 87 | I103: 27270 | J103: 102 | K103: =RC[-4]*7 -> 83041 | L103: =RC[-4]*10 -> 870 | M103: =RC[-4]*10 -> 272700 | P103: 870 | Q103: =RC[-1]+1000 -> 1870
C104: 8815 | D104: =RC[-1]*100 -> 881500 | G104: 11897 | H104: 91 | I104: 27540 | J104: 103 | K104: =RC[-4]*7 -> 83279 | L104: =RC[-4]*10 -> 910 | M104: =RC[-4]*10 -> 275400 | P104: 910 | Q104: =RC[-1]+1000 -> 1910
C105: 8853 | D105: =RC[-1]*100 -> 885300 | G105: 11931 | H105: 93 | I105: 27810 | J105: 104 | K105: =RC[-4]*7 -> 83517 | L105: =RC[-4]*10 -> 930 | M105: =RC[-4]*10 -> 278100 | P105: 930 | Q105: =RC[-1]+1000 -> 1930
C106: 8893 | D106: =RC[-1]*100 -> 889300 | G106: 11965 | H106: 97 | I106: 28080 | J106: 105 | K106: =RC[-4]*7*3 -> 251265 | L106: =RC[-4]*10*3 -> 2910 | M106: =RC[-4]*10*3 -> 842400 | P106: 2910 | Q106: =RC[-1]+1000 -> 3910
C107: 9101 | D107: =RC[-1]*100 -> 910100 | G107: 11999 | H107: 101 | I107: 28350 | J107: 106 | K107: =RC[-4]*7 -> 83993 | L107: =RC[-4]*10 -> 1010 | M107: =RC[-4]*10 -> 283500 | P107: 1010 | Q107: =RC[-1]+1000 -> 2010
C108: 9139 | D108: =RC[-1]*100 -> 913900 | G108: 12032 | H108: 104 | I108: 28620 | J108: 107 | K108: =RC[-4]*7 -> 84224 | L108: =RC[-4]*10 -> 1040 | M108: =RC[-4]*10 -> 286200 | P108: 1040 | Q108: =RC[-1]+1000 -> 2040
C109: 9178 | D109: =RC[-1]*100 -> 917800 | G109: 12066 | H109: 107 | I109: 28890 | J109: 108 | K109: =RC[-4]*7 -> 84462 | L109: =RC[-4]*10 -> 1070 | M109: =RC[-4]*10 -> 288900 | P109: 1070 | Q109: =RC[-1]+1000 -> 2070
C110: 9341 | D110: =RC[-1]*100 -> 934100 | G110: 12100 | H110: 110 | I110: 29160 | J110: 109 | K110: =RC[-4]*7 -> 84700 | L110: =RC[-4]*10 -> 1100 | M110: =RC[-4]*10 -> 291600 | P110: 1100 | Q110: =RC[-1]+1000 -> 2100
C111: 9379 | D111: =RC[-1]*100 -> 937900 | G111: 12184 | H111: 114 | I111: 29430 | J111: 110 | K111: =RC[-4]*7*3 -> 255864 | L111: =RC[-4]*10*3 -> 3420 | M111: =RC[-4]*10*3 -> 882900 | P111: 3420 | Q111: =RC[-1]+1000 -> 4420
C112: 9798 | D112: =RC[-1]*100 -> 979800 | G112: 12269 | H112: 118 | I112: 29700 | J112: 111 | K112: =RC[-4]*7 -> 85883 | L112: =RC[-4]*10 -> 1180 | M112: =RC[-4]*10 -> 297000 | P112: 1180 | Q112: =RC[-1]+1000 -> 2180
C113: 9837 | D113: =RC[-1]*100 -> 983700 | G113: 12353 | H113: 120 | I113: 29970 | J113: 112 | K113: =RC[-4]*7 -> 86471 | L113: =RC[-4]*10 -> 1200 | M113: =RC[-4]*10 -> 299700 | P113: 1200 | Q113: =RC[-1]+1000 -> 2200
C114: 9875 | D114: =RC[-1]*100 -> 987500 | G114: 12438 | H114: 124 | I114: 30240 | J114: 113 | K114: =RC[-4]*7 -> 87066 | L114: =RC[-4]*10 -> 1240 | M114: =RC[-4]*10 -> 302400 | P114: 1240 | Q114: =RC[-1]+1000 -> 2240
C115: 9914 | D115: =RC[-1]*100 -> 991400 | G115: 12522 | H115: 132 | I115: 30510 | J115: 114 | K115: =RC[-4]*7 -> 87654 | L115: =RC[-4]*10 -> 1320 | M115: =RC[-4]*10 -> 305100 | P115: 1320 | Q115: =RC[-1]+1000 -> 2320
C116: 9952 | D116: =RC[-1]*100 -> 995200 | G116: 12607 | H116: 141 | I116: 30780 | J116: 115 | K116: =RC[-4]*7*3 -> 264747 | L116: =RC[-4]*10*3 -> 4230 | M116: =RC[-4]*10*3 -> 923400 | P116: 4230 | Q116: =RC[-1]+1000 -> 5230
C117: 10038 | D117: =RC[-1]*100 -> 1003800 | G117: 12691 | H117: 149 | I117: 31050 | J117: 116 | K117: =RC[-4]*7 -> 88837 | L117: =RC[-4]*10 -> 1490 | M117: =RC[-4]*10 -> 310500 | P117: 1490 | Q117: =RC[-1]+1000 -> 2490
C118: 10077 | D118: =RC[-1]*100 -> 1007700 | G118: 12860 | H118: 158 | I118: 31320 | J118: 117 | K118: =RC[-4]*7 -> 90020 | L118: =RC[-4]*10 -> 1580 | M118: =RC[-4]*10 -> 313200 | P118: 1580 | Q118: =RC[-1]+1000 -> 2580
C119: 10114 | D119: =RC[-1]*100 -> 1011400 | G119: 13029 | H119: 166 | I119: 31590 | J119: 118 | K119: =RC[-4]*7 -> 91203 | L119: =RC[-4]*10 -> 1660 | M119: =RC[-4]*10 -> 315900 | P119: 1660 | Q119: =RC[-1]+1000 -> 2660
C120: 10153 | D120: =RC[-1]*100 -> 1015300 | G120: 13198 | H120: 175 | I120: 31860 | J120: 119 | K120: =RC[-4]*7 -> 92386 | L120: =RC[-4]*10 -> 1750 | M120: =RC[-4]*10 -> 318600 | P120: 1750 | Q120: =RC[-1]+1000 -> 2750
C121: 10192 | D121: =RC[-1]*100 -> 1019200 | G121: 13367 | H121: 183 | I121: 32130 | J121: 120 | K121: =RC[-4]*7*3 -> 280707 | L121: =RC[-4]*10*3 -> 5490 | M121: =RC[-4]*10*3 -> 963900 | P121: 5490 | Q121: =RC[-1]+1000 -> 6490
C122: 10469 | D122: =RC[-1]*100 -> 1046900 | G122: 13536 | H122: 192 | I122: 32400 | J122: 121 | K122: =RC[-4]*7 -> 94752 | L122: =RC[-4]*10 -> 1920 | M122: =RC[-4]*10 -> 324000 | P122: 1920 | Q122: =RC[-1]+1000 -> 2920
C123: 10508 | D123: =RC[-1]*100 -> 1050800 | G123: 13705 | H123: 200 | I123: 32670 | J123: 122 | K123: =RC[-4]*7 -> 95935 | L123: =RC[-4]*10 -> 2000 | M123: =RC[-4]*10 -> 326700 | P123: 2000 | Q123: =RC[-1]+1000 -> 3000
C124: 10546 | D124: =RC[-1]*100 -> 1054600 | G124: 13874 | H124: 209 | I124: 32940 | J124: 123 | K124: =RC[-4]*7 -> 97118 | L124: =RC[-4]*10 -> 2090 | M124: =RC[-4]*10 -> 329400 | P124: 2090 | Q124: =RC[-1]+1000 -> 3090
C125: 10585 | D125: =RC[-1]*100 -> 1058500 | G125: 14043 | H125: 217 | I125: 33210 | J125: 124 | K125: =RC[-4]*7 -> 98301 | L125: =RC[-4]*10 -> 2170 | M125: =RC[-4]*10 -> 332100 | P125: 2170 | Q125: =RC[-1]+1000 -> 3170
C126: 10623 | D126: =RC[-1]*100 -> 1062300 | G126: 14212 | H126: 226 | I126: 33480 | J126: 125 | K126: =RC[-4]*7*3 -> 298452 | L126: =RC[-4]*10*3 -> 6780 | M126: =RC[-4]*10*3 -> 1004400 | P126: 6780 | Q126: =RC[-1]+1000 -> 7780
C127: 10683 | D127: =RC[-1]*100 -> 1068300 | G127: 14381 | H127: 234 | I127: 33750 | J127: 126 | K127: =RC[-4]*7 -> 100667 | L127: =RC[-4]*10 -> 2340 | M127: =RC[-4]*10 -> 337500 | P127: 2340 | Q127: =RC[-1]+1000 -> 3340
C128: 10721 | D128: =RC[-1]*100 -> 1072100 | G128: 14550 | H128: 243 | I128: 34020 | J128: 127 | K128: =RC[-4]*7 -> 101850 | L128: =RC[-4]*10 -> 2430 | M128: =RC[-4]*10 -> 340200 | P128: 2430 | Q128: =RC[-1]+1000 -> 3430
C129: 10760 | D129: =RC[-1]*100 -> 1076000 | G129: 14719 | H129: 250 | I129: 34290 | J129: 128 | K129: =RC[-4]*7 -> 103033 | L129: =RC[-4]*10 -> 2500 | M129: =RC[-4]*10 -> 342900 | P129: 2500 | Q129: =RC[-1]+1000 -> 3500
C130: 10797 | D130: =RC[-1]*100 -> 1079700 | G130: 14888 | H130: 260 | I130: 34560 | J130: 129 | K130: =RC[-4]*7 -> 104216 | L130: =RC[-4]*10 -> 2600 | M130: =RC[-4]*10 -> 345600 | P130: 2600 | Q130: =RC[-1]+1000 -> 3600
C131: 10836 | D131: =RC[-1]*100 -> 1083600 | G131: 15057 | H131: 267 | I131: 34830 | J131: 130 | K131: =RC[-4]*7*3 -> 316197 | L131: =RC[-4]*10*3 -> 8010 | M131: =RC[-4]*10*3 -> 1044900 | P131: 8010 | Q131: =RC[-1]+1000 -> 9010
C132: 11120 | D132: =RC[-1]*100 -> 1112000 | G132: 15226 | H132: 276 | I132: 35100 | J132: 131 | K132: =RC[-4]*7 -> 106582 | L132: =RC[-4]*10 -> 2760 | M132: =RC[-4]*10 -> 351000 | P132: 2760 | Q132: =RC[-1]+1000 -> 3760
C133: 11159 | D133: =RC[-1]*100 -> 1115900 | G133: 15395 | H133: 284 | I133: 35370 | J133: 132 | K133: =RC[-4]*7 -> 107765 | L133: =RC[-4]*10 -> 2840 | M133: =RC[-4]*10 -> 353700 | P133: 2840 | Q133: =RC[-1]+1000 -> 3840
C134: 11196 | D134: =RC[-1]*100 -> 1119600 | G134: 15733 | H134: 301 | I134: 35640 | J134: 133 | K134: =RC[-4]*7 -> 110131 | L134: =RC[-4]*10 -> 3010 | M134: =RC[-4]*10 -> 356400 | P134: 3010 | Q134: =RC[-1]+1000 -> 4010
C135: 11236 | D135: =RC[-1]*100 -> 1123600 | G135: 16071 | H135: 318 | I135: 35910 | J135: 134 | K135: =RC[-4]*7 -> 112497 | L135: =RC[-4]*10 -> 3180 | M135: =RC[-4]*10 -> 359100 | P135: 3180 | Q135: =RC[-1]+1000 -> 4180
C136: 11273 | D136: =RC[-1]*100 -> 1127300 | G136: 16409 | H136: 335 | I136: 36180 | J136: 135 | K136: =RC[-4]*7*3 -> 344589 | L136: =RC[-4]*10*3 -> 10050 | M136: =RC[-4]*10*3 -> 1085400 | P136: 10050 | Q136: =RC[-1]+1000 -> 11050
C137: 11335 | D137: =RC[-1]*100 -> 1133500 | G137: 16747 | H137: 352 | I137: 36450 | J137: 136 | K137: =RC[-4]*7 -> 117229 | L137: =RC[-4]*10 -> 3520 | M137: =RC[-4]*10 -> 364500 | P137: 3520 | Q137: =RC[-1]+1000 -> 4520
C138: 11375 | D138: =RC[-1]*100 -> 1137500 | G138: 17085 | H138: 369 | I138: 36720 | J138: 137 | K138: =RC[-4]*7 -> 119595 | L138: =RC[-4]*10 -> 3690 | M138: =RC[-4]*10 -> 367200 | P138: 3690 | Q138: =RC[-1]+1000 -> 4690
C139: 11411 | D139: =RC[-1]*100 -> 1141100 | G139: 17423 | H139: 386 | I139: 36990 | J139: 138 | K139: =RC[-4]*7 -> 121961 | L139: =RC[-4]*10 -> 3860 | M139: =RC[-4]*10 -> 369900 | P139: 3860 | Q139: =RC[-1]+1000 -> 4860
C140: 11450 | D140: =RC[-1]*100 -> 1145000 | G140: 17761 | H140: 403 | I140: 37260 | J140: 139 | K140: =RC[-4]*7 -> 124327 | L140: =RC[-4]*10 -> 4030 | M140: =RC[-4]*10 -> 372600 | P140: 4030 | Q140: =RC[-1]+1000 -> 5030
C141: 11488 | D141: =RC[-1]*100 -> 1148800 | G141: 18099 | H141: 419 | I141: 37530 | J141: 140 | K141: =RC[-4]*7*3 -> 380079 | L141: =RC[-4]*10*3 -> 12570 | M141: =RC[-4]*10*3 -> 1125900 | P141: 12570 | Q141: =RC[-1]+1000 -> 13570
C142: 11812 | D142: =RC[-1]*100 -> 1181200 | G142: 18437 | H142: 436 | I142: 37800 | J142: 141 | K142: =RC[-4]*7 -> 129059 | L142: =RC[-4]*10 -> 4360 | M142: =RC[-4]*10 -> 378000 | P142: 4360 | Q142: =RC[-1]+1000 -> 5360
C143: 11850 | D143: =RC[-1]*100 -> 1185000 | G143: 18775 | H143: 453 | I143: 38070 | J143: 142 | K143: =RC[-4]*7 -> 131425 | L143: =RC[-4]*10 -> 4530 | M143: =RC[-4]*10 -> 380700 | P143: 4530 | Q143: =RC[-1]+1000 -> 5530
C144: 11888 | D144: =RC[-1]*100 -> 1188800 | G144: 19113 | H144: 470 | I144: 38340 | J144: 143 | K144: =RC[-4]*7 -> 133791 | L144: =RC[-4]*10 -> 4700 | M144: =RC[-4]*10 -> 383400 | P144: 4700 | Q144: =RC[-1]+1000 -> 5700
C145: 11926 | D145: =RC[-1]*100 -> 1192600 | G145: 19451 | H145: 487 | I145: 38610 | J145: 144 | K145: =RC[-4]*7 -> 136157 | L145: =RC[-4]*10 -> 4870 | M145: =RC[-4]*10 -> 386100 | P145: 4870 | Q145: =RC[-1]+1000 -> 5870
C146: 11964 | D146: =RC[-1]*100 -> 1196400 | G146: 20296 | H146: 504 | I146: 38880 | J146: 145 | K146: =RC[-4]*7*3 -> 426216 | L146: =RC[-4]*10*3 -> 15120 | M146: =RC[-4]*10*3 -> 1166400 | P146: 15120 | Q146: =RC[-1]+1000 -> 16120
C147: 12002 | D147: =RC[-1]*100 -> 1200200 | G147: 21141 | H147: 521 | I147: 39150 | J147: 146 | K147: =RC[-4]*7 -> 147987 | L147: =RC[-4]*10 -> 5210 | M147: =RC[-4]*10 -> 391500 | P147: 5210 | Q147: =RC[-1]+1000 -> 6210
C148: 12041 | D148: =RC[-1]*100 -> 1204100 | G148: 21986 | H148: 538 | I148: 39420 | J148: 147 | K148: =RC[-4]*7 -> 153902 | L148: =RC[-4]*10 -> 5380 | M148: =RC[-4]*10 -> 394200 | P148: 5380 | Q148: =RC[-1]+1000 -> 6380
C149: 12078 | D149: =RC[-1]*100 -> 1207800 | G149: 22831 | H149: 572 | I149: 39690 | J149: 148 | K149: =RC[-4]*7 -> 159817 | L149: =RC[-4]*10 -> 5720 | M149: =RC[-4]*10 -> 396900 | P149: 5720 | Q149: =RC[-1]+1000 -> 6720
C150: 12115 | D150: =RC[-1]*100 -> 1211500 | G150: 23676 | H150: 605 | I150: 39960 | J150: 149 | K150: =RC[-4]*7 -> 165732 | L150: =RC[-4]*10 -> 6050 | M150: =RC[-4]*10 -> 399600 | P150: 6050 | Q150: =RC[-1]+1000 -> 7050
C151: 12155 | D151: =RC[-1]*100 -> 1215500 | G151: 25366 | H151: 639 | I151: 40230 | J151: 150 | K151: =RC[-4]*7*3 -> 532686 | L151: =RC[-4]*10*3 -> 19170 | M151: =RC[-4]*10*3 -> 1206900 | P151: 19170 | Q151: =RC[-1]+1000 -> 20170