Sheet: ctShangGuMuXueConf
M1: 用于显示 | O1: 配置0,0,则不抽取奖励
A2: nSeq | B2: bCanTeam | C2: nBattleGroup | D2: tFixReward | E2: bRewardBox | F2: nBoxID | G2: fnAttrQiXue | H2: fnAttrGongJi | I2: fnAttrFangYu | J2: fnAttrLingLi | K2: fnAttrMoFa | L2: fnAttrSuDu | M2: nNextBoxID | N2: tDailyReward | O2: tPool
A3: i | B3: b | C3: i | D3: t{iiib} | E3: b | F3: i | G3: e | H3: e | I3: e | J3: e | K3: e | L3: e | M3: i | N3: t{iii} | O3: t{ii}
A4: 序号 | B4: 是否可以组队前往 | C4: 战斗组ID | D4: 首通奖励 | E4: 是否奖励宝箱 | F4: 宝箱ID | G4: 气血属性 | H4: 攻击属性 | I4: 防御属性 | J4: 灵力属性 | K4: 魔法属性 | L4: 速度属性 | M4: 下关宝箱关卡 | N4: 每日奖励 | O4: 奖池(奖池ID,奖励的道具数量)
A5: 1 | B5: 1 | C5: 500001 | D5: 1,14103,1,0; | E5: 1 | F5: 30001 | G5: math.floor(((nCurrGuanQia/10)*2*3+10)*1.5) | H5: math.floor(((nCurrGuanQia/10)*2*3.8+15)*1.5) | I5: math.floor(((nCurrGuanQia/10)*2*3+25)*1.5) | J5: math.floor(((nCurrGuanQia/10)*2*1.1+15)*1.5) | K5: math.floor(((nCurrGuanQia/10)*2*5)*1.5) | L5: math.floor(((nCurrGuanQia/10)*2*0.4+4)*1.5) | M5: 1 | N5: 1,14103,1; | O5: 3000,1;
A6: 2 | B6: 1 | C6: 500002 | D6: 1,14103,1,0; | E6: 0 | F6: 0 | G6: math.floor(((nCurrGuanQia/10)*2*3+10)*1.5) | H6: math.floor(((nCurrGuanQia/10)*2*3.8+15)*1.5) | I6: math.floor(((nCurrGuanQia/10)*2*3+25)*1.5) | J6: math.floor(((nCurrGuanQia/10)*2*1.1+15)*1.5) | K6: math.floor(((nCurrGuanQia/10)*2*5)*1.5) | L6: math.floor(((nCurrGuanQia/10)*2*0.4+4)*1.5) | M6: 4 | N6: 1,14103,2; | O6: 3000,1;
A7: 3 | B7: 1 | C7: 500003 | D7: 1,14103,1,0; | E7: 0 | F7: 0 | G7: math.floor(((nCurrGuanQia/10)*2*3+10)*1.5) | H7: math.floor(((nCurrGuanQia/10)*2*3.8+15)*1.5) | I7: math.floor(((nCurrGuanQia/10)*2*3+25)*1.5) | J7: math.floor(((nCurrGuanQia/10)*2*1.1+15)*1.5) | K7: math.floor(((nCurrGuanQia/10)*2*5)*1.5) | L7: math.floor(((nCurrGuanQia/10)*2*0.4+4)*1.5) | M7: 4 | N7: 1,14103,3; | O7: 3000,1;
A8: 4 | B8: 1 | C8: 500004 | D8: 1,14103,1,0; | E8: 1 | F8: 30002 | G8: math.floor(((nCurrGuanQia/10)*2*3+10)*1.5) | H8: math.floor(((nCurrGuanQia/10)*2*3.8+15)*1.5) | I8: math.floor(((nCurrGuanQia/10)*2*3+25)*1.5) | J8: math.floor(((nCurrGuanQia/10)*2*1.1+15)*1.5) | K8: math.floor(((nCurrGuanQia/10)*2*5)*1.5) | L8: math.floor(((nCurrGuanQia/10)*2*0.4+4)*1.5) | M8: 4 | N8: 1,14103,4; | O8: 3000,1;
A9: 5 | B9: 1 | C9: 500005 | D9: 1,14103,1,0; | E9: 0 | F9: 0 | G9: math.floor(((nCurrGuanQia/10)*2*3+10)*1.5) | H9: math.floor(((nCurrGuanQia/10)*2*3.8+15)*1.5) | I9: math.floor(((nCurrGuanQia/10)*2*3+25)*1.5) | J9: math.floor(((nCurrGuanQia/10)*2*1.1+15)*1.5) | K9: math.floor(((nCurrGuanQia/10)*2*5)*1.5) | L9: math.floor(((nCurrGuanQia/10)*2*0.4+4)*1.5) | M9: 7 | N9: 1,14103,5; | O9: 3000,1;
A10: 6 | B10: 1 | C10: 500006 | D10: 1,14103,1,0; | E10: 0 | F10: 0 | G10: math.floor(((nCurrGuanQia/10)*2*3+10)*1.5) | H10: math.floor(((nCurrGuanQia/10)*2*3.8+15)*1.5) | I10: math.floor(((nCurrGuanQia/10)*2*3+25)*1.5) | J10: math.floor(((nCurrGuanQia/10)*2*1.1+15)*1.5) | K10: math.floor(((nCurrGuanQia/10)*2*5)*1.5) | L10: math.floor(((nCurrGuanQia/10)*2*0.4+4)*1.5) | M10: 7 | N10: 1,14103,6; | O10: 3000,1;
A11: 7 | B11: 1 | C11: 500007 | D11: 1,14103,1,0; | E11: 1 | F11: 30003 | G11: math.floor(((nCurrGuanQia/10)*2*3+10)*1.5) | H11: math.floor(((nCurrGuanQia/10)*2*3.8+15)*1.5) | I11: math.floor(((nCurrGuanQia/10)*2*3+25)*1.5) | J11: math.floor(((nCurrGuanQia/10)*2*1.1+15)*1.5) | K11: math.floor(((nCurrGuanQia/10)*2*5)*1.5) | L11: math.floor(((nCurrGuanQia/10)*2*0.4+4)*1.5) | M11: 7 | N11: 1,14103,7; | O11: 3000,1;
A12: 8 | B12: 1 | C12: 500008 | D12: 1,14103,1,0; | E12: 0 | F12: 0 | G12: math.floor(((nCurrGuanQia/10)*2*3+10)*1.5) | H12: math.floor(((nCurrGuanQia/10)*2*3.8+15)*1.5) | I12: math.floor(((nCurrGuanQia/10)*2*3+25)*1.5) | J12: math.floor(((nCurrGuanQia/10)*2*1.1+15)*1.5) | K12: math.floor(((nCurrGuanQia/10)*2*5)*1.5) | L12: math.floor(((nCurrGuanQia/10)*2*0.4+4)*1.5) | M12: 10 | N12: 1,14103,8; | O12: 3000,1;
A13: 9 | B13: 1 | C13: 500009 | D13: 1,14103,1,0; | E13: 0 | F13: 0 | G13: math.floor(((nCurrGuanQia/10)*2*3+10)*1.5) | H13: math.floor(((nCurrGuanQia/10)*2*3.8+15)*1.5) | I13: math.floor(((nCurrGuanQia/10)*2*3+25)*1.5) | J13: math.floor(((nCurrGuanQia/10)*2*1.1+15)*1.5) | K13: math.floor(((nCurrGuanQia/10)*2*5)*1.5) | L13: math.floor(((nCurrGuanQia/10)*2*0.4+4)*1.5) | M13: 10 | N13: 1,14103,9; | O13: 3000,1;
A14: 10 | B14: 1 | C14: 500010 | D14: 1,14103,1,0; | E14: 1 | F14: 30004 | G14: math.floor(((nCurrGuanQia/10)*2*3+10)*1.5) | H14: math.floor(((nCurrGuanQia/10)*2*3.8+15)*1.5) | I14: math.floor(((nCurrGuanQia/10)*2*3+25)*1.5) | J14: math.floor(((nCurrGuanQia/10)*2*1.1+15)*1.5) | K14: math.floor(((nCurrGuanQia/10)*2*5)*1.5) | L14: math.floor(((nCurrGuanQia/10)*2*0.4+4)*1.5) | M14: 10 | N14: 1,14103,10; | O14: 3000,1;
A15: 11 | B15: 1 | C15: 500011 | D15: 1,14103,1,0; | E15: 0 | F15: 0 | G15: math.floor(((nCurrGuanQia/10)*2*3+10)*1.5) | H15: math.floor(((nCurrGuanQia/10)*2*3.8+15)*1.5) | I15: math.floor(((nCurrGuanQia/10)*2*3+25)*1.5) | J15: math.floor(((nCurrGuanQia/10)*2*1.1+15)*1.5) | K15: math.floor(((nCurrGuanQia/10)*2*5)*1.5) | L15: math.floor(((nCurrGuanQia/10)*2*0.4+4)*1.5) | M15: 13 | N15: 1,14103,11; | O15: 3000,1;
A16: 12 | B16: 1 | C16: 500012 | D16: 1,14103,1,0; | E16: 0 | F16: 0 | G16: math.floor(((nCurrGuanQia/10)*2*3+10)*1.5) | H16: math.floor(((nCurrGuanQia/10)*2*3.8+15)*1.5) | I16: math.floor(((nCurrGuanQia/10)*2*3+25)*1.5) | J16: math.floor(((nCurrGuanQia/10)*2*1.1+15)*1.5) | K16: math.floor(((nCurrGuanQia/10)*2*5)*1.5) | L16: math.floor(((nCurrGuanQia/10)*2*0.4+4)*1.5) | M16: 13 | N16: 1,14103,12; | O16: 3000,1;
A17: 13 | B17: 1 | C17: 500013 | D17: 1,14103,1,0; | E17: 1 | F17: 30005 | G17: math.floor(((nCurrGuanQia/10)*2*3+10)*1.5) | H17: math.floor(((nCurrGuanQia/10)*2*3.8+15)*1.5) | I17: math.floor(((nCurrGuanQia/10)*2*3+25)*1.5) | J17: math.floor(((nCurrGuanQia/10)*2*1.1+15)*1.5) | K17: math.floor(((nCurrGuanQia/10)*2*5)*1.5) | L17: math.floor(((nCurrGuanQia/10)*2*0.4+4)*1.5) | M17: 13 | N17: 1,14103,13; | O17: 3000,1;
A18: 14 | B18: 1 | C18: 500014 | D18: 1,14103,1,0; | E18: 0 | F18: 0 | G18: math.floor(((nCurrGuanQia/10)*2*3+10)*1.5) | H18: math.floor(((nCurrGuanQia/10)*2*3.8+15)*1.5) | I18: math.floor(((nCurrGuanQia/10)*2*3+25)*1.5) | J18: math.floor(((nCurrGuanQia/10)*2*1.1+15)*1.5) | K18: math.floor(((nCurrGuanQia/10)*2*5)*1.5) | L18: math.floor(((nCurrGuanQia/10)*2*0.4+4)*1.5) | M18: 16 | N18: 1,14103,14; | O18: 3000,1;
A19: 15 | B19: 1 | C19: 500015 | D19: 1,14103,1,0; | E19: 0 | F19: 0 | G19: math.floor(((nCurrGuanQia/10)*2*3+10)*1.5) | H19: math.floor(((nCurrGuanQia/10)*2*3.8+15)*1.5) | I19: math.floor(((nCurrGuanQia/10)*2*3+25)*1.5) | J19: math.floor(((nCurrGuanQia/10)*2*1.1+15)*1.5) | K19: math.floor(((nCurrGuanQia/10)*2*5)*1.5) | L19: math.floor(((nCurrGuanQia/10)*2*0.4+4)*1.5) | M19: 16 | N19: 1,14103,15; | O19: 3000,1;
A20: 16 | B20: 1 | C20: 500016 | D20: 1,14103,1,0; | E20: 1 | F20: 30006 | G20: math.floor(((nCurrGuanQia/10)*2*3+10)*1.5) | H20: math.floor(((nCurrGuanQia/10)*2*3.8+15)*1.5) | I20: math.floor(((nCurrGuanQia/10)*2*3+25)*1.5) | J20: math.floor(((nCurrGuanQia/10)*2*1.1+15)*1.5) | K20: math.floor(((nCurrGuanQia/10)*2*5)*1.5) | L20: math.floor(((nCurrGuanQia/10)*2*0.4+4)*1.5) | M20: 16 | N20: 1,14103,16; | O20: 3000,1;
A21: 17 | B21: 1 | C21: 500017 | D21: 1,14103,1,0; | E21: 0 | F21: 0 | G21: math.floor(((nCurrGuanQia/10)*2*3+10)*1.5) | H21: math.floor(((nCurrGuanQia/10)*2*3.8+15)*1.5) | I21: math.floor(((nCurrGuanQia/10)*2*3+25)*1.5) | J21: math.floor(((nCurrGuanQia/10)*2*1.1+15)*1.5) | K21: math.floor(((nCurrGuanQia/10)*2*5)*1.5) | L21: math.floor(((nCurrGuanQia/10)*2*0.4+4)*1.5) | M21: 19 | N21: 1,14103,17; | O21: 3000,1;
A22: 18 | B22: 1 | C22: 500018 | D22: 1,14103,1,0; | E22: 0 | F22: 0 | G22: math.floor(((nCurrGuanQia/10)*2*3+10)*1.5) | H22: math.floor(((nCurrGuanQia/10)*2*3.8+15)*1.5) | I22: math.floor(((nCurrGuanQia/10)*2*3+25)*1.5) | J22: math.floor(((nCurrGuanQia/10)*2*1.1+15)*1.5) | K22: math.floor(((nCurrGuanQia/10)*2*5)*1.5) | L22: math.floor(((nCurrGuanQia/10)*2*0.4+4)*1.5) | M22: 19 | N22: 1,14103,18; | O22: 3000,1;
A23: 19 | B23: 1 | C23: 500019 | D23: 1,14103,1,0; | E23: 1 | F23: 30007 | G23: math.floor(((nCurrGuanQia/10)*2*3+10)*1.5) | H23: math.floor(((nCurrGuanQia/10)*2*3.8+15)*1.5) | I23: math.floor(((nCurrGuanQia/10)*2*3+25)*1.5) | J23: math.floor(((nCurrGuanQia/10)*2*1.1+15)*1.5) | K23: math.floor(((nCurrGuanQia/10)*2*5)*1.5) | L23: math.floor(((nCurrGuanQia/10)*2*0.4+4)*1.5) | M23: 19 | N23: 1,14103,19; | O23: 3000,1;
A24: 20 | B24: 1 | C24: 500020 | D24: 1,14103,1,0; | E24: 0 | F24: 0 | G24: math.floor(((nCurrGuanQia/10)*2*3+10)*1.5) | H24: math.floor(((nCurrGuanQia/10)*2*3.8+15)*1.5) | I24: math.floor(((nCurrGuanQia/10)*2*3+25)*1.5) | J24: math.floor(((nCurrGuanQia/10)*2*1.1+15)*1.5) | K24: math.floor(((nCurrGuanQia/10)*2*5)*1.5) | L24: math.floor(((nCurrGuanQia/10)*2*0.4+4)*1.5) | M24: 22 | N24: 1,14103,20; | O24: 3000,1;
A25: 21 | B25: 1 | C25: 500021 | D25: 1,14103,1,0; | E25: 0 | F25: 0 | G25: math.floor(((nCurrGuanQia/10)*2*3+10)*1.5) | H25: math.floor(((nCurrGuanQia/10)*2*3.8+15)*1.5) | I25: math.floor(((nCurrGuanQia/10)*2*3+25)*1.5) | J25: math.floor(((nCurrGuanQia/10)*2*1.1+15)*1.5) | K25: math.floor(((nCurrGuanQia/10)*2*5)*1.5) | L25: math.floor(((nCurrGuanQia/10)*2*0.4+4)*1.5) | M25: 22 | N25: 1,14103,21; | O25: 3000,1;
A26: 22 | B26: 1 | C26: 500022 | D26: 1,14103,1,0; | E26: 1 | F26: 30008 | G26: math.floor(((nCurrGuanQia/10)*2*3+10)*1.5) | H26: math.floor(((nCurrGuanQia/10)*2*3.8+15)*1.5) | I26: math.floor(((nCurrGuanQia/10)*2*3+25)*1.5) | J26: math.floor(((nCurrGuanQia/10)*2*1.1+15)*1.5) | K26: math.floor(((nCurrGuanQia/10)*2*5)*1.5) | L26: math.floor(((nCurrGuanQia/10)*2*0.4+4)*1.5) | M26: 22 | N26: 1,14103,22; | O26: 3000,1;
A27: 23 | B27: 1 | C27: 500023 | D27: 1,14103,1,0; | E27: 0 | F27: 0 | G27: math.floor(((nCurrGuanQia/10)*2*3+10)*1.5) | H27: math.floor(((nCurrGuanQia/10)*2*3.8+15)*1.5) | I27: math.floor(((nCurrGuanQia/10)*2*3+25)*1.5) | J27: math.floor(((nCurrGuanQia/10)*2*1.1+15)*1.5) | K27: math.floor(((nCurrGuanQia/10)*2*5)*1.5) | L27: math.floor(((nCurrGuanQia/10)*2*0.4+4)*1.5) | M27: 25 | N27: 1,14103,23; | O27: 3000,1;
A28: 24 | B28: 1 | C28: 500024 | D28: 1,14103,1,0; | E28: 0 | F28: 0 | G28: math.floor(((nCurrGuanQia/10)*2*3+10)*1.5) | H28: math.floor(((nCurrGuanQia/10)*2*3.8+15)*1.5) | I28: math.floor(((nCurrGuanQia/10)*2*3+25)*1.5) | J28: math.floor(((nCurrGuanQia/10)*2*1.1+15)*1.5) | K28: math.floor(((nCurrGuanQia/10)*2*5)*1.5) | L28: math.floor(((nCurrGuanQia/10)*2*0.4+4)*1.5) | M28: 25 | N28: 1,14103,24; | O28: 3000,1;
A29: 25 | B29: 1 | C29: 500025 | D29: 1,14103,1,0; | E29: 1 | F29: 30009 | G29: math.floor(((nCurrGuanQia/10)*2*3+10)*1.5) | H29: math.floor(((nCurrGuanQia/10)*2*3.8+15)*1.5) | I29: math.floor(((nCurrGuanQia/10)*2*3+25)*1.5) | J29: math.floor(((nCurrGuanQia/10)*2*1.1+15)*1.5) | K29: math.floor(((nCurrGuanQia/10)*2*5)*1.5) | L29: math.floor(((nCurrGuanQia/10)*2*0.4+4)*1.5) | M29: 25 | N29: 1,14103,25; | O29: 3000,1;
A30: 26 | B30: 1 | C30: 500026 | D30: 1,14103,1,0; | E30: 0 | F30: 0 | G30: math.floor(((nCurrGuanQia/10)*2*3+10)*1.5) | H30: math.floor(((nCurrGuanQia/10)*2*3.8+15)*1.5) | I30: math.floor(((nCurrGuanQia/10)*2*3+25)*1.5) | J30: math.floor(((nCurrGuanQia/10)*2*1.1+15)*1.5) | K30: math.floor(((nCurrGuanQia/10)*2*5)*1.5) | L30: math.floor(((nCurrGuanQia/10)*2*0.4+4)*1.5) | M30: 28 | N30: 1,14103,26; | O30: 3000,1;
A31: 27 | B31: 1 | C31: 500027 | D31: 1,14103,1,0; | E31: 0 | F31: 0 | G31: math.floor(((nCurrGuanQia/10)*2*3+10)*1.5) | H31: math.floor(((nCurrGuanQia/10)*2*3.8+15)*1.5) | I31: math.floor(((nCurrGuanQia/10)*2*3+25)*1.5) | J31: math.floor(((nCurrGuanQia/10)*2*1.1+15)*1.5) | K31: math.floor(((nCurrGuanQia/10)*2*5)*1.5) | L31: math.floor(((nCurrGuanQia/10)*2*0.4+4)*1.5) | M31: 28 | N31: 1,14103,27; | O31: 3000,1;
A32: 28 | B32: 1 | C32: 500028 | D32: 1,14103,1,0; | E32: 1 | F32: 30010 | G32: math.floor(((nCurrGuanQia/10)*2*3+10)*1.5) | H32: math.floor(((nCurrGuanQia/10)*2*3.8+15)*1.5) | I32: math.floor(((nCurrGuanQia/10)*2*3+25)*1.5) | J32: math.floor(((nCurrGuanQia/10)*2*1.1+15)*1.5) | K32: math.floor(((nCurrGuanQia/10)*2*5)*1.5) | L32: math.floor(((nCurrGuanQia/10)*2*0.4+4)*1.5) | M32: 28 | N32: 1,14103,28; | O32: 3000,1;
A33: 29 | B33: 1 | C33: 500029 | D33: 1,14103,1,0; | E33: 0 | F33: 0 | G33: math.floor(((nCurrGuanQia/10)*2*3+10)*1.5) | H33: math.floor(((nCurrGuanQia/10)*2*3.8+15)*1.5) | I33: math.floor(((nCurrGuanQia/10)*2*3+25)*1.5) | J33: math.floor(((nCurrGuanQia/10)*2*1.1+15)*1.5) | K33: math.floor(((nCurrGuanQia/10)*2*5)*1.5) | L33: math.floor(((nCurrGuanQia/10)*2*0.4+4)*1.5) | M33: 31 | N33: 1,14103,29; | O33: 3000,1;
A34: 30 | B34: 1 | C34: 500030 | D34: 1,14103,1,0; | E34: 0 | F34: 0 | G34: math.floor(((nCurrGuanQia/10)*2*3+10)*1.5) | H34: math.floor(((nCurrGuanQia/10)*2*3.8+15)*1.5) | I34: math.floor(((nCurrGuanQia/10)*2*3+25)*1.5) | J34: math.floor(((nCurrGuanQia/10)*2*1.1+15)*1.5) | K34: math.floor(((nCurrGuanQia/10)*2*5)*1.5) | L34: math.floor(((nCurrGuanQia/10)*2*0.4+4)*1.5) | M34: 31 | N34: 1,14103,30; | O34: 3000,1;
A35: 31 | B35: 1 | C35: 500031 | D35: 1,14103,1,0; | E35: 1 | F35: 30011 | G35: math.floor(((nCurrGuanQia/10)*2*3+10)*1.5) | H35: math.floor(((nCurrGuanQia/10)*2*3.8+15)*1.5) | I35: math.floor(((nCurrGuanQia/10)*2*3+25)*1.5) | J35: math.floor(((nCurrGuanQia/10)*2*1.1+15)*1.5) | K35: math.floor(((nCurrGuanQia/10)*2*5)*1.5) | L35: math.floor(((nCurrGuanQia/10)*2*0.4+4)*1.5) | M35: 31 | N35: 1,14103,31; | O35: 3000,1;
A36: 32 | B36: 1 | C36: 500032 | D36: 1,14103,1,0; | E36: 0 | F36: 0 | G36: math.floor(((nCurrGuanQia/10)*2*3+10)*1.5) | H36: math.floor(((nCurrGuanQia/10)*2*3.8+15)*1.5) | I36: math.floor(((nCurrGuanQia/10)*2*3+25)*1.5) | J36: math.floor(((nCurrGuanQia/10)*2*1.1+15)*1.5) | K36: math.floor(((nCurrGuanQia/10)*2*5)*1.5) | L36: math.floor(((nCurrGuanQia/10)*2*0.4+4)*1.5) | M36: 34 | N36: 1,14103,32; | O36: 3000,1;
A37: 33 | B37: 1 | C37: 500033 | D37: 1,14103,1,0; | E37: 0 | F37: 0 | G37: math.floor(((nCurrGuanQia/10)*2*3+10)*1.5) | H37: math.floor(((nCurrGuanQia/10)*2*3.8+15)*1.5) | I37: math.floor(((nCurrGuanQia/10)*2*3+25)*1.5) | J37: math.floor(((nCurrGuanQia/10)*2*1.1+15)*1.5) | K37: math.floor(((nCurrGuanQia/10)*2*5)*1.5) | L37: math.floor(((nCurrGuanQia/10)*2*0.4+4)*1.5) | M37: 34 | N37: 1,14103,33; | O37: 3000,1;
A38: 34 | B38: 1 | C38: 500034 | D38: 1,14103,1,0; | E38: 1 | F38: 30012 | G38: math.floor(((nCurrGuanQia/10)*2*3+10)*1.5) | H38: math.floor(((nCurrGuanQia/10)*2*3.8+15)*1.5) | I38: math.floor(((nCurrGuanQia/10)*2*3+25)*1.5) | J38: math.floor(((nCurrGuanQia/10)*2*1.1+15)*1.5) | K38: math.floor(((nCurrGuanQia/10)*2*5)*1.5) | L38: math.floor(((nCurrGuanQia/10)*2*0.4+4)*1.5) | M38: 34 | N38: 1,14103,34; | O38: 3000,1;
A39: 35 | B39: 1 | C39: 500035 | D39: 1,14103,1,0; | E39: 0 | F39: 0 | G39: math.floor(((nCurrGuanQia/10)*2*3+10)*1.5) | H39: math.floor(((nCurrGuanQia/10)*2*3.8+15)*1.5) | I39: math.floor(((nCurrGuanQia/10)*2*3+25)*1.5) | J39: math.floor(((nCurrGuanQia/10)*2*1.1+15)*1.5) | K39: math.floor(((nCurrGuanQia/10)*2*5)*1.5) | L39: math.floor(((nCurrGuanQia/10)*2*0.4+4)*1.5) | M39: 37 | N39: 1,14103,35; | O39: 3000,1;
A40: 36 | B40: 1 | C40: 500036 | D40: 1,14103,1,0; | E40: 0 | F40: 0 | G40: math.floor(((nCurrGuanQia/10)*2*3+10)*1.5) | H40: math.floor(((nCurrGuanQia/10)*2*3.8+15)*1.5) | I40: math.floor(((nCurrGuanQia/10)*2*3+25)*1.5) | J40: math.floor(((nCurrGuanQia/10)*2*1.1+15)*1.5) | K40: math.floor(((nCurrGuanQia/10)*2*5)*1.5) | L40: math.floor(((nCurrGuanQia/10)*2*0.4+4)*1.5) | M40: 37 | N40: 1,14103,36; | O40: 3000,1;
A41: 37 | B41: 1 | C41: 500037 | D41: 1,14103,1,0; | E41: 1 | F41: 30013 | G41: math.floor(((nCurrGuanQia/10)*2*3+10)*1.5) | H41: math.floor(((nCurrGuanQia/10)*2*3.8+15)*1.5) | I41: math.floor(((nCurrGuanQia/10)*2*3+25)*1.5) | J41: math.floor(((nCurrGuanQia/10)*2*1.1+15)*1.5) | K41: math.floor(((nCurrGuanQia/10)*2*5)*1.5) | L41: math.floor(((nCurrGuanQia/10)*2*0.4+4)*1.5) | M41: 37 | N41: 1,14103,37; | O41: 3000,1;
A42: 38 | B42: 1 | C42: 500038 | D42: 1,14103,1,0; | E42: 0 | F42: 0 | G42: math.floor(((nCurrGuanQia/10)*2*3+10)*1.5) | H42: math.floor(((nCurrGuanQia/10)*2*3.8+15)*1.5) | I42: math.floor(((nCurrGuanQia/10)*2*3+25)*1.5) | J42: math.floor(((nCurrGuanQia/10)*2*1.1+15)*1.5) | K42: math.floor(((nCurrGuanQia/10)*2*5)*1.5) | L42: math.floor(((nCurrGuanQia/10)*2*0.4+4)*1.5) | M42: 40 | N42: 1,14103,38; | O42: 3000,1;
A43: 39 | B43: 1 | C43: 500039 | D43: 1,14103,1,0; | E43: 0 | F43: 0 | G43: math.floor(((nCurrGuanQia/10)*2*3+10)*1.5) | H43: math.floor(((nCurrGuanQia/10)*2*3.8+15)*1.5) | I43: math.floor(((nCurrGuanQia/10)*2*3+25)*1.5) | J43: math.floor(((nCurrGuanQia/10)*2*1.1+15)*1.5) | K43: math.floor(((nCurrGuanQia/10)*2*5)*1.5) | L43: math.floor(((nCurrGuanQia/10)*2*0.4+4)*1.5) | M43: 40 | N43: 1,14103,39; | O43: 3000,1;
A44: 40 | B44: 1 | C44: 500040 | D44: 1,14103,1,0; | E44: 1 | F44: 30014 | G44: math.floor(((nCurrGuanQia/10)*2*3+10)*1.5) | H44: math.floor(((nCurrGuanQia/10)*2*3.8+15)*1.5) | I44: math.floor(((nCurrGuanQia/10)*2*3+25)*1.5) | J44: math.floor(((nCurrGuanQia/10)*2*1.1+15)*1.5) | K44: math.floor(((nCurrGuanQia/10)*2*5)*1.5) | L44: math.floor(((nCurrGuanQia/10)*2*0.4+4)*1.5) | M44: 40 | N44: 1,14103,40; | O44: 3000,1;
A45: 41 | B45: 1 | C45: 500041 | D45: 1,14103,1,0; | E45: 0 | F45: 0 | G45: math.floor(((nCurrGuanQia/10)*2*3+10)*1.5) | H45: math.floor(((nCurrGuanQia/10)*2*3.8+15)*1.5) | I45: math.floor(((nCurrGuanQia/10)*2*3+25)*1.5) | J45: math.floor(((nCurrGuanQia/10)*2*1.1+15)*1.5) | K45: math.floor(((nCurrGuanQia/10)*2*5)*1.5) | L45: math.floor(((nCurrGuanQia/10)*2*0.4+4)*1.5) | M45: 43 | N45: 1,14103,41; | O45: 3000,1;
A46: 42 | B46: 1 | C46: 500042 | D46: 1,14103,1,0; | E46: 0 | F46: 0 | G46: math.floor(((nCurrGuanQia/10)*2*3+10)*1.5) | H46: math.floor(((nCurrGuanQia/10)*2*3.8+15)*1.5) | I46: math.floor(((nCurrGuanQia/10)*2*3+25)*1.5) | J46: math.floor(((nCurrGuanQia/10)*2*1.1+15)*1.5) | K46: math.floor(((nCurrGuanQia/10)*2*5)*1.5) | L46: math.floor(((nCurrGuanQia/10)*2*0.4+4)*1.5) | M46: 43 | N46: 1,14103,42; | O46: 3000,1;
A47: 43 | B47: 1 | C47: 500043 | D47: 1,14103,1,0; | E47: 1 | F47: 30015 | G47: math.floor(((nCurrGuanQia/10)*2*3+10)*1.5) | H47: math.floor(((nCurrGuanQia/10)*2*3.8+15)*1.5) | I47: math.floor(((nCurrGuanQia/10)*2*3+25)*1.5) | J47: math.floor(((nCurrGuanQia/10)*2*1.1+15)*1.5) | K47: math.floor(((nCurrGuanQia/10)*2*5)*1.5) | L47: math.floor(((nCurrGuanQia/10)*2*0.4+4)*1.5) | M47: 43 | N47: 1,14103,43; | O47: 3000,1;
A48: 44 | B48: 1 | C48: 500044 | D48: 1,14103,1,0; | E48: 0 | F48: 0 | G48: math.floor(((nCurrGuanQia/10)*2*3+10)*1.5) | H48: math.floor(((nCurrGuanQia/10)*2*3.8+15)*1.5) | I48: math.floor(((nCurrGuanQia/10)*2*3+25)*1.5) | J48: math.floor(((nCurrGuanQia/10)*2*1.1+15)*1.5) | K48: math.floor(((nCurrGuanQia/10)*2*5)*1.5) | L48: math.floor(((nCurrGuanQia/10)*2*0.4+4)*1.5) | M48: 46 | N48: 1,14103,44; | O48: 3000,1;
A49: 45 | B49: 1 | C49: 500045 | D49: 1,14103,1,0; | E49: 0 | F49: 0 | G49: math.floor(((nCurrGuanQia/10)*2*3+10)*1.5) | H49: math.floor(((nCurrGuanQia/10)*2*3.8+15)*1.5) | I49: math.floor(((nCurrGuanQia/10)*2*3+25)*1.5) | J49: math.floor(((nCurrGuanQia/10)*2*1.1+15)*1.5) | K49: math.floor(((nCurrGuanQia/10)*2*5)*1.5) | L49: math.floor(((nCurrGuanQia/10)*2*0.4+4)*1.5) | M49: 46 | N49: 1,14103,45; | O49: 3000,1;
A50: 46 | B50: 1 | C50: 500046 | D50: 1,14103,1,0; | E50: 1 | F50: 30016 | G50: math.floor(((nCurrGuanQia/10)*2*3+10)*1.5) | H50: math.floor(((nCurrGuanQia/10)*2*3.8+15)*1.5) | I50: math.floor(((nCurrGuanQia/10)*2*3+25)*1.5) | J50: math.floor(((nCurrGuanQia/10)*2*1.1+15)*1.5) | K50: math.floor(((nCurrGuanQia/10)*2*5)*1.5) | L50: math.floor(((nCurrGuanQia/10)*2*0.4+4)*1.5) | M50: 46 | N50: 1,14103,46; | O50: 3000,1;
A51: 47 | B51: 1 | C51: 500047 | D51: 1,14103,1,0; | E51: 0 | F51: 0 | G51: math.floor(((nCurrGuanQia/10)*2*3+10)*1.5) | H51: math.floor(((nCurrGuanQia/10)*2*3.8+15)*1.5) | I51: math.floor(((nCurrGuanQia/10)*2*3+25)*1.5) | J51: math.floor(((nCurrGuanQia/10)*2*1.1+15)*1.5) | K51: math.floor(((nCurrGuanQia/10)*2*5)*1.5) | L51: math.floor(((nCurrGuanQia/10)*2*0.4+4)*1.5) | M51: 49 | N51: 1,14103,47; | O51: 3000,1;
A52: 48 | B52: 1 | C52: 500048 | D52: 1,14103,1,0; | E52: 0 | F52: 0 | G52: math.floor(((nCurrGuanQia/10)*2*3+10)*1.5) | H52: math.floor(((nCurrGuanQia/10)*2*3.8+15)*1.5) | I52: math.floor(((nCurrGuanQia/10)*2*3+25)*1.5) | J52: math.floor(((nCurrGuanQia/10)*2*1.1+15)*1.5) | K52: math.floor(((nCurrGuanQia/10)*2*5)*1.5) | L52: math.floor(((nCurrGuanQia/10)*2*0.4+4)*1.5) | M52: 49 | N52: 1,14103,48; | O52: 3000,1;
A53: 49 | B53: 1 | C53: 500049 | D53: 1,14103,1,0; | E53: 1 | F53: 30017 | G53: math.floor(((nCurrGuanQia/10)*2*3+10)*1.5) | H53: math.floor(((nCurrGuanQia/10)*2*3.8+15)*1.5) | I53: math.floor(((nCurrGuanQia/10)*2*3+25)*1.5) | J53: math.floor(((nCurrGuanQia/10)*2*1.1+15)*1.5) | K53: math.floor(((nCurrGuanQia/10)*2*5)*1.5) | L53: math.floor(((nCurrGuanQia/10)*2*0.4+4)*1.5) | M53: 49 | N53: 1,14103,49; | O53: 3000,1;
A54: 50 | B54: 1 | C54: 500050 | D54: 1,14103,1,0; | E54: 0 | F54: 0 | G54: math.floor(((nCurrGuanQia/10)*2*3+10)*1.5) | H54: math.floor(((nCurrGuanQia/10)*2*3.8+15)*1.5) | I54: math.floor(((nCurrGuanQia/10)*2*3+25)*1.5) | J54: math.floor(((nCurrGuanQia/10)*2*1.1+15)*1.5) | K54: math.floor(((nCurrGuanQia/10)*2*5)*1.5) | L54: math.floor(((nCurrGuanQia/10)*2*0.4+4)*1.5) | M54: 52 | N54: 1,14103,50; | O54: 3000,1;
A55: 51 | B55: 1 | C55: 500051 | D55: 1,14103,1,0; | E55: 0 | F55: 0 | G55: math.floor(((nCurrGuanQia/10)*2*3+10)*1.5) | H55: math.floor(((nCurrGuanQia/10)*2*3.8+15)*1.5) | I55: math.floor(((nCurrGuanQia/10)*2*3+25)*1.5) | J55: math.floor(((nCurrGuanQia/10)*2*1.1+15)*1.5) | K55: math.floor(((nCurrGuanQia/10)*2*5)*1.5) | L55: math.floor(((nCurrGuanQia/10)*2*0.4+4)*1.5) | M55: 52 | N55: 1,14103,51; | O55: 3000,1;
A56: 52 | B56: 1 | C56: 500052 | D56: 1,14103,1,0; | E56: 1 | F56: 30018 | G56: math.floor(((nCurrGuanQia/10)*2*3+10)*1.5) | H56: math.floor(((nCurrGuanQia/10)*2*3.8+15)*1.5) | I56: math.floor(((nCurrGuanQia/10)*2*3+25)*1.5) | J56: math.floor(((nCurrGuanQia/10)*2*1.1+15)*1.5) | K56: math.floor(((nCurrGuanQia/10)*2*5)*1.5) | L56: math.floor(((nCurrGuanQia/10)*2*0.4+4)*1.5) | M56: 52 | N56: 1,14103,52; | O56: 3000,1;
A57: 53 | B57: 1 | C57: 500053 | D57: 1,14103,1,0; | E57: 0 | F57: 0 | G57: math.floor(((nCurrGuanQia/10)*2*3+10)*1.5) | H57: math.floor(((nCurrGuanQia/10)*2*3.8+15)*1.5) | I57: math.floor(((nCurrGuanQia/10)*2*3+25)*1.5) | J57: math.floor(((nCurrGuanQia/10)*2*1.1+15)*1.5) | K57: math.floor(((nCurrGuanQia/10)*2*5)*1.5) | L57: math.floor(((nCurrGuanQia/10)*2*0.4+4)*1.5) | M57: 55 | N57: 1,14103,53; | O57: 3000,1;
A58: 54 | B58: 1 | C58: 500054 | D58: 1,14103,1,0; | E58: 0 | F58: 0 | G58: math.floor(((nCurrGuanQia/10)*2*3+10)*1.5) | H58: math.floor(((nCurrGuanQia/10)*2*3.8+15)*1.5) | I58: math.floor(((nCurrGuanQia/10)*2*3+25)*1.5) | J58: math.floor(((nCurrGuanQia/10)*2*1.1+15)*1.5) | K58: math.floor(((nCurrGuanQia/10)*2*5)*1.5) | L58: math.floor(((nCurrGuanQia/10)*2*0.4+4)*1.5) | M58: 55 | N58: 1,14103,54; | O58: 3000,1;
A59: 55 | B59: 1 | C59: 500055 | D59: 1,14103,1,0; | E59: 1 | F59: 30019 | G59: math.floor(((nCurrGuanQia/10)*2*3+10)*1.5) | H59: math.floor(((nCurrGuanQia/10)*2*3.8+15)*1.5) | I59: math.floor(((nCurrGuanQia/10)*2*3+25)*1.5) | J59: math.floor(((nCurrGuanQia/10)*2*1.1+15)*1.5) | K59: math.floor(((nCurrGuanQia/10)*2*5)*1.5) | L59: math.floor(((nCurrGuanQia/10)*2*0.4+4)*1.5) | M59: 55 | N59: 1,14103,55; | O59: 3000,1;
A60: 56 | B60: 1 | C60: 500056 | D60: 1,14103,1,0; | E60: 0 | F60: 0 | G60: math.floor(((nCurrGuanQia/10)*2*3+10)*1.5) | H60: math.floor(((nCurrGuanQia/10)*2*3.8+15)*1.5) | I60: math.floor(((nCurrGuanQia/10)*2*3+25)*1.5) | J60: math.floor(((nCurrGuanQia/10)*2*1.1+15)*1.5) | K60: math.floor(((nCurrGuanQia/10)*2*5)*1.5) | L60: math.floor(((nCurrGuanQia/10)*2*0.4+4)*1.5) | M60: 58 | N60: 1,14103,56; | O60: 3000,1;
A61: 57 | B61: 1 | C61: 500057 | D61: 1,14103,1,0; | E61: 0 | F61: 0 | G61: math.floor(((nCurrGuanQia/10)*2*3+10)*1.5) | H61: math.floor(((nCurrGuanQia/10)*2*3.8+15)*1.5) | I61: math.floor(((nCurrGuanQia/10)*2*3+25)*1.5) | J61: math.floor(((nCurrGuanQia/10)*2*1.1+15)*1.5) | K61: math.floor(((nCurrGuanQia/10)*2*5)*1.5) | L61: math.floor(((nCurrGuanQia/10)*2*0.4+4)*1.5) | M61: 58 | N61: 1,14103,57; | O61: 3000,1;
A62: 58 | B62: 1 | C62: 500058 | D62: 1,14103,1,0; | E62: 1 | F62: 30020 | G62: math.floor(((nCurrGuanQia/10)*2*3+10)*1.5) | H62: math.floor(((nCurrGuanQia/10)*2*3.8+15)*1.5) | I62: math.floor(((nCurrGuanQia/10)*2*3+25)*1.5) | J62: math.floor(((nCurrGuanQia/10)*2*1.1+15)*1.5) | K62: math.floor(((nCurrGuanQia/10)*2*5)*1.5) | L62: math.floor(((nCurrGuanQia/10)*2*0.4+4)*1.5) | M62: 58 | N62: 1,14103,58; | O62: 3000,1;
A63: 59 | B63: 1 | C63: 500059 | D63: 1,14103,1,0; | E63: 0 | F63: 0 | G63: math.floor(((nCurrGuanQia/10)*2*3+10)*1.5) | H63: math.floor(((nCurrGuanQia/10)*2*3.8+15)*1.5) | I63: math.floor(((nCurrGuanQia/10)*2*3+25)*1.5) | J63: math.floor(((nCurrGuanQia/10)*2*1.1+15)*1.5) | K63: math.floor(((nCurrGuanQia/10)*2*5)*1.5) | L63: math.floor(((nCurrGuanQia/10)*2*0.4+4)*1.5) | M63: 61 | N63: 1,14103,59; | O63: 3000,1;
A64: 60 | B64: 1 | C64: 500060 | D64: 1,14103,1,0; | E64: 0 | F64: 0 | G64: math.floor(((nCurrGuanQia/10)*2*3+10)*1.5) | H64: math.floor(((nCurrGuanQia/10)*2*3.8+15)*1.5) | I64: math.floor(((nCurrGuanQia/10)*2*3+25)*1.5) | J64: math.floor(((nCurrGuanQia/10)*2*1.1+15)*1.5) | K64: math.floor(((nCurrGuanQia/10)*2*5)*1.5) | L64: math.floor(((nCurrGuanQia/10)*2*0.4+4)*1.5) | M64: 61 | N64: 1,14103,60; | O64: 3000,1;
A65: 61 | B65: 1 | C65: 500061 | D65: 1,14103,1,0; | E65: 1 | F65: 30021 | G65: math.floor(((nCurrGuanQia/10)*2*3+10)*1.5) | H65: math.floor(((nCurrGuanQia/10)*2*3.8+15)*1.5) | I65: math.floor(((nCurrGuanQia/10)*2*3+25)*1.5) | J65: math.floor(((nCurrGuanQia/10)*2*1.1+15)*1.5) | K65: math.floor(((nCurrGuanQia/10)*2*5)*1.5) | L65: math.floor(((nCurrGuanQia/10)*2*0.4+4)*1.5) | M65: 61 | N65: 1,14103,61; | O65: 3000,1;
A66: 62 | B66: 1 | C66: 500062 | D66: 1,14103,1,0; | E66: 0 | F66: 0 | G66: math.floor(((nCurrGuanQia/10)*2*3+10)*1.5) | H66: math.floor(((nCurrGuanQia/10)*2*3.8+15)*1.5) | I66: math.floor(((nCurrGuanQia/10)*2*3+25)*1.5) | J66: math.floor(((nCurrGuanQia/10)*2*1.1+15)*1.5) | K66: math.floor(((nCurrGuanQia/10)*2*5)*1.5) | L66: math.floor(((nCurrGuanQia/10)*2*0.4+4)*1.5) | M66: 64 | N66: 1,14103,62; | O66: 3000,1;
A67: 63 | B67: 1 | C67: 500063 | D67: 1,14103,1,0; | E67: 0 | F67: 0 | G67: math.floor(((nCurrGuanQia/10)*2*3+10)*1.5) | H67: math.floor(((nCurrGuanQia/10)*2*3.8+15)*1.5) | I67: math.floor(((nCurrGuanQia/10)*2*3+25)*1.5) | J67: math.floor(((nCurrGuanQia/10)*2*1.1+15)*1.5) | K67: math.floor(((nCurrGuanQia/10)*2*5)*1.5) | L67: math.floor(((nCurrGuanQia/10)*2*0.4+4)*1.5) | M67: 64 | N67: 1,14103,63; | O67: 3000,1;
A68: 64 | B68: 1 | C68: 500064 | D68: 1,14103,1,0; | E68: 1 | F68: 30022 | G68: math.floor(((nCurrGuanQia/10)*2*3+10)*1.5) | H68: math.floor(((nCurrGuanQia/10)*2*3.8+15)*1.5) | I68: math.floor(((nCurrGuanQia/10)*2*3+25)*1.5) | J68: math.floor(((nCurrGuanQia/10)*2*1.1+15)*1.5) | K68: math.floor(((nCurrGuanQia/10)*2*5)*1.5) | L68: math.floor(((nCurrGuanQia/10)*2*0.4+4)*1.5) | M68: 64 | N68: 1,14103,64; | O68: 3000,1;
A69: 65 | B69: 1 | C69: 500065 | D69: 1,14103,1,0; | E69: 0 | F69: 0 | G69: math.floor(((nCurrGuanQia/10)*2*3+10)*1.5) | H69: math.floor(((nCurrGuanQia/10)*2*3.8+15)*1.5) | I69: math.floor(((nCurrGuanQia/10)*2*3+25)*1.5) | J69: math.floor(((nCurrGuanQia/10)*2*1.1+15)*1.5) | K69: math.floor(((nCurrGuanQia/10)*2*5)*1.5) | L69: math.floor(((nCurrGuanQia/10)*2*0.4+4)*1.5) | M69: 67 | N69: 1,14103,65; | O69: 3000,1;
A70: 66 | B70: 1 | C70: 500066 | D70: 1,14103,1,0; | E70: 0 | F70: 0 | G70: math.floor(((nCurrGuanQia/10)*2*3+10)*1.5) | H70: math.floor(((nCurrGuanQia/10)*2*3.8+15)*1.5) | I70: math.floor(((nCurrGuanQia/10)*2*3+25)*1.5) | J70: math.floor(((nCurrGuanQia/10)*2*1.1+15)*1.5) | K70: math.floor(((nCurrGuanQia/10)*2*5)*1.5) | L70: math.floor(((nCurrGuanQia/10)*2*0.4+4)*1.5) | M70: 67 | N70: 1,14103,66; | O70: 3000,1;
A71: 67 | B71: 1 | C71: 500067 | D71: 1,14103,1,0; | E71: 1 | F71: 30023 | G71: math.floor(((nCurrGuanQia/10)*2*3+10)*1.5) | H71: math.floor(((nCurrGuanQia/10)*2*3.8+15)*1.5) | I71: math.floor(((nCurrGuanQia/10)*2*3+25)*1.5) | J71: math.floor(((nCurrGuanQia/10)*2*1.1+15)*1.5) | K71: math.floor(((nCurrGuanQia/10)*2*5)*1.5) | L71: math.floor(((nCurrGuanQia/10)*2*0.4+4)*1.5) | M71: 67 | N71: 1,14103,67; | O71: 3000,1;
A72: 68 | B72: 1 | C72: 500068 | D72: 1,14103,1,0; | E72: 0 | F72: 0 | G72: math.floor(((nCurrGuanQia/10)*2*3+10)*1.5) | H72: math.floor(((nCurrGuanQia/10)*2*3.8+15)*1.5) | I72: math.floor(((nCurrGuanQia/10)*2*3+25)*1.5) | J72: math.floor(((nCurrGuanQia/10)*2*1.1+15)*1.5) | K72: math.floor(((nCurrGuanQia/10)*2*5)*1.5) | L72: math.floor(((nCurrGuanQia/10)*2*0.4+4)*1.5) | M72: 70 | N72: 1,14103,68; | O72: 3000,1;
A73: 69 | B73: 1 | C73: 500069 | D73: 1,14103,1,0; | E73: 0 | F73: 0 | G73: math.floor(((nCurrGuanQia/10)*2*3+10)*1.5) | H73: math.floor(((nCurrGuanQia/10)*2*3.8+15)*1.5) | I73: math.floor(((nCurrGuanQia/10)*2*3+25)*1.5) | J73: math.floor(((nCurrGuanQia/10)*2*1.1+15)*1.5) | K73: math.floor(((nCurrGuanQia/10)*2*5)*1.5) | L73: math.floor(((nCurrGuanQia/10)*2*0.4+4)*1.5) | M73: 70 | N73: 1,14103,69; | O73: 3000,1;
A74: 70 | B74: 1 | C74: 500070 | D74: 1,14103,1,0; | E74: 1 | F74: 30024 | G74: math.floor(((nCurrGuanQia/10)*2*3+10)*1.5) | H74: math.floor(((nCurrGuanQia/10)*2*3.8+15)*1.5) | I74: math.floor(((nCurrGuanQia/10)*2*3+25)*1.5) | J74: math.floor(((nCurrGuanQia/10)*2*1.1+15)*1.5) | K74: math.floor(((nCurrGuanQia/10)*2*5)*1.5) | L74: math.floor(((nCurrGuanQia/10)*2*0.4+4)*1.5) | M74: 70 | N74: 1,14103,70; | O74: 3000,1;
A75: 71 | B75: 1 | C75: 500071 | D75: 1,14103,1,0; | E75: 0 | F75: 0 | G75: math.floor(((nCurrGuanQia/10)*2*3+10)*1.5) | H75: math.floor(((nCurrGuanQia/10)*2*3.8+15)*1.5) | I75: math.floor(((nCurrGuanQia/10)*2*3+25)*1.5) | J75: math.floor(((nCurrGuanQia/10)*2*1.1+15)*1.5) | K75: math.floor(((nCurrGuanQia/10)*2*5)*1.5) | L75: math.floor(((nCurrGuanQia/10)*2*0.4+4)*1.5) | M75: 73 | N75: 1,14103,71; | O75: 3000,1;
A76: 72 | B76: 1 | C76: 500072 | D76: 1,14103,1,0; | E76: 0 | F76: 0 | G76: math.floor(((nCurrGuanQia/10)*2*3+10)*1.5) | H76: math.floor(((nCurrGuanQia/10)*2*3.8+15)*1.5) | I76: math.floor(((nCurrGuanQia/10)*2*3+25)*1.5) | J76: math.floor(((nCurrGuanQia/10)*2*1.1+15)*1.5) | K76: math.floor(((nCurrGuanQia/10)*2*5)*1.5) | L76: math.floor(((nCurrGuanQia/10)*2*0.4+4)*1.5) | M76: 73 | N76: 1,14103,72; | O76: 3000,1;
A77: 73 | B77: 1 | C77: 500073 | D77: 1,14103,1,0; | E77: 1 | F77: 30025 | G77: math.floor(((nCurrGuanQia/10)*2*3+10)*1.5) | H77: math.floor(((nCurrGuanQia/10)*2*3.8+15)*1.5) | I77: math.floor(((nCurrGuanQia/10)*2*3+25)*1.5) | J77: math.floor(((nCurrGuanQia/10)*2*1.1+15)*1.5) | K77: math.floor(((nCurrGuanQia/10)*2*5)*1.5) | L77: math.floor(((nCurrGuanQia/10)*2*0.4+4)*1.5) | M77: 73 | N77: 1,14103,73; | O77: 3000,1;
A78: 74 | B78: 1 | C78: 500074 | D78: 1,14103,1,0; | E78: 0 | F78: 0 | G78: math.floor(((nCurrGuanQia/10)*2*3+10)*1.5) | H78: math.floor(((nCurrGuanQia/10)*2*3.8+15)*1.5) | I78: math.floor(((nCurrGuanQia/10)*2*3+25)*1.5) | J78: math.floor(((nCurrGuanQia/10)*2*1.1+15)*1.5) | K78: math.floor(((nCurrGuanQia/10)*2*5)*1.5) | L78: math.floor(((nCurrGuanQia/10)*2*0.4+4)*1.5) | M78: 76 | N78: 1,14103,74; | O78: 3000,1;
A79: 75 | B79: 1 | C79: 500075 | D79: 1,14103,1,0; | E79: 0 | F79: 0 | G79: math.floor(((nCurrGuanQia/10)*2*3+10)*1.5) | H79: math.floor(((nCurrGuanQia/10)*2*3.8+15)*1.5) | I79: math.floor(((nCurrGuanQia/10)*2*3+25)*1.5) | J79: math.floor(((nCurrGuanQia/10)*2*1.1+15)*1.5) | K79: math.floor(((nCurrGuanQia/10)*2*5)*1.5) | L79: math.floor(((nCurrGuanQia/10)*2*0.4+4)*1.5) | M79: 76 | N79: 1,14103,75; | O79: 3000,1;
A80: 76 | B80: 1 | C80: 500076 | D80: 1,14103,1,0; | E80: 1 | F80: 30026 | G80: math.floor(((nCurrGuanQia/10)*2*3+10)*1.5) | H80: math.floor(((nCurrGuanQia/10)*2*3.8+15)*1.5) | I80: math.floor(((nCurrGuanQia/10)*2*3+25)*1.5) | J80: math.floor(((nCurrGuanQia/10)*2*1.1+15)*1.5) | K80: math.floor(((nCurrGuanQia/10)*2*5)*1.5) | L80: math.floor(((nCurrGuanQia/10)*2*0.4+4)*1.5) | M80: 76 | N80: 1,14103,76; | O80: 3000,1;
A81: 77 | B81: 1 | C81: 500077 | D81: 1,14103,1,0; | E81: 0 | F81: 0 | G81: math.floor(((nCurrGuanQia/10)*2*3+10)*1.5) | H81: math.floor(((nCurrGuanQia/10)*2*3.8+15)*1.5) | I81: math.floor(((nCurrGuanQia/10)*2*3+25)*1.5) | J81: math.floor(((nCurrGuanQia/10)*2*1.1+15)*1.5) | K81: math.floor(((nCurrGuanQia/10)*2*5)*1.5) | L81: math.floor(((nCurrGuanQia/10)*2*0.4+4)*1.5) | M81: 79 | N81: 1,14103,77; | O81: 3000,1;
A82: 78 | B82: 1 | C82: 500078 | D82: 1,14103,1,0; | E82: 0 | F82: 0 | G82: math.floor(((nCurrGuanQia/10)*2*3+10)*1.5) | H82: math.floor(((nCurrGuanQia/10)*2*3.8+15)*1.5) | I82: math.floor(((nCurrGuanQia/10)*2*3+25)*1.5) | J82: math.floor(((nCurrGuanQia/10)*2*1.1+15)*1.5) | K82: math.floor(((nCurrGuanQia/10)*2*5)*1.5) | L82: math.floor(((nCurrGuanQia/10)*2*0.4+4)*1.5) | M82: 79 | N82: 1,14103,78; | O82: 3000,1;
A83: 79 | B83: 1 | C83: 500079 | D83: 1,14103,1,0; | E83: 1 | F83: 30027 | G83: math.floor(((nCurrGuanQia/10)*2*3+10)*1.5) | H83: math.floor(((nCurrGuanQia/10)*2*3.8+15)*1.5) | I83: math.floor(((nCurrGuanQia/10)*2*3+25)*1.5) | J83: math.floor(((nCurrGuanQia/10)*2*1.1+15)*1.5) | K83: math.floor(((nCurrGuanQia/10)*2*5)*1.5) | L83: math.floor(((nCurrGuanQia/10)*2*0.4+4)*1.5) | M83: 79 | N83: 1,14103,79; | O83: 3000,1;
A84: 80 | B84: 1 | C84: 500080 | D84: 1,14103,1,0; | E84: 0 | F84: 0 | G84: math.floor(((nCurrGuanQia/10)*2*3+10)*1.5) | H84: math.floor(((nCurrGuanQia/10)*2*3.8+15)*1.5) | I84: math.floor(((nCurrGuanQia/10)*2*3+25)*1.5) | J84: math.floor(((nCurrGuanQia/10)*2*1.1+15)*1.5) | K84: math.floor(((nCurrGuanQia/10)*2*5)*1.5) | L84: math.floor(((nCurrGuanQia/10)*2*0.4+4)*1.5) | M84: 82 | N84: 1,14103,80; | O84: 3000,1;
A85: 81 | B85: 1 | C85: 500081 | D85: 1,14103,1,0; | E85: 0 | F85: 0 | G85: math.floor(((nCurrGuanQia/10)*2*3+10)*1.5) | H85: math.floor(((nCurrGuanQia/10)*2*3.8+15)*1.5) | I85: math.floor(((nCurrGuanQia/10)*2*3+25)*1.5) | J85: math.floor(((nCurrGuanQia/10)*2*1.1+15)*1.5) | K85: math.floor(((nCurrGuanQia/10)*2*5)*1.5) | L85: math.floor(((nCurrGuanQia/10)*2*0.4+4)*1.5) | M85: 82 | N85: 1,14103,81; | O85: 3000,1;
A86: 82 | B86: 1 | C86: 500082 | D86: 1,14103,1,0; | E86: 1 | F86: 30028 | G86: math.floor(((nCurrGuanQia/10)*2*3+10)*1.5) | H86: math.floor(((nCurrGuanQia/10)*2*3.8+15)*1.5) | I86: math.floor(((nCurrGuanQia/10)*2*3+25)*1.5) | J86: math.floor(((nCurrGuanQia/10)*2*1.1+15)*1.5) | K86: math.floor(((nCurrGuanQia/10)*2*5)*1.5) | L86: math.floor(((nCurrGuanQia/10)*2*0.4+4)*1.5) | M86: 82 | N86: 1,14103,82; | O86: 3000,1;
A87: 83 | B87: 1 | C87: 500083 | D87: 1,14103,1,0; | E87: 0 | F87: 0 | G87: math.floor(((nCurrGuanQia/10)*2*3+10)*1.5) | H87: math.floor(((nCurrGuanQia/10)*2*3.8+15)*1.5) | I87: math.floor(((nCurrGuanQia/10)*2*3+25)*1.5) | J87: math.floor(((nCurrGuanQia/10)*2*1.1+15)*1.5) | K87: math.floor(((nCurrGuanQia/10)*2*5)*1.5) | L87: math.floor(((nCurrGuanQia/10)*2*0.4+4)*1.5) | M87: 85 | N87: 1,14103,83; | O87: 3000,1;
A88: 84 | B88: 1 | C88: 500084 | D88: 1,14103,1,0; | E88: 0 | F88: 0 | G88: math.floor(((nCurrGuanQia/10)*2*3+10)*1.5) | H88: math.floor(((nCurrGuanQia/10)*2*3.8+15)*1.5) | I88: math.floor(((nCurrGuanQia/10)*2*3+25)*1.5) | J88: math.floor(((nCurrGuanQia/10)*2*1.1+15)*1.5) | K88: math.floor(((nCurrGuanQia/10)*2*5)*1.5) | L88: math.floor(((nCurrGuanQia/10)*2*0.4+4)*1.5) | M88: 85 | N88: 1,14103,84; | O88: 3000,1;
A89: 85 | B89: 1 | C89: 500085 | D89: 1,14103,1,0; | E89: 1 | F89: 30029 | G89: math.floor(((nCurrGuanQia/10)*2*3+10)*1.5) | H89: math.floor(((nCurrGuanQia/10)*2*3.8+15)*1.5) | I89: math.floor(((nCurrGuanQia/10)*2*3+25)*1.5) | J89: math.floor(((nCurrGuanQia/10)*2*1.1+15)*1.5) | K89: math.floor(((nCurrGuanQia/10)*2*5)*1.5) | L89: math.floor(((nCurrGuanQia/10)*2*0.4+4)*1.5) | M89: 85 | N89: 1,14103,85; | O89: 3000,1;
A90: 86 | B90: 1 | C90: 500086 | D90: 1,14103,1,0; | E90: 0 | F90: 0 | G90: math.floor(((nCurrGuanQia/10)*2*3+10)*1.5) | H90: math.floor(((nCurrGuanQia/10)*2*3.8+15)*1.5) | I90: math.floor(((nCurrGuanQia/10)*2*3+25)*1.5) | J90: math.floor(((nCurrGuanQia/10)*2*1.1+15)*1.5) | K90: math.floor(((nCurrGuanQia/10)*2*5)*1.5) | L90: math.floor(((nCurrGuanQia/10)*2*0.4+4)*1.5) | M90: 88 | N90: 1,14103,86; | O90: 3000,1;
A91: 87 | B91: 1 | C91: 500087 | D91: 1,14103,1,0; | E91: 0 | F91: 0 | G91: math.floor(((nCurrGuanQia/10)*2*3+10)*1.5) | H91: math.floor(((nCurrGuanQia/10)*2*3.8+15)*1.5) | I91: math.floor(((nCurrGuanQia/10)*2*3+25)*1.5) | J91: math.floor(((nCurrGuanQia/10)*2*1.1+15)*1.5) | K91: math.floor(((nCurrGuanQia/10)*2*5)*1.5) | L91: math.floor(((nCurrGuanQia/10)*2*0.4+4)*1.5) | M91: 88 | N91: 1,14103,87; | O91: 3000,1;
A92: 88 | B92: 1 | C92: 500088 | D92: 1,14103,1,0; | E92: 1 | F92: 30030 | G92: math.floor(((nCurrGuanQia/10)*2*3+10)*1.5) | H92: math.floor(((nCurrGuanQia/10)*2*3.8+15)*1.5) | I92: math.floor(((nCurrGuanQia/10)*2*3+25)*1.5) | J92: math.floor(((nCurrGuanQia/10)*2*1.1+15)*1.5) | K92: math.floor(((nCurrGuanQia/10)*2*5)*1.5) | L92: math.floor(((nCurrGuanQia/10)*2*0.4+4)*1.5) | M92: 88 | N92: 1,14103,88; | O92: 3000,1;
A93: 89 | B93: 1 | C93: 500089 | D93: 1,14103,1,0; | E93: 0 | F93: 0 | G93: math.floor(((nCurrGuanQia/10)*2*3+10)*1.5) | H93: math.floor(((nCurrGuanQia/10)*2*3.8+15)*1.5) | I93: math.floor(((nCurrGuanQia/10)*2*3+25)*1.5) | J93: math.floor(((nCurrGuanQia/10)*2*1.1+15)*1.5) | K93: math.floor(((nCurrGuanQia/10)*2*5)*1.5) | L93: math.floor(((nCurrGuanQia/10)*2*0.4+4)*1.5) | M93: 91 | N93: 1,14103,89; | O93: 3000,1;
A94: 90 | B94: 1 | C94: 500090 | D94: 1,14103,1,0; | E94: 0 | F94: 0 | G94: math.floor(((nCurrGuanQia/10)*2*3+10)*1.5) | H94: math.floor(((nCurrGuanQia/10)*2*3.8+15)*1.5) | I94: math.floor(((nCurrGuanQia/10)*2*3+25)*1.5) | J94: math.floor(((nCurrGuanQia/10)*2*1.1+15)*1.5) | K94: math.floor(((nCurrGuanQia/10)*2*5)*1.5) | L94: math.floor(((nCurrGuanQia/10)*2*0.4+4)*1.5) | M94: 91 | N94: 1,14103,90; | O94: 3000,1;
A95: 91 | B95: 1 | C95: 500091 | D95: 1,14103,1,0; | E95: 1 | F95: 30031 | G95: math.floor(((nCurrGuanQia/10)*2*3+10)*1.5) | H95: math.floor(((nCurrGuanQia/10)*2*3.8+15)*1.5) | I95: math.floor(((nCurrGuanQia/10)*2*3+25)*1.5) | J95: math.floor(((nCurrGuanQia/10)*2*1.1+15)*1.5) | K95: math.floor(((nCurrGuanQia/10)*2*5)*1.5) | L95: math.floor(((nCurrGuanQia/10)*2*0.4+4)*1.5) | M95: 91 | N95: 1,14103,91; | O95: 3000,1;
A96: 92 | B96: 1 | C96: 500092 | D96: 1,14103,1,0; | E96: 0 | F96: 0 | G96: math.floor(((nCurrGuanQia/10)*2*3+10)*1.5) | H96: math.floor(((nCurrGuanQia/10)*2*3.8+15)*1.5) | I96: math.floor(((nCurrGuanQia/10)*2*3+25)*1.5) | J96: math.floor(((nCurrGuanQia/10)*2*1.1+15)*1.5) | K96: math.floor(((nCurrGuanQia/10)*2*5)*1.5) | L96: math.floor(((nCurrGuanQia/10)*2*0.4+4)*1.5) | M96: 94 | N96: 1,14103,92; | O96: 3000,1;
A97: 93 | B97: 1 | C97: 500093 | D97: 1,14103,1,0; | E97: 0 | F97: 0 | G97: math.floor(((nCurrGuanQia/10)*2*3+10)*1.5) | H97: math.floor(((nCurrGuanQia/10)*2*3.8+15)*1.5) | I97: math.floor(((nCurrGuanQia/10)*2*3+25)*1.5) | J97: math.floor(((nCurrGuanQia/10)*2*1.1+15)*1.5) | K97: math.floor(((nCurrGuanQia/10)*2*5)*1.5) | L97: math.floor(((nCurrGuanQia/10)*2*0.4+4)*1.5) | M97: 94 | N97: 1,14103,93; | O97: 3000,1;
A98: 94 | B98: 1 | C98: 500094 | D98: 1,14103,1,0; | E98: 1 | F98: 30032 | G98: math.floor(((nCurrGuanQia/10)*2*3+10)*1.5) | H98: math.floor(((nCurrGuanQia/10)*2*3.8+15)*1.5) | I98: math.floor(((nCurrGuanQia/10)*2*3+25)*1.5) | J98: math.floor(((nCurrGuanQia/10)*2*1.1+15)*1.5) | K98: math.floor(((nCurrGuanQia/10)*2*5)*1.5) | L98: math.floor(((nCurrGuanQia/10)*2*0.4+4)*1.5) | M98: 94 | N98: 1,14103,94; | O98: 3000,1;
A99: 95 | B99: 1 | C99: 500095 | D99: 1,14103,1,0; | E99: 0 | F99: 0 | G99: math.floor(((nCurrGuanQia/10)*2*3+10)*1.5) | H99: math.floor(((nCurrGuanQia/10)*2*3.8+15)*1.5) | I99: math.floor(((nCurrGuanQia/10)*2*3+25)*1.5) | J99: math.floor(((nCurrGuanQia/10)*2*1.1+15)*1.5) | K99: math.floor(((nCurrGuanQia/10)*2*5)*1.5) | L99: math.floor(((nCurrGuanQia/10)*2*0.4+4)*1.5) | M99: 97 | N99: 1,14103,95; | O99: 3000,1;
A100: 96 | B100: 1 | C100: 500096 | D100: 1,14103,1,0; | E100: 0 | F100: 0 | G100: math.floor(((nCurrGuanQia/10)*2*3+10)*1.5) | H100: math.floor(((nCurrGuanQia/10)*2*3.8+15)*1.5) | I100: math.floor(((nCurrGuanQia/10)*2*3+25)*1.5) | J100: math.floor(((nCurrGuanQia/10)*2*1.1+15)*1.5) | K100: math.floor(((nCurrGuanQia/10)*2*5)*1.5) | L100: math.floor(((nCurrGuanQia/10)*2*0.4+4)*1.5) | M100: 97 | N100: 1,14103,96; | O100: 3000,1;
A101: 97 | B101: 1 | C101: 500097 | D101: 1,14103,1,0; | E101: 1 | F101: 30033 | G101: math.floor(((nCurrGuanQia/10)*2*3+10)*1.5) | H101: math.floor(((nCurrGuanQia/10)*2*3.8+15)*1.5) | I101: math.floor(((nCurrGuanQia/10)*2*3+25)*1.5) | J101: math.floor(((nCurrGuanQia/10)*2*1.1+15)*1.5) | K101: math.floor(((nCurrGuanQia/10)*2*5)*1.5) | L101: math.floor(((nCurrGuanQia/10)*2*0.4+4)*1.5) | M101: 97 | N101: 1,14103,97; | O101: 3000,1;
A102: 98 | B102: 1 | C102: 500098 | D102: 1,14103,1,0; | E102: 0 | F102: 0 | G102: math.floor(((nCurrGuanQia/10)*2*3+10)*1.5) | H102: math.floor(((nCurrGuanQia/10)*2*3.8+15)*1.5) | I102: math.floor(((nCurrGuanQia/10)*2*3+25)*1.5) | J102: math.floor(((nCurrGuanQia/10)*2*1.1+15)*1.5) | K102: math.floor(((nCurrGuanQia/10)*2*5)*1.5) | L102: math.floor(((nCurrGuanQia/10)*2*0.4+4)*1.5) | M102: 100 | N102: 1,14103,98; | O102: 3000,1;
A103: 99 | B103: 1 | C103: 500099 | D103: 1,14103,1,0; | E103: 0 | F103: 0 | G103: math.floor(((nCurrGuanQia/10)*2*3+10)*1.5) | H103: math.floor(((nCurrGuanQia/10)*2*3.8+15)*1.5) | I103: math.floor(((nCurrGuanQia/10)*2*3+25)*1.5) | J103: math.floor(((nCurrGuanQia/10)*2*1.1+15)*1.5) | K103: math.floor(((nCurrGuanQia/10)*2*5)*1.5) | L103: math.floor(((nCurrGuanQia/10)*2*0.4+4)*1.5) | M103: 100 | N103: 1,14103,99; | O103: 3000,1;
A104: 100 | B104: 1 | C104: 500100 | D104: 1,14103,1,0; | E104: 1 | F104: 30034 | G104: math.floor(((nCurrGuanQia/10)*2*3+10)*1.5) | H104: math.floor(((nCurrGuanQia/10)*2*3.8+15)*1.5) | I104: math.floor(((nCurrGuanQia/10)*2*3+25)*1.5) | J104: math.floor(((nCurrGuanQia/10)*2*1.1+15)*1.5) | K104: math.floor(((nCurrGuanQia/10)*2*5)*1.5) | L104: math.floor(((nCurrGuanQia/10)*2*0.4+4)*1.5) | M104: 100 | N104: 1,14103,100; | O104: 3000,1;

Sheet: Sheet2
A1: 宋玉 | B1: 多想为你奉上最美的鲜花
A2: 潘安 | B2: 留不住的，始终是那刹那消逝的芳华
A3: 卫玠 | B3: 天涯海角，但求无他，只望君安，叔宝便已知足
A4: 赵云 | B4: 若为伊故，子龙再度七进七出又何妨！
A5: 司马相如 | B5: 能与娘娘相伴，真乃微臣之辛
A6: 孙策 | B6: =R[-1]C -> 能与娘娘相伴，真乃微臣之辛
A7: 韩子高 | B7: 伊人独舞，倾城之姿。舞中带忧，我见犹怜
A8: 高长恭 | B8: 不要动，再动的话，我可不敢保证会发生什么!
A9: 嵇康 | B9: 人生难免不如意，娘娘懂得排遣便好
A10: 慕容冲 | B10: 你是白痴吗？这种话还需要我当面跟你说清楚吗！
A11: 诸葛亮 | B11: 今日夜观星象，乌云盖顶，却奈何遮不住对你的思念
A12: 卫青 | B12: 有时候莫名其妙的笑了，只因为想到了你
A13: 荀彧 | B13: 大千世界，能遇上娘娘，真好
A14: 子画 | B14: 没有我，你要好好的，这是你唯一能为我做的
A15: 白玉堂 | B15: 不要怕什么路途遥远。走一步有一步的风景
A16: 曹操 | B16: 我从来不怕天下人看错我，却唯怕你看错我
A17: 李白 | B17: 陪你地老天荒，只为伊人独醉
A18: 杜甫 | B18: 你站在哪里 哪里就自成风景
A19: 展昭 | B19: 只要展某认为值得，纵管前方是刀山火海还是千军万马，我也会义无反顾！
A20: 周瑜 | B20: 聆听吧，这首献给您的醉赤壁
A21: 苏轼 | B21: 小楼一夜听风雨，深巷明朝卖杏花
A22: 元稹 | B22: 在你需要我时，我总会出现在你身边
A23: 阮籍 | B23: 世间纵有风雪寒寒，亦终有人万死不离
A24: 霍去病 | B24: 娘娘，和你在一起总会令我忘记时间的存在
A25: 邹忌 | B25: 我不思进取，因为只思你！
A26: 唐伯虎 | B26: 笔走龙蛇绘江山，却绘不出娘娘的惊鸿之姿
A27: 柳永 | B27: 云淡风轻，细水长流
A28: 魏无忌 | B28: 凤兮凤兮归故乡，遨游四海求其凰
A29: 扶苏 | B29: 此刻看着你，就好比我在晴朗的天气，眺望远处的青山
A30: 欧阳修 | B30: 娘娘，好风、好景，倒不如来一场春风得意马蹄疾。
A31: 郭嘉 | B31: 有的路，是脚去走。而有的路，确是用心去走
A32: 蒙恬 | B32: 你若需要，大可拿走我的心，可是别把你的微笑拿掉
A33: 白居易 | B33: 娘娘，樱树只有华美落尽，生命脉络才历历可见
A34: 刘彻 | B34: 一腔孤勇与余生，只愿能陪在你的身边

Sheet: Sheet3
W1: 10001 | X1: 20000 | Y1: =RC[-2]+RC[-1] -> 30001
W2: 0 | X2: 0 | Y2: =RC[-2]+RC[-1] -> 0
W3: 0 | X3: 0 | Y3: =RC[-2]+RC[-1] -> 0
W4: 10002 | X4: =R[-3]C -> 20000 | Y4: =RC[-2]+RC[-1] -> 30002
W5: 0 | X5: =R[-3]C -> 0 | Y5: =RC[-2]+RC[-1] -> 0
W6: 0 | X6: =R[-3]C -> 0 | Y6: =RC[-2]+RC[-1] -> 0
A7: 序号 | B7: 最小关卡 | C7: 最大关卡 | D7: 关卡名 | E7: 人物经验基数公式 | F7: 宠物经验基数公式 | I7: 银币奖励基数公式 | L7: 金币奖励基础公式 | M7: 人物离线经验 | N7: 宠物离线经验 | O7: 离线奖励银币 | W7: 10003 | X7: =R[-3]C -> 20000 | Y7: =RC[-2]+RC[-1] -> 30003
A8: 1 | B8: 1 | C8: 1 | D8: 新手试炼 | E8: 50000/3600*(nPatrolSec+3)*(100+nGuanQia)/100 | F8: 50000/3600*(nPatrolSec+3)*(100+nGuanQia)/100*0.4 | I8: 50000/3600*(nPatrolSec+3)*(100+nGuanQia)/100*20 | J8: =RC[1]&"/15/3600*(nPatrolSec+3)*(nGuanQia+0)/"&INT((RC[-8]+RC[-7])/2) -> 2000000/15/3600*(nPatrolSec+3)*(nGuanQia+0)/1 | K8: 2000000 | L8: nGuanQia + 100 | M8: 50000/60*nMin*(100+nGuanQia)/100 | N8: 50000/60*nMin*(100+nGuanQia)/100*0.4 | O8: 50000/60*nMin*(100+nGuanQia)/100*20 | P8: =RC[-5]&"/20/60*nMin*(nGuanQia+0)/"&INT((RC[-14]+RC[-13])/2) -> 2000000/20/60*nMin*(nGuanQia+0)/1 | W8: 0 | X8: =R[-3]C -> 0 | Y8: =RC[-2]+RC[-1] -> 0
A9: 2 | B9: 2 | C9: 2 | D9: 新手试炼 | E9: 50000/3600*(nPatrolSec+3)*(100+nGuanQia)/100 | F9: 50000/3600*(nPatrolSec+3)*(100+nGuanQia)/100*0.4 | I9: 50000/3600*(nPatrolSec+3)*(100+nGuanQia)/100*20 | J9: =RC[1]&"/15/3600*(nPatrolSec+3)*(nGuanQia+0)/"&INT((RC[-8]+RC[-7])/2) -> 2600000/15/3600*(nPatrolSec+3)*(nGuanQia+0)/2 | K9: =(R18C11-R8C11)/(R18C1-R8C1)+R[-1]C -> 2600000 | L9: nGuanQia + 100 | M9: 50000/60*nMin*(100+nGuanQia)/100 | N9: 50000/60*nMin*(100+nGuanQia)/100*0.4 | O9: 50000/60*nMin*(100+nGuanQia)/100*20 | P9: =RC[-5]&"/20/60*nMin*(nGuanQia+0)/"&INT((RC[-14]+RC[-13])/2) -> 2600000/20/60*nMin*(nGuanQia+0)/2 | W9: 0 | X9: =R[-3]C -> 0 | Y9: =RC[-2]+RC[-1] -> 0
A10: 3 | B10: 3 | C10: 3 | D10: 新手试炼 | E10: 50000/3600*(nPatrolSec+3)*(100+nGuanQia)/100 | F10: 50000/3600*(nPatrolSec+3)*(100+nGuanQia)/100*0.4 | I10: 50000/3600*(nPatrolSec+3)*(100+nGuanQia)/100*20 | J10: =RC[1]&"/15/3600*(nPatrolSec+3)*(nGuanQia+0)/"&INT((RC[-8]+RC[-7])/2) -> 3200000/15/3600*(nPatrolSec+3)*(nGuanQia+0)/3 | K10: =(R18C11-R8C11)/(R18C1-R8C1)+R[-1]C -> 3200000 | L10: nGuanQia + 100 | M10: 50000/60*nMin*(100+nGuanQia)/100 | N10: 50000/60*nMin*(100+nGuanQia)/100*0.4 | O10: 50000/60*nMin*(100+nGuanQia)/100*20 | P10: =RC[-5]&"/20/60*nMin*(nGuanQia+0)/"&INT((RC[-14]+RC[-13])/2) -> 3200000/20/60*nMin*(nGuanQia+0)/3 | W10: 10004 | X10: =R[-3]C -> 20000 | Y10: =RC[-2]+RC[-1] -> 30004
A11: 4 | B11: 4 | C11: 4 | D11: 新手试炼 | E11: 50000/3600*(nPatrolSec+3)*(100+nGuanQia)/100 | F11: 50000/3600*(nPatrolSec+3)*(100+nGuanQia)/100*0.4 | I11: 50000/3600*(nPatrolSec+3)*(100+nGuanQia)/100*20 | J11: =RC[1]&"/15/3600*(nPatrolSec+3)*(nGuanQia+0)/"&INT((RC[-8]+RC[-7])/2) -> 3800000/15/3600*(nPatrolSec+3)*(nGuanQia+0)/4 | K11: =(R18C11-R8C11)/(R18C1-R8C1)+R[-1]C -> 3800000 | L11: nGuanQia + 100 | M11: 50000/60*nMin*(100+nGuanQia)/100 | N11: 50000/60*nMin*(100+nGuanQia)/100*0.4 | O11: 50000/60*nMin*(100+nGuanQia)/100*20 | P11: =RC[-5]&"/20/60*nMin*(nGuanQia+0)/"&INT((RC[-14]+RC[-13])/2) -> 3800000/20/60*nMin*(nGuanQia+0)/4 | W11: 0 | X11: =R[-3]C -> 0 | Y11: =RC[-2]+RC[-1] -> 0
A12: 5 | B12: 5 | C12: 5 | D12: 新手试炼 | E12: 50000/3600*(nPatrolSec+3)*(100+nGuanQia)/100 | F12: 50000/3600*(nPatrolSec+3)*(100+nGuanQia)/100*0.4 | I12: 50000/3600*(nPatrolSec+3)*(100+nGuanQia)/100*20 | J12: =RC[1]&"/15/3600*(nPatrolSec+3)*(nGuanQia+0)/"&INT((RC[-8]+RC[-7])/2) -> 4400000/15/3600*(nPatrolSec+3)*(nGuanQia+0)/5 | K12: =(R18C11-R8C11)/(R18C1-R8C1)+R[-1]C -> 4400000 | L12: nGuanQia + 100 | M12: 50000/60*nMin*(100+nGuanQia)/100 | N12: 50000/60*nMin*(100+nGuanQia)/100*0.4 | O12: 50000/60*nMin*(100+nGuanQia)/100*20 | P12: =RC[-5]&"/20/60*nMin*(nGuanQia+0)/"&INT((RC[-14]+RC[-13])/2) -> 4400000/20/60*nMin*(nGuanQia+0)/5 | W12: 0 | X12: =R[-3]C -> 0 | Y12: =RC[-2]+RC[-1] -> 0
A13: 6 | B13: 6 | C13: 20 | D13: 新手试炼 | E13: 50000/3600*(nPatrolSec+3)*(100+nGuanQia)/100 | F13: 50000/3600*(nPatrolSec+3)*(100+nGuanQia)/100*0.4 | I13: 50000/3600*(nPatrolSec+3)*(100+nGuanQia)/100*20 | J13: =RC[1]&"/15/3600*(nPatrolSec+3)*(nGuanQia+0)/"&INT((RC[-8]+RC[-7])/2) -> 5000000/15/3600*(nPatrolSec+3)*(nGuanQia+0)/13 | K13: =(R18C11-R8C11)/(R18C1-R8C1)+R[-1]C -> 5000000 | L13: nGuanQia + 100 | M13: 50000/60*nMin*(100+nGuanQia)/100 | N13: 50000/60*nMin*(100+nGuanQia)/100*0.4 | O13: 50000/60*nMin*(100+nGuanQia)/100*20 | P13: =RC[-5]&"/20/60*nMin*(nGuanQia+0)/"&INT((RC[-14]+RC[-13])/2) -> 5000000/20/60*nMin*(nGuanQia+0)/13 | W13: 10005 | X13: =R[-3]C -> 20000 | Y13: =RC[-2]+RC[-1] -> 30005
A14: 7 | B14: 21 | C14: 50 | D14: 青铜试炼 | E14: 60000/3600*(nPatrolSec+3)*(100+nGuanQia)/100 | F14: 60000/3600*(nPatrolSec+3)*(100+nGuanQia)/100*0.4 | I14: 60000/3600*(nPatrolSec+3)*(100+nGuanQia)/100*20 | J14: =RC[1]&"/15/3600*(nPatrolSec+3)*(nGuanQia+0)/"&INT((RC[-8]+RC[-7])/2) -> 5600000/15/3600*(nPatrolSec+3)*(nGuanQia+0)/35 | K14: =(R18C11-R8C11)/(R18C1-R8C1)+R[-1]C -> 5600000 | L14: nGuanQia + 100 | M14: 60000/60*nMin*(100+nGuanQia)/100 | N14: 60000/60*nMin*(100+nGuanQia)/100*0.4 | O14: 60000/60*nMin*(100+nGuanQia)/100*20 | P14: =RC[-5]&"/20/60*nMin*(nGuanQia+0)/"&INT((RC[-14]+RC[-13])/2) -> 5600000/20/60*nMin*(nGuanQia+0)/35 | W14: 0 | X14: =R[-3]C -> 0 | Y14: =RC[-2]+RC[-1] -> 0
A15: 8 | B15: 51 | C15: 100 | D15: 白银试炼 | E15: 70000/3600*(nPatrolSec+3)*(100+nGuanQia)/100 | F15: 70000/3600*(nPatrolSec+3)*(100+nGuanQia)/100*0.4 | I15: 70000/3600*(nPatrolSec+3)*(100+nGuanQia)/100*20 | J15: =RC[1]&"/15/3600*(nPatrolSec+3)*(nGuanQia+0)/"&INT((RC[-8]+RC[-7])/2) -> 6200000/15/3600*(nPatrolSec+3)*(nGuanQia+0)/75 | K15: =(R18C11-R8C11)/(R18C1-R8C1)+R[-1]C -> 6200000 | L15: nGuanQia + 100 | M15: 70000/60*nMin*(100+nGuanQia)/100 | N15: 70000/60*nMin*(100+nGuanQia)/100*0.4 | O15: 70000/60*nMin*(100+nGuanQia)/100*20 | P15: =RC[-5]&"/20/60*nMin*(nGuanQia+0)/"&INT((RC[-14]+RC[-13])/2) -> 6200000/20/60*nMin*(nGuanQia+0)/75 | W15: 0 | X15: =R[-3]C -> 0 | Y15: =RC[-2]+RC[-1] -> 0
A16: 9 | B16: 101 | C16: 200 | D16: 黄金试炼 | E16: 80000/3600*(nPatrolSec+3)*(100+nGuanQia)/100 | F16: 80000/3600*(nPatrolSec+3)*(100+nGuanQia)/100*0.4 | I16: 80000/3600*(nPatrolSec+3)*(100+nGuanQia)/100*20 | J16: =RC[1]&"/15/3600*(nPatrolSec+3)*(nGuanQia+0)/"&INT((RC[-8]+RC[-7])/2) -> 6800000/15/3600*(nPatrolSec+3)*(nGuanQia+0)/150 | K16: =(R18C11-R8C11)/(R18C1-R8C1)+R[-1]C -> 6800000 | L16: nGuanQia + 100 | M16: 80000/60*nMin*(100+nGuanQia)/100 | N16: 80000/60*nMin*(100+nGuanQia)/100*0.4 | O16: 80000/60*nMin*(100+nGuanQia)/100*20 | P16: =RC[-5]&"/20/60*nMin*(nGuanQia+0)/"&INT((RC[-14]+RC[-13])/2) -> 6800000/20/60*nMin*(nGuanQia+0)/150 | W16: 10006 | X16: =R[-3]C -> 20000 | Y16: =RC[-2]+RC[-1] -> 30006
A17: 10 | B17: 201 | C17: 300 | D17: 钻石试炼 | E17: 90000/3600*(nPatrolSec+3)*(100+nGuanQia)/100 | F17: 90000/3600*(nPatrolSec+3)*(100+nGuanQia)/100*0.4 | I17: 90000/3600*(nPatrolSec+3)*(100+nGuanQia)/100*20 | J17: =RC[1]&"/15/3600*(nPatrolSec+3)*(nGuanQia+0)/"&INT((RC[-8]+RC[-7])/2) -> 7400000/15/3600*(nPatrolSec+3)*(nGuanQia+0)/250 | K17: =(R18C11-R8C11)/(R18C1-R8C1)+R[-1]C -> 7400000 | L17: nGuanQia + 100 | M17: 90000/60*nMin*(100+nGuanQia)/100 | N17: 90000/60*nMin*(100+nGuanQia)/100*0.4 | O17: 90000/60*nMin*(100+nGuanQia)/100*20 | P17: =RC[-5]&"/20/60*nMin*(nGuanQia+0)/"&INT((RC[-14]+RC[-13])/2) -> 7400000/20/60*nMin*(nGuanQia+0)/250 | W17: 0 | X17: =R[-3]C -> 0 | Y17: =RC[-2]+RC[-1] -> 0
A18: 11 | B18: 301 | C18: 400 | D18: 王者试炼 | E18: 100000/3600*(nPatrolSec+3)*(100+nGuanQia)/100 | F18: 100000/3600*(nPatrolSec+3)*(100+nGuanQia)/100*0.4 | I18: 100000/3600*(nPatrolSec+3)*(100+nGuanQia)/100*20 | J18: =RC[1]&"/15/3600*(nPatrolSec+3)*(nGuanQia+0)/"&INT((RC[-8]+RC[-7])/2) -> 8000000/15/3600*(nPatrolSec+3)*(nGuanQia+0)/350 | K18: 8000000 | L18: nGuanQia + 100 | M18: 100000/60*nMin*(100+nGuanQia)/100 | N18: 100000/60*nMin*(100+nGuanQia)/100*0.4 | O18: 100000/60*nMin*(100+nGuanQia)/100*20 | P18: =RC[-5]&"/20/60*nMin*(nGuanQia+0)/"&INT((RC[-14]+RC[-13])/2) -> 8000000/20/60*nMin*(nGuanQia+0)/350 | W18: 0 | X18: =R[-3]C -> 0 | Y18: =RC[-2]+RC[-1] -> 0
A19: 12 | B19: 401 | C19: 9999 | D19: 大师试炼 | E19: 100000/3600*(nPatrolSec+3)*(100+nGuanQia)/100 | F19: 100000/3600*(nPatrolSec+3)*(100+nGuanQia)/100*0.4 | I19: 100000/3600*(nPatrolSec+3)*(100+nGuanQia)/100*20 | K19: 8000000 | L19: nGuanQia + 100 | M19: 100000/60*nMin*(100+nGuanQia)/100 | N19: 100000/60*nMin*(100+nGuanQia)/100*0.4 | O19: 100000/60*nMin*(100+nGuanQia)/100*20 | W19: 10007 | X19: =R[-3]C -> 20000 | Y19: =RC[-2]+RC[-1] -> 30007
W20: 0 | X20: =R[-3]C -> 0 | Y20: =RC[-2]+RC[-1] -> 0
W21: 0 | X21: =R[-3]C -> 0 | Y21: =RC[-2]+RC[-1] -> 0
W22: 10008 | X22: =R[-3]C -> 20000 | Y22: =RC[-2]+RC[-1] -> 30008
W23: 0 | X23: =R[-3]C -> 0 | Y23: =RC[-2]+RC[-1] -> 0
D24: (nRoleLevel*35+200)*(nCompCount+2)/4 | W24: 0 | X24: =R[-3]C -> 0 | Y24: =RC[-2]+RC[-1] -> 0
E25: (nRoleLevel*28+160)*(nCompCount+2)/4 | W25: 10009 | X25: =R[-3]C -> 20000 | Y25: =RC[-2]+RC[-1] -> 30009
F26: 10000*0.1*(100+nCompCount)/100*(1+nRoleLevel/200) | W26: 0 | X26: =R[-3]C -> 0 | Y26: =RC[-2]+RC[-1] -> 0
D27: 镇妖基数公式，最坏情况 | I27: 假动画3秒，巡逻5秒，1小时450次假动画弹经验 | W27: 0 | X27: =R[-3]C -> 0 | Y27: =RC[-2]+RC[-1] -> 0
B28: 关卡数 | C28: 期望等级 | D28: 经验 | E28: 宠物经验 | F28: 银币 | G28: 关卡数 | H28: 期望等级 | I28: 每小时经验 | J28: 每小时宠物经验 | K28: 每小时银币 | L28: 公式 | W28: 10010 | X28: =R[-3]C -> 20000 | Y28: =RC[-2]+RC[-1] -> 30010
B29: 1 | C29: 2 | D29: =INT((RC[-1]*35+200)*(1+2)/4*0.2) -> 40 | E29: =INT((RC[-2]*28+160)*(1+2)/4*0.2) -> 32 | F29: =INT(10000*0.1*(100+1)/100*(1+RC[-3]/200)*0.2) -> 204 | G29: 1 | H29: 2 | I29: 10000 | J29: =RC[-1]/35*28 -> 8000 | K29: =RC[-5]*60 -> 12240 | L29: =RC[-3]&"/3600*(nPatrolSec+3)*(1000+nGuanQia)/1000" -> 10000/3600*(nPatrolSec+3)*(1000+nGuanQia)/1000 | M29: =RC[-3]&"/3600*(nPatrolSec+3)*(1000+nGuanQia)/1000" -> 8000/3600*(nPatrolSec+3)*(1000+nGuanQia)/1000 | N29: =RC[-3]&"/3600*(nPatrolSec+3)*(1000+nGuanQia)/1000" -> 12240/3600*(nPatrolSec+3)*(1000+nGuanQia)/1000 | O29: =RC[-6]&"/60*nMin*(1000+nGuanQia)/1000" -> 10000/60*nMin*(1000+nGuanQia)/1000 | P29: =RC[-6]&"/60*nMin*(1000+nGuanQia)/1000" -> 8000/60*nMin*(1000+nGuanQia)/1000 | Q29: =RC[-6]&"/60*nMin*(1000+nGuanQia)/1000" -> 12240/60*nMin*(1000+nGuanQia)/1000 | W29: 0 | X29: =R[-3]C -> 0 | Y29: =RC[-2]+RC[-1] -> 0
B30: 2 | C30: 3 | D30: =INT((RC[-1]*35+200)*(1+2)/4*0.2) -> 45 | E30: =INT((RC[-2]*28+160)*(1+2)/4*0.2) -> 36 | F30: =INT(10000*0.1*(100+1)/100*(1+RC[-3]/200)*0.2) -> 205 | G30: 2 | H30: 3 | I30: =R[-1]C+250 -> 10250 | J30: =RC[-1]/35*28 -> 8200 | K30: =RC[-5]*60 -> 12300 | L30: =RC[-3]&"/3600*(nPatrolSec+3)*(1000+nGuanQia)/1000" -> 10250/3600*(nPatrolSec+3)*(1000+nGuanQia)/1000 | M30: =RC[-3]&"/3600*(nPatrolSec+3)*(1000+nGuanQia)/1000" -> 8200/3600*(nPatrolSec+3)*(1000+nGuanQia)/1000 | N30: =RC[-3]&"/3600*(nPatrolSec+3)*(1000+nGuanQia)/1000" -> 12300/3600*(nPatrolSec+3)*(1000+nGuanQia)/1000 | O30: =RC[-6]&"/60*nMin*(1000+nGuanQia)/1000" -> 10250/60*nMin*(1000+nGuanQia)/1000 | P30: =RC[-6]&"/60*nMin*(1000+nGuanQia)/1000" -> 8200/60*nMin*(1000+nGuanQia)/1000 | Q30: =RC[-6]&"/60*nMin*(1000+nGuanQia)/1000" -> 12300/60*nMin*(1000+nGuanQia)/1000 | W30: 0 | X30: =R[-3]C -> 0 | Y30: =RC[-2]+RC[-1] -> 0
B31: 3 | C31: 4 | D31: =INT((RC[-1]*35+200)*(1+2)/4*0.2) -> 51 | E31: =INT((RC[-2]*28+160)*(1+2)/4*0.2) -> 40 | F31: =INT(10000*0.1*(100+1)/100*(1+RC[-3]/200)*0.2) -> 206 | G31: 3 | H31: 4 | I31: =R[-1]C+250 -> 10500 | J31: =RC[-1]/35*28 -> 8400 | K31: =RC[-5]*60 -> 12360 | L31: =RC[-3]&"/3600*(nPatrolSec+3)*(1000+nGuanQia)/1000" -> 10500/3600*(nPatrolSec+3)*(1000+nGuanQia)/1000 | M31: =RC[-3]&"/3600*(nPatrolSec+3)*(1000+nGuanQia)/1000" -> 8400/3600*(nPatrolSec+3)*(1000+nGuanQia)/1000 | N31: =RC[-3]&"/3600*(nPatrolSec+3)*(1000+nGuanQia)/1000" -> 12360/3600*(nPatrolSec+3)*(1000+nGuanQia)/1000 | O31: =RC[-6]&"/60*nMin*(1000+nGuanQia)/1000" -> 10500/60*nMin*(1000+nGuanQia)/1000 | P31: =RC[-6]&"/60*nMin*(1000+nGuanQia)/1000" -> 8400/60*nMin*(1000+nGuanQia)/1000 | Q31: =RC[-6]&"/60*nMin*(1000+nGuanQia)/1000" -> 12360/60*nMin*(1000+nGuanQia)/1000 | W31: 10011 | X31: =R[-3]C -> 20000 | Y31: =RC[-2]+RC[-1] -> 30011
B32: 4 | C32: 5 | D32: =INT((RC[-1]*35+200)*(1+2)/4*0.2) -> 56 | E32: =INT((RC[-2]*28+160)*(1+2)/4*0.2) -> 45 | F32: =INT(10000*0.1*(100+1)/100*(1+RC[-3]/200)*0.2) -> 207 | G32: 4 | H32: 5 | I32: =R[-1]C+250 -> 10750 | J32: =RC[-1]/35*28 -> 8600 | K32: =RC[-5]*60 -> 12420 | L32: =RC[-3]&"/3600*(nPatrolSec+3)*(1000+nGuanQia)/1000" -> 10750/3600*(nPatrolSec+3)*(1000+nGuanQia)/1000 | M32: =RC[-3]&"/3600*(nPatrolSec+3)*(1000+nGuanQia)/1000" -> 8600/3600*(nPatrolSec+3)*(1000+nGuanQia)/1000 | N32: =RC[-3]&"/3600*(nPatrolSec+3)*(1000+nGuanQia)/1000" -> 12420/3600*(nPatrolSec+3)*(1000+nGuanQia)/1000 | O32: =RC[-6]&"/60*nMin*(1000+nGuanQia)/1000" -> 10750/60*nMin*(1000+nGuanQia)/1000 | P32: =RC[-6]&"/60*nMin*(1000+nGuanQia)/1000" -> 8600/60*nMin*(1000+nGuanQia)/1000 | Q32: =RC[-6]&"/60*nMin*(1000+nGuanQia)/1000" -> 12420/60*nMin*(1000+nGuanQia)/1000 | W32: 0 | X32: =R[-3]C -> 0 | Y32: =RC[-2]+RC[-1] -> 0
B33: 5 | C33: 6 | D33: =INT((RC[-1]*35+200)*(1+2)/4*0.2) -> 61 | E33: =INT((RC[-2]*28+160)*(1+2)/4*0.2) -> 49 | F33: =INT(10000*0.1*(100+1)/100*(1+RC[-3]/200)*0.2) -> 208 | G33: 5 | H33: 6 | I33: =R[-1]C+250 -> 11000 | J33: =RC[-1]/35*28 -> 8800 | K33: =RC[-5]*60 -> 12480 | L33: =RC[-3]&"/3600*(nPatrolSec+3)*(1000+nGuanQia)/1000" -> 11000/3600*(nPatrolSec+3)*(1000+nGuanQia)/1000 | M33: =RC[-3]&"/3600*(nPatrolSec+3)*(1000+nGuanQia)/1000" -> 8800/3600*(nPatrolSec+3)*(1000+nGuanQia)/1000 | N33: =RC[-3]&"/3600*(nPatrolSec+3)*(1000+nGuanQia)/1000" -> 12480/3600*(nPatrolSec+3)*(1000+nGuanQia)/1000 | O33: =RC[-6]&"/60*nMin*(1000+nGuanQia)/1000" -> 11000/60*nMin*(1000+nGuanQia)/1000 | P33: =RC[-6]&"/60*nMin*(1000+nGuanQia)/1000" -> 8800/60*nMin*(1000+nGuanQia)/1000 | Q33: =RC[-6]&"/60*nMin*(1000+nGuanQia)/1000" -> 12480/60*nMin*(1000+nGuanQia)/1000 | W33: 0 | X33: =R[-3]C -> 0 | Y33: =RC[-2]+RC[-1] -> 0
B34: 6 | C34: 7 | D34: =INT((RC[-1]*35+200)*(1+2)/4*0.2) -> 66 | E34: =INT((RC[-2]*28+160)*(1+2)/4*0.2) -> 53 | F34: =INT(10000*0.1*(100+1)/100*(1+RC[-3]/200)*0.2) -> 209 | G34: 6 | H34: 7 | I34: =R[-1]C+250 -> 11250 | J34: =RC[-1]/35*28 -> 9000 | K34: =RC[-5]*60 -> 12540 | L34: =RC[-3]&"/3600*(nPatrolSec+3)*(1000+nGuanQia)/1000" -> 11250/3600*(nPatrolSec+3)*(1000+nGuanQia)/1000 | M34: =RC[-3]&"/3600*(nPatrolSec+3)*(1000+nGuanQia)/1000" -> 9000/3600*(nPatrolSec+3)*(1000+nGuanQia)/1000 | N34: =RC[-3]&"/3600*(nPatrolSec+3)*(1000+nGuanQia)/1000" -> 12540/3600*(nPatrolSec+3)*(1000+nGuanQia)/1000 | O34: =RC[-6]&"/60*nMin*(1000+nGuanQia)/1000" -> 11250/60*nMin*(1000+nGuanQia)/1000 | P34: =RC[-6]&"/60*nMin*(1000+nGuanQia)/1000" -> 9000/60*nMin*(1000+nGuanQia)/1000 | Q34: =RC[-6]&"/60*nMin*(1000+nGuanQia)/1000" -> 12540/60*nMin*(1000+nGuanQia)/1000 | W34: 10012 | X34: =R[-3]C -> 20000 | Y34: =RC[-2]+RC[-1] -> 30012
B35: 7 | C35: 8 | D35: =INT((RC[-1]*35+200)*(1+2)/4*0.2) -> 72 | E35: =INT((RC[-2]*28+160)*(1+2)/4*0.2) -> 57 | F35: =INT(10000*0.1*(100+1)/100*(1+RC[-3]/200)*0.2) -> 210 | G35: 7 | H35: 8 | I35: =R[-1]C+250 -> 11500 | J35: =RC[-1]/35*28 -> 9200 | K35: =RC[-5]*60 -> 12600 | L35: =RC[-3]&"/3600*(nPatrolSec+3)*(1000+nGuanQia)/1000" -> 11500/3600*(nPatrolSec+3)*(1000+nGuanQia)/1000 | M35: =RC[-3]&"/3600*(nPatrolSec+3)*(1000+nGuanQia)/1000" -> 9200/3600*(nPatrolSec+3)*(1000+nGuanQia)/1000 | N35: =RC[-3]&"/3600*(nPatrolSec+3)*(1000+nGuanQia)/1000" -> 12600/3600*(nPatrolSec+3)*(1000+nGuanQia)/1000 | O35: =RC[-6]&"/60*nMin*(1000+nGuanQia)/1000" -> 11500/60*nMin*(1000+nGuanQia)/1000 | P35: =RC[-6]&"/60*nMin*(1000+nGuanQia)/1000" -> 9200/60*nMin*(1000+nGuanQia)/1000 | Q35: =RC[-6]&"/60*nMin*(1000+nGuanQia)/1000" -> 12600/60*nMin*(1000+nGuanQia)/1000 | W35: 0 | X35: =R[-3]C -> 0 | Y35: =RC[-2]+RC[-1] -> 0
B36: 8 | C36: 9 | D36: =INT((RC[-1]*35+200)*(1+2)/4*0.2) -> 77 | E36: =INT((RC[-2]*28+160)*(1+2)/4*0.2) -> 61 | F36: =INT(10000*0.1*(100+1)/100*(1+RC[-3]/200)*0.2) -> 211 | G36: 8 | H36: 9 | I36: =R[-1]C+250 -> 11750 | J36: =RC[-1]/35*28 -> 9400 | K36: =RC[-5]*60 -> 12660 | L36: =RC[-3]&"/3600*(nPatrolSec+3)*(1000+nGuanQia)/1000" -> 11750/3600*(nPatrolSec+3)*(1000+nGuanQia)/1000 | M36: =RC[-3]&"/3600*(nPatrolSec+3)*(1000+nGuanQia)/1000" -> 9400/3600*(nPatrolSec+3)*(1000+nGuanQia)/1000 | N36: =RC[-3]&"/3600*(nPatrolSec+3)*(1000+nGuanQia)/1000" -> 12660/3600*(nPatrolSec+3)*(1000+nGuanQia)/1000 | O36: =RC[-6]&"/60*nMin*(1000+nGuanQia)/1000" -> 11750/60*nMin*(1000+nGuanQia)/1000 | P36: =RC[-6]&"/60*nMin*(1000+nGuanQia)/1000" -> 9400/60*nMin*(1000+nGuanQia)/1000 | Q36: =RC[-6]&"/60*nMin*(1000+nGuanQia)/1000" -> 12660/60*nMin*(1000+nGuanQia)/1000 | W36: 0 | X36: =R[-3]C -> 0 | Y36: =RC[-2]+RC[-1] -> 0
B37: 9 | C37: 10 | D37: =INT((RC[-1]*35+200)*(1+2)/4*0.2) -> 82 | E37: =INT((RC[-2]*28+160)*(1+2)/4*0.2) -> 66 | F37: =INT(10000*0.1*(100+1)/100*(1+RC[-3]/200)*0.2) -> 212 | G37: 9 | H37: 10 | I37: =R[-1]C+250 -> 12000 | J37: =RC[-1]/35*28 -> 9600 | K37: =RC[-5]*60 -> 12720 | L37: =RC[-3]&"/3600*(nPatrolSec+3)*(1000+nGuanQia)/1000" -> 12000/3600*(nPatrolSec+3)*(1000+nGuanQia)/1000 | M37: =RC[-3]&"/3600*(nPatrolSec+3)*(1000+nGuanQia)/1000" -> 9600/3600*(nPatrolSec+3)*(1000+nGuanQia)/1000 | N37: =RC[-3]&"/3600*(nPatrolSec+3)*(1000+nGuanQia)/1000" -> 12720/3600*(nPatrolSec+3)*(1000+nGuanQia)/1000 | O37: =RC[-6]&"/60*nMin*(1000+nGuanQia)/1000" -> 12000/60*nMin*(1000+nGuanQia)/1000 | P37: =RC[-6]&"/60*nMin*(1000+nGuanQia)/1000" -> 9600/60*nMin*(1000+nGuanQia)/1000 | Q37: =RC[-6]&"/60*nMin*(1000+nGuanQia)/1000" -> 12720/60*nMin*(1000+nGuanQia)/1000 | W37: 10013 | X37: =R[-3]C -> 20000 | Y37: =RC[-2]+RC[-1] -> 30013
B38: 10 | C38: 11 | D38: =INT((RC[-1]*35+200)*(1+2)/4*0.2) -> 87 | E38: =INT((RC[-2]*28+160)*(1+2)/4*0.2) -> 70 | F38: =INT(10000*0.1*(100+1)/100*(1+RC[-3]/200)*0.2) -> 213 | G38: 10 | H38: 11 | I38: =R[-1]C+250 -> 12250 | J38: =RC[-1]/35*28 -> 9800 | K38: =RC[-5]*60 -> 12780 | L38: =RC[-3]&"/3600*(nPatrolSec+3)*(1000+nGuanQia)/1000" -> 12250/3600*(nPatrolSec+3)*(1000+nGuanQia)/1000 | M38: =RC[-3]&"/3600*(nPatrolSec+3)*(1000+nGuanQia)/1000" -> 9800/3600*(nPatrolSec+3)*(1000+nGuanQia)/1000 | N38: =RC[-3]&"/3600*(nPatrolSec+3)*(1000+nGuanQia)/1000" -> 12780/3600*(nPatrolSec+3)*(1000+nGuanQia)/1000 | O38: =RC[-6]&"/60*nMin*(1000+nGuanQia)/1000" -> 12250/60*nMin*(1000+nGuanQia)/1000 | P38: =RC[-6]&"/60*nMin*(1000+nGuanQia)/1000" -> 9800/60*nMin*(1000+nGuanQia)/1000 | Q38: =RC[-6]&"/60*nMin*(1000+nGuanQia)/1000" -> 12780/60*nMin*(1000+nGuanQia)/1000 | W38: 0 | X38: =R[-3]C -> 0 | Y38: =RC[-2]+RC[-1] -> 0
B39: 11 | C39: 14 | D39: =INT((RC[-1]*35+200)*(1+2)/4*0.2) -> 103 | E39: =INT((RC[-2]*28+160)*(1+2)/4*0.2) -> 82 | F39: =INT(10000*0.1*(100+1)/100*(1+RC[-3]/200)*0.2) -> 216 | G39: 11 | H39: 14 | I39: =R[-1]C+250 -> 12500 | J39: =RC[-1]/35*28 -> 10000 | K39: =RC[-5]*60 -> 12960 | L39: =RC[-3]&"/3600*(nPatrolSec+3)*(1000+nGuanQia)/1000" -> 12500/3600*(nPatrolSec+3)*(1000+nGuanQia)/1000 | M39: =RC[-3]&"/3600*(nPatrolSec+3)*(1000+nGuanQia)/1000" -> 10000/3600*(nPatrolSec+3)*(1000+nGuanQia)/1000 | N39: =RC[-3]&"/3600*(nPatrolSec+3)*(1000+nGuanQia)/1000" -> 12960/3600*(nPatrolSec+3)*(1000+nGuanQia)/1000 | O39: =RC[-6]&"/60*nMin*(1000+nGuanQia)/1000" -> 12500/60*nMin*(1000+nGuanQia)/1000 | P39: =RC[-6]&"/60*nMin*(1000+nGuanQia)/1000" -> 10000/60*nMin*(1000+nGuanQia)/1000 | Q39: =RC[-6]&"/60*nMin*(1000+nGuanQia)/1000" -> 12960/60*nMin*(1000+nGuanQia)/1000 | W39: 0 | X39: =R[-3]C -> 0 | Y39: =RC[-2]+RC[-1] -> 0
B40: 12 | C40: 17 | D40: =INT((RC[-1]*35+200)*(1+2)/4*0.2) -> 119 | E40: =INT((RC[-2]*28+160)*(1+2)/4*0.2) -> 95 | F40: =INT(10000*0.1*(100+1)/100*(1+RC[-3]/200)*0.2) -> 219 | G40: 12 | H40: 17 | I40: =R[-1]C+250 -> 12750 | J40: =RC[-1]/35*28 -> 10200 | K40: =RC[-5]*60 -> 13140 | L40: =RC[-3]&"/3600*(nPatrolSec+3)*(1000+nGuanQia)/1000" -> 12750/3600*(nPatrolSec+3)*(1000+nGuanQia)/1000 | M40: =RC[-3]&"/3600*(nPatrolSec+3)*(1000+nGuanQia)/1000" -> 10200/3600*(nPatrolSec+3)*(1000+nGuanQia)/1000 | N40: =RC[-3]&"/3600*(nPatrolSec+3)*(1000+nGuanQia)/1000" -> 13140/3600*(nPatrolSec+3)*(1000+nGuanQia)/1000 | O40: =RC[-6]&"/60*nMin*(1000+nGuanQia)/1000" -> 12750/60*nMin*(1000+nGuanQia)/1000 | P40: =RC[-6]&"/60*nMin*(1000+nGuanQia)/1000" -> 10200/60*nMin*(1000+nGuanQia)/1000 | Q40: =RC[-6]&"/60*nMin*(1000+nGuanQia)/1000" -> 13140/60*nMin*(1000+nGuanQia)/1000 | W40: 10014 | X40: =R[-3]C -> 20000 | Y40: =RC[-2]+RC[-1] -> 30014
B41: 13 | C41: 20 | D41: =INT((RC[-1]*35+200)*(1+2)/4*0.2) -> 135 | E41: =INT((RC[-2]*28+160)*(1+2)/4*0.2) -> 108 | F41: =INT(10000*0.1*(100+1)/100*(1+RC[-3]/200)*0.2) -> 222 | G41: 13 | H41: 20 | I41: =R[-1]C+250 -> 13000 | J41: =RC[-1]/35*28 -> 10400 | K41: =RC[-5]*60 -> 13320 | L41: =RC[-3]&"/3600*(nPatrolSec+3)*(1000+nGuanQia)/1000" -> 13000/3600*(nPatrolSec+3)*(1000+nGuanQia)/1000 | M41: =RC[-3]&"/3600*(nPatrolSec+3)*(1000+nGuanQia)/1000" -> 10400/3600*(nPatrolSec+3)*(1000+nGuanQia)/1000 | N41: =RC[-3]&"/3600*(nPatrolSec+3)*(1000+nGuanQia)/1000" -> 13320/3600*(nPatrolSec+3)*(1000+nGuanQia)/1000 | O41: =RC[-6]&"/60*nMin*(1000+nGuanQia)/1000" -> 13000/60*nMin*(1000+nGuanQia)/1000 | P41: =RC[-6]&"/60*nMin*(1000+nGuanQia)/1000" -> 10400/60*nMin*(1000+nGuanQia)/1000 | Q41: =RC[-6]&"/60*nMin*(1000+nGuanQia)/1000" -> 13320/60*nMin*(1000+nGuanQia)/1000 | W41: 0 | X41: =R[-3]C -> 0 | Y41: =RC[-2]+RC[-1] -> 0
B42: 14 | C42: 23 | D42: =INT((RC[-1]*35+200)*(1+2)/4*0.2) -> 150 | E42: =INT((RC[-2]*28+160)*(1+2)/4*0.2) -> 120 | F42: =INT(10000*0.1*(100+1)/100*(1+RC[-3]/200)*0.2) -> 225 | G42: 14 | H42: 23 | I42: =R[-1]C+250 -> 13250 | J42: =RC[-1]/35*28 -> 10600 | K42: =RC[-5]*60 -> 13500 | L42: =RC[-3]&"/3600*(nPatrolSec+3)*(1000+nGuanQia)/1000" -> 13250/3600*(nPatrolSec+3)*(1000+nGuanQia)/1000 | M42: =RC[-3]&"/3600*(nPatrolSec+3)*(1000+nGuanQia)/1000" -> 10600/3600*(nPatrolSec+3)*(1000+nGuanQia)/1000 | N42: =RC[-3]&"/3600*(nPatrolSec+3)*(1000+nGuanQia)/1000" -> 13500/3600*(nPatrolSec+3)*(1000+nGuanQia)/1000 | O42: =RC[-6]&"/60*nMin*(1000+nGuanQia)/1000" -> 13250/60*nMin*(1000+nGuanQia)/1000 | P42: =RC[-6]&"/60*nMin*(1000+nGuanQia)/1000" -> 10600/60*nMin*(1000+nGuanQia)/1000 | Q42: =RC[-6]&"/60*nMin*(1000+nGuanQia)/1000" -> 13500/60*nMin*(1000+nGuanQia)/1000 | W42: 0 | X42: =R[-3]C -> 0 | Y42: =RC[-2]+RC[-1] -> 0
B43: 15 | C43: 26 | D43: =INT((RC[-1]*35+200)*(1+2)/4*0.2) -> 166 | E43: =INT((RC[-2]*28+160)*(1+2)/4*0.2) -> 133 | F43: =INT(10000*0.1*(100+1)/100*(1+RC[-3]/200)*0.2) -> 228 | G43: 15 | H43: 26 | I43: =R[-1]C+250 -> 13500 | J43: =RC[-1]/35*28 -> 10800 | K43: =RC[-5]*60 -> 13680 | L43: =RC[-3]&"/3600*(nPatrolSec+3)*(1000+nGuanQia)/1000" -> 13500/3600*(nPatrolSec+3)*(1000+nGuanQia)/1000 | M43: =RC[-3]&"/3600*(nPatrolSec+3)*(1000+nGuanQia)/1000" -> 10800/3600*(nPatrolSec+3)*(1000+nGuanQia)/1000 | N43: =RC[-3]&"/3600*(nPatrolSec+3)*(1000+nGuanQia)/1000" -> 13680/3600*(nPatrolSec+3)*(1000+nGuanQia)/1000 | O43: =RC[-6]&"/60*nMin*(1000+nGuanQia)/1000" -> 13500/60*nMin*(1000+nGuanQia)/1000 | P43: =RC[-6]&"/60*nMin*(1000+nGuanQia)/1000" -> 10800/60*nMin*(1000+nGuanQia)/1000 | Q43: =RC[-6]&"/60*nMin*(1000+nGuanQia)/1000" -> 13680/60*nMin*(1000+nGuanQia)/1000 | W43: 10015 | X43: =R[-3]C -> 20000 | Y43: =RC[-2]+RC[-1] -> 30015
B44: 16 | C44: 29 | D44: =INT((RC[-1]*35+200)*(1+2)/4*0.2) -> 182 | E44: =INT((RC[-2]*28+160)*(1+2)/4*0.2) -> 145 | F44: =INT(10000*0.1*(100+1)/100*(1+RC[-3]/200)*0.2) -> 231 | G44: 16 | H44: 29 | I44: =R[-1]C+250 -> 13750 | J44: =RC[-1]/35*28 -> 11000 | K44: =RC[-5]*60 -> 13860 | L44: =RC[-3]&"/3600*(nPatrolSec+3)*(1000+nGuanQia)/1000" -> 13750/3600*(nPatrolSec+3)*(1000+nGuanQia)/1000 | M44: =RC[-3]&"/3600*(nPatrolSec+3)*(1000+nGuanQia)/1000" -> 11000/3600*(nPatrolSec+3)*(1000+nGuanQia)/1000 | N44: =RC[-3]&"/3600*(nPatrolSec+3)*(1000+nGuanQia)/1000" -> 13860/3600*(nPatrolSec+3)*(1000+nGuanQia)/1000 | O44: =RC[-6]&"/60*nMin*(1000+nGuanQia)/1000" -> 13750/60*nMin*(1000+nGuanQia)/1000 | P44: =RC[-6]&"/60*nMin*(1000+nGuanQia)/1000" -> 11000/60*nMin*(1000+nGuanQia)/1000 | Q44: =RC[-6]&"/60*nMin*(1000+nGuanQia)/1000" -> 13860/60*nMin*(1000+nGuanQia)/1000 | W44: 0 | X44: =R[-3]C -> 0 | Y44: =RC[-2]+RC[-1] -> 0
B45: 17 | C45: 32 | D45: =INT((RC[-1]*35+200)*(1+2)/4*0.2) -> 198 | E45: =INT((RC[-2]*28+160)*(1+2)/4*0.2) -> 158 | F45: =INT(10000*0.1*(100+1)/100*(1+RC[-3]/200)*0.2) -> 234 | G45: 17 | H45: 32 | I45: =R[-1]C+250 -> 14000 | J45: =RC[-1]/35*28 -> 11200 | K45: =RC[-5]*60 -> 14040 | L45: =RC[-3]&"/3600*(nPatrolSec+3)*(1000+nGuanQia)/1000" -> 14000/3600*(nPatrolSec+3)*(1000+nGuanQia)/1000 | M45: =RC[-3]&"/3600*(nPatrolSec+3)*(1000+nGuanQia)/1000" -> 11200/3600*(nPatrolSec+3)*(1000+nGuanQia)/1000 | N45: =RC[-3]&"/3600*(nPatrolSec+3)*(1000+nGuanQia)/1000" -> 14040/3600*(nPatrolSec+3)*(1000+nGuanQia)/1000 | O45: =RC[-6]&"/60*nMin*(1000+nGuanQia)/1000" -> 14000/60*nMin*(1000+nGuanQia)/1000 | P45: =RC[-6]&"/60*nMin*(1000+nGuanQia)/1000" -> 11200/60*nMin*(1000+nGuanQia)/1000 | Q45: =RC[-6]&"/60*nMin*(1000+nGuanQia)/1000" -> 14040/60*nMin*(1000+nGuanQia)/1000 | W45: 0 | X45: =R[-3]C -> 0 | Y45: =RC[-2]+RC[-1] -> 0
B46: 18 | C46: 35 | D46: =INT((RC[-1]*35+200)*(1+2)/4*0.2) -> 213 | E46: =INT((RC[-2]*28+160)*(1+2)/4*0.2) -> 171 | F46: =INT(10000*0.1*(100+1)/100*(1+RC[-3]/200)*0.2) -> 237 | G46: 18 | H46: 35 | I46: =R[-1]C+250 -> 14250 | J46: =RC[-1]/35*28 -> 11400 | K46: =RC[-5]*60 -> 14220 | L46: =RC[-3]&"/3600*(nPatrolSec+3)*(1000+nGuanQia)/1000" -> 14250/3600*(nPatrolSec+3)*(1000+nGuanQia)/1000 | M46: =RC[-3]&"/3600*(nPatrolSec+3)*(1000+nGuanQia)/1000" -> 11400/3600*(nPatrolSec+3)*(1000+nGuanQia)/1000 | N46: =RC[-3]&"/3600*(nPatrolSec+3)*(1000+nGuanQia)/1000" -> 14220/3600*(nPatrolSec+3)*(1000+nGuanQia)/1000 | O46: =RC[-6]&"/60*nMin*(1000+nGuanQia)/1000" -> 14250/60*nMin*(1000+nGuanQia)/1000 | P46: =RC[-6]&"/60*nMin*(1000+nGuanQia)/1000" -> 11400/60*nMin*(1000+nGuanQia)/1000 | Q46: =RC[-6]&"/60*nMin*(1000+nGuanQia)/1000" -> 14220/60*nMin*(1000+nGuanQia)/1000 | W46: 10016 | X46: =R[-3]C -> 20000 | Y46: =RC[-2]+RC[-1] -> 30016
B47: 19 | C47: 38 | D47: =INT((RC[-1]*35+200)*(1+2)/4*0.2) -> 229 | E47: =INT((RC[-2]*28+160)*(1+2)/4*0.2) -> 183 | F47: =INT(10000*0.1*(100+1)/100*(1+RC[-3]/200)*0.2) -> 240 | G47: 19 | H47: 38 | I47: =R[-1]C+250 -> 14500 | J47: =RC[-1]/35*28 -> 11600 | K47: =RC[-5]*60 -> 14400 | L47: =RC[-3]&"/3600*(nPatrolSec+3)*(1000+nGuanQia)/1000" -> 14500/3600*(nPatrolSec+3)*(1000+nGuanQia)/1000 | M47: =RC[-3]&"/3600*(nPatrolSec+3)*(1000+nGuanQia)/1000" -> 11600/3600*(nPatrolSec+3)*(1000+nGuanQia)/1000 | N47: =RC[-3]&"/3600*(nPatrolSec+3)*(1000+nGuanQia)/1000" -> 14400/3600*(nPatrolSec+3)*(1000+nGuanQia)/1000 | O47: =RC[-6]&"/60*nMin*(1000+nGuanQia)/1000" -> 14500/60*nMin*(1000+nGuanQia)/1000 | P47: =RC[-6]&"/60*nMin*(1000+nGuanQia)/1000" -> 11600/60*nMin*(1000+nGuanQia)/1000 | Q47: =RC[-6]&"/60*nMin*(1000+nGuanQia)/1000" -> 14400/60*nMin*(1000+nGuanQia)/1000 | W47: 0 | X47: =R[-3]C -> 0 | Y47: =RC[-2]+RC[-1] -> 0
B48: 20 | C48: 40 | D48: =INT((RC[-1]*35+200)*(1+2)/4*0.2) -> 240 | E48: =INT((RC[-2]*28+160)*(1+2)/4*0.2) -> 192 | F48: =INT(10000*0.1*(100+1)/100*(1+RC[-3]/200)*0.2) -> 242 | G48: 20 | H48: 40 | I48: =R[-1]C+250 -> 14750 | J48: =RC[-1]/35*28 -> 11800 | K48: =RC[-5]*60 -> 14520 | L48: =RC[-3]&"/3600*(nPatrolSec+3)*(1000+nGuanQia)/1000" -> 14750/3600*(nPatrolSec+3)*(1000+nGuanQia)/1000 | M48: =RC[-3]&"/3600*(nPatrolSec+3)*(1000+nGuanQia)/1000" -> 11800/3600*(nPatrolSec+3)*(1000+nGuanQia)/1000 | N48: =RC[-3]&"/3600*(nPatrolSec+3)*(1000+nGuanQia)/1000" -> 14520/3600*(nPatrolSec+3)*(1000+nGuanQia)/1000 | O48: =RC[-6]&"/60*nMin*(1000+nGuanQia)/1000" -> 14750/60*nMin*(1000+nGuanQia)/1000 | P48: =RC[-6]&"/60*nMin*(1000+nGuanQia)/1000" -> 11800/60*nMin*(1000+nGuanQia)/1000 | Q48: =RC[-6]&"/60*nMin*(1000+nGuanQia)/1000" -> 14520/60*nMin*(1000+nGuanQia)/1000 | W48: 0 | X48: =R[-3]C -> 0 | Y48: =RC[-2]+RC[-1] -> 0
B49: 21 | C49: 41 | D49: =INT((RC[-1]*35+200)*(1+2)/4*0.2) -> 245 | E49: =INT((RC[-2]*28+160)*(1+2)/4*0.2) -> 196 | F49: =INT(10000*0.1*(100+1)/100*(1+RC[-3]/200)*0.2) -> 243 | G49: 21 | H49: 41 | I49: =R[-1]C+250 -> 15000 | J49: =RC[-1]/35*28 -> 12000 | K49: =RC[-5]*60 -> 14580 | L49: =RC[-3]&"/3600*(nPatrolSec+3)*(1000+nGuanQia)/1000" -> 15000/3600*(nPatrolSec+3)*(1000+nGuanQia)/1000 | M49: =RC[-3]&"/3600*(nPatrolSec+3)*(1000+nGuanQia)/1000" -> 12000/3600*(nPatrolSec+3)*(1000+nGuanQia)/1000 | N49: =RC[-3]&"/3600*(nPatrolSec+3)*(1000+nGuanQia)/1000" -> 14580/3600*(nPatrolSec+3)*(1000+nGuanQia)/1000 | O49: =RC[-6]&"/60*nMin*(1000+nGuanQia)/1000" -> 15000/60*nMin*(1000+nGuanQia)/1000 | P49: =RC[-6]&"/60*nMin*(1000+nGuanQia)/1000" -> 12000/60*nMin*(1000+nGuanQia)/1000 | Q49: =RC[-6]&"/60*nMin*(1000+nGuanQia)/1000" -> 14580/60*nMin*(1000+nGuanQia)/1000 | W49: 10017 | X49: =R[-3]C -> 20000 | Y49: =RC[-2]+RC[-1] -> 30017
B50: 22 | C50: 42 | D50: =INT((RC[-1]*35+200)*(1+2)/4*0.2) -> 250 | E50: =INT((RC[-2]*28+160)*(1+2)/4*0.2) -> 200 | F50: =INT(10000*0.1*(100+1)/100*(1+RC[-3]/200)*0.2) -> 244 | G50: 22 | H50: 42 | I50: =R[-1]C+250 -> 15250 | J50: =RC[-1]/35*28 -> 12200 | K50: =RC[-5]*60 -> 14640 | L50: =RC[-3]&"/3600*(nPatrolSec+3)*(1000+nGuanQia)/1000" -> 15250/3600*(nPatrolSec+3)*(1000+nGuanQia)/1000 | M50: =RC[-3]&"/3600*(nPatrolSec+3)*(1000+nGuanQia)/1000" -> 12200/3600*(nPatrolSec+3)*(1000+nGuanQia)/1000 | N50: =RC[-3]&"/3600*(nPatrolSec+3)*(1000+nGuanQia)/1000" -> 14640/3600*(nPatrolSec+3)*(1000+nGuanQia)/1000 | O50: =RC[-6]&"/60*nMin*(1000+nGuanQia)/1000" -> 15250/60*nMin*(1000+nGuanQia)/1000 | P50: =RC[-6]&"/60*nMin*(1000+nGuanQia)/1000" -> 12200/60*nMin*(1000+nGuanQia)/1000 | Q50: =RC[-6]&"/60*nMin*(1000+nGuanQia)/1000" -> 14640/60*nMin*(1000+nGuanQia)/1000 | W50: 0 | X50: =R[-3]C -> 0 | Y50: =RC[-2]+RC[-1] -> 0
B51: 23 | C51: 43 | D51: =INT((RC[-1]*35+200)*(1+2)/4*0.2) -> 255 | E51: =INT((RC[-2]*28+160)*(1+2)/4*0.2) -> 204 | F51: =INT(10000*0.1*(100+1)/100*(1+RC[-3]/200)*0.2) -> 245 | G51: 23 | H51: 43 | I51: =R[-1]C+250 -> 15500 | J51: =RC[-1]/35*28 -> 12400 | K51: =RC[-5]*60 -> 14700 | L51: =RC[-3]&"/3600*(nPatrolSec+3)*(1000+nGuanQia)/1000" -> 15500/3600*(nPatrolSec+3)*(1000+nGuanQia)/1000 | M51: =RC[-3]&"/3600*(nPatrolSec+3)*(1000+nGuanQia)/1000" -> 12400/3600*(nPatrolSec+3)*(1000+nGuanQia)/1000 | N51: =RC[-3]&"/3600*(nPatrolSec+3)*(1000+nGuanQia)/1000" -> 14700/3600*(nPatrolSec+3)*(1000+nGuanQia)/1000 | O51: =RC[-6]&"/60*nMin*(1000+nGuanQia)/1000" -> 15500/60*nMin*(1000+nGuanQia)/1000 | P51: =RC[-6]&"/60*nMin*(1000+nGuanQia)/1000" -> 12400/60*nMin*(1000+nGuanQia)/1000 | Q51: =RC[-6]&"/60*nMin*(1000+nGuanQia)/1000" -> 14700/60*nMin*(1000+nGuanQia)/1000 | W51: 0 | X51: =R[-3]C -> 0 | Y51: =RC[-2]+RC[-1] -> 0
B52: 24 | C52: 44 | D52: =INT((RC[-1]*35+200)*(1+2)/4*0.2) -> 261 | E52: =INT((RC[-2]*28+160)*(1+2)/4*0.2) -> 208 | F52: =INT(10000*0.1*(100+1)/100*(1+RC[-3]/200)*0.2) -> 246 | G52: 24 | H52: 44 | I52: =R[-1]C+250 -> 15750 | J52: =RC[-1]/35*28 -> 12600 | K52: =RC[-5]*60 -> 14760 | L52: =RC[-3]&"/3600*(nPatrolSec+3)*(1000+nGuanQia)/1000" -> 15750/3600*(nPatrolSec+3)*(1000+nGuanQia)/1000 | M52: =RC[-3]&"/3600*(nPatrolSec+3)*(1000+nGuanQia)/1000" -> 12600/3600*(nPatrolSec+3)*(1000+nGuanQia)/1000 | N52: =RC[-3]&"/3600*(nPatrolSec+3)*(1000+nGuanQia)/1000" -> 14760/3600*(nPatrolSec+3)*(1000+nGuanQia)/1000 | O52: =RC[-6]&"/60*nMin*(1000+nGuanQia)/1000" -> 15750/60*nMin*(1000+nGuanQia)/1000 | P52: =RC[-6]&"/60*nMin*(1000+nGuanQia)/1000" -> 12600/60*nMin*(1000+nGuanQia)/1000 | Q52: =RC[-6]&"/60*nMin*(1000+nGuanQia)/1000" -> 14760/60*nMin*(1000+nGuanQia)/1000 | W52: 10018 | X52: =R[-3]C -> 20000 | Y52: =RC[-2]+RC[-1] -> 30018
B53: 25 | C53: 45 | D53: =INT((RC[-1]*35+200)*(1+2)/4*0.2) -> 266 | E53: =INT((RC[-2]*28+160)*(1+2)/4*0.2) -> 213 | F53: =INT(10000*0.1*(100+1)/100*(1+RC[-3]/200)*0.2) -> 247 | G53: 25 | H53: 45 | I53: =R[-1]C+250 -> 16000 | J53: =RC[-1]/35*28 -> 12800 | K53: =RC[-5]*60 -> 14820 | L53: =RC[-3]&"/3600*(nPatrolSec+3)*(1000+nGuanQia)/1000" -> 16000/3600*(nPatrolSec+3)*(1000+nGuanQia)/1000 | M53: =RC[-3]&"/3600*(nPatrolSec+3)*(1000+nGuanQia)/1000" -> 12800/3600*(nPatrolSec+3)*(1000+nGuanQia)/1000 | N53: =RC[-3]&"/3600*(nPatrolSec+3)*(1000+nGuanQia)/1000" -> 14820/3600*(nPatrolSec+3)*(1000+nGuanQia)/1000 | O53: =RC[-6]&"/60*nMin*(1000+nGuanQia)/1000" -> 16000/60*nMin*(1000+nGuanQia)/1000 | P53: =RC[-6]&"/60*nMin*(1000+nGuanQia)/1000" -> 12800/60*nMin*(1000+nGuanQia)/1000 | Q53: =RC[-6]&"/60*nMin*(1000+nGuanQia)/1000" -> 14820/60*nMin*(1000+nGuanQia)/1000 | W53: 0 | X53: =R[-3]C -> 0 | Y53: =RC[-2]+RC[-1] -> 0
B54: 26 | C54: 46 | D54: =INT((RC[-1]*35+200)*(1+2)/4*0.2) -> 271 | E54: =INT((RC[-2]*28+160)*(1+2)/4*0.2) -> 217 | F54: =INT(10000*0.1*(100+1)/100*(1+RC[-3]/200)*0.2) -> 248 | G54: 26 | H54: 46 | I54: =R[-1]C+250 -> 16250 | J54: =RC[-1]/35*28 -> 13000 | K54: =RC[-5]*60 -> 14880 | L54: =RC[-3]&"/3600*(nPatrolSec+3)*(1000+nGuanQia)/1000" -> 16250/3600*(nPatrolSec+3)*(1000+nGuanQia)/1000 | M54: =RC[-3]&"/3600*(nPatrolSec+3)*(1000+nGuanQia)/1000" -> 13000/3600*(nPatrolSec+3)*(1000+nGuanQia)/1000 | N54: =RC[-3]&"/3600*(nPatrolSec+3)*(1000+nGuanQia)/1000" -> 14880/3600*(nPatrolSec+3)*(1000+nGuanQia)/1000 | O54: =RC[-6]&"/60*nMin*(1000+nGuanQia)/1000" -> 16250/60*nMin*(1000+nGuanQia)/1000 | P54: =RC[-6]&"/60*nMin*(1000+nGuanQia)/1000" -> 13000/60*nMin*(1000+nGuanQia)/1000 | Q54: =RC[-6]&"/60*nMin*(1000+nGuanQia)/1000" -> 14880/60*nMin*(1000+nGuanQia)/1000 | W54: 0 | X54: =R[-3]C -> 0 | Y54: =RC[-2]+RC[-1] -> 0
B55: 27 | C55: 47 | D55: =INT((RC[-1]*35+200)*(1+2)/4*0.2) -> 276 | E55: =INT((RC[-2]*28+160)*(1+2)/4*0.2) -> 221 | F55: =INT(10000*0.1*(100+1)/100*(1+RC[-3]/200)*0.2) -> 249 | G55: 27 | H55: 47 | I55: =R[-1]C+250 -> 16500 | J55: =RC[-1]/35*28 -> 13200 | K55: =RC[-5]*60 -> 14940 | L55: =RC[-3]&"/3600*(nPatrolSec+3)*(1000+nGuanQia)/1000" -> 16500/3600*(nPatrolSec+3)*(1000+nGuanQia)/1000 | M55: =RC[-3]&"/3600*(nPatrolSec+3)*(1000+nGuanQia)/1000" -> 13200/3600*(nPatrolSec+3)*(1000+nGuanQia)/1000 | N55: =RC[-3]&"/3600*(nPatrolSec+3)*(1000+nGuanQia)/1000" -> 14940/3600*(nPatrolSec+3)*(1000+nGuanQia)/1000 | O55: =RC[-6]&"/60*nMin*(1000+nGuanQia)/1000" -> 16500/60*nMin*(1000+nGuanQia)/1000 | P55: =RC[-6]&"/60*nMin*(1000+nGuanQia)/1000" -> 13200/60*nMin*(1000+nGuanQia)/1000 | Q55: =RC[-6]&"/60*nMin*(1000+nGuanQia)/1000" -> 14940/60*nMin*(1000+nGuanQia)/1000 | W55: 10019 | X55: =R[-3]C -> 20000 | Y55: =RC[-2]+RC[-1] -> 30019
B56: 28 | C56: 48 | D56: =INT((RC[-1]*35+200)*(1+2)/4*0.2) -> 282 | E56: =INT((RC[-2]*28+160)*(1+2)/4*0.2) -> 225 | F56: =INT(10000*0.1*(100+1)/100*(1+RC[-3]/200)*0.2) -> 250 | G56: 28 | H56: 48 | I56: =R[-1]C+250 -> 16750 | J56: =RC[-1]/35*28 -> 13400 | K56: =RC[-5]*60 -> 15000 | L56: =RC[-3]&"/3600*(nPatrolSec+3)*(1000+nGuanQia)/1000" -> 16750/3600*(nPatrolSec+3)*(1000+nGuanQia)/1000 | M56: =RC[-3]&"/3600*(nPatrolSec+3)*(1000+nGuanQia)/1000" -> 13400/3600*(nPatrolSec+3)*(1000+nGuanQia)/1000 | N56: =RC[-3]&"/3600*(nPatrolSec+3)*(1000+nGuanQia)/1000" -> 15000/3600*(nPatrolSec+3)*(1000+nGuanQia)/1000 | O56: =RC[-6]&"/60*nMin*(1000+nGuanQia)/1000" -> 16750/60*nMin*(1000+nGuanQia)/1000 | P56: =RC[-6]&"/60*nMin*(1000+nGuanQia)/1000" -> 13400/60*nMin*(1000+nGuanQia)/1000 | Q56: =RC[-6]&"/60*nMin*(1000+nGuanQia)/1000" -> 15000/60*nMin*(1000+nGuanQia)/1000 | W56: 0 | X56: =R[-3]C -> 0 | Y56: =RC[-2]+RC[-1] -> 0
B57: 29 | C57: 49 | D57: =INT((RC[-1]*35+200)*(1+2)/4*0.2) -> 287 | E57: =INT((RC[-2]*28+160)*(1+2)/4*0.2) -> 229 | F57: =INT(10000*0.1*(100+1)/100*(1+RC[-3]/200)*0.2) -> 251 | G57: 29 | H57: 49 | I57: =R[-1]C+250 -> 17000 | J57: =RC[-1]/35*28 -> 13600 | K57: =RC[-5]*60 -> 15060 | L57: =RC[-3]&"/3600*(nPatrolSec+3)*(1000+nGuanQia)/1000" -> 17000/3600*(nPatrolSec+3)*(1000+nGuanQia)/1000 | M57: =RC[-3]&"/3600*(nPatrolSec+3)*(1000+nGuanQia)/1000" -> 13600/3600*(nPatrolSec+3)*(1000+nGuanQia)/1000 | N57: =RC[-3]&"/3600*(nPatrolSec+3)*(1000+nGuanQia)/1000" -> 15060/3600*(nPatrolSec+3)*(1000+nGuanQia)/1000 | O57: =RC[-6]&"/60*nMin*(1000+nGuanQia)/1000" -> 17000/60*nMin*(1000+nGuanQia)/1000 | P57: =RC[-6]&"/60*nMin*(1000+nGuanQia)/1000" -> 13600/60*nMin*(1000+nGuanQia)/1000 | Q57: =RC[-6]&"/60*nMin*(1000+nGuanQia)/1000" -> 15060/60*nMin*(1000+nGuanQia)/1000 | W57: 0 | X57: =R[-3]C -> 0 | Y57: =RC[-2]+RC[-1] -> 0
B58: 30 | C58: 50 | D58: =INT((RC[-1]*35+200)*(1+2)/4*0.2) -> 292 | E58: =INT((RC[-2]*28+160)*(1+2)/4*0.2) -> 234 | F58: =INT(10000*0.1*(100+1)/100*(1+RC[-3]/200)*0.2) -> 252 | G58: 30 | H58: 50 | I58: =R[-1]C+250 -> 17250 | J58: =RC[-1]/35*28 -> 13800 | K58: =RC[-5]*60 -> 15120 | L58: =RC[-3]&"/3600*(nPatrolSec+3)*(1000+nGuanQia)/1000" -> 17250/3600*(nPatrolSec+3)*(1000+nGuanQia)/1000 | M58: =RC[-3]&"/3600*(nPatrolSec+3)*(1000+nGuanQia)/1000" -> 13800/3600*(nPatrolSec+3)*(1000+nGuanQia)/1000 | N58: =RC[-3]&"/3600*(nPatrolSec+3)*(1000+nGuanQia)/1000" -> 15120/3600*(nPatrolSec+3)*(1000+nGuanQia)/1000 | O58: =RC[-6]&"/60*nMin*(1000+nGuanQia)/1000" -> 17250/60*nMin*(1000+nGuanQia)/1000 | P58: =RC[-6]&"/60*nMin*(1000+nGuanQia)/1000" -> 13800/60*nMin*(1000+nGuanQia)/1000 | Q58: =RC[-6]&"/60*nMin*(1000+nGuanQia)/1000" -> 15120/60*nMin*(1000+nGuanQia)/1000 | W58: 10020 | X58: =R[-3]C -> 20000 | Y58: =RC[-2]+RC[-1] -> 30020
B59: 31 | C59: 51 | D59: =INT((RC[-1]*35+200)*(1+2)/4*0.2) -> 297 | E59: =INT((RC[-2]*28+160)*(1+2)/4*0.2) -> 238 | F59: =INT(10000*0.1*(100+1)/100*(1+RC[-3]/200)*0.2) -> 253 | G59: 31 | H59: 51 | I59: =R[-1]C+250 -> 17500 | J59: =RC[-1]/35*28 -> 14000 | K59: =RC[-5]*60 -> 15180 | L59: =RC[-3]&"/3600*(nPatrolSec+3)*(1000+nGuanQia)/1000" -> 17500/3600*(nPatrolSec+3)*(1000+nGuanQia)/1000 | M59: =RC[-3]&"/3600*(nPatrolSec+3)*(1000+nGuanQia)/1000" -> 14000/3600*(nPatrolSec+3)*(1000+nGuanQia)/1000 | N59: =RC[-3]&"/3600*(nPatrolSec+3)*(1000+nGuanQia)/1000" -> 15180/3600*(nPatrolSec+3)*(1000+nGuanQia)/1000 | O59: =RC[-6]&"/60*nMin*(1000+nGuanQia)/1000" -> 17500/60*nMin*(1000+nGuanQia)/1000 | P59: =RC[-6]&"/60*nMin*(1000+nGuanQia)/1000" -> 14000/60*nMin*(1000+nGuanQia)/1000 | Q59: =RC[-6]&"/60*nMin*(1000+nGuanQia)/1000" -> 15180/60*nMin*(1000+nGuanQia)/1000 | W59: 0 | X59: =R[-3]C -> 0 | Y59: =RC[-2]+RC[-1] -> 0
B60: 32 | C60: 52 | D60: =INT((RC[-1]*35+200)*(1+2)/4*0.2) -> 303 | E60: =INT((RC[-2]*28+160)*(1+2)/4*0.2) -> 242 | F60: =INT(10000*0.1*(100+1)/100*(1+RC[-3]/200)*0.2) -> 254 | G60: 32 | H60: 52 | I60: =R[-1]C+250 -> 17750 | J60: =RC[-1]/35*28 -> 14200 | K60: =RC[-5]*60 -> 15240 | L60: =RC[-3]&"/3600*(nPatrolSec+3)*(1000+nGuanQia)/1000" -> 17750/3600*(nPatrolSec+3)*(1000+nGuanQia)/1000 | M60: =RC[-3]&"/3600*(nPatrolSec+3)*(1000+nGuanQia)/1000" -> 14200/3600*(nPatrolSec+3)*(1000+nGuanQia)/1000 | N60: =RC[-3]&"/3600*(nPatrolSec+3)*(1000+nGuanQia)/1000" -> 15240/3600*(nPatrolSec+3)*(1000+nGuanQia)/1000 | O60: =RC[-6]&"/60*nMin*(1000+nGuanQia)/1000" -> 17750/60*nMin*(1000+nGuanQia)/1000 | P60: =RC[-6]&"/60*nMin*(1000+nGuanQia)/1000" -> 14200/60*nMin*(1000+nGuanQia)/1000 | Q60: =RC[-6]&"/60*nMin*(1000+nGuanQia)/1000" -> 15240/60*nMin*(1000+nGuanQia)/1000 | W60: 0 | X60: =R[-3]C -> 0 | Y60: =RC[-2]+RC[-1] -> 0
B61: 33 | C61: 53 | D61: =INT((RC[-1]*35+200)*(1+2)/4*0.2) -> 308 | E61: =INT((RC[-2]*28+160)*(1+2)/4*0.2) -> 246 | F61: =INT(10000*0.1*(100+1)/100*(1+RC[-3]/200)*0.2) -> 255 | G61: 33 | H61: 53 | I61: =R[-1]C+250 -> 18000 | J61: =RC[-1]/35*28 -> 14400.000000000002 | K61: =RC[-5]*60 -> 15300 | L61: =RC[-3]&"/3600*(nPatrolSec+3)*(1000+nGuanQia)/1000" -> 18000/3600*(nPatrolSec+3)*(1000+nGuanQia)/1000 | M61: =RC[-3]&"/3600*(nPatrolSec+3)*(1000+nGuanQia)/1000" -> 14400/3600*(nPatrolSec+3)*(1000+nGuanQia)/1000 | N61: =RC[-3]&"/3600*(nPatrolSec+3)*(1000+nGuanQia)/1000" -> 15300/3600*(nPatrolSec+3)*(1000+nGuanQia)/1000 | O61: =RC[-6]&"/60*nMin*(1000+nGuanQia)/1000" -> 18000/60*nMin*(1000+nGuanQia)/1000 | P61: =RC[-6]&"/60*nMin*(1000+nGuanQia)/1000" -> 14400/60*nMin*(1000+nGuanQia)/1000 | Q61: =RC[-6]&"/60*nMin*(1000+nGuanQia)/1000" -> 15300/60*nMin*(1000+nGuanQia)/1000 | W61: 10021 | X61: =R[-3]C -> 20000 | Y61: =RC[-2]+RC[-1] -> 30021
B62: 34 | C62: 54 | D62: =INT((RC[-1]*35+200)*(1+2)/4*0.2) -> 313 | E62: =INT((RC[-2]*28+160)*(1+2)/4*0.2) -> 250 | F62: =INT(10000*0.1*(100+1)/100*(1+RC[-3]/200)*0.2) -> 256 | G62: 34 | H62: 54 | I62: =R[-1]C+250 -> 18250 | J62: =RC[-1]/35*28 -> 14600 | K62: =RC[-5]*60 -> 15360 | L62: =RC[-3]&"/3600*(nPatrolSec+3)*(1000+nGuanQia)/1000" -> 18250/3600*(nPatrolSec+3)*(1000+nGuanQia)/1000 | M62: =RC[-3]&"/3600*(nPatrolSec+3)*(1000+nGuanQia)/1000" -> 14600/3600*(nPatrolSec+3)*(1000+nGuanQia)/1000 | N62: =RC[-3]&"/3600*(nPatrolSec+3)*(1000+nGuanQia)/1000" -> 15360/3600*(nPatrolSec+3)*(1000+nGuanQia)/1000 | O62: =RC[-6]&"/60*nMin*(1000+nGuanQia)/1000" -> 18250/60*nMin*(1000+nGuanQia)/1000 | P62: =RC[-6]&"/60*nMin*(1000+nGuanQia)/1000" -> 14600/60*nMin*(1000+nGuanQia)/1000 | Q62: =RC[-6]&"/60*nMin*(1000+nGuanQia)/1000" -> 15360/60*nMin*(1000+nGuanQia)/1000 | W62: 0 | X62: =R[-3]C -> 0 | Y62: =RC[-2]+RC[-1] -> 0
B63: 35 | C63: 55 | D63: =INT((RC[-1]*35+200)*(1+2)/4*0.2) -> 318 | E63: =INT((RC[-2]*28+160)*(1+2)/4*0.2) -> 255 | F63: =INT(10000*0.1*(100+1)/100*(1+RC[-3]/200)*0.2) -> 257 | G63: 35 | H63: 55 | I63: =R[-1]C+250 -> 18500 | J63: =RC[-1]/35*28 -> 14800 | K63: =RC[-5]*60 -> 15420 | L63: =RC[-3]&"/3600*(nPatrolSec+3)*(1000+nGuanQia)/1000" -> 18500/3600*(nPatrolSec+3)*(1000+nGuanQia)/1000 | M63: =RC[-3]&"/3600*(nPatrolSec+3)*(1000+nGuanQia)/1000" -> 14800/3600*(nPatrolSec+3)*(1000+nGuanQia)/1000 | N63: =RC[-3]&"/3600*(nPatrolSec+3)*(1000+nGuanQia)/1000" -> 15420/3600*(nPatrolSec+3)*(1000+nGuanQia)/1000 | O63: =RC[-6]&"/60*nMin*(1000+nGuanQia)/1000" -> 18500/60*nMin*(1000+nGuanQia)/1000 | P63: =RC[-6]&"/60*nMin*(1000+nGuanQia)/1000" -> 14800/60*nMin*(1000+nGuanQia)/1000 | Q63: =RC[-6]&"/60*nMin*(1000+nGuanQia)/1000" -> 15420/60*nMin*(1000+nGuanQia)/1000 | W63: 0 | X63: =R[-3]C -> 0 | Y63: =RC[-2]+RC[-1] -> 0
B64: 36 | C64: 56 | D64: =INT((RC[-1]*35+200)*(1+2)/4*0.2) -> 324 | E64: =INT((RC[-2]*28+160)*(1+2)/4*0.2) -> 259 | F64: =INT(10000*0.1*(100+1)/100*(1+RC[-3]/200)*0.2) -> 258 | G64: 36 | H64: 56 | I64: =R[-1]C+250 -> 18750 | J64: =RC[-1]/35*28 -> 14999.999999999998 | K64: =RC[-5]*60 -> 15480 | L64: =RC[-3]&"/3600*(nPatrolSec+3)*(1000+nGuanQia)/1000" -> 18750/3600*(nPatrolSec+3)*(1000+nGuanQia)/1000 | M64: =RC[-3]&"/3600*(nPatrolSec+3)*(1000+nGuanQia)/1000" -> 15000/3600*(nPatrolSec+3)*(1000+nGuanQia)/1000 | N64: =RC[-3]&"/3600*(nPatrolSec+3)*(1000+nGuanQia)/1000" -> 15480/3600*(nPatrolSec+3)*(1000+nGuanQia)/1000 | O64: =RC[-6]&"/60*nMin*(1000+nGuanQia)/1000" -> 18750/60*nMin*(1000+nGuanQia)/1000 | P64: =RC[-6]&"/60*nMin*(1000+nGuanQia)/1000" -> 15000/60*nMin*(1000+nGuanQia)/1000 | Q64: =RC[-6]&"/60*nMin*(1000+nGuanQia)/1000" -> 15480/60*nMin*(1000+nGuanQia)/1000 | W64: 10022 | X64: =R[-3]C -> 20000 | Y64: =RC[-2]+RC[-1] -> 30022
B65: 37 | C65: 57 | D65: =INT((RC[-1]*35+200)*(1+2)/4*0.2) -> 329 | E65: =INT((RC[-2]*28+160)*(1+2)/4*0.2) -> 263 | F65: =INT(10000*0.1*(100+1)/100*(1+RC[-3]/200)*0.2) -> 259 | G65: 37 | H65: 57 | I65: =R[-1]C+250 -> 19000 | J65: =RC[-1]/35*28 -> 15200 | K65: =RC[-5]*60 -> 15540 | L65: =RC[-3]&"/3600*(nPatrolSec+3)*(1000+nGuanQia)/1000" -> 19000/3600*(nPatrolSec+3)*(1000+nGuanQia)/1000 | M65: =RC[-3]&"/3600*(nPatrolSec+3)*(1000+nGuanQia)/1000" -> 15200/3600*(nPatrolSec+3)*(1000+nGuanQia)/1000 | N65: =RC[-3]&"/3600*(nPatrolSec+3)*(1000+nGuanQia)/1000" -> 15540/3600*(nPatrolSec+3)*(1000+nGuanQia)/1000 | O65: =RC[-6]&"/60*nMin*(1000+nGuanQia)/1000" -> 19000/60*nMin*(1000+nGuanQia)/1000 | P65: =RC[-6]&"/60*nMin*(1000+nGuanQia)/1000" -> 15200/60*nMin*(1000+nGuanQia)/1000 | Q65: =RC[-6]&"/60*nMin*(1000+nGuanQia)/1000" -> 15540/60*nMin*(1000+nGuanQia)/1000 | W65: 0 | X65: =R[-3]C -> 0 | Y65: =RC[-2]+RC[-1] -> 0
B66: 38 | C66: 58 | D66: =INT((RC[-1]*35+200)*(1+2)/4*0.2) -> 334 | E66: =INT((RC[-2]*28+160)*(1+2)/4*0.2) -> 267 | F66: =INT(10000*0.1*(100+1)/100*(1+RC[-3]/200)*0.2) -> 260 | G66: 38 | H66: 58 | I66: =R[-1]C+250 -> 19250 | J66: =RC[-1]/35*28 -> 15400 | K66: =RC[-5]*60 -> 15600 | L66: =RC[-3]&"/3600*(nPatrolSec+3)*(1000+nGuanQia)/1000" -> 19250/3600*(nPatrolSec+3)*(1000+nGuanQia)/1000 | M66: =RC[-3]&"/3600*(nPatrolSec+3)*(1000+nGuanQia)/1000" -> 15400/3600*(nPatrolSec+3)*(1000+nGuanQia)/1000 | N66: =RC[-3]&"/3600*(nPatrolSec+3)*(1000+nGuanQia)/1000" -> 15600/3600*(nPatrolSec+3)*(1000+nGuanQia)/1000 | O66: =RC[-6]&"/60*nMin*(1000+nGuanQia)/1000" -> 19250/60*nMin*(1000+nGuanQia)/1000 | P66: =RC[-6]&"/60*nMin*(1000+nGuanQia)/1000" -> 15400/60*nMin*(1000+nGuanQia)/1000 | Q66: =RC[-6]&"/60*nMin*(1000+nGuanQia)/1000" -> 15600/60*nMin*(1000+nGuanQia)/1000 | W66: 0 | X66: =R[-3]C -> 0 | Y66: =RC[-2]+RC[-1] -> 0
B67: 39 | C67: 59 | D67: =INT((RC[-1]*35+200)*(1+2)/4*0.2) -> 339 | E67: =INT((RC[-2]*28+160)*(1+2)/4*0.2) -> 271 | F67: =INT(10000*0.1*(100+1)/100*(1+RC[-3]/200)*0.2) -> 261 | G67: 39 | H67: 59 | I67: =R[-1]C+250 -> 19500 | J67: =RC[-1]/35*28 -> 15600 | K67: =RC[-5]*60 -> 15660 | L67: =RC[-3]&"/3600*(nPatrolSec+3)*(1000+nGuanQia)/1000" -> 19500/3600*(nPatrolSec+3)*(1000+nGuanQia)/1000 | M67: =RC[-3]&"/3600*(nPatrolSec+3)*(1000+nGuanQia)/1000" -> 15600/3600*(nPatrolSec+3)*(1000+nGuanQia)/1000 | N67: =RC[-3]&"/3600*(nPatrolSec+3)*(1000+nGuanQia)/1000" -> 15660/3600*(nPatrolSec+3)*(1000+nGuanQia)/1000 | O67: =RC[-6]&"/60*nMin*(1000+nGuanQia)/1000" -> 19500/60*nMin*(1000+nGuanQia)/1000 | P67: =RC[-6]&"/60*nMin*(1000+nGuanQia)/1000" -> 15600/60*nMin*(1000+nGuanQia)/1000 | Q67: =RC[-6]&"/60*nMin*(1000+nGuanQia)/1000" -> 15660/60*nMin*(1000+nGuanQia)/1000 | W67: 10023 | X67: =R[-3]C -> 20000 | Y67: =RC[-2]+RC[-1] -> 30023
B68: 40 | C68: 60 | D68: =INT((RC[-1]*35+200)*(1+2)/4*0.2) -> 345 | E68: =INT((RC[-2]*28+160)*(1+2)/4*0.2) -> 276 | F68: =INT(10000*0.1*(100+1)/100*(1+RC[-3]/200)*0.2) -> 262 | G68: 40 | H68: 60 | I68: =RC[-5]*60 -> 20700 | J68: =RC[-1]/35*28 -> 16560 | K68: =RC[-5]*60 -> 15720 | L68: =RC[-3]&"/3600*(nPatrolSec+3)*(1000+nGuanQia)/1000" -> 20700/3600*(nPatrolSec+3)*(1000+nGuanQia)/1000 | M68: =RC[-3]&"/3600*(nPatrolSec+3)*(1000+nGuanQia)/1000" -> 16560/3600*(nPatrolSec+3)*(1000+nGuanQia)/1000 | N68: =RC[-3]&"/3600*(nPatrolSec+3)*(1000+nGuanQia)/1000" -> 15720/3600*(nPatrolSec+3)*(1000+nGuanQia)/1000 | O68: =RC[-6]&"/60*nMin*(1000+nGuanQia)/1000" -> 20700/60*nMin*(1000+nGuanQia)/1000 | P68: =RC[-6]&"/60*nMin*(1000+nGuanQia)/1000" -> 16560/60*nMin*(1000+nGuanQia)/1000 | Q68: =RC[-6]&"/60*nMin*(1000+nGuanQia)/1000" -> 15720/60*nMin*(1000+nGuanQia)/1000 | W68: 0 | X68: =R[-3]C -> 0 | Y68: =RC[-2]+RC[-1] -> 0
B69: 41 | C69: 61 | D69: =INT((RC[-1]*35+200)*(1+2)/4*0.2) -> 350 | E69: =INT((RC[-2]*28+160)*(1+2)/4*0.2) -> 280 | F69: =INT(10000*0.1*(100+1)/100*(1+RC[-3]/200)*0.2) -> 263 | G69: 41 | H69: 61 | I69: =RC[-5]*60 -> 21000 | J69: =RC[-5]*60 -> 16800 | K69: =RC[-5]*60 -> 15780 | L69: =RC[-3]&"/3600*(nPatrolSec+3)*(1000+nGuanQia)/1000" -> 21000/3600*(nPatrolSec+3)*(1000+nGuanQia)/1000 | M69: =RC[-3]&"/3600*(nPatrolSec+3)*(1000+nGuanQia)/1000" -> 16800/3600*(nPatrolSec+3)*(1000+nGuanQia)/1000 | N69: =RC[-3]&"/3600*(nPatrolSec+3)*(1000+nGuanQia)/1000" -> 15780/3600*(nPatrolSec+3)*(1000+nGuanQia)/1000 | O69: =RC[-6]&"/60*nMin*(1000+nGuanQia)/1000" -> 21000/60*nMin*(1000+nGuanQia)/1000 | P69: =RC[-6]&"/60*nMin*(1000+nGuanQia)/1000" -> 16800/60*nMin*(1000+nGuanQia)/1000 | Q69: =RC[-6]&"/60*nMin*(1000+nGuanQia)/1000" -> 15780/60*nMin*(1000+nGuanQia)/1000 | W69: 0 | X69: =R[-3]C -> 0 | Y69: =RC[-2]+RC[-1] -> 0
B70: 42 | C70: 62 | D70: =INT((RC[-1]*35+200)*(1+2)/4*0.2) -> 355 | E70: =INT((RC[-2]*28+160)*(1+2)/4*0.2) -> 284 | F70: =INT(10000*0.1*(100+1)/100*(1+RC[-3]/200)*0.2) -> 264 | G70: 42 | H70: 62 | I70: =RC[-5]*60 -> 21300 | J70: =RC[-5]*60 -> 17040 | K70: =RC[-5]*60 -> 15840 | L70: =RC[-3]&"/3600*(nPatrolSec+3)*(1000+nGuanQia)/1000" -> 21300/3600*(nPatrolSec+3)*(1000+nGuanQia)/1000 | M70: =RC[-3]&"/3600*(nPatrolSec+3)*(1000+nGuanQia)/1000" -> 17040/3600*(nPatrolSec+3)*(1000+nGuanQia)/1000 | N70: =RC[-3]&"/3600*(nPatrolSec+3)*(1000+nGuanQia)/1000" -> 15840/3600*(nPatrolSec+3)*(1000+nGuanQia)/1000 | O70: =RC[-6]&"/60*nMin*(1000+nGuanQia)/1000" -> 21300/60*nMin*(1000+nGuanQia)/1000 | P70: =RC[-6]&"/60*nMin*(1000+nGuanQia)/1000" -> 17040/60*nMin*(1000+nGuanQia)/1000 | Q70: =RC[-6]&"/60*nMin*(1000+nGuanQia)/1000" -> 15840/60*nMin*(1000+nGuanQia)/1000 | W70: 10024 | X70: =R[-3]C -> 20000 | Y70: =RC[-2]+RC[-1] -> 30024
B71: 43 | C71: 63 | D71: =INT((RC[-1]*35+200)*(1+2)/4*0.2) -> 360 | E71: =INT((RC[-2]*28+160)*(1+2)/4*0.2) -> 288 | F71: =INT(10000*0.1*(100+1)/100*(1+RC[-3]/200)*0.2) -> 265 | G71: 43 | H71: 63 | I71: =RC[-5]*60 -> 21600 | J71: =RC[-5]*60 -> 17280 | K71: =RC[-5]*60 -> 15900 | L71: =RC[-3]&"/3600*(nPatrolSec+3)*(1000+nGuanQia)/1000" -> 21600/3600*(nPatrolSec+3)*(1000+nGuanQia)/1000 | M71: =RC[-3]&"/3600*(nPatrolSec+3)*(1000+nGuanQia)/1000" -> 17280/3600*(nPatrolSec+3)*(1000+nGuanQia)/1000 | N71: =RC[-3]&"/3600*(nPatrolSec+3)*(1000+nGuanQia)/1000" -> 15900/3600*(nPatrolSec+3)*(1000+nGuanQia)/1000 | O71: =RC[-6]&"/60*nMin*(1000+nGuanQia)/1000" -> 21600/60*nMin*(1000+nGuanQia)/1000 | P71: =RC[-6]&"/60*nMin*(1000+nGuanQia)/1000" -> 17280/60*nMin*(1000+nGuanQia)/1000 | Q71: =RC[-6]&"/60*nMin*(1000+nGuanQia)/1000" -> 15900/60*nMin*(1000+nGuanQia)/1000 | W71: 0 | X71: =R[-3]C -> 0 | Y71: =RC[-2]+RC[-1] -> 0
B72: 44 | C72: 64 | D72: =INT((RC[-1]*35+200)*(1+2)/4*0.2) -> 366 | E72: =INT((RC[-2]*28+160)*(1+2)/4*0.2) -> 292 | F72: =INT(10000*0.1*(100+1)/100*(1+RC[-3]/200)*0.2) -> 266 | G72: 44 | H72: 64 | I72: =RC[-5]*60 -> 21960 | J72: =RC[-5]*60 -> 17520 | K72: =RC[-5]*60 -> 15960 | L72: =RC[-3]&"/3600*(nPatrolSec+3)*(1000+nGuanQia)/1000" -> 21960/3600*(nPatrolSec+3)*(1000+nGuanQia)/1000 | M72: =RC[-3]&"/3600*(nPatrolSec+3)*(1000+nGuanQia)/1000" -> 17520/3600*(nPatrolSec+3)*(1000+nGuanQia)/1000 | N72: =RC[-3]&"/3600*(nPatrolSec+3)*(1000+nGuanQia)/1000" -> 15960/3600*(nPatrolSec+3)*(1000+nGuanQia)/1000 | O72: =RC[-6]&"/60*nMin*(1000+nGuanQia)/1000" -> 21960/60*nMin*(1000+nGuanQia)/1000 | P72: =RC[-6]&"/60*nMin*(1000+nGuanQia)/1000" -> 17520/60*nMin*(1000+nGuanQia)/1000 | Q72: =RC[-6]&"/60*nMin*(1000+nGuanQia)/1000" -> 15960/60*nMin*(1000+nGuanQia)/1000 | W72: 0 | X72: =R[-3]C -> 0 | Y72: =RC[-2]+RC[-1] -> 0
B73: 45 | C73: 65 | D73: =INT((RC[-1]*35+200)*(1+2)/4*0.2) -> 371 | E73: =INT((RC[-2]*28+160)*(1+2)/4*0.2) -> 297 | F73: =INT(10000*0.1*(100+1)/100*(1+RC[-3]/200)*0.2) -> 267 | G73: 45 | H73: 65 | I73: =RC[-5]*60 -> 22260 | J73: =RC[-5]*60 -> 17820 | K73: =RC[-5]*60 -> 16020 | L73: =RC[-3]&"/3600*(nPatrolSec+3)*(1000+nGuanQia)/1000" -> 22260/3600*(nPatrolSec+3)*(1000+nGuanQia)/1000 | M73: =RC[-3]&"/3600*(nPatrolSec+3)*(1000+nGuanQia)/1000" -> 17820/3600*(nPatrolSec+3)*(1000+nGuanQia)/1000 | N73: =RC[-3]&"/3600*(nPatrolSec+3)*(1000+nGuanQia)/1000" -> 16020/3600*(nPatrolSec+3)*(1000+nGuanQia)/1000 | O73: =RC[-6]&"/60*nMin*(1000+nGuanQia)/1000" -> 22260/60*nMin*(1000+nGuanQia)/1000 | P73: =RC[-6]&"/60*nMin*(1000+nGuanQia)/1000" -> 17820/60*nMin*(1000+nGuanQia)/1000 | Q73: =RC[-6]&"/60*nMin*(1000+nGuanQia)/1000" -> 16020/60*nMin*(1000+nGuanQia)/1000 | W73: 10025 | X73: =R[-3]C -> 20000 | Y73: =RC[-2]+RC[-1] -> 30025
B74: 46 | C74: 66 | D74: =INT((RC[-1]*35+200)*(1+2)/4*0.2) -> 376 | E74: =INT((RC[-2]*28+160)*(1+2)/4*0.2) -> 301 | F74: =INT(10000*0.1*(100+1)/100*(1+RC[-3]/200)*0.2) -> 268 | G74: 46 | H74: 66 | I74: =RC[-5]*60 -> 22560 | J74: =RC[-5]*60 -> 18060 | K74: =RC[-5]*60 -> 16080 | L74: =RC[-3]&"/3600*(nPatrolSec+3)*(1000+nGuanQia)/1000" -> 22560/3600*(nPatrolSec+3)*(1000+nGuanQia)/1000 | M74: =RC[-3]&"/3600*(nPatrolSec+3)*(1000+nGuanQia)/1000" -> 18060/3600*(nPatrolSec+3)*(1000+nGuanQia)/1000 | N74: =RC[-3]&"/3600*(nPatrolSec+3)*(1000+nGuanQia)/1000" -> 16080/3600*(nPatrolSec+3)*(1000+nGuanQia)/1000 | O74: =RC[-6]&"/60*nMin*(1000+nGuanQia)/1000" -> 22560/60*nMin*(1000+nGuanQia)/1000 | P74: =RC[-6]&"/60*nMin*(1000+nGuanQia)/1000" -> 18060/60*nMin*(1000+nGuanQia)/1000 | Q74: =RC[-6]&"/60*nMin*(1000+nGuanQia)/1000" -> 16080/60*nMin*(1000+nGuanQia)/1000 | W74: 0 | X74: =R[-3]C -> 0 | Y74: =RC[-2]+RC[-1] -> 0
B75: 47 | C75: 67 | D75: =INT((RC[-1]*35+200)*(1+2)/4*0.2) -> 381 | E75: =INT((RC[-2]*28+160)*(1+2)/4*0.2) -> 305 | F75: =INT(10000*0.1*(100+1)/100*(1+RC[-3]/200)*0.2) -> 269 | G75: 47 | H75: 67 | I75: =RC[-5]*60 -> 22860 | J75: =RC[-5]*60 -> 18300 | K75: =RC[-5]*60 -> 16140 | L75: =RC[-3]&"/3600*(nPatrolSec+3)*(1000+nGuanQia)/1000" -> 22860/3600*(nPatrolSec+3)*(1000+nGuanQia)/1000 | M75: =RC[-3]&"/3600*(nPatrolSec+3)*(1000+nGuanQia)/1000" -> 18300/3600*(nPatrolSec+3)*(1000+nGuanQia)/1000 | N75: =RC[-3]&"/3600*(nPatrolSec+3)*(1000+nGuanQia)/1000" -> 16140/3600*(nPatrolSec+3)*(1000+nGuanQia)/1000 | O75: =RC[-6]&"/60*nMin*(1000+nGuanQia)/1000" -> 22860/60*nMin*(1000+nGuanQia)/1000 | P75: =RC[-6]&"/60*nMin*(1000+nGuanQia)/1000" -> 18300/60*nMin*(1000+nGuanQia)/1000 | Q75: =RC[-6]&"/60*nMin*(1000+nGuanQia)/1000" -> 16140/60*nMin*(1000+nGuanQia)/1000 | W75: 0 | X75: =R[-3]C -> 0 | Y75: =RC[-2]+RC[-1] -> 0
B76: 48 | C76: 68 | D76: =INT((RC[-1]*35+200)*(1+2)/4*0.2) -> 387 | E76: =INT((RC[-2]*28+160)*(1+2)/4*0.2) -> 309 | F76: =INT(10000*0.1*(100+1)/100*(1+RC[-3]/200)*0.2) -> 270 | G76: 48 | H76: 68 | I76: =RC[-5]*60 -> 23220 | J76: =RC[-5]*60 -> 18540 | K76: =RC[-5]*60 -> 16200 | L76: =RC[-3]&"/3600*(nPatrolSec+3)*(1000+nGuanQia)/1000" -> 23220/3600*(nPatrolSec+3)*(1000+nGuanQia)/1000 | M76: =RC[-3]&"/3600*(nPatrolSec+3)*(1000+nGuanQia)/1000" -> 18540/3600*(nPatrolSec+3)*(1000+nGuanQia)/1000 | N76: =RC[-3]&"/3600*(nPatrolSec+3)*(1000+nGuanQia)/1000" -> 16200/3600*(nPatrolSec+3)*(1000+nGuanQia)/1000 | O76: =RC[-6]&"/60*nMin*(1000+nGuanQia)/1000" -> 23220/60*nMin*(1000+nGuanQia)/1000 | P76: =RC[-6]&"/60*nMin*(1000+nGuanQia)/1000" -> 18540/60*nMin*(1000+nGuanQia)/1000 | Q76: =RC[-6]&"/60*nMin*(1000+nGuanQia)/1000" -> 16200/60*nMin*(1000+nGuanQia)/1000 | W76: 10026 | X76: =R[-3]C -> 20000 | Y76: =RC[-2]+RC[-1] -> 30026
B77: 49 | C77: 69 | D77: =INT((RC[-1]*35+200)*(1+2)/4*0.2) -> 392 | E77: =INT((RC[-2]*28+160)*(1+2)/4*0.2) -> 313 | F77: =INT(10000*0.1*(100+1)/100*(1+RC[-3]/200)*0.2) -> 271 | G77: 49 | H77: 69 | I77: =RC[-5]*60 -> 23520 | J77: =RC[-5]*60 -> 18780 | K77: =RC[-5]*60 -> 16260 | L77: =RC[-3]&"/3600*(nPatrolSec+3)*(1000+nGuanQia)/1000" -> 23520/3600*(nPatrolSec+3)*(1000+nGuanQia)/1000 | M77: =RC[-3]&"/3600*(nPatrolSec+3)*(1000+nGuanQia)/1000" -> 18780/3600*(nPatrolSec+3)*(1000+nGuanQia)/1000 | N77: =RC[-3]&"/3600*(nPatrolSec+3)*(1000+nGuanQia)/1000" -> 16260/3600*(nPatrolSec+3)*(1000+nGuanQia)/1000 | O77: =RC[-6]&"/60*nMin*(1000+nGuanQia)/1000" -> 23520/60*nMin*(1000+nGuanQia)/1000 | P77: =RC[-6]&"/60*nMin*(1000+nGuanQia)/1000" -> 18780/60*nMin*(1000+nGuanQia)/1000 | Q77: =RC[-6]&"/60*nMin*(1000+nGuanQia)/1000" -> 16260/60*nMin*(1000+nGuanQia)/1000 | W77: 0 | X77: =R[-3]C -> 0 | Y77: =RC[-2]+RC[-1] -> 0
B78: 50 | C78: 70 | D78: =INT((RC[-1]*35+200)*(1+2)/4*0.2) -> 397 | E78: =INT((RC[-2]*28+160)*(1+2)/4*0.2) -> 318 | F78: =INT(10000*0.1*(100+1)/100*(1+RC[-3]/200)*0.2) -> 272 | G78: 50 | H78: 70 | I78: =RC[-5]*60 -> 23820 | J78: =RC[-5]*60 -> 19080 | K78: =RC[-5]*60 -> 16320 | L78: =RC[-3]&"/3600*(nPatrolSec+3)*(1000+nGuanQia)/1000" -> 23820/3600*(nPatrolSec+3)*(1000+nGuanQia)/1000 | M78: =RC[-3]&"/3600*(nPatrolSec+3)*(1000+nGuanQia)/1000" -> 19080/3600*(nPatrolSec+3)*(1000+nGuanQia)/1000 | N78: =RC[-3]&"/3600*(nPatrolSec+3)*(1000+nGuanQia)/1000" -> 16320/3600*(nPatrolSec+3)*(1000+nGuanQia)/1000 | O78: =RC[-6]&"/60*nMin*(1000+nGuanQia)/1000" -> 23820/60*nMin*(1000+nGuanQia)/1000 | P78: =RC[-6]&"/60*nMin*(1000+nGuanQia)/1000" -> 19080/60*nMin*(1000+nGuanQia)/1000 | Q78: =RC[-6]&"/60*nMin*(1000+nGuanQia)/1000" -> 16320/60*nMin*(1000+nGuanQia)/1000 | W78: 0 | X78: =R[-3]C -> 0 | Y78: =RC[-2]+RC[-1] -> 0
B79: 51 | C79: 71 | D79: =INT((RC[-1]*35+200)*(1+2)/4*0.2) -> 402 | E79: =INT((RC[-2]*28+160)*(1+2)/4*0.2) -> 322 | F79: =INT(10000*0.1*(100+1)/100*(1+RC[-3]/200)*0.2) -> 273 | G79: 51 | H79: 71 | I79: =RC[-5]*60 -> 24120 | J79: =RC[-5]*60 -> 19320 | K79: =RC[-5]*60 -> 16380 | L79: =RC[-3]&"/3600*(nPatrolSec+3)*(1000+nGuanQia)/1000" -> 24120/3600*(nPatrolSec+3)*(1000+nGuanQia)/1000 | M79: =RC[-3]&"/3600*(nPatrolSec+3)*(1000+nGuanQia)/1000" -> 19320/3600*(nPatrolSec+3)*(1000+nGuanQia)/1000 | N79: =RC[-3]&"/3600*(nPatrolSec+3)*(1000+nGuanQia)/1000" -> 16380/3600*(nPatrolSec+3)*(1000+nGuanQia)/1000 | O79: =RC[-6]&"/60*nMin*(1000+nGuanQia)/1000" -> 24120/60*nMin*(1000+nGuanQia)/1000 | P79: =RC[-6]&"/60*nMin*(1000+nGuanQia)/1000" -> 19320/60*nMin*(1000+nGuanQia)/1000 | Q79: =RC[-6]&"/60*nMin*(1000+nGuanQia)/1000" -> 16380/60*nMin*(1000+nGuanQia)/1000 | W79: 10027 | X79: =R[-3]C -> 20000 | Y79: =RC[-2]+RC[-1] -> 30027
B80: 52 | C80: 72 | D80: =INT((RC[-1]*35+200)*(1+2)/4*0.2) -> 408 | E80: =INT((RC[-2]*28+160)*(1+2)/4*0.2) -> 326 | F80: =INT(10000*0.1*(100+1)/100*(1+RC[-3]/200)*0.2) -> 274 | G80: 52 | H80: 72 | I80: =RC[-5]*60 -> 24480 | J80: =RC[-5]*60 -> 19560 | K80: =RC[-5]*60 -> 16440 | L80: =RC[-3]&"/3600*(nPatrolSec+3)*(1000+nGuanQia)/1000" -> 24480/3600*(nPatrolSec+3)*(1000+nGuanQia)/1000 | M80: =RC[-3]&"/3600*(nPatrolSec+3)*(1000+nGuanQia)/1000" -> 19560/3600*(nPatrolSec+3)*(1000+nGuanQia)/1000 | N80: =RC[-3]&"/3600*(nPatrolSec+3)*(1000+nGuanQia)/1000" -> 16440/3600*(nPatrolSec+3)*(1000+nGuanQia)/1000 | O80: =RC[-6]&"/60*nMin*(1000+nGuanQia)/1000" -> 24480/60*nMin*(1000+nGuanQia)/1000 | P80: =RC[-6]&"/60*nMin*(1000+nGuanQia)/1000" -> 19560/60*nMin*(1000+nGuanQia)/1000 | Q80: =RC[-6]&"/60*nMin*(1000+nGuanQia)/1000" -> 16440/60*nMin*(1000+nGuanQia)/1000 | W80: 0 | X80: =R[-3]C -> 0 | Y80: =RC[-2]+RC[-1] -> 0
B81: 53 | C81: 73 | D81: =INT((RC[-1]*35+200)*(1+2)/4*0.2) -> 413 | E81: =INT((RC[-2]*28+160)*(1+2)/4*0.2) -> 330 | F81: =INT(10000*0.1*(100+1)/100*(1+RC[-3]/200)*0.2) -> 275 | G81: 53 | H81: 73 | I81: =RC[-5]*60 -> 24780 | J81: =RC[-5]*60 -> 19800 | K81: =RC[-5]*60 -> 16500 | L81: =RC[-3]&"/3600*(nPatrolSec+3)*(1000+nGuanQia)/1000" -> 24780/3600*(nPatrolSec+3)*(1000+nGuanQia)/1000 | M81: =RC[-3]&"/3600*(nPatrolSec+3)*(1000+nGuanQia)/1000" -> 19800/3600*(nPatrolSec+3)*(1000+nGuanQia)/1000 | N81: =RC[-3]&"/3600*(nPatrolSec+3)*(1000+nGuanQia)/1000" -> 16500/3600*(nPatrolSec+3)*(1000+nGuanQia)/1000 | O81: =RC[-6]&"/60*nMin*(1000+nGuanQia)/1000" -> 24780/60*nMin*(1000+nGuanQia)/1000 | P81: =RC[-6]&"/60*nMin*(1000+nGuanQia)/1000" -> 19800/60*nMin*(1000+nGuanQia)/1000 | Q81: =RC[-6]&"/60*nMin*(1000+nGuanQia)/1000" -> 16500/60*nMin*(1000+nGuanQia)/1000 | W81: 0 | X81: =R[-3]C -> 0 | Y81: =RC[-2]+RC[-1] -> 0
B82: 54 | C82: 74 | D82: =INT((RC[-1]*35+200)*(1+2)/4*0.2) -> 418 | E82: =INT((RC[-2]*28+160)*(1+2)/4*0.2) -> 334 | F82: =INT(10000*0.1*(100+1)/100*(1+RC[-3]/200)*0.2) -> 276 | G82: 54 | H82: 74 | I82: =RC[-5]*60 -> 25080 | J82: =RC[-5]*60 -> 20040 | K82: =RC[-5]*60 -> 16560 | L82: =RC[-3]&"/3600*(nPatrolSec+3)*(1000+nGuanQia)/1000" -> 25080/3600*(nPatrolSec+3)*(1000+nGuanQia)/1000 | M82: =RC[-3]&"/3600*(nPatrolSec+3)*(1000+nGuanQia)/1000" -> 20040/3600*(nPatrolSec+3)*(1000+nGuanQia)/1000 | N82: =RC[-3]&"/3600*(nPatrolSec+3)*(1000+nGuanQia)/1000" -> 16560/3600*(nPatrolSec+3)*(1000+nGuanQia)/1000 | O82: =RC[-6]&"/60*nMin*(1000+nGuanQia)/1000" -> 25080/60*nMin*(1000+nGuanQia)/1000 | P82: =RC[-6]&"/60*nMin*(1000+nGuanQia)/1000" -> 20040/60*nMin*(1000+nGuanQia)/1000 | Q82: =RC[-6]&"/60*nMin*(1000+nGuanQia)/1000" -> 16560/60*nMin*(1000+nGuanQia)/1000 | W82: 10028 | X82: =R[-3]C -> 20000 | Y82: =RC[-2]+RC[-1] -> 30028
B83: 55 | C83: 75 | D83: =INT((RC[-1]*35+200)*(1+2)/4*0.2) -> 423 | E83: =INT((RC[-2]*28+160)*(1+2)/4*0.2) -> 339 | F83: =INT(10000*0.1*(100+1)/100*(1+RC[-3]/200)*0.2) -> 277 | G83: 55 | H83: 75 | I83: =RC[-5]*60 -> 25380 | J83: =RC[-5]*60 -> 20340 | K83: =RC[-5]*60 -> 16620 | L83: =RC[-3]&"/3600*(nPatrolSec+3)*(1000+nGuanQia)/1000" -> 25380/3600*(nPatrolSec+3)*(1000+nGuanQia)/1000 | M83: =RC[-3]&"/3600*(nPatrolSec+3)*(1000+nGuanQia)/1000" -> 20340/3600*(nPatrolSec+3)*(1000+nGuanQia)/1000 | N83: =RC[-3]&"/3600*(nPatrolSec+3)*(1000+nGuanQia)/1000" -> 16620/3600*(nPatrolSec+3)*(1000+nGuanQia)/1000 | O83: =RC[-6]&"/60*nMin*(1000+nGuanQia)/1000" -> 25380/60*nMin*(1000+nGuanQia)/1000 | P83: =RC[-6]&"/60*nMin*(1000+nGuanQia)/1000" -> 20340/60*nMin*(1000+nGuanQia)/1000 | Q83: =RC[-6]&"/60*nMin*(1000+nGuanQia)/1000" -> 16620/60*nMin*(1000+nGuanQia)/1000 | W83: 0 | X83: =R[-3]C -> 0 | Y83: =RC[-2]+RC[-1] -> 0
B84: 56 | C84: 76 | D84: =INT((RC[-1]*35+200)*(1+2)/4*0.2) -> 429 | E84: =INT((RC[-2]*28+160)*(1+2)/4*0.2) -> 343 | F84: =INT(10000*0.1*(100+1)/100*(1+RC[-3]/200)*0.2) -> 278 | G84: 56 | H84: 76 | I84: =RC[-5]*60 -> 25740 | J84: =RC[-5]*60 -> 20580 | K84: =RC[-5]*60 -> 16680 | L84: =RC[-3]&"/3600*(nPatrolSec+3)*(1000+nGuanQia)/1000" -> 25740/3600*(nPatrolSec+3)*(1000+nGuanQia)/1000 | M84: =RC[-3]&"/3600*(nPatrolSec+3)*(1000+nGuanQia)/1000" -> 20580/3600*(nPatrolSec+3)*(1000+nGuanQia)/1000 | N84: =RC[-3]&"/3600*(nPatrolSec+3)*(1000+nGuanQia)/1000" -> 16680/3600*(nPatrolSec+3)*(1000+nGuanQia)/1000 | O84: =RC[-6]&"/60*nMin*(1000+nGuanQia)/1000" -> 25740/60*nMin*(1000+nGuanQia)/1000 | P84: =RC[-6]&"/60*nMin*(1000+nGuanQia)/1000" -> 20580/60*nMin*(1000+nGuanQia)/1000 | Q84: =RC[-6]&"/60*nMin*(1000+nGuanQia)/1000" -> 16680/60*nMin*(1000+nGuanQia)/1000 | W84: 0 | X84: =R[-3]C -> 0 | Y84: =RC[-2]+RC[-1] -> 0
B85: 57 | C85: 77 | D85: =INT((RC[-1]*35+200)*(1+2)/4*0.2) -> 434 | E85: =INT((RC[-2]*28+160)*(1+2)/4*0.2) -> 347 | F85: =INT(10000*0.1*(100+1)/100*(1+RC[-3]/200)*0.2) -> 279 | G85: 57 | H85: 77 | I85: =RC[-5]*60 -> 26040 | J85: =RC[-5]*60 -> 20820 | K85: =RC[-5]*60 -> 16740 | L85: =RC[-3]&"/3600*(nPatrolSec+3)*(1000+nGuanQia)/1000" -> 26040/3600*(nPatrolSec+3)*(1000+nGuanQia)/1000 | M85: =RC[-3]&"/3600*(nPatrolSec+3)*(1000+nGuanQia)/1000" -> 20820/3600*(nPatrolSec+3)*(1000+nGuanQia)/1000 | N85: =RC[-3]&"/3600*(nPatrolSec+3)*(1000+nGuanQia)/1000" -> 16740/3600*(nPatrolSec+3)*(1000+nGuanQia)/1000 | O85: =RC[-6]&"/60*nMin*(1000+nGuanQia)/1000" -> 26040/60*nMin*(1000+nGuanQia)/1000 | P85: =RC[-6]&"/60*nMin*(1000+nGuanQia)/1000" -> 20820/60*nMin*(1000+nGuanQia)/1000 | Q85: =RC[-6]&"/60*nMin*(1000+nGuanQia)/1000" -> 16740/60*nMin*(1000+nGuanQia)/1000 | W85: 10029 | X85: =R[-3]C -> 20000 | Y85: =RC[-2]+RC[-1] -> 30029
B86: 58 | C86: 78 | D86: =INT((RC[-1]*35+200)*(1+2)/4*0.2) -> 439 | E86: =INT((RC[-2]*28+160)*(1+2)/4*0.2) -> 351 | F86: =INT(10000*0.1*(100+1)/100*(1+RC[-3]/200)*0.2) -> 280 | G86: 58 | H86: 78 | I86: =RC[-5]*60 -> 26340 | J86: =RC[-5]*60 -> 21060 | K86: =RC[-5]*60 -> 16800 | L86: =RC[-3]&"/3600*(nPatrolSec+3)*(1000+nGuanQia)/1000" -> 26340/3600*(nPatrolSec+3)*(1000+nGuanQia)/1000 | M86: =RC[-3]&"/3600*(nPatrolSec+3)*(1000+nGuanQia)/1000" -> 21060/3600*(nPatrolSec+3)*(1000+nGuanQia)/1000 | N86: =RC[-3]&"/3600*(nPatrolSec+3)*(1000+nGuanQia)/1000" -> 16800/3600*(nPatrolSec+3)*(1000+nGuanQia)/1000 | O86: =RC[-6]&"/60*nMin*(1000+nGuanQia)/1000" -> 26340/60*nMin*(1000+nGuanQia)/1000 | P86: =RC[-6]&"/60*nMin*(1000+nGuanQia)/1000" -> 21060/60*nMin*(1000+nGuanQia)/1000 | Q86: =RC[-6]&"/60*nMin*(1000+nGuanQia)/1000" -> 16800/60*nMin*(1000+nGuanQia)/1000 | W86: 0 | X86: =R[-3]C -> 0 | Y86: =RC[-2]+RC[-1] -> 0
B87: 59 | C87: 79 | D87: =INT((RC[-1]*35+200)*(1+2)/4*0.2) -> 444 | E87: =INT((RC[-2]*28+160)*(1+2)/4*0.2) -> 355 | F87: =INT(10000*0.1*(100+1)/100*(1+RC[-3]/200)*0.2) -> 281 | G87: 59 | H87: 79 | I87: =RC[-5]*60 -> 26640 | J87: =RC[-5]*60 -> 21300 | K87: =RC[-5]*60 -> 16860 | L87: =RC[-3]&"/3600*(nPatrolSec+3)*(1000+nGuanQia)/1000" -> 26640/3600*(nPatrolSec+3)*(1000+nGuanQia)/1000 | M87: =RC[-3]&"/3600*(nPatrolSec+3)*(1000+nGuanQia)/1000" -> 21300/3600*(nPatrolSec+3)*(1000+nGuanQia)/1000 | N87: =RC[-3]&"/3600*(nPatrolSec+3)*(1000+nGuanQia)/1000" -> 16860/3600*(nPatrolSec+3)*(1000+nGuanQia)/1000 | O87: =RC[-6]&"/60*nMin*(1000+nGuanQia)/1000" -> 26640/60*nMin*(1000+nGuanQia)/1000 | P87: =RC[-6]&"/60*nMin*(1000+nGuanQia)/1000" -> 21300/60*nMin*(1000+nGuanQia)/1000 | Q87: =RC[-6]&"/60*nMin*(1000+nGuanQia)/1000" -> 16860/60*nMin*(1000+nGuanQia)/1000 | W87: 0 | X87: =R[-3]C -> 0 | Y87: =RC[-2]+RC[-1] -> 0
B88: 60 | C88: 80 | D88: =INT((RC[-1]*35+200)*(1+2)/4*0.2) -> 450 | E88: =INT((RC[-2]*28+160)*(1+2)/4*0.2) -> 360 | F88: =INT(10000*0.1*(100+1)/100*(1+RC[-3]/200)*0.2) -> 282 | G88: 60 | H88: 80 | I88: =RC[-5]*60 -> 27000 | J88: =RC[-5]*60 -> 21600 | K88: =RC[-5]*60 -> 16920 | L88: =RC[-3]&"/3600*(nPatrolSec+3)*(1000+nGuanQia)/1000" -> 27000/3600*(nPatrolSec+3)*(1000+nGuanQia)/1000 | M88: =RC[-3]&"/3600*(nPatrolSec+3)*(1000+nGuanQia)/1000" -> 21600/3600*(nPatrolSec+3)*(1000+nGuanQia)/1000 | N88: =RC[-3]&"/3600*(nPatrolSec+3)*(1000+nGuanQia)/1000" -> 16920/3600*(nPatrolSec+3)*(1000+nGuanQia)/1000 | O88: =RC[-6]&"/60*nMin*(1000+nGuanQia)/1000" -> 27000/60*nMin*(1000+nGuanQia)/1000 | P88: =RC[-6]&"/60*nMin*(1000+nGuanQia)/1000" -> 21600/60*nMin*(1000+nGuanQia)/1000 | Q88: =RC[-6]&"/60*nMin*(1000+nGuanQia)/1000" -> 16920/60*nMin*(1000+nGuanQia)/1000 | W88: 10030 | X88: =R[-3]C -> 20000 | Y88: =RC[-2]+RC[-1] -> 30030
B89: 61 | C89: 81 | D89: =INT((RC[-1]*35+200)*(1+2)/4*0.2) -> 455 | E89: =INT((RC[-2]*28+160)*(1+2)/4*0.2) -> 364 | F89: =INT(10000*0.1*(100+1)/100*(1+RC[-3]/200)*0.2) -> 283 | G89: 61 | H89: 81 | I89: =RC[-5]*60 -> 27300 | J89: =RC[-5]*60 -> 21840 | K89: =RC[-5]*60 -> 16980 | L89: =RC[-3]&"/3600*(nPatrolSec+3)*(1000+nGuanQia)/1000" -> 27300/3600*(nPatrolSec+3)*(1000+nGuanQia)/1000 | M89: =RC[-3]&"/3600*(nPatrolSec+3)*(1000+nGuanQia)/1000" -> 21840/3600*(nPatrolSec+3)*(1000+nGuanQia)/1000 | N89: =RC[-3]&"/3600*(nPatrolSec+3)*(1000+nGuanQia)/1000" -> 16980/3600*(nPatrolSec+3)*(1000+nGuanQia)/1000 | O89: =RC[-6]&"/60*nMin*(1000+nGuanQia)/1000" -> 27300/60*nMin*(1000+nGuanQia)/1000 | P89: =RC[-6]&"/60*nMin*(1000+nGuanQia)/1000" -> 21840/60*nMin*(1000+nGuanQia)/1000 | Q89: =RC[-6]&"/60*nMin*(1000+nGuanQia)/1000" -> 16980/60*nMin*(1000+nGuanQia)/1000 | W89: 0 | X89: =R[-3]C -> 0 | Y89: =RC[-2]+RC[-1] -> 0
B90: 62 | C90: 82 | D90: =INT((RC[-1]*35+200)*(1+2)/4*0.2) -> 460 | E90: =INT((RC[-2]*28+160)*(1+2)/4*0.2) -> 368 | F90: =INT(10000*0.1*(100+1)/100*(1+RC[-3]/200)*0.2) -> 284 | G90: 62 | H90: 82 | I90: =RC[-5]*60 -> 27600 | J90: =RC[-5]*60 -> 22080 | K90: =RC[-5]*60 -> 17040 | L90: =RC[-3]&"/3600*(nPatrolSec+3)*(1000+nGuanQia)/1000" -> 27600/3600*(nPatrolSec+3)*(1000+nGuanQia)/1000 | M90: =RC[-3]&"/3600*(nPatrolSec+3)*(1000+nGuanQia)/1000" -> 22080/3600*(nPatrolSec+3)*(1000+nGuanQia)/1000 | N90: =RC[-3]&"/3600*(nPatrolSec+3)*(1000+nGuanQia)/1000" -> 17040/3600*(nPatrolSec+3)*(1000+nGuanQia)/1000 | O90: =RC[-6]&"/60*nMin*(1000+nGuanQia)/1000" -> 27600/60*nMin*(1000+nGuanQia)/1000 | P90: =RC[-6]&"/60*nMin*(1000+nGuanQia)/1000" -> 22080/60*nMin*(1000+nGuanQia)/1000 | Q90: =RC[-6]&"/60*nMin*(1000+nGuanQia)/1000" -> 17040/60*nMin*(1000+nGuanQia)/1000 | W90: 0 | X90: =R[-3]C -> 0 | Y90: =RC[-2]+RC[-1] -> 0
B91: 63 | C91: 83 | D91: =INT((RC[-1]*35+200)*(1+2)/4*0.2) -> 465 | E91: =INT((RC[-2]*28+160)*(1+2)/4*0.2) -> 372 | F91: =INT(10000*0.1*(100+1)/100*(1+RC[-3]/200)*0.2) -> 285 | G91: 63 | H91: 83 | I91: =RC[-5]*60 -> 27900 | J91: =RC[-5]*60 -> 22320 | K91: =RC[-5]*60 -> 17100 | L91: =RC[-3]&"/3600*(nPatrolSec+3)*(1000+nGuanQia)/1000" -> 27900/3600*(nPatrolSec+3)*(1000+nGuanQia)/1000 | M91: =RC[-3]&"/3600*(nPatrolSec+3)*(1000+nGuanQia)/1000" -> 22320/3600*(nPatrolSec+3)*(1000+nGuanQia)/1000 | N91: =RC[-3]&"/3600*(nPatrolSec+3)*(1000+nGuanQia)/1000" -> 17100/3600*(nPatrolSec+3)*(1000+nGuanQia)/1000 | O91: =RC[-6]&"/60*nMin*(1000+nGuanQia)/1000" -> 27900/60*nMin*(1000+nGuanQia)/1000 | P91: =RC[-6]&"/60*nMin*(1000+nGuanQia)/1000" -> 22320/60*nMin*(1000+nGuanQia)/1000 | Q91: =RC[-6]&"/60*nMin*(1000+nGuanQia)/1000" -> 17100/60*nMin*(1000+nGuanQia)/1000 | W91: 10031 | X91: =R[-3]C -> 20000 | Y91: =RC[-2]+RC[-1] -> 30031
B92: 64 | C92: 84 | D92: =INT((RC[-1]*35+200)*(1+2)/4*0.2) -> 471 | E92: =INT((RC[-2]*28+160)*(1+2)/4*0.2) -> 376 | F92: =INT(10000*0.1*(100+1)/100*(1+RC[-3]/200)*0.2) -> 286 | G92: 64 | H92: 84 | I92: =RC[-5]*60 -> 28260 | J92: =RC[-5]*60 -> 22560 | K92: =RC[-5]*60 -> 17160 | L92: =RC[-3]&"/3600*(nPatrolSec+3)*(1000+nGuanQia)/1000" -> 28260/3600*(nPatrolSec+3)*(1000+nGuanQia)/1000 | M92: =RC[-3]&"/3600*(nPatrolSec+3)*(1000+nGuanQia)/1000" -> 22560/3600*(nPatrolSec+3)*(1000+nGuanQia)/1000 | N92: =RC[-3]&"/3600*(nPatrolSec+3)*(1000+nGuanQia)/1000" -> 17160/3600*(nPatrolSec+3)*(1000+nGuanQia)/1000 | O92: =RC[-6]&"/60*nMin*(1000+nGuanQia)/1000" -> 28260/60*nMin*(1000+nGuanQia)/1000 | P92: =RC[-6]&"/60*nMin*(1000+nGuanQia)/1000" -> 22560/60*nMin*(1000+nGuanQia)/1000 | Q92: =RC[-6]&"/60*nMin*(1000+nGuanQia)/1000" -> 17160/60*nMin*(1000+nGuanQia)/1000 | W92: 0 | X92: =R[-3]C -> 0 | Y92: =RC[-2]+RC[-1] -> 0
B93: 65 | C93: 85 | D93: =INT((RC[-1]*35+200)*(1+2)/4*0.2) -> 476 | E93: =INT((RC[-2]*28+160)*(1+2)/4*0.2) -> 381 | F93: =INT(10000*0.1*(100+1)/100*(1+RC[-3]/200)*0.2) -> 287 | G93: 65 | H93: 85 | I93: =RC[-5]*60 -> 28560 | J93: =RC[-5]*60 -> 22860 | K93: =RC[-5]*60 -> 17220 | L93: =RC[-3]&"/3600*(nPatrolSec+3)*(1000+nGuanQia)/1000" -> 28560/3600*(nPatrolSec+3)*(1000+nGuanQia)/1000 | M93: =RC[-3]&"/3600*(nPatrolSec+3)*(1000+nGuanQia)/1000" -> 22860/3600*(nPatrolSec+3)*(1000+nGuanQia)/1000 | N93: =RC[-3]&"/3600*(nPatrolSec+3)*(1000+nGuanQia)/1000" -> 17220/3600*(nPatrolSec+3)*(1000+nGuanQia)/1000 | O93: =RC[-6]&"/60*nMin*(1000+nGuanQia)/1000" -> 28560/60*nMin*(1000+nGuanQia)/1000 | P93: =RC[-6]&"/60*nMin*(1000+nGuanQia)/1000" -> 22860/60*nMin*(1000+nGuanQia)/1000 | Q93: =RC[-6]&"/60*nMin*(1000+nGuanQia)/1000" -> 17220/60*nMin*(1000+nGuanQia)/1000 | W93: 0 | X93: =R[-3]C -> 0 | Y93: =RC[-2]+RC[-1] -> 0
B94: 66 | C94: 86 | D94: =INT((RC[-1]*35+200)*(1+2)/4*0.2) -> 481 | E94: =INT((RC[-2]*28+160)*(1+2)/4*0.2) -> 385 | F94: =INT(10000*0.1*(100+1)/100*(1+RC[-3]/200)*0.2) -> 288 | G94: 66 | H94: 86 | I94: =RC[-5]*60 -> 28860 | J94: =RC[-5]*60 -> 23100 | K94: =RC[-5]*60 -> 17280 | L94: =RC[-3]&"/3600*(nPatrolSec+3)*(1000+nGuanQia)/1000" -> 28860/3600*(nPatrolSec+3)*(1000+nGuanQia)/1000 | M94: =RC[-3]&"/3600*(nPatrolSec+3)*(1000+nGuanQia)/1000" -> 23100/3600*(nPatrolSec+3)*(1000+nGuanQia)/1000 | N94: =RC[-3]&"/3600*(nPatrolSec+3)*(1000+nGuanQia)/1000" -> 17280/3600*(nPatrolSec+3)*(1000+nGuanQia)/1000 | O94: =RC[-6]&"/60*nMin*(1000+nGuanQia)/1000" -> 28860/60*nMin*(1000+nGuanQia)/1000 | P94: =RC[-6]&"/60*nMin*(1000+nGuanQia)/1000" -> 23100/60*nMin*(1000+nGuanQia)/1000 | Q94: =RC[-6]&"/60*nMin*(1000+nGuanQia)/1000" -> 17280/60*nMin*(1000+nGuanQia)/1000 | W94: 10032 | X94: =R[-3]C -> 20000 | Y94: =RC[-2]+RC[-1] -> 30032
B95: 67 | C95: 87 | D95: =INT((RC[-1]*35+200)*(1+2)/4*0.2) -> 486 | E95: =INT((RC[-2]*28+160)*(1+2)/4*0.2) -> 389 | F95: =INT(10000*0.1*(100+1)/100*(1+RC[-3]/200)*0.2) -> 289 | G95: 67 | H95: 87 | I95: =RC[-5]*60 -> 29160 | J95: =RC[-5]*60 -> 23340 | K95: =RC[-5]*60 -> 17340 | L95: =RC[-3]&"/3600*(nPatrolSec+3)*(1000+nGuanQia)/1000" -> 29160/3600*(nPatrolSec+3)*(1000+nGuanQia)/1000 | M95: =RC[-3]&"/3600*(nPatrolSec+3)*(1000+nGuanQia)/1000" -> 23340/3600*(nPatrolSec+3)*(1000+nGuanQia)/1000 | N95: =RC[-3]&"/3600*(nPatrolSec+3)*(1000+nGuanQia)/1000" -> 17340/3600*(nPatrolSec+3)*(1000+nGuanQia)/1000 | O95: =RC[-6]&"/60*nMin*(1000+nGuanQia)/1000" -> 29160/60*nMin*(1000+nGuanQia)/1000 | P95: =RC[-6]&"/60*nMin*(1000+nGuanQia)/1000" -> 23340/60*nMin*(1000+nGuanQia)/1000 | Q95: =RC[-6]&"/60*nMin*(1000+nGuanQia)/1000" -> 17340/60*nMin*(1000+nGuanQia)/1000 | W95: 0 | X95: =R[-3]C -> 0 | Y95: =RC[-2]+RC[-1] -> 0
B96: 68 | C96: 88 | D96: =INT((RC[-1]*35+200)*(1+2)/4*0.2) -> 492 | E96: =INT((RC[-2]*28+160)*(1+2)/4*0.2) -> 393 | F96: =INT(10000*0.1*(100+1)/100*(1+RC[-3]/200)*0.2) -> 290 | G96: 68 | H96: 88 | I96: =RC[-5]*60 -> 29520 | J96: =RC[-5]*60 -> 23580 | K96: =RC[-5]*60 -> 17400 | L96: =RC[-3]&"/3600*(nPatrolSec+3)*(1000+nGuanQia)/1000" -> 29520/3600*(nPatrolSec+3)*(1000+nGuanQia)/1000 | M96: =RC[-3]&"/3600*(nPatrolSec+3)*(1000+nGuanQia)/1000" -> 23580/3600*(nPatrolSec+3)*(1000+nGuanQia)/1000 | N96: =RC[-3]&"/3600*(nPatrolSec+3)*(1000+nGuanQia)/1000" -> 17400/3600*(nPatrolSec+3)*(1000+nGuanQia)/1000 | O96: =RC[-6]&"/60*nMin*(1000+nGuanQia)/1000" -> 29520/60*nMin*(1000+nGuanQia)/1000 | P96: =RC[-6]&"/60*nMin*(1000+nGuanQia)/1000" -> 23580/60*nMin*(1000+nGuanQia)/1000 | Q96: =RC[-6]&"/60*nMin*(1000+nGuanQia)/1000" -> 17400/60*nMin*(1000+nGuanQia)/1000 | W96: 0 | X96: =R[-3]C -> 0 | Y96: =RC[-2]+RC[-1] -> 0
B97: 69 | C97: 89 | D97: =INT((RC[-1]*35+200)*(1+2)/4*0.2) -> 497 | E97: =INT((RC[-2]*28+160)*(1+2)/4*0.2) -> 397 | F97: =INT(10000*0.1*(100+1)/100*(1+RC[-3]/200)*0.2) -> 291 | G97: 69 | H97: 89 | I97: =RC[-5]*60 -> 29820 | J97: =RC[-5]*60 -> 23820 | K97: =RC[-5]*60 -> 17460 | L97: =RC[-3]&"/3600*(nPatrolSec+3)*(1000+nGuanQia)/1000" -> 29820/3600*(nPatrolSec+3)*(1000+nGuanQia)/1000 | M97: =RC[-3]&"/3600*(nPatrolSec+3)*(1000+nGuanQia)/1000" -> 23820/3600*(nPatrolSec+3)*(1000+nGuanQia)/1000 | N97: =RC[-3]&"/3600*(nPatrolSec+3)*(1000+nGuanQia)/1000" -> 17460/3600*(nPatrolSec+3)*(1000+nGuanQia)/1000 | O97: =RC[-6]&"/60*nMin*(1000+nGuanQia)/1000" -> 29820/60*nMin*(1000+nGuanQia)/1000 | P97: =RC[-6]&"/60*nMin*(1000+nGuanQia)/1000" -> 23820/60*nMin*(1000+nGuanQia)/1000 | Q97: =RC[-6]&"/60*nMin*(1000+nGuanQia)/1000" -> 17460/60*nMin*(1000+nGuanQia)/1000 | W97: 10033 | X97: =R[-3]C -> 20000 | Y97: =RC[-2]+RC[-1] -> 30033
B98: 70 | C98: 90 | D98: =INT((RC[-1]*35+200)*(1+2)/4*0.2) -> 502 | E98: =INT((RC[-2]*28+160)*(1+2)/4*0.2) -> 402 | F98: =INT(10000*0.1*(100+1)/100*(1+RC[-3]/200)*0.2) -> 292 | G98: 70 | H98: 90 | I98: =RC[-5]*60 -> 30120 | J98: =RC[-5]*60 -> 24120 | K98: =RC[-5]*60 -> 17520 | L98: =RC[-3]&"/3600*(nPatrolSec+3)*(1000+nGuanQia)/1000" -> 30120/3600*(nPatrolSec+3)*(1000+nGuanQia)/1000 | M98: =RC[-3]&"/3600*(nPatrolSec+3)*(1000+nGuanQia)/1000" -> 24120/3600*(nPatrolSec+3)*(1000+nGuanQia)/1000 | N98: =RC[-3]&"/3600*(nPatrolSec+3)*(1000+nGuanQia)/1000" -> 17520/3600*(nPatrolSec+3)*(1000+nGuanQia)/1000 | O98: =RC[-6]&"/60*nMin*(1000+nGuanQia)/1000" -> 30120/60*nMin*(1000+nGuanQia)/1000 | P98: =RC[-6]&"/60*nMin*(1000+nGuanQia)/1000" -> 24120/60*nMin*(1000+nGuanQia)/1000 | Q98: =RC[-6]&"/60*nMin*(1000+nGuanQia)/1000" -> 17520/60*nMin*(1000+nGuanQia)/1000 | W98: 0 | X98: =R[-3]C -> 0 | Y98: =RC[-2]+RC[-1] -> 0
B99: 71 | C99: 91 | D99: =INT((RC[-1]*35+200)*(1+2)/4*0.2) -> 507 | E99: =INT((RC[-2]*28+160)*(1+2)/4*0.2) -> 406 | F99: =INT(10000*0.1*(100+1)/100*(1+RC[-3]/200)*0.2) -> 293 | G99: 71 | H99: 91 | I99: =RC[-5]*60 -> 30420 | J99: =RC[-5]*60 -> 24360 | K99: =RC[-5]*60 -> 17580 | L99: =RC[-3]&"/3600*(nPatrolSec+3)*(1000+nGuanQia)/1000" -> 30420/3600*(nPatrolSec+3)*(1000+nGuanQia)/1000 | M99: =RC[-3]&"/3600*(nPatrolSec+3)*(1000+nGuanQia)/1000" -> 24360/3600*(nPatrolSec+3)*(1000+nGuanQia)/1000 | N99: =RC[-3]&"/3600*(nPatrolSec+3)*(1000+nGuanQia)/1000" -> 17580/3600*(nPatrolSec+3)*(1000+nGuanQia)/1000 | O99: =RC[-6]&"/60*nMin*(1000+nGuanQia)/1000" -> 30420/60*nMin*(1000+nGuanQia)/1000 | P99: =RC[-6]&"/60*nMin*(1000+nGuanQia)/1000" -> 24360/60*nMin*(1000+nGuanQia)/1000 | Q99: =RC[-6]&"/60*nMin*(1000+nGuanQia)/1000" -> 17580/60*nMin*(1000+nGuanQia)/1000 | W99: 0 | X99: =R[-3]C -> 0 | Y99: =RC[-2]+RC[-1] -> 0
B100: 72 | C100: 92 | D100: =INT((RC[-1]*35+200)*(1+2)/4*0.2) -> 513 | E100: =INT((RC[-2]*28+160)*(1+2)/4*0.2) -> 410 | F100: =INT(10000*0.1*(100+1)/100*(1+RC[-3]/200)*0.2) -> 294 | G100: 72 | H100: 92 | I100: =RC[-5]*60 -> 30780 | J100: =RC[-5]*60 -> 24600 | K100: =RC[-5]*60 -> 17640 | L100: =RC[-3]&"/3600*(nPatrolSec+3)*(1000+nGuanQia)/1000" -> 30780/3600*(nPatrolSec+3)*(1000+nGuanQia)/1000 | M100: =RC[-3]&"/3600*(nPatrolSec+3)*(1000+nGuanQia)/1000" -> 24600/3600*(nPatrolSec+3)*(1000+nGuanQia)/1000 | N100: =RC[-3]&"/3600*(nPatrolSec+3)*(1000+nGuanQia)/1000" -> 17640/3600*(nPatrolSec+3)*(1000+nGuanQia)/1000 | O100: =RC[-6]&"/60*nMin*(1000+nGuanQia)/1000" -> 30780/60*nMin*(1000+nGuanQia)/1000 | P100: =RC[-6]&"/60*nMin*(1000+nGuanQia)/1000" -> 24600/60*nMin*(1000+nGuanQia)/1000 | Q100: =RC[-6]&"/60*nMin*(1000+nGuanQia)/1000" -> 17640/60*nMin*(1000+nGuanQia)/1000 | W100: 10034 | X100: =R[-3]C -> 20000 | Y100: =RC[-2]+RC[-1] -> 30034
B101: 73 | C101: 93 | D101: =INT((RC[-1]*35+200)*(1+2)/4*0.2) -> 518 | E101: =INT((RC[-2]*28+160)*(1+2)/4*0.2) -> 414 | F101: =INT(10000*0.1*(100+1)/100*(1+RC[-3]/200)*0.2) -> 295 | G101: 73 | H101: 93 | I101: =RC[-5]*60 -> 31080 | J101: =RC[-5]*60 -> 24840 | K101: =RC[-5]*60 -> 17700 | L101: =RC[-3]&"/3600*(nPatrolSec+3)*(1000+nGuanQia)/1000" -> 31080/3600*(nPatrolSec+3)*(1000+nGuanQia)/1000 | M101: =RC[-3]&"/3600*(nPatrolSec+3)*(1000+nGuanQia)/1000" -> 24840/3600*(nPatrolSec+3)*(1000+nGuanQia)/1000 | N101: =RC[-3]&"/3600*(nPatrolSec+3)*(1000+nGuanQia)/1000" -> 17700/3600*(nPatrolSec+3)*(1000+nGuanQia)/1000 | O101: =RC[-6]&"/60*nMin*(1000+nGuanQia)/1000" -> 31080/60*nMin*(1000+nGuanQia)/1000 | P101: =RC[-6]&"/60*nMin*(1000+nGuanQia)/1000" -> 24840/60*nMin*(1000+nGuanQia)/1000 | Q101: =RC[-6]&"/60*nMin*(1000+nGuanQia)/1000" -> 17700/60*nMin*(1000+nGuanQia)/1000 | W101: 0 | X101: =R[-3]C -> 0 | Y101: =RC[-2]+RC[-1] -> 0
B102: 74 | C102: 94 | D102: =INT((RC[-1]*35+200)*(1+2)/4*0.2) -> 523 | E102: =INT((RC[-2]*28+160)*(1+2)/4*0.2) -> 418 | F102: =INT(10000*0.1*(100+1)/100*(1+RC[-3]/200)*0.2) -> 296 | G102: 74 | H102: 94 | I102: =RC[-5]*60 -> 31380 | J102: =RC[-5]*60 -> 25080 | K102: =RC[-5]*60 -> 17760 | L102: =RC[-3]&"/3600*(nPatrolSec+3)*(1000+nGuanQia)/1000" -> 31380/3600*(nPatrolSec+3)*(1000+nGuanQia)/1000 | M102: =RC[-3]&"/3600*(nPatrolSec+3)*(1000+nGuanQia)/1000" -> 25080/3600*(nPatrolSec+3)*(1000+nGuanQia)/1000 | N102: =RC[-3]&"/3600*(nPatrolSec+3)*(1000+nGuanQia)/1000" -> 17760/3600*(nPatrolSec+3)*(1000+nGuanQia)/1000 | O102: =RC[-6]&"/60*nMin*(1000+nGuanQia)/1000" -> 31380/60*nMin*(1000+nGuanQia)/1000 | P102: =RC[-6]&"/60*nMin*(1000+nGuanQia)/1000" -> 25080/60*nMin*(1000+nGuanQia)/1000 | Q102: =RC[-6]&"/60*nMin*(1000+nGuanQia)/1000" -> 17760/60*nMin*(1000+nGuanQia)/1000 | W102: 0 | X102: =R[-3]C -> 0 | Y102: =RC[-2]+RC[-1] -> 0
B103: 75 | C103: 95 | D103: =INT((RC[-1]*35+200)*(1+2)/4*0.2) -> 528 | E103: =INT((RC[-2]*28+160)*(1+2)/4*0.2) -> 423 | F103: =INT(10000*0.1*(100+1)/100*(1+RC[-3]/200)*0.2) -> 297 | G103: 75 | H103: 95 | I103: =RC[-5]*60 -> 31680 | J103: =RC[-5]*60 -> 25380 | K103: =RC[-5]*60 -> 17820 | L103: =RC[-3]&"/3600*(nPatrolSec+3)*(1000+nGuanQia)/1000" -> 31680/3600*(nPatrolSec+3)*(1000+nGuanQia)/1000 | M103: =RC[-3]&"/3600*(nPatrolSec+3)*(1000+nGuanQia)/1000" -> 25380/3600*(nPatrolSec+3)*(1000+nGuanQia)/1000 | N103: =RC[-3]&"/3600*(nPatrolSec+3)*(1000+nGuanQia)/1000" -> 17820/3600*(nPatrolSec+3)*(1000+nGuanQia)/1000 | O103: =RC[-6]&"/60*nMin*(1000+nGuanQia)/1000" -> 31680/60*nMin*(1000+nGuanQia)/1000 | P103: =RC[-6]&"/60*nMin*(1000+nGuanQia)/1000" -> 25380/60*nMin*(1000+nGuanQia)/1000 | Q103: =RC[-6]&"/60*nMin*(1000+nGuanQia)/1000" -> 17820/60*nMin*(1000+nGuanQia)/1000 | W103: 10035 | X103: =R[-3]C -> 20000 | Y103: =RC[-2]+RC[-1] -> 30035
B104: 76 | C104: 96 | D104: =INT((RC[-1]*35+200)*(1+2)/4*0.2) -> 534 | E104: =INT((RC[-2]*28+160)*(1+2)/4*0.2) -> 427 | F104: =INT(10000*0.1*(100+1)/100*(1+RC[-3]/200)*0.2) -> 298 | G104: 76 | H104: 96 | I104: =RC[-5]*60 -> 32040 | J104: =RC[-5]*60 -> 25620 | K104: =RC[-5]*60 -> 17880 | L104: =RC[-3]&"/3600*(nPatrolSec+3)*(1000+nGuanQia)/1000" -> 32040/3600*(nPatrolSec+3)*(1000+nGuanQia)/1000 | M104: =RC[-3]&"/3600*(nPatrolSec+3)*(1000+nGuanQia)/1000" -> 25620/3600*(nPatrolSec+3)*(1000+nGuanQia)/1000 | N104: =RC[-3]&"/3600*(nPatrolSec+3)*(1000+nGuanQia)/1000" -> 17880/3600*(nPatrolSec+3)*(1000+nGuanQia)/1000 | O104: =RC[-6]&"/60*nMin*(1000+nGuanQia)/1000" -> 32040/60*nMin*(1000+nGuanQia)/1000 | P104: =RC[-6]&"/60*nMin*(1000+nGuanQia)/1000" -> 25620/60*nMin*(1000+nGuanQia)/1000 | Q104: =RC[-6]&"/60*nMin*(1000+nGuanQia)/1000" -> 17880/60*nMin*(1000+nGuanQia)/1000 | W104: 0 | X104: =R[-3]C -> 0 | Y104: =RC[-2]+RC[-1] -> 0
B105: 77 | C105: 97 | D105: =INT((RC[-1]*35+200)*(1+2)/4*0.2) -> 539 | E105: =INT((RC[-2]*28+160)*(1+2)/4*0.2) -> 431 | F105: =INT(10000*0.1*(100+1)/100*(1+RC[-3]/200)*0.2) -> 299 | G105: 77 | H105: 97 | I105: =RC[-5]*60 -> 32340 | J105: =RC[-5]*60 -> 25860 | K105: =RC[-5]*60 -> 17940 | L105: =RC[-3]&"/3600*(nPatrolSec+3)*(1000+nGuanQia)/1000" -> 32340/3600*(nPatrolSec+3)*(1000+nGuanQia)/1000 | M105: =RC[-3]&"/3600*(nPatrolSec+3)*(1000+nGuanQia)/1000" -> 25860/3600*(nPatrolSec+3)*(1000+nGuanQia)/1000 | N105: =RC[-3]&"/3600*(nPatrolSec+3)*(1000+nGuanQia)/1000" -> 17940/3600*(nPatrolSec+3)*(1000+nGuanQia)/1000 | O105: =RC[-6]&"/60*nMin*(1000+nGuanQia)/1000" -> 32340/60*nMin*(1000+nGuanQia)/1000 | P105: =RC[-6]&"/60*nMin*(1000+nGuanQia)/1000" -> 25860/60*nMin*(1000+nGuanQia)/1000 | Q105: =RC[-6]&"/60*nMin*(1000+nGuanQia)/1000" -> 17940/60*nMin*(1000+nGuanQia)/1000 | W105: 0 | X105: =R[-3]C -> 0 | Y105: =RC[-2]+RC[-1] -> 0
B106: 78 | C106: 98 | D106: =INT((RC[-1]*35+200)*(1+2)/4*0.2) -> 544 | E106: =INT((RC[-2]*28+160)*(1+2)/4*0.2) -> 435 | F106: =INT(10000*0.1*(100+1)/100*(1+RC[-3]/200)*0.2) -> 300 | G106: 78 | H106: 98 | I106: =RC[-5]*60 -> 32640 | J106: =RC[-5]*60 -> 26100 | K106: =RC[-5]*60 -> 18000 | L106: =RC[-3]&"/3600*(nPatrolSec+3)*(1000+nGuanQia)/1000" -> 32640/3600*(nPatrolSec+3)*(1000+nGuanQia)/1000 | M106: =RC[-3]&"/3600*(nPatrolSec+3)*(1000+nGuanQia)/1000" -> 26100/3600*(nPatrolSec+3)*(1000+nGuanQia)/1000 | N106: =RC[-3]&"/3600*(nPatrolSec+3)*(1000+nGuanQia)/1000" -> 18000/3600*(nPatrolSec+3)*(1000+nGuanQia)/1000 | O106: =RC[-6]&"/60*nMin*(1000+nGuanQia)/1000" -> 32640/60*nMin*(1000+nGuanQia)/1000 | P106: =RC[-6]&"/60*nMin*(1000+nGuanQia)/1000" -> 26100/60*nMin*(1000+nGuanQia)/1000 | Q106: =RC[-6]&"/60*nMin*(1000+nGuanQia)/1000" -> 18000/60*nMin*(1000+nGuanQia)/1000 | W106: 10036 | X106: =R[-3]C -> 20000 | Y106: =RC[-2]+RC[-1] -> 30036
B107: 79 | C107: 99 | D107: =INT((RC[-1]*35+200)*(1+2)/4*0.2) -> 549 | E107: =INT((RC[-2]*28+160)*(1+2)/4*0.2) -> 439 | F107: =INT(10000*0.1*(100+1)/100*(1+RC[-3]/200)*0.2) -> 301 | G107: 79 | H107: 99 | I107: =RC[-5]*60 -> 32940 | J107: =RC[-5]*60 -> 26340 | K107: =RC[-5]*60 -> 18060 | L107: =RC[-3]&"/3600*(nPatrolSec+3)*(1000+nGuanQia)/1000" -> 32940/3600*(nPatrolSec+3)*(1000+nGuanQia)/1000 | M107: =RC[-3]&"/3600*(nPatrolSec+3)*(1000+nGuanQia)/1000" -> 26340/3600*(nPatrolSec+3)*(1000+nGuanQia)/1000 | N107: =RC[-3]&"/3600*(nPatrolSec+3)*(1000+nGuanQia)/1000" -> 18060/3600*(nPatrolSec+3)*(1000+nGuanQia)/1000 | O107: =RC[-6]&"/60*nMin*(1000+nGuanQia)/1000" -> 32940/60*nMin*(1000+nGuanQia)/1000 | P107: =RC[-6]&"/60*nMin*(1000+nGuanQia)/1000" -> 26340/60*nMin*(1000+nGuanQia)/1000 | Q107: =RC[-6]&"/60*nMin*(1000+nGuanQia)/1000" -> 18060/60*nMin*(1000+nGuanQia)/1000 | W107: 0 | X107: =R[-3]C -> 0 | Y107: =RC[-2]+RC[-1] -> 0
B108: 80 | C108: 100 | D108: =INT((RC[-1]*35+200)*(1+2)/4*0.2) -> 555 | E108: =INT((RC[-2]*28+160)*(1+2)/4*0.2) -> 444 | F108: =INT(10000*0.1*(100+1)/100*(1+RC[-3]/200)*0.2) -> 303 | G108: 80 | H108: 100 | I108: =RC[-5]*60 -> 33300 | J108: =RC[-5]*60 -> 26640 | K108: =RC[-5]*60 -> 18180 | L108: =RC[-3]&"/3600*(nPatrolSec+3)*(1000+nGuanQia)/1000" -> 33300/3600*(nPatrolSec+3)*(1000+nGuanQia)/1000 | M108: =RC[-3]&"/3600*(nPatrolSec+3)*(1000+nGuanQia)/1000" -> 26640/3600*(nPatrolSec+3)*(1000+nGuanQia)/1000 | N108: =RC[-3]&"/3600*(nPatrolSec+3)*(1000+nGuanQia)/1000" -> 18180/3600*(nPatrolSec+3)*(1000+nGuanQia)/1000 | O108: =RC[-6]&"/60*nMin*(1000+nGuanQia)/1000" -> 33300/60*nMin*(1000+nGuanQia)/1000 | P108: =RC[-6]&"/60*nMin*(1000+nGuanQia)/1000" -> 26640/60*nMin*(1000+nGuanQia)/1000 | Q108: =RC[-6]&"/60*nMin*(1000+nGuanQia)/1000" -> 18180/60*nMin*(1000+nGuanQia)/1000 | W108: 0 | X108: =R[-3]C -> 0 | Y108: =RC[-2]+RC[-1] -> 0
B109: 81 | C109: =R[-1]C+1 -> 101 | D109: =INT((RC[-1]*35+200)*(1+2)/4*0.2) -> 560 | E109: =INT((RC[-2]*28+160)*(1+2)/4*0.2) -> 448 | F109: =INT(10000*0.1*(100+1)/100*(1+RC[-3]/200)*0.2) -> 304 | G109: 81 | H109: =R[-1]C+1 -> 101 | I109: =RC[-5]*60 -> 33600 | J109: =RC[-5]*60 -> 26880 | K109: =RC[-5]*60 -> 18240 | L109: =RC[-3]&"/3600*(nPatrolSec+3)*(1000+nGuanQia)/1000" -> 33600/3600*(nPatrolSec+3)*(1000+nGuanQia)/1000 | M109: =RC[-3]&"/3600*(nPatrolSec+3)*(1000+nGuanQia)/1000" -> 26880/3600*(nPatrolSec+3)*(1000+nGuanQia)/1000 | N109: =RC[-3]&"/3600*(nPatrolSec+3)*(1000+nGuanQia)/1000" -> 18240/3600*(nPatrolSec+3)*(1000+nGuanQia)/1000 | O109: =RC[-6]&"/60*nMin*(1000+nGuanQia)/1000" -> 33600/60*nMin*(1000+nGuanQia)/1000 | P109: =RC[-6]&"/60*nMin*(1000+nGuanQia)/1000" -> 26880/60*nMin*(1000+nGuanQia)/1000 | Q109: =RC[-6]&"/60*nMin*(1000+nGuanQia)/1000" -> 18240/60*nMin*(1000+nGuanQia)/1000 | W109: 10037 | X109: =R[-3]C -> 20000 | Y109: =RC[-2]+RC[-1] -> 30037
B110: 82 | C110: =R[-1]C+1 -> 102 | D110: =INT((RC[-1]*35+200)*(1+2)/4*0.2) -> 565 | E110: =INT((RC[-2]*28+160)*(1+2)/4*0.2) -> 452 | F110: =INT(10000*0.1*(100+1)/100*(1+RC[-3]/200)*0.2) -> 305 | G110: 82 | H110: =R[-1]C+1 -> 102 | I110: =RC[-5]*60 -> 33900 | J110: =RC[-5]*60 -> 27120 | K110: =RC[-5]*60 -> 18300 | L110: =RC[-3]&"/3600*(nPatrolSec+3)*(1000+nGuanQia)/1000" -> 33900/3600*(nPatrolSec+3)*(1000+nGuanQia)/1000 | M110: =RC[-3]&"/3600*(nPatrolSec+3)*(1000+nGuanQia)/1000" -> 27120/3600*(nPatrolSec+3)*(1000+nGuanQia)/1000 | N110: =RC[-3]&"/3600*(nPatrolSec+3)*(1000+nGuanQia)/1000" -> 18300/3600*(nPatrolSec+3)*(1000+nGuanQia)/1000 | O110: =RC[-6]&"/60*nMin*(1000+nGuanQia)/1000" -> 33900/60*nMin*(1000+nGuanQia)/1000 | P110: =RC[-6]&"/60*nMin*(1000+nGuanQia)/1000" -> 27120/60*nMin*(1000+nGuanQia)/1000 | Q110: =RC[-6]&"/60*nMin*(1000+nGuanQia)/1000" -> 18300/60*nMin*(1000+nGuanQia)/1000 | W110: 0 | X110: =R[-3]C -> 0 | Y110: =RC[-2]+RC[-1] -> 0
B111: 83 | C111: =R[-1]C+1 -> 103 | D111: =INT((RC[-1]*35+200)*(1+2)/4*0.2) -> 570 | E111: =INT((RC[-2]*28+160)*(1+2)/4*0.2) -> 456 | F111: =INT(10000*0.1*(100+1)/100*(1+RC[-3]/200)*0.2) -> 306 | G111: 83 | H111: =R[-1]C+1 -> 103 | I111: =RC[-5]*60 -> 34200 | J111: =RC[-5]*60 -> 27360 | K111: =RC[-5]*60 -> 18360 | L111: =RC[-3]&"/3600*(nPatrolSec+3)*(1000+nGuanQia)/1000" -> 34200/3600*(nPatrolSec+3)*(1000+nGuanQia)/1000 | M111: =RC[-3]&"/3600*(nPatrolSec+3)*(1000+nGuanQia)/1000" -> 27360/3600*(nPatrolSec+3)*(1000+nGuanQia)/1000 | N111: =RC[-3]&"/3600*(nPatrolSec+3)*(1000+nGuanQia)/1000" -> 18360/3600*(nPatrolSec+3)*(1000+nGuanQia)/1000 | O111: =RC[-6]&"/60*nMin*(1000+nGuanQia)/1000" -> 34200/60*nMin*(1000+nGuanQia)/1000 | P111: =RC[-6]&"/60*nMin*(1000+nGuanQia)/1000" -> 27360/60*nMin*(1000+nGuanQia)/1000 | Q111: =RC[-6]&"/60*nMin*(1000+nGuanQia)/1000" -> 18360/60*nMin*(1000+nGuanQia)/1000 | W111: 0 | X111: =R[-3]C -> 0 | Y111: =RC[-2]+RC[-1] -> 0
B112: 84 | C112: =R[-1]C+1 -> 104 | D112: =INT((RC[-1]*35+200)*(1+2)/4*0.2) -> 576 | E112: =INT((RC[-2]*28+160)*(1+2)/4*0.2) -> 460 | F112: =INT(10000*0.1*(100+1)/100*(1+RC[-3]/200)*0.2) -> 307 | G112: 84 | H112: =R[-1]C+1 -> 104 | I112: =RC[-5]*60 -> 34560 | J112: =RC[-5]*60 -> 27600 | K112: =RC[-5]*60 -> 18420 | L112: =RC[-3]&"/3600*(nPatrolSec+3)*(1000+nGuanQia)/1000" -> 34560/3600*(nPatrolSec+3)*(1000+nGuanQia)/1000 | M112: =RC[-3]&"/3600*(nPatrolSec+3)*(1000+nGuanQia)/1000" -> 27600/3600*(nPatrolSec+3)*(1000+nGuanQia)/1000 | N112: =RC[-3]&"/3600*(nPatrolSec+3)*(1000+nGuanQia)/1000" -> 18420/3600*(nPatrolSec+3)*(1000+nGuanQia)/1000 | O112: =RC[-6]&"/60*nMin*(1000+nGuanQia)/1000" -> 34560/60*nMin*(1000+nGuanQia)/1000 | P112: =RC[-6]&"/60*nMin*(1000+nGuanQia)/1000" -> 27600/60*nMin*(1000+nGuanQia)/1000 | Q112: =RC[-6]&"/60*nMin*(1000+nGuanQia)/1000" -> 18420/60*nMin*(1000+nGuanQia)/1000 | W112: 10038 | X112: =R[-3]C -> 20000 | Y112: =RC[-2]+RC[-1] -> 30038
B113: 85 | C113: =R[-1]C+1 -> 105 | D113: =INT((RC[-1]*35+200)*(1+2)/4*0.2) -> 581 | E113: =INT((RC[-2]*28+160)*(1+2)/4*0.2) -> 465 | F113: =INT(10000*0.1*(100+1)/100*(1+RC[-3]/200)*0.2) -> 308 | G113: 85 | H113: =R[-1]C+1 -> 105 | I113: =RC[-5]*60 -> 34860 | J113: =RC[-5]*60 -> 27900 | K113: =RC[-5]*60 -> 18480 | L113: =RC[-3]&"/3600*(nPatrolSec+3)*(1000+nGuanQia)/1000" -> 34860/3600*(nPatrolSec+3)*(1000+nGuanQia)/1000 | M113: =RC[-3]&"/3600*(nPatrolSec+3)*(1000+nGuanQia)/1000" -> 27900/3600*(nPatrolSec+3)*(1000+nGuanQia)/1000 | N113: =RC[-3]&"/3600*(nPatrolSec+3)*(1000+nGuanQia)/1000" -> 18480/3600*(nPatrolSec+3)*(1000+nGuanQia)/1000 | O113: =RC[-6]&"/60*nMin*(1000+nGuanQia)/1000" -> 34860/60*nMin*(1000+nGuanQia)/1000 | P113: =RC[-6]&"/60*nMin*(1000+nGuanQia)/1000" -> 27900/60*nMin*(1000+nGuanQia)/1000 | Q113: =RC[-6]&"/60*nMin*(1000+nGuanQia)/1000" -> 18480/60*nMin*(1000+nGuanQia)/1000 | W113: 0 | X113: =R[-3]C -> 0 | Y113: =RC[-2]+RC[-1] -> 0
B114: 86 | C114: =R[-1]C+1 -> 106 | D114: =INT((RC[-1]*35+200)*(1+2)/4*0.2) -> 586 | E114: =INT((RC[-2]*28+160)*(1+2)/4*0.2) -> 469 | F114: =INT(10000*0.1*(100+1)/100*(1+RC[-3]/200)*0.2) -> 309 | G114: 86 | H114: =R[-1]C+1 -> 106 | I114: =RC[-5]*60 -> 35160 | J114: =RC[-5]*60 -> 28140 | K114: =RC[-5]*60 -> 18540 | L114: =RC[-3]&"/3600*(nPatrolSec+3)*(1000+nGuanQia)/1000" -> 35160/3600*(nPatrolSec+3)*(1000+nGuanQia)/1000 | M114: =RC[-3]&"/3600*(nPatrolSec+3)*(1000+nGuanQia)/1000" -> 28140/3600*(nPatrolSec+3)*(1000+nGuanQia)/1000 | N114: =RC[-3]&"/3600*(nPatrolSec+3)*(1000+nGuanQia)/1000" -> 18540/3600*(nPatrolSec+3)*(1000+nGuanQia)/1000 | O114: =RC[-6]&"/60*nMin*(1000+nGuanQia)/1000" -> 35160/60*nMin*(1000+nGuanQia)/1000 | P114: =RC[-6]&"/60*nMin*(1000+nGuanQia)/1000" -> 28140/60*nMin*(1000+nGuanQia)/1000 | Q114: =RC[-6]&"/60*nMin*(1000+nGuanQia)/1000" -> 18540/60*nMin*(1000+nGuanQia)/1000 | W114: 0 | X114: =R[-3]C -> 0 | Y114: =RC[-2]+RC[-1] -> 0
B115: 87 | C115: =R[-1]C+1 -> 107 | D115: =INT((RC[-1]*35+200)*(1+2)/4*0.2) -> 591 | E115: =INT((RC[-2]*28+160)*(1+2)/4*0.2) -> 473 | F115: =INT(10000*0.1*(100+1)/100*(1+RC[-3]/200)*0.2) -> 310 | G115: 87 | H115: =R[-1]C+1 -> 107 | I115: =RC[-5]*60 -> 35460 | J115: =RC[-5]*60 -> 28380 | K115: =RC[-5]*60 -> 18600 | L115: =RC[-3]&"/3600*(nPatrolSec+3)*(1000+nGuanQia)/1000" -> 35460/3600*(nPatrolSec+3)*(1000+nGuanQia)/1000 | M115: =RC[-3]&"/3600*(nPatrolSec+3)*(1000+nGuanQia)/1000" -> 28380/3600*(nPatrolSec+3)*(1000+nGuanQia)/1000 | N115: =RC[-3]&"/3600*(nPatrolSec+3)*(1000+nGuanQia)/1000" -> 18600/3600*(nPatrolSec+3)*(1000+nGuanQia)/1000 | O115: =RC[-6]&"/60*nMin*(1000+nGuanQia)/1000" -> 35460/60*nMin*(1000+nGuanQia)/1000 | P115: =RC[-6]&"/60*nMin*(1000+nGuanQia)/1000" -> 28380/60*nMin*(1000+nGuanQia)/1000 | Q115: =RC[-6]&"/60*nMin*(1000+nGuanQia)/1000" -> 18600/60*nMin*(1000+nGuanQia)/1000 | W115: 10039 | X115: =R[-3]C -> 20000 | Y115: =RC[-2]+RC[-1] -> 30039
B116: 88 | C116: =R[-1]C+1 -> 108 | D116: =INT((RC[-1]*35+200)*(1+2)/4*0.2) -> 597 | E116: =INT((RC[-2]*28+160)*(1+2)/4*0.2) -> 477 | F116: =INT(10000*0.1*(100+1)/100*(1+RC[-3]/200)*0.2) -> 311 | G116: 88 | H116: =R[-1]C+1 -> 108 | I116: =RC[-5]*60 -> 35820 | J116: =RC[-5]*60 -> 28620 | K116: =RC[-5]*60 -> 18660 | L116: =RC[-3]&"/3600*(nPatrolSec+3)*(1000+nGuanQia)/1000" -> 35820/3600*(nPatrolSec+3)*(1000+nGuanQia)/1000 | M116: =RC[-3]&"/3600*(nPatrolSec+3)*(1000+nGuanQia)/1000" -> 28620/3600*(nPatrolSec+3)*(1000+nGuanQia)/1000 | N116: =RC[-3]&"/3600*(nPatrolSec+3)*(1000+nGuanQia)/1000" -> 18660/3600*(nPatrolSec+3)*(1000+nGuanQia)/1000 | O116: =RC[-6]&"/60*nMin*(1000+nGuanQia)/1000" -> 35820/60*nMin*(1000+nGuanQia)/1000 | P116: =RC[-6]&"/60*nMin*(1000+nGuanQia)/1000" -> 28620/60*nMin*(1000+nGuanQia)/1000 | Q116: =RC[-6]&"/60*nMin*(1000+nGuanQia)/1000" -> 18660/60*nMin*(1000+nGuanQia)/1000 | W116: 0 | X116: =R[-3]C -> 0 | Y116: =RC[-2]+RC[-1] -> 0
B117: 89 | C117: =R[-1]C+1 -> 109 | D117: =INT((RC[-1]*35+200)*(1+2)/4*0.2) -> 602 | E117: =INT((RC[-2]*28+160)*(1+2)/4*0.2) -> 481 | F117: =INT(10000*0.1*(100+1)/100*(1+RC[-3]/200)*0.2) -> 312 | G117: 89 | H117: =R[-1]C+1 -> 109 | I117: =RC[-5]*60 -> 36120 | J117: =RC[-5]*60 -> 28860 | K117: =RC[-5]*60 -> 18720 | L117: =RC[-3]&"/3600*(nPatrolSec+3)*(1000+nGuanQia)/1000" -> 36120/3600*(nPatrolSec+3)*(1000+nGuanQia)/1000 | M117: =RC[-3]&"/3600*(nPatrolSec+3)*(1000+nGuanQia)/1000" -> 28860/3600*(nPatrolSec+3)*(1000+nGuanQia)/1000 | N117: =RC[-3]&"/3600*(nPatrolSec+3)*(1000+nGuanQia)/1000" -> 18720/3600*(nPatrolSec+3)*(1000+nGuanQia)/1000 | O117: =RC[-6]&"/60*nMin*(1000+nGuanQia)/1000" -> 36120/60*nMin*(1000+nGuanQia)/1000 | P117: =RC[-6]&"/60*nMin*(1000+nGuanQia)/1000" -> 28860/60*nMin*(1000+nGuanQia)/1000 | Q117: =RC[-6]&"/60*nMin*(1000+nGuanQia)/1000" -> 18720/60*nMin*(1000+nGuanQia)/1000 | W117: 0 | X117: =R[-3]C -> 0 | Y117: =RC[-2]+RC[-1] -> 0
B118: 90 | C118: =R[-1]C+1 -> 110 | D118: =INT((RC[-1]*35+200)*(1+2)/4*0.2) -> 607 | E118: =INT((RC[-2]*28+160)*(1+2)/4*0.2) -> 486 | F118: =INT(10000*0.1*(100+1)/100*(1+RC[-3]/200)*0.2) -> 313 | G118: 90 | H118: =R[-1]C+1 -> 110 | I118: =RC[-5]*60 -> 36420 | J118: =RC[-5]*60 -> 29160 | K118: =RC[-5]*60 -> 18780 | L118: =RC[-3]&"/3600*(nPatrolSec+3)*(1000+nGuanQia)/1000" -> 36420/3600*(nPatrolSec+3)*(1000+nGuanQia)/1000 | M118: =RC[-3]&"/3600*(nPatrolSec+3)*(1000+nGuanQia)/1000" -> 29160/3600*(nPatrolSec+3)*(1000+nGuanQia)/1000 | N118: =RC[-3]&"/3600*(nPatrolSec+3)*(1000+nGuanQia)/1000" -> 18780/3600*(nPatrolSec+3)*(1000+nGuanQia)/1000 | O118: =RC[-6]&"/60*nMin*(1000+nGuanQia)/1000" -> 36420/60*nMin*(1000+nGuanQia)/1000 | P118: =RC[-6]&"/60*nMin*(1000+nGuanQia)/1000" -> 29160/60*nMin*(1000+nGuanQia)/1000 | Q118: =RC[-6]&"/60*nMin*(1000+nGuanQia)/1000" -> 18780/60*nMin*(1000+nGuanQia)/1000 | W118: 10040 | X118: =R[-3]C -> 20000 | Y118: =RC[-2]+RC[-1] -> 30040
B119: 91 | C119: =R[-1]C+1 -> 111 | D119: =INT((RC[-1]*35+200)*(1+2)/4*0.2) -> 612 | E119: =INT((RC[-2]*28+160)*(1+2)/4*0.2) -> 490 | F119: =INT(10000*0.1*(100+1)/100*(1+RC[-3]/200)*0.2) -> 314 | G119: 91 | H119: =R[-1]C+1 -> 111 | I119: =RC[-5]*60 -> 36720 | J119: =RC[-5]*60 -> 29400 | K119: =RC[-5]*60 -> 18840 | L119: =RC[-3]&"/3600*(nPatrolSec+3)*(1000+nGuanQia)/1000" -> 36720/3600*(nPatrolSec+3)*(1000+nGuanQia)/1000 | M119: =RC[-3]&"/3600*(nPatrolSec+3)*(1000+nGuanQia)/1000" -> 29400/3600*(nPatrolSec+3)*(1000+nGuanQia)/1000 | N119: =RC[-3]&"/3600*(nPatrolSec+3)*(1000+nGuanQia)/1000" -> 18840/3600*(nPatrolSec+3)*(1000+nGuanQia)/1000 | O119: =RC[-6]&"/60*nMin*(1000+nGuanQia)/1000" -> 36720/60*nMin*(1000+nGuanQia)/1000 | P119: =RC[-6]&"/60*nMin*(1000+nGuanQia)/1000" -> 29400/60*nMin*(1000+nGuanQia)/1000 | Q119: =RC[-6]&"/60*nMin*(1000+nGuanQia)/1000" -> 18840/60*nMin*(1000+nGuanQia)/1000 | W119: 0 | X119: =R[-3]C -> 0 | Y119: =RC[-2]+RC[-1] -> 0
B120: 92 | C120: =R[-1]C+1 -> 112 | D120: =INT((RC[-1]*35+200)*(1+2)/4*0.2) -> 618 | E120: =INT((RC[-2]*28+160)*(1+2)/4*0.2) -> 494 | F120: =INT(10000*0.1*(100+1)/100*(1+RC[-3]/200)*0.2) -> 315 | G120: 92 | H120: =R[-1]C+1 -> 112 | I120: =RC[-5]*60 -> 37080 | J120: =RC[-5]*60 -> 29640 | K120: =RC[-5]*60 -> 18900 | L120: =RC[-3]&"/3600*(nPatrolSec+3)*(1000+nGuanQia)/1000" -> 37080/3600*(nPatrolSec+3)*(1000+nGuanQia)/1000 | M120: =RC[-3]&"/3600*(nPatrolSec+3)*(1000+nGuanQia)/1000" -> 29640/3600*(nPatrolSec+3)*(1000+nGuanQia)/1000 | N120: =RC[-3]&"/3600*(nPatrolSec+3)*(1000+nGuanQia)/1000" -> 18900/3600*(nPatrolSec+3)*(1000+nGuanQia)/1000 | O120: =RC[-6]&"/60*nMin*(1000+nGuanQia)/1000" -> 37080/60*nMin*(1000+nGuanQia)/1000 | P120: =RC[-6]&"/60*nMin*(1000+nGuanQia)/1000" -> 29640/60*nMin*(1000+nGuanQia)/1000 | Q120: =RC[-6]&"/60*nMin*(1000+nGuanQia)/1000" -> 18900/60*nMin*(1000+nGuanQia)/1000 | W120: 0 | X120: =R[-3]C -> 0 | Y120: =RC[-2]+RC[-1] -> 0
B121: 93 | C121: =R[-1]C+1 -> 113 | D121: =INT((RC[-1]*35+200)*(1+2)/4*0.2) -> 623 | E121: =INT((RC[-2]*28+160)*(1+2)/4*0.2) -> 498 | F121: =INT(10000*0.1*(100+1)/100*(1+RC[-3]/200)*0.2) -> 316 | G121: 93 | H121: =R[-1]C+1 -> 113 | I121: =RC[-5]*60 -> 37380 | J121: =RC[-5]*60 -> 29880 | K121: =RC[-5]*60 -> 18960 | L121: =RC[-3]&"/3600*(nPatrolSec+3)*(1000+nGuanQia)/1000" -> 37380/3600*(nPatrolSec+3)*(1000+nGuanQia)/1000 | M121: =RC[-3]&"/3600*(nPatrolSec+3)*(1000+nGuanQia)/1000" -> 29880/3600*(nPatrolSec+3)*(1000+nGuanQia)/1000 | N121: =RC[-3]&"/3600*(nPatrolSec+3)*(1000+nGuanQia)/1000" -> 18960/3600*(nPatrolSec+3)*(1000+nGuanQia)/1000 | O121: =RC[-6]&"/60*nMin*(1000+nGuanQia)/1000" -> 37380/60*nMin*(1000+nGuanQia)/1000 | P121: =RC[-6]&"/60*nMin*(1000+nGuanQia)/1000" -> 29880/60*nMin*(1000+nGuanQia)/1000 | Q121: =RC[-6]&"/60*nMin*(1000+nGuanQia)/1000" -> 18960/60*nMin*(1000+nGuanQia)/1000 | W121: 10041 | X121: =R[-3]C -> 20000 | Y121: =RC[-2]+RC[-1] -> 30041
B122: 94 | C122: =R[-1]C+1 -> 114 | D122: =INT((RC[-1]*35+200)*(1+2)/4*0.2) -> 628 | E122: =INT((RC[-2]*28+160)*(1+2)/4*0.2) -> 502 | F122: =INT(10000*0.1*(100+1)/100*(1+RC[-3]/200)*0.2) -> 317 | G122: 94 | H122: =R[-1]C+1 -> 114 | I122: =RC[-5]*60 -> 37680 | J122: =RC[-5]*60 -> 30120 | K122: =RC[-5]*60 -> 19020 | L122: =RC[-3]&"/3600*(nPatrolSec+3)*(1000+nGuanQia)/1000" -> 37680/3600*(nPatrolSec+3)*(1000+nGuanQia)/1000 | M122: =RC[-3]&"/3600*(nPatrolSec+3)*(1000+nGuanQia)/1000" -> 30120/3600*(nPatrolSec+3)*(1000+nGuanQia)/1000 | N122: =RC[-3]&"/3600*(nPatrolSec+3)*(1000+nGuanQia)/1000" -> 19020/3600*(nPatrolSec+3)*(1000+nGuanQia)/1000 | O122: =RC[-6]&"/60*nMin*(1000+nGuanQia)/1000" -> 37680/60*nMin*(1000+nGuanQia)/1000 | P122: =RC[-6]&"/60*nMin*(1000+nGuanQia)/1000" -> 30120/60*nMin*(1000+nGuanQia)/1000 | Q122: =RC[-6]&"/60*nMin*(1000+nGuanQia)/1000" -> 19020/60*nMin*(1000+nGuanQia)/1000 | W122: 0 | X122: =R[-3]C -> 0 | Y122: =RC[-2]+RC[-1] -> 0
B123: 95 | C123: =R[-1]C+1 -> 115 | D123: =INT((RC[-1]*35+200)*(1+2)/4*0.2) -> 633 | E123: =INT((RC[-2]*28+160)*(1+2)/4*0.2) -> 507 | F123: =INT(10000*0.1*(100+1)/100*(1+RC[-3]/200)*0.2) -> 318 | G123: 95 | H123: =R[-1]C+1 -> 115 | I123: =RC[-5]*60 -> 37980 | J123: =RC[-5]*60 -> 30420 | K123: =RC[-5]*60 -> 19080 | L123: =RC[-3]&"/3600*(nPatrolSec+3)*(1000+nGuanQia)/1000" -> 37980/3600*(nPatrolSec+3)*(1000+nGuanQia)/1000 | M123: =RC[-3]&"/3600*(nPatrolSec+3)*(1000+nGuanQia)/1000" -> 30420/3600*(nPatrolSec+3)*(1000+nGuanQia)/1000 | N123: =RC[-3]&"/3600*(nPatrolSec+3)*(1000+nGuanQia)/1000" -> 19080/3600*(nPatrolSec+3)*(1000+nGuanQia)/1000 | O123: =RC[-6]&"/60*nMin*(1000+nGuanQia)/1000" -> 37980/60*nMin*(1000+nGuanQia)/1000 | P123: =RC[-6]&"/60*nMin*(1000+nGuanQia)/1000" -> 30420/60*nMin*(1000+nGuanQia)/1000 | Q123: =RC[-6]&"/60*nMin*(1000+nGuanQia)/1000" -> 19080/60*nMin*(1000+nGuanQia)/1000 | W123: 0 | X123: =R[-3]C -> 0 | Y123: =RC[-2]+RC[-1] -> 0
B124: 96 | C124: =R[-1]C+1 -> 116 | D124: =INT((RC[-1]*35+200)*(1+2)/4*0.2) -> 639 | E124: =INT((RC[-2]*28+160)*(1+2)/4*0.2) -> 511 | F124: =INT(10000*0.1*(100+1)/100*(1+RC[-3]/200)*0.2) -> 319 | G124: 96 | H124: =R[-1]C+1 -> 116 | I124: =RC[-5]*60 -> 38340 | J124: =RC[-5]*60 -> 30660 | K124: =RC[-5]*60 -> 19140 | L124: =RC[-3]&"/3600*(nPatrolSec+3)*(1000+nGuanQia)/1000" -> 38340/3600*(nPatrolSec+3)*(1000+nGuanQia)/1000 | M124: =RC[-3]&"/3600*(nPatrolSec+3)*(1000+nGuanQia)/1000" -> 30660/3600*(nPatrolSec+3)*(1000+nGuanQia)/1000 | N124: =RC[-3]&"/3600*(nPatrolSec+3)*(1000+nGuanQia)/1000" -> 19140/3600*(nPatrolSec+3)*(1000+nGuanQia)/1000 | O124: =RC[-6]&"/60*nMin*(1000+nGuanQia)/1000" -> 38340/60*nMin*(1000+nGuanQia)/1000 | P124: =RC[-6]&"/60*nMin*(1000+nGuanQia)/1000" -> 30660/60*nMin*(1000+nGuanQia)/1000 | Q124: =RC[-6]&"/60*nMin*(1000+nGuanQia)/1000" -> 19140/60*nMin*(1000+nGuanQia)/1000 | W124: 10042 | X124: =R[-3]C -> 20000 | Y124: =RC[-2]+RC[-1] -> 30042
B125: 97 | C125: =R[-1]C+1 -> 117 | D125: =INT((RC[-1]*35+200)*(1+2)/4*0.2) -> 644 | E125: =INT((RC[-2]*28+160)*(1+2)/4*0.2) -> 515 | F125: =INT(10000*0.1*(100+1)/100*(1+RC[-3]/200)*0.2) -> 320 | G125: 97 | H125: =R[-1]C+1 -> 117 | I125: =RC[-5]*60 -> 38640 | J125: =RC[-5]*60 -> 30900 | K125: =RC[-5]*60 -> 19200 | L125: =RC[-3]&"/3600*(nPatrolSec+3)*(1000+nGuanQia)/1000" -> 38640/3600*(nPatrolSec+3)*(1000+nGuanQia)/1000 | M125: =RC[-3]&"/3600*(nPatrolSec+3)*(1000+nGuanQia)/1000" -> 30900/3600*(nPatrolSec+3)*(1000+nGuanQia)/1000 | N125: =RC[-3]&"/3600*(nPatrolSec+3)*(1000+nGuanQia)/1000" -> 19200/3600*(nPatrolSec+3)*(1000+nGuanQia)/1000 | O125: =RC[-6]&"/60*nMin*(1000+nGuanQia)/1000" -> 38640/60*nMin*(1000+nGuanQia)/1000 | P125: =RC[-6]&"/60*nMin*(1000+nGuanQia)/1000" -> 30900/60*nMin*(1000+nGuanQia)/1000 | Q125: =RC[-6]&"/60*nMin*(1000+nGuanQia)/1000" -> 19200/60*nMin*(1000+nGuanQia)/1000 | W125: 0 | X125: =R[-3]C -> 0 | Y125: =RC[-2]+RC[-1] -> 0
B126: 98 | C126: =R[-1]C+1 -> 118 | D126: =INT((RC[-1]*35+200)*(1+2)/4*0.2) -> 649 | E126: =INT((RC[-2]*28+160)*(1+2)/4*0.2) -> 519 | F126: =INT(10000*0.1*(100+1)/100*(1+RC[-3]/200)*0.2) -> 321 | G126: 98 | H126: =R[-1]C+1 -> 118 | I126: =RC[-5]*60 -> 38940 | J126: =RC[-5]*60 -> 31140 | K126: =RC[-5]*60 -> 19260 | L126: =RC[-3]&"/3600*(nPatrolSec+3)*(1000+nGuanQia)/1000" -> 38940/3600*(nPatrolSec+3)*(1000+nGuanQia)/1000 | M126: =RC[-3]&"/3600*(nPatrolSec+3)*(1000+nGuanQia)/1000" -> 31140/3600*(nPatrolSec+3)*(1000+nGuanQia)/1000 | N126: =RC[-3]&"/3600*(nPatrolSec+3)*(1000+nGuanQia)/1000" -> 19260/3600*(nPatrolSec+3)*(1000+nGuanQia)/1000 | O126: =RC[-6]&"/60*nMin*(1000+nGuanQia)/1000" -> 38940/60*nMin*(1000+nGuanQia)/1000 | P126: =RC[-6]&"/60*nMin*(1000+nGuanQia)/1000" -> 31140/60*nMin*(1000+nGuanQia)/1000 | Q126: =RC[-6]&"/60*nMin*(1000+nGuanQia)/1000" -> 19260/60*nMin*(1000+nGuanQia)/1000 | W126: 0 | X126: =R[-3]C -> 0 | Y126: =RC[-2]+RC[-1] -> 0
B127: 99 | C127: =R[-1]C+1 -> 119 | D127: =INT((RC[-1]*35+200)*(1+2)/4*0.2) -> 654 | E127: =INT((RC[-2]*28+160)*(1+2)/4*0.2) -> 523 | F127: =INT(10000*0.1*(100+1)/100*(1+RC[-3]/200)*0.2) -> 322 | G127: 99 | H127: =R[-1]C+1 -> 119 | I127: =RC[-5]*60 -> 39240 | J127: =RC[-5]*60 -> 31380 | K127: =RC[-5]*60 -> 19320 | L127: =RC[-3]&"/3600*(nPatrolSec+3)*(1000+nGuanQia)/1000" -> 39240/3600*(nPatrolSec+3)*(1000+nGuanQia)/1000 | M127: =RC[-3]&"/3600*(nPatrolSec+3)*(1000+nGuanQia)/1000" -> 31380/3600*(nPatrolSec+3)*(1000+nGuanQia)/1000 | N127: =RC[-3]&"/3600*(nPatrolSec+3)*(1000+nGuanQia)/1000" -> 19320/3600*(nPatrolSec+3)*(1000+nGuanQia)/1000 | O127: =RC[-6]&"/60*nMin*(1000+nGuanQia)/1000" -> 39240/60*nMin*(1000+nGuanQia)/1000 | P127: =RC[-6]&"/60*nMin*(1000+nGuanQia)/1000" -> 31380/60*nMin*(1000+nGuanQia)/1000 | Q127: =RC[-6]&"/60*nMin*(1000+nGuanQia)/1000" -> 19320/60*nMin*(1000+nGuanQia)/1000 | W127: 10043 | X127: =R[-3]C -> 20000 | Y127: =RC[-2]+RC[-1] -> 30043
W128: 0 | X128: =R[-3]C -> 0 | Y128: =RC[-2]+RC[-1] -> 0
W129: 0 | X129: =R[-3]C -> 0 | Y129: =RC[-2]+RC[-1] -> 0
W130: 10044 | X130: =R[-3]C -> 20000 | Y130: =RC[-2]+RC[-1] -> 30044
W131: 0 | X131: =R[-3]C -> 0 | Y131: =RC[-2]+RC[-1] -> 0
W132: 0 | X132: =R[-3]C -> 0 | Y132: =RC[-2]+RC[-1] -> 0
W133: 10045 | X133: =R[-3]C -> 20000 | Y133: =RC[-2]+RC[-1] -> 30045
W134: 0 | X134: =R[-3]C -> 0 | Y134: =RC[-2]+RC[-1] -> 0
W135: 0 | X135: =R[-3]C -> 0 | Y135: =RC[-2]+RC[-1] -> 0
W136: 10046 | X136: =R[-3]C -> 20000 | Y136: =RC[-2]+RC[-1] -> 30046
W137: 0 | X137: =R[-3]C -> 0 | Y137: =RC[-2]+RC[-1] -> 0
W138: 0 | X138: =R[-3]C -> 0 | Y138: =RC[-2]+RC[-1] -> 0
W139: 10047 | X139: =R[-3]C -> 20000 | Y139: =RC[-2]+RC[-1] -> 30047
W140: 0 | X140: =R[-3]C -> 0 | Y140: =RC[-2]+RC[-1] -> 0
W141: 0 | X141: =R[-3]C -> 0 | Y141: =RC[-2]+RC[-1] -> 0
W142: 10048 | X142: =R[-3]C -> 20000 | Y142: =RC[-2]+RC[-1] -> 30048
W143: 0 | X143: =R[-3]C -> 0 | Y143: =RC[-2]+RC[-1] -> 0
W144: 0 | X144: =R[-3]C -> 0 | Y144: =RC[-2]+RC[-1] -> 0
W145: 10049 | X145: =R[-3]C -> 20000 | Y145: =RC[-2]+RC[-1] -> 30049
W146: 0 | X146: =R[-3]C -> 0 | Y146: =RC[-2]+RC[-1] -> 0
W147: 0 | X147: =R[-3]C -> 0 | Y147: =RC[-2]+RC[-1] -> 0
W148: 10050 | X148: =R[-3]C -> 20000 | Y148: =RC[-2]+RC[-1] -> 30050
W149: 0 | X149: =R[-3]C -> 0 | Y149: =RC[-2]+RC[-1] -> 0
W150: 0 | X150: =R[-3]C -> 0 | Y150: =RC[-2]+RC[-1] -> 0
W151: 10051 | X151: =R[-3]C -> 20000 | Y151: =RC[-2]+RC[-1] -> 30051
W152: 0 | X152: =R[-3]C -> 0 | Y152: =RC[-2]+RC[-1] -> 0
W153: 0 | X153: =R[-3]C -> 0 | Y153: =RC[-2]+RC[-1] -> 0
W154: 10052 | X154: =R[-3]C -> 20000 | Y154: =RC[-2]+RC[-1] -> 30052
W155: 0 | X155: =R[-3]C -> 0 | Y155: =RC[-2]+RC[-1] -> 0
W156: 0 | X156: =R[-3]C -> 0 | Y156: =RC[-2]+RC[-1] -> 0
W157: 10053 | X157: =R[-3]C -> 20000 | Y157: =RC[-2]+RC[-1] -> 30053
W158: 0 | X158: =R[-3]C -> 0 | Y158: =RC[-2]+RC[-1] -> 0
W159: 0 | X159: =R[-3]C -> 0 | Y159: =RC[-2]+RC[-1] -> 0
W160: 10054 | X160: =R[-3]C -> 20000 | Y160: =RC[-2]+RC[-1] -> 30054
W161: 0 | X161: =R[-3]C -> 0 | Y161: =RC[-2]+RC[-1] -> 0
W162: 0 | X162: =R[-3]C -> 0 | Y162: =RC[-2]+RC[-1] -> 0
W163: 10055 | X163: =R[-3]C -> 20000 | Y163: =RC[-2]+RC[-1] -> 30055
W164: 0 | X164: =R[-3]C -> 0 | Y164: =RC[-2]+RC[-1] -> 0
W165: 0 | X165: =R[-3]C -> 0 | Y165: =RC[-2]+RC[-1] -> 0
W166: 10056 | X166: =R[-3]C -> 20000 | Y166: =RC[-2]+RC[-1] -> 30056
W167: 0 | X167: =R[-3]C -> 0 | Y167: =RC[-2]+RC[-1] -> 0
W168: 0 | X168: =R[-3]C -> 0 | Y168: =RC[-2]+RC[-1] -> 0
W169: 10057 | X169: =R[-3]C -> 20000 | Y169: =RC[-2]+RC[-1] -> 30057
W170: 0 | X170: =R[-3]C -> 0 | Y170: =RC[-2]+RC[-1] -> 0
W171: 0 | X171: =R[-3]C -> 0 | Y171: =RC[-2]+RC[-1] -> 0
W172: 10058 | X172: =R[-3]C -> 20000 | Y172: =RC[-2]+RC[-1] -> 30058
W173: 0 | X173: =R[-3]C -> 0 | Y173: =RC[-2]+RC[-1] -> 0
W174: 0 | X174: =R[-3]C -> 0 | Y174: =RC[-2]+RC[-1] -> 0
W175: 10059 | X175: =R[-3]C -> 20000 | Y175: =RC[-2]+RC[-1] -> 30059
W176: 0 | X176: =R[-3]C -> 0 | Y176: =RC[-2]+RC[-1] -> 0
W177: 0 | X177: =R[-3]C -> 0 | Y177: =RC[-2]+RC[-1] -> 0
W178: 10060 | X178: =R[-3]C -> 20000 | Y178: =RC[-2]+RC[-1] -> 30060
W179: 0 | X179: =R[-3]C -> 0 | Y179: =RC[-2]+RC[-1] -> 0
W180: 0 | X180: =R[-3]C -> 0 | Y180: =RC[-2]+RC[-1] -> 0
W181: 10061 | X181: =R[-3]C -> 20000 | Y181: =RC[-2]+RC[-1] -> 30061
W182: 0 | X182: =R[-3]C -> 0 | Y182: =RC[-2]+RC[-1] -> 0
W183: 0 | X183: =R[-3]C -> 0 | Y183: =RC[-2]+RC[-1] -> 0
W184: 10062 | X184: =R[-3]C -> 20000 | Y184: =RC[-2]+RC[-1] -> 30062
W185: 0 | X185: =R[-3]C -> 0 | Y185: =RC[-2]+RC[-1] -> 0
W186: 0 | X186: =R[-3]C -> 0 | Y186: =RC[-2]+RC[-1] -> 0
W187: 10063 | X187: =R[-3]C -> 20000 | Y187: =RC[-2]+RC[-1] -> 30063
W188: 0 | X188: =R[-3]C -> 0 | Y188: =RC[-2]+RC[-1] -> 0
W189: 0 | X189: =R[-3]C -> 0 | Y189: =RC[-2]+RC[-1] -> 0
W190: 10064 | X190: =R[-3]C -> 20000 | Y190: =RC[-2]+RC[-1] -> 30064
W191: 0 | X191: =R[-3]C -> 0 | Y191: =RC[-2]+RC[-1] -> 0
W192: 0 | X192: =R[-3]C -> 0 | Y192: =RC[-2]+RC[-1] -> 0
W193: 10065 | X193: =R[-3]C -> 20000 | Y193: =RC[-2]+RC[-1] -> 30065
W194: 0 | X194: =R[-3]C -> 0 | Y194: =RC[-2]+RC[-1] -> 0
W195: 0 | X195: =R[-3]C -> 0 | Y195: =RC[-2]+RC[-1] -> 0
W196: 10066 | X196: =R[-3]C -> 20000 | Y196: =RC[-2]+RC[-1] -> 30066
W197: 0 | X197: =R[-3]C -> 0 | Y197: =RC[-2]+RC[-1] -> 0
W198: 0 | X198: =R[-3]C -> 0 | Y198: =RC[-2]+RC[-1] -> 0
W199: 10067 | X199: =R[-3]C -> 20000 | Y199: =RC[-2]+RC[-1] -> 30067
W200: 0 | X200: =R[-3]C -> 0 | Y200: =RC[-2]+RC[-1] -> 0
W201: 0 | X201: =R[-3]C -> 0 | Y201: =RC[-2]+RC[-1] -> 0
W202: 10068 | X202: =R[-3]C -> 20000 | Y202: =RC[-2]+RC[-1] -> 30068
W203: 0 | X203: =R[-3]C -> 0 | Y203: =RC[-2]+RC[-1] -> 0
W204: 0 | X204: =R[-3]C -> 0 | Y204: =RC[-2]+RC[-1] -> 0
W205: 10069 | X205: =R[-3]C -> 20000 | Y205: =RC[-2]+RC[-1] -> 30069
W206: 0 | X206: =R[-3]C -> 0 | Y206: =RC[-2]+RC[-1] -> 0
W207: 0 | X207: =R[-3]C -> 0 | Y207: =RC[-2]+RC[-1] -> 0
W208: 10070 | X208: =R[-3]C -> 20000 | Y208: =RC[-2]+RC[-1] -> 30070
W209: 0 | X209: =R[-3]C -> 0 | Y209: =RC[-2]+RC[-1] -> 0
W210: 0 | X210: =R[-3]C -> 0 | Y210: =RC[-2]+RC[-1] -> 0
W211: 10071 | X211: =R[-3]C -> 20000 | Y211: =RC[-2]+RC[-1] -> 30071
W212: 0 | X212: =R[-3]C -> 0 | Y212: =RC[-2]+RC[-1] -> 0
W213: 0 | X213: =R[-3]C -> 0 | Y213: =RC[-2]+RC[-1] -> 0
W214: 10072 | X214: =R[-3]C -> 20000 | Y214: =RC[-2]+RC[-1] -> 30072
W215: 0 | X215: =R[-3]C -> 0 | Y215: =RC[-2]+RC[-1] -> 0
W216: 0 | X216: =R[-3]C -> 0 | Y216: =RC[-2]+RC[-1] -> 0
W217: 10073 | X217: =R[-3]C -> 20000 | Y217: =RC[-2]+RC[-1] -> 30073
W218: 0 | X218: =R[-3]C -> 0 | Y218: =RC[-2]+RC[-1] -> 0
W219: 0 | X219: =R[-3]C -> 0 | Y219: =RC[-2]+RC[-1] -> 0
W220: 10074 | X220: =R[-3]C -> 20000 | Y220: =RC[-2]+RC[-1] -> 30074
W221: 0 | X221: =R[-3]C -> 0 | Y221: =RC[-2]+RC[-1] -> 0
W222: 0 | X222: =R[-3]C -> 0 | Y222: =RC[-2]+RC[-1] -> 0
W223: 10075 | X223: =R[-3]C -> 20000 | Y223: =RC[-2]+RC[-1] -> 30075
W224: 0 | X224: =R[-3]C -> 0 | Y224: =RC[-2]+RC[-1] -> 0
W225: 0 | X225: =R[-3]C -> 0 | Y225: =RC[-2]+RC[-1] -> 0
W226: 10076 | X226: =R[-3]C -> 20000 | Y226: =RC[-2]+RC[-1] -> 30076
W227: 0 | X227: =R[-3]C -> 0 | Y227: =RC[-2]+RC[-1] -> 0
W228: 0 | X228: =R[-3]C -> 0 | Y228: =RC[-2]+RC[-1] -> 0
W229: 10077 | X229: =R[-3]C -> 20000 | Y229: =RC[-2]+RC[-1] -> 30077
W230: 0 | X230: =R[-3]C -> 0 | Y230: =RC[-2]+RC[-1] -> 0
W231: 0 | X231: =R[-3]C -> 0 | Y231: =RC[-2]+RC[-1] -> 0
W232: 10078 | X232: =R[-3]C -> 20000 | Y232: =RC[-2]+RC[-1] -> 30078
W233: 0 | X233: =R[-3]C -> 0 | Y233: =RC[-2]+RC[-1] -> 0
W234: 0 | X234: =R[-3]C -> 0 | Y234: =RC[-2]+RC[-1] -> 0
W235: 10079 | X235: =R[-3]C -> 20000 | Y235: =RC[-2]+RC[-1] -> 30079
W236: 0 | X236: =R[-3]C -> 0 | Y236: =RC[-2]+RC[-1] -> 0
W237: 0 | X237: =R[-3]C -> 0 | Y237: =RC[-2]+RC[-1] -> 0
W238: 10080 | X238: =R[-3]C -> 20000 | Y238: =RC[-2]+RC[-1] -> 30080
W239: 0 | X239: =R[-3]C -> 0 | Y239: =RC[-2]+RC[-1] -> 0
W240: 0 | X240: =R[-3]C -> 0 | Y240: =RC[-2]+RC[-1] -> 0
W241: 10081 | X241: =R[-3]C -> 20000 | Y241: =RC[-2]+RC[-1] -> 30081
W242: 0 | X242: =R[-3]C -> 0 | Y242: =RC[-2]+RC[-1] -> 0
W243: 0 | X243: =R[-3]C -> 0 | Y243: =RC[-2]+RC[-1] -> 0
W244: 10082 | X244: =R[-3]C -> 20000 | Y244: =RC[-2]+RC[-1] -> 30082
W245: 0 | X245: =R[-3]C -> 0 | Y245: =RC[-2]+RC[-1] -> 0
W246: 0 | X246: =R[-3]C -> 0 | Y246: =RC[-2]+RC[-1] -> 0
W247: 10083 | X247: =R[-3]C -> 20000 | Y247: =RC[-2]+RC[-1] -> 30083
W248: 0 | X248: =R[-3]C -> 0 | Y248: =RC[-2]+RC[-1] -> 0
W249: 0 | X249: =R[-3]C -> 0 | Y249: =RC[-2]+RC[-1] -> 0
W250: 10084 | X250: =R[-3]C -> 20000 | Y250: =RC[-2]+RC[-1] -> 30084
W251: 0 | X251: =R[-3]C -> 0 | Y251: =RC[-2]+RC[-1] -> 0
W252: 0 | X252: =R[-3]C -> 0 | Y252: =RC[-2]+RC[-1] -> 0
W253: 10085 | X253: =R[-3]C -> 20000 | Y253: =RC[-2]+RC[-1] -> 30085
W254: 0 | X254: =R[-3]C -> 0 | Y254: =RC[-2]+RC[-1] -> 0
W255: 0 | X255: =R[-3]C -> 0 | Y255: =RC[-2]+RC[-1] -> 0
W256: 10086 | X256: =R[-3]C -> 20000 | Y256: =RC[-2]+RC[-1] -> 30086
W257: 0 | X257: =R[-3]C -> 0 | Y257: =RC[-2]+RC[-1] -> 0
W258: 0 | X258: =R[-3]C -> 0 | Y258: =RC[-2]+RC[-1] -> 0
W259: 10087 | X259: =R[-3]C -> 20000 | Y259: =RC[-2]+RC[-1] -> 30087
W260: 0 | X260: =R[-3]C -> 0 | Y260: =RC[-2]+RC[-1] -> 0
W261: 0 | X261: =R[-3]C -> 0 | Y261: =RC[-2]+RC[-1] -> 0
W262: 10088 | X262: =R[-3]C -> 20000 | Y262: =RC[-2]+RC[-1] -> 30088
W263: 0 | X263: =R[-3]C -> 0 | Y263: =RC[-2]+RC[-1] -> 0
W264: 0 | X264: =R[-3]C -> 0 | Y264: =RC[-2]+RC[-1] -> 0
W265: 10089 | X265: =R[-3]C -> 20000 | Y265: =RC[-2]+RC[-1] -> 30089
W266: 0 | X266: =R[-3]C -> 0 | Y266: =RC[-2]+RC[-1] -> 0
W267: 0 | X267: =R[-3]C -> 0 | Y267: =RC[-2]+RC[-1] -> 0
W268: 10090 | X268: =R[-3]C -> 20000 | Y268: =RC[-2]+RC[-1] -> 30090
W269: 0 | X269: =R[-3]C -> 0 | Y269: =RC[-2]+RC[-1] -> 0
W270: 0 | X270: =R[-3]C -> 0 | Y270: =RC[-2]+RC[-1] -> 0
W271: 10091 | X271: =R[-3]C -> 20000 | Y271: =RC[-2]+RC[-1] -> 30091
W272: 0 | X272: =R[-3]C -> 0 | Y272: =RC[-2]+RC[-1] -> 0
W273: 0 | X273: =R[-3]C -> 0 | Y273: =RC[-2]+RC[-1] -> 0
W274: 10092 | X274: =R[-3]C -> 20000 | Y274: =RC[-2]+RC[-1] -> 30092
W275: 0 | X275: =R[-3]C -> 0 | Y275: =RC[-2]+RC[-1] -> 0
W276: 0 | X276: =R[-3]C -> 0 | Y276: =RC[-2]+RC[-1] -> 0
W277: 10093 | X277: =R[-3]C -> 20000 | Y277: =RC[-2]+RC[-1] -> 30093
W278: 0 | X278: =R[-3]C -> 0 | Y278: =RC[-2]+RC[-1] -> 0
W279: 0 | X279: =R[-3]C -> 0 | Y279: =RC[-2]+RC[-1] -> 0
W280: 10094 | X280: =R[-3]C -> 20000 | Y280: =RC[-2]+RC[-1] -> 30094
W281: 0 | X281: =R[-3]C -> 0 | Y281: =RC[-2]+RC[-1] -> 0
W282: 0 | X282: =R[-3]C -> 0 | Y282: =RC[-2]+RC[-1] -> 0
W283: 10095 | X283: =R[-3]C -> 20000 | Y283: =RC[-2]+RC[-1] -> 30095
W284: 0 | X284: =R[-3]C -> 0 | Y284: =RC[-2]+RC[-1] -> 0
W285: 0 | X285: =R[-3]C -> 0 | Y285: =RC[-2]+RC[-1] -> 0
W286: 10096 | X286: =R[-3]C -> 20000 | Y286: =RC[-2]+RC[-1] -> 30096
W287: 0 | X287: =R[-3]C -> 0 | Y287: =RC[-2]+RC[-1] -> 0
W288: 0 | X288: =R[-3]C -> 0 | Y288: =RC[-2]+RC[-1] -> 0
W289: 10097 | X289: =R[-3]C -> 20000 | Y289: =RC[-2]+RC[-1] -> 30097
W290: 0 | X290: =R[-3]C -> 0 | Y290: =RC[-2]+RC[-1] -> 0
W291: 0 | X291: =R[-3]C -> 0 | Y291: =RC[-2]+RC[-1] -> 0
W292: 10098 | X292: =R[-3]C -> 20000 | Y292: =RC[-2]+RC[-1] -> 30098
W293: 0 | X293: =R[-3]C -> 0 | Y293: =RC[-2]+RC[-1] -> 0
W294: 0 | X294: =R[-3]C -> 0 | Y294: =RC[-2]+RC[-1] -> 0
W295: 10099 | X295: =R[-3]C -> 20000 | Y295: =RC[-2]+RC[-1] -> 30099
W296: 0 | X296: =R[-3]C -> 0 | Y296: =RC[-2]+RC[-1] -> 0
W297: 0 | X297: =R[-3]C -> 0 | Y297: =RC[-2]+RC[-1] -> 0
W298: 10100 | X298: =R[-3]C -> 20000 | Y298: =RC[-2]+RC[-1] -> 30100
W299: 0 | X299: =R[-3]C -> 0 | Y299: =RC[-2]+RC[-1] -> 0
W300: 0 | X300: =R[-3]C -> 0 | Y300: =RC[-2]+RC[-1] -> 0
W301: 10101 | X301: =R[-3]C -> 20000 | Y301: =RC[-2]+RC[-1] -> 30101
W302: 0 | X302: =R[-3]C -> 0 | Y302: =RC[-2]+RC[-1] -> 0
W303: 0 | X303: =R[-3]C -> 0 | Y303: =RC[-2]+RC[-1] -> 0
W304: 10102 | X304: =R[-3]C -> 20000 | Y304: =RC[-2]+RC[-1] -> 30102
W305: 0 | X305: =R[-3]C -> 0 | Y305: =RC[-2]+RC[-1] -> 0
W306: 0 | X306: =R[-3]C -> 0 | Y306: =RC[-2]+RC[-1] -> 0
W307: 10103 | X307: =R[-3]C -> 20000 | Y307: =RC[-2]+RC[-1] -> 30103
W308: 0 | X308: =R[-3]C -> 0 | Y308: =RC[-2]+RC[-1] -> 0
W309: 0 | X309: =R[-3]C -> 0 | Y309: =RC[-2]+RC[-1] -> 0
W310: 10104 | X310: =R[-3]C -> 20000 | Y310: =RC[-2]+RC[-1] -> 30104
W311: 0 | X311: =R[-3]C -> 0 | Y311: =RC[-2]+RC[-1] -> 0
W312: 0 | X312: =R[-3]C -> 0 | Y312: =RC[-2]+RC[-1] -> 0
W313: 10105 | X313: =R[-3]C -> 20000 | Y313: =RC[-2]+RC[-1] -> 30105
W314: 0 | X314: =R[-3]C -> 0 | Y314: =RC[-2]+RC[-1] -> 0
W315: 0 | X315: =R[-3]C -> 0 | Y315: =RC[-2]+RC[-1] -> 0
W316: 10106 | X316: =R[-3]C -> 20000 | Y316: =RC[-2]+RC[-1] -> 30106
W317: 0 | X317: =R[-3]C -> 0 | Y317: =RC[-2]+RC[-1] -> 0
W318: 0 | X318: =R[-3]C -> 0 | Y318: =RC[-2]+RC[-1] -> 0
W319: 10107 | X319: =R[-3]C -> 20000 | Y319: =RC[-2]+RC[-1] -> 30107
W320: 0 | X320: =R[-3]C -> 0 | Y320: =RC[-2]+RC[-1] -> 0
W321: 0 | X321: =R[-3]C -> 0 | Y321: =RC[-2]+RC[-1] -> 0
W322: 10108 | X322: =R[-3]C -> 20000 | Y322: =RC[-2]+RC[-1] -> 30108
W323: 0 | X323: =R[-3]C -> 0 | Y323: =RC[-2]+RC[-1] -> 0
W324: 0 | X324: =R[-3]C -> 0 | Y324: =RC[-2]+RC[-1] -> 0
W325: 10109 | X325: =R[-3]C -> 20000 | Y325: =RC[-2]+RC[-1] -> 30109
W326: 0 | X326: =R[-3]C -> 0 | Y326: =RC[-2]+RC[-1] -> 0
W327: 0 | X327: =R[-3]C -> 0 | Y327: =RC[-2]+RC[-1] -> 0
W328: 10110 | X328: =R[-3]C -> 20000 | Y328: =RC[-2]+RC[-1] -> 30110
W329: 0 | X329: =R[-3]C -> 0 | Y329: =RC[-2]+RC[-1] -> 0
W330: 0 | X330: =R[-3]C -> 0 | Y330: =RC[-2]+RC[-1] -> 0
W331: 10111 | X331: =R[-3]C -> 20000 | Y331: =RC[-2]+RC[-1] -> 30111
W332: 0 | X332: =R[-3]C -> 0 | Y332: =RC[-2]+RC[-1] -> 0
W333: 0 | X333: =R[-3]C -> 0 | Y333: =RC[-2]+RC[-1] -> 0
W334: 10112 | X334: =R[-3]C -> 20000 | Y334: =RC[-2]+RC[-1] -> 30112
W335: 0 | X335: =R[-3]C -> 0 | Y335: =RC[-2]+RC[-1] -> 0
W336: 0 | X336: =R[-3]C -> 0 | Y336: =RC[-2]+RC[-1] -> 0
W337: 10113 | X337: =R[-3]C -> 20000 | Y337: =RC[-2]+RC[-1] -> 30113
W338: 0 | X338: =R[-3]C -> 0 | Y338: =RC[-2]+RC[-1] -> 0
W339: 0 | X339: =R[-3]C -> 0 | Y339: =RC[-2]+RC[-1] -> 0
W340: 10114 | X340: =R[-3]C -> 20000 | Y340: =RC[-2]+RC[-1] -> 30114
W341: 0 | X341: =R[-3]C -> 0 | Y341: =RC[-2]+RC[-1] -> 0
W342: 0 | X342: =R[-3]C -> 0 | Y342: =RC[-2]+RC[-1] -> 0
W343: 10115 | X343: =R[-3]C -> 20000 | Y343: =RC[-2]+RC[-1] -> 30115
W344: 0 | X344: =R[-3]C -> 0 | Y344: =RC[-2]+RC[-1] -> 0
W345: 0 | X345: =R[-3]C -> 0 | Y345: =RC[-2]+RC[-1] -> 0
W346: 10116 | X346: =R[-3]C -> 20000 | Y346: =RC[-2]+RC[-1] -> 30116
W347: 0 | X347: =R[-3]C -> 0 | Y347: =RC[-2]+RC[-1] -> 0
W348: 0 | X348: =R[-3]C -> 0 | Y348: =RC[-2]+RC[-1] -> 0
W349: 10117 | X349: =R[-3]C -> 20000 | Y349: =RC[-2]+RC[-1] -> 30117
W350: 0 | X350: =R[-3]C -> 0 | Y350: =RC[-2]+RC[-1] -> 0
W351: 0 | X351: =R[-3]C -> 0 | Y351: =RC[-2]+RC[-1] -> 0
W352: 10118 | X352: =R[-3]C -> 20000 | Y352: =RC[-2]+RC[-1] -> 30118
W353: 0 | X353: =R[-3]C -> 0 | Y353: =RC[-2]+RC[-1] -> 0
W354: 0 | X354: =R[-3]C -> 0 | Y354: =RC[-2]+RC[-1] -> 0
W355: 10119 | X355: =R[-3]C -> 20000 | Y355: =RC[-2]+RC[-1] -> 30119
W356: 0 | X356: =R[-3]C -> 0 | Y356: =RC[-2]+RC[-1] -> 0
W357: 0 | X357: =R[-3]C -> 0 | Y357: =RC[-2]+RC[-1] -> 0
W358: 10120 | X358: =R[-3]C -> 20000 | Y358: =RC[-2]+RC[-1] -> 30120
W359: 0 | X359: =R[-3]C -> 0 | Y359: =RC[-2]+RC[-1] -> 0
W360: 0 | X360: =R[-3]C -> 0 | Y360: =RC[-2]+RC[-1] -> 0
W361: 10121 | X361: =R[-3]C -> 20000 | Y361: =RC[-2]+RC[-1] -> 30121
W362: 0 | X362: =R[-3]C -> 0 | Y362: =RC[-2]+RC[-1] -> 0
W363: 0 | X363: =R[-3]C -> 0 | Y363: =RC[-2]+RC[-1] -> 0
W364: 10122 | X364: =R[-3]C -> 20000 | Y364: =RC[-2]+RC[-1] -> 30122
W365: 0 | X365: =R[-3]C -> 0 | Y365: =RC[-2]+RC[-1] -> 0
W366: 0 | X366: =R[-3]C -> 0 | Y366: =RC[-2]+RC[-1] -> 0
W367: 10123 | X367: =R[-3]C -> 20000 | Y367: =RC[-2]+RC[-1] -> 30123
W368: 0 | X368: =R[-3]C -> 0 | Y368: =RC[-2]+RC[-1] -> 0
W369: 0 | X369: =R[-3]C -> 0 | Y369: =RC[-2]+RC[-1] -> 0
W370: 10124 | X370: =R[-3]C -> 20000 | Y370: =RC[-2]+RC[-1] -> 30124
W371: 0 | X371: =R[-3]C -> 0 | Y371: =RC[-2]+RC[-1] -> 0
W372: 0 | X372: =R[-3]C -> 0 | Y372: =RC[-2]+RC[-1] -> 0
W373: 10125 | X373: =R[-3]C -> 20000 | Y373: =RC[-2]+RC[-1] -> 30125
W374: 0 | X374: =R[-3]C -> 0 | Y374: =RC[-2]+RC[-1] -> 0
W375: 0 | X375: =R[-3]C -> 0 | Y375: =RC[-2]+RC[-1] -> 0
W376: 10126 | X376: =R[-3]C -> 20000 | Y376: =RC[-2]+RC[-1] -> 30126
W377: 0 | X377: =R[-3]C -> 0 | Y377: =RC[-2]+RC[-1] -> 0
W378: 0 | X378: =R[-3]C -> 0 | Y378: =RC[-2]+RC[-1] -> 0
W379: 10127 | X379: =R[-3]C -> 20000 | Y379: =RC[-2]+RC[-1] -> 30127
W380: 0 | X380: =R[-3]C -> 0 | Y380: =RC[-2]+RC[-1] -> 0
W381: 0 | X381: =R[-3]C -> 0 | Y381: =RC[-2]+RC[-1] -> 0
W382: 10128 | X382: =R[-3]C -> 20000 | Y382: =RC[-2]+RC[-1] -> 30128
W383: 0 | X383: =R[-3]C -> 0 | Y383: =RC[-2]+RC[-1] -> 0
W384: 0 | X384: =R[-3]C -> 0 | Y384: =RC[-2]+RC[-1] -> 0
W385: 10129 | X385: =R[-3]C -> 20000 | Y385: =RC[-2]+RC[-1] -> 30129
W386: 0 | X386: =R[-3]C -> 0 | Y386: =RC[-2]+RC[-1] -> 0
W387: 0 | X387: =R[-3]C -> 0 | Y387: =RC[-2]+RC[-1] -> 0
W388: 10130 | X388: =R[-3]C -> 20000 | Y388: =RC[-2]+RC[-1] -> 30130
W389: 0 | X389: =R[-3]C -> 0 | Y389: =RC[-2]+RC[-1] -> 0
W390: 0 | X390: =R[-3]C -> 0 | Y390: =RC[-2]+RC[-1] -> 0
W391: 10131 | X391: =R[-3]C -> 20000 | Y391: =RC[-2]+RC[-1] -> 30131
W392: 0 | X392: =R[-3]C -> 0 | Y392: =RC[-2]+RC[-1] -> 0
W393: 0 | X393: =R[-3]C -> 0 | Y393: =RC[-2]+RC[-1] -> 0
W394: 10132 | X394: =R[-3]C -> 20000 | Y394: =RC[-2]+RC[-1] -> 30132
W395: 0 | X395: =R[-3]C -> 0 | Y395: =RC[-2]+RC[-1] -> 0
W396: 0 | X396: =R[-3]C -> 0 | Y396: =RC[-2]+RC[-1] -> 0
W397: 10133 | X397: =R[-3]C -> 20000 | Y397: =RC[-2]+RC[-1] -> 30133
W398: 0 | X398: =R[-3]C -> 0 | Y398: =RC[-2]+RC[-1] -> 0
W399: 0 | X399: =R[-3]C -> 0 | Y399: =RC[-2]+RC[-1] -> 0
W400: 10134 | X400: =R[-3]C -> 20000 | Y400: =RC[-2]+RC[-1] -> 30134
W401: 0 | X401: =R[-3]C -> 0 | Y401: =RC[-2]+RC[-1] -> 0
W402: 0 | X402: =R[-3]C -> 0 | Y402: =RC[-2]+RC[-1] -> 0
W403: 10135 | X403: =R[-3]C -> 20000 | Y403: =RC[-2]+RC[-1] -> 30135
W404: 0 | X404: =R[-3]C -> 0 | Y404: =RC[-2]+RC[-1] -> 0
W405: 0 | X405: =R[-3]C -> 0 | Y405: =RC[-2]+RC[-1] -> 0
W406: 10136 | X406: =R[-3]C -> 20000 | Y406: =RC[-2]+RC[-1] -> 30136
W407: 0 | X407: =R[-3]C -> 0 | Y407: =RC[-2]+RC[-1] -> 0
W408: 0 | X408: =R[-3]C -> 0 | Y408: =RC[-2]+RC[-1] -> 0
W409: 10137 | X409: =R[-3]C -> 20000 | Y409: =RC[-2]+RC[-1] -> 30137
W410: 0 | X410: =R[-3]C -> 0 | Y410: =RC[-2]+RC[-1] -> 0
W411: 0 | X411: =R[-3]C -> 0 | Y411: =RC[-2]+RC[-1] -> 0
W412: 10138 | X412: =R[-3]C -> 20000 | Y412: =RC[-2]+RC[-1] -> 30138
W413: 0 | X413: =R[-3]C -> 0 | Y413: =RC[-2]+RC[-1] -> 0
W414: 0 | X414: =R[-3]C -> 0 | Y414: =RC[-2]+RC[-1] -> 0
W415: 10139 | X415: =R[-3]C -> 20000 | Y415: =RC[-2]+RC[-1] -> 30139
W416: 0 | X416: =R[-3]C -> 0 | Y416: =RC[-2]+RC[-1] -> 0
W417: 0 | X417: =R[-3]C -> 0 | Y417: =RC[-2]+RC[-1] -> 0
W418: 10140 | X418: =R[-3]C -> 20000 | Y418: =RC[-2]+RC[-1] -> 30140
W419: 0 | X419: =R[-3]C -> 0 | Y419: =RC[-2]+RC[-1] -> 0
W420: 0 | X420: =R[-3]C -> 0 | Y420: =RC[-2]+RC[-1] -> 0
W421: 10141 | X421: =R[-3]C -> 20000 | Y421: =RC[-2]+RC[-1] -> 30141
W422: 0 | X422: =R[-3]C -> 0 | Y422: =RC[-2]+RC[-1] -> 0
W423: 0 | X423: =R[-3]C -> 0 | Y423: =RC[-2]+RC[-1] -> 0
W424: 10142 | X424: =R[-3]C -> 20000 | Y424: =RC[-2]+RC[-1] -> 30142
W425: 0 | X425: =R[-3]C -> 0 | Y425: =RC[-2]+RC[-1] -> 0
W426: 0 | X426: =R[-3]C -> 0 | Y426: =RC[-2]+RC[-1] -> 0
W427: 10143 | X427: =R[-3]C -> 20000 | Y427: =RC[-2]+RC[-1] -> 30143
W428: 0 | X428: =R[-3]C -> 0 | Y428: =RC[-2]+RC[-1] -> 0
W429: 0 | X429: =R[-3]C -> 0 | Y429: =RC[-2]+RC[-1] -> 0
W430: 10144 | X430: =R[-3]C -> 20000 | Y430: =RC[-2]+RC[-1] -> 30144
W431: 0 | X431: =R[-3]C -> 0 | Y431: =RC[-2]+RC[-1] -> 0
W432: 0 | X432: =R[-3]C -> 0 | Y432: =RC[-2]+RC[-1] -> 0
W433: 10145 | X433: =R[-3]C -> 20000 | Y433: =RC[-2]+RC[-1] -> 30145
W434: 0 | X434: =R[-3]C -> 0 | Y434: =RC[-2]+RC[-1] -> 0
W435: 0 | X435: =R[-3]C -> 0 | Y435: =RC[-2]+RC[-1] -> 0
W436: 10146 | X436: =R[-3]C -> 20000 | Y436: =RC[-2]+RC[-1] -> 30146
W437: 0 | X437: =R[-3]C -> 0 | Y437: =RC[-2]+RC[-1] -> 0
W438: 0 | X438: =R[-3]C -> 0 | Y438: =RC[-2]+RC[-1] -> 0
W439: 10147 | X439: =R[-3]C -> 20000 | Y439: =RC[-2]+RC[-1] -> 30147
W440: 0 | X440: =R[-3]C -> 0 | Y440: =RC[-2]+RC[-1] -> 0
W441: 0 | X441: =R[-3]C -> 0 | Y441: =RC[-2]+RC[-1] -> 0
W442: 10148 | X442: =R[-3]C -> 20000 | Y442: =RC[-2]+RC[-1] -> 30148
W443: 0 | X443: =R[-3]C -> 0 | Y443: =RC[-2]+RC[-1] -> 0
W444: 0 | X444: =R[-3]C -> 0 | Y444: =RC[-2]+RC[-1] -> 0
W445: 10149 | X445: =R[-3]C -> 20000 | Y445: =RC[-2]+RC[-1] -> 30149
W446: 0 | X446: =R[-3]C -> 0 | Y446: =RC[-2]+RC[-1] -> 0
W447: 0 | X447: =R[-3]C -> 0 | Y447: =RC[-2]+RC[-1] -> 0
W448: 10150 | X448: =R[-3]C -> 20000 | Y448: =RC[-2]+RC[-1] -> 30150
W449: 0 | X449: =R[-3]C -> 0 | Y449: =RC[-2]+RC[-1] -> 0
W450: 0 | X450: =R[-3]C -> 0 | Y450: =RC[-2]+RC[-1] -> 0
W451: 10151 | X451: =R[-3]C -> 20000 | Y451: =RC[-2]+RC[-1] -> 30151
W452: 0 | X452: =R[-3]C -> 0 | Y452: =RC[-2]+RC[-1] -> 0
W453: 0 | X453: =R[-3]C -> 0 | Y453: =RC[-2]+RC[-1] -> 0
W454: 10152 | X454: =R[-3]C -> 20000 | Y454: =RC[-2]+RC[-1] -> 30152
W455: 0 | X455: =R[-3]C -> 0 | Y455: =RC[-2]+RC[-1] -> 0
W456: 0 | X456: =R[-3]C -> 0 | Y456: =RC[-2]+RC[-1] -> 0
W457: 10153 | X457: =R[-3]C -> 20000 | Y457: =RC[-2]+RC[-1] -> 30153
W458: 0 | X458: =R[-3]C -> 0 | Y458: =RC[-2]+RC[-1] -> 0
W459: 0 | X459: =R[-3]C -> 0 | Y459: =RC[-2]+RC[-1] -> 0
W460: 10154 | X460: =R[-3]C -> 20000 | Y460: =RC[-2]+RC[-1] -> 30154
W461: 0 | X461: =R[-3]C -> 0 | Y461: =RC[-2]+RC[-1] -> 0
W462: 0 | X462: =R[-3]C -> 0 | Y462: =RC[-2]+RC[-1] -> 0
W463: 10155 | X463: =R[-3]C -> 20000 | Y463: =RC[-2]+RC[-1] -> 30155
W464: 0 | X464: =R[-3]C -> 0 | Y464: =RC[-2]+RC[-1] -> 0
W465: 0 | X465: =R[-3]C -> 0 | Y465: =RC[-2]+RC[-1] -> 0
W466: 10156 | X466: =R[-3]C -> 20000 | Y466: =RC[-2]+RC[-1] -> 30156
W467: 0 | X467: =R[-3]C -> 0 | Y467: =RC[-2]+RC[-1] -> 0
W468: 0 | X468: =R[-3]C -> 0 | Y468: =RC[-2]+RC[-1] -> 0
W469: 10157 | X469: =R[-3]C -> 20000 | Y469: =RC[-2]+RC[-1] -> 30157
W470: 0 | X470: =R[-3]C -> 0 | Y470: =RC[-2]+RC[-1] -> 0
W471: 0 | X471: =R[-3]C -> 0 | Y471: =RC[-2]+RC[-1] -> 0
W472: 10158 | X472: =R[-3]C -> 20000 | Y472: =RC[-2]+RC[-1] -> 30158
W473: 0 | X473: =R[-3]C -> 0 | Y473: =RC[-2]+RC[-1] -> 0
W474: 0 | X474: =R[-3]C -> 0 | Y474: =RC[-2]+RC[-1] -> 0
W475: 10159 | X475: =R[-3]C -> 20000 | Y475: =RC[-2]+RC[-1] -> 30159
W476: 0 | X476: =R[-3]C -> 0 | Y476: =RC[-2]+RC[-1] -> 0
W477: 0 | X477: =R[-3]C -> 0 | Y477: =RC[-2]+RC[-1] -> 0
W478: 10160 | X478: =R[-3]C -> 20000 | Y478: =RC[-2]+RC[-1] -> 30160
W479: 0 | X479: =R[-3]C -> 0 | Y479: =RC[-2]+RC[-1] -> 0
W480: 0 | X480: =R[-3]C -> 0 | Y480: =RC[-2]+RC[-1] -> 0
W481: 10161 | X481: =R[-3]C -> 20000 | Y481: =RC[-2]+RC[-1] -> 30161
W482: 0 | X482: =R[-3]C -> 0 | Y482: =RC[-2]+RC[-1] -> 0
W483: 0 | X483: =R[-3]C -> 0 | Y483: =RC[-2]+RC[-1] -> 0
W484: 10162 | X484: =R[-3]C -> 20000 | Y484: =RC[-2]+RC[-1] -> 30162
W485: 0 | X485: =R[-3]C -> 0 | Y485: =RC[-2]+RC[-1] -> 0
W486: 0 | X486: =R[-3]C -> 0 | Y486: =RC[-2]+RC[-1] -> 0
W487: 10163 | X487: =R[-3]C -> 20000 | Y487: =RC[-2]+RC[-1] -> 30163
W488: 0 | X488: =R[-3]C -> 0 | Y488: =RC[-2]+RC[-1] -> 0
W489: 0 | X489: =R[-3]C -> 0 | Y489: =RC[-2]+RC[-1] -> 0
W490: 10164 | X490: =R[-3]C -> 20000 | Y490: =RC[-2]+RC[-1] -> 30164
W491: 0 | X491: =R[-3]C -> 0 | Y491: =RC[-2]+RC[-1] -> 0
W492: 0 | X492: =R[-3]C -> 0 | Y492: =RC[-2]+RC[-1] -> 0
W493: 10165 | X493: =R[-3]C -> 20000 | Y493: =RC[-2]+RC[-1] -> 30165
W494: 0 | X494: =R[-3]C -> 0 | Y494: =RC[-2]+RC[-1] -> 0
W495: 0 | X495: =R[-3]C -> 0 | Y495: =RC[-2]+RC[-1] -> 0
W496: 10166 | X496: =R[-3]C -> 20000 | Y496: =RC[-2]+RC[-1] -> 30166
W497: 0 | X497: =R[-3]C -> 0 | Y497: =RC[-2]+RC[-1] -> 0
W498: 0 | X498: =R[-3]C -> 0 | Y498: =RC[-2]+RC[-1] -> 0
W499: 10167 | X499: =R[-3]C -> 20000 | Y499: =RC[-2]+RC[-1] -> 30167
W500: 0 | X500: =R[-3]C -> 0 | Y500: =RC[-2]+RC[-1] -> 0
W501: 0 | X501: =R[-3]C -> 0 | Y501: =RC[-2]+RC[-1] -> 0
W502: 10168 | X502: =R[-3]C -> 20000 | Y502: =RC[-2]+RC[-1] -> 30168
W503: 0 | X503: =R[-3]C -> 0 | Y503: =RC[-2]+RC[-1] -> 0
W504: 0 | X504: =R[-3]C -> 0 | Y504: =RC[-2]+RC[-1] -> 0
W505: 10169 | X505: =R[-3]C -> 20000 | Y505: =RC[-2]+RC[-1] -> 30169
W506: 0 | X506: =R[-3]C -> 0 | Y506: =RC[-2]+RC[-1] -> 0
W507: 0 | X507: =R[-3]C -> 0 | Y507: =RC[-2]+RC[-1] -> 0
W508: 10170 | X508: =R[-3]C -> 20000 | Y508: =RC[-2]+RC[-1] -> 30170
W509: 0 | X509: =R[-3]C -> 0 | Y509: =RC[-2]+RC[-1] -> 0
W510: 0 | X510: =R[-3]C -> 0 | Y510: =RC[-2]+RC[-1] -> 0
W511: 10171 | X511: =R[-3]C -> 20000 | Y511: =RC[-2]+RC[-1] -> 30171
W512: 0 | X512: =R[-3]C -> 0 | Y512: =RC[-2]+RC[-1] -> 0
W513: 0 | X513: =R[-3]C -> 0 | Y513: =RC[-2]+RC[-1] -> 0
W514: 10172 | X514: =R[-3]C -> 20000 | Y514: =RC[-2]+RC[-1] -> 30172
W515: 0 | X515: =R[-3]C -> 0 | Y515: =RC[-2]+RC[-1] -> 0
W516: 0 | X516: =R[-3]C -> 0 | Y516: =RC[-2]+RC[-1] -> 0
W517: 10173 | X517: =R[-3]C -> 20000 | Y517: =RC[-2]+RC[-1] -> 30173
W518: 0 | X518: =R[-3]C -> 0 | Y518: =RC[-2]+RC[-1] -> 0
W519: 0 | X519: =R[-3]C -> 0 | Y519: =RC[-2]+RC[-1] -> 0
W520: 10174 | X520: =R[-3]C -> 20000 | Y520: =RC[-2]+RC[-1] -> 30174
W521: 0 | X521: =R[-3]C -> 0 | Y521: =RC[-2]+RC[-1] -> 0
W522: 0 | X522: =R[-3]C -> 0 | Y522: =RC[-2]+RC[-1] -> 0
W523: 10175 | X523: =R[-3]C -> 20000 | Y523: =RC[-2]+RC[-1] -> 30175
W524: 0 | X524: =R[-3]C -> 0 | Y524: =RC[-2]+RC[-1] -> 0
W525: 0 | X525: =R[-3]C -> 0 | Y525: =RC[-2]+RC[-1] -> 0
W526: 10176 | X526: =R[-3]C -> 20000 | Y526: =RC[-2]+RC[-1] -> 30176
W527: 0 | X527: =R[-3]C -> 0 | Y527: =RC[-2]+RC[-1] -> 0
W528: 0 | X528: =R[-3]C -> 0 | Y528: =RC[-2]+RC[-1] -> 0
W529: 10177 | X529: =R[-3]C -> 20000 | Y529: =RC[-2]+RC[-1] -> 30177
W530: 0 | X530: =R[-3]C -> 0 | Y530: =RC[-2]+RC[-1] -> 0
W531: 0 | X531: =R[-3]C -> 0 | Y531: =RC[-2]+RC[-1] -> 0
W532: 10178 | X532: =R[-3]C -> 20000 | Y532: =RC[-2]+RC[-1] -> 30178
W533: 0 | X533: =R[-3]C -> 0 | Y533: =RC[-2]+RC[-1] -> 0
W534: 0 | X534: =R[-3]C -> 0 | Y534: =RC[-2]+RC[-1] -> 0
W535: 10179 | X535: =R[-3]C -> 20000 | Y535: =RC[-2]+RC[-1] -> 30179
W536: 0 | X536: =R[-3]C -> 0 | Y536: =RC[-2]+RC[-1] -> 0
W537: 0 | X537: =R[-3]C -> 0 | Y537: =RC[-2]+RC[-1] -> 0
W538: 10180 | X538: =R[-3]C -> 20000 | Y538: =RC[-2]+RC[-1] -> 30180
W539: 0 | X539: =R[-3]C -> 0 | Y539: =RC[-2]+RC[-1] -> 0
W540: 0 | X540: =R[-3]C -> 0 | Y540: =RC[-2]+RC[-1] -> 0
W541: 10181 | X541: =R[-3]C -> 20000 | Y541: =RC[-2]+RC[-1] -> 30181
W542: 0 | X542: =R[-3]C -> 0 | Y542: =RC[-2]+RC[-1] -> 0
W543: 0 | X543: =R[-3]C -> 0 | Y543: =RC[-2]+RC[-1] -> 0
W544: 10182 | X544: =R[-3]C -> 20000 | Y544: =RC[-2]+RC[-1] -> 30182
W545: 0 | X545: =R[-3]C -> 0 | Y545: =RC[-2]+RC[-1] -> 0
W546: 0 | X546: =R[-3]C -> 0 | Y546: =RC[-2]+RC[-1] -> 0
W547: 10183 | X547: =R[-3]C -> 20000 | Y547: =RC[-2]+RC[-1] -> 30183
W548: 0 | X548: =R[-3]C -> 0 | Y548: =RC[-2]+RC[-1] -> 0
W549: 0 | X549: =R[-3]C -> 0 | Y549: =RC[-2]+RC[-1] -> 0
W550: 10184 | X550: =R[-3]C -> 20000 | Y550: =RC[-2]+RC[-1] -> 30184
W551: 0 | X551: =R[-3]C -> 0 | Y551: =RC[-2]+RC[-1] -> 0
W552: 0 | X552: =R[-3]C -> 0 | Y552: =RC[-2]+RC[-1] -> 0
W553: 10185 | X553: =R[-3]C -> 20000 | Y553: =RC[-2]+RC[-1] -> 30185
W554: 0 | X554: =R[-3]C -> 0 | Y554: =RC[-2]+RC[-1] -> 0
W555: 0 | X555: =R[-3]C -> 0 | Y555: =RC[-2]+RC[-1] -> 0
W556: 10186 | X556: =R[-3]C -> 20000 | Y556: =RC[-2]+RC[-1] -> 30186
W557: 0 | X557: =R[-3]C -> 0 | Y557: =RC[-2]+RC[-1] -> 0
W558: 0 | X558: =R[-3]C -> 0 | Y558: =RC[-2]+RC[-1] -> 0
W559: 10187 | X559: =R[-3]C -> 20000 | Y559: =RC[-2]+RC[-1] -> 30187
W560: 0 | X560: =R[-3]C -> 0 | Y560: =RC[-2]+RC[-1] -> 0
W561: 0 | X561: =R[-3]C -> 0 | Y561: =RC[-2]+RC[-1] -> 0
W562: 10188 | X562: =R[-3]C -> 20000 | Y562: =RC[-2]+RC[-1] -> 30188
W563: 0 | X563: =R[-3]C -> 0 | Y563: =RC[-2]+RC[-1] -> 0
W564: 0 | X564: =R[-3]C -> 0 | Y564: =RC[-2]+RC[-1] -> 0
W565: 10189 | X565: =R[-3]C -> 20000 | Y565: =RC[-2]+RC[-1] -> 30189
W566: 0 | X566: =R[-3]C -> 0 | Y566: =RC[-2]+RC[-1] -> 0
W567: 0 | X567: =R[-3]C -> 0 | Y567: =RC[-2]+RC[-1] -> 0
W568: 10190 | X568: =R[-3]C -> 20000 | Y568: =RC[-2]+RC[-1] -> 30190
W569: 0 | X569: =R[-3]C -> 0 | Y569: =RC[-2]+RC[-1] -> 0
W570: 0 | X570: =R[-3]C -> 0 | Y570: =RC[-2]+RC[-1] -> 0
W571: 10191 | X571: =R[-3]C -> 20000 | Y571: =RC[-2]+RC[-1] -> 30191
W572: 0 | X572: =R[-3]C -> 0 | Y572: =RC[-2]+RC[-1] -> 0
W573: 0 | X573: =R[-3]C -> 0 | Y573: =RC[-2]+RC[-1] -> 0
W574: 10192 | X574: =R[-3]C -> 20000 | Y574: =RC[-2]+RC[-1] -> 30192
W575: 0 | X575: =R[-3]C -> 0 | Y575: =RC[-2]+RC[-1] -> 0
W576: 0 | X576: =R[-3]C -> 0 | Y576: =RC[-2]+RC[-1] -> 0
W577: 10193 | X577: =R[-3]C -> 20000 | Y577: =RC[-2]+RC[-1] -> 30193
W578: 0 | X578: =R[-3]C -> 0 | Y578: =RC[-2]+RC[-1] -> 0
W579: 0 | X579: =R[-3]C -> 0 | Y579: =RC[-2]+RC[-1] -> 0
W580: 10194 | X580: =R[-3]C -> 20000 | Y580: =RC[-2]+RC[-1] -> 30194
W581: 0 | X581: =R[-3]C -> 0 | Y581: =RC[-2]+RC[-1] -> 0
W582: 0 | X582: =R[-3]C -> 0 | Y582: =RC[-2]+RC[-1] -> 0
W583: 10195 | X583: =R[-3]C -> 20000 | Y583: =RC[-2]+RC[-1] -> 30195
W584: 0 | X584: =R[-3]C -> 0 | Y584: =RC[-2]+RC[-1] -> 0
W585: 0 | X585: =R[-3]C -> 0 | Y585: =RC[-2]+RC[-1] -> 0
W586: 10196 | X586: =R[-3]C -> 20000 | Y586: =RC[-2]+RC[-1] -> 30196
W587: 0 | X587: =R[-3]C -> 0 | Y587: =RC[-2]+RC[-1] -> 0
W588: 0 | X588: =R[-3]C -> 0 | Y588: =RC[-2]+RC[-1] -> 0
W589: 10197 | X589: =R[-3]C -> 20000 | Y589: =RC[-2]+RC[-1] -> 30197
W590: 0 | X590: =R[-3]C -> 0 | Y590: =RC[-2]+RC[-1] -> 0
W591: 0 | X591: =R[-3]C -> 0 | Y591: =RC[-2]+RC[-1] -> 0
W592: 10198 | X592: =R[-3]C -> 20000 | Y592: =RC[-2]+RC[-1] -> 30198
W593: 0 | X593: =R[-3]C -> 0 | Y593: =RC[-2]+RC[-1] -> 0
W594: 0 | X594: =R[-3]C -> 0 | Y594: =RC[-2]+RC[-1] -> 0
W595: 10199 | X595: =R[-3]C -> 20000 | Y595: =RC[-2]+RC[-1] -> 30199
W596: 0 | X596: =R[-3]C -> 0 | Y596: =RC[-2]+RC[-1] -> 0
W597: 0 | X597: =R[-3]C -> 0 | Y597: =RC[-2]+RC[-1] -> 0
W598: 10200 | X598: =R[-3]C -> 20000 | Y598: =RC[-2]+RC[-1] -> 30200
W599: 0 | X599: =R[-3]C -> 0 | Y599: =RC[-2]+RC[-1] -> 0
W600: 0 | X600: =R[-3]C -> 0 | Y600: =RC[-2]+RC[-1] -> 0
W601: 10201 | X601: =R[-3]C -> 20000 | Y601: =RC[-2]+RC[-1] -> 30201
W602: 0 | X602: =R[-3]C -> 0 | Y602: =RC[-2]+RC[-1] -> 0
W603: 0 | X603: =R[-3]C -> 0 | Y603: =RC[-2]+RC[-1] -> 0
W604: 10202 | X604: =R[-3]C -> 20000 | Y604: =RC[-2]+RC[-1] -> 30202
W605: 0 | X605: =R[-3]C -> 0 | Y605: =RC[-2]+RC[-1] -> 0
W606: 0 | X606: =R[-3]C -> 0 | Y606: =RC[-2]+RC[-1] -> 0
W607: 10203 | X607: =R[-3]C -> 20000 | Y607: =RC[-2]+RC[-1] -> 30203
W608: 0 | X608: =R[-3]C -> 0 | Y608: =RC[-2]+RC[-1] -> 0
W609: 0 | X609: =R[-3]C -> 0 | Y609: =RC[-2]+RC[-1] -> 0
W610: 10204 | X610: =R[-3]C -> 20000 | Y610: =RC[-2]+RC[-1] -> 30204
W611: 0 | X611: =R[-3]C -> 0 | Y611: =RC[-2]+RC[-1] -> 0
W612: 0 | X612: =R[-3]C -> 0 | Y612: =RC[-2]+RC[-1] -> 0
W613: 10205 | X613: =R[-3]C -> 20000 | Y613: =RC[-2]+RC[-1] -> 30205
W614: 0 | X614: =R[-3]C -> 0 | Y614: =RC[-2]+RC[-1] -> 0
W615: 0 | X615: =R[-3]C -> 0 | Y615: =RC[-2]+RC[-1] -> 0
W616: 10206 | X616: =R[-3]C -> 20000 | Y616: =RC[-2]+RC[-1] -> 30206
W617: 0 | X617: =R[-3]C -> 0 | Y617: =RC[-2]+RC[-1] -> 0
W618: 0 | X618: =R[-3]C -> 0 | Y618: =RC[-2]+RC[-1] -> 0
W619: 10207 | X619: =R[-3]C -> 20000 | Y619: =RC[-2]+RC[-1] -> 30207
W620: 0 | X620: =R[-3]C -> 0 | Y620: =RC[-2]+RC[-1] -> 0
W621: 0 | X621: =R[-3]C -> 0 | Y621: =RC[-2]+RC[-1] -> 0
W622: 10208 | X622: =R[-3]C -> 20000 | Y622: =RC[-2]+RC[-1] -> 30208
W623: 0 | X623: =R[-3]C -> 0 | Y623: =RC[-2]+RC[-1] -> 0
W624: 0 | X624: =R[-3]C -> 0 | Y624: =RC[-2]+RC[-1] -> 0
W625: 10209 | X625: =R[-3]C -> 20000 | Y625: =RC[-2]+RC[-1] -> 30209
W626: 0 | X626: =R[-3]C -> 0 | Y626: =RC[-2]+RC[-1] -> 0
W627: 0 | X627: =R[-3]C -> 0 | Y627: =RC[-2]+RC[-1] -> 0
W628: 10210 | X628: =R[-3]C -> 20000 | Y628: =RC[-2]+RC[-1] -> 30210
W629: 0 | X629: =R[-3]C -> 0 | Y629: =RC[-2]+RC[-1] -> 0
W630: 0 | X630: =R[-3]C -> 0 | Y630: =RC[-2]+RC[-1] -> 0
W631: 10211 | X631: =R[-3]C -> 20000 | Y631: =RC[-2]+RC[-1] -> 30211
W632: 0 | X632: =R[-3]C -> 0 | Y632: =RC[-2]+RC[-1] -> 0
W633: 0 | X633: =R[-3]C -> 0 | Y633: =RC[-2]+RC[-1] -> 0
W634: 10212 | X634: =R[-3]C -> 20000 | Y634: =RC[-2]+RC[-1] -> 30212
W635: 0 | X635: =R[-3]C -> 0 | Y635: =RC[-2]+RC[-1] -> 0
W636: 0 | X636: =R[-3]C -> 0 | Y636: =RC[-2]+RC[-1] -> 0
W637: 10213 | X637: =R[-3]C -> 20000 | Y637: =RC[-2]+RC[-1] -> 30213
W638: 0 | X638: =R[-3]C -> 0 | Y638: =RC[-2]+RC[-1] -> 0
W639: 0 | X639: =R[-3]C -> 0 | Y639: =RC[-2]+RC[-1] -> 0
W640: 10214 | X640: =R[-3]C -> 20000 | Y640: =RC[-2]+RC[-1] -> 30214
W641: 0 | X641: =R[-3]C -> 0 | Y641: =RC[-2]+RC[-1] -> 0
W642: 0 | X642: =R[-3]C -> 0 | Y642: =RC[-2]+RC[-1] -> 0
W643: 10215 | X643: =R[-3]C -> 20000 | Y643: =RC[-2]+RC[-1] -> 30215
W644: 0 | X644: =R[-3]C -> 0 | Y644: =RC[-2]+RC[-1] -> 0
W645: 0 | X645: =R[-3]C -> 0 | Y645: =RC[-2]+RC[-1] -> 0
W646: 10216 | X646: =R[-3]C -> 20000 | Y646: =RC[-2]+RC[-1] -> 30216
W647: 0 | X647: =R[-3]C -> 0 | Y647: =RC[-2]+RC[-1] -> 0
W648: 0 | X648: =R[-3]C -> 0 | Y648: =RC[-2]+RC[-1] -> 0
W649: 10217 | X649: =R[-3]C -> 20000 | Y649: =RC[-2]+RC[-1] -> 30217
W650: 0 | X650: =R[-3]C -> 0 | Y650: =RC[-2]+RC[-1] -> 0
W651: 0 | X651: =R[-3]C -> 0 | Y651: =RC[-2]+RC[-1] -> 0
W652: 10218 | X652: =R[-3]C -> 20000 | Y652: =RC[-2]+RC[-1] -> 30218
W653: 0 | X653: =R[-3]C -> 0 | Y653: =RC[-2]+RC[-1] -> 0
W654: 0 | X654: =R[-3]C -> 0 | Y654: =RC[-2]+RC[-1] -> 0
W655: 10219 | X655: =R[-3]C -> 20000 | Y655: =RC[-2]+RC[-1] -> 30219
W656: 0 | X656: =R[-3]C -> 0 | Y656: =RC[-2]+RC[-1] -> 0
W657: 0 | X657: =R[-3]C -> 0 | Y657: =RC[-2]+RC[-1] -> 0
W658: 10220 | X658: =R[-3]C -> 20000 | Y658: =RC[-2]+RC[-1] -> 30220
W659: 0 | X659: =R[-3]C -> 0 | Y659: =RC[-2]+RC[-1] -> 0
W660: 0 | X660: =R[-3]C -> 0 | Y660: =RC[-2]+RC[-1] -> 0
W661: 10221 | X661: =R[-3]C -> 20000 | Y661: =RC[-2]+RC[-1] -> 30221
W662: 0 | X662: =R[-3]C -> 0 | Y662: =RC[-2]+RC[-1] -> 0
W663: 0 | X663: =R[-3]C -> 0 | Y663: =RC[-2]+RC[-1] -> 0
W664: 10222 | X664: =R[-3]C -> 20000 | Y664: =RC[-2]+RC[-1] -> 30222
W665: 0 | X665: =R[-3]C -> 0 | Y665: =RC[-2]+RC[-1] -> 0
W666: 0 | X666: =R[-3]C -> 0 | Y666: =RC[-2]+RC[-1] -> 0
W667: 10223 | X667: =R[-3]C -> 20000 | Y667: =RC[-2]+RC[-1] -> 30223
W668: 0 | X668: =R[-3]C -> 0 | Y668: =RC[-2]+RC[-1] -> 0
W669: 0 | X669: =R[-3]C -> 0 | Y669: =RC[-2]+RC[-1] -> 0
W670: 10224 | X670: =R[-3]C -> 20000 | Y670: =RC[-2]+RC[-1] -> 30224
W671: 0 | X671: =R[-3]C -> 0 | Y671: =RC[-2]+RC[-1] -> 0
W672: 0 | X672: =R[-3]C -> 0 | Y672: =RC[-2]+RC[-1] -> 0
W673: 10225 | X673: =R[-3]C -> 20000 | Y673: =RC[-2]+RC[-1] -> 30225
W674: 0 | X674: =R[-3]C -> 0 | Y674: =RC[-2]+RC[-1] -> 0
W675: 0 | X675: =R[-3]C -> 0 | Y675: =RC[-2]+RC[-1] -> 0
W676: 10226 | X676: =R[-3]C -> 20000 | Y676: =RC[-2]+RC[-1] -> 30226
W677: 0 | X677: =R[-3]C -> 0 | Y677: =RC[-2]+RC[-1] -> 0
W678: 0 | X678: =R[-3]C -> 0 | Y678: =RC[-2]+RC[-1] -> 0
W679: 10227 | X679: =R[-3]C -> 20000 | Y679: =RC[-2]+RC[-1] -> 30227
W680: 0 | X680: =R[-3]C -> 0 | Y680: =RC[-2]+RC[-1] -> 0
W681: 0 | X681: =R[-3]C -> 0 | Y681: =RC[-2]+RC[-1] -> 0
W682: 10228 | X682: =R[-3]C -> 20000 | Y682: =RC[-2]+RC[-1] -> 30228
W683: 0 | X683: =R[-3]C -> 0 | Y683: =RC[-2]+RC[-1] -> 0
W684: 0 | X684: =R[-3]C -> 0 | Y684: =RC[-2]+RC[-1] -> 0
W685: 10229 | X685: =R[-3]C -> 20000 | Y685: =RC[-2]+RC[-1] -> 30229
W686: 0 | X686: =R[-3]C -> 0 | Y686: =RC[-2]+RC[-1] -> 0
W687: 0 | X687: =R[-3]C -> 0 | Y687: =RC[-2]+RC[-1] -> 0
W688: 10230 | X688: =R[-3]C -> 20000 | Y688: =RC[-2]+RC[-1] -> 30230
W689: 0 | X689: =R[-3]C -> 0 | Y689: =RC[-2]+RC[-1] -> 0
W690: 0 | X690: =R[-3]C -> 0 | Y690: =RC[-2]+RC[-1] -> 0
W691: 10231 | X691: =R[-3]C -> 20000 | Y691: =RC[-2]+RC[-1] -> 30231
W692: 0 | X692: =R[-3]C -> 0 | Y692: =RC[-2]+RC[-1] -> 0
W693: 0 | X693: =R[-3]C -> 0 | Y693: =RC[-2]+RC[-1] -> 0
W694: 10232 | X694: =R[-3]C -> 20000 | Y694: =RC[-2]+RC[-1] -> 30232
W695: 0 | X695: =R[-3]C -> 0 | Y695: =RC[-2]+RC[-1] -> 0
W696: 0 | X696: =R[-3]C -> 0 | Y696: =RC[-2]+RC[-1] -> 0
W697: 10233 | X697: =R[-3]C -> 20000 | Y697: =RC[-2]+RC[-1] -> 30233
W698: 0 | X698: =R[-3]C -> 0 | Y698: =RC[-2]+RC[-1] -> 0
W699: 0 | X699: =R[-3]C -> 0 | Y699: =RC[-2]+RC[-1] -> 0
W700: 10234 | X700: =R[-3]C -> 20000 | Y700: =RC[-2]+RC[-1] -> 30234
W701: 0 | X701: =R[-3]C -> 0 | Y701: =RC[-2]+RC[-1] -> 0
W702: 0 | X702: =R[-3]C -> 0 | Y702: =RC[-2]+RC[-1] -> 0
W703: 10235 | X703: =R[-3]C -> 20000 | Y703: =RC[-2]+RC[-1] -> 30235
W704: 0 | X704: =R[-3]C -> 0 | Y704: =RC[-2]+RC[-1] -> 0
W705: 0 | X705: =R[-3]C -> 0 | Y705: =RC[-2]+RC[-1] -> 0
W706: 10236 | X706: =R[-3]C -> 20000 | Y706: =RC[-2]+RC[-1] -> 30236
W707: 0 | X707: =R[-3]C -> 0 | Y707: =RC[-2]+RC[-1] -> 0
W708: 0 | X708: =R[-3]C -> 0 | Y708: =RC[-2]+RC[-1] -> 0
W709: 10237 | X709: =R[-3]C -> 20000 | Y709: =RC[-2]+RC[-1] -> 30237
W710: 0 | X710: =R[-3]C -> 0 | Y710: =RC[-2]+RC[-1] -> 0
W711: 0 | X711: =R[-3]C -> 0 | Y711: =RC[-2]+RC[-1] -> 0
W712: 10238 | X712: =R[-3]C -> 20000 | Y712: =RC[-2]+RC[-1] -> 30238
W713: 0 | X713: =R[-3]C -> 0 | Y713: =RC[-2]+RC[-1] -> 0
W714: 0 | X714: =R[-3]C -> 0 | Y714: =RC[-2]+RC[-1] -> 0
W715: 10239 | X715: =R[-3]C -> 20000 | Y715: =RC[-2]+RC[-1] -> 30239
W716: 0 | X716: =R[-3]C -> 0 | Y716: =RC[-2]+RC[-1] -> 0
W717: 0 | X717: =R[-3]C -> 0 | Y717: =RC[-2]+RC[-1] -> 0
W718: 10240 | X718: =R[-3]C -> 20000 | Y718: =RC[-2]+RC[-1] -> 30240
W719: 0 | X719: =R[-3]C -> 0 | Y719: =RC[-2]+RC[-1] -> 0
W720: 0 | X720: =R[-3]C -> 0 | Y720: =RC[-2]+RC[-1] -> 0
W721: 10241 | X721: =R[-3]C -> 20000 | Y721: =RC[-2]+RC[-1] -> 30241
W722: 0 | X722: =R[-3]C -> 0 | Y722: =RC[-2]+RC[-1] -> 0
W723: 0 | X723: =R[-3]C -> 0 | Y723: =RC[-2]+RC[-1] -> 0
W724: 10242 | X724: =R[-3]C -> 20000 | Y724: =RC[-2]+RC[-1] -> 30242
W725: 0 | X725: =R[-3]C -> 0 | Y725: =RC[-2]+RC[-1] -> 0
W726: 0 | X726: =R[-3]C -> 0 | Y726: =RC[-2]+RC[-1] -> 0
W727: 10243 | X727: =R[-3]C -> 20000 | Y727: =RC[-2]+RC[-1] -> 30243
W728: 0 | X728: =R[-3]C -> 0 | Y728: =RC[-2]+RC[-1] -> 0
W729: 0 | X729: =R[-3]C -> 0 | Y729: =RC[-2]+RC[-1] -> 0
W730: 10244 | X730: =R[-3]C -> 20000 | Y730: =RC[-2]+RC[-1] -> 30244
W731: 0 | X731: =R[-3]C -> 0 | Y731: =RC[-2]+RC[-1] -> 0
W732: 0 | X732: =R[-3]C -> 0 | Y732: =RC[-2]+RC[-1] -> 0
W733: 10245 | X733: =R[-3]C -> 20000 | Y733: =RC[-2]+RC[-1] -> 30245
W734: 0 | X734: =R[-3]C -> 0 | Y734: =RC[-2]+RC[-1] -> 0
W735: 0 | X735: =R[-3]C -> 0 | Y735: =RC[-2]+RC[-1] -> 0
W736: 10246 | X736: =R[-3]C -> 20000 | Y736: =RC[-2]+RC[-1] -> 30246
W737: 0 | X737: =R[-3]C -> 0 | Y737: =RC[-2]+RC[-1] -> 0
W738: 0 | X738: =R[-3]C -> 0 | Y738: =RC[-2]+RC[-1] -> 0
W739: 10247 | X739: =R[-3]C -> 20000 | Y739: =RC[-2]+RC[-1] -> 30247
W740: 0 | X740: =R[-3]C -> 0 | Y740: =RC[-2]+RC[-1] -> 0
W741: 0 | X741: =R[-3]C -> 0 | Y741: =RC[-2]+RC[-1] -> 0
W742: 10248 | X742: =R[-3]C -> 20000 | Y742: =RC[-2]+RC[-1] -> 30248
W743: 0 | X743: =R[-3]C -> 0 | Y743: =RC[-2]+RC[-1] -> 0
W744: 0 | X744: =R[-3]C -> 0 | Y744: =RC[-2]+RC[-1] -> 0
W745: 10249 | X745: =R[-3]C -> 20000 | Y745: =RC[-2]+RC[-1] -> 30249
W746: 0 | X746: =R[-3]C -> 0 | Y746: =RC[-2]+RC[-1] -> 0
W747: 0 | X747: =R[-3]C -> 0 | Y747: =RC[-2]+RC[-1] -> 0
W748: 10250 | X748: =R[-3]C -> 20000 | Y748: =RC[-2]+RC[-1] -> 30250
W749: 0 | X749: =R[-3]C -> 0 | Y749: =RC[-2]+RC[-1] -> 0
W750: 0 | X750: =R[-3]C -> 0 | Y750: =RC[-2]+RC[-1] -> 0
W751: 10251 | X751: =R[-3]C -> 20000 | Y751: =RC[-2]+RC[-1] -> 30251
W752: 0 | X752: =R[-3]C -> 0 | Y752: =RC[-2]+RC[-1] -> 0
W753: 0 | X753: =R[-3]C -> 0 | Y753: =RC[-2]+RC[-1] -> 0
W754: 10252 | X754: =R[-3]C -> 20000 | Y754: =RC[-2]+RC[-1] -> 30252
W755: 0 | X755: =R[-3]C -> 0 | Y755: =RC[-2]+RC[-1] -> 0
W756: 0 | X756: =R[-3]C -> 0 | Y756: =RC[-2]+RC[-1] -> 0
W757: 10253 | X757: =R[-3]C -> 20000 | Y757: =RC[-2]+RC[-1] -> 30253
W758: 0 | X758: =R[-3]C -> 0 | Y758: =RC[-2]+RC[-1] -> 0
W759: 0 | X759: =R[-3]C -> 0 | Y759: =RC[-2]+RC[-1] -> 0
W760: 10254 | X760: =R[-3]C -> 20000 | Y760: =RC[-2]+RC[-1] -> 30254
W761: 0 | X761: =R[-3]C -> 0 | Y761: =RC[-2]+RC[-1] -> 0
W762: 0 | X762: =R[-3]C -> 0 | Y762: =RC[-2]+RC[-1] -> 0
W763: 10255 | X763: =R[-3]C -> 20000 | Y763: =RC[-2]+RC[-1] -> 30255
W764: 0 | X764: =R[-3]C -> 0 | Y764: =RC[-2]+RC[-1] -> 0
W765: 0 | X765: =R[-3]C -> 0 | Y765: =RC[-2]+RC[-1] -> 0
W766: 10256 | X766: =R[-3]C -> 20000 | Y766: =RC[-2]+RC[-1] -> 30256
W767: 0 | X767: =R[-3]C -> 0 | Y767: =RC[-2]+RC[-1] -> 0
W768: 0 | X768: =R[-3]C -> 0 | Y768: =RC[-2]+RC[-1] -> 0
W769: 10257 | X769: =R[-3]C -> 20000 | Y769: =RC[-2]+RC[-1] -> 30257
W770: 0 | X770: =R[-3]C -> 0 | Y770: =RC[-2]+RC[-1] -> 0
W771: 0 | X771: =R[-3]C -> 0 | Y771: =RC[-2]+RC[-1] -> 0
W772: 10258 | X772: =R[-3]C -> 20000 | Y772: =RC[-2]+RC[-1] -> 30258
W773: 0 | X773: =R[-3]C -> 0 | Y773: =RC[-2]+RC[-1] -> 0
W774: 0 | X774: =R[-3]C -> 0 | Y774: =RC[-2]+RC[-1] -> 0
W775: 10259 | X775: =R[-3]C -> 20000 | Y775: =RC[-2]+RC[-1] -> 30259
W776: 0 | X776: =R[-3]C -> 0 | Y776: =RC[-2]+RC[-1] -> 0
W777: 0 | X777: =R[-3]C -> 0 | Y777: =RC[-2]+RC[-1] -> 0
W778: 10260 | X778: =R[-3]C -> 20000 | Y778: =RC[-2]+RC[-1] -> 30260
W779: 0 | X779: =R[-3]C -> 0 | Y779: =RC[-2]+RC[-1] -> 0
W780: 0 | X780: =R[-3]C -> 0 | Y780: =RC[-2]+RC[-1] -> 0
W781: 10261 | X781: =R[-3]C -> 20000 | Y781: =RC[-2]+RC[-1] -> 30261
W782: 0 | X782: =R[-3]C -> 0 | Y782: =RC[-2]+RC[-1] -> 0
W783: 0 | X783: =R[-3]C -> 0 | Y783: =RC[-2]+RC[-1] -> 0
W784: 10262 | X784: =R[-3]C -> 20000 | Y784: =RC[-2]+RC[-1] -> 30262
W785: 0 | X785: =R[-3]C -> 0 | Y785: =RC[-2]+RC[-1] -> 0
W786: 0 | X786: =R[-3]C -> 0 | Y786: =RC[-2]+RC[-1] -> 0
W787: 10263 | X787: =R[-3]C -> 20000 | Y787: =RC[-2]+RC[-1] -> 30263
W788: 0 | X788: =R[-3]C -> 0 | Y788: =RC[-2]+RC[-1] -> 0
W789: 0 | X789: =R[-3]C -> 0 | Y789: =RC[-2]+RC[-1] -> 0
W790: 10264 | X790: =R[-3]C -> 20000 | Y790: =RC[-2]+RC[-1] -> 30264
W791: 0 | X791: =R[-3]C -> 0 | Y791: =RC[-2]+RC[-1] -> 0
W792: 0 | X792: =R[-3]C -> 0 | Y792: =RC[-2]+RC[-1] -> 0
W793: 10265 | X793: =R[-3]C -> 20000 | Y793: =RC[-2]+RC[-1] -> 30265
W794: 0 | X794: =R[-3]C -> 0 | Y794: =RC[-2]+RC[-1] -> 0
W795: 0 | X795: =R[-3]C -> 0 | Y795: =RC[-2]+RC[-1] -> 0
W796: 10266 | X796: =R[-3]C -> 20000 | Y796: =RC[-2]+RC[-1] -> 30266
W797: 0 | X797: =R[-3]C -> 0 | Y797: =RC[-2]+RC[-1] -> 0
W798: 0 | X798: =R[-3]C -> 0 | Y798: =RC[-2]+RC[-1] -> 0
W799: 10267 | X799: =R[-3]C -> 20000 | Y799: =RC[-2]+RC[-1] -> 30267
W800: 0 | X800: =R[-3]C -> 0 | Y800: =RC[-2]+RC[-1] -> 0
W801: 0 | X801: =R[-3]C -> 0 | Y801: =RC[-2]+RC[-1] -> 0
W802: 10268 | X802: =R[-3]C -> 20000 | Y802: =RC[-2]+RC[-1] -> 30268
W803: 0 | X803: =R[-3]C -> 0 | Y803: =RC[-2]+RC[-1] -> 0
W804: 0 | X804: =R[-3]C -> 0 | Y804: =RC[-2]+RC[-1] -> 0
W805: 10269 | X805: =R[-3]C -> 20000 | Y805: =RC[-2]+RC[-1] -> 30269
W806: 0 | X806: =R[-3]C -> 0 | Y806: =RC[-2]+RC[-1] -> 0
W807: 0 | X807: =R[-3]C -> 0 | Y807: =RC[-2]+RC[-1] -> 0
W808: 10270 | X808: =R[-3]C -> 20000 | Y808: =RC[-2]+RC[-1] -> 30270
W809: 0 | X809: =R[-3]C -> 0 | Y809: =RC[-2]+RC[-1] -> 0
W810: 0 | X810: =R[-3]C -> 0 | Y810: =RC[-2]+RC[-1] -> 0
W811: 10271 | X811: =R[-3]C -> 20000 | Y811: =RC[-2]+RC[-1] -> 30271
W812: 0 | X812: =R[-3]C -> 0 | Y812: =RC[-2]+RC[-1] -> 0
W813: 0 | X813: =R[-3]C -> 0 | Y813: =RC[-2]+RC[-1] -> 0
W814: 10272 | X814: =R[-3]C -> 20000 | Y814: =RC[-2]+RC[-1] -> 30272
W815: 0 | X815: =R[-3]C -> 0 | Y815: =RC[-2]+RC[-1] -> 0
W816: 0 | X816: =R[-3]C -> 0 | Y816: =RC[-2]+RC[-1] -> 0
W817: 10273 | X817: =R[-3]C -> 20000 | Y817: =RC[-2]+RC[-1] -> 30273
W818: 0 | X818: =R[-3]C -> 0 | Y818: =RC[-2]+RC[-1] -> 0
W819: 0 | X819: =R[-3]C -> 0 | Y819: =RC[-2]+RC[-1] -> 0
W820: 10274 | X820: =R[-3]C -> 20000 | Y820: =RC[-2]+RC[-1] -> 30274
W821: 0 | X821: =R[-3]C -> 0 | Y821: =RC[-2]+RC[-1] -> 0
W822: 0 | X822: =R[-3]C -> 0 | Y822: =RC[-2]+RC[-1] -> 0
W823: 10275 | X823: =R[-3]C -> 20000 | Y823: =RC[-2]+RC[-1] -> 30275
W824: 0 | X824: =R[-3]C -> 0 | Y824: =RC[-2]+RC[-1] -> 0
W825: 0 | X825: =R[-3]C -> 0 | Y825: =RC[-2]+RC[-1] -> 0
W826: 10276 | X826: =R[-3]C -> 20000 | Y826: =RC[-2]+RC[-1] -> 30276
W827: 0 | X827: =R[-3]C -> 0 | Y827: =RC[-2]+RC[-1] -> 0
W828: 0 | X828: =R[-3]C -> 0 | Y828: =RC[-2]+RC[-1] -> 0
W829: 10277 | X829: =R[-3]C -> 20000 | Y829: =RC[-2]+RC[-1] -> 30277
W830: 0 | X830: =R[-3]C -> 0 | Y830: =RC[-2]+RC[-1] -> 0
W831: 0 | X831: =R[-3]C -> 0 | Y831: =RC[-2]+RC[-1] -> 0
W832: 10278 | X832: =R[-3]C -> 20000 | Y832: =RC[-2]+RC[-1] -> 30278
W833: 0 | X833: =R[-3]C -> 0 | Y833: =RC[-2]+RC[-1] -> 0
W834: 0 | X834: =R[-3]C -> 0 | Y834: =RC[-2]+RC[-1] -> 0
W835: 10279 | X835: =R[-3]C -> 20000 | Y835: =RC[-2]+RC[-1] -> 30279
W836: 0 | X836: =R[-3]C -> 0 | Y836: =RC[-2]+RC[-1] -> 0
W837: 0 | X837: =R[-3]C -> 0 | Y837: =RC[-2]+RC[-1] -> 0
W838: 10280 | X838: =R[-3]C -> 20000 | Y838: =RC[-2]+RC[-1] -> 30280
W839: 0 | X839: =R[-3]C -> 0 | Y839: =RC[-2]+RC[-1] -> 0
W840: 0 | X840: =R[-3]C -> 0 | Y840: =RC[-2]+RC[-1] -> 0
W841: 10281 | X841: =R[-3]C -> 20000 | Y841: =RC[-2]+RC[-1] -> 30281
W842: 0 | X842: =R[-3]C -> 0 | Y842: =RC[-2]+RC[-1] -> 0
W843: 0 | X843: =R[-3]C -> 0 | Y843: =RC[-2]+RC[-1] -> 0
W844: 10282 | X844: =R[-3]C -> 20000 | Y844: =RC[-2]+RC[-1] -> 30282
W845: 0 | X845: =R[-3]C -> 0 | Y845: =RC[-2]+RC[-1] -> 0
W846: 0 | X846: =R[-3]C -> 0 | Y846: =RC[-2]+RC[-1] -> 0
W847: 10283 | X847: =R[-3]C -> 20000 | Y847: =RC[-2]+RC[-1] -> 30283
W848: 0 | X848: =R[-3]C -> 0 | Y848: =RC[-2]+RC[-1] -> 0
W849: 0 | X849: =R[-3]C -> 0 | Y849: =RC[-2]+RC[-1] -> 0
W850: 10284 | X850: =R[-3]C -> 20000 | Y850: =RC[-2]+RC[-1] -> 30284
W851: 0 | X851: =R[-3]C -> 0 | Y851: =RC[-2]+RC[-1] -> 0
W852: 0 | X852: =R[-3]C -> 0 | Y852: =RC[-2]+RC[-1] -> 0
W853: 10285 | X853: =R[-3]C -> 20000 | Y853: =RC[-2]+RC[-1] -> 30285
W854: 0 | X854: =R[-3]C -> 0 | Y854: =RC[-2]+RC[-1] -> 0
W855: 0 | X855: =R[-3]C -> 0 | Y855: =RC[-2]+RC[-1] -> 0
W856: 10286 | X856: =R[-3]C -> 20000 | Y856: =RC[-2]+RC[-1] -> 30286
W857: 0 | X857: =R[-3]C -> 0 | Y857: =RC[-2]+RC[-1] -> 0
W858: 0 | X858: =R[-3]C -> 0 | Y858: =RC[-2]+RC[-1] -> 0
W859: 10287 | X859: =R[-3]C -> 20000 | Y859: =RC[-2]+RC[-1] -> 30287
W860: 0 | X860: =R[-3]C -> 0 | Y860: =RC[-2]+RC[-1] -> 0
W861: 0 | X861: =R[-3]C -> 0 | Y861: =RC[-2]+RC[-1] -> 0
W862: 10288 | X862: =R[-3]C -> 20000 | Y862: =RC[-2]+RC[-1] -> 30288
W863: 0 | X863: =R[-3]C -> 0 | Y863: =RC[-2]+RC[-1] -> 0
W864: 0 | X864: =R[-3]C -> 0 | Y864: =RC[-2]+RC[-1] -> 0
W865: 10289 | X865: =R[-3]C -> 20000 | Y865: =RC[-2]+RC[-1] -> 30289
W866: 0 | X866: =R[-3]C -> 0 | Y866: =RC[-2]+RC[-1] -> 0
W867: 0 | X867: =R[-3]C -> 0 | Y867: =RC[-2]+RC[-1] -> 0
W868: 10290 | X868: =R[-3]C -> 20000 | Y868: =RC[-2]+RC[-1] -> 30290
W869: 0 | X869: =R[-3]C -> 0 | Y869: =RC[-2]+RC[-1] -> 0
W870: 0 | X870: =R[-3]C -> 0 | Y870: =RC[-2]+RC[-1] -> 0
W871: 10291 | X871: =R[-3]C -> 20000 | Y871: =RC[-2]+RC[-1] -> 30291
W872: 0 | X872: =R[-3]C -> 0 | Y872: =RC[-2]+RC[-1] -> 0
W873: 0 | X873: =R[-3]C -> 0 | Y873: =RC[-2]+RC[-1] -> 0
W874: 10292 | X874: =R[-3]C -> 20000 | Y874: =RC[-2]+RC[-1] -> 30292
W875: 0 | X875: =R[-3]C -> 0 | Y875: =RC[-2]+RC[-1] -> 0
W876: 0 | X876: =R[-3]C -> 0 | Y876: =RC[-2]+RC[-1] -> 0
W877: 10293 | X877: =R[-3]C -> 20000 | Y877: =RC[-2]+RC[-1] -> 30293
W878: 0 | X878: =R[-3]C -> 0 | Y878: =RC[-2]+RC[-1] -> 0
W879: 0 | X879: =R[-3]C -> 0 | Y879: =RC[-2]+RC[-1] -> 0
W880: 10294 | X880: =R[-3]C -> 20000 | Y880: =RC[-2]+RC[-1] -> 30294
W881: 0 | X881: =R[-3]C -> 0 | Y881: =RC[-2]+RC[-1] -> 0
W882: 0 | X882: =R[-3]C -> 0 | Y882: =RC[-2]+RC[-1] -> 0
W883: 10295 | X883: =R[-3]C -> 20000 | Y883: =RC[-2]+RC[-1] -> 30295
W884: 0 | X884: =R[-3]C -> 0 | Y884: =RC[-2]+RC[-1] -> 0
W885: 0 | X885: =R[-3]C -> 0 | Y885: =RC[-2]+RC[-1] -> 0
W886: 10296 | X886: =R[-3]C -> 20000 | Y886: =RC[-2]+RC[-1] -> 30296
W887: 0 | X887: =R[-3]C -> 0 | Y887: =RC[-2]+RC[-1] -> 0
W888: 0 | X888: =R[-3]C -> 0 | Y888: =RC[-2]+RC[-1] -> 0
W889: 10297 | X889: =R[-3]C -> 20000 | Y889: =RC[-2]+RC[-1] -> 30297
W890: 0 | X890: =R[-3]C -> 0 | Y890: =RC[-2]+RC[-1] -> 0
W891: 0 | X891: =R[-3]C -> 0 | Y891: =RC[-2]+RC[-1] -> 0
W892: 10298 | X892: =R[-3]C -> 20000 | Y892: =RC[-2]+RC[-1] -> 30298
W893: 0 | X893: =R[-3]C -> 0 | Y893: =RC[-2]+RC[-1] -> 0
W894: 0 | X894: =R[-3]C -> 0 | Y894: =RC[-2]+RC[-1] -> 0
W895: 10299 | X895: =R[-3]C -> 20000 | Y895: =RC[-2]+RC[-1] -> 30299
W896: 0 | X896: =R[-3]C -> 0 | Y896: =RC[-2]+RC[-1] -> 0
W897: 0 | X897: =R[-3]C -> 0 | Y897: =RC[-2]+RC[-1] -> 0
W898: 10300 | X898: =R[-3]C -> 20000 | Y898: =RC[-2]+RC[-1] -> 30300
W899: 0 | X899: =R[-3]C -> 0 | Y899: =RC[-2]+RC[-1] -> 0
W900: 0 | X900: =R[-3]C -> 0 | Y900: =RC[-2]+RC[-1] -> 0
W901: 10301 | X901: =R[-3]C -> 20000 | Y901: =RC[-2]+RC[-1] -> 30301
W902: 0 | X902: =R[-3]C -> 0 | Y902: =RC[-2]+RC[-1] -> 0
W903: 0 | X903: =R[-3]C -> 0 | Y903: =RC[-2]+RC[-1] -> 0
W904: 10302 | X904: =R[-3]C -> 20000 | Y904: =RC[-2]+RC[-1] -> 30302
W905: 0 | X905: =R[-3]C -> 0 | Y905: =RC[-2]+RC[-1] -> 0
W906: 0 | X906: =R[-3]C -> 0 | Y906: =RC[-2]+RC[-1] -> 0
W907: 10303 | X907: =R[-3]C -> 20000 | Y907: =RC[-2]+RC[-1] -> 30303
W908: 0 | X908: =R[-3]C -> 0 | Y908: =RC[-2]+RC[-1] -> 0
W909: 0 | X909: =R[-3]C -> 0 | Y909: =RC[-2]+RC[-1] -> 0
W910: 10304 | X910: =R[-3]C -> 20000 | Y910: =RC[-2]+RC[-1] -> 30304
W911: 0 | X911: =R[-3]C -> 0 | Y911: =RC[-2]+RC[-1] -> 0
W912: 0 | X912: =R[-3]C -> 0 | Y912: =RC[-2]+RC[-1] -> 0
W913: 10305 | X913: =R[-3]C -> 20000 | Y913: =RC[-2]+RC[-1] -> 30305
W914: 0 | X914: =R[-3]C -> 0 | Y914: =RC[-2]+RC[-1] -> 0
W915: 0 | X915: =R[-3]C -> 0 | Y915: =RC[-2]+RC[-1] -> 0
W916: 10306 | X916: =R[-3]C -> 20000 | Y916: =RC[-2]+RC[-1] -> 30306
W917: 0 | X917: =R[-3]C -> 0 | Y917: =RC[-2]+RC[-1] -> 0
W918: 0 | X918: =R[-3]C -> 0 | Y918: =RC[-2]+RC[-1] -> 0
W919: 10307 | X919: =R[-3]C -> 20000 | Y919: =RC[-2]+RC[-1] -> 30307
W920: 0 | X920: =R[-3]C -> 0 | Y920: =RC[-2]+RC[-1] -> 0
W921: 0 | X921: =R[-3]C -> 0 | Y921: =RC[-2]+RC[-1] -> 0
W922: 10308 | X922: =R[-3]C -> 20000 | Y922: =RC[-2]+RC[-1] -> 30308
W923: 0 | X923: =R[-3]C -> 0 | Y923: =RC[-2]+RC[-1] -> 0
W924: 0 | X924: =R[-3]C -> 0 | Y924: =RC[-2]+RC[-1] -> 0
W925: 10309 | X925: =R[-3]C -> 20000 | Y925: =RC[-2]+RC[-1] -> 30309
W926: 0 | X926: =R[-3]C -> 0 | Y926: =RC[-2]+RC[-1] -> 0
W927: 0 | X927: =R[-3]C -> 0 | Y927: =RC[-2]+RC[-1] -> 0
W928: 10310 | X928: =R[-3]C -> 20000 | Y928: =RC[-2]+RC[-1] -> 30310
W929: 0 | X929: =R[-3]C -> 0 | Y929: =RC[-2]+RC[-1] -> 0
W930: 0 | X930: =R[-3]C -> 0 | Y930: =RC[-2]+RC[-1] -> 0
W931: 10311 | X931: =R[-3]C -> 20000 | Y931: =RC[-2]+RC[-1] -> 30311
W932: 0 | X932: =R[-3]C -> 0 | Y932: =RC[-2]+RC[-1] -> 0
W933: 0 | X933: =R[-3]C -> 0 | Y933: =RC[-2]+RC[-1] -> 0
W934: 10312 | X934: =R[-3]C -> 20000 | Y934: =RC[-2]+RC[-1] -> 30312
W935: 0 | X935: =R[-3]C -> 0 | Y935: =RC[-2]+RC[-1] -> 0
W936: 0 | X936: =R[-3]C -> 0 | Y936: =RC[-2]+RC[-1] -> 0
W937: 10313 | X937: =R[-3]C -> 20000 | Y937: =RC[-2]+RC[-1] -> 30313
W938: 0 | X938: =R[-3]C -> 0 | Y938: =RC[-2]+RC[-1] -> 0
W939: 0 | X939: =R[-3]C -> 0 | Y939: =RC[-2]+RC[-1] -> 0
W940: 10314 | X940: =R[-3]C -> 20000 | Y940: =RC[-2]+RC[-1] -> 30314
W941: 0 | X941: =R[-3]C -> 0 | Y941: =RC[-2]+RC[-1] -> 0
W942: 0 | X942: =R[-3]C -> 0 | Y942: =RC[-2]+RC[-1] -> 0
W943: 10315 | X943: =R[-3]C -> 20000 | Y943: =RC[-2]+RC[-1] -> 30315
W944: 0 | X944: =R[-3]C -> 0 | Y944: =RC[-2]+RC[-1] -> 0
W945: 0 | X945: =R[-3]C -> 0 | Y945: =RC[-2]+RC[-1] -> 0
W946: 10316 | X946: =R[-3]C -> 20000 | Y946: =RC[-2]+RC[-1] -> 30316
W947: 0 | X947: =R[-3]C -> 0 | Y947: =RC[-2]+RC[-1] -> 0
W948: 0 | X948: =R[-3]C -> 0 | Y948: =RC[-2]+RC[-1] -> 0
W949: 10317 | X949: =R[-3]C -> 20000 | Y949: =RC[-2]+RC[-1] -> 30317
W950: 0 | X950: =R[-3]C -> 0 | Y950: =RC[-2]+RC[-1] -> 0
W951: 0 | X951: =R[-3]C -> 0 | Y951: =RC[-2]+RC[-1] -> 0
W952: 10318 | X952: =R[-3]C -> 20000 | Y952: =RC[-2]+RC[-1] -> 30318
W953: 0 | X953: =R[-3]C -> 0 | Y953: =RC[-2]+RC[-1] -> 0
W954: 0 | X954: =R[-3]C -> 0 | Y954: =RC[-2]+RC[-1] -> 0
W955: 10319 | X955: =R[-3]C -> 20000 | Y955: =RC[-2]+RC[-1] -> 30319
W956: 0 | X956: =R[-3]C -> 0 | Y956: =RC[-2]+RC[-1] -> 0
W957: 0 | X957: =R[-3]C -> 0 | Y957: =RC[-2]+RC[-1] -> 0
W958: 10320 | X958: =R[-3]C -> 20000 | Y958: =RC[-2]+RC[-1] -> 30320
W959: 0 | X959: =R[-3]C -> 0 | Y959: =RC[-2]+RC[-1] -> 0
W960: 0 | X960: =R[-3]C -> 0 | Y960: =RC[-2]+RC[-1] -> 0
W961: 10321 | X961: =R[-3]C -> 20000 | Y961: =RC[-2]+RC[-1] -> 30321
W962: 0 | X962: =R[-3]C -> 0 | Y962: =RC[-2]+RC[-1] -> 0
W963: 0 | X963: =R[-3]C -> 0 | Y963: =RC[-2]+RC[-1] -> 0
W964: 10322 | X964: =R[-3]C -> 20000 | Y964: =RC[-2]+RC[-1] -> 30322
W965: 0 | X965: =R[-3]C -> 0 | Y965: =RC[-2]+RC[-1] -> 0
W966: 0 | X966: =R[-3]C -> 0 | Y966: =RC[-2]+RC[-1] -> 0
W967: 10323 | X967: =R[-3]C -> 20000 | Y967: =RC[-2]+RC[-1] -> 30323
W968: 0 | X968: =R[-3]C -> 0 | Y968: =RC[-2]+RC[-1] -> 0
W969: 0 | X969: =R[-3]C -> 0 | Y969: =RC[-2]+RC[-1] -> 0
W970: 10324 | X970: =R[-3]C -> 20000 | Y970: =RC[-2]+RC[-1] -> 30324
W971: 0 | X971: =R[-3]C -> 0 | Y971: =RC[-2]+RC[-1] -> 0
W972: 0 | X972: =R[-3]C -> 0 | Y972: =RC[-2]+RC[-1] -> 0
W973: 10325 | X973: =R[-3]C -> 20000 | Y973: =RC[-2]+RC[-1] -> 30325
W974: 0 | X974: =R[-3]C -> 0 | Y974: =RC[-2]+RC[-1] -> 0
W975: 0 | X975: =R[-3]C -> 0 | Y975: =RC[-2]+RC[-1] -> 0
W976: 10326 | X976: =R[-3]C -> 20000 | Y976: =RC[-2]+RC[-1] -> 30326
W977: 0 | X977: =R[-3]C -> 0 | Y977: =RC[-2]+RC[-1] -> 0
W978: 0 | X978: =R[-3]C -> 0 | Y978: =RC[-2]+RC[-1] -> 0
W979: 10327 | X979: =R[-3]C -> 20000 | Y979: =RC[-2]+RC[-1] -> 30327
W980: 0 | X980: =R[-3]C -> 0 | Y980: =RC[-2]+RC[-1] -> 0
W981: 0 | X981: =R[-3]C -> 0 | Y981: =RC[-2]+RC[-1] -> 0
W982: 10328 | X982: =R[-3]C -> 20000 | Y982: =RC[-2]+RC[-1] -> 30328
W983: 0 | X983: =R[-3]C -> 0 | Y983: =RC[-2]+RC[-1] -> 0
W984: 0 | X984: =R[-3]C -> 0 | Y984: =RC[-2]+RC[-1] -> 0
W985: 10329 | X985: =R[-3]C -> 20000 | Y985: =RC[-2]+RC[-1] -> 30329
W986: 0 | X986: =R[-3]C -> 0 | Y986: =RC[-2]+RC[-1] -> 0
W987: 0 | X987: =R[-3]C -> 0 | Y987: =RC[-2]+RC[-1] -> 0
W988: 10330 | X988: =R[-3]C -> 20000 | Y988: =RC[-2]+RC[-1] -> 30330
W989: 0 | X989: =R[-3]C -> 0 | Y989: =RC[-2]+RC[-1] -> 0
W990: 0 | X990: =R[-3]C -> 0 | Y990: =RC[-2]+RC[-1] -> 0
W991: 10331 | X991: =R[-3]C -> 20000 | Y991: =RC[-2]+RC[-1] -> 30331
W992: 0 | X992: =R[-3]C -> 0 | Y992: =RC[-2]+RC[-1] -> 0
W993: 0 | X993: =R[-3]C -> 0 | Y993: =RC[-2]+RC[-1] -> 0
W994: 10332 | X994: =R[-3]C -> 20000 | Y994: =RC[-2]+RC[-1] -> 30332
W995: 0 | X995: =R[-3]C -> 0 | Y995: =RC[-2]+RC[-1] -> 0
W996: 0 | X996: =R[-3]C -> 0 | Y996: =RC[-2]+RC[-1] -> 0
W997: 10333 | X997: =R[-3]C -> 20000 | Y997: =RC[-2]+RC[-1] -> 30333
W998: 0 | X998: =R[-3]C -> 0 | Y998: =RC[-2]+RC[-1] -> 0
W999: 0 | X999: =R[-3]C -> 0 | Y999: =RC[-2]+RC[-1] -> 0
W1000: 10334 | X1000: =R[-3]C -> 20000 | Y1000: =RC[-2]+RC[-1] -> 30334

Sheet: Sheet4
B1: 序号 | C1: 是否可以组队前往 | D1: 战斗组ID | E1: 首通奖励 | G1: 首通奖励
B2: 1 | C2: 0 | D2: 400001 | E2: 1,7,760,0;1,4,1100,0; | G2: 1 | H2: 7 | I2: 760 | J2: 0 | L2: 1 | M2: 4 | N2: 1100 | O2: 0 | Q2: ="1,7,"&RC[2]&",0;"&"1,4,"&RC[4]&",0;" -> 1,7,5860,0;1,4,137555,0; | S2: =INT(((50+RC[-17]/10)*35+200)*12/4) -> 5860 | U2: =1000*110/100*(1+(50+RC[-19]/10)/200)*100 -> 137555
B3: 2 | C3: 0 | D3: 400002 | E3: 1,7,771,0;1,4,1101,0; | G3: 1 | H3: 7 | I3: 771 | J3: 0 | L3: 1 | M3: 4 | N3: 1101 | O3: 0 | Q3: ="1,7,"&RC[2]&",0;"&"1,4,"&RC[4]&",0;" -> 1,7,5871,0;1,4,137610,0; | S3: =INT(((50+RC[-17]/10)*35+200)*12/4) -> 5871 | U3: =1000*110/100*(1+(50+RC[-19]/10)/200)*100 -> 137610
B4: 3 | C4: 0 | D4: 400003 | E4: 1,7,781,0;1,4,1101,0; | G4: 1 | H4: 7 | I4: 781 | J4: 0 | L4: 1 | M4: 4 | N4: 1101 | O4: 0 | Q4: ="1,7,"&RC[2]&",0;"&"1,4,"&RC[4]&",0;" -> 1,7,5881,0;1,4,137665,0; | S4: =INT(((50+RC[-17]/10)*35+200)*12/4) -> 5881 | U4: =1000*110/100*(1+(50+RC[-19]/10)/200)*100 -> 137665
B5: 4 | C5: 0 | D5: 400004 | E5: 1,7,792,0;1,4,1102,0; | G5: 1 | H5: 7 | I5: 792 | J5: 0 | L5: 1 | M5: 4 | N5: 1102 | O5: 0 | Q5: ="1,7,"&RC[2]&",0;"&"1,4,"&RC[4]&",0;" -> 1,7,5892,0;1,4,137720,0; | S5: =INT(((50+RC[-17]/10)*35+200)*12/4) -> 5892 | U5: =1000*110/100*(1+(50+RC[-19]/10)/200)*100 -> 137720
B6: 5 | C6: 0 | D6: 400005 | E6: 1,7,802,0;1,4,1102,0; | G6: 1 | H6: 7 | I6: 802 | J6: 0 | L6: 1 | M6: 4 | N6: 1102 | O6: 0 | Q6: ="1,7,"&RC[2]&",0;"&"1,4,"&RC[4]&",0;" -> 1,7,5902,0;1,4,137775,0; | S6: =INT(((50+RC[-17]/10)*35+200)*12/4) -> 5902 | U6: =1000*110/100*(1+(50+RC[-19]/10)/200)*100 -> 137775
B7: 6 | C7: 0 | D7: 400006 | E7: 1,7,813,0;1,4,1103,0; | G7: 1 | H7: 7 | I7: 813 | J7: 0 | L7: 1 | M7: 4 | N7: 1103 | O7: 0 | Q7: ="1,7,"&RC[2]&",0;"&"1,4,"&RC[4]&",0;" -> 1,7,5913,0;1,4,137830,0; | S7: =INT(((50+RC[-17]/10)*35+200)*12/4) -> 5913 | U7: =1000*110/100*(1+(50+RC[-19]/10)/200)*100 -> 137830.00000000003
B8: 7 | C8: 0 | D8: 400007 | E8: 1,7,823,0;1,4,1103,0; | G8: 1 | H8: 7 | I8: 823 | J8: 0 | L8: 1 | M8: 4 | N8: 1103 | O8: 0 | Q8: ="1,7,"&RC[2]&",0;"&"1,4,"&RC[4]&",0;" -> 1,7,5923,0;1,4,137885,0; | S8: =INT(((50+RC[-17]/10)*35+200)*12/4) -> 5923 | U8: =1000*110/100*(1+(50+RC[-19]/10)/200)*100 -> 137885
B9: 8 | C9: 0 | D9: 400008 | E9: 1,7,834,0;1,4,1104,0; | G9: 1 | H9: 7 | I9: 834 | J9: 0 | L9: 1 | M9: 4 | N9: 1104 | O9: 0 | Q9: ="1,7,"&RC[2]&",0;"&"1,4,"&RC[4]&",0;" -> 1,7,5934,0;1,4,137940,0; | S9: =INT(((50+RC[-17]/10)*35+200)*12/4) -> 5934 | U9: =1000*110/100*(1+(50+RC[-19]/10)/200)*100 -> 137940
B10: 9 | C10: 0 | D10: 400009 | E10: 1,7,844,0;1,4,1104,0; | G10: 1 | H10: 7 | I10: 844 | J10: 0 | L10: 1 | M10: 4 | N10: 1104 | O10: 0 | Q10: ="1,7,"&RC[2]&",0;"&"1,4,"&RC[4]&",0;" -> 1,7,5944,0;1,4,137995,0; | S10: =INT(((50+RC[-17]/10)*35+200)*12/4) -> 5944 | U10: =1000*110/100*(1+(50+RC[-19]/10)/200)*100 -> 137995
B11: 10 | C11: 0 | D11: 400010 | E11: 1,7,855,0;1,4,1105,0; | G11: 1 | H11: 7 | I11: 855 | J11: 0 | L11: 1 | M11: 4 | N11: 1105 | O11: 0 | Q11: ="1,7,"&RC[2]&",0;"&"1,4,"&RC[4]&",0;" -> 1,7,5955,0;1,4,138050,0; | S11: =INT(((50+RC[-17]/10)*35+200)*12/4) -> 5955 | U11: =1000*110/100*(1+(50+RC[-19]/10)/200)*100 -> 138049.99999999997
B12: 11 | C12: 0 | D12: 400011 | E12: 1,7,865,0;1,4,1106,0; | G12: 1 | H12: 7 | I12: 865 | J12: 0 | L12: 1 | M12: 4 | N12: 1106 | O12: 0 | Q12: ="1,7,"&RC[2]&",0;"&"1,4,"&RC[4]&",0;" -> 1,7,5965,0;1,4,138105,0; | S12: =INT(((50+RC[-17]/10)*35+200)*12/4) -> 5965 | U12: =1000*110/100*(1+(50+RC[-19]/10)/200)*100 -> 138105
B13: 12 | C13: 0 | D13: 400012 | E13: 1,7,876,0;1,4,1106,0; | G13: 1 | H13: 7 | I13: 876 | J13: 0 | L13: 1 | M13: 4 | N13: 1106 | O13: 0 | Q13: ="1,7,"&RC[2]&",0;"&"1,4,"&RC[4]&",0;" -> 1,7,5976,0;1,4,138160,0; | S13: =INT(((50+RC[-17]/10)*35+200)*12/4) -> 5976 | U13: =1000*110/100*(1+(50+RC[-19]/10)/200)*100 -> 138160
B14: 13 | C14: 0 | D14: 400013 | E14: 1,7,886,0;1,4,1107,0; | G14: 1 | H14: 7 | I14: 886 | J14: 0 | L14: 1 | M14: 4 | N14: 1107 | O14: 0 | Q14: ="1,7,"&RC[2]&",0;"&"1,4,"&RC[4]&",0;" -> 1,7,5986,0;1,4,138215,0; | S14: =INT(((50+RC[-17]/10)*35+200)*12/4) -> 5986 | U14: =1000*110/100*(1+(50+RC[-19]/10)/200)*100 -> 138215
B15: 14 | C15: 0 | D15: 400014 | E15: 1,7,897,0;1,4,1107,0; | G15: 1 | H15: 7 | I15: 897 | J15: 0 | L15: 1 | M15: 4 | N15: 1107 | O15: 0 | Q15: ="1,7,"&RC[2]&",0;"&"1,4,"&RC[4]&",0;" -> 1,7,5997,0;1,4,138270,0; | S15: =INT(((50+RC[-17]/10)*35+200)*12/4) -> 5997 | U15: =1000*110/100*(1+(50+RC[-19]/10)/200)*100 -> 138270
B16: 15 | C16: 0 | D16: 400015 | E16: 1,7,907,0;1,4,1108,0; | G16: 1 | H16: 7 | I16: 907 | J16: 0 | L16: 1 | M16: 4 | N16: 1108 | O16: 0 | Q16: ="1,7,"&RC[2]&",0;"&"1,4,"&RC[4]&",0;" -> 1,7,6007,0;1,4,138325,0; | S16: =INT(((50+RC[-17]/10)*35+200)*12/4) -> 6007 | U16: =1000*110/100*(1+(50+RC[-19]/10)/200)*100 -> 138325
B17: 16 | C17: 0 | D17: 400016 | E17: 1,7,918,0;1,4,1108,0; | G17: 1 | H17: 7 | I17: 918 | J17: 0 | L17: 1 | M17: 4 | N17: 1108 | O17: 0 | Q17: ="1,7,"&RC[2]&",0;"&"1,4,"&RC[4]&",0;" -> 1,7,6018,0;1,4,138380,0; | S17: =INT(((50+RC[-17]/10)*35+200)*12/4) -> 6018 | U17: =1000*110/100*(1+(50+RC[-19]/10)/200)*100 -> 138380
B18: 17 | C18: 0 | D18: 400017 | E18: 1,7,928,0;1,4,1109,0; | G18: 1 | H18: 7 | I18: 928 | J18: 0 | L18: 1 | M18: 4 | N18: 1109 | O18: 0 | Q18: ="1,7,"&RC[2]&",0;"&"1,4,"&RC[4]&",0;" -> 1,7,6028,0;1,4,138435,0; | S18: =INT(((50+RC[-17]/10)*35+200)*12/4) -> 6028 | U18: =1000*110/100*(1+(50+RC[-19]/10)/200)*100 -> 138435
B19: 18 | C19: 0 | D19: 400018 | E19: 1,7,939,0;1,4,1109,0; | G19: 1 | H19: 7 | I19: 939 | J19: 0 | L19: 1 | M19: 4 | N19: 1109 | O19: 0 | Q19: ="1,7,"&RC[2]&",0;"&"1,4,"&RC[4]&",0;" -> 1,7,6039,0;1,4,138490,0; | S19: =INT(((50+RC[-17]/10)*35+200)*12/4) -> 6039 | U19: =1000*110/100*(1+(50+RC[-19]/10)/200)*100 -> 138490
B20: 19 | C20: 0 | D20: 400019 | E20: 1,7,949,0;1,4,1110,0; | G20: 1 | H20: 7 | I20: 949 | J20: 0 | L20: 1 | M20: 4 | N20: 1110 | O20: 0 | Q20: ="1,7,"&RC[2]&",0;"&"1,4,"&RC[4]&",0;" -> 1,7,6049,0;1,4,138545,0; | S20: =INT(((50+RC[-17]/10)*35+200)*12/4) -> 6049 | U20: =1000*110/100*(1+(50+RC[-19]/10)/200)*100 -> 138545
B21: 20 | C21: 0 | D21: 400020 | E21: 1,7,960,0;1,4,1111,0; | G21: 1 | H21: 7 | I21: 960 | J21: 0 | L21: 1 | M21: 4 | N21: 1111 | O21: 0 | Q21: ="1,7,"&RC[2]&",0;"&"1,4,"&RC[4]&",0;" -> 1,7,6060,0;1,4,138600,0; | S21: =INT(((50+RC[-17]/10)*35+200)*12/4) -> 6060 | U21: =1000*110/100*(1+(50+RC[-19]/10)/200)*100 -> 138600
B22: 21 | C22: 0 | D22: 400021 | E22: 1,7,970,0;1,4,1111,0; | G22: 1 | H22: 7 | I22: 970 | J22: 0 | L22: 1 | M22: 4 | N22: 1111 | O22: 0 | Q22: ="1,7,"&RC[2]&",0;"&"1,4,"&RC[4]&",0;" -> 1,7,6070,0;1,4,138655,0; | S22: =INT(((50+RC[-17]/10)*35+200)*12/4) -> 6070 | U22: =1000*110/100*(1+(50+RC[-19]/10)/200)*100 -> 138655
B23: 22 | C23: 0 | D23: 400022 | E23: 1,7,981,0;1,4,1112,0; | G23: 1 | H23: 7 | I23: 981 | J23: 0 | L23: 1 | M23: 4 | N23: 1112 | O23: 0 | Q23: ="1,7,"&RC[2]&",0;"&"1,4,"&RC[4]&",0;" -> 1,7,6081,0;1,4,138710,0; | S23: =INT(((50+RC[-17]/10)*35+200)*12/4) -> 6081 | U23: =1000*110/100*(1+(50+RC[-19]/10)/200)*100 -> 138710
B24: 23 | C24: 0 | D24: 400023 | E24: 1,7,991,0;1,4,1112,0; | G24: 1 | H24: 7 | I24: 991 | J24: 0 | L24: 1 | M24: 4 | N24: 1112 | O24: 0 | Q24: ="1,7,"&RC[2]&",0;"&"1,4,"&RC[4]&",0;" -> 1,7,6091,0;1,4,138765,0; | S24: =INT(((50+RC[-17]/10)*35+200)*12/4) -> 6091 | U24: =1000*110/100*(1+(50+RC[-19]/10)/200)*100 -> 138765
B25: 24 | C25: 0 | D25: 400024 | E25: 1,7,1002,0;1,4,1113,0; | G25: 1 | H25: 7 | I25: 1002 | J25: 0 | L25: 1 | M25: 4 | N25: 1113 | O25: 0 | Q25: ="1,7,"&RC[2]&",0;"&"1,4,"&RC[4]&",0;" -> 1,7,6102,0;1,4,138820,0; | S25: =INT(((50+RC[-17]/10)*35+200)*12/4) -> 6102 | U25: =1000*110/100*(1+(50+RC[-19]/10)/200)*100 -> 138820
B26: 25 | C26: 0 | D26: 400025 | E26: 1,7,1012,0;1,4,1113,0; | G26: 1 | H26: 7 | I26: 1012 | J26: 0 | L26: 1 | M26: 4 | N26: 1113 | O26: 0 | Q26: ="1,7,"&RC[2]&",0;"&"1,4,"&RC[4]&",0;" -> 1,7,6112,0;1,4,138875,0; | S26: =INT(((50+RC[-17]/10)*35+200)*12/4) -> 6112 | U26: =1000*110/100*(1+(50+RC[-19]/10)/200)*100 -> 138875
B27: 26 | C27: 0 | D27: 400026 | E27: 1,7,1023,0;1,4,1114,0; | G27: 1 | H27: 7 | I27: 1023 | J27: 0 | L27: 1 | M27: 4 | N27: 1114 | O27: 0 | Q27: ="1,7,"&RC[2]&",0;"&"1,4,"&RC[4]&",0;" -> 1,7,6123,0;1,4,138930,0; | S27: =INT(((50+RC[-17]/10)*35+200)*12/4) -> 6123 | U27: =1000*110/100*(1+(50+RC[-19]/10)/200)*100 -> 138930
B28: 27 | C28: 0 | D28: 400027 | E28: 1,7,1033,0;1,4,1114,0; | G28: 1 | H28: 7 | I28: 1033 | J28: 0 | L28: 1 | M28: 4 | N28: 1114 | O28: 0 | Q28: ="1,7,"&RC[2]&",0;"&"1,4,"&RC[4]&",0;" -> 1,7,6133,0;1,4,138985,0; | S28: =INT(((50+RC[-17]/10)*35+200)*12/4) -> 6133 | U28: =1000*110/100*(1+(50+RC[-19]/10)/200)*100 -> 138985
B29: 28 | C29: 0 | D29: 400028 | E29: 1,7,1044,0;1,4,1115,0; | G29: 1 | H29: 7 | I29: 1044 | J29: 0 | L29: 1 | M29: 4 | N29: 1115 | O29: 0 | Q29: ="1,7,"&RC[2]&",0;"&"1,4,"&RC[4]&",0;" -> 1,7,6144,0;1,4,139040,0; | S29: =INT(((50+RC[-17]/10)*35+200)*12/4) -> 6144 | U29: =1000*110/100*(1+(50+RC[-19]/10)/200)*100 -> 139040
B30: 29 | C30: 0 | D30: 400029 | E30: 1,7,1054,0;1,4,1115,0; | G30: 1 | H30: 7 | I30: 1054 | J30: 0 | L30: 1 | M30: 4 | N30: 1115 | O30: 0 | Q30: ="1,7,"&RC[2]&",0;"&"1,4,"&RC[4]&",0;" -> 1,7,6154,0;1,4,139095,0; | S30: =INT(((50+RC[-17]/10)*35+200)*12/4) -> 6154 | U30: =1000*110/100*(1+(50+RC[-19]/10)/200)*100 -> 139095
B31: 30 | C31: 0 | D31: 400030 | E31: 1,7,1065,0;1,4,1116,0; | G31: 1 | H31: 7 | I31: 1065 | J31: 0 | L31: 1 | M31: 4 | N31: 1116 | O31: 0 | Q31: ="1,7,"&RC[2]&",0;"&"1,4,"&RC[4]&",0;" -> 1,7,6165,0;1,4,139150,0; | S31: =INT(((50+RC[-17]/10)*35+200)*12/4) -> 6165 | U31: =1000*110/100*(1+(50+RC[-19]/10)/200)*100 -> 139150.00000000003
B32: 31 | C32: 0 | D32: 400031 | E32: 1,7,1075,0;1,4,1117,0; | G32: 1 | H32: 7 | I32: 1075 | J32: 0 | L32: 1 | M32: 4 | N32: 1117 | O32: 0 | Q32: ="1,7,"&RC[2]&",0;"&"1,4,"&RC[4]&",0;" -> 1,7,6175,0;1,4,139205,0; | S32: =INT(((50+RC[-17]/10)*35+200)*12/4) -> 6175 | U32: =1000*110/100*(1+(50+RC[-19]/10)/200)*100 -> 139205.00000000003
B33: 32 | C33: 0 | D33: 400032 | E33: 1,7,1086,0;1,4,1117,0; | G33: 1 | H33: 7 | I33: 1086 | J33: 0 | L33: 1 | M33: 4 | N33: 1117 | O33: 0 | Q33: ="1,7,"&RC[2]&",0;"&"1,4,"&RC[4]&",0;" -> 1,7,6186,0;1,4,139260,0; | S33: =INT(((50+RC[-17]/10)*35+200)*12/4) -> 6186 | U33: =1000*110/100*(1+(50+RC[-19]/10)/200)*100 -> 139260
B34: 33 | C34: 0 | D34: 400033 | E34: 1,7,1096,0;1,4,1118,0; | G34: 1 | H34: 7 | I34: 1096 | J34: 0 | L34: 1 | M34: 4 | N34: 1118 | O34: 0 | Q34: ="1,7,"&RC[2]&",0;"&"1,4,"&RC[4]&",0;" -> 1,7,6196,0;1,4,139315,0; | S34: =INT(((50+RC[-17]/10)*35+200)*12/4) -> 6196 | U34: =1000*110/100*(1+(50+RC[-19]/10)/200)*100 -> 139315
B35: 34 | C35: 0 | D35: 400034 | E35: 1,7,1107,0;1,4,1118,0; | G35: 1 | H35: 7 | I35: 1107 | J35: 0 | L35: 1 | M35: 4 | N35: 1118 | O35: 0 | Q35: ="1,7,"&RC[2]&",0;"&"1,4,"&RC[4]&",0;" -> 1,7,6207,0;1,4,139370,0; | S35: =INT(((50+RC[-17]/10)*35+200)*12/4) -> 6207 | U35: =1000*110/100*(1+(50+RC[-19]/10)/200)*100 -> 139369.99999999997
B36: 35 | C36: 0 | D36: 400035 | E36: 1,7,1117,0;1,4,1119,0; | G36: 1 | H36: 7 | I36: 1117 | J36: 0 | L36: 1 | M36: 4 | N36: 1119 | O36: 0 | Q36: ="1,7,"&RC[2]&",0;"&"1,4,"&RC[4]&",0;" -> 1,7,6217,0;1,4,139425,0; | S36: =INT(((50+RC[-17]/10)*35+200)*12/4) -> 6217 | U36: =1000*110/100*(1+(50+RC[-19]/10)/200)*100 -> 139425
B37: 36 | C37: 0 | D37: 400036 | E37: 1,7,1128,0;1,4,1119,0; | G37: 1 | H37: 7 | I37: 1128 | J37: 0 | L37: 1 | M37: 4 | N37: 1119 | O37: 0 | Q37: ="1,7,"&RC[2]&",0;"&"1,4,"&RC[4]&",0;" -> 1,7,6228,0;1,4,139480,0; | S37: =INT(((50+RC[-17]/10)*35+200)*12/4) -> 6228 | U37: =1000*110/100*(1+(50+RC[-19]/10)/200)*100 -> 139480
B38: 37 | C38: 0 | D38: 400037 | E38: 1,7,1138,0;1,4,1120,0; | G38: 1 | H38: 7 | I38: 1138 | J38: 0 | L38: 1 | M38: 4 | N38: 1120 | O38: 0 | Q38: ="1,7,"&RC[2]&",0;"&"1,4,"&RC[4]&",0;" -> 1,7,6238,0;1,4,139535,0; | S38: =INT(((50+RC[-17]/10)*35+200)*12/4) -> 6238 | U38: =1000*110/100*(1+(50+RC[-19]/10)/200)*100 -> 139535
B39: 38 | C39: 0 | D39: 400038 | E39: 1,7,1149,0;1,4,1120,0; | G39: 1 | H39: 7 | I39: 1149 | J39: 0 | L39: 1 | M39: 4 | N39: 1120 | O39: 0 | Q39: ="1,7,"&RC[2]&",0;"&"1,4,"&RC[4]&",0;" -> 1,7,6249,0;1,4,139590,0; | S39: =INT(((50+RC[-17]/10)*35+200)*12/4) -> 6249 | U39: =1000*110/100*(1+(50+RC[-19]/10)/200)*100 -> 139590
B40: 39 | C40: 0 | D40: 400039 | E40: 1,7,1159,0;1,4,1121,0; | G40: 1 | H40: 7 | I40: 1159 | J40: 0 | L40: 1 | M40: 4 | N40: 1121 | O40: 0 | Q40: ="1,7,"&RC[2]&",0;"&"1,4,"&RC[4]&",0;" -> 1,7,6259,0;1,4,139645,0; | S40: =INT(((50+RC[-17]/10)*35+200)*12/4) -> 6259 | U40: =1000*110/100*(1+(50+RC[-19]/10)/200)*100 -> 139645
B41: 40 | C41: 0 | D41: 400040 | E41: 1,7,1170,0;1,4,1122,0; | G41: 1 | H41: 7 | I41: 1170 | J41: 0 | L41: 1 | M41: 4 | N41: 1122 | O41: 0 | Q41: ="1,7,"&RC[2]&",0;"&"1,4,"&RC[4]&",0;" -> 1,7,6270,0;1,4,139700,0; | S41: =INT(((50+RC[-17]/10)*35+200)*12/4) -> 6270 | U41: =1000*110/100*(1+(50+RC[-19]/10)/200)*100 -> 139700
B42: 41 | C42: 0 | D42: 400041 | E42: 1,7,1180,0;1,4,1122,0; | G42: 1 | H42: 7 | I42: 1180 | J42: 0 | L42: 1 | M42: 4 | N42: 1122 | O42: 0 | Q42: ="1,7,"&RC[2]&",0;"&"1,4,"&RC[4]&",0;" -> 1,7,6280,0;1,4,139755,0; | S42: =INT(((50+RC[-17]/10)*35+200)*12/4) -> 6280 | U42: =1000*110/100*(1+(50+RC[-19]/10)/200)*100 -> 139755
B43: 42 | C43: 0 | D43: 400042 | E43: 1,7,1191,0;1,4,1123,0; | G43: 1 | H43: 7 | I43: 1191 | J43: 0 | L43: 1 | M43: 4 | N43: 1123 | O43: 0 | Q43: ="1,7,"&RC[2]&",0;"&"1,4,"&RC[4]&",0;" -> 1,7,6291,0;1,4,139810,0; | S43: =INT(((50+RC[-17]/10)*35+200)*12/4) -> 6291 | U43: =1000*110/100*(1+(50+RC[-19]/10)/200)*100 -> 139810
B44: 43 | C44: 0 | D44: 400043 | E44: 1,7,1201,0;1,4,1123,0; | G44: 1 | H44: 7 | I44: 1201 | J44: 0 | L44: 1 | M44: 4 | N44: 1123 | O44: 0 | Q44: ="1,7,"&RC[2]&",0;"&"1,4,"&RC[4]&",0;" -> 1,7,6301,0;1,4,139865,0; | S44: =INT(((50+RC[-17]/10)*35+200)*12/4) -> 6301 | U44: =1000*110/100*(1+(50+RC[-19]/10)/200)*100 -> 139865
B45: 44 | C45: 0 | D45: 400044 | E45: 1,7,1212,0;1,4,1124,0; | G45: 1 | H45: 7 | I45: 1212 | J45: 0 | L45: 1 | M45: 4 | N45: 1124 | O45: 0 | Q45: ="1,7,"&RC[2]&",0;"&"1,4,"&RC[4]&",0;" -> 1,7,6312,0;1,4,139920,0; | S45: =INT(((50+RC[-17]/10)*35+200)*12/4) -> 6312 | U45: =1000*110/100*(1+(50+RC[-19]/10)/200)*100 -> 139920
B46: 45 | C46: 0 | D46: 400045 | E46: 1,7,1222,0;1,4,1124,0; | G46: 1 | H46: 7 | I46: 1222 | J46: 0 | L46: 1 | M46: 4 | N46: 1124 | O46: 0 | Q46: ="1,7,"&RC[2]&",0;"&"1,4,"&RC[4]&",0;" -> 1,7,6322,0;1,4,139975,0; | S46: =INT(((50+RC[-17]/10)*35+200)*12/4) -> 6322 | U46: =1000*110/100*(1+(50+RC[-19]/10)/200)*100 -> 139975
B47: 46 | C47: 0 | D47: 400046 | E47: 1,7,1233,0;1,4,1125,0; | G47: 1 | H47: 7 | I47: 1233 | J47: 0 | L47: 1 | M47: 4 | N47: 1125 | O47: 0 | Q47: ="1,7,"&RC[2]&",0;"&"1,4,"&RC[4]&",0;" -> 1,7,6333,0;1,4,140030,0; | S47: =INT(((50+RC[-17]/10)*35+200)*12/4) -> 6333 | U47: =1000*110/100*(1+(50+RC[-19]/10)/200)*100 -> 140030.00000000003
B48: 47 | C48: 0 | D48: 400047 | E48: 1,7,1243,0;1,4,1125,0; | G48: 1 | H48: 7 | I48: 1243 | J48: 0 | L48: 1 | M48: 4 | N48: 1125 | O48: 0 | Q48: ="1,7,"&RC[2]&",0;"&"1,4,"&RC[4]&",0;" -> 1,7,6343,0;1,4,140085,0; | S48: =INT(((50+RC[-17]/10)*35+200)*12/4) -> 6343 | U48: =1000*110/100*(1+(50+RC[-19]/10)/200)*100 -> 140085
B49: 48 | C49: 0 | D49: 400048 | E49: 1,7,1254,0;1,4,1126,0; | G49: 1 | H49: 7 | I49: 1254 | J49: 0 | L49: 1 | M49: 4 | N49: 1126 | O49: 0 | Q49: ="1,7,"&RC[2]&",0;"&"1,4,"&RC[4]&",0;" -> 1,7,6354,0;1,4,140140,0; | S49: =INT(((50+RC[-17]/10)*35+200)*12/4) -> 6354 | U49: =1000*110/100*(1+(50+RC[-19]/10)/200)*100 -> 140140
B50: 49 | C50: 0 | D50: 400049 | E50: 1,7,1264,0;1,4,1126,0; | G50: 1 | H50: 7 | I50: 1264 | J50: 0 | L50: 1 | M50: 4 | N50: 1126 | O50: 0 | Q50: ="1,7,"&RC[2]&",0;"&"1,4,"&RC[4]&",0;" -> 1,7,6364,0;1,4,140195,0; | S50: =INT(((50+RC[-17]/10)*35+200)*12/4) -> 6364 | U50: =1000*110/100*(1+(50+RC[-19]/10)/200)*100 -> 140195
B51: 50 | C51: 0 | D51: 400050 | E51: 1,7,1275,0;1,4,1127,0; | G51: 1 | H51: 7 | I51: 1275 | J51: 0 | L51: 1 | M51: 4 | N51: 1127 | O51: 0 | Q51: ="1,7,"&RC[2]&",0;"&"1,4,"&RC[4]&",0;" -> 1,7,6375,0;1,4,140250,0; | S51: =INT(((50+RC[-17]/10)*35+200)*12/4) -> 6375 | U51: =1000*110/100*(1+(50+RC[-19]/10)/200)*100 -> 140250
B52: 51 | C52: 0 | D52: 400051 | E52: 1,7,1285,0;1,4,1128,0; | G52: 1 | H52: 7 | I52: 1285 | J52: 0 | L52: 1 | M52: 4 | N52: 1128 | O52: 0 | Q52: ="1,7,"&RC[2]&",0;"&"1,4,"&RC[4]&",0;" -> 1,7,6385,0;1,4,140305,0; | S52: =INT(((50+RC[-17]/10)*35+200)*12/4) -> 6385 | U52: =1000*110/100*(1+(50+RC[-19]/10)/200)*100 -> 140305.00000000003
B53: 52 | C53: 0 | D53: 400052 | E53: 1,7,1296,0;1,4,1128,0; | G53: 1 | H53: 7 | I53: 1296 | J53: 0 | L53: 1 | M53: 4 | N53: 1128 | O53: 0 | Q53: ="1,7,"&RC[2]&",0;"&"1,4,"&RC[4]&",0;" -> 1,7,6396,0;1,4,140360,0; | S53: =INT(((50+RC[-17]/10)*35+200)*12/4) -> 6396 | U53: =1000*110/100*(1+(50+RC[-19]/10)/200)*100 -> 140360
B54: 53 | C54: 0 | D54: 400053 | E54: 1,7,1306,0;1,4,1129,0; | G54: 1 | H54: 7 | I54: 1306 | J54: 0 | L54: 1 | M54: 4 | N54: 1129 | O54: 0 | Q54: ="1,7,"&RC[2]&",0;"&"1,4,"&RC[4]&",0;" -> 1,7,6406,0;1,4,140415,0; | S54: =INT(((50+RC[-17]/10)*35+200)*12/4) -> 6406 | U54: =1000*110/100*(1+(50+RC[-19]/10)/200)*100 -> 140415
B55: 54 | C55: 0 | D55: 400054 | E55: 1,7,1317,0;1,4,1129,0; | G55: 1 | H55: 7 | I55: 1317 | J55: 0 | L55: 1 | M55: 4 | N55: 1129 | O55: 0 | Q55: ="1,7,"&RC[2]&",0;"&"1,4,"&RC[4]&",0;" -> 1,7,6417,0;1,4,140470,0; | S55: =INT(((50+RC[-17]/10)*35+200)*12/4) -> 6417 | U55: =1000*110/100*(1+(50+RC[-19]/10)/200)*100 -> 140469.99999999997
B56: 55 | C56: 0 | D56: 400055 | E56: 1,7,1327,0;1,4,1130,0; | G56: 1 | H56: 7 | I56: 1327 | J56: 0 | L56: 1 | M56: 4 | N56: 1130 | O56: 0 | Q56: ="1,7,"&RC[2]&",0;"&"1,4,"&RC[4]&",0;" -> 1,7,6427,0;1,4,140525,0; | S56: =INT(((50+RC[-17]/10)*35+200)*12/4) -> 6427 | U56: =1000*110/100*(1+(50+RC[-19]/10)/200)*100 -> 140525
B57: 56 | C57: 0 | D57: 400056 | E57: 1,7,1338,0;1,4,1130,0; | G57: 1 | H57: 7 | I57: 1338 | J57: 0 | L57: 1 | M57: 4 | N57: 1130 | O57: 0 | Q57: ="1,7,"&RC[2]&",0;"&"1,4,"&RC[4]&",0;" -> 1,7,6438,0;1,4,140580,0; | S57: =INT(((50+RC[-17]/10)*35+200)*12/4) -> 6438 | U57: =1000*110/100*(1+(50+RC[-19]/10)/200)*100 -> 140580
B58: 57 | C58: 0 | D58: 400057 | E58: 1,7,1348,0;1,4,1131,0; | G58: 1 | H58: 7 | I58: 1348 | J58: 0 | L58: 1 | M58: 4 | N58: 1131 | O58: 0 | Q58: ="1,7,"&RC[2]&",0;"&"1,4,"&RC[4]&",0;" -> 1,7,6448,0;1,4,140635,0; | S58: =INT(((50+RC[-17]/10)*35+200)*12/4) -> 6448 | U58: =1000*110/100*(1+(50+RC[-19]/10)/200)*100 -> 140635
B59: 58 | C59: 0 | D59: 400058 | E59: 1,7,1359,0;1,4,1131,0; | G59: 1 | H59: 7 | I59: 1359 | J59: 0 | L59: 1 | M59: 4 | N59: 1131 | O59: 0 | Q59: ="1,7,"&RC[2]&",0;"&"1,4,"&RC[4]&",0;" -> 1,7,6459,0;1,4,140690,0; | S59: =INT(((50+RC[-17]/10)*35+200)*12/4) -> 6459 | U59: =1000*110/100*(1+(50+RC[-19]/10)/200)*100 -> 140690
B60: 59 | C60: 0 | D60: 400059 | E60: 1,7,1369,0;1,4,1132,0; | G60: 1 | H60: 7 | I60: 1369 | J60: 0 | L60: 1 | M60: 4 | N60: 1132 | O60: 0 | Q60: ="1,7,"&RC[2]&",0;"&"1,4,"&RC[4]&",0;" -> 1,7,6469,0;1,4,140745,0; | S60: =INT(((50+RC[-17]/10)*35+200)*12/4) -> 6469 | U60: =1000*110/100*(1+(50+RC[-19]/10)/200)*100 -> 140745
B61: 60 | C61: 0 | D61: 400060 | E61: 1,7,1380,0;1,4,1133,0; | G61: 1 | H61: 7 | I61: 1380 | J61: 0 | L61: 1 | M61: 4 | N61: 1133 | O61: 0 | Q61: ="1,7,"&RC[2]&",0;"&"1,4,"&RC[4]&",0;" -> 1,7,6480,0;1,4,140800,0; | S61: =INT(((50+RC[-17]/10)*35+200)*12/4) -> 6480 | U61: =1000*110/100*(1+(50+RC[-19]/10)/200)*100 -> 140800
B62: 61 | C62: 0 | D62: 400061 | E62: 1,7,1390,0;1,4,1133,0; | G62: 1 | H62: 7 | I62: 1390 | J62: 0 | L62: 1 | M62: 4 | N62: 1133 | O62: 0 | Q62: ="1,7,"&RC[2]&",0;"&"1,4,"&RC[4]&",0;" -> 1,7,6490,0;1,4,140855,0; | S62: =INT(((50+RC[-17]/10)*35+200)*12/4) -> 6490 | U62: =1000*110/100*(1+(50+RC[-19]/10)/200)*100 -> 140855
B63: 62 | C63: 0 | D63: 400062 | E63: 1,7,1401,0;1,4,1134,0; | G63: 1 | H63: 7 | I63: 1401 | J63: 0 | L63: 1 | M63: 4 | N63: 1134 | O63: 0 | Q63: ="1,7,"&RC[2]&",0;"&"1,4,"&RC[4]&",0;" -> 1,7,6501,0;1,4,140910,0; | S63: =INT(((50+RC[-17]/10)*35+200)*12/4) -> 6501 | U63: =1000*110/100*(1+(50+RC[-19]/10)/200)*100 -> 140910
B64: 63 | C64: 0 | D64: 400063 | E64: 1,7,1411,0;1,4,1134,0; | G64: 1 | H64: 7 | I64: 1411 | J64: 0 | L64: 1 | M64: 4 | N64: 1134 | O64: 0 | Q64: ="1,7,"&RC[2]&",0;"&"1,4,"&RC[4]&",0;" -> 1,7,6511,0;1,4,140965,0; | S64: =INT(((50+RC[-17]/10)*35+200)*12/4) -> 6511 | U64: =1000*110/100*(1+(50+RC[-19]/10)/200)*100 -> 140965
B65: 64 | C65: 0 | D65: 400064 | E65: 1,7,1422,0;1,4,1135,0; | G65: 1 | H65: 7 | I65: 1422 | J65: 0 | L65: 1 | M65: 4 | N65: 1135 | O65: 0 | Q65: ="1,7,"&RC[2]&",0;"&"1,4,"&RC[4]&",0;" -> 1,7,6522,0;1,4,141020,0; | S65: =INT(((50+RC[-17]/10)*35+200)*12/4) -> 6522 | U65: =1000*110/100*(1+(50+RC[-19]/10)/200)*100 -> 141020
B66: 65 | C66: 0 | D66: 400065 | E66: 1,7,1432,0;1,4,1135,0; | G66: 1 | H66: 7 | I66: 1432 | J66: 0 | L66: 1 | M66: 4 | N66: 1135 | O66: 0 | Q66: ="1,7,"&RC[2]&",0;"&"1,4,"&RC[4]&",0;" -> 1,7,6532,0;1,4,141075,0; | S66: =INT(((50+RC[-17]/10)*35+200)*12/4) -> 6532 | U66: =1000*110/100*(1+(50+RC[-19]/10)/200)*100 -> 141075
B67: 66 | C67: 0 | D67: 400066 | E67: 1,7,1443,0;1,4,1136,0; | G67: 1 | H67: 7 | I67: 1443 | J67: 0 | L67: 1 | M67: 4 | N67: 1136 | O67: 0 | Q67: ="1,7,"&RC[2]&",0;"&"1,4,"&RC[4]&",0;" -> 1,7,6543,0;1,4,141130,0; | S67: =INT(((50+RC[-17]/10)*35+200)*12/4) -> 6543 | U67: =1000*110/100*(1+(50+RC[-19]/10)/200)*100 -> 141130
B68: 67 | C68: 0 | D68: 400067 | E68: 1,7,1453,0;1,4,1136,0; | G68: 1 | H68: 7 | I68: 1453 | J68: 0 | L68: 1 | M68: 4 | N68: 1136 | O68: 0 | Q68: ="1,7,"&RC[2]&",0;"&"1,4,"&RC[4]&",0;" -> 1,7,6553,0;1,4,141185,0; | S68: =INT(((50+RC[-17]/10)*35+200)*12/4) -> 6553 | U68: =1000*110/100*(1+(50+RC[-19]/10)/200)*100 -> 141185
B69: 68 | C69: 0 | D69: 400068 | E69: 1,7,1464,0;1,4,1137,0; | G69: 1 | H69: 7 | I69: 1464 | J69: 0 | L69: 1 | M69: 4 | N69: 1137 | O69: 0 | Q69: ="1,7,"&RC[2]&",0;"&"1,4,"&RC[4]&",0;" -> 1,7,6564,0;1,4,141240,0; | S69: =INT(((50+RC[-17]/10)*35+200)*12/4) -> 6564 | U69: =1000*110/100*(1+(50+RC[-19]/10)/200)*100 -> 141240
B70: 69 | C70: 0 | D70: 400069 | E70: 1,7,1474,0;1,4,1137,0; | G70: 1 | H70: 7 | I70: 1474 | J70: 0 | L70: 1 | M70: 4 | N70: 1137 | O70: 0 | Q70: ="1,7,"&RC[2]&",0;"&"1,4,"&RC[4]&",0;" -> 1,7,6574,0;1,4,141295,0; | S70: =INT(((50+RC[-17]/10)*35+200)*12/4) -> 6574 | U70: =1000*110/100*(1+(50+RC[-19]/10)/200)*100 -> 141295
B71: 70 | C71: 0 | D71: 400070 | E71: 1,7,1485,0;1,4,1138,0; | G71: 1 | H71: 7 | I71: 1485 | J71: 0 | L71: 1 | M71: 4 | N71: 1138 | O71: 0 | Q71: ="1,7,"&RC[2]&",0;"&"1,4,"&RC[4]&",0;" -> 1,7,6585,0;1,4,141350,0; | S71: =INT(((50+RC[-17]/10)*35+200)*12/4) -> 6585 | U71: =1000*110/100*(1+(50+RC[-19]/10)/200)*100 -> 141350
B72: 71 | C72: 0 | D72: 400071 | E72: 1,7,1495,0;1,4,1139,0; | G72: 1 | H72: 7 | I72: 1495 | J72: 0 | L72: 1 | M72: 4 | N72: 1139 | O72: 0 | Q72: ="1,7,"&RC[2]&",0;"&"1,4,"&RC[4]&",0;" -> 1,7,6595,0;1,4,141405,0; | S72: =INT(((50+RC[-17]/10)*35+200)*12/4) -> 6595 | U72: =1000*110/100*(1+(50+RC[-19]/10)/200)*100 -> 141405.00000000003
B73: 72 | C73: 0 | D73: 400072 | E73: 1,7,1506,0;1,4,1139,0; | G73: 1 | H73: 7 | I73: 1506 | J73: 0 | L73: 1 | M73: 4 | N73: 1139 | O73: 0 | Q73: ="1,7,"&RC[2]&",0;"&"1,4,"&RC[4]&",0;" -> 1,7,6606,0;1,4,141460,0; | S73: =INT(((50+RC[-17]/10)*35+200)*12/4) -> 6606 | U73: =1000*110/100*(1+(50+RC[-19]/10)/200)*100 -> 141460
B74: 73 | C74: 0 | D74: 400073 | E74: 1,7,1516,0;1,4,1140,0; | G74: 1 | H74: 7 | I74: 1516 | J74: 0 | L74: 1 | M74: 4 | N74: 1140 | O74: 0 | Q74: ="1,7,"&RC[2]&",0;"&"1,4,"&RC[4]&",0;" -> 1,7,6616,0;1,4,141515,0; | S74: =INT(((50+RC[-17]/10)*35+200)*12/4) -> 6616 | U74: =1000*110/100*(1+(50+RC[-19]/10)/200)*100 -> 141515
B75: 74 | C75: 0 | D75: 400074 | E75: 1,7,1527,0;1,4,1140,0; | G75: 1 | H75: 7 | I75: 1527 | J75: 0 | L75: 1 | M75: 4 | N75: 1140 | O75: 0 | Q75: ="1,7,"&RC[2]&",0;"&"1,4,"&RC[4]&",0;" -> 1,7,6627,0;1,4,141570,0; | S75: =INT(((50+RC[-17]/10)*35+200)*12/4) -> 6627 | U75: =1000*110/100*(1+(50+RC[-19]/10)/200)*100 -> 141569.99999999997
B76: 75 | C76: 0 | D76: 400075 | E76: 1,7,1537,0;1,4,1141,0; | G76: 1 | H76: 7 | I76: 1537 | J76: 0 | L76: 1 | M76: 4 | N76: 1141 | O76: 0 | Q76: ="1,7,"&RC[2]&",0;"&"1,4,"&RC[4]&",0;" -> 1,7,6637,0;1,4,141625,0; | S76: =INT(((50+RC[-17]/10)*35+200)*12/4) -> 6637 | U76: =1000*110/100*(1+(50+RC[-19]/10)/200)*100 -> 141625
B77: 76 | C77: 0 | D77: 400076 | E77: 1,7,1548,0;1,4,1141,0; | G77: 1 | H77: 7 | I77: 1548 | J77: 0 | L77: 1 | M77: 4 | N77: 1141 | O77: 0 | Q77: ="1,7,"&RC[2]&",0;"&"1,4,"&RC[4]&",0;" -> 1,7,6648,0;1,4,141680,0; | S77: =INT(((50+RC[-17]/10)*35+200)*12/4) -> 6648 | U77: =1000*110/100*(1+(50+RC[-19]/10)/200)*100 -> 141680
B78: 77 | C78: 0 | D78: 400077 | E78: 1,7,1558,0;1,4,1142,0; | G78: 1 | H78: 7 | I78: 1558 | J78: 0 | L78: 1 | M78: 4 | N78: 1142 | O78: 0 | Q78: ="1,7,"&RC[2]&",0;"&"1,4,"&RC[4]&",0;" -> 1,7,6658,0;1,4,141735,0; | S78: =INT(((50+RC[-17]/10)*35+200)*12/4) -> 6658 | U78: =1000*110/100*(1+(50+RC[-19]/10)/200)*100 -> 141735
B79: 78 | C79: 0 | D79: 400078 | E79: 1,7,1569,0;1,4,1142,0; | G79: 1 | H79: 7 | I79: 1569 | J79: 0 | L79: 1 | M79: 4 | N79: 1142 | O79: 0 | Q79: ="1,7,"&RC[2]&",0;"&"1,4,"&RC[4]&",0;" -> 1,7,6669,0;1,4,141790,0; | S79: =INT(((50+RC[-17]/10)*35+200)*12/4) -> 6669 | U79: =1000*110/100*(1+(50+RC[-19]/10)/200)*100 -> 141790
B80: 79 | C80: 0 | D80: 400079 | E80: 1,7,1579,0;1,4,1143,0; | G80: 1 | H80: 7 | I80: 1579 | J80: 0 | L80: 1 | M80: 4 | N80: 1143 | O80: 0 | Q80: ="1,7,"&RC[2]&",0;"&"1,4,"&RC[4]&",0;" -> 1,7,6679,0;1,4,141845,0; | S80: =INT(((50+RC[-17]/10)*35+200)*12/4) -> 6679 | U80: =1000*110/100*(1+(50+RC[-19]/10)/200)*100 -> 141844.99999999997
B81: 80 | C81: 0 | D81: 400080 | E81: 1,7,1590,0;1,4,1144,0; | G81: 1 | H81: 7 | I81: 1590 | J81: 0 | L81: 1 | M81: 4 | N81: 1144 | O81: 0 | Q81: ="1,7,"&RC[2]&",0;"&"1,4,"&RC[4]&",0;" -> 1,7,6690,0;1,4,141900,0; | S81: =INT(((50+RC[-17]/10)*35+200)*12/4) -> 6690 | U81: =1000*110/100*(1+(50+RC[-19]/10)/200)*100 -> 141900
B82: 81 | C82: 0 | D82: 400081 | E82: 1,7,1600,0;1,4,1144,0; | G82: 1 | H82: 7 | I82: 1600 | J82: 0 | L82: 1 | M82: 4 | N82: 1144 | O82: 0 | Q82: ="1,7,"&RC[2]&",0;"&"1,4,"&RC[4]&",0;" -> 1,7,6700,0;1,4,141955,0; | S82: =INT(((50+RC[-17]/10)*35+200)*12/4) -> 6700 | U82: =1000*110/100*(1+(50+RC[-19]/10)/200)*100 -> 141955
B83: 82 | C83: 0 | D83: 400082 | E83: 1,7,1611,0;1,4,1145,0; | G83: 1 | H83: 7 | I83: 1611 | J83: 0 | L83: 1 | M83: 4 | N83: 1145 | O83: 0 | Q83: ="1,7,"&RC[2]&",0;"&"1,4,"&RC[4]&",0;" -> 1,7,6711,0;1,4,142010,0; | S83: =INT(((50+RC[-17]/10)*35+200)*12/4) -> 6711 | U83: =1000*110/100*(1+(50+RC[-19]/10)/200)*100 -> 142010
B84: 83 | C84: 0 | D84: 400083 | E84: 1,7,1621,0;1,4,1145,0; | G84: 1 | H84: 7 | I84: 1621 | J84: 0 | L84: 1 | M84: 4 | N84: 1145 | O84: 0 | Q84: ="1,7,"&RC[2]&",0;"&"1,4,"&RC[4]&",0;" -> 1,7,6721,0;1,4,142065,0; | S84: =INT(((50+RC[-17]/10)*35+200)*12/4) -> 6721 | U84: =1000*110/100*(1+(50+RC[-19]/10)/200)*100 -> 142065
B85: 84 | C85: 0 | D85: 400084 | E85: 1,7,1632,0;1,4,1146,0; | G85: 1 | H85: 7 | I85: 1632 | J85: 0 | L85: 1 | M85: 4 | N85: 1146 | O85: 0 | Q85: ="1,7,"&RC[2]&",0;"&"1,4,"&RC[4]&",0;" -> 1,7,6732,0;1,4,142120,0; | S85: =INT(((50+RC[-17]/10)*35+200)*12/4) -> 6732 | U85: =1000*110/100*(1+(50+RC[-19]/10)/200)*100 -> 142120
B86: 85 | C86: 0 | D86: 400085 | E86: 1,7,1642,0;1,4,1146,0; | G86: 1 | H86: 7 | I86: 1642 | J86: 0 | L86: 1 | M86: 4 | N86: 1146 | O86: 0 | Q86: ="1,7,"&RC[2]&",0;"&"1,4,"&RC[4]&",0;" -> 1,7,6742,0;1,4,142175,0; | S86: =INT(((50+RC[-17]/10)*35+200)*12/4) -> 6742 | U86: =1000*110/100*(1+(50+RC[-19]/10)/200)*100 -> 142175
B87: 86 | C87: 0 | D87: 400086 | E87: 1,7,1653,0;1,4,1147,0; | G87: 1 | H87: 7 | I87: 1653 | J87: 0 | L87: 1 | M87: 4 | N87: 1147 | O87: 0 | Q87: ="1,7,"&RC[2]&",0;"&"1,4,"&RC[4]&",0;" -> 1,7,6753,0;1,4,142230,0; | S87: =INT(((50+RC[-17]/10)*35+200)*12/4) -> 6753 | U87: =1000*110/100*(1+(50+RC[-19]/10)/200)*100 -> 142230
B88: 87 | C88: 0 | D88: 400087 | E88: 1,7,1663,0;1,4,1147,0; | G88: 1 | H88: 7 | I88: 1663 | J88: 0 | L88: 1 | M88: 4 | N88: 1147 | O88: 0 | Q88: ="1,7,"&RC[2]&",0;"&"1,4,"&RC[4]&",0;" -> 1,7,6763,0;1,4,142285,0; | S88: =INT(((50+RC[-17]/10)*35+200)*12/4) -> 6763 | U88: =1000*110/100*(1+(50+RC[-19]/10)/200)*100 -> 142285
B89: 88 | C89: 0 | D89: 400088 | E89: 1,7,1674,0;1,4,1148,0; | G89: 1 | H89: 7 | I89: 1674 | J89: 0 | L89: 1 | M89: 4 | N89: 1148 | O89: 0 | Q89: ="1,7,"&RC[2]&",0;"&"1,4,"&RC[4]&",0;" -> 1,7,6774,0;1,4,142340,0; | S89: =INT(((50+RC[-17]/10)*35+200)*12/4) -> 6774 | U89: =1000*110/100*(1+(50+RC[-19]/10)/200)*100 -> 142340
B90: 89 | C90: 0 | D90: 400089 | E90: 1,7,1684,0;1,4,1148,0; | G90: 1 | H90: 7 | I90: 1684 | J90: 0 | L90: 1 | M90: 4 | N90: 1148 | O90: 0 | Q90: ="1,7,"&RC[2]&",0;"&"1,4,"&RC[4]&",0;" -> 1,7,6784,0;1,4,142395,0; | S90: =INT(((50+RC[-17]/10)*35+200)*12/4) -> 6784 | U90: =1000*110/100*(1+(50+RC[-19]/10)/200)*100 -> 142395
B91: 90 | C91: 0 | D91: 400090 | E91: 1,7,1695,0;1,4,1149,0; | G91: 1 | H91: 7 | I91: 1695 | J91: 0 | L91: 1 | M91: 4 | N91: 1149 | O91: 0 | Q91: ="1,7,"&RC[2]&",0;"&"1,4,"&RC[4]&",0;" -> 1,7,6795,0;1,4,142450,0; | S91: =INT(((50+RC[-17]/10)*35+200)*12/4) -> 6795 | U91: =1000*110/100*(1+(50+RC[-19]/10)/200)*100 -> 142450
B92: 91 | C92: 0 | D92: 400091 | E92: 1,7,1705,0;1,4,1150,0; | G92: 1 | H92: 7 | I92: 1705 | J92: 0 | L92: 1 | M92: 4 | N92: 1150 | O92: 0 | Q92: ="1,7,"&RC[2]&",0;"&"1,4,"&RC[4]&",0;" -> 1,7,6805,0;1,4,142505,0; | S92: =INT(((50+RC[-17]/10)*35+200)*12/4) -> 6805 | U92: =1000*110/100*(1+(50+RC[-19]/10)/200)*100 -> 142505.00000000003
B93: 92 | C93: 0 | D93: 400092 | E93: 1,7,1716,0;1,4,1150,0; | G93: 1 | H93: 7 | I93: 1716 | J93: 0 | L93: 1 | M93: 4 | N93: 1150 | O93: 0 | Q93: ="1,7,"&RC[2]&",0;"&"1,4,"&RC[4]&",0;" -> 1,7,6816,0;1,4,142560,0; | S93: =INT(((50+RC[-17]/10)*35+200)*12/4) -> 6816 | U93: =1000*110/100*(1+(50+RC[-19]/10)/200)*100 -> 142560
B94: 93 | C94: 0 | D94: 400093 | E94: 1,7,1726,0;1,4,1151,0; | G94: 1 | H94: 7 | I94: 1726 | J94: 0 | L94: 1 | M94: 4 | N94: 1151 | O94: 0 | Q94: ="1,7,"&RC[2]&",0;"&"1,4,"&RC[4]&",0;" -> 1,7,6826,0;1,4,142615,0; | S94: =INT(((50+RC[-17]/10)*35+200)*12/4) -> 6826 | U94: =1000*110/100*(1+(50+RC[-19]/10)/200)*100 -> 142615
B95: 94 | C95: 0 | D95: 400094 | E95: 1,7,1737,0;1,4,1151,0; | G95: 1 | H95: 7 | I95: 1737 | J95: 0 | L95: 1 | M95: 4 | N95: 1151 | O95: 0 | Q95: ="1,7,"&RC[2]&",0;"&"1,4,"&RC[4]&",0;" -> 1,7,6837,0;1,4,142670,0; | S95: =INT(((50+RC[-17]/10)*35+200)*12/4) -> 6837 | U95: =1000*110/100*(1+(50+RC[-19]/10)/200)*100 -> 142669.99999999997
B96: 95 | C96: 0 | D96: 400095 | E96: 1,7,1747,0;1,4,1152,0; | G96: 1 | H96: 7 | I96: 1747 | J96: 0 | L96: 1 | M96: 4 | N96: 1152 | O96: 0 | Q96: ="1,7,"&RC[2]&",0;"&"1,4,"&RC[4]&",0;" -> 1,7,6847,0;1,4,142725,0; | S96: =INT(((50+RC[-17]/10)*35+200)*12/4) -> 6847 | U96: =1000*110/100*(1+(50+RC[-19]/10)/200)*100 -> 142724.99999999997
B97: 96 | C97: 0 | D97: 400096 | E97: 1,7,1758,0;1,4,1152,0; | G97: 1 | H97: 7 | I97: 1758 | J97: 0 | L97: 1 | M97: 4 | N97: 1152 | O97: 0 | Q97: ="1,7,"&RC[2]&",0;"&"1,4,"&RC[4]&",0;" -> 1,7,6858,0;1,4,142780,0; | S97: =INT(((50+RC[-17]/10)*35+200)*12/4) -> 6858 | U97: =1000*110/100*(1+(50+RC[-19]/10)/200)*100 -> 142780
B98: 97 | C98: 0 | D98: 400097 | E98: 1,7,1768,0;1,4,1153,0; | G98: 1 | H98: 7 | I98: 1768 | J98: 0 | L98: 1 | M98: 4 | N98: 1153 | O98: 0 | Q98: ="1,7,"&RC[2]&",0;"&"1,4,"&RC[4]&",0;" -> 1,7,6868,0;1,4,142835,0; | S98: =INT(((50+RC[-17]/10)*35+200)*12/4) -> 6868 | U98: =1000*110/100*(1+(50+RC[-19]/10)/200)*100 -> 142835
B99: 98 | C99: 0 | D99: 400098 | E99: 1,7,1779,0;1,4,1153,0; | G99: 1 | H99: 7 | I99: 1779 | J99: 0 | L99: 1 | M99: 4 | N99: 1153 | O99: 0 | Q99: ="1,7,"&RC[2]&",0;"&"1,4,"&RC[4]&",0;" -> 1,7,6879,0;1,4,142890,0; | S99: =INT(((50+RC[-17]/10)*35+200)*12/4) -> 6879 | U99: =1000*110/100*(1+(50+RC[-19]/10)/200)*100 -> 142890
B100: 99 | C100: 0 | D100: 400099 | E100: 1,7,1789,0;1,4,1154,0; | G100: 1 | H100: 7 | I100: 1789 | J100: 0 | L100: 1 | M100: 4 | N100: 1154 | O100: 0 | Q100: ="1,7,"&RC[2]&",0;"&"1,4,"&RC[4]&",0;" -> 1,7,6889,0;1,4,142945,0; | S100: =INT(((50+RC[-17]/10)*35+200)*12/4) -> 6889 | U100: =1000*110/100*(1+(50+RC[-19]/10)/200)*100 -> 142945
B101: 100 | C101: 0 | D101: 400100 | E101: 1,7,1800,0;1,4,1155,0; | G101: 1 | H101: 7 | I101: 1800 | J101: 0 | L101: 1 | M101: 4 | N101: 1155 | O101: 0 | Q101: ="1,7,"&RC[2]&",0;"&"1,4,"&RC[4]&",0;" -> 1,7,6900,0;1,4,143000,0; | S101: =INT(((50+RC[-17]/10)*35+200)*12/4) -> 6900 | U101: =1000*110/100*(1+(50+RC[-19]/10)/200)*100 -> 143000
B102: 101 | C102: 0 | D102: 400101 | E102: 1,7,1810,0;1,4,1155,0; | G102: 1 | H102: 7 | I102: 1810 | J102: 0 | L102: 1 | M102: 4 | N102: 1155 | O102: 0 | Q102: ="1,7,"&RC[2]&",0;"&"1,4,"&RC[4]&",0;" -> 1,7,6910,0;1,4,143055,0; | S102: =INT(((50+RC[-17]/10)*35+200)*12/4) -> 6910 | U102: =1000*110/100*(1+(50+RC[-19]/10)/200)*100 -> 143055
B103: 102 | C103: 0 | D103: 400102 | E103: 1,7,1821,0;1,4,1156,0; | G103: 1 | H103: 7 | I103: 1821 | J103: 0 | L103: 1 | M103: 4 | N103: 1156 | O103: 0 | Q103: ="1,7,"&RC[2]&",0;"&"1,4,"&RC[4]&",0;" -> 1,7,6921,0;1,4,143110,0; | S103: =INT(((50+RC[-17]/10)*35+200)*12/4) -> 6921 | U103: =1000*110/100*(1+(50+RC[-19]/10)/200)*100 -> 143110
B104: 103 | C104: 0 | D104: 400103 | E104: 1,7,1831,0;1,4,1156,0; | G104: 1 | H104: 7 | I104: 1831 | J104: 0 | L104: 1 | M104: 4 | N104: 1156 | O104: 0 | Q104: ="1,7,"&RC[2]&",0;"&"1,4,"&RC[4]&",0;" -> 1,7,6931,0;1,4,143165,0; | S104: =INT(((50+RC[-17]/10)*35+200)*12/4) -> 6931 | U104: =1000*110/100*(1+(50+RC[-19]/10)/200)*100 -> 143165
B105: 104 | C105: 0 | D105: 400104 | E105: 1,7,1842,0;1,4,1157,0; | G105: 1 | H105: 7 | I105: 1842 | J105: 0 | L105: 1 | M105: 4 | N105: 1157 | O105: 0 | Q105: ="1,7,"&RC[2]&",0;"&"1,4,"&RC[4]&",0;" -> 1,7,6942,0;1,4,143220,0; | S105: =INT(((50+RC[-17]/10)*35+200)*12/4) -> 6942 | U105: =1000*110/100*(1+(50+RC[-19]/10)/200)*100 -> 143220
B106: 105 | C106: 0 | D106: 400105 | E106: 1,7,1852,0;1,4,1157,0; | G106: 1 | H106: 7 | I106: 1852 | J106: 0 | L106: 1 | M106: 4 | N106: 1157 | O106: 0 | Q106: ="1,7,"&RC[2]&",0;"&"1,4,"&RC[4]&",0;" -> 1,7,6952,0;1,4,143275,0; | S106: =INT(((50+RC[-17]/10)*35+200)*12/4) -> 6952 | U106: =1000*110/100*(1+(50+RC[-19]/10)/200)*100 -> 143275
B107: 106 | C107: 0 | D107: 400106 | E107: 1,7,1863,0;1,4,1158,0; | G107: 1 | H107: 7 | I107: 1863 | J107: 0 | L107: 1 | M107: 4 | N107: 1158 | O107: 0 | Q107: ="1,7,"&RC[2]&",0;"&"1,4,"&RC[4]&",0;" -> 1,7,6963,0;1,4,143330,0; | S107: =INT(((50+RC[-17]/10)*35+200)*12/4) -> 6963 | U107: =1000*110/100*(1+(50+RC[-19]/10)/200)*100 -> 143330
B108: 107 | C108: 0 | D108: 400107 | E108: 1,7,1873,0;1,4,1158,0; | G108: 1 | H108: 7 | I108: 1873 | J108: 0 | L108: 1 | M108: 4 | N108: 1158 | O108: 0 | Q108: ="1,7,"&RC[2]&",0;"&"1,4,"&RC[4]&",0;" -> 1,7,6973,0;1,4,143385,0; | S108: =INT(((50+RC[-17]/10)*35+200)*12/4) -> 6973 | U108: =1000*110/100*(1+(50+RC[-19]/10)/200)*100 -> 143385
B109: 108 | C109: 0 | D109: 400108 | E109: 1,7,1884,0;1,4,1159,0; | G109: 1 | H109: 7 | I109: 1884 | J109: 0 | L109: 1 | M109: 4 | N109: 1159 | O109: 0 | Q109: ="1,7,"&RC[2]&",0;"&"1,4,"&RC[4]&",0;" -> 1,7,6984,0;1,4,143440,0; | S109: =INT(((50+RC[-17]/10)*35+200)*12/4) -> 6984 | U109: =1000*110/100*(1+(50+RC[-19]/10)/200)*100 -> 143440
B110: 109 | C110: 0 | D110: 400109 | E110: 1,7,1894,0;1,4,1159,0; | G110: 1 | H110: 7 | I110: 1894 | J110: 0 | L110: 1 | M110: 4 | N110: 1159 | O110: 0 | Q110: ="1,7,"&RC[2]&",0;"&"1,4,"&RC[4]&",0;" -> 1,7,6994,0;1,4,143495,0; | S110: =INT(((50+RC[-17]/10)*35+200)*12/4) -> 6994 | U110: =1000*110/100*(1+(50+RC[-19]/10)/200)*100 -> 143495
B111: 110 | C111: 0 | D111: 400110 | E111: 1,7,1905,0;1,4,1160,0; | G111: 1 | H111: 7 | I111: 1905 | J111: 0 | L111: 1 | M111: 4 | N111: 1160 | O111: 0 | Q111: ="1,7,"&RC[2]&",0;"&"1,4,"&RC[4]&",0;" -> 1,7,7005,0;1,4,143550,0; | S111: =INT(((50+RC[-17]/10)*35+200)*12/4) -> 7005 | U111: =1000*110/100*(1+(50+RC[-19]/10)/200)*100 -> 143550
B112: 111 | C112: 0 | D112: 400111 | E112: 1,7,1915,0;1,4,1161,0; | G112: 1 | H112: 7 | I112: 1915 | J112: 0 | L112: 1 | M112: 4 | N112: 1161 | O112: 0 | Q112: ="1,7,"&RC[2]&",0;"&"1,4,"&RC[4]&",0;" -> 1,7,7015,0;1,4,143605,0; | S112: =INT(((50+RC[-17]/10)*35+200)*12/4) -> 7015 | U112: =1000*110/100*(1+(50+RC[-19]/10)/200)*100 -> 143605
B113: 112 | C113: 0 | D113: 400112 | E113: 1,7,1926,0;1,4,1161,0; | G113: 1 | H113: 7 | I113: 1926 | J113: 0 | L113: 1 | M113: 4 | N113: 1161 | O113: 0 | Q113: ="1,7,"&RC[2]&",0;"&"1,4,"&RC[4]&",0;" -> 1,7,7026,0;1,4,143660,0; | S113: =INT(((50+RC[-17]/10)*35+200)*12/4) -> 7026 | U113: =1000*110/100*(1+(50+RC[-19]/10)/200)*100 -> 143660
B114: 113 | C114: 0 | D114: 400113 | E114: 1,7,1936,0;1,4,1162,0; | G114: 1 | H114: 7 | I114: 1936 | J114: 0 | L114: 1 | M114: 4 | N114: 1162 | O114: 0 | Q114: ="1,7,"&RC[2]&",0;"&"1,4,"&RC[4]&",0;" -> 1,7,7036,0;1,4,143715,0; | S114: =INT(((50+RC[-17]/10)*35+200)*12/4) -> 7036 | U114: =1000*110/100*(1+(50+RC[-19]/10)/200)*100 -> 143715
B115: 114 | C115: 0 | D115: 400114 | E115: 1,7,1947,0;1,4,1162,0; | G115: 1 | H115: 7 | I115: 1947 | J115: 0 | L115: 1 | M115: 4 | N115: 1162 | O115: 0 | Q115: ="1,7,"&RC[2]&",0;"&"1,4,"&RC[4]&",0;" -> 1,7,7047,0;1,4,143770,0; | S115: =INT(((50+RC[-17]/10)*35+200)*12/4) -> 7047 | U115: =1000*110/100*(1+(50+RC[-19]/10)/200)*100 -> 143770
B116: 115 | C116: 0 | D116: 400115 | E116: 1,7,1957,0;1,4,1163,0; | G116: 1 | H116: 7 | I116: 1957 | J116: 0 | L116: 1 | M116: 4 | N116: 1163 | O116: 0 | Q116: ="1,7,"&RC[2]&",0;"&"1,4,"&RC[4]&",0;" -> 1,7,7057,0;1,4,143825,0; | S116: =INT(((50+RC[-17]/10)*35+200)*12/4) -> 7057 | U116: =1000*110/100*(1+(50+RC[-19]/10)/200)*100 -> 143825.00000000003
B117: 116 | C117: 0 | D117: 400116 | E117: 1,7,1968,0;1,4,1163,0; | G117: 1 | H117: 7 | I117: 1968 | J117: 0 | L117: 1 | M117: 4 | N117: 1163 | O117: 0 | Q117: ="1,7,"&RC[2]&",0;"&"1,4,"&RC[4]&",0;" -> 1,7,7068,0;1,4,143880,0; | S117: =INT(((50+RC[-17]/10)*35+200)*12/4) -> 7068 | U117: =1000*110/100*(1+(50+RC[-19]/10)/200)*100 -> 143880
B118: 117 | C118: 0 | D118: 400117 | E118: 1,7,1978,0;1,4,1164,0; | G118: 1 | H118: 7 | I118: 1978 | J118: 0 | L118: 1 | M118: 4 | N118: 1164 | O118: 0 | Q118: ="1,7,"&RC[2]&",0;"&"1,4,"&RC[4]&",0;" -> 1,7,7078,0;1,4,143935,0; | S118: =INT(((50+RC[-17]/10)*35+200)*12/4) -> 7078 | U118: =1000*110/100*(1+(50+RC[-19]/10)/200)*100 -> 143935
B119: 118 | C119: 0 | D119: 400118 | E119: 1,7,1989,0;1,4,1164,0; | G119: 1 | H119: 7 | I119: 1989 | J119: 0 | L119: 1 | M119: 4 | N119: 1164 | O119: 0 | Q119: ="1,7,"&RC[2]&",0;"&"1,4,"&RC[4]&",0;" -> 1,7,7089,0;1,4,143990,0; | S119: =INT(((50+RC[-17]/10)*35+200)*12/4) -> 7089 | U119: =1000*110/100*(1+(50+RC[-19]/10)/200)*100 -> 143990
B120: 119 | C120: 0 | D120: 400119 | E120: 1,7,1999,0;1,4,1165,0; | G120: 1 | H120: 7 | I120: 1999 | J120: 0 | L120: 1 | M120: 4 | N120: 1165 | O120: 0 | Q120: ="1,7,"&RC[2]&",0;"&"1,4,"&RC[4]&",0;" -> 1,7,7099,0;1,4,144045,0; | S120: =INT(((50+RC[-17]/10)*35+200)*12/4) -> 7099 | U120: =1000*110/100*(1+(50+RC[-19]/10)/200)*100 -> 144044.99999999997
B121: 120 | C121: 0 | D121: 400120 | E121: 1,7,2010,0;1,4,1166,0; | G121: 1 | H121: 7 | I121: 2010 | J121: 0 | L121: 1 | M121: 4 | N121: 1166 | O121: 0 | Q121: ="1,7,"&RC[2]&",0;"&"1,4,"&RC[4]&",0;" -> 1,7,7110,0;1,4,144100,0; | S121: =INT(((50+RC[-17]/10)*35+200)*12/4) -> 7110 | U121: =1000*110/100*(1+(50+RC[-19]/10)/200)*100 -> 144100
B122: 121 | C122: 0 | D122: 400121 | E122: 1,7,2020,0;1,4,1166,0; | G122: 1 | H122: 7 | I122: 2020 | J122: 0 | L122: 1 | M122: 4 | N122: 1166 | O122: 0 | Q122: ="1,7,"&RC[2]&",0;"&"1,4,"&RC[4]&",0;" -> 1,7,7120,0;1,4,144155,0; | S122: =INT(((50+RC[-17]/10)*35+200)*12/4) -> 7120 | U122: =1000*110/100*(1+(50+RC[-19]/10)/200)*100 -> 144155
B123: 122 | C123: 0 | D123: 400122 | E123: 1,7,2031,0;1,4,1167,0; | G123: 1 | H123: 7 | I123: 2031 | J123: 0 | L123: 1 | M123: 4 | N123: 1167 | O123: 0 | Q123: ="1,7,"&RC[2]&",0;"&"1,4,"&RC[4]&",0;" -> 1,7,7131,0;1,4,144210,0; | S123: =INT(((50+RC[-17]/10)*35+200)*12/4) -> 7131 | U123: =1000*110/100*(1+(50+RC[-19]/10)/200)*100 -> 144210
B124: 123 | C124: 0 | D124: 400123 | E124: 1,7,2041,0;1,4,1167,0; | G124: 1 | H124: 7 | I124: 2041 | J124: 0 | L124: 1 | M124: 4 | N124: 1167 | O124: 0 | Q124: ="1,7,"&RC[2]&",0;"&"1,4,"&RC[4]&",0;" -> 1,7,7141,0;1,4,144265,0; | S124: =INT(((50+RC[-17]/10)*35+200)*12/4) -> 7141 | U124: =1000*110/100*(1+(50+RC[-19]/10)/200)*100 -> 144265
B125: 124 | C125: 0 | D125: 400124 | E125: 1,7,2052,0;1,4,1168,0; | G125: 1 | H125: 7 | I125: 2052 | J125: 0 | L125: 1 | M125: 4 | N125: 1168 | O125: 0 | Q125: ="1,7,"&RC[2]&",0;"&"1,4,"&RC[4]&",0;" -> 1,7,7152,0;1,4,144320,0; | S125: =INT(((50+RC[-17]/10)*35+200)*12/4) -> 7152 | U125: =1000*110/100*(1+(50+RC[-19]/10)/200)*100 -> 144320
B126: 125 | C126: 0 | D126: 400125 | E126: 1,7,2062,0;1,4,1168,0; | G126: 1 | H126: 7 | I126: 2062 | J126: 0 | L126: 1 | M126: 4 | N126: 1168 | O126: 0 | Q126: ="1,7,"&RC[2]&",0;"&"1,4,"&RC[4]&",0;" -> 1,7,7162,0;1,4,144375,0; | S126: =INT(((50+RC[-17]/10)*35+200)*12/4) -> 7162 | U126: =1000*110/100*(1+(50+RC[-19]/10)/200)*100 -> 144375
B127: 126 | C127: 0 | D127: 400126 | E127: 1,7,2073,0;1,4,1169,0; | G127: 1 | H127: 7 | I127: 2073 | J127: 0 | L127: 1 | M127: 4 | N127: 1169 | O127: 0 | Q127: ="1,7,"&RC[2]&",0;"&"1,4,"&RC[4]&",0;" -> 1,7,7173,0;1,4,144430,0; | S127: =INT(((50+RC[-17]/10)*35+200)*12/4) -> 7173 | U127: =1000*110/100*(1+(50+RC[-19]/10)/200)*100 -> 144430
B128: 127 | C128: 0 | D128: 400127 | E128: 1,7,2083,0;1,4,1169,0; | G128: 1 | H128: 7 | I128: 2083 | J128: 0 | L128: 1 | M128: 4 | N128: 1169 | O128: 0 | Q128: ="1,7,"&RC[2]&",0;"&"1,4,"&RC[4]&",0;" -> 1,7,7183,0;1,4,144485,0; | S128: =INT(((50+RC[-17]/10)*35+200)*12/4) -> 7183 | U128: =1000*110/100*(1+(50+RC[-19]/10)/200)*100 -> 144485
B129: 128 | C129: 0 | D129: 400128 | E129: 1,7,2094,0;1,4,1170,0; | G129: 1 | H129: 7 | I129: 2094 | J129: 0 | L129: 1 | M129: 4 | N129: 1170 | O129: 0 | Q129: ="1,7,"&RC[2]&",0;"&"1,4,"&RC[4]&",0;" -> 1,7,7194,0;1,4,144540,0; | S129: =INT(((50+RC[-17]/10)*35+200)*12/4) -> 7194 | U129: =1000*110/100*(1+(50+RC[-19]/10)/200)*100 -> 144540
B130: 129 | C130: 0 | D130: 400129 | E130: 1,7,2104,0;1,4,1170,0; | G130: 1 | H130: 7 | I130: 2104 | J130: 0 | L130: 1 | M130: 4 | N130: 1170 | O130: 0 | Q130: ="1,7,"&RC[2]&",0;"&"1,4,"&RC[4]&",0;" -> 1,7,7204,0;1,4,144595,0; | S130: =INT(((50+RC[-17]/10)*35+200)*12/4) -> 7204 | U130: =1000*110/100*(1+(50+RC[-19]/10)/200)*100 -> 144595
B131: 130 | C131: 0 | D131: 400130 | E131: 1,7,2115,0;1,4,1171,0; | G131: 1 | H131: 7 | I131: 2115 | J131: 0 | L131: 1 | M131: 4 | N131: 1171 | O131: 0 | Q131: ="1,7,"&RC[2]&",0;"&"1,4,"&RC[4]&",0;" -> 1,7,7215,0;1,4,144650,0; | S131: =INT(((50+RC[-17]/10)*35+200)*12/4) -> 7215 | U131: =1000*110/100*(1+(50+RC[-19]/10)/200)*100 -> 144650
B132: 131 | C132: 0 | D132: 400131 | E132: 1,7,2125,0;1,4,1172,0; | G132: 1 | H132: 7 | I132: 2125 | J132: 0 | L132: 1 | M132: 4 | N132: 1172 | O132: 0 | Q132: ="1,7,"&RC[2]&",0;"&"1,4,"&RC[4]&",0;" -> 1,7,7225,0;1,4,144705,0; | S132: =INT(((50+RC[-17]/10)*35+200)*12/4) -> 7225 | U132: =1000*110/100*(1+(50+RC[-19]/10)/200)*100 -> 144705.00000000003
B133: 132 | C133: 0 | D133: 400132 | E133: 1,7,2136,0;1,4,1172,0; | G133: 1 | H133: 7 | I133: 2136 | J133: 0 | L133: 1 | M133: 4 | N133: 1172 | O133: 0 | Q133: ="1,7,"&RC[2]&",0;"&"1,4,"&RC[4]&",0;" -> 1,7,7236,0;1,4,144760,0; | S133: =INT(((50+RC[-17]/10)*35+200)*12/4) -> 7236 | U133: =1000*110/100*(1+(50+RC[-19]/10)/200)*100 -> 144760
B134: 133 | C134: 0 | D134: 400133 | E134: 1,7,2146,0;1,4,1173,0; | G134: 1 | H134: 7 | I134: 2146 | J134: 0 | L134: 1 | M134: 4 | N134: 1173 | O134: 0 | Q134: ="1,7,"&RC[2]&",0;"&"1,4,"&RC[4]&",0;" -> 1,7,7246,0;1,4,144815,0; | S134: =INT(((50+RC[-17]/10)*35+200)*12/4) -> 7246 | U134: =1000*110/100*(1+(50+RC[-19]/10)/200)*100 -> 144815
B135: 134 | C135: 0 | D135: 400134 | E135: 1,7,2157,0;1,4,1173,0; | G135: 1 | H135: 7 | I135: 2157 | J135: 0 | L135: 1 | M135: 4 | N135: 1173 | O135: 0 | Q135: ="1,7,"&RC[2]&",0;"&"1,4,"&RC[4]&",0;" -> 1,7,7257,0;1,4,144870,0; | S135: =INT(((50+RC[-17]/10)*35+200)*12/4) -> 7257 | U135: =1000*110/100*(1+(50+RC[-19]/10)/200)*100 -> 144870
B136: 135 | C136: 0 | D136: 400135 | E136: 1,7,2167,0;1,4,1174,0; | G136: 1 | H136: 7 | I136: 2167 | J136: 0 | L136: 1 | M136: 4 | N136: 1174 | O136: 0 | Q136: ="1,7,"&RC[2]&",0;"&"1,4,"&RC[4]&",0;" -> 1,7,7267,0;1,4,144925,0; | S136: =INT(((50+RC[-17]/10)*35+200)*12/4) -> 7267 | U136: =1000*110/100*(1+(50+RC[-19]/10)/200)*100 -> 144924.99999999997
B137: 136 | C137: 0 | D137: 400136 | E137: 1,7,2178,0;1,4,1174,0; | G137: 1 | H137: 7 | I137: 2178 | J137: 0 | L137: 1 | M137: 4 | N137: 1174 | O137: 0 | Q137: ="1,7,"&RC[2]&",0;"&"1,4,"&RC[4]&",0;" -> 1,7,7278,0;1,4,144980,0; | S137: =INT(((50+RC[-17]/10)*35+200)*12/4) -> 7278 | U137: =1000*110/100*(1+(50+RC[-19]/10)/200)*100 -> 144980
B138: 137 | C138: 0 | D138: 400137 | E138: 1,7,2188,0;1,4,1175,0; | G138: 1 | H138: 7 | I138: 2188 | J138: 0 | L138: 1 | M138: 4 | N138: 1175 | O138: 0 | Q138: ="1,7,"&RC[2]&",0;"&"1,4,"&RC[4]&",0;" -> 1,7,7288,0;1,4,145035,0; | S138: =INT(((50+RC[-17]/10)*35+200)*12/4) -> 7288 | U138: =1000*110/100*(1+(50+RC[-19]/10)/200)*100 -> 145035
B139: 138 | C139: 0 | D139: 400138 | E139: 1,7,2199,0;1,4,1175,0; | G139: 1 | H139: 7 | I139: 2199 | J139: 0 | L139: 1 | M139: 4 | N139: 1175 | O139: 0 | Q139: ="1,7,"&RC[2]&",0;"&"1,4,"&RC[4]&",0;" -> 1,7,7299,0;1,4,145090,0; | S139: =INT(((50+RC[-17]/10)*35+200)*12/4) -> 7299 | U139: =1000*110/100*(1+(50+RC[-19]/10)/200)*100 -> 145090
B140: 139 | C140: 0 | D140: 400139 | E140: 1,7,2209,0;1,4,1176,0; | G140: 1 | H140: 7 | I140: 2209 | J140: 0 | L140: 1 | M140: 4 | N140: 1176 | O140: 0 | Q140: ="1,7,"&RC[2]&",0;"&"1,4,"&RC[4]&",0;" -> 1,7,7309,0;1,4,145145,0; | S140: =INT(((50+RC[-17]/10)*35+200)*12/4) -> 7309 | U140: =1000*110/100*(1+(50+RC[-19]/10)/200)*100 -> 145145
B141: 140 | C141: 0 | D141: 400140 | E141: 1,7,2220,0;1,4,1177,0; | G141: 1 | H141: 7 | I141: 2220 | J141: 0 | L141: 1 | M141: 4 | N141: 1177 | O141: 0 | Q141: ="1,7,"&RC[2]&",0;"&"1,4,"&RC[4]&",0;" -> 1,7,7320,0;1,4,145200,0; | S141: =INT(((50+RC[-17]/10)*35+200)*12/4) -> 7320 | U141: =1000*110/100*(1+(50+RC[-19]/10)/200)*100 -> 145200
B142: 141 | C142: 0 | D142: 400141 | E142: 1,7,2230,0;1,4,1177,0; | G142: 1 | H142: 7 | I142: 2230 | J142: 0 | L142: 1 | M142: 4 | N142: 1177 | O142: 0 | Q142: ="1,7,"&RC[2]&",0;"&"1,4,"&RC[4]&",0;" -> 1,7,7330,0;1,4,145255,0; | S142: =INT(((50+RC[-17]/10)*35+200)*12/4) -> 7330 | U142: =1000*110/100*(1+(50+RC[-19]/10)/200)*100 -> 145255
B143: 142 | C143: 0 | D143: 400142 | E143: 1,7,2241,0;1,4,1178,0; | G143: 1 | H143: 7 | I143: 2241 | J143: 0 | L143: 1 | M143: 4 | N143: 1178 | O143: 0 | Q143: ="1,7,"&RC[2]&",0;"&"1,4,"&RC[4]&",0;" -> 1,7,7341,0;1,4,145310,0; | S143: =INT(((50+RC[-17]/10)*35+200)*12/4) -> 7341 | U143: =1000*110/100*(1+(50+RC[-19]/10)/200)*100 -> 145310
B144: 143 | C144: 0 | D144: 400143 | E144: 1,7,2251,0;1,4,1178,0; | G144: 1 | H144: 7 | I144: 2251 | J144: 0 | L144: 1 | M144: 4 | N144: 1178 | O144: 0 | Q144: ="1,7,"&RC[2]&",0;"&"1,4,"&RC[4]&",0;" -> 1,7,7351,0;1,4,145365,0; | S144: =INT(((50+RC[-17]/10)*35+200)*12/4) -> 7351 | U144: =1000*110/100*(1+(50+RC[-19]/10)/200)*100 -> 145365
B145: 144 | C145: 0 | D145: 400144 | E145: 1,7,2262,0;1,4,1179,0; | G145: 1 | H145: 7 | I145: 2262 | J145: 0 | L145: 1 | M145: 4 | N145: 1179 | O145: 0 | Q145: ="1,7,"&RC[2]&",0;"&"1,4,"&RC[4]&",0;" -> 1,7,7362,0;1,4,145420,0; | S145: =INT(((50+RC[-17]/10)*35+200)*12/4) -> 7362 | U145: =1000*110/100*(1+(50+RC[-19]/10)/200)*100 -> 145420
B146: 145 | C146: 0 | D146: 400145 | E146: 1,7,2272,0;1,4,1179,0; | G146: 1 | H146: 7 | I146: 2272 | J146: 0 | L146: 1 | M146: 4 | N146: 1179 | O146: 0 | Q146: ="1,7,"&RC[2]&",0;"&"1,4,"&RC[4]&",0;" -> 1,7,7372,0;1,4,145475,0; | S146: =INT(((50+RC[-17]/10)*35+200)*12/4) -> 7372 | U146: =1000*110/100*(1+(50+RC[-19]/10)/200)*100 -> 145475
B147: 146 | C147: 0 | D147: 400146 | E147: 1,7,2283,0;1,4,1180,0; | G147: 1 | H147: 7 | I147: 2283 | J147: 0 | L147: 1 | M147: 4 | N147: 1180 | O147: 0 | Q147: ="1,7,"&RC[2]&",0;"&"1,4,"&RC[4]&",0;" -> 1,7,7383,0;1,4,145530,0; | S147: =INT(((50+RC[-17]/10)*35+200)*12/4) -> 7383 | U147: =1000*110/100*(1+(50+RC[-19]/10)/200)*100 -> 145530
B148: 147 | C148: 0 | D148: 400147 | E148: 1,7,2293,0;1,4,1180,0; | G148: 1 | H148: 7 | I148: 2293 | J148: 0 | L148: 1 | M148: 4 | N148: 1180 | O148: 0 | Q148: ="1,7,"&RC[2]&",0;"&"1,4,"&RC[4]&",0;" -> 1,7,7393,0;1,4,145585,0; | S148: =INT(((50+RC[-17]/10)*35+200)*12/4) -> 7393 | U148: =1000*110/100*(1+(50+RC[-19]/10)/200)*100 -> 145585
B149: 148 | C149: 0 | D149: 400148 | E149: 1,7,2304,0;1,4,1181,0; | G149: 1 | H149: 7 | I149: 2304 | J149: 0 | L149: 1 | M149: 4 | N149: 1181 | O149: 0 | Q149: ="1,7,"&RC[2]&",0;"&"1,4,"&RC[4]&",0;" -> 1,7,7404,0;1,4,145640,0; | S149: =INT(((50+RC[-17]/10)*35+200)*12/4) -> 7404 | U149: =1000*110/100*(1+(50+RC[-19]/10)/200)*100 -> 145640
B150: 149 | C150: 0 | D150: 400149 | E150: 1,7,2314,0;1,4,1181,0; | G150: 1 | H150: 7 | I150: 2314 | J150: 0 | L150: 1 | M150: 4 | N150: 1181 | O150: 0 | Q150: ="1,7,"&RC[2]&",0;"&"1,4,"&RC[4]&",0;" -> 1,7,7414,0;1,4,145695,0; | S150: =INT(((50+RC[-17]/10)*35+200)*12/4) -> 7414 | U150: =1000*110/100*(1+(50+RC[-19]/10)/200)*100 -> 145695
B151: 150 | C151: 0 | D151: 400150 | E151: 1,7,2325,0;1,4,1182,0; | G151: 1 | H151: 7 | I151: 2325 | J151: 0 | L151: 1 | M151: 4 | N151: 1182 | O151: 0 | Q151: ="1,7,"&RC[2]&",0;"&"1,4,"&RC[4]&",0;" -> 1,7,7425,0;1,4,145750,0; | S151: =INT(((50+RC[-17]/10)*35+200)*12/4) -> 7425 | U151: =1000*110/100*(1+(50+RC[-19]/10)/200)*100 -> 145750
B152: 151 | C152: 0 | D152: 400151 | E152: 1,7,2335,0;1,4,1183,0; | G152: 1 | H152: 7 | I152: 2335 | J152: 0 | L152: 1 | M152: 4 | N152: 1183 | O152: 0 | Q152: ="1,7,"&RC[2]&",0;"&"1,4,"&RC[4]&",0;" -> 1,7,7435,0;1,4,145805,0; | S152: =INT(((50+RC[-17]/10)*35+200)*12/4) -> 7435 | U152: =1000*110/100*(1+(50+RC[-19]/10)/200)*100 -> 145805
B153: 152 | C153: 0 | D153: 400152 | E153: 1,7,2346,0;1,4,1183,0; | G153: 1 | H153: 7 | I153: 2346 | J153: 0 | L153: 1 | M153: 4 | N153: 1183 | O153: 0 | Q153: ="1,7,"&RC[2]&",0;"&"1,4,"&RC[4]&",0;" -> 1,7,7446,0;1,4,145860,0; | S153: =INT(((50+RC[-17]/10)*35+200)*12/4) -> 7446 | U153: =1000*110/100*(1+(50+RC[-19]/10)/200)*100 -> 145860
B154: 153 | C154: 0 | D154: 400153 | E154: 1,7,2356,0;1,4,1184,0; | G154: 1 | H154: 7 | I154: 2356 | J154: 0 | L154: 1 | M154: 4 | N154: 1184 | O154: 0 | Q154: ="1,7,"&RC[2]&",0;"&"1,4,"&RC[4]&",0;" -> 1,7,7456,0;1,4,145915,0; | S154: =INT(((50+RC[-17]/10)*35+200)*12/4) -> 7456 | U154: =1000*110/100*(1+(50+RC[-19]/10)/200)*100 -> 145915
B155: 154 | C155: 0 | D155: 400154 | E155: 1,7,2367,0;1,4,1184,0; | G155: 1 | H155: 7 | I155: 2367 | J155: 0 | L155: 1 | M155: 4 | N155: 1184 | O155: 0 | Q155: ="1,7,"&RC[2]&",0;"&"1,4,"&RC[4]&",0;" -> 1,7,7467,0;1,4,145970,0; | S155: =INT(((50+RC[-17]/10)*35+200)*12/4) -> 7467 | U155: =1000*110/100*(1+(50+RC[-19]/10)/200)*100 -> 145970
B156: 155 | C156: 0 | D156: 400155 | E156: 1,7,2377,0;1,4,1185,0; | G156: 1 | H156: 7 | I156: 2377 | J156: 0 | L156: 1 | M156: 4 | N156: 1185 | O156: 0 | Q156: ="1,7,"&RC[2]&",0;"&"1,4,"&RC[4]&",0;" -> 1,7,7477,0;1,4,146025,0; | S156: =INT(((50+RC[-17]/10)*35+200)*12/4) -> 7477 | U156: =1000*110/100*(1+(50+RC[-19]/10)/200)*100 -> 146025.00000000003
B157: 156 | C157: 0 | D157: 400156 | E157: 1,7,2388,0;1,4,1185,0; | G157: 1 | H157: 7 | I157: 2388 | J157: 0 | L157: 1 | M157: 4 | N157: 1185 | O157: 0 | Q157: ="1,7,"&RC[2]&",0;"&"1,4,"&RC[4]&",0;" -> 1,7,7488,0;1,4,146080,0; | S157: =INT(((50+RC[-17]/10)*35+200)*12/4) -> 7488 | U157: =1000*110/100*(1+(50+RC[-19]/10)/200)*100 -> 146079.99999999997
B158: 157 | C158: 0 | D158: 400157 | E158: 1,7,2398,0;1,4,1186,0; | G158: 1 | H158: 7 | I158: 2398 | J158: 0 | L158: 1 | M158: 4 | N158: 1186 | O158: 0 | Q158: ="1,7,"&RC[2]&",0;"&"1,4,"&RC[4]&",0;" -> 1,7,7498,0;1,4,146135,0; | S158: =INT(((50+RC[-17]/10)*35+200)*12/4) -> 7498 | U158: =1000*110/100*(1+(50+RC[-19]/10)/200)*100 -> 146135
B159: 158 | C159: 0 | D159: 400158 | E159: 1,7,2409,0;1,4,1186,0; | G159: 1 | H159: 7 | I159: 2409 | J159: 0 | L159: 1 | M159: 4 | N159: 1186 | O159: 0 | Q159: ="1,7,"&RC[2]&",0;"&"1,4,"&RC[4]&",0;" -> 1,7,7509,0;1,4,146190,0; | S159: =INT(((50+RC[-17]/10)*35+200)*12/4) -> 7509 | U159: =1000*110/100*(1+(50+RC[-19]/10)/200)*100 -> 146190
B160: 159 | C160: 0 | D160: 400159 | E160: 1,7,2419,0;1,4,1187,0; | G160: 1 | H160: 7 | I160: 2419 | J160: 0 | L160: 1 | M160: 4 | N160: 1187 | O160: 0 | Q160: ="1,7,"&RC[2]&",0;"&"1,4,"&RC[4]&",0;" -> 1,7,7519,0;1,4,146245,0; | S160: =INT(((50+RC[-17]/10)*35+200)*12/4) -> 7519 | U160: =1000*110/100*(1+(50+RC[-19]/10)/200)*100 -> 146244.99999999997
B161: 160 | C161: 0 | D161: 400160 | E161: 1,7,2430,0;1,4,1188,0; | G161: 1 | H161: 7 | I161: 2430 | J161: 0 | L161: 1 | M161: 4 | N161: 1188 | O161: 0 | Q161: ="1,7,"&RC[2]&",0;"&"1,4,"&RC[4]&",0;" -> 1,7,7530,0;1,4,146300,0; | S161: =INT(((50+RC[-17]/10)*35+200)*12/4) -> 7530 | U161: =1000*110/100*(1+(50+RC[-19]/10)/200)*100 -> 146300
B162: 161 | C162: 0 | D162: 400161 | E162: 1,7,2440,0;1,4,1188,0; | G162: 1 | H162: 7 | I162: 2440 | J162: 0 | L162: 1 | M162: 4 | N162: 1188 | O162: 0 | Q162: ="1,7,"&RC[2]&",0;"&"1,4,"&RC[4]&",0;" -> 1,7,7540,0;1,4,146355,0; | S162: =INT(((50+RC[-17]/10)*35+200)*12/4) -> 7540 | U162: =1000*110/100*(1+(50+RC[-19]/10)/200)*100 -> 146355
B163: 162 | C163: 0 | D163: 400162 | E163: 1,7,2451,0;1,4,1189,0; | G163: 1 | H163: 7 | I163: 2451 | J163: 0 | L163: 1 | M163: 4 | N163: 1189 | O163: 0 | Q163: ="1,7,"&RC[2]&",0;"&"1,4,"&RC[4]&",0;" -> 1,7,7551,0;1,4,146410,0; | S163: =INT(((50+RC[-17]/10)*35+200)*12/4) -> 7551 | U163: =1000*110/100*(1+(50+RC[-19]/10)/200)*100 -> 146410
B164: 163 | C164: 0 | D164: 400163 | E164: 1,7,2461,0;1,4,1189,0; | G164: 1 | H164: 7 | I164: 2461 | J164: 0 | L164: 1 | M164: 4 | N164: 1189 | O164: 0 | Q164: ="1,7,"&RC[2]&",0;"&"1,4,"&RC[4]&",0;" -> 1,7,7561,0;1,4,146465,0; | S164: =INT(((50+RC[-17]/10)*35+200)*12/4) -> 7561 | U164: =1000*110/100*(1+(50+RC[-19]/10)/200)*100 -> 146465
B165: 164 | C165: 0 | D165: 400164 | E165: 1,7,2472,0;1,4,1190,0; | G165: 1 | H165: 7 | I165: 2472 | J165: 0 | L165: 1 | M165: 4 | N165: 1190 | O165: 0 | Q165: ="1,7,"&RC[2]&",0;"&"1,4,"&RC[4]&",0;" -> 1,7,7572,0;1,4,146520,0; | S165: =INT(((50+RC[-17]/10)*35+200)*12/4) -> 7572 | U165: =1000*110/100*(1+(50+RC[-19]/10)/200)*100 -> 146520
B166: 165 | C166: 0 | D166: 400165 | E166: 1,7,2482,0;1,4,1190,0; | G166: 1 | H166: 7 | I166: 2482 | J166: 0 | L166: 1 | M166: 4 | N166: 1190 | O166: 0 | Q166: ="1,7,"&RC[2]&",0;"&"1,4,"&RC[4]&",0;" -> 1,7,7582,0;1,4,146575,0; | S166: =INT(((50+RC[-17]/10)*35+200)*12/4) -> 7582 | U166: =1000*110/100*(1+(50+RC[-19]/10)/200)*100 -> 146575
B167: 166 | C167: 0 | D167: 400166 | E167: 1,7,2493,0;1,4,1191,0; | G167: 1 | H167: 7 | I167: 2493 | J167: 0 | L167: 1 | M167: 4 | N167: 1191 | O167: 0 | Q167: ="1,7,"&RC[2]&",0;"&"1,4,"&RC[4]&",0;" -> 1,7,7593,0;1,4,146630,0; | S167: =INT(((50+RC[-17]/10)*35+200)*12/4) -> 7593 | U167: =1000*110/100*(1+(50+RC[-19]/10)/200)*100 -> 146630
B168: 167 | C168: 0 | D168: 400167 | E168: 1,7,2503,0;1,4,1191,0; | G168: 1 | H168: 7 | I168: 2503 | J168: 0 | L168: 1 | M168: 4 | N168: 1191 | O168: 0 | Q168: ="1,7,"&RC[2]&",0;"&"1,4,"&RC[4]&",0;" -> 1,7,7603,0;1,4,146685,0; | S168: =INT(((50+RC[-17]/10)*35+200)*12/4) -> 7603 | U168: =1000*110/100*(1+(50+RC[-19]/10)/200)*100 -> 146685
B169: 168 | C169: 0 | D169: 400168 | E169: 1,7,2514,0;1,4,1192,0; | G169: 1 | H169: 7 | I169: 2514 | J169: 0 | L169: 1 | M169: 4 | N169: 1192 | O169: 0 | Q169: ="1,7,"&RC[2]&",0;"&"1,4,"&RC[4]&",0;" -> 1,7,7614,0;1,4,146740,0; | S169: =INT(((50+RC[-17]/10)*35+200)*12/4) -> 7614 | U169: =1000*110/100*(1+(50+RC[-19]/10)/200)*100 -> 146740
B170: 169 | C170: 0 | D170: 400169 | E170: 1,7,2524,0;1,4,1192,0; | G170: 1 | H170: 7 | I170: 2524 | J170: 0 | L170: 1 | M170: 4 | N170: 1192 | O170: 0 | Q170: ="1,7,"&RC[2]&",0;"&"1,4,"&RC[4]&",0;" -> 1,7,7624,0;1,4,146795,0; | S170: =INT(((50+RC[-17]/10)*35+200)*12/4) -> 7624 | U170: =1000*110/100*(1+(50+RC[-19]/10)/200)*100 -> 146795
B171: 170 | C171: 0 | D171: 400170 | E171: 1,7,2535,0;1,4,1193,0; | G171: 1 | H171: 7 | I171: 2535 | J171: 0 | L171: 1 | M171: 4 | N171: 1193 | O171: 0 | Q171: ="1,7,"&RC[2]&",0;"&"1,4,"&RC[4]&",0;" -> 1,7,7635,0;1,4,146850,0; | S171: =INT(((50+RC[-17]/10)*35+200)*12/4) -> 7635 | U171: =1000*110/100*(1+(50+RC[-19]/10)/200)*100 -> 146850
B172: 171 | C172: 0 | D172: 400171 | E172: 1,7,2545,0;1,4,1194,0; | G172: 1 | H172: 7 | I172: 2545 | J172: 0 | L172: 1 | M172: 4 | N172: 1194 | O172: 0 | Q172: ="1,7,"&RC[2]&",0;"&"1,4,"&RC[4]&",0;" -> 1,7,7645,0;1,4,146905,0; | S172: =INT(((50+RC[-17]/10)*35+200)*12/4) -> 7645 | U172: =1000*110/100*(1+(50+RC[-19]/10)/200)*100 -> 146905
B173: 172 | C173: 0 | D173: 400172 | E173: 1,7,2556,0;1,4,1194,0; | G173: 1 | H173: 7 | I173: 2556 | J173: 0 | L173: 1 | M173: 4 | N173: 1194 | O173: 0 | Q173: ="1,7,"&RC[2]&",0;"&"1,4,"&RC[4]&",0;" -> 1,7,7656,0;1,4,146960,0; | S173: =INT(((50+RC[-17]/10)*35+200)*12/4) -> 7656 | U173: =1000*110/100*(1+(50+RC[-19]/10)/200)*100 -> 146960
B174: 173 | C174: 0 | D174: 400173 | E174: 1,7,2566,0;1,4,1195,0; | G174: 1 | H174: 7 | I174: 2566 | J174: 0 | L174: 1 | M174: 4 | N174: 1195 | O174: 0 | Q174: ="1,7,"&RC[2]&",0;"&"1,4,"&RC[4]&",0;" -> 1,7,7666,0;1,4,147015,0; | S174: =INT(((50+RC[-17]/10)*35+200)*12/4) -> 7666 | U174: =1000*110/100*(1+(50+RC[-19]/10)/200)*100 -> 147015
B175: 174 | C175: 0 | D175: 400174 | E175: 1,7,2577,0;1,4,1195,0; | G175: 1 | H175: 7 | I175: 2577 | J175: 0 | L175: 1 | M175: 4 | N175: 1195 | O175: 0 | Q175: ="1,7,"&RC[2]&",0;"&"1,4,"&RC[4]&",0;" -> 1,7,7677,0;1,4,147070,0; | S175: =INT(((50+RC[-17]/10)*35+200)*12/4) -> 7677 | U175: =1000*110/100*(1+(50+RC[-19]/10)/200)*100 -> 147070
B176: 175 | C176: 0 | D176: 400175 | E176: 1,7,2587,0;1,4,1196,0; | G176: 1 | H176: 7 | I176: 2587 | J176: 0 | L176: 1 | M176: 4 | N176: 1196 | O176: 0 | Q176: ="1,7,"&RC[2]&",0;"&"1,4,"&RC[4]&",0;" -> 1,7,7687,0;1,4,147125,0; | S176: =INT(((50+RC[-17]/10)*35+200)*12/4) -> 7687 | U176: =1000*110/100*(1+(50+RC[-19]/10)/200)*100 -> 147125
B177: 176 | C177: 0 | D177: 400176 | E177: 1,7,2598,0;1,4,1196,0; | G177: 1 | H177: 7 | I177: 2598 | J177: 0 | L177: 1 | M177: 4 | N177: 1196 | O177: 0 | Q177: ="1,7,"&RC[2]&",0;"&"1,4,"&RC[4]&",0;" -> 1,7,7698,0;1,4,147180,0; | S177: =INT(((50+RC[-17]/10)*35+200)*12/4) -> 7698 | U177: =1000*110/100*(1+(50+RC[-19]/10)/200)*100 -> 147180.00000000003
B178: 177 | C178: 0 | D178: 400177 | E178: 1,7,2608,0;1,4,1197,0; | G178: 1 | H178: 7 | I178: 2608 | J178: 0 | L178: 1 | M178: 4 | N178: 1197 | O178: 0 | Q178: ="1,7,"&RC[2]&",0;"&"1,4,"&RC[4]&",0;" -> 1,7,7708,0;1,4,147235,0; | S178: =INT(((50+RC[-17]/10)*35+200)*12/4) -> 7708 | U178: =1000*110/100*(1+(50+RC[-19]/10)/200)*100 -> 147235
B179: 178 | C179: 0 | D179: 400178 | E179: 1,7,2619,0;1,4,1197,0; | G179: 1 | H179: 7 | I179: 2619 | J179: 0 | L179: 1 | M179: 4 | N179: 1197 | O179: 0 | Q179: ="1,7,"&RC[2]&",0;"&"1,4,"&RC[4]&",0;" -> 1,7,7719,0;1,4,147290,0; | S179: =INT(((50+RC[-17]/10)*35+200)*12/4) -> 7719 | U179: =1000*110/100*(1+(50+RC[-19]/10)/200)*100 -> 147290
B180: 179 | C180: 0 | D180: 400179 | E180: 1,7,2629,0;1,4,1198,0; | G180: 1 | H180: 7 | I180: 2629 | J180: 0 | L180: 1 | M180: 4 | N180: 1198 | O180: 0 | Q180: ="1,7,"&RC[2]&",0;"&"1,4,"&RC[4]&",0;" -> 1,7,7729,0;1,4,147345,0; | S180: =INT(((50+RC[-17]/10)*35+200)*12/4) -> 7729 | U180: =1000*110/100*(1+(50+RC[-19]/10)/200)*100 -> 147345
B181: 180 | C181: 0 | D181: 400180 | E181: 1,7,2640,0;1,4,1199,0; | G181: 1 | H181: 7 | I181: 2640 | J181: 0 | L181: 1 | M181: 4 | N181: 1199 | O181: 0 | Q181: ="1,7,"&RC[2]&",0;"&"1,4,"&RC[4]&",0;" -> 1,7,7740,0;1,4,147400,0; | S181: =INT(((50+RC[-17]/10)*35+200)*12/4) -> 7740 | U181: =1000*110/100*(1+(50+RC[-19]/10)/200)*100 -> 147400
B182: 181 | C182: 0 | D182: 400181 | E182: 1,7,2650,0;1,4,1199,0; | G182: 1 | H182: 7 | I182: 2650 | J182: 0 | L182: 1 | M182: 4 | N182: 1199 | O182: 0 | Q182: ="1,7,"&RC[2]&",0;"&"1,4,"&RC[4]&",0;" -> 1,7,7750,0;1,4,147455,0; | S182: =INT(((50+RC[-17]/10)*35+200)*12/4) -> 7750 | U182: =1000*110/100*(1+(50+RC[-19]/10)/200)*100 -> 147455
B183: 182 | C183: 0 | D183: 400182 | E183: 1,7,2661,0;1,4,1200,0; | G183: 1 | H183: 7 | I183: 2661 | J183: 0 | L183: 1 | M183: 4 | N183: 1200 | O183: 0 | Q183: ="1,7,"&RC[2]&",0;"&"1,4,"&RC[4]&",0;" -> 1,7,7761,0;1,4,147510,0; | S183: =INT(((50+RC[-17]/10)*35+200)*12/4) -> 7761 | U183: =1000*110/100*(1+(50+RC[-19]/10)/200)*100 -> 147510
B184: 183 | C184: 0 | D184: 400183 | E184: 1,7,2671,0;1,4,1200,0; | G184: 1 | H184: 7 | I184: 2671 | J184: 0 | L184: 1 | M184: 4 | N184: 1200 | O184: 0 | Q184: ="1,7,"&RC[2]&",0;"&"1,4,"&RC[4]&",0;" -> 1,7,7771,0;1,4,147565,0; | S184: =INT(((50+RC[-17]/10)*35+200)*12/4) -> 7771 | U184: =1000*110/100*(1+(50+RC[-19]/10)/200)*100 -> 147565
B185: 184 | C185: 0 | D185: 400184 | E185: 1,7,2682,0;1,4,1201,0; | G185: 1 | H185: 7 | I185: 2682 | J185: 0 | L185: 1 | M185: 4 | N185: 1201 | O185: 0 | Q185: ="1,7,"&RC[2]&",0;"&"1,4,"&RC[4]&",0;" -> 1,7,7782,0;1,4,147620,0; | S185: =INT(((50+RC[-17]/10)*35+200)*12/4) -> 7782 | U185: =1000*110/100*(1+(50+RC[-19]/10)/200)*100 -> 147620
B186: 185 | C186: 0 | D186: 400185 | E186: 1,7,2692,0;1,4,1201,0; | G186: 1 | H186: 7 | I186: 2692 | J186: 0 | L186: 1 | M186: 4 | N186: 1201 | O186: 0 | Q186: ="1,7,"&RC[2]&",0;"&"1,4,"&RC[4]&",0;" -> 1,7,7792,0;1,4,147675,0; | S186: =INT(((50+RC[-17]/10)*35+200)*12/4) -> 7792 | U186: =1000*110/100*(1+(50+RC[-19]/10)/200)*100 -> 147675
B187: 186 | C187: 0 | D187: 400186 | E187: 1,7,2703,0;1,4,1202,0; | G187: 1 | H187: 7 | I187: 2703 | J187: 0 | L187: 1 | M187: 4 | N187: 1202 | O187: 0 | Q187: ="1,7,"&RC[2]&",0;"&"1,4,"&RC[4]&",0;" -> 1,7,7803,0;1,4,147730,0; | S187: =INT(((50+RC[-17]/10)*35+200)*12/4) -> 7803 | U187: =1000*110/100*(1+(50+RC[-19]/10)/200)*100 -> 147730
B188: 187 | C188: 0 | D188: 400187 | E188: 1,7,2713,0;1,4,1202,0; | G188: 1 | H188: 7 | I188: 2713 | J188: 0 | L188: 1 | M188: 4 | N188: 1202 | O188: 0 | Q188: ="1,7,"&RC[2]&",0;"&"1,4,"&RC[4]&",0;" -> 1,7,7813,0;1,4,147785,0; | S188: =INT(((50+RC[-17]/10)*35+200)*12/4) -> 7813 | U188: =1000*110/100*(1+(50+RC[-19]/10)/200)*100 -> 147785
B189: 188 | C189: 0 | D189: 400188 | E189: 1,7,2724,0;1,4,1203,0; | G189: 1 | H189: 7 | I189: 2724 | J189: 0 | L189: 1 | M189: 4 | N189: 1203 | O189: 0 | Q189: ="1,7,"&RC[2]&",0;"&"1,4,"&RC[4]&",0;" -> 1,7,7824,0;1,4,147840,0; | S189: =INT(((50+RC[-17]/10)*35+200)*12/4) -> 7824 | U189: =1000*110/100*(1+(50+RC[-19]/10)/200)*100 -> 147840
B190: 189 | C190: 0 | D190: 400189 | E190: 1,7,2734,0;1,4,1203,0; | G190: 1 | H190: 7 | I190: 2734 | J190: 0 | L190: 1 | M190: 4 | N190: 1203 | O190: 0 | Q190: ="1,7,"&RC[2]&",0;"&"1,4,"&RC[4]&",0;" -> 1,7,7834,0;1,4,147895,0; | S190: =INT(((50+RC[-17]/10)*35+200)*12/4) -> 7834 | U190: =1000*110/100*(1+(50+RC[-19]/10)/200)*100 -> 147895
B191: 190 | C191: 0 | D191: 400190 | E191: 1,7,2745,0;1,4,1204,0; | G191: 1 | H191: 7 | I191: 2745 | J191: 0 | L191: 1 | M191: 4 | N191: 1204 | O191: 0 | Q191: ="1,7,"&RC[2]&",0;"&"1,4,"&RC[4]&",0;" -> 1,7,7845,0;1,4,147950,0; | S191: =INT(((50+RC[-17]/10)*35+200)*12/4) -> 7845 | U191: =1000*110/100*(1+(50+RC[-19]/10)/200)*100 -> 147950
B192: 191 | C192: 0 | D192: 400191 | E192: 1,7,2755,0;1,4,1205,0; | G192: 1 | H192: 7 | I192: 2755 | J192: 0 | L192: 1 | M192: 4 | N192: 1205 | O192: 0 | Q192: ="1,7,"&RC[2]&",0;"&"1,4,"&RC[4]&",0;" -> 1,7,7855,0;1,4,148005,0; | S192: =INT(((50+RC[-17]/10)*35+200)*12/4) -> 7855 | U192: =1000*110/100*(1+(50+RC[-19]/10)/200)*100 -> 148005
B193: 192 | C193: 0 | D193: 400192 | E193: 1,7,2766,0;1,4,1205,0; | G193: 1 | H193: 7 | I193: 2766 | J193: 0 | L193: 1 | M193: 4 | N193: 1205 | O193: 0 | Q193: ="1,7,"&RC[2]&",0;"&"1,4,"&RC[4]&",0;" -> 1,7,7866,0;1,4,148060,0; | S193: =INT(((50+RC[-17]/10)*35+200)*12/4) -> 7866 | U193: =1000*110/100*(1+(50+RC[-19]/10)/200)*100 -> 148060
B194: 193 | C194: 0 | D194: 400193 | E194: 1,7,2776,0;1,4,1206,0; | G194: 1 | H194: 7 | I194: 2776 | J194: 0 | L194: 1 | M194: 4 | N194: 1206 | O194: 0 | Q194: ="1,7,"&RC[2]&",0;"&"1,4,"&RC[4]&",0;" -> 1,7,7876,0;1,4,148115,0; | S194: =INT(((50+RC[-17]/10)*35+200)*12/4) -> 7876 | U194: =1000*110/100*(1+(50+RC[-19]/10)/200)*100 -> 148115
B195: 194 | C195: 0 | D195: 400194 | E195: 1,7,2787,0;1,4,1206,0; | G195: 1 | H195: 7 | I195: 2787 | J195: 0 | L195: 1 | M195: 4 | N195: 1206 | O195: 0 | Q195: ="1,7,"&RC[2]&",0;"&"1,4,"&RC[4]&",0;" -> 1,7,7887,0;1,4,148170,0; | S195: =INT(((50+RC[-17]/10)*35+200)*12/4) -> 7887 | U195: =1000*110/100*(1+(50+RC[-19]/10)/200)*100 -> 148170
B196: 195 | C196: 0 | D196: 400195 | E196: 1,7,2797,0;1,4,1207,0; | G196: 1 | H196: 7 | I196: 2797 | J196: 0 | L196: 1 | M196: 4 | N196: 1207 | O196: 0 | Q196: ="1,7,"&RC[2]&",0;"&"1,4,"&RC[4]&",0;" -> 1,7,7897,0;1,4,148225,0; | S196: =INT(((50+RC[-17]/10)*35+200)*12/4) -> 7897 | U196: =1000*110/100*(1+(50+RC[-19]/10)/200)*100 -> 148225
B197: 196 | C197: 0 | D197: 400196 | E197: 1,7,2808,0;1,4,1207,0; | G197: 1 | H197: 7 | I197: 2808 | J197: 0 | L197: 1 | M197: 4 | N197: 1207 | O197: 0 | Q197: ="1,7,"&RC[2]&",0;"&"1,4,"&RC[4]&",0;" -> 1,7,7908,0;1,4,148280,0; | S197: =INT(((50+RC[-17]/10)*35+200)*12/4) -> 7908 | U197: =1000*110/100*(1+(50+RC[-19]/10)/200)*100 -> 148280
B198: 197 | C198: 0 | D198: 400197 | E198: 1,7,2818,0;1,4,1208,0; | G198: 1 | H198: 7 | I198: 2818 | J198: 0 | L198: 1 | M198: 4 | N198: 1208 | O198: 0 | Q198: ="1,7,"&RC[2]&",0;"&"1,4,"&RC[4]&",0;" -> 1,7,7918,0;1,4,148335,0; | S198: =INT(((50+RC[-17]/10)*35+200)*12/4) -> 7918 | U198: =1000*110/100*(1+(50+RC[-19]/10)/200)*100 -> 148335
B199: 198 | C199: 0 | D199: 400198 | E199: 1,7,2829,0;1,4,1208,0; | G199: 1 | H199: 7 | I199: 2829 | J199: 0 | L199: 1 | M199: 4 | N199: 1208 | O199: 0 | Q199: ="1,7,"&RC[2]&",0;"&"1,4,"&RC[4]&",0;" -> 1,7,7929,0;1,4,148390,0; | S199: =INT(((50+RC[-17]/10)*35+200)*12/4) -> 7929 | U199: =1000*110/100*(1+(50+RC[-19]/10)/200)*100 -> 148390
B200: 199 | C200: 0 | D200: 400199 | E200: 1,7,2839,0;1,4,1209,0; | G200: 1 | H200: 7 | I200: 2839 | J200: 0 | L200: 1 | M200: 4 | N200: 1209 | O200: 0 | Q200: ="1,7,"&RC[2]&",0;"&"1,4,"&RC[4]&",0;" -> 1,7,7939,0;1,4,148445,0; | S200: =INT(((50+RC[-17]/10)*35+200)*12/4) -> 7939 | U200: =1000*110/100*(1+(50+RC[-19]/10)/200)*100 -> 148444.99999999997
B201: 200 | C201: 0 | D201: 400200 | E201: 1,7,2850,0;1,4,1210,0; | G201: 1 | H201: 7 | I201: 2850 | J201: 0 | L201: 1 | M201: 4 | N201: 1210 | O201: 0 | Q201: ="1,7,"&RC[2]&",0;"&"1,4,"&RC[4]&",0;" -> 1,7,7950,0;1,4,148500,0; | S201: =INT(((50+RC[-17]/10)*35+200)*12/4) -> 7950 | U201: =1000*110/100*(1+(50+RC[-19]/10)/200)*100 -> 148500
B202: 201 | C202: 0 | D202: 400201 | E202: 1,7,2860,0;1,4,1210,0; | G202: 1 | H202: 7 | I202: 2860 | J202: 0 | L202: 1 | M202: 4 | N202: 1210 | O202: 0 | Q202: ="1,7,"&RC[2]&",0;"&"1,4,"&RC[4]&",0;" -> 1,7,7960,0;1,4,148555,0; | S202: =INT(((50+RC[-17]/10)*35+200)*12/4) -> 7960 | U202: =1000*110/100*(1+(50+RC[-19]/10)/200)*100 -> 148555
B203: 202 | C203: 0 | D203: 400202 | E203: 1,7,2871,0;1,4,1211,0; | G203: 1 | H203: 7 | I203: 2871 | J203: 0 | L203: 1 | M203: 4 | N203: 1211 | O203: 0 | Q203: ="1,7,"&RC[2]&",0;"&"1,4,"&RC[4]&",0;" -> 1,7,7971,0;1,4,148610,0; | S203: =INT(((50+RC[-17]/10)*35+200)*12/4) -> 7971 | U203: =1000*110/100*(1+(50+RC[-19]/10)/200)*100 -> 148610
B204: 203 | C204: 0 | D204: 400203 | E204: 1,7,2881,0;1,4,1211,0; | G204: 1 | H204: 7 | I204: 2881 | J204: 0 | L204: 1 | M204: 4 | N204: 1211 | O204: 0 | Q204: ="1,7,"&RC[2]&",0;"&"1,4,"&RC[4]&",0;" -> 1,7,7981,0;1,4,148665,0; | S204: =INT(((50+RC[-17]/10)*35+200)*12/4) -> 7981 | U204: =1000*110/100*(1+(50+RC[-19]/10)/200)*100 -> 148665
B205: 204 | C205: 0 | D205: 400204 | E205: 1,7,2892,0;1,4,1212,0; | G205: 1 | H205: 7 | I205: 2892 | J205: 0 | L205: 1 | M205: 4 | N205: 1212 | O205: 0 | Q205: ="1,7,"&RC[2]&",0;"&"1,4,"&RC[4]&",0;" -> 1,7,7992,0;1,4,148720,0; | S205: =INT(((50+RC[-17]/10)*35+200)*12/4) -> 7992 | U205: =1000*110/100*(1+(50+RC[-19]/10)/200)*100 -> 148720
B206: 205 | C206: 0 | D206: 400205 | E206: 1,7,2902,0;1,4,1212,0; | G206: 1 | H206: 7 | I206: 2902 | J206: 0 | L206: 1 | M206: 4 | N206: 1212 | O206: 0 | Q206: ="1,7,"&RC[2]&",0;"&"1,4,"&RC[4]&",0;" -> 1,7,8002,0;1,4,148775,0; | S206: =INT(((50+RC[-17]/10)*35+200)*12/4) -> 8002 | U206: =1000*110/100*(1+(50+RC[-19]/10)/200)*100 -> 148775
B207: 206 | C207: 0 | D207: 400206 | E207: 1,7,2913,0;1,4,1213,0; | G207: 1 | H207: 7 | I207: 2913 | J207: 0 | L207: 1 | M207: 4 | N207: 1213 | O207: 0 | Q207: ="1,7,"&RC[2]&",0;"&"1,4,"&RC[4]&",0;" -> 1,7,8013,0;1,4,148830,0; | S207: =INT(((50+RC[-17]/10)*35+200)*12/4) -> 8013 | U207: =1000*110/100*(1+(50+RC[-19]/10)/200)*100 -> 148830
B208: 207 | C208: 0 | D208: 400207 | E208: 1,7,2923,0;1,4,1213,0; | G208: 1 | H208: 7 | I208: 2923 | J208: 0 | L208: 1 | M208: 4 | N208: 1213 | O208: 0 | Q208: ="1,7,"&RC[2]&",0;"&"1,4,"&RC[4]&",0;" -> 1,7,8023,0;1,4,148885,0; | S208: =INT(((50+RC[-17]/10)*35+200)*12/4) -> 8023 | U208: =1000*110/100*(1+(50+RC[-19]/10)/200)*100 -> 148885
B209: 208 | C209: 0 | D209: 400208 | E209: 1,7,2934,0;1,4,1214,0; | G209: 1 | H209: 7 | I209: 2934 | J209: 0 | L209: 1 | M209: 4 | N209: 1214 | O209: 0 | Q209: ="1,7,"&RC[2]&",0;"&"1,4,"&RC[4]&",0;" -> 1,7,8034,0;1,4,148940,0; | S209: =INT(((50+RC[-17]/10)*35+200)*12/4) -> 8034 | U209: =1000*110/100*(1+(50+RC[-19]/10)/200)*100 -> 148940
B210: 209 | C210: 0 | D210: 400209 | E210: 1,7,2944,0;1,4,1214,0; | G210: 1 | H210: 7 | I210: 2944 | J210: 0 | L210: 1 | M210: 4 | N210: 1214 | O210: 0 | Q210: ="1,7,"&RC[2]&",0;"&"1,4,"&RC[4]&",0;" -> 1,7,8044,0;1,4,148995,0; | S210: =INT(((50+RC[-17]/10)*35+200)*12/4) -> 8044 | U210: =1000*110/100*(1+(50+RC[-19]/10)/200)*100 -> 148995
B211: 210 | C211: 0 | D211: 400210 | E211: 1,7,2955,0;1,4,1215,0; | G211: 1 | H211: 7 | I211: 2955 | J211: 0 | L211: 1 | M211: 4 | N211: 1215 | O211: 0 | Q211: ="1,7,"&RC[2]&",0;"&"1,4,"&RC[4]&",0;" -> 1,7,8055,0;1,4,149050,0; | S211: =INT(((50+RC[-17]/10)*35+200)*12/4) -> 8055 | U211: =1000*110/100*(1+(50+RC[-19]/10)/200)*100 -> 149050
B212: 211 | C212: 0 | D212: 400211 | E212: 1,7,2965,0;1,4,1216,0; | G212: 1 | H212: 7 | I212: 2965 | J212: 0 | L212: 1 | M212: 4 | N212: 1216 | O212: 0 | Q212: ="1,7,"&RC[2]&",0;"&"1,4,"&RC[4]&",0;" -> 1,7,8065,0;1,4,149105,0; | S212: =INT(((50+RC[-17]/10)*35+200)*12/4) -> 8065 | U212: =1000*110/100*(1+(50+RC[-19]/10)/200)*100 -> 149105
B213: 212 | C213: 0 | D213: 400212 | E213: 1,7,2976,0;1,4,1216,0; | G213: 1 | H213: 7 | I213: 2976 | J213: 0 | L213: 1 | M213: 4 | N213: 1216 | O213: 0 | Q213: ="1,7,"&RC[2]&",0;"&"1,4,"&RC[4]&",0;" -> 1,7,8076,0;1,4,149160,0; | S213: =INT(((50+RC[-17]/10)*35+200)*12/4) -> 8076 | U213: =1000*110/100*(1+(50+RC[-19]/10)/200)*100 -> 149160
B214: 213 | C214: 0 | D214: 400213 | E214: 1,7,2986,0;1,4,1217,0; | G214: 1 | H214: 7 | I214: 2986 | J214: 0 | L214: 1 | M214: 4 | N214: 1217 | O214: 0 | Q214: ="1,7,"&RC[2]&",0;"&"1,4,"&RC[4]&",0;" -> 1,7,8086,0;1,4,149215,0; | S214: =INT(((50+RC[-17]/10)*35+200)*12/4) -> 8086 | U214: =1000*110/100*(1+(50+RC[-19]/10)/200)*100 -> 149215
B215: 214 | C215: 0 | D215: 400214 | E215: 1,7,2997,0;1,4,1217,0; | G215: 1 | H215: 7 | I215: 2997 | J215: 0 | L215: 1 | M215: 4 | N215: 1217 | O215: 0 | Q215: ="1,7,"&RC[2]&",0;"&"1,4,"&RC[4]&",0;" -> 1,7,8097,0;1,4,149270,0; | S215: =INT(((50+RC[-17]/10)*35+200)*12/4) -> 8097 | U215: =1000*110/100*(1+(50+RC[-19]/10)/200)*100 -> 149270
B216: 215 | C216: 0 | D216: 400215 | E216: 1,7,3007,0;1,4,1218,0; | G216: 1 | H216: 7 | I216: 3007 | J216: 0 | L216: 1 | M216: 4 | N216: 1218 | O216: 0 | Q216: ="1,7,"&RC[2]&",0;"&"1,4,"&RC[4]&",0;" -> 1,7,8107,0;1,4,149325,0; | S216: =INT(((50+RC[-17]/10)*35+200)*12/4) -> 8107 | U216: =1000*110/100*(1+(50+RC[-19]/10)/200)*100 -> 149325
B217: 216 | C217: 0 | D217: 400216 | E217: 1,7,3018,0;1,4,1218,0; | G217: 1 | H217: 7 | I217: 3018 | J217: 0 | L217: 1 | M217: 4 | N217: 1218 | O217: 0 | Q217: ="1,7,"&RC[2]&",0;"&"1,4,"&RC[4]&",0;" -> 1,7,8118,0;1,4,149380,0; | S217: =INT(((50+RC[-17]/10)*35+200)*12/4) -> 8118 | U217: =1000*110/100*(1+(50+RC[-19]/10)/200)*100 -> 149380.00000000003
B218: 217 | C218: 0 | D218: 400217 | E218: 1,7,3028,0;1,4,1219,0; | G218: 1 | H218: 7 | I218: 3028 | J218: 0 | L218: 1 | M218: 4 | N218: 1219 | O218: 0 | Q218: ="1,7,"&RC[2]&",0;"&"1,4,"&RC[4]&",0;" -> 1,7,8128,0;1,4,149435,0; | S218: =INT(((50+RC[-17]/10)*35+200)*12/4) -> 8128 | U218: =1000*110/100*(1+(50+RC[-19]/10)/200)*100 -> 149435
B219: 218 | C219: 0 | D219: 400218 | E219: 1,7,3039,0;1,4,1219,0; | G219: 1 | H219: 7 | I219: 3039 | J219: 0 | L219: 1 | M219: 4 | N219: 1219 | O219: 0 | Q219: ="1,7,"&RC[2]&",0;"&"1,4,"&RC[4]&",0;" -> 1,7,8139,0;1,4,149490,0; | S219: =INT(((50+RC[-17]/10)*35+200)*12/4) -> 8139 | U219: =1000*110/100*(1+(50+RC[-19]/10)/200)*100 -> 149490
B220: 219 | C220: 0 | D220: 400219 | E220: 1,7,3049,0;1,4,1220,0; | G220: 1 | H220: 7 | I220: 3049 | J220: 0 | L220: 1 | M220: 4 | N220: 1220 | O220: 0 | Q220: ="1,7,"&RC[2]&",0;"&"1,4,"&RC[4]&",0;" -> 1,7,8149,0;1,4,149545,0; | S220: =INT(((50+RC[-17]/10)*35+200)*12/4) -> 8149 | U220: =1000*110/100*(1+(50+RC[-19]/10)/200)*100 -> 149545.00000000003
B221: 220 | C221: 0 | D221: 400220 | E221: 1,7,3060,0;1,4,1221,0; | G221: 1 | H221: 7 | I221: 3060 | J221: 0 | L221: 1 | M221: 4 | N221: 1221 | O221: 0 | Q221: ="1,7,"&RC[2]&",0;"&"1,4,"&RC[4]&",0;" -> 1,7,8160,0;1,4,149600,0; | S221: =INT(((50+RC[-17]/10)*35+200)*12/4) -> 8160 | U221: =1000*110/100*(1+(50+RC[-19]/10)/200)*100 -> 149599.99999999997
B222: 221 | C222: 0 | D222: 400221 | E222: 1,7,3070,0;1,4,1221,0; | G222: 1 | H222: 7 | I222: 3070 | J222: 0 | L222: 1 | M222: 4 | N222: 1221 | O222: 0 | Q222: ="1,7,"&RC[2]&",0;"&"1,4,"&RC[4]&",0;" -> 1,7,8170,0;1,4,149655,0; | S222: =INT(((50+RC[-17]/10)*35+200)*12/4) -> 8170 | U222: =1000*110/100*(1+(50+RC[-19]/10)/200)*100 -> 149655
B223: 222 | C223: 0 | D223: 400222 | E223: 1,7,3081,0;1,4,1222,0; | G223: 1 | H223: 7 | I223: 3081 | J223: 0 | L223: 1 | M223: 4 | N223: 1222 | O223: 0 | Q223: ="1,7,"&RC[2]&",0;"&"1,4,"&RC[4]&",0;" -> 1,7,8181,0;1,4,149710,0; | S223: =INT(((50+RC[-17]/10)*35+200)*12/4) -> 8181 | U223: =1000*110/100*(1+(50+RC[-19]/10)/200)*100 -> 149710
B224: 223 | C224: 0 | D224: 400223 | E224: 1,7,3091,0;1,4,1222,0; | G224: 1 | H224: 7 | I224: 3091 | J224: 0 | L224: 1 | M224: 4 | N224: 1222 | O224: 0 | Q224: ="1,7,"&RC[2]&",0;"&"1,4,"&RC[4]&",0;" -> 1,7,8191,0;1,4,149765,0; | S224: =INT(((50+RC[-17]/10)*35+200)*12/4) -> 8191 | U224: =1000*110/100*(1+(50+RC[-19]/10)/200)*100 -> 149765
B225: 224 | C225: 0 | D225: 400224 | E225: 1,7,3102,0;1,4,1223,0; | G225: 1 | H225: 7 | I225: 3102 | J225: 0 | L225: 1 | M225: 4 | N225: 1223 | O225: 0 | Q225: ="1,7,"&RC[2]&",0;"&"1,4,"&RC[4]&",0;" -> 1,7,8202,0;1,4,149820,0; | S225: =INT(((50+RC[-17]/10)*35+200)*12/4) -> 8202 | U225: =1000*110/100*(1+(50+RC[-19]/10)/200)*100 -> 149820
B226: 225 | C226: 0 | D226: 400225 | E226: 1,7,3112,0;1,4,1223,0; | G226: 1 | H226: 7 | I226: 3112 | J226: 0 | L226: 1 | M226: 4 | N226: 1223 | O226: 0 | Q226: ="1,7,"&RC[2]&",0;"&"1,4,"&RC[4]&",0;" -> 1,7,8212,0;1,4,149875,0; | S226: =INT(((50+RC[-17]/10)*35+200)*12/4) -> 8212 | U226: =1000*110/100*(1+(50+RC[-19]/10)/200)*100 -> 149875
B227: 226 | C227: 0 | D227: 400226 | E227: 1,7,3123,0;1,4,1224,0; | G227: 1 | H227: 7 | I227: 3123 | J227: 0 | L227: 1 | M227: 4 | N227: 1224 | O227: 0 | Q227: ="1,7,"&RC[2]&",0;"&"1,4,"&RC[4]&",0;" -> 1,7,8223,0;1,4,149930,0; | S227: =INT(((50+RC[-17]/10)*35+200)*12/4) -> 8223 | U227: =1000*110/100*(1+(50+RC[-19]/10)/200)*100 -> 149930
B228: 227 | C228: 0 | D228: 400227 | E228: 1,7,3133,0;1,4,1224,0; | G228: 1 | H228: 7 | I228: 3133 | J228: 0 | L228: 1 | M228: 4 | N228: 1224 | O228: 0 | Q228: ="1,7,"&RC[2]&",0;"&"1,4,"&RC[4]&",0;" -> 1,7,8233,0;1,4,149985,0; | S228: =INT(((50+RC[-17]/10)*35+200)*12/4) -> 8233 | U228: =1000*110/100*(1+(50+RC[-19]/10)/200)*100 -> 149985
B229: 228 | C229: 0 | D229: 400228 | E229: 1,7,3144,0;1,4,1225,0; | G229: 1 | H229: 7 | I229: 3144 | J229: 0 | L229: 1 | M229: 4 | N229: 1225 | O229: 0 | Q229: ="1,7,"&RC[2]&",0;"&"1,4,"&RC[4]&",0;" -> 1,7,8244,0;1,4,150040,0; | S229: =INT(((50+RC[-17]/10)*35+200)*12/4) -> 8244 | U229: =1000*110/100*(1+(50+RC[-19]/10)/200)*100 -> 150040
B230: 229 | C230: 0 | D230: 400229 | E230: 1,7,3154,0;1,4,1225,0; | G230: 1 | H230: 7 | I230: 3154 | J230: 0 | L230: 1 | M230: 4 | N230: 1225 | O230: 0 | Q230: ="1,7,"&RC[2]&",0;"&"1,4,"&RC[4]&",0;" -> 1,7,8254,0;1,4,150095,0; | S230: =INT(((50+RC[-17]/10)*35+200)*12/4) -> 8254 | U230: =1000*110/100*(1+(50+RC[-19]/10)/200)*100 -> 150095
B231: 230 | C231: 0 | D231: 400230 | E231: 1,7,3165,0;1,4,1226,0; | G231: 1 | H231: 7 | I231: 3165 | J231: 0 | L231: 1 | M231: 4 | N231: 1226 | O231: 0 | Q231: ="1,7,"&RC[2]&",0;"&"1,4,"&RC[4]&",0;" -> 1,7,8265,0;1,4,150150,0; | S231: =INT(((50+RC[-17]/10)*35+200)*12/4) -> 8265 | U231: =1000*110/100*(1+(50+RC[-19]/10)/200)*100 -> 150150
B232: 231 | C232: 0 | D232: 400231 | E232: 1,7,3175,0;1,4,1227,0; | G232: 1 | H232: 7 | I232: 3175 | J232: 0 | L232: 1 | M232: 4 | N232: 1227 | O232: 0 | Q232: ="1,7,"&RC[2]&",0;"&"1,4,"&RC[4]&",0;" -> 1,7,8275,0;1,4,150205,0; | S232: =INT(((50+RC[-17]/10)*35+200)*12/4) -> 8275 | U232: =1000*110/100*(1+(50+RC[-19]/10)/200)*100 -> 150205
B233: 232 | C233: 0 | D233: 400232 | E233: 1,7,3186,0;1,4,1227,0; | G233: 1 | H233: 7 | I233: 3186 | J233: 0 | L233: 1 | M233: 4 | N233: 1227 | O233: 0 | Q233: ="1,7,"&RC[2]&",0;"&"1,4,"&RC[4]&",0;" -> 1,7,8286,0;1,4,150260,0; | S233: =INT(((50+RC[-17]/10)*35+200)*12/4) -> 8286 | U233: =1000*110/100*(1+(50+RC[-19]/10)/200)*100 -> 150260
B234: 233 | C234: 0 | D234: 400233 | E234: 1,7,3196,0;1,4,1228,0; | G234: 1 | H234: 7 | I234: 3196 | J234: 0 | L234: 1 | M234: 4 | N234: 1228 | O234: 0 | Q234: ="1,7,"&RC[2]&",0;"&"1,4,"&RC[4]&",0;" -> 1,7,8296,0;1,4,150315,0; | S234: =INT(((50+RC[-17]/10)*35+200)*12/4) -> 8296 | U234: =1000*110/100*(1+(50+RC[-19]/10)/200)*100 -> 150315
B235: 234 | C235: 0 | D235: 400234 | E235: 1,7,3207,0;1,4,1228,0; | G235: 1 | H235: 7 | I235: 3207 | J235: 0 | L235: 1 | M235: 4 | N235: 1228 | O235: 0 | Q235: ="1,7,"&RC[2]&",0;"&"1,4,"&RC[4]&",0;" -> 1,7,8307,0;1,4,150370,0; | S235: =INT(((50+RC[-17]/10)*35+200)*12/4) -> 8307 | U235: =1000*110/100*(1+(50+RC[-19]/10)/200)*100 -> 150370
B236: 235 | C236: 0 | D236: 400235 | E236: 1,7,3217,0;1,4,1229,0; | G236: 1 | H236: 7 | I236: 3217 | J236: 0 | L236: 1 | M236: 4 | N236: 1229 | O236: 0 | Q236: ="1,7,"&RC[2]&",0;"&"1,4,"&RC[4]&",0;" -> 1,7,8317,0;1,4,150425,0; | S236: =INT(((50+RC[-17]/10)*35+200)*12/4) -> 8317 | U236: =1000*110/100*(1+(50+RC[-19]/10)/200)*100 -> 150425
B237: 236 | C237: 0 | D237: 400236 | E237: 1,7,3228,0;1,4,1229,0; | G237: 1 | H237: 7 | I237: 3228 | J237: 0 | L237: 1 | M237: 4 | N237: 1229 | O237: 0 | Q237: ="1,7,"&RC[2]&",0;"&"1,4,"&RC[4]&",0;" -> 1,7,8328,0;1,4,150480,0; | S237: =INT(((50+RC[-17]/10)*35+200)*12/4) -> 8328 | U237: =1000*110/100*(1+(50+RC[-19]/10)/200)*100 -> 150480
B238: 237 | C238: 0 | D238: 400237 | E238: 1,7,3238,0;1,4,1230,0; | G238: 1 | H238: 7 | I238: 3238 | J238: 0 | L238: 1 | M238: 4 | N238: 1230 | O238: 0 | Q238: ="1,7,"&RC[2]&",0;"&"1,4,"&RC[4]&",0;" -> 1,7,8338,0;1,4,150535,0; | S238: =INT(((50+RC[-17]/10)*35+200)*12/4) -> 8338 | U238: =1000*110/100*(1+(50+RC[-19]/10)/200)*100 -> 150535
B239: 238 | C239: 0 | D239: 400238 | E239: 1,7,3249,0;1,4,1230,0; | G239: 1 | H239: 7 | I239: 3249 | J239: 0 | L239: 1 | M239: 4 | N239: 1230 | O239: 0 | Q239: ="1,7,"&RC[2]&",0;"&"1,4,"&RC[4]&",0;" -> 1,7,8349,0;1,4,150590,0; | S239: =INT(((50+RC[-17]/10)*35+200)*12/4) -> 8349 | U239: =1000*110/100*(1+(50+RC[-19]/10)/200)*100 -> 150590
B240: 239 | C240: 0 | D240: 400239 | E240: 1,7,3259,0;1,4,1231,0; | G240: 1 | H240: 7 | I240: 3259 | J240: 0 | L240: 1 | M240: 4 | N240: 1231 | O240: 0 | Q240: ="1,7,"&RC[2]&",0;"&"1,4,"&RC[4]&",0;" -> 1,7,8359,0;1,4,150645,0; | S240: =INT(((50+RC[-17]/10)*35+200)*12/4) -> 8359 | U240: =1000*110/100*(1+(50+RC[-19]/10)/200)*100 -> 150645
B241: 240 | C241: 0 | D241: 400240 | E241: 1,7,3270,0;1,4,1232,0; | G241: 1 | H241: 7 | I241: 3270 | J241: 0 | L241: 1 | M241: 4 | N241: 1232 | O241: 0 | Q241: ="1,7,"&RC[2]&",0;"&"1,4,"&RC[4]&",0;" -> 1,7,8370,0;1,4,150700,0; | S241: =INT(((50+RC[-17]/10)*35+200)*12/4) -> 8370 | U241: =1000*110/100*(1+(50+RC[-19]/10)/200)*100 -> 150700.00000000003
B242: 241 | C242: 0 | D242: 400241 | E242: 1,7,3280,0;1,4,1232,0; | G242: 1 | H242: 7 | I242: 3280 | J242: 0 | L242: 1 | M242: 4 | N242: 1232 | O242: 0 | Q242: ="1,7,"&RC[2]&",0;"&"1,4,"&RC[4]&",0;" -> 1,7,8380,0;1,4,150755,0; | S242: =INT(((50+RC[-17]/10)*35+200)*12/4) -> 8380 | U242: =1000*110/100*(1+(50+RC[-19]/10)/200)*100 -> 150755
B243: 242 | C243: 0 | D243: 400242 | E243: 1,7,3291,0;1,4,1233,0; | G243: 1 | H243: 7 | I243: 3291 | J243: 0 | L243: 1 | M243: 4 | N243: 1233 | O243: 0 | Q243: ="1,7,"&RC[2]&",0;"&"1,4,"&RC[4]&",0;" -> 1,7,8391,0;1,4,150810,0; | S243: =INT(((50+RC[-17]/10)*35+200)*12/4) -> 8391 | U243: =1000*110/100*(1+(50+RC[-19]/10)/200)*100 -> 150810
B244: 243 | C244: 0 | D244: 400243 | E244: 1,7,3301,0;1,4,1233,0; | G244: 1 | H244: 7 | I244: 3301 | J244: 0 | L244: 1 | M244: 4 | N244: 1233 | O244: 0 | Q244: ="1,7,"&RC[2]&",0;"&"1,4,"&RC[4]&",0;" -> 1,7,8401,0;1,4,150865,0; | S244: =INT(((50+RC[-17]/10)*35+200)*12/4) -> 8401 | U244: =1000*110/100*(1+(50+RC[-19]/10)/200)*100 -> 150865
B245: 244 | C245: 0 | D245: 400244 | E245: 1,7,3312,0;1,4,1234,0; | G245: 1 | H245: 7 | I245: 3312 | J245: 0 | L245: 1 | M245: 4 | N245: 1234 | O245: 0 | Q245: ="1,7,"&RC[2]&",0;"&"1,4,"&RC[4]&",0;" -> 1,7,8412,0;1,4,150920,0; | S245: =INT(((50+RC[-17]/10)*35+200)*12/4) -> 8412 | U245: =1000*110/100*(1+(50+RC[-19]/10)/200)*100 -> 150920
B246: 245 | C246: 0 | D246: 400245 | E246: 1,7,3322,0;1,4,1234,0; | G246: 1 | H246: 7 | I246: 3322 | J246: 0 | L246: 1 | M246: 4 | N246: 1234 | O246: 0 | Q246: ="1,7,"&RC[2]&",0;"&"1,4,"&RC[4]&",0;" -> 1,7,8422,0;1,4,150975,0; | S246: =INT(((50+RC[-17]/10)*35+200)*12/4) -> 8422 | U246: =1000*110/100*(1+(50+RC[-19]/10)/200)*100 -> 150975
B247: 246 | C247: 0 | D247: 400246 | E247: 1,7,3333,0;1,4,1235,0; | G247: 1 | H247: 7 | I247: 3333 | J247: 0 | L247: 1 | M247: 4 | N247: 1235 | O247: 0 | Q247: ="1,7,"&RC[2]&",0;"&"1,4,"&RC[4]&",0;" -> 1,7,8433,0;1,4,151030,0; | S247: =INT(((50+RC[-17]/10)*35+200)*12/4) -> 8433 | U247: =1000*110/100*(1+(50+RC[-19]/10)/200)*100 -> 151030
B248: 247 | C248: 0 | D248: 400247 | E248: 1,7,3343,0;1,4,1235,0; | G248: 1 | H248: 7 | I248: 3343 | J248: 0 | L248: 1 | M248: 4 | N248: 1235 | O248: 0 | Q248: ="1,7,"&RC[2]&",0;"&"1,4,"&RC[4]&",0;" -> 1,7,8443,0;1,4,151085,0; | S248: =INT(((50+RC[-17]/10)*35+200)*12/4) -> 8443 | U248: =1000*110/100*(1+(50+RC[-19]/10)/200)*100 -> 151085
B249: 248 | C249: 0 | D249: 400248 | E249: 1,7,3354,0;1,4,1236,0; | G249: 1 | H249: 7 | I249: 3354 | J249: 0 | L249: 1 | M249: 4 | N249: 1236 | O249: 0 | Q249: ="1,7,"&RC[2]&",0;"&"1,4,"&RC[4]&",0;" -> 1,7,8454,0;1,4,151140,0; | S249: =INT(((50+RC[-17]/10)*35+200)*12/4) -> 8454 | U249: =1000*110/100*(1+(50+RC[-19]/10)/200)*100 -> 151140
B250: 249 | C250: 0 | D250: 400249 | E250: 1,7,3364,0;1,4,1236,0; | G250: 1 | H250: 7 | I250: 3364 | J250: 0 | L250: 1 | M250: 4 | N250: 1236 | O250: 0 | Q250: ="1,7,"&RC[2]&",0;"&"1,4,"&RC[4]&",0;" -> 1,7,8464,0;1,4,151195,0; | S250: =INT(((50+RC[-17]/10)*35+200)*12/4) -> 8464 | U250: =1000*110/100*(1+(50+RC[-19]/10)/200)*100 -> 151195
B251: 250 | C251: 0 | D251: 400250 | E251: 1,7,3375,0;1,4,1237,0; | G251: 1 | H251: 7 | I251: 3375 | J251: 0 | L251: 1 | M251: 4 | N251: 1237 | O251: 0 | Q251: ="1,7,"&RC[2]&",0;"&"1,4,"&RC[4]&",0;" -> 1,7,8475,0;1,4,151250,0; | S251: =INT(((50+RC[-17]/10)*35+200)*12/4) -> 8475 | U251: =1000*110/100*(1+(50+RC[-19]/10)/200)*100 -> 151250
B252: 251 | C252: 0 | D252: 400251 | E252: 1,7,3385,0;1,4,1238,0; | G252: 1 | H252: 7 | I252: 3385 | J252: 0 | L252: 1 | M252: 4 | N252: 1238 | O252: 0 | Q252: ="1,7,"&RC[2]&",0;"&"1,4,"&RC[4]&",0;" -> 1,7,8485,0;1,4,151305,0; | S252: =INT(((50+RC[-17]/10)*35+200)*12/4) -> 8485 | U252: =1000*110/100*(1+(50+RC[-19]/10)/200)*100 -> 151305
B253: 252 | C253: 0 | D253: 400252 | E253: 1,7,3396,0;1,4,1238,0; | G253: 1 | H253: 7 | I253: 3396 | J253: 0 | L253: 1 | M253: 4 | N253: 1238 | O253: 0 | Q253: ="1,7,"&RC[2]&",0;"&"1,4,"&RC[4]&",0;" -> 1,7,8496,0;1,4,151360,0; | S253: =INT(((50+RC[-17]/10)*35+200)*12/4) -> 8496 | U253: =1000*110/100*(1+(50+RC[-19]/10)/200)*100 -> 151360
B254: 253 | C254: 0 | D254: 400253 | E254: 1,7,3406,0;1,4,1239,0; | G254: 1 | H254: 7 | I254: 3406 | J254: 0 | L254: 1 | M254: 4 | N254: 1239 | O254: 0 | Q254: ="1,7,"&RC[2]&",0;"&"1,4,"&RC[4]&",0;" -> 1,7,8506,0;1,4,151415,0; | S254: =INT(((50+RC[-17]/10)*35+200)*12/4) -> 8506 | U254: =1000*110/100*(1+(50+RC[-19]/10)/200)*100 -> 151415
B255: 254 | C255: 0 | D255: 400254 | E255: 1,7,3417,0;1,4,1239,0; | G255: 1 | H255: 7 | I255: 3417 | J255: 0 | L255: 1 | M255: 4 | N255: 1239 | O255: 0 | Q255: ="1,7,"&RC[2]&",0;"&"1,4,"&RC[4]&",0;" -> 1,7,8517,0;1,4,151470,0; | S255: =INT(((50+RC[-17]/10)*35+200)*12/4) -> 8517 | U255: =1000*110/100*(1+(50+RC[-19]/10)/200)*100 -> 151470
B256: 255 | C256: 0 | D256: 400255 | E256: 1,7,3427,0;1,4,1240,0; | G256: 1 | H256: 7 | I256: 3427 | J256: 0 | L256: 1 | M256: 4 | N256: 1240 | O256: 0 | Q256: ="1,7,"&RC[2]&",0;"&"1,4,"&RC[4]&",0;" -> 1,7,8527,0;1,4,151525,0; | S256: =INT(((50+RC[-17]/10)*35+200)*12/4) -> 8527 | U256: =1000*110/100*(1+(50+RC[-19]/10)/200)*100 -> 151525
B257: 256 | C257: 0 | D257: 400256 | E257: 1,7,3438,0;1,4,1240,0; | G257: 1 | H257: 7 | I257: 3438 | J257: 0 | L257: 1 | M257: 4 | N257: 1240 | O257: 0 | Q257: ="1,7,"&RC[2]&",0;"&"1,4,"&RC[4]&",0;" -> 1,7,8538,0;1,4,151580,0; | S257: =INT(((50+RC[-17]/10)*35+200)*12/4) -> 8538 | U257: =1000*110/100*(1+(50+RC[-19]/10)/200)*100 -> 151580
B258: 257 | C258: 0 | D258: 400257 | E258: 1,7,3448,0;1,4,1241,0; | G258: 1 | H258: 7 | I258: 3448 | J258: 0 | L258: 1 | M258: 4 | N258: 1241 | O258: 0 | Q258: ="1,7,"&RC[2]&",0;"&"1,4,"&RC[4]&",0;" -> 1,7,8548,0;1,4,151635,0; | S258: =INT(((50+RC[-17]/10)*35+200)*12/4) -> 8548 | U258: =1000*110/100*(1+(50+RC[-19]/10)/200)*100 -> 151635
B259: 258 | C259: 0 | D259: 400258 | E259: 1,7,3459,0;1,4,1241,0; | G259: 1 | H259: 7 | I259: 3459 | J259: 0 | L259: 1 | M259: 4 | N259: 1241 | O259: 0 | Q259: ="1,7,"&RC[2]&",0;"&"1,4,"&RC[4]&",0;" -> 1,7,8559,0;1,4,151690,0; | S259: =INT(((50+RC[-17]/10)*35+200)*12/4) -> 8559 | U259: =1000*110/100*(1+(50+RC[-19]/10)/200)*100 -> 151690
B260: 259 | C260: 0 | D260: 400259 | E260: 1,7,3469,0;1,4,1242,0; | G260: 1 | H260: 7 | I260: 3469 | J260: 0 | L260: 1 | M260: 4 | N260: 1242 | O260: 0 | Q260: ="1,7,"&RC[2]&",0;"&"1,4,"&RC[4]&",0;" -> 1,7,8569,0;1,4,151745,0; | S260: =INT(((50+RC[-17]/10)*35+200)*12/4) -> 8569 | U260: =1000*110/100*(1+(50+RC[-19]/10)/200)*100 -> 151745
B261: 260 | C261: 0 | D261: 400260 | E261: 1,7,3480,0;1,4,1243,0; | G261: 1 | H261: 7 | I261: 3480 | J261: 0 | L261: 1 | M261: 4 | N261: 1243 | O261: 0 | Q261: ="1,7,"&RC[2]&",0;"&"1,4,"&RC[4]&",0;" -> 1,7,8580,0;1,4,151800,0; | S261: =INT(((50+RC[-17]/10)*35+200)*12/4) -> 8580 | U261: =1000*110/100*(1+(50+RC[-19]/10)/200)*100 -> 151799.99999999997
B262: 261 | C262: 0 | D262: 400261 | E262: 1,7,3490,0;1,4,1243,0; | G262: 1 | H262: 7 | I262: 3490 | J262: 0 | L262: 1 | M262: 4 | N262: 1243 | O262: 0 | Q262: ="1,7,"&RC[2]&",0;"&"1,4,"&RC[4]&",0;" -> 1,7,8590,0;1,4,151855,0; | S262: =INT(((50+RC[-17]/10)*35+200)*12/4) -> 8590 | U262: =1000*110/100*(1+(50+RC[-19]/10)/200)*100 -> 151855
B263: 262 | C263: 0 | D263: 400262 | E263: 1,7,3501,0;1,4,1244,0; | G263: 1 | H263: 7 | I263: 3501 | J263: 0 | L263: 1 | M263: 4 | N263: 1244 | O263: 0 | Q263: ="1,7,"&RC[2]&",0;"&"1,4,"&RC[4]&",0;" -> 1,7,8601,0;1,4,151910,0; | S263: =INT(((50+RC[-17]/10)*35+200)*12/4) -> 8601 | U263: =1000*110/100*(1+(50+RC[-19]/10)/200)*100 -> 151910
B264: 263 | C264: 0 | D264: 400263 | E264: 1,7,3511,0;1,4,1244,0; | G264: 1 | H264: 7 | I264: 3511 | J264: 0 | L264: 1 | M264: 4 | N264: 1244 | O264: 0 | Q264: ="1,7,"&RC[2]&",0;"&"1,4,"&RC[4]&",0;" -> 1,7,8611,0;1,4,151965,0; | S264: =INT(((50+RC[-17]/10)*35+200)*12/4) -> 8611 | U264: =1000*110/100*(1+(50+RC[-19]/10)/200)*100 -> 151965
B265: 264 | C265: 0 | D265: 400264 | E265: 1,7,3522,0;1,4,1245,0; | G265: 1 | H265: 7 | I265: 3522 | J265: 0 | L265: 1 | M265: 4 | N265: 1245 | O265: 0 | Q265: ="1,7,"&RC[2]&",0;"&"1,4,"&RC[4]&",0;" -> 1,7,8622,0;1,4,152020,0; | S265: =INT(((50+RC[-17]/10)*35+200)*12/4) -> 8622 | U265: =1000*110/100*(1+(50+RC[-19]/10)/200)*100 -> 152020
B266: 265 | C266: 0 | D266: 400265 | E266: 1,7,3532,0;1,4,1245,0; | G266: 1 | H266: 7 | I266: 3532 | J266: 0 | L266: 1 | M266: 4 | N266: 1245 | O266: 0 | Q266: ="1,7,"&RC[2]&",0;"&"1,4,"&RC[4]&",0;" -> 1,7,8632,0;1,4,152075,0; | S266: =INT(((50+RC[-17]/10)*35+200)*12/4) -> 8632 | U266: =1000*110/100*(1+(50+RC[-19]/10)/200)*100 -> 152075
B267: 266 | C267: 0 | D267: 400266 | E267: 1,7,3543,0;1,4,1246,0; | G267: 1 | H267: 7 | I267: 3543 | J267: 0 | L267: 1 | M267: 4 | N267: 1246 | O267: 0 | Q267: ="1,7,"&RC[2]&",0;"&"1,4,"&RC[4]&",0;" -> 1,7,8643,0;1,4,152130,0; | S267: =INT(((50+RC[-17]/10)*35+200)*12/4) -> 8643 | U267: =1000*110/100*(1+(50+RC[-19]/10)/200)*100 -> 152130
B268: 267 | C268: 0 | D268: 400267 | E268: 1,7,3553,0;1,4,1246,0; | G268: 1 | H268: 7 | I268: 3553 | J268: 0 | L268: 1 | M268: 4 | N268: 1246 | O268: 0 | Q268: ="1,7,"&RC[2]&",0;"&"1,4,"&RC[4]&",0;" -> 1,7,8653,0;1,4,152185,0; | S268: =INT(((50+RC[-17]/10)*35+200)*12/4) -> 8653 | U268: =1000*110/100*(1+(50+RC[-19]/10)/200)*100 -> 152185
B269: 268 | C269: 0 | D269: 400268 | E269: 1,7,3564,0;1,4,1247,0; | G269: 1 | H269: 7 | I269: 3564 | J269: 0 | L269: 1 | M269: 4 | N269: 1247 | O269: 0 | Q269: ="1,7,"&RC[2]&",0;"&"1,4,"&RC[4]&",0;" -> 1,7,8664,0;1,4,152240,0; | S269: =INT(((50+RC[-17]/10)*35+200)*12/4) -> 8664 | U269: =1000*110/100*(1+(50+RC[-19]/10)/200)*100 -> 152240
B270: 269 | C270: 0 | D270: 400269 | E270: 1,7,3574,0;1,4,1247,0; | G270: 1 | H270: 7 | I270: 3574 | J270: 0 | L270: 1 | M270: 4 | N270: 1247 | O270: 0 | Q270: ="1,7,"&RC[2]&",0;"&"1,4,"&RC[4]&",0;" -> 1,7,8674,0;1,4,152295,0; | S270: =INT(((50+RC[-17]/10)*35+200)*12/4) -> 8674 | U270: =1000*110/100*(1+(50+RC[-19]/10)/200)*100 -> 152295
B271: 270 | C271: 0 | D271: 400270 | E271: 1,7,3585,0;1,4,1248,0; | G271: 1 | H271: 7 | I271: 3585 | J271: 0 | L271: 1 | M271: 4 | N271: 1248 | O271: 0 | Q271: ="1,7,"&RC[2]&",0;"&"1,4,"&RC[4]&",0;" -> 1,7,8685,0;1,4,152350,0; | S271: =INT(((50+RC[-17]/10)*35+200)*12/4) -> 8685 | U271: =1000*110/100*(1+(50+RC[-19]/10)/200)*100 -> 152350
B272: 271 | C272: 0 | D272: 400271 | E272: 1,7,3595,0;1,4,1249,0; | G272: 1 | H272: 7 | I272: 3595 | J272: 0 | L272: 1 | M272: 4 | N272: 1249 | O272: 0 | Q272: ="1,7,"&RC[2]&",0;"&"1,4,"&RC[4]&",0;" -> 1,7,8695,0;1,4,152405,0; | S272: =INT(((50+RC[-17]/10)*35+200)*12/4) -> 8695 | U272: =1000*110/100*(1+(50+RC[-19]/10)/200)*100 -> 152405
B273: 272 | C273: 0 | D273: 400272 | E273: 1,7,3606,0;1,4,1249,0; | G273: 1 | H273: 7 | I273: 3606 | J273: 0 | L273: 1 | M273: 4 | N273: 1249 | O273: 0 | Q273: ="1,7,"&RC[2]&",0;"&"1,4,"&RC[4]&",0;" -> 1,7,8706,0;1,4,152460,0; | S273: =INT(((50+RC[-17]/10)*35+200)*12/4) -> 8706 | U273: =1000*110/100*(1+(50+RC[-19]/10)/200)*100 -> 152460
B274: 273 | C274: 0 | D274: 400273 | E274: 1,7,3616,0;1,4,1250,0; | G274: 1 | H274: 7 | I274: 3616 | J274: 0 | L274: 1 | M274: 4 | N274: 1250 | O274: 0 | Q274: ="1,7,"&RC[2]&",0;"&"1,4,"&RC[4]&",0;" -> 1,7,8716,0;1,4,152515,0; | S274: =INT(((50+RC[-17]/10)*35+200)*12/4) -> 8716 | U274: =1000*110/100*(1+(50+RC[-19]/10)/200)*100 -> 152515
B275: 274 | C275: 0 | D275: 400274 | E275: 1,7,3627,0;1,4,1250,0; | G275: 1 | H275: 7 | I275: 3627 | J275: 0 | L275: 1 | M275: 4 | N275: 1250 | O275: 0 | Q275: ="1,7,"&RC[2]&",0;"&"1,4,"&RC[4]&",0;" -> 1,7,8727,0;1,4,152570,0; | S275: =INT(((50+RC[-17]/10)*35+200)*12/4) -> 8727 | U275: =1000*110/100*(1+(50+RC[-19]/10)/200)*100 -> 152570
B276: 275 | C276: 0 | D276: 400275 | E276: 1,7,3637,0;1,4,1251,0; | G276: 1 | H276: 7 | I276: 3637 | J276: 0 | L276: 1 | M276: 4 | N276: 1251 | O276: 0 | Q276: ="1,7,"&RC[2]&",0;"&"1,4,"&RC[4]&",0;" -> 1,7,8737,0;1,4,152625,0; | S276: =INT(((50+RC[-17]/10)*35+200)*12/4) -> 8737 | U276: =1000*110/100*(1+(50+RC[-19]/10)/200)*100 -> 152625
B277: 276 | C277: 0 | D277: 400276 | E277: 1,7,3648,0;1,4,1251,0; | G277: 1 | H277: 7 | I277: 3648 | J277: 0 | L277: 1 | M277: 4 | N277: 1251 | O277: 0 | Q277: ="1,7,"&RC[2]&",0;"&"1,4,"&RC[4]&",0;" -> 1,7,8748,0;1,4,152680,0; | S277: =INT(((50+RC[-17]/10)*35+200)*12/4) -> 8748 | U277: =1000*110/100*(1+(50+RC[-19]/10)/200)*100 -> 152680
B278: 277 | C278: 0 | D278: 400277 | E278: 1,7,3658,0;1,4,1252,0; | G278: 1 | H278: 7 | I278: 3658 | J278: 0 | L278: 1 | M278: 4 | N278: 1252 | O278: 0 | Q278: ="1,7,"&RC[2]&",0;"&"1,4,"&RC[4]&",0;" -> 1,7,8758,0;1,4,152735,0; | S278: =INT(((50+RC[-17]/10)*35+200)*12/4) -> 8758 | U278: =1000*110/100*(1+(50+RC[-19]/10)/200)*100 -> 152735
B279: 278 | C279: 0 | D279: 400278 | E279: 1,7,3669,0;1,4,1252,0; | G279: 1 | H279: 7 | I279: 3669 | J279: 0 | L279: 1 | M279: 4 | N279: 1252 | O279: 0 | Q279: ="1,7,"&RC[2]&",0;"&"1,4,"&RC[4]&",0;" -> 1,7,8769,0;1,4,152790,0; | S279: =INT(((50+RC[-17]/10)*35+200)*12/4) -> 8769 | U279: =1000*110/100*(1+(50+RC[-19]/10)/200)*100 -> 152790
B280: 279 | C280: 0 | D280: 400279 | E280: 1,7,3679,0;1,4,1253,0; | G280: 1 | H280: 7 | I280: 3679 | J280: 0 | L280: 1 | M280: 4 | N280: 1253 | O280: 0 | Q280: ="1,7,"&RC[2]&",0;"&"1,4,"&RC[4]&",0;" -> 1,7,8779,0;1,4,152845,0; | S280: =INT(((50+RC[-17]/10)*35+200)*12/4) -> 8779 | U280: =1000*110/100*(1+(50+RC[-19]/10)/200)*100 -> 152845
B281: 280 | C281: 0 | D281: 400280 | E281: 1,7,3690,0;1,4,1254,0; | G281: 1 | H281: 7 | I281: 3690 | J281: 0 | L281: 1 | M281: 4 | N281: 1254 | O281: 0 | Q281: ="1,7,"&RC[2]&",0;"&"1,4,"&RC[4]&",0;" -> 1,7,8790,0;1,4,152900,0; | S281: =INT(((50+RC[-17]/10)*35+200)*12/4) -> 8790 | U281: =1000*110/100*(1+(50+RC[-19]/10)/200)*100 -> 152900.00000000003
B282: 281 | C282: 0 | D282: 400281 | E282: 1,7,3700,0;1,4,1254,0; | G282: 1 | H282: 7 | I282: 3700 | J282: 0 | L282: 1 | M282: 4 | N282: 1254 | O282: 0 | Q282: ="1,7,"&RC[2]&",0;"&"1,4,"&RC[4]&",0;" -> 1,7,8800,0;1,4,152955,0; | S282: =INT(((50+RC[-17]/10)*35+200)*12/4) -> 8800 | U282: =1000*110/100*(1+(50+RC[-19]/10)/200)*100 -> 152954.99999999997
B283: 282 | C283: 0 | D283: 400282 | E283: 1,7,3711,0;1,4,1255,0; | G283: 1 | H283: 7 | I283: 3711 | J283: 0 | L283: 1 | M283: 4 | N283: 1255 | O283: 0 | Q283: ="1,7,"&RC[2]&",0;"&"1,4,"&RC[4]&",0;" -> 1,7,8811,0;1,4,153010,0; | S283: =INT(((50+RC[-17]/10)*35+200)*12/4) -> 8811 | U283: =1000*110/100*(1+(50+RC[-19]/10)/200)*100 -> 153010
B284: 283 | C284: 0 | D284: 400283 | E284: 1,7,3721,0;1,4,1255,0; | G284: 1 | H284: 7 | I284: 3721 | J284: 0 | L284: 1 | M284: 4 | N284: 1255 | O284: 0 | Q284: ="1,7,"&RC[2]&",0;"&"1,4,"&RC[4]&",0;" -> 1,7,8821,0;1,4,153065,0; | S284: =INT(((50+RC[-17]/10)*35+200)*12/4) -> 8821 | U284: =1000*110/100*(1+(50+RC[-19]/10)/200)*100 -> 153065
B285: 284 | C285: 0 | D285: 400284 | E285: 1,7,3732,0;1,4,1256,0; | G285: 1 | H285: 7 | I285: 3732 | J285: 0 | L285: 1 | M285: 4 | N285: 1256 | O285: 0 | Q285: ="1,7,"&RC[2]&",0;"&"1,4,"&RC[4]&",0;" -> 1,7,8832,0;1,4,153120,0; | S285: =INT(((50+RC[-17]/10)*35+200)*12/4) -> 8832 | U285: =1000*110/100*(1+(50+RC[-19]/10)/200)*100 -> 153119.99999999997
B286: 285 | C286: 0 | D286: 400285 | E286: 1,7,3742,0;1,4,1256,0; | G286: 1 | H286: 7 | I286: 3742 | J286: 0 | L286: 1 | M286: 4 | N286: 1256 | O286: 0 | Q286: ="1,7,"&RC[2]&",0;"&"1,4,"&RC[4]&",0;" -> 1,7,8842,0;1,4,153175,0; | S286: =INT(((50+RC[-17]/10)*35+200)*12/4) -> 8842 | U286: =1000*110/100*(1+(50+RC[-19]/10)/200)*100 -> 153175
B287: 286 | C287: 0 | D287: 400286 | E287: 1,7,3753,0;1,4,1257,0; | G287: 1 | H287: 7 | I287: 3753 | J287: 0 | L287: 1 | M287: 4 | N287: 1257 | O287: 0 | Q287: ="1,7,"&RC[2]&",0;"&"1,4,"&RC[4]&",0;" -> 1,7,8853,0;1,4,153230,0; | S287: =INT(((50+RC[-17]/10)*35+200)*12/4) -> 8853 | U287: =1000*110/100*(1+(50+RC[-19]/10)/200)*100 -> 153230
B288: 287 | C288: 0 | D288: 400287 | E288: 1,7,3763,0;1,4,1257,0; | G288: 1 | H288: 7 | I288: 3763 | J288: 0 | L288: 1 | M288: 4 | N288: 1257 | O288: 0 | Q288: ="1,7,"&RC[2]&",0;"&"1,4,"&RC[4]&",0;" -> 1,7,8863,0;1,4,153285,0; | S288: =INT(((50+RC[-17]/10)*35+200)*12/4) -> 8863 | U288: =1000*110/100*(1+(50+RC[-19]/10)/200)*100 -> 153285
B289: 288 | C289: 0 | D289: 400288 | E289: 1,7,3774,0;1,4,1258,0; | G289: 1 | H289: 7 | I289: 3774 | J289: 0 | L289: 1 | M289: 4 | N289: 1258 | O289: 0 | Q289: ="1,7,"&RC[2]&",0;"&"1,4,"&RC[4]&",0;" -> 1,7,8874,0;1,4,153340,0; | S289: =INT(((50+RC[-17]/10)*35+200)*12/4) -> 8874 | U289: =1000*110/100*(1+(50+RC[-19]/10)/200)*100 -> 153340
B290: 289 | C290: 0 | D290: 400289 | E290: 1,7,3784,0;1,4,1258,0; | G290: 1 | H290: 7 | I290: 3784 | J290: 0 | L290: 1 | M290: 4 | N290: 1258 | O290: 0 | Q290: ="1,7,"&RC[2]&",0;"&"1,4,"&RC[4]&",0;" -> 1,7,8884,0;1,4,153395,0; | S290: =INT(((50+RC[-17]/10)*35+200)*12/4) -> 8884 | U290: =1000*110/100*(1+(50+RC[-19]/10)/200)*100 -> 153395
B291: 290 | C291: 0 | D291: 400290 | E291: 1,7,3795,0;1,4,1259,0; | G291: 1 | H291: 7 | I291: 3795 | J291: 0 | L291: 1 | M291: 4 | N291: 1259 | O291: 0 | Q291: ="1,7,"&RC[2]&",0;"&"1,4,"&RC[4]&",0;" -> 1,7,8895,0;1,4,153450,0; | S291: =INT(((50+RC[-17]/10)*35+200)*12/4) -> 8895 | U291: =1000*110/100*(1+(50+RC[-19]/10)/200)*100 -> 153450
B292: 291 | C292: 0 | D292: 400291 | E292: 1,7,3805,0;1,4,1260,0; | G292: 1 | H292: 7 | I292: 3805 | J292: 0 | L292: 1 | M292: 4 | N292: 1260 | O292: 0 | Q292: ="1,7,"&RC[2]&",0;"&"1,4,"&RC[4]&",0;" -> 1,7,8905,0;1,4,153505,0; | S292: =INT(((50+RC[-17]/10)*35+200)*12/4) -> 8905 | U292: =1000*110/100*(1+(50+RC[-19]/10)/200)*100 -> 153505
B293: 292 | C293: 0 | D293: 400292 | E293: 1,7,3816,0;1,4,1260,0; | G293: 1 | H293: 7 | I293: 3816 | J293: 0 | L293: 1 | M293: 4 | N293: 1260 | O293: 0 | Q293: ="1,7,"&RC[2]&",0;"&"1,4,"&RC[4]&",0;" -> 1,7,8916,0;1,4,153560,0; | S293: =INT(((50+RC[-17]/10)*35+200)*12/4) -> 8916 | U293: =1000*110/100*(1+(50+RC[-19]/10)/200)*100 -> 153560
B294: 293 | C294: 0 | D294: 400293 | E294: 1,7,3826,0;1,4,1261,0; | G294: 1 | H294: 7 | I294: 3826 | J294: 0 | L294: 1 | M294: 4 | N294: 1261 | O294: 0 | Q294: ="1,7,"&RC[2]&",0;"&"1,4,"&RC[4]&",0;" -> 1,7,8926,0;1,4,153615,0; | S294: =INT(((50+RC[-17]/10)*35+200)*12/4) -> 8926 | U294: =1000*110/100*(1+(50+RC[-19]/10)/200)*100 -> 153615
B295: 294 | C295: 0 | D295: 400294 | E295: 1,7,3837,0;1,4,1261,0; | G295: 1 | H295: 7 | I295: 3837 | J295: 0 | L295: 1 | M295: 4 | N295: 1261 | O295: 0 | Q295: ="1,7,"&RC[2]&",0;"&"1,4,"&RC[4]&",0;" -> 1,7,8937,0;1,4,153670,0; | S295: =INT(((50+RC[-17]/10)*35+200)*12/4) -> 8937 | U295: =1000*110/100*(1+(50+RC[-19]/10)/200)*100 -> 153670
B296: 295 | C296: 0 | D296: 400295 | E296: 1,7,3847,0;1,4,1262,0; | G296: 1 | H296: 7 | I296: 3847 | J296: 0 | L296: 1 | M296: 4 | N296: 1262 | O296: 0 | Q296: ="1,7,"&RC[2]&",0;"&"1,4,"&RC[4]&",0;" -> 1,7,8947,0;1,4,153725,0; | S296: =INT(((50+RC[-17]/10)*35+200)*12/4) -> 8947 | U296: =1000*110/100*(1+(50+RC[-19]/10)/200)*100 -> 153725
B297: 296 | C297: 0 | D297: 400296 | E297: 1,7,3858,0;1,4,1262,0; | G297: 1 | H297: 7 | I297: 3858 | J297: 0 | L297: 1 | M297: 4 | N297: 1262 | O297: 0 | Q297: ="1,7,"&RC[2]&",0;"&"1,4,"&RC[4]&",0;" -> 1,7,8958,0;1,4,153780,0; | S297: =INT(((50+RC[-17]/10)*35+200)*12/4) -> 8958 | U297: =1000*110/100*(1+(50+RC[-19]/10)/200)*100 -> 153780
B298: 297 | C298: 0 | D298: 400297 | E298: 1,7,3868,0;1,4,1263,0; | G298: 1 | H298: 7 | I298: 3868 | J298: 0 | L298: 1 | M298: 4 | N298: 1263 | O298: 0 | Q298: ="1,7,"&RC[2]&",0;"&"1,4,"&RC[4]&",0;" -> 1,7,8968,0;1,4,153835,0; | S298: =INT(((50+RC[-17]/10)*35+200)*12/4) -> 8968 | U298: =1000*110/100*(1+(50+RC[-19]/10)/200)*100 -> 153835
B299: 298 | C299: 0 | D299: 400298 | E299: 1,7,3879,0;1,4,1263,0; | G299: 1 | H299: 7 | I299: 3879 | J299: 0 | L299: 1 | M299: 4 | N299: 1263 | O299: 0 | Q299: ="1,7,"&RC[2]&",0;"&"1,4,"&RC[4]&",0;" -> 1,7,8979,0;1,4,153890,0; | S299: =INT(((50+RC[-17]/10)*35+200)*12/4) -> 8979 | U299: =1000*110/100*(1+(50+RC[-19]/10)/200)*100 -> 153890
B300: 299 | C300: 0 | D300: 400299 | E300: 1,7,3889,0;1,4,1264,0; | G300: 1 | H300: 7 | I300: 3889 | J300: 0 | L300: 1 | M300: 4 | N300: 1264 | O300: 0 | Q300: ="1,7,"&RC[2]&",0;"&"1,4,"&RC[4]&",0;" -> 1,7,8989,0;1,4,153945,0; | S300: =INT(((50+RC[-17]/10)*35+200)*12/4) -> 8989 | U300: =1000*110/100*(1+(50+RC[-19]/10)/200)*100 -> 153945
B301: 300 | C301: 0 | D301: 400300 | E301: 1,7,3900,0;1,4,1265,0; | G301: 1 | H301: 7 | I301: 3900 | J301: 0 | L301: 1 | M301: 4 | N301: 1265 | O301: 0 | Q301: ="1,7,"&RC[2]&",0;"&"1,4,"&RC[4]&",0;" -> 1,7,9000,0;1,4,154000,0; | S301: =INT(((50+RC[-17]/10)*35+200)*12/4) -> 9000 | U301: =1000*110/100*(1+(50+RC[-19]/10)/200)*100 -> 154000
B302: 301 | C302: 0 | D302: 400301 | E302: 1,7,3910,0;1,4,1265,0; | G302: 1 | H302: 7 | I302: 3910 | J302: 0 | L302: 1 | M302: 4 | N302: 1265 | O302: 0 | Q302: ="1,7,"&RC[2]&",0;"&"1,4,"&RC[4]&",0;" -> 1,7,9010,0;1,4,154055,0; | S302: =INT(((50+RC[-17]/10)*35+200)*12/4) -> 9010 | U302: =1000*110/100*(1+(50+RC[-19]/10)/200)*100 -> 154055.00000000003
B303: 302 | C303: 0 | D303: 400302 | E303: 1,7,3921,0;1,4,1266,0; | G303: 1 | H303: 7 | I303: 3921 | J303: 0 | L303: 1 | M303: 4 | N303: 1266 | O303: 0 | Q303: ="1,7,"&RC[2]&",0;"&"1,4,"&RC[4]&",0;" -> 1,7,9021,0;1,4,154110,0; | S303: =INT(((50+RC[-17]/10)*35+200)*12/4) -> 9021 | U303: =1000*110/100*(1+(50+RC[-19]/10)/200)*100 -> 154110
B304: 303 | C304: 0 | D304: 400303 | E304: 1,7,3931,0;1,4,1266,0; | G304: 1 | H304: 7 | I304: 3931 | J304: 0 | L304: 1 | M304: 4 | N304: 1266 | O304: 0 | Q304: ="1,7,"&RC[2]&",0;"&"1,4,"&RC[4]&",0;" -> 1,7,9031,0;1,4,154165,0; | S304: =INT(((50+RC[-17]/10)*35+200)*12/4) -> 9031 | U304: =1000*110/100*(1+(50+RC[-19]/10)/200)*100 -> 154165
B305: 304 | C305: 0 | D305: 400304 | E305: 1,7,3942,0;1,4,1267,0; | G305: 1 | H305: 7 | I305: 3942 | J305: 0 | L305: 1 | M305: 4 | N305: 1267 | O305: 0 | Q305: ="1,7,"&RC[2]&",0;"&"1,4,"&RC[4]&",0;" -> 1,7,9042,0;1,4,154220,0; | S305: =INT(((50+RC[-17]/10)*35+200)*12/4) -> 9042 | U305: =1000*110/100*(1+(50+RC[-19]/10)/200)*100 -> 154220
B306: 305 | C306: 0 | D306: 400305 | E306: 1,7,3952,0;1,4,1267,0; | G306: 1 | H306: 7 | I306: 3952 | J306: 0 | L306: 1 | M306: 4 | N306: 1267 | O306: 0 | Q306: ="1,7,"&RC[2]&",0;"&"1,4,"&RC[4]&",0;" -> 1,7,9052,0;1,4,154275,0; | S306: =INT(((50+RC[-17]/10)*35+200)*12/4) -> 9052 | U306: =1000*110/100*(1+(50+RC[-19]/10)/200)*100 -> 154275
B307: 306 | C307: 0 | D307: 400306 | E307: 1,7,3963,0;1,4,1268,0; | G307: 1 | H307: 7 | I307: 3963 | J307: 0 | L307: 1 | M307: 4 | N307: 1268 | O307: 0 | Q307: ="1,7,"&RC[2]&",0;"&"1,4,"&RC[4]&",0;" -> 1,7,9063,0;1,4,154330,0; | S307: =INT(((50+RC[-17]/10)*35+200)*12/4) -> 9063 | U307: =1000*110/100*(1+(50+RC[-19]/10)/200)*100 -> 154330
B308: 307 | C308: 0 | D308: 400307 | E308: 1,7,3973,0;1,4,1268,0; | G308: 1 | H308: 7 | I308: 3973 | J308: 0 | L308: 1 | M308: 4 | N308: 1268 | O308: 0 | Q308: ="1,7,"&RC[2]&",0;"&"1,4,"&RC[4]&",0;" -> 1,7,9073,0;1,4,154385,0; | S308: =INT(((50+RC[-17]/10)*35+200)*12/4) -> 9073 | U308: =1000*110/100*(1+(50+RC[-19]/10)/200)*100 -> 154385
B309: 308 | C309: 0 | D309: 400308 | E309: 1,7,3984,0;1,4,1269,0; | G309: 1 | H309: 7 | I309: 3984 | J309: 0 | L309: 1 | M309: 4 | N309: 1269 | O309: 0 | Q309: ="1,7,"&RC[2]&",0;"&"1,4,"&RC[4]&",0;" -> 1,7,9084,0;1,4,154440,0; | S309: =INT(((50+RC[-17]/10)*35+200)*12/4) -> 9084 | U309: =1000*110/100*(1+(50+RC[-19]/10)/200)*100 -> 154440
B310: 309 | C310: 0 | D310: 400309 | E310: 1,7,3994,0;1,4,1269,0; | G310: 1 | H310: 7 | I310: 3994 | J310: 0 | L310: 1 | M310: 4 | N310: 1269 | O310: 0 | Q310: ="1,7,"&RC[2]&",0;"&"1,4,"&RC[4]&",0;" -> 1,7,9094,0;1,4,154495,0; | S310: =INT(((50+RC[-17]/10)*35+200)*12/4) -> 9094 | U310: =1000*110/100*(1+(50+RC[-19]/10)/200)*100 -> 154495
B311: 310 | C311: 0 | D311: 400310 | E311: 1,7,4005,0;1,4,1270,0; | G311: 1 | H311: 7 | I311: 4005 | J311: 0 | L311: 1 | M311: 4 | N311: 1270 | O311: 0 | Q311: ="1,7,"&RC[2]&",0;"&"1,4,"&RC[4]&",0;" -> 1,7,9105,0;1,4,154550,0; | S311: =INT(((50+RC[-17]/10)*35+200)*12/4) -> 9105 | U311: =1000*110/100*(1+(50+RC[-19]/10)/200)*100 -> 154550
B312: 311 | C312: 0 | D312: 400311 | E312: 1,7,4015,0;1,4,1271,0; | G312: 1 | H312: 7 | I312: 4015 | J312: 0 | L312: 1 | M312: 4 | N312: 1271 | O312: 0 | Q312: ="1,7,"&RC[2]&",0;"&"1,4,"&RC[4]&",0;" -> 1,7,9115,0;1,4,154605,0; | S312: =INT(((50+RC[-17]/10)*35+200)*12/4) -> 9115 | U312: =1000*110/100*(1+(50+RC[-19]/10)/200)*100 -> 154605
B313: 312 | C313: 0 | D313: 400312 | E313: 1,7,4026,0;1,4,1271,0; | G313: 1 | H313: 7 | I313: 4026 | J313: 0 | L313: 1 | M313: 4 | N313: 1271 | O313: 0 | Q313: ="1,7,"&RC[2]&",0;"&"1,4,"&RC[4]&",0;" -> 1,7,9126,0;1,4,154660,0; | S313: =INT(((50+RC[-17]/10)*35+200)*12/4) -> 9126 | U313: =1000*110/100*(1+(50+RC[-19]/10)/200)*100 -> 154660
B314: 313 | C314: 0 | D314: 400313 | E314: 1,7,4036,0;1,4,1272,0; | G314: 1 | H314: 7 | I314: 4036 | J314: 0 | L314: 1 | M314: 4 | N314: 1272 | O314: 0 | Q314: ="1,7,"&RC[2]&",0;"&"1,4,"&RC[4]&",0;" -> 1,7,9136,0;1,4,154715,0; | S314: =INT(((50+RC[-17]/10)*35+200)*12/4) -> 9136 | U314: =1000*110/100*(1+(50+RC[-19]/10)/200)*100 -> 154715
B315: 314 | C315: 0 | D315: 400314 | E315: 1,7,4047,0;1,4,1272,0; | G315: 1 | H315: 7 | I315: 4047 | J315: 0 | L315: 1 | M315: 4 | N315: 1272 | O315: 0 | Q315: ="1,7,"&RC[2]&",0;"&"1,4,"&RC[4]&",0;" -> 1,7,9147,0;1,4,154770,0; | S315: =INT(((50+RC[-17]/10)*35+200)*12/4) -> 9147 | U315: =1000*110/100*(1+(50+RC[-19]/10)/200)*100 -> 154770
B316: 315 | C316: 0 | D316: 400315 | E316: 1,7,4057,0;1,4,1273,0; | G316: 1 | H316: 7 | I316: 4057 | J316: 0 | L316: 1 | M316: 4 | N316: 1273 | O316: 0 | Q316: ="1,7,"&RC[2]&",0;"&"1,4,"&RC[4]&",0;" -> 1,7,9157,0;1,4,154825,0; | S316: =INT(((50+RC[-17]/10)*35+200)*12/4) -> 9157 | U316: =1000*110/100*(1+(50+RC[-19]/10)/200)*100 -> 154825
B317: 316 | C317: 0 | D317: 400316 | E317: 1,7,4068,0;1,4,1273,0; | G317: 1 | H317: 7 | I317: 4068 | J317: 0 | L317: 1 | M317: 4 | N317: 1273 | O317: 0 | Q317: ="1,7,"&RC[2]&",0;"&"1,4,"&RC[4]&",0;" -> 1,7,9168,0;1,4,154880,0; | S317: =INT(((50+RC[-17]/10)*35+200)*12/4) -> 9168 | U317: =1000*110/100*(1+(50+RC[-19]/10)/200)*100 -> 154880
B318: 317 | C318: 0 | D318: 400317 | E318: 1,7,4078,0;1,4,1274,0; | G318: 1 | H318: 7 | I318: 4078 | J318: 0 | L318: 1 | M318: 4 | N318: 1274 | O318: 0 | Q318: ="1,7,"&RC[2]&",0;"&"1,4,"&RC[4]&",0;" -> 1,7,9178,0;1,4,154935,0; | S318: =INT(((50+RC[-17]/10)*35+200)*12/4) -> 9178 | U318: =1000*110/100*(1+(50+RC[-19]/10)/200)*100 -> 154935
B319: 318 | C319: 0 | D319: 400318 | E319: 1,7,4089,0;1,4,1274,0; | G319: 1 | H319: 7 | I319: 4089 | J319: 0 | L319: 1 | M319: 4 | N319: 1274 | O319: 0 | Q319: ="1,7,"&RC[2]&",0;"&"1,4,"&RC[4]&",0;" -> 1,7,9189,0;1,4,154990,0; | S319: =INT(((50+RC[-17]/10)*35+200)*12/4) -> 9189 | U319: =1000*110/100*(1+(50+RC[-19]/10)/200)*100 -> 154990
B320: 319 | C320: 0 | D320: 400319 | E320: 1,7,4099,0;1,4,1275,0; | G320: 1 | H320: 7 | I320: 4099 | J320: 0 | L320: 1 | M320: 4 | N320: 1275 | O320: 0 | Q320: ="1,7,"&RC[2]&",0;"&"1,4,"&RC[4]&",0;" -> 1,7,9199,0;1,4,155045,0; | S320: =INT(((50+RC[-17]/10)*35+200)*12/4) -> 9199 | U320: =1000*110/100*(1+(50+RC[-19]/10)/200)*100 -> 155045
B321: 320 | C321: 0 | D321: 400320 | E321: 1,7,4110,0;1,4,1276,0; | G321: 1 | H321: 7 | I321: 4110 | J321: 0 | L321: 1 | M321: 4 | N321: 1276 | O321: 0 | Q321: ="1,7,"&RC[2]&",0;"&"1,4,"&RC[4]&",0;" -> 1,7,9210,0;1,4,155100,0; | S321: =INT(((50+RC[-17]/10)*35+200)*12/4) -> 9210 | U321: =1000*110/100*(1+(50+RC[-19]/10)/200)*100 -> 155100
B322: 321 | C322: 0 | D322: 400321 | E322: 1,7,4120,0;1,4,1276,0; | G322: 1 | H322: 7 | I322: 4120 | J322: 0 | L322: 1 | M322: 4 | N322: 1276 | O322: 0 | Q322: ="1,7,"&RC[2]&",0;"&"1,4,"&RC[4]&",0;" -> 1,7,9220,0;1,4,155155,0; | S322: =INT(((50+RC[-17]/10)*35+200)*12/4) -> 9220 | U322: =1000*110/100*(1+(50+RC[-19]/10)/200)*100 -> 155155
B323: 322 | C323: 0 | D323: 400322 | E323: 1,7,4131,0;1,4,1277,0; | G323: 1 | H323: 7 | I323: 4131 | J323: 0 | L323: 1 | M323: 4 | N323: 1277 | O323: 0 | Q323: ="1,7,"&RC[2]&",0;"&"1,4,"&RC[4]&",0;" -> 1,7,9231,0;1,4,155210,0; | S323: =INT(((50+RC[-17]/10)*35+200)*12/4) -> 9231 | U323: =1000*110/100*(1+(50+RC[-19]/10)/200)*100 -> 155210
B324: 323 | C324: 0 | D324: 400323 | E324: 1,7,4141,0;1,4,1277,0; | G324: 1 | H324: 7 | I324: 4141 | J324: 0 | L324: 1 | M324: 4 | N324: 1277 | O324: 0 | Q324: ="1,7,"&RC[2]&",0;"&"1,4,"&RC[4]&",0;" -> 1,7,9241,0;1,4,155265,0; | S324: =INT(((50+RC[-17]/10)*35+200)*12/4) -> 9241 | U324: =1000*110/100*(1+(50+RC[-19]/10)/200)*100 -> 155265
B325: 324 | C325: 0 | D325: 400324 | E325: 1,7,4152,0;1,4,1278,0; | G325: 1 | H325: 7 | I325: 4152 | J325: 0 | L325: 1 | M325: 4 | N325: 1278 | O325: 0 | Q325: ="1,7,"&RC[2]&",0;"&"1,4,"&RC[4]&",0;" -> 1,7,9252,0;1,4,155320,0; | S325: =INT(((50+RC[-17]/10)*35+200)*12/4) -> 9252 | U325: =1000*110/100*(1+(50+RC[-19]/10)/200)*100 -> 155319.99999999997
B326: 325 | C326: 0 | D326: 400325 | E326: 1,7,4162,0;1,4,1278,0; | G326: 1 | H326: 7 | I326: 4162 | J326: 0 | L326: 1 | M326: 4 | N326: 1278 | O326: 0 | Q326: ="1,7,"&RC[2]&",0;"&"1,4,"&RC[4]&",0;" -> 1,7,9262,0;1,4,155375,0; | S326: =INT(((50+RC[-17]/10)*35+200)*12/4) -> 9262 | U326: =1000*110/100*(1+(50+RC[-19]/10)/200)*100 -> 155375
B327: 326 | C327: 0 | D327: 400326 | E327: 1,7,4173,0;1,4,1279,0; | G327: 1 | H327: 7 | I327: 4173 | J327: 0 | L327: 1 | M327: 4 | N327: 1279 | O327: 0 | Q327: ="1,7,"&RC[2]&",0;"&"1,4,"&RC[4]&",0;" -> 1,7,9273,0;1,4,155430,0; | S327: =INT(((50+RC[-17]/10)*35+200)*12/4) -> 9273 | U327: =1000*110/100*(1+(50+RC[-19]/10)/200)*100 -> 155430
B328: 327 | C328: 0 | D328: 400327 | E328: 1,7,4183,0;1,4,1279,0; | G328: 1 | H328: 7 | I328: 4183 | J328: 0 | L328: 1 | M328: 4 | N328: 1279 | O328: 0 | Q328: ="1,7,"&RC[2]&",0;"&"1,4,"&RC[4]&",0;" -> 1,7,9283,0;1,4,155485,0; | S328: =INT(((50+RC[-17]/10)*35+200)*12/4) -> 9283 | U328: =1000*110/100*(1+(50+RC[-19]/10)/200)*100 -> 155485
B329: 328 | C329: 0 | D329: 400328 | E329: 1,7,4194,0;1,4,1280,0; | G329: 1 | H329: 7 | I329: 4194 | J329: 0 | L329: 1 | M329: 4 | N329: 1280 | O329: 0 | Q329: ="1,7,"&RC[2]&",0;"&"1,4,"&RC[4]&",0;" -> 1,7,9294,0;1,4,155540,0; | S329: =INT(((50+RC[-17]/10)*35+200)*12/4) -> 9294 | U329: =1000*110/100*(1+(50+RC[-19]/10)/200)*100 -> 155540
B330: 329 | C330: 0 | D330: 400329 | E330: 1,7,4204,0;1,4,1280,0; | G330: 1 | H330: 7 | I330: 4204 | J330: 0 | L330: 1 | M330: 4 | N330: 1280 | O330: 0 | Q330: ="1,7,"&RC[2]&",0;"&"1,4,"&RC[4]&",0;" -> 1,7,9304,0;1,4,155595,0; | S330: =INT(((50+RC[-17]/10)*35+200)*12/4) -> 9304 | U330: =1000*110/100*(1+(50+RC[-19]/10)/200)*100 -> 155595
B331: 330 | C331: 0 | D331: 400330 | E331: 1,7,4215,0;1,4,1281,0; | G331: 1 | H331: 7 | I331: 4215 | J331: 0 | L331: 1 | M331: 4 | N331: 1281 | O331: 0 | Q331: ="1,7,"&RC[2]&",0;"&"1,4,"&RC[4]&",0;" -> 1,7,9315,0;1,4,155650,0; | S331: =INT(((50+RC[-17]/10)*35+200)*12/4) -> 9315 | U331: =1000*110/100*(1+(50+RC[-19]/10)/200)*100 -> 155650
B332: 331 | C332: 0 | D332: 400331 | E332: 1,7,4225,0;1,4,1282,0; | G332: 1 | H332: 7 | I332: 4225 | J332: 0 | L332: 1 | M332: 4 | N332: 1282 | O332: 0 | Q332: ="1,7,"&RC[2]&",0;"&"1,4,"&RC[4]&",0;" -> 1,7,9325,0;1,4,155705,0; | S332: =INT(((50+RC[-17]/10)*35+200)*12/4) -> 9325 | U332: =1000*110/100*(1+(50+RC[-19]/10)/200)*100 -> 155705
B333: 332 | C333: 0 | D333: 400332 | E333: 1,7,4236,0;1,4,1282,0; | G333: 1 | H333: 7 | I333: 4236 | J333: 0 | L333: 1 | M333: 4 | N333: 1282 | O333: 0 | Q333: ="1,7,"&RC[2]&",0;"&"1,4,"&RC[4]&",0;" -> 1,7,9336,0;1,4,155760,0; | S333: =INT(((50+RC[-17]/10)*35+200)*12/4) -> 9336 | U333: =1000*110/100*(1+(50+RC[-19]/10)/200)*100 -> 155760
B334: 333 | C334: 0 | D334: 400333 | E334: 1,7,4246,0;1,4,1283,0; | G334: 1 | H334: 7 | I334: 4246 | J334: 0 | L334: 1 | M334: 4 | N334: 1283 | O334: 0 | Q334: ="1,7,"&RC[2]&",0;"&"1,4,"&RC[4]&",0;" -> 1,7,9346,0;1,4,155815,0; | S334: =INT(((50+RC[-17]/10)*35+200)*12/4) -> 9346 | U334: =1000*110/100*(1+(50+RC[-19]/10)/200)*100 -> 155815
B335: 334 | C335: 0 | D335: 400334 | E335: 1,7,4257,0;1,4,1283,0; | G335: 1 | H335: 7 | I335: 4257 | J335: 0 | L335: 1 | M335: 4 | N335: 1283 | O335: 0 | Q335: ="1,7,"&RC[2]&",0;"&"1,4,"&RC[4]&",0;" -> 1,7,9357,0;1,4,155870,0; | S335: =INT(((50+RC[-17]/10)*35+200)*12/4) -> 9357 | U335: =1000*110/100*(1+(50+RC[-19]/10)/200)*100 -> 155870
B336: 335 | C336: 0 | D336: 400335 | E336: 1,7,4267,0;1,4,1284,0; | G336: 1 | H336: 7 | I336: 4267 | J336: 0 | L336: 1 | M336: 4 | N336: 1284 | O336: 0 | Q336: ="1,7,"&RC[2]&",0;"&"1,4,"&RC[4]&",0;" -> 1,7,9367,0;1,4,155925,0; | S336: =INT(((50+RC[-17]/10)*35+200)*12/4) -> 9367 | U336: =1000*110/100*(1+(50+RC[-19]/10)/200)*100 -> 155925
B337: 336 | C337: 0 | D337: 400336 | E337: 1,7,4278,0;1,4,1284,0; | G337: 1 | H337: 7 | I337: 4278 | J337: 0 | L337: 1 | M337: 4 | N337: 1284 | O337: 0 | Q337: ="1,7,"&RC[2]&",0;"&"1,4,"&RC[4]&",0;" -> 1,7,9378,0;1,4,155980,0; | S337: =INT(((50+RC[-17]/10)*35+200)*12/4) -> 9378 | U337: =1000*110/100*(1+(50+RC[-19]/10)/200)*100 -> 155980
B338: 337 | C338: 0 | D338: 400337 | E338: 1,7,4288,0;1,4,1285,0; | G338: 1 | H338: 7 | I338: 4288 | J338: 0 | L338: 1 | M338: 4 | N338: 1285 | O338: 0 | Q338: ="1,7,"&RC[2]&",0;"&"1,4,"&RC[4]&",0;" -> 1,7,9388,0;1,4,156035,0; | S338: =INT(((50+RC[-17]/10)*35+200)*12/4) -> 9388 | U338: =1000*110/100*(1+(50+RC[-19]/10)/200)*100 -> 156035
B339: 338 | C339: 0 | D339: 400338 | E339: 1,7,4299,0;1,4,1285,0; | G339: 1 | H339: 7 | I339: 4299 | J339: 0 | L339: 1 | M339: 4 | N339: 1285 | O339: 0 | Q339: ="1,7,"&RC[2]&",0;"&"1,4,"&RC[4]&",0;" -> 1,7,9399,0;1,4,156090,0; | S339: =INT(((50+RC[-17]/10)*35+200)*12/4) -> 9399 | U339: =1000*110/100*(1+(50+RC[-19]/10)/200)*100 -> 156090
B340: 339 | C340: 0 | D340: 400339 | E340: 1,7,4309,0;1,4,1286,0; | G340: 1 | H340: 7 | I340: 4309 | J340: 0 | L340: 1 | M340: 4 | N340: 1286 | O340: 0 | Q340: ="1,7,"&RC[2]&",0;"&"1,4,"&RC[4]&",0;" -> 1,7,9409,0;1,4,156145,0; | S340: =INT(((50+RC[-17]/10)*35+200)*12/4) -> 9409 | U340: =1000*110/100*(1+(50+RC[-19]/10)/200)*100 -> 156145
B341: 340 | C341: 0 | D341: 400340 | E341: 1,7,4320,0;1,4,1287,0; | G341: 1 | H341: 7 | I341: 4320 | J341: 0 | L341: 1 | M341: 4 | N341: 1287 | O341: 0 | Q341: ="1,7,"&RC[2]&",0;"&"1,4,"&RC[4]&",0;" -> 1,7,9420,0;1,4,156200,0; | S341: =INT(((50+RC[-17]/10)*35+200)*12/4) -> 9420 | U341: =1000*110/100*(1+(50+RC[-19]/10)/200)*100 -> 156200
B342: 341 | C342: 0 | D342: 400341 | E342: 1,7,4330,0;1,4,1287,0; | G342: 1 | H342: 7 | I342: 4330 | J342: 0 | L342: 1 | M342: 4 | N342: 1287 | O342: 0 | Q342: ="1,7,"&RC[2]&",0;"&"1,4,"&RC[4]&",0;" -> 1,7,9430,0;1,4,156255,0; | S342: =INT(((50+RC[-17]/10)*35+200)*12/4) -> 9430 | U342: =1000*110/100*(1+(50+RC[-19]/10)/200)*100 -> 156255.00000000003
B343: 342 | C343: 0 | D343: 400342 | E343: 1,7,4341,0;1,4,1288,0; | G343: 1 | H343: 7 | I343: 4341 | J343: 0 | L343: 1 | M343: 4 | N343: 1288 | O343: 0 | Q343: ="1,7,"&RC[2]&",0;"&"1,4,"&RC[4]&",0;" -> 1,7,9441,0;1,4,156310,0; | S343: =INT(((50+RC[-17]/10)*35+200)*12/4) -> 9441 | U343: =1000*110/100*(1+(50+RC[-19]/10)/200)*100 -> 156310
B344: 343 | C344: 0 | D344: 400343 | E344: 1,7,4351,0;1,4,1288,0; | G344: 1 | H344: 7 | I344: 4351 | J344: 0 | L344: 1 | M344: 4 | N344: 1288 | O344: 0 | Q344: ="1,7,"&RC[2]&",0;"&"1,4,"&RC[4]&",0;" -> 1,7,9451,0;1,4,156365,0; | S344: =INT(((50+RC[-17]/10)*35+200)*12/4) -> 9451 | U344: =1000*110/100*(1+(50+RC[-19]/10)/200)*100 -> 156365
B345: 344 | C345: 0 | D345: 400344 | E345: 1,7,4362,0;1,4,1289,0; | G345: 1 | H345: 7 | I345: 4362 | J345: 0 | L345: 1 | M345: 4 | N345: 1289 | O345: 0 | Q345: ="1,7,"&RC[2]&",0;"&"1,4,"&RC[4]&",0;" -> 1,7,9462,0;1,4,156420,0; | S345: =INT(((50+RC[-17]/10)*35+200)*12/4) -> 9462 | U345: =1000*110/100*(1+(50+RC[-19]/10)/200)*100 -> 156420.00000000003
B346: 345 | C346: 0 | D346: 400345 | E346: 1,7,4372,0;1,4,1289,0; | G346: 1 | H346: 7 | I346: 4372 | J346: 0 | L346: 1 | M346: 4 | N346: 1289 | O346: 0 | Q346: ="1,7,"&RC[2]&",0;"&"1,4,"&RC[4]&",0;" -> 1,7,9472,0;1,4,156475,0; | S346: =INT(((50+RC[-17]/10)*35+200)*12/4) -> 9472 | U346: =1000*110/100*(1+(50+RC[-19]/10)/200)*100 -> 156474.99999999997
B347: 346 | C347: 0 | D347: 400346 | E347: 1,7,4383,0;1,4,1290,0; | G347: 1 | H347: 7 | I347: 4383 | J347: 0 | L347: 1 | M347: 4 | N347: 1290 | O347: 0 | Q347: ="1,7,"&RC[2]&",0;"&"1,4,"&RC[4]&",0;" -> 1,7,9483,0;1,4,156530,0; | S347: =INT(((50+RC[-17]/10)*35+200)*12/4) -> 9483 | U347: =1000*110/100*(1+(50+RC[-19]/10)/200)*100 -> 156530
B348: 347 | C348: 0 | D348: 400347 | E348: 1,7,4393,0;1,4,1290,0; | G348: 1 | H348: 7 | I348: 4393 | J348: 0 | L348: 1 | M348: 4 | N348: 1290 | O348: 0 | Q348: ="1,7,"&RC[2]&",0;"&"1,4,"&RC[4]&",0;" -> 1,7,9493,0;1,4,156585,0; | S348: =INT(((50+RC[-17]/10)*35+200)*12/4) -> 9493 | U348: =1000*110/100*(1+(50+RC[-19]/10)/200)*100 -> 156585
B349: 348 | C349: 0 | D349: 400348 | E349: 1,7,4404,0;1,4,1291,0; | G349: 1 | H349: 7 | I349: 4404 | J349: 0 | L349: 1 | M349: 4 | N349: 1291 | O349: 0 | Q349: ="1,7,"&RC[2]&",0;"&"1,4,"&RC[4]&",0;" -> 1,7,9504,0;1,4,156640,0; | S349: =INT(((50+RC[-17]/10)*35+200)*12/4) -> 9504 | U349: =1000*110/100*(1+(50+RC[-19]/10)/200)*100 -> 156640
B350: 349 | C350: 0 | D350: 400349 | E350: 1,7,4414,0;1,4,1291,0; | G350: 1 | H350: 7 | I350: 4414 | J350: 0 | L350: 1 | M350: 4 | N350: 1291 | O350: 0 | Q350: ="1,7,"&RC[2]&",0;"&"1,4,"&RC[4]&",0;" -> 1,7,9514,0;1,4,156695,0; | S350: =INT(((50+RC[-17]/10)*35+200)*12/4) -> 9514 | U350: =1000*110/100*(1+(50+RC[-19]/10)/200)*100 -> 156695
B351: 350 | C351: 0 | D351: 400350 | E351: 1,7,4425,0;1,4,1292,0; | G351: 1 | H351: 7 | I351: 4425 | J351: 0 | L351: 1 | M351: 4 | N351: 1292 | O351: 0 | Q351: ="1,7,"&RC[2]&",0;"&"1,4,"&RC[4]&",0;" -> 1,7,9525,0;1,4,156750,0; | S351: =INT(((50+RC[-17]/10)*35+200)*12/4) -> 9525 | U351: =1000*110/100*(1+(50+RC[-19]/10)/200)*100 -> 156750
B352: 351 | C352: 0 | D352: 400351 | E352: 1,7,4435,0;1,4,1293,0; | G352: 1 | H352: 7 | I352: 4435 | J352: 0 | L352: 1 | M352: 4 | N352: 1293 | O352: 0 | Q352: ="1,7,"&RC[2]&",0;"&"1,4,"&RC[4]&",0;" -> 1,7,9535,0;1,4,156805,0; | S352: =INT(((50+RC[-17]/10)*35+200)*12/4) -> 9535 | U352: =1000*110/100*(1+(50+RC[-19]/10)/200)*100 -> 156805
B353: 352 | C353: 0 | D353: 400352 | E353: 1,7,4446,0;1,4,1293,0; | G353: 1 | H353: 7 | I353: 4446 | J353: 0 | L353: 1 | M353: 4 | N353: 1293 | O353: 0 | Q353: ="1,7,"&RC[2]&",0;"&"1,4,"&RC[4]&",0;" -> 1,7,9546,0;1,4,156860,0; | S353: =INT(((50+RC[-17]/10)*35+200)*12/4) -> 9546 | U353: =1000*110/100*(1+(50+RC[-19]/10)/200)*100 -> 156860
B354: 353 | C354: 0 | D354: 400353 | E354: 1,7,4456,0;1,4,1294,0; | G354: 1 | H354: 7 | I354: 4456 | J354: 0 | L354: 1 | M354: 4 | N354: 1294 | O354: 0 | Q354: ="1,7,"&RC[2]&",0;"&"1,4,"&RC[4]&",0;" -> 1,7,9556,0;1,4,156915,0; | S354: =INT(((50+RC[-17]/10)*35+200)*12/4) -> 9556 | U354: =1000*110/100*(1+(50+RC[-19]/10)/200)*100 -> 156915
B355: 354 | C355: 0 | D355: 400354 | E355: 1,7,4467,0;1,4,1294,0; | G355: 1 | H355: 7 | I355: 4467 | J355: 0 | L355: 1 | M355: 4 | N355: 1294 | O355: 0 | Q355: ="1,7,"&RC[2]&",0;"&"1,4,"&RC[4]&",0;" -> 1,7,9567,0;1,4,156970,0; | S355: =INT(((50+RC[-17]/10)*35+200)*12/4) -> 9567 | U355: =1000*110/100*(1+(50+RC[-19]/10)/200)*100 -> 156970
B356: 355 | C356: 0 | D356: 400355 | E356: 1,7,4477,0;1,4,1295,0; | G356: 1 | H356: 7 | I356: 4477 | J356: 0 | L356: 1 | M356: 4 | N356: 1295 | O356: 0 | Q356: ="1,7,"&RC[2]&",0;"&"1,4,"&RC[4]&",0;" -> 1,7,9577,0;1,4,157025,0; | S356: =INT(((50+RC[-17]/10)*35+200)*12/4) -> 9577 | U356: =1000*110/100*(1+(50+RC[-19]/10)/200)*100 -> 157025
B357: 356 | C357: 0 | D357: 400356 | E357: 1,7,4488,0;1,4,1295,0; | G357: 1 | H357: 7 | I357: 4488 | J357: 0 | L357: 1 | M357: 4 | N357: 1295 | O357: 0 | Q357: ="1,7,"&RC[2]&",0;"&"1,4,"&RC[4]&",0;" -> 1,7,9588,0;1,4,157080,0; | S357: =INT(((50+RC[-17]/10)*35+200)*12/4) -> 9588 | U357: =1000*110/100*(1+(50+RC[-19]/10)/200)*100 -> 157080
B358: 357 | C358: 0 | D358: 400357 | E358: 1,7,4498,0;1,4,1296,0; | G358: 1 | H358: 7 | I358: 4498 | J358: 0 | L358: 1 | M358: 4 | N358: 1296 | O358: 0 | Q358: ="1,7,"&RC[2]&",0;"&"1,4,"&RC[4]&",0;" -> 1,7,9598,0;1,4,157135,0; | S358: =INT(((50+RC[-17]/10)*35+200)*12/4) -> 9598 | U358: =1000*110/100*(1+(50+RC[-19]/10)/200)*100 -> 157135
B359: 358 | C359: 0 | D359: 400358 | E359: 1,7,4509,0;1,4,1296,0; | G359: 1 | H359: 7 | I359: 4509 | J359: 0 | L359: 1 | M359: 4 | N359: 1296 | O359: 0 | Q359: ="1,7,"&RC[2]&",0;"&"1,4,"&RC[4]&",0;" -> 1,7,9609,0;1,4,157190,0; | S359: =INT(((50+RC[-17]/10)*35+200)*12/4) -> 9609 | U359: =1000*110/100*(1+(50+RC[-19]/10)/200)*100 -> 157190
B360: 359 | C360: 0 | D360: 400359 | E360: 1,7,4519,0;1,4,1297,0; | G360: 1 | H360: 7 | I360: 4519 | J360: 0 | L360: 1 | M360: 4 | N360: 1297 | O360: 0 | Q360: ="1,7,"&RC[2]&",0;"&"1,4,"&RC[4]&",0;" -> 1,7,9619,0;1,4,157245,0; | S360: =INT(((50+RC[-17]/10)*35+200)*12/4) -> 9619 | U360: =1000*110/100*(1+(50+RC[-19]/10)/200)*100 -> 157245
B361: 360 | C361: 0 | D361: 400360 | E361: 1,7,4530,0;1,4,1298,0; | G361: 1 | H361: 7 | I361: 4530 | J361: 0 | L361: 1 | M361: 4 | N361: 1298 | O361: 0 | Q361: ="1,7,"&RC[2]&",0;"&"1,4,"&RC[4]&",0;" -> 1,7,9630,0;1,4,157300,0; | S361: =INT(((50+RC[-17]/10)*35+200)*12/4) -> 9630 | U361: =1000*110/100*(1+(50+RC[-19]/10)/200)*100 -> 157300
B362: 361 | C362: 0 | D362: 400361 | E362: 1,7,4540,0;1,4,1298,0; | G362: 1 | H362: 7 | I362: 4540 | J362: 0 | L362: 1 | M362: 4 | N362: 1298 | O362: 0 | Q362: ="1,7,"&RC[2]&",0;"&"1,4,"&RC[4]&",0;" -> 1,7,9640,0;1,4,157355,0; | S362: =INT(((50+RC[-17]/10)*35+200)*12/4) -> 9640 | U362: =1000*110/100*(1+(50+RC[-19]/10)/200)*100 -> 157355
B363: 362 | C363: 0 | D363: 400362 | E363: 1,7,4551,0;1,4,1299,0; | G363: 1 | H363: 7 | I363: 4551 | J363: 0 | L363: 1 | M363: 4 | N363: 1299 | O363: 0 | Q363: ="1,7,"&RC[2]&",0;"&"1,4,"&RC[4]&",0;" -> 1,7,9651,0;1,4,157410,0; | S363: =INT(((50+RC[-17]/10)*35+200)*12/4) -> 9651 | U363: =1000*110/100*(1+(50+RC[-19]/10)/200)*100 -> 157410
B364: 363 | C364: 0 | D364: 400363 | E364: 1,7,4561,0;1,4,1299,0; | G364: 1 | H364: 7 | I364: 4561 | J364: 0 | L364: 1 | M364: 4 | N364: 1299 | O364: 0 | Q364: ="1,7,"&RC[2]&",0;"&"1,4,"&RC[4]&",0;" -> 1,7,9661,0;1,4,157465,0; | S364: =INT(((50+RC[-17]/10)*35+200)*12/4) -> 9661 | U364: =1000*110/100*(1+(50+RC[-19]/10)/200)*100 -> 157465
B365: 364 | C365: 0 | D365: 400364 | E365: 1,7,4572,0;1,4,1300,0; | G365: 1 | H365: 7 | I365: 4572 | J365: 0 | L365: 1 | M365: 4 | N365: 1300 | O365: 0 | Q365: ="1,7,"&RC[2]&",0;"&"1,4,"&RC[4]&",0;" -> 1,7,9672,0;1,4,157520,0; | S365: =INT(((50+RC[-17]/10)*35+200)*12/4) -> 9672 | U365: =1000*110/100*(1+(50+RC[-19]/10)/200)*100 -> 157520
B366: 365 | C366: 0 | D366: 400365 | E366: 1,7,4582,0;1,4,1300,0; | G366: 1 | H366: 7 | I366: 4582 | J366: 0 | L366: 1 | M366: 4 | N366: 1300 | O366: 0 | Q366: ="1,7,"&RC[2]&",0;"&"1,4,"&RC[4]&",0;" -> 1,7,9682,0;1,4,157575,0; | S366: =INT(((50+RC[-17]/10)*35+200)*12/4) -> 9682 | U366: =1000*110/100*(1+(50+RC[-19]/10)/200)*100 -> 157575.00000000003
B367: 366 | C367: 0 | D367: 400366 | E367: 1,7,4593,0;1,4,1301,0; | G367: 1 | H367: 7 | I367: 4593 | J367: 0 | L367: 1 | M367: 4 | N367: 1301 | O367: 0 | Q367: ="1,7,"&RC[2]&",0;"&"1,4,"&RC[4]&",0;" -> 1,7,9693,0;1,4,157630,0; | S367: =INT(((50+RC[-17]/10)*35+200)*12/4) -> 9693 | U367: =1000*110/100*(1+(50+RC[-19]/10)/200)*100 -> 157630
B368: 367 | C368: 0 | D368: 400367 | E368: 1,7,4603,0;1,4,1301,0; | G368: 1 | H368: 7 | I368: 4603 | J368: 0 | L368: 1 | M368: 4 | N368: 1301 | O368: 0 | Q368: ="1,7,"&RC[2]&",0;"&"1,4,"&RC[4]&",0;" -> 1,7,9703,0;1,4,157685,0; | S368: =INT(((50+RC[-17]/10)*35+200)*12/4) -> 9703 | U368: =1000*110/100*(1+(50+RC[-19]/10)/200)*100 -> 157685
B369: 368 | C369: 0 | D369: 400368 | E369: 1,7,4614,0;1,4,1302,0; | G369: 1 | H369: 7 | I369: 4614 | J369: 0 | L369: 1 | M369: 4 | N369: 1302 | O369: 0 | Q369: ="1,7,"&RC[2]&",0;"&"1,4,"&RC[4]&",0;" -> 1,7,9714,0;1,4,157740,0; | S369: =INT(((50+RC[-17]/10)*35+200)*12/4) -> 9714 | U369: =1000*110/100*(1+(50+RC[-19]/10)/200)*100 -> 157740
B370: 369 | C370: 0 | D370: 400369 | E370: 1,7,4624,0;1,4,1302,0; | G370: 1 | H370: 7 | I370: 4624 | J370: 0 | L370: 1 | M370: 4 | N370: 1302 | O370: 0 | Q370: ="1,7,"&RC[2]&",0;"&"1,4,"&RC[4]&",0;" -> 1,7,9724,0;1,4,157795,0; | S370: =INT(((50+RC[-17]/10)*35+200)*12/4) -> 9724 | U370: =1000*110/100*(1+(50+RC[-19]/10)/200)*100 -> 157795
B371: 370 | C371: 0 | D371: 400370 | E371: 1,7,4635,0;1,4,1303,0; | G371: 1 | H371: 7 | I371: 4635 | J371: 0 | L371: 1 | M371: 4 | N371: 1303 | O371: 0 | Q371: ="1,7,"&RC[2]&",0;"&"1,4,"&RC[4]&",0;" -> 1,7,9735,0;1,4,157850,0; | S371: =INT(((50+RC[-17]/10)*35+200)*12/4) -> 9735 | U371: =1000*110/100*(1+(50+RC[-19]/10)/200)*100 -> 157850
B372: 371 | C372: 0 | D372: 400371 | E372: 1,7,4645,0;1,4,1304,0; | G372: 1 | H372: 7 | I372: 4645 | J372: 0 | L372: 1 | M372: 4 | N372: 1304 | O372: 0 | Q372: ="1,7,"&RC[2]&",0;"&"1,4,"&RC[4]&",0;" -> 1,7,9745,0;1,4,157905,0; | S372: =INT(((50+RC[-17]/10)*35+200)*12/4) -> 9745 | U372: =1000*110/100*(1+(50+RC[-19]/10)/200)*100 -> 157905
B373: 372 | C373: 0 | D373: 400372 | E373: 1,7,4656,0;1,4,1304,0; | G373: 1 | H373: 7 | I373: 4656 | J373: 0 | L373: 1 | M373: 4 | N373: 1304 | O373: 0 | Q373: ="1,7,"&RC[2]&",0;"&"1,4,"&RC[4]&",0;" -> 1,7,9756,0;1,4,157960,0; | S373: =INT(((50+RC[-17]/10)*35+200)*12/4) -> 9756 | U373: =1000*110/100*(1+(50+RC[-19]/10)/200)*100 -> 157960
B374: 373 | C374: 0 | D374: 400373 | E374: 1,7,4666,0;1,4,1305,0; | G374: 1 | H374: 7 | I374: 4666 | J374: 0 | L374: 1 | M374: 4 | N374: 1305 | O374: 0 | Q374: ="1,7,"&RC[2]&",0;"&"1,4,"&RC[4]&",0;" -> 1,7,9766,0;1,4,158015,0; | S374: =INT(((50+RC[-17]/10)*35+200)*12/4) -> 9766 | U374: =1000*110/100*(1+(50+RC[-19]/10)/200)*100 -> 158015
B375: 374 | C375: 0 | D375: 400374 | E375: 1,7,4677,0;1,4,1305,0; | G375: 1 | H375: 7 | I375: 4677 | J375: 0 | L375: 1 | M375: 4 | N375: 1305 | O375: 0 | Q375: ="1,7,"&RC[2]&",0;"&"1,4,"&RC[4]&",0;" -> 1,7,9777,0;1,4,158070,0; | S375: =INT(((50+RC[-17]/10)*35+200)*12/4) -> 9777 | U375: =1000*110/100*(1+(50+RC[-19]/10)/200)*100 -> 158070
B376: 375 | C376: 0 | D376: 400375 | E376: 1,7,4687,0;1,4,1306,0; | G376: 1 | H376: 7 | I376: 4687 | J376: 0 | L376: 1 | M376: 4 | N376: 1306 | O376: 0 | Q376: ="1,7,"&RC[2]&",0;"&"1,4,"&RC[4]&",0;" -> 1,7,9787,0;1,4,158125,0; | S376: =INT(((50+RC[-17]/10)*35+200)*12/4) -> 9787 | U376: =1000*110/100*(1+(50+RC[-19]/10)/200)*100 -> 158125
B377: 376 | C377: 0 | D377: 400376 | E377: 1,7,4698,0;1,4,1306,0; | G377: 1 | H377: 7 | I377: 4698 | J377: 0 | L377: 1 | M377: 4 | N377: 1306 | O377: 0 | Q377: ="1,7,"&RC[2]&",0;"&"1,4,"&RC[4]&",0;" -> 1,7,9798,0;1,4,158180,0; | S377: =INT(((50+RC[-17]/10)*35+200)*12/4) -> 9798 | U377: =1000*110/100*(1+(50+RC[-19]/10)/200)*100 -> 158180
B378: 377 | C378: 0 | D378: 400377 | E378: 1,7,4708,0;1,4,1307,0; | G378: 1 | H378: 7 | I378: 4708 | J378: 0 | L378: 1 | M378: 4 | N378: 1307 | O378: 0 | Q378: ="1,7,"&RC[2]&",0;"&"1,4,"&RC[4]&",0;" -> 1,7,9808,0;1,4,158235,0; | S378: =INT(((50+RC[-17]/10)*35+200)*12/4) -> 9808 | U378: =1000*110/100*(1+(50+RC[-19]/10)/200)*100 -> 158235
B379: 378 | C379: 0 | D379: 400378 | E379: 1,7,4719,0;1,4,1307,0; | G379: 1 | H379: 7 | I379: 4719 | J379: 0 | L379: 1 | M379: 4 | N379: 1307 | O379: 0 | Q379: ="1,7,"&RC[2]&",0;"&"1,4,"&RC[4]&",0;" -> 1,7,9819,0;1,4,158290,0; | S379: =INT(((50+RC[-17]/10)*35+200)*12/4) -> 9819 | U379: =1000*110/100*(1+(50+RC[-19]/10)/200)*100 -> 158290
B380: 379 | C380: 0 | D380: 400379 | E380: 1,7,4729,0;1,4,1308,0; | G380: 1 | H380: 7 | I380: 4729 | J380: 0 | L380: 1 | M380: 4 | N380: 1308 | O380: 0 | Q380: ="1,7,"&RC[2]&",0;"&"1,4,"&RC[4]&",0;" -> 1,7,9829,0;1,4,158345,0; | S380: =INT(((50+RC[-17]/10)*35+200)*12/4) -> 9829 | U380: =1000*110/100*(1+(50+RC[-19]/10)/200)*100 -> 158345
B381: 380 | C381: 0 | D381: 400380 | E381: 1,7,4740,0;1,4,1309,0; | G381: 1 | H381: 7 | I381: 4740 | J381: 0 | L381: 1 | M381: 4 | N381: 1309 | O381: 0 | Q381: ="1,7,"&RC[2]&",0;"&"1,4,"&RC[4]&",0;" -> 1,7,9840,0;1,4,158400,0; | S381: =INT(((50+RC[-17]/10)*35+200)*12/4) -> 9840 | U381: =1000*110/100*(1+(50+RC[-19]/10)/200)*100 -> 158400
B382: 381 | C382: 0 | D382: 400381 | E382: 1,7,4750,0;1,4,1309,0; | G382: 1 | H382: 7 | I382: 4750 | J382: 0 | L382: 1 | M382: 4 | N382: 1309 | O382: 0 | Q382: ="1,7,"&RC[2]&",0;"&"1,4,"&RC[4]&",0;" -> 1,7,9850,0;1,4,158455,0; | S382: =INT(((50+RC[-17]/10)*35+200)*12/4) -> 9850 | U382: =1000*110/100*(1+(50+RC[-19]/10)/200)*100 -> 158455
B383: 382 | C383: 0 | D383: 400382 | E383: 1,7,4761,0;1,4,1310,0; | G383: 1 | H383: 7 | I383: 4761 | J383: 0 | L383: 1 | M383: 4 | N383: 1310 | O383: 0 | Q383: ="1,7,"&RC[2]&",0;"&"1,4,"&RC[4]&",0;" -> 1,7,9861,0;1,4,158510,0; | S383: =INT(((50+RC[-17]/10)*35+200)*12/4) -> 9861 | U383: =1000*110/100*(1+(50+RC[-19]/10)/200)*100 -> 158510
B384: 383 | C384: 0 | D384: 400383 | E384: 1,7,4771,0;1,4,1310,0; | G384: 1 | H384: 7 | I384: 4771 | J384: 0 | L384: 1 | M384: 4 | N384: 1310 | O384: 0 | Q384: ="1,7,"&RC[2]&",0;"&"1,4,"&RC[4]&",0;" -> 1,7,9871,0;1,4,158565,0; | S384: =INT(((50+RC[-17]/10)*35+200)*12/4) -> 9871 | U384: =1000*110/100*(1+(50+RC[-19]/10)/200)*100 -> 158565
B385: 384 | C385: 0 | D385: 400384 | E385: 1,7,4782,0;1,4,1311,0; | G385: 1 | H385: 7 | I385: 4782 | J385: 0 | L385: 1 | M385: 4 | N385: 1311 | O385: 0 | Q385: ="1,7,"&RC[2]&",0;"&"1,4,"&RC[4]&",0;" -> 1,7,9882,0;1,4,158620,0; | S385: =INT(((50+RC[-17]/10)*35+200)*12/4) -> 9882 | U385: =1000*110/100*(1+(50+RC[-19]/10)/200)*100 -> 158620
B386: 385 | C386: 0 | D386: 400385 | E386: 1,7,4792,0;1,4,1311,0; | G386: 1 | H386: 7 | I386: 4792 | J386: 0 | L386: 1 | M386: 4 | N386: 1311 | O386: 0 | Q386: ="1,7,"&RC[2]&",0;"&"1,4,"&RC[4]&",0;" -> 1,7,9892,0;1,4,158675,0; | S386: =INT(((50+RC[-17]/10)*35+200)*12/4) -> 9892 | U386: =1000*110/100*(1+(50+RC[-19]/10)/200)*100 -> 158674.99999999997
B387: 386 | C387: 0 | D387: 400386 | E387: 1,7,4803,0;1,4,1312,0; | G387: 1 | H387: 7 | I387: 4803 | J387: 0 | L387: 1 | M387: 4 | N387: 1312 | O387: 0 | Q387: ="1,7,"&RC[2]&",0;"&"1,4,"&RC[4]&",0;" -> 1,7,9903,0;1,4,158730,0; | S387: =INT(((50+RC[-17]/10)*35+200)*12/4) -> 9903 | U387: =1000*110/100*(1+(50+RC[-19]/10)/200)*100 -> 158730
B388: 387 | C388: 0 | D388: 400387 | E388: 1,7,4813,0;1,4,1312,0; | G388: 1 | H388: 7 | I388: 4813 | J388: 0 | L388: 1 | M388: 4 | N388: 1312 | O388: 0 | Q388: ="1,7,"&RC[2]&",0;"&"1,4,"&RC[4]&",0;" -> 1,7,9913,0;1,4,158785,0; | S388: =INT(((50+RC[-17]/10)*35+200)*12/4) -> 9913 | U388: =1000*110/100*(1+(50+RC[-19]/10)/200)*100 -> 158785
B389: 388 | C389: 0 | D389: 400388 | E389: 1,7,4824,0;1,4,1313,0; | G389: 1 | H389: 7 | I389: 4824 | J389: 0 | L389: 1 | M389: 4 | N389: 1313 | O389: 0 | Q389: ="1,7,"&RC[2]&",0;"&"1,4,"&RC[4]&",0;" -> 1,7,9924,0;1,4,158840,0; | S389: =INT(((50+RC[-17]/10)*35+200)*12/4) -> 9924 | U389: =1000*110/100*(1+(50+RC[-19]/10)/200)*100 -> 158840
B390: 389 | C390: 0 | D390: 400389 | E390: 1,7,4834,0;1,4,1313,0; | G390: 1 | H390: 7 | I390: 4834 | J390: 0 | L390: 1 | M390: 4 | N390: 1313 | O390: 0 | Q390: ="1,7,"&RC[2]&",0;"&"1,4,"&RC[4]&",0;" -> 1,7,9934,0;1,4,158895,0; | S390: =INT(((50+RC[-17]/10)*35+200)*12/4) -> 9934 | U390: =1000*110/100*(1+(50+RC[-19]/10)/200)*100 -> 158895
B391: 390 | C391: 0 | D391: 400390 | E391: 1,7,4845,0;1,4,1314,0; | G391: 1 | H391: 7 | I391: 4845 | J391: 0 | L391: 1 | M391: 4 | N391: 1314 | O391: 0 | Q391: ="1,7,"&RC[2]&",0;"&"1,4,"&RC[4]&",0;" -> 1,7,9945,0;1,4,158950,0; | S391: =INT(((50+RC[-17]/10)*35+200)*12/4) -> 9945 | U391: =1000*110/100*(1+(50+RC[-19]/10)/200)*100 -> 158950
B392: 391 | C392: 0 | D392: 400391 | E392: 1,7,4855,0;1,4,1315,0; | G392: 1 | H392: 7 | I392: 4855 | J392: 0 | L392: 1 | M392: 4 | N392: 1315 | O392: 0 | Q392: ="1,7,"&RC[2]&",0;"&"1,4,"&RC[4]&",0;" -> 1,7,9955,0;1,4,159005,0; | S392: =INT(((50+RC[-17]/10)*35+200)*12/4) -> 9955 | U392: =1000*110/100*(1+(50+RC[-19]/10)/200)*100 -> 159005
B393: 392 | C393: 0 | D393: 400392 | E393: 1,7,4866,0;1,4,1315,0; | G393: 1 | H393: 7 | I393: 4866 | J393: 0 | L393: 1 | M393: 4 | N393: 1315 | O393: 0 | Q393: ="1,7,"&RC[2]&",0;"&"1,4,"&RC[4]&",0;" -> 1,7,9966,0;1,4,159060,0; | S393: =INT(((50+RC[-17]/10)*35+200)*12/4) -> 9966 | U393: =1000*110/100*(1+(50+RC[-19]/10)/200)*100 -> 159060
B394: 393 | C394: 0 | D394: 400393 | E394: 1,7,4876,0;1,4,1316,0; | G394: 1 | H394: 7 | I394: 4876 | J394: 0 | L394: 1 | M394: 4 | N394: 1316 | O394: 0 | Q394: ="1,7,"&RC[2]&",0;"&"1,4,"&RC[4]&",0;" -> 1,7,9976,0;1,4,159115,0; | S394: =INT(((50+RC[-17]/10)*35+200)*12/4) -> 9976 | U394: =1000*110/100*(1+(50+RC[-19]/10)/200)*100 -> 159115
B395: 394 | C395: 0 | D395: 400394 | E395: 1,7,4887,0;1,4,1316,0; | G395: 1 | H395: 7 | I395: 4887 | J395: 0 | L395: 1 | M395: 4 | N395: 1316 | O395: 0 | Q395: ="1,7,"&RC[2]&",0;"&"1,4,"&RC[4]&",0;" -> 1,7,9987,0;1,4,159170,0; | S395: =INT(((50+RC[-17]/10)*35+200)*12/4) -> 9987 | U395: =1000*110/100*(1+(50+RC[-19]/10)/200)*100 -> 159170
B396: 395 | C396: 0 | D396: 400395 | E396: 1,7,4897,0;1,4,1317,0; | G396: 1 | H396: 7 | I396: 4897 | J396: 0 | L396: 1 | M396: 4 | N396: 1317 | O396: 0 | Q396: ="1,7,"&RC[2]&",0;"&"1,4,"&RC[4]&",0;" -> 1,7,9997,0;1,4,159225,0; | S396: =INT(((50+RC[-17]/10)*35+200)*12/4) -> 9997 | U396: =1000*110/100*(1+(50+RC[-19]/10)/200)*100 -> 159225
B397: 396 | C397: 0 | D397: 400396 | E397: 1,7,4908,0;1,4,1317,0; | G397: 1 | H397: 7 | I397: 4908 | J397: 0 | L397: 1 | M397: 4 | N397: 1317 | O397: 0 | Q397: ="1,7,"&RC[2]&",0;"&"1,4,"&RC[4]&",0;" -> 1,7,10008,0;1,4,159280,0; | S397: =INT(((50+RC[-17]/10)*35+200)*12/4) -> 10008 | U397: =1000*110/100*(1+(50+RC[-19]/10)/200)*100 -> 159280
B398: 397 | C398: 0 | D398: 400397 | E398: 1,7,4918,0;1,4,1318,0; | G398: 1 | H398: 7 | I398: 4918 | J398: 0 | L398: 1 | M398: 4 | N398: 1318 | O398: 0 | Q398: ="1,7,"&RC[2]&",0;"&"1,4,"&RC[4]&",0;" -> 1,7,10018,0;1,4,159335,0; | S398: =INT(((50+RC[-17]/10)*35+200)*12/4) -> 10018 | U398: =1000*110/100*(1+(50+RC[-19]/10)/200)*100 -> 159335
B399: 398 | C399: 0 | D399: 400398 | E399: 1,7,4929,0;1,4,1318,0; | G399: 1 | H399: 7 | I399: 4929 | J399: 0 | L399: 1 | M399: 4 | N399: 1318 | O399: 0 | Q399: ="1,7,"&RC[2]&",0;"&"1,4,"&RC[4]&",0;" -> 1,7,10029,0;1,4,159390,0; | S399: =INT(((50+RC[-17]/10)*35+200)*12/4) -> 10029 | U399: =1000*110/100*(1+(50+RC[-19]/10)/200)*100 -> 159390
B400: 399 | C400: 0 | D400: 400399 | E400: 1,7,4939,0;1,4,1319,0; | G400: 1 | H400: 7 | I400: 4939 | J400: 0 | L400: 1 | M400: 4 | N400: 1319 | O400: 0 | Q400: ="1,7,"&RC[2]&",0;"&"1,4,"&RC[4]&",0;" -> 1,7,10039,0;1,4,159445,0; | S400: =INT(((50+RC[-17]/10)*35+200)*12/4) -> 10039 | U400: =1000*110/100*(1+(50+RC[-19]/10)/200)*100 -> 159445
B401: 400 | C401: 0 | D401: 400400 | E401: 1,7,4950,0;1,4,1320,0; | G401: 1 | H401: 7 | I401: 4950 | J401: 0 | L401: 1 | M401: 4 | N401: 1320 | O401: 0 | Q401: ="1,7,"&RC[2]&",0;"&"1,4,"&RC[4]&",0;" -> 1,7,10050,0;1,4,159500,0; | S401: =INT(((50+RC[-17]/10)*35+200)*12/4) -> 10050 | U401: =1000*110/100*(1+(50+RC[-19]/10)/200)*100 -> 159500
B402: 401 | C402: 0 | D402: 400401 | E402: 1,7,4960,0;1,4,1320,0; | G402: 1 | H402: 7 | I402: 4960 | J402: 0 | L402: 1 | M402: 4 | N402: 1320 | O402: 0 | Q402: ="1,7,"&RC[2]&",0;"&"1,4,"&RC[4]&",0;" -> 1,7,10060,0;1,4,159555,0; | S402: =INT(((50+RC[-17]/10)*35+200)*12/4) -> 10060 | U402: =1000*110/100*(1+(50+RC[-19]/10)/200)*100 -> 159555
B403: 402 | C403: 0 | D403: 400402 | E403: 1,7,4971,0;1,4,1321,0; | G403: 1 | H403: 7 | I403: 4971 | J403: 0 | L403: 1 | M403: 4 | N403: 1321 | O403: 0 | Q403: ="1,7,"&RC[2]&",0;"&"1,4,"&RC[4]&",0;" -> 1,7,10071,0;1,4,159610,0; | S403: =INT(((50+RC[-17]/10)*35+200)*12/4) -> 10071 | U403: =1000*110/100*(1+(50+RC[-19]/10)/200)*100 -> 159610
B404: 403 | C404: 0 | D404: 400403 | E404: 1,7,4981,0;1,4,1321,0; | G404: 1 | H404: 7 | I404: 4981 | J404: 0 | L404: 1 | M404: 4 | N404: 1321 | O404: 0 | Q404: ="1,7,"&RC[2]&",0;"&"1,4,"&RC[4]&",0;" -> 1,7,10081,0;1,4,159665,0; | S404: =INT(((50+RC[-17]/10)*35+200)*12/4) -> 10081 | U404: =1000*110/100*(1+(50+RC[-19]/10)/200)*100 -> 159665
B405: 404 | C405: 0 | D405: 400404 | E405: 1,7,4992,0;1,4,1322,0; | G405: 1 | H405: 7 | I405: 4992 | J405: 0 | L405: 1 | M405: 4 | N405: 1322 | O405: 0 | Q405: ="1,7,"&RC[2]&",0;"&"1,4,"&RC[4]&",0;" -> 1,7,10092,0;1,4,159720,0; | S405: =INT(((50+RC[-17]/10)*35+200)*12/4) -> 10092 | U405: =1000*110/100*(1+(50+RC[-19]/10)/200)*100 -> 159720
B406: 405 | C406: 0 | D406: 400405 | E406: 1,7,5002,0;1,4,1322,0; | G406: 1 | H406: 7 | I406: 5002 | J406: 0 | L406: 1 | M406: 4 | N406: 1322 | O406: 0 | Q406: ="1,7,"&RC[2]&",0;"&"1,4,"&RC[4]&",0;" -> 1,7,10102,0;1,4,159775,0; | S406: =INT(((50+RC[-17]/10)*35+200)*12/4) -> 10102 | U406: =1000*110/100*(1+(50+RC[-19]/10)/200)*100 -> 159775.00000000003
B407: 406 | C407: 0 | D407: 400406 | E407: 1,7,5013,0;1,4,1323,0; | G407: 1 | H407: 7 | I407: 5013 | J407: 0 | L407: 1 | M407: 4 | N407: 1323 | O407: 0 | Q407: ="1,7,"&RC[2]&",0;"&"1,4,"&RC[4]&",0;" -> 1,7,10113,0;1,4,159830,0; | S407: =INT(((50+RC[-17]/10)*35+200)*12/4) -> 10113 | U407: =1000*110/100*(1+(50+RC[-19]/10)/200)*100 -> 159829.99999999997
B408: 407 | C408: 0 | D408: 400407 | E408: 1,7,5023,0;1,4,1323,0; | G408: 1 | H408: 7 | I408: 5023 | J408: 0 | L408: 1 | M408: 4 | N408: 1323 | O408: 0 | Q408: ="1,7,"&RC[2]&",0;"&"1,4,"&RC[4]&",0;" -> 1,7,10123,0;1,4,159885,0; | S408: =INT(((50+RC[-17]/10)*35+200)*12/4) -> 10123 | U408: =1000*110/100*(1+(50+RC[-19]/10)/200)*100 -> 159885
B409: 408 | C409: 0 | D409: 400408 | E409: 1,7,5034,0;1,4,1324,0; | G409: 1 | H409: 7 | I409: 5034 | J409: 0 | L409: 1 | M409: 4 | N409: 1324 | O409: 0 | Q409: ="1,7,"&RC[2]&",0;"&"1,4,"&RC[4]&",0;" -> 1,7,10134,0;1,4,159940,0; | S409: =INT(((50+RC[-17]/10)*35+200)*12/4) -> 10134 | U409: =1000*110/100*(1+(50+RC[-19]/10)/200)*100 -> 159940
B410: 409 | C410: 0 | D410: 400409 | E410: 1,7,5044,0;1,4,1324,0; | G410: 1 | H410: 7 | I410: 5044 | J410: 0 | L410: 1 | M410: 4 | N410: 1324 | O410: 0 | Q410: ="1,7,"&RC[2]&",0;"&"1,4,"&RC[4]&",0;" -> 1,7,10144,0;1,4,159995,0; | S410: =INT(((50+RC[-17]/10)*35+200)*12/4) -> 10144 | U410: =1000*110/100*(1+(50+RC[-19]/10)/200)*100 -> 159994.99999999997
B411: 410 | C411: 0 | D411: 400410 | E411: 1,7,5055,0;1,4,1325,0; | G411: 1 | H411: 7 | I411: 5055 | J411: 0 | L411: 1 | M411: 4 | N411: 1325 | O411: 0 | Q411: ="1,7,"&RC[2]&",0;"&"1,4,"&RC[4]&",0;" -> 1,7,10155,0;1,4,160050,0; | S411: =INT(((50+RC[-17]/10)*35+200)*12/4) -> 10155 | U411: =1000*110/100*(1+(50+RC[-19]/10)/200)*100 -> 160050
B412: 411 | C412: 0 | D412: 400411 | E412: 1,7,5065,0;1,4,1326,0; | G412: 1 | H412: 7 | I412: 5065 | J412: 0 | L412: 1 | M412: 4 | N412: 1326 | O412: 0 | Q412: ="1,7,"&RC[2]&",0;"&"1,4,"&RC[4]&",0;" -> 1,7,10165,0;1,4,160105,0; | S412: =INT(((50+RC[-17]/10)*35+200)*12/4) -> 10165 | U412: =1000*110/100*(1+(50+RC[-19]/10)/200)*100 -> 160105
B413: 412 | C413: 0 | D413: 400412 | E413: 1,7,5076,0;1,4,1326,0; | G413: 1 | H413: 7 | I413: 5076 | J413: 0 | L413: 1 | M413: 4 | N413: 1326 | O413: 0 | Q413: ="1,7,"&RC[2]&",0;"&"1,4,"&RC[4]&",0;" -> 1,7,10176,0;1,4,160160,0; | S413: =INT(((50+RC[-17]/10)*35+200)*12/4) -> 10176 | U413: =1000*110/100*(1+(50+RC[-19]/10)/200)*100 -> 160160
B414: 413 | C414: 0 | D414: 400413 | E414: 1,7,5086,0;1,4,1327,0; | G414: 1 | H414: 7 | I414: 5086 | J414: 0 | L414: 1 | M414: 4 | N414: 1327 | O414: 0 | Q414: ="1,7,"&RC[2]&",0;"&"1,4,"&RC[4]&",0;" -> 1,7,10186,0;1,4,160215,0; | S414: =INT(((50+RC[-17]/10)*35+200)*12/4) -> 10186 | U414: =1000*110/100*(1+(50+RC[-19]/10)/200)*100 -> 160215
B415: 414 | C415: 0 | D415: 400414 | E415: 1,7,5097,0;1,4,1327,0; | G415: 1 | H415: 7 | I415: 5097 | J415: 0 | L415: 1 | M415: 4 | N415: 1327 | O415: 0 | Q415: ="1,7,"&RC[2]&",0;"&"1,4,"&RC[4]&",0;" -> 1,7,10197,0;1,4,160270,0; | S415: =INT(((50+RC[-17]/10)*35+200)*12/4) -> 10197 | U415: =1000*110/100*(1+(50+RC[-19]/10)/200)*100 -> 160270
B416: 415 | C416: 0 | D416: 400415 | E416: 1,7,5107,0;1,4,1328,0; | G416: 1 | H416: 7 | I416: 5107 | J416: 0 | L416: 1 | M416: 4 | N416: 1328 | O416: 0 | Q416: ="1,7,"&RC[2]&",0;"&"1,4,"&RC[4]&",0;" -> 1,7,10207,0;1,4,160325,0; | S416: =INT(((50+RC[-17]/10)*35+200)*12/4) -> 10207 | U416: =1000*110/100*(1+(50+RC[-19]/10)/200)*100 -> 160325
B417: 416 | C417: 0 | D417: 400416 | E417: 1,7,5118,0;1,4,1328,0; | G417: 1 | H417: 7 | I417: 5118 | J417: 0 | L417: 1 | M417: 4 | N417: 1328 | O417: 0 | Q417: ="1,7,"&RC[2]&",0;"&"1,4,"&RC[4]&",0;" -> 1,7,10218,0;1,4,160380,0; | S417: =INT(((50+RC[-17]/10)*35+200)*12/4) -> 10218 | U417: =1000*110/100*(1+(50+RC[-19]/10)/200)*100 -> 160380
B418: 417 | C418: 0 | D418: 400417 | E418: 1,7,5128,0;1,4,1329,0; | G418: 1 | H418: 7 | I418: 5128 | J418: 0 | L418: 1 | M418: 4 | N418: 1329 | O418: 0 | Q418: ="1,7,"&RC[2]&",0;"&"1,4,"&RC[4]&",0;" -> 1,7,10228,0;1,4,160435,0; | S418: =INT(((50+RC[-17]/10)*35+200)*12/4) -> 10228 | U418: =1000*110/100*(1+(50+RC[-19]/10)/200)*100 -> 160435
B419: 418 | C419: 0 | D419: 400418 | E419: 1,7,5139,0;1,4,1329,0; | G419: 1 | H419: 7 | I419: 5139 | J419: 0 | L419: 1 | M419: 4 | N419: 1329 | O419: 0 | Q419: ="1,7,"&RC[2]&",0;"&"1,4,"&RC[4]&",0;" -> 1,7,10239,0;1,4,160490,0; | S419: =INT(((50+RC[-17]/10)*35+200)*12/4) -> 10239 | U419: =1000*110/100*(1+(50+RC[-19]/10)/200)*100 -> 160490
B420: 419 | C420: 0 | D420: 400419 | E420: 1,7,5149,0;1,4,1330,0; | G420: 1 | H420: 7 | I420: 5149 | J420: 0 | L420: 1 | M420: 4 | N420: 1330 | O420: 0 | Q420: ="1,7,"&RC[2]&",0;"&"1,4,"&RC[4]&",0;" -> 1,7,10249,0;1,4,160545,0; | S420: =INT(((50+RC[-17]/10)*35+200)*12/4) -> 10249 | U420: =1000*110/100*(1+(50+RC[-19]/10)/200)*100 -> 160545
B421: 420 | C421: 0 | D421: 400420 | E421: 1,7,5160,0;1,4,1331,0; | G421: 1 | H421: 7 | I421: 5160 | J421: 0 | L421: 1 | M421: 4 | N421: 1331 | O421: 0 | Q421: ="1,7,"&RC[2]&",0;"&"1,4,"&RC[4]&",0;" -> 1,7,10260,0;1,4,160600,0; | S421: =INT(((50+RC[-17]/10)*35+200)*12/4) -> 10260 | U421: =1000*110/100*(1+(50+RC[-19]/10)/200)*100 -> 160600
B422: 421 | C422: 0 | D422: 400421 | E422: 1,7,5170,0;1,4,1331,0; | G422: 1 | H422: 7 | I422: 5170 | J422: 0 | L422: 1 | M422: 4 | N422: 1331 | O422: 0 | Q422: ="1,7,"&RC[2]&",0;"&"1,4,"&RC[4]&",0;" -> 1,7,10270,0;1,4,160655,0; | S422: =INT(((50+RC[-17]/10)*35+200)*12/4) -> 10270 | U422: =1000*110/100*(1+(50+RC[-19]/10)/200)*100 -> 160655
B423: 422 | C423: 0 | D423: 400422 | E423: 1,7,5181,0;1,4,1332,0; | G423: 1 | H423: 7 | I423: 5181 | J423: 0 | L423: 1 | M423: 4 | N423: 1332 | O423: 0 | Q423: ="1,7,"&RC[2]&",0;"&"1,4,"&RC[4]&",0;" -> 1,7,10281,0;1,4,160710,0; | S423: =INT(((50+RC[-17]/10)*35+200)*12/4) -> 10281 | U423: =1000*110/100*(1+(50+RC[-19]/10)/200)*100 -> 160710
B424: 423 | C424: 0 | D424: 400423 | E424: 1,7,5191,0;1,4,1332,0; | G424: 1 | H424: 7 | I424: 5191 | J424: 0 | L424: 1 | M424: 4 | N424: 1332 | O424: 0 | Q424: ="1,7,"&RC[2]&",0;"&"1,4,"&RC[4]&",0;" -> 1,7,10291,0;1,4,160765,0; | S424: =INT(((50+RC[-17]/10)*35+200)*12/4) -> 10291 | U424: =1000*110/100*(1+(50+RC[-19]/10)/200)*100 -> 160765
B425: 424 | C425: 0 | D425: 400424 | E425: 1,7,5202,0;1,4,1333,0; | G425: 1 | H425: 7 | I425: 5202 | J425: 0 | L425: 1 | M425: 4 | N425: 1333 | O425: 0 | Q425: ="1,7,"&RC[2]&",0;"&"1,4,"&RC[4]&",0;" -> 1,7,10302,0;1,4,160820,0; | S425: =INT(((50+RC[-17]/10)*35+200)*12/4) -> 10302 | U425: =1000*110/100*(1+(50+RC[-19]/10)/200)*100 -> 160820
B426: 425 | C426: 0 | D426: 400425 | E426: 1,7,5212,0;1,4,1333,0; | G426: 1 | H426: 7 | I426: 5212 | J426: 0 | L426: 1 | M426: 4 | N426: 1333 | O426: 0 | Q426: ="1,7,"&RC[2]&",0;"&"1,4,"&RC[4]&",0;" -> 1,7,10312,0;1,4,160875,0; | S426: =INT(((50+RC[-17]/10)*35+200)*12/4) -> 10312 | U426: =1000*110/100*(1+(50+RC[-19]/10)/200)*100 -> 160875
B427: 426 | C427: 0 | D427: 400426 | E427: 1,7,5223,0;1,4,1334,0; | G427: 1 | H427: 7 | I427: 5223 | J427: 0 | L427: 1 | M427: 4 | N427: 1334 | O427: 0 | Q427: ="1,7,"&RC[2]&",0;"&"1,4,"&RC[4]&",0;" -> 1,7,10323,0;1,4,160930,0; | S427: =INT(((50+RC[-17]/10)*35+200)*12/4) -> 10323 | U427: =1000*110/100*(1+(50+RC[-19]/10)/200)*100 -> 160930.00000000003
B428: 427 | C428: 0 | D428: 400427 | E428: 1,7,5233,0;1,4,1334,0; | G428: 1 | H428: 7 | I428: 5233 | J428: 0 | L428: 1 | M428: 4 | N428: 1334 | O428: 0 | Q428: ="1,7,"&RC[2]&",0;"&"1,4,"&RC[4]&",0;" -> 1,7,10333,0;1,4,160985,0; | S428: =INT(((50+RC[-17]/10)*35+200)*12/4) -> 10333 | U428: =1000*110/100*(1+(50+RC[-19]/10)/200)*100 -> 160985
B429: 428 | C429: 0 | D429: 400428 | E429: 1,7,5244,0;1,4,1335,0; | G429: 1 | H429: 7 | I429: 5244 | J429: 0 | L429: 1 | M429: 4 | N429: 1335 | O429: 0 | Q429: ="1,7,"&RC[2]&",0;"&"1,4,"&RC[4]&",0;" -> 1,7,10344,0;1,4,161040,0; | S429: =INT(((50+RC[-17]/10)*35+200)*12/4) -> 10344 | U429: =1000*110/100*(1+(50+RC[-19]/10)/200)*100 -> 161040
B430: 429 | C430: 0 | D430: 400429 | E430: 1,7,5254,0;1,4,1335,0; | G430: 1 | H430: 7 | I430: 5254 | J430: 0 | L430: 1 | M430: 4 | N430: 1335 | O430: 0 | Q430: ="1,7,"&RC[2]&",0;"&"1,4,"&RC[4]&",0;" -> 1,7,10354,0;1,4,161095,0; | S430: =INT(((50+RC[-17]/10)*35+200)*12/4) -> 10354 | U430: =1000*110/100*(1+(50+RC[-19]/10)/200)*100 -> 161095
B431: 430 | C431: 0 | D431: 400430 | E431: 1,7,5265,0;1,4,1336,0; | G431: 1 | H431: 7 | I431: 5265 | J431: 0 | L431: 1 | M431: 4 | N431: 1336 | O431: 0 | Q431: ="1,7,"&RC[2]&",0;"&"1,4,"&RC[4]&",0;" -> 1,7,10365,0;1,4,161150,0; | S431: =INT(((50+RC[-17]/10)*35+200)*12/4) -> 10365 | U431: =1000*110/100*(1+(50+RC[-19]/10)/200)*100 -> 161150
B432: 431 | C432: 0 | D432: 400431 | E432: 1,7,5275,0;1,4,1337,0; | G432: 1 | H432: 7 | I432: 5275 | J432: 0 | L432: 1 | M432: 4 | N432: 1337 | O432: 0 | Q432: ="1,7,"&RC[2]&",0;"&"1,4,"&RC[4]&",0;" -> 1,7,10375,0;1,4,161205,0; | S432: =INT(((50+RC[-17]/10)*35+200)*12/4) -> 10375 | U432: =1000*110/100*(1+(50+RC[-19]/10)/200)*100 -> 161205
B433: 432 | C433: 0 | D433: 400432 | E433: 1,7,5286,0;1,4,1337,0; | G433: 1 | H433: 7 | I433: 5286 | J433: 0 | L433: 1 | M433: 4 | N433: 1337 | O433: 0 | Q433: ="1,7,"&RC[2]&",0;"&"1,4,"&RC[4]&",0;" -> 1,7,10386,0;1,4,161260,0; | S433: =INT(((50+RC[-17]/10)*35+200)*12/4) -> 10386 | U433: =1000*110/100*(1+(50+RC[-19]/10)/200)*100 -> 161260
B434: 433 | C434: 0 | D434: 400433 | E434: 1,7,5296,0;1,4,1338,0; | G434: 1 | H434: 7 | I434: 5296 | J434: 0 | L434: 1 | M434: 4 | N434: 1338 | O434: 0 | Q434: ="1,7,"&RC[2]&",0;"&"1,4,"&RC[4]&",0;" -> 1,7,10396,0;1,4,161315,0; | S434: =INT(((50+RC[-17]/10)*35+200)*12/4) -> 10396 | U434: =1000*110/100*(1+(50+RC[-19]/10)/200)*100 -> 161315
B435: 434 | C435: 0 | D435: 400434 | E435: 1,7,5307,0;1,4,1338,0; | G435: 1 | H435: 7 | I435: 5307 | J435: 0 | L435: 1 | M435: 4 | N435: 1338 | O435: 0 | Q435: ="1,7,"&RC[2]&",0;"&"1,4,"&RC[4]&",0;" -> 1,7,10407,0;1,4,161370,0; | S435: =INT(((50+RC[-17]/10)*35+200)*12/4) -> 10407 | U435: =1000*110/100*(1+(50+RC[-19]/10)/200)*100 -> 161370
B436: 435 | C436: 0 | D436: 400435 | E436: 1,7,5317,0;1,4,1339,0; | G436: 1 | H436: 7 | I436: 5317 | J436: 0 | L436: 1 | M436: 4 | N436: 1339 | O436: 0 | Q436: ="1,7,"&RC[2]&",0;"&"1,4,"&RC[4]&",0;" -> 1,7,10417,0;1,4,161425,0; | S436: =INT(((50+RC[-17]/10)*35+200)*12/4) -> 10417 | U436: =1000*110/100*(1+(50+RC[-19]/10)/200)*100 -> 161425
B437: 436 | C437: 0 | D437: 400436 | E437: 1,7,5328,0;1,4,1339,0; | G437: 1 | H437: 7 | I437: 5328 | J437: 0 | L437: 1 | M437: 4 | N437: 1339 | O437: 0 | Q437: ="1,7,"&RC[2]&",0;"&"1,4,"&RC[4]&",0;" -> 1,7,10428,0;1,4,161480,0; | S437: =INT(((50+RC[-17]/10)*35+200)*12/4) -> 10428 | U437: =1000*110/100*(1+(50+RC[-19]/10)/200)*100 -> 161480
B438: 437 | C438: 0 | D438: 400437 | E438: 1,7,5338,0;1,4,1340,0; | G438: 1 | H438: 7 | I438: 5338 | J438: 0 | L438: 1 | M438: 4 | N438: 1340 | O438: 0 | Q438: ="1,7,"&RC[2]&",0;"&"1,4,"&RC[4]&",0;" -> 1,7,10438,0;1,4,161535,0; | S438: =INT(((50+RC[-17]/10)*35+200)*12/4) -> 10438 | U438: =1000*110/100*(1+(50+RC[-19]/10)/200)*100 -> 161535
B439: 438 | C439: 0 | D439: 400438 | E439: 1,7,5349,0;1,4,1340,0; | G439: 1 | H439: 7 | I439: 5349 | J439: 0 | L439: 1 | M439: 4 | N439: 1340 | O439: 0 | Q439: ="1,7,"&RC[2]&",0;"&"1,4,"&RC[4]&",0;" -> 1,7,10449,0;1,4,161590,0; | S439: =INT(((50+RC[-17]/10)*35+200)*12/4) -> 10449 | U439: =1000*110/100*(1+(50+RC[-19]/10)/200)*100 -> 161590
B440: 439 | C440: 0 | D440: 400439 | E440: 1,7,5359,0;1,4,1341,0; | G440: 1 | H440: 7 | I440: 5359 | J440: 0 | L440: 1 | M440: 4 | N440: 1341 | O440: 0 | Q440: ="1,7,"&RC[2]&",0;"&"1,4,"&RC[4]&",0;" -> 1,7,10459,0;1,4,161645,0; | S440: =INT(((50+RC[-17]/10)*35+200)*12/4) -> 10459 | U440: =1000*110/100*(1+(50+RC[-19]/10)/200)*100 -> 161645
B441: 440 | C441: 0 | D441: 400440 | E441: 1,7,5370,0;1,4,1342,0; | G441: 1 | H441: 7 | I441: 5370 | J441: 0 | L441: 1 | M441: 4 | N441: 1342 | O441: 0 | Q441: ="1,7,"&RC[2]&",0;"&"1,4,"&RC[4]&",0;" -> 1,7,10470,0;1,4,161700,0; | S441: =INT(((50+RC[-17]/10)*35+200)*12/4) -> 10470 | U441: =1000*110/100*(1+(50+RC[-19]/10)/200)*100 -> 161700
B442: 441 | C442: 0 | D442: 400441 | E442: 1,7,5380,0;1,4,1342,0; | G442: 1 | H442: 7 | I442: 5380 | J442: 0 | L442: 1 | M442: 4 | N442: 1342 | O442: 0 | Q442: ="1,7,"&RC[2]&",0;"&"1,4,"&RC[4]&",0;" -> 1,7,10480,0;1,4,161755,0; | S442: =INT(((50+RC[-17]/10)*35+200)*12/4) -> 10480 | U442: =1000*110/100*(1+(50+RC[-19]/10)/200)*100 -> 161755
B443: 442 | C443: 0 | D443: 400442 | E443: 1,7,5391,0;1,4,1343,0; | G443: 1 | H443: 7 | I443: 5391 | J443: 0 | L443: 1 | M443: 4 | N443: 1343 | O443: 0 | Q443: ="1,7,"&RC[2]&",0;"&"1,4,"&RC[4]&",0;" -> 1,7,10491,0;1,4,161810,0; | S443: =INT(((50+RC[-17]/10)*35+200)*12/4) -> 10491 | U443: =1000*110/100*(1+(50+RC[-19]/10)/200)*100 -> 161810
B444: 443 | C444: 0 | D444: 400443 | E444: 1,7,5401,0;1,4,1343,0; | G444: 1 | H444: 7 | I444: 5401 | J444: 0 | L444: 1 | M444: 4 | N444: 1343 | O444: 0 | Q444: ="1,7,"&RC[2]&",0;"&"1,4,"&RC[4]&",0;" -> 1,7,10501,0;1,4,161865,0; | S444: =INT(((50+RC[-17]/10)*35+200)*12/4) -> 10501 | U444: =1000*110/100*(1+(50+RC[-19]/10)/200)*100 -> 161865
B445: 444 | C445: 0 | D445: 400444 | E445: 1,7,5412,0;1,4,1344,0; | G445: 1 | H445: 7 | I445: 5412 | J445: 0 | L445: 1 | M445: 4 | N445: 1344 | O445: 0 | Q445: ="1,7,"&RC[2]&",0;"&"1,4,"&RC[4]&",0;" -> 1,7,10512,0;1,4,161920,0; | S445: =INT(((50+RC[-17]/10)*35+200)*12/4) -> 10512 | U445: =1000*110/100*(1+(50+RC[-19]/10)/200)*100 -> 161920
B446: 445 | C446: 0 | D446: 400445 | E446: 1,7,5422,0;1,4,1344,0; | G446: 1 | H446: 7 | I446: 5422 | J446: 0 | L446: 1 | M446: 4 | N446: 1344 | O446: 0 | Q446: ="1,7,"&RC[2]&",0;"&"1,4,"&RC[4]&",0;" -> 1,7,10522,0;1,4,161975,0; | S446: =INT(((50+RC[-17]/10)*35+200)*12/4) -> 10522 | U446: =1000*110/100*(1+(50+RC[-19]/10)/200)*100 -> 161975
B447: 446 | C447: 0 | D447: 400446 | E447: 1,7,5433,0;1,4,1345,0; | G447: 1 | H447: 7 | I447: 5433 | J447: 0 | L447: 1 | M447: 4 | N447: 1345 | O447: 0 | Q447: ="1,7,"&RC[2]&",0;"&"1,4,"&RC[4]&",0;" -> 1,7,10533,0;1,4,162030,0; | S447: =INT(((50+RC[-17]/10)*35+200)*12/4) -> 10533 | U447: =1000*110/100*(1+(50+RC[-19]/10)/200)*100 -> 162030
B448: 447 | C448: 0 | D448: 400447 | E448: 1,7,5443,0;1,4,1345,0; | G448: 1 | H448: 7 | I448: 5443 | J448: 0 | L448: 1 | M448: 4 | N448: 1345 | O448: 0 | Q448: ="1,7,"&RC[2]&",0;"&"1,4,"&RC[4]&",0;" -> 1,7,10543,0;1,4,162085,0; | S448: =INT(((50+RC[-17]/10)*35+200)*12/4) -> 10543 | U448: =1000*110/100*(1+(50+RC[-19]/10)/200)*100 -> 162085
B449: 448 | C449: 0 | D449: 400448 | E449: 1,7,5454,0;1,4,1346,0; | G449: 1 | H449: 7 | I449: 5454 | J449: 0 | L449: 1 | M449: 4 | N449: 1346 | O449: 0 | Q449: ="1,7,"&RC[2]&",0;"&"1,4,"&RC[4]&",0;" -> 1,7,10554,0;1,4,162140,0; | S449: =INT(((50+RC[-17]/10)*35+200)*12/4) -> 10554 | U449: =1000*110/100*(1+(50+RC[-19]/10)/200)*100 -> 162140
B450: 449 | C450: 0 | D450: 400449 | E450: 1,7,5464,0;1,4,1346,0; | G450: 1 | H450: 7 | I450: 5464 | J450: 0 | L450: 1 | M450: 4 | N450: 1346 | O450: 0 | Q450: ="1,7,"&RC[2]&",0;"&"1,4,"&RC[4]&",0;" -> 1,7,10564,0;1,4,162195,0; | S450: =INT(((50+RC[-17]/10)*35+200)*12/4) -> 10564 | U450: =1000*110/100*(1+(50+RC[-19]/10)/200)*100 -> 162194.99999999997
B451: 450 | C451: 0 | D451: 400450 | E451: 1,7,5475,0;1,4,1347,0; | G451: 1 | H451: 7 | I451: 5475 | J451: 0 | L451: 1 | M451: 4 | N451: 1347 | O451: 0 | Q451: ="1,7,"&RC[2]&",0;"&"1,4,"&RC[4]&",0;" -> 1,7,10575,0;1,4,162250,0; | S451: =INT(((50+RC[-17]/10)*35+200)*12/4) -> 10575 | U451: =1000*110/100*(1+(50+RC[-19]/10)/200)*100 -> 162250
B452: 451 | C452: 0 | D452: 400451 | E452: 1,7,5485,0;1,4,1348,0; | G452: 1 | H452: 7 | I452: 5485 | J452: 0 | L452: 1 | M452: 4 | N452: 1348 | O452: 0 | Q452: ="1,7,"&RC[2]&",0;"&"1,4,"&RC[4]&",0;" -> 1,7,10585,0;1,4,162305,0; | S452: =INT(((50+RC[-17]/10)*35+200)*12/4) -> 10585 | U452: =1000*110/100*(1+(50+RC[-19]/10)/200)*100 -> 162305
B453: 452 | C453: 0 | D453: 400452 | E453: 1,7,5496,0;1,4,1348,0; | G453: 1 | H453: 7 | I453: 5496 | J453: 0 | L453: 1 | M453: 4 | N453: 1348 | O453: 0 | Q453: ="1,7,"&RC[2]&",0;"&"1,4,"&RC[4]&",0;" -> 1,7,10596,0;1,4,162360,0; | S453: =INT(((50+RC[-17]/10)*35+200)*12/4) -> 10596 | U453: =1000*110/100*(1+(50+RC[-19]/10)/200)*100 -> 162360
B454: 453 | C454: 0 | D454: 400453 | E454: 1,7,5506,0;1,4,1349,0; | G454: 1 | H454: 7 | I454: 5506 | J454: 0 | L454: 1 | M454: 4 | N454: 1349 | O454: 0 | Q454: ="1,7,"&RC[2]&",0;"&"1,4,"&RC[4]&",0;" -> 1,7,10606,0;1,4,162415,0; | S454: =INT(((50+RC[-17]/10)*35+200)*12/4) -> 10606 | U454: =1000*110/100*(1+(50+RC[-19]/10)/200)*100 -> 162415
B455: 454 | C455: 0 | D455: 400454 | E455: 1,7,5517,0;1,4,1349,0; | G455: 1 | H455: 7 | I455: 5517 | J455: 0 | L455: 1 | M455: 4 | N455: 1349 | O455: 0 | Q455: ="1,7,"&RC[2]&",0;"&"1,4,"&RC[4]&",0;" -> 1,7,10617,0;1,4,162470,0; | S455: =INT(((50+RC[-17]/10)*35+200)*12/4) -> 10617 | U455: =1000*110/100*(1+(50+RC[-19]/10)/200)*100 -> 162470
B456: 455 | C456: 0 | D456: 400455 | E456: 1,7,5527,0;1,4,1350,0; | G456: 1 | H456: 7 | I456: 5527 | J456: 0 | L456: 1 | M456: 4 | N456: 1350 | O456: 0 | Q456: ="1,7,"&RC[2]&",0;"&"1,4,"&RC[4]&",0;" -> 1,7,10627,0;1,4,162525,0; | S456: =INT(((50+RC[-17]/10)*35+200)*12/4) -> 10627 | U456: =1000*110/100*(1+(50+RC[-19]/10)/200)*100 -> 162525
B457: 456 | C457: 0 | D457: 400456 | E457: 1,7,5538,0;1,4,1350,0; | G457: 1 | H457: 7 | I457: 5538 | J457: 0 | L457: 1 | M457: 4 | N457: 1350 | O457: 0 | Q457: ="1,7,"&RC[2]&",0;"&"1,4,"&RC[4]&",0;" -> 1,7,10638,0;1,4,162580,0; | S457: =INT(((50+RC[-17]/10)*35+200)*12/4) -> 10638 | U457: =1000*110/100*(1+(50+RC[-19]/10)/200)*100 -> 162580
B458: 457 | C458: 0 | D458: 400457 | E458: 1,7,5548,0;1,4,1351,0; | G458: 1 | H458: 7 | I458: 5548 | J458: 0 | L458: 1 | M458: 4 | N458: 1351 | O458: 0 | Q458: ="1,7,"&RC[2]&",0;"&"1,4,"&RC[4]&",0;" -> 1,7,10648,0;1,4,162635,0; | S458: =INT(((50+RC[-17]/10)*35+200)*12/4) -> 10648 | U458: =1000*110/100*(1+(50+RC[-19]/10)/200)*100 -> 162635
B459: 458 | C459: 0 | D459: 400458 | E459: 1,7,5559,0;1,4,1351,0; | G459: 1 | H459: 7 | I459: 5559 | J459: 0 | L459: 1 | M459: 4 | N459: 1351 | O459: 0 | Q459: ="1,7,"&RC[2]&",0;"&"1,4,"&RC[4]&",0;" -> 1,7,10659,0;1,4,162690,0; | S459: =INT(((50+RC[-17]/10)*35+200)*12/4) -> 10659 | U459: =1000*110/100*(1+(50+RC[-19]/10)/200)*100 -> 162690
B460: 459 | C460: 0 | D460: 400459 | E460: 1,7,5569,0;1,4,1352,0; | G460: 1 | H460: 7 | I460: 5569 | J460: 0 | L460: 1 | M460: 4 | N460: 1352 | O460: 0 | Q460: ="1,7,"&RC[2]&",0;"&"1,4,"&RC[4]&",0;" -> 1,7,10669,0;1,4,162745,0; | S460: =INT(((50+RC[-17]/10)*35+200)*12/4) -> 10669 | U460: =1000*110/100*(1+(50+RC[-19]/10)/200)*100 -> 162745
B461: 460 | C461: 0 | D461: 400460 | E461: 1,7,5580,0;1,4,1353,0; | G461: 1 | H461: 7 | I461: 5580 | J461: 0 | L461: 1 | M461: 4 | N461: 1353 | O461: 0 | Q461: ="1,7,"&RC[2]&",0;"&"1,4,"&RC[4]&",0;" -> 1,7,10680,0;1,4,162800,0; | S461: =INT(((50+RC[-17]/10)*35+200)*12/4) -> 10680 | U461: =1000*110/100*(1+(50+RC[-19]/10)/200)*100 -> 162800
B462: 461 | C462: 0 | D462: 400461 | E462: 1,7,5590,0;1,4,1353,0; | G462: 1 | H462: 7 | I462: 5590 | J462: 0 | L462: 1 | M462: 4 | N462: 1353 | O462: 0 | Q462: ="1,7,"&RC[2]&",0;"&"1,4,"&RC[4]&",0;" -> 1,7,10690,0;1,4,162855,0; | S462: =INT(((50+RC[-17]/10)*35+200)*12/4) -> 10690 | U462: =1000*110/100*(1+(50+RC[-19]/10)/200)*100 -> 162855
B463: 462 | C463: 0 | D463: 400462 | E463: 1,7,5601,0;1,4,1354,0; | G463: 1 | H463: 7 | I463: 5601 | J463: 0 | L463: 1 | M463: 4 | N463: 1354 | O463: 0 | Q463: ="1,7,"&RC[2]&",0;"&"1,4,"&RC[4]&",0;" -> 1,7,10701,0;1,4,162910,0; | S463: =INT(((50+RC[-17]/10)*35+200)*12/4) -> 10701 | U463: =1000*110/100*(1+(50+RC[-19]/10)/200)*100 -> 162910
B464: 463 | C464: 0 | D464: 400463 | E464: 1,7,5611,0;1,4,1354,0; | G464: 1 | H464: 7 | I464: 5611 | J464: 0 | L464: 1 | M464: 4 | N464: 1354 | O464: 0 | Q464: ="1,7,"&RC[2]&",0;"&"1,4,"&RC[4]&",0;" -> 1,7,10711,0;1,4,162965,0; | S464: =INT(((50+RC[-17]/10)*35+200)*12/4) -> 10711 | U464: =1000*110/100*(1+(50+RC[-19]/10)/200)*100 -> 162965
B465: 464 | C465: 0 | D465: 400464 | E465: 1,7,5622,0;1,4,1355,0; | G465: 1 | H465: 7 | I465: 5622 | J465: 0 | L465: 1 | M465: 4 | N465: 1355 | O465: 0 | Q465: ="1,7,"&RC[2]&",0;"&"1,4,"&RC[4]&",0;" -> 1,7,10722,0;1,4,163020,0; | S465: =INT(((50+RC[-17]/10)*35+200)*12/4) -> 10722 | U465: =1000*110/100*(1+(50+RC[-19]/10)/200)*100 -> 163020
B466: 465 | C466: 0 | D466: 400465 | E466: 1,7,5632,0;1,4,1355,0; | G466: 1 | H466: 7 | I466: 5632 | J466: 0 | L466: 1 | M466: 4 | N466: 1355 | O466: 0 | Q466: ="1,7,"&RC[2]&",0;"&"1,4,"&RC[4]&",0;" -> 1,7,10732,0;1,4,163075,0; | S466: =INT(((50+RC[-17]/10)*35+200)*12/4) -> 10732 | U466: =1000*110/100*(1+(50+RC[-19]/10)/200)*100 -> 163075
B467: 466 | C467: 0 | D467: 400466 | E467: 1,7,5643,0;1,4,1356,0; | G467: 1 | H467: 7 | I467: 5643 | J467: 0 | L467: 1 | M467: 4 | N467: 1356 | O467: 0 | Q467: ="1,7,"&RC[2]&",0;"&"1,4,"&RC[4]&",0;" -> 1,7,10743,0;1,4,163130,0; | S467: =INT(((50+RC[-17]/10)*35+200)*12/4) -> 10743 | U467: =1000*110/100*(1+(50+RC[-19]/10)/200)*100 -> 163130.00000000003
B468: 467 | C468: 0 | D468: 400467 | E468: 1,7,5653,0;1,4,1356,0; | G468: 1 | H468: 7 | I468: 5653 | J468: 0 | L468: 1 | M468: 4 | N468: 1356 | O468: 0 | Q468: ="1,7,"&RC[2]&",0;"&"1,4,"&RC[4]&",0;" -> 1,7,10753,0;1,4,163185,0; | S468: =INT(((50+RC[-17]/10)*35+200)*12/4) -> 10753 | U468: =1000*110/100*(1+(50+RC[-19]/10)/200)*100 -> 163185
B469: 468 | C469: 0 | D469: 400468 | E469: 1,7,5664,0;1,4,1357,0; | G469: 1 | H469: 7 | I469: 5664 | J469: 0 | L469: 1 | M469: 4 | N469: 1357 | O469: 0 | Q469: ="1,7,"&RC[2]&",0;"&"1,4,"&RC[4]&",0;" -> 1,7,10764,0;1,4,163240,0; | S469: =INT(((50+RC[-17]/10)*35+200)*12/4) -> 10764 | U469: =1000*110/100*(1+(50+RC[-19]/10)/200)*100 -> 163240
B470: 469 | C470: 0 | D470: 400469 | E470: 1,7,5674,0;1,4,1357,0; | G470: 1 | H470: 7 | I470: 5674 | J470: 0 | L470: 1 | M470: 4 | N470: 1357 | O470: 0 | Q470: ="1,7,"&RC[2]&",0;"&"1,4,"&RC[4]&",0;" -> 1,7,10774,0;1,4,163295,0; | S470: =INT(((50+RC[-17]/10)*35+200)*12/4) -> 10774 | U470: =1000*110/100*(1+(50+RC[-19]/10)/200)*100 -> 163295.00000000003
B471: 470 | C471: 0 | D471: 400470 | E471: 1,7,5685,0;1,4,1358,0; | G471: 1 | H471: 7 | I471: 5685 | J471: 0 | L471: 1 | M471: 4 | N471: 1358 | O471: 0 | Q471: ="1,7,"&RC[2]&",0;"&"1,4,"&RC[4]&",0;" -> 1,7,10785,0;1,4,163350,0; | S471: =INT(((50+RC[-17]/10)*35+200)*12/4) -> 10785 | U471: =1000*110/100*(1+(50+RC[-19]/10)/200)*100 -> 163349.99999999997
B472: 471 | C472: 0 | D472: 400471 | E472: 1,7,5695,0;1,4,1359,0; | G472: 1 | H472: 7 | I472: 5695 | J472: 0 | L472: 1 | M472: 4 | N472: 1359 | O472: 0 | Q472: ="1,7,"&RC[2]&",0;"&"1,4,"&RC[4]&",0;" -> 1,7,10795,0;1,4,163405,0; | S472: =INT(((50+RC[-17]/10)*35+200)*12/4) -> 10795 | U472: =1000*110/100*(1+(50+RC[-19]/10)/200)*100 -> 163405
B473: 472 | C473: 0 | D473: 400472 | E473: 1,7,5706,0;1,4,1359,0; | G473: 1 | H473: 7 | I473: 5706 | J473: 0 | L473: 1 | M473: 4 | N473: 1359 | O473: 0 | Q473: ="1,7,"&RC[2]&",0;"&"1,4,"&RC[4]&",0;" -> 1,7,10806,0;1,4,163460,0; | S473: =INT(((50+RC[-17]/10)*35+200)*12/4) -> 10806 | U473: =1000*110/100*(1+(50+RC[-19]/10)/200)*100 -> 163460
B474: 473 | C474: 0 | D474: 400473 | E474: 1,7,5716,0;1,4,1360,0; | G474: 1 | H474: 7 | I474: 5716 | J474: 0 | L474: 1 | M474: 4 | N474: 1360 | O474: 0 | Q474: ="1,7,"&RC[2]&",0;"&"1,4,"&RC[4]&",0;" -> 1,7,10816,0;1,4,163515,0; | S474: =INT(((50+RC[-17]/10)*35+200)*12/4) -> 10816 | U474: =1000*110/100*(1+(50+RC[-19]/10)/200)*100 -> 163515
B475: 474 | C475: 0 | D475: 400474 | E475: 1,7,5727,0;1,4,1360,0; | G475: 1 | H475: 7 | I475: 5727 | J475: 0 | L475: 1 | M475: 4 | N475: 1360 | O475: 0 | Q475: ="1,7,"&RC[2]&",0;"&"1,4,"&RC[4]&",0;" -> 1,7,10827,0;1,4,163570,0; | S475: =INT(((50+RC[-17]/10)*35+200)*12/4) -> 10827 | U475: =1000*110/100*(1+(50+RC[-19]/10)/200)*100 -> 163570
B476: 475 | C476: 0 | D476: 400475 | E476: 1,7,5737,0;1,4,1361,0; | G476: 1 | H476: 7 | I476: 5737 | J476: 0 | L476: 1 | M476: 4 | N476: 1361 | O476: 0 | Q476: ="1,7,"&RC[2]&",0;"&"1,4,"&RC[4]&",0;" -> 1,7,10837,0;1,4,163625,0; | S476: =INT(((50+RC[-17]/10)*35+200)*12/4) -> 10837 | U476: =1000*110/100*(1+(50+RC[-19]/10)/200)*100 -> 163625
B477: 476 | C477: 0 | D477: 400476 | E477: 1,7,5748,0;1,4,1361,0; | G477: 1 | H477: 7 | I477: 5748 | J477: 0 | L477: 1 | M477: 4 | N477: 1361 | O477: 0 | Q477: ="1,7,"&RC[2]&",0;"&"1,4,"&RC[4]&",0;" -> 1,7,10848,0;1,4,163680,0; | S477: =INT(((50+RC[-17]/10)*35+200)*12/4) -> 10848 | U477: =1000*110/100*(1+(50+RC[-19]/10)/200)*100 -> 163680
B478: 477 | C478: 0 | D478: 400477 | E478: 1,7,5758,0;1,4,1362,0; | G478: 1 | H478: 7 | I478: 5758 | J478: 0 | L478: 1 | M478: 4 | N478: 1362 | O478: 0 | Q478: ="1,7,"&RC[2]&",0;"&"1,4,"&RC[4]&",0;" -> 1,7,10858,0;1,4,163735,0; | S478: =INT(((50+RC[-17]/10)*35+200)*12/4) -> 10858 | U478: =1000*110/100*(1+(50+RC[-19]/10)/200)*100 -> 163735
B479: 478 | C479: 0 | D479: 400478 | E479: 1,7,5769,0;1,4,1362,0; | G479: 1 | H479: 7 | I479: 5769 | J479: 0 | L479: 1 | M479: 4 | N479: 1362 | O479: 0 | Q479: ="1,7,"&RC[2]&",0;"&"1,4,"&RC[4]&",0;" -> 1,7,10869,0;1,4,163790,0; | S479: =INT(((50+RC[-17]/10)*35+200)*12/4) -> 10869 | U479: =1000*110/100*(1+(50+RC[-19]/10)/200)*100 -> 163790
B480: 479 | C480: 0 | D480: 400479 | E480: 1,7,5779,0;1,4,1363,0; | G480: 1 | H480: 7 | I480: 5779 | J480: 0 | L480: 1 | M480: 4 | N480: 1363 | O480: 0 | Q480: ="1,7,"&RC[2]&",0;"&"1,4,"&RC[4]&",0;" -> 1,7,10879,0;1,4,163845,0; | S480: =INT(((50+RC[-17]/10)*35+200)*12/4) -> 10879 | U480: =1000*110/100*(1+(50+RC[-19]/10)/200)*100 -> 163845
B481: 480 | C481: 0 | D481: 400480 | E481: 1,7,5790,0;1,4,1364,0; | G481: 1 | H481: 7 | I481: 5790 | J481: 0 | L481: 1 | M481: 4 | N481: 1364 | O481: 0 | Q481: ="1,7,"&RC[2]&",0;"&"1,4,"&RC[4]&",0;" -> 1,7,10890,0;1,4,163900,0; | S481: =INT(((50+RC[-17]/10)*35+200)*12/4) -> 10890 | U481: =1000*110/100*(1+(50+RC[-19]/10)/200)*100 -> 163900
B482: 481 | C482: 0 | D482: 400481 | E482: 1,7,5800,0;1,4,1364,0; | G482: 1 | H482: 7 | I482: 5800 | J482: 0 | L482: 1 | M482: 4 | N482: 1364 | O482: 0 | Q482: ="1,7,"&RC[2]&",0;"&"1,4,"&RC[4]&",0;" -> 1,7,10900,0;1,4,163955,0; | S482: =INT(((50+RC[-17]/10)*35+200)*12/4) -> 10900 | U482: =1000*110/100*(1+(50+RC[-19]/10)/200)*100 -> 163955
B483: 482 | C483: 0 | D483: 400482 | E483: 1,7,5811,0;1,4,1365,0; | G483: 1 | H483: 7 | I483: 5811 | J483: 0 | L483: 1 | M483: 4 | N483: 1365 | O483: 0 | Q483: ="1,7,"&RC[2]&",0;"&"1,4,"&RC[4]&",0;" -> 1,7,10911,0;1,4,164010,0; | S483: =INT(((50+RC[-17]/10)*35+200)*12/4) -> 10911 | U483: =1000*110/100*(1+(50+RC[-19]/10)/200)*100 -> 164010
B484: 483 | C484: 0 | D484: 400483 | E484: 1,7,5821,0;1,4,1365,0; | G484: 1 | H484: 7 | I484: 5821 | J484: 0 | L484: 1 | M484: 4 | N484: 1365 | O484: 0 | Q484: ="1,7,"&RC[2]&",0;"&"1,4,"&RC[4]&",0;" -> 1,7,10921,0;1,4,164065,0; | S484: =INT(((50+RC[-17]/10)*35+200)*12/4) -> 10921 | U484: =1000*110/100*(1+(50+RC[-19]/10)/200)*100 -> 164065
B485: 484 | C485: 0 | D485: 400484 | E485: 1,7,5832,0;1,4,1366,0; | G485: 1 | H485: 7 | I485: 5832 | J485: 0 | L485: 1 | M485: 4 | N485: 1366 | O485: 0 | Q485: ="1,7,"&RC[2]&",0;"&"1,4,"&RC[4]&",0;" -> 1,7,10932,0;1,4,164120,0; | S485: =INT(((50+RC[-17]/10)*35+200)*12/4) -> 10932 | U485: =1000*110/100*(1+(50+RC[-19]/10)/200)*100 -> 164120
B486: 485 | C486: 0 | D486: 400485 | E486: 1,7,5842,0;1,4,1366,0; | G486: 1 | H486: 7 | I486: 5842 | J486: 0 | L486: 1 | M486: 4 | N486: 1366 | O486: 0 | Q486: ="1,7,"&RC[2]&",0;"&"1,4,"&RC[4]&",0;" -> 1,7,10942,0;1,4,164175,0; | S486: =INT(((50+RC[-17]/10)*35+200)*12/4) -> 10942 | U486: =1000*110/100*(1+(50+RC[-19]/10)/200)*100 -> 164175
B487: 486 | C487: 0 | D487: 400486 | E487: 1,7,5853,0;1,4,1367,0; | G487: 1 | H487: 7 | I487: 5853 | J487: 0 | L487: 1 | M487: 4 | N487: 1367 | O487: 0 | Q487: ="1,7,"&RC[2]&",0;"&"1,4,"&RC[4]&",0;" -> 1,7,10953,0;1,4,164230,0; | S487: =INT(((50+RC[-17]/10)*35+200)*12/4) -> 10953 | U487: =1000*110/100*(1+(50+RC[-19]/10)/200)*100 -> 164230
B488: 487 | C488: 0 | D488: 400487 | E488: 1,7,5863,0;1,4,1367,0; | G488: 1 | H488: 7 | I488: 5863 | J488: 0 | L488: 1 | M488: 4 | N488: 1367 | O488: 0 | Q488: ="1,7,"&RC[2]&",0;"&"1,4,"&RC[4]&",0;" -> 1,7,10963,0;1,4,164285,0; | S488: =INT(((50+RC[-17]/10)*35+200)*12/4) -> 10963 | U488: =1000*110/100*(1+(50+RC[-19]/10)/200)*100 -> 164285
B489: 488 | C489: 0 | D489: 400488 | E489: 1,7,5874,0;1,4,1368,0; | G489: 1 | H489: 7 | I489: 5874 | J489: 0 | L489: 1 | M489: 4 | N489: 1368 | O489: 0 | Q489: ="1,7,"&RC[2]&",0;"&"1,4,"&RC[4]&",0;" -> 1,7,10974,0;1,4,164340,0; | S489: =INT(((50+RC[-17]/10)*35+200)*12/4) -> 10974 | U489: =1000*110/100*(1+(50+RC[-19]/10)/200)*100 -> 164340
B490: 489 | C490: 0 | D490: 400489 | E490: 1,7,5884,0;1,4,1368,0; | G490: 1 | H490: 7 | I490: 5884 | J490: 0 | L490: 1 | M490: 4 | N490: 1368 | O490: 0 | Q490: ="1,7,"&RC[2]&",0;"&"1,4,"&RC[4]&",0;" -> 1,7,10984,0;1,4,164395,0; | S490: =INT(((50+RC[-17]/10)*35+200)*12/4) -> 10984 | U490: =1000*110/100*(1+(50+RC[-19]/10)/200)*100 -> 164395
B491: 490 | C491: 0 | D491: 400490 | E491: 1,7,5895,0;1,4,1369,0; | G491: 1 | H491: 7 | I491: 5895 | J491: 0 | L491: 1 | M491: 4 | N491: 1369 | O491: 0 | Q491: ="1,7,"&RC[2]&",0;"&"1,4,"&RC[4]&",0;" -> 1,7,10995,0;1,4,164450,0; | S491: =INT(((50+RC[-17]/10)*35+200)*12/4) -> 10995 | U491: =1000*110/100*(1+(50+RC[-19]/10)/200)*100 -> 164450.00000000003
B492: 491 | C492: 0 | D492: 400491 | E492: 1,7,5905,0;1,4,1370,0; | G492: 1 | H492: 7 | I492: 5905 | J492: 0 | L492: 1 | M492: 4 | N492: 1370 | O492: 0 | Q492: ="1,7,"&RC[2]&",0;"&"1,4,"&RC[4]&",0;" -> 1,7,11005,0;1,4,164505,0; | S492: =INT(((50+RC[-17]/10)*35+200)*12/4) -> 11005 | U492: =1000*110/100*(1+(50+RC[-19]/10)/200)*100 -> 164505
B493: 492 | C493: 0 | D493: 400492 | E493: 1,7,5916,0;1,4,1370,0; | G493: 1 | H493: 7 | I493: 5916 | J493: 0 | L493: 1 | M493: 4 | N493: 1370 | O493: 0 | Q493: ="1,7,"&RC[2]&",0;"&"1,4,"&RC[4]&",0;" -> 1,7,11016,0;1,4,164560,0; | S493: =INT(((50+RC[-17]/10)*35+200)*12/4) -> 11016 | U493: =1000*110/100*(1+(50+RC[-19]/10)/200)*100 -> 164560
B494: 493 | C494: 0 | D494: 400493 | E494: 1,7,5926,0;1,4,1371,0; | G494: 1 | H494: 7 | I494: 5926 | J494: 0 | L494: 1 | M494: 4 | N494: 1371 | O494: 0 | Q494: ="1,7,"&RC[2]&",0;"&"1,4,"&RC[4]&",0;" -> 1,7,11026,0;1,4,164615,0; | S494: =INT(((50+RC[-17]/10)*35+200)*12/4) -> 11026 | U494: =1000*110/100*(1+(50+RC[-19]/10)/200)*100 -> 164615
B495: 494 | C495: 0 | D495: 400494 | E495: 1,7,5937,0;1,4,1371,0; | G495: 1 | H495: 7 | I495: 5937 | J495: 0 | L495: 1 | M495: 4 | N495: 1371 | O495: 0 | Q495: ="1,7,"&RC[2]&",0;"&"1,4,"&RC[4]&",0;" -> 1,7,11037,0;1,4,164670,0; | S495: =INT(((50+RC[-17]/10)*35+200)*12/4) -> 11037 | U495: =1000*110/100*(1+(50+RC[-19]/10)/200)*100 -> 164670
B496: 495 | C496: 0 | D496: 400495 | E496: 1,7,5947,0;1,4,1372,0; | G496: 1 | H496: 7 | I496: 5947 | J496: 0 | L496: 1 | M496: 4 | N496: 1372 | O496: 0 | Q496: ="1,7,"&RC[2]&",0;"&"1,4,"&RC[4]&",0;" -> 1,7,11047,0;1,4,164725,0; | S496: =INT(((50+RC[-17]/10)*35+200)*12/4) -> 11047 | U496: =1000*110/100*(1+(50+RC[-19]/10)/200)*100 -> 164725
B497: 496 | C497: 0 | D497: 400496 | E497: 1,7,5958,0;1,4,1372,0; | G497: 1 | H497: 7 | I497: 5958 | J497: 0 | L497: 1 | M497: 4 | N497: 1372 | O497: 0 | Q497: ="1,7,"&RC[2]&",0;"&"1,4,"&RC[4]&",0;" -> 1,7,11058,0;1,4,164780,0; | S497: =INT(((50+RC[-17]/10)*35+200)*12/4) -> 11058 | U497: =1000*110/100*(1+(50+RC[-19]/10)/200)*100 -> 164780
B498: 497 | C498: 0 | D498: 400497 | E498: 1,7,5968,0;1,4,1373,0; | G498: 1 | H498: 7 | I498: 5968 | J498: 0 | L498: 1 | M498: 4 | N498: 1373 | O498: 0 | Q498: ="1,7,"&RC[2]&",0;"&"1,4,"&RC[4]&",0;" -> 1,7,11068,0;1,4,164835,0; | S498: =INT(((50+RC[-17]/10)*35+200)*12/4) -> 11068 | U498: =1000*110/100*(1+(50+RC[-19]/10)/200)*100 -> 164835
B499: 498 | C499: 0 | D499: 400498 | E499: 1,7,5979,0;1,4,1373,0; | G499: 1 | H499: 7 | I499: 5979 | J499: 0 | L499: 1 | M499: 4 | N499: 1373 | O499: 0 | Q499: ="1,7,"&RC[2]&",0;"&"1,4,"&RC[4]&",0;" -> 1,7,11079,0;1,4,164890,0; | S499: =INT(((50+RC[-17]/10)*35+200)*12/4) -> 11079 | U499: =1000*110/100*(1+(50+RC[-19]/10)/200)*100 -> 164890
B500: 499 | C500: 0 | D500: 400499 | E500: 1,7,5989,0;1,4,1374,0; | G500: 1 | H500: 7 | I500: 5989 | J500: 0 | L500: 1 | M500: 4 | N500: 1374 | O500: 0 | Q500: ="1,7,"&RC[2]&",0;"&"1,4,"&RC[4]&",0;" -> 1,7,11089,0;1,4,164945,0; | S500: =INT(((50+RC[-17]/10)*35+200)*12/4) -> 11089 | U500: =1000*110/100*(1+(50+RC[-19]/10)/200)*100 -> 164945
B501: 500 | C501: 0 | D501: 400500 | E501: 1,7,6000,0;1,4,1375,0; | G501: 1 | H501: 7 | I501: 6000 | J501: 0 | L501: 1 | M501: 4 | N501: 1375 | O501: 0 | Q501: ="1,7,"&RC[2]&",0;"&"1,4,"&RC[4]&",0;" -> 1,7,11100,0;1,4,165000,0; | S501: =INT(((50+RC[-17]/10)*35+200)*12/4) -> 11100 | U501: =1000*110/100*(1+(50+RC[-19]/10)/200)*100 -> 165000
B502: 501 | C502: 0 | D502: 400501 | E502: 1,7,6010,0;1,4,1375,0; | G502: 1 | H502: 7 | I502: 6010 | J502: 0 | L502: 1 | M502: 4 | N502: 1375 | O502: 0 | Q502: ="1,7,"&RC[2]&",0;"&"1,4,"&RC[4]&",0;" -> 1,7,11110,0;1,4,165055,0; | S502: =INT(((50+RC[-17]/10)*35+200)*12/4) -> 11110 | U502: =1000*110/100*(1+(50+RC[-19]/10)/200)*100 -> 165055
B503: 502 | C503: 0 | D503: 400502 | E503: 1,7,6021,0;1,4,1376,0; | G503: 1 | H503: 7 | I503: 6021 | J503: 0 | L503: 1 | M503: 4 | N503: 1376 | O503: 0 | Q503: ="1,7,"&RC[2]&",0;"&"1,4,"&RC[4]&",0;" -> 1,7,11121,0;1,4,165110,0; | S503: =INT(((50+RC[-17]/10)*35+200)*12/4) -> 11121 | U503: =1000*110/100*(1+(50+RC[-19]/10)/200)*100 -> 165110
B504: 503 | C504: 0 | D504: 400503 | E504: 1,7,6031,0;1,4,1376,0; | G504: 1 | H504: 7 | I504: 6031 | J504: 0 | L504: 1 | M504: 4 | N504: 1376 | O504: 0 | Q504: ="1,7,"&RC[2]&",0;"&"1,4,"&RC[4]&",0;" -> 1,7,11131,0;1,4,165165,0; | S504: =INT(((50+RC[-17]/10)*35+200)*12/4) -> 11131 | U504: =1000*110/100*(1+(50+RC[-19]/10)/200)*100 -> 165165
B505: 504 | C505: 0 | D505: 400504 | E505: 1,7,6042,0;1,4,1377,0; | G505: 1 | H505: 7 | I505: 6042 | J505: 0 | L505: 1 | M505: 4 | N505: 1377 | O505: 0 | Q505: ="1,7,"&RC[2]&",0;"&"1,4,"&RC[4]&",0;" -> 1,7,11142,0;1,4,165220,0; | S505: =INT(((50+RC[-17]/10)*35+200)*12/4) -> 11142 | U505: =1000*110/100*(1+(50+RC[-19]/10)/200)*100 -> 165220
B506: 505 | C506: 0 | D506: 400505 | E506: 1,7,6052,0;1,4,1377,0; | G506: 1 | H506: 7 | I506: 6052 | J506: 0 | L506: 1 | M506: 4 | N506: 1377 | O506: 0 | Q506: ="1,7,"&RC[2]&",0;"&"1,4,"&RC[4]&",0;" -> 1,7,11152,0;1,4,165275,0; | S506: =INT(((50+RC[-17]/10)*35+200)*12/4) -> 11152 | U506: =1000*110/100*(1+(50+RC[-19]/10)/200)*100 -> 165275
B507: 506 | C507: 0 | D507: 400506 | E507: 1,7,6063,0;1,4,1378,0; | G507: 1 | H507: 7 | I507: 6063 | J507: 0 | L507: 1 | M507: 4 | N507: 1378 | O507: 0 | Q507: ="1,7,"&RC[2]&",0;"&"1,4,"&RC[4]&",0;" -> 1,7,11163,0;1,4,165330,0; | S507: =INT(((50+RC[-17]/10)*35+200)*12/4) -> 11163 | U507: =1000*110/100*(1+(50+RC[-19]/10)/200)*100 -> 165330.00000000003
B508: 507 | C508: 0 | D508: 400507 | E508: 1,7,6073,0;1,4,1378,0; | G508: 1 | H508: 7 | I508: 6073 | J508: 0 | L508: 1 | M508: 4 | N508: 1378 | O508: 0 | Q508: ="1,7,"&RC[2]&",0;"&"1,4,"&RC[4]&",0;" -> 1,7,11173,0;1,4,165385,0; | S508: =INT(((50+RC[-17]/10)*35+200)*12/4) -> 11173 | U508: =1000*110/100*(1+(50+RC[-19]/10)/200)*100 -> 165385
B509: 508 | C509: 0 | D509: 400508 | E509: 1,7,6084,0;1,4,1379,0; | G509: 1 | H509: 7 | I509: 6084 | J509: 0 | L509: 1 | M509: 4 | N509: 1379 | O509: 0 | Q509: ="1,7,"&RC[2]&",0;"&"1,4,"&RC[4]&",0;" -> 1,7,11184,0;1,4,165440,0; | S509: =INT(((50+RC[-17]/10)*35+200)*12/4) -> 11184 | U509: =1000*110/100*(1+(50+RC[-19]/10)/200)*100 -> 165440
B510: 509 | C510: 0 | D510: 400509 | E510: 1,7,6094,0;1,4,1379,0; | G510: 1 | H510: 7 | I510: 6094 | J510: 0 | L510: 1 | M510: 4 | N510: 1379 | O510: 0 | Q510: ="1,7,"&RC[2]&",0;"&"1,4,"&RC[4]&",0;" -> 1,7,11194,0;1,4,165495,0; | S510: =INT(((50+RC[-17]/10)*35+200)*12/4) -> 11194 | U510: =1000*110/100*(1+(50+RC[-19]/10)/200)*100 -> 165495.00000000003
B511: 510 | C511: 0 | D511: 400510 | E511: 1,7,6105,0;1,4,1380,0; | G511: 1 | H511: 7 | I511: 6105 | J511: 0 | L511: 1 | M511: 4 | N511: 1380 | O511: 0 | Q511: ="1,7,"&RC[2]&",0;"&"1,4,"&RC[4]&",0;" -> 1,7,11205,0;1,4,165550,0; | S511: =INT(((50+RC[-17]/10)*35+200)*12/4) -> 11205 | U511: =1000*110/100*(1+(50+RC[-19]/10)/200)*100 -> 165549.99999999997
B512: 511 | C512: 0 | D512: 400511 | E512: 1,7,6115,0;1,4,1381,0; | G512: 1 | H512: 7 | I512: 6115 | J512: 0 | L512: 1 | M512: 4 | N512: 1381 | O512: 0 | Q512: ="1,7,"&RC[2]&",0;"&"1,4,"&RC[4]&",0;" -> 1,7,11215,0;1,4,165605,0; | S512: =INT(((50+RC[-17]/10)*35+200)*12/4) -> 11215 | U512: =1000*110/100*(1+(50+RC[-19]/10)/200)*100 -> 165605
B513: 512 | C513: 0 | D513: 400512 | E513: 1,7,6126,0;1,4,1381,0; | G513: 1 | H513: 7 | I513: 6126 | J513: 0 | L513: 1 | M513: 4 | N513: 1381 | O513: 0 | Q513: ="1,7,"&RC[2]&",0;"&"1,4,"&RC[4]&",0;" -> 1,7,11226,0;1,4,165660,0; | S513: =INT(((50+RC[-17]/10)*35+200)*12/4) -> 11226 | U513: =1000*110/100*(1+(50+RC[-19]/10)/200)*100 -> 165660
B514: 513 | C514: 0 | D514: 400513 | E514: 1,7,6136,0;1,4,1382,0; | G514: 1 | H514: 7 | I514: 6136 | J514: 0 | L514: 1 | M514: 4 | N514: 1382 | O514: 0 | Q514: ="1,7,"&RC[2]&",0;"&"1,4,"&RC[4]&",0;" -> 1,7,11236,0;1,4,165715,0; | S514: =INT(((50+RC[-17]/10)*35+200)*12/4) -> 11236 | U514: =1000*110/100*(1+(50+RC[-19]/10)/200)*100 -> 165715
B515: 514 | C515: 0 | D515: 400514 | E515: 1,7,6147,0;1,4,1382,0; | G515: 1 | H515: 7 | I515: 6147 | J515: 0 | L515: 1 | M515: 4 | N515: 1382 | O515: 0 | Q515: ="1,7,"&RC[2]&",0;"&"1,4,"&RC[4]&",0;" -> 1,7,11247,0;1,4,165770,0; | S515: =INT(((50+RC[-17]/10)*35+200)*12/4) -> 11247 | U515: =1000*110/100*(1+(50+RC[-19]/10)/200)*100 -> 165770
B516: 515 | C516: 0 | D516: 400515 | E516: 1,7,6157,0;1,4,1383,0; | G516: 1 | H516: 7 | I516: 6157 | J516: 0 | L516: 1 | M516: 4 | N516: 1383 | O516: 0 | Q516: ="1,7,"&RC[2]&",0;"&"1,4,"&RC[4]&",0;" -> 1,7,11257,0;1,4,165825,0; | S516: =INT(((50+RC[-17]/10)*35+200)*12/4) -> 11257 | U516: =1000*110/100*(1+(50+RC[-19]/10)/200)*100 -> 165824.99999999997
B517: 516 | C517: 0 | D517: 400516 | E517: 1,7,6168,0;1,4,1383,0; | G517: 1 | H517: 7 | I517: 6168 | J517: 0 | L517: 1 | M517: 4 | N517: 1383 | O517: 0 | Q517: ="1,7,"&RC[2]&",0;"&"1,4,"&RC[4]&",0;" -> 1,7,11268,0;1,4,165880,0; | S517: =INT(((50+RC[-17]/10)*35+200)*12/4) -> 11268 | U517: =1000*110/100*(1+(50+RC[-19]/10)/200)*100 -> 165880
B518: 517 | C518: 0 | D518: 400517 | E518: 1,7,6178,0;1,4,1384,0; | G518: 1 | H518: 7 | I518: 6178 | J518: 0 | L518: 1 | M518: 4 | N518: 1384 | O518: 0 | Q518: ="1,7,"&RC[2]&",0;"&"1,4,"&RC[4]&",0;" -> 1,7,11278,0;1,4,165935,0; | S518: =INT(((50+RC[-17]/10)*35+200)*12/4) -> 11278 | U518: =1000*110/100*(1+(50+RC[-19]/10)/200)*100 -> 165935
B519: 518 | C519: 0 | D519: 400518 | E519: 1,7,6189,0;1,4,1384,0; | G519: 1 | H519: 7 | I519: 6189 | J519: 0 | L519: 1 | M519: 4 | N519: 1384 | O519: 0 | Q519: ="1,7,"&RC[2]&",0;"&"1,4,"&RC[4]&",0;" -> 1,7,11289,0;1,4,165990,0; | S519: =INT(((50+RC[-17]/10)*35+200)*12/4) -> 11289 | U519: =1000*110/100*(1+(50+RC[-19]/10)/200)*100 -> 165990
B520: 519 | C520: 0 | D520: 400519 | E520: 1,7,6199,0;1,4,1385,0; | G520: 1 | H520: 7 | I520: 6199 | J520: 0 | L520: 1 | M520: 4 | N520: 1385 | O520: 0 | Q520: ="1,7,"&RC[2]&",0;"&"1,4,"&RC[4]&",0;" -> 1,7,11299,0;1,4,166045,0; | S520: =INT(((50+RC[-17]/10)*35+200)*12/4) -> 11299 | U520: =1000*110/100*(1+(50+RC[-19]/10)/200)*100 -> 166045
B521: 520 | C521: 0 | D521: 400520 | E521: 1,7,6210,0;1,4,1386,0; | G521: 1 | H521: 7 | I521: 6210 | J521: 0 | L521: 1 | M521: 4 | N521: 1386 | O521: 0 | Q521: ="1,7,"&RC[2]&",0;"&"1,4,"&RC[4]&",0;" -> 1,7,11310,0;1,4,166100,0; | S521: =INT(((50+RC[-17]/10)*35+200)*12/4) -> 11310 | U521: =1000*110/100*(1+(50+RC[-19]/10)/200)*100 -> 166100
B522: 521 | C522: 0 | D522: 400521 | E522: 1,7,6220,0;1,4,1386,0; | G522: 1 | H522: 7 | I522: 6220 | J522: 0 | L522: 1 | M522: 4 | N522: 1386 | O522: 0 | Q522: ="1,7,"&RC[2]&",0;"&"1,4,"&RC[4]&",0;" -> 1,7,11320,0;1,4,166155,0; | S522: =INT(((50+RC[-17]/10)*35+200)*12/4) -> 11320 | U522: =1000*110/100*(1+(50+RC[-19]/10)/200)*100 -> 166155
B523: 522 | C523: 0 | D523: 400522 | E523: 1,7,6231,0;1,4,1387,0; | G523: 1 | H523: 7 | I523: 6231 | J523: 0 | L523: 1 | M523: 4 | N523: 1387 | O523: 0 | Q523: ="1,7,"&RC[2]&",0;"&"1,4,"&RC[4]&",0;" -> 1,7,11331,0;1,4,166210,0; | S523: =INT(((50+RC[-17]/10)*35+200)*12/4) -> 11331 | U523: =1000*110/100*(1+(50+RC[-19]/10)/200)*100 -> 166210
B524: 523 | C524: 0 | D524: 400523 | E524: 1,7,6241,0;1,4,1387,0; | G524: 1 | H524: 7 | I524: 6241 | J524: 0 | L524: 1 | M524: 4 | N524: 1387 | O524: 0 | Q524: ="1,7,"&RC[2]&",0;"&"1,4,"&RC[4]&",0;" -> 1,7,11341,0;1,4,166265,0; | S524: =INT(((50+RC[-17]/10)*35+200)*12/4) -> 11341 | U524: =1000*110/100*(1+(50+RC[-19]/10)/200)*100 -> 166265
B525: 524 | C525: 0 | D525: 400524 | E525: 1,7,6252,0;1,4,1388,0; | G525: 1 | H525: 7 | I525: 6252 | J525: 0 | L525: 1 | M525: 4 | N525: 1388 | O525: 0 | Q525: ="1,7,"&RC[2]&",0;"&"1,4,"&RC[4]&",0;" -> 1,7,11352,0;1,4,166320,0; | S525: =INT(((50+RC[-17]/10)*35+200)*12/4) -> 11352 | U525: =1000*110/100*(1+(50+RC[-19]/10)/200)*100 -> 166320
B526: 525 | C526: 0 | D526: 400525 | E526: 1,7,6262,0;1,4,1388,0; | G526: 1 | H526: 7 | I526: 6262 | J526: 0 | L526: 1 | M526: 4 | N526: 1388 | O526: 0 | Q526: ="1,7,"&RC[2]&",0;"&"1,4,"&RC[4]&",0;" -> 1,7,11362,0;1,4,166375,0; | S526: =INT(((50+RC[-17]/10)*35+200)*12/4) -> 11362 | U526: =1000*110/100*(1+(50+RC[-19]/10)/200)*100 -> 166375
B527: 526 | C527: 0 | D527: 400526 | E527: 1,7,6273,0;1,4,1389,0; | G527: 1 | H527: 7 | I527: 6273 | J527: 0 | L527: 1 | M527: 4 | N527: 1389 | O527: 0 | Q527: ="1,7,"&RC[2]&",0;"&"1,4,"&RC[4]&",0;" -> 1,7,11373,0;1,4,166430,0; | S527: =INT(((50+RC[-17]/10)*35+200)*12/4) -> 11373 | U527: =1000*110/100*(1+(50+RC[-19]/10)/200)*100 -> 166430
B528: 527 | C528: 0 | D528: 400527 | E528: 1,7,6283,0;1,4,1389,0; | G528: 1 | H528: 7 | I528: 6283 | J528: 0 | L528: 1 | M528: 4 | N528: 1389 | O528: 0 | Q528: ="1,7,"&RC[2]&",0;"&"1,4,"&RC[4]&",0;" -> 1,7,11383,0;1,4,166485,0; | S528: =INT(((50+RC[-17]/10)*35+200)*12/4) -> 11383 | U528: =1000*110/100*(1+(50+RC[-19]/10)/200)*100 -> 166485
B529: 528 | C529: 0 | D529: 400528 | E529: 1,7,6294,0;1,4,1390,0; | G529: 1 | H529: 7 | I529: 6294 | J529: 0 | L529: 1 | M529: 4 | N529: 1390 | O529: 0 | Q529: ="1,7,"&RC[2]&",0;"&"1,4,"&RC[4]&",0;" -> 1,7,11394,0;1,4,166540,0; | S529: =INT(((50+RC[-17]/10)*35+200)*12/4) -> 11394 | U529: =1000*110/100*(1+(50+RC[-19]/10)/200)*100 -> 166540
B530: 529 | C530: 0 | D530: 400529 | E530: 1,7,6304,0;1,4,1390,0; | G530: 1 | H530: 7 | I530: 6304 | J530: 0 | L530: 1 | M530: 4 | N530: 1390 | O530: 0 | Q530: ="1,7,"&RC[2]&",0;"&"1,4,"&RC[4]&",0;" -> 1,7,11404,0;1,4,166595,0; | S530: =INT(((50+RC[-17]/10)*35+200)*12/4) -> 11404 | U530: =1000*110/100*(1+(50+RC[-19]/10)/200)*100 -> 166595
B531: 530 | C531: 0 | D531: 400530 | E531: 1,7,6315,0;1,4,1391,0; | G531: 1 | H531: 7 | I531: 6315 | J531: 0 | L531: 1 | M531: 4 | N531: 1391 | O531: 0 | Q531: ="1,7,"&RC[2]&",0;"&"1,4,"&RC[4]&",0;" -> 1,7,11415,0;1,4,166650,0; | S531: =INT(((50+RC[-17]/10)*35+200)*12/4) -> 11415 | U531: =1000*110/100*(1+(50+RC[-19]/10)/200)*100 -> 166650.00000000003
B532: 531 | C532: 0 | D532: 400531 | E532: 1,7,6325,0;1,4,1392,0; | G532: 1 | H532: 7 | I532: 6325 | J532: 0 | L532: 1 | M532: 4 | N532: 1392 | O532: 0 | Q532: ="1,7,"&RC[2]&",0;"&"1,4,"&RC[4]&",0;" -> 1,7,11425,0;1,4,166705,0; | S532: =INT(((50+RC[-17]/10)*35+200)*12/4) -> 11425 | U532: =1000*110/100*(1+(50+RC[-19]/10)/200)*100 -> 166704.99999999997
B533: 532 | C533: 0 | D533: 400532 | E533: 1,7,6336,0;1,4,1392,0; | G533: 1 | H533: 7 | I533: 6336 | J533: 0 | L533: 1 | M533: 4 | N533: 1392 | O533: 0 | Q533: ="1,7,"&RC[2]&",0;"&"1,4,"&RC[4]&",0;" -> 1,7,11436,0;1,4,166760,0; | S533: =INT(((50+RC[-17]/10)*35+200)*12/4) -> 11436 | U533: =1000*110/100*(1+(50+RC[-19]/10)/200)*100 -> 166760
B534: 533 | C534: 0 | D534: 400533 | E534: 1,7,6346,0;1,4,1393,0; | G534: 1 | H534: 7 | I534: 6346 | J534: 0 | L534: 1 | M534: 4 | N534: 1393 | O534: 0 | Q534: ="1,7,"&RC[2]&",0;"&"1,4,"&RC[4]&",0;" -> 1,7,11446,0;1,4,166815,0; | S534: =INT(((50+RC[-17]/10)*35+200)*12/4) -> 11446 | U534: =1000*110/100*(1+(50+RC[-19]/10)/200)*100 -> 166815
B535: 534 | C535: 0 | D535: 400534 | E535: 1,7,6357,0;1,4,1393,0; | G535: 1 | H535: 7 | I535: 6357 | J535: 0 | L535: 1 | M535: 4 | N535: 1393 | O535: 0 | Q535: ="1,7,"&RC[2]&",0;"&"1,4,"&RC[4]&",0;" -> 1,7,11457,0;1,4,166870,0; | S535: =INT(((50+RC[-17]/10)*35+200)*12/4) -> 11457 | U535: =1000*110/100*(1+(50+RC[-19]/10)/200)*100 -> 166869.99999999997
B536: 535 | C536: 0 | D536: 400535 | E536: 1,7,6367,0;1,4,1394,0; | G536: 1 | H536: 7 | I536: 6367 | J536: 0 | L536: 1 | M536: 4 | N536: 1394 | O536: 0 | Q536: ="1,7,"&RC[2]&",0;"&"1,4,"&RC[4]&",0;" -> 1,7,11467,0;1,4,166925,0; | S536: =INT(((50+RC[-17]/10)*35+200)*12/4) -> 11467 | U536: =1000*110/100*(1+(50+RC[-19]/10)/200)*100 -> 166925
B537: 536 | C537: 0 | D537: 400536 | E537: 1,7,6378,0;1,4,1394,0; | G537: 1 | H537: 7 | I537: 6378 | J537: 0 | L537: 1 | M537: 4 | N537: 1394 | O537: 0 | Q537: ="1,7,"&RC[2]&",0;"&"1,4,"&RC[4]&",0;" -> 1,7,11478,0;1,4,166980,0; | S537: =INT(((50+RC[-17]/10)*35+200)*12/4) -> 11478 | U537: =1000*110/100*(1+(50+RC[-19]/10)/200)*100 -> 166980
B538: 537 | C538: 0 | D538: 400537 | E538: 1,7,6388,0;1,4,1395,0; | G538: 1 | H538: 7 | I538: 6388 | J538: 0 | L538: 1 | M538: 4 | N538: 1395 | O538: 0 | Q538: ="1,7,"&RC[2]&",0;"&"1,4,"&RC[4]&",0;" -> 1,7,11488,0;1,4,167035,0; | S538: =INT(((50+RC[-17]/10)*35+200)*12/4) -> 11488 | U538: =1000*110/100*(1+(50+RC[-19]/10)/200)*100 -> 167035
B539: 538 | C539: 0 | D539: 400538 | E539: 1,7,6399,0;1,4,1395,0; | G539: 1 | H539: 7 | I539: 6399 | J539: 0 | L539: 1 | M539: 4 | N539: 1395 | O539: 0 | Q539: ="1,7,"&RC[2]&",0;"&"1,4,"&RC[4]&",0;" -> 1,7,11499,0;1,4,167090,0; | S539: =INT(((50+RC[-17]/10)*35+200)*12/4) -> 11499 | U539: =1000*110/100*(1+(50+RC[-19]/10)/200)*100 -> 167090
B540: 539 | C540: 0 | D540: 400539 | E540: 1,7,6409,0;1,4,1396,0; | G540: 1 | H540: 7 | I540: 6409 | J540: 0 | L540: 1 | M540: 4 | N540: 1396 | O540: 0 | Q540: ="1,7,"&RC[2]&",0;"&"1,4,"&RC[4]&",0;" -> 1,7,11509,0;1,4,167145,0; | S540: =INT(((50+RC[-17]/10)*35+200)*12/4) -> 11509 | U540: =1000*110/100*(1+(50+RC[-19]/10)/200)*100 -> 167145
B541: 540 | C541: 0 | D541: 400540 | E541: 1,7,6420,0;1,4,1397,0; | G541: 1 | H541: 7 | I541: 6420 | J541: 0 | L541: 1 | M541: 4 | N541: 1397 | O541: 0 | Q541: ="1,7,"&RC[2]&",0;"&"1,4,"&RC[4]&",0;" -> 1,7,11520,0;1,4,167200,0; | S541: =INT(((50+RC[-17]/10)*35+200)*12/4) -> 11520 | U541: =1000*110/100*(1+(50+RC[-19]/10)/200)*100 -> 167200
B542: 541 | C542: 0 | D542: 400541 | E542: 1,7,6430,0;1,4,1397,0; | G542: 1 | H542: 7 | I542: 6430 | J542: 0 | L542: 1 | M542: 4 | N542: 1397 | O542: 0 | Q542: ="1,7,"&RC[2]&",0;"&"1,4,"&RC[4]&",0;" -> 1,7,11530,0;1,4,167255,0; | S542: =INT(((50+RC[-17]/10)*35+200)*12/4) -> 11530 | U542: =1000*110/100*(1+(50+RC[-19]/10)/200)*100 -> 167255
B543: 542 | C543: 0 | D543: 400542 | E543: 1,7,6441,0;1,4,1398,0; | G543: 1 | H543: 7 | I543: 6441 | J543: 0 | L543: 1 | M543: 4 | N543: 1398 | O543: 0 | Q543: ="1,7,"&RC[2]&",0;"&"1,4,"&RC[4]&",0;" -> 1,7,11541,0;1,4,167310,0; | S543: =INT(((50+RC[-17]/10)*35+200)*12/4) -> 11541 | U543: =1000*110/100*(1+(50+RC[-19]/10)/200)*100 -> 167310
B544: 543 | C544: 0 | D544: 400543 | E544: 1,7,6451,0;1,4,1398,0; | G544: 1 | H544: 7 | I544: 6451 | J544: 0 | L544: 1 | M544: 4 | N544: 1398 | O544: 0 | Q544: ="1,7,"&RC[2]&",0;"&"1,4,"&RC[4]&",0;" -> 1,7,11551,0;1,4,167365,0; | S544: =INT(((50+RC[-17]/10)*35+200)*12/4) -> 11551 | U544: =1000*110/100*(1+(50+RC[-19]/10)/200)*100 -> 167365
B545: 544 | C545: 0 | D545: 400544 | E545: 1,7,6462,0;1,4,1399,0; | G545: 1 | H545: 7 | I545: 6462 | J545: 0 | L545: 1 | M545: 4 | N545: 1399 | O545: 0 | Q545: ="1,7,"&RC[2]&",0;"&"1,4,"&RC[4]&",0;" -> 1,7,11562,0;1,4,167420,0; | S545: =INT(((50+RC[-17]/10)*35+200)*12/4) -> 11562 | U545: =1000*110/100*(1+(50+RC[-19]/10)/200)*100 -> 167420
B546: 545 | C546: 0 | D546: 400545 | E546: 1,7,6472,0;1,4,1399,0; | G546: 1 | H546: 7 | I546: 6472 | J546: 0 | L546: 1 | M546: 4 | N546: 1399 | O546: 0 | Q546: ="1,7,"&RC[2]&",0;"&"1,4,"&RC[4]&",0;" -> 1,7,11572,0;1,4,167475,0; | S546: =INT(((50+RC[-17]/10)*35+200)*12/4) -> 11572 | U546: =1000*110/100*(1+(50+RC[-19]/10)/200)*100 -> 167475
B547: 546 | C547: 0 | D547: 400546 | E547: 1,7,6483,0;1,4,1400,0; | G547: 1 | H547: 7 | I547: 6483 | J547: 0 | L547: 1 | M547: 4 | N547: 1400 | O547: 0 | Q547: ="1,7,"&RC[2]&",0;"&"1,4,"&RC[4]&",0;" -> 1,7,11583,0;1,4,167530,0; | S547: =INT(((50+RC[-17]/10)*35+200)*12/4) -> 11583 | U547: =1000*110/100*(1+(50+RC[-19]/10)/200)*100 -> 167530.00000000003
B548: 547 | C548: 0 | D548: 400547 | E548: 1,7,6493,0;1,4,1400,0; | G548: 1 | H548: 7 | I548: 6493 | J548: 0 | L548: 1 | M548: 4 | N548: 1400 | O548: 0 | Q548: ="1,7,"&RC[2]&",0;"&"1,4,"&RC[4]&",0;" -> 1,7,11593,0;1,4,167585,0; | S548: =INT(((50+RC[-17]/10)*35+200)*12/4) -> 11593 | U548: =1000*110/100*(1+(50+RC[-19]/10)/200)*100 -> 167585
B549: 548 | C549: 0 | D549: 400548 | E549: 1,7,6504,0;1,4,1401,0; | G549: 1 | H549: 7 | I549: 6504 | J549: 0 | L549: 1 | M549: 4 | N549: 1401 | O549: 0 | Q549: ="1,7,"&RC[2]&",0;"&"1,4,"&RC[4]&",0;" -> 1,7,11604,0;1,4,167640,0; | S549: =INT(((50+RC[-17]/10)*35+200)*12/4) -> 11604 | U549: =1000*110/100*(1+(50+RC[-19]/10)/200)*100 -> 167640
B550: 549 | C550: 0 | D550: 400549 | E550: 1,7,6514,0;1,4,1401,0; | G550: 1 | H550: 7 | I550: 6514 | J550: 0 | L550: 1 | M550: 4 | N550: 1401 | O550: 0 | Q550: ="1,7,"&RC[2]&",0;"&"1,4,"&RC[4]&",0;" -> 1,7,11614,0;1,4,167695,0; | S550: =INT(((50+RC[-17]/10)*35+200)*12/4) -> 11614 | U550: =1000*110/100*(1+(50+RC[-19]/10)/200)*100 -> 167695.00000000003
B551: 550 | C551: 0 | D551: 400550 | E551: 1,7,6525,0;1,4,1402,0; | G551: 1 | H551: 7 | I551: 6525 | J551: 0 | L551: 1 | M551: 4 | N551: 1402 | O551: 0 | Q551: ="1,7,"&RC[2]&",0;"&"1,4,"&RC[4]&",0;" -> 1,7,11625,0;1,4,167750,0; | S551: =INT(((50+RC[-17]/10)*35+200)*12/4) -> 11625 | U551: =1000*110/100*(1+(50+RC[-19]/10)/200)*100 -> 167750
B552: 551 | C552: 0 | D552: 400551 | E552: 1,7,6535,0;1,4,1403,0; | G552: 1 | H552: 7 | I552: 6535 | J552: 0 | L552: 1 | M552: 4 | N552: 1403 | O552: 0 | Q552: ="1,7,"&RC[2]&",0;"&"1,4,"&RC[4]&",0;" -> 1,7,11635,0;1,4,167805,0; | S552: =INT(((50+RC[-17]/10)*35+200)*12/4) -> 11635 | U552: =1000*110/100*(1+(50+RC[-19]/10)/200)*100 -> 167805.00000000003
B553: 552 | C553: 0 | D553: 400552 | E553: 1,7,6546,0;1,4,1403,0; | G553: 1 | H553: 7 | I553: 6546 | J553: 0 | L553: 1 | M553: 4 | N553: 1403 | O553: 0 | Q553: ="1,7,"&RC[2]&",0;"&"1,4,"&RC[4]&",0;" -> 1,7,11646,0;1,4,167860,0; | S553: =INT(((50+RC[-17]/10)*35+200)*12/4) -> 11646 | U553: =1000*110/100*(1+(50+RC[-19]/10)/200)*100 -> 167860
B554: 553 | C554: 0 | D554: 400553 | E554: 1,7,6556,0;1,4,1404,0; | G554: 1 | H554: 7 | I554: 6556 | J554: 0 | L554: 1 | M554: 4 | N554: 1404 | O554: 0 | Q554: ="1,7,"&RC[2]&",0;"&"1,4,"&RC[4]&",0;" -> 1,7,11656,0;1,4,167915,0; | S554: =INT(((50+RC[-17]/10)*35+200)*12/4) -> 11656 | U554: =1000*110/100*(1+(50+RC[-19]/10)/200)*100 -> 167915
B555: 554 | C555: 0 | D555: 400554 | E555: 1,7,6567,0;1,4,1404,0; | G555: 1 | H555: 7 | I555: 6567 | J555: 0 | L555: 1 | M555: 4 | N555: 1404 | O555: 0 | Q555: ="1,7,"&RC[2]&",0;"&"1,4,"&RC[4]&",0;" -> 1,7,11667,0;1,4,167970,0; | S555: =INT(((50+RC[-17]/10)*35+200)*12/4) -> 11667 | U555: =1000*110/100*(1+(50+RC[-19]/10)/200)*100 -> 167970
B556: 555 | C556: 0 | D556: 400555 | E556: 1,7,6577,0;1,4,1405,0; | G556: 1 | H556: 7 | I556: 6577 | J556: 0 | L556: 1 | M556: 4 | N556: 1405 | O556: 0 | Q556: ="1,7,"&RC[2]&",0;"&"1,4,"&RC[4]&",0;" -> 1,7,11677,0;1,4,168025,0; | S556: =INT(((50+RC[-17]/10)*35+200)*12/4) -> 11677 | U556: =1000*110/100*(1+(50+RC[-19]/10)/200)*100 -> 168024.99999999997
B557: 556 | C557: 0 | D557: 400556 | E557: 1,7,6588,0;1,4,1405,0; | G557: 1 | H557: 7 | I557: 6588 | J557: 0 | L557: 1 | M557: 4 | N557: 1405 | O557: 0 | Q557: ="1,7,"&RC[2]&",0;"&"1,4,"&RC[4]&",0;" -> 1,7,11688,0;1,4,168080,0; | S557: =INT(((50+RC[-17]/10)*35+200)*12/4) -> 11688 | U557: =1000*110/100*(1+(50+RC[-19]/10)/200)*100 -> 168080
B558: 557 | C558: 0 | D558: 400557 | E558: 1,7,6598,0;1,4,1406,0; | G558: 1 | H558: 7 | I558: 6598 | J558: 0 | L558: 1 | M558: 4 | N558: 1406 | O558: 0 | Q558: ="1,7,"&RC[2]&",0;"&"1,4,"&RC[4]&",0;" -> 1,7,11698,0;1,4,168135,0; | S558: =INT(((50+RC[-17]/10)*35+200)*12/4) -> 11698 | U558: =1000*110/100*(1+(50+RC[-19]/10)/200)*100 -> 168135
B559: 558 | C559: 0 | D559: 400558 | E559: 1,7,6609,0;1,4,1406,0; | G559: 1 | H559: 7 | I559: 6609 | J559: 0 | L559: 1 | M559: 4 | N559: 1406 | O559: 0 | Q559: ="1,7,"&RC[2]&",0;"&"1,4,"&RC[4]&",0;" -> 1,7,11709,0;1,4,168190,0; | S559: =INT(((50+RC[-17]/10)*35+200)*12/4) -> 11709 | U559: =1000*110/100*(1+(50+RC[-19]/10)/200)*100 -> 168190
B560: 559 | C560: 0 | D560: 400559 | E560: 1,7,6619,0;1,4,1407,0; | G560: 1 | H560: 7 | I560: 6619 | J560: 0 | L560: 1 | M560: 4 | N560: 1407 | O560: 0 | Q560: ="1,7,"&RC[2]&",0;"&"1,4,"&RC[4]&",0;" -> 1,7,11719,0;1,4,168245,0; | S560: =INT(((50+RC[-17]/10)*35+200)*12/4) -> 11719 | U560: =1000*110/100*(1+(50+RC[-19]/10)/200)*100 -> 168245
B561: 560 | C561: 0 | D561: 400560 | E561: 1,7,6630,0;1,4,1408,0; | G561: 1 | H561: 7 | I561: 6630 | J561: 0 | L561: 1 | M561: 4 | N561: 1408 | O561: 0 | Q561: ="1,7,"&RC[2]&",0;"&"1,4,"&RC[4]&",0;" -> 1,7,11730,0;1,4,168300,0; | S561: =INT(((50+RC[-17]/10)*35+200)*12/4) -> 11730 | U561: =1000*110/100*(1+(50+RC[-19]/10)/200)*100 -> 168300
B562: 561 | C562: 0 | D562: 400561 | E562: 1,7,6640,0;1,4,1408,0; | G562: 1 | H562: 7 | I562: 6640 | J562: 0 | L562: 1 | M562: 4 | N562: 1408 | O562: 0 | Q562: ="1,7,"&RC[2]&",0;"&"1,4,"&RC[4]&",0;" -> 1,7,11740,0;1,4,168355,0; | S562: =INT(((50+RC[-17]/10)*35+200)*12/4) -> 11740 | U562: =1000*110/100*(1+(50+RC[-19]/10)/200)*100 -> 168355
B563: 562 | C563: 0 | D563: 400562 | E563: 1,7,6651,0;1,4,1409,0; | G563: 1 | H563: 7 | I563: 6651 | J563: 0 | L563: 1 | M563: 4 | N563: 1409 | O563: 0 | Q563: ="1,7,"&RC[2]&",0;"&"1,4,"&RC[4]&",0;" -> 1,7,11751,0;1,4,168410,0; | S563: =INT(((50+RC[-17]/10)*35+200)*12/4) -> 11751 | U563: =1000*110/100*(1+(50+RC[-19]/10)/200)*100 -> 168410
B564: 563 | C564: 0 | D564: 400563 | E564: 1,7,6661,0;1,4,1409,0; | G564: 1 | H564: 7 | I564: 6661 | J564: 0 | L564: 1 | M564: 4 | N564: 1409 | O564: 0 | Q564: ="1,7,"&RC[2]&",0;"&"1,4,"&RC[4]&",0;" -> 1,7,11761,0;1,4,168465,0; | S564: =INT(((50+RC[-17]/10)*35+200)*12/4) -> 11761 | U564: =1000*110/100*(1+(50+RC[-19]/10)/200)*100 -> 168465
B565: 564 | C565: 0 | D565: 400564 | E565: 1,7,6672,0;1,4,1410,0; | G565: 1 | H565: 7 | I565: 6672 | J565: 0 | L565: 1 | M565: 4 | N565: 1410 | O565: 0 | Q565: ="1,7,"&RC[2]&",0;"&"1,4,"&RC[4]&",0;" -> 1,7,11772,0;1,4,168520,0; | S565: =INT(((50+RC[-17]/10)*35+200)*12/4) -> 11772 | U565: =1000*110/100*(1+(50+RC[-19]/10)/200)*100 -> 168520
B566: 565 | C566: 0 | D566: 400565 | E566: 1,7,6682,0;1,4,1410,0; | G566: 1 | H566: 7 | I566: 6682 | J566: 0 | L566: 1 | M566: 4 | N566: 1410 | O566: 0 | Q566: ="1,7,"&RC[2]&",0;"&"1,4,"&RC[4]&",0;" -> 1,7,11782,0;1,4,168575,0; | S566: =INT(((50+RC[-17]/10)*35+200)*12/4) -> 11782 | U566: =1000*110/100*(1+(50+RC[-19]/10)/200)*100 -> 168575
B567: 566 | C567: 0 | D567: 400566 | E567: 1,7,6693,0;1,4,1411,0; | G567: 1 | H567: 7 | I567: 6693 | J567: 0 | L567: 1 | M567: 4 | N567: 1411 | O567: 0 | Q567: ="1,7,"&RC[2]&",0;"&"1,4,"&RC[4]&",0;" -> 1,7,11793,0;1,4,168630,0; | S567: =INT(((50+RC[-17]/10)*35+200)*12/4) -> 11793 | U567: =1000*110/100*(1+(50+RC[-19]/10)/200)*100 -> 168630
B568: 567 | C568: 0 | D568: 400567 | E568: 1,7,6703,0;1,4,1411,0; | G568: 1 | H568: 7 | I568: 6703 | J568: 0 | L568: 1 | M568: 4 | N568: 1411 | O568: 0 | Q568: ="1,7,"&RC[2]&",0;"&"1,4,"&RC[4]&",0;" -> 1,7,11803,0;1,4,168685,0; | S568: =INT(((50+RC[-17]/10)*35+200)*12/4) -> 11803 | U568: =1000*110/100*(1+(50+RC[-19]/10)/200)*100 -> 168685
B569: 568 | C569: 0 | D569: 400568 | E569: 1,7,6714,0;1,4,1412,0; | G569: 1 | H569: 7 | I569: 6714 | J569: 0 | L569: 1 | M569: 4 | N569: 1412 | O569: 0 | Q569: ="1,7,"&RC[2]&",0;"&"1,4,"&RC[4]&",0;" -> 1,7,11814,0;1,4,168740,0; | S569: =INT(((50+RC[-17]/10)*35+200)*12/4) -> 11814 | U569: =1000*110/100*(1+(50+RC[-19]/10)/200)*100 -> 168740
B570: 569 | C570: 0 | D570: 400569 | E570: 1,7,6724,0;1,4,1412,0; | G570: 1 | H570: 7 | I570: 6724 | J570: 0 | L570: 1 | M570: 4 | N570: 1412 | O570: 0 | Q570: ="1,7,"&RC[2]&",0;"&"1,4,"&RC[4]&",0;" -> 1,7,11824,0;1,4,168795,0; | S570: =INT(((50+RC[-17]/10)*35+200)*12/4) -> 11824 | U570: =1000*110/100*(1+(50+RC[-19]/10)/200)*100 -> 168795
B571: 570 | C571: 0 | D571: 400570 | E571: 1,7,6735,0;1,4,1413,0; | G571: 1 | H571: 7 | I571: 6735 | J571: 0 | L571: 1 | M571: 4 | N571: 1413 | O571: 0 | Q571: ="1,7,"&RC[2]&",0;"&"1,4,"&RC[4]&",0;" -> 1,7,11835,0;1,4,168850,0; | S571: =INT(((50+RC[-17]/10)*35+200)*12/4) -> 11835 | U571: =1000*110/100*(1+(50+RC[-19]/10)/200)*100 -> 168850.00000000003
B572: 571 | C572: 0 | D572: 400571 | E572: 1,7,6745,0;1,4,1414,0; | G572: 1 | H572: 7 | I572: 6745 | J572: 0 | L572: 1 | M572: 4 | N572: 1414 | O572: 0 | Q572: ="1,7,"&RC[2]&",0;"&"1,4,"&RC[4]&",0;" -> 1,7,11845,0;1,4,168905,0; | S572: =INT(((50+RC[-17]/10)*35+200)*12/4) -> 11845 | U572: =1000*110/100*(1+(50+RC[-19]/10)/200)*100 -> 168905
B573: 572 | C573: 0 | D573: 400572 | E573: 1,7,6756,0;1,4,1414,0; | G573: 1 | H573: 7 | I573: 6756 | J573: 0 | L573: 1 | M573: 4 | N573: 1414 | O573: 0 | Q573: ="1,7,"&RC[2]&",0;"&"1,4,"&RC[4]&",0;" -> 1,7,11856,0;1,4,168960,0; | S573: =INT(((50+RC[-17]/10)*35+200)*12/4) -> 11856 | U573: =1000*110/100*(1+(50+RC[-19]/10)/200)*100 -> 168960
B574: 573 | C574: 0 | D574: 400573 | E574: 1,7,6766,0;1,4,1415,0; | G574: 1 | H574: 7 | I574: 6766 | J574: 0 | L574: 1 | M574: 4 | N574: 1415 | O574: 0 | Q574: ="1,7,"&RC[2]&",0;"&"1,4,"&RC[4]&",0;" -> 1,7,11866,0;1,4,169015,0; | S574: =INT(((50+RC[-17]/10)*35+200)*12/4) -> 11866 | U574: =1000*110/100*(1+(50+RC[-19]/10)/200)*100 -> 169015
B575: 574 | C575: 0 | D575: 400574 | E575: 1,7,6777,0;1,4,1415,0; | G575: 1 | H575: 7 | I575: 6777 | J575: 0 | L575: 1 | M575: 4 | N575: 1415 | O575: 0 | Q575: ="1,7,"&RC[2]&",0;"&"1,4,"&RC[4]&",0;" -> 1,7,11877,0;1,4,169070,0; | S575: =INT(((50+RC[-17]/10)*35+200)*12/4) -> 11877 | U575: =1000*110/100*(1+(50+RC[-19]/10)/200)*100 -> 169069.99999999997
B576: 575 | C576: 0 | D576: 400575 | E576: 1,7,6787,0;1,4,1416,0; | G576: 1 | H576: 7 | I576: 6787 | J576: 0 | L576: 1 | M576: 4 | N576: 1416 | O576: 0 | Q576: ="1,7,"&RC[2]&",0;"&"1,4,"&RC[4]&",0;" -> 1,7,11887,0;1,4,169125,0; | S576: =INT(((50+RC[-17]/10)*35+200)*12/4) -> 11887 | U576: =1000*110/100*(1+(50+RC[-19]/10)/200)*100 -> 169125
B577: 576 | C577: 0 | D577: 400576 | E577: 1,7,6798,0;1,4,1416,0; | G577: 1 | H577: 7 | I577: 6798 | J577: 0 | L577: 1 | M577: 4 | N577: 1416 | O577: 0 | Q577: ="1,7,"&RC[2]&",0;"&"1,4,"&RC[4]&",0;" -> 1,7,11898,0;1,4,169180,0; | S577: =INT(((50+RC[-17]/10)*35+200)*12/4) -> 11898 | U577: =1000*110/100*(1+(50+RC[-19]/10)/200)*100 -> 169179.99999999997
B578: 577 | C578: 0 | D578: 400577 | E578: 1,7,6808,0;1,4,1417,0; | G578: 1 | H578: 7 | I578: 6808 | J578: 0 | L578: 1 | M578: 4 | N578: 1417 | O578: 0 | Q578: ="1,7,"&RC[2]&",0;"&"1,4,"&RC[4]&",0;" -> 1,7,11908,0;1,4,169235,0; | S578: =INT(((50+RC[-17]/10)*35+200)*12/4) -> 11908 | U578: =1000*110/100*(1+(50+RC[-19]/10)/200)*100 -> 169235
B579: 578 | C579: 0 | D579: 400578 | E579: 1,7,6819,0;1,4,1417,0; | G579: 1 | H579: 7 | I579: 6819 | J579: 0 | L579: 1 | M579: 4 | N579: 1417 | O579: 0 | Q579: ="1,7,"&RC[2]&",0;"&"1,4,"&RC[4]&",0;" -> 1,7,11919,0;1,4,169290,0; | S579: =INT(((50+RC[-17]/10)*35+200)*12/4) -> 11919 | U579: =1000*110/100*(1+(50+RC[-19]/10)/200)*100 -> 169290
B580: 579 | C580: 0 | D580: 400579 | E580: 1,7,6829,0;1,4,1418,0; | G580: 1 | H580: 7 | I580: 6829 | J580: 0 | L580: 1 | M580: 4 | N580: 1418 | O580: 0 | Q580: ="1,7,"&RC[2]&",0;"&"1,4,"&RC[4]&",0;" -> 1,7,11929,0;1,4,169345,0; | S580: =INT(((50+RC[-17]/10)*35+200)*12/4) -> 11929 | U580: =1000*110/100*(1+(50+RC[-19]/10)/200)*100 -> 169344.99999999997
B581: 580 | C581: 0 | D581: 400580 | E581: 1,7,6840,0;1,4,1419,0; | G581: 1 | H581: 7 | I581: 6840 | J581: 0 | L581: 1 | M581: 4 | N581: 1419 | O581: 0 | Q581: ="1,7,"&RC[2]&",0;"&"1,4,"&RC[4]&",0;" -> 1,7,11940,0;1,4,169400,0; | S581: =INT(((50+RC[-17]/10)*35+200)*12/4) -> 11940 | U581: =1000*110/100*(1+(50+RC[-19]/10)/200)*100 -> 169400
B582: 581 | C582: 0 | D582: 400581 | E582: 1,7,6850,0;1,4,1419,0; | G582: 1 | H582: 7 | I582: 6850 | J582: 0 | L582: 1 | M582: 4 | N582: 1419 | O582: 0 | Q582: ="1,7,"&RC[2]&",0;"&"1,4,"&RC[4]&",0;" -> 1,7,11950,0;1,4,169455,0; | S582: =INT(((50+RC[-17]/10)*35+200)*12/4) -> 11950 | U582: =1000*110/100*(1+(50+RC[-19]/10)/200)*100 -> 169455
B583: 582 | C583: 0 | D583: 400582 | E583: 1,7,6861,0;1,4,1420,0; | G583: 1 | H583: 7 | I583: 6861 | J583: 0 | L583: 1 | M583: 4 | N583: 1420 | O583: 0 | Q583: ="1,7,"&RC[2]&",0;"&"1,4,"&RC[4]&",0;" -> 1,7,11961,0;1,4,169510,0; | S583: =INT(((50+RC[-17]/10)*35+200)*12/4) -> 11961 | U583: =1000*110/100*(1+(50+RC[-19]/10)/200)*100 -> 169510
B584: 583 | C584: 0 | D584: 400583 | E584: 1,7,6871,0;1,4,1420,0; | G584: 1 | H584: 7 | I584: 6871 | J584: 0 | L584: 1 | M584: 4 | N584: 1420 | O584: 0 | Q584: ="1,7,"&RC[2]&",0;"&"1,4,"&RC[4]&",0;" -> 1,7,11971,0;1,4,169565,0; | S584: =INT(((50+RC[-17]/10)*35+200)*12/4) -> 11971 | U584: =1000*110/100*(1+(50+RC[-19]/10)/200)*100 -> 169565
B585: 584 | C585: 0 | D585: 400584 | E585: 1,7,6882,0;1,4,1421,0; | G585: 1 | H585: 7 | I585: 6882 | J585: 0 | L585: 1 | M585: 4 | N585: 1421 | O585: 0 | Q585: ="1,7,"&RC[2]&",0;"&"1,4,"&RC[4]&",0;" -> 1,7,11982,0;1,4,169620,0; | S585: =INT(((50+RC[-17]/10)*35+200)*12/4) -> 11982 | U585: =1000*110/100*(1+(50+RC[-19]/10)/200)*100 -> 169620
B586: 585 | C586: 0 | D586: 400585 | E586: 1,7,6892,0;1,4,1421,0; | G586: 1 | H586: 7 | I586: 6892 | J586: 0 | L586: 1 | M586: 4 | N586: 1421 | O586: 0 | Q586: ="1,7,"&RC[2]&",0;"&"1,4,"&RC[4]&",0;" -> 1,7,11992,0;1,4,169675,0; | S586: =INT(((50+RC[-17]/10)*35+200)*12/4) -> 11992 | U586: =1000*110/100*(1+(50+RC[-19]/10)/200)*100 -> 169675
B587: 586 | C587: 0 | D587: 400586 | E587: 1,7,6903,0;1,4,1422,0; | G587: 1 | H587: 7 | I587: 6903 | J587: 0 | L587: 1 | M587: 4 | N587: 1422 | O587: 0 | Q587: ="1,7,"&RC[2]&",0;"&"1,4,"&RC[4]&",0;" -> 1,7,12003,0;1,4,169730,0; | S587: =INT(((50+RC[-17]/10)*35+200)*12/4) -> 12003 | U587: =1000*110/100*(1+(50+RC[-19]/10)/200)*100 -> 169730
B588: 587 | C588: 0 | D588: 400587 | E588: 1,7,6913,0;1,4,1422,0; | G588: 1 | H588: 7 | I588: 6913 | J588: 0 | L588: 1 | M588: 4 | N588: 1422 | O588: 0 | Q588: ="1,7,"&RC[2]&",0;"&"1,4,"&RC[4]&",0;" -> 1,7,12013,0;1,4,169785,0; | S588: =INT(((50+RC[-17]/10)*35+200)*12/4) -> 12013 | U588: =1000*110/100*(1+(50+RC[-19]/10)/200)*100 -> 169785
B589: 588 | C589: 0 | D589: 400588 | E589: 1,7,6924,0;1,4,1423,0; | G589: 1 | H589: 7 | I589: 6924 | J589: 0 | L589: 1 | M589: 4 | N589: 1423 | O589: 0 | Q589: ="1,7,"&RC[2]&",0;"&"1,4,"&RC[4]&",0;" -> 1,7,12024,0;1,4,169840,0; | S589: =INT(((50+RC[-17]/10)*35+200)*12/4) -> 12024 | U589: =1000*110/100*(1+(50+RC[-19]/10)/200)*100 -> 169840
B590: 589 | C590: 0 | D590: 400589 | E590: 1,7,6934,0;1,4,1423,0; | G590: 1 | H590: 7 | I590: 6934 | J590: 0 | L590: 1 | M590: 4 | N590: 1423 | O590: 0 | Q590: ="1,7,"&RC[2]&",0;"&"1,4,"&RC[4]&",0;" -> 1,7,12034,0;1,4,169895,0; | S590: =INT(((50+RC[-17]/10)*35+200)*12/4) -> 12034 | U590: =1000*110/100*(1+(50+RC[-19]/10)/200)*100 -> 169895
B591: 590 | C591: 0 | D591: 400590 | E591: 1,7,6945,0;1,4,1424,0; | G591: 1 | H591: 7 | I591: 6945 | J591: 0 | L591: 1 | M591: 4 | N591: 1424 | O591: 0 | Q591: ="1,7,"&RC[2]&",0;"&"1,4,"&RC[4]&",0;" -> 1,7,12045,0;1,4,169950,0; | S591: =INT(((50+RC[-17]/10)*35+200)*12/4) -> 12045 | U591: =1000*110/100*(1+(50+RC[-19]/10)/200)*100 -> 169950
B592: 591 | C592: 0 | D592: 400591 | E592: 1,7,6955,0;1,4,1425,0; | G592: 1 | H592: 7 | I592: 6955 | J592: 0 | L592: 1 | M592: 4 | N592: 1425 | O592: 0 | Q592: ="1,7,"&RC[2]&",0;"&"1,4,"&RC[4]&",0;" -> 1,7,12055,0;1,4,170005,0; | S592: =INT(((50+RC[-17]/10)*35+200)*12/4) -> 12055 | U592: =1000*110/100*(1+(50+RC[-19]/10)/200)*100 -> 170005.00000000003
B593: 592 | C593: 0 | D593: 400592 | E593: 1,7,6966,0;1,4,1425,0; | G593: 1 | H593: 7 | I593: 6966 | J593: 0 | L593: 1 | M593: 4 | N593: 1425 | O593: 0 | Q593: ="1,7,"&RC[2]&",0;"&"1,4,"&RC[4]&",0;" -> 1,7,12066,0;1,4,170060,0; | S593: =INT(((50+RC[-17]/10)*35+200)*12/4) -> 12066 | U593: =1000*110/100*(1+(50+RC[-19]/10)/200)*100 -> 170060
B594: 593 | C594: 0 | D594: 400593 | E594: 1,7,6976,0;1,4,1426,0; | G594: 1 | H594: 7 | I594: 6976 | J594: 0 | L594: 1 | M594: 4 | N594: 1426 | O594: 0 | Q594: ="1,7,"&RC[2]&",0;"&"1,4,"&RC[4]&",0;" -> 1,7,12076,0;1,4,170115,0; | S594: =INT(((50+RC[-17]/10)*35+200)*12/4) -> 12076 | U594: =1000*110/100*(1+(50+RC[-19]/10)/200)*100 -> 170115
B595: 594 | C595: 0 | D595: 400594 | E595: 1,7,6987,0;1,4,1426,0; | G595: 1 | H595: 7 | I595: 6987 | J595: 0 | L595: 1 | M595: 4 | N595: 1426 | O595: 0 | Q595: ="1,7,"&RC[2]&",0;"&"1,4,"&RC[4]&",0;" -> 1,7,12087,0;1,4,170170,0; | S595: =INT(((50+RC[-17]/10)*35+200)*12/4) -> 12087 | U595: =1000*110/100*(1+(50+RC[-19]/10)/200)*100 -> 170170.00000000003
B596: 595 | C596: 0 | D596: 400595 | E596: 1,7,6997,0;1,4,1427,0; | G596: 1 | H596: 7 | I596: 6997 | J596: 0 | L596: 1 | M596: 4 | N596: 1427 | O596: 0 | Q596: ="1,7,"&RC[2]&",0;"&"1,4,"&RC[4]&",0;" -> 1,7,12097,0;1,4,170225,0; | S596: =INT(((50+RC[-17]/10)*35+200)*12/4) -> 12097 | U596: =1000*110/100*(1+(50+RC[-19]/10)/200)*100 -> 170224.99999999997
B597: 596 | C597: 0 | D597: 400596 | E597: 1,7,7008,0;1,4,1427,0; | G597: 1 | H597: 7 | I597: 7008 | J597: 0 | L597: 1 | M597: 4 | N597: 1427 | O597: 0 | Q597: ="1,7,"&RC[2]&",0;"&"1,4,"&RC[4]&",0;" -> 1,7,12108,0;1,4,170280,0; | S597: =INT(((50+RC[-17]/10)*35+200)*12/4) -> 12108 | U597: =1000*110/100*(1+(50+RC[-19]/10)/200)*100 -> 170280
B598: 597 | C598: 0 | D598: 400597 | E598: 1,7,7018,0;1,4,1428,0; | G598: 1 | H598: 7 | I598: 7018 | J598: 0 | L598: 1 | M598: 4 | N598: 1428 | O598: 0 | Q598: ="1,7,"&RC[2]&",0;"&"1,4,"&RC[4]&",0;" -> 1,7,12118,0;1,4,170335,0; | S598: =INT(((50+RC[-17]/10)*35+200)*12/4) -> 12118 | U598: =1000*110/100*(1+(50+RC[-19]/10)/200)*100 -> 170335
B599: 598 | C599: 0 | D599: 400598 | E599: 1,7,7029,0;1,4,1428,0; | G599: 1 | H599: 7 | I599: 7029 | J599: 0 | L599: 1 | M599: 4 | N599: 1428 | O599: 0 | Q599: ="1,7,"&RC[2]&",0;"&"1,4,"&RC[4]&",0;" -> 1,7,12129,0;1,4,170390,0; | S599: =INT(((50+RC[-17]/10)*35+200)*12/4) -> 12129 | U599: =1000*110/100*(1+(50+RC[-19]/10)/200)*100 -> 170390
B600: 599 | C600: 0 | D600: 400599 | E600: 1,7,7039,0;1,4,1429,0; | G600: 1 | H600: 7 | I600: 7039 | J600: 0 | L600: 1 | M600: 4 | N600: 1429 | O600: 0 | Q600: ="1,7,"&RC[2]&",0;"&"1,4,"&RC[4]&",0;" -> 1,7,12139,0;1,4,170445,0; | S600: =INT(((50+RC[-17]/10)*35+200)*12/4) -> 12139 | U600: =1000*110/100*(1+(50+RC[-19]/10)/200)*100 -> 170445
B601: 600 | C601: 0 | D601: 400600 | E601: 1,7,7050,0;1,4,1430,0; | G601: 1 | H601: 7 | I601: 7050 | J601: 0 | L601: 1 | M601: 4 | N601: 1430 | O601: 0 | Q601: ="1,7,"&RC[2]&",0;"&"1,4,"&RC[4]&",0;" -> 1,7,12150,0;1,4,170500,0; | S601: =INT(((50+RC[-17]/10)*35+200)*12/4) -> 12150 | U601: =1000*110/100*(1+(50+RC[-19]/10)/200)*100 -> 170500
B602: 601 | C602: 0 | D602: 400601 | E602: 1,7,7060,0;1,4,1430,0; | G602: 1 | H602: 7 | I602: 7060 | J602: 0 | L602: 1 | M602: 4 | N602: 1430 | O602: 0 | Q602: ="1,7,"&RC[2]&",0;"&"1,4,"&RC[4]&",0;" -> 1,7,12160,0;1,4,170555,0; | S602: =INT(((50+RC[-17]/10)*35+200)*12/4) -> 12160 | U602: =1000*110/100*(1+(50+RC[-19]/10)/200)*100 -> 170555
B603: 602 | C603: 0 | D603: 400602 | E603: 1,7,7071,0;1,4,1431,0; | G603: 1 | H603: 7 | I603: 7071 | J603: 0 | L603: 1 | M603: 4 | N603: 1431 | O603: 0 | Q603: ="1,7,"&RC[2]&",0;"&"1,4,"&RC[4]&",0;" -> 1,7,12171,0;1,4,170610,0; | S603: =INT(((50+RC[-17]/10)*35+200)*12/4) -> 12171 | U603: =1000*110/100*(1+(50+RC[-19]/10)/200)*100 -> 170610
B604: 603 | C604: 0 | D604: 400603 | E604: 1,7,7081,0;1,4,1431,0; | G604: 1 | H604: 7 | I604: 7081 | J604: 0 | L604: 1 | M604: 4 | N604: 1431 | O604: 0 | Q604: ="1,7,"&RC[2]&",0;"&"1,4,"&RC[4]&",0;" -> 1,7,12181,0;1,4,170665,0; | S604: =INT(((50+RC[-17]/10)*35+200)*12/4) -> 12181 | U604: =1000*110/100*(1+(50+RC[-19]/10)/200)*100 -> 170665
B605: 604 | C605: 0 | D605: 400604 | E605: 1,7,7092,0;1,4,1432,0; | G605: 1 | H605: 7 | I605: 7092 | J605: 0 | L605: 1 | M605: 4 | N605: 1432 | O605: 0 | Q605: ="1,7,"&RC[2]&",0;"&"1,4,"&RC[4]&",0;" -> 1,7,12192,0;1,4,170720,0; | S605: =INT(((50+RC[-17]/10)*35+200)*12/4) -> 12192 | U605: =1000*110/100*(1+(50+RC[-19]/10)/200)*100 -> 170720
B606: 605 | C606: 0 | D606: 400605 | E606: 1,7,7102,0;1,4,1432,0; | G606: 1 | H606: 7 | I606: 7102 | J606: 0 | L606: 1 | M606: 4 | N606: 1432 | O606: 0 | Q606: ="1,7,"&RC[2]&",0;"&"1,4,"&RC[4]&",0;" -> 1,7,12202,0;1,4,170775,0; | S606: =INT(((50+RC[-17]/10)*35+200)*12/4) -> 12202 | U606: =1000*110/100*(1+(50+RC[-19]/10)/200)*100 -> 170775
B607: 606 | C607: 0 | D607: 400606 | E607: 1,7,7113,0;1,4,1433,0; | G607: 1 | H607: 7 | I607: 7113 | J607: 0 | L607: 1 | M607: 4 | N607: 1433 | O607: 0 | Q607: ="1,7,"&RC[2]&",0;"&"1,4,"&RC[4]&",0;" -> 1,7,12213,0;1,4,170830,0; | S607: =INT(((50+RC[-17]/10)*35+200)*12/4) -> 12213 | U607: =1000*110/100*(1+(50+RC[-19]/10)/200)*100 -> 170830
B608: 607 | C608: 0 | D608: 400607 | E608: 1,7,7123,0;1,4,1433,0; | G608: 1 | H608: 7 | I608: 7123 | J608: 0 | L608: 1 | M608: 4 | N608: 1433 | O608: 0 | Q608: ="1,7,"&RC[2]&",0;"&"1,4,"&RC[4]&",0;" -> 1,7,12223,0;1,4,170885,0; | S608: =INT(((50+RC[-17]/10)*35+200)*12/4) -> 12223 | U608: =1000*110/100*(1+(50+RC[-19]/10)/200)*100 -> 170885
B609: 608 | C609: 0 | D609: 400608 | E609: 1,7,7134,0;1,4,1434,0; | G609: 1 | H609: 7 | I609: 7134 | J609: 0 | L609: 1 | M609: 4 | N609: 1434 | O609: 0 | Q609: ="1,7,"&RC[2]&",0;"&"1,4,"&RC[4]&",0;" -> 1,7,12234,0;1,4,170940,0; | S609: =INT(((50+RC[-17]/10)*35+200)*12/4) -> 12234 | U609: =1000*110/100*(1+(50+RC[-19]/10)/200)*100 -> 170940
B610: 609 | C610: 0 | D610: 400609 | E610: 1,7,7144,0;1,4,1434,0; | G610: 1 | H610: 7 | I610: 7144 | J610: 0 | L610: 1 | M610: 4 | N610: 1434 | O610: 0 | Q610: ="1,7,"&RC[2]&",0;"&"1,4,"&RC[4]&",0;" -> 1,7,12244,0;1,4,170995,0; | S610: =INT(((50+RC[-17]/10)*35+200)*12/4) -> 12244 | U610: =1000*110/100*(1+(50+RC[-19]/10)/200)*100 -> 170995
B611: 610 | C611: 0 | D611: 400610 | E611: 1,7,7155,0;1,4,1435,0; | G611: 1 | H611: 7 | I611: 7155 | J611: 0 | L611: 1 | M611: 4 | N611: 1435 | O611: 0 | Q611: ="1,7,"&RC[2]&",0;"&"1,4,"&RC[4]&",0;" -> 1,7,12255,0;1,4,171050,0; | S611: =INT(((50+RC[-17]/10)*35+200)*12/4) -> 12255 | U611: =1000*110/100*(1+(50+RC[-19]/10)/200)*100 -> 171050.00000000003
B612: 611 | C612: 0 | D612: 400611 | E612: 1,7,7165,0;1,4,1436,0; | G612: 1 | H612: 7 | I612: 7165 | J612: 0 | L612: 1 | M612: 4 | N612: 1436 | O612: 0 | Q612: ="1,7,"&RC[2]&",0;"&"1,4,"&RC[4]&",0;" -> 1,7,12265,0;1,4,171105,0; | S612: =INT(((50+RC[-17]/10)*35+200)*12/4) -> 12265 | U612: =1000*110/100*(1+(50+RC[-19]/10)/200)*100 -> 171105
B613: 612 | C613: 0 | D613: 400612 | E613: 1,7,7176,0;1,4,1436,0; | G613: 1 | H613: 7 | I613: 7176 | J613: 0 | L613: 1 | M613: 4 | N613: 1436 | O613: 0 | Q613: ="1,7,"&RC[2]&",0;"&"1,4,"&RC[4]&",0;" -> 1,7,12276,0;1,4,171160,0; | S613: =INT(((50+RC[-17]/10)*35+200)*12/4) -> 12276 | U613: =1000*110/100*(1+(50+RC[-19]/10)/200)*100 -> 171160
B614: 613 | C614: 0 | D614: 400613 | E614: 1,7,7186,0;1,4,1437,0; | G614: 1 | H614: 7 | I614: 7186 | J614: 0 | L614: 1 | M614: 4 | N614: 1437 | O614: 0 | Q614: ="1,7,"&RC[2]&",0;"&"1,4,"&RC[4]&",0;" -> 1,7,12286,0;1,4,171215,0; | S614: =INT(((50+RC[-17]/10)*35+200)*12/4) -> 12286 | U614: =1000*110/100*(1+(50+RC[-19]/10)/200)*100 -> 171215
B615: 614 | C615: 0 | D615: 400614 | E615: 1,7,7197,0;1,4,1437,0; | G615: 1 | H615: 7 | I615: 7197 | J615: 0 | L615: 1 | M615: 4 | N615: 1437 | O615: 0 | Q615: ="1,7,"&RC[2]&",0;"&"1,4,"&RC[4]&",0;" -> 1,7,12297,0;1,4,171270,0; | S615: =INT(((50+RC[-17]/10)*35+200)*12/4) -> 12297 | U615: =1000*110/100*(1+(50+RC[-19]/10)/200)*100 -> 171270
B616: 615 | C616: 0 | D616: 400615 | E616: 1,7,7207,0;1,4,1438,0; | G616: 1 | H616: 7 | I616: 7207 | J616: 0 | L616: 1 | M616: 4 | N616: 1438 | O616: 0 | Q616: ="1,7,"&RC[2]&",0;"&"1,4,"&RC[4]&",0;" -> 1,7,12307,0;1,4,171325,0; | S616: =INT(((50+RC[-17]/10)*35+200)*12/4) -> 12307 | U616: =1000*110/100*(1+(50+RC[-19]/10)/200)*100 -> 171325.00000000003
B617: 616 | C617: 0 | D617: 400616 | E617: 1,7,7218,0;1,4,1438,0; | G617: 1 | H617: 7 | I617: 7218 | J617: 0 | L617: 1 | M617: 4 | N617: 1438 | O617: 0 | Q617: ="1,7,"&RC[2]&",0;"&"1,4,"&RC[4]&",0;" -> 1,7,12318,0;1,4,171380,0; | S617: =INT(((50+RC[-17]/10)*35+200)*12/4) -> 12318 | U617: =1000*110/100*(1+(50+RC[-19]/10)/200)*100 -> 171379.99999999997
B618: 617 | C618: 0 | D618: 400617 | E618: 1,7,7228,0;1,4,1439,0; | G618: 1 | H618: 7 | I618: 7228 | J618: 0 | L618: 1 | M618: 4 | N618: 1439 | O618: 0 | Q618: ="1,7,"&RC[2]&",0;"&"1,4,"&RC[4]&",0;" -> 1,7,12328,0;1,4,171435,0; | S618: =INT(((50+RC[-17]/10)*35+200)*12/4) -> 12328 | U618: =1000*110/100*(1+(50+RC[-19]/10)/200)*100 -> 171435
B619: 618 | C619: 0 | D619: 400618 | E619: 1,7,7239,0;1,4,1439,0; | G619: 1 | H619: 7 | I619: 7239 | J619: 0 | L619: 1 | M619: 4 | N619: 1439 | O619: 0 | Q619: ="1,7,"&RC[2]&",0;"&"1,4,"&RC[4]&",0;" -> 1,7,12339,0;1,4,171490,0; | S619: =INT(((50+RC[-17]/10)*35+200)*12/4) -> 12339 | U619: =1000*110/100*(1+(50+RC[-19]/10)/200)*100 -> 171490
B620: 619 | C620: 0 | D620: 400619 | E620: 1,7,7249,0;1,4,1440,0; | G620: 1 | H620: 7 | I620: 7249 | J620: 0 | L620: 1 | M620: 4 | N620: 1440 | O620: 0 | Q620: ="1,7,"&RC[2]&",0;"&"1,4,"&RC[4]&",0;" -> 1,7,12349,0;1,4,171545,0; | S620: =INT(((50+RC[-17]/10)*35+200)*12/4) -> 12349 | U620: =1000*110/100*(1+(50+RC[-19]/10)/200)*100 -> 171544.99999999997
B621: 620 | C621: 0 | D621: 400620 | E621: 1,7,7260,0;1,4,1441,0; | G621: 1 | H621: 7 | I621: 7260 | J621: 0 | L621: 1 | M621: 4 | N621: 1441 | O621: 0 | Q621: ="1,7,"&RC[2]&",0;"&"1,4,"&RC[4]&",0;" -> 1,7,12360,0;1,4,171600,0; | S621: =INT(((50+RC[-17]/10)*35+200)*12/4) -> 12360 | U621: =1000*110/100*(1+(50+RC[-19]/10)/200)*100 -> 171600
B622: 621 | C622: 0 | D622: 400621 | E622: 1,7,7270,0;1,4,1441,0; | G622: 1 | H622: 7 | I622: 7270 | J622: 0 | L622: 1 | M622: 4 | N622: 1441 | O622: 0 | Q622: ="1,7,"&RC[2]&",0;"&"1,4,"&RC[4]&",0;" -> 1,7,12370,0;1,4,171655,0; | S622: =INT(((50+RC[-17]/10)*35+200)*12/4) -> 12370 | U622: =1000*110/100*(1+(50+RC[-19]/10)/200)*100 -> 171655
B623: 622 | C623: 0 | D623: 400622 | E623: 1,7,7281,0;1,4,1442,0; | G623: 1 | H623: 7 | I623: 7281 | J623: 0 | L623: 1 | M623: 4 | N623: 1442 | O623: 0 | Q623: ="1,7,"&RC[2]&",0;"&"1,4,"&RC[4]&",0;" -> 1,7,12381,0;1,4,171710,0; | S623: =INT(((50+RC[-17]/10)*35+200)*12/4) -> 12381 | U623: =1000*110/100*(1+(50+RC[-19]/10)/200)*100 -> 171710
B624: 623 | C624: 0 | D624: 400623 | E624: 1,7,7291,0;1,4,1442,0; | G624: 1 | H624: 7 | I624: 7291 | J624: 0 | L624: 1 | M624: 4 | N624: 1442 | O624: 0 | Q624: ="1,7,"&RC[2]&",0;"&"1,4,"&RC[4]&",0;" -> 1,7,12391,0;1,4,171765,0; | S624: =INT(((50+RC[-17]/10)*35+200)*12/4) -> 12391 | U624: =1000*110/100*(1+(50+RC[-19]/10)/200)*100 -> 171765
B625: 624 | C625: 0 | D625: 400624 | E625: 1,7,7302,0;1,4,1443,0; | G625: 1 | H625: 7 | I625: 7302 | J625: 0 | L625: 1 | M625: 4 | N625: 1443 | O625: 0 | Q625: ="1,7,"&RC[2]&",0;"&"1,4,"&RC[4]&",0;" -> 1,7,12402,0;1,4,171820,0; | S625: =INT(((50+RC[-17]/10)*35+200)*12/4) -> 12402 | U625: =1000*110/100*(1+(50+RC[-19]/10)/200)*100 -> 171820
B626: 625 | C626: 0 | D626: 400625 | E626: 1,7,7312,0;1,4,1443,0; | G626: 1 | H626: 7 | I626: 7312 | J626: 0 | L626: 1 | M626: 4 | N626: 1443 | O626: 0 | Q626: ="1,7,"&RC[2]&",0;"&"1,4,"&RC[4]&",0;" -> 1,7,12412,0;1,4,171875,0; | S626: =INT(((50+RC[-17]/10)*35+200)*12/4) -> 12412 | U626: =1000*110/100*(1+(50+RC[-19]/10)/200)*100 -> 171875
B627: 626 | C627: 0 | D627: 400626 | E627: 1,7,7323,0;1,4,1444,0; | G627: 1 | H627: 7 | I627: 7323 | J627: 0 | L627: 1 | M627: 4 | N627: 1444 | O627: 0 | Q627: ="1,7,"&RC[2]&",0;"&"1,4,"&RC[4]&",0;" -> 1,7,12423,0;1,4,171930,0; | S627: =INT(((50+RC[-17]/10)*35+200)*12/4) -> 12423 | U627: =1000*110/100*(1+(50+RC[-19]/10)/200)*100 -> 171930
B628: 627 | C628: 0 | D628: 400627 | E628: 1,7,7333,0;1,4,1444,0; | G628: 1 | H628: 7 | I628: 7333 | J628: 0 | L628: 1 | M628: 4 | N628: 1444 | O628: 0 | Q628: ="1,7,"&RC[2]&",0;"&"1,4,"&RC[4]&",0;" -> 1,7,12433,0;1,4,171985,0; | S628: =INT(((50+RC[-17]/10)*35+200)*12/4) -> 12433 | U628: =1000*110/100*(1+(50+RC[-19]/10)/200)*100 -> 171985
B629: 628 | C629: 0 | D629: 400628 | E629: 1,7,7344,0;1,4,1445,0; | G629: 1 | H629: 7 | I629: 7344 | J629: 0 | L629: 1 | M629: 4 | N629: 1445 | O629: 0 | Q629: ="1,7,"&RC[2]&",0;"&"1,4,"&RC[4]&",0;" -> 1,7,12444,0;1,4,172040,0; | S629: =INT(((50+RC[-17]/10)*35+200)*12/4) -> 12444 | U629: =1000*110/100*(1+(50+RC[-19]/10)/200)*100 -> 172040
B630: 629 | C630: 0 | D630: 400629 | E630: 1,7,7354,0;1,4,1445,0; | G630: 1 | H630: 7 | I630: 7354 | J630: 0 | L630: 1 | M630: 4 | N630: 1445 | O630: 0 | Q630: ="1,7,"&RC[2]&",0;"&"1,4,"&RC[4]&",0;" -> 1,7,12454,0;1,4,172095,0; | S630: =INT(((50+RC[-17]/10)*35+200)*12/4) -> 12454 | U630: =1000*110/100*(1+(50+RC[-19]/10)/200)*100 -> 172095
B631: 630 | C631: 0 | D631: 400630 | E631: 1,7,7365,0;1,4,1446,0; | G631: 1 | H631: 7 | I631: 7365 | J631: 0 | L631: 1 | M631: 4 | N631: 1446 | O631: 0 | Q631: ="1,7,"&RC[2]&",0;"&"1,4,"&RC[4]&",0;" -> 1,7,12465,0;1,4,172150,0; | S631: =INT(((50+RC[-17]/10)*35+200)*12/4) -> 12465 | U631: =1000*110/100*(1+(50+RC[-19]/10)/200)*100 -> 172150
B632: 631 | C632: 0 | D632: 400631 | E632: 1,7,7375,0;1,4,1447,0; | G632: 1 | H632: 7 | I632: 7375 | J632: 0 | L632: 1 | M632: 4 | N632: 1447 | O632: 0 | Q632: ="1,7,"&RC[2]&",0;"&"1,4,"&RC[4]&",0;" -> 1,7,12475,0;1,4,172205,0; | S632: =INT(((50+RC[-17]/10)*35+200)*12/4) -> 12475 | U632: =1000*110/100*(1+(50+RC[-19]/10)/200)*100 -> 172205.00000000003
B633: 632 | C633: 0 | D633: 400632 | E633: 1,7,7386,0;1,4,1447,0; | G633: 1 | H633: 7 | I633: 7386 | J633: 0 | L633: 1 | M633: 4 | N633: 1447 | O633: 0 | Q633: ="1,7,"&RC[2]&",0;"&"1,4,"&RC[4]&",0;" -> 1,7,12486,0;1,4,172260,0; | S633: =INT(((50+RC[-17]/10)*35+200)*12/4) -> 12486 | U633: =1000*110/100*(1+(50+RC[-19]/10)/200)*100 -> 172260
B634: 633 | C634: 0 | D634: 400633 | E634: 1,7,7396,0;1,4,1448,0; | G634: 1 | H634: 7 | I634: 7396 | J634: 0 | L634: 1 | M634: 4 | N634: 1448 | O634: 0 | Q634: ="1,7,"&RC[2]&",0;"&"1,4,"&RC[4]&",0;" -> 1,7,12496,0;1,4,172315,0; | S634: =INT(((50+RC[-17]/10)*35+200)*12/4) -> 12496 | U634: =1000*110/100*(1+(50+RC[-19]/10)/200)*100 -> 172315
B635: 634 | C635: 0 | D635: 400634 | E635: 1,7,7407,0;1,4,1448,0; | G635: 1 | H635: 7 | I635: 7407 | J635: 0 | L635: 1 | M635: 4 | N635: 1448 | O635: 0 | Q635: ="1,7,"&RC[2]&",0;"&"1,4,"&RC[4]&",0;" -> 1,7,12507,0;1,4,172370,0; | S635: =INT(((50+RC[-17]/10)*35+200)*12/4) -> 12507 | U635: =1000*110/100*(1+(50+RC[-19]/10)/200)*100 -> 172370.00000000003
B636: 635 | C636: 0 | D636: 400635 | E636: 1,7,7417,0;1,4,1449,0; | G636: 1 | H636: 7 | I636: 7417 | J636: 0 | L636: 1 | M636: 4 | N636: 1449 | O636: 0 | Q636: ="1,7,"&RC[2]&",0;"&"1,4,"&RC[4]&",0;" -> 1,7,12517,0;1,4,172425,0; | S636: =INT(((50+RC[-17]/10)*35+200)*12/4) -> 12517 | U636: =1000*110/100*(1+(50+RC[-19]/10)/200)*100 -> 172424.99999999997
B637: 636 | C637: 0 | D637: 400636 | E637: 1,7,7428,0;1,4,1449,0; | G637: 1 | H637: 7 | I637: 7428 | J637: 0 | L637: 1 | M637: 4 | N637: 1449 | O637: 0 | Q637: ="1,7,"&RC[2]&",0;"&"1,4,"&RC[4]&",0;" -> 1,7,12528,0;1,4,172480,0; | S637: =INT(((50+RC[-17]/10)*35+200)*12/4) -> 12528 | U637: =1000*110/100*(1+(50+RC[-19]/10)/200)*100 -> 172480
B638: 637 | C638: 0 | D638: 400637 | E638: 1,7,7438,0;1,4,1450,0; | G638: 1 | H638: 7 | I638: 7438 | J638: 0 | L638: 1 | M638: 4 | N638: 1450 | O638: 0 | Q638: ="1,7,"&RC[2]&",0;"&"1,4,"&RC[4]&",0;" -> 1,7,12538,0;1,4,172535,0; | S638: =INT(((50+RC[-17]/10)*35+200)*12/4) -> 12538 | U638: =1000*110/100*(1+(50+RC[-19]/10)/200)*100 -> 172535
B639: 638 | C639: 0 | D639: 400638 | E639: 1,7,7449,0;1,4,1450,0; | G639: 1 | H639: 7 | I639: 7449 | J639: 0 | L639: 1 | M639: 4 | N639: 1450 | O639: 0 | Q639: ="1,7,"&RC[2]&",0;"&"1,4,"&RC[4]&",0;" -> 1,7,12549,0;1,4,172590,0; | S639: =INT(((50+RC[-17]/10)*35+200)*12/4) -> 12549 | U639: =1000*110/100*(1+(50+RC[-19]/10)/200)*100 -> 172590
B640: 639 | C640: 0 | D640: 400639 | E640: 1,7,7459,0;1,4,1451,0; | G640: 1 | H640: 7 | I640: 7459 | J640: 0 | L640: 1 | M640: 4 | N640: 1451 | O640: 0 | Q640: ="1,7,"&RC[2]&",0;"&"1,4,"&RC[4]&",0;" -> 1,7,12559,0;1,4,172645,0; | S640: =INT(((50+RC[-17]/10)*35+200)*12/4) -> 12559 | U640: =1000*110/100*(1+(50+RC[-19]/10)/200)*100 -> 172645
B641: 640 | C641: 0 | D641: 400640 | E641: 1,7,7470,0;1,4,1452,0; | G641: 1 | H641: 7 | I641: 7470 | J641: 0 | L641: 1 | M641: 4 | N641: 1452 | O641: 0 | Q641: ="1,7,"&RC[2]&",0;"&"1,4,"&RC[4]&",0;" -> 1,7,12570,0;1,4,172700,0; | S641: =INT(((50+RC[-17]/10)*35+200)*12/4) -> 12570 | U641: =1000*110/100*(1+(50+RC[-19]/10)/200)*100 -> 172699.99999999997
B642: 641 | C642: 0 | D642: 400641 | E642: 1,7,7480,0;1,4,1452,0; | G642: 1 | H642: 7 | I642: 7480 | J642: 0 | L642: 1 | M642: 4 | N642: 1452 | O642: 0 | Q642: ="1,7,"&RC[2]&",0;"&"1,4,"&RC[4]&",0;" -> 1,7,12580,0;1,4,172755,0; | S642: =INT(((50+RC[-17]/10)*35+200)*12/4) -> 12580 | U642: =1000*110/100*(1+(50+RC[-19]/10)/200)*100 -> 172755
B643: 642 | C643: 0 | D643: 400642 | E643: 1,7,7491,0;1,4,1453,0; | G643: 1 | H643: 7 | I643: 7491 | J643: 0 | L643: 1 | M643: 4 | N643: 1453 | O643: 0 | Q643: ="1,7,"&RC[2]&",0;"&"1,4,"&RC[4]&",0;" -> 1,7,12591,0;1,4,172810,0; | S643: =INT(((50+RC[-17]/10)*35+200)*12/4) -> 12591 | U643: =1000*110/100*(1+(50+RC[-19]/10)/200)*100 -> 172810
B644: 643 | C644: 0 | D644: 400643 | E644: 1,7,7501,0;1,4,1453,0; | G644: 1 | H644: 7 | I644: 7501 | J644: 0 | L644: 1 | M644: 4 | N644: 1453 | O644: 0 | Q644: ="1,7,"&RC[2]&",0;"&"1,4,"&RC[4]&",0;" -> 1,7,12601,0;1,4,172865,0; | S644: =INT(((50+RC[-17]/10)*35+200)*12/4) -> 12601 | U644: =1000*110/100*(1+(50+RC[-19]/10)/200)*100 -> 172865
B645: 644 | C645: 0 | D645: 400644 | E645: 1,7,7512,0;1,4,1454,0; | G645: 1 | H645: 7 | I645: 7512 | J645: 0 | L645: 1 | M645: 4 | N645: 1454 | O645: 0 | Q645: ="1,7,"&RC[2]&",0;"&"1,4,"&RC[4]&",0;" -> 1,7,12612,0;1,4,172920,0; | S645: =INT(((50+RC[-17]/10)*35+200)*12/4) -> 12612 | U645: =1000*110/100*(1+(50+RC[-19]/10)/200)*100 -> 172920
B646: 645 | C646: 0 | D646: 400645 | E646: 1,7,7522,0;1,4,1454,0; | G646: 1 | H646: 7 | I646: 7522 | J646: 0 | L646: 1 | M646: 4 | N646: 1454 | O646: 0 | Q646: ="1,7,"&RC[2]&",0;"&"1,4,"&RC[4]&",0;" -> 1,7,12622,0;1,4,172975,0; | S646: =INT(((50+RC[-17]/10)*35+200)*12/4) -> 12622 | U646: =1000*110/100*(1+(50+RC[-19]/10)/200)*100 -> 172975
B647: 646 | C647: 0 | D647: 400646 | E647: 1,7,7533,0;1,4,1455,0; | G647: 1 | H647: 7 | I647: 7533 | J647: 0 | L647: 1 | M647: 4 | N647: 1455 | O647: 0 | Q647: ="1,7,"&RC[2]&",0;"&"1,4,"&RC[4]&",0;" -> 1,7,12633,0;1,4,173030,0; | S647: =INT(((50+RC[-17]/10)*35+200)*12/4) -> 12633 | U647: =1000*110/100*(1+(50+RC[-19]/10)/200)*100 -> 173030
B648: 647 | C648: 0 | D648: 400647 | E648: 1,7,7543,0;1,4,1455,0; | G648: 1 | H648: 7 | I648: 7543 | J648: 0 | L648: 1 | M648: 4 | N648: 1455 | O648: 0 | Q648: ="1,7,"&RC[2]&",0;"&"1,4,"&RC[4]&",0;" -> 1,7,12643,0;1,4,173085,0; | S648: =INT(((50+RC[-17]/10)*35+200)*12/4) -> 12643 | U648: =1000*110/100*(1+(50+RC[-19]/10)/200)*100 -> 173085
B649: 648 | C649: 0 | D649: 400648 | E649: 1,7,7554,0;1,4,1456,0; | G649: 1 | H649: 7 | I649: 7554 | J649: 0 | L649: 1 | M649: 4 | N649: 1456 | O649: 0 | Q649: ="1,7,"&RC[2]&",0;"&"1,4,"&RC[4]&",0;" -> 1,7,12654,0;1,4,173140,0; | S649: =INT(((50+RC[-17]/10)*35+200)*12/4) -> 12654 | U649: =1000*110/100*(1+(50+RC[-19]/10)/200)*100 -> 173140
B650: 649 | C650: 0 | D650: 400649 | E650: 1,7,7564,0;1,4,1456,0; | G650: 1 | H650: 7 | I650: 7564 | J650: 0 | L650: 1 | M650: 4 | N650: 1456 | O650: 0 | Q650: ="1,7,"&RC[2]&",0;"&"1,4,"&RC[4]&",0;" -> 1,7,12664,0;1,4,173195,0; | S650: =INT(((50+RC[-17]/10)*35+200)*12/4) -> 12664 | U650: =1000*110/100*(1+(50+RC[-19]/10)/200)*100 -> 173195
B651: 650 | C651: 0 | D651: 400650 | E651: 1,7,7575,0;1,4,1457,0; | G651: 1 | H651: 7 | I651: 7575 | J651: 0 | L651: 1 | M651: 4 | N651: 1457 | O651: 0 | Q651: ="1,7,"&RC[2]&",0;"&"1,4,"&RC[4]&",0;" -> 1,7,12675,0;1,4,173250,0; | S651: =INT(((50+RC[-17]/10)*35+200)*12/4) -> 12675 | U651: =1000*110/100*(1+(50+RC[-19]/10)/200)*100 -> 173250
B652: 651 | C652: 0 | D652: 400651 | E652: 1,7,7585,0;1,4,1458,0; | G652: 1 | H652: 7 | I652: 7585 | J652: 0 | L652: 1 | M652: 4 | N652: 1458 | O652: 0 | Q652: ="1,7,"&RC[2]&",0;"&"1,4,"&RC[4]&",0;" -> 1,7,12685,0;1,4,173305,0; | S652: =INT(((50+RC[-17]/10)*35+200)*12/4) -> 12685 | U652: =1000*110/100*(1+(50+RC[-19]/10)/200)*100 -> 173305
B653: 652 | C653: 0 | D653: 400652 | E653: 1,7,7596,0;1,4,1458,0; | G653: 1 | H653: 7 | I653: 7596 | J653: 0 | L653: 1 | M653: 4 | N653: 1458 | O653: 0 | Q653: ="1,7,"&RC[2]&",0;"&"1,4,"&RC[4]&",0;" -> 1,7,12696,0;1,4,173360,0; | S653: =INT(((50+RC[-17]/10)*35+200)*12/4) -> 12696 | U653: =1000*110/100*(1+(50+RC[-19]/10)/200)*100 -> 173360
B654: 653 | C654: 0 | D654: 400653 | E654: 1,7,7606,0;1,4,1459,0; | G654: 1 | H654: 7 | I654: 7606 | J654: 0 | L654: 1 | M654: 4 | N654: 1459 | O654: 0 | Q654: ="1,7,"&RC[2]&",0;"&"1,4,"&RC[4]&",0;" -> 1,7,12706,0;1,4,173415,0; | S654: =INT(((50+RC[-17]/10)*35+200)*12/4) -> 12706 | U654: =1000*110/100*(1+(50+RC[-19]/10)/200)*100 -> 173415
B655: 654 | C655: 0 | D655: 400654 | E655: 1,7,7617,0;1,4,1459,0; | G655: 1 | H655: 7 | I655: 7617 | J655: 0 | L655: 1 | M655: 4 | N655: 1459 | O655: 0 | Q655: ="1,7,"&RC[2]&",0;"&"1,4,"&RC[4]&",0;" -> 1,7,12717,0;1,4,173470,0; | S655: =INT(((50+RC[-17]/10)*35+200)*12/4) -> 12717 | U655: =1000*110/100*(1+(50+RC[-19]/10)/200)*100 -> 173470
B656: 655 | C656: 0 | D656: 400655 | E656: 1,7,7627,0;1,4,1460,0; | G656: 1 | H656: 7 | I656: 7627 | J656: 0 | L656: 1 | M656: 4 | N656: 1460 | O656: 0 | Q656: ="1,7,"&RC[2]&",0;"&"1,4,"&RC[4]&",0;" -> 1,7,12727,0;1,4,173525,0; | S656: =INT(((50+RC[-17]/10)*35+200)*12/4) -> 12727 | U656: =1000*110/100*(1+(50+RC[-19]/10)/200)*100 -> 173525.00000000003
B657: 656 | C657: 0 | D657: 400656 | E657: 1,7,7638,0;1,4,1460,0; | G657: 1 | H657: 7 | I657: 7638 | J657: 0 | L657: 1 | M657: 4 | N657: 1460 | O657: 0 | Q657: ="1,7,"&RC[2]&",0;"&"1,4,"&RC[4]&",0;" -> 1,7,12738,0;1,4,173580,0; | S657: =INT(((50+RC[-17]/10)*35+200)*12/4) -> 12738 | U657: =1000*110/100*(1+(50+RC[-19]/10)/200)*100 -> 173579.99999999997
B658: 657 | C658: 0 | D658: 400657 | E658: 1,7,7648,0;1,4,1461,0; | G658: 1 | H658: 7 | I658: 7648 | J658: 0 | L658: 1 | M658: 4 | N658: 1461 | O658: 0 | Q658: ="1,7,"&RC[2]&",0;"&"1,4,"&RC[4]&",0;" -> 1,7,12748,0;1,4,173635,0; | S658: =INT(((50+RC[-17]/10)*35+200)*12/4) -> 12748 | U658: =1000*110/100*(1+(50+RC[-19]/10)/200)*100 -> 173635
B659: 658 | C659: 0 | D659: 400658 | E659: 1,7,7659,0;1,4,1461,0; | G659: 1 | H659: 7 | I659: 7659 | J659: 0 | L659: 1 | M659: 4 | N659: 1461 | O659: 0 | Q659: ="1,7,"&RC[2]&",0;"&"1,4,"&RC[4]&",0;" -> 1,7,12759,0;1,4,173690,0; | S659: =INT(((50+RC[-17]/10)*35+200)*12/4) -> 12759 | U659: =1000*110/100*(1+(50+RC[-19]/10)/200)*100 -> 173690
B660: 659 | C660: 0 | D660: 400659 | E660: 1,7,7669,0;1,4,1462,0; | G660: 1 | H660: 7 | I660: 7669 | J660: 0 | L660: 1 | M660: 4 | N660: 1462 | O660: 0 | Q660: ="1,7,"&RC[2]&",0;"&"1,4,"&RC[4]&",0;" -> 1,7,12769,0;1,4,173745,0; | S660: =INT(((50+RC[-17]/10)*35+200)*12/4) -> 12769 | U660: =1000*110/100*(1+(50+RC[-19]/10)/200)*100 -> 173744.99999999997
B661: 660 | C661: 0 | D661: 400660 | E661: 1,7,7680,0;1,4,1463,0; | G661: 1 | H661: 7 | I661: 7680 | J661: 0 | L661: 1 | M661: 4 | N661: 1463 | O661: 0 | Q661: ="1,7,"&RC[2]&",0;"&"1,4,"&RC[4]&",0;" -> 1,7,12780,0;1,4,173800,0; | S661: =INT(((50+RC[-17]/10)*35+200)*12/4) -> 12780 | U661: =1000*110/100*(1+(50+RC[-19]/10)/200)*100 -> 173800
B662: 661 | C662: 0 | D662: 400661 | E662: 1,7,7690,0;1,4,1463,0; | G662: 1 | H662: 7 | I662: 7690 | J662: 0 | L662: 1 | M662: 4 | N662: 1463 | O662: 0 | Q662: ="1,7,"&RC[2]&",0;"&"1,4,"&RC[4]&",0;" -> 1,7,12790,0;1,4,173855,0; | S662: =INT(((50+RC[-17]/10)*35+200)*12/4) -> 12790 | U662: =1000*110/100*(1+(50+RC[-19]/10)/200)*100 -> 173855
B663: 662 | C663: 0 | D663: 400662 | E663: 1,7,7701,0;1,4,1464,0; | G663: 1 | H663: 7 | I663: 7701 | J663: 0 | L663: 1 | M663: 4 | N663: 1464 | O663: 0 | Q663: ="1,7,"&RC[2]&",0;"&"1,4,"&RC[4]&",0;" -> 1,7,12801,0;1,4,173910,0; | S663: =INT(((50+RC[-17]/10)*35+200)*12/4) -> 12801 | U663: =1000*110/100*(1+(50+RC[-19]/10)/200)*100 -> 173910
B664: 663 | C664: 0 | D664: 400663 | E664: 1,7,7711,0;1,4,1464,0; | G664: 1 | H664: 7 | I664: 7711 | J664: 0 | L664: 1 | M664: 4 | N664: 1464 | O664: 0 | Q664: ="1,7,"&RC[2]&",0;"&"1,4,"&RC[4]&",0;" -> 1,7,12811,0;1,4,173965,0; | S664: =INT(((50+RC[-17]/10)*35+200)*12/4) -> 12811 | U664: =1000*110/100*(1+(50+RC[-19]/10)/200)*100 -> 173965
B665: 664 | C665: 0 | D665: 400664 | E665: 1,7,7722,0;1,4,1465,0; | G665: 1 | H665: 7 | I665: 7722 | J665: 0 | L665: 1 | M665: 4 | N665: 1465 | O665: 0 | Q665: ="1,7,"&RC[2]&",0;"&"1,4,"&RC[4]&",0;" -> 1,7,12822,0;1,4,174020,0; | S665: =INT(((50+RC[-17]/10)*35+200)*12/4) -> 12822 | U665: =1000*110/100*(1+(50+RC[-19]/10)/200)*100 -> 174020
B666: 665 | C666: 0 | D666: 400665 | E666: 1,7,7732,0;1,4,1465,0; | G666: 1 | H666: 7 | I666: 7732 | J666: 0 | L666: 1 | M666: 4 | N666: 1465 | O666: 0 | Q666: ="1,7,"&RC[2]&",0;"&"1,4,"&RC[4]&",0;" -> 1,7,12832,0;1,4,174075,0; | S666: =INT(((50+RC[-17]/10)*35+200)*12/4) -> 12832 | U666: =1000*110/100*(1+(50+RC[-19]/10)/200)*100 -> 174075
B667: 666 | C667: 0 | D667: 400666 | E667: 1,7,7743,0;1,4,1466,0; | G667: 1 | H667: 7 | I667: 7743 | J667: 0 | L667: 1 | M667: 4 | N667: 1466 | O667: 0 | Q667: ="1,7,"&RC[2]&",0;"&"1,4,"&RC[4]&",0;" -> 1,7,12843,0;1,4,174130,0; | S667: =INT(((50+RC[-17]/10)*35+200)*12/4) -> 12843 | U667: =1000*110/100*(1+(50+RC[-19]/10)/200)*100 -> 174130
B668: 667 | C668: 0 | D668: 400667 | E668: 1,7,7753,0;1,4,1466,0; | G668: 1 | H668: 7 | I668: 7753 | J668: 0 | L668: 1 | M668: 4 | N668: 1466 | O668: 0 | Q668: ="1,7,"&RC[2]&",0;"&"1,4,"&RC[4]&",0;" -> 1,7,12853,0;1,4,174185,0; | S668: =INT(((50+RC[-17]/10)*35+200)*12/4) -> 12853 | U668: =1000*110/100*(1+(50+RC[-19]/10)/200)*100 -> 174185
B669: 668 | C669: 0 | D669: 400668 | E669: 1,7,7764,0;1,4,1467,0; | G669: 1 | H669: 7 | I669: 7764 | J669: 0 | L669: 1 | M669: 4 | N669: 1467 | O669: 0 | Q669: ="1,7,"&RC[2]&",0;"&"1,4,"&RC[4]&",0;" -> 1,7,12864,0;1,4,174240,0; | S669: =INT(((50+RC[-17]/10)*35+200)*12/4) -> 12864 | U669: =1000*110/100*(1+(50+RC[-19]/10)/200)*100 -> 174240
B670: 669 | C670: 0 | D670: 400669 | E670: 1,7,7774,0;1,4,1467,0; | G670: 1 | H670: 7 | I670: 7774 | J670: 0 | L670: 1 | M670: 4 | N670: 1467 | O670: 0 | Q670: ="1,7,"&RC[2]&",0;"&"1,4,"&RC[4]&",0;" -> 1,7,12874,0;1,4,174295,0; | S670: =INT(((50+RC[-17]/10)*35+200)*12/4) -> 12874 | U670: =1000*110/100*(1+(50+RC[-19]/10)/200)*100 -> 174295
B671: 670 | C671: 0 | D671: 400670 | E671: 1,7,7785,0;1,4,1468,0; | G671: 1 | H671: 7 | I671: 7785 | J671: 0 | L671: 1 | M671: 4 | N671: 1468 | O671: 0 | Q671: ="1,7,"&RC[2]&",0;"&"1,4,"&RC[4]&",0;" -> 1,7,12885,0;1,4,174350,0; | S671: =INT(((50+RC[-17]/10)*35+200)*12/4) -> 12885 | U671: =1000*110/100*(1+(50+RC[-19]/10)/200)*100 -> 174350
B672: 671 | C672: 0 | D672: 400671 | E672: 1,7,7795,0;1,4,1469,0; | G672: 1 | H672: 7 | I672: 7795 | J672: 0 | L672: 1 | M672: 4 | N672: 1469 | O672: 0 | Q672: ="1,7,"&RC[2]&",0;"&"1,4,"&RC[4]&",0;" -> 1,7,12895,0;1,4,174405,0; | S672: =INT(((50+RC[-17]/10)*35+200)*12/4) -> 12895 | U672: =1000*110/100*(1+(50+RC[-19]/10)/200)*100 -> 174405.00000000003
B673: 672 | C673: 0 | D673: 400672 | E673: 1,7,7806,0;1,4,1469,0; | G673: 1 | H673: 7 | I673: 7806 | J673: 0 | L673: 1 | M673: 4 | N673: 1469 | O673: 0 | Q673: ="1,7,"&RC[2]&",0;"&"1,4,"&RC[4]&",0;" -> 1,7,12906,0;1,4,174460,0; | S673: =INT(((50+RC[-17]/10)*35+200)*12/4) -> 12906 | U673: =1000*110/100*(1+(50+RC[-19]/10)/200)*100 -> 174460
B674: 673 | C674: 0 | D674: 400673 | E674: 1,7,7816,0;1,4,1470,0; | G674: 1 | H674: 7 | I674: 7816 | J674: 0 | L674: 1 | M674: 4 | N674: 1470 | O674: 0 | Q674: ="1,7,"&RC[2]&",0;"&"1,4,"&RC[4]&",0;" -> 1,7,12916,0;1,4,174515,0; | S674: =INT(((50+RC[-17]/10)*35+200)*12/4) -> 12916 | U674: =1000*110/100*(1+(50+RC[-19]/10)/200)*100 -> 174515
B675: 674 | C675: 0 | D675: 400674 | E675: 1,7,7827,0;1,4,1470,0; | G675: 1 | H675: 7 | I675: 7827 | J675: 0 | L675: 1 | M675: 4 | N675: 1470 | O675: 0 | Q675: ="1,7,"&RC[2]&",0;"&"1,4,"&RC[4]&",0;" -> 1,7,12927,0;1,4,174570,0; | S675: =INT(((50+RC[-17]/10)*35+200)*12/4) -> 12927 | U675: =1000*110/100*(1+(50+RC[-19]/10)/200)*100 -> 174570.00000000003
B676: 675 | C676: 0 | D676: 400675 | E676: 1,7,7837,0;1,4,1471,0; | G676: 1 | H676: 7 | I676: 7837 | J676: 0 | L676: 1 | M676: 4 | N676: 1471 | O676: 0 | Q676: ="1,7,"&RC[2]&",0;"&"1,4,"&RC[4]&",0;" -> 1,7,12937,0;1,4,174625,0; | S676: =INT(((50+RC[-17]/10)*35+200)*12/4) -> 12937 | U676: =1000*110/100*(1+(50+RC[-19]/10)/200)*100 -> 174625
B677: 676 | C677: 0 | D677: 400676 | E677: 1,7,7848,0;1,4,1471,0; | G677: 1 | H677: 7 | I677: 7848 | J677: 0 | L677: 1 | M677: 4 | N677: 1471 | O677: 0 | Q677: ="1,7,"&RC[2]&",0;"&"1,4,"&RC[4]&",0;" -> 1,7,12948,0;1,4,174680,0; | S677: =INT(((50+RC[-17]/10)*35+200)*12/4) -> 12948 | U677: =1000*110/100*(1+(50+RC[-19]/10)/200)*100 -> 174680.00000000003
B678: 677 | C678: 0 | D678: 400677 | E678: 1,7,7858,0;1,4,1472,0; | G678: 1 | H678: 7 | I678: 7858 | J678: 0 | L678: 1 | M678: 4 | N678: 1472 | O678: 0 | Q678: ="1,7,"&RC[2]&",0;"&"1,4,"&RC[4]&",0;" -> 1,7,12958,0;1,4,174735,0; | S678: =INT(((50+RC[-17]/10)*35+200)*12/4) -> 12958 | U678: =1000*110/100*(1+(50+RC[-19]/10)/200)*100 -> 174735
B679: 678 | C679: 0 | D679: 400678 | E679: 1,7,7869,0;1,4,1472,0; | G679: 1 | H679: 7 | I679: 7869 | J679: 0 | L679: 1 | M679: 4 | N679: 1472 | O679: 0 | Q679: ="1,7,"&RC[2]&",0;"&"1,4,"&RC[4]&",0;" -> 1,7,12969,0;1,4,174790,0; | S679: =INT(((50+RC[-17]/10)*35+200)*12/4) -> 12969 | U679: =1000*110/100*(1+(50+RC[-19]/10)/200)*100 -> 174790
B680: 679 | C680: 0 | D680: 400679 | E680: 1,7,7879,0;1,4,1473,0; | G680: 1 | H680: 7 | I680: 7879 | J680: 0 | L680: 1 | M680: 4 | N680: 1473 | O680: 0 | Q680: ="1,7,"&RC[2]&",0;"&"1,4,"&RC[4]&",0;" -> 1,7,12979,0;1,4,174845,0; | S680: =INT(((50+RC[-17]/10)*35+200)*12/4) -> 12979 | U680: =1000*110/100*(1+(50+RC[-19]/10)/200)*100 -> 174845
B681: 680 | C681: 0 | D681: 400680 | E681: 1,7,7890,0;1,4,1474,0; | G681: 1 | H681: 7 | I681: 7890 | J681: 0 | L681: 1 | M681: 4 | N681: 1474 | O681: 0 | Q681: ="1,7,"&RC[2]&",0;"&"1,4,"&RC[4]&",0;" -> 1,7,12990,0;1,4,174900,0; | S681: =INT(((50+RC[-17]/10)*35+200)*12/4) -> 12990 | U681: =1000*110/100*(1+(50+RC[-19]/10)/200)*100 -> 174899.99999999997
B682: 681 | C682: 0 | D682: 400681 | E682: 1,7,7900,0;1,4,1474,0; | G682: 1 | H682: 7 | I682: 7900 | J682: 0 | L682: 1 | M682: 4 | N682: 1474 | O682: 0 | Q682: ="1,7,"&RC[2]&",0;"&"1,4,"&RC[4]&",0;" -> 1,7,13000,0;1,4,174955,0; | S682: =INT(((50+RC[-17]/10)*35+200)*12/4) -> 13000 | U682: =1000*110/100*(1+(50+RC[-19]/10)/200)*100 -> 174955
B683: 682 | C683: 0 | D683: 400682 | E683: 1,7,7911,0;1,4,1475,0; | G683: 1 | H683: 7 | I683: 7911 | J683: 0 | L683: 1 | M683: 4 | N683: 1475 | O683: 0 | Q683: ="1,7,"&RC[2]&",0;"&"1,4,"&RC[4]&",0;" -> 1,7,13011,0;1,4,175010,0; | S683: =INT(((50+RC[-17]/10)*35+200)*12/4) -> 13011 | U683: =1000*110/100*(1+(50+RC[-19]/10)/200)*100 -> 175010
B684: 683 | C684: 0 | D684: 400683 | E684: 1,7,7921,0;1,4,1475,0; | G684: 1 | H684: 7 | I684: 7921 | J684: 0 | L684: 1 | M684: 4 | N684: 1475 | O684: 0 | Q684: ="1,7,"&RC[2]&",0;"&"1,4,"&RC[4]&",0;" -> 1,7,13021,0;1,4,175065,0; | S684: =INT(((50+RC[-17]/10)*35+200)*12/4) -> 13021 | U684: =1000*110/100*(1+(50+RC[-19]/10)/200)*100 -> 175065
B685: 684 | C685: 0 | D685: 400684 | E685: 1,7,7932,0;1,4,1476,0; | G685: 1 | H685: 7 | I685: 7932 | J685: 0 | L685: 1 | M685: 4 | N685: 1476 | O685: 0 | Q685: ="1,7,"&RC[2]&",0;"&"1,4,"&RC[4]&",0;" -> 1,7,13032,0;1,4,175120,0; | S685: =INT(((50+RC[-17]/10)*35+200)*12/4) -> 13032 | U685: =1000*110/100*(1+(50+RC[-19]/10)/200)*100 -> 175120
B686: 685 | C686: 0 | D686: 400685 | E686: 1,7,7942,0;1,4,1476,0; | G686: 1 | H686: 7 | I686: 7942 | J686: 0 | L686: 1 | M686: 4 | N686: 1476 | O686: 0 | Q686: ="1,7,"&RC[2]&",0;"&"1,4,"&RC[4]&",0;" -> 1,7,13042,0;1,4,175175,0; | S686: =INT(((50+RC[-17]/10)*35+200)*12/4) -> 13042 | U686: =1000*110/100*(1+(50+RC[-19]/10)/200)*100 -> 175175
B687: 686 | C687: 0 | D687: 400686 | E687: 1,7,7953,0;1,4,1477,0; | G687: 1 | H687: 7 | I687: 7953 | J687: 0 | L687: 1 | M687: 4 | N687: 1477 | O687: 0 | Q687: ="1,7,"&RC[2]&",0;"&"1,4,"&RC[4]&",0;" -> 1,7,13053,0;1,4,175230,0; | S687: =INT(((50+RC[-17]/10)*35+200)*12/4) -> 13053 | U687: =1000*110/100*(1+(50+RC[-19]/10)/200)*100 -> 175230
B688: 687 | C688: 0 | D688: 400687 | E688: 1,7,7963,0;1,4,1477,0; | G688: 1 | H688: 7 | I688: 7963 | J688: 0 | L688: 1 | M688: 4 | N688: 1477 | O688: 0 | Q688: ="1,7,"&RC[2]&",0;"&"1,4,"&RC[4]&",0;" -> 1,7,13063,0;1,4,175285,0; | S688: =INT(((50+RC[-17]/10)*35+200)*12/4) -> 13063 | U688: =1000*110/100*(1+(50+RC[-19]/10)/200)*100 -> 175285
B689: 688 | C689: 0 | D689: 400688 | E689: 1,7,7974,0;1,4,1478,0; | G689: 1 | H689: 7 | I689: 7974 | J689: 0 | L689: 1 | M689: 4 | N689: 1478 | O689: 0 | Q689: ="1,7,"&RC[2]&",0;"&"1,4,"&RC[4]&",0;" -> 1,7,13074,0;1,4,175340,0; | S689: =INT(((50+RC[-17]/10)*35+200)*12/4) -> 13074 | U689: =1000*110/100*(1+(50+RC[-19]/10)/200)*100 -> 175340
B690: 689 | C690: 0 | D690: 400689 | E690: 1,7,7984,0;1,4,1478,0; | G690: 1 | H690: 7 | I690: 7984 | J690: 0 | L690: 1 | M690: 4 | N690: 1478 | O690: 0 | Q690: ="1,7,"&RC[2]&",0;"&"1,4,"&RC[4]&",0;" -> 1,7,13084,0;1,4,175395,0; | S690: =INT(((50+RC[-17]/10)*35+200)*12/4) -> 13084 | U690: =1000*110/100*(1+(50+RC[-19]/10)/200)*100 -> 175395
B691: 690 | C691: 0 | D691: 400690 | E691: 1,7,7995,0;1,4,1479,0; | G691: 1 | H691: 7 | I691: 7995 | J691: 0 | L691: 1 | M691: 4 | N691: 1479 | O691: 0 | Q691: ="1,7,"&RC[2]&",0;"&"1,4,"&RC[4]&",0;" -> 1,7,13095,0;1,4,175450,0; | S691: =INT(((50+RC[-17]/10)*35+200)*12/4) -> 13095 | U691: =1000*110/100*(1+(50+RC[-19]/10)/200)*100 -> 175450
B692: 691 | C692: 0 | D692: 400691 | E692: 1,7,8005,0;1,4,1480,0; | G692: 1 | H692: 7 | I692: 8005 | J692: 0 | L692: 1 | M692: 4 | N692: 1480 | O692: 0 | Q692: ="1,7,"&RC[2]&",0;"&"1,4,"&RC[4]&",0;" -> 1,7,13105,0;1,4,175505,0; | S692: =INT(((50+RC[-17]/10)*35+200)*12/4) -> 13105 | U692: =1000*110/100*(1+(50+RC[-19]/10)/200)*100 -> 175505
B693: 692 | C693: 0 | D693: 400692 | E693: 1,7,8016,0;1,4,1480,0; | G693: 1 | H693: 7 | I693: 8016 | J693: 0 | L693: 1 | M693: 4 | N693: 1480 | O693: 0 | Q693: ="1,7,"&RC[2]&",0;"&"1,4,"&RC[4]&",0;" -> 1,7,13116,0;1,4,175560,0; | S693: =INT(((50+RC[-17]/10)*35+200)*12/4) -> 13116 | U693: =1000*110/100*(1+(50+RC[-19]/10)/200)*100 -> 175560
B694: 693 | C694: 0 | D694: 400693 | E694: 1,7,8026,0;1,4,1481,0; | G694: 1 | H694: 7 | I694: 8026 | J694: 0 | L694: 1 | M694: 4 | N694: 1481 | O694: 0 | Q694: ="1,7,"&RC[2]&",0;"&"1,4,"&RC[4]&",0;" -> 1,7,13126,0;1,4,175615,0; | S694: =INT(((50+RC[-17]/10)*35+200)*12/4) -> 13126 | U694: =1000*110/100*(1+(50+RC[-19]/10)/200)*100 -> 175615
B695: 694 | C695: 0 | D695: 400694 | E695: 1,7,8037,0;1,4,1481,0; | G695: 1 | H695: 7 | I695: 8037 | J695: 0 | L695: 1 | M695: 4 | N695: 1481 | O695: 0 | Q695: ="1,7,"&RC[2]&",0;"&"1,4,"&RC[4]&",0;" -> 1,7,13137,0;1,4,175670,0; | S695: =INT(((50+RC[-17]/10)*35+200)*12/4) -> 13137 | U695: =1000*110/100*(1+(50+RC[-19]/10)/200)*100 -> 175670
B696: 695 | C696: 0 | D696: 400695 | E696: 1,7,8047,0;1,4,1482,0; | G696: 1 | H696: 7 | I696: 8047 | J696: 0 | L696: 1 | M696: 4 | N696: 1482 | O696: 0 | Q696: ="1,7,"&RC[2]&",0;"&"1,4,"&RC[4]&",0;" -> 1,7,13147,0;1,4,175725,0; | S696: =INT(((50+RC[-17]/10)*35+200)*12/4) -> 13147 | U696: =1000*110/100*(1+(50+RC[-19]/10)/200)*100 -> 175725.00000000003
B697: 696 | C697: 0 | D697: 400696 | E697: 1,7,8058,0;1,4,1482,0; | G697: 1 | H697: 7 | I697: 8058 | J697: 0 | L697: 1 | M697: 4 | N697: 1482 | O697: 0 | Q697: ="1,7,"&RC[2]&",0;"&"1,4,"&RC[4]&",0;" -> 1,7,13158,0;1,4,175780,0; | S697: =INT(((50+RC[-17]/10)*35+200)*12/4) -> 13158 | U697: =1000*110/100*(1+(50+RC[-19]/10)/200)*100 -> 175780
B698: 697 | C698: 0 | D698: 400697 | E698: 1,7,8068,0;1,4,1483,0; | G698: 1 | H698: 7 | I698: 8068 | J698: 0 | L698: 1 | M698: 4 | N698: 1483 | O698: 0 | Q698: ="1,7,"&RC[2]&",0;"&"1,4,"&RC[4]&",0;" -> 1,7,13168,0;1,4,175835,0; | S698: =INT(((50+RC[-17]/10)*35+200)*12/4) -> 13168 | U698: =1000*110/100*(1+(50+RC[-19]/10)/200)*100 -> 175835
B699: 698 | C699: 0 | D699: 400698 | E699: 1,7,8079,0;1,4,1483,0; | G699: 1 | H699: 7 | I699: 8079 | J699: 0 | L699: 1 | M699: 4 | N699: 1483 | O699: 0 | Q699: ="1,7,"&RC[2]&",0;"&"1,4,"&RC[4]&",0;" -> 1,7,13179,0;1,4,175890,0; | S699: =INT(((50+RC[-17]/10)*35+200)*12/4) -> 13179 | U699: =1000*110/100*(1+(50+RC[-19]/10)/200)*100 -> 175890
B700: 699 | C700: 0 | D700: 400699 | E700: 1,7,8089,0;1,4,1484,0; | G700: 1 | H700: 7 | I700: 8089 | J700: 0 | L700: 1 | M700: 4 | N700: 1484 | O700: 0 | Q700: ="1,7,"&RC[2]&",0;"&"1,4,"&RC[4]&",0;" -> 1,7,13189,0;1,4,175945,0; | S700: =INT(((50+RC[-17]/10)*35+200)*12/4) -> 13189 | U700: =1000*110/100*(1+(50+RC[-19]/10)/200)*100 -> 175944.99999999997
B701: 700 | C701: 0 | D701: 400700 | E701: 1,7,8100,0;1,4,1485,0; | G701: 1 | H701: 7 | I701: 8100 | J701: 0 | L701: 1 | M701: 4 | N701: 1485 | O701: 0 | Q701: ="1,7,"&RC[2]&",0;"&"1,4,"&RC[4]&",0;" -> 1,7,13200,0;1,4,176000,0; | S701: =INT(((50+RC[-17]/10)*35+200)*12/4) -> 13200 | U701: =1000*110/100*(1+(50+RC[-19]/10)/200)*100 -> 176000
B702: 701 | C702: 0 | D702: 400701 | E702: 1,7,8110,0;1,4,1485,0; | G702: 1 | H702: 7 | I702: 8110 | J702: 0 | L702: 1 | M702: 4 | N702: 1485 | O702: 0 | Q702: ="1,7,"&RC[2]&",0;"&"1,4,"&RC[4]&",0;" -> 1,7,13210,0;1,4,176055,0; | S702: =INT(((50+RC[-17]/10)*35+200)*12/4) -> 13210 | U702: =1000*110/100*(1+(50+RC[-19]/10)/200)*100 -> 176054.99999999997
B703: 702 | C703: 0 | D703: 400702 | E703: 1,7,8121,0;1,4,1486,0; | G703: 1 | H703: 7 | I703: 8121 | J703: 0 | L703: 1 | M703: 4 | N703: 1486 | O703: 0 | Q703: ="1,7,"&RC[2]&",0;"&"1,4,"&RC[4]&",0;" -> 1,7,13221,0;1,4,176110,0; | S703: =INT(((50+RC[-17]/10)*35+200)*12/4) -> 13221 | U703: =1000*110/100*(1+(50+RC[-19]/10)/200)*100 -> 176110
B704: 703 | C704: 0 | D704: 400703 | E704: 1,7,8131,0;1,4,1486,0; | G704: 1 | H704: 7 | I704: 8131 | J704: 0 | L704: 1 | M704: 4 | N704: 1486 | O704: 0 | Q704: ="1,7,"&RC[2]&",0;"&"1,4,"&RC[4]&",0;" -> 1,7,13231,0;1,4,176165,0; | S704: =INT(((50+RC[-17]/10)*35+200)*12/4) -> 13231 | U704: =1000*110/100*(1+(50+RC[-19]/10)/200)*100 -> 176165
B705: 704 | C705: 0 | D705: 400704 | E705: 1,7,8142,0;1,4,1487,0; | G705: 1 | H705: 7 | I705: 8142 | J705: 0 | L705: 1 | M705: 4 | N705: 1487 | O705: 0 | Q705: ="1,7,"&RC[2]&",0;"&"1,4,"&RC[4]&",0;" -> 1,7,13242,0;1,4,176220,0; | S705: =INT(((50+RC[-17]/10)*35+200)*12/4) -> 13242 | U705: =1000*110/100*(1+(50+RC[-19]/10)/200)*100 -> 176219.99999999997
B706: 705 | C706: 0 | D706: 400705 | E706: 1,7,8152,0;1,4,1487,0; | G706: 1 | H706: 7 | I706: 8152 | J706: 0 | L706: 1 | M706: 4 | N706: 1487 | O706: 0 | Q706: ="1,7,"&RC[2]&",0;"&"1,4,"&RC[4]&",0;" -> 1,7,13252,0;1,4,176275,0; | S706: =INT(((50+RC[-17]/10)*35+200)*12/4) -> 13252 | U706: =1000*110/100*(1+(50+RC[-19]/10)/200)*100 -> 176275
B707: 706 | C707: 0 | D707: 400706 | E707: 1,7,8163,0;1,4,1488,0; | G707: 1 | H707: 7 | I707: 8163 | J707: 0 | L707: 1 | M707: 4 | N707: 1488 | O707: 0 | Q707: ="1,7,"&RC[2]&",0;"&"1,4,"&RC[4]&",0;" -> 1,7,13263,0;1,4,176330,0; | S707: =INT(((50+RC[-17]/10)*35+200)*12/4) -> 13263 | U707: =1000*110/100*(1+(50+RC[-19]/10)/200)*100 -> 176330
B708: 707 | C708: 0 | D708: 400707 | E708: 1,7,8173,0;1,4,1488,0; | G708: 1 | H708: 7 | I708: 8173 | J708: 0 | L708: 1 | M708: 4 | N708: 1488 | O708: 0 | Q708: ="1,7,"&RC[2]&",0;"&"1,4,"&RC[4]&",0;" -> 1,7,13273,0;1,4,176385,0; | S708: =INT(((50+RC[-17]/10)*35+200)*12/4) -> 13273 | U708: =1000*110/100*(1+(50+RC[-19]/10)/200)*100 -> 176385
B709: 708 | C709: 0 | D709: 400708 | E709: 1,7,8184,0;1,4,1489,0; | G709: 1 | H709: 7 | I709: 8184 | J709: 0 | L709: 1 | M709: 4 | N709: 1489 | O709: 0 | Q709: ="1,7,"&RC[2]&",0;"&"1,4,"&RC[4]&",0;" -> 1,7,13284,0;1,4,176440,0; | S709: =INT(((50+RC[-17]/10)*35+200)*12/4) -> 13284 | U709: =1000*110/100*(1+(50+RC[-19]/10)/200)*100 -> 176440
B710: 709 | C710: 0 | D710: 400709 | E710: 1,7,8194,0;1,4,1489,0; | G710: 1 | H710: 7 | I710: 8194 | J710: 0 | L710: 1 | M710: 4 | N710: 1489 | O710: 0 | Q710: ="1,7,"&RC[2]&",0;"&"1,4,"&RC[4]&",0;" -> 1,7,13294,0;1,4,176495,0; | S710: =INT(((50+RC[-17]/10)*35+200)*12/4) -> 13294 | U710: =1000*110/100*(1+(50+RC[-19]/10)/200)*100 -> 176495
B711: 710 | C711: 0 | D711: 400710 | E711: 1,7,8205,0;1,4,1490,0; | G711: 1 | H711: 7 | I711: 8205 | J711: 0 | L711: 1 | M711: 4 | N711: 1490 | O711: 0 | Q711: ="1,7,"&RC[2]&",0;"&"1,4,"&RC[4]&",0;" -> 1,7,13305,0;1,4,176550,0; | S711: =INT(((50+RC[-17]/10)*35+200)*12/4) -> 13305 | U711: =1000*110/100*(1+(50+RC[-19]/10)/200)*100 -> 176550
B712: 711 | C712: 0 | D712: 400711 | E712: 1,7,8215,0;1,4,1491,0; | G712: 1 | H712: 7 | I712: 8215 | J712: 0 | L712: 1 | M712: 4 | N712: 1491 | O712: 0 | Q712: ="1,7,"&RC[2]&",0;"&"1,4,"&RC[4]&",0;" -> 1,7,13315,0;1,4,176605,0; | S712: =INT(((50+RC[-17]/10)*35+200)*12/4) -> 13315 | U712: =1000*110/100*(1+(50+RC[-19]/10)/200)*100 -> 176605
B713: 712 | C713: 0 | D713: 400712 | E713: 1,7,8226,0;1,4,1491,0; | G713: 1 | H713: 7 | I713: 8226 | J713: 0 | L713: 1 | M713: 4 | N713: 1491 | O713: 0 | Q713: ="1,7,"&RC[2]&",0;"&"1,4,"&RC[4]&",0;" -> 1,7,13326,0;1,4,176660,0; | S713: =INT(((50+RC[-17]/10)*35+200)*12/4) -> 13326 | U713: =1000*110/100*(1+(50+RC[-19]/10)/200)*100 -> 176660
B714: 713 | C714: 0 | D714: 400713 | E714: 1,7,8236,0;1,4,1492,0; | G714: 1 | H714: 7 | I714: 8236 | J714: 0 | L714: 1 | M714: 4 | N714: 1492 | O714: 0 | Q714: ="1,7,"&RC[2]&",0;"&"1,4,"&RC[4]&",0;" -> 1,7,13336,0;1,4,176715,0; | S714: =INT(((50+RC[-17]/10)*35+200)*12/4) -> 13336 | U714: =1000*110/100*(1+(50+RC[-19]/10)/200)*100 -> 176715
B715: 714 | C715: 0 | D715: 400714 | E715: 1,7,8247,0;1,4,1492,0; | G715: 1 | H715: 7 | I715: 8247 | J715: 0 | L715: 1 | M715: 4 | N715: 1492 | O715: 0 | Q715: ="1,7,"&RC[2]&",0;"&"1,4,"&RC[4]&",0;" -> 1,7,13347,0;1,4,176770,0; | S715: =INT(((50+RC[-17]/10)*35+200)*12/4) -> 13347 | U715: =1000*110/100*(1+(50+RC[-19]/10)/200)*100 -> 176770
B716: 715 | C716: 0 | D716: 400715 | E716: 1,7,8257,0;1,4,1493,0; | G716: 1 | H716: 7 | I716: 8257 | J716: 0 | L716: 1 | M716: 4 | N716: 1493 | O716: 0 | Q716: ="1,7,"&RC[2]&",0;"&"1,4,"&RC[4]&",0;" -> 1,7,13357,0;1,4,176825,0; | S716: =INT(((50+RC[-17]/10)*35+200)*12/4) -> 13357 | U716: =1000*110/100*(1+(50+RC[-19]/10)/200)*100 -> 176825
B717: 716 | C717: 0 | D717: 400716 | E717: 1,7,8268,0;1,4,1493,0; | G717: 1 | H717: 7 | I717: 8268 | J717: 0 | L717: 1 | M717: 4 | N717: 1493 | O717: 0 | Q717: ="1,7,"&RC[2]&",0;"&"1,4,"&RC[4]&",0;" -> 1,7,13368,0;1,4,176880,0; | S717: =INT(((50+RC[-17]/10)*35+200)*12/4) -> 13368 | U717: =1000*110/100*(1+(50+RC[-19]/10)/200)*100 -> 176880.00000000003
B718: 717 | C718: 0 | D718: 400717 | E718: 1,7,8278,0;1,4,1494,0; | G718: 1 | H718: 7 | I718: 8278 | J718: 0 | L718: 1 | M718: 4 | N718: 1494 | O718: 0 | Q718: ="1,7,"&RC[2]&",0;"&"1,4,"&RC[4]&",0;" -> 1,7,13378,0;1,4,176935,0; | S718: =INT(((50+RC[-17]/10)*35+200)*12/4) -> 13378 | U718: =1000*110/100*(1+(50+RC[-19]/10)/200)*100 -> 176935
B719: 718 | C719: 0 | D719: 400718 | E719: 1,7,8289,0;1,4,1494,0; | G719: 1 | H719: 7 | I719: 8289 | J719: 0 | L719: 1 | M719: 4 | N719: 1494 | O719: 0 | Q719: ="1,7,"&RC[2]&",0;"&"1,4,"&RC[4]&",0;" -> 1,7,13389,0;1,4,176990,0; | S719: =INT(((50+RC[-17]/10)*35+200)*12/4) -> 13389 | U719: =1000*110/100*(1+(50+RC[-19]/10)/200)*100 -> 176990
B720: 719 | C720: 0 | D720: 400719 | E720: 1,7,8299,0;1,4,1495,0; | G720: 1 | H720: 7 | I720: 8299 | J720: 0 | L720: 1 | M720: 4 | N720: 1495 | O720: 0 | Q720: ="1,7,"&RC[2]&",0;"&"1,4,"&RC[4]&",0;" -> 1,7,13399,0;1,4,177045,0; | S720: =INT(((50+RC[-17]/10)*35+200)*12/4) -> 13399 | U720: =1000*110/100*(1+(50+RC[-19]/10)/200)*100 -> 177045.00000000003
B721: 720 | C721: 0 | D721: 400720 | E721: 1,7,8310,0;1,4,1496,0; | G721: 1 | H721: 7 | I721: 8310 | J721: 0 | L721: 1 | M721: 4 | N721: 1496 | O721: 0 | Q721: ="1,7,"&RC[2]&",0;"&"1,4,"&RC[4]&",0;" -> 1,7,13410,0;1,4,177100,0; | S721: =INT(((50+RC[-17]/10)*35+200)*12/4) -> 13410 | U721: =1000*110/100*(1+(50+RC[-19]/10)/200)*100 -> 177099.99999999997
B722: 721 | C722: 0 | D722: 400721 | E722: 1,7,8320,0;1,4,1496,0; | G722: 1 | H722: 7 | I722: 8320 | J722: 0 | L722: 1 | M722: 4 | N722: 1496 | O722: 0 | Q722: ="1,7,"&RC[2]&",0;"&"1,4,"&RC[4]&",0;" -> 1,7,13420,0;1,4,177155,0; | S722: =INT(((50+RC[-17]/10)*35+200)*12/4) -> 13420 | U722: =1000*110/100*(1+(50+RC[-19]/10)/200)*100 -> 177155
B723: 722 | C723: 0 | D723: 400722 | E723: 1,7,8331,0;1,4,1497,0; | G723: 1 | H723: 7 | I723: 8331 | J723: 0 | L723: 1 | M723: 4 | N723: 1497 | O723: 0 | Q723: ="1,7,"&RC[2]&",0;"&"1,4,"&RC[4]&",0;" -> 1,7,13431,0;1,4,177210,0; | S723: =INT(((50+RC[-17]/10)*35+200)*12/4) -> 13431 | U723: =1000*110/100*(1+(50+RC[-19]/10)/200)*100 -> 177210
B724: 723 | C724: 0 | D724: 400723 | E724: 1,7,8341,0;1,4,1497,0; | G724: 1 | H724: 7 | I724: 8341 | J724: 0 | L724: 1 | M724: 4 | N724: 1497 | O724: 0 | Q724: ="1,7,"&RC[2]&",0;"&"1,4,"&RC[4]&",0;" -> 1,7,13441,0;1,4,177265,0; | S724: =INT(((50+RC[-17]/10)*35+200)*12/4) -> 13441 | U724: =1000*110/100*(1+(50+RC[-19]/10)/200)*100 -> 177265
B725: 724 | C725: 0 | D725: 400724 | E725: 1,7,8352,0;1,4,1498,0; | G725: 1 | H725: 7 | I725: 8352 | J725: 0 | L725: 1 | M725: 4 | N725: 1498 | O725: 0 | Q725: ="1,7,"&RC[2]&",0;"&"1,4,"&RC[4]&",0;" -> 1,7,13452,0;1,4,177320,0; | S725: =INT(((50+RC[-17]/10)*35+200)*12/4) -> 13452 | U725: =1000*110/100*(1+(50+RC[-19]/10)/200)*100 -> 177320
B726: 725 | C726: 0 | D726: 400725 | E726: 1,7,8362,0;1,4,1498,0; | G726: 1 | H726: 7 | I726: 8362 | J726: 0 | L726: 1 | M726: 4 | N726: 1498 | O726: 0 | Q726: ="1,7,"&RC[2]&",0;"&"1,4,"&RC[4]&",0;" -> 1,7,13462,0;1,4,177375,0; | S726: =INT(((50+RC[-17]/10)*35+200)*12/4) -> 13462 | U726: =1000*110/100*(1+(50+RC[-19]/10)/200)*100 -> 177375
B727: 726 | C727: 0 | D727: 400726 | E727: 1,7,8373,0;1,4,1499,0; | G727: 1 | H727: 7 | I727: 8373 | J727: 0 | L727: 1 | M727: 4 | N727: 1499 | O727: 0 | Q727: ="1,7,"&RC[2]&",0;"&"1,4,"&RC[4]&",0;" -> 1,7,13473,0;1,4,177430,0; | S727: =INT(((50+RC[-17]/10)*35+200)*12/4) -> 13473 | U727: =1000*110/100*(1+(50+RC[-19]/10)/200)*100 -> 177430
B728: 727 | C728: 0 | D728: 400727 | E728: 1,7,8383,0;1,4,1499,0; | G728: 1 | H728: 7 | I728: 8383 | J728: 0 | L728: 1 | M728: 4 | N728: 1499 | O728: 0 | Q728: ="1,7,"&RC[2]&",0;"&"1,4,"&RC[4]&",0;" -> 1,7,13483,0;1,4,177485,0; | S728: =INT(((50+RC[-17]/10)*35+200)*12/4) -> 13483 | U728: =1000*110/100*(1+(50+RC[-19]/10)/200)*100 -> 177485
B729: 728 | C729: 0 | D729: 400728 | E729: 1,7,8394,0;1,4,1500,0; | G729: 1 | H729: 7 | I729: 8394 | J729: 0 | L729: 1 | M729: 4 | N729: 1500 | O729: 0 | Q729: ="1,7,"&RC[2]&",0;"&"1,4,"&RC[4]&",0;" -> 1,7,13494,0;1,4,177540,0; | S729: =INT(((50+RC[-17]/10)*35+200)*12/4) -> 13494 | U729: =1000*110/100*(1+(50+RC[-19]/10)/200)*100 -> 177540
B730: 729 | C730: 0 | D730: 400729 | E730: 1,7,8404,0;1,4,1500,0; | G730: 1 | H730: 7 | I730: 8404 | J730: 0 | L730: 1 | M730: 4 | N730: 1500 | O730: 0 | Q730: ="1,7,"&RC[2]&",0;"&"1,4,"&RC[4]&",0;" -> 1,7,13504,0;1,4,177595,0; | S730: =INT(((50+RC[-17]/10)*35+200)*12/4) -> 13504 | U730: =1000*110/100*(1+(50+RC[-19]/10)/200)*100 -> 177595
B731: 730 | C731: 0 | D731: 400730 | E731: 1,7,8415,0;1,4,1501,0; | G731: 1 | H731: 7 | I731: 8415 | J731: 0 | L731: 1 | M731: 4 | N731: 1501 | O731: 0 | Q731: ="1,7,"&RC[2]&",0;"&"1,4,"&RC[4]&",0;" -> 1,7,13515,0;1,4,177650,0; | S731: =INT(((50+RC[-17]/10)*35+200)*12/4) -> 13515 | U731: =1000*110/100*(1+(50+RC[-19]/10)/200)*100 -> 177650
B732: 731 | C732: 0 | D732: 400731 | E732: 1,7,8425,0;1,4,1502,0; | G732: 1 | H732: 7 | I732: 8425 | J732: 0 | L732: 1 | M732: 4 | N732: 1502 | O732: 0 | Q732: ="1,7,"&RC[2]&",0;"&"1,4,"&RC[4]&",0;" -> 1,7,13525,0;1,4,177705,0; | S732: =INT(((50+RC[-17]/10)*35+200)*12/4) -> 13525 | U732: =1000*110/100*(1+(50+RC[-19]/10)/200)*100 -> 177705
B733: 732 | C733: 0 | D733: 400732 | E733: 1,7,8436,0;1,4,1502,0; | G733: 1 | H733: 7 | I733: 8436 | J733: 0 | L733: 1 | M733: 4 | N733: 1502 | O733: 0 | Q733: ="1,7,"&RC[2]&",0;"&"1,4,"&RC[4]&",0;" -> 1,7,13536,0;1,4,177760,0; | S733: =INT(((50+RC[-17]/10)*35+200)*12/4) -> 13536 | U733: =1000*110/100*(1+(50+RC[-19]/10)/200)*100 -> 177760
B734: 733 | C734: 0 | D734: 400733 | E734: 1,7,8446,0;1,4,1503,0; | G734: 1 | H734: 7 | I734: 8446 | J734: 0 | L734: 1 | M734: 4 | N734: 1503 | O734: 0 | Q734: ="1,7,"&RC[2]&",0;"&"1,4,"&RC[4]&",0;" -> 1,7,13546,0;1,4,177815,0; | S734: =INT(((50+RC[-17]/10)*35+200)*12/4) -> 13546 | U734: =1000*110/100*(1+(50+RC[-19]/10)/200)*100 -> 177815
B735: 734 | C735: 0 | D735: 400734 | E735: 1,7,8457,0;1,4,1503,0; | G735: 1 | H735: 7 | I735: 8457 | J735: 0 | L735: 1 | M735: 4 | N735: 1503 | O735: 0 | Q735: ="1,7,"&RC[2]&",0;"&"1,4,"&RC[4]&",0;" -> 1,7,13557,0;1,4,177870,0; | S735: =INT(((50+RC[-17]/10)*35+200)*12/4) -> 13557 | U735: =1000*110/100*(1+(50+RC[-19]/10)/200)*100 -> 177870
B736: 735 | C736: 0 | D736: 400735 | E736: 1,7,8467,0;1,4,1504,0; | G736: 1 | H736: 7 | I736: 8467 | J736: 0 | L736: 1 | M736: 4 | N736: 1504 | O736: 0 | Q736: ="1,7,"&RC[2]&",0;"&"1,4,"&RC[4]&",0;" -> 1,7,13567,0;1,4,177925,0; | S736: =INT(((50+RC[-17]/10)*35+200)*12/4) -> 13567 | U736: =1000*110/100*(1+(50+RC[-19]/10)/200)*100 -> 177925.00000000003
B737: 736 | C737: 0 | D737: 400736 | E737: 1,7,8478,0;1,4,1504,0; | G737: 1 | H737: 7 | I737: 8478 | J737: 0 | L737: 1 | M737: 4 | N737: 1504 | O737: 0 | Q737: ="1,7,"&RC[2]&",0;"&"1,4,"&RC[4]&",0;" -> 1,7,13578,0;1,4,177980,0; | S737: =INT(((50+RC[-17]/10)*35+200)*12/4) -> 13578 | U737: =1000*110/100*(1+(50+RC[-19]/10)/200)*100 -> 177980
B738: 737 | C738: 0 | D738: 400737 | E738: 1,7,8488,0;1,4,1505,0; | G738: 1 | H738: 7 | I738: 8488 | J738: 0 | L738: 1 | M738: 4 | N738: 1505 | O738: 0 | Q738: ="1,7,"&RC[2]&",0;"&"1,4,"&RC[4]&",0;" -> 1,7,13588,0;1,4,178035,0; | S738: =INT(((50+RC[-17]/10)*35+200)*12/4) -> 13588 | U738: =1000*110/100*(1+(50+RC[-19]/10)/200)*100 -> 178035
B739: 738 | C739: 0 | D739: 400738 | E739: 1,7,8499,0;1,4,1505,0; | G739: 1 | H739: 7 | I739: 8499 | J739: 0 | L739: 1 | M739: 4 | N739: 1505 | O739: 0 | Q739: ="1,7,"&RC[2]&",0;"&"1,4,"&RC[4]&",0;" -> 1,7,13599,0;1,4,178090,0; | S739: =INT(((50+RC[-17]/10)*35+200)*12/4) -> 13599 | U739: =1000*110/100*(1+(50+RC[-19]/10)/200)*100 -> 178090
B740: 739 | C740: 0 | D740: 400739 | E740: 1,7,8509,0;1,4,1506,0; | G740: 1 | H740: 7 | I740: 8509 | J740: 0 | L740: 1 | M740: 4 | N740: 1506 | O740: 0 | Q740: ="1,7,"&RC[2]&",0;"&"1,4,"&RC[4]&",0;" -> 1,7,13609,0;1,4,178145,0; | S740: =INT(((50+RC[-17]/10)*35+200)*12/4) -> 13609 | U740: =1000*110/100*(1+(50+RC[-19]/10)/200)*100 -> 178145
B741: 740 | C741: 0 | D741: 400740 | E741: 1,7,8520,0;1,4,1507,0; | G741: 1 | H741: 7 | I741: 8520 | J741: 0 | L741: 1 | M741: 4 | N741: 1507 | O741: 0 | Q741: ="1,7,"&RC[2]&",0;"&"1,4,"&RC[4]&",0;" -> 1,7,13620,0;1,4,178200,0; | S741: =INT(((50+RC[-17]/10)*35+200)*12/4) -> 13620 | U741: =1000*110/100*(1+(50+RC[-19]/10)/200)*100 -> 178200.00000000003
B742: 741 | C742: 0 | D742: 400741 | E742: 1,7,8530,0;1,4,1507,0; | G742: 1 | H742: 7 | I742: 8530 | J742: 0 | L742: 1 | M742: 4 | N742: 1507 | O742: 0 | Q742: ="1,7,"&RC[2]&",0;"&"1,4,"&RC[4]&",0;" -> 1,7,13630,0;1,4,178255,0; | S742: =INT(((50+RC[-17]/10)*35+200)*12/4) -> 13630 | U742: =1000*110/100*(1+(50+RC[-19]/10)/200)*100 -> 178254.99999999997
B743: 742 | C743: 0 | D743: 400742 | E743: 1,7,8541,0;1,4,1508,0; | G743: 1 | H743: 7 | I743: 8541 | J743: 0 | L743: 1 | M743: 4 | N743: 1508 | O743: 0 | Q743: ="1,7,"&RC[2]&",0;"&"1,4,"&RC[4]&",0;" -> 1,7,13641,0;1,4,178310,0; | S743: =INT(((50+RC[-17]/10)*35+200)*12/4) -> 13641 | U743: =1000*110/100*(1+(50+RC[-19]/10)/200)*100 -> 178310
B744: 743 | C744: 0 | D744: 400743 | E744: 1,7,8551,0;1,4,1508,0; | G744: 1 | H744: 7 | I744: 8551 | J744: 0 | L744: 1 | M744: 4 | N744: 1508 | O744: 0 | Q744: ="1,7,"&RC[2]&",0;"&"1,4,"&RC[4]&",0;" -> 1,7,13651,0;1,4,178365,0; | S744: =INT(((50+RC[-17]/10)*35+200)*12/4) -> 13651 | U744: =1000*110/100*(1+(50+RC[-19]/10)/200)*100 -> 178365
B745: 744 | C745: 0 | D745: 400744 | E745: 1,7,8562,0;1,4,1509,0; | G745: 1 | H745: 7 | I745: 8562 | J745: 0 | L745: 1 | M745: 4 | N745: 1509 | O745: 0 | Q745: ="1,7,"&RC[2]&",0;"&"1,4,"&RC[4]&",0;" -> 1,7,13662,0;1,4,178420,0; | S745: =INT(((50+RC[-17]/10)*35+200)*12/4) -> 13662 | U745: =1000*110/100*(1+(50+RC[-19]/10)/200)*100 -> 178419.99999999997
B746: 745 | C746: 0 | D746: 400745 | E746: 1,7,8572,0;1,4,1509,0; | G746: 1 | H746: 7 | I746: 8572 | J746: 0 | L746: 1 | M746: 4 | N746: 1509 | O746: 0 | Q746: ="1,7,"&RC[2]&",0;"&"1,4,"&RC[4]&",0;" -> 1,7,13672,0;1,4,178475,0; | S746: =INT(((50+RC[-17]/10)*35+200)*12/4) -> 13672 | U746: =1000*110/100*(1+(50+RC[-19]/10)/200)*100 -> 178475
B747: 746 | C747: 0 | D747: 400746 | E747: 1,7,8583,0;1,4,1510,0; | G747: 1 | H747: 7 | I747: 8583 | J747: 0 | L747: 1 | M747: 4 | N747: 1510 | O747: 0 | Q747: ="1,7,"&RC[2]&",0;"&"1,4,"&RC[4]&",0;" -> 1,7,13683,0;1,4,178530,0; | S747: =INT(((50+RC[-17]/10)*35+200)*12/4) -> 13683 | U747: =1000*110/100*(1+(50+RC[-19]/10)/200)*100 -> 178530
B748: 747 | C748: 0 | D748: 400747 | E748: 1,7,8593,0;1,4,1510,0; | G748: 1 | H748: 7 | I748: 8593 | J748: 0 | L748: 1 | M748: 4 | N748: 1510 | O748: 0 | Q748: ="1,7,"&RC[2]&",0;"&"1,4,"&RC[4]&",0;" -> 1,7,13693,0;1,4,178585,0; | S748: =INT(((50+RC[-17]/10)*35+200)*12/4) -> 13693 | U748: =1000*110/100*(1+(50+RC[-19]/10)/200)*100 -> 178585
B749: 748 | C749: 0 | D749: 400748 | E749: 1,7,8604,0;1,4,1511,0; | G749: 1 | H749: 7 | I749: 8604 | J749: 0 | L749: 1 | M749: 4 | N749: 1511 | O749: 0 | Q749: ="1,7,"&RC[2]&",0;"&"1,4,"&RC[4]&",0;" -> 1,7,13704,0;1,4,178640,0; | S749: =INT(((50+RC[-17]/10)*35+200)*12/4) -> 13704 | U749: =1000*110/100*(1+(50+RC[-19]/10)/200)*100 -> 178640
B750: 749 | C750: 0 | D750: 400749 | E750: 1,7,8614,0;1,4,1511,0; | G750: 1 | H750: 7 | I750: 8614 | J750: 0 | L750: 1 | M750: 4 | N750: 1511 | O750: 0 | Q750: ="1,7,"&RC[2]&",0;"&"1,4,"&RC[4]&",0;" -> 1,7,13714,0;1,4,178695,0; | S750: =INT(((50+RC[-17]/10)*35+200)*12/4) -> 13714 | U750: =1000*110/100*(1+(50+RC[-19]/10)/200)*100 -> 178695
B751: 750 | C751: 0 | D751: 400750 | E751: 1,7,8625,0;1,4,1512,0; | G751: 1 | H751: 7 | I751: 8625 | J751: 0 | L751: 1 | M751: 4 | N751: 1512 | O751: 0 | Q751: ="1,7,"&RC[2]&",0;"&"1,4,"&RC[4]&",0;" -> 1,7,13725,0;1,4,178750,0; | S751: =INT(((50+RC[-17]/10)*35+200)*12/4) -> 13725 | U751: =1000*110/100*(1+(50+RC[-19]/10)/200)*100 -> 178750
B752: 751 | C752: 0 | D752: 400751 | E752: 1,7,8635,0;1,4,1513,0; | G752: 1 | H752: 7 | I752: 8635 | J752: 0 | L752: 1 | M752: 4 | N752: 1513 | O752: 0 | Q752: ="1,7,"&RC[2]&",0;"&"1,4,"&RC[4]&",0;" -> 1,7,13735,0;1,4,178805,0; | S752: =INT(((50+RC[-17]/10)*35+200)*12/4) -> 13735 | U752: =1000*110/100*(1+(50+RC[-19]/10)/200)*100 -> 178805
B753: 752 | C753: 0 | D753: 400752 | E753: 1,7,8646,0;1,4,1513,0; | G753: 1 | H753: 7 | I753: 8646 | J753: 0 | L753: 1 | M753: 4 | N753: 1513 | O753: 0 | Q753: ="1,7,"&RC[2]&",0;"&"1,4,"&RC[4]&",0;" -> 1,7,13746,0;1,4,178860,0; | S753: =INT(((50+RC[-17]/10)*35+200)*12/4) -> 13746 | U753: =1000*110/100*(1+(50+RC[-19]/10)/200)*100 -> 178860
B754: 753 | C754: 0 | D754: 400753 | E754: 1,7,8656,0;1,4,1514,0; | G754: 1 | H754: 7 | I754: 8656 | J754: 0 | L754: 1 | M754: 4 | N754: 1514 | O754: 0 | Q754: ="1,7,"&RC[2]&",0;"&"1,4,"&RC[4]&",0;" -> 1,7,13756,0;1,4,178915,0; | S754: =INT(((50+RC[-17]/10)*35+200)*12/4) -> 13756 | U754: =1000*110/100*(1+(50+RC[-19]/10)/200)*100 -> 178915
B755: 754 | C755: 0 | D755: 400754 | E755: 1,7,8667,0;1,4,1514,0; | G755: 1 | H755: 7 | I755: 8667 | J755: 0 | L755: 1 | M755: 4 | N755: 1514 | O755: 0 | Q755: ="1,7,"&RC[2]&",0;"&"1,4,"&RC[4]&",0;" -> 1,7,13767,0;1,4,178970,0; | S755: =INT(((50+RC[-17]/10)*35+200)*12/4) -> 13767 | U755: =1000*110/100*(1+(50+RC[-19]/10)/200)*100 -> 178970
B756: 755 | C756: 0 | D756: 400755 | E756: 1,7,8677,0;1,4,1515,0; | G756: 1 | H756: 7 | I756: 8677 | J756: 0 | L756: 1 | M756: 4 | N756: 1515 | O756: 0 | Q756: ="1,7,"&RC[2]&",0;"&"1,4,"&RC[4]&",0;" -> 1,7,13777,0;1,4,179025,0; | S756: =INT(((50+RC[-17]/10)*35+200)*12/4) -> 13777 | U756: =1000*110/100*(1+(50+RC[-19]/10)/200)*100 -> 179025
B757: 756 | C757: 0 | D757: 400756 | E757: 1,7,8688,0;1,4,1515,0; | G757: 1 | H757: 7 | I757: 8688 | J757: 0 | L757: 1 | M757: 4 | N757: 1515 | O757: 0 | Q757: ="1,7,"&RC[2]&",0;"&"1,4,"&RC[4]&",0;" -> 1,7,13788,0;1,4,179080,0; | S757: =INT(((50+RC[-17]/10)*35+200)*12/4) -> 13788 | U757: =1000*110/100*(1+(50+RC[-19]/10)/200)*100 -> 179080.00000000003
B758: 757 | C758: 0 | D758: 400757 | E758: 1,7,8698,0;1,4,1516,0; | G758: 1 | H758: 7 | I758: 8698 | J758: 0 | L758: 1 | M758: 4 | N758: 1516 | O758: 0 | Q758: ="1,7,"&RC[2]&",0;"&"1,4,"&RC[4]&",0;" -> 1,7,13798,0;1,4,179135,0; | S758: =INT(((50+RC[-17]/10)*35+200)*12/4) -> 13798 | U758: =1000*110/100*(1+(50+RC[-19]/10)/200)*100 -> 179135
B759: 758 | C759: 0 | D759: 400758 | E759: 1,7,8709,0;1,4,1516,0; | G759: 1 | H759: 7 | I759: 8709 | J759: 0 | L759: 1 | M759: 4 | N759: 1516 | O759: 0 | Q759: ="1,7,"&RC[2]&",0;"&"1,4,"&RC[4]&",0;" -> 1,7,13809,0;1,4,179190,0; | S759: =INT(((50+RC[-17]/10)*35+200)*12/4) -> 13809 | U759: =1000*110/100*(1+(50+RC[-19]/10)/200)*100 -> 179190
B760: 759 | C760: 0 | D760: 400759 | E760: 1,7,8719,0;1,4,1517,0; | G760: 1 | H760: 7 | I760: 8719 | J760: 0 | L760: 1 | M760: 4 | N760: 1517 | O760: 0 | Q760: ="1,7,"&RC[2]&",0;"&"1,4,"&RC[4]&",0;" -> 1,7,13819,0;1,4,179245,0; | S760: =INT(((50+RC[-17]/10)*35+200)*12/4) -> 13819 | U760: =1000*110/100*(1+(50+RC[-19]/10)/200)*100 -> 179245.00000000003
B761: 760 | C761: 0 | D761: 400760 | E761: 1,7,8730,0;1,4,1518,0; | G761: 1 | H761: 7 | I761: 8730 | J761: 0 | L761: 1 | M761: 4 | N761: 1518 | O761: 0 | Q761: ="1,7,"&RC[2]&",0;"&"1,4,"&RC[4]&",0;" -> 1,7,13830,0;1,4,179300,0; | S761: =INT(((50+RC[-17]/10)*35+200)*12/4) -> 13830 | U761: =1000*110/100*(1+(50+RC[-19]/10)/200)*100 -> 179299.99999999997
B762: 761 | C762: 0 | D762: 400761 | E762: 1,7,8740,0;1,4,1518,0; | G762: 1 | H762: 7 | I762: 8740 | J762: 0 | L762: 1 | M762: 4 | N762: 1518 | O762: 0 | Q762: ="1,7,"&RC[2]&",0;"&"1,4,"&RC[4]&",0;" -> 1,7,13840,0;1,4,179355,0; | S762: =INT(((50+RC[-17]/10)*35+200)*12/4) -> 13840 | U762: =1000*110/100*(1+(50+RC[-19]/10)/200)*100 -> 179355
B763: 762 | C763: 0 | D763: 400762 | E763: 1,7,8751,0;1,4,1519,0; | G763: 1 | H763: 7 | I763: 8751 | J763: 0 | L763: 1 | M763: 4 | N763: 1519 | O763: 0 | Q763: ="1,7,"&RC[2]&",0;"&"1,4,"&RC[4]&",0;" -> 1,7,13851,0;1,4,179410,0; | S763: =INT(((50+RC[-17]/10)*35+200)*12/4) -> 13851 | U763: =1000*110/100*(1+(50+RC[-19]/10)/200)*100 -> 179410
B764: 763 | C764: 0 | D764: 400763 | E764: 1,7,8761,0;1,4,1519,0; | G764: 1 | H764: 7 | I764: 8761 | J764: 0 | L764: 1 | M764: 4 | N764: 1519 | O764: 0 | Q764: ="1,7,"&RC[2]&",0;"&"1,4,"&RC[4]&",0;" -> 1,7,13861,0;1,4,179465,0; | S764: =INT(((50+RC[-17]/10)*35+200)*12/4) -> 13861 | U764: =1000*110/100*(1+(50+RC[-19]/10)/200)*100 -> 179465
B765: 764 | C765: 0 | D765: 400764 | E765: 1,7,8772,0;1,4,1520,0; | G765: 1 | H765: 7 | I765: 8772 | J765: 0 | L765: 1 | M765: 4 | N765: 1520 | O765: 0 | Q765: ="1,7,"&RC[2]&",0;"&"1,4,"&RC[4]&",0;" -> 1,7,13872,0;1,4,179520,0; | S765: =INT(((50+RC[-17]/10)*35+200)*12/4) -> 13872 | U765: =1000*110/100*(1+(50+RC[-19]/10)/200)*100 -> 179520
B766: 765 | C766: 0 | D766: 400765 | E766: 1,7,8782,0;1,4,1520,0; | G766: 1 | H766: 7 | I766: 8782 | J766: 0 | L766: 1 | M766: 4 | N766: 1520 | O766: 0 | Q766: ="1,7,"&RC[2]&",0;"&"1,4,"&RC[4]&",0;" -> 1,7,13882,0;1,4,179575,0; | S766: =INT(((50+RC[-17]/10)*35+200)*12/4) -> 13882 | U766: =1000*110/100*(1+(50+RC[-19]/10)/200)*100 -> 179574.99999999997
B767: 766 | C767: 0 | D767: 400766 | E767: 1,7,8793,0;1,4,1521,0; | G767: 1 | H767: 7 | I767: 8793 | J767: 0 | L767: 1 | M767: 4 | N767: 1521 | O767: 0 | Q767: ="1,7,"&RC[2]&",0;"&"1,4,"&RC[4]&",0;" -> 1,7,13893,0;1,4,179630,0; | S767: =INT(((50+RC[-17]/10)*35+200)*12/4) -> 13893 | U767: =1000*110/100*(1+(50+RC[-19]/10)/200)*100 -> 179630
B768: 767 | C768: 0 | D768: 400767 | E768: 1,7,8803,0;1,4,1521,0; | G768: 1 | H768: 7 | I768: 8803 | J768: 0 | L768: 1 | M768: 4 | N768: 1521 | O768: 0 | Q768: ="1,7,"&RC[2]&",0;"&"1,4,"&RC[4]&",0;" -> 1,7,13903,0;1,4,179685,0; | S768: =INT(((50+RC[-17]/10)*35+200)*12/4) -> 13903 | U768: =1000*110/100*(1+(50+RC[-19]/10)/200)*100 -> 179685
B769: 768 | C769: 0 | D769: 400768 | E769: 1,7,8814,0;1,4,1522,0; | G769: 1 | H769: 7 | I769: 8814 | J769: 0 | L769: 1 | M769: 4 | N769: 1522 | O769: 0 | Q769: ="1,7,"&RC[2]&",0;"&"1,4,"&RC[4]&",0;" -> 1,7,13914,0;1,4,179740,0; | S769: =INT(((50+RC[-17]/10)*35+200)*12/4) -> 13914 | U769: =1000*110/100*(1+(50+RC[-19]/10)/200)*100 -> 179740
B770: 769 | C770: 0 | D770: 400769 | E770: 1,7,8824,0;1,4,1522,0; | G770: 1 | H770: 7 | I770: 8824 | J770: 0 | L770: 1 | M770: 4 | N770: 1522 | O770: 0 | Q770: ="1,7,"&RC[2]&",0;"&"1,4,"&RC[4]&",0;" -> 1,7,13924,0;1,4,179795,0; | S770: =INT(((50+RC[-17]/10)*35+200)*12/4) -> 13924 | U770: =1000*110/100*(1+(50+RC[-19]/10)/200)*100 -> 179795
B771: 770 | C771: 0 | D771: 400770 | E771: 1,7,8835,0;1,4,1523,0; | G771: 1 | H771: 7 | I771: 8835 | J771: 0 | L771: 1 | M771: 4 | N771: 1523 | O771: 0 | Q771: ="1,7,"&RC[2]&",0;"&"1,4,"&RC[4]&",0;" -> 1,7,13935,0;1,4,179850,0; | S771: =INT(((50+RC[-17]/10)*35+200)*12/4) -> 13935 | U771: =1000*110/100*(1+(50+RC[-19]/10)/200)*100 -> 179850
B772: 771 | C772: 0 | D772: 400771 | E772: 1,7,8845,0;1,4,1524,0; | G772: 1 | H772: 7 | I772: 8845 | J772: 0 | L772: 1 | M772: 4 | N772: 1524 | O772: 0 | Q772: ="1,7,"&RC[2]&",0;"&"1,4,"&RC[4]&",0;" -> 1,7,13945,0;1,4,179905,0; | S772: =INT(((50+RC[-17]/10)*35+200)*12/4) -> 13945 | U772: =1000*110/100*(1+(50+RC[-19]/10)/200)*100 -> 179905
B773: 772 | C773: 0 | D773: 400772 | E773: 1,7,8856,0;1,4,1524,0; | G773: 1 | H773: 7 | I773: 8856 | J773: 0 | L773: 1 | M773: 4 | N773: 1524 | O773: 0 | Q773: ="1,7,"&RC[2]&",0;"&"1,4,"&RC[4]&",0;" -> 1,7,13956,0;1,4,179960,0; | S773: =INT(((50+RC[-17]/10)*35+200)*12/4) -> 13956 | U773: =1000*110/100*(1+(50+RC[-19]/10)/200)*100 -> 179960
B774: 773 | C774: 0 | D774: 400773 | E774: 1,7,8866,0;1,4,1525,0; | G774: 1 | H774: 7 | I774: 8866 | J774: 0 | L774: 1 | M774: 4 | N774: 1525 | O774: 0 | Q774: ="1,7,"&RC[2]&",0;"&"1,4,"&RC[4]&",0;" -> 1,7,13966,0;1,4,180015,0; | S774: =INT(((50+RC[-17]/10)*35+200)*12/4) -> 13966 | U774: =1000*110/100*(1+(50+RC[-19]/10)/200)*100 -> 180015
B775: 774 | C775: 0 | D775: 400774 | E775: 1,7,8877,0;1,4,1525,0; | G775: 1 | H775: 7 | I775: 8877 | J775: 0 | L775: 1 | M775: 4 | N775: 1525 | O775: 0 | Q775: ="1,7,"&RC[2]&",0;"&"1,4,"&RC[4]&",0;" -> 1,7,13977,0;1,4,180070,0; | S775: =INT(((50+RC[-17]/10)*35+200)*12/4) -> 13977 | U775: =1000*110/100*(1+(50+RC[-19]/10)/200)*100 -> 180070
B776: 775 | C776: 0 | D776: 400775 | E776: 1,7,8887,0;1,4,1526,0; | G776: 1 | H776: 7 | I776: 8887 | J776: 0 | L776: 1 | M776: 4 | N776: 1526 | O776: 0 | Q776: ="1,7,"&RC[2]&",0;"&"1,4,"&RC[4]&",0;" -> 1,7,13987,0;1,4,180125,0; | S776: =INT(((50+RC[-17]/10)*35+200)*12/4) -> 13987 | U776: =1000*110/100*(1+(50+RC[-19]/10)/200)*100 -> 180125
B777: 776 | C777: 0 | D777: 400776 | E777: 1,7,8898,0;1,4,1526,0; | G777: 1 | H777: 7 | I777: 8898 | J777: 0 | L777: 1 | M777: 4 | N777: 1526 | O777: 0 | Q777: ="1,7,"&RC[2]&",0;"&"1,4,"&RC[4]&",0;" -> 1,7,13998,0;1,4,180180,0; | S777: =INT(((50+RC[-17]/10)*35+200)*12/4) -> 13998 | U777: =1000*110/100*(1+(50+RC[-19]/10)/200)*100 -> 180180
B778: 777 | C778: 0 | D778: 400777 | E778: 1,7,8908,0;1,4,1527,0; | G778: 1 | H778: 7 | I778: 8908 | J778: 0 | L778: 1 | M778: 4 | N778: 1527 | O778: 0 | Q778: ="1,7,"&RC[2]&",0;"&"1,4,"&RC[4]&",0;" -> 1,7,14008,0;1,4,180235,0; | S778: =INT(((50+RC[-17]/10)*35+200)*12/4) -> 14008 | U778: =1000*110/100*(1+(50+RC[-19]/10)/200)*100 -> 180235
B779: 778 | C779: 0 | D779: 400778 | E779: 1,7,8919,0;1,4,1527,0; | G779: 1 | H779: 7 | I779: 8919 | J779: 0 | L779: 1 | M779: 4 | N779: 1527 | O779: 0 | Q779: ="1,7,"&RC[2]&",0;"&"1,4,"&RC[4]&",0;" -> 1,7,14019,0;1,4,180290,0; | S779: =INT(((50+RC[-17]/10)*35+200)*12/4) -> 14019 | U779: =1000*110/100*(1+(50+RC[-19]/10)/200)*100 -> 180290
B780: 779 | C780: 0 | D780: 400779 | E780: 1,7,8929,0;1,4,1528,0; | G780: 1 | H780: 7 | I780: 8929 | J780: 0 | L780: 1 | M780: 4 | N780: 1528 | O780: 0 | Q780: ="1,7,"&RC[2]&",0;"&"1,4,"&RC[4]&",0;" -> 1,7,14029,0;1,4,180345,0; | S780: =INT(((50+RC[-17]/10)*35+200)*12/4) -> 14029 | U780: =1000*110/100*(1+(50+RC[-19]/10)/200)*100 -> 180345
B781: 780 | C781: 0 | D781: 400780 | E781: 1,7,8940,0;1,4,1529,0; | G781: 1 | H781: 7 | I781: 8940 | J781: 0 | L781: 1 | M781: 4 | N781: 1529 | O781: 0 | Q781: ="1,7,"&RC[2]&",0;"&"1,4,"&RC[4]&",0;" -> 1,7,14040,0;1,4,180400,0; | S781: =INT(((50+RC[-17]/10)*35+200)*12/4) -> 14040 | U781: =1000*110/100*(1+(50+RC[-19]/10)/200)*100 -> 180400.00000000003
B782: 781 | C782: 0 | D782: 400781 | E782: 1,7,8950,0;1,4,1529,0; | G782: 1 | H782: 7 | I782: 8950 | J782: 0 | L782: 1 | M782: 4 | N782: 1529 | O782: 0 | Q782: ="1,7,"&RC[2]&",0;"&"1,4,"&RC[4]&",0;" -> 1,7,14050,0;1,4,180455,0; | S782: =INT(((50+RC[-17]/10)*35+200)*12/4) -> 14050 | U782: =1000*110/100*(1+(50+RC[-19]/10)/200)*100 -> 180454.99999999997
B783: 782 | C783: 0 | D783: 400782 | E783: 1,7,8961,0;1,4,1530,0; | G783: 1 | H783: 7 | I783: 8961 | J783: 0 | L783: 1 | M783: 4 | N783: 1530 | O783: 0 | Q783: ="1,7,"&RC[2]&",0;"&"1,4,"&RC[4]&",0;" -> 1,7,14061,0;1,4,180510,0; | S783: =INT(((50+RC[-17]/10)*35+200)*12/4) -> 14061 | U783: =1000*110/100*(1+(50+RC[-19]/10)/200)*100 -> 180510
B784: 783 | C784: 0 | D784: 400783 | E784: 1,7,8971,0;1,4,1530,0; | G784: 1 | H784: 7 | I784: 8971 | J784: 0 | L784: 1 | M784: 4 | N784: 1530 | O784: 0 | Q784: ="1,7,"&RC[2]&",0;"&"1,4,"&RC[4]&",0;" -> 1,7,14071,0;1,4,180565,0; | S784: =INT(((50+RC[-17]/10)*35+200)*12/4) -> 14071 | U784: =1000*110/100*(1+(50+RC[-19]/10)/200)*100 -> 180565
B785: 784 | C785: 0 | D785: 400784 | E785: 1,7,8982,0;1,4,1531,0; | G785: 1 | H785: 7 | I785: 8982 | J785: 0 | L785: 1 | M785: 4 | N785: 1531 | O785: 0 | Q785: ="1,7,"&RC[2]&",0;"&"1,4,"&RC[4]&",0;" -> 1,7,14082,0;1,4,180620,0; | S785: =INT(((50+RC[-17]/10)*35+200)*12/4) -> 14082 | U785: =1000*110/100*(1+(50+RC[-19]/10)/200)*100 -> 180619.99999999997
B786: 785 | C786: 0 | D786: 400785 | E786: 1,7,8992,0;1,4,1531,0; | G786: 1 | H786: 7 | I786: 8992 | J786: 0 | L786: 1 | M786: 4 | N786: 1531 | O786: 0 | Q786: ="1,7,"&RC[2]&",0;"&"1,4,"&RC[4]&",0;" -> 1,7,14092,0;1,4,180675,0; | S786: =INT(((50+RC[-17]/10)*35+200)*12/4) -> 14092 | U786: =1000*110/100*(1+(50+RC[-19]/10)/200)*100 -> 180675
B787: 786 | C787: 0 | D787: 400786 | E787: 1,7,9003,0;1,4,1532,0; | G787: 1 | H787: 7 | I787: 9003 | J787: 0 | L787: 1 | M787: 4 | N787: 1532 | O787: 0 | Q787: ="1,7,"&RC[2]&",0;"&"1,4,"&RC[4]&",0;" -> 1,7,14103,0;1,4,180730,0; | S787: =INT(((50+RC[-17]/10)*35+200)*12/4) -> 14103 | U787: =1000*110/100*(1+(50+RC[-19]/10)/200)*100 -> 180730
B788: 787 | C788: 0 | D788: 400787 | E788: 1,7,9013,0;1,4,1532,0; | G788: 1 | H788: 7 | I788: 9013 | J788: 0 | L788: 1 | M788: 4 | N788: 1532 | O788: 0 | Q788: ="1,7,"&RC[2]&",0;"&"1,4,"&RC[4]&",0;" -> 1,7,14113,0;1,4,180785,0; | S788: =INT(((50+RC[-17]/10)*35+200)*12/4) -> 14113 | U788: =1000*110/100*(1+(50+RC[-19]/10)/200)*100 -> 180785
B789: 788 | C789: 0 | D789: 400788 | E789: 1,7,9024,0;1,4,1533,0; | G789: 1 | H789: 7 | I789: 9024 | J789: 0 | L789: 1 | M789: 4 | N789: 1533 | O789: 0 | Q789: ="1,7,"&RC[2]&",0;"&"1,4,"&RC[4]&",0;" -> 1,7,14124,0;1,4,180840,0; | S789: =INT(((50+RC[-17]/10)*35+200)*12/4) -> 14124 | U789: =1000*110/100*(1+(50+RC[-19]/10)/200)*100 -> 180840
B790: 789 | C790: 0 | D790: 400789 | E790: 1,7,9034,0;1,4,1533,0; | G790: 1 | H790: 7 | I790: 9034 | J790: 0 | L790: 1 | M790: 4 | N790: 1533 | O790: 0 | Q790: ="1,7,"&RC[2]&",0;"&"1,4,"&RC[4]&",0;" -> 1,7,14134,0;1,4,180895,0; | S790: =INT(((50+RC[-17]/10)*35+200)*12/4) -> 14134 | U790: =1000*110/100*(1+(50+RC[-19]/10)/200)*100 -> 180895
B791: 790 | C791: 0 | D791: 400790 | E791: 1,7,9045,0;1,4,1534,0; | G791: 1 | H791: 7 | I791: 9045 | J791: 0 | L791: 1 | M791: 4 | N791: 1534 | O791: 0 | Q791: ="1,7,"&RC[2]&",0;"&"1,4,"&RC[4]&",0;" -> 1,7,14145,0;1,4,180950,0; | S791: =INT(((50+RC[-17]/10)*35+200)*12/4) -> 14145 | U791: =1000*110/100*(1+(50+RC[-19]/10)/200)*100 -> 180950
B792: 791 | C792: 0 | D792: 400791 | E792: 1,7,9055,0;1,4,1535,0; | G792: 1 | H792: 7 | I792: 9055 | J792: 0 | L792: 1 | M792: 4 | N792: 1535 | O792: 0 | Q792: ="1,7,"&RC[2]&",0;"&"1,4,"&RC[4]&",0;" -> 1,7,14155,0;1,4,181005,0; | S792: =INT(((50+RC[-17]/10)*35+200)*12/4) -> 14155 | U792: =1000*110/100*(1+(50+RC[-19]/10)/200)*100 -> 181005
B793: 792 | C793: 0 | D793: 400792 | E793: 1,7,9066,0;1,4,1535,0; | G793: 1 | H793: 7 | I793: 9066 | J793: 0 | L793: 1 | M793: 4 | N793: 1535 | O793: 0 | Q793: ="1,7,"&RC[2]&",0;"&"1,4,"&RC[4]&",0;" -> 1,7,14166,0;1,4,181060,0; | S793: =INT(((50+RC[-17]/10)*35+200)*12/4) -> 14166 | U793: =1000*110/100*(1+(50+RC[-19]/10)/200)*100 -> 181060
B794: 793 | C794: 0 | D794: 400793 | E794: 1,7,9076,0;1,4,1536,0; | G794: 1 | H794: 7 | I794: 9076 | J794: 0 | L794: 1 | M794: 4 | N794: 1536 | O794: 0 | Q794: ="1,7,"&RC[2]&",0;"&"1,4,"&RC[4]&",0;" -> 1,7,14176,0;1,4,181115,0; | S794: =INT(((50+RC[-17]/10)*35+200)*12/4) -> 14176 | U794: =1000*110/100*(1+(50+RC[-19]/10)/200)*100 -> 181115
B795: 794 | C795: 0 | D795: 400794 | E795: 1,7,9087,0;1,4,1536,0; | G795: 1 | H795: 7 | I795: 9087 | J795: 0 | L795: 1 | M795: 4 | N795: 1536 | O795: 0 | Q795: ="1,7,"&RC[2]&",0;"&"1,4,"&RC[4]&",0;" -> 1,7,14187,0;1,4,181170,0; | S795: =INT(((50+RC[-17]/10)*35+200)*12/4) -> 14187 | U795: =1000*110/100*(1+(50+RC[-19]/10)/200)*100 -> 181170
B796: 795 | C796: 0 | D796: 400795 | E796: 1,7,9097,0;1,4,1537,0; | G796: 1 | H796: 7 | I796: 9097 | J796: 0 | L796: 1 | M796: 4 | N796: 1537 | O796: 0 | Q796: ="1,7,"&RC[2]&",0;"&"1,4,"&RC[4]&",0;" -> 1,7,14197,0;1,4,181225,0; | S796: =INT(((50+RC[-17]/10)*35+200)*12/4) -> 14197 | U796: =1000*110/100*(1+(50+RC[-19]/10)/200)*100 -> 181225
B797: 796 | C797: 0 | D797: 400796 | E797: 1,7,9108,0;1,4,1537,0; | G797: 1 | H797: 7 | I797: 9108 | J797: 0 | L797: 1 | M797: 4 | N797: 1537 | O797: 0 | Q797: ="1,7,"&RC[2]&",0;"&"1,4,"&RC[4]&",0;" -> 1,7,14208,0;1,4,181280,0; | S797: =INT(((50+RC[-17]/10)*35+200)*12/4) -> 14208 | U797: =1000*110/100*(1+(50+RC[-19]/10)/200)*100 -> 181280.00000000003
B798: 797 | C798: 0 | D798: 400797 | E798: 1,7,9118,0;1,4,1538,0; | G798: 1 | H798: 7 | I798: 9118 | J798: 0 | L798: 1 | M798: 4 | N798: 1538 | O798: 0 | Q798: ="1,7,"&RC[2]&",0;"&"1,4,"&RC[4]&",0;" -> 1,7,14218,0;1,4,181335,0; | S798: =INT(((50+RC[-17]/10)*35+200)*12/4) -> 14218 | U798: =1000*110/100*(1+(50+RC[-19]/10)/200)*100 -> 181335
B799: 798 | C799: 0 | D799: 400798 | E799: 1,7,9129,0;1,4,1538,0; | G799: 1 | H799: 7 | I799: 9129 | J799: 0 | L799: 1 | M799: 4 | N799: 1538 | O799: 0 | Q799: ="1,7,"&RC[2]&",0;"&"1,4,"&RC[4]&",0;" -> 1,7,14229,0;1,4,181390,0; | S799: =INT(((50+RC[-17]/10)*35+200)*12/4) -> 14229 | U799: =1000*110/100*(1+(50+RC[-19]/10)/200)*100 -> 181390
B800: 799 | C800: 0 | D800: 400799 | E800: 1,7,9139,0;1,4,1539,0; | G800: 1 | H800: 7 | I800: 9139 | J800: 0 | L800: 1 | M800: 4 | N800: 1539 | O800: 0 | Q800: ="1,7,"&RC[2]&",0;"&"1,4,"&RC[4]&",0;" -> 1,7,14239,0;1,4,181445,0; | S800: =INT(((50+RC[-17]/10)*35+200)*12/4) -> 14239 | U800: =1000*110/100*(1+(50+RC[-19]/10)/200)*100 -> 181445.00000000003
B801: 800 | C801: 0 | D801: 400800 | E801: 1,7,9150,0;1,4,1540,0; | G801: 1 | H801: 7 | I801: 9150 | J801: 0 | L801: 1 | M801: 4 | N801: 1540 | O801: 0 | Q801: ="1,7,"&RC[2]&",0;"&"1,4,"&RC[4]&",0;" -> 1,7,14250,0;1,4,181500,0; | S801: =INT(((50+RC[-17]/10)*35+200)*12/4) -> 14250 | U801: =1000*110/100*(1+(50+RC[-19]/10)/200)*100 -> 181500
B802: 801 | C802: 0 | D802: 400801 | E802: 1,7,9160,0;1,4,1540,0; | G802: 1 | H802: 7 | I802: 9160 | J802: 0 | L802: 1 | M802: 4 | N802: 1540 | O802: 0 | Q802: ="1,7,"&RC[2]&",0;"&"1,4,"&RC[4]&",0;" -> 1,7,14260,0;1,4,181555,0; | S802: =INT(((50+RC[-17]/10)*35+200)*12/4) -> 14260 | U802: =1000*110/100*(1+(50+RC[-19]/10)/200)*100 -> 181555.00000000003
B803: 802 | C803: 0 | D803: 400802 | E803: 1,7,9171,0;1,4,1541,0; | G803: 1 | H803: 7 | I803: 9171 | J803: 0 | L803: 1 | M803: 4 | N803: 1541 | O803: 0 | Q803: ="1,7,"&RC[2]&",0;"&"1,4,"&RC[4]&",0;" -> 1,7,14271,0;1,4,181610,0; | S803: =INT(((50+RC[-17]/10)*35+200)*12/4) -> 14271 | U803: =1000*110/100*(1+(50+RC[-19]/10)/200)*100 -> 181609.99999999997
B804: 803 | C804: 0 | D804: 400803 | E804: 1,7,9181,0;1,4,1541,0; | G804: 1 | H804: 7 | I804: 9181 | J804: 0 | L804: 1 | M804: 4 | N804: 1541 | O804: 0 | Q804: ="1,7,"&RC[2]&",0;"&"1,4,"&RC[4]&",0;" -> 1,7,14281,0;1,4,181665,0; | S804: =INT(((50+RC[-17]/10)*35+200)*12/4) -> 14281 | U804: =1000*110/100*(1+(50+RC[-19]/10)/200)*100 -> 181665
B805: 804 | C805: 0 | D805: 400804 | E805: 1,7,9192,0;1,4,1542,0; | G805: 1 | H805: 7 | I805: 9192 | J805: 0 | L805: 1 | M805: 4 | N805: 1542 | O805: 0 | Q805: ="1,7,"&RC[2]&",0;"&"1,4,"&RC[4]&",0;" -> 1,7,14292,0;1,4,181720,0; | S805: =INT(((50+RC[-17]/10)*35+200)*12/4) -> 14292 | U805: =1000*110/100*(1+(50+RC[-19]/10)/200)*100 -> 181720
B806: 805 | C806: 0 | D806: 400805 | E806: 1,7,9202,0;1,4,1542,0; | G806: 1 | H806: 7 | I806: 9202 | J806: 0 | L806: 1 | M806: 4 | N806: 1542 | O806: 0 | Q806: ="1,7,"&RC[2]&",0;"&"1,4,"&RC[4]&",0;" -> 1,7,14302,0;1,4,181775,0; | S806: =INT(((50+RC[-17]/10)*35+200)*12/4) -> 14302 | U806: =1000*110/100*(1+(50+RC[-19]/10)/200)*100 -> 181774.99999999997
B807: 806 | C807: 0 | D807: 400806 | E807: 1,7,9213,0;1,4,1543,0; | G807: 1 | H807: 7 | I807: 9213 | J807: 0 | L807: 1 | M807: 4 | N807: 1543 | O807: 0 | Q807: ="1,7,"&RC[2]&",0;"&"1,4,"&RC[4]&",0;" -> 1,7,14313,0;1,4,181830,0; | S807: =INT(((50+RC[-17]/10)*35+200)*12/4) -> 14313 | U807: =1000*110/100*(1+(50+RC[-19]/10)/200)*100 -> 181830
B808: 807 | C808: 0 | D808: 400807 | E808: 1,7,9223,0;1,4,1543,0; | G808: 1 | H808: 7 | I808: 9223 | J808: 0 | L808: 1 | M808: 4 | N808: 1543 | O808: 0 | Q808: ="1,7,"&RC[2]&",0;"&"1,4,"&RC[4]&",0;" -> 1,7,14323,0;1,4,181885,0; | S808: =INT(((50+RC[-17]/10)*35+200)*12/4) -> 14323 | U808: =1000*110/100*(1+(50+RC[-19]/10)/200)*100 -> 181885
B809: 808 | C809: 0 | D809: 400808 | E809: 1,7,9234,0;1,4,1544,0; | G809: 1 | H809: 7 | I809: 9234 | J809: 0 | L809: 1 | M809: 4 | N809: 1544 | O809: 0 | Q809: ="1,7,"&RC[2]&",0;"&"1,4,"&RC[4]&",0;" -> 1,7,14334,0;1,4,181940,0; | S809: =INT(((50+RC[-17]/10)*35+200)*12/4) -> 14334 | U809: =1000*110/100*(1+(50+RC[-19]/10)/200)*100 -> 181940
B810: 809 | C810: 0 | D810: 400809 | E810: 1,7,9244,0;1,4,1544,0; | G810: 1 | H810: 7 | I810: 9244 | J810: 0 | L810: 1 | M810: 4 | N810: 1544 | O810: 0 | Q810: ="1,7,"&RC[2]&",0;"&"1,4,"&RC[4]&",0;" -> 1,7,14344,0;1,4,181995,0; | S810: =INT(((50+RC[-17]/10)*35+200)*12/4) -> 14344 | U810: =1000*110/100*(1+(50+RC[-19]/10)/200)*100 -> 181995
B811: 810 | C811: 0 | D811: 400810 | E811: 1,7,9255,0;1,4,1545,0; | G811: 1 | H811: 7 | I811: 9255 | J811: 0 | L811: 1 | M811: 4 | N811: 1545 | O811: 0 | Q811: ="1,7,"&RC[2]&",0;"&"1,4,"&RC[4]&",0;" -> 1,7,14355,0;1,4,182050,0; | S811: =INT(((50+RC[-17]/10)*35+200)*12/4) -> 14355 | U811: =1000*110/100*(1+(50+RC[-19]/10)/200)*100 -> 182050
B812: 811 | C812: 0 | D812: 400811 | E812: 1,7,9265,0;1,4,1546,0; | G812: 1 | H812: 7 | I812: 9265 | J812: 0 | L812: 1 | M812: 4 | N812: 1546 | O812: 0 | Q812: ="1,7,"&RC[2]&",0;"&"1,4,"&RC[4]&",0;" -> 1,7,14365,0;1,4,182105,0; | S812: =INT(((50+RC[-17]/10)*35+200)*12/4) -> 14365 | U812: =1000*110/100*(1+(50+RC[-19]/10)/200)*100 -> 182105
B813: 812 | C813: 0 | D813: 400812 | E813: 1,7,9276,0;1,4,1546,0; | G813: 1 | H813: 7 | I813: 9276 | J813: 0 | L813: 1 | M813: 4 | N813: 1546 | O813: 0 | Q813: ="1,7,"&RC[2]&",0;"&"1,4,"&RC[4]&",0;" -> 1,7,14376,0;1,4,182160,0; | S813: =INT(((50+RC[-17]/10)*35+200)*12/4) -> 14376 | U813: =1000*110/100*(1+(50+RC[-19]/10)/200)*100 -> 182160
B814: 813 | C814: 0 | D814: 400813 | E814: 1,7,9286,0;1,4,1547,0; | G814: 1 | H814: 7 | I814: 9286 | J814: 0 | L814: 1 | M814: 4 | N814: 1547 | O814: 0 | Q814: ="1,7,"&RC[2]&",0;"&"1,4,"&RC[4]&",0;" -> 1,7,14386,0;1,4,182215,0; | S814: =INT(((50+RC[-17]/10)*35+200)*12/4) -> 14386 | U814: =1000*110/100*(1+(50+RC[-19]/10)/200)*100 -> 182215
B815: 814 | C815: 0 | D815: 400814 | E815: 1,7,9297,0;1,4,1547,0; | G815: 1 | H815: 7 | I815: 9297 | J815: 0 | L815: 1 | M815: 4 | N815: 1547 | O815: 0 | Q815: ="1,7,"&RC[2]&",0;"&"1,4,"&RC[4]&",0;" -> 1,7,14397,0;1,4,182270,0; | S815: =INT(((50+RC[-17]/10)*35+200)*12/4) -> 14397 | U815: =1000*110/100*(1+(50+RC[-19]/10)/200)*100 -> 182270
B816: 815 | C816: 0 | D816: 400815 | E816: 1,7,9307,0;1,4,1548,0; | G816: 1 | H816: 7 | I816: 9307 | J816: 0 | L816: 1 | M816: 4 | N816: 1548 | O816: 0 | Q816: ="1,7,"&RC[2]&",0;"&"1,4,"&RC[4]&",0;" -> 1,7,14407,0;1,4,182325,0; | S816: =INT(((50+RC[-17]/10)*35+200)*12/4) -> 14407 | U816: =1000*110/100*(1+(50+RC[-19]/10)/200)*100 -> 182325
B817: 816 | C817: 0 | D817: 400816 | E817: 1,7,9318,0;1,4,1548,0; | G817: 1 | H817: 7 | I817: 9318 | J817: 0 | L817: 1 | M817: 4 | N817: 1548 | O817: 0 | Q817: ="1,7,"&RC[2]&",0;"&"1,4,"&RC[4]&",0;" -> 1,7,14418,0;1,4,182380,0; | S817: =INT(((50+RC[-17]/10)*35+200)*12/4) -> 14418 | U817: =1000*110/100*(1+(50+RC[-19]/10)/200)*100 -> 182380
B818: 817 | C818: 0 | D818: 400817 | E818: 1,7,9328,0;1,4,1549,0; | G818: 1 | H818: 7 | I818: 9328 | J818: 0 | L818: 1 | M818: 4 | N818: 1549 | O818: 0 | Q818: ="1,7,"&RC[2]&",0;"&"1,4,"&RC[4]&",0;" -> 1,7,14428,0;1,4,182435,0; | S818: =INT(((50+RC[-17]/10)*35+200)*12/4) -> 14428 | U818: =1000*110/100*(1+(50+RC[-19]/10)/200)*100 -> 182435
B819: 818 | C819: 0 | D819: 400818 | E819: 1,7,9339,0;1,4,1549,0; | G819: 1 | H819: 7 | I819: 9339 | J819: 0 | L819: 1 | M819: 4 | N819: 1549 | O819: 0 | Q819: ="1,7,"&RC[2]&",0;"&"1,4,"&RC[4]&",0;" -> 1,7,14439,0;1,4,182490,0; | S819: =INT(((50+RC[-17]/10)*35+200)*12/4) -> 14439 | U819: =1000*110/100*(1+(50+RC[-19]/10)/200)*100 -> 182490
B820: 819 | C820: 0 | D820: 400819 | E820: 1,7,9349,0;1,4,1550,0; | G820: 1 | H820: 7 | I820: 9349 | J820: 0 | L820: 1 | M820: 4 | N820: 1550 | O820: 0 | Q820: ="1,7,"&RC[2]&",0;"&"1,4,"&RC[4]&",0;" -> 1,7,14449,0;1,4,182545,0; | S820: =INT(((50+RC[-17]/10)*35+200)*12/4) -> 14449 | U820: =1000*110/100*(1+(50+RC[-19]/10)/200)*100 -> 182545
B821: 820 | C821: 0 | D821: 400820 | E821: 1,7,9360,0;1,4,1551,0; | G821: 1 | H821: 7 | I821: 9360 | J821: 0 | L821: 1 | M821: 4 | N821: 1551 | O821: 0 | Q821: ="1,7,"&RC[2]&",0;"&"1,4,"&RC[4]&",0;" -> 1,7,14460,0;1,4,182600,0; | S821: =INT(((50+RC[-17]/10)*35+200)*12/4) -> 14460 | U821: =1000*110/100*(1+(50+RC[-19]/10)/200)*100 -> 182600.00000000003
B822: 821 | C822: 0 | D822: 400821 | E822: 1,7,9370,0;1,4,1551,0; | G822: 1 | H822: 7 | I822: 9370 | J822: 0 | L822: 1 | M822: 4 | N822: 1551 | O822: 0 | Q822: ="1,7,"&RC[2]&",0;"&"1,4,"&RC[4]&",0;" -> 1,7,14470,0;1,4,182655,0; | S822: =INT(((50+RC[-17]/10)*35+200)*12/4) -> 14470 | U822: =1000*110/100*(1+(50+RC[-19]/10)/200)*100 -> 182655
B823: 822 | C823: 0 | D823: 400822 | E823: 1,7,9381,0;1,4,1552,0; | G823: 1 | H823: 7 | I823: 9381 | J823: 0 | L823: 1 | M823: 4 | N823: 1552 | O823: 0 | Q823: ="1,7,"&RC[2]&",0;"&"1,4,"&RC[4]&",0;" -> 1,7,14481,0;1,4,182710,0; | S823: =INT(((50+RC[-17]/10)*35+200)*12/4) -> 14481 | U823: =1000*110/100*(1+(50+RC[-19]/10)/200)*100 -> 182710
B824: 823 | C824: 0 | D824: 400823 | E824: 1,7,9391,0;1,4,1552,0; | G824: 1 | H824: 7 | I824: 9391 | J824: 0 | L824: 1 | M824: 4 | N824: 1552 | O824: 0 | Q824: ="1,7,"&RC[2]&",0;"&"1,4,"&RC[4]&",0;" -> 1,7,14491,0;1,4,182765,0; | S824: =INT(((50+RC[-17]/10)*35+200)*12/4) -> 14491 | U824: =1000*110/100*(1+(50+RC[-19]/10)/200)*100 -> 182765.00000000003
B825: 824 | C825: 0 | D825: 400824 | E825: 1,7,9402,0;1,4,1553,0; | G825: 1 | H825: 7 | I825: 9402 | J825: 0 | L825: 1 | M825: 4 | N825: 1553 | O825: 0 | Q825: ="1,7,"&RC[2]&",0;"&"1,4,"&RC[4]&",0;" -> 1,7,14502,0;1,4,182820,0; | S825: =INT(((50+RC[-17]/10)*35+200)*12/4) -> 14502 | U825: =1000*110/100*(1+(50+RC[-19]/10)/200)*100 -> 182819.99999999997
B826: 825 | C826: 0 | D826: 400825 | E826: 1,7,9412,0;1,4,1553,0; | G826: 1 | H826: 7 | I826: 9412 | J826: 0 | L826: 1 | M826: 4 | N826: 1553 | O826: 0 | Q826: ="1,7,"&RC[2]&",0;"&"1,4,"&RC[4]&",0;" -> 1,7,14512,0;1,4,182875,0; | S826: =INT(((50+RC[-17]/10)*35+200)*12/4) -> 14512 | U826: =1000*110/100*(1+(50+RC[-19]/10)/200)*100 -> 182875
B827: 826 | C827: 0 | D827: 400826 | E827: 1,7,9423,0;1,4,1554,0; | G827: 1 | H827: 7 | I827: 9423 | J827: 0 | L827: 1 | M827: 4 | N827: 1554 | O827: 0 | Q827: ="1,7,"&RC[2]&",0;"&"1,4,"&RC[4]&",0;" -> 1,7,14523,0;1,4,182930,0; | S827: =INT(((50+RC[-17]/10)*35+200)*12/4) -> 14523 | U827: =1000*110/100*(1+(50+RC[-19]/10)/200)*100 -> 182929.99999999997
B828: 827 | C828: 0 | D828: 400827 | E828: 1,7,9433,0;1,4,1554,0; | G828: 1 | H828: 7 | I828: 9433 | J828: 0 | L828: 1 | M828: 4 | N828: 1554 | O828: 0 | Q828: ="1,7,"&RC[2]&",0;"&"1,4,"&RC[4]&",0;" -> 1,7,14533,0;1,4,182985,0; | S828: =INT(((50+RC[-17]/10)*35+200)*12/4) -> 14533 | U828: =1000*110/100*(1+(50+RC[-19]/10)/200)*100 -> 182985
B829: 828 | C829: 0 | D829: 400828 | E829: 1,7,9444,0;1,4,1555,0; | G829: 1 | H829: 7 | I829: 9444 | J829: 0 | L829: 1 | M829: 4 | N829: 1555 | O829: 0 | Q829: ="1,7,"&RC[2]&",0;"&"1,4,"&RC[4]&",0;" -> 1,7,14544,0;1,4,183040,0; | S829: =INT(((50+RC[-17]/10)*35+200)*12/4) -> 14544 | U829: =1000*110/100*(1+(50+RC[-19]/10)/200)*100 -> 183040
B830: 829 | C830: 0 | D830: 400829 | E830: 1,7,9454,0;1,4,1555,0; | G830: 1 | H830: 7 | I830: 9454 | J830: 0 | L830: 1 | M830: 4 | N830: 1555 | O830: 0 | Q830: ="1,7,"&RC[2]&",0;"&"1,4,"&RC[4]&",0;" -> 1,7,14554,0;1,4,183095,0; | S830: =INT(((50+RC[-17]/10)*35+200)*12/4) -> 14554 | U830: =1000*110/100*(1+(50+RC[-19]/10)/200)*100 -> 183094.99999999997
B831: 830 | C831: 0 | D831: 400830 | E831: 1,7,9465,0;1,4,1556,0; | G831: 1 | H831: 7 | I831: 9465 | J831: 0 | L831: 1 | M831: 4 | N831: 1556 | O831: 0 | Q831: ="1,7,"&RC[2]&",0;"&"1,4,"&RC[4]&",0;" -> 1,7,14565,0;1,4,183150,0; | S831: =INT(((50+RC[-17]/10)*35+200)*12/4) -> 14565 | U831: =1000*110/100*(1+(50+RC[-19]/10)/200)*100 -> 183150
B832: 831 | C832: 0 | D832: 400831 | E832: 1,7,9475,0;1,4,1557,0; | G832: 1 | H832: 7 | I832: 9475 | J832: 0 | L832: 1 | M832: 4 | N832: 1557 | O832: 0 | Q832: ="1,7,"&RC[2]&",0;"&"1,4,"&RC[4]&",0;" -> 1,7,14575,0;1,4,183205,0; | S832: =INT(((50+RC[-17]/10)*35+200)*12/4) -> 14575 | U832: =1000*110/100*(1+(50+RC[-19]/10)/200)*100 -> 183205
B833: 832 | C833: 0 | D833: 400832 | E833: 1,7,9486,0;1,4,1557,0; | G833: 1 | H833: 7 | I833: 9486 | J833: 0 | L833: 1 | M833: 4 | N833: 1557 | O833: 0 | Q833: ="1,7,"&RC[2]&",0;"&"1,4,"&RC[4]&",0;" -> 1,7,14586,0;1,4,183260,0; | S833: =INT(((50+RC[-17]/10)*35+200)*12/4) -> 14586 | U833: =1000*110/100*(1+(50+RC[-19]/10)/200)*100 -> 183260
B834: 833 | C834: 0 | D834: 400833 | E834: 1,7,9496,0;1,4,1558,0; | G834: 1 | H834: 7 | I834: 9496 | J834: 0 | L834: 1 | M834: 4 | N834: 1558 | O834: 0 | Q834: ="1,7,"&RC[2]&",0;"&"1,4,"&RC[4]&",0;" -> 1,7,14596,0;1,4,183315,0; | S834: =INT(((50+RC[-17]/10)*35+200)*12/4) -> 14596 | U834: =1000*110/100*(1+(50+RC[-19]/10)/200)*100 -> 183315
B835: 834 | C835: 0 | D835: 400834 | E835: 1,7,9507,0;1,4,1558,0; | G835: 1 | H835: 7 | I835: 9507 | J835: 0 | L835: 1 | M835: 4 | N835: 1558 | O835: 0 | Q835: ="1,7,"&RC[2]&",0;"&"1,4,"&RC[4]&",0;" -> 1,7,14607,0;1,4,183370,0; | S835: =INT(((50+RC[-17]/10)*35+200)*12/4) -> 14607 | U835: =1000*110/100*(1+(50+RC[-19]/10)/200)*100 -> 183370
B836: 835 | C836: 0 | D836: 400835 | E836: 1,7,9517,0;1,4,1559,0; | G836: 1 | H836: 7 | I836: 9517 | J836: 0 | L836: 1 | M836: 4 | N836: 1559 | O836: 0 | Q836: ="1,7,"&RC[2]&",0;"&"1,4,"&RC[4]&",0;" -> 1,7,14617,0;1,4,183425,0; | S836: =INT(((50+RC[-17]/10)*35+200)*12/4) -> 14617 | U836: =1000*110/100*(1+(50+RC[-19]/10)/200)*100 -> 183425
B837: 836 | C837: 0 | D837: 400836 | E837: 1,7,9528,0;1,4,1559,0; | G837: 1 | H837: 7 | I837: 9528 | J837: 0 | L837: 1 | M837: 4 | N837: 1559 | O837: 0 | Q837: ="1,7,"&RC[2]&",0;"&"1,4,"&RC[4]&",0;" -> 1,7,14628,0;1,4,183480,0; | S837: =INT(((50+RC[-17]/10)*35+200)*12/4) -> 14628 | U837: =1000*110/100*(1+(50+RC[-19]/10)/200)*100 -> 183480
B838: 837 | C838: 0 | D838: 400837 | E838: 1,7,9538,0;1,4,1560,0; | G838: 1 | H838: 7 | I838: 9538 | J838: 0 | L838: 1 | M838: 4 | N838: 1560 | O838: 0 | Q838: ="1,7,"&RC[2]&",0;"&"1,4,"&RC[4]&",0;" -> 1,7,14638,0;1,4,183535,0; | S838: =INT(((50+RC[-17]/10)*35+200)*12/4) -> 14638 | U838: =1000*110/100*(1+(50+RC[-19]/10)/200)*100 -> 183535
B839: 838 | C839: 0 | D839: 400838 | E839: 1,7,9549,0;1,4,1560,0; | G839: 1 | H839: 7 | I839: 9549 | J839: 0 | L839: 1 | M839: 4 | N839: 1560 | O839: 0 | Q839: ="1,7,"&RC[2]&",0;"&"1,4,"&RC[4]&",0;" -> 1,7,14649,0;1,4,183590,0; | S839: =INT(((50+RC[-17]/10)*35+200)*12/4) -> 14649 | U839: =1000*110/100*(1+(50+RC[-19]/10)/200)*100 -> 183590
B840: 839 | C840: 0 | D840: 400839 | E840: 1,7,9559,0;1,4,1561,0; | G840: 1 | H840: 7 | I840: 9559 | J840: 0 | L840: 1 | M840: 4 | N840: 1561 | O840: 0 | Q840: ="1,7,"&RC[2]&",0;"&"1,4,"&RC[4]&",0;" -> 1,7,14659,0;1,4,183645,0; | S840: =INT(((50+RC[-17]/10)*35+200)*12/4) -> 14659 | U840: =1000*110/100*(1+(50+RC[-19]/10)/200)*100 -> 183645
B841: 840 | C841: 0 | D841: 400840 | E841: 1,7,9570,0;1,4,1562,0; | G841: 1 | H841: 7 | I841: 9570 | J841: 0 | L841: 1 | M841: 4 | N841: 1562 | O841: 0 | Q841: ="1,7,"&RC[2]&",0;"&"1,4,"&RC[4]&",0;" -> 1,7,14670,0;1,4,183700,0; | S841: =INT(((50+RC[-17]/10)*35+200)*12/4) -> 14670 | U841: =1000*110/100*(1+(50+RC[-19]/10)/200)*100 -> 183700
B842: 841 | C842: 0 | D842: 400841 | E842: 1,7,9580,0;1,4,1562,0; | G842: 1 | H842: 7 | I842: 9580 | J842: 0 | L842: 1 | M842: 4 | N842: 1562 | O842: 0 | Q842: ="1,7,"&RC[2]&",0;"&"1,4,"&RC[4]&",0;" -> 1,7,14680,0;1,4,183755,0; | S842: =INT(((50+RC[-17]/10)*35+200)*12/4) -> 14680 | U842: =1000*110/100*(1+(50+RC[-19]/10)/200)*100 -> 183755.00000000003
B843: 842 | C843: 0 | D843: 400842 | E843: 1,7,9591,0;1,4,1563,0; | G843: 1 | H843: 7 | I843: 9591 | J843: 0 | L843: 1 | M843: 4 | N843: 1563 | O843: 0 | Q843: ="1,7,"&RC[2]&",0;"&"1,4,"&RC[4]&",0;" -> 1,7,14691,0;1,4,183810,0; | S843: =INT(((50+RC[-17]/10)*35+200)*12/4) -> 14691 | U843: =1000*110/100*(1+(50+RC[-19]/10)/200)*100 -> 183810
B844: 843 | C844: 0 | D844: 400843 | E844: 1,7,9601,0;1,4,1563,0; | G844: 1 | H844: 7 | I844: 9601 | J844: 0 | L844: 1 | M844: 4 | N844: 1563 | O844: 0 | Q844: ="1,7,"&RC[2]&",0;"&"1,4,"&RC[4]&",0;" -> 1,7,14701,0;1,4,183865,0; | S844: =INT(((50+RC[-17]/10)*35+200)*12/4) -> 14701 | U844: =1000*110/100*(1+(50+RC[-19]/10)/200)*100 -> 183865
B845: 844 | C845: 0 | D845: 400844 | E845: 1,7,9612,0;1,4,1564,0; | G845: 1 | H845: 7 | I845: 9612 | J845: 0 | L845: 1 | M845: 4 | N845: 1564 | O845: 0 | Q845: ="1,7,"&RC[2]&",0;"&"1,4,"&RC[4]&",0;" -> 1,7,14712,0;1,4,183920,0; | S845: =INT(((50+RC[-17]/10)*35+200)*12/4) -> 14712 | U845: =1000*110/100*(1+(50+RC[-19]/10)/200)*100 -> 183920.00000000003
B846: 845 | C846: 0 | D846: 400845 | E846: 1,7,9622,0;1,4,1564,0; | G846: 1 | H846: 7 | I846: 9622 | J846: 0 | L846: 1 | M846: 4 | N846: 1564 | O846: 0 | Q846: ="1,7,"&RC[2]&",0;"&"1,4,"&RC[4]&",0;" -> 1,7,14722,0;1,4,183975,0; | S846: =INT(((50+RC[-17]/10)*35+200)*12/4) -> 14722 | U846: =1000*110/100*(1+(50+RC[-19]/10)/200)*100 -> 183974.99999999997
B847: 846 | C847: 0 | D847: 400846 | E847: 1,7,9633,0;1,4,1565,0; | G847: 1 | H847: 7 | I847: 9633 | J847: 0 | L847: 1 | M847: 4 | N847: 1565 | O847: 0 | Q847: ="1,7,"&RC[2]&",0;"&"1,4,"&RC[4]&",0;" -> 1,7,14733,0;1,4,184030,0; | S847: =INT(((50+RC[-17]/10)*35+200)*12/4) -> 14733 | U847: =1000*110/100*(1+(50+RC[-19]/10)/200)*100 -> 184030
B848: 847 | C848: 0 | D848: 400847 | E848: 1,7,9643,0;1,4,1565,0; | G848: 1 | H848: 7 | I848: 9643 | J848: 0 | L848: 1 | M848: 4 | N848: 1565 | O848: 0 | Q848: ="1,7,"&RC[2]&",0;"&"1,4,"&RC[4]&",0;" -> 1,7,14743,0;1,4,184085,0; | S848: =INT(((50+RC[-17]/10)*35+200)*12/4) -> 14743 | U848: =1000*110/100*(1+(50+RC[-19]/10)/200)*100 -> 184085
B849: 848 | C849: 0 | D849: 400848 | E849: 1,7,9654,0;1,4,1566,0; | G849: 1 | H849: 7 | I849: 9654 | J849: 0 | L849: 1 | M849: 4 | N849: 1566 | O849: 0 | Q849: ="1,7,"&RC[2]&",0;"&"1,4,"&RC[4]&",0;" -> 1,7,14754,0;1,4,184140,0; | S849: =INT(((50+RC[-17]/10)*35+200)*12/4) -> 14754 | U849: =1000*110/100*(1+(50+RC[-19]/10)/200)*100 -> 184140
B850: 849 | C850: 0 | D850: 400849 | E850: 1,7,9664,0;1,4,1566,0; | G850: 1 | H850: 7 | I850: 9664 | J850: 0 | L850: 1 | M850: 4 | N850: 1566 | O850: 0 | Q850: ="1,7,"&RC[2]&",0;"&"1,4,"&RC[4]&",0;" -> 1,7,14764,0;1,4,184195,0; | S850: =INT(((50+RC[-17]/10)*35+200)*12/4) -> 14764 | U850: =1000*110/100*(1+(50+RC[-19]/10)/200)*100 -> 184195
B851: 850 | C851: 0 | D851: 400850 | E851: 1,7,9675,0;1,4,1567,0; | G851: 1 | H851: 7 | I851: 9675 | J851: 0 | L851: 1 | M851: 4 | N851: 1567 | O851: 0 | Q851: ="1,7,"&RC[2]&",0;"&"1,4,"&RC[4]&",0;" -> 1,7,14775,0;1,4,184250,0; | S851: =INT(((50+RC[-17]/10)*35+200)*12/4) -> 14775 | U851: =1000*110/100*(1+(50+RC[-19]/10)/200)*100 -> 184250
B852: 851 | C852: 0 | D852: 400851 | E852: 1,7,9685,0;1,4,1568,0; | G852: 1 | H852: 7 | I852: 9685 | J852: 0 | L852: 1 | M852: 4 | N852: 1568 | O852: 0 | Q852: ="1,7,"&RC[2]&",0;"&"1,4,"&RC[4]&",0;" -> 1,7,14785,0;1,4,184305,0; | S852: =INT(((50+RC[-17]/10)*35+200)*12/4) -> 14785 | U852: =1000*110/100*(1+(50+RC[-19]/10)/200)*100 -> 184305
B853: 852 | C853: 0 | D853: 400852 | E853: 1,7,9696,0;1,4,1568,0; | G853: 1 | H853: 7 | I853: 9696 | J853: 0 | L853: 1 | M853: 4 | N853: 1568 | O853: 0 | Q853: ="1,7,"&RC[2]&",0;"&"1,4,"&RC[4]&",0;" -> 1,7,14796,0;1,4,184360,0; | S853: =INT(((50+RC[-17]/10)*35+200)*12/4) -> 14796 | U853: =1000*110/100*(1+(50+RC[-19]/10)/200)*100 -> 184360
B854: 853 | C854: 0 | D854: 400853 | E854: 1,7,9706,0;1,4,1569,0; | G854: 1 | H854: 7 | I854: 9706 | J854: 0 | L854: 1 | M854: 4 | N854: 1569 | O854: 0 | Q854: ="1,7,"&RC[2]&",0;"&"1,4,"&RC[4]&",0;" -> 1,7,14806,0;1,4,184415,0; | S854: =INT(((50+RC[-17]/10)*35+200)*12/4) -> 14806 | U854: =1000*110/100*(1+(50+RC[-19]/10)/200)*100 -> 184415
B855: 854 | C855: 0 | D855: 400854 | E855: 1,7,9717,0;1,4,1569,0; | G855: 1 | H855: 7 | I855: 9717 | J855: 0 | L855: 1 | M855: 4 | N855: 1569 | O855: 0 | Q855: ="1,7,"&RC[2]&",0;"&"1,4,"&RC[4]&",0;" -> 1,7,14817,0;1,4,184470,0; | S855: =INT(((50+RC[-17]/10)*35+200)*12/4) -> 14817 | U855: =1000*110/100*(1+(50+RC[-19]/10)/200)*100 -> 184470
B856: 855 | C856: 0 | D856: 400855 | E856: 1,7,9727,0;1,4,1570,0; | G856: 1 | H856: 7 | I856: 9727 | J856: 0 | L856: 1 | M856: 4 | N856: 1570 | O856: 0 | Q856: ="1,7,"&RC[2]&",0;"&"1,4,"&RC[4]&",0;" -> 1,7,14827,0;1,4,184525,0; | S856: =INT(((50+RC[-17]/10)*35+200)*12/4) -> 14827 | U856: =1000*110/100*(1+(50+RC[-19]/10)/200)*100 -> 184525
B857: 856 | C857: 0 | D857: 400856 | E857: 1,7,9738,0;1,4,1570,0; | G857: 1 | H857: 7 | I857: 9738 | J857: 0 | L857: 1 | M857: 4 | N857: 1570 | O857: 0 | Q857: ="1,7,"&RC[2]&",0;"&"1,4,"&RC[4]&",0;" -> 1,7,14838,0;1,4,184580,0; | S857: =INT(((50+RC[-17]/10)*35+200)*12/4) -> 14838 | U857: =1000*110/100*(1+(50+RC[-19]/10)/200)*100 -> 184580
B858: 857 | C858: 0 | D858: 400857 | E858: 1,7,9748,0;1,4,1571,0; | G858: 1 | H858: 7 | I858: 9748 | J858: 0 | L858: 1 | M858: 4 | N858: 1571 | O858: 0 | Q858: ="1,7,"&RC[2]&",0;"&"1,4,"&RC[4]&",0;" -> 1,7,14848,0;1,4,184635,0; | S858: =INT(((50+RC[-17]/10)*35+200)*12/4) -> 14848 | U858: =1000*110/100*(1+(50+RC[-19]/10)/200)*100 -> 184635
B859: 858 | C859: 0 | D859: 400858 | E859: 1,7,9759,0;1,4,1571,0; | G859: 1 | H859: 7 | I859: 9759 | J859: 0 | L859: 1 | M859: 4 | N859: 1571 | O859: 0 | Q859: ="1,7,"&RC[2]&",0;"&"1,4,"&RC[4]&",0;" -> 1,7,14859,0;1,4,184690,0; | S859: =INT(((50+RC[-17]/10)*35+200)*12/4) -> 14859 | U859: =1000*110/100*(1+(50+RC[-19]/10)/200)*100 -> 184690
B860: 859 | C860: 0 | D860: 400859 | E860: 1,7,9769,0;1,4,1572,0; | G860: 1 | H860: 7 | I860: 9769 | J860: 0 | L860: 1 | M860: 4 | N860: 1572 | O860: 0 | Q860: ="1,7,"&RC[2]&",0;"&"1,4,"&RC[4]&",0;" -> 1,7,14869,0;1,4,184745,0; | S860: =INT(((50+RC[-17]/10)*35+200)*12/4) -> 14869 | U860: =1000*110/100*(1+(50+RC[-19]/10)/200)*100 -> 184745
B861: 860 | C861: 0 | D861: 400860 | E861: 1,7,9780,0;1,4,1573,0; | G861: 1 | H861: 7 | I861: 9780 | J861: 0 | L861: 1 | M861: 4 | N861: 1573 | O861: 0 | Q861: ="1,7,"&RC[2]&",0;"&"1,4,"&RC[4]&",0;" -> 1,7,14880,0;1,4,184800,0; | S861: =INT(((50+RC[-17]/10)*35+200)*12/4) -> 14880 | U861: =1000*110/100*(1+(50+RC[-19]/10)/200)*100 -> 184800.00000000003
B862: 861 | C862: 0 | D862: 400861 | E862: 1,7,9790,0;1,4,1573,0; | G862: 1 | H862: 7 | I862: 9790 | J862: 0 | L862: 1 | M862: 4 | N862: 1573 | O862: 0 | Q862: ="1,7,"&RC[2]&",0;"&"1,4,"&RC[4]&",0;" -> 1,7,14890,0;1,4,184855,0; | S862: =INT(((50+RC[-17]/10)*35+200)*12/4) -> 14890 | U862: =1000*110/100*(1+(50+RC[-19]/10)/200)*100 -> 184855
B863: 862 | C863: 0 | D863: 400862 | E863: 1,7,9801,0;1,4,1574,0; | G863: 1 | H863: 7 | I863: 9801 | J863: 0 | L863: 1 | M863: 4 | N863: 1574 | O863: 0 | Q863: ="1,7,"&RC[2]&",0;"&"1,4,"&RC[4]&",0;" -> 1,7,14901,0;1,4,184910,0; | S863: =INT(((50+RC[-17]/10)*35+200)*12/4) -> 14901 | U863: =1000*110/100*(1+(50+RC[-19]/10)/200)*100 -> 184910
B864: 863 | C864: 0 | D864: 400863 | E864: 1,7,9811,0;1,4,1574,0; | G864: 1 | H864: 7 | I864: 9811 | J864: 0 | L864: 1 | M864: 4 | N864: 1574 | O864: 0 | Q864: ="1,7,"&RC[2]&",0;"&"1,4,"&RC[4]&",0;" -> 1,7,14911,0;1,4,184965,0; | S864: =INT(((50+RC[-17]/10)*35+200)*12/4) -> 14911 | U864: =1000*110/100*(1+(50+RC[-19]/10)/200)*100 -> 184965.00000000003
B865: 864 | C865: 0 | D865: 400864 | E865: 1,7,9822,0;1,4,1575,0; | G865: 1 | H865: 7 | I865: 9822 | J865: 0 | L865: 1 | M865: 4 | N865: 1575 | O865: 0 | Q865: ="1,7,"&RC[2]&",0;"&"1,4,"&RC[4]&",0;" -> 1,7,14922,0;1,4,185020,0; | S865: =INT(((50+RC[-17]/10)*35+200)*12/4) -> 14922 | U865: =1000*110/100*(1+(50+RC[-19]/10)/200)*100 -> 185020
B866: 865 | C866: 0 | D866: 400865 | E866: 1,7,9832,0;1,4,1575,0; | G866: 1 | H866: 7 | I866: 9832 | J866: 0 | L866: 1 | M866: 4 | N866: 1575 | O866: 0 | Q866: ="1,7,"&RC[2]&",0;"&"1,4,"&RC[4]&",0;" -> 1,7,14932,0;1,4,185075,0; | S866: =INT(((50+RC[-17]/10)*35+200)*12/4) -> 14932 | U866: =1000*110/100*(1+(50+RC[-19]/10)/200)*100 -> 185075.00000000003
B867: 866 | C867: 0 | D867: 400866 | E867: 1,7,9843,0;1,4,1576,0; | G867: 1 | H867: 7 | I867: 9843 | J867: 0 | L867: 1 | M867: 4 | N867: 1576 | O867: 0 | Q867: ="1,7,"&RC[2]&",0;"&"1,4,"&RC[4]&",0;" -> 1,7,14943,0;1,4,185130,0; | S867: =INT(((50+RC[-17]/10)*35+200)*12/4) -> 14943 | U867: =1000*110/100*(1+(50+RC[-19]/10)/200)*100 -> 185129.99999999997
B868: 867 | C868: 0 | D868: 400867 | E868: 1,7,9853,0;1,4,1576,0; | G868: 1 | H868: 7 | I868: 9853 | J868: 0 | L868: 1 | M868: 4 | N868: 1576 | O868: 0 | Q868: ="1,7,"&RC[2]&",0;"&"1,4,"&RC[4]&",0;" -> 1,7,14953,0;1,4,185185,0; | S868: =INT(((50+RC[-17]/10)*35+200)*12/4) -> 14953 | U868: =1000*110/100*(1+(50+RC[-19]/10)/200)*100 -> 185185
B869: 868 | C869: 0 | D869: 400868 | E869: 1,7,9864,0;1,4,1577,0; | G869: 1 | H869: 7 | I869: 9864 | J869: 0 | L869: 1 | M869: 4 | N869: 1577 | O869: 0 | Q869: ="1,7,"&RC[2]&",0;"&"1,4,"&RC[4]&",0;" -> 1,7,14964,0;1,4,185240,0; | S869: =INT(((50+RC[-17]/10)*35+200)*12/4) -> 14964 | U869: =1000*110/100*(1+(50+RC[-19]/10)/200)*100 -> 185240
B870: 869 | C870: 0 | D870: 400869 | E870: 1,7,9874,0;1,4,1577,0; | G870: 1 | H870: 7 | I870: 9874 | J870: 0 | L870: 1 | M870: 4 | N870: 1577 | O870: 0 | Q870: ="1,7,"&RC[2]&",0;"&"1,4,"&RC[4]&",0;" -> 1,7,14974,0;1,4,185295,0; | S870: =INT(((50+RC[-17]/10)*35+200)*12/4) -> 14974 | U870: =1000*110/100*(1+(50+RC[-19]/10)/200)*100 -> 185294.99999999997
B871: 870 | C871: 0 | D871: 400870 | E871: 1,7,9885,0;1,4,1578,0; | G871: 1 | H871: 7 | I871: 9885 | J871: 0 | L871: 1 | M871: 4 | N871: 1578 | O871: 0 | Q871: ="1,7,"&RC[2]&",0;"&"1,4,"&RC[4]&",0;" -> 1,7,14985,0;1,4,185350,0; | S871: =INT(((50+RC[-17]/10)*35+200)*12/4) -> 14985 | U871: =1000*110/100*(1+(50+RC[-19]/10)/200)*100 -> 185350
B872: 871 | C872: 0 | D872: 400871 | E872: 1,7,9895,0;1,4,1579,0; | G872: 1 | H872: 7 | I872: 9895 | J872: 0 | L872: 1 | M872: 4 | N872: 1579 | O872: 0 | Q872: ="1,7,"&RC[2]&",0;"&"1,4,"&RC[4]&",0;" -> 1,7,14995,0;1,4,185405,0; | S872: =INT(((50+RC[-17]/10)*35+200)*12/4) -> 14995 | U872: =1000*110/100*(1+(50+RC[-19]/10)/200)*100 -> 185405
B873: 872 | C873: 0 | D873: 400872 | E873: 1,7,9906,0;1,4,1579,0; | G873: 1 | H873: 7 | I873: 9906 | J873: 0 | L873: 1 | M873: 4 | N873: 1579 | O873: 0 | Q873: ="1,7,"&RC[2]&",0;"&"1,4,"&RC[4]&",0;" -> 1,7,15006,0;1,4,185460,0; | S873: =INT(((50+RC[-17]/10)*35+200)*12/4) -> 15006 | U873: =1000*110/100*(1+(50+RC[-19]/10)/200)*100 -> 185460
B874: 873 | C874: 0 | D874: 400873 | E874: 1,7,9916,0;1,4,1580,0; | G874: 1 | H874: 7 | I874: 9916 | J874: 0 | L874: 1 | M874: 4 | N874: 1580 | O874: 0 | Q874: ="1,7,"&RC[2]&",0;"&"1,4,"&RC[4]&",0;" -> 1,7,15016,0;1,4,185515,0; | S874: =INT(((50+RC[-17]/10)*35+200)*12/4) -> 15016 | U874: =1000*110/100*(1+(50+RC[-19]/10)/200)*100 -> 185515
B875: 874 | C875: 0 | D875: 400874 | E875: 1,7,9927,0;1,4,1580,0; | G875: 1 | H875: 7 | I875: 9927 | J875: 0 | L875: 1 | M875: 4 | N875: 1580 | O875: 0 | Q875: ="1,7,"&RC[2]&",0;"&"1,4,"&RC[4]&",0;" -> 1,7,15027,0;1,4,185570,0; | S875: =INT(((50+RC[-17]/10)*35+200)*12/4) -> 15027 | U875: =1000*110/100*(1+(50+RC[-19]/10)/200)*100 -> 185570
B876: 875 | C876: 0 | D876: 400875 | E876: 1,7,9937,0;1,4,1581,0; | G876: 1 | H876: 7 | I876: 9937 | J876: 0 | L876: 1 | M876: 4 | N876: 1581 | O876: 0 | Q876: ="1,7,"&RC[2]&",0;"&"1,4,"&RC[4]&",0;" -> 1,7,15037,0;1,4,185625,0; | S876: =INT(((50+RC[-17]/10)*35+200)*12/4) -> 15037 | U876: =1000*110/100*(1+(50+RC[-19]/10)/200)*100 -> 185625
B877: 876 | C877: 0 | D877: 400876 | E877: 1,7,9948,0;1,4,1581,0; | G877: 1 | H877: 7 | I877: 9948 | J877: 0 | L877: 1 | M877: 4 | N877: 1581 | O877: 0 | Q877: ="1,7,"&RC[2]&",0;"&"1,4,"&RC[4]&",0;" -> 1,7,15048,0;1,4,185680,0; | S877: =INT(((50+RC[-17]/10)*35+200)*12/4) -> 15048 | U877: =1000*110/100*(1+(50+RC[-19]/10)/200)*100 -> 185680
B878: 877 | C878: 0 | D878: 400877 | E878: 1,7,9958,0;1,4,1582,0; | G878: 1 | H878: 7 | I878: 9958 | J878: 0 | L878: 1 | M878: 4 | N878: 1582 | O878: 0 | Q878: ="1,7,"&RC[2]&",0;"&"1,4,"&RC[4]&",0;" -> 1,7,15058,0;1,4,185735,0; | S878: =INT(((50+RC[-17]/10)*35+200)*12/4) -> 15058 | U878: =1000*110/100*(1+(50+RC[-19]/10)/200)*100 -> 185735
B879: 878 | C879: 0 | D879: 400878 | E879: 1,7,9969,0;1,4,1582,0; | G879: 1 | H879: 7 | I879: 9969 | J879: 0 | L879: 1 | M879: 4 | N879: 1582 | O879: 0 | Q879: ="1,7,"&RC[2]&",0;"&"1,4,"&RC[4]&",0;" -> 1,7,15069,0;1,4,185790,0; | S879: =INT(((50+RC[-17]/10)*35+200)*12/4) -> 15069 | U879: =1000*110/100*(1+(50+RC[-19]/10)/200)*100 -> 185790
B880: 879 | C880: 0 | D880: 400879 | E880: 1,7,9979,0;1,4,1583,0; | G880: 1 | H880: 7 | I880: 9979 | J880: 0 | L880: 1 | M880: 4 | N880: 1583 | O880: 0 | Q880: ="1,7,"&RC[2]&",0;"&"1,4,"&RC[4]&",0;" -> 1,7,15079,0;1,4,185845,0; | S880: =INT(((50+RC[-17]/10)*35+200)*12/4) -> 15079 | U880: =1000*110/100*(1+(50+RC[-19]/10)/200)*100 -> 185845
B881: 880 | C881: 0 | D881: 400880 | E881: 1,7,9990,0;1,4,1584,0; | G881: 1 | H881: 7 | I881: 9990 | J881: 0 | L881: 1 | M881: 4 | N881: 1584 | O881: 0 | Q881: ="1,7,"&RC[2]&",0;"&"1,4,"&RC[4]&",0;" -> 1,7,15090,0;1,4,185900,0; | S881: =INT(((50+RC[-17]/10)*35+200)*12/4) -> 15090 | U881: =1000*110/100*(1+(50+RC[-19]/10)/200)*100 -> 185900
B882: 881 | C882: 0 | D882: 400881 | E882: 1,7,10000,0;1,4,1584,0; | G882: 1 | H882: 7 | I882: 10000 | J882: 0 | L882: 1 | M882: 4 | N882: 1584 | O882: 0 | Q882: ="1,7,"&RC[2]&",0;"&"1,4,"&RC[4]&",0;" -> 1,7,15100,0;1,4,185955,0; | S882: =INT(((50+RC[-17]/10)*35+200)*12/4) -> 15100 | U882: =1000*110/100*(1+(50+RC[-19]/10)/200)*100 -> 185955.00000000003
B883: 882 | C883: 0 | D883: 400882 | E883: 1,7,10011,0;1,4,1585,0; | G883: 1 | H883: 7 | I883: 10011 | J883: 0 | L883: 1 | M883: 4 | N883: 1585 | O883: 0 | Q883: ="1,7,"&RC[2]&",0;"&"1,4,"&RC[4]&",0;" -> 1,7,15111,0;1,4,186010,0; | S883: =INT(((50+RC[-17]/10)*35+200)*12/4) -> 15111 | U883: =1000*110/100*(1+(50+RC[-19]/10)/200)*100 -> 186010
B884: 883 | C884: 0 | D884: 400883 | E884: 1,7,10021,0;1,4,1585,0; | G884: 1 | H884: 7 | I884: 10021 | J884: 0 | L884: 1 | M884: 4 | N884: 1585 | O884: 0 | Q884: ="1,7,"&RC[2]&",0;"&"1,4,"&RC[4]&",0;" -> 1,7,15121,0;1,4,186065,0; | S884: =INT(((50+RC[-17]/10)*35+200)*12/4) -> 15121 | U884: =1000*110/100*(1+(50+RC[-19]/10)/200)*100 -> 186065
B885: 884 | C885: 0 | D885: 400884 | E885: 1,7,10032,0;1,4,1586,0; | G885: 1 | H885: 7 | I885: 10032 | J885: 0 | L885: 1 | M885: 4 | N885: 1586 | O885: 0 | Q885: ="1,7,"&RC[2]&",0;"&"1,4,"&RC[4]&",0;" -> 1,7,15132,0;1,4,186120,0; | S885: =INT(((50+RC[-17]/10)*35+200)*12/4) -> 15132 | U885: =1000*110/100*(1+(50+RC[-19]/10)/200)*100 -> 186120.00000000003
B886: 885 | C886: 0 | D886: 400885 | E886: 1,7,10042,0;1,4,1586,0; | G886: 1 | H886: 7 | I886: 10042 | J886: 0 | L886: 1 | M886: 4 | N886: 1586 | O886: 0 | Q886: ="1,7,"&RC[2]&",0;"&"1,4,"&RC[4]&",0;" -> 1,7,15142,0;1,4,186175,0; | S886: =INT(((50+RC[-17]/10)*35+200)*12/4) -> 15142 | U886: =1000*110/100*(1+(50+RC[-19]/10)/200)*100 -> 186174.99999999997
B887: 886 | C887: 0 | D887: 400886 | E887: 1,7,10053,0;1,4,1587,0; | G887: 1 | H887: 7 | I887: 10053 | J887: 0 | L887: 1 | M887: 4 | N887: 1587 | O887: 0 | Q887: ="1,7,"&RC[2]&",0;"&"1,4,"&RC[4]&",0;" -> 1,7,15153,0;1,4,186230,0; | S887: =INT(((50+RC[-17]/10)*35+200)*12/4) -> 15153 | U887: =1000*110/100*(1+(50+RC[-19]/10)/200)*100 -> 186230
B888: 887 | C888: 0 | D888: 400887 | E888: 1,7,10063,0;1,4,1587,0; | G888: 1 | H888: 7 | I888: 10063 | J888: 0 | L888: 1 | M888: 4 | N888: 1587 | O888: 0 | Q888: ="1,7,"&RC[2]&",0;"&"1,4,"&RC[4]&",0;" -> 1,7,15163,0;1,4,186285,0; | S888: =INT(((50+RC[-17]/10)*35+200)*12/4) -> 15163 | U888: =1000*110/100*(1+(50+RC[-19]/10)/200)*100 -> 186284.99999999997
B889: 888 | C889: 0 | D889: 400888 | E889: 1,7,10074,0;1,4,1588,0; | G889: 1 | H889: 7 | I889: 10074 | J889: 0 | L889: 1 | M889: 4 | N889: 1588 | O889: 0 | Q889: ="1,7,"&RC[2]&",0;"&"1,4,"&RC[4]&",0;" -> 1,7,15174,0;1,4,186340,0; | S889: =INT(((50+RC[-17]/10)*35+200)*12/4) -> 15174 | U889: =1000*110/100*(1+(50+RC[-19]/10)/200)*100 -> 186340
B890: 889 | C890: 0 | D890: 400889 | E890: 1,7,10084,0;1,4,1588,0; | G890: 1 | H890: 7 | I890: 10084 | J890: 0 | L890: 1 | M890: 4 | N890: 1588 | O890: 0 | Q890: ="1,7,"&RC[2]&",0;"&"1,4,"&RC[4]&",0;" -> 1,7,15184,0;1,4,186395,0; | S890: =INT(((50+RC[-17]/10)*35+200)*12/4) -> 15184 | U890: =1000*110/100*(1+(50+RC[-19]/10)/200)*100 -> 186395
B891: 890 | C891: 0 | D891: 400890 | E891: 1,7,10095,0;1,4,1589,0; | G891: 1 | H891: 7 | I891: 10095 | J891: 0 | L891: 1 | M891: 4 | N891: 1589 | O891: 0 | Q891: ="1,7,"&RC[2]&",0;"&"1,4,"&RC[4]&",0;" -> 1,7,15195,0;1,4,186450,0; | S891: =INT(((50+RC[-17]/10)*35+200)*12/4) -> 15195 | U891: =1000*110/100*(1+(50+RC[-19]/10)/200)*100 -> 186449.99999999997
B892: 891 | C892: 0 | D892: 400891 | E892: 1,7,10105,0;1,4,1590,0; | G892: 1 | H892: 7 | I892: 10105 | J892: 0 | L892: 1 | M892: 4 | N892: 1590 | O892: 0 | Q892: ="1,7,"&RC[2]&",0;"&"1,4,"&RC[4]&",0;" -> 1,7,15205,0;1,4,186505,0; | S892: =INT(((50+RC[-17]/10)*35+200)*12/4) -> 15205 | U892: =1000*110/100*(1+(50+RC[-19]/10)/200)*100 -> 186505
B893: 892 | C893: 0 | D893: 400892 | E893: 1,7,10116,0;1,4,1590,0; | G893: 1 | H893: 7 | I893: 10116 | J893: 0 | L893: 1 | M893: 4 | N893: 1590 | O893: 0 | Q893: ="1,7,"&RC[2]&",0;"&"1,4,"&RC[4]&",0;" -> 1,7,15216,0;1,4,186560,0; | S893: =INT(((50+RC[-17]/10)*35+200)*12/4) -> 15216 | U893: =1000*110/100*(1+(50+RC[-19]/10)/200)*100 -> 186560
B894: 893 | C894: 0 | D894: 400893 | E894: 1,7,10126,0;1,4,1591,0; | G894: 1 | H894: 7 | I894: 10126 | J894: 0 | L894: 1 | M894: 4 | N894: 1591 | O894: 0 | Q894: ="1,7,"&RC[2]&",0;"&"1,4,"&RC[4]&",0;" -> 1,7,15226,0;1,4,186615,0; | S894: =INT(((50+RC[-17]/10)*35+200)*12/4) -> 15226 | U894: =1000*110/100*(1+(50+RC[-19]/10)/200)*100 -> 186615
B895: 894 | C895: 0 | D895: 400894 | E895: 1,7,10137,0;1,4,1591,0; | G895: 1 | H895: 7 | I895: 10137 | J895: 0 | L895: 1 | M895: 4 | N895: 1591 | O895: 0 | Q895: ="1,7,"&RC[2]&",0;"&"1,4,"&RC[4]&",0;" -> 1,7,15237,0;1,4,186670,0; | S895: =INT(((50+RC[-17]/10)*35+200)*12/4) -> 15237 | U895: =1000*110/100*(1+(50+RC[-19]/10)/200)*100 -> 186670
B896: 895 | C896: 0 | D896: 400895 | E896: 1,7,10147,0;1,4,1592,0; | G896: 1 | H896: 7 | I896: 10147 | J896: 0 | L896: 1 | M896: 4 | N896: 1592 | O896: 0 | Q896: ="1,7,"&RC[2]&",0;"&"1,4,"&RC[4]&",0;" -> 1,7,15247,0;1,4,186725,0; | S896: =INT(((50+RC[-17]/10)*35+200)*12/4) -> 15247 | U896: =1000*110/100*(1+(50+RC[-19]/10)/200)*100 -> 186725
B897: 896 | C897: 0 | D897: 400896 | E897: 1,7,10158,0;1,4,1592,0; | G897: 1 | H897: 7 | I897: 10158 | J897: 0 | L897: 1 | M897: 4 | N897: 1592 | O897: 0 | Q897: ="1,7,"&RC[2]&",0;"&"1,4,"&RC[4]&",0;" -> 1,7,15258,0;1,4,186780,0; | S897: =INT(((50+RC[-17]/10)*35+200)*12/4) -> 15258 | U897: =1000*110/100*(1+(50+RC[-19]/10)/200)*100 -> 186780
B898: 897 | C898: 0 | D898: 400897 | E898: 1,7,10168,0;1,4,1593,0; | G898: 1 | H898: 7 | I898: 10168 | J898: 0 | L898: 1 | M898: 4 | N898: 1593 | O898: 0 | Q898: ="1,7,"&RC[2]&",0;"&"1,4,"&RC[4]&",0;" -> 1,7,15268,0;1,4,186835,0; | S898: =INT(((50+RC[-17]/10)*35+200)*12/4) -> 15268 | U898: =1000*110/100*(1+(50+RC[-19]/10)/200)*100 -> 186835
B899: 898 | C899: 0 | D899: 400898 | E899: 1,7,10179,0;1,4,1593,0; | G899: 1 | H899: 7 | I899: 10179 | J899: 0 | L899: 1 | M899: 4 | N899: 1593 | O899: 0 | Q899: ="1,7,"&RC[2]&",0;"&"1,4,"&RC[4]&",0;" -> 1,7,15279,0;1,4,186890,0; | S899: =INT(((50+RC[-17]/10)*35+200)*12/4) -> 15279 | U899: =1000*110/100*(1+(50+RC[-19]/10)/200)*100 -> 186890
B900: 899 | C900: 0 | D900: 400899 | E900: 1,7,10189,0;1,4,1594,0; | G900: 1 | H900: 7 | I900: 10189 | J900: 0 | L900: 1 | M900: 4 | N900: 1594 | O900: 0 | Q900: ="1,7,"&RC[2]&",0;"&"1,4,"&RC[4]&",0;" -> 1,7,15289,0;1,4,186945,0; | S900: =INT(((50+RC[-17]/10)*35+200)*12/4) -> 15289 | U900: =1000*110/100*(1+(50+RC[-19]/10)/200)*100 -> 186945
B901: 900 | C901: 0 | D901: 400900 | E901: 1,7,10200,0;1,4,1595,0; | G901: 1 | H901: 7 | I901: 10200 | J901: 0 | L901: 1 | M901: 4 | N901: 1595 | O901: 0 | Q901: ="1,7,"&RC[2]&",0;"&"1,4,"&RC[4]&",0;" -> 1,7,15300,0;1,4,187000,0; | S901: =INT(((50+RC[-17]/10)*35+200)*12/4) -> 15300 | U901: =1000*110/100*(1+(50+RC[-19]/10)/200)*100 -> 187000
B902: 901 | C902: 0 | D902: 400901 | E902: 1,7,10210,0;1,4,1595,0; | G902: 1 | H902: 7 | I902: 10210 | J902: 0 | L902: 1 | M902: 4 | N902: 1595 | O902: 0 | Q902: ="1,7,"&RC[2]&",0;"&"1,4,"&RC[4]&",0;" -> 1,7,15310,0;1,4,187055,0; | S902: =INT(((50+RC[-17]/10)*35+200)*12/4) -> 15310 | U902: =1000*110/100*(1+(50+RC[-19]/10)/200)*100 -> 187055
B903: 902 | C903: 0 | D903: 400902 | E903: 1,7,10221,0;1,4,1596,0; | G903: 1 | H903: 7 | I903: 10221 | J903: 0 | L903: 1 | M903: 4 | N903: 1596 | O903: 0 | Q903: ="1,7,"&RC[2]&",0;"&"1,4,"&RC[4]&",0;" -> 1,7,15321,0;1,4,187110,0; | S903: =INT(((50+RC[-17]/10)*35+200)*12/4) -> 15321 | U903: =1000*110/100*(1+(50+RC[-19]/10)/200)*100 -> 187110
B904: 903 | C904: 0 | D904: 400903 | E904: 1,7,10231,0;1,4,1596,0; | G904: 1 | H904: 7 | I904: 10231 | J904: 0 | L904: 1 | M904: 4 | N904: 1596 | O904: 0 | Q904: ="1,7,"&RC[2]&",0;"&"1,4,"&RC[4]&",0;" -> 1,7,15331,0;1,4,187165,0; | S904: =INT(((50+RC[-17]/10)*35+200)*12/4) -> 15331 | U904: =1000*110/100*(1+(50+RC[-19]/10)/200)*100 -> 187165
B905: 904 | C905: 0 | D905: 400904 | E905: 1,7,10242,0;1,4,1597,0; | G905: 1 | H905: 7 | I905: 10242 | J905: 0 | L905: 1 | M905: 4 | N905: 1597 | O905: 0 | Q905: ="1,7,"&RC[2]&",0;"&"1,4,"&RC[4]&",0;" -> 1,7,15342,0;1,4,187220,0; | S905: =INT(((50+RC[-17]/10)*35+200)*12/4) -> 15342 | U905: =1000*110/100*(1+(50+RC[-19]/10)/200)*100 -> 187220
B906: 905 | C906: 0 | D906: 400905 | E906: 1,7,10252,0;1,4,1597,0; | G906: 1 | H906: 7 | I906: 10252 | J906: 0 | L906: 1 | M906: 4 | N906: 1597 | O906: 0 | Q906: ="1,7,"&RC[2]&",0;"&"1,4,"&RC[4]&",0;" -> 1,7,15352,0;1,4,187275,0; | S906: =INT(((50+RC[-17]/10)*35+200)*12/4) -> 15352 | U906: =1000*110/100*(1+(50+RC[-19]/10)/200)*100 -> 187275.00000000003
B907: 906 | C907: 0 | D907: 400906 | E907: 1,7,10263,0;1,4,1598,0; | G907: 1 | H907: 7 | I907: 10263 | J907: 0 | L907: 1 | M907: 4 | N907: 1598 | O907: 0 | Q907: ="1,7,"&RC[2]&",0;"&"1,4,"&RC[4]&",0;" -> 1,7,15363,0;1,4,187330,0; | S907: =INT(((50+RC[-17]/10)*35+200)*12/4) -> 15363 | U907: =1000*110/100*(1+(50+RC[-19]/10)/200)*100 -> 187329.99999999997
B908: 907 | C908: 0 | D908: 400907 | E908: 1,7,10273,0;1,4,1598,0; | G908: 1 | H908: 7 | I908: 10273 | J908: 0 | L908: 1 | M908: 4 | N908: 1598 | O908: 0 | Q908: ="1,7,"&RC[2]&",0;"&"1,4,"&RC[4]&",0;" -> 1,7,15373,0;1,4,187385,0; | S908: =INT(((50+RC[-17]/10)*35+200)*12/4) -> 15373 | U908: =1000*110/100*(1+(50+RC[-19]/10)/200)*100 -> 187385
B909: 908 | C909: 0 | D909: 400908 | E909: 1,7,10284,0;1,4,1599,0; | G909: 1 | H909: 7 | I909: 10284 | J909: 0 | L909: 1 | M909: 4 | N909: 1599 | O909: 0 | Q909: ="1,7,"&RC[2]&",0;"&"1,4,"&RC[4]&",0;" -> 1,7,15384,0;1,4,187440,0; | S909: =INT(((50+RC[-17]/10)*35+200)*12/4) -> 15384 | U909: =1000*110/100*(1+(50+RC[-19]/10)/200)*100 -> 187440
B910: 909 | C910: 0 | D910: 400909 | E910: 1,7,10294,0;1,4,1599,0; | G910: 1 | H910: 7 | I910: 10294 | J910: 0 | L910: 1 | M910: 4 | N910: 1599 | O910: 0 | Q910: ="1,7,"&RC[2]&",0;"&"1,4,"&RC[4]&",0;" -> 1,7,15394,0;1,4,187495,0; | S910: =INT(((50+RC[-17]/10)*35+200)*12/4) -> 15394 | U910: =1000*110/100*(1+(50+RC[-19]/10)/200)*100 -> 187494.99999999997
B911: 910 | C911: 0 | D911: 400910 | E911: 1,7,10305,0;1,4,1600,0; | G911: 1 | H911: 7 | I911: 10305 | J911: 0 | L911: 1 | M911: 4 | N911: 1600 | O911: 0 | Q911: ="1,7,"&RC[2]&",0;"&"1,4,"&RC[4]&",0;" -> 1,7,15405,0;1,4,187550,0; | S911: =INT(((50+RC[-17]/10)*35+200)*12/4) -> 15405 | U911: =1000*110/100*(1+(50+RC[-19]/10)/200)*100 -> 187550
B912: 911 | C912: 0 | D912: 400911 | E912: 1,7,10315,0;1,4,1601,0; | G912: 1 | H912: 7 | I912: 10315 | J912: 0 | L912: 1 | M912: 4 | N912: 1601 | O912: 0 | Q912: ="1,7,"&RC[2]&",0;"&"1,4,"&RC[4]&",0;" -> 1,7,15415,0;1,4,187605,0; | S912: =INT(((50+RC[-17]/10)*35+200)*12/4) -> 15415 | U912: =1000*110/100*(1+(50+RC[-19]/10)/200)*100 -> 187605
B913: 912 | C913: 0 | D913: 400912 | E913: 1,7,10326,0;1,4,1601,0; | G913: 1 | H913: 7 | I913: 10326 | J913: 0 | L913: 1 | M913: 4 | N913: 1601 | O913: 0 | Q913: ="1,7,"&RC[2]&",0;"&"1,4,"&RC[4]&",0;" -> 1,7,15426,0;1,4,187660,0; | S913: =INT(((50+RC[-17]/10)*35+200)*12/4) -> 15426 | U913: =1000*110/100*(1+(50+RC[-19]/10)/200)*100 -> 187660
B914: 913 | C914: 0 | D914: 400913 | E914: 1,7,10336,0;1,4,1602,0; | G914: 1 | H914: 7 | I914: 10336 | J914: 0 | L914: 1 | M914: 4 | N914: 1602 | O914: 0 | Q914: ="1,7,"&RC[2]&",0;"&"1,4,"&RC[4]&",0;" -> 1,7,15436,0;1,4,187715,0; | S914: =INT(((50+RC[-17]/10)*35+200)*12/4) -> 15436 | U914: =1000*110/100*(1+(50+RC[-19]/10)/200)*100 -> 187715
B915: 914 | C915: 0 | D915: 400914 | E915: 1,7,10347,0;1,4,1602,0; | G915: 1 | H915: 7 | I915: 10347 | J915: 0 | L915: 1 | M915: 4 | N915: 1602 | O915: 0 | Q915: ="1,7,"&RC[2]&",0;"&"1,4,"&RC[4]&",0;" -> 1,7,15447,0;1,4,187770,0; | S915: =INT(((50+RC[-17]/10)*35+200)*12/4) -> 15447 | U915: =1000*110/100*(1+(50+RC[-19]/10)/200)*100 -> 187770
B916: 915 | C916: 0 | D916: 400915 | E916: 1,7,10357,0;1,4,1603,0; | G916: 1 | H916: 7 | I916: 10357 | J916: 0 | L916: 1 | M916: 4 | N916: 1603 | O916: 0 | Q916: ="1,7,"&RC[2]&",0;"&"1,4,"&RC[4]&",0;" -> 1,7,15457,0;1,4,187825,0; | S916: =INT(((50+RC[-17]/10)*35+200)*12/4) -> 15457 | U916: =1000*110/100*(1+(50+RC[-19]/10)/200)*100 -> 187825
B917: 916 | C917: 0 | D917: 400916 | E917: 1,7,10368,0;1,4,1603,0; | G917: 1 | H917: 7 | I917: 10368 | J917: 0 | L917: 1 | M917: 4 | N917: 1603 | O917: 0 | Q917: ="1,7,"&RC[2]&",0;"&"1,4,"&RC[4]&",0;" -> 1,7,15468,0;1,4,187880,0; | S917: =INT(((50+RC[-17]/10)*35+200)*12/4) -> 15468 | U917: =1000*110/100*(1+(50+RC[-19]/10)/200)*100 -> 187880
B918: 917 | C918: 0 | D918: 400917 | E918: 1,7,10378,0;1,4,1604,0; | G918: 1 | H918: 7 | I918: 10378 | J918: 0 | L918: 1 | M918: 4 | N918: 1604 | O918: 0 | Q918: ="1,7,"&RC[2]&",0;"&"1,4,"&RC[4]&",0;" -> 1,7,15478,0;1,4,187935,0; | S918: =INT(((50+RC[-17]/10)*35+200)*12/4) -> 15478 | U918: =1000*110/100*(1+(50+RC[-19]/10)/200)*100 -> 187935
B919: 918 | C919: 0 | D919: 400918 | E919: 1,7,10389,0;1,4,1604,0; | G919: 1 | H919: 7 | I919: 10389 | J919: 0 | L919: 1 | M919: 4 | N919: 1604 | O919: 0 | Q919: ="1,7,"&RC[2]&",0;"&"1,4,"&RC[4]&",0;" -> 1,7,15489,0;1,4,187990,0; | S919: =INT(((50+RC[-17]/10)*35+200)*12/4) -> 15489 | U919: =1000*110/100*(1+(50+RC[-19]/10)/200)*100 -> 187990
B920: 919 | C920: 0 | D920: 400919 | E920: 1,7,10399,0;1,4,1605,0; | G920: 1 | H920: 7 | I920: 10399 | J920: 0 | L920: 1 | M920: 4 | N920: 1605 | O920: 0 | Q920: ="1,7,"&RC[2]&",0;"&"1,4,"&RC[4]&",0;" -> 1,7,15499,0;1,4,188045,0; | S920: =INT(((50+RC[-17]/10)*35+200)*12/4) -> 15499 | U920: =1000*110/100*(1+(50+RC[-19]/10)/200)*100 -> 188045
B921: 920 | C921: 0 | D921: 400920 | E921: 1,7,10410,0;1,4,1606,0; | G921: 1 | H921: 7 | I921: 10410 | J921: 0 | L921: 1 | M921: 4 | N921: 1606 | O921: 0 | Q921: ="1,7,"&RC[2]&",0;"&"1,4,"&RC[4]&",0;" -> 1,7,15510,0;1,4,188100,0; | S921: =INT(((50+RC[-17]/10)*35+200)*12/4) -> 15510 | U921: =1000*110/100*(1+(50+RC[-19]/10)/200)*100 -> 188100
B922: 921 | C922: 0 | D922: 400921 | E922: 1,7,10420,0;1,4,1606,0; | G922: 1 | H922: 7 | I922: 10420 | J922: 0 | L922: 1 | M922: 4 | N922: 1606 | O922: 0 | Q922: ="1,7,"&RC[2]&",0;"&"1,4,"&RC[4]&",0;" -> 1,7,15520,0;1,4,188155,0; | S922: =INT(((50+RC[-17]/10)*35+200)*12/4) -> 15520 | U922: =1000*110/100*(1+(50+RC[-19]/10)/200)*100 -> 188155.00000000003
B923: 922 | C923: 0 | D923: 400922 | E923: 1,7,10431,0;1,4,1607,0; | G923: 1 | H923: 7 | I923: 10431 | J923: 0 | L923: 1 | M923: 4 | N923: 1607 | O923: 0 | Q923: ="1,7,"&RC[2]&",0;"&"1,4,"&RC[4]&",0;" -> 1,7,15531,0;1,4,188210,0; | S923: =INT(((50+RC[-17]/10)*35+200)*12/4) -> 15531 | U923: =1000*110/100*(1+(50+RC[-19]/10)/200)*100 -> 188210
B924: 923 | C924: 0 | D924: 400923 | E924: 1,7,10441,0;1,4,1607,0; | G924: 1 | H924: 7 | I924: 10441 | J924: 0 | L924: 1 | M924: 4 | N924: 1607 | O924: 0 | Q924: ="1,7,"&RC[2]&",0;"&"1,4,"&RC[4]&",0;" -> 1,7,15541,0;1,4,188265,0; | S924: =INT(((50+RC[-17]/10)*35+200)*12/4) -> 15541 | U924: =1000*110/100*(1+(50+RC[-19]/10)/200)*100 -> 188265
B925: 924 | C925: 0 | D925: 400924 | E925: 1,7,10452,0;1,4,1608,0; | G925: 1 | H925: 7 | I925: 10452 | J925: 0 | L925: 1 | M925: 4 | N925: 1608 | O925: 0 | Q925: ="1,7,"&RC[2]&",0;"&"1,4,"&RC[4]&",0;" -> 1,7,15552,0;1,4,188320,0; | S925: =INT(((50+RC[-17]/10)*35+200)*12/4) -> 15552 | U925: =1000*110/100*(1+(50+RC[-19]/10)/200)*100 -> 188320.00000000003
B926: 925 | C926: 0 | D926: 400925 | E926: 1,7,10462,0;1,4,1608,0; | G926: 1 | H926: 7 | I926: 10462 | J926: 0 | L926: 1 | M926: 4 | N926: 1608 | O926: 0 | Q926: ="1,7,"&RC[2]&",0;"&"1,4,"&RC[4]&",0;" -> 1,7,15562,0;1,4,188375,0; | S926: =INT(((50+RC[-17]/10)*35+200)*12/4) -> 15562 | U926: =1000*110/100*(1+(50+RC[-19]/10)/200)*100 -> 188375
B927: 926 | C927: 0 | D927: 400926 | E927: 1,7,10473,0;1,4,1609,0; | G927: 1 | H927: 7 | I927: 10473 | J927: 0 | L927: 1 | M927: 4 | N927: 1609 | O927: 0 | Q927: ="1,7,"&RC[2]&",0;"&"1,4,"&RC[4]&",0;" -> 1,7,15573,0;1,4,188430,0; | S927: =INT(((50+RC[-17]/10)*35+200)*12/4) -> 15573 | U927: =1000*110/100*(1+(50+RC[-19]/10)/200)*100 -> 188430.00000000003
B928: 927 | C928: 0 | D928: 400927 | E928: 1,7,10483,0;1,4,1609,0; | G928: 1 | H928: 7 | I928: 10483 | J928: 0 | L928: 1 | M928: 4 | N928: 1609 | O928: 0 | Q928: ="1,7,"&RC[2]&",0;"&"1,4,"&RC[4]&",0;" -> 1,7,15583,0;1,4,188485,0; | S928: =INT(((50+RC[-17]/10)*35+200)*12/4) -> 15583 | U928: =1000*110/100*(1+(50+RC[-19]/10)/200)*100 -> 188484.99999999997
B929: 928 | C929: 0 | D929: 400928 | E929: 1,7,10494,0;1,4,1610,0; | G929: 1 | H929: 7 | I929: 10494 | J929: 0 | L929: 1 | M929: 4 | N929: 1610 | O929: 0 | Q929: ="1,7,"&RC[2]&",0;"&"1,4,"&RC[4]&",0;" -> 1,7,15594,0;1,4,188540,0; | S929: =INT(((50+RC[-17]/10)*35+200)*12/4) -> 15594 | U929: =1000*110/100*(1+(50+RC[-19]/10)/200)*100 -> 188540
B930: 929 | C930: 0 | D930: 400929 | E930: 1,7,10504,0;1,4,1610,0; | G930: 1 | H930: 7 | I930: 10504 | J930: 0 | L930: 1 | M930: 4 | N930: 1610 | O930: 0 | Q930: ="1,7,"&RC[2]&",0;"&"1,4,"&RC[4]&",0;" -> 1,7,15604,0;1,4,188595,0; | S930: =INT(((50+RC[-17]/10)*35+200)*12/4) -> 15604 | U930: =1000*110/100*(1+(50+RC[-19]/10)/200)*100 -> 188595
B931: 930 | C931: 0 | D931: 400930 | E931: 1,7,10515,0;1,4,1611,0; | G931: 1 | H931: 7 | I931: 10515 | J931: 0 | L931: 1 | M931: 4 | N931: 1611 | O931: 0 | Q931: ="1,7,"&RC[2]&",0;"&"1,4,"&RC[4]&",0;" -> 1,7,15615,0;1,4,188650,0; | S931: =INT(((50+RC[-17]/10)*35+200)*12/4) -> 15615 | U931: =1000*110/100*(1+(50+RC[-19]/10)/200)*100 -> 188649.99999999997
B932: 931 | C932: 0 | D932: 400931 | E932: 1,7,10525,0;1,4,1612,0; | G932: 1 | H932: 7 | I932: 10525 | J932: 0 | L932: 1 | M932: 4 | N932: 1612 | O932: 0 | Q932: ="1,7,"&RC[2]&",0;"&"1,4,"&RC[4]&",0;" -> 1,7,15625,0;1,4,188705,0; | S932: =INT(((50+RC[-17]/10)*35+200)*12/4) -> 15625 | U932: =1000*110/100*(1+(50+RC[-19]/10)/200)*100 -> 188705
B933: 932 | C933: 0 | D933: 400932 | E933: 1,7,10536,0;1,4,1612,0; | G933: 1 | H933: 7 | I933: 10536 | J933: 0 | L933: 1 | M933: 4 | N933: 1612 | O933: 0 | Q933: ="1,7,"&RC[2]&",0;"&"1,4,"&RC[4]&",0;" -> 1,7,15636,0;1,4,188760,0; | S933: =INT(((50+RC[-17]/10)*35+200)*12/4) -> 15636 | U933: =1000*110/100*(1+(50+RC[-19]/10)/200)*100 -> 188760
B934: 933 | C934: 0 | D934: 400933 | E934: 1,7,10546,0;1,4,1613,0; | G934: 1 | H934: 7 | I934: 10546 | J934: 0 | L934: 1 | M934: 4 | N934: 1613 | O934: 0 | Q934: ="1,7,"&RC[2]&",0;"&"1,4,"&RC[4]&",0;" -> 1,7,15646,0;1,4,188815,0; | S934: =INT(((50+RC[-17]/10)*35+200)*12/4) -> 15646 | U934: =1000*110/100*(1+(50+RC[-19]/10)/200)*100 -> 188815
B935: 934 | C935: 0 | D935: 400934 | E935: 1,7,10557,0;1,4,1613,0; | G935: 1 | H935: 7 | I935: 10557 | J935: 0 | L935: 1 | M935: 4 | N935: 1613 | O935: 0 | Q935: ="1,7,"&RC[2]&",0;"&"1,4,"&RC[4]&",0;" -> 1,7,15657,0;1,4,188870,0; | S935: =INT(((50+RC[-17]/10)*35+200)*12/4) -> 15657 | U935: =1000*110/100*(1+(50+RC[-19]/10)/200)*100 -> 188870
B936: 935 | C936: 0 | D936: 400935 | E936: 1,7,10567,0;1,4,1614,0; | G936: 1 | H936: 7 | I936: 10567 | J936: 0 | L936: 1 | M936: 4 | N936: 1614 | O936: 0 | Q936: ="1,7,"&RC[2]&",0;"&"1,4,"&RC[4]&",0;" -> 1,7,15667,0;1,4,188925,0; | S936: =INT(((50+RC[-17]/10)*35+200)*12/4) -> 15667 | U936: =1000*110/100*(1+(50+RC[-19]/10)/200)*100 -> 188925
B937: 936 | C937: 0 | D937: 400936 | E937: 1,7,10578,0;1,4,1614,0; | G937: 1 | H937: 7 | I937: 10578 | J937: 0 | L937: 1 | M937: 4 | N937: 1614 | O937: 0 | Q937: ="1,7,"&RC[2]&",0;"&"1,4,"&RC[4]&",0;" -> 1,7,15678,0;1,4,188980,0; | S937: =INT(((50+RC[-17]/10)*35+200)*12/4) -> 15678 | U937: =1000*110/100*(1+(50+RC[-19]/10)/200)*100 -> 188980
B938: 937 | C938: 0 | D938: 400937 | E938: 1,7,10588,0;1,4,1615,0; | G938: 1 | H938: 7 | I938: 10588 | J938: 0 | L938: 1 | M938: 4 | N938: 1615 | O938: 0 | Q938: ="1,7,"&RC[2]&",0;"&"1,4,"&RC[4]&",0;" -> 1,7,15688,0;1,4,189035,0; | S938: =INT(((50+RC[-17]/10)*35+200)*12/4) -> 15688 | U938: =1000*110/100*(1+(50+RC[-19]/10)/200)*100 -> 189035
B939: 938 | C939: 0 | D939: 400938 | E939: 1,7,10599,0;1,4,1615,0; | G939: 1 | H939: 7 | I939: 10599 | J939: 0 | L939: 1 | M939: 4 | N939: 1615 | O939: 0 | Q939: ="1,7,"&RC[2]&",0;"&"1,4,"&RC[4]&",0;" -> 1,7,15699,0;1,4,189090,0; | S939: =INT(((50+RC[-17]/10)*35+200)*12/4) -> 15699 | U939: =1000*110/100*(1+(50+RC[-19]/10)/200)*100 -> 189090
B940: 939 | C940: 0 | D940: 400939 | E940: 1,7,10609,0;1,4,1616,0; | G940: 1 | H940: 7 | I940: 10609 | J940: 0 | L940: 1 | M940: 4 | N940: 1616 | O940: 0 | Q940: ="1,7,"&RC[2]&",0;"&"1,4,"&RC[4]&",0;" -> 1,7,15709,0;1,4,189145,0; | S940: =INT(((50+RC[-17]/10)*35+200)*12/4) -> 15709 | U940: =1000*110/100*(1+(50+RC[-19]/10)/200)*100 -> 189145
B941: 940 | C941: 0 | D941: 400940 | E941: 1,7,10620,0;1,4,1617,0; | G941: 1 | H941: 7 | I941: 10620 | J941: 0 | L941: 1 | M941: 4 | N941: 1617 | O941: 0 | Q941: ="1,7,"&RC[2]&",0;"&"1,4,"&RC[4]&",0;" -> 1,7,15720,0;1,4,189200,0; | S941: =INT(((50+RC[-17]/10)*35+200)*12/4) -> 15720 | U941: =1000*110/100*(1+(50+RC[-19]/10)/200)*100 -> 189200
B942: 941 | C942: 0 | D942: 400941 | E942: 1,7,10630,0;1,4,1617,0; | G942: 1 | H942: 7 | I942: 10630 | J942: 0 | L942: 1 | M942: 4 | N942: 1617 | O942: 0 | Q942: ="1,7,"&RC[2]&",0;"&"1,4,"&RC[4]&",0;" -> 1,7,15730,0;1,4,189255,0; | S942: =INT(((50+RC[-17]/10)*35+200)*12/4) -> 15730 | U942: =1000*110/100*(1+(50+RC[-19]/10)/200)*100 -> 189255
B943: 942 | C943: 0 | D943: 400942 | E943: 1,7,10641,0;1,4,1618,0; | G943: 1 | H943: 7 | I943: 10641 | J943: 0 | L943: 1 | M943: 4 | N943: 1618 | O943: 0 | Q943: ="1,7,"&RC[2]&",0;"&"1,4,"&RC[4]&",0;" -> 1,7,15741,0;1,4,189310,0; | S943: =INT(((50+RC[-17]/10)*35+200)*12/4) -> 15741 | U943: =1000*110/100*(1+(50+RC[-19]/10)/200)*100 -> 189310
B944: 943 | C944: 0 | D944: 400943 | E944: 1,7,10651,0;1,4,1618,0; | G944: 1 | H944: 7 | I944: 10651 | J944: 0 | L944: 1 | M944: 4 | N944: 1618 | O944: 0 | Q944: ="1,7,"&RC[2]&",0;"&"1,4,"&RC[4]&",0;" -> 1,7,15751,0;1,4,189365,0; | S944: =INT(((50+RC[-17]/10)*35+200)*12/4) -> 15751 | U944: =1000*110/100*(1+(50+RC[-19]/10)/200)*100 -> 189365
B945: 944 | C945: 0 | D945: 400944 | E945: 1,7,10662,0;1,4,1619,0; | G945: 1 | H945: 7 | I945: 10662 | J945: 0 | L945: 1 | M945: 4 | N945: 1619 | O945: 0 | Q945: ="1,7,"&RC[2]&",0;"&"1,4,"&RC[4]&",0;" -> 1,7,15762,0;1,4,189420,0; | S945: =INT(((50+RC[-17]/10)*35+200)*12/4) -> 15762 | U945: =1000*110/100*(1+(50+RC[-19]/10)/200)*100 -> 189420
B946: 945 | C946: 0 | D946: 400945 | E946: 1,7,10672,0;1,4,1619,0; | G946: 1 | H946: 7 | I946: 10672 | J946: 0 | L946: 1 | M946: 4 | N946: 1619 | O946: 0 | Q946: ="1,7,"&RC[2]&",0;"&"1,4,"&RC[4]&",0;" -> 1,7,15772,0;1,4,189475,0; | S946: =INT(((50+RC[-17]/10)*35+200)*12/4) -> 15772 | U946: =1000*110/100*(1+(50+RC[-19]/10)/200)*100 -> 189475.00000000003
B947: 946 | C947: 0 | D947: 400946 | E947: 1,7,10683,0;1,4,1620,0; | G947: 1 | H947: 7 | I947: 10683 | J947: 0 | L947: 1 | M947: 4 | N947: 1620 | O947: 0 | Q947: ="1,7,"&RC[2]&",0;"&"1,4,"&RC[4]&",0;" -> 1,7,15783,0;1,4,189530,0; | S947: =INT(((50+RC[-17]/10)*35+200)*12/4) -> 15783 | U947: =1000*110/100*(1+(50+RC[-19]/10)/200)*100 -> 189530
B948: 947 | C948: 0 | D948: 400947 | E948: 1,7,10693,0;1,4,1620,0; | G948: 1 | H948: 7 | I948: 10693 | J948: 0 | L948: 1 | M948: 4 | N948: 1620 | O948: 0 | Q948: ="1,7,"&RC[2]&",0;"&"1,4,"&RC[4]&",0;" -> 1,7,15793,0;1,4,189585,0; | S948: =INT(((50+RC[-17]/10)*35+200)*12/4) -> 15793 | U948: =1000*110/100*(1+(50+RC[-19]/10)/200)*100 -> 189585
B949: 948 | C949: 0 | D949: 400948 | E949: 1,7,10704,0;1,4,1621,0; | G949: 1 | H949: 7 | I949: 10704 | J949: 0 | L949: 1 | M949: 4 | N949: 1621 | O949: 0 | Q949: ="1,7,"&RC[2]&",0;"&"1,4,"&RC[4]&",0;" -> 1,7,15804,0;1,4,189640,0; | S949: =INT(((50+RC[-17]/10)*35+200)*12/4) -> 15804 | U949: =1000*110/100*(1+(50+RC[-19]/10)/200)*100 -> 189640.00000000003
B950: 949 | C950: 0 | D950: 400949 | E950: 1,7,10714,0;1,4,1621,0; | G950: 1 | H950: 7 | I950: 10714 | J950: 0 | L950: 1 | M950: 4 | N950: 1621 | O950: 0 | Q950: ="1,7,"&RC[2]&",0;"&"1,4,"&RC[4]&",0;" -> 1,7,15814,0;1,4,189695,0; | S950: =INT(((50+RC[-17]/10)*35+200)*12/4) -> 15814 | U950: =1000*110/100*(1+(50+RC[-19]/10)/200)*100 -> 189694.99999999997
B951: 950 | C951: 0 | D951: 400950 | E951: 1,7,10725,0;1,4,1622,0; | G951: 1 | H951: 7 | I951: 10725 | J951: 0 | L951: 1 | M951: 4 | N951: 1622 | O951: 0 | Q951: ="1,7,"&RC[2]&",0;"&"1,4,"&RC[4]&",0;" -> 1,7,15825,0;1,4,189750,0; | S951: =INT(((50+RC[-17]/10)*35+200)*12/4) -> 15825 | U951: =1000*110/100*(1+(50+RC[-19]/10)/200)*100 -> 189750
B952: 951 | C952: 0 | D952: 400951 | E952: 1,7,10735,0;1,4,1623,0; | G952: 1 | H952: 7 | I952: 10735 | J952: 0 | L952: 1 | M952: 4 | N952: 1623 | O952: 0 | Q952: ="1,7,"&RC[2]&",0;"&"1,4,"&RC[4]&",0;" -> 1,7,15835,0;1,4,189805,0; | S952: =INT(((50+RC[-17]/10)*35+200)*12/4) -> 15835 | U952: =1000*110/100*(1+(50+RC[-19]/10)/200)*100 -> 189804.99999999997
B953: 952 | C953: 0 | D953: 400952 | E953: 1,7,10746,0;1,4,1623,0; | G953: 1 | H953: 7 | I953: 10746 | J953: 0 | L953: 1 | M953: 4 | N953: 1623 | O953: 0 | Q953: ="1,7,"&RC[2]&",0;"&"1,4,"&RC[4]&",0;" -> 1,7,15846,0;1,4,189860,0; | S953: =INT(((50+RC[-17]/10)*35+200)*12/4) -> 15846 | U953: =1000*110/100*(1+(50+RC[-19]/10)/200)*100 -> 189860
B954: 953 | C954: 0 | D954: 400953 | E954: 1,7,10756,0;1,4,1624,0; | G954: 1 | H954: 7 | I954: 10756 | J954: 0 | L954: 1 | M954: 4 | N954: 1624 | O954: 0 | Q954: ="1,7,"&RC[2]&",0;"&"1,4,"&RC[4]&",0;" -> 1,7,15856,0;1,4,189915,0; | S954: =INT(((50+RC[-17]/10)*35+200)*12/4) -> 15856 | U954: =1000*110/100*(1+(50+RC[-19]/10)/200)*100 -> 189915
B955: 954 | C955: 0 | D955: 400954 | E955: 1,7,10767,0;1,4,1624,0; | G955: 1 | H955: 7 | I955: 10767 | J955: 0 | L955: 1 | M955: 4 | N955: 1624 | O955: 0 | Q955: ="1,7,"&RC[2]&",0;"&"1,4,"&RC[4]&",0;" -> 1,7,15867,0;1,4,189970,0; | S955: =INT(((50+RC[-17]/10)*35+200)*12/4) -> 15867 | U955: =1000*110/100*(1+(50+RC[-19]/10)/200)*100 -> 189969.99999999997
B956: 955 | C956: 0 | D956: 400955 | E956: 1,7,10777,0;1,4,1625,0; | G956: 1 | H956: 7 | I956: 10777 | J956: 0 | L956: 1 | M956: 4 | N956: 1625 | O956: 0 | Q956: ="1,7,"&RC[2]&",0;"&"1,4,"&RC[4]&",0;" -> 1,7,15877,0;1,4,190025,0; | S956: =INT(((50+RC[-17]/10)*35+200)*12/4) -> 15877 | U956: =1000*110/100*(1+(50+RC[-19]/10)/200)*100 -> 190025
B957: 956 | C957: 0 | D957: 400956 | E957: 1,7,10788,0;1,4,1625,0; | G957: 1 | H957: 7 | I957: 10788 | J957: 0 | L957: 1 | M957: 4 | N957: 1625 | O957: 0 | Q957: ="1,7,"&RC[2]&",0;"&"1,4,"&RC[4]&",0;" -> 1,7,15888,0;1,4,190080,0; | S957: =INT(((50+RC[-17]/10)*35+200)*12/4) -> 15888 | U957: =1000*110/100*(1+(50+RC[-19]/10)/200)*100 -> 190080
B958: 957 | C958: 0 | D958: 400957 | E958: 1,7,10798,0;1,4,1626,0; | G958: 1 | H958: 7 | I958: 10798 | J958: 0 | L958: 1 | M958: 4 | N958: 1626 | O958: 0 | Q958: ="1,7,"&RC[2]&",0;"&"1,4,"&RC[4]&",0;" -> 1,7,15898,0;1,4,190135,0; | S958: =INT(((50+RC[-17]/10)*35+200)*12/4) -> 15898 | U958: =1000*110/100*(1+(50+RC[-19]/10)/200)*100 -> 190135
B959: 958 | C959: 0 | D959: 400958 | E959: 1,7,10809,0;1,4,1626,0; | G959: 1 | H959: 7 | I959: 10809 | J959: 0 | L959: 1 | M959: 4 | N959: 1626 | O959: 0 | Q959: ="1,7,"&RC[2]&",0;"&"1,4,"&RC[4]&",0;" -> 1,7,15909,0;1,4,190190,0; | S959: =INT(((50+RC[-17]/10)*35+200)*12/4) -> 15909 | U959: =1000*110/100*(1+(50+RC[-19]/10)/200)*100 -> 190190
B960: 959 | C960: 0 | D960: 400959 | E960: 1,7,10819,0;1,4,1627,0; | G960: 1 | H960: 7 | I960: 10819 | J960: 0 | L960: 1 | M960: 4 | N960: 1627 | O960: 0 | Q960: ="1,7,"&RC[2]&",0;"&"1,4,"&RC[4]&",0;" -> 1,7,15919,0;1,4,190245,0; | S960: =INT(((50+RC[-17]/10)*35+200)*12/4) -> 15919 | U960: =1000*110/100*(1+(50+RC[-19]/10)/200)*100 -> 190245
B961: 960 | C961: 0 | D961: 400960 | E961: 1,7,10830,0;1,4,1628,0; | G961: 1 | H961: 7 | I961: 10830 | J961: 0 | L961: 1 | M961: 4 | N961: 1628 | O961: 0 | Q961: ="1,7,"&RC[2]&",0;"&"1,4,"&RC[4]&",0;" -> 1,7,15930,0;1,4,190300,0; | S961: =INT(((50+RC[-17]/10)*35+200)*12/4) -> 15930 | U961: =1000*110/100*(1+(50+RC[-19]/10)/200)*100 -> 190300
B962: 961 | C962: 0 | D962: 400961 | E962: 1,7,10840,0;1,4,1628,0; | G962: 1 | H962: 7 | I962: 10840 | J962: 0 | L962: 1 | M962: 4 | N962: 1628 | O962: 0 | Q962: ="1,7,"&RC[2]&",0;"&"1,4,"&RC[4]&",0;" -> 1,7,15940,0;1,4,190355,0; | S962: =INT(((50+RC[-17]/10)*35+200)*12/4) -> 15940 | U962: =1000*110/100*(1+(50+RC[-19]/10)/200)*100 -> 190355
B963: 962 | C963: 0 | D963: 400962 | E963: 1,7,10851,0;1,4,1629,0; | G963: 1 | H963: 7 | I963: 10851 | J963: 0 | L963: 1 | M963: 4 | N963: 1629 | O963: 0 | Q963: ="1,7,"&RC[2]&",0;"&"1,4,"&RC[4]&",0;" -> 1,7,15951,0;1,4,190410,0; | S963: =INT(((50+RC[-17]/10)*35+200)*12/4) -> 15951 | U963: =1000*110/100*(1+(50+RC[-19]/10)/200)*100 -> 190410
B964: 963 | C964: 0 | D964: 400963 | E964: 1,7,10861,0;1,4,1629,0; | G964: 1 | H964: 7 | I964: 10861 | J964: 0 | L964: 1 | M964: 4 | N964: 1629 | O964: 0 | Q964: ="1,7,"&RC[2]&",0;"&"1,4,"&RC[4]&",0;" -> 1,7,15961,0;1,4,190465,0; | S964: =INT(((50+RC[-17]/10)*35+200)*12/4) -> 15961 | U964: =1000*110/100*(1+(50+RC[-19]/10)/200)*100 -> 190465
B965: 964 | C965: 0 | D965: 400964 | E965: 1,7,10872,0;1,4,1630,0; | G965: 1 | H965: 7 | I965: 10872 | J965: 0 | L965: 1 | M965: 4 | N965: 1630 | O965: 0 | Q965: ="1,7,"&RC[2]&",0;"&"1,4,"&RC[4]&",0;" -> 1,7,15972,0;1,4,190520,0; | S965: =INT(((50+RC[-17]/10)*35+200)*12/4) -> 15972 | U965: =1000*110/100*(1+(50+RC[-19]/10)/200)*100 -> 190520
B966: 965 | C966: 0 | D966: 400965 | E966: 1,7,10882,0;1,4,1630,0; | G966: 1 | H966: 7 | I966: 10882 | J966: 0 | L966: 1 | M966: 4 | N966: 1630 | O966: 0 | Q966: ="1,7,"&RC[2]&",0;"&"1,4,"&RC[4]&",0;" -> 1,7,15982,0;1,4,190575,0; | S966: =INT(((50+RC[-17]/10)*35+200)*12/4) -> 15982 | U966: =1000*110/100*(1+(50+RC[-19]/10)/200)*100 -> 190575
B967: 966 | C967: 0 | D967: 400966 | E967: 1,7,10893,0;1,4,1631,0; | G967: 1 | H967: 7 | I967: 10893 | J967: 0 | L967: 1 | M967: 4 | N967: 1631 | O967: 0 | Q967: ="1,7,"&RC[2]&",0;"&"1,4,"&RC[4]&",0;" -> 1,7,15993,0;1,4,190630,0; | S967: =INT(((50+RC[-17]/10)*35+200)*12/4) -> 15993 | U967: =1000*110/100*(1+(50+RC[-19]/10)/200)*100 -> 190630.00000000003
B968: 967 | C968: 0 | D968: 400967 | E968: 1,7,10903,0;1,4,1631,0; | G968: 1 | H968: 7 | I968: 10903 | J968: 0 | L968: 1 | M968: 4 | N968: 1631 | O968: 0 | Q968: ="1,7,"&RC[2]&",0;"&"1,4,"&RC[4]&",0;" -> 1,7,16003,0;1,4,190685,0; | S968: =INT(((50+RC[-17]/10)*35+200)*12/4) -> 16003 | U968: =1000*110/100*(1+(50+RC[-19]/10)/200)*100 -> 190685
B969: 968 | C969: 0 | D969: 400968 | E969: 1,7,10914,0;1,4,1632,0; | G969: 1 | H969: 7 | I969: 10914 | J969: 0 | L969: 1 | M969: 4 | N969: 1632 | O969: 0 | Q969: ="1,7,"&RC[2]&",0;"&"1,4,"&RC[4]&",0;" -> 1,7,16014,0;1,4,190740,0; | S969: =INT(((50+RC[-17]/10)*35+200)*12/4) -> 16014 | U969: =1000*110/100*(1+(50+RC[-19]/10)/200)*100 -> 190740
B970: 969 | C970: 0 | D970: 400969 | E970: 1,7,10924,0;1,4,1632,0; | G970: 1 | H970: 7 | I970: 10924 | J970: 0 | L970: 1 | M970: 4 | N970: 1632 | O970: 0 | Q970: ="1,7,"&RC[2]&",0;"&"1,4,"&RC[4]&",0;" -> 1,7,16024,0;1,4,190795,0; | S970: =INT(((50+RC[-17]/10)*35+200)*12/4) -> 16024 | U970: =1000*110/100*(1+(50+RC[-19]/10)/200)*100 -> 190795.00000000003
B971: 970 | C971: 0 | D971: 400970 | E971: 1,7,10935,0;1,4,1633,0; | G971: 1 | H971: 7 | I971: 10935 | J971: 0 | L971: 1 | M971: 4 | N971: 1633 | O971: 0 | Q971: ="1,7,"&RC[2]&",0;"&"1,4,"&RC[4]&",0;" -> 1,7,16035,0;1,4,190850,0; | S971: =INT(((50+RC[-17]/10)*35+200)*12/4) -> 16035 | U971: =1000*110/100*(1+(50+RC[-19]/10)/200)*100 -> 190849.99999999997
B972: 971 | C972: 0 | D972: 400971 | E972: 1,7,10945,0;1,4,1634,0; | G972: 1 | H972: 7 | I972: 10945 | J972: 0 | L972: 1 | M972: 4 | N972: 1634 | O972: 0 | Q972: ="1,7,"&RC[2]&",0;"&"1,4,"&RC[4]&",0;" -> 1,7,16045,0;1,4,190905,0; | S972: =INT(((50+RC[-17]/10)*35+200)*12/4) -> 16045 | U972: =1000*110/100*(1+(50+RC[-19]/10)/200)*100 -> 190905
B973: 972 | C973: 0 | D973: 400972 | E973: 1,7,10956,0;1,4,1634,0; | G973: 1 | H973: 7 | I973: 10956 | J973: 0 | L973: 1 | M973: 4 | N973: 1634 | O973: 0 | Q973: ="1,7,"&RC[2]&",0;"&"1,4,"&RC[4]&",0;" -> 1,7,16056,0;1,4,190960,0; | S973: =INT(((50+RC[-17]/10)*35+200)*12/4) -> 16056 | U973: =1000*110/100*(1+(50+RC[-19]/10)/200)*100 -> 190960
B974: 973 | C974: 0 | D974: 400973 | E974: 1,7,10966,0;1,4,1635,0; | G974: 1 | H974: 7 | I974: 10966 | J974: 0 | L974: 1 | M974: 4 | N974: 1635 | O974: 0 | Q974: ="1,7,"&RC[2]&",0;"&"1,4,"&RC[4]&",0;" -> 1,7,16066,0;1,4,191015,0; | S974: =INT(((50+RC[-17]/10)*35+200)*12/4) -> 16066 | U974: =1000*110/100*(1+(50+RC[-19]/10)/200)*100 -> 191015
B975: 974 | C975: 0 | D975: 400974 | E975: 1,7,10977,0;1,4,1635,0; | G975: 1 | H975: 7 | I975: 10977 | J975: 0 | L975: 1 | M975: 4 | N975: 1635 | O975: 0 | Q975: ="1,7,"&RC[2]&",0;"&"1,4,"&RC[4]&",0;" -> 1,7,16077,0;1,4,191070,0; | S975: =INT(((50+RC[-17]/10)*35+200)*12/4) -> 16077 | U975: =1000*110/100*(1+(50+RC[-19]/10)/200)*100 -> 191070
B976: 975 | C976: 0 | D976: 400975 | E976: 1,7,10987,0;1,4,1636,0; | G976: 1 | H976: 7 | I976: 10987 | J976: 0 | L976: 1 | M976: 4 | N976: 1636 | O976: 0 | Q976: ="1,7,"&RC[2]&",0;"&"1,4,"&RC[4]&",0;" -> 1,7,16087,0;1,4,191125,0; | S976: =INT(((50+RC[-17]/10)*35+200)*12/4) -> 16087 | U976: =1000*110/100*(1+(50+RC[-19]/10)/200)*100 -> 191125
B977: 976 | C977: 0 | D977: 400976 | E977: 1,7,10998,0;1,4,1636,0; | G977: 1 | H977: 7 | I977: 10998 | J977: 0 | L977: 1 | M977: 4 | N977: 1636 | O977: 0 | Q977: ="1,7,"&RC[2]&",0;"&"1,4,"&RC[4]&",0;" -> 1,7,16098,0;1,4,191180,0; | S977: =INT(((50+RC[-17]/10)*35+200)*12/4) -> 16098 | U977: =1000*110/100*(1+(50+RC[-19]/10)/200)*100 -> 191180
B978: 977 | C978: 0 | D978: 400977 | E978: 1,7,11008,0;1,4,1637,0; | G978: 1 | H978: 7 | I978: 11008 | J978: 0 | L978: 1 | M978: 4 | N978: 1637 | O978: 0 | Q978: ="1,7,"&RC[2]&",0;"&"1,4,"&RC[4]&",0;" -> 1,7,16108,0;1,4,191235,0; | S978: =INT(((50+RC[-17]/10)*35+200)*12/4) -> 16108 | U978: =1000*110/100*(1+(50+RC[-19]/10)/200)*100 -> 191235
B979: 978 | C979: 0 | D979: 400978 | E979: 1,7,11019,0;1,4,1637,0; | G979: 1 | H979: 7 | I979: 11019 | J979: 0 | L979: 1 | M979: 4 | N979: 1637 | O979: 0 | Q979: ="1,7,"&RC[2]&",0;"&"1,4,"&RC[4]&",0;" -> 1,7,16119,0;1,4,191290,0; | S979: =INT(((50+RC[-17]/10)*35+200)*12/4) -> 16119 | U979: =1000*110/100*(1+(50+RC[-19]/10)/200)*100 -> 191290
B980: 979 | C980: 0 | D980: 400979 | E980: 1,7,11029,0;1,4,1638,0; | G980: 1 | H980: 7 | I980: 11029 | J980: 0 | L980: 1 | M980: 4 | N980: 1638 | O980: 0 | Q980: ="1,7,"&RC[2]&",0;"&"1,4,"&RC[4]&",0;" -> 1,7,16129,0;1,4,191345,0; | S980: =INT(((50+RC[-17]/10)*35+200)*12/4) -> 16129 | U980: =1000*110/100*(1+(50+RC[-19]/10)/200)*100 -> 191345
B981: 980 | C981: 0 | D981: 400980 | E981: 1,7,11040,0;1,4,1639,0; | G981: 1 | H981: 7 | I981: 11040 | J981: 0 | L981: 1 | M981: 4 | N981: 1639 | O981: 0 | Q981: ="1,7,"&RC[2]&",0;"&"1,4,"&RC[4]&",0;" -> 1,7,16140,0;1,4,191400,0; | S981: =INT(((50+RC[-17]/10)*35+200)*12/4) -> 16140 | U981: =1000*110/100*(1+(50+RC[-19]/10)/200)*100 -> 191400
B982: 981 | C982: 0 | D982: 400981 | E982: 1,7,11050,0;1,4,1639,0; | G982: 1 | H982: 7 | I982: 11050 | J982: 0 | L982: 1 | M982: 4 | N982: 1639 | O982: 0 | Q982: ="1,7,"&RC[2]&",0;"&"1,4,"&RC[4]&",0;" -> 1,7,16150,0;1,4,191455,0; | S982: =INT(((50+RC[-17]/10)*35+200)*12/4) -> 16150 | U982: =1000*110/100*(1+(50+RC[-19]/10)/200)*100 -> 191455
B983: 982 | C983: 0 | D983: 400982 | E983: 1,7,11061,0;1,4,1640,0; | G983: 1 | H983: 7 | I983: 11061 | J983: 0 | L983: 1 | M983: 4 | N983: 1640 | O983: 0 | Q983: ="1,7,"&RC[2]&",0;"&"1,4,"&RC[4]&",0;" -> 1,7,16161,0;1,4,191510,0; | S983: =INT(((50+RC[-17]/10)*35+200)*12/4) -> 16161 | U983: =1000*110/100*(1+(50+RC[-19]/10)/200)*100 -> 191510
B984: 983 | C984: 0 | D984: 400983 | E984: 1,7,11071,0;1,4,1640,0; | G984: 1 | H984: 7 | I984: 11071 | J984: 0 | L984: 1 | M984: 4 | N984: 1640 | O984: 0 | Q984: ="1,7,"&RC[2]&",0;"&"1,4,"&RC[4]&",0;" -> 1,7,16171,0;1,4,191565,0; | S984: =INT(((50+RC[-17]/10)*35+200)*12/4) -> 16171 | U984: =1000*110/100*(1+(50+RC[-19]/10)/200)*100 -> 191565
B985: 984 | C985: 0 | D985: 400984 | E985: 1,7,11082,0;1,4,1641,0; | G985: 1 | H985: 7 | I985: 11082 | J985: 0 | L985: 1 | M985: 4 | N985: 1641 | O985: 0 | Q985: ="1,7,"&RC[2]&",0;"&"1,4,"&RC[4]&",0;" -> 1,7,16182,0;1,4,191620,0; | S985: =INT(((50+RC[-17]/10)*35+200)*12/4) -> 16182 | U985: =1000*110/100*(1+(50+RC[-19]/10)/200)*100 -> 191620
B986: 985 | C986: 0 | D986: 400985 | E986: 1,7,11092,0;1,4,1641,0; | G986: 1 | H986: 7 | I986: 11092 | J986: 0 | L986: 1 | M986: 4 | N986: 1641 | O986: 0 | Q986: ="1,7,"&RC[2]&",0;"&"1,4,"&RC[4]&",0;" -> 1,7,16192,0;1,4,191675,0; | S986: =INT(((50+RC[-17]/10)*35+200)*12/4) -> 16192 | U986: =1000*110/100*(1+(50+RC[-19]/10)/200)*100 -> 191675.00000000003
B987: 986 | C987: 0 | D987: 400986 | E987: 1,7,11103,0;1,4,1642,0; | G987: 1 | H987: 7 | I987: 11103 | J987: 0 | L987: 1 | M987: 4 | N987: 1642 | O987: 0 | Q987: ="1,7,"&RC[2]&",0;"&"1,4,"&RC[4]&",0;" -> 1,7,16203,0;1,4,191730,0; | S987: =INT(((50+RC[-17]/10)*35+200)*12/4) -> 16203 | U987: =1000*110/100*(1+(50+RC[-19]/10)/200)*100 -> 191730
B988: 987 | C988: 0 | D988: 400987 | E988: 1,7,11113,0;1,4,1642,0; | G988: 1 | H988: 7 | I988: 11113 | J988: 0 | L988: 1 | M988: 4 | N988: 1642 | O988: 0 | Q988: ="1,7,"&RC[2]&",0;"&"1,4,"&RC[4]&",0;" -> 1,7,16213,0;1,4,191785,0; | S988: =INT(((50+RC[-17]/10)*35+200)*12/4) -> 16213 | U988: =1000*110/100*(1+(50+RC[-19]/10)/200)*100 -> 191785
B989: 988 | C989: 0 | D989: 400988 | E989: 1,7,11124,0;1,4,1643,0; | G989: 1 | H989: 7 | I989: 11124 | J989: 0 | L989: 1 | M989: 4 | N989: 1643 | O989: 0 | Q989: ="1,7,"&RC[2]&",0;"&"1,4,"&RC[4]&",0;" -> 1,7,16224,0;1,4,191840,0; | S989: =INT(((50+RC[-17]/10)*35+200)*12/4) -> 16224 | U989: =1000*110/100*(1+(50+RC[-19]/10)/200)*100 -> 191840.00000000003
B990: 989 | C990: 0 | D990: 400989 | E990: 1,7,11134,0;1,4,1643,0; | G990: 1 | H990: 7 | I990: 11134 | J990: 0 | L990: 1 | M990: 4 | N990: 1643 | O990: 0 | Q990: ="1,7,"&RC[2]&",0;"&"1,4,"&RC[4]&",0;" -> 1,7,16234,0;1,4,191895,0; | S990: =INT(((50+RC[-17]/10)*35+200)*12/4) -> 16234 | U990: =1000*110/100*(1+(50+RC[-19]/10)/200)*100 -> 191895
B991: 990 | C991: 0 | D991: 400990 | E991: 1,7,11145,0;1,4,1644,0; | G991: 1 | H991: 7 | I991: 11145 | J991: 0 | L991: 1 | M991: 4 | N991: 1644 | O991: 0 | Q991: ="1,7,"&RC[2]&",0;"&"1,4,"&RC[4]&",0;" -> 1,7,16245,0;1,4,191950,0; | S991: =INT(((50+RC[-17]/10)*35+200)*12/4) -> 16245 | U991: =1000*110/100*(1+(50+RC[-19]/10)/200)*100 -> 191950.00000000003
B992: 991 | C992: 0 | D992: 400991 | E992: 1,7,11155,0;1,4,1645,0; | G992: 1 | H992: 7 | I992: 11155 | J992: 0 | L992: 1 | M992: 4 | N992: 1645 | O992: 0 | Q992: ="1,7,"&RC[2]&",0;"&"1,4,"&RC[4]&",0;" -> 1,7,16255,0;1,4,192005,0; | S992: =INT(((50+RC[-17]/10)*35+200)*12/4) -> 16255 | U992: =1000*110/100*(1+(50+RC[-19]/10)/200)*100 -> 192004.99999999997
B993: 992 | C993: 0 | D993: 400992 | E993: 1,7,11166,0;1,4,1645,0; | G993: 1 | H993: 7 | I993: 11166 | J993: 0 | L993: 1 | M993: 4 | N993: 1645 | O993: 0 | Q993: ="1,7,"&RC[2]&",0;"&"1,4,"&RC[4]&",0;" -> 1,7,16266,0;1,4,192060,0; | S993: =INT(((50+RC[-17]/10)*35+200)*12/4) -> 16266 | U993: =1000*110/100*(1+(50+RC[-19]/10)/200)*100 -> 192060
B994: 993 | C994: 0 | D994: 400993 | E994: 1,7,11176,0;1,4,1646,0; | G994: 1 | H994: 7 | I994: 11176 | J994: 0 | L994: 1 | M994: 4 | N994: 1646 | O994: 0 | Q994: ="1,7,"&RC[2]&",0;"&"1,4,"&RC[4]&",0;" -> 1,7,16276,0;1,4,192115,0; | S994: =INT(((50+RC[-17]/10)*35+200)*12/4) -> 16276 | U994: =1000*110/100*(1+(50+RC[-19]/10)/200)*100 -> 192115
B995: 994 | C995: 0 | D995: 400994 | E995: 1,7,11187,0;1,4,1646,0; | G995: 1 | H995: 7 | I995: 11187 | J995: 0 | L995: 1 | M995: 4 | N995: 1646 | O995: 0 | Q995: ="1,7,"&RC[2]&",0;"&"1,4,"&RC[4]&",0;" -> 1,7,16287,0;1,4,192170,0; | S995: =INT(((50+RC[-17]/10)*35+200)*12/4) -> 16287 | U995: =1000*110/100*(1+(50+RC[-19]/10)/200)*100 -> 192169.99999999997
B996: 995 | C996: 0 | D996: 400995 | E996: 1,7,11197,0;1,4,1647,0; | G996: 1 | H996: 7 | I996: 11197 | J996: 0 | L996: 1 | M996: 4 | N996: 1647 | O996: 0 | Q996: ="1,7,"&RC[2]&",0;"&"1,4,"&RC[4]&",0;" -> 1,7,16297,0;1,4,192225,0; | S996: =INT(((50+RC[-17]/10)*35+200)*12/4) -> 16297 | U996: =1000*110/100*(1+(50+RC[-19]/10)/200)*100 -> 192225
B997: 996 | C997: 0 | D997: 400996 | E997: 1,7,11208,0;1,4,1647,0; | G997: 1 | H997: 7 | I997: 11208 | J997: 0 | L997: 1 | M997: 4 | N997: 1647 | O997: 0 | Q997: ="1,7,"&RC[2]&",0;"&"1,4,"&RC[4]&",0;" -> 1,7,16308,0;1,4,192280,0; | S997: =INT(((50+RC[-17]/10)*35+200)*12/4) -> 16308 | U997: =1000*110/100*(1+(50+RC[-19]/10)/200)*100 -> 192280
B998: 997 | C998: 0 | D998: 400997 | E998: 1,7,11218,0;1,4,1648,0; | G998: 1 | H998: 7 | I998: 11218 | J998: 0 | L998: 1 | M998: 4 | N998: 1648 | O998: 0 | Q998: ="1,7,"&RC[2]&",0;"&"1,4,"&RC[4]&",0;" -> 1,7,16318,0;1,4,192335,0; | S998: =INT(((50+RC[-17]/10)*35+200)*12/4) -> 16318 | U998: =1000*110/100*(1+(50+RC[-19]/10)/200)*100 -> 192335
B999: 998 | C999: 0 | D999: 400998 | E999: 1,7,11229,0;1,4,1648,0; | G999: 1 | H999: 7 | I999: 11229 | J999: 0 | L999: 1 | M999: 4 | N999: 1648 | O999: 0 | Q999: ="1,7,"&RC[2]&",0;"&"1,4,"&RC[4]&",0;" -> 1,7,16329,0;1,4,192390,0; | S999: =INT(((50+RC[-17]/10)*35+200)*12/4) -> 16329 | U999: =1000*110/100*(1+(50+RC[-19]/10)/200)*100 -> 192390
B1000: 999 | C1000: 0 | D1000: 400999 | E1000: 1,7,11239,0;1,4,1649,0; | G1000: 1 | H1000: 7 | I1000: 11239 | J1000: 0 | L1000: 1 | M1000: 4 | N1000: 1649 | O1000: 0 | Q1000: ="1,7,"&RC[2]&",0;"&"1,4,"&RC[4]&",0;" -> 1,7,16339,0;1,4,192445,0; | S1000: =INT(((50+RC[-17]/10)*35+200)*12/4) -> 16339 | U1000: =1000*110/100*(1+(50+RC[-19]/10)/200)*100 -> 192445
B1001: 1000 | C1001: 0 | D1001: 401000 | E1001: 1,7,11250,0;1,4,1650,0; | G1001: 1 | H1001: 7 | I1001: 11250 | J1001: 0 | L1001: 1 | M1001: 4 | N1001: 1650 | O1001: 0 | Q1001: ="1,7,"&RC[2]&",0;"&"1,4,"&RC[4]&",0;" -> 1,7,16350,0;1,4,192500,0; | S1001: =INT(((50+RC[-17]/10)*35+200)*12/4) -> 16350 | U1001: =1000*110/100*(1+(50+RC[-19]/10)/200)*100 -> 192500