Sheet: ctYaoShouChaoConf
M1: 用于显示 | O1: 配置0,则不抽取奖励
A2: nSeq | B2: bCanTeam | C2: nBattleGroup | D2: tFixReward | E2: bRewardBox | F2: nBoxID | G2: fnAttrQiXue | H2: fnAttrGongJi | I2: fnAttrFangYu | J2: fnAttrLingLi | K2: fnAttrMoFa | L2: fnAttrSuDu | M2: nNextBoxID | N2: tDailyReward | O2: tPool
A3: i | B3: b | C3: i | D3: t{iiib} | E3: b | F3: i | G3: e | H3: e | I3: e | J3: e | K3: e | L3: e | M3: i | N3: t{iii} | O3: t{ii}
A4: 序号 | B4: 是否可以组队前往 | C4: 战斗组ID | D4: 首通奖励 | E4: 是否奖励宝箱 | F4: 宝箱ID | G4: 气血属性 | H4: 攻击属性 | I4: 防御属性 | J4: 灵力属性 | K4: 魔法属性 | L4: 速度属性 | M4: 下关宝箱关卡 | N4: 每日奖励 | O4: 奖池(奖池ID,奖励的道具数量)
A5: 1 | B5: 0 | C5: 400001 | D5: 1,4,5000,0; | E5: 1 | F5: 20001 | G5: math.floor(((nCurrGuanQia/10)*2*3+10)*1.5) | H5: math.floor(((nCurrGuanQia/10)*2*3.8+15)*1.5) | I5: math.floor(((nCurrGuanQia/10)*2*3+25)*1.5) | J5: math.floor(((nCurrGuanQia/10)*2*1.1+15)*1.5) | K5: math.floor(((nCurrGuanQia/10)*2*5)*1.5) | L5: math.floor(((nCurrGuanQia/10)*2*0.4+4)*1.5) | M5: 1 | N5: 1,4,1000; | O5: 3000,1;
A6: 2 | B6: 0 | C6: 400002 | D6: 1,4,5001,0; | E6: 0 | F6: 0 | G6: math.floor(((nCurrGuanQia/10)*2*3+10)*1.5) | H6: math.floor(((nCurrGuanQia/10)*2*3.8+15)*1.5) | I6: math.floor(((nCurrGuanQia/10)*2*3+25)*1.5) | J6: math.floor(((nCurrGuanQia/10)*2*1.1+15)*1.5) | K6: math.floor(((nCurrGuanQia/10)*2*5)*1.5) | L6: math.floor(((nCurrGuanQia/10)*2*0.4+4)*1.5) | M6: 4 | N6: 1,4,6001; | O6: 3000,1;
A7: 3 | B7: 0 | C7: 400003 | D7: 1,4,5002,0; | E7: 0 | F7: 0 | G7: math.floor(((nCurrGuanQia/10)*2*3+10)*1.5) | H7: math.floor(((nCurrGuanQia/10)*2*3.8+15)*1.5) | I7: math.floor(((nCurrGuanQia/10)*2*3+25)*1.5) | J7: math.floor(((nCurrGuanQia/10)*2*1.1+15)*1.5) | K7: math.floor(((nCurrGuanQia/10)*2*5)*1.5) | L7: math.floor(((nCurrGuanQia/10)*2*0.4+4)*1.5) | M7: 4 | N7: 1,4,11003; | O7: 3000,1;
A8: 4 | B8: 0 | C8: 400004 | D8: 1,4,5003,0; | E8: 1 | F8: 20002 | G8: math.floor(((nCurrGuanQia/10)*2*3+10)*1.5) | H8: math.floor(((nCurrGuanQia/10)*2*3.8+15)*1.5) | I8: math.floor(((nCurrGuanQia/10)*2*3+25)*1.5) | J8: math.floor(((nCurrGuanQia/10)*2*1.1+15)*1.5) | K8: math.floor(((nCurrGuanQia/10)*2*5)*1.5) | L8: math.floor(((nCurrGuanQia/10)*2*0.4+4)*1.5) | M8: 4 | N8: 1,4,16006; | O8: 3000,1;
A9: 5 | B9: 0 | C9: 400005 | D9: 1,4,5004,0; | E9: 0 | F9: 0 | G9: math.floor(((nCurrGuanQia/10)*2*3+10)*1.5) | H9: math.floor(((nCurrGuanQia/10)*2*3.8+15)*1.5) | I9: math.floor(((nCurrGuanQia/10)*2*3+25)*1.5) | J9: math.floor(((nCurrGuanQia/10)*2*1.1+15)*1.5) | K9: math.floor(((nCurrGuanQia/10)*2*5)*1.5) | L9: math.floor(((nCurrGuanQia/10)*2*0.4+4)*1.5) | M9: 7 | N9: 1,4,21010; | O9: 3000,1;
A10: 6 | B10: 0 | C10: 400006 | D10: 1,4,5005,0; | E10: 0 | F10: 0 | G10: math.floor(((nCurrGuanQia/10)*2*3+10)*1.5) | H10: math.floor(((nCurrGuanQia/10)*2*3.8+15)*1.5) | I10: math.floor(((nCurrGuanQia/10)*2*3+25)*1.5) | J10: math.floor(((nCurrGuanQia/10)*2*1.1+15)*1.5) | K10: math.floor(((nCurrGuanQia/10)*2*5)*1.5) | L10: math.floor(((nCurrGuanQia/10)*2*0.4+4)*1.5) | M10: 7 | N10: 1,4,26015; | O10: 3000,1;
A11: 7 | B11: 0 | C11: 400007 | D11: 1,4,5006,0; | E11: 1 | F11: 20003 | G11: math.floor(((nCurrGuanQia/10)*2*3+10)*1.5) | H11: math.floor(((nCurrGuanQia/10)*2*3.8+15)*1.5) | I11: math.floor(((nCurrGuanQia/10)*2*3+25)*1.5) | J11: math.floor(((nCurrGuanQia/10)*2*1.1+15)*1.5) | K11: math.floor(((nCurrGuanQia/10)*2*5)*1.5) | L11: math.floor(((nCurrGuanQia/10)*2*0.4+4)*1.5) | M11: 7 | N11: 1,4,31021; | O11: 3000,1;
A12: 8 | B12: 0 | C12: 400008 | D12: 1,4,5007,0; | E12: 0 | F12: 0 | G12: math.floor(((nCurrGuanQia/10)*2*3+10)*1.5) | H12: math.floor(((nCurrGuanQia/10)*2*3.8+15)*1.5) | I12: math.floor(((nCurrGuanQia/10)*2*3+25)*1.5) | J12: math.floor(((nCurrGuanQia/10)*2*1.1+15)*1.5) | K12: math.floor(((nCurrGuanQia/10)*2*5)*1.5) | L12: math.floor(((nCurrGuanQia/10)*2*0.4+4)*1.5) | M12: 10 | N12: 1,4,36028; | O12: 3000,1;
A13: 9 | B13: 0 | C13: 400009 | D13: 1,4,5008,0; | E13: 0 | F13: 0 | G13: math.floor(((nCurrGuanQia/10)*2*3+10)*1.5) | H13: math.floor(((nCurrGuanQia/10)*2*3.8+15)*1.5) | I13: math.floor(((nCurrGuanQia/10)*2*3+25)*1.5) | J13: math.floor(((nCurrGuanQia/10)*2*1.1+15)*1.5) | K13: math.floor(((nCurrGuanQia/10)*2*5)*1.5) | L13: math.floor(((nCurrGuanQia/10)*2*0.4+4)*1.5) | M13: 10 | N13: 1,4,41036; | O13: 3000,1;
A14: 10 | B14: 0 | C14: 400010 | D14: 1,4,5009,0; | E14: 1 | F14: 20004 | G14: math.floor(((nCurrGuanQia/10)*2*3+10)*1.5) | H14: math.floor(((nCurrGuanQia/10)*2*3.8+15)*1.5) | I14: math.floor(((nCurrGuanQia/10)*2*3+25)*1.5) | J14: math.floor(((nCurrGuanQia/10)*2*1.1+15)*1.5) | K14: math.floor(((nCurrGuanQia/10)*2*5)*1.5) | L14: math.floor(((nCurrGuanQia/10)*2*0.4+4)*1.5) | M14: 10 | N14: 1,4,46045; | O14: 3000,1;
A15: 11 | B15: 0 | C15: 400011 | D15: 1,4,5010,0; | E15: 0 | F15: 0 | G15: math.floor(((nCurrGuanQia/10)*2*3+10)*1.5) | H15: math.floor(((nCurrGuanQia/10)*2*3.8+15)*1.5) | I15: math.floor(((nCurrGuanQia/10)*2*3+25)*1.5) | J15: math.floor(((nCurrGuanQia/10)*2*1.1+15)*1.5) | K15: math.floor(((nCurrGuanQia/10)*2*5)*1.5) | L15: math.floor(((nCurrGuanQia/10)*2*0.4+4)*1.5) | M15: 13 | N15: 1,4,51055; | O15: 3000,1;
A16: 12 | B16: 0 | C16: 400012 | D16: 1,4,5011,0; | E16: 0 | F16: 0 | G16: math.floor(((nCurrGuanQia/10)*2*3+10)*1.5) | H16: math.floor(((nCurrGuanQia/10)*2*3.8+15)*1.5) | I16: math.floor(((nCurrGuanQia/10)*2*3+25)*1.5) | J16: math.floor(((nCurrGuanQia/10)*2*1.1+15)*1.5) | K16: math.floor(((nCurrGuanQia/10)*2*5)*1.5) | L16: math.floor(((nCurrGuanQia/10)*2*0.4+4)*1.5) | M16: 13 | N16: 1,4,56066; | O16: 3000,1;
A17: 13 | B17: 0 | C17: 400013 | D17: 1,4,5012,0; | E17: 1 | F17: 20005 | G17: math.floor(((nCurrGuanQia/10)*2*3+10)*1.5) | H17: math.floor(((nCurrGuanQia/10)*2*3.8+15)*1.5) | I17: math.floor(((nCurrGuanQia/10)*2*3+25)*1.5) | J17: math.floor(((nCurrGuanQia/10)*2*1.1+15)*1.5) | K17: math.floor(((nCurrGuanQia/10)*2*5)*1.5) | L17: math.floor(((nCurrGuanQia/10)*2*0.4+4)*1.5) | M17: 13 | N17: 1,4,61078; | O17: 3000,1;
A18: 14 | B18: 0 | C18: 400014 | D18: 1,4,5013,0; | E18: 0 | F18: 0 | G18: math.floor(((nCurrGuanQia/10)*2*3+10)*1.5) | H18: math.floor(((nCurrGuanQia/10)*2*3.8+15)*1.5) | I18: math.floor(((nCurrGuanQia/10)*2*3+25)*1.5) | J18: math.floor(((nCurrGuanQia/10)*2*1.1+15)*1.5) | K18: math.floor(((nCurrGuanQia/10)*2*5)*1.5) | L18: math.floor(((nCurrGuanQia/10)*2*0.4+4)*1.5) | M18: 16 | N18: 1,4,66091; | O18: 3000,1;
A19: 15 | B19: 0 | C19: 400015 | D19: 1,4,5014,0; | E19: 1 | F19: 2006 | G19: math.floor(((nCurrGuanQia/10)*2*3+10)*1.5) | H19: math.floor(((nCurrGuanQia/10)*2*3.8+15)*1.5) | I19: math.floor(((nCurrGuanQia/10)*2*3+25)*1.5) | J19: math.floor(((nCurrGuanQia/10)*2*1.1+15)*1.5) | K19: math.floor(((nCurrGuanQia/10)*2*5)*1.5) | L19: math.floor(((nCurrGuanQia/10)*2*0.4+4)*1.5) | M19: 16 | N19: 1,4,71105; | O19: 3000,1;

Sheet: Sheet2
A1: 宋玉 | B1: 多想为你奉上最美的鲜花
A2: 潘安 | B2: 留不住的，始终是那刹那消逝的芳华
A3: 卫玠 | B3: 天涯海角，但求无他，只望君安，叔宝便已知足
A4: 赵云 | B4: 若为伊故，子龙再度七进七出又何妨！
A5: 司马相如 | B5: 能与娘娘相伴，真乃微臣之辛
A6: 孙策 | B6: =R[-1]C -> 能与娘娘相伴，真乃微臣之辛
A7: 韩子高 | B7: 伊人独舞，倾城之姿。舞中带忧，我见犹怜
A8: 高长恭 | B8: 不要动，再动的话，我可不敢保证会发生什么!
A9: 嵇康 | B9: 人生难免不如意，娘娘懂得排遣便好
A10: 慕容冲 | B10: 你是白痴吗？这种话还需要我当面跟你说清楚吗！
A11: 诸葛亮 | B11: 今日夜观星象，乌云盖顶，却奈何遮不住对你的思念
A12: 卫青 | B12: 有时候莫名其妙的笑了，只因为想到了你
A13: 荀彧 | B13: 大千世界，能遇上娘娘，真好
A14: 子画 | B14: 没有我，你要好好的，这是你唯一能为我做的
A15: 白玉堂 | B15: 不要怕什么路途遥远。走一步有一步的风景
A16: 曹操 | B16: 我从来不怕天下人看错我，却唯怕你看错我
A17: 李白 | B17: 陪你地老天荒，只为伊人独醉
A18: 杜甫 | B18: 你站在哪里 哪里就自成风景
A19: 展昭 | B19: 只要展某认为值得，纵管前方是刀山火海还是千军万马，我也会义无反顾！
A20: 周瑜 | B20: 聆听吧，这首献给您的醉赤壁
A21: 苏轼 | B21: 小楼一夜听风雨，深巷明朝卖杏花
A22: 元稹 | B22: 在你需要我时，我总会出现在你身边
A23: 阮籍 | B23: 世间纵有风雪寒寒，亦终有人万死不离
A24: 霍去病 | B24: 娘娘，和你在一起总会令我忘记时间的存在
A25: 邹忌 | B25: 我不思进取，因为只思你！
A26: 唐伯虎 | B26: 笔走龙蛇绘江山，却绘不出娘娘的惊鸿之姿
A27: 柳永 | B27: 云淡风轻，细水长流
A28: 魏无忌 | B28: 凤兮凤兮归故乡，遨游四海求其凰
A29: 扶苏 | B29: 此刻看着你，就好比我在晴朗的天气，眺望远处的青山
A30: 欧阳修 | B30: 娘娘，好风、好景，倒不如来一场春风得意马蹄疾。
A31: 郭嘉 | B31: 有的路，是脚去走。而有的路，确是用心去走
A32: 蒙恬 | B32: 你若需要，大可拿走我的心，可是别把你的微笑拿掉
A33: 白居易 | B33: 娘娘，樱树只有华美落尽，生命脉络才历历可见
A34: 刘彻 | B34: 一腔孤勇与余生，只愿能陪在你的身边

Sheet: Sheet3
A7: 序号 | B7: 最小关卡 | C7: 最大关卡 | D7: 关卡名 | E7: 人物经验基数公式 | F7: 宠物经验基数公式 | I7: 银币奖励基数公式 | L7: 金币奖励基础公式 | M7: 人物离线经验 | N7: 宠物离线经验 | O7: 离线奖励银币
A8: 1 | B8: 1 | C8: 1 | D8: 新手试炼 | E8: 50000/3600*(nPatrolSec+3)*(100+nGuanQia)/100 | F8: 50000/3600*(nPatrolSec+3)*(100+nGuanQia)/100*0.4 | I8: 50000/3600*(nPatrolSec+3)*(100+nGuanQia)/100*20 | J8: =RC[1]&"/15/3600*(nPatrolSec+3)*(nGuanQia+0)/"&INT((RC[-8]+RC[-7])/2) -> 2000000/15/3600*(nPatrolSec+3)*(nGuanQia+0)/1 | K8: 2000000 | L8: nGuanQia + 100 | M8: 50000/60*nMin*(100+nGuanQia)/100 | N8: 50000/60*nMin*(100+nGuanQia)/100*0.4 | O8: 50000/60*nMin*(100+nGuanQia)/100*20 | P8: =RC[-5]&"/20/60*nMin*(nGuanQia+0)/"&INT((RC[-14]+RC[-13])/2) -> 2000000/20/60*nMin*(nGuanQia+0)/1
A9: 2 | B9: 2 | C9: 2 | D9: 新手试炼 | E9: 50000/3600*(nPatrolSec+3)*(100+nGuanQia)/100 | F9: 50000/3600*(nPatrolSec+3)*(100+nGuanQia)/100*0.4 | I9: 50000/3600*(nPatrolSec+3)*(100+nGuanQia)/100*20 | J9: =RC[1]&"/15/3600*(nPatrolSec+3)*(nGuanQia+0)/"&INT((RC[-8]+RC[-7])/2) -> 2600000/15/3600*(nPatrolSec+3)*(nGuanQia+0)/2 | K9: =(R18C11-R8C11)/(R18C1-R8C1)+R[-1]C -> 2600000 | L9: nGuanQia + 100 | M9: 50000/60*nMin*(100+nGuanQia)/100 | N9: 50000/60*nMin*(100+nGuanQia)/100*0.4 | O9: 50000/60*nMin*(100+nGuanQia)/100*20 | P9: =RC[-5]&"/20/60*nMin*(nGuanQia+0)/"&INT((RC[-14]+RC[-13])/2) -> 2600000/20/60*nMin*(nGuanQia+0)/2
A10: 3 | B10: 3 | C10: 3 | D10: 新手试炼 | E10: 50000/3600*(nPatrolSec+3)*(100+nGuanQia)/100 | F10: 50000/3600*(nPatrolSec+3)*(100+nGuanQia)/100*0.4 | I10: 50000/3600*(nPatrolSec+3)*(100+nGuanQia)/100*20 | J10: =RC[1]&"/15/3600*(nPatrolSec+3)*(nGuanQia+0)/"&INT((RC[-8]+RC[-7])/2) -> 3200000/15/3600*(nPatrolSec+3)*(nGuanQia+0)/3 | K10: =(R18C11-R8C11)/(R18C1-R8C1)+R[-1]C -> 3200000 | L10: nGuanQia + 100 | M10: 50000/60*nMin*(100+nGuanQia)/100 | N10: 50000/60*nMin*(100+nGuanQia)/100*0.4 | O10: 50000/60*nMin*(100+nGuanQia)/100*20 | P10: =RC[-5]&"/20/60*nMin*(nGuanQia+0)/"&INT((RC[-14]+RC[-13])/2) -> 3200000/20/60*nMin*(nGuanQia+0)/3
A11: 4 | B11: 4 | C11: 4 | D11: 新手试炼 | E11: 50000/3600*(nPatrolSec+3)*(100+nGuanQia)/100 | F11: 50000/3600*(nPatrolSec+3)*(100+nGuanQia)/100*0.4 | I11: 50000/3600*(nPatrolSec+3)*(100+nGuanQia)/100*20 | J11: =RC[1]&"/15/3600*(nPatrolSec+3)*(nGuanQia+0)/"&INT((RC[-8]+RC[-7])/2) -> 3800000/15/3600*(nPatrolSec+3)*(nGuanQia+0)/4 | K11: =(R18C11-R8C11)/(R18C1-R8C1)+R[-1]C -> 3800000 | L11: nGuanQia + 100 | M11: 50000/60*nMin*(100+nGuanQia)/100 | N11: 50000/60*nMin*(100+nGuanQia)/100*0.4 | O11: 50000/60*nMin*(100+nGuanQia)/100*20 | P11: =RC[-5]&"/20/60*nMin*(nGuanQia+0)/"&INT((RC[-14]+RC[-13])/2) -> 3800000/20/60*nMin*(nGuanQia+0)/4
A12: 5 | B12: 5 | C12: 5 | D12: 新手试炼 | E12: 50000/3600*(nPatrolSec+3)*(100+nGuanQia)/100 | F12: 50000/3600*(nPatrolSec+3)*(100+nGuanQia)/100*0.4 | I12: 50000/3600*(nPatrolSec+3)*(100+nGuanQia)/100*20 | J12: =RC[1]&"/15/3600*(nPatrolSec+3)*(nGuanQia+0)/"&INT((RC[-8]+RC[-7])/2) -> 4400000/15/3600*(nPatrolSec+3)*(nGuanQia+0)/5 | K12: =(R18C11-R8C11)/(R18C1-R8C1)+R[-1]C -> 4400000 | L12: nGuanQia + 100 | M12: 50000/60*nMin*(100+nGuanQia)/100 | N12: 50000/60*nMin*(100+nGuanQia)/100*0.4 | O12: 50000/60*nMin*(100+nGuanQia)/100*20 | P12: =RC[-5]&"/20/60*nMin*(nGuanQia+0)/"&INT((RC[-14]+RC[-13])/2) -> 4400000/20/60*nMin*(nGuanQia+0)/5
A13: 6 | B13: 6 | C13: 20 | D13: 新手试炼 | E13: 50000/3600*(nPatrolSec+3)*(100+nGuanQia)/100 | F13: 50000/3600*(nPatrolSec+3)*(100+nGuanQia)/100*0.4 | I13: 50000/3600*(nPatrolSec+3)*(100+nGuanQia)/100*20 | J13: =RC[1]&"/15/3600*(nPatrolSec+3)*(nGuanQia+0)/"&INT((RC[-8]+RC[-7])/2) -> 5000000/15/3600*(nPatrolSec+3)*(nGuanQia+0)/13 | K13: =(R18C11-R8C11)/(R18C1-R8C1)+R[-1]C -> 5000000 | L13: nGuanQia + 100 | M13: 50000/60*nMin*(100+nGuanQia)/100 | N13: 50000/60*nMin*(100+nGuanQia)/100*0.4 | O13: 50000/60*nMin*(100+nGuanQia)/100*20 | P13: =RC[-5]&"/20/60*nMin*(nGuanQia+0)/"&INT((RC[-14]+RC[-13])/2) -> 5000000/20/60*nMin*(nGuanQia+0)/13
A14: 7 | B14: 21 | C14: 50 | D14: 青铜试炼 | E14: 60000/3600*(nPatrolSec+3)*(100+nGuanQia)/100 | F14: 60000/3600*(nPatrolSec+3)*(100+nGuanQia)/100*0.4 | I14: 60000/3600*(nPatrolSec+3)*(100+nGuanQia)/100*20 | J14: =RC[1]&"/15/3600*(nPatrolSec+3)*(nGuanQia+0)/"&INT((RC[-8]+RC[-7])/2) -> 5600000/15/3600*(nPatrolSec+3)*(nGuanQia+0)/35 | K14: =(R18C11-R8C11)/(R18C1-R8C1)+R[-1]C -> 5600000 | L14: nGuanQia + 100 | M14: 60000/60*nMin*(100+nGuanQia)/100 | N14: 60000/60*nMin*(100+nGuanQia)/100*0.4 | O14: 60000/60*nMin*(100+nGuanQia)/100*20 | P14: =RC[-5]&"/20/60*nMin*(nGuanQia+0)/"&INT((RC[-14]+RC[-13])/2) -> 5600000/20/60*nMin*(nGuanQia+0)/35
A15: 8 | B15: 51 | C15: 100 | D15: 白银试炼 | E15: 70000/3600*(nPatrolSec+3)*(100+nGuanQia)/100 | F15: 70000/3600*(nPatrolSec+3)*(100+nGuanQia)/100*0.4 | I15: 70000/3600*(nPatrolSec+3)*(100+nGuanQia)/100*20 | J15: =RC[1]&"/15/3600*(nPatrolSec+3)*(nGuanQia+0)/"&INT((RC[-8]+RC[-7])/2) -> 6200000/15/3600*(nPatrolSec+3)*(nGuanQia+0)/75 | K15: =(R18C11-R8C11)/(R18C1-R8C1)+R[-1]C -> 6200000 | L15: nGuanQia + 100 | M15: 70000/60*nMin*(100+nGuanQia)/100 | N15: 70000/60*nMin*(100+nGuanQia)/100*0.4 | O15: 70000/60*nMin*(100+nGuanQia)/100*20 | P15: =RC[-5]&"/20/60*nMin*(nGuanQia+0)/"&INT((RC[-14]+RC[-13])/2) -> 6200000/20/60*nMin*(nGuanQia+0)/75
A16: 9 | B16: 101 | C16: 200 | D16: 黄金试炼 | E16: 80000/3600*(nPatrolSec+3)*(100+nGuanQia)/100 | F16: 80000/3600*(nPatrolSec+3)*(100+nGuanQia)/100*0.4 | I16: 80000/3600*(nPatrolSec+3)*(100+nGuanQia)/100*20 | J16: =RC[1]&"/15/3600*(nPatrolSec+3)*(nGuanQia+0)/"&INT((RC[-8]+RC[-7])/2) -> 6800000/15/3600*(nPatrolSec+3)*(nGuanQia+0)/150 | K16: =(R18C11-R8C11)/(R18C1-R8C1)+R[-1]C -> 6800000 | L16: nGuanQia + 100 | M16: 80000/60*nMin*(100+nGuanQia)/100 | N16: 80000/60*nMin*(100+nGuanQia)/100*0.4 | O16: 80000/60*nMin*(100+nGuanQia)/100*20 | P16: =RC[-5]&"/20/60*nMin*(nGuanQia+0)/"&INT((RC[-14]+RC[-13])/2) -> 6800000/20/60*nMin*(nGuanQia+0)/150
A17: 10 | B17: 201 | C17: 300 | D17: 钻石试炼 | E17: 90000/3600*(nPatrolSec+3)*(100+nGuanQia)/100 | F17: 90000/3600*(nPatrolSec+3)*(100+nGuanQia)/100*0.4 | I17: 90000/3600*(nPatrolSec+3)*(100+nGuanQia)/100*20 | J17: =RC[1]&"/15/3600*(nPatrolSec+3)*(nGuanQia+0)/"&INT((RC[-8]+RC[-7])/2) -> 7400000/15/3600*(nPatrolSec+3)*(nGuanQia+0)/250 | K17: =(R18C11-R8C11)/(R18C1-R8C1)+R[-1]C -> 7400000 | L17: nGuanQia + 100 | M17: 90000/60*nMin*(100+nGuanQia)/100 | N17: 90000/60*nMin*(100+nGuanQia)/100*0.4 | O17: 90000/60*nMin*(100+nGuanQia)/100*20 | P17: =RC[-5]&"/20/60*nMin*(nGuanQia+0)/"&INT((RC[-14]+RC[-13])/2) -> 7400000/20/60*nMin*(nGuanQia+0)/250
A18: 11 | B18: 301 | C18: 400 | D18: 王者试炼 | E18: 100000/3600*(nPatrolSec+3)*(100+nGuanQia)/100 | F18: 100000/3600*(nPatrolSec+3)*(100+nGuanQia)/100*0.4 | I18: 100000/3600*(nPatrolSec+3)*(100+nGuanQia)/100*20 | J18: =RC[1]&"/15/3600*(nPatrolSec+3)*(nGuanQia+0)/"&INT((RC[-8]+RC[-7])/2) -> 8000000/15/3600*(nPatrolSec+3)*(nGuanQia+0)/350 | K18: 8000000 | L18: nGuanQia + 100 | M18: 100000/60*nMin*(100+nGuanQia)/100 | N18: 100000/60*nMin*(100+nGuanQia)/100*0.4 | O18: 100000/60*nMin*(100+nGuanQia)/100*20 | P18: =RC[-5]&"/20/60*nMin*(nGuanQia+0)/"&INT((RC[-14]+RC[-13])/2) -> 8000000/20/60*nMin*(nGuanQia+0)/350
A19: 12 | B19: 401 | C19: 9999 | D19: 大师试炼 | E19: 100000/3600*(nPatrolSec+3)*(100+nGuanQia)/100 | F19: 100000/3600*(nPatrolSec+3)*(100+nGuanQia)/100*0.4 | I19: 100000/3600*(nPatrolSec+3)*(100+nGuanQia)/100*20 | K19: 8000000 | L19: nGuanQia + 100 | M19: 100000/60*nMin*(100+nGuanQia)/100 | N19: 100000/60*nMin*(100+nGuanQia)/100*0.4 | O19: 100000/60*nMin*(100+nGuanQia)/100*20
D24: (nRoleLevel*35+200)*(nCompCount+2)/4
E25: (nRoleLevel*28+160)*(nCompCount+2)/4
F26: 10000*0.1*(100+nCompCount)/100*(1+nRoleLevel/200)
D27: 镇妖基数公式，最坏情况 | I27: 假动画3秒，巡逻5秒，1小时450次假动画弹经验
B28: 关卡数 | C28: 期望等级 | D28: 经验 | E28: 宠物经验 | F28: 银币 | G28: 关卡数 | H28: 期望等级 | I28: 每小时经验 | J28: 每小时宠物经验 | K28: 每小时银币 | L28: 公式
B29: 1 | C29: 2 | D29: =INT((RC[-1]*35+200)*(1+2)/4*0.2) -> 40 | E29: =INT((RC[-2]*28+160)*(1+2)/4*0.2) -> 32 | F29: =INT(10000*0.1*(100+1)/100*(1+RC[-3]/200)*0.2) -> 204 | G29: 1 | H29: 2 | I29: 10000 | J29: =RC[-1]/35*28 -> 8000 | K29: =RC[-5]*60 -> 12240 | L29: =RC[-3]&"/3600*(nPatrolSec+3)*(1000+nGuanQia)/1000" -> 10000/3600*(nPatrolSec+3)*(1000+nGuanQia)/1000 | M29: =RC[-3]&"/3600*(nPatrolSec+3)*(1000+nGuanQia)/1000" -> 8000/3600*(nPatrolSec+3)*(1000+nGuanQia)/1000 | N29: =RC[-3]&"/3600*(nPatrolSec+3)*(1000+nGuanQia)/1000" -> 12240/3600*(nPatrolSec+3)*(1000+nGuanQia)/1000 | O29: =RC[-6]&"/60*nMin*(1000+nGuanQia)/1000" -> 10000/60*nMin*(1000+nGuanQia)/1000 | P29: =RC[-6]&"/60*nMin*(1000+nGuanQia)/1000" -> 8000/60*nMin*(1000+nGuanQia)/1000 | Q29: =RC[-6]&"/60*nMin*(1000+nGuanQia)/1000" -> 12240/60*nMin*(1000+nGuanQia)/1000
B30: 2 | C30: 3 | D30: =INT((RC[-1]*35+200)*(1+2)/4*0.2) -> 45 | E30: =INT((RC[-2]*28+160)*(1+2)/4*0.2) -> 36 | F30: =INT(10000*0.1*(100+1)/100*(1+RC[-3]/200)*0.2) -> 205 | G30: 2 | H30: 3 | I30: =R[-1]C+250 -> 10250 | J30: =RC[-1]/35*28 -> 8200 | K30: =RC[-5]*60 -> 12300 | L30: =RC[-3]&"/3600*(nPatrolSec+3)*(1000+nGuanQia)/1000" -> 10250/3600*(nPatrolSec+3)*(1000+nGuanQia)/1000 | M30: =RC[-3]&"/3600*(nPatrolSec+3)*(1000+nGuanQia)/1000" -> 8200/3600*(nPatrolSec+3)*(1000+nGuanQia)/1000 | N30: =RC[-3]&"/3600*(nPatrolSec+3)*(1000+nGuanQia)/1000" -> 12300/3600*(nPatrolSec+3)*(1000+nGuanQia)/1000 | O30: =RC[-6]&"/60*nMin*(1000+nGuanQia)/1000" -> 10250/60*nMin*(1000+nGuanQia)/1000 | P30: =RC[-6]&"/60*nMin*(1000+nGuanQia)/1000" -> 8200/60*nMin*(1000+nGuanQia)/1000 | Q30: =RC[-6]&"/60*nMin*(1000+nGuanQia)/1000" -> 12300/60*nMin*(1000+nGuanQia)/1000
B31: 3 | C31: 4 | D31: =INT((RC[-1]*35+200)*(1+2)/4*0.2) -> 51 | E31: =INT((RC[-2]*28+160)*(1+2)/4*0.2) -> 40 | F31: =INT(10000*0.1*(100+1)/100*(1+RC[-3]/200)*0.2) -> 206 | G31: 3 | H31: 4 | I31: =R[-1]C+250 -> 10500 | J31: =RC[-1]/35*28 -> 8400 | K31: =RC[-5]*60 -> 12360 | L31: =RC[-3]&"/3600*(nPatrolSec+3)*(1000+nGuanQia)/1000" -> 10500/3600*(nPatrolSec+3)*(1000+nGuanQia)/1000 | M31: =RC[-3]&"/3600*(nPatrolSec+3)*(1000+nGuanQia)/1000" -> 8400/3600*(nPatrolSec+3)*(1000+nGuanQia)/1000 | N31: =RC[-3]&"/3600*(nPatrolSec+3)*(1000+nGuanQia)/1000" -> 12360/3600*(nPatrolSec+3)*(1000+nGuanQia)/1000 | O31: =RC[-6]&"/60*nMin*(1000+nGuanQia)/1000" -> 10500/60*nMin*(1000+nGuanQia)/1000 | P31: =RC[-6]&"/60*nMin*(1000+nGuanQia)/1000" -> 8400/60*nMin*(1000+nGuanQia)/1000 | Q31: =RC[-6]&"/60*nMin*(1000+nGuanQia)/1000" -> 12360/60*nMin*(1000+nGuanQia)/1000
B32: 4 | C32: 5 | D32: =INT((RC[-1]*35+200)*(1+2)/4*0.2) -> 56 | E32: =INT((RC[-2]*28+160)*(1+2)/4*0.2) -> 45 | F32: =INT(10000*0.1*(100+1)/100*(1+RC[-3]/200)*0.2) -> 207 | G32: 4 | H32: 5 | I32: =R[-1]C+250 -> 10750 | J32: =RC[-1]/35*28 -> 8600 | K32: =RC[-5]*60 -> 12420 | L32: =RC[-3]&"/3600*(nPatrolSec+3)*(1000+nGuanQia)/1000" -> 10750/3600*(nPatrolSec+3)*(1000+nGuanQia)/1000 | M32: =RC[-3]&"/3600*(nPatrolSec+3)*(1000+nGuanQia)/1000" -> 8600/3600*(nPatrolSec+3)*(1000+nGuanQia)/1000 | N32: =RC[-3]&"/3600*(nPatrolSec+3)*(1000+nGuanQia)/1000" -> 12420/3600*(nPatrolSec+3)*(1000+nGuanQia)/1000 | O32: =RC[-6]&"/60*nMin*(1000+nGuanQia)/1000" -> 10750/60*nMin*(1000+nGuanQia)/1000 | P32: =RC[-6]&"/60*nMin*(1000+nGuanQia)/1000" -> 8600/60*nMin*(1000+nGuanQia)/1000 | Q32: =RC[-6]&"/60*nMin*(1000+nGuanQia)/1000" -> 12420/60*nMin*(1000+nGuanQia)/1000
B33: 5 | C33: 6 | D33: =INT((RC[-1]*35+200)*(1+2)/4*0.2) -> 61 | E33: =INT((RC[-2]*28+160)*(1+2)/4*0.2) -> 49 | F33: =INT(10000*0.1*(100+1)/100*(1+RC[-3]/200)*0.2) -> 208 | G33: 5 | H33: 6 | I33: =R[-1]C+250 -> 11000 | J33: =RC[-1]/35*28 -> 8800 | K33: =RC[-5]*60 -> 12480 | L33: =RC[-3]&"/3600*(nPatrolSec+3)*(1000+nGuanQia)/1000" -> 11000/3600*(nPatrolSec+3)*(1000+nGuanQia)/1000 | M33: =RC[-3]&"/3600*(nPatrolSec+3)*(1000+nGuanQia)/1000" -> 8800/3600*(nPatrolSec+3)*(1000+nGuanQia)/1000 | N33: =RC[-3]&"/3600*(nPatrolSec+3)*(1000+nGuanQia)/1000" -> 12480/3600*(nPatrolSec+3)*(1000+nGuanQia)/1000 | O33: =RC[-6]&"/60*nMin*(1000+nGuanQia)/1000" -> 11000/60*nMin*(1000+nGuanQia)/1000 | P33: =RC[-6]&"/60*nMin*(1000+nGuanQia)/1000" -> 8800/60*nMin*(1000+nGuanQia)/1000 | Q33: =RC[-6]&"/60*nMin*(1000+nGuanQia)/1000" -> 12480/60*nMin*(1000+nGuanQia)/1000
B34: 6 | C34: 7 | D34: =INT((RC[-1]*35+200)*(1+2)/4*0.2) -> 66 | E34: =INT((RC[-2]*28+160)*(1+2)/4*0.2) -> 53 | F34: =INT(10000*0.1*(100+1)/100*(1+RC[-3]/200)*0.2) -> 209 | G34: 6 | H34: 7 | I34: =R[-1]C+250 -> 11250 | J34: =RC[-1]/35*28 -> 9000 | K34: =RC[-5]*60 -> 12540 | L34: =RC[-3]&"/3600*(nPatrolSec+3)*(1000+nGuanQia)/1000" -> 11250/3600*(nPatrolSec+3)*(1000+nGuanQia)/1000 | M34: =RC[-3]&"/3600*(nPatrolSec+3)*(1000+nGuanQia)/1000" -> 9000/3600*(nPatrolSec+3)*(1000+nGuanQia)/1000 | N34: =RC[-3]&"/3600*(nPatrolSec+3)*(1000+nGuanQia)/1000" -> 12540/3600*(nPatrolSec+3)*(1000+nGuanQia)/1000 | O34: =RC[-6]&"/60*nMin*(1000+nGuanQia)/1000" -> 11250/60*nMin*(1000+nGuanQia)/1000 | P34: =RC[-6]&"/60*nMin*(1000+nGuanQia)/1000" -> 9000/60*nMin*(1000+nGuanQia)/1000 | Q34: =RC[-6]&"/60*nMin*(1000+nGuanQia)/1000" -> 12540/60*nMin*(1000+nGuanQia)/1000
B35: 7 | C35: 8 | D35: =INT((RC[-1]*35+200)*(1+2)/4*0.2) -> 72 | E35: =INT((RC[-2]*28+160)*(1+2)/4*0.2) -> 57 | F35: =INT(10000*0.1*(100+1)/100*(1+RC[-3]/200)*0.2) -> 210 | G35: 7 | H35: 8 | I35: =R[-1]C+250 -> 11500 | J35: =RC[-1]/35*28 -> 9200 | K35: =RC[-5]*60 -> 12600 | L35: =RC[-3]&"/3600*(nPatrolSec+3)*(1000+nGuanQia)/1000" -> 11500/3600*(nPatrolSec+3)*(1000+nGuanQia)/1000 | M35: =RC[-3]&"/3600*(nPatrolSec+3)*(1000+nGuanQia)/1000" -> 9200/3600*(nPatrolSec+3)*(1000+nGuanQia)/1000 | N35: =RC[-3]&"/3600*(nPatrolSec+3)*(1000+nGuanQia)/1000" -> 12600/3600*(nPatrolSec+3)*(1000+nGuanQia)/1000 | O35: =RC[-6]&"/60*nMin*(1000+nGuanQia)/1000" -> 11500/60*nMin*(1000+nGuanQia)/1000 | P35: =RC[-6]&"/60*nMin*(1000+nGuanQia)/1000" -> 9200/60*nMin*(1000+nGuanQia)/1000 | Q35: =RC[-6]&"/60*nMin*(1000+nGuanQia)/1000" -> 12600/60*nMin*(1000+nGuanQia)/1000
B36: 8 | C36: 9 | D36: =INT((RC[-1]*35+200)*(1+2)/4*0.2) -> 77 | E36: =INT((RC[-2]*28+160)*(1+2)/4*0.2) -> 61 | F36: =INT(10000*0.1*(100+1)/100*(1+RC[-3]/200)*0.2) -> 211 | G36: 8 | H36: 9 | I36: =R[-1]C+250 -> 11750 | J36: =RC[-1]/35*28 -> 9400 | K36: =RC[-5]*60 -> 12660 | L36: =RC[-3]&"/3600*(nPatrolSec+3)*(1000+nGuanQia)/1000" -> 11750/3600*(nPatrolSec+3)*(1000+nGuanQia)/1000 | M36: =RC[-3]&"/3600*(nPatrolSec+3)*(1000+nGuanQia)/1000" -> 9400/3600*(nPatrolSec+3)*(1000+nGuanQia)/1000 | N36: =RC[-3]&"/3600*(nPatrolSec+3)*(1000+nGuanQia)/1000" -> 12660/3600*(nPatrolSec+3)*(1000+nGuanQia)/1000 | O36: =RC[-6]&"/60*nMin*(1000+nGuanQia)/1000" -> 11750/60*nMin*(1000+nGuanQia)/1000 | P36: =RC[-6]&"/60*nMin*(1000+nGuanQia)/1000" -> 9400/60*nMin*(1000+nGuanQia)/1000 | Q36: =RC[-6]&"/60*nMin*(1000+nGuanQia)/1000" -> 12660/60*nMin*(1000+nGuanQia)/1000
B37: 9 | C37: 10 | D37: =INT((RC[-1]*35+200)*(1+2)/4*0.2) -> 82 | E37: =INT((RC[-2]*28+160)*(1+2)/4*0.2) -> 66 | F37: =INT(10000*0.1*(100+1)/100*(1+RC[-3]/200)*0.2) -> 212 | G37: 9 | H37: 10 | I37: =R[-1]C+250 -> 12000 | J37: =RC[-1]/35*28 -> 9600 | K37: =RC[-5]*60 -> 12720 | L37: =RC[-3]&"/3600*(nPatrolSec+3)*(1000+nGuanQia)/1000" -> 12000/3600*(nPatrolSec+3)*(1000+nGuanQia)/1000 | M37: =RC[-3]&"/3600*(nPatrolSec+3)*(1000+nGuanQia)/1000" -> 9600/3600*(nPatrolSec+3)*(1000+nGuanQia)/1000 | N37: =RC[-3]&"/3600*(nPatrolSec+3)*(1000+nGuanQia)/1000" -> 12720/3600*(nPatrolSec+3)*(1000+nGuanQia)/1000 | O37: =RC[-6]&"/60*nMin*(1000+nGuanQia)/1000" -> 12000/60*nMin*(1000+nGuanQia)/1000 | P37: =RC[-6]&"/60*nMin*(1000+nGuanQia)/1000" -> 9600/60*nMin*(1000+nGuanQia)/1000 | Q37: =RC[-6]&"/60*nMin*(1000+nGuanQia)/1000" -> 12720/60*nMin*(1000+nGuanQia)/1000
B38: 10 | C38: 11 | D38: =INT((RC[-1]*35+200)*(1+2)/4*0.2) -> 87 | E38: =INT((RC[-2]*28+160)*(1+2)/4*0.2) -> 70 | F38: =INT(10000*0.1*(100+1)/100*(1+RC[-3]/200)*0.2) -> 213 | G38: 10 | H38: 11 | I38: =R[-1]C+250 -> 12250 | J38: =RC[-1]/35*28 -> 9800 | K38: =RC[-5]*60 -> 12780 | L38: =RC[-3]&"/3600*(nPatrolSec+3)*(1000+nGuanQia)/1000" -> 12250/3600*(nPatrolSec+3)*(1000+nGuanQia)/1000 | M38: =RC[-3]&"/3600*(nPatrolSec+3)*(1000+nGuanQia)/1000" -> 9800/3600*(nPatrolSec+3)*(1000+nGuanQia)/1000 | N38: =RC[-3]&"/3600*(nPatrolSec+3)*(1000+nGuanQia)/1000" -> 12780/3600*(nPatrolSec+3)*(1000+nGuanQia)/1000 | O38: =RC[-6]&"/60*nMin*(1000+nGuanQia)/1000" -> 12250/60*nMin*(1000+nGuanQia)/1000 | P38: =RC[-6]&"/60*nMin*(1000+nGuanQia)/1000" -> 9800/60*nMin*(1000+nGuanQia)/1000 | Q38: =RC[-6]&"/60*nMin*(1000+nGuanQia)/1000" -> 12780/60*nMin*(1000+nGuanQia)/1000
B39: 11 | C39: 14 | D39: =INT((RC[-1]*35+200)*(1+2)/4*0.2) -> 103 | E39: =INT((RC[-2]*28+160)*(1+2)/4*0.2) -> 82 | F39: =INT(10000*0.1*(100+1)/100*(1+RC[-3]/200)*0.2) -> 216 | G39: 11 | H39: 14 | I39: =R[-1]C+250 -> 12500 | J39: =RC[-1]/35*28 -> 10000 | K39: =RC[-5]*60 -> 12960 | L39: =RC[-3]&"/3600*(nPatrolSec+3)*(1000+nGuanQia)/1000" -> 12500/3600*(nPatrolSec+3)*(1000+nGuanQia)/1000 | M39: =RC[-3]&"/3600*(nPatrolSec+3)*(1000+nGuanQia)/1000" -> 10000/3600*(nPatrolSec+3)*(1000+nGuanQia)/1000 | N39: =RC[-3]&"/3600*(nPatrolSec+3)*(1000+nGuanQia)/1000" -> 12960/3600*(nPatrolSec+3)*(1000+nGuanQia)/1000 | O39: =RC[-6]&"/60*nMin*(1000+nGuanQia)/1000" -> 12500/60*nMin*(1000+nGuanQia)/1000 | P39: =RC[-6]&"/60*nMin*(1000+nGuanQia)/1000" -> 10000/60*nMin*(1000+nGuanQia)/1000 | Q39: =RC[-6]&"/60*nMin*(1000+nGuanQia)/1000" -> 12960/60*nMin*(1000+nGuanQia)/1000
B40: 12 | C40: 17 | D40: =INT((RC[-1]*35+200)*(1+2)/4*0.2) -> 119 | E40: =INT((RC[-2]*28+160)*(1+2)/4*0.2) -> 95 | F40: =INT(10000*0.1*(100+1)/100*(1+RC[-3]/200)*0.2) -> 219 | G40: 12 | H40: 17 | I40: =R[-1]C+250 -> 12750 | J40: =RC[-1]/35*28 -> 10200 | K40: =RC[-5]*60 -> 13140 | L40: =RC[-3]&"/3600*(nPatrolSec+3)*(1000+nGuanQia)/1000" -> 12750/3600*(nPatrolSec+3)*(1000+nGuanQia)/1000 | M40: =RC[-3]&"/3600*(nPatrolSec+3)*(1000+nGuanQia)/1000" -> 10200/3600*(nPatrolSec+3)*(1000+nGuanQia)/1000 | N40: =RC[-3]&"/3600*(nPatrolSec+3)*(1000+nGuanQia)/1000" -> 13140/3600*(nPatrolSec+3)*(1000+nGuanQia)/1000 | O40: =RC[-6]&"/60*nMin*(1000+nGuanQia)/1000" -> 12750/60*nMin*(1000+nGuanQia)/1000 | P40: =RC[-6]&"/60*nMin*(1000+nGuanQia)/1000" -> 10200/60*nMin*(1000+nGuanQia)/1000 | Q40: =RC[-6]&"/60*nMin*(1000+nGuanQia)/1000" -> 13140/60*nMin*(1000+nGuanQia)/1000
B41: 13 | C41: 20 | D41: =INT((RC[-1]*35+200)*(1+2)/4*0.2) -> 135 | E41: =INT((RC[-2]*28+160)*(1+2)/4*0.2) -> 108 | F41: =INT(10000*0.1*(100+1)/100*(1+RC[-3]/200)*0.2) -> 222 | G41: 13 | H41: 20 | I41: =R[-1]C+250 -> 13000 | J41: =RC[-1]/35*28 -> 10400 | K41: =RC[-5]*60 -> 13320 | L41: =RC[-3]&"/3600*(nPatrolSec+3)*(1000+nGuanQia)/1000" -> 13000/3600*(nPatrolSec+3)*(1000+nGuanQia)/1000 | M41: =RC[-3]&"/3600*(nPatrolSec+3)*(1000+nGuanQia)/1000" -> 10400/3600*(nPatrolSec+3)*(1000+nGuanQia)/1000 | N41: =RC[-3]&"/3600*(nPatrolSec+3)*(1000+nGuanQia)/1000" -> 13320/3600*(nPatrolSec+3)*(1000+nGuanQia)/1000 | O41: =RC[-6]&"/60*nMin*(1000+nGuanQia)/1000" -> 13000/60*nMin*(1000+nGuanQia)/1000 | P41: =RC[-6]&"/60*nMin*(1000+nGuanQia)/1000" -> 10400/60*nMin*(1000+nGuanQia)/1000 | Q41: =RC[-6]&"/60*nMin*(1000+nGuanQia)/1000" -> 13320/60*nMin*(1000+nGuanQia)/1000
B42: 14 | C42: 23 | D42: =INT((RC[-1]*35+200)*(1+2)/4*0.2) -> 150 | E42: =INT((RC[-2]*28+160)*(1+2)/4*0.2) -> 120 | F42: =INT(10000*0.1*(100+1)/100*(1+RC[-3]/200)*0.2) -> 225 | G42: 14 | H42: 23 | I42: =R[-1]C+250 -> 13250 | J42: =RC[-1]/35*28 -> 10600 | K42: =RC[-5]*60 -> 13500 | L42: =RC[-3]&"/3600*(nPatrolSec+3)*(1000+nGuanQia)/1000" -> 13250/3600*(nPatrolSec+3)*(1000+nGuanQia)/1000 | M42: =RC[-3]&"/3600*(nPatrolSec+3)*(1000+nGuanQia)/1000" -> 10600/3600*(nPatrolSec+3)*(1000+nGuanQia)/1000 | N42: =RC[-3]&"/3600*(nPatrolSec+3)*(1000+nGuanQia)/1000" -> 13500/3600*(nPatrolSec+3)*(1000+nGuanQia)/1000 | O42: =RC[-6]&"/60*nMin*(1000+nGuanQia)/1000" -> 13250/60*nMin*(1000+nGuanQia)/1000 | P42: =RC[-6]&"/60*nMin*(1000+nGuanQia)/1000" -> 10600/60*nMin*(1000+nGuanQia)/1000 | Q42: =RC[-6]&"/60*nMin*(1000+nGuanQia)/1000" -> 13500/60*nMin*(1000+nGuanQia)/1000
B43: 15 | C43: 26 | D43: =INT((RC[-1]*35+200)*(1+2)/4*0.2) -> 166 | E43: =INT((RC[-2]*28+160)*(1+2)/4*0.2) -> 133 | F43: =INT(10000*0.1*(100+1)/100*(1+RC[-3]/200)*0.2) -> 228 | G43: 15 | H43: 26 | I43: =R[-1]C+250 -> 13500 | J43: =RC[-1]/35*28 -> 10800 | K43: =RC[-5]*60 -> 13680 | L43: =RC[-3]&"/3600*(nPatrolSec+3)*(1000+nGuanQia)/1000" -> 13500/3600*(nPatrolSec+3)*(1000+nGuanQia)/1000 | M43: =RC[-3]&"/3600*(nPatrolSec+3)*(1000+nGuanQia)/1000" -> 10800/3600*(nPatrolSec+3)*(1000+nGuanQia)/1000 | N43: =RC[-3]&"/3600*(nPatrolSec+3)*(1000+nGuanQia)/1000" -> 13680/3600*(nPatrolSec+3)*(1000+nGuanQia)/1000 | O43: =RC[-6]&"/60*nMin*(1000+nGuanQia)/1000" -> 13500/60*nMin*(1000+nGuanQia)/1000 | P43: =RC[-6]&"/60*nMin*(1000+nGuanQia)/1000" -> 10800/60*nMin*(1000+nGuanQia)/1000 | Q43: =RC[-6]&"/60*nMin*(1000+nGuanQia)/1000" -> 13680/60*nMin*(1000+nGuanQia)/1000
B44: 16 | C44: 29 | D44: =INT((RC[-1]*35+200)*(1+2)/4*0.2) -> 182 | E44: =INT((RC[-2]*28+160)*(1+2)/4*0.2) -> 145 | F44: =INT(10000*0.1*(100+1)/100*(1+RC[-3]/200)*0.2) -> 231 | G44: 16 | H44: 29 | I44: =R[-1]C+250 -> 13750 | J44: =RC[-1]/35*28 -> 11000 | K44: =RC[-5]*60 -> 13860 | L44: =RC[-3]&"/3600*(nPatrolSec+3)*(1000+nGuanQia)/1000" -> 13750/3600*(nPatrolSec+3)*(1000+nGuanQia)/1000 | M44: =RC[-3]&"/3600*(nPatrolSec+3)*(1000+nGuanQia)/1000" -> 11000/3600*(nPatrolSec+3)*(1000+nGuanQia)/1000 | N44: =RC[-3]&"/3600*(nPatrolSec+3)*(1000+nGuanQia)/1000" -> 13860/3600*(nPatrolSec+3)*(1000+nGuanQia)/1000 | O44: =RC[-6]&"/60*nMin*(1000+nGuanQia)/1000" -> 13750/60*nMin*(1000+nGuanQia)/1000 | P44: =RC[-6]&"/60*nMin*(1000+nGuanQia)/1000" -> 11000/60*nMin*(1000+nGuanQia)/1000 | Q44: =RC[-6]&"/60*nMin*(1000+nGuanQia)/1000" -> 13860/60*nMin*(1000+nGuanQia)/1000
B45: 17 | C45: 32 | D45: =INT((RC[-1]*35+200)*(1+2)/4*0.2) -> 198 | E45: =INT((RC[-2]*28+160)*(1+2)/4*0.2) -> 158 | F45: =INT(10000*0.1*(100+1)/100*(1+RC[-3]/200)*0.2) -> 234 | G45: 17 | H45: 32 | I45: =R[-1]C+250 -> 14000 | J45: =RC[-1]/35*28 -> 11200 | K45: =RC[-5]*60 -> 14040 | L45: =RC[-3]&"/3600*(nPatrolSec+3)*(1000+nGuanQia)/1000" -> 14000/3600*(nPatrolSec+3)*(1000+nGuanQia)/1000 | M45: =RC[-3]&"/3600*(nPatrolSec+3)*(1000+nGuanQia)/1000" -> 11200/3600*(nPatrolSec+3)*(1000+nGuanQia)/1000 | N45: =RC[-3]&"/3600*(nPatrolSec+3)*(1000+nGuanQia)/1000" -> 14040/3600*(nPatrolSec+3)*(1000+nGuanQia)/1000 | O45: =RC[-6]&"/60*nMin*(1000+nGuanQia)/1000" -> 14000/60*nMin*(1000+nGuanQia)/1000 | P45: =RC[-6]&"/60*nMin*(1000+nGuanQia)/1000" -> 11200/60*nMin*(1000+nGuanQia)/1000 | Q45: =RC[-6]&"/60*nMin*(1000+nGuanQia)/1000" -> 14040/60*nMin*(1000+nGuanQia)/1000
B46: 18 | C46: 35 | D46: =INT((RC[-1]*35+200)*(1+2)/4*0.2) -> 213 | E46: =INT((RC[-2]*28+160)*(1+2)/4*0.2) -> 171 | F46: =INT(10000*0.1*(100+1)/100*(1+RC[-3]/200)*0.2) -> 237 | G46: 18 | H46: 35 | I46: =R[-1]C+250 -> 14250 | J46: =RC[-1]/35*28 -> 11400 | K46: =RC[-5]*60 -> 14220 | L46: =RC[-3]&"/3600*(nPatrolSec+3)*(1000+nGuanQia)/1000" -> 14250/3600*(nPatrolSec+3)*(1000+nGuanQia)/1000 | M46: =RC[-3]&"/3600*(nPatrolSec+3)*(1000+nGuanQia)/1000" -> 11400/3600*(nPatrolSec+3)*(1000+nGuanQia)/1000 | N46: =RC[-3]&"/3600*(nPatrolSec+3)*(1000+nGuanQia)/1000" -> 14220/3600*(nPatrolSec+3)*(1000+nGuanQia)/1000 | O46: =RC[-6]&"/60*nMin*(1000+nGuanQia)/1000" -> 14250/60*nMin*(1000+nGuanQia)/1000 | P46: =RC[-6]&"/60*nMin*(1000+nGuanQia)/1000" -> 11400/60*nMin*(1000+nGuanQia)/1000 | Q46: =RC[-6]&"/60*nMin*(1000+nGuanQia)/1000" -> 14220/60*nMin*(1000+nGuanQia)/1000
B47: 19 | C47: 38 | D47: =INT((RC[-1]*35+200)*(1+2)/4*0.2) -> 229 | E47: =INT((RC[-2]*28+160)*(1+2)/4*0.2) -> 183 | F47: =INT(10000*0.1*(100+1)/100*(1+RC[-3]/200)*0.2) -> 240 | G47: 19 | H47: 38 | I47: =R[-1]C+250 -> 14500 | J47: =RC[-1]/35*28 -> 11600 | K47: =RC[-5]*60 -> 14400 | L47: =RC[-3]&"/3600*(nPatrolSec+3)*(1000+nGuanQia)/1000" -> 14500/3600*(nPatrolSec+3)*(1000+nGuanQia)/1000 | M47: =RC[-3]&"/3600*(nPatrolSec+3)*(1000+nGuanQia)/1000" -> 11600/3600*(nPatrolSec+3)*(1000+nGuanQia)/1000 | N47: =RC[-3]&"/3600*(nPatrolSec+3)*(1000+nGuanQia)/1000" -> 14400/3600*(nPatrolSec+3)*(1000+nGuanQia)/1000 | O47: =RC[-6]&"/60*nMin*(1000+nGuanQia)/1000" -> 14500/60*nMin*(1000+nGuanQia)/1000 | P47: =RC[-6]&"/60*nMin*(1000+nGuanQia)/1000" -> 11600/60*nMin*(1000+nGuanQia)/1000 | Q47: =RC[-6]&"/60*nMin*(1000+nGuanQia)/1000" -> 14400/60*nMin*(1000+nGuanQia)/1000
B48: 20 | C48: 40 | D48: =INT((RC[-1]*35+200)*(1+2)/4*0.2) -> 240 | E48: =INT((RC[-2]*28+160)*(1+2)/4*0.2) -> 192 | F48: =INT(10000*0.1*(100+1)/100*(1+RC[-3]/200)*0.2) -> 242 | G48: 20 | H48: 40 | I48: =R[-1]C+250 -> 14750 | J48: =RC[-1]/35*28 -> 11800 | K48: =RC[-5]*60 -> 14520 | L48: =RC[-3]&"/3600*(nPatrolSec+3)*(1000+nGuanQia)/1000" -> 14750/3600*(nPatrolSec+3)*(1000+nGuanQia)/1000 | M48: =RC[-3]&"/3600*(nPatrolSec+3)*(1000+nGuanQia)/1000" -> 11800/3600*(nPatrolSec+3)*(1000+nGuanQia)/1000 | N48: =RC[-3]&"/3600*(nPatrolSec+3)*(1000+nGuanQia)/1000" -> 14520/3600*(nPatrolSec+3)*(1000+nGuanQia)/1000 | O48: =RC[-6]&"/60*nMin*(1000+nGuanQia)/1000" -> 14750/60*nMin*(1000+nGuanQia)/1000 | P48: =RC[-6]&"/60*nMin*(1000+nGuanQia)/1000" -> 11800/60*nMin*(1000+nGuanQia)/1000 | Q48: =RC[-6]&"/60*nMin*(1000+nGuanQia)/1000" -> 14520/60*nMin*(1000+nGuanQia)/1000
B49: 21 | C49: 41 | D49: =INT((RC[-1]*35+200)*(1+2)/4*0.2) -> 245 | E49: =INT((RC[-2]*28+160)*(1+2)/4*0.2) -> 196 | F49: =INT(10000*0.1*(100+1)/100*(1+RC[-3]/200)*0.2) -> 243 | G49: 21 | H49: 41 | I49: =R[-1]C+250 -> 15000 | J49: =RC[-1]/35*28 -> 12000 | K49: =RC[-5]*60 -> 14580 | L49: =RC[-3]&"/3600*(nPatrolSec+3)*(1000+nGuanQia)/1000" -> 15000/3600*(nPatrolSec+3)*(1000+nGuanQia)/1000 | M49: =RC[-3]&"/3600*(nPatrolSec+3)*(1000+nGuanQia)/1000" -> 12000/3600*(nPatrolSec+3)*(1000+nGuanQia)/1000 | N49: =RC[-3]&"/3600*(nPatrolSec+3)*(1000+nGuanQia)/1000" -> 14580/3600*(nPatrolSec+3)*(1000+nGuanQia)/1000 | O49: =RC[-6]&"/60*nMin*(1000+nGuanQia)/1000" -> 15000/60*nMin*(1000+nGuanQia)/1000 | P49: =RC[-6]&"/60*nMin*(1000+nGuanQia)/1000" -> 12000/60*nMin*(1000+nGuanQia)/1000 | Q49: =RC[-6]&"/60*nMin*(1000+nGuanQia)/1000" -> 14580/60*nMin*(1000+nGuanQia)/1000
B50: 22 | C50: 42 | D50: =INT((RC[-1]*35+200)*(1+2)/4*0.2) -> 250 | E50: =INT((RC[-2]*28+160)*(1+2)/4*0.2) -> 200 | F50: =INT(10000*0.1*(100+1)/100*(1+RC[-3]/200)*0.2) -> 244 | G50: 22 | H50: 42 | I50: =R[-1]C+250 -> 15250 | J50: =RC[-1]/35*28 -> 12200 | K50: =RC[-5]*60 -> 14640 | L50: =RC[-3]&"/3600*(nPatrolSec+3)*(1000+nGuanQia)/1000" -> 15250/3600*(nPatrolSec+3)*(1000+nGuanQia)/1000 | M50: =RC[-3]&"/3600*(nPatrolSec+3)*(1000+nGuanQia)/1000" -> 12200/3600*(nPatrolSec+3)*(1000+nGuanQia)/1000 | N50: =RC[-3]&"/3600*(nPatrolSec+3)*(1000+nGuanQia)/1000" -> 14640/3600*(nPatrolSec+3)*(1000+nGuanQia)/1000 | O50: =RC[-6]&"/60*nMin*(1000+nGuanQia)/1000" -> 15250/60*nMin*(1000+nGuanQia)/1000 | P50: =RC[-6]&"/60*nMin*(1000+nGuanQia)/1000" -> 12200/60*nMin*(1000+nGuanQia)/1000 | Q50: =RC[-6]&"/60*nMin*(1000+nGuanQia)/1000" -> 14640/60*nMin*(1000+nGuanQia)/1000
B51: 23 | C51: 43 | D51: =INT((RC[-1]*35+200)*(1+2)/4*0.2) -> 255 | E51: =INT((RC[-2]*28+160)*(1+2)/4*0.2) -> 204 | F51: =INT(10000*0.1*(100+1)/100*(1+RC[-3]/200)*0.2) -> 245 | G51: 23 | H51: 43 | I51: =R[-1]C+250 -> 15500 | J51: =RC[-1]/35*28 -> 12400 | K51: =RC[-5]*60 -> 14700 | L51: =RC[-3]&"/3600*(nPatrolSec+3)*(1000+nGuanQia)/1000" -> 15500/3600*(nPatrolSec+3)*(1000+nGuanQia)/1000 | M51: =RC[-3]&"/3600*(nPatrolSec+3)*(1000+nGuanQia)/1000" -> 12400/3600*(nPatrolSec+3)*(1000+nGuanQia)/1000 | N51: =RC[-3]&"/3600*(nPatrolSec+3)*(1000+nGuanQia)/1000" -> 14700/3600*(nPatrolSec+3)*(1000+nGuanQia)/1000 | O51: =RC[-6]&"/60*nMin*(1000+nGuanQia)/1000" -> 15500/60*nMin*(1000+nGuanQia)/1000 | P51: =RC[-6]&"/60*nMin*(1000+nGuanQia)/1000" -> 12400/60*nMin*(1000+nGuanQia)/1000 | Q51: =RC[-6]&"/60*nMin*(1000+nGuanQia)/1000" -> 14700/60*nMin*(1000+nGuanQia)/1000
B52: 24 | C52: 44 | D52: =INT((RC[-1]*35+200)*(1+2)/4*0.2) -> 261 | E52: =INT((RC[-2]*28+160)*(1+2)/4*0.2) -> 208 | F52: =INT(10000*0.1*(100+1)/100*(1+RC[-3]/200)*0.2) -> 246 | G52: 24 | H52: 44 | I52: =R[-1]C+250 -> 15750 | J52: =RC[-1]/35*28 -> 12600 | K52: =RC[-5]*60 -> 14760 | L52: =RC[-3]&"/3600*(nPatrolSec+3)*(1000+nGuanQia)/1000" -> 15750/3600*(nPatrolSec+3)*(1000+nGuanQia)/1000 | M52: =RC[-3]&"/3600*(nPatrolSec+3)*(1000+nGuanQia)/1000" -> 12600/3600*(nPatrolSec+3)*(1000+nGuanQia)/1000 | N52: =RC[-3]&"/3600*(nPatrolSec+3)*(1000+nGuanQia)/1000" -> 14760/3600*(nPatrolSec+3)*(1000+nGuanQia)/1000 | O52: =RC[-6]&"/60*nMin*(1000+nGuanQia)/1000" -> 15750/60*nMin*(1000+nGuanQia)/1000 | P52: =RC[-6]&"/60*nMin*(1000+nGuanQia)/1000" -> 12600/60*nMin*(1000+nGuanQia)/1000 | Q52: =RC[-6]&"/60*nMin*(1000+nGuanQia)/1000" -> 14760/60*nMin*(1000+nGuanQia)/1000
B53: 25 | C53: 45 | D53: =INT((RC[-1]*35+200)*(1+2)/4*0.2) -> 266 | E53: =INT((RC[-2]*28+160)*(1+2)/4*0.2) -> 213 | F53: =INT(10000*0.1*(100+1)/100*(1+RC[-3]/200)*0.2) -> 247 | G53: 25 | H53: 45 | I53: =R[-1]C+250 -> 16000 | J53: =RC[-1]/35*28 -> 12800 | K53: =RC[-5]*60 -> 14820 | L53: =RC[-3]&"/3600*(nPatrolSec+3)*(1000+nGuanQia)/1000" -> 16000/3600*(nPatrolSec+3)*(1000+nGuanQia)/1000 | M53: =RC[-3]&"/3600*(nPatrolSec+3)*(1000+nGuanQia)/1000" -> 12800/3600*(nPatrolSec+3)*(1000+nGuanQia)/1000 | N53: =RC[-3]&"/3600*(nPatrolSec+3)*(1000+nGuanQia)/1000" -> 14820/3600*(nPatrolSec+3)*(1000+nGuanQia)/1000 | O53: =RC[-6]&"/60*nMin*(1000+nGuanQia)/1000" -> 16000/60*nMin*(1000+nGuanQia)/1000 | P53: =RC[-6]&"/60*nMin*(1000+nGuanQia)/1000" -> 12800/60*nMin*(1000+nGuanQia)/1000 | Q53: =RC[-6]&"/60*nMin*(1000+nGuanQia)/1000" -> 14820/60*nMin*(1000+nGuanQia)/1000
B54: 26 | C54: 46 | D54: =INT((RC[-1]*35+200)*(1+2)/4*0.2) -> 271 | E54: =INT((RC[-2]*28+160)*(1+2)/4*0.2) -> 217 | F54: =INT(10000*0.1*(100+1)/100*(1+RC[-3]/200)*0.2) -> 248 | G54: 26 | H54: 46 | I54: =R[-1]C+250 -> 16250 | J54: =RC[-1]/35*28 -> 13000 | K54: =RC[-5]*60 -> 14880 | L54: =RC[-3]&"/3600*(nPatrolSec+3)*(1000+nGuanQia)/1000" -> 16250/3600*(nPatrolSec+3)*(1000+nGuanQia)/1000 | M54: =RC[-3]&"/3600*(nPatrolSec+3)*(1000+nGuanQia)/1000" -> 13000/3600*(nPatrolSec+3)*(1000+nGuanQia)/1000 | N54: =RC[-3]&"/3600*(nPatrolSec+3)*(1000+nGuanQia)/1000" -> 14880/3600*(nPatrolSec+3)*(1000+nGuanQia)/1000 | O54: =RC[-6]&"/60*nMin*(1000+nGuanQia)/1000" -> 16250/60*nMin*(1000+nGuanQia)/1000 | P54: =RC[-6]&"/60*nMin*(1000+nGuanQia)/1000" -> 13000/60*nMin*(1000+nGuanQia)/1000 | Q54: =RC[-6]&"/60*nMin*(1000+nGuanQia)/1000" -> 14880/60*nMin*(1000+nGuanQia)/1000
B55: 27 | C55: 47 | D55: =INT((RC[-1]*35+200)*(1+2)/4*0.2) -> 276 | E55: =INT((RC[-2]*28+160)*(1+2)/4*0.2) -> 221 | F55: =INT(10000*0.1*(100+1)/100*(1+RC[-3]/200)*0.2) -> 249 | G55: 27 | H55: 47 | I55: =R[-1]C+250 -> 16500 | J55: =RC[-1]/35*28 -> 13200 | K55: =RC[-5]*60 -> 14940 | L55: =RC[-3]&"/3600*(nPatrolSec+3)*(1000+nGuanQia)/1000" -> 16500/3600*(nPatrolSec+3)*(1000+nGuanQia)/1000 | M55: =RC[-3]&"/3600*(nPatrolSec+3)*(1000+nGuanQia)/1000" -> 13200/3600*(nPatrolSec+3)*(1000+nGuanQia)/1000 | N55: =RC[-3]&"/3600*(nPatrolSec+3)*(1000+nGuanQia)/1000" -> 14940/3600*(nPatrolSec+3)*(1000+nGuanQia)/1000 | O55: =RC[-6]&"/60*nMin*(1000+nGuanQia)/1000" -> 16500/60*nMin*(1000+nGuanQia)/1000 | P55: =RC[-6]&"/60*nMin*(1000+nGuanQia)/1000" -> 13200/60*nMin*(1000+nGuanQia)/1000 | Q55: =RC[-6]&"/60*nMin*(1000+nGuanQia)/1000" -> 14940/60*nMin*(1000+nGuanQia)/1000
B56: 28 | C56: 48 | D56: =INT((RC[-1]*35+200)*(1+2)/4*0.2) -> 282 | E56: =INT((RC[-2]*28+160)*(1+2)/4*0.2) -> 225 | F56: =INT(10000*0.1*(100+1)/100*(1+RC[-3]/200)*0.2) -> 250 | G56: 28 | H56: 48 | I56: =R[-1]C+250 -> 16750 | J56: =RC[-1]/35*28 -> 13400 | K56: =RC[-5]*60 -> 15000 | L56: =RC[-3]&"/3600*(nPatrolSec+3)*(1000+nGuanQia)/1000" -> 16750/3600*(nPatrolSec+3)*(1000+nGuanQia)/1000 | M56: =RC[-3]&"/3600*(nPatrolSec+3)*(1000+nGuanQia)/1000" -> 13400/3600*(nPatrolSec+3)*(1000+nGuanQia)/1000 | N56: =RC[-3]&"/3600*(nPatrolSec+3)*(1000+nGuanQia)/1000" -> 15000/3600*(nPatrolSec+3)*(1000+nGuanQia)/1000 | O56: =RC[-6]&"/60*nMin*(1000+nGuanQia)/1000" -> 16750/60*nMin*(1000+nGuanQia)/1000 | P56: =RC[-6]&"/60*nMin*(1000+nGuanQia)/1000" -> 13400/60*nMin*(1000+nGuanQia)/1000 | Q56: =RC[-6]&"/60*nMin*(1000+nGuanQia)/1000" -> 15000/60*nMin*(1000+nGuanQia)/1000
B57: 29 | C57: 49 | D57: =INT((RC[-1]*35+200)*(1+2)/4*0.2) -> 287 | E57: =INT((RC[-2]*28+160)*(1+2)/4*0.2) -> 229 | F57: =INT(10000*0.1*(100+1)/100*(1+RC[-3]/200)*0.2) -> 251 | G57: 29 | H57: 49 | I57: =R[-1]C+250 -> 17000 | J57: =RC[-1]/35*28 -> 13600 | K57: =RC[-5]*60 -> 15060 | L57: =RC[-3]&"/3600*(nPatrolSec+3)*(1000+nGuanQia)/1000" -> 17000/3600*(nPatrolSec+3)*(1000+nGuanQia)/1000 | M57: =RC[-3]&"/3600*(nPatrolSec+3)*(1000+nGuanQia)/1000" -> 13600/3600*(nPatrolSec+3)*(1000+nGuanQia)/1000 | N57: =RC[-3]&"/3600*(nPatrolSec+3)*(1000+nGuanQia)/1000" -> 15060/3600*(nPatrolSec+3)*(1000+nGuanQia)/1000 | O57: =RC[-6]&"/60*nMin*(1000+nGuanQia)/1000" -> 17000/60*nMin*(1000+nGuanQia)/1000 | P57: =RC[-6]&"/60*nMin*(1000+nGuanQia)/1000" -> 13600/60*nMin*(1000+nGuanQia)/1000 | Q57: =RC[-6]&"/60*nMin*(1000+nGuanQia)/1000" -> 15060/60*nMin*(1000+nGuanQia)/1000
B58: 30 | C58: 50 | D58: =INT((RC[-1]*35+200)*(1+2)/4*0.2) -> 292 | E58: =INT((RC[-2]*28+160)*(1+2)/4*0.2) -> 234 | F58: =INT(10000*0.1*(100+1)/100*(1+RC[-3]/200)*0.2) -> 252 | G58: 30 | H58: 50 | I58: =R[-1]C+250 -> 17250 | J58: =RC[-1]/35*28 -> 13800 | K58: =RC[-5]*60 -> 15120 | L58: =RC[-3]&"/3600*(nPatrolSec+3)*(1000+nGuanQia)/1000" -> 17250/3600*(nPatrolSec+3)*(1000+nGuanQia)/1000 | M58: =RC[-3]&"/3600*(nPatrolSec+3)*(1000+nGuanQia)/1000" -> 13800/3600*(nPatrolSec+3)*(1000+nGuanQia)/1000 | N58: =RC[-3]&"/3600*(nPatrolSec+3)*(1000+nGuanQia)/1000" -> 15120/3600*(nPatrolSec+3)*(1000+nGuanQia)/1000 | O58: =RC[-6]&"/60*nMin*(1000+nGuanQia)/1000" -> 17250/60*nMin*(1000+nGuanQia)/1000 | P58: =RC[-6]&"/60*nMin*(1000+nGuanQia)/1000" -> 13800/60*nMin*(1000+nGuanQia)/1000 | Q58: =RC[-6]&"/60*nMin*(1000+nGuanQia)/1000" -> 15120/60*nMin*(1000+nGuanQia)/1000
B59: 31 | C59: 51 | D59: =INT((RC[-1]*35+200)*(1+2)/4*0.2) -> 297 | E59: =INT((RC[-2]*28+160)*(1+2)/4*0.2) -> 238 | F59: =INT(10000*0.1*(100+1)/100*(1+RC[-3]/200)*0.2) -> 253 | G59: 31 | H59: 51 | I59: =R[-1]C+250 -> 17500 | J59: =RC[-1]/35*28 -> 14000 | K59: =RC[-5]*60 -> 15180 | L59: =RC[-3]&"/3600*(nPatrolSec+3)*(1000+nGuanQia)/1000" -> 17500/3600*(nPatrolSec+3)*(1000+nGuanQia)/1000 | M59: =RC[-3]&"/3600*(nPatrolSec+3)*(1000+nGuanQia)/1000" -> 14000/3600*(nPatrolSec+3)*(1000+nGuanQia)/1000 | N59: =RC[-3]&"/3600*(nPatrolSec+3)*(1000+nGuanQia)/1000" -> 15180/3600*(nPatrolSec+3)*(1000+nGuanQia)/1000 | O59: =RC[-6]&"/60*nMin*(1000+nGuanQia)/1000" -> 17500/60*nMin*(1000+nGuanQia)/1000 | P59: =RC[-6]&"/60*nMin*(1000+nGuanQia)/1000" -> 14000/60*nMin*(1000+nGuanQia)/1000 | Q59: =RC[-6]&"/60*nMin*(1000+nGuanQia)/1000" -> 15180/60*nMin*(1000+nGuanQia)/1000
B60: 32 | C60: 52 | D60: =INT((RC[-1]*35+200)*(1+2)/4*0.2) -> 303 | E60: =INT((RC[-2]*28+160)*(1+2)/4*0.2) -> 242 | F60: =INT(10000*0.1*(100+1)/100*(1+RC[-3]/200)*0.2) -> 254 | G60: 32 | H60: 52 | I60: =R[-1]C+250 -> 17750 | J60: =RC[-1]/35*28 -> 14200 | K60: =RC[-5]*60 -> 15240 | L60: =RC[-3]&"/3600*(nPatrolSec+3)*(1000+nGuanQia)/1000" -> 17750/3600*(nPatrolSec+3)*(1000+nGuanQia)/1000 | M60: =RC[-3]&"/3600*(nPatrolSec+3)*(1000+nGuanQia)/1000" -> 14200/3600*(nPatrolSec+3)*(1000+nGuanQia)/1000 | N60: =RC[-3]&"/3600*(nPatrolSec+3)*(1000+nGuanQia)/1000" -> 15240/3600*(nPatrolSec+3)*(1000+nGuanQia)/1000 | O60: =RC[-6]&"/60*nMin*(1000+nGuanQia)/1000" -> 17750/60*nMin*(1000+nGuanQia)/1000 | P60: =RC[-6]&"/60*nMin*(1000+nGuanQia)/1000" -> 14200/60*nMin*(1000+nGuanQia)/1000 | Q60: =RC[-6]&"/60*nMin*(1000+nGuanQia)/1000" -> 15240/60*nMin*(1000+nGuanQia)/1000
B61: 33 | C61: 53 | D61: =INT((RC[-1]*35+200)*(1+2)/4*0.2) -> 308 | E61: =INT((RC[-2]*28+160)*(1+2)/4*0.2) -> 246 | F61: =INT(10000*0.1*(100+1)/100*(1+RC[-3]/200)*0.2) -> 255 | G61: 33 | H61: 53 | I61: =R[-1]C+250 -> 18000 | J61: =RC[-1]/35*28 -> 14400.000000000002 | K61: =RC[-5]*60 -> 15300 | L61: =RC[-3]&"/3600*(nPatrolSec+3)*(1000+nGuanQia)/1000" -> 18000/3600*(nPatrolSec+3)*(1000+nGuanQia)/1000 | M61: =RC[-3]&"/3600*(nPatrolSec+3)*(1000+nGuanQia)/1000" -> 14400/3600*(nPatrolSec+3)*(1000+nGuanQia)/1000 | N61: =RC[-3]&"/3600*(nPatrolSec+3)*(1000+nGuanQia)/1000" -> 15300/3600*(nPatrolSec+3)*(1000+nGuanQia)/1000 | O61: =RC[-6]&"/60*nMin*(1000+nGuanQia)/1000" -> 18000/60*nMin*(1000+nGuanQia)/1000 | P61: =RC[-6]&"/60*nMin*(1000+nGuanQia)/1000" -> 14400/60*nMin*(1000+nGuanQia)/1000 | Q61: =RC[-6]&"/60*nMin*(1000+nGuanQia)/1000" -> 15300/60*nMin*(1000+nGuanQia)/1000
B62: 34 | C62: 54 | D62: =INT((RC[-1]*35+200)*(1+2)/4*0.2) -> 313 | E62: =INT((RC[-2]*28+160)*(1+2)/4*0.2) -> 250 | F62: =INT(10000*0.1*(100+1)/100*(1+RC[-3]/200)*0.2) -> 256 | G62: 34 | H62: 54 | I62: =R[-1]C+250 -> 18250 | J62: =RC[-1]/35*28 -> 14600 | K62: =RC[-5]*60 -> 15360 | L62: =RC[-3]&"/3600*(nPatrolSec+3)*(1000+nGuanQia)/1000" -> 18250/3600*(nPatrolSec+3)*(1000+nGuanQia)/1000 | M62: =RC[-3]&"/3600*(nPatrolSec+3)*(1000+nGuanQia)/1000" -> 14600/3600*(nPatrolSec+3)*(1000+nGuanQia)/1000 | N62: =RC[-3]&"/3600*(nPatrolSec+3)*(1000+nGuanQia)/1000" -> 15360/3600*(nPatrolSec+3)*(1000+nGuanQia)/1000 | O62: =RC[-6]&"/60*nMin*(1000+nGuanQia)/1000" -> 18250/60*nMin*(1000+nGuanQia)/1000 | P62: =RC[-6]&"/60*nMin*(1000+nGuanQia)/1000" -> 14600/60*nMin*(1000+nGuanQia)/1000 | Q62: =RC[-6]&"/60*nMin*(1000+nGuanQia)/1000" -> 15360/60*nMin*(1000+nGuanQia)/1000
B63: 35 | C63: 55 | D63: =INT((RC[-1]*35+200)*(1+2)/4*0.2) -> 318 | E63: =INT((RC[-2]*28+160)*(1+2)/4*0.2) -> 255 | F63: =INT(10000*0.1*(100+1)/100*(1+RC[-3]/200)*0.2) -> 257 | G63: 35 | H63: 55 | I63: =R[-1]C+250 -> 18500 | J63: =RC[-1]/35*28 -> 14800 | K63: =RC[-5]*60 -> 15420 | L63: =RC[-3]&"/3600*(nPatrolSec+3)*(1000+nGuanQia)/1000" -> 18500/3600*(nPatrolSec+3)*(1000+nGuanQia)/1000 | M63: =RC[-3]&"/3600*(nPatrolSec+3)*(1000+nGuanQia)/1000" -> 14800/3600*(nPatrolSec+3)*(1000+nGuanQia)/1000 | N63: =RC[-3]&"/3600*(nPatrolSec+3)*(1000+nGuanQia)/1000" -> 15420/3600*(nPatrolSec+3)*(1000+nGuanQia)/1000 | O63: =RC[-6]&"/60*nMin*(1000+nGuanQia)/1000" -> 18500/60*nMin*(1000+nGuanQia)/1000 | P63: =RC[-6]&"/60*nMin*(1000+nGuanQia)/1000" -> 14800/60*nMin*(1000+nGuanQia)/1000 | Q63: =RC[-6]&"/60*nMin*(1000+nGuanQia)/1000" -> 15420/60*nMin*(1000+nGuanQia)/1000
B64: 36 | C64: 56 | D64: =INT((RC[-1]*35+200)*(1+2)/4*0.2) -> 324 | E64: =INT((RC[-2]*28+160)*(1+2)/4*0.2) -> 259 | F64: =INT(10000*0.1*(100+1)/100*(1+RC[-3]/200)*0.2) -> 258 | G64: 36 | H64: 56 | I64: =R[-1]C+250 -> 18750 | J64: =RC[-1]/35*28 -> 14999.999999999998 | K64: =RC[-5]*60 -> 15480 | L64: =RC[-3]&"/3600*(nPatrolSec+3)*(1000+nGuanQia)/1000" -> 18750/3600*(nPatrolSec+3)*(1000+nGuanQia)/1000 | M64: =RC[-3]&"/3600*(nPatrolSec+3)*(1000+nGuanQia)/1000" -> 15000/3600*(nPatrolSec+3)*(1000+nGuanQia)/1000 | N64: =RC[-3]&"/3600*(nPatrolSec+3)*(1000+nGuanQia)/1000" -> 15480/3600*(nPatrolSec+3)*(1000+nGuanQia)/1000 | O64: =RC[-6]&"/60*nMin*(1000+nGuanQia)/1000" -> 18750/60*nMin*(1000+nGuanQia)/1000 | P64: =RC[-6]&"/60*nMin*(1000+nGuanQia)/1000" -> 15000/60*nMin*(1000+nGuanQia)/1000 | Q64: =RC[-6]&"/60*nMin*(1000+nGuanQia)/1000" -> 15480/60*nMin*(1000+nGuanQia)/1000
B65: 37 | C65: 57 | D65: =INT((RC[-1]*35+200)*(1+2)/4*0.2) -> 329 | E65: =INT((RC[-2]*28+160)*(1+2)/4*0.2) -> 263 | F65: =INT(10000*0.1*(100+1)/100*(1+RC[-3]/200)*0.2) -> 259 | G65: 37 | H65: 57 | I65: =R[-1]C+250 -> 19000 | J65: =RC[-1]/35*28 -> 15200 | K65: =RC[-5]*60 -> 15540 | L65: =RC[-3]&"/3600*(nPatrolSec+3)*(1000+nGuanQia)/1000" -> 19000/3600*(nPatrolSec+3)*(1000+nGuanQia)/1000 | M65: =RC[-3]&"/3600*(nPatrolSec+3)*(1000+nGuanQia)/1000" -> 15200/3600*(nPatrolSec+3)*(1000+nGuanQia)/1000 | N65: =RC[-3]&"/3600*(nPatrolSec+3)*(1000+nGuanQia)/1000" -> 15540/3600*(nPatrolSec+3)*(1000+nGuanQia)/1000 | O65: =RC[-6]&"/60*nMin*(1000+nGuanQia)/1000" -> 19000/60*nMin*(1000+nGuanQia)/1000 | P65: =RC[-6]&"/60*nMin*(1000+nGuanQia)/1000" -> 15200/60*nMin*(1000+nGuanQia)/1000 | Q65: =RC[-6]&"/60*nMin*(1000+nGuanQia)/1000" -> 15540/60*nMin*(1000+nGuanQia)/1000
B66: 38 | C66: 58 | D66: =INT((RC[-1]*35+200)*(1+2)/4*0.2) -> 334 | E66: =INT((RC[-2]*28+160)*(1+2)/4*0.2) -> 267 | F66: =INT(10000*0.1*(100+1)/100*(1+RC[-3]/200)*0.2) -> 260 | G66: 38 | H66: 58 | I66: =R[-1]C+250 -> 19250 | J66: =RC[-1]/35*28 -> 15400 | K66: =RC[-5]*60 -> 15600 | L66: =RC[-3]&"/3600*(nPatrolSec+3)*(1000+nGuanQia)/1000" -> 19250/3600*(nPatrolSec+3)*(1000+nGuanQia)/1000 | M66: =RC[-3]&"/3600*(nPatrolSec+3)*(1000+nGuanQia)/1000" -> 15400/3600*(nPatrolSec+3)*(1000+nGuanQia)/1000 | N66: =RC[-3]&"/3600*(nPatrolSec+3)*(1000+nGuanQia)/1000" -> 15600/3600*(nPatrolSec+3)*(1000+nGuanQia)/1000 | O66: =RC[-6]&"/60*nMin*(1000+nGuanQia)/1000" -> 19250/60*nMin*(1000+nGuanQia)/1000 | P66: =RC[-6]&"/60*nMin*(1000+nGuanQia)/1000" -> 15400/60*nMin*(1000+nGuanQia)/1000 | Q66: =RC[-6]&"/60*nMin*(1000+nGuanQia)/1000" -> 15600/60*nMin*(1000+nGuanQia)/1000
B67: 39 | C67: 59 | D67: =INT((RC[-1]*35+200)*(1+2)/4*0.2) -> 339 | E67: =INT((RC[-2]*28+160)*(1+2)/4*0.2) -> 271 | F67: =INT(10000*0.1*(100+1)/100*(1+RC[-3]/200)*0.2) -> 261 | G67: 39 | H67: 59 | I67: =R[-1]C+250 -> 19500 | J67: =RC[-1]/35*28 -> 15600 | K67: =RC[-5]*60 -> 15660 | L67: =RC[-3]&"/3600*(nPatrolSec+3)*(1000+nGuanQia)/1000" -> 19500/3600*(nPatrolSec+3)*(1000+nGuanQia)/1000 | M67: =RC[-3]&"/3600*(nPatrolSec+3)*(1000+nGuanQia)/1000" -> 15600/3600*(nPatrolSec+3)*(1000+nGuanQia)/1000 | N67: =RC[-3]&"/3600*(nPatrolSec+3)*(1000+nGuanQia)/1000" -> 15660/3600*(nPatrolSec+3)*(1000+nGuanQia)/1000 | O67: =RC[-6]&"/60*nMin*(1000+nGuanQia)/1000" -> 19500/60*nMin*(1000+nGuanQia)/1000 | P67: =RC[-6]&"/60*nMin*(1000+nGuanQia)/1000" -> 15600/60*nMin*(1000+nGuanQia)/1000 | Q67: =RC[-6]&"/60*nMin*(1000+nGuanQia)/1000" -> 15660/60*nMin*(1000+nGuanQia)/1000
B68: 40 | C68: 60 | D68: =INT((RC[-1]*35+200)*(1+2)/4*0.2) -> 345 | E68: =INT((RC[-2]*28+160)*(1+2)/4*0.2) -> 276 | F68: =INT(10000*0.1*(100+1)/100*(1+RC[-3]/200)*0.2) -> 262 | G68: 40 | H68: 60 | I68: =RC[-5]*60 -> 20700 | J68: =RC[-1]/35*28 -> 16560 | K68: =RC[-5]*60 -> 15720 | L68: =RC[-3]&"/3600*(nPatrolSec+3)*(1000+nGuanQia)/1000" -> 20700/3600*(nPatrolSec+3)*(1000+nGuanQia)/1000 | M68: =RC[-3]&"/3600*(nPatrolSec+3)*(1000+nGuanQia)/1000" -> 16560/3600*(nPatrolSec+3)*(1000+nGuanQia)/1000 | N68: =RC[-3]&"/3600*(nPatrolSec+3)*(1000+nGuanQia)/1000" -> 15720/3600*(nPatrolSec+3)*(1000+nGuanQia)/1000 | O68: =RC[-6]&"/60*nMin*(1000+nGuanQia)/1000" -> 20700/60*nMin*(1000+nGuanQia)/1000 | P68: =RC[-6]&"/60*nMin*(1000+nGuanQia)/1000" -> 16560/60*nMin*(1000+nGuanQia)/1000 | Q68: =RC[-6]&"/60*nMin*(1000+nGuanQia)/1000" -> 15720/60*nMin*(1000+nGuanQia)/1000
B69: 41 | C69: 61 | D69: =INT((RC[-1]*35+200)*(1+2)/4*0.2) -> 350 | E69: =INT((RC[-2]*28+160)*(1+2)/4*0.2) -> 280 | F69: =INT(10000*0.1*(100+1)/100*(1+RC[-3]/200)*0.2) -> 263 | G69: 41 | H69: 61 | I69: =RC[-5]*60 -> 21000 | J69: =RC[-5]*60 -> 16800 | K69: =RC[-5]*60 -> 15780 | L69: =RC[-3]&"/3600*(nPatrolSec+3)*(1000+nGuanQia)/1000" -> 21000/3600*(nPatrolSec+3)*(1000+nGuanQia)/1000 | M69: =RC[-3]&"/3600*(nPatrolSec+3)*(1000+nGuanQia)/1000" -> 16800/3600*(nPatrolSec+3)*(1000+nGuanQia)/1000 | N69: =RC[-3]&"/3600*(nPatrolSec+3)*(1000+nGuanQia)/1000" -> 15780/3600*(nPatrolSec+3)*(1000+nGuanQia)/1000 | O69: =RC[-6]&"/60*nMin*(1000+nGuanQia)/1000" -> 21000/60*nMin*(1000+nGuanQia)/1000 | P69: =RC[-6]&"/60*nMin*(1000+nGuanQia)/1000" -> 16800/60*nMin*(1000+nGuanQia)/1000 | Q69: =RC[-6]&"/60*nMin*(1000+nGuanQia)/1000" -> 15780/60*nMin*(1000+nGuanQia)/1000
B70: 42 | C70: 62 | D70: =INT((RC[-1]*35+200)*(1+2)/4*0.2) -> 355 | E70: =INT((RC[-2]*28+160)*(1+2)/4*0.2) -> 284 | F70: =INT(10000*0.1*(100+1)/100*(1+RC[-3]/200)*0.2) -> 264 | G70: 42 | H70: 62 | I70: =RC[-5]*60 -> 21300 | J70: =RC[-5]*60 -> 17040 | K70: =RC[-5]*60 -> 15840 | L70: =RC[-3]&"/3600*(nPatrolSec+3)*(1000+nGuanQia)/1000" -> 21300/3600*(nPatrolSec+3)*(1000+nGuanQia)/1000 | M70: =RC[-3]&"/3600*(nPatrolSec+3)*(1000+nGuanQia)/1000" -> 17040/3600*(nPatrolSec+3)*(1000+nGuanQia)/1000 | N70: =RC[-3]&"/3600*(nPatrolSec+3)*(1000+nGuanQia)/1000" -> 15840/3600*(nPatrolSec+3)*(1000+nGuanQia)/1000 | O70: =RC[-6]&"/60*nMin*(1000+nGuanQia)/1000" -> 21300/60*nMin*(1000+nGuanQia)/1000 | P70: =RC[-6]&"/60*nMin*(1000+nGuanQia)/1000" -> 17040/60*nMin*(1000+nGuanQia)/1000 | Q70: =RC[-6]&"/60*nMin*(1000+nGuanQia)/1000" -> 15840/60*nMin*(1000+nGuanQia)/1000
B71: 43 | C71: 63 | D71: =INT((RC[-1]*35+200)*(1+2)/4*0.2) -> 360 | E71: =INT((RC[-2]*28+160)*(1+2)/4*0.2) -> 288 | F71: =INT(10000*0.1*(100+1)/100*(1+RC[-3]/200)*0.2) -> 265 | G71: 43 | H71: 63 | I71: =RC[-5]*60 -> 21600 | J71: =RC[-5]*60 -> 17280 | K71: =RC[-5]*60 -> 15900 | L71: =RC[-3]&"/3600*(nPatrolSec+3)*(1000+nGuanQia)/1000" -> 21600/3600*(nPatrolSec+3)*(1000+nGuanQia)/1000 | M71: =RC[-3]&"/3600*(nPatrolSec+3)*(1000+nGuanQia)/1000" -> 17280/3600*(nPatrolSec+3)*(1000+nGuanQia)/1000 | N71: =RC[-3]&"/3600*(nPatrolSec+3)*(1000+nGuanQia)/1000" -> 15900/3600*(nPatrolSec+3)*(1000+nGuanQia)/1000 | O71: =RC[-6]&"/60*nMin*(1000+nGuanQia)/1000" -> 21600/60*nMin*(1000+nGuanQia)/1000 | P71: =RC[-6]&"/60*nMin*(1000+nGuanQia)/1000" -> 17280/60*nMin*(1000+nGuanQia)/1000 | Q71: =RC[-6]&"/60*nMin*(1000+nGuanQia)/1000" -> 15900/60*nMin*(1000+nGuanQia)/1000
B72: 44 | C72: 64 | D72: =INT((RC[-1]*35+200)*(1+2)/4*0.2) -> 366 | E72: =INT((RC[-2]*28+160)*(1+2)/4*0.2) -> 292 | F72: =INT(10000*0.1*(100+1)/100*(1+RC[-3]/200)*0.2) -> 266 | G72: 44 | H72: 64 | I72: =RC[-5]*60 -> 21960 | J72: =RC[-5]*60 -> 17520 | K72: =RC[-5]*60 -> 15960 | L72: =RC[-3]&"/3600*(nPatrolSec+3)*(1000+nGuanQia)/1000" -> 21960/3600*(nPatrolSec+3)*(1000+nGuanQia)/1000 | M72: =RC[-3]&"/3600*(nPatrolSec+3)*(1000+nGuanQia)/1000" -> 17520/3600*(nPatrolSec+3)*(1000+nGuanQia)/1000 | N72: =RC[-3]&"/3600*(nPatrolSec+3)*(1000+nGuanQia)/1000" -> 15960/3600*(nPatrolSec+3)*(1000+nGuanQia)/1000 | O72: =RC[-6]&"/60*nMin*(1000+nGuanQia)/1000" -> 21960/60*nMin*(1000+nGuanQia)/1000 | P72: =RC[-6]&"/60*nMin*(1000+nGuanQia)/1000" -> 17520/60*nMin*(1000+nGuanQia)/1000 | Q72: =RC[-6]&"/60*nMin*(1000+nGuanQia)/1000" -> 15960/60*nMin*(1000+nGuanQia)/1000
B73: 45 | C73: 65 | D73: =INT((RC[-1]*35+200)*(1+2)/4*0.2) -> 371 | E73: =INT((RC[-2]*28+160)*(1+2)/4*0.2) -> 297 | F73: =INT(10000*0.1*(100+1)/100*(1+RC[-3]/200)*0.2) -> 267 | G73: 45 | H73: 65 | I73: =RC[-5]*60 -> 22260 | J73: =RC[-5]*60 -> 17820 | K73: =RC[-5]*60 -> 16020 | L73: =RC[-3]&"/3600*(nPatrolSec+3)*(1000+nGuanQia)/1000" -> 22260/3600*(nPatrolSec+3)*(1000+nGuanQia)/1000 | M73: =RC[-3]&"/3600*(nPatrolSec+3)*(1000+nGuanQia)/1000" -> 17820/3600*(nPatrolSec+3)*(1000+nGuanQia)/1000 | N73: =RC[-3]&"/3600*(nPatrolSec+3)*(1000+nGuanQia)/1000" -> 16020/3600*(nPatrolSec+3)*(1000+nGuanQia)/1000 | O73: =RC[-6]&"/60*nMin*(1000+nGuanQia)/1000" -> 22260/60*nMin*(1000+nGuanQia)/1000 | P73: =RC[-6]&"/60*nMin*(1000+nGuanQia)/1000" -> 17820/60*nMin*(1000+nGuanQia)/1000 | Q73: =RC[-6]&"/60*nMin*(1000+nGuanQia)/1000" -> 16020/60*nMin*(1000+nGuanQia)/1000
B74: 46 | C74: 66 | D74: =INT((RC[-1]*35+200)*(1+2)/4*0.2) -> 376 | E74: =INT((RC[-2]*28+160)*(1+2)/4*0.2) -> 301 | F74: =INT(10000*0.1*(100+1)/100*(1+RC[-3]/200)*0.2) -> 268 | G74: 46 | H74: 66 | I74: =RC[-5]*60 -> 22560 | J74: =RC[-5]*60 -> 18060 | K74: =RC[-5]*60 -> 16080 | L74: =RC[-3]&"/3600*(nPatrolSec+3)*(1000+nGuanQia)/1000" -> 22560/3600*(nPatrolSec+3)*(1000+nGuanQia)/1000 | M74: =RC[-3]&"/3600*(nPatrolSec+3)*(1000+nGuanQia)/1000" -> 18060/3600*(nPatrolSec+3)*(1000+nGuanQia)/1000 | N74: =RC[-3]&"/3600*(nPatrolSec+3)*(1000+nGuanQia)/1000" -> 16080/3600*(nPatrolSec+3)*(1000+nGuanQia)/1000 | O74: =RC[-6]&"/60*nMin*(1000+nGuanQia)/1000" -> 22560/60*nMin*(1000+nGuanQia)/1000 | P74: =RC[-6]&"/60*nMin*(1000+nGuanQia)/1000" -> 18060/60*nMin*(1000+nGuanQia)/1000 | Q74: =RC[-6]&"/60*nMin*(1000+nGuanQia)/1000" -> 16080/60*nMin*(1000+nGuanQia)/1000
B75: 47 | C75: 67 | D75: =INT((RC[-1]*35+200)*(1+2)/4*0.2) -> 381 | E75: =INT((RC[-2]*28+160)*(1+2)/4*0.2) -> 305 | F75: =INT(10000*0.1*(100+1)/100*(1+RC[-3]/200)*0.2) -> 269 | G75: 47 | H75: 67 | I75: =RC[-5]*60 -> 22860 | J75: =RC[-5]*60 -> 18300 | K75: =RC[-5]*60 -> 16140 | L75: =RC[-3]&"/3600*(nPatrolSec+3)*(1000+nGuanQia)/1000" -> 22860/3600*(nPatrolSec+3)*(1000+nGuanQia)/1000 | M75: =RC[-3]&"/3600*(nPatrolSec+3)*(1000+nGuanQia)/1000" -> 18300/3600*(nPatrolSec+3)*(1000+nGuanQia)/1000 | N75: =RC[-3]&"/3600*(nPatrolSec+3)*(1000+nGuanQia)/1000" -> 16140/3600*(nPatrolSec+3)*(1000+nGuanQia)/1000 | O75: =RC[-6]&"/60*nMin*(1000+nGuanQia)/1000" -> 22860/60*nMin*(1000+nGuanQia)/1000 | P75: =RC[-6]&"/60*nMin*(1000+nGuanQia)/1000" -> 18300/60*nMin*(1000+nGuanQia)/1000 | Q75: =RC[-6]&"/60*nMin*(1000+nGuanQia)/1000" -> 16140/60*nMin*(1000+nGuanQia)/1000
B76: 48 | C76: 68 | D76: =INT((RC[-1]*35+200)*(1+2)/4*0.2) -> 387 | E76: =INT((RC[-2]*28+160)*(1+2)/4*0.2) -> 309 | F76: =INT(10000*0.1*(100+1)/100*(1+RC[-3]/200)*0.2) -> 270 | G76: 48 | H76: 68 | I76: =RC[-5]*60 -> 23220 | J76: =RC[-5]*60 -> 18540 | K76: =RC[-5]*60 -> 16200 | L76: =RC[-3]&"/3600*(nPatrolSec+3)*(1000+nGuanQia)/1000" -> 23220/3600*(nPatrolSec+3)*(1000+nGuanQia)/1000 | M76: =RC[-3]&"/3600*(nPatrolSec+3)*(1000+nGuanQia)/1000" -> 18540/3600*(nPatrolSec+3)*(1000+nGuanQia)/1000 | N76: =RC[-3]&"/3600*(nPatrolSec+3)*(1000+nGuanQia)/1000" -> 16200/3600*(nPatrolSec+3)*(1000+nGuanQia)/1000 | O76: =RC[-6]&"/60*nMin*(1000+nGuanQia)/1000" -> 23220/60*nMin*(1000+nGuanQia)/1000 | P76: =RC[-6]&"/60*nMin*(1000+nGuanQia)/1000" -> 18540/60*nMin*(1000+nGuanQia)/1000 | Q76: =RC[-6]&"/60*nMin*(1000+nGuanQia)/1000" -> 16200/60*nMin*(1000+nGuanQia)/1000
B77: 49 | C77: 69 | D77: =INT((RC[-1]*35+200)*(1+2)/4*0.2) -> 392 | E77: =INT((RC[-2]*28+160)*(1+2)/4*0.2) -> 313 | F77: =INT(10000*0.1*(100+1)/100*(1+RC[-3]/200)*0.2) -> 271 | G77: 49 | H77: 69 | I77: =RC[-5]*60 -> 23520 | J77: =RC[-5]*60 -> 18780 | K77: =RC[-5]*60 -> 16260 | L77: =RC[-3]&"/3600*(nPatrolSec+3)*(1000+nGuanQia)/1000" -> 23520/3600*(nPatrolSec+3)*(1000+nGuanQia)/1000 | M77: =RC[-3]&"/3600*(nPatrolSec+3)*(1000+nGuanQia)/1000" -> 18780/3600*(nPatrolSec+3)*(1000+nGuanQia)/1000 | N77: =RC[-3]&"/3600*(nPatrolSec+3)*(1000+nGuanQia)/1000" -> 16260/3600*(nPatrolSec+3)*(1000+nGuanQia)/1000 | O77: =RC[-6]&"/60*nMin*(1000+nGuanQia)/1000" -> 23520/60*nMin*(1000+nGuanQia)/1000 | P77: =RC[-6]&"/60*nMin*(1000+nGuanQia)/1000" -> 18780/60*nMin*(1000+nGuanQia)/1000 | Q77: =RC[-6]&"/60*nMin*(1000+nGuanQia)/1000" -> 16260/60*nMin*(1000+nGuanQia)/1000
B78: 50 | C78: 70 | D78: =INT((RC[-1]*35+200)*(1+2)/4*0.2) -> 397 | E78: =INT((RC[-2]*28+160)*(1+2)/4*0.2) -> 318 | F78: =INT(10000*0.1*(100+1)/100*(1+RC[-3]/200)*0.2) -> 272 | G78: 50 | H78: 70 | I78: =RC[-5]*60 -> 23820 | J78: =RC[-5]*60 -> 19080 | K78: =RC[-5]*60 -> 16320 | L78: =RC[-3]&"/3600*(nPatrolSec+3)*(1000+nGuanQia)/1000" -> 23820/3600*(nPatrolSec+3)*(1000+nGuanQia)/1000 | M78: =RC[-3]&"/3600*(nPatrolSec+3)*(1000+nGuanQia)/1000" -> 19080/3600*(nPatrolSec+3)*(1000+nGuanQia)/1000 | N78: =RC[-3]&"/3600*(nPatrolSec+3)*(1000+nGuanQia)/1000" -> 16320/3600*(nPatrolSec+3)*(1000+nGuanQia)/1000 | O78: =RC[-6]&"/60*nMin*(1000+nGuanQia)/1000" -> 23820/60*nMin*(1000+nGuanQia)/1000 | P78: =RC[-6]&"/60*nMin*(1000+nGuanQia)/1000" -> 19080/60*nMin*(1000+nGuanQia)/1000 | Q78: =RC[-6]&"/60*nMin*(1000+nGuanQia)/1000" -> 16320/60*nMin*(1000+nGuanQia)/1000
B79: 51 | C79: 71 | D79: =INT((RC[-1]*35+200)*(1+2)/4*0.2) -> 402 | E79: =INT((RC[-2]*28+160)*(1+2)/4*0.2) -> 322 | F79: =INT(10000*0.1*(100+1)/100*(1+RC[-3]/200)*0.2) -> 273 | G79: 51 | H79: 71 | I79: =RC[-5]*60 -> 24120 | J79: =RC[-5]*60 -> 19320 | K79: =RC[-5]*60 -> 16380 | L79: =RC[-3]&"/3600*(nPatrolSec+3)*(1000+nGuanQia)/1000" -> 24120/3600*(nPatrolSec+3)*(1000+nGuanQia)/1000 | M79: =RC[-3]&"/3600*(nPatrolSec+3)*(1000+nGuanQia)/1000" -> 19320/3600*(nPatrolSec+3)*(1000+nGuanQia)/1000 | N79: =RC[-3]&"/3600*(nPatrolSec+3)*(1000+nGuanQia)/1000" -> 16380/3600*(nPatrolSec+3)*(1000+nGuanQia)/1000 | O79: =RC[-6]&"/60*nMin*(1000+nGuanQia)/1000" -> 24120/60*nMin*(1000+nGuanQia)/1000 | P79: =RC[-6]&"/60*nMin*(1000+nGuanQia)/1000" -> 19320/60*nMin*(1000+nGuanQia)/1000 | Q79: =RC[-6]&"/60*nMin*(1000+nGuanQia)/1000" -> 16380/60*nMin*(1000+nGuanQia)/1000
B80: 52 | C80: 72 | D80: =INT((RC[-1]*35+200)*(1+2)/4*0.2) -> 408 | E80: =INT((RC[-2]*28+160)*(1+2)/4*0.2) -> 326 | F80: =INT(10000*0.1*(100+1)/100*(1+RC[-3]/200)*0.2) -> 274 | G80: 52 | H80: 72 | I80: =RC[-5]*60 -> 24480 | J80: =RC[-5]*60 -> 19560 | K80: =RC[-5]*60 -> 16440 | L80: =RC[-3]&"/3600*(nPatrolSec+3)*(1000+nGuanQia)/1000" -> 24480/3600*(nPatrolSec+3)*(1000+nGuanQia)/1000 | M80: =RC[-3]&"/3600*(nPatrolSec+3)*(1000+nGuanQia)/1000" -> 19560/3600*(nPatrolSec+3)*(1000+nGuanQia)/1000 | N80: =RC[-3]&"/3600*(nPatrolSec+3)*(1000+nGuanQia)/1000" -> 16440/3600*(nPatrolSec+3)*(1000+nGuanQia)/1000 | O80: =RC[-6]&"/60*nMin*(1000+nGuanQia)/1000" -> 24480/60*nMin*(1000+nGuanQia)/1000 | P80: =RC[-6]&"/60*nMin*(1000+nGuanQia)/1000" -> 19560/60*nMin*(1000+nGuanQia)/1000 | Q80: =RC[-6]&"/60*nMin*(1000+nGuanQia)/1000" -> 16440/60*nMin*(1000+nGuanQia)/1000
B81: 53 | C81: 73 | D81: =INT((RC[-1]*35+200)*(1+2)/4*0.2) -> 413 | E81: =INT((RC[-2]*28+160)*(1+2)/4*0.2) -> 330 | F81: =INT(10000*0.1*(100+1)/100*(1+RC[-3]/200)*0.2) -> 275 | G81: 53 | H81: 73 | I81: =RC[-5]*60 -> 24780 | J81: =RC[-5]*60 -> 19800 | K81: =RC[-5]*60 -> 16500 | L81: =RC[-3]&"/3600*(nPatrolSec+3)*(1000+nGuanQia)/1000" -> 24780/3600*(nPatrolSec+3)*(1000+nGuanQia)/1000 | M81: =RC[-3]&"/3600*(nPatrolSec+3)*(1000+nGuanQia)/1000" -> 19800/3600*(nPatrolSec+3)*(1000+nGuanQia)/1000 | N81: =RC[-3]&"/3600*(nPatrolSec+3)*(1000+nGuanQia)/1000" -> 16500/3600*(nPatrolSec+3)*(1000+nGuanQia)/1000 | O81: =RC[-6]&"/60*nMin*(1000+nGuanQia)/1000" -> 24780/60*nMin*(1000+nGuanQia)/1000 | P81: =RC[-6]&"/60*nMin*(1000+nGuanQia)/1000" -> 19800/60*nMin*(1000+nGuanQia)/1000 | Q81: =RC[-6]&"/60*nMin*(1000+nGuanQia)/1000" -> 16500/60*nMin*(1000+nGuanQia)/1000
B82: 54 | C82: 74 | D82: =INT((RC[-1]*35+200)*(1+2)/4*0.2) -> 418 | E82: =INT((RC[-2]*28+160)*(1+2)/4*0.2) -> 334 | F82: =INT(10000*0.1*(100+1)/100*(1+RC[-3]/200)*0.2) -> 276 | G82: 54 | H82: 74 | I82: =RC[-5]*60 -> 25080 | J82: =RC[-5]*60 -> 20040 | K82: =RC[-5]*60 -> 16560 | L82: =RC[-3]&"/3600*(nPatrolSec+3)*(1000+nGuanQia)/1000" -> 25080/3600*(nPatrolSec+3)*(1000+nGuanQia)/1000 | M82: =RC[-3]&"/3600*(nPatrolSec+3)*(1000+nGuanQia)/1000" -> 20040/3600*(nPatrolSec+3)*(1000+nGuanQia)/1000 | N82: =RC[-3]&"/3600*(nPatrolSec+3)*(1000+nGuanQia)/1000" -> 16560/3600*(nPatrolSec+3)*(1000+nGuanQia)/1000 | O82: =RC[-6]&"/60*nMin*(1000+nGuanQia)/1000" -> 25080/60*nMin*(1000+nGuanQia)/1000 | P82: =RC[-6]&"/60*nMin*(1000+nGuanQia)/1000" -> 20040/60*nMin*(1000+nGuanQia)/1000 | Q82: =RC[-6]&"/60*nMin*(1000+nGuanQia)/1000" -> 16560/60*nMin*(1000+nGuanQia)/1000
B83: 55 | C83: 75 | D83: =INT((RC[-1]*35+200)*(1+2)/4*0.2) -> 423 | E83: =INT((RC[-2]*28+160)*(1+2)/4*0.2) -> 339 | F83: =INT(10000*0.1*(100+1)/100*(1+RC[-3]/200)*0.2) -> 277 | G83: 55 | H83: 75 | I83: =RC[-5]*60 -> 25380 | J83: =RC[-5]*60 -> 20340 | K83: =RC[-5]*60 -> 16620 | L83: =RC[-3]&"/3600*(nPatrolSec+3)*(1000+nGuanQia)/1000" -> 25380/3600*(nPatrolSec+3)*(1000+nGuanQia)/1000 | M83: =RC[-3]&"/3600*(nPatrolSec+3)*(1000+nGuanQia)/1000" -> 20340/3600*(nPatrolSec+3)*(1000+nGuanQia)/1000 | N83: =RC[-3]&"/3600*(nPatrolSec+3)*(1000+nGuanQia)/1000" -> 16620/3600*(nPatrolSec+3)*(1000+nGuanQia)/1000 | O83: =RC[-6]&"/60*nMin*(1000+nGuanQia)/1000" -> 25380/60*nMin*(1000+nGuanQia)/1000 | P83: =RC[-6]&"/60*nMin*(1000+nGuanQia)/1000" -> 20340/60*nMin*(1000+nGuanQia)/1000 | Q83: =RC[-6]&"/60*nMin*(1000+nGuanQia)/1000" -> 16620/60*nMin*(1000+nGuanQia)/1000
B84: 56 | C84: 76 | D84: =INT((RC[-1]*35+200)*(1+2)/4*0.2) -> 429 | E84: =INT((RC[-2]*28+160)*(1+2)/4*0.2) -> 343 | F84: =INT(10000*0.1*(100+1)/100*(1+RC[-3]/200)*0.2) -> 278 | G84: 56 | H84: 76 | I84: =RC[-5]*60 -> 25740 | J84: =RC[-5]*60 -> 20580 | K84: =RC[-5]*60 -> 16680 | L84: =RC[-3]&"/3600*(nPatrolSec+3)*(1000+nGuanQia)/1000" -> 25740/3600*(nPatrolSec+3)*(1000+nGuanQia)/1000 | M84: =RC[-3]&"/3600*(nPatrolSec+3)*(1000+nGuanQia)/1000" -> 20580/3600*(nPatrolSec+3)*(1000+nGuanQia)/1000 | N84: =RC[-3]&"/3600*(nPatrolSec+3)*(1000+nGuanQia)/1000" -> 16680/3600*(nPatrolSec+3)*(1000+nGuanQia)/1000 | O84: =RC[-6]&"/60*nMin*(1000+nGuanQia)/1000" -> 25740/60*nMin*(1000+nGuanQia)/1000 | P84: =RC[-6]&"/60*nMin*(1000+nGuanQia)/1000" -> 20580/60*nMin*(1000+nGuanQia)/1000 | Q84: =RC[-6]&"/60*nMin*(1000+nGuanQia)/1000" -> 16680/60*nMin*(1000+nGuanQia)/1000
B85: 57 | C85: 77 | D85: =INT((RC[-1]*35+200)*(1+2)/4*0.2) -> 434 | E85: =INT((RC[-2]*28+160)*(1+2)/4*0.2) -> 347 | F85: =INT(10000*0.1*(100+1)/100*(1+RC[-3]/200)*0.2) -> 279 | G85: 57 | H85: 77 | I85: =RC[-5]*60 -> 26040 | J85: =RC[-5]*60 -> 20820 | K85: =RC[-5]*60 -> 16740 | L85: =RC[-3]&"/3600*(nPatrolSec+3)*(1000+nGuanQia)/1000" -> 26040/3600*(nPatrolSec+3)*(1000+nGuanQia)/1000 | M85: =RC[-3]&"/3600*(nPatrolSec+3)*(1000+nGuanQia)/1000" -> 20820/3600*(nPatrolSec+3)*(1000+nGuanQia)/1000 | N85: =RC[-3]&"/3600*(nPatrolSec+3)*(1000+nGuanQia)/1000" -> 16740/3600*(nPatrolSec+3)*(1000+nGuanQia)/1000 | O85: =RC[-6]&"/60*nMin*(1000+nGuanQia)/1000" -> 26040/60*nMin*(1000+nGuanQia)/1000 | P85: =RC[-6]&"/60*nMin*(1000+nGuanQia)/1000" -> 20820/60*nMin*(1000+nGuanQia)/1000 | Q85: =RC[-6]&"/60*nMin*(1000+nGuanQia)/1000" -> 16740/60*nMin*(1000+nGuanQia)/1000
B86: 58 | C86: 78 | D86: =INT((RC[-1]*35+200)*(1+2)/4*0.2) -> 439 | E86: =INT((RC[-2]*28+160)*(1+2)/4*0.2) -> 351 | F86: =INT(10000*0.1*(100+1)/100*(1+RC[-3]/200)*0.2) -> 280 | G86: 58 | H86: 78 | I86: =RC[-5]*60 -> 26340 | J86: =RC[-5]*60 -> 21060 | K86: =RC[-5]*60 -> 16800 | L86: =RC[-3]&"/3600*(nPatrolSec+3)*(1000+nGuanQia)/1000" -> 26340/3600*(nPatrolSec+3)*(1000+nGuanQia)/1000 | M86: =RC[-3]&"/3600*(nPatrolSec+3)*(1000+nGuanQia)/1000" -> 21060/3600*(nPatrolSec+3)*(1000+nGuanQia)/1000 | N86: =RC[-3]&"/3600*(nPatrolSec+3)*(1000+nGuanQia)/1000" -> 16800/3600*(nPatrolSec+3)*(1000+nGuanQia)/1000 | O86: =RC[-6]&"/60*nMin*(1000+nGuanQia)/1000" -> 26340/60*nMin*(1000+nGuanQia)/1000 | P86: =RC[-6]&"/60*nMin*(1000+nGuanQia)/1000" -> 21060/60*nMin*(1000+nGuanQia)/1000 | Q86: =RC[-6]&"/60*nMin*(1000+nGuanQia)/1000" -> 16800/60*nMin*(1000+nGuanQia)/1000
B87: 59 | C87: 79 | D87: =INT((RC[-1]*35+200)*(1+2)/4*0.2) -> 444 | E87: =INT((RC[-2]*28+160)*(1+2)/4*0.2) -> 355 | F87: =INT(10000*0.1*(100+1)/100*(1+RC[-3]/200)*0.2) -> 281 | G87: 59 | H87: 79 | I87: =RC[-5]*60 -> 26640 | J87: =RC[-5]*60 -> 21300 | K87: =RC[-5]*60 -> 16860 | L87: =RC[-3]&"/3600*(nPatrolSec+3)*(1000+nGuanQia)/1000" -> 26640/3600*(nPatrolSec+3)*(1000+nGuanQia)/1000 | M87: =RC[-3]&"/3600*(nPatrolSec+3)*(1000+nGuanQia)/1000" -> 21300/3600*(nPatrolSec+3)*(1000+nGuanQia)/1000 | N87: =RC[-3]&"/3600*(nPatrolSec+3)*(1000+nGuanQia)/1000" -> 16860/3600*(nPatrolSec+3)*(1000+nGuanQia)/1000 | O87: =RC[-6]&"/60*nMin*(1000+nGuanQia)/1000" -> 26640/60*nMin*(1000+nGuanQia)/1000 | P87: =RC[-6]&"/60*nMin*(1000+nGuanQia)/1000" -> 21300/60*nMin*(1000+nGuanQia)/1000 | Q87: =RC[-6]&"/60*nMin*(1000+nGuanQia)/1000" -> 16860/60*nMin*(1000+nGuanQia)/1000
B88: 60 | C88: 80 | D88: =INT((RC[-1]*35+200)*(1+2)/4*0.2) -> 450 | E88: =INT((RC[-2]*28+160)*(1+2)/4*0.2) -> 360 | F88: =INT(10000*0.1*(100+1)/100*(1+RC[-3]/200)*0.2) -> 282 | G88: 60 | H88: 80 | I88: =RC[-5]*60 -> 27000 | J88: =RC[-5]*60 -> 21600 | K88: =RC[-5]*60 -> 16920 | L88: =RC[-3]&"/3600*(nPatrolSec+3)*(1000+nGuanQia)/1000" -> 27000/3600*(nPatrolSec+3)*(1000+nGuanQia)/1000 | M88: =RC[-3]&"/3600*(nPatrolSec+3)*(1000+nGuanQia)/1000" -> 21600/3600*(nPatrolSec+3)*(1000+nGuanQia)/1000 | N88: =RC[-3]&"/3600*(nPatrolSec+3)*(1000+nGuanQia)/1000" -> 16920/3600*(nPatrolSec+3)*(1000+nGuanQia)/1000 | O88: =RC[-6]&"/60*nMin*(1000+nGuanQia)/1000" -> 27000/60*nMin*(1000+nGuanQia)/1000 | P88: =RC[-6]&"/60*nMin*(1000+nGuanQia)/1000" -> 21600/60*nMin*(1000+nGuanQia)/1000 | Q88: =RC[-6]&"/60*nMin*(1000+nGuanQia)/1000" -> 16920/60*nMin*(1000+nGuanQia)/1000
B89: 61 | C89: 81 | D89: =INT((RC[-1]*35+200)*(1+2)/4*0.2) -> 455 | E89: =INT((RC[-2]*28+160)*(1+2)/4*0.2) -> 364 | F89: =INT(10000*0.1*(100+1)/100*(1+RC[-3]/200)*0.2) -> 283 | G89: 61 | H89: 81 | I89: =RC[-5]*60 -> 27300 | J89: =RC[-5]*60 -> 21840 | K89: =RC[-5]*60 -> 16980 | L89: =RC[-3]&"/3600*(nPatrolSec+3)*(1000+nGuanQia)/1000" -> 27300/3600*(nPatrolSec+3)*(1000+nGuanQia)/1000 | M89: =RC[-3]&"/3600*(nPatrolSec+3)*(1000+nGuanQia)/1000" -> 21840/3600*(nPatrolSec+3)*(1000+nGuanQia)/1000 | N89: =RC[-3]&"/3600*(nPatrolSec+3)*(1000+nGuanQia)/1000" -> 16980/3600*(nPatrolSec+3)*(1000+nGuanQia)/1000 | O89: =RC[-6]&"/60*nMin*(1000+nGuanQia)/1000" -> 27300/60*nMin*(1000+nGuanQia)/1000 | P89: =RC[-6]&"/60*nMin*(1000+nGuanQia)/1000" -> 21840/60*nMin*(1000+nGuanQia)/1000 | Q89: =RC[-6]&"/60*nMin*(1000+nGuanQia)/1000" -> 16980/60*nMin*(1000+nGuanQia)/1000
B90: 62 | C90: 82 | D90: =INT((RC[-1]*35+200)*(1+2)/4*0.2) -> 460 | E90: =INT((RC[-2]*28+160)*(1+2)/4*0.2) -> 368 | F90: =INT(10000*0.1*(100+1)/100*(1+RC[-3]/200)*0.2) -> 284 | G90: 62 | H90: 82 | I90: =RC[-5]*60 -> 27600 | J90: =RC[-5]*60 -> 22080 | K90: =RC[-5]*60 -> 17040 | L90: =RC[-3]&"/3600*(nPatrolSec+3)*(1000+nGuanQia)/1000" -> 27600/3600*(nPatrolSec+3)*(1000+nGuanQia)/1000 | M90: =RC[-3]&"/3600*(nPatrolSec+3)*(1000+nGuanQia)/1000" -> 22080/3600*(nPatrolSec+3)*(1000+nGuanQia)/1000 | N90: =RC[-3]&"/3600*(nPatrolSec+3)*(1000+nGuanQia)/1000" -> 17040/3600*(nPatrolSec+3)*(1000+nGuanQia)/1000 | O90: =RC[-6]&"/60*nMin*(1000+nGuanQia)/1000" -> 27600/60*nMin*(1000+nGuanQia)/1000 | P90: =RC[-6]&"/60*nMin*(1000+nGuanQia)/1000" -> 22080/60*nMin*(1000+nGuanQia)/1000 | Q90: =RC[-6]&"/60*nMin*(1000+nGuanQia)/1000" -> 17040/60*nMin*(1000+nGuanQia)/1000
B91: 63 | C91: 83 | D91: =INT((RC[-1]*35+200)*(1+2)/4*0.2) -> 465 | E91: =INT((RC[-2]*28+160)*(1+2)/4*0.2) -> 372 | F91: =INT(10000*0.1*(100+1)/100*(1+RC[-3]/200)*0.2) -> 285 | G91: 63 | H91: 83 | I91: =RC[-5]*60 -> 27900 | J91: =RC[-5]*60 -> 22320 | K91: =RC[-5]*60 -> 17100 | L91: =RC[-3]&"/3600*(nPatrolSec+3)*(1000+nGuanQia)/1000" -> 27900/3600*(nPatrolSec+3)*(1000+nGuanQia)/1000 | M91: =RC[-3]&"/3600*(nPatrolSec+3)*(1000+nGuanQia)/1000" -> 22320/3600*(nPatrolSec+3)*(1000+nGuanQia)/1000 | N91: =RC[-3]&"/3600*(nPatrolSec+3)*(1000+nGuanQia)/1000" -> 17100/3600*(nPatrolSec+3)*(1000+nGuanQia)/1000 | O91: =RC[-6]&"/60*nMin*(1000+nGuanQia)/1000" -> 27900/60*nMin*(1000+nGuanQia)/1000 | P91: =RC[-6]&"/60*nMin*(1000+nGuanQia)/1000" -> 22320/60*nMin*(1000+nGuanQia)/1000 | Q91: =RC[-6]&"/60*nMin*(1000+nGuanQia)/1000" -> 17100/60*nMin*(1000+nGuanQia)/1000
B92: 64 | C92: 84 | D92: =INT((RC[-1]*35+200)*(1+2)/4*0.2) -> 471 | E92: =INT((RC[-2]*28+160)*(1+2)/4*0.2) -> 376 | F92: =INT(10000*0.1*(100+1)/100*(1+RC[-3]/200)*0.2) -> 286 | G92: 64 | H92: 84 | I92: =RC[-5]*60 -> 28260 | J92: =RC[-5]*60 -> 22560 | K92: =RC[-5]*60 -> 17160 | L92: =RC[-3]&"/3600*(nPatrolSec+3)*(1000+nGuanQia)/1000" -> 28260/3600*(nPatrolSec+3)*(1000+nGuanQia)/1000 | M92: =RC[-3]&"/3600*(nPatrolSec+3)*(1000+nGuanQia)/1000" -> 22560/3600*(nPatrolSec+3)*(1000+nGuanQia)/1000 | N92: =RC[-3]&"/3600*(nPatrolSec+3)*(1000+nGuanQia)/1000" -> 17160/3600*(nPatrolSec+3)*(1000+nGuanQia)/1000 | O92: =RC[-6]&"/60*nMin*(1000+nGuanQia)/1000" -> 28260/60*nMin*(1000+nGuanQia)/1000 | P92: =RC[-6]&"/60*nMin*(1000+nGuanQia)/1000" -> 22560/60*nMin*(1000+nGuanQia)/1000 | Q92: =RC[-6]&"/60*nMin*(1000+nGuanQia)/1000" -> 17160/60*nMin*(1000+nGuanQia)/1000
B93: 65 | C93: 85 | D93: =INT((RC[-1]*35+200)*(1+2)/4*0.2) -> 476 | E93: =INT((RC[-2]*28+160)*(1+2)/4*0.2) -> 381 | F93: =INT(10000*0.1*(100+1)/100*(1+RC[-3]/200)*0.2) -> 287 | G93: 65 | H93: 85 | I93: =RC[-5]*60 -> 28560 | J93: =RC[-5]*60 -> 22860 | K93: =RC[-5]*60 -> 17220 | L93: =RC[-3]&"/3600*(nPatrolSec+3)*(1000+nGuanQia)/1000" -> 28560/3600*(nPatrolSec+3)*(1000+nGuanQia)/1000 | M93: =RC[-3]&"/3600*(nPatrolSec+3)*(1000+nGuanQia)/1000" -> 22860/3600*(nPatrolSec+3)*(1000+nGuanQia)/1000 | N93: =RC[-3]&"/3600*(nPatrolSec+3)*(1000+nGuanQia)/1000" -> 17220/3600*(nPatrolSec+3)*(1000+nGuanQia)/1000 | O93: =RC[-6]&"/60*nMin*(1000+nGuanQia)/1000" -> 28560/60*nMin*(1000+nGuanQia)/1000 | P93: =RC[-6]&"/60*nMin*(1000+nGuanQia)/1000" -> 22860/60*nMin*(1000+nGuanQia)/1000 | Q93: =RC[-6]&"/60*nMin*(1000+nGuanQia)/1000" -> 17220/60*nMin*(1000+nGuanQia)/1000
B94: 66 | C94: 86 | D94: =INT((RC[-1]*35+200)*(1+2)/4*0.2) -> 481 | E94: =INT((RC[-2]*28+160)*(1+2)/4*0.2) -> 385 | F94: =INT(10000*0.1*(100+1)/100*(1+RC[-3]/200)*0.2) -> 288 | G94: 66 | H94: 86 | I94: =RC[-5]*60 -> 28860 | J94: =RC[-5]*60 -> 23100 | K94: =RC[-5]*60 -> 17280 | L94: =RC[-3]&"/3600*(nPatrolSec+3)*(1000+nGuanQia)/1000" -> 28860/3600*(nPatrolSec+3)*(1000+nGuanQia)/1000 | M94: =RC[-3]&"/3600*(nPatrolSec+3)*(1000+nGuanQia)/1000" -> 23100/3600*(nPatrolSec+3)*(1000+nGuanQia)/1000 | N94: =RC[-3]&"/3600*(nPatrolSec+3)*(1000+nGuanQia)/1000" -> 17280/3600*(nPatrolSec+3)*(1000+nGuanQia)/1000 | O94: =RC[-6]&"/60*nMin*(1000+nGuanQia)/1000" -> 28860/60*nMin*(1000+nGuanQia)/1000 | P94: =RC[-6]&"/60*nMin*(1000+nGuanQia)/1000" -> 23100/60*nMin*(1000+nGuanQia)/1000 | Q94: =RC[-6]&"/60*nMin*(1000+nGuanQia)/1000" -> 17280/60*nMin*(1000+nGuanQia)/1000
B95: 67 | C95: 87 | D95: =INT((RC[-1]*35+200)*(1+2)/4*0.2) -> 486 | E95: =INT((RC[-2]*28+160)*(1+2)/4*0.2) -> 389 | F95: =INT(10000*0.1*(100+1)/100*(1+RC[-3]/200)*0.2) -> 289 | G95: 67 | H95: 87 | I95: =RC[-5]*60 -> 29160 | J95: =RC[-5]*60 -> 23340 | K95: =RC[-5]*60 -> 17340 | L95: =RC[-3]&"/3600*(nPatrolSec+3)*(1000+nGuanQia)/1000" -> 29160/3600*(nPatrolSec+3)*(1000+nGuanQia)/1000 | M95: =RC[-3]&"/3600*(nPatrolSec+3)*(1000+nGuanQia)/1000" -> 23340/3600*(nPatrolSec+3)*(1000+nGuanQia)/1000 | N95: =RC[-3]&"/3600*(nPatrolSec+3)*(1000+nGuanQia)/1000" -> 17340/3600*(nPatrolSec+3)*(1000+nGuanQia)/1000 | O95: =RC[-6]&"/60*nMin*(1000+nGuanQia)/1000" -> 29160/60*nMin*(1000+nGuanQia)/1000 | P95: =RC[-6]&"/60*nMin*(1000+nGuanQia)/1000" -> 23340/60*nMin*(1000+nGuanQia)/1000 | Q95: =RC[-6]&"/60*nMin*(1000+nGuanQia)/1000" -> 17340/60*nMin*(1000+nGuanQia)/1000
B96: 68 | C96: 88 | D96: =INT((RC[-1]*35+200)*(1+2)/4*0.2) -> 492 | E96: =INT((RC[-2]*28+160)*(1+2)/4*0.2) -> 393 | F96: =INT(10000*0.1*(100+1)/100*(1+RC[-3]/200)*0.2) -> 290 | G96: 68 | H96: 88 | I96: =RC[-5]*60 -> 29520 | J96: =RC[-5]*60 -> 23580 | K96: =RC[-5]*60 -> 17400 | L96: =RC[-3]&"/3600*(nPatrolSec+3)*(1000+nGuanQia)/1000" -> 29520/3600*(nPatrolSec+3)*(1000+nGuanQia)/1000 | M96: =RC[-3]&"/3600*(nPatrolSec+3)*(1000+nGuanQia)/1000" -> 23580/3600*(nPatrolSec+3)*(1000+nGuanQia)/1000 | N96: =RC[-3]&"/3600*(nPatrolSec+3)*(1000+nGuanQia)/1000" -> 17400/3600*(nPatrolSec+3)*(1000+nGuanQia)/1000 | O96: =RC[-6]&"/60*nMin*(1000+nGuanQia)/1000" -> 29520/60*nMin*(1000+nGuanQia)/1000 | P96: =RC[-6]&"/60*nMin*(1000+nGuanQia)/1000" -> 23580/60*nMin*(1000+nGuanQia)/1000 | Q96: =RC[-6]&"/60*nMin*(1000+nGuanQia)/1000" -> 17400/60*nMin*(1000+nGuanQia)/1000
B97: 69 | C97: 89 | D97: =INT((RC[-1]*35+200)*(1+2)/4*0.2) -> 497 | E97: =INT((RC[-2]*28+160)*(1+2)/4*0.2) -> 397 | F97: =INT(10000*0.1*(100+1)/100*(1+RC[-3]/200)*0.2) -> 291 | G97: 69 | H97: 89 | I97: =RC[-5]*60 -> 29820 | J97: =RC[-5]*60 -> 23820 | K97: =RC[-5]*60 -> 17460 | L97: =RC[-3]&"/3600*(nPatrolSec+3)*(1000+nGuanQia)/1000" -> 29820/3600*(nPatrolSec+3)*(1000+nGuanQia)/1000 | M97: =RC[-3]&"/3600*(nPatrolSec+3)*(1000+nGuanQia)/1000" -> 23820/3600*(nPatrolSec+3)*(1000+nGuanQia)/1000 | N97: =RC[-3]&"/3600*(nPatrolSec+3)*(1000+nGuanQia)/1000" -> 17460/3600*(nPatrolSec+3)*(1000+nGuanQia)/1000 | O97: =RC[-6]&"/60*nMin*(1000+nGuanQia)/1000" -> 29820/60*nMin*(1000+nGuanQia)/1000 | P97: =RC[-6]&"/60*nMin*(1000+nGuanQia)/1000" -> 23820/60*nMin*(1000+nGuanQia)/1000 | Q97: =RC[-6]&"/60*nMin*(1000+nGuanQia)/1000" -> 17460/60*nMin*(1000+nGuanQia)/1000
B98: 70 | C98: 90 | D98: =INT((RC[-1]*35+200)*(1+2)/4*0.2) -> 502 | E98: =INT((RC[-2]*28+160)*(1+2)/4*0.2) -> 402 | F98: =INT(10000*0.1*(100+1)/100*(1+RC[-3]/200)*0.2) -> 292 | G98: 70 | H98: 90 | I98: =RC[-5]*60 -> 30120 | J98: =RC[-5]*60 -> 24120 | K98: =RC[-5]*60 -> 17520 | L98: =RC[-3]&"/3600*(nPatrolSec+3)*(1000+nGuanQia)/1000" -> 30120/3600*(nPatrolSec+3)*(1000+nGuanQia)/1000 | M98: =RC[-3]&"/3600*(nPatrolSec+3)*(1000+nGuanQia)/1000" -> 24120/3600*(nPatrolSec+3)*(1000+nGuanQia)/1000 | N98: =RC[-3]&"/3600*(nPatrolSec+3)*(1000+nGuanQia)/1000" -> 17520/3600*(nPatrolSec+3)*(1000+nGuanQia)/1000 | O98: =RC[-6]&"/60*nMin*(1000+nGuanQia)/1000" -> 30120/60*nMin*(1000+nGuanQia)/1000 | P98: =RC[-6]&"/60*nMin*(1000+nGuanQia)/1000" -> 24120/60*nMin*(1000+nGuanQia)/1000 | Q98: =RC[-6]&"/60*nMin*(1000+nGuanQia)/1000" -> 17520/60*nMin*(1000+nGuanQia)/1000
B99: 71 | C99: 91 | D99: =INT((RC[-1]*35+200)*(1+2)/4*0.2) -> 507 | E99: =INT((RC[-2]*28+160)*(1+2)/4*0.2) -> 406 | F99: =INT(10000*0.1*(100+1)/100*(1+RC[-3]/200)*0.2) -> 293 | G99: 71 | H99: 91 | I99: =RC[-5]*60 -> 30420 | J99: =RC[-5]*60 -> 24360 | K99: =RC[-5]*60 -> 17580 | L99: =RC[-3]&"/3600*(nPatrolSec+3)*(1000+nGuanQia)/1000" -> 30420/3600*(nPatrolSec+3)*(1000+nGuanQia)/1000 | M99: =RC[-3]&"/3600*(nPatrolSec+3)*(1000+nGuanQia)/1000" -> 24360/3600*(nPatrolSec+3)*(1000+nGuanQia)/1000 | N99: =RC[-3]&"/3600*(nPatrolSec+3)*(1000+nGuanQia)/1000" -> 17580/3600*(nPatrolSec+3)*(1000+nGuanQia)/1000 | O99: =RC[-6]&"/60*nMin*(1000+nGuanQia)/1000" -> 30420/60*nMin*(1000+nGuanQia)/1000 | P99: =RC[-6]&"/60*nMin*(1000+nGuanQia)/1000" -> 24360/60*nMin*(1000+nGuanQia)/1000 | Q99: =RC[-6]&"/60*nMin*(1000+nGuanQia)/1000" -> 17580/60*nMin*(1000+nGuanQia)/1000
B100: 72 | C100: 92 | D100: =INT((RC[-1]*35+200)*(1+2)/4*0.2) -> 513 | E100: =INT((RC[-2]*28+160)*(1+2)/4*0.2) -> 410 | F100: =INT(10000*0.1*(100+1)/100*(1+RC[-3]/200)*0.2) -> 294 | G100: 72 | H100: 92 | I100: =RC[-5]*60 -> 30780 | J100: =RC[-5]*60 -> 24600 | K100: =RC[-5]*60 -> 17640 | L100: =RC[-3]&"/3600*(nPatrolSec+3)*(1000+nGuanQia)/1000" -> 30780/3600*(nPatrolSec+3)*(1000+nGuanQia)/1000 | M100: =RC[-3]&"/3600*(nPatrolSec+3)*(1000+nGuanQia)/1000" -> 24600/3600*(nPatrolSec+3)*(1000+nGuanQia)/1000 | N100: =RC[-3]&"/3600*(nPatrolSec+3)*(1000+nGuanQia)/1000" -> 17640/3600*(nPatrolSec+3)*(1000+nGuanQia)/1000 | O100: =RC[-6]&"/60*nMin*(1000+nGuanQia)/1000" -> 30780/60*nMin*(1000+nGuanQia)/1000 | P100: =RC[-6]&"/60*nMin*(1000+nGuanQia)/1000" -> 24600/60*nMin*(1000+nGuanQia)/1000 | Q100: =RC[-6]&"/60*nMin*(1000+nGuanQia)/1000" -> 17640/60*nMin*(1000+nGuanQia)/1000
B101: 73 | C101: 93 | D101: =INT((RC[-1]*35+200)*(1+2)/4*0.2) -> 518 | E101: =INT((RC[-2]*28+160)*(1+2)/4*0.2) -> 414 | F101: =INT(10000*0.1*(100+1)/100*(1+RC[-3]/200)*0.2) -> 295 | G101: 73 | H101: 93 | I101: =RC[-5]*60 -> 31080 | J101: =RC[-5]*60 -> 24840 | K101: =RC[-5]*60 -> 17700 | L101: =RC[-3]&"/3600*(nPatrolSec+3)*(1000+nGuanQia)/1000" -> 31080/3600*(nPatrolSec+3)*(1000+nGuanQia)/1000 | M101: =RC[-3]&"/3600*(nPatrolSec+3)*(1000+nGuanQia)/1000" -> 24840/3600*(nPatrolSec+3)*(1000+nGuanQia)/1000 | N101: =RC[-3]&"/3600*(nPatrolSec+3)*(1000+nGuanQia)/1000" -> 17700/3600*(nPatrolSec+3)*(1000+nGuanQia)/1000 | O101: =RC[-6]&"/60*nMin*(1000+nGuanQia)/1000" -> 31080/60*nMin*(1000+nGuanQia)/1000 | P101: =RC[-6]&"/60*nMin*(1000+nGuanQia)/1000" -> 24840/60*nMin*(1000+nGuanQia)/1000 | Q101: =RC[-6]&"/60*nMin*(1000+nGuanQia)/1000" -> 17700/60*nMin*(1000+nGuanQia)/1000
B102: 74 | C102: 94 | D102: =INT((RC[-1]*35+200)*(1+2)/4*0.2) -> 523 | E102: =INT((RC[-2]*28+160)*(1+2)/4*0.2) -> 418 | F102: =INT(10000*0.1*(100+1)/100*(1+RC[-3]/200)*0.2) -> 296 | G102: 74 | H102: 94 | I102: =RC[-5]*60 -> 31380 | J102: =RC[-5]*60 -> 25080 | K102: =RC[-5]*60 -> 17760 | L102: =RC[-3]&"/3600*(nPatrolSec+3)*(1000+nGuanQia)/1000" -> 31380/3600*(nPatrolSec+3)*(1000+nGuanQia)/1000 | M102: =RC[-3]&"/3600*(nPatrolSec+3)*(1000+nGuanQia)/1000" -> 25080/3600*(nPatrolSec+3)*(1000+nGuanQia)/1000 | N102: =RC[-3]&"/3600*(nPatrolSec+3)*(1000+nGuanQia)/1000" -> 17760/3600*(nPatrolSec+3)*(1000+nGuanQia)/1000 | O102: =RC[-6]&"/60*nMin*(1000+nGuanQia)/1000" -> 31380/60*nMin*(1000+nGuanQia)/1000 | P102: =RC[-6]&"/60*nMin*(1000+nGuanQia)/1000" -> 25080/60*nMin*(1000+nGuanQia)/1000 | Q102: =RC[-6]&"/60*nMin*(1000+nGuanQia)/1000" -> 17760/60*nMin*(1000+nGuanQia)/1000
B103: 75 | C103: 95 | D103: =INT((RC[-1]*35+200)*(1+2)/4*0.2) -> 528 | E103: =INT((RC[-2]*28+160)*(1+2)/4*0.2) -> 423 | F103: =INT(10000*0.1*(100+1)/100*(1+RC[-3]/200)*0.2) -> 297 | G103: 75 | H103: 95 | I103: =RC[-5]*60 -> 31680 | J103: =RC[-5]*60 -> 25380 | K103: =RC[-5]*60 -> 17820 | L103: =RC[-3]&"/3600*(nPatrolSec+3)*(1000+nGuanQia)/1000" -> 31680/3600*(nPatrolSec+3)*(1000+nGuanQia)/1000 | M103: =RC[-3]&"/3600*(nPatrolSec+3)*(1000+nGuanQia)/1000" -> 25380/3600*(nPatrolSec+3)*(1000+nGuanQia)/1000 | N103: =RC[-3]&"/3600*(nPatrolSec+3)*(1000+nGuanQia)/1000" -> 17820/3600*(nPatrolSec+3)*(1000+nGuanQia)/1000 | O103: =RC[-6]&"/60*nMin*(1000+nGuanQia)/1000" -> 31680/60*nMin*(1000+nGuanQia)/1000 | P103: =RC[-6]&"/60*nMin*(1000+nGuanQia)/1000" -> 25380/60*nMin*(1000+nGuanQia)/1000 | Q103: =RC[-6]&"/60*nMin*(1000+nGuanQia)/1000" -> 17820/60*nMin*(1000+nGuanQia)/1000
B104: 76 | C104: 96 | D104: =INT((RC[-1]*35+200)*(1+2)/4*0.2) -> 534 | E104: =INT((RC[-2]*28+160)*(1+2)/4*0.2) -> 427 | F104: =INT(10000*0.1*(100+1)/100*(1+RC[-3]/200)*0.2) -> 298 | G104: 76 | H104: 96 | I104: =RC[-5]*60 -> 32040 | J104: =RC[-5]*60 -> 25620 | K104: =RC[-5]*60 -> 17880 | L104: =RC[-3]&"/3600*(nPatrolSec+3)*(1000+nGuanQia)/1000" -> 32040/3600*(nPatrolSec+3)*(1000+nGuanQia)/1000 | M104: =RC[-3]&"/3600*(nPatrolSec+3)*(1000+nGuanQia)/1000" -> 25620/3600*(nPatrolSec+3)*(1000+nGuanQia)/1000 | N104: =RC[-3]&"/3600*(nPatrolSec+3)*(1000+nGuanQia)/1000" -> 17880/3600*(nPatrolSec+3)*(1000+nGuanQia)/1000 | O104: =RC[-6]&"/60*nMin*(1000+nGuanQia)/1000" -> 32040/60*nMin*(1000+nGuanQia)/1000 | P104: =RC[-6]&"/60*nMin*(1000+nGuanQia)/1000" -> 25620/60*nMin*(1000+nGuanQia)/1000 | Q104: =RC[-6]&"/60*nMin*(1000+nGuanQia)/1000" -> 17880/60*nMin*(1000+nGuanQia)/1000
B105: 77 | C105: 97 | D105: =INT((RC[-1]*35+200)*(1+2)/4*0.2) -> 539 | E105: =INT((RC[-2]*28+160)*(1+2)/4*0.2) -> 431 | F105: =INT(10000*0.1*(100+1)/100*(1+RC[-3]/200)*0.2) -> 299 | G105: 77 | H105: 97 | I105: =RC[-5]*60 -> 32340 | J105: =RC[-5]*60 -> 25860 | K105: =RC[-5]*60 -> 17940 | L105: =RC[-3]&"/3600*(nPatrolSec+3)*(1000+nGuanQia)/1000" -> 32340/3600*(nPatrolSec+3)*(1000+nGuanQia)/1000 | M105: =RC[-3]&"/3600*(nPatrolSec+3)*(1000+nGuanQia)/1000" -> 25860/3600*(nPatrolSec+3)*(1000+nGuanQia)/1000 | N105: =RC[-3]&"/3600*(nPatrolSec+3)*(1000+nGuanQia)/1000" -> 17940/3600*(nPatrolSec+3)*(1000+nGuanQia)/1000 | O105: =RC[-6]&"/60*nMin*(1000+nGuanQia)/1000" -> 32340/60*nMin*(1000+nGuanQia)/1000 | P105: =RC[-6]&"/60*nMin*(1000+nGuanQia)/1000" -> 25860/60*nMin*(1000+nGuanQia)/1000 | Q105: =RC[-6]&"/60*nMin*(1000+nGuanQia)/1000" -> 17940/60*nMin*(1000+nGuanQia)/1000
B106: 78 | C106: 98 | D106: =INT((RC[-1]*35+200)*(1+2)/4*0.2) -> 544 | E106: =INT((RC[-2]*28+160)*(1+2)/4*0.2) -> 435 | F106: =INT(10000*0.1*(100+1)/100*(1+RC[-3]/200)*0.2) -> 300 | G106: 78 | H106: 98 | I106: =RC[-5]*60 -> 32640 | J106: =RC[-5]*60 -> 26100 | K106: =RC[-5]*60 -> 18000 | L106: =RC[-3]&"/3600*(nPatrolSec+3)*(1000+nGuanQia)/1000" -> 32640/3600*(nPatrolSec+3)*(1000+nGuanQia)/1000 | M106: =RC[-3]&"/3600*(nPatrolSec+3)*(1000+nGuanQia)/1000" -> 26100/3600*(nPatrolSec+3)*(1000+nGuanQia)/1000 | N106: =RC[-3]&"/3600*(nPatrolSec+3)*(1000+nGuanQia)/1000" -> 18000/3600*(nPatrolSec+3)*(1000+nGuanQia)/1000 | O106: =RC[-6]&"/60*nMin*(1000+nGuanQia)/1000" -> 32640/60*nMin*(1000+nGuanQia)/1000 | P106: =RC[-6]&"/60*nMin*(1000+nGuanQia)/1000" -> 26100/60*nMin*(1000+nGuanQia)/1000 | Q106: =RC[-6]&"/60*nMin*(1000+nGuanQia)/1000" -> 18000/60*nMin*(1000+nGuanQia)/1000
B107: 79 | C107: 99 | D107: =INT((RC[-1]*35+200)*(1+2)/4*0.2) -> 549 | E107: =INT((RC[-2]*28+160)*(1+2)/4*0.2) -> 439 | F107: =INT(10000*0.1*(100+1)/100*(1+RC[-3]/200)*0.2) -> 301 | G107: 79 | H107: 99 | I107: =RC[-5]*60 -> 32940 | J107: =RC[-5]*60 -> 26340 | K107: =RC[-5]*60 -> 18060 | L107: =RC[-3]&"/3600*(nPatrolSec+3)*(1000+nGuanQia)/1000" -> 32940/3600*(nPatrolSec+3)*(1000+nGuanQia)/1000 | M107: =RC[-3]&"/3600*(nPatrolSec+3)*(1000+nGuanQia)/1000" -> 26340/3600*(nPatrolSec+3)*(1000+nGuanQia)/1000 | N107: =RC[-3]&"/3600*(nPatrolSec+3)*(1000+nGuanQia)/1000" -> 18060/3600*(nPatrolSec+3)*(1000+nGuanQia)/1000 | O107: =RC[-6]&"/60*nMin*(1000+nGuanQia)/1000" -> 32940/60*nMin*(1000+nGuanQia)/1000 | P107: =RC[-6]&"/60*nMin*(1000+nGuanQia)/1000" -> 26340/60*nMin*(1000+nGuanQia)/1000 | Q107: =RC[-6]&"/60*nMin*(1000+nGuanQia)/1000" -> 18060/60*nMin*(1000+nGuanQia)/1000
B108: 80 | C108: 100 | D108: =INT((RC[-1]*35+200)*(1+2)/4*0.2) -> 555 | E108: =INT((RC[-2]*28+160)*(1+2)/4*0.2) -> 444 | F108: =INT(10000*0.1*(100+1)/100*(1+RC[-3]/200)*0.2) -> 303 | G108: 80 | H108: 100 | I108: =RC[-5]*60 -> 33300 | J108: =RC[-5]*60 -> 26640 | K108: =RC[-5]*60 -> 18180 | L108: =RC[-3]&"/3600*(nPatrolSec+3)*(1000+nGuanQia)/1000" -> 33300/3600*(nPatrolSec+3)*(1000+nGuanQia)/1000 | M108: =RC[-3]&"/3600*(nPatrolSec+3)*(1000+nGuanQia)/1000" -> 26640/3600*(nPatrolSec+3)*(1000+nGuanQia)/1000 | N108: =RC[-3]&"/3600*(nPatrolSec+3)*(1000+nGuanQia)/1000" -> 18180/3600*(nPatrolSec+3)*(1000+nGuanQia)/1000 | O108: =RC[-6]&"/60*nMin*(1000+nGuanQia)/1000" -> 33300/60*nMin*(1000+nGuanQia)/1000 | P108: =RC[-6]&"/60*nMin*(1000+nGuanQia)/1000" -> 26640/60*nMin*(1000+nGuanQia)/1000 | Q108: =RC[-6]&"/60*nMin*(1000+nGuanQia)/1000" -> 18180/60*nMin*(1000+nGuanQia)/1000
B109: 81 | C109: =R[-1]C+1 -> 101 | D109: =INT((RC[-1]*35+200)*(1+2)/4*0.2) -> 560 | E109: =INT((RC[-2]*28+160)*(1+2)/4*0.2) -> 448 | F109: =INT(10000*0.1*(100+1)/100*(1+RC[-3]/200)*0.2) -> 304 | G109: 81 | H109: =R[-1]C+1 -> 101 | I109: =RC[-5]*60 -> 33600 | J109: =RC[-5]*60 -> 26880 | K109: =RC[-5]*60 -> 18240 | L109: =RC[-3]&"/3600*(nPatrolSec+3)*(1000+nGuanQia)/1000" -> 33600/3600*(nPatrolSec+3)*(1000+nGuanQia)/1000 | M109: =RC[-3]&"/3600*(nPatrolSec+3)*(1000+nGuanQia)/1000" -> 26880/3600*(nPatrolSec+3)*(1000+nGuanQia)/1000 | N109: =RC[-3]&"/3600*(nPatrolSec+3)*(1000+nGuanQia)/1000" -> 18240/3600*(nPatrolSec+3)*(1000+nGuanQia)/1000 | O109: =RC[-6]&"/60*nMin*(1000+nGuanQia)/1000" -> 33600/60*nMin*(1000+nGuanQia)/1000 | P109: =RC[-6]&"/60*nMin*(1000+nGuanQia)/1000" -> 26880/60*nMin*(1000+nGuanQia)/1000 | Q109: =RC[-6]&"/60*nMin*(1000+nGuanQia)/1000" -> 18240/60*nMin*(1000+nGuanQia)/1000
B110: 82 | C110: =R[-1]C+1 -> 102 | D110: =INT((RC[-1]*35+200)*(1+2)/4*0.2) -> 565 | E110: =INT((RC[-2]*28+160)*(1+2)/4*0.2) -> 452 | F110: =INT(10000*0.1*(100+1)/100*(1+RC[-3]/200)*0.2) -> 305 | G110: 82 | H110: =R[-1]C+1 -> 102 | I110: =RC[-5]*60 -> 33900 | J110: =RC[-5]*60 -> 27120 | K110: =RC[-5]*60 -> 18300 | L110: =RC[-3]&"/3600*(nPatrolSec+3)*(1000+nGuanQia)/1000" -> 33900/3600*(nPatrolSec+3)*(1000+nGuanQia)/1000 | M110: =RC[-3]&"/3600*(nPatrolSec+3)*(1000+nGuanQia)/1000" -> 27120/3600*(nPatrolSec+3)*(1000+nGuanQia)/1000 | N110: =RC[-3]&"/3600*(nPatrolSec+3)*(1000+nGuanQia)/1000" -> 18300/3600*(nPatrolSec+3)*(1000+nGuanQia)/1000 | O110: =RC[-6]&"/60*nMin*(1000+nGuanQia)/1000" -> 33900/60*nMin*(1000+nGuanQia)/1000 | P110: =RC[-6]&"/60*nMin*(1000+nGuanQia)/1000" -> 27120/60*nMin*(1000+nGuanQia)/1000 | Q110: =RC[-6]&"/60*nMin*(1000+nGuanQia)/1000" -> 18300/60*nMin*(1000+nGuanQia)/1000
B111: 83 | C111: =R[-1]C+1 -> 103 | D111: =INT((RC[-1]*35+200)*(1+2)/4*0.2) -> 570 | E111: =INT((RC[-2]*28+160)*(1+2)/4*0.2) -> 456 | F111: =INT(10000*0.1*(100+1)/100*(1+RC[-3]/200)*0.2) -> 306 | G111: 83 | H111: =R[-1]C+1 -> 103 | I111: =RC[-5]*60 -> 34200 | J111: =RC[-5]*60 -> 27360 | K111: =RC[-5]*60 -> 18360 | L111: =RC[-3]&"/3600*(nPatrolSec+3)*(1000+nGuanQia)/1000" -> 34200/3600*(nPatrolSec+3)*(1000+nGuanQia)/1000 | M111: =RC[-3]&"/3600*(nPatrolSec+3)*(1000+nGuanQia)/1000" -> 27360/3600*(nPatrolSec+3)*(1000+nGuanQia)/1000 | N111: =RC[-3]&"/3600*(nPatrolSec+3)*(1000+nGuanQia)/1000" -> 18360/3600*(nPatrolSec+3)*(1000+nGuanQia)/1000 | O111: =RC[-6]&"/60*nMin*(1000+nGuanQia)/1000" -> 34200/60*nMin*(1000+nGuanQia)/1000 | P111: =RC[-6]&"/60*nMin*(1000+nGuanQia)/1000" -> 27360/60*nMin*(1000+nGuanQia)/1000 | Q111: =RC[-6]&"/60*nMin*(1000+nGuanQia)/1000" -> 18360/60*nMin*(1000+nGuanQia)/1000
B112: 84 | C112: =R[-1]C+1 -> 104 | D112: =INT((RC[-1]*35+200)*(1+2)/4*0.2) -> 576 | E112: =INT((RC[-2]*28+160)*(1+2)/4*0.2) -> 460 | F112: =INT(10000*0.1*(100+1)/100*(1+RC[-3]/200)*0.2) -> 307 | G112: 84 | H112: =R[-1]C+1 -> 104 | I112: =RC[-5]*60 -> 34560 | J112: =RC[-5]*60 -> 27600 | K112: =RC[-5]*60 -> 18420 | L112: =RC[-3]&"/3600*(nPatrolSec+3)*(1000+nGuanQia)/1000" -> 34560/3600*(nPatrolSec+3)*(1000+nGuanQia)/1000 | M112: =RC[-3]&"/3600*(nPatrolSec+3)*(1000+nGuanQia)/1000" -> 27600/3600*(nPatrolSec+3)*(1000+nGuanQia)/1000 | N112: =RC[-3]&"/3600*(nPatrolSec+3)*(1000+nGuanQia)/1000" -> 18420/3600*(nPatrolSec+3)*(1000+nGuanQia)/1000 | O112: =RC[-6]&"/60*nMin*(1000+nGuanQia)/1000" -> 34560/60*nMin*(1000+nGuanQia)/1000 | P112: =RC[-6]&"/60*nMin*(1000+nGuanQia)/1000" -> 27600/60*nMin*(1000+nGuanQia)/1000 | Q112: =RC[-6]&"/60*nMin*(1000+nGuanQia)/1000" -> 18420/60*nMin*(1000+nGuanQia)/1000
B113: 85 | C113: =R[-1]C+1 -> 105 | D113: =INT((RC[-1]*35+200)*(1+2)/4*0.2) -> 581 | E113: =INT((RC[-2]*28+160)*(1+2)/4*0.2) -> 465 | F113: =INT(10000*0.1*(100+1)/100*(1+RC[-3]/200)*0.2) -> 308 | G113: 85 | H113: =R[-1]C+1 -> 105 | I113: =RC[-5]*60 -> 34860 | J113: =RC[-5]*60 -> 27900 | K113: =RC[-5]*60 -> 18480 | L113: =RC[-3]&"/3600*(nPatrolSec+3)*(1000+nGuanQia)/1000" -> 34860/3600*(nPatrolSec+3)*(1000+nGuanQia)/1000 | M113: =RC[-3]&"/3600*(nPatrolSec+3)*(1000+nGuanQia)/1000" -> 27900/3600*(nPatrolSec+3)*(1000+nGuanQia)/1000 | N113: =RC[-3]&"/3600*(nPatrolSec+3)*(1000+nGuanQia)/1000" -> 18480/3600*(nPatrolSec+3)*(1000+nGuanQia)/1000 | O113: =RC[-6]&"/60*nMin*(1000+nGuanQia)/1000" -> 34860/60*nMin*(1000+nGuanQia)/1000 | P113: =RC[-6]&"/60*nMin*(1000+nGuanQia)/1000" -> 27900/60*nMin*(1000+nGuanQia)/1000 | Q113: =RC[-6]&"/60*nMin*(1000+nGuanQia)/1000" -> 18480/60*nMin*(1000+nGuanQia)/1000
B114: 86 | C114: =R[-1]C+1 -> 106 | D114: =INT((RC[-1]*35+200)*(1+2)/4*0.2) -> 586 | E114: =INT((RC[-2]*28+160)*(1+2)/4*0.2) -> 469 | F114: =INT(10000*0.1*(100+1)/100*(1+RC[-3]/200)*0.2) -> 309 | G114: 86 | H114: =R[-1]C+1 -> 106 | I114: =RC[-5]*60 -> 35160 | J114: =RC[-5]*60 -> 28140 | K114: =RC[-5]*60 -> 18540 | L114: =RC[-3]&"/3600*(nPatrolSec+3)*(1000+nGuanQia)/1000" -> 35160/3600*(nPatrolSec+3)*(1000+nGuanQia)/1000 | M114: =RC[-3]&"/3600*(nPatrolSec+3)*(1000+nGuanQia)/1000" -> 28140/3600*(nPatrolSec+3)*(1000+nGuanQia)/1000 | N114: =RC[-3]&"/3600*(nPatrolSec+3)*(1000+nGuanQia)/1000" -> 18540/3600*(nPatrolSec+3)*(1000+nGuanQia)/1000 | O114: =RC[-6]&"/60*nMin*(1000+nGuanQia)/1000" -> 35160/60*nMin*(1000+nGuanQia)/1000 | P114: =RC[-6]&"/60*nMin*(1000+nGuanQia)/1000" -> 28140/60*nMin*(1000+nGuanQia)/1000 | Q114: =RC[-6]&"/60*nMin*(1000+nGuanQia)/1000" -> 18540/60*nMin*(1000+nGuanQia)/1000
B115: 87 | C115: =R[-1]C+1 -> 107 | D115: =INT((RC[-1]*35+200)*(1+2)/4*0.2) -> 591 | E115: =INT((RC[-2]*28+160)*(1+2)/4*0.2) -> 473 | F115: =INT(10000*0.1*(100+1)/100*(1+RC[-3]/200)*0.2) -> 310 | G115: 87 | H115: =R[-1]C+1 -> 107 | I115: =RC[-5]*60 -> 35460 | J115: =RC[-5]*60 -> 28380 | K115: =RC[-5]*60 -> 18600 | L115: =RC[-3]&"/3600*(nPatrolSec+3)*(1000+nGuanQia)/1000" -> 35460/3600*(nPatrolSec+3)*(1000+nGuanQia)/1000 | M115: =RC[-3]&"/3600*(nPatrolSec+3)*(1000+nGuanQia)/1000" -> 28380/3600*(nPatrolSec+3)*(1000+nGuanQia)/1000 | N115: =RC[-3]&"/3600*(nPatrolSec+3)*(1000+nGuanQia)/1000" -> 18600/3600*(nPatrolSec+3)*(1000+nGuanQia)/1000 | O115: =RC[-6]&"/60*nMin*(1000+nGuanQia)/1000" -> 35460/60*nMin*(1000+nGuanQia)/1000 | P115: =RC[-6]&"/60*nMin*(1000+nGuanQia)/1000" -> 28380/60*nMin*(1000+nGuanQia)/1000 | Q115: =RC[-6]&"/60*nMin*(1000+nGuanQia)/1000" -> 18600/60*nMin*(1000+nGuanQia)/1000
B116: 88 | C116: =R[-1]C+1 -> 108 | D116: =INT((RC[-1]*35+200)*(1+2)/4*0.2) -> 597 | E116: =INT((RC[-2]*28+160)*(1+2)/4*0.2) -> 477 | F116: =INT(10000*0.1*(100+1)/100*(1+RC[-3]/200)*0.2) -> 311 | G116: 88 | H116: =R[-1]C+1 -> 108 | I116: =RC[-5]*60 -> 35820 | J116: =RC[-5]*60 -> 28620 | K116: =RC[-5]*60 -> 18660 | L116: =RC[-3]&"/3600*(nPatrolSec+3)*(1000+nGuanQia)/1000" -> 35820/3600*(nPatrolSec+3)*(1000+nGuanQia)/1000 | M116: =RC[-3]&"/3600*(nPatrolSec+3)*(1000+nGuanQia)/1000" -> 28620/3600*(nPatrolSec+3)*(1000+nGuanQia)/1000 | N116: =RC[-3]&"/3600*(nPatrolSec+3)*(1000+nGuanQia)/1000" -> 18660/3600*(nPatrolSec+3)*(1000+nGuanQia)/1000 | O116: =RC[-6]&"/60*nMin*(1000+nGuanQia)/1000" -> 35820/60*nMin*(1000+nGuanQia)/1000 | P116: =RC[-6]&"/60*nMin*(1000+nGuanQia)/1000" -> 28620/60*nMin*(1000+nGuanQia)/1000 | Q116: =RC[-6]&"/60*nMin*(1000+nGuanQia)/1000" -> 18660/60*nMin*(1000+nGuanQia)/1000
B117: 89 | C117: =R[-1]C+1 -> 109 | D117: =INT((RC[-1]*35+200)*(1+2)/4*0.2) -> 602 | E117: =INT((RC[-2]*28+160)*(1+2)/4*0.2) -> 481 | F117: =INT(10000*0.1*(100+1)/100*(1+RC[-3]/200)*0.2) -> 312 | G117: 89 | H117: =R[-1]C+1 -> 109 | I117: =RC[-5]*60 -> 36120 | J117: =RC[-5]*60 -> 28860 | K117: =RC[-5]*60 -> 18720 | L117: =RC[-3]&"/3600*(nPatrolSec+3)*(1000+nGuanQia)/1000" -> 36120/3600*(nPatrolSec+3)*(1000+nGuanQia)/1000 | M117: =RC[-3]&"/3600*(nPatrolSec+3)*(1000+nGuanQia)/1000" -> 28860/3600*(nPatrolSec+3)*(1000+nGuanQia)/1000 | N117: =RC[-3]&"/3600*(nPatrolSec+3)*(1000+nGuanQia)/1000" -> 18720/3600*(nPatrolSec+3)*(1000+nGuanQia)/1000 | O117: =RC[-6]&"/60*nMin*(1000+nGuanQia)/1000" -> 36120/60*nMin*(1000+nGuanQia)/1000 | P117: =RC[-6]&"/60*nMin*(1000+nGuanQia)/1000" -> 28860/60*nMin*(1000+nGuanQia)/1000 | Q117: =RC[-6]&"/60*nMin*(1000+nGuanQia)/1000" -> 18720/60*nMin*(1000+nGuanQia)/1000
B118: 90 | C118: =R[-1]C+1 -> 110 | D118: =INT((RC[-1]*35+200)*(1+2)/4*0.2) -> 607 | E118: =INT((RC[-2]*28+160)*(1+2)/4*0.2) -> 486 | F118: =INT(10000*0.1*(100+1)/100*(1+RC[-3]/200)*0.2) -> 313 | G118: 90 | H118: =R[-1]C+1 -> 110 | I118: =RC[-5]*60 -> 36420 | J118: =RC[-5]*60 -> 29160 | K118: =RC[-5]*60 -> 18780 | L118: =RC[-3]&"/3600*(nPatrolSec+3)*(1000+nGuanQia)/1000" -> 36420/3600*(nPatrolSec+3)*(1000+nGuanQia)/1000 | M118: =RC[-3]&"/3600*(nPatrolSec+3)*(1000+nGuanQia)/1000" -> 29160/3600*(nPatrolSec+3)*(1000+nGuanQia)/1000 | N118: =RC[-3]&"/3600*(nPatrolSec+3)*(1000+nGuanQia)/1000" -> 18780/3600*(nPatrolSec+3)*(1000+nGuanQia)/1000 | O118: =RC[-6]&"/60*nMin*(1000+nGuanQia)/1000" -> 36420/60*nMin*(1000+nGuanQia)/1000 | P118: =RC[-6]&"/60*nMin*(1000+nGuanQia)/1000" -> 29160/60*nMin*(1000+nGuanQia)/1000 | Q118: =RC[-6]&"/60*nMin*(1000+nGuanQia)/1000" -> 18780/60*nMin*(1000+nGuanQia)/1000
B119: 91 | C119: =R[-1]C+1 -> 111 | D119: =INT((RC[-1]*35+200)*(1+2)/4*0.2) -> 612 | E119: =INT((RC[-2]*28+160)*(1+2)/4*0.2) -> 490 | F119: =INT(10000*0.1*(100+1)/100*(1+RC[-3]/200)*0.2) -> 314 | G119: 91 | H119: =R[-1]C+1 -> 111 | I119: =RC[-5]*60 -> 36720 | J119: =RC[-5]*60 -> 29400 | K119: =RC[-5]*60 -> 18840 | L119: =RC[-3]&"/3600*(nPatrolSec+3)*(1000+nGuanQia)/1000" -> 36720/3600*(nPatrolSec+3)*(1000+nGuanQia)/1000 | M119: =RC[-3]&"/3600*(nPatrolSec+3)*(1000+nGuanQia)/1000" -> 29400/3600*(nPatrolSec+3)*(1000+nGuanQia)/1000 | N119: =RC[-3]&"/3600*(nPatrolSec+3)*(1000+nGuanQia)/1000" -> 18840/3600*(nPatrolSec+3)*(1000+nGuanQia)/1000 | O119: =RC[-6]&"/60*nMin*(1000+nGuanQia)/1000" -> 36720/60*nMin*(1000+nGuanQia)/1000 | P119: =RC[-6]&"/60*nMin*(1000+nGuanQia)/1000" -> 29400/60*nMin*(1000+nGuanQia)/1000 | Q119: =RC[-6]&"/60*nMin*(1000+nGuanQia)/1000" -> 18840/60*nMin*(1000+nGuanQia)/1000
B120: 92 | C120: =R[-1]C+1 -> 112 | D120: =INT((RC[-1]*35+200)*(1+2)/4*0.2) -> 618 | E120: =INT((RC[-2]*28+160)*(1+2)/4*0.2) -> 494 | F120: =INT(10000*0.1*(100+1)/100*(1+RC[-3]/200)*0.2) -> 315 | G120: 92 | H120: =R[-1]C+1 -> 112 | I120: =RC[-5]*60 -> 37080 | J120: =RC[-5]*60 -> 29640 | K120: =RC[-5]*60 -> 18900 | L120: =RC[-3]&"/3600*(nPatrolSec+3)*(1000+nGuanQia)/1000" -> 37080/3600*(nPatrolSec+3)*(1000+nGuanQia)/1000 | M120: =RC[-3]&"/3600*(nPatrolSec+3)*(1000+nGuanQia)/1000" -> 29640/3600*(nPatrolSec+3)*(1000+nGuanQia)/1000 | N120: =RC[-3]&"/3600*(nPatrolSec+3)*(1000+nGuanQia)/1000" -> 18900/3600*(nPatrolSec+3)*(1000+nGuanQia)/1000 | O120: =RC[-6]&"/60*nMin*(1000+nGuanQia)/1000" -> 37080/60*nMin*(1000+nGuanQia)/1000 | P120: =RC[-6]&"/60*nMin*(1000+nGuanQia)/1000" -> 29640/60*nMin*(1000+nGuanQia)/1000 | Q120: =RC[-6]&"/60*nMin*(1000+nGuanQia)/1000" -> 18900/60*nMin*(1000+nGuanQia)/1000
B121: 93 | C121: =R[-1]C+1 -> 113 | D121: =INT((RC[-1]*35+200)*(1+2)/4*0.2) -> 623 | E121: =INT((RC[-2]*28+160)*(1+2)/4*0.2) -> 498 | F121: =INT(10000*0.1*(100+1)/100*(1+RC[-3]/200)*0.2) -> 316 | G121: 93 | H121: =R[-1]C+1 -> 113 | I121: =RC[-5]*60 -> 37380 | J121: =RC[-5]*60 -> 29880 | K121: =RC[-5]*60 -> 18960 | L121: =RC[-3]&"/3600*(nPatrolSec+3)*(1000+nGuanQia)/1000" -> 37380/3600*(nPatrolSec+3)*(1000+nGuanQia)/1000 | M121: =RC[-3]&"/3600*(nPatrolSec+3)*(1000+nGuanQia)/1000" -> 29880/3600*(nPatrolSec+3)*(1000+nGuanQia)/1000 | N121: =RC[-3]&"/3600*(nPatrolSec+3)*(1000+nGuanQia)/1000" -> 18960/3600*(nPatrolSec+3)*(1000+nGuanQia)/1000 | O121: =RC[-6]&"/60*nMin*(1000+nGuanQia)/1000" -> 37380/60*nMin*(1000+nGuanQia)/1000 | P121: =RC[-6]&"/60*nMin*(1000+nGuanQia)/1000" -> 29880/60*nMin*(1000+nGuanQia)/1000 | Q121: =RC[-6]&"/60*nMin*(1000+nGuanQia)/1000" -> 18960/60*nMin*(1000+nGuanQia)/1000
B122: 94 | C122: =R[-1]C+1 -> 114 | D122: =INT((RC[-1]*35+200)*(1+2)/4*0.2) -> 628 | E122: =INT((RC[-2]*28+160)*(1+2)/4*0.2) -> 502 | F122: =INT(10000*0.1*(100+1)/100*(1+RC[-3]/200)*0.2) -> 317 | G122: 94 | H122: =R[-1]C+1 -> 114 | I122: =RC[-5]*60 -> 37680 | J122: =RC[-5]*60 -> 30120 | K122: =RC[-5]*60 -> 19020 | L122: =RC[-3]&"/3600*(nPatrolSec+3)*(1000+nGuanQia)/1000" -> 37680/3600*(nPatrolSec+3)*(1000+nGuanQia)/1000 | M122: =RC[-3]&"/3600*(nPatrolSec+3)*(1000+nGuanQia)/1000" -> 30120/3600*(nPatrolSec+3)*(1000+nGuanQia)/1000 | N122: =RC[-3]&"/3600*(nPatrolSec+3)*(1000+nGuanQia)/1000" -> 19020/3600*(nPatrolSec+3)*(1000+nGuanQia)/1000 | O122: =RC[-6]&"/60*nMin*(1000+nGuanQia)/1000" -> 37680/60*nMin*(1000+nGuanQia)/1000 | P122: =RC[-6]&"/60*nMin*(1000+nGuanQia)/1000" -> 30120/60*nMin*(1000+nGuanQia)/1000 | Q122: =RC[-6]&"/60*nMin*(1000+nGuanQia)/1000" -> 19020/60*nMin*(1000+nGuanQia)/1000
B123: 95 | C123: =R[-1]C+1 -> 115 | D123: =INT((RC[-1]*35+200)*(1+2)/4*0.2) -> 633 | E123: =INT((RC[-2]*28+160)*(1+2)/4*0.2) -> 507 | F123: =INT(10000*0.1*(100+1)/100*(1+RC[-3]/200)*0.2) -> 318 | G123: 95 | H123: =R[-1]C+1 -> 115 | I123: =RC[-5]*60 -> 37980 | J123: =RC[-5]*60 -> 30420 | K123: =RC[-5]*60 -> 19080 | L123: =RC[-3]&"/3600*(nPatrolSec+3)*(1000+nGuanQia)/1000" -> 37980/3600*(nPatrolSec+3)*(1000+nGuanQia)/1000 | M123: =RC[-3]&"/3600*(nPatrolSec+3)*(1000+nGuanQia)/1000" -> 30420/3600*(nPatrolSec+3)*(1000+nGuanQia)/1000 | N123: =RC[-3]&"/3600*(nPatrolSec+3)*(1000+nGuanQia)/1000" -> 19080/3600*(nPatrolSec+3)*(1000+nGuanQia)/1000 | O123: =RC[-6]&"/60*nMin*(1000+nGuanQia)/1000" -> 37980/60*nMin*(1000+nGuanQia)/1000 | P123: =RC[-6]&"/60*nMin*(1000+nGuanQia)/1000" -> 30420/60*nMin*(1000+nGuanQia)/1000 | Q123: =RC[-6]&"/60*nMin*(1000+nGuanQia)/1000" -> 19080/60*nMin*(1000+nGuanQia)/1000
B124: 96 | C124: =R[-1]C+1 -> 116 | D124: =INT((RC[-1]*35+200)*(1+2)/4*0.2) -> 639 | E124: =INT((RC[-2]*28+160)*(1+2)/4*0.2) -> 511 | F124: =INT(10000*0.1*(100+1)/100*(1+RC[-3]/200)*0.2) -> 319 | G124: 96 | H124: =R[-1]C+1 -> 116 | I124: =RC[-5]*60 -> 38340 | J124: =RC[-5]*60 -> 30660 | K124: =RC[-5]*60 -> 19140 | L124: =RC[-3]&"/3600*(nPatrolSec+3)*(1000+nGuanQia)/1000" -> 38340/3600*(nPatrolSec+3)*(1000+nGuanQia)/1000 | M124: =RC[-3]&"/3600*(nPatrolSec+3)*(1000+nGuanQia)/1000" -> 30660/3600*(nPatrolSec+3)*(1000+nGuanQia)/1000 | N124: =RC[-3]&"/3600*(nPatrolSec+3)*(1000+nGuanQia)/1000" -> 19140/3600*(nPatrolSec+3)*(1000+nGuanQia)/1000 | O124: =RC[-6]&"/60*nMin*(1000+nGuanQia)/1000" -> 38340/60*nMin*(1000+nGuanQia)/1000 | P124: =RC[-6]&"/60*nMin*(1000+nGuanQia)/1000" -> 30660/60*nMin*(1000+nGuanQia)/1000 | Q124: =RC[-6]&"/60*nMin*(1000+nGuanQia)/1000" -> 19140/60*nMin*(1000+nGuanQia)/1000
B125: 97 | C125: =R[-1]C+1 -> 117 | D125: =INT((RC[-1]*35+200)*(1+2)/4*0.2) -> 644 | E125: =INT((RC[-2]*28+160)*(1+2)/4*0.2) -> 515 | F125: =INT(10000*0.1*(100+1)/100*(1+RC[-3]/200)*0.2) -> 320 | G125: 97 | H125: =R[-1]C+1 -> 117 | I125: =RC[-5]*60 -> 38640 | J125: =RC[-5]*60 -> 30900 | K125: =RC[-5]*60 -> 19200 | L125: =RC[-3]&"/3600*(nPatrolSec+3)*(1000+nGuanQia)/1000" -> 38640/3600*(nPatrolSec+3)*(1000+nGuanQia)/1000 | M125: =RC[-3]&"/3600*(nPatrolSec+3)*(1000+nGuanQia)/1000" -> 30900/3600*(nPatrolSec+3)*(1000+nGuanQia)/1000 | N125: =RC[-3]&"/3600*(nPatrolSec+3)*(1000+nGuanQia)/1000" -> 19200/3600*(nPatrolSec+3)*(1000+nGuanQia)/1000 | O125: =RC[-6]&"/60*nMin*(1000+nGuanQia)/1000" -> 38640/60*nMin*(1000+nGuanQia)/1000 | P125: =RC[-6]&"/60*nMin*(1000+nGuanQia)/1000" -> 30900/60*nMin*(1000+nGuanQia)/1000 | Q125: =RC[-6]&"/60*nMin*(1000+nGuanQia)/1000" -> 19200/60*nMin*(1000+nGuanQia)/1000
B126: 98 | C126: =R[-1]C+1 -> 118 | D126: =INT((RC[-1]*35+200)*(1+2)/4*0.2) -> 649 | E126: =INT((RC[-2]*28+160)*(1+2)/4*0.2) -> 519 | F126: =INT(10000*0.1*(100+1)/100*(1+RC[-3]/200)*0.2) -> 321 | G126: 98 | H126: =R[-1]C+1 -> 118 | I126: =RC[-5]*60 -> 38940 | J126: =RC[-5]*60 -> 31140 | K126: =RC[-5]*60 -> 19260 | L126: =RC[-3]&"/3600*(nPatrolSec+3)*(1000+nGuanQia)/1000" -> 38940/3600*(nPatrolSec+3)*(1000+nGuanQia)/1000 | M126: =RC[-3]&"/3600*(nPatrolSec+3)*(1000+nGuanQia)/1000" -> 31140/3600*(nPatrolSec+3)*(1000+nGuanQia)/1000 | N126: =RC[-3]&"/3600*(nPatrolSec+3)*(1000+nGuanQia)/1000" -> 19260/3600*(nPatrolSec+3)*(1000+nGuanQia)/1000 | O126: =RC[-6]&"/60*nMin*(1000+nGuanQia)/1000" -> 38940/60*nMin*(1000+nGuanQia)/1000 | P126: =RC[-6]&"/60*nMin*(1000+nGuanQia)/1000" -> 31140/60*nMin*(1000+nGuanQia)/1000 | Q126: =RC[-6]&"/60*nMin*(1000+nGuanQia)/1000" -> 19260/60*nMin*(1000+nGuanQia)/1000
B127: 99 | C127: =R[-1]C+1 -> 119 | D127: =INT((RC[-1]*35+200)*(1+2)/4*0.2) -> 654 | E127: =INT((RC[-2]*28+160)*(1+2)/4*0.2) -> 523 | F127: =INT(10000*0.1*(100+1)/100*(1+RC[-3]/200)*0.2) -> 322 | G127: 99 | H127: =R[-1]C+1 -> 119 | I127: =RC[-5]*60 -> 39240 | J127: =RC[-5]*60 -> 31380 | K127: =RC[-5]*60 -> 19320 | L127: =RC[-3]&"/3600*(nPatrolSec+3)*(1000+nGuanQia)/1000" -> 39240/3600*(nPatrolSec+3)*(1000+nGuanQia)/1000 | M127: =RC[-3]&"/3600*(nPatrolSec+3)*(1000+nGuanQia)/1000" -> 31380/3600*(nPatrolSec+3)*(1000+nGuanQia)/1000 | N127: =RC[-3]&"/3600*(nPatrolSec+3)*(1000+nGuanQia)/1000" -> 19320/3600*(nPatrolSec+3)*(1000+nGuanQia)/1000 | O127: =RC[-6]&"/60*nMin*(1000+nGuanQia)/1000" -> 39240/60*nMin*(1000+nGuanQia)/1000 | P127: =RC[-6]&"/60*nMin*(1000+nGuanQia)/1000" -> 31380/60*nMin*(1000+nGuanQia)/1000 | Q127: =RC[-6]&"/60*nMin*(1000+nGuanQia)/1000" -> 19320/60*nMin*(1000+nGuanQia)/1000

Sheet: Sheet4
B2: tFixReward
B3: t{iiib}
B4: 首通奖励 | C4: 序号 | D4: 首通奖励 | E4: 经验 | F4: 数量 | J4: 银币 | K4: 数量 | Q4: 经验 | S4: 银币
B5: 1,7,775,0;1,4,1100,0; | C5: 1 | D5: 1 | E5: 7 | F5: 775 | G5: 0 | I5: 1 | J5: 4 | K5: 1100 | L5: 0 | O5: ="1,7,"&RC[2]&",0;"&"1,4,"&RC[4]&",0;" -> 1,7,6385,0;1,4,140305,0; | Q5: =INT(((55+RC[-14]/10)*35+200)*12/4) -> 6385 | S5: =1000*110/100*(1+(55+RC[-16]/10)/200)*100 -> 140305.00000000003
B6: 1,7,786,0;1,4,1101,0; | C6: 2 | D6: 1 | E6: 7 | F6: 786 | G6: 0 | I6: 1 | J6: 4 | K6: 1101 | L6: 0 | O6: ="1,7,"&RC[2]&",0;"&"1,4,"&RC[4]&",0;" -> 1,7,6396,0;1,4,140360,0; | Q6: =INT(((55+RC[-14]/10)*35+200)*12/4) -> 6396 | S6: =1000*110/100*(1+(55+RC[-16]/10)/200)*100 -> 140360
B7: 1,7,796,0;1,4,1101,0; | C7: 3 | D7: 1 | E7: 7 | F7: 796 | G7: 0 | I7: 1 | J7: 4 | K7: 1101 | L7: 0 | O7: ="1,7,"&RC[2]&",0;"&"1,4,"&RC[4]&",0;" -> 1,7,6406,0;1,4,140415,0; | Q7: =INT(((55+RC[-14]/10)*35+200)*12/4) -> 6406 | S7: =1000*110/100*(1+(55+RC[-16]/10)/200)*100 -> 140415
B8: 1,7,807,0;1,4,1102,0; | C8: 4 | D8: 1 | E8: 7 | F8: 807 | G8: 0 | I8: 1 | J8: 4 | K8: 1102 | L8: 0 | O8: ="1,7,"&RC[2]&",0;"&"1,4,"&RC[4]&",0;" -> 1,7,6417,0;1,4,140470,0; | Q8: =INT(((55+RC[-14]/10)*35+200)*12/4) -> 6417 | S8: =1000*110/100*(1+(55+RC[-16]/10)/200)*100 -> 140469.99999999997
B9: 1,7,817,0;1,4,1102,0; | C9: 5 | D9: 1 | E9: 7 | F9: 817 | G9: 0 | I9: 1 | J9: 4 | K9: 1102 | L9: 0 | O9: ="1,7,"&RC[2]&",0;"&"1,4,"&RC[4]&",0;" -> 1,7,6427,0;1,4,140525,0; | Q9: =INT(((55+RC[-14]/10)*35+200)*12/4) -> 6427 | S9: =1000*110/100*(1+(55+RC[-16]/10)/200)*100 -> 140525
B10: 1,7,828,0;1,4,1103,0; | C10: 6 | D10: 1 | E10: 7 | F10: 828 | G10: 0 | I10: 1 | J10: 4 | K10: 1103 | L10: 0 | O10: ="1,7,"&RC[2]&",0;"&"1,4,"&RC[4]&",0;" -> 1,7,6438,0;1,4,140580,0; | Q10: =INT(((55+RC[-14]/10)*35+200)*12/4) -> 6438 | S10: =1000*110/100*(1+(55+RC[-16]/10)/200)*100 -> 140580
B11: 1,7,838,0;1,4,1103,0; | C11: 7 | D11: 1 | E11: 7 | F11: 838 | G11: 0 | I11: 1 | J11: 4 | K11: 1103 | L11: 0 | O11: ="1,7,"&RC[2]&",0;"&"1,4,"&RC[4]&",0;" -> 1,7,6448,0;1,4,140635,0; | Q11: =INT(((55+RC[-14]/10)*35+200)*12/4) -> 6448 | S11: =1000*110/100*(1+(55+RC[-16]/10)/200)*100 -> 140635
B12: 1,7,849,0;1,4,1104,0; | C12: 8 | D12: 1 | E12: 7 | F12: 849 | G12: 0 | I12: 1 | J12: 4 | K12: 1104 | L12: 0 | O12: ="1,7,"&RC[2]&",0;"&"1,4,"&RC[4]&",0;" -> 1,7,6459,0;1,4,140690,0; | Q12: =INT(((55+RC[-14]/10)*35+200)*12/4) -> 6459 | S12: =1000*110/100*(1+(55+RC[-16]/10)/200)*100 -> 140690
B13: 1,7,859,0;1,4,1104,0; | C13: 9 | D13: 1 | E13: 7 | F13: 859 | G13: 0 | I13: 1 | J13: 4 | K13: 1104 | L13: 0 | O13: ="1,7,"&RC[2]&",0;"&"1,4,"&RC[4]&",0;" -> 1,7,6469,0;1,4,140745,0; | Q13: =INT(((55+RC[-14]/10)*35+200)*12/4) -> 6469 | S13: =1000*110/100*(1+(55+RC[-16]/10)/200)*100 -> 140745
B14: 1,7,870,0;1,4,1105,0; | C14: 10 | D14: 1 | E14: 7 | F14: 870 | G14: 0 | I14: 1 | J14: 4 | K14: 1105 | L14: 0 | O14: ="1,7,"&RC[2]&",0;"&"1,4,"&RC[4]&",0;" -> 1,7,6480,0;1,4,140800,0; | Q14: =INT(((55+RC[-14]/10)*35+200)*12/4) -> 6480 | S14: =1000*110/100*(1+(55+RC[-16]/10)/200)*100 -> 140800
B15: 1,7,880,0;1,4,1106,0; | C15: 11 | D15: 1 | E15: 7 | F15: 880 | G15: 0 | I15: 1 | J15: 4 | K15: 1106 | L15: 0 | O15: ="1,7,"&RC[2]&",0;"&"1,4,"&RC[4]&",0;" -> 1,7,6490,0;1,4,140855,0; | Q15: =INT(((55+RC[-14]/10)*35+200)*12/4) -> 6490 | S15: =1000*110/100*(1+(55+RC[-16]/10)/200)*100 -> 140855
B16: 1,7,891,0;1,4,1106,0; | C16: 12 | D16: 1 | E16: 7 | F16: 891 | G16: 0 | I16: 1 | J16: 4 | K16: 1106 | L16: 0 | O16: ="1,7,"&RC[2]&",0;"&"1,4,"&RC[4]&",0;" -> 1,7,6501,0;1,4,140910,0; | Q16: =INT(((55+RC[-14]/10)*35+200)*12/4) -> 6501 | S16: =1000*110/100*(1+(55+RC[-16]/10)/200)*100 -> 140910
B17: 1,7,901,0;1,4,1107,0; | C17: 13 | D17: 1 | E17: 7 | F17: 901 | G17: 0 | I17: 1 | J17: 4 | K17: 1107 | L17: 0 | O17: ="1,7,"&RC[2]&",0;"&"1,4,"&RC[4]&",0;" -> 1,7,6511,0;1,4,140965,0; | Q17: =INT(((55+RC[-14]/10)*35+200)*12/4) -> 6511 | S17: =1000*110/100*(1+(55+RC[-16]/10)/200)*100 -> 140965
B18: 1,7,912,0;1,4,1107,0; | C18: 14 | D18: 1 | E18: 7 | F18: 912 | G18: 0 | I18: 1 | J18: 4 | K18: 1107 | L18: 0 | O18: ="1,7,"&RC[2]&",0;"&"1,4,"&RC[4]&",0;" -> 1,7,6522,0;1,4,141020,0; | Q18: =INT(((55+RC[-14]/10)*35+200)*12/4) -> 6522 | S18: =1000*110/100*(1+(55+RC[-16]/10)/200)*100 -> 141020
B19: 1,7,922,0;1,4,1108,0; | C19: 15 | D19: 1 | E19: 7 | F19: 922 | G19: 0 | I19: 1 | J19: 4 | K19: 1108 | L19: 0 | O19: ="1,7,"&RC[2]&",0;"&"1,4,"&RC[4]&",0;" -> 1,7,6532,0;1,4,141075,0; | Q19: =INT(((55+RC[-14]/10)*35+200)*12/4) -> 6532 | S19: =1000*110/100*(1+(55+RC[-16]/10)/200)*100 -> 141075
B20: 1,7,933,0;1,4,1108,0; | C20: 16 | D20: 1 | E20: 7 | F20: 933 | G20: 0 | I20: 1 | J20: 4 | K20: 1108 | L20: 0 | O20: ="1,7,"&RC[2]&",0;"&"1,4,"&RC[4]&",0;" -> 1,7,6543,0;1,4,141130,0; | Q20: =INT(((55+RC[-14]/10)*35+200)*12/4) -> 6543 | S20: =1000*110/100*(1+(55+RC[-16]/10)/200)*100 -> 141130
B21: 1,7,943,0;1,4,1109,0; | C21: 17 | D21: 1 | E21: 7 | F21: 943 | G21: 0 | I21: 1 | J21: 4 | K21: 1109 | L21: 0 | O21: ="1,7,"&RC[2]&",0;"&"1,4,"&RC[4]&",0;" -> 1,7,6553,0;1,4,141185,0; | Q21: =INT(((55+RC[-14]/10)*35+200)*12/4) -> 6553 | S21: =1000*110/100*(1+(55+RC[-16]/10)/200)*100 -> 141185
B22: 1,7,954,0;1,4,1109,0; | C22: 18 | D22: 1 | E22: 7 | F22: 954 | G22: 0 | I22: 1 | J22: 4 | K22: 1109 | L22: 0 | O22: ="1,7,"&RC[2]&",0;"&"1,4,"&RC[4]&",0;" -> 1,7,6564,0;1,4,141240,0; | Q22: =INT(((55+RC[-14]/10)*35+200)*12/4) -> 6564 | S22: =1000*110/100*(1+(55+RC[-16]/10)/200)*100 -> 141240
B23: 1,7,964,0;1,4,1110,0; | C23: 19 | D23: 1 | E23: 7 | F23: 964 | G23: 0 | I23: 1 | J23: 4 | K23: 1110 | L23: 0 | O23: ="1,7,"&RC[2]&",0;"&"1,4,"&RC[4]&",0;" -> 1,7,6574,0;1,4,141295,0; | Q23: =INT(((55+RC[-14]/10)*35+200)*12/4) -> 6574 | S23: =1000*110/100*(1+(55+RC[-16]/10)/200)*100 -> 141295
B24: 1,7,975,0;1,4,1111,0; | C24: 20 | D24: 1 | E24: 7 | F24: 975 | G24: 0 | I24: 1 | J24: 4 | K24: 1111 | L24: 0 | O24: ="1,7,"&RC[2]&",0;"&"1,4,"&RC[4]&",0;" -> 1,7,6585,0;1,4,141350,0; | Q24: =INT(((55+RC[-14]/10)*35+200)*12/4) -> 6585 | S24: =1000*110/100*(1+(55+RC[-16]/10)/200)*100 -> 141350
B25: 1,7,985,0;1,4,1111,0; | C25: 21 | D25: 1 | E25: 7 | F25: 985 | G25: 0 | I25: 1 | J25: 4 | K25: 1111 | L25: 0 | O25: ="1,7,"&RC[2]&",0;"&"1,4,"&RC[4]&",0;" -> 1,7,6595,0;1,4,141405,0; | Q25: =INT(((55+RC[-14]/10)*35+200)*12/4) -> 6595 | S25: =1000*110/100*(1+(55+RC[-16]/10)/200)*100 -> 141405.00000000003
B26: 1,7,996,0;1,4,1112,0; | C26: 22 | D26: 1 | E26: 7 | F26: 996 | G26: 0 | I26: 1 | J26: 4 | K26: 1112 | L26: 0 | O26: ="1,7,"&RC[2]&",0;"&"1,4,"&RC[4]&",0;" -> 1,7,6606,0;1,4,141460,0; | Q26: =INT(((55+RC[-14]/10)*35+200)*12/4) -> 6606 | S26: =1000*110/100*(1+(55+RC[-16]/10)/200)*100 -> 141460
B27: 1,7,1006,0;1,4,1112,0; | C27: 23 | D27: 1 | E27: 7 | F27: 1006 | G27: 0 | I27: 1 | J27: 4 | K27: 1112 | L27: 0 | O27: ="1,7,"&RC[2]&",0;"&"1,4,"&RC[4]&",0;" -> 1,7,6616,0;1,4,141515,0; | Q27: =INT(((55+RC[-14]/10)*35+200)*12/4) -> 6616 | S27: =1000*110/100*(1+(55+RC[-16]/10)/200)*100 -> 141515
B28: 1,7,1017,0;1,4,1113,0; | C28: 24 | D28: 1 | E28: 7 | F28: 1017 | G28: 0 | I28: 1 | J28: 4 | K28: 1113 | L28: 0 | O28: ="1,7,"&RC[2]&",0;"&"1,4,"&RC[4]&",0;" -> 1,7,6627,0;1,4,141570,0; | Q28: =INT(((55+RC[-14]/10)*35+200)*12/4) -> 6627 | S28: =1000*110/100*(1+(55+RC[-16]/10)/200)*100 -> 141569.99999999997
B29: 1,7,1027,0;1,4,1113,0; | C29: 25 | D29: 1 | E29: 7 | F29: 1027 | G29: 0 | I29: 1 | J29: 4 | K29: 1113 | L29: 0 | O29: ="1,7,"&RC[2]&",0;"&"1,4,"&RC[4]&",0;" -> 1,7,6637,0;1,4,141625,0; | Q29: =INT(((55+RC[-14]/10)*35+200)*12/4) -> 6637 | S29: =1000*110/100*(1+(55+RC[-16]/10)/200)*100 -> 141625
B30: 1,7,1038,0;1,4,1114,0; | C30: 26 | D30: 1 | E30: 7 | F30: 1038 | G30: 0 | I30: 1 | J30: 4 | K30: 1114 | L30: 0 | O30: ="1,7,"&RC[2]&",0;"&"1,4,"&RC[4]&",0;" -> 1,7,6648,0;1,4,141680,0; | Q30: =INT(((55+RC[-14]/10)*35+200)*12/4) -> 6648 | S30: =1000*110/100*(1+(55+RC[-16]/10)/200)*100 -> 141680
B31: 1,7,1048,0;1,4,1114,0; | C31: 27 | D31: 1 | E31: 7 | F31: 1048 | G31: 0 | I31: 1 | J31: 4 | K31: 1114 | L31: 0 | O31: ="1,7,"&RC[2]&",0;"&"1,4,"&RC[4]&",0;" -> 1,7,6658,0;1,4,141735,0; | Q31: =INT(((55+RC[-14]/10)*35+200)*12/4) -> 6658 | S31: =1000*110/100*(1+(55+RC[-16]/10)/200)*100 -> 141735
B32: 1,7,1059,0;1,4,1115,0; | C32: 28 | D32: 1 | E32: 7 | F32: 1059 | G32: 0 | I32: 1 | J32: 4 | K32: 1115 | L32: 0 | O32: ="1,7,"&RC[2]&",0;"&"1,4,"&RC[4]&",0;" -> 1,7,6669,0;1,4,141790,0; | Q32: =INT(((55+RC[-14]/10)*35+200)*12/4) -> 6669 | S32: =1000*110/100*(1+(55+RC[-16]/10)/200)*100 -> 141790
B33: 1,7,1069,0;1,4,1115,0; | C33: 29 | D33: 1 | E33: 7 | F33: 1069 | G33: 0 | I33: 1 | J33: 4 | K33: 1115 | L33: 0 | O33: ="1,7,"&RC[2]&",0;"&"1,4,"&RC[4]&",0;" -> 1,7,6679,0;1,4,141845,0; | Q33: =INT(((55+RC[-14]/10)*35+200)*12/4) -> 6679 | S33: =1000*110/100*(1+(55+RC[-16]/10)/200)*100 -> 141844.99999999997
B34: 1,7,1080,0;1,4,1116,0; | C34: 30 | D34: 1 | E34: 7 | F34: 1080 | G34: 0 | I34: 1 | J34: 4 | K34: 1116 | L34: 0 | O34: ="1,7,"&RC[2]&",0;"&"1,4,"&RC[4]&",0;" -> 1,7,6690,0;1,4,141900,0; | Q34: =INT(((55+RC[-14]/10)*35+200)*12/4) -> 6690 | S34: =1000*110/100*(1+(55+RC[-16]/10)/200)*100 -> 141900
B35: 1,7,1090,0;1,4,1117,0; | C35: 31 | D35: 1 | E35: 7 | F35: 1090 | G35: 0 | I35: 1 | J35: 4 | K35: 1117 | L35: 0 | O35: ="1,7,"&RC[2]&",0;"&"1,4,"&RC[4]&",0;" -> 1,7,6700,0;1,4,141955,0; | Q35: =INT(((55+RC[-14]/10)*35+200)*12/4) -> 6700 | S35: =1000*110/100*(1+(55+RC[-16]/10)/200)*100 -> 141955
B36: 1,7,1101,0;1,4,1117,0; | C36: 32 | D36: 1 | E36: 7 | F36: 1101 | G36: 0 | I36: 1 | J36: 4 | K36: 1117 | L36: 0 | O36: ="1,7,"&RC[2]&",0;"&"1,4,"&RC[4]&",0;" -> 1,7,6711,0;1,4,142010,0; | Q36: =INT(((55+RC[-14]/10)*35+200)*12/4) -> 6711 | S36: =1000*110/100*(1+(55+RC[-16]/10)/200)*100 -> 142010
B37: 1,7,1111,0;1,4,1118,0; | C37: 33 | D37: 1 | E37: 7 | F37: 1111 | G37: 0 | I37: 1 | J37: 4 | K37: 1118 | L37: 0 | O37: ="1,7,"&RC[2]&",0;"&"1,4,"&RC[4]&",0;" -> 1,7,6721,0;1,4,142065,0; | Q37: =INT(((55+RC[-14]/10)*35+200)*12/4) -> 6721 | S37: =1000*110/100*(1+(55+RC[-16]/10)/200)*100 -> 142065
B38: 1,7,1122,0;1,4,1118,0; | C38: 34 | D38: 1 | E38: 7 | F38: 1122 | G38: 0 | I38: 1 | J38: 4 | K38: 1118 | L38: 0 | O38: ="1,7,"&RC[2]&",0;"&"1,4,"&RC[4]&",0;" -> 1,7,6732,0;1,4,142120,0; | Q38: =INT(((55+RC[-14]/10)*35+200)*12/4) -> 6732 | S38: =1000*110/100*(1+(55+RC[-16]/10)/200)*100 -> 142120
B39: 1,7,1132,0;1,4,1119,0; | C39: 35 | D39: 1 | E39: 7 | F39: 1132 | G39: 0 | I39: 1 | J39: 4 | K39: 1119 | L39: 0 | O39: ="1,7,"&RC[2]&",0;"&"1,4,"&RC[4]&",0;" -> 1,7,6742,0;1,4,142175,0; | Q39: =INT(((55+RC[-14]/10)*35+200)*12/4) -> 6742 | S39: =1000*110/100*(1+(55+RC[-16]/10)/200)*100 -> 142175
B40: 1,7,1143,0;1,4,1119,0; | C40: 36 | D40: 1 | E40: 7 | F40: 1143 | G40: 0 | I40: 1 | J40: 4 | K40: 1119 | L40: 0 | O40: ="1,7,"&RC[2]&",0;"&"1,4,"&RC[4]&",0;" -> 1,7,6753,0;1,4,142230,0; | Q40: =INT(((55+RC[-14]/10)*35+200)*12/4) -> 6753 | S40: =1000*110/100*(1+(55+RC[-16]/10)/200)*100 -> 142230
B41: 1,7,1153,0;1,4,1120,0; | C41: 37 | D41: 1 | E41: 7 | F41: 1153 | G41: 0 | I41: 1 | J41: 4 | K41: 1120 | L41: 0 | O41: ="1,7,"&RC[2]&",0;"&"1,4,"&RC[4]&",0;" -> 1,7,6763,0;1,4,142285,0; | Q41: =INT(((55+RC[-14]/10)*35+200)*12/4) -> 6763 | S41: =1000*110/100*(1+(55+RC[-16]/10)/200)*100 -> 142285
B42: 1,7,1164,0;1,4,1120,0; | C42: 38 | D42: 1 | E42: 7 | F42: 1164 | G42: 0 | I42: 1 | J42: 4 | K42: 1120 | L42: 0 | O42: ="1,7,"&RC[2]&",0;"&"1,4,"&RC[4]&",0;" -> 1,7,6774,0;1,4,142340,0; | Q42: =INT(((55+RC[-14]/10)*35+200)*12/4) -> 6774 | S42: =1000*110/100*(1+(55+RC[-16]/10)/200)*100 -> 142340
B43: 1,7,1174,0;1,4,1121,0; | C43: 39 | D43: 1 | E43: 7 | F43: 1174 | G43: 0 | I43: 1 | J43: 4 | K43: 1121 | L43: 0 | O43: ="1,7,"&RC[2]&",0;"&"1,4,"&RC[4]&",0;" -> 1,7,6784,0;1,4,142395,0; | Q43: =INT(((55+RC[-14]/10)*35+200)*12/4) -> 6784 | S43: =1000*110/100*(1+(55+RC[-16]/10)/200)*100 -> 142395
B44: 1,7,1185,0;1,4,1122,0; | C44: 40 | D44: 1 | E44: 7 | F44: 1185 | G44: 0 | I44: 1 | J44: 4 | K44: 1122 | L44: 0 | O44: ="1,7,"&RC[2]&",0;"&"1,4,"&RC[4]&",0;" -> 1,7,6795,0;1,4,142450,0; | Q44: =INT(((55+RC[-14]/10)*35+200)*12/4) -> 6795 | S44: =1000*110/100*(1+(55+RC[-16]/10)/200)*100 -> 142450
B45: 1,7,1195,0;1,4,1122,0; | C45: 41 | D45: 1 | E45: 7 | F45: 1195 | G45: 0 | I45: 1 | J45: 4 | K45: 1122 | L45: 0 | O45: ="1,7,"&RC[2]&",0;"&"1,4,"&RC[4]&",0;" -> 1,7,6805,0;1,4,142505,0; | Q45: =INT(((55+RC[-14]/10)*35+200)*12/4) -> 6805 | S45: =1000*110/100*(1+(55+RC[-16]/10)/200)*100 -> 142505.00000000003
B46: 1,7,1206,0;1,4,1123,0; | C46: 42 | D46: 1 | E46: 7 | F46: 1206 | G46: 0 | I46: 1 | J46: 4 | K46: 1123 | L46: 0 | O46: ="1,7,"&RC[2]&",0;"&"1,4,"&RC[4]&",0;" -> 1,7,6816,0;1,4,142560,0; | Q46: =INT(((55+RC[-14]/10)*35+200)*12/4) -> 6816 | S46: =1000*110/100*(1+(55+RC[-16]/10)/200)*100 -> 142560
B47: 1,7,1216,0;1,4,1123,0; | C47: 43 | D47: 1 | E47: 7 | F47: 1216 | G47: 0 | I47: 1 | J47: 4 | K47: 1123 | L47: 0 | O47: ="1,7,"&RC[2]&",0;"&"1,4,"&RC[4]&",0;" -> 1,7,6826,0;1,4,142615,0; | Q47: =INT(((55+RC[-14]/10)*35+200)*12/4) -> 6826 | S47: =1000*110/100*(1+(55+RC[-16]/10)/200)*100 -> 142615
B48: 1,7,1227,0;1,4,1124,0; | C48: 44 | D48: 1 | E48: 7 | F48: 1227 | G48: 0 | I48: 1 | J48: 4 | K48: 1124 | L48: 0 | O48: ="1,7,"&RC[2]&",0;"&"1,4,"&RC[4]&",0;" -> 1,7,6837,0;1,4,142670,0; | Q48: =INT(((55+RC[-14]/10)*35+200)*12/4) -> 6837 | S48: =1000*110/100*(1+(55+RC[-16]/10)/200)*100 -> 142669.99999999997
B49: 1,7,1237,0;1,4,1124,0; | C49: 45 | D49: 1 | E49: 7 | F49: 1237 | G49: 0 | I49: 1 | J49: 4 | K49: 1124 | L49: 0 | O49: ="1,7,"&RC[2]&",0;"&"1,4,"&RC[4]&",0;" -> 1,7,6847,0;1,4,142725,0; | Q49: =INT(((55+RC[-14]/10)*35+200)*12/4) -> 6847 | S49: =1000*110/100*(1+(55+RC[-16]/10)/200)*100 -> 142724.99999999997
B50: 1,7,1248,0;1,4,1125,0; | C50: 46 | D50: 1 | E50: 7 | F50: 1248 | G50: 0 | I50: 1 | J50: 4 | K50: 1125 | L50: 0 | O50: ="1,7,"&RC[2]&",0;"&"1,4,"&RC[4]&",0;" -> 1,7,6858,0;1,4,142780,0; | Q50: =INT(((55+RC[-14]/10)*35+200)*12/4) -> 6858 | S50: =1000*110/100*(1+(55+RC[-16]/10)/200)*100 -> 142780
B51: 1,7,1258,0;1,4,1125,0; | C51: 47 | D51: 1 | E51: 7 | F51: 1258 | G51: 0 | I51: 1 | J51: 4 | K51: 1125 | L51: 0 | O51: ="1,7,"&RC[2]&",0;"&"1,4,"&RC[4]&",0;" -> 1,7,6868,0;1,4,142835,0; | Q51: =INT(((55+RC[-14]/10)*35+200)*12/4) -> 6868 | S51: =1000*110/100*(1+(55+RC[-16]/10)/200)*100 -> 142835
B52: 1,7,1269,0;1,4,1126,0; | C52: 48 | D52: 1 | E52: 7 | F52: 1269 | G52: 0 | I52: 1 | J52: 4 | K52: 1126 | L52: 0 | O52: ="1,7,"&RC[2]&",0;"&"1,4,"&RC[4]&",0;" -> 1,7,6879,0;1,4,142890,0; | Q52: =INT(((55+RC[-14]/10)*35+200)*12/4) -> 6879 | S52: =1000*110/100*(1+(55+RC[-16]/10)/200)*100 -> 142890
B53: 1,7,1279,0;1,4,1126,0; | C53: 49 | D53: 1 | E53: 7 | F53: 1279 | G53: 0 | I53: 1 | J53: 4 | K53: 1126 | L53: 0 | O53: ="1,7,"&RC[2]&",0;"&"1,4,"&RC[4]&",0;" -> 1,7,6889,0;1,4,142945,0; | Q53: =INT(((55+RC[-14]/10)*35+200)*12/4) -> 6889 | S53: =1000*110/100*(1+(55+RC[-16]/10)/200)*100 -> 142945
B54: 1,7,1290,0;1,4,1127,0; | C54: 50 | D54: 1 | E54: 7 | F54: 1290 | G54: 0 | I54: 1 | J54: 4 | K54: 1127 | L54: 0 | O54: ="1,7,"&RC[2]&",0;"&"1,4,"&RC[4]&",0;" -> 1,7,6900,0;1,4,143000,0; | Q54: =INT(((55+RC[-14]/10)*35+200)*12/4) -> 6900 | S54: =1000*110/100*(1+(55+RC[-16]/10)/200)*100 -> 143000
B55: 1,7,1300,0;1,4,1128,0; | C55: 51 | D55: 1 | E55: 7 | F55: 1300 | G55: 0 | I55: 1 | J55: 4 | K55: 1128 | L55: 0 | O55: ="1,7,"&RC[2]&",0;"&"1,4,"&RC[4]&",0;" -> 1,7,6910,0;1,4,143055,0; | Q55: =INT(((55+RC[-14]/10)*35+200)*12/4) -> 6910 | S55: =1000*110/100*(1+(55+RC[-16]/10)/200)*100 -> 143055
B56: 1,7,1311,0;1,4,1128,0; | C56: 52 | D56: 1 | E56: 7 | F56: 1311 | G56: 0 | I56: 1 | J56: 4 | K56: 1128 | L56: 0 | O56: ="1,7,"&RC[2]&",0;"&"1,4,"&RC[4]&",0;" -> 1,7,6921,0;1,4,143110,0; | Q56: =INT(((55+RC[-14]/10)*35+200)*12/4) -> 6921 | S56: =1000*110/100*(1+(55+RC[-16]/10)/200)*100 -> 143110
B57: 1,7,1321,0;1,4,1129,0; | C57: 53 | D57: 1 | E57: 7 | F57: 1321 | G57: 0 | I57: 1 | J57: 4 | K57: 1129 | L57: 0 | O57: ="1,7,"&RC[2]&",0;"&"1,4,"&RC[4]&",0;" -> 1,7,6931,0;1,4,143165,0; | Q57: =INT(((55+RC[-14]/10)*35+200)*12/4) -> 6931 | S57: =1000*110/100*(1+(55+RC[-16]/10)/200)*100 -> 143165
B58: 1,7,1332,0;1,4,1129,0; | C58: 54 | D58: 1 | E58: 7 | F58: 1332 | G58: 0 | I58: 1 | J58: 4 | K58: 1129 | L58: 0 | O58: ="1,7,"&RC[2]&",0;"&"1,4,"&RC[4]&",0;" -> 1,7,6942,0;1,4,143220,0; | Q58: =INT(((55+RC[-14]/10)*35+200)*12/4) -> 6942 | S58: =1000*110/100*(1+(55+RC[-16]/10)/200)*100 -> 143220
B59: 1,7,1342,0;1,4,1130,0; | C59: 55 | D59: 1 | E59: 7 | F59: 1342 | G59: 0 | I59: 1 | J59: 4 | K59: 1130 | L59: 0 | O59: ="1,7,"&RC[2]&",0;"&"1,4,"&RC[4]&",0;" -> 1,7,6952,0;1,4,143275,0; | Q59: =INT(((55+RC[-14]/10)*35+200)*12/4) -> 6952 | S59: =1000*110/100*(1+(55+RC[-16]/10)/200)*100 -> 143275
B60: 1,7,1353,0;1,4,1130,0; | C60: 56 | D60: 1 | E60: 7 | F60: 1353 | G60: 0 | I60: 1 | J60: 4 | K60: 1130 | L60: 0 | O60: ="1,7,"&RC[2]&",0;"&"1,4,"&RC[4]&",0;" -> 1,7,6963,0;1,4,143330,0; | Q60: =INT(((55+RC[-14]/10)*35+200)*12/4) -> 6963 | S60: =1000*110/100*(1+(55+RC[-16]/10)/200)*100 -> 143330
B61: 1,7,1363,0;1,4,1131,0; | C61: 57 | D61: 1 | E61: 7 | F61: 1363 | G61: 0 | I61: 1 | J61: 4 | K61: 1131 | L61: 0 | O61: ="1,7,"&RC[2]&",0;"&"1,4,"&RC[4]&",0;" -> 1,7,6973,0;1,4,143385,0; | Q61: =INT(((55+RC[-14]/10)*35+200)*12/4) -> 6973 | S61: =1000*110/100*(1+(55+RC[-16]/10)/200)*100 -> 143385
B62: 1,7,1374,0;1,4,1131,0; | C62: 58 | D62: 1 | E62: 7 | F62: 1374 | G62: 0 | I62: 1 | J62: 4 | K62: 1131 | L62: 0 | O62: ="1,7,"&RC[2]&",0;"&"1,4,"&RC[4]&",0;" -> 1,7,6984,0;1,4,143440,0; | Q62: =INT(((55+RC[-14]/10)*35+200)*12/4) -> 6984 | S62: =1000*110/100*(1+(55+RC[-16]/10)/200)*100 -> 143440
B63: 1,7,1384,0;1,4,1132,0; | C63: 59 | D63: 1 | E63: 7 | F63: 1384 | G63: 0 | I63: 1 | J63: 4 | K63: 1132 | L63: 0 | O63: ="1,7,"&RC[2]&",0;"&"1,4,"&RC[4]&",0;" -> 1,7,6994,0;1,4,143495,0; | Q63: =INT(((55+RC[-14]/10)*35+200)*12/4) -> 6994 | S63: =1000*110/100*(1+(55+RC[-16]/10)/200)*100 -> 143495
B64: 1,7,1395,0;1,4,1133,0; | C64: 60 | D64: 1 | E64: 7 | F64: 1395 | G64: 0 | I64: 1 | J64: 4 | K64: 1133 | L64: 0 | O64: ="1,7,"&RC[2]&",0;"&"1,4,"&RC[4]&",0;" -> 1,7,7005,0;1,4,143550,0; | Q64: =INT(((55+RC[-14]/10)*35+200)*12/4) -> 7005 | S64: =1000*110/100*(1+(55+RC[-16]/10)/200)*100 -> 143550
B65: 1,7,1405,0;1,4,1133,0; | C65: 61 | D65: 1 | E65: 7 | F65: 1405 | G65: 0 | I65: 1 | J65: 4 | K65: 1133 | L65: 0 | O65: ="1,7,"&RC[2]&",0;"&"1,4,"&RC[4]&",0;" -> 1,7,7015,0;1,4,143605,0; | Q65: =INT(((55+RC[-14]/10)*35+200)*12/4) -> 7015 | S65: =1000*110/100*(1+(55+RC[-16]/10)/200)*100 -> 143605
B66: 1,7,1416,0;1,4,1134,0; | C66: 62 | D66: 1 | E66: 7 | F66: 1416 | G66: 0 | I66: 1 | J66: 4 | K66: 1134 | L66: 0 | O66: ="1,7,"&RC[2]&",0;"&"1,4,"&RC[4]&",0;" -> 1,7,7026,0;1,4,143660,0; | Q66: =INT(((55+RC[-14]/10)*35+200)*12/4) -> 7026 | S66: =1000*110/100*(1+(55+RC[-16]/10)/200)*100 -> 143660
B67: 1,7,1426,0;1,4,1134,0; | C67: 63 | D67: 1 | E67: 7 | F67: 1426 | G67: 0 | I67: 1 | J67: 4 | K67: 1134 | L67: 0 | O67: ="1,7,"&RC[2]&",0;"&"1,4,"&RC[4]&",0;" -> 1,7,7036,0;1,4,143715,0; | Q67: =INT(((55+RC[-14]/10)*35+200)*12/4) -> 7036 | S67: =1000*110/100*(1+(55+RC[-16]/10)/200)*100 -> 143715
B68: 1,7,1437,0;1,4,1135,0; | C68: 64 | D68: 1 | E68: 7 | F68: 1437 | G68: 0 | I68: 1 | J68: 4 | K68: 1135 | L68: 0 | O68: ="1,7,"&RC[2]&",0;"&"1,4,"&RC[4]&",0;" -> 1,7,7047,0;1,4,143770,0; | Q68: =INT(((55+RC[-14]/10)*35+200)*12/4) -> 7047 | S68: =1000*110/100*(1+(55+RC[-16]/10)/200)*100 -> 143770
B69: 1,7,1447,0;1,4,1135,0; | C69: 65 | D69: 1 | E69: 7 | F69: 1447 | G69: 0 | I69: 1 | J69: 4 | K69: 1135 | L69: 0 | O69: ="1,7,"&RC[2]&",0;"&"1,4,"&RC[4]&",0;" -> 1,7,7057,0;1,4,143825,0; | Q69: =INT(((55+RC[-14]/10)*35+200)*12/4) -> 7057 | S69: =1000*110/100*(1+(55+RC[-16]/10)/200)*100 -> 143825.00000000003
B70: 1,7,1458,0;1,4,1136,0; | C70: 66 | D70: 1 | E70: 7 | F70: 1458 | G70: 0 | I70: 1 | J70: 4 | K70: 1136 | L70: 0 | O70: ="1,7,"&RC[2]&",0;"&"1,4,"&RC[4]&",0;" -> 1,7,7068,0;1,4,143880,0; | Q70: =INT(((55+RC[-14]/10)*35+200)*12/4) -> 7068 | S70: =1000*110/100*(1+(55+RC[-16]/10)/200)*100 -> 143880
B71: 1,7,1468,0;1,4,1136,0; | C71: 67 | D71: 1 | E71: 7 | F71: 1468 | G71: 0 | I71: 1 | J71: 4 | K71: 1136 | L71: 0 | O71: ="1,7,"&RC[2]&",0;"&"1,4,"&RC[4]&",0;" -> 1,7,7078,0;1,4,143935,0; | Q71: =INT(((55+RC[-14]/10)*35+200)*12/4) -> 7078 | S71: =1000*110/100*(1+(55+RC[-16]/10)/200)*100 -> 143935
B72: 1,7,1479,0;1,4,1137,0; | C72: 68 | D72: 1 | E72: 7 | F72: 1479 | G72: 0 | I72: 1 | J72: 4 | K72: 1137 | L72: 0 | O72: ="1,7,"&RC[2]&",0;"&"1,4,"&RC[4]&",0;" -> 1,7,7089,0;1,4,143990,0; | Q72: =INT(((55+RC[-14]/10)*35+200)*12/4) -> 7089 | S72: =1000*110/100*(1+(55+RC[-16]/10)/200)*100 -> 143990
B73: 1,7,1489,0;1,4,1137,0; | C73: 69 | D73: 1 | E73: 7 | F73: 1489 | G73: 0 | I73: 1 | J73: 4 | K73: 1137 | L73: 0 | O73: ="1,7,"&RC[2]&",0;"&"1,4,"&RC[4]&",0;" -> 1,7,7099,0;1,4,144045,0; | Q73: =INT(((55+RC[-14]/10)*35+200)*12/4) -> 7099 | S73: =1000*110/100*(1+(55+RC[-16]/10)/200)*100 -> 144044.99999999997
B74: 1,7,1500,0;1,4,1138,0; | C74: 70 | D74: 1 | E74: 7 | F74: 1500 | G74: 0 | I74: 1 | J74: 4 | K74: 1138 | L74: 0 | O74: ="1,7,"&RC[2]&",0;"&"1,4,"&RC[4]&",0;" -> 1,7,7110,0;1,4,144100,0; | Q74: =INT(((55+RC[-14]/10)*35+200)*12/4) -> 7110 | S74: =1000*110/100*(1+(55+RC[-16]/10)/200)*100 -> 144100
B75: 1,7,1510,0;1,4,1139,0; | C75: 71 | D75: 1 | E75: 7 | F75: 1510 | G75: 0 | I75: 1 | J75: 4 | K75: 1139 | L75: 0 | O75: ="1,7,"&RC[2]&",0;"&"1,4,"&RC[4]&",0;" -> 1,7,7120,0;1,4,144155,0; | Q75: =INT(((55+RC[-14]/10)*35+200)*12/4) -> 7120 | S75: =1000*110/100*(1+(55+RC[-16]/10)/200)*100 -> 144155
B76: 1,7,1521,0;1,4,1139,0; | C76: 72 | D76: 1 | E76: 7 | F76: 1521 | G76: 0 | I76: 1 | J76: 4 | K76: 1139 | L76: 0 | O76: ="1,7,"&RC[2]&",0;"&"1,4,"&RC[4]&",0;" -> 1,7,7131,0;1,4,144210,0; | Q76: =INT(((55+RC[-14]/10)*35+200)*12/4) -> 7131 | S76: =1000*110/100*(1+(55+RC[-16]/10)/200)*100 -> 144210
B77: 1,7,1531,0;1,4,1140,0; | C77: 73 | D77: 1 | E77: 7 | F77: 1531 | G77: 0 | I77: 1 | J77: 4 | K77: 1140 | L77: 0 | O77: ="1,7,"&RC[2]&",0;"&"1,4,"&RC[4]&",0;" -> 1,7,7141,0;1,4,144265,0; | Q77: =INT(((55+RC[-14]/10)*35+200)*12/4) -> 7141 | S77: =1000*110/100*(1+(55+RC[-16]/10)/200)*100 -> 144265
B78: 1,7,1542,0;1,4,1140,0; | C78: 74 | D78: 1 | E78: 7 | F78: 1542 | G78: 0 | I78: 1 | J78: 4 | K78: 1140 | L78: 0 | O78: ="1,7,"&RC[2]&",0;"&"1,4,"&RC[4]&",0;" -> 1,7,7152,0;1,4,144320,0; | Q78: =INT(((55+RC[-14]/10)*35+200)*12/4) -> 7152 | S78: =1000*110/100*(1+(55+RC[-16]/10)/200)*100 -> 144320
B79: 1,7,1552,0;1,4,1141,0; | C79: 75 | D79: 1 | E79: 7 | F79: 1552 | G79: 0 | I79: 1 | J79: 4 | K79: 1141 | L79: 0 | O79: ="1,7,"&RC[2]&",0;"&"1,4,"&RC[4]&",0;" -> 1,7,7162,0;1,4,144375,0; | Q79: =INT(((55+RC[-14]/10)*35+200)*12/4) -> 7162 | S79: =1000*110/100*(1+(55+RC[-16]/10)/200)*100 -> 144375
B80: 1,7,1563,0;1,4,1141,0; | C80: 76 | D80: 1 | E80: 7 | F80: 1563 | G80: 0 | I80: 1 | J80: 4 | K80: 1141 | L80: 0 | O80: ="1,7,"&RC[2]&",0;"&"1,4,"&RC[4]&",0;" -> 1,7,7173,0;1,4,144430,0; | Q80: =INT(((55+RC[-14]/10)*35+200)*12/4) -> 7173 | S80: =1000*110/100*(1+(55+RC[-16]/10)/200)*100 -> 144430
B81: 1,7,1573,0;1,4,1142,0; | C81: 77 | D81: 1 | E81: 7 | F81: 1573 | G81: 0 | I81: 1 | J81: 4 | K81: 1142 | L81: 0 | O81: ="1,7,"&RC[2]&",0;"&"1,4,"&RC[4]&",0;" -> 1,7,7183,0;1,4,144485,0; | Q81: =INT(((55+RC[-14]/10)*35+200)*12/4) -> 7183 | S81: =1000*110/100*(1+(55+RC[-16]/10)/200)*100 -> 144485
B82: 1,7,1584,0;1,4,1142,0; | C82: 78 | D82: 1 | E82: 7 | F82: 1584 | G82: 0 | I82: 1 | J82: 4 | K82: 1142 | L82: 0 | O82: ="1,7,"&RC[2]&",0;"&"1,4,"&RC[4]&",0;" -> 1,7,7194,0;1,4,144540,0; | Q82: =INT(((55+RC[-14]/10)*35+200)*12/4) -> 7194 | S82: =1000*110/100*(1+(55+RC[-16]/10)/200)*100 -> 144540
B83: 1,7,1594,0;1,4,1143,0; | C83: 79 | D83: 1 | E83: 7 | F83: 1594 | G83: 0 | I83: 1 | J83: 4 | K83: 1143 | L83: 0 | O83: ="1,7,"&RC[2]&",0;"&"1,4,"&RC[4]&",0;" -> 1,7,7204,0;1,4,144595,0; | Q83: =INT(((55+RC[-14]/10)*35+200)*12/4) -> 7204 | S83: =1000*110/100*(1+(55+RC[-16]/10)/200)*100 -> 144595
B84: 1,7,1605,0;1,4,1144,0; | C84: 80 | D84: 1 | E84: 7 | F84: 1605 | G84: 0 | I84: 1 | J84: 4 | K84: 1144 | L84: 0 | O84: ="1,7,"&RC[2]&",0;"&"1,4,"&RC[4]&",0;" -> 1,7,7215,0;1,4,144650,0; | Q84: =INT(((55+RC[-14]/10)*35+200)*12/4) -> 7215 | S84: =1000*110/100*(1+(55+RC[-16]/10)/200)*100 -> 144650
B85: 1,7,1615,0;1,4,1144,0; | C85: 81 | D85: 1 | E85: 7 | F85: 1615 | G85: 0 | I85: 1 | J85: 4 | K85: 1144 | L85: 0 | O85: ="1,7,"&RC[2]&",0;"&"1,4,"&RC[4]&",0;" -> 1,7,7225,0;1,4,144705,0; | Q85: =INT(((55+RC[-14]/10)*35+200)*12/4) -> 7225 | S85: =1000*110/100*(1+(55+RC[-16]/10)/200)*100 -> 144705.00000000003
B86: 1,7,1626,0;1,4,1145,0; | C86: 82 | D86: 1 | E86: 7 | F86: 1626 | G86: 0 | I86: 1 | J86: 4 | K86: 1145 | L86: 0 | O86: ="1,7,"&RC[2]&",0;"&"1,4,"&RC[4]&",0;" -> 1,7,7236,0;1,4,144760,0; | Q86: =INT(((55+RC[-14]/10)*35+200)*12/4) -> 7236 | S86: =1000*110/100*(1+(55+RC[-16]/10)/200)*100 -> 144760
B87: 1,7,1636,0;1,4,1145,0; | C87: 83 | D87: 1 | E87: 7 | F87: 1636 | G87: 0 | I87: 1 | J87: 4 | K87: 1145 | L87: 0 | O87: ="1,7,"&RC[2]&",0;"&"1,4,"&RC[4]&",0;" -> 1,7,7246,0;1,4,144815,0; | Q87: =INT(((55+RC[-14]/10)*35+200)*12/4) -> 7246 | S87: =1000*110/100*(1+(55+RC[-16]/10)/200)*100 -> 144815
B88: 1,7,1647,0;1,4,1146,0; | C88: 84 | D88: 1 | E88: 7 | F88: 1647 | G88: 0 | I88: 1 | J88: 4 | K88: 1146 | L88: 0 | O88: ="1,7,"&RC[2]&",0;"&"1,4,"&RC[4]&",0;" -> 1,7,7257,0;1,4,144870,0; | Q88: =INT(((55+RC[-14]/10)*35+200)*12/4) -> 7257 | S88: =1000*110/100*(1+(55+RC[-16]/10)/200)*100 -> 144870
B89: 1,7,1657,0;1,4,1146,0; | C89: 85 | D89: 1 | E89: 7 | F89: 1657 | G89: 0 | I89: 1 | J89: 4 | K89: 1146 | L89: 0 | O89: ="1,7,"&RC[2]&",0;"&"1,4,"&RC[4]&",0;" -> 1,7,7267,0;1,4,144925,0; | Q89: =INT(((55+RC[-14]/10)*35+200)*12/4) -> 7267 | S89: =1000*110/100*(1+(55+RC[-16]/10)/200)*100 -> 144924.99999999997
B90: 1,7,1668,0;1,4,1147,0; | C90: 86 | D90: 1 | E90: 7 | F90: 1668 | G90: 0 | I90: 1 | J90: 4 | K90: 1147 | L90: 0 | O90: ="1,7,"&RC[2]&",0;"&"1,4,"&RC[4]&",0;" -> 1,7,7278,0;1,4,144980,0; | Q90: =INT(((55+RC[-14]/10)*35+200)*12/4) -> 7278 | S90: =1000*110/100*(1+(55+RC[-16]/10)/200)*100 -> 144980
B91: 1,7,1678,0;1,4,1147,0; | C91: 87 | D91: 1 | E91: 7 | F91: 1678 | G91: 0 | I91: 1 | J91: 4 | K91: 1147 | L91: 0 | O91: ="1,7,"&RC[2]&",0;"&"1,4,"&RC[4]&",0;" -> 1,7,7288,0;1,4,145035,0; | Q91: =INT(((55+RC[-14]/10)*35+200)*12/4) -> 7288 | S91: =1000*110/100*(1+(55+RC[-16]/10)/200)*100 -> 145035
B92: 1,7,1689,0;1,4,1148,0; | C92: 88 | D92: 1 | E92: 7 | F92: 1689 | G92: 0 | I92: 1 | J92: 4 | K92: 1148 | L92: 0 | O92: ="1,7,"&RC[2]&",0;"&"1,4,"&RC[4]&",0;" -> 1,7,7299,0;1,4,145090,0; | Q92: =INT(((55+RC[-14]/10)*35+200)*12/4) -> 7299 | S92: =1000*110/100*(1+(55+RC[-16]/10)/200)*100 -> 145090
B93: 1,7,1699,0;1,4,1148,0; | C93: 89 | D93: 1 | E93: 7 | F93: 1699 | G93: 0 | I93: 1 | J93: 4 | K93: 1148 | L93: 0 | O93: ="1,7,"&RC[2]&",0;"&"1,4,"&RC[4]&",0;" -> 1,7,7309,0;1,4,145145,0; | Q93: =INT(((55+RC[-14]/10)*35+200)*12/4) -> 7309 | S93: =1000*110/100*(1+(55+RC[-16]/10)/200)*100 -> 145145
B94: 1,7,1710,0;1,4,1149,0; | C94: 90 | D94: 1 | E94: 7 | F94: 1710 | G94: 0 | I94: 1 | J94: 4 | K94: 1149 | L94: 0 | O94: ="1,7,"&RC[2]&",0;"&"1,4,"&RC[4]&",0;" -> 1,7,7320,0;1,4,145200,0; | Q94: =INT(((55+RC[-14]/10)*35+200)*12/4) -> 7320 | S94: =1000*110/100*(1+(55+RC[-16]/10)/200)*100 -> 145200
B95: 1,7,1720,0;1,4,1150,0; | C95: 91 | D95: 1 | E95: 7 | F95: 1720 | G95: 0 | I95: 1 | J95: 4 | K95: 1150 | L95: 0 | O95: ="1,7,"&RC[2]&",0;"&"1,4,"&RC[4]&",0;" -> 1,7,7330,0;1,4,145255,0; | Q95: =INT(((55+RC[-14]/10)*35+200)*12/4) -> 7330 | S95: =1000*110/100*(1+(55+RC[-16]/10)/200)*100 -> 145255
B96: 1,7,1731,0;1,4,1150,0; | C96: 92 | D96: 1 | E96: 7 | F96: 1731 | G96: 0 | I96: 1 | J96: 4 | K96: 1150 | L96: 0 | O96: ="1,7,"&RC[2]&",0;"&"1,4,"&RC[4]&",0;" -> 1,7,7341,0;1,4,145310,0; | Q96: =INT(((55+RC[-14]/10)*35+200)*12/4) -> 7341 | S96: =1000*110/100*(1+(55+RC[-16]/10)/200)*100 -> 145310
B97: 1,7,1741,0;1,4,1151,0; | C97: 93 | D97: 1 | E97: 7 | F97: 1741 | G97: 0 | I97: 1 | J97: 4 | K97: 1151 | L97: 0 | O97: ="1,7,"&RC[2]&",0;"&"1,4,"&RC[4]&",0;" -> 1,7,7351,0;1,4,145365,0; | Q97: =INT(((55+RC[-14]/10)*35+200)*12/4) -> 7351 | S97: =1000*110/100*(1+(55+RC[-16]/10)/200)*100 -> 145365
B98: 1,7,1752,0;1,4,1151,0; | C98: 94 | D98: 1 | E98: 7 | F98: 1752 | G98: 0 | I98: 1 | J98: 4 | K98: 1151 | L98: 0 | O98: ="1,7,"&RC[2]&",0;"&"1,4,"&RC[4]&",0;" -> 1,7,7362,0;1,4,145420,0; | Q98: =INT(((55+RC[-14]/10)*35+200)*12/4) -> 7362 | S98: =1000*110/100*(1+(55+RC[-16]/10)/200)*100 -> 145420
B99: 1,7,1762,0;1,4,1152,0; | C99: 95 | D99: 1 | E99: 7 | F99: 1762 | G99: 0 | I99: 1 | J99: 4 | K99: 1152 | L99: 0 | O99: ="1,7,"&RC[2]&",0;"&"1,4,"&RC[4]&",0;" -> 1,7,7372,0;1,4,145475,0; | Q99: =INT(((55+RC[-14]/10)*35+200)*12/4) -> 7372 | S99: =1000*110/100*(1+(55+RC[-16]/10)/200)*100 -> 145475
B100: 1,7,1773,0;1,4,1152,0; | C100: 96 | D100: 1 | E100: 7 | F100: 1773 | G100: 0 | I100: 1 | J100: 4 | K100: 1152 | L100: 0 | O100: ="1,7,"&RC[2]&",0;"&"1,4,"&RC[4]&",0;" -> 1,7,7383,0;1,4,145530,0; | Q100: =INT(((55+RC[-14]/10)*35+200)*12/4) -> 7383 | S100: =1000*110/100*(1+(55+RC[-16]/10)/200)*100 -> 145530
B101: 1,7,1783,0;1,4,1153,0; | C101: 97 | D101: 1 | E101: 7 | F101: 1783 | G101: 0 | I101: 1 | J101: 4 | K101: 1153 | L101: 0 | O101: ="1,7,"&RC[2]&",0;"&"1,4,"&RC[4]&",0;" -> 1,7,7393,0;1,4,145585,0; | Q101: =INT(((55+RC[-14]/10)*35+200)*12/4) -> 7393 | S101: =1000*110/100*(1+(55+RC[-16]/10)/200)*100 -> 145585
B102: 1,7,1794,0;1,4,1153,0; | C102: 98 | D102: 1 | E102: 7 | F102: 1794 | G102: 0 | I102: 1 | J102: 4 | K102: 1153 | L102: 0 | O102: ="1,7,"&RC[2]&",0;"&"1,4,"&RC[4]&",0;" -> 1,7,7404,0;1,4,145640,0; | Q102: =INT(((55+RC[-14]/10)*35+200)*12/4) -> 7404 | S102: =1000*110/100*(1+(55+RC[-16]/10)/200)*100 -> 145640
B103: 1,7,1804,0;1,4,1154,0; | C103: 99 | D103: 1 | E103: 7 | F103: 1804 | G103: 0 | I103: 1 | J103: 4 | K103: 1154 | L103: 0 | O103: ="1,7,"&RC[2]&",0;"&"1,4,"&RC[4]&",0;" -> 1,7,7414,0;1,4,145695,0; | Q103: =INT(((55+RC[-14]/10)*35+200)*12/4) -> 7414 | S103: =1000*110/100*(1+(55+RC[-16]/10)/200)*100 -> 145695
B104: 1,7,1815,0;1,4,1155,0; | C104: 100 | D104: 1 | E104: 7 | F104: 1815 | G104: 0 | I104: 1 | J104: 4 | K104: 1155 | L104: 0 | O104: ="1,7,"&RC[2]&",0;"&"1,4,"&RC[4]&",0;" -> 1,7,7425,0;1,4,145750,0; | Q104: =INT(((55+RC[-14]/10)*35+200)*12/4) -> 7425 | S104: =1000*110/100*(1+(55+RC[-16]/10)/200)*100 -> 145750
B105: 1,7,1825,0;1,4,1155,0; | C105: 101 | D105: 1 | E105: 7 | F105: 1825 | G105: 0 | I105: 1 | J105: 4 | K105: 1155 | L105: 0 | O105: ="1,7,"&RC[2]&",0;"&"1,4,"&RC[4]&",0;" -> 1,7,7435,0;1,4,145805,0; | Q105: =INT(((55+RC[-14]/10)*35+200)*12/4) -> 7435 | S105: =1000*110/100*(1+(55+RC[-16]/10)/200)*100 -> 145805
B106: 1,7,1836,0;1,4,1156,0; | C106: 102 | D106: 1 | E106: 7 | F106: 1836 | G106: 0 | I106: 1 | J106: 4 | K106: 1156 | L106: 0 | O106: ="1,7,"&RC[2]&",0;"&"1,4,"&RC[4]&",0;" -> 1,7,7446,0;1,4,145860,0; | Q106: =INT(((55+RC[-14]/10)*35+200)*12/4) -> 7446 | S106: =1000*110/100*(1+(55+RC[-16]/10)/200)*100 -> 145860
B107: 1,7,1846,0;1,4,1156,0; | C107: 103 | D107: 1 | E107: 7 | F107: 1846 | G107: 0 | I107: 1 | J107: 4 | K107: 1156 | L107: 0 | O107: ="1,7,"&RC[2]&",0;"&"1,4,"&RC[4]&",0;" -> 1,7,7456,0;1,4,145915,0; | Q107: =INT(((55+RC[-14]/10)*35+200)*12/4) -> 7456 | S107: =1000*110/100*(1+(55+RC[-16]/10)/200)*100 -> 145915
B108: 1,7,1857,0;1,4,1157,0; | C108: 104 | D108: 1 | E108: 7 | F108: 1857 | G108: 0 | I108: 1 | J108: 4 | K108: 1157 | L108: 0 | O108: ="1,7,"&RC[2]&",0;"&"1,4,"&RC[4]&",0;" -> 1,7,7467,0;1,4,145970,0; | Q108: =INT(((55+RC[-14]/10)*35+200)*12/4) -> 7467 | S108: =1000*110/100*(1+(55+RC[-16]/10)/200)*100 -> 145970
B109: 1,7,1867,0;1,4,1157,0; | C109: 105 | D109: 1 | E109: 7 | F109: 1867 | G109: 0 | I109: 1 | J109: 4 | K109: 1157 | L109: 0 | O109: ="1,7,"&RC[2]&",0;"&"1,4,"&RC[4]&",0;" -> 1,7,7477,0;1,4,146025,0; | Q109: =INT(((55+RC[-14]/10)*35+200)*12/4) -> 7477 | S109: =1000*110/100*(1+(55+RC[-16]/10)/200)*100 -> 146025.00000000003
B110: 1,7,1878,0;1,4,1158,0; | C110: 106 | D110: 1 | E110: 7 | F110: 1878 | G110: 0 | I110: 1 | J110: 4 | K110: 1158 | L110: 0 | O110: ="1,7,"&RC[2]&",0;"&"1,4,"&RC[4]&",0;" -> 1,7,7488,0;1,4,146080,0; | Q110: =INT(((55+RC[-14]/10)*35+200)*12/4) -> 7488 | S110: =1000*110/100*(1+(55+RC[-16]/10)/200)*100 -> 146079.99999999997
B111: 1,7,1888,0;1,4,1158,0; | C111: 107 | D111: 1 | E111: 7 | F111: 1888 | G111: 0 | I111: 1 | J111: 4 | K111: 1158 | L111: 0 | O111: ="1,7,"&RC[2]&",0;"&"1,4,"&RC[4]&",0;" -> 1,7,7498,0;1,4,146135,0; | Q111: =INT(((55+RC[-14]/10)*35+200)*12/4) -> 7498 | S111: =1000*110/100*(1+(55+RC[-16]/10)/200)*100 -> 146135
B112: 1,7,1899,0;1,4,1159,0; | C112: 108 | D112: 1 | E112: 7 | F112: 1899 | G112: 0 | I112: 1 | J112: 4 | K112: 1159 | L112: 0 | O112: ="1,7,"&RC[2]&",0;"&"1,4,"&RC[4]&",0;" -> 1,7,7509,0;1,4,146190,0; | Q112: =INT(((55+RC[-14]/10)*35+200)*12/4) -> 7509 | S112: =1000*110/100*(1+(55+RC[-16]/10)/200)*100 -> 146190
B113: 1,7,1909,0;1,4,1159,0; | C113: 109 | D113: 1 | E113: 7 | F113: 1909 | G113: 0 | I113: 1 | J113: 4 | K113: 1159 | L113: 0 | O113: ="1,7,"&RC[2]&",0;"&"1,4,"&RC[4]&",0;" -> 1,7,7519,0;1,4,146245,0; | Q113: =INT(((55+RC[-14]/10)*35+200)*12/4) -> 7519 | S113: =1000*110/100*(1+(55+RC[-16]/10)/200)*100 -> 146244.99999999997
B114: 1,7,1920,0;1,4,1160,0; | C114: 110 | D114: 1 | E114: 7 | F114: 1920 | G114: 0 | I114: 1 | J114: 4 | K114: 1160 | L114: 0 | O114: ="1,7,"&RC[2]&",0;"&"1,4,"&RC[4]&",0;" -> 1,7,7530,0;1,4,146300,0; | Q114: =INT(((55+RC[-14]/10)*35+200)*12/4) -> 7530 | S114: =1000*110/100*(1+(55+RC[-16]/10)/200)*100 -> 146300
B115: 1,7,1930,0;1,4,1161,0; | C115: 111 | D115: 1 | E115: 7 | F115: 1930 | G115: 0 | I115: 1 | J115: 4 | K115: 1161 | L115: 0 | O115: ="1,7,"&RC[2]&",0;"&"1,4,"&RC[4]&",0;" -> 1,7,7540,0;1,4,146355,0; | Q115: =INT(((55+RC[-14]/10)*35+200)*12/4) -> 7540 | S115: =1000*110/100*(1+(55+RC[-16]/10)/200)*100 -> 146355
B116: 1,7,1941,0;1,4,1161,0; | C116: 112 | D116: 1 | E116: 7 | F116: 1941 | G116: 0 | I116: 1 | J116: 4 | K116: 1161 | L116: 0 | O116: ="1,7,"&RC[2]&",0;"&"1,4,"&RC[4]&",0;" -> 1,7,7551,0;1,4,146410,0; | Q116: =INT(((55+RC[-14]/10)*35+200)*12/4) -> 7551 | S116: =1000*110/100*(1+(55+RC[-16]/10)/200)*100 -> 146410
B117: 1,7,1951,0;1,4,1162,0; | C117: 113 | D117: 1 | E117: 7 | F117: 1951 | G117: 0 | I117: 1 | J117: 4 | K117: 1162 | L117: 0 | O117: ="1,7,"&RC[2]&",0;"&"1,4,"&RC[4]&",0;" -> 1,7,7561,0;1,4,146465,0; | Q117: =INT(((55+RC[-14]/10)*35+200)*12/4) -> 7561 | S117: =1000*110/100*(1+(55+RC[-16]/10)/200)*100 -> 146465
B118: 1,7,1962,0;1,4,1162,0; | C118: 114 | D118: 1 | E118: 7 | F118: 1962 | G118: 0 | I118: 1 | J118: 4 | K118: 1162 | L118: 0 | O118: ="1,7,"&RC[2]&",0;"&"1,4,"&RC[4]&",0;" -> 1,7,7572,0;1,4,146520,0; | Q118: =INT(((55+RC[-14]/10)*35+200)*12/4) -> 7572 | S118: =1000*110/100*(1+(55+RC[-16]/10)/200)*100 -> 146520
B119: 1,7,1972,0;1,4,1163,0; | C119: 115 | D119: 1 | E119: 7 | F119: 1972 | G119: 0 | I119: 1 | J119: 4 | K119: 1163 | L119: 0 | O119: ="1,7,"&RC[2]&",0;"&"1,4,"&RC[4]&",0;" -> 1,7,7582,0;1,4,146575,0; | Q119: =INT(((55+RC[-14]/10)*35+200)*12/4) -> 7582 | S119: =1000*110/100*(1+(55+RC[-16]/10)/200)*100 -> 146575
B120: 1,7,1983,0;1,4,1163,0; | C120: 116 | D120: 1 | E120: 7 | F120: 1983 | G120: 0 | I120: 1 | J120: 4 | K120: 1163 | L120: 0 | O120: ="1,7,"&RC[2]&",0;"&"1,4,"&RC[4]&",0;" -> 1,7,7593,0;1,4,146630,0; | Q120: =INT(((55+RC[-14]/10)*35+200)*12/4) -> 7593 | S120: =1000*110/100*(1+(55+RC[-16]/10)/200)*100 -> 146630
B121: 1,7,1993,0;1,4,1164,0; | C121: 117 | D121: 1 | E121: 7 | F121: 1993 | G121: 0 | I121: 1 | J121: 4 | K121: 1164 | L121: 0 | O121: ="1,7,"&RC[2]&",0;"&"1,4,"&RC[4]&",0;" -> 1,7,7603,0;1,4,146685,0; | Q121: =INT(((55+RC[-14]/10)*35+200)*12/4) -> 7603 | S121: =1000*110/100*(1+(55+RC[-16]/10)/200)*100 -> 146685
B122: 1,7,2004,0;1,4,1164,0; | C122: 118 | D122: 1 | E122: 7 | F122: 2004 | G122: 0 | I122: 1 | J122: 4 | K122: 1164 | L122: 0 | O122: ="1,7,"&RC[2]&",0;"&"1,4,"&RC[4]&",0;" -> 1,7,7614,0;1,4,146740,0; | Q122: =INT(((55+RC[-14]/10)*35+200)*12/4) -> 7614 | S122: =1000*110/100*(1+(55+RC[-16]/10)/200)*100 -> 146740
B123: 1,7,2014,0;1,4,1165,0; | C123: 119 | D123: 1 | E123: 7 | F123: 2014 | G123: 0 | I123: 1 | J123: 4 | K123: 1165 | L123: 0 | O123: ="1,7,"&RC[2]&",0;"&"1,4,"&RC[4]&",0;" -> 1,7,7624,0;1,4,146795,0; | Q123: =INT(((55+RC[-14]/10)*35+200)*12/4) -> 7624 | S123: =1000*110/100*(1+(55+RC[-16]/10)/200)*100 -> 146795
B124: 1,7,2025,0;1,4,1166,0; | C124: 120 | D124: 1 | E124: 7 | F124: 2025 | G124: 0 | I124: 1 | J124: 4 | K124: 1166 | L124: 0 | O124: ="1,7,"&RC[2]&",0;"&"1,4,"&RC[4]&",0;" -> 1,7,7635,0;1,4,146850,0; | Q124: =INT(((55+RC[-14]/10)*35+200)*12/4) -> 7635 | S124: =1000*110/100*(1+(55+RC[-16]/10)/200)*100 -> 146850
B125: 1,7,2035,0;1,4,1166,0; | C125: 121 | D125: 1 | E125: 7 | F125: 2035 | G125: 0 | I125: 1 | J125: 4 | K125: 1166 | L125: 0 | O125: ="1,7,"&RC[2]&",0;"&"1,4,"&RC[4]&",0;" -> 1,7,7645,0;1,4,146905,0; | Q125: =INT(((55+RC[-14]/10)*35+200)*12/4) -> 7645 | S125: =1000*110/100*(1+(55+RC[-16]/10)/200)*100 -> 146905
B126: 1,7,2046,0;1,4,1167,0; | C126: 122 | D126: 1 | E126: 7 | F126: 2046 | G126: 0 | I126: 1 | J126: 4 | K126: 1167 | L126: 0 | O126: ="1,7,"&RC[2]&",0;"&"1,4,"&RC[4]&",0;" -> 1,7,7656,0;1,4,146960,0; | Q126: =INT(((55+RC[-14]/10)*35+200)*12/4) -> 7656 | S126: =1000*110/100*(1+(55+RC[-16]/10)/200)*100 -> 146960
B127: 1,7,2056,0;1,4,1167,0; | C127: 123 | D127: 1 | E127: 7 | F127: 2056 | G127: 0 | I127: 1 | J127: 4 | K127: 1167 | L127: 0 | O127: ="1,7,"&RC[2]&",0;"&"1,4,"&RC[4]&",0;" -> 1,7,7666,0;1,4,147015,0; | Q127: =INT(((55+RC[-14]/10)*35+200)*12/4) -> 7666 | S127: =1000*110/100*(1+(55+RC[-16]/10)/200)*100 -> 147015
B128: 1,7,2067,0;1,4,1168,0; | C128: 124 | D128: 1 | E128: 7 | F128: 2067 | G128: 0 | I128: 1 | J128: 4 | K128: 1168 | L128: 0 | O128: ="1,7,"&RC[2]&",0;"&"1,4,"&RC[4]&",0;" -> 1,7,7677,0;1,4,147070,0; | Q128: =INT(((55+RC[-14]/10)*35+200)*12/4) -> 7677 | S128: =1000*110/100*(1+(55+RC[-16]/10)/200)*100 -> 147070
B129: 1,7,2077,0;1,4,1168,0; | C129: 125 | D129: 1 | E129: 7 | F129: 2077 | G129: 0 | I129: 1 | J129: 4 | K129: 1168 | L129: 0 | O129: ="1,7,"&RC[2]&",0;"&"1,4,"&RC[4]&",0;" -> 1,7,7687,0;1,4,147125,0; | Q129: =INT(((55+RC[-14]/10)*35+200)*12/4) -> 7687 | S129: =1000*110/100*(1+(55+RC[-16]/10)/200)*100 -> 147125
B130: 1,7,2088,0;1,4,1169,0; | C130: 126 | D130: 1 | E130: 7 | F130: 2088 | G130: 0 | I130: 1 | J130: 4 | K130: 1169 | L130: 0 | O130: ="1,7,"&RC[2]&",0;"&"1,4,"&RC[4]&",0;" -> 1,7,7698,0;1,4,147180,0; | Q130: =INT(((55+RC[-14]/10)*35+200)*12/4) -> 7698 | S130: =1000*110/100*(1+(55+RC[-16]/10)/200)*100 -> 147180.00000000003
B131: 1,7,2098,0;1,4,1169,0; | C131: 127 | D131: 1 | E131: 7 | F131: 2098 | G131: 0 | I131: 1 | J131: 4 | K131: 1169 | L131: 0 | O131: ="1,7,"&RC[2]&",0;"&"1,4,"&RC[4]&",0;" -> 1,7,7708,0;1,4,147235,0; | Q131: =INT(((55+RC[-14]/10)*35+200)*12/4) -> 7708 | S131: =1000*110/100*(1+(55+RC[-16]/10)/200)*100 -> 147235
B132: 1,7,2109,0;1,4,1170,0; | C132: 128 | D132: 1 | E132: 7 | F132: 2109 | G132: 0 | I132: 1 | J132: 4 | K132: 1170 | L132: 0 | O132: ="1,7,"&RC[2]&",0;"&"1,4,"&RC[4]&",0;" -> 1,7,7719,0;1,4,147290,0; | Q132: =INT(((55+RC[-14]/10)*35+200)*12/4) -> 7719 | S132: =1000*110/100*(1+(55+RC[-16]/10)/200)*100 -> 147290
B133: 1,7,2119,0;1,4,1170,0; | C133: 129 | D133: 1 | E133: 7 | F133: 2119 | G133: 0 | I133: 1 | J133: 4 | K133: 1170 | L133: 0 | O133: ="1,7,"&RC[2]&",0;"&"1,4,"&RC[4]&",0;" -> 1,7,7729,0;1,4,147345,0; | Q133: =INT(((55+RC[-14]/10)*35+200)*12/4) -> 7729 | S133: =1000*110/100*(1+(55+RC[-16]/10)/200)*100 -> 147345
B134: 1,7,2130,0;1,4,1171,0; | C134: 130 | D134: 1 | E134: 7 | F134: 2130 | G134: 0 | I134: 1 | J134: 4 | K134: 1171 | L134: 0 | O134: ="1,7,"&RC[2]&",0;"&"1,4,"&RC[4]&",0;" -> 1,7,7740,0;1,4,147400,0; | Q134: =INT(((55+RC[-14]/10)*35+200)*12/4) -> 7740 | S134: =1000*110/100*(1+(55+RC[-16]/10)/200)*100 -> 147400
B135: 1,7,2140,0;1,4,1172,0; | C135: 131 | D135: 1 | E135: 7 | F135: 2140 | G135: 0 | I135: 1 | J135: 4 | K135: 1172 | L135: 0 | O135: ="1,7,"&RC[2]&",0;"&"1,4,"&RC[4]&",0;" -> 1,7,7750,0;1,4,147455,0; | Q135: =INT(((55+RC[-14]/10)*35+200)*12/4) -> 7750 | S135: =1000*110/100*(1+(55+RC[-16]/10)/200)*100 -> 147455
B136: 1,7,2151,0;1,4,1172,0; | C136: 132 | D136: 1 | E136: 7 | F136: 2151 | G136: 0 | I136: 1 | J136: 4 | K136: 1172 | L136: 0 | O136: ="1,7,"&RC[2]&",0;"&"1,4,"&RC[4]&",0;" -> 1,7,7761,0;1,4,147510,0; | Q136: =INT(((55+RC[-14]/10)*35+200)*12/4) -> 7761 | S136: =1000*110/100*(1+(55+RC[-16]/10)/200)*100 -> 147510
B137: 1,7,2161,0;1,4,1173,0; | C137: 133 | D137: 1 | E137: 7 | F137: 2161 | G137: 0 | I137: 1 | J137: 4 | K137: 1173 | L137: 0 | O137: ="1,7,"&RC[2]&",0;"&"1,4,"&RC[4]&",0;" -> 1,7,7771,0;1,4,147565,0; | Q137: =INT(((55+RC[-14]/10)*35+200)*12/4) -> 7771 | S137: =1000*110/100*(1+(55+RC[-16]/10)/200)*100 -> 147565
B138: 1,7,2172,0;1,4,1173,0; | C138: 134 | D138: 1 | E138: 7 | F138: 2172 | G138: 0 | I138: 1 | J138: 4 | K138: 1173 | L138: 0 | O138: ="1,7,"&RC[2]&",0;"&"1,4,"&RC[4]&",0;" -> 1,7,7782,0;1,4,147620,0; | Q138: =INT(((55+RC[-14]/10)*35+200)*12/4) -> 7782 | S138: =1000*110/100*(1+(55+RC[-16]/10)/200)*100 -> 147620
B139: 1,7,2182,0;1,4,1174,0; | C139: 135 | D139: 1 | E139: 7 | F139: 2182 | G139: 0 | I139: 1 | J139: 4 | K139: 1174 | L139: 0 | O139: ="1,7,"&RC[2]&",0;"&"1,4,"&RC[4]&",0;" -> 1,7,7792,0;1,4,147675,0; | Q139: =INT(((55+RC[-14]/10)*35+200)*12/4) -> 7792 | S139: =1000*110/100*(1+(55+RC[-16]/10)/200)*100 -> 147675
B140: 1,7,2193,0;1,4,1174,0; | C140: 136 | D140: 1 | E140: 7 | F140: 2193 | G140: 0 | I140: 1 | J140: 4 | K140: 1174 | L140: 0 | O140: ="1,7,"&RC[2]&",0;"&"1,4,"&RC[4]&",0;" -> 1,7,7803,0;1,4,147730,0; | Q140: =INT(((55+RC[-14]/10)*35+200)*12/4) -> 7803 | S140: =1000*110/100*(1+(55+RC[-16]/10)/200)*100 -> 147730
B141: 1,7,2203,0;1,4,1175,0; | C141: 137 | D141: 1 | E141: 7 | F141: 2203 | G141: 0 | I141: 1 | J141: 4 | K141: 1175 | L141: 0 | O141: ="1,7,"&RC[2]&",0;"&"1,4,"&RC[4]&",0;" -> 1,7,7813,0;1,4,147785,0; | Q141: =INT(((55+RC[-14]/10)*35+200)*12/4) -> 7813 | S141: =1000*110/100*(1+(55+RC[-16]/10)/200)*100 -> 147785
B142: 1,7,2214,0;1,4,1175,0; | C142: 138 | D142: 1 | E142: 7 | F142: 2214 | G142: 0 | I142: 1 | J142: 4 | K142: 1175 | L142: 0 | O142: ="1,7,"&RC[2]&",0;"&"1,4,"&RC[4]&",0;" -> 1,7,7824,0;1,4,147840,0; | Q142: =INT(((55+RC[-14]/10)*35+200)*12/4) -> 7824 | S142: =1000*110/100*(1+(55+RC[-16]/10)/200)*100 -> 147840
B143: 1,7,2224,0;1,4,1176,0; | C143: 139 | D143: 1 | E143: 7 | F143: 2224 | G143: 0 | I143: 1 | J143: 4 | K143: 1176 | L143: 0 | O143: ="1,7,"&RC[2]&",0;"&"1,4,"&RC[4]&",0;" -> 1,7,7834,0;1,4,147895,0; | Q143: =INT(((55+RC[-14]/10)*35+200)*12/4) -> 7834 | S143: =1000*110/100*(1+(55+RC[-16]/10)/200)*100 -> 147895
B144: 1,7,2235,0;1,4,1177,0; | C144: 140 | D144: 1 | E144: 7 | F144: 2235 | G144: 0 | I144: 1 | J144: 4 | K144: 1177 | L144: 0 | O144: ="1,7,"&RC[2]&",0;"&"1,4,"&RC[4]&",0;" -> 1,7,7845,0;1,4,147950,0; | Q144: =INT(((55+RC[-14]/10)*35+200)*12/4) -> 7845 | S144: =1000*110/100*(1+(55+RC[-16]/10)/200)*100 -> 147950
B145: 1,7,2245,0;1,4,1177,0; | C145: 141 | D145: 1 | E145: 7 | F145: 2245 | G145: 0 | I145: 1 | J145: 4 | K145: 1177 | L145: 0 | O145: ="1,7,"&RC[2]&",0;"&"1,4,"&RC[4]&",0;" -> 1,7,7855,0;1,4,148005,0; | Q145: =INT(((55+RC[-14]/10)*35+200)*12/4) -> 7855 | S145: =1000*110/100*(1+(55+RC[-16]/10)/200)*100 -> 148005
B146: 1,7,2256,0;1,4,1178,0; | C146: 142 | D146: 1 | E146: 7 | F146: 2256 | G146: 0 | I146: 1 | J146: 4 | K146: 1178 | L146: 0 | O146: ="1,7,"&RC[2]&",0;"&"1,4,"&RC[4]&",0;" -> 1,7,7866,0;1,4,148060,0; | Q146: =INT(((55+RC[-14]/10)*35+200)*12/4) -> 7866 | S146: =1000*110/100*(1+(55+RC[-16]/10)/200)*100 -> 148060
B147: 1,7,2266,0;1,4,1178,0; | C147: 143 | D147: 1 | E147: 7 | F147: 2266 | G147: 0 | I147: 1 | J147: 4 | K147: 1178 | L147: 0 | O147: ="1,7,"&RC[2]&",0;"&"1,4,"&RC[4]&",0;" -> 1,7,7876,0;1,4,148115,0; | Q147: =INT(((55+RC[-14]/10)*35+200)*12/4) -> 7876 | S147: =1000*110/100*(1+(55+RC[-16]/10)/200)*100 -> 148115
B148: 1,7,2277,0;1,4,1179,0; | C148: 144 | D148: 1 | E148: 7 | F148: 2277 | G148: 0 | I148: 1 | J148: 4 | K148: 1179 | L148: 0 | O148: ="1,7,"&RC[2]&",0;"&"1,4,"&RC[4]&",0;" -> 1,7,7887,0;1,4,148170,0; | Q148: =INT(((55+RC[-14]/10)*35+200)*12/4) -> 7887 | S148: =1000*110/100*(1+(55+RC[-16]/10)/200)*100 -> 148170
B149: 1,7,2287,0;1,4,1179,0; | C149: 145 | D149: 1 | E149: 7 | F149: 2287 | G149: 0 | I149: 1 | J149: 4 | K149: 1179 | L149: 0 | O149: ="1,7,"&RC[2]&",0;"&"1,4,"&RC[4]&",0;" -> 1,7,7897,0;1,4,148225,0; | Q149: =INT(((55+RC[-14]/10)*35+200)*12/4) -> 7897 | S149: =1000*110/100*(1+(55+RC[-16]/10)/200)*100 -> 148225
B150: 1,7,2298,0;1,4,1180,0; | C150: 146 | D150: 1 | E150: 7 | F150: 2298 | G150: 0 | I150: 1 | J150: 4 | K150: 1180 | L150: 0 | O150: ="1,7,"&RC[2]&",0;"&"1,4,"&RC[4]&",0;" -> 1,7,7908,0;1,4,148280,0; | Q150: =INT(((55+RC[-14]/10)*35+200)*12/4) -> 7908 | S150: =1000*110/100*(1+(55+RC[-16]/10)/200)*100 -> 148280
B151: 1,7,2308,0;1,4,1180,0; | C151: 147 | D151: 1 | E151: 7 | F151: 2308 | G151: 0 | I151: 1 | J151: 4 | K151: 1180 | L151: 0 | O151: ="1,7,"&RC[2]&",0;"&"1,4,"&RC[4]&",0;" -> 1,7,7918,0;1,4,148335,0; | Q151: =INT(((55+RC[-14]/10)*35+200)*12/4) -> 7918 | S151: =1000*110/100*(1+(55+RC[-16]/10)/200)*100 -> 148335
B152: 1,7,2319,0;1,4,1181,0; | C152: 148 | D152: 1 | E152: 7 | F152: 2319 | G152: 0 | I152: 1 | J152: 4 | K152: 1181 | L152: 0 | O152: ="1,7,"&RC[2]&",0;"&"1,4,"&RC[4]&",0;" -> 1,7,7929,0;1,4,148390,0; | Q152: =INT(((55+RC[-14]/10)*35+200)*12/4) -> 7929 | S152: =1000*110/100*(1+(55+RC[-16]/10)/200)*100 -> 148390
B153: 1,7,2329,0;1,4,1181,0; | C153: 149 | D153: 1 | E153: 7 | F153: 2329 | G153: 0 | I153: 1 | J153: 4 | K153: 1181 | L153: 0 | O153: ="1,7,"&RC[2]&",0;"&"1,4,"&RC[4]&",0;" -> 1,7,7939,0;1,4,148445,0; | Q153: =INT(((55+RC[-14]/10)*35+200)*12/4) -> 7939 | S153: =1000*110/100*(1+(55+RC[-16]/10)/200)*100 -> 148444.99999999997
B154: 1,7,2340,0;1,4,1182,0; | C154: 150 | D154: 1 | E154: 7 | F154: 2340 | G154: 0 | I154: 1 | J154: 4 | K154: 1182 | L154: 0 | O154: ="1,7,"&RC[2]&",0;"&"1,4,"&RC[4]&",0;" -> 1,7,7950,0;1,4,148500,0; | Q154: =INT(((55+RC[-14]/10)*35+200)*12/4) -> 7950 | S154: =1000*110/100*(1+(55+RC[-16]/10)/200)*100 -> 148500
B155: 1,7,2350,0;1,4,1183,0; | C155: 151 | D155: 1 | E155: 7 | F155: 2350 | G155: 0 | I155: 1 | J155: 4 | K155: 1183 | L155: 0 | O155: ="1,7,"&RC[2]&",0;"&"1,4,"&RC[4]&",0;" -> 1,7,7960,0;1,4,148555,0; | Q155: =INT(((55+RC[-14]/10)*35+200)*12/4) -> 7960 | S155: =1000*110/100*(1+(55+RC[-16]/10)/200)*100 -> 148555
B156: 1,7,2361,0;1,4,1183,0; | C156: 152 | D156: 1 | E156: 7 | F156: 2361 | G156: 0 | I156: 1 | J156: 4 | K156: 1183 | L156: 0 | O156: ="1,7,"&RC[2]&",0;"&"1,4,"&RC[4]&",0;" -> 1,7,7971,0;1,4,148610,0; | Q156: =INT(((55+RC[-14]/10)*35+200)*12/4) -> 7971 | S156: =1000*110/100*(1+(55+RC[-16]/10)/200)*100 -> 148610
B157: 1,7,2371,0;1,4,1184,0; | C157: 153 | D157: 1 | E157: 7 | F157: 2371 | G157: 0 | I157: 1 | J157: 4 | K157: 1184 | L157: 0 | O157: ="1,7,"&RC[2]&",0;"&"1,4,"&RC[4]&",0;" -> 1,7,7981,0;1,4,148665,0; | Q157: =INT(((55+RC[-14]/10)*35+200)*12/4) -> 7981 | S157: =1000*110/100*(1+(55+RC[-16]/10)/200)*100 -> 148665
B158: 1,7,2382,0;1,4,1184,0; | C158: 154 | D158: 1 | E158: 7 | F158: 2382 | G158: 0 | I158: 1 | J158: 4 | K158: 1184 | L158: 0 | O158: ="1,7,"&RC[2]&",0;"&"1,4,"&RC[4]&",0;" -> 1,7,7992,0;1,4,148720,0; | Q158: =INT(((55+RC[-14]/10)*35+200)*12/4) -> 7992 | S158: =1000*110/100*(1+(55+RC[-16]/10)/200)*100 -> 148720
B159: 1,7,2392,0;1,4,1185,0; | C159: 155 | D159: 1 | E159: 7 | F159: 2392 | G159: 0 | I159: 1 | J159: 4 | K159: 1185 | L159: 0 | O159: ="1,7,"&RC[2]&",0;"&"1,4,"&RC[4]&",0;" -> 1,7,8002,0;1,4,148775,0; | Q159: =INT(((55+RC[-14]/10)*35+200)*12/4) -> 8002 | S159: =1000*110/100*(1+(55+RC[-16]/10)/200)*100 -> 148775
B160: 1,7,2403,0;1,4,1185,0; | C160: 156 | D160: 1 | E160: 7 | F160: 2403 | G160: 0 | I160: 1 | J160: 4 | K160: 1185 | L160: 0 | O160: ="1,7,"&RC[2]&",0;"&"1,4,"&RC[4]&",0;" -> 1,7,8013,0;1,4,148830,0; | Q160: =INT(((55+RC[-14]/10)*35+200)*12/4) -> 8013 | S160: =1000*110/100*(1+(55+RC[-16]/10)/200)*100 -> 148830
B161: 1,7,2413,0;1,4,1186,0; | C161: 157 | D161: 1 | E161: 7 | F161: 2413 | G161: 0 | I161: 1 | J161: 4 | K161: 1186 | L161: 0 | O161: ="1,7,"&RC[2]&",0;"&"1,4,"&RC[4]&",0;" -> 1,7,8023,0;1,4,148885,0; | Q161: =INT(((55+RC[-14]/10)*35+200)*12/4) -> 8023 | S161: =1000*110/100*(1+(55+RC[-16]/10)/200)*100 -> 148885
B162: 1,7,2424,0;1,4,1186,0; | C162: 158 | D162: 1 | E162: 7 | F162: 2424 | G162: 0 | I162: 1 | J162: 4 | K162: 1186 | L162: 0 | O162: ="1,7,"&RC[2]&",0;"&"1,4,"&RC[4]&",0;" -> 1,7,8034,0;1,4,148940,0; | Q162: =INT(((55+RC[-14]/10)*35+200)*12/4) -> 8034 | S162: =1000*110/100*(1+(55+RC[-16]/10)/200)*100 -> 148940
B163: 1,7,2434,0;1,4,1187,0; | C163: 159 | D163: 1 | E163: 7 | F163: 2434 | G163: 0 | I163: 1 | J163: 4 | K163: 1187 | L163: 0 | O163: ="1,7,"&RC[2]&",0;"&"1,4,"&RC[4]&",0;" -> 1,7,8044,0;1,4,148995,0; | Q163: =INT(((55+RC[-14]/10)*35+200)*12/4) -> 8044 | S163: =1000*110/100*(1+(55+RC[-16]/10)/200)*100 -> 148995
B164: 1,7,2445,0;1,4,1188,0; | C164: 160 | D164: 1 | E164: 7 | F164: 2445 | G164: 0 | I164: 1 | J164: 4 | K164: 1188 | L164: 0 | O164: ="1,7,"&RC[2]&",0;"&"1,4,"&RC[4]&",0;" -> 1,7,8055,0;1,4,149050,0; | Q164: =INT(((55+RC[-14]/10)*35+200)*12/4) -> 8055 | S164: =1000*110/100*(1+(55+RC[-16]/10)/200)*100 -> 149050
B165: 1,7,2455,0;1,4,1188,0; | C165: 161 | D165: 1 | E165: 7 | F165: 2455 | G165: 0 | I165: 1 | J165: 4 | K165: 1188 | L165: 0 | O165: ="1,7,"&RC[2]&",0;"&"1,4,"&RC[4]&",0;" -> 1,7,8065,0;1,4,149105,0; | Q165: =INT(((55+RC[-14]/10)*35+200)*12/4) -> 8065 | S165: =1000*110/100*(1+(55+RC[-16]/10)/200)*100 -> 149105
B166: 1,7,2466,0;1,4,1189,0; | C166: 162 | D166: 1 | E166: 7 | F166: 2466 | G166: 0 | I166: 1 | J166: 4 | K166: 1189 | L166: 0 | O166: ="1,7,"&RC[2]&",0;"&"1,4,"&RC[4]&",0;" -> 1,7,8076,0;1,4,149160,0; | Q166: =INT(((55+RC[-14]/10)*35+200)*12/4) -> 8076 | S166: =1000*110/100*(1+(55+RC[-16]/10)/200)*100 -> 149160
B167: 1,7,2476,0;1,4,1189,0; | C167: 163 | D167: 1 | E167: 7 | F167: 2476 | G167: 0 | I167: 1 | J167: 4 | K167: 1189 | L167: 0 | O167: ="1,7,"&RC[2]&",0;"&"1,4,"&RC[4]&",0;" -> 1,7,8086,0;1,4,149215,0; | Q167: =INT(((55+RC[-14]/10)*35+200)*12/4) -> 8086 | S167: =1000*110/100*(1+(55+RC[-16]/10)/200)*100 -> 149215
B168: 1,7,2487,0;1,4,1190,0; | C168: 164 | D168: 1 | E168: 7 | F168: 2487 | G168: 0 | I168: 1 | J168: 4 | K168: 1190 | L168: 0 | O168: ="1,7,"&RC[2]&",0;"&"1,4,"&RC[4]&",0;" -> 1,7,8097,0;1,4,149270,0; | Q168: =INT(((55+RC[-14]/10)*35+200)*12/4) -> 8097 | S168: =1000*110/100*(1+(55+RC[-16]/10)/200)*100 -> 149270
B169: 1,7,2497,0;1,4,1190,0; | C169: 165 | D169: 1 | E169: 7 | F169: 2497 | G169: 0 | I169: 1 | J169: 4 | K169: 1190 | L169: 0 | O169: ="1,7,"&RC[2]&",0;"&"1,4,"&RC[4]&",0;" -> 1,7,8107,0;1,4,149325,0; | Q169: =INT(((55+RC[-14]/10)*35+200)*12/4) -> 8107 | S169: =1000*110/100*(1+(55+RC[-16]/10)/200)*100 -> 149325
B170: 1,7,2508,0;1,4,1191,0; | C170: 166 | D170: 1 | E170: 7 | F170: 2508 | G170: 0 | I170: 1 | J170: 4 | K170: 1191 | L170: 0 | O170: ="1,7,"&RC[2]&",0;"&"1,4,"&RC[4]&",0;" -> 1,7,8118,0;1,4,149380,0; | Q170: =INT(((55+RC[-14]/10)*35+200)*12/4) -> 8118 | S170: =1000*110/100*(1+(55+RC[-16]/10)/200)*100 -> 149380.00000000003
B171: 1,7,2518,0;1,4,1191,0; | C171: 167 | D171: 1 | E171: 7 | F171: 2518 | G171: 0 | I171: 1 | J171: 4 | K171: 1191 | L171: 0 | O171: ="1,7,"&RC[2]&",0;"&"1,4,"&RC[4]&",0;" -> 1,7,8128,0;1,4,149435,0; | Q171: =INT(((55+RC[-14]/10)*35+200)*12/4) -> 8128 | S171: =1000*110/100*(1+(55+RC[-16]/10)/200)*100 -> 149435
B172: 1,7,2529,0;1,4,1192,0; | C172: 168 | D172: 1 | E172: 7 | F172: 2529 | G172: 0 | I172: 1 | J172: 4 | K172: 1192 | L172: 0 | O172: ="1,7,"&RC[2]&",0;"&"1,4,"&RC[4]&",0;" -> 1,7,8139,0;1,4,149490,0; | Q172: =INT(((55+RC[-14]/10)*35+200)*12/4) -> 8139 | S172: =1000*110/100*(1+(55+RC[-16]/10)/200)*100 -> 149490
B173: 1,7,2539,0;1,4,1192,0; | C173: 169 | D173: 1 | E173: 7 | F173: 2539 | G173: 0 | I173: 1 | J173: 4 | K173: 1192 | L173: 0 | O173: ="1,7,"&RC[2]&",0;"&"1,4,"&RC[4]&",0;" -> 1,7,8149,0;1,4,149545,0; | Q173: =INT(((55+RC[-14]/10)*35+200)*12/4) -> 8149 | S173: =1000*110/100*(1+(55+RC[-16]/10)/200)*100 -> 149545.00000000003
B174: 1,7,2550,0;1,4,1193,0; | C174: 170 | D174: 1 | E174: 7 | F174: 2550 | G174: 0 | I174: 1 | J174: 4 | K174: 1193 | L174: 0 | O174: ="1,7,"&RC[2]&",0;"&"1,4,"&RC[4]&",0;" -> 1,7,8160,0;1,4,149600,0; | Q174: =INT(((55+RC[-14]/10)*35+200)*12/4) -> 8160 | S174: =1000*110/100*(1+(55+RC[-16]/10)/200)*100 -> 149599.99999999997
B175: 1,7,2560,0;1,4,1194,0; | C175: 171 | D175: 1 | E175: 7 | F175: 2560 | G175: 0 | I175: 1 | J175: 4 | K175: 1194 | L175: 0 | O175: ="1,7,"&RC[2]&",0;"&"1,4,"&RC[4]&",0;" -> 1,7,8170,0;1,4,149655,0; | Q175: =INT(((55+RC[-14]/10)*35+200)*12/4) -> 8170 | S175: =1000*110/100*(1+(55+RC[-16]/10)/200)*100 -> 149655
B176: 1,7,2571,0;1,4,1194,0; | C176: 172 | D176: 1 | E176: 7 | F176: 2571 | G176: 0 | I176: 1 | J176: 4 | K176: 1194 | L176: 0 | O176: ="1,7,"&RC[2]&",0;"&"1,4,"&RC[4]&",0;" -> 1,7,8181,0;1,4,149710,0; | Q176: =INT(((55+RC[-14]/10)*35+200)*12/4) -> 8181 | S176: =1000*110/100*(1+(55+RC[-16]/10)/200)*100 -> 149710
B177: 1,7,2581,0;1,4,1195,0; | C177: 173 | D177: 1 | E177: 7 | F177: 2581 | G177: 0 | I177: 1 | J177: 4 | K177: 1195 | L177: 0 | O177: ="1,7,"&RC[2]&",0;"&"1,4,"&RC[4]&",0;" -> 1,7,8191,0;1,4,149765,0; | Q177: =INT(((55+RC[-14]/10)*35+200)*12/4) -> 8191 | S177: =1000*110/100*(1+(55+RC[-16]/10)/200)*100 -> 149765
B178: 1,7,2592,0;1,4,1195,0; | C178: 174 | D178: 1 | E178: 7 | F178: 2592 | G178: 0 | I178: 1 | J178: 4 | K178: 1195 | L178: 0 | O178: ="1,7,"&RC[2]&",0;"&"1,4,"&RC[4]&",0;" -> 1,7,8202,0;1,4,149820,0; | Q178: =INT(((55+RC[-14]/10)*35+200)*12/4) -> 8202 | S178: =1000*110/100*(1+(55+RC[-16]/10)/200)*100 -> 149820
B179: 1,7,2602,0;1,4,1196,0; | C179: 175 | D179: 1 | E179: 7 | F179: 2602 | G179: 0 | I179: 1 | J179: 4 | K179: 1196 | L179: 0 | O179: ="1,7,"&RC[2]&",0;"&"1,4,"&RC[4]&",0;" -> 1,7,8212,0;1,4,149875,0; | Q179: =INT(((55+RC[-14]/10)*35+200)*12/4) -> 8212 | S179: =1000*110/100*(1+(55+RC[-16]/10)/200)*100 -> 149875
B180: 1,7,2613,0;1,4,1196,0; | C180: 176 | D180: 1 | E180: 7 | F180: 2613 | G180: 0 | I180: 1 | J180: 4 | K180: 1196 | L180: 0 | O180: ="1,7,"&RC[2]&",0;"&"1,4,"&RC[4]&",0;" -> 1,7,8223,0;1,4,149930,0; | Q180: =INT(((55+RC[-14]/10)*35+200)*12/4) -> 8223 | S180: =1000*110/100*(1+(55+RC[-16]/10)/200)*100 -> 149930
B181: 1,7,2623,0;1,4,1197,0; | C181: 177 | D181: 1 | E181: 7 | F181: 2623 | G181: 0 | I181: 1 | J181: 4 | K181: 1197 | L181: 0 | O181: ="1,7,"&RC[2]&",0;"&"1,4,"&RC[4]&",0;" -> 1,7,8233,0;1,4,149985,0; | Q181: =INT(((55+RC[-14]/10)*35+200)*12/4) -> 8233 | S181: =1000*110/100*(1+(55+RC[-16]/10)/200)*100 -> 149985
B182: 1,7,2634,0;1,4,1197,0; | C182: 178 | D182: 1 | E182: 7 | F182: 2634 | G182: 0 | I182: 1 | J182: 4 | K182: 1197 | L182: 0 | O182: ="1,7,"&RC[2]&",0;"&"1,4,"&RC[4]&",0;" -> 1,7,8244,0;1,4,150040,0; | Q182: =INT(((55+RC[-14]/10)*35+200)*12/4) -> 8244 | S182: =1000*110/100*(1+(55+RC[-16]/10)/200)*100 -> 150040
B183: 1,7,2644,0;1,4,1198,0; | C183: 179 | D183: 1 | E183: 7 | F183: 2644 | G183: 0 | I183: 1 | J183: 4 | K183: 1198 | L183: 0 | O183: ="1,7,"&RC[2]&",0;"&"1,4,"&RC[4]&",0;" -> 1,7,8254,0;1,4,150095,0; | Q183: =INT(((55+RC[-14]/10)*35+200)*12/4) -> 8254 | S183: =1000*110/100*(1+(55+RC[-16]/10)/200)*100 -> 150095
B184: 1,7,2655,0;1,4,1199,0; | C184: 180 | D184: 1 | E184: 7 | F184: 2655 | G184: 0 | I184: 1 | J184: 4 | K184: 1199 | L184: 0 | O184: ="1,7,"&RC[2]&",0;"&"1,4,"&RC[4]&",0;" -> 1,7,8265,0;1,4,150150,0; | Q184: =INT(((55+RC[-14]/10)*35+200)*12/4) -> 8265 | S184: =1000*110/100*(1+(55+RC[-16]/10)/200)*100 -> 150150
B185: 1,7,2665,0;1,4,1199,0; | C185: 181 | D185: 1 | E185: 7 | F185: 2665 | G185: 0 | I185: 1 | J185: 4 | K185: 1199 | L185: 0 | O185: ="1,7,"&RC[2]&",0;"&"1,4,"&RC[4]&",0;" -> 1,7,8275,0;1,4,150205,0; | Q185: =INT(((55+RC[-14]/10)*35+200)*12/4) -> 8275 | S185: =1000*110/100*(1+(55+RC[-16]/10)/200)*100 -> 150205
B186: 1,7,2676,0;1,4,1200,0; | C186: 182 | D186: 1 | E186: 7 | F186: 2676 | G186: 0 | I186: 1 | J186: 4 | K186: 1200 | L186: 0 | O186: ="1,7,"&RC[2]&",0;"&"1,4,"&RC[4]&",0;" -> 1,7,8286,0;1,4,150260,0; | Q186: =INT(((55+RC[-14]/10)*35+200)*12/4) -> 8286 | S186: =1000*110/100*(1+(55+RC[-16]/10)/200)*100 -> 150260
B187: 1,7,2686,0;1,4,1200,0; | C187: 183 | D187: 1 | E187: 7 | F187: 2686 | G187: 0 | I187: 1 | J187: 4 | K187: 1200 | L187: 0 | O187: ="1,7,"&RC[2]&",0;"&"1,4,"&RC[4]&",0;" -> 1,7,8296,0;1,4,150315,0; | Q187: =INT(((55+RC[-14]/10)*35+200)*12/4) -> 8296 | S187: =1000*110/100*(1+(55+RC[-16]/10)/200)*100 -> 150315
B188: 1,7,2697,0;1,4,1201,0; | C188: 184 | D188: 1 | E188: 7 | F188: 2697 | G188: 0 | I188: 1 | J188: 4 | K188: 1201 | L188: 0 | O188: ="1,7,"&RC[2]&",0;"&"1,4,"&RC[4]&",0;" -> 1,7,8307,0;1,4,150370,0; | Q188: =INT(((55+RC[-14]/10)*35+200)*12/4) -> 8307 | S188: =1000*110/100*(1+(55+RC[-16]/10)/200)*100 -> 150370
B189: 1,7,2707,0;1,4,1201,0; | C189: 185 | D189: 1 | E189: 7 | F189: 2707 | G189: 0 | I189: 1 | J189: 4 | K189: 1201 | L189: 0 | O189: ="1,7,"&RC[2]&",0;"&"1,4,"&RC[4]&",0;" -> 1,7,8317,0;1,4,150425,0; | Q189: =INT(((55+RC[-14]/10)*35+200)*12/4) -> 8317 | S189: =1000*110/100*(1+(55+RC[-16]/10)/200)*100 -> 150425
B190: 1,7,2718,0;1,4,1202,0; | C190: 186 | D190: 1 | E190: 7 | F190: 2718 | G190: 0 | I190: 1 | J190: 4 | K190: 1202 | L190: 0 | O190: ="1,7,"&RC[2]&",0;"&"1,4,"&RC[4]&",0;" -> 1,7,8328,0;1,4,150480,0; | Q190: =INT(((55+RC[-14]/10)*35+200)*12/4) -> 8328 | S190: =1000*110/100*(1+(55+RC[-16]/10)/200)*100 -> 150480
B191: 1,7,2728,0;1,4,1202,0; | C191: 187 | D191: 1 | E191: 7 | F191: 2728 | G191: 0 | I191: 1 | J191: 4 | K191: 1202 | L191: 0 | O191: ="1,7,"&RC[2]&",0;"&"1,4,"&RC[4]&",0;" -> 1,7,8338,0;1,4,150535,0; | Q191: =INT(((55+RC[-14]/10)*35+200)*12/4) -> 8338 | S191: =1000*110/100*(1+(55+RC[-16]/10)/200)*100 -> 150535
B192: 1,7,2739,0;1,4,1203,0; | C192: 188 | D192: 1 | E192: 7 | F192: 2739 | G192: 0 | I192: 1 | J192: 4 | K192: 1203 | L192: 0 | O192: ="1,7,"&RC[2]&",0;"&"1,4,"&RC[4]&",0;" -> 1,7,8349,0;1,4,150590,0; | Q192: =INT(((55+RC[-14]/10)*35+200)*12/4) -> 8349 | S192: =1000*110/100*(1+(55+RC[-16]/10)/200)*100 -> 150590
B193: 1,7,2749,0;1,4,1203,0; | C193: 189 | D193: 1 | E193: 7 | F193: 2749 | G193: 0 | I193: 1 | J193: 4 | K193: 1203 | L193: 0 | O193: ="1,7,"&RC[2]&",0;"&"1,4,"&RC[4]&",0;" -> 1,7,8359,0;1,4,150645,0; | Q193: =INT(((55+RC[-14]/10)*35+200)*12/4) -> 8359 | S193: =1000*110/100*(1+(55+RC[-16]/10)/200)*100 -> 150645
B194: 1,7,2760,0;1,4,1204,0; | C194: 190 | D194: 1 | E194: 7 | F194: 2760 | G194: 0 | I194: 1 | J194: 4 | K194: 1204 | L194: 0 | O194: ="1,7,"&RC[2]&",0;"&"1,4,"&RC[4]&",0;" -> 1,7,8370,0;1,4,150700,0; | Q194: =INT(((55+RC[-14]/10)*35+200)*12/4) -> 8370 | S194: =1000*110/100*(1+(55+RC[-16]/10)/200)*100 -> 150700.00000000003
B195: 1,7,2770,0;1,4,1205,0; | C195: 191 | D195: 1 | E195: 7 | F195: 2770 | G195: 0 | I195: 1 | J195: 4 | K195: 1205 | L195: 0 | O195: ="1,7,"&RC[2]&",0;"&"1,4,"&RC[4]&",0;" -> 1,7,8380,0;1,4,150755,0; | Q195: =INT(((55+RC[-14]/10)*35+200)*12/4) -> 8380 | S195: =1000*110/100*(1+(55+RC[-16]/10)/200)*100 -> 150755
B196: 1,7,2781,0;1,4,1205,0; | C196: 192 | D196: 1 | E196: 7 | F196: 2781 | G196: 0 | I196: 1 | J196: 4 | K196: 1205 | L196: 0 | O196: ="1,7,"&RC[2]&",0;"&"1,4,"&RC[4]&",0;" -> 1,7,8391,0;1,4,150810,0; | Q196: =INT(((55+RC[-14]/10)*35+200)*12/4) -> 8391 | S196: =1000*110/100*(1+(55+RC[-16]/10)/200)*100 -> 150810
B197: 1,7,2791,0;1,4,1206,0; | C197: 193 | D197: 1 | E197: 7 | F197: 2791 | G197: 0 | I197: 1 | J197: 4 | K197: 1206 | L197: 0 | O197: ="1,7,"&RC[2]&",0;"&"1,4,"&RC[4]&",0;" -> 1,7,8401,0;1,4,150865,0; | Q197: =INT(((55+RC[-14]/10)*35+200)*12/4) -> 8401 | S197: =1000*110/100*(1+(55+RC[-16]/10)/200)*100 -> 150865
B198: 1,7,2802,0;1,4,1206,0; | C198: 194 | D198: 1 | E198: 7 | F198: 2802 | G198: 0 | I198: 1 | J198: 4 | K198: 1206 | L198: 0 | O198: ="1,7,"&RC[2]&",0;"&"1,4,"&RC[4]&",0;" -> 1,7,8412,0;1,4,150920,0; | Q198: =INT(((55+RC[-14]/10)*35+200)*12/4) -> 8412 | S198: =1000*110/100*(1+(55+RC[-16]/10)/200)*100 -> 150920
B199: 1,7,2812,0;1,4,1207,0; | C199: 195 | D199: 1 | E199: 7 | F199: 2812 | G199: 0 | I199: 1 | J199: 4 | K199: 1207 | L199: 0 | O199: ="1,7,"&RC[2]&",0;"&"1,4,"&RC[4]&",0;" -> 1,7,8422,0;1,4,150975,0; | Q199: =INT(((55+RC[-14]/10)*35+200)*12/4) -> 8422 | S199: =1000*110/100*(1+(55+RC[-16]/10)/200)*100 -> 150975
B200: 1,7,2823,0;1,4,1207,0; | C200: 196 | D200: 1 | E200: 7 | F200: 2823 | G200: 0 | I200: 1 | J200: 4 | K200: 1207 | L200: 0 | O200: ="1,7,"&RC[2]&",0;"&"1,4,"&RC[4]&",0;" -> 1,7,8433,0;1,4,151030,0; | Q200: =INT(((55+RC[-14]/10)*35+200)*12/4) -> 8433 | S200: =1000*110/100*(1+(55+RC[-16]/10)/200)*100 -> 151030
B201: 1,7,2833,0;1,4,1208,0; | C201: 197 | D201: 1 | E201: 7 | F201: 2833 | G201: 0 | I201: 1 | J201: 4 | K201: 1208 | L201: 0 | O201: ="1,7,"&RC[2]&",0;"&"1,4,"&RC[4]&",0;" -> 1,7,8443,0;1,4,151085,0; | Q201: =INT(((55+RC[-14]/10)*35+200)*12/4) -> 8443 | S201: =1000*110/100*(1+(55+RC[-16]/10)/200)*100 -> 151085
B202: 1,7,2844,0;1,4,1208,0; | C202: 198 | D202: 1 | E202: 7 | F202: 2844 | G202: 0 | I202: 1 | J202: 4 | K202: 1208 | L202: 0 | O202: ="1,7,"&RC[2]&",0;"&"1,4,"&RC[4]&",0;" -> 1,7,8454,0;1,4,151140,0; | Q202: =INT(((55+RC[-14]/10)*35+200)*12/4) -> 8454 | S202: =1000*110/100*(1+(55+RC[-16]/10)/200)*100 -> 151140
B203: 1,7,2854,0;1,4,1209,0; | C203: 199 | D203: 1 | E203: 7 | F203: 2854 | G203: 0 | I203: 1 | J203: 4 | K203: 1209 | L203: 0 | O203: ="1,7,"&RC[2]&",0;"&"1,4,"&RC[4]&",0;" -> 1,7,8464,0;1,4,151195,0; | Q203: =INT(((55+RC[-14]/10)*35+200)*12/4) -> 8464 | S203: =1000*110/100*(1+(55+RC[-16]/10)/200)*100 -> 151195
B204: 1,7,2865,0;1,4,1210,0; | C204: 200 | D204: 1 | E204: 7 | F204: 2865 | G204: 0 | I204: 1 | J204: 4 | K204: 1210 | L204: 0 | O204: ="1,7,"&RC[2]&",0;"&"1,4,"&RC[4]&",0;" -> 1,7,8475,0;1,4,151250,0; | Q204: =INT(((55+RC[-14]/10)*35+200)*12/4) -> 8475 | S204: =1000*110/100*(1+(55+RC[-16]/10)/200)*100 -> 151250
B205: 1,7,2875,0;1,4,1210,0; | C205: 201 | D205: 1 | E205: 7 | F205: 2875 | G205: 0 | I205: 1 | J205: 4 | K205: 1210 | L205: 0 | O205: ="1,7,"&RC[2]&",0;"&"1,4,"&RC[4]&",0;" -> 1,7,8485,0;1,4,151305,0; | Q205: =INT(((55+RC[-14]/10)*35+200)*12/4) -> 8485 | S205: =1000*110/100*(1+(55+RC[-16]/10)/200)*100 -> 151305
B206: 1,7,2886,0;1,4,1211,0; | C206: 202 | D206: 1 | E206: 7 | F206: 2886 | G206: 0 | I206: 1 | J206: 4 | K206: 1211 | L206: 0 | O206: ="1,7,"&RC[2]&",0;"&"1,4,"&RC[4]&",0;" -> 1,7,8496,0;1,4,151360,0; | Q206: =INT(((55+RC[-14]/10)*35+200)*12/4) -> 8496 | S206: =1000*110/100*(1+(55+RC[-16]/10)/200)*100 -> 151360
B207: 1,7,2896,0;1,4,1211,0; | C207: 203 | D207: 1 | E207: 7 | F207: 2896 | G207: 0 | I207: 1 | J207: 4 | K207: 1211 | L207: 0 | O207: ="1,7,"&RC[2]&",0;"&"1,4,"&RC[4]&",0;" -> 1,7,8506,0;1,4,151415,0; | Q207: =INT(((55+RC[-14]/10)*35+200)*12/4) -> 8506 | S207: =1000*110/100*(1+(55+RC[-16]/10)/200)*100 -> 151415
B208: 1,7,2907,0;1,4,1212,0; | C208: 204 | D208: 1 | E208: 7 | F208: 2907 | G208: 0 | I208: 1 | J208: 4 | K208: 1212 | L208: 0 | O208: ="1,7,"&RC[2]&",0;"&"1,4,"&RC[4]&",0;" -> 1,7,8517,0;1,4,151470,0; | Q208: =INT(((55+RC[-14]/10)*35+200)*12/4) -> 8517 | S208: =1000*110/100*(1+(55+RC[-16]/10)/200)*100 -> 151470
B209: 1,7,2917,0;1,4,1212,0; | C209: 205 | D209: 1 | E209: 7 | F209: 2917 | G209: 0 | I209: 1 | J209: 4 | K209: 1212 | L209: 0 | O209: ="1,7,"&RC[2]&",0;"&"1,4,"&RC[4]&",0;" -> 1,7,8527,0;1,4,151525,0; | Q209: =INT(((55+RC[-14]/10)*35+200)*12/4) -> 8527 | S209: =1000*110/100*(1+(55+RC[-16]/10)/200)*100 -> 151525
B210: 1,7,2928,0;1,4,1213,0; | C210: 206 | D210: 1 | E210: 7 | F210: 2928 | G210: 0 | I210: 1 | J210: 4 | K210: 1213 | L210: 0 | O210: ="1,7,"&RC[2]&",0;"&"1,4,"&RC[4]&",0;" -> 1,7,8538,0;1,4,151580,0; | Q210: =INT(((55+RC[-14]/10)*35+200)*12/4) -> 8538 | S210: =1000*110/100*(1+(55+RC[-16]/10)/200)*100 -> 151580
B211: 1,7,2938,0;1,4,1213,0; | C211: 207 | D211: 1 | E211: 7 | F211: 2938 | G211: 0 | I211: 1 | J211: 4 | K211: 1213 | L211: 0 | O211: ="1,7,"&RC[2]&",0;"&"1,4,"&RC[4]&",0;" -> 1,7,8548,0;1,4,151635,0; | Q211: =INT(((55+RC[-14]/10)*35+200)*12/4) -> 8548 | S211: =1000*110/100*(1+(55+RC[-16]/10)/200)*100 -> 151635
B212: 1,7,2949,0;1,4,1214,0; | C212: 208 | D212: 1 | E212: 7 | F212: 2949 | G212: 0 | I212: 1 | J212: 4 | K212: 1214 | L212: 0 | O212: ="1,7,"&RC[2]&",0;"&"1,4,"&RC[4]&",0;" -> 1,7,8559,0;1,4,151690,0; | Q212: =INT(((55+RC[-14]/10)*35+200)*12/4) -> 8559 | S212: =1000*110/100*(1+(55+RC[-16]/10)/200)*100 -> 151690
B213: 1,7,2959,0;1,4,1214,0; | C213: 209 | D213: 1 | E213: 7 | F213: 2959 | G213: 0 | I213: 1 | J213: 4 | K213: 1214 | L213: 0 | O213: ="1,7,"&RC[2]&",0;"&"1,4,"&RC[4]&",0;" -> 1,7,8569,0;1,4,151745,0; | Q213: =INT(((55+RC[-14]/10)*35+200)*12/4) -> 8569 | S213: =1000*110/100*(1+(55+RC[-16]/10)/200)*100 -> 151745
B214: 1,7,2970,0;1,4,1215,0; | C214: 210 | D214: 1 | E214: 7 | F214: 2970 | G214: 0 | I214: 1 | J214: 4 | K214: 1215 | L214: 0 | O214: ="1,7,"&RC[2]&",0;"&"1,4,"&RC[4]&",0;" -> 1,7,8580,0;1,4,151800,0; | Q214: =INT(((55+RC[-14]/10)*35+200)*12/4) -> 8580 | S214: =1000*110/100*(1+(55+RC[-16]/10)/200)*100 -> 151799.99999999997
B215: 1,7,2980,0;1,4,1216,0; | C215: 211 | D215: 1 | E215: 7 | F215: 2980 | G215: 0 | I215: 1 | J215: 4 | K215: 1216 | L215: 0 | O215: ="1,7,"&RC[2]&",0;"&"1,4,"&RC[4]&",0;" -> 1,7,8590,0;1,4,151855,0; | Q215: =INT(((55+RC[-14]/10)*35+200)*12/4) -> 8590 | S215: =1000*110/100*(1+(55+RC[-16]/10)/200)*100 -> 151855
B216: 1,7,2991,0;1,4,1216,0; | C216: 212 | D216: 1 | E216: 7 | F216: 2991 | G216: 0 | I216: 1 | J216: 4 | K216: 1216 | L216: 0 | O216: ="1,7,"&RC[2]&",0;"&"1,4,"&RC[4]&",0;" -> 1,7,8601,0;1,4,151910,0; | Q216: =INT(((55+RC[-14]/10)*35+200)*12/4) -> 8601 | S216: =1000*110/100*(1+(55+RC[-16]/10)/200)*100 -> 151910
B217: 1,7,3001,0;1,4,1217,0; | C217: 213 | D217: 1 | E217: 7 | F217: 3001 | G217: 0 | I217: 1 | J217: 4 | K217: 1217 | L217: 0 | O217: ="1,7,"&RC[2]&",0;"&"1,4,"&RC[4]&",0;" -> 1,7,8611,0;1,4,151965,0; | Q217: =INT(((55+RC[-14]/10)*35+200)*12/4) -> 8611 | S217: =1000*110/100*(1+(55+RC[-16]/10)/200)*100 -> 151965
B218: 1,7,3012,0;1,4,1217,0; | C218: 214 | D218: 1 | E218: 7 | F218: 3012 | G218: 0 | I218: 1 | J218: 4 | K218: 1217 | L218: 0 | O218: ="1,7,"&RC[2]&",0;"&"1,4,"&RC[4]&",0;" -> 1,7,8622,0;1,4,152020,0; | Q218: =INT(((55+RC[-14]/10)*35+200)*12/4) -> 8622 | S218: =1000*110/100*(1+(55+RC[-16]/10)/200)*100 -> 152020
B219: 1,7,3022,0;1,4,1218,0; | C219: 215 | D219: 1 | E219: 7 | F219: 3022 | G219: 0 | I219: 1 | J219: 4 | K219: 1218 | L219: 0 | O219: ="1,7,"&RC[2]&",0;"&"1,4,"&RC[4]&",0;" -> 1,7,8632,0;1,4,152075,0; | Q219: =INT(((55+RC[-14]/10)*35+200)*12/4) -> 8632 | S219: =1000*110/100*(1+(55+RC[-16]/10)/200)*100 -> 152075
B220: 1,7,3033,0;1,4,1218,0; | C220: 216 | D220: 1 | E220: 7 | F220: 3033 | G220: 0 | I220: 1 | J220: 4 | K220: 1218 | L220: 0 | O220: ="1,7,"&RC[2]&",0;"&"1,4,"&RC[4]&",0;" -> 1,7,8643,0;1,4,152130,0; | Q220: =INT(((55+RC[-14]/10)*35+200)*12/4) -> 8643 | S220: =1000*110/100*(1+(55+RC[-16]/10)/200)*100 -> 152130
B221: 1,7,3043,0;1,4,1219,0; | C221: 217 | D221: 1 | E221: 7 | F221: 3043 | G221: 0 | I221: 1 | J221: 4 | K221: 1219 | L221: 0 | O221: ="1,7,"&RC[2]&",0;"&"1,4,"&RC[4]&",0;" -> 1,7,8653,0;1,4,152185,0; | Q221: =INT(((55+RC[-14]/10)*35+200)*12/4) -> 8653 | S221: =1000*110/100*(1+(55+RC[-16]/10)/200)*100 -> 152185
B222: 1,7,3054,0;1,4,1219,0; | C222: 218 | D222: 1 | E222: 7 | F222: 3054 | G222: 0 | I222: 1 | J222: 4 | K222: 1219 | L222: 0 | O222: ="1,7,"&RC[2]&",0;"&"1,4,"&RC[4]&",0;" -> 1,7,8664,0;1,4,152240,0; | Q222: =INT(((55+RC[-14]/10)*35+200)*12/4) -> 8664 | S222: =1000*110/100*(1+(55+RC[-16]/10)/200)*100 -> 152240
B223: 1,7,3064,0;1,4,1220,0; | C223: 219 | D223: 1 | E223: 7 | F223: 3064 | G223: 0 | I223: 1 | J223: 4 | K223: 1220 | L223: 0 | O223: ="1,7,"&RC[2]&",0;"&"1,4,"&RC[4]&",0;" -> 1,7,8674,0;1,4,152295,0; | Q223: =INT(((55+RC[-14]/10)*35+200)*12/4) -> 8674 | S223: =1000*110/100*(1+(55+RC[-16]/10)/200)*100 -> 152295
B224: 1,7,3075,0;1,4,1221,0; | C224: 220 | D224: 1 | E224: 7 | F224: 3075 | G224: 0 | I224: 1 | J224: 4 | K224: 1221 | L224: 0 | O224: ="1,7,"&RC[2]&",0;"&"1,4,"&RC[4]&",0;" -> 1,7,8685,0;1,4,152350,0; | Q224: =INT(((55+RC[-14]/10)*35+200)*12/4) -> 8685 | S224: =1000*110/100*(1+(55+RC[-16]/10)/200)*100 -> 152350
B225: 1,7,3085,0;1,4,1221,0; | C225: 221 | D225: 1 | E225: 7 | F225: 3085 | G225: 0 | I225: 1 | J225: 4 | K225: 1221 | L225: 0 | O225: ="1,7,"&RC[2]&",0;"&"1,4,"&RC[4]&",0;" -> 1,7,8695,0;1,4,152405,0; | Q225: =INT(((55+RC[-14]/10)*35+200)*12/4) -> 8695 | S225: =1000*110/100*(1+(55+RC[-16]/10)/200)*100 -> 152405
B226: 1,7,3096,0;1,4,1222,0; | C226: 222 | D226: 1 | E226: 7 | F226: 3096 | G226: 0 | I226: 1 | J226: 4 | K226: 1222 | L226: 0 | O226: ="1,7,"&RC[2]&",0;"&"1,4,"&RC[4]&",0;" -> 1,7,8706,0;1,4,152460,0; | Q226: =INT(((55+RC[-14]/10)*35+200)*12/4) -> 8706 | S226: =1000*110/100*(1+(55+RC[-16]/10)/200)*100 -> 152460
B227: 1,7,3106,0;1,4,1222,0; | C227: 223 | D227: 1 | E227: 7 | F227: 3106 | G227: 0 | I227: 1 | J227: 4 | K227: 1222 | L227: 0 | O227: ="1,7,"&RC[2]&",0;"&"1,4,"&RC[4]&",0;" -> 1,7,8716,0;1,4,152515,0; | Q227: =INT(((55+RC[-14]/10)*35+200)*12/4) -> 8716 | S227: =1000*110/100*(1+(55+RC[-16]/10)/200)*100 -> 152515
B228: 1,7,3117,0;1,4,1223,0; | C228: 224 | D228: 1 | E228: 7 | F228: 3117 | G228: 0 | I228: 1 | J228: 4 | K228: 1223 | L228: 0 | O228: ="1,7,"&RC[2]&",0;"&"1,4,"&RC[4]&",0;" -> 1,7,8727,0;1,4,152570,0; | Q228: =INT(((55+RC[-14]/10)*35+200)*12/4) -> 8727 | S228: =1000*110/100*(1+(55+RC[-16]/10)/200)*100 -> 152570
B229: 1,7,3127,0;1,4,1223,0; | C229: 225 | D229: 1 | E229: 7 | F229: 3127 | G229: 0 | I229: 1 | J229: 4 | K229: 1223 | L229: 0 | O229: ="1,7,"&RC[2]&",0;"&"1,4,"&RC[4]&",0;" -> 1,7,8737,0;1,4,152625,0; | Q229: =INT(((55+RC[-14]/10)*35+200)*12/4) -> 8737 | S229: =1000*110/100*(1+(55+RC[-16]/10)/200)*100 -> 152625
B230: 1,7,3138,0;1,4,1224,0; | C230: 226 | D230: 1 | E230: 7 | F230: 3138 | G230: 0 | I230: 1 | J230: 4 | K230: 1224 | L230: 0 | O230: ="1,7,"&RC[2]&",0;"&"1,4,"&RC[4]&",0;" -> 1,7,8748,0;1,4,152680,0; | Q230: =INT(((55+RC[-14]/10)*35+200)*12/4) -> 8748 | S230: =1000*110/100*(1+(55+RC[-16]/10)/200)*100 -> 152680
B231: 1,7,3148,0;1,4,1224,0; | C231: 227 | D231: 1 | E231: 7 | F231: 3148 | G231: 0 | I231: 1 | J231: 4 | K231: 1224 | L231: 0 | O231: ="1,7,"&RC[2]&",0;"&"1,4,"&RC[4]&",0;" -> 1,7,8758,0;1,4,152735,0; | Q231: =INT(((55+RC[-14]/10)*35+200)*12/4) -> 8758 | S231: =1000*110/100*(1+(55+RC[-16]/10)/200)*100 -> 152735
B232: 1,7,3159,0;1,4,1225,0; | C232: 228 | D232: 1 | E232: 7 | F232: 3159 | G232: 0 | I232: 1 | J232: 4 | K232: 1225 | L232: 0 | O232: ="1,7,"&RC[2]&",0;"&"1,4,"&RC[4]&",0;" -> 1,7,8769,0;1,4,152790,0; | Q232: =INT(((55+RC[-14]/10)*35+200)*12/4) -> 8769 | S232: =1000*110/100*(1+(55+RC[-16]/10)/200)*100 -> 152790
B233: 1,7,3169,0;1,4,1225,0; | C233: 229 | D233: 1 | E233: 7 | F233: 3169 | G233: 0 | I233: 1 | J233: 4 | K233: 1225 | L233: 0 | O233: ="1,7,"&RC[2]&",0;"&"1,4,"&RC[4]&",0;" -> 1,7,8779,0;1,4,152845,0; | Q233: =INT(((55+RC[-14]/10)*35+200)*12/4) -> 8779 | S233: =1000*110/100*(1+(55+RC[-16]/10)/200)*100 -> 152845
B234: 1,7,3180,0;1,4,1226,0; | C234: 230 | D234: 1 | E234: 7 | F234: 3180 | G234: 0 | I234: 1 | J234: 4 | K234: 1226 | L234: 0 | O234: ="1,7,"&RC[2]&",0;"&"1,4,"&RC[4]&",0;" -> 1,7,8790,0;1,4,152900,0; | Q234: =INT(((55+RC[-14]/10)*35+200)*12/4) -> 8790 | S234: =1000*110/100*(1+(55+RC[-16]/10)/200)*100 -> 152900.00000000003
B235: 1,7,3190,0;1,4,1227,0; | C235: 231 | D235: 1 | E235: 7 | F235: 3190 | G235: 0 | I235: 1 | J235: 4 | K235: 1227 | L235: 0 | O235: ="1,7,"&RC[2]&",0;"&"1,4,"&RC[4]&",0;" -> 1,7,8800,0;1,4,152955,0; | Q235: =INT(((55+RC[-14]/10)*35+200)*12/4) -> 8800 | S235: =1000*110/100*(1+(55+RC[-16]/10)/200)*100 -> 152954.99999999997
B236: 1,7,3201,0;1,4,1227,0; | C236: 232 | D236: 1 | E236: 7 | F236: 3201 | G236: 0 | I236: 1 | J236: 4 | K236: 1227 | L236: 0 | O236: ="1,7,"&RC[2]&",0;"&"1,4,"&RC[4]&",0;" -> 1,7,8811,0;1,4,153010,0; | Q236: =INT(((55+RC[-14]/10)*35+200)*12/4) -> 8811 | S236: =1000*110/100*(1+(55+RC[-16]/10)/200)*100 -> 153010
B237: 1,7,3211,0;1,4,1228,0; | C237: 233 | D237: 1 | E237: 7 | F237: 3211 | G237: 0 | I237: 1 | J237: 4 | K237: 1228 | L237: 0 | O237: ="1,7,"&RC[2]&",0;"&"1,4,"&RC[4]&",0;" -> 1,7,8821,0;1,4,153065,0; | Q237: =INT(((55+RC[-14]/10)*35+200)*12/4) -> 8821 | S237: =1000*110/100*(1+(55+RC[-16]/10)/200)*100 -> 153065
B238: 1,7,3222,0;1,4,1228,0; | C238: 234 | D238: 1 | E238: 7 | F238: 3222 | G238: 0 | I238: 1 | J238: 4 | K238: 1228 | L238: 0 | O238: ="1,7,"&RC[2]&",0;"&"1,4,"&RC[4]&",0;" -> 1,7,8832,0;1,4,153120,0; | Q238: =INT(((55+RC[-14]/10)*35+200)*12/4) -> 8832 | S238: =1000*110/100*(1+(55+RC[-16]/10)/200)*100 -> 153119.99999999997
B239: 1,7,3232,0;1,4,1229,0; | C239: 235 | D239: 1 | E239: 7 | F239: 3232 | G239: 0 | I239: 1 | J239: 4 | K239: 1229 | L239: 0 | O239: ="1,7,"&RC[2]&",0;"&"1,4,"&RC[4]&",0;" -> 1,7,8842,0;1,4,153175,0; | Q239: =INT(((55+RC[-14]/10)*35+200)*12/4) -> 8842 | S239: =1000*110/100*(1+(55+RC[-16]/10)/200)*100 -> 153175
B240: 1,7,3243,0;1,4,1229,0; | C240: 236 | D240: 1 | E240: 7 | F240: 3243 | G240: 0 | I240: 1 | J240: 4 | K240: 1229 | L240: 0 | O240: ="1,7,"&RC[2]&",0;"&"1,4,"&RC[4]&",0;" -> 1,7,8853,0;1,4,153230,0; | Q240: =INT(((55+RC[-14]/10)*35+200)*12/4) -> 8853 | S240: =1000*110/100*(1+(55+RC[-16]/10)/200)*100 -> 153230
B241: 1,7,3253,0;1,4,1230,0; | C241: 237 | D241: 1 | E241: 7 | F241: 3253 | G241: 0 | I241: 1 | J241: 4 | K241: 1230 | L241: 0 | O241: ="1,7,"&RC[2]&",0;"&"1,4,"&RC[4]&",0;" -> 1,7,8863,0;1,4,153285,0; | Q241: =INT(((55+RC[-14]/10)*35+200)*12/4) -> 8863 | S241: =1000*110/100*(1+(55+RC[-16]/10)/200)*100 -> 153285
B242: 1,7,3264,0;1,4,1230,0; | C242: 238 | D242: 1 | E242: 7 | F242: 3264 | G242: 0 | I242: 1 | J242: 4 | K242: 1230 | L242: 0 | O242: ="1,7,"&RC[2]&",0;"&"1,4,"&RC[4]&",0;" -> 1,7,8874,0;1,4,153340,0; | Q242: =INT(((55+RC[-14]/10)*35+200)*12/4) -> 8874 | S242: =1000*110/100*(1+(55+RC[-16]/10)/200)*100 -> 153340
B243: 1,7,3274,0;1,4,1231,0; | C243: 239 | D243: 1 | E243: 7 | F243: 3274 | G243: 0 | I243: 1 | J243: 4 | K243: 1231 | L243: 0 | O243: ="1,7,"&RC[2]&",0;"&"1,4,"&RC[4]&",0;" -> 1,7,8884,0;1,4,153395,0; | Q243: =INT(((55+RC[-14]/10)*35+200)*12/4) -> 8884 | S243: =1000*110/100*(1+(55+RC[-16]/10)/200)*100 -> 153395
B244: 1,7,3285,0;1,4,1232,0; | C244: 240 | D244: 1 | E244: 7 | F244: 3285 | G244: 0 | I244: 1 | J244: 4 | K244: 1232 | L244: 0 | O244: ="1,7,"&RC[2]&",0;"&"1,4,"&RC[4]&",0;" -> 1,7,8895,0;1,4,153450,0; | Q244: =INT(((55+RC[-14]/10)*35+200)*12/4) -> 8895 | S244: =1000*110/100*(1+(55+RC[-16]/10)/200)*100 -> 153450
B245: 1,7,3295,0;1,4,1232,0; | C245: 241 | D245: 1 | E245: 7 | F245: 3295 | G245: 0 | I245: 1 | J245: 4 | K245: 1232 | L245: 0 | O245: ="1,7,"&RC[2]&",0;"&"1,4,"&RC[4]&",0;" -> 1,7,8905,0;1,4,153505,0; | Q245: =INT(((55+RC[-14]/10)*35+200)*12/4) -> 8905 | S245: =1000*110/100*(1+(55+RC[-16]/10)/200)*100 -> 153505
B246: 1,7,3306,0;1,4,1233,0; | C246: 242 | D246: 1 | E246: 7 | F246: 3306 | G246: 0 | I246: 1 | J246: 4 | K246: 1233 | L246: 0 | O246: ="1,7,"&RC[2]&",0;"&"1,4,"&RC[4]&",0;" -> 1,7,8916,0;1,4,153560,0; | Q246: =INT(((55+RC[-14]/10)*35+200)*12/4) -> 8916 | S246: =1000*110/100*(1+(55+RC[-16]/10)/200)*100 -> 153560
B247: 1,7,3316,0;1,4,1233,0; | C247: 243 | D247: 1 | E247: 7 | F247: 3316 | G247: 0 | I247: 1 | J247: 4 | K247: 1233 | L247: 0 | O247: ="1,7,"&RC[2]&",0;"&"1,4,"&RC[4]&",0;" -> 1,7,8926,0;1,4,153615,0; | Q247: =INT(((55+RC[-14]/10)*35+200)*12/4) -> 8926 | S247: =1000*110/100*(1+(55+RC[-16]/10)/200)*100 -> 153615
B248: 1,7,3327,0;1,4,1234,0; | C248: 244 | D248: 1 | E248: 7 | F248: 3327 | G248: 0 | I248: 1 | J248: 4 | K248: 1234 | L248: 0 | O248: ="1,7,"&RC[2]&",0;"&"1,4,"&RC[4]&",0;" -> 1,7,8937,0;1,4,153670,0; | Q248: =INT(((55+RC[-14]/10)*35+200)*12/4) -> 8937 | S248: =1000*110/100*(1+(55+RC[-16]/10)/200)*100 -> 153670
B249: 1,7,3337,0;1,4,1234,0; | C249: 245 | D249: 1 | E249: 7 | F249: 3337 | G249: 0 | I249: 1 | J249: 4 | K249: 1234 | L249: 0 | O249: ="1,7,"&RC[2]&",0;"&"1,4,"&RC[4]&",0;" -> 1,7,8947,0;1,4,153725,0; | Q249: =INT(((55+RC[-14]/10)*35+200)*12/4) -> 8947 | S249: =1000*110/100*(1+(55+RC[-16]/10)/200)*100 -> 153725
B250: 1,7,3348,0;1,4,1235,0; | C250: 246 | D250: 1 | E250: 7 | F250: 3348 | G250: 0 | I250: 1 | J250: 4 | K250: 1235 | L250: 0 | O250: ="1,7,"&RC[2]&",0;"&"1,4,"&RC[4]&",0;" -> 1,7,8958,0;1,4,153780,0; | Q250: =INT(((55+RC[-14]/10)*35+200)*12/4) -> 8958 | S250: =1000*110/100*(1+(55+RC[-16]/10)/200)*100 -> 153780
B251: 1,7,3358,0;1,4,1235,0; | C251: 247 | D251: 1 | E251: 7 | F251: 3358 | G251: 0 | I251: 1 | J251: 4 | K251: 1235 | L251: 0 | O251: ="1,7,"&RC[2]&",0;"&"1,4,"&RC[4]&",0;" -> 1,7,8968,0;1,4,153835,0; | Q251: =INT(((55+RC[-14]/10)*35+200)*12/4) -> 8968 | S251: =1000*110/100*(1+(55+RC[-16]/10)/200)*100 -> 153835
B252: 1,7,3369,0;1,4,1236,0; | C252: 248 | D252: 1 | E252: 7 | F252: 3369 | G252: 0 | I252: 1 | J252: 4 | K252: 1236 | L252: 0 | O252: ="1,7,"&RC[2]&",0;"&"1,4,"&RC[4]&",0;" -> 1,7,8979,0;1,4,153890,0; | Q252: =INT(((55+RC[-14]/10)*35+200)*12/4) -> 8979 | S252: =1000*110/100*(1+(55+RC[-16]/10)/200)*100 -> 153890
B253: 1,7,3379,0;1,4,1236,0; | C253: 249 | D253: 1 | E253: 7 | F253: 3379 | G253: 0 | I253: 1 | J253: 4 | K253: 1236 | L253: 0 | O253: ="1,7,"&RC[2]&",0;"&"1,4,"&RC[4]&",0;" -> 1,7,8989,0;1,4,153945,0; | Q253: =INT(((55+RC[-14]/10)*35+200)*12/4) -> 8989 | S253: =1000*110/100*(1+(55+RC[-16]/10)/200)*100 -> 153945
B254: 1,7,3390,0;1,4,1237,0; | C254: 250 | D254: 1 | E254: 7 | F254: 3390 | G254: 0 | I254: 1 | J254: 4 | K254: 1237 | L254: 0 | O254: ="1,7,"&RC[2]&",0;"&"1,4,"&RC[4]&",0;" -> 1,7,9000,0;1,4,154000,0; | Q254: =INT(((55+RC[-14]/10)*35+200)*12/4) -> 9000 | S254: =1000*110/100*(1+(55+RC[-16]/10)/200)*100 -> 154000
B255: 1,7,3400,0;1,4,1238,0; | C255: 251 | D255: 1 | E255: 7 | F255: 3400 | G255: 0 | I255: 1 | J255: 4 | K255: 1238 | L255: 0 | O255: ="1,7,"&RC[2]&",0;"&"1,4,"&RC[4]&",0;" -> 1,7,9010,0;1,4,154055,0; | Q255: =INT(((55+RC[-14]/10)*35+200)*12/4) -> 9010 | S255: =1000*110/100*(1+(55+RC[-16]/10)/200)*100 -> 154055.00000000003
B256: 1,7,3411,0;1,4,1238,0; | C256: 252 | D256: 1 | E256: 7 | F256: 3411 | G256: 0 | I256: 1 | J256: 4 | K256: 1238 | L256: 0 | O256: ="1,7,"&RC[2]&",0;"&"1,4,"&RC[4]&",0;" -> 1,7,9021,0;1,4,154110,0; | Q256: =INT(((55+RC[-14]/10)*35+200)*12/4) -> 9021 | S256: =1000*110/100*(1+(55+RC[-16]/10)/200)*100 -> 154110
B257: 1,7,3421,0;1,4,1239,0; | C257: 253 | D257: 1 | E257: 7 | F257: 3421 | G257: 0 | I257: 1 | J257: 4 | K257: 1239 | L257: 0 | O257: ="1,7,"&RC[2]&",0;"&"1,4,"&RC[4]&",0;" -> 1,7,9031,0;1,4,154165,0; | Q257: =INT(((55+RC[-14]/10)*35+200)*12/4) -> 9031 | S257: =1000*110/100*(1+(55+RC[-16]/10)/200)*100 -> 154165
B258: 1,7,3432,0;1,4,1239,0; | C258: 254 | D258: 1 | E258: 7 | F258: 3432 | G258: 0 | I258: 1 | J258: 4 | K258: 1239 | L258: 0 | O258: ="1,7,"&RC[2]&",0;"&"1,4,"&RC[4]&",0;" -> 1,7,9042,0;1,4,154220,0; | Q258: =INT(((55+RC[-14]/10)*35+200)*12/4) -> 9042 | S258: =1000*110/100*(1+(55+RC[-16]/10)/200)*100 -> 154220
B259: 1,7,3442,0;1,4,1240,0; | C259: 255 | D259: 1 | E259: 7 | F259: 3442 | G259: 0 | I259: 1 | J259: 4 | K259: 1240 | L259: 0 | O259: ="1,7,"&RC[2]&",0;"&"1,4,"&RC[4]&",0;" -> 1,7,9052,0;1,4,154275,0; | Q259: =INT(((55+RC[-14]/10)*35+200)*12/4) -> 9052 | S259: =1000*110/100*(1+(55+RC[-16]/10)/200)*100 -> 154275
B260: 1,7,3453,0;1,4,1240,0; | C260: 256 | D260: 1 | E260: 7 | F260: 3453 | G260: 0 | I260: 1 | J260: 4 | K260: 1240 | L260: 0 | O260: ="1,7,"&RC[2]&",0;"&"1,4,"&RC[4]&",0;" -> 1,7,9063,0;1,4,154330,0; | Q260: =INT(((55+RC[-14]/10)*35+200)*12/4) -> 9063 | S260: =1000*110/100*(1+(55+RC[-16]/10)/200)*100 -> 154330
B261: 1,7,3463,0;1,4,1241,0; | C261: 257 | D261: 1 | E261: 7 | F261: 3463 | G261: 0 | I261: 1 | J261: 4 | K261: 1241 | L261: 0 | O261: ="1,7,"&RC[2]&",0;"&"1,4,"&RC[4]&",0;" -> 1,7,9073,0;1,4,154385,0; | Q261: =INT(((55+RC[-14]/10)*35+200)*12/4) -> 9073 | S261: =1000*110/100*(1+(55+RC[-16]/10)/200)*100 -> 154385
B262: 1,7,3474,0;1,4,1241,0; | C262: 258 | D262: 1 | E262: 7 | F262: 3474 | G262: 0 | I262: 1 | J262: 4 | K262: 1241 | L262: 0 | O262: ="1,7,"&RC[2]&",0;"&"1,4,"&RC[4]&",0;" -> 1,7,9084,0;1,4,154440,0; | Q262: =INT(((55+RC[-14]/10)*35+200)*12/4) -> 9084 | S262: =1000*110/100*(1+(55+RC[-16]/10)/200)*100 -> 154440
B263: 1,7,3484,0;1,4,1242,0; | C263: 259 | D263: 1 | E263: 7 | F263: 3484 | G263: 0 | I263: 1 | J263: 4 | K263: 1242 | L263: 0 | O263: ="1,7,"&RC[2]&",0;"&"1,4,"&RC[4]&",0;" -> 1,7,9094,0;1,4,154495,0; | Q263: =INT(((55+RC[-14]/10)*35+200)*12/4) -> 9094 | S263: =1000*110/100*(1+(55+RC[-16]/10)/200)*100 -> 154495
B264: 1,7,3495,0;1,4,1243,0; | C264: 260 | D264: 1 | E264: 7 | F264: 3495 | G264: 0 | I264: 1 | J264: 4 | K264: 1243 | L264: 0 | O264: ="1,7,"&RC[2]&",0;"&"1,4,"&RC[4]&",0;" -> 1,7,9105,0;1,4,154550,0; | Q264: =INT(((55+RC[-14]/10)*35+200)*12/4) -> 9105 | S264: =1000*110/100*(1+(55+RC[-16]/10)/200)*100 -> 154550
B265: 1,7,3505,0;1,4,1243,0; | C265: 261 | D265: 1 | E265: 7 | F265: 3505 | G265: 0 | I265: 1 | J265: 4 | K265: 1243 | L265: 0 | O265: ="1,7,"&RC[2]&",0;"&"1,4,"&RC[4]&",0;" -> 1,7,9115,0;1,4,154605,0; | Q265: =INT(((55+RC[-14]/10)*35+200)*12/4) -> 9115 | S265: =1000*110/100*(1+(55+RC[-16]/10)/200)*100 -> 154605
B266: 1,7,3516,0;1,4,1244,0; | C266: 262 | D266: 1 | E266: 7 | F266: 3516 | G266: 0 | I266: 1 | J266: 4 | K266: 1244 | L266: 0 | O266: ="1,7,"&RC[2]&",0;"&"1,4,"&RC[4]&",0;" -> 1,7,9126,0;1,4,154660,0; | Q266: =INT(((55+RC[-14]/10)*35+200)*12/4) -> 9126 | S266: =1000*110/100*(1+(55+RC[-16]/10)/200)*100 -> 154660
B267: 1,7,3526,0;1,4,1244,0; | C267: 263 | D267: 1 | E267: 7 | F267: 3526 | G267: 0 | I267: 1 | J267: 4 | K267: 1244 | L267: 0 | O267: ="1,7,"&RC[2]&",0;"&"1,4,"&RC[4]&",0;" -> 1,7,9136,0;1,4,154715,0; | Q267: =INT(((55+RC[-14]/10)*35+200)*12/4) -> 9136 | S267: =1000*110/100*(1+(55+RC[-16]/10)/200)*100 -> 154715
B268: 1,7,3537,0;1,4,1245,0; | C268: 264 | D268: 1 | E268: 7 | F268: 3537 | G268: 0 | I268: 1 | J268: 4 | K268: 1245 | L268: 0 | O268: ="1,7,"&RC[2]&",0;"&"1,4,"&RC[4]&",0;" -> 1,7,9147,0;1,4,154770,0; | Q268: =INT(((55+RC[-14]/10)*35+200)*12/4) -> 9147 | S268: =1000*110/100*(1+(55+RC[-16]/10)/200)*100 -> 154770
B269: 1,7,3547,0;1,4,1245,0; | C269: 265 | D269: 1 | E269: 7 | F269: 3547 | G269: 0 | I269: 1 | J269: 4 | K269: 1245 | L269: 0 | O269: ="1,7,"&RC[2]&",0;"&"1,4,"&RC[4]&",0;" -> 1,7,9157,0;1,4,154825,0; | Q269: =INT(((55+RC[-14]/10)*35+200)*12/4) -> 9157 | S269: =1000*110/100*(1+(55+RC[-16]/10)/200)*100 -> 154825
B270: 1,7,3558,0;1,4,1246,0; | C270: 266 | D270: 1 | E270: 7 | F270: 3558 | G270: 0 | I270: 1 | J270: 4 | K270: 1246 | L270: 0 | O270: ="1,7,"&RC[2]&",0;"&"1,4,"&RC[4]&",0;" -> 1,7,9168,0;1,4,154880,0; | Q270: =INT(((55+RC[-14]/10)*35+200)*12/4) -> 9168 | S270: =1000*110/100*(1+(55+RC[-16]/10)/200)*100 -> 154880
B271: 1,7,3568,0;1,4,1246,0; | C271: 267 | D271: 1 | E271: 7 | F271: 3568 | G271: 0 | I271: 1 | J271: 4 | K271: 1246 | L271: 0 | O271: ="1,7,"&RC[2]&",0;"&"1,4,"&RC[4]&",0;" -> 1,7,9178,0;1,4,154935,0; | Q271: =INT(((55+RC[-14]/10)*35+200)*12/4) -> 9178 | S271: =1000*110/100*(1+(55+RC[-16]/10)/200)*100 -> 154935
B272: 1,7,3579,0;1,4,1247,0; | C272: 268 | D272: 1 | E272: 7 | F272: 3579 | G272: 0 | I272: 1 | J272: 4 | K272: 1247 | L272: 0 | O272: ="1,7,"&RC[2]&",0;"&"1,4,"&RC[4]&",0;" -> 1,7,9189,0;1,4,154990,0; | Q272: =INT(((55+RC[-14]/10)*35+200)*12/4) -> 9189 | S272: =1000*110/100*(1+(55+RC[-16]/10)/200)*100 -> 154990
B273: 1,7,3589,0;1,4,1247,0; | C273: 269 | D273: 1 | E273: 7 | F273: 3589 | G273: 0 | I273: 1 | J273: 4 | K273: 1247 | L273: 0 | O273: ="1,7,"&RC[2]&",0;"&"1,4,"&RC[4]&",0;" -> 1,7,9199,0;1,4,155045,0; | Q273: =INT(((55+RC[-14]/10)*35+200)*12/4) -> 9199 | S273: =1000*110/100*(1+(55+RC[-16]/10)/200)*100 -> 155045
B274: 1,7,3600,0;1,4,1248,0; | C274: 270 | D274: 1 | E274: 7 | F274: 3600 | G274: 0 | I274: 1 | J274: 4 | K274: 1248 | L274: 0 | O274: ="1,7,"&RC[2]&",0;"&"1,4,"&RC[4]&",0;" -> 1,7,9210,0;1,4,155100,0; | Q274: =INT(((55+RC[-14]/10)*35+200)*12/4) -> 9210 | S274: =1000*110/100*(1+(55+RC[-16]/10)/200)*100 -> 155100
B275: 1,7,3610,0;1,4,1249,0; | C275: 271 | D275: 1 | E275: 7 | F275: 3610 | G275: 0 | I275: 1 | J275: 4 | K275: 1249 | L275: 0 | O275: ="1,7,"&RC[2]&",0;"&"1,4,"&RC[4]&",0;" -> 1,7,9220,0;1,4,155155,0; | Q275: =INT(((55+RC[-14]/10)*35+200)*12/4) -> 9220 | S275: =1000*110/100*(1+(55+RC[-16]/10)/200)*100 -> 155155
B276: 1,7,3621,0;1,4,1249,0; | C276: 272 | D276: 1 | E276: 7 | F276: 3621 | G276: 0 | I276: 1 | J276: 4 | K276: 1249 | L276: 0 | O276: ="1,7,"&RC[2]&",0;"&"1,4,"&RC[4]&",0;" -> 1,7,9231,0;1,4,155210,0; | Q276: =INT(((55+RC[-14]/10)*35+200)*12/4) -> 9231 | S276: =1000*110/100*(1+(55+RC[-16]/10)/200)*100 -> 155210
B277: 1,7,3631,0;1,4,1250,0; | C277: 273 | D277: 1 | E277: 7 | F277: 3631 | G277: 0 | I277: 1 | J277: 4 | K277: 1250 | L277: 0 | O277: ="1,7,"&RC[2]&",0;"&"1,4,"&RC[4]&",0;" -> 1,7,9241,0;1,4,155265,0; | Q277: =INT(((55+RC[-14]/10)*35+200)*12/4) -> 9241 | S277: =1000*110/100*(1+(55+RC[-16]/10)/200)*100 -> 155265
B278: 1,7,3642,0;1,4,1250,0; | C278: 274 | D278: 1 | E278: 7 | F278: 3642 | G278: 0 | I278: 1 | J278: 4 | K278: 1250 | L278: 0 | O278: ="1,7,"&RC[2]&",0;"&"1,4,"&RC[4]&",0;" -> 1,7,9252,0;1,4,155320,0; | Q278: =INT(((55+RC[-14]/10)*35+200)*12/4) -> 9252 | S278: =1000*110/100*(1+(55+RC[-16]/10)/200)*100 -> 155319.99999999997
B279: 1,7,3652,0;1,4,1251,0; | C279: 275 | D279: 1 | E279: 7 | F279: 3652 | G279: 0 | I279: 1 | J279: 4 | K279: 1251 | L279: 0 | O279: ="1,7,"&RC[2]&",0;"&"1,4,"&RC[4]&",0;" -> 1,7,9262,0;1,4,155375,0; | Q279: =INT(((55+RC[-14]/10)*35+200)*12/4) -> 9262 | S279: =1000*110/100*(1+(55+RC[-16]/10)/200)*100 -> 155375
B280: 1,7,3663,0;1,4,1251,0; | C280: 276 | D280: 1 | E280: 7 | F280: 3663 | G280: 0 | I280: 1 | J280: 4 | K280: 1251 | L280: 0 | O280: ="1,7,"&RC[2]&",0;"&"1,4,"&RC[4]&",0;" -> 1,7,9273,0;1,4,155430,0; | Q280: =INT(((55+RC[-14]/10)*35+200)*12/4) -> 9273 | S280: =1000*110/100*(1+(55+RC[-16]/10)/200)*100 -> 155430
B281: 1,7,3673,0;1,4,1252,0; | C281: 277 | D281: 1 | E281: 7 | F281: 3673 | G281: 0 | I281: 1 | J281: 4 | K281: 1252 | L281: 0 | O281: ="1,7,"&RC[2]&",0;"&"1,4,"&RC[4]&",0;" -> 1,7,9283,0;1,4,155485,0; | Q281: =INT(((55+RC[-14]/10)*35+200)*12/4) -> 9283 | S281: =1000*110/100*(1+(55+RC[-16]/10)/200)*100 -> 155485
B282: 1,7,3684,0;1,4,1252,0; | C282: 278 | D282: 1 | E282: 7 | F282: 3684 | G282: 0 | I282: 1 | J282: 4 | K282: 1252 | L282: 0 | O282: ="1,7,"&RC[2]&",0;"&"1,4,"&RC[4]&",0;" -> 1,7,9294,0;1,4,155540,0; | Q282: =INT(((55+RC[-14]/10)*35+200)*12/4) -> 9294 | S282: =1000*110/100*(1+(55+RC[-16]/10)/200)*100 -> 155540
B283: 1,7,3694,0;1,4,1253,0; | C283: 279 | D283: 1 | E283: 7 | F283: 3694 | G283: 0 | I283: 1 | J283: 4 | K283: 1253 | L283: 0 | O283: ="1,7,"&RC[2]&",0;"&"1,4,"&RC[4]&",0;" -> 1,7,9304,0;1,4,155595,0; | Q283: =INT(((55+RC[-14]/10)*35+200)*12/4) -> 9304 | S283: =1000*110/100*(1+(55+RC[-16]/10)/200)*100 -> 155595
B284: 1,7,3705,0;1,4,1254,0; | C284: 280 | D284: 1 | E284: 7 | F284: 3705 | G284: 0 | I284: 1 | J284: 4 | K284: 1254 | L284: 0 | O284: ="1,7,"&RC[2]&",0;"&"1,4,"&RC[4]&",0;" -> 1,7,9315,0;1,4,155650,0; | Q284: =INT(((55+RC[-14]/10)*35+200)*12/4) -> 9315 | S284: =1000*110/100*(1+(55+RC[-16]/10)/200)*100 -> 155650
B285: 1,7,3715,0;1,4,1254,0; | C285: 281 | D285: 1 | E285: 7 | F285: 3715 | G285: 0 | I285: 1 | J285: 4 | K285: 1254 | L285: 0 | O285: ="1,7,"&RC[2]&",0;"&"1,4,"&RC[4]&",0;" -> 1,7,9325,0;1,4,155705,0; | Q285: =INT(((55+RC[-14]/10)*35+200)*12/4) -> 9325 | S285: =1000*110/100*(1+(55+RC[-16]/10)/200)*100 -> 155705
B286: 1,7,3726,0;1,4,1255,0; | C286: 282 | D286: 1 | E286: 7 | F286: 3726 | G286: 0 | I286: 1 | J286: 4 | K286: 1255 | L286: 0 | O286: ="1,7,"&RC[2]&",0;"&"1,4,"&RC[4]&",0;" -> 1,7,9336,0;1,4,155760,0; | Q286: =INT(((55+RC[-14]/10)*35+200)*12/4) -> 9336 | S286: =1000*110/100*(1+(55+RC[-16]/10)/200)*100 -> 155760
B287: 1,7,3736,0;1,4,1255,0; | C287: 283 | D287: 1 | E287: 7 | F287: 3736 | G287: 0 | I287: 1 | J287: 4 | K287: 1255 | L287: 0 | O287: ="1,7,"&RC[2]&",0;"&"1,4,"&RC[4]&",0;" -> 1,7,9346,0;1,4,155815,0; | Q287: =INT(((55+RC[-14]/10)*35+200)*12/4) -> 9346 | S287: =1000*110/100*(1+(55+RC[-16]/10)/200)*100 -> 155815
B288: 1,7,3747,0;1,4,1256,0; | C288: 284 | D288: 1 | E288: 7 | F288: 3747 | G288: 0 | I288: 1 | J288: 4 | K288: 1256 | L288: 0 | O288: ="1,7,"&RC[2]&",0;"&"1,4,"&RC[4]&",0;" -> 1,7,9357,0;1,4,155870,0; | Q288: =INT(((55+RC[-14]/10)*35+200)*12/4) -> 9357 | S288: =1000*110/100*(1+(55+RC[-16]/10)/200)*100 -> 155870
B289: 1,7,3757,0;1,4,1256,0; | C289: 285 | D289: 1 | E289: 7 | F289: 3757 | G289: 0 | I289: 1 | J289: 4 | K289: 1256 | L289: 0 | O289: ="1,7,"&RC[2]&",0;"&"1,4,"&RC[4]&",0;" -> 1,7,9367,0;1,4,155925,0; | Q289: =INT(((55+RC[-14]/10)*35+200)*12/4) -> 9367 | S289: =1000*110/100*(1+(55+RC[-16]/10)/200)*100 -> 155925
B290: 1,7,3768,0;1,4,1257,0; | C290: 286 | D290: 1 | E290: 7 | F290: 3768 | G290: 0 | I290: 1 | J290: 4 | K290: 1257 | L290: 0 | O290: ="1,7,"&RC[2]&",0;"&"1,4,"&RC[4]&",0;" -> 1,7,9378,0;1,4,155980,0; | Q290: =INT(((55+RC[-14]/10)*35+200)*12/4) -> 9378 | S290: =1000*110/100*(1+(55+RC[-16]/10)/200)*100 -> 155980
B291: 1,7,3778,0;1,4,1257,0; | C291: 287 | D291: 1 | E291: 7 | F291: 3778 | G291: 0 | I291: 1 | J291: 4 | K291: 1257 | L291: 0 | O291: ="1,7,"&RC[2]&",0;"&"1,4,"&RC[4]&",0;" -> 1,7,9388,0;1,4,156035,0; | Q291: =INT(((55+RC[-14]/10)*35+200)*12/4) -> 9388 | S291: =1000*110/100*(1+(55+RC[-16]/10)/200)*100 -> 156035
B292: 1,7,3789,0;1,4,1258,0; | C292: 288 | D292: 1 | E292: 7 | F292: 3789 | G292: 0 | I292: 1 | J292: 4 | K292: 1258 | L292: 0 | O292: ="1,7,"&RC[2]&",0;"&"1,4,"&RC[4]&",0;" -> 1,7,9399,0;1,4,156090,0; | Q292: =INT(((55+RC[-14]/10)*35+200)*12/4) -> 9399 | S292: =1000*110/100*(1+(55+RC[-16]/10)/200)*100 -> 156090
B293: 1,7,3799,0;1,4,1258,0; | C293: 289 | D293: 1 | E293: 7 | F293: 3799 | G293: 0 | I293: 1 | J293: 4 | K293: 1258 | L293: 0 | O293: ="1,7,"&RC[2]&",0;"&"1,4,"&RC[4]&",0;" -> 1,7,9409,0;1,4,156145,0; | Q293: =INT(((55+RC[-14]/10)*35+200)*12/4) -> 9409 | S293: =1000*110/100*(1+(55+RC[-16]/10)/200)*100 -> 156145
B294: 1,7,3810,0;1,4,1259,0; | C294: 290 | D294: 1 | E294: 7 | F294: 3810 | G294: 0 | I294: 1 | J294: 4 | K294: 1259 | L294: 0 | O294: ="1,7,"&RC[2]&",0;"&"1,4,"&RC[4]&",0;" -> 1,7,9420,0;1,4,156200,0; | Q294: =INT(((55+RC[-14]/10)*35+200)*12/4) -> 9420 | S294: =1000*110/100*(1+(55+RC[-16]/10)/200)*100 -> 156200
B295: 1,7,3820,0;1,4,1260,0; | C295: 291 | D295: 1 | E295: 7 | F295: 3820 | G295: 0 | I295: 1 | J295: 4 | K295: 1260 | L295: 0 | O295: ="1,7,"&RC[2]&",0;"&"1,4,"&RC[4]&",0;" -> 1,7,9430,0;1,4,156255,0; | Q295: =INT(((55+RC[-14]/10)*35+200)*12/4) -> 9430 | S295: =1000*110/100*(1+(55+RC[-16]/10)/200)*100 -> 156255.00000000003
B296: 1,7,3831,0;1,4,1260,0; | C296: 292 | D296: 1 | E296: 7 | F296: 3831 | G296: 0 | I296: 1 | J296: 4 | K296: 1260 | L296: 0 | O296: ="1,7,"&RC[2]&",0;"&"1,4,"&RC[4]&",0;" -> 1,7,9441,0;1,4,156310,0; | Q296: =INT(((55+RC[-14]/10)*35+200)*12/4) -> 9441 | S296: =1000*110/100*(1+(55+RC[-16]/10)/200)*100 -> 156310
B297: 1,7,3841,0;1,4,1261,0; | C297: 293 | D297: 1 | E297: 7 | F297: 3841 | G297: 0 | I297: 1 | J297: 4 | K297: 1261 | L297: 0 | O297: ="1,7,"&RC[2]&",0;"&"1,4,"&RC[4]&",0;" -> 1,7,9451,0;1,4,156365,0; | Q297: =INT(((55+RC[-14]/10)*35+200)*12/4) -> 9451 | S297: =1000*110/100*(1+(55+RC[-16]/10)/200)*100 -> 156365
B298: 1,7,3852,0;1,4,1261,0; | C298: 294 | D298: 1 | E298: 7 | F298: 3852 | G298: 0 | I298: 1 | J298: 4 | K298: 1261 | L298: 0 | O298: ="1,7,"&RC[2]&",0;"&"1,4,"&RC[4]&",0;" -> 1,7,9462,0;1,4,156420,0; | Q298: =INT(((55+RC[-14]/10)*35+200)*12/4) -> 9462 | S298: =1000*110/100*(1+(55+RC[-16]/10)/200)*100 -> 156420.00000000003
B299: 1,7,3862,0;1,4,1262,0; | C299: 295 | D299: 1 | E299: 7 | F299: 3862 | G299: 0 | I299: 1 | J299: 4 | K299: 1262 | L299: 0 | O299: ="1,7,"&RC[2]&",0;"&"1,4,"&RC[4]&",0;" -> 1,7,9472,0;1,4,156475,0; | Q299: =INT(((55+RC[-14]/10)*35+200)*12/4) -> 9472 | S299: =1000*110/100*(1+(55+RC[-16]/10)/200)*100 -> 156474.99999999997
B300: 1,7,3873,0;1,4,1262,0; | C300: 296 | D300: 1 | E300: 7 | F300: 3873 | G300: 0 | I300: 1 | J300: 4 | K300: 1262 | L300: 0 | O300: ="1,7,"&RC[2]&",0;"&"1,4,"&RC[4]&",0;" -> 1,7,9483,0;1,4,156530,0; | Q300: =INT(((55+RC[-14]/10)*35+200)*12/4) -> 9483 | S300: =1000*110/100*(1+(55+RC[-16]/10)/200)*100 -> 156530
B301: 1,7,3883,0;1,4,1263,0; | C301: 297 | D301: 1 | E301: 7 | F301: 3883 | G301: 0 | I301: 1 | J301: 4 | K301: 1263 | L301: 0 | O301: ="1,7,"&RC[2]&",0;"&"1,4,"&RC[4]&",0;" -> 1,7,9493,0;1,4,156585,0; | Q301: =INT(((55+RC[-14]/10)*35+200)*12/4) -> 9493 | S301: =1000*110/100*(1+(55+RC[-16]/10)/200)*100 -> 156585
B302: 1,7,3894,0;1,4,1263,0; | C302: 298 | D302: 1 | E302: 7 | F302: 3894 | G302: 0 | I302: 1 | J302: 4 | K302: 1263 | L302: 0 | O302: ="1,7,"&RC[2]&",0;"&"1,4,"&RC[4]&",0;" -> 1,7,9504,0;1,4,156640,0; | Q302: =INT(((55+RC[-14]/10)*35+200)*12/4) -> 9504 | S302: =1000*110/100*(1+(55+RC[-16]/10)/200)*100 -> 156640
B303: 1,7,3904,0;1,4,1264,0; | C303: 299 | D303: 1 | E303: 7 | F303: 3904 | G303: 0 | I303: 1 | J303: 4 | K303: 1264 | L303: 0 | O303: ="1,7,"&RC[2]&",0;"&"1,4,"&RC[4]&",0;" -> 1,7,9514,0;1,4,156695,0; | Q303: =INT(((55+RC[-14]/10)*35+200)*12/4) -> 9514 | S303: =1000*110/100*(1+(55+RC[-16]/10)/200)*100 -> 156695
B304: 1,7,3915,0;1,4,1265,0; | C304: 300 | D304: 1 | E304: 7 | F304: 3915 | G304: 0 | I304: 1 | J304: 4 | K304: 1265 | L304: 0 | O304: ="1,7,"&RC[2]&",0;"&"1,4,"&RC[4]&",0;" -> 1,7,9525,0;1,4,156750,0; | Q304: =INT(((55+RC[-14]/10)*35+200)*12/4) -> 9525 | S304: =1000*110/100*(1+(55+RC[-16]/10)/200)*100 -> 156750
B305: 1,7,3925,0;1,4,1265,0; | C305: 301 | D305: 1 | E305: 7 | F305: 3925 | G305: 0 | I305: 1 | J305: 4 | K305: 1265 | L305: 0 | O305: ="1,7,"&RC[2]&",0;"&"1,4,"&RC[4]&",0;" -> 1,7,9535,0;1,4,156805,0; | Q305: =INT(((55+RC[-14]/10)*35+200)*12/4) -> 9535 | S305: =1000*110/100*(1+(55+RC[-16]/10)/200)*100 -> 156805
B306: 1,7,3936,0;1,4,1266,0; | C306: 302 | D306: 1 | E306: 7 | F306: 3936 | G306: 0 | I306: 1 | J306: 4 | K306: 1266 | L306: 0 | O306: ="1,7,"&RC[2]&",0;"&"1,4,"&RC[4]&",0;" -> 1,7,9546,0;1,4,156860,0; | Q306: =INT(((55+RC[-14]/10)*35+200)*12/4) -> 9546 | S306: =1000*110/100*(1+(55+RC[-16]/10)/200)*100 -> 156860
B307: 1,7,3946,0;1,4,1266,0; | C307: 303 | D307: 1 | E307: 7 | F307: 3946 | G307: 0 | I307: 1 | J307: 4 | K307: 1266 | L307: 0 | O307: ="1,7,"&RC[2]&",0;"&"1,4,"&RC[4]&",0;" -> 1,7,9556,0;1,4,156915,0; | Q307: =INT(((55+RC[-14]/10)*35+200)*12/4) -> 9556 | S307: =1000*110/100*(1+(55+RC[-16]/10)/200)*100 -> 156915
B308: 1,7,3957,0;1,4,1267,0; | C308: 304 | D308: 1 | E308: 7 | F308: 3957 | G308: 0 | I308: 1 | J308: 4 | K308: 1267 | L308: 0 | O308: ="1,7,"&RC[2]&",0;"&"1,4,"&RC[4]&",0;" -> 1,7,9567,0;1,4,156970,0; | Q308: =INT(((55+RC[-14]/10)*35+200)*12/4) -> 9567 | S308: =1000*110/100*(1+(55+RC[-16]/10)/200)*100 -> 156970
B309: 1,7,3967,0;1,4,1267,0; | C309: 305 | D309: 1 | E309: 7 | F309: 3967 | G309: 0 | I309: 1 | J309: 4 | K309: 1267 | L309: 0 | O309: ="1,7,"&RC[2]&",0;"&"1,4,"&RC[4]&",0;" -> 1,7,9577,0;1,4,157025,0; | Q309: =INT(((55+RC[-14]/10)*35+200)*12/4) -> 9577 | S309: =1000*110/100*(1+(55+RC[-16]/10)/200)*100 -> 157025
B310: 1,7,3978,0;1,4,1268,0; | C310: 306 | D310: 1 | E310: 7 | F310: 3978 | G310: 0 | I310: 1 | J310: 4 | K310: 1268 | L310: 0 | O310: ="1,7,"&RC[2]&",0;"&"1,4,"&RC[4]&",0;" -> 1,7,9588,0;1,4,157080,0; | Q310: =INT(((55+RC[-14]/10)*35+200)*12/4) -> 9588 | S310: =1000*110/100*(1+(55+RC[-16]/10)/200)*100 -> 157080
B311: 1,7,3988,0;1,4,1268,0; | C311: 307 | D311: 1 | E311: 7 | F311: 3988 | G311: 0 | I311: 1 | J311: 4 | K311: 1268 | L311: 0 | O311: ="1,7,"&RC[2]&",0;"&"1,4,"&RC[4]&",0;" -> 1,7,9598,0;1,4,157135,0; | Q311: =INT(((55+RC[-14]/10)*35+200)*12/4) -> 9598 | S311: =1000*110/100*(1+(55+RC[-16]/10)/200)*100 -> 157135
B312: 1,7,3999,0;1,4,1269,0; | C312: 308 | D312: 1 | E312: 7 | F312: 3999 | G312: 0 | I312: 1 | J312: 4 | K312: 1269 | L312: 0 | O312: ="1,7,"&RC[2]&",0;"&"1,4,"&RC[4]&",0;" -> 1,7,9609,0;1,4,157190,0; | Q312: =INT(((55+RC[-14]/10)*35+200)*12/4) -> 9609 | S312: =1000*110/100*(1+(55+RC[-16]/10)/200)*100 -> 157190
B313: 1,7,4009,0;1,4,1269,0; | C313: 309 | D313: 1 | E313: 7 | F313: 4009 | G313: 0 | I313: 1 | J313: 4 | K313: 1269 | L313: 0 | O313: ="1,7,"&RC[2]&",0;"&"1,4,"&RC[4]&",0;" -> 1,7,9619,0;1,4,157245,0; | Q313: =INT(((55+RC[-14]/10)*35+200)*12/4) -> 9619 | S313: =1000*110/100*(1+(55+RC[-16]/10)/200)*100 -> 157245
B314: 1,7,4020,0;1,4,1270,0; | C314: 310 | D314: 1 | E314: 7 | F314: 4020 | G314: 0 | I314: 1 | J314: 4 | K314: 1270 | L314: 0 | O314: ="1,7,"&RC[2]&",0;"&"1,4,"&RC[4]&",0;" -> 1,7,9630,0;1,4,157300,0; | Q314: =INT(((55+RC[-14]/10)*35+200)*12/4) -> 9630 | S314: =1000*110/100*(1+(55+RC[-16]/10)/200)*100 -> 157300
B315: 1,7,4030,0;1,4,1271,0; | C315: 311 | D315: 1 | E315: 7 | F315: 4030 | G315: 0 | I315: 1 | J315: 4 | K315: 1271 | L315: 0 | O315: ="1,7,"&RC[2]&",0;"&"1,4,"&RC[4]&",0;" -> 1,7,9640,0;1,4,157355,0; | Q315: =INT(((55+RC[-14]/10)*35+200)*12/4) -> 9640 | S315: =1000*110/100*(1+(55+RC[-16]/10)/200)*100 -> 157355
B316: 1,7,4041,0;1,4,1271,0; | C316: 312 | D316: 1 | E316: 7 | F316: 4041 | G316: 0 | I316: 1 | J316: 4 | K316: 1271 | L316: 0 | O316: ="1,7,"&RC[2]&",0;"&"1,4,"&RC[4]&",0;" -> 1,7,9651,0;1,4,157410,0; | Q316: =INT(((55+RC[-14]/10)*35+200)*12/4) -> 9651 | S316: =1000*110/100*(1+(55+RC[-16]/10)/200)*100 -> 157410
B317: 1,7,4051,0;1,4,1272,0; | C317: 313 | D317: 1 | E317: 7 | F317: 4051 | G317: 0 | I317: 1 | J317: 4 | K317: 1272 | L317: 0 | O317: ="1,7,"&RC[2]&",0;"&"1,4,"&RC[4]&",0;" -> 1,7,9661,0;1,4,157465,0; | Q317: =INT(((55+RC[-14]/10)*35+200)*12/4) -> 9661 | S317: =1000*110/100*(1+(55+RC[-16]/10)/200)*100 -> 157465
B318: 1,7,4062,0;1,4,1272,0; | C318: 314 | D318: 1 | E318: 7 | F318: 4062 | G318: 0 | I318: 1 | J318: 4 | K318: 1272 | L318: 0 | O318: ="1,7,"&RC[2]&",0;"&"1,4,"&RC[4]&",0;" -> 1,7,9672,0;1,4,157520,0; | Q318: =INT(((55+RC[-14]/10)*35+200)*12/4) -> 9672 | S318: =1000*110/100*(1+(55+RC[-16]/10)/200)*100 -> 157520
B319: 1,7,4072,0;1,4,1273,0; | C319: 315 | D319: 1 | E319: 7 | F319: 4072 | G319: 0 | I319: 1 | J319: 4 | K319: 1273 | L319: 0 | O319: ="1,7,"&RC[2]&",0;"&"1,4,"&RC[4]&",0;" -> 1,7,9682,0;1,4,157575,0; | Q319: =INT(((55+RC[-14]/10)*35+200)*12/4) -> 9682 | S319: =1000*110/100*(1+(55+RC[-16]/10)/200)*100 -> 157575.00000000003
B320: 1,7,4083,0;1,4,1273,0; | C320: 316 | D320: 1 | E320: 7 | F320: 4083 | G320: 0 | I320: 1 | J320: 4 | K320: 1273 | L320: 0 | O320: ="1,7,"&RC[2]&",0;"&"1,4,"&RC[4]&",0;" -> 1,7,9693,0;1,4,157630,0; | Q320: =INT(((55+RC[-14]/10)*35+200)*12/4) -> 9693 | S320: =1000*110/100*(1+(55+RC[-16]/10)/200)*100 -> 157630
B321: 1,7,4093,0;1,4,1274,0; | C321: 317 | D321: 1 | E321: 7 | F321: 4093 | G321: 0 | I321: 1 | J321: 4 | K321: 1274 | L321: 0 | O321: ="1,7,"&RC[2]&",0;"&"1,4,"&RC[4]&",0;" -> 1,7,9703,0;1,4,157685,0; | Q321: =INT(((55+RC[-14]/10)*35+200)*12/4) -> 9703 | S321: =1000*110/100*(1+(55+RC[-16]/10)/200)*100 -> 157685
B322: 1,7,4104,0;1,4,1274,0; | C322: 318 | D322: 1 | E322: 7 | F322: 4104 | G322: 0 | I322: 1 | J322: 4 | K322: 1274 | L322: 0 | O322: ="1,7,"&RC[2]&",0;"&"1,4,"&RC[4]&",0;" -> 1,7,9714,0;1,4,157740,0; | Q322: =INT(((55+RC[-14]/10)*35+200)*12/4) -> 9714 | S322: =1000*110/100*(1+(55+RC[-16]/10)/200)*100 -> 157740
B323: 1,7,4114,0;1,4,1275,0; | C323: 319 | D323: 1 | E323: 7 | F323: 4114 | G323: 0 | I323: 1 | J323: 4 | K323: 1275 | L323: 0 | O323: ="1,7,"&RC[2]&",0;"&"1,4,"&RC[4]&",0;" -> 1,7,9724,0;1,4,157795,0; | Q323: =INT(((55+RC[-14]/10)*35+200)*12/4) -> 9724 | S323: =1000*110/100*(1+(55+RC[-16]/10)/200)*100 -> 157795
B324: 1,7,4125,0;1,4,1276,0; | C324: 320 | D324: 1 | E324: 7 | F324: 4125 | G324: 0 | I324: 1 | J324: 4 | K324: 1276 | L324: 0 | O324: ="1,7,"&RC[2]&",0;"&"1,4,"&RC[4]&",0;" -> 1,7,9735,0;1,4,157850,0; | Q324: =INT(((55+RC[-14]/10)*35+200)*12/4) -> 9735 | S324: =1000*110/100*(1+(55+RC[-16]/10)/200)*100 -> 157850
B325: 1,7,4135,0;1,4,1276,0; | C325: 321 | D325: 1 | E325: 7 | F325: 4135 | G325: 0 | I325: 1 | J325: 4 | K325: 1276 | L325: 0 | O325: ="1,7,"&RC[2]&",0;"&"1,4,"&RC[4]&",0;" -> 1,7,9745,0;1,4,157905,0; | Q325: =INT(((55+RC[-14]/10)*35+200)*12/4) -> 9745 | S325: =1000*110/100*(1+(55+RC[-16]/10)/200)*100 -> 157905
B326: 1,7,4146,0;1,4,1277,0; | C326: 322 | D326: 1 | E326: 7 | F326: 4146 | G326: 0 | I326: 1 | J326: 4 | K326: 1277 | L326: 0 | O326: ="1,7,"&RC[2]&",0;"&"1,4,"&RC[4]&",0;" -> 1,7,9756,0;1,4,157960,0; | Q326: =INT(((55+RC[-14]/10)*35+200)*12/4) -> 9756 | S326: =1000*110/100*(1+(55+RC[-16]/10)/200)*100 -> 157960
B327: 1,7,4156,0;1,4,1277,0; | C327: 323 | D327: 1 | E327: 7 | F327: 4156 | G327: 0 | I327: 1 | J327: 4 | K327: 1277 | L327: 0 | O327: ="1,7,"&RC[2]&",0;"&"1,4,"&RC[4]&",0;" -> 1,7,9766,0;1,4,158015,0; | Q327: =INT(((55+RC[-14]/10)*35+200)*12/4) -> 9766 | S327: =1000*110/100*(1+(55+RC[-16]/10)/200)*100 -> 158015
B328: 1,7,4167,0;1,4,1278,0; | C328: 324 | D328: 1 | E328: 7 | F328: 4167 | G328: 0 | I328: 1 | J328: 4 | K328: 1278 | L328: 0 | O328: ="1,7,"&RC[2]&",0;"&"1,4,"&RC[4]&",0;" -> 1,7,9777,0;1,4,158070,0; | Q328: =INT(((55+RC[-14]/10)*35+200)*12/4) -> 9777 | S328: =1000*110/100*(1+(55+RC[-16]/10)/200)*100 -> 158070
B329: 1,7,4177,0;1,4,1278,0; | C329: 325 | D329: 1 | E329: 7 | F329: 4177 | G329: 0 | I329: 1 | J329: 4 | K329: 1278 | L329: 0 | O329: ="1,7,"&RC[2]&",0;"&"1,4,"&RC[4]&",0;" -> 1,7,9787,0;1,4,158125,0; | Q329: =INT(((55+RC[-14]/10)*35+200)*12/4) -> 9787 | S329: =1000*110/100*(1+(55+RC[-16]/10)/200)*100 -> 158125
B330: 1,7,4188,0;1,4,1279,0; | C330: 326 | D330: 1 | E330: 7 | F330: 4188 | G330: 0 | I330: 1 | J330: 4 | K330: 1279 | L330: 0 | O330: ="1,7,"&RC[2]&",0;"&"1,4,"&RC[4]&",0;" -> 1,7,9798,0;1,4,158180,0; | Q330: =INT(((55+RC[-14]/10)*35+200)*12/4) -> 9798 | S330: =1000*110/100*(1+(55+RC[-16]/10)/200)*100 -> 158180
B331: 1,7,4198,0;1,4,1279,0; | C331: 327 | D331: 1 | E331: 7 | F331: 4198 | G331: 0 | I331: 1 | J331: 4 | K331: 1279 | L331: 0 | O331: ="1,7,"&RC[2]&",0;"&"1,4,"&RC[4]&",0;" -> 1,7,9808,0;1,4,158235,0; | Q331: =INT(((55+RC[-14]/10)*35+200)*12/4) -> 9808 | S331: =1000*110/100*(1+(55+RC[-16]/10)/200)*100 -> 158235
B332: 1,7,4209,0;1,4,1280,0; | C332: 328 | D332: 1 | E332: 7 | F332: 4209 | G332: 0 | I332: 1 | J332: 4 | K332: 1280 | L332: 0 | O332: ="1,7,"&RC[2]&",0;"&"1,4,"&RC[4]&",0;" -> 1,7,9819,0;1,4,158290,0; | Q332: =INT(((55+RC[-14]/10)*35+200)*12/4) -> 9819 | S332: =1000*110/100*(1+(55+RC[-16]/10)/200)*100 -> 158290
B333: 1,7,4219,0;1,4,1280,0; | C333: 329 | D333: 1 | E333: 7 | F333: 4219 | G333: 0 | I333: 1 | J333: 4 | K333: 1280 | L333: 0 | O333: ="1,7,"&RC[2]&",0;"&"1,4,"&RC[4]&",0;" -> 1,7,9829,0;1,4,158345,0; | Q333: =INT(((55+RC[-14]/10)*35+200)*12/4) -> 9829 | S333: =1000*110/100*(1+(55+RC[-16]/10)/200)*100 -> 158345
B334: 1,7,4230,0;1,4,1281,0; | C334: 330 | D334: 1 | E334: 7 | F334: 4230 | G334: 0 | I334: 1 | J334: 4 | K334: 1281 | L334: 0 | O334: ="1,7,"&RC[2]&",0;"&"1,4,"&RC[4]&",0;" -> 1,7,9840,0;1,4,158400,0; | Q334: =INT(((55+RC[-14]/10)*35+200)*12/4) -> 9840 | S334: =1000*110/100*(1+(55+RC[-16]/10)/200)*100 -> 158400
B335: 1,7,4240,0;1,4,1282,0; | C335: 331 | D335: 1 | E335: 7 | F335: 4240 | G335: 0 | I335: 1 | J335: 4 | K335: 1282 | L335: 0 | O335: ="1,7,"&RC[2]&",0;"&"1,4,"&RC[4]&",0;" -> 1,7,9850,0;1,4,158455,0; | Q335: =INT(((55+RC[-14]/10)*35+200)*12/4) -> 9850 | S335: =1000*110/100*(1+(55+RC[-16]/10)/200)*100 -> 158455
B336: 1,7,4251,0;1,4,1282,0; | C336: 332 | D336: 1 | E336: 7 | F336: 4251 | G336: 0 | I336: 1 | J336: 4 | K336: 1282 | L336: 0 | O336: ="1,7,"&RC[2]&",0;"&"1,4,"&RC[4]&",0;" -> 1,7,9861,0;1,4,158510,0; | Q336: =INT(((55+RC[-14]/10)*35+200)*12/4) -> 9861 | S336: =1000*110/100*(1+(55+RC[-16]/10)/200)*100 -> 158510
B337: 1,7,4261,0;1,4,1283,0; | C337: 333 | D337: 1 | E337: 7 | F337: 4261 | G337: 0 | I337: 1 | J337: 4 | K337: 1283 | L337: 0 | O337: ="1,7,"&RC[2]&",0;"&"1,4,"&RC[4]&",0;" -> 1,7,9871,0;1,4,158565,0; | Q337: =INT(((55+RC[-14]/10)*35+200)*12/4) -> 9871 | S337: =1000*110/100*(1+(55+RC[-16]/10)/200)*100 -> 158565
B338: 1,7,4272,0;1,4,1283,0; | C338: 334 | D338: 1 | E338: 7 | F338: 4272 | G338: 0 | I338: 1 | J338: 4 | K338: 1283 | L338: 0 | O338: ="1,7,"&RC[2]&",0;"&"1,4,"&RC[4]&",0;" -> 1,7,9882,0;1,4,158620,0; | Q338: =INT(((55+RC[-14]/10)*35+200)*12/4) -> 9882 | S338: =1000*110/100*(1+(55+RC[-16]/10)/200)*100 -> 158620
B339: 1,7,4282,0;1,4,1284,0; | C339: 335 | D339: 1 | E339: 7 | F339: 4282 | G339: 0 | I339: 1 | J339: 4 | K339: 1284 | L339: 0 | O339: ="1,7,"&RC[2]&",0;"&"1,4,"&RC[4]&",0;" -> 1,7,9892,0;1,4,158675,0; | Q339: =INT(((55+RC[-14]/10)*35+200)*12/4) -> 9892 | S339: =1000*110/100*(1+(55+RC[-16]/10)/200)*100 -> 158674.99999999997
B340: 1,7,4293,0;1,4,1284,0; | C340: 336 | D340: 1 | E340: 7 | F340: 4293 | G340: 0 | I340: 1 | J340: 4 | K340: 1284 | L340: 0 | O340: ="1,7,"&RC[2]&",0;"&"1,4,"&RC[4]&",0;" -> 1,7,9903,0;1,4,158730,0; | Q340: =INT(((55+RC[-14]/10)*35+200)*12/4) -> 9903 | S340: =1000*110/100*(1+(55+RC[-16]/10)/200)*100 -> 158730
B341: 1,7,4303,0;1,4,1285,0; | C341: 337 | D341: 1 | E341: 7 | F341: 4303 | G341: 0 | I341: 1 | J341: 4 | K341: 1285 | L341: 0 | O341: ="1,7,"&RC[2]&",0;"&"1,4,"&RC[4]&",0;" -> 1,7,9913,0;1,4,158785,0; | Q341: =INT(((55+RC[-14]/10)*35+200)*12/4) -> 9913 | S341: =1000*110/100*(1+(55+RC[-16]/10)/200)*100 -> 158785
B342: 1,7,4314,0;1,4,1285,0; | C342: 338 | D342: 1 | E342: 7 | F342: 4314 | G342: 0 | I342: 1 | J342: 4 | K342: 1285 | L342: 0 | O342: ="1,7,"&RC[2]&",0;"&"1,4,"&RC[4]&",0;" -> 1,7,9924,0;1,4,158840,0; | Q342: =INT(((55+RC[-14]/10)*35+200)*12/4) -> 9924 | S342: =1000*110/100*(1+(55+RC[-16]/10)/200)*100 -> 158840
B343: 1,7,4324,0;1,4,1286,0; | C343: 339 | D343: 1 | E343: 7 | F343: 4324 | G343: 0 | I343: 1 | J343: 4 | K343: 1286 | L343: 0 | O343: ="1,7,"&RC[2]&",0;"&"1,4,"&RC[4]&",0;" -> 1,7,9934,0;1,4,158895,0; | Q343: =INT(((55+RC[-14]/10)*35+200)*12/4) -> 9934 | S343: =1000*110/100*(1+(55+RC[-16]/10)/200)*100 -> 158895
B344: 1,7,4335,0;1,4,1287,0; | C344: 340 | D344: 1 | E344: 7 | F344: 4335 | G344: 0 | I344: 1 | J344: 4 | K344: 1287 | L344: 0 | O344: ="1,7,"&RC[2]&",0;"&"1,4,"&RC[4]&",0;" -> 1,7,9945,0;1,4,158950,0; | Q344: =INT(((55+RC[-14]/10)*35+200)*12/4) -> 9945 | S344: =1000*110/100*(1+(55+RC[-16]/10)/200)*100 -> 158950
B345: 1,7,4345,0;1,4,1287,0; | C345: 341 | D345: 1 | E345: 7 | F345: 4345 | G345: 0 | I345: 1 | J345: 4 | K345: 1287 | L345: 0 | O345: ="1,7,"&RC[2]&",0;"&"1,4,"&RC[4]&",0;" -> 1,7,9955,0;1,4,159005,0; | Q345: =INT(((55+RC[-14]/10)*35+200)*12/4) -> 9955 | S345: =1000*110/100*(1+(55+RC[-16]/10)/200)*100 -> 159005
B346: 1,7,4356,0;1,4,1288,0; | C346: 342 | D346: 1 | E346: 7 | F346: 4356 | G346: 0 | I346: 1 | J346: 4 | K346: 1288 | L346: 0 | O346: ="1,7,"&RC[2]&",0;"&"1,4,"&RC[4]&",0;" -> 1,7,9966,0;1,4,159060,0; | Q346: =INT(((55+RC[-14]/10)*35+200)*12/4) -> 9966 | S346: =1000*110/100*(1+(55+RC[-16]/10)/200)*100 -> 159060
B347: 1,7,4366,0;1,4,1288,0; | C347: 343 | D347: 1 | E347: 7 | F347: 4366 | G347: 0 | I347: 1 | J347: 4 | K347: 1288 | L347: 0 | O347: ="1,7,"&RC[2]&",0;"&"1,4,"&RC[4]&",0;" -> 1,7,9976,0;1,4,159115,0; | Q347: =INT(((55+RC[-14]/10)*35+200)*12/4) -> 9976 | S347: =1000*110/100*(1+(55+RC[-16]/10)/200)*100 -> 159115
B348: 1,7,4377,0;1,4,1289,0; | C348: 344 | D348: 1 | E348: 7 | F348: 4377 | G348: 0 | I348: 1 | J348: 4 | K348: 1289 | L348: 0 | O348: ="1,7,"&RC[2]&",0;"&"1,4,"&RC[4]&",0;" -> 1,7,9987,0;1,4,159170,0; | Q348: =INT(((55+RC[-14]/10)*35+200)*12/4) -> 9987 | S348: =1000*110/100*(1+(55+RC[-16]/10)/200)*100 -> 159170
B349: 1,7,4387,0;1,4,1289,0; | C349: 345 | D349: 1 | E349: 7 | F349: 4387 | G349: 0 | I349: 1 | J349: 4 | K349: 1289 | L349: 0 | O349: ="1,7,"&RC[2]&",0;"&"1,4,"&RC[4]&",0;" -> 1,7,9997,0;1,4,159225,0; | Q349: =INT(((55+RC[-14]/10)*35+200)*12/4) -> 9997 | S349: =1000*110/100*(1+(55+RC[-16]/10)/200)*100 -> 159225
B350: 1,7,4398,0;1,4,1290,0; | C350: 346 | D350: 1 | E350: 7 | F350: 4398 | G350: 0 | I350: 1 | J350: 4 | K350: 1290 | L350: 0 | O350: ="1,7,"&RC[2]&",0;"&"1,4,"&RC[4]&",0;" -> 1,7,10008,0;1,4,159280,0; | Q350: =INT(((55+RC[-14]/10)*35+200)*12/4) -> 10008 | S350: =1000*110/100*(1+(55+RC[-16]/10)/200)*100 -> 159280
B351: 1,7,4408,0;1,4,1290,0; | C351: 347 | D351: 1 | E351: 7 | F351: 4408 | G351: 0 | I351: 1 | J351: 4 | K351: 1290 | L351: 0 | O351: ="1,7,"&RC[2]&",0;"&"1,4,"&RC[4]&",0;" -> 1,7,10018,0;1,4,159335,0; | Q351: =INT(((55+RC[-14]/10)*35+200)*12/4) -> 10018 | S351: =1000*110/100*(1+(55+RC[-16]/10)/200)*100 -> 159335
B352: 1,7,4419,0;1,4,1291,0; | C352: 348 | D352: 1 | E352: 7 | F352: 4419 | G352: 0 | I352: 1 | J352: 4 | K352: 1291 | L352: 0 | O352: ="1,7,"&RC[2]&",0;"&"1,4,"&RC[4]&",0;" -> 1,7,10029,0;1,4,159390,0; | Q352: =INT(((55+RC[-14]/10)*35+200)*12/4) -> 10029 | S352: =1000*110/100*(1+(55+RC[-16]/10)/200)*100 -> 159390
B353: 1,7,4429,0;1,4,1291,0; | C353: 349 | D353: 1 | E353: 7 | F353: 4429 | G353: 0 | I353: 1 | J353: 4 | K353: 1291 | L353: 0 | O353: ="1,7,"&RC[2]&",0;"&"1,4,"&RC[4]&",0;" -> 1,7,10039,0;1,4,159445,0; | Q353: =INT(((55+RC[-14]/10)*35+200)*12/4) -> 10039 | S353: =1000*110/100*(1+(55+RC[-16]/10)/200)*100 -> 159445
B354: 1,7,4440,0;1,4,1292,0; | C354: 350 | D354: 1 | E354: 7 | F354: 4440 | G354: 0 | I354: 1 | J354: 4 | K354: 1292 | L354: 0 | O354: ="1,7,"&RC[2]&",0;"&"1,4,"&RC[4]&",0;" -> 1,7,10050,0;1,4,159500,0; | Q354: =INT(((55+RC[-14]/10)*35+200)*12/4) -> 10050 | S354: =1000*110/100*(1+(55+RC[-16]/10)/200)*100 -> 159500
B355: 1,7,4450,0;1,4,1293,0; | C355: 351 | D355: 1 | E355: 7 | F355: 4450 | G355: 0 | I355: 1 | J355: 4 | K355: 1293 | L355: 0 | O355: ="1,7,"&RC[2]&",0;"&"1,4,"&RC[4]&",0;" -> 1,7,10060,0;1,4,159555,0; | Q355: =INT(((55+RC[-14]/10)*35+200)*12/4) -> 10060 | S355: =1000*110/100*(1+(55+RC[-16]/10)/200)*100 -> 159555
B356: 1,7,4461,0;1,4,1293,0; | C356: 352 | D356: 1 | E356: 7 | F356: 4461 | G356: 0 | I356: 1 | J356: 4 | K356: 1293 | L356: 0 | O356: ="1,7,"&RC[2]&",0;"&"1,4,"&RC[4]&",0;" -> 1,7,10071,0;1,4,159610,0; | Q356: =INT(((55+RC[-14]/10)*35+200)*12/4) -> 10071 | S356: =1000*110/100*(1+(55+RC[-16]/10)/200)*100 -> 159610
B357: 1,7,4471,0;1,4,1294,0; | C357: 353 | D357: 1 | E357: 7 | F357: 4471 | G357: 0 | I357: 1 | J357: 4 | K357: 1294 | L357: 0 | O357: ="1,7,"&RC[2]&",0;"&"1,4,"&RC[4]&",0;" -> 1,7,10081,0;1,4,159665,0; | Q357: =INT(((55+RC[-14]/10)*35+200)*12/4) -> 10081 | S357: =1000*110/100*(1+(55+RC[-16]/10)/200)*100 -> 159665
B358: 1,7,4482,0;1,4,1294,0; | C358: 354 | D358: 1 | E358: 7 | F358: 4482 | G358: 0 | I358: 1 | J358: 4 | K358: 1294 | L358: 0 | O358: ="1,7,"&RC[2]&",0;"&"1,4,"&RC[4]&",0;" -> 1,7,10092,0;1,4,159720,0; | Q358: =INT(((55+RC[-14]/10)*35+200)*12/4) -> 10092 | S358: =1000*110/100*(1+(55+RC[-16]/10)/200)*100 -> 159720
B359: 1,7,4492,0;1,4,1295,0; | C359: 355 | D359: 1 | E359: 7 | F359: 4492 | G359: 0 | I359: 1 | J359: 4 | K359: 1295 | L359: 0 | O359: ="1,7,"&RC[2]&",0;"&"1,4,"&RC[4]&",0;" -> 1,7,10102,0;1,4,159775,0; | Q359: =INT(((55+RC[-14]/10)*35+200)*12/4) -> 10102 | S359: =1000*110/100*(1+(55+RC[-16]/10)/200)*100 -> 159775.00000000003
B360: 1,7,4503,0;1,4,1295,0; | C360: 356 | D360: 1 | E360: 7 | F360: 4503 | G360: 0 | I360: 1 | J360: 4 | K360: 1295 | L360: 0 | O360: ="1,7,"&RC[2]&",0;"&"1,4,"&RC[4]&",0;" -> 1,7,10113,0;1,4,159830,0; | Q360: =INT(((55+RC[-14]/10)*35+200)*12/4) -> 10113 | S360: =1000*110/100*(1+(55+RC[-16]/10)/200)*100 -> 159829.99999999997
B361: 1,7,4513,0;1,4,1296,0; | C361: 357 | D361: 1 | E361: 7 | F361: 4513 | G361: 0 | I361: 1 | J361: 4 | K361: 1296 | L361: 0 | O361: ="1,7,"&RC[2]&",0;"&"1,4,"&RC[4]&",0;" -> 1,7,10123,0;1,4,159885,0; | Q361: =INT(((55+RC[-14]/10)*35+200)*12/4) -> 10123 | S361: =1000*110/100*(1+(55+RC[-16]/10)/200)*100 -> 159885
B362: 1,7,4524,0;1,4,1296,0; | C362: 358 | D362: 1 | E362: 7 | F362: 4524 | G362: 0 | I362: 1 | J362: 4 | K362: 1296 | L362: 0 | O362: ="1,7,"&RC[2]&",0;"&"1,4,"&RC[4]&",0;" -> 1,7,10134,0;1,4,159940,0; | Q362: =INT(((55+RC[-14]/10)*35+200)*12/4) -> 10134 | S362: =1000*110/100*(1+(55+RC[-16]/10)/200)*100 -> 159940
B363: 1,7,4534,0;1,4,1297,0; | C363: 359 | D363: 1 | E363: 7 | F363: 4534 | G363: 0 | I363: 1 | J363: 4 | K363: 1297 | L363: 0 | O363: ="1,7,"&RC[2]&",0;"&"1,4,"&RC[4]&",0;" -> 1,7,10144,0;1,4,159995,0; | Q363: =INT(((55+RC[-14]/10)*35+200)*12/4) -> 10144 | S363: =1000*110/100*(1+(55+RC[-16]/10)/200)*100 -> 159994.99999999997
B364: 1,7,4545,0;1,4,1298,0; | C364: 360 | D364: 1 | E364: 7 | F364: 4545 | G364: 0 | I364: 1 | J364: 4 | K364: 1298 | L364: 0 | O364: ="1,7,"&RC[2]&",0;"&"1,4,"&RC[4]&",0;" -> 1,7,10155,0;1,4,160050,0; | Q364: =INT(((55+RC[-14]/10)*35+200)*12/4) -> 10155 | S364: =1000*110/100*(1+(55+RC[-16]/10)/200)*100 -> 160050
B365: 1,7,4555,0;1,4,1298,0; | C365: 361 | D365: 1 | E365: 7 | F365: 4555 | G365: 0 | I365: 1 | J365: 4 | K365: 1298 | L365: 0 | O365: ="1,7,"&RC[2]&",0;"&"1,4,"&RC[4]&",0;" -> 1,7,10165,0;1,4,160105,0; | Q365: =INT(((55+RC[-14]/10)*35+200)*12/4) -> 10165 | S365: =1000*110/100*(1+(55+RC[-16]/10)/200)*100 -> 160105
B366: 1,7,4566,0;1,4,1299,0; | C366: 362 | D366: 1 | E366: 7 | F366: 4566 | G366: 0 | I366: 1 | J366: 4 | K366: 1299 | L366: 0 | O366: ="1,7,"&RC[2]&",0;"&"1,4,"&RC[4]&",0;" -> 1,7,10176,0;1,4,160160,0; | Q366: =INT(((55+RC[-14]/10)*35+200)*12/4) -> 10176 | S366: =1000*110/100*(1+(55+RC[-16]/10)/200)*100 -> 160160
B367: 1,7,4576,0;1,4,1299,0; | C367: 363 | D367: 1 | E367: 7 | F367: 4576 | G367: 0 | I367: 1 | J367: 4 | K367: 1299 | L367: 0 | O367: ="1,7,"&RC[2]&",0;"&"1,4,"&RC[4]&",0;" -> 1,7,10186,0;1,4,160215,0; | Q367: =INT(((55+RC[-14]/10)*35+200)*12/4) -> 10186 | S367: =1000*110/100*(1+(55+RC[-16]/10)/200)*100 -> 160215
B368: 1,7,4587,0;1,4,1300,0; | C368: 364 | D368: 1 | E368: 7 | F368: 4587 | G368: 0 | I368: 1 | J368: 4 | K368: 1300 | L368: 0 | O368: ="1,7,"&RC[2]&",0;"&"1,4,"&RC[4]&",0;" -> 1,7,10197,0;1,4,160270,0; | Q368: =INT(((55+RC[-14]/10)*35+200)*12/4) -> 10197 | S368: =1000*110/100*(1+(55+RC[-16]/10)/200)*100 -> 160270
B369: 1,7,4597,0;1,4,1300,0; | C369: 365 | D369: 1 | E369: 7 | F369: 4597 | G369: 0 | I369: 1 | J369: 4 | K369: 1300 | L369: 0 | O369: ="1,7,"&RC[2]&",0;"&"1,4,"&RC[4]&",0;" -> 1,7,10207,0;1,4,160325,0; | Q369: =INT(((55+RC[-14]/10)*35+200)*12/4) -> 10207 | S369: =1000*110/100*(1+(55+RC[-16]/10)/200)*100 -> 160325
B370: 1,7,4608,0;1,4,1301,0; | C370: 366 | D370: 1 | E370: 7 | F370: 4608 | G370: 0 | I370: 1 | J370: 4 | K370: 1301 | L370: 0 | O370: ="1,7,"&RC[2]&",0;"&"1,4,"&RC[4]&",0;" -> 1,7,10218,0;1,4,160380,0; | Q370: =INT(((55+RC[-14]/10)*35+200)*12/4) -> 10218 | S370: =1000*110/100*(1+(55+RC[-16]/10)/200)*100 -> 160380
B371: 1,7,4618,0;1,4,1301,0; | C371: 367 | D371: 1 | E371: 7 | F371: 4618 | G371: 0 | I371: 1 | J371: 4 | K371: 1301 | L371: 0 | O371: ="1,7,"&RC[2]&",0;"&"1,4,"&RC[4]&",0;" -> 1,7,10228,0;1,4,160435,0; | Q371: =INT(((55+RC[-14]/10)*35+200)*12/4) -> 10228 | S371: =1000*110/100*(1+(55+RC[-16]/10)/200)*100 -> 160435
B372: 1,7,4629,0;1,4,1302,0; | C372: 368 | D372: 1 | E372: 7 | F372: 4629 | G372: 0 | I372: 1 | J372: 4 | K372: 1302 | L372: 0 | O372: ="1,7,"&RC[2]&",0;"&"1,4,"&RC[4]&",0;" -> 1,7,10239,0;1,4,160490,0; | Q372: =INT(((55+RC[-14]/10)*35+200)*12/4) -> 10239 | S372: =1000*110/100*(1+(55+RC[-16]/10)/200)*100 -> 160490
B373: 1,7,4639,0;1,4,1302,0; | C373: 369 | D373: 1 | E373: 7 | F373: 4639 | G373: 0 | I373: 1 | J373: 4 | K373: 1302 | L373: 0 | O373: ="1,7,"&RC[2]&",0;"&"1,4,"&RC[4]&",0;" -> 1,7,10249,0;1,4,160545,0; | Q373: =INT(((55+RC[-14]/10)*35+200)*12/4) -> 10249 | S373: =1000*110/100*(1+(55+RC[-16]/10)/200)*100 -> 160545
B374: 1,7,4650,0;1,4,1303,0; | C374: 370 | D374: 1 | E374: 7 | F374: 4650 | G374: 0 | I374: 1 | J374: 4 | K374: 1303 | L374: 0 | O374: ="1,7,"&RC[2]&",0;"&"1,4,"&RC[4]&",0;" -> 1,7,10260,0;1,4,160600,0; | Q374: =INT(((55+RC[-14]/10)*35+200)*12/4) -> 10260 | S374: =1000*110/100*(1+(55+RC[-16]/10)/200)*100 -> 160600
B375: 1,7,4660,0;1,4,1304,0; | C375: 371 | D375: 1 | E375: 7 | F375: 4660 | G375: 0 | I375: 1 | J375: 4 | K375: 1304 | L375: 0 | O375: ="1,7,"&RC[2]&",0;"&"1,4,"&RC[4]&",0;" -> 1,7,10270,0;1,4,160655,0; | Q375: =INT(((55+RC[-14]/10)*35+200)*12/4) -> 10270 | S375: =1000*110/100*(1+(55+RC[-16]/10)/200)*100 -> 160655
B376: 1,7,4671,0;1,4,1304,0; | C376: 372 | D376: 1 | E376: 7 | F376: 4671 | G376: 0 | I376: 1 | J376: 4 | K376: 1304 | L376: 0 | O376: ="1,7,"&RC[2]&",0;"&"1,4,"&RC[4]&",0;" -> 1,7,10281,0;1,4,160710,0; | Q376: =INT(((55+RC[-14]/10)*35+200)*12/4) -> 10281 | S376: =1000*110/100*(1+(55+RC[-16]/10)/200)*100 -> 160710
B377: 1,7,4681,0;1,4,1305,0; | C377: 373 | D377: 1 | E377: 7 | F377: 4681 | G377: 0 | I377: 1 | J377: 4 | K377: 1305 | L377: 0 | O377: ="1,7,"&RC[2]&",0;"&"1,4,"&RC[4]&",0;" -> 1,7,10291,0;1,4,160765,0; | Q377: =INT(((55+RC[-14]/10)*35+200)*12/4) -> 10291 | S377: =1000*110/100*(1+(55+RC[-16]/10)/200)*100 -> 160765
B378: 1,7,4692,0;1,4,1305,0; | C378: 374 | D378: 1 | E378: 7 | F378: 4692 | G378: 0 | I378: 1 | J378: 4 | K378: 1305 | L378: 0 | O378: ="1,7,"&RC[2]&",0;"&"1,4,"&RC[4]&",0;" -> 1,7,10302,0;1,4,160820,0; | Q378: =INT(((55+RC[-14]/10)*35+200)*12/4) -> 10302 | S378: =1000*110/100*(1+(55+RC[-16]/10)/200)*100 -> 160820
B379: 1,7,4702,0;1,4,1306,0; | C379: 375 | D379: 1 | E379: 7 | F379: 4702 | G379: 0 | I379: 1 | J379: 4 | K379: 1306 | L379: 0 | O379: ="1,7,"&RC[2]&",0;"&"1,4,"&RC[4]&",0;" -> 1,7,10312,0;1,4,160875,0; | Q379: =INT(((55+RC[-14]/10)*35+200)*12/4) -> 10312 | S379: =1000*110/100*(1+(55+RC[-16]/10)/200)*100 -> 160875
B380: 1,7,4713,0;1,4,1306,0; | C380: 376 | D380: 1 | E380: 7 | F380: 4713 | G380: 0 | I380: 1 | J380: 4 | K380: 1306 | L380: 0 | O380: ="1,7,"&RC[2]&",0;"&"1,4,"&RC[4]&",0;" -> 1,7,10323,0;1,4,160930,0; | Q380: =INT(((55+RC[-14]/10)*35+200)*12/4) -> 10323 | S380: =1000*110/100*(1+(55+RC[-16]/10)/200)*100 -> 160930.00000000003
B381: 1,7,4723,0;1,4,1307,0; | C381: 377 | D381: 1 | E381: 7 | F381: 4723 | G381: 0 | I381: 1 | J381: 4 | K381: 1307 | L381: 0 | O381: ="1,7,"&RC[2]&",0;"&"1,4,"&RC[4]&",0;" -> 1,7,10333,0;1,4,160985,0; | Q381: =INT(((55+RC[-14]/10)*35+200)*12/4) -> 10333 | S381: =1000*110/100*(1+(55+RC[-16]/10)/200)*100 -> 160985
B382: 1,7,4734,0;1,4,1307,0; | C382: 378 | D382: 1 | E382: 7 | F382: 4734 | G382: 0 | I382: 1 | J382: 4 | K382: 1307 | L382: 0 | O382: ="1,7,"&RC[2]&",0;"&"1,4,"&RC[4]&",0;" -> 1,7,10344,0;1,4,161040,0; | Q382: =INT(((55+RC[-14]/10)*35+200)*12/4) -> 10344 | S382: =1000*110/100*(1+(55+RC[-16]/10)/200)*100 -> 161040
B383: 1,7,4744,0;1,4,1308,0; | C383: 379 | D383: 1 | E383: 7 | F383: 4744 | G383: 0 | I383: 1 | J383: 4 | K383: 1308 | L383: 0 | O383: ="1,7,"&RC[2]&",0;"&"1,4,"&RC[4]&",0;" -> 1,7,10354,0;1,4,161095,0; | Q383: =INT(((55+RC[-14]/10)*35+200)*12/4) -> 10354 | S383: =1000*110/100*(1+(55+RC[-16]/10)/200)*100 -> 161095
B384: 1,7,4755,0;1,4,1309,0; | C384: 380 | D384: 1 | E384: 7 | F384: 4755 | G384: 0 | I384: 1 | J384: 4 | K384: 1309 | L384: 0 | O384: ="1,7,"&RC[2]&",0;"&"1,4,"&RC[4]&",0;" -> 1,7,10365,0;1,4,161150,0; | Q384: =INT(((55+RC[-14]/10)*35+200)*12/4) -> 10365 | S384: =1000*110/100*(1+(55+RC[-16]/10)/200)*100 -> 161150
B385: 1,7,4765,0;1,4,1309,0; | C385: 381 | D385: 1 | E385: 7 | F385: 4765 | G385: 0 | I385: 1 | J385: 4 | K385: 1309 | L385: 0 | O385: ="1,7,"&RC[2]&",0;"&"1,4,"&RC[4]&",0;" -> 1,7,10375,0;1,4,161205,0; | Q385: =INT(((55+RC[-14]/10)*35+200)*12/4) -> 10375 | S385: =1000*110/100*(1+(55+RC[-16]/10)/200)*100 -> 161205
B386: 1,7,4776,0;1,4,1310,0; | C386: 382 | D386: 1 | E386: 7 | F386: 4776 | G386: 0 | I386: 1 | J386: 4 | K386: 1310 | L386: 0 | O386: ="1,7,"&RC[2]&",0;"&"1,4,"&RC[4]&",0;" -> 1,7,10386,0;1,4,161260,0; | Q386: =INT(((55+RC[-14]/10)*35+200)*12/4) -> 10386 | S386: =1000*110/100*(1+(55+RC[-16]/10)/200)*100 -> 161260
B387: 1,7,4786,0;1,4,1310,0; | C387: 383 | D387: 1 | E387: 7 | F387: 4786 | G387: 0 | I387: 1 | J387: 4 | K387: 1310 | L387: 0 | O387: ="1,7,"&RC[2]&",0;"&"1,4,"&RC[4]&",0;" -> 1,7,10396,0;1,4,161315,0; | Q387: =INT(((55+RC[-14]/10)*35+200)*12/4) -> 10396 | S387: =1000*110/100*(1+(55+RC[-16]/10)/200)*100 -> 161315
B388: 1,7,4797,0;1,4,1311,0; | C388: 384 | D388: 1 | E388: 7 | F388: 4797 | G388: 0 | I388: 1 | J388: 4 | K388: 1311 | L388: 0 | O388: ="1,7,"&RC[2]&",0;"&"1,4,"&RC[4]&",0;" -> 1,7,10407,0;1,4,161370,0; | Q388: =INT(((55+RC[-14]/10)*35+200)*12/4) -> 10407 | S388: =1000*110/100*(1+(55+RC[-16]/10)/200)*100 -> 161370
B389: 1,7,4807,0;1,4,1311,0; | C389: 385 | D389: 1 | E389: 7 | F389: 4807 | G389: 0 | I389: 1 | J389: 4 | K389: 1311 | L389: 0 | O389: ="1,7,"&RC[2]&",0;"&"1,4,"&RC[4]&",0;" -> 1,7,10417,0;1,4,161425,0; | Q389: =INT(((55+RC[-14]/10)*35+200)*12/4) -> 10417 | S389: =1000*110/100*(1+(55+RC[-16]/10)/200)*100 -> 161425
B390: 1,7,4818,0;1,4,1312,0; | C390: 386 | D390: 1 | E390: 7 | F390: 4818 | G390: 0 | I390: 1 | J390: 4 | K390: 1312 | L390: 0 | O390: ="1,7,"&RC[2]&",0;"&"1,4,"&RC[4]&",0;" -> 1,7,10428,0;1,4,161480,0; | Q390: =INT(((55+RC[-14]/10)*35+200)*12/4) -> 10428 | S390: =1000*110/100*(1+(55+RC[-16]/10)/200)*100 -> 161480
B391: 1,7,4828,0;1,4,1312,0; | C391: 387 | D391: 1 | E391: 7 | F391: 4828 | G391: 0 | I391: 1 | J391: 4 | K391: 1312 | L391: 0 | O391: ="1,7,"&RC[2]&",0;"&"1,4,"&RC[4]&",0;" -> 1,7,10438,0;1,4,161535,0; | Q391: =INT(((55+RC[-14]/10)*35+200)*12/4) -> 10438 | S391: =1000*110/100*(1+(55+RC[-16]/10)/200)*100 -> 161535
B392: 1,7,4839,0;1,4,1313,0; | C392: 388 | D392: 1 | E392: 7 | F392: 4839 | G392: 0 | I392: 1 | J392: 4 | K392: 1313 | L392: 0 | O392: ="1,7,"&RC[2]&",0;"&"1,4,"&RC[4]&",0;" -> 1,7,10449,0;1,4,161590,0; | Q392: =INT(((55+RC[-14]/10)*35+200)*12/4) -> 10449 | S392: =1000*110/100*(1+(55+RC[-16]/10)/200)*100 -> 161590
B393: 1,7,4849,0;1,4,1313,0; | C393: 389 | D393: 1 | E393: 7 | F393: 4849 | G393: 0 | I393: 1 | J393: 4 | K393: 1313 | L393: 0 | O393: ="1,7,"&RC[2]&",0;"&"1,4,"&RC[4]&",0;" -> 1,7,10459,0;1,4,161645,0; | Q393: =INT(((55+RC[-14]/10)*35+200)*12/4) -> 10459 | S393: =1000*110/100*(1+(55+RC[-16]/10)/200)*100 -> 161645
B394: 1,7,4860,0;1,4,1314,0; | C394: 390 | D394: 1 | E394: 7 | F394: 4860 | G394: 0 | I394: 1 | J394: 4 | K394: 1314 | L394: 0 | O394: ="1,7,"&RC[2]&",0;"&"1,4,"&RC[4]&",0;" -> 1,7,10470,0;1,4,161700,0; | Q394: =INT(((55+RC[-14]/10)*35+200)*12/4) -> 10470 | S394: =1000*110/100*(1+(55+RC[-16]/10)/200)*100 -> 161700
B395: 1,7,4870,0;1,4,1315,0; | C395: 391 | D395: 1 | E395: 7 | F395: 4870 | G395: 0 | I395: 1 | J395: 4 | K395: 1315 | L395: 0 | O395: ="1,7,"&RC[2]&",0;"&"1,4,"&RC[4]&",0;" -> 1,7,10480,0;1,4,161755,0; | Q395: =INT(((55+RC[-14]/10)*35+200)*12/4) -> 10480 | S395: =1000*110/100*(1+(55+RC[-16]/10)/200)*100 -> 161755
B396: 1,7,4881,0;1,4,1315,0; | C396: 392 | D396: 1 | E396: 7 | F396: 4881 | G396: 0 | I396: 1 | J396: 4 | K396: 1315 | L396: 0 | O396: ="1,7,"&RC[2]&",0;"&"1,4,"&RC[4]&",0;" -> 1,7,10491,0;1,4,161810,0; | Q396: =INT(((55+RC[-14]/10)*35+200)*12/4) -> 10491 | S396: =1000*110/100*(1+(55+RC[-16]/10)/200)*100 -> 161810
B397: 1,7,4891,0;1,4,1316,0; | C397: 393 | D397: 1 | E397: 7 | F397: 4891 | G397: 0 | I397: 1 | J397: 4 | K397: 1316 | L397: 0 | O397: ="1,7,"&RC[2]&",0;"&"1,4,"&RC[4]&",0;" -> 1,7,10501,0;1,4,161865,0; | Q397: =INT(((55+RC[-14]/10)*35+200)*12/4) -> 10501 | S397: =1000*110/100*(1+(55+RC[-16]/10)/200)*100 -> 161865
B398: 1,7,4902,0;1,4,1316,0; | C398: 394 | D398: 1 | E398: 7 | F398: 4902 | G398: 0 | I398: 1 | J398: 4 | K398: 1316 | L398: 0 | O398: ="1,7,"&RC[2]&",0;"&"1,4,"&RC[4]&",0;" -> 1,7,10512,0;1,4,161920,0; | Q398: =INT(((55+RC[-14]/10)*35+200)*12/4) -> 10512 | S398: =1000*110/100*(1+(55+RC[-16]/10)/200)*100 -> 161920
B399: 1,7,4912,0;1,4,1317,0; | C399: 395 | D399: 1 | E399: 7 | F399: 4912 | G399: 0 | I399: 1 | J399: 4 | K399: 1317 | L399: 0 | O399: ="1,7,"&RC[2]&",0;"&"1,4,"&RC[4]&",0;" -> 1,7,10522,0;1,4,161975,0; | Q399: =INT(((55+RC[-14]/10)*35+200)*12/4) -> 10522 | S399: =1000*110/100*(1+(55+RC[-16]/10)/200)*100 -> 161975
B400: 1,7,4923,0;1,4,1317,0; | C400: 396 | D400: 1 | E400: 7 | F400: 4923 | G400: 0 | I400: 1 | J400: 4 | K400: 1317 | L400: 0 | O400: ="1,7,"&RC[2]&",0;"&"1,4,"&RC[4]&",0;" -> 1,7,10533,0;1,4,162030,0; | Q400: =INT(((55+RC[-14]/10)*35+200)*12/4) -> 10533 | S400: =1000*110/100*(1+(55+RC[-16]/10)/200)*100 -> 162030
B401: 1,7,4933,0;1,4,1318,0; | C401: 397 | D401: 1 | E401: 7 | F401: 4933 | G401: 0 | I401: 1 | J401: 4 | K401: 1318 | L401: 0 | O401: ="1,7,"&RC[2]&",0;"&"1,4,"&RC[4]&",0;" -> 1,7,10543,0;1,4,162085,0; | Q401: =INT(((55+RC[-14]/10)*35+200)*12/4) -> 10543 | S401: =1000*110/100*(1+(55+RC[-16]/10)/200)*100 -> 162085
B402: 1,7,4944,0;1,4,1318,0; | C402: 398 | D402: 1 | E402: 7 | F402: 4944 | G402: 0 | I402: 1 | J402: 4 | K402: 1318 | L402: 0 | O402: ="1,7,"&RC[2]&",0;"&"1,4,"&RC[4]&",0;" -> 1,7,10554,0;1,4,162140,0; | Q402: =INT(((55+RC[-14]/10)*35+200)*12/4) -> 10554 | S402: =1000*110/100*(1+(55+RC[-16]/10)/200)*100 -> 162140
B403: 1,7,4954,0;1,4,1319,0; | C403: 399 | D403: 1 | E403: 7 | F403: 4954 | G403: 0 | I403: 1 | J403: 4 | K403: 1319 | L403: 0 | O403: ="1,7,"&RC[2]&",0;"&"1,4,"&RC[4]&",0;" -> 1,7,10564,0;1,4,162195,0; | Q403: =INT(((55+RC[-14]/10)*35+200)*12/4) -> 10564 | S403: =1000*110/100*(1+(55+RC[-16]/10)/200)*100 -> 162194.99999999997
B404: 1,7,4965,0;1,4,1320,0; | C404: 400 | D404: 1 | E404: 7 | F404: 4965 | G404: 0 | I404: 1 | J404: 4 | K404: 1320 | L404: 0 | O404: ="1,7,"&RC[2]&",0;"&"1,4,"&RC[4]&",0;" -> 1,7,10575,0;1,4,162250,0; | Q404: =INT(((55+RC[-14]/10)*35+200)*12/4) -> 10575 | S404: =1000*110/100*(1+(55+RC[-16]/10)/200)*100 -> 162250
B405: 1,7,4975,0;1,4,1320,0; | C405: 401 | D405: 1 | E405: 7 | F405: 4975 | G405: 0 | I405: 1 | J405: 4 | K405: 1320 | L405: 0 | O405: ="1,7,"&RC[2]&",0;"&"1,4,"&RC[4]&",0;" -> 1,7,10585,0;1,4,162305,0; | Q405: =INT(((55+RC[-14]/10)*35+200)*12/4) -> 10585 | S405: =1000*110/100*(1+(55+RC[-16]/10)/200)*100 -> 162305
B406: 1,7,4986,0;1,4,1321,0; | C406: 402 | D406: 1 | E406: 7 | F406: 4986 | G406: 0 | I406: 1 | J406: 4 | K406: 1321 | L406: 0 | O406: ="1,7,"&RC[2]&",0;"&"1,4,"&RC[4]&",0;" -> 1,7,10596,0;1,4,162360,0; | Q406: =INT(((55+RC[-14]/10)*35+200)*12/4) -> 10596 | S406: =1000*110/100*(1+(55+RC[-16]/10)/200)*100 -> 162360
B407: 1,7,4996,0;1,4,1321,0; | C407: 403 | D407: 1 | E407: 7 | F407: 4996 | G407: 0 | I407: 1 | J407: 4 | K407: 1321 | L407: 0 | O407: ="1,7,"&RC[2]&",0;"&"1,4,"&RC[4]&",0;" -> 1,7,10606,0;1,4,162415,0; | Q407: =INT(((55+RC[-14]/10)*35+200)*12/4) -> 10606 | S407: =1000*110/100*(1+(55+RC[-16]/10)/200)*100 -> 162415
B408: 1,7,5007,0;1,4,1322,0; | C408: 404 | D408: 1 | E408: 7 | F408: 5007 | G408: 0 | I408: 1 | J408: 4 | K408: 1322 | L408: 0 | O408: ="1,7,"&RC[2]&",0;"&"1,4,"&RC[4]&",0;" -> 1,7,10617,0;1,4,162470,0; | Q408: =INT(((55+RC[-14]/10)*35+200)*12/4) -> 10617 | S408: =1000*110/100*(1+(55+RC[-16]/10)/200)*100 -> 162470
B409: 1,7,5017,0;1,4,1322,0; | C409: 405 | D409: 1 | E409: 7 | F409: 5017 | G409: 0 | I409: 1 | J409: 4 | K409: 1322 | L409: 0 | O409: ="1,7,"&RC[2]&",0;"&"1,4,"&RC[4]&",0;" -> 1,7,10627,0;1,4,162525,0; | Q409: =INT(((55+RC[-14]/10)*35+200)*12/4) -> 10627 | S409: =1000*110/100*(1+(55+RC[-16]/10)/200)*100 -> 162525
B410: 1,7,5028,0;1,4,1323,0; | C410: 406 | D410: 1 | E410: 7 | F410: 5028 | G410: 0 | I410: 1 | J410: 4 | K410: 1323 | L410: 0 | O410: ="1,7,"&RC[2]&",0;"&"1,4,"&RC[4]&",0;" -> 1,7,10638,0;1,4,162580,0; | Q410: =INT(((55+RC[-14]/10)*35+200)*12/4) -> 10638 | S410: =1000*110/100*(1+(55+RC[-16]/10)/200)*100 -> 162580
B411: 1,7,5038,0;1,4,1323,0; | C411: 407 | D411: 1 | E411: 7 | F411: 5038 | G411: 0 | I411: 1 | J411: 4 | K411: 1323 | L411: 0 | O411: ="1,7,"&RC[2]&",0;"&"1,4,"&RC[4]&",0;" -> 1,7,10648,0;1,4,162635,0; | Q411: =INT(((55+RC[-14]/10)*35+200)*12/4) -> 10648 | S411: =1000*110/100*(1+(55+RC[-16]/10)/200)*100 -> 162635
B412: 1,7,5049,0;1,4,1324,0; | C412: 408 | D412: 1 | E412: 7 | F412: 5049 | G412: 0 | I412: 1 | J412: 4 | K412: 1324 | L412: 0 | O412: ="1,7,"&RC[2]&",0;"&"1,4,"&RC[4]&",0;" -> 1,7,10659,0;1,4,162690,0; | Q412: =INT(((55+RC[-14]/10)*35+200)*12/4) -> 10659 | S412: =1000*110/100*(1+(55+RC[-16]/10)/200)*100 -> 162690
B413: 1,7,5059,0;1,4,1324,0; | C413: 409 | D413: 1 | E413: 7 | F413: 5059 | G413: 0 | I413: 1 | J413: 4 | K413: 1324 | L413: 0 | O413: ="1,7,"&RC[2]&",0;"&"1,4,"&RC[4]&",0;" -> 1,7,10669,0;1,4,162745,0; | Q413: =INT(((55+RC[-14]/10)*35+200)*12/4) -> 10669 | S413: =1000*110/100*(1+(55+RC[-16]/10)/200)*100 -> 162745
B414: 1,7,5070,0;1,4,1325,0; | C414: 410 | D414: 1 | E414: 7 | F414: 5070 | G414: 0 | I414: 1 | J414: 4 | K414: 1325 | L414: 0 | O414: ="1,7,"&RC[2]&",0;"&"1,4,"&RC[4]&",0;" -> 1,7,10680,0;1,4,162800,0; | Q414: =INT(((55+RC[-14]/10)*35+200)*12/4) -> 10680 | S414: =1000*110/100*(1+(55+RC[-16]/10)/200)*100 -> 162800
B415: 1,7,5080,0;1,4,1326,0; | C415: 411 | D415: 1 | E415: 7 | F415: 5080 | G415: 0 | I415: 1 | J415: 4 | K415: 1326 | L415: 0 | O415: ="1,7,"&RC[2]&",0;"&"1,4,"&RC[4]&",0;" -> 1,7,10690,0;1,4,162855,0; | Q415: =INT(((55+RC[-14]/10)*35+200)*12/4) -> 10690 | S415: =1000*110/100*(1+(55+RC[-16]/10)/200)*100 -> 162855
B416: 1,7,5091,0;1,4,1326,0; | C416: 412 | D416: 1 | E416: 7 | F416: 5091 | G416: 0 | I416: 1 | J416: 4 | K416: 1326 | L416: 0 | O416: ="1,7,"&RC[2]&",0;"&"1,4,"&RC[4]&",0;" -> 1,7,10701,0;1,4,162910,0; | Q416: =INT(((55+RC[-14]/10)*35+200)*12/4) -> 10701 | S416: =1000*110/100*(1+(55+RC[-16]/10)/200)*100 -> 162910
B417: 1,7,5101,0;1,4,1327,0; | C417: 413 | D417: 1 | E417: 7 | F417: 5101 | G417: 0 | I417: 1 | J417: 4 | K417: 1327 | L417: 0 | O417: ="1,7,"&RC[2]&",0;"&"1,4,"&RC[4]&",0;" -> 1,7,10711,0;1,4,162965,0; | Q417: =INT(((55+RC[-14]/10)*35+200)*12/4) -> 10711 | S417: =1000*110/100*(1+(55+RC[-16]/10)/200)*100 -> 162965
B418: 1,7,5112,0;1,4,1327,0; | C418: 414 | D418: 1 | E418: 7 | F418: 5112 | G418: 0 | I418: 1 | J418: 4 | K418: 1327 | L418: 0 | O418: ="1,7,"&RC[2]&",0;"&"1,4,"&RC[4]&",0;" -> 1,7,10722,0;1,4,163020,0; | Q418: =INT(((55+RC[-14]/10)*35+200)*12/4) -> 10722 | S418: =1000*110/100*(1+(55+RC[-16]/10)/200)*100 -> 163020
B419: 1,7,5122,0;1,4,1328,0; | C419: 415 | D419: 1 | E419: 7 | F419: 5122 | G419: 0 | I419: 1 | J419: 4 | K419: 1328 | L419: 0 | O419: ="1,7,"&RC[2]&",0;"&"1,4,"&RC[4]&",0;" -> 1,7,10732,0;1,4,163075,0; | Q419: =INT(((55+RC[-14]/10)*35+200)*12/4) -> 10732 | S419: =1000*110/100*(1+(55+RC[-16]/10)/200)*100 -> 163075
B420: 1,7,5133,0;1,4,1328,0; | C420: 416 | D420: 1 | E420: 7 | F420: 5133 | G420: 0 | I420: 1 | J420: 4 | K420: 1328 | L420: 0 | O420: ="1,7,"&RC[2]&",0;"&"1,4,"&RC[4]&",0;" -> 1,7,10743,0;1,4,163130,0; | Q420: =INT(((55+RC[-14]/10)*35+200)*12/4) -> 10743 | S420: =1000*110/100*(1+(55+RC[-16]/10)/200)*100 -> 163130.00000000003
B421: 1,7,5143,0;1,4,1329,0; | C421: 417 | D421: 1 | E421: 7 | F421: 5143 | G421: 0 | I421: 1 | J421: 4 | K421: 1329 | L421: 0 | O421: ="1,7,"&RC[2]&",0;"&"1,4,"&RC[4]&",0;" -> 1,7,10753,0;1,4,163185,0; | Q421: =INT(((55+RC[-14]/10)*35+200)*12/4) -> 10753 | S421: =1000*110/100*(1+(55+RC[-16]/10)/200)*100 -> 163185
B422: 1,7,5154,0;1,4,1329,0; | C422: 418 | D422: 1 | E422: 7 | F422: 5154 | G422: 0 | I422: 1 | J422: 4 | K422: 1329 | L422: 0 | O422: ="1,7,"&RC[2]&",0;"&"1,4,"&RC[4]&",0;" -> 1,7,10764,0;1,4,163240,0; | Q422: =INT(((55+RC[-14]/10)*35+200)*12/4) -> 10764 | S422: =1000*110/100*(1+(55+RC[-16]/10)/200)*100 -> 163240
B423: 1,7,5164,0;1,4,1330,0; | C423: 419 | D423: 1 | E423: 7 | F423: 5164 | G423: 0 | I423: 1 | J423: 4 | K423: 1330 | L423: 0 | O423: ="1,7,"&RC[2]&",0;"&"1,4,"&RC[4]&",0;" -> 1,7,10774,0;1,4,163295,0; | Q423: =INT(((55+RC[-14]/10)*35+200)*12/4) -> 10774 | S423: =1000*110/100*(1+(55+RC[-16]/10)/200)*100 -> 163295.00000000003
B424: 1,7,5175,0;1,4,1331,0; | C424: 420 | D424: 1 | E424: 7 | F424: 5175 | G424: 0 | I424: 1 | J424: 4 | K424: 1331 | L424: 0 | O424: ="1,7,"&RC[2]&",0;"&"1,4,"&RC[4]&",0;" -> 1,7,10785,0;1,4,163350,0; | Q424: =INT(((55+RC[-14]/10)*35+200)*12/4) -> 10785 | S424: =1000*110/100*(1+(55+RC[-16]/10)/200)*100 -> 163349.99999999997
B425: 1,7,5185,0;1,4,1331,0; | C425: 421 | D425: 1 | E425: 7 | F425: 5185 | G425: 0 | I425: 1 | J425: 4 | K425: 1331 | L425: 0 | O425: ="1,7,"&RC[2]&",0;"&"1,4,"&RC[4]&",0;" -> 1,7,10795,0;1,4,163405,0; | Q425: =INT(((55+RC[-14]/10)*35+200)*12/4) -> 10795 | S425: =1000*110/100*(1+(55+RC[-16]/10)/200)*100 -> 163405
B426: 1,7,5196,0;1,4,1332,0; | C426: 422 | D426: 1 | E426: 7 | F426: 5196 | G426: 0 | I426: 1 | J426: 4 | K426: 1332 | L426: 0 | O426: ="1,7,"&RC[2]&",0;"&"1,4,"&RC[4]&",0;" -> 1,7,10806,0;1,4,163460,0; | Q426: =INT(((55+RC[-14]/10)*35+200)*12/4) -> 10806 | S426: =1000*110/100*(1+(55+RC[-16]/10)/200)*100 -> 163460
B427: 1,7,5206,0;1,4,1332,0; | C427: 423 | D427: 1 | E427: 7 | F427: 5206 | G427: 0 | I427: 1 | J427: 4 | K427: 1332 | L427: 0 | O427: ="1,7,"&RC[2]&",0;"&"1,4,"&RC[4]&",0;" -> 1,7,10816,0;1,4,163515,0; | Q427: =INT(((55+RC[-14]/10)*35+200)*12/4) -> 10816 | S427: =1000*110/100*(1+(55+RC[-16]/10)/200)*100 -> 163515
B428: 1,7,5217,0;1,4,1333,0; | C428: 424 | D428: 1 | E428: 7 | F428: 5217 | G428: 0 | I428: 1 | J428: 4 | K428: 1333 | L428: 0 | O428: ="1,7,"&RC[2]&",0;"&"1,4,"&RC[4]&",0;" -> 1,7,10827,0;1,4,163570,0; | Q428: =INT(((55+RC[-14]/10)*35+200)*12/4) -> 10827 | S428: =1000*110/100*(1+(55+RC[-16]/10)/200)*100 -> 163570
B429: 1,7,5227,0;1,4,1333,0; | C429: 425 | D429: 1 | E429: 7 | F429: 5227 | G429: 0 | I429: 1 | J429: 4 | K429: 1333 | L429: 0 | O429: ="1,7,"&RC[2]&",0;"&"1,4,"&RC[4]&",0;" -> 1,7,10837,0;1,4,163625,0; | Q429: =INT(((55+RC[-14]/10)*35+200)*12/4) -> 10837 | S429: =1000*110/100*(1+(55+RC[-16]/10)/200)*100 -> 163625
B430: 1,7,5238,0;1,4,1334,0; | C430: 426 | D430: 1 | E430: 7 | F430: 5238 | G430: 0 | I430: 1 | J430: 4 | K430: 1334 | L430: 0 | O430: ="1,7,"&RC[2]&",0;"&"1,4,"&RC[4]&",0;" -> 1,7,10848,0;1,4,163680,0; | Q430: =INT(((55+RC[-14]/10)*35+200)*12/4) -> 10848 | S430: =1000*110/100*(1+(55+RC[-16]/10)/200)*100 -> 163680
B431: 1,7,5248,0;1,4,1334,0; | C431: 427 | D431: 1 | E431: 7 | F431: 5248 | G431: 0 | I431: 1 | J431: 4 | K431: 1334 | L431: 0 | O431: ="1,7,"&RC[2]&",0;"&"1,4,"&RC[4]&",0;" -> 1,7,10858,0;1,4,163735,0; | Q431: =INT(((55+RC[-14]/10)*35+200)*12/4) -> 10858 | S431: =1000*110/100*(1+(55+RC[-16]/10)/200)*100 -> 163735
B432: 1,7,5259,0;1,4,1335,0; | C432: 428 | D432: 1 | E432: 7 | F432: 5259 | G432: 0 | I432: 1 | J432: 4 | K432: 1335 | L432: 0 | O432: ="1,7,"&RC[2]&",0;"&"1,4,"&RC[4]&",0;" -> 1,7,10869,0;1,4,163790,0; | Q432: =INT(((55+RC[-14]/10)*35+200)*12/4) -> 10869 | S432: =1000*110/100*(1+(55+RC[-16]/10)/200)*100 -> 163790
B433: 1,7,5269,0;1,4,1335,0; | C433: 429 | D433: 1 | E433: 7 | F433: 5269 | G433: 0 | I433: 1 | J433: 4 | K433: 1335 | L433: 0 | O433: ="1,7,"&RC[2]&",0;"&"1,4,"&RC[4]&",0;" -> 1,7,10879,0;1,4,163845,0; | Q433: =INT(((55+RC[-14]/10)*35+200)*12/4) -> 10879 | S433: =1000*110/100*(1+(55+RC[-16]/10)/200)*100 -> 163845
B434: 1,7,5280,0;1,4,1336,0; | C434: 430 | D434: 1 | E434: 7 | F434: 5280 | G434: 0 | I434: 1 | J434: 4 | K434: 1336 | L434: 0 | O434: ="1,7,"&RC[2]&",0;"&"1,4,"&RC[4]&",0;" -> 1,7,10890,0;1,4,163900,0; | Q434: =INT(((55+RC[-14]/10)*35+200)*12/4) -> 10890 | S434: =1000*110/100*(1+(55+RC[-16]/10)/200)*100 -> 163900
B435: 1,7,5290,0;1,4,1337,0; | C435: 431 | D435: 1 | E435: 7 | F435: 5290 | G435: 0 | I435: 1 | J435: 4 | K435: 1337 | L435: 0 | O435: ="1,7,"&RC[2]&",0;"&"1,4,"&RC[4]&",0;" -> 1,7,10900,0;1,4,163955,0; | Q435: =INT(((55+RC[-14]/10)*35+200)*12/4) -> 10900 | S435: =1000*110/100*(1+(55+RC[-16]/10)/200)*100 -> 163955
B436: 1,7,5301,0;1,4,1337,0; | C436: 432 | D436: 1 | E436: 7 | F436: 5301 | G436: 0 | I436: 1 | J436: 4 | K436: 1337 | L436: 0 | O436: ="1,7,"&RC[2]&",0;"&"1,4,"&RC[4]&",0;" -> 1,7,10911,0;1,4,164010,0; | Q436: =INT(((55+RC[-14]/10)*35+200)*12/4) -> 10911 | S436: =1000*110/100*(1+(55+RC[-16]/10)/200)*100 -> 164010
B437: 1,7,5311,0;1,4,1338,0; | C437: 433 | D437: 1 | E437: 7 | F437: 5311 | G437: 0 | I437: 1 | J437: 4 | K437: 1338 | L437: 0 | O437: ="1,7,"&RC[2]&",0;"&"1,4,"&RC[4]&",0;" -> 1,7,10921,0;1,4,164065,0; | Q437: =INT(((55+RC[-14]/10)*35+200)*12/4) -> 10921 | S437: =1000*110/100*(1+(55+RC[-16]/10)/200)*100 -> 164065
B438: 1,7,5322,0;1,4,1338,0; | C438: 434 | D438: 1 | E438: 7 | F438: 5322 | G438: 0 | I438: 1 | J438: 4 | K438: 1338 | L438: 0 | O438: ="1,7,"&RC[2]&",0;"&"1,4,"&RC[4]&",0;" -> 1,7,10932,0;1,4,164120,0; | Q438: =INT(((55+RC[-14]/10)*35+200)*12/4) -> 10932 | S438: =1000*110/100*(1+(55+RC[-16]/10)/200)*100 -> 164120
B439: 1,7,5332,0;1,4,1339,0; | C439: 435 | D439: 1 | E439: 7 | F439: 5332 | G439: 0 | I439: 1 | J439: 4 | K439: 1339 | L439: 0 | O439: ="1,7,"&RC[2]&",0;"&"1,4,"&RC[4]&",0;" -> 1,7,10942,0;1,4,164175,0; | Q439: =INT(((55+RC[-14]/10)*35+200)*12/4) -> 10942 | S439: =1000*110/100*(1+(55+RC[-16]/10)/200)*100 -> 164175
B440: 1,7,5343,0;1,4,1339,0; | C440: 436 | D440: 1 | E440: 7 | F440: 5343 | G440: 0 | I440: 1 | J440: 4 | K440: 1339 | L440: 0 | O440: ="1,7,"&RC[2]&",0;"&"1,4,"&RC[4]&",0;" -> 1,7,10953,0;1,4,164230,0; | Q440: =INT(((55+RC[-14]/10)*35+200)*12/4) -> 10953 | S440: =1000*110/100*(1+(55+RC[-16]/10)/200)*100 -> 164230
B441: 1,7,5353,0;1,4,1340,0; | C441: 437 | D441: 1 | E441: 7 | F441: 5353 | G441: 0 | I441: 1 | J441: 4 | K441: 1340 | L441: 0 | O441: ="1,7,"&RC[2]&",0;"&"1,4,"&RC[4]&",0;" -> 1,7,10963,0;1,4,164285,0; | Q441: =INT(((55+RC[-14]/10)*35+200)*12/4) -> 10963 | S441: =1000*110/100*(1+(55+RC[-16]/10)/200)*100 -> 164285
B442: 1,7,5364,0;1,4,1340,0; | C442: 438 | D442: 1 | E442: 7 | F442: 5364 | G442: 0 | I442: 1 | J442: 4 | K442: 1340 | L442: 0 | O442: ="1,7,"&RC[2]&",0;"&"1,4,"&RC[4]&",0;" -> 1,7,10974,0;1,4,164340,0; | Q442: =INT(((55+RC[-14]/10)*35+200)*12/4) -> 10974 | S442: =1000*110/100*(1+(55+RC[-16]/10)/200)*100 -> 164340
B443: 1,7,5374,0;1,4,1341,0; | C443: 439 | D443: 1 | E443: 7 | F443: 5374 | G443: 0 | I443: 1 | J443: 4 | K443: 1341 | L443: 0 | O443: ="1,7,"&RC[2]&",0;"&"1,4,"&RC[4]&",0;" -> 1,7,10984,0;1,4,164395,0; | Q443: =INT(((55+RC[-14]/10)*35+200)*12/4) -> 10984 | S443: =1000*110/100*(1+(55+RC[-16]/10)/200)*100 -> 164395
B444: 1,7,5385,0;1,4,1342,0; | C444: 440 | D444: 1 | E444: 7 | F444: 5385 | G444: 0 | I444: 1 | J444: 4 | K444: 1342 | L444: 0 | O444: ="1,7,"&RC[2]&",0;"&"1,4,"&RC[4]&",0;" -> 1,7,10995,0;1,4,164450,0; | Q444: =INT(((55+RC[-14]/10)*35+200)*12/4) -> 10995 | S444: =1000*110/100*(1+(55+RC[-16]/10)/200)*100 -> 164450.00000000003
B445: 1,7,5395,0;1,4,1342,0; | C445: 441 | D445: 1 | E445: 7 | F445: 5395 | G445: 0 | I445: 1 | J445: 4 | K445: 1342 | L445: 0 | O445: ="1,7,"&RC[2]&",0;"&"1,4,"&RC[4]&",0;" -> 1,7,11005,0;1,4,164505,0; | Q445: =INT(((55+RC[-14]/10)*35+200)*12/4) -> 11005 | S445: =1000*110/100*(1+(55+RC[-16]/10)/200)*100 -> 164505
B446: 1,7,5406,0;1,4,1343,0; | C446: 442 | D446: 1 | E446: 7 | F446: 5406 | G446: 0 | I446: 1 | J446: 4 | K446: 1343 | L446: 0 | O446: ="1,7,"&RC[2]&",0;"&"1,4,"&RC[4]&",0;" -> 1,7,11016,0;1,4,164560,0; | Q446: =INT(((55+RC[-14]/10)*35+200)*12/4) -> 11016 | S446: =1000*110/100*(1+(55+RC[-16]/10)/200)*100 -> 164560
B447: 1,7,5416,0;1,4,1343,0; | C447: 443 | D447: 1 | E447: 7 | F447: 5416 | G447: 0 | I447: 1 | J447: 4 | K447: 1343 | L447: 0 | O447: ="1,7,"&RC[2]&",0;"&"1,4,"&RC[4]&",0;" -> 1,7,11026,0;1,4,164615,0; | Q447: =INT(((55+RC[-14]/10)*35+200)*12/4) -> 11026 | S447: =1000*110/100*(1+(55+RC[-16]/10)/200)*100 -> 164615
B448: 1,7,5427,0;1,4,1344,0; | C448: 444 | D448: 1 | E448: 7 | F448: 5427 | G448: 0 | I448: 1 | J448: 4 | K448: 1344 | L448: 0 | O448: ="1,7,"&RC[2]&",0;"&"1,4,"&RC[4]&",0;" -> 1,7,11037,0;1,4,164670,0; | Q448: =INT(((55+RC[-14]/10)*35+200)*12/4) -> 11037 | S448: =1000*110/100*(1+(55+RC[-16]/10)/200)*100 -> 164670
B449: 1,7,5437,0;1,4,1344,0; | C449: 445 | D449: 1 | E449: 7 | F449: 5437 | G449: 0 | I449: 1 | J449: 4 | K449: 1344 | L449: 0 | O449: ="1,7,"&RC[2]&",0;"&"1,4,"&RC[4]&",0;" -> 1,7,11047,0;1,4,164725,0; | Q449: =INT(((55+RC[-14]/10)*35+200)*12/4) -> 11047 | S449: =1000*110/100*(1+(55+RC[-16]/10)/200)*100 -> 164725
B450: 1,7,5448,0;1,4,1345,0; | C450: 446 | D450: 1 | E450: 7 | F450: 5448 | G450: 0 | I450: 1 | J450: 4 | K450: 1345 | L450: 0 | O450: ="1,7,"&RC[2]&",0;"&"1,4,"&RC[4]&",0;" -> 1,7,11058,0;1,4,164780,0; | Q450: =INT(((55+RC[-14]/10)*35+200)*12/4) -> 11058 | S450: =1000*110/100*(1+(55+RC[-16]/10)/200)*100 -> 164780
B451: 1,7,5458,0;1,4,1345,0; | C451: 447 | D451: 1 | E451: 7 | F451: 5458 | G451: 0 | I451: 1 | J451: 4 | K451: 1345 | L451: 0 | O451: ="1,7,"&RC[2]&",0;"&"1,4,"&RC[4]&",0;" -> 1,7,11068,0;1,4,164835,0; | Q451: =INT(((55+RC[-14]/10)*35+200)*12/4) -> 11068 | S451: =1000*110/100*(1+(55+RC[-16]/10)/200)*100 -> 164835
B452: 1,7,5469,0;1,4,1346,0; | C452: 448 | D452: 1 | E452: 7 | F452: 5469 | G452: 0 | I452: 1 | J452: 4 | K452: 1346 | L452: 0 | O452: ="1,7,"&RC[2]&",0;"&"1,4,"&RC[4]&",0;" -> 1,7,11079,0;1,4,164890,0; | Q452: =INT(((55+RC[-14]/10)*35+200)*12/4) -> 11079 | S452: =1000*110/100*(1+(55+RC[-16]/10)/200)*100 -> 164890
B453: 1,7,5479,0;1,4,1346,0; | C453: 449 | D453: 1 | E453: 7 | F453: 5479 | G453: 0 | I453: 1 | J453: 4 | K453: 1346 | L453: 0 | O453: ="1,7,"&RC[2]&",0;"&"1,4,"&RC[4]&",0;" -> 1,7,11089,0;1,4,164945,0; | Q453: =INT(((55+RC[-14]/10)*35+200)*12/4) -> 11089 | S453: =1000*110/100*(1+(55+RC[-16]/10)/200)*100 -> 164945
B454: 1,7,5490,0;1,4,1347,0; | C454: 450 | D454: 1 | E454: 7 | F454: 5490 | G454: 0 | I454: 1 | J454: 4 | K454: 1347 | L454: 0 | O454: ="1,7,"&RC[2]&",0;"&"1,4,"&RC[4]&",0;" -> 1,7,11100,0;1,4,165000,0; | Q454: =INT(((55+RC[-14]/10)*35+200)*12/4) -> 11100 | S454: =1000*110/100*(1+(55+RC[-16]/10)/200)*100 -> 165000
B455: 1,7,5500,0;1,4,1348,0; | C455: 451 | D455: 1 | E455: 7 | F455: 5500 | G455: 0 | I455: 1 | J455: 4 | K455: 1348 | L455: 0 | O455: ="1,7,"&RC[2]&",0;"&"1,4,"&RC[4]&",0;" -> 1,7,11110,0;1,4,165055,0; | Q455: =INT(((55+RC[-14]/10)*35+200)*12/4) -> 11110 | S455: =1000*110/100*(1+(55+RC[-16]/10)/200)*100 -> 165055
B456: 1,7,5511,0;1,4,1348,0; | C456: 452 | D456: 1 | E456: 7 | F456: 5511 | G456: 0 | I456: 1 | J456: 4 | K456: 1348 | L456: 0 | O456: ="1,7,"&RC[2]&",0;"&"1,4,"&RC[4]&",0;" -> 1,7,11121,0;1,4,165110,0; | Q456: =INT(((55+RC[-14]/10)*35+200)*12/4) -> 11121 | S456: =1000*110/100*(1+(55+RC[-16]/10)/200)*100 -> 165110
B457: 1,7,5521,0;1,4,1349,0; | C457: 453 | D457: 1 | E457: 7 | F457: 5521 | G457: 0 | I457: 1 | J457: 4 | K457: 1349 | L457: 0 | O457: ="1,7,"&RC[2]&",0;"&"1,4,"&RC[4]&",0;" -> 1,7,11131,0;1,4,165165,0; | Q457: =INT(((55+RC[-14]/10)*35+200)*12/4) -> 11131 | S457: =1000*110/100*(1+(55+RC[-16]/10)/200)*100 -> 165165
B458: 1,7,5532,0;1,4,1349,0; | C458: 454 | D458: 1 | E458: 7 | F458: 5532 | G458: 0 | I458: 1 | J458: 4 | K458: 1349 | L458: 0 | O458: ="1,7,"&RC[2]&",0;"&"1,4,"&RC[4]&",0;" -> 1,7,11142,0;1,4,165220,0; | Q458: =INT(((55+RC[-14]/10)*35+200)*12/4) -> 11142 | S458: =1000*110/100*(1+(55+RC[-16]/10)/200)*100 -> 165220
B459: 1,7,5542,0;1,4,1350,0; | C459: 455 | D459: 1 | E459: 7 | F459: 5542 | G459: 0 | I459: 1 | J459: 4 | K459: 1350 | L459: 0 | O459: ="1,7,"&RC[2]&",0;"&"1,4,"&RC[4]&",0;" -> 1,7,11152,0;1,4,165275,0; | Q459: =INT(((55+RC[-14]/10)*35+200)*12/4) -> 11152 | S459: =1000*110/100*(1+(55+RC[-16]/10)/200)*100 -> 165275
B460: 1,7,5553,0;1,4,1350,0; | C460: 456 | D460: 1 | E460: 7 | F460: 5553 | G460: 0 | I460: 1 | J460: 4 | K460: 1350 | L460: 0 | O460: ="1,7,"&RC[2]&",0;"&"1,4,"&RC[4]&",0;" -> 1,7,11163,0;1,4,165330,0; | Q460: =INT(((55+RC[-14]/10)*35+200)*12/4) -> 11163 | S460: =1000*110/100*(1+(55+RC[-16]/10)/200)*100 -> 165330.00000000003
B461: 1,7,5563,0;1,4,1351,0; | C461: 457 | D461: 1 | E461: 7 | F461: 5563 | G461: 0 | I461: 1 | J461: 4 | K461: 1351 | L461: 0 | O461: ="1,7,"&RC[2]&",0;"&"1,4,"&RC[4]&",0;" -> 1,7,11173,0;1,4,165385,0; | Q461: =INT(((55+RC[-14]/10)*35+200)*12/4) -> 11173 | S461: =1000*110/100*(1+(55+RC[-16]/10)/200)*100 -> 165385
B462: 1,7,5574,0;1,4,1351,0; | C462: 458 | D462: 1 | E462: 7 | F462: 5574 | G462: 0 | I462: 1 | J462: 4 | K462: 1351 | L462: 0 | O462: ="1,7,"&RC[2]&",0;"&"1,4,"&RC[4]&",0;" -> 1,7,11184,0;1,4,165440,0; | Q462: =INT(((55+RC[-14]/10)*35+200)*12/4) -> 11184 | S462: =1000*110/100*(1+(55+RC[-16]/10)/200)*100 -> 165440
B463: 1,7,5584,0;1,4,1352,0; | C463: 459 | D463: 1 | E463: 7 | F463: 5584 | G463: 0 | I463: 1 | J463: 4 | K463: 1352 | L463: 0 | O463: ="1,7,"&RC[2]&",0;"&"1,4,"&RC[4]&",0;" -> 1,7,11194,0;1,4,165495,0; | Q463: =INT(((55+RC[-14]/10)*35+200)*12/4) -> 11194 | S463: =1000*110/100*(1+(55+RC[-16]/10)/200)*100 -> 165495.00000000003
B464: 1,7,5595,0;1,4,1353,0; | C464: 460 | D464: 1 | E464: 7 | F464: 5595 | G464: 0 | I464: 1 | J464: 4 | K464: 1353 | L464: 0 | O464: ="1,7,"&RC[2]&",0;"&"1,4,"&RC[4]&",0;" -> 1,7,11205,0;1,4,165550,0; | Q464: =INT(((55+RC[-14]/10)*35+200)*12/4) -> 11205 | S464: =1000*110/100*(1+(55+RC[-16]/10)/200)*100 -> 165549.99999999997
B465: 1,7,5605,0;1,4,1353,0; | C465: 461 | D465: 1 | E465: 7 | F465: 5605 | G465: 0 | I465: 1 | J465: 4 | K465: 1353 | L465: 0 | O465: ="1,7,"&RC[2]&",0;"&"1,4,"&RC[4]&",0;" -> 1,7,11215,0;1,4,165605,0; | Q465: =INT(((55+RC[-14]/10)*35+200)*12/4) -> 11215 | S465: =1000*110/100*(1+(55+RC[-16]/10)/200)*100 -> 165605
B466: 1,7,5616,0;1,4,1354,0; | C466: 462 | D466: 1 | E466: 7 | F466: 5616 | G466: 0 | I466: 1 | J466: 4 | K466: 1354 | L466: 0 | O466: ="1,7,"&RC[2]&",0;"&"1,4,"&RC[4]&",0;" -> 1,7,11226,0;1,4,165660,0; | Q466: =INT(((55+RC[-14]/10)*35+200)*12/4) -> 11226 | S466: =1000*110/100*(1+(55+RC[-16]/10)/200)*100 -> 165660
B467: 1,7,5626,0;1,4,1354,0; | C467: 463 | D467: 1 | E467: 7 | F467: 5626 | G467: 0 | I467: 1 | J467: 4 | K467: 1354 | L467: 0 | O467: ="1,7,"&RC[2]&",0;"&"1,4,"&RC[4]&",0;" -> 1,7,11236,0;1,4,165715,0; | Q467: =INT(((55+RC[-14]/10)*35+200)*12/4) -> 11236 | S467: =1000*110/100*(1+(55+RC[-16]/10)/200)*100 -> 165715
B468: 1,7,5637,0;1,4,1355,0; | C468: 464 | D468: 1 | E468: 7 | F468: 5637 | G468: 0 | I468: 1 | J468: 4 | K468: 1355 | L468: 0 | O468: ="1,7,"&RC[2]&",0;"&"1,4,"&RC[4]&",0;" -> 1,7,11247,0;1,4,165770,0; | Q468: =INT(((55+RC[-14]/10)*35+200)*12/4) -> 11247 | S468: =1000*110/100*(1+(55+RC[-16]/10)/200)*100 -> 165770
B469: 1,7,5647,0;1,4,1355,0; | C469: 465 | D469: 1 | E469: 7 | F469: 5647 | G469: 0 | I469: 1 | J469: 4 | K469: 1355 | L469: 0 | O469: ="1,7,"&RC[2]&",0;"&"1,4,"&RC[4]&",0;" -> 1,7,11257,0;1,4,165825,0; | Q469: =INT(((55+RC[-14]/10)*35+200)*12/4) -> 11257 | S469: =1000*110/100*(1+(55+RC[-16]/10)/200)*100 -> 165824.99999999997
B470: 1,7,5658,0;1,4,1356,0; | C470: 466 | D470: 1 | E470: 7 | F470: 5658 | G470: 0 | I470: 1 | J470: 4 | K470: 1356 | L470: 0 | O470: ="1,7,"&RC[2]&",0;"&"1,4,"&RC[4]&",0;" -> 1,7,11268,0;1,4,165880,0; | Q470: =INT(((55+RC[-14]/10)*35+200)*12/4) -> 11268 | S470: =1000*110/100*(1+(55+RC[-16]/10)/200)*100 -> 165880
B471: 1,7,5668,0;1,4,1356,0; | C471: 467 | D471: 1 | E471: 7 | F471: 5668 | G471: 0 | I471: 1 | J471: 4 | K471: 1356 | L471: 0 | O471: ="1,7,"&RC[2]&",0;"&"1,4,"&RC[4]&",0;" -> 1,7,11278,0;1,4,165935,0; | Q471: =INT(((55+RC[-14]/10)*35+200)*12/4) -> 11278 | S471: =1000*110/100*(1+(55+RC[-16]/10)/200)*100 -> 165935
B472: 1,7,5679,0;1,4,1357,0; | C472: 468 | D472: 1 | E472: 7 | F472: 5679 | G472: 0 | I472: 1 | J472: 4 | K472: 1357 | L472: 0 | O472: ="1,7,"&RC[2]&",0;"&"1,4,"&RC[4]&",0;" -> 1,7,11289,0;1,4,165990,0; | Q472: =INT(((55+RC[-14]/10)*35+200)*12/4) -> 11289 | S472: =1000*110/100*(1+(55+RC[-16]/10)/200)*100 -> 165990
B473: 1,7,5689,0;1,4,1357,0; | C473: 469 | D473: 1 | E473: 7 | F473: 5689 | G473: 0 | I473: 1 | J473: 4 | K473: 1357 | L473: 0 | O473: ="1,7,"&RC[2]&",0;"&"1,4,"&RC[4]&",0;" -> 1,7,11299,0;1,4,166045,0; | Q473: =INT(((55+RC[-14]/10)*35+200)*12/4) -> 11299 | S473: =1000*110/100*(1+(55+RC[-16]/10)/200)*100 -> 166045
B474: 1,7,5700,0;1,4,1358,0; | C474: 470 | D474: 1 | E474: 7 | F474: 5700 | G474: 0 | I474: 1 | J474: 4 | K474: 1358 | L474: 0 | O474: ="1,7,"&RC[2]&",0;"&"1,4,"&RC[4]&",0;" -> 1,7,11310,0;1,4,166100,0; | Q474: =INT(((55+RC[-14]/10)*35+200)*12/4) -> 11310 | S474: =1000*110/100*(1+(55+RC[-16]/10)/200)*100 -> 166100
B475: 1,7,5710,0;1,4,1359,0; | C475: 471 | D475: 1 | E475: 7 | F475: 5710 | G475: 0 | I475: 1 | J475: 4 | K475: 1359 | L475: 0 | O475: ="1,7,"&RC[2]&",0;"&"1,4,"&RC[4]&",0;" -> 1,7,11320,0;1,4,166155,0; | Q475: =INT(((55+RC[-14]/10)*35+200)*12/4) -> 11320 | S475: =1000*110/100*(1+(55+RC[-16]/10)/200)*100 -> 166155
B476: 1,7,5721,0;1,4,1359,0; | C476: 472 | D476: 1 | E476: 7 | F476: 5721 | G476: 0 | I476: 1 | J476: 4 | K476: 1359 | L476: 0 | O476: ="1,7,"&RC[2]&",0;"&"1,4,"&RC[4]&",0;" -> 1,7,11331,0;1,4,166210,0; | Q476: =INT(((55+RC[-14]/10)*35+200)*12/4) -> 11331 | S476: =1000*110/100*(1+(55+RC[-16]/10)/200)*100 -> 166210
B477: 1,7,5731,0;1,4,1360,0; | C477: 473 | D477: 1 | E477: 7 | F477: 5731 | G477: 0 | I477: 1 | J477: 4 | K477: 1360 | L477: 0 | O477: ="1,7,"&RC[2]&",0;"&"1,4,"&RC[4]&",0;" -> 1,7,11341,0;1,4,166265,0; | Q477: =INT(((55+RC[-14]/10)*35+200)*12/4) -> 11341 | S477: =1000*110/100*(1+(55+RC[-16]/10)/200)*100 -> 166265
B478: 1,7,5742,0;1,4,1360,0; | C478: 474 | D478: 1 | E478: 7 | F478: 5742 | G478: 0 | I478: 1 | J478: 4 | K478: 1360 | L478: 0 | O478: ="1,7,"&RC[2]&",0;"&"1,4,"&RC[4]&",0;" -> 1,7,11352,0;1,4,166320,0; | Q478: =INT(((55+RC[-14]/10)*35+200)*12/4) -> 11352 | S478: =1000*110/100*(1+(55+RC[-16]/10)/200)*100 -> 166320
B479: 1,7,5752,0;1,4,1361,0; | C479: 475 | D479: 1 | E479: 7 | F479: 5752 | G479: 0 | I479: 1 | J479: 4 | K479: 1361 | L479: 0 | O479: ="1,7,"&RC[2]&",0;"&"1,4,"&RC[4]&",0;" -> 1,7,11362,0;1,4,166375,0; | Q479: =INT(((55+RC[-14]/10)*35+200)*12/4) -> 11362 | S479: =1000*110/100*(1+(55+RC[-16]/10)/200)*100 -> 166375
B480: 1,7,5763,0;1,4,1361,0; | C480: 476 | D480: 1 | E480: 7 | F480: 5763 | G480: 0 | I480: 1 | J480: 4 | K480: 1361 | L480: 0 | O480: ="1,7,"&RC[2]&",0;"&"1,4,"&RC[4]&",0;" -> 1,7,11373,0;1,4,166430,0; | Q480: =INT(((55+RC[-14]/10)*35+200)*12/4) -> 11373 | S480: =1000*110/100*(1+(55+RC[-16]/10)/200)*100 -> 166430
B481: 1,7,5773,0;1,4,1362,0; | C481: 477 | D481: 1 | E481: 7 | F481: 5773 | G481: 0 | I481: 1 | J481: 4 | K481: 1362 | L481: 0 | O481: ="1,7,"&RC[2]&",0;"&"1,4,"&RC[4]&",0;" -> 1,7,11383,0;1,4,166485,0; | Q481: =INT(((55+RC[-14]/10)*35+200)*12/4) -> 11383 | S481: =1000*110/100*(1+(55+RC[-16]/10)/200)*100 -> 166485
B482: 1,7,5784,0;1,4,1362,0; | C482: 478 | D482: 1 | E482: 7 | F482: 5784 | G482: 0 | I482: 1 | J482: 4 | K482: 1362 | L482: 0 | O482: ="1,7,"&RC[2]&",0;"&"1,4,"&RC[4]&",0;" -> 1,7,11394,0;1,4,166540,0; | Q482: =INT(((55+RC[-14]/10)*35+200)*12/4) -> 11394 | S482: =1000*110/100*(1+(55+RC[-16]/10)/200)*100 -> 166540
B483: 1,7,5794,0;1,4,1363,0; | C483: 479 | D483: 1 | E483: 7 | F483: 5794 | G483: 0 | I483: 1 | J483: 4 | K483: 1363 | L483: 0 | O483: ="1,7,"&RC[2]&",0;"&"1,4,"&RC[4]&",0;" -> 1,7,11404,0;1,4,166595,0; | Q483: =INT(((55+RC[-14]/10)*35+200)*12/4) -> 11404 | S483: =1000*110/100*(1+(55+RC[-16]/10)/200)*100 -> 166595
B484: 1,7,5805,0;1,4,1364,0; | C484: 480 | D484: 1 | E484: 7 | F484: 5805 | G484: 0 | I484: 1 | J484: 4 | K484: 1364 | L484: 0 | O484: ="1,7,"&RC[2]&",0;"&"1,4,"&RC[4]&",0;" -> 1,7,11415,0;1,4,166650,0; | Q484: =INT(((55+RC[-14]/10)*35+200)*12/4) -> 11415 | S484: =1000*110/100*(1+(55+RC[-16]/10)/200)*100 -> 166650.00000000003
B485: 1,7,5815,0;1,4,1364,0; | C485: 481 | D485: 1 | E485: 7 | F485: 5815 | G485: 0 | I485: 1 | J485: 4 | K485: 1364 | L485: 0 | O485: ="1,7,"&RC[2]&",0;"&"1,4,"&RC[4]&",0;" -> 1,7,11425,0;1,4,166705,0; | Q485: =INT(((55+RC[-14]/10)*35+200)*12/4) -> 11425 | S485: =1000*110/100*(1+(55+RC[-16]/10)/200)*100 -> 166704.99999999997
B486: 1,7,5826,0;1,4,1365,0; | C486: 482 | D486: 1 | E486: 7 | F486: 5826 | G486: 0 | I486: 1 | J486: 4 | K486: 1365 | L486: 0 | O486: ="1,7,"&RC[2]&",0;"&"1,4,"&RC[4]&",0;" -> 1,7,11436,0;1,4,166760,0; | Q486: =INT(((55+RC[-14]/10)*35+200)*12/4) -> 11436 | S486: =1000*110/100*(1+(55+RC[-16]/10)/200)*100 -> 166760
B487: 1,7,5836,0;1,4,1365,0; | C487: 483 | D487: 1 | E487: 7 | F487: 5836 | G487: 0 | I487: 1 | J487: 4 | K487: 1365 | L487: 0 | O487: ="1,7,"&RC[2]&",0;"&"1,4,"&RC[4]&",0;" -> 1,7,11446,0;1,4,166815,0; | Q487: =INT(((55+RC[-14]/10)*35+200)*12/4) -> 11446 | S487: =1000*110/100*(1+(55+RC[-16]/10)/200)*100 -> 166815
B488: 1,7,5847,0;1,4,1366,0; | C488: 484 | D488: 1 | E488: 7 | F488: 5847 | G488: 0 | I488: 1 | J488: 4 | K488: 1366 | L488: 0 | O488: ="1,7,"&RC[2]&",0;"&"1,4,"&RC[4]&",0;" -> 1,7,11457,0;1,4,166870,0; | Q488: =INT(((55+RC[-14]/10)*35+200)*12/4) -> 11457 | S488: =1000*110/100*(1+(55+RC[-16]/10)/200)*100 -> 166869.99999999997
B489: 1,7,5857,0;1,4,1366,0; | C489: 485 | D489: 1 | E489: 7 | F489: 5857 | G489: 0 | I489: 1 | J489: 4 | K489: 1366 | L489: 0 | O489: ="1,7,"&RC[2]&",0;"&"1,4,"&RC[4]&",0;" -> 1,7,11467,0;1,4,166925,0; | Q489: =INT(((55+RC[-14]/10)*35+200)*12/4) -> 11467 | S489: =1000*110/100*(1+(55+RC[-16]/10)/200)*100 -> 166925
B490: 1,7,5868,0;1,4,1367,0; | C490: 486 | D490: 1 | E490: 7 | F490: 5868 | G490: 0 | I490: 1 | J490: 4 | K490: 1367 | L490: 0 | O490: ="1,7,"&RC[2]&",0;"&"1,4,"&RC[4]&",0;" -> 1,7,11478,0;1,4,166980,0; | Q490: =INT(((55+RC[-14]/10)*35+200)*12/4) -> 11478 | S490: =1000*110/100*(1+(55+RC[-16]/10)/200)*100 -> 166980
B491: 1,7,5878,0;1,4,1367,0; | C491: 487 | D491: 1 | E491: 7 | F491: 5878 | G491: 0 | I491: 1 | J491: 4 | K491: 1367 | L491: 0 | O491: ="1,7,"&RC[2]&",0;"&"1,4,"&RC[4]&",0;" -> 1,7,11488,0;1,4,167035,0; | Q491: =INT(((55+RC[-14]/10)*35+200)*12/4) -> 11488 | S491: =1000*110/100*(1+(55+RC[-16]/10)/200)*100 -> 167035
B492: 1,7,5889,0;1,4,1368,0; | C492: 488 | D492: 1 | E492: 7 | F492: 5889 | G492: 0 | I492: 1 | J492: 4 | K492: 1368 | L492: 0 | O492: ="1,7,"&RC[2]&",0;"&"1,4,"&RC[4]&",0;" -> 1,7,11499,0;1,4,167090,0; | Q492: =INT(((55+RC[-14]/10)*35+200)*12/4) -> 11499 | S492: =1000*110/100*(1+(55+RC[-16]/10)/200)*100 -> 167090
B493: 1,7,5899,0;1,4,1368,0; | C493: 489 | D493: 1 | E493: 7 | F493: 5899 | G493: 0 | I493: 1 | J493: 4 | K493: 1368 | L493: 0 | O493: ="1,7,"&RC[2]&",0;"&"1,4,"&RC[4]&",0;" -> 1,7,11509,0;1,4,167145,0; | Q493: =INT(((55+RC[-14]/10)*35+200)*12/4) -> 11509 | S493: =1000*110/100*(1+(55+RC[-16]/10)/200)*100 -> 167145
B494: 1,7,5910,0;1,4,1369,0; | C494: 490 | D494: 1 | E494: 7 | F494: 5910 | G494: 0 | I494: 1 | J494: 4 | K494: 1369 | L494: 0 | O494: ="1,7,"&RC[2]&",0;"&"1,4,"&RC[4]&",0;" -> 1,7,11520,0;1,4,167200,0; | Q494: =INT(((55+RC[-14]/10)*35+200)*12/4) -> 11520 | S494: =1000*110/100*(1+(55+RC[-16]/10)/200)*100 -> 167200
B495: 1,7,5920,0;1,4,1370,0; | C495: 491 | D495: 1 | E495: 7 | F495: 5920 | G495: 0 | I495: 1 | J495: 4 | K495: 1370 | L495: 0 | O495: ="1,7,"&RC[2]&",0;"&"1,4,"&RC[4]&",0;" -> 1,7,11530,0;1,4,167255,0; | Q495: =INT(((55+RC[-14]/10)*35+200)*12/4) -> 11530 | S495: =1000*110/100*(1+(55+RC[-16]/10)/200)*100 -> 167255
B496: 1,7,5931,0;1,4,1370,0; | C496: 492 | D496: 1 | E496: 7 | F496: 5931 | G496: 0 | I496: 1 | J496: 4 | K496: 1370 | L496: 0 | O496: ="1,7,"&RC[2]&",0;"&"1,4,"&RC[4]&",0;" -> 1,7,11541,0;1,4,167310,0; | Q496: =INT(((55+RC[-14]/10)*35+200)*12/4) -> 11541 | S496: =1000*110/100*(1+(55+RC[-16]/10)/200)*100 -> 167310
B497: 1,7,5941,0;1,4,1371,0; | C497: 493 | D497: 1 | E497: 7 | F497: 5941 | G497: 0 | I497: 1 | J497: 4 | K497: 1371 | L497: 0 | O497: ="1,7,"&RC[2]&",0;"&"1,4,"&RC[4]&",0;" -> 1,7,11551,0;1,4,167365,0; | Q497: =INT(((55+RC[-14]/10)*35+200)*12/4) -> 11551 | S497: =1000*110/100*(1+(55+RC[-16]/10)/200)*100 -> 167365
B498: 1,7,5952,0;1,4,1371,0; | C498: 494 | D498: 1 | E498: 7 | F498: 5952 | G498: 0 | I498: 1 | J498: 4 | K498: 1371 | L498: 0 | O498: ="1,7,"&RC[2]&",0;"&"1,4,"&RC[4]&",0;" -> 1,7,11562,0;1,4,167420,0; | Q498: =INT(((55+RC[-14]/10)*35+200)*12/4) -> 11562 | S498: =1000*110/100*(1+(55+RC[-16]/10)/200)*100 -> 167420
B499: 1,7,5962,0;1,4,1372,0; | C499: 495 | D499: 1 | E499: 7 | F499: 5962 | G499: 0 | I499: 1 | J499: 4 | K499: 1372 | L499: 0 | O499: ="1,7,"&RC[2]&",0;"&"1,4,"&RC[4]&",0;" -> 1,7,11572,0;1,4,167475,0; | Q499: =INT(((55+RC[-14]/10)*35+200)*12/4) -> 11572 | S499: =1000*110/100*(1+(55+RC[-16]/10)/200)*100 -> 167475
B500: 1,7,5973,0;1,4,1372,0; | C500: 496 | D500: 1 | E500: 7 | F500: 5973 | G500: 0 | I500: 1 | J500: 4 | K500: 1372 | L500: 0 | O500: ="1,7,"&RC[2]&",0;"&"1,4,"&RC[4]&",0;" -> 1,7,11583,0;1,4,167530,0; | Q500: =INT(((55+RC[-14]/10)*35+200)*12/4) -> 11583 | S500: =1000*110/100*(1+(55+RC[-16]/10)/200)*100 -> 167530.00000000003
B501: 1,7,5983,0;1,4,1373,0; | C501: 497 | D501: 1 | E501: 7 | F501: 5983 | G501: 0 | I501: 1 | J501: 4 | K501: 1373 | L501: 0 | O501: ="1,7,"&RC[2]&",0;"&"1,4,"&RC[4]&",0;" -> 1,7,11593,0;1,4,167585,0; | Q501: =INT(((55+RC[-14]/10)*35+200)*12/4) -> 11593 | S501: =1000*110/100*(1+(55+RC[-16]/10)/200)*100 -> 167585
B502: 1,7,5994,0;1,4,1373,0; | C502: 498 | D502: 1 | E502: 7 | F502: 5994 | G502: 0 | I502: 1 | J502: 4 | K502: 1373 | L502: 0 | O502: ="1,7,"&RC[2]&",0;"&"1,4,"&RC[4]&",0;" -> 1,7,11604,0;1,4,167640,0; | Q502: =INT(((55+RC[-14]/10)*35+200)*12/4) -> 11604 | S502: =1000*110/100*(1+(55+RC[-16]/10)/200)*100 -> 167640
B503: 1,7,6004,0;1,4,1374,0; | C503: 499 | D503: 1 | E503: 7 | F503: 6004 | G503: 0 | I503: 1 | J503: 4 | K503: 1374 | L503: 0 | O503: ="1,7,"&RC[2]&",0;"&"1,4,"&RC[4]&",0;" -> 1,7,11614,0;1,4,167695,0; | Q503: =INT(((55+RC[-14]/10)*35+200)*12/4) -> 11614 | S503: =1000*110/100*(1+(55+RC[-16]/10)/200)*100 -> 167695.00000000003
B504: 1,7,6015,0;1,4,1375,0; | C504: 500 | D504: 1 | E504: 7 | F504: 6015 | G504: 0 | I504: 1 | J504: 4 | K504: 1375 | L504: 0 | O504: ="1,7,"&RC[2]&",0;"&"1,4,"&RC[4]&",0;" -> 1,7,11625,0;1,4,167750,0; | Q504: =INT(((55+RC[-14]/10)*35+200)*12/4) -> 11625 | S504: =1000*110/100*(1+(55+RC[-16]/10)/200)*100 -> 167750
B505: 1,7,6025,0;1,4,1375,0; | C505: 501 | D505: 1 | E505: 7 | F505: 6025 | G505: 0 | I505: 1 | J505: 4 | K505: 1375 | L505: 0 | O505: ="1,7,"&RC[2]&",0;"&"1,4,"&RC[4]&",0;" -> 1,7,11635,0;1,4,167805,0; | Q505: =INT(((55+RC[-14]/10)*35+200)*12/4) -> 11635 | S505: =1000*110/100*(1+(55+RC[-16]/10)/200)*100 -> 167805.00000000003
B506: 1,7,6036,0;1,4,1376,0; | C506: 502 | D506: 1 | E506: 7 | F506: 6036 | G506: 0 | I506: 1 | J506: 4 | K506: 1376 | L506: 0 | O506: ="1,7,"&RC[2]&",0;"&"1,4,"&RC[4]&",0;" -> 1,7,11646,0;1,4,167860,0; | Q506: =INT(((55+RC[-14]/10)*35+200)*12/4) -> 11646 | S506: =1000*110/100*(1+(55+RC[-16]/10)/200)*100 -> 167860
B507: 1,7,6046,0;1,4,1376,0; | C507: 503 | D507: 1 | E507: 7 | F507: 6046 | G507: 0 | I507: 1 | J507: 4 | K507: 1376 | L507: 0 | O507: ="1,7,"&RC[2]&",0;"&"1,4,"&RC[4]&",0;" -> 1,7,11656,0;1,4,167915,0; | Q507: =INT(((55+RC[-14]/10)*35+200)*12/4) -> 11656 | S507: =1000*110/100*(1+(55+RC[-16]/10)/200)*100 -> 167915
B508: 1,7,6057,0;1,4,1377,0; | C508: 504 | D508: 1 | E508: 7 | F508: 6057 | G508: 0 | I508: 1 | J508: 4 | K508: 1377 | L508: 0 | O508: ="1,7,"&RC[2]&",0;"&"1,4,"&RC[4]&",0;" -> 1,7,11667,0;1,4,167970,0; | Q508: =INT(((55+RC[-14]/10)*35+200)*12/4) -> 11667 | S508: =1000*110/100*(1+(55+RC[-16]/10)/200)*100 -> 167970
B509: 1,7,6067,0;1,4,1377,0; | C509: 505 | D509: 1 | E509: 7 | F509: 6067 | G509: 0 | I509: 1 | J509: 4 | K509: 1377 | L509: 0 | O509: ="1,7,"&RC[2]&",0;"&"1,4,"&RC[4]&",0;" -> 1,7,11677,0;1,4,168025,0; | Q509: =INT(((55+RC[-14]/10)*35+200)*12/4) -> 11677 | S509: =1000*110/100*(1+(55+RC[-16]/10)/200)*100 -> 168024.99999999997
B510: 1,7,6078,0;1,4,1378,0; | C510: 506 | D510: 1 | E510: 7 | F510: 6078 | G510: 0 | I510: 1 | J510: 4 | K510: 1378 | L510: 0 | O510: ="1,7,"&RC[2]&",0;"&"1,4,"&RC[4]&",0;" -> 1,7,11688,0;1,4,168080,0; | Q510: =INT(((55+RC[-14]/10)*35+200)*12/4) -> 11688 | S510: =1000*110/100*(1+(55+RC[-16]/10)/200)*100 -> 168080
B511: 1,7,6088,0;1,4,1378,0; | C511: 507 | D511: 1 | E511: 7 | F511: 6088 | G511: 0 | I511: 1 | J511: 4 | K511: 1378 | L511: 0 | O511: ="1,7,"&RC[2]&",0;"&"1,4,"&RC[4]&",0;" -> 1,7,11698,0;1,4,168135,0; | Q511: =INT(((55+RC[-14]/10)*35+200)*12/4) -> 11698 | S511: =1000*110/100*(1+(55+RC[-16]/10)/200)*100 -> 168135
B512: 1,7,6099,0;1,4,1379,0; | C512: 508 | D512: 1 | E512: 7 | F512: 6099 | G512: 0 | I512: 1 | J512: 4 | K512: 1379 | L512: 0 | O512: ="1,7,"&RC[2]&",0;"&"1,4,"&RC[4]&",0;" -> 1,7,11709,0;1,4,168190,0; | Q512: =INT(((55+RC[-14]/10)*35+200)*12/4) -> 11709 | S512: =1000*110/100*(1+(55+RC[-16]/10)/200)*100 -> 168190
B513: 1,7,6109,0;1,4,1379,0; | C513: 509 | D513: 1 | E513: 7 | F513: 6109 | G513: 0 | I513: 1 | J513: 4 | K513: 1379 | L513: 0 | O513: ="1,7,"&RC[2]&",0;"&"1,4,"&RC[4]&",0;" -> 1,7,11719,0;1,4,168245,0; | Q513: =INT(((55+RC[-14]/10)*35+200)*12/4) -> 11719 | S513: =1000*110/100*(1+(55+RC[-16]/10)/200)*100 -> 168245
B514: 1,7,6120,0;1,4,1380,0; | C514: 510 | D514: 1 | E514: 7 | F514: 6120 | G514: 0 | I514: 1 | J514: 4 | K514: 1380 | L514: 0 | O514: ="1,7,"&RC[2]&",0;"&"1,4,"&RC[4]&",0;" -> 1,7,11730,0;1,4,168300,0; | Q514: =INT(((55+RC[-14]/10)*35+200)*12/4) -> 11730 | S514: =1000*110/100*(1+(55+RC[-16]/10)/200)*100 -> 168300
B515: 1,7,6130,0;1,4,1381,0; | C515: 511 | D515: 1 | E515: 7 | F515: 6130 | G515: 0 | I515: 1 | J515: 4 | K515: 1381 | L515: 0 | O515: ="1,7,"&RC[2]&",0;"&"1,4,"&RC[4]&",0;" -> 1,7,11740,0;1,4,168355,0; | Q515: =INT(((55+RC[-14]/10)*35+200)*12/4) -> 11740 | S515: =1000*110/100*(1+(55+RC[-16]/10)/200)*100 -> 168355
B516: 1,7,6141,0;1,4,1381,0; | C516: 512 | D516: 1 | E516: 7 | F516: 6141 | G516: 0 | I516: 1 | J516: 4 | K516: 1381 | L516: 0 | O516: ="1,7,"&RC[2]&",0;"&"1,4,"&RC[4]&",0;" -> 1,7,11751,0;1,4,168410,0; | Q516: =INT(((55+RC[-14]/10)*35+200)*12/4) -> 11751 | S516: =1000*110/100*(1+(55+RC[-16]/10)/200)*100 -> 168410
B517: 1,7,6151,0;1,4,1382,0; | C517: 513 | D517: 1 | E517: 7 | F517: 6151 | G517: 0 | I517: 1 | J517: 4 | K517: 1382 | L517: 0 | O517: ="1,7,"&RC[2]&",0;"&"1,4,"&RC[4]&",0;" -> 1,7,11761,0;1,4,168465,0; | Q517: =INT(((55+RC[-14]/10)*35+200)*12/4) -> 11761 | S517: =1000*110/100*(1+(55+RC[-16]/10)/200)*100 -> 168465
B518: 1,7,6162,0;1,4,1382,0; | C518: 514 | D518: 1 | E518: 7 | F518: 6162 | G518: 0 | I518: 1 | J518: 4 | K518: 1382 | L518: 0 | O518: ="1,7,"&RC[2]&",0;"&"1,4,"&RC[4]&",0;" -> 1,7,11772,0;1,4,168520,0; | Q518: =INT(((55+RC[-14]/10)*35+200)*12/4) -> 11772 | S518: =1000*110/100*(1+(55+RC[-16]/10)/200)*100 -> 168520
B519: 1,7,6172,0;1,4,1383,0; | C519: 515 | D519: 1 | E519: 7 | F519: 6172 | G519: 0 | I519: 1 | J519: 4 | K519: 1383 | L519: 0 | O519: ="1,7,"&RC[2]&",0;"&"1,4,"&RC[4]&",0;" -> 1,7,11782,0;1,4,168575,0; | Q519: =INT(((55+RC[-14]/10)*35+200)*12/4) -> 11782 | S519: =1000*110/100*(1+(55+RC[-16]/10)/200)*100 -> 168575
B520: 1,7,6183,0;1,4,1383,0; | C520: 516 | D520: 1 | E520: 7 | F520: 6183 | G520: 0 | I520: 1 | J520: 4 | K520: 1383 | L520: 0 | O520: ="1,7,"&RC[2]&",0;"&"1,4,"&RC[4]&",0;" -> 1,7,11793,0;1,4,168630,0; | Q520: =INT(((55+RC[-14]/10)*35+200)*12/4) -> 11793 | S520: =1000*110/100*(1+(55+RC[-16]/10)/200)*100 -> 168630
B521: 1,7,6193,0;1,4,1384,0; | C521: 517 | D521: 1 | E521: 7 | F521: 6193 | G521: 0 | I521: 1 | J521: 4 | K521: 1384 | L521: 0 | O521: ="1,7,"&RC[2]&",0;"&"1,4,"&RC[4]&",0;" -> 1,7,11803,0;1,4,168685,0; | Q521: =INT(((55+RC[-14]/10)*35+200)*12/4) -> 11803 | S521: =1000*110/100*(1+(55+RC[-16]/10)/200)*100 -> 168685
B522: 1,7,6204,0;1,4,1384,0; | C522: 518 | D522: 1 | E522: 7 | F522: 6204 | G522: 0 | I522: 1 | J522: 4 | K522: 1384 | L522: 0 | O522: ="1,7,"&RC[2]&",0;"&"1,4,"&RC[4]&",0;" -> 1,7,11814,0;1,4,168740,0; | Q522: =INT(((55+RC[-14]/10)*35+200)*12/4) -> 11814 | S522: =1000*110/100*(1+(55+RC[-16]/10)/200)*100 -> 168740
B523: 1,7,6214,0;1,4,1385,0; | C523: 519 | D523: 1 | E523: 7 | F523: 6214 | G523: 0 | I523: 1 | J523: 4 | K523: 1385 | L523: 0 | O523: ="1,7,"&RC[2]&",0;"&"1,4,"&RC[4]&",0;" -> 1,7,11824,0;1,4,168795,0; | Q523: =INT(((55+RC[-14]/10)*35+200)*12/4) -> 11824 | S523: =1000*110/100*(1+(55+RC[-16]/10)/200)*100 -> 168795
B524: 1,7,6225,0;1,4,1386,0; | C524: 520 | D524: 1 | E524: 7 | F524: 6225 | G524: 0 | I524: 1 | J524: 4 | K524: 1386 | L524: 0 | O524: ="1,7,"&RC[2]&",0;"&"1,4,"&RC[4]&",0;" -> 1,7,11835,0;1,4,168850,0; | Q524: =INT(((55+RC[-14]/10)*35+200)*12/4) -> 11835 | S524: =1000*110/100*(1+(55+RC[-16]/10)/200)*100 -> 168850.00000000003
B525: 1,7,6235,0;1,4,1386,0; | C525: 521 | D525: 1 | E525: 7 | F525: 6235 | G525: 0 | I525: 1 | J525: 4 | K525: 1386 | L525: 0 | O525: ="1,7,"&RC[2]&",0;"&"1,4,"&RC[4]&",0;" -> 1,7,11845,0;1,4,168905,0; | Q525: =INT(((55+RC[-14]/10)*35+200)*12/4) -> 11845 | S525: =1000*110/100*(1+(55+RC[-16]/10)/200)*100 -> 168905
B526: 1,7,6246,0;1,4,1387,0; | C526: 522 | D526: 1 | E526: 7 | F526: 6246 | G526: 0 | I526: 1 | J526: 4 | K526: 1387 | L526: 0 | O526: ="1,7,"&RC[2]&",0;"&"1,4,"&RC[4]&",0;" -> 1,7,11856,0;1,4,168960,0; | Q526: =INT(((55+RC[-14]/10)*35+200)*12/4) -> 11856 | S526: =1000*110/100*(1+(55+RC[-16]/10)/200)*100 -> 168960
B527: 1,7,6256,0;1,4,1387,0; | C527: 523 | D527: 1 | E527: 7 | F527: 6256 | G527: 0 | I527: 1 | J527: 4 | K527: 1387 | L527: 0 | O527: ="1,7,"&RC[2]&",0;"&"1,4,"&RC[4]&",0;" -> 1,7,11866,0;1,4,169015,0; | Q527: =INT(((55+RC[-14]/10)*35+200)*12/4) -> 11866 | S527: =1000*110/100*(1+(55+RC[-16]/10)/200)*100 -> 169015
B528: 1,7,6267,0;1,4,1388,0; | C528: 524 | D528: 1 | E528: 7 | F528: 6267 | G528: 0 | I528: 1 | J528: 4 | K528: 1388 | L528: 0 | O528: ="1,7,"&RC[2]&",0;"&"1,4,"&RC[4]&",0;" -> 1,7,11877,0;1,4,169070,0; | Q528: =INT(((55+RC[-14]/10)*35+200)*12/4) -> 11877 | S528: =1000*110/100*(1+(55+RC[-16]/10)/200)*100 -> 169069.99999999997
B529: 1,7,6277,0;1,4,1388,0; | C529: 525 | D529: 1 | E529: 7 | F529: 6277 | G529: 0 | I529: 1 | J529: 4 | K529: 1388 | L529: 0 | O529: ="1,7,"&RC[2]&",0;"&"1,4,"&RC[4]&",0;" -> 1,7,11887,0;1,4,169125,0; | Q529: =INT(((55+RC[-14]/10)*35+200)*12/4) -> 11887 | S529: =1000*110/100*(1+(55+RC[-16]/10)/200)*100 -> 169125
B530: 1,7,6288,0;1,4,1389,0; | C530: 526 | D530: 1 | E530: 7 | F530: 6288 | G530: 0 | I530: 1 | J530: 4 | K530: 1389 | L530: 0 | O530: ="1,7,"&RC[2]&",0;"&"1,4,"&RC[4]&",0;" -> 1,7,11898,0;1,4,169180,0; | Q530: =INT(((55+RC[-14]/10)*35+200)*12/4) -> 11898 | S530: =1000*110/100*(1+(55+RC[-16]/10)/200)*100 -> 169179.99999999997
B531: 1,7,6298,0;1,4,1389,0; | C531: 527 | D531: 1 | E531: 7 | F531: 6298 | G531: 0 | I531: 1 | J531: 4 | K531: 1389 | L531: 0 | O531: ="1,7,"&RC[2]&",0;"&"1,4,"&RC[4]&",0;" -> 1,7,11908,0;1,4,169235,0; | Q531: =INT(((55+RC[-14]/10)*35+200)*12/4) -> 11908 | S531: =1000*110/100*(1+(55+RC[-16]/10)/200)*100 -> 169235
B532: 1,7,6309,0;1,4,1390,0; | C532: 528 | D532: 1 | E532: 7 | F532: 6309 | G532: 0 | I532: 1 | J532: 4 | K532: 1390 | L532: 0 | O532: ="1,7,"&RC[2]&",0;"&"1,4,"&RC[4]&",0;" -> 1,7,11919,0;1,4,169290,0; | Q532: =INT(((55+RC[-14]/10)*35+200)*12/4) -> 11919 | S532: =1000*110/100*(1+(55+RC[-16]/10)/200)*100 -> 169290
B533: 1,7,6319,0;1,4,1390,0; | C533: 529 | D533: 1 | E533: 7 | F533: 6319 | G533: 0 | I533: 1 | J533: 4 | K533: 1390 | L533: 0 | O533: ="1,7,"&RC[2]&",0;"&"1,4,"&RC[4]&",0;" -> 1,7,11929,0;1,4,169345,0; | Q533: =INT(((55+RC[-14]/10)*35+200)*12/4) -> 11929 | S533: =1000*110/100*(1+(55+RC[-16]/10)/200)*100 -> 169344.99999999997
B534: 1,7,6330,0;1,4,1391,0; | C534: 530 | D534: 1 | E534: 7 | F534: 6330 | G534: 0 | I534: 1 | J534: 4 | K534: 1391 | L534: 0 | O534: ="1,7,"&RC[2]&",0;"&"1,4,"&RC[4]&",0;" -> 1,7,11940,0;1,4,169400,0; | Q534: =INT(((55+RC[-14]/10)*35+200)*12/4) -> 11940 | S534: =1000*110/100*(1+(55+RC[-16]/10)/200)*100 -> 169400
B535: 1,7,6340,0;1,4,1392,0; | C535: 531 | D535: 1 | E535: 7 | F535: 6340 | G535: 0 | I535: 1 | J535: 4 | K535: 1392 | L535: 0 | O535: ="1,7,"&RC[2]&",0;"&"1,4,"&RC[4]&",0;" -> 1,7,11950,0;1,4,169455,0; | Q535: =INT(((55+RC[-14]/10)*35+200)*12/4) -> 11950 | S535: =1000*110/100*(1+(55+RC[-16]/10)/200)*100 -> 169455
B536: 1,7,6351,0;1,4,1392,0; | C536: 532 | D536: 1 | E536: 7 | F536: 6351 | G536: 0 | I536: 1 | J536: 4 | K536: 1392 | L536: 0 | O536: ="1,7,"&RC[2]&",0;"&"1,4,"&RC[4]&",0;" -> 1,7,11961,0;1,4,169510,0; | Q536: =INT(((55+RC[-14]/10)*35+200)*12/4) -> 11961 | S536: =1000*110/100*(1+(55+RC[-16]/10)/200)*100 -> 169510
B537: 1,7,6361,0;1,4,1393,0; | C537: 533 | D537: 1 | E537: 7 | F537: 6361 | G537: 0 | I537: 1 | J537: 4 | K537: 1393 | L537: 0 | O537: ="1,7,"&RC[2]&",0;"&"1,4,"&RC[4]&",0;" -> 1,7,11971,0;1,4,169565,0; | Q537: =INT(((55+RC[-14]/10)*35+200)*12/4) -> 11971 | S537: =1000*110/100*(1+(55+RC[-16]/10)/200)*100 -> 169565
B538: 1,7,6372,0;1,4,1393,0; | C538: 534 | D538: 1 | E538: 7 | F538: 6372 | G538: 0 | I538: 1 | J538: 4 | K538: 1393 | L538: 0 | O538: ="1,7,"&RC[2]&",0;"&"1,4,"&RC[4]&",0;" -> 1,7,11982,0;1,4,169620,0; | Q538: =INT(((55+RC[-14]/10)*35+200)*12/4) -> 11982 | S538: =1000*110/100*(1+(55+RC[-16]/10)/200)*100 -> 169620
B539: 1,7,6382,0;1,4,1394,0; | C539: 535 | D539: 1 | E539: 7 | F539: 6382 | G539: 0 | I539: 1 | J539: 4 | K539: 1394 | L539: 0 | O539: ="1,7,"&RC[2]&",0;"&"1,4,"&RC[4]&",0;" -> 1,7,11992,0;1,4,169675,0; | Q539: =INT(((55+RC[-14]/10)*35+200)*12/4) -> 11992 | S539: =1000*110/100*(1+(55+RC[-16]/10)/200)*100 -> 169675
B540: 1,7,6393,0;1,4,1394,0; | C540: 536 | D540: 1 | E540: 7 | F540: 6393 | G540: 0 | I540: 1 | J540: 4 | K540: 1394 | L540: 0 | O540: ="1,7,"&RC[2]&",0;"&"1,4,"&RC[4]&",0;" -> 1,7,12003,0;1,4,169730,0; | Q540: =INT(((55+RC[-14]/10)*35+200)*12/4) -> 12003 | S540: =1000*110/100*(1+(55+RC[-16]/10)/200)*100 -> 169730
B541: 1,7,6403,0;1,4,1395,0; | C541: 537 | D541: 1 | E541: 7 | F541: 6403 | G541: 0 | I541: 1 | J541: 4 | K541: 1395 | L541: 0 | O541: ="1,7,"&RC[2]&",0;"&"1,4,"&RC[4]&",0;" -> 1,7,12013,0;1,4,169785,0; | Q541: =INT(((55+RC[-14]/10)*35+200)*12/4) -> 12013 | S541: =1000*110/100*(1+(55+RC[-16]/10)/200)*100 -> 169785
B542: 1,7,6414,0;1,4,1395,0; | C542: 538 | D542: 1 | E542: 7 | F542: 6414 | G542: 0 | I542: 1 | J542: 4 | K542: 1395 | L542: 0 | O542: ="1,7,"&RC[2]&",0;"&"1,4,"&RC[4]&",0;" -> 1,7,12024,0;1,4,169840,0; | Q542: =INT(((55+RC[-14]/10)*35+200)*12/4) -> 12024 | S542: =1000*110/100*(1+(55+RC[-16]/10)/200)*100 -> 169840
B543: 1,7,6424,0;1,4,1396,0; | C543: 539 | D543: 1 | E543: 7 | F543: 6424 | G543: 0 | I543: 1 | J543: 4 | K543: 1396 | L543: 0 | O543: ="1,7,"&RC[2]&",0;"&"1,4,"&RC[4]&",0;" -> 1,7,12034,0;1,4,169895,0; | Q543: =INT(((55+RC[-14]/10)*35+200)*12/4) -> 12034 | S543: =1000*110/100*(1+(55+RC[-16]/10)/200)*100 -> 169895
B544: 1,7,6435,0;1,4,1397,0; | C544: 540 | D544: 1 | E544: 7 | F544: 6435 | G544: 0 | I544: 1 | J544: 4 | K544: 1397 | L544: 0 | O544: ="1,7,"&RC[2]&",0;"&"1,4,"&RC[4]&",0;" -> 1,7,12045,0;1,4,169950,0; | Q544: =INT(((55+RC[-14]/10)*35+200)*12/4) -> 12045 | S544: =1000*110/100*(1+(55+RC[-16]/10)/200)*100 -> 169950
B545: 1,7,6445,0;1,4,1397,0; | C545: 541 | D545: 1 | E545: 7 | F545: 6445 | G545: 0 | I545: 1 | J545: 4 | K545: 1397 | L545: 0 | O545: ="1,7,"&RC[2]&",0;"&"1,4,"&RC[4]&",0;" -> 1,7,12055,0;1,4,170005,0; | Q545: =INT(((55+RC[-14]/10)*35+200)*12/4) -> 12055 | S545: =1000*110/100*(1+(55+RC[-16]/10)/200)*100 -> 170005.00000000003
B546: 1,7,6456,0;1,4,1398,0; | C546: 542 | D546: 1 | E546: 7 | F546: 6456 | G546: 0 | I546: 1 | J546: 4 | K546: 1398 | L546: 0 | O546: ="1,7,"&RC[2]&",0;"&"1,4,"&RC[4]&",0;" -> 1,7,12066,0;1,4,170060,0; | Q546: =INT(((55+RC[-14]/10)*35+200)*12/4) -> 12066 | S546: =1000*110/100*(1+(55+RC[-16]/10)/200)*100 -> 170060
B547: 1,7,6466,0;1,4,1398,0; | C547: 543 | D547: 1 | E547: 7 | F547: 6466 | G547: 0 | I547: 1 | J547: 4 | K547: 1398 | L547: 0 | O547: ="1,7,"&RC[2]&",0;"&"1,4,"&RC[4]&",0;" -> 1,7,12076,0;1,4,170115,0; | Q547: =INT(((55+RC[-14]/10)*35+200)*12/4) -> 12076 | S547: =1000*110/100*(1+(55+RC[-16]/10)/200)*100 -> 170115
B548: 1,7,6477,0;1,4,1399,0; | C548: 544 | D548: 1 | E548: 7 | F548: 6477 | G548: 0 | I548: 1 | J548: 4 | K548: 1399 | L548: 0 | O548: ="1,7,"&RC[2]&",0;"&"1,4,"&RC[4]&",0;" -> 1,7,12087,0;1,4,170170,0; | Q548: =INT(((55+RC[-14]/10)*35+200)*12/4) -> 12087 | S548: =1000*110/100*(1+(55+RC[-16]/10)/200)*100 -> 170170.00000000003
B549: 1,7,6487,0;1,4,1399,0; | C549: 545 | D549: 1 | E549: 7 | F549: 6487 | G549: 0 | I549: 1 | J549: 4 | K549: 1399 | L549: 0 | O549: ="1,7,"&RC[2]&",0;"&"1,4,"&RC[4]&",0;" -> 1,7,12097,0;1,4,170225,0; | Q549: =INT(((55+RC[-14]/10)*35+200)*12/4) -> 12097 | S549: =1000*110/100*(1+(55+RC[-16]/10)/200)*100 -> 170224.99999999997
B550: 1,7,6498,0;1,4,1400,0; | C550: 546 | D550: 1 | E550: 7 | F550: 6498 | G550: 0 | I550: 1 | J550: 4 | K550: 1400 | L550: 0 | O550: ="1,7,"&RC[2]&",0;"&"1,4,"&RC[4]&",0;" -> 1,7,12108,0;1,4,170280,0; | Q550: =INT(((55+RC[-14]/10)*35+200)*12/4) -> 12108 | S550: =1000*110/100*(1+(55+RC[-16]/10)/200)*100 -> 170280
B551: 1,7,6508,0;1,4,1400,0; | C551: 547 | D551: 1 | E551: 7 | F551: 6508 | G551: 0 | I551: 1 | J551: 4 | K551: 1400 | L551: 0 | O551: ="1,7,"&RC[2]&",0;"&"1,4,"&RC[4]&",0;" -> 1,7,12118,0;1,4,170335,0; | Q551: =INT(((55+RC[-14]/10)*35+200)*12/4) -> 12118 | S551: =1000*110/100*(1+(55+RC[-16]/10)/200)*100 -> 170335
B552: 1,7,6519,0;1,4,1401,0; | C552: 548 | D552: 1 | E552: 7 | F552: 6519 | G552: 0 | I552: 1 | J552: 4 | K552: 1401 | L552: 0 | O552: ="1,7,"&RC[2]&",0;"&"1,4,"&RC[4]&",0;" -> 1,7,12129,0;1,4,170390,0; | Q552: =INT(((55+RC[-14]/10)*35+200)*12/4) -> 12129 | S552: =1000*110/100*(1+(55+RC[-16]/10)/200)*100 -> 170390
B553: 1,7,6529,0;1,4,1401,0; | C553: 549 | D553: 1 | E553: 7 | F553: 6529 | G553: 0 | I553: 1 | J553: 4 | K553: 1401 | L553: 0 | O553: ="1,7,"&RC[2]&",0;"&"1,4,"&RC[4]&",0;" -> 1,7,12139,0;1,4,170445,0; | Q553: =INT(((55+RC[-14]/10)*35+200)*12/4) -> 12139 | S553: =1000*110/100*(1+(55+RC[-16]/10)/200)*100 -> 170445
B554: 1,7,6540,0;1,4,1402,0; | C554: 550 | D554: 1 | E554: 7 | F554: 6540 | G554: 0 | I554: 1 | J554: 4 | K554: 1402 | L554: 0 | O554: ="1,7,"&RC[2]&",0;"&"1,4,"&RC[4]&",0;" -> 1,7,12150,0;1,4,170500,0; | Q554: =INT(((55+RC[-14]/10)*35+200)*12/4) -> 12150 | S554: =1000*110/100*(1+(55+RC[-16]/10)/200)*100 -> 170500
B555: 1,7,6550,0;1,4,1403,0; | C555: 551 | D555: 1 | E555: 7 | F555: 6550 | G555: 0 | I555: 1 | J555: 4 | K555: 1403 | L555: 0 | O555: ="1,7,"&RC[2]&",0;"&"1,4,"&RC[4]&",0;" -> 1,7,12160,0;1,4,170555,0; | Q555: =INT(((55+RC[-14]/10)*35+200)*12/4) -> 12160 | S555: =1000*110/100*(1+(55+RC[-16]/10)/200)*100 -> 170555
B556: 1,7,6561,0;1,4,1403,0; | C556: 552 | D556: 1 | E556: 7 | F556: 6561 | G556: 0 | I556: 1 | J556: 4 | K556: 1403 | L556: 0 | O556: ="1,7,"&RC[2]&",0;"&"1,4,"&RC[4]&",0;" -> 1,7,12171,0;1,4,170610,0; | Q556: =INT(((55+RC[-14]/10)*35+200)*12/4) -> 12171 | S556: =1000*110/100*(1+(55+RC[-16]/10)/200)*100 -> 170610
B557: 1,7,6571,0;1,4,1404,0; | C557: 553 | D557: 1 | E557: 7 | F557: 6571 | G557: 0 | I557: 1 | J557: 4 | K557: 1404 | L557: 0 | O557: ="1,7,"&RC[2]&",0;"&"1,4,"&RC[4]&",0;" -> 1,7,12181,0;1,4,170665,0; | Q557: =INT(((55+RC[-14]/10)*35+200)*12/4) -> 12181 | S557: =1000*110/100*(1+(55+RC[-16]/10)/200)*100 -> 170665
B558: 1,7,6582,0;1,4,1404,0; | C558: 554 | D558: 1 | E558: 7 | F558: 6582 | G558: 0 | I558: 1 | J558: 4 | K558: 1404 | L558: 0 | O558: ="1,7,"&RC[2]&",0;"&"1,4,"&RC[4]&",0;" -> 1,7,12192,0;1,4,170720,0; | Q558: =INT(((55+RC[-14]/10)*35+200)*12/4) -> 12192 | S558: =1000*110/100*(1+(55+RC[-16]/10)/200)*100 -> 170720
B559: 1,7,6592,0;1,4,1405,0; | C559: 555 | D559: 1 | E559: 7 | F559: 6592 | G559: 0 | I559: 1 | J559: 4 | K559: 1405 | L559: 0 | O559: ="1,7,"&RC[2]&",0;"&"1,4,"&RC[4]&",0;" -> 1,7,12202,0;1,4,170775,0; | Q559: =INT(((55+RC[-14]/10)*35+200)*12/4) -> 12202 | S559: =1000*110/100*(1+(55+RC[-16]/10)/200)*100 -> 170775
B560: 1,7,6603,0;1,4,1405,0; | C560: 556 | D560: 1 | E560: 7 | F560: 6603 | G560: 0 | I560: 1 | J560: 4 | K560: 1405 | L560: 0 | O560: ="1,7,"&RC[2]&",0;"&"1,4,"&RC[4]&",0;" -> 1,7,12213,0;1,4,170830,0; | Q560: =INT(((55+RC[-14]/10)*35+200)*12/4) -> 12213 | S560: =1000*110/100*(1+(55+RC[-16]/10)/200)*100 -> 170830
B561: 1,7,6613,0;1,4,1406,0; | C561: 557 | D561: 1 | E561: 7 | F561: 6613 | G561: 0 | I561: 1 | J561: 4 | K561: 1406 | L561: 0 | O561: ="1,7,"&RC[2]&",0;"&"1,4,"&RC[4]&",0;" -> 1,7,12223,0;1,4,170885,0; | Q561: =INT(((55+RC[-14]/10)*35+200)*12/4) -> 12223 | S561: =1000*110/100*(1+(55+RC[-16]/10)/200)*100 -> 170885
B562: 1,7,6624,0;1,4,1406,0; | C562: 558 | D562: 1 | E562: 7 | F562: 6624 | G562: 0 | I562: 1 | J562: 4 | K562: 1406 | L562: 0 | O562: ="1,7,"&RC[2]&",0;"&"1,4,"&RC[4]&",0;" -> 1,7,12234,0;1,4,170940,0; | Q562: =INT(((55+RC[-14]/10)*35+200)*12/4) -> 12234 | S562: =1000*110/100*(1+(55+RC[-16]/10)/200)*100 -> 170940
B563: 1,7,6634,0;1,4,1407,0; | C563: 559 | D563: 1 | E563: 7 | F563: 6634 | G563: 0 | I563: 1 | J563: 4 | K563: 1407 | L563: 0 | O563: ="1,7,"&RC[2]&",0;"&"1,4,"&RC[4]&",0;" -> 1,7,12244,0;1,4,170995,0; | Q563: =INT(((55+RC[-14]/10)*35+200)*12/4) -> 12244 | S563: =1000*110/100*(1+(55+RC[-16]/10)/200)*100 -> 170995
B564: 1,7,6645,0;1,4,1408,0; | C564: 560 | D564: 1 | E564: 7 | F564: 6645 | G564: 0 | I564: 1 | J564: 4 | K564: 1408 | L564: 0 | O564: ="1,7,"&RC[2]&",0;"&"1,4,"&RC[4]&",0;" -> 1,7,12255,0;1,4,171050,0; | Q564: =INT(((55+RC[-14]/10)*35+200)*12/4) -> 12255 | S564: =1000*110/100*(1+(55+RC[-16]/10)/200)*100 -> 171050.00000000003
B565: 1,7,6655,0;1,4,1408,0; | C565: 561 | D565: 1 | E565: 7 | F565: 6655 | G565: 0 | I565: 1 | J565: 4 | K565: 1408 | L565: 0 | O565: ="1,7,"&RC[2]&",0;"&"1,4,"&RC[4]&",0;" -> 1,7,12265,0;1,4,171105,0; | Q565: =INT(((55+RC[-14]/10)*35+200)*12/4) -> 12265 | S565: =1000*110/100*(1+(55+RC[-16]/10)/200)*100 -> 171105
B566: 1,7,6666,0;1,4,1409,0; | C566: 562 | D566: 1 | E566: 7 | F566: 6666 | G566: 0 | I566: 1 | J566: 4 | K566: 1409 | L566: 0 | O566: ="1,7,"&RC[2]&",0;"&"1,4,"&RC[4]&",0;" -> 1,7,12276,0;1,4,171160,0; | Q566: =INT(((55+RC[-14]/10)*35+200)*12/4) -> 12276 | S566: =1000*110/100*(1+(55+RC[-16]/10)/200)*100 -> 171160
B567: 1,7,6676,0;1,4,1409,0; | C567: 563 | D567: 1 | E567: 7 | F567: 6676 | G567: 0 | I567: 1 | J567: 4 | K567: 1409 | L567: 0 | O567: ="1,7,"&RC[2]&",0;"&"1,4,"&RC[4]&",0;" -> 1,7,12286,0;1,4,171215,0; | Q567: =INT(((55+RC[-14]/10)*35+200)*12/4) -> 12286 | S567: =1000*110/100*(1+(55+RC[-16]/10)/200)*100 -> 171215
B568: 1,7,6687,0;1,4,1410,0; | C568: 564 | D568: 1 | E568: 7 | F568: 6687 | G568: 0 | I568: 1 | J568: 4 | K568: 1410 | L568: 0 | O568: ="1,7,"&RC[2]&",0;"&"1,4,"&RC[4]&",0;" -> 1,7,12297,0;1,4,171270,0; | Q568: =INT(((55+RC[-14]/10)*35+200)*12/4) -> 12297 | S568: =1000*110/100*(1+(55+RC[-16]/10)/200)*100 -> 171270
B569: 1,7,6697,0;1,4,1410,0; | C569: 565 | D569: 1 | E569: 7 | F569: 6697 | G569: 0 | I569: 1 | J569: 4 | K569: 1410 | L569: 0 | O569: ="1,7,"&RC[2]&",0;"&"1,4,"&RC[4]&",0;" -> 1,7,12307,0;1,4,171325,0; | Q569: =INT(((55+RC[-14]/10)*35+200)*12/4) -> 12307 | S569: =1000*110/100*(1+(55+RC[-16]/10)/200)*100 -> 171325.00000000003
B570: 1,7,6708,0;1,4,1411,0; | C570: 566 | D570: 1 | E570: 7 | F570: 6708 | G570: 0 | I570: 1 | J570: 4 | K570: 1411 | L570: 0 | O570: ="1,7,"&RC[2]&",0;"&"1,4,"&RC[4]&",0;" -> 1,7,12318,0;1,4,171380,0; | Q570: =INT(((55+RC[-14]/10)*35+200)*12/4) -> 12318 | S570: =1000*110/100*(1+(55+RC[-16]/10)/200)*100 -> 171379.99999999997
B571: 1,7,6718,0;1,4,1411,0; | C571: 567 | D571: 1 | E571: 7 | F571: 6718 | G571: 0 | I571: 1 | J571: 4 | K571: 1411 | L571: 0 | O571: ="1,7,"&RC[2]&",0;"&"1,4,"&RC[4]&",0;" -> 1,7,12328,0;1,4,171435,0; | Q571: =INT(((55+RC[-14]/10)*35+200)*12/4) -> 12328 | S571: =1000*110/100*(1+(55+RC[-16]/10)/200)*100 -> 171435
B572: 1,7,6729,0;1,4,1412,0; | C572: 568 | D572: 1 | E572: 7 | F572: 6729 | G572: 0 | I572: 1 | J572: 4 | K572: 1412 | L572: 0 | O572: ="1,7,"&RC[2]&",0;"&"1,4,"&RC[4]&",0;" -> 1,7,12339,0;1,4,171490,0; | Q572: =INT(((55+RC[-14]/10)*35+200)*12/4) -> 12339 | S572: =1000*110/100*(1+(55+RC[-16]/10)/200)*100 -> 171490
B573: 1,7,6739,0;1,4,1412,0; | C573: 569 | D573: 1 | E573: 7 | F573: 6739 | G573: 0 | I573: 1 | J573: 4 | K573: 1412 | L573: 0 | O573: ="1,7,"&RC[2]&",0;"&"1,4,"&RC[4]&",0;" -> 1,7,12349,0;1,4,171545,0; | Q573: =INT(((55+RC[-14]/10)*35+200)*12/4) -> 12349 | S573: =1000*110/100*(1+(55+RC[-16]/10)/200)*100 -> 171544.99999999997
B574: 1,7,6750,0;1,4,1413,0; | C574: 570 | D574: 1 | E574: 7 | F574: 6750 | G574: 0 | I574: 1 | J574: 4 | K574: 1413 | L574: 0 | O574: ="1,7,"&RC[2]&",0;"&"1,4,"&RC[4]&",0;" -> 1,7,12360,0;1,4,171600,0; | Q574: =INT(((55+RC[-14]/10)*35+200)*12/4) -> 12360 | S574: =1000*110/100*(1+(55+RC[-16]/10)/200)*100 -> 171600
B575: 1,7,6760,0;1,4,1414,0; | C575: 571 | D575: 1 | E575: 7 | F575: 6760 | G575: 0 | I575: 1 | J575: 4 | K575: 1414 | L575: 0 | O575: ="1,7,"&RC[2]&",0;"&"1,4,"&RC[4]&",0;" -> 1,7,12370,0;1,4,171655,0; | Q575: =INT(((55+RC[-14]/10)*35+200)*12/4) -> 12370 | S575: =1000*110/100*(1+(55+RC[-16]/10)/200)*100 -> 171655
B576: 1,7,6771,0;1,4,1414,0; | C576: 572 | D576: 1 | E576: 7 | F576: 6771 | G576: 0 | I576: 1 | J576: 4 | K576: 1414 | L576: 0 | O576: ="1,7,"&RC[2]&",0;"&"1,4,"&RC[4]&",0;" -> 1,7,12381,0;1,4,171710,0; | Q576: =INT(((55+RC[-14]/10)*35+200)*12/4) -> 12381 | S576: =1000*110/100*(1+(55+RC[-16]/10)/200)*100 -> 171710
B577: 1,7,6781,0;1,4,1415,0; | C577: 573 | D577: 1 | E577: 7 | F577: 6781 | G577: 0 | I577: 1 | J577: 4 | K577: 1415 | L577: 0 | O577: ="1,7,"&RC[2]&",0;"&"1,4,"&RC[4]&",0;" -> 1,7,12391,0;1,4,171765,0; | Q577: =INT(((55+RC[-14]/10)*35+200)*12/4) -> 12391 | S577: =1000*110/100*(1+(55+RC[-16]/10)/200)*100 -> 171765
B578: 1,7,6792,0;1,4,1415,0; | C578: 574 | D578: 1 | E578: 7 | F578: 6792 | G578: 0 | I578: 1 | J578: 4 | K578: 1415 | L578: 0 | O578: ="1,7,"&RC[2]&",0;"&"1,4,"&RC[4]&",0;" -> 1,7,12402,0;1,4,171820,0; | Q578: =INT(((55+RC[-14]/10)*35+200)*12/4) -> 12402 | S578: =1000*110/100*(1+(55+RC[-16]/10)/200)*100 -> 171820
B579: 1,7,6802,0;1,4,1416,0; | C579: 575 | D579: 1 | E579: 7 | F579: 6802 | G579: 0 | I579: 1 | J579: 4 | K579: 1416 | L579: 0 | O579: ="1,7,"&RC[2]&",0;"&"1,4,"&RC[4]&",0;" -> 1,7,12412,0;1,4,171875,0; | Q579: =INT(((55+RC[-14]/10)*35+200)*12/4) -> 12412 | S579: =1000*110/100*(1+(55+RC[-16]/10)/200)*100 -> 171875
B580: 1,7,6813,0;1,4,1416,0; | C580: 576 | D580: 1 | E580: 7 | F580: 6813 | G580: 0 | I580: 1 | J580: 4 | K580: 1416 | L580: 0 | O580: ="1,7,"&RC[2]&",0;"&"1,4,"&RC[4]&",0;" -> 1,7,12423,0;1,4,171930,0; | Q580: =INT(((55+RC[-14]/10)*35+200)*12/4) -> 12423 | S580: =1000*110/100*(1+(55+RC[-16]/10)/200)*100 -> 171930
B581: 1,7,6823,0;1,4,1417,0; | C581: 577 | D581: 1 | E581: 7 | F581: 6823 | G581: 0 | I581: 1 | J581: 4 | K581: 1417 | L581: 0 | O581: ="1,7,"&RC[2]&",0;"&"1,4,"&RC[4]&",0;" -> 1,7,12433,0;1,4,171985,0; | Q581: =INT(((55+RC[-14]/10)*35+200)*12/4) -> 12433 | S581: =1000*110/100*(1+(55+RC[-16]/10)/200)*100 -> 171985
B582: 1,7,6834,0;1,4,1417,0; | C582: 578 | D582: 1 | E582: 7 | F582: 6834 | G582: 0 | I582: 1 | J582: 4 | K582: 1417 | L582: 0 | O582: ="1,7,"&RC[2]&",0;"&"1,4,"&RC[4]&",0;" -> 1,7,12444,0;1,4,172040,0; | Q582: =INT(((55+RC[-14]/10)*35+200)*12/4) -> 12444 | S582: =1000*110/100*(1+(55+RC[-16]/10)/200)*100 -> 172040
B583: 1,7,6844,0;1,4,1418,0; | C583: 579 | D583: 1 | E583: 7 | F583: 6844 | G583: 0 | I583: 1 | J583: 4 | K583: 1418 | L583: 0 | O583: ="1,7,"&RC[2]&",0;"&"1,4,"&RC[4]&",0;" -> 1,7,12454,0;1,4,172095,0; | Q583: =INT(((55+RC[-14]/10)*35+200)*12/4) -> 12454 | S583: =1000*110/100*(1+(55+RC[-16]/10)/200)*100 -> 172095
B584: 1,7,6855,0;1,4,1419,0; | C584: 580 | D584: 1 | E584: 7 | F584: 6855 | G584: 0 | I584: 1 | J584: 4 | K584: 1419 | L584: 0 | O584: ="1,7,"&RC[2]&",0;"&"1,4,"&RC[4]&",0;" -> 1,7,12465,0;1,4,172150,0; | Q584: =INT(((55+RC[-14]/10)*35+200)*12/4) -> 12465 | S584: =1000*110/100*(1+(55+RC[-16]/10)/200)*100 -> 172150
B585: 1,7,6865,0;1,4,1419,0; | C585: 581 | D585: 1 | E585: 7 | F585: 6865 | G585: 0 | I585: 1 | J585: 4 | K585: 1419 | L585: 0 | O585: ="1,7,"&RC[2]&",0;"&"1,4,"&RC[4]&",0;" -> 1,7,12475,0;1,4,172205,0; | Q585: =INT(((55+RC[-14]/10)*35+200)*12/4) -> 12475 | S585: =1000*110/100*(1+(55+RC[-16]/10)/200)*100 -> 172205.00000000003
B586: 1,7,6876,0;1,4,1420,0; | C586: 582 | D586: 1 | E586: 7 | F586: 6876 | G586: 0 | I586: 1 | J586: 4 | K586: 1420 | L586: 0 | O586: ="1,7,"&RC[2]&",0;"&"1,4,"&RC[4]&",0;" -> 1,7,12486,0;1,4,172260,0; | Q586: =INT(((55+RC[-14]/10)*35+200)*12/4) -> 12486 | S586: =1000*110/100*(1+(55+RC[-16]/10)/200)*100 -> 172260
B587: 1,7,6886,0;1,4,1420,0; | C587: 583 | D587: 1 | E587: 7 | F587: 6886 | G587: 0 | I587: 1 | J587: 4 | K587: 1420 | L587: 0 | O587: ="1,7,"&RC[2]&",0;"&"1,4,"&RC[4]&",0;" -> 1,7,12496,0;1,4,172315,0; | Q587: =INT(((55+RC[-14]/10)*35+200)*12/4) -> 12496 | S587: =1000*110/100*(1+(55+RC[-16]/10)/200)*100 -> 172315
B588: 1,7,6897,0;1,4,1421,0; | C588: 584 | D588: 1 | E588: 7 | F588: 6897 | G588: 0 | I588: 1 | J588: 4 | K588: 1421 | L588: 0 | O588: ="1,7,"&RC[2]&",0;"&"1,4,"&RC[4]&",0;" -> 1,7,12507,0;1,4,172370,0; | Q588: =INT(((55+RC[-14]/10)*35+200)*12/4) -> 12507 | S588: =1000*110/100*(1+(55+RC[-16]/10)/200)*100 -> 172370.00000000003
B589: 1,7,6907,0;1,4,1421,0; | C589: 585 | D589: 1 | E589: 7 | F589: 6907 | G589: 0 | I589: 1 | J589: 4 | K589: 1421 | L589: 0 | O589: ="1,7,"&RC[2]&",0;"&"1,4,"&RC[4]&",0;" -> 1,7,12517,0;1,4,172425,0; | Q589: =INT(((55+RC[-14]/10)*35+200)*12/4) -> 12517 | S589: =1000*110/100*(1+(55+RC[-16]/10)/200)*100 -> 172424.99999999997
B590: 1,7,6918,0;1,4,1422,0; | C590: 586 | D590: 1 | E590: 7 | F590: 6918 | G590: 0 | I590: 1 | J590: 4 | K590: 1422 | L590: 0 | O590: ="1,7,"&RC[2]&",0;"&"1,4,"&RC[4]&",0;" -> 1,7,12528,0;1,4,172480,0; | Q590: =INT(((55+RC[-14]/10)*35+200)*12/4) -> 12528 | S590: =1000*110/100*(1+(55+RC[-16]/10)/200)*100 -> 172480
B591: 1,7,6928,0;1,4,1422,0; | C591: 587 | D591: 1 | E591: 7 | F591: 6928 | G591: 0 | I591: 1 | J591: 4 | K591: 1422 | L591: 0 | O591: ="1,7,"&RC[2]&",0;"&"1,4,"&RC[4]&",0;" -> 1,7,12538,0;1,4,172535,0; | Q591: =INT(((55+RC[-14]/10)*35+200)*12/4) -> 12538 | S591: =1000*110/100*(1+(55+RC[-16]/10)/200)*100 -> 172535
B592: 1,7,6939,0;1,4,1423,0; | C592: 588 | D592: 1 | E592: 7 | F592: 6939 | G592: 0 | I592: 1 | J592: 4 | K592: 1423 | L592: 0 | O592: ="1,7,"&RC[2]&",0;"&"1,4,"&RC[4]&",0;" -> 1,7,12549,0;1,4,172590,0; | Q592: =INT(((55+RC[-14]/10)*35+200)*12/4) -> 12549 | S592: =1000*110/100*(1+(55+RC[-16]/10)/200)*100 -> 172590
B593: 1,7,6949,0;1,4,1423,0; | C593: 589 | D593: 1 | E593: 7 | F593: 6949 | G593: 0 | I593: 1 | J593: 4 | K593: 1423 | L593: 0 | O593: ="1,7,"&RC[2]&",0;"&"1,4,"&RC[4]&",0;" -> 1,7,12559,0;1,4,172645,0; | Q593: =INT(((55+RC[-14]/10)*35+200)*12/4) -> 12559 | S593: =1000*110/100*(1+(55+RC[-16]/10)/200)*100 -> 172645
B594: 1,7,6960,0;1,4,1424,0; | C594: 590 | D594: 1 | E594: 7 | F594: 6960 | G594: 0 | I594: 1 | J594: 4 | K594: 1424 | L594: 0 | O594: ="1,7,"&RC[2]&",0;"&"1,4,"&RC[4]&",0;" -> 1,7,12570,0;1,4,172700,0; | Q594: =INT(((55+RC[-14]/10)*35+200)*12/4) -> 12570 | S594: =1000*110/100*(1+(55+RC[-16]/10)/200)*100 -> 172699.99999999997
B595: 1,7,6970,0;1,4,1425,0; | C595: 591 | D595: 1 | E595: 7 | F595: 6970 | G595: 0 | I595: 1 | J595: 4 | K595: 1425 | L595: 0 | O595: ="1,7,"&RC[2]&",0;"&"1,4,"&RC[4]&",0;" -> 1,7,12580,0;1,4,172755,0; | Q595: =INT(((55+RC[-14]/10)*35+200)*12/4) -> 12580 | S595: =1000*110/100*(1+(55+RC[-16]/10)/200)*100 -> 172755
B596: 1,7,6981,0;1,4,1425,0; | C596: 592 | D596: 1 | E596: 7 | F596: 6981 | G596: 0 | I596: 1 | J596: 4 | K596: 1425 | L596: 0 | O596: ="1,7,"&RC[2]&",0;"&"1,4,"&RC[4]&",0;" -> 1,7,12591,0;1,4,172810,0; | Q596: =INT(((55+RC[-14]/10)*35+200)*12/4) -> 12591 | S596: =1000*110/100*(1+(55+RC[-16]/10)/200)*100 -> 172810
B597: 1,7,6991,0;1,4,1426,0; | C597: 593 | D597: 1 | E597: 7 | F597: 6991 | G597: 0 | I597: 1 | J597: 4 | K597: 1426 | L597: 0 | O597: ="1,7,"&RC[2]&",0;"&"1,4,"&RC[4]&",0;" -> 1,7,12601,0;1,4,172865,0; | Q597: =INT(((55+RC[-14]/10)*35+200)*12/4) -> 12601 | S597: =1000*110/100*(1+(55+RC[-16]/10)/200)*100 -> 172865
B598: 1,7,7002,0;1,4,1426,0; | C598: 594 | D598: 1 | E598: 7 | F598: 7002 | G598: 0 | I598: 1 | J598: 4 | K598: 1426 | L598: 0 | O598: ="1,7,"&RC[2]&",0;"&"1,4,"&RC[4]&",0;" -> 1,7,12612,0;1,4,172920,0; | Q598: =INT(((55+RC[-14]/10)*35+200)*12/4) -> 12612 | S598: =1000*110/100*(1+(55+RC[-16]/10)/200)*100 -> 172920
B599: 1,7,7012,0;1,4,1427,0; | C599: 595 | D599: 1 | E599: 7 | F599: 7012 | G599: 0 | I599: 1 | J599: 4 | K599: 1427 | L599: 0 | O599: ="1,7,"&RC[2]&",0;"&"1,4,"&RC[4]&",0;" -> 1,7,12622,0;1,4,172975,0; | Q599: =INT(((55+RC[-14]/10)*35+200)*12/4) -> 12622 | S599: =1000*110/100*(1+(55+RC[-16]/10)/200)*100 -> 172975
B600: 1,7,7023,0;1,4,1427,0; | C600: 596 | D600: 1 | E600: 7 | F600: 7023 | G600: 0 | I600: 1 | J600: 4 | K600: 1427 | L600: 0 | O600: ="1,7,"&RC[2]&",0;"&"1,4,"&RC[4]&",0;" -> 1,7,12633,0;1,4,173030,0; | Q600: =INT(((55+RC[-14]/10)*35+200)*12/4) -> 12633 | S600: =1000*110/100*(1+(55+RC[-16]/10)/200)*100 -> 173030
B601: 1,7,7033,0;1,4,1428,0; | C601: 597 | D601: 1 | E601: 7 | F601: 7033 | G601: 0 | I601: 1 | J601: 4 | K601: 1428 | L601: 0 | O601: ="1,7,"&RC[2]&",0;"&"1,4,"&RC[4]&",0;" -> 1,7,12643,0;1,4,173085,0; | Q601: =INT(((55+RC[-14]/10)*35+200)*12/4) -> 12643 | S601: =1000*110/100*(1+(55+RC[-16]/10)/200)*100 -> 173085
B602: 1,7,7044,0;1,4,1428,0; | C602: 598 | D602: 1 | E602: 7 | F602: 7044 | G602: 0 | I602: 1 | J602: 4 | K602: 1428 | L602: 0 | O602: ="1,7,"&RC[2]&",0;"&"1,4,"&RC[4]&",0;" -> 1,7,12654,0;1,4,173140,0; | Q602: =INT(((55+RC[-14]/10)*35+200)*12/4) -> 12654 | S602: =1000*110/100*(1+(55+RC[-16]/10)/200)*100 -> 173140
B603: 1,7,7054,0;1,4,1429,0; | C603: 599 | D603: 1 | E603: 7 | F603: 7054 | G603: 0 | I603: 1 | J603: 4 | K603: 1429 | L603: 0 | O603: ="1,7,"&RC[2]&",0;"&"1,4,"&RC[4]&",0;" -> 1,7,12664,0;1,4,173195,0; | Q603: =INT(((55+RC[-14]/10)*35+200)*12/4) -> 12664 | S603: =1000*110/100*(1+(55+RC[-16]/10)/200)*100 -> 173195
B604: 1,7,7065,0;1,4,1430,0; | C604: 600 | D604: 1 | E604: 7 | F604: 7065 | G604: 0 | I604: 1 | J604: 4 | K604: 1430 | L604: 0 | O604: ="1,7,"&RC[2]&",0;"&"1,4,"&RC[4]&",0;" -> 1,7,12675,0;1,4,173250,0; | Q604: =INT(((55+RC[-14]/10)*35+200)*12/4) -> 12675 | S604: =1000*110/100*(1+(55+RC[-16]/10)/200)*100 -> 173250
B605: 1,7,7075,0;1,4,1430,0; | C605: 601 | D605: 1 | E605: 7 | F605: 7075 | G605: 0 | I605: 1 | J605: 4 | K605: 1430 | L605: 0 | O605: ="1,7,"&RC[2]&",0;"&"1,4,"&RC[4]&",0;" -> 1,7,12685,0;1,4,173305,0; | Q605: =INT(((55+RC[-14]/10)*35+200)*12/4) -> 12685 | S605: =1000*110/100*(1+(55+RC[-16]/10)/200)*100 -> 173305
B606: 1,7,7086,0;1,4,1431,0; | C606: 602 | D606: 1 | E606: 7 | F606: 7086 | G606: 0 | I606: 1 | J606: 4 | K606: 1431 | L606: 0 | O606: ="1,7,"&RC[2]&",0;"&"1,4,"&RC[4]&",0;" -> 1,7,12696,0;1,4,173360,0; | Q606: =INT(((55+RC[-14]/10)*35+200)*12/4) -> 12696 | S606: =1000*110/100*(1+(55+RC[-16]/10)/200)*100 -> 173360
B607: 1,7,7096,0;1,4,1431,0; | C607: 603 | D607: 1 | E607: 7 | F607: 7096 | G607: 0 | I607: 1 | J607: 4 | K607: 1431 | L607: 0 | O607: ="1,7,"&RC[2]&",0;"&"1,4,"&RC[4]&",0;" -> 1,7,12706,0;1,4,173415,0; | Q607: =INT(((55+RC[-14]/10)*35+200)*12/4) -> 12706 | S607: =1000*110/100*(1+(55+RC[-16]/10)/200)*100 -> 173415
B608: 1,7,7107,0;1,4,1432,0; | C608: 604 | D608: 1 | E608: 7 | F608: 7107 | G608: 0 | I608: 1 | J608: 4 | K608: 1432 | L608: 0 | O608: ="1,7,"&RC[2]&",0;"&"1,4,"&RC[4]&",0;" -> 1,7,12717,0;1,4,173470,0; | Q608: =INT(((55+RC[-14]/10)*35+200)*12/4) -> 12717 | S608: =1000*110/100*(1+(55+RC[-16]/10)/200)*100 -> 173470
B609: 1,7,7117,0;1,4,1432,0; | C609: 605 | D609: 1 | E609: 7 | F609: 7117 | G609: 0 | I609: 1 | J609: 4 | K609: 1432 | L609: 0 | O609: ="1,7,"&RC[2]&",0;"&"1,4,"&RC[4]&",0;" -> 1,7,12727,0;1,4,173525,0; | Q609: =INT(((55+RC[-14]/10)*35+200)*12/4) -> 12727 | S609: =1000*110/100*(1+(55+RC[-16]/10)/200)*100 -> 173525.00000000003
B610: 1,7,7128,0;1,4,1433,0; | C610: 606 | D610: 1 | E610: 7 | F610: 7128 | G610: 0 | I610: 1 | J610: 4 | K610: 1433 | L610: 0 | O610: ="1,7,"&RC[2]&",0;"&"1,4,"&RC[4]&",0;" -> 1,7,12738,0;1,4,173580,0; | Q610: =INT(((55+RC[-14]/10)*35+200)*12/4) -> 12738 | S610: =1000*110/100*(1+(55+RC[-16]/10)/200)*100 -> 173579.99999999997
B611: 1,7,7138,0;1,4,1433,0; | C611: 607 | D611: 1 | E611: 7 | F611: 7138 | G611: 0 | I611: 1 | J611: 4 | K611: 1433 | L611: 0 | O611: ="1,7,"&RC[2]&",0;"&"1,4,"&RC[4]&",0;" -> 1,7,12748,0;1,4,173635,0; | Q611: =INT(((55+RC[-14]/10)*35+200)*12/4) -> 12748 | S611: =1000*110/100*(1+(55+RC[-16]/10)/200)*100 -> 173635
B612: 1,7,7149,0;1,4,1434,0; | C612: 608 | D612: 1 | E612: 7 | F612: 7149 | G612: 0 | I612: 1 | J612: 4 | K612: 1434 | L612: 0 | O612: ="1,7,"&RC[2]&",0;"&"1,4,"&RC[4]&",0;" -> 1,7,12759,0;1,4,173690,0; | Q612: =INT(((55+RC[-14]/10)*35+200)*12/4) -> 12759 | S612: =1000*110/100*(1+(55+RC[-16]/10)/200)*100 -> 173690
B613: 1,7,7159,0;1,4,1434,0; | C613: 609 | D613: 1 | E613: 7 | F613: 7159 | G613: 0 | I613: 1 | J613: 4 | K613: 1434 | L613: 0 | O613: ="1,7,"&RC[2]&",0;"&"1,4,"&RC[4]&",0;" -> 1,7,12769,0;1,4,173745,0; | Q613: =INT(((55+RC[-14]/10)*35+200)*12/4) -> 12769 | S613: =1000*110/100*(1+(55+RC[-16]/10)/200)*100 -> 173744.99999999997
B614: 1,7,7170,0;1,4,1435,0; | C614: 610 | D614: 1 | E614: 7 | F614: 7170 | G614: 0 | I614: 1 | J614: 4 | K614: 1435 | L614: 0 | O614: ="1,7,"&RC[2]&",0;"&"1,4,"&RC[4]&",0;" -> 1,7,12780,0;1,4,173800,0; | Q614: =INT(((55+RC[-14]/10)*35+200)*12/4) -> 12780 | S614: =1000*110/100*(1+(55+RC[-16]/10)/200)*100 -> 173800
B615: 1,7,7180,0;1,4,1436,0; | C615: 611 | D615: 1 | E615: 7 | F615: 7180 | G615: 0 | I615: 1 | J615: 4 | K615: 1436 | L615: 0 | O615: ="1,7,"&RC[2]&",0;"&"1,4,"&RC[4]&",0;" -> 1,7,12790,0;1,4,173855,0; | Q615: =INT(((55+RC[-14]/10)*35+200)*12/4) -> 12790 | S615: =1000*110/100*(1+(55+RC[-16]/10)/200)*100 -> 173855
B616: 1,7,7191,0;1,4,1436,0; | C616: 612 | D616: 1 | E616: 7 | F616: 7191 | G616: 0 | I616: 1 | J616: 4 | K616: 1436 | L616: 0 | O616: ="1,7,"&RC[2]&",0;"&"1,4,"&RC[4]&",0;" -> 1,7,12801,0;1,4,173910,0; | Q616: =INT(((55+RC[-14]/10)*35+200)*12/4) -> 12801 | S616: =1000*110/100*(1+(55+RC[-16]/10)/200)*100 -> 173910
B617: 1,7,7201,0;1,4,1437,0; | C617: 613 | D617: 1 | E617: 7 | F617: 7201 | G617: 0 | I617: 1 | J617: 4 | K617: 1437 | L617: 0 | O617: ="1,7,"&RC[2]&",0;"&"1,4,"&RC[4]&",0;" -> 1,7,12811,0;1,4,173965,0; | Q617: =INT(((55+RC[-14]/10)*35+200)*12/4) -> 12811 | S617: =1000*110/100*(1+(55+RC[-16]/10)/200)*100 -> 173965
B618: 1,7,7212,0;1,4,1437,0; | C618: 614 | D618: 1 | E618: 7 | F618: 7212 | G618: 0 | I618: 1 | J618: 4 | K618: 1437 | L618: 0 | O618: ="1,7,"&RC[2]&",0;"&"1,4,"&RC[4]&",0;" -> 1,7,12822,0;1,4,174020,0; | Q618: =INT(((55+RC[-14]/10)*35+200)*12/4) -> 12822 | S618: =1000*110/100*(1+(55+RC[-16]/10)/200)*100 -> 174020
B619: 1,7,7222,0;1,4,1438,0; | C619: 615 | D619: 1 | E619: 7 | F619: 7222 | G619: 0 | I619: 1 | J619: 4 | K619: 1438 | L619: 0 | O619: ="1,7,"&RC[2]&",0;"&"1,4,"&RC[4]&",0;" -> 1,7,12832,0;1,4,174075,0; | Q619: =INT(((55+RC[-14]/10)*35+200)*12/4) -> 12832 | S619: =1000*110/100*(1+(55+RC[-16]/10)/200)*100 -> 174075
B620: 1,7,7233,0;1,4,1438,0; | C620: 616 | D620: 1 | E620: 7 | F620: 7233 | G620: 0 | I620: 1 | J620: 4 | K620: 1438 | L620: 0 | O620: ="1,7,"&RC[2]&",0;"&"1,4,"&RC[4]&",0;" -> 1,7,12843,0;1,4,174130,0; | Q620: =INT(((55+RC[-14]/10)*35+200)*12/4) -> 12843 | S620: =1000*110/100*(1+(55+RC[-16]/10)/200)*100 -> 174130
B621: 1,7,7243,0;1,4,1439,0; | C621: 617 | D621: 1 | E621: 7 | F621: 7243 | G621: 0 | I621: 1 | J621: 4 | K621: 1439 | L621: 0 | O621: ="1,7,"&RC[2]&",0;"&"1,4,"&RC[4]&",0;" -> 1,7,12853,0;1,4,174185,0; | Q621: =INT(((55+RC[-14]/10)*35+200)*12/4) -> 12853 | S621: =1000*110/100*(1+(55+RC[-16]/10)/200)*100 -> 174185
B622: 1,7,7254,0;1,4,1439,0; | C622: 618 | D622: 1 | E622: 7 | F622: 7254 | G622: 0 | I622: 1 | J622: 4 | K622: 1439 | L622: 0 | O622: ="1,7,"&RC[2]&",0;"&"1,4,"&RC[4]&",0;" -> 1,7,12864,0;1,4,174240,0; | Q622: =INT(((55+RC[-14]/10)*35+200)*12/4) -> 12864 | S622: =1000*110/100*(1+(55+RC[-16]/10)/200)*100 -> 174240
B623: 1,7,7264,0;1,4,1440,0; | C623: 619 | D623: 1 | E623: 7 | F623: 7264 | G623: 0 | I623: 1 | J623: 4 | K623: 1440 | L623: 0 | O623: ="1,7,"&RC[2]&",0;"&"1,4,"&RC[4]&",0;" -> 1,7,12874,0;1,4,174295,0; | Q623: =INT(((55+RC[-14]/10)*35+200)*12/4) -> 12874 | S623: =1000*110/100*(1+(55+RC[-16]/10)/200)*100 -> 174295
B624: 1,7,7275,0;1,4,1441,0; | C624: 620 | D624: 1 | E624: 7 | F624: 7275 | G624: 0 | I624: 1 | J624: 4 | K624: 1441 | L624: 0 | O624: ="1,7,"&RC[2]&",0;"&"1,4,"&RC[4]&",0;" -> 1,7,12885,0;1,4,174350,0; | Q624: =INT(((55+RC[-14]/10)*35+200)*12/4) -> 12885 | S624: =1000*110/100*(1+(55+RC[-16]/10)/200)*100 -> 174350
B625: 1,7,7285,0;1,4,1441,0; | C625: 621 | D625: 1 | E625: 7 | F625: 7285 | G625: 0 | I625: 1 | J625: 4 | K625: 1441 | L625: 0 | O625: ="1,7,"&RC[2]&",0;"&"1,4,"&RC[4]&",0;" -> 1,7,12895,0;1,4,174405,0; | Q625: =INT(((55+RC[-14]/10)*35+200)*12/4) -> 12895 | S625: =1000*110/100*(1+(55+RC[-16]/10)/200)*100 -> 174405.00000000003
B626: 1,7,7296,0;1,4,1442,0; | C626: 622 | D626: 1 | E626: 7 | F626: 7296 | G626: 0 | I626: 1 | J626: 4 | K626: 1442 | L626: 0 | O626: ="1,7,"&RC[2]&",0;"&"1,4,"&RC[4]&",0;" -> 1,7,12906,0;1,4,174460,0; | Q626: =INT(((55+RC[-14]/10)*35+200)*12/4) -> 12906 | S626: =1000*110/100*(1+(55+RC[-16]/10)/200)*100 -> 174460
B627: 1,7,7306,0;1,4,1442,0; | C627: 623 | D627: 1 | E627: 7 | F627: 7306 | G627: 0 | I627: 1 | J627: 4 | K627: 1442 | L627: 0 | O627: ="1,7,"&RC[2]&",0;"&"1,4,"&RC[4]&",0;" -> 1,7,12916,0;1,4,174515,0; | Q627: =INT(((55+RC[-14]/10)*35+200)*12/4) -> 12916 | S627: =1000*110/100*(1+(55+RC[-16]/10)/200)*100 -> 174515
B628: 1,7,7317,0;1,4,1443,0; | C628: 624 | D628: 1 | E628: 7 | F628: 7317 | G628: 0 | I628: 1 | J628: 4 | K628: 1443 | L628: 0 | O628: ="1,7,"&RC[2]&",0;"&"1,4,"&RC[4]&",0;" -> 1,7,12927,0;1,4,174570,0; | Q628: =INT(((55+RC[-14]/10)*35+200)*12/4) -> 12927 | S628: =1000*110/100*(1+(55+RC[-16]/10)/200)*100 -> 174570.00000000003
B629: 1,7,7327,0;1,4,1443,0; | C629: 625 | D629: 1 | E629: 7 | F629: 7327 | G629: 0 | I629: 1 | J629: 4 | K629: 1443 | L629: 0 | O629: ="1,7,"&RC[2]&",0;"&"1,4,"&RC[4]&",0;" -> 1,7,12937,0;1,4,174625,0; | Q629: =INT(((55+RC[-14]/10)*35+200)*12/4) -> 12937 | S629: =1000*110/100*(1+(55+RC[-16]/10)/200)*100 -> 174625
B630: 1,7,7338,0;1,4,1444,0; | C630: 626 | D630: 1 | E630: 7 | F630: 7338 | G630: 0 | I630: 1 | J630: 4 | K630: 1444 | L630: 0 | O630: ="1,7,"&RC[2]&",0;"&"1,4,"&RC[4]&",0;" -> 1,7,12948,0;1,4,174680,0; | Q630: =INT(((55+RC[-14]/10)*35+200)*12/4) -> 12948 | S630: =1000*110/100*(1+(55+RC[-16]/10)/200)*100 -> 174680.00000000003
B631: 1,7,7348,0;1,4,1444,0; | C631: 627 | D631: 1 | E631: 7 | F631: 7348 | G631: 0 | I631: 1 | J631: 4 | K631: 1444 | L631: 0 | O631: ="1,7,"&RC[2]&",0;"&"1,4,"&RC[4]&",0;" -> 1,7,12958,0;1,4,174735,0; | Q631: =INT(((55+RC[-14]/10)*35+200)*12/4) -> 12958 | S631: =1000*110/100*(1+(55+RC[-16]/10)/200)*100 -> 174735
B632: 1,7,7359,0;1,4,1445,0; | C632: 628 | D632: 1 | E632: 7 | F632: 7359 | G632: 0 | I632: 1 | J632: 4 | K632: 1445 | L632: 0 | O632: ="1,7,"&RC[2]&",0;"&"1,4,"&RC[4]&",0;" -> 1,7,12969,0;1,4,174790,0; | Q632: =INT(((55+RC[-14]/10)*35+200)*12/4) -> 12969 | S632: =1000*110/100*(1+(55+RC[-16]/10)/200)*100 -> 174790
B633: 1,7,7369,0;1,4,1445,0; | C633: 629 | D633: 1 | E633: 7 | F633: 7369 | G633: 0 | I633: 1 | J633: 4 | K633: 1445 | L633: 0 | O633: ="1,7,"&RC[2]&",0;"&"1,4,"&RC[4]&",0;" -> 1,7,12979,0;1,4,174845,0; | Q633: =INT(((55+RC[-14]/10)*35+200)*12/4) -> 12979 | S633: =1000*110/100*(1+(55+RC[-16]/10)/200)*100 -> 174845
B634: 1,7,7380,0;1,4,1446,0; | C634: 630 | D634: 1 | E634: 7 | F634: 7380 | G634: 0 | I634: 1 | J634: 4 | K634: 1446 | L634: 0 | O634: ="1,7,"&RC[2]&",0;"&"1,4,"&RC[4]&",0;" -> 1,7,12990,0;1,4,174900,0; | Q634: =INT(((55+RC[-14]/10)*35+200)*12/4) -> 12990 | S634: =1000*110/100*(1+(55+RC[-16]/10)/200)*100 -> 174899.99999999997
B635: 1,7,7390,0;1,4,1447,0; | C635: 631 | D635: 1 | E635: 7 | F635: 7390 | G635: 0 | I635: 1 | J635: 4 | K635: 1447 | L635: 0 | O635: ="1,7,"&RC[2]&",0;"&"1,4,"&RC[4]&",0;" -> 1,7,13000,0;1,4,174955,0; | Q635: =INT(((55+RC[-14]/10)*35+200)*12/4) -> 13000 | S635: =1000*110/100*(1+(55+RC[-16]/10)/200)*100 -> 174955
B636: 1,7,7401,0;1,4,1447,0; | C636: 632 | D636: 1 | E636: 7 | F636: 7401 | G636: 0 | I636: 1 | J636: 4 | K636: 1447 | L636: 0 | O636: ="1,7,"&RC[2]&",0;"&"1,4,"&RC[4]&",0;" -> 1,7,13011,0;1,4,175010,0; | Q636: =INT(((55+RC[-14]/10)*35+200)*12/4) -> 13011 | S636: =1000*110/100*(1+(55+RC[-16]/10)/200)*100 -> 175010
B637: 1,7,7411,0;1,4,1448,0; | C637: 633 | D637: 1 | E637: 7 | F637: 7411 | G637: 0 | I637: 1 | J637: 4 | K637: 1448 | L637: 0 | O637: ="1,7,"&RC[2]&",0;"&"1,4,"&RC[4]&",0;" -> 1,7,13021,0;1,4,175065,0; | Q637: =INT(((55+RC[-14]/10)*35+200)*12/4) -> 13021 | S637: =1000*110/100*(1+(55+RC[-16]/10)/200)*100 -> 175065
B638: 1,7,7422,0;1,4,1448,0; | C638: 634 | D638: 1 | E638: 7 | F638: 7422 | G638: 0 | I638: 1 | J638: 4 | K638: 1448 | L638: 0 | O638: ="1,7,"&RC[2]&",0;"&"1,4,"&RC[4]&",0;" -> 1,7,13032,0;1,4,175120,0; | Q638: =INT(((55+RC[-14]/10)*35+200)*12/4) -> 13032 | S638: =1000*110/100*(1+(55+RC[-16]/10)/200)*100 -> 175120
B639: 1,7,7432,0;1,4,1449,0; | C639: 635 | D639: 1 | E639: 7 | F639: 7432 | G639: 0 | I639: 1 | J639: 4 | K639: 1449 | L639: 0 | O639: ="1,7,"&RC[2]&",0;"&"1,4,"&RC[4]&",0;" -> 1,7,13042,0;1,4,175175,0; | Q639: =INT(((55+RC[-14]/10)*35+200)*12/4) -> 13042 | S639: =1000*110/100*(1+(55+RC[-16]/10)/200)*100 -> 175175
B640: 1,7,7443,0;1,4,1449,0; | C640: 636 | D640: 1 | E640: 7 | F640: 7443 | G640: 0 | I640: 1 | J640: 4 | K640: 1449 | L640: 0 | O640: ="1,7,"&RC[2]&",0;"&"1,4,"&RC[4]&",0;" -> 1,7,13053,0;1,4,175230,0; | Q640: =INT(((55+RC[-14]/10)*35+200)*12/4) -> 13053 | S640: =1000*110/100*(1+(55+RC[-16]/10)/200)*100 -> 175230
B641: 1,7,7453,0;1,4,1450,0; | C641: 637 | D641: 1 | E641: 7 | F641: 7453 | G641: 0 | I641: 1 | J641: 4 | K641: 1450 | L641: 0 | O641: ="1,7,"&RC[2]&",0;"&"1,4,"&RC[4]&",0;" -> 1,7,13063,0;1,4,175285,0; | Q641: =INT(((55+RC[-14]/10)*35+200)*12/4) -> 13063 | S641: =1000*110/100*(1+(55+RC[-16]/10)/200)*100 -> 175285
B642: 1,7,7464,0;1,4,1450,0; | C642: 638 | D642: 1 | E642: 7 | F642: 7464 | G642: 0 | I642: 1 | J642: 4 | K642: 1450 | L642: 0 | O642: ="1,7,"&RC[2]&",0;"&"1,4,"&RC[4]&",0;" -> 1,7,13074,0;1,4,175340,0; | Q642: =INT(((55+RC[-14]/10)*35+200)*12/4) -> 13074 | S642: =1000*110/100*(1+(55+RC[-16]/10)/200)*100 -> 175340
B643: 1,7,7474,0;1,4,1451,0; | C643: 639 | D643: 1 | E643: 7 | F643: 7474 | G643: 0 | I643: 1 | J643: 4 | K643: 1451 | L643: 0 | O643: ="1,7,"&RC[2]&",0;"&"1,4,"&RC[4]&",0;" -> 1,7,13084,0;1,4,175395,0; | Q643: =INT(((55+RC[-14]/10)*35+200)*12/4) -> 13084 | S643: =1000*110/100*(1+(55+RC[-16]/10)/200)*100 -> 175395
B644: 1,7,7485,0;1,4,1452,0; | C644: 640 | D644: 1 | E644: 7 | F644: 7485 | G644: 0 | I644: 1 | J644: 4 | K644: 1452 | L644: 0 | O644: ="1,7,"&RC[2]&",0;"&"1,4,"&RC[4]&",0;" -> 1,7,13095,0;1,4,175450,0; | Q644: =INT(((55+RC[-14]/10)*35+200)*12/4) -> 13095 | S644: =1000*110/100*(1+(55+RC[-16]/10)/200)*100 -> 175450
B645: 1,7,7495,0;1,4,1452,0; | C645: 641 | D645: 1 | E645: 7 | F645: 7495 | G645: 0 | I645: 1 | J645: 4 | K645: 1452 | L645: 0 | O645: ="1,7,"&RC[2]&",0;"&"1,4,"&RC[4]&",0;" -> 1,7,13105,0;1,4,175505,0; | Q645: =INT(((55+RC[-14]/10)*35+200)*12/4) -> 13105 | S645: =1000*110/100*(1+(55+RC[-16]/10)/200)*100 -> 175505
B646: 1,7,7506,0;1,4,1453,0; | C646: 642 | D646: 1 | E646: 7 | F646: 7506 | G646: 0 | I646: 1 | J646: 4 | K646: 1453 | L646: 0 | O646: ="1,7,"&RC[2]&",0;"&"1,4,"&RC[4]&",0;" -> 1,7,13116,0;1,4,175560,0; | Q646: =INT(((55+RC[-14]/10)*35+200)*12/4) -> 13116 | S646: =1000*110/100*(1+(55+RC[-16]/10)/200)*100 -> 175560
B647: 1,7,7516,0;1,4,1453,0; | C647: 643 | D647: 1 | E647: 7 | F647: 7516 | G647: 0 | I647: 1 | J647: 4 | K647: 1453 | L647: 0 | O647: ="1,7,"&RC[2]&",0;"&"1,4,"&RC[4]&",0;" -> 1,7,13126,0;1,4,175615,0; | Q647: =INT(((55+RC[-14]/10)*35+200)*12/4) -> 13126 | S647: =1000*110/100*(1+(55+RC[-16]/10)/200)*100 -> 175615
B648: 1,7,7527,0;1,4,1454,0; | C648: 644 | D648: 1 | E648: 7 | F648: 7527 | G648: 0 | I648: 1 | J648: 4 | K648: 1454 | L648: 0 | O648: ="1,7,"&RC[2]&",0;"&"1,4,"&RC[4]&",0;" -> 1,7,13137,0;1,4,175670,0; | Q648: =INT(((55+RC[-14]/10)*35+200)*12/4) -> 13137 | S648: =1000*110/100*(1+(55+RC[-16]/10)/200)*100 -> 175670
B649: 1,7,7537,0;1,4,1454,0; | C649: 645 | D649: 1 | E649: 7 | F649: 7537 | G649: 0 | I649: 1 | J649: 4 | K649: 1454 | L649: 0 | O649: ="1,7,"&RC[2]&",0;"&"1,4,"&RC[4]&",0;" -> 1,7,13147,0;1,4,175725,0; | Q649: =INT(((55+RC[-14]/10)*35+200)*12/4) -> 13147 | S649: =1000*110/100*(1+(55+RC[-16]/10)/200)*100 -> 175725.00000000003
B650: 1,7,7548,0;1,4,1455,0; | C650: 646 | D650: 1 | E650: 7 | F650: 7548 | G650: 0 | I650: 1 | J650: 4 | K650: 1455 | L650: 0 | O650: ="1,7,"&RC[2]&",0;"&"1,4,"&RC[4]&",0;" -> 1,7,13158,0;1,4,175780,0; | Q650: =INT(((55+RC[-14]/10)*35+200)*12/4) -> 13158 | S650: =1000*110/100*(1+(55+RC[-16]/10)/200)*100 -> 175780
B651: 1,7,7558,0;1,4,1455,0; | C651: 647 | D651: 1 | E651: 7 | F651: 7558 | G651: 0 | I651: 1 | J651: 4 | K651: 1455 | L651: 0 | O651: ="1,7,"&RC[2]&",0;"&"1,4,"&RC[4]&",0;" -> 1,7,13168,0;1,4,175835,0; | Q651: =INT(((55+RC[-14]/10)*35+200)*12/4) -> 13168 | S651: =1000*110/100*(1+(55+RC[-16]/10)/200)*100 -> 175835
B652: 1,7,7569,0;1,4,1456,0; | C652: 648 | D652: 1 | E652: 7 | F652: 7569 | G652: 0 | I652: 1 | J652: 4 | K652: 1456 | L652: 0 | O652: ="1,7,"&RC[2]&",0;"&"1,4,"&RC[4]&",0;" -> 1,7,13179,0;1,4,175890,0; | Q652: =INT(((55+RC[-14]/10)*35+200)*12/4) -> 13179 | S652: =1000*110/100*(1+(55+RC[-16]/10)/200)*100 -> 175890
B653: 1,7,7579,0;1,4,1456,0; | C653: 649 | D653: 1 | E653: 7 | F653: 7579 | G653: 0 | I653: 1 | J653: 4 | K653: 1456 | L653: 0 | O653: ="1,7,"&RC[2]&",0;"&"1,4,"&RC[4]&",0;" -> 1,7,13189,0;1,4,175945,0; | Q653: =INT(((55+RC[-14]/10)*35+200)*12/4) -> 13189 | S653: =1000*110/100*(1+(55+RC[-16]/10)/200)*100 -> 175944.99999999997
B654: 1,7,7590,0;1,4,1457,0; | C654: 650 | D654: 1 | E654: 7 | F654: 7590 | G654: 0 | I654: 1 | J654: 4 | K654: 1457 | L654: 0 | O654: ="1,7,"&RC[2]&",0;"&"1,4,"&RC[4]&",0;" -> 1,7,13200,0;1,4,176000,0; | Q654: =INT(((55+RC[-14]/10)*35+200)*12/4) -> 13200 | S654: =1000*110/100*(1+(55+RC[-16]/10)/200)*100 -> 176000
B655: 1,7,7600,0;1,4,1458,0; | C655: 651 | D655: 1 | E655: 7 | F655: 7600 | G655: 0 | I655: 1 | J655: 4 | K655: 1458 | L655: 0 | O655: ="1,7,"&RC[2]&",0;"&"1,4,"&RC[4]&",0;" -> 1,7,13210,0;1,4,176055,0; | Q655: =INT(((55+RC[-14]/10)*35+200)*12/4) -> 13210 | S655: =1000*110/100*(1+(55+RC[-16]/10)/200)*100 -> 176054.99999999997
B656: 1,7,7611,0;1,4,1458,0; | C656: 652 | D656: 1 | E656: 7 | F656: 7611 | G656: 0 | I656: 1 | J656: 4 | K656: 1458 | L656: 0 | O656: ="1,7,"&RC[2]&",0;"&"1,4,"&RC[4]&",0;" -> 1,7,13221,0;1,4,176110,0; | Q656: =INT(((55+RC[-14]/10)*35+200)*12/4) -> 13221 | S656: =1000*110/100*(1+(55+RC[-16]/10)/200)*100 -> 176110
B657: 1,7,7621,0;1,4,1459,0; | C657: 653 | D657: 1 | E657: 7 | F657: 7621 | G657: 0 | I657: 1 | J657: 4 | K657: 1459 | L657: 0 | O657: ="1,7,"&RC[2]&",0;"&"1,4,"&RC[4]&",0;" -> 1,7,13231,0;1,4,176165,0; | Q657: =INT(((55+RC[-14]/10)*35+200)*12/4) -> 13231 | S657: =1000*110/100*(1+(55+RC[-16]/10)/200)*100 -> 176165
B658: 1,7,7632,0;1,4,1459,0; | C658: 654 | D658: 1 | E658: 7 | F658: 7632 | G658: 0 | I658: 1 | J658: 4 | K658: 1459 | L658: 0 | O658: ="1,7,"&RC[2]&",0;"&"1,4,"&RC[4]&",0;" -> 1,7,13242,0;1,4,176220,0; | Q658: =INT(((55+RC[-14]/10)*35+200)*12/4) -> 13242 | S658: =1000*110/100*(1+(55+RC[-16]/10)/200)*100 -> 176219.99999999997
B659: 1,7,7642,0;1,4,1460,0; | C659: 655 | D659: 1 | E659: 7 | F659: 7642 | G659: 0 | I659: 1 | J659: 4 | K659: 1460 | L659: 0 | O659: ="1,7,"&RC[2]&",0;"&"1,4,"&RC[4]&",0;" -> 1,7,13252,0;1,4,176275,0; | Q659: =INT(((55+RC[-14]/10)*35+200)*12/4) -> 13252 | S659: =1000*110/100*(1+(55+RC[-16]/10)/200)*100 -> 176275
B660: 1,7,7653,0;1,4,1460,0; | C660: 656 | D660: 1 | E660: 7 | F660: 7653 | G660: 0 | I660: 1 | J660: 4 | K660: 1460 | L660: 0 | O660: ="1,7,"&RC[2]&",0;"&"1,4,"&RC[4]&",0;" -> 1,7,13263,0;1,4,176330,0; | Q660: =INT(((55+RC[-14]/10)*35+200)*12/4) -> 13263 | S660: =1000*110/100*(1+(55+RC[-16]/10)/200)*100 -> 176330
B661: 1,7,7663,0;1,4,1461,0; | C661: 657 | D661: 1 | E661: 7 | F661: 7663 | G661: 0 | I661: 1 | J661: 4 | K661: 1461 | L661: 0 | O661: ="1,7,"&RC[2]&",0;"&"1,4,"&RC[4]&",0;" -> 1,7,13273,0;1,4,176385,0; | Q661: =INT(((55+RC[-14]/10)*35+200)*12/4) -> 13273 | S661: =1000*110/100*(1+(55+RC[-16]/10)/200)*100 -> 176385
B662: 1,7,7674,0;1,4,1461,0; | C662: 658 | D662: 1 | E662: 7 | F662: 7674 | G662: 0 | I662: 1 | J662: 4 | K662: 1461 | L662: 0 | O662: ="1,7,"&RC[2]&",0;"&"1,4,"&RC[4]&",0;" -> 1,7,13284,0;1,4,176440,0; | Q662: =INT(((55+RC[-14]/10)*35+200)*12/4) -> 13284 | S662: =1000*110/100*(1+(55+RC[-16]/10)/200)*100 -> 176440
B663: 1,7,7684,0;1,4,1462,0; | C663: 659 | D663: 1 | E663: 7 | F663: 7684 | G663: 0 | I663: 1 | J663: 4 | K663: 1462 | L663: 0 | O663: ="1,7,"&RC[2]&",0;"&"1,4,"&RC[4]&",0;" -> 1,7,13294,0;1,4,176495,0; | Q663: =INT(((55+RC[-14]/10)*35+200)*12/4) -> 13294 | S663: =1000*110/100*(1+(55+RC[-16]/10)/200)*100 -> 176495
B664: 1,7,7695,0;1,4,1463,0; | C664: 660 | D664: 1 | E664: 7 | F664: 7695 | G664: 0 | I664: 1 | J664: 4 | K664: 1463 | L664: 0 | O664: ="1,7,"&RC[2]&",0;"&"1,4,"&RC[4]&",0;" -> 1,7,13305,0;1,4,176550,0; | Q664: =INT(((55+RC[-14]/10)*35+200)*12/4) -> 13305 | S664: =1000*110/100*(1+(55+RC[-16]/10)/200)*100 -> 176550
B665: 1,7,7705,0;1,4,1463,0; | C665: 661 | D665: 1 | E665: 7 | F665: 7705 | G665: 0 | I665: 1 | J665: 4 | K665: 1463 | L665: 0 | O665: ="1,7,"&RC[2]&",0;"&"1,4,"&RC[4]&",0;" -> 1,7,13315,0;1,4,176605,0; | Q665: =INT(((55+RC[-14]/10)*35+200)*12/4) -> 13315 | S665: =1000*110/100*(1+(55+RC[-16]/10)/200)*100 -> 176605
B666: 1,7,7716,0;1,4,1464,0; | C666: 662 | D666: 1 | E666: 7 | F666: 7716 | G666: 0 | I666: 1 | J666: 4 | K666: 1464 | L666: 0 | O666: ="1,7,"&RC[2]&",0;"&"1,4,"&RC[4]&",0;" -> 1,7,13326,0;1,4,176660,0; | Q666: =INT(((55+RC[-14]/10)*35+200)*12/4) -> 13326 | S666: =1000*110/100*(1+(55+RC[-16]/10)/200)*100 -> 176660
B667: 1,7,7726,0;1,4,1464,0; | C667: 663 | D667: 1 | E667: 7 | F667: 7726 | G667: 0 | I667: 1 | J667: 4 | K667: 1464 | L667: 0 | O667: ="1,7,"&RC[2]&",0;"&"1,4,"&RC[4]&",0;" -> 1,7,13336,0;1,4,176715,0; | Q667: =INT(((55+RC[-14]/10)*35+200)*12/4) -> 13336 | S667: =1000*110/100*(1+(55+RC[-16]/10)/200)*100 -> 176715
B668: 1,7,7737,0;1,4,1465,0; | C668: 664 | D668: 1 | E668: 7 | F668: 7737 | G668: 0 | I668: 1 | J668: 4 | K668: 1465 | L668: 0 | O668: ="1,7,"&RC[2]&",0;"&"1,4,"&RC[4]&",0;" -> 1,7,13347,0;1,4,176770,0; | Q668: =INT(((55+RC[-14]/10)*35+200)*12/4) -> 13347 | S668: =1000*110/100*(1+(55+RC[-16]/10)/200)*100 -> 176770
B669: 1,7,7747,0;1,4,1465,0; | C669: 665 | D669: 1 | E669: 7 | F669: 7747 | G669: 0 | I669: 1 | J669: 4 | K669: 1465 | L669: 0 | O669: ="1,7,"&RC[2]&",0;"&"1,4,"&RC[4]&",0;" -> 1,7,13357,0;1,4,176825,0; | Q669: =INT(((55+RC[-14]/10)*35+200)*12/4) -> 13357 | S669: =1000*110/100*(1+(55+RC[-16]/10)/200)*100 -> 176825
B670: 1,7,7758,0;1,4,1466,0; | C670: 666 | D670: 1 | E670: 7 | F670: 7758 | G670: 0 | I670: 1 | J670: 4 | K670: 1466 | L670: 0 | O670: ="1,7,"&RC[2]&",0;"&"1,4,"&RC[4]&",0;" -> 1,7,13368,0;1,4,176880,0; | Q670: =INT(((55+RC[-14]/10)*35+200)*12/4) -> 13368 | S670: =1000*110/100*(1+(55+RC[-16]/10)/200)*100 -> 176880.00000000003
B671: 1,7,7768,0;1,4,1466,0; | C671: 667 | D671: 1 | E671: 7 | F671: 7768 | G671: 0 | I671: 1 | J671: 4 | K671: 1466 | L671: 0 | O671: ="1,7,"&RC[2]&",0;"&"1,4,"&RC[4]&",0;" -> 1,7,13378,0;1,4,176935,0; | Q671: =INT(((55+RC[-14]/10)*35+200)*12/4) -> 13378 | S671: =1000*110/100*(1+(55+RC[-16]/10)/200)*100 -> 176935
B672: 1,7,7779,0;1,4,1467,0; | C672: 668 | D672: 1 | E672: 7 | F672: 7779 | G672: 0 | I672: 1 | J672: 4 | K672: 1467 | L672: 0 | O672: ="1,7,"&RC[2]&",0;"&"1,4,"&RC[4]&",0;" -> 1,7,13389,0;1,4,176990,0; | Q672: =INT(((55+RC[-14]/10)*35+200)*12/4) -> 13389 | S672: =1000*110/100*(1+(55+RC[-16]/10)/200)*100 -> 176990
B673: 1,7,7789,0;1,4,1467,0; | C673: 669 | D673: 1 | E673: 7 | F673: 7789 | G673: 0 | I673: 1 | J673: 4 | K673: 1467 | L673: 0 | O673: ="1,7,"&RC[2]&",0;"&"1,4,"&RC[4]&",0;" -> 1,7,13399,0;1,4,177045,0; | Q673: =INT(((55+RC[-14]/10)*35+200)*12/4) -> 13399 | S673: =1000*110/100*(1+(55+RC[-16]/10)/200)*100 -> 177045.00000000003
B674: 1,7,7800,0;1,4,1468,0; | C674: 670 | D674: 1 | E674: 7 | F674: 7800 | G674: 0 | I674: 1 | J674: 4 | K674: 1468 | L674: 0 | O674: ="1,7,"&RC[2]&",0;"&"1,4,"&RC[4]&",0;" -> 1,7,13410,0;1,4,177100,0; | Q674: =INT(((55+RC[-14]/10)*35+200)*12/4) -> 13410 | S674: =1000*110/100*(1+(55+RC[-16]/10)/200)*100 -> 177099.99999999997
B675: 1,7,7810,0;1,4,1469,0; | C675: 671 | D675: 1 | E675: 7 | F675: 7810 | G675: 0 | I675: 1 | J675: 4 | K675: 1469 | L675: 0 | O675: ="1,7,"&RC[2]&",0;"&"1,4,"&RC[4]&",0;" -> 1,7,13420,0;1,4,177155,0; | Q675: =INT(((55+RC[-14]/10)*35+200)*12/4) -> 13420 | S675: =1000*110/100*(1+(55+RC[-16]/10)/200)*100 -> 177155
B676: 1,7,7821,0;1,4,1469,0; | C676: 672 | D676: 1 | E676: 7 | F676: 7821 | G676: 0 | I676: 1 | J676: 4 | K676: 1469 | L676: 0 | O676: ="1,7,"&RC[2]&",0;"&"1,4,"&RC[4]&",0;" -> 1,7,13431,0;1,4,177210,0; | Q676: =INT(((55+RC[-14]/10)*35+200)*12/4) -> 13431 | S676: =1000*110/100*(1+(55+RC[-16]/10)/200)*100 -> 177210
B677: 1,7,7831,0;1,4,1470,0; | C677: 673 | D677: 1 | E677: 7 | F677: 7831 | G677: 0 | I677: 1 | J677: 4 | K677: 1470 | L677: 0 | O677: ="1,7,"&RC[2]&",0;"&"1,4,"&RC[4]&",0;" -> 1,7,13441,0;1,4,177265,0; | Q677: =INT(((55+RC[-14]/10)*35+200)*12/4) -> 13441 | S677: =1000*110/100*(1+(55+RC[-16]/10)/200)*100 -> 177265
B678: 1,7,7842,0;1,4,1470,0; | C678: 674 | D678: 1 | E678: 7 | F678: 7842 | G678: 0 | I678: 1 | J678: 4 | K678: 1470 | L678: 0 | O678: ="1,7,"&RC[2]&",0;"&"1,4,"&RC[4]&",0;" -> 1,7,13452,0;1,4,177320,0; | Q678: =INT(((55+RC[-14]/10)*35+200)*12/4) -> 13452 | S678: =1000*110/100*(1+(55+RC[-16]/10)/200)*100 -> 177320
B679: 1,7,7852,0;1,4,1471,0; | C679: 675 | D679: 1 | E679: 7 | F679: 7852 | G679: 0 | I679: 1 | J679: 4 | K679: 1471 | L679: 0 | O679: ="1,7,"&RC[2]&",0;"&"1,4,"&RC[4]&",0;" -> 1,7,13462,0;1,4,177375,0; | Q679: =INT(((55+RC[-14]/10)*35+200)*12/4) -> 13462 | S679: =1000*110/100*(1+(55+RC[-16]/10)/200)*100 -> 177375
B680: 1,7,7863,0;1,4,1471,0; | C680: 676 | D680: 1 | E680: 7 | F680: 7863 | G680: 0 | I680: 1 | J680: 4 | K680: 1471 | L680: 0 | O680: ="1,7,"&RC[2]&",0;"&"1,4,"&RC[4]&",0;" -> 1,7,13473,0;1,4,177430,0; | Q680: =INT(((55+RC[-14]/10)*35+200)*12/4) -> 13473 | S680: =1000*110/100*(1+(55+RC[-16]/10)/200)*100 -> 177430
B681: 1,7,7873,0;1,4,1472,0; | C681: 677 | D681: 1 | E681: 7 | F681: 7873 | G681: 0 | I681: 1 | J681: 4 | K681: 1472 | L681: 0 | O681: ="1,7,"&RC[2]&",0;"&"1,4,"&RC[4]&",0;" -> 1,7,13483,0;1,4,177485,0; | Q681: =INT(((55+RC[-14]/10)*35+200)*12/4) -> 13483 | S681: =1000*110/100*(1+(55+RC[-16]/10)/200)*100 -> 177485
B682: 1,7,7884,0;1,4,1472,0; | C682: 678 | D682: 1 | E682: 7 | F682: 7884 | G682: 0 | I682: 1 | J682: 4 | K682: 1472 | L682: 0 | O682: ="1,7,"&RC[2]&",0;"&"1,4,"&RC[4]&",0;" -> 1,7,13494,0;1,4,177540,0; | Q682: =INT(((55+RC[-14]/10)*35+200)*12/4) -> 13494 | S682: =1000*110/100*(1+(55+RC[-16]/10)/200)*100 -> 177540
B683: 1,7,7894,0;1,4,1473,0; | C683: 679 | D683: 1 | E683: 7 | F683: 7894 | G683: 0 | I683: 1 | J683: 4 | K683: 1473 | L683: 0 | O683: ="1,7,"&RC[2]&",0;"&"1,4,"&RC[4]&",0;" -> 1,7,13504,0;1,4,177595,0; | Q683: =INT(((55+RC[-14]/10)*35+200)*12/4) -> 13504 | S683: =1000*110/100*(1+(55+RC[-16]/10)/200)*100 -> 177595
B684: 1,7,7905,0;1,4,1474,0; | C684: 680 | D684: 1 | E684: 7 | F684: 7905 | G684: 0 | I684: 1 | J684: 4 | K684: 1474 | L684: 0 | O684: ="1,7,"&RC[2]&",0;"&"1,4,"&RC[4]&",0;" -> 1,7,13515,0;1,4,177650,0; | Q684: =INT(((55+RC[-14]/10)*35+200)*12/4) -> 13515 | S684: =1000*110/100*(1+(55+RC[-16]/10)/200)*100 -> 177650
B685: 1,7,7915,0;1,4,1474,0; | C685: 681 | D685: 1 | E685: 7 | F685: 7915 | G685: 0 | I685: 1 | J685: 4 | K685: 1474 | L685: 0 | O685: ="1,7,"&RC[2]&",0;"&"1,4,"&RC[4]&",0;" -> 1,7,13525,0;1,4,177705,0; | Q685: =INT(((55+RC[-14]/10)*35+200)*12/4) -> 13525 | S685: =1000*110/100*(1+(55+RC[-16]/10)/200)*100 -> 177705
B686: 1,7,7926,0;1,4,1475,0; | C686: 682 | D686: 1 | E686: 7 | F686: 7926 | G686: 0 | I686: 1 | J686: 4 | K686: 1475 | L686: 0 | O686: ="1,7,"&RC[2]&",0;"&"1,4,"&RC[4]&",0;" -> 1,7,13536,0;1,4,177760,0; | Q686: =INT(((55+RC[-14]/10)*35+200)*12/4) -> 13536 | S686: =1000*110/100*(1+(55+RC[-16]/10)/200)*100 -> 177760
B687: 1,7,7936,0;1,4,1475,0; | C687: 683 | D687: 1 | E687: 7 | F687: 7936 | G687: 0 | I687: 1 | J687: 4 | K687: 1475 | L687: 0 | O687: ="1,7,"&RC[2]&",0;"&"1,4,"&RC[4]&",0;" -> 1,7,13546,0;1,4,177815,0; | Q687: =INT(((55+RC[-14]/10)*35+200)*12/4) -> 13546 | S687: =1000*110/100*(1+(55+RC[-16]/10)/200)*100 -> 177815
B688: 1,7,7947,0;1,4,1476,0; | C688: 684 | D688: 1 | E688: 7 | F688: 7947 | G688: 0 | I688: 1 | J688: 4 | K688: 1476 | L688: 0 | O688: ="1,7,"&RC[2]&",0;"&"1,4,"&RC[4]&",0;" -> 1,7,13557,0;1,4,177870,0; | Q688: =INT(((55+RC[-14]/10)*35+200)*12/4) -> 13557 | S688: =1000*110/100*(1+(55+RC[-16]/10)/200)*100 -> 177870
B689: 1,7,7957,0;1,4,1476,0; | C689: 685 | D689: 1 | E689: 7 | F689: 7957 | G689: 0 | I689: 1 | J689: 4 | K689: 1476 | L689: 0 | O689: ="1,7,"&RC[2]&",0;"&"1,4,"&RC[4]&",0;" -> 1,7,13567,0;1,4,177925,0; | Q689: =INT(((55+RC[-14]/10)*35+200)*12/4) -> 13567 | S689: =1000*110/100*(1+(55+RC[-16]/10)/200)*100 -> 177925.00000000003
B690: 1,7,7968,0;1,4,1477,0; | C690: 686 | D690: 1 | E690: 7 | F690: 7968 | G690: 0 | I690: 1 | J690: 4 | K690: 1477 | L690: 0 | O690: ="1,7,"&RC[2]&",0;"&"1,4,"&RC[4]&",0;" -> 1,7,13578,0;1,4,177980,0; | Q690: =INT(((55+RC[-14]/10)*35+200)*12/4) -> 13578 | S690: =1000*110/100*(1+(55+RC[-16]/10)/200)*100 -> 177980
B691: 1,7,7978,0;1,4,1477,0; | C691: 687 | D691: 1 | E691: 7 | F691: 7978 | G691: 0 | I691: 1 | J691: 4 | K691: 1477 | L691: 0 | O691: ="1,7,"&RC[2]&",0;"&"1,4,"&RC[4]&",0;" -> 1,7,13588,0;1,4,178035,0; | Q691: =INT(((55+RC[-14]/10)*35+200)*12/4) -> 13588 | S691: =1000*110/100*(1+(55+RC[-16]/10)/200)*100 -> 178035
B692: 1,7,7989,0;1,4,1478,0; | C692: 688 | D692: 1 | E692: 7 | F692: 7989 | G692: 0 | I692: 1 | J692: 4 | K692: 1478 | L692: 0 | O692: ="1,7,"&RC[2]&",0;"&"1,4,"&RC[4]&",0;" -> 1,7,13599,0;1,4,178090,0; | Q692: =INT(((55+RC[-14]/10)*35+200)*12/4) -> 13599 | S692: =1000*110/100*(1+(55+RC[-16]/10)/200)*100 -> 178090
B693: 1,7,7999,0;1,4,1478,0; | C693: 689 | D693: 1 | E693: 7 | F693: 7999 | G693: 0 | I693: 1 | J693: 4 | K693: 1478 | L693: 0 | O693: ="1,7,"&RC[2]&",0;"&"1,4,"&RC[4]&",0;" -> 1,7,13609,0;1,4,178145,0; | Q693: =INT(((55+RC[-14]/10)*35+200)*12/4) -> 13609 | S693: =1000*110/100*(1+(55+RC[-16]/10)/200)*100 -> 178145
B694: 1,7,8010,0;1,4,1479,0; | C694: 690 | D694: 1 | E694: 7 | F694: 8010 | G694: 0 | I694: 1 | J694: 4 | K694: 1479 | L694: 0 | O694: ="1,7,"&RC[2]&",0;"&"1,4,"&RC[4]&",0;" -> 1,7,13620,0;1,4,178200,0; | Q694: =INT(((55+RC[-14]/10)*35+200)*12/4) -> 13620 | S694: =1000*110/100*(1+(55+RC[-16]/10)/200)*100 -> 178200.00000000003
B695: 1,7,8020,0;1,4,1480,0; | C695: 691 | D695: 1 | E695: 7 | F695: 8020 | G695: 0 | I695: 1 | J695: 4 | K695: 1480 | L695: 0 | O695: ="1,7,"&RC[2]&",0;"&"1,4,"&RC[4]&",0;" -> 1,7,13630,0;1,4,178255,0; | Q695: =INT(((55+RC[-14]/10)*35+200)*12/4) -> 13630 | S695: =1000*110/100*(1+(55+RC[-16]/10)/200)*100 -> 178254.99999999997
B696: 1,7,8031,0;1,4,1480,0; | C696: 692 | D696: 1 | E696: 7 | F696: 8031 | G696: 0 | I696: 1 | J696: 4 | K696: 1480 | L696: 0 | O696: ="1,7,"&RC[2]&",0;"&"1,4,"&RC[4]&",0;" -> 1,7,13641,0;1,4,178310,0; | Q696: =INT(((55+RC[-14]/10)*35+200)*12/4) -> 13641 | S696: =1000*110/100*(1+(55+RC[-16]/10)/200)*100 -> 178310
B697: 1,7,8041,0;1,4,1481,0; | C697: 693 | D697: 1 | E697: 7 | F697: 8041 | G697: 0 | I697: 1 | J697: 4 | K697: 1481 | L697: 0 | O697: ="1,7,"&RC[2]&",0;"&"1,4,"&RC[4]&",0;" -> 1,7,13651,0;1,4,178365,0; | Q697: =INT(((55+RC[-14]/10)*35+200)*12/4) -> 13651 | S697: =1000*110/100*(1+(55+RC[-16]/10)/200)*100 -> 178365
B698: 1,7,8052,0;1,4,1481,0; | C698: 694 | D698: 1 | E698: 7 | F698: 8052 | G698: 0 | I698: 1 | J698: 4 | K698: 1481 | L698: 0 | O698: ="1,7,"&RC[2]&",0;"&"1,4,"&RC[4]&",0;" -> 1,7,13662,0;1,4,178420,0; | Q698: =INT(((55+RC[-14]/10)*35+200)*12/4) -> 13662 | S698: =1000*110/100*(1+(55+RC[-16]/10)/200)*100 -> 178419.99999999997
B699: 1,7,8062,0;1,4,1482,0; | C699: 695 | D699: 1 | E699: 7 | F699: 8062 | G699: 0 | I699: 1 | J699: 4 | K699: 1482 | L699: 0 | O699: ="1,7,"&RC[2]&",0;"&"1,4,"&RC[4]&",0;" -> 1,7,13672,0;1,4,178475,0; | Q699: =INT(((55+RC[-14]/10)*35+200)*12/4) -> 13672 | S699: =1000*110/100*(1+(55+RC[-16]/10)/200)*100 -> 178475
B700: 1,7,8073,0;1,4,1482,0; | C700: 696 | D700: 1 | E700: 7 | F700: 8073 | G700: 0 | I700: 1 | J700: 4 | K700: 1482 | L700: 0 | O700: ="1,7,"&RC[2]&",0;"&"1,4,"&RC[4]&",0;" -> 1,7,13683,0;1,4,178530,0; | Q700: =INT(((55+RC[-14]/10)*35+200)*12/4) -> 13683 | S700: =1000*110/100*(1+(55+RC[-16]/10)/200)*100 -> 178530
B701: 1,7,8083,0;1,4,1483,0; | C701: 697 | D701: 1 | E701: 7 | F701: 8083 | G701: 0 | I701: 1 | J701: 4 | K701: 1483 | L701: 0 | O701: ="1,7,"&RC[2]&",0;"&"1,4,"&RC[4]&",0;" -> 1,7,13693,0;1,4,178585,0; | Q701: =INT(((55+RC[-14]/10)*35+200)*12/4) -> 13693 | S701: =1000*110/100*(1+(55+RC[-16]/10)/200)*100 -> 178585
B702: 1,7,8094,0;1,4,1483,0; | C702: 698 | D702: 1 | E702: 7 | F702: 8094 | G702: 0 | I702: 1 | J702: 4 | K702: 1483 | L702: 0 | O702: ="1,7,"&RC[2]&",0;"&"1,4,"&RC[4]&",0;" -> 1,7,13704,0;1,4,178640,0; | Q702: =INT(((55+RC[-14]/10)*35+200)*12/4) -> 13704 | S702: =1000*110/100*(1+(55+RC[-16]/10)/200)*100 -> 178640
B703: 1,7,8104,0;1,4,1484,0; | C703: 699 | D703: 1 | E703: 7 | F703: 8104 | G703: 0 | I703: 1 | J703: 4 | K703: 1484 | L703: 0 | O703: ="1,7,"&RC[2]&",0;"&"1,4,"&RC[4]&",0;" -> 1,7,13714,0;1,4,178695,0; | Q703: =INT(((55+RC[-14]/10)*35+200)*12/4) -> 13714 | S703: =1000*110/100*(1+(55+RC[-16]/10)/200)*100 -> 178695
B704: 1,7,8115,0;1,4,1485,0; | C704: 700 | D704: 1 | E704: 7 | F704: 8115 | G704: 0 | I704: 1 | J704: 4 | K704: 1485 | L704: 0 | O704: ="1,7,"&RC[2]&",0;"&"1,4,"&RC[4]&",0;" -> 1,7,13725,0;1,4,178750,0; | Q704: =INT(((55+RC[-14]/10)*35+200)*12/4) -> 13725 | S704: =1000*110/100*(1+(55+RC[-16]/10)/200)*100 -> 178750
B705: 1,7,8125,0;1,4,1485,0; | C705: 701 | D705: 1 | E705: 7 | F705: 8125 | G705: 0 | I705: 1 | J705: 4 | K705: 1485 | L705: 0 | O705: ="1,7,"&RC[2]&",0;"&"1,4,"&RC[4]&",0;" -> 1,7,13735,0;1,4,178805,0; | Q705: =INT(((55+RC[-14]/10)*35+200)*12/4) -> 13735 | S705: =1000*110/100*(1+(55+RC[-16]/10)/200)*100 -> 178805
B706: 1,7,8136,0;1,4,1486,0; | C706: 702 | D706: 1 | E706: 7 | F706: 8136 | G706: 0 | I706: 1 | J706: 4 | K706: 1486 | L706: 0 | O706: ="1,7,"&RC[2]&",0;"&"1,4,"&RC[4]&",0;" -> 1,7,13746,0;1,4,178860,0; | Q706: =INT(((55+RC[-14]/10)*35+200)*12/4) -> 13746 | S706: =1000*110/100*(1+(55+RC[-16]/10)/200)*100 -> 178860
B707: 1,7,8146,0;1,4,1486,0; | C707: 703 | D707: 1 | E707: 7 | F707: 8146 | G707: 0 | I707: 1 | J707: 4 | K707: 1486 | L707: 0 | O707: ="1,7,"&RC[2]&",0;"&"1,4,"&RC[4]&",0;" -> 1,7,13756,0;1,4,178915,0; | Q707: =INT(((55+RC[-14]/10)*35+200)*12/4) -> 13756 | S707: =1000*110/100*(1+(55+RC[-16]/10)/200)*100 -> 178915
B708: 1,7,8157,0;1,4,1487,0; | C708: 704 | D708: 1 | E708: 7 | F708: 8157 | G708: 0 | I708: 1 | J708: 4 | K708: 1487 | L708: 0 | O708: ="1,7,"&RC[2]&",0;"&"1,4,"&RC[4]&",0;" -> 1,7,13767,0;1,4,178970,0; | Q708: =INT(((55+RC[-14]/10)*35+200)*12/4) -> 13767 | S708: =1000*110/100*(1+(55+RC[-16]/10)/200)*100 -> 178970
B709: 1,7,8167,0;1,4,1487,0; | C709: 705 | D709: 1 | E709: 7 | F709: 8167 | G709: 0 | I709: 1 | J709: 4 | K709: 1487 | L709: 0 | O709: ="1,7,"&RC[2]&",0;"&"1,4,"&RC[4]&",0;" -> 1,7,13777,0;1,4,179025,0; | Q709: =INT(((55+RC[-14]/10)*35+200)*12/4) -> 13777 | S709: =1000*110/100*(1+(55+RC[-16]/10)/200)*100 -> 179025
B710: 1,7,8178,0;1,4,1488,0; | C710: 706 | D710: 1 | E710: 7 | F710: 8178 | G710: 0 | I710: 1 | J710: 4 | K710: 1488 | L710: 0 | O710: ="1,7,"&RC[2]&",0;"&"1,4,"&RC[4]&",0;" -> 1,7,13788,0;1,4,179080,0; | Q710: =INT(((55+RC[-14]/10)*35+200)*12/4) -> 13788 | S710: =1000*110/100*(1+(55+RC[-16]/10)/200)*100 -> 179080.00000000003
B711: 1,7,8188,0;1,4,1488,0; | C711: 707 | D711: 1 | E711: 7 | F711: 8188 | G711: 0 | I711: 1 | J711: 4 | K711: 1488 | L711: 0 | O711: ="1,7,"&RC[2]&",0;"&"1,4,"&RC[4]&",0;" -> 1,7,13798,0;1,4,179135,0; | Q711: =INT(((55+RC[-14]/10)*35+200)*12/4) -> 13798 | S711: =1000*110/100*(1+(55+RC[-16]/10)/200)*100 -> 179135
B712: 1,7,8199,0;1,4,1489,0; | C712: 708 | D712: 1 | E712: 7 | F712: 8199 | G712: 0 | I712: 1 | J712: 4 | K712: 1489 | L712: 0 | O712: ="1,7,"&RC[2]&",0;"&"1,4,"&RC[4]&",0;" -> 1,7,13809,0;1,4,179190,0; | Q712: =INT(((55+RC[-14]/10)*35+200)*12/4) -> 13809 | S712: =1000*110/100*(1+(55+RC[-16]/10)/200)*100 -> 179190
B713: 1,7,8209,0;1,4,1489,0; | C713: 709 | D713: 1 | E713: 7 | F713: 8209 | G713: 0 | I713: 1 | J713: 4 | K713: 1489 | L713: 0 | O713: ="1,7,"&RC[2]&",0;"&"1,4,"&RC[4]&",0;" -> 1,7,13819,0;1,4,179245,0; | Q713: =INT(((55+RC[-14]/10)*35+200)*12/4) -> 13819 | S713: =1000*110/100*(1+(55+RC[-16]/10)/200)*100 -> 179245.00000000003
B714: 1,7,8220,0;1,4,1490,0; | C714: 710 | D714: 1 | E714: 7 | F714: 8220 | G714: 0 | I714: 1 | J714: 4 | K714: 1490 | L714: 0 | O714: ="1,7,"&RC[2]&",0;"&"1,4,"&RC[4]&",0;" -> 1,7,13830,0;1,4,179300,0; | Q714: =INT(((55+RC[-14]/10)*35+200)*12/4) -> 13830 | S714: =1000*110/100*(1+(55+RC[-16]/10)/200)*100 -> 179299.99999999997
B715: 1,7,8230,0;1,4,1491,0; | C715: 711 | D715: 1 | E715: 7 | F715: 8230 | G715: 0 | I715: 1 | J715: 4 | K715: 1491 | L715: 0 | O715: ="1,7,"&RC[2]&",0;"&"1,4,"&RC[4]&",0;" -> 1,7,13840,0;1,4,179355,0; | Q715: =INT(((55+RC[-14]/10)*35+200)*12/4) -> 13840 | S715: =1000*110/100*(1+(55+RC[-16]/10)/200)*100 -> 179355
B716: 1,7,8241,0;1,4,1491,0; | C716: 712 | D716: 1 | E716: 7 | F716: 8241 | G716: 0 | I716: 1 | J716: 4 | K716: 1491 | L716: 0 | O716: ="1,7,"&RC[2]&",0;"&"1,4,"&RC[4]&",0;" -> 1,7,13851,0;1,4,179410,0; | Q716: =INT(((55+RC[-14]/10)*35+200)*12/4) -> 13851 | S716: =1000*110/100*(1+(55+RC[-16]/10)/200)*100 -> 179410
B717: 1,7,8251,0;1,4,1492,0; | C717: 713 | D717: 1 | E717: 7 | F717: 8251 | G717: 0 | I717: 1 | J717: 4 | K717: 1492 | L717: 0 | O717: ="1,7,"&RC[2]&",0;"&"1,4,"&RC[4]&",0;" -> 1,7,13861,0;1,4,179465,0; | Q717: =INT(((55+RC[-14]/10)*35+200)*12/4) -> 13861 | S717: =1000*110/100*(1+(55+RC[-16]/10)/200)*100 -> 179465
B718: 1,7,8262,0;1,4,1492,0; | C718: 714 | D718: 1 | E718: 7 | F718: 8262 | G718: 0 | I718: 1 | J718: 4 | K718: 1492 | L718: 0 | O718: ="1,7,"&RC[2]&",0;"&"1,4,"&RC[4]&",0;" -> 1,7,13872,0;1,4,179520,0; | Q718: =INT(((55+RC[-14]/10)*35+200)*12/4) -> 13872 | S718: =1000*110/100*(1+(55+RC[-16]/10)/200)*100 -> 179520
B719: 1,7,8272,0;1,4,1493,0; | C719: 715 | D719: 1 | E719: 7 | F719: 8272 | G719: 0 | I719: 1 | J719: 4 | K719: 1493 | L719: 0 | O719: ="1,7,"&RC[2]&",0;"&"1,4,"&RC[4]&",0;" -> 1,7,13882,0;1,4,179575,0; | Q719: =INT(((55+RC[-14]/10)*35+200)*12/4) -> 13882 | S719: =1000*110/100*(1+(55+RC[-16]/10)/200)*100 -> 179574.99999999997
B720: 1,7,8283,0;1,4,1493,0; | C720: 716 | D720: 1 | E720: 7 | F720: 8283 | G720: 0 | I720: 1 | J720: 4 | K720: 1493 | L720: 0 | O720: ="1,7,"&RC[2]&",0;"&"1,4,"&RC[4]&",0;" -> 1,7,13893,0;1,4,179630,0; | Q720: =INT(((55+RC[-14]/10)*35+200)*12/4) -> 13893 | S720: =1000*110/100*(1+(55+RC[-16]/10)/200)*100 -> 179630
B721: 1,7,8293,0;1,4,1494,0; | C721: 717 | D721: 1 | E721: 7 | F721: 8293 | G721: 0 | I721: 1 | J721: 4 | K721: 1494 | L721: 0 | O721: ="1,7,"&RC[2]&",0;"&"1,4,"&RC[4]&",0;" -> 1,7,13903,0;1,4,179685,0; | Q721: =INT(((55+RC[-14]/10)*35+200)*12/4) -> 13903 | S721: =1000*110/100*(1+(55+RC[-16]/10)/200)*100 -> 179685
B722: 1,7,8304,0;1,4,1494,0; | C722: 718 | D722: 1 | E722: 7 | F722: 8304 | G722: 0 | I722: 1 | J722: 4 | K722: 1494 | L722: 0 | O722: ="1,7,"&RC[2]&",0;"&"1,4,"&RC[4]&",0;" -> 1,7,13914,0;1,4,179740,0; | Q722: =INT(((55+RC[-14]/10)*35+200)*12/4) -> 13914 | S722: =1000*110/100*(1+(55+RC[-16]/10)/200)*100 -> 179740
B723: 1,7,8314,0;1,4,1495,0; | C723: 719 | D723: 1 | E723: 7 | F723: 8314 | G723: 0 | I723: 1 | J723: 4 | K723: 1495 | L723: 0 | O723: ="1,7,"&RC[2]&",0;"&"1,4,"&RC[4]&",0;" -> 1,7,13924,0;1,4,179795,0; | Q723: =INT(((55+RC[-14]/10)*35+200)*12/4) -> 13924 | S723: =1000*110/100*(1+(55+RC[-16]/10)/200)*100 -> 179795
B724: 1,7,8325,0;1,4,1496,0; | C724: 720 | D724: 1 | E724: 7 | F724: 8325 | G724: 0 | I724: 1 | J724: 4 | K724: 1496 | L724: 0 | O724: ="1,7,"&RC[2]&",0;"&"1,4,"&RC[4]&",0;" -> 1,7,13935,0;1,4,179850,0; | Q724: =INT(((55+RC[-14]/10)*35+200)*12/4) -> 13935 | S724: =1000*110/100*(1+(55+RC[-16]/10)/200)*100 -> 179850
B725: 1,7,8335,0;1,4,1496,0; | C725: 721 | D725: 1 | E725: 7 | F725: 8335 | G725: 0 | I725: 1 | J725: 4 | K725: 1496 | L725: 0 | O725: ="1,7,"&RC[2]&",0;"&"1,4,"&RC[4]&",0;" -> 1,7,13945,0;1,4,179905,0; | Q725: =INT(((55+RC[-14]/10)*35+200)*12/4) -> 13945 | S725: =1000*110/100*(1+(55+RC[-16]/10)/200)*100 -> 179905
B726: 1,7,8346,0;1,4,1497,0; | C726: 722 | D726: 1 | E726: 7 | F726: 8346 | G726: 0 | I726: 1 | J726: 4 | K726: 1497 | L726: 0 | O726: ="1,7,"&RC[2]&",0;"&"1,4,"&RC[4]&",0;" -> 1,7,13956,0;1,4,179960,0; | Q726: =INT(((55+RC[-14]/10)*35+200)*12/4) -> 13956 | S726: =1000*110/100*(1+(55+RC[-16]/10)/200)*100 -> 179960
B727: 1,7,8356,0;1,4,1497,0; | C727: 723 | D727: 1 | E727: 7 | F727: 8356 | G727: 0 | I727: 1 | J727: 4 | K727: 1497 | L727: 0 | O727: ="1,7,"&RC[2]&",0;"&"1,4,"&RC[4]&",0;" -> 1,7,13966,0;1,4,180015,0; | Q727: =INT(((55+RC[-14]/10)*35+200)*12/4) -> 13966 | S727: =1000*110/100*(1+(55+RC[-16]/10)/200)*100 -> 180015
B728: 1,7,8367,0;1,4,1498,0; | C728: 724 | D728: 1 | E728: 7 | F728: 8367 | G728: 0 | I728: 1 | J728: 4 | K728: 1498 | L728: 0 | O728: ="1,7,"&RC[2]&",0;"&"1,4,"&RC[4]&",0;" -> 1,7,13977,0;1,4,180070,0; | Q728: =INT(((55+RC[-14]/10)*35+200)*12/4) -> 13977 | S728: =1000*110/100*(1+(55+RC[-16]/10)/200)*100 -> 180070
B729: 1,7,8377,0;1,4,1498,0; | C729: 725 | D729: 1 | E729: 7 | F729: 8377 | G729: 0 | I729: 1 | J729: 4 | K729: 1498 | L729: 0 | O729: ="1,7,"&RC[2]&",0;"&"1,4,"&RC[4]&",0;" -> 1,7,13987,0;1,4,180125,0; | Q729: =INT(((55+RC[-14]/10)*35+200)*12/4) -> 13987 | S729: =1000*110/100*(1+(55+RC[-16]/10)/200)*100 -> 180125
B730: 1,7,8388,0;1,4,1499,0; | C730: 726 | D730: 1 | E730: 7 | F730: 8388 | G730: 0 | I730: 1 | J730: 4 | K730: 1499 | L730: 0 | O730: ="1,7,"&RC[2]&",0;"&"1,4,"&RC[4]&",0;" -> 1,7,13998,0;1,4,180180,0; | Q730: =INT(((55+RC[-14]/10)*35+200)*12/4) -> 13998 | S730: =1000*110/100*(1+(55+RC[-16]/10)/200)*100 -> 180180
B731: 1,7,8398,0;1,4,1499,0; | C731: 727 | D731: 1 | E731: 7 | F731: 8398 | G731: 0 | I731: 1 | J731: 4 | K731: 1499 | L731: 0 | O731: ="1,7,"&RC[2]&",0;"&"1,4,"&RC[4]&",0;" -> 1,7,14008,0;1,4,180235,0; | Q731: =INT(((55+RC[-14]/10)*35+200)*12/4) -> 14008 | S731: =1000*110/100*(1+(55+RC[-16]/10)/200)*100 -> 180235
B732: 1,7,8409,0;1,4,1500,0; | C732: 728 | D732: 1 | E732: 7 | F732: 8409 | G732: 0 | I732: 1 | J732: 4 | K732: 1500 | L732: 0 | O732: ="1,7,"&RC[2]&",0;"&"1,4,"&RC[4]&",0;" -> 1,7,14019,0;1,4,180290,0; | Q732: =INT(((55+RC[-14]/10)*35+200)*12/4) -> 14019 | S732: =1000*110/100*(1+(55+RC[-16]/10)/200)*100 -> 180290
B733: 1,7,8419,0;1,4,1500,0; | C733: 729 | D733: 1 | E733: 7 | F733: 8419 | G733: 0 | I733: 1 | J733: 4 | K733: 1500 | L733: 0 | O733: ="1,7,"&RC[2]&",0;"&"1,4,"&RC[4]&",0;" -> 1,7,14029,0;1,4,180345,0; | Q733: =INT(((55+RC[-14]/10)*35+200)*12/4) -> 14029 | S733: =1000*110/100*(1+(55+RC[-16]/10)/200)*100 -> 180345
B734: 1,7,8430,0;1,4,1501,0; | C734: 730 | D734: 1 | E734: 7 | F734: 8430 | G734: 0 | I734: 1 | J734: 4 | K734: 1501 | L734: 0 | O734: ="1,7,"&RC[2]&",0;"&"1,4,"&RC[4]&",0;" -> 1,7,14040,0;1,4,180400,0; | Q734: =INT(((55+RC[-14]/10)*35+200)*12/4) -> 14040 | S734: =1000*110/100*(1+(55+RC[-16]/10)/200)*100 -> 180400.00000000003
B735: 1,7,8440,0;1,4,1502,0; | C735: 731 | D735: 1 | E735: 7 | F735: 8440 | G735: 0 | I735: 1 | J735: 4 | K735: 1502 | L735: 0 | O735: ="1,7,"&RC[2]&",0;"&"1,4,"&RC[4]&",0;" -> 1,7,14050,0;1,4,180455,0; | Q735: =INT(((55+RC[-14]/10)*35+200)*12/4) -> 14050 | S735: =1000*110/100*(1+(55+RC[-16]/10)/200)*100 -> 180454.99999999997
B736: 1,7,8451,0;1,4,1502,0; | C736: 732 | D736: 1 | E736: 7 | F736: 8451 | G736: 0 | I736: 1 | J736: 4 | K736: 1502 | L736: 0 | O736: ="1,7,"&RC[2]&",0;"&"1,4,"&RC[4]&",0;" -> 1,7,14061,0;1,4,180510,0; | Q736: =INT(((55+RC[-14]/10)*35+200)*12/4) -> 14061 | S736: =1000*110/100*(1+(55+RC[-16]/10)/200)*100 -> 180510
B737: 1,7,8461,0;1,4,1503,0; | C737: 733 | D737: 1 | E737: 7 | F737: 8461 | G737: 0 | I737: 1 | J737: 4 | K737: 1503 | L737: 0 | O737: ="1,7,"&RC[2]&",0;"&"1,4,"&RC[4]&",0;" -> 1,7,14071,0;1,4,180565,0; | Q737: =INT(((55+RC[-14]/10)*35+200)*12/4) -> 14071 | S737: =1000*110/100*(1+(55+RC[-16]/10)/200)*100 -> 180565
B738: 1,7,8472,0;1,4,1503,0; | C738: 734 | D738: 1 | E738: 7 | F738: 8472 | G738: 0 | I738: 1 | J738: 4 | K738: 1503 | L738: 0 | O738: ="1,7,"&RC[2]&",0;"&"1,4,"&RC[4]&",0;" -> 1,7,14082,0;1,4,180620,0; | Q738: =INT(((55+RC[-14]/10)*35+200)*12/4) -> 14082 | S738: =1000*110/100*(1+(55+RC[-16]/10)/200)*100 -> 180619.99999999997
B739: 1,7,8482,0;1,4,1504,0; | C739: 735 | D739: 1 | E739: 7 | F739: 8482 | G739: 0 | I739: 1 | J739: 4 | K739: 1504 | L739: 0 | O739: ="1,7,"&RC[2]&",0;"&"1,4,"&RC[4]&",0;" -> 1,7,14092,0;1,4,180675,0; | Q739: =INT(((55+RC[-14]/10)*35+200)*12/4) -> 14092 | S739: =1000*110/100*(1+(55+RC[-16]/10)/200)*100 -> 180675
B740: 1,7,8493,0;1,4,1504,0; | C740: 736 | D740: 1 | E740: 7 | F740: 8493 | G740: 0 | I740: 1 | J740: 4 | K740: 1504 | L740: 0 | O740: ="1,7,"&RC[2]&",0;"&"1,4,"&RC[4]&",0;" -> 1,7,14103,0;1,4,180730,0; | Q740: =INT(((55+RC[-14]/10)*35+200)*12/4) -> 14103 | S740: =1000*110/100*(1+(55+RC[-16]/10)/200)*100 -> 180730
B741: 1,7,8503,0;1,4,1505,0; | C741: 737 | D741: 1 | E741: 7 | F741: 8503 | G741: 0 | I741: 1 | J741: 4 | K741: 1505 | L741: 0 | O741: ="1,7,"&RC[2]&",0;"&"1,4,"&RC[4]&",0;" -> 1,7,14113,0;1,4,180785,0; | Q741: =INT(((55+RC[-14]/10)*35+200)*12/4) -> 14113 | S741: =1000*110/100*(1+(55+RC[-16]/10)/200)*100 -> 180785
B742: 1,7,8514,0;1,4,1505,0; | C742: 738 | D742: 1 | E742: 7 | F742: 8514 | G742: 0 | I742: 1 | J742: 4 | K742: 1505 | L742: 0 | O742: ="1,7,"&RC[2]&",0;"&"1,4,"&RC[4]&",0;" -> 1,7,14124,0;1,4,180840,0; | Q742: =INT(((55+RC[-14]/10)*35+200)*12/4) -> 14124 | S742: =1000*110/100*(1+(55+RC[-16]/10)/200)*100 -> 180840
B743: 1,7,8524,0;1,4,1506,0; | C743: 739 | D743: 1 | E743: 7 | F743: 8524 | G743: 0 | I743: 1 | J743: 4 | K743: 1506 | L743: 0 | O743: ="1,7,"&RC[2]&",0;"&"1,4,"&RC[4]&",0;" -> 1,7,14134,0;1,4,180895,0; | Q743: =INT(((55+RC[-14]/10)*35+200)*12/4) -> 14134 | S743: =1000*110/100*(1+(55+RC[-16]/10)/200)*100 -> 180895
B744: 1,7,8535,0;1,4,1507,0; | C744: 740 | D744: 1 | E744: 7 | F744: 8535 | G744: 0 | I744: 1 | J744: 4 | K744: 1507 | L744: 0 | O744: ="1,7,"&RC[2]&",0;"&"1,4,"&RC[4]&",0;" -> 1,7,14145,0;1,4,180950,0; | Q744: =INT(((55+RC[-14]/10)*35+200)*12/4) -> 14145 | S744: =1000*110/100*(1+(55+RC[-16]/10)/200)*100 -> 180950
B745: 1,7,8545,0;1,4,1507,0; | C745: 741 | D745: 1 | E745: 7 | F745: 8545 | G745: 0 | I745: 1 | J745: 4 | K745: 1507 | L745: 0 | O745: ="1,7,"&RC[2]&",0;"&"1,4,"&RC[4]&",0;" -> 1,7,14155,0;1,4,181005,0; | Q745: =INT(((55+RC[-14]/10)*35+200)*12/4) -> 14155 | S745: =1000*110/100*(1+(55+RC[-16]/10)/200)*100 -> 181005
B746: 1,7,8556,0;1,4,1508,0; | C746: 742 | D746: 1 | E746: 7 | F746: 8556 | G746: 0 | I746: 1 | J746: 4 | K746: 1508 | L746: 0 | O746: ="1,7,"&RC[2]&",0;"&"1,4,"&RC[4]&",0;" -> 1,7,14166,0;1,4,181060,0; | Q746: =INT(((55+RC[-14]/10)*35+200)*12/4) -> 14166 | S746: =1000*110/100*(1+(55+RC[-16]/10)/200)*100 -> 181060
B747: 1,7,8566,0;1,4,1508,0; | C747: 743 | D747: 1 | E747: 7 | F747: 8566 | G747: 0 | I747: 1 | J747: 4 | K747: 1508 | L747: 0 | O747: ="1,7,"&RC[2]&",0;"&"1,4,"&RC[4]&",0;" -> 1,7,14176,0;1,4,181115,0; | Q747: =INT(((55+RC[-14]/10)*35+200)*12/4) -> 14176 | S747: =1000*110/100*(1+(55+RC[-16]/10)/200)*100 -> 181115
B748: 1,7,8577,0;1,4,1509,0; | C748: 744 | D748: 1 | E748: 7 | F748: 8577 | G748: 0 | I748: 1 | J748: 4 | K748: 1509 | L748: 0 | O748: ="1,7,"&RC[2]&",0;"&"1,4,"&RC[4]&",0;" -> 1,7,14187,0;1,4,181170,0; | Q748: =INT(((55+RC[-14]/10)*35+200)*12/4) -> 14187 | S748: =1000*110/100*(1+(55+RC[-16]/10)/200)*100 -> 181170
B749: 1,7,8587,0;1,4,1509,0; | C749: 745 | D749: 1 | E749: 7 | F749: 8587 | G749: 0 | I749: 1 | J749: 4 | K749: 1509 | L749: 0 | O749: ="1,7,"&RC[2]&",0;"&"1,4,"&RC[4]&",0;" -> 1,7,14197,0;1,4,181225,0; | Q749: =INT(((55+RC[-14]/10)*35+200)*12/4) -> 14197 | S749: =1000*110/100*(1+(55+RC[-16]/10)/200)*100 -> 181225
B750: 1,7,8598,0;1,4,1510,0; | C750: 746 | D750: 1 | E750: 7 | F750: 8598 | G750: 0 | I750: 1 | J750: 4 | K750: 1510 | L750: 0 | O750: ="1,7,"&RC[2]&",0;"&"1,4,"&RC[4]&",0;" -> 1,7,14208,0;1,4,181280,0; | Q750: =INT(((55+RC[-14]/10)*35+200)*12/4) -> 14208 | S750: =1000*110/100*(1+(55+RC[-16]/10)/200)*100 -> 181280.00000000003
B751: 1,7,8608,0;1,4,1510,0; | C751: 747 | D751: 1 | E751: 7 | F751: 8608 | G751: 0 | I751: 1 | J751: 4 | K751: 1510 | L751: 0 | O751: ="1,7,"&RC[2]&",0;"&"1,4,"&RC[4]&",0;" -> 1,7,14218,0;1,4,181335,0; | Q751: =INT(((55+RC[-14]/10)*35+200)*12/4) -> 14218 | S751: =1000*110/100*(1+(55+RC[-16]/10)/200)*100 -> 181335
B752: 1,7,8619,0;1,4,1511,0; | C752: 748 | D752: 1 | E752: 7 | F752: 8619 | G752: 0 | I752: 1 | J752: 4 | K752: 1511 | L752: 0 | O752: ="1,7,"&RC[2]&",0;"&"1,4,"&RC[4]&",0;" -> 1,7,14229,0;1,4,181390,0; | Q752: =INT(((55+RC[-14]/10)*35+200)*12/4) -> 14229 | S752: =1000*110/100*(1+(55+RC[-16]/10)/200)*100 -> 181390
B753: 1,7,8629,0;1,4,1511,0; | C753: 749 | D753: 1 | E753: 7 | F753: 8629 | G753: 0 | I753: 1 | J753: 4 | K753: 1511 | L753: 0 | O753: ="1,7,"&RC[2]&",0;"&"1,4,"&RC[4]&",0;" -> 1,7,14239,0;1,4,181445,0; | Q753: =INT(((55+RC[-14]/10)*35+200)*12/4) -> 14239 | S753: =1000*110/100*(1+(55+RC[-16]/10)/200)*100 -> 181445.00000000003
B754: 1,7,8640,0;1,4,1512,0; | C754: 750 | D754: 1 | E754: 7 | F754: 8640 | G754: 0 | I754: 1 | J754: 4 | K754: 1512 | L754: 0 | O754: ="1,7,"&RC[2]&",0;"&"1,4,"&RC[4]&",0;" -> 1,7,14250,0;1,4,181500,0; | Q754: =INT(((55+RC[-14]/10)*35+200)*12/4) -> 14250 | S754: =1000*110/100*(1+(55+RC[-16]/10)/200)*100 -> 181500
B755: 1,7,8650,0;1,4,1513,0; | C755: 751 | D755: 1 | E755: 7 | F755: 8650 | G755: 0 | I755: 1 | J755: 4 | K755: 1513 | L755: 0 | O755: ="1,7,"&RC[2]&",0;"&"1,4,"&RC[4]&",0;" -> 1,7,14260,0;1,4,181555,0; | Q755: =INT(((55+RC[-14]/10)*35+200)*12/4) -> 14260 | S755: =1000*110/100*(1+(55+RC[-16]/10)/200)*100 -> 181555.00000000003
B756: 1,7,8661,0;1,4,1513,0; | C756: 752 | D756: 1 | E756: 7 | F756: 8661 | G756: 0 | I756: 1 | J756: 4 | K756: 1513 | L756: 0 | O756: ="1,7,"&RC[2]&",0;"&"1,4,"&RC[4]&",0;" -> 1,7,14271,0;1,4,181610,0; | Q756: =INT(((55+RC[-14]/10)*35+200)*12/4) -> 14271 | S756: =1000*110/100*(1+(55+RC[-16]/10)/200)*100 -> 181609.99999999997
B757: 1,7,8671,0;1,4,1514,0; | C757: 753 | D757: 1 | E757: 7 | F757: 8671 | G757: 0 | I757: 1 | J757: 4 | K757: 1514 | L757: 0 | O757: ="1,7,"&RC[2]&",0;"&"1,4,"&RC[4]&",0;" -> 1,7,14281,0;1,4,181665,0; | Q757: =INT(((55+RC[-14]/10)*35+200)*12/4) -> 14281 | S757: =1000*110/100*(1+(55+RC[-16]/10)/200)*100 -> 181665
B758: 1,7,8682,0;1,4,1514,0; | C758: 754 | D758: 1 | E758: 7 | F758: 8682 | G758: 0 | I758: 1 | J758: 4 | K758: 1514 | L758: 0 | O758: ="1,7,"&RC[2]&",0;"&"1,4,"&RC[4]&",0;" -> 1,7,14292,0;1,4,181720,0; | Q758: =INT(((55+RC[-14]/10)*35+200)*12/4) -> 14292 | S758: =1000*110/100*(1+(55+RC[-16]/10)/200)*100 -> 181720
B759: 1,7,8692,0;1,4,1515,0; | C759: 755 | D759: 1 | E759: 7 | F759: 8692 | G759: 0 | I759: 1 | J759: 4 | K759: 1515 | L759: 0 | O759: ="1,7,"&RC[2]&",0;"&"1,4,"&RC[4]&",0;" -> 1,7,14302,0;1,4,181775,0; | Q759: =INT(((55+RC[-14]/10)*35+200)*12/4) -> 14302 | S759: =1000*110/100*(1+(55+RC[-16]/10)/200)*100 -> 181774.99999999997
B760: 1,7,8703,0;1,4,1515,0; | C760: 756 | D760: 1 | E760: 7 | F760: 8703 | G760: 0 | I760: 1 | J760: 4 | K760: 1515 | L760: 0 | O760: ="1,7,"&RC[2]&",0;"&"1,4,"&RC[4]&",0;" -> 1,7,14313,0;1,4,181830,0; | Q760: =INT(((55+RC[-14]/10)*35+200)*12/4) -> 14313 | S760: =1000*110/100*(1+(55+RC[-16]/10)/200)*100 -> 181830
B761: 1,7,8713,0;1,4,1516,0; | C761: 757 | D761: 1 | E761: 7 | F761: 8713 | G761: 0 | I761: 1 | J761: 4 | K761: 1516 | L761: 0 | O761: ="1,7,"&RC[2]&",0;"&"1,4,"&RC[4]&",0;" -> 1,7,14323,0;1,4,181885,0; | Q761: =INT(((55+RC[-14]/10)*35+200)*12/4) -> 14323 | S761: =1000*110/100*(1+(55+RC[-16]/10)/200)*100 -> 181885
B762: 1,7,8724,0;1,4,1516,0; | C762: 758 | D762: 1 | E762: 7 | F762: 8724 | G762: 0 | I762: 1 | J762: 4 | K762: 1516 | L762: 0 | O762: ="1,7,"&RC[2]&",0;"&"1,4,"&RC[4]&",0;" -> 1,7,14334,0;1,4,181940,0; | Q762: =INT(((55+RC[-14]/10)*35+200)*12/4) -> 14334 | S762: =1000*110/100*(1+(55+RC[-16]/10)/200)*100 -> 181940
B763: 1,7,8734,0;1,4,1517,0; | C763: 759 | D763: 1 | E763: 7 | F763: 8734 | G763: 0 | I763: 1 | J763: 4 | K763: 1517 | L763: 0 | O763: ="1,7,"&RC[2]&",0;"&"1,4,"&RC[4]&",0;" -> 1,7,14344,0;1,4,181995,0; | Q763: =INT(((55+RC[-14]/10)*35+200)*12/4) -> 14344 | S763: =1000*110/100*(1+(55+RC[-16]/10)/200)*100 -> 181995
B764: 1,7,8745,0;1,4,1518,0; | C764: 760 | D764: 1 | E764: 7 | F764: 8745 | G764: 0 | I764: 1 | J764: 4 | K764: 1518 | L764: 0 | O764: ="1,7,"&RC[2]&",0;"&"1,4,"&RC[4]&",0;" -> 1,7,14355,0;1,4,182050,0; | Q764: =INT(((55+RC[-14]/10)*35+200)*12/4) -> 14355 | S764: =1000*110/100*(1+(55+RC[-16]/10)/200)*100 -> 182050
B765: 1,7,8755,0;1,4,1518,0; | C765: 761 | D765: 1 | E765: 7 | F765: 8755 | G765: 0 | I765: 1 | J765: 4 | K765: 1518 | L765: 0 | O765: ="1,7,"&RC[2]&",0;"&"1,4,"&RC[4]&",0;" -> 1,7,14365,0;1,4,182105,0; | Q765: =INT(((55+RC[-14]/10)*35+200)*12/4) -> 14365 | S765: =1000*110/100*(1+(55+RC[-16]/10)/200)*100 -> 182105
B766: 1,7,8766,0;1,4,1519,0; | C766: 762 | D766: 1 | E766: 7 | F766: 8766 | G766: 0 | I766: 1 | J766: 4 | K766: 1519 | L766: 0 | O766: ="1,7,"&RC[2]&",0;"&"1,4,"&RC[4]&",0;" -> 1,7,14376,0;1,4,182160,0; | Q766: =INT(((55+RC[-14]/10)*35+200)*12/4) -> 14376 | S766: =1000*110/100*(1+(55+RC[-16]/10)/200)*100 -> 182160
B767: 1,7,8776,0;1,4,1519,0; | C767: 763 | D767: 1 | E767: 7 | F767: 8776 | G767: 0 | I767: 1 | J767: 4 | K767: 1519 | L767: 0 | O767: ="1,7,"&RC[2]&",0;"&"1,4,"&RC[4]&",0;" -> 1,7,14386,0;1,4,182215,0; | Q767: =INT(((55+RC[-14]/10)*35+200)*12/4) -> 14386 | S767: =1000*110/100*(1+(55+RC[-16]/10)/200)*100 -> 182215
B768: 1,7,8787,0;1,4,1520,0; | C768: 764 | D768: 1 | E768: 7 | F768: 8787 | G768: 0 | I768: 1 | J768: 4 | K768: 1520 | L768: 0 | O768: ="1,7,"&RC[2]&",0;"&"1,4,"&RC[4]&",0;" -> 1,7,14397,0;1,4,182270,0; | Q768: =INT(((55+RC[-14]/10)*35+200)*12/4) -> 14397 | S768: =1000*110/100*(1+(55+RC[-16]/10)/200)*100 -> 182270
B769: 1,7,8797,0;1,4,1520,0; | C769: 765 | D769: 1 | E769: 7 | F769: 8797 | G769: 0 | I769: 1 | J769: 4 | K769: 1520 | L769: 0 | O769: ="1,7,"&RC[2]&",0;"&"1,4,"&RC[4]&",0;" -> 1,7,14407,0;1,4,182325,0; | Q769: =INT(((55+RC[-14]/10)*35+200)*12/4) -> 14407 | S769: =1000*110/100*(1+(55+RC[-16]/10)/200)*100 -> 182325
B770: 1,7,8808,0;1,4,1521,0; | C770: 766 | D770: 1 | E770: 7 | F770: 8808 | G770: 0 | I770: 1 | J770: 4 | K770: 1521 | L770: 0 | O770: ="1,7,"&RC[2]&",0;"&"1,4,"&RC[4]&",0;" -> 1,7,14418,0;1,4,182380,0; | Q770: =INT(((55+RC[-14]/10)*35+200)*12/4) -> 14418 | S770: =1000*110/100*(1+(55+RC[-16]/10)/200)*100 -> 182380
B771: 1,7,8818,0;1,4,1521,0; | C771: 767 | D771: 1 | E771: 7 | F771: 8818 | G771: 0 | I771: 1 | J771: 4 | K771: 1521 | L771: 0 | O771: ="1,7,"&RC[2]&",0;"&"1,4,"&RC[4]&",0;" -> 1,7,14428,0;1,4,182435,0; | Q771: =INT(((55+RC[-14]/10)*35+200)*12/4) -> 14428 | S771: =1000*110/100*(1+(55+RC[-16]/10)/200)*100 -> 182435
B772: 1,7,8829,0;1,4,1522,0; | C772: 768 | D772: 1 | E772: 7 | F772: 8829 | G772: 0 | I772: 1 | J772: 4 | K772: 1522 | L772: 0 | O772: ="1,7,"&RC[2]&",0;"&"1,4,"&RC[4]&",0;" -> 1,7,14439,0;1,4,182490,0; | Q772: =INT(((55+RC[-14]/10)*35+200)*12/4) -> 14439 | S772: =1000*110/100*(1+(55+RC[-16]/10)/200)*100 -> 182490
B773: 1,7,8839,0;1,4,1522,0; | C773: 769 | D773: 1 | E773: 7 | F773: 8839 | G773: 0 | I773: 1 | J773: 4 | K773: 1522 | L773: 0 | O773: ="1,7,"&RC[2]&",0;"&"1,4,"&RC[4]&",0;" -> 1,7,14449,0;1,4,182545,0; | Q773: =INT(((55+RC[-14]/10)*35+200)*12/4) -> 14449 | S773: =1000*110/100*(1+(55+RC[-16]/10)/200)*100 -> 182545
B774: 1,7,8850,0;1,4,1523,0; | C774: 770 | D774: 1 | E774: 7 | F774: 8850 | G774: 0 | I774: 1 | J774: 4 | K774: 1523 | L774: 0 | O774: ="1,7,"&RC[2]&",0;"&"1,4,"&RC[4]&",0;" -> 1,7,14460,0;1,4,182600,0; | Q774: =INT(((55+RC[-14]/10)*35+200)*12/4) -> 14460 | S774: =1000*110/100*(1+(55+RC[-16]/10)/200)*100 -> 182600.00000000003
B775: 1,7,8860,0;1,4,1524,0; | C775: 771 | D775: 1 | E775: 7 | F775: 8860 | G775: 0 | I775: 1 | J775: 4 | K775: 1524 | L775: 0 | O775: ="1,7,"&RC[2]&",0;"&"1,4,"&RC[4]&",0;" -> 1,7,14470,0;1,4,182655,0; | Q775: =INT(((55+RC[-14]/10)*35+200)*12/4) -> 14470 | S775: =1000*110/100*(1+(55+RC[-16]/10)/200)*100 -> 182655
B776: 1,7,8871,0;1,4,1524,0; | C776: 772 | D776: 1 | E776: 7 | F776: 8871 | G776: 0 | I776: 1 | J776: 4 | K776: 1524 | L776: 0 | O776: ="1,7,"&RC[2]&",0;"&"1,4,"&RC[4]&",0;" -> 1,7,14481,0;1,4,182710,0; | Q776: =INT(((55+RC[-14]/10)*35+200)*12/4) -> 14481 | S776: =1000*110/100*(1+(55+RC[-16]/10)/200)*100 -> 182710
B777: 1,7,8881,0;1,4,1525,0; | C777: 773 | D777: 1 | E777: 7 | F777: 8881 | G777: 0 | I777: 1 | J777: 4 | K777: 1525 | L777: 0 | O777: ="1,7,"&RC[2]&",0;"&"1,4,"&RC[4]&",0;" -> 1,7,14491,0;1,4,182765,0; | Q777: =INT(((55+RC[-14]/10)*35+200)*12/4) -> 14491 | S777: =1000*110/100*(1+(55+RC[-16]/10)/200)*100 -> 182765.00000000003
B778: 1,7,8892,0;1,4,1525,0; | C778: 774 | D778: 1 | E778: 7 | F778: 8892 | G778: 0 | I778: 1 | J778: 4 | K778: 1525 | L778: 0 | O778: ="1,7,"&RC[2]&",0;"&"1,4,"&RC[4]&",0;" -> 1,7,14502,0;1,4,182820,0; | Q778: =INT(((55+RC[-14]/10)*35+200)*12/4) -> 14502 | S778: =1000*110/100*(1+(55+RC[-16]/10)/200)*100 -> 182819.99999999997
B779: 1,7,8902,0;1,4,1526,0; | C779: 775 | D779: 1 | E779: 7 | F779: 8902 | G779: 0 | I779: 1 | J779: 4 | K779: 1526 | L779: 0 | O779: ="1,7,"&RC[2]&",0;"&"1,4,"&RC[4]&",0;" -> 1,7,14512,0;1,4,182875,0; | Q779: =INT(((55+RC[-14]/10)*35+200)*12/4) -> 14512 | S779: =1000*110/100*(1+(55+RC[-16]/10)/200)*100 -> 182875
B780: 1,7,8913,0;1,4,1526,0; | C780: 776 | D780: 1 | E780: 7 | F780: 8913 | G780: 0 | I780: 1 | J780: 4 | K780: 1526 | L780: 0 | O780: ="1,7,"&RC[2]&",0;"&"1,4,"&RC[4]&",0;" -> 1,7,14523,0;1,4,182930,0; | Q780: =INT(((55+RC[-14]/10)*35+200)*12/4) -> 14523 | S780: =1000*110/100*(1+(55+RC[-16]/10)/200)*100 -> 182929.99999999997
B781: 1,7,8923,0;1,4,1527,0; | C781: 777 | D781: 1 | E781: 7 | F781: 8923 | G781: 0 | I781: 1 | J781: 4 | K781: 1527 | L781: 0 | O781: ="1,7,"&RC[2]&",0;"&"1,4,"&RC[4]&",0;" -> 1,7,14533,0;1,4,182985,0; | Q781: =INT(((55+RC[-14]/10)*35+200)*12/4) -> 14533 | S781: =1000*110/100*(1+(55+RC[-16]/10)/200)*100 -> 182985
B782: 1,7,8934,0;1,4,1527,0; | C782: 778 | D782: 1 | E782: 7 | F782: 8934 | G782: 0 | I782: 1 | J782: 4 | K782: 1527 | L782: 0 | O782: ="1,7,"&RC[2]&",0;"&"1,4,"&RC[4]&",0;" -> 1,7,14544,0;1,4,183040,0; | Q782: =INT(((55+RC[-14]/10)*35+200)*12/4) -> 14544 | S782: =1000*110/100*(1+(55+RC[-16]/10)/200)*100 -> 183040
B783: 1,7,8944,0;1,4,1528,0; | C783: 779 | D783: 1 | E783: 7 | F783: 8944 | G783: 0 | I783: 1 | J783: 4 | K783: 1528 | L783: 0 | O783: ="1,7,"&RC[2]&",0;"&"1,4,"&RC[4]&",0;" -> 1,7,14554,0;1,4,183095,0; | Q783: =INT(((55+RC[-14]/10)*35+200)*12/4) -> 14554 | S783: =1000*110/100*(1+(55+RC[-16]/10)/200)*100 -> 183094.99999999997
B784: 1,7,8955,0;1,4,1529,0; | C784: 780 | D784: 1 | E784: 7 | F784: 8955 | G784: 0 | I784: 1 | J784: 4 | K784: 1529 | L784: 0 | O784: ="1,7,"&RC[2]&",0;"&"1,4,"&RC[4]&",0;" -> 1,7,14565,0;1,4,183150,0; | Q784: =INT(((55+RC[-14]/10)*35+200)*12/4) -> 14565 | S784: =1000*110/100*(1+(55+RC[-16]/10)/200)*100 -> 183150
B785: 1,7,8965,0;1,4,1529,0; | C785: 781 | D785: 1 | E785: 7 | F785: 8965 | G785: 0 | I785: 1 | J785: 4 | K785: 1529 | L785: 0 | O785: ="1,7,"&RC[2]&",0;"&"1,4,"&RC[4]&",0;" -> 1,7,14575,0;1,4,183205,0; | Q785: =INT(((55+RC[-14]/10)*35+200)*12/4) -> 14575 | S785: =1000*110/100*(1+(55+RC[-16]/10)/200)*100 -> 183205
B786: 1,7,8976,0;1,4,1530,0; | C786: 782 | D786: 1 | E786: 7 | F786: 8976 | G786: 0 | I786: 1 | J786: 4 | K786: 1530 | L786: 0 | O786: ="1,7,"&RC[2]&",0;"&"1,4,"&RC[4]&",0;" -> 1,7,14586,0;1,4,183260,0; | Q786: =INT(((55+RC[-14]/10)*35+200)*12/4) -> 14586 | S786: =1000*110/100*(1+(55+RC[-16]/10)/200)*100 -> 183260
B787: 1,7,8986,0;1,4,1530,0; | C787: 783 | D787: 1 | E787: 7 | F787: 8986 | G787: 0 | I787: 1 | J787: 4 | K787: 1530 | L787: 0 | O787: ="1,7,"&RC[2]&",0;"&"1,4,"&RC[4]&",0;" -> 1,7,14596,0;1,4,183315,0; | Q787: =INT(((55+RC[-14]/10)*35+200)*12/4) -> 14596 | S787: =1000*110/100*(1+(55+RC[-16]/10)/200)*100 -> 183315
B788: 1,7,8997,0;1,4,1531,0; | C788: 784 | D788: 1 | E788: 7 | F788: 8997 | G788: 0 | I788: 1 | J788: 4 | K788: 1531 | L788: 0 | O788: ="1,7,"&RC[2]&",0;"&"1,4,"&RC[4]&",0;" -> 1,7,14607,0;1,4,183370,0; | Q788: =INT(((55+RC[-14]/10)*35+200)*12/4) -> 14607 | S788: =1000*110/100*(1+(55+RC[-16]/10)/200)*100 -> 183370
B789: 1,7,9007,0;1,4,1531,0; | C789: 785 | D789: 1 | E789: 7 | F789: 9007 | G789: 0 | I789: 1 | J789: 4 | K789: 1531 | L789: 0 | O789: ="1,7,"&RC[2]&",0;"&"1,4,"&RC[4]&",0;" -> 1,7,14617,0;1,4,183425,0; | Q789: =INT(((55+RC[-14]/10)*35+200)*12/4) -> 14617 | S789: =1000*110/100*(1+(55+RC[-16]/10)/200)*100 -> 183425
B790: 1,7,9018,0;1,4,1532,0; | C790: 786 | D790: 1 | E790: 7 | F790: 9018 | G790: 0 | I790: 1 | J790: 4 | K790: 1532 | L790: 0 | O790: ="1,7,"&RC[2]&",0;"&"1,4,"&RC[4]&",0;" -> 1,7,14628,0;1,4,183480,0; | Q790: =INT(((55+RC[-14]/10)*35+200)*12/4) -> 14628 | S790: =1000*110/100*(1+(55+RC[-16]/10)/200)*100 -> 183480
B791: 1,7,9028,0;1,4,1532,0; | C791: 787 | D791: 1 | E791: 7 | F791: 9028 | G791: 0 | I791: 1 | J791: 4 | K791: 1532 | L791: 0 | O791: ="1,7,"&RC[2]&",0;"&"1,4,"&RC[4]&",0;" -> 1,7,14638,0;1,4,183535,0; | Q791: =INT(((55+RC[-14]/10)*35+200)*12/4) -> 14638 | S791: =1000*110/100*(1+(55+RC[-16]/10)/200)*100 -> 183535
B792: 1,7,9039,0;1,4,1533,0; | C792: 788 | D792: 1 | E792: 7 | F792: 9039 | G792: 0 | I792: 1 | J792: 4 | K792: 1533 | L792: 0 | O792: ="1,7,"&RC[2]&",0;"&"1,4,"&RC[4]&",0;" -> 1,7,14649,0;1,4,183590,0; | Q792: =INT(((55+RC[-14]/10)*35+200)*12/4) -> 14649 | S792: =1000*110/100*(1+(55+RC[-16]/10)/200)*100 -> 183590
B793: 1,7,9049,0;1,4,1533,0; | C793: 789 | D793: 1 | E793: 7 | F793: 9049 | G793: 0 | I793: 1 | J793: 4 | K793: 1533 | L793: 0 | O793: ="1,7,"&RC[2]&",0;"&"1,4,"&RC[4]&",0;" -> 1,7,14659,0;1,4,183645,0; | Q793: =INT(((55+RC[-14]/10)*35+200)*12/4) -> 14659 | S793: =1000*110/100*(1+(55+RC[-16]/10)/200)*100 -> 183645
B794: 1,7,9060,0;1,4,1534,0; | C794: 790 | D794: 1 | E794: 7 | F794: 9060 | G794: 0 | I794: 1 | J794: 4 | K794: 1534 | L794: 0 | O794: ="1,7,"&RC[2]&",0;"&"1,4,"&RC[4]&",0;" -> 1,7,14670,0;1,4,183700,0; | Q794: =INT(((55+RC[-14]/10)*35+200)*12/4) -> 14670 | S794: =1000*110/100*(1+(55+RC[-16]/10)/200)*100 -> 183700
B795: 1,7,9070,0;1,4,1535,0; | C795: 791 | D795: 1 | E795: 7 | F795: 9070 | G795: 0 | I795: 1 | J795: 4 | K795: 1535 | L795: 0 | O795: ="1,7,"&RC[2]&",0;"&"1,4,"&RC[4]&",0;" -> 1,7,14680,0;1,4,183755,0; | Q795: =INT(((55+RC[-14]/10)*35+200)*12/4) -> 14680 | S795: =1000*110/100*(1+(55+RC[-16]/10)/200)*100 -> 183755.00000000003
B796: 1,7,9081,0;1,4,1535,0; | C796: 792 | D796: 1 | E796: 7 | F796: 9081 | G796: 0 | I796: 1 | J796: 4 | K796: 1535 | L796: 0 | O796: ="1,7,"&RC[2]&",0;"&"1,4,"&RC[4]&",0;" -> 1,7,14691,0;1,4,183810,0; | Q796: =INT(((55+RC[-14]/10)*35+200)*12/4) -> 14691 | S796: =1000*110/100*(1+(55+RC[-16]/10)/200)*100 -> 183810
B797: 1,7,9091,0;1,4,1536,0; | C797: 793 | D797: 1 | E797: 7 | F797: 9091 | G797: 0 | I797: 1 | J797: 4 | K797: 1536 | L797: 0 | O797: ="1,7,"&RC[2]&",0;"&"1,4,"&RC[4]&",0;" -> 1,7,14701,0;1,4,183865,0; | Q797: =INT(((55+RC[-14]/10)*35+200)*12/4) -> 14701 | S797: =1000*110/100*(1+(55+RC[-16]/10)/200)*100 -> 183865
B798: 1,7,9102,0;1,4,1536,0; | C798: 794 | D798: 1 | E798: 7 | F798: 9102 | G798: 0 | I798: 1 | J798: 4 | K798: 1536 | L798: 0 | O798: ="1,7,"&RC[2]&",0;"&"1,4,"&RC[4]&",0;" -> 1,7,14712,0;1,4,183920,0; | Q798: =INT(((55+RC[-14]/10)*35+200)*12/4) -> 14712 | S798: =1000*110/100*(1+(55+RC[-16]/10)/200)*100 -> 183920.00000000003
B799: 1,7,9112,0;1,4,1537,0; | C799: 795 | D799: 1 | E799: 7 | F799: 9112 | G799: 0 | I799: 1 | J799: 4 | K799: 1537 | L799: 0 | O799: ="1,7,"&RC[2]&",0;"&"1,4,"&RC[4]&",0;" -> 1,7,14722,0;1,4,183975,0; | Q799: =INT(((55+RC[-14]/10)*35+200)*12/4) -> 14722 | S799: =1000*110/100*(1+(55+RC[-16]/10)/200)*100 -> 183974.99999999997
B800: 1,7,9123,0;1,4,1537,0; | C800: 796 | D800: 1 | E800: 7 | F800: 9123 | G800: 0 | I800: 1 | J800: 4 | K800: 1537 | L800: 0 | O800: ="1,7,"&RC[2]&",0;"&"1,4,"&RC[4]&",0;" -> 1,7,14733,0;1,4,184030,0; | Q800: =INT(((55+RC[-14]/10)*35+200)*12/4) -> 14733 | S800: =1000*110/100*(1+(55+RC[-16]/10)/200)*100 -> 184030
B801: 1,7,9133,0;1,4,1538,0; | C801: 797 | D801: 1 | E801: 7 | F801: 9133 | G801: 0 | I801: 1 | J801: 4 | K801: 1538 | L801: 0 | O801: ="1,7,"&RC[2]&",0;"&"1,4,"&RC[4]&",0;" -> 1,7,14743,0;1,4,184085,0; | Q801: =INT(((55+RC[-14]/10)*35+200)*12/4) -> 14743 | S801: =1000*110/100*(1+(55+RC[-16]/10)/200)*100 -> 184085
B802: 1,7,9144,0;1,4,1538,0; | C802: 798 | D802: 1 | E802: 7 | F802: 9144 | G802: 0 | I802: 1 | J802: 4 | K802: 1538 | L802: 0 | O802: ="1,7,"&RC[2]&",0;"&"1,4,"&RC[4]&",0;" -> 1,7,14754,0;1,4,184140,0; | Q802: =INT(((55+RC[-14]/10)*35+200)*12/4) -> 14754 | S802: =1000*110/100*(1+(55+RC[-16]/10)/200)*100 -> 184140
B803: 1,7,9154,0;1,4,1539,0; | C803: 799 | D803: 1 | E803: 7 | F803: 9154 | G803: 0 | I803: 1 | J803: 4 | K803: 1539 | L803: 0 | O803: ="1,7,"&RC[2]&",0;"&"1,4,"&RC[4]&",0;" -> 1,7,14764,0;1,4,184195,0; | Q803: =INT(((55+RC[-14]/10)*35+200)*12/4) -> 14764 | S803: =1000*110/100*(1+(55+RC[-16]/10)/200)*100 -> 184195
B804: 1,7,9165,0;1,4,1540,0; | C804: 800 | D804: 1 | E804: 7 | F804: 9165 | G804: 0 | I804: 1 | J804: 4 | K804: 1540 | L804: 0 | O804: ="1,7,"&RC[2]&",0;"&"1,4,"&RC[4]&",0;" -> 1,7,14775,0;1,4,184250,0; | Q804: =INT(((55+RC[-14]/10)*35+200)*12/4) -> 14775 | S804: =1000*110/100*(1+(55+RC[-16]/10)/200)*100 -> 184250
B805: 1,7,9175,0;1,4,1540,0; | C805: 801 | D805: 1 | E805: 7 | F805: 9175 | G805: 0 | I805: 1 | J805: 4 | K805: 1540 | L805: 0 | O805: ="1,7,"&RC[2]&",0;"&"1,4,"&RC[4]&",0;" -> 1,7,14785,0;1,4,184305,0; | Q805: =INT(((55+RC[-14]/10)*35+200)*12/4) -> 14785 | S805: =1000*110/100*(1+(55+RC[-16]/10)/200)*100 -> 184305
B806: 1,7,9186,0;1,4,1541,0; | C806: 802 | D806: 1 | E806: 7 | F806: 9186 | G806: 0 | I806: 1 | J806: 4 | K806: 1541 | L806: 0 | O806: ="1,7,"&RC[2]&",0;"&"1,4,"&RC[4]&",0;" -> 1,7,14796,0;1,4,184360,0; | Q806: =INT(((55+RC[-14]/10)*35+200)*12/4) -> 14796 | S806: =1000*110/100*(1+(55+RC[-16]/10)/200)*100 -> 184360
B807: 1,7,9196,0;1,4,1541,0; | C807: 803 | D807: 1 | E807: 7 | F807: 9196 | G807: 0 | I807: 1 | J807: 4 | K807: 1541 | L807: 0 | O807: ="1,7,"&RC[2]&",0;"&"1,4,"&RC[4]&",0;" -> 1,7,14806,0;1,4,184415,0; | Q807: =INT(((55+RC[-14]/10)*35+200)*12/4) -> 14806 | S807: =1000*110/100*(1+(55+RC[-16]/10)/200)*100 -> 184415
B808: 1,7,9207,0;1,4,1542,0; | C808: 804 | D808: 1 | E808: 7 | F808: 9207 | G808: 0 | I808: 1 | J808: 4 | K808: 1542 | L808: 0 | O808: ="1,7,"&RC[2]&",0;"&"1,4,"&RC[4]&",0;" -> 1,7,14817,0;1,4,184470,0; | Q808: =INT(((55+RC[-14]/10)*35+200)*12/4) -> 14817 | S808: =1000*110/100*(1+(55+RC[-16]/10)/200)*100 -> 184470
B809: 1,7,9217,0;1,4,1542,0; | C809: 805 | D809: 1 | E809: 7 | F809: 9217 | G809: 0 | I809: 1 | J809: 4 | K809: 1542 | L809: 0 | O809: ="1,7,"&RC[2]&",0;"&"1,4,"&RC[4]&",0;" -> 1,7,14827,0;1,4,184525,0; | Q809: =INT(((55+RC[-14]/10)*35+200)*12/4) -> 14827 | S809: =1000*110/100*(1+(55+RC[-16]/10)/200)*100 -> 184525
B810: 1,7,9228,0;1,4,1543,0; | C810: 806 | D810: 1 | E810: 7 | F810: 9228 | G810: 0 | I810: 1 | J810: 4 | K810: 1543 | L810: 0 | O810: ="1,7,"&RC[2]&",0;"&"1,4,"&RC[4]&",0;" -> 1,7,14838,0;1,4,184580,0; | Q810: =INT(((55+RC[-14]/10)*35+200)*12/4) -> 14838 | S810: =1000*110/100*(1+(55+RC[-16]/10)/200)*100 -> 184580
B811: 1,7,9238,0;1,4,1543,0; | C811: 807 | D811: 1 | E811: 7 | F811: 9238 | G811: 0 | I811: 1 | J811: 4 | K811: 1543 | L811: 0 | O811: ="1,7,"&RC[2]&",0;"&"1,4,"&RC[4]&",0;" -> 1,7,14848,0;1,4,184635,0; | Q811: =INT(((55+RC[-14]/10)*35+200)*12/4) -> 14848 | S811: =1000*110/100*(1+(55+RC[-16]/10)/200)*100 -> 184635
B812: 1,7,9249,0;1,4,1544,0; | C812: 808 | D812: 1 | E812: 7 | F812: 9249 | G812: 0 | I812: 1 | J812: 4 | K812: 1544 | L812: 0 | O812: ="1,7,"&RC[2]&",0;"&"1,4,"&RC[4]&",0;" -> 1,7,14859,0;1,4,184690,0; | Q812: =INT(((55+RC[-14]/10)*35+200)*12/4) -> 14859 | S812: =1000*110/100*(1+(55+RC[-16]/10)/200)*100 -> 184690
B813: 1,7,9259,0;1,4,1544,0; | C813: 809 | D813: 1 | E813: 7 | F813: 9259 | G813: 0 | I813: 1 | J813: 4 | K813: 1544 | L813: 0 | O813: ="1,7,"&RC[2]&",0;"&"1,4,"&RC[4]&",0;" -> 1,7,14869,0;1,4,184745,0; | Q813: =INT(((55+RC[-14]/10)*35+200)*12/4) -> 14869 | S813: =1000*110/100*(1+(55+RC[-16]/10)/200)*100 -> 184745
B814: 1,7,9270,0;1,4,1545,0; | C814: 810 | D814: 1 | E814: 7 | F814: 9270 | G814: 0 | I814: 1 | J814: 4 | K814: 1545 | L814: 0 | O814: ="1,7,"&RC[2]&",0;"&"1,4,"&RC[4]&",0;" -> 1,7,14880,0;1,4,184800,0; | Q814: =INT(((55+RC[-14]/10)*35+200)*12/4) -> 14880 | S814: =1000*110/100*(1+(55+RC[-16]/10)/200)*100 -> 184800.00000000003
B815: 1,7,9280,0;1,4,1546,0; | C815: 811 | D815: 1 | E815: 7 | F815: 9280 | G815: 0 | I815: 1 | J815: 4 | K815: 1546 | L815: 0 | O815: ="1,7,"&RC[2]&",0;"&"1,4,"&RC[4]&",0;" -> 1,7,14890,0;1,4,184855,0; | Q815: =INT(((55+RC[-14]/10)*35+200)*12/4) -> 14890 | S815: =1000*110/100*(1+(55+RC[-16]/10)/200)*100 -> 184855
B816: 1,7,9291,0;1,4,1546,0; | C816: 812 | D816: 1 | E816: 7 | F816: 9291 | G816: 0 | I816: 1 | J816: 4 | K816: 1546 | L816: 0 | O816: ="1,7,"&RC[2]&",0;"&"1,4,"&RC[4]&",0;" -> 1,7,14901,0;1,4,184910,0; | Q816: =INT(((55+RC[-14]/10)*35+200)*12/4) -> 14901 | S816: =1000*110/100*(1+(55+RC[-16]/10)/200)*100 -> 184910
B817: 1,7,9301,0;1,4,1547,0; | C817: 813 | D817: 1 | E817: 7 | F817: 9301 | G817: 0 | I817: 1 | J817: 4 | K817: 1547 | L817: 0 | O817: ="1,7,"&RC[2]&",0;"&"1,4,"&RC[4]&",0;" -> 1,7,14911,0;1,4,184965,0; | Q817: =INT(((55+RC[-14]/10)*35+200)*12/4) -> 14911 | S817: =1000*110/100*(1+(55+RC[-16]/10)/200)*100 -> 184965.00000000003
B818: 1,7,9312,0;1,4,1547,0; | C818: 814 | D818: 1 | E818: 7 | F818: 9312 | G818: 0 | I818: 1 | J818: 4 | K818: 1547 | L818: 0 | O818: ="1,7,"&RC[2]&",0;"&"1,4,"&RC[4]&",0;" -> 1,7,14922,0;1,4,185020,0; | Q818: =INT(((55+RC[-14]/10)*35+200)*12/4) -> 14922 | S818: =1000*110/100*(1+(55+RC[-16]/10)/200)*100 -> 185020
B819: 1,7,9322,0;1,4,1548,0; | C819: 815 | D819: 1 | E819: 7 | F819: 9322 | G819: 0 | I819: 1 | J819: 4 | K819: 1548 | L819: 0 | O819: ="1,7,"&RC[2]&",0;"&"1,4,"&RC[4]&",0;" -> 1,7,14932,0;1,4,185075,0; | Q819: =INT(((55+RC[-14]/10)*35+200)*12/4) -> 14932 | S819: =1000*110/100*(1+(55+RC[-16]/10)/200)*100 -> 185075.00000000003
B820: 1,7,9333,0;1,4,1548,0; | C820: 816 | D820: 1 | E820: 7 | F820: 9333 | G820: 0 | I820: 1 | J820: 4 | K820: 1548 | L820: 0 | O820: ="1,7,"&RC[2]&",0;"&"1,4,"&RC[4]&",0;" -> 1,7,14943,0;1,4,185130,0; | Q820: =INT(((55+RC[-14]/10)*35+200)*12/4) -> 14943 | S820: =1000*110/100*(1+(55+RC[-16]/10)/200)*100 -> 185129.99999999997
B821: 1,7,9343,0;1,4,1549,0; | C821: 817 | D821: 1 | E821: 7 | F821: 9343 | G821: 0 | I821: 1 | J821: 4 | K821: 1549 | L821: 0 | O821: ="1,7,"&RC[2]&",0;"&"1,4,"&RC[4]&",0;" -> 1,7,14953,0;1,4,185185,0; | Q821: =INT(((55+RC[-14]/10)*35+200)*12/4) -> 14953 | S821: =1000*110/100*(1+(55+RC[-16]/10)/200)*100 -> 185185
B822: 1,7,9354,0;1,4,1549,0; | C822: 818 | D822: 1 | E822: 7 | F822: 9354 | G822: 0 | I822: 1 | J822: 4 | K822: 1549 | L822: 0 | O822: ="1,7,"&RC[2]&",0;"&"1,4,"&RC[4]&",0;" -> 1,7,14964,0;1,4,185240,0; | Q822: =INT(((55+RC[-14]/10)*35+200)*12/4) -> 14964 | S822: =1000*110/100*(1+(55+RC[-16]/10)/200)*100 -> 185240
B823: 1,7,9364,0;1,4,1550,0; | C823: 819 | D823: 1 | E823: 7 | F823: 9364 | G823: 0 | I823: 1 | J823: 4 | K823: 1550 | L823: 0 | O823: ="1,7,"&RC[2]&",0;"&"1,4,"&RC[4]&",0;" -> 1,7,14974,0;1,4,185295,0; | Q823: =INT(((55+RC[-14]/10)*35+200)*12/4) -> 14974 | S823: =1000*110/100*(1+(55+RC[-16]/10)/200)*100 -> 185294.99999999997
B824: 1,7,9375,0;1,4,1551,0; | C824: 820 | D824: 1 | E824: 7 | F824: 9375 | G824: 0 | I824: 1 | J824: 4 | K824: 1551 | L824: 0 | O824: ="1,7,"&RC[2]&",0;"&"1,4,"&RC[4]&",0;" -> 1,7,14985,0;1,4,185350,0; | Q824: =INT(((55+RC[-14]/10)*35+200)*12/4) -> 14985 | S824: =1000*110/100*(1+(55+RC[-16]/10)/200)*100 -> 185350
B825: 1,7,9385,0;1,4,1551,0; | C825: 821 | D825: 1 | E825: 7 | F825: 9385 | G825: 0 | I825: 1 | J825: 4 | K825: 1551 | L825: 0 | O825: ="1,7,"&RC[2]&",0;"&"1,4,"&RC[4]&",0;" -> 1,7,14995,0;1,4,185405,0; | Q825: =INT(((55+RC[-14]/10)*35+200)*12/4) -> 14995 | S825: =1000*110/100*(1+(55+RC[-16]/10)/200)*100 -> 185405
B826: 1,7,9396,0;1,4,1552,0; | C826: 822 | D826: 1 | E826: 7 | F826: 9396 | G826: 0 | I826: 1 | J826: 4 | K826: 1552 | L826: 0 | O826: ="1,7,"&RC[2]&",0;"&"1,4,"&RC[4]&",0;" -> 1,7,15006,0;1,4,185460,0; | Q826: =INT(((55+RC[-14]/10)*35+200)*12/4) -> 15006 | S826: =1000*110/100*(1+(55+RC[-16]/10)/200)*100 -> 185460
B827: 1,7,9406,0;1,4,1552,0; | C827: 823 | D827: 1 | E827: 7 | F827: 9406 | G827: 0 | I827: 1 | J827: 4 | K827: 1552 | L827: 0 | O827: ="1,7,"&RC[2]&",0;"&"1,4,"&RC[4]&",0;" -> 1,7,15016,0;1,4,185515,0; | Q827: =INT(((55+RC[-14]/10)*35+200)*12/4) -> 15016 | S827: =1000*110/100*(1+(55+RC[-16]/10)/200)*100 -> 185515
B828: 1,7,9417,0;1,4,1553,0; | C828: 824 | D828: 1 | E828: 7 | F828: 9417 | G828: 0 | I828: 1 | J828: 4 | K828: 1553 | L828: 0 | O828: ="1,7,"&RC[2]&",0;"&"1,4,"&RC[4]&",0;" -> 1,7,15027,0;1,4,185570,0; | Q828: =INT(((55+RC[-14]/10)*35+200)*12/4) -> 15027 | S828: =1000*110/100*(1+(55+RC[-16]/10)/200)*100 -> 185570
B829: 1,7,9427,0;1,4,1553,0; | C829: 825 | D829: 1 | E829: 7 | F829: 9427 | G829: 0 | I829: 1 | J829: 4 | K829: 1553 | L829: 0 | O829: ="1,7,"&RC[2]&",0;"&"1,4,"&RC[4]&",0;" -> 1,7,15037,0;1,4,185625,0; | Q829: =INT(((55+RC[-14]/10)*35+200)*12/4) -> 15037 | S829: =1000*110/100*(1+(55+RC[-16]/10)/200)*100 -> 185625
B830: 1,7,9438,0;1,4,1554,0; | C830: 826 | D830: 1 | E830: 7 | F830: 9438 | G830: 0 | I830: 1 | J830: 4 | K830: 1554 | L830: 0 | O830: ="1,7,"&RC[2]&",0;"&"1,4,"&RC[4]&",0;" -> 1,7,15048,0;1,4,185680,0; | Q830: =INT(((55+RC[-14]/10)*35+200)*12/4) -> 15048 | S830: =1000*110/100*(1+(55+RC[-16]/10)/200)*100 -> 185680
B831: 1,7,9448,0;1,4,1554,0; | C831: 827 | D831: 1 | E831: 7 | F831: 9448 | G831: 0 | I831: 1 | J831: 4 | K831: 1554 | L831: 0 | O831: ="1,7,"&RC[2]&",0;"&"1,4,"&RC[4]&",0;" -> 1,7,15058,0;1,4,185735,0; | Q831: =INT(((55+RC[-14]/10)*35+200)*12/4) -> 15058 | S831: =1000*110/100*(1+(55+RC[-16]/10)/200)*100 -> 185735
B832: 1,7,9459,0;1,4,1555,0; | C832: 828 | D832: 1 | E832: 7 | F832: 9459 | G832: 0 | I832: 1 | J832: 4 | K832: 1555 | L832: 0 | O832: ="1,7,"&RC[2]&",0;"&"1,4,"&RC[4]&",0;" -> 1,7,15069,0;1,4,185790,0; | Q832: =INT(((55+RC[-14]/10)*35+200)*12/4) -> 15069 | S832: =1000*110/100*(1+(55+RC[-16]/10)/200)*100 -> 185790
B833: 1,7,9469,0;1,4,1555,0; | C833: 829 | D833: 1 | E833: 7 | F833: 9469 | G833: 0 | I833: 1 | J833: 4 | K833: 1555 | L833: 0 | O833: ="1,7,"&RC[2]&",0;"&"1,4,"&RC[4]&",0;" -> 1,7,15079,0;1,4,185845,0; | Q833: =INT(((55+RC[-14]/10)*35+200)*12/4) -> 15079 | S833: =1000*110/100*(1+(55+RC[-16]/10)/200)*100 -> 185845
B834: 1,7,9480,0;1,4,1556,0; | C834: 830 | D834: 1 | E834: 7 | F834: 9480 | G834: 0 | I834: 1 | J834: 4 | K834: 1556 | L834: 0 | O834: ="1,7,"&RC[2]&",0;"&"1,4,"&RC[4]&",0;" -> 1,7,15090,0;1,4,185900,0; | Q834: =INT(((55+RC[-14]/10)*35+200)*12/4) -> 15090 | S834: =1000*110/100*(1+(55+RC[-16]/10)/200)*100 -> 185900
B835: 1,7,9490,0;1,4,1557,0; | C835: 831 | D835: 1 | E835: 7 | F835: 9490 | G835: 0 | I835: 1 | J835: 4 | K835: 1557 | L835: 0 | O835: ="1,7,"&RC[2]&",0;"&"1,4,"&RC[4]&",0;" -> 1,7,15100,0;1,4,185955,0; | Q835: =INT(((55+RC[-14]/10)*35+200)*12/4) -> 15100 | S835: =1000*110/100*(1+(55+RC[-16]/10)/200)*100 -> 185955.00000000003
B836: 1,7,9501,0;1,4,1557,0; | C836: 832 | D836: 1 | E836: 7 | F836: 9501 | G836: 0 | I836: 1 | J836: 4 | K836: 1557 | L836: 0 | O836: ="1,7,"&RC[2]&",0;"&"1,4,"&RC[4]&",0;" -> 1,7,15111,0;1,4,186010,0; | Q836: =INT(((55+RC[-14]/10)*35+200)*12/4) -> 15111 | S836: =1000*110/100*(1+(55+RC[-16]/10)/200)*100 -> 186010
B837: 1,7,9511,0;1,4,1558,0; | C837: 833 | D837: 1 | E837: 7 | F837: 9511 | G837: 0 | I837: 1 | J837: 4 | K837: 1558 | L837: 0 | O837: ="1,7,"&RC[2]&",0;"&"1,4,"&RC[4]&",0;" -> 1,7,15121,0;1,4,186065,0; | Q837: =INT(((55+RC[-14]/10)*35+200)*12/4) -> 15121 | S837: =1000*110/100*(1+(55+RC[-16]/10)/200)*100 -> 186065
B838: 1,7,9522,0;1,4,1558,0; | C838: 834 | D838: 1 | E838: 7 | F838: 9522 | G838: 0 | I838: 1 | J838: 4 | K838: 1558 | L838: 0 | O838: ="1,7,"&RC[2]&",0;"&"1,4,"&RC[4]&",0;" -> 1,7,15132,0;1,4,186120,0; | Q838: =INT(((55+RC[-14]/10)*35+200)*12/4) -> 15132 | S838: =1000*110/100*(1+(55+RC[-16]/10)/200)*100 -> 186120.00000000003
B839: 1,7,9532,0;1,4,1559,0; | C839: 835 | D839: 1 | E839: 7 | F839: 9532 | G839: 0 | I839: 1 | J839: 4 | K839: 1559 | L839: 0 | O839: ="1,7,"&RC[2]&",0;"&"1,4,"&RC[4]&",0;" -> 1,7,15142,0;1,4,186175,0; | Q839: =INT(((55+RC[-14]/10)*35+200)*12/4) -> 15142 | S839: =1000*110/100*(1+(55+RC[-16]/10)/200)*100 -> 186174.99999999997
B840: 1,7,9543,0;1,4,1559,0; | C840: 836 | D840: 1 | E840: 7 | F840: 9543 | G840: 0 | I840: 1 | J840: 4 | K840: 1559 | L840: 0 | O840: ="1,7,"&RC[2]&",0;"&"1,4,"&RC[4]&",0;" -> 1,7,15153,0;1,4,186230,0; | Q840: =INT(((55+RC[-14]/10)*35+200)*12/4) -> 15153 | S840: =1000*110/100*(1+(55+RC[-16]/10)/200)*100 -> 186230
B841: 1,7,9553,0;1,4,1560,0; | C841: 837 | D841: 1 | E841: 7 | F841: 9553 | G841: 0 | I841: 1 | J841: 4 | K841: 1560 | L841: 0 | O841: ="1,7,"&RC[2]&",0;"&"1,4,"&RC[4]&",0;" -> 1,7,15163,0;1,4,186285,0; | Q841: =INT(((55+RC[-14]/10)*35+200)*12/4) -> 15163 | S841: =1000*110/100*(1+(55+RC[-16]/10)/200)*100 -> 186284.99999999997
B842: 1,7,9564,0;1,4,1560,0; | C842: 838 | D842: 1 | E842: 7 | F842: 9564 | G842: 0 | I842: 1 | J842: 4 | K842: 1560 | L842: 0 | O842: ="1,7,"&RC[2]&",0;"&"1,4,"&RC[4]&",0;" -> 1,7,15174,0;1,4,186340,0; | Q842: =INT(((55+RC[-14]/10)*35+200)*12/4) -> 15174 | S842: =1000*110/100*(1+(55+RC[-16]/10)/200)*100 -> 186340
B843: 1,7,9574,0;1,4,1561,0; | C843: 839 | D843: 1 | E843: 7 | F843: 9574 | G843: 0 | I843: 1 | J843: 4 | K843: 1561 | L843: 0 | O843: ="1,7,"&RC[2]&",0;"&"1,4,"&RC[4]&",0;" -> 1,7,15184,0;1,4,186395,0; | Q843: =INT(((55+RC[-14]/10)*35+200)*12/4) -> 15184 | S843: =1000*110/100*(1+(55+RC[-16]/10)/200)*100 -> 186395
B844: 1,7,9585,0;1,4,1562,0; | C844: 840 | D844: 1 | E844: 7 | F844: 9585 | G844: 0 | I844: 1 | J844: 4 | K844: 1562 | L844: 0 | O844: ="1,7,"&RC[2]&",0;"&"1,4,"&RC[4]&",0;" -> 1,7,15195,0;1,4,186450,0; | Q844: =INT(((55+RC[-14]/10)*35+200)*12/4) -> 15195 | S844: =1000*110/100*(1+(55+RC[-16]/10)/200)*100 -> 186449.99999999997
B845: 1,7,9595,0;1,4,1562,0; | C845: 841 | D845: 1 | E845: 7 | F845: 9595 | G845: 0 | I845: 1 | J845: 4 | K845: 1562 | L845: 0 | O845: ="1,7,"&RC[2]&",0;"&"1,4,"&RC[4]&",0;" -> 1,7,15205,0;1,4,186505,0; | Q845: =INT(((55+RC[-14]/10)*35+200)*12/4) -> 15205 | S845: =1000*110/100*(1+(55+RC[-16]/10)/200)*100 -> 186505
B846: 1,7,9606,0;1,4,1563,0; | C846: 842 | D846: 1 | E846: 7 | F846: 9606 | G846: 0 | I846: 1 | J846: 4 | K846: 1563 | L846: 0 | O846: ="1,7,"&RC[2]&",0;"&"1,4,"&RC[4]&",0;" -> 1,7,15216,0;1,4,186560,0; | Q846: =INT(((55+RC[-14]/10)*35+200)*12/4) -> 15216 | S846: =1000*110/100*(1+(55+RC[-16]/10)/200)*100 -> 186560
B847: 1,7,9616,0;1,4,1563,0; | C847: 843 | D847: 1 | E847: 7 | F847: 9616 | G847: 0 | I847: 1 | J847: 4 | K847: 1563 | L847: 0 | O847: ="1,7,"&RC[2]&",0;"&"1,4,"&RC[4]&",0;" -> 1,7,15226,0;1,4,186615,0; | Q847: =INT(((55+RC[-14]/10)*35+200)*12/4) -> 15226 | S847: =1000*110/100*(1+(55+RC[-16]/10)/200)*100 -> 186615
B848: 1,7,9627,0;1,4,1564,0; | C848: 844 | D848: 1 | E848: 7 | F848: 9627 | G848: 0 | I848: 1 | J848: 4 | K848: 1564 | L848: 0 | O848: ="1,7,"&RC[2]&",0;"&"1,4,"&RC[4]&",0;" -> 1,7,15237,0;1,4,186670,0; | Q848: =INT(((55+RC[-14]/10)*35+200)*12/4) -> 15237 | S848: =1000*110/100*(1+(55+RC[-16]/10)/200)*100 -> 186670
B849: 1,7,9637,0;1,4,1564,0; | C849: 845 | D849: 1 | E849: 7 | F849: 9637 | G849: 0 | I849: 1 | J849: 4 | K849: 1564 | L849: 0 | O849: ="1,7,"&RC[2]&",0;"&"1,4,"&RC[4]&",0;" -> 1,7,15247,0;1,4,186725,0; | Q849: =INT(((55+RC[-14]/10)*35+200)*12/4) -> 15247 | S849: =1000*110/100*(1+(55+RC[-16]/10)/200)*100 -> 186725
B850: 1,7,9648,0;1,4,1565,0; | C850: 846 | D850: 1 | E850: 7 | F850: 9648 | G850: 0 | I850: 1 | J850: 4 | K850: 1565 | L850: 0 | O850: ="1,7,"&RC[2]&",0;"&"1,4,"&RC[4]&",0;" -> 1,7,15258,0;1,4,186780,0; | Q850: =INT(((55+RC[-14]/10)*35+200)*12/4) -> 15258 | S850: =1000*110/100*(1+(55+RC[-16]/10)/200)*100 -> 186780
B851: 1,7,9658,0;1,4,1565,0; | C851: 847 | D851: 1 | E851: 7 | F851: 9658 | G851: 0 | I851: 1 | J851: 4 | K851: 1565 | L851: 0 | O851: ="1,7,"&RC[2]&",0;"&"1,4,"&RC[4]&",0;" -> 1,7,15268,0;1,4,186835,0; | Q851: =INT(((55+RC[-14]/10)*35+200)*12/4) -> 15268 | S851: =1000*110/100*(1+(55+RC[-16]/10)/200)*100 -> 186835
B852: 1,7,9669,0;1,4,1566,0; | C852: 848 | D852: 1 | E852: 7 | F852: 9669 | G852: 0 | I852: 1 | J852: 4 | K852: 1566 | L852: 0 | O852: ="1,7,"&RC[2]&",0;"&"1,4,"&RC[4]&",0;" -> 1,7,15279,0;1,4,186890,0; | Q852: =INT(((55+RC[-14]/10)*35+200)*12/4) -> 15279 | S852: =1000*110/100*(1+(55+RC[-16]/10)/200)*100 -> 186890
B853: 1,7,9679,0;1,4,1566,0; | C853: 849 | D853: 1 | E853: 7 | F853: 9679 | G853: 0 | I853: 1 | J853: 4 | K853: 1566 | L853: 0 | O853: ="1,7,"&RC[2]&",0;"&"1,4,"&RC[4]&",0;" -> 1,7,15289,0;1,4,186945,0; | Q853: =INT(((55+RC[-14]/10)*35+200)*12/4) -> 15289 | S853: =1000*110/100*(1+(55+RC[-16]/10)/200)*100 -> 186945
B854: 1,7,9690,0;1,4,1567,0; | C854: 850 | D854: 1 | E854: 7 | F854: 9690 | G854: 0 | I854: 1 | J854: 4 | K854: 1567 | L854: 0 | O854: ="1,7,"&RC[2]&",0;"&"1,4,"&RC[4]&",0;" -> 1,7,15300,0;1,4,187000,0; | Q854: =INT(((55+RC[-14]/10)*35+200)*12/4) -> 15300 | S854: =1000*110/100*(1+(55+RC[-16]/10)/200)*100 -> 187000
B855: 1,7,9700,0;1,4,1568,0; | C855: 851 | D855: 1 | E855: 7 | F855: 9700 | G855: 0 | I855: 1 | J855: 4 | K855: 1568 | L855: 0 | O855: ="1,7,"&RC[2]&",0;"&"1,4,"&RC[4]&",0;" -> 1,7,15310,0;1,4,187055,0; | Q855: =INT(((55+RC[-14]/10)*35+200)*12/4) -> 15310 | S855: =1000*110/100*(1+(55+RC[-16]/10)/200)*100 -> 187055
B856: 1,7,9711,0;1,4,1568,0; | C856: 852 | D856: 1 | E856: 7 | F856: 9711 | G856: 0 | I856: 1 | J856: 4 | K856: 1568 | L856: 0 | O856: ="1,7,"&RC[2]&",0;"&"1,4,"&RC[4]&",0;" -> 1,7,15321,0;1,4,187110,0; | Q856: =INT(((55+RC[-14]/10)*35+200)*12/4) -> 15321 | S856: =1000*110/100*(1+(55+RC[-16]/10)/200)*100 -> 187110
B857: 1,7,9721,0;1,4,1569,0; | C857: 853 | D857: 1 | E857: 7 | F857: 9721 | G857: 0 | I857: 1 | J857: 4 | K857: 1569 | L857: 0 | O857: ="1,7,"&RC[2]&",0;"&"1,4,"&RC[4]&",0;" -> 1,7,15331,0;1,4,187165,0; | Q857: =INT(((55+RC[-14]/10)*35+200)*12/4) -> 15331 | S857: =1000*110/100*(1+(55+RC[-16]/10)/200)*100 -> 187165
B858: 1,7,9732,0;1,4,1569,0; | C858: 854 | D858: 1 | E858: 7 | F858: 9732 | G858: 0 | I858: 1 | J858: 4 | K858: 1569 | L858: 0 | O858: ="1,7,"&RC[2]&",0;"&"1,4,"&RC[4]&",0;" -> 1,7,15342,0;1,4,187220,0; | Q858: =INT(((55+RC[-14]/10)*35+200)*12/4) -> 15342 | S858: =1000*110/100*(1+(55+RC[-16]/10)/200)*100 -> 187220
B859: 1,7,9742,0;1,4,1570,0; | C859: 855 | D859: 1 | E859: 7 | F859: 9742 | G859: 0 | I859: 1 | J859: 4 | K859: 1570 | L859: 0 | O859: ="1,7,"&RC[2]&",0;"&"1,4,"&RC[4]&",0;" -> 1,7,15352,0;1,4,187275,0; | Q859: =INT(((55+RC[-14]/10)*35+200)*12/4) -> 15352 | S859: =1000*110/100*(1+(55+RC[-16]/10)/200)*100 -> 187275.00000000003
B860: 1,7,9753,0;1,4,1570,0; | C860: 856 | D860: 1 | E860: 7 | F860: 9753 | G860: 0 | I860: 1 | J860: 4 | K860: 1570 | L860: 0 | O860: ="1,7,"&RC[2]&",0;"&"1,4,"&RC[4]&",0;" -> 1,7,15363,0;1,4,187330,0; | Q860: =INT(((55+RC[-14]/10)*35+200)*12/4) -> 15363 | S860: =1000*110/100*(1+(55+RC[-16]/10)/200)*100 -> 187329.99999999997
B861: 1,7,9763,0;1,4,1571,0; | C861: 857 | D861: 1 | E861: 7 | F861: 9763 | G861: 0 | I861: 1 | J861: 4 | K861: 1571 | L861: 0 | O861: ="1,7,"&RC[2]&",0;"&"1,4,"&RC[4]&",0;" -> 1,7,15373,0;1,4,187385,0; | Q861: =INT(((55+RC[-14]/10)*35+200)*12/4) -> 15373 | S861: =1000*110/100*(1+(55+RC[-16]/10)/200)*100 -> 187385
B862: 1,7,9774,0;1,4,1571,0; | C862: 858 | D862: 1 | E862: 7 | F862: 9774 | G862: 0 | I862: 1 | J862: 4 | K862: 1571 | L862: 0 | O862: ="1,7,"&RC[2]&",0;"&"1,4,"&RC[4]&",0;" -> 1,7,15384,0;1,4,187440,0; | Q862: =INT(((55+RC[-14]/10)*35+200)*12/4) -> 15384 | S862: =1000*110/100*(1+(55+RC[-16]/10)/200)*100 -> 187440
B863: 1,7,9784,0;1,4,1572,0; | C863: 859 | D863: 1 | E863: 7 | F863: 9784 | G863: 0 | I863: 1 | J863: 4 | K863: 1572 | L863: 0 | O863: ="1,7,"&RC[2]&",0;"&"1,4,"&RC[4]&",0;" -> 1,7,15394,0;1,4,187495,0; | Q863: =INT(((55+RC[-14]/10)*35+200)*12/4) -> 15394 | S863: =1000*110/100*(1+(55+RC[-16]/10)/200)*100 -> 187494.99999999997
B864: 1,7,9795,0;1,4,1573,0; | C864: 860 | D864: 1 | E864: 7 | F864: 9795 | G864: 0 | I864: 1 | J864: 4 | K864: 1573 | L864: 0 | O864: ="1,7,"&RC[2]&",0;"&"1,4,"&RC[4]&",0;" -> 1,7,15405,0;1,4,187550,0; | Q864: =INT(((55+RC[-14]/10)*35+200)*12/4) -> 15405 | S864: =1000*110/100*(1+(55+RC[-16]/10)/200)*100 -> 187550
B865: 1,7,9805,0;1,4,1573,0; | C865: 861 | D865: 1 | E865: 7 | F865: 9805 | G865: 0 | I865: 1 | J865: 4 | K865: 1573 | L865: 0 | O865: ="1,7,"&RC[2]&",0;"&"1,4,"&RC[4]&",0;" -> 1,7,15415,0;1,4,187605,0; | Q865: =INT(((55+RC[-14]/10)*35+200)*12/4) -> 15415 | S865: =1000*110/100*(1+(55+RC[-16]/10)/200)*100 -> 187605
B866: 1,7,9816,0;1,4,1574,0; | C866: 862 | D866: 1 | E866: 7 | F866: 9816 | G866: 0 | I866: 1 | J866: 4 | K866: 1574 | L866: 0 | O866: ="1,7,"&RC[2]&",0;"&"1,4,"&RC[4]&",0;" -> 1,7,15426,0;1,4,187660,0; | Q866: =INT(((55+RC[-14]/10)*35+200)*12/4) -> 15426 | S866: =1000*110/100*(1+(55+RC[-16]/10)/200)*100 -> 187660
B867: 1,7,9826,0;1,4,1574,0; | C867: 863 | D867: 1 | E867: 7 | F867: 9826 | G867: 0 | I867: 1 | J867: 4 | K867: 1574 | L867: 0 | O867: ="1,7,"&RC[2]&",0;"&"1,4,"&RC[4]&",0;" -> 1,7,15436,0;1,4,187715,0; | Q867: =INT(((55+RC[-14]/10)*35+200)*12/4) -> 15436 | S867: =1000*110/100*(1+(55+RC[-16]/10)/200)*100 -> 187715
B868: 1,7,9837,0;1,4,1575,0; | C868: 864 | D868: 1 | E868: 7 | F868: 9837 | G868: 0 | I868: 1 | J868: 4 | K868: 1575 | L868: 0 | O868: ="1,7,"&RC[2]&",0;"&"1,4,"&RC[4]&",0;" -> 1,7,15447,0;1,4,187770,0; | Q868: =INT(((55+RC[-14]/10)*35+200)*12/4) -> 15447 | S868: =1000*110/100*(1+(55+RC[-16]/10)/200)*100 -> 187770
B869: 1,7,9847,0;1,4,1575,0; | C869: 865 | D869: 1 | E869: 7 | F869: 9847 | G869: 0 | I869: 1 | J869: 4 | K869: 1575 | L869: 0 | O869: ="1,7,"&RC[2]&",0;"&"1,4,"&RC[4]&",0;" -> 1,7,15457,0;1,4,187825,0; | Q869: =INT(((55+RC[-14]/10)*35+200)*12/4) -> 15457 | S869: =1000*110/100*(1+(55+RC[-16]/10)/200)*100 -> 187825
B870: 1,7,9858,0;1,4,1576,0; | C870: 866 | D870: 1 | E870: 7 | F870: 9858 | G870: 0 | I870: 1 | J870: 4 | K870: 1576 | L870: 0 | O870: ="1,7,"&RC[2]&",0;"&"1,4,"&RC[4]&",0;" -> 1,7,15468,0;1,4,187880,0; | Q870: =INT(((55+RC[-14]/10)*35+200)*12/4) -> 15468 | S870: =1000*110/100*(1+(55+RC[-16]/10)/200)*100 -> 187880
B871: 1,7,9868,0;1,4,1576,0; | C871: 867 | D871: 1 | E871: 7 | F871: 9868 | G871: 0 | I871: 1 | J871: 4 | K871: 1576 | L871: 0 | O871: ="1,7,"&RC[2]&",0;"&"1,4,"&RC[4]&",0;" -> 1,7,15478,0;1,4,187935,0; | Q871: =INT(((55+RC[-14]/10)*35+200)*12/4) -> 15478 | S871: =1000*110/100*(1+(55+RC[-16]/10)/200)*100 -> 187935
B872: 1,7,9879,0;1,4,1577,0; | C872: 868 | D872: 1 | E872: 7 | F872: 9879 | G872: 0 | I872: 1 | J872: 4 | K872: 1577 | L872: 0 | O872: ="1,7,"&RC[2]&",0;"&"1,4,"&RC[4]&",0;" -> 1,7,15489,0;1,4,187990,0; | Q872: =INT(((55+RC[-14]/10)*35+200)*12/4) -> 15489 | S872: =1000*110/100*(1+(55+RC[-16]/10)/200)*100 -> 187990
B873: 1,7,9889,0;1,4,1577,0; | C873: 869 | D873: 1 | E873: 7 | F873: 9889 | G873: 0 | I873: 1 | J873: 4 | K873: 1577 | L873: 0 | O873: ="1,7,"&RC[2]&",0;"&"1,4,"&RC[4]&",0;" -> 1,7,15499,0;1,4,188045,0; | Q873: =INT(((55+RC[-14]/10)*35+200)*12/4) -> 15499 | S873: =1000*110/100*(1+(55+RC[-16]/10)/200)*100 -> 188045
B874: 1,7,9900,0;1,4,1578,0; | C874: 870 | D874: 1 | E874: 7 | F874: 9900 | G874: 0 | I874: 1 | J874: 4 | K874: 1578 | L874: 0 | O874: ="1,7,"&RC[2]&",0;"&"1,4,"&RC[4]&",0;" -> 1,7,15510,0;1,4,188100,0; | Q874: =INT(((55+RC[-14]/10)*35+200)*12/4) -> 15510 | S874: =1000*110/100*(1+(55+RC[-16]/10)/200)*100 -> 188100
B875: 1,7,9910,0;1,4,1579,0; | C875: 871 | D875: 1 | E875: 7 | F875: 9910 | G875: 0 | I875: 1 | J875: 4 | K875: 1579 | L875: 0 | O875: ="1,7,"&RC[2]&",0;"&"1,4,"&RC[4]&",0;" -> 1,7,15520,0;1,4,188155,0; | Q875: =INT(((55+RC[-14]/10)*35+200)*12/4) -> 15520 | S875: =1000*110/100*(1+(55+RC[-16]/10)/200)*100 -> 188155.00000000003
B876: 1,7,9921,0;1,4,1579,0; | C876: 872 | D876: 1 | E876: 7 | F876: 9921 | G876: 0 | I876: 1 | J876: 4 | K876: 1579 | L876: 0 | O876: ="1,7,"&RC[2]&",0;"&"1,4,"&RC[4]&",0;" -> 1,7,15531,0;1,4,188210,0; | Q876: =INT(((55+RC[-14]/10)*35+200)*12/4) -> 15531 | S876: =1000*110/100*(1+(55+RC[-16]/10)/200)*100 -> 188210
B877: 1,7,9931,0;1,4,1580,0; | C877: 873 | D877: 1 | E877: 7 | F877: 9931 | G877: 0 | I877: 1 | J877: 4 | K877: 1580 | L877: 0 | O877: ="1,7,"&RC[2]&",0;"&"1,4,"&RC[4]&",0;" -> 1,7,15541,0;1,4,188265,0; | Q877: =INT(((55+RC[-14]/10)*35+200)*12/4) -> 15541 | S877: =1000*110/100*(1+(55+RC[-16]/10)/200)*100 -> 188265
B878: 1,7,9942,0;1,4,1580,0; | C878: 874 | D878: 1 | E878: 7 | F878: 9942 | G878: 0 | I878: 1 | J878: 4 | K878: 1580 | L878: 0 | O878: ="1,7,"&RC[2]&",0;"&"1,4,"&RC[4]&",0;" -> 1,7,15552,0;1,4,188320,0; | Q878: =INT(((55+RC[-14]/10)*35+200)*12/4) -> 15552 | S878: =1000*110/100*(1+(55+RC[-16]/10)/200)*100 -> 188320.00000000003
B879: 1,7,9952,0;1,4,1581,0; | C879: 875 | D879: 1 | E879: 7 | F879: 9952 | G879: 0 | I879: 1 | J879: 4 | K879: 1581 | L879: 0 | O879: ="1,7,"&RC[2]&",0;"&"1,4,"&RC[4]&",0;" -> 1,7,15562,0;1,4,188375,0; | Q879: =INT(((55+RC[-14]/10)*35+200)*12/4) -> 15562 | S879: =1000*110/100*(1+(55+RC[-16]/10)/200)*100 -> 188375
B880: 1,7,9963,0;1,4,1581,0; | C880: 876 | D880: 1 | E880: 7 | F880: 9963 | G880: 0 | I880: 1 | J880: 4 | K880: 1581 | L880: 0 | O880: ="1,7,"&RC[2]&",0;"&"1,4,"&RC[4]&",0;" -> 1,7,15573,0;1,4,188430,0; | Q880: =INT(((55+RC[-14]/10)*35+200)*12/4) -> 15573 | S880: =1000*110/100*(1+(55+RC[-16]/10)/200)*100 -> 188430.00000000003
B881: 1,7,9973,0;1,4,1582,0; | C881: 877 | D881: 1 | E881: 7 | F881: 9973 | G881: 0 | I881: 1 | J881: 4 | K881: 1582 | L881: 0 | O881: ="1,7,"&RC[2]&",0;"&"1,4,"&RC[4]&",0;" -> 1,7,15583,0;1,4,188485,0; | Q881: =INT(((55+RC[-14]/10)*35+200)*12/4) -> 15583 | S881: =1000*110/100*(1+(55+RC[-16]/10)/200)*100 -> 188484.99999999997
B882: 1,7,9984,0;1,4,1582,0; | C882: 878 | D882: 1 | E882: 7 | F882: 9984 | G882: 0 | I882: 1 | J882: 4 | K882: 1582 | L882: 0 | O882: ="1,7,"&RC[2]&",0;"&"1,4,"&RC[4]&",0;" -> 1,7,15594,0;1,4,188540,0; | Q882: =INT(((55+RC[-14]/10)*35+200)*12/4) -> 15594 | S882: =1000*110/100*(1+(55+RC[-16]/10)/200)*100 -> 188540
B883: 1,7,9994,0;1,4,1583,0; | C883: 879 | D883: 1 | E883: 7 | F883: 9994 | G883: 0 | I883: 1 | J883: 4 | K883: 1583 | L883: 0 | O883: ="1,7,"&RC[2]&",0;"&"1,4,"&RC[4]&",0;" -> 1,7,15604,0;1,4,188595,0; | Q883: =INT(((55+RC[-14]/10)*35+200)*12/4) -> 15604 | S883: =1000*110/100*(1+(55+RC[-16]/10)/200)*100 -> 188595
B884: 1,7,10005,0;1,4,1584,0; | C884: 880 | D884: 1 | E884: 7 | F884: 10005 | G884: 0 | I884: 1 | J884: 4 | K884: 1584 | L884: 0 | O884: ="1,7,"&RC[2]&",0;"&"1,4,"&RC[4]&",0;" -> 1,7,15615,0;1,4,188650,0; | Q884: =INT(((55+RC[-14]/10)*35+200)*12/4) -> 15615 | S884: =1000*110/100*(1+(55+RC[-16]/10)/200)*100 -> 188649.99999999997
B885: 1,7,10015,0;1,4,1584,0; | C885: 881 | D885: 1 | E885: 7 | F885: 10015 | G885: 0 | I885: 1 | J885: 4 | K885: 1584 | L885: 0 | O885: ="1,7,"&RC[2]&",0;"&"1,4,"&RC[4]&",0;" -> 1,7,15625,0;1,4,188705,0; | Q885: =INT(((55+RC[-14]/10)*35+200)*12/4) -> 15625 | S885: =1000*110/100*(1+(55+RC[-16]/10)/200)*100 -> 188705
B886: 1,7,10026,0;1,4,1585,0; | C886: 882 | D886: 1 | E886: 7 | F886: 10026 | G886: 0 | I886: 1 | J886: 4 | K886: 1585 | L886: 0 | O886: ="1,7,"&RC[2]&",0;"&"1,4,"&RC[4]&",0;" -> 1,7,15636,0;1,4,188760,0; | Q886: =INT(((55+RC[-14]/10)*35+200)*12/4) -> 15636 | S886: =1000*110/100*(1+(55+RC[-16]/10)/200)*100 -> 188760
B887: 1,7,10036,0;1,4,1585,0; | C887: 883 | D887: 1 | E887: 7 | F887: 10036 | G887: 0 | I887: 1 | J887: 4 | K887: 1585 | L887: 0 | O887: ="1,7,"&RC[2]&",0;"&"1,4,"&RC[4]&",0;" -> 1,7,15646,0;1,4,188815,0; | Q887: =INT(((55+RC[-14]/10)*35+200)*12/4) -> 15646 | S887: =1000*110/100*(1+(55+RC[-16]/10)/200)*100 -> 188815
B888: 1,7,10047,0;1,4,1586,0; | C888: 884 | D888: 1 | E888: 7 | F888: 10047 | G888: 0 | I888: 1 | J888: 4 | K888: 1586 | L888: 0 | O888: ="1,7,"&RC[2]&",0;"&"1,4,"&RC[4]&",0;" -> 1,7,15657,0;1,4,188870,0; | Q888: =INT(((55+RC[-14]/10)*35+200)*12/4) -> 15657 | S888: =1000*110/100*(1+(55+RC[-16]/10)/200)*100 -> 188870
B889: 1,7,10057,0;1,4,1586,0; | C889: 885 | D889: 1 | E889: 7 | F889: 10057 | G889: 0 | I889: 1 | J889: 4 | K889: 1586 | L889: 0 | O889: ="1,7,"&RC[2]&",0;"&"1,4,"&RC[4]&",0;" -> 1,7,15667,0;1,4,188925,0; | Q889: =INT(((55+RC[-14]/10)*35+200)*12/4) -> 15667 | S889: =1000*110/100*(1+(55+RC[-16]/10)/200)*100 -> 188925
B890: 1,7,10068,0;1,4,1587,0; | C890: 886 | D890: 1 | E890: 7 | F890: 10068 | G890: 0 | I890: 1 | J890: 4 | K890: 1587 | L890: 0 | O890: ="1,7,"&RC[2]&",0;"&"1,4,"&RC[4]&",0;" -> 1,7,15678,0;1,4,188980,0; | Q890: =INT(((55+RC[-14]/10)*35+200)*12/4) -> 15678 | S890: =1000*110/100*(1+(55+RC[-16]/10)/200)*100 -> 188980
B891: 1,7,10078,0;1,4,1587,0; | C891: 887 | D891: 1 | E891: 7 | F891: 10078 | G891: 0 | I891: 1 | J891: 4 | K891: 1587 | L891: 0 | O891: ="1,7,"&RC[2]&",0;"&"1,4,"&RC[4]&",0;" -> 1,7,15688,0;1,4,189035,0; | Q891: =INT(((55+RC[-14]/10)*35+200)*12/4) -> 15688 | S891: =1000*110/100*(1+(55+RC[-16]/10)/200)*100 -> 189035
B892: 1,7,10089,0;1,4,1588,0; | C892: 888 | D892: 1 | E892: 7 | F892: 10089 | G892: 0 | I892: 1 | J892: 4 | K892: 1588 | L892: 0 | O892: ="1,7,"&RC[2]&",0;"&"1,4,"&RC[4]&",0;" -> 1,7,15699,0;1,4,189090,0; | Q892: =INT(((55+RC[-14]/10)*35+200)*12/4) -> 15699 | S892: =1000*110/100*(1+(55+RC[-16]/10)/200)*100 -> 189090
B893: 1,7,10099,0;1,4,1588,0; | C893: 889 | D893: 1 | E893: 7 | F893: 10099 | G893: 0 | I893: 1 | J893: 4 | K893: 1588 | L893: 0 | O893: ="1,7,"&RC[2]&",0;"&"1,4,"&RC[4]&",0;" -> 1,7,15709,0;1,4,189145,0; | Q893: =INT(((55+RC[-14]/10)*35+200)*12/4) -> 15709 | S893: =1000*110/100*(1+(55+RC[-16]/10)/200)*100 -> 189145
B894: 1,7,10110,0;1,4,1589,0; | C894: 890 | D894: 1 | E894: 7 | F894: 10110 | G894: 0 | I894: 1 | J894: 4 | K894: 1589 | L894: 0 | O894: ="1,7,"&RC[2]&",0;"&"1,4,"&RC[4]&",0;" -> 1,7,15720,0;1,4,189200,0; | Q894: =INT(((55+RC[-14]/10)*35+200)*12/4) -> 15720 | S894: =1000*110/100*(1+(55+RC[-16]/10)/200)*100 -> 189200
B895: 1,7,10120,0;1,4,1590,0; | C895: 891 | D895: 1 | E895: 7 | F895: 10120 | G895: 0 | I895: 1 | J895: 4 | K895: 1590 | L895: 0 | O895: ="1,7,"&RC[2]&",0;"&"1,4,"&RC[4]&",0;" -> 1,7,15730,0;1,4,189255,0; | Q895: =INT(((55+RC[-14]/10)*35+200)*12/4) -> 15730 | S895: =1000*110/100*(1+(55+RC[-16]/10)/200)*100 -> 189255
B896: 1,7,10131,0;1,4,1590,0; | C896: 892 | D896: 1 | E896: 7 | F896: 10131 | G896: 0 | I896: 1 | J896: 4 | K896: 1590 | L896: 0 | O896: ="1,7,"&RC[2]&",0;"&"1,4,"&RC[4]&",0;" -> 1,7,15741,0;1,4,189310,0; | Q896: =INT(((55+RC[-14]/10)*35+200)*12/4) -> 15741 | S896: =1000*110/100*(1+(55+RC[-16]/10)/200)*100 -> 189310
B897: 1,7,10141,0;1,4,1591,0; | C897: 893 | D897: 1 | E897: 7 | F897: 10141 | G897: 0 | I897: 1 | J897: 4 | K897: 1591 | L897: 0 | O897: ="1,7,"&RC[2]&",0;"&"1,4,"&RC[4]&",0;" -> 1,7,15751,0;1,4,189365,0; | Q897: =INT(((55+RC[-14]/10)*35+200)*12/4) -> 15751 | S897: =1000*110/100*(1+(55+RC[-16]/10)/200)*100 -> 189365
B898: 1,7,10152,0;1,4,1591,0; | C898: 894 | D898: 1 | E898: 7 | F898: 10152 | G898: 0 | I898: 1 | J898: 4 | K898: 1591 | L898: 0 | O898: ="1,7,"&RC[2]&",0;"&"1,4,"&RC[4]&",0;" -> 1,7,15762,0;1,4,189420,0; | Q898: =INT(((55+RC[-14]/10)*35+200)*12/4) -> 15762 | S898: =1000*110/100*(1+(55+RC[-16]/10)/200)*100 -> 189420
B899: 1,7,10162,0;1,4,1592,0; | C899: 895 | D899: 1 | E899: 7 | F899: 10162 | G899: 0 | I899: 1 | J899: 4 | K899: 1592 | L899: 0 | O899: ="1,7,"&RC[2]&",0;"&"1,4,"&RC[4]&",0;" -> 1,7,15772,0;1,4,189475,0; | Q899: =INT(((55+RC[-14]/10)*35+200)*12/4) -> 15772 | S899: =1000*110/100*(1+(55+RC[-16]/10)/200)*100 -> 189475.00000000003
B900: 1,7,10173,0;1,4,1592,0; | C900: 896 | D900: 1 | E900: 7 | F900: 10173 | G900: 0 | I900: 1 | J900: 4 | K900: 1592 | L900: 0 | O900: ="1,7,"&RC[2]&",0;"&"1,4,"&RC[4]&",0;" -> 1,7,15783,0;1,4,189530,0; | Q900: =INT(((55+RC[-14]/10)*35+200)*12/4) -> 15783 | S900: =1000*110/100*(1+(55+RC[-16]/10)/200)*100 -> 189530
B901: 1,7,10183,0;1,4,1593,0; | C901: 897 | D901: 1 | E901: 7 | F901: 10183 | G901: 0 | I901: 1 | J901: 4 | K901: 1593 | L901: 0 | O901: ="1,7,"&RC[2]&",0;"&"1,4,"&RC[4]&",0;" -> 1,7,15793,0;1,4,189585,0; | Q901: =INT(((55+RC[-14]/10)*35+200)*12/4) -> 15793 | S901: =1000*110/100*(1+(55+RC[-16]/10)/200)*100 -> 189585
B902: 1,7,10194,0;1,4,1593,0; | C902: 898 | D902: 1 | E902: 7 | F902: 10194 | G902: 0 | I902: 1 | J902: 4 | K902: 1593 | L902: 0 | O902: ="1,7,"&RC[2]&",0;"&"1,4,"&RC[4]&",0;" -> 1,7,15804,0;1,4,189640,0; | Q902: =INT(((55+RC[-14]/10)*35+200)*12/4) -> 15804 | S902: =1000*110/100*(1+(55+RC[-16]/10)/200)*100 -> 189640.00000000003
B903: 1,7,10204,0;1,4,1594,0; | C903: 899 | D903: 1 | E903: 7 | F903: 10204 | G903: 0 | I903: 1 | J903: 4 | K903: 1594 | L903: 0 | O903: ="1,7,"&RC[2]&",0;"&"1,4,"&RC[4]&",0;" -> 1,7,15814,0;1,4,189695,0; | Q903: =INT(((55+RC[-14]/10)*35+200)*12/4) -> 15814 | S903: =1000*110/100*(1+(55+RC[-16]/10)/200)*100 -> 189694.99999999997
B904: 1,7,10215,0;1,4,1595,0; | C904: 900 | D904: 1 | E904: 7 | F904: 10215 | G904: 0 | I904: 1 | J904: 4 | K904: 1595 | L904: 0 | O904: ="1,7,"&RC[2]&",0;"&"1,4,"&RC[4]&",0;" -> 1,7,15825,0;1,4,189750,0; | Q904: =INT(((55+RC[-14]/10)*35+200)*12/4) -> 15825 | S904: =1000*110/100*(1+(55+RC[-16]/10)/200)*100 -> 189750
B905: 1,7,10225,0;1,4,1595,0; | C905: 901 | D905: 1 | E905: 7 | F905: 10225 | G905: 0 | I905: 1 | J905: 4 | K905: 1595 | L905: 0 | O905: ="1,7,"&RC[2]&",0;"&"1,4,"&RC[4]&",0;" -> 1,7,15835,0;1,4,189805,0; | Q905: =INT(((55+RC[-14]/10)*35+200)*12/4) -> 15835 | S905: =1000*110/100*(1+(55+RC[-16]/10)/200)*100 -> 189804.99999999997
B906: 1,7,10236,0;1,4,1596,0; | C906: 902 | D906: 1 | E906: 7 | F906: 10236 | G906: 0 | I906: 1 | J906: 4 | K906: 1596 | L906: 0 | O906: ="1,7,"&RC[2]&",0;"&"1,4,"&RC[4]&",0;" -> 1,7,15846,0;1,4,189860,0; | Q906: =INT(((55+RC[-14]/10)*35+200)*12/4) -> 15846 | S906: =1000*110/100*(1+(55+RC[-16]/10)/200)*100 -> 189860
B907: 1,7,10246,0;1,4,1596,0; | C907: 903 | D907: 1 | E907: 7 | F907: 10246 | G907: 0 | I907: 1 | J907: 4 | K907: 1596 | L907: 0 | O907: ="1,7,"&RC[2]&",0;"&"1,4,"&RC[4]&",0;" -> 1,7,15856,0;1,4,189915,0; | Q907: =INT(((55+RC[-14]/10)*35+200)*12/4) -> 15856 | S907: =1000*110/100*(1+(55+RC[-16]/10)/200)*100 -> 189915
B908: 1,7,10257,0;1,4,1597,0; | C908: 904 | D908: 1 | E908: 7 | F908: 10257 | G908: 0 | I908: 1 | J908: 4 | K908: 1597 | L908: 0 | O908: ="1,7,"&RC[2]&",0;"&"1,4,"&RC[4]&",0;" -> 1,7,15867,0;1,4,189970,0; | Q908: =INT(((55+RC[-14]/10)*35+200)*12/4) -> 15867 | S908: =1000*110/100*(1+(55+RC[-16]/10)/200)*100 -> 189969.99999999997
B909: 1,7,10267,0;1,4,1597,0; | C909: 905 | D909: 1 | E909: 7 | F909: 10267 | G909: 0 | I909: 1 | J909: 4 | K909: 1597 | L909: 0 | O909: ="1,7,"&RC[2]&",0;"&"1,4,"&RC[4]&",0;" -> 1,7,15877,0;1,4,190025,0; | Q909: =INT(((55+RC[-14]/10)*35+200)*12/4) -> 15877 | S909: =1000*110/100*(1+(55+RC[-16]/10)/200)*100 -> 190025
B910: 1,7,10278,0;1,4,1598,0; | C910: 906 | D910: 1 | E910: 7 | F910: 10278 | G910: 0 | I910: 1 | J910: 4 | K910: 1598 | L910: 0 | O910: ="1,7,"&RC[2]&",0;"&"1,4,"&RC[4]&",0;" -> 1,7,15888,0;1,4,190080,0; | Q910: =INT(((55+RC[-14]/10)*35+200)*12/4) -> 15888 | S910: =1000*110/100*(1+(55+RC[-16]/10)/200)*100 -> 190080
B911: 1,7,10288,0;1,4,1598,0; | C911: 907 | D911: 1 | E911: 7 | F911: 10288 | G911: 0 | I911: 1 | J911: 4 | K911: 1598 | L911: 0 | O911: ="1,7,"&RC[2]&",0;"&"1,4,"&RC[4]&",0;" -> 1,7,15898,0;1,4,190135,0; | Q911: =INT(((55+RC[-14]/10)*35+200)*12/4) -> 15898 | S911: =1000*110/100*(1+(55+RC[-16]/10)/200)*100 -> 190135
B912: 1,7,10299,0;1,4,1599,0; | C912: 908 | D912: 1 | E912: 7 | F912: 10299 | G912: 0 | I912: 1 | J912: 4 | K912: 1599 | L912: 0 | O912: ="1,7,"&RC[2]&",0;"&"1,4,"&RC[4]&",0;" -> 1,7,15909,0;1,4,190190,0; | Q912: =INT(((55+RC[-14]/10)*35+200)*12/4) -> 15909 | S912: =1000*110/100*(1+(55+RC[-16]/10)/200)*100 -> 190190
B913: 1,7,10309,0;1,4,1599,0; | C913: 909 | D913: 1 | E913: 7 | F913: 10309 | G913: 0 | I913: 1 | J913: 4 | K913: 1599 | L913: 0 | O913: ="1,7,"&RC[2]&",0;"&"1,4,"&RC[4]&",0;" -> 1,7,15919,0;1,4,190245,0; | Q913: =INT(((55+RC[-14]/10)*35+200)*12/4) -> 15919 | S913: =1000*110/100*(1+(55+RC[-16]/10)/200)*100 -> 190245
B914: 1,7,10320,0;1,4,1600,0; | C914: 910 | D914: 1 | E914: 7 | F914: 10320 | G914: 0 | I914: 1 | J914: 4 | K914: 1600 | L914: 0 | O914: ="1,7,"&RC[2]&",0;"&"1,4,"&RC[4]&",0;" -> 1,7,15930,0;1,4,190300,0; | Q914: =INT(((55+RC[-14]/10)*35+200)*12/4) -> 15930 | S914: =1000*110/100*(1+(55+RC[-16]/10)/200)*100 -> 190300
B915: 1,7,10330,0;1,4,1601,0; | C915: 911 | D915: 1 | E915: 7 | F915: 10330 | G915: 0 | I915: 1 | J915: 4 | K915: 1601 | L915: 0 | O915: ="1,7,"&RC[2]&",0;"&"1,4,"&RC[4]&",0;" -> 1,7,15940,0;1,4,190355,0; | Q915: =INT(((55+RC[-14]/10)*35+200)*12/4) -> 15940 | S915: =1000*110/100*(1+(55+RC[-16]/10)/200)*100 -> 190355
B916: 1,7,10341,0;1,4,1601,0; | C916: 912 | D916: 1 | E916: 7 | F916: 10341 | G916: 0 | I916: 1 | J916: 4 | K916: 1601 | L916: 0 | O916: ="1,7,"&RC[2]&",0;"&"1,4,"&RC[4]&",0;" -> 1,7,15951,0;1,4,190410,0; | Q916: =INT(((55+RC[-14]/10)*35+200)*12/4) -> 15951 | S916: =1000*110/100*(1+(55+RC[-16]/10)/200)*100 -> 190410
B917: 1,7,10351,0;1,4,1602,0; | C917: 913 | D917: 1 | E917: 7 | F917: 10351 | G917: 0 | I917: 1 | J917: 4 | K917: 1602 | L917: 0 | O917: ="1,7,"&RC[2]&",0;"&"1,4,"&RC[4]&",0;" -> 1,7,15961,0;1,4,190465,0; | Q917: =INT(((55+RC[-14]/10)*35+200)*12/4) -> 15961 | S917: =1000*110/100*(1+(55+RC[-16]/10)/200)*100 -> 190465
B918: 1,7,10362,0;1,4,1602,0; | C918: 914 | D918: 1 | E918: 7 | F918: 10362 | G918: 0 | I918: 1 | J918: 4 | K918: 1602 | L918: 0 | O918: ="1,7,"&RC[2]&",0;"&"1,4,"&RC[4]&",0;" -> 1,7,15972,0;1,4,190520,0; | Q918: =INT(((55+RC[-14]/10)*35+200)*12/4) -> 15972 | S918: =1000*110/100*(1+(55+RC[-16]/10)/200)*100 -> 190520
B919: 1,7,10372,0;1,4,1603,0; | C919: 915 | D919: 1 | E919: 7 | F919: 10372 | G919: 0 | I919: 1 | J919: 4 | K919: 1603 | L919: 0 | O919: ="1,7,"&RC[2]&",0;"&"1,4,"&RC[4]&",0;" -> 1,7,15982,0;1,4,190575,0; | Q919: =INT(((55+RC[-14]/10)*35+200)*12/4) -> 15982 | S919: =1000*110/100*(1+(55+RC[-16]/10)/200)*100 -> 190575
B920: 1,7,10383,0;1,4,1603,0; | C920: 916 | D920: 1 | E920: 7 | F920: 10383 | G920: 0 | I920: 1 | J920: 4 | K920: 1603 | L920: 0 | O920: ="1,7,"&RC[2]&",0;"&"1,4,"&RC[4]&",0;" -> 1,7,15993,0;1,4,190630,0; | Q920: =INT(((55+RC[-14]/10)*35+200)*12/4) -> 15993 | S920: =1000*110/100*(1+(55+RC[-16]/10)/200)*100 -> 190630.00000000003
B921: 1,7,10393,0;1,4,1604,0; | C921: 917 | D921: 1 | E921: 7 | F921: 10393 | G921: 0 | I921: 1 | J921: 4 | K921: 1604 | L921: 0 | O921: ="1,7,"&RC[2]&",0;"&"1,4,"&RC[4]&",0;" -> 1,7,16003,0;1,4,190685,0; | Q921: =INT(((55+RC[-14]/10)*35+200)*12/4) -> 16003 | S921: =1000*110/100*(1+(55+RC[-16]/10)/200)*100 -> 190685
B922: 1,7,10404,0;1,4,1604,0; | C922: 918 | D922: 1 | E922: 7 | F922: 10404 | G922: 0 | I922: 1 | J922: 4 | K922: 1604 | L922: 0 | O922: ="1,7,"&RC[2]&",0;"&"1,4,"&RC[4]&",0;" -> 1,7,16014,0;1,4,190740,0; | Q922: =INT(((55+RC[-14]/10)*35+200)*12/4) -> 16014 | S922: =1000*110/100*(1+(55+RC[-16]/10)/200)*100 -> 190740
B923: 1,7,10414,0;1,4,1605,0; | C923: 919 | D923: 1 | E923: 7 | F923: 10414 | G923: 0 | I923: 1 | J923: 4 | K923: 1605 | L923: 0 | O923: ="1,7,"&RC[2]&",0;"&"1,4,"&RC[4]&",0;" -> 1,7,16024,0;1,4,190795,0; | Q923: =INT(((55+RC[-14]/10)*35+200)*12/4) -> 16024 | S923: =1000*110/100*(1+(55+RC[-16]/10)/200)*100 -> 190795.00000000003
B924: 1,7,10425,0;1,4,1606,0; | C924: 920 | D924: 1 | E924: 7 | F924: 10425 | G924: 0 | I924: 1 | J924: 4 | K924: 1606 | L924: 0 | O924: ="1,7,"&RC[2]&",0;"&"1,4,"&RC[4]&",0;" -> 1,7,16035,0;1,4,190850,0; | Q924: =INT(((55+RC[-14]/10)*35+200)*12/4) -> 16035 | S924: =1000*110/100*(1+(55+RC[-16]/10)/200)*100 -> 190849.99999999997
B925: 1,7,10435,0;1,4,1606,0; | C925: 921 | D925: 1 | E925: 7 | F925: 10435 | G925: 0 | I925: 1 | J925: 4 | K925: 1606 | L925: 0 | O925: ="1,7,"&RC[2]&",0;"&"1,4,"&RC[4]&",0;" -> 1,7,16045,0;1,4,190905,0; | Q925: =INT(((55+RC[-14]/10)*35+200)*12/4) -> 16045 | S925: =1000*110/100*(1+(55+RC[-16]/10)/200)*100 -> 190905
B926: 1,7,10446,0;1,4,1607,0; | C926: 922 | D926: 1 | E926: 7 | F926: 10446 | G926: 0 | I926: 1 | J926: 4 | K926: 1607 | L926: 0 | O926: ="1,7,"&RC[2]&",0;"&"1,4,"&RC[4]&",0;" -> 1,7,16056,0;1,4,190960,0; | Q926: =INT(((55+RC[-14]/10)*35+200)*12/4) -> 16056 | S926: =1000*110/100*(1+(55+RC[-16]/10)/200)*100 -> 190960
B927: 1,7,10456,0;1,4,1607,0; | C927: 923 | D927: 1 | E927: 7 | F927: 10456 | G927: 0 | I927: 1 | J927: 4 | K927: 1607 | L927: 0 | O927: ="1,7,"&RC[2]&",0;"&"1,4,"&RC[4]&",0;" -> 1,7,16066,0;1,4,191015,0; | Q927: =INT(((55+RC[-14]/10)*35+200)*12/4) -> 16066 | S927: =1000*110/100*(1+(55+RC[-16]/10)/200)*100 -> 191015
B928: 1,7,10467,0;1,4,1608,0; | C928: 924 | D928: 1 | E928: 7 | F928: 10467 | G928: 0 | I928: 1 | J928: 4 | K928: 1608 | L928: 0 | O928: ="1,7,"&RC[2]&",0;"&"1,4,"&RC[4]&",0;" -> 1,7,16077,0;1,4,191070,0; | Q928: =INT(((55+RC[-14]/10)*35+200)*12/4) -> 16077 | S928: =1000*110/100*(1+(55+RC[-16]/10)/200)*100 -> 191070
B929: 1,7,10477,0;1,4,1608,0; | C929: 925 | D929: 1 | E929: 7 | F929: 10477 | G929: 0 | I929: 1 | J929: 4 | K929: 1608 | L929: 0 | O929: ="1,7,"&RC[2]&",0;"&"1,4,"&RC[4]&",0;" -> 1,7,16087,0;1,4,191125,0; | Q929: =INT(((55+RC[-14]/10)*35+200)*12/4) -> 16087 | S929: =1000*110/100*(1+(55+RC[-16]/10)/200)*100 -> 191125
B930: 1,7,10488,0;1,4,1609,0; | C930: 926 | D930: 1 | E930: 7 | F930: 10488 | G930: 0 | I930: 1 | J930: 4 | K930: 1609 | L930: 0 | O930: ="1,7,"&RC[2]&",0;"&"1,4,"&RC[4]&",0;" -> 1,7,16098,0;1,4,191180,0; | Q930: =INT(((55+RC[-14]/10)*35+200)*12/4) -> 16098 | S930: =1000*110/100*(1+(55+RC[-16]/10)/200)*100 -> 191180
B931: 1,7,10498,0;1,4,1609,0; | C931: 927 | D931: 1 | E931: 7 | F931: 10498 | G931: 0 | I931: 1 | J931: 4 | K931: 1609 | L931: 0 | O931: ="1,7,"&RC[2]&",0;"&"1,4,"&RC[4]&",0;" -> 1,7,16108,0;1,4,191235,0; | Q931: =INT(((55+RC[-14]/10)*35+200)*12/4) -> 16108 | S931: =1000*110/100*(1+(55+RC[-16]/10)/200)*100 -> 191235
B932: 1,7,10509,0;1,4,1610,0; | C932: 928 | D932: 1 | E932: 7 | F932: 10509 | G932: 0 | I932: 1 | J932: 4 | K932: 1610 | L932: 0 | O932: ="1,7,"&RC[2]&",0;"&"1,4,"&RC[4]&",0;" -> 1,7,16119,0;1,4,191290,0; | Q932: =INT(((55+RC[-14]/10)*35+200)*12/4) -> 16119 | S932: =1000*110/100*(1+(55+RC[-16]/10)/200)*100 -> 191290
B933: 1,7,10519,0;1,4,1610,0; | C933: 929 | D933: 1 | E933: 7 | F933: 10519 | G933: 0 | I933: 1 | J933: 4 | K933: 1610 | L933: 0 | O933: ="1,7,"&RC[2]&",0;"&"1,4,"&RC[4]&",0;" -> 1,7,16129,0;1,4,191345,0; | Q933: =INT(((55+RC[-14]/10)*35+200)*12/4) -> 16129 | S933: =1000*110/100*(1+(55+RC[-16]/10)/200)*100 -> 191345
B934: 1,7,10530,0;1,4,1611,0; | C934: 930 | D934: 1 | E934: 7 | F934: 10530 | G934: 0 | I934: 1 | J934: 4 | K934: 1611 | L934: 0 | O934: ="1,7,"&RC[2]&",0;"&"1,4,"&RC[4]&",0;" -> 1,7,16140,0;1,4,191400,0; | Q934: =INT(((55+RC[-14]/10)*35+200)*12/4) -> 16140 | S934: =1000*110/100*(1+(55+RC[-16]/10)/200)*100 -> 191400
B935: 1,7,10540,0;1,4,1612,0; | C935: 931 | D935: 1 | E935: 7 | F935: 10540 | G935: 0 | I935: 1 | J935: 4 | K935: 1612 | L935: 0 | O935: ="1,7,"&RC[2]&",0;"&"1,4,"&RC[4]&",0;" -> 1,7,16150,0;1,4,191455,0; | Q935: =INT(((55+RC[-14]/10)*35+200)*12/4) -> 16150 | S935: =1000*110/100*(1+(55+RC[-16]/10)/200)*100 -> 191455
B936: 1,7,10551,0;1,4,1612,0; | C936: 932 | D936: 1 | E936: 7 | F936: 10551 | G936: 0 | I936: 1 | J936: 4 | K936: 1612 | L936: 0 | O936: ="1,7,"&RC[2]&",0;"&"1,4,"&RC[4]&",0;" -> 1,7,16161,0;1,4,191510,0; | Q936: =INT(((55+RC[-14]/10)*35+200)*12/4) -> 16161 | S936: =1000*110/100*(1+(55+RC[-16]/10)/200)*100 -> 191510
B937: 1,7,10561,0;1,4,1613,0; | C937: 933 | D937: 1 | E937: 7 | F937: 10561 | G937: 0 | I937: 1 | J937: 4 | K937: 1613 | L937: 0 | O937: ="1,7,"&RC[2]&",0;"&"1,4,"&RC[4]&",0;" -> 1,7,16171,0;1,4,191565,0; | Q937: =INT(((55+RC[-14]/10)*35+200)*12/4) -> 16171 | S937: =1000*110/100*(1+(55+RC[-16]/10)/200)*100 -> 191565
B938: 1,7,10572,0;1,4,1613,0; | C938: 934 | D938: 1 | E938: 7 | F938: 10572 | G938: 0 | I938: 1 | J938: 4 | K938: 1613 | L938: 0 | O938: ="1,7,"&RC[2]&",0;"&"1,4,"&RC[4]&",0;" -> 1,7,16182,0;1,4,191620,0; | Q938: =INT(((55+RC[-14]/10)*35+200)*12/4) -> 16182 | S938: =1000*110/100*(1+(55+RC[-16]/10)/200)*100 -> 191620
B939: 1,7,10582,0;1,4,1614,0; | C939: 935 | D939: 1 | E939: 7 | F939: 10582 | G939: 0 | I939: 1 | J939: 4 | K939: 1614 | L939: 0 | O939: ="1,7,"&RC[2]&",0;"&"1,4,"&RC[4]&",0;" -> 1,7,16192,0;1,4,191675,0; | Q939: =INT(((55+RC[-14]/10)*35+200)*12/4) -> 16192 | S939: =1000*110/100*(1+(55+RC[-16]/10)/200)*100 -> 191675.00000000003
B940: 1,7,10593,0;1,4,1614,0; | C940: 936 | D940: 1 | E940: 7 | F940: 10593 | G940: 0 | I940: 1 | J940: 4 | K940: 1614 | L940: 0 | O940: ="1,7,"&RC[2]&",0;"&"1,4,"&RC[4]&",0;" -> 1,7,16203,0;1,4,191730,0; | Q940: =INT(((55+RC[-14]/10)*35+200)*12/4) -> 16203 | S940: =1000*110/100*(1+(55+RC[-16]/10)/200)*100 -> 191730
B941: 1,7,10603,0;1,4,1615,0; | C941: 937 | D941: 1 | E941: 7 | F941: 10603 | G941: 0 | I941: 1 | J941: 4 | K941: 1615 | L941: 0 | O941: ="1,7,"&RC[2]&",0;"&"1,4,"&RC[4]&",0;" -> 1,7,16213,0;1,4,191785,0; | Q941: =INT(((55+RC[-14]/10)*35+200)*12/4) -> 16213 | S941: =1000*110/100*(1+(55+RC[-16]/10)/200)*100 -> 191785
B942: 1,7,10614,0;1,4,1615,0; | C942: 938 | D942: 1 | E942: 7 | F942: 10614 | G942: 0 | I942: 1 | J942: 4 | K942: 1615 | L942: 0 | O942: ="1,7,"&RC[2]&",0;"&"1,4,"&RC[4]&",0;" -> 1,7,16224,0;1,4,191840,0; | Q942: =INT(((55+RC[-14]/10)*35+200)*12/4) -> 16224 | S942: =1000*110/100*(1+(55+RC[-16]/10)/200)*100 -> 191840.00000000003
B943: 1,7,10624,0;1,4,1616,0; | C943: 939 | D943: 1 | E943: 7 | F943: 10624 | G943: 0 | I943: 1 | J943: 4 | K943: 1616 | L943: 0 | O943: ="1,7,"&RC[2]&",0;"&"1,4,"&RC[4]&",0;" -> 1,7,16234,0;1,4,191895,0; | Q943: =INT(((55+RC[-14]/10)*35+200)*12/4) -> 16234 | S943: =1000*110/100*(1+(55+RC[-16]/10)/200)*100 -> 191895
B944: 1,7,10635,0;1,4,1617,0; | C944: 940 | D944: 1 | E944: 7 | F944: 10635 | G944: 0 | I944: 1 | J944: 4 | K944: 1617 | L944: 0 | O944: ="1,7,"&RC[2]&",0;"&"1,4,"&RC[4]&",0;" -> 1,7,16245,0;1,4,191950,0; | Q944: =INT(((55+RC[-14]/10)*35+200)*12/4) -> 16245 | S944: =1000*110/100*(1+(55+RC[-16]/10)/200)*100 -> 191950.00000000003
B945: 1,7,10645,0;1,4,1617,0; | C945: 941 | D945: 1 | E945: 7 | F945: 10645 | G945: 0 | I945: 1 | J945: 4 | K945: 1617 | L945: 0 | O945: ="1,7,"&RC[2]&",0;"&"1,4,"&RC[4]&",0;" -> 1,7,16255,0;1,4,192005,0; | Q945: =INT(((55+RC[-14]/10)*35+200)*12/4) -> 16255 | S945: =1000*110/100*(1+(55+RC[-16]/10)/200)*100 -> 192004.99999999997
B946: 1,7,10656,0;1,4,1618,0; | C946: 942 | D946: 1 | E946: 7 | F946: 10656 | G946: 0 | I946: 1 | J946: 4 | K946: 1618 | L946: 0 | O946: ="1,7,"&RC[2]&",0;"&"1,4,"&RC[4]&",0;" -> 1,7,16266,0;1,4,192060,0; | Q946: =INT(((55+RC[-14]/10)*35+200)*12/4) -> 16266 | S946: =1000*110/100*(1+(55+RC[-16]/10)/200)*100 -> 192060
B947: 1,7,10666,0;1,4,1618,0; | C947: 943 | D947: 1 | E947: 7 | F947: 10666 | G947: 0 | I947: 1 | J947: 4 | K947: 1618 | L947: 0 | O947: ="1,7,"&RC[2]&",0;"&"1,4,"&RC[4]&",0;" -> 1,7,16276,0;1,4,192115,0; | Q947: =INT(((55+RC[-14]/10)*35+200)*12/4) -> 16276 | S947: =1000*110/100*(1+(55+RC[-16]/10)/200)*100 -> 192115
B948: 1,7,10677,0;1,4,1619,0; | C948: 944 | D948: 1 | E948: 7 | F948: 10677 | G948: 0 | I948: 1 | J948: 4 | K948: 1619 | L948: 0 | O948: ="1,7,"&RC[2]&",0;"&"1,4,"&RC[4]&",0;" -> 1,7,16287,0;1,4,192170,0; | Q948: =INT(((55+RC[-14]/10)*35+200)*12/4) -> 16287 | S948: =1000*110/100*(1+(55+RC[-16]/10)/200)*100 -> 192169.99999999997
B949: 1,7,10687,0;1,4,1619,0; | C949: 945 | D949: 1 | E949: 7 | F949: 10687 | G949: 0 | I949: 1 | J949: 4 | K949: 1619 | L949: 0 | O949: ="1,7,"&RC[2]&",0;"&"1,4,"&RC[4]&",0;" -> 1,7,16297,0;1,4,192225,0; | Q949: =INT(((55+RC[-14]/10)*35+200)*12/4) -> 16297 | S949: =1000*110/100*(1+(55+RC[-16]/10)/200)*100 -> 192225
B950: 1,7,10698,0;1,4,1620,0; | C950: 946 | D950: 1 | E950: 7 | F950: 10698 | G950: 0 | I950: 1 | J950: 4 | K950: 1620 | L950: 0 | O950: ="1,7,"&RC[2]&",0;"&"1,4,"&RC[4]&",0;" -> 1,7,16308,0;1,4,192280,0; | Q950: =INT(((55+RC[-14]/10)*35+200)*12/4) -> 16308 | S950: =1000*110/100*(1+(55+RC[-16]/10)/200)*100 -> 192280
B951: 1,7,10708,0;1,4,1620,0; | C951: 947 | D951: 1 | E951: 7 | F951: 10708 | G951: 0 | I951: 1 | J951: 4 | K951: 1620 | L951: 0 | O951: ="1,7,"&RC[2]&",0;"&"1,4,"&RC[4]&",0;" -> 1,7,16318,0;1,4,192335,0; | Q951: =INT(((55+RC[-14]/10)*35+200)*12/4) -> 16318 | S951: =1000*110/100*(1+(55+RC[-16]/10)/200)*100 -> 192335
B952: 1,7,10719,0;1,4,1621,0; | C952: 948 | D952: 1 | E952: 7 | F952: 10719 | G952: 0 | I952: 1 | J952: 4 | K952: 1621 | L952: 0 | O952: ="1,7,"&RC[2]&",0;"&"1,4,"&RC[4]&",0;" -> 1,7,16329,0;1,4,192390,0; | Q952: =INT(((55+RC[-14]/10)*35+200)*12/4) -> 16329 | S952: =1000*110/100*(1+(55+RC[-16]/10)/200)*100 -> 192390
B953: 1,7,10729,0;1,4,1621,0; | C953: 949 | D953: 1 | E953: 7 | F953: 10729 | G953: 0 | I953: 1 | J953: 4 | K953: 1621 | L953: 0 | O953: ="1,7,"&RC[2]&",0;"&"1,4,"&RC[4]&",0;" -> 1,7,16339,0;1,4,192445,0; | Q953: =INT(((55+RC[-14]/10)*35+200)*12/4) -> 16339 | S953: =1000*110/100*(1+(55+RC[-16]/10)/200)*100 -> 192445
B954: 1,7,10740,0;1,4,1622,0; | C954: 950 | D954: 1 | E954: 7 | F954: 10740 | G954: 0 | I954: 1 | J954: 4 | K954: 1622 | L954: 0 | O954: ="1,7,"&RC[2]&",0;"&"1,4,"&RC[4]&",0;" -> 1,7,16350,0;1,4,192500,0; | Q954: =INT(((55+RC[-14]/10)*35+200)*12/4) -> 16350 | S954: =1000*110/100*(1+(55+RC[-16]/10)/200)*100 -> 192500
B955: 1,7,10750,0;1,4,1623,0; | C955: 951 | D955: 1 | E955: 7 | F955: 10750 | G955: 0 | I955: 1 | J955: 4 | K955: 1623 | L955: 0 | O955: ="1,7,"&RC[2]&",0;"&"1,4,"&RC[4]&",0;" -> 1,7,16360,0;1,4,192555,0; | Q955: =INT(((55+RC[-14]/10)*35+200)*12/4) -> 16360 | S955: =1000*110/100*(1+(55+RC[-16]/10)/200)*100 -> 192555
B956: 1,7,10761,0;1,4,1623,0; | C956: 952 | D956: 1 | E956: 7 | F956: 10761 | G956: 0 | I956: 1 | J956: 4 | K956: 1623 | L956: 0 | O956: ="1,7,"&RC[2]&",0;"&"1,4,"&RC[4]&",0;" -> 1,7,16371,0;1,4,192610,0; | Q956: =INT(((55+RC[-14]/10)*35+200)*12/4) -> 16371 | S956: =1000*110/100*(1+(55+RC[-16]/10)/200)*100 -> 192610
B957: 1,7,10771,0;1,4,1624,0; | C957: 953 | D957: 1 | E957: 7 | F957: 10771 | G957: 0 | I957: 1 | J957: 4 | K957: 1624 | L957: 0 | O957: ="1,7,"&RC[2]&",0;"&"1,4,"&RC[4]&",0;" -> 1,7,16381,0;1,4,192665,0; | Q957: =INT(((55+RC[-14]/10)*35+200)*12/4) -> 16381 | S957: =1000*110/100*(1+(55+RC[-16]/10)/200)*100 -> 192665
B958: 1,7,10782,0;1,4,1624,0; | C958: 954 | D958: 1 | E958: 7 | F958: 10782 | G958: 0 | I958: 1 | J958: 4 | K958: 1624 | L958: 0 | O958: ="1,7,"&RC[2]&",0;"&"1,4,"&RC[4]&",0;" -> 1,7,16392,0;1,4,192720,0; | Q958: =INT(((55+RC[-14]/10)*35+200)*12/4) -> 16392 | S958: =1000*110/100*(1+(55+RC[-16]/10)/200)*100 -> 192720
B959: 1,7,10792,0;1,4,1625,0; | C959: 955 | D959: 1 | E959: 7 | F959: 10792 | G959: 0 | I959: 1 | J959: 4 | K959: 1625 | L959: 0 | O959: ="1,7,"&RC[2]&",0;"&"1,4,"&RC[4]&",0;" -> 1,7,16402,0;1,4,192775,0; | Q959: =INT(((55+RC[-14]/10)*35+200)*12/4) -> 16402 | S959: =1000*110/100*(1+(55+RC[-16]/10)/200)*100 -> 192775
B960: 1,7,10803,0;1,4,1625,0; | C960: 956 | D960: 1 | E960: 7 | F960: 10803 | G960: 0 | I960: 1 | J960: 4 | K960: 1625 | L960: 0 | O960: ="1,7,"&RC[2]&",0;"&"1,4,"&RC[4]&",0;" -> 1,7,16413,0;1,4,192830,0; | Q960: =INT(((55+RC[-14]/10)*35+200)*12/4) -> 16413 | S960: =1000*110/100*(1+(55+RC[-16]/10)/200)*100 -> 192830.00000000003
B961: 1,7,10813,0;1,4,1626,0; | C961: 957 | D961: 1 | E961: 7 | F961: 10813 | G961: 0 | I961: 1 | J961: 4 | K961: 1626 | L961: 0 | O961: ="1,7,"&RC[2]&",0;"&"1,4,"&RC[4]&",0;" -> 1,7,16423,0;1,4,192885,0; | Q961: =INT(((55+RC[-14]/10)*35+200)*12/4) -> 16423 | S961: =1000*110/100*(1+(55+RC[-16]/10)/200)*100 -> 192885
B962: 1,7,10824,0;1,4,1626,0; | C962: 958 | D962: 1 | E962: 7 | F962: 10824 | G962: 0 | I962: 1 | J962: 4 | K962: 1626 | L962: 0 | O962: ="1,7,"&RC[2]&",0;"&"1,4,"&RC[4]&",0;" -> 1,7,16434,0;1,4,192940,0; | Q962: =INT(((55+RC[-14]/10)*35+200)*12/4) -> 16434 | S962: =1000*110/100*(1+(55+RC[-16]/10)/200)*100 -> 192940
B963: 1,7,10834,0;1,4,1627,0; | C963: 959 | D963: 1 | E963: 7 | F963: 10834 | G963: 0 | I963: 1 | J963: 4 | K963: 1627 | L963: 0 | O963: ="1,7,"&RC[2]&",0;"&"1,4,"&RC[4]&",0;" -> 1,7,16444,0;1,4,192995,0; | Q963: =INT(((55+RC[-14]/10)*35+200)*12/4) -> 16444 | S963: =1000*110/100*(1+(55+RC[-16]/10)/200)*100 -> 192995.00000000003
B964: 1,7,10845,0;1,4,1628,0; | C964: 960 | D964: 1 | E964: 7 | F964: 10845 | G964: 0 | I964: 1 | J964: 4 | K964: 1628 | L964: 0 | O964: ="1,7,"&RC[2]&",0;"&"1,4,"&RC[4]&",0;" -> 1,7,16455,0;1,4,193050,0; | Q964: =INT(((55+RC[-14]/10)*35+200)*12/4) -> 16455 | S964: =1000*110/100*(1+(55+RC[-16]/10)/200)*100 -> 193049.99999999997
B965: 1,7,10855,0;1,4,1628,0; | C965: 961 | D965: 1 | E965: 7 | F965: 10855 | G965: 0 | I965: 1 | J965: 4 | K965: 1628 | L965: 0 | O965: ="1,7,"&RC[2]&",0;"&"1,4,"&RC[4]&",0;" -> 1,7,16465,0;1,4,193105,0; | Q965: =INT(((55+RC[-14]/10)*35+200)*12/4) -> 16465 | S965: =1000*110/100*(1+(55+RC[-16]/10)/200)*100 -> 193105
B966: 1,7,10866,0;1,4,1629,0; | C966: 962 | D966: 1 | E966: 7 | F966: 10866 | G966: 0 | I966: 1 | J966: 4 | K966: 1629 | L966: 0 | O966: ="1,7,"&RC[2]&",0;"&"1,4,"&RC[4]&",0;" -> 1,7,16476,0;1,4,193160,0; | Q966: =INT(((55+RC[-14]/10)*35+200)*12/4) -> 16476 | S966: =1000*110/100*(1+(55+RC[-16]/10)/200)*100 -> 193159.99999999997
B967: 1,7,10876,0;1,4,1629,0; | C967: 963 | D967: 1 | E967: 7 | F967: 10876 | G967: 0 | I967: 1 | J967: 4 | K967: 1629 | L967: 0 | O967: ="1,7,"&RC[2]&",0;"&"1,4,"&RC[4]&",0;" -> 1,7,16486,0;1,4,193215,0; | Q967: =INT(((55+RC[-14]/10)*35+200)*12/4) -> 16486 | S967: =1000*110/100*(1+(55+RC[-16]/10)/200)*100 -> 193215
B968: 1,7,10887,0;1,4,1630,0; | C968: 964 | D968: 1 | E968: 7 | F968: 10887 | G968: 0 | I968: 1 | J968: 4 | K968: 1630 | L968: 0 | O968: ="1,7,"&RC[2]&",0;"&"1,4,"&RC[4]&",0;" -> 1,7,16497,0;1,4,193270,0; | Q968: =INT(((55+RC[-14]/10)*35+200)*12/4) -> 16497 | S968: =1000*110/100*(1+(55+RC[-16]/10)/200)*100 -> 193270
B969: 1,7,10897,0;1,4,1630,0; | C969: 965 | D969: 1 | E969: 7 | F969: 10897 | G969: 0 | I969: 1 | J969: 4 | K969: 1630 | L969: 0 | O969: ="1,7,"&RC[2]&",0;"&"1,4,"&RC[4]&",0;" -> 1,7,16507,0;1,4,193325,0; | Q969: =INT(((55+RC[-14]/10)*35+200)*12/4) -> 16507 | S969: =1000*110/100*(1+(55+RC[-16]/10)/200)*100 -> 193324.99999999997
B970: 1,7,10908,0;1,4,1631,0; | C970: 966 | D970: 1 | E970: 7 | F970: 10908 | G970: 0 | I970: 1 | J970: 4 | K970: 1631 | L970: 0 | O970: ="1,7,"&RC[2]&",0;"&"1,4,"&RC[4]&",0;" -> 1,7,16518,0;1,4,193380,0; | Q970: =INT(((55+RC[-14]/10)*35+200)*12/4) -> 16518 | S970: =1000*110/100*(1+(55+RC[-16]/10)/200)*100 -> 193380
B971: 1,7,10918,0;1,4,1631,0; | C971: 967 | D971: 1 | E971: 7 | F971: 10918 | G971: 0 | I971: 1 | J971: 4 | K971: 1631 | L971: 0 | O971: ="1,7,"&RC[2]&",0;"&"1,4,"&RC[4]&",0;" -> 1,7,16528,0;1,4,193435,0; | Q971: =INT(((55+RC[-14]/10)*35+200)*12/4) -> 16528 | S971: =1000*110/100*(1+(55+RC[-16]/10)/200)*100 -> 193435
B972: 1,7,10929,0;1,4,1632,0; | C972: 968 | D972: 1 | E972: 7 | F972: 10929 | G972: 0 | I972: 1 | J972: 4 | K972: 1632 | L972: 0 | O972: ="1,7,"&RC[2]&",0;"&"1,4,"&RC[4]&",0;" -> 1,7,16539,0;1,4,193490,0; | Q972: =INT(((55+RC[-14]/10)*35+200)*12/4) -> 16539 | S972: =1000*110/100*(1+(55+RC[-16]/10)/200)*100 -> 193490
B973: 1,7,10939,0;1,4,1632,0; | C973: 969 | D973: 1 | E973: 7 | F973: 10939 | G973: 0 | I973: 1 | J973: 4 | K973: 1632 | L973: 0 | O973: ="1,7,"&RC[2]&",0;"&"1,4,"&RC[4]&",0;" -> 1,7,16549,0;1,4,193545,0; | Q973: =INT(((55+RC[-14]/10)*35+200)*12/4) -> 16549 | S973: =1000*110/100*(1+(55+RC[-16]/10)/200)*100 -> 193545
B974: 1,7,10950,0;1,4,1633,0; | C974: 970 | D974: 1 | E974: 7 | F974: 10950 | G974: 0 | I974: 1 | J974: 4 | K974: 1633 | L974: 0 | O974: ="1,7,"&RC[2]&",0;"&"1,4,"&RC[4]&",0;" -> 1,7,16560,0;1,4,193600,0; | Q974: =INT(((55+RC[-14]/10)*35+200)*12/4) -> 16560 | S974: =1000*110/100*(1+(55+RC[-16]/10)/200)*100 -> 193600
B975: 1,7,10960,0;1,4,1634,0; | C975: 971 | D975: 1 | E975: 7 | F975: 10960 | G975: 0 | I975: 1 | J975: 4 | K975: 1634 | L975: 0 | O975: ="1,7,"&RC[2]&",0;"&"1,4,"&RC[4]&",0;" -> 1,7,16570,0;1,4,193655,0; | Q975: =INT(((55+RC[-14]/10)*35+200)*12/4) -> 16570 | S975: =1000*110/100*(1+(55+RC[-16]/10)/200)*100 -> 193655
B976: 1,7,10971,0;1,4,1634,0; | C976: 972 | D976: 1 | E976: 7 | F976: 10971 | G976: 0 | I976: 1 | J976: 4 | K976: 1634 | L976: 0 | O976: ="1,7,"&RC[2]&",0;"&"1,4,"&RC[4]&",0;" -> 1,7,16581,0;1,4,193710,0; | Q976: =INT(((55+RC[-14]/10)*35+200)*12/4) -> 16581 | S976: =1000*110/100*(1+(55+RC[-16]/10)/200)*100 -> 193710
B977: 1,7,10981,0;1,4,1635,0; | C977: 973 | D977: 1 | E977: 7 | F977: 10981 | G977: 0 | I977: 1 | J977: 4 | K977: 1635 | L977: 0 | O977: ="1,7,"&RC[2]&",0;"&"1,4,"&RC[4]&",0;" -> 1,7,16591,0;1,4,193765,0; | Q977: =INT(((55+RC[-14]/10)*35+200)*12/4) -> 16591 | S977: =1000*110/100*(1+(55+RC[-16]/10)/200)*100 -> 193765
B978: 1,7,10992,0;1,4,1635,0; | C978: 974 | D978: 1 | E978: 7 | F978: 10992 | G978: 0 | I978: 1 | J978: 4 | K978: 1635 | L978: 0 | O978: ="1,7,"&RC[2]&",0;"&"1,4,"&RC[4]&",0;" -> 1,7,16602,0;1,4,193820,0; | Q978: =INT(((55+RC[-14]/10)*35+200)*12/4) -> 16602 | S978: =1000*110/100*(1+(55+RC[-16]/10)/200)*100 -> 193820
B979: 1,7,11002,0;1,4,1636,0; | C979: 975 | D979: 1 | E979: 7 | F979: 11002 | G979: 0 | I979: 1 | J979: 4 | K979: 1636 | L979: 0 | O979: ="1,7,"&RC[2]&",0;"&"1,4,"&RC[4]&",0;" -> 1,7,16612,0;1,4,193875,0; | Q979: =INT(((55+RC[-14]/10)*35+200)*12/4) -> 16612 | S979: =1000*110/100*(1+(55+RC[-16]/10)/200)*100 -> 193875
B980: 1,7,11013,0;1,4,1636,0; | C980: 976 | D980: 1 | E980: 7 | F980: 11013 | G980: 0 | I980: 1 | J980: 4 | K980: 1636 | L980: 0 | O980: ="1,7,"&RC[2]&",0;"&"1,4,"&RC[4]&",0;" -> 1,7,16623,0;1,4,193930,0; | Q980: =INT(((55+RC[-14]/10)*35+200)*12/4) -> 16623 | S980: =1000*110/100*(1+(55+RC[-16]/10)/200)*100 -> 193930
B981: 1,7,11023,0;1,4,1637,0; | C981: 977 | D981: 1 | E981: 7 | F981: 11023 | G981: 0 | I981: 1 | J981: 4 | K981: 1637 | L981: 0 | O981: ="1,7,"&RC[2]&",0;"&"1,4,"&RC[4]&",0;" -> 1,7,16633,0;1,4,193985,0; | Q981: =INT(((55+RC[-14]/10)*35+200)*12/4) -> 16633 | S981: =1000*110/100*(1+(55+RC[-16]/10)/200)*100 -> 193985
B982: 1,7,11034,0;1,4,1637,0; | C982: 978 | D982: 1 | E982: 7 | F982: 11034 | G982: 0 | I982: 1 | J982: 4 | K982: 1637 | L982: 0 | O982: ="1,7,"&RC[2]&",0;"&"1,4,"&RC[4]&",0;" -> 1,7,16644,0;1,4,194040,0; | Q982: =INT(((55+RC[-14]/10)*35+200)*12/4) -> 16644 | S982: =1000*110/100*(1+(55+RC[-16]/10)/200)*100 -> 194040
B983: 1,7,11044,0;1,4,1638,0; | C983: 979 | D983: 1 | E983: 7 | F983: 11044 | G983: 0 | I983: 1 | J983: 4 | K983: 1638 | L983: 0 | O983: ="1,7,"&RC[2]&",0;"&"1,4,"&RC[4]&",0;" -> 1,7,16654,0;1,4,194095,0; | Q983: =INT(((55+RC[-14]/10)*35+200)*12/4) -> 16654 | S983: =1000*110/100*(1+(55+RC[-16]/10)/200)*100 -> 194095
B984: 1,7,11055,0;1,4,1639,0; | C984: 980 | D984: 1 | E984: 7 | F984: 11055 | G984: 0 | I984: 1 | J984: 4 | K984: 1639 | L984: 0 | O984: ="1,7,"&RC[2]&",0;"&"1,4,"&RC[4]&",0;" -> 1,7,16665,0;1,4,194150,0; | Q984: =INT(((55+RC[-14]/10)*35+200)*12/4) -> 16665 | S984: =1000*110/100*(1+(55+RC[-16]/10)/200)*100 -> 194150.00000000003
B985: 1,7,11065,0;1,4,1639,0; | C985: 981 | D985: 1 | E985: 7 | F985: 11065 | G985: 0 | I985: 1 | J985: 4 | K985: 1639 | L985: 0 | O985: ="1,7,"&RC[2]&",0;"&"1,4,"&RC[4]&",0;" -> 1,7,16675,0;1,4,194205,0; | Q985: =INT(((55+RC[-14]/10)*35+200)*12/4) -> 16675 | S985: =1000*110/100*(1+(55+RC[-16]/10)/200)*100 -> 194204.99999999997
B986: 1,7,11076,0;1,4,1640,0; | C986: 982 | D986: 1 | E986: 7 | F986: 11076 | G986: 0 | I986: 1 | J986: 4 | K986: 1640 | L986: 0 | O986: ="1,7,"&RC[2]&",0;"&"1,4,"&RC[4]&",0;" -> 1,7,16686,0;1,4,194260,0; | Q986: =INT(((55+RC[-14]/10)*35+200)*12/4) -> 16686 | S986: =1000*110/100*(1+(55+RC[-16]/10)/200)*100 -> 194260
B987: 1,7,11086,0;1,4,1640,0; | C987: 983 | D987: 1 | E987: 7 | F987: 11086 | G987: 0 | I987: 1 | J987: 4 | K987: 1640 | L987: 0 | O987: ="1,7,"&RC[2]&",0;"&"1,4,"&RC[4]&",0;" -> 1,7,16696,0;1,4,194315,0; | Q987: =INT(((55+RC[-14]/10)*35+200)*12/4) -> 16696 | S987: =1000*110/100*(1+(55+RC[-16]/10)/200)*100 -> 194315
B988: 1,7,11097,0;1,4,1641,0; | C988: 984 | D988: 1 | E988: 7 | F988: 11097 | G988: 0 | I988: 1 | J988: 4 | K988: 1641 | L988: 0 | O988: ="1,7,"&RC[2]&",0;"&"1,4,"&RC[4]&",0;" -> 1,7,16707,0;1,4,194370,0; | Q988: =INT(((55+RC[-14]/10)*35+200)*12/4) -> 16707 | S988: =1000*110/100*(1+(55+RC[-16]/10)/200)*100 -> 194369.99999999997
B989: 1,7,11107,0;1,4,1641,0; | C989: 985 | D989: 1 | E989: 7 | F989: 11107 | G989: 0 | I989: 1 | J989: 4 | K989: 1641 | L989: 0 | O989: ="1,7,"&RC[2]&",0;"&"1,4,"&RC[4]&",0;" -> 1,7,16717,0;1,4,194425,0; | Q989: =INT(((55+RC[-14]/10)*35+200)*12/4) -> 16717 | S989: =1000*110/100*(1+(55+RC[-16]/10)/200)*100 -> 194425
B990: 1,7,11118,0;1,4,1642,0; | C990: 986 | D990: 1 | E990: 7 | F990: 11118 | G990: 0 | I990: 1 | J990: 4 | K990: 1642 | L990: 0 | O990: ="1,7,"&RC[2]&",0;"&"1,4,"&RC[4]&",0;" -> 1,7,16728,0;1,4,194480,0; | Q990: =INT(((55+RC[-14]/10)*35+200)*12/4) -> 16728 | S990: =1000*110/100*(1+(55+RC[-16]/10)/200)*100 -> 194480
B991: 1,7,11128,0;1,4,1642,0; | C991: 987 | D991: 1 | E991: 7 | F991: 11128 | G991: 0 | I991: 1 | J991: 4 | K991: 1642 | L991: 0 | O991: ="1,7,"&RC[2]&",0;"&"1,4,"&RC[4]&",0;" -> 1,7,16738,0;1,4,194535,0; | Q991: =INT(((55+RC[-14]/10)*35+200)*12/4) -> 16738 | S991: =1000*110/100*(1+(55+RC[-16]/10)/200)*100 -> 194535
B992: 1,7,11139,0;1,4,1643,0; | C992: 988 | D992: 1 | E992: 7 | F992: 11139 | G992: 0 | I992: 1 | J992: 4 | K992: 1643 | L992: 0 | O992: ="1,7,"&RC[2]&",0;"&"1,4,"&RC[4]&",0;" -> 1,7,16749,0;1,4,194590,0; | Q992: =INT(((55+RC[-14]/10)*35+200)*12/4) -> 16749 | S992: =1000*110/100*(1+(55+RC[-16]/10)/200)*100 -> 194590
B993: 1,7,11149,0;1,4,1643,0; | C993: 989 | D993: 1 | E993: 7 | F993: 11149 | G993: 0 | I993: 1 | J993: 4 | K993: 1643 | L993: 0 | O993: ="1,7,"&RC[2]&",0;"&"1,4,"&RC[4]&",0;" -> 1,7,16759,0;1,4,194645,0; | Q993: =INT(((55+RC[-14]/10)*35+200)*12/4) -> 16759 | S993: =1000*110/100*(1+(55+RC[-16]/10)/200)*100 -> 194645
B994: 1,7,11160,0;1,4,1644,0; | C994: 990 | D994: 1 | E994: 7 | F994: 11160 | G994: 0 | I994: 1 | J994: 4 | K994: 1644 | L994: 0 | O994: ="1,7,"&RC[2]&",0;"&"1,4,"&RC[4]&",0;" -> 1,7,16770,0;1,4,194700,0; | Q994: =INT(((55+RC[-14]/10)*35+200)*12/4) -> 16770 | S994: =1000*110/100*(1+(55+RC[-16]/10)/200)*100 -> 194700
B995: 1,7,11170,0;1,4,1645,0; | C995: 991 | D995: 1 | E995: 7 | F995: 11170 | G995: 0 | I995: 1 | J995: 4 | K995: 1645 | L995: 0 | O995: ="1,7,"&RC[2]&",0;"&"1,4,"&RC[4]&",0;" -> 1,7,16780,0;1,4,194755,0; | Q995: =INT(((55+RC[-14]/10)*35+200)*12/4) -> 16780 | S995: =1000*110/100*(1+(55+RC[-16]/10)/200)*100 -> 194755
B996: 1,7,11181,0;1,4,1645,0; | C996: 992 | D996: 1 | E996: 7 | F996: 11181 | G996: 0 | I996: 1 | J996: 4 | K996: 1645 | L996: 0 | O996: ="1,7,"&RC[2]&",0;"&"1,4,"&RC[4]&",0;" -> 1,7,16791,0;1,4,194810,0; | Q996: =INT(((55+RC[-14]/10)*35+200)*12/4) -> 16791 | S996: =1000*110/100*(1+(55+RC[-16]/10)/200)*100 -> 194810
B997: 1,7,11191,0;1,4,1646,0; | C997: 993 | D997: 1 | E997: 7 | F997: 11191 | G997: 0 | I997: 1 | J997: 4 | K997: 1646 | L997: 0 | O997: ="1,7,"&RC[2]&",0;"&"1,4,"&RC[4]&",0;" -> 1,7,16801,0;1,4,194865,0; | Q997: =INT(((55+RC[-14]/10)*35+200)*12/4) -> 16801 | S997: =1000*110/100*(1+(55+RC[-16]/10)/200)*100 -> 194865
B998: 1,7,11202,0;1,4,1646,0; | C998: 994 | D998: 1 | E998: 7 | F998: 11202 | G998: 0 | I998: 1 | J998: 4 | K998: 1646 | L998: 0 | O998: ="1,7,"&RC[2]&",0;"&"1,4,"&RC[4]&",0;" -> 1,7,16812,0;1,4,194920,0; | Q998: =INT(((55+RC[-14]/10)*35+200)*12/4) -> 16812 | S998: =1000*110/100*(1+(55+RC[-16]/10)/200)*100 -> 194920
B999: 1,7,11212,0;1,4,1647,0; | C999: 995 | D999: 1 | E999: 7 | F999: 11212 | G999: 0 | I999: 1 | J999: 4 | K999: 1647 | L999: 0 | O999: ="1,7,"&RC[2]&",0;"&"1,4,"&RC[4]&",0;" -> 1,7,16822,0;1,4,194975,0; | Q999: =INT(((55+RC[-14]/10)*35+200)*12/4) -> 16822 | S999: =1000*110/100*(1+(55+RC[-16]/10)/200)*100 -> 194975
B1000: 1,7,11223,0;1,4,1647,0; | C1000: 996 | D1000: 1 | E1000: 7 | F1000: 11223 | G1000: 0 | I1000: 1 | J1000: 4 | K1000: 1647 | L1000: 0 | O1000: ="1,7,"&RC[2]&",0;"&"1,4,"&RC[4]&",0;" -> 1,7,16833,0;1,4,195030,0; | Q1000: =INT(((55+RC[-14]/10)*35+200)*12/4) -> 16833 | S1000: =1000*110/100*(1+(55+RC[-16]/10)/200)*100 -> 195030.00000000003
B1001: 1,7,11233,0;1,4,1648,0; | C1001: 997 | D1001: 1 | E1001: 7 | F1001: 11233 | G1001: 0 | I1001: 1 | J1001: 4 | K1001: 1648 | L1001: 0 | O1001: ="1,7,"&RC[2]&",0;"&"1,4,"&RC[4]&",0;" -> 1,7,16843,0;1,4,195085,0; | Q1001: =INT(((55+RC[-14]/10)*35+200)*12/4) -> 16843 | S1001: =1000*110/100*(1+(55+RC[-16]/10)/200)*100 -> 195085
B1002: 1,7,11244,0;1,4,1648,0; | C1002: 998 | D1002: 1 | E1002: 7 | F1002: 11244 | G1002: 0 | I1002: 1 | J1002: 4 | K1002: 1648 | L1002: 0 | O1002: ="1,7,"&RC[2]&",0;"&"1,4,"&RC[4]&",0;" -> 1,7,16854,0;1,4,195140,0; | Q1002: =INT(((55+RC[-14]/10)*35+200)*12/4) -> 16854 | S1002: =1000*110/100*(1+(55+RC[-16]/10)/200)*100 -> 195140
B1003: 1,7,11254,0;1,4,1649,0; | C1003: 999 | D1003: 1 | E1003: 7 | F1003: 11254 | G1003: 0 | I1003: 1 | J1003: 4 | K1003: 1649 | L1003: 0 | O1003: ="1,7,"&RC[2]&",0;"&"1,4,"&RC[4]&",0;" -> 1,7,16864,0;1,4,195195,0; | Q1003: =INT(((55+RC[-14]/10)*35+200)*12/4) -> 16864 | S1003: =1000*110/100*(1+(55+RC[-16]/10)/200)*100 -> 195195.00000000003
B1004: 1,7,11265,0;1,4,1650,0; | C1004: 1000 | D1004: 1 | E1004: 7 | F1004: 11265 | G1004: 0 | I1004: 1 | J1004: 4 | K1004: 1650 | L1004: 0 | O1004: ="1,7,"&RC[2]&",0;"&"1,4,"&RC[4]&",0;" -> 1,7,16875,0;1,4,195250,0; | Q1004: =INT(((55+RC[-14]/10)*35+200)*12/4) -> 16875 | S1004: =1000*110/100*(1+(55+RC[-16]/10)/200)*100 -> 195250