Sheet: ctRoleLevelConf
A2: nLevel | B2: nNeedExp
A3: i | B3: i
A4: 等级 | B4: 下级需要经验
A5: 0 | B5: 330
A6: 1 | B6: 1257
A7: 2 | B7: 2409
A8: 3 | B8: 3151
A9: 4 | B9: 3837
A10: 5 | B10: 4494
A11: 6 | B11: 5148
A12: 7 | B12: =R[-1]C+150 -> 5298
A13: 8 | B13: =R[-1]C+150 -> 5448
A14: 9 | B14: =R[-1]C+150 -> 5598
A15: 10 | B15: =R[-1]C+150 -> 5748
A16: 11 | B16: =R[-1]C+150 -> 5898
A17: 12 | B17: =R[-1]C+150 -> 6048
A18: 13 | B18: =R[-1]C+150 -> 6198
A19: 14 | B19: =R[-1]C+150 -> 6348
A20: 15 | B20: =R[-1]C+150 -> 6498
A21: 16 | B21: =R[-1]C+150 -> 6648
A22: 17 | B22: =R[-1]C+150 -> 6798
A23: 18 | B23: =R[-1]C+150 -> 6948
A24: 19 | B24: =R[-1]C+150 -> 7098
A25: 20 | B25: =R[-1]C+150 -> 7248
A26: 21 | B26: =R[-1]C+150 -> 7398
A27: 22 | B27: =R[-1]C+150 -> 7548
A28: 23 | B28: =R[-1]C+150 -> 7698
A29: 24 | B29: =R[-1]C+150 -> 7848
A30: 25 | B30: 29765
A31: 26 | B31: 35610
A32: 27 | B32: 38310
A33: 28 | B33: 41183
A34: 29 | B34: 44235
A35: 30 | B35: 47476
A36: 31 | B36: 56568
A37: 32 | B37: 60611
A38: 33 | B38: 64890
A39: 34 | B39: 69412
A40: 35 | B40: 73492
A41: 36 | B41: 96062
A42: 37 | B42: 100427
A43: 38 | B43: 104967
A44: 39 | B44: 109685
A45: 40 | B45: 110572
A46: 41 | B46: 184001
A47: 42 | B47: 212665
A48: 43 | B48: 244129
A49: 44 | B49: 278577
A50: 45 | B50: 316200
A51: 46 | B51: 357193
A52: 47 | B52: 401759
A53: 48 | B53: 450108
A54: 49 | B54: 502454
A55: 50 | B55: 503622
A56: 51 | B56: 563140
A57: 52 | B57: 627534
A58: 53 | B58: 697056
A59: 54 | B59: 771966
A60: 55 | B60: 852527
A61: 56 | B61: 939010
A62: 57 | B62: 1031693
A63: 58 | B63: 1130858
A64: 59 | B64: 1236796
A65: 60 | B65: 1349802
A66: 61 | B66: 1470178
A67: 62 | B67: 1598232
A68: 63 | B68: 1734279
A69: 64 | B69: 1878640
A70: 65 | B70: 2031642
A71: 66 | B71: 2193618
A72: 67 | B72: 2364906
A73: 68 | B73: 2545854
A74: 69 | B74: 2736814
A75: 70 | B75: 2938142
A76: 71 | B76: 3150204
A77: 72 | B77: 3373371
A78: 73 | B78: 3608018
A79: 74 | B79: 3854531
A80: 75 | B80: 4113297
A81: 76 | B81: 4384713
A82: 77 | B82: 4669180
A83: 78 | B83: 4967106
A84: 79 | B84: 5278907
A85: 80 | B85: 6165502
A86: 81 | B86: 7134982
A87: 82 | B87: 8192326
A88: 83 | B88: 9342695
A89: 84 | B89: 10591436
A90: 85 | B90: 11944083
A91: 86 | B91: 13406363
A92: 87 | B92: 14984196
A93: 88 | B93: 16683700
A94: 89 | B94: 18511193
A95: 90 | B95: 20473198
A96: 91 | B96: 22576445
A97: 92 | B97: 24827873
A98: 93 | B98: 27234635
A99: 94 | B99: 29804099
A100: 95 | B100: 32543854
A101: 96 | B101: 35461711
A102: 97 | B102: 38565707
A103: 98 | B103: 41864106
A104: 99 | B104: 45365405
A105: 100 | B105: 61347923
A106: 101 | B106: 66264843
A107: 102 | B107: 71469032
A108: 103 | B108: 76972309
A109: 104 | B109: 82786804
A110: 105 | B110: 88924959
A111: 106 | B111: 95399534
A112: 107 | B112: 102223610
A113: 108 | B113: 109410593
A114: 109 | B114: 116974216
A115: 110 | B115: 124928548
A116: 111 | B116: 133287992
A117: 112 | B117: 142067293
A118: 113 | B118: 151281540
A119: 114 | B119: 160946170
A120: 115 | B120: 171076973
A121: 116 | B121: 181690094
A122: 117 | B122: 192802041
A123: 118 | B123: 204429681
A124: 119 | B124: 216590254
A125: 120 | B125: 229301368
A126: 121 | B126: 291097210
A127: 122 | B127: 307737048
A128: 123 | B128: 325103653
A129: 124 | B129: 343219988
A130: 125 | B130: 362109485
A131: 126 | B131: 381796050
A132: 127 | B132: 402304068
A133: 128 | B133: 423658407
A134: 129 | B134: 445884426
A135: 130 | B135: 469007973
A136: 131 | B136: 493055397
A137: 132 | B137: 518053546
A138: 133 | B138: 544029777
A139: 134 | B139: 571011960
A140: 135 | B140: 599028477
A141: 136 | B141: 628108236
A142: 137 | B142: 658280666
A143: 138 | B143: 689575731
A144: 139 | B144: 722023926
A145: 140 | B145: 755656287
A146: 141 | B146: 790504396
A147: 142 | B147: 826600383
A148: 143 | B148: 863976930
A149: 144 | B149: 902667281
A150: 145 | B150: 942705239
A151: 146 | B151: 984125178
A152: 147 | B152: 1026962044
A153: 148 | B153: 1071251358
A154: 149 | B154: 1117029226
A155: 150 | B155: 1164332337
A156: 151 | B156: 1213197975
A157: 152 | B157: 1263664017
A158: 153 | B158: 1315768942
A159: 154 | B159: 1369551833
A160: 155 | B160: 1425052383
A161: 156 | B161: 1482310902
A162: 157 | B162: 1541368317
A163: 158 | B163: 1602266179
A164: 159 | B164: 1665046668
A165: 160 | B165: 1729752597
A166: 161 | B166: 1796427419
A167: 162 | B167: 1865115227
A168: 163 | B168: 1935860762
A169: 164 | B169: 2008709418
A170: 165 | B170: 2083707245
A171: 166 | B171: 2160900955
A172: 167 | B172: 2240337924
A173: 168 | B173: 2322066203
A174: 169 | B174: 2406134514
A175: 170 | B175: 2492592261
A176: 171 | B176: 2581489534
A177: 172 | B177: 2672877109
A178: 173 | B178: 2766806460
A179: 174 | B179: 2863329758
A180: 175 | B180: 2962499877
A181: 176 | B181: 3064370401
A182: 177 | B182: 3168995624
A183: 178 | B183: 3276430561
A184: 179 | B184: 3386730947
A185: 180 | B185: 3499953243
A186: 181 | B186: 3616154645
A187: 182 | B187: 3735393083
A188: 183 | B188: 3857727228
A189: 184 | B189: 3983216496
A190: 185 | B190: 4111921055
A191: 186 | B191: 4243901827
A192: 187 | B192: 4379220494
A193: 188 | B193: 4517939502
A194: 189 | B194: 4660122067
A195: 190 | B195: 4805832177
A196: 191 | B196: 4955134600
A197: 192 | B197: 5108094886
A198: 193 | B198: 5264779373
A199: 194 | B199: 5425255193
A200: 195 | B200: 5589590271
A201: 196 | B201: 5757853339
A202: 197 | B202: 5930113932
A203: 198 | B203: 6106442398
A204: 199 | B204: 6286909898
A205: 200 | B205: 6471588417
A206: 201 | B206: 6660550764
A207: 202 | B207: 6853870576
A208: 203 | B208: 7051622328
A209: 204 | B209: 7253881331
A210: 205 | B210: 7460723741
A211: 206 | B211: 7672226563
A212: 207 | B212: 7888467657
A213: 208 | B213: 8109525736