Sheet: ctRechargeConf
M1: 0：普通充值(充值相互影响各个模块) 1：每日礼包(充值不影响其他任何模块)
A2: nID | B2: sName | C2: nMoney | D2: nBuyYuanBao | E2: nGiveYuanBao | F2: nMultiple | G2: sDesc | H2: sProduct | I2: sIcon | J2: bCard | K2: bFund | L2: display | M2: nType
A3: i | B3: s | C3: i | D3: i | E3: i | F3: i | G3: s | H3: s | I3: s | J3: b | K3: b | L3: b | M3: i
A4: 充值 | B4: 名字 | C4: 充值金额(RMB) | D4: 充值元宝 | E4: 赠送绑定元宝 | F4: 首充翻倍数 | G4: 描述 | H4: IOS商品标识 | I4: 图标 | J4: 是否卡券 | K4: 是否基金 | L4: 是否展示 | M4: 充值类型
A5: 1 | B5: 充值6 | C5: 6 | D5: =RC[-1]*500 -> 3000 | E5: =RC[-1]*0.5 -> 1500 | F5: 6 | G5: =RC[-3]&"送"&RC[-2] -> 3000送1500 | H5: com.yinghun.jphd.pay6 | I5: bg_yuanbao01 | J5: 0 | K5: 0 | L5: 1 | M5: 0
A6: 2 | B6: 充值30 | C6: 30 | D6: =RC[-1]*500 -> 15000 | E6: =RC[-1]*0.5 -> 7500 | F6: 6 | G6: =RC[-3]&"送"&RC[-2] -> 15000送7500 | H6: com.yinghun.jphd.pay30 | I6: bg_yuanbao02 | J6: 0 | K6: 0 | L6: 1 | M6: 0
A7: 3 | B7: 充值50 | C7: 50 | D7: =RC[-1]*500 -> 25000 | E7: =RC[-1]*0.5 -> 12500 | F7: 6 | G7: =RC[-3]&"送"&RC[-2] -> 25000送12500 | H7: com.yinghun.jphd.pay50 | I7: bg_yuanbao03 | J7: 0 | K7: 0 | L7: 1 | M7: 0
A8: 4 | B8: 充值98 | C8: 98 | D8: =RC[-1]*500 -> 49000 | E8: =RC[-1]*0.5 -> 24500 | F8: 6 | G8: =RC[-3]&"送"&RC[-2] -> 49000送24500 | H8: com.yinghun.jphd.pay98 | I8: bg_yuanbao04 | J8: 0 | K8: 0 | L8: 1 | M8: 0
A9: 5 | B9: 充值198 | C9: 198 | D9: =RC[-1]*500 -> 99000 | E9: =RC[-1]*0.5 -> 49500 | F9: 6 | G9: =RC[-3]&"送"&RC[-2] -> 99000送49500 | H9: com.yinghun.jphd.pay198 | I9: bg_yuanbao05 | J9: 0 | K9: 0 | L9: 1 | M9: 0
A10: 8 | B10: 充值648 | C10: 648 | D10: 324000 | E10: =RC[-1]*0.5 -> 162000 | F10: 1 | G10: =RC[-3]&"送"&RC[-2] -> 324000送162000 | H10: com.yinghun.jphd.pay648 | I10: bg_yuanbao08 | J10: 0 | K10: 0 | L10: 1 | M10: 0
A11: 9 | B11: 超值福利月卡 | C11: 30 | D11: 15000 | E11: 0 | F11: 0 | G11: =RC[-3] -> 15000 | H11: com.yinghun.jphd.pay28yk | I11: icon_chongzhi_2 | J11: 1 | K11: 0 | L11: 0 | M11: 0
A12: 10 | B12: 双周福利 | C12: 18 | D12: 9000 | E12: 0 | F12: 0 | G12: =RC[-3] -> 9000 | H12: com.yinghun.jphd.pay88jk | I12: icon_chongzhi_5 | J12: 1 | K12: 0 | L12: 0 | M12: 0
A13: 11 | B13: 成长基金 | C13: 40 | D13: 20000 | E13: 0 | F13: 0 | G13: 40元获得超额元宝 | H13: com.yinghun.jphd.pay40cz | I13: 0 | J13: 0 | K13: 1 | L13: 0 | M13: 0
A14: 12 | B14: 纵横基金 | C14: 98 | D14: 49000 | E14: 0 | F14: 0 | G14: 98元获得超额元宝 | H14: com.yinghun.jphd.pay98zh | I14: 0 | J14: 0 | K14: 1 | L14: 0 | M14: 0
A15: 13 | B15: 8元礼包 | C15: 8 | D15: 0 | E15: 0 | F15: 0 | G15: 8元获取超值礼包 | H15: com.yinghun.jphd.pay1yy | I15: 0 | J15: 0 | K15: 0 | L15: 0 | M15: 1
A16: 14 | B16: 30元礼包 | C16: 30 | D16: 0 | E16: 0 | F16: 0 | G16: 30元获取超值礼包 | H16: com.yinghun.jphd.pay6ly | I16: 0 | J16: 0 | K16: 0 | L16: 0 | M16: 1
A17: 15 | B17: 188元礼包 | C17: 188 | D17: 0 | E17: 0 | F17: 0 | G17: 188元获取超值礼包 | H17: com.yinghun.jphd.pay18sb | I17: 0 | J17: 0 | K17: 0 | L17: 0 | M17: 1
A18: 16 | B18: 328元礼包 | C18: 328 | D18: 0 | E18: 0 | F18: 0 | G18: 328获取超值礼包 | H18: com.yinghun.jphd.pay30ss | I18: 0 | J18: 0 | K18: 0 | L18: 0 | M18: 1
A19: 17 | B19: 充值1 | C19: 1 | D19: =RC[-1]*500 -> 500 | E19: 1 | F19: 1 | G19: 6送1 | H19: com.yinghun.jphd.pay1 | I19: bg_yuanbao01 | J19: 0 | K19: 0 | L19: 1 | M19: 0
A20: 18 | B20: 终身福利 | C20: 98 | D20: =RC[-1]*500 -> 49000 | E20: 0 | F20: 0 | G20: 0 | H20: 0 | I20: 0 | J20: 0 | K20: 0 | L20: 0 | M20: 0
A21: 19 | B21: 648元礼包 | C21: 648 | D21: 0 | E21: 0 | F21: 0 | G21: 648获取超值礼包 | H21: com.yinghun.jphd.pay648ss | I21: 0 | J21: 0 | K21: 0 | L21: 0 | M21: 1

Sheet: Sheet2
C5: 充值 | D5: 名字 | E5: 充值金额(RMB) | J5: 100 | K5: =RC[-1]/100 -> 1 | L5: 1
C6: 1 | D6: 充值6 | E6: 6 | F6: =VLOOKUP(RC[-1],C11:C12,2,FALSE) -> 1 | J6: 300 | K6: =RC[-1]/100 -> 3 | L6: 1
C7: 2 | D7: 充值30 | E7: 30 | F7: =VLOOKUP(RC[-1],C11:C12,2,FALSE) -> 1 | J7: 600 | K7: =RC[-1]/100 -> 6 | L7: 1
C8: 3 | D8: 充值50 | E8: 50 | F8: =VLOOKUP(RC[-1],C11:C12,2,FALSE) -> 1 | J8: 800 | K8: =RC[-1]/100 -> 8 | L8: 1
C9: 4 | D9: 充值98 | E9: 98 | F9: =VLOOKUP(RC[-1],C11:C12,2,FALSE) -> 1 | J9: 1200 | K9: =RC[-1]/100 -> 12 | L9: 1
C10: 5 | D10: 充值198 | E10: 198 | F10: =VLOOKUP(RC[-1],C11:C12,2,FALSE) -> 1 | J10: 1800 | K10: =RC[-1]/100 -> 18 | L10: 1
C11: 6 | D11: 充值298 | E11: 298 | F11: =VLOOKUP(RC[-1],C11:C12,2,FALSE) -> #N/A | J11: 2500 | K11: =RC[-1]/100 -> 25 | L11: 1
C12: 7 | D12: 充值488 | E12: 488 | F12: =VLOOKUP(RC[-1],C11:C12,2,FALSE) -> #N/A | J12: 3000 | K12: =RC[-1]/100 -> 30 | L12: 1
C13: 8 | D13: 充值648 | E13: 648 | F13: =VLOOKUP(RC[-1],C11:C12,2,FALSE) -> 1 | J13: 4000 | K13: =RC[-1]/100 -> 40 | L13: 1
C14: 9 | D14: 超值福利月卡 | E14: 30 | F14: =VLOOKUP(RC[-1],C11:C12,2,FALSE) -> 1 | J14: 4500 | K14: =RC[-1]/100 -> 45 | L14: 1
C15: 10 | D15: 双周福利 | E15: 18 | F15: =VLOOKUP(RC[-1],C11:C12,2,FALSE) -> 1 | J15: 5000 | K15: =RC[-1]/100 -> 50 | L15: 1
C16: 11 | D16: 成长基金 | E16: 40 | F16: =VLOOKUP(RC[-1],C11:C12,2,FALSE) -> 1 | J16: 6000 | K16: =RC[-1]/100 -> 60 | L16: 1
C17: 12 | D17: 纵横基金 | E17: 98 | F17: =VLOOKUP(RC[-1],C11:C12,2,FALSE) -> 1 | J17: 6800 | K17: =RC[-1]/100 -> 68 | L17: 1
C18: 13 | D18: 1元礼包 | E18: 1 | F18: =VLOOKUP(RC[-1],C11:C12,2,FALSE) -> 1 | J18: 7300 | K18: =RC[-1]/100 -> 73 | L18: 1
C19: 14 | D19: 6元礼包 | E19: 6 | F19: =VLOOKUP(RC[-1],C11:C12,2,FALSE) -> 1 | J19: 7800 | K19: =RC[-1]/100 -> 78 | L19: 1
C20: 15 | D20: 18元礼包 | E20: 18 | F20: =VLOOKUP(RC[-1],C11:C12,2,FALSE) -> 1 | J20: 8800 | K20: =RC[-1]/100 -> 88 | L20: 1
C21: 16 | D21: 30元礼包 | E21: 30 | F21: =VLOOKUP(RC[-1],C11:C12,2,FALSE) -> 1 | J21: 9800 | K21: =RC[-1]/100 -> 98 | L21: 1
C22: 17 | D22: 充值1 | E22: 1 | F22: =VLOOKUP(RC[-1],C11:C12,2,FALSE) -> 1 | J22: 10800 | K22: =RC[-1]/100 -> 108 | L22: 1
C23: 18 | D23: 终身福利 | E23: 98 | F23: =VLOOKUP(RC[-1],C11:C12,2,FALSE) -> 1 | J23: 11800 | K23: =RC[-1]/100 -> 118 | L23: 1
J24: 12800 | K24: =RC[-1]/100 -> 128 | L24: 1
J25: 14800 | K25: =RC[-1]/100 -> 148 | L25: 1
J26: 16800 | K26: =RC[-1]/100 -> 168 | L26: 1
J27: 18800 | K27: =RC[-1]/100 -> 188 | L27: 1
J28: 19800 | K28: =RC[-1]/100 -> 198 | L28: 1
J29: 32800 | K29: =RC[-1]/100 -> 328 | L29: 1
J30: 64800 | K30: =RC[-1]/100 -> 648 | L30: 1