Sheet: ctRechargeEtcConf
B1: 职业：无限制填0，存在限制，填对应角色初始表ID 品质：不指定品质，填0，指定品质，填1-5，对应白-橙
A2: nID | B2: tFirstRecargeAward | C2: sDesc | D2: nGrade
A3: i | B3: t{iiiii} | C3: s | D3: s
A4: 充值 | B4: 首充奖励(职业，道具类型，道具id，数量，品质) | C4: 充值说明 | D4: 战力提升
A5: 1 | B5: 0,4,20004,1,5;0,3,3051,1,5;0,1,19016,20,1;0,1,28000,20,1;0,1,10009,20,1;0,1,4,1000000,1; | C5: 首充翻倍\n每个档位都享有首充翻倍优惠，仅限一次\n\n充值有礼\n1. 重置成功后可获得对应档位赠送的元宝\n2. 日充奖励、周充奖励、限时礼包均有对应档位的奖励可以领取\n\n特权\n1. 当充值金额达到要求即可获得对应VIP等级的特权\n2. 不同VIP等级可领取对应等级的VIP特权礼包，每个等级的礼包只可领取一次 | D5: 200000

Sheet: Sheet2
A8: 原始 | B8: 20004 | C8: 3201
A9: 加工 | B9: =0&",4,"&R[-1]C&",1,5;" -> 0,4,20004,1,5; | C9: =0&",3,"&R[-1]C&",1,5;" -> 0,3,3201,1,5; | D9: 1,1,1101103,1,5; | E9: 1,1,1101104,1,5; | F9: 1,1,1101105,1,5; | G9: 2,1,1101203,1,5; | H9: 2,1,1101204,1,5; | I9: 2,1,1101205,1,5; | J9: 3,1,1102103,1,5; | K9: 3,1,1102104,1,5; | L9: 3,1,1102105,1,5; | M9: 4,1,1102203,1,5; | N9: 4,1,1102204,1,5; | O9: 4,1,1102205,1,5; | P9: 5,1,1103103,1,5; | Q9: 5,1,1103104,1,5; | R9: 5,1,1103105,1,5; | S9: 6,1,1103203,1,5; | T9: 6,1,1103204,1,5; | U9: 6,1,1103205,1,5; | V9: 7,1,1104103,1,5; | W9: 7,1,1104104,1,5; | X9: 7,1,1104105,1,5; | Y9: 8,1,1104203,1,5; | Z9: 8,1,1104204,1,5; | AA9: 8,1,1104205,1,5; | AB9: 9,1,1105103,1,5; | AC9: 9,1,1105104,1,5; | AD9: 9,1,1105105,1,5; | AE9: 10,1,1105203,1,5; | AF9: 10,1,1105204,1,5; | AG9: 10,1,1105205,1,5;
A10: 合并 | B10: =R[-1]C&R[-1]C[1]&R[-1]C[2]&R[-1]C[3]&R[-1]C[4]&R[-1]C[5]&R[-1]C[6]&R[-1]C[7]&R[-1]C[8]&R[-1]C[9]&R[-1]C[10]&R[-1]C[11]&R[-1]C[12]&R[-1]C[13]&R[-1]C[14]&R[-1]C[15]&R[-1]C[16]&R[-1]C[17]&R[-1]C[18]&R[-1]C[19]&R[-1]C[20]&R[-1]C[21]&R[-1]C[22]&R[-1]C[23]&R[-1]C[24]&R[-1]C[25]&R[-1]C[26]&R[-1]C[27]&R[-1]C[28]&R[-1]C[29]&R[-1]C[30]&R[-1]C[31] -> 0,4,20004,1,5;0,3,3201,1,5;1,1,1101103,1,5;1,1,1101104,1,5;1,1,1101105,1,5;2,1,1101203,1,5;2,1,1101204,1,5;2,1,1101205,1,5;3,1,1102103,1,5;3,1,1102104,1,5;3,1,1102105,1,5;4,1,1102203,1,5;4,1,1102204,1,5;4,1,1102205,1,5;5,1,1103103,1,5;5,1,1103104,1,5;5,1,1103105,1,5;6,1,1103203,1,5;6,1,1103204,1,5;6,1,1103205,1,5;7,1,1104103,1,5;7,1,1104104,1,5;7,1,1104105,1,5;8,1,1104203,1,5;8,1,1104204,1,5;8,1,1104205,1,5;9,1,1105103,1,5;9,1,1105104,1,5;9,1,1105105,1,5;10,1,1105203,1,5;10,1,1105204,1,5;10,1,1105205,1,5;
B11: 0,1,4,1000000,1;
B12: =R[-2]C&R[-1]C -> 0,4,20004,1,5;0,3,3201,1,5;1,1,1101103,1,5;1,1,1101104,1,5;1,1,1101105,1,5;2,1,1101203,1,5;2,1,1101204,1,5;2,1,1101205,1,5;3,1,1102103,1,5;3,1,1102104,1,5;3,1,1102105,1,5;4,1,1102203,1,5;4,1,1102204,1,5;4,1,1102205,1,5;5,1,1103103,1,5;5,1,1103104,1,5;5,1,1103105,1,5;6,1,1103203,1,5;6,1,1103204,1,5;6,1,1103205,1,5;7,1,1104103,1,5;7,1,1104104,1,5;7,1,1104105,1,5;8,1,1104203,1,5;8,1,1104204,1,5;8,1,1104205,1,5;9,1,1105103,1,5;9,1,1105104,1,5;9,1,1105105,1,5;10,1,1105203,1,5;10,1,1105204,1,5;10,1,1105205,1,5;0,1,4,1000000,1;
C17: 物品编号 | D17: 名称 | E17: 门派+性别 | F17: 门派+性别编号 | H17: 职业编号
C18: 1101103 | D18: 紫金 | E18: =RC[11] -> 鬼王男 | F18: =(VLOOKUP(RC[-3],Sheet3!C3:C23,9,FALSE)&VLOOKUP(RC[-3],Sheet3!C3:C23,8,FALSE))*1 -> 11 | G18: =RC[-1]-RC[10] -> 0 | H18: =VLOOKUP(RC[-2],R16C12:R29C13,2,FALSE) -> 1 | J18: 1 | K18: 鬼王男 | L18: 11 | M18: =RC[-3] -> 1 | N18: =RC[-3] -> 鬼王男 | P18: =VLOOKUP(RC[1],C12:C14,3,FALSE) -> 鬼王男 | Q18: =MID(RC[-14],4,2)*1 -> 11 | R18: =VLOOKUP(RC[-1],R18C12:R27C13,2,FALSE) -> 1 | S18: =RC[-1]&",1,"&RC[-16]&",1,5;" -> 1,1,1101103,1,5; | V18: =RC[-4] -> 1 | W18: =RC[-20] -> 1101103
C19: 1101104 | D19: 饮血 | E19: =RC[11] -> 鬼王男 | F19: =(VLOOKUP(RC[-3],Sheet3!C3:C23,9,FALSE)&VLOOKUP(RC[-3],Sheet3!C3:C23,8,FALSE))*1 -> 11 | G19: =RC[-1]-RC[10] -> 0 | H19: =VLOOKUP(RC[-2],R16C12:R29C13,2,FALSE) -> 1 | J19: 2 | K19: 鬼王女 | L19: 12 | M19: =RC[-3] -> 2 | N19: =RC[-3] -> 鬼王女 | P19: =VLOOKUP(RC[1],C12:C14,3,FALSE) -> 鬼王男 | Q19: =MID(RC[-14],4,2)*1 -> 11 | R19: =VLOOKUP(RC[-1],R18C12:R27C13,2,FALSE) -> 1 | S19: =RC[-1]&",1,"&RC[-16]&",1,5;" -> 1,1,1101104,1,5; | V19: =RC[-4] -> 1 | W19: =RC[-20] -> 1101104
C20: 1101105 | D20: 罗刹 | E20: =RC[11] -> 鬼王男 | F20: =(VLOOKUP(RC[-3],Sheet3!C3:C23,9,FALSE)&VLOOKUP(RC[-3],Sheet3!C3:C23,8,FALSE))*1 -> 11 | G20: =RC[-1]-RC[10] -> 0 | H20: =VLOOKUP(RC[-2],R16C12:R29C13,2,FALSE) -> 1 | J20: 3 | K20: 青云男 | L20: 21 | M20: =RC[-3] -> 3 | N20: =RC[-3] -> 青云男 | P20: =VLOOKUP(RC[1],C12:C14,3,FALSE) -> 鬼王男 | Q20: =MID(RC[-14],4,2)*1 -> 11 | R20: =VLOOKUP(RC[-1],R18C12:R27C13,2,FALSE) -> 1 | S20: =RC[-1]&",1,"&RC[-16]&",1,5;" -> 1,1,1101105,1,5; | V20: =RC[-4] -> 1 | W20: =RC[-20] -> 1101105
C21: 1101203 | D21: 七情断肠 | E21: =RC[11] -> 鬼王女 | F21: =(VLOOKUP(RC[-3],Sheet3!C3:C23,9,FALSE)&VLOOKUP(RC[-3],Sheet3!C3:C23,8,FALSE))*1 -> 12 | G21: =RC[-1]-RC[10] -> 0 | H21: =VLOOKUP(RC[-2],R16C12:R29C13,2,FALSE) -> 2 | J21: 4 | K21: 青云女 | L21: 22 | M21: =RC[-3] -> 4 | N21: =RC[-3] -> 青云女 | P21: =VLOOKUP(RC[1],C12:C14,3,FALSE) -> 鬼王女 | Q21: =MID(RC[-14],4,2)*1 -> 12 | R21: =VLOOKUP(RC[-1],R18C12:R27C13,2,FALSE) -> 2 | S21: =RC[-1]&",1,"&RC[-16]&",1,5;" -> 2,1,1101203,1,5; | V21: =RC[-4] -> 2 | W21: =RC[-20] -> 1101203
C22: 1101204 | D22: 紫鸢 | E22: =RC[11] -> 鬼王女 | F22: =(VLOOKUP(RC[-3],Sheet3!C3:C23,9,FALSE)&VLOOKUP(RC[-3],Sheet3!C3:C23,8,FALSE))*1 -> 12 | G22: =RC[-1]-RC[10] -> 0 | H22: =VLOOKUP(RC[-2],R16C12:R29C13,2,FALSE) -> 2 | J22: 5 | K22: 天音男 | L22: 31 | M22: =RC[-3] -> 5 | N22: =RC[-3] -> 天音男 | P22: =VLOOKUP(RC[1],C12:C14,3,FALSE) -> 鬼王女 | Q22: =MID(RC[-14],4,2)*1 -> 12 | R22: =VLOOKUP(RC[-1],R18C12:R27C13,2,FALSE) -> 2 | S22: =RC[-1]&",1,"&RC[-16]&",1,5;" -> 2,1,1101204,1,5; | V22: =RC[-4] -> 2 | W22: =RC[-20] -> 1101204
C23: 1101205 | D23: 水犹寒 | E23: =RC[11] -> 鬼王女 | F23: =(VLOOKUP(RC[-3],Sheet3!C3:C23,9,FALSE)&VLOOKUP(RC[-3],Sheet3!C3:C23,8,FALSE))*1 -> 12 | G23: =RC[-1]-RC[10] -> 0 | H23: =VLOOKUP(RC[-2],R16C12:R29C13,2,FALSE) -> 2 | J23: 6 | K23: 天音女 | L23: 32 | M23: =RC[-3] -> 6 | N23: =RC[-3] -> 天音女 | P23: =VLOOKUP(RC[1],C12:C14,3,FALSE) -> 鬼王女 | Q23: =MID(RC[-14],4,2)*1 -> 12 | R23: =VLOOKUP(RC[-1],R18C12:R27C13,2,FALSE) -> 2 | S23: =RC[-1]&",1,"&RC[-16]&",1,5;" -> 2,1,1101205,1,5; | V23: =RC[-4] -> 2 | W23: =RC[-20] -> 1101205
C24: 1102103 | D24: 蔷薇 | E24: =RC[11] -> 青云男 | F24: =(VLOOKUP(RC[-3],Sheet3!C3:C23,9,FALSE)&VLOOKUP(RC[-3],Sheet3!C3:C23,8,FALSE))*1 -> 21 | G24: =RC[-1]-RC[10] -> 0 | H24: =VLOOKUP(RC[-2],R16C12:R29C13,2,FALSE) -> 3 | J24: 7 | K24: 合欢男 | L24: 41 | M24: =RC[-3] -> 7 | N24: =RC[-3] -> 合欢男 | P24: =VLOOKUP(RC[1],C12:C14,3,FALSE) -> 青云男 | Q24: =MID(RC[-14],4,2)*1 -> 21 | R24: =VLOOKUP(RC[-1],R18C12:R27C13,2,FALSE) -> 3 | S24: =RC[-1]&",1,"&RC[-16]&",1,5;" -> 3,1,1102103,1,5; | V24: =RC[-4] -> 3 | W24: =RC[-20] -> 1102103
C25: 1102104 | D25: 承影 | E25: =RC[11] -> 青云男 | F25: =(VLOOKUP(RC[-3],Sheet3!C3:C23,9,FALSE)&VLOOKUP(RC[-3],Sheet3!C3:C23,8,FALSE))*1 -> 21 | G25: =RC[-1]-RC[10] -> 0 | H25: =VLOOKUP(RC[-2],R16C12:R29C13,2,FALSE) -> 3 | J25: 8 | K25: 合欢女 | L25: 42 | M25: =RC[-3] -> 8 | N25: =RC[-3] -> 合欢女 | P25: =VLOOKUP(RC[1],C12:C14,3,FALSE) -> 青云男 | Q25: =MID(RC[-14],4,2)*1 -> 21 | R25: =VLOOKUP(RC[-1],R18C12:R27C13,2,FALSE) -> 3 | S25: =RC[-1]&",1,"&RC[-16]&",1,5;" -> 3,1,1102104,1,5; | V25: =RC[-4] -> 3 | W25: =RC[-20] -> 1102104
C26: 1102105 | D26: 七星龙渊 | E26: =RC[11] -> 青云男 | F26: =(VLOOKUP(RC[-3],Sheet3!C3:C23,9,FALSE)&VLOOKUP(RC[-3],Sheet3!C3:C23,8,FALSE))*1 -> 21 | G26: =RC[-1]-RC[10] -> 0 | H26: =VLOOKUP(RC[-2],R16C12:R29C13,2,FALSE) -> 3 | J26: 9 | K26: 圣巫男 | L26: 51 | M26: =RC[-3] -> 9 | N26: =RC[-3] -> 圣巫男 | P26: =VLOOKUP(RC[1],C12:C14,3,FALSE) -> 青云男 | Q26: =MID(RC[-14],4,2)*1 -> 21 | R26: =VLOOKUP(RC[-1],R18C12:R27C13,2,FALSE) -> 3 | S26: =RC[-1]&",1,"&RC[-16]&",1,5;" -> 3,1,1102105,1,5; | V26: =RC[-4] -> 3 | W26: =RC[-20] -> 1102105
C27: 1102203 | D27: 龙凤 | E27: =RC[11] -> 青云女 | F27: =(VLOOKUP(RC[-3],Sheet3!C3:C23,9,FALSE)&VLOOKUP(RC[-3],Sheet3!C3:C23,8,FALSE))*1 -> 22 | G27: =RC[-1]-RC[10] -> 0 | H27: =VLOOKUP(RC[-2],R16C12:R29C13,2,FALSE) -> 4 | J27: 10 | K27: 圣巫女 | L27: 52 | M27: =RC[-3] -> 10 | N27: =RC[-3] -> 圣巫女 | P27: =VLOOKUP(RC[1],C12:C14,3,FALSE) -> 青云女 | Q27: =MID(RC[-14],4,2)*1 -> 22 | R27: =VLOOKUP(RC[-1],R18C12:R27C13,2,FALSE) -> 4 | S27: =RC[-1]&",1,"&RC[-16]&",1,5;" -> 4,1,1102203,1,5; | V27: =RC[-4] -> 4 | W27: =RC[-20] -> 1102203
C28: 1102204 | D28: 阴阳 | E28: =RC[11] -> 青云女 | F28: =(VLOOKUP(RC[-3],Sheet3!C3:C23,9,FALSE)&VLOOKUP(RC[-3],Sheet3!C3:C23,8,FALSE))*1 -> 22 | G28: =RC[-1]-RC[10] -> 0 | H28: =VLOOKUP(RC[-2],R16C12:R29C13,2,FALSE) -> 4 | P28: =VLOOKUP(RC[1],C12:C14,3,FALSE) -> 青云女 | Q28: =MID(RC[-14],4,2)*1 -> 22 | R28: =VLOOKUP(RC[-1],R18C12:R27C13,2,FALSE) -> 4 | S28: =RC[-1]&",1,"&RC[-16]&",1,5;" -> 4,1,1102204,1,5; | V28: =RC[-4] -> 4 | W28: =RC[-20] -> 1102204
C29: 1102205 | D29: 子母鸳鸯 | E29: =RC[11] -> 青云女 | F29: =(VLOOKUP(RC[-3],Sheet3!C3:C23,9,FALSE)&VLOOKUP(RC[-3],Sheet3!C3:C23,8,FALSE))*1 -> 22 | G29: =RC[-1]-RC[10] -> 0 | H29: =VLOOKUP(RC[-2],R16C12:R29C13,2,FALSE) -> 4 | P29: =VLOOKUP(RC[1],C12:C14,3,FALSE) -> 青云女 | Q29: =MID(RC[-14],4,2)*1 -> 22 | R29: =VLOOKUP(RC[-1],R18C12:R27C13,2,FALSE) -> 4 | S29: =RC[-1]&",1,"&RC[-16]&",1,5;" -> 4,1,1102205,1,5; | V29: =RC[-4] -> 4 | W29: =RC[-20] -> 1102205
C30: 1103103 | D30: 打狗棒 | E30: =RC[11] -> 天音男 | F30: =(VLOOKUP(RC[-3],Sheet3!C3:C23,9,FALSE)&VLOOKUP(RC[-3],Sheet3!C3:C23,8,FALSE))*1 -> 31 | G30: =RC[-1]-RC[10] -> 0 | H30: =VLOOKUP(RC[-2],R16C12:R29C13,2,FALSE) -> 5 | J30: 1 | K30: 鬼王男 | P30: =VLOOKUP(RC[1],C12:C14,3,FALSE) -> 天音男 | Q30: =MID(RC[-14],4,2)*1 -> 31 | R30: =VLOOKUP(RC[-1],R18C12:R27C13,2,FALSE) -> 5 | S30: =RC[-1]&",1,"&RC[-16]&",1,5;" -> 5,1,1103103,1,5; | V30: =RC[-4] -> 5 | W30: =RC[-20] -> 1103103
C31: 1103104 | D31: 流云杖 | E31: =RC[11] -> 天音男 | F31: =(VLOOKUP(RC[-3],Sheet3!C3:C23,9,FALSE)&VLOOKUP(RC[-3],Sheet3!C3:C23,8,FALSE))*1 -> 31 | G31: =RC[-1]-RC[10] -> 0 | H31: =VLOOKUP(RC[-2],R16C12:R29C13,2,FALSE) -> 5 | J31: 2 | K31: 鬼王女 | P31: =VLOOKUP(RC[1],C12:C14,3,FALSE) -> 天音男 | Q31: =MID(RC[-14],4,2)*1 -> 31 | R31: =VLOOKUP(RC[-1],R18C12:R27C13,2,FALSE) -> 5 | S31: =RC[-1]&",1,"&RC[-16]&",1,5;" -> 5,1,1103104,1,5; | V31: =RC[-4] -> 5 | W31: =RC[-20] -> 1103104
C32: 1103105 | D32: 长歌伽蓝 | E32: =RC[11] -> 天音男 | F32: =(VLOOKUP(RC[-3],Sheet3!C3:C23,9,FALSE)&VLOOKUP(RC[-3],Sheet3!C3:C23,8,FALSE))*1 -> 31 | G32: =RC[-1]-RC[10] -> 0 | H32: =VLOOKUP(RC[-2],R16C12:R29C13,2,FALSE) -> 5 | J32: 3 | K32: 青云男 | P32: =VLOOKUP(RC[1],C12:C14,3,FALSE) -> 天音男 | Q32: =MID(RC[-14],4,2)*1 -> 31 | R32: =VLOOKUP(RC[-1],R18C12:R27C13,2,FALSE) -> 5 | S32: =RC[-1]&",1,"&RC[-16]&",1,5;" -> 5,1,1103105,1,5; | V32: =RC[-4] -> 5 | W32: =RC[-20] -> 1103105
C33: 1103203 | D33: 混天绫 | E33: =RC[11] -> 天音女 | F33: =(VLOOKUP(RC[-3],Sheet3!C3:C23,9,FALSE)&VLOOKUP(RC[-3],Sheet3!C3:C23,8,FALSE))*1 -> 32 | G33: =RC[-1]-RC[10] -> 0 | H33: =VLOOKUP(RC[-2],R16C12:R29C13,2,FALSE) -> 6 | J33: 4 | K33: 青云女 | P33: =VLOOKUP(RC[1],C12:C14,3,FALSE) -> 天音女 | Q33: =MID(RC[-14],4,2)*1 -> 32 | R33: =VLOOKUP(RC[-1],R18C12:R27C13,2,FALSE) -> 6 | S33: =RC[-1]&",1,"&RC[-16]&",1,5;" -> 6,1,1103203,1,5; | V33: =RC[-4] -> 6 | W33: =RC[-20] -> 1103203
C34: 1103204 | D34: 绕指柔 | E34: =RC[11] -> 天音女 | F34: =(VLOOKUP(RC[-3],Sheet3!C3:C23,9,FALSE)&VLOOKUP(RC[-3],Sheet3!C3:C23,8,FALSE))*1 -> 32 | G34: =RC[-1]-RC[10] -> 0 | H34: =VLOOKUP(RC[-2],R16C12:R29C13,2,FALSE) -> 6 | J34: 5 | K34: 天音男 | P34: =VLOOKUP(RC[1],C12:C14,3,FALSE) -> 天音女 | Q34: =MID(RC[-14],4,2)*1 -> 32 | R34: =VLOOKUP(RC[-1],R18C12:R27C13,2,FALSE) -> 6 | S34: =RC[-1]&",1,"&RC[-16]&",1,5;" -> 6,1,1103204,1,5; | V34: =RC[-4] -> 6 | W34: =RC[-20] -> 1103204
C35: 1103205 | D35: 沧海卷云丝 | E35: =RC[11] -> 天音女 | F35: =(VLOOKUP(RC[-3],Sheet3!C3:C23,9,FALSE)&VLOOKUP(RC[-3],Sheet3!C3:C23,8,FALSE))*1 -> 32 | G35: =RC[-1]-RC[10] -> 0 | H35: =VLOOKUP(RC[-2],R16C12:R29C13,2,FALSE) -> 6 | J35: 6 | K35: 天音女 | P35: =VLOOKUP(RC[1],C12:C14,3,FALSE) -> 天音女 | Q35: =MID(RC[-14],4,2)*1 -> 32 | R35: =VLOOKUP(RC[-1],R18C12:R27C13,2,FALSE) -> 6 | S35: =RC[-1]&",1,"&RC[-16]&",1,5;" -> 6,1,1103205,1,5; | V35: =RC[-4] -> 6 | W35: =RC[-20] -> 1103205
C36: 1104103 | D36: 五明 | E36: =RC[11] -> 合欢男 | F36: =(VLOOKUP(RC[-3],Sheet3!C3:C23,9,FALSE)&VLOOKUP(RC[-3],Sheet3!C3:C23,8,FALSE))*1 -> 41 | G36: =RC[-1]-RC[10] -> 0 | H36: =VLOOKUP(RC[-2],R16C12:R29C13,2,FALSE) -> 7 | J36: 7 | K36: 合欢男 | P36: =VLOOKUP(RC[1],C12:C14,3,FALSE) -> 合欢男 | Q36: =MID(RC[-14],4,2)*1 -> 41 | R36: =VLOOKUP(RC[-1],R18C12:R27C13,2,FALSE) -> 7 | S36: =RC[-1]&",1,"&RC[-16]&",1,5;" -> 7,1,1104103,1,5; | V36: =RC[-4] -> 7 | W36: =RC[-20] -> 1104103
C37: 1104104 | D37: 鹰羽 | E37: =RC[11] -> 合欢男 | F37: =(VLOOKUP(RC[-3],Sheet3!C3:C23,9,FALSE)&VLOOKUP(RC[-3],Sheet3!C3:C23,8,FALSE))*1 -> 41 | G37: =RC[-1]-RC[10] -> 0 | H37: =VLOOKUP(RC[-2],R16C12:R29C13,2,FALSE) -> 7 | J37: 8 | K37: 合欢女 | P37: =VLOOKUP(RC[1],C12:C14,3,FALSE) -> 合欢男 | Q37: =MID(RC[-14],4,2)*1 -> 41 | R37: =VLOOKUP(RC[-1],R18C12:R27C13,2,FALSE) -> 7 | S37: =RC[-1]&",1,"&RC[-16]&",1,5;" -> 7,1,1104104,1,5; | V37: =RC[-4] -> 7 | W37: =RC[-20] -> 1104104
C38: 1104105 | D38: 五鬼阴风 | E38: =RC[11] -> 合欢男 | F38: =(VLOOKUP(RC[-3],Sheet3!C3:C23,9,FALSE)&VLOOKUP(RC[-3],Sheet3!C3:C23,8,FALSE))*1 -> 41 | G38: =RC[-1]-RC[10] -> 0 | H38: =VLOOKUP(RC[-2],R16C12:R29C13,2,FALSE) -> 7 | J38: 9 | K38: 圣巫男 | P38: =VLOOKUP(RC[1],C12:C14,3,FALSE) -> 合欢男 | Q38: =MID(RC[-14],4,2)*1 -> 41 | R38: =VLOOKUP(RC[-1],R18C12:R27C13,2,FALSE) -> 7 | S38: =RC[-1]&",1,"&RC[-16]&",1,5;" -> 7,1,1104105,1,5; | V38: =RC[-4] -> 7 | W38: =RC[-20] -> 1104105
C39: 1104203 | D39: 锁心鞭 | E39: =RC[11] -> 合欢女 | F39: =(VLOOKUP(RC[-3],Sheet3!C3:C23,9,FALSE)&VLOOKUP(RC[-3],Sheet3!C3:C23,8,FALSE))*1 -> 42 | G39: =RC[-1]-RC[10] -> 0 | H39: =VLOOKUP(RC[-2],R16C12:R29C13,2,FALSE) -> 8 | J39: 10 | K39: 圣巫女 | P39: =VLOOKUP(RC[1],C12:C14,3,FALSE) -> 合欢女 | Q39: =MID(RC[-14],4,2)*1 -> 42 | R39: =VLOOKUP(RC[-1],R18C12:R27C13,2,FALSE) -> 8 | S39: =RC[-1]&",1,"&RC[-16]&",1,5;" -> 8,1,1104203,1,5; | V39: =RC[-4] -> 8 | W39: =RC[-20] -> 1104203
C40: 1104204 | D40: 狼牙鞭 | E40: =RC[11] -> 合欢女 | F40: =(VLOOKUP(RC[-3],Sheet3!C3:C23,9,FALSE)&VLOOKUP(RC[-3],Sheet3!C3:C23,8,FALSE))*1 -> 42 | G40: =RC[-1]-RC[10] -> 0 | H40: =VLOOKUP(RC[-2],R16C12:R29C13,2,FALSE) -> 8 | P40: =VLOOKUP(RC[1],C12:C14,3,FALSE) -> 合欢女 | Q40: =MID(RC[-14],4,2)*1 -> 42 | R40: =VLOOKUP(RC[-1],R18C12:R27C13,2,FALSE) -> 8 | S40: =RC[-1]&",1,"&RC[-16]&",1,5;" -> 8,1,1104204,1,5; | V40: =RC[-4] -> 8 | W40: =RC[-20] -> 1104204
C41: 1104205 | D41: 神风鞭 | E41: =RC[11] -> 合欢女 | F41: =(VLOOKUP(RC[-3],Sheet3!C3:C23,9,FALSE)&VLOOKUP(RC[-3],Sheet3!C3:C23,8,FALSE))*1 -> 42 | G41: =RC[-1]-RC[10] -> 0 | H41: =VLOOKUP(RC[-2],R16C12:R29C13,2,FALSE) -> 8 | P41: =VLOOKUP(RC[1],C12:C14,3,FALSE) -> 合欢女 | Q41: =MID(RC[-14],4,2)*1 -> 42 | R41: =VLOOKUP(RC[-1],R18C12:R27C13,2,FALSE) -> 8 | S41: =RC[-1]&",1,"&RC[-16]&",1,5;" -> 8,1,1104205,1,5; | V41: =RC[-4] -> 8 | W41: =RC[-20] -> 1104205
C42: 1105103 | D42: 鸳鸯 | E42: =RC[11] -> 圣巫男 | F42: =(VLOOKUP(RC[-3],Sheet3!C3:C23,9,FALSE)&VLOOKUP(RC[-3],Sheet3!C3:C23,8,FALSE))*1 -> 51 | G42: =RC[-1]-RC[10] -> 0 | H42: =VLOOKUP(RC[-2],R16C12:R29C13,2,FALSE) -> 9 | P42: =VLOOKUP(RC[1],C12:C14,3,FALSE) -> 圣巫男 | Q42: =MID(RC[-14],4,2)*1 -> 51 | R42: =VLOOKUP(RC[-1],R18C12:R27C13,2,FALSE) -> 9 | S42: =RC[-1]&",1,"&RC[-16]&",1,5;" -> 9,1,1105103,1,5; | V42: =RC[-4] -> 9 | W42: =RC[-20] -> 1105103
C43: 1105104 | D43: 鱼鳞 | E43: =RC[11] -> 圣巫男 | F43: =(VLOOKUP(RC[-3],Sheet3!C3:C23,9,FALSE)&VLOOKUP(RC[-3],Sheet3!C3:C23,8,FALSE))*1 -> 51 | G43: =RC[-1]-RC[10] -> 0 | H43: =VLOOKUP(RC[-2],R16C12:R29C13,2,FALSE) -> 9 | P43: =VLOOKUP(RC[1],C12:C14,3,FALSE) -> 圣巫男 | Q43: =MID(RC[-14],4,2)*1 -> 51 | R43: =VLOOKUP(RC[-1],R18C12:R27C13,2,FALSE) -> 9 | S43: =RC[-1]&",1,"&RC[-16]&",1,5;" -> 9,1,1105104,1,5; | V43: =RC[-4] -> 9 | W43: =RC[-20] -> 1105104
C44: 1105105 | D44: 九天丧门 | E44: =RC[11] -> 圣巫男 | F44: =(VLOOKUP(RC[-3],Sheet3!C3:C23,9,FALSE)&VLOOKUP(RC[-3],Sheet3!C3:C23,8,FALSE))*1 -> 51 | G44: =RC[-1]-RC[10] -> 0 | H44: =VLOOKUP(RC[-2],R16C12:R29C13,2,FALSE) -> 9 | P44: =VLOOKUP(RC[1],C12:C14,3,FALSE) -> 圣巫男 | Q44: =MID(RC[-14],4,2)*1 -> 51 | R44: =VLOOKUP(RC[-1],R18C12:R27C13,2,FALSE) -> 9 | S44: =RC[-1]&",1,"&RC[-16]&",1,5;" -> 9,1,1105105,1,5; | V44: =RC[-4] -> 9 | W44: =RC[-20] -> 1105105
C45: 1105203 | D45: 棒棒糖 | E45: =RC[11] -> 圣巫女 | F45: =(VLOOKUP(RC[-3],Sheet3!C3:C23,9,FALSE)&VLOOKUP(RC[-3],Sheet3!C3:C23,8,FALSE))*1 -> 52 | G45: =RC[-1]-RC[10] -> 0 | H45: =VLOOKUP(RC[-2],R16C12:R29C13,2,FALSE) -> 10 | P45: =VLOOKUP(RC[1],C12:C14,3,FALSE) -> 圣巫女 | Q45: =MID(RC[-14],4,2)*1 -> 52 | R45: =VLOOKUP(RC[-1],R18C12:R27C13,2,FALSE) -> 10 | S45: =RC[-1]&",1,"&RC[-16]&",1,5;" -> 10,1,1105203,1,5; | V45: =RC[-4] -> 10 | W45: =RC[-20] -> 1105203
C46: 1105204 | D46: 咸鱼 | E46: =RC[11] -> 圣巫女 | F46: =(VLOOKUP(RC[-3],Sheet3!C3:C23,9,FALSE)&VLOOKUP(RC[-3],Sheet3!C3:C23,8,FALSE))*1 -> 52 | G46: =RC[-1]-RC[10] -> 0 | H46: =VLOOKUP(RC[-2],R16C12:R29C13,2,FALSE) -> 10 | P46: =VLOOKUP(RC[1],C12:C14,3,FALSE) -> 圣巫女 | Q46: =MID(RC[-14],4,2)*1 -> 52 | R46: =VLOOKUP(RC[-1],R18C12:R27C13,2,FALSE) -> 10 | S46: =RC[-1]&",1,"&RC[-16]&",1,5;" -> 10,1,1105204,1,5; | V46: =RC[-4] -> 10 | W46: =RC[-20] -> 1105204
C47: 1105205 | D47: 冰淇淋 | E47: =RC[11] -> 圣巫女 | F47: =(VLOOKUP(RC[-3],Sheet3!C3:C23,9,FALSE)&VLOOKUP(RC[-3],Sheet3!C3:C23,8,FALSE))*1 -> 52 | G47: =RC[-1]-RC[10] -> 0 | H47: =VLOOKUP(RC[-2],R16C12:R29C13,2,FALSE) -> 10 | P47: =VLOOKUP(RC[1],C12:C14,3,FALSE) -> 圣巫女 | Q47: =MID(RC[-14],4,2)*1 -> 52 | R47: =VLOOKUP(RC[-1],R18C12:R27C13,2,FALSE) -> 10 | S47: =RC[-1]&",1,"&RC[-16]&",1,5;" -> 10,1,1105205,1,5; | V47: =RC[-4] -> 10 | W47: =RC[-20] -> 1105205

Sheet: Sheet3
C1: 第一位：1=主角；2=宠物 第二位：1=武器；2=帽子；3=衣服；4=项链；5=腰带；6=鞋子 第三、四位：00=宠物；01=鬼王宗；02=青云门；03=天音阁；04=合欢派；05=圣巫教 第五位：0=宠物；1=男；2=女 第六、七位：编号00-99 | I1: 武器：1 帽子：2 衣服：3 项链：4 腰带：5 鞋子：6
C2: nID | D2: sName | E2: nDurable | F2: nNimbus | G2: nSalePrice | H2: nEquipLevel | I2: nEquipPartType | J2: nEquipSexType | K2: nEquipSchool
C3: i | D3: s | E3: e | F3: i | G3: i | H3: i | I3: i | J3: i | K3: i
C4: 编号 | D4: 名称 | E4: 耐久 | F4: 非专用的灵气值 | G4: 装备基础价格 | H4: 装备等级 | I4: 装备部位类型 | J4: 装备性别 | K4: 适用门派
C5: 1101100 | D5: 鬼头 | E5: lv*5+100 | F5: 2 | G5: 500 | H5: 0 | I5: 1 | J5: 1 | K5: 1
C6: 1101101 | D6: 古月 | E6: lv*5+100 | F6: 2 | G6: 1000 | H6: 10 | I6: 1 | J6: 1 | K6: 1
C7: 1101102 | D7: 七圣 | E7: lv*5+100 | F7: 2 | G7: 2500 | H7: 20 | I7: 1 | J7: 1 | K7: 1
C8: 1101103 | D8: 紫金 | E8: lv*5+100 | F8: 2 | G8: 5000 | H8: 30 | I8: 1 | J8: 1 | K8: 1
C9: 1101104 | D9: 饮血 | E9: lv*5+100 | F9: 2 | G9: 10000 | H9: 40 | I9: 1 | J9: 1 | K9: 1
C10: 1101105 | D10: 罗刹 | E10: lv*5+100 | F10: 2 | G10: 94500 | H10: 50 | I10: 1 | J10: 1 | K10: 1
C11: 1101106 | D11: 偃月侍 | E11: lv*5+100 | F11: 2 | G11: 154000 | H11: 60 | I11: 1 | J11: 1 | K11: 1
C12: 1101107 | D12: 地影 | E12: lv*5+100 | F12: 2 | G12: 230000 | H12: 70 | I12: 1 | J12: 1 | K12: 1
C13: 1101108 | D13: 鸣鸿 | E13: lv*5+100 | F13: 2 | G13: 360000 | H13: 80 | I13: 1 | J13: 1 | K13: 1
C14: 1101109 | D14: 龙鳞 | E14: lv*5+100 | F14: 2 | G14: 575000 | H14: 90 | I14: 1 | J14: 1 | K14: 1
C15: 1101110 | D15: 龙泉 | E15: lv*5+100 | F15: 2 | G15: 884000 | H15: 100 | I15: 1 | J15: 1 | K15: 1
C16: 1101200 | D16: 碧鳞 | E16: lv*5+100 | F16: 2 | G16: 500 | H16: 0 | I16: 1 | J16: 2 | K16: 1
C17: 1101201 | D17: 冰魄 | E17: lv*5+100 | F17: 2 | G17: 1000 | H17: 10 | I17: 1 | J17: 2 | K17: 1
C18: 1101202 | D18: 寒彻骨 | E18: lv*5+100 | F18: 2 | G18: 2500 | H18: 20 | I18: 1 | J18: 2 | K18: 1
C19: 1101203 | D19: 七情断肠 | E19: lv*5+100 | F19: 2 | G19: 5000 | H19: 30 | I19: 1 | J19: 2 | K19: 1
C20: 1101204 | D20: 紫鸢 | E20: lv*5+100 | F20: 2 | G20: 10000 | H20: 40 | I20: 1 | J20: 2 | K20: 1
C21: 1101205 | D21: 水犹寒 | E21: lv*5+100 | F21: 2 | G21: 94500 | H21: 50 | I21: 1 | J21: 2 | K21: 1
C22: 1101206 | D22: 忘情 | E22: lv*5+100 | F22: 2 | G22: 154000 | H22: 60 | I22: 1 | J22: 2 | K22: 1
C23: 1101207 | D23: 落花吟 | E23: lv*5+100 | F23: 2 | G23: 230000 | H23: 70 | I23: 1 | J23: 2 | K23: 1
C24: 1101208 | D24: 黄泉 | E24: lv*5+100 | F24: 2 | G24: 360000 | H24: 80 | I24: 1 | J24: 2 | K24: 1
C25: 1101209 | D25: 醉琉璃 | E25: lv*5+100 | F25: 2 | G25: 575000 | H25: 90 | I25: 1 | J25: 2 | K25: 1
C26: 1101210 | D26: 残阳 | E26: lv*5+100 | F26: 2 | G26: 884000 | H26: 100 | I26: 1 | J26: 2 | K26: 1
C27: 1102100 | D27: 雄黄 | E27: lv*5+100 | F27: 2 | G27: 500 | H27: 0 | I27: 1 | J27: 1 | K27: 2
C28: 1102101 | D28: 游龙 | E28: lv*5+100 | F28: 2 | G28: 1000 | H28: 10 | I28: 1 | J28: 1 | K28: 2
C29: 1102102 | D29: 蓝玉 | E29: lv*5+100 | F29: 2 | G29: 2500 | H29: 20 | I29: 1 | J29: 1 | K29: 2
C30: 1102103 | D30: 蔷薇 | E30: lv*5+100 | F30: 2 | G30: 5000 | H30: 30 | I30: 1 | J30: 1 | K30: 2
C31: 1102104 | D31: 承影 | E31: lv*5+100 | F31: 2 | G31: 10000 | H31: 40 | I31: 1 | J31: 1 | K31: 2
C32: 1102105 | D32: 七星龙渊 | E32: lv*5+100 | F32: 2 | G32: 94500 | H32: 50 | I32: 1 | J32: 1 | K32: 2
C33: 1102106 | D33: 泰阿 | E33: lv*5+100 | F33: 2 | G33: 154000 | H33: 60 | I33: 1 | J33: 1 | K33: 2
C34: 1102107 | D34: 赤霄 | E34: lv*5+100 | F34: 2 | G34: 230000 | H34: 70 | I34: 1 | J34: 1 | K34: 2
C35: 1102108 | D35: 巨阙 | E35: lv*5+100 | F35: 2 | G35: 360000 | H35: 80 | I35: 1 | J35: 1 | K35: 2
C36: 1102109 | D36: 湛泸 | E36: lv*5+100 | F36: 2 | G36: 575000 | H36: 90 | I36: 1 | J36: 1 | K36: 2
C37: 1102110 | D37: 轩辕 | E37: lv*5+100 | F37: 2 | G37: 884000 | H37: 100 | I37: 1 | J37: 1 | K37: 2
C38: 1102200 | D38: 青铜双剑 | E38: lv*5+100 | F38: 2 | G38: 500 | H38: 0 | I38: 1 | J38: 2 | K38: 2
C39: 1102201 | D39: 旋舞 | E39: lv*5+100 | F39: 2 | G39: 1000 | H39: 10 | I39: 1 | J39: 2 | K39: 2
C40: 1102202 | D40: 映水 | E40: lv*5+100 | F40: 2 | G40: 2500 | H40: 20 | I40: 1 | J40: 2 | K40: 2
C41: 1102203 | D41: 龙凤 | E41: lv*5+100 | F41: 2 | G41: 5000 | H41: 30 | I41: 1 | J41: 2 | K41: 2
C42: 1102204 | D42: 阴阳 | E42: lv*5+100 | F42: 2 | G42: 10000 | H42: 40 | I42: 1 | J42: 2 | K42: 2
C43: 1102205 | D43: 子母鸳鸯 | E43: lv*5+100 | F43: 2 | G43: 94500 | H43: 50 | I43: 1 | J43: 2 | K43: 2
C44: 1102206 | D44: 紫青 | E44: lv*5+100 | F44: 2 | G44: 154000 | H44: 60 | I44: 1 | J44: 2 | K44: 2
C45: 1102207 | D45: 清魂 | E45: lv*5+100 | F45: 2 | G45: 230000 | H45: 70 | I45: 1 | J45: 2 | K45: 2
C46: 1102208 | D46: 霞影 | E46: lv*5+100 | F46: 2 | G46: 360000 | H46: 80 | I46: 1 | J46: 2 | K46: 2
C47: 1102209 | D47: 流萤 | E47: lv*5+100 | F47: 2 | G47: 575000 | H47: 90 | I47: 1 | J47: 2 | K47: 2
C48: 1102210 | D48: 噬月 | E48: lv*5+100 | F48: 2 | G48: 884000 | H48: 100 | I48: 1 | J48: 2 | K48: 2
C49: 1103100 | D49: 水火 | E49: lv*5+100 | F49: 2 | G49: 500 | H49: 0 | I49: 1 | J49: 1 | K49: 3
C50: 1103101 | D50: 齐眉 | E50: lv*5+100 | F50: 2 | G50: 1000 | H50: 10 | I50: 1 | J50: 1 | K50: 3
C51: 1103102 | D51: 云竹杖 | E51: lv*5+100 | F51: 2 | G51: 2500 | H51: 20 | I51: 1 | J51: 1 | K51: 3
C52: 1103103 | D52: 打狗棒 | E52: lv*5+100 | F52: 2 | G52: 5000 | H52: 30 | I52: 1 | J52: 1 | K52: 3
C53: 1103104 | D53: 流云杖 | E53: lv*5+100 | F53: 2 | G53: 10000 | H53: 40 | I53: 1 | J53: 1 | K53: 3
C54: 1103105 | D54: 长歌伽蓝 | E54: lv*5+100 | F54: 2 | G54: 94500 | H54: 50 | I54: 1 | J54: 1 | K54: 3
C55: 1103106 | D55: 盘龙杖 | E55: lv*5+100 | F55: 2 | G55: 154000 | H55: 60 | I55: 1 | J55: 1 | K55: 3
C56: 1103107 | D56: 赤金 | E56: lv*5+100 | F56: 2 | G56: 230000 | H56: 70 | I56: 1 | J56: 1 | K56: 3
C57: 1103108 | D57: 烈火 | E57: lv*5+100 | F57: 2 | G57: 360000 | H57: 80 | I57: 1 | J57: 1 | K57: 3
C58: 1103109 | D58: 青蛇 | E58: lv*5+100 | F58: 2 | G58: 575000 | H58: 90 | I58: 1 | J58: 1 | K58: 3
C59: 1103110 | D59: 不周天柱 | E59: lv*5+100 | F59: 2 | G59: 884000 | H59: 100 | I59: 1 | J59: 1 | K59: 3
C60: 1103200 | D60: 彩云缎带 | E60: lv*5+100 | F60: 2 | G60: 500 | H60: 0 | I60: 1 | J60: 2 | K60: 3
C61: 1103201 | D61: 天罗丝 | E61: lv*5+100 | F61: 2 | G61: 1000 | H61: 10 | I61: 1 | J61: 2 | K61: 3
C62: 1103202 | D62: 碧海银纱 | E62: lv*5+100 | F62: 2 | G62: 2500 | H62: 20 | I62: 1 | J62: 2 | K62: 3
C63: 1103203 | D63: 混天绫 | E63: lv*5+100 | F63: 2 | G63: 5000 | H63: 30 | I63: 1 | J63: 2 | K63: 3
C64: 1103204 | D64: 绕指柔 | E64: lv*5+100 | F64: 2 | G64: 10000 | H64: 40 | I64: 1 | J64: 2 | K64: 3
C65: 1103205 | D65: 沧海卷云丝 | E65: lv*5+100 | F65: 2 | G65: 94500 | H65: 50 | I65: 1 | J65: 2 | K65: 3
C66: 1103206 | D66: 青虹 | E66: lv*5+100 | F66: 2 | G66: 154000 | H66: 60 | I66: 1 | J66: 2 | K66: 3
C67: 1103207 | D67: 唱月 | E67: lv*5+100 | F67: 2 | G67: 230000 | H67: 70 | I67: 1 | J67: 2 | K67: 3
C68: 1103208 | D68: 红袖 | E68: lv*5+100 | F68: 2 | G68: 360000 | H68: 80 | I68: 1 | J68: 2 | K68: 3
C69: 1103209 | D69: 碧落 | E69: lv*5+100 | F69: 2 | G69: 575000 | H69: 90 | I69: 1 | J69: 2 | K69: 3
C70: 1103210 | D70: 慕雪梨花 | E70: lv*5+100 | F70: 2 | G70: 884000 | H70: 100 | I70: 1 | J70: 2 | K70: 3
C71: 1104100 | D71: 纸扇 | E71: lv*5+100 | F71: 2 | G71: 500 | H71: 0 | I71: 1 | J71: 1 | K71: 4
C72: 1104101 | D72: 聚财 | E72: lv*5+100 | F72: 2 | G72: 1000 | H72: 10 | I72: 1 | J72: 1 | K72: 4
C73: 1104102 | D73: 铁骨 | E73: lv*5+100 | F73: 2 | G73: 2500 | H73: 20 | I73: 1 | J73: 1 | K73: 4
C74: 1104103 | D74: 五明 | E74: lv*5+100 | F74: 2 | G74: 5000 | H74: 30 | I74: 1 | J74: 1 | K74: 4
C75: 1104104 | D75: 鹰羽 | E75: lv*5+100 | F75: 2 | G75: 10000 | H75: 40 | I75: 1 | J75: 1 | K75: 4
C76: 1104105 | D76: 五鬼阴风 | E76: lv*5+100 | F76: 2 | G76: 94500 | H76: 50 | I76: 1 | J76: 1 | K76: 4
C77: 1104106 | D77: 芭蕉 | E77: lv*5+100 | F77: 2 | G77: 154000 | H77: 60 | I77: 1 | J77: 1 | K77: 4
C78: 1104107 | D78: 穷奇 | E78: lv*5+100 | F78: 2 | G78: 230000 | H78: 70 | I78: 1 | J78: 1 | K78: 4
C79: 1104108 | D79: 风雷 | E79: lv*5+100 | F79: 2 | G79: 360000 | H79: 80 | I79: 1 | J79: 1 | K79: 4
C80: 1104109 | D80: 神焰 | E80: lv*5+100 | F80: 2 | G80: 575000 | H80: 90 | I80: 1 | J80: 1 | K80: 4
C81: 1104110 | D81: 朱雀血羽 | E81: lv*5+100 | F81: 2 | G81: 884000 | H81: 100 | I81: 1 | J81: 1 | K81: 4
C82: 1104200 | D82: 荆棘鞭 | E82: lv*5+100 | F82: 2 | G82: 500 | H82: 0 | I82: 1 | J82: 2 | K82: 4
C83: 1104201 | D83: 豹尾鞭 | E83: lv*5+100 | F83: 2 | G83: 1000 | H83: 10 | I83: 1 | J83: 2 | K83: 4
C84: 1104202 | D84: 赤链鞭 | E84: lv*5+100 | F84: 2 | G84: 2500 | H84: 20 | I84: 1 | J84: 2 | K84: 4
C85: 1104203 | D85: 锁心鞭 | E85: lv*5+100 | F85: 2 | G85: 5000 | H85: 30 | I85: 1 | J85: 2 | K85: 4
C86: 1104204 | D86: 狼牙鞭 | E86: lv*5+100 | F86: 2 | G86: 10000 | H86: 40 | I86: 1 | J86: 2 | K86: 4
C87: 1104205 | D87: 神风鞭 | E87: lv*5+100 | F87: 2 | G87: 94500 | H87: 50 | I87: 1 | J87: 2 | K87: 4
C88: 1104206 | D88: 幽灵鞭 | E88: lv*5+100 | F88: 2 | G88: 154000 | H88: 60 | I88: 1 | J88: 2 | K88: 4
C89: 1104207 | D89: 伏魔鞭 | E89: lv*5+100 | F89: 2 | G89: 230000 | H89: 70 | I89: 1 | J89: 2 | K89: 4
C90: 1104208 | D90: 诛神鞭 | E90: lv*5+100 | F90: 2 | G90: 360000 | H90: 80 | I90: 1 | J90: 2 | K90: 4
C91: 1104209 | D91: 灭天 | E91: lv*5+100 | F91: 2 | G91: 575000 | H91: 90 | I91: 1 | J91: 2 | K91: 4
C92: 1104210 | D92: 化蛇缠丝 | E92: lv*5+100 | F92: 2 | G92: 884000 | H92: 100 | I92: 1 | J92: 2 | K92: 4
C93: 1105100 | D93: 轻木槌 | E93: lv*5+100 | F93: 2 | G93: 500 | H93: 0 | I93: 1 | J93: 1 | K93: 5
C94: 1105101 | D94: 钉头 | E94: lv*5+100 | F94: 2 | G94: 1000 | H94: 10 | I94: 1 | J94: 1 | K94: 5
C95: 1105102 | D95: 碎骨 | E95: lv*5+100 | F95: 2 | G95: 2500 | H95: 20 | I95: 1 | J95: 1 | K95: 5
C96: 1105103 | D96: 鸳鸯 | E96: lv*5+100 | F96: 2 | G96: 5000 | H96: 30 | I96: 1 | J96: 1 | K96: 5
C97: 1105104 | D97: 鱼鳞 | E97: lv*5+100 | F97: 2 | G97: 10000 | H97: 40 | I97: 1 | J97: 1 | K97: 5
C98: 1105105 | D98: 九天丧门 | E98: lv*5+100 | F98: 2 | G98: 94500 | H98: 50 | I98: 1 | J98: 1 | K98: 5
C99: 1105106 | D99: 巨蟒 | E99: lv*5+100 | F99: 2 | G99: 154000 | H99: 60 | I99: 1 | J99: 1 | K99: 5
C100: 1105107 | D100: 镇妖 | E100: lv*5+100 | F100: 2 | G100: 230000 | H100: 70 | I100: 1 | J100: 1 | K100: 5
C101: 1105108 | D101: 龙骨 | E101: lv*5+100 | F101: 2 | G101: 360000 | H101: 80 | I101: 1 | J101: 1 | K101: 5
C102: 1105109 | D102: 雷霆 | E102: lv*5+100 | F102: 2 | G102: 575000 | H102: 90 | I102: 1 | J102: 1 | K102: 5
C103: 1105110 | D103: 鬼眼 | E103: lv*5+100 | F103: 2 | G103: 884000 | H103: 100 | I103: 1 | J103: 1 | K103: 5
C104: 1105200 | D104: 竹子 | E104: lv*5+100 | F104: 2 | G104: 500 | H104: 0 | I104: 1 | J104: 2 | K104: 5
C105: 1105201 | D105: 鸡毛掸子 | E105: lv*5+100 | F105: 2 | G105: 1000 | H105: 10 | I105: 1 | J105: 2 | K105: 5
C106: 1105202 | D106: 木马 | E106: lv*5+100 | F106: 2 | G106: 2500 | H106: 20 | I106: 1 | J106: 2 | K106: 5
C107: 1105203 | D107: 棒棒糖 | E107: lv*5+100 | F107: 2 | G107: 5000 | H107: 30 | I107: 1 | J107: 2 | K107: 5
C108: 1105204 | D108: 咸鱼 | E108: lv*5+100 | F108: 2 | G108: 10000 | H108: 40 | I108: 1 | J108: 2 | K108: 5
C109: 1105205 | D109: 冰淇淋 | E109: lv*5+100 | F109: 2 | G109: 94500 | H109: 50 | I109: 1 | J109: 2 | K109: 5
C110: 1105206 | D110: 拨浪鼓 | E110: lv*5+100 | F110: 2 | G110: 154000 | H110: 60 | I110: 1 | J110: 2 | K110: 5
C111: 1105207 | D111: 平底锅 | E111: lv*5+100 | F111: 2 | G111: 230000 | H111: 70 | I111: 1 | J111: 2 | K111: 5
C112: 1105208 | D112: 面具 | E112: lv*5+100 | F112: 2 | G112: 360000 | H112: 80 | I112: 1 | J112: 2 | K112: 5
C113: 1105209 | D113: 狼牙棒 | E113: lv*5+100 | F113: 2 | G113: 575000 | H113: 90 | I113: 1 | J113: 2 | K113: 5
C114: 1105210 | D114: 玩具兔 | E114: lv*5+100 | F114: 2 | G114: 884000 | H114: 100 | I114: 1 | J114: 2 | K114: 5
C115: 1200100 | D115: 布帽 | E115: lv*5+100 | F115: 2 | G115: 500 | H115: 0 | I115: 2 | J115: 1 | K115: 0
C116: 1200101 | D116: 武勇帽 | E116: lv*5+100 | F116: 2 | G116: 1000 | H116: 10 | I116: 2 | J116: 1 | K116: 0
C117: 1200102 | D117: 油皮帽 | E117: lv*5+100 | F117: 2 | G117: 2500 | H117: 20 | I117: 2 | J117: 1 | K117: 0
C118: 1200103 | D118: 熟铁盔 | E118: lv*5+100 | F118: 2 | G118: 5000 | H118: 30 | I118: 2 | J118: 1 | K118: 0
C119: 1200104 | D119: 錾金盔 | E119: lv*5+100 | F119: 2 | G119: 10000 | H119: 40 | I119: 2 | J119: 1 | K119: 0
C120: 1200105 | D120: 玄铁盔 | E120: lv*5+100 | F120: 2 | G120: 94500 | H120: 50 | I120: 2 | J120: 1 | K120: 0
C121: 1200106 | D121: 流云冠 | E121: lv*5+100 | F121: 2 | G121: 154000 | H121: 60 | I121: 2 | J121: 1 | K121: 0
C122: 1200107 | D122: 破军盔 | E122: lv*5+100 | F122: 2 | G122: 230000 | H122: 70 | I122: 2 | J122: 1 | K122: 0
C123: 1200108 | D123: 魔尊盔 | E123: lv*5+100 | F123: 2 | G123: 360000 | H123: 80 | I123: 2 | J123: 1 | K123: 0
C124: 1200109 | D124: 龙鳞盔 | E124: lv*5+100 | F124: 2 | G124: 575000 | H124: 90 | I124: 2 | J124: 1 | K124: 0
C125: 1200110 | D125: 武神冠 | E125: lv*5+100 | F125: 2 | G125: 884000 | H125: 100 | I125: 2 | J125: 1 | K125: 0
C126: 1200111 | D126: 旭日冠宇 | E126: lv*5+100 | F126: 2 | G126: 1390500 | H126: 110 | I126: 2 | J126: 1 | K126: 0
C127: 1200112 | D127: 乾坤顶 | E127: lv*5+100 | F127: 2 | G127: 2156000 | H127: 120 | I127: 2 | J127: 1 | K127: 0
C128: 1200200 | D128: 布巾 | E128: lv*5+100 | F128: 2 | G128: 500 | H128: 0 | I128: 2 | J128: 2 | K128: 0
C129: 1200201 | D129: 巾帼帽 | E129: lv*5+100 | F129: 2 | G129: 1000 | H129: 10 | I129: 2 | J129: 2 | K129: 0
C130: 1200202 | D130: 玉钗 | E130: lv*5+100 | F130: 2 | G130: 2500 | H130: 20 | I130: 2 | J130: 2 | K130: 0
C131: 1200203 | D131: 珍珠钗 | E131: lv*5+100 | F131: 2 | G131: 5000 | H131: 30 | I131: 2 | J131: 2 | K131: 0
C132: 1200204 | D132: 蚕丝帽 | E132: lv*5+100 | F132: 2 | G132: 10000 | H132: 40 | I132: 2 | J132: 2 | K132: 0
C133: 1200205 | D133: 雾隐面纱 | E133: lv*5+100 | F133: 2 | G133: 94500 | H133: 50 | I133: 2 | J133: 2 | K133: 0
C134: 1200206 | D134: 雪羽帽 | E134: lv*5+100 | F134: 2 | G134: 154000 | H134: 60 | I134: 2 | J134: 2 | K134: 0
C135: 1200207 | D135: 彩云丝冠 | E135: lv*5+100 | F135: 2 | G135: 230000 | H135: 70 | I135: 2 | J135: 2 | K135: 0
C136: 1200208 | D136: 碧玉仙簪 | E136: lv*5+100 | F136: 2 | G136: 360000 | H136: 80 | I136: 2 | J136: 2 | K136: 0
C137: 1200209 | D137: 凤羽冠 | E137: lv*5+100 | F137: 2 | G137: 575000 | H137: 90 | I137: 2 | J137: 2 | K137: 0
C138: 1200210 | D138: 天女冠 | E138: lv*5+100 | F138: 2 | G138: 884000 | H138: 100 | I138: 2 | J138: 2 | K138: 0
C139: 1200211 | D139: 百鸟朝凤 | E139: lv*5+100 | F139: 2 | G139: 1390500 | H139: 110 | I139: 2 | J139: 2 | K139: 0
C140: 1200212 | D140: 雀羽凤凰 | E140: lv*5+100 | F140: 2 | G140: 2156000 | H140: 120 | I140: 2 | J140: 2 | K140: 0
C141: 1300100 | D141: 粗布衣 | E141: lv*5+100 | F141: 2 | G141: 500 | H141: 0 | I141: 3 | J141: 1 | K141: 0
C142: 1300101 | D142: 武勇袍 | E142: lv*5+100 | F142: 2 | G142: 1000 | H142: 10 | I142: 3 | J142: 1 | K142: 0
C143: 1300102 | D143: 镶皮甲 | E143: lv*5+100 | F143: 2 | G143: 2500 | H143: 20 | I143: 3 | J143: 1 | K143: 0
C144: 1300103 | D144: 精钢铠 | E144: lv*5+100 | F144: 2 | G144: 5000 | H144: 30 | I144: 3 | J144: 1 | K144: 0
C145: 1300104 | D145: 金丝软甲 | E145: lv*5+100 | F145: 2 | G145: 10000 | H145: 40 | I145: 3 | J145: 1 | K145: 0
C146: 1300105 | D146: 玄铁战甲 | E146: lv*5+100 | F146: 2 | G146: 94500 | H146: 50 | I146: 3 | J146: 1 | K146: 0
C147: 1300106 | D147: 流云战袍 | E147: lv*5+100 | F147: 2 | G147: 154000 | H147: 60 | I147: 3 | J147: 1 | K147: 0
C148: 1300107 | D148: 破军铠 | E148: lv*5+100 | F148: 2 | G148: 230000 | H148: 70 | I148: 3 | J148: 1 | K148: 0
C149: 1300108 | D149: 魔尊铠 | E149: lv*5+100 | F149: 2 | G149: 360000 | H149: 80 | I149: 3 | J149: 1 | K149: 0
C150: 1300109 | D150: 龙鳞铠 | E150: lv*5+100 | F150: 2 | G150: 575000 | H150: 90 | I150: 3 | J150: 1 | K150: 0
C151: 1300110 | D151: 武神铠 | E151: lv*5+100 | F151: 2 | G151: 884000 | H151: 100 | I151: 3 | J151: 1 | K151: 0
C152: 1300111 | D152: 刀锋铠 | E152: lv*5+100 | F152: 2 | G152: 1390500 | H152: 110 | I152: 3 | J152: 1 | K152: 0
C153: 1300112 | D153: 雷鸣甲 | E153: lv*5+100 | F153: 2 | G153: 2156000 | H153: 120 | I153: 3 | J153: 1 | K153: 0
C154: 1300200 | D154: 粗布裙 | E154: lv*5+100 | F154: 2 | G154: 500 | H154: 0 | I154: 3 | J154: 2 | K154: 0
C155: 1300201 | D155: 巾帼袍 | E155: lv*5+100 | F155: 2 | G155: 1000 | H155: 10 | I155: 3 | J155: 2 | K155: 0
C156: 1300202 | D156: 狐裘袄 | E156: lv*5+100 | F156: 2 | G156: 2500 | H156: 20 | I156: 3 | J156: 2 | K156: 0
C157: 1300203 | D157: 流云纱衣 | E157: lv*5+100 | F157: 2 | G157: 5000 | H157: 30 | I157: 3 | J157: 2 | K157: 0
C158: 1300204 | D158: 天蚕丝衣 | E158: lv*5+100 | F158: 2 | G158: 10000 | H158: 40 | I158: 3 | J158: 2 | K158: 0
C159: 1300205 | D159: 雾隐长裙 | E159: lv*5+100 | F159: 2 | G159: 94500 | H159: 50 | I159: 3 | J159: 2 | K159: 0
C160: 1300206 | D160: 霓裳羽衣 | E160: lv*5+100 | F160: 2 | G160: 154000 | H160: 60 | I160: 3 | J160: 2 | K160: 0
C161: 1300207 | D161: 婆娑云裳 | E161: lv*5+100 | F161: 2 | G161: 230000 | H161: 70 | I161: 3 | J161: 2 | K161: 0
C162: 1300208 | D162: 金蝉仙衣 | E162: lv*5+100 | F162: 2 | G162: 360000 | H162: 80 | I162: 3 | J162: 2 | K162: 0
C163: 1300209 | D163: 凤凰羽衣 | E163: lv*5+100 | F163: 2 | G163: 575000 | H163: 90 | I163: 3 | J163: 2 | K163: 0
C164: 1300210 | D164: 无暇天衣 | E164: lv*5+100 | F164: 2 | G164: 884000 | H164: 100 | I164: 3 | J164: 2 | K164: 0
C165: 1300211 | D165: 飘渺鳞衣 | E165: lv*5+100 | F165: 2 | G165: 1390500 | H165: 110 | I165: 3 | J165: 2 | K165: 0
C166: 1300212 | D166: 落雁裙摆 | E166: lv*5+100 | F166: 2 | G166: 2156000 | H166: 120 | I166: 3 | J166: 2 | K166: 0
C167: 1400000 | D167: 红丝线 | E167: lv*5+100 | F167: 2 | G167: 500 | H167: 0 | I167: 4 | J167: 0 | K167: 0
C168: 1400001 | D168: 香囊 | E168: lv*5+100 | F168: 2 | G168: 1000 | H168: 10 | I168: 4 | J168: 0 | K168: 0
C169: 1400002 | D169: 长生锁 | E169: lv*5+100 | F169: 2 | G169: 2500 | H169: 20 | I169: 4 | J169: 0 | K169: 0
C170: 1400003 | D170: 玲珑玉符 | E170: lv*5+100 | F170: 2 | G170: 5000 | H170: 30 | I170: 4 | J170: 0 | K170: 0
C171: 1400004 | D171: 月白项链 | E171: lv*5+100 | F171: 2 | G171: 10000 | H171: 40 | I171: 4 | J171: 0 | K171: 0
C172: 1400005 | D172: 辟邪香包 | E172: lv*5+100 | F172: 2 | G172: 94500 | H172: 50 | I172: 4 | J172: 0 | K172: 0
C173: 1400006 | D173: 象牙龙骨 | E173: lv*5+100 | F173: 2 | G173: 154000 | H173: 60 | I173: 4 | J173: 0 | K173: 0
C174: 1400007 | D174: 玄石护符 | E174: lv*5+100 | F174: 2 | G174: 230000 | H174: 70 | I174: 4 | J174: 0 | K174: 0
C175: 1400008 | D175: 金蕉叶链 | E175: lv*5+100 | F175: 2 | G175: 360000 | H175: 80 | I175: 4 | J175: 0 | K175: 0
C176: 1400009 | D176: 星耀令 | E176: lv*5+100 | F176: 2 | G176: 575000 | H176: 90 | I176: 4 | J176: 0 | K176: 0
C177: 1400010 | D177: 灵宝 | E177: lv*5+100 | F177: 2 | G177: 884000 | H177: 100 | I177: 4 | J177: 0 | K177: 0
C178: 1400011 | D178: 聚魂护手 | E178: lv*5+100 | F178: 2 | G178: 1390500 | H178: 110 | I178: 4 | J178: 0 | K178: 0
C179: 1400012 | D179: 七曜暗护手 | E179: lv*5+100 | F179: 2 | G179: 2156000 | H179: 120 | I179: 4 | J179: 0 | K179: 0
C180: 1500000 | D180: 软皮带 | E180: lv*5+100 | F180: 2 | G180: 500 | H180: 0 | I180: 5 | J180: 0 | K180: 0
C181: 1500001 | D181: 硬皮护腰 | E181: lv*5+100 | F181: 2 | G181: 1000 | H181: 10 | I181: 5 | J181: 0 | K181: 0
C182: 1500002 | D182: 镶金腰带 | E182: lv*5+100 | F182: 2 | G182: 2500 | H182: 20 | I182: 5 | J182: 0 | K182: 0
C183: 1500003 | D183: 坠玉腰带 | E183: lv*5+100 | F183: 2 | G183: 5000 | H183: 30 | I183: 5 | J183: 0 | K183: 0
C184: 1500004 | D184: 火云鳞带 | E184: lv*5+100 | F184: 2 | G184: 10000 | H184: 40 | I184: 5 | J184: 0 | K184: 0
C185: 1500005 | D185: 水晶腰带 | E185: lv*5+100 | F185: 2 | G185: 94500 | H185: 50 | I185: 5 | J185: 0 | K185: 0
C186: 1500006 | D186: 鲲鹏护腰 | E186: lv*5+100 | F186: 2 | G186: 154000 | H186: 60 | I186: 5 | J186: 0 | K186: 0
C187: 1500007 | D187: 七煞护腰 | E187: lv*5+100 | F187: 2 | G187: 230000 | H187: 70 | I187: 5 | J187: 0 | K187: 0
C188: 1500008 | D188: 星云护腰 | E188: lv*5+100 | F188: 2 | G188: 360000 | H188: 80 | I188: 5 | J188: 0 | K188: 0
C189: 1500009 | D189: 修罗护腰 | E189: lv*5+100 | F189: 2 | G189: 575000 | H189: 90 | I189: 5 | J189: 0 | K189: 0
C190: 1500010 | D190: 九幽护腰 | E190: lv*5+100 | F190: 2 | G190: 884000 | H190: 100 | I190: 5 | J190: 0 | K190: 0
C191: 1500011 | D191: 刀伤护腰 | E191: lv*5+100 | F191: 2 | G191: 1390500 | H191: 110 | I191: 5 | J191: 0 | K191: 0
C192: 1500012 | D192: 威震八方护腰 | E192: lv*5+100 | F192: 2 | G192: 2156000 | H192: 120 | I192: 5 | J192: 0 | K192: 0
C193: 1600000 | D193: 布鞋 | E193: lv*5+100 | F193: 2 | G193: 500 | H193: 0 | I193: 6 | J193: 0 | K193: 0
C194: 1600001 | D194: 牛皮靴 | E194: lv*5+100 | F194: 2 | G194: 1000 | H194: 10 | I194: 6 | J194: 0 | K194: 0
C195: 1600002 | D195: 侠客靴 | E195: lv*5+100 | F195: 2 | G195: 2500 | H195: 20 | I195: 6 | J195: 0 | K195: 0
C196: 1600003 | D196: 逐日靴 | E196: lv*5+100 | F196: 2 | G196: 5000 | H196: 30 | I196: 6 | J196: 0 | K196: 0
C197: 1600004 | D197: 炽焰靴 | E197: lv*5+100 | F197: 2 | G197: 10000 | H197: 40 | I197: 6 | J197: 0 | K197: 0
C198: 1600005 | D198: 步云履 | E198: lv*5+100 | F198: 2 | G198: 94500 | H198: 50 | I198: 6 | J198: 0 | K198: 0
C199: 1600006 | D199: 凌波履 | E199: lv*5+100 | F199: 2 | G199: 154000 | H199: 60 | I199: 6 | J199: 0 | K199: 0
C200: 1600007 | D200: 御风履 | E200: lv*5+100 | F200: 2 | G200: 230000 | H200: 70 | I200: 6 | J200: 0 | K200: 0
C201: 1600008 | D201: 乌光神靴 | E201: lv*5+100 | F201: 2 | G201: 360000 | H201: 80 | I201: 6 | J201: 0 | K201: 0
C202: 1600009 | D202: 钧天履 | E202: lv*5+100 | F202: 2 | G202: 575000 | H202: 90 | I202: 6 | J202: 0 | K202: 0
C203: 1600010 | D203: 踏火风轮 | E203: lv*5+100 | F203: 2 | G203: 884000 | H203: 100 | I203: 6 | J203: 0 | K203: 0
C204: 1600011 | D204: 举步千里靴 | E204: lv*5+100 | F204: 2 | G204: 1390500 | H204: 110 | I204: 6 | J204: 0 | K204: 0
C205: 1600012 | D205: 神行魔足 | E205: lv*5+100 | F205: 2 | G205: 2156000 | H205: 120 | I205: 6 | J205: 0 | K205: 0