Sheet: ctPetGradeConf
A2: nGradeID | B2: sGrade
A3: i | B3: s
A4: 宠物评级编号 | B4: 宠物评级
A5: 1 | B5: R
A6: 2 | B6: SR
A7: 3 | B7: SSR
A8: 4 | B8: SSSR
A9: 5 | B9: UR

Sheet: Sheet2
F1: 灵气1的多少元宝 | G1: 8
A3: 伙伴评级编号 | B3: 伙伴评级 | C3: 战斗力 | D3: 品质升级到SSS需求的灵气 | F3: 价格（元宝 | G3: 补充差价 | H3: 需要灵气 | J3: 需要天数
A4: 1 | B4: B | C4: 34*lv | D4: 1250 | F4: 10 | G4: =R8C6-RC[-1] -> 9990 | H4: =RC[-1]/R1C7 -> 1248.75 | J4: =RC4/R16C19 -> 10 | K4: =RC4/R17C19 -> 17.857142857142858 | L4: =RC4/R18C19 -> 34.722222222222221
A5: 2 | B5: A | C5: 38*lv | D5: 1240 | F5: 100 | G5: =R8C6-RC[-1] -> 9900 | H5: =RC[-1]/R1C7 -> 1237.5 | J5: =RC4/R16C19 -> 9.92 | K5: =RC4/R17C19 -> 17.714285714285715 | L5: =RC4/R18C19 -> 34.444444444444443
A6: 3 | B6: S | C6: 42*lv | D6: 1190 | F6: 500 | G6: =R8C6-RC[-1] -> 9500 | H6: =RC[-1]/R1C7 -> 1187.5 | J6: =RC4/R16C19 -> 9.52 | K6: =RC4/R17C19 -> 17 | L6: =RC4/R18C19 -> 33.055555555555557
A7: 4 | B7: SS | C7: 46*lv | D7: 625 | F7: 5000 | G7: =R8C6-RC[-1] -> 5000 | H7: =RC[-1]/R1C7 -> 625 | J7: =RC4/R16C19 -> 5 | K7: =RC4/R17C19 -> 8.9285714285714288 | L7: =RC4/R18C19 -> 17.361111111111111
A8: 5 | B8: SSS | C8: 50*lv | D8: 0 | F8: 10000 | G8: =R8C6-RC[-1] -> 0 | H8: =RC[-1]/R1C7 -> 0
B15: 消耗 | C15: 天数 | D15: b | E15: a | F15: s | G15: ss | I15: b | J15: a | K15: s | L15: ss | N15: b | O15: a | P15: s | Q15: ss
B16: 元宝 | C16: 10 | D16: =R4C7/RC3 -> 999 | I16: =ROUND(RC[-5],0) -> 999 | J16: =ROUND(RC[-5],0) -> 0 | K16: =ROUND(RC[-5],0) -> 0 | L16: =ROUND(RC[-5],0) -> 0 | N16: =RC[-5]*1*1 -> 999 | O16: =RC[-5]*1 -> 0 | P16: =RC[-5]*1 -> 0 | Q16: =RC[-5]*1 -> 0 | S16: =ROUNDUP(RC[-10]/R1C7,0) -> 125 | T16: =ROUNDUP(RC[-10]/R1C7,0) -> 0 | U16: =ROUNDUP(RC[-10]/R1C7,0) -> 0 | V16: =ROUNDUP(RC[-10]/R1C7,0) -> 0 | X16: =RC[-5]*RC3 -> 1250
B17: 金币 | C17: 18 | D17: =R4C7/RC3 -> 555 | I17: =ROUND(RC[-5],0) -> 555 | J17: =ROUND(RC[-5],0) -> 0 | K17: =ROUND(RC[-5],0) -> 0 | L17: =ROUND(RC[-5],0) -> 0 | N17: =RC[-5]*100*1.1 -> 61050.000000000007 | O17: =RC[-5]*100 -> 0 | P17: =RC[-5]*100 -> 0 | Q17: =RC[-5]*100 -> 0 | S17: =ROUNDUP(RC[-10]/R1C7,0) -> 70 | T17: =ROUNDUP(RC[-10]/R1C7,0) -> 0 | U17: =ROUNDUP(RC[-10]/R1C7,0) -> 0 | V17: =ROUNDUP(RC[-10]/R1C7,0) -> 0 | X17: =RC[-5]*RC3 -> 1260
B18: 银币 | C18: 35 | D18: =R4C7/RC3 -> 285.42857142857144 | I18: =ROUND(RC[-5],0) -> 285 | J18: =ROUND(RC[-5],0) -> 0 | K18: =ROUND(RC[-5],0) -> 0 | L18: =ROUND(RC[-5],0) -> 0 | N18: =RC[-5]*10000*1.3 -> 3705000 | O18: =RC[-5]*10000 -> 0 | P18: =RC[-5]*10000 -> 0 | Q18: =RC[-5]*10000 -> 0 | S18: =ROUNDUP(RC[-10]/R1C7,0) -> 36 | T18: =ROUNDUP(RC[-10]/R1C7,0) -> 0 | U18: =ROUNDUP(RC[-10]/R1C7,0) -> 0 | V18: =ROUNDUP(RC[-10]/R1C7,0) -> 0 | X18: =RC[-5]*RC3 -> 1260
B20: 元宝灵气
B21: 金币灵气
B22: 银币灵气