Sheet: ctPetInfoConf
D1: 1:物攻 2:法攻 3:血耐 | G1: -999:永生 | H1: 1:野生 2:宝宝 3:变异 4:圣兽 5:神兽 | J1: 千分比 | S1: 1为体质 2为魔力, 3为力量. 4为耐力. 5为敏捷 | T1: 道具ID,道具数量 | V1: 4-道具ID,5000-数量
A2: nPetId | B2: sName | C2: sDesc2 | D2: nDesc | E2: sModelNumber | F2: nPetLv | G2: nLife | H2: nPetType | I2: nPetcj | J2: nChengZhangLv | K2: nGongJiZiZhi | L2: nFangYuZiZhi | M2: nTiLiZiZhi | N2: nFaLiZiZhi | O2: nSuDuZiZhi | P2: tMskill | Q2: tTskill | R2: tUnique | S2: tPushingPoint | T2: tGetWay | U2: nSilverPrice | V2: tBuyCost | W2: nAddPoint | X2: nGrade | Y2: nSort
A3: i | B3: s | C3: s | D3: i | E3: s | F3: i | G3: i | H3: i | I3: i | J3: i | K3: i | L3: i | M3: i | N3: i | O3: i | P3: t{i} | Q3: t{ii} | R3: t{i} | S3: t{i} | T3: t{ii} | U3: i | V3: t{ii} | W3: i | X3: s | Y3: i
A4: 宠物编号 | B4: 宠物名称 | C4: 文字描述 | D4: 描述 | E4: 模型编号 | F4: 携带等级 | G4: 宠物寿命 | H4: 宠物类型 | I4: 评级 | J4: 成长率 | K4: 攻击资质 | L4: 防御资质 | M4: 体力资质 | N4: 法力资质 | O4: 速度资质 | P4: 必有技能 | Q4: 可有技能，如{5402,10},5402为技能Id，10为获得百分百比 | R4: 特有技能 | S4: 推荐加点 | T4: 获取途径 | U4: 银币价格 | V4: 购买(兑换)消耗 | W4: 加点方案设置 | X4: 评分 | Y4: 排序字段
A5: 3003 | B5: 大黄 | C5: 文字描述 | D5: 1 | E5: pet_2 | F5: 0 | G5: 7500 | H5: 2 | I5: 1 | J5: 1050 | K5: 1155 | L5: 1155 | M5: 1207 | N5: 997 | O5: 1050 | P5: 0; | Q5: 5105,40;5102,40;5126,40;5116,40; | R5: 0; | S5: 0;0;5;0;0; | T5: 0,0; | U5: 5000 | V5: 4,5000;19016,1; | W5: 5 | X5: 0 | Y5: 1
A6: 3011 | B6: 天兵 | C6: 文字描述 | D6: 1 | E6: pet_3 | F6: 5 | G6: 7000 | H6: 2 | I6: 1 | J6: 1080 | K6: 1102 | L6: 1050 | M6: 1155 | N6: 1050 | O6: 1155 | P6: 0; | Q6: 5123,40;5102,40;5103,40;5204,40; | R6: 0; | S6: 0;0;5;0;0; | T6: 0,0; | U6: 8000 | V6: 4,8000;19016,1; | W6: 5 | X6: 0 | Y6: 2
A7: 3021 | B7: 冰雪蚌仙子 | C7: 文字描述 | D7: 2 | E7: pet_12 | F7: 15 | G7: 8000 | H7: 2 | I7: 1 | J7: 1100 | K7: 945 | L7: 1155 | M7: 1155 | N7: 1155 | O7: 1155 | P7: 0; | Q7: 5304,40;5105,40;5116,40;5224,40; | R7: 0; | S7: 0;5;0;0;0; | T7: 0,0; | U7: 11000 | V7: 4,11000;19016,2; | W7: 5 | X7: 0 | Y7: 3
A8: 3032 | B8: 龙女 | C8: 文字描述 | D8: 1 | E8: pet_22 | F8: 25 | G8: 8500 | H8: 2 | I8: 2 | J8: 1150 | K8: 1155 | L8: 997 | M8: 1207 | N8: 1155 | O8: 1155 | P8: 0; | Q8: 5226,40;5101,40;5222,40;5116,40; | R8: 0; | S8: 0;0;5;0;0; | T8: 0,0; | U8: 14000 | V8: 4,14000;19016,3; | W8: 5 | X8: 0 | Y8: 4
A9: 3041 | B9: 赤背斗魁 | C9: 文字描述 | D9: 2 | E9: pet_23 | F9: 35 | G9: 8000 | H9: 2 | I9: 2 | J9: 1170 | K9: 1200 | L9: 1250 | M9: 1180 | N9: 1190 | O9: 1170 | P9: 0; | Q9: 5234,40;5303,40;5117,40;5126,40; | R9: 0; | S9: 0;5;0;0;0; | T9: 0,0; | U9: 17000 | V9: 4,17000;19016,5; | W9: 5 | X9: 0 | Y9: 5
A10: 3051 | B10: 小灰 | C10: 神兽小灰，汲取日月精华的灵猴 | D10: 2 | E10: pet_32 | F10: 0 | G10: -999 | H10: 5 | I10: 4 | J10: 1280 | K10: 1400 | L10: 1400 | M10: 1450 | N10: 1450 | O10: 1400 | P10: 0; | Q10: 5220,100;5224,100;5305,100;5212,100; | R10: 0; | S10: 0;5;0;0;0; | T10: 13410,30; | U10: 0 | V10: 13410,30; | W10: 5 | X10: 0 | Y10: 6
A11: 3063 | B11: 幼态火龙 | C11: 文字描述 | D11: 3 | E11: pet_42 | F11: 55 | G11: 8500 | H11: 2 | I11: 3 | J11: 1210 | K11: 1239 | L11: 1312 | M11: 1312 | N11: 1000 | O11: 1155 | P11: 0; | Q11: 5222,40;5212,40;5207,40;5116,40; | R11: 0; | S11: 3;0;0;2;0; | T11: 0,0; | U11: 23000 | V11: 4,23000;19016,10; | W11: 5 | X11: 0 | Y11: 7
A12: 3071 | B12: 冰灵宝宝 | C12: 文字描述 | D12: 2 | E12: pet_43 | F12: 65 | G12: 7500 | H12: 2 | I12: 3 | J12: 1230 | K12: 1155 | L12: 1260 | M12: 1155 | N12: 1312 | O12: 1260 | P12: 0; | Q12: 5306,40;5233,40;5119,40;5215,40; | R12: 0; | S12: 0;5;0;0;0; | T12: 0,0; | U12: 26000 | V12: 4,26000;19016,15; | W12: 5 | X12: 0 | Y12: 8
A13: 3073 | B13: 金化白狐 | C13: 文字描述 | D13: 1 | E13: pet_51 | F13: 75 | G13: 9000 | H13: 2 | I13: 3 | J13: 1240 | K13: 1312 | L13: 1365 | M13: 1207 | N13: 1050 | O13: 1207 | P13: 0; | Q13: 5202,40;5223,40;5103,40;5116,40; | R13: 0; | S13: 0;0;5;0;0; | T13: 0,0; | U13: 29000 | V13: 4,29000;19016,20; | W13: 5 | X13: 0 | Y13: 9
A14: 3091 | B14: 钛晶牛头 | C14: 机关城采集神牛的残骸而打造机关兽，战斗时，会拥有神牛强大的力量，是机关城的守护神兽 | D14: 1 | E14: pet_61 | F14: 0 | G14: -999 | H14: 5 | I14: 4 | J14: 1240 | K14: 1312 | L14: 1365 | M14: 1207 | N14: 1050 | O14: 1207 | P14: 0; | Q14: 5222,100;5216,100;5102,100;5101,100; | R14: 0; | S14: 0;0;5;0;0; | T14: 13357,1; | U14: 0 | V14: 13357,1; | W14: 5 | X14: 0 | Y14: 10
A15: 3081 | B15: 芙蓉仙女 | C15: 文字描述 | D15: 2 | E15: pet_52 | F15: 0 | G15: -999 | H15: 5 | I15: 4 | J15: 1280 | K15: 1400 | L15: 1400 | M15: 1450 | N15: 1450 | O15: 1400 | P15: 0; | Q15: 5220,100;5224,100;5305,100;5212,100; | R15: 0; | S15: 0;5;0;0;0; | T15: 19011,99; | U15: 0 | V15: 19011,99; | W15: 5 | X15: 0 | Y15: 11
A16: 3101 | B16: 吸血鬼 | C16: 文字描述 | D16: 1 | E16: pet_63 | F16: 0 | G16: -999 | H16: 4 | I16: 5 | J16: 1300 | K16: 1650 | L16: 1600 | M16: 1650 | N16: 1600 | O16: 1600 | P16: 0; | Q16: 5207,100;5209,100;5202,100;5201,100;5235,100; | R16: 0; | S16: 0;0;5;0;0; | T16: 19012,99; | U16: 0 | V16: 19012,99; | W16: 5 | X16: 0 | Y16: 12
A17: 3061 | B17: 裟娜 | C17: 文字描述 | D17: 1 | E17: pet_41 | F17: 0 | G17: -999 | H17: 4 | I17: 5 | J17: 1300 | K17: 1650 | L17: 1650 | M17: 1600 | N17: 1600 | O17: 1600 | P17: 0; | Q17: 5201,100;5209,100;5223,100;5216,100;5309,100; | R17: 0; | S17: 0;0;5;0;0; | T17: 19012,99; | U17: 0 | V17: 19012,99; | W17: 5 | X17: 0 | Y17: 13
A18: 3083 | B18: 御龙仙女 | C18: 文字描述 | D18: 1 | E18: pet_53 | F18: 0 | G18: -999 | H18: 4 | I18: 5 | J18: 1300 | K18: 1650 | L18: 1600 | M18: 1600 | N18: 1600 | O18: 1650 | P18: 0; | Q18: 5203,100;5204,100;5208,100;5231,100;5201,100; | R18: 0; | S18: 0;0;5;0;0; | T18: 19012,99; | U18: 0 | V18: 19012,99; | W18: 5 | X18: 0 | Y18: 14
A19: 3103 | B19: 南疆圣女 | C19: 文字描述 | D19: 2 | E19: pet_71 | F19: 0 | G19: -999 | H19: 4 | I19: 5 | J19: 1320 | K19: =Sheet2!R[2]C+50 -> 1700 | L19: =Sheet2!R[2]C+50 -> 1700 | M19: =Sheet2!R[2]C+50 -> 1750 | N19: =Sheet2!R[2]C+50 -> 1750 | O19: =Sheet2!R[2]C+50 -> 1650 | P19: 0; | Q19: 5305,100;5208,100;5230,100;5219,100;5218,100; | R19: 0; | S19: 0;5;0;0;0; | T19: 13421,30; | U19: 0 | V19: 13421,30; | W19: 5 | X19: 0 | Y19: 16
A20: 3201 | B20: 赤瞳剑魔 | C20: 文字描述 | D20: 3 | E20: pet_72 | F20: 0 | G20: -999 | H20: 4 | I20: 5 | J20: 1320 | K20: =Sheet2!R[2]C+50 -> 1700 | L20: =Sheet2!R[2]C+50 -> 1750 | M20: =Sheet2!R[2]C+50 -> 1750 | N20: =Sheet2!R[2]C+50 -> 1700 | O20: =Sheet2!R[2]C+50 -> 1650 | P20: 0; | Q20: 5204,100;5202,100;5223,100;5216,100;5215,100; | R20: 0; | S20: 3;0;0;2;0; | T20: 13422,30; | U20: 0 | V20: 13422,30; | W20: 5 | X20: 0 | Y20: 17

Sheet: Sheet2
B2: 备用 | K2: 攻击资质 | L2: 防御资质 | M2: 体力资质 | N2: 法力资质 | O2: 速度资质 | P2: 必有技能
A3: 3002 | B3: 哮天犬 | C3: 文字描述 | D3: 1 | E3: pet_1 | F3: 0 | G3: -999 | H3: 4 | I3: 5 | J3: 1300 | K3: =R[17]C+50 -> 1700 | L3: =R[17]C+50 -> 1700 | M3: =R[17]C+50 -> 1650 | N3: =R[17]C+50 -> 1650 | O3: =R[17]C+50 -> 1650 | P3: 0; | Q3: 5222,100;5216,100;5202,100;5201,100;5209,100; | R3: 0; | S3: 0;0;5;0;0; | T3: 13400,30; | U3: 0 | V3: 13400,30; | W3: 5 | X3: 0 | Y3: 15
A7: 3202 | B7: 花神君 | C7: 文字描述 | D7: 2 | E7: pet_73 | F7: 0 | G7: -999 | H7: 4 | I7: 5 | J7: 1300 | K7: =R[17]C+100 -> 1700 | L7: =R[17]C+100 -> 1750 | M7: =R[17]C+100 -> 1700 | N7: =R[17]C+100 -> 1750 | O7: =R[17]C+100 -> 1700 | P7: 0; | Q7: 5220,100;5219,100;5208,100;5306,100;5237,100; | R7: 0; | S7: 0;5;0;0;0; | T7: 13423,30; | U7: 0 | V7: 13423,30; | W7: 5 | X7: 0 | Y7: 18
A8: 3013 | B8: 帝之妖灵 | C8: 文字描述 | D8: 2 | E8: pet_11 | F8: 0 | G8: -999 | H8: 4 | I8: 5 | J8: 1300 | K8: =R[17]C+100 -> 1700 | L8: =R[17]C+100 -> 1750 | M8: =R[17]C+100 -> 1700 | N8: =R[17]C+100 -> 1750 | O8: =R[17]C+100 -> 1700 | P8: 0; | Q8: 5218,100;5219,100;5220,100;5305,100;5232,100; | R8: 0; | S8: 0;5;0;0;0; | T8: 13403,30; | U8: 0 | V8: 13403,30; | W8: 5 | X8: 0 | Y8: 19
A9: 3023 | B9: 斗战龙女 | C9: 文字描述 | D9: 3 | E9: pet_13 | F9: 0 | G9: -999 | H9: 4 | I9: 5 | J9: 1300 | K9: =R[17]C+100 -> 1700 | L9: =R[17]C+100 -> 1750 | M9: =R[17]C+100 -> 1750 | N9: =R[17]C+100 -> 1700 | O9: =R[17]C+100 -> 1700 | P9: 0; | Q9: 5228,100;5216,100;5222,100;5214,100;5207,100; | R9: 0; | S9: 3;0;0;2;0; | T9: 13405,30; | U9: 0 | V9: 13405,30; | W9: 5 | X9: 0 | Y9: 20
A11: 3031 | B11: 佑圣真君 | C11: 文字描述 | D11: 1 | E11: pet_21 | F11: 0 | G11: -999 | H11: 4 | I11: 5 | J11: 1320 | K11: =R[17]C+150 -> 1850 | L11: =R[17]C+150 -> 1850 | M11: =R[17]C+150 -> 1800 | N11: =R[17]C+150 -> 1800 | O11: =R[17]C+150 -> 1750 | P11: 0; | Q11: 5223,100;5225,100;5204,100;5202,100;5211,100; | R11: 0; | S11: 0;0;5;0;0; | T11: 13406,30; | U11: 0 | V11: 13406,30; | W11: 5 | X11: 0 | Y11: 21
A12: 3043 | B12: 冰灵兽女王 | C12: 文字描述 | D12: 2 | E12: pet_31 | F12: 0 | G12: -999 | H12: 4 | I12: 5 | J12: 1320 | K12: =R[17]C+150 -> 1800 | L12: =R[17]C+150 -> 1800 | M12: =R[17]C+150 -> 1850 | N12: =R[17]C+150 -> 1850 | O12: =R[17]C+150 -> 1750 | P12: 0; | Q12: 5234,100;5236,100;5307,100;5218,100;5207,100; | R12: 0; | S12: 0;5;0;0;0; | T12: 13409,30; | U12: 0 | V12: 13409,30; | W12: 5 | X12: 0 | Y12: 22
A13: 3053 | B13: 飞天火龙 | C13: 文字描述 | D13: 3 | E13: pet_33 | F13: 0 | G13: -999 | H13: 4 | I13: 5 | J13: 1300 | K13: =R[17]C+150 -> 1750 | L13: =R[17]C+150 -> 1800 | M13: =R[17]C+150 -> 1800 | N13: =R[17]C+150 -> 1750 | O13: =R[17]C+150 -> 1750 | P13: 0; | Q13: 5216,100;5217,100;5222,100;5215,100;5205,100; | R13: 0; | S13: 3;0;0;2;0; | T13: 13411,30; | U13: 0 | V13: 13411,30; | W13: 5 | X13: 0 | Y13: 23
A15: 3093 | B15: 神犬骑兵 | C15: 文字描述 | D15: 1 | E15: pet_62 | F15: 0 | G15: -999 | H15: 4 | I15: 5 | J15: 1300 | K15: =R[17]C+200 -> 1800 | L15: =R[17]C+200 -> 1850 | M15: =R[17]C+200 -> 1800 | N15: =R[17]C+200 -> 1850 | O15: =R[17]C+200 -> 1800 | P15: 0; | Q15: 5226,100;5203,100;5202,100;5233,100;5232,100; | R15: 0; | S15: 0;0;5;0;0; | T15: 13419,30; | U15: 0 | V15: 13419,30; | W15: 5 | X15: 0 | Y15: 24
I20: 3002 | J20: 哮天犬 | K20: 1650 | L20: 1650 | M20: 1600 | N20: 1600 | O20: 1600
I21: 3103 | J21: 南疆圣女 | K21: 1650 | L21: 1650 | M21: 1700 | N21: 1700 | O21: 1600
I22: 3201 | J22: 赤瞳剑魔 | K22: 1650 | L22: 1700 | M22: 1700 | N22: 1650 | O22: 1600
I24: 3202 | J24: 花神君 | K24: 1600 | L24: 1650 | M24: 1600 | N24: 1650 | O24: 1600
I25: 3013 | J25: 帝之妖灵 | K25: 1600 | L25: 1650 | M25: 1600 | N25: 1650 | O25: 1600
I26: 3023 | J26: 斗战龙女 | K26: 1600 | L26: 1650 | M26: 1650 | N26: 1600 | O26: 1600
I28: 3031 | J28: 佑圣真君 | K28: 1700 | L28: 1700 | M28: 1650 | N28: 1650 | O28: 1600
I29: 3043 | J29: 冰灵兽女王 | K29: 1650 | L29: 1650 | M29: 1700 | N29: 1700 | O29: 1600
I30: 3053 | J30: 飞天火龙 | K30: 1600 | L30: 1650 | M30: 1650 | N30: 1600 | O30: 1600
I32: 3093 | J32: 神犬骑兵 | K32: 1600 | L32: 1650 | M32: 1600 | N32: 1650 | O32: 1600