Sheet: ctPetSkillConf
D1: 1：低级 2：高级 3：特殊 4：子女 5：天赋 | E1: 1:主动技能 0:被动技能 | G1: 1 进入战斗时 2 普通物理攻击时 3 受到物理攻击时 4 死亡时 5 法术攻击时 6 使用技能时 7 选择目标时 8 受到治疗时 9 敌人死亡时 10 即将死亡时 11 物理攻击时(普通+物理系技能) | L1: 参考 Battle/AttrConf.xml | T1: 1群物 2单物 3群发 4单发 | U1: 1己方随机 2敌方随机 3己方死亡 4敌方气血升序 5己方气血升序 6自己 7 己方宠物 8 敌方宠物 | V1: 主动技能目标数量
A2: nSKILId | B2: sName | C2: nIcon | D2: nSkType | E2: nActiveSkill | F2: tConflictSkill | G2: tTrigger | H2: nRate | I2: tTriggerSkillCond | J2: tIgnoreSkillCond | K2: nCOTSkill | L2: tAttr | M2: nBuffNumber | N2: nBuffRounds | O2: sFunDesc | P2: sDec | Q2: sEff | R2: nHitRate | S2: eConsume | T2: nAtkType | U2: nTarType | V2: tTargets | W2: nPropID | X2: bTriggerTips | Y2: iNa
A3: i | B3: s | C3: i | D3: i | E3: i | F3: t{i} | G3: t{i} | H3: i | I3: t{i} | J3: t{i} | K3: i | L3: t{iiie} | M3: i | N3: i | O3: s | P3: s | Q3: s | R3: i | S3: e | T3: i | U3: i | V3: t{ii} | W3: i | X3: b | Y3: i
A4: 技能Id | B4: 技能名称 | C4: 图标 | D4: 技能类型 | E4: 是否主动技能 | F4: 冲突无效技能 | G4: 触发时机 | H4: 触发概率 | I4: 对方技能条件(进入战斗不判断) | J4: 无效技能(进入战斗不判断) | K4: 反击用技能 | L4: 属性变化[事件ID,属性ID,值类型[1值,2百分比],数值] | M4: buff编号 | N4: buff回合 | O4: 功能描述 | P4: 技能描述 | Q4: 作用效果(程序用) | R4: 主动技能命中 | S4: 主动技能消耗 | T4: 主动技能攻击类型 | U4: 主动技能目标类型 | V4: 目标数量(技能等级>=,目标数量) | W4: 道具编号 | X4: 是否喊招 | Y4: 高级美术字对应关系
A5: 5101 | B5: 重击 | C5: 5101 | D5: 1 | E5: 0 | F5: 0; | G5: 1; | H5: 100 | I5: 0; | J5: 0; | K5: 0 | L5: 1,303,1,10; | M5: 0 | N5: 0 | O5: 0 | P5: 物攻攻击时增加暴击概率10%。 | Q5: 物攻攻击时增加暴击概率10%。 | R5: 0 | S5: 0 | T5: 0 | U5: 0 | V5: 0,0; | W5: 16001 | X5: 1 | Y5: 0
A6: 5102 | B6: 连击 | C6: 5102 | D6: 1 | E6: 0 | F6: 0; | G6: 2; | H6: 45 | I6: 0; | J6: 0; | K6: 0 | L6: 2,108,1,-25; | M6: 0 | N6: 0 | O6: 0 | P6: 普通物攻攻击时45%的几率对目标连续物攻攻击2次；造成物攻伤害结果会降低25%。 | Q6: 使用普通物攻攻击时，45%几率对目标连续攻击2次；造成物攻伤害结果减少25% | R6: 0 | S6: 0 | T6: 0 | U6: 0 | V6: 0,0; | W6: 16002 | X6: 1 | Y6: 0
A7: 5103 | B7: 蛮力 | C7: 5103 | D7: 1 | E7: 0 | F7: 0; | G7: 1;11; | H7: 100 | I7: 5122;5222; | J7: 0; | K7: 0 | L7: 1,104,1,lv*0.6;11,108,1,-20; | M7: 0 | N7: 0 | O7: 0 | P7: 增加自身等级*0.6的攻击力；如果对方有坚韧或高级坚韧技能，物攻伤害结果会减少20%。 | Q7: 增加自身等级*0.6的攻击力；如果对方有坚韧或高级坚韧技能，物攻伤害结果会减少20%。 | R7: 0 | S7: 0 | T7: 0 | U7: 0 | V7: 0,0; | W7: 16003 | X7: 1 | Y7: 0
A8: 5104 | B8: 追击 | C8: 5104 | D8: 1 | E8: 0 | F8: 0; | G8: 2; | H8: 100 | I8: 0; | J8: 0; | K8: 0 | L8: 2,108,1,-50; | M8: 0 | N8: 0 | O8: 0 | P8: 普通物攻攻击时，物攻攻击目标倒地后进行追击，造成的伤害结果为正常的50%。 | Q8: 普通物攻攻击时，物攻攻击目标倒地后进行追击，造成的伤害为正常的50% | R8: 0 | S8: 0 | T8: 0 | U8: 0 | V8: 0,0; | W8: 16004 | X8: 1 | Y8: 0
A9: 5105 | B9: 复仇 | C9: 5105 | D9: 1 | E9: 0 | F9: 0; | G9: 3; | H9: 30 | I9: 0; | J9: 0; | K9: 0 | L9: 3,108,1,-50; | M9: 0 | N9: 0 | O9: 0 | P9: 受到物攻攻击30%几率进行反击，伤害为正常伤害的50%。 | Q9: 受到物攻攻击30%几率进行反击，伤害为正常伤害的50% | R9: 0 | S9: 0 | T9: 0 | U9: 0 | V9: 0,0; | W9: 16005 | X9: 1 | Y9: 0
A10: 5106 | B10: 魔法反击 | C10: 5106 | D10: 1 | E10: 0 | F10: 0; | G10: 3; | H10: 30 | I10: 0; | J10: 0; | K10: 5304 | L10: 3,108,1,-50; | M10: 0 | N10: 0 | O10: 0 | P10: 受到物攻攻击30%几率进行魔法反击，伤害为正常伤害的50%。 | Q10: 受到物攻攻击30%几率进行魔法反击，伤害为正常伤害的50% | R10: 0 | S10: 0 | T10: 0 | U10: 0 | V10: 0,0; | W10: 16006 | X10: 1 | Y10: 0
A11: 5107 | B11: 鬼魅 | C11: 5107 | D11: 1 | E11: 0 | F11: 5115;5215;5132;5232; | G11: 1; | H11: 100 | I11: 0; | J11: 0; | K11: 0 | L11: 0,0,0,0; | M11: 901 | N11: 99 | O11: 0 | P11: 死亡5回合复活。不受任何状态影响，但也不能使用主动技能恢复气血。 | Q11: 鬼魂生物，死亡后5回合复活。不能接受任何药物和法攻恢复。不受吸血、异常、辅助等效果影响 | R11: 0 | S11: 0 | T11: 0 | U11: 0 | V11: 0,0; | W11: 16007 | X11: 1 | Y11: 0
A12: 5108 | B12: 驱鬼 | C12: 5108 | D12: 1 | E12: 0 | F12: 0; | G12: 11;5; | H12: 100 | I12: 5107;5207; | J12: 0; | K12: 0 | L12: 0,108,1,50;0,208,1,50; | M12: 0 | N12: 0 | O12: 0 | P12: 对拥有鬼魅类技能的单位物攻、法攻伤害效果增加50%，如果将鬼魅类怪物打死，对方将飞出场外而不能复活。 | Q12: 对鬼魂生物的所有伤害增加50%；如果将鬼魂生物打死，则同时将其打出场外 | R12: 0 | S12: 0 | T12: 0 | U12: 0 | V12: 0,0; | W12: 16008 | X12: 1 | Y12: 0
A13: 5109 | B13: 吸血 | C13: 5109 | D13: 1 | E13: 0 | F13: 0; | G13: 11; | H13: 100 | I13: 0; | J13: 5107;5207; | K13: 0 | L13: 11,101,2,20; | M13: 0 | N13: 0 | O13: 0 | P13: 物攻攻击可吸取对方所掉气血的20%，对拥有鬼魅技能的单位无效。 | Q13: 物攻攻击可吸取对方所掉气血的20%，对鬼魂生物无效。如果对方有异常状态，则吸血后自己为中植物毒状态 | R13: 0 | S13: 0 | T13: 0 | U13: 0 | V13: 0,0; | W13: 16009 | X13: 1 | Y13: 0
A14: 5110 | B14: 飞行 | C14: 5110 | D14: 1 | E14: 0 | F14: 0; | G14: 1; | H14: 100 | I14: 0; | J14: 0; | K14: 0 | L14: 1,302,1,5;1,301,1,10;1,107,2,5; | M14: 0 | N14: 0 | O14: 0 | P14: 物攻躲避增加5%，物攻命中增加10%，战斗中速度增加5%。 | Q14: 飞行生物，物攻躲避增加5%，物攻攻击命中增加10%，战斗中速度增加5%。 | R14: 0 | S14: 0 | T14: 0 | U14: 0 | V14: 0,0; | W14: 16010 | X14: 1 | Y14: 0
A15: 5111 | B15: 隐身 | C15: 5111 | D15: 1 | E15: 0 | F15: 0; | G15: 1; | H15: 100 | I15: 0; | J15: 0; | K15: 0 | L15: 0,0,0,0; | M15: 303 | N15: 3 | O15: 0 | P15: 进入战斗自动附加隐身状态3回合；隐身状态下物攻攻击能力会降低20%，且无法使用技能。 | Q15: 进入战斗自动附加隐身状态2~3回合（消耗MP=自身等级*3）；造成伤害结果减少20%；隐身状态下无法使用技能； | R15: 0 | S15: 0 | T15: 0 | U15: 0 | V15: 0,0; | W15: 16011 | X15: 1 | Y15: 0
A16: 5112 | B16: 金睛 | C16: 5112 | D16: 1 | E16: 0 | F16: 0; | G16: 11;5; | H16: 100 | I16: 5111;5211; | J16: 0; | K16: 0 | L16: 0,108,1,10;0,208,1,10; | M16: 0 | N16: 0 | O16: 0 | P16: 可攻击隐身目标并对拥有隐身、高级隐身的单位伤害结果增加10%。 | Q16: 可攻击隐身目标并对拥有隐身、高级隐身的单位伤害结果增加10%。 | R16: 0 | S16: 0 | T16: 0 | U16: 0 | V16: 0,0; | W16: 16012 | X16: 1 | Y16: 0
A17: 5113 | B17: 冥思 | C17: 5113 | D17: 1 | E17: 0 | F17: 0; | G17: 1; | H17: 100 | I17: 0; | J17: 0; | K17: 0 | L17: 0,0,0,0; | M17: 902 | N17: 99 | O17: 0 | P17: 战斗中，每回合结束时恢复等级*0.5点法力。 | Q17: 战斗中每回合恢复（自身等级×0.5）的魔法 | R17: 0 | S17: 0 | T17: 0 | U17: 0 | V17: 0,0; | W17: 16013 | X17: 1 | Y17: 0
A18: 5114 | B18: 律令 | C18: 5114 | D18: 1 | E18: 0 | F18: 0; | G18: 6; | H18: 100 | I18: 0; | J18: 0; | K18: 0 | L18: 6,102,1,-30; | M18: 0 | N18: 0 | O18: 0 | P18: 使用技能时所消耗的法力减少30%。 | Q18: 使用法攻时，消耗减少30% | R18: 0 | S18: 0 | T18: 0 | U18: 0 | V18: 0,0; | W18: 16014 | X18: 1 | Y18: 0
A19: 5115 | B19: 重生 | C19: 5115 | D19: 1 | E19: 0 | F19: 5132;5232; | G19: 4; | H19: 20 | I19: 0; | J19: 0; | K19: 0 | L19: 4,101,2,50; | M19: 0 | N19: 0 | O19: 0 | P19: 死亡时，有20%概率自动复活并恢复50%的气血。与鬼魅类技能共存时，重生技能无效。 | Q19: 死亡时，有20%概率自动复活并恢复50%的气血。与鬼魅类技能共存时，重生技能无效。 | R19: 0 | S19: 0 | T19: 0 | U19: 0 | V19: 0,0; | W19: 16015 | X19: 1 | Y19: 0
A20: 5116 | B20: 幸运 | C20: 5116 | D20: 1 | E20: 0 | F20: 0; | G20: 1; | H20: 100 | I20: 0; | J20: 0; | K20: 0 | L20: 1,207,1,5; | M20: 911 | N20: 99 | O20: 0 | P20: 不会受到物攻重击，法术暴击，5%几率躲避法攻。 | Q20: 不会受到物攻重击，法术暴击，5%几率躲避法攻。 | R20: 0 | S20: 0 | T20: 0 | U20: 0 | V20: 0,0; | W20: 16016 | X20: 1 | Y20: 0
A21: 5117 | B21: 再生 | C21: 5117 | D21: 1 | E21: 0 | F21: 0; | G21: 1; | H21: 100 | I21: 0; | J21: 0; | K21: 0 | L21: 0,0,0,0; | M21: 903 | N21: 99 | O21: 0 | P21: 战斗中，每回合结束时恢复等级*1的气血。 | Q21: 战斗中每回合恢复（自身等级*1）的气血 | R21: 0 | S21: 0 | T21: 0 | U21: 0 | V21: 0,0; | W21: 16017 | X21: 1 | Y21: 0
A22: 5118 | B22: 法术连击 | C22: 5118 | D22: 1 | E22: 0 | F22: 0; | G22: 5; | H22: 25 | I22: 0; | J22: 0; | K22: 0 | L22: 5,208,1,-50; | M22: 0 | N22: 0 | O22: 0 | P22: 法攻攻击时，有25%概率追加一次50%伤害结果的相同攻击。 | Q22: 法攻攻击时，25%几率追加一次50%伤害结果的相同攻击 | R22: 0 | S22: 0 | T22: 0 | U22: 0 | V22: 0,0; | W22: 16018 | X22: 1 | Y22: 0
A23: 5119 | B23: 怒火 | C23: 5119 | D23: 1 | E23: 0 | F23: 0; | G23: 5; | H23: 100 | I23: 0; | J23: 0; | K23: 0 | L23: 5,210,1,10; | M23: 0 | N23: 0 | O23: 0 | P23: 法攻攻击时，10%几率触发法术暴击。 | Q23: 法攻攻击时，10%几率触发法术暴击。 | R23: 0 | S23: 0 | T23: 0 | U23: 0 | V23: 0,0; | W23: 16019 | X23: 1 | Y23: 0
A24: 5120 | B24: 剧烈 | C24: 5120 | D24: 1 | E24: 0 | F24: 0; | G24: 5; | H24: 100 | I24: 0; | J24: 0; | K24: 0 | L24: 5,208,1,math.random(-10,20); | M24: 0 | N24: 0 | O24: 0 | P24: 法攻攻击伤害结果在原基础上会有90%至120%的波动。 | Q24: 法攻攻击伤害结果在原基础上会有90%-120%的浮动 | R24: 0 | S24: 0 | T24: 0 | U24: 0 | V24: 0,0; | W24: 16020 | X24: 1 | Y24: 0
A25: 5121 | B25: 法伤 | C25: 5121 | D25: 1 | E25: 0 | F25: 0; | G25: 5; | H25: 100 | I25: 0; | J25: 0; | K25: 0 | L25: 5,208,1,10; | M25: 0 | N25: 0 | O25: 0 | P25: 对敌人的法攻伤害结果提高10%。 | Q25: 法攻攻击伤害结果增加10% | R25: 0 | S25: 0 | T25: 0 | U25: 0 | V25: 0,0; | W25: 16021 | X25: 1 | Y25: 0
A26: 5122 | B26: 坚韧 | C26: 5122 | D26: 1 | E26: 0 | F26: 0; | G26: 1; | H26: 100 | I26: 0; | J26: 0; | K26: 0 | L26: 1,105,1,lv*0.8;1,208,1,-10; | M26: 0 | N26: 0 | O26: 0 | P26: 提升自身等级*0.8的物攻防御，但法攻伤害结果会降低10%。 | Q26: 提升自身等级*0.8的物攻防御，但法攻伤害结果会降低10%。 | R26: 0 | S26: 0 | T26: 0 | U26: 0 | V26: 0,0; | W26: 16022 | X26: 1 | Y26: 0
A27: 5123 | B27: 偷袭 | C27: 5123 | D27: 1 | E27: 0 | F27: 0; | G27: 11; | H27: 100 | I27: 0; | J27: 0; | K27: 0 | L27: 11,105,2,-5 | M27: 0 | N27: 0 | O27: 0 | P27: 物攻攻击时忽视对方5%的物攻防御。 | Q27: 物攻攻击时忽视对方5%的物攻防御。 | R27: 0 | S27: 0 | T27: 0 | U27: 0 | V27: 0,0; | W27: 16023 | X27: 1 | Y27: 0
A28: 5124 | B28: 毒药 | C28: 5124 | D28: 1 | E28: 0 | F28: 0; | G28: 11;5; | H28: 10 | I28: 0; | J28: 0; | K28: 0 | L28: 0,0,0,0; | M28: 904 | N28: 3 | O28: 0 | P28: 物攻或法攻攻击时，10%几率使目标3回合内中毒。 | Q28: 物攻或法攻攻击时，10%几率使目标5回合内中毒（每回合损失气血=中毒时所受伤害结果的1/3） | R28: 0 | S28: 0 | T28: 0 | U28: 0 | V28: 0,0; | W28: 16024 | X28: 1 | Y28: 0
A29: 5125 | B29: 凝神 | C29: 5125 | D29: 1 | E29: 0 | F29: 0; | G29: 1; | H29: 100 | I29: 0; | J29: 0; | K29: 0 | L29: 1,108,1,-20;1,109,1,-5;1,208,1,-20;1,209,1,-5; | M29: 905 | N29: 99 | O29: 0 | P29: 可以抵挡封印类异常状态，伤害能力降低20%，同时受到的伤害减少5%。 | Q29: 可以抵挡封印类异常状态，伤害能力降低20%，同时受到的伤害减少5%。 | R29: 0 | S29: 0 | T29: 0 | U29: 0 | V29: 0,0; | W29: 16025 | X29: 1 | Y29: 0
A30: 5126 | B30: 迅捷 | C30: 5126 | D30: 1 | E30: 0 | F30: 0; | G30: 1; | H30: 100 | I30: 0; | J30: 0; | K30: 0 | L30: 1,107,2,10; | M30: 0 | N30: 0 | O30: 0 | P30: 进入战斗后，自身速度增加10%。 | Q30: 进入战斗后，自身速度增加10%。 | R30: 0 | S30: 0 | T30: 0 | U30: 0 | V30: 0,0; | W30: 16026 | X30: 1 | Y30: 0
A31: 5127 | B31: 强迫 | C31: 5127 | D31: 1 | E31: 0 | F31: 0; | G31: 11;5; | H31: 5 | I31: 0; | J31: 0; | K31: 0 | L31: 0,0,0,0; | M31: 906 | N31: 2 | O31: 0 | P31: 攻击时，5%几率使目标在行动时只能被迫执行防御，持续2回合。 | Q31: 攻击时，5%几率使目标在行动时只能被迫执行防御，持续2回合。 | R31: 0 | S31: 0 | T31: 0 | U31: 0 | V31: 0,0; | W31: 16027 | X31: 1 | Y31: 0
A32: 5128 | B32: 忠心 | C32: 5128 | D32: 1 | E32: 0 | F32: 0; | G32: 1; | H32: 100 | I32: 0; | J32: 0; | K32: 0 | L32: 1,104,1,lv*0.3; | M32: 912 | N32: 99 | O32: 0 | P32: 不会逃跑，不受强迫效果影响，增加自身等级*0.3的物攻攻击力。 | Q32: 不会逃跑，不受强迫效果影响，增加自身等级*0.3的物攻攻击力。 | R32: 0 | S32: 0 | T32: 0 | U32: 0 | V32: 0,0; | W32: 16028 | X32: 1 | Y32: 0
A33: 5129 | B33: 精准 | C33: 5129 | D33: 1 | E33: 0 | F33: 0; | G33: 1;11;5; | H33: 100 | I33: 5110;5210;5126;5226; | J33: 0; | K33: 0 | L33: 1,301,1,10;11,108,1,20;5,108,1,20; | M33: 0 | N33: 0 | O33: 0 | P33: 物攻命中率增加10%，对拥有飞行类、迅捷类技能的目标伤害结果增加20%。 | Q33: 物攻命中率增加10%，对拥有飞行类、迅捷类技能的目标伤害结果增加20%。 | R33: 0 | S33: 0 | T33: 0 | U33: 0 | V33: 0,0; | W33: 16029 | X33: 1 | Y33: 0
A34: 5130 | B34: 持久 | C34: 5130 | D34: 1 | E34: 0 | F34: 0; | G34: 1; | H34: 100 | I34: 0; | J34: 0; | K34: 0 | L34: 0,0,0,0; | M34: 913 | N34: 99 | O34: 0 | P34: 受到的增益状态持续回合数加倍。 | Q34: 受到的辅助类法攻持续效果增加3回合 | R34: 0 | S34: 0 | T34: 0 | U34: 0 | V34: 0,0; | W34: 16030 | X34: 1 | Y34: 0
A35: 5131 | B35: 强壮 | C35: 5131 | D35: 1 | E35: 0 | F35: 0; | G35: 1; | H35: 100 | I35: 0; | J35: 0; | K35: 0 | L35: 1,502,1,lv*2+25; | M35: 0 | N35: 0 | O35: 0 | P35: 气血上限提高：自身等级*2+25。 | Q35: 气血上限提高=自身等级×2+25 | R35: 0 | S35: 0 | T35: 0 | U35: 0 | V35: 0,0; | W35: 16031 | X35: 1 | Y35: 0
A36: 5132 | B36: 保命 | C36: 5132 | D36: 1 | E36: 0 | F36: 0; | G36: 10; | H36: 20 | I36: 0; | J36: 0; | K36: 0 | L36: 10,101,1,1; | M36: 0 | N36: 0 | O36: 0 | P36: 如果被攻击后会死亡，则有20%几率保命，保留1点气血。与重生和鬼魅共存时保命无效。 | Q36: 如果被攻击后会死亡，则有20%几率保命，保留1点气血。与神佑复生或高级神佑复生技能同时存在时保命技能无效 | R36: 0 | S36: 0 | T36: 0 | U36: 0 | V36: 0,0; | W36: 16032 | X36: 1 | Y36: 0
A37: 5133 | B37: 报复 | C37: 5133 | D37: 1 | E37: 0 | F37: 0; | G37: 11;5; | H37: 100 | I37: 0; | J37: 0; | K37: 0 | L37: 0,108,1,math.max(5,(1-hp/maxhp)*100/5); | M37: 0 | N37: 0 | O37: 0 | P37: 攻击时根据自身当前气血与气血上限的比例增加一定伤害结果。气血比例越低，增加的伤害结果越多，最低增加5%，最高增加20%。 | Q37: 攻击时根据自身当前气血与气血上限的比例增加一定伤害，增加(1-当前气血/上限气血)/5结果。气血比例越低，增加的伤害越多，最高增加20% | R37: 0 | S37: 0 | T37: 0 | U37: 0 | V37: 0,0; | W37: 16033 | X37: 1 | Y37: 0
A38: 5134 | B38: 冰霜 | C38: 5134 | D38: 1 | E38: 0 | F38: 0; | G38: 11;5; | H38: 30 | I38: 0; | J38: 0; | K38: 0 | L38: 0,0,0,0; | M38: 907 | N38: 4 | O38: 0 | P38: 攻击目标时，有一定几率使目标4回合内速度降低10%。 | Q38: 攻击目标时，有一定几率使目标4回合内速度降低10%。自身魔力点加得越多，成功几率越大。20%*自身魔力/(自身等级*4+20)，最高20%。 | R38: 0 | S38: 0 | T38: 0 | U38: 0 | V38: 0,0; | W38: 16034 | X38: 1 | Y38: 0
A39: 5135 | B39: 气势 | C39: 5135 | D39: 1 | E39: 0 | F39: 0; | G39: 1; | H39: 100 | I39: 0; | J39: 0; | K39: 0 | L39: 0,0,0,0; | M39: 908 | N39: 2 | O39: 0 | P39: 出战前2回合物攻伤害结果增加10%。 | Q39: 出战前2回合物攻伤害结果增加10% | R39: 0 | S39: 0 | T39: 0 | U39: 0 | V39: 0,0; | W39: 16035 | X39: 1 | Y39: 0
A40: 5136 | B40: 震慑 | C40: 5136 | D40: 1 | E40: 0 | F40: 0; | G40: 1; | H40: 100 | I40: 0; | J40: 0; | K40: 0 | L40: 0,0,0,0; | M40: 909 | N40: 2 | O40: 0 | P40: 出战前2回合法攻伤害结果增加10%。 | Q40: 出战前2回合法攻伤害结果增加10% | R40: 0 | S40: 0 | T40: 0 | U40: 0 | V40: 0,0; | W40: 16036 | X40: 1 | Y40: 0
A41: 5137 | B41: 审判 | C41: 5137 | D41: 1 | E41: 0 | F41: 0; | G41: 4;11;5; | H41: 100 | I41: 5115;5215; | J41: 0; | K41: 0 | L41: 11,108,1,20;5,108,1,20; | M41: 910 | N41: 1 | O41: 0 | P41: 将敌人击倒时，其重生类技能或效果无效。对拥有重生、高级重生的目标伤害结果增加20%。 | Q41: 将敌人击倒时，其重生类技能或效果无效。对拥有重生、高级重生的目标伤害结果增加20%。 | R41: 0 | S41: 0 | T41: 0 | U41: 0 | V41: 0,0; | W41: 16037 | X41: 1 | Y41: 0
A42: 5138 | B42: 光明 | C42: 5138 | D42: 1 | E42: 0 | F42: 0; | G42: 8; | H42: 100 | I42: 0; | J42: 0; | K42: 0 | L42: 8,501,2,20; | M42: 0 | N42: 0 | O42: 0 | P42: 当宠物受到治疗时，提高治疗效果20%。 | Q42: 接受气血治疗时，恢复效果提高20% | R42: 0 | S42: 0 | T42: 0 | U42: 0 | V42: 0,0; | W42: 16038 | X42: 1 | Y42: 0
A43: 5201 | B43: 高级重击 | C43: 5101 | D43: 2 | E43: 0 | F43: 0; | G43: 1; | H43: 100 | I43: 0; | J43: 0; | K43: 0 | L43: 1,303,1,15; | M43: 0 | N43: 0 | O43: 0 | P43: 物攻攻击时增加暴击概率15%。 | Q43: 物攻攻击时增加暴击概率15%。 | R43: 0 | S43: 0 | T43: 0 | U43: 0 | V43: 0,0; | W43: 17001 | X43: 1 | Y43: =R[-38]C[-24] -> 5101
A44: 5202 | B44: 高级连击 | C44: 5102 | D44: 2 | E44: 0 | F44: 0; | G44: 2; | H44: 50 | I44: 0; | J44: 0; | K44: 0 | L44: 2,108,1,-20; | M44: 0 | N44: 0 | O44: 0 | P44: 普通物攻攻击时50%的几率对目标连续物攻攻击2次；造成物攻伤害结果会降低20%。 | Q44: 使用普通物攻攻击时，50%几率对目标连续攻击2次；造成物攻伤害结果减少20% | R44: 0 | S44: 0 | T44: 0 | U44: 0 | V44: 0,0; | W44: 17002 | X44: 1 | Y44: =R[-38]C[-24] -> 5102
A45: 5203 | B45: 高级蛮力 | C45: 5103 | D45: 2 | E45: 0 | F45: 0; | G45: 1;11; | H45: 100 | I45: 5122;5222; | J45: 0; | K45: 0 | L45: 1,104,1,lv*0.8;11,108,1,-10; | M45: 0 | N45: 0 | O45: 0 | P45: 增加自身等级*0.8的攻击力；如果对方有坚韧或高级坚韧技能，物攻伤害结果会减少10%。 | Q45: 增加自身等级*0.8的攻击力；如果对方有坚韧或高级坚韧技能，物攻伤害结果会减少10%。 | R45: 0 | S45: 0 | T45: 0 | U45: 0 | V45: 0,0; | W45: 17003 | X45: 1 | Y45: =R[-38]C[-24] -> 5103
A46: 5204 | B46: 高级追击 | C46: 5104 | D46: 2 | E46: 0 | F46: 0; | G46: 2; | H46: 100 | I46: 0; | J46: 0; | K46: 0 | L46: 2,108,1,-25; | M46: 0 | N46: 0 | O46: 0 | P46: 普通物攻攻击时，物攻攻击目标倒地后进行追击，造成的伤害结果为正常的75%。 | Q46: 普通物攻攻击时，物攻攻击目标倒地后进行追击，造成的伤害为正常的75% | R46: 0 | S46: 0 | T46: 0 | U46: 0 | V46: 0,0; | W46: 17004 | X46: 1 | Y46: =R[-38]C[-24] -> 5104
A47: 5205 | B47: 高级复仇 | C47: 5105 | D47: 2 | E47: 0 | F47: 0; | G47: 3; | H47: 30 | I47: 0; | J47: 0; | K47: 0 | L47: 3,108,1,-30; | M47: 0 | N47: 0 | O47: 0 | P47: 受到物攻攻击30%几率进行反击，伤害为正常伤害的70%。 | Q47: 受到物攻攻击30%几率进行反击，伤害为正常伤害的70% | R47: 0 | S47: 0 | T47: 0 | U47: 0 | V47: 0,0; | W47: 17005 | X47: 1 | Y47: =R[-38]C[-24] -> 5105
A48: 5206 | B48: 高级魔法反击 | C48: 5106 | D48: 2 | E48: 0 | F48: 0; | G48: 3; | H48: 30 | I48: 0; | J48: 0; | K48: 5304 | L48: 3,108,1,-30; | M48: 0 | N48: 0 | O48: 0 | P48: 受到物攻攻击30%几率进行魔法反击，伤害为正常伤害的70%。 | Q48: 受到物攻攻击30%几率进行魔法反击，伤害为正常伤害的70% | R48: 0 | S48: 0 | T48: 0 | U48: 0 | V48: 0,0; | W48: 17006 | X48: 1 | Y48: =R[-38]C[-24] -> 5106
A49: 5207 | B49: 高级鬼魅 | C49: 5107 | D49: 2 | E49: 0 | F49: 5115;5215;5132;5232; | G49: 1; | H49: 100 | I49: 0; | J49: 0; | K49: 0 | L49: 0,0,0,0; | M49: 1901 | N49: 99 | O49: 0 | P49: 死亡4回合复活。不受任何状态影响，但也不能使用主动技能恢复气血。 | Q49: 鬼魂生物，死亡后4回合复活。不能接受任何药物和法攻恢复。不受吸血、异常、辅助等效果影响 | R49: 0 | S49: 0 | T49: 0 | U49: 0 | V49: 0,0; | W49: 17007 | X49: 1 | Y49: =R[-38]C[-24] -> 5107
A50: 5208 | B50: 高级驱鬼 | C50: 5108 | D50: 2 | E50: 0 | F50: 0; | G50: 11;5; | H50: 100 | I50: 5107;5207; | J50: 0; | K50: 0 | L50: 0,108,1,75;0,208,1,75; | M50: 0 | N50: 0 | O50: 0 | P50: 对拥有鬼魅类技能的单位物攻、法攻伤害效果增加75%，如果将鬼魅类怪物打死，对方将飞出场外而不能复活。 | Q50: 对鬼魂生物的所有伤害增加75%；如果将鬼魂生物打死，则同时将其打出场外 | R50: 0 | S50: 0 | T50: 0 | U50: 0 | V50: 0,0; | W50: 17008 | X50: 1 | Y50: =R[-38]C[-24] -> 5108
A51: 5209 | B51: 高级吸血 | C51: 5109 | D51: 2 | E51: 0 | F51: 0; | G51: 11; | H51: 100 | I51: 0; | J51: 5107;5207; | K51: 0 | L51: 11,101,2,25; | M51: 0 | N51: 0 | O51: 0 | P51: 物攻攻击可吸取对方所掉气血的25%，对拥有鬼魅技能的单位无效。 | Q51: 物攻攻击可吸取对方所掉气血的25%，对鬼魂生物无效。如果对方有异常状态，则吸血后自己为中植物毒状态 | R51: 0 | S51: 0 | T51: 0 | U51: 0 | V51: 0,0; | W51: 17009 | X51: 1 | Y51: =R[-38]C[-24] -> 5109
A52: 5210 | B52: 高级飞行 | C52: 5110 | D52: 2 | E52: 0 | F52: 0; | G52: 1; | H52: 100 | I52: 0; | J52: 0; | K52: 0 | L52: 1,302,1,10;1,301,1,12.5;1,107,2,7.5; | M52: 0 | N52: 0 | O52: 0 | P52: 物攻躲避增加10%，物攻命中增加12.5%，战斗中速度增加7.5%。 | Q52: 飞行生物，物攻躲避增加10%，物攻攻击命中增加12.5%，战斗中速度增加7.5%。 | R52: 0 | S52: 0 | T52: 0 | U52: 0 | V52: 0,0; | W52: 17010 | X52: 1 | Y52: =R[-38]C[-24] -> 5110
A53: 5211 | B53: 高级隐身 | C53: 5111 | D53: 2 | E53: 0 | F53: 0; | G53: 1; | H53: 100 | I53: 0; | J53: 0; | K53: 0 | L53: 0,0,0,0; | M53: 303 | N53: 4 | O53: 0 | P53: 进入战斗自动附加隐身状态4回合；隐身状态下物攻攻击能力会降低20%，且无法使用技能。 | Q53: 进入战斗自动附加隐身状态4回合（消耗MP=自身等级*3）；造成伤害结果减少20%；隐身状态下无法使用技能； | R53: 0 | S53: 0 | T53: 0 | U53: 0 | V53: 0,0; | W53: 17011 | X53: 1 | Y53: =R[-38]C[-24] -> 5111
A54: 5212 | B54: 高级金睛 | C54: 5112 | D54: 2 | E54: 0 | F54: 0; | G54: 11;5; | H54: 100 | I54: 5111;5211; | J54: 0; | K54: 0 | L54: 0,301,1,3;0,108,1,12.5;0,208,1,12.5; | M54: 0 | N54: 0 | O54: 0 | P54: 命中率提高3%，可攻击隐身目标并对拥有隐身、高级隐身的单位伤害结果增加12.5%。 | Q54: 命中率提高3%，可攻击隐身目标并对拥有隐身、高级隐身的单位伤害结果增加12.5%。 | R54: 0 | S54: 0 | T54: 0 | U54: 0 | V54: 0,0; | W54: 17012 | X54: 1 | Y54: =R[-38]C[-24] -> 5112
A55: 5213 | B55: 高级冥思 | C55: 5113 | D55: 2 | E55: 0 | F55: 0; | G55: 1; | H55: 100 | I55: 0; | J55: 0; | K55: 0 | L55: 0,0,0,0; | M55: 1902 | N55: 99 | O55: 0 | P55: 战斗中，每回合结束时恢复等级*0.75点法力。 | Q55: 战斗中每回合恢复（自身等级×0.75）的魔法 | R55: 0 | S55: 0 | T55: 0 | U55: 0 | V55: 0,0; | W55: 17013 | X55: 1 | Y55: =R[-38]C[-24] -> 5113
A56: 5214 | B56: 高级律令 | C56: 5114 | D56: 2 | E56: 0 | F56: 0; | G56: 6; | H56: 100 | I56: 0; | J56: 0; | K56: 0 | L56: 6,102,1,-50; | M56: 0 | N56: 0 | O56: 0 | P56: 使用技能时所消耗的法力减少50%。 | Q56: 使用法攻时，消耗减少50% | R56: 0 | S56: 0 | T56: 0 | U56: 0 | V56: 0,0; | W56: 17014 | X56: 1 | Y56: =R[-38]C[-24] -> 5114
A57: 5215 | B57: 高级重生 | C57: 5115 | D57: 2 | E57: 0 | F57: 5132;5232; | G57: 4; | H57: 25 | I57: 0; | J57: 0; | K57: 0 | L57: 4,101,2,75; | M57: 0 | N57: 0 | O57: 0 | P57: 死亡时，有25%概率自动复活并恢复75%的气血。与鬼魅类技能共存时，重生技能无效。 | Q57: 死亡时，有25%概率自动复活并恢复75%的气血。与鬼魅类技能共存时，重生技能无效。 | R57: 0 | S57: 0 | T57: 0 | U57: 0 | V57: 0,0; | W57: 17015 | X57: 1 | Y57: =R[-38]C[-24] -> 5115
A58: 5216 | B58: 高级幸运 | C58: 5116 | D58: 2 | E58: 0 | F58: 0; | G58: 1; | H58: 100 | I58: 0; | J58: 0; | K58: 0 | L58: 1,207,1,7.5; | M58: 911 | N58: 99 | O58: 0 | P58: 不会受到物攻重击，法术暴击，7.5%几率躲避法攻。 | Q58: 不会受到物攻重击，法术暴击，7.5%几率躲避法攻。 | R58: 0 | S58: 0 | T58: 0 | U58: 0 | V58: 0,0; | W58: 17016 | X58: 1 | Y58: =R[-38]C[-24] -> 5116
A59: 5217 | B59: 高级再生 | C59: 5117 | D59: 2 | E59: 0 | F59: 0; | G59: 1; | H59: 100 | I59: 0; | J59: 0; | K59: 0 | L59: 0,0,0,0; | M59: 1903 | N59: 99 | O59: 0 | P59: 战斗中，每回合结束时恢复等级*1.2的气血。 | Q59: 战斗中每回合恢复（自身等级*1.2）的气血 | R59: 0 | S59: 0 | T59: 0 | U59: 0 | V59: 0,0; | W59: 17017 | X59: 1 | Y59: =R[-38]C[-24] -> 5117
A60: 5218 | B60: 高级法术连击 | C60: 5118 | D60: 2 | E60: 0 | F60: 0; | G60: 5; | H60: 30 | I60: 0; | J60: 0; | K60: 0 | L60: 5,208,1,-45; | M60: 0 | N60: 0 | O60: 0 | P60: 法攻攻击时，有30%概率追加一次55%伤害结果的相同攻击。 | Q60: 法攻攻击时，30%几率追加一次55%伤害结果的相同攻击 | R60: 0 | S60: 0 | T60: 0 | U60: 0 | V60: 0,0; | W60: 17018 | X60: 1 | Y60: =R[-38]C[-24] -> 5118
A61: 5219 | B61: 高级怒火 | C61: 5119 | D61: 2 | E61: 0 | F61: 0; | G61: 5; | H61: 100 | I61: 0; | J61: 0; | K61: 0 | L61: 5,210,1,15; | M61: 0 | N61: 0 | O61: 0 | P61: 法攻攻击时，15%几率触发法术暴击。 | Q61: 法攻攻击时，15%几率触发法术暴击。 | R61: 0 | S61: 0 | T61: 0 | U61: 0 | V61: 0,0; | W61: 17019 | X61: 1 | Y61: =R[-38]C[-24] -> 5119
A62: 5220 | B62: 高级剧烈 | C62: 5120 | D62: 2 | E62: 0 | F62: 0; | G62: 5; | H62: 100 | I62: 0; | J62: 0; | K62: 0 | L62: 5,208,1,math.random(-20,30); | M62: 0 | N62: 0 | O62: 0 | P62: 法攻攻击伤害结果在原基础上会有80%至130%的波动。 | Q62: 法攻攻击伤害结果在原基础上会有80%-130%的浮动 | R62: 0 | S62: 0 | T62: 0 | U62: 0 | V62: 0,0; | W62: 17020 | X62: 1 | Y62: =R[-38]C[-24] -> 5120
A63: 5221 | B63: 高级法伤 | C63: 5121 | D63: 2 | E63: 0 | F63: 0; | G63: 5; | H63: 100 | I63: 0; | J63: 0; | K63: 0 | L63: 5,208,1,15; | M63: 0 | N63: 0 | O63: 0 | P63: 对敌人的法攻伤害结果提高15%。 | Q63: 法攻攻击伤害结果增加15% | R63: 0 | S63: 0 | T63: 0 | U63: 0 | V63: 0,0; | W63: 17021 | X63: 1 | Y63: =R[-38]C[-24] -> 5121
A64: 5222 | B64: 高级坚韧 | C64: 5122 | D64: 2 | E64: 0 | F64: 0; | G64: 1; | H64: 100 | I64: 0; | J64: 0; | K64: 0 | L64: 1,105,1,lv*1.1;1,208,1,-10; | M64: 0 | N64: 0 | O64: 0 | P64: 提升自身等级*1.1的物攻防御，但法攻伤害结果会降低10%。 | Q64: 提升自身等级*1.1的物攻防御，但法攻伤害结果会降低10%。 | R64: 0 | S64: 0 | T64: 0 | U64: 0 | V64: 0,0; | W64: 17022 | X64: 1 | Y64: =R[-38]C[-24] -> 5122
A65: 5223 | B65: 高级偷袭 | C65: 5123 | D65: 2 | E65: 0 | F65: 0; | G65: 11; | H65: 100 | I65: 0; | J65: 0; | K65: 0 | L65: 11,105,2,-7.5 | M65: 0 | N65: 0 | O65: 0 | P65: 物攻攻击时忽视对方7.5%的物攻防御。 | Q65: 物攻攻击时忽视对方7.5%的物攻防御。 | R65: 0 | S65: 0 | T65: 0 | U65: 0 | V65: 0,0; | W65: 17023 | X65: 1 | Y65: =R[-38]C[-24] -> 5123
A66: 5224 | B66: 高级毒药 | C66: 5124 | D66: 2 | E66: 0 | F66: 0; | G66: 11;5; | H66: 15 | I66: 0; | J66: 0; | K66: 0 | L66: 0,0,0,0; | M66: 904 | N66: 4 | O66: 0 | P66: 物攻或法攻攻击时，15%几率使目标4回合内中毒。 | Q66: 物攻或法攻攻击时，15%几率使目标4回合内中毒（每回合损失气血=中毒时所受伤害结果的1/3） | R66: 0 | S66: 0 | T66: 0 | U66: 0 | V66: 0,0; | W66: 17024 | X66: 1 | Y66: =R[-38]C[-24] -> 5124
A67: 5225 | B67: 高级凝神 | C67: 5125 | D67: 2 | E67: 0 | F67: 0; | G67: 1; | H67: 100 | I67: 0; | J67: 0; | K67: 0 | L67: 1,108,1,-10;1,109,1,-7.5;1,208,1,-10;1,209,1,-7.5; | M67: 905 | N67: 99 | O67: 0 | P67: 可以抵挡封印类异常状态，伤害能力降低10%，同时受到的伤害减少7.5%。 | Q67: 可以抵挡封印类异常状态，伤害能力降低10%，同时受到的伤害减少7.5%。 | R67: 0 | S67: 0 | T67: 0 | U67: 0 | V67: 0,0; | W67: 17025 | X67: 1 | Y67: =R[-38]C[-24] -> 5125
A68: 5226 | B68: 高级迅捷 | C68: 5126 | D68: 2 | E68: 0 | F68: 0; | G68: 1; | H68: 100 | I68: 0; | J68: 0; | K68: 0 | L68: 1,107,2,15; | M68: 0 | N68: 0 | O68: 0 | P68: 进入战斗后，自身速度增加15%。 | Q68: 进入战斗后，自身速度增加15%。 | R68: 0 | S68: 0 | T68: 0 | U68: 0 | V68: 0,0; | W68: 17026 | X68: 1 | Y68: =R[-38]C[-24] -> 5126
A69: 5227 | B69: 高级强迫 | C69: 5127 | D69: 2 | E69: 0 | F69: 0; | G69: 11;5; | H69: 7.5 | I69: 0; | J69: 0; | K69: 0 | L69: 0,0,0,0; | M69: 906 | N69: 2 | O69: 0 | P69: 攻击时，7.5%几率使目标在行动时只能被迫执行防御，持续2回合。 | Q69: 攻击时，7.5%几率使目标在行动时只能被迫执行防御，持续2回合。 | R69: 0 | S69: 0 | T69: 0 | U69: 0 | V69: 0,0; | W69: 17027 | X69: 1 | Y69: =R[-38]C[-24] -> 5127
A70: 5228 | B70: 高级忠心 | C70: 5128 | D70: 2 | E70: 0 | F70: 0; | G70: 1; | H70: 100 | I70: 0; | J70: 0; | K70: 0 | L70: 1,104,1,lv*0.4; | M70: 912 | N70: 99 | O70: 0 | P70: 不会逃跑，不受强迫效果影响，增加自身等级*0.4的物攻攻击力。 | Q70: 不会逃跑，不受强迫效果影响，增加自身等级*0.4的物攻攻击力。 | R70: 0 | S70: 0 | T70: 0 | U70: 0 | V70: 0,0; | W70: 17028 | X70: 1 | Y70: =R[-38]C[-24] -> 5128
A71: 5229 | B71: 高级精准 | C71: 5129 | D71: 2 | E71: 0 | F71: 0; | G71: 1;11;5; | H71: 100 | I71: 5110;5210;5126;5226; | J71: 0; | K71: 0 | L71: 1,301,1,12.5;11,108,1,30;5,108,1,30; | M71: 0 | N71: 0 | O71: 0 | P71: 物攻命中率增加12.5%，对拥有飞行类、迅捷类技能的目标伤害结果增加30%。 | Q71: 物攻命中率增加12.5%，对拥有飞行类、迅捷类技能的目标伤害结果增加30%。 | R71: 0 | S71: 0 | T71: 0 | U71: 0 | V71: 0,0; | W71: 17029 | X71: 1 | Y71: =R[-38]C[-24] -> 5129
A72: 5230 | B72: 高级持久 | C72: 5130 | D72: 2 | E72: 0 | F72: 0; | G72: 1; | H72: 100 | I72: 0; | J72: 0; | K72: 0 | L72: 0,0,0,0; | M72: 1913 | N72: 99 | O72: 0 | P72: 受到的增益状态持续回合数为原来的3倍。 | Q72: 受到的辅助类法攻持续效果增加3回合 | R72: 0 | S72: 0 | T72: 0 | U72: 0 | V72: 0,0; | W72: 17030 | X72: 1 | Y72: =R[-38]C[-24] -> 5130
A73: 5231 | B73: 高级强壮 | C73: 5131 | D73: 2 | E73: 0 | F73: 0; | G73: 1; | H73: 100 | I73: 0; | J73: 0; | K73: 0 | L73: 1,502,1,lv*3+40; | M73: 0 | N73: 0 | O73: 0 | P73: 气血上限提高：自身等级*3+40。 | Q73: 气血上限提高=自身等级×2+25 | R73: 0 | S73: 0 | T73: 0 | U73: 0 | V73: 0,0; | W73: 17031 | X73: 1 | Y73: =R[-38]C[-24] -> 5131
A74: 5232 | B74: 高级保命 | C74: 5132 | D74: 2 | E74: 0 | F74: 0; | G74: 10; | H74: 30 | I74: 0; | J74: 0; | K74: 0 | L74: 10,101,1,1; | M74: 0 | N74: 0 | O74: 0 | P74: 如果被攻击后会死亡，则有30%几率保命，保留1点气血。与重生和鬼魅共存时保命无效。 | Q74: 如果被攻击后会死亡，则有30%几率保命，保留1点气血。与神佑复生或高级神佑复生技能同时存在时保命技能无效 | R74: 0 | S74: 0 | T74: 0 | U74: 0 | V74: 0,0; | W74: 17032 | X74: 1 | Y74: =R[-38]C[-24] -> 5132
A75: 5233 | B75: 高级报复 | C75: 5133 | D75: 2 | E75: 0 | F75: 0; | G75: 11;5; | H75: 100 | I75: 0; | J75: 0; | K75: 0 | L75: 0,108,1,math.max(5,(1-hp/maxhp)*100/4); | M75: 0 | N75: 0 | O75: 0 | P75: 攻击时根据自身当前气血与气血上限的比例增加一定伤害结果。气血比例越低，增加的伤害结果越多，最低增加5%，最高增加25%。 | Q75: 攻击时根据自身当前气血与气血上限的比例增加一定伤害，增加(1-当前气血/上限气血)/5结果。气血比例越低，增加的伤害越多，最高增加20% | R75: 0 | S75: 0 | T75: 0 | U75: 0 | V75: 0,0; | W75: 17033 | X75: 1 | Y75: =R[-38]C[-24] -> 5133
A76: 5234 | B76: 高级冰霜 | C76: 5134 | D76: 2 | E76: 0 | F76: 0; | G76: 11;5; | H76: 30 | I76: 0; | J76: 0; | K76: 0 | L76: 0,0,0,0; | M76: 1907 | N76: 4 | O76: 0 | P76: 攻击目标时，有一定几率使目标4回合内速度降低15%。 | Q76: 攻击目标时，有一定几率使目标4回合内速度降低15%。自身魔力点加得越多，成功几率越大。20%*自身魔力/(自身等级*4+20)，最高20%。 | R76: 0 | S76: 0 | T76: 0 | U76: 0 | V76: 0,0; | W76: 17034 | X76: 1 | Y76: =R[-38]C[-24] -> 5134
A77: 5235 | B77: 高级气势 | C77: 5135 | D77: 2 | E77: 0 | F77: 0; | G77: 1; | H77: 100 | I77: 0; | J77: 0; | K77: 0 | L77: 0,0,0,0; | M77: 1908 | N77: 2 | O77: 0 | P77: 出战前2回合物攻伤害结果增加15%。 | Q77: 出战前2回合物攻伤害结果增加15%。 | R77: 0 | S77: 0 | T77: 0 | U77: 0 | V77: 0,0; | W77: 17035 | X77: 1 | Y77: =R[-38]C[-24] -> 5135
A78: 5236 | B78: 高级震慑 | C78: 5136 | D78: 2 | E78: 0 | F78: 0; | G78: 1; | H78: 100 | I78: 0; | J78: 0; | K78: 0 | L78: 0,0,0,0; | M78: 1909 | N78: 2 | O78: 0 | P78: 出战前2回合法攻伤害结果增加15%。 | Q78: 出战前2回合法攻伤害结果增加15%。 | R78: 0 | S78: 0 | T78: 0 | U78: 0 | V78: 0,0; | W78: 17036 | X78: 1 | Y78: =R[-38]C[-24] -> 5136
A79: 5237 | B79: 高级审判 | C79: 5137 | D79: 2 | E79: 0 | F79: 0; | G79: 4;11;5; | H79: 100 | I79: 5115;5215; | J79: 0; | K79: 0 | L79: 11,108,1,30;5,108,1,30; | M79: 910 | N79: 1 | O79: 0 | P79: 将敌人击倒时，其重生类技能或效果无效。对拥有重生、高级重生的目标伤害结果增加30%。 | Q79: 将敌人击倒时，其重生类技能或效果无效。对拥有重生、高级重生的目标伤害结果增加30%。 | R79: 0 | S79: 0 | T79: 0 | U79: 0 | V79: 0,0; | W79: 17037 | X79: 1 | Y79: =R[-38]C[-24] -> 5137
A80: 5238 | B80: 高级光明 | C80: 5138 | D80: 2 | E80: 0 | F80: 0; | G80: 8; | H80: 100 | I80: 0; | J80: 0; | K80: 0 | L80: 8,501,2,27; | M80: 0 | N80: 0 | O80: 0 | P80: 当宠物受到治疗时，提高治疗效果27%。 | Q80: 接受气血治疗时，恢复效果提高27% | R80: 0 | S80: 0 | T80: 0 | U80: 0 | V80: 0,0; | W80: 17038 | X80: 1 | Y80: =R[-38]C[-24] -> 5138
A81: 5301 | B81: 雷击 | C81: 5301 | D81: 3 | E81: 1 | F81: 0; | G81: 0; | H81: 100 | I81: 0; | J81: 0; | K81: 0 | L81: 0,0,0,0; | M81: 0 | N81: 0 | O81: 法术单体 | P81: 雷系单体法攻技能，同时有10%概率驱除对方的一项增益状态。 | Q81: 单体雷系攻击法攻，消耗的MP=自身等级×2，附加法攻伤害=等级*2+15 | R81: 100 | S81: level*2 | T81: 4 | U81: 2 | V81: 0,1; | W81: 16101 | X81: 0 | Y81: 0
A82: 5302 | B82: 烈火 | C82: 5302 | D82: 3 | E82: 1 | F82: 0; | G82: 0; | H82: 100 | I82: 0; | J82: 0; | K82: 0 | L82: 0,0,0,0; | M82: 0 | N82: 0 | O82: 法术单体 | P82: 火系单体法攻技能，同时有10%概率降低对方物攻和法攻防御力5%，持续3回合。 | Q82: 单体火系攻击法攻，消耗的MP=自身等级×2，附加法攻伤害=等级*2+15 | R82: 100 | S82: level*2 | T82: 4 | U82: 2 | V82: 0,1; | W82: 16102 | X82: 0 | Y82: 0
A83: 5303 | B83: 水攻 | C83: 5303 | D83: 3 | E83: 1 | F83: 0; | G83: 0; | H83: 100 | I83: 0; | J83: 0; | K83: 0 | L83: 0,0,0,0; | M83: 0 | N83: 0 | O83: 法术单体 | P83: 水系单体法攻技能，同时有10%概率降低对方物攻和法攻攻击力3%，持续3回合。 | Q83: 单体水系攻击法攻，消耗的MP=自身等级×2，附加法攻伤害=等级*2+15 | R83: 100 | S83: level*2 | T83: 4 | U83: 2 | V83: 0,1; | W83: 16103 | X83: 0 | Y83: 0
A84: 5304 | B84: 落岩 | C84: 5304 | D84: 3 | E84: 1 | F84: 0; | G84: 0; | H84: 100 | I84: 0; | J84: 0; | K84: 0 | L84: 0,0,0,0; | M84: 0 | N84: 0 | O84: 法术单体 | P84: 土系单体法攻技能，同时有10%概率降低对方速度5%，持续3回合。 | Q84: 单体土系攻击法攻，消耗的MP=自身等级×2，附加法攻伤害=等级*2+15 | R84: 100 | S84: level*2 | T84: 4 | U84: 2 | V84: 0,1; | W84: 16104 | X84: 0 | Y84: 0
A85: 5305 | B85: 雷霆万钧 | C85: 5305 | D85: 3 | E85: 1 | F85: 0; | G85: 0; | H85: 100 | I85: 0; | J85: 0; | K85: 0 | L85: 0,0,0,0; | M85: 0 | N85: 0 | O85: 法术群体 | P85: 雷系群体法攻技能，初始可同时攻击两个目标，达到60级后可以同时攻击三个目标，同时有5%概率驱除对方的一项增益状态。 | Q85: 群体雷系攻击法攻（初始作用2个目标、50级以上作用3个目标）消耗MP：自身等级*2，附加法攻伤害=等级*1.5+30，受群攻规则影响 | R85: 100 | S85: level*2 | T85: 3 | U85: 2 | V85: 60,3;0,2; | W85: 17101 | X85: 0 | Y85: 0
A86: 5306 | B86: 地狱烈焰 | C86: 5306 | D86: 3 | E86: 1 | F86: 0; | G86: 0; | H86: 100 | I86: 0; | J86: 0; | K86: 0 | L86: 0,0,0,0; | M86: 0 | N86: 0 | O86: 法术群体 | P86: 火系群体法攻技能，初始可同时攻击两个目标，达到60级后可以同时攻击三个目标，同时有5%概率降低对方物攻和法攻防御力5%，持续3回合。 | Q86: 群体火系攻击法攻（初始作用2个目标、50级以上作用3个目标）消耗MP：自身等级*2，附加法攻伤害=等级*1.5+30，受群攻规则影响 | R86: 100 | S86: level*2 | T86: 3 | U86: 2 | V86: 60,3;0,2; | W86: 17102 | X86: 0 | Y86: 0
A87: 5307 | B87: 水漫金山 | C87: 5307 | D87: 3 | E87: 1 | F87: 0; | G87: 0; | H87: 100 | I87: 0; | J87: 0; | K87: 0 | L87: 0,0,0,0; | M87: 0 | N87: 0 | O87: 法术群体 | P87: 水系群体法攻技能，初始可同时攻击两个目标，达到60级后可以同时攻击三个目标，同时有5%概率降低对方物攻和法攻技能攻击力3%，持续3回合。 | Q87: 群体水系攻击法攻（初始作用2个目标、50级以上作用3个目标）消耗MP：自身等级*2，附加法攻伤害=等级*1.5+30，受群攻规则影响 | R87: 100 | S87: level*2 | T87: 3 | U87: 2 | V87: 60,3;0,2; | W87: 17103 | X87: 0 | Y87: 0
A88: 5308 | B88: 飞沙走石 | C88: 5308 | D88: 3 | E88: 1 | F88: 0; | G88: 0; | H88: 100 | I88: 0; | J88: 0; | K88: 0 | L88: 0,0,0,0; | M88: 0 | N88: 0 | O88: 法术群体 | P88: 土系群体法攻技能，初始可同时攻击两个目标，达到60级后可以同时攻击三个目标，同时有5%概率降低对方速度5%，持续3回合。 | Q88: 群体土系攻击法攻（初始作用2个目标、50级以上作用3个目标）消耗MP：自身等级*2，附加法攻伤害=等级*1.5+30，受群攻规则影响 | R88: 100 | S88: level*2 | T88: 3 | U88: 2 | V88: 60,3;0,2; | W88: 17104 | X88: 0 | Y88: 0
A89: 5309 | B89: 剑荡八荒 | C89: 5309 | D89: 3 | E89: 1 | F89: 0; | G89: 0; | H89: 100 | I89: 0; | J89: 0; | K89: 0 | L89: 0,0,0,0; | M89: 0 | N89: 0 | O89: 物理群体 | P89: 群体物攻技能，初始可同时攻击两个目标，达到60级后可以同时攻击三个目标，无法触发吸血和连击。 | Q89: 群体物攻攻击法攻（初始作用2个目标、50级以上作用3个目标）消耗MP：自身等级*2，1人100%，2人75%，3人60%。（冲击、高级冲击、恐怖、高级恐怖有效） | R89: 100 | S89: level*2 | T89: 1 | U89: 2 | V89: 60,3;0,2; | W89: 17105 | X89: 0 | Y89: 0
A90: 5310 | B90: 召唤子怪 | C90: 5310 | D90: 3 | E90: 1 | F90: 0; | G90: 0; | H90: 100 | I90: 0; | J90: 0; | K90: 0 | L90: 0,0,0,0; | M90: 0 | N90: 0 | O90: 0 | P90: 0 | Q90: 0 | R90: 100 | S90: 0 | T90: 4 | U90: 1 | V90: 0,0; | W90: 0 | X90: 0 | Y90: 0

Sheet: Sheet2
A2: nRate
A3: i
A4: 触发概率
A5: 10
A6: 45
A7: 100
A8: 100
A9: 30
A10: 30
A11: 100
A12: 100
A13: 100
A14: 100
A15: 100
A16: 100
A17: 100
A18: 100
A19: 20
A20: 100
A21: 100
A22: 25
A23: 10
A24: 100
A25: 100
A26: 100
A27: 100
A28: 10
A29: 100
A30: 100
A31: 5
A32: 100
A33: 100
A34: 100
A35: 100
A36: 20
A37: 100
A38: 30
A39: 100
A40: 100
A41: 100
A42: 100
A43: 100
A44: 50
A45: 100
A46: 100
A47: 30
A48: 30
A49: 100
A50: 100
A51: 100
A52: 100
A53: 100
A54: 100
A55: 100
A56: 100
A57: 25
A58: 100
A59: 100
A60: 30
A61: 100
A62: 100
A63: 100
A64: 100
A65: 100
A66: 15
A67: 100
A68: 100
A69: 7.5
A70: 100
A71: 100
A72: 100
A73: 100
A74: 30
A75: 100
A76: 30
A77: 100
A78: 100
A79: 100
A80: 100
A81: 100
A82: 100
A83: 100
A84: 100
A85: 100
A86: 100
A87: 100
A88: 100
A89: 100