Sheet: ctPalanquinWayConf
C1: 第一个是起始位置 最后一个，终点位置 移动到目标点之后，目标点的面向，就是下一阶段移动时的面向 比如，从第一个点移动到第二个点后，准备从第二个点移动到第三个点， 那么从第二个点到第三个点移动时的面向，就是第二个点配置的面向
A2: sModel | B2: sName | C2: tTargetPos | D2: nSpeed
A3: s | B3: s | C3: t{iii} | D3: i
A4: NPC形象 | B4: NPC名字 | C4: 目标位置(x, y,时间) | D4: 时间
A5: common_3038 | B5: 乐师敲锣 | C5: 1150,700,0;20,490,10 | D5: 10
A6: common_3038 | B6: 乐师敲锣 | C6: 1340,870,0;250,550,10 | D6: 10
A7: common_3033 | B7: 男童 | C7: 1290,630,0;230,380,10 | D7: 10
A8: common_3034 | B8: 女童 | C8: 1160,830,0;420,490,10 | D8: 10
A9: common_3036 | B9: 婚车 | C9: 600,560,0;520,300,10 | D9: 10
A10: common_3035 | B10: 媒婆 | C10: 810,730,0;740,380,10 | D10: 10
A11: common_3039 | B11: 双喜牌 | C11: 880,410,0;760,250,10 | D11: 10
A12: common_3039 | B12: 双喜牌 | C12: 910,580,0;940,390,10 | D12: 10
A13: common_3037 | B13: 乐师唢呐 | C13: 890,300,0;920,250,10 | D13: 10
A14: common_3037 | B14: 乐师唢呐 | C14: 1200,450,0;1150,290,10 | D14: 10

Sheet: Sheet2
A1: 2770 | B1: 750 | C1: 0 | D1: 310 | E1: 1110 | F1: 10 | G1: =RC[-6]&","&RC[-5]&","&RC[-4]&";"&RC[-3]&","&RC[-2]&","&RC[-1] -> 2770,750,0;310,1110,10 | I1: =RC[-4]-1100 -> 10
A2: 2960 | B2: 920 | C2: 0 | D2: 540 | E2: 1170 | F2: 10 | G2: =RC[-6]&","&RC[-5]&","&RC[-4]&";"&RC[-3]&","&RC[-2]&","&RC[-1] -> 2960,920,0;540,1170,10 | I2: =RC[-4]-1100 -> 70
A3: 2910 | B3: 680 | C3: 0 | D3: 520 | E3: 1000 | F3: 10 | G3: =RC[-6]&","&RC[-5]&","&RC[-4]&";"&RC[-3]&","&RC[-2]&","&RC[-1] -> 2910,680,0;520,1000,10 | I3: =RC[-4]-1100 -> -100
A4: 2780 | B4: 880 | C4: 0 | D4: 710 | E4: 1110 | F4: 10 | G4: =RC[-6]&","&RC[-5]&","&RC[-4]&";"&RC[-3]&","&RC[-2]&","&RC[-1] -> 2780,880,0;710,1110,10 | I4: =RC[-4]-1100 -> 10
A5: 2220 | B5: 610 | C5: 0 | D5: 810 | E5: 920 | F5: 10 | G5: =RC[-6]&","&RC[-5]&","&RC[-4]&";"&RC[-3]&","&RC[-2]&","&RC[-1] -> 2220,610,0;810,920,10 | I5: =RC[-4]-1100 -> -180
A6: 2430 | B6: 780 | C6: 0 | D6: 1030 | E6: 1000 | F6: 10 | G6: =RC[-6]&","&RC[-5]&","&RC[-4]&";"&RC[-3]&","&RC[-2]&","&RC[-1] -> 2430,780,0;1030,1000,10 | I6: =RC[-4]-1100 -> -100
A7: 2500 | B7: 460 | C7: 0 | D7: 1050 | E7: 870 | F7: 10 | G7: =RC[-6]&","&RC[-5]&","&RC[-4]&";"&RC[-3]&","&RC[-2]&","&RC[-1] -> 2500,460,0;1050,870,10 | I7: =RC[-4]-900 -> -30
A8: 2530 | B8: 630 | C8: 0 | D8: 1230 | E8: 1010 | F8: 10 | G8: =RC[-6]&","&RC[-5]&","&RC[-4]&";"&RC[-3]&","&RC[-2]&","&RC[-1] -> 2530,630,0;1230,1010,10 | I8: =RC[-4]-900 -> 110
A9: 2510 | B9: 350 | C9: 0 | D9: 1210 | E9: 870 | F9: 10 | G9: =RC[-6]&","&RC[-5]&","&RC[-4]&";"&RC[-3]&","&RC[-2]&","&RC[-1] -> 2510,350,0;1210,870,10 | I9: =RC[-4]-900 -> -30
A10: 2820 | B10: 500 | C10: 0 | D10: 1440 | E10: 910 | F10: 10 | G10: =RC[-6]&","&RC[-5]&","&RC[-4]&";"&RC[-3]&","&RC[-2]&","&RC[-1] -> 2820,500,0;1440,910,10 | I10: =RC[-4]-900 -> 10
A11: 1620 | B11: 50 | C11: 0 | D11: 290 | E11: 620 | F11: 10 | H11: 差值
A12: =R[-11]C-R11C1 -> 1150 | B12: =R[-11]C-R11C2 -> 700 | C12: 0 | D12: =R[-11]C-R11C4 -> 20 | E12: =R[-11]C-R11C5 -> 490 | F12: 10 | G12: =RC[-6]&","&RC[-5]&","&RC[-4]&";"&RC[-3]&","&RC[-2]&","&RC[-1] -> 1150,700,0;20,490,10 | I12: =RC[-4]-900 -> -410
A13: =R[-11]C-R11C1 -> 1340 | B13: =R[-11]C-R11C2 -> 870 | C13: 0 | D13: =R[-11]C-R11C4 -> 250 | E13: =R[-11]C-R11C5 -> 550 | F13: 10 | G13: =RC[-6]&","&RC[-5]&","&RC[-4]&";"&RC[-3]&","&RC[-2]&","&RC[-1] -> 1340,870,0;250,550,10 | I13: =RC[-4]-900 -> -350
A14: =R[-11]C-R11C1 -> 1290 | B14: =R[-11]C-R11C2 -> 630 | C14: 0 | D14: =R[-11]C-R11C4 -> 230 | E14: =R[-11]C-R11C5 -> 380 | F14: 10 | G14: =RC[-6]&","&RC[-5]&","&RC[-4]&";"&RC[-3]&","&RC[-2]&","&RC[-1] -> 1290,630,0;230,380,10 | I14: =RC[-4]-900 -> -520
A15: =R[-11]C-R11C1 -> 1160 | B15: =R[-11]C-R11C2 -> 830 | C15: 0 | D15: =R[-11]C-R11C4 -> 420 | E15: =R[-11]C-R11C5 -> 490 | F15: 10 | G15: =RC[-6]&","&RC[-5]&","&RC[-4]&";"&RC[-3]&","&RC[-2]&","&RC[-1] -> 1160,830,0;420,490,10
A16: =R[-11]C-R11C1 -> 600 | B16: =R[-11]C-R11C2 -> 560 | C16: 0 | D16: =R[-11]C-R11C4 -> 520 | E16: =R[-11]C-R11C5 -> 300 | F16: 10 | G16: =RC[-6]&","&RC[-5]&","&RC[-4]&";"&RC[-3]&","&RC[-2]&","&RC[-1] -> 600,560,0;520,300,10
A17: =R[-11]C-R11C1 -> 810 | B17: =R[-11]C-R11C2 -> 730 | C17: 0 | D17: =R[-11]C-R11C4 -> 740 | E17: =R[-11]C-R11C5 -> 380 | F17: 10 | G17: =RC[-6]&","&RC[-5]&","&RC[-4]&";"&RC[-3]&","&RC[-2]&","&RC[-1] -> 810,730,0;740,380,10
A18: =R[-11]C-R11C1 -> 880 | B18: =R[-11]C-R11C2 -> 410 | C18: 0 | D18: =R[-11]C-R11C4 -> 760 | E18: =R[-11]C-R11C5 -> 250 | F18: 10 | G18: =RC[-6]&","&RC[-5]&","&RC[-4]&";"&RC[-3]&","&RC[-2]&","&RC[-1] -> 880,410,0;760,250,10
A19: =R[-11]C-R11C1 -> 910 | B19: =R[-11]C-R11C2 -> 580 | C19: 0 | D19: =R[-11]C-R11C4 -> 940 | E19: =R[-11]C-R11C5 -> 390 | F19: 10 | G19: =RC[-6]&","&RC[-5]&","&RC[-4]&";"&RC[-3]&","&RC[-2]&","&RC[-1] -> 910,580,0;940,390,10
A20: =R[-11]C-R11C1 -> 890 | B20: =R[-11]C-R11C2 -> 300 | C20: 0 | D20: =R[-11]C-R11C4 -> 920 | E20: =R[-11]C-R11C5 -> 250 | F20: 10 | G20: =RC[-6]&","&RC[-5]&","&RC[-4]&";"&RC[-3]&","&RC[-2]&","&RC[-1] -> 890,300,0;920,250,10
A21: =R[-11]C-R11C1 -> 1200 | B21: =R[-11]C-R11C2 -> 450 | C21: 0 | D21: =R[-11]C-R11C4 -> 1150 | E21: =R[-11]C-R11C5 -> 290 | F21: 10 | G21: =RC[-6]&","&RC[-5]&","&RC[-4]&";"&RC[-3]&","&RC[-2]&","&RC[-1] -> 1200,450,0;1150,290,10