Sheet: ctRandomPoint
B1: 1 长安城 2 天剑府 3 灵音寺 4 兽王寨 5 水晶宫 6 幽冥殿 7 大雁塔 8 乌斯藏 9 西部边境 10 大唐国境 11 月老池 12 地府 13 昆仑山 20 万寿山 10101 高老庄 10102 泾川 10103 方寸山 | G1: 0:通用 1:放妖 2:师门 3:帮派 4:藏宝图 5:赏金任务 6：妖兽突袭 7：镇妖 | H1: 2700*1920 | I1: 3240*1920
A2: nID | B2: nDupID | C2: tPos | D2: nRadius | E2: nMinGrade | F2: nMaxGrade | G2: nType
A3: i | B3: i | C3: t{ii} | D3: i | E3: i | F3: i | G3: i
A4: 随机编号 | B4: 副本编号 | C4: 刷新中心点 | D4: 刷新半径 | E4: 角色等级下限（关联悬赏任务） | F4: 角色等级上限（关联悬赏任务） | G4: 用途类型
A5: 1 | B5: 2 | C5: 1220,790; | D5: 50 | E5: 0 | F5: 999 | G5: 5
A6: 2 | B6: 2 | C6: 950,1340; | D6: 50 | E6: 0 | F6: 999 | G6: 5
A7: 3 | B7: 2 | C7: 300,920; | D7: 50 | E7: 0 | F7: 999 | G7: 5
A8: 4 | B8: 3 | C8: 490,1320; | D8: 50 | E8: 0 | F8: 999 | G8: 5
A9: 5 | B9: 3 | C9: 480,850; | D9: 50 | E9: 0 | F9: 999 | G9: 5
A10: 6 | B10: 3 | C10: 1100,640; | D10: 50 | E10: 0 | F10: 999 | G10: 5
A11: 7 | B11: 4 | C11: 630,1380; | D11: 50 | E11: 0 | F11: 999 | G11: 5
A12: 8 | B12: 4 | C12: 1070,870; | D12: 50 | E12: 0 | F12: 999 | G12: 5
A13: 9 | B13: 4 | C13: 1300,620; | D13: 50 | E13: 0 | F13: 999 | G13: 5
A14: 10 | B14: 5 | C14: 250,610; | D14: 50 | E14: 0 | F14: 999 | G14: 5
A15: 11 | B15: 5 | C15: 1180,1130; | D15: 50 | E15: 0 | F15: 999 | G15: 5
A16: 12 | B16: 5 | C16: 500,1320; | D16: 50 | E16: 0 | F16: 999 | G16: 5
A17: 13 | B17: 6 | C17: 560,1434; | D17: 50 | E17: 0 | F17: 999 | G17: 5
A18: 14 | B18: 6 | C18: 300,924; | D18: 50 | E18: 0 | F18: 999 | G18: 5
A19: 15 | B19: 6 | C19: 580,620; | D19: 50 | E19: 0 | F19: 999 | G19: 5
A20: 16 | B20: 2 | C20: 630,240; | D20: 50 | E20: 0 | F20: 999 | G20: 6
A21: 17 | B21: 3 | C21: 730,640; | D21: 50 | E21: 0 | F21: 999 | G21: 6
A22: 18 | B22: 4 | C22: 830,240; | D22: 50 | E22: 0 | F22: 999 | G22: 6
A23: 19 | B23: 5 | C23: 230,540; | D23: 50 | E23: 0 | F23: 999 | G23: 6
A24: 20 | B24: 6 | C24: 430,640; | D24: 50 | E24: 0 | F24: 999 | G24: 6
A25: 21 | B25: 8 | C25: 630,740; | D25: 50 | E25: 0 | F25: 999 | G25: 6
A26: 22 | B26: 2 | C26: 519,594; | D26: 50 | E26: 0 | F26: 999 | G26: 6
A27: 23 | B27: 2 | C27: 230,240; | D27: 50 | E27: 0 | F27: 999 | G27: 6
A28: 24 | B28: 2 | C28: 330,540; | D28: 50 | E28: 0 | F28: 999 | G28: 6
A29: 25 | B29: 2 | C29: 430,340; | D29: 50 | E29: 0 | F29: 999 | G29: 6
A30: 26 | B30: 3 | C30: 530,440; | D30: 50 | E30: 0 | F30: 999 | G30: 6
A31: 27 | B31: 3 | C31: 630,240; | D31: 50 | E31: 0 | F31: 999 | G31: 6
A32: 28 | B32: 3 | C32: 730,640; | D32: 50 | E32: 0 | F32: 999 | G32: 6
A33: 29 | B33: 3 | C33: 830,240; | D33: 50 | E33: 0 | F33: 999 | G33: 6
A34: 30 | B34: 4 | C34: 230,540; | D34: 50 | E34: 0 | F34: 999 | G34: 6
A35: 31 | B35: 4 | C35: 430,640; | D35: 50 | E35: 0 | F35: 999 | G35: 6
A36: 32 | B36: 4 | C36: 630,740; | D36: 50 | E36: 0 | F36: 999 | G36: 6
A37: 33 | B37: 4 | C37: 519,594; | D37: 50 | E37: 0 | F37: 999 | G37: 6
A38: 34 | B38: 5 | C38: 230,240; | D38: 50 | E38: 0 | F38: 999 | G38: 6
A39: 35 | B39: 5 | C39: 330,540; | D39: 50 | E39: 0 | F39: 999 | G39: 6
A40: 36 | B40: 5 | C40: 430,340; | D40: 50 | E40: 0 | F40: 999 | G40: 6
A41: 37 | B41: 5 | C41: 530,440; | D41: 50 | E41: 0 | F41: 999 | G41: 6
A42: 38 | B42: 6 | C42: 630,240; | D42: 50 | E42: 0 | F42: 999 | G42: 6
A43: 39 | B43: 6 | C43: 730,640; | D43: 50 | E43: 0 | F43: 999 | G43: 6
A44: 40 | B44: 6 | C44: 830,240; | D44: 50 | E44: 0 | F44: 999 | G44: 6
A45: 41 | B45: 6 | C45: 230,540; | D45: 50 | E45: 0 | F45: 999 | G45: 6
A46: 42 | B46: 8 | C46: 430,640; | D46: 50 | E46: 0 | F46: 999 | G46: 6
A47: 43 | B47: 8 | C47: 630,740; | D47: 50 | E47: 0 | F47: 999 | G47: 6
A48: 44 | B48: 8 | C48: 519,594; | D48: 50 | E48: 0 | F48: 999 | G48: 6
A49: 45 | B49: 8 | C49: 230,240; | D49: 50 | E49: 0 | F49: 999 | G49: 6
A50: 46 | B50: 1 | C50: 330,540; | D50: 50 | E50: 0 | F50: 999 | G50: 2
A51: 47 | B51: 1 | C51: 430,340; | D51: 50 | E51: 0 | F51: 999 | G51: 2
A52: 48 | B52: 1 | C52: 530,440; | D52: 50 | E52: 0 | F52: 999 | G52: 2
A53: 49 | B53: 1 | C53: 630,240; | D53: 50 | E53: 0 | F53: 999 | G53: 2
A54: 50 | B54: 1 | C54: 730,640; | D54: 50 | E54: 0 | F54: 999 | G54: 2
A55: 51 | B55: 1 | C55: 830,240; | D55: 50 | E55: 0 | F55: 999 | G55: 2
A56: 52 | B56: 1 | C56: 230,540; | D56: 50 | E56: 0 | F56: 999 | G56: 2
A57: 53 | B57: 1 | C57: 430,640; | D57: 50 | E57: 0 | F57: 999 | G57: 2
A58: 54 | B58: 1 | C58: 630,740; | D58: 50 | E58: 0 | F58: 999 | G58: 2
A59: 55 | B59: 1 | C59: 519,594; | D59: 50 | E59: 0 | F59: 999 | G59: 2
A60: 56 | B60: 2 | C60: 230,240; | D60: 50 | E60: 0 | F60: 999 | G60: 2
A61: 57 | B61: 2 | C61: 330,540; | D61: 50 | E61: 0 | F61: 999 | G61: 2
A62: 58 | B62: 2 | C62: 430,340; | D62: 50 | E62: 0 | F62: 999 | G62: 2
A63: 59 | B63: 2 | C63: 530,440; | D63: 50 | E63: 0 | F63: 999 | G63: 2
A64: 60 | B64: 3 | C64: 630,240; | D64: 50 | E64: 0 | F64: 999 | G64: 2
A65: 61 | B65: 3 | C65: 730,640; | D65: 50 | E65: 0 | F65: 999 | G65: 2
A66: 62 | B66: 3 | C66: 830,240; | D66: 50 | E66: 0 | F66: 999 | G66: 2
A67: 63 | B67: 3 | C67: 230,540; | D67: 50 | E67: 0 | F67: 999 | G67: 2
A68: 64 | B68: 4 | C68: 430,640; | D68: 50 | E68: 0 | F68: 999 | G68: 2
A69: 65 | B69: 4 | C69: 630,740; | D69: 50 | E69: 0 | F69: 999 | G69: 2
A70: 66 | B70: 4 | C70: 519,594; | D70: 50 | E70: 0 | F70: 999 | G70: 2
A71: 67 | B71: 4 | C71: 230,240; | D71: 50 | E71: 0 | F71: 999 | G71: 2
A72: 68 | B72: 4 | C72: 330,540; | D72: 50 | E72: 0 | F72: 999 | G72: 2
A73: 69 | B73: 5 | C73: 430,340; | D73: 50 | E73: 0 | F73: 999 | G73: 2
A74: 70 | B74: 5 | C74: 530,440; | D74: 50 | E74: 0 | F74: 999 | G74: 2
A75: 71 | B75: 5 | C75: 630,240; | D75: 50 | E75: 0 | F75: 999 | G75: 2
A76: 72 | B76: 5 | C76: 730,640; | D76: 50 | E76: 0 | F76: 999 | G76: 2
A77: 73 | B77: 6 | C77: 830,240; | D77: 50 | E77: 0 | F77: 999 | G77: 2
A78: 74 | B78: 6 | C78: 230,540; | D78: 50 | E78: 0 | F78: 999 | G78: 2
A79: 75 | B79: 6 | C79: 430,640; | D79: 50 | E79: 0 | F79: 999 | G79: 2
A80: 76 | B80: 6 | C80: 630,740; | D80: 50 | E80: 0 | F80: 999 | G80: 2
A81: 77 | B81: 8 | C81: 519,594; | D81: 50 | E81: 0 | F81: 999 | G81: 2
A82: 78 | B82: 8 | C82: 230,240; | D82: 50 | E82: 0 | F82: 999 | G82: 2
A83: 79 | B83: 8 | C83: 330,540; | D83: 50 | E83: 0 | F83: 999 | G83: 2
A84: 80 | B84: 8 | C84: 430,340; | D84: 50 | E84: 0 | F84: 999 | G84: 2
A85: 81 | B85: 8 | C85: 530,440; | D85: 50 | E85: 0 | F85: 999 | G85: 2
A86: 82 | B86: 1 | C86: 630,240; | D86: 50 | E86: 0 | F86: 999 | G86: 4
A87: 83 | B87: 1 | C87: 730,640; | D87: 50 | E87: 0 | F87: 999 | G87: 4
A88: 84 | B88: 1 | C88: 830,240; | D88: 50 | E88: 0 | F88: 999 | G88: 4
A89: 85 | B89: 1 | C89: 230,540; | D89: 50 | E89: 0 | F89: 999 | G89: 4
A90: 86 | B90: 1 | C90: 430,640; | D90: 50 | E90: 0 | F90: 999 | G90: 4
A91: 87 | B91: 1 | C91: 630,740; | D91: 50 | E91: 0 | F91: 999 | G91: 4
A92: 88 | B92: 1 | C92: 519,594; | D92: 50 | E92: 0 | F92: 999 | G92: 4
A93: 89 | B93: 1 | C93: 230,240; | D93: 50 | E93: 0 | F93: 999 | G93: 4
A94: 90 | B94: 1 | C94: 330,540; | D94: 50 | E94: 0 | F94: 999 | G94: 4
A95: 91 | B95: 1 | C95: 430,340; | D95: 50 | E95: 0 | F95: 999 | G95: 4
A96: 92 | B96: 2 | C96: 530,440; | D96: 50 | E96: 0 | F96: 999 | G96: 4
A97: 93 | B97: 2 | C97: 630,240; | D97: 50 | E97: 0 | F97: 999 | G97: 4
A98: 94 | B98: 2 | C98: 730,640; | D98: 50 | E98: 0 | F98: 999 | G98: 4
A99: 95 | B99: 3 | C99: 830,240; | D99: 50 | E99: 0 | F99: 999 | G99: 4
A100: 96 | B100: 3 | C100: 230,540; | D100: 50 | E100: 0 | F100: 999 | G100: 4
A101: 97 | B101: 3 | C101: 430,640; | D101: 50 | E101: 0 | F101: 999 | G101: 4
A102: 98 | B102: 3 | C102: 630,740; | D102: 50 | E102: 0 | F102: 999 | G102: 4
A103: 99 | B103: 4 | C103: 519,594; | D103: 50 | E103: 0 | F103: 999 | G103: 4
A104: 100 | B104: 4 | C104: 230,240; | D104: 50 | E104: 0 | F104: 999 | G104: 4
A105: 101 | B105: 4 | C105: 330,540; | D105: 50 | E105: 0 | F105: 999 | G105: 4
A106: 102 | B106: 4 | C106: 430,340; | D106: 50 | E106: 0 | F106: 999 | G106: 4
A107: 103 | B107: 5 | C107: 530,440; | D107: 50 | E107: 0 | F107: 999 | G107: 4
A108: 104 | B108: 5 | C108: 630,240; | D108: 50 | E108: 0 | F108: 999 | G108: 4
A109: 105 | B109: 5 | C109: 730,640; | D109: 50 | E109: 0 | F109: 999 | G109: 4
A110: 106 | B110: 5 | C110: 830,240; | D110: 50 | E110: 0 | F110: 999 | G110: 4
A111: 107 | B111: 6 | C111: 230,540; | D111: 50 | E111: 0 | F111: 999 | G111: 4
A112: 108 | B112: 6 | C112: 430,640; | D112: 50 | E112: 0 | F112: 999 | G112: 4
A113: 109 | B113: 6 | C113: 630,740; | D113: 50 | E113: 0 | F113: 999 | G113: 4
A114: 110 | B114: 6 | C114: 519,594; | D114: 50 | E114: 0 | F114: 999 | G114: 4
A115: 111 | B115: 8 | C115: 230,240; | D115: 50 | E115: 0 | F115: 999 | G115: 4
A116: 112 | B116: 8 | C116: 330,540; | D116: 50 | E116: 0 | F116: 999 | G116: 4
A117: 113 | B117: 8 | C117: 430,340; | D117: 50 | E117: 0 | F117: 999 | G117: 4
A118: 114 | B118: 8 | C118: 530,440; | D118: 50 | E118: 0 | F118: 999 | G118: 4
A119: 115 | B119: 10101 | C119: 630,240; | D119: 50 | E119: 0 | F119: 999 | G119: 7
A120: 116 | B120: 10101 | C120: 730,640; | D120: 50 | E120: 0 | F120: 999 | G120: 7
A121: 117 | B121: 10101 | C121: 830,240; | D121: 50 | E121: 0 | F121: 999 | G121: 7
A122: 118 | B122: 10101 | C122: 230,540; | D122: 50 | E122: 0 | F122: 999 | G122: 7
A123: 119 | B123: 10101 | C123: 430,640; | D123: 50 | E123: 0 | F123: 999 | G123: 7
A124: 120 | B124: 10101 | C124: 630,740; | D124: 50 | E124: 0 | F124: 999 | G124: 7
A125: 121 | B125: 10101 | C125: 519,594; | D125: 50 | E125: 0 | F125: 999 | G125: 7
A126: 122 | B126: 10101 | C126: 230,240; | D126: 50 | E126: 0 | F126: 999 | G126: 7
A127: 123 | B127: 10101 | C127: 330,540; | D127: 50 | E127: 0 | F127: 999 | G127: 7
A128: 124 | B128: 10101 | C128: 430,340; | D128: 50 | E128: 0 | F128: 999 | G128: 7
A129: 125 | B129: 10102 | C129: 530,440; | D129: 50 | E129: 0 | F129: 999 | G129: 7
A130: 126 | B130: 10102 | C130: 630,240; | D130: 50 | E130: 0 | F130: 999 | G130: 7
A131: 127 | B131: 10102 | C131: 730,640; | D131: 50 | E131: 0 | F131: 999 | G131: 7
A132: 128 | B132: 10102 | C132: 830,240; | D132: 50 | E132: 0 | F132: 999 | G132: 7
A133: 129 | B133: 10102 | C133: 230,540; | D133: 50 | E133: 0 | F133: 999 | G133: 7
A134: 130 | B134: 10102 | C134: 430,640; | D134: 50 | E134: 0 | F134: 999 | G134: 7
A135: 131 | B135: 10102 | C135: 630,740; | D135: 50 | E135: 0 | F135: 999 | G135: 7
A136: 132 | B136: 10102 | C136: 519,594; | D136: 50 | E136: 0 | F136: 999 | G136: 7
A137: 133 | B137: 10102 | C137: 230,240; | D137: 50 | E137: 0 | F137: 999 | G137: 7
A138: 134 | B138: 10102 | C138: 330,540; | D138: 50 | E138: 0 | F138: 999 | G138: 7
A139: 135 | B139: 10103 | C139: 430,340; | D139: 50 | E139: 0 | F139: 999 | G139: 7
A140: 136 | B140: 10103 | C140: 530,440; | D140: 50 | E140: 0 | F140: 999 | G140: 7
A141: 137 | B141: 10103 | C141: 630,240; | D141: 50 | E141: 0 | F141: 999 | G141: 7
A142: 138 | B142: 10103 | C142: 730,640; | D142: 50 | E142: 0 | F142: 999 | G142: 7
A143: 139 | B143: 10103 | C143: 830,240; | D143: 50 | E143: 0 | F143: 999 | G143: 7
A144: 140 | B144: 10103 | C144: 230,540; | D144: 50 | E144: 0 | F144: 999 | G144: 7
A145: 141 | B145: 10103 | C145: 430,640; | D145: 50 | E145: 0 | F145: 999 | G145: 7
A146: 142 | B146: 10103 | C146: 630,740; | D146: 50 | E146: 0 | F146: 999 | G146: 7
A147: 143 | B147: 10103 | C147: 519,594; | D147: 50 | E147: 0 | F147: 999 | G147: 7
A148: 144 | B148: 10103 | C148: 230,240; | D148: 50 | E148: 0 | F148: 999 | G148: 7
A149: 145 | B149: 10104 | C149: 330,540; | D149: 50 | E149: 0 | F149: 999 | G149: 7
A150: 146 | B150: 10104 | C150: 430,340; | D150: 50 | E150: 0 | F150: 999 | G150: 7
A151: 147 | B151: 10104 | C151: 530,440; | D151: 50 | E151: 0 | F151: 999 | G151: 7
A152: 148 | B152: 10104 | C152: 630,240; | D152: 50 | E152: 0 | F152: 999 | G152: 7
A153: 149 | B153: 10104 | C153: 730,640; | D153: 50 | E153: 0 | F153: 999 | G153: 7
A154: 150 | B154: 10104 | C154: 830,240; | D154: 50 | E154: 0 | F154: 999 | G154: 7
A155: 151 | B155: 10104 | C155: 230,540; | D155: 50 | E155: 0 | F155: 999 | G155: 7
A156: 152 | B156: 10104 | C156: 430,640; | D156: 50 | E156: 0 | F156: 999 | G156: 7
A157: 153 | B157: 10104 | C157: 630,740; | D157: 50 | E157: 0 | F157: 999 | G157: 7
A158: 154 | B158: 10104 | C158: 519,594; | D158: 50 | E158: 0 | F158: 999 | G158: 7
A159: 155 | B159: 10105 | C159: 230,240; | D159: 50 | E159: 0 | F159: 999 | G159: 7
A160: 156 | B160: 10105 | C160: 330,540; | D160: 50 | E160: 0 | F160: 999 | G160: 7
A161: 157 | B161: 10105 | C161: 430,340; | D161: 50 | E161: 0 | F161: 999 | G161: 7
A162: 158 | B162: 10105 | C162: 530,440; | D162: 50 | E162: 0 | F162: 999 | G162: 7
A163: 159 | B163: 10105 | C163: 630,240; | D163: 50 | E163: 0 | F163: 999 | G163: 7
A164: 160 | B164: 10105 | C164: 730,640; | D164: 50 | E164: 0 | F164: 999 | G164: 7
A165: 161 | B165: 10105 | C165: 830,240; | D165: 50 | E165: 0 | F165: 999 | G165: 7
A166: 162 | B166: 10105 | C166: 230,540; | D166: 50 | E166: 0 | F166: 999 | G166: 7
A167: 163 | B167: 10105 | C167: 430,640; | D167: 50 | E167: 0 | F167: 999 | G167: 7
A168: 164 | B168: 10105 | C168: 630,740; | D168: 50 | E168: 0 | F168: 999 | G168: 7

Sheet: Sheet2
A1: 宋玉 | B1: 多想为你奉上最美的鲜花
A2: 潘安 | B2: 留不住的，始终是那刹那消逝的芳华
A3: 卫玠 | B3: 天涯海角，但求无他，只望君安，叔宝便已知足
A4: 赵云 | B4: 若为伊故，子龙再度七进七出又何妨！
A5: 司马相如 | B5: 能与娘娘相伴，真乃微臣之辛
A6: 孙策 | B6: =R[-1]C -> 能与娘娘相伴，真乃微臣之辛
A7: 韩子高 | B7: 伊人独舞，倾城之姿。舞中带忧，我见犹怜
A8: 高长恭 | B8: 不要动，再动的话，我可不敢保证会发生什么!
A9: 嵇康 | B9: 人生难免不如意，娘娘懂得排遣便好
A10: 慕容冲 | B10: 你是白痴吗？这种话还需要我当面跟你说清楚吗！
A11: 诸葛亮 | B11: 今日夜观星象，乌云盖顶，却奈何遮不住对你的思念
A12: 卫青 | B12: 有时候莫名其妙的笑了，只因为想到了你
A13: 荀彧 | B13: 大千世界，能遇上娘娘，真好
A14: 子画 | B14: 没有我，你要好好的，这是你唯一能为我做的
A15: 白玉堂 | B15: 不要怕什么路途遥远。走一步有一步的风景
A16: 曹操 | B16: 我从来不怕天下人看错我，却唯怕你看错我
A17: 李白 | B17: 陪你地老天荒，只为伊人独醉
A18: 杜甫 | B18: 你站在哪里 哪里就自成风景
A19: 展昭 | B19: 只要展某认为值得，纵管前方是刀山火海还是千军万马，我也会义无反顾！
A20: 周瑜 | B20: 聆听吧，这首献给您的醉赤壁
A21: 苏轼 | B21: 小楼一夜听风雨，深巷明朝卖杏花
A22: 元稹 | B22: 在你需要我时，我总会出现在你身边
A23: 阮籍 | B23: 世间纵有风雪寒寒，亦终有人万死不离
A24: 霍去病 | B24: 娘娘，和你在一起总会令我忘记时间的存在
A25: 邹忌 | B25: 我不思进取，因为只思你！
A26: 唐伯虎 | B26: 笔走龙蛇绘江山，却绘不出娘娘的惊鸿之姿
A27: 柳永 | B27: 云淡风轻，细水长流
A28: 魏无忌 | B28: 凤兮凤兮归故乡，遨游四海求其凰
A29: 扶苏 | B29: 此刻看着你，就好比我在晴朗的天气，眺望远处的青山
A30: 欧阳修 | B30: 娘娘，好风、好景，倒不如来一场春风得意马蹄疾。
A31: 郭嘉 | B31: 有的路，是脚去走。而有的路，确是用心去走
A32: 蒙恬 | B32: 你若需要，大可拿走我的心，可是别把你的微笑拿掉
A33: 白居易 | B33: 娘娘，樱树只有华美落尽，生命脉络才历历可见
A34: 刘彻 | B34: 一腔孤勇与余生，只愿能陪在你的身边

Sheet: Sheet3
A3: =ctRandomPoint!R[1]C -> 随机编号 | B3: =ctRandomPoint!R[1]C -> 副本编号 | C3: 总数 | E3: 宽 | F3: 分子 | G3: 分母 | I3: 高 | J3: 分子 | K3: 分母 | P3: 结果
A4: =ctRandomPoint!R[1]C -> 1 | B4: =ctRandomPoint!R[1]C -> 2 | C4: =COUNTIFS(C2,RC[-1]) -> 15 | E4: =VLOOKUP(RC[-3],Sheet4!C3:C7,4,FALSE) -> 2160 | F4: 2 | G4: =INT(RC[-4]^0.5)*2+2 -> 8 | I4: =VLOOKUP(RC[-7],Sheet4!C3:C7,5,FALSE) -> 1920 | J4: 2 | K4: =ROUNDUP(RC[-8]^0.5,0)*2+2 -> 10 | M4: =ROUND(RC[-8]*RC[-7]/RC[-6],0) -> 540 | N4: =ROUND(RC[-5]*RC[-4]/RC[-3],0) -> 384 | P4: =RC[-3]&","&RC[-2]&";" -> 540,384;
A5: =ctRandomPoint!R[1]C -> 2 | B5: =ctRandomPoint!R[1]C -> 2 | C5: =COUNTIFS(C2,RC[-1]) -> 15 | E5: =VLOOKUP(RC[-3],Sheet4!C3:C7,4,FALSE) -> 2160 | F5: 4 | G5: =INT(RC[-4]^0.5)*2+2 -> 8 | I5: =VLOOKUP(RC[-7],Sheet4!C3:C7,5,FALSE) -> 1920 | J5: 2 | K5: =ROUNDUP(RC[-8]^0.5,0)*2+2 -> 10 | M5: =ROUND(RC[-8]*RC[-7]/RC[-6],0) -> 1080 | N5: =ROUND(RC[-5]*RC[-4]/RC[-3],0) -> 384 | P5: =RC[-3]&","&RC[-2]&";" -> 1080,384;
A6: =ctRandomPoint!R[1]C -> 3 | B6: =ctRandomPoint!R[1]C -> 2 | C6: =COUNTIFS(C2,RC[-1]) -> 15 | E6: =VLOOKUP(RC[-3],Sheet4!C3:C7,4,FALSE) -> 2160 | F6: 6 | G6: =INT(RC[-4]^0.5)*2+2 -> 8 | I6: =VLOOKUP(RC[-7],Sheet4!C3:C7,5,FALSE) -> 1920 | J6: 2 | K6: =ROUNDUP(RC[-8]^0.5,0)*2+2 -> 10 | M6: =ROUND(RC[-8]*RC[-7]/RC[-6],0) -> 1620 | N6: =ROUND(RC[-5]*RC[-4]/RC[-3],0) -> 384 | P6: =RC[-3]&","&RC[-2]&";" -> 1620,384;
A7: =ctRandomPoint!R[1]C -> 4 | B7: =ctRandomPoint!R[1]C -> 3 | C7: =COUNTIFS(C2,RC[-1]) -> 16 | E7: =VLOOKUP(RC[-3],Sheet4!C3:C7,4,FALSE) -> 2700 | F7: 8 | G7: =INT(RC[-4]^0.5)*2+2 -> 10 | I7: =VLOOKUP(RC[-7],Sheet4!C3:C7,5,FALSE) -> 1920 | J7: 2 | K7: =ROUNDUP(RC[-8]^0.5,0)*2+2 -> 10 | M7: =ROUND(RC[-8]*RC[-7]/RC[-6],0) -> 2160 | N7: =ROUND(RC[-5]*RC[-4]/RC[-3],0) -> 384 | P7: =RC[-3]&","&RC[-2]&";" -> 2160,384;
A8: =ctRandomPoint!R[1]C -> 5 | B8: =ctRandomPoint!R[1]C -> 3 | C8: =COUNTIFS(C2,RC[-1]) -> 16 | E8: =VLOOKUP(RC[-3],Sheet4!C3:C7,4,FALSE) -> 2700 | F8: 10 | G8: =INT(RC[-4]^0.5)*2+2 -> 10 | I8: =VLOOKUP(RC[-7],Sheet4!C3:C7,5,FALSE) -> 1920 | J8: 2 | K8: =ROUNDUP(RC[-8]^0.5,0)*2+2 -> 10 | M8: =ROUND(RC[-8]*RC[-7]/RC[-6],0) -> 2700 | N8: =ROUND(RC[-5]*RC[-4]/RC[-3],0) -> 384 | P8: =RC[-3]&","&RC[-2]&";" -> 2700,384;
A9: =ctRandomPoint!R[1]C -> 6 | B9: =ctRandomPoint!R[1]C -> 3 | C9: =COUNTIFS(C2,RC[-1]) -> 16 | E9: =VLOOKUP(RC[-3],Sheet4!C3:C7,4,FALSE) -> 2700 | F9: 2 | G9: =INT(RC[-4]^0.5)*2+2 -> 10 | I9: =VLOOKUP(RC[-7],Sheet4!C3:C7,5,FALSE) -> 1920 | J9: =R[-5]C+2 -> 4 | K9: =ROUNDUP(RC[-8]^0.5,0)*2+2 -> 10 | M9: =ROUND(RC[-8]*RC[-7]/RC[-6],0) -> 540 | N9: =ROUND(RC[-5]*RC[-4]/RC[-3],0) -> 768 | P9: =RC[-3]&","&RC[-2]&";" -> 540,768;
A10: =ctRandomPoint!R[1]C -> 7 | B10: =ctRandomPoint!R[1]C -> 4 | C10: =COUNTIFS(C2,RC[-1]) -> 17 | E10: =VLOOKUP(RC[-3],Sheet4!C3:C7,4,FALSE) -> 3240 | F10: 4 | G10: =INT(RC[-4]^0.5)*2+2 -> 10 | I10: =VLOOKUP(RC[-7],Sheet4!C3:C7,5,FALSE) -> 2560 | J10: =R[-5]C+2 -> 4 | K10: =ROUNDUP(RC[-8]^0.5,0)*2+2 -> 12 | M10: =ROUND(RC[-8]*RC[-7]/RC[-6],0) -> 1296 | N10: =ROUND(RC[-5]*RC[-4]/RC[-3],0) -> 853 | P10: =RC[-3]&","&RC[-2]&";" -> 1296,853;
A11: =ctRandomPoint!R[1]C -> 8 | B11: =ctRandomPoint!R[1]C -> 4 | C11: =COUNTIFS(C2,RC[-1]) -> 17 | E11: =VLOOKUP(RC[-3],Sheet4!C3:C7,4,FALSE) -> 3240 | F11: 6 | G11: =INT(RC[-4]^0.5)*2+2 -> 10 | I11: =VLOOKUP(RC[-7],Sheet4!C3:C7,5,FALSE) -> 2560 | J11: =R[-5]C+2 -> 4 | K11: =ROUNDUP(RC[-8]^0.5,0)*2+2 -> 12 | M11: =ROUND(RC[-8]*RC[-7]/RC[-6],0) -> 1944 | N11: =ROUND(RC[-5]*RC[-4]/RC[-3],0) -> 853 | P11: =RC[-3]&","&RC[-2]&";" -> 1944,853;
A12: =ctRandomPoint!R[1]C -> 9 | B12: =ctRandomPoint!R[1]C -> 4 | C12: =COUNTIFS(C2,RC[-1]) -> 17 | E12: =VLOOKUP(RC[-3],Sheet4!C3:C7,4,FALSE) -> 3240 | F12: 8 | G12: =INT(RC[-4]^0.5)*2+2 -> 10 | I12: =VLOOKUP(RC[-7],Sheet4!C3:C7,5,FALSE) -> 2560 | J12: =R[-5]C+2 -> 4 | K12: =ROUNDUP(RC[-8]^0.5,0)*2+2 -> 12 | M12: =ROUND(RC[-8]*RC[-7]/RC[-6],0) -> 2592 | N12: =ROUND(RC[-5]*RC[-4]/RC[-3],0) -> 853 | P12: =RC[-3]&","&RC[-2]&";" -> 2592,853;
A13: =ctRandomPoint!R[1]C -> 10 | B13: =ctRandomPoint!R[1]C -> 5 | C13: =COUNTIFS(C2,RC[-1]) -> 16 | E13: =VLOOKUP(RC[-3],Sheet4!C3:C7,4,FALSE) -> 2700 | F13: 10 | G13: =INT(RC[-4]^0.5)*2+2 -> 10 | I13: =VLOOKUP(RC[-7],Sheet4!C3:C7,5,FALSE) -> 1920 | J13: =R[-5]C+2 -> 4 | K13: =ROUNDUP(RC[-8]^0.5,0)*2+2 -> 10 | M13: =ROUND(RC[-8]*RC[-7]/RC[-6],0) -> 2700 | N13: =ROUND(RC[-5]*RC[-4]/RC[-3],0) -> 768 | P13: =RC[-3]&","&RC[-2]&";" -> 2700,768;
A14: =ctRandomPoint!R[36]C -> 46 | B14: =ctRandomPoint!R[36]C -> 1 | C14: =COUNTIFS(C2,RC[-1]) -> 20 | E14: =VLOOKUP(RC[-3],Sheet4!C3:C7,4,FALSE) -> 3240 | F14: 2 | G14: 10 | I14: =VLOOKUP(RC[-7],Sheet4!C3:C7,5,FALSE) -> 1920 | J14: =R[-3]C+2 -> 6 | K14: =ROUNDUP(RC[-8]^0.5,0)*2+2 -> 12 | M14: =ROUND(RC[-8]*RC[-7]/RC[-6],0) -> 648 | N14: =ROUND(RC[-5]*RC[-4]/RC[-3],0) -> 960 | P14: =RC[-3]&","&RC[-2]&";" -> 648,960;
A15: =ctRandomPoint!R[36]C -> 47 | B15: =ctRandomPoint!R[36]C -> 1 | C15: =COUNTIFS(C2,RC[-1]) -> 20 | E15: =VLOOKUP(RC[-3],Sheet4!C3:C7,4,FALSE) -> 3240 | F15: 4 | G15: 10 | I15: =VLOOKUP(RC[-7],Sheet4!C3:C7,5,FALSE) -> 1920 | J15: =R[-3]C+2 -> 6 | K15: =ROUNDUP(RC[-8]^0.5,0)*2+2 -> 12 | M15: =ROUND(RC[-8]*RC[-7]/RC[-6],0) -> 1296 | N15: =ROUND(RC[-5]*RC[-4]/RC[-3],0) -> 960 | P15: =RC[-3]&","&RC[-2]&";" -> 1296,960;
A16: =ctRandomPoint!R[36]C -> 48 | B16: =ctRandomPoint!R[36]C -> 1 | C16: =COUNTIFS(C2,RC[-1]) -> 20 | E16: =VLOOKUP(RC[-3],Sheet4!C3:C7,4,FALSE) -> 3240 | F16: 6 | G16: 10 | I16: =VLOOKUP(RC[-7],Sheet4!C3:C7,5,FALSE) -> 1920 | J16: =R[-3]C+2 -> 6 | K16: =ROUNDUP(RC[-8]^0.5,0)*2+2 -> 12 | M16: =ROUND(RC[-8]*RC[-7]/RC[-6],0) -> 1944 | N16: =ROUND(RC[-5]*RC[-4]/RC[-3],0) -> 960 | P16: =RC[-3]&","&RC[-2]&";" -> 1944,960;
A17: =ctRandomPoint!R[36]C -> 49 | B17: =ctRandomPoint!R[36]C -> 1 | C17: =COUNTIFS(C2,RC[-1]) -> 20 | E17: =VLOOKUP(RC[-3],Sheet4!C3:C7,4,FALSE) -> 3240 | F17: 8 | G17: 10 | I17: =VLOOKUP(RC[-7],Sheet4!C3:C7,5,FALSE) -> 1920 | J17: =R[-3]C+2 -> 8 | K17: =ROUNDUP(RC[-8]^0.5,0)*2+2 -> 12 | M17: =ROUND(RC[-8]*RC[-7]/RC[-6],0) -> 2592 | N17: =ROUND(RC[-5]*RC[-4]/RC[-3],0) -> 1280 | P17: =RC[-3]&","&RC[-2]&";" -> 2592,1280;
A18: =ctRandomPoint!R[36]C -> 50 | B18: =ctRandomPoint!R[36]C -> 1 | C18: =COUNTIFS(C2,RC[-1]) -> 20 | E18: =VLOOKUP(RC[-3],Sheet4!C3:C7,4,FALSE) -> 3240 | F18: 2 | G18: =INT(RC[-4]^0.5)*2+2 -> 10 | I18: =VLOOKUP(RC[-7],Sheet4!C3:C7,5,FALSE) -> 1920 | J18: 6 | K18: =ROUNDUP(RC[-8]^0.5,0)*2+2 -> 12 | M18: =ROUND(RC[-8]*RC[-7]/RC[-6],0) -> 648 | N18: =ROUND(RC[-5]*RC[-4]/RC[-3],0) -> 960 | P18: =RC[-3]&","&RC[-2]&";" -> 648,960;
A19: =ctRandomPoint!R[36]C -> 51 | B19: =ctRandomPoint!R[36]C -> 1 | C19: =COUNTIFS(C2,RC[-1]) -> 20 | E19: =VLOOKUP(RC[-3],Sheet4!C3:C7,4,FALSE) -> 3240 | F19: 4 | G19: =INT(RC[-4]^0.5)*2+2 -> 10 | I19: =VLOOKUP(RC[-7],Sheet4!C3:C7,5,FALSE) -> 1920 | J19: 6 | K19: =ROUNDUP(RC[-8]^0.5,0)*2+2 -> 12 | M19: =ROUND(RC[-8]*RC[-7]/RC[-6],0) -> 1296 | N19: =ROUND(RC[-5]*RC[-4]/RC[-3],0) -> 960 | P19: =RC[-3]&","&RC[-2]&";" -> 1296,960;
A20: =ctRandomPoint!R[36]C -> 52 | B20: =ctRandomPoint!R[36]C -> 1 | C20: =COUNTIFS(C2,RC[-1]) -> 20 | E20: =VLOOKUP(RC[-3],Sheet4!C3:C7,4,FALSE) -> 3240 | F20: 6 | G20: =INT(RC[-4]^0.5)*2+2 -> 10 | I20: =VLOOKUP(RC[-7],Sheet4!C3:C7,5,FALSE) -> 1920 | J20: 6 | K20: =ROUNDUP(RC[-8]^0.5,0)*2+2 -> 12 | M20: =ROUND(RC[-8]*RC[-7]/RC[-6],0) -> 1944 | N20: =ROUND(RC[-5]*RC[-4]/RC[-3],0) -> 960 | P20: =RC[-3]&","&RC[-2]&";" -> 1944,960;
A21: =ctRandomPoint!R[36]C -> 53 | B21: =ctRandomPoint!R[36]C -> 1 | C21: =COUNTIFS(C2,RC[-1]) -> 20 | E21: =VLOOKUP(RC[-3],Sheet4!C3:C7,4,FALSE) -> 3240 | F21: 2 | G21: =INT(RC[-4]^0.5)*2+2 -> 10 | I21: =VLOOKUP(RC[-7],Sheet4!C3:C7,5,FALSE) -> 1920 | J21: 8 | K21: =ROUNDUP(RC[-8]^0.5,0)*2+2 -> 12 | M21: =ROUND(RC[-8]*RC[-7]/RC[-6],0) -> 648 | N21: =ROUND(RC[-5]*RC[-4]/RC[-3],0) -> 1280 | P21: =RC[-3]&","&RC[-2]&";" -> 648,1280;
A22: =ctRandomPoint!R[36]C -> 54 | B22: =ctRandomPoint!R[36]C -> 1 | C22: =COUNTIFS(C2,RC[-1]) -> 20 | E22: =VLOOKUP(RC[-3],Sheet4!C3:C7,4,FALSE) -> 3240 | F22: 4 | G22: =INT(RC[-4]^0.5)*2+2 -> 10 | I22: =VLOOKUP(RC[-7],Sheet4!C3:C7,5,FALSE) -> 1920 | J22: 8 | K22: =ROUNDUP(RC[-8]^0.5,0)*2+2 -> 12 | M22: =ROUND(RC[-8]*RC[-7]/RC[-6],0) -> 1296 | N22: =ROUND(RC[-5]*RC[-4]/RC[-3],0) -> 1280 | P22: =RC[-3]&","&RC[-2]&";" -> 1296,1280;
A23: =ctRandomPoint!R[36]C -> 55 | B23: =ctRandomPoint!R[36]C -> 1 | C23: =COUNTIFS(C2,RC[-1]) -> 20 | E23: =VLOOKUP(RC[-3],Sheet4!C3:C7,4,FALSE) -> 3240 | F23: 6 | G23: =INT(RC[-4]^0.5)*2+2 -> 10 | I23: =VLOOKUP(RC[-7],Sheet4!C3:C7,5,FALSE) -> 1920 | J23: 8 | K23: =ROUNDUP(RC[-8]^0.5,0)*2+2 -> 12 | M23: =ROUND(RC[-8]*RC[-7]/RC[-6],0) -> 1944 | N23: =ROUND(RC[-5]*RC[-4]/RC[-3],0) -> 1280 | P23: =RC[-3]&","&RC[-2]&";" -> 1944,1280;
A24: =ctRandomPoint!R[62]C -> 82 | B24: =ctRandomPoint!R[62]C -> 1 | C24: =COUNTIFS(C2,RC[-1]) -> 20 | E24: =VLOOKUP(RC[-3],Sheet4!C3:C7,4,FALSE) -> 3240 | F24: 6 | G24: =INT(RC[-4]^0.5)*2+2 -> 10 | I24: =VLOOKUP(RC[-7],Sheet4!C3:C7,5,FALSE) -> 1920 | J24: 8 | K24: =ROUNDUP(RC[-8]^0.5,0)*2+2 -> 12 | M24: =ROUND(RC[-8]*RC[-7]/RC[-6],0) -> 1944 | N24: =ROUND(RC[-5]*RC[-4]/RC[-3],0) -> 1280 | P24: =RC[-3]&","&RC[-2]&";" -> 1944,1280;
A25: =ctRandomPoint!R[62]C -> 83 | B25: =ctRandomPoint!R[62]C -> 1 | C25: =COUNTIFS(C2,RC[-1]) -> 20 | E25: =VLOOKUP(RC[-3],Sheet4!C3:C7,4,FALSE) -> 3240 | F25: 2 | G25: =INT(RC[-4]^0.5)*2+2 -> 10 | I25: =VLOOKUP(RC[-7],Sheet4!C3:C7,5,FALSE) -> 1920 | J25: 2 | K25: =ROUNDUP(RC[-8]^0.5,0)*2+2 -> 12 | M25: =ROUND(RC[-8]*RC[-7]/RC[-6],0) -> 648 | N25: =ROUND(RC[-5]*RC[-4]/RC[-3],0) -> 320 | P25: =RC[-3]&","&RC[-2]&";" -> 648,320;
A26: =ctRandomPoint!R[62]C -> 84 | B26: =ctRandomPoint!R[62]C -> 1 | C26: =COUNTIFS(C2,RC[-1]) -> 20 | E26: =VLOOKUP(RC[-3],Sheet4!C3:C7,4,FALSE) -> 3240 | F26: 4 | G26: =INT(RC[-4]^0.5)*2+2 -> 10 | I26: =VLOOKUP(RC[-7],Sheet4!C3:C7,5,FALSE) -> 1920 | J26: 2 | K26: =ROUNDUP(RC[-8]^0.5,0)*2+2 -> 12 | M26: =ROUND(RC[-8]*RC[-7]/RC[-6],0) -> 1296 | N26: =ROUND(RC[-5]*RC[-4]/RC[-3],0) -> 320 | P26: =RC[-3]&","&RC[-2]&";" -> 1296,320;
A27: =ctRandomPoint!R[62]C -> 85 | B27: =ctRandomPoint!R[62]C -> 1 | C27: =COUNTIFS(C2,RC[-1]) -> 20 | E27: =VLOOKUP(RC[-3],Sheet4!C3:C7,4,FALSE) -> 3240 | F27: 6 | G27: =INT(RC[-4]^0.5)*2+2 -> 10 | I27: =VLOOKUP(RC[-7],Sheet4!C3:C7,5,FALSE) -> 1920 | J27: 2 | K27: =ROUNDUP(RC[-8]^0.5,0)*2+2 -> 12 | M27: =ROUND(RC[-8]*RC[-7]/RC[-6],0) -> 1944 | N27: =ROUND(RC[-5]*RC[-4]/RC[-3],0) -> 320 | P27: =RC[-3]&","&RC[-2]&";" -> 1944,320;
A28: =ctRandomPoint!R[62]C -> 86 | B28: =ctRandomPoint!R[62]C -> 1 | C28: =COUNTIFS(C2,RC[-1]) -> 20 | E28: =VLOOKUP(RC[-3],Sheet4!C3:C7,4,FALSE) -> 3240 | F28: 2 | G28: 10 | I28: =VLOOKUP(RC[-7],Sheet4!C3:C7,5,FALSE) -> 1920 | J28: 4 | K28: =ROUNDUP(RC[-8]^0.5,0)*2+2 -> 12 | M28: =ROUND(RC[-8]*RC[-7]/RC[-6],0) -> 648 | N28: =ROUND(RC[-5]*RC[-4]/RC[-3],0) -> 640 | P28: =RC[-3]&","&RC[-2]&";" -> 648,640;
A29: =ctRandomPoint!R[62]C -> 87 | B29: =ctRandomPoint!R[62]C -> 1 | C29: =COUNTIFS(C2,RC[-1]) -> 20 | E29: =VLOOKUP(RC[-3],Sheet4!C3:C7,4,FALSE) -> 3240 | F29: 4 | G29: 10 | I29: =VLOOKUP(RC[-7],Sheet4!C3:C7,5,FALSE) -> 1920 | J29: 4 | K29: =ROUNDUP(RC[-8]^0.5,0)*2+2 -> 12 | M29: =ROUND(RC[-8]*RC[-7]/RC[-6],0) -> 1296 | N29: =ROUND(RC[-5]*RC[-4]/RC[-3],0) -> 640 | P29: =RC[-3]&","&RC[-2]&";" -> 1296,640;
A30: =ctRandomPoint!R[62]C -> 88 | B30: =ctRandomPoint!R[62]C -> 1 | C30: =COUNTIFS(C2,RC[-1]) -> 20 | E30: =VLOOKUP(RC[-3],Sheet4!C3:C7,4,FALSE) -> 3240 | F30: 6 | G30: 10 | I30: =VLOOKUP(RC[-7],Sheet4!C3:C7,5,FALSE) -> 1920 | J30: 4 | K30: =ROUNDUP(RC[-8]^0.5,0)*2+2 -> 12 | M30: =ROUND(RC[-8]*RC[-7]/RC[-6],0) -> 1944 | N30: =ROUND(RC[-5]*RC[-4]/RC[-3],0) -> 640 | P30: =RC[-3]&","&RC[-2]&";" -> 1944,640;
A31: =ctRandomPoint!R[62]C -> 89 | B31: =ctRandomPoint!R[62]C -> 1 | C31: =COUNTIFS(C2,RC[-1]) -> 20 | E31: =VLOOKUP(RC[-3],Sheet4!C3:C7,4,FALSE) -> 3240 | F31: 8 | G31: 10 | I31: =VLOOKUP(RC[-7],Sheet4!C3:C7,5,FALSE) -> 1920 | J31: 4 | K31: =ROUNDUP(RC[-8]^0.5,0)*2+2 -> 12 | M31: =ROUND(RC[-8]*RC[-7]/RC[-6],0) -> 2592 | N31: =ROUND(RC[-5]*RC[-4]/RC[-3],0) -> 640 | P31: =RC[-3]&","&RC[-2]&";" -> 2592,640;
A32: =ctRandomPoint!R[62]C -> 90 | B32: =ctRandomPoint!R[62]C -> 1 | C32: =COUNTIFS(C2,RC[-1]) -> 20 | E32: =VLOOKUP(RC[-3],Sheet4!C3:C7,4,FALSE) -> 3240 | F32: 2 | G32: =INT(RC[-4]^0.5)*2+2 -> 10 | I32: =VLOOKUP(RC[-7],Sheet4!C3:C7,5,FALSE) -> 1920 | J32: 6 | K32: =ROUNDUP(RC[-8]^0.5,0)*2+2 -> 12 | M32: =ROUND(RC[-8]*RC[-7]/RC[-6],0) -> 648 | N32: =ROUND(RC[-5]*RC[-4]/RC[-3],0) -> 960 | P32: =RC[-3]&","&RC[-2]&";" -> 648,960;
A33: =ctRandomPoint!R[62]C -> 91 | B33: =ctRandomPoint!R[62]C -> 1 | C33: =COUNTIFS(C2,RC[-1]) -> 20 | E33: =VLOOKUP(RC[-3],Sheet4!C3:C7,4,FALSE) -> 3240 | F33: 4 | G33: =INT(RC[-4]^0.5)*2+2 -> 10 | I33: =VLOOKUP(RC[-7],Sheet4!C3:C7,5,FALSE) -> 1920 | J33: 6 | K33: =ROUNDUP(RC[-8]^0.5,0)*2+2 -> 12 | M33: =ROUND(RC[-8]*RC[-7]/RC[-6],0) -> 1296 | N33: =ROUND(RC[-5]*RC[-4]/RC[-3],0) -> 960 | P33: =RC[-3]&","&RC[-2]&";" -> 1296,960;
A34: =ctRandomPoint!R[-14]C -> 16 | B34: =ctRandomPoint!R[-14]C -> 2 | C34: =COUNTIFS(C2,RC[-1]) -> 15 | E34: =VLOOKUP(RC[-3],Sheet4!C3:C7,4,FALSE) -> 2160 | F34: 2 | G34: =INT(RC[-4]^0.5)*2+2 -> 8 | I34: =VLOOKUP(RC[-7],Sheet4!C3:C7,5,FALSE) -> 1920 | J34: =R[-5]C+2 -> 6 | K34: =ROUNDUP(RC[-8]^0.5,0)*2+2 -> 10 | M34: =ROUND(RC[-8]*RC[-7]/RC[-6],0) -> 540 | N34: =ROUND(RC[-5]*RC[-4]/RC[-3],0) -> 1152 | P34: =RC[-3]&","&RC[-2]&";" -> 540,1152;
A35: =ctRandomPoint!R[-9]C -> 22 | B35: =ctRandomPoint!R[-9]C -> 2 | C35: =COUNTIFS(C2,RC[-1]) -> 15 | E35: =VLOOKUP(RC[-3],Sheet4!C3:C7,4,FALSE) -> 2160 | F35: 4 | G35: =INT(RC[-4]^0.5)*2+2 -> 8 | I35: =VLOOKUP(RC[-7],Sheet4!C3:C7,5,FALSE) -> 1920 | J35: =R[-5]C+2 -> 6 | K35: =ROUNDUP(RC[-8]^0.5,0)*2+2 -> 10 | M35: =ROUND(RC[-8]*RC[-7]/RC[-6],0) -> 1080 | N35: =ROUND(RC[-5]*RC[-4]/RC[-3],0) -> 1152 | P35: =RC[-3]&","&RC[-2]&";" -> 1080,1152;
A36: =ctRandomPoint!R[-9]C -> 23 | B36: =ctRandomPoint!R[-9]C -> 2 | C36: =COUNTIFS(C2,RC[-1]) -> 15 | E36: =VLOOKUP(RC[-3],Sheet4!C3:C7,4,FALSE) -> 2160 | F36: 6 | G36: =INT(RC[-4]^0.5)*2+2 -> 8 | I36: =VLOOKUP(RC[-7],Sheet4!C3:C7,5,FALSE) -> 1920 | J36: =R[-5]C+2 -> 6 | K36: =ROUNDUP(RC[-8]^0.5,0)*2+2 -> 10 | M36: =ROUND(RC[-8]*RC[-7]/RC[-6],0) -> 1620 | N36: =ROUND(RC[-5]*RC[-4]/RC[-3],0) -> 1152 | P36: =RC[-3]&","&RC[-2]&";" -> 1620,1152;
A37: =ctRandomPoint!R[-9]C -> 24 | B37: =ctRandomPoint!R[-9]C -> 2 | C37: =COUNTIFS(C2,RC[-1]) -> 15 | E37: =VLOOKUP(RC[-3],Sheet4!C3:C7,4,FALSE) -> 2160 | F37: 8 | G37: =INT(RC[-4]^0.5)*2+2 -> 8 | I37: =VLOOKUP(RC[-7],Sheet4!C3:C7,5,FALSE) -> 1920 | J37: =R[-5]C+2 -> 8 | K37: =ROUNDUP(RC[-8]^0.5,0)*2+2 -> 10 | M37: =ROUND(RC[-8]*RC[-7]/RC[-6],0) -> 2160 | N37: =ROUND(RC[-5]*RC[-4]/RC[-3],0) -> 1536 | P37: =RC[-3]&","&RC[-2]&";" -> 2160,1536;
A38: =ctRandomPoint!R[-9]C -> 25 | B38: =ctRandomPoint!R[-9]C -> 2 | C38: =COUNTIFS(C2,RC[-1]) -> 15 | E38: =VLOOKUP(RC[-3],Sheet4!C3:C7,4,FALSE) -> 2160 | F38: 10 | G38: =INT(RC[-4]^0.5)*2+2 -> 8 | I38: =VLOOKUP(RC[-7],Sheet4!C3:C7,5,FALSE) -> 1920 | J38: =R[-5]C+2 -> 8 | K38: =ROUNDUP(RC[-8]^0.5,0)*2+2 -> 10 | M38: =ROUND(RC[-8]*RC[-7]/RC[-6],0) -> 2700 | N38: =ROUND(RC[-5]*RC[-4]/RC[-3],0) -> 1536 | P38: =RC[-3]&","&RC[-2]&";" -> 2700,1536;
A39: =ctRandomPoint!R[21]C -> 56 | B39: =ctRandomPoint!R[21]C -> 2 | C39: =COUNTIFS(C2,RC[-1]) -> 15 | E39: =VLOOKUP(RC[-3],Sheet4!C3:C7,4,FALSE) -> 2160 | F39: 2 | G39: =INT(RC[-4]^0.5)*2+2 -> 8 | I39: =VLOOKUP(RC[-7],Sheet4!C3:C7,5,FALSE) -> 1920 | J39: 2 | K39: =ROUNDUP(RC[-8]^0.5,0)*2+2 -> 10 | M39: =ROUND(RC[-8]*RC[-7]/RC[-6],0) -> 540 | N39: =ROUND(RC[-5]*RC[-4]/RC[-3],0) -> 384 | P39: =RC[-3]&","&RC[-2]&";" -> 540,384;
A40: =ctRandomPoint!R[21]C -> 57 | B40: =ctRandomPoint!R[21]C -> 2 | C40: =COUNTIFS(C2,RC[-1]) -> 15 | E40: =VLOOKUP(RC[-3],Sheet4!C3:C7,4,FALSE) -> 2160 | F40: 4 | G40: =INT(RC[-4]^0.5)*2+2 -> 8 | I40: =VLOOKUP(RC[-7],Sheet4!C3:C7,5,FALSE) -> 1920 | J40: 2 | K40: =ROUNDUP(RC[-8]^0.5,0)*2+2 -> 10 | M40: =ROUND(RC[-8]*RC[-7]/RC[-6],0) -> 1080 | N40: =ROUND(RC[-5]*RC[-4]/RC[-3],0) -> 384 | P40: =RC[-3]&","&RC[-2]&";" -> 1080,384;
A41: =ctRandomPoint!R[21]C -> 58 | B41: =ctRandomPoint!R[21]C -> 2 | C41: =COUNTIFS(C2,RC[-1]) -> 15 | E41: =VLOOKUP(RC[-3],Sheet4!C3:C7,4,FALSE) -> 2160 | F41: 6 | G41: =INT(RC[-4]^0.5)*2+2 -> 8 | I41: =VLOOKUP(RC[-7],Sheet4!C3:C7,5,FALSE) -> 1920 | J41: 2 | K41: =ROUNDUP(RC[-8]^0.5,0)*2+2 -> 10 | M41: =ROUND(RC[-8]*RC[-7]/RC[-6],0) -> 1620 | N41: =ROUND(RC[-5]*RC[-4]/RC[-3],0) -> 384 | P41: =RC[-3]&","&RC[-2]&";" -> 1620,384;
A42: =ctRandomPoint!R[21]C -> 59 | B42: =ctRandomPoint!R[21]C -> 2 | C42: =COUNTIFS(C2,RC[-1]) -> 15 | E42: =VLOOKUP(RC[-3],Sheet4!C3:C7,4,FALSE) -> 2160 | F42: 2 | G42: 10 | I42: =VLOOKUP(RC[-7],Sheet4!C3:C7,5,FALSE) -> 1920 | J42: 4 | K42: =ROUNDUP(RC[-8]^0.5,0)*2+2 -> 10 | M42: =ROUND(RC[-8]*RC[-7]/RC[-6],0) -> 432 | N42: =ROUND(RC[-5]*RC[-4]/RC[-3],0) -> 768 | P42: =RC[-3]&","&RC[-2]&";" -> 432,768;
A43: =ctRandomPoint!R[53]C -> 92 | B43: =ctRandomPoint!R[53]C -> 2 | C43: =COUNTIFS(C2,RC[-1]) -> 15 | E43: =VLOOKUP(RC[-3],Sheet4!C3:C7,4,FALSE) -> 2160 | F43: 6 | G43: =INT(RC[-4]^0.5)*2+2 -> 8 | I43: =VLOOKUP(RC[-7],Sheet4!C3:C7,5,FALSE) -> 1920 | J43: 6 | K43: =ROUNDUP(RC[-8]^0.5,0)*2+2 -> 10 | M43: =ROUND(RC[-8]*RC[-7]/RC[-6],0) -> 1620 | N43: =ROUND(RC[-5]*RC[-4]/RC[-3],0) -> 1152 | P43: =RC[-3]&","&RC[-2]&";" -> 1620,1152;
A44: =ctRandomPoint!R[53]C -> 93 | B44: =ctRandomPoint!R[53]C -> 2 | C44: =COUNTIFS(C2,RC[-1]) -> 15 | E44: =VLOOKUP(RC[-3],Sheet4!C3:C7,4,FALSE) -> 2160 | F44: 2 | G44: =INT(RC[-4]^0.5)*2+2 -> 8 | I44: =VLOOKUP(RC[-7],Sheet4!C3:C7,5,FALSE) -> 1920 | J44: 8 | K44: =ROUNDUP(RC[-8]^0.5,0)*2+2 -> 10 | M44: =ROUND(RC[-8]*RC[-7]/RC[-6],0) -> 540 | N44: =ROUND(RC[-5]*RC[-4]/RC[-3],0) -> 1536 | P44: =RC[-3]&","&RC[-2]&";" -> 540,1536;
A45: =ctRandomPoint!R[53]C -> 94 | B45: =ctRandomPoint!R[53]C -> 2 | C45: =COUNTIFS(C2,RC[-1]) -> 15 | E45: =VLOOKUP(RC[-3],Sheet4!C3:C7,4,FALSE) -> 2160 | F45: 4 | G45: =INT(RC[-4]^0.5)*2+2 -> 8 | I45: =VLOOKUP(RC[-7],Sheet4!C3:C7,5,FALSE) -> 1920 | J45: 8 | K45: =ROUNDUP(RC[-8]^0.5,0)*2+2 -> 10 | M45: =ROUND(RC[-8]*RC[-7]/RC[-6],0) -> 1080 | N45: =ROUND(RC[-5]*RC[-4]/RC[-3],0) -> 1536 | P45: =RC[-3]&","&RC[-2]&";" -> 1080,1536;
A46: =ctRandomPoint!R[-25]C -> 17 | B46: =ctRandomPoint!R[-25]C -> 3 | C46: =COUNTIFS(C2,RC[-1]) -> 16 | E46: =VLOOKUP(RC[-3],Sheet4!C3:C7,4,FALSE) -> 2700 | F46: 4 | G46: =INT(RC[-4]^0.5)*2+2 -> 10 | I46: =VLOOKUP(RC[-7],Sheet4!C3:C7,5,FALSE) -> 1920 | J46: =R[-5]C+2 -> 4 | K46: =ROUNDUP(RC[-8]^0.5,0)*2+2 -> 10 | M46: =ROUND(RC[-8]*RC[-7]/RC[-6],0) -> 1080 | N46: =ROUND(RC[-5]*RC[-4]/RC[-3],0) -> 768 | P46: =RC[-3]&","&RC[-2]&";" -> 1080,768;
A47: =ctRandomPoint!R[-17]C -> 26 | B47: =ctRandomPoint!R[-17]C -> 3 | C47: =COUNTIFS(C2,RC[-1]) -> 16 | E47: =VLOOKUP(RC[-3],Sheet4!C3:C7,4,FALSE) -> 2700 | F47: 2 | G47: =INT(RC[-4]^0.5)*2+2 -> 10 | I47: =VLOOKUP(RC[-7],Sheet4!C3:C7,5,FALSE) -> 1920 | J47: =R[-5]C+2 -> 6 | K47: =ROUNDUP(RC[-8]^0.5,0)*2+2 -> 10 | M47: =ROUND(RC[-8]*RC[-7]/RC[-6],0) -> 540 | N47: =ROUND(RC[-5]*RC[-4]/RC[-3],0) -> 1152 | P47: =RC[-3]&","&RC[-2]&";" -> 540,1152;
A48: =ctRandomPoint!R[-17]C -> 27 | B48: =ctRandomPoint!R[-17]C -> 3 | C48: =COUNTIFS(C2,RC[-1]) -> 16 | E48: =VLOOKUP(RC[-3],Sheet4!C3:C7,4,FALSE) -> 2700 | F48: 4 | G48: =INT(RC[-4]^0.5)*2+2 -> 10 | I48: =VLOOKUP(RC[-7],Sheet4!C3:C7,5,FALSE) -> 1920 | J48: =R[-5]C+2 -> 8 | K48: =ROUNDUP(RC[-8]^0.5,0)*2+2 -> 10 | M48: =ROUND(RC[-8]*RC[-7]/RC[-6],0) -> 1080 | N48: =ROUND(RC[-5]*RC[-4]/RC[-3],0) -> 1536 | P48: =RC[-3]&","&RC[-2]&";" -> 1080,1536;
A49: =ctRandomPoint!R[-17]C -> 28 | B49: =ctRandomPoint!R[-17]C -> 3 | C49: =COUNTIFS(C2,RC[-1]) -> 16 | E49: =VLOOKUP(RC[-3],Sheet4!C3:C7,4,FALSE) -> 2700 | F49: 6 | G49: =INT(RC[-4]^0.5)*2+2 -> 10 | I49: =VLOOKUP(RC[-7],Sheet4!C3:C7,5,FALSE) -> 1920 | J49: =R[-5]C+2 -> 10 | K49: =ROUNDUP(RC[-8]^0.5,0)*2+2 -> 10 | M49: =ROUND(RC[-8]*RC[-7]/RC[-6],0) -> 1620 | N49: =ROUND(RC[-5]*RC[-4]/RC[-3],0) -> 1920 | P49: =RC[-3]&","&RC[-2]&";" -> 1620,1920;
A50: =ctRandomPoint!R[-17]C -> 29 | B50: =ctRandomPoint!R[-17]C -> 3 | C50: =COUNTIFS(C2,RC[-1]) -> 16 | E50: =VLOOKUP(RC[-3],Sheet4!C3:C7,4,FALSE) -> 2700 | F50: 8 | G50: =INT(RC[-4]^0.5)*2+2 -> 10 | I50: =VLOOKUP(RC[-7],Sheet4!C3:C7,5,FALSE) -> 1920 | J50: =R[-5]C+2 -> 10 | K50: =ROUNDUP(RC[-8]^0.5,0)*2+2 -> 10 | M50: =ROUND(RC[-8]*RC[-7]/RC[-6],0) -> 2160 | N50: =ROUND(RC[-5]*RC[-4]/RC[-3],0) -> 1920 | P50: =RC[-3]&","&RC[-2]&";" -> 2160,1920;
A51: =ctRandomPoint!R[13]C -> 60 | B51: =ctRandomPoint!R[13]C -> 3 | C51: =COUNTIFS(C2,RC[-1]) -> 16 | E51: =VLOOKUP(RC[-3],Sheet4!C3:C7,4,FALSE) -> 2700 | F51: 4 | G51: 10 | I51: =VLOOKUP(RC[-7],Sheet4!C3:C7,5,FALSE) -> 1920 | J51: 4 | K51: =ROUNDUP(RC[-8]^0.5,0)*2+2 -> 10 | M51: =ROUND(RC[-8]*RC[-7]/RC[-6],0) -> 1080 | N51: =ROUND(RC[-5]*RC[-4]/RC[-3],0) -> 768 | P51: =RC[-3]&","&RC[-2]&";" -> 1080,768;
A52: =ctRandomPoint!R[13]C -> 61 | B52: =ctRandomPoint!R[13]C -> 3 | C52: =COUNTIFS(C2,RC[-1]) -> 16 | E52: =VLOOKUP(RC[-3],Sheet4!C3:C7,4,FALSE) -> 2700 | F52: 6 | G52: 10 | I52: =VLOOKUP(RC[-7],Sheet4!C3:C7,5,FALSE) -> 1920 | J52: 4 | K52: =ROUNDUP(RC[-8]^0.5,0)*2+2 -> 10 | M52: =ROUND(RC[-8]*RC[-7]/RC[-6],0) -> 1620 | N52: =ROUND(RC[-5]*RC[-4]/RC[-3],0) -> 768 | P52: =RC[-3]&","&RC[-2]&";" -> 1620,768;
A53: =ctRandomPoint!R[13]C -> 62 | B53: =ctRandomPoint!R[13]C -> 3 | C53: =COUNTIFS(C2,RC[-1]) -> 16 | E53: =VLOOKUP(RC[-3],Sheet4!C3:C7,4,FALSE) -> 2700 | F53: 8 | G53: 10 | I53: =VLOOKUP(RC[-7],Sheet4!C3:C7,5,FALSE) -> 1920 | J53: 4 | K53: =ROUNDUP(RC[-8]^0.5,0)*2+2 -> 10 | M53: =ROUND(RC[-8]*RC[-7]/RC[-6],0) -> 2160 | N53: =ROUND(RC[-5]*RC[-4]/RC[-3],0) -> 768 | P53: =RC[-3]&","&RC[-2]&";" -> 2160,768;
A54: =ctRandomPoint!R[13]C -> 63 | B54: =ctRandomPoint!R[13]C -> 3 | C54: =COUNTIFS(C2,RC[-1]) -> 16 | E54: =VLOOKUP(RC[-3],Sheet4!C3:C7,4,FALSE) -> 2700 | F54: 2 | G54: 10 | I54: =VLOOKUP(RC[-7],Sheet4!C3:C7,5,FALSE) -> 1920 | J54: 6 | K54: =ROUNDUP(RC[-8]^0.5,0)*2+2 -> 10 | M54: =ROUND(RC[-8]*RC[-7]/RC[-6],0) -> 540 | N54: =ROUND(RC[-5]*RC[-4]/RC[-3],0) -> 1152 | P54: =RC[-3]&","&RC[-2]&";" -> 540,1152;
A55: =ctRandomPoint!R[44]C -> 95 | B55: =ctRandomPoint!R[44]C -> 3 | C55: =COUNTIFS(C2,RC[-1]) -> 16 | E55: =VLOOKUP(RC[-3],Sheet4!C3:C7,4,FALSE) -> 2700 | F55: 6 | G55: =INT(RC[-4]^0.5)*2+2 -> 10 | I55: =VLOOKUP(RC[-7],Sheet4!C3:C7,5,FALSE) -> 1920 | J55: 8 | K55: =ROUNDUP(RC[-8]^0.5,0)*2+2 -> 10 | M55: =ROUND(RC[-8]*RC[-7]/RC[-6],0) -> 1620 | N55: =ROUND(RC[-5]*RC[-4]/RC[-3],0) -> 1536 | P55: =RC[-3]&","&RC[-2]&";" -> 1620,1536;
A56: =ctRandomPoint!R[44]C -> 96 | B56: =ctRandomPoint!R[44]C -> 3 | C56: =COUNTIFS(C2,RC[-1]) -> 16 | E56: =VLOOKUP(RC[-3],Sheet4!C3:C7,4,FALSE) -> 2700 | F56: 2 | G56: =INT(RC[-4]^0.5)*2+2 -> 10 | I56: =VLOOKUP(RC[-7],Sheet4!C3:C7,5,FALSE) -> 1920 | J56: 2 | K56: =ROUNDUP(RC[-8]^0.5,0)*2+2 -> 10 | M56: =ROUND(RC[-8]*RC[-7]/RC[-6],0) -> 540 | N56: =ROUND(RC[-5]*RC[-4]/RC[-3],0) -> 384 | P56: =RC[-3]&","&RC[-2]&";" -> 540,384;
A57: =ctRandomPoint!R[44]C -> 97 | B57: =ctRandomPoint!R[44]C -> 3 | C57: =COUNTIFS(C2,RC[-1]) -> 16 | E57: =VLOOKUP(RC[-3],Sheet4!C3:C7,4,FALSE) -> 2700 | F57: 4 | G57: =INT(RC[-4]^0.5)*2+2 -> 10 | I57: =VLOOKUP(RC[-7],Sheet4!C3:C7,5,FALSE) -> 1920 | J57: 2 | K57: =ROUNDUP(RC[-8]^0.5,0)*2+2 -> 10 | M57: =ROUND(RC[-8]*RC[-7]/RC[-6],0) -> 1080 | N57: =ROUND(RC[-5]*RC[-4]/RC[-3],0) -> 384 | P57: =RC[-3]&","&RC[-2]&";" -> 1080,384;
A58: =ctRandomPoint!R[44]C -> 98 | B58: =ctRandomPoint!R[44]C -> 3 | C58: =COUNTIFS(C2,RC[-1]) -> 16 | E58: =VLOOKUP(RC[-3],Sheet4!C3:C7,4,FALSE) -> 2700 | F58: 6 | G58: =INT(RC[-4]^0.5)*2+2 -> 10 | I58: =VLOOKUP(RC[-7],Sheet4!C3:C7,5,FALSE) -> 1920 | J58: 2 | K58: =ROUNDUP(RC[-8]^0.5,0)*2+2 -> 10 | M58: =ROUND(RC[-8]*RC[-7]/RC[-6],0) -> 1620 | N58: =ROUND(RC[-5]*RC[-4]/RC[-3],0) -> 384 | P58: =RC[-3]&","&RC[-2]&";" -> 1620,384;
A59: =ctRandomPoint!R[-37]C -> 18 | B59: =ctRandomPoint!R[-37]C -> 4 | C59: =COUNTIFS(C2,RC[-1]) -> 17 | E59: =VLOOKUP(RC[-3],Sheet4!C3:C7,4,FALSE) -> 3240 | F59: 6 | G59: =INT(RC[-4]^0.5)*2+2 -> 10 | I59: =VLOOKUP(RC[-7],Sheet4!C3:C7,5,FALSE) -> 2560 | J59: =R[-5]C+2 -> 8 | K59: =ROUNDUP(RC[-8]^0.5,0)*2+2 -> 12 | M59: =ROUND(RC[-8]*RC[-7]/RC[-6],0) -> 1944 | N59: =ROUND(RC[-5]*RC[-4]/RC[-3],0) -> 1707 | P59: =RC[-3]&","&RC[-2]&";" -> 1944,1707;
A60: =ctRandomPoint!R[-26]C -> 30 | B60: =ctRandomPoint!R[-26]C -> 4 | C60: =COUNTIFS(C2,RC[-1]) -> 17 | E60: =VLOOKUP(RC[-3],Sheet4!C3:C7,4,FALSE) -> 3240 | F60: 10 | G60: =INT(RC[-4]^0.5)*2+2 -> 10 | I60: =VLOOKUP(RC[-7],Sheet4!C3:C7,5,FALSE) -> 2560 | J60: =R[-5]C+2 -> 10 | K60: =ROUNDUP(RC[-8]^0.5,0)*2+2 -> 12 | M60: =ROUND(RC[-8]*RC[-7]/RC[-6],0) -> 3240 | N60: =ROUND(RC[-5]*RC[-4]/RC[-3],0) -> 2133 | P60: =RC[-3]&","&RC[-2]&";" -> 3240,2133;
A61: =ctRandomPoint!R[-26]C -> 31 | B61: =ctRandomPoint!R[-26]C -> 4 | C61: =COUNTIFS(C2,RC[-1]) -> 17 | E61: =VLOOKUP(RC[-3],Sheet4!C3:C7,4,FALSE) -> 3240 | F61: 2 | G61: =INT(RC[-4]^0.5)*2+2 -> 10 | I61: =VLOOKUP(RC[-7],Sheet4!C3:C7,5,FALSE) -> 2560 | J61: 2 | K61: =ROUNDUP(RC[-8]^0.5,0)*2+2 -> 12 | M61: =ROUND(RC[-8]*RC[-7]/RC[-6],0) -> 648 | N61: =ROUND(RC[-5]*RC[-4]/RC[-3],0) -> 427 | P61: =RC[-3]&","&RC[-2]&";" -> 648,427;
A62: =ctRandomPoint!R[-26]C -> 32 | B62: =ctRandomPoint!R[-26]C -> 4 | C62: =COUNTIFS(C2,RC[-1]) -> 17 | E62: =VLOOKUP(RC[-3],Sheet4!C3:C7,4,FALSE) -> 3240 | F62: 4 | G62: =INT(RC[-4]^0.5)*2+2 -> 10 | I62: =VLOOKUP(RC[-7],Sheet4!C3:C7,5,FALSE) -> 2560 | J62: 2 | K62: =ROUNDUP(RC[-8]^0.5,0)*2+2 -> 12 | M62: =ROUND(RC[-8]*RC[-7]/RC[-6],0) -> 1296 | N62: =ROUND(RC[-5]*RC[-4]/RC[-3],0) -> 427 | P62: =RC[-3]&","&RC[-2]&";" -> 1296,427;
A63: =ctRandomPoint!R[-26]C -> 33 | B63: =ctRandomPoint!R[-26]C -> 4 | C63: =COUNTIFS(C2,RC[-1]) -> 17 | E63: =VLOOKUP(RC[-3],Sheet4!C3:C7,4,FALSE) -> 3240 | F63: 6 | G63: =INT(RC[-4]^0.5)*2+2 -> 10 | I63: =VLOOKUP(RC[-7],Sheet4!C3:C7,5,FALSE) -> 2560 | J63: 2 | K63: =ROUNDUP(RC[-8]^0.5,0)*2+2 -> 12 | M63: =ROUND(RC[-8]*RC[-7]/RC[-6],0) -> 1944 | N63: =ROUND(RC[-5]*RC[-4]/RC[-3],0) -> 427 | P63: =RC[-3]&","&RC[-2]&";" -> 1944,427;
A64: =ctRandomPoint!R[4]C -> 64 | B64: =ctRandomPoint!R[4]C -> 4 | C64: =COUNTIFS(C2,RC[-1]) -> 17 | E64: =VLOOKUP(RC[-3],Sheet4!C3:C7,4,FALSE) -> 3240 | F64: 4 | G64: 10 | I64: =VLOOKUP(RC[-7],Sheet4!C3:C7,5,FALSE) -> 2560 | J64: 6 | K64: =ROUNDUP(RC[-8]^0.5,0)*2+2 -> 12 | M64: =ROUND(RC[-8]*RC[-7]/RC[-6],0) -> 1296 | N64: =ROUND(RC[-5]*RC[-4]/RC[-3],0) -> 1280 | P64: =RC[-3]&","&RC[-2]&";" -> 1296,1280;
A65: =ctRandomPoint!R[4]C -> 65 | B65: =ctRandomPoint!R[4]C -> 4 | C65: =COUNTIFS(C2,RC[-1]) -> 17 | E65: =VLOOKUP(RC[-3],Sheet4!C3:C7,4,FALSE) -> 3240 | F65: 6 | G65: 10 | I65: =VLOOKUP(RC[-7],Sheet4!C3:C7,5,FALSE) -> 2560 | J65: 6 | K65: =ROUNDUP(RC[-8]^0.5,0)*2+2 -> 12 | M65: =ROUND(RC[-8]*RC[-7]/RC[-6],0) -> 1944 | N65: =ROUND(RC[-5]*RC[-4]/RC[-3],0) -> 1280 | P65: =RC[-3]&","&RC[-2]&";" -> 1944,1280;
A66: =ctRandomPoint!R[4]C -> 66 | B66: =ctRandomPoint!R[4]C -> 4 | C66: =COUNTIFS(C2,RC[-1]) -> 17 | E66: =VLOOKUP(RC[-3],Sheet4!C3:C7,4,FALSE) -> 3240 | F66: 8 | G66: 10 | I66: =VLOOKUP(RC[-7],Sheet4!C3:C7,5,FALSE) -> 2560 | J66: 6 | K66: =ROUNDUP(RC[-8]^0.5,0)*2+2 -> 12 | M66: =ROUND(RC[-8]*RC[-7]/RC[-6],0) -> 2592 | N66: =ROUND(RC[-5]*RC[-4]/RC[-3],0) -> 1280 | P66: =RC[-3]&","&RC[-2]&";" -> 2592,1280;
A67: =ctRandomPoint!R[4]C -> 67 | B67: =ctRandomPoint!R[4]C -> 4 | C67: =COUNTIFS(C2,RC[-1]) -> 17 | E67: =VLOOKUP(RC[-3],Sheet4!C3:C7,4,FALSE) -> 3240 | F67: 2 | G67: =INT(RC[-4]^0.5)*2+2 -> 10 | I67: =VLOOKUP(RC[-7],Sheet4!C3:C7,5,FALSE) -> 2560 | J67: 8 | K67: =ROUNDUP(RC[-8]^0.5,0)*2+2 -> 12 | M67: =ROUND(RC[-8]*RC[-7]/RC[-6],0) -> 648 | N67: =ROUND(RC[-5]*RC[-4]/RC[-3],0) -> 1707 | P67: =RC[-3]&","&RC[-2]&";" -> 648,1707;
A68: =ctRandomPoint!R[4]C -> 68 | B68: =ctRandomPoint!R[4]C -> 4 | C68: =COUNTIFS(C2,RC[-1]) -> 17 | E68: =VLOOKUP(RC[-3],Sheet4!C3:C7,4,FALSE) -> 3240 | F68: 4 | G68: =INT(RC[-4]^0.5)*2+2 -> 10 | I68: =VLOOKUP(RC[-7],Sheet4!C3:C7,5,FALSE) -> 2560 | J68: 8 | K68: =ROUNDUP(RC[-8]^0.5,0)*2+2 -> 12 | M68: =ROUND(RC[-8]*RC[-7]/RC[-6],0) -> 1296 | N68: =ROUND(RC[-5]*RC[-4]/RC[-3],0) -> 1707 | P68: =RC[-3]&","&RC[-2]&";" -> 1296,1707;
A69: =ctRandomPoint!R[34]C -> 99 | B69: =ctRandomPoint!R[34]C -> 4 | C69: =COUNTIFS(C2,RC[-1]) -> 17 | E69: =VLOOKUP(RC[-3],Sheet4!C3:C7,4,FALSE) -> 3240 | F69: 8 | G69: =INT(RC[-4]^0.5)*2+2 -> 10 | I69: =VLOOKUP(RC[-7],Sheet4!C3:C7,5,FALSE) -> 2560 | J69: 2 | K69: =ROUNDUP(RC[-8]^0.5,0)*2+2 -> 12 | M69: =ROUND(RC[-8]*RC[-7]/RC[-6],0) -> 2592 | N69: =ROUND(RC[-5]*RC[-4]/RC[-3],0) -> 427 | P69: =RC[-3]&","&RC[-2]&";" -> 2592,427;
A70: =ctRandomPoint!R[34]C -> 100 | B70: =ctRandomPoint!R[34]C -> 4 | C70: =COUNTIFS(C2,RC[-1]) -> 17 | E70: =VLOOKUP(RC[-3],Sheet4!C3:C7,4,FALSE) -> 3240 | F70: 2 | G70: =INT(RC[-4]^0.5)*2+2 -> 10 | I70: =VLOOKUP(RC[-7],Sheet4!C3:C7,5,FALSE) -> 2560 | J70: =R[-4]C+2 -> 8 | K70: =ROUNDUP(RC[-8]^0.5,0)*2+2 -> 12 | M70: =ROUND(RC[-8]*RC[-7]/RC[-6],0) -> 648 | N70: =ROUND(RC[-5]*RC[-4]/RC[-3],0) -> 1707 | P70: =RC[-3]&","&RC[-2]&";" -> 648,1707;
A71: =ctRandomPoint!R[34]C -> 101 | B71: =ctRandomPoint!R[34]C -> 4 | C71: =COUNTIFS(C2,RC[-1]) -> 17 | E71: =VLOOKUP(RC[-3],Sheet4!C3:C7,4,FALSE) -> 3240 | F71: 4 | G71: =INT(RC[-4]^0.5)*2+2 -> 10 | I71: =VLOOKUP(RC[-7],Sheet4!C3:C7,5,FALSE) -> 2560 | J71: =R[-4]C+2 -> 10 | K71: =ROUNDUP(RC[-8]^0.5,0)*2+2 -> 12 | M71: =ROUND(RC[-8]*RC[-7]/RC[-6],0) -> 1296 | N71: =ROUND(RC[-5]*RC[-4]/RC[-3],0) -> 2133 | P71: =RC[-3]&","&RC[-2]&";" -> 1296,2133;
A72: =ctRandomPoint!R[34]C -> 102 | B72: =ctRandomPoint!R[34]C -> 4 | C72: =COUNTIFS(C2,RC[-1]) -> 17 | E72: =VLOOKUP(RC[-3],Sheet4!C3:C7,4,FALSE) -> 3240 | F72: 6 | G72: =INT(RC[-4]^0.5)*2+2 -> 10 | I72: =VLOOKUP(RC[-7],Sheet4!C3:C7,5,FALSE) -> 2560 | J72: =R[-4]C+2 -> 10 | K72: =ROUNDUP(RC[-8]^0.5,0)*2+2 -> 12 | M72: =ROUND(RC[-8]*RC[-7]/RC[-6],0) -> 1944 | N72: =ROUND(RC[-5]*RC[-4]/RC[-3],0) -> 2133 | P72: =RC[-3]&","&RC[-2]&";" -> 1944,2133;
A73: =ctRandomPoint!R[-50]C -> 19 | B73: =ctRandomPoint!R[-50]C -> 5 | C73: =COUNTIFS(C2,RC[-1]) -> 16 | E73: =VLOOKUP(RC[-3],Sheet4!C3:C7,4,FALSE) -> 2700 | F73: 8 | G73: =INT(RC[-4]^0.5)*2+2 -> 10 | I73: =VLOOKUP(RC[-7],Sheet4!C3:C7,5,FALSE) -> 1920 | J73: =R[-5]C+2 -> 10 | K73: =ROUNDUP(RC[-8]^0.5,0)*2+2 -> 10 | M73: =ROUND(RC[-8]*RC[-7]/RC[-6],0) -> 2160 | N73: =ROUND(RC[-5]*RC[-4]/RC[-3],0) -> 1920 | P73: =RC[-3]&","&RC[-2]&";" -> 2160,1920;
A74: =ctRandomPoint!R[-36]C -> 34 | B74: =ctRandomPoint!R[-36]C -> 5 | C74: =COUNTIFS(C2,RC[-1]) -> 16 | E74: =VLOOKUP(RC[-3],Sheet4!C3:C7,4,FALSE) -> 2700 | F74: 2 | G74: =INT(RC[-4]^0.5)*2+2 -> 10 | I74: =VLOOKUP(RC[-7],Sheet4!C3:C7,5,FALSE) -> 1920 | J74: =R[-3]C+2 -> 12 | K74: =ROUNDUP(RC[-8]^0.5,0)*2+2 -> 10 | M74: =ROUND(RC[-8]*RC[-7]/RC[-6],0) -> 540 | N74: =ROUND(RC[-5]*RC[-4]/RC[-3],0) -> 2304 | P74: =RC[-3]&","&RC[-2]&";" -> 540,2304;
A75: =ctRandomPoint!R[-36]C -> 35 | B75: =ctRandomPoint!R[-36]C -> 5 | C75: =COUNTIFS(C2,RC[-1]) -> 16 | E75: =VLOOKUP(RC[-3],Sheet4!C3:C7,4,FALSE) -> 2700 | F75: 4 | G75: =INT(RC[-4]^0.5)*2+2 -> 10 | I75: =VLOOKUP(RC[-7],Sheet4!C3:C7,5,FALSE) -> 1920 | J75: =R[-3]C+2 -> 12 | K75: =ROUNDUP(RC[-8]^0.5,0)*2+2 -> 10 | M75: =ROUND(RC[-8]*RC[-7]/RC[-6],0) -> 1080 | N75: =ROUND(RC[-5]*RC[-4]/RC[-3],0) -> 2304 | P75: =RC[-3]&","&RC[-2]&";" -> 1080,2304;
A76: =ctRandomPoint!R[-36]C -> 36 | B76: =ctRandomPoint!R[-36]C -> 5 | C76: =COUNTIFS(C2,RC[-1]) -> 16 | E76: =VLOOKUP(RC[-3],Sheet4!C3:C7,4,FALSE) -> 2700 | F76: 6 | G76: =INT(RC[-4]^0.5)*2+2 -> 10 | I76: =VLOOKUP(RC[-7],Sheet4!C3:C7,5,FALSE) -> 1920 | J76: =R[-3]C+2 -> 12 | K76: =ROUNDUP(RC[-8]^0.5,0)*2+2 -> 10 | M76: =ROUND(RC[-8]*RC[-7]/RC[-6],0) -> 1620 | N76: =ROUND(RC[-5]*RC[-4]/RC[-3],0) -> 2304 | P76: =RC[-3]&","&RC[-2]&";" -> 1620,2304;
A77: =ctRandomPoint!R[-36]C -> 37 | B77: =ctRandomPoint!R[-36]C -> 5 | C77: =COUNTIFS(C2,RC[-1]) -> 16 | E77: =VLOOKUP(RC[-3],Sheet4!C3:C7,4,FALSE) -> 2700 | F77: 2 | G77: =INT(RC[-4]^0.5)*2+2 -> 10 | I77: =VLOOKUP(RC[-7],Sheet4!C3:C7,5,FALSE) -> 1920 | J77: =R[-3]C+2 -> 14 | K77: =ROUNDUP(RC[-8]^0.5,0)*2+2 -> 10 | M77: =ROUND(RC[-8]*RC[-7]/RC[-6],0) -> 540 | N77: =ROUND(RC[-5]*RC[-4]/RC[-3],0) -> 2688 | P77: =RC[-3]&","&RC[-2]&";" -> 540,2688;
A78: =ctRandomPoint!R[-5]C -> 69 | B78: =ctRandomPoint!R[-5]C -> 5 | C78: =COUNTIFS(C2,RC[-1]) -> 16 | E78: =VLOOKUP(RC[-3],Sheet4!C3:C7,4,FALSE) -> 2700 | F78: 6 | G78: =INT(RC[-4]^0.5)*2+2 -> 10 | I78: =VLOOKUP(RC[-7],Sheet4!C3:C7,5,FALSE) -> 1920 | J78: 8 | K78: =ROUNDUP(RC[-8]^0.5,0)*2+2 -> 10 | M78: =ROUND(RC[-8]*RC[-7]/RC[-6],0) -> 1620 | N78: =ROUND(RC[-5]*RC[-4]/RC[-3],0) -> 1536 | P78: =RC[-3]&","&RC[-2]&";" -> 1620,1536;
A79: =ctRandomPoint!R[-5]C -> 70 | B79: =ctRandomPoint!R[-5]C -> 5 | C79: =COUNTIFS(C2,RC[-1]) -> 16 | E79: =VLOOKUP(RC[-3],Sheet4!C3:C7,4,FALSE) -> 2700 | F79: 2 | G79: =INT(RC[-4]^0.5)*2+2 -> 10 | I79: =VLOOKUP(RC[-7],Sheet4!C3:C7,5,FALSE) -> 1920 | J79: 2 | K79: =ROUNDUP(RC[-8]^0.5,0)*2+2 -> 10 | M79: =ROUND(RC[-8]*RC[-7]/RC[-6],0) -> 540 | N79: =ROUND(RC[-5]*RC[-4]/RC[-3],0) -> 384 | P79: =RC[-3]&","&RC[-2]&";" -> 540,384;
A80: =ctRandomPoint!R[-5]C -> 71 | B80: =ctRandomPoint!R[-5]C -> 5 | C80: =COUNTIFS(C2,RC[-1]) -> 16 | E80: =VLOOKUP(RC[-3],Sheet4!C3:C7,4,FALSE) -> 2700 | F80: 4 | G80: =INT(RC[-4]^0.5)*2+2 -> 10 | I80: =VLOOKUP(RC[-7],Sheet4!C3:C7,5,FALSE) -> 1920 | J80: 2 | K80: =ROUNDUP(RC[-8]^0.5,0)*2+2 -> 10 | M80: =ROUND(RC[-8]*RC[-7]/RC[-6],0) -> 1080 | N80: =ROUND(RC[-5]*RC[-4]/RC[-3],0) -> 384 | P80: =RC[-3]&","&RC[-2]&";" -> 1080,384;
A81: =ctRandomPoint!R[-5]C -> 72 | B81: =ctRandomPoint!R[-5]C -> 5 | C81: =COUNTIFS(C2,RC[-1]) -> 16 | E81: =VLOOKUP(RC[-3],Sheet4!C3:C7,4,FALSE) -> 2700 | F81: 6 | G81: =INT(RC[-4]^0.5)*2+2 -> 10 | I81: =VLOOKUP(RC[-7],Sheet4!C3:C7,5,FALSE) -> 1920 | J81: 2 | K81: =ROUNDUP(RC[-8]^0.5,0)*2+2 -> 10 | M81: =ROUND(RC[-8]*RC[-7]/RC[-6],0) -> 1620 | N81: =ROUND(RC[-5]*RC[-4]/RC[-3],0) -> 384 | P81: =RC[-3]&","&RC[-2]&";" -> 1620,384;
A82: =ctRandomPoint!R[25]C -> 103 | B82: =ctRandomPoint!R[25]C -> 5 | C82: =COUNTIFS(C2,RC[-1]) -> 16 | E82: =VLOOKUP(RC[-3],Sheet4!C3:C7,4,FALSE) -> 2700 | F82: 8 | G82: =INT(RC[-4]^0.5)*2+2 -> 10 | I82: =VLOOKUP(RC[-7],Sheet4!C3:C7,5,FALSE) -> 1920 | J82: =R[-4]C+2 -> 10 | K82: =ROUNDUP(RC[-8]^0.5,0)*2+2 -> 10 | M82: =ROUND(RC[-8]*RC[-7]/RC[-6],0) -> 2160 | N82: =ROUND(RC[-5]*RC[-4]/RC[-3],0) -> 1920 | P82: =RC[-3]&","&RC[-2]&";" -> 2160,1920;
A83: =ctRandomPoint!R[25]C -> 104 | B83: =ctRandomPoint!R[25]C -> 5 | C83: =COUNTIFS(C2,RC[-1]) -> 16 | E83: =VLOOKUP(RC[-3],Sheet4!C3:C7,4,FALSE) -> 2700 | F83: 2 | G83: =INT(RC[-4]^0.5)*2+2 -> 10 | I83: =VLOOKUP(RC[-7],Sheet4!C3:C7,5,FALSE) -> 1920 | J83: =R[-4]C+2 -> 4 | K83: =ROUNDUP(RC[-8]^0.5,0)*2+2 -> 10 | M83: =ROUND(RC[-8]*RC[-7]/RC[-6],0) -> 540 | N83: =ROUND(RC[-5]*RC[-4]/RC[-3],0) -> 768 | P83: =RC[-3]&","&RC[-2]&";" -> 540,768;
A84: =ctRandomPoint!R[25]C -> 105 | B84: =ctRandomPoint!R[25]C -> 5 | C84: =COUNTIFS(C2,RC[-1]) -> 16 | E84: =VLOOKUP(RC[-3],Sheet4!C3:C7,4,FALSE) -> 2700 | F84: 4 | G84: =INT(RC[-4]^0.5)*2+2 -> 10 | I84: =VLOOKUP(RC[-7],Sheet4!C3:C7,5,FALSE) -> 1920 | J84: =R[-4]C+2 -> 4 | K84: =ROUNDUP(RC[-8]^0.5,0)*2+2 -> 10 | M84: =ROUND(RC[-8]*RC[-7]/RC[-6],0) -> 1080 | N84: =ROUND(RC[-5]*RC[-4]/RC[-3],0) -> 768 | P84: =RC[-3]&","&RC[-2]&";" -> 1080,768;
A85: =ctRandomPoint!R[25]C -> 106 | B85: =ctRandomPoint!R[25]C -> 5 | C85: =COUNTIFS(C2,RC[-1]) -> 16 | E85: =VLOOKUP(RC[-3],Sheet4!C3:C7,4,FALSE) -> 2700 | F85: 6 | G85: =INT(RC[-4]^0.5)*2+2 -> 10 | I85: =VLOOKUP(RC[-7],Sheet4!C3:C7,5,FALSE) -> 1920 | J85: =R[-4]C+2 -> 4 | K85: =ROUNDUP(RC[-8]^0.5,0)*2+2 -> 10 | M85: =ROUND(RC[-8]*RC[-7]/RC[-6],0) -> 1620 | N85: =ROUND(RC[-5]*RC[-4]/RC[-3],0) -> 768 | P85: =RC[-3]&","&RC[-2]&";" -> 1620,768;
A86: =ctRandomPoint!R[-62]C -> 20 | B86: =ctRandomPoint!R[-62]C -> 6 | C86: =COUNTIFS(C2,RC[-1]) -> 16 | E86: =VLOOKUP(RC[-3],Sheet4!C3:C7,4,FALSE) -> 2160 | F86: 10 | G86: =INT(RC[-4]^0.5)*2+2 -> 10 | I86: =VLOOKUP(RC[-7],Sheet4!C3:C7,5,FALSE) -> 1920 | J86: =R[-5]C+2 -> 4 | K86: =ROUNDUP(RC[-8]^0.5,0)*2+2 -> 10 | M86: =ROUND(RC[-8]*RC[-7]/RC[-6],0) -> 2160 | N86: =ROUND(RC[-5]*RC[-4]/RC[-3],0) -> 768 | P86: =RC[-3]&","&RC[-2]&";" -> 2160,768;
A87: =ctRandomPoint!R[-45]C -> 38 | B87: =ctRandomPoint!R[-45]C -> 6 | C87: =COUNTIFS(C2,RC[-1]) -> 16 | E87: =VLOOKUP(RC[-3],Sheet4!C3:C7,4,FALSE) -> 2160 | F87: 4 | G87: =INT(RC[-4]^0.5)*2+2 -> 10 | I87: =VLOOKUP(RC[-7],Sheet4!C3:C7,5,FALSE) -> 1920 | J87: =R[-3]C+2 -> 6 | K87: =ROUNDUP(RC[-8]^0.5,0)*2+2 -> 10 | M87: =ROUND(RC[-8]*RC[-7]/RC[-6],0) -> 864 | N87: =ROUND(RC[-5]*RC[-4]/RC[-3],0) -> 1152 | P87: =RC[-3]&","&RC[-2]&";" -> 864,1152;
A88: =ctRandomPoint!R[-45]C -> 39 | B88: =ctRandomPoint!R[-45]C -> 6 | C88: =COUNTIFS(C2,RC[-1]) -> 16 | E88: =VLOOKUP(RC[-3],Sheet4!C3:C7,4,FALSE) -> 2160 | F88: 6 | G88: =INT(RC[-4]^0.5)*2+2 -> 10 | I88: =VLOOKUP(RC[-7],Sheet4!C3:C7,5,FALSE) -> 1920 | J88: =R[-3]C+2 -> 6 | K88: =ROUNDUP(RC[-8]^0.5,0)*2+2 -> 10 | M88: =ROUND(RC[-8]*RC[-7]/RC[-6],0) -> 1296 | N88: =ROUND(RC[-5]*RC[-4]/RC[-3],0) -> 1152 | P88: =RC[-3]&","&RC[-2]&";" -> 1296,1152;
A89: =ctRandomPoint!R[-45]C -> 40 | B89: =ctRandomPoint!R[-45]C -> 6 | C89: =COUNTIFS(C2,RC[-1]) -> 16 | E89: =VLOOKUP(RC[-3],Sheet4!C3:C7,4,FALSE) -> 2160 | F89: 2 | G89: =INT(RC[-4]^0.5)*2+2 -> 10 | I89: =VLOOKUP(RC[-7],Sheet4!C3:C7,5,FALSE) -> 1920 | J89: =R[-3]C+2 -> 6 | K89: =ROUNDUP(RC[-8]^0.5,0)*2+2 -> 10 | M89: =ROUND(RC[-8]*RC[-7]/RC[-6],0) -> 432 | N89: =ROUND(RC[-5]*RC[-4]/RC[-3],0) -> 1152 | P89: =RC[-3]&","&RC[-2]&";" -> 432,1152;
A90: =ctRandomPoint!R[-45]C -> 41 | B90: =ctRandomPoint!R[-45]C -> 6 | C90: =COUNTIFS(C2,RC[-1]) -> 16 | E90: =VLOOKUP(RC[-3],Sheet4!C3:C7,4,FALSE) -> 2160 | F90: 4 | G90: =INT(RC[-4]^0.5)*2+2 -> 10 | I90: =VLOOKUP(RC[-7],Sheet4!C3:C7,5,FALSE) -> 1920 | J90: =R[-3]C+2 -> 8 | K90: =ROUNDUP(RC[-8]^0.5,0)*2+2 -> 10 | M90: =ROUND(RC[-8]*RC[-7]/RC[-6],0) -> 864 | N90: =ROUND(RC[-5]*RC[-4]/RC[-3],0) -> 1536 | P90: =RC[-3]&","&RC[-2]&";" -> 864,1536;
A91: =ctRandomPoint!R[-14]C -> 73 | B91: =ctRandomPoint!R[-14]C -> 6 | C91: =COUNTIFS(C2,RC[-1]) -> 16 | E91: =VLOOKUP(RC[-3],Sheet4!C3:C7,4,FALSE) -> 2160 | F91: 2 | G91: 10 | I91: =VLOOKUP(RC[-7],Sheet4!C3:C7,5,FALSE) -> 1920 | J91: 4 | K91: =ROUNDUP(RC[-8]^0.5,0)*2+2 -> 10 | M91: =ROUND(RC[-8]*RC[-7]/RC[-6],0) -> 432 | N91: =ROUND(RC[-5]*RC[-4]/RC[-3],0) -> 768 | P91: =RC[-3]&","&RC[-2]&";" -> 432,768;
A92: =ctRandomPoint!R[-14]C -> 74 | B92: =ctRandomPoint!R[-14]C -> 6 | C92: =COUNTIFS(C2,RC[-1]) -> 16 | E92: =VLOOKUP(RC[-3],Sheet4!C3:C7,4,FALSE) -> 2160 | F92: 4 | G92: 10 | I92: =VLOOKUP(RC[-7],Sheet4!C3:C7,5,FALSE) -> 1920 | J92: 4 | K92: =ROUNDUP(RC[-8]^0.5,0)*2+2 -> 10 | M92: =ROUND(RC[-8]*RC[-7]/RC[-6],0) -> 864 | N92: =ROUND(RC[-5]*RC[-4]/RC[-3],0) -> 768 | P92: =RC[-3]&","&RC[-2]&";" -> 864,768;
A93: =ctRandomPoint!R[-14]C -> 75 | B93: =ctRandomPoint!R[-14]C -> 6 | C93: =COUNTIFS(C2,RC[-1]) -> 16 | E93: =VLOOKUP(RC[-3],Sheet4!C3:C7,4,FALSE) -> 2160 | F93: 6 | G93: 10 | I93: =VLOOKUP(RC[-7],Sheet4!C3:C7,5,FALSE) -> 1920 | J93: 4 | K93: =ROUNDUP(RC[-8]^0.5,0)*2+2 -> 10 | M93: =ROUND(RC[-8]*RC[-7]/RC[-6],0) -> 1296 | N93: =ROUND(RC[-5]*RC[-4]/RC[-3],0) -> 768 | P93: =RC[-3]&","&RC[-2]&";" -> 1296,768;
A94: =ctRandomPoint!R[-14]C -> 76 | B94: =ctRandomPoint!R[-14]C -> 6 | C94: =COUNTIFS(C2,RC[-1]) -> 16 | E94: =VLOOKUP(RC[-3],Sheet4!C3:C7,4,FALSE) -> 2160 | F94: 8 | G94: 10 | I94: =VLOOKUP(RC[-7],Sheet4!C3:C7,5,FALSE) -> 1920 | J94: 4 | K94: =ROUNDUP(RC[-8]^0.5,0)*2+2 -> 10 | M94: =ROUND(RC[-8]*RC[-7]/RC[-6],0) -> 1728 | N94: =ROUND(RC[-5]*RC[-4]/RC[-3],0) -> 768 | P94: =RC[-3]&","&RC[-2]&";" -> 1728,768;
A95: =ctRandomPoint!R[16]C -> 107 | B95: =ctRandomPoint!R[16]C -> 6 | C95: =COUNTIFS(C2,RC[-1]) -> 16 | E95: =VLOOKUP(RC[-3],Sheet4!C3:C7,4,FALSE) -> 2160 | F95: 8 | G95: =INT(RC[-4]^0.5)*2+2 -> 10 | I95: =VLOOKUP(RC[-7],Sheet4!C3:C7,5,FALSE) -> 1920 | J95: =R[-4]C+2 -> 6 | K95: =ROUNDUP(RC[-8]^0.5,0)*2+2 -> 10 | M95: =ROUND(RC[-8]*RC[-7]/RC[-6],0) -> 1728 | N95: =ROUND(RC[-5]*RC[-4]/RC[-3],0) -> 1152 | P95: =RC[-3]&","&RC[-2]&";" -> 1728,1152;
A96: =ctRandomPoint!R[16]C -> 108 | B96: =ctRandomPoint!R[16]C -> 6 | C96: =COUNTIFS(C2,RC[-1]) -> 16 | E96: =VLOOKUP(RC[-3],Sheet4!C3:C7,4,FALSE) -> 2160 | F96: 2 | G96: =INT(RC[-4]^0.5)*2+2 -> 10 | I96: =VLOOKUP(RC[-7],Sheet4!C3:C7,5,FALSE) -> 1920 | J96: =R[-4]C+2 -> 6 | K96: =ROUNDUP(RC[-8]^0.5,0)*2+2 -> 10 | M96: =ROUND(RC[-8]*RC[-7]/RC[-6],0) -> 432 | N96: =ROUND(RC[-5]*RC[-4]/RC[-3],0) -> 1152 | P96: =RC[-3]&","&RC[-2]&";" -> 432,1152;
A97: =ctRandomPoint!R[16]C -> 109 | B97: =ctRandomPoint!R[16]C -> 6 | C97: =COUNTIFS(C2,RC[-1]) -> 16 | E97: =VLOOKUP(RC[-3],Sheet4!C3:C7,4,FALSE) -> 2160 | F97: 4 | G97: =INT(RC[-4]^0.5)*2+2 -> 10 | I97: =VLOOKUP(RC[-7],Sheet4!C3:C7,5,FALSE) -> 1920 | J97: =R[-4]C+2 -> 6 | K97: =ROUNDUP(RC[-8]^0.5,0)*2+2 -> 10 | M97: =ROUND(RC[-8]*RC[-7]/RC[-6],0) -> 864 | N97: =ROUND(RC[-5]*RC[-4]/RC[-3],0) -> 1152 | P97: =RC[-3]&","&RC[-2]&";" -> 864,1152;
A98: =ctRandomPoint!R[16]C -> 110 | B98: =ctRandomPoint!R[16]C -> 6 | C98: =COUNTIFS(C2,RC[-1]) -> 16 | E98: =VLOOKUP(RC[-3],Sheet4!C3:C7,4,FALSE) -> 2160 | F98: 6 | G98: =INT(RC[-4]^0.5)*2+2 -> 10 | I98: =VLOOKUP(RC[-7],Sheet4!C3:C7,5,FALSE) -> 1920 | J98: =R[-4]C+2 -> 6 | K98: =ROUNDUP(RC[-8]^0.5,0)*2+2 -> 10 | M98: =ROUND(RC[-8]*RC[-7]/RC[-6],0) -> 1296 | N98: =ROUND(RC[-5]*RC[-4]/RC[-3],0) -> 1152 | P98: =RC[-3]&","&RC[-2]&";" -> 1296,1152;
A99: =ctRandomPoint!R[-84]C -> 11 | B99: =ctRandomPoint!R[-84]C -> 5 | C99: =COUNTIFS(C2,RC[-1]) -> 16 | E99: =VLOOKUP(RC[-3],Sheet4!C3:C7,4,FALSE) -> 2700 | F99: 2 | G99: =INT(RC[-4]^0.5)*2+2 -> 10 | I99: =VLOOKUP(RC[-7],Sheet4!C3:C7,5,FALSE) -> 1920 | J99: =R[-5]C+2 -> 6 | K99: =ROUNDUP(RC[-8]^0.5,0)*2+2 -> 10 | M99: =ROUND(RC[-8]*RC[-7]/RC[-6],0) -> 540 | N99: =ROUND(RC[-5]*RC[-4]/RC[-3],0) -> 1152 | P99: =RC[-3]&","&RC[-2]&";" -> 540,1152;
A100: =ctRandomPoint!R[-84]C -> 12 | B100: =ctRandomPoint!R[-84]C -> 5 | C100: =COUNTIFS(C2,RC[-1]) -> 16 | E100: =VLOOKUP(RC[-3],Sheet4!C3:C7,4,FALSE) -> 2700 | F100: 4 | G100: =INT(RC[-4]^0.5)*2+2 -> 10 | I100: =VLOOKUP(RC[-7],Sheet4!C3:C7,5,FALSE) -> 1920 | J100: =R[-5]C+2 -> 8 | K100: =ROUNDUP(RC[-8]^0.5,0)*2+2 -> 10 | M100: =ROUND(RC[-8]*RC[-7]/RC[-6],0) -> 1080 | N100: =ROUND(RC[-5]*RC[-4]/RC[-3],0) -> 1536 | P100: =RC[-3]&","&RC[-2]&";" -> 1080,1536;
A101: =ctRandomPoint!R[-84]C -> 13 | B101: =ctRandomPoint!R[-84]C -> 6 | C101: =COUNTIFS(C2,RC[-1]) -> 16 | E101: =VLOOKUP(RC[-3],Sheet4!C3:C7,4,FALSE) -> 2160 | F101: 6 | G101: =INT(RC[-4]^0.5)*2+2 -> 10 | I101: =VLOOKUP(RC[-7],Sheet4!C3:C7,5,FALSE) -> 1920 | J101: =R[-5]C+2 -> 8 | K101: =ROUNDUP(RC[-8]^0.5,0)*2+2 -> 10 | M101: =ROUND(RC[-8]*RC[-7]/RC[-6],0) -> 1296 | N101: =ROUND(RC[-5]*RC[-4]/RC[-3],0) -> 1536 | P101: =RC[-3]&","&RC[-2]&";" -> 1296,1536;
A102: =ctRandomPoint!R[-84]C -> 14 | B102: =ctRandomPoint!R[-84]C -> 6 | C102: =COUNTIFS(C2,RC[-1]) -> 16 | E102: =VLOOKUP(RC[-3],Sheet4!C3:C7,4,FALSE) -> 2160 | F102: 8 | G102: =INT(RC[-4]^0.5)*2+2 -> 10 | I102: =VLOOKUP(RC[-7],Sheet4!C3:C7,5,FALSE) -> 1920 | J102: =R[-5]C+2 -> 8 | K102: =ROUNDUP(RC[-8]^0.5,0)*2+2 -> 10 | M102: =ROUND(RC[-8]*RC[-7]/RC[-6],0) -> 1728 | N102: =ROUND(RC[-5]*RC[-4]/RC[-3],0) -> 1536 | P102: =RC[-3]&","&RC[-2]&";" -> 1728,1536;
A103: =ctRandomPoint!R[-84]C -> 15 | B103: =ctRandomPoint!R[-84]C -> 6 | C103: =COUNTIFS(C2,RC[-1]) -> 16 | E103: =VLOOKUP(RC[-3],Sheet4!C3:C7,4,FALSE) -> 2160 | F103: 10 | G103: =INT(RC[-4]^0.5)*2+2 -> 10 | I103: =VLOOKUP(RC[-7],Sheet4!C3:C7,5,FALSE) -> 1920 | J103: =R[-5]C+2 -> 8 | K103: =ROUNDUP(RC[-8]^0.5,0)*2+2 -> 10 | M103: =ROUND(RC[-8]*RC[-7]/RC[-6],0) -> 2160 | N103: =ROUND(RC[-5]*RC[-4]/RC[-3],0) -> 1536 | P103: =RC[-3]&","&RC[-2]&";" -> 2160,1536;
A104: =ctRandomPoint!R[-79]C -> 21 | B104: =ctRandomPoint!R[-79]C -> 8 | C104: =COUNTIFS(C2,RC[-1]) -> 14 | E104: =VLOOKUP(RC[-3],Sheet4!C3:C7,4,FALSE) -> 2700 | F104: 2 | G104: =INT(RC[-4]^0.5)*2+2 -> 8 | I104: =VLOOKUP(RC[-7],Sheet4!C3:C7,5,FALSE) -> 1920 | J104: =R[-5]C+2 -> 8 | K104: =ROUNDUP(RC[-8]^0.5,0)*2+2 -> 10 | M104: =ROUND(RC[-8]*RC[-7]/RC[-6],0) -> 675 | N104: =ROUND(RC[-5]*RC[-4]/RC[-3],0) -> 1536 | P104: =RC[-3]&","&RC[-2]&";" -> 675,1536;
A105: =ctRandomPoint!R[-59]C -> 42 | B105: =ctRandomPoint!R[-59]C -> 8 | C105: =COUNTIFS(C2,RC[-1]) -> 14 | E105: =VLOOKUP(RC[-3],Sheet4!C3:C7,4,FALSE) -> 2700 | F105: 6 | G105: =INT(RC[-4]^0.5)*2+2 -> 8 | I105: =VLOOKUP(RC[-7],Sheet4!C3:C7,5,FALSE) -> 1920 | J105: =R[-3]C+2 -> 10 | K105: =ROUNDUP(RC[-8]^0.5,0)*2+2 -> 10 | M105: =ROUND(RC[-8]*RC[-7]/RC[-6],0) -> 2025 | N105: =ROUND(RC[-5]*RC[-4]/RC[-3],0) -> 1920 | P105: =RC[-3]&","&RC[-2]&";" -> 2025,1920;
A106: =ctRandomPoint!R[-59]C -> 43 | B106: =ctRandomPoint!R[-59]C -> 8 | C106: =COUNTIFS(C2,RC[-1]) -> 14 | E106: =VLOOKUP(RC[-3],Sheet4!C3:C7,4,FALSE) -> 2700 | F106: 2 | G106: =INT(RC[-4]^0.5)*2+2 -> 8 | I106: =VLOOKUP(RC[-7],Sheet4!C3:C7,5,FALSE) -> 1920 | J106: 2 | K106: =ROUNDUP(RC[-8]^0.5,0)*2+2 -> 10 | M106: =ROUND(RC[-8]*RC[-7]/RC[-6],0) -> 675 | N106: =ROUND(RC[-5]*RC[-4]/RC[-3],0) -> 384 | P106: =RC[-3]&","&RC[-2]&";" -> 675,384;
A107: =ctRandomPoint!R[-59]C -> 44 | B107: =ctRandomPoint!R[-59]C -> 8 | C107: =COUNTIFS(C2,RC[-1]) -> 14 | E107: =VLOOKUP(RC[-3],Sheet4!C3:C7,4,FALSE) -> 2700 | F107: 4 | G107: =INT(RC[-4]^0.5)*2+2 -> 8 | I107: =VLOOKUP(RC[-7],Sheet4!C3:C7,5,FALSE) -> 1920 | J107: 2 | K107: =ROUNDUP(RC[-8]^0.5,0)*2+2 -> 10 | M107: =ROUND(RC[-8]*RC[-7]/RC[-6],0) -> 1350 | N107: =ROUND(RC[-5]*RC[-4]/RC[-3],0) -> 384 | P107: =RC[-3]&","&RC[-2]&";" -> 1350,384;
A108: =ctRandomPoint!R[-59]C -> 45 | B108: =ctRandomPoint!R[-59]C -> 8 | C108: =COUNTIFS(C2,RC[-1]) -> 14 | E108: =VLOOKUP(RC[-3],Sheet4!C3:C7,4,FALSE) -> 2700 | F108: 6 | G108: =INT(RC[-4]^0.5)*2+2 -> 8 | I108: =VLOOKUP(RC[-7],Sheet4!C3:C7,5,FALSE) -> 1920 | J108: 2 | K108: =ROUNDUP(RC[-8]^0.5,0)*2+2 -> 10 | M108: =ROUND(RC[-8]*RC[-7]/RC[-6],0) -> 2025 | N108: =ROUND(RC[-5]*RC[-4]/RC[-3],0) -> 384 | P108: =RC[-3]&","&RC[-2]&";" -> 2025,384;
A109: =ctRandomPoint!R[-28]C -> 77 | B109: =ctRandomPoint!R[-28]C -> 8 | C109: =COUNTIFS(C2,RC[-1]) -> 14 | E109: =VLOOKUP(RC[-3],Sheet4!C3:C7,4,FALSE) -> 2700 | F109: 2 | G109: =INT(RC[-4]^0.5)*2+2 -> 8 | I109: =VLOOKUP(RC[-7],Sheet4!C3:C7,5,FALSE) -> 1920 | J109: 6 | K109: =ROUNDUP(RC[-8]^0.5,0)*2+2 -> 10 | M109: =ROUND(RC[-8]*RC[-7]/RC[-6],0) -> 675 | N109: =ROUND(RC[-5]*RC[-4]/RC[-3],0) -> 1152 | P109: =RC[-3]&","&RC[-2]&";" -> 675,1152;
A110: =ctRandomPoint!R[-28]C -> 78 | B110: =ctRandomPoint!R[-28]C -> 8 | C110: =COUNTIFS(C2,RC[-1]) -> 14 | E110: =VLOOKUP(RC[-3],Sheet4!C3:C7,4,FALSE) -> 2700 | F110: 4 | G110: =INT(RC[-4]^0.5)*2+2 -> 8 | I110: =VLOOKUP(RC[-7],Sheet4!C3:C7,5,FALSE) -> 1920 | J110: 6 | K110: =ROUNDUP(RC[-8]^0.5,0)*2+2 -> 10 | M110: =ROUND(RC[-8]*RC[-7]/RC[-6],0) -> 1350 | N110: =ROUND(RC[-5]*RC[-4]/RC[-3],0) -> 1152 | P110: =RC[-3]&","&RC[-2]&";" -> 1350,1152;
A111: =ctRandomPoint!R[-28]C -> 79 | B111: =ctRandomPoint!R[-28]C -> 8 | C111: =COUNTIFS(C2,RC[-1]) -> 14 | E111: =VLOOKUP(RC[-3],Sheet4!C3:C7,4,FALSE) -> 2700 | F111: 6 | G111: =INT(RC[-4]^0.5)*2+2 -> 8 | I111: =VLOOKUP(RC[-7],Sheet4!C3:C7,5,FALSE) -> 1920 | J111: 6 | K111: =ROUNDUP(RC[-8]^0.5,0)*2+2 -> 10 | M111: =ROUND(RC[-8]*RC[-7]/RC[-6],0) -> 2025 | N111: =ROUND(RC[-5]*RC[-4]/RC[-3],0) -> 1152 | P111: =RC[-3]&","&RC[-2]&";" -> 2025,1152;
A112: =ctRandomPoint!R[-28]C -> 80 | B112: =ctRandomPoint!R[-28]C -> 8 | C112: =COUNTIFS(C2,RC[-1]) -> 14 | E112: =VLOOKUP(RC[-3],Sheet4!C3:C7,4,FALSE) -> 2700 | F112: 2 | G112: =INT(RC[-4]^0.5)*2+2 -> 8 | I112: =VLOOKUP(RC[-7],Sheet4!C3:C7,5,FALSE) -> 1920 | J112: 8 | K112: =ROUNDUP(RC[-8]^0.5,0)*2+2 -> 10 | M112: =ROUND(RC[-8]*RC[-7]/RC[-6],0) -> 675 | N112: =ROUND(RC[-5]*RC[-4]/RC[-3],0) -> 1536 | P112: =RC[-3]&","&RC[-2]&";" -> 675,1536;
A113: =ctRandomPoint!R[-28]C -> 81 | B113: =ctRandomPoint!R[-28]C -> 8 | C113: =COUNTIFS(C2,RC[-1]) -> 14 | E113: =VLOOKUP(RC[-3],Sheet4!C3:C7,4,FALSE) -> 2700 | F113: 4 | G113: =INT(RC[-4]^0.5)*2+2 -> 8 | I113: =VLOOKUP(RC[-7],Sheet4!C3:C7,5,FALSE) -> 1920 | J113: 8 | K113: =ROUNDUP(RC[-8]^0.5,0)*2+2 -> 10 | M113: =ROUND(RC[-8]*RC[-7]/RC[-6],0) -> 1350 | N113: =ROUND(RC[-5]*RC[-4]/RC[-3],0) -> 1536 | P113: =RC[-3]&","&RC[-2]&";" -> 1350,1536;
A114: =ctRandomPoint!R[1]C -> 111 | B114: =ctRandomPoint!R[1]C -> 8 | C114: =COUNTIFS(C2,RC[-1]) -> 14 | E114: =VLOOKUP(RC[-3],Sheet4!C3:C7,4,FALSE) -> 2700 | F114: 8 | G114: =INT(RC[-4]^0.5)*2+2 -> 8 | I114: =VLOOKUP(RC[-7],Sheet4!C3:C7,5,FALSE) -> 1920 | J114: =R[-4]C+2 -> 8 | K114: =ROUNDUP(RC[-8]^0.5,0)*2+2 -> 10 | M114: =ROUND(RC[-8]*RC[-7]/RC[-6],0) -> 2700 | N114: =ROUND(RC[-5]*RC[-4]/RC[-3],0) -> 1536 | P114: =RC[-3]&","&RC[-2]&";" -> 2700,1536;
A115: =ctRandomPoint!R[1]C -> 112 | B115: =ctRandomPoint!R[1]C -> 8 | C115: =COUNTIFS(C2,RC[-1]) -> 14 | E115: =VLOOKUP(RC[-3],Sheet4!C3:C7,4,FALSE) -> 2700 | F115: 2 | G115: =INT(RC[-4]^0.5)*2+2 -> 8 | I115: =VLOOKUP(RC[-7],Sheet4!C3:C7,5,FALSE) -> 1920 | J115: =R[-4]C+2 -> 8 | K115: =ROUNDUP(RC[-8]^0.5,0)*2+2 -> 10 | M115: =ROUND(RC[-8]*RC[-7]/RC[-6],0) -> 675 | N115: =ROUND(RC[-5]*RC[-4]/RC[-3],0) -> 1536 | P115: =RC[-3]&","&RC[-2]&";" -> 675,1536;
A116: =ctRandomPoint!R[1]C -> 113 | B116: =ctRandomPoint!R[1]C -> 8 | C116: =COUNTIFS(C2,RC[-1]) -> 14 | E116: =VLOOKUP(RC[-3],Sheet4!C3:C7,4,FALSE) -> 2700 | F116: 5 | G116: =INT(RC[-4]^0.5)*2+2 -> 8 | I116: =VLOOKUP(RC[-7],Sheet4!C3:C7,5,FALSE) -> 1920 | J116: =R[-4]C+2 -> 10 | K116: =ROUNDUP(RC[-8]^0.5,0)*2+2 -> 10 | M116: =ROUND(RC[-8]*RC[-7]/RC[-6],0) -> 1688 | N116: =ROUND(RC[-5]*RC[-4]/RC[-3],0) -> 1920 | P116: =RC[-3]&","&RC[-2]&";" -> 1688,1920;
A117: =ctRandomPoint!R[1]C -> 114 | B117: =ctRandomPoint!R[1]C -> 8 | C117: =COUNTIFS(C2,RC[-1]) -> 14 | E117: =VLOOKUP(RC[-3],Sheet4!C3:C7,4,FALSE) -> 2700 | F117: 8 | G117: =INT(RC[-4]^0.5)*2+2 -> 8 | I117: =VLOOKUP(RC[-7],Sheet4!C3:C7,5,FALSE) -> 1920 | J117: =R[-4]C+2 -> 10 | K117: =ROUNDUP(RC[-8]^0.5,0)*2+2 -> 10 | M117: =ROUND(RC[-8]*RC[-7]/RC[-6],0) -> 2700 | N117: =ROUND(RC[-5]*RC[-4]/RC[-3],0) -> 1920 | P117: =RC[-3]&","&RC[-2]&";" -> 2700,1920;
A118: =ctRandomPoint!R[1]C -> 115 | B118: =ctRandomPoint!R[1]C -> 10101 | C118: =COUNTIFS(C2,RC[-1]) -> 10 | E118: =VLOOKUP(RC[-3],Sheet4!C3:C7,4,FALSE) -> 2160 | F118: 2 | G118: =INT(RC[-4]^0.5)*2+2 -> 8 | I118: =VLOOKUP(RC[-7],Sheet4!C3:C7,5,FALSE) -> 1920 | J118: 2 | K118: =ROUNDUP(RC[-8]^0.5,0)*2 -> 8 | M118: =ROUND(RC[-8]*RC[-7]/RC[-6],0) -> 540 | N118: =ROUND(RC[-5]*RC[-4]/RC[-3],0) -> 480 | P118: =RC[-3]&","&RC[-2]&";" -> 540,480;
A119: =ctRandomPoint!R[1]C -> 116 | B119: =ctRandomPoint!R[1]C -> 10101 | C119: =COUNTIFS(C2,RC[-1]) -> 10 | E119: =VLOOKUP(RC[-3],Sheet4!C3:C7,4,FALSE) -> 2160 | F119: 4 | G119: =INT(RC[-4]^0.5)*2+2 -> 8 | I119: =VLOOKUP(RC[-7],Sheet4!C3:C7,5,FALSE) -> 1920 | J119: 2 | K119: =ROUNDUP(RC[-8]^0.5,0)*2 -> 8 | M119: =ROUND(RC[-8]*RC[-7]/RC[-6],0) -> 1080 | N119: =ROUND(RC[-5]*RC[-4]/RC[-3],0) -> 480 | P119: =RC[-3]&","&RC[-2]&";" -> 1080,480;
A120: =ctRandomPoint!R[1]C -> 117 | B120: =ctRandomPoint!R[1]C -> 10101 | C120: =COUNTIFS(C2,RC[-1]) -> 10 | E120: =VLOOKUP(RC[-3],Sheet4!C3:C7,4,FALSE) -> 2160 | F120: 6 | G120: =INT(RC[-4]^0.5)*2+2 -> 8 | I120: =VLOOKUP(RC[-7],Sheet4!C3:C7,5,FALSE) -> 1920 | J120: 2 | K120: =ROUNDUP(RC[-8]^0.5,0)*2 -> 8 | M120: =ROUND(RC[-8]*RC[-7]/RC[-6],0) -> 1620 | N120: =ROUND(RC[-5]*RC[-4]/RC[-3],0) -> 480 | P120: =RC[-3]&","&RC[-2]&";" -> 1620,480;
A121: =ctRandomPoint!R[1]C -> 118 | B121: =ctRandomPoint!R[1]C -> 10101 | C121: =COUNTIFS(C2,RC[-1]) -> 10 | E121: =VLOOKUP(RC[-3],Sheet4!C3:C7,4,FALSE) -> 2160 | F121: 2 | G121: 10 | I121: =VLOOKUP(RC[-7],Sheet4!C3:C7,5,FALSE) -> 1920 | J121: 4 | K121: =ROUNDUP(RC[-8]^0.5,0)*2 -> 8 | M121: =ROUND(RC[-8]*RC[-7]/RC[-6],0) -> 432 | N121: =ROUND(RC[-5]*RC[-4]/RC[-3],0) -> 960 | P121: =RC[-3]&","&RC[-2]&";" -> 432,960;
A122: =ctRandomPoint!R[1]C -> 119 | B122: =ctRandomPoint!R[1]C -> 10101 | C122: =COUNTIFS(C2,RC[-1]) -> 10 | E122: =VLOOKUP(RC[-3],Sheet4!C3:C7,4,FALSE) -> 2160 | F122: 4 | G122: 10 | I122: =VLOOKUP(RC[-7],Sheet4!C3:C7,5,FALSE) -> 1920 | J122: 4 | K122: =ROUNDUP(RC[-8]^0.5,0)*2 -> 8 | M122: =ROUND(RC[-8]*RC[-7]/RC[-6],0) -> 864 | N122: =ROUND(RC[-5]*RC[-4]/RC[-3],0) -> 960 | P122: =RC[-3]&","&RC[-2]&";" -> 864,960;
A123: =ctRandomPoint!R[1]C -> 120 | B123: =ctRandomPoint!R[1]C -> 10101 | C123: =COUNTIFS(C2,RC[-1]) -> 10 | E123: =VLOOKUP(RC[-3],Sheet4!C3:C7,4,FALSE) -> 2160 | F123: 6 | G123: 10 | I123: =VLOOKUP(RC[-7],Sheet4!C3:C7,5,FALSE) -> 1920 | J123: 4 | K123: =ROUNDUP(RC[-8]^0.5,0)*2 -> 8 | M123: =ROUND(RC[-8]*RC[-7]/RC[-6],0) -> 1296 | N123: =ROUND(RC[-5]*RC[-4]/RC[-3],0) -> 960 | P123: =RC[-3]&","&RC[-2]&";" -> 1296,960;
A124: =ctRandomPoint!R[1]C -> 121 | B124: =ctRandomPoint!R[1]C -> 10101 | C124: =COUNTIFS(C2,RC[-1]) -> 10 | E124: =VLOOKUP(RC[-3],Sheet4!C3:C7,4,FALSE) -> 2160 | F124: 8 | G124: 10 | I124: =VLOOKUP(RC[-7],Sheet4!C3:C7,5,FALSE) -> 1920 | J124: 4 | K124: =ROUNDUP(RC[-8]^0.5,0)*2 -> 8 | M124: =ROUND(RC[-8]*RC[-7]/RC[-6],0) -> 1728 | N124: =ROUND(RC[-5]*RC[-4]/RC[-3],0) -> 960 | P124: =RC[-3]&","&RC[-2]&";" -> 1728,960;
A125: =ctRandomPoint!R[1]C -> 122 | B125: =ctRandomPoint!R[1]C -> 10101 | C125: =COUNTIFS(C2,RC[-1]) -> 10 | E125: =VLOOKUP(RC[-3],Sheet4!C3:C7,4,FALSE) -> 2160 | F125: 2 | G125: =INT(RC[-4]^0.5)*2+2 -> 8 | I125: =VLOOKUP(RC[-7],Sheet4!C3:C7,5,FALSE) -> 1920 | J125: 6 | K125: =ROUNDUP(RC[-8]^0.5,0)*2 -> 8 | M125: =ROUND(RC[-8]*RC[-7]/RC[-6],0) -> 540 | N125: =ROUND(RC[-5]*RC[-4]/RC[-3],0) -> 1440 | P125: =RC[-3]&","&RC[-2]&";" -> 540,1440;
A126: =ctRandomPoint!R[1]C -> 123 | B126: =ctRandomPoint!R[1]C -> 10101 | C126: =COUNTIFS(C2,RC[-1]) -> 10 | E126: =VLOOKUP(RC[-3],Sheet4!C3:C7,4,FALSE) -> 2160 | F126: 4 | G126: =INT(RC[-4]^0.5)*2+2 -> 8 | I126: =VLOOKUP(RC[-7],Sheet4!C3:C7,5,FALSE) -> 1920 | J126: 6 | K126: =ROUNDUP(RC[-8]^0.5,0)*2 -> 8 | M126: =ROUND(RC[-8]*RC[-7]/RC[-6],0) -> 1080 | N126: =ROUND(RC[-5]*RC[-4]/RC[-3],0) -> 1440 | P126: =RC[-3]&","&RC[-2]&";" -> 1080,1440;
A127: =ctRandomPoint!R[1]C -> 124 | B127: =ctRandomPoint!R[1]C -> 10101 | C127: =COUNTIFS(C2,RC[-1]) -> 10 | E127: =VLOOKUP(RC[-3],Sheet4!C3:C7,4,FALSE) -> 2160 | F127: 6 | G127: =INT(RC[-4]^0.5)*2+2 -> 8 | I127: =VLOOKUP(RC[-7],Sheet4!C3:C7,5,FALSE) -> 1920 | J127: 6 | K127: =ROUNDUP(RC[-8]^0.5,0)*2 -> 8 | M127: =ROUND(RC[-8]*RC[-7]/RC[-6],0) -> 1620 | N127: =ROUND(RC[-5]*RC[-4]/RC[-3],0) -> 1440 | P127: =RC[-3]&","&RC[-2]&";" -> 1620,1440;
A128: =ctRandomPoint!R[1]C -> 125 | B128: =ctRandomPoint!R[1]C -> 10102 | C128: =COUNTIFS(C2,RC[-1]) -> 10 | E128: =VLOOKUP(RC[-3],Sheet4!C3:C7,4,FALSE) -> 3240 | F128: 2 | G128: =INT(RC[-4]^0.5)*2+2 -> 8 | I128: =VLOOKUP(RC[-7],Sheet4!C3:C7,5,FALSE) -> 1920 | J128: 2 | K128: =ROUNDUP(RC[-8]^0.5,0)*2 -> 8 | M128: =ROUND(RC[-8]*RC[-7]/RC[-6],0) -> 810 | N128: =ROUND(RC[-5]*RC[-4]/RC[-3],0) -> 480 | P128: =RC[-3]&","&RC[-2]&";" -> 810,480;
A129: =ctRandomPoint!R[1]C -> 126 | B129: =ctRandomPoint!R[1]C -> 10102 | C129: =COUNTIFS(C2,RC[-1]) -> 10 | E129: =VLOOKUP(RC[-3],Sheet4!C3:C7,4,FALSE) -> 3240 | F129: 4 | G129: =INT(RC[-4]^0.5)*2+2 -> 8 | I129: =VLOOKUP(RC[-7],Sheet4!C3:C7,5,FALSE) -> 1920 | J129: 2 | K129: =ROUNDUP(RC[-8]^0.5,0)*2 -> 8 | M129: =ROUND(RC[-8]*RC[-7]/RC[-6],0) -> 1620 | N129: =ROUND(RC[-5]*RC[-4]/RC[-3],0) -> 480 | P129: =RC[-3]&","&RC[-2]&";" -> 1620,480;
A130: =ctRandomPoint!R[1]C -> 127 | B130: =ctRandomPoint!R[1]C -> 10102 | C130: =COUNTIFS(C2,RC[-1]) -> 10 | E130: =VLOOKUP(RC[-3],Sheet4!C3:C7,4,FALSE) -> 3240 | F130: 6 | G130: =INT(RC[-4]^0.5)*2+2 -> 8 | I130: =VLOOKUP(RC[-7],Sheet4!C3:C7,5,FALSE) -> 1920 | J130: 2 | K130: =ROUNDUP(RC[-8]^0.5,0)*2 -> 8 | M130: =ROUND(RC[-8]*RC[-7]/RC[-6],0) -> 2430 | N130: =ROUND(RC[-5]*RC[-4]/RC[-3],0) -> 480 | P130: =RC[-3]&","&RC[-2]&";" -> 2430,480;
A131: =ctRandomPoint!R[1]C -> 128 | B131: =ctRandomPoint!R[1]C -> 10102 | C131: =COUNTIFS(C2,RC[-1]) -> 10 | E131: =VLOOKUP(RC[-3],Sheet4!C3:C7,4,FALSE) -> 3240 | F131: 2 | G131: 10 | I131: =VLOOKUP(RC[-7],Sheet4!C3:C7,5,FALSE) -> 1920 | J131: 4 | K131: =ROUNDUP(RC[-8]^0.5,0)*2 -> 8 | M131: =ROUND(RC[-8]*RC[-7]/RC[-6],0) -> 648 | N131: =ROUND(RC[-5]*RC[-4]/RC[-3],0) -> 960 | P131: =RC[-3]&","&RC[-2]&";" -> 648,960;
A132: =ctRandomPoint!R[1]C -> 129 | B132: =ctRandomPoint!R[1]C -> 10102 | C132: =COUNTIFS(C2,RC[-1]) -> 10 | E132: =VLOOKUP(RC[-3],Sheet4!C3:C7,4,FALSE) -> 3240 | F132: 4 | G132: 10 | I132: =VLOOKUP(RC[-7],Sheet4!C3:C7,5,FALSE) -> 1920 | J132: 4 | K132: =ROUNDUP(RC[-8]^0.5,0)*2 -> 8 | M132: =ROUND(RC[-8]*RC[-7]/RC[-6],0) -> 1296 | N132: =ROUND(RC[-5]*RC[-4]/RC[-3],0) -> 960 | P132: =RC[-3]&","&RC[-2]&";" -> 1296,960;
A133: =ctRandomPoint!R[1]C -> 130 | B133: =ctRandomPoint!R[1]C -> 10102 | C133: =COUNTIFS(C2,RC[-1]) -> 10 | E133: =VLOOKUP(RC[-3],Sheet4!C3:C7,4,FALSE) -> 3240 | F133: 6 | G133: 10 | I133: =VLOOKUP(RC[-7],Sheet4!C3:C7,5,FALSE) -> 1920 | J133: 4 | K133: =ROUNDUP(RC[-8]^0.5,0)*2 -> 8 | M133: =ROUND(RC[-8]*RC[-7]/RC[-6],0) -> 1944 | N133: =ROUND(RC[-5]*RC[-4]/RC[-3],0) -> 960 | P133: =RC[-3]&","&RC[-2]&";" -> 1944,960;
A134: =ctRandomPoint!R[1]C -> 131 | B134: =ctRandomPoint!R[1]C -> 10102 | C134: =COUNTIFS(C2,RC[-1]) -> 10 | E134: =VLOOKUP(RC[-3],Sheet4!C3:C7,4,FALSE) -> 3240 | F134: 8 | G134: 10 | I134: =VLOOKUP(RC[-7],Sheet4!C3:C7,5,FALSE) -> 1920 | J134: 4 | K134: =ROUNDUP(RC[-8]^0.5,0)*2 -> 8 | M134: =ROUND(RC[-8]*RC[-7]/RC[-6],0) -> 2592 | N134: =ROUND(RC[-5]*RC[-4]/RC[-3],0) -> 960 | P134: =RC[-3]&","&RC[-2]&";" -> 2592,960;
A135: =ctRandomPoint!R[1]C -> 132 | B135: =ctRandomPoint!R[1]C -> 10102 | C135: =COUNTIFS(C2,RC[-1]) -> 10 | E135: =VLOOKUP(RC[-3],Sheet4!C3:C7,4,FALSE) -> 3240 | F135: 2 | G135: =INT(RC[-4]^0.5)*2+2 -> 8 | I135: =VLOOKUP(RC[-7],Sheet4!C3:C7,5,FALSE) -> 1920 | J135: 6 | K135: =ROUNDUP(RC[-8]^0.5,0)*2 -> 8 | M135: =ROUND(RC[-8]*RC[-7]/RC[-6],0) -> 810 | N135: =ROUND(RC[-5]*RC[-4]/RC[-3],0) -> 1440 | P135: =RC[-3]&","&RC[-2]&";" -> 810,1440;
A136: =ctRandomPoint!R[1]C -> 133 | B136: =ctRandomPoint!R[1]C -> 10102 | C136: =COUNTIFS(C2,RC[-1]) -> 10 | E136: =VLOOKUP(RC[-3],Sheet4!C3:C7,4,FALSE) -> 3240 | F136: 4 | G136: =INT(RC[-4]^0.5)*2+2 -> 8 | I136: =VLOOKUP(RC[-7],Sheet4!C3:C7,5,FALSE) -> 1920 | J136: 6 | K136: =ROUNDUP(RC[-8]^0.5,0)*2 -> 8 | M136: =ROUND(RC[-8]*RC[-7]/RC[-6],0) -> 1620 | N136: =ROUND(RC[-5]*RC[-4]/RC[-3],0) -> 1440 | P136: =RC[-3]&","&RC[-2]&";" -> 1620,1440;
A137: =ctRandomPoint!R[1]C -> 134 | B137: =ctRandomPoint!R[1]C -> 10102 | C137: =COUNTIFS(C2,RC[-1]) -> 10 | E137: =VLOOKUP(RC[-3],Sheet4!C3:C7,4,FALSE) -> 3240 | F137: 6 | G137: =INT(RC[-4]^0.5)*2+2 -> 8 | I137: =VLOOKUP(RC[-7],Sheet4!C3:C7,5,FALSE) -> 1920 | J137: 6 | K137: =ROUNDUP(RC[-8]^0.5,0)*2 -> 8 | M137: =ROUND(RC[-8]*RC[-7]/RC[-6],0) -> 2430 | N137: =ROUND(RC[-5]*RC[-4]/RC[-3],0) -> 1440 | P137: =RC[-3]&","&RC[-2]&";" -> 2430,1440;
A138: =ctRandomPoint!R[1]C -> 135 | B138: =ctRandomPoint!R[1]C -> 10103 | C138: =COUNTIFS(C2,RC[-1]) -> 10 | E138: =VLOOKUP(RC[-3],Sheet4!C3:C7,4,FALSE) -> 2700 | F138: 2 | G138: =INT(RC[-4]^0.5)*2+2 -> 8 | I138: =VLOOKUP(RC[-7],Sheet4!C3:C7,5,FALSE) -> 1920 | J138: 2 | K138: =ROUNDUP(RC[-8]^0.5,0)*2 -> 8 | M138: =ROUND(RC[-8]*RC[-7]/RC[-6],0) -> 675 | N138: =ROUND(RC[-5]*RC[-4]/RC[-3],0) -> 480 | P138: =RC[-3]&","&RC[-2]&";" -> 675,480;
A139: =ctRandomPoint!R[1]C -> 136 | B139: =ctRandomPoint!R[1]C -> 10103 | C139: =COUNTIFS(C2,RC[-1]) -> 10 | E139: =VLOOKUP(RC[-3],Sheet4!C3:C7,4,FALSE) -> 2700 | F139: 4 | G139: =INT(RC[-4]^0.5)*2+2 -> 8 | I139: =VLOOKUP(RC[-7],Sheet4!C3:C7,5,FALSE) -> 1920 | J139: 2 | K139: =ROUNDUP(RC[-8]^0.5,0)*2 -> 8 | M139: =ROUND(RC[-8]*RC[-7]/RC[-6],0) -> 1350 | N139: =ROUND(RC[-5]*RC[-4]/RC[-3],0) -> 480 | P139: =RC[-3]&","&RC[-2]&";" -> 1350,480;
A140: =ctRandomPoint!R[1]C -> 137 | B140: =ctRandomPoint!R[1]C -> 10103 | C140: =COUNTIFS(C2,RC[-1]) -> 10 | E140: =VLOOKUP(RC[-3],Sheet4!C3:C7,4,FALSE) -> 2700 | F140: 6 | G140: =INT(RC[-4]^0.5)*2+2 -> 8 | I140: =VLOOKUP(RC[-7],Sheet4!C3:C7,5,FALSE) -> 1920 | J140: 2 | K140: =ROUNDUP(RC[-8]^0.5,0)*2 -> 8 | M140: =ROUND(RC[-8]*RC[-7]/RC[-6],0) -> 2025 | N140: =ROUND(RC[-5]*RC[-4]/RC[-3],0) -> 480 | P140: =RC[-3]&","&RC[-2]&";" -> 2025,480;
A141: =ctRandomPoint!R[1]C -> 138 | B141: =ctRandomPoint!R[1]C -> 10103 | C141: =COUNTIFS(C2,RC[-1]) -> 10 | E141: =VLOOKUP(RC[-3],Sheet4!C3:C7,4,FALSE) -> 2700 | F141: 2 | G141: 10 | I141: =VLOOKUP(RC[-7],Sheet4!C3:C7,5,FALSE) -> 1920 | J141: 4 | K141: =ROUNDUP(RC[-8]^0.5,0)*2 -> 8 | M141: =ROUND(RC[-8]*RC[-7]/RC[-6],0) -> 540 | N141: =ROUND(RC[-5]*RC[-4]/RC[-3],0) -> 960 | P141: =RC[-3]&","&RC[-2]&";" -> 540,960;
A142: =ctRandomPoint!R[1]C -> 139 | B142: =ctRandomPoint!R[1]C -> 10103 | C142: =COUNTIFS(C2,RC[-1]) -> 10 | E142: =VLOOKUP(RC[-3],Sheet4!C3:C7,4,FALSE) -> 2700 | F142: 4 | G142: 10 | I142: =VLOOKUP(RC[-7],Sheet4!C3:C7,5,FALSE) -> 1920 | J142: 4 | K142: =ROUNDUP(RC[-8]^0.5,0)*2 -> 8 | M142: =ROUND(RC[-8]*RC[-7]/RC[-6],0) -> 1080 | N142: =ROUND(RC[-5]*RC[-4]/RC[-3],0) -> 960 | P142: =RC[-3]&","&RC[-2]&";" -> 1080,960;
A143: =ctRandomPoint!R[1]C -> 140 | B143: =ctRandomPoint!R[1]C -> 10103 | C143: =COUNTIFS(C2,RC[-1]) -> 10 | E143: =VLOOKUP(RC[-3],Sheet4!C3:C7,4,FALSE) -> 2700 | F143: 6 | G143: 10 | I143: =VLOOKUP(RC[-7],Sheet4!C3:C7,5,FALSE) -> 1920 | J143: 4 | K143: =ROUNDUP(RC[-8]^0.5,0)*2 -> 8 | M143: =ROUND(RC[-8]*RC[-7]/RC[-6],0) -> 1620 | N143: =ROUND(RC[-5]*RC[-4]/RC[-3],0) -> 960 | P143: =RC[-3]&","&RC[-2]&";" -> 1620,960;
A144: =ctRandomPoint!R[1]C -> 141 | B144: =ctRandomPoint!R[1]C -> 10103 | C144: =COUNTIFS(C2,RC[-1]) -> 10 | E144: =VLOOKUP(RC[-3],Sheet4!C3:C7,4,FALSE) -> 2700 | F144: 8 | G144: 10 | I144: =VLOOKUP(RC[-7],Sheet4!C3:C7,5,FALSE) -> 1920 | J144: 4 | K144: =ROUNDUP(RC[-8]^0.5,0)*2 -> 8 | M144: =ROUND(RC[-8]*RC[-7]/RC[-6],0) -> 2160 | N144: =ROUND(RC[-5]*RC[-4]/RC[-3],0) -> 960 | P144: =RC[-3]&","&RC[-2]&";" -> 2160,960;
A145: =ctRandomPoint!R[1]C -> 142 | B145: =ctRandomPoint!R[1]C -> 10103 | C145: =COUNTIFS(C2,RC[-1]) -> 10 | E145: =VLOOKUP(RC[-3],Sheet4!C3:C7,4,FALSE) -> 2700 | F145: 2 | G145: =INT(RC[-4]^0.5)*2+2 -> 8 | I145: =VLOOKUP(RC[-7],Sheet4!C3:C7,5,FALSE) -> 1920 | J145: 6 | K145: =ROUNDUP(RC[-8]^0.5,0)*2 -> 8 | M145: =ROUND(RC[-8]*RC[-7]/RC[-6],0) -> 675 | N145: =ROUND(RC[-5]*RC[-4]/RC[-3],0) -> 1440 | P145: =RC[-3]&","&RC[-2]&";" -> 675,1440;
A146: =ctRandomPoint!R[1]C -> 143 | B146: =ctRandomPoint!R[1]C -> 10103 | C146: =COUNTIFS(C2,RC[-1]) -> 10 | E146: =VLOOKUP(RC[-3],Sheet4!C3:C7,4,FALSE) -> 2700 | F146: 4 | G146: =INT(RC[-4]^0.5)*2+2 -> 8 | I146: =VLOOKUP(RC[-7],Sheet4!C3:C7,5,FALSE) -> 1920 | J146: 6 | K146: =ROUNDUP(RC[-8]^0.5,0)*2 -> 8 | M146: =ROUND(RC[-8]*RC[-7]/RC[-6],0) -> 1350 | N146: =ROUND(RC[-5]*RC[-4]/RC[-3],0) -> 1440 | P146: =RC[-3]&","&RC[-2]&";" -> 1350,1440;
A147: =ctRandomPoint!R[1]C -> 144 | B147: =ctRandomPoint!R[1]C -> 10103 | C147: =COUNTIFS(C2,RC[-1]) -> 10 | E147: =VLOOKUP(RC[-3],Sheet4!C3:C7,4,FALSE) -> 2700 | F147: 6 | G147: =INT(RC[-4]^0.5)*2+2 -> 8 | I147: =VLOOKUP(RC[-7],Sheet4!C3:C7,5,FALSE) -> 1920 | J147: 6 | K147: =ROUNDUP(RC[-8]^0.5,0)*2 -> 8 | M147: =ROUND(RC[-8]*RC[-7]/RC[-6],0) -> 2025 | N147: =ROUND(RC[-5]*RC[-4]/RC[-3],0) -> 1440 | P147: =RC[-3]&","&RC[-2]&";" -> 2025,1440;
A148: =ctRandomPoint!R[1]C -> 145 | B148: =ctRandomPoint!R[1]C -> 10104 | C148: =COUNTIFS(C2,RC[-1]) -> 10 | E148: =VLOOKUP(RC[-3],Sheet4!C3:C7,4,FALSE) -> 3240 | F148: 2 | G148: =INT(RC[-4]^0.5)*2+2 -> 8 | I148: =VLOOKUP(RC[-7],Sheet4!C3:C7,5,FALSE) -> 2560 | J148: 2 | K148: =ROUNDUP(RC[-8]^0.5,0)*2 -> 8 | M148: =ROUND(RC[-8]*RC[-7]/RC[-6],0) -> 810 | N148: =ROUND(RC[-5]*RC[-4]/RC[-3],0) -> 640 | P148: =RC[-3]&","&RC[-2]&";" -> 810,640;
A149: =ctRandomPoint!R[1]C -> 146 | B149: =ctRandomPoint!R[1]C -> 10104 | C149: =COUNTIFS(C2,RC[-1]) -> 10 | E149: =VLOOKUP(RC[-3],Sheet4!C3:C7,4,FALSE) -> 3240 | F149: 4 | G149: =INT(RC[-4]^0.5)*2+2 -> 8 | I149: =VLOOKUP(RC[-7],Sheet4!C3:C7,5,FALSE) -> 2560 | J149: 2 | K149: =ROUNDUP(RC[-8]^0.5,0)*2 -> 8 | M149: =ROUND(RC[-8]*RC[-7]/RC[-6],0) -> 1620 | N149: =ROUND(RC[-5]*RC[-4]/RC[-3],0) -> 640 | P149: =RC[-3]&","&RC[-2]&";" -> 1620,640;
A150: =ctRandomPoint!R[1]C -> 147 | B150: =ctRandomPoint!R[1]C -> 10104 | C150: =COUNTIFS(C2,RC[-1]) -> 10 | E150: =VLOOKUP(RC[-3],Sheet4!C3:C7,4,FALSE) -> 3240 | F150: 6 | G150: =INT(RC[-4]^0.5)*2+2 -> 8 | I150: =VLOOKUP(RC[-7],Sheet4!C3:C7,5,FALSE) -> 2560 | J150: 2 | K150: =ROUNDUP(RC[-8]^0.5,0)*2 -> 8 | M150: =ROUND(RC[-8]*RC[-7]/RC[-6],0) -> 2430 | N150: =ROUND(RC[-5]*RC[-4]/RC[-3],0) -> 640 | P150: =RC[-3]&","&RC[-2]&";" -> 2430,640;
A151: =ctRandomPoint!R[1]C -> 148 | B151: =ctRandomPoint!R[1]C -> 10104 | C151: =COUNTIFS(C2,RC[-1]) -> 10 | E151: =VLOOKUP(RC[-3],Sheet4!C3:C7,4,FALSE) -> 3240 | F151: 2 | G151: 10 | I151: =VLOOKUP(RC[-7],Sheet4!C3:C7,5,FALSE) -> 2560 | J151: 4 | K151: =ROUNDUP(RC[-8]^0.5,0)*2 -> 8 | M151: =ROUND(RC[-8]*RC[-7]/RC[-6],0) -> 648 | N151: =ROUND(RC[-5]*RC[-4]/RC[-3],0) -> 1280 | P151: =RC[-3]&","&RC[-2]&";" -> 648,1280;
A152: =ctRandomPoint!R[1]C -> 149 | B152: =ctRandomPoint!R[1]C -> 10104 | C152: =COUNTIFS(C2,RC[-1]) -> 10 | E152: =VLOOKUP(RC[-3],Sheet4!C3:C7,4,FALSE) -> 3240 | F152: 4 | G152: 10 | I152: =VLOOKUP(RC[-7],Sheet4!C3:C7,5,FALSE) -> 2560 | J152: 4 | K152: =ROUNDUP(RC[-8]^0.5,0)*2 -> 8 | M152: =ROUND(RC[-8]*RC[-7]/RC[-6],0) -> 1296 | N152: =ROUND(RC[-5]*RC[-4]/RC[-3],0) -> 1280 | P152: =RC[-3]&","&RC[-2]&";" -> 1296,1280;
A153: =ctRandomPoint!R[1]C -> 150 | B153: =ctRandomPoint!R[1]C -> 10104 | C153: =COUNTIFS(C2,RC[-1]) -> 10 | E153: =VLOOKUP(RC[-3],Sheet4!C3:C7,4,FALSE) -> 3240 | F153: 6 | G153: 10 | I153: =VLOOKUP(RC[-7],Sheet4!C3:C7,5,FALSE) -> 2560 | J153: 4 | K153: =ROUNDUP(RC[-8]^0.5,0)*2 -> 8 | M153: =ROUND(RC[-8]*RC[-7]/RC[-6],0) -> 1944 | N153: =ROUND(RC[-5]*RC[-4]/RC[-3],0) -> 1280 | P153: =RC[-3]&","&RC[-2]&";" -> 1944,1280;
A154: =ctRandomPoint!R[1]C -> 151 | B154: =ctRandomPoint!R[1]C -> 10104 | C154: =COUNTIFS(C2,RC[-1]) -> 10 | E154: =VLOOKUP(RC[-3],Sheet4!C3:C7,4,FALSE) -> 3240 | F154: 8 | G154: 10 | I154: =VLOOKUP(RC[-7],Sheet4!C3:C7,5,FALSE) -> 2560 | J154: 4 | K154: =ROUNDUP(RC[-8]^0.5,0)*2 -> 8 | M154: =ROUND(RC[-8]*RC[-7]/RC[-6],0) -> 2592 | N154: =ROUND(RC[-5]*RC[-4]/RC[-3],0) -> 1280 | P154: =RC[-3]&","&RC[-2]&";" -> 2592,1280;
A155: =ctRandomPoint!R[1]C -> 152 | B155: =ctRandomPoint!R[1]C -> 10104 | C155: =COUNTIFS(C2,RC[-1]) -> 10 | E155: =VLOOKUP(RC[-3],Sheet4!C3:C7,4,FALSE) -> 3240 | F155: 2 | G155: =INT(RC[-4]^0.5)*2+2 -> 8 | I155: =VLOOKUP(RC[-7],Sheet4!C3:C7,5,FALSE) -> 2560 | J155: 6 | K155: =ROUNDUP(RC[-8]^0.5,0)*2 -> 8 | M155: =ROUND(RC[-8]*RC[-7]/RC[-6],0) -> 810 | N155: =ROUND(RC[-5]*RC[-4]/RC[-3],0) -> 1920 | P155: =RC[-3]&","&RC[-2]&";" -> 810,1920;
A156: =ctRandomPoint!R[1]C -> 153 | B156: =ctRandomPoint!R[1]C -> 10104 | C156: =COUNTIFS(C2,RC[-1]) -> 10 | E156: =VLOOKUP(RC[-3],Sheet4!C3:C7,4,FALSE) -> 3240 | F156: 4 | G156: =INT(RC[-4]^0.5)*2+2 -> 8 | I156: =VLOOKUP(RC[-7],Sheet4!C3:C7,5,FALSE) -> 2560 | J156: 6 | K156: =ROUNDUP(RC[-8]^0.5,0)*2 -> 8 | M156: =ROUND(RC[-8]*RC[-7]/RC[-6],0) -> 1620 | N156: =ROUND(RC[-5]*RC[-4]/RC[-3],0) -> 1920 | P156: =RC[-3]&","&RC[-2]&";" -> 1620,1920;
A157: =ctRandomPoint!R[1]C -> 154 | B157: =ctRandomPoint!R[1]C -> 10104 | C157: =COUNTIFS(C2,RC[-1]) -> 10 | E157: =VLOOKUP(RC[-3],Sheet4!C3:C7,4,FALSE) -> 3240 | F157: 6 | G157: =INT(RC[-4]^0.5)*2+2 -> 8 | I157: =VLOOKUP(RC[-7],Sheet4!C3:C7,5,FALSE) -> 2560 | J157: 6 | K157: =ROUNDUP(RC[-8]^0.5,0)*2 -> 8 | M157: =ROUND(RC[-8]*RC[-7]/RC[-6],0) -> 2430 | N157: =ROUND(RC[-5]*RC[-4]/RC[-3],0) -> 1920 | P157: =RC[-3]&","&RC[-2]&";" -> 2430,1920;
A158: =ctRandomPoint!R[1]C -> 155 | B158: =ctRandomPoint!R[1]C -> 10105 | C158: =COUNTIFS(C2,RC[-1]) -> 10 | E158: =VLOOKUP(RC[-3],Sheet4!C3:C7,4,FALSE) -> 2160 | F158: 2 | G158: =INT(RC[-4]^0.5)*2+2 -> 8 | I158: =VLOOKUP(RC[-7],Sheet4!C3:C7,5,FALSE) -> 1920 | J158: 2 | K158: =ROUNDUP(RC[-8]^0.5,0)*2 -> 8 | M158: =ROUND(RC[-8]*RC[-7]/RC[-6],0) -> 540 | N158: =ROUND(RC[-5]*RC[-4]/RC[-3],0) -> 480 | P158: =RC[-3]&","&RC[-2]&";" -> 540,480;
A159: =ctRandomPoint!R[1]C -> 156 | B159: =ctRandomPoint!R[1]C -> 10105 | C159: =COUNTIFS(C2,RC[-1]) -> 10 | E159: =VLOOKUP(RC[-3],Sheet4!C3:C7,4,FALSE) -> 2160 | F159: 4 | G159: =INT(RC[-4]^0.5)*2+2 -> 8 | I159: =VLOOKUP(RC[-7],Sheet4!C3:C7,5,FALSE) -> 1920 | J159: 2 | K159: =ROUNDUP(RC[-8]^0.5,0)*2 -> 8 | M159: =ROUND(RC[-8]*RC[-7]/RC[-6],0) -> 1080 | N159: =ROUND(RC[-5]*RC[-4]/RC[-3],0) -> 480 | P159: =RC[-3]&","&RC[-2]&";" -> 1080,480;
A160: =ctRandomPoint!R[1]C -> 157 | B160: =ctRandomPoint!R[1]C -> 10105 | C160: =COUNTIFS(C2,RC[-1]) -> 10 | E160: =VLOOKUP(RC[-3],Sheet4!C3:C7,4,FALSE) -> 2160 | F160: 6 | G160: =INT(RC[-4]^0.5)*2+2 -> 8 | I160: =VLOOKUP(RC[-7],Sheet4!C3:C7,5,FALSE) -> 1920 | J160: 2 | K160: =ROUNDUP(RC[-8]^0.5,0)*2 -> 8 | M160: =ROUND(RC[-8]*RC[-7]/RC[-6],0) -> 1620 | N160: =ROUND(RC[-5]*RC[-4]/RC[-3],0) -> 480 | P160: =RC[-3]&","&RC[-2]&";" -> 1620,480;
A161: =ctRandomPoint!R[1]C -> 158 | B161: =ctRandomPoint!R[1]C -> 10105 | C161: =COUNTIFS(C2,RC[-1]) -> 10 | E161: =VLOOKUP(RC[-3],Sheet4!C3:C7,4,FALSE) -> 2160 | F161: 2 | G161: 10 | I161: =VLOOKUP(RC[-7],Sheet4!C3:C7,5,FALSE) -> 1920 | J161: 4 | K161: =ROUNDUP(RC[-8]^0.5,0)*2 -> 8 | M161: =ROUND(RC[-8]*RC[-7]/RC[-6],0) -> 432 | N161: =ROUND(RC[-5]*RC[-4]/RC[-3],0) -> 960 | P161: =RC[-3]&","&RC[-2]&";" -> 432,960;
A162: =ctRandomPoint!R[1]C -> 159 | B162: =ctRandomPoint!R[1]C -> 10105 | C162: =COUNTIFS(C2,RC[-1]) -> 10 | E162: =VLOOKUP(RC[-3],Sheet4!C3:C7,4,FALSE) -> 2160 | F162: 4 | G162: 10 | I162: =VLOOKUP(RC[-7],Sheet4!C3:C7,5,FALSE) -> 1920 | J162: 4 | K162: =ROUNDUP(RC[-8]^0.5,0)*2 -> 8 | M162: =ROUND(RC[-8]*RC[-7]/RC[-6],0) -> 864 | N162: =ROUND(RC[-5]*RC[-4]/RC[-3],0) -> 960 | P162: =RC[-3]&","&RC[-2]&";" -> 864,960;
A163: =ctRandomPoint!R[1]C -> 160 | B163: =ctRandomPoint!R[1]C -> 10105 | C163: =COUNTIFS(C2,RC[-1]) -> 10 | E163: =VLOOKUP(RC[-3],Sheet4!C3:C7,4,FALSE) -> 2160 | F163: 6 | G163: 10 | I163: =VLOOKUP(RC[-7],Sheet4!C3:C7,5,FALSE) -> 1920 | J163: 4 | K163: =ROUNDUP(RC[-8]^0.5,0)*2 -> 8 | M163: =ROUND(RC[-8]*RC[-7]/RC[-6],0) -> 1296 | N163: =ROUND(RC[-5]*RC[-4]/RC[-3],0) -> 960 | P163: =RC[-3]&","&RC[-2]&";" -> 1296,960;
A164: =ctRandomPoint!R[1]C -> 161 | B164: =ctRandomPoint!R[1]C -> 10105 | C164: =COUNTIFS(C2,RC[-1]) -> 10 | E164: =VLOOKUP(RC[-3],Sheet4!C3:C7,4,FALSE) -> 2160 | F164: 8 | G164: 10 | I164: =VLOOKUP(RC[-7],Sheet4!C3:C7,5,FALSE) -> 1920 | J164: 4 | K164: =ROUNDUP(RC[-8]^0.5,0)*2 -> 8 | M164: =ROUND(RC[-8]*RC[-7]/RC[-6],0) -> 1728 | N164: =ROUND(RC[-5]*RC[-4]/RC[-3],0) -> 960 | P164: =RC[-3]&","&RC[-2]&";" -> 1728,960;
A165: =ctRandomPoint!R[1]C -> 162 | B165: =ctRandomPoint!R[1]C -> 10105 | C165: =COUNTIFS(C2,RC[-1]) -> 10 | E165: =VLOOKUP(RC[-3],Sheet4!C3:C7,4,FALSE) -> 2160 | F165: 2 | G165: =INT(RC[-4]^0.5)*2+2 -> 8 | I165: =VLOOKUP(RC[-7],Sheet4!C3:C7,5,FALSE) -> 1920 | J165: 6 | K165: =ROUNDUP(RC[-8]^0.5,0)*2 -> 8 | M165: =ROUND(RC[-8]*RC[-7]/RC[-6],0) -> 540 | N165: =ROUND(RC[-5]*RC[-4]/RC[-3],0) -> 1440 | P165: =RC[-3]&","&RC[-2]&";" -> 540,1440;
A166: =ctRandomPoint!R[1]C -> 163 | B166: =ctRandomPoint!R[1]C -> 10105 | C166: =COUNTIFS(C2,RC[-1]) -> 10 | E166: =VLOOKUP(RC[-3],Sheet4!C3:C7,4,FALSE) -> 2160 | F166: 4 | G166: =INT(RC[-4]^0.5)*2+2 -> 8 | I166: =VLOOKUP(RC[-7],Sheet4!C3:C7,5,FALSE) -> 1920 | J166: 6 | K166: =ROUNDUP(RC[-8]^0.5,0)*2 -> 8 | M166: =ROUND(RC[-8]*RC[-7]/RC[-6],0) -> 1080 | N166: =ROUND(RC[-5]*RC[-4]/RC[-3],0) -> 1440 | P166: =RC[-3]&","&RC[-2]&";" -> 1080,1440;
A167: =ctRandomPoint!R[1]C -> 164 | B167: =ctRandomPoint!R[1]C -> 10105 | C167: =COUNTIFS(C2,RC[-1]) -> 10 | E167: =VLOOKUP(RC[-3],Sheet4!C3:C7,4,FALSE) -> 2160 | F167: 6 | G167: =INT(RC[-4]^0.5)*2+2 -> 8 | I167: =VLOOKUP(RC[-7],Sheet4!C3:C7,5,FALSE) -> 1920 | J167: 6 | K167: =ROUNDUP(RC[-8]^0.5,0)*2 -> 8 | M167: =ROUND(RC[-8]*RC[-7]/RC[-6],0) -> 1620 | N167: =ROUND(RC[-5]*RC[-4]/RC[-3],0) -> 1440 | P167: =RC[-3]&","&RC[-2]&";" -> 1620,1440;

Sheet: Sheet4
C3: =RC[12] -> 副本ID | D3: =RC[12] -> 副本名字 | F3: =RC[22] -> 地图宽 | G3: =RC[22] -> 地图高 | O3: 副本ID | P3: 副本名字 | Q3: 副本类型 | R3: 地图编号 | S3: 小地图比例 | T3: 出生点 | U3: 战斗场景 | V3: 逻辑服ID | W3: 角色出生模型方向 | X3: 是否弹归队提示 | Y3: 队伍限制类型 | Z3: 副本战斗类型 | AA3: 大厅包含的副本类型 | AB3: 地图宽 | AC3: 地图高
C4: =RC[12] -> 1 | D4: =RC[12] -> 京城 | F4: =RC[22] -> 3240 | G4: =RC[22] -> 1920 | O4: 1 | P4: 京城 | Q4: 1 | R4: 1001 | S4: 5.69420035149385,5.74850299401198; | T4: 1950,1100; | U4: 1101 | V4: 50 | W4: 2 | X4: 0 | Y4: 0 | Z4: 0 | AA4: {} | AB4: 3240 | AC4: 1920
C5: =RC[12] -> 2 | D5: =RC[12] -> 鬼王宗 | F5: =RC[22] -> 2160 | G5: =RC[22] -> 1920 | O5: 2 | P5: 鬼王宗 | Q5: 1 | R5: 2001 | S5: 3.79613356766257,5.74850299401198; | T5: 1600,620; | U5: 2101 | V5: 50 | W5: 0 | X5: 0 | Y5: 0 | Z5: 0 | AA5: {} | AB5: 2160 | AC5: 1920
C6: =RC[12] -> 3 | D6: =RC[12] -> 天音寺 | F6: =RC[22] -> 2700 | G6: =RC[22] -> 1920 | O6: 3 | P6: 天音寺 | Q6: 1 | R6: 2002 | S6: 4.74516695957821,5.74850299401198; | T6: 1460,1270; | U6: 2102 | V6: 50 | W6: 0 | X6: 0 | Y6: 0 | Z6: 0 | AA6: {} | AB6: 2700 | AC6: 1920
C7: =RC[12] -> 4 | D7: =RC[12] -> 合欢派 | F7: =RC[22] -> 3240 | G7: =RC[22] -> 2560 | O7: 4 | P7: 合欢派 | Q7: 1 | R7: 2003 | S7: 5.69420035149385,7.66467065868263; | T7: 1920,1400; | U7: 2103 | V7: 50 | W7: 3 | X7: 0 | Y7: 0 | Z7: 0 | AA7: {} | AB7: 3240 | AC7: 2560
C8: =RC[12] -> 5 | D8: =RC[12] -> 青云门 | F8: =RC[22] -> 2700 | G8: =RC[22] -> 1920 | O8: 5 | P8: 青云门 | Q8: 1 | R8: 2004 | S8: 4.74516695957821,5.74850299401198; | T8: 1120,600; | U8: 2104 | V8: 50 | W8: 1 | X8: 0 | Y8: 0 | Z8: 0 | AA8: {} | AB8: 2700 | AC8: 1920
C9: =RC[12] -> 6 | D9: =RC[12] -> 圣巫教 | F9: =RC[22] -> 2160 | G9: =RC[22] -> 1920 | O9: 6 | P9: 圣巫教 | Q9: 1 | R9: 2005 | S9: 3.79613356766257,5.74850299401198; | T9: 1000,920; | U9: 2105 | V9: 50 | W9: 1 | X9: 0 | Y9: 0 | Z9: 0 | AA9: {} | AB9: 2160 | AC9: 1920
C10: =RC[12] -> 7 | D10: =RC[12] -> 万蝠古洞幻境 | F10: =RC[22] -> 0 | G10: =RC[22] -> 0 | O10: 7 | P10: 万蝠古洞幻境 | Q10: 2 | R10: 3001 | S10: 0,0; | T10: 40,200; | U10: 3101 | V10: 100 | W10: 1 | X10: 0 | Y10: 0 | Z10: 0 | AA10: {} | AB10: 0 | AC10: 0
C11: =RC[12] -> 8 | D11: =RC[12] -> 草庙村 | F11: =RC[22] -> 2700 | G11: =RC[22] -> 1920 | O11: 8 | P11: 草庙村 | Q11: 1 | R11: 3002 | S11: 4.745166959578207,5.748502994011976; | T11: 1250,600; | U11: 3102 | V11: 50 | W11: 1 | X11: 0 | Y11: 0 | Z11: 0 | AA11: {} | AB11: 2700 | AC11: 1920
C12: =RC[12] -> 9 | D12: =RC[12] -> 天帝宝库 | F12: =RC[22] -> 0 | G12: =RC[22] -> 0 | O12: 9 | P12: 天帝宝库 | Q12: 2 | R12: 3003 | S12: 0,0; | T12: 40,200; | U12: 3103 | V12: 50 | W12: 1 | X12: 0 | Y12: 0 | Z12: 0 | AA12: {} | AB12: 0 | AC12: 0
C13: =RC[12] -> 10 | D13: =RC[12] -> 十万大山幻境 | F13: =RC[22] -> 0 | G13: =RC[22] -> 0 | O13: 10 | P13: 十万大山幻境 | Q13: 2 | R13: 3004 | S13: 0,0; | T13: 40,200; | U13: 3104 | V13: 101 | W13: 1 | X13: 0 | Y13: 0 | Z13: 0 | AA13: {} | AB13: 0 | AC13: 0
C14: =RC[12] -> 11 | D14: =RC[12] -> 三生殿幻境 | F14: =RC[22] -> 2700 | G14: =RC[22] -> 1920 | O14: 11 | P14: 三生殿幻境 | Q14: 1 | R14: 3005 | S14: 4.745166959578207,5.748502994011976; | T14: 1930,1480; | U14: 3105 | V14: 102 | W14: 1 | X14: 0 | Y14: 0 | Z14: 0 | AA14: {} | AB14: 2700 | AC14: 1920
C15: =RC[12] -> 12 | D15: =RC[12] -> 帮派驻地 | F15: =RC[22] -> 3240 | G15: =RC[22] -> 2560 | O15: 12 | P15: 帮派驻地 | Q15: 2 | R15: 4001 | S15: 5.69420035149385,7.66467065868263; | T15: 1560,1120; | U15: 4101 | V15: 50 | W15: 1 | X15: 0 | Y15: 0 | Z15: 0 | AA15: {} | AB15: 3240 | AC15: 2560
C16: =RC[12] -> 13 | D16: =RC[12] -> 帮战地图幻境 | F16: =RC[22] -> 2700 | G16: =RC[22] -> 1920 | O16: 13 | P16: 帮战地图幻境 | Q16: 2 | R16: 4002 | S16: 4.745166959578207,5.748502994011976; | T16: 2300,1450; | U16: 4102 | V16: 100 | W16: 1 | X16: 0 | Y16: 0 | Z16: 304 | AA16: {} | AB16: 2700 | AC16: 1920
C17: =RC[12] -> 14 | D17: =RC[12] -> 演武场幻境 | F17: =RC[22] -> 2700 | G17: =RC[22] -> 1920 | O17: 14 | P17: 演武场幻境 | Q17: 1 | R17: 4002 | S17: 4.745166959578207,5.748502994011976; | T17: 2300,1450; | U17: 4102 | V17: 101 | W17: 1 | X17: 0 | Y17: 0 | Z17: 100 | AA17: {101,102,103} | AB17: 2700 | AC17: 1920
C18: =RC[12] -> 10101 | D18: =RC[12] -> 鬼王宗幻境 | F18: =RC[22] -> 2160 | G18: =RC[22] -> 1920 | O18: 10101 | P18: 鬼王宗幻境 | Q18: 2 | R18: 2001 | S18: 3.79613356766257,5.74850299401198; | T18: 1600,620; | U18: 1101 | V18: 101 | W18: 1 | X18: 0 | Y18: 0 | Z18: 101 | AA18: {100} | AB18: 2160 | AC18: 1920
C19: =RC[12] -> 10102 | D19: =RC[12] -> 京城幻境 | F19: =RC[22] -> 3240 | G19: =RC[22] -> 1920 | O19: 10102 | P19: 京城幻境 | Q19: 2 | R19: 1001 | S19: 5.69420035149385,5.74850299401198; | T19: 1950,1100; | U19: 1101 | V19: 101 | W19: 2 | X19: 0 | Y19: 0 | Z19: 101 | AA19: {100} | AB19: 3240 | AC19: 1920
C20: =RC[12] -> 10103 | D20: =RC[12] -> 天音寺幻境 | F20: =RC[22] -> 2700 | G20: =RC[22] -> 1920 | O20: 10103 | P20: 天音寺幻境 | Q20: 2 | R20: 2002 | S20: 4.74516695957821,5.74850299401198; | T20: 1460,1270; | U20: 1101 | V20: 101 | W20: 0 | X20: 0 | Y20: 0 | Z20: 101 | AA20: {100} | AB20: 2700 | AC20: 1920
C21: =RC[12] -> 10104 | D21: =RC[12] -> 合欢派幻境 | F21: =RC[22] -> 3240 | G21: =RC[22] -> 2560 | O21: 10104 | P21: 合欢派幻境 | Q21: 2 | R21: 2003 | S21: 5.69420035149385,7.66467065868263; | T21: 1920,1400; | U21: 1101 | V21: 101 | W21: 3 | X21: 0 | Y21: 0 | Z21: 101 | AA21: {100} | AB21: 3240 | AC21: 2560
C22: =RC[12] -> 10105 | D22: =RC[12] -> 圣巫教幻境 | F22: =RC[22] -> 2160 | G22: =RC[22] -> 1920 | O22: 10105 | P22: 圣巫教幻境 | Q22: 2 | R22: 2005 | S22: 3.79613356766257,5.74850299401198; | T22: 1000,920; | U22: 1101 | V22: 101 | W22: 1 | X22: 0 | Y22: 0 | Z22: 101 | AA22: {100} | AB22: 2160 | AC22: 1920
C23: =RC[12] -> 10201 | D23: =RC[12] -> 草庙村幻境 | F23: =RC[22] -> 2700 | G23: =RC[22] -> 1920 | O23: 10201 | P23: 草庙村幻境 | Q23: 2 | R23: 3002 | S23: 4.745166959578207,5.748502994011976; | T23: 1250,600; | U23: 1101 | V23: 102 | W23: 1 | X23: 0 | Y23: 0 | Z23: 102 | AA23: {100} | AB23: 2700 | AC23: 1920
C24: =RC[12] -> 10301 | D24: =RC[12] -> 青云门幻境 | F24: =RC[22] -> 2700 | G24: =RC[22] -> 1920 | O24: 10301 | P24: 青云门幻境 | Q24: 2 | R24: 2004 | S24: 4.74516695957821,5.74850299401198; | T24: 1120,600; | U24: 1101 | V24: 100 | W24: 1 | X24: 0 | Y24: 0 | Z24: 103 | AA24: {100} | AB24: 2700 | AC24: 1920
C25: =RC[12] -> 10501 | D25: =RC[12] -> 鬼王宗幻境 | F25: =RC[22] -> 2160 | G25: =RC[22] -> 1920 | O25: 10501 | P25: 鬼王宗幻境 | Q25: 2 | R25: 2001 | S25: 3.79613356766257,5.74850299401198; | T25: 1600,620; | U25: 2101 | V25: 101 | W25: 0 | X25: 0 | Y25: 0 | Z25: 202 | AA25: {} | AB25: 2160 | AC25: 1920
C26: =RC[12] -> 10502 | D26: =RC[12] -> 天音寺幻境 | F26: =RC[22] -> 2700 | G26: =RC[22] -> 1920 | O26: 10502 | P26: 天音寺幻境 | Q26: 2 | R26: 2002 | S26: 4.74516695957821,5.74850299401198; | T26: 1460,1270; | U26: 2102 | V26: 101 | W26: 0 | X26: 0 | Y26: 0 | Z26: 202 | AA26: {} | AB26: 2700 | AC26: 1920
C27: =RC[12] -> 10503 | D27: =RC[12] -> 合欢派幻境 | F27: =RC[22] -> 3240 | G27: =RC[22] -> 2560 | O27: 10503 | P27: 合欢派幻境 | Q27: 2 | R27: 2003 | S27: 5.69420035149385,7.66467065868263; | T27: 1920,1400; | U27: 2103 | V27: 101 | W27: 3 | X27: 0 | Y27: 0 | Z27: 202 | AA27: {} | AB27: 3240 | AC27: 2560
C28: =RC[12] -> 10504 | D28: =RC[12] -> 青云门幻境 | F28: =RC[22] -> 2700 | G28: =RC[22] -> 1920 | O28: 10504 | P28: 青云门幻境 | Q28: 2 | R28: 2004 | S28: 4.74516695957821,5.74850299401198; | T28: 1120,600; | U28: 2104 | V28: 101 | W28: 1 | X28: 0 | Y28: 0 | Z28: 202 | AA28: {} | AB28: 2700 | AC28: 1920
C29: =RC[12] -> 10505 | D29: =RC[12] -> 圣巫教幻境 | F29: =RC[22] -> 2160 | G29: =RC[22] -> 1920 | O29: 10505 | P29: 圣巫教幻境 | Q29: 2 | R29: 2005 | S29: 3.79613356766257,5.74850299401198; | T29: 1000,920; | U29: 2105 | V29: 101 | W29: 1 | X29: 0 | Y29: 0 | Z29: 202 | AA29: {} | AB29: 2160 | AC29: 1920
C30: =RC[12] -> 10601 | D30: =RC[12] -> 鬼王宗幻境 | F30: =RC[22] -> 2160 | G30: =RC[22] -> 1920 | O30: 10601 | P30: 鬼王宗幻境 | Q30: 2 | R30: 2001 | S30: 3.79613356766257,5.74850299401198; | T30: 1600,620; | U30: 2101 | V30: 102 | W30: 0 | X30: 0 | Y30: 2 | Z30: 301 | AA30: {} | AB30: 2160 | AC30: 1920
C31: =RC[12] -> 10602 | D31: =RC[12] -> 天音寺幻境 | F31: =RC[22] -> 2700 | G31: =RC[22] -> 1920 | O31: 10602 | P31: 天音寺幻境 | Q31: 2 | R31: 2002 | S31: 4.74516695957821,5.74850299401198; | T31: 1460,1270; | U31: 2102 | V31: 102 | W31: 0 | X31: 0 | Y31: 2 | Z31: 301 | AA31: {} | AB31: 2700 | AC31: 1920
C32: =RC[12] -> 10603 | D32: =RC[12] -> 合欢派幻境 | F32: =RC[22] -> 3240 | G32: =RC[22] -> 2560 | O32: 10603 | P32: 合欢派幻境 | Q32: 2 | R32: 2003 | S32: 5.69420035149385,7.66467065868263; | T32: 1920,1400; | U32: 2103 | V32: 102 | W32: 3 | X32: 0 | Y32: 2 | Z32: 301 | AA32: {} | AB32: 3240 | AC32: 2560
C33: =RC[12] -> 10604 | D33: =RC[12] -> 青云门幻境 | F33: =RC[22] -> 2700 | G33: =RC[22] -> 1920 | O33: 10604 | P33: 青云门幻境 | Q33: 2 | R33: 2004 | S33: 4.74516695957821,5.74850299401198; | T33: 1120,600; | U33: 2104 | V33: 102 | W33: 1 | X33: 0 | Y33: 2 | Z33: 301 | AA33: {} | AB33: 2700 | AC33: 1920
C34: =RC[12] -> 10605 | D34: =RC[12] -> 圣巫教幻境 | F34: =RC[22] -> 2160 | G34: =RC[22] -> 1920 | O34: 10605 | P34: 圣巫教幻境 | Q34: 2 | R34: 2005 | S34: 3.79613356766257,5.74850299401198; | T34: 1000,920; | U34: 2105 | V34: 102 | W34: 1 | X34: 0 | Y34: 2 | Z34: 301 | AA34: {} | AB34: 2160 | AC34: 1920
C35: =RC[12] -> 10701 | D35: =RC[12] -> 神兽乐园 | F35: =RC[22] -> 3240 | G35: =RC[22] -> 1920 | O35: 10701 | P35: 神兽乐园 | Q35: 2 | R35: 1001 | S35: 5.69420035149385,5.74850299401198; | T35: 1950,1100; | U35: 1101 | V35: 50 | W35: 1 | X35: 0 | Y35: 0 | Z35: 105 | AA35: {} | AB35: 3240 | AC35: 1920
C36: =RC[12] -> 10801 | D36: =RC[12] -> 七脉会武幻境 | F36: =RC[22] -> 2700 | G36: =RC[22] -> 1920 | O36: 10801 | P36: 七脉会武幻境 | Q36: 2 | R36: 2004 | S36: 4.74516695957821,5.74850299401198; | T36: 1120,600; | U36: 2104 | V36: 100 | W36: 1 | X36: 0 | Y36: 1 | Z36: 302 | AA36: {} | AB36: 2700 | AC36: 1920
C37: =RC[12] -> 10901 | D37: =RC[12] -> 青云之战幻境 | F37: =RC[22] -> 2700 | G37: =RC[22] -> 1920 | O37: 10901 | P37: 青云之战幻境 | Q37: 2 | R37: 4002 | S37: 4.745166959578207,5.748502994011976; | T37: 2300,1450; | U37: 4102 | V37: 101 | W37: 1 | X37: 0 | Y37: 2 | Z37: 303 | AA37: {} | AB37: 2700 | AC37: 1920
C38: =RC[12] -> 10400 | D38: =RC[12] -> 演武场幻境 | F38: =RC[22] -> 2700 | G38: =RC[22] -> 1920 | O38: 10400 | P38: 演武场幻境 | Q38: 2 | R38: 4002 | S38: 4.745166959578207,5.748502994011976; | T38: 2300,1450; | U38: 4102 | V38: 102 | W38: 1 | X38: 0 | Y38: 0 | Z38: 200 | AA38: {201,202,1002,1003} | AB38: 2700 | AC38: 1920
C39: =RC[12] -> 4001 | D39: =RC[12] -> 决战九霄幻境 | F39: =RC[22] -> 2700 | G39: =RC[22] -> 1920 | O39: 4001 | P39: 决战九霄幻境 | Q39: 2 | R39: 4002 | S39: 4.745166959578207,5.748502994011976; | T39: 2300,1450; | U39: 4102 | V39: 100 | W39: 1 | X39: 0 | Y39: 0 | Z39: 201 | AA39: {} | AB39: 2700 | AC39: 1920
C40: =RC[12] -> 4002 | D40: =RC[12] -> 决战九霄幻境 | F40: =RC[22] -> 2700 | G40: =RC[22] -> 1920 | O40: 4002 | P40: 决战九霄幻境 | Q40: 2 | R40: 4002 | S40: 4.745166959578207,5.748502994011976; | T40: 2300,1450; | U40: 4102 | V40: 100 | W40: 1 | X40: 0 | Y40: 0 | Z40: 201 | AA40: {} | AB40: 2700 | AC40: 1920
C41: =RC[12] -> 20 | D41: =RC[12] -> 三生殿幻境 | F41: =RC[22] -> 2700 | G41: =RC[22] -> 1920 | O41: 20 | P41: 三生殿幻境 | Q41: 1 | R41: 3005 | S41: 4.745166959578207,5.748502994011976; | T41: 1930,1480; | U41: 3105 | V41: 102 | W41: 1 | X41: 0 | Y41: 0 | Z41: 0 | AA41: {} | AB41: 2700 | AC41: 1920
C42: =RC[12] -> 10902 | D42: =RC[12] -> 神魔志幻境 | F42: =RC[22] -> 2700 | G42: =RC[22] -> 1920 | O42: 10902 | P42: 神魔志幻境 | Q42: 2 | R42: 3002 | S42: 4.745166959578207,5.748502994011976; | T42: 1250,600; | U42: 1101 | V42: 102 | W42: 1 | X42: 0 | Y42: 0 | Z42: 109 | AA42: {} | AB42: 2700 | AC42: 1920
C43: =RC[12] -> 10903 | D43: =RC[12] -> 尊师考验幻境 | F43: =RC[22] -> 2700 | G43: =RC[22] -> 1920 | O43: 10903 | P43: 尊师考验幻境 | Q43: 2 | R43: 2001 | S43: 3.79613356766257,5.74850299401198; | T43: 2300,1450; | U43: 4102 | V43: 100 | W43: 1 | X43: 0 | Y43: 0 | Z43: 115 | AA43: {100} | AB43: 2700 | AC43: 1920

Sheet: Sheet5
A4: 随机编号 | B4: 副本编号 | C4: =ctRandomPoint!RC -> 刷新中心点 | D4: 刷新半径 | E4: 角色等级下限（关联悬赏任务） | F4: 角色等级上限（关联悬赏任务） | G4: 用途类型 | I4: 宽 | J4: 高 | L4: 坐标宽 | M4: 坐标高 | O4: 宽差 | P4: 高差
A5: 1 | B5: 1 | C5: =RC[9]&","&RC[10]&";" -> 1080,457; | D5: 50 | E5: 1 | F5: 999 | G5: 5 | I5: =VLOOKUP(RC[-7],Sheet4!C15:C29,14,FALSE) -> 3240 | J5: =VLOOKUP(RC[-8],Sheet4!C15:C29,15,FALSE) -> 1920 | L5: 1080 | M5: 457 | O5: =RC[-6]-RC[-3] -> 2160 | P5: =RC[-6]-RC[-3] -> 1463 | R5: =IF(RC[-3]<50,1,0) -> 0 | S5: =IF(RC[-3]<50,1,0) -> 0
A6: 2 | B6: 1 | C6: =RC[9]&","&RC[10]&";" -> 2160,457; | D6: 50 | E6: 1 | F6: 999 | G6: 5 | I6: =VLOOKUP(RC[-7],Sheet4!C15:C29,14,FALSE) -> 3240 | J6: =VLOOKUP(RC[-8],Sheet4!C15:C29,15,FALSE) -> 1920 | L6: 2160 | M6: 457 | O6: =RC[-6]-RC[-3] -> 1080 | P6: =RC[-6]-RC[-3] -> 1463 | R6: =IF(RC[-3]<50,1,0) -> 0 | S6: =IF(RC[-3]<50,1,0) -> 0
A7: 3 | B7: 1 | C7: =RC[9]&","&RC[10]&";" -> 2240,457; | D7: 50 | E7: 1 | F7: 999 | G7: 5 | I7: =VLOOKUP(RC[-7],Sheet4!C15:C29,14,FALSE) -> 3240 | J7: =VLOOKUP(RC[-8],Sheet4!C15:C29,15,FALSE) -> 1920 | L7: 2240 | M7: 457 | O7: =RC[-6]-RC[-3] -> 1000 | P7: =RC[-6]-RC[-3] -> 1463 | R7: =IF(RC[-3]<50,1,0) -> 0 | S7: =IF(RC[-3]<50,1,0) -> 0
A8: 4 | B8: 1 | C8: =RC[9]&","&RC[10]&";" -> 1320,457; | D8: 50 | E8: 1 | F8: 999 | G8: 5 | I8: =VLOOKUP(RC[-7],Sheet4!C15:C29,14,FALSE) -> 3240 | J8: =VLOOKUP(RC[-8],Sheet4!C15:C29,15,FALSE) -> 1920 | L8: 1320 | M8: 457 | O8: =RC[-6]-RC[-3] -> 1920 | P8: =RC[-6]-RC[-3] -> 1463 | R8: =IF(RC[-3]<50,1,0) -> 0 | S8: =IF(RC[-3]<50,1,0) -> 0
A9: 5 | B9: 1 | C9: =RC[9]&","&RC[10]&";" -> 2400,457; | D9: 50 | E9: 1 | F9: 999 | G9: 5 | I9: =VLOOKUP(RC[-7],Sheet4!C15:C29,14,FALSE) -> 3240 | J9: =VLOOKUP(RC[-8],Sheet4!C15:C29,15,FALSE) -> 1920 | L9: 2400 | M9: 457 | O9: =RC[-6]-RC[-3] -> 840 | P9: =RC[-6]-RC[-3] -> 1463 | R9: =IF(RC[-3]<50,1,0) -> 0 | S9: =IF(RC[-3]<50,1,0) -> 0
A10: 6 | B10: 1 | C10: =RC[9]&","&RC[10]&";" -> 1080,814; | D10: 50 | E10: 1 | F10: 999 | G10: 5 | I10: =VLOOKUP(RC[-7],Sheet4!C15:C29,14,FALSE) -> 3240 | J10: =VLOOKUP(RC[-8],Sheet4!C15:C29,15,FALSE) -> 1920 | L10: 1080 | M10: 814 | O10: =RC[-6]-RC[-3] -> 2160 | P10: =RC[-6]-RC[-3] -> 1106 | R10: =IF(RC[-3]<50,1,0) -> 0 | S10: =IF(RC[-3]<50,1,0) -> 0
A11: 7 | B11: 1 | C11: =RC[9]&","&RC[10]&";" -> 2160,814; | D11: 50 | E11: 1 | F11: 999 | G11: 5 | I11: =VLOOKUP(RC[-7],Sheet4!C15:C29,14,FALSE) -> 3240 | J11: =VLOOKUP(RC[-8],Sheet4!C15:C29,15,FALSE) -> 1920 | L11: 2160 | M11: 814 | O11: =RC[-6]-RC[-3] -> 1080 | P11: =RC[-6]-RC[-3] -> 1106 | R11: =IF(RC[-3]<50,1,0) -> 0 | S11: =IF(RC[-3]<50,1,0) -> 0
A12: 8 | B12: 1 | C12: =RC[9]&","&RC[10]&";" -> 2240,814; | D12: 50 | E12: 1 | F12: 999 | G12: 5 | I12: =VLOOKUP(RC[-7],Sheet4!C15:C29,14,FALSE) -> 3240 | J12: =VLOOKUP(RC[-8],Sheet4!C15:C29,15,FALSE) -> 1920 | L12: 2240 | M12: 814 | O12: =RC[-6]-RC[-3] -> 1000 | P12: =RC[-6]-RC[-3] -> 1106 | R12: =IF(RC[-3]<50,1,0) -> 0 | S12: =IF(RC[-3]<50,1,0) -> 0
A13: 9 | B13: 1 | C13: =RC[9]&","&RC[10]&";" -> 1320,814; | D13: 50 | E13: 1 | F13: 999 | G13: 5 | I13: =VLOOKUP(RC[-7],Sheet4!C15:C29,14,FALSE) -> 3240 | J13: =VLOOKUP(RC[-8],Sheet4!C15:C29,15,FALSE) -> 1920 | L13: 1320 | M13: 814 | O13: =RC[-6]-RC[-3] -> 1920 | P13: =RC[-6]-RC[-3] -> 1106 | R13: =IF(RC[-3]<50,1,0) -> 0 | S13: =IF(RC[-3]<50,1,0) -> 0
A14: 10 | B14: 1 | C14: =RC[9]&","&RC[10]&";" -> 2400,814; | D14: 50 | E14: 1 | F14: 999 | G14: 5 | I14: =VLOOKUP(RC[-7],Sheet4!C15:C29,14,FALSE) -> 3240 | J14: =VLOOKUP(RC[-8],Sheet4!C15:C29,15,FALSE) -> 1920 | L14: 2400 | M14: 814 | O14: =RC[-6]-RC[-3] -> 840 | P14: =RC[-6]-RC[-3] -> 1106 | R14: =IF(RC[-3]<50,1,0) -> 0 | S14: =IF(RC[-3]<50,1,0) -> 0
A15: 11 | B15: 8 | C15: =RC[9]&","&RC[10]&";" -> 619,394; | D15: 50 | E15: 1 | F15: 999 | G15: 5 | I15: =VLOOKUP(RC[-7],Sheet4!C15:C29,14,FALSE) -> 2700 | J15: =VLOOKUP(RC[-8],Sheet4!C15:C29,15,FALSE) -> 1920 | L15: 619 | M15: 394 | O15: =RC[-6]-RC[-3] -> 2081 | P15: =RC[-6]-RC[-3] -> 1526 | R15: =IF(RC[-3]<50,1,0) -> 0 | S15: =IF(RC[-3]<50,1,0) -> 0
A16: 12 | B16: 8 | C16: =RC[9]&","&RC[10]&";" -> 1239,394; | D16: 50 | E16: 1 | F16: 999 | G16: 5 | I16: =VLOOKUP(RC[-7],Sheet4!C15:C29,14,FALSE) -> 2700 | J16: =VLOOKUP(RC[-8],Sheet4!C15:C29,15,FALSE) -> 1920 | L16: 1239 | M16: 394 | O16: =RC[-6]-RC[-3] -> 1461 | P16: =RC[-6]-RC[-3] -> 1526 | R16: =IF(RC[-3]<50,1,0) -> 0 | S16: =IF(RC[-3]<50,1,0) -> 0
A17: 13 | B17: 8 | C17: =RC[9]&","&RC[10]&";" -> 1858,394; | D17: 50 | E17: 1 | F17: 999 | G17: 5 | I17: =VLOOKUP(RC[-7],Sheet4!C15:C29,14,FALSE) -> 2700 | J17: =VLOOKUP(RC[-8],Sheet4!C15:C29,15,FALSE) -> 1920 | L17: 1858 | M17: 394 | O17: =RC[-6]-RC[-3] -> 842 | P17: =RC[-6]-RC[-3] -> 1526 | R17: =IF(RC[-3]<50,1,0) -> 0 | S17: =IF(RC[-3]<50,1,0) -> 0
A18: 14 | B18: 8 | C18: =RC[9]&","&RC[10]&";" -> 2278,394; | D18: 50 | E18: 1 | F18: 999 | G18: 5 | I18: =VLOOKUP(RC[-7],Sheet4!C15:C29,14,FALSE) -> 2700 | J18: =VLOOKUP(RC[-8],Sheet4!C15:C29,15,FALSE) -> 1920 | L18: 2278 | M18: 394 | O18: =RC[-6]-RC[-3] -> 422 | P18: =RC[-6]-RC[-3] -> 1526 | R18: =IF(RC[-3]<50,1,0) -> 0 | S18: =IF(RC[-3]<50,1,0) -> 0
A19: 15 | B19: 8 | C19: =RC[9]&","&RC[10]&";" -> 619,787; | D19: 50 | E19: 1 | F19: 999 | G19: 5 | I19: =VLOOKUP(RC[-7],Sheet4!C15:C29,14,FALSE) -> 2700 | J19: =VLOOKUP(RC[-8],Sheet4!C15:C29,15,FALSE) -> 1920 | L19: 619 | M19: 787 | O19: =RC[-6]-RC[-3] -> 2081 | P19: =RC[-6]-RC[-3] -> 1133 | R19: =IF(RC[-3]<50,1,0) -> 0 | S19: =IF(RC[-3]<50,1,0) -> 0
A20: 16 | B20: 2 | C20: =RC[9]&","&RC[10]&";" -> 540,384; | D20: 50 | E20: 1 | F20: 999 | G20: 6 | I20: =VLOOKUP(RC[-7],Sheet4!C15:C29,14,FALSE) -> 2160 | J20: =VLOOKUP(RC[-8],Sheet4!C15:C29,15,FALSE) -> 1920 | L20: 540 | M20: 384 | O20: =RC[-6]-RC[-3] -> 1620 | P20: =RC[-6]-RC[-3] -> 1536 | R20: =IF(RC[-3]<50,1,0) -> 0 | S20: =IF(RC[-3]<50,1,0) -> 0
A21: 17 | B21: 3 | C21: =RC[9]&","&RC[10]&";" -> 675,512; | D21: 50 | E21: 1 | F21: 999 | G21: 6 | I21: =VLOOKUP(RC[-7],Sheet4!C15:C29,14,FALSE) -> 2700 | J21: =VLOOKUP(RC[-8],Sheet4!C15:C29,15,FALSE) -> 1920 | L21: 675 | M21: 512 | O21: =RC[-6]-RC[-3] -> 2025 | P21: =RC[-6]-RC[-3] -> 1408 | R21: =IF(RC[-3]<50,1,0) -> 0 | S21: =IF(RC[-3]<50,1,0) -> 0
A22: 18 | B22: 4 | C22: =RC[9]&","&RC[10]&";" -> 810,512; | D22: 50 | E22: 1 | F22: 999 | G22: 6 | I22: =VLOOKUP(RC[-7],Sheet4!C15:C29,14,FALSE) -> 3240 | J22: =VLOOKUP(RC[-8],Sheet4!C15:C29,15,FALSE) -> 2560 | L22: 810 | M22: 512 | O22: =RC[-6]-RC[-3] -> 2430 | P22: =RC[-6]-RC[-3] -> 2048 | R22: =IF(RC[-3]<50,1,0) -> 0 | S22: =IF(RC[-3]<50,1,0) -> 0
A23: 19 | B23: 5 | C23: =RC[9]&","&RC[10]&";" -> 675,384; | D23: 50 | E23: 1 | F23: 999 | G23: 6 | I23: =VLOOKUP(RC[-7],Sheet4!C15:C29,14,FALSE) -> 2700 | J23: =VLOOKUP(RC[-8],Sheet4!C15:C29,15,FALSE) -> 1920 | L23: 675 | M23: 384 | O23: =RC[-6]-RC[-3] -> 2025 | P23: =RC[-6]-RC[-3] -> 1536 | R23: =IF(RC[-3]<50,1,0) -> 0 | S23: =IF(RC[-3]<50,1,0) -> 0
A24: 20 | B24: 6 | C24: =RC[9]&","&RC[10]&";" -> 540,384; | D24: 50 | E24: 1 | F24: 999 | G24: 6 | I24: =VLOOKUP(RC[-7],Sheet4!C15:C29,14,FALSE) -> 2160 | J24: =VLOOKUP(RC[-8],Sheet4!C15:C29,15,FALSE) -> 1920 | L24: 540 | M24: 384 | O24: =RC[-6]-RC[-3] -> 1620 | P24: =RC[-6]-RC[-3] -> 1536 | R24: =IF(RC[-3]<50,1,0) -> 0 | S24: =IF(RC[-3]<50,1,0) -> 0
A25: 21 | B25: 8 | C25: =RC[9]&","&RC[10]&";" -> 1239,787; | D25: 50 | E25: 1 | F25: 999 | G25: 6 | I25: =VLOOKUP(RC[-7],Sheet4!C15:C29,14,FALSE) -> 2700 | J25: =VLOOKUP(RC[-8],Sheet4!C15:C29,15,FALSE) -> 1920 | L25: 1239 | M25: 787 | O25: =RC[-6]-RC[-3] -> 1461 | P25: =RC[-6]-RC[-3] -> 1133 | R25: =IF(RC[-3]<50,1,0) -> 0 | S25: =IF(RC[-3]<50,1,0) -> 0
A26: 22 | B26: 2 | C26: =RC[9]&","&RC[10]&";" -> 1080,384; | D26: 50 | E26: 1 | F26: 999 | G26: 6 | I26: =VLOOKUP(RC[-7],Sheet4!C15:C29,14,FALSE) -> 2160 | J26: =VLOOKUP(RC[-8],Sheet4!C15:C29,15,FALSE) -> 1920 | L26: 1080 | M26: 384 | O26: =RC[-6]-RC[-3] -> 1080 | P26: =RC[-6]-RC[-3] -> 1536 | R26: =IF(RC[-3]<50,1,0) -> 0 | S26: =IF(RC[-3]<50,1,0) -> 0
A27: 23 | B27: 2 | C27: =RC[9]&","&RC[10]&";" -> 1620,384; | D27: 50 | E27: 1 | F27: 999 | G27: 6 | I27: =VLOOKUP(RC[-7],Sheet4!C15:C29,14,FALSE) -> 2160 | J27: =VLOOKUP(RC[-8],Sheet4!C15:C29,15,FALSE) -> 1920 | L27: 1620 | M27: 384 | O27: =RC[-6]-RC[-3] -> 540 | P27: =RC[-6]-RC[-3] -> 1536 | R27: =IF(RC[-3]<50,1,0) -> 0 | S27: =IF(RC[-3]<50,1,0) -> 0
A28: 24 | B28: 2 | C28: =RC[9]&","&RC[10]&";" -> 540,768; | D28: 50 | E28: 1 | F28: 999 | G28: 6 | I28: =VLOOKUP(RC[-7],Sheet4!C15:C29,14,FALSE) -> 2160 | J28: =VLOOKUP(RC[-8],Sheet4!C15:C29,15,FALSE) -> 1920 | L28: 540 | M28: 768 | O28: =RC[-6]-RC[-3] -> 1620 | P28: =RC[-6]-RC[-3] -> 1152 | R28: =IF(RC[-3]<50,1,0) -> 0 | S28: =IF(RC[-3]<50,1,0) -> 0
A29: 25 | B29: 2 | C29: =RC[9]&","&RC[10]&";" -> 1080,768; | D29: 50 | E29: 1 | F29: 999 | G29: 6 | I29: =VLOOKUP(RC[-7],Sheet4!C15:C29,14,FALSE) -> 2160 | J29: =VLOOKUP(RC[-8],Sheet4!C15:C29,15,FALSE) -> 1920 | L29: 1080 | M29: 768 | O29: =RC[-6]-RC[-3] -> 1080 | P29: =RC[-6]-RC[-3] -> 1152 | R29: =IF(RC[-3]<50,1,0) -> 0 | S29: =IF(RC[-3]<50,1,0) -> 0
A30: 26 | B30: 3 | C30: =RC[9]&","&RC[10]&";" -> 1350,512; | D30: 50 | E30: 1 | F30: 999 | G30: 6 | I30: =VLOOKUP(RC[-7],Sheet4!C15:C29,14,FALSE) -> 2700 | J30: =VLOOKUP(RC[-8],Sheet4!C15:C29,15,FALSE) -> 1920 | L30: 1350 | M30: 512 | O30: =RC[-6]-RC[-3] -> 1350 | P30: =RC[-6]-RC[-3] -> 1408 | R30: =IF(RC[-3]<50,1,0) -> 0 | S30: =IF(RC[-3]<50,1,0) -> 0
A31: 27 | B31: 3 | C31: =RC[9]&","&RC[10]&";" -> 1030,812; | D31: 50 | E31: 1 | F31: 999 | G31: 6 | I31: =VLOOKUP(RC[-7],Sheet4!C15:C29,14,FALSE) -> 2700 | J31: =VLOOKUP(RC[-8],Sheet4!C15:C29,15,FALSE) -> 1920 | L31: 1030 | M31: 812 | O31: =RC[-6]-RC[-3] -> 1670 | P31: =RC[-6]-RC[-3] -> 1108 | R31: =IF(RC[-3]<50,1,0) -> 0 | S31: =IF(RC[-3]<50,1,0) -> 0
A32: 28 | B32: 3 | C32: =RC[9]&","&RC[10]&";" -> 540,1024; | D32: 50 | E32: 1 | F32: 999 | G32: 6 | I32: =VLOOKUP(RC[-7],Sheet4!C15:C29,14,FALSE) -> 2700 | J32: =VLOOKUP(RC[-8],Sheet4!C15:C29,15,FALSE) -> 1920 | L32: 540 | M32: 1024 | O32: =RC[-6]-RC[-3] -> 2160 | P32: =RC[-6]-RC[-3] -> 896 | R32: =IF(RC[-3]<50,1,0) -> 0 | S32: =IF(RC[-3]<50,1,0) -> 0
A33: 29 | B33: 3 | C33: =RC[9]&","&RC[10]&";" -> 530,1380; | D33: 50 | E33: 1 | F33: 999 | G33: 6 | I33: =VLOOKUP(RC[-7],Sheet4!C15:C29,14,FALSE) -> 2700 | J33: =VLOOKUP(RC[-8],Sheet4!C15:C29,15,FALSE) -> 1920 | L33: 530 | M33: 1380 | O33: =RC[-6]-RC[-3] -> 2170 | P33: =RC[-6]-RC[-3] -> 540 | R33: =IF(RC[-3]<50,1,0) -> 0 | S33: =IF(RC[-3]<50,1,0) -> 0
A34: 30 | B34: 4 | C34: =RC[9]&","&RC[10]&";" -> 1620,512; | D34: 50 | E34: 1 | F34: 999 | G34: 6 | I34: =VLOOKUP(RC[-7],Sheet4!C15:C29,14,FALSE) -> 3240 | J34: =VLOOKUP(RC[-8],Sheet4!C15:C29,15,FALSE) -> 2560 | L34: 1620 | M34: 512 | O34: =RC[-6]-RC[-3] -> 1620 | P34: =RC[-6]-RC[-3] -> 2048 | R34: =IF(RC[-3]<50,1,0) -> 0 | S34: =IF(RC[-3]<50,1,0) -> 0
A35: 31 | B35: 4 | C35: =RC[9]&","&RC[10]&";" -> 2430,512; | D35: 50 | E35: 1 | F35: 999 | G35: 6 | I35: =VLOOKUP(RC[-7],Sheet4!C15:C29,14,FALSE) -> 3240 | J35: =VLOOKUP(RC[-8],Sheet4!C15:C29,15,FALSE) -> 2560 | L35: 2430 | M35: 512 | O35: =RC[-6]-RC[-3] -> 810 | P35: =RC[-6]-RC[-3] -> 2048 | R35: =IF(RC[-3]<50,1,0) -> 0 | S35: =IF(RC[-3]<50,1,0) -> 0
A36: 32 | B36: 4 | C36: =RC[9]&","&RC[10]&";" -> 648,1024; | D36: 50 | E36: 1 | F36: 999 | G36: 6 | I36: =VLOOKUP(RC[-7],Sheet4!C15:C29,14,FALSE) -> 3240 | J36: =VLOOKUP(RC[-8],Sheet4!C15:C29,15,FALSE) -> 2560 | L36: 648 | M36: 1024 | O36: =RC[-6]-RC[-3] -> 2592 | P36: =RC[-6]-RC[-3] -> 1536 | R36: =IF(RC[-3]<50,1,0) -> 0 | S36: =IF(RC[-3]<50,1,0) -> 0
A37: 33 | B37: 4 | C37: =RC[9]&","&RC[10]&";" -> 1296,1024; | D37: 50 | E37: 1 | F37: 999 | G37: 6 | I37: =VLOOKUP(RC[-7],Sheet4!C15:C29,14,FALSE) -> 3240 | J37: =VLOOKUP(RC[-8],Sheet4!C15:C29,15,FALSE) -> 2560 | L37: 1296 | M37: 1024 | O37: =RC[-6]-RC[-3] -> 1944 | P37: =RC[-6]-RC[-3] -> 1536 | R37: =IF(RC[-3]<50,1,0) -> 0 | S37: =IF(RC[-3]<50,1,0) -> 0
A38: 34 | B38: 5 | C38: =RC[9]&","&RC[10]&";" -> 1350,384; | D38: 50 | E38: 1 | F38: 999 | G38: 6 | I38: =VLOOKUP(RC[-7],Sheet4!C15:C29,14,FALSE) -> 2700 | J38: =VLOOKUP(RC[-8],Sheet4!C15:C29,15,FALSE) -> 1920 | L38: 1350 | M38: 384 | O38: =RC[-6]-RC[-3] -> 1350 | P38: =RC[-6]-RC[-3] -> 1536 | R38: =IF(RC[-3]<50,1,0) -> 0 | S38: =IF(RC[-3]<50,1,0) -> 0
A39: 35 | B39: 5 | C39: =RC[9]&","&RC[10]&";" -> 2025,384; | D39: 50 | E39: 1 | F39: 999 | G39: 6 | I39: =VLOOKUP(RC[-7],Sheet4!C15:C29,14,FALSE) -> 2700 | J39: =VLOOKUP(RC[-8],Sheet4!C15:C29,15,FALSE) -> 1920 | L39: 2025 | M39: 384 | O39: =RC[-6]-RC[-3] -> 675 | P39: =RC[-6]-RC[-3] -> 1536 | R39: =IF(RC[-3]<50,1,0) -> 0 | S39: =IF(RC[-3]<50,1,0) -> 0
A40: 36 | B40: 5 | C40: =RC[9]&","&RC[10]&";" -> 540,768; | D40: 50 | E40: 1 | F40: 999 | G40: 6 | I40: =VLOOKUP(RC[-7],Sheet4!C15:C29,14,FALSE) -> 2700 | J40: =VLOOKUP(RC[-8],Sheet4!C15:C29,15,FALSE) -> 1920 | L40: 540 | M40: 768 | O40: =RC[-6]-RC[-3] -> 2160 | P40: =RC[-6]-RC[-3] -> 1152 | R40: =IF(RC[-3]<50,1,0) -> 0 | S40: =IF(RC[-3]<50,1,0) -> 0
A41: 37 | B41: 5 | C41: =RC[9]&","&RC[10]&";" -> 1080,768; | D41: 50 | E41: 1 | F41: 999 | G41: 6 | I41: =VLOOKUP(RC[-7],Sheet4!C15:C29,14,FALSE) -> 2700 | J41: =VLOOKUP(RC[-8],Sheet4!C15:C29,15,FALSE) -> 1920 | L41: 1080 | M41: 768 | O41: =RC[-6]-RC[-3] -> 1620 | P41: =RC[-6]-RC[-3] -> 1152 | R41: =IF(RC[-3]<50,1,0) -> 0 | S41: =IF(RC[-3]<50,1,0) -> 0
A42: 38 | B42: 6 | C42: =RC[9]&","&RC[10]&";" -> 1080,384; | D42: 50 | E42: 1 | F42: 999 | G42: 6 | I42: =VLOOKUP(RC[-7],Sheet4!C15:C29,14,FALSE) -> 2160 | J42: =VLOOKUP(RC[-8],Sheet4!C15:C29,15,FALSE) -> 1920 | L42: 1080 | M42: 384 | O42: =RC[-6]-RC[-3] -> 1080 | P42: =RC[-6]-RC[-3] -> 1536 | R42: =IF(RC[-3]<50,1,0) -> 0 | S42: =IF(RC[-3]<50,1,0) -> 0
A43: 39 | B43: 6 | C43: =RC[9]&","&RC[10]&";" -> 1620,384; | D43: 50 | E43: 1 | F43: 999 | G43: 6 | I43: =VLOOKUP(RC[-7],Sheet4!C15:C29,14,FALSE) -> 2160 | J43: =VLOOKUP(RC[-8],Sheet4!C15:C29,15,FALSE) -> 1920 | L43: 1620 | M43: 384 | O43: =RC[-6]-RC[-3] -> 540 | P43: =RC[-6]-RC[-3] -> 1536 | R43: =IF(RC[-3]<50,1,0) -> 0 | S43: =IF(RC[-3]<50,1,0) -> 0
A44: 40 | B44: 6 | C44: =RC[9]&","&RC[10]&";" -> 432,768; | D44: 50 | E44: 1 | F44: 999 | G44: 6 | I44: =VLOOKUP(RC[-7],Sheet4!C15:C29,14,FALSE) -> 2160 | J44: =VLOOKUP(RC[-8],Sheet4!C15:C29,15,FALSE) -> 1920 | L44: 432 | M44: 768 | O44: =RC[-6]-RC[-3] -> 1728 | P44: =RC[-6]-RC[-3] -> 1152 | R44: =IF(RC[-3]<50,1,0) -> 0 | S44: =IF(RC[-3]<50,1,0) -> 0
A45: 41 | B45: 6 | C45: =RC[9]&","&RC[10]&";" -> 864,768; | D45: 50 | E45: 1 | F45: 999 | G45: 6 | I45: =VLOOKUP(RC[-7],Sheet4!C15:C29,14,FALSE) -> 2160 | J45: =VLOOKUP(RC[-8],Sheet4!C15:C29,15,FALSE) -> 1920 | L45: 864 | M45: 768 | O45: =RC[-6]-RC[-3] -> 1296 | P45: =RC[-6]-RC[-3] -> 1152 | R45: =IF(RC[-3]<50,1,0) -> 0 | S45: =IF(RC[-3]<50,1,0) -> 0
A46: 42 | B46: 8 | C46: =RC[9]&","&RC[10]&";" -> 1858,787; | D46: 50 | E46: 1 | F46: 999 | G46: 6 | I46: =VLOOKUP(RC[-7],Sheet4!C15:C29,14,FALSE) -> 2700 | J46: =VLOOKUP(RC[-8],Sheet4!C15:C29,15,FALSE) -> 1920 | L46: 1858 | M46: 787 | O46: =RC[-6]-RC[-3] -> 842 | P46: =RC[-6]-RC[-3] -> 1133 | R46: =IF(RC[-3]<50,1,0) -> 0 | S46: =IF(RC[-3]<50,1,0) -> 0
A47: 43 | B47: 8 | C47: =RC[9]&","&RC[10]&";" -> 2478,787; | D47: 50 | E47: 1 | F47: 999 | G47: 6 | I47: =VLOOKUP(RC[-7],Sheet4!C15:C29,14,FALSE) -> 2700 | J47: =VLOOKUP(RC[-8],Sheet4!C15:C29,15,FALSE) -> 1920 | L47: 2478 | M47: 787 | O47: =RC[-6]-RC[-3] -> 222 | P47: =RC[-6]-RC[-3] -> 1133 | R47: =IF(RC[-3]<50,1,0) -> 0 | S47: =IF(RC[-3]<50,1,0) -> 0
A48: 44 | B48: 8 | C48: =RC[9]&","&RC[10]&";" -> 619,1181; | D48: 50 | E48: 1 | F48: 999 | G48: 6 | I48: =VLOOKUP(RC[-7],Sheet4!C15:C29,14,FALSE) -> 2700 | J48: =VLOOKUP(RC[-8],Sheet4!C15:C29,15,FALSE) -> 1920 | L48: 619 | M48: 1181 | O48: =RC[-6]-RC[-3] -> 2081 | P48: =RC[-6]-RC[-3] -> 739 | R48: =IF(RC[-3]<50,1,0) -> 0 | S48: =IF(RC[-3]<50,1,0) -> 0
A49: 45 | B49: 8 | C49: =RC[9]&","&RC[10]&";" -> 1239,1181; | D49: 50 | E49: 1 | F49: 999 | G49: 6 | I49: =VLOOKUP(RC[-7],Sheet4!C15:C29,14,FALSE) -> 2700 | J49: =VLOOKUP(RC[-8],Sheet4!C15:C29,15,FALSE) -> 1920 | L49: 1239 | M49: 1181 | O49: =RC[-6]-RC[-3] -> 1461 | P49: =RC[-6]-RC[-3] -> 739 | R49: =IF(RC[-3]<50,1,0) -> 0 | S49: =IF(RC[-3]<50,1,0) -> 0
A50: 46 | B50: 1 | C50: =RC[9]&","&RC[10]&";" -> 1080,1371; | D50: 50 | E50: 1 | F50: 999 | G50: 2 | I50: =VLOOKUP(RC[-7],Sheet4!C15:C29,14,FALSE) -> 3240 | J50: =VLOOKUP(RC[-8],Sheet4!C15:C29,15,FALSE) -> 1920 | L50: 1080 | M50: 1371 | O50: =RC[-6]-RC[-3] -> 2160 | P50: =RC[-6]-RC[-3] -> 549 | R50: =IF(RC[-3]<50,1,0) -> 0 | S50: =IF(RC[-3]<50,1,0) -> 0
A51: 47 | B51: 1 | C51: =RC[9]&","&RC[10]&";" -> 2160,1371; | D51: 50 | E51: 1 | F51: 999 | G51: 2 | I51: =VLOOKUP(RC[-7],Sheet4!C15:C29,14,FALSE) -> 3240 | J51: =VLOOKUP(RC[-8],Sheet4!C15:C29,15,FALSE) -> 1920 | L51: 2160 | M51: 1371 | O51: =RC[-6]-RC[-3] -> 1080 | P51: =RC[-6]-RC[-3] -> 549 | R51: =IF(RC[-3]<50,1,0) -> 0 | S51: =IF(RC[-3]<50,1,0) -> 0
A52: 48 | B52: 1 | C52: =RC[9]&","&RC[10]&";" -> 2500,1371; | D52: 50 | E52: 1 | F52: 999 | G52: 2 | I52: =VLOOKUP(RC[-7],Sheet4!C15:C29,14,FALSE) -> 3240 | J52: =VLOOKUP(RC[-8],Sheet4!C15:C29,15,FALSE) -> 1920 | L52: 2500 | M52: 1371 | O52: =RC[-6]-RC[-3] -> 740 | P52: =RC[-6]-RC[-3] -> 549 | R52: =IF(RC[-3]<50,1,0) -> 0 | S52: =IF(RC[-3]<50,1,0) -> 0
A53: 49 | B53: 1 | C53: =RC[9]&","&RC[10]&";" -> 2900,1371; | D53: 50 | E53: 1 | F53: 999 | G53: 2 | I53: =VLOOKUP(RC[-7],Sheet4!C15:C29,14,FALSE) -> 3240 | J53: =VLOOKUP(RC[-8],Sheet4!C15:C29,15,FALSE) -> 1920 | L53: 2900 | M53: 1371 | O53: =RC[-6]-RC[-3] -> 340 | P53: =RC[-6]-RC[-3] -> 549 | R53: =IF(RC[-3]<50,1,0) -> 0 | S53: =IF(RC[-3]<50,1,0) -> 0
A54: 50 | B54: 1 | C54: =RC[9]&","&RC[10]&";" -> 3050,1371; | D54: 50 | E54: 1 | F54: 999 | G54: 2 | I54: =VLOOKUP(RC[-7],Sheet4!C15:C29,14,FALSE) -> 3240 | J54: =VLOOKUP(RC[-8],Sheet4!C15:C29,15,FALSE) -> 1920 | L54: 3050 | M54: 1371 | O54: =RC[-6]-RC[-3] -> 190 | P54: =RC[-6]-RC[-3] -> 549 | R54: =IF(RC[-3]<50,1,0) -> 0 | S54: =IF(RC[-3]<50,1,0) -> 0
A55: 51 | B55: 1 | C55: =RC[9]&","&RC[10]&";" -> 1080,1829; | D55: 50 | E55: 1 | F55: 999 | G55: 2 | I55: =VLOOKUP(RC[-7],Sheet4!C15:C29,14,FALSE) -> 3240 | J55: =VLOOKUP(RC[-8],Sheet4!C15:C29,15,FALSE) -> 1920 | L55: 1080 | M55: 1829 | O55: =RC[-6]-RC[-3] -> 2160 | P55: =RC[-6]-RC[-3] -> 91 | R55: =IF(RC[-3]<50,1,0) -> 0 | S55: =IF(RC[-3]<50,1,0) -> 0
A56: 52 | B56: 1 | C56: =RC[9]&","&RC[10]&";" -> 2160,1829; | D56: 50 | E56: 1 | F56: 999 | G56: 2 | I56: =VLOOKUP(RC[-7],Sheet4!C15:C29,14,FALSE) -> 3240 | J56: =VLOOKUP(RC[-8],Sheet4!C15:C29,15,FALSE) -> 1920 | L56: 2160 | M56: 1829 | O56: =RC[-6]-RC[-3] -> 1080 | P56: =RC[-6]-RC[-3] -> 91 | R56: =IF(RC[-3]<50,1,0) -> 0 | S56: =IF(RC[-3]<50,1,0) -> 0
A57: 53 | B57: 1 | C57: =RC[9]&","&RC[10]&";" -> 2700,1829; | D57: 50 | E57: 1 | F57: 999 | G57: 2 | I57: =VLOOKUP(RC[-7],Sheet4!C15:C29,14,FALSE) -> 3240 | J57: =VLOOKUP(RC[-8],Sheet4!C15:C29,15,FALSE) -> 1920 | L57: 2700 | M57: 1829 | O57: =RC[-6]-RC[-3] -> 540 | P57: =RC[-6]-RC[-3] -> 91 | R57: =IF(RC[-3]<50,1,0) -> 0 | S57: =IF(RC[-3]<50,1,0) -> 0
A58: 54 | B58: 1 | C58: =RC[9]&","&RC[10]&";" -> 3080,1829; | D58: 50 | E58: 1 | F58: 999 | G58: 2 | I58: =VLOOKUP(RC[-7],Sheet4!C15:C29,14,FALSE) -> 3240 | J58: =VLOOKUP(RC[-8],Sheet4!C15:C29,15,FALSE) -> 1920 | L58: 3080 | M58: 1829 | O58: =RC[-6]-RC[-3] -> 160 | P58: =RC[-6]-RC[-3] -> 91 | R58: =IF(RC[-3]<50,1,0) -> 0 | S58: =IF(RC[-3]<50,1,0) -> 0
A59: 55 | B59: 1 | C59: =RC[9]&","&RC[10]&";" -> 2900,1829; | D59: 50 | E59: 1 | F59: 999 | G59: 2 | I59: =VLOOKUP(RC[-7],Sheet4!C15:C29,14,FALSE) -> 3240 | J59: =VLOOKUP(RC[-8],Sheet4!C15:C29,15,FALSE) -> 1920 | L59: 2900 | M59: 1829 | O59: =RC[-6]-RC[-3] -> 340 | P59: =RC[-6]-RC[-3] -> 91 | R59: =IF(RC[-3]<50,1,0) -> 0 | S59: =IF(RC[-3]<50,1,0) -> 0
A60: 56 | B60: 2 | C60: =RC[9]&","&RC[10]&";" -> 1620,768; | D60: 50 | E60: 1 | F60: 999 | G60: 2 | I60: =VLOOKUP(RC[-7],Sheet4!C15:C29,14,FALSE) -> 2160 | J60: =VLOOKUP(RC[-8],Sheet4!C15:C29,15,FALSE) -> 1920 | L60: 1620 | M60: 768 | O60: =RC[-6]-RC[-3] -> 540 | P60: =RC[-6]-RC[-3] -> 1152 | R60: =IF(RC[-3]<50,1,0) -> 0 | S60: =IF(RC[-3]<50,1,0) -> 0
A61: 57 | B61: 2 | C61: =RC[9]&","&RC[10]&";" -> 540,1152; | D61: 50 | E61: 1 | F61: 999 | G61: 2 | I61: =VLOOKUP(RC[-7],Sheet4!C15:C29,14,FALSE) -> 2160 | J61: =VLOOKUP(RC[-8],Sheet4!C15:C29,15,FALSE) -> 1920 | L61: 540 | M61: 1152 | O61: =RC[-6]-RC[-3] -> 1620 | P61: =RC[-6]-RC[-3] -> 768 | R61: =IF(RC[-3]<50,1,0) -> 0 | S61: =IF(RC[-3]<50,1,0) -> 0
A62: 58 | B62: 2 | C62: =RC[9]&","&RC[10]&";" -> 1080,1152; | D62: 50 | E62: 1 | F62: 999 | G62: 2 | I62: =VLOOKUP(RC[-7],Sheet4!C15:C29,14,FALSE) -> 2160 | J62: =VLOOKUP(RC[-8],Sheet4!C15:C29,15,FALSE) -> 1920 | L62: 1080 | M62: 1152 | O62: =RC[-6]-RC[-3] -> 1080 | P62: =RC[-6]-RC[-3] -> 768 | R62: =IF(RC[-3]<50,1,0) -> 0 | S62: =IF(RC[-3]<50,1,0) -> 0
A63: 59 | B63: 2 | C63: =RC[9]&","&RC[10]&";" -> 1620,1152; | D63: 50 | E63: 1 | F63: 999 | G63: 2 | I63: =VLOOKUP(RC[-7],Sheet4!C15:C29,14,FALSE) -> 2160 | J63: =VLOOKUP(RC[-8],Sheet4!C15:C29,15,FALSE) -> 1920 | L63: 1620 | M63: 1152 | O63: =RC[-6]-RC[-3] -> 540 | P63: =RC[-6]-RC[-3] -> 768 | R63: =IF(RC[-3]<50,1,0) -> 0 | S63: =IF(RC[-3]<50,1,0) -> 0
A64: 60 | B64: 3 | C64: =RC[9]&","&RC[10]&";" -> 330,1290; | D64: 50 | E64: 1 | F64: 999 | G64: 2 | I64: =VLOOKUP(RC[-7],Sheet4!C15:C29,14,FALSE) -> 2700 | J64: =VLOOKUP(RC[-8],Sheet4!C15:C29,15,FALSE) -> 1920 | L64: 330 | M64: 1290 | O64: =RC[-6]-RC[-3] -> 2370 | P64: =RC[-6]-RC[-3] -> 630 | R64: =IF(RC[-3]<50,1,0) -> 0 | S64: =IF(RC[-3]<50,1,0) -> 0
A65: 61 | B65: 3 | C65: =RC[9]&","&RC[10]&";" -> 1310,1210; | D65: 50 | E65: 1 | F65: 999 | G65: 2 | I65: =VLOOKUP(RC[-7],Sheet4!C15:C29,14,FALSE) -> 2700 | J65: =VLOOKUP(RC[-8],Sheet4!C15:C29,15,FALSE) -> 1920 | L65: 1310 | M65: 1210 | O65: =RC[-6]-RC[-3] -> 1390 | P65: =RC[-6]-RC[-3] -> 710 | R65: =IF(RC[-3]<50,1,0) -> 0 | S65: =IF(RC[-3]<50,1,0) -> 0
A66: 62 | B66: 3 | C66: =RC[9]&","&RC[10]&";" -> 1530,880; | D66: 50 | E66: 1 | F66: 999 | G66: 2 | I66: =VLOOKUP(RC[-7],Sheet4!C15:C29,14,FALSE) -> 2700 | J66: =VLOOKUP(RC[-8],Sheet4!C15:C29,15,FALSE) -> 1920 | L66: 1530 | M66: 880 | O66: =RC[-6]-RC[-3] -> 1170 | P66: =RC[-6]-RC[-3] -> 1040 | R66: =IF(RC[-3]<50,1,0) -> 0 | S66: =IF(RC[-3]<50,1,0) -> 0
A67: 63 | B67: 3 | C67: =RC[9]&","&RC[10]&";" -> 1730,1080; | D67: 50 | E67: 1 | F67: 999 | G67: 2 | I67: =VLOOKUP(RC[-7],Sheet4!C15:C29,14,FALSE) -> 2700 | J67: =VLOOKUP(RC[-8],Sheet4!C15:C29,15,FALSE) -> 1920 | L67: 1730 | M67: 1080 | O67: =RC[-6]-RC[-3] -> 970 | P67: =RC[-6]-RC[-3] -> 840 | R67: =IF(RC[-3]<50,1,0) -> 0 | S67: =IF(RC[-3]<50,1,0) -> 0
A68: 64 | B68: 4 | C68: =RC[9]&","&RC[10]&";" -> 1944,1024; | D68: 50 | E68: 1 | F68: 999 | G68: 2 | I68: =VLOOKUP(RC[-7],Sheet4!C15:C29,14,FALSE) -> 3240 | J68: =VLOOKUP(RC[-8],Sheet4!C15:C29,15,FALSE) -> 2560 | L68: 1944 | M68: 1024 | O68: =RC[-6]-RC[-3] -> 1296 | P68: =RC[-6]-RC[-3] -> 1536 | R68: =IF(RC[-3]<50,1,0) -> 0 | S68: =IF(RC[-3]<50,1,0) -> 0
A69: 65 | B69: 4 | C69: =RC[9]&","&RC[10]&";" -> 2592,1024; | D69: 50 | E69: 1 | F69: 999 | G69: 2 | I69: =VLOOKUP(RC[-7],Sheet4!C15:C29,14,FALSE) -> 3240 | J69: =VLOOKUP(RC[-8],Sheet4!C15:C29,15,FALSE) -> 2560 | L69: 2592 | M69: 1024 | O69: =RC[-6]-RC[-3] -> 648 | P69: =RC[-6]-RC[-3] -> 1536 | R69: =IF(RC[-3]<50,1,0) -> 0 | S69: =IF(RC[-3]<50,1,0) -> 0
A70: 66 | B70: 4 | C70: =RC[9]&","&RC[10]&";" -> 648,1536; | D70: 50 | E70: 1 | F70: 999 | G70: 2 | I70: =VLOOKUP(RC[-7],Sheet4!C15:C29,14,FALSE) -> 3240 | J70: =VLOOKUP(RC[-8],Sheet4!C15:C29,15,FALSE) -> 2560 | L70: 648 | M70: 1536 | O70: =RC[-6]-RC[-3] -> 2592 | P70: =RC[-6]-RC[-3] -> 1024 | R70: =IF(RC[-3]<50,1,0) -> 0 | S70: =IF(RC[-3]<50,1,0) -> 0
A71: 67 | B71: 4 | C71: =RC[9]&","&RC[10]&";" -> 1296,1536; | D71: 50 | E71: 1 | F71: 999 | G71: 2 | I71: =VLOOKUP(RC[-7],Sheet4!C15:C29,14,FALSE) -> 3240 | J71: =VLOOKUP(RC[-8],Sheet4!C15:C29,15,FALSE) -> 2560 | L71: 1296 | M71: 1536 | O71: =RC[-6]-RC[-3] -> 1944 | P71: =RC[-6]-RC[-3] -> 1024 | R71: =IF(RC[-3]<50,1,0) -> 0 | S71: =IF(RC[-3]<50,1,0) -> 0
A72: 68 | B72: 4 | C72: =RC[9]&","&RC[10]&";" -> 1944,1536; | D72: 50 | E72: 1 | F72: 999 | G72: 2 | I72: =VLOOKUP(RC[-7],Sheet4!C15:C29,14,FALSE) -> 3240 | J72: =VLOOKUP(RC[-8],Sheet4!C15:C29,15,FALSE) -> 2560 | L72: 1944 | M72: 1536 | O72: =RC[-6]-RC[-3] -> 1296 | P72: =RC[-6]-RC[-3] -> 1024 | R72: =IF(RC[-3]<50,1,0) -> 0 | S72: =IF(RC[-3]<50,1,0) -> 0
A73: 69 | B73: 5 | C73: =RC[9]&","&RC[10]&";" -> 1620,768; | D73: 50 | E73: 1 | F73: 999 | G73: 2 | I73: =VLOOKUP(RC[-7],Sheet4!C15:C29,14,FALSE) -> 2700 | J73: =VLOOKUP(RC[-8],Sheet4!C15:C29,15,FALSE) -> 1920 | L73: 1620 | M73: 768 | O73: =RC[-6]-RC[-3] -> 1080 | P73: =RC[-6]-RC[-3] -> 1152 | R73: =IF(RC[-3]<50,1,0) -> 0 | S73: =IF(RC[-3]<50,1,0) -> 0
A74: 70 | B74: 5 | C74: =RC[9]&","&RC[10]&";" -> 2160,768; | D74: 50 | E74: 1 | F74: 999 | G74: 2 | I74: =VLOOKUP(RC[-7],Sheet4!C15:C29,14,FALSE) -> 2700 | J74: =VLOOKUP(RC[-8],Sheet4!C15:C29,15,FALSE) -> 1920 | L74: 2160 | M74: 768 | O74: =RC[-6]-RC[-3] -> 540 | P74: =RC[-6]-RC[-3] -> 1152 | R74: =IF(RC[-3]<50,1,0) -> 0 | S74: =IF(RC[-3]<50,1,0) -> 0
A75: 71 | B75: 5 | C75: =RC[9]&","&RC[10]&";" -> 675,1152; | D75: 50 | E75: 1 | F75: 999 | G75: 2 | I75: =VLOOKUP(RC[-7],Sheet4!C15:C29,14,FALSE) -> 2700 | J75: =VLOOKUP(RC[-8],Sheet4!C15:C29,15,FALSE) -> 1920 | L75: 675 | M75: 1152 | O75: =RC[-6]-RC[-3] -> 2025 | P75: =RC[-6]-RC[-3] -> 768 | R75: =IF(RC[-3]<50,1,0) -> 0 | S75: =IF(RC[-3]<50,1,0) -> 0
A76: 72 | B76: 5 | C76: =RC[9]&","&RC[10]&";" -> 1350,1152; | D76: 50 | E76: 1 | F76: 999 | G76: 2 | I76: =VLOOKUP(RC[-7],Sheet4!C15:C29,14,FALSE) -> 2700 | J76: =VLOOKUP(RC[-8],Sheet4!C15:C29,15,FALSE) -> 1920 | L76: 1350 | M76: 1152 | O76: =RC[-6]-RC[-3] -> 1350 | P76: =RC[-6]-RC[-3] -> 768 | R76: =IF(RC[-3]<50,1,0) -> 0 | S76: =IF(RC[-3]<50,1,0) -> 0
A77: 73 | B77: 6 | C77: =RC[9]&","&RC[10]&";" -> 1296,768; | D77: 50 | E77: 1 | F77: 999 | G77: 2 | I77: =VLOOKUP(RC[-7],Sheet4!C15:C29,14,FALSE) -> 2160 | J77: =VLOOKUP(RC[-8],Sheet4!C15:C29,15,FALSE) -> 1920 | L77: 1296 | M77: 768 | O77: =RC[-6]-RC[-3] -> 864 | P77: =RC[-6]-RC[-3] -> 1152 | R77: =IF(RC[-3]<50,1,0) -> 0 | S77: =IF(RC[-3]<50,1,0) -> 0
A78: 74 | B78: 6 | C78: =RC[9]&","&RC[10]&";" -> 1728,768; | D78: 50 | E78: 1 | F78: 999 | G78: 2 | I78: =VLOOKUP(RC[-7],Sheet4!C15:C29,14,FALSE) -> 2160 | J78: =VLOOKUP(RC[-8],Sheet4!C15:C29,15,FALSE) -> 1920 | L78: 1728 | M78: 768 | O78: =RC[-6]-RC[-3] -> 432 | P78: =RC[-6]-RC[-3] -> 1152 | R78: =IF(RC[-3]<50,1,0) -> 0 | S78: =IF(RC[-3]<50,1,0) -> 0
A79: 75 | B79: 6 | C79: =RC[9]&","&RC[10]&";" -> 540,1152; | D79: 50 | E79: 1 | F79: 999 | G79: 2 | I79: =VLOOKUP(RC[-7],Sheet4!C15:C29,14,FALSE) -> 2160 | J79: =VLOOKUP(RC[-8],Sheet4!C15:C29,15,FALSE) -> 1920 | L79: 540 | M79: 1152 | O79: =RC[-6]-RC[-3] -> 1620 | P79: =RC[-6]-RC[-3] -> 768 | R79: =IF(RC[-3]<50,1,0) -> 0 | S79: =IF(RC[-3]<50,1,0) -> 0
A80: 76 | B80: 6 | C80: =RC[9]&","&RC[10]&";" -> 1080,1152; | D80: 50 | E80: 1 | F80: 999 | G80: 2 | I80: =VLOOKUP(RC[-7],Sheet4!C15:C29,14,FALSE) -> 2160 | J80: =VLOOKUP(RC[-8],Sheet4!C15:C29,15,FALSE) -> 1920 | L80: 1080 | M80: 1152 | O80: =RC[-6]-RC[-3] -> 1080 | P80: =RC[-6]-RC[-3] -> 768 | R80: =IF(RC[-3]<50,1,0) -> 0 | S80: =IF(RC[-3]<50,1,0) -> 0
A81: 77 | B81: 8 | C81: =RC[9]&","&RC[10]&";" -> 1728,851; | D81: 50 | E81: 1 | F81: 999 | G81: 2 | I81: =VLOOKUP(RC[-7],Sheet4!C15:C29,14,FALSE) -> 2700 | J81: =VLOOKUP(RC[-8],Sheet4!C15:C29,15,FALSE) -> 1920 | L81: 1728 | M81: 851 | O81: =RC[-6]-RC[-3] -> 972 | P81: =RC[-6]-RC[-3] -> 1069 | R81: =IF(RC[-3]<50,1,0) -> 0 | S81: =IF(RC[-3]<50,1,0) -> 0
A82: 78 | B82: 8 | C82: =RC[9]&","&RC[10]&";" -> 2060,1561; | D82: 50 | E82: 1 | F82: 999 | G82: 2 | I82: =VLOOKUP(RC[-7],Sheet4!C15:C29,14,FALSE) -> 2700 | J82: =VLOOKUP(RC[-8],Sheet4!C15:C29,15,FALSE) -> 1920 | L82: 2060 | M82: 1561 | O82: =RC[-6]-RC[-3] -> 640 | P82: =RC[-6]-RC[-3] -> 359 | R82: =IF(RC[-3]<50,1,0) -> 0 | S82: =IF(RC[-3]<50,1,0) -> 0
A83: 79 | B83: 8 | C83: =RC[9]&","&RC[10]&";" -> 789,1274; | D83: 50 | E83: 1 | F83: 999 | G83: 2 | I83: =VLOOKUP(RC[-7],Sheet4!C15:C29,14,FALSE) -> 2700 | J83: =VLOOKUP(RC[-8],Sheet4!C15:C29,15,FALSE) -> 1920 | L83: 789 | M83: 1274 | O83: =RC[-6]-RC[-3] -> 1911 | P83: =RC[-6]-RC[-3] -> 646 | R83: =IF(RC[-3]<50,1,0) -> 0 | S83: =IF(RC[-3]<50,1,0) -> 0
A84: 80 | B84: 8 | C84: =RC[9]&","&RC[10]&";" -> 2350,534; | D84: 50 | E84: 1 | F84: 999 | G84: 2 | I84: =VLOOKUP(RC[-7],Sheet4!C15:C29,14,FALSE) -> 2700 | J84: =VLOOKUP(RC[-8],Sheet4!C15:C29,15,FALSE) -> 1920 | L84: 2350 | M84: 534 | O84: =RC[-6]-RC[-3] -> 350 | P84: =RC[-6]-RC[-3] -> 1386 | R84: =IF(RC[-3]<50,1,0) -> 0 | S84: =IF(RC[-3]<50,1,0) -> 0
A85: 81 | B85: 8 | C85: =RC[9]&","&RC[10]&";" -> 1758,711; | D85: 50 | E85: 1 | F85: 999 | G85: 2 | I85: =VLOOKUP(RC[-7],Sheet4!C15:C29,14,FALSE) -> 2700 | J85: =VLOOKUP(RC[-8],Sheet4!C15:C29,15,FALSE) -> 1920 | L85: 1758 | M85: 711 | O85: =RC[-6]-RC[-3] -> 942 | P85: =RC[-6]-RC[-3] -> 1209 | R85: =IF(RC[-3]<50,1,0) -> 0 | S85: =IF(RC[-3]<50,1,0) -> 0
A86: 82 | B86: 1 | C86: =RC[9]&","&RC[10]&";" -> 1080,1800; | D86: 50 | E86: 1 | F86: 999 | G86: 4 | I86: =VLOOKUP(RC[-7],Sheet4!C15:C29,14,FALSE) -> 3240 | J86: =VLOOKUP(RC[-8],Sheet4!C15:C29,15,FALSE) -> 1920 | L86: 1080 | M86: 1800 | O86: =RC[-6]-RC[-3] -> 2160 | P86: =RC[-6]-RC[-3] -> 120 | R86: =IF(RC[-3]<50,1,0) -> 0 | S86: =IF(RC[-3]<50,1,0) -> 0
A87: 83 | B87: 1 | C87: =RC[9]&","&RC[10]&";" -> 2160,1750; | D87: 50 | E87: 1 | F87: 999 | G87: 4 | I87: =VLOOKUP(RC[-7],Sheet4!C15:C29,14,FALSE) -> 3240 | J87: =VLOOKUP(RC[-8],Sheet4!C15:C29,15,FALSE) -> 1920 | L87: 2160 | M87: 1750 | O87: =RC[-6]-RC[-3] -> 1080 | P87: =RC[-6]-RC[-3] -> 170 | R87: =IF(RC[-3]<50,1,0) -> 0 | S87: =IF(RC[-3]<50,1,0) -> 0
A88: 84 | B88: 1 | C88: =RC[9]&","&RC[10]&";" -> 2850,1550; | D88: 50 | E88: 1 | F88: 999 | G88: 4 | I88: =VLOOKUP(RC[-7],Sheet4!C15:C29,14,FALSE) -> 3240 | J88: =VLOOKUP(RC[-8],Sheet4!C15:C29,15,FALSE) -> 1920 | L88: 2850 | M88: 1550 | O88: =RC[-6]-RC[-3] -> 390 | P88: =RC[-6]-RC[-3] -> 370 | R88: =IF(RC[-3]<50,1,0) -> 0 | S88: =IF(RC[-3]<50,1,0) -> 0
A89: 85 | B89: 1 | C89: =RC[9]&","&RC[10]&";" -> 3050,1080; | D89: 50 | E89: 1 | F89: 999 | G89: 4 | I89: =VLOOKUP(RC[-7],Sheet4!C15:C29,14,FALSE) -> 3240 | J89: =VLOOKUP(RC[-8],Sheet4!C15:C29,15,FALSE) -> 1920 | L89: 3050 | M89: 1080 | O89: =RC[-6]-RC[-3] -> 190 | P89: =RC[-6]-RC[-3] -> 840 | R89: =IF(RC[-3]<50,1,0) -> 0 | S89: =IF(RC[-3]<50,1,0) -> 0
A90: 86 | B90: 1 | C90: =RC[9]&","&RC[10]&";" -> 3010,1650; | D90: 50 | E90: 1 | F90: 999 | G90: 4 | I90: =VLOOKUP(RC[-7],Sheet4!C15:C29,14,FALSE) -> 3240 | J90: =VLOOKUP(RC[-8],Sheet4!C15:C29,15,FALSE) -> 1920 | L90: 3010 | M90: 1650 | O90: =RC[-6]-RC[-3] -> 230 | P90: =RC[-6]-RC[-3] -> 270 | R90: =IF(RC[-3]<50,1,0) -> 0 | S90: =IF(RC[-3]<50,1,0) -> 0
A91: 87 | B91: 1 | C91: =RC[9]&","&RC[10]&";" -> 1080,1760; | D91: 50 | E91: 1 | F91: 999 | G91: 4 | I91: =VLOOKUP(RC[-7],Sheet4!C15:C29,14,FALSE) -> 3240 | J91: =VLOOKUP(RC[-8],Sheet4!C15:C29,15,FALSE) -> 1920 | L91: 1080 | M91: 1760 | O91: =RC[-6]-RC[-3] -> 2160 | P91: =RC[-6]-RC[-3] -> 160 | R91: =IF(RC[-3]<50,1,0) -> 0 | S91: =IF(RC[-3]<50,1,0) -> 0
A92: 88 | B92: 1 | C92: =RC[9]&","&RC[10]&";" -> 2160,1320; | D92: 50 | E92: 1 | F92: 999 | G92: 4 | I92: =VLOOKUP(RC[-7],Sheet4!C15:C29,14,FALSE) -> 3240 | J92: =VLOOKUP(RC[-8],Sheet4!C15:C29,15,FALSE) -> 1920 | L92: 2160 | M92: 1320 | O92: =RC[-6]-RC[-3] -> 1080 | P92: =RC[-6]-RC[-3] -> 600 | R92: =IF(RC[-3]<50,1,0) -> 0 | S92: =IF(RC[-3]<50,1,0) -> 0
A93: 89 | B93: 1 | C93: =RC[9]&","&RC[10]&";" -> 3080,1730; | D93: 50 | E93: 1 | F93: 999 | G93: 4 | I93: =VLOOKUP(RC[-7],Sheet4!C15:C29,14,FALSE) -> 3240 | J93: =VLOOKUP(RC[-8],Sheet4!C15:C29,15,FALSE) -> 1920 | L93: 3080 | M93: 1730 | O93: =RC[-6]-RC[-3] -> 160 | P93: =RC[-6]-RC[-3] -> 190 | R93: =IF(RC[-3]<50,1,0) -> 0 | S93: =IF(RC[-3]<50,1,0) -> 0
A94: 90 | B94: 1 | C94: =RC[9]&","&RC[10]&";" -> 3160,1430; | D94: 50 | E94: 1 | F94: 999 | G94: 4 | I94: =VLOOKUP(RC[-7],Sheet4!C15:C29,14,FALSE) -> 3240 | J94: =VLOOKUP(RC[-8],Sheet4!C15:C29,15,FALSE) -> 1920 | L94: 3160 | M94: 1430 | O94: =RC[-6]-RC[-3] -> 80 | P94: =RC[-6]-RC[-3] -> 490 | R94: =IF(RC[-3]<50,1,0) -> 0 | S94: =IF(RC[-3]<50,1,0) -> 0
A95: 91 | B95: 1 | C95: =RC[9]&","&RC[10]&";" -> 2760,1300; | D95: 50 | E95: 1 | F95: 999 | G95: 4 | I95: =VLOOKUP(RC[-7],Sheet4!C15:C29,14,FALSE) -> 3240 | J95: =VLOOKUP(RC[-8],Sheet4!C15:C29,15,FALSE) -> 1920 | L95: 2760 | M95: 1300 | O95: =RC[-6]-RC[-3] -> 480 | P95: =RC[-6]-RC[-3] -> 620 | R95: =IF(RC[-3]<50,1,0) -> 0 | S95: =IF(RC[-3]<50,1,0) -> 0
A96: 92 | B96: 2 | C96: =RC[9]&","&RC[10]&";" -> 540,1536; | D96: 50 | E96: 1 | F96: 999 | G96: 4 | I96: =VLOOKUP(RC[-7],Sheet4!C15:C29,14,FALSE) -> 2160 | J96: =VLOOKUP(RC[-8],Sheet4!C15:C29,15,FALSE) -> 1920 | L96: 540 | M96: 1536 | O96: =RC[-6]-RC[-3] -> 1620 | P96: =RC[-6]-RC[-3] -> 384 | R96: =IF(RC[-3]<50,1,0) -> 0 | S96: =IF(RC[-3]<50,1,0) -> 0
A97: 93 | B97: 2 | C97: =RC[9]&","&RC[10]&";" -> 1080,1536; | D97: 50 | E97: 1 | F97: 999 | G97: 4 | I97: =VLOOKUP(RC[-7],Sheet4!C15:C29,14,FALSE) -> 2160 | J97: =VLOOKUP(RC[-8],Sheet4!C15:C29,15,FALSE) -> 1920 | L97: 1080 | M97: 1536 | O97: =RC[-6]-RC[-3] -> 1080 | P97: =RC[-6]-RC[-3] -> 384 | R97: =IF(RC[-3]<50,1,0) -> 0 | S97: =IF(RC[-3]<50,1,0) -> 0
A98: 94 | B98: 2 | C98: =RC[9]&","&RC[10]&";" -> 1620,1536; | D98: 50 | E98: 1 | F98: 999 | G98: 4 | I98: =VLOOKUP(RC[-7],Sheet4!C15:C29,14,FALSE) -> 2160 | J98: =VLOOKUP(RC[-8],Sheet4!C15:C29,15,FALSE) -> 1920 | L98: 1620 | M98: 1536 | O98: =RC[-6]-RC[-3] -> 540 | P98: =RC[-6]-RC[-3] -> 384 | R98: =IF(RC[-3]<50,1,0) -> 0 | S98: =IF(RC[-3]<50,1,0) -> 0
A99: 95 | B99: 3 | C99: =RC[9]&","&RC[10]&";" -> 1925,1136; | D99: 50 | E99: 1 | F99: 999 | G99: 4 | I99: =VLOOKUP(RC[-7],Sheet4!C15:C29,14,FALSE) -> 2700 | J99: =VLOOKUP(RC[-8],Sheet4!C15:C29,15,FALSE) -> 1920 | L99: 1925 | M99: 1136 | O99: =RC[-6]-RC[-3] -> 775 | P99: =RC[-6]-RC[-3] -> 784 | R99: =IF(RC[-3]<50,1,0) -> 0 | S99: =IF(RC[-3]<50,1,0) -> 0
A100: 96 | B100: 3 | C100: =RC[9]&","&RC[10]&";" -> 675,880; | D100: 50 | E100: 1 | F100: 999 | G100: 4 | I100: =VLOOKUP(RC[-7],Sheet4!C15:C29,14,FALSE) -> 2700 | J100: =VLOOKUP(RC[-8],Sheet4!C15:C29,15,FALSE) -> 1920 | L100: 675 | M100: 880 | O100: =RC[-6]-RC[-3] -> 2025 | P100: =RC[-6]-RC[-3] -> 1040 | R100: =IF(RC[-3]<50,1,0) -> 0 | S100: =IF(RC[-3]<50,1,0) -> 0
A101: 97 | B101: 3 | C101: =RC[9]&","&RC[10]&";" -> 1350,1048; | D101: 50 | E101: 1 | F101: 999 | G101: 4 | I101: =VLOOKUP(RC[-7],Sheet4!C15:C29,14,FALSE) -> 2700 | J101: =VLOOKUP(RC[-8],Sheet4!C15:C29,15,FALSE) -> 1920 | L101: 1350 | M101: 1048 | O101: =RC[-6]-RC[-3] -> 1350 | P101: =RC[-6]-RC[-3] -> 872 | R101: =IF(RC[-3]<50,1,0) -> 0 | S101: =IF(RC[-3]<50,1,0) -> 0
A102: 98 | B102: 3 | C102: =RC[9]&","&RC[10]&";" -> 1725,948; | D102: 50 | E102: 1 | F102: 999 | G102: 4 | I102: =VLOOKUP(RC[-7],Sheet4!C15:C29,14,FALSE) -> 2700 | J102: =VLOOKUP(RC[-8],Sheet4!C15:C29,15,FALSE) -> 1920 | L102: 1725 | M102: 948 | O102: =RC[-6]-RC[-3] -> 975 | P102: =RC[-6]-RC[-3] -> 972 | R102: =IF(RC[-3]<50,1,0) -> 0 | S102: =IF(RC[-3]<50,1,0) -> 0
A103: 99 | B103: 4 | C103: =RC[9]&","&RC[10]&";" -> 2592,1536; | D103: 50 | E103: 1 | F103: 999 | G103: 4 | I103: =VLOOKUP(RC[-7],Sheet4!C15:C29,14,FALSE) -> 3240 | J103: =VLOOKUP(RC[-8],Sheet4!C15:C29,15,FALSE) -> 2560 | L103: 2592 | M103: 1536 | O103: =RC[-6]-RC[-3] -> 648 | P103: =RC[-6]-RC[-3] -> 1024 | R103: =IF(RC[-3]<50,1,0) -> 0 | S103: =IF(RC[-3]<50,1,0) -> 0
A104: 100 | B104: 4 | C104: =RC[9]&","&RC[10]&";" -> 810,2048; | D104: 50 | E104: 1 | F104: 999 | G104: 4 | I104: =VLOOKUP(RC[-7],Sheet4!C15:C29,14,FALSE) -> 3240 | J104: =VLOOKUP(RC[-8],Sheet4!C15:C29,15,FALSE) -> 2560 | L104: 810 | M104: 2048 | O104: =RC[-6]-RC[-3] -> 2430 | P104: =RC[-6]-RC[-3] -> 512 | R104: =IF(RC[-3]<50,1,0) -> 0 | S104: =IF(RC[-3]<50,1,0) -> 0
A105: 101 | B105: 4 | C105: =RC[9]&","&RC[10]&";" -> 1620,2048; | D105: 50 | E105: 1 | F105: 999 | G105: 4 | I105: =VLOOKUP(RC[-7],Sheet4!C15:C29,14,FALSE) -> 3240 | J105: =VLOOKUP(RC[-8],Sheet4!C15:C29,15,FALSE) -> 2560 | L105: 1620 | M105: 2048 | O105: =RC[-6]-RC[-3] -> 1620 | P105: =RC[-6]-RC[-3] -> 512 | R105: =IF(RC[-3]<50,1,0) -> 0 | S105: =IF(RC[-3]<50,1,0) -> 0
A106: 102 | B106: 4 | C106: =RC[9]&","&RC[10]&";" -> 2430,2048; | D106: 50 | E106: 1 | F106: 999 | G106: 4 | I106: =VLOOKUP(RC[-7],Sheet4!C15:C29,14,FALSE) -> 3240 | J106: =VLOOKUP(RC[-8],Sheet4!C15:C29,15,FALSE) -> 2560 | L106: 2430 | M106: 2048 | O106: =RC[-6]-RC[-3] -> 810 | P106: =RC[-6]-RC[-3] -> 512 | R106: =IF(RC[-3]<50,1,0) -> 0 | S106: =IF(RC[-3]<50,1,0) -> 0
A107: 103 | B107: 5 | C107: =RC[9]&","&RC[10]&";" -> 2025,1152; | D107: 50 | E107: 1 | F107: 999 | G107: 4 | I107: =VLOOKUP(RC[-7],Sheet4!C15:C29,14,FALSE) -> 2700 | J107: =VLOOKUP(RC[-8],Sheet4!C15:C29,15,FALSE) -> 1920 | L107: 2025 | M107: 1152 | O107: =RC[-6]-RC[-3] -> 675 | P107: =RC[-6]-RC[-3] -> 768 | R107: =IF(RC[-3]<50,1,0) -> 0 | S107: =IF(RC[-3]<50,1,0) -> 0
A108: 104 | B108: 5 | C108: =RC[9]&","&RC[10]&";" -> 675,1536; | D108: 50 | E108: 1 | F108: 999 | G108: 4 | I108: =VLOOKUP(RC[-7],Sheet4!C15:C29,14,FALSE) -> 2700 | J108: =VLOOKUP(RC[-8],Sheet4!C15:C29,15,FALSE) -> 1920 | L108: 675 | M108: 1536 | O108: =RC[-6]-RC[-3] -> 2025 | P108: =RC[-6]-RC[-3] -> 384 | R108: =IF(RC[-3]<50,1,0) -> 0 | S108: =IF(RC[-3]<50,1,0) -> 0
A109: 105 | B109: 5 | C109: =RC[9]&","&RC[10]&";" -> 1350,1536; | D109: 50 | E109: 1 | F109: 999 | G109: 4 | I109: =VLOOKUP(RC[-7],Sheet4!C15:C29,14,FALSE) -> 2700 | J109: =VLOOKUP(RC[-8],Sheet4!C15:C29,15,FALSE) -> 1920 | L109: 1350 | M109: 1536 | O109: =RC[-6]-RC[-3] -> 1350 | P109: =RC[-6]-RC[-3] -> 384 | R109: =IF(RC[-3]<50,1,0) -> 0 | S109: =IF(RC[-3]<50,1,0) -> 0
A110: 106 | B110: 5 | C110: =RC[9]&","&RC[10]&";" -> 2025,1536; | D110: 50 | E110: 1 | F110: 999 | G110: 4 | I110: =VLOOKUP(RC[-7],Sheet4!C15:C29,14,FALSE) -> 2700 | J110: =VLOOKUP(RC[-8],Sheet4!C15:C29,15,FALSE) -> 1920 | L110: 2025 | M110: 1536 | O110: =RC[-6]-RC[-3] -> 675 | P110: =RC[-6]-RC[-3] -> 384 | R110: =IF(RC[-3]<50,1,0) -> 0 | S110: =IF(RC[-3]<50,1,0) -> 0
A111: 107 | B111: 6 | C111: =RC[9]&","&RC[10]&";" -> 1620,1152; | D111: 50 | E111: 1 | F111: 999 | G111: 4 | I111: =VLOOKUP(RC[-7],Sheet4!C15:C29,14,FALSE) -> 2160 | J111: =VLOOKUP(RC[-8],Sheet4!C15:C29,15,FALSE) -> 1920 | L111: 1620 | M111: 1152 | O111: =RC[-6]-RC[-3] -> 540 | P111: =RC[-6]-RC[-3] -> 768 | R111: =IF(RC[-3]<50,1,0) -> 0 | S111: =IF(RC[-3]<50,1,0) -> 0
A112: 108 | B112: 6 | C112: =RC[9]&","&RC[10]&";" -> 540,1536; | D112: 50 | E112: 1 | F112: 999 | G112: 4 | I112: =VLOOKUP(RC[-7],Sheet4!C15:C29,14,FALSE) -> 2160 | J112: =VLOOKUP(RC[-8],Sheet4!C15:C29,15,FALSE) -> 1920 | L112: 540 | M112: 1536 | O112: =RC[-6]-RC[-3] -> 1620 | P112: =RC[-6]-RC[-3] -> 384 | R112: =IF(RC[-3]<50,1,0) -> 0 | S112: =IF(RC[-3]<50,1,0) -> 0
A113: 109 | B113: 6 | C113: =RC[9]&","&RC[10]&";" -> 1080,1536; | D113: 50 | E113: 1 | F113: 999 | G113: 4 | I113: =VLOOKUP(RC[-7],Sheet4!C15:C29,14,FALSE) -> 2160 | J113: =VLOOKUP(RC[-8],Sheet4!C15:C29,15,FALSE) -> 1920 | L113: 1080 | M113: 1536 | O113: =RC[-6]-RC[-3] -> 1080 | P113: =RC[-6]-RC[-3] -> 384 | R113: =IF(RC[-3]<50,1,0) -> 0 | S113: =IF(RC[-3]<50,1,0) -> 0
A114: 110 | B114: 6 | C114: =RC[9]&","&RC[10]&";" -> 1620,1536; | D114: 50 | E114: 1 | F114: 999 | G114: 4 | I114: =VLOOKUP(RC[-7],Sheet4!C15:C29,14,FALSE) -> 2160 | J114: =VLOOKUP(RC[-8],Sheet4!C15:C29,15,FALSE) -> 1920 | L114: 1620 | M114: 1536 | O114: =RC[-6]-RC[-3] -> 540 | P114: =RC[-6]-RC[-3] -> 384 | R114: =IF(RC[-3]<50,1,0) -> 0 | S114: =IF(RC[-3]<50,1,0) -> 0
A115: 111 | B115: 8 | C115: =RC[9]&","&RC[10]&";" -> 1878,1574; | D115: 50 | E115: 1 | F115: 999 | G115: 4 | I115: =VLOOKUP(RC[-7],Sheet4!C15:C29,14,FALSE) -> 2700 | J115: =VLOOKUP(RC[-8],Sheet4!C15:C29,15,FALSE) -> 1920 | L115: 1878 | M115: 1574 | O115: =RC[-6]-RC[-3] -> 822 | P115: =RC[-6]-RC[-3] -> 346 | R115: =IF(RC[-3]<50,1,0) -> 0 | S115: =IF(RC[-3]<50,1,0) -> 0
A116: 112 | B116: 8 | C116: =RC[9]&","&RC[10]&";" -> 619,1268; | D116: 50 | E116: 1 | F116: 999 | G116: 4 | I116: =VLOOKUP(RC[-7],Sheet4!C15:C29,14,FALSE) -> 2700 | J116: =VLOOKUP(RC[-8],Sheet4!C15:C29,15,FALSE) -> 1920 | L116: 619 | M116: 1268 | O116: =RC[-6]-RC[-3] -> 2081 | P116: =RC[-6]-RC[-3] -> 652 | R116: =IF(RC[-3]<50,1,0) -> 0 | S116: =IF(RC[-3]<50,1,0) -> 0
A117: 113 | B117: 8 | C117: =RC[9]&","&RC[10]&";" -> 1149,1268; | D117: 50 | E117: 1 | F117: 999 | G117: 4 | I117: =VLOOKUP(RC[-7],Sheet4!C15:C29,14,FALSE) -> 2700 | J117: =VLOOKUP(RC[-8],Sheet4!C15:C29,15,FALSE) -> 1920 | L117: 1149 | M117: 1268 | O117: =RC[-6]-RC[-3] -> 1551 | P117: =RC[-6]-RC[-3] -> 652 | R117: =IF(RC[-3]<50,1,0) -> 0 | S117: =IF(RC[-3]<50,1,0) -> 0
A118: 114 | B118: 8 | C118: =RC[9]&","&RC[10]&";" -> 1678,868; | D118: 50 | E118: 1 | F118: 999 | G118: 4 | I118: =VLOOKUP(RC[-7],Sheet4!C15:C29,14,FALSE) -> 2700 | J118: =VLOOKUP(RC[-8],Sheet4!C15:C29,15,FALSE) -> 1920 | L118: 1678 | M118: 868 | O118: =RC[-6]-RC[-3] -> 1022 | P118: =RC[-6]-RC[-3] -> 1052 | R118: =IF(RC[-3]<50,1,0) -> 0 | S118: =IF(RC[-3]<50,1,0) -> 0
A119: 115 | B119: 10101 | C119: =RC[9]&","&RC[10]&";" -> 540,480; | D119: 50 | E119: 0 | F119: 999 | G119: 7 | I119: =VLOOKUP(RC[-7],Sheet4!C15:C29,14,FALSE) -> 2160 | J119: =VLOOKUP(RC[-8],Sheet4!C15:C29,15,FALSE) -> 1920 | L119: 540 | M119: 480 | O119: =RC[-6]-RC[-3] -> 1620 | P119: =RC[-6]-RC[-3] -> 1440 | R119: =IF(RC[-3]<50,1,0) -> 0 | S119: =IF(RC[-3]<50,1,0) -> 0
A120: 116 | B120: 10101 | C120: =RC[9]&","&RC[10]&";" -> 1080,480; | D120: 50 | E120: 0 | F120: 999 | G120: 7 | I120: =VLOOKUP(RC[-7],Sheet4!C15:C29,14,FALSE) -> 2160 | J120: =VLOOKUP(RC[-8],Sheet4!C15:C29,15,FALSE) -> 1920 | L120: 1080 | M120: 480 | O120: =RC[-6]-RC[-3] -> 1080 | P120: =RC[-6]-RC[-3] -> 1440 | R120: =IF(RC[-3]<50,1,0) -> 0 | S120: =IF(RC[-3]<50,1,0) -> 0
A121: 117 | B121: 10101 | C121: =RC[9]&","&RC[10]&";" -> 1620,480; | D121: 50 | E121: 0 | F121: 999 | G121: 7 | I121: =VLOOKUP(RC[-7],Sheet4!C15:C29,14,FALSE) -> 2160 | J121: =VLOOKUP(RC[-8],Sheet4!C15:C29,15,FALSE) -> 1920 | L121: 1620 | M121: 480 | O121: =RC[-6]-RC[-3] -> 540 | P121: =RC[-6]-RC[-3] -> 1440 | R121: =IF(RC[-3]<50,1,0) -> 0 | S121: =IF(RC[-3]<50,1,0) -> 0
A122: 118 | B122: 10101 | C122: =RC[9]&","&RC[10]&";" -> 432,960; | D122: 50 | E122: 0 | F122: 999 | G122: 7 | I122: =VLOOKUP(RC[-7],Sheet4!C15:C29,14,FALSE) -> 2160 | J122: =VLOOKUP(RC[-8],Sheet4!C15:C29,15,FALSE) -> 1920 | L122: 432 | M122: 960 | O122: =RC[-6]-RC[-3] -> 1728 | P122: =RC[-6]-RC[-3] -> 960 | R122: =IF(RC[-3]<50,1,0) -> 0 | S122: =IF(RC[-3]<50,1,0) -> 0
A123: 119 | B123: 10101 | C123: =RC[9]&","&RC[10]&";" -> 864,960; | D123: 50 | E123: 0 | F123: 999 | G123: 7 | I123: =VLOOKUP(RC[-7],Sheet4!C15:C29,14,FALSE) -> 2160 | J123: =VLOOKUP(RC[-8],Sheet4!C15:C29,15,FALSE) -> 1920 | L123: 864 | M123: 960 | O123: =RC[-6]-RC[-3] -> 1296 | P123: =RC[-6]-RC[-3] -> 960 | R123: =IF(RC[-3]<50,1,0) -> 0 | S123: =IF(RC[-3]<50,1,0) -> 0
A124: 120 | B124: 10101 | C124: =RC[9]&","&RC[10]&";" -> 1296,960; | D124: 50 | E124: 0 | F124: 999 | G124: 7 | I124: =VLOOKUP(RC[-7],Sheet4!C15:C29,14,FALSE) -> 2160 | J124: =VLOOKUP(RC[-8],Sheet4!C15:C29,15,FALSE) -> 1920 | L124: 1296 | M124: 960 | O124: =RC[-6]-RC[-3] -> 864 | P124: =RC[-6]-RC[-3] -> 960 | R124: =IF(RC[-3]<50,1,0) -> 0 | S124: =IF(RC[-3]<50,1,0) -> 0
A125: 121 | B125: 10101 | C125: =RC[9]&","&RC[10]&";" -> 1728,960; | D125: 50 | E125: 0 | F125: 999 | G125: 7 | I125: =VLOOKUP(RC[-7],Sheet4!C15:C29,14,FALSE) -> 2160 | J125: =VLOOKUP(RC[-8],Sheet4!C15:C29,15,FALSE) -> 1920 | L125: 1728 | M125: 960 | O125: =RC[-6]-RC[-3] -> 432 | P125: =RC[-6]-RC[-3] -> 960 | R125: =IF(RC[-3]<50,1,0) -> 0 | S125: =IF(RC[-3]<50,1,0) -> 0
A126: 122 | B126: 10101 | C126: =RC[9]&","&RC[10]&";" -> 540,1440; | D126: 50 | E126: 0 | F126: 999 | G126: 7 | I126: =VLOOKUP(RC[-7],Sheet4!C15:C29,14,FALSE) -> 2160 | J126: =VLOOKUP(RC[-8],Sheet4!C15:C29,15,FALSE) -> 1920 | L126: 540 | M126: 1440 | O126: =RC[-6]-RC[-3] -> 1620 | P126: =RC[-6]-RC[-3] -> 480 | R126: =IF(RC[-3]<50,1,0) -> 0 | S126: =IF(RC[-3]<50,1,0) -> 0
A127: 123 | B127: 10101 | C127: =RC[9]&","&RC[10]&";" -> 1080,1440; | D127: 50 | E127: 0 | F127: 999 | G127: 7 | I127: =VLOOKUP(RC[-7],Sheet4!C15:C29,14,FALSE) -> 2160 | J127: =VLOOKUP(RC[-8],Sheet4!C15:C29,15,FALSE) -> 1920 | L127: 1080 | M127: 1440 | O127: =RC[-6]-RC[-3] -> 1080 | P127: =RC[-6]-RC[-3] -> 480 | R127: =IF(RC[-3]<50,1,0) -> 0 | S127: =IF(RC[-3]<50,1,0) -> 0
A128: 124 | B128: 10101 | C128: =RC[9]&","&RC[10]&";" -> 1620,1440; | D128: 50 | E128: 0 | F128: 999 | G128: 7 | I128: =VLOOKUP(RC[-7],Sheet4!C15:C29,14,FALSE) -> 2160 | J128: =VLOOKUP(RC[-8],Sheet4!C15:C29,15,FALSE) -> 1920 | L128: 1620 | M128: 1440 | O128: =RC[-6]-RC[-3] -> 540 | P128: =RC[-6]-RC[-3] -> 480 | R128: =IF(RC[-3]<50,1,0) -> 0 | S128: =IF(RC[-3]<50,1,0) -> 0
A129: 125 | B129: 10102 | C129: =RC[9]&","&RC[10]&";" -> 1620,800; | D129: 50 | E129: 0 | F129: 999 | G129: 7 | I129: =VLOOKUP(RC[-7],Sheet4!C15:C29,14,FALSE) -> 3240 | J129: =VLOOKUP(RC[-8],Sheet4!C15:C29,15,FALSE) -> 1920 | L129: 1620 | M129: 800 | O129: =RC[-6]-RC[-3] -> 1620 | P129: =RC[-6]-RC[-3] -> 1120 | R129: =IF(RC[-3]<50,1,0) -> 0 | S129: =IF(RC[-3]<50,1,0) -> 0
A130: 126 | B130: 10102 | C130: =RC[9]&","&RC[10]&";" -> 2930,800; | D130: 50 | E130: 0 | F130: 999 | G130: 7 | I130: =VLOOKUP(RC[-7],Sheet4!C15:C29,14,FALSE) -> 3240 | J130: =VLOOKUP(RC[-8],Sheet4!C15:C29,15,FALSE) -> 1920 | L130: 2930 | M130: 800 | O130: =RC[-6]-RC[-3] -> 310 | P130: =RC[-6]-RC[-3] -> 1120 | R130: =IF(RC[-3]<50,1,0) -> 0 | S130: =IF(RC[-3]<50,1,0) -> 0
A131: 127 | B131: 10102 | C131: =RC[9]&","&RC[10]&";" -> 2360,800; | D131: 50 | E131: 0 | F131: 999 | G131: 7 | I131: =VLOOKUP(RC[-7],Sheet4!C15:C29,14,FALSE) -> 3240 | J131: =VLOOKUP(RC[-8],Sheet4!C15:C29,15,FALSE) -> 1920 | L131: 2360 | M131: 800 | O131: =RC[-6]-RC[-3] -> 880 | P131: =RC[-6]-RC[-3] -> 1120 | R131: =IF(RC[-3]<50,1,0) -> 0 | S131: =IF(RC[-3]<50,1,0) -> 0
A132: 128 | B132: 10102 | C132: =RC[9]&","&RC[10]&";" -> 1296,1600; | D132: 50 | E132: 0 | F132: 999 | G132: 7 | I132: =VLOOKUP(RC[-7],Sheet4!C15:C29,14,FALSE) -> 3240 | J132: =VLOOKUP(RC[-8],Sheet4!C15:C29,15,FALSE) -> 1920 | L132: 1296 | M132: 1600 | O132: =RC[-6]-RC[-3] -> 1944 | P132: =RC[-6]-RC[-3] -> 320 | R132: =IF(RC[-3]<50,1,0) -> 0 | S132: =IF(RC[-3]<50,1,0) -> 0
A133: 129 | B133: 10102 | C133: =RC[9]&","&RC[10]&";" -> 2592,1600; | D133: 50 | E133: 0 | F133: 999 | G133: 7 | I133: =VLOOKUP(RC[-7],Sheet4!C15:C29,14,FALSE) -> 3240 | J133: =VLOOKUP(RC[-8],Sheet4!C15:C29,15,FALSE) -> 1920 | L133: 2592 | M133: 1600 | O133: =RC[-6]-RC[-3] -> 648 | P133: =RC[-6]-RC[-3] -> 320 | R133: =IF(RC[-3]<50,1,0) -> 0 | S133: =IF(RC[-3]<50,1,0) -> 0
A134: 130 | B134: 10102 | C134: =RC[9]&","&RC[10]&";" -> 3110,1600; | D134: 50 | E134: 0 | F134: 999 | G134: 7 | I134: =VLOOKUP(RC[-7],Sheet4!C15:C29,14,FALSE) -> 3240 | J134: =VLOOKUP(RC[-8],Sheet4!C15:C29,15,FALSE) -> 1920 | L134: 3110 | M134: 1600 | O134: =RC[-6]-RC[-3] -> 130 | P134: =RC[-6]-RC[-3] -> 320 | R134: =IF(RC[-3]<50,1,0) -> 0 | S134: =IF(RC[-3]<50,1,0) -> 0
A135: 131 | B135: 10102 | C135: =RC[9]&","&RC[10]&";" -> 2830,1600; | D135: 50 | E135: 0 | F135: 999 | G135: 7 | I135: =VLOOKUP(RC[-7],Sheet4!C15:C29,14,FALSE) -> 3240 | J135: =VLOOKUP(RC[-8],Sheet4!C15:C29,15,FALSE) -> 1920 | L135: 2830 | M135: 1600 | O135: =RC[-6]-RC[-3] -> 410 | P135: =RC[-6]-RC[-3] -> 320 | R135: =IF(RC[-3]<50,1,0) -> 0 | S135: =IF(RC[-3]<50,1,0) -> 0
A136: 132 | B136: 10102 | C136: =RC[9]&","&RC[10]&";" -> 1620,1860; | D136: 50 | E136: 0 | F136: 999 | G136: 7 | I136: =VLOOKUP(RC[-7],Sheet4!C15:C29,14,FALSE) -> 3240 | J136: =VLOOKUP(RC[-8],Sheet4!C15:C29,15,FALSE) -> 1920 | L136: 1620 | M136: 1860 | O136: =RC[-6]-RC[-3] -> 1620 | P136: =RC[-6]-RC[-3] -> 60 | R136: =IF(RC[-3]<50,1,0) -> 0 | S136: =IF(RC[-3]<50,1,0) -> 0
A137: 133 | B137: 10102 | C137: =RC[9]&","&RC[10]&";" -> 2700,1750; | D137: 50 | E137: 0 | F137: 999 | G137: 7 | I137: =VLOOKUP(RC[-7],Sheet4!C15:C29,14,FALSE) -> 3240 | J137: =VLOOKUP(RC[-8],Sheet4!C15:C29,15,FALSE) -> 1920 | L137: 2700 | M137: 1750 | O137: =RC[-6]-RC[-3] -> 540 | P137: =RC[-6]-RC[-3] -> 170 | R137: =IF(RC[-3]<50,1,0) -> 0 | S137: =IF(RC[-3]<50,1,0) -> 0
A138: 134 | B138: 10102 | C138: =RC[9]&","&RC[10]&";" -> 3000,1430; | D138: 50 | E138: 0 | F138: 999 | G138: 7 | I138: =VLOOKUP(RC[-7],Sheet4!C15:C29,14,FALSE) -> 3240 | J138: =VLOOKUP(RC[-8],Sheet4!C15:C29,15,FALSE) -> 1920 | L138: 3000 | M138: 1430 | O138: =RC[-6]-RC[-3] -> 240 | P138: =RC[-6]-RC[-3] -> 490 | R138: =IF(RC[-3]<50,1,0) -> 0 | S138: =IF(RC[-3]<50,1,0) -> 0
A139: 135 | B139: 10103 | C139: =RC[9]&","&RC[10]&";" -> 675,640; | D139: 50 | E139: 0 | F139: 999 | G139: 7 | I139: =VLOOKUP(RC[-7],Sheet4!C15:C29,14,FALSE) -> 2700 | J139: =VLOOKUP(RC[-8],Sheet4!C15:C29,15,FALSE) -> 1920 | L139: 675 | M139: 640 | O139: =RC[-6]-RC[-3] -> 2025 | P139: =RC[-6]-RC[-3] -> 1280 | R139: =IF(RC[-3]<50,1,0) -> 0 | S139: =IF(RC[-3]<50,1,0) -> 0
A140: 136 | B140: 10103 | C140: =RC[9]&","&RC[10]&";" -> 1350,640; | D140: 50 | E140: 0 | F140: 999 | G140: 7 | I140: =VLOOKUP(RC[-7],Sheet4!C15:C29,14,FALSE) -> 2700 | J140: =VLOOKUP(RC[-8],Sheet4!C15:C29,15,FALSE) -> 1920 | L140: 1350 | M140: 640 | O140: =RC[-6]-RC[-3] -> 1350 | P140: =RC[-6]-RC[-3] -> 1280 | R140: =IF(RC[-3]<50,1,0) -> 0 | S140: =IF(RC[-3]<50,1,0) -> 0
A141: 137 | B141: 10103 | C141: =RC[9]&","&RC[10]&";" -> 2025,640; | D141: 50 | E141: 0 | F141: 999 | G141: 7 | I141: =VLOOKUP(RC[-7],Sheet4!C15:C29,14,FALSE) -> 2700 | J141: =VLOOKUP(RC[-8],Sheet4!C15:C29,15,FALSE) -> 1920 | L141: 2025 | M141: 640 | O141: =RC[-6]-RC[-3] -> 675 | P141: =RC[-6]-RC[-3] -> 1280 | R141: =IF(RC[-3]<50,1,0) -> 0 | S141: =IF(RC[-3]<50,1,0) -> 0
A142: 138 | B142: 10103 | C142: =RC[9]&","&RC[10]&";" -> 540,1280; | D142: 50 | E142: 0 | F142: 999 | G142: 7 | I142: =VLOOKUP(RC[-7],Sheet4!C15:C29,14,FALSE) -> 2700 | J142: =VLOOKUP(RC[-8],Sheet4!C15:C29,15,FALSE) -> 1920 | L142: 540 | M142: 1280 | O142: =RC[-6]-RC[-3] -> 2160 | P142: =RC[-6]-RC[-3] -> 640 | R142: =IF(RC[-3]<50,1,0) -> 0 | S142: =IF(RC[-3]<50,1,0) -> 0
A143: 139 | B143: 10103 | C143: =RC[9]&","&RC[10]&";" -> 1080,1280; | D143: 50 | E143: 0 | F143: 999 | G143: 7 | I143: =VLOOKUP(RC[-7],Sheet4!C15:C29,14,FALSE) -> 2700 | J143: =VLOOKUP(RC[-8],Sheet4!C15:C29,15,FALSE) -> 1920 | L143: 1080 | M143: 1280 | O143: =RC[-6]-RC[-3] -> 1620 | P143: =RC[-6]-RC[-3] -> 640 | R143: =IF(RC[-3]<50,1,0) -> 0 | S143: =IF(RC[-3]<50,1,0) -> 0
A144: 140 | B144: 10103 | C144: =RC[9]&","&RC[10]&";" -> 1620,1280; | D144: 50 | E144: 0 | F144: 999 | G144: 7 | I144: =VLOOKUP(RC[-7],Sheet4!C15:C29,14,FALSE) -> 2700 | J144: =VLOOKUP(RC[-8],Sheet4!C15:C29,15,FALSE) -> 1920 | L144: 1620 | M144: 1280 | O144: =RC[-6]-RC[-3] -> 1080 | P144: =RC[-6]-RC[-3] -> 640 | R144: =IF(RC[-3]<50,1,0) -> 0 | S144: =IF(RC[-3]<50,1,0) -> 0
A145: 141 | B145: 10103 | C145: =RC[9]&","&RC[10]&";" -> 2160,1280; | D145: 50 | E145: 0 | F145: 999 | G145: 7 | I145: =VLOOKUP(RC[-7],Sheet4!C15:C29,14,FALSE) -> 2700 | J145: =VLOOKUP(RC[-8],Sheet4!C15:C29,15,FALSE) -> 1920 | L145: 2160 | M145: 1280 | O145: =RC[-6]-RC[-3] -> 540 | P145: =RC[-6]-RC[-3] -> 640 | R145: =IF(RC[-3]<50,1,0) -> 0 | S145: =IF(RC[-3]<50,1,0) -> 0
A146: 142 | B146: 10103 | C146: =RC[9]&","&RC[10]&";" -> 675,1720; | D146: 50 | E146: 0 | F146: 999 | G146: 7 | I146: =VLOOKUP(RC[-7],Sheet4!C15:C29,14,FALSE) -> 2700 | J146: =VLOOKUP(RC[-8],Sheet4!C15:C29,15,FALSE) -> 1920 | L146: 675 | M146: 1720 | O146: =RC[-6]-RC[-3] -> 2025 | P146: =RC[-6]-RC[-3] -> 200 | R146: =IF(RC[-3]<50,1,0) -> 0 | S146: =IF(RC[-3]<50,1,0) -> 0
A147: 143 | B147: 10103 | C147: =RC[9]&","&RC[10]&";" -> 1350,1850; | D147: 50 | E147: 0 | F147: 999 | G147: 7 | I147: =VLOOKUP(RC[-7],Sheet4!C15:C29,14,FALSE) -> 2700 | J147: =VLOOKUP(RC[-8],Sheet4!C15:C29,15,FALSE) -> 1920 | L147: 1350 | M147: 1850 | O147: =RC[-6]-RC[-3] -> 1350 | P147: =RC[-6]-RC[-3] -> 70 | R147: =IF(RC[-3]<50,1,0) -> 0 | S147: =IF(RC[-3]<50,1,0) -> 0
A148: 144 | B148: 10103 | C148: =RC[9]&","&RC[10]&";" -> 2025,1660; | D148: 50 | E148: 0 | F148: 999 | G148: 7 | I148: =VLOOKUP(RC[-7],Sheet4!C15:C29,14,FALSE) -> 2700 | J148: =VLOOKUP(RC[-8],Sheet4!C15:C29,15,FALSE) -> 1920 | L148: 2025 | M148: 1660 | O148: =RC[-6]-RC[-3] -> 675 | P148: =RC[-6]-RC[-3] -> 260 | R148: =IF(RC[-3]<50,1,0) -> 0 | S148: =IF(RC[-3]<50,1,0) -> 0
A149: 145 | B149: 10104 | C149: =RC[9]&","&RC[10]&";" -> 810,640; | D149: 50 | E149: 0 | F149: 999 | G149: 7 | I149: =VLOOKUP(RC[-7],Sheet4!C15:C29,14,FALSE) -> 3240 | J149: =VLOOKUP(RC[-8],Sheet4!C15:C29,15,FALSE) -> 2560 | L149: 810 | M149: 640 | O149: =RC[-6]-RC[-3] -> 2430 | P149: =RC[-6]-RC[-3] -> 1920 | R149: =IF(RC[-3]<50,1,0) -> 0 | S149: =IF(RC[-3]<50,1,0) -> 0
A150: 146 | B150: 10104 | C150: =RC[9]&","&RC[10]&";" -> 1620,640; | D150: 50 | E150: 0 | F150: 999 | G150: 7 | I150: =VLOOKUP(RC[-7],Sheet4!C15:C29,14,FALSE) -> 3240 | J150: =VLOOKUP(RC[-8],Sheet4!C15:C29,15,FALSE) -> 2560 | L150: 1620 | M150: 640 | O150: =RC[-6]-RC[-3] -> 1620 | P150: =RC[-6]-RC[-3] -> 1920 | R150: =IF(RC[-3]<50,1,0) -> 0 | S150: =IF(RC[-3]<50,1,0) -> 0
A151: 147 | B151: 10104 | C151: =RC[9]&","&RC[10]&";" -> 2430,640; | D151: 50 | E151: 0 | F151: 999 | G151: 7 | I151: =VLOOKUP(RC[-7],Sheet4!C15:C29,14,FALSE) -> 3240 | J151: =VLOOKUP(RC[-8],Sheet4!C15:C29,15,FALSE) -> 2560 | L151: 2430 | M151: 640 | O151: =RC[-6]-RC[-3] -> 810 | P151: =RC[-6]-RC[-3] -> 1920 | R151: =IF(RC[-3]<50,1,0) -> 0 | S151: =IF(RC[-3]<50,1,0) -> 0
A152: 148 | B152: 10104 | C152: =RC[9]&","&RC[10]&";" -> 648,1280; | D152: 50 | E152: 0 | F152: 999 | G152: 7 | I152: =VLOOKUP(RC[-7],Sheet4!C15:C29,14,FALSE) -> 3240 | J152: =VLOOKUP(RC[-8],Sheet4!C15:C29,15,FALSE) -> 2560 | L152: 648 | M152: 1280 | O152: =RC[-6]-RC[-3] -> 2592 | P152: =RC[-6]-RC[-3] -> 1280 | R152: =IF(RC[-3]<50,1,0) -> 0 | S152: =IF(RC[-3]<50,1,0) -> 0
A153: 149 | B153: 10104 | C153: =RC[9]&","&RC[10]&";" -> 1296,1280; | D153: 50 | E153: 0 | F153: 999 | G153: 7 | I153: =VLOOKUP(RC[-7],Sheet4!C15:C29,14,FALSE) -> 3240 | J153: =VLOOKUP(RC[-8],Sheet4!C15:C29,15,FALSE) -> 2560 | L153: 1296 | M153: 1280 | O153: =RC[-6]-RC[-3] -> 1944 | P153: =RC[-6]-RC[-3] -> 1280 | R153: =IF(RC[-3]<50,1,0) -> 0 | S153: =IF(RC[-3]<50,1,0) -> 0
A154: 150 | B154: 10104 | C154: =RC[9]&","&RC[10]&";" -> 1944,1280; | D154: 50 | E154: 0 | F154: 999 | G154: 7 | I154: =VLOOKUP(RC[-7],Sheet4!C15:C29,14,FALSE) -> 3240 | J154: =VLOOKUP(RC[-8],Sheet4!C15:C29,15,FALSE) -> 2560 | L154: 1944 | M154: 1280 | O154: =RC[-6]-RC[-3] -> 1296 | P154: =RC[-6]-RC[-3] -> 1280 | R154: =IF(RC[-3]<50,1,0) -> 0 | S154: =IF(RC[-3]<50,1,0) -> 0
A155: 151 | B155: 10104 | C155: =RC[9]&","&RC[10]&";" -> 2592,1280; | D155: 50 | E155: 0 | F155: 999 | G155: 7 | I155: =VLOOKUP(RC[-7],Sheet4!C15:C29,14,FALSE) -> 3240 | J155: =VLOOKUP(RC[-8],Sheet4!C15:C29,15,FALSE) -> 2560 | L155: 2592 | M155: 1280 | O155: =RC[-6]-RC[-3] -> 648 | P155: =RC[-6]-RC[-3] -> 1280 | R155: =IF(RC[-3]<50,1,0) -> 0 | S155: =IF(RC[-3]<50,1,0) -> 0
A156: 152 | B156: 10104 | C156: =RC[9]&","&RC[10]&";" -> 810,1920; | D156: 50 | E156: 0 | F156: 999 | G156: 7 | I156: =VLOOKUP(RC[-7],Sheet4!C15:C29,14,FALSE) -> 3240 | J156: =VLOOKUP(RC[-8],Sheet4!C15:C29,15,FALSE) -> 2560 | L156: 810 | M156: 1920 | O156: =RC[-6]-RC[-3] -> 2430 | P156: =RC[-6]-RC[-3] -> 640 | R156: =IF(RC[-3]<50,1,0) -> 0 | S156: =IF(RC[-3]<50,1,0) -> 0
A157: 153 | B157: 10104 | C157: =RC[9]&","&RC[10]&";" -> 1620,1920; | D157: 50 | E157: 0 | F157: 999 | G157: 7 | I157: =VLOOKUP(RC[-7],Sheet4!C15:C29,14,FALSE) -> 3240 | J157: =VLOOKUP(RC[-8],Sheet4!C15:C29,15,FALSE) -> 2560 | L157: 1620 | M157: 1920 | O157: =RC[-6]-RC[-3] -> 1620 | P157: =RC[-6]-RC[-3] -> 640 | R157: =IF(RC[-3]<50,1,0) -> 0 | S157: =IF(RC[-3]<50,1,0) -> 0
A158: 154 | B158: 10104 | C158: =RC[9]&","&RC[10]&";" -> 2430,1920; | D158: 50 | E158: 0 | F158: 999 | G158: 7 | I158: =VLOOKUP(RC[-7],Sheet4!C15:C29,14,FALSE) -> 3240 | J158: =VLOOKUP(RC[-8],Sheet4!C15:C29,15,FALSE) -> 2560 | L158: 2430 | M158: 1920 | O158: =RC[-6]-RC[-3] -> 810 | P158: =RC[-6]-RC[-3] -> 640 | R158: =IF(RC[-3]<50,1,0) -> 0 | S158: =IF(RC[-3]<50,1,0) -> 0
A159: 155 | B159: 10105 | C159: =RC[9]&","&RC[10]&";" -> 540,480; | D159: 50 | E159: 0 | F159: 999 | G159: 7 | I159: =VLOOKUP(RC[-7],Sheet4!C15:C29,14,FALSE) -> 2160 | J159: =VLOOKUP(RC[-8],Sheet4!C15:C29,15,FALSE) -> 1920 | L159: 540 | M159: 480 | O159: =RC[-6]-RC[-3] -> 1620 | P159: =RC[-6]-RC[-3] -> 1440 | R159: =IF(RC[-3]<50,1,0) -> 0 | S159: =IF(RC[-3]<50,1,0) -> 0
A160: 156 | B160: 10105 | C160: =RC[9]&","&RC[10]&";" -> 1080,480; | D160: 50 | E160: 0 | F160: 999 | G160: 7 | I160: =VLOOKUP(RC[-7],Sheet4!C15:C29,14,FALSE) -> 2160 | J160: =VLOOKUP(RC[-8],Sheet4!C15:C29,15,FALSE) -> 1920 | L160: 1080 | M160: 480 | O160: =RC[-6]-RC[-3] -> 1080 | P160: =RC[-6]-RC[-3] -> 1440 | R160: =IF(RC[-3]<50,1,0) -> 0 | S160: =IF(RC[-3]<50,1,0) -> 0
A161: 157 | B161: 10105 | C161: =RC[9]&","&RC[10]&";" -> 1620,480; | D161: 50 | E161: 0 | F161: 999 | G161: 7 | I161: =VLOOKUP(RC[-7],Sheet4!C15:C29,14,FALSE) -> 2160 | J161: =VLOOKUP(RC[-8],Sheet4!C15:C29,15,FALSE) -> 1920 | L161: 1620 | M161: 480 | O161: =RC[-6]-RC[-3] -> 540 | P161: =RC[-6]-RC[-3] -> 1440 | R161: =IF(RC[-3]<50,1,0) -> 0 | S161: =IF(RC[-3]<50,1,0) -> 0
A162: 158 | B162: 10105 | C162: =RC[9]&","&RC[10]&";" -> 432,960; | D162: 50 | E162: 0 | F162: 999 | G162: 7 | I162: =VLOOKUP(RC[-7],Sheet4!C15:C29,14,FALSE) -> 2160 | J162: =VLOOKUP(RC[-8],Sheet4!C15:C29,15,FALSE) -> 1920 | L162: 432 | M162: 960 | O162: =RC[-6]-RC[-3] -> 1728 | P162: =RC[-6]-RC[-3] -> 960 | R162: =IF(RC[-3]<50,1,0) -> 0 | S162: =IF(RC[-3]<50,1,0) -> 0
A163: 159 | B163: 10105 | C163: =RC[9]&","&RC[10]&";" -> 864,960; | D163: 50 | E163: 0 | F163: 999 | G163: 7 | I163: =VLOOKUP(RC[-7],Sheet4!C15:C29,14,FALSE) -> 2160 | J163: =VLOOKUP(RC[-8],Sheet4!C15:C29,15,FALSE) -> 1920 | L163: 864 | M163: 960 | O163: =RC[-6]-RC[-3] -> 1296 | P163: =RC[-6]-RC[-3] -> 960 | R163: =IF(RC[-3]<50,1,0) -> 0 | S163: =IF(RC[-3]<50,1,0) -> 0
A164: 160 | B164: 10105 | C164: =RC[9]&","&RC[10]&";" -> 1296,960; | D164: 50 | E164: 0 | F164: 999 | G164: 7 | I164: =VLOOKUP(RC[-7],Sheet4!C15:C29,14,FALSE) -> 2160 | J164: =VLOOKUP(RC[-8],Sheet4!C15:C29,15,FALSE) -> 1920 | L164: 1296 | M164: 960 | O164: =RC[-6]-RC[-3] -> 864 | P164: =RC[-6]-RC[-3] -> 960 | R164: =IF(RC[-3]<50,1,0) -> 0 | S164: =IF(RC[-3]<50,1,0) -> 0
A165: 161 | B165: 10105 | C165: =RC[9]&","&RC[10]&";" -> 1728,960; | D165: 50 | E165: 0 | F165: 999 | G165: 7 | I165: =VLOOKUP(RC[-7],Sheet4!C15:C29,14,FALSE) -> 2160 | J165: =VLOOKUP(RC[-8],Sheet4!C15:C29,15,FALSE) -> 1920 | L165: 1728 | M165: 960 | O165: =RC[-6]-RC[-3] -> 432 | P165: =RC[-6]-RC[-3] -> 960 | R165: =IF(RC[-3]<50,1,0) -> 0 | S165: =IF(RC[-3]<50,1,0) -> 0
A166: 162 | B166: 10105 | C166: =RC[9]&","&RC[10]&";" -> 540,1440; | D166: 50 | E166: 0 | F166: 999 | G166: 7 | I166: =VLOOKUP(RC[-7],Sheet4!C15:C29,14,FALSE) -> 2160 | J166: =VLOOKUP(RC[-8],Sheet4!C15:C29,15,FALSE) -> 1920 | L166: 540 | M166: 1440 | O166: =RC[-6]-RC[-3] -> 1620 | P166: =RC[-6]-RC[-3] -> 480 | R166: =IF(RC[-3]<50,1,0) -> 0 | S166: =IF(RC[-3]<50,1,0) -> 0
A167: 163 | B167: 10105 | C167: =RC[9]&","&RC[10]&";" -> 1080,1440; | D167: 50 | E167: 0 | F167: 999 | G167: 7 | I167: =VLOOKUP(RC[-7],Sheet4!C15:C29,14,FALSE) -> 2160 | J167: =VLOOKUP(RC[-8],Sheet4!C15:C29,15,FALSE) -> 1920 | L167: 1080 | M167: 1440 | O167: =RC[-6]-RC[-3] -> 1080 | P167: =RC[-6]-RC[-3] -> 480 | R167: =IF(RC[-3]<50,1,0) -> 0 | S167: =IF(RC[-3]<50,1,0) -> 0
A168: 164 | B168: 10105 | C168: =RC[9]&","&RC[10]&";" -> 1620,1440; | D168: 50 | E168: 0 | F168: 999 | G168: 7 | I168: =VLOOKUP(RC[-7],Sheet4!C15:C29,14,FALSE) -> 2160 | J168: =VLOOKUP(RC[-8],Sheet4!C15:C29,15,FALSE) -> 1920 | L168: 1620 | M168: 1440 | O168: =RC[-6]-RC[-3] -> 540 | P168: =RC[-6]-RC[-3] -> 480 | R168: =IF(RC[-3]<50,1,0) -> 0 | S168: =IF(RC[-3]<50,1,0) -> 0
A169: 0 | B169: 0 | C169: =RC[9]&","&RC[10]&";" -> 0,; | D169: 0 | E169: 0 | F169: 0 | G169: 0 | I169: =VLOOKUP(RC[-7],Sheet4!C15:C29,14,FALSE) -> #N/A | J169: =VLOOKUP(RC[-8],Sheet4!C15:C29,15,FALSE) -> #N/A | L169: 0
A170: 0 | B170: 0 | C170: =RC[9]&","&RC[10]&";" -> 0,; | D170: 0 | E170: 0 | F170: 0 | G170: 0 | I170: =VLOOKUP(RC[-7],Sheet4!C15:C29,14,FALSE) -> #N/A | J170: =VLOOKUP(RC[-8],Sheet4!C15:C29,15,FALSE) -> #N/A | L170: 0
A171: 0 | B171: 0 | C171: =RC[9]&","&RC[10]&";" -> 0,; | D171: 0 | E171: 0 | F171: 0 | G171: 0 | I171: =VLOOKUP(RC[-7],Sheet4!C15:C29,14,FALSE) -> #N/A | J171: =VLOOKUP(RC[-8],Sheet4!C15:C29,15,FALSE) -> #N/A | L171: 0
A172: 0 | B172: 0 | C172: =RC[9]&","&RC[10]&";" -> 0,; | D172: 0 | E172: 0 | F172: 0 | G172: 0 | I172: =VLOOKUP(RC[-7],Sheet4!C15:C29,14,FALSE) -> #N/A | J172: =VLOOKUP(RC[-8],Sheet4!C15:C29,15,FALSE) -> #N/A | L172: 0
A173: 0 | B173: 0 | C173: =RC[9]&","&RC[10]&";" -> 0,; | D173: 0 | E173: 0 | F173: 0 | G173: 0 | I173: =VLOOKUP(RC[-7],Sheet4!C15:C29,14,FALSE) -> #N/A | J173: =VLOOKUP(RC[-8],Sheet4!C15:C29,15,FALSE) -> #N/A | L173: 0
A174: 0 | B174: 0 | C174: =RC[9]&","&RC[10]&";" -> 0,; | D174: 0 | E174: 0 | F174: 0 | G174: 0 | I174: =VLOOKUP(RC[-7],Sheet4!C15:C29,14,FALSE) -> #N/A | J174: =VLOOKUP(RC[-8],Sheet4!C15:C29,15,FALSE) -> #N/A | L174: 0
A175: 0 | B175: 0 | C175: =RC[9]&","&RC[10]&";" -> 0,; | D175: 0 | E175: 0 | F175: 0 | G175: 0 | I175: =VLOOKUP(RC[-7],Sheet4!C15:C29,14,FALSE) -> #N/A | J175: =VLOOKUP(RC[-8],Sheet4!C15:C29,15,FALSE) -> #N/A | L175: 0
A176: 0 | B176: 0 | C176: =RC[9]&","&RC[10]&";" -> 0,; | D176: 0 | E176: 0 | F176: 0 | G176: 0 | I176: =VLOOKUP(RC[-7],Sheet4!C15:C29,14,FALSE) -> #N/A | J176: =VLOOKUP(RC[-8],Sheet4!C15:C29,15,FALSE) -> #N/A | L176: 0
A177: 0 | B177: 0 | C177: =RC[9]&","&RC[10]&";" -> 0,; | D177: 0 | E177: 0 | F177: 0 | G177: 0 | I177: =VLOOKUP(RC[-7],Sheet4!C15:C29,14,FALSE) -> #N/A | J177: =VLOOKUP(RC[-8],Sheet4!C15:C29,15,FALSE) -> #N/A | L177: 0
A178: 0 | B178: 0 | C178: =RC[9]&","&RC[10]&";" -> 0,; | D178: 0 | E178: 0 | F178: 0 | G178: 0 | I178: =VLOOKUP(RC[-7],Sheet4!C15:C29,14,FALSE) -> #N/A | J178: =VLOOKUP(RC[-8],Sheet4!C15:C29,15,FALSE) -> #N/A | L178: 0
A179: 0 | B179: 0 | C179: =RC[9]&","&RC[10]&";" -> 0,; | D179: 0 | E179: 0 | F179: 0 | G179: 0 | I179: =VLOOKUP(RC[-7],Sheet4!C15:C29,14,FALSE) -> #N/A | J179: =VLOOKUP(RC[-8],Sheet4!C15:C29,15,FALSE) -> #N/A | L179: 0
A180: 0 | B180: 0 | C180: =RC[9]&","&RC[10]&";" -> 0,; | D180: 0 | E180: 0 | F180: 0 | G180: 0 | I180: =VLOOKUP(RC[-7],Sheet4!C15:C29,14,FALSE) -> #N/A | J180: =VLOOKUP(RC[-8],Sheet4!C15:C29,15,FALSE) -> #N/A | L180: 0
A181: 0 | B181: 0 | C181: =RC[9]&","&RC[10]&";" -> 0,; | D181: 0 | E181: 0 | F181: 0 | G181: 0 | I181: =VLOOKUP(RC[-7],Sheet4!C15:C29,14,FALSE) -> #N/A | J181: =VLOOKUP(RC[-8],Sheet4!C15:C29,15,FALSE) -> #N/A | L181: 0
A182: 0 | B182: 0 | C182: =RC[9]&","&RC[10]&";" -> 0,; | D182: 0 | E182: 0 | F182: 0 | G182: 0 | I182: =VLOOKUP(RC[-7],Sheet4!C15:C29,14,FALSE) -> #N/A | J182: =VLOOKUP(RC[-8],Sheet4!C15:C29,15,FALSE) -> #N/A | L182: 0
A183: 0 | B183: 0 | C183: =RC[9]&","&RC[10]&";" -> 0,; | D183: 0 | E183: 0 | F183: 0 | G183: 0 | I183: =VLOOKUP(RC[-7],Sheet4!C15:C29,14,FALSE) -> #N/A | J183: =VLOOKUP(RC[-8],Sheet4!C15:C29,15,FALSE) -> #N/A | L183: 0
A184: 0 | B184: 0 | C184: =RC[9]&","&RC[10]&";" -> 0,; | D184: 0 | E184: 0 | F184: 0 | G184: 0 | I184: =VLOOKUP(RC[-7],Sheet4!C15:C29,14,FALSE) -> #N/A | J184: =VLOOKUP(RC[-8],Sheet4!C15:C29,15,FALSE) -> #N/A | L184: 0
A185: 0 | B185: 0 | C185: =RC[9]&","&RC[10]&";" -> 0,; | D185: 0 | E185: 0 | F185: 0 | G185: 0 | I185: =VLOOKUP(RC[-7],Sheet4!C15:C29,14,FALSE) -> #N/A | J185: =VLOOKUP(RC[-8],Sheet4!C15:C29,15,FALSE) -> #N/A | L185: 0
A186: 0 | B186: 0 | C186: =RC[9]&","&RC[10]&";" -> 0,; | D186: 0 | E186: 0 | F186: 0 | G186: 0 | I186: =VLOOKUP(RC[-7],Sheet4!C15:C29,14,FALSE) -> #N/A | J186: =VLOOKUP(RC[-8],Sheet4!C15:C29,15,FALSE) -> #N/A | L186: 0
A187: 0 | B187: 0 | C187: =RC[9]&","&RC[10]&";" -> 0,; | D187: 0 | E187: 0 | F187: 0 | G187: 0 | I187: =VLOOKUP(RC[-7],Sheet4!C15:C29,14,FALSE) -> #N/A | J187: =VLOOKUP(RC[-8],Sheet4!C15:C29,15,FALSE) -> #N/A | L187: 0
A188: 0 | B188: 0 | C188: =RC[9]&","&RC[10]&";" -> 0,; | D188: 0 | E188: 0 | F188: 0 | G188: 0 | I188: =VLOOKUP(RC[-7],Sheet4!C15:C29,14,FALSE) -> #N/A | J188: =VLOOKUP(RC[-8],Sheet4!C15:C29,15,FALSE) -> #N/A | L188: 0
A189: 0 | B189: 0 | C189: =RC[9]&","&RC[10]&";" -> 0,; | D189: 0 | E189: 0 | F189: 0 | G189: 0 | I189: =VLOOKUP(RC[-7],Sheet4!C15:C29,14,FALSE) -> #N/A | J189: =VLOOKUP(RC[-8],Sheet4!C15:C29,15,FALSE) -> #N/A | L189: 0
A190: 0 | B190: 0 | C190: =RC[9]&","&RC[10]&";" -> 0,; | D190: 0 | E190: 0 | F190: 0 | G190: 0 | I190: =VLOOKUP(RC[-7],Sheet4!C15:C29,14,FALSE) -> #N/A | J190: =VLOOKUP(RC[-8],Sheet4!C15:C29,15,FALSE) -> #N/A | L190: 0
A191: 0 | B191: 0 | C191: =RC[9]&","&RC[10]&";" -> 0,; | D191: 0 | E191: 0 | F191: 0 | G191: 0 | I191: =VLOOKUP(RC[-7],Sheet4!C15:C29,14,FALSE) -> #N/A | J191: =VLOOKUP(RC[-8],Sheet4!C15:C29,15,FALSE) -> #N/A | L191: 0
A192: 0 | B192: 0 | C192: =RC[9]&","&RC[10]&";" -> 0,; | D192: 0 | E192: 0 | F192: 0 | G192: 0 | I192: =VLOOKUP(RC[-7],Sheet4!C15:C29,14,FALSE) -> #N/A | J192: =VLOOKUP(RC[-8],Sheet4!C15:C29,15,FALSE) -> #N/A | L192: 0
A193: 0 | B193: 0 | C193: =RC[9]&","&RC[10]&";" -> 0,; | D193: 0 | E193: 0 | F193: 0 | G193: 0 | I193: =VLOOKUP(RC[-7],Sheet4!C15:C29,14,FALSE) -> #N/A | J193: =VLOOKUP(RC[-8],Sheet4!C15:C29,15,FALSE) -> #N/A | L193: 0
A194: 0 | B194: 0 | C194: =RC[9]&","&RC[10]&";" -> 0,; | D194: 0 | E194: 0 | F194: 0 | G194: 0 | I194: =VLOOKUP(RC[-7],Sheet4!C15:C29,14,FALSE) -> #N/A | J194: =VLOOKUP(RC[-8],Sheet4!C15:C29,15,FALSE) -> #N/A | L194: 0
A195: 0 | B195: 0 | C195: =RC[9]&","&RC[10]&";" -> 0,; | D195: 0 | E195: 0 | F195: 0 | G195: 0 | I195: =VLOOKUP(RC[-7],Sheet4!C15:C29,14,FALSE) -> #N/A | J195: =VLOOKUP(RC[-8],Sheet4!C15:C29,15,FALSE) -> #N/A | L195: 0
A196: 0 | B196: 0 | C196: =RC[9]&","&RC[10]&";" -> 0,; | D196: 0 | E196: 0 | F196: 0 | G196: 0 | I196: =VLOOKUP(RC[-7],Sheet4!C15:C29,14,FALSE) -> #N/A | J196: =VLOOKUP(RC[-8],Sheet4!C15:C29,15,FALSE) -> #N/A | L196: 0
A197: 0 | B197: 0 | C197: =RC[9]&","&RC[10]&";" -> 0,; | D197: 0 | E197: 0 | F197: 0 | G197: 0 | I197: =VLOOKUP(RC[-7],Sheet4!C15:C29,14,FALSE) -> #N/A | J197: =VLOOKUP(RC[-8],Sheet4!C15:C29,15,FALSE) -> #N/A | L197: 0
A198: 0 | B198: 0 | C198: =RC[9]&","&RC[10]&";" -> 0,; | D198: 0 | E198: 0 | F198: 0 | G198: 0 | I198: =VLOOKUP(RC[-7],Sheet4!C15:C29,14,FALSE) -> #N/A | J198: =VLOOKUP(RC[-8],Sheet4!C15:C29,15,FALSE) -> #N/A | L198: 0
A199: 0 | B199: 0 | C199: =RC[9]&","&RC[10]&";" -> 0,; | D199: 0 | E199: 0 | F199: 0 | G199: 0 | I199: =VLOOKUP(RC[-7],Sheet4!C15:C29,14,FALSE) -> #N/A | J199: =VLOOKUP(RC[-8],Sheet4!C15:C29,15,FALSE) -> #N/A | L199: 0
A200: 0 | B200: 0 | C200: =RC[9]&","&RC[10]&";" -> 0,; | D200: 0 | E200: 0 | F200: 0 | G200: 0 | I200: =VLOOKUP(RC[-7],Sheet4!C15:C29,14,FALSE) -> #N/A | J200: =VLOOKUP(RC[-8],Sheet4!C15:C29,15,FALSE) -> #N/A | L200: 0
A201: 0 | B201: 0 | C201: =RC[9]&","&RC[10]&";" -> 0,; | D201: 0 | E201: 0 | F201: 0 | G201: 0 | I201: =VLOOKUP(RC[-7],Sheet4!C15:C29,14,FALSE) -> #N/A | J201: =VLOOKUP(RC[-8],Sheet4!C15:C29,15,FALSE) -> #N/A | L201: 0
A202: 0 | B202: 0 | C202: =RC[9]&","&RC[10]&";" -> 0,; | D202: 0 | E202: 0 | F202: 0 | G202: 0 | I202: =VLOOKUP(RC[-7],Sheet4!C15:C29,14,FALSE) -> #N/A | J202: =VLOOKUP(RC[-8],Sheet4!C15:C29,15,FALSE) -> #N/A | L202: 0
A203: 0 | B203: 0 | C203: =RC[9]&","&RC[10]&";" -> 0,; | D203: 0 | E203: 0 | F203: 0 | G203: 0 | I203: =VLOOKUP(RC[-7],Sheet4!C15:C29,14,FALSE) -> #N/A | J203: =VLOOKUP(RC[-8],Sheet4!C15:C29,15,FALSE) -> #N/A | L203: 0
A204: 0 | B204: 0 | C204: =RC[9]&","&RC[10]&";" -> 0,; | D204: 0 | E204: 0 | F204: 0 | G204: 0 | I204: =VLOOKUP(RC[-7],Sheet4!C15:C29,14,FALSE) -> #N/A | J204: =VLOOKUP(RC[-8],Sheet4!C15:C29,15,FALSE) -> #N/A | L204: 0
A205: 0 | B205: 0 | C205: =RC[9]&","&RC[10]&";" -> 0,; | D205: 0 | E205: 0 | F205: 0 | G205: 0 | I205: =VLOOKUP(RC[-7],Sheet4!C15:C29,14,FALSE) -> #N/A | J205: =VLOOKUP(RC[-8],Sheet4!C15:C29,15,FALSE) -> #N/A | L205: 0
A206: 0 | B206: 0 | C206: =RC[9]&","&RC[10]&";" -> 0,; | D206: 0 | E206: 0 | F206: 0 | G206: 0 | I206: =VLOOKUP(RC[-7],Sheet4!C15:C29,14,FALSE) -> #N/A | J206: =VLOOKUP(RC[-8],Sheet4!C15:C29,15,FALSE) -> #N/A | L206: 0
A207: 0 | B207: 0 | C207: =RC[9]&","&RC[10]&";" -> 0,; | D207: 0 | E207: 0 | F207: 0 | G207: 0 | I207: =VLOOKUP(RC[-7],Sheet4!C15:C29,14,FALSE) -> #N/A | J207: =VLOOKUP(RC[-8],Sheet4!C15:C29,15,FALSE) -> #N/A | L207: 0
A208: 0 | B208: 0 | C208: =RC[9]&","&RC[10]&";" -> 0,; | D208: 0 | E208: 0 | F208: 0 | G208: 0 | I208: =VLOOKUP(RC[-7],Sheet4!C15:C29,14,FALSE) -> #N/A | J208: =VLOOKUP(RC[-8],Sheet4!C15:C29,15,FALSE) -> #N/A | L208: 0
A209: 0 | B209: 0 | C209: =RC[9]&","&RC[10]&";" -> 0,; | D209: 0 | E209: 0 | F209: 0 | G209: 0 | I209: =VLOOKUP(RC[-7],Sheet4!C15:C29,14,FALSE) -> #N/A | J209: =VLOOKUP(RC[-8],Sheet4!C15:C29,15,FALSE) -> #N/A | L209: 0
A210: 0 | B210: 0 | C210: =RC[9]&","&RC[10]&";" -> 0,; | D210: 0 | E210: 0 | F210: 0 | G210: 0 | I210: =VLOOKUP(RC[-7],Sheet4!C15:C29,14,FALSE) -> #N/A | J210: =VLOOKUP(RC[-8],Sheet4!C15:C29,15,FALSE) -> #N/A | L210: 0
A211: 0 | B211: 0 | C211: =RC[9]&","&RC[10]&";" -> 0,; | D211: 0 | E211: 0 | F211: 0 | G211: 0 | I211: =VLOOKUP(RC[-7],Sheet4!C15:C29,14,FALSE) -> #N/A | J211: =VLOOKUP(RC[-8],Sheet4!C15:C29,15,FALSE) -> #N/A | L211: 0
A212: 0 | B212: 0 | C212: =RC[9]&","&RC[10]&";" -> 0,; | D212: 0 | E212: 0 | F212: 0 | G212: 0 | I212: =VLOOKUP(RC[-7],Sheet4!C15:C29,14,FALSE) -> #N/A | J212: =VLOOKUP(RC[-8],Sheet4!C15:C29,15,FALSE) -> #N/A | L212: 0
A213: 0 | B213: 0 | C213: =RC[9]&","&RC[10]&";" -> 0,; | D213: 0 | E213: 0 | F213: 0 | G213: 0 | I213: =VLOOKUP(RC[-7],Sheet4!C15:C29,14,FALSE) -> #N/A | J213: =VLOOKUP(RC[-8],Sheet4!C15:C29,15,FALSE) -> #N/A | L213: 0
A214: 0 | B214: 0 | C214: =RC[9]&","&RC[10]&";" -> 0,; | D214: 0 | E214: 0 | F214: 0 | G214: 0 | I214: =VLOOKUP(RC[-7],Sheet4!C15:C29,14,FALSE) -> #N/A | J214: =VLOOKUP(RC[-8],Sheet4!C15:C29,15,FALSE) -> #N/A | L214: 0
A215: 0 | B215: 0 | C215: =RC[9]&","&RC[10]&";" -> 0,; | D215: 0 | E215: 0 | F215: 0 | G215: 0 | I215: =VLOOKUP(RC[-7],Sheet4!C15:C29,14,FALSE) -> #N/A | J215: =VLOOKUP(RC[-8],Sheet4!C15:C29,15,FALSE) -> #N/A | L215: 0
A216: 0 | B216: 0 | C216: =RC[9]&","&RC[10]&";" -> 0,; | D216: 0 | E216: 0 | F216: 0 | G216: 0 | I216: =VLOOKUP(RC[-7],Sheet4!C15:C29,14,FALSE) -> #N/A | J216: =VLOOKUP(RC[-8],Sheet4!C15:C29,15,FALSE) -> #N/A | L216: 0
A217: 0 | B217: 0 | C217: =RC[9]&","&RC[10]&";" -> 0,; | D217: 0 | E217: 0 | F217: 0 | G217: 0 | I217: =VLOOKUP(RC[-7],Sheet4!C15:C29,14,FALSE) -> #N/A | J217: =VLOOKUP(RC[-8],Sheet4!C15:C29,15,FALSE) -> #N/A | L217: 0
A218: 0 | B218: 0 | C218: =RC[9]&","&RC[10]&";" -> 0,; | D218: 0 | E218: 0 | F218: 0 | G218: 0 | I218: =VLOOKUP(RC[-7],Sheet4!C15:C29,14,FALSE) -> #N/A | J218: =VLOOKUP(RC[-8],Sheet4!C15:C29,15,FALSE) -> #N/A | L218: 0
A219: 0 | B219: 0 | C219: =RC[9]&","&RC[10]&";" -> 0,; | D219: 0 | E219: 0 | F219: 0 | G219: 0 | I219: =VLOOKUP(RC[-7],Sheet4!C15:C29,14,FALSE) -> #N/A | J219: =VLOOKUP(RC[-8],Sheet4!C15:C29,15,FALSE) -> #N/A | L219: 0
A220: 0 | B220: 0 | C220: =RC[9]&","&RC[10]&";" -> 0,; | D220: 0 | E220: 0 | F220: 0 | G220: 0 | I220: =VLOOKUP(RC[-7],Sheet4!C15:C29,14,FALSE) -> #N/A | J220: =VLOOKUP(RC[-8],Sheet4!C15:C29,15,FALSE) -> #N/A | L220: 0
A221: 0 | B221: 0 | C221: =RC[9]&","&RC[10]&";" -> 0,; | D221: 0 | E221: 0 | F221: 0 | G221: 0 | I221: =VLOOKUP(RC[-7],Sheet4!C15:C29,14,FALSE) -> #N/A | J221: =VLOOKUP(RC[-8],Sheet4!C15:C29,15,FALSE) -> #N/A | L221: 0
A222: 0 | B222: 0 | C222: =RC[9]&","&RC[10]&";" -> 0,; | D222: 0 | E222: 0 | F222: 0 | G222: 0 | I222: =VLOOKUP(RC[-7],Sheet4!C15:C29,14,FALSE) -> #N/A | J222: =VLOOKUP(RC[-8],Sheet4!C15:C29,15,FALSE) -> #N/A | L222: 0
A223: 0 | B223: 0 | C223: =RC[9]&","&RC[10]&";" -> 0,; | D223: 0 | E223: 0 | F223: 0 | G223: 0 | I223: =VLOOKUP(RC[-7],Sheet4!C15:C29,14,FALSE) -> #N/A | J223: =VLOOKUP(RC[-8],Sheet4!C15:C29,15,FALSE) -> #N/A | L223: 0
A224: 0 | B224: 0 | C224: =RC[9]&","&RC[10]&";" -> 0,; | D224: 0 | E224: 0 | F224: 0 | G224: 0 | I224: =VLOOKUP(RC[-7],Sheet4!C15:C29,14,FALSE) -> #N/A | J224: =VLOOKUP(RC[-8],Sheet4!C15:C29,15,FALSE) -> #N/A | L224: 0
A225: 0 | B225: 0 | C225: =RC[9]&","&RC[10]&";" -> 0,; | D225: 0 | E225: 0 | F225: 0 | G225: 0 | I225: =VLOOKUP(RC[-7],Sheet4!C15:C29,14,FALSE) -> #N/A | J225: =VLOOKUP(RC[-8],Sheet4!C15:C29,15,FALSE) -> #N/A | L225: 0
A226: 0 | B226: 0 | C226: =RC[9]&","&RC[10]&";" -> 0,; | D226: 0 | E226: 0 | F226: 0 | G226: 0 | I226: =VLOOKUP(RC[-7],Sheet4!C15:C29,14,FALSE) -> #N/A | J226: =VLOOKUP(RC[-8],Sheet4!C15:C29,15,FALSE) -> #N/A | L226: 0
A227: 0 | B227: 0 | C227: =RC[9]&","&RC[10]&";" -> 0,; | D227: 0 | E227: 0 | F227: 0 | G227: 0 | I227: =VLOOKUP(RC[-7],Sheet4!C15:C29,14,FALSE) -> #N/A | J227: =VLOOKUP(RC[-8],Sheet4!C15:C29,15,FALSE) -> #N/A | L227: 0
A228: 0 | B228: 0 | C228: =RC[9]&","&RC[10]&";" -> 0,; | D228: 0 | E228: 0 | F228: 0 | G228: 0 | I228: =VLOOKUP(RC[-7],Sheet4!C15:C29,14,FALSE) -> #N/A | J228: =VLOOKUP(RC[-8],Sheet4!C15:C29,15,FALSE) -> #N/A | L228: 0
A229: 0 | B229: 0 | C229: =RC[9]&","&RC[10]&";" -> 0,; | D229: 0 | E229: 0 | F229: 0 | G229: 0 | I229: =VLOOKUP(RC[-7],Sheet4!C15:C29,14,FALSE) -> #N/A | J229: =VLOOKUP(RC[-8],Sheet4!C15:C29,15,FALSE) -> #N/A | L229: 0
A230: 0 | B230: 0 | C230: =RC[9]&","&RC[10]&";" -> 0,; | D230: 0 | E230: 0 | F230: 0 | G230: 0 | I230: =VLOOKUP(RC[-7],Sheet4!C15:C29,14,FALSE) -> #N/A | J230: =VLOOKUP(RC[-8],Sheet4!C15:C29,15,FALSE) -> #N/A | L230: 0
A231: 0 | B231: 0 | C231: =RC[9]&","&RC[10]&";" -> 0,; | D231: 0 | E231: 0 | F231: 0 | G231: 0 | I231: =VLOOKUP(RC[-7],Sheet4!C15:C29,14,FALSE) -> #N/A | J231: =VLOOKUP(RC[-8],Sheet4!C15:C29,15,FALSE) -> #N/A | L231: 0
A232: 0 | B232: 0 | C232: =RC[9]&","&RC[10]&";" -> 0,; | D232: 0 | E232: 0 | F232: 0 | G232: 0 | I232: =VLOOKUP(RC[-7],Sheet4!C15:C29,14,FALSE) -> #N/A | J232: =VLOOKUP(RC[-8],Sheet4!C15:C29,15,FALSE) -> #N/A | L232: 0
A233: 0 | B233: 0 | C233: =RC[9]&","&RC[10]&";" -> ,; | D233: 0 | E233: 0 | F233: 0 | G233: 0 | I233: =VLOOKUP(RC[-7],Sheet4!C15:C29,14,FALSE) -> #N/A | J233: =VLOOKUP(RC[-8],Sheet4!C15:C29,15,FALSE) -> #N/A
I234: =VLOOKUP(RC[-7],Sheet4!C15:C29,14,FALSE) -> #N/A | J234: =VLOOKUP(RC[-8],Sheet4!C15:C29,15,FALSE) -> #N/A
I235: =VLOOKUP(RC[-7],Sheet4!C15:C29,14,FALSE) -> #N/A | J235: =VLOOKUP(RC[-8],Sheet4!C15:C29,15,FALSE) -> #N/A
I236: =VLOOKUP(RC[-7],Sheet4!C15:C29,14,FALSE) -> #N/A | J236: =VLOOKUP(RC[-8],Sheet4!C15:C29,15,FALSE) -> #N/A
I237: =VLOOKUP(RC[-7],Sheet4!C15:C29,14,FALSE) -> #N/A | J237: =VLOOKUP(RC[-8],Sheet4!C15:C29,15,FALSE) -> #N/A
I238: =VLOOKUP(RC[-7],Sheet4!C15:C29,14,FALSE) -> #N/A | J238: =VLOOKUP(RC[-8],Sheet4!C15:C29,15,FALSE) -> #N/A
I239: =VLOOKUP(RC[-7],Sheet4!C15:C29,14,FALSE) -> #N/A | J239: =VLOOKUP(RC[-8],Sheet4!C15:C29,15,FALSE) -> #N/A
I240: =VLOOKUP(RC[-7],Sheet4!C15:C29,14,FALSE) -> #N/A | J240: =VLOOKUP(RC[-8],Sheet4!C15:C29,15,FALSE) -> #N/A
I241: =VLOOKUP(RC[-7],Sheet4!C15:C29,14,FALSE) -> #N/A | J241: =VLOOKUP(RC[-8],Sheet4!C15:C29,15,FALSE) -> #N/A
I242: =VLOOKUP(RC[-7],Sheet4!C15:C29,14,FALSE) -> #N/A | J242: =VLOOKUP(RC[-8],Sheet4!C15:C29,15,FALSE) -> #N/A
I243: =VLOOKUP(RC[-7],Sheet4!C15:C29,14,FALSE) -> #N/A | J243: =VLOOKUP(RC[-8],Sheet4!C15:C29,15,FALSE) -> #N/A
I244: =VLOOKUP(RC[-7],Sheet4!C15:C29,14,FALSE) -> #N/A | J244: =VLOOKUP(RC[-8],Sheet4!C15:C29,15,FALSE) -> #N/A
I245: =VLOOKUP(RC[-7],Sheet4!C15:C29,14,FALSE) -> #N/A | J245: =VLOOKUP(RC[-8],Sheet4!C15:C29,15,FALSE) -> #N/A
I246: =VLOOKUP(RC[-7],Sheet4!C15:C29,14,FALSE) -> #N/A | J246: =VLOOKUP(RC[-8],Sheet4!C15:C29,15,FALSE) -> #N/A
I247: =VLOOKUP(RC[-7],Sheet4!C15:C29,14,FALSE) -> #N/A | J247: =VLOOKUP(RC[-8],Sheet4!C15:C29,15,FALSE) -> #N/A
I248: =VLOOKUP(RC[-7],Sheet4!C15:C29,14,FALSE) -> #N/A | J248: =VLOOKUP(RC[-8],Sheet4!C15:C29,15,FALSE) -> #N/A
I249: =VLOOKUP(RC[-7],Sheet4!C15:C29,14,FALSE) -> #N/A | J249: =VLOOKUP(RC[-8],Sheet4!C15:C29,15,FALSE) -> #N/A
I250: =VLOOKUP(RC[-7],Sheet4!C15:C29,14,FALSE) -> #N/A | J250: =VLOOKUP(RC[-8],Sheet4!C15:C29,15,FALSE) -> #N/A
I251: =VLOOKUP(RC[-7],Sheet4!C15:C29,14,FALSE) -> #N/A | J251: =VLOOKUP(RC[-8],Sheet4!C15:C29,15,FALSE) -> #N/A
I252: =VLOOKUP(RC[-7],Sheet4!C15:C29,14,FALSE) -> #N/A | J252: =VLOOKUP(RC[-8],Sheet4!C15:C29,15,FALSE) -> #N/A
I253: =VLOOKUP(RC[-7],Sheet4!C15:C29,14,FALSE) -> #N/A | J253: =VLOOKUP(RC[-8],Sheet4!C15:C29,15,FALSE) -> #N/A
I254: =VLOOKUP(RC[-7],Sheet4!C15:C29,14,FALSE) -> #N/A | J254: =VLOOKUP(RC[-8],Sheet4!C15:C29,15,FALSE) -> #N/A
I255: =VLOOKUP(RC[-7],Sheet4!C15:C29,14,FALSE) -> #N/A | J255: =VLOOKUP(RC[-8],Sheet4!C15:C29,15,FALSE) -> #N/A
I256: =VLOOKUP(RC[-7],Sheet4!C15:C29,14,FALSE) -> #N/A | J256: =VLOOKUP(RC[-8],Sheet4!C15:C29,15,FALSE) -> #N/A
I257: =VLOOKUP(RC[-7],Sheet4!C15:C29,14,FALSE) -> #N/A | J257: =VLOOKUP(RC[-8],Sheet4!C15:C29,15,FALSE) -> #N/A
I258: =VLOOKUP(RC[-7],Sheet4!C15:C29,14,FALSE) -> #N/A | J258: =VLOOKUP(RC[-8],Sheet4!C15:C29,15,FALSE) -> #N/A
I259: =VLOOKUP(RC[-7],Sheet4!C15:C29,14,FALSE) -> #N/A | J259: =VLOOKUP(RC[-8],Sheet4!C15:C29,15,FALSE) -> #N/A
I260: =VLOOKUP(RC[-7],Sheet4!C15:C29,14,FALSE) -> #N/A | J260: =VLOOKUP(RC[-8],Sheet4!C15:C29,15,FALSE) -> #N/A
I261: =VLOOKUP(RC[-7],Sheet4!C15:C29,14,FALSE) -> #N/A | J261: =VLOOKUP(RC[-8],Sheet4!C15:C29,15,FALSE) -> #N/A
I262: =VLOOKUP(RC[-7],Sheet4!C15:C29,14,FALSE) -> #N/A | J262: =VLOOKUP(RC[-8],Sheet4!C15:C29,15,FALSE) -> #N/A