Sheet: ctFATaskAwardConf
A2: nID | B2: sName | C2: ePlayerExp | D2: ePetExp | E2: nEveryDayTimes | F2: nHuanshu | G2: tRewadPercentage
A3: i | B3: s | C3: e | D3: e | E3: i | F3: i | G3: t{iii}
A4: 任务ID | B4: 任务名字 | C4: 玩家经验公式 | D4: 宠物经验公式 | E4: 每天最大次数 | F4: 每次找回的环数 | G4: 奖励经验比例
A5: 104 | B5: 师门活动 | C5: 16*(100*LV+140) | D5: 16*(54*LV+900) | E5: 2 | F5: 10 | G5: 40,80,100;
A6: 108 | B6: 赏金活动 | C6: 4*(LV*LV+1500) | D6: 4*(LV*LV+1500) | E6: 5 | F6: 1 | G6: 40,80,100;
A7: 101 | B7: 捉妖活动 | C7: 4.5*(35*LV+200)*10 | D7: 4.2*(28*LV+160)*10 | E7: 5 | F7: 10 | G7: 40,80,100;
A8: 111 | B8: 萌仙轶事 | C8: 600*LV+2000 | D8: 195*LV+1900 | E8: 1 | F8: 10 | G8: 40,80,100;
A9: 112 | B9: 萌仙课堂 | C9: 500*LV+2000 | D9: 195*LV+1900 | E9: 1 | F9: 10 | G9: 40,80,100;
A10: 116 | B10: 妖兽突袭 | C10: 2*(180*LV+3000) | D10: 2*(144*LV+2400) | E10: 3 | F10: 1 | G10: 40,80,100;
A11: 102 | B11: 降妖伏魔 | C11: 2000*LV+8000 | D11: 500*LV+12000 | E11: 1 | F11: 10 | G11: 40,80,100;
A12: 103 | B12: 诛心魔 | C12: 160*LV+2500 | D12: 288*LV+4500 | E12: 2 | F12: 1 | G12: 40,80,100;

Sheet: Sheet2
D4: 副本类型 | E4: 副本名称 | F4: 银币奖励基数公式
D5: 101 | E5: 镇妖活动 | F5: 10000*0.1*(100+nCompCount)/100*(1+nRoleLevel/200)
D6: 102 | E6: 乱世妖魔 | F6: 1000*(1+nRoleLevel/200)
D7: 103 | E7: 心魔侵蚀 | F7: nSilverRatio*20
D8: 201 | E8: 决战九霄 | F8: 50000
D9: 202 | E9: 混沌试炼 | F9: 50000
D10: 203 | E10: 梦诛无双 | F10: 50000*(1+MaxCount/99)
D11: 105 | E11: 神兽乐园 | F11: 0
D12: 110 | E12: 神魔志 | F12: 0
E13: 师门活动 | F13: 8000*(1+nTaskCount*0.2)*0.5*(1+nRoleLevel/200)*nXiuzheng
E14: 妖兽突袭 | F14: math.floor(50000+(1+nStare/9))
E15: 赏金活动 | F15: nSilverRatio*3

Sheet: Sheet3
C2: =INT(R[11]C*0.85) -> 7318 | F2: =INT(R[11]C*0.85) -> 25500 | J2: =INT(R[11]C*0.85) -> 5577 | M2: =INT(R[11]C*0.85) -> 2550 | P2: =INT(R[11]C*0.85) -> 3570 | S2: =INT(R[11]C*0.85) -> 170000 | W2: 任务ID | X2: 任务名字 | Y2: 玩家经验公式 | Z2: 宠物经验公式 | AA2: 每天最大次数
C3: =INT(R[20]C*0.85) -> 7675 | F3: =INT(R[20]C*0.85) -> 25500 | J3: =INT(R[20]C*0.85) -> 6108 | M3: =INT(R[20]C*0.85) -> 2550 | P3: =INT(R[20]C*0.85) -> 3910 | S3: =INT(R[20]C*0.85) -> 170000 | W3: 104 | X3: 师门活动 | Y3: 1.6*(90*LV+1000) | Z3: 1.6*(54*LV+900) | AA3: 20 | AC3: =VLOOKUP(RC[-5],Sheet2!C5:C7,2,FALSE) -> 8000*(1+nTaskCount*0.2)*0.5*(1+nRoleLevel/200)*nXiuzheng
C4: =INT(R[39]C*0.85) -> 8389 | F4: =INT(R[39]C*0.85) -> 25500 | J4: =INT(R[39]C*0.85) -> 7171 | M4: =INT(R[39]C*0.85) -> 2550 | P4: =INT(R[39]C*0.85) -> 4590 | S4: =INT(R[39]C*0.85) -> 170000 | W4: 108 | X4: 赏金活动 | Y4: 4*(LV*LV+1500) | Z4: 4*(LV*LV+1500) | AA4: 5 | AC4: =VLOOKUP(RC[-5],Sheet2!C5:C7,2,FALSE) -> nSilverRatio*3
C5: =INT(R[68]C*0.85) -> 9460 | F5: =INT(R[68]C*0.85) -> 25500 | J5: =INT(R[68]C*0.85) -> 8765 | M5: =INT(R[68]C*0.85) -> 2550 | P5: =INT(R[68]C*0.85) -> 5610 | S5: =INT(R[68]C*0.85) -> 170000 | W5: 101 | X5: 镇妖活动 | Y5: 4.5*(35*LV+200)*5 | Z5: 4.2*(28*LV+160)*5 | AA5: 10 | AC5: =VLOOKUP(RC[-5],Sheet2!C5:C7,2,FALSE) -> 10000*0.1*(100+nCompCount)/100*(1+nRoleLevel/200) | AF5: 10000*0.1*(100+nCompCount)/100*(1+nRoleLevel/100)
C6: =INT(R[87]C*0.85) -> 10174 | F6: =INT(R[87]C*0.85) -> 25500 | J6: =INT(R[87]C*0.85) -> 9827 | M6: =INT(R[87]C*0.85) -> 2550 | P6: =INT(R[87]C*0.85) -> 6290 | S6: =INT(R[87]C*0.85) -> 170000 | W6: 4 | X6: 诛仙轶事 | Y6: 600*LV+2000 | Z6: 195*LV+1900 | AA6: 1 | AC6: =VLOOKUP(RC[-5],Sheet2!C5:C7,2,FALSE) -> #N/A
W7: 5 | X7: 梦诛课堂 | Y7: 500*LV+2000 | Z7: 195*LV+1900 | AA7: 1 | AC7: =VLOOKUP(RC[-5],Sheet2!C5:C7,2,FALSE) -> #N/A
B8: 等级 | C8: 师门 | D8: 20次之后 | F8: 赏金 | G8: 5次之后 | I8: 镇妖 | J8: 镇妖*5 | K8: 50次之后 | M8: 妖兽突袭 | N8: 3次之后 | P8: 乱世妖魔 | Q8: 10次之后 | S8: 心魔侵蚀 | T8: 2次之后 | W8: 6 | X8: 妖兽突袭 | Y8: 1.3*(180*LV+3000) | Z8: 1.3*(144*LV+2400) | AA8: 3 | AC8: =VLOOKUP(RC[-5],Sheet2!C5:C7,2,FALSE) -> math.floor(50000+(1+nStare/9)) | AF8: math.floor(5000+(1+nStare/9))
B9: 1 | C9: =8000*2.1*0.5*(1+RC[-1]/200) -> 8442 | D9: =RC[-1]*20 -> 168840 | F9: =10000*3 -> 30000 | G9: =RC[-1]*5 -> 150000 | I9: =10000*0.1*1.25*(1+RC[-7]/100) -> 1262.5 | J9: =INT(RC[-1]*5) -> 6312 | K9: =RC[-2]*50 -> 63125 | M9: =2000*1.5 -> 3000 | N9: =RC[-1]*3 -> 9000 | P9: =4000*(1+RC[-14]/100) -> 4040 | Q9: =RC[-1]*10 -> 40400 | S9: 200000 | T9: =RC[-1]*2 -> 400000 | W9: 102 | X9: 乱世妖魔 | Y9: 200*LV+800 | Z9: 50*LV+1200 | AA9: 10 | AC9: =VLOOKUP(RC[-5],Sheet2!C5:C7,2,FALSE) -> 1000*(1+nRoleLevel/200) | AF9: 2000*(1+nRoleLevel/100)
B10: 2 | C10: =8000*2.1*0.5*(1+RC[-1]/200) -> 8484 | D10: =RC[-1]*20 -> 169680 | F10: =10000*3 -> 30000 | G10: =RC[-1]*5 -> 150000 | I10: =10000*0.1*1.25*(1+RC[-7]/100) -> 1275 | J10: =INT(RC[-1]*5) -> 6375 | K10: =RC[-2]*50 -> 63750 | M10: =2000*1.5 -> 3000 | N10: =RC[-1]*3 -> 9000 | P10: =4000*(1+RC[-14]/100) -> 4080 | Q10: =RC[-1]*10 -> 40800 | S10: 200000 | T10: =RC[-1]*2 -> 400000
B11: 3 | C11: =8000*2.1*0.5*(1+RC[-1]/200) -> 8526 | D11: =RC[-1]*20 -> 170520 | F11: =10000*3 -> 30000 | G11: =RC[-1]*5 -> 150000 | I11: =10000*0.1*1.25*(1+RC[-7]/100) -> 1287.5 | J11: =INT(RC[-1]*5) -> 6437 | K11: =RC[-2]*50 -> 64375 | M11: =2000*1.5 -> 3000 | N11: =RC[-1]*3 -> 9000 | P11: =4000*(1+RC[-14]/100) -> 4120 | Q11: =RC[-1]*10 -> 41200 | S11: 200000 | T11: =RC[-1]*2 -> 400000
B12: 4 | C12: =8000*2.1*0.5*(1+RC[-1]/200) -> 8568 | D12: =RC[-1]*20 -> 171360 | F12: =10000*3 -> 30000 | G12: =RC[-1]*5 -> 150000 | I12: =10000*0.1*1.25*(1+RC[-7]/100) -> 1300 | J12: =INT(RC[-1]*5) -> 6500 | K12: =RC[-2]*50 -> 65000 | M12: =2000*1.5 -> 3000 | N12: =RC[-1]*3 -> 9000 | P12: =4000*(1+RC[-14]/100) -> 4160 | Q12: =RC[-1]*10 -> 41600 | S12: 200000 | T12: =RC[-1]*2 -> 400000
B13: 5 | C13: =8000*2.1*0.5*(1+RC[-1]/200) -> 8610 | D13: =RC[-1]*20 -> 172200 | F13: =10000*3 -> 30000 | G13: =RC[-1]*5 -> 150000 | I13: =10000*0.1*1.25*(1+RC[-7]/100) -> 1312.5 | J13: =INT(RC[-1]*5) -> 6562 | K13: =RC[-2]*50 -> 65625 | M13: =2000*1.5 -> 3000 | N13: =RC[-1]*3 -> 9000 | P13: =4000*(1+RC[-14]/100) -> 4200 | Q13: =RC[-1]*10 -> 42000 | S13: 200000 | T13: =RC[-1]*2 -> 400000
B14: 6 | C14: =8000*2.1*0.5*(1+RC[-1]/200) -> 8652 | D14: =RC[-1]*20 -> 173040 | F14: =10000*3 -> 30000 | G14: =RC[-1]*5 -> 150000 | I14: =10000*0.1*1.25*(1+RC[-7]/100) -> 1325 | J14: =INT(RC[-1]*5) -> 6625 | K14: =RC[-2]*50 -> 66250 | M14: =2000*1.5 -> 3000 | N14: =RC[-1]*3 -> 9000 | P14: =4000*(1+RC[-14]/100) -> 4240 | Q14: =RC[-1]*10 -> 42400 | S14: 200000 | T14: =RC[-1]*2 -> 400000
B15: 7 | C15: =8000*2.1*0.5*(1+RC[-1]/200) -> 8694 | D15: =RC[-1]*20 -> 173880 | F15: =10000*3 -> 30000 | G15: =RC[-1]*5 -> 150000 | I15: =10000*0.1*1.25*(1+RC[-7]/100) -> 1337.5 | J15: =INT(RC[-1]*5) -> 6687 | K15: =RC[-2]*50 -> 66875 | M15: =2000*1.5 -> 3000 | N15: =RC[-1]*3 -> 9000 | P15: =4000*(1+RC[-14]/100) -> 4280 | Q15: =RC[-1]*10 -> 42800 | S15: 200000 | T15: =RC[-1]*2 -> 400000
B16: 8 | C16: =8000*2.1*0.5*(1+RC[-1]/200) -> 8736 | D16: =RC[-1]*20 -> 174720 | F16: =10000*3 -> 30000 | G16: =RC[-1]*5 -> 150000 | I16: =10000*0.1*1.25*(1+RC[-7]/100) -> 1350 | J16: =INT(RC[-1]*5) -> 6750 | K16: =RC[-2]*50 -> 67500 | M16: =2000*1.5 -> 3000 | N16: =RC[-1]*3 -> 9000 | P16: =4000*(1+RC[-14]/100) -> 4320 | Q16: =RC[-1]*10 -> 43200 | S16: 200000 | T16: =RC[-1]*2 -> 400000
B17: 9 | C17: =8000*2.1*0.5*(1+RC[-1]/200) -> 8778 | D17: =RC[-1]*20 -> 175560 | F17: =10000*3 -> 30000 | G17: =RC[-1]*5 -> 150000 | I17: =10000*0.1*1.25*(1+RC[-7]/100) -> 1362.5 | J17: =INT(RC[-1]*5) -> 6812 | K17: =RC[-2]*50 -> 68125 | M17: =2000*1.5 -> 3000 | N17: =RC[-1]*3 -> 9000 | P17: =4000*(1+RC[-14]/100) -> 4360 | Q17: =RC[-1]*10 -> 43600 | S17: 200000 | T17: =RC[-1]*2 -> 400000
B18: 10 | C18: =8000*2.1*0.5*(1+RC[-1]/200) -> 8820 | D18: =RC[-1]*20 -> 176400 | F18: =10000*3 -> 30000 | G18: =RC[-1]*5 -> 150000 | I18: =10000*0.1*1.25*(1+RC[-7]/100) -> 1375 | J18: =INT(RC[-1]*5) -> 6875 | K18: =RC[-2]*50 -> 68750 | M18: =2000*1.5 -> 3000 | N18: =RC[-1]*3 -> 9000 | P18: =4000*(1+RC[-14]/100) -> 4400 | Q18: =RC[-1]*10 -> 44000 | S18: 200000 | T18: =RC[-1]*2 -> 400000
B19: 11 | C19: =8000*2.1*0.5*(1+RC[-1]/200) -> 8862 | D19: =RC[-1]*20 -> 177240 | F19: =10000*3 -> 30000 | G19: =RC[-1]*5 -> 150000 | I19: =10000*0.1*1.25*(1+RC[-7]/100) -> 1387.5 | J19: =INT(RC[-1]*5) -> 6937 | K19: =RC[-2]*50 -> 69375 | M19: =2000*1.5 -> 3000 | N19: =RC[-1]*3 -> 9000 | P19: =4000*(1+RC[-14]/100) -> 4440 | Q19: =RC[-1]*10 -> 44400 | S19: 200000 | T19: =RC[-1]*2 -> 400000
B20: 12 | C20: =8000*2.1*0.5*(1+RC[-1]/200) -> 8904 | D20: =RC[-1]*20 -> 178080 | F20: =10000*3 -> 30000 | G20: =RC[-1]*5 -> 150000 | I20: =10000*0.1*1.25*(1+RC[-7]/100) -> 1400 | J20: =INT(RC[-1]*5) -> 7000 | K20: =RC[-2]*50 -> 70000 | M20: =2000*1.5 -> 3000 | N20: =RC[-1]*3 -> 9000 | P20: =4000*(1+RC[-14]/100) -> 4480 | Q20: =RC[-1]*10 -> 44800 | S20: 200000 | T20: =RC[-1]*2 -> 400000
B21: 13 | C21: =8000*2.1*0.5*(1+RC[-1]/200) -> 8946 | D21: =RC[-1]*20 -> 178920 | F21: =10000*3 -> 30000 | G21: =RC[-1]*5 -> 150000 | I21: =10000*0.1*1.25*(1+RC[-7]/100) -> 1412.5 | J21: =INT(RC[-1]*5) -> 7062 | K21: =RC[-2]*50 -> 70625 | M21: =2000*1.5 -> 3000 | N21: =RC[-1]*3 -> 9000 | P21: =4000*(1+RC[-14]/100) -> 4520 | Q21: =RC[-1]*10 -> 45200 | S21: 200000 | T21: =RC[-1]*2 -> 400000
B22: 14 | C22: =8000*2.1*0.5*(1+RC[-1]/200) -> 8988 | D22: =RC[-1]*20 -> 179760 | F22: =10000*3 -> 30000 | G22: =RC[-1]*5 -> 150000 | I22: =10000*0.1*1.25*(1+RC[-7]/100) -> 1425 | J22: =INT(RC[-1]*5) -> 7125 | K22: =RC[-2]*50 -> 71250 | M22: =2000*1.5 -> 3000 | N22: =RC[-1]*3 -> 9000 | P22: =4000*(1+RC[-14]/100) -> 4560 | Q22: =RC[-1]*10 -> 45600 | S22: 200000 | T22: =RC[-1]*2 -> 400000
B23: 15 | C23: =8000*2.1*0.5*(1+RC[-1]/200) -> 9030 | D23: =RC[-1]*20 -> 180600 | F23: =10000*3 -> 30000 | G23: =RC[-1]*5 -> 150000 | I23: =10000*0.1*1.25*(1+RC[-7]/100) -> 1437.5 | J23: =INT(RC[-1]*5) -> 7187 | K23: =RC[-2]*50 -> 71875 | M23: =2000*1.5 -> 3000 | N23: =RC[-1]*3 -> 9000 | P23: =4000*(1+RC[-14]/100) -> 4600 | Q23: =RC[-1]*10 -> 46000 | S23: 200000 | T23: =RC[-1]*2 -> 400000
B24: 16 | C24: =8000*2.1*0.5*(1+RC[-1]/200) -> 9072 | D24: =RC[-1]*20 -> 181440 | F24: =10000*3 -> 30000 | G24: =RC[-1]*5 -> 150000 | I24: =10000*0.1*1.25*(1+RC[-7]/100) -> 1450 | J24: =INT(RC[-1]*5) -> 7250 | K24: =RC[-2]*50 -> 72500 | M24: =2000*1.5 -> 3000 | N24: =RC[-1]*3 -> 9000 | P24: =4000*(1+RC[-14]/100) -> 4640 | Q24: =RC[-1]*10 -> 46400 | S24: 200000 | T24: =RC[-1]*2 -> 400000
B25: 17 | C25: =8000*2.1*0.5*(1+RC[-1]/200) -> 9114 | D25: =RC[-1]*20 -> 182280 | F25: =10000*3 -> 30000 | G25: =RC[-1]*5 -> 150000 | I25: =10000*0.1*1.25*(1+RC[-7]/100) -> 1462.5 | J25: =INT(RC[-1]*5) -> 7312 | K25: =RC[-2]*50 -> 73125 | M25: =2000*1.5 -> 3000 | N25: =RC[-1]*3 -> 9000 | P25: =4000*(1+RC[-14]/100) -> 4680 | Q25: =RC[-1]*10 -> 46800 | S25: 200000 | T25: =RC[-1]*2 -> 400000
B26: 18 | C26: =8000*2.1*0.5*(1+RC[-1]/200) -> 9156 | D26: =RC[-1]*20 -> 183120 | F26: =10000*3 -> 30000 | G26: =RC[-1]*5 -> 150000 | I26: =10000*0.1*1.25*(1+RC[-7]/100) -> 1475 | J26: =INT(RC[-1]*5) -> 7375 | K26: =RC[-2]*50 -> 73750 | M26: =2000*1.5 -> 3000 | N26: =RC[-1]*3 -> 9000 | P26: =4000*(1+RC[-14]/100) -> 4720 | Q26: =RC[-1]*10 -> 47200 | S26: 200000 | T26: =RC[-1]*2 -> 400000
B27: 19 | C27: =8000*2.1*0.5*(1+RC[-1]/200) -> 9198 | D27: =RC[-1]*20 -> 183960 | F27: =10000*3 -> 30000 | G27: =RC[-1]*5 -> 150000 | I27: =10000*0.1*1.25*(1+RC[-7]/100) -> 1487.5 | J27: =INT(RC[-1]*5) -> 7437 | K27: =RC[-2]*50 -> 74375 | M27: =2000*1.5 -> 3000 | N27: =RC[-1]*3 -> 9000 | P27: =4000*(1+RC[-14]/100) -> 4760 | Q27: =RC[-1]*10 -> 47600 | S27: 200000 | T27: =RC[-1]*2 -> 400000
B28: 20 | C28: =8000*2.1*0.5*(1+RC[-1]/200) -> 9240 | D28: =RC[-1]*20 -> 184800 | F28: =10000*3 -> 30000 | G28: =RC[-1]*5 -> 150000 | I28: =10000*0.1*1.25*(1+RC[-7]/100) -> 1500 | J28: =INT(RC[-1]*5) -> 7500 | K28: =RC[-2]*50 -> 75000 | M28: =2000*1.5 -> 3000 | N28: =RC[-1]*3 -> 9000 | P28: =4000*(1+RC[-14]/100) -> 4800 | Q28: =RC[-1]*10 -> 48000 | S28: 200000 | T28: =RC[-1]*2 -> 400000
B29: 21 | C29: =8000*2.1*0.5*(1+RC[-1]/200) -> 9282 | D29: =RC[-1]*20 -> 185640 | F29: =10000*3 -> 30000 | G29: =RC[-1]*5 -> 150000 | I29: =10000*0.1*1.25*(1+RC[-7]/100) -> 1512.5 | J29: =INT(RC[-1]*5) -> 7562 | K29: =RC[-2]*50 -> 75625 | M29: =2000*1.5 -> 3000 | N29: =RC[-1]*3 -> 9000 | P29: =4000*(1+RC[-14]/100) -> 4840 | Q29: =RC[-1]*10 -> 48400 | S29: 200000 | T29: =RC[-1]*2 -> 400000
B30: 22 | C30: =8000*2.1*0.5*(1+RC[-1]/200) -> 9324 | D30: =RC[-1]*20 -> 186480 | F30: =10000*3 -> 30000 | G30: =RC[-1]*5 -> 150000 | I30: =10000*0.1*1.25*(1+RC[-7]/100) -> 1525 | J30: =INT(RC[-1]*5) -> 7625 | K30: =RC[-2]*50 -> 76250 | M30: =2000*1.5 -> 3000 | N30: =RC[-1]*3 -> 9000 | P30: =4000*(1+RC[-14]/100) -> 4880 | Q30: =RC[-1]*10 -> 48800 | S30: 200000 | T30: =RC[-1]*2 -> 400000
B31: 23 | C31: =8000*2.1*0.5*(1+RC[-1]/200) -> 9366 | D31: =RC[-1]*20 -> 187320 | F31: =10000*3 -> 30000 | G31: =RC[-1]*5 -> 150000 | I31: =10000*0.1*1.25*(1+RC[-7]/100) -> 1537.5 | J31: =INT(RC[-1]*5) -> 7687 | K31: =RC[-2]*50 -> 76875 | M31: =2000*1.5 -> 3000 | N31: =RC[-1]*3 -> 9000 | P31: =4000*(1+RC[-14]/100) -> 4920 | Q31: =RC[-1]*10 -> 49200 | S31: 200000 | T31: =RC[-1]*2 -> 400000
B32: 24 | C32: =8000*2.1*0.5*(1+RC[-1]/200) -> 9408 | D32: =RC[-1]*20 -> 188160 | F32: =10000*3 -> 30000 | G32: =RC[-1]*5 -> 150000 | I32: =10000*0.1*1.25*(1+RC[-7]/100) -> 1550 | J32: =INT(RC[-1]*5) -> 7750 | K32: =RC[-2]*50 -> 77500 | M32: =2000*1.5 -> 3000 | N32: =RC[-1]*3 -> 9000 | P32: =4000*(1+RC[-14]/100) -> 4960 | Q32: =RC[-1]*10 -> 49600 | S32: 200000 | T32: =RC[-1]*2 -> 400000
B33: 25 | C33: =8000*2.1*0.5*(1+RC[-1]/200) -> 9450 | D33: =RC[-1]*20 -> 189000 | F33: =10000*3 -> 30000 | G33: =RC[-1]*5 -> 150000 | I33: =10000*0.1*1.25*(1+RC[-7]/100) -> 1562.5 | J33: =INT(RC[-1]*5) -> 7812 | K33: =RC[-2]*50 -> 78125 | M33: =2000*1.5 -> 3000 | N33: =RC[-1]*3 -> 9000 | P33: =4000*(1+RC[-14]/100) -> 5000 | Q33: =RC[-1]*10 -> 50000 | S33: 200000 | T33: =RC[-1]*2 -> 400000
B34: 26 | C34: =8000*2.1*0.5*(1+RC[-1]/200) -> 9492 | D34: =RC[-1]*20 -> 189840 | F34: =10000*3 -> 30000 | G34: =RC[-1]*5 -> 150000 | I34: =10000*0.1*1.25*(1+RC[-7]/100) -> 1575 | J34: =INT(RC[-1]*5) -> 7875 | K34: =RC[-2]*50 -> 78750 | M34: =2000*1.5 -> 3000 | N34: =RC[-1]*3 -> 9000 | P34: =4000*(1+RC[-14]/100) -> 5040 | Q34: =RC[-1]*10 -> 50400 | S34: 200000 | T34: =RC[-1]*2 -> 400000
B35: 27 | C35: =8000*2.1*0.5*(1+RC[-1]/200) -> 9534 | D35: =RC[-1]*20 -> 190680 | F35: =10000*3 -> 30000 | G35: =RC[-1]*5 -> 150000 | I35: =10000*0.1*1.25*(1+RC[-7]/100) -> 1587.5 | J35: =INT(RC[-1]*5) -> 7937 | K35: =RC[-2]*50 -> 79375 | M35: =2000*1.5 -> 3000 | N35: =RC[-1]*3 -> 9000 | P35: =4000*(1+RC[-14]/100) -> 5080 | Q35: =RC[-1]*10 -> 50800 | S35: 200000 | T35: =RC[-1]*2 -> 400000
B36: 28 | C36: =8000*2.1*0.5*(1+RC[-1]/200) -> 9576 | D36: =RC[-1]*20 -> 191520 | F36: =10000*3 -> 30000 | G36: =RC[-1]*5 -> 150000 | I36: =10000*0.1*1.25*(1+RC[-7]/100) -> 1600 | J36: =INT(RC[-1]*5) -> 8000 | K36: =RC[-2]*50 -> 80000 | M36: =2000*1.5 -> 3000 | N36: =RC[-1]*3 -> 9000 | P36: =4000*(1+RC[-14]/100) -> 5120 | Q36: =RC[-1]*10 -> 51200 | S36: 200000 | T36: =RC[-1]*2 -> 400000
B37: 29 | C37: =8000*2.1*0.5*(1+RC[-1]/200) -> 9618 | D37: =RC[-1]*20 -> 192360 | F37: =10000*3 -> 30000 | G37: =RC[-1]*5 -> 150000 | I37: =10000*0.1*1.25*(1+RC[-7]/100) -> 1612.5 | J37: =INT(RC[-1]*5) -> 8062 | K37: =RC[-2]*50 -> 80625 | M37: =2000*1.5 -> 3000 | N37: =RC[-1]*3 -> 9000 | P37: =4000*(1+RC[-14]/100) -> 5160 | Q37: =RC[-1]*10 -> 51600 | S37: 200000 | T37: =RC[-1]*2 -> 400000
B38: 30 | C38: =8000*2.1*0.5*(1+RC[-1]/200) -> 9660 | D38: =RC[-1]*20 -> 193200 | F38: =10000*3 -> 30000 | G38: =RC[-1]*5 -> 150000 | I38: =10000*0.1*1.25*(1+RC[-7]/100) -> 1625 | J38: =INT(RC[-1]*5) -> 8125 | K38: =RC[-2]*50 -> 81250 | M38: =2000*1.5 -> 3000 | N38: =RC[-1]*3 -> 9000 | P38: =4000*(1+RC[-14]/100) -> 5200 | Q38: =RC[-1]*10 -> 52000 | S38: 200000 | T38: =RC[-1]*2 -> 400000
B39: 31 | C39: =8000*2.1*0.5*(1+RC[-1]/200) -> 9702 | D39: =RC[-1]*20 -> 194040 | F39: =10000*3 -> 30000 | G39: =RC[-1]*5 -> 150000 | I39: =10000*0.1*1.25*(1+RC[-7]/100) -> 1637.5 | J39: =INT(RC[-1]*5) -> 8187 | K39: =RC[-2]*50 -> 81875 | M39: =2000*1.5 -> 3000 | N39: =RC[-1]*3 -> 9000 | P39: =4000*(1+RC[-14]/100) -> 5240 | Q39: =RC[-1]*10 -> 52400 | S39: 200000 | T39: =RC[-1]*2 -> 400000
B40: 32 | C40: =8000*2.1*0.5*(1+RC[-1]/200) -> 9744 | D40: =RC[-1]*20 -> 194880 | F40: =10000*3 -> 30000 | G40: =RC[-1]*5 -> 150000 | I40: =10000*0.1*1.25*(1+RC[-7]/100) -> 1650 | J40: =INT(RC[-1]*5) -> 8250 | K40: =RC[-2]*50 -> 82500 | M40: =2000*1.5 -> 3000 | N40: =RC[-1]*3 -> 9000 | P40: =4000*(1+RC[-14]/100) -> 5280 | Q40: =RC[-1]*10 -> 52800 | S40: 200000 | T40: =RC[-1]*2 -> 400000
B41: 33 | C41: =8000*2.1*0.5*(1+RC[-1]/200) -> 9786 | D41: =RC[-1]*20 -> 195720 | F41: =10000*3 -> 30000 | G41: =RC[-1]*5 -> 150000 | I41: =10000*0.1*1.25*(1+RC[-7]/100) -> 1662.5 | J41: =INT(RC[-1]*5) -> 8312 | K41: =RC[-2]*50 -> 83125 | M41: =2000*1.5 -> 3000 | N41: =RC[-1]*3 -> 9000 | P41: =4000*(1+RC[-14]/100) -> 5320 | Q41: =RC[-1]*10 -> 53200 | S41: 200000 | T41: =RC[-1]*2 -> 400000
B42: 34 | C42: =8000*2.1*0.5*(1+RC[-1]/200) -> 9828 | D42: =RC[-1]*20 -> 196560 | F42: =10000*3 -> 30000 | G42: =RC[-1]*5 -> 150000 | I42: =10000*0.1*1.25*(1+RC[-7]/100) -> 1675 | J42: =INT(RC[-1]*5) -> 8375 | K42: =RC[-2]*50 -> 83750 | M42: =2000*1.5 -> 3000 | N42: =RC[-1]*3 -> 9000 | P42: =4000*(1+RC[-14]/100) -> 5360 | Q42: =RC[-1]*10 -> 53600 | S42: 200000 | T42: =RC[-1]*2 -> 400000
B43: 35 | C43: =8000*2.1*0.5*(1+RC[-1]/200) -> 9870 | D43: =RC[-1]*20 -> 197400 | F43: =10000*3 -> 30000 | G43: =RC[-1]*5 -> 150000 | I43: =10000*0.1*1.25*(1+RC[-7]/100) -> 1687.5 | J43: =INT(RC[-1]*5) -> 8437 | K43: =RC[-2]*50 -> 84375 | M43: =2000*1.5 -> 3000 | N43: =RC[-1]*3 -> 9000 | P43: =4000*(1+RC[-14]/100) -> 5400 | Q43: =RC[-1]*10 -> 54000 | S43: 200000 | T43: =RC[-1]*2 -> 400000
B44: 36 | C44: =8000*2.1*0.5*(1+RC[-1]/200) -> 9912 | D44: =RC[-1]*20 -> 198240 | F44: =10000*3 -> 30000 | G44: =RC[-1]*5 -> 150000 | I44: =10000*0.1*1.25*(1+RC[-7]/100) -> 1700 | J44: =INT(RC[-1]*5) -> 8500 | K44: =RC[-2]*50 -> 85000 | M44: =2000*1.5 -> 3000 | N44: =RC[-1]*3 -> 9000 | P44: =4000*(1+RC[-14]/100) -> 5440 | Q44: =RC[-1]*10 -> 54400 | S44: 200000 | T44: =RC[-1]*2 -> 400000
B45: 37 | C45: =8000*2.1*0.5*(1+RC[-1]/200) -> 9954 | D45: =RC[-1]*20 -> 199080 | F45: =10000*3 -> 30000 | G45: =RC[-1]*5 -> 150000 | I45: =10000*0.1*1.25*(1+RC[-7]/100) -> 1712.5 | J45: =INT(RC[-1]*5) -> 8562 | K45: =RC[-2]*50 -> 85625 | M45: =2000*1.5 -> 3000 | N45: =RC[-1]*3 -> 9000 | P45: =4000*(1+RC[-14]/100) -> 5480 | Q45: =RC[-1]*10 -> 54800 | S45: 200000 | T45: =RC[-1]*2 -> 400000
B46: 38 | C46: =8000*2.1*0.5*(1+RC[-1]/200) -> 9996 | D46: =RC[-1]*20 -> 199920 | F46: =10000*3 -> 30000 | G46: =RC[-1]*5 -> 150000 | I46: =10000*0.1*1.25*(1+RC[-7]/100) -> 1725 | J46: =INT(RC[-1]*5) -> 8625 | K46: =RC[-2]*50 -> 86250 | M46: =2000*1.5 -> 3000 | N46: =RC[-1]*3 -> 9000 | P46: =4000*(1+RC[-14]/100) -> 5520 | Q46: =RC[-1]*10 -> 55200 | S46: 200000 | T46: =RC[-1]*2 -> 400000
B47: 39 | C47: =8000*2.1*0.5*(1+RC[-1]/200) -> 10038 | D47: =RC[-1]*20 -> 200760 | F47: =10000*3 -> 30000 | G47: =RC[-1]*5 -> 150000 | I47: =10000*0.1*1.25*(1+RC[-7]/100) -> 1737.5 | J47: =INT(RC[-1]*5) -> 8687 | K47: =RC[-2]*50 -> 86875 | M47: =2000*1.5 -> 3000 | N47: =RC[-1]*3 -> 9000 | P47: =4000*(1+RC[-14]/100) -> 5560 | Q47: =RC[-1]*10 -> 55600 | S47: 200000 | T47: =RC[-1]*2 -> 400000
B48: 40 | C48: =8000*2.1*0.5*(1+RC[-1]/200) -> 10080 | D48: =RC[-1]*20 -> 201600 | F48: =10000*3 -> 30000 | G48: =RC[-1]*5 -> 150000 | I48: =10000*0.1*1.25*(1+RC[-7]/100) -> 1750 | J48: =INT(RC[-1]*5) -> 8750 | K48: =RC[-2]*50 -> 87500 | M48: =2000*1.5 -> 3000 | N48: =RC[-1]*3 -> 9000 | P48: =4000*(1+RC[-14]/100) -> 5600 | Q48: =RC[-1]*10 -> 56000 | S48: 200000 | T48: =RC[-1]*2 -> 400000
B49: 41 | C49: =8000*2.1*0.5*(1+RC[-1]/200) -> 10122 | D49: =RC[-1]*20 -> 202440 | F49: =10000*3 -> 30000 | G49: =RC[-1]*5 -> 150000 | I49: =10000*0.1*1.25*(1+RC[-7]/100) -> 1762.5 | J49: =INT(RC[-1]*5) -> 8812 | K49: =RC[-2]*50 -> 88125 | M49: =2000*1.5 -> 3000 | N49: =RC[-1]*3 -> 9000 | P49: =4000*(1+RC[-14]/100) -> 5640 | Q49: =RC[-1]*10 -> 56400 | S49: 200000 | T49: =RC[-1]*2 -> 400000
B50: 42 | C50: =8000*2.1*0.5*(1+RC[-1]/200) -> 10164 | D50: =RC[-1]*20 -> 203280 | F50: =10000*3 -> 30000 | G50: =RC[-1]*5 -> 150000 | I50: =10000*0.1*1.25*(1+RC[-7]/100) -> 1775 | J50: =INT(RC[-1]*5) -> 8875 | K50: =RC[-2]*50 -> 88750 | M50: =2000*1.5 -> 3000 | N50: =RC[-1]*3 -> 9000 | P50: =4000*(1+RC[-14]/100) -> 5680 | Q50: =RC[-1]*10 -> 56800 | S50: 200000 | T50: =RC[-1]*2 -> 400000
B51: 43 | C51: =8000*2.1*0.5*(1+RC[-1]/200) -> 10206 | D51: =RC[-1]*20 -> 204120 | F51: =10000*3 -> 30000 | G51: =RC[-1]*5 -> 150000 | I51: =10000*0.1*1.25*(1+RC[-7]/100) -> 1787.5 | J51: =INT(RC[-1]*5) -> 8937 | K51: =RC[-2]*50 -> 89375 | M51: =2000*1.5 -> 3000 | N51: =RC[-1]*3 -> 9000 | P51: =4000*(1+RC[-14]/100) -> 5720 | Q51: =RC[-1]*10 -> 57200 | S51: 200000 | T51: =RC[-1]*2 -> 400000
B52: 44 | C52: =8000*2.1*0.5*(1+RC[-1]/200) -> 10248 | D52: =RC[-1]*20 -> 204960 | F52: =10000*3 -> 30000 | G52: =RC[-1]*5 -> 150000 | I52: =10000*0.1*1.25*(1+RC[-7]/100) -> 1800 | J52: =INT(RC[-1]*5) -> 9000 | K52: =RC[-2]*50 -> 90000 | M52: =2000*1.5 -> 3000 | N52: =RC[-1]*3 -> 9000 | P52: =4000*(1+RC[-14]/100) -> 5760 | Q52: =RC[-1]*10 -> 57600 | S52: 200000 | T52: =RC[-1]*2 -> 400000
B53: 45 | C53: =8000*2.1*0.5*(1+RC[-1]/200) -> 10290 | D53: =RC[-1]*20 -> 205800 | F53: =10000*3 -> 30000 | G53: =RC[-1]*5 -> 150000 | I53: =10000*0.1*1.25*(1+RC[-7]/100) -> 1812.5 | J53: =INT(RC[-1]*5) -> 9062 | K53: =RC[-2]*50 -> 90625 | M53: =2000*1.5 -> 3000 | N53: =RC[-1]*3 -> 9000 | P53: =4000*(1+RC[-14]/100) -> 5800 | Q53: =RC[-1]*10 -> 58000 | S53: 200000 | T53: =RC[-1]*2 -> 400000
B54: 46 | C54: =8000*2.1*0.5*(1+RC[-1]/200) -> 10332 | D54: =RC[-1]*20 -> 206640 | F54: =10000*3 -> 30000 | G54: =RC[-1]*5 -> 150000 | I54: =10000*0.1*1.25*(1+RC[-7]/100) -> 1825 | J54: =INT(RC[-1]*5) -> 9125 | K54: =RC[-2]*50 -> 91250 | M54: =2000*1.5 -> 3000 | N54: =RC[-1]*3 -> 9000 | P54: =4000*(1+RC[-14]/100) -> 5840 | Q54: =RC[-1]*10 -> 58400 | S54: 200000 | T54: =RC[-1]*2 -> 400000
B55: 47 | C55: =8000*2.1*0.5*(1+RC[-1]/200) -> 10374 | D55: =RC[-1]*20 -> 207480 | F55: =10000*3 -> 30000 | G55: =RC[-1]*5 -> 150000 | I55: =10000*0.1*1.25*(1+RC[-7]/100) -> 1837.5 | J55: =INT(RC[-1]*5) -> 9187 | K55: =RC[-2]*50 -> 91875 | M55: =2000*1.5 -> 3000 | N55: =RC[-1]*3 -> 9000 | P55: =4000*(1+RC[-14]/100) -> 5880 | Q55: =RC[-1]*10 -> 58800 | S55: 200000 | T55: =RC[-1]*2 -> 400000
B56: 48 | C56: =8000*2.1*0.5*(1+RC[-1]/200) -> 10416 | D56: =RC[-1]*20 -> 208320 | F56: =10000*3 -> 30000 | G56: =RC[-1]*5 -> 150000 | I56: =10000*0.1*1.25*(1+RC[-7]/100) -> 1850 | J56: =INT(RC[-1]*5) -> 9250 | K56: =RC[-2]*50 -> 92500 | M56: =2000*1.5 -> 3000 | N56: =RC[-1]*3 -> 9000 | P56: =4000*(1+RC[-14]/100) -> 5920 | Q56: =RC[-1]*10 -> 59200 | S56: 200000 | T56: =RC[-1]*2 -> 400000
B57: 49 | C57: =8000*2.1*0.5*(1+RC[-1]/200) -> 10458 | D57: =RC[-1]*20 -> 209160 | F57: =10000*3 -> 30000 | G57: =RC[-1]*5 -> 150000 | I57: =10000*0.1*1.25*(1+RC[-7]/100) -> 1862.5 | J57: =INT(RC[-1]*5) -> 9312 | K57: =RC[-2]*50 -> 93125 | M57: =2000*1.5 -> 3000 | N57: =RC[-1]*3 -> 9000 | P57: =4000*(1+RC[-14]/100) -> 5960 | Q57: =RC[-1]*10 -> 59600 | S57: 200000 | T57: =RC[-1]*2 -> 400000
B58: 50 | C58: =8000*2.1*0.5*(1+RC[-1]/200) -> 10500 | D58: =RC[-1]*20 -> 210000 | F58: =10000*3 -> 30000 | G58: =RC[-1]*5 -> 150000 | I58: =10000*0.1*1.25*(1+RC[-7]/100) -> 1875 | J58: =INT(RC[-1]*5) -> 9375 | K58: =RC[-2]*50 -> 93750 | M58: =2000*1.5 -> 3000 | N58: =RC[-1]*3 -> 9000 | P58: =4000*(1+RC[-14]/100) -> 6000 | Q58: =RC[-1]*10 -> 60000 | S58: 200000 | T58: =RC[-1]*2 -> 400000
B59: 51 | C59: =8000*2.1*0.5*(1+RC[-1]/200) -> 10542 | D59: =RC[-1]*20 -> 210840 | F59: =10000*3 -> 30000 | G59: =RC[-1]*5 -> 150000 | I59: =10000*0.1*1.25*(1+RC[-7]/100) -> 1887.5 | J59: =INT(RC[-1]*5) -> 9437 | K59: =RC[-2]*50 -> 94375 | M59: =2000*1.5 -> 3000 | N59: =RC[-1]*3 -> 9000 | P59: =4000*(1+RC[-14]/100) -> 6040 | Q59: =RC[-1]*10 -> 60400 | S59: 200000 | T59: =RC[-1]*2 -> 400000
B60: 52 | C60: =8000*2.1*0.5*(1+RC[-1]/200) -> 10584 | D60: =RC[-1]*20 -> 211680 | F60: =10000*3 -> 30000 | G60: =RC[-1]*5 -> 150000 | I60: =10000*0.1*1.25*(1+RC[-7]/100) -> 1900 | J60: =INT(RC[-1]*5) -> 9500 | K60: =RC[-2]*50 -> 95000 | M60: =2000*1.5 -> 3000 | N60: =RC[-1]*3 -> 9000 | P60: =4000*(1+RC[-14]/100) -> 6080 | Q60: =RC[-1]*10 -> 60800 | S60: 200000 | T60: =RC[-1]*2 -> 400000
B61: 53 | C61: =8000*2.1*0.5*(1+RC[-1]/200) -> 10626 | D61: =RC[-1]*20 -> 212520 | F61: =10000*3 -> 30000 | G61: =RC[-1]*5 -> 150000 | I61: =10000*0.1*1.25*(1+RC[-7]/100) -> 1912.5 | J61: =INT(RC[-1]*5) -> 9562 | K61: =RC[-2]*50 -> 95625 | M61: =2000*1.5 -> 3000 | N61: =RC[-1]*3 -> 9000 | P61: =4000*(1+RC[-14]/100) -> 6120 | Q61: =RC[-1]*10 -> 61200 | S61: 200000 | T61: =RC[-1]*2 -> 400000
B62: 54 | C62: =8000*2.1*0.5*(1+RC[-1]/200) -> 10668 | D62: =RC[-1]*20 -> 213360 | F62: =10000*3 -> 30000 | G62: =RC[-1]*5 -> 150000 | I62: =10000*0.1*1.25*(1+RC[-7]/100) -> 1925 | J62: =INT(RC[-1]*5) -> 9625 | K62: =RC[-2]*50 -> 96250 | M62: =2000*1.5 -> 3000 | N62: =RC[-1]*3 -> 9000 | P62: =4000*(1+RC[-14]/100) -> 6160 | Q62: =RC[-1]*10 -> 61600 | S62: 200000 | T62: =RC[-1]*2 -> 400000
B63: 55 | C63: =8000*2.1*0.5*(1+RC[-1]/200) -> 10710 | D63: =RC[-1]*20 -> 214200 | F63: =10000*3 -> 30000 | G63: =RC[-1]*5 -> 150000 | I63: =10000*0.1*1.25*(1+RC[-7]/100) -> 1937.5 | J63: =INT(RC[-1]*5) -> 9687 | K63: =RC[-2]*50 -> 96875 | M63: =2000*1.5 -> 3000 | N63: =RC[-1]*3 -> 9000 | P63: =4000*(1+RC[-14]/100) -> 6200 | Q63: =RC[-1]*10 -> 62000 | S63: 200000 | T63: =RC[-1]*2 -> 400000
B64: 56 | C64: =8000*2.1*0.5*(1+RC[-1]/200) -> 10752 | D64: =RC[-1]*20 -> 215040 | F64: =10000*3 -> 30000 | G64: =RC[-1]*5 -> 150000 | I64: =10000*0.1*1.25*(1+RC[-7]/100) -> 1950 | J64: =INT(RC[-1]*5) -> 9750 | K64: =RC[-2]*50 -> 97500 | M64: =2000*1.5 -> 3000 | N64: =RC[-1]*3 -> 9000 | P64: =4000*(1+RC[-14]/100) -> 6240 | Q64: =RC[-1]*10 -> 62400 | S64: 200000 | T64: =RC[-1]*2 -> 400000
B65: 57 | C65: =8000*2.1*0.5*(1+RC[-1]/200) -> 10794 | D65: =RC[-1]*20 -> 215880 | F65: =10000*3 -> 30000 | G65: =RC[-1]*5 -> 150000 | I65: =10000*0.1*1.25*(1+RC[-7]/100) -> 1962.5 | J65: =INT(RC[-1]*5) -> 9812 | K65: =RC[-2]*50 -> 98125 | M65: =2000*1.5 -> 3000 | N65: =RC[-1]*3 -> 9000 | P65: =4000*(1+RC[-14]/100) -> 6280 | Q65: =RC[-1]*10 -> 62800 | S65: 200000 | T65: =RC[-1]*2 -> 400000
B66: 58 | C66: =8000*2.1*0.5*(1+RC[-1]/200) -> 10836 | D66: =RC[-1]*20 -> 216720 | F66: =10000*3 -> 30000 | G66: =RC[-1]*5 -> 150000 | I66: =10000*0.1*1.25*(1+RC[-7]/100) -> 1975 | J66: =INT(RC[-1]*5) -> 9875 | K66: =RC[-2]*50 -> 98750 | M66: =2000*1.5 -> 3000 | N66: =RC[-1]*3 -> 9000 | P66: =4000*(1+RC[-14]/100) -> 6320 | Q66: =RC[-1]*10 -> 63200 | S66: 200000 | T66: =RC[-1]*2 -> 400000
B67: 59 | C67: =8000*2.1*0.5*(1+RC[-1]/200) -> 10878 | D67: =RC[-1]*20 -> 217560 | F67: =10000*3 -> 30000 | G67: =RC[-1]*5 -> 150000 | I67: =10000*0.1*1.25*(1+RC[-7]/100) -> 1987.5 | J67: =INT(RC[-1]*5) -> 9937 | K67: =RC[-2]*50 -> 99375 | M67: =2000*1.5 -> 3000 | N67: =RC[-1]*3 -> 9000 | P67: =4000*(1+RC[-14]/100) -> 6360 | Q67: =RC[-1]*10 -> 63600 | S67: 200000 | T67: =RC[-1]*2 -> 400000
B68: 60 | C68: =8000*2.1*0.5*(1+RC[-1]/200) -> 10920 | D68: =RC[-1]*20 -> 218400 | F68: =10000*3 -> 30000 | G68: =RC[-1]*5 -> 150000 | I68: =10000*0.1*1.25*(1+RC[-7]/100) -> 2000 | J68: =INT(RC[-1]*5) -> 10000 | K68: =RC[-2]*50 -> 100000 | M68: =2000*1.5 -> 3000 | N68: =RC[-1]*3 -> 9000 | P68: =4000*(1+RC[-14]/100) -> 6400 | Q68: =RC[-1]*10 -> 64000 | S68: 200000 | T68: =RC[-1]*2 -> 400000
B69: 61 | C69: =8000*2.1*0.5*(1+RC[-1]/200) -> 10962 | D69: =RC[-1]*20 -> 219240 | F69: =10000*3 -> 30000 | G69: =RC[-1]*5 -> 150000 | I69: =10000*0.1*1.25*(1+RC[-7]/100) -> 2012.5 | J69: =INT(RC[-1]*5) -> 10062 | K69: =RC[-2]*50 -> 100625 | M69: =2000*1.5 -> 3000 | N69: =RC[-1]*3 -> 9000 | P69: =4000*(1+RC[-14]/100) -> 6440 | Q69: =RC[-1]*10 -> 64400 | S69: 200000 | T69: =RC[-1]*2 -> 400000
B70: 62 | C70: =8000*2.1*0.5*(1+RC[-1]/200) -> 11004 | D70: =RC[-1]*20 -> 220080 | F70: =10000*3 -> 30000 | G70: =RC[-1]*5 -> 150000 | I70: =10000*0.1*1.25*(1+RC[-7]/100) -> 2025 | J70: =INT(RC[-1]*5) -> 10125 | K70: =RC[-2]*50 -> 101250 | M70: =2000*1.5 -> 3000 | N70: =RC[-1]*3 -> 9000 | P70: =4000*(1+RC[-14]/100) -> 6480 | Q70: =RC[-1]*10 -> 64800 | S70: 200000 | T70: =RC[-1]*2 -> 400000
B71: 63 | C71: =8000*2.1*0.5*(1+RC[-1]/200) -> 11046 | D71: =RC[-1]*20 -> 220920 | F71: =10000*3 -> 30000 | G71: =RC[-1]*5 -> 150000 | I71: =10000*0.1*1.25*(1+RC[-7]/100) -> 2037.5 | J71: =INT(RC[-1]*5) -> 10187 | K71: =RC[-2]*50 -> 101875 | M71: =2000*1.5 -> 3000 | N71: =RC[-1]*3 -> 9000 | P71: =4000*(1+RC[-14]/100) -> 6520 | Q71: =RC[-1]*10 -> 65200 | S71: 200000 | T71: =RC[-1]*2 -> 400000
B72: 64 | C72: =8000*2.1*0.5*(1+RC[-1]/200) -> 11088 | D72: =RC[-1]*20 -> 221760 | F72: =10000*3 -> 30000 | G72: =RC[-1]*5 -> 150000 | I72: =10000*0.1*1.25*(1+RC[-7]/100) -> 2050 | J72: =INT(RC[-1]*5) -> 10250 | K72: =RC[-2]*50 -> 102500 | M72: =2000*1.5 -> 3000 | N72: =RC[-1]*3 -> 9000 | P72: =4000*(1+RC[-14]/100) -> 6560 | Q72: =RC[-1]*10 -> 65600 | S72: 200000 | T72: =RC[-1]*2 -> 400000
B73: 65 | C73: =8000*2.1*0.5*(1+RC[-1]/200) -> 11130 | D73: =RC[-1]*20 -> 222600 | F73: =10000*3 -> 30000 | G73: =RC[-1]*5 -> 150000 | I73: =10000*0.1*1.25*(1+RC[-7]/100) -> 2062.5 | J73: =INT(RC[-1]*5) -> 10312 | K73: =RC[-2]*50 -> 103125 | M73: =2000*1.5 -> 3000 | N73: =RC[-1]*3 -> 9000 | P73: =4000*(1+RC[-14]/100) -> 6600 | Q73: =RC[-1]*10 -> 66000 | S73: 200000 | T73: =RC[-1]*2 -> 400000
B74: 66 | C74: =8000*2.1*0.5*(1+RC[-1]/200) -> 11172 | D74: =RC[-1]*20 -> 223440 | F74: =10000*3 -> 30000 | G74: =RC[-1]*5 -> 150000 | I74: =10000*0.1*1.25*(1+RC[-7]/100) -> 2075 | J74: =INT(RC[-1]*5) -> 10375 | K74: =RC[-2]*50 -> 103750 | M74: =2000*1.5 -> 3000 | N74: =RC[-1]*3 -> 9000 | P74: =4000*(1+RC[-14]/100) -> 6640 | Q74: =RC[-1]*10 -> 66400 | S74: 200000 | T74: =RC[-1]*2 -> 400000
B75: 67 | C75: =8000*2.1*0.5*(1+RC[-1]/200) -> 11214 | D75: =RC[-1]*20 -> 224280 | F75: =10000*3 -> 30000 | G75: =RC[-1]*5 -> 150000 | I75: =10000*0.1*1.25*(1+RC[-7]/100) -> 2087.5 | J75: =INT(RC[-1]*5) -> 10437 | K75: =RC[-2]*50 -> 104375 | M75: =2000*1.5 -> 3000 | N75: =RC[-1]*3 -> 9000 | P75: =4000*(1+RC[-14]/100) -> 6680 | Q75: =RC[-1]*10 -> 66800 | S75: 200000 | T75: =RC[-1]*2 -> 400000
B76: 68 | C76: =8000*2.1*0.5*(1+RC[-1]/200) -> 11256 | D76: =RC[-1]*20 -> 225120 | F76: =10000*3 -> 30000 | G76: =RC[-1]*5 -> 150000 | I76: =10000*0.1*1.25*(1+RC[-7]/100) -> 2100 | J76: =INT(RC[-1]*5) -> 10500 | K76: =RC[-2]*50 -> 105000 | M76: =2000*1.5 -> 3000 | N76: =RC[-1]*3 -> 9000 | P76: =4000*(1+RC[-14]/100) -> 6720 | Q76: =RC[-1]*10 -> 67200 | S76: 200000 | T76: =RC[-1]*2 -> 400000
B77: 69 | C77: =8000*2.1*0.5*(1+RC[-1]/200) -> 11298 | D77: =RC[-1]*20 -> 225960 | F77: =10000*3 -> 30000 | G77: =RC[-1]*5 -> 150000 | I77: =10000*0.1*1.25*(1+RC[-7]/100) -> 2112.5 | J77: =INT(RC[-1]*5) -> 10562 | K77: =RC[-2]*50 -> 105625 | M77: =2000*1.5 -> 3000 | N77: =RC[-1]*3 -> 9000 | P77: =4000*(1+RC[-14]/100) -> 6760 | Q77: =RC[-1]*10 -> 67600 | S77: 200000 | T77: =RC[-1]*2 -> 400000
B78: 70 | C78: =8000*2.1*0.5*(1+RC[-1]/200) -> 11340 | D78: =RC[-1]*20 -> 226800 | F78: =10000*3 -> 30000 | G78: =RC[-1]*5 -> 150000 | I78: =10000*0.1*1.25*(1+RC[-7]/100) -> 2125 | J78: =INT(RC[-1]*5) -> 10625 | K78: =RC[-2]*50 -> 106250 | M78: =2000*1.5 -> 3000 | N78: =RC[-1]*3 -> 9000 | P78: =4000*(1+RC[-14]/100) -> 6800 | Q78: =RC[-1]*10 -> 68000 | S78: 200000 | T78: =RC[-1]*2 -> 400000
B79: 71 | C79: =8000*2.1*0.5*(1+RC[-1]/200) -> 11382 | D79: =RC[-1]*20 -> 227640 | F79: =10000*3 -> 30000 | G79: =RC[-1]*5 -> 150000 | I79: =10000*0.1*1.25*(1+RC[-7]/100) -> 2137.5 | J79: =INT(RC[-1]*5) -> 10687 | K79: =RC[-2]*50 -> 106875 | M79: =2000*1.5 -> 3000 | N79: =RC[-1]*3 -> 9000 | P79: =4000*(1+RC[-14]/100) -> 6840 | Q79: =RC[-1]*10 -> 68400 | S79: 200000 | T79: =RC[-1]*2 -> 400000
B80: 72 | C80: =8000*2.1*0.5*(1+RC[-1]/200) -> 11424 | D80: =RC[-1]*20 -> 228480 | F80: =10000*3 -> 30000 | G80: =RC[-1]*5 -> 150000 | I80: =10000*0.1*1.25*(1+RC[-7]/100) -> 2150 | J80: =INT(RC[-1]*5) -> 10750 | K80: =RC[-2]*50 -> 107500 | M80: =2000*1.5 -> 3000 | N80: =RC[-1]*3 -> 9000 | P80: =4000*(1+RC[-14]/100) -> 6880 | Q80: =RC[-1]*10 -> 68800 | S80: 200000 | T80: =RC[-1]*2 -> 400000
B81: 73 | C81: =8000*2.1*0.5*(1+RC[-1]/200) -> 11466 | D81: =RC[-1]*20 -> 229320 | F81: =10000*3 -> 30000 | G81: =RC[-1]*5 -> 150000 | I81: =10000*0.1*1.25*(1+RC[-7]/100) -> 2162.5 | J81: =INT(RC[-1]*5) -> 10812 | K81: =RC[-2]*50 -> 108125 | M81: =2000*1.5 -> 3000 | N81: =RC[-1]*3 -> 9000 | P81: =4000*(1+RC[-14]/100) -> 6920 | Q81: =RC[-1]*10 -> 69200 | S81: 200000 | T81: =RC[-1]*2 -> 400000
B82: 74 | C82: =8000*2.1*0.5*(1+RC[-1]/200) -> 11508 | D82: =RC[-1]*20 -> 230160 | F82: =10000*3 -> 30000 | G82: =RC[-1]*5 -> 150000 | I82: =10000*0.1*1.25*(1+RC[-7]/100) -> 2175 | J82: =INT(RC[-1]*5) -> 10875 | K82: =RC[-2]*50 -> 108750 | M82: =2000*1.5 -> 3000 | N82: =RC[-1]*3 -> 9000 | P82: =4000*(1+RC[-14]/100) -> 6960 | Q82: =RC[-1]*10 -> 69600 | S82: 200000 | T82: =RC[-1]*2 -> 400000
B83: 75 | C83: =8000*2.1*0.5*(1+RC[-1]/200) -> 11550 | D83: =RC[-1]*20 -> 231000 | F83: =10000*3 -> 30000 | G83: =RC[-1]*5 -> 150000 | I83: =10000*0.1*1.25*(1+RC[-7]/100) -> 2187.5 | J83: =INT(RC[-1]*5) -> 10937 | K83: =RC[-2]*50 -> 109375 | M83: =2000*1.5 -> 3000 | N83: =RC[-1]*3 -> 9000 | P83: =4000*(1+RC[-14]/100) -> 7000 | Q83: =RC[-1]*10 -> 70000 | S83: 200000 | T83: =RC[-1]*2 -> 400000
B84: 76 | C84: =8000*2.1*0.5*(1+RC[-1]/200) -> 11592 | D84: =RC[-1]*20 -> 231840 | F84: =10000*3 -> 30000 | G84: =RC[-1]*5 -> 150000 | I84: =10000*0.1*1.25*(1+RC[-7]/100) -> 2200 | J84: =INT(RC[-1]*5) -> 11000 | K84: =RC[-2]*50 -> 110000 | M84: =2000*1.5 -> 3000 | N84: =RC[-1]*3 -> 9000 | P84: =4000*(1+RC[-14]/100) -> 7040 | Q84: =RC[-1]*10 -> 70400 | S84: 200000 | T84: =RC[-1]*2 -> 400000
B85: 77 | C85: =8000*2.1*0.5*(1+RC[-1]/200) -> 11634 | D85: =RC[-1]*20 -> 232680 | F85: =10000*3 -> 30000 | G85: =RC[-1]*5 -> 150000 | I85: =10000*0.1*1.25*(1+RC[-7]/100) -> 2212.5 | J85: =INT(RC[-1]*5) -> 11062 | K85: =RC[-2]*50 -> 110625 | M85: =2000*1.5 -> 3000 | N85: =RC[-1]*3 -> 9000 | P85: =4000*(1+RC[-14]/100) -> 7080 | Q85: =RC[-1]*10 -> 70800 | S85: 200000 | T85: =RC[-1]*2 -> 400000
B86: 78 | C86: =8000*2.1*0.5*(1+RC[-1]/200) -> 11676 | D86: =RC[-1]*20 -> 233520 | F86: =10000*3 -> 30000 | G86: =RC[-1]*5 -> 150000 | I86: =10000*0.1*1.25*(1+RC[-7]/100) -> 2225 | J86: =INT(RC[-1]*5) -> 11125 | K86: =RC[-2]*50 -> 111250 | M86: =2000*1.5 -> 3000 | N86: =RC[-1]*3 -> 9000 | P86: =4000*(1+RC[-14]/100) -> 7120 | Q86: =RC[-1]*10 -> 71200 | S86: 200000 | T86: =RC[-1]*2 -> 400000
B87: 79 | C87: =8000*2.1*0.5*(1+RC[-1]/200) -> 11718 | D87: =RC[-1]*20 -> 234360 | F87: =10000*3 -> 30000 | G87: =RC[-1]*5 -> 150000 | I87: =10000*0.1*1.25*(1+RC[-7]/100) -> 2237.5 | J87: =INT(RC[-1]*5) -> 11187 | K87: =RC[-2]*50 -> 111875 | M87: =2000*1.5 -> 3000 | N87: =RC[-1]*3 -> 9000 | P87: =4000*(1+RC[-14]/100) -> 7160 | Q87: =RC[-1]*10 -> 71600 | S87: 200000 | T87: =RC[-1]*2 -> 400000
B88: 80 | C88: =8000*2.1*0.5*(1+RC[-1]/200) -> 11760 | D88: =RC[-1]*20 -> 235200 | F88: =10000*3 -> 30000 | G88: =RC[-1]*5 -> 150000 | I88: =10000*0.1*1.25*(1+RC[-7]/100) -> 2250 | J88: =INT(RC[-1]*5) -> 11250 | K88: =RC[-2]*50 -> 112500 | M88: =2000*1.5 -> 3000 | N88: =RC[-1]*3 -> 9000 | P88: =4000*(1+RC[-14]/100) -> 7200 | Q88: =RC[-1]*10 -> 72000 | S88: 200000 | T88: =RC[-1]*2 -> 400000
B89: 81 | C89: =8000*2.1*0.5*(1+RC[-1]/200) -> 11802 | D89: =RC[-1]*20 -> 236040 | F89: =10000*3 -> 30000 | G89: =RC[-1]*5 -> 150000 | I89: =10000*0.1*1.25*(1+RC[-7]/100) -> 2262.5 | J89: =INT(RC[-1]*5) -> 11312 | K89: =RC[-2]*50 -> 113125 | M89: =2000*1.5 -> 3000 | N89: =RC[-1]*3 -> 9000 | P89: =4000*(1+RC[-14]/100) -> 7240 | Q89: =RC[-1]*10 -> 72400 | S89: 200000 | T89: =RC[-1]*2 -> 400000
B90: 82 | C90: =8000*2.1*0.5*(1+RC[-1]/200) -> 11844 | D90: =RC[-1]*20 -> 236880 | F90: =10000*3 -> 30000 | G90: =RC[-1]*5 -> 150000 | I90: =10000*0.1*1.25*(1+RC[-7]/100) -> 2275 | J90: =INT(RC[-1]*5) -> 11375 | K90: =RC[-2]*50 -> 113750 | M90: =2000*1.5 -> 3000 | N90: =RC[-1]*3 -> 9000 | P90: =4000*(1+RC[-14]/100) -> 7280 | Q90: =RC[-1]*10 -> 72800 | S90: 200000 | T90: =RC[-1]*2 -> 400000
B91: 83 | C91: =8000*2.1*0.5*(1+RC[-1]/200) -> 11886 | D91: =RC[-1]*20 -> 237720 | F91: =10000*3 -> 30000 | G91: =RC[-1]*5 -> 150000 | I91: =10000*0.1*1.25*(1+RC[-7]/100) -> 2287.5 | J91: =INT(RC[-1]*5) -> 11437 | K91: =RC[-2]*50 -> 114375 | M91: =2000*1.5 -> 3000 | N91: =RC[-1]*3 -> 9000 | P91: =4000*(1+RC[-14]/100) -> 7320 | Q91: =RC[-1]*10 -> 73200 | S91: 200000 | T91: =RC[-1]*2 -> 400000
B92: 84 | C92: =8000*2.1*0.5*(1+RC[-1]/200) -> 11928 | D92: =RC[-1]*20 -> 238560 | F92: =10000*3 -> 30000 | G92: =RC[-1]*5 -> 150000 | I92: =10000*0.1*1.25*(1+RC[-7]/100) -> 2300 | J92: =INT(RC[-1]*5) -> 11500 | K92: =RC[-2]*50 -> 115000 | M92: =2000*1.5 -> 3000 | N92: =RC[-1]*3 -> 9000 | P92: =4000*(1+RC[-14]/100) -> 7360 | Q92: =RC[-1]*10 -> 73600 | S92: 200000 | T92: =RC[-1]*2 -> 400000
B93: 85 | C93: =8000*2.1*0.5*(1+RC[-1]/200) -> 11970 | D93: =RC[-1]*20 -> 239400 | F93: =10000*3 -> 30000 | G93: =RC[-1]*5 -> 150000 | I93: =10000*0.1*1.25*(1+RC[-7]/100) -> 2312.5 | J93: =INT(RC[-1]*5) -> 11562 | K93: =RC[-2]*50 -> 115625 | M93: =2000*1.5 -> 3000 | N93: =RC[-1]*3 -> 9000 | P93: =4000*(1+RC[-14]/100) -> 7400 | Q93: =RC[-1]*10 -> 74000 | S93: 200000 | T93: =RC[-1]*2 -> 400000
B94: 86 | C94: =8000*2.1*0.5*(1+RC[-1]/200) -> 12012 | D94: =RC[-1]*20 -> 240240 | F94: =10000*3 -> 30000 | G94: =RC[-1]*5 -> 150000 | I94: =10000*0.1*1.25*(1+RC[-7]/100) -> 2325 | J94: =INT(RC[-1]*5) -> 11625 | K94: =RC[-2]*50 -> 116250 | M94: =2000*1.5 -> 3000 | N94: =RC[-1]*3 -> 9000 | P94: =4000*(1+RC[-14]/100) -> 7440 | Q94: =RC[-1]*10 -> 74400 | S94: 200000 | T94: =RC[-1]*2 -> 400000
B95: 87 | C95: =8000*2.1*0.5*(1+RC[-1]/200) -> 12054 | D95: =RC[-1]*20 -> 241080 | F95: =10000*3 -> 30000 | G95: =RC[-1]*5 -> 150000 | I95: =10000*0.1*1.25*(1+RC[-7]/100) -> 2337.5 | J95: =INT(RC[-1]*5) -> 11687 | K95: =RC[-2]*50 -> 116875 | M95: =2000*1.5 -> 3000 | N95: =RC[-1]*3 -> 9000 | P95: =4000*(1+RC[-14]/100) -> 7480 | Q95: =RC[-1]*10 -> 74800 | S95: 200000 | T95: =RC[-1]*2 -> 400000
B96: 88 | C96: =8000*2.1*0.5*(1+RC[-1]/200) -> 12096 | D96: =RC[-1]*20 -> 241920 | F96: =10000*3 -> 30000 | G96: =RC[-1]*5 -> 150000 | I96: =10000*0.1*1.25*(1+RC[-7]/100) -> 2350 | J96: =INT(RC[-1]*5) -> 11750 | K96: =RC[-2]*50 -> 117500 | M96: =2000*1.5 -> 3000 | N96: =RC[-1]*3 -> 9000 | P96: =4000*(1+RC[-14]/100) -> 7520 | Q96: =RC[-1]*10 -> 75200 | S96: 200000 | T96: =RC[-1]*2 -> 400000
B97: 89 | C97: =8000*2.1*0.5*(1+RC[-1]/200) -> 12138 | D97: =RC[-1]*20 -> 242760 | F97: =10000*3 -> 30000 | G97: =RC[-1]*5 -> 150000 | I97: =10000*0.1*1.25*(1+RC[-7]/100) -> 2362.5 | J97: =INT(RC[-1]*5) -> 11812 | K97: =RC[-2]*50 -> 118125 | M97: =2000*1.5 -> 3000 | N97: =RC[-1]*3 -> 9000 | P97: =4000*(1+RC[-14]/100) -> 7560 | Q97: =RC[-1]*10 -> 75600 | S97: 200000 | T97: =RC[-1]*2 -> 400000
B98: 90 | C98: =8000*2.1*0.5*(1+RC[-1]/200) -> 12180 | D98: =RC[-1]*20 -> 243600 | F98: =10000*3 -> 30000 | G98: =RC[-1]*5 -> 150000 | I98: =10000*0.1*1.25*(1+RC[-7]/100) -> 2375 | J98: =INT(RC[-1]*5) -> 11875 | K98: =RC[-2]*50 -> 118750 | M98: =2000*1.5 -> 3000 | N98: =RC[-1]*3 -> 9000 | P98: =4000*(1+RC[-14]/100) -> 7600 | Q98: =RC[-1]*10 -> 76000 | S98: 200000 | T98: =RC[-1]*2 -> 400000
B99: 91 | C99: =8000*2.1*0.5*(1+RC[-1]/200) -> 12222 | D99: =RC[-1]*20 -> 244440 | F99: =10000*3 -> 30000 | G99: =RC[-1]*5 -> 150000 | I99: =10000*0.1*1.25*(1+RC[-7]/100) -> 2387.5 | J99: =INT(RC[-1]*5) -> 11937 | K99: =RC[-2]*50 -> 119375 | M99: =2000*1.5 -> 3000 | N99: =RC[-1]*3 -> 9000 | P99: =4000*(1+RC[-14]/100) -> 7640 | Q99: =RC[-1]*10 -> 76400 | S99: 200000 | T99: =RC[-1]*2 -> 400000
B100: 92 | C100: =8000*2.1*0.5*(1+RC[-1]/200) -> 12264 | D100: =RC[-1]*20 -> 245280 | F100: =10000*3 -> 30000 | G100: =RC[-1]*5 -> 150000 | I100: =10000*0.1*1.25*(1+RC[-7]/100) -> 2400 | J100: =INT(RC[-1]*5) -> 12000 | K100: =RC[-2]*50 -> 120000 | M100: =2000*1.5 -> 3000 | N100: =RC[-1]*3 -> 9000 | P100: =4000*(1+RC[-14]/100) -> 7680 | Q100: =RC[-1]*10 -> 76800 | S100: 200000 | T100: =RC[-1]*2 -> 400000
B101: 93 | C101: =8000*2.1*0.5*(1+RC[-1]/200) -> 12306 | D101: =RC[-1]*20 -> 246120 | F101: =10000*3 -> 30000 | G101: =RC[-1]*5 -> 150000 | I101: =10000*0.1*1.25*(1+RC[-7]/100) -> 2412.5 | J101: =INT(RC[-1]*5) -> 12062 | K101: =RC[-2]*50 -> 120625 | M101: =2000*1.5 -> 3000 | N101: =RC[-1]*3 -> 9000 | P101: =4000*(1+RC[-14]/100) -> 7720 | Q101: =RC[-1]*10 -> 77200 | S101: 200000 | T101: =RC[-1]*2 -> 400000
B102: 94 | C102: =8000*2.1*0.5*(1+RC[-1]/200) -> 12348 | D102: =RC[-1]*20 -> 246960 | F102: =10000*3 -> 30000 | G102: =RC[-1]*5 -> 150000 | I102: =10000*0.1*1.25*(1+RC[-7]/100) -> 2425 | J102: =INT(RC[-1]*5) -> 12125 | K102: =RC[-2]*50 -> 121250 | M102: =2000*1.5 -> 3000 | N102: =RC[-1]*3 -> 9000 | P102: =4000*(1+RC[-14]/100) -> 7760 | Q102: =RC[-1]*10 -> 77600 | S102: 200000 | T102: =RC[-1]*2 -> 400000
B103: 95 | C103: =8000*2.1*0.5*(1+RC[-1]/200) -> 12390 | D103: =RC[-1]*20 -> 247800 | F103: =10000*3 -> 30000 | G103: =RC[-1]*5 -> 150000 | I103: =10000*0.1*1.25*(1+RC[-7]/100) -> 2437.5 | J103: =INT(RC[-1]*5) -> 12187 | K103: =RC[-2]*50 -> 121875 | M103: =2000*1.5 -> 3000 | N103: =RC[-1]*3 -> 9000 | P103: =4000*(1+RC[-14]/100) -> 7800 | Q103: =RC[-1]*10 -> 78000 | S103: 200000 | T103: =RC[-1]*2 -> 400000
B104: 96 | C104: =8000*2.1*0.5*(1+RC[-1]/200) -> 12432 | D104: =RC[-1]*20 -> 248640 | F104: =10000*3 -> 30000 | G104: =RC[-1]*5 -> 150000 | I104: =10000*0.1*1.25*(1+RC[-7]/100) -> 2450 | J104: =INT(RC[-1]*5) -> 12250 | K104: =RC[-2]*50 -> 122500 | M104: =2000*1.5 -> 3000 | N104: =RC[-1]*3 -> 9000 | P104: =4000*(1+RC[-14]/100) -> 7840 | Q104: =RC[-1]*10 -> 78400 | S104: 200000 | T104: =RC[-1]*2 -> 400000
B105: 97 | C105: =8000*2.1*0.5*(1+RC[-1]/200) -> 12474 | D105: =RC[-1]*20 -> 249480 | F105: =10000*3 -> 30000 | G105: =RC[-1]*5 -> 150000 | I105: =10000*0.1*1.25*(1+RC[-7]/100) -> 2462.5 | J105: =INT(RC[-1]*5) -> 12312 | K105: =RC[-2]*50 -> 123125 | M105: =2000*1.5 -> 3000 | N105: =RC[-1]*3 -> 9000 | P105: =4000*(1+RC[-14]/100) -> 7880 | Q105: =RC[-1]*10 -> 78800 | S105: 200000 | T105: =RC[-1]*2 -> 400000
B106: 98 | C106: =8000*2.1*0.5*(1+RC[-1]/200) -> 12516 | D106: =RC[-1]*20 -> 250320 | F106: =10000*3 -> 30000 | G106: =RC[-1]*5 -> 150000 | I106: =10000*0.1*1.25*(1+RC[-7]/100) -> 2475 | J106: =INT(RC[-1]*5) -> 12375 | K106: =RC[-2]*50 -> 123750 | M106: =2000*1.5 -> 3000 | N106: =RC[-1]*3 -> 9000 | P106: =4000*(1+RC[-14]/100) -> 7920 | Q106: =RC[-1]*10 -> 79200 | S106: 200000 | T106: =RC[-1]*2 -> 400000
B107: 99 | C107: =8000*2.1*0.5*(1+RC[-1]/200) -> 12558 | D107: =RC[-1]*20 -> 251160 | F107: =10000*3 -> 30000 | G107: =RC[-1]*5 -> 150000 | I107: =10000*0.1*1.25*(1+RC[-7]/100) -> 2487.5 | J107: =INT(RC[-1]*5) -> 12437 | K107: =RC[-2]*50 -> 124375 | M107: =2000*1.5 -> 3000 | N107: =RC[-1]*3 -> 9000 | P107: =4000*(1+RC[-14]/100) -> 7960 | Q107: =RC[-1]*10 -> 79600 | S107: 200000 | T107: =RC[-1]*2 -> 400000
B108: 100 | C108: =8000*2.1*0.5*(1+RC[-1]/200) -> 12600 | D108: =RC[-1]*20 -> 252000 | F108: =10000*3 -> 30000 | G108: =RC[-1]*5 -> 150000 | I108: =10000*0.1*1.25*(1+RC[-7]/100) -> 2500 | J108: =INT(RC[-1]*5) -> 12500 | K108: =RC[-2]*50 -> 125000 | M108: =2000*1.5 -> 3000 | N108: =RC[-1]*3 -> 9000 | P108: =4000*(1+RC[-14]/100) -> 8000 | Q108: =RC[-1]*10 -> 80000 | S108: 200000 | T108: =RC[-1]*2 -> 400000