Sheet: ctFaBaoCostConf
A1: 法宝等级
A2: nLevel | B2: nFeastStoneID | C2: nFaBaoFeastStone | D2: nFaBaoYinBi | E2: nSumFaBaoFeastStone | F2: nSumFaBaoYinBi | G2: nRolelevel
A3: i | B3: i | C3: i | D3: i | E3: i | F3: i | G3: i
A4: 等级 | B4: 祭炼石ID | C4: 法宝祭炼石消耗 | D4: 法宝银币消耗 | E4: 累计消耗法宝祭炼石 | F4: 累计消耗银币 | G4: 角色等级要求
A5: 1 | B5: 10113 | C5: 5 | D5: 50000 | E5: =RC[-2] -> 5 | F5: =RC[-2] -> 50000 | G5: 20
A6: 2 | B6: 10113 | C6: =R[-1]C+5 -> 10 | D6: =R[-1]C*2 -> 100000 | E6: =RC[-2]+R[-1]C -> 15 | F6: =RC[-2]+R[-1]C -> 150000 | G6: 20
A7: 3 | B7: 10113 | C7: =R[-1]C+10 -> 20 | D7: =R[-1]C+100000 -> 200000 | E7: =RC[-2]+R[-1]C -> 35 | F7: =RC[-2]+R[-1]C -> 350000 | G7: 20
A8: 4 | B8: 10113 | C8: 40 | D8: =R[-1]C*2 -> 400000 | E8: =RC[-2]+R[-1]C -> 75 | F8: =RC[-2]+R[-1]C -> 750000 | G8: 20
A9: 5 | B9: 10113 | C9: 80 | D9: =R[-1]C*2 -> 800000 | E9: =RC[-2]+R[-1]C -> 155 | F9: =RC[-2]+R[-1]C -> 1550000 | G9: =R[-1]C+5 -> 25
A10: 6 | B10: 10113 | C10: 120 | D10: =R[-1]C+400000 -> 1200000 | E10: =RC[-2]+R[-1]C -> 275 | F10: =RC[-2]+R[-1]C -> 2750000 | G10: =R[-1]C+5 -> 30
A11: 7 | B11: 10113 | C11: 160 | D11: =R[-1]C+400000 -> 1600000 | E11: =RC[-2]+R[-1]C -> 435 | F11: =RC[-2]+R[-1]C -> 4350000 | G11: =R[-1]C+5 -> 35
A12: 8 | B12: 10113 | C12: 200 | D12: =R[-1]C+400000 -> 2000000 | E12: =RC[-2]+R[-1]C -> 635 | F12: =RC[-2]+R[-1]C -> 6350000 | G12: =R[-1]C+5 -> 40
A13: 9 | B13: 10113 | C13: 250 | D13: =R[-1]C+1000000 -> 3000000 | E13: =RC[-2]+R[-1]C -> 885 | F13: =RC[-2]+R[-1]C -> 9350000 | G13: =R[-1]C+5 -> 45
A14: 10 | B14: 10113 | C14: 300 | D14: =R[-1]C+1000000 -> 4000000 | E14: =RC[-2]+R[-1]C -> 1185 | F14: =RC[-2]+R[-1]C -> 13350000 | G14: =R[-1]C+5 -> 50
A15: 11 | B15: 10113 | C15: 350 | D15: =R[-1]C+1000000 -> 5000000 | E15: =RC[-2]+R[-1]C -> 1535 | F15: =RC[-2]+R[-1]C -> 18350000 | G15: =R[-1]C+5 -> 55
A16: 12 | B16: 10113 | C16: 400 | D16: =R[-1]C+1000000 -> 6000000 | E16: =RC[-2]+R[-1]C -> 1935 | F16: =RC[-2]+R[-1]C -> 24350000 | G16: =R[-1]C+5 -> 60
A17: 13 | B17: 10113 | C17: 450 | D17: =R[-1]C+1000000 -> 7000000 | E17: =RC[-2]+R[-1]C -> 2385 | F17: =RC[-2]+R[-1]C -> 31350000 | G17: =R[-1]C+5 -> 65
A18: 14 | B18: 10113 | C18: 500 | D18: =R[-1]C+1000000 -> 8000000 | E18: =RC[-2]+R[-1]C -> 2885 | F18: =RC[-2]+R[-1]C -> 39350000 | G18: =R[-1]C+5 -> 70
A19: 15 | B19: 10113 | C19: 600 | D19: =R[-1]C+1000000 -> 9000000 | E19: =RC[-2]+R[-1]C -> 3485 | F19: =RC[-2]+R[-1]C -> 48350000 | G19: =R[-1]C+5 -> 75
A20: 16 | B20: 10113 | C20: 700 | D20: =R[-1]C+1000000 -> 10000000 | E20: =RC[-2]+R[-1]C -> 4185 | F20: =RC[-2]+R[-1]C -> 58350000 | G20: =R[-1]C+5 -> 80
A21: 17 | B21: 10113 | C21: 800 | D21: =R[-1]C+1000000 -> 11000000 | E21: =RC[-2]+R[-1]C -> 4985 | F21: =RC[-2]+R[-1]C -> 69350000 | G21: =R[-1]C+5 -> 85
A22: 18 | B22: 10113 | C22: 900 | D22: =R[-1]C+1000000 -> 12000000 | E22: =RC[-2]+R[-1]C -> 5885 | F22: =RC[-2]+R[-1]C -> 81350000 | G22: =R[-1]C+5 -> 90
A23: 19 | B23: 10113 | C23: 1000 | D23: =R[-1]C+1000000 -> 13000000 | E23: =RC[-2]+R[-1]C -> 6885 | F23: =RC[-2]+R[-1]C -> 94350000 | G23: =R[-1]C+5 -> 95