Sheet: ctFaBaoConf
A1: 技能ID(法宝ID) | C1: 1:金 2:木 3:水 4:火 5:土 6:风 | L1: 101:气血 102:魔法 103:怒气 104:攻击 105:防御 106:灵力 107:速度 108:伤害(百分比100倍,战斗中用) 201:法术攻击(值) 202:法术防御(值) 203:治疗强度(值) 204:封印命中(百分比100倍) 205:封印抗性(百分比100倍) 206:法术命中 207:法术闪避 208:法术伤害(百分比100倍,战斗中用) 301:命中率 302:闪避率 303:暴击率 304:抗暴率 | M1: 6,3,105,300; 6--法宝星级 3--法宝星级数量 105--属性标识 300--对应属性值 | N1: 1,75,10 1--法宝星级 75--合成概率 10--消耗的银币(单位为万) | O1: 法宝重置 100--成功率 100--消耗的银币(单位为万)
A2: nID | B2: sName | C2: nFaBaoAttr | D2: nWeights | E2: nFaBaopPartType | F2: nCostRage | G2: nSuitIndex | H2: nFaBaoGrade | I2: nLevel | J2: skillName | K2: nScore | L2: eFaBaoAttrFornula | M2: tFaBaoSetAttr | N2: tFaBaoComposeProbability | O2: tFaBaoReset | P2: sSkillDec | Q2: sFaBaoDec
A3: i | B3: s | C3: i | D3: i | E3: i | F3: i | G3: i | H3: i | I3: i | J3: s | K3: i | L3: t{ie} | M3: t{iiii} | N3: t{iii} | O3: t{ii} | P3: s | Q3: s
A4: 编号 | B4: 名称 | C4: 法宝属性 | D4: 合成权重 | E4: 穿戴位置 | F4: 消耗怒气 | G4: 套装索引 | H4: 法宝品级 | I4: 法宝等级 | J4: 特技名 | K4: 特技评分 | L4: 属性计算公式 | M4: 法宝套装属性加成 | N4: 法宝合成概率及消耗的银币 | O4: 100,100 | P4: 描述 | Q4: 法宝描述
A5: 32001 | B5: 1★勾魄灯 | C5: 3 | D5: 100 | E5: 3 | F5: 30 | G5: 0 | H5: 1 | I5: 1 | J5: 如沐春露 | K5: 50 | L5: 105,(ilv*1.5+10)*1.5; | M5: 6,3,101,0; | N5: 1,85,10;2,80,30;3,75,60;4,70,80;5,65,100 | O5: 100,100 | P5: 为自己或队友恢复气血。 | Q5: 四大神僧每天都敲的木鱼，受佛法熏陶，已具灵性
A6: 32002 | B6: 1★番天印 | C6: 4 | D6: 100 | E6: 4 | F6: 40 | G6: 0 | H6: 1 | I6: 1 | J6: 战吼 | K6: 50 | L6: 106,(ilv*1.1+5)*1.5; | M6: 6,3,101,0; | N6: 1,85,10;2,80,30;3,75,60;4,70,80;5,65,100 | O6: 100,100 | P6: 提高自己或队友12%攻击力，效果不叠加，持续至战斗结束。 | Q6: 乃天狗所持法宝，状似大狗牙，美其名曰“獠牙”
A7: 32003 | B7: 1★指天剑 | C7: 5 | D7: 100 | E7: 5 | F7: 40 | G7: 0 | H7: 1 | I7: 1 | J7: 虎贲 | K7: 50 | L7: 105,(ilv*0.5+5)*1.5;101,(ilv*3+10)*1.5; | M7: 6,3,101,0; | N7: 1,85,10;2,80,30;3,75,60;4,70,80;5,65,100 | O7: 100,100 | P7: 提高自己或队友12%防御，效果不叠加，持续至战斗结束。 | Q7: 挥动时会缠有金色的火焰，刚猛如十虎下山，因而得名
A8: 32101 | B8: 2★鬼印珠 | C8: 2 | D8: 100 | E8: 2 | F8: 40 | G8: 0 | H8: 2 | I8: 1 | J8: 九转归一 | K8: 100 | L8: 105,(ilv*0.5+5)*1.5;102,ilv*5*1.5; | M8: 6,3,101,0; | N8: 1,85,10;2,80,30;3,75,60;4,70,80;5,65,100 | O8: 100,100 | P8: 为自己或队友解除各种异常状态。 | Q8: 取南方赤水之畔千年三珠树的精华雕刻而成的法宝
A9: 32102 | B9: 2★炼妖壶 | C9: 1 | D9: 100 | E9: 1 | F9: 40 | G9: 0 | H9: 2 | I9: 1 | J9: 血煞之力 | K9: 100 | L9: 104,(ilv*3.8+15)*1.5; | M9: 6,3,101,0; | N9: 1,85,10;2,80,30;3,75,60;4,70,80;5,65,100 | O9: 100,100 | P9: 降低敌方单人12%攻击力，效果不叠加，续至战斗结束。 | Q9: 万鬼门老大用自己右眼修炼的法宝，施法时，充满血色，会放出凶煞血腥之气
A10: 32103 | B10: 2★鸣鸿刀 | C10: 5 | D10: 100 | E10: 5 | F10: 40 | G10: 0 | H10: 2 | I10: 1 | J10: 杀身成仁 | K10: 100 | L10: 105,(ilv*0.5+5)*1.5;101,(ilv*3+10)*1.5; | M10: 6,3,101,0; | N10: 1,85,10;2,80,30;3,75,60;4,70,80;5,65,100 | O10: 100,100 | P10: 降低敌方单人12%防御，效果不叠加，持续至战斗结束。 | Q10: 乃鬼巫手下得力猛将杀生和尚的武器，杀生无数，故而煞气极重
A11: 32201 | B11: 3★照妖镜 | C11: 3 | D11: 100 | E11: 3 | F11: 30 | G11: 0 | H11: 3 | I11: 1 | J11: 佛光普度 | K11: 150 | L11: 105,(ilv*1.5+10)*1.5; | M11: 6,3,101,0; | N11: 1,85,10;2,80,30;3,75,60;4,70,80;5,65,100 | O11: 100,100 | P11: 为自己或队友恢复气血。 | Q11: 乃四大神僧普方所持有的法宝，威力刚猛，除魔无数
A12: 32202 | B12: 3★神禹令 | C12: 6 | D12: 100 | E12: 6 | F12: 40 | G12: 0 | H12: 3 | I12: 1 | J12: 乘风破浪 | K12: 150 | L12: 105,(ilv*0.5+5)*1.5;107,(ilv*0.4+4)*1.5; | M12: 6,3,101,0; | N12: 1,85,10;2,80,30;3,75,60;4,70,80;5,65,100 | O12: 100,100 | P12: 提高自己或队友12%速度，效果不叠加，持续至战斗结束。 | Q12: 看似一条普通的三尺来长的红色腰带，五行属土，妙用无方，威力巨大
A13: 32203 | B13: 3★乌金锤 | C13: 2 | D13: 100 | E13: 2 | F13: 40 | G13: 0 | H13: 3 | I13: 1 | J13: 冰冻三尺 | K13: 150 | L13: 105,(ilv*0.5+5)*1.5;102,ilv*5*1.5; | M13: 6,3,101,0; | N13: 1,85,10;2,80,30;3,75,60;4,70,80;5,65,100 | O13: 100,100 | P13: 降低敌方单人12%速度，效果不叠加，持续至战斗结束。 | Q13: 仙家修炼，法宝材质极好，乃用万年玄晶所炼成，威力巨大，可凝冰墙
A14: 32301 | B14: 4★落魂灯 | C14: 3 | D14: 100 | E14: 3 | F14: 60 | G14: 0 | H14: 4 | I14: 1 | J14: 大慈大悲 | K14: 200 | L14: 105,(ilv*1.5+10)*1.5; | M14: 6,3,101,0; | N14: 1,85,10;2,80,30;3,75,60;4,70,80;5,65,100 | O14: 100,100 | P14: 为自己恢复气血。 | Q14: 佛珠圆润，坠于掌间，随心中佛念和口中福语转动，诸般烦恼，仿佛早已消散于无边无际
A15: 32302 | B15: 4★列瘟印 | C15: 5 | D15: 100 | E15: 5 | F15: 120 | G15: 0 | H15: 4 | I15: 1 | J15: 还魂术 | K15: 200 | L15: 105,(ilv*0.5+5)*1.5;101,(ilv*3+10)*1.5; | M15: 6,3,101,0; | N15: 1,85,10;2,80,30;3,75,60;4,70,80;5,65,100 | O15: 100,100 | P15: 复活已死亡的队友，恢复其50%气血 | Q15: 和尚的法宝，肃穆之中带着耀眼的佛家光辉，乃佛门至宝
A16: 32303 | B16: 4★九疑鼎 | C16: 2 | D16: 100 | E16: 2 | F16: 80 | G16: 0 | H16: 4 | I16: 1 | J16: 三元归一 | K16: 200 | L16: 105,(ilv*0.5+5)*1.5;102,ilv*5*1.5; | M16: 6,3,101,0; | N16: 1,85,10;2,80,30;3,75,60;4,70,80;5,65,100 | O16: 100,100 | P16: 为自己或队友解除各种异常状态，并恢复气血。 | Q16: 形状古拙，青铜镂边，上刻龙，下刻虎，镜上刻着八卦方位。
A17: 32304 | B17: 4★摄魂琴 | C17: 4 | D17: 100 | E17: 4 | F17: 60 | G17: 0 | H17: 4 | I17: 1 | J17: 离人愁 | K17: 200 | L17: 106,(ilv*1.1+5)*1.5; | M17: 6,3,101,0; | N17: 1,85,10;2,80,30;3,75,60;4,70,80;5,65,100 | O17: 100,100 | P17: 减少敌方单人一定气血，最小伤害为100。 | Q17: 看似钝器，锐利无比，拥有比刺杀更强大的力量
A18: 32305 | B18: 4★四海瓶 | C18: 1 | D18: 100 | E18: 1 | F18: 60 | G18: 0 | H18: 4 | I18: 1 | J18: 金刚伏魔 | K18: 200 | L18: 104,(ilv*3.8+15)*1.5; | M18: 6,3,101,0; | N18: 1,85,10;2,80,30;3,75,60;4,70,80;5,65,100 | O18: 100,100 | P18: 物理攻击敌人，并同时减少其魔法值。 | Q18: 又称金刚杆，包金雕花，分量沉重，握在手里便能感觉到刚正的佛威
A19: 32306 | B19: 4★金钟罩 | C19: 6 | D19: 100 | E19: 6 | F19: 60 | G19: 0 | H19: 4 | I19: 1 | J19: 火眼金睛 | K19: 200 | L19: 105,(ilv*0.5+5)*1.5;107,(ilv*0.4+4)*1.5; | M19: 6,3,101,0; | N19: 1,85,10;2,80,30;3,75,60;4,70,80;5,65,100 | O19: 100,100 | P19: 使己方单体目标获得反隐能力，持续4回合。 | Q19: 乃焚香谷宝物，绝非凡品
A20: 32401 | B20: 5★锁心锤 | C20: 2 | D20: 100 | E20: 2 | F20: 30 | G20: 0 | H20: 5 | I20: 1 | J20: 以毒养身 | K20: 250 | L20: 105,(ilv*0.5+5)*1.5;102,ilv*5*1.5; | M20: 6,3,101,0; | N20: 1,85,10;2,80,30;3,75,60;4,70,80;5,65,100 | O20: 100,100 | P20: 为自己或队友恢复气血。 | Q20: 乃毒神法宝，袋内养有异虫毒蝎子
A21: 32402 | B21: 5★昏迷剑 | C21: 4 | D21: 100 | E21: 4 | F21: 60 | G21: 0 | H21: 5 | I21: 1 | J21: 临阵曲 | K21: 250 | L21: 106,(ilv*1.1+5)*1.5; | M21: 6,3,101,0; | N21: 1,85,10;2,80,30;3,75,60;4,70,80;5,65,100 | O21: 100,100 | P21: 对己方宠物使用，使其四回合内对敌方的伤害结果提高15%，且不会逃跑。 | Q21: 纯黑色的铁笛，乃巫教的法宝，拥有操控毒物妖怪的奇能
A22: 32403 | B22: 5★颜如玉 | C22: 5 | D22: 100 | E22: 5 | F22: 80 | G22: 0 | H22: 5 | I22: 1 | J22: 抱元守缺 | K22: 250 | L22: 105,(ilv*0.5+5)*1.5;101,(ilv*3+10)*1.5; | M22: 6,3,101,0; | N22: 1,85,10;2,80,30;3,75,60;4,70,80;5,65,100 | O22: 100,100 | P22: 为自己恢复魔法值。 | Q22: 乃灵音寺主持的法宝，来历不详，但威力不俗
A23: 32404 | B23: 5★降魔杖 | C23: 3 | D23: 50 | E23: 3 | F23: 140 | G23: 0 | H23: 5 | I23: 1 | J23: 血气缠绕 | K23: 250 | L23: 105,(ilv*1.5+10)*1.5; | M23: 6,3,101,0; | N23: 1,85,10;2,80,30;3,75,60;4,70,80;5,65,100 | O23: 100,100 | P23: 为己方所有队员恢复气血，对有“鬼魂术”的宠物无效。 | Q23: 用至阴之人颅骨碎片炼化而成，其中不知还加了多少生人魂魄
A24: 32405 | B24: 5★混元伞 | C24: 6 | D24: 50 | E24: 6 | F24: 110 | G24: 0 | H24: 5 | I24: 1 | J24: 朱雀清鸣 | K24: 250 | L24: 105,(ilv*0.5+5)*1.5;107,(ilv*0.4+4)*1.5; | M24: 6,3,101,0; | N24: 1,85,10;2,80,30;3,75,60;4,70,80;5,65,100 | O24: 100,100 | P24: 解除己方全员的异常状态。 | Q24: 乃朱雀使用的法宝，内含奇门印法，诡异至极，威力不俗
A25: 32406 | B25: 5★太极图 | C25: 1 | D25: 100 | E25: 1 | F25: 60 | G25: 0 | H25: 5 | I25: 1 | J25: 幽厉血芒 | K25: 250 | L25: 104,(ilv*3.8+15)*1.5; | M25: 6,3,101,0; | N25: 1,85,10;2,80,30;3,75,60;4,70,80;5,65,100 | O25: 100,100 | P25: 对敌方宠物使用，使其四回合内对敌方的伤害结果降低15%，且每回合有15%几率逃跑。 | Q25: 巫族取死人怨气炼制的法宝，能摄人魂魄，使听其号令，再度复活死人
A26: 32501 | B26: 6★乾坤弩 | C26: 3 | D26: 100 | E26: 3 | F26: 130 | G26: 1 | H26: 6 | I26: 1 | J26: 青光现 | K26: 300 | L26: 105,(ilv*1.5+10)*1.5; | M26: 6,2,104,118;6,2,105,97;6,2,101,93;6,2,106,34;6,2,107,13;6,2,102,150;6,3,104,177;6,3,105,146;6,3,101,139;6,3,106,51;6,3,107,19;6,3,102,225; | N26: 1,85,10;2,80,30;3,75,60;4,70,80;5,65,100 | O26: 100,100 | P26: 为自己恢复气血。 | Q26: 乃青龙使用的法宝，乃九天神兵之一，威力不俗
A27: 32502 | B27: 6★修罗刀 | C27: 3 | D27: 50 | E27: 3 | F27: 150 | G27: 2 | H27: 6 | I27: 1 | J27: 佛光普照 | K27: 300 | L27: 105,(ilv*1.5+10)*1.5; | M27: 6,2,104,118;6,2,105,97;6,2,101,93;6,2,106,34;6,2,107,13;6,2,102,150;6,3,104,177;6,3,105,146;6,3,101,139;6,3,106,51;6,3,107,19;6,3,102,225; | N27: 1,85,10;2,80,30;3,75,60;4,70,80;5,65,100 | O27: 100,100 | P27: 复活己方所有单位（最多5个），使其气血和气血上限完全恢复；使用后自己的魔法值为零、气血和降为1；不能复活鬼魂。 | Q27: 圆盘金轮模样，通体金黄，一尺直径见方，边缘一圈镂刻着诸罗汉金身法相，围绕着中间处正是佛祖的真身法相
A28: 32503 | B28: 6★乾天火灵珠 | C28: 2 | D28: 50 | E28: 2 | F28: 150 | G28: 3 | H28: 6 | I28: 1 | J28: 阴阳调和 | K28: 300 | L28: 105,(ilv*0.5+5)*1.5;102,ilv*5*1.5; | M28: 6,2,104,118;6,2,105,97;6,2,101,93;6,2,106,34;6,2,107,13;6,2,102,150;6,3,104,177;6,3,105,146;6,3,101,139;6,3,106,51;6,3,107,19;6,3,102,225; | N28: 1,85,10;2,80,30;3,75,60;4,70,80;5,65,100 | O28: 100,100 | P28: 解除己方全员的异常状态，并恢复气血，对有“鬼魂术”的宠物无效。 | Q28: 有阴阳两面，阴面为黑，阳面为白，黑是死，白是生。乃道家灵宝
A29: 32504 | B29: 6★赤焰剑 | C29: 1 | D29: 50 | E29: 1 | F29: 70 | G29: 2 | H29: 6 | I29: 1 | J29: 赤阳之力 | K29: 300 | L29: 104,(ilv*3.8+15)*1.5; | M29: 6,2,104,118;6,2,105,97;6,2,101,93;6,2,106,34;6,2,107,13;6,2,102,150;6,3,104,177;6,3,105,146;6,3,101,139;6,3,106,51;6,3,107,19;6,3,102,225; | N29: 1,85,10;2,80,30;3,75,60;4,70,80;5,65,100 | O29: 100,100 | P29: 提高己方全员9%攻击力，效果不叠加，持续至战斗结束。 | Q29: 剑体通红的宝剑，威力绝伦
A30: 32505 | B30: 6★血焰叉 | C30: 5 | D30: 100 | E30: 5 | F30: 80 | G30: 2 | H30: 6 | I30: 1 | J30: 化实为虚 | K30: 300 | L30: 105,(ilv*0.5+5)*1.5;101,(ilv*3+10)*1.5; | M30: 6,2,104,118;6,2,105,97;6,2,101,93;6,2,106,34;6,2,107,13;6,2,102,150;6,3,104,177;6,3,105,146;6,3,101,139;6,3,106,51;6,3,107,19;6,3,102,225; | N30: 1,85,10;2,80,30;3,75,60;4,70,80;5,65,100 | O30: 100,100 | P30: 提高己方全员9%防御，效果不叠加，持续至战斗结束。 | Q30: 仙家的法宝，剑刃长两尺，剑柄材质似玉非玉，最奇特处乃是如冰一般
A31: 32506 | B31: 6★紫芒剑 | C31: 6 | D31: 50 | E31: 6 | F31: 80 | G31: 4 | H31: 6 | I31: 1 | J31: 紫电青霜 | K31: 300 | L31: 105,(ilv*0.5+5)*1.5;107,(ilv*0.4+4)*1.5; | M31: 6,2,104,118;6,2,105,97;6,2,101,93;6,2,106,34;6,2,107,13;6,2,102,150;6,3,104,177;6,3,105,146;6,3,101,139;6,3,106,51;6,3,107,19;6,3,102,225; | N31: 1,85,10;2,80,30;3,75,60;4,70,80;5,65,100 | O31: 100,100 | P31: 提高己方全员9%速度，效果不叠加，持续至战斗结束。 | Q31: 乃巫教公主所有，至阴至邪，灵力很强，可与自身气脉融为一体
A32: 32507 | B32: 6★彼岸花 | C32: 1 | D32: 50 | E32: 1 | F32: 120 | G32: 1 | H32: 6 | I32: 1 | J32: 黯然神伤 | K32: 300 | L32: 104,(ilv*3.8+15)*1.5; | M32: 6,2,104,118;6,2,105,97;6,2,101,93;6,2,106,34;6,2,107,13;6,2,102,150;6,3,104,177;6,3,105,146;6,3,101,139;6,3,106,51;6,3,107,19;6,3,102,225; | N32: 1,85,10;2,80,30;3,75,60;4,70,80;5,65,100 | O32: 100,100 | P32: 降低敌方全员9%攻击力，效果不叠加，持续至战斗结束。 | Q32: 一朵会散发出淡淡白光的小花，暗藏巨大魔力。
A33: 32508 | B33: 6★噬魂杖 | C33: 5 | D33: 100 | E33: 5 | F33: 120 | G33: 1 | H33: 6 | I33: 1 | J33: 噬魂夺魄 | K33: 300 | L33: 105,(ilv*0.5+5)*1.5;101,(ilv*3+10)*1.5; | M33: 6,2,104,118;6,2,105,97;6,2,101,93;6,2,106,34;6,2,107,13;6,2,102,150;6,3,104,177;6,3,105,146;6,3,101,139;6,3,106,51;6,3,107,19;6,3,102,225; | N33: 1,85,10;2,80,30;3,75,60;4,70,80;5,65,100 | O33: 100,100 | P33: 降低敌方全员9%防御，效果不叠加，持续至战斗结束。 | Q33: 乃巫教的法宝武器，通过摄人魂与噬人血炼造而成。
A34: 32509 | B34: 6★寒冰刺 | C34: 6 | D34: 50 | E34: 6 | F34: 120 | G34: 3 | H34: 6 | I34: 1 | J34: 冰寒彻骨 | K34: 300 | L34: 105,(ilv*0.5+5)*1.5;107,(ilv*0.4+4)*1.5; | M34: 6,2,104,118;6,2,105,97;6,2,101,93;6,2,106,34;6,2,107,13;6,2,102,150;6,3,104,177;6,3,105,146;6,3,101,139;6,3,106,51;6,3,107,19;6,3,102,225; | N34: 1,85,10;2,80,30;3,75,60;4,70,80;5,65,100 | O34: 100,100 | P34: 降低敌方全员9%速度，效果不叠加，持续至战斗结束。 | Q34: 乃灵音寺主持所使用的法宝，取极寒之铁打造而成，一旦被其锋芒所伤，冰毒入体，十死无生！
A35: 32510 | B35: 6★无形剑 | C35: 4 | D35: 100 | E35: 4 | F35: 80 | G35: 3 | H35: 6 | I35: 1 | J35: 斩龙决 | K35: 300 | L35: 106,(ilv*1.1+5)*1.5; | M35: 6,2,104,118;6,2,105,97;6,2,101,93;6,2,106,34;6,2,107,13;6,2,102,150;6,3,104,177;6,3,105,146;6,3,101,139;6,3,106,51;6,3,107,19;6,3,102,225; | N35: 1,85,10;2,80,30;3,75,60;4,70,80;5,65,100 | O35: 100,100 | P35: 对敌方单人连续使用两次物理攻击，伤害结果降低20%。 | Q35: 碧绿仙剑，剑身有龙形，剑刃清清如秋水，瑞气蒸腾，碧绿如水，光芒万丈！
A36: 32511 | B36: 6★天璇剑 | C36: 4 | D36: 100 | E36: 4 | F36: 80 | G36: 4 | H36: 6 | I36: 1 | J36: 御雷决 | K36: 300 | L36: 106,(ilv*1.1+5)*1.5; | M36: 6,2,104,118;6,2,105,97;6,2,101,93;6,2,106,34;6,2,107,13;6,2,102,150;6,3,104,177;6,3,105,146;6,3,101,139;6,3,106,51;6,3,107,19;6,3,102,225; | N36: 1,85,10;2,80,30;3,75,60;4,70,80;5,65,100 | O36: 100,100 | P36: 对敌方单人连续使用两次法术攻击，伤害结果降低20%。 | Q36: 剑鞘剑柄通体呈天蓝色，色泽鲜亮，隐隐有波光流动，是九天神兵，仙家至宝！
A37: 32512 | B37: 6★五火扇 | C37: 2 | D37: 100 | E37: 2 | F37: 60 | G37: 4 | H37: 6 | I37: 1 | J37: 鬼魅 | K37: 300 | L37: 105,(ilv*0.5+5)*1.5;102,ilv*5*1.5; | M37: 6,2,104,118;6,2,105,97;6,2,101,93;6,2,106,34;6,2,107,13;6,2,102,150;6,3,104,177;6,3,105,146;6,3,101,139;6,3,106,51;6,3,107,19;6,3,102,225; | N37: 1,85,10;2,80,30;3,75,60;4,70,80;5,65,100 | O37: 100,100 | P37: 使己方单人隐身4回合。 | Q37: 通体闪烁着妖艳光芒的弯牙匕首，两面都开有血槽，其中暗藏的剧毒，见血封喉！

Sheet: Sheet2
F4: 木鱼 | G4: 天音寺四大神僧每天都敲的木鱼，受佛法熏陶，已具灵性
F5: 獠牙 | G5: 乃野狗道人所持法宝，状似大狗牙，美其名曰“獠牙”
F6: 十虎剑 | G6: 挥动时会缠有金色的火焰，刚猛如十虎下山，因而得名
F7: 神木骰 | G7: 取南方赤水之畔千年三珠树的精华雕刻而成的法宝(可通过低阶法宝合成）
F8: 赤魔眼 | G8: 炼血堂老大用自己右眼修炼的法宝，施法时，充满血色，会放出凶煞血腥之气（可通过低阶法宝合成）
F9: 杀生刀 | G9: 乃鬼厉手下得力猛将杀生和尚的武器，杀生无数，故而煞气极重（可通过低阶法宝合成）
F10: 浮屠金钵 | G10: 乃天音寺四大神僧普方所持有的法宝，威力刚猛，除魔无数（可通过低阶法宝合成）
F11: 琥珀朱绫 | G11: 看似一条普通的三尺来长的红色腰带，五行属土，妙用无方，威力巨大（可通过低阶法宝合成）
F12: 寒冰剑 | G12: 齐昊自己所修炼，法宝材质极好，乃用北极万年冰晶所炼成，威力巨大，可凝冰墙（可通过低阶法宝合成）
F13: 翡翠念珠 | G13: 佛珠圆润，坠于掌间，随心中佛念和口中福语转动，诸般烦恼，仿佛早已消散于无边无际（可通过低阶法宝合成）
F14: 轮回珠 | G14: 法相的法宝，肃穆之中带着耀眼的佛家光辉，乃佛门至宝（可通过低阶法宝合成）
F15: 六合镜 | G15: 形状古拙，青铜镂边，上刻龙，下刻虎，镜上刻着八卦方位。乃青云至宝之一（可通过低阶法宝合成）
F16: 离人锥 | G16: 本为黑心老人收藏，炼血堂没落后，辗转于周隐之手，相传拥有比刺杀更强大的力量（可通过低阶法宝合成）
F17: 降魔杖 | G17: 又称金刚杆，包金雕花，分量沉重，握在手里便能感觉到刚正的佛威（可通过低阶法宝合成）
F18: 九阳尺 | G18: 又名纯阳玉尺，乃焚香谷宝物，绝非凡品（可通过低阶法宝合成）
F19: 万毒归宗袋 | G19: 乃毒神法宝，袋内养有异虫“七尾蜈蚣”（可通过低阶法宝合成）
F20: 控妖笛 | G20: 纯黑色的铁笛，乃秦无炎的法宝，拥有操控毒物妖怪的奇能（可通过低阶法宝合成）
F21: 青灵石 | G21: 乃焚香谷燕虹的法宝，来历不详，但威力不俗（可通过低阶法宝合成）
F22: 血玉骨片 | G22: 用至阴之人颅骨碎片炼化而成，其中不知还加了多少生人魂魄（可通过低阶法宝合成）
F23: 朱雀印 | G23: 乃鬼王四圣使朱雀幽姬的法宝，内含奇门印法，诡异至极，威力不俗（可通过低阶法宝合成）
F24: 血骷髅 | G24: 吸血老妖炼制的法宝，与鬼厉的嗜血珠乃是同源，是赖以催动五鬼御灵和吸血大阵的法宝（可通过低阶法宝合成）
F25: 乾坤清光戒 | G25: 鬼王四圣使青龙使用的法宝，乃九天神兵之一，威力不俗（可通过低阶法宝合成）
F26: 大悲金轮 | G26: 圆盘金轮模样，通体金黄，一尺直径见方，边缘一圈镂刻着诸罗汉金身法相，围绕着中间处正是佛祖的真身法相（可通过低阶法宝合成）
F27: 阴阳镜 | G27: 有阴阳两面，阴面为黑，阳面为白，黑是死，白是生。乃道家灵宝（可通过低阶法宝合成）
F28: 赤焰剑 | G28: 剑体通红的宝剑，乃大竹峰首座田不易的法宝，威力绝伦（可通过低阶法宝合成）
F29: 墨雪 | G29: 苏茹的法宝，剑刃长两尺，剑柄材质似玉非玉，最奇特处乃是如冰一般（可通过低阶法宝合成）
F30: 紫芒刃 | G30: 乃魔教妙公子金瓶儿所有，至阴至邪，灵力很强，可与自身气脉融为一体（可通过低阶法宝合成）
F31: 伤心花 | G31: 一朵会散发出淡淡白光的小花，是鬼王费大心血为其爱女碧瑶专门炼制的法宝（可通过低阶法宝合成）
F32: 噬魂棍 | G32: 乃张小凡的法宝武器，由“摄魂”与“噬血珠”结合，再由小凡血炼而成（可通过低阶法宝合成）
F33: 九寒凝冰刺 | G33: 焚香谷谷主上官策所使用的法宝，取极寒之铁打造而成，一旦被其锋芒所伤，冰毒入体，十死无生！（可通过低阶法宝合成）
F34: 斩龙剑 | G34: 碧绿仙剑，剑身有龙形，剑刃清清如秋水，瑞气蒸腾，碧绿如水，光芒万丈！（可通过低阶法宝合成）
F35: 天琊剑 | G35: 剑鞘剑柄通体呈天蓝色，色泽鲜亮，隐隐有波光流动，是九天神兵，仙家至宝！（可通过低阶法宝合成）
F36: 斩相思 | G36: 秦无炎的法宝，通体闪烁着妖艳光芒的弯牙匕首，两面都开有血槽，其中暗藏的剧毒，见血封喉！（可通过低阶法宝合成）
F39: 1★木鱼 | H39: 催魂灯 | J39: 1★ | K39: =RC[-1]&RC[-3] -> 1★催魂灯 | M39: 32001 | N39: 勾魄灯 | O39: 32001 | P39: =RC[-6]&RC[-2] -> 1★勾魄灯
F40: 1★獠牙 | H40: 翻天印 | J40: 1★ | K40: =RC[-1]&RC[-3] -> 1★翻天印 | M40: 32002 | N40: 番天印 | O40: 32002 | P40: =RC[-6]&RC[-2] -> 1★番天印
F41: 1★十虎剑 | H41: 震天剑 | J41: 1★ | K41: =RC[-1]&RC[-3] -> 1★震天剑 | M41: 32003 | N41: 指天剑 | O41: 32003 | P41: =RC[-6]&RC[-2] -> 1★指天剑
F42: 2★神木骰 | H42: 噬魂珠 | J42: 2★ | K42: =RC[-1]&RC[-3] -> 2★噬魂珠 | M42: 32101 | N42: 鬼印珠 | O42: 32101 | P42: =RC[-6]&RC[-2] -> 2★鬼印珠
F43: 2★赤魔眼 | H43: 清净琉璃瓶 | J43: 2★ | K43: =RC[-1]&RC[-3] -> 2★清净琉璃瓶 | M43: 32102 | N43: 炼妖壶 | O43: 32102 | P43: =RC[-6]&RC[-2] -> 2★炼妖壶
F44: 2★杀生刀 | H44: 鸣鸿刀 | J44: 2★ | K44: =RC[-1]&RC[-3] -> 2★鸣鸿刀 | M44: 32103 | N44: 鸣鸿刀 | O44: 32103 | P44: =RC[-6]&RC[-2] -> 2★鸣鸿刀
F45: 3★浮屠金钵 | H45: 照妖镜 | J45: 3★ | K45: =RC[-1]&RC[-3] -> 3★照妖镜 | M45: 32201 | N45: 照妖镜 | O45: 32201 | P45: =RC[-6]&RC[-2] -> 3★照妖镜
F46: 3★琥珀朱绫 | H46: 神禹令 | J46: 3★ | K46: =RC[-1]&RC[-3] -> 3★神禹令 | M46: 32202 | N46: 神禹令 | O46: 32202 | P46: =RC[-6]&RC[-2] -> 3★神禹令
F47: 3★寒冰剑 | H47: 金刚锤 | J47: 3★ | K47: =RC[-1]&RC[-3] -> 3★金刚锤 | M47: 32203 | N47: 乌金锤 | O47: 32203 | P47: =RC[-6]&RC[-2] -> 3★乌金锤
F48: 4★翡翠念珠 | H48: 清心灯 | J48: 4★ | K48: =RC[-1]&RC[-3] -> 4★清心灯 | M48: 32301 | N48: 落魂灯 | O48: 32301 | P48: =RC[-6]&RC[-2] -> 4★落魂灯
F49: 4★轮回珠 | H49: 列瘟印 | J49: 4★ | K49: =RC[-1]&RC[-3] -> 4★列瘟印 | M49: 32302 | N49: 列瘟印 | O49: 32302 | P49: =RC[-6]&RC[-2] -> 4★列瘟印
F50: 4★六合镜 | H50: 九疑鼎 | J50: 4★ | K50: =RC[-1]&RC[-3] -> 4★九疑鼎 | M50: 32303 | N50: 九疑鼎 | O50: 32303 | P50: =RC[-6]&RC[-2] -> 4★九疑鼎
F51: 4★离人锥 | H51: 摄魂琴 | J51: 4★ | K51: =RC[-1]&RC[-3] -> 4★摄魂琴 | M51: 32304 | N51: 摄魂琴 | O51: 32304 | P51: =RC[-6]&RC[-2] -> 4★摄魂琴
F52: 4★降魔杖 | H52: 四海瓶 | J52: 4★ | K52: =RC[-1]&RC[-3] -> 4★四海瓶 | M52: 32305 | N52: 四海瓶 | O52: 32305 | P52: =RC[-6]&RC[-2] -> 4★四海瓶
F53: 4★九阳尺 | H53: 金钟罩 | J53: 4★ | K53: =RC[-1]&RC[-3] -> 4★金钟罩 | M53: 32306 | N53: 金钟罩 | O53: 32306 | P53: =RC[-6]&RC[-2] -> 4★金钟罩
F54: 5★万毒归宗袋 | H54: 锁心锤 | J54: 5★ | K54: =RC[-1]&RC[-3] -> 5★锁心锤 | M54: 32401 | N54: 锁心锤 | O54: 32401 | P54: =RC[-6]&RC[-2] -> 5★锁心锤
F55: 5★控妖笛 | H55: 昏迷剑 | J55: 5★ | K55: =RC[-1]&RC[-3] -> 5★昏迷剑 | M55: 32402 | N55: 昏迷剑 | O55: 32402 | P55: =RC[-6]&RC[-2] -> 5★昏迷剑
F56: 5★青灵石 | H56: 颜如玉 | J56: 5★ | K56: =RC[-1]&RC[-3] -> 5★颜如玉 | M56: 32403 | N56: 颜如玉 | O56: 32403 | P56: =RC[-6]&RC[-2] -> 5★颜如玉
F57: 5★血玉骨片 | H57: 降魔杖 | J57: 5★ | K57: =RC[-1]&RC[-3] -> 5★降魔杖 | M57: 32404 | N57: 降魔杖 | O57: 32404 | P57: =RC[-6]&RC[-2] -> 5★降魔杖
F58: 5★朱雀印 | H58: 混元伞 | J58: 5★ | K58: =RC[-1]&RC[-3] -> 5★混元伞 | M58: 32405 | N58: 混元伞 | O58: 32405 | P58: =RC[-6]&RC[-2] -> 5★混元伞
F59: 5★血骷髅 | H59: 太极图 | J59: 5★ | K59: =RC[-1]&RC[-3] -> 5★太极图 | M59: 32406 | N59: 太极图 | O59: 32406 | P59: =RC[-6]&RC[-2] -> 5★太极图
F60: 6★乾坤清光戒 | H60: 乾坤弩 | J60: 6★ | K60: =RC[-1]&RC[-3] -> 6★乾坤弩 | M60: 32501 | N60: 乾坤弩 | O60: 32501 | P60: =RC[-6]&RC[-2] -> 6★乾坤弩
F61: 6★大悲金轮 | H61: 修罗刀 | J61: 6★ | K61: =RC[-1]&RC[-3] -> 6★修罗刀 | M61: 32502 | N61: 修罗刀 | O61: 32502 | P61: =RC[-6]&RC[-2] -> 6★修罗刀
F62: 6★阴阳镜 | H62: 乾天火灵珠 | J62: 6★ | K62: =RC[-1]&RC[-3] -> 6★乾天火灵珠 | M62: 32503 | N62: 乾天火灵珠 | O62: 32503 | P62: =RC[-6]&RC[-2] -> 6★乾天火灵珠
F63: 6★赤焰剑 | H63: 赤焰剑 | J63: 6★ | K63: =RC[-1]&RC[-3] -> 6★赤焰剑 | M63: 32504 | N63: 赤焰剑 | O63: 32504 | P63: =RC[-6]&RC[-2] -> 6★赤焰剑
F64: 6★墨雪 | H64: 血焰叉 | J64: 6★ | K64: =RC[-1]&RC[-3] -> 6★血焰叉 | M64: 32505 | N64: 血焰叉 | O64: 32505 | P64: =RC[-6]&RC[-2] -> 6★血焰叉
F65: 6★紫芒刃 | H65: 紫芒剑 | J65: 6★ | K65: =RC[-1]&RC[-3] -> 6★紫芒剑 | M65: 32506 | N65: 紫芒剑 | O65: 32506 | P65: =RC[-6]&RC[-2] -> 6★紫芒剑
F66: 6★伤心花 | H66: 彼岸花 | J66: 6★ | K66: =RC[-1]&RC[-3] -> 6★彼岸花 | M66: 32507 | N66: 彼岸花 | O66: 32507 | P66: =RC[-6]&RC[-2] -> 6★彼岸花
F67: 6★噬魂棍 | H67: 噬魂杖 | J67: 6★ | K67: =RC[-1]&RC[-3] -> 6★噬魂杖 | M67: 32508 | N67: 噬魂杖 | O67: 32508 | P67: =RC[-6]&RC[-2] -> 6★噬魂杖
F68: 6★九寒凝冰刺 | H68: 寒冰刺 | J68: 6★ | K68: =RC[-1]&RC[-3] -> 6★寒冰刺 | M68: 32509 | N68: 寒冰刺 | O68: 32509 | P68: =RC[-6]&RC[-2] -> 6★寒冰刺
F69: 6★斩龙剑 | H69: 无形剑 | J69: 6★ | K69: =RC[-1]&RC[-3] -> 6★无形剑 | M69: 32510 | N69: 无形剑 | O69: 32510 | P69: =RC[-6]&RC[-2] -> 6★无形剑
F70: 6★天琊剑 | H70: 天璇剑 | J70: 6★ | K70: =RC[-1]&RC[-3] -> 6★天璇剑 | M70: 32511 | N70: 天璇剑 | O70: 32511 | P70: =RC[-6]&RC[-2] -> 6★天璇剑
F71: 6★斩相思 | H71: 五火神焰扇 | J71: 6★ | K71: =RC[-1]&RC[-3] -> 6★五火神焰扇 | M71: 32512 | N71: 五火扇 | O71: 32512 | P71: =RC[-6]&RC[-2] -> 6★五火扇

Sheet: Sheet3
B2: 5000 | C2: =RC[-1]/100 -> 50
B3: 5000 | C3: =RC[-1]/100 -> 50
B4: 5000 | C4: =RC[-1]/100 -> 50
B5: 10000 | C5: =RC[-1]/100 -> 100
B6: 10000 | C6: =RC[-1]/100 -> 100
B7: 10000 | C7: =RC[-1]/100 -> 100
B8: 15000 | C8: =RC[-1]/100 -> 150
B9: 15000 | C9: =RC[-1]/100 -> 150
B10: 15000 | C10: =RC[-1]/100 -> 150
B11: 20000 | C11: =RC[-1]/100 -> 200
B12: 20000 | C12: =RC[-1]/100 -> 200
B13: 20000 | C13: =RC[-1]/100 -> 200
B14: 20000 | C14: =RC[-1]/100 -> 200
B15: 20000 | C15: =RC[-1]/100 -> 200
B16: 20000 | C16: =RC[-1]/100 -> 200
B17: 25000 | C17: =RC[-1]/100 -> 250
B18: 25000 | C18: =RC[-1]/100 -> 250
B19: 25000 | C19: =RC[-1]/100 -> 250
B20: 25000 | C20: =RC[-1]/100 -> 250
B21: 25000 | C21: =RC[-1]/100 -> 250
B22: 25000 | C22: =RC[-1]/100 -> 250
B23: 30000 | C23: =RC[-1]/100 -> 300
B24: 30000 | C24: =RC[-1]/100 -> 300
B25: 30000 | C25: =RC[-1]/100 -> 300
B26: 30000 | C26: =RC[-1]/100 -> 300
B27: 30000 | C27: =RC[-1]/100 -> 300
B28: 30000 | C28: =RC[-1]/100 -> 300
B29: 30000 | C29: =RC[-1]/100 -> 300
B30: 30000 | C30: =RC[-1]/100 -> 300
B31: 30000 | C31: =RC[-1]/100 -> 300
B32: 30000 | C32: =RC[-1]/100 -> 300
B33: 30000 | C33: =RC[-1]/100 -> 300
B34: 30000 | C34: =RC[-1]/100 -> 300