Sheet: ctAscendingStarConf
A1: 神器星级
A2: nStar | B2: nAdvancedExp | C2: nMaxLevel | D2: nRoleLevel | E2: nMAxStar
A3: i | B3: i | C3: i | D3: i | E3: i
A4: 星级 | B4: 进阶经验 | C4: 等级上限 | D4: 人物等级上限 | E4: 最大星级上限
A5: 1 | B5: 100 | C5: 10 | D5: 60 | E5: 10
A6: 2 | B6: 200 | C6: =R[-1]C+10 -> 20 | D6: 60 | E6: 10
A7: 3 | B7: 400 | C7: =R[-1]C+10 -> 30 | D7: 60 | E7: 10
A8: 4 | B8: 800 | C8: =R[-1]C+10 -> 40 | D8: 65 | E8: 10
A9: 5 | B9: 1200 | C9: =R[-1]C+10 -> 50 | D9: 70 | E9: 10
A10: 6 | B10: 1600 | C10: =R[-1]C+10 -> 60 | D10: 75 | E10: 10
A11: 7 | B11: 2500 | C11: =R[-1]C+10 -> 70 | D11: 80 | E11: 10
A12: 8 | B12: 4000 | C12: =R[-1]C+10 -> 80 | D12: 85 | E12: 10
A13: 9 | B13: 6000 | C13: =R[-1]C+10 -> 90 | D13: 88 | E13: 10
A14: 10 | B14: 0 | C14: =R[-1]C+10 -> 100 | D14: 90 | E14: 10