Sheet: ctDailyActivity
E1: 1：日常活动 2：限时活动 | F1: 1:可以继续参加 0:不可继续参加 | G1: 1可以在战斗中参加 0不可在战斗中参加 | K1: 1：没条件限制 2：服务器等级 | L1: 服务器开启等级 | O1: 目前针对PVE跟PVP,0表示没有限制 | R1: 客户端 | S1: 客户端 | U1: 人物开启等级 | V1: 1:单人 2:组队 | X1: 客户端 | Y1: 客户端 | AB1: 客户端 | AC1: 1为开启，0为关闭
A2: nActivityID | B2: sActivityName | C2: sIcon | D2: nListID | E2: nActivityType | F2: bCanJoinContinues | G2: bCanDoInFight | H2: nTimesReward | I2: nRewardActValue | J2: nMaxActValue | K2: nOpenType | L2: nOpenLimit | M2: nSysOpenID | N2: tOpenList | O2: nArrivaTime | P2: nOpenTime | Q2: nCloseTime | R2: sOpenTime1 | S2: sCloseTime1 | T2: nID | U2: nLevelLimit | V2: nJoinType | W2: nMenberNum | X2: sNumLimit1 | Y2: sLevelLimit1 | Z2: sActivityDesc | AA2: nShowReward | AB2: sTimeDesc | AC2: nJoin
A3: i | B3: s | C3: s | D3: i | E3: i | F3: b | G3: b | H3: i | I3: i | J3: i | K3: i | L3: i | M3: i | N3: t{i} | O3: i | P3: i | Q3: i | R3: s | S3: s | T3: i | U3: i | V3: i | W3: i | X3: s | Y3: s | Z3: s | AA3: t{i} | AB3: s | AC3: b
A4: 活动ID | B4: 活动名称 | C4: 图标 | D4: 排列顺序 | E4: 活动类型 | F4: 完成有奖励次数是否能继续参加 | G4: 能否在战斗中参加 | H4: 有奖励的次数 | I4: 奖励活跃值 | J4: 活跃值上限 | K4: 开启条件类型 | L4: 开启等级限制 | M4: 开放系统ID | N4: 星期几开放列表 | O4: 活动开启多少分钟内可以进入 | P4: 开启时间 | Q4: 关闭时间 | R4: 开启时间 | S4: 关闭时间 | T4: NPC编号 | U4: 等级限制 | V4: 参加形式 | W4: 成员最小人数 | X4: 人数限制 | Y4: 等级限制 | Z4: 活动描述 | AA4: 奖励展示 | AB4: 时间描述 | AC4: 参加按钮是否开启
A5: 101 | B5: 捉妖任务 | C5: rc_zyrw | D5: 10 | E5: 1 | F5: 1 | G5: 0 | H5: 50 | I5: 1 | J5: 30 | K5: 1 | L5: 20 | M5: 26 | N5: 1;2;3;4;5;6;7; | O5: 0 | P5: 0 | Q5: 2400 | R5: 00:00 | S5: 24:00 | T5: 1 | U5: =RC[-9] -> 20 | V5: 2 | W5: 3 | X5: 3~5人 | Y5: ="最低"&RC[-4]&"级" -> 最低20级 | Z5: 跨服组队任务，奖励丰厚。每天可完成<color=#ffff00>50次</color>捉妖，超过<color=#ffff00>50次</color>后收益将大大降低。<color=#ffff00>每日必做！</color> | AA5: 7;4;12008;90000; | AB5: 全天,每天<color=#ffff00>00:00</color>刷新 | AC5: 1
A6: 102 | B6: 降妖伏魔 | C6: rc_lsym | D6: 9 | E6: 1 | F6: 1 | G6: 0 | H6: 10 | I6: 2 | J6: 20 | K6: 1 | L6: 45 | M6: 27 | N6: 1;2;3;4;5;6;7; | O6: 0 | P6: 0 | Q6: 2400 | R6: 00:00 | S6: 24:00 | T6: 5007 | U6: =RC[-9] -> 45 | V6: 2 | W6: 3 | X6: 3~5人 | Y6: ="最低"&RC[-4]&"级" -> 最低45级 | Z6: 击杀妖魔会获得丰厚的经验和道具奖励。每天可完成<color=#ffff00>10次</color>降妖伏魔，超过<color=#ffff00>10次</color>后会没有任何收益。 | AA6: 7;28000;19016;27000; | AB6: 全天,每天<color=#ffff00>00:00</color>刷新 | AC6: 1
A7: 103 | B7: 诛心魔 | C7: rc_xmqs | D7: 13 | E7: 1 | F7: 1 | G7: 0 | H7: 2 | I7: 5 | J7: 10 | K7: 2 | L7: 60 | M7: 28 | N7: 1;2;3;4;5;6;7; | O7: 0 | P7: 0 | Q7: 2400 | R7: 00:00 | S7: 24:00 | T7: 5013 | U7: =RC[-9] -> 60 | V7: 2 | W7: 3 | X7: 3~5人 | Y7: ="最低"&RC[-4]&"级" -> 最低60级 | Z7: 修行至深，难逃心魔侵扰，而心魔之力甚大非比寻常。各位侠士快快前往挑战。<color=#ffff00>该活动为高难度战斗，请组好队伍再进行挑战！</color> | AA7: 7;17000;19011;2000100; | AB7: 全天,每天<color=#ffff00>00:00</color>刷新 | AC7: 1
A8: 104 | B8: 师门任务 | C8: rc_smrw | D8: 4 | E8: 1 | F8: 0 | G8: 0 | H8: 10 | I8: 2 | J8: 20 | K8: 1 | L8: 12 | M8: 2 | N8: 1;2;3;4;5;6;7; | O8: 0 | P8: 0 | Q8: 2400 | R8: 00:00 | S8: 24:00 | T8: 1 | U8: =RC[-9] -> 12 | V8: 1 | W8: 1 | X8: 单人 | Y8: ="最低"&RC[-4]&"级" -> 最低12级 | Z8: 在本门派<color=#ffff00>师傅</color>处领取。每天前<color=#ffff00>10环</color>师门有高额奖励；连续做完10环为<color=#ffff00>完美10环</color>，有<color=#ffff00>帮派诏令</color>的额外奖励；每周完成<color=#ffff00>5次</color>完美10环有周额外奖励。<color=#ffff00>每日必做！</color> | AA8: 7;4;10007; | AB8: 全天,每天<color=#ffff00>00:00</color>刷新 | AC8: 1
A9: 105 | B9: 神兽大放送 | C9: rc_ssly | D9: 15 | E9: 1 | F9: 1 | G9: 0 | H9: 0 | I9: 0 | J9: 0 | K9: 1 | L9: 30 | M9: 38 | N9: 0; | O9: 0 | P9: 0 | Q9: 2400 | R9: 00:00 | S9: 24:00 | T9: 5024 | U9: =RC[-9] -> 30 | V9: 1 | W9: 1 | X9: 单人 | Y9: ="最低"&RC[-4]&"级" -> 最低30级 | Z9: 传闻只有拥有仙缘的修道之人方可踏入的神兽大放送 | AA9: 19016;28002;19011;19012; | AB9: 全天,每天<color=#ffff00>00:00</color>刷新 | AC9: 1
A10: 106 | B10: 竞技场 | C10: rc_jjc | D10: 7 | E10: 1 | F10: 1 | G10: 0 | H10: 5 | I10: 4 | J10: 20 | K10: 1 | L10: 30 | M10: 39 | N10: 1;2;3;4;5;6;7; | O10: 0 | P10: 0 | Q10: 2400 | R10: 00:00 | S10: 24:00 | T10: 1 | U10: =RC[-9] -> 30 | V10: 1 | W10: 1 | X10: 单人 | Y10: ="最低"&RC[-4]&"级" -> 最低30级 | Z10: 挑战其他玩家，赢取高级段位，高段位的赛季宝箱可获得极品神器，竞技积分可在积分商城中兑换珍稀道具。 | AA10: 33161;5;28000;28001; | AB10: 全天,每天<color=#ffff00>00:00</color>刷新 | AC10: 1
A11: 107 | B11: 挖宝任务 | C11: rc_btrw | D11: 6 | E11: 1 | F11: 1 | G11: 0 | H11: 10 | I11: 2 | J11: 20 | K11: 1 | L11: 35 | M11: 70 | N11: 1;2;3;4;5;6;7; | O11: 0 | P11: 0 | Q11: 2400 | R11: 00:00 | S11: 24:00 | T11: 0 | U11: =RC[-9] -> 35 | V11: 1 | W11: 1 | X11: 单人 | Y11: ="最低"&RC[-4]&"级" -> 最低35级 | Z11: 每天免费<color=#ffff00>10次</color>挖取神秘宝藏 | AA11: 18005; | AB11: 全天,每天<color=#ffff00>00:00</color>刷新 | AC11: 1
A12: 108 | B12: 赏金任务 | C12: rc_sjrw | D12: 5 | E12: 1 | F12: 0 | G12: 0 | H12: 5 | I12: 2 | J12: 10 | K12: 1 | L12: 40 | M12: 48 | N12: 1;2;3;4;5;6;7; | O12: 0 | P12: 0 | Q12: 2400 | R12: 00:00 | S12: 24:00 | T12: 0 | U12: =RC[-9] -> 40 | V12: 1 | W12: 1 | X12: 单人 | Y12: ="最低"&RC[-4]&"级" -> 最低40级 | Z12: 每天可做<color=#ffff00>5次</color>赏金任务。赏金榜上<color=#ffff00>星级</color>越高的任务，难度越高，奖励越丰厚。 | AA12: 7;31000;16000;17000; | AB12: 全天,每天<color=#ffff00>00:00</color>刷新 | AC12: 1
A13: 109 | B13: 连环任务 | C13: rc_slrw | D13: 12 | E13: 1 | F13: 0 | G13: 0 | H13: 0 | I13: 0 | J13: 0 | K13: 2 | L13: 65 | M13: 56 | N13: 1;2;3;4;5;6;7; | O13: 0 | P13: 0 | Q13: 2400 | R13: 00:00 | S13: 24:00 | T13: 0 | U13: =RC[-9] -> 65 | V13: 1 | W13: 1 | X13: 单人 | Y13: ="最低"&RC[-4]&"级" -> 最低65级 | Z13: 每周可以完成<color=#ffff00>100环</color>连环任务。在完成<color=#ffff00>第100环</color>时，会有稀有<color=#ffff00>宠物装备</color>奖励。 | AA13: 7;2000100; | AB13: 全天,每天<color=#ffff00>00:00</color>刷新 | AC13: 1
A14: 110 | B14: 神魔录 | C14: rc_smz | D14: 8 | E14: 1 | F14: 1 | G14: 0 | H14: 0 | I14: 0 | J14: 0 | K14: 1 | L14: 30 | M14: 71 | N14: 1;2;3;4;5;6;7; | O14: 0 | P14: 0 | Q14: 2400 | R14: 00:00 | S14: 24:00 | T14: 0 | U14: =RC[-9] -> 30 | V14: 0 | W14: 1 | X14: 单人/组队 | Y14: ="最低"&RC[-4]&"级" -> 最低30级 | Z14: 高难度挑战玩法，可获得<color=#ffff00>高星法宝，稀有神器，稀有时装，高品质装备</color>… | AA14: 13002;13101;32306;33071; | AB14: 全天开放 | AC14: 1
A15: 111 | B15: 萌仙轶事 | C15: rc_zxys | D15: 1 | E15: 1 | F15: 0 | G15: 1 | H15: 10 | I15: 0 | J15: 0 | K15: 1 | L15: 25 | M15: 67 | N15: 1;2;3;4;5;6;7; | O15: 0 | P15: 1000 | Q15: 2400 | R15: 10:00 | S15: 24:00 | T15: 0 | U15: =RC[-9] -> 25 | V15: 0 | W15: 1 | X15: 单人 | Y15: ="最低"&RC[-4]&"级" -> 最低25级 | Z15: 了解萌仙的故事，成为萌仙的百事通，参与答题，可获得丰厚奖励哦 | AA15: 7;4;19011;19012; | AB15: 每天<color=#ffff00>10:00-24:00点</color> | AC15: 1
A16: 112 | B16: 萌仙课堂 | C16: rc_mzkt | D16: 2 | E16: 1 | F16: 0 | G16: 1 | H16: 10 | I16: 0 | J16: 0 | K16: 1 | L16: 25 | M16: 66 | N16: 1;2;3;4;5;7; | O16: 0 | P16: 1730 | Q16: 2400 | R16: 17:30 | S16: 24:00 | T16: 0 | U16: =RC[-9] -> 25 | V16: 0 | W16: 1 | X16: 单人 | Y16: ="最低"&RC[-4]&"级" -> 最低25级 | Z16: 修道之人怎可只知练功打坐？快来与众位仙友比拼谁的知识更丰富吧！ | AA16: 7;4;28000;19016; | AB16: 每天<color=#ffff00>17:30-24:00</color> | AC16: 1
A17: 114 | B17: 天地法阵 | C17: rc_bhhz | D17: 14 | E17: 1 | F17: 0 | G17: 0 | H17: 1 | I17: 0 | J17: 0 | K17: 1 | L17: 47 | M17: 46 | N17: 1;2;3;4;5;6;7; | O17: 0 | P17: 500 | Q17: 2400 | R17: 5:00 | S17: 24:00 | T17: 5026 | U17: =RC[-9] -> 47 | V17: 1 | W17: 1 | X17: 单人 | Y17: ="最低"&RC[-4]&"级" -> 最低47级 | Z17: 备齐开启法阵所需物品，完成后可以获得大量修炼经验。<color=#ffff00>可以向帮派成员发起求助。</color> | AA17: 7;9;10009; | AB17: 全天,每天<color=#ffff00>5:00</color>刷新 | AC17: 1
A18: 116 | B18: 妖兽突袭 | C18: rc_ystx | D18: 11 | E18: 1 | F18: 0 | G18: 0 | H18: 3 | I18: 5 | J18: 15 | K18: 1 | L18: 50 | M18: 47 | N18: 1;2;3;4;5;6;7; | O18: 0 | P18: 0 | Q18: 2400 | R18: 00:00 | S18: 24:00 | T18: 5025 | U18: =RC[-9] -> 50 | V18: 1 | W18: 1 | X18: 单人 | Y18: ="最低"&RC[-4]&"级" -> 最低50级 | Z18: 兽神座下十三妖兽意图染指人间，我辈修道之人必将带头御敌！抵御成功即有机会获得高级技能书和高级宠物装备 | AA18: 7;16000;17000;2000100; | AB18: 全天,每天<color=#ffff00>00:00</color>刷新 | AC18: 1
A19: 201 | B19: 决战九天 | C19: rc_jzjx | D19: 1 | E19: 2 | F19: 1 | G19: 0 | H19: 9 | I19: 0 | J19: 0 | K19: 1 | L19: 30 | M19: 29 | N19: 1;3;5;7; | O19: 60 | P19: 2000 | Q19: 2100 | R19: 20:00 | S19: 21:00 | T19: 5006 | U19: =RC[-9] -> 30 | V19: 2 | W19: 3 | X19: 3~5人 | Y19: ="最低"&RC[-4]&"级" -> 最低30级 | Z19: 传说九重天由龙之九子镇守，二十八星宿辅佐，一共<color=#ffff00>九层</color>，层数越高难度越大奖励越丰厚。 | AA19: 28000;19011;19012;17000; | AB19: 每周一、周三、周五和周日<color=#ffff00>20:00-21:00点</color> | AC19: 1
A20: 202 | B20: 混沌试炼 | C20: rc_hdsl | D20: 1 | E20: 2 | F20: 1 | G20: 0 | H20: 9 | I20: 0 | J20: 0 | K20: 1 | L20: 30 | M20: 31 | N20: 2;4;6; | O20: 60 | P20: 2000 | Q20: 2100 | R20: 20:00 | S20: 21:00 | T20: 5008 | U20: =RC[-9] -> 30 | V20: 2 | W20: 3 | X20: 3~5人 | Y20: ="最低"&RC[-4]&"级" -> 最低30级 | Z20: 少侠，这场试炼所面对的，将是各门各派中的翘楚菁英。少侠若是对自身实力有自信，不妨挑战一番 | AA20: 28000;19013;17000; | AB20: 每周二、周四和周六<color=#ffff00>20:00-21:00点</color> | AC20: 1
A21: 1001 | B21: 首席争霸 | C21: rc_sxzb | D21: 1 | E21: 2 | F21: 0 | G21: 0 | H21: 0 | I21: 0 | J21: 0 | K21: 1 | L21: 30 | M21: 33 | N21: 1; | O21: 10 | P21: 2100 | Q21: 2130 | R21: 21:00 | S21: 21:30 | T21: 5009 | U21: =RC[-9] -> 30 | V21: 0 | W21: 1 | X21: 单人 | Y21: ="最低"&RC[-4]&"级" -> 最低30级 | Z21: 自古各派菁英翘楚层出不穷。少侠，想要获得门下弟子第一人的称号，并非易事啊 | AA21: 11003;19011;19012;17000; | AB21: 每周一<color=#ffff00>21:00-21:30点</color> | AC21: 1
A22: 1002 | B22: 跨服·五方会武 | C22: rc_qmhw | D22: 1 | E22: 2 | F22: 0 | G22: 0 | H22: 0 | I22: 0 | J22: 0 | K22: 1 | L22: 30 | M22: 35 | N22: 3;6; | O22: 10 | P22: 2100 | Q22: 2130 | R22: 21:00 | S22: 21:30 | T22: 5011 | U22: =RC[-9] -> 30 | V22: 0 | W22: 1 | X22: 1~5人 | Y22: ="最低"&RC[-4]&"级" -> 最低30级 | Z22: 五方会武乃天剑府一甲子一次的比武大会，目的是警戒后人，提携年轻弟子 | AA22: 11003;19011;19012;17000; | AB22: 每周三和周六<color=#ffff00>21:00-21:30点</color> | AC22: 1
A23: 1003 | B23: 跨服·萌仙会战 | C23: rc_qyzz | D23: 1 | E23: 2 | F23: 0 | G23: 0 | H23: 0 | I23: 0 | J23: 0 | K23: 1 | L23: 30 | M23: 36 | N23: 2;5;7; | O23: 10 | P23: 2100 | Q23: 2130 | R23: 21:00 | S23: 21:30 | T23: 5012 | U23: =RC[-9] -> 30 | V23: 0 | W23: 1 | X23: 单人 | Y23: ="最低"&RC[-4]&"级" -> 最低30级 | Z23: 三界暗流涌动，豪杰齐聚，是为决出萌仙第一人。少侠若有兴趣，不妨来我此处报名参赛 | AA23: 11003;19011;19012;17000; | AB23: 每周二、周五和周日<color=#ffff00>21:00-21:30点</color> | AC23: 1
A24: 1004 | B24: 跨服帮战 | C24: rc_kfbz | D24: 1 | E24: 2 | F24: 0 | G24: 0 | H24: 0 | I24: 0 | J24: 0 | K24: 1 | L24: 30 | M24: 34 | N24: 4; | O24: 10 | P24: 2100 | Q24: 2215 | R24: 21:00 | S24: 22:15 | T24: 5010 | U24: =RC[-9] -> 30 | V24: 0 | W24: 1 | X24: 1~5人 | Y24: ="最低"&RC[-4]&"级" -> 最低30级 | Z24: 众人拾柴火焰高。帮派等级大于2的帮派都可以在我这里报名参加跨服帮战 | AA24: 11003;19011;19012;17000; | AB24: 每周四<color=#ffff00>21:00-22:15点</color> | AC24: 1