Sheet: ctDailyBattleDupConf
A1: 101捉妖 102降妖伏魔 103诛心魔 105神兽大放送 201决战九天 202混沌试炼 203萌仙天下 | W1: 道具库
A2: nTaskType | B2: sTaksName | C2: nAccpLimit | D2: nSerLimit | E2: nMinMember | F2: nGoldReward | G2: nXiaYiReward | H2: nMaxXiaYi | I2: nRewardXiaYiPer | J2: nRewardItemPer | K2: nShuangBeiRewardPer | L2: nShuangBei | M2: nDuiZhang | N2: nCouple | O2: nQingYuan | P2: nShouHu | Q2: nXinHun | R2: nJieYi | S2: nShiTu | T2: fnRoleExpReward | U2: fnPetExpReward | V2: fnSilverReward | W2: tItemAward
A3: i | B3: s | C3: i | D3: i | E3: i | F3: i | G3: i | H3: i | I3: i | J3: i | K3: i | L3: i | M3: i | N3: i | O3: i | P3: i | Q3: i | R3: i | S3: i | T3: e | U3: e | V3: e | W3: t{ii}
A4: 副本类型 | B4: 副本名称 | C4: 可接等级 | D4: 服务器开放等级 | E4: 队伍最小人数 | F4: 奖励金币数量 | G4: 单位奖励侠义值 | H4: 每天最多侠义值 | I4: 奖励侠义值概率百分比 | J4: 奖励物品概率百分比 | K4: 双倍状态下奖励物品百分比 | L4: 双倍状态加成百分比 | M4: 队长加成百分比 | N4: 夫妻加成 | O4: 有情缘加成百分比 | P4: 守护加成百分比 | Q4: 新婚状态加成百分比 | R4: 结义加成百分比 | S4: 师徒加成百分比 | T4: 人物经验基数公式 | U4: 宠物经验基数公式 | V4: 银币奖励基数公式 | W4: 奖励库(权重,奖励库ID;...)
A5: 101 | B5: 捉妖任务 | C5: 35 | D5: 1 | E5: 3 | F5: 0 | G5: 1 | H5: 60 | I5: 50 | J5: 50 | K5: 50 | L5: 100 | M5: 20 | N5: 10 | O5: 10 | P5: 10 | Q5: 10 | R5: 10 | S5: 15 | T5: (nRoleLevel*35+200)*(nCompCount+2)/4 | U5: (nRoleLevel*28+160)*(nCompCount+2)/4 | V5: 10000*0.1*(100+nCompCount)/100*(1+nRoleLevel/200) | W5: 100,1000;375,6100;
A6: 102 | B6: 降妖伏魔 | C6: 35 | D6: 1 | E6: 3 | F6: 0 | G6: 1 | H6: 60 | I6: 50 | J6: 50 | K6: 0 | L6: 100 | M6: 20 | N6: 10 | O6: 10 | P6: 10 | Q6: 10 | R6: 10 | S6: 15 | T6: nRoleLevel*200+800 | U6: nRoleLevel*50+1200 | V6: 1000*(1+nRoleLevel/200) | W6: 100,2200;
A7: 103 | B7: 诛心魔 | C7: 60 | D7: 1 | E7: 3 | F7: 500 | G7: 1 | H7: 60 | I7: 50 | J7: 0 | K7: 0 | L7: 100 | M7: 20 | N7: 10 | O7: 10 | P7: 10 | Q7: 10 | R7: 10 | S7: 15 | T7: nRoleLevel*160+2500 | U7: nRoleLevel*288+4800 | V7: nSilverRatio*20 | W7: 0,0;
A8: 201 | B8: 决战九天 | C8: 30 | D8: 1 | E8: 3 | F8: 0 | G8: 1 | H8: 60 | I8: 50 | J8: 0 | K8: 0 | L8: 100 | M8: 20 | N8: 0 | O8: 10 | P8: 10 | Q8: 10 | R8: 10 | S8: 15 | T8: nRoleLevel*230+400 | U8: nRoleLevel*120+400 | V8: 50000 | W8: 100,1018;
A9: 202 | B9: 混沌试炼 | C9: 30 | D9: 1 | E9: 3 | F9: 0 | G9: 1 | H9: 60 | I9: 50 | J9: 0 | K9: 0 | L9: 100 | M9: 20 | N9: 0 | O9: 10 | P9: 10 | Q9: 10 | R9: 10 | S9: 15 | T9: nRoleLevel*300+500 | U9: nRoleLevel*120+400 | V9: 50000 | W9: 100,1019;
A10: 203 | B10: 萌仙天下 | C10: 30 | D10: 1 | E10: 1 | F10: 0 | G10: 1 | H10: 60 | I10: 50 | J10: 0 | K10: 0 | L10: 100 | M10: 20 | N10: 0 | O10: 10 | P10: 10 | Q10: 10 | R10: 10 | S10: 15 | T10: (nRoleLevel*190+500)*(1+MaxCount/99) | U10: (nRoleLevel*120+400)*(1+MaxCount/99) | V10: 50000*(1+MaxCount/99) | W10: 100,1020;
A11: 105 | B11: 神兽大放送 | C11: 30 | D11: 1 | E11: 1 | F11: 0 | G11: 0 | H11: 0 | I11: 0 | J11: 0 | K11: 0 | L11: 0 | M11: 0 | N11: 0 | O11: 0 | P11: 0 | Q11: 0 | R11: 0 | S11: 0 | T11: 0 | U11: 0 | V11: 0 | W11: 100,2000;
A12: 110 | B12: 神魔录 | C12: 30 | D12: 1 | E12: 1 | F12: 0 | G12: 5 | H12: 0 | I12: 0 | J12: 0 | K12: 0 | L12: 0 | M12: 0 | N12: 0 | O12: 0 | P12: 0 | Q12: 0 | R12: 0 | S12: 0 | T12: 0 | U12: 0 | V12: 0 | W12: 0,0;

Sheet: Sheet2
A1: 宋玉 | B1: 多想为你奉上最美的鲜花
A2: 潘安 | B2: 留不住的，始终是那刹那消逝的芳华
A3: 卫玠 | B3: 天涯海角，但求无他，只望君安，叔宝便已知足
A4: 赵云 | B4: 若为伊故，子龙再度七进七出又何妨！
A5: 司马相如 | B5: 能与娘娘相伴，真乃微臣之辛
A6: 孙策 | B6: =R[-1]C -> 能与娘娘相伴，真乃微臣之辛
A7: 韩子高 | B7: 伊人独舞，倾城之姿。舞中带忧，我见犹怜
A8: 高长恭 | B8: 不要动，再动的话，我可不敢保证会发生什么!
A9: 嵇康 | B9: 人生难免不如意，娘娘懂得排遣便好
A10: 慕容冲 | B10: 你是白痴吗？这种话还需要我当面跟你说清楚吗！
A11: 诸葛亮 | B11: 今日夜观星象，乌云盖顶，却奈何遮不住对你的思念
A12: 卫青 | B12: 有时候莫名其妙的笑了，只因为想到了你
A13: 荀彧 | B13: 大千世界，能遇上娘娘，真好
A14: 子画 | B14: 没有我，你要好好的，这是你唯一能为我做的
A15: 白玉堂 | B15: 不要怕什么路途遥远。走一步有一步的风景
A16: 曹操 | B16: 我从来不怕天下人看错我，却唯怕你看错我
A17: 李白 | B17: 陪你地老天荒，只为伊人独醉
A18: 杜甫 | B18: 你站在哪里 哪里就自成风景
A19: 展昭 | B19: 只要展某认为值得，纵管前方是刀山火海还是千军万马，我也会义无反顾！
A20: 周瑜 | B20: 聆听吧，这首献给您的醉赤壁
A21: 苏轼 | B21: 小楼一夜听风雨，深巷明朝卖杏花
A22: 元稹 | B22: 在你需要我时，我总会出现在你身边
A23: 阮籍 | B23: 世间纵有风雪寒寒，亦终有人万死不离
A24: 霍去病 | B24: 娘娘，和你在一起总会令我忘记时间的存在
A25: 邹忌 | B25: 我不思进取，因为只思你！
A26: 唐伯虎 | B26: 笔走龙蛇绘江山，却绘不出娘娘的惊鸿之姿
A27: 柳永 | B27: 云淡风轻，细水长流
A28: 魏无忌 | B28: 凤兮凤兮归故乡，遨游四海求其凰
A29: 扶苏 | B29: 此刻看着你，就好比我在晴朗的天气，眺望远处的青山
A30: 欧阳修 | B30: 娘娘，好风、好景，倒不如来一场春风得意马蹄疾。
A31: 郭嘉 | B31: 有的路，是脚去走。而有的路，确是用心去走
A32: 蒙恬 | B32: 你若需要，大可拿走我的心，可是别把你的微笑拿掉
A33: 白居易 | B33: 娘娘，樱树只有华美落尽，生命脉络才历历可见
A34: 刘彻 | B34: 一腔孤勇与余生，只愿能陪在你的身边

Sheet: Sheet3
B4: 副本类型 | C4: 副本名称 | D4: 可接等级 | E4: 服务器开放等级 | F4: 队伍最小人数 | G4: 奖励金币数量 | H4: 单位奖励侠义值 | I4: 每天最多侠义值 | J4: 奖励侠义值概率百分比 | K4: 奖励物品概率百分比 | L4: 双倍状态下奖励物品百分比 | M4: 双倍状态加成百分比 | N4: 队长加成百分比 | O4: 有情缘加成百分比 | P4: 守护加成百分比 | Q4: 新婚状态加成百分比 | R4: 结义加成百分比 | S4: 师徒加成百分比 | U4: 人物经验基数公式 | V4: 宠物经验基数公式 | W4: 银币奖励基数公式 | X4: 奖励库(权重,奖励库ID;...) | AG4: 活动ID | AH4: 活动名称 | AI4: 图标 | AJ4: 活动类型 | AK4: 完成有奖励次数是否能继续参加 | AL4: 有奖励的次数
B5: 101 | C5: 镇妖任务 | D5: 20 | E5: 1 | F5: 3 | G5: 0 | H5: 1 | I5: 120 | J5: 20 | K5: 3 | L5: 8 | M5: 100 | N5: 20 | O5: 10 | P5: 10 | Q5: 10 | R5: 10 | S5: 15 | T5: =RC[-17] -> 镇妖任务 | U5: (nRoleLevel*35+200)*(nCompCount+2)/4 | V5: (nRoleLevel*28+160)*(nCompCount+2)/4 | W5: 1000*0.1*(100+nCompCount)/100*(1+nRoleLevel/200) | X5: 100,1000; | AA5: 35 | AB5: 200 | AG5: 101 | AH5: 镇妖任务 | AI5: rc_zyrw | AJ5: 1 | AK5: 1 | AL5: 50
B6: 102 | C6: 乱世妖魔 | D6: 30 | E6: 1 | F6: 1 | G6: 0 | H6: 1 | I6: 120 | J6: 20 | K6: 50 | L6: 0 | M6: 100 | N6: 20 | O6: 10 | P6: 10 | Q6: 10 | R6: 10 | S6: 15 | T6: =RC[-17] -> 乱世妖魔 | U6: (nRoleLevel*35+200)/4 | V6: (nRoleLevel*28+160)/4 | W6: 1000*(1+nRoleLevel/200) | X6: 100,1001; | AA6: 35 | AB6: 200 | AG6: 102 | AH6: 乱世妖魔 | AI6: rc_lsym | AJ6: 1 | AK6: 1 | AL6: 10
B7: 103 | C7: 心魔侵蚀 | D7: 60 | E7: 1 | F7: 3 | G7: 500 | H7: 1 | I7: 120 | J7: 20 | K7: 0 | L7: 0 | M7: 100 | N7: 20 | O7: 10 | P7: 10 | Q7: 10 | R7: 10 | S7: 15 | T7: =RC[-17] -> 心魔侵蚀 | U7: nRoleLevel*360+6000 | V7: nRoleLevel*288+4800 | W7: nSilverRatio*20 | X7: 0,0; | AA7: 360 | AB7: 6000 | AG7: 103 | AH7: 心魔侵蚀 | AI7: rc_xmqs | AJ7: 1 | AK7: 1 | AL7: 2
B8: 201 | C8: 决战九霄 | D8: 30 | E8: 1 | F8: 3 | G8: 0 | H8: 1 | I8: 120 | J8: 20 | K8: 0 | L8: 0 | M8: 100 | N8: 20 | O8: 10 | P8: 10 | Q8: 10 | R8: 10 | S8: 15 | T8: =RC[-17] -> 决战九霄 | U8: nRoleLevel*150+500 | V8: nRoleLevel*120+400 | W8: 50000 | X8: 100,1018; | AA8: 150 | AB8: 500 | AG8: 104 | AH8: 师门任务 | AI8: rc_smrw | AJ8: 1 | AK8: 0 | AL8: 20
B9: 202 | C9: 混沌试炼 | D9: 30 | E9: 1 | F9: 3 | G9: 0 | H9: 1 | I9: 120 | J9: 20 | K9: 0 | L9: 0 | M9: 100 | N9: 20 | O9: 10 | P9: 10 | Q9: 10 | R9: 10 | S9: 15 | T9: =RC[-17] -> 混沌试炼 | U9: nRoleLevel*150+500 | V9: nRoleLevel*120+400 | W9: 50000 | X9: 100,1019; | AA9: 150 | AB9: 500 | AG9: 105 | AH9: 神兽乐园 | AI9: rc_ssly | AJ9: 1 | AK9: 1 | AL9: 0
B10: 203 | C10: 梦诛无双 | D10: 30 | E10: 1 | F10: 3 | G10: 0 | H10: 1 | I10: 120 | J10: 20 | K10: 0 | L10: 0 | M10: 100 | N10: 20 | O10: 10 | P10: 10 | Q10: 10 | R10: 10 | S10: 15 | T10: =RC[-17] -> 梦诛无双 | U10: (nRoleLevel*150+500)*(1+MaxCount/99) | V10: (nRoleLevel*120+400)*(1+MaxCount/99) | W10: 50000*(1+MaxCount/99) | X10: 100,1020; | AA10: 150 | AB10: 500 | AG10: 106 | AH10: 竞技场 | AI10: rc_jjc | AJ10: 1 | AK10: 0 | AL10: 5
B11: 105 | C11: 神兽乐园 | D11: 30 | E11: 1 | F11: 1 | G11: 0 | H11: 0 | I11: 0 | J11: 0 | K11: 0 | L11: 0 | M11: 0 | N11: 0 | O11: 0 | P11: 0 | Q11: 0 | R11: 0 | S11: 0 | T11: =RC[-17] -> 神兽乐园 | U11: (nRoleLevel*35+20)/4 | V11: (nRoleLevel*28+16)/4 | W11: 0 | X11: 100,1000; | AA11: 35 | AB11: 20 | AG11: 107 | AH11: 宝图任务 | AI11: rc_btrw | AJ11: 1 | AK11: 0 | AL11: 0
B12: 110 | C12: 神魔志 | D12: 30 | E12: 1 | F12: 1 | G12: 0 | H12: 5 | I12: 0 | J12: 0 | K12: 0 | L12: 0 | M12: 0 | N12: 0 | O12: 0 | P12: 0 | Q12: 0 | R12: 0 | S12: 0 | T12: =RC[-17] -> 神魔志 | U12: 0 | V12: 0 | W12: 0 | X12: 0,0; | AG12: 108 | AH12: 赏金任务 | AI12: rc_sjrw | AJ12: 1 | AK12: 0 | AL12: 5
AG13: 109 | AH13: 试炼任务 | AI13: rc_slrw | AJ13: 1 | AK13: 0 | AL13: 0
AG14: 110 | AH14: 神魔志 | AI14: 0 | AJ14: 1 | AK14: 0 | AL14: 5
AG15: 111 | AH15: 青云轶事 | AI15: rc_zxys | AJ15: 1 | AK15: 0 | AL15: 10
AG16: 112 | AH16: 梦诛课堂 | AI16: rc_mzkt | AJ16: 1 | AK16: 0 | AL16: 10
AG17: 113 | AH17: 科举 | AI17: 0 | AJ17: 1 | AK17: 0 | AL17: 2
AG18: 114 | AH18: 八荒火阵 | AI18: rc_bhhz | AJ18: 1 | AK18: 0 | AL18: 1
AG19: 115 | AH19: 帮派任务 | AI19: rc_bprw | AJ19: 1 | AK19: 0 | AL19: 30
AG20: 116 | AH20: 妖兽突袭 | AI20: rc_ystx | AJ20: 1 | AK20: 0 | AL20: 30
AG21: 201 | AH21: 决战九霄 | AI21: rc_jzjx | AJ21: 2 | AK21: 0 | AL21: 9
AG22: 202 | AH22: 混沌试炼 | AI22: rc_hdsl | AJ22: 2 | AK22: 0 | AL22: 9
AG23: 203 | AH23: 梦诛无双 | AI23: rc_mzws | AJ23: 2 | AK23: 0 | AL23: 1
AG24: 1001 | AH24: 首席争霸 | AI24: rc_sxzb | AJ24: 2 | AK24: 0 | AL24: 0
AG25: 1002 | AH25: 七脉会武 | AI25: rc_qmhw | AJ25: 2 | AK25: 0 | AL25: 0
AG26: 1003 | AH26: 青云之战 | AI26: rc_qyzz | AJ26: 2 | AK26: 0 | AL26: 0
AG27: 1004 | AH27: 跨服帮战 | AI27: rc_kfbz | AJ27: 2 | AK27: 0 | AL27: 0

Sheet: Sheet4
R2: 67386875 | AF2: 比例 | AO2: 每次 | AX2: 每次比例
B3: 任务ID | C3: 任务名字 | D3: 玩家经验公式 | E3: 宠物经验公式 | F3: 每天最大次数 | I3: 系数 | J3: 基数 | L3: 等级 | M3: 经验 | N3: 总经验 | O3: 梦诛经验 | R3: 镇妖任务 | S3: 乱世妖魔 | T3: 心魔侵蚀 | U3: 决战九霄 | V3: 混沌试炼 | W3: 梦诛无双 | X3: 神兽乐园 | Y3: 神魔志 | AA3: 合计 | AB3: 1级需要几天 | AC3: 累计天 | AF3: 镇妖任务 | AG3: 乱世妖魔 | AH3: 心魔侵蚀 | AI3: 决战九霄 | AJ3: 混沌试炼 | AK3: 梦诛无双 | AL3: 神兽乐园 | AM3: 神魔志 | AO3: 镇妖任务 | AP3: 乱世妖魔 | AQ3: 心魔侵蚀 | AR3: 决战九霄 | AS3: 混沌试炼 | AT3: 梦诛无双 | AU3: 神兽乐园 | AV3: 神魔志 | AX3: 镇妖任务 | AY3: 乱世妖魔 | AZ3: 心魔侵蚀 | BA3: 决战九霄 | BB3: 混沌试炼 | BC3: 梦诛无双 | BD3: 神兽乐园 | BE3: 神魔志
B4: 104 | C4: 镇妖任务 | D4: (nRoleLevel*35+200)*(nCompCount+2)/4 | F4: =VLOOKUP(RC[-3],Sheet3!C34:C38,5,FALSE) -> 50 | G4: 6.85 | H4: =RC[1]&"*LV+"&RC[2] -> 35*LV+200 | I4: =35 -> 35 | J4: =200 -> 200 | L4: 1 | M4: 41 | N4: =SUM(R4C13:RC[-1]) -> 41 | R4: =(RC12*R4C9+R4C10)*R4C6*R4C7 -> 80487.5 | S4: =(RC12*R5C9+R5C10)*R5C6 -> 10000 | T4: =(RC12*R6C9+R6C10)*R6C6 -> 12720 | U4: =(RC12*R7C9+R7C10)*R7C6 -> 5670 | V4: =(RC12*R8C9+R8C10)*R8C6 -> 4500 | W4: =(RC12*R9C9+R9C10)*R9C6 -> 690 | X4: =(RC12*R10C9+R10C10)*R10C6 -> 0 | Y4: =(RC12*R11C9+R11C10)*R11C6 -> 5000 | AA4: =SUM(RC[-9]:RC[-2]) -> 119067.5 | AB4: =ROUND(RC[-15]/RC[-1],3) -> 0 | AC4: =SUM(R4C28:RC[-1]) -> 0 | AF4: =ROUND(RC[-14]/RC18,2) -> 1 | AG4: =ROUND(RC[-14]/RC18,2) -> 0.12 | AH4: =ROUND(RC[-14]/RC18,2) -> 0.16 | AI4: =ROUND(RC[-14]/RC18,2) -> 7.0000000000000007E-2 | AJ4: =ROUND(RC[-14]/RC18,2) -> 0.06 | AK4: =ROUND(RC[-14]/RC18,2) -> 0.01 | AL4: =ROUND(RC[-14]/RC18,2) -> 0 | AM4: =ROUND(RC[-14]/RC18,2) -> 0.06 | AO4: =RC[-23]/R4C6 -> 1609.75 | AP4: =RC[-23]/R5C6 -> 1000 | AQ4: =RC[-23]/R6C6 -> 6360 | AR4: =RC[-23]/R7C6 -> 630 | AS4: =RC[-23]/R8C6 -> 500 | AT4: =RC[-23]/R9C6 -> 690 | AV4: =RC[-23]/R11C6 -> 1000 | AX4: =RC[-9]/RC41 -> 1 | AY4: =RC[-9]/RC41 -> 0.62121447429725107 | AZ4: =RC[-9]/RC41 -> 3.9509240565305173 | BA4: =RC[-9]/RC41 -> 0.39136511880726821 | BB4: =RC[-9]/RC41 -> 0.31060723714862554 | BC4: =RC[-9]/RC41 -> 0.42863798726510327 | BD4: =RC[-9]/RC41 -> 0 | BE4: =RC[-9]/RC41 -> 0.62121447429725107
B5: 108 | C5: 乱世妖魔 | D5: (nRoleLevel*35+200)/4 | F5: =VLOOKUP(RC[-3],Sheet3!C34:C38,5,FALSE) -> 10 | H5: =RC[1]&"*LV+"&RC[2] -> 200*LV+800 | I5: 200 | J5: 800 | L5: 2 | M5: 140 | N5: =SUM(R4C13:RC[-1]) -> 181 | R5: =(RC12*R4C9+R4C10)*R4C6*R4C7 -> 92475 | S5: =(RC12*R5C9+R5C10)*R5C6 -> 12000 | T5: =(RC12*R6C9+R6C10)*R6C6 -> 13440 | U5: =(RC12*R7C9+R7C10)*R7C6 -> 7740 | V5: =(RC12*R8C9+R8C10)*R8C6 -> 6300 | W5: =(RC12*R9C9+R9C10)*R9C6 -> 880 | X5: =(RC12*R10C9+R10C10)*R10C6 -> 0 | Y5: =(RC12*R11C9+R11C10)*R11C6 -> 5000 | AA5: =SUM(RC[-9]:RC[-2]) -> 137835 | AB5: =ROUND(RC[-15]/RC[-1],3) -> 1E-3 | AC5: =SUM(R4C28:RC[-1]) -> 1E-3 | AF5: =ROUND(RC[-14]/RC18,2) -> 1 | AG5: =ROUND(RC[-14]/RC18,2) -> 0.13 | AH5: =ROUND(RC[-14]/RC18,2) -> 0.15 | AI5: =ROUND(RC[-14]/RC18,2) -> 0.08 | AJ5: =ROUND(RC[-14]/RC18,2) -> 7.0000000000000007E-2 | AK5: =ROUND(RC[-14]/RC18,2) -> 0.01 | AL5: =ROUND(RC[-14]/RC18,2) -> 0 | AM5: =ROUND(RC[-14]/RC18,2) -> 0.05 | AO5: =RC[-23]/R4C6 -> 1849.5 | AP5: =RC[-23]/R5C6 -> 1200 | AQ5: =RC[-23]/R6C6 -> 6720 | AR5: =RC[-23]/R7C6 -> 860 | AS5: =RC[-23]/R8C6 -> 700 | AT5: =RC[-23]/R9C6 -> 880 | AV5: =RC[-23]/R11C6 -> 1000 | AX5: =RC[-9]/RC41 -> 1 | AY5: =RC[-9]/RC41 -> 0.64882400648824001 | AZ5: =RC[-9]/RC41 -> 3.6334144363341445 | BA5: =RC[-9]/RC41 -> 0.46499053798323869 | BB5: =RC[-9]/RC41 -> 0.37848067045147338 | BC5: =RC[-9]/RC41 -> 0.47580427142470938 | BD5: =RC[-9]/RC41 -> 0 | BE5: =RC[-9]/RC41 -> 0.54068667207353338
B6: 101 | C6: 心魔侵蚀 | D6: nRoleLevel*360+6000 | F6: =VLOOKUP(RC[-3],Sheet3!C34:C38,5,FALSE) -> 2 | H6: =RC[1]&"*LV+"&RC[2] -> 360*LV+6000 | I6: 360 | J6: 6000 | L6: 3 | M6: 215 | N6: =SUM(R4C13:RC[-1]) -> 396 | R6: =(RC12*R4C9+R4C10)*R4C6*R4C7 -> 104462.5 | S6: =(RC12*R5C9+R5C10)*R5C6 -> 14000 | T6: =(RC12*R6C9+R6C10)*R6C6 -> 14160 | U6: =(RC12*R7C9+R7C10)*R7C6 -> 9810 | V6: =(RC12*R8C9+R8C10)*R8C6 -> 8100 | W6: =(RC12*R9C9+R9C10)*R9C6 -> 1070 | X6: =(RC12*R10C9+R10C10)*R10C6 -> 0 | Y6: =(RC12*R11C9+R11C10)*R11C6 -> 5000 | AA6: =SUM(RC[-9]:RC[-2]) -> 156602.5 | AB6: =ROUND(RC[-15]/RC[-1],3) -> 1E-3 | AC6: =SUM(R4C28:RC[-1]) -> 2E-3 | AF6: =ROUND(RC[-14]/RC18,2) -> 1 | AG6: =ROUND(RC[-14]/RC18,2) -> 0.13 | AH6: =ROUND(RC[-14]/RC18,2) -> 0.14000000000000001 | AI6: =ROUND(RC[-14]/RC18,2) -> 0.09 | AJ6: =ROUND(RC[-14]/RC18,2) -> 0.08 | AK6: =ROUND(RC[-14]/RC18,2) -> 0.01 | AL6: =ROUND(RC[-14]/RC18,2) -> 0 | AM6: =ROUND(RC[-14]/RC18,2) -> 0.05 | AO6: =RC[-23]/R4C6 -> 2089.25 | AP6: =RC[-23]/R5C6 -> 1400 | AQ6: =RC[-23]/R6C6 -> 7080 | AR6: =RC[-23]/R7C6 -> 1090 | AS6: =RC[-23]/R8C6 -> 900 | AT6: =RC[-23]/R9C6 -> 1070 | AV6: =RC[-23]/R11C6 -> 1000 | AX6: =RC[-9]/RC41 -> 1 | AY6: =RC[-9]/RC41 -> 0.67009692473375615 | AZ6: =RC[-9]/RC41 -> 3.3887758765107097 | BA6: =RC[-9]/RC41 -> 0.5217183199712816 | BB6: =RC[-9]/RC41 -> 0.43077659447170036 | BC6: =RC[-9]/RC41 -> 0.51214550676079929 | BD6: =RC[-9]/RC41 -> 0 | BE6: =RC[-9]/RC41 -> 0.47864066052411153
B7: 4 | C7: 决战九霄 | D7: nRoleLevel*150+500 | F7: =VLOOKUP(RC[-3],Sheet3!C34:C38,5,FALSE) -> 9 | H7: =RC[1]&"*LV+"&RC[2] -> 230*LV+400 | I7: 230 | J7: 400 | L7: 4 | M7: 273 | N7: =SUM(R4C13:RC[-1]) -> 669 | R7: =(RC12*R4C9+R4C10)*R4C6*R4C7 -> 116450 | S7: =(RC12*R5C9+R5C10)*R5C6 -> 16000 | T7: =(RC12*R6C9+R6C10)*R6C6 -> 14880 | U7: =(RC12*R7C9+R7C10)*R7C6 -> 11880 | V7: =(RC12*R8C9+R8C10)*R8C6 -> 9900 | W7: =(RC12*R9C9+R9C10)*R9C6 -> 1260 | X7: =(RC12*R10C9+R10C10)*R10C6 -> 0 | Y7: =(RC12*R11C9+R11C10)*R11C6 -> 5000 | AA7: =SUM(RC[-9]:RC[-2]) -> 175370 | AB7: =ROUND(RC[-15]/RC[-1],3) -> 2E-3 | AC7: =SUM(R4C28:RC[-1]) -> 4.0000000000000001E-3 | AF7: =ROUND(RC[-14]/RC18,2) -> 1 | AG7: =ROUND(RC[-14]/RC18,2) -> 0.14000000000000001 | AH7: =ROUND(RC[-14]/RC18,2) -> 0.13 | AI7: =ROUND(RC[-14]/RC18,2) -> 0.1 | AJ7: =ROUND(RC[-14]/RC18,2) -> 0.09 | AK7: =ROUND(RC[-14]/RC18,2) -> 0.01 | AL7: =ROUND(RC[-14]/RC18,2) -> 0 | AM7: =ROUND(RC[-14]/RC18,2) -> 0.04 | AO7: =RC[-23]/R4C6 -> 2329 | AP7: =RC[-23]/R5C6 -> 1600 | AQ7: =RC[-23]/R6C6 -> 7440 | AR7: =RC[-23]/R7C6 -> 1320 | AS7: =RC[-23]/R8C6 -> 1100 | AT7: =RC[-23]/R9C6 -> 1260 | AV7: =RC[-23]/R11C6 -> 1000 | AX7: =RC[-9]/RC41 -> 1 | AY7: =RC[-9]/RC41 -> 0.68699012451696007 | AZ7: =RC[-9]/RC41 -> 3.1945040790038641 | BA7: =RC[-9]/RC41 -> 0.56676685272649208 | BB7: =RC[-9]/RC41 -> 0.47230571060541005 | BC7: =RC[-9]/RC41 -> 0.54100472305710601 | BD7: =RC[-9]/RC41 -> 0 | BE7: =RC[-9]/RC41 -> 0.42936882782310004
B8: 5 | C8: 混沌试炼 | D8: nRoleLevel*150+500 | F8: =VLOOKUP(RC[-3],Sheet3!C34:C38,5,FALSE) -> 9 | H8: =RC[1]&"*LV+"&RC[2] -> 200*LV+300 | I8: 200 | J8: 300 | L8: 5 | M8: 323 | N8: =SUM(R4C13:RC[-1]) -> 992 | R8: =(RC12*R4C9+R4C10)*R4C6*R4C7 -> 128437.5 | S8: =(RC12*R5C9+R5C10)*R5C6 -> 18000 | T8: =(RC12*R6C9+R6C10)*R6C6 -> 15600 | U8: =(RC12*R7C9+R7C10)*R7C6 -> 13950 | V8: =(RC12*R8C9+R8C10)*R8C6 -> 11700 | W8: =(RC12*R9C9+R9C10)*R9C6 -> 1450 | X8: =(RC12*R10C9+R10C10)*R10C6 -> 0 | Y8: =(RC12*R11C9+R11C10)*R11C6 -> 5000 | AA8: =SUM(RC[-9]:RC[-2]) -> 194137.5 | AB8: =ROUND(RC[-15]/RC[-1],3) -> 2E-3 | AC8: =SUM(R4C28:RC[-1]) -> 6.0000000000000001E-3 | AF8: =ROUND(RC[-14]/RC18,2) -> 1 | AG8: =ROUND(RC[-14]/RC18,2) -> 0.14000000000000001 | AH8: =ROUND(RC[-14]/RC18,2) -> 0.12 | AI8: =ROUND(RC[-14]/RC18,2) -> 0.11 | AJ8: =ROUND(RC[-14]/RC18,2) -> 0.09 | AK8: =ROUND(RC[-14]/RC18,2) -> 0.01 | AL8: =ROUND(RC[-14]/RC18,2) -> 0 | AM8: =ROUND(RC[-14]/RC18,2) -> 0.04 | AO8: =RC[-23]/R4C6 -> 2568.75 | AP8: =RC[-23]/R5C6 -> 1800 | AQ8: =RC[-23]/R6C6 -> 7800 | AR8: =RC[-23]/R7C6 -> 1550 | AS8: =RC[-23]/R8C6 -> 1300 | AT8: =RC[-23]/R9C6 -> 1450 | AV8: =RC[-23]/R11C6 -> 1000 | AX8: =RC[-9]/RC41 -> 1 | AY8: =RC[-9]/RC41 -> 0.7007299270072993 | AZ8: =RC[-9]/RC41 -> 3.0364963503649633 | BA8: =RC[-9]/RC41 -> 0.6034063260340633 | BB8: =RC[-9]/RC41 -> 0.5060827250608273 | BC8: =RC[-9]/RC41 -> 0.56447688564476883 | BD8: =RC[-9]/RC41 -> 0 | BE8: =RC[-9]/RC41 -> 0.38929440389294406
B9: 6 | C9: 梦诛无双 | D9: (nRoleLevel*150+500)*(1+MaxCount/99) | F9: =VLOOKUP(RC[-3],Sheet3!C34:C38,5,FALSE) -> 1 | H9: =RC[1]&"*LV+"&RC[2] -> 190*LV+500 | I9: 190 | J9: 500 | L9: 6 | M9: 371 | N9: =SUM(R4C13:RC[-1]) -> 1363 | R9: =(RC12*R4C9+R4C10)*R4C6*R4C7 -> 140425 | S9: =(RC12*R5C9+R5C10)*R5C6 -> 20000 | T9: =(RC12*R6C9+R6C10)*R6C6 -> 16320 | U9: =(RC12*R7C9+R7C10)*R7C6 -> 16020 | V9: =(RC12*R8C9+R8C10)*R8C6 -> 13500 | W9: =(RC12*R9C9+R9C10)*R9C6 -> 1640 | X9: =(RC12*R10C9+R10C10)*R10C6 -> 0 | Y9: =(RC12*R11C9+R11C10)*R11C6 -> 5000 | AA9: =SUM(RC[-9]:RC[-2]) -> 212905 | AB9: =ROUND(RC[-15]/RC[-1],3) -> 2E-3 | AC9: =SUM(R4C28:RC[-1]) -> 8.0000000000000002E-3 | AF9: =ROUND(RC[-14]/RC18,2) -> 1 | AG9: =ROUND(RC[-14]/RC18,2) -> 0.14000000000000001 | AH9: =ROUND(RC[-14]/RC18,2) -> 0.12 | AI9: =ROUND(RC[-14]/RC18,2) -> 0.11 | AJ9: =ROUND(RC[-14]/RC18,2) -> 0.1 | AK9: =ROUND(RC[-14]/RC18,2) -> 0.01 | AL9: =ROUND(RC[-14]/RC18,2) -> 0 | AM9: =ROUND(RC[-14]/RC18,2) -> 0.04 | AO9: =RC[-23]/R4C6 -> 2808.5 | AP9: =RC[-23]/R5C6 -> 2000 | AQ9: =RC[-23]/R6C6 -> 8160 | AR9: =RC[-23]/R7C6 -> 1780 | AS9: =RC[-23]/R8C6 -> 1500 | AT9: =RC[-23]/R9C6 -> 1640 | AV9: =RC[-23]/R11C6 -> 1000 | AX9: =RC[-9]/RC41 -> 1 | AY9: =RC[-9]/RC41 -> 0.7121239095602635 | AZ9: =RC[-9]/RC41 -> 2.9054655510058751 | BA9: =RC[-9]/RC41 -> 0.63379027950863454 | BB9: =RC[-9]/RC41 -> 0.5340929321701976 | BC9: =RC[-9]/RC41 -> 0.58394160583941601 | BD9: =RC[-9]/RC41 -> 0 | BE9: =RC[-9]/RC41 -> 0.35606195478013175
B10: 102 | C10: 神兽乐园 | D10: (nRoleLevel*35+20)/4 | F10: =VLOOKUP(RC[-3],Sheet3!C34:C38,5,FALSE) -> 0 | H10: =RC[1]&"*LV+"&RC[2] -> 100*LV+500 | I10: 100 | J10: 500 | L10: 7 | M10: 426 | N10: =SUM(R4C13:RC[-1]) -> 1789 | R10: =(RC12*R4C9+R4C10)*R4C6*R4C7 -> 152412.5 | S10: =(RC12*R5C9+R5C10)*R5C6 -> 22000 | T10: =(RC12*R6C9+R6C10)*R6C6 -> 17040 | U10: =(RC12*R7C9+R7C10)*R7C6 -> 18090 | V10: =(RC12*R8C9+R8C10)*R8C6 -> 15300 | W10: =(RC12*R9C9+R9C10)*R9C6 -> 1830 | X10: =(RC12*R10C9+R10C10)*R10C6 -> 0 | Y10: =(RC12*R11C9+R11C10)*R11C6 -> 5000 | AA10: =SUM(RC[-9]:RC[-2]) -> 231672.5 | AB10: =ROUND(RC[-15]/RC[-1],3) -> 2E-3 | AC10: =SUM(R4C28:RC[-1]) -> 0.01 | AF10: =ROUND(RC[-14]/RC18,2) -> 1 | AG10: =ROUND(RC[-14]/RC18,2) -> 0.14000000000000001 | AH10: =ROUND(RC[-14]/RC18,2) -> 0.11 | AI10: =ROUND(RC[-14]/RC18,2) -> 0.12 | AJ10: =ROUND(RC[-14]/RC18,2) -> 0.1 | AK10: =ROUND(RC[-14]/RC18,2) -> 0.01 | AL10: =ROUND(RC[-14]/RC18,2) -> 0 | AM10: =ROUND(RC[-14]/RC18,2) -> 0.03 | AO10: =RC[-23]/R4C6 -> 3048.25 | AP10: =RC[-23]/R5C6 -> 2200 | AQ10: =RC[-23]/R6C6 -> 8520 | AR10: =RC[-23]/R7C6 -> 2010 | AS10: =RC[-23]/R8C6 -> 1700 | AT10: =RC[-23]/R9C6 -> 1830 | AV10: =RC[-23]/R11C6 -> 1000 | AX10: =RC[-9]/RC41 -> 1 | AY10: =RC[-9]/RC41 -> 0.72172558025096367 | AZ10: =RC[-9]/RC41 -> 2.7950463380628228 | BA10: =RC[-9]/RC41 -> 0.65939473468383503 | BB10: =RC[-9]/RC41 -> 0.55769703928483561 | BC10: =RC[-9]/RC41 -> 0.60034445993602892 | BD10: =RC[-9]/RC41 -> 0 | BE10: =RC[-9]/RC41 -> 0.32805708193225619
B11: 103 | C11: 神魔志 | D11: 0 | F11: =VLOOKUP(RC[-3],Sheet3!C34:C38,5,FALSE) -> 5 | H11: =RC[1]&"*LV+"&RC[2] -> 0*LV+1000 | I11: 0 | J11: 1000 | L11: 8 | M11: 496 | N11: =SUM(R4C13:RC[-1]) -> 2285 | R11: =(RC12*R4C9+R4C10)*R4C6*R4C7 -> 164400 | S11: =(RC12*R5C9+R5C10)*R5C6 -> 24000 | T11: =(RC12*R6C9+R6C10)*R6C6 -> 17760 | U11: =(RC12*R7C9+R7C10)*R7C6 -> 20160 | V11: =(RC12*R8C9+R8C10)*R8C6 -> 17100 | W11: =(RC12*R9C9+R9C10)*R9C6 -> 2020 | X11: =(RC12*R10C9+R10C10)*R10C6 -> 0 | Y11: =(RC12*R11C9+R11C10)*R11C6 -> 5000 | AA11: =SUM(RC[-9]:RC[-2]) -> 250440 | AB11: =ROUND(RC[-15]/RC[-1],3) -> 2E-3 | AC11: =SUM(R4C28:RC[-1]) -> 1.2E-2 | AF11: =ROUND(RC[-14]/RC18,2) -> 1 | AG11: =ROUND(RC[-14]/RC18,2) -> 0.15 | AH11: =ROUND(RC[-14]/RC18,2) -> 0.11 | AI11: =ROUND(RC[-14]/RC18,2) -> 0.12 | AJ11: =ROUND(RC[-14]/RC18,2) -> 0.1 | AK11: =ROUND(RC[-14]/RC18,2) -> 0.01 | AL11: =ROUND(RC[-14]/RC18,2) -> 0 | AM11: =ROUND(RC[-14]/RC18,2) -> 0.03 | AO11: =RC[-23]/R4C6 -> 3288 | AP11: =RC[-23]/R5C6 -> 2400 | AQ11: =RC[-23]/R6C6 -> 8880 | AR11: =RC[-23]/R7C6 -> 2240 | AS11: =RC[-23]/R8C6 -> 1900 | AT11: =RC[-23]/R9C6 -> 2020 | AV11: =RC[-23]/R11C6 -> 1000 | AX11: =RC[-9]/RC41 -> 1 | AY11: =RC[-9]/RC41 -> 0.72992700729927007 | AZ11: =RC[-9]/RC41 -> 2.7007299270072993 | BA11: =RC[-9]/RC41 -> 0.68126520681265201 | BB11: =RC[-9]/RC41 -> 0.57785888077858882 | BC11: =RC[-9]/RC41 -> 0.61435523114355228 | BD11: =RC[-9]/RC41 -> 0 | BE11: =RC[-9]/RC41 -> 0.30413625304136255
L12: 9 | M12: 588 | N12: =SUM(R4C13:RC[-1]) -> 2873 | R12: =(RC12*R4C9+R4C10)*R4C6*R4C7 -> 176387.5 | S12: =(RC12*R5C9+R5C10)*R5C6 -> 26000 | T12: =(RC12*R6C9+R6C10)*R6C6 -> 18480 | U12: =(RC12*R7C9+R7C10)*R7C6 -> 22230 | V12: =(RC12*R8C9+R8C10)*R8C6 -> 18900 | W12: =(RC12*R9C9+R9C10)*R9C6 -> 2210 | X12: =(RC12*R10C9+R10C10)*R10C6 -> 0 | Y12: =(RC12*R11C9+R11C10)*R11C6 -> 5000 | AA12: =SUM(RC[-9]:RC[-2]) -> 269207.5 | AB12: =ROUND(RC[-15]/RC[-1],3) -> 2E-3 | AC12: =SUM(R4C28:RC[-1]) -> 1.4E-2 | AF12: =ROUND(RC[-14]/RC18,2) -> 1 | AG12: =ROUND(RC[-14]/RC18,2) -> 0.15 | AH12: =ROUND(RC[-14]/RC18,2) -> 0.1 | AI12: =ROUND(RC[-14]/RC18,2) -> 0.13 | AJ12: =ROUND(RC[-14]/RC18,2) -> 0.11 | AK12: =ROUND(RC[-14]/RC18,2) -> 0.01 | AL12: =ROUND(RC[-14]/RC18,2) -> 0 | AM12: =ROUND(RC[-14]/RC18,2) -> 0.03 | AO12: =RC[-23]/R4C6 -> 3527.75 | AP12: =RC[-23]/R5C6 -> 2600 | AQ12: =RC[-23]/R6C6 -> 9240 | AR12: =RC[-23]/R7C6 -> 2470 | AS12: =RC[-23]/R8C6 -> 2100 | AT12: =RC[-23]/R9C6 -> 2210 | AV12: =RC[-23]/R11C6 -> 1000 | AX12: =RC[-9]/RC41 -> 1 | AY12: =RC[-9]/RC41 -> 0.73701367727304934 | AZ12: =RC[-9]/RC41 -> 2.619233222308837 | BA12: =RC[-9]/RC41 -> 0.70016299340939692 | BB12: =RC[-9]/RC41 -> 0.59528027779746295 | BC12: =RC[-9]/RC41 -> 0.62646162568209196 | BD12: =RC[-9]/RC41 -> 0 | BE12: =RC[-9]/RC41 -> 0.28346679895117283
L13: 10 | M13: 710 | N13: =SUM(R4C13:RC[-1]) -> 3583 | R13: =(RC12*R4C9+R4C10)*R4C6*R4C7 -> 188375 | S13: =(RC12*R5C9+R5C10)*R5C6 -> 28000 | T13: =(RC12*R6C9+R6C10)*R6C6 -> 19200 | U13: =(RC12*R7C9+R7C10)*R7C6 -> 24300 | V13: =(RC12*R8C9+R8C10)*R8C6 -> 20700 | W13: =(RC12*R9C9+R9C10)*R9C6 -> 2400 | X13: =(RC12*R10C9+R10C10)*R10C6 -> 0 | Y13: =(RC12*R11C9+R11C10)*R11C6 -> 5000 | AA13: =SUM(RC[-9]:RC[-2]) -> 287975 | AB13: =ROUND(RC[-15]/RC[-1],3) -> 2E-3 | AC13: =SUM(R4C28:RC[-1]) -> 1.6E-2 | AF13: =ROUND(RC[-14]/RC18,2) -> 1 | AG13: =ROUND(RC[-14]/RC18,2) -> 0.15 | AH13: =ROUND(RC[-14]/RC18,2) -> 0.1 | AI13: =ROUND(RC[-14]/RC18,2) -> 0.13 | AJ13: =ROUND(RC[-14]/RC18,2) -> 0.11 | AK13: =ROUND(RC[-14]/RC18,2) -> 0.01 | AL13: =ROUND(RC[-14]/RC18,2) -> 0 | AM13: =ROUND(RC[-14]/RC18,2) -> 0.03 | AO13: =RC[-23]/R4C6 -> 3767.5 | AP13: =RC[-23]/R5C6 -> 2800 | AQ13: =RC[-23]/R6C6 -> 9600 | AR13: =RC[-23]/R7C6 -> 2700 | AS13: =RC[-23]/R8C6 -> 2300 | AT13: =RC[-23]/R9C6 -> 2400 | AV13: =RC[-23]/R11C6 -> 1000 | AX13: =RC[-9]/RC41 -> 1 | AY13: =RC[-9]/RC41 -> 0.74319840743198406 | AZ13: =RC[-9]/RC41 -> 2.5481088254810884 | BA13: =RC[-9]/RC41 -> 0.71665560716655607 | BB13: =RC[-9]/RC41 -> 0.61048440610484411 | BC13: =RC[-9]/RC41 -> 0.6370272063702721 | BD13: =RC[-9]/RC41 -> 0 | BE13: =RC[-9]/RC41 -> 0.26542800265428002
L14: 11 | M14: 870 | N14: =SUM(R4C13:RC[-1]) -> 4453 | R14: =(RC12*R4C9+R4C10)*R4C6*R4C7 -> 200362.5 | S14: =(RC12*R5C9+R5C10)*R5C6 -> 30000 | T14: =(RC12*R6C9+R6C10)*R6C6 -> 19920 | U14: =(RC12*R7C9+R7C10)*R7C6 -> 26370 | V14: =(RC12*R8C9+R8C10)*R8C6 -> 22500 | W14: =(RC12*R9C9+R9C10)*R9C6 -> 2590 | X14: =(RC12*R10C9+R10C10)*R10C6 -> 0 | Y14: =(RC12*R11C9+R11C10)*R11C6 -> 5000 | AA14: =SUM(RC[-9]:RC[-2]) -> 306742.5 | AB14: =ROUND(RC[-15]/RC[-1],3) -> 3.0000000000000001E-3 | AC14: =SUM(R4C28:RC[-1]) -> 1.9E-2 | AF14: =ROUND(RC[-14]/RC18,2) -> 1 | AG14: =ROUND(RC[-14]/RC18,2) -> 0.15 | AH14: =ROUND(RC[-14]/RC18,2) -> 0.1 | AI14: =ROUND(RC[-14]/RC18,2) -> 0.13 | AJ14: =ROUND(RC[-14]/RC18,2) -> 0.11 | AK14: =ROUND(RC[-14]/RC18,2) -> 0.01 | AL14: =ROUND(RC[-14]/RC18,2) -> 0 | AM14: =ROUND(RC[-14]/RC18,2) -> 0.02 | AO14: =RC[-23]/R4C6 -> 4007.25 | AP14: =RC[-23]/R5C6 -> 3000 | AQ14: =RC[-23]/R6C6 -> 9960 | AR14: =RC[-23]/R7C6 -> 2930 | AS14: =RC[-23]/R8C6 -> 2500 | AT14: =RC[-23]/R9C6 -> 2590 | AV14: =RC[-23]/R11C6 -> 1000 | AX14: =RC[-9]/RC41 -> 1 | AY14: =RC[-9]/RC41 -> 0.74864308440950778 | AZ14: =RC[-9]/RC41 -> 2.4854950402395657 | BA14: =RC[-9]/RC41 -> 0.73117474577328589 | BB14: =RC[-9]/RC41 -> 0.62386923700792318 | BC14: =RC[-9]/RC41 -> 0.64632852954020836 | BD14: =RC[-9]/RC41 -> 0 | BE14: =RC[-9]/RC41 -> 0.24954769480316927
L15: 12 | M15: 1076 | N15: =SUM(R4C13:RC[-1]) -> 5529 | R15: =(RC12*R4C9+R4C10)*R4C6*R4C7 -> 212350 | S15: =(RC12*R5C9+R5C10)*R5C6 -> 32000 | T15: =(RC12*R6C9+R6C10)*R6C6 -> 20640 | U15: =(RC12*R7C9+R7C10)*R7C6 -> 28440 | V15: =(RC12*R8C9+R8C10)*R8C6 -> 24300 | W15: =(RC12*R9C9+R9C10)*R9C6 -> 2780 | X15: =(RC12*R10C9+R10C10)*R10C6 -> 0 | Y15: =(RC12*R11C9+R11C10)*R11C6 -> 5000 | AA15: =SUM(RC[-9]:RC[-2]) -> 325510 | AB15: =ROUND(RC[-15]/RC[-1],3) -> 3.0000000000000001E-3 | AC15: =SUM(R4C28:RC[-1]) -> 2.1999999999999999E-2 | AF15: =ROUND(RC[-14]/RC18,2) -> 1 | AG15: =ROUND(RC[-14]/RC18,2) -> 0.15 | AH15: =ROUND(RC[-14]/RC18,2) -> 0.1 | AI15: =ROUND(RC[-14]/RC18,2) -> 0.13 | AJ15: =ROUND(RC[-14]/RC18,2) -> 0.11 | AK15: =ROUND(RC[-14]/RC18,2) -> 0.01 | AL15: =ROUND(RC[-14]/RC18,2) -> 0 | AM15: =ROUND(RC[-14]/RC18,2) -> 0.02 | AO15: =RC[-23]/R4C6 -> 4247 | AP15: =RC[-23]/R5C6 -> 3200 | AQ15: =RC[-23]/R6C6 -> 10320 | AR15: =RC[-23]/R7C6 -> 3160 | AS15: =RC[-23]/R8C6 -> 2700 | AT15: =RC[-23]/R9C6 -> 2780 | AV15: =RC[-23]/R11C6 -> 1000 | AX15: =RC[-9]/RC41 -> 1 | AY15: =RC[-9]/RC41 -> 0.7534730397927949 | AZ15: =RC[-9]/RC41 -> 2.4299505533317638 | BA15: =RC[-9]/RC41 -> 0.74405462679538503 | BB15: =RC[-9]/RC41 -> 0.63574287732517076 | BC15: =RC[-9]/RC41 -> 0.6545797033199906 | BD15: =RC[-9]/RC41 -> 0 | BE15: =RC[-9]/RC41 -> 0.23546032493524841
L16: 13 | M16: 1336 | N16: =SUM(R4C13:RC[-1]) -> 6865 | R16: =(RC12*R4C9+R4C10)*R4C6*R4C7 -> 224337.5 | S16: =(RC12*R5C9+R5C10)*R5C6 -> 34000 | T16: =(RC12*R6C9+R6C10)*R6C6 -> 21360 | U16: =(RC12*R7C9+R7C10)*R7C6 -> 30510 | V16: =(RC12*R8C9+R8C10)*R8C6 -> 26100 | W16: =(RC12*R9C9+R9C10)*R9C6 -> 2970 | X16: =(RC12*R10C9+R10C10)*R10C6 -> 0 | Y16: =(RC12*R11C9+R11C10)*R11C6 -> 5000 | AA16: =SUM(RC[-9]:RC[-2]) -> 344277.5 | AB16: =ROUND(RC[-15]/RC[-1],3) -> 4.0000000000000001E-3 | AC16: =SUM(R4C28:RC[-1]) -> 2.5999999999999999E-2 | AF16: =ROUND(RC[-14]/RC18,2) -> 1 | AG16: =ROUND(RC[-14]/RC18,2) -> 0.15 | AH16: =ROUND(RC[-14]/RC18,2) -> 0.1 | AI16: =ROUND(RC[-14]/RC18,2) -> 0.14000000000000001 | AJ16: =ROUND(RC[-14]/RC18,2) -> 0.12 | AK16: =ROUND(RC[-14]/RC18,2) -> 0.01 | AL16: =ROUND(RC[-14]/RC18,2) -> 0 | AM16: =ROUND(RC[-14]/RC18,2) -> 0.02 | AO16: =RC[-23]/R4C6 -> 4486.75 | AP16: =RC[-23]/R5C6 -> 3400 | AQ16: =RC[-23]/R6C6 -> 10680 | AR16: =RC[-23]/R7C6 -> 3390 | AS16: =RC[-23]/R8C6 -> 2900 | AT16: =RC[-23]/R9C6 -> 2970 | AV16: =RC[-23]/R11C6 -> 1000 | AX16: =RC[-9]/RC41 -> 1 | AY16: =RC[-9]/RC41 -> 0.7577868167381735 | AZ16: =RC[-9]/RC41 -> 2.3803421184599096 | BA16: =RC[-9]/RC41 -> 0.75555803198306126 | BB16: =RC[-9]/RC41 -> 0.64634757898255979 | BC16: =RC[-9]/RC41 -> 0.66194907226834565 | BD16: =RC[-9]/RC41 -> 0 | BE16: =RC[-9]/RC41 -> 0.2228784755112275
L17: 14 | M17: 1657 | N17: =SUM(R4C13:RC[-1]) -> 8522 | R17: =(RC12*R4C9+R4C10)*R4C6*R4C7 -> 236325 | S17: =(RC12*R5C9+R5C10)*R5C6 -> 36000 | T17: =(RC12*R6C9+R6C10)*R6C6 -> 22080 | U17: =(RC12*R7C9+R7C10)*R7C6 -> 32580 | V17: =(RC12*R8C9+R8C10)*R8C6 -> 27900 | W17: =(RC12*R9C9+R9C10)*R9C6 -> 3160 | X17: =(RC12*R10C9+R10C10)*R10C6 -> 0 | Y17: =(RC12*R11C9+R11C10)*R11C6 -> 5000 | AA17: =SUM(RC[-9]:RC[-2]) -> 363045 | AB17: =ROUND(RC[-15]/RC[-1],3) -> 5.0000000000000001E-3 | AC17: =SUM(R4C28:RC[-1]) -> 3.1E-2 | AF17: =ROUND(RC[-14]/RC18,2) -> 1 | AG17: =ROUND(RC[-14]/RC18,2) -> 0.15 | AH17: =ROUND(RC[-14]/RC18,2) -> 0.09 | AI17: =ROUND(RC[-14]/RC18,2) -> 0.14000000000000001 | AJ17: =ROUND(RC[-14]/RC18,2) -> 0.12 | AK17: =ROUND(RC[-14]/RC18,2) -> 0.01 | AL17: =ROUND(RC[-14]/RC18,2) -> 0 | AM17: =ROUND(RC[-14]/RC18,2) -> 0.02 | AO17: =RC[-23]/R4C6 -> 4726.5 | AP17: =RC[-23]/R5C6 -> 3600 | AQ17: =RC[-23]/R6C6 -> 11040 | AR17: =RC[-23]/R7C6 -> 3620 | AS17: =RC[-23]/R8C6 -> 3100 | AT17: =RC[-23]/R9C6 -> 3160 | AV17: =RC[-23]/R11C6 -> 1000 | AX17: =RC[-9]/RC41 -> 1 | AY17: =RC[-9]/RC41 -> 0.76166296413836876 | AZ17: =RC[-9]/RC41 -> 2.335766423357664 | BA17: =RC[-9]/RC41 -> 0.76589442505024863 | BB17: =RC[-9]/RC41 -> 0.65587644134137313 | BC17: =RC[-9]/RC41 -> 0.66857082407701263 | BD17: =RC[-9]/RC41 -> 0 | BE17: =RC[-9]/RC41 -> 0.21157304559399132
L18: 15 | M18: 2048 | N18: =SUM(R4C13:RC[-1]) -> 10570 | R18: =(RC12*R4C9+R4C10)*R4C6*R4C7 -> 248312.5 | S18: =(RC12*R5C9+R5C10)*R5C6 -> 38000 | T18: =(RC12*R6C9+R6C10)*R6C6 -> 22800 | U18: =(RC12*R7C9+R7C10)*R7C6 -> 34650 | V18: =(RC12*R8C9+R8C10)*R8C6 -> 29700 | W18: =(RC12*R9C9+R9C10)*R9C6 -> 3350 | X18: =(RC12*R10C9+R10C10)*R10C6 -> 0 | Y18: =(RC12*R11C9+R11C10)*R11C6 -> 5000 | AA18: =SUM(RC[-9]:RC[-2]) -> 381812.5 | AB18: =ROUND(RC[-15]/RC[-1],3) -> 5.0000000000000001E-3 | AC18: =SUM(R4C28:RC[-1]) -> 3.5999999999999997E-2 | AF18: =ROUND(RC[-14]/RC18,2) -> 1 | AG18: =ROUND(RC[-14]/RC18,2) -> 0.15 | AH18: =ROUND(RC[-14]/RC18,2) -> 0.09 | AI18: =ROUND(RC[-14]/RC18,2) -> 0.14000000000000001 | AJ18: =ROUND(RC[-14]/RC18,2) -> 0.12 | AK18: =ROUND(RC[-14]/RC18,2) -> 0.01 | AL18: =ROUND(RC[-14]/RC18,2) -> 0 | AM18: =ROUND(RC[-14]/RC18,2) -> 0.02 | AO18: =RC[-23]/R4C6 -> 4966.25 | AP18: =RC[-23]/R5C6 -> 3800 | AQ18: =RC[-23]/R6C6 -> 11400 | AR18: =RC[-23]/R7C6 -> 3850 | AS18: =RC[-23]/R8C6 -> 3300 | AT18: =RC[-23]/R9C6 -> 3350 | AV18: =RC[-23]/R11C6 -> 1000 | AX18: =RC[-9]/RC41 -> 1 | AY18: =RC[-9]/RC41 -> 0.76516486282406238 | AZ18: =RC[-9]/RC41 -> 2.2954945884721871 | BA18: =RC[-9]/RC41 -> 0.77523282154543172 | BB18: =RC[-9]/RC41 -> 0.66448527561036996 | BC18: =RC[-9]/RC41 -> 0.67455323433173919 | BD18: =RC[-9]/RC41 -> 0 | BE18: =RC[-9]/RC41 -> 0.20135917442738485
L19: 16 | M19: 2515 | N19: =SUM(R4C13:RC[-1]) -> 13085 | R19: =(RC12*R4C9+R4C10)*R4C6*R4C7 -> 260300 | S19: =(RC12*R5C9+R5C10)*R5C6 -> 40000 | T19: =(RC12*R6C9+R6C10)*R6C6 -> 23520 | U19: =(RC12*R7C9+R7C10)*R7C6 -> 36720 | V19: =(RC12*R8C9+R8C10)*R8C6 -> 31500 | W19: =(RC12*R9C9+R9C10)*R9C6 -> 3540 | X19: =(RC12*R10C9+R10C10)*R10C6 -> 0 | Y19: =(RC12*R11C9+R11C10)*R11C6 -> 5000 | AA19: =SUM(RC[-9]:RC[-2]) -> 400580 | AB19: =ROUND(RC[-15]/RC[-1],3) -> 6.0000000000000001E-3 | AC19: =SUM(R4C28:RC[-1]) -> 4.1999999999999996E-2 | AF19: =ROUND(RC[-14]/RC18,2) -> 1 | AG19: =ROUND(RC[-14]/RC18,2) -> 0.15 | AH19: =ROUND(RC[-14]/RC18,2) -> 0.09 | AI19: =ROUND(RC[-14]/RC18,2) -> 0.14000000000000001 | AJ19: =ROUND(RC[-14]/RC18,2) -> 0.12 | AK19: =ROUND(RC[-14]/RC18,2) -> 0.01 | AL19: =ROUND(RC[-14]/RC18,2) -> 0 | AM19: =ROUND(RC[-14]/RC18,2) -> 0.02 | AO19: =RC[-23]/R4C6 -> 5206 | AP19: =RC[-23]/R5C6 -> 4000 | AQ19: =RC[-23]/R6C6 -> 11760 | AR19: =RC[-23]/R7C6 -> 4080 | AS19: =RC[-23]/R8C6 -> 3500 | AT19: =RC[-23]/R9C6 -> 3540 | AV19: =RC[-23]/R11C6 -> 1000 | AX19: =RC[-9]/RC41 -> 1 | AY19: =RC[-9]/RC41 -> 0.76834421820975796 | AZ19: =RC[-9]/RC41 -> 2.2589320015366883 | BA19: =RC[-9]/RC41 -> 0.78371110257395316 | BB19: =RC[-9]/RC41 -> 0.67230119093353824 | BC19: =RC[-9]/RC41 -> 0.67998463311563584 | BD19: =RC[-9]/RC41 -> 0 | BE19: =RC[-9]/RC41 -> 0.19208605455243949
L20: 17 | M20: 3067 | N20: =SUM(R4C13:RC[-1]) -> 16152 | R20: =(RC12*R4C9+R4C10)*R4C6*R4C7 -> 272287.5 | S20: =(RC12*R5C9+R5C10)*R5C6 -> 42000 | T20: =(RC12*R6C9+R6C10)*R6C6 -> 24240 | U20: =(RC12*R7C9+R7C10)*R7C6 -> 38790 | V20: =(RC12*R8C9+R8C10)*R8C6 -> 33300 | W20: =(RC12*R9C9+R9C10)*R9C6 -> 3730 | X20: =(RC12*R10C9+R10C10)*R10C6 -> 0 | Y20: =(RC12*R11C9+R11C10)*R11C6 -> 5000 | AA20: =SUM(RC[-9]:RC[-2]) -> 419347.5 | AB20: =ROUND(RC[-15]/RC[-1],3) -> 7.0000000000000001E-3 | AC20: =SUM(R4C28:RC[-1]) -> 4.8999999999999995E-2 | AF20: =ROUND(RC[-14]/RC18,2) -> 1 | AG20: =ROUND(RC[-14]/RC18,2) -> 0.15 | AH20: =ROUND(RC[-14]/RC18,2) -> 0.09 | AI20: =ROUND(RC[-14]/RC18,2) -> 0.14000000000000001 | AJ20: =ROUND(RC[-14]/RC18,2) -> 0.12 | AK20: =ROUND(RC[-14]/RC18,2) -> 0.01 | AL20: =ROUND(RC[-14]/RC18,2) -> 0 | AM20: =ROUND(RC[-14]/RC18,2) -> 0.02 | AO20: =RC[-23]/R4C6 -> 5445.75 | AP20: =RC[-23]/R5C6 -> 4200 | AQ20: =RC[-23]/R6C6 -> 12120 | AR20: =RC[-23]/R7C6 -> 4310 | AS20: =RC[-23]/R8C6 -> 3700 | AT20: =RC[-23]/R9C6 -> 3730 | AV20: =RC[-23]/R11C6 -> 1000 | AX20: =RC[-9]/RC41 -> 1 | AY20: =RC[-9]/RC41 -> 0.77124363035394572 | AZ20: =RC[-9]/RC41 -> 2.2255887618785293 | BA20: =RC[-9]/RC41 -> 0.79144286829178723 | BB20: =RC[-9]/RC41 -> 0.67942891245466652 | BC20: =RC[-9]/RC41 -> 0.68493779552862322 | BD20: =RC[-9]/RC41 -> 0 | BE20: =RC[-9]/RC41 -> 0.1836294357985585
L21: 18 | M21: 3712 | N21: =SUM(R4C13:RC[-1]) -> 19864 | R21: =(RC12*R4C9+R4C10)*R4C6*R4C7 -> 284275 | S21: =(RC12*R5C9+R5C10)*R5C6 -> 44000 | T21: =(RC12*R6C9+R6C10)*R6C6 -> 24960 | U21: =(RC12*R7C9+R7C10)*R7C6 -> 40860 | V21: =(RC12*R8C9+R8C10)*R8C6 -> 35100 | W21: =(RC12*R9C9+R9C10)*R9C6 -> 3920 | X21: =(RC12*R10C9+R10C10)*R10C6 -> 0 | Y21: =(RC12*R11C9+R11C10)*R11C6 -> 5000 | AA21: =SUM(RC[-9]:RC[-2]) -> 438115 | AB21: =ROUND(RC[-15]/RC[-1],3) -> 8.0000000000000002E-3 | AC21: =SUM(R4C28:RC[-1]) -> 5.6999999999999995E-2 | AF21: =ROUND(RC[-14]/RC18,2) -> 1 | AG21: =ROUND(RC[-14]/RC18,2) -> 0.15 | AH21: =ROUND(RC[-14]/RC18,2) -> 0.09 | AI21: =ROUND(RC[-14]/RC18,2) -> 0.14000000000000001 | AJ21: =ROUND(RC[-14]/RC18,2) -> 0.12 | AK21: =ROUND(RC[-14]/RC18,2) -> 0.01 | AL21: =ROUND(RC[-14]/RC18,2) -> 0 | AM21: =ROUND(RC[-14]/RC18,2) -> 0.02 | AO21: =RC[-23]/R4C6 -> 5685.5 | AP21: =RC[-23]/R5C6 -> 4400 | AQ21: =RC[-23]/R6C6 -> 12480 | AR21: =RC[-23]/R7C6 -> 4540 | AS21: =RC[-23]/R8C6 -> 3900 | AT21: =RC[-23]/R9C6 -> 3920 | AV21: =RC[-23]/R11C6 -> 1000 | AX21: =RC[-9]/RC41 -> 1 | AY21: =RC[-9]/RC41 -> 0.7738985137630815 | AZ21: =RC[-9]/RC41 -> 2.1950576026734674 | BA21: =RC[-9]/RC41 -> 0.79852255738281597 | BB21: =RC[-9]/RC41 -> 0.68595550083545864 | BC21: =RC[-9]/RC41 -> 0.6894732213525635 | BD21: =RC[-9]/RC41 -> 0 | BE21: =RC[-9]/RC41 -> 0.17588602585524579
L22: 19 | M22: 4457 | N22: =SUM(R4C13:RC[-1]) -> 24321 | R22: =(RC12*R4C9+R4C10)*R4C6*R4C7 -> 296262.5 | S22: =(RC12*R5C9+R5C10)*R5C6 -> 46000 | T22: =(RC12*R6C9+R6C10)*R6C6 -> 25680 | U22: =(RC12*R7C9+R7C10)*R7C6 -> 42930 | V22: =(RC12*R8C9+R8C10)*R8C6 -> 36900 | W22: =(RC12*R9C9+R9C10)*R9C6 -> 4110 | X22: =(RC12*R10C9+R10C10)*R10C6 -> 0 | Y22: =(RC12*R11C9+R11C10)*R11C6 -> 5000 | AA22: =SUM(RC[-9]:RC[-2]) -> 456882.5 | AB22: =ROUND(RC[-15]/RC[-1],3) -> 0.01 | AC22: =SUM(R4C28:RC[-1]) -> 6.699999999999999E-2 | AF22: =ROUND(RC[-14]/RC18,2) -> 1 | AG22: =ROUND(RC[-14]/RC18,2) -> 0.16 | AH22: =ROUND(RC[-14]/RC18,2) -> 0.09 | AI22: =ROUND(RC[-14]/RC18,2) -> 0.14000000000000001 | AJ22: =ROUND(RC[-14]/RC18,2) -> 0.12 | AK22: =ROUND(RC[-14]/RC18,2) -> 0.01 | AL22: =ROUND(RC[-14]/RC18,2) -> 0 | AM22: =ROUND(RC[-14]/RC18,2) -> 0.02 | AO22: =RC[-23]/R4C6 -> 5925.25 | AP22: =RC[-23]/R5C6 -> 4600 | AQ22: =RC[-23]/R6C6 -> 12840 | AR22: =RC[-23]/R7C6 -> 4770 | AS22: =RC[-23]/R8C6 -> 4100 | AT22: =RC[-23]/R9C6 -> 4110 | AV22: =RC[-23]/R11C6 -> 1000 | AX22: =RC[-9]/RC41 -> 1 | AY22: =RC[-9]/RC41 -> 0.77633855111598671 | AZ22: =RC[-9]/RC41 -> 2.1669971731150586 | BA22: =RC[-9]/RC41 -> 0.80502932365722968 | BB22: =RC[-9]/RC41 -> 0.69195392599468375 | BC22: =RC[-9]/RC41 -> 0.69364161849710981 | BD22: =RC[-9]/RC41 -> 0 | BE22: =RC[-9]/RC41 -> 0.16876925024260581
L23: 20 | M23: 5310 | N23: =SUM(R4C13:RC[-1]) -> 29631 | R23: =(RC12*R4C9+R4C10)*R4C6*R4C7 -> 308250 | S23: =(RC12*R5C9+R5C10)*R5C6 -> 48000 | T23: =(RC12*R6C9+R6C10)*R6C6 -> 26400 | U23: =(RC12*R7C9+R7C10)*R7C6 -> 45000 | V23: =(RC12*R8C9+R8C10)*R8C6 -> 38700 | W23: =(RC12*R9C9+R9C10)*R9C6 -> 4300 | X23: =(RC12*R10C9+R10C10)*R10C6 -> 0 | Y23: =(RC12*R11C9+R11C10)*R11C6 -> 5000 | AA23: =SUM(RC[-9]:RC[-2]) -> 475650 | AB23: =ROUND(RC[-15]/RC[-1],3) -> 1.0999999999999999E-2 | AC23: =SUM(R4C28:RC[-1]) -> 7.7999999999999986E-2 | AF23: =ROUND(RC[-14]/RC18,2) -> 1 | AG23: =ROUND(RC[-14]/RC18,2) -> 0.16 | AH23: =ROUND(RC[-14]/RC18,2) -> 0.09 | AI23: =ROUND(RC[-14]/RC18,2) -> 0.15 | AJ23: =ROUND(RC[-14]/RC18,2) -> 0.13 | AK23: =ROUND(RC[-14]/RC18,2) -> 0.01 | AL23: =ROUND(RC[-14]/RC18,2) -> 0 | AM23: =ROUND(RC[-14]/RC18,2) -> 0.02 | AO23: =RC[-23]/R4C6 -> 6165 | AP23: =RC[-23]/R5C6 -> 4800 | AQ23: =RC[-23]/R6C6 -> 13200 | AR23: =RC[-23]/R7C6 -> 5000 | AS23: =RC[-23]/R8C6 -> 4300 | AT23: =RC[-23]/R9C6 -> 4300 | AV23: =RC[-23]/R11C6 -> 1000 | AX23: =RC[-9]/RC41 -> 1 | AY23: =RC[-9]/RC41 -> 0.77858880778588813 | AZ23: =RC[-9]/RC41 -> 2.1411192214111923 | BA23: =RC[-9]/RC41 -> 0.81103000811030013 | BB23: =RC[-9]/RC41 -> 0.69748580697485807 | BC23: =RC[-9]/RC41 -> 0.69748580697485807 | BD23: =RC[-9]/RC41 -> 0 | BE23: =RC[-9]/RC41 -> 0.16220600162206
L24: 21 | M24: 6279 | N24: =SUM(R4C13:RC[-1]) -> 35910 | R24: =(RC12*R4C9+R4C10)*R4C6*R4C7 -> 320237.5 | S24: =(RC12*R5C9+R5C10)*R5C6 -> 50000 | T24: =(RC12*R6C9+R6C10)*R6C6 -> 27120 | U24: =(RC12*R7C9+R7C10)*R7C6 -> 47070 | V24: =(RC12*R8C9+R8C10)*R8C6 -> 40500 | W24: =(RC12*R9C9+R9C10)*R9C6 -> 4490 | X24: =(RC12*R10C9+R10C10)*R10C6 -> 0 | Y24: =(RC12*R11C9+R11C10)*R11C6 -> 5000 | AA24: =SUM(RC[-9]:RC[-2]) -> 494417.5 | AB24: =ROUND(RC[-15]/RC[-1],3) -> 1.2999999999999999E-2 | AC24: =SUM(R4C28:RC[-1]) -> 9.0999999999999984E-2 | AF24: =ROUND(RC[-14]/RC18,2) -> 1 | AG24: =ROUND(RC[-14]/RC18,2) -> 0.16 | AH24: =ROUND(RC[-14]/RC18,2) -> 0.08 | AI24: =ROUND(RC[-14]/RC18,2) -> 0.15 | AJ24: =ROUND(RC[-14]/RC18,2) -> 0.13 | AK24: =ROUND(RC[-14]/RC18,2) -> 0.01 | AL24: =ROUND(RC[-14]/RC18,2) -> 0 | AM24: =ROUND(RC[-14]/RC18,2) -> 0.02 | AO24: =RC[-23]/R4C6 -> 6404.75 | AP24: =RC[-23]/R5C6 -> 5000 | AQ24: =RC[-23]/R6C6 -> 13560 | AR24: =RC[-23]/R7C6 -> 5230 | AS24: =RC[-23]/R8C6 -> 4500 | AT24: =RC[-23]/R9C6 -> 4490 | AV24: =RC[-23]/R11C6 -> 1000 | AX24: =RC[-9]/RC41 -> 1 | AY24: =RC[-9]/RC41 -> 0.78067059604200006 | AZ24: =RC[-9]/RC41 -> 2.1171786564659043 | BA24: =RC[-9]/RC41 -> 0.81658144345993211 | BB24: =RC[-9]/RC41 -> 0.70260353643780005 | BC24: =RC[-9]/RC41 -> 0.70104219524571609 | BD24: =RC[-9]/RC41 -> 0 | BE24: =RC[-9]/RC41 -> 0.15613411920840001
L25: 22 | M25: 7372 | N25: =SUM(R4C13:RC[-1]) -> 43282 | R25: =(RC12*R4C9+R4C10)*R4C6*R4C7 -> 332225 | S25: =(RC12*R5C9+R5C10)*R5C6 -> 52000 | T25: =(RC12*R6C9+R6C10)*R6C6 -> 27840 | U25: =(RC12*R7C9+R7C10)*R7C6 -> 49140 | V25: =(RC12*R8C9+R8C10)*R8C6 -> 42300 | W25: =(RC12*R9C9+R9C10)*R9C6 -> 4680 | X25: =(RC12*R10C9+R10C10)*R10C6 -> 0 | Y25: =(RC12*R11C9+R11C10)*R11C6 -> 5000 | AA25: =SUM(RC[-9]:RC[-2]) -> 513185 | AB25: =ROUND(RC[-15]/RC[-1],3) -> 1.4E-2 | AC25: =SUM(R4C28:RC[-1]) -> 0.10499999999999998 | AF25: =ROUND(RC[-14]/RC18,2) -> 1 | AG25: =ROUND(RC[-14]/RC18,2) -> 0.16 | AH25: =ROUND(RC[-14]/RC18,2) -> 0.08 | AI25: =ROUND(RC[-14]/RC18,2) -> 0.15 | AJ25: =ROUND(RC[-14]/RC18,2) -> 0.13 | AK25: =ROUND(RC[-14]/RC18,2) -> 0.01 | AL25: =ROUND(RC[-14]/RC18,2) -> 0 | AM25: =ROUND(RC[-14]/RC18,2) -> 0.02 | AO25: =RC[-23]/R4C6 -> 6644.5 | AP25: =RC[-23]/R5C6 -> 5200 | AQ25: =RC[-23]/R6C6 -> 13920 | AR25: =RC[-23]/R7C6 -> 5460 | AS25: =RC[-23]/R8C6 -> 4700 | AT25: =RC[-23]/R9C6 -> 4680 | AV25: =RC[-23]/R11C6 -> 1000 | AX25: =RC[-9]/RC41 -> 1 | AY25: =RC[-9]/RC41 -> 0.78260215215591844 | AZ25: =RC[-9]/RC41 -> 2.094965761155843 | BA25: =RC[-9]/RC41 -> 0.82173225976371433 | BB25: =RC[-9]/RC41 -> 0.70735194521784939 | BC25: =RC[-9]/RC41 -> 0.70434193694032654 | BD25: =RC[-9]/RC41 -> 0 | BE25: =RC[-9]/RC41 -> 0.15050041387613816
L26: 23 | M26: 8597 | N26: =SUM(R4C13:RC[-1]) -> 51879 | R26: =(RC12*R4C9+R4C10)*R4C6*R4C7 -> 344212.5 | S26: =(RC12*R5C9+R5C10)*R5C6 -> 54000 | T26: =(RC12*R6C9+R6C10)*R6C6 -> 28560 | U26: =(RC12*R7C9+R7C10)*R7C6 -> 51210 | V26: =(RC12*R8C9+R8C10)*R8C6 -> 44100 | W26: =(RC12*R9C9+R9C10)*R9C6 -> 4870 | X26: =(RC12*R10C9+R10C10)*R10C6 -> 0 | Y26: =(RC12*R11C9+R11C10)*R11C6 -> 5000 | AA26: =SUM(RC[-9]:RC[-2]) -> 531952.5 | AB26: =ROUND(RC[-15]/RC[-1],3) -> 1.6E-2 | AC26: =SUM(R4C28:RC[-1]) -> 0.12099999999999998 | AF26: =ROUND(RC[-14]/RC18,2) -> 1 | AG26: =ROUND(RC[-14]/RC18,2) -> 0.16 | AH26: =ROUND(RC[-14]/RC18,2) -> 0.08 | AI26: =ROUND(RC[-14]/RC18,2) -> 0.15 | AJ26: =ROUND(RC[-14]/RC18,2) -> 0.13 | AK26: =ROUND(RC[-14]/RC18,2) -> 0.01 | AL26: =ROUND(RC[-14]/RC18,2) -> 0 | AM26: =ROUND(RC[-14]/RC18,2) -> 0.01 | AO26: =RC[-23]/R4C6 -> 6884.25 | AP26: =RC[-23]/R5C6 -> 5400 | AQ26: =RC[-23]/R6C6 -> 14280 | AR26: =RC[-23]/R7C6 -> 5690 | AS26: =RC[-23]/R8C6 -> 4900 | AT26: =RC[-23]/R9C6 -> 4870 | AV26: =RC[-23]/R11C6 -> 1000 | AX26: =RC[-9]/RC41 -> 1 | AY26: =RC[-9]/RC41 -> 0.78439917202309617 | AZ26: =RC[-9]/RC41 -> 2.0743000326832988 | BA26: =RC[-9]/RC41 -> 0.82652431274285509 | BB26: =RC[-9]/RC41 -> 0.71176961905799474 | BC26: =RC[-9]/RC41 -> 0.70741184588008865 | BD26: =RC[-9]/RC41 -> 0 | BE26: =RC[-9]/RC41 -> 0.145259105930203
L27: 24 | M27: 9961 | N27: =SUM(R4C13:RC[-1]) -> 61840 | R27: =(RC12*R4C9+R4C10)*R4C6*R4C7 -> 356200 | S27: =(RC12*R5C9+R5C10)*R5C6 -> 56000 | T27: =(RC12*R6C9+R6C10)*R6C6 -> 29280 | U27: =(RC12*R7C9+R7C10)*R7C6 -> 53280 | V27: =(RC12*R8C9+R8C10)*R8C6 -> 45900 | W27: =(RC12*R9C9+R9C10)*R9C6 -> 5060 | X27: =(RC12*R10C9+R10C10)*R10C6 -> 0 | Y27: =(RC12*R11C9+R11C10)*R11C6 -> 5000 | AA27: =SUM(RC[-9]:RC[-2]) -> 550720 | AB27: =ROUND(RC[-15]/RC[-1],3) -> 1.7999999999999999E-2 | AC27: =SUM(R4C28:RC[-1]) -> 0.13899999999999998 | AF27: =ROUND(RC[-14]/RC18,2) -> 1 | AG27: =ROUND(RC[-14]/RC18,2) -> 0.16 | AH27: =ROUND(RC[-14]/RC18,2) -> 0.08 | AI27: =ROUND(RC[-14]/RC18,2) -> 0.15 | AJ27: =ROUND(RC[-14]/RC18,2) -> 0.13 | AK27: =ROUND(RC[-14]/RC18,2) -> 0.01 | AL27: =ROUND(RC[-14]/RC18,2) -> 0 | AM27: =ROUND(RC[-14]/RC18,2) -> 0.01 | AO27: =RC[-23]/R4C6 -> 7124 | AP27: =RC[-23]/R5C6 -> 5600 | AQ27: =RC[-23]/R6C6 -> 14640 | AR27: =RC[-23]/R7C6 -> 5920 | AS27: =RC[-23]/R8C6 -> 5100 | AT27: =RC[-23]/R9C6 -> 5060 | AV27: =RC[-23]/R11C6 -> 1000 | AX27: =RC[-9]/RC41 -> 1 | AY27: =RC[-9]/RC41 -> 0.78607523862998319 | AZ27: =RC[-9]/RC41 -> 2.0550252667040989 | BA27: =RC[-9]/RC41 -> 0.83099382369455366 | BB27: =RC[-9]/RC41 -> 0.71588994946659179 | BC27: =RC[-9]/RC41 -> 0.71027512633352052 | BD27: =RC[-9]/RC41 -> 0 | BE27: =RC[-9]/RC41 -> 0.14037057832678271
L28: 25 | M28: 11473 | N28: =SUM(R4C13:RC[-1]) -> 73313 | R28: =(RC12*R4C9+R4C10)*R4C6*R4C7 -> 368187.5 | S28: =(RC12*R5C9+R5C10)*R5C6 -> 58000 | T28: =(RC12*R6C9+R6C10)*R6C6 -> 30000 | U28: =(RC12*R7C9+R7C10)*R7C6 -> 55350 | V28: =(RC12*R8C9+R8C10)*R8C6 -> 47700 | W28: =(RC12*R9C9+R9C10)*R9C6 -> 5250 | X28: =(RC12*R10C9+R10C10)*R10C6 -> 0 | Y28: =(RC12*R11C9+R11C10)*R11C6 -> 5000 | AA28: =SUM(RC[-9]:RC[-2]) -> 569487.5 | AB28: =ROUND(RC[-15]/RC[-1],3) -> 0.02 | AC28: =SUM(R4C28:RC[-1]) -> 0.15899999999999997 | AF28: =ROUND(RC[-14]/RC18,2) -> 1 | AG28: =ROUND(RC[-14]/RC18,2) -> 0.16 | AH28: =ROUND(RC[-14]/RC18,2) -> 0.08 | AI28: =ROUND(RC[-14]/RC18,2) -> 0.15 | AJ28: =ROUND(RC[-14]/RC18,2) -> 0.13 | AK28: =ROUND(RC[-14]/RC18,2) -> 0.01 | AL28: =ROUND(RC[-14]/RC18,2) -> 0 | AM28: =ROUND(RC[-14]/RC18,2) -> 0.01 | AO28: =RC[-23]/R4C6 -> 7363.75 | AP28: =RC[-23]/R5C6 -> 5800 | AQ28: =RC[-23]/R6C6 -> 15000 | AR28: =RC[-23]/R7C6 -> 6150 | AS28: =RC[-23]/R8C6 -> 5300 | AT28: =RC[-23]/R9C6 -> 5250 | AV28: =RC[-23]/R11C6 -> 1000 | AX28: =RC[-9]/RC41 -> 1 | AY28: =RC[-9]/RC41 -> 0.78764216601595649 | AZ28: =RC[-9]/RC41 -> 2.0370056017654048 | BA28: =RC[-9]/RC41 -> 0.83517229672381599 | BB28: =RC[-9]/RC41 -> 0.71974197929044303 | BC28: =RC[-9]/RC41 -> 0.71295196061789168 | BD28: =RC[-9]/RC41 -> 0 | BE28: =RC[-9]/RC41 -> 0.135800373451027
L29: 26 | M29: 13139 | N29: =SUM(R4C13:RC[-1]) -> 86452 | R29: =(RC12*R4C9+R4C10)*R4C6*R4C7 -> 380175 | S29: =(RC12*R5C9+R5C10)*R5C6 -> 60000 | T29: =(RC12*R6C9+R6C10)*R6C6 -> 30720 | U29: =(RC12*R7C9+R7C10)*R7C6 -> 57420 | V29: =(RC12*R8C9+R8C10)*R8C6 -> 49500 | W29: =(RC12*R9C9+R9C10)*R9C6 -> 5440 | X29: =(RC12*R10C9+R10C10)*R10C6 -> 0 | Y29: =(RC12*R11C9+R11C10)*R11C6 -> 5000 | AA29: =SUM(RC[-9]:RC[-2]) -> 588255 | AB29: =ROUND(RC[-15]/RC[-1],3) -> 2.1999999999999999E-2 | AC29: =SUM(R4C28:RC[-1]) -> 0.18099999999999997 | AF29: =ROUND(RC[-14]/RC18,2) -> 1 | AG29: =ROUND(RC[-14]/RC18,2) -> 0.16 | AH29: =ROUND(RC[-14]/RC18,2) -> 0.08 | AI29: =ROUND(RC[-14]/RC18,2) -> 0.15 | AJ29: =ROUND(RC[-14]/RC18,2) -> 0.13 | AK29: =ROUND(RC[-14]/RC18,2) -> 0.01 | AL29: =ROUND(RC[-14]/RC18,2) -> 0 | AM29: =ROUND(RC[-14]/RC18,2) -> 0.01 | AO29: =RC[-23]/R4C6 -> 7603.5 | AP29: =RC[-23]/R5C6 -> 6000 | AQ29: =RC[-23]/R6C6 -> 15360 | AR29: =RC[-23]/R7C6 -> 6380 | AS29: =RC[-23]/R8C6 -> 5500 | AT29: =RC[-23]/R9C6 -> 5440 | AV29: =RC[-23]/R11C6 -> 1000 | AX29: =RC[-9]/RC41 -> 1 | AY29: =RC[-9]/RC41 -> 0.78911027816137302 | AZ29: =RC[-9]/RC41 -> 2.0201223120931151 | BA29: =RC[-9]/RC41 -> 0.83908726244492671 | BB29: =RC[-9]/RC41 -> 0.72335108831459194 | BC29: =RC[-9]/RC41 -> 0.71545998553297818 | BD29: =RC[-9]/RC41 -> 0 | BE29: =RC[-9]/RC41 -> 0.13151837969356217
L30: 27 | M30: 14968 | N30: =SUM(R4C13:RC[-1]) -> 101420 | R30: =(RC12*R4C9+R4C10)*R4C6*R4C7 -> 392162.5 | S30: =(RC12*R5C9+R5C10)*R5C6 -> 62000 | T30: =(RC12*R6C9+R6C10)*R6C6 -> 31440 | U30: =(RC12*R7C9+R7C10)*R7C6 -> 59490 | V30: =(RC12*R8C9+R8C10)*R8C6 -> 51300 | W30: =(RC12*R9C9+R9C10)*R9C6 -> 5630 | X30: =(RC12*R10C9+R10C10)*R10C6 -> 0 | Y30: =(RC12*R11C9+R11C10)*R11C6 -> 5000 | AA30: =SUM(RC[-9]:RC[-2]) -> 607022.5 | AB30: =ROUND(RC[-15]/RC[-1],3) -> 2.5000000000000001E-2 | AC30: =SUM(R4C28:RC[-1]) -> 0.20599999999999996 | AF30: =ROUND(RC[-14]/RC18,2) -> 1 | AG30: =ROUND(RC[-14]/RC18,2) -> 0.16 | AH30: =ROUND(RC[-14]/RC18,2) -> 0.08 | AI30: =ROUND(RC[-14]/RC18,2) -> 0.15 | AJ30: =ROUND(RC[-14]/RC18,2) -> 0.13 | AK30: =ROUND(RC[-14]/RC18,2) -> 0.01 | AL30: =ROUND(RC[-14]/RC18,2) -> 0 | AM30: =ROUND(RC[-14]/RC18,2) -> 0.01 | AO30: =RC[-23]/R4C6 -> 7843.25 | AP30: =RC[-23]/R5C6 -> 6200 | AQ30: =RC[-23]/R6C6 -> 15720 | AR30: =RC[-23]/R7C6 -> 6610 | AS30: =RC[-23]/R8C6 -> 5700 | AT30: =RC[-23]/R9C6 -> 5630 | AV30: =RC[-23]/R11C6 -> 1000 | AX30: =RC[-9]/RC41 -> 1 | AY30: =RC[-9]/RC41 -> 0.79048863672584702 | AZ30: =RC[-9]/RC41 -> 2.0042711886016638 | BA30: =RC[-9]/RC41 -> 0.84276288528352405 | BB30: =RC[-9]/RC41 -> 0.72673955311892391 | BC30: =RC[-9]/RC41 -> 0.71781468141395466 | BD30: =RC[-9]/RC41 -> 0 | BE30: =RC[-9]/RC41 -> 0.1274981672138463
L31: 28 | M31: 16968 | N31: =SUM(R4C13:RC[-1]) -> 118388 | R31: =(RC12*R4C9+R4C10)*R4C6*R4C7 -> 404150 | S31: =(RC12*R5C9+R5C10)*R5C6 -> 64000 | T31: =(RC12*R6C9+R6C10)*R6C6 -> 32160 | U31: =(RC12*R7C9+R7C10)*R7C6 -> 61560 | V31: =(RC12*R8C9+R8C10)*R8C6 -> 53100 | W31: =(RC12*R9C9+R9C10)*R9C6 -> 5820 | X31: =(RC12*R10C9+R10C10)*R10C6 -> 0 | Y31: =(RC12*R11C9+R11C10)*R11C6 -> 5000 | AA31: =SUM(RC[-9]:RC[-2]) -> 625790 | AB31: =ROUND(RC[-15]/RC[-1],3) -> 2.7E-2 | AC31: =SUM(R4C28:RC[-1]) -> 0.23299999999999996 | AF31: =ROUND(RC[-14]/RC18,2) -> 1 | AG31: =ROUND(RC[-14]/RC18,2) -> 0.16 | AH31: =ROUND(RC[-14]/RC18,2) -> 0.08 | AI31: =ROUND(RC[-14]/RC18,2) -> 0.15 | AJ31: =ROUND(RC[-14]/RC18,2) -> 0.13 | AK31: =ROUND(RC[-14]/RC18,2) -> 0.01 | AL31: =ROUND(RC[-14]/RC18,2) -> 0 | AM31: =ROUND(RC[-14]/RC18,2) -> 0.01 | AO31: =RC[-23]/R4C6 -> 8083 | AP31: =RC[-23]/R5C6 -> 6400 | AQ31: =RC[-23]/R6C6 -> 16080 | AR31: =RC[-23]/R7C6 -> 6840 | AS31: =RC[-23]/R8C6 -> 5900 | AT31: =RC[-23]/R9C6 -> 5820 | AV31: =RC[-23]/R11C6 -> 1000 | AX31: =RC[-9]/RC41 -> 1 | AY31: =RC[-9]/RC41 -> 0.79178522825683528 | AZ31: =RC[-9]/RC41 -> 1.9893603859952989 | BA31: =RC[-9]/RC41 -> 0.8462204626994928 | BB31: =RC[-9]/RC41 -> 0.72992700729927007 | BC31: =RC[-9]/RC41 -> 0.72002969194605959 | BD31: =RC[-9]/RC41 -> 0 | BE31: =RC[-9]/RC41 -> 0.12371644191513052
L32: 29 | M32: 19146 | N32: =SUM(R4C13:RC[-1]) -> 137534 | R32: =(RC12*R4C9+R4C10)*R4C6*R4C7 -> 416137.5 | S32: =(RC12*R5C9+R5C10)*R5C6 -> 66000 | T32: =(RC12*R6C9+R6C10)*R6C6 -> 32880 | U32: =(RC12*R7C9+R7C10)*R7C6 -> 63630 | V32: =(RC12*R8C9+R8C10)*R8C6 -> 54900 | W32: =(RC12*R9C9+R9C10)*R9C6 -> 6010 | X32: =(RC12*R10C9+R10C10)*R10C6 -> 0 | Y32: =(RC12*R11C9+R11C10)*R11C6 -> 5000 | AA32: =SUM(RC[-9]:RC[-2]) -> 644557.5 | AB32: =ROUND(RC[-15]/RC[-1],3) -> 0.03 | AC32: =SUM(R4C28:RC[-1]) -> 0.26299999999999996 | AF32: =ROUND(RC[-14]/RC18,2) -> 1 | AG32: =ROUND(RC[-14]/RC18,2) -> 0.16 | AH32: =ROUND(RC[-14]/RC18,2) -> 0.08 | AI32: =ROUND(RC[-14]/RC18,2) -> 0.15 | AJ32: =ROUND(RC[-14]/RC18,2) -> 0.13 | AK32: =ROUND(RC[-14]/RC18,2) -> 0.01 | AL32: =ROUND(RC[-14]/RC18,2) -> 0 | AM32: =ROUND(RC[-14]/RC18,2) -> 0.01 | AO32: =RC[-23]/R4C6 -> 8322.75 | AP32: =RC[-23]/R5C6 -> 6600 | AQ32: =RC[-23]/R6C6 -> 16440 | AR32: =RC[-23]/R7C6 -> 7070 | AS32: =RC[-23]/R8C6 -> 6100 | AT32: =RC[-23]/R9C6 -> 6010 | AV32: =RC[-23]/R11C6 -> 1000 | AX32: =RC[-9]/RC41 -> 1 | AY32: =RC[-9]/RC41 -> 0.79300711904118226 | AZ32: =RC[-9]/RC41 -> 1.9753086419753085 | BA32: =RC[-9]/RC41 -> 0.84947883812441805 | BB32: =RC[-9]/RC41 -> 0.73293082214412308 | BC32: =RC[-9]/RC41 -> 0.72211708870265234 | BD32: =RC[-9]/RC41 -> 0 | BE32: =RC[-9]/RC41 -> 0.12015259379411854
L33: 30 | M33: 21510 | N33: =SUM(R4C13:RC[-1]) -> 159044 | R33: =(RC12*R4C9+R4C10)*R4C6*R4C7 -> 428125 | S33: =(RC12*R5C9+R5C10)*R5C6 -> 68000 | T33: =(RC12*R6C9+R6C10)*R6C6 -> 33600 | U33: =(RC12*R7C9+R7C10)*R7C6 -> 65700 | V33: =(RC12*R8C9+R8C10)*R8C6 -> 56700 | W33: =(RC12*R9C9+R9C10)*R9C6 -> 6200 | X33: =(RC12*R10C9+R10C10)*R10C6 -> 0 | Y33: =(RC12*R11C9+R11C10)*R11C6 -> 5000 | AA33: =SUM(RC[-9]:RC[-2]) -> 663325 | AB33: =ROUND(RC[-15]/RC[-1],3) -> 3.2000000000000001E-2 | AC33: =SUM(R4C28:RC[-1]) -> 0.29499999999999993 | AF33: =ROUND(RC[-14]/RC18,2) -> 1 | AG33: =ROUND(RC[-14]/RC18,2) -> 0.16 | AH33: =ROUND(RC[-14]/RC18,2) -> 0.08 | AI33: =ROUND(RC[-14]/RC18,2) -> 0.15 | AJ33: =ROUND(RC[-14]/RC18,2) -> 0.13 | AK33: =ROUND(RC[-14]/RC18,2) -> 0.01 | AL33: =ROUND(RC[-14]/RC18,2) -> 0 | AM33: =ROUND(RC[-14]/RC18,2) -> 0.01 | AO33: =RC[-23]/R4C6 -> 8562.5 | AP33: =RC[-23]/R5C6 -> 6800 | AQ33: =RC[-23]/R6C6 -> 16800 | AR33: =RC[-23]/R7C6 -> 7300 | AS33: =RC[-23]/R8C6 -> 6300 | AT33: =RC[-23]/R9C6 -> 6200 | AV33: =RC[-23]/R11C6 -> 1000 | AX33: =RC[-9]/RC41 -> 1 | AY33: =RC[-9]/RC41 -> 0.79416058394160582 | AZ33: =RC[-9]/RC41 -> 1.962043795620438 | BA33: =RC[-9]/RC41 -> 0.85255474452554747 | BB33: =RC[-9]/RC41 -> 0.73576642335766418 | BC33: =RC[-9]/RC41 -> 0.72408759124087596 | BD33: =RC[-9]/RC41 -> 0 | BE33: =RC[-9]/RC41 -> 0.11678832116788321
L34: 31 | M34: 24068 | N34: =SUM(R4C13:RC[-1]) -> 183112 | R34: =(RC12*R4C9+R4C10)*R4C6*R4C7 -> 440112.5 | S34: =(RC12*R5C9+R5C10)*R5C6 -> 70000 | T34: =(RC12*R6C9+R6C10)*R6C6 -> 34320 | U34: =(RC12*R7C9+R7C10)*R7C6 -> 67770 | V34: =(RC12*R8C9+R8C10)*R8C6 -> 58500 | W34: =(RC12*R9C9+R9C10)*R9C6 -> 6390 | X34: =(RC12*R10C9+R10C10)*R10C6 -> 0 | Y34: =(RC12*R11C9+R11C10)*R11C6 -> 5000 | AA34: =SUM(RC[-9]:RC[-2]) -> 682092.5 | AB34: =ROUND(RC[-15]/RC[-1],3) -> 3.5000000000000003E-2 | AC34: =SUM(R4C28:RC[-1]) -> 0.32999999999999996 | AF34: =ROUND(RC[-14]/RC18,2) -> 1 | AG34: =ROUND(RC[-14]/RC18,2) -> 0.16 | AH34: =ROUND(RC[-14]/RC18,2) -> 0.08 | AI34: =ROUND(RC[-14]/RC18,2) -> 0.15 | AJ34: =ROUND(RC[-14]/RC18,2) -> 0.13 | AK34: =ROUND(RC[-14]/RC18,2) -> 0.01 | AL34: =ROUND(RC[-14]/RC18,2) -> 0 | AM34: =ROUND(RC[-14]/RC18,2) -> 0.01 | AO34: =RC[-23]/R4C6 -> 8802.25 | AP34: =RC[-23]/R5C6 -> 7000 | AQ34: =RC[-23]/R6C6 -> 17160 | AR34: =RC[-23]/R7C6 -> 7530 | AS34: =RC[-23]/R8C6 -> 6500 | AT34: =RC[-23]/R9C6 -> 6390 | AV34: =RC[-23]/R11C6 -> 1000 | AX34: =RC[-9]/RC41 -> 1 | AY34: =RC[-9]/RC41 -> 0.79525121417819311 | AZ34: =RC[-9]/RC41 -> 1.9495015478996847 | BA34: =RC[-9]/RC41 -> 0.85546309182311342 | BB34: =RC[-9]/RC41 -> 0.73844755602260781 | BC34: =RC[-9]/RC41 -> 0.72595075122837915 | BD34: =RC[-9]/RC41 -> 0 | BE34: =RC[-9]/RC41 -> 0.11360731631117044
L35: 32 | M35: 26828 | N35: =SUM(R4C13:RC[-1]) -> 209940 | R35: =(RC12*R4C9+R4C10)*R4C6*R4C7 -> 452100 | S35: =(RC12*R5C9+R5C10)*R5C6 -> 72000 | T35: =(RC12*R6C9+R6C10)*R6C6 -> 35040 | U35: =(RC12*R7C9+R7C10)*R7C6 -> 69840 | V35: =(RC12*R8C9+R8C10)*R8C6 -> 60300 | W35: =(RC12*R9C9+R9C10)*R9C6 -> 6580 | X35: =(RC12*R10C9+R10C10)*R10C6 -> 0 | Y35: =(RC12*R11C9+R11C10)*R11C6 -> 5000 | AA35: =SUM(RC[-9]:RC[-2]) -> 700860 | AB35: =ROUND(RC[-15]/RC[-1],3) -> 3.7999999999999999E-2 | AC35: =SUM(R4C28:RC[-1]) -> 0.36799999999999994 | AF35: =ROUND(RC[-14]/RC18,2) -> 1 | AG35: =ROUND(RC[-14]/RC18,2) -> 0.16 | AH35: =ROUND(RC[-14]/RC18,2) -> 0.08 | AI35: =ROUND(RC[-14]/RC18,2) -> 0.15 | AJ35: =ROUND(RC[-14]/RC18,2) -> 0.13 | AK35: =ROUND(RC[-14]/RC18,2) -> 0.01 | AL35: =ROUND(RC[-14]/RC18,2) -> 0 | AM35: =ROUND(RC[-14]/RC18,2) -> 0.01 | AO35: =RC[-23]/R4C6 -> 9042 | AP35: =RC[-23]/R5C6 -> 7200 | AQ35: =RC[-23]/R6C6 -> 17520 | AR35: =RC[-23]/R7C6 -> 7760 | AS35: =RC[-23]/R8C6 -> 6700 | AT35: =RC[-23]/R9C6 -> 6580 | AV35: =RC[-23]/R11C6 -> 1000 | AX35: =RC[-9]/RC41 -> 1 | AY35: =RC[-9]/RC41 -> 0.79628400796284005 | AZ35: =RC[-9]/RC41 -> 1.9376244193762442 | BA35: =RC[-9]/RC41 -> 0.8582172085821721 | BB35: =RC[-9]/RC41 -> 0.74098650740986505 | BC35: =RC[-9]/RC41 -> 0.72771510727715105 | BD35: =RC[-9]/RC41 -> 0 | BE35: =RC[-9]/RC41 -> 0.11059500110595001
L36: 33 | M36: 29798 | N36: =SUM(R4C13:RC[-1]) -> 239738 | R36: =(RC12*R4C9+R4C10)*R4C6*R4C7 -> 464087.5 | S36: =(RC12*R5C9+R5C10)*R5C6 -> 74000 | T36: =(RC12*R6C9+R6C10)*R6C6 -> 35760 | U36: =(RC12*R7C9+R7C10)*R7C6 -> 71910 | V36: =(RC12*R8C9+R8C10)*R8C6 -> 62100 | W36: =(RC12*R9C9+R9C10)*R9C6 -> 6770 | X36: =(RC12*R10C9+R10C10)*R10C6 -> 0 | Y36: =(RC12*R11C9+R11C10)*R11C6 -> 5000 | AA36: =SUM(RC[-9]:RC[-2]) -> 719627.5 | AB36: =ROUND(RC[-15]/RC[-1],3) -> 4.1000000000000002E-2 | AC36: =SUM(R4C28:RC[-1]) -> 0.40899999999999992 | AF36: =ROUND(RC[-14]/RC18,2) -> 1 | AG36: =ROUND(RC[-14]/RC18,2) -> 0.16 | AH36: =ROUND(RC[-14]/RC18,2) -> 0.08 | AI36: =ROUND(RC[-14]/RC18,2) -> 0.15 | AJ36: =ROUND(RC[-14]/RC18,2) -> 0.13 | AK36: =ROUND(RC[-14]/RC18,2) -> 0.01 | AL36: =ROUND(RC[-14]/RC18,2) -> 0 | AM36: =ROUND(RC[-14]/RC18,2) -> 0.01 | AO36: =RC[-23]/R4C6 -> 9281.75 | AP36: =RC[-23]/R5C6 -> 7400 | AQ36: =RC[-23]/R6C6 -> 17880 | AR36: =RC[-23]/R7C6 -> 7990 | AS36: =RC[-23]/R8C6 -> 6900 | AT36: =RC[-23]/R9C6 -> 6770 | AV36: =RC[-23]/R11C6 -> 1000 | AX36: =RC[-9]/RC41 -> 1 | AY36: =RC[-9]/RC41 -> 0.79726344708702557 | AZ36: =RC[-9]/RC41 -> 1.9263608694481105 | BA36: =RC[-9]/RC41 -> 0.8608290462466669 | BB36: =RC[-9]/RC41 -> 0.74339429525682121 | BC36: =RC[-9]/RC41 -> 0.72938831578096808 | BD36: =RC[-9]/RC41 -> 0 | BE36: =RC[-9]/RC41 -> 0.10773830366040886
L37: 34 | M37: 32985 | N37: =SUM(R4C13:RC[-1]) -> 272723 | R37: =(RC12*R4C9+R4C10)*R4C6*R4C7 -> 476075 | S37: =(RC12*R5C9+R5C10)*R5C6 -> 76000 | T37: =(RC12*R6C9+R6C10)*R6C6 -> 36480 | U37: =(RC12*R7C9+R7C10)*R7C6 -> 73980 | V37: =(RC12*R8C9+R8C10)*R8C6 -> 63900 | W37: =(RC12*R9C9+R9C10)*R9C6 -> 6960 | X37: =(RC12*R10C9+R10C10)*R10C6 -> 0 | Y37: =(RC12*R11C9+R11C10)*R11C6 -> 5000 | AA37: =SUM(RC[-9]:RC[-2]) -> 738395 | AB37: =ROUND(RC[-15]/RC[-1],3) -> 4.4999999999999998E-2 | AC37: =SUM(R4C28:RC[-1]) -> 0.4539999999999999 | AF37: =ROUND(RC[-14]/RC18,2) -> 1 | AG37: =ROUND(RC[-14]/RC18,2) -> 0.16 | AH37: =ROUND(RC[-14]/RC18,2) -> 0.08 | AI37: =ROUND(RC[-14]/RC18,2) -> 0.16 | AJ37: =ROUND(RC[-14]/RC18,2) -> 0.13 | AK37: =ROUND(RC[-14]/RC18,2) -> 0.01 | AL37: =ROUND(RC[-14]/RC18,2) -> 0 | AM37: =ROUND(RC[-14]/RC18,2) -> 0.01 | AO37: =RC[-23]/R4C6 -> 9521.5 | AP37: =RC[-23]/R5C6 -> 7600 | AQ37: =RC[-23]/R6C6 -> 18240 | AR37: =RC[-23]/R7C6 -> 8220 | AS37: =RC[-23]/R8C6 -> 7100 | AT37: =RC[-23]/R9C6 -> 6960 | AV37: =RC[-23]/R11C6 -> 1000 | AX37: =RC[-9]/RC41 -> 1 | AY37: =RC[-9]/RC41 -> 0.79819356193877011 | AZ37: =RC[-9]/RC41 -> 1.9156645486530484 | BA37: =RC[-9]/RC41 -> 0.86330935251798557 | BB37: =RC[-9]/RC41 -> 0.74568082760069321 | BC37: =RC[-9]/RC41 -> 0.73097726198603163 | BD37: =RC[-9]/RC41 -> 0 | BE37: =RC[-9]/RC41 -> 0.10502546867615396
L38: 35 | M38: 36398 | N38: =SUM(R4C13:RC[-1]) -> 309121 | R38: =(RC12*R4C9+R4C10)*R4C6*R4C7 -> 488062.5 | S38: =(RC12*R5C9+R5C10)*R5C6 -> 78000 | T38: =(RC12*R6C9+R6C10)*R6C6 -> 37200 | U38: =(RC12*R7C9+R7C10)*R7C6 -> 76050 | V38: =(RC12*R8C9+R8C10)*R8C6 -> 65700 | W38: =(RC12*R9C9+R9C10)*R9C6 -> 7150 | X38: =(RC12*R10C9+R10C10)*R10C6 -> 0 | Y38: =(RC12*R11C9+R11C10)*R11C6 -> 5000 | AA38: =SUM(RC[-9]:RC[-2]) -> 757162.5 | AB38: =ROUND(RC[-15]/RC[-1],3) -> 4.8000000000000001E-2 | AC38: =SUM(R4C28:RC[-1]) -> 0.50199999999999989 | AF38: =ROUND(RC[-14]/RC18,2) -> 1 | AG38: =ROUND(RC[-14]/RC18,2) -> 0.16 | AH38: =ROUND(RC[-14]/RC18,2) -> 0.08 | AI38: =ROUND(RC[-14]/RC18,2) -> 0.16 | AJ38: =ROUND(RC[-14]/RC18,2) -> 0.13 | AK38: =ROUND(RC[-14]/RC18,2) -> 0.01 | AL38: =ROUND(RC[-14]/RC18,2) -> 0 | AM38: =ROUND(RC[-14]/RC18,2) -> 0.01 | AO38: =RC[-23]/R4C6 -> 9761.25 | AP38: =RC[-23]/R5C6 -> 7800 | AQ38: =RC[-23]/R6C6 -> 18600 | AR38: =RC[-23]/R7C6 -> 8450 | AS38: =RC[-23]/R8C6 -> 7300 | AT38: =RC[-23]/R9C6 -> 7150 | AV38: =RC[-23]/R11C6 -> 1000 | AX38: =RC[-9]/RC41 -> 1 | AY38: =RC[-9]/RC41 -> 0.79907798693814824 | AZ38: =RC[-9]/RC41 -> 1.9054936611601998 | BA38: =RC[-9]/RC41 -> 0.86566781918299396 | BB38: =RC[-9]/RC41 -> 0.74785503905749773 | BC38: =RC[-9]/RC41 -> 0.73248815469330264 | BD38: =RC[-9]/RC41 -> 0 | BE38: =RC[-9]/RC41 -> 0.10244589576130106
L39: 36 | M39: 40043 | N39: =SUM(R4C13:RC[-1]) -> 349164 | R39: =(RC12*R4C9+R4C10)*R4C6*R4C7 -> 500050 | S39: =(RC12*R5C9+R5C10)*R5C6 -> 80000 | T39: =(RC12*R6C9+R6C10)*R6C6 -> 37920 | U39: =(RC12*R7C9+R7C10)*R7C6 -> 78120 | V39: =(RC12*R8C9+R8C10)*R8C6 -> 67500 | W39: =(RC12*R9C9+R9C10)*R9C6 -> 7340 | X39: =(RC12*R10C9+R10C10)*R10C6 -> 0 | Y39: =(RC12*R11C9+R11C10)*R11C6 -> 5000 | AA39: =SUM(RC[-9]:RC[-2]) -> 775930 | AB39: =ROUND(RC[-15]/RC[-1],3) -> 5.1999999999999998E-2 | AC39: =SUM(R4C28:RC[-1]) -> 0.55399999999999994 | AF39: =ROUND(RC[-14]/RC18,2) -> 1 | AG39: =ROUND(RC[-14]/RC18,2) -> 0.16 | AH39: =ROUND(RC[-14]/RC18,2) -> 0.08 | AI39: =ROUND(RC[-14]/RC18,2) -> 0.16 | AJ39: =ROUND(RC[-14]/RC18,2) -> 0.13 | AK39: =ROUND(RC[-14]/RC18,2) -> 0.01 | AL39: =ROUND(RC[-14]/RC18,2) -> 0 | AM39: =ROUND(RC[-14]/RC18,2) -> 0.01 | AO39: =RC[-23]/R4C6 -> 10001 | AP39: =RC[-23]/R5C6 -> 8000 | AQ39: =RC[-23]/R6C6 -> 18960 | AR39: =RC[-23]/R7C6 -> 8680 | AS39: =RC[-23]/R8C6 -> 7500 | AT39: =RC[-23]/R9C6 -> 7340 | AV39: =RC[-23]/R11C6 -> 1000 | AX39: =RC[-9]/RC41 -> 1 | AY39: =RC[-9]/RC41 -> 0.79992000799920004 | AZ39: =RC[-9]/RC41 -> 1.8958104189581042 | BA39: =RC[-9]/RC41 -> 0.86791320867913213 | BB39: =RC[-9]/RC41 -> 0.74992500749925006 | BC39: =RC[-9]/RC41 -> 0.73392660733926607 | BD39: =RC[-9]/RC41 -> 0 | BE39: =RC[-9]/RC41 -> 9.9990000999900006E-2
L40: 37 | M40: 43929 | N40: =SUM(R4C13:RC[-1]) -> 393093 | R40: =(RC12*R4C9+R4C10)*R4C6*R4C7 -> 512037.5 | S40: =(RC12*R5C9+R5C10)*R5C6 -> 82000 | T40: =(RC12*R6C9+R6C10)*R6C6 -> 38640 | U40: =(RC12*R7C9+R7C10)*R7C6 -> 80190 | V40: =(RC12*R8C9+R8C10)*R8C6 -> 69300 | W40: =(RC12*R9C9+R9C10)*R9C6 -> 7530 | X40: =(RC12*R10C9+R10C10)*R10C6 -> 0 | Y40: =(RC12*R11C9+R11C10)*R11C6 -> 5000 | AA40: =SUM(RC[-9]:RC[-2]) -> 794697.5 | AB40: =ROUND(RC[-15]/RC[-1],3) -> 5.5E-2 | AC40: =SUM(R4C28:RC[-1]) -> 0.60899999999999999 | AF40: =ROUND(RC[-14]/RC18,2) -> 1 | AG40: =ROUND(RC[-14]/RC18,2) -> 0.16 | AH40: =ROUND(RC[-14]/RC18,2) -> 0.08 | AI40: =ROUND(RC[-14]/RC18,2) -> 0.16 | AJ40: =ROUND(RC[-14]/RC18,2) -> 0.14000000000000001 | AK40: =ROUND(RC[-14]/RC18,2) -> 0.01 | AL40: =ROUND(RC[-14]/RC18,2) -> 0 | AM40: =ROUND(RC[-14]/RC18,2) -> 0.01 | AO40: =RC[-23]/R4C6 -> 10240.75 | AP40: =RC[-23]/R5C6 -> 8200 | AQ40: =RC[-23]/R6C6 -> 19320 | AR40: =RC[-23]/R7C6 -> 8910 | AS40: =RC[-23]/R8C6 -> 7700 | AT40: =RC[-23]/R9C6 -> 7530 | AV40: =RC[-23]/R11C6 -> 1000 | AX40: =RC[-9]/RC41 -> 1 | AY40: =RC[-9]/RC41 -> 0.80072260332495182 | AZ40: =RC[-9]/RC41 -> 1.8865805727119596 | BA40: =RC[-9]/RC41 -> 0.87005346288113661 | BB40: =RC[-9]/RC41 -> 0.75189805434172297 | BC40: =RC[-9]/RC41 -> 0.73529770768742519 | BD40: =RC[-9]/RC41 -> 0 | BE40: =RC[-9]/RC41 -> 9.7649097966457529E-2
L41: 38 | M41: 48064 | N41: =SUM(R4C13:RC[-1]) -> 441157 | R41: =(RC12*R4C9+R4C10)*R4C6*R4C7 -> 524025 | S41: =(RC12*R5C9+R5C10)*R5C6 -> 84000 | T41: =(RC12*R6C9+R6C10)*R6C6 -> 39360 | U41: =(RC12*R7C9+R7C10)*R7C6 -> 82260 | V41: =(RC12*R8C9+R8C10)*R8C6 -> 71100 | W41: =(RC12*R9C9+R9C10)*R9C6 -> 7720 | X41: =(RC12*R10C9+R10C10)*R10C6 -> 0 | Y41: =(RC12*R11C9+R11C10)*R11C6 -> 5000 | AA41: =SUM(RC[-9]:RC[-2]) -> 813465 | AB41: =ROUND(RC[-15]/RC[-1],3) -> 5.8999999999999997E-2 | AC41: =SUM(R4C28:RC[-1]) -> 0.66799999999999993 | AF41: =ROUND(RC[-14]/RC18,2) -> 1 | AG41: =ROUND(RC[-14]/RC18,2) -> 0.16 | AH41: =ROUND(RC[-14]/RC18,2) -> 0.08 | AI41: =ROUND(RC[-14]/RC18,2) -> 0.16 | AJ41: =ROUND(RC[-14]/RC18,2) -> 0.14000000000000001 | AK41: =ROUND(RC[-14]/RC18,2) -> 0.01 | AL41: =ROUND(RC[-14]/RC18,2) -> 0 | AM41: =ROUND(RC[-14]/RC18,2) -> 0.01 | AO41: =RC[-23]/R4C6 -> 10480.5 | AP41: =RC[-23]/R5C6 -> 8400 | AQ41: =RC[-23]/R6C6 -> 19680 | AR41: =RC[-23]/R7C6 -> 9140 | AS41: =RC[-23]/R8C6 -> 7900 | AT41: =RC[-23]/R9C6 -> 7720 | AV41: =RC[-23]/R11C6 -> 1000 | AX41: =RC[-9]/RC41 -> 1 | AY41: =RC[-9]/RC41 -> 0.80148847860312011 | AZ41: =RC[-9]/RC41 -> 1.8777730070130243 | BA41: =RC[-9]/RC41 -> 0.87209579695625206 | BB41: =RC[-9]/RC41 -> 0.75378083106722005 | BC41: =RC[-9]/RC41 -> 0.73660607795429611 | BD41: =RC[-9]/RC41 -> 0 | BE41: =RC[-9]/RC41 -> 9.5415295071800008E-2
L42: 39 | M42: 52455 | N42: =SUM(R4C13:RC[-1]) -> 493612 | R42: =(RC12*R4C9+R4C10)*R4C6*R4C7 -> 536012.5 | S42: =(RC12*R5C9+R5C10)*R5C6 -> 86000 | T42: =(RC12*R6C9+R6C10)*R6C6 -> 40080 | U42: =(RC12*R7C9+R7C10)*R7C6 -> 84330 | V42: =(RC12*R8C9+R8C10)*R8C6 -> 72900 | W42: =(RC12*R9C9+R9C10)*R9C6 -> 7910 | X42: =(RC12*R10C9+R10C10)*R10C6 -> 0 | Y42: =(RC12*R11C9+R11C10)*R11C6 -> 5000 | AA42: =SUM(RC[-9]:RC[-2]) -> 832232.5 | AB42: =ROUND(RC[-15]/RC[-1],3) -> 6.3E-2 | AC42: =SUM(R4C28:RC[-1]) -> 0.73099999999999987 | AF42: =ROUND(RC[-14]/RC18,2) -> 1 | AG42: =ROUND(RC[-14]/RC18,2) -> 0.16 | AH42: =ROUND(RC[-14]/RC18,2) -> 7.0000000000000007E-2 | AI42: =ROUND(RC[-14]/RC18,2) -> 0.16 | AJ42: =ROUND(RC[-14]/RC18,2) -> 0.14000000000000001 | AK42: =ROUND(RC[-14]/RC18,2) -> 0.01 | AL42: =ROUND(RC[-14]/RC18,2) -> 0 | AM42: =ROUND(RC[-14]/RC18,2) -> 0.01 | AO42: =RC[-23]/R4C6 -> 10720.25 | AP42: =RC[-23]/R5C6 -> 8600 | AQ42: =RC[-23]/R6C6 -> 20040 | AR42: =RC[-23]/R7C6 -> 9370 | AS42: =RC[-23]/R8C6 -> 8100 | AT42: =RC[-23]/R9C6 -> 7910 | AV42: =RC[-23]/R11C6 -> 1000 | AX42: =RC[-9]/RC41 -> 1 | AY42: =RC[-9]/RC41 -> 0.80222009747906997 | AZ42: =RC[-9]/RC41 -> 1.8693593899396004 | BA42: =RC[-9]/RC41 -> 0.87404678062545182 | BB42: =RC[-9]/RC41 -> 0.7555793941372636 | BC42: =RC[-9]/RC41 -> 0.73785592686737711 | BD42: =RC[-9]/RC41 -> 0 | BE42: =RC[-9]/RC41 -> 9.3281406683612789E-2
L43: 40 | M43: 125642 | N43: =SUM(R4C13:RC[-1]) -> 619254 | R43: =(RC12*R4C9+R4C10)*R4C6*R4C7 -> 548000 | S43: =(RC12*R5C9+R5C10)*R5C6 -> 88000 | T43: =(RC12*R6C9+R6C10)*R6C6 -> 40800 | U43: =(RC12*R7C9+R7C10)*R7C6 -> 86400 | V43: =(RC12*R8C9+R8C10)*R8C6 -> 74700 | W43: =(RC12*R9C9+R9C10)*R9C6 -> 8100 | X43: =(RC12*R10C9+R10C10)*R10C6 -> 0 | Y43: =(RC12*R11C9+R11C10)*R11C6 -> 5000 | AA43: =SUM(RC[-9]:RC[-2]) -> 851000 | AB43: =ROUND(RC[-15]/RC[-1],3) -> 0.14799999999999999 | AC43: =SUM(R4C28:RC[-1]) -> 0.87899999999999989 | AF43: =ROUND(RC[-14]/RC18,2) -> 1 | AG43: =ROUND(RC[-14]/RC18,2) -> 0.16 | AH43: =ROUND(RC[-14]/RC18,2) -> 7.0000000000000007E-2 | AI43: =ROUND(RC[-14]/RC18,2) -> 0.16 | AJ43: =ROUND(RC[-14]/RC18,2) -> 0.14000000000000001 | AK43: =ROUND(RC[-14]/RC18,2) -> 0.01 | AL43: =ROUND(RC[-14]/RC18,2) -> 0 | AM43: =ROUND(RC[-14]/RC18,2) -> 0.01 | AO43: =RC[-23]/R4C6 -> 10960 | AP43: =RC[-23]/R5C6 -> 8800 | AQ43: =RC[-23]/R6C6 -> 20400 | AR43: =RC[-23]/R7C6 -> 9600 | AS43: =RC[-23]/R8C6 -> 8300 | AT43: =RC[-23]/R9C6 -> 8100 | AV43: =RC[-23]/R11C6 -> 1000 | AX43: =RC[-9]/RC41 -> 1 | AY43: =RC[-9]/RC41 -> 0.8029197080291971 | AZ43: =RC[-9]/RC41 -> 1.8613138686131387 | BA43: =RC[-9]/RC41 -> 0.87591240875912413 | BB43: =RC[-9]/RC41 -> 0.75729927007299269 | BC43: =RC[-9]/RC41 -> 0.73905109489051091 | BD43: =RC[-9]/RC41 -> 0 | BE43: =RC[-9]/RC41 -> 9.1240875912408759E-2
L44: 41 | M44: 148890 | N44: =SUM(R4C13:RC[-1]) -> 768144 | R44: =(RC12*R4C9+R4C10)*R4C6*R4C7 -> 559987.5 | S44: =(RC12*R5C9+R5C10)*R5C6 -> 90000 | T44: =(RC12*R6C9+R6C10)*R6C6 -> 41520 | U44: =(RC12*R7C9+R7C10)*R7C6 -> 88470 | V44: =(RC12*R8C9+R8C10)*R8C6 -> 76500 | W44: =(RC12*R9C9+R9C10)*R9C6 -> 8290 | X44: =(RC12*R10C9+R10C10)*R10C6 -> 0 | Y44: =(RC12*R11C9+R11C10)*R11C6 -> 5000 | AA44: =SUM(RC[-9]:RC[-2]) -> 869767.5 | AB44: =ROUND(RC[-15]/RC[-1],3) -> 0.17100000000000001 | AC44: =SUM(R4C28:RC[-1]) -> 1.0499999999999998 | AF44: =ROUND(RC[-14]/RC18,2) -> 1 | AG44: =ROUND(RC[-14]/RC18,2) -> 0.16 | AH44: =ROUND(RC[-14]/RC18,2) -> 7.0000000000000007E-2 | AI44: =ROUND(RC[-14]/RC18,2) -> 0.16 | AJ44: =ROUND(RC[-14]/RC18,2) -> 0.14000000000000001 | AK44: =ROUND(RC[-14]/RC18,2) -> 0.01 | AL44: =ROUND(RC[-14]/RC18,2) -> 0 | AM44: =ROUND(RC[-14]/RC18,2) -> 0.01 | AO44: =RC[-23]/R4C6 -> 11199.75 | AP44: =RC[-23]/R5C6 -> 9000 | AQ44: =RC[-23]/R6C6 -> 20760 | AR44: =RC[-23]/R7C6 -> 9830 | AS44: =RC[-23]/R8C6 -> 8500 | AT44: =RC[-23]/R9C6 -> 8290 | AV44: =RC[-23]/R11C6 -> 1000 | AX44: =RC[-9]/RC41 -> 1 | AY44: =RC[-9]/RC41 -> 0.80358936583405882 | AZ44: =RC[-9]/RC41 -> 1.853612803857229 | BA44: =RC[-9]/RC41 -> 0.87769816290542202 | BB44: =RC[-9]/RC41 -> 0.7589455121766111 | BC44: =RC[-9]/RC41 -> 0.74019509364048308 | BD44: =RC[-9]/RC41 -> 0 | BE44: =RC[-9]/RC41 -> 8.9287707314895423E-2
L45: 42 | M45: 174835 | N45: =SUM(R4C13:RC[-1]) -> 942979 | R45: =(RC12*R4C9+R4C10)*R4C6*R4C7 -> 571975 | S45: =(RC12*R5C9+R5C10)*R5C6 -> 92000 | T45: =(RC12*R6C9+R6C10)*R6C6 -> 42240 | U45: =(RC12*R7C9+R7C10)*R7C6 -> 90540 | V45: =(RC12*R8C9+R8C10)*R8C6 -> 78300 | W45: =(RC12*R9C9+R9C10)*R9C6 -> 8480 | X45: =(RC12*R10C9+R10C10)*R10C6 -> 0 | Y45: =(RC12*R11C9+R11C10)*R11C6 -> 5000 | AA45: =SUM(RC[-9]:RC[-2]) -> 888535 | AB45: =ROUND(RC[-15]/RC[-1],3) -> 0.19700000000000001 | AC45: =SUM(R4C28:RC[-1]) -> 1.2469999999999999 | AF45: =ROUND(RC[-14]/RC18,2) -> 1 | AG45: =ROUND(RC[-14]/RC18,2) -> 0.16 | AH45: =ROUND(RC[-14]/RC18,2) -> 7.0000000000000007E-2 | AI45: =ROUND(RC[-14]/RC18,2) -> 0.16 | AJ45: =ROUND(RC[-14]/RC18,2) -> 0.14000000000000001 | AK45: =ROUND(RC[-14]/RC18,2) -> 0.01 | AL45: =ROUND(RC[-14]/RC18,2) -> 0 | AM45: =ROUND(RC[-14]/RC18,2) -> 0.01 | AO45: =RC[-23]/R4C6 -> 11439.5 | AP45: =RC[-23]/R5C6 -> 9200 | AQ45: =RC[-23]/R6C6 -> 21120 | AR45: =RC[-23]/R7C6 -> 10060 | AS45: =RC[-23]/R8C6 -> 8700 | AT45: =RC[-23]/R9C6 -> 8480 | AV45: =RC[-23]/R11C6 -> 1000 | AX45: =RC[-9]/RC41 -> 1 | AY45: =RC[-9]/RC41 -> 0.80423095415009394 | AZ45: =RC[-9]/RC41 -> 1.8462345382228245 | BA45: =RC[-9]/RC41 -> 0.87940906508151584 | BB45: =RC[-9]/RC41 -> 0.76052275012019754 | BC45: =RC[-9]/RC41 -> 0.74129114034704313 | BD45: =RC[-9]/RC41 -> 0 | BE45: =RC[-9]/RC41 -> 8.7416408059792824E-2
L46: 43 | M46: 203669 | N46: =SUM(R4C13:RC[-1]) -> 1146648 | R46: =(RC12*R4C9+R4C10)*R4C6*R4C7 -> 583962.5 | S46: =(RC12*R5C9+R5C10)*R5C6 -> 94000 | T46: =(RC12*R6C9+R6C10)*R6C6 -> 42960 | U46: =(RC12*R7C9+R7C10)*R7C6 -> 92610 | V46: =(RC12*R8C9+R8C10)*R8C6 -> 80100 | W46: =(RC12*R9C9+R9C10)*R9C6 -> 8670 | X46: =(RC12*R10C9+R10C10)*R10C6 -> 0 | Y46: =(RC12*R11C9+R11C10)*R11C6 -> 5000 | AA46: =SUM(RC[-9]:RC[-2]) -> 907302.5 | AB46: =ROUND(RC[-15]/RC[-1],3) -> 0.224 | AC46: =SUM(R4C28:RC[-1]) -> 1.4709999999999999 | AF46: =ROUND(RC[-14]/RC18,2) -> 1 | AG46: =ROUND(RC[-14]/RC18,2) -> 0.16 | AH46: =ROUND(RC[-14]/RC18,2) -> 7.0000000000000007E-2 | AI46: =ROUND(RC[-14]/RC18,2) -> 0.16 | AJ46: =ROUND(RC[-14]/RC18,2) -> 0.14000000000000001 | AK46: =ROUND(RC[-14]/RC18,2) -> 0.01 | AL46: =ROUND(RC[-14]/RC18,2) -> 0 | AM46: =ROUND(RC[-14]/RC18,2) -> 0.01 | AO46: =RC[-23]/R4C6 -> 11679.25 | AP46: =RC[-23]/R5C6 -> 9400 | AQ46: =RC[-23]/R6C6 -> 21480 | AR46: =RC[-23]/R7C6 -> 10290 | AS46: =RC[-23]/R8C6 -> 8900 | AT46: =RC[-23]/R9C6 -> 8670 | AV46: =RC[-23]/R11C6 -> 1000 | AX46: =RC[-9]/RC41 -> 1 | AY46: =RC[-9]/RC41 -> 0.80484620159684916 | AZ46: =RC[-9]/RC41 -> 1.8391591925851403 | BA46: =RC[-9]/RC41 -> 0.88104972493952949 | BB46: =RC[-9]/RC41 -> 0.7620352334268039 | BC46: =RC[-9]/RC41 -> 0.74234218806858321 | BD46: =RC[-9]/RC41 -> 0 | BE46: =RC[-9]/RC41 -> 8.5621936340090327E-2
L47: 44 | M47: 235588 | N47: =SUM(R4C13:RC[-1]) -> 1382236 | R47: =(RC12*R4C9+R4C10)*R4C6*R4C7 -> 595950 | S47: =(RC12*R5C9+R5C10)*R5C6 -> 96000 | T47: =(RC12*R6C9+R6C10)*R6C6 -> 43680 | U47: =(RC12*R7C9+R7C10)*R7C6 -> 94680 | V47: =(RC12*R8C9+R8C10)*R8C6 -> 81900 | W47: =(RC12*R9C9+R9C10)*R9C6 -> 8860 | X47: =(RC12*R10C9+R10C10)*R10C6 -> 0 | Y47: =(RC12*R11C9+R11C10)*R11C6 -> 5000 | AA47: =SUM(RC[-9]:RC[-2]) -> 926070 | AB47: =ROUND(RC[-15]/RC[-1],3) -> 0.254 | AC47: =SUM(R4C28:RC[-1]) -> 1.7249999999999999 | AF47: =ROUND(RC[-14]/RC18,2) -> 1 | AG47: =ROUND(RC[-14]/RC18,2) -> 0.16 | AH47: =ROUND(RC[-14]/RC18,2) -> 7.0000000000000007E-2 | AI47: =ROUND(RC[-14]/RC18,2) -> 0.16 | AJ47: =ROUND(RC[-14]/RC18,2) -> 0.14000000000000001 | AK47: =ROUND(RC[-14]/RC18,2) -> 0.01 | AL47: =ROUND(RC[-14]/RC18,2) -> 0 | AM47: =ROUND(RC[-14]/RC18,2) -> 0.01 | AO47: =RC[-23]/R4C6 -> 11919 | AP47: =RC[-23]/R5C6 -> 9600 | AQ47: =RC[-23]/R6C6 -> 21840 | AR47: =RC[-23]/R7C6 -> 10520 | AS47: =RC[-23]/R8C6 -> 9100 | AT47: =RC[-23]/R9C6 -> 8860 | AV47: =RC[-23]/R11C6 -> 1000 | AX47: =RC[-9]/RC41 -> 1 | AY47: =RC[-9]/RC41 -> 0.80543669770953941 | AZ47: =RC[-9]/RC41 -> 1.8323684872892021 | BA47: =RC[-9]/RC41 -> 0.88262438124003695 | BB47: =RC[-9]/RC41 -> 0.76348686970383417 | BC47: =RC[-9]/RC41 -> 0.74335095226109571 | BD47: =RC[-9]/RC41 -> 0 | BE47: =RC[-9]/RC41 -> 8.3899656011410348E-2
L48: 45 | M48: 270792 | N48: =SUM(R4C13:RC[-1]) -> 1653028 | R48: =(RC12*R4C9+R4C10)*R4C6*R4C7 -> 607937.5 | S48: =(RC12*R5C9+R5C10)*R5C6 -> 98000 | T48: =(RC12*R6C9+R6C10)*R6C6 -> 44400 | U48: =(RC12*R7C9+R7C10)*R7C6 -> 96750 | V48: =(RC12*R8C9+R8C10)*R8C6 -> 83700 | W48: =(RC12*R9C9+R9C10)*R9C6 -> 9050 | X48: =(RC12*R10C9+R10C10)*R10C6 -> 0 | Y48: =(RC12*R11C9+R11C10)*R11C6 -> 5000 | AA48: =SUM(RC[-9]:RC[-2]) -> 944837.5 | AB48: =ROUND(RC[-15]/RC[-1],3) -> 0.28699999999999998 | AC48: =SUM(R4C28:RC[-1]) -> 2.012 | AF48: =ROUND(RC[-14]/RC18,2) -> 1 | AG48: =ROUND(RC[-14]/RC18,2) -> 0.16 | AH48: =ROUND(RC[-14]/RC18,2) -> 7.0000000000000007E-2 | AI48: =ROUND(RC[-14]/RC18,2) -> 0.16 | AJ48: =ROUND(RC[-14]/RC18,2) -> 0.14000000000000001 | AK48: =ROUND(RC[-14]/RC18,2) -> 0.01 | AL48: =ROUND(RC[-14]/RC18,2) -> 0 | AM48: =ROUND(RC[-14]/RC18,2) -> 0.01 | AO48: =RC[-23]/R4C6 -> 12158.75 | AP48: =RC[-23]/R5C6 -> 9800 | AQ48: =RC[-23]/R6C6 -> 22200 | AR48: =RC[-23]/R7C6 -> 10750 | AS48: =RC[-23]/R8C6 -> 9300 | AT48: =RC[-23]/R9C6 -> 9050 | AV48: =RC[-23]/R11C6 -> 1000 | AX48: =RC[-9]/RC41 -> 1 | AY48: =RC[-9]/RC41 -> 0.80600390665158839 | AZ48: =RC[-9]/RC41 -> 1.8258455844556389 | BA48: =RC[-9]/RC41 -> 0.88413693841883423 | BB48: =RC[-9]/RC41 -> 0.76488125835303789 | BC48: =RC[-9]/RC41 -> 0.74431993420376275 | BD48: =RC[-9]/RC41 -> 0 | BE48: =RC[-9]/RC41 -> 8.224529659710085E-2
L49: 46 | M49: 309491 | N49: =SUM(R4C13:RC[-1]) -> 1962519 | R49: =(RC12*R4C9+R4C10)*R4C6*R4C7 -> 619925 | S49: =(RC12*R5C9+R5C10)*R5C6 -> 100000 | T49: =(RC12*R6C9+R6C10)*R6C6 -> 45120 | U49: =(RC12*R7C9+R7C10)*R7C6 -> 98820 | V49: =(RC12*R8C9+R8C10)*R8C6 -> 85500 | W49: =(RC12*R9C9+R9C10)*R9C6 -> 9240 | X49: =(RC12*R10C9+R10C10)*R10C6 -> 0 | Y49: =(RC12*R11C9+R11C10)*R11C6 -> 5000 | AA49: =SUM(RC[-9]:RC[-2]) -> 963605 | AB49: =ROUND(RC[-15]/RC[-1],3) -> 0.32100000000000001 | AC49: =SUM(R4C28:RC[-1]) -> 2.3330000000000002 | AF49: =ROUND(RC[-14]/RC18,2) -> 1 | AG49: =ROUND(RC[-14]/RC18,2) -> 0.16 | AH49: =ROUND(RC[-14]/RC18,2) -> 7.0000000000000007E-2 | AI49: =ROUND(RC[-14]/RC18,2) -> 0.16 | AJ49: =ROUND(RC[-14]/RC18,2) -> 0.14000000000000001 | AK49: =ROUND(RC[-14]/RC18,2) -> 0.01 | AL49: =ROUND(RC[-14]/RC18,2) -> 0 | AM49: =ROUND(RC[-14]/RC18,2) -> 0.01 | AO49: =RC[-23]/R4C6 -> 12398.5 | AP49: =RC[-23]/R5C6 -> 10000 | AQ49: =RC[-23]/R6C6 -> 22560 | AR49: =RC[-23]/R7C6 -> 10980 | AS49: =RC[-23]/R8C6 -> 9500 | AT49: =RC[-23]/R9C6 -> 9240 | AV49: =RC[-23]/R11C6 -> 1000 | AX49: =RC[-9]/RC41 -> 1 | AY49: =RC[-9]/RC41 -> 0.80654917933621006 | AZ49: =RC[-9]/RC41 -> 1.8195749485824899 | BA49: =RC[-9]/RC41 -> 0.88559099891115856 | BB49: =RC[-9]/RC41 -> 0.76622172036939951 | BC49: =RC[-9]/RC41 -> 0.74525144170665802 | BD49: =RC[-9]/RC41 -> 0 | BE49: =RC[-9]/RC41 -> 8.0654917933621006E-2
L50: 47 | M50: 351900 | N50: =SUM(R4C13:RC[-1]) -> 2314419 | R50: =(RC12*R4C9+R4C10)*R4C6*R4C7 -> 631912.5 | S50: =(RC12*R5C9+R5C10)*R5C6 -> 102000 | T50: =(RC12*R6C9+R6C10)*R6C6 -> 45840 | U50: =(RC12*R7C9+R7C10)*R7C6 -> 100890 | V50: =(RC12*R8C9+R8C10)*R8C6 -> 87300 | W50: =(RC12*R9C9+R9C10)*R9C6 -> 9430 | X50: =(RC12*R10C9+R10C10)*R10C6 -> 0 | Y50: =(RC12*R11C9+R11C10)*R11C6 -> 5000 | AA50: =SUM(RC[-9]:RC[-2]) -> 982372.5 | AB50: =ROUND(RC[-15]/RC[-1],3) -> 0.35799999999999998 | AC50: =SUM(R4C28:RC[-1]) -> 2.6910000000000003 | AF50: =ROUND(RC[-14]/RC18,2) -> 1 | AG50: =ROUND(RC[-14]/RC18,2) -> 0.16 | AH50: =ROUND(RC[-14]/RC18,2) -> 7.0000000000000007E-2 | AI50: =ROUND(RC[-14]/RC18,2) -> 0.16 | AJ50: =ROUND(RC[-14]/RC18,2) -> 0.14000000000000001 | AK50: =ROUND(RC[-14]/RC18,2) -> 0.01 | AL50: =ROUND(RC[-14]/RC18,2) -> 0 | AM50: =ROUND(RC[-14]/RC18,2) -> 0.01 | AO50: =RC[-23]/R4C6 -> 12638.25 | AP50: =RC[-23]/R5C6 -> 10200 | AQ50: =RC[-23]/R6C6 -> 22920 | AR50: =RC[-23]/R7C6 -> 11210 | AS50: =RC[-23]/R8C6 -> 9700 | AT50: =RC[-23]/R9C6 -> 9430 | AV50: =RC[-23]/R11C6 -> 1000 | AX50: =RC[-9]/RC41 -> 1 | AY50: =RC[-9]/RC41 -> 0.80707376416829857 | AZ50: =RC[-9]/RC41 -> 1.813542223013471 | BA50: =RC[-9]/RC41 -> 0.88698989179672816 | BB50: =RC[-9]/RC41 -> 0.76751132474828399 | BC50: =RC[-9]/RC41 -> 0.74614760746147613 | BD50: =RC[-9]/RC41 -> 0 | BE50: =RC[-9]/RC41 -> 7.9124878840029278E-2
L51: 48 | M51: 398238 | N51: =SUM(R4C13:RC[-1]) -> 2712657 | R51: =(RC12*R4C9+R4C10)*R4C6*R4C7 -> 643900 | S51: =(RC12*R5C9+R5C10)*R5C6 -> 104000 | T51: =(RC12*R6C9+R6C10)*R6C6 -> 46560 | U51: =(RC12*R7C9+R7C10)*R7C6 -> 102960 | V51: =(RC12*R8C9+R8C10)*R8C6 -> 89100 | W51: =(RC12*R9C9+R9C10)*R9C6 -> 9620 | X51: =(RC12*R10C9+R10C10)*R10C6 -> 0 | Y51: =(RC12*R11C9+R11C10)*R11C6 -> 5000 | AA51: =SUM(RC[-9]:RC[-2]) -> 1001140 | AB51: =ROUND(RC[-15]/RC[-1],3) -> 0.39800000000000002 | AC51: =SUM(R4C28:RC[-1]) -> 3.0890000000000004 | AF51: =ROUND(RC[-14]/RC18,2) -> 1 | AG51: =ROUND(RC[-14]/RC18,2) -> 0.16 | AH51: =ROUND(RC[-14]/RC18,2) -> 7.0000000000000007E-2 | AI51: =ROUND(RC[-14]/RC18,2) -> 0.16 | AJ51: =ROUND(RC[-14]/RC18,2) -> 0.14000000000000001 | AK51: =ROUND(RC[-14]/RC18,2) -> 0.01 | AL51: =ROUND(RC[-14]/RC18,2) -> 0 | AM51: =ROUND(RC[-14]/RC18,2) -> 0.01 | AO51: =RC[-23]/R4C6 -> 12878 | AP51: =RC[-23]/R5C6 -> 10400 | AQ51: =RC[-23]/R6C6 -> 23280 | AR51: =RC[-23]/R7C6 -> 11440 | AS51: =RC[-23]/R8C6 -> 9900 | AT51: =RC[-23]/R9C6 -> 9620 | AV51: =RC[-23]/R11C6 -> 1000 | AX51: =RC[-9]/RC41 -> 1 | AY51: =RC[-9]/RC41 -> 0.8075788165864265 | AZ51: =RC[-9]/RC41 -> 1.8077341202050008 | BA51: =RC[-9]/RC41 -> 0.88833669824506911 | BB51: =RC[-9]/RC41 -> 0.76875291194284823 | BC51: =RC[-9]/RC41 -> 0.74701040534244445 | BD51: =RC[-9]/RC41 -> 0 | BE51: =RC[-9]/RC41 -> 7.7651809287156384E-2
L52: 49 | M52: 448735 | N52: =SUM(R4C13:RC[-1]) -> 3161392 | R52: =(RC12*R4C9+R4C10)*R4C6*R4C7 -> 655887.5 | S52: =(RC12*R5C9+R5C10)*R5C6 -> 106000 | T52: =(RC12*R6C9+R6C10)*R6C6 -> 47280 | U52: =(RC12*R7C9+R7C10)*R7C6 -> 105030 | V52: =(RC12*R8C9+R8C10)*R8C6 -> 90900 | W52: =(RC12*R9C9+R9C10)*R9C6 -> 9810 | X52: =(RC12*R10C9+R10C10)*R10C6 -> 0 | Y52: =(RC12*R11C9+R11C10)*R11C6 -> 5000 | AA52: =SUM(RC[-9]:RC[-2]) -> 1019907.5 | AB52: =ROUND(RC[-15]/RC[-1],3) -> 0.44 | AC52: =SUM(R4C28:RC[-1]) -> 3.5290000000000004 | AF52: =ROUND(RC[-14]/RC18,2) -> 1 | AG52: =ROUND(RC[-14]/RC18,2) -> 0.16 | AH52: =ROUND(RC[-14]/RC18,2) -> 7.0000000000000007E-2 | AI52: =ROUND(RC[-14]/RC18,2) -> 0.16 | AJ52: =ROUND(RC[-14]/RC18,2) -> 0.14000000000000001 | AK52: =ROUND(RC[-14]/RC18,2) -> 0.01 | AL52: =ROUND(RC[-14]/RC18,2) -> 0 | AM52: =ROUND(RC[-14]/RC18,2) -> 0.01 | AO52: =RC[-23]/R4C6 -> 13117.75 | AP52: =RC[-23]/R5C6 -> 10600 | AQ52: =RC[-23]/R6C6 -> 23640 | AR52: =RC[-23]/R7C6 -> 11670 | AS52: =RC[-23]/R8C6 -> 10100 | AT52: =RC[-23]/R9C6 -> 9810 | AV52: =RC[-23]/R11C6 -> 1000 | AX52: =RC[-9]/RC41 -> 1 | AY52: =RC[-9]/RC41 -> 0.8080654075584609 | AZ52: =RC[-9]/RC41 -> 1.8021383240266051 | BA52: =RC[-9]/RC41 -> 0.88963427417049423 | BB52: =RC[-9]/RC41 -> 0.76994911474909955 | BC52: =RC[-9]/RC41 -> 0.74784166491966997 | BD52: =RC[-9]/RC41 -> 0 | BE52: =RC[-9]/RC41 -> 7.6232585618722717E-2
L53: 50 | M53: 503622 | N53: =SUM(R4C13:RC[-1]) -> 3665014 | R53: =(RC12*R4C9+R4C10)*R4C6*R4C7 -> 667875 | S53: =(RC12*R5C9+R5C10)*R5C6 -> 108000 | T53: =(RC12*R6C9+R6C10)*R6C6 -> 48000 | U53: =(RC12*R7C9+R7C10)*R7C6 -> 107100 | V53: =(RC12*R8C9+R8C10)*R8C6 -> 92700 | W53: =(RC12*R9C9+R9C10)*R9C6 -> 10000 | X53: =(RC12*R10C9+R10C10)*R10C6 -> 0 | Y53: =(RC12*R11C9+R11C10)*R11C6 -> 5000 | AA53: =SUM(RC[-9]:RC[-2]) -> 1038675 | AB53: =ROUND(RC[-15]/RC[-1],3) -> 0.48499999999999999 | AC53: =SUM(R4C28:RC[-1]) -> 4.0140000000000002 | AF53: =ROUND(RC[-14]/RC18,2) -> 1 | AG53: =ROUND(RC[-14]/RC18,2) -> 0.16 | AH53: =ROUND(RC[-14]/RC18,2) -> 7.0000000000000007E-2 | AI53: =ROUND(RC[-14]/RC18,2) -> 0.16 | AJ53: =ROUND(RC[-14]/RC18,2) -> 0.14000000000000001 | AK53: =ROUND(RC[-14]/RC18,2) -> 0.01 | AL53: =ROUND(RC[-14]/RC18,2) -> 0 | AM53: =ROUND(RC[-14]/RC18,2) -> 0.01 | AO53: =RC[-23]/R4C6 -> 13357.5 | AP53: =RC[-23]/R5C6 -> 10800 | AQ53: =RC[-23]/R6C6 -> 24000 | AR53: =RC[-23]/R7C6 -> 11900 | AS53: =RC[-23]/R8C6 -> 10300 | AT53: =RC[-23]/R9C6 -> 10000 | AV53: =RC[-23]/R11C6 -> 1000 | AX53: =RC[-9]/RC41 -> 1 | AY53: =RC[-9]/RC41 -> 0.80853453116226837 | AZ53: =RC[-9]/RC41 -> 1.7967434025828186 | BA53: =RC[-9]/RC41 -> 0.89088527044731425 | BB53: =RC[-9]/RC41 -> 0.77110237694179296 | BC53: =RC[-9]/RC41 -> 0.74864308440950778 | BD53: =RC[-9]/RC41 -> 0 | BE53: =RC[-9]/RC41 -> 7.486430844095078E-2
L54: 51 | M54: 563140 | N54: =SUM(R4C13:RC[-1]) -> 4228154 | R54: =(RC12*R4C9+R4C10)*R4C6*R4C7 -> 679862.5 | S54: =(RC12*R5C9+R5C10)*R5C6 -> 110000 | T54: =(RC12*R6C9+R6C10)*R6C6 -> 48720 | U54: =(RC12*R7C9+R7C10)*R7C6 -> 109170 | V54: =(RC12*R8C9+R8C10)*R8C6 -> 94500 | W54: =(RC12*R9C9+R9C10)*R9C6 -> 10190 | X54: =(RC12*R10C9+R10C10)*R10C6 -> 0 | Y54: =(RC12*R11C9+R11C10)*R11C6 -> 5000 | AA54: =SUM(RC[-9]:RC[-2]) -> 1057442.5 | AB54: =ROUND(RC[-15]/RC[-1],3) -> 0.53300000000000003 | AC54: =SUM(R4C28:RC[-1]) -> 4.5470000000000006 | AF54: =ROUND(RC[-14]/RC18,2) -> 1 | AG54: =ROUND(RC[-14]/RC18,2) -> 0.16 | AH54: =ROUND(RC[-14]/RC18,2) -> 7.0000000000000007E-2 | AI54: =ROUND(RC[-14]/RC18,2) -> 0.16 | AJ54: =ROUND(RC[-14]/RC18,2) -> 0.14000000000000001 | AK54: =ROUND(RC[-14]/RC18,2) -> 0.01 | AL54: =ROUND(RC[-14]/RC18,2) -> 0 | AM54: =ROUND(RC[-14]/RC18,2) -> 0.01 | AO54: =RC[-23]/R4C6 -> 13597.25 | AP54: =RC[-23]/R5C6 -> 11000 | AQ54: =RC[-23]/R6C6 -> 24360 | AR54: =RC[-23]/R7C6 -> 12130 | AS54: =RC[-23]/R8C6 -> 10500 | AT54: =RC[-23]/R9C6 -> 10190 | AV54: =RC[-23]/R11C6 -> 1000 | AX54: =RC[-9]/RC41 -> 1 | AY54: =RC[-9]/RC41 -> 0.80898711136443036 | AZ54: =RC[-9]/RC41 -> 1.7915387302579566 | BA54: =RC[-9]/RC41 -> 0.8920921509864127 | BB54: =RC[-9]/RC41 -> 0.77221496993877436 | BC54: =RC[-9]/RC41 -> 0.74941624225486769 | BD54: =RC[-9]/RC41 -> 0 | BE54: =RC[-9]/RC41 -> 7.3544282851311843E-2
L55: 52 | M55: 627534 | N55: =SUM(R4C13:RC[-1]) -> 4855688 | R55: =(RC12*R4C9+R4C10)*R4C6*R4C7 -> 691850 | S55: =(RC12*R5C9+R5C10)*R5C6 -> 112000 | T55: =(RC12*R6C9+R6C10)*R6C6 -> 49440 | U55: =(RC12*R7C9+R7C10)*R7C6 -> 111240 | V55: =(RC12*R8C9+R8C10)*R8C6 -> 96300 | W55: =(RC12*R9C9+R9C10)*R9C6 -> 10380 | X55: =(RC12*R10C9+R10C10)*R10C6 -> 0 | Y55: =(RC12*R11C9+R11C10)*R11C6 -> 5000 | AA55: =SUM(RC[-9]:RC[-2]) -> 1076210 | AB55: =ROUND(RC[-15]/RC[-1],3) -> 0.58299999999999996 | AC55: =SUM(R4C28:RC[-1]) -> 5.1300000000000008 | AF55: =ROUND(RC[-14]/RC18,2) -> 1 | AG55: =ROUND(RC[-14]/RC18,2) -> 0.16 | AH55: =ROUND(RC[-14]/RC18,2) -> 7.0000000000000007E-2 | AI55: =ROUND(RC[-14]/RC18,2) -> 0.16 | AJ55: =ROUND(RC[-14]/RC18,2) -> 0.14000000000000001 | AK55: =ROUND(RC[-14]/RC18,2) -> 0.02 | AL55: =ROUND(RC[-14]/RC18,2) -> 0 | AM55: =ROUND(RC[-14]/RC18,2) -> 0.01 | AO55: =RC[-23]/R4C6 -> 13837 | AP55: =RC[-23]/R5C6 -> 11200 | AQ55: =RC[-23]/R6C6 -> 24720 | AR55: =RC[-23]/R7C6 -> 12360 | AS55: =RC[-23]/R8C6 -> 10700 | AT55: =RC[-23]/R9C6 -> 10380 | AV55: =RC[-23]/R11C6 -> 1000 | AX55: =RC[-9]/RC41 -> 1 | AY55: =RC[-9]/RC41 -> 0.80942400809424009 | AZ55: =RC[-9]/RC41 -> 1.7865144178651442 | BA55: =RC[-9]/RC41 -> 0.8932572089325721 | BB55: =RC[-9]/RC41 -> 0.77328900773289011 | BC55: =RC[-9]/RC41 -> 0.75016260750162611 | BD55: =RC[-9]/RC41 -> 0 | BE55: =RC[-9]/RC41 -> 7.2270000722700012E-2
L56: 53 | M56: 697056 | N56: =SUM(R4C13:RC[-1]) -> 5552744 | R56: =(RC12*R4C9+R4C10)*R4C6*R4C7 -> 703837.5 | S56: =(RC12*R5C9+R5C10)*R5C6 -> 114000 | T56: =(RC12*R6C9+R6C10)*R6C6 -> 50160 | U56: =(RC12*R7C9+R7C10)*R7C6 -> 113310 | V56: =(RC12*R8C9+R8C10)*R8C6 -> 98100 | W56: =(RC12*R9C9+R9C10)*R9C6 -> 10570 | X56: =(RC12*R10C9+R10C10)*R10C6 -> 0 | Y56: =(RC12*R11C9+R11C10)*R11C6 -> 5000 | AA56: =SUM(RC[-9]:RC[-2]) -> 1094977.5 | AB56: =ROUND(RC[-15]/RC[-1],3) -> 0.63700000000000001 | AC56: =SUM(R4C28:RC[-1]) -> 5.7670000000000012 | AF56: =ROUND(RC[-14]/RC18,2) -> 1 | AG56: =ROUND(RC[-14]/RC18,2) -> 0.16 | AH56: =ROUND(RC[-14]/RC18,2) -> 7.0000000000000007E-2 | AI56: =ROUND(RC[-14]/RC18,2) -> 0.16 | AJ56: =ROUND(RC[-14]/RC18,2) -> 0.14000000000000001 | AK56: =ROUND(RC[-14]/RC18,2) -> 0.02 | AL56: =ROUND(RC[-14]/RC18,2) -> 0 | AM56: =ROUND(RC[-14]/RC18,2) -> 0.01 | AO56: =RC[-23]/R4C6 -> 14076.75 | AP56: =RC[-23]/R5C6 -> 11400 | AQ56: =RC[-23]/R6C6 -> 25080 | AR56: =RC[-23]/R7C6 -> 12590 | AS56: =RC[-23]/R8C6 -> 10900 | AT56: =RC[-23]/R9C6 -> 10570 | AV56: =RC[-23]/R11C6 -> 1000 | AX56: =RC[-9]/RC41 -> 1 | AY56: =RC[-9]/RC41 -> 0.80984602269700035 | AZ56: =RC[-9]/RC41 -> 1.7816612499334008 | BA56: =RC[-9]/RC41 -> 0.89438258120659953 | BB56: =RC[-9]/RC41 -> 0.77432646029800911 | BC56: =RC[-9]/RC41 -> 0.75088354911467492 | BD56: =RC[-9]/RC41 -> 0 | BE56: =RC[-9]/RC41 -> 7.1039124797982495E-2
L57: 54 | M57: 771966 | N57: =SUM(R4C13:RC[-1]) -> 6324710 | R57: =(RC12*R4C9+R4C10)*R4C6*R4C7 -> 715825 | S57: =(RC12*R5C9+R5C10)*R5C6 -> 116000 | T57: =(RC12*R6C9+R6C10)*R6C6 -> 50880 | U57: =(RC12*R7C9+R7C10)*R7C6 -> 115380 | V57: =(RC12*R8C9+R8C10)*R8C6 -> 99900 | W57: =(RC12*R9C9+R9C10)*R9C6 -> 10760 | X57: =(RC12*R10C9+R10C10)*R10C6 -> 0 | Y57: =(RC12*R11C9+R11C10)*R11C6 -> 5000 | AA57: =SUM(RC[-9]:RC[-2]) -> 1113745 | AB57: =ROUND(RC[-15]/RC[-1],3) -> 0.69299999999999995 | AC57: =SUM(R4C28:RC[-1]) -> 6.4600000000000009 | AF57: =ROUND(RC[-14]/RC18,2) -> 1 | AG57: =ROUND(RC[-14]/RC18,2) -> 0.16 | AH57: =ROUND(RC[-14]/RC18,2) -> 7.0000000000000007E-2 | AI57: =ROUND(RC[-14]/RC18,2) -> 0.16 | AJ57: =ROUND(RC[-14]/RC18,2) -> 0.14000000000000001 | AK57: =ROUND(RC[-14]/RC18,2) -> 0.02 | AL57: =ROUND(RC[-14]/RC18,2) -> 0 | AM57: =ROUND(RC[-14]/RC18,2) -> 0.01 | AO57: =RC[-23]/R4C6 -> 14316.5 | AP57: =RC[-23]/R5C6 -> 11600 | AQ57: =RC[-23]/R6C6 -> 25440 | AR57: =RC[-23]/R7C6 -> 12820 | AS57: =RC[-23]/R8C6 -> 11100 | AT57: =RC[-23]/R9C6 -> 10760 | AV57: =RC[-23]/R11C6 -> 1000 | AX57: =RC[-9]/RC41 -> 1 | AY57: =RC[-9]/RC41 -> 0.81025390283938115 | AZ57: =RC[-9]/RC41 -> 1.776970628296022 | BA57: =RC[-9]/RC41 -> 0.89547026158628151 | BB57: =RC[-9]/RC41 -> 0.77532916564802845 | BC57: =RC[-9]/RC41 -> 0.75158034435790866 | BD57: =RC[-9]/RC41 -> 0 | BE57: =RC[-9]/RC41 -> 6.9849474382705265E-2
L58: 55 | M58: 852527 | N58: =SUM(R4C13:RC[-1]) -> 7177237 | R58: =(RC12*R4C9+R4C10)*R4C6*R4C7 -> 727812.5 | S58: =(RC12*R5C9+R5C10)*R5C6 -> 118000 | T58: =(RC12*R6C9+R6C10)*R6C6 -> 51600 | U58: =(RC12*R7C9+R7C10)*R7C6 -> 117450 | V58: =(RC12*R8C9+R8C10)*R8C6 -> 101700 | W58: =(RC12*R9C9+R9C10)*R9C6 -> 10950 | X58: =(RC12*R10C9+R10C10)*R10C6 -> 0 | Y58: =(RC12*R11C9+R11C10)*R11C6 -> 5000 | AA58: =SUM(RC[-9]:RC[-2]) -> 1132512.5 | AB58: =ROUND(RC[-15]/RC[-1],3) -> 0.753 | AC58: =SUM(R4C28:RC[-1]) -> 7.213000000000001 | AF58: =ROUND(RC[-14]/RC18,2) -> 1 | AG58: =ROUND(RC[-14]/RC18,2) -> 0.16 | AH58: =ROUND(RC[-14]/RC18,2) -> 7.0000000000000007E-2 | AI58: =ROUND(RC[-14]/RC18,2) -> 0.16 | AJ58: =ROUND(RC[-14]/RC18,2) -> 0.14000000000000001 | AK58: =ROUND(RC[-14]/RC18,2) -> 0.02 | AL58: =ROUND(RC[-14]/RC18,2) -> 0 | AM58: =ROUND(RC[-14]/RC18,2) -> 0.01 | AO58: =RC[-23]/R4C6 -> 14556.25 | AP58: =RC[-23]/R5C6 -> 11800 | AQ58: =RC[-23]/R6C6 -> 25800 | AR58: =RC[-23]/R7C6 -> 13050 | AS58: =RC[-23]/R8C6 -> 11300 | AT58: =RC[-23]/R9C6 -> 10950 | AV58: =RC[-23]/R11C6 -> 1000 | AX58: =RC[-9]/RC41 -> 1 | AY58: =RC[-9]/RC41 -> 0.81064834693001286 | AZ58: =RC[-9]/RC41 -> 1.7724345212537569 | BA58: =RC[-9]/RC41 -> 0.89652211249463287 | BB58: =RC[-9]/RC41 -> 0.77629884070416488 | BC58: =RC[-9]/RC41 -> 0.75225418634607133 | BD58: =RC[-9]/RC41 -> 0 | BE58: =RC[-9]/RC41 -> 6.8699012451696004E-2
L59: 56 | M59: 939010 | N59: =SUM(R4C13:RC[-1]) -> 8116247 | R59: =(RC12*R4C9+R4C10)*R4C6*R4C7 -> 739800 | S59: =(RC12*R5C9+R5C10)*R5C6 -> 120000 | T59: =(RC12*R6C9+R6C10)*R6C6 -> 52320 | U59: =(RC12*R7C9+R7C10)*R7C6 -> 119520 | V59: =(RC12*R8C9+R8C10)*R8C6 -> 103500 | W59: =(RC12*R9C9+R9C10)*R9C6 -> 11140 | X59: =(RC12*R10C9+R10C10)*R10C6 -> 0 | Y59: =(RC12*R11C9+R11C10)*R11C6 -> 5000 | AA59: =SUM(RC[-9]:RC[-2]) -> 1151280 | AB59: =ROUND(RC[-15]/RC[-1],3) -> 0.81599999999999995 | AC59: =SUM(R4C28:RC[-1]) -> 8.0290000000000017 | AF59: =ROUND(RC[-14]/RC18,2) -> 1 | AG59: =ROUND(RC[-14]/RC18,2) -> 0.16 | AH59: =ROUND(RC[-14]/RC18,2) -> 7.0000000000000007E-2 | AI59: =ROUND(RC[-14]/RC18,2) -> 0.16 | AJ59: =ROUND(RC[-14]/RC18,2) -> 0.14000000000000001 | AK59: =ROUND(RC[-14]/RC18,2) -> 0.02 | AL59: =ROUND(RC[-14]/RC18,2) -> 0 | AM59: =ROUND(RC[-14]/RC18,2) -> 0.01 | AO59: =RC[-23]/R4C6 -> 14796 | AP59: =RC[-23]/R5C6 -> 12000 | AQ59: =RC[-23]/R6C6 -> 26160 | AR59: =RC[-23]/R7C6 -> 13280 | AS59: =RC[-23]/R8C6 -> 11500 | AT59: =RC[-23]/R9C6 -> 11140 | AV59: =RC[-23]/R11C6 -> 1000 | AX59: =RC[-9]/RC41 -> 1 | AY59: =RC[-9]/RC41 -> 0.81103000811030013 | AZ59: =RC[-9]/RC41 -> 1.7680454176804541 | BA59: =RC[-9]/RC41 -> 0.89753987564206539 | BB59: =RC[-9]/RC41 -> 0.77723709110570427 | BC59: =RC[-9]/RC41 -> 0.7529061908623953 | BD59: =RC[-9]/RC41 -> 0 | BE59: =RC[-9]/RC41 -> 6.7585834009191673E-2
L60: 57 | M60: 1031693 | N60: =SUM(R4C13:RC[-1]) -> 9147940 | R60: =(RC12*R4C9+R4C10)*R4C6*R4C7 -> 751787.5 | S60: =(RC12*R5C9+R5C10)*R5C6 -> 122000 | T60: =(RC12*R6C9+R6C10)*R6C6 -> 53040 | U60: =(RC12*R7C9+R7C10)*R7C6 -> 121590 | V60: =(RC12*R8C9+R8C10)*R8C6 -> 105300 | W60: =(RC12*R9C9+R9C10)*R9C6 -> 11330 | X60: =(RC12*R10C9+R10C10)*R10C6 -> 0 | Y60: =(RC12*R11C9+R11C10)*R11C6 -> 5000 | AA60: =SUM(RC[-9]:RC[-2]) -> 1170047.5 | AB60: =ROUND(RC[-15]/RC[-1],3) -> 0.88200000000000001 | AC60: =SUM(R4C28:RC[-1]) -> 8.9110000000000014 | AF60: =ROUND(RC[-14]/RC18,2) -> 1 | AG60: =ROUND(RC[-14]/RC18,2) -> 0.16 | AH60: =ROUND(RC[-14]/RC18,2) -> 7.0000000000000007E-2 | AI60: =ROUND(RC[-14]/RC18,2) -> 0.16 | AJ60: =ROUND(RC[-14]/RC18,2) -> 0.14000000000000001 | AK60: =ROUND(RC[-14]/RC18,2) -> 0.02 | AL60: =ROUND(RC[-14]/RC18,2) -> 0 | AM60: =ROUND(RC[-14]/RC18,2) -> 0.01 | AO60: =RC[-23]/R4C6 -> 15035.75 | AP60: =RC[-23]/R5C6 -> 12200 | AQ60: =RC[-23]/R6C6 -> 26520 | AR60: =RC[-23]/R7C6 -> 13510 | AS60: =RC[-23]/R8C6 -> 11700 | AT60: =RC[-23]/R9C6 -> 11330 | AV60: =RC[-23]/R11C6 -> 1000 | AX60: =RC[-9]/RC41 -> 1 | AY60: =RC[-9]/RC41 -> 0.81139949786342547 | AZ60: =RC[-9]/RC41 -> 1.7637962855195117 | BA60: =RC[-9]/RC41 -> 0.89852518165039985 | BB60: =RC[-9]/RC41 -> 0.77814542008213761 | BC60: =RC[-9]/RC41 -> 0.75353740252398449 | BD60: =RC[-9]/RC41 -> 0 | BE60: =RC[-9]/RC41 -> 6.650815556257586E-2
L61: 58 | M61: 1130858 | N61: =SUM(R4C13:RC[-1]) -> 10278798 | R61: =(RC12*R4C9+R4C10)*R4C6*R4C7 -> 763775 | S61: =(RC12*R5C9+R5C10)*R5C6 -> 124000 | T61: =(RC12*R6C9+R6C10)*R6C6 -> 53760 | U61: =(RC12*R7C9+R7C10)*R7C6 -> 123660 | V61: =(RC12*R8C9+R8C10)*R8C6 -> 107100 | W61: =(RC12*R9C9+R9C10)*R9C6 -> 11520 | X61: =(RC12*R10C9+R10C10)*R10C6 -> 0 | Y61: =(RC12*R11C9+R11C10)*R11C6 -> 5000 | AA61: =SUM(RC[-9]:RC[-2]) -> 1188815 | AB61: =ROUND(RC[-15]/RC[-1],3) -> 0.95099999999999996 | AC61: =SUM(R4C28:RC[-1]) -> 9.8620000000000019 | AF61: =ROUND(RC[-14]/RC18,2) -> 1 | AG61: =ROUND(RC[-14]/RC18,2) -> 0.16 | AH61: =ROUND(RC[-14]/RC18,2) -> 7.0000000000000007E-2 | AI61: =ROUND(RC[-14]/RC18,2) -> 0.16 | AJ61: =ROUND(RC[-14]/RC18,2) -> 0.14000000000000001 | AK61: =ROUND(RC[-14]/RC18,2) -> 0.02 | AL61: =ROUND(RC[-14]/RC18,2) -> 0 | AM61: =ROUND(RC[-14]/RC18,2) -> 0.01 | AO61: =RC[-23]/R4C6 -> 15275.5 | AP61: =RC[-23]/R5C6 -> 12400 | AQ61: =RC[-23]/R6C6 -> 26880 | AR61: =RC[-23]/R7C6 -> 13740 | AS61: =RC[-23]/R8C6 -> 11900 | AT61: =RC[-23]/R9C6 -> 11520 | AV61: =RC[-23]/R11C6 -> 1000 | AX61: =RC[-9]/RC41 -> 1 | AY61: =RC[-9]/RC41 -> 0.81175738928349317 | AZ61: =RC[-9]/RC41 -> 1.7596805341887336 | BA61: =RC[-9]/RC41 -> 0.89947955877058039 | BB61: =RC[-9]/RC41 -> 0.77902523648980393 | BC61: =RC[-9]/RC41 -> 0.75414880036660015 | BD61: =RC[-9]/RC41 -> 0 | BE61: =RC[-9]/RC41 -> 6.546430558737848E-2
L62: 59 | M62: 1236796 | N62: =SUM(R4C13:RC[-1]) -> 11515594 | R62: =(RC12*R4C9+R4C10)*R4C6*R4C7 -> 775762.5 | S62: =(RC12*R5C9+R5C10)*R5C6 -> 126000 | T62: =(RC12*R6C9+R6C10)*R6C6 -> 54480 | U62: =(RC12*R7C9+R7C10)*R7C6 -> 125730 | V62: =(RC12*R8C9+R8C10)*R8C6 -> 108900 | W62: =(RC12*R9C9+R9C10)*R9C6 -> 11710 | X62: =(RC12*R10C9+R10C10)*R10C6 -> 0 | Y62: =(RC12*R11C9+R11C10)*R11C6 -> 5000 | AA62: =SUM(RC[-9]:RC[-2]) -> 1207582.5 | AB62: =ROUND(RC[-15]/RC[-1],3) -> 1.024 | AC62: =SUM(R4C28:RC[-1]) -> 10.886000000000003 | AF62: =ROUND(RC[-14]/RC18,2) -> 1 | AG62: =ROUND(RC[-14]/RC18,2) -> 0.16 | AH62: =ROUND(RC[-14]/RC18,2) -> 7.0000000000000007E-2 | AI62: =ROUND(RC[-14]/RC18,2) -> 0.16 | AJ62: =ROUND(RC[-14]/RC18,2) -> 0.14000000000000001 | AK62: =ROUND(RC[-14]/RC18,2) -> 0.02 | AL62: =ROUND(RC[-14]/RC18,2) -> 0 | AM62: =ROUND(RC[-14]/RC18,2) -> 0.01 | AO62: =RC[-23]/R4C6 -> 15515.25 | AP62: =RC[-23]/R5C6 -> 12600 | AQ62: =RC[-23]/R6C6 -> 27240 | AR62: =RC[-23]/R7C6 -> 13970 | AS62: =RC[-23]/R8C6 -> 12100 | AT62: =RC[-23]/R9C6 -> 11710 | AV62: =RC[-23]/R11C6 -> 1000 | AX62: =RC[-9]/RC41 -> 1 | AY62: =RC[-9]/RC41 -> 0.81210422004157201 | AZ62: =RC[-9]/RC41 -> 1.7556919804708271 | BA62: =RC[-9]/RC41 -> 0.90040444079212389 | BB62: =RC[-9]/RC41 -> 0.77987786210341437 | BC62: =RC[-9]/RC41 -> 0.75474130291165142 | BD62: =RC[-9]/RC41 -> 0 | BE62: =RC[-9]/RC41 -> 6.4452715876315236E-2
L63: 60 | M63: 1349802 | N63: =SUM(R4C13:RC[-1]) -> 12865396 | R63: =(RC12*R4C9+R4C10)*R4C6*R4C7 -> 787750 | S63: =(RC12*R5C9+R5C10)*R5C6 -> 128000 | T63: =(RC12*R6C9+R6C10)*R6C6 -> 55200 | U63: =(RC12*R7C9+R7C10)*R7C6 -> 127800 | V63: =(RC12*R8C9+R8C10)*R8C6 -> 110700 | W63: =(RC12*R9C9+R9C10)*R9C6 -> 11900 | X63: =(RC12*R10C9+R10C10)*R10C6 -> 0 | Y63: =(RC12*R11C9+R11C10)*R11C6 -> 5000 | AA63: =SUM(RC[-9]:RC[-2]) -> 1226350 | AB63: =ROUND(RC[-15]/RC[-1],3) -> 1.101 | AC63: =SUM(R4C28:RC[-1]) -> 11.987000000000002 | AF63: =ROUND(RC[-14]/RC18,2) -> 1 | AG63: =ROUND(RC[-14]/RC18,2) -> 0.16 | AH63: =ROUND(RC[-14]/RC18,2) -> 7.0000000000000007E-2 | AI63: =ROUND(RC[-14]/RC18,2) -> 0.16 | AJ63: =ROUND(RC[-14]/RC18,2) -> 0.14000000000000001 | AK63: =ROUND(RC[-14]/RC18,2) -> 0.02 | AL63: =ROUND(RC[-14]/RC18,2) -> 0 | AM63: =ROUND(RC[-14]/RC18,2) -> 0.01 | AO63: =RC[-23]/R4C6 -> 15755 | AP63: =RC[-23]/R5C6 -> 12800 | AQ63: =RC[-23]/R6C6 -> 27600 | AR63: =RC[-23]/R7C6 -> 14200 | AS63: =RC[-23]/R8C6 -> 12300 | AT63: =RC[-23]/R9C6 -> 11900 | AV63: =RC[-23]/R11C6 -> 1000 | AX63: =RC[-9]/RC41 -> 1 | AY63: =RC[-9]/RC41 -> 0.81244049508092664 | AZ63: =RC[-9]/RC41 -> 1.7518248175182483 | BA63: =RC[-9]/RC41 -> 0.90130117423040301 | BB63: =RC[-9]/RC41 -> 0.78070453824182795 | BC63: =RC[-9]/RC41 -> 0.75531577277054907 | BD63: =RC[-9]/RC41 -> 0 | BE63: =RC[-9]/RC41 -> 6.3471913678197392E-2
L64: 61 | M64: 1470178 | N64: =SUM(R4C13:RC[-1]) -> 14335574 | R64: =(RC12*R4C9+R4C10)*R4C6*R4C7 -> 799737.5 | S64: =(RC12*R5C9+R5C10)*R5C6 -> 130000 | T64: =(RC12*R6C9+R6C10)*R6C6 -> 55920 | U64: =(RC12*R7C9+R7C10)*R7C6 -> 129870 | V64: =(RC12*R8C9+R8C10)*R8C6 -> 112500 | W64: =(RC12*R9C9+R9C10)*R9C6 -> 12090 | X64: =(RC12*R10C9+R10C10)*R10C6 -> 0 | Y64: =(RC12*R11C9+R11C10)*R11C6 -> 5000 | AA64: =SUM(RC[-9]:RC[-2]) -> 1245117.5 | AB64: =ROUND(RC[-15]/RC[-1],3) -> 1.181 | AC64: =SUM(R4C28:RC[-1]) -> 13.168000000000003 | AF64: =ROUND(RC[-14]/RC18,2) -> 1 | AG64: =ROUND(RC[-14]/RC18,2) -> 0.16 | AH64: =ROUND(RC[-14]/RC18,2) -> 7.0000000000000007E-2 | AI64: =ROUND(RC[-14]/RC18,2) -> 0.16 | AJ64: =ROUND(RC[-14]/RC18,2) -> 0.14000000000000001 | AK64: =ROUND(RC[-14]/RC18,2) -> 0.02 | AL64: =ROUND(RC[-14]/RC18,2) -> 0 | AM64: =ROUND(RC[-14]/RC18,2) -> 0.01 | AO64: =RC[-23]/R4C6 -> 15994.75 | AP64: =RC[-23]/R5C6 -> 13000 | AQ64: =RC[-23]/R6C6 -> 27960 | AR64: =RC[-23]/R7C6 -> 14430 | AS64: =RC[-23]/R8C6 -> 12500 | AT64: =RC[-23]/R9C6 -> 12090 | AV64: =RC[-23]/R11C6 -> 1000 | AX64: =RC[-9]/RC41 -> 1 | AY64: =RC[-9]/RC41 -> 0.81276668906985106 | AZ64: =RC[-9]/RC41 -> 1.7480735866456181 | BA64: =RC[-9]/RC41 -> 0.90217102486753464 | BB64: =RC[-9]/RC41 -> 0.78150643179793366 | BC64: =RC[-9]/RC41 -> 0.75587302083496144 | BD64: =RC[-9]/RC41 -> 0 | BE64: =RC[-9]/RC41 -> 6.2520514543834699E-2
L65: 62 | M65: 1598232 | N65: =SUM(R4C13:RC[-1]) -> 15933806 | R65: =(RC12*R4C9+R4C10)*R4C6*R4C7 -> 811725 | S65: =(RC12*R5C9+R5C10)*R5C6 -> 132000 | T65: =(RC12*R6C9+R6C10)*R6C6 -> 56640 | U65: =(RC12*R7C9+R7C10)*R7C6 -> 131940 | V65: =(RC12*R8C9+R8C10)*R8C6 -> 114300 | W65: =(RC12*R9C9+R9C10)*R9C6 -> 12280 | X65: =(RC12*R10C9+R10C10)*R10C6 -> 0 | Y65: =(RC12*R11C9+R11C10)*R11C6 -> 5000 | AA65: =SUM(RC[-9]:RC[-2]) -> 1263885 | AB65: =ROUND(RC[-15]/RC[-1],3) -> 1.2649999999999999 | AC65: =SUM(R4C28:RC[-1]) -> 14.433000000000003 | AF65: =ROUND(RC[-14]/RC18,2) -> 1 | AG65: =ROUND(RC[-14]/RC18,2) -> 0.16 | AH65: =ROUND(RC[-14]/RC18,2) -> 7.0000000000000007E-2 | AI65: =ROUND(RC[-14]/RC18,2) -> 0.16 | AJ65: =ROUND(RC[-14]/RC18,2) -> 0.14000000000000001 | AK65: =ROUND(RC[-14]/RC18,2) -> 0.02 | AL65: =ROUND(RC[-14]/RC18,2) -> 0 | AM65: =ROUND(RC[-14]/RC18,2) -> 0.01 | AO65: =RC[-23]/R4C6 -> 16234.5 | AP65: =RC[-23]/R5C6 -> 13200 | AQ65: =RC[-23]/R6C6 -> 28320 | AR65: =RC[-23]/R7C6 -> 14660 | AS65: =RC[-23]/R8C6 -> 12700 | AT65: =RC[-23]/R9C6 -> 12280 | AV65: =RC[-23]/R11C6 -> 1000 | AX65: =RC[-9]/RC41 -> 1 | AY65: =RC[-9]/RC41 -> 0.81308324863716164 | AZ65: =RC[-9]/RC41 -> 1.7444331516215468 | BA65: =RC[-9]/RC41 -> 0.90301518371369616 | BB65: =RC[-9]/RC41 -> 0.78228464073423887 | BC65: =RC[-9]/RC41 -> 0.75641381009578368 | BD65: =RC[-9]/RC41 -> 0 | BE65: =RC[-9]/RC41 -> 6.1597215805845575E-2
L66: 63 | M66: 1734279 | N66: =SUM(R4C13:RC[-1]) -> 17668085 | R66: =(RC12*R4C9+R4C10)*R4C6*R4C7 -> 823712.5 | S66: =(RC12*R5C9+R5C10)*R5C6 -> 134000 | T66: =(RC12*R6C9+R6C10)*R6C6 -> 57360 | U66: =(RC12*R7C9+R7C10)*R7C6 -> 134010 | V66: =(RC12*R8C9+R8C10)*R8C6 -> 116100 | W66: =(RC12*R9C9+R9C10)*R9C6 -> 12470 | X66: =(RC12*R10C9+R10C10)*R10C6 -> 0 | Y66: =(RC12*R11C9+R11C10)*R11C6 -> 5000 | AA66: =SUM(RC[-9]:RC[-2]) -> 1282652.5 | AB66: =ROUND(RC[-15]/RC[-1],3) -> 1.3520000000000001 | AC66: =SUM(R4C28:RC[-1]) -> 15.785000000000004 | AF66: =ROUND(RC[-14]/RC18,2) -> 1 | AG66: =ROUND(RC[-14]/RC18,2) -> 0.16 | AH66: =ROUND(RC[-14]/RC18,2) -> 7.0000000000000007E-2 | AI66: =ROUND(RC[-14]/RC18,2) -> 0.16 | AJ66: =ROUND(RC[-14]/RC18,2) -> 0.14000000000000001 | AK66: =ROUND(RC[-14]/RC18,2) -> 0.02 | AL66: =ROUND(RC[-14]/RC18,2) -> 0 | AM66: =ROUND(RC[-14]/RC18,2) -> 0.01 | AO66: =RC[-23]/R4C6 -> 16474.25 | AP66: =RC[-23]/R5C6 -> 13400 | AQ66: =RC[-23]/R6C6 -> 28680 | AR66: =RC[-23]/R7C6 -> 14890 | AS66: =RC[-23]/R8C6 -> 12900 | AT66: =RC[-23]/R9C6 -> 12470 | AV66: =RC[-23]/R11C6 -> 1000 | AX66: =RC[-9]/RC41 -> 1 | AY66: =RC[-9]/RC41 -> 0.81339059441249217 | AZ66: =RC[-9]/RC41 -> 1.7408986752052444 | BA66: =RC[-9]/RC41 -> 0.90383477244791111 | BB66: =RC[-9]/RC41 -> 0.78304019909859324 | BC66: =RC[-9]/RC41 -> 0.75693885912864012 | BD66: =RC[-9]/RC41 -> 0 | BE66: =RC[-9]/RC41 -> 6.0700790627797929E-2
L67: 64 | M67: 1878640 | N67: =SUM(R4C13:RC[-1]) -> 19546725 | R67: =(RC12*R4C9+R4C10)*R4C6*R4C7 -> 835700 | S67: =(RC12*R5C9+R5C10)*R5C6 -> 136000 | T67: =(RC12*R6C9+R6C10)*R6C6 -> 58080 | U67: =(RC12*R7C9+R7C10)*R7C6 -> 136080 | V67: =(RC12*R8C9+R8C10)*R8C6 -> 117900 | W67: =(RC12*R9C9+R9C10)*R9C6 -> 12660 | X67: =(RC12*R10C9+R10C10)*R10C6 -> 0 | Y67: =(RC12*R11C9+R11C10)*R11C6 -> 5000 | AA67: =SUM(RC[-9]:RC[-2]) -> 1301420 | AB67: =ROUND(RC[-15]/RC[-1],3) -> 1.444 | AC67: =SUM(R4C28:RC[-1]) -> 17.229000000000003 | AF67: =ROUND(RC[-14]/RC18,2) -> 1 | AG67: =ROUND(RC[-14]/RC18,2) -> 0.16 | AH67: =ROUND(RC[-14]/RC18,2) -> 7.0000000000000007E-2 | AI67: =ROUND(RC[-14]/RC18,2) -> 0.16 | AJ67: =ROUND(RC[-14]/RC18,2) -> 0.14000000000000001 | AK67: =ROUND(RC[-14]/RC18,2) -> 0.02 | AL67: =ROUND(RC[-14]/RC18,2) -> 0 | AM67: =ROUND(RC[-14]/RC18,2) -> 0.01 | AO67: =RC[-23]/R4C6 -> 16714 | AP67: =RC[-23]/R5C6 -> 13600 | AQ67: =RC[-23]/R6C6 -> 29040 | AR67: =RC[-23]/R7C6 -> 15120 | AS67: =RC[-23]/R8C6 -> 13100 | AT67: =RC[-23]/R9C6 -> 12660 | AV67: =RC[-23]/R11C6 -> 1000 | AX67: =RC[-9]/RC41 -> 1 | AY67: =RC[-9]/RC41 -> 0.8136891228909896 | AZ67: =RC[-9]/RC41 -> 1.7374655977025248 | BA67: =RC[-9]/RC41 -> 0.90463084839057073 | BB67: =RC[-9]/RC41 -> 0.78377408160823259 | BC67: =RC[-9]/RC41 -> 0.75744884527940648 | BD67: =RC[-9]/RC41 -> 0 | BE67: =RC[-9]/RC41 -> 5.9830082565513941E-2
L68: 65 | M68: 2031642 | N68: =SUM(R4C13:RC[-1]) -> 21578367 | R68: =(RC12*R4C9+R4C10)*R4C6*R4C7 -> 847687.5 | S68: =(RC12*R5C9+R5C10)*R5C6 -> 138000 | T68: =(RC12*R6C9+R6C10)*R6C6 -> 58800 | U68: =(RC12*R7C9+R7C10)*R7C6 -> 138150 | V68: =(RC12*R8C9+R8C10)*R8C6 -> 119700 | W68: =(RC12*R9C9+R9C10)*R9C6 -> 12850 | X68: =(RC12*R10C9+R10C10)*R10C6 -> 0 | Y68: =(RC12*R11C9+R11C10)*R11C6 -> 5000 | AA68: =SUM(RC[-9]:RC[-2]) -> 1320187.5 | AB68: =ROUND(RC[-15]/RC[-1],3) -> 1.5389999999999999 | AC68: =SUM(R4C28:RC[-1]) -> 18.768000000000004 | AF68: =ROUND(RC[-14]/RC18,2) -> 1 | AG68: =ROUND(RC[-14]/RC18,2) -> 0.16 | AH68: =ROUND(RC[-14]/RC18,2) -> 7.0000000000000007E-2 | AI68: =ROUND(RC[-14]/RC18,2) -> 0.16 | AJ68: =ROUND(RC[-14]/RC18,2) -> 0.14000000000000001 | AK68: =ROUND(RC[-14]/RC18,2) -> 0.02 | AL68: =ROUND(RC[-14]/RC18,2) -> 0 | AM68: =ROUND(RC[-14]/RC18,2) -> 0.01 | AO68: =RC[-23]/R4C6 -> 16953.75 | AP68: =RC[-23]/R5C6 -> 13800 | AQ68: =RC[-23]/R6C6 -> 29400 | AR68: =RC[-23]/R7C6 -> 15350 | AS68: =RC[-23]/R8C6 -> 13300 | AT68: =RC[-23]/R9C6 -> 12850 | AV68: =RC[-23]/R11C6 -> 1000 | AX68: =RC[-9]/RC41 -> 1 | AY68: =RC[-9]/RC41 -> 0.81397920813979208 | AZ68: =RC[-9]/RC41 -> 1.7341296173412961 | BA68: =RC[-9]/RC41 -> 0.90540440905404407 | BB68: =RC[-9]/RC41 -> 0.78448720784487203 | BC68: =RC[-9]/RC41 -> 0.75794440757944403 | BD68: =RC[-9]/RC41 -> 0 | BE68: =RC[-9]/RC41 -> 5.8984000589840005E-2
L69: 66 | M69: 2193618 | N69: =SUM(R4C13:RC[-1]) -> 23771985 | R69: =(RC12*R4C9+R4C10)*R4C6*R4C7 -> 859675 | S69: =(RC12*R5C9+R5C10)*R5C6 -> 140000 | T69: =(RC12*R6C9+R6C10)*R6C6 -> 59520 | U69: =(RC12*R7C9+R7C10)*R7C6 -> 140220 | V69: =(RC12*R8C9+R8C10)*R8C6 -> 121500 | W69: =(RC12*R9C9+R9C10)*R9C6 -> 13040 | X69: =(RC12*R10C9+R10C10)*R10C6 -> 0 | Y69: =(RC12*R11C9+R11C10)*R11C6 -> 5000 | AA69: =SUM(RC[-9]:RC[-2]) -> 1338955 | AB69: =ROUND(RC[-15]/RC[-1],3) -> 1.6379999999999999 | AC69: =SUM(R4C28:RC[-1]) -> 20.406000000000006 | AF69: =ROUND(RC[-14]/RC18,2) -> 1 | AG69: =ROUND(RC[-14]/RC18,2) -> 0.16 | AH69: =ROUND(RC[-14]/RC18,2) -> 7.0000000000000007E-2 | AI69: =ROUND(RC[-14]/RC18,2) -> 0.16 | AJ69: =ROUND(RC[-14]/RC18,2) -> 0.14000000000000001 | AK69: =ROUND(RC[-14]/RC18,2) -> 0.02 | AL69: =ROUND(RC[-14]/RC18,2) -> 0 | AM69: =ROUND(RC[-14]/RC18,2) -> 0.01 | AO69: =RC[-23]/R4C6 -> 17193.5 | AP69: =RC[-23]/R5C6 -> 14000 | AQ69: =RC[-23]/R6C6 -> 29760 | AR69: =RC[-23]/R7C6 -> 15580 | AS69: =RC[-23]/R8C6 -> 13500 | AT69: =RC[-23]/R9C6 -> 13040 | AV69: =RC[-23]/R11C6 -> 1000 | AX69: =RC[-9]/RC41 -> 1 | AY69: =RC[-9]/RC41 -> 0.81426120336173557 | AZ69: =RC[-9]/RC41 -> 1.7308866722889464 | BA69: =RC[-9]/RC41 -> 0.90615639631255995 | BB69: =RC[-9]/RC41 -> 0.78518044609881643 | BC69: =RC[-9]/RC41 -> 0.75842614941693076 | BD69: =RC[-9]/RC41 -> 0 | BE69: =RC[-9]/RC41 -> 5.8161514525838252E-2
L70: 67 | M70: 2364906 | N70: =SUM(R4C13:RC[-1]) -> 26136891 | R70: =(RC12*R4C9+R4C10)*R4C6*R4C7 -> 871662.5 | S70: =(RC12*R5C9+R5C10)*R5C6 -> 142000 | T70: =(RC12*R6C9+R6C10)*R6C6 -> 60240 | U70: =(RC12*R7C9+R7C10)*R7C6 -> 142290 | V70: =(RC12*R8C9+R8C10)*R8C6 -> 123300 | W70: =(RC12*R9C9+R9C10)*R9C6 -> 13230 | X70: =(RC12*R10C9+R10C10)*R10C6 -> 0 | Y70: =(RC12*R11C9+R11C10)*R11C6 -> 5000 | AA70: =SUM(RC[-9]:RC[-2]) -> 1357722.5 | AB70: =ROUND(RC[-15]/RC[-1],3) -> 1.742 | AC70: =SUM(R4C28:RC[-1]) -> 22.148000000000007 | AF70: =ROUND(RC[-14]/RC18,2) -> 1 | AG70: =ROUND(RC[-14]/RC18,2) -> 0.16 | AH70: =ROUND(RC[-14]/RC18,2) -> 7.0000000000000007E-2 | AI70: =ROUND(RC[-14]/RC18,2) -> 0.16 | AJ70: =ROUND(RC[-14]/RC18,2) -> 0.14000000000000001 | AK70: =ROUND(RC[-14]/RC18,2) -> 0.02 | AL70: =ROUND(RC[-14]/RC18,2) -> 0 | AM70: =ROUND(RC[-14]/RC18,2) -> 0.01 | AO70: =RC[-23]/R4C6 -> 17433.25 | AP70: =RC[-23]/R5C6 -> 14200 | AQ70: =RC[-23]/R6C6 -> 30120 | AR70: =RC[-23]/R7C6 -> 15810 | AS70: =RC[-23]/R8C6 -> 13700 | AT70: =RC[-23]/R9C6 -> 13230 | AV70: =RC[-23]/R11C6 -> 1000 | AX70: =RC[-9]/RC41 -> 1 | AY70: =RC[-9]/RC41 -> 0.81453544233003028 | AZ70: =RC[-9]/RC41 -> 1.7277329241535571 | BA70: =RC[-9]/RC41 -> 0.90688770022801257 | BB70: =RC[-9]/RC41 -> 0.78585461689587421 | BC70: =RC[-9]/RC41 -> 0.7588946409877676 | BD70: =RC[-9]/RC41 -> 0 | BE70: =RC[-9]/RC41 -> 5.7361650868311992E-2
L71: 68 | M71: 2545854 | N71: =SUM(R4C13:RC[-1]) -> 28682745 | R71: =(RC12*R4C9+R4C10)*R4C6*R4C7 -> 883650 | S71: =(RC12*R5C9+R5C10)*R5C6 -> 144000 | T71: =(RC12*R6C9+R6C10)*R6C6 -> 60960 | U71: =(RC12*R7C9+R7C10)*R7C6 -> 144360 | V71: =(RC12*R8C9+R8C10)*R8C6 -> 125100 | W71: =(RC12*R9C9+R9C10)*R9C6 -> 13420 | X71: =(RC12*R10C9+R10C10)*R10C6 -> 0 | Y71: =(RC12*R11C9+R11C10)*R11C6 -> 5000 | AA71: =SUM(RC[-9]:RC[-2]) -> 1376490 | AB71: =ROUND(RC[-15]/RC[-1],3) -> 1.85 | AC71: =SUM(R4C28:RC[-1]) -> 23.998000000000008 | AF71: =ROUND(RC[-14]/RC18,2) -> 1 | AG71: =ROUND(RC[-14]/RC18,2) -> 0.16 | AH71: =ROUND(RC[-14]/RC18,2) -> 7.0000000000000007E-2 | AI71: =ROUND(RC[-14]/RC18,2) -> 0.16 | AJ71: =ROUND(RC[-14]/RC18,2) -> 0.14000000000000001 | AK71: =ROUND(RC[-14]/RC18,2) -> 0.02 | AL71: =ROUND(RC[-14]/RC18,2) -> 0 | AM71: =ROUND(RC[-14]/RC18,2) -> 0.01 | AO71: =RC[-23]/R4C6 -> 17673 | AP71: =RC[-23]/R5C6 -> 14400 | AQ71: =RC[-23]/R6C6 -> 30480 | AR71: =RC[-23]/R7C6 -> 16040 | AS71: =RC[-23]/R8C6 -> 13900 | AT71: =RC[-23]/R9C6 -> 13420 | AV71: =RC[-23]/R11C6 -> 1000 | AX71: =RC[-9]/RC41 -> 1 | AY71: =RC[-9]/RC41 -> 0.81480224070616192 | AZ71: =RC[-9]/RC41 -> 1.7246647428280428 | BA71: =RC[-9]/RC41 -> 0.90759916256436368 | BB71: =RC[-9]/RC41 -> 0.78651049623719793 | BC71: =RC[-9]/RC41 -> 0.75935042154699262 | BD71: =RC[-9]/RC41 -> 0 | BE71: =RC[-9]/RC41 -> 5.658348893792791E-2
L72: 69 | M72: 2736814 | N72: =SUM(R4C13:RC[-1]) -> 31419559 | R72: =(RC12*R4C9+R4C10)*R4C6*R4C7 -> 895637.5 | S72: =(RC12*R5C9+R5C10)*R5C6 -> 146000 | T72: =(RC12*R6C9+R6C10)*R6C6 -> 61680 | U72: =(RC12*R7C9+R7C10)*R7C6 -> 146430 | V72: =(RC12*R8C9+R8C10)*R8C6 -> 126900 | W72: =(RC12*R9C9+R9C10)*R9C6 -> 13610 | X72: =(RC12*R10C9+R10C10)*R10C6 -> 0 | Y72: =(RC12*R11C9+R11C10)*R11C6 -> 5000 | AA72: =SUM(RC[-9]:RC[-2]) -> 1395257.5 | AB72: =ROUND(RC[-15]/RC[-1],3) -> 1.962 | AC72: =SUM(R4C28:RC[-1]) -> 25.960000000000008 | AF72: =ROUND(RC[-14]/RC18,2) -> 1 | AG72: =ROUND(RC[-14]/RC18,2) -> 0.16 | AH72: =ROUND(RC[-14]/RC18,2) -> 7.0000000000000007E-2 | AI72: =ROUND(RC[-14]/RC18,2) -> 0.16 | AJ72: =ROUND(RC[-14]/RC18,2) -> 0.14000000000000001 | AK72: =ROUND(RC[-14]/RC18,2) -> 0.02 | AL72: =ROUND(RC[-14]/RC18,2) -> 0 | AM72: =ROUND(RC[-14]/RC18,2) -> 0.01 | AO72: =RC[-23]/R4C6 -> 17912.75 | AP72: =RC[-23]/R5C6 -> 14600 | AQ72: =RC[-23]/R6C6 -> 30840 | AR72: =RC[-23]/R7C6 -> 16270 | AS72: =RC[-23]/R8C6 -> 14100 | AT72: =RC[-23]/R9C6 -> 13610 | AV72: =RC[-23]/R11C6 -> 1000 | AX72: =RC[-9]/RC41 -> 1 | AY72: =RC[-9]/RC41 -> 0.81506189725195743 | AZ72: =RC[-9]/RC41 -> 1.7216786925513949 | BA72: =RC[-9]/RC41 -> 0.90829158001981825 | BB72: =RC[-9]/RC41 -> 0.78714881857894514 | BC72: =RC[-9]/RC41 -> 0.75979400147939313 | BD72: =RC[-9]/RC41 -> 0 | BE72: =RC[-9]/RC41 -> 5.5826157346024481E-2
L73: 70 | M73: 2938142 | N73: =SUM(R4C13:RC[-1]) -> 34357701 | R73: =(RC12*R4C9+R4C10)*R4C6*R4C7 -> 907625 | S73: =(RC12*R5C9+R5C10)*R5C6 -> 148000 | T73: =(RC12*R6C9+R6C10)*R6C6 -> 62400 | U73: =(RC12*R7C9+R7C10)*R7C6 -> 148500 | V73: =(RC12*R8C9+R8C10)*R8C6 -> 128700 | W73: =(RC12*R9C9+R9C10)*R9C6 -> 13800 | X73: =(RC12*R10C9+R10C10)*R10C6 -> 0 | Y73: =(RC12*R11C9+R11C10)*R11C6 -> 5000 | AA73: =SUM(RC[-9]:RC[-2]) -> 1414025 | AB73: =ROUND(RC[-15]/RC[-1],3) -> 2.0779999999999998 | AC73: =SUM(R4C28:RC[-1]) -> 28.038000000000007 | AF73: =ROUND(RC[-14]/RC18,2) -> 1 | AG73: =ROUND(RC[-14]/RC18,2) -> 0.16 | AH73: =ROUND(RC[-14]/RC18,2) -> 7.0000000000000007E-2 | AI73: =ROUND(RC[-14]/RC18,2) -> 0.16 | AJ73: =ROUND(RC[-14]/RC18,2) -> 0.14000000000000001 | AK73: =ROUND(RC[-14]/RC18,2) -> 0.02 | AL73: =ROUND(RC[-14]/RC18,2) -> 0 | AM73: =ROUND(RC[-14]/RC18,2) -> 0.01 | AO73: =RC[-23]/R4C6 -> 18152.5 | AP73: =RC[-23]/R5C6 -> 14800 | AQ73: =RC[-23]/R6C6 -> 31200 | AR73: =RC[-23]/R7C6 -> 16500 | AS73: =RC[-23]/R8C6 -> 14300 | AT73: =RC[-23]/R9C6 -> 13800 | AV73: =RC[-23]/R11C6 -> 1000 | AX73: =RC[-9]/RC41 -> 1 | AY73: =RC[-9]/RC41 -> 0.81531469494559983 | AZ73: =RC[-9]/RC41 -> 1.7187715190745076 | BA73: =RC[-9]/RC41 -> 0.90896570720286463 | BB73: =RC[-9]/RC41 -> 0.78777027957581602 | BC73: =RC[-9]/RC41 -> 0.76022586420603222 | BD73: =RC[-9]/RC41 -> 0 | BE73: =RC[-9]/RC41 -> 5.5088830739567551E-2
L74: 71 | M74: 3150204 | N74: =SUM(R4C13:RC[-1]) -> 37507905 | R74: =(RC12*R4C9+R4C10)*R4C6*R4C7 -> 919612.5 | S74: =(RC12*R5C9+R5C10)*R5C6 -> 150000 | T74: =(RC12*R6C9+R6C10)*R6C6 -> 63120 | U74: =(RC12*R7C9+R7C10)*R7C6 -> 150570 | V74: =(RC12*R8C9+R8C10)*R8C6 -> 130500 | W74: =(RC12*R9C9+R9C10)*R9C6 -> 13990 | X74: =(RC12*R10C9+R10C10)*R10C6 -> 0 | Y74: =(RC12*R11C9+R11C10)*R11C6 -> 5000 | AA74: =SUM(RC[-9]:RC[-2]) -> 1432792.5 | AB74: =ROUND(RC[-15]/RC[-1],3) -> 2.1989999999999998 | AC74: =SUM(R4C28:RC[-1]) -> 30.237000000000009 | AF74: =ROUND(RC[-14]/RC18,2) -> 1 | AG74: =ROUND(RC[-14]/RC18,2) -> 0.16 | AH74: =ROUND(RC[-14]/RC18,2) -> 7.0000000000000007E-2 | AI74: =ROUND(RC[-14]/RC18,2) -> 0.16 | AJ74: =ROUND(RC[-14]/RC18,2) -> 0.14000000000000001 | AK74: =ROUND(RC[-14]/RC18,2) -> 0.02 | AL74: =ROUND(RC[-14]/RC18,2) -> 0 | AM74: =ROUND(RC[-14]/RC18,2) -> 0.01 | AO74: =RC[-23]/R4C6 -> 18392.25 | AP74: =RC[-23]/R5C6 -> 15000 | AQ74: =RC[-23]/R6C6 -> 31560 | AR74: =RC[-23]/R7C6 -> 16730 | AS74: =RC[-23]/R8C6 -> 14500 | AT74: =RC[-23]/R9C6 -> 13990 | AV74: =RC[-23]/R11C6 -> 1000 | AX74: =RC[-9]/RC41 -> 1 | AY74: =RC[-9]/RC41 -> 0.81556090201035758 | AZ74: =RC[-9]/RC41 -> 1.7159401378297925 | BA74: =RC[-9]/RC41 -> 0.90962225937555219 | BB74: =RC[-9]/RC41 -> 0.78837553861001242 | BC74: =RC[-9]/RC41 -> 0.76064646794166024 | BD74: =RC[-9]/RC41 -> 0 | BE74: =RC[-9]/RC41 -> 5.4370726800690508E-2
L75: 72 | M75: 3373371 | N75: =SUM(R4C13:RC[-1]) -> 40881276 | R75: =(RC12*R4C9+R4C10)*R4C6*R4C7 -> 931600 | S75: =(RC12*R5C9+R5C10)*R5C6 -> 152000 | T75: =(RC12*R6C9+R6C10)*R6C6 -> 63840 | U75: =(RC12*R7C9+R7C10)*R7C6 -> 152640 | V75: =(RC12*R8C9+R8C10)*R8C6 -> 132300 | W75: =(RC12*R9C9+R9C10)*R9C6 -> 14180 | X75: =(RC12*R10C9+R10C10)*R10C6 -> 0 | Y75: =(RC12*R11C9+R11C10)*R11C6 -> 5000 | AA75: =SUM(RC[-9]:RC[-2]) -> 1451560 | AB75: =ROUND(RC[-15]/RC[-1],3) -> 2.3239999999999998 | AC75: =SUM(R4C28:RC[-1]) -> 32.561000000000007 | AF75: =ROUND(RC[-14]/RC18,2) -> 1 | AG75: =ROUND(RC[-14]/RC18,2) -> 0.16 | AH75: =ROUND(RC[-14]/RC18,2) -> 7.0000000000000007E-2 | AI75: =ROUND(RC[-14]/RC18,2) -> 0.16 | AJ75: =ROUND(RC[-14]/RC18,2) -> 0.14000000000000001 | AK75: =ROUND(RC[-14]/RC18,2) -> 0.02 | AL75: =ROUND(RC[-14]/RC18,2) -> 0 | AM75: =ROUND(RC[-14]/RC18,2) -> 0.01 | AO75: =RC[-23]/R4C6 -> 18632 | AP75: =RC[-23]/R5C6 -> 15200 | AQ75: =RC[-23]/R6C6 -> 31920 | AR75: =RC[-23]/R7C6 -> 16960 | AS75: =RC[-23]/R8C6 -> 14700 | AT75: =RC[-23]/R9C6 -> 14180 | AV75: =RC[-23]/R11C6 -> 1000 | AX75: =RC[-9]/RC41 -> 1 | AY75: =RC[-9]/RC41 -> 0.81580077286389008 | AZ75: =RC[-9]/RC41 -> 1.7131816230141692 | BA75: =RC[-9]/RC41 -> 0.91026191498497211 | BB75: =RC[-9]/RC41 -> 0.78896522112494638 | BC75: =RC[-9]/RC41 -> 0.76105624731644483 | BD75: =RC[-9]/RC41 -> 0 | BE75: =RC[-9]/RC41 -> 5.3671103477887505E-2
L76: 73 | M76: 3608018 | N76: =SUM(R4C13:RC[-1]) -> 44489294 | R76: =(RC12*R4C9+R4C10)*R4C6*R4C7 -> 943587.5 | S76: =(RC12*R5C9+R5C10)*R5C6 -> 154000 | T76: =(RC12*R6C9+R6C10)*R6C6 -> 64560 | U76: =(RC12*R7C9+R7C10)*R7C6 -> 154710 | V76: =(RC12*R8C9+R8C10)*R8C6 -> 134100 | W76: =(RC12*R9C9+R9C10)*R9C6 -> 14370 | X76: =(RC12*R10C9+R10C10)*R10C6 -> 0 | Y76: =(RC12*R11C9+R11C10)*R11C6 -> 5000 | AA76: =SUM(RC[-9]:RC[-2]) -> 1470327.5 | AB76: =ROUND(RC[-15]/RC[-1],3) -> 2.4540000000000002 | AC76: =SUM(R4C28:RC[-1]) -> 35.015000000000008 | AF76: =ROUND(RC[-14]/RC18,2) -> 1 | AG76: =ROUND(RC[-14]/RC18,2) -> 0.16 | AH76: =ROUND(RC[-14]/RC18,2) -> 7.0000000000000007E-2 | AI76: =ROUND(RC[-14]/RC18,2) -> 0.16 | AJ76: =ROUND(RC[-14]/RC18,2) -> 0.14000000000000001 | AK76: =ROUND(RC[-14]/RC18,2) -> 0.02 | AL76: =ROUND(RC[-14]/RC18,2) -> 0 | AM76: =ROUND(RC[-14]/RC18,2) -> 0.01 | AO76: =RC[-23]/R4C6 -> 18871.75 | AP76: =RC[-23]/R5C6 -> 15400 | AQ76: =RC[-23]/R6C6 -> 32280 | AR76: =RC[-23]/R7C6 -> 17190 | AS76: =RC[-23]/R8C6 -> 14900 | AT76: =RC[-23]/R9C6 -> 14370 | AV76: =RC[-23]/R11C6 -> 1000 | AX76: =RC[-9]/RC41 -> 1 | AY76: =RC[-9]/RC41 -> 0.81603454899519123 | AZ76: =RC[-9]/RC41 -> 1.7104931975042059 | BA76: =RC[-9]/RC41 -> 0.91088531800177519 | BB76: =RC[-9]/RC41 -> 0.78953992078106161 | BC76: =RC[-9]/RC41 -> 0.76145561487408431 | BD76: =RC[-9]/RC41 -> 0 | BE76: =RC[-9]/RC41 -> 5.298925642825917E-2
L77: 74 | M77: 3854531 | N77: =SUM(R4C13:RC[-1]) -> 48343825 | R77: =(RC12*R4C9+R4C10)*R4C6*R4C7 -> 955575 | S77: =(RC12*R5C9+R5C10)*R5C6 -> 156000 | T77: =(RC12*R6C9+R6C10)*R6C6 -> 65280 | U77: =(RC12*R7C9+R7C10)*R7C6 -> 156780 | V77: =(RC12*R8C9+R8C10)*R8C6 -> 135900 | W77: =(RC12*R9C9+R9C10)*R9C6 -> 14560 | X77: =(RC12*R10C9+R10C10)*R10C6 -> 0 | Y77: =(RC12*R11C9+R11C10)*R11C6 -> 5000 | AA77: =SUM(RC[-9]:RC[-2]) -> 1489095 | AB77: =ROUND(RC[-15]/RC[-1],3) -> 2.589 | AC77: =SUM(R4C28:RC[-1]) -> 37.604000000000006 | AF77: =ROUND(RC[-14]/RC18,2) -> 1 | AG77: =ROUND(RC[-14]/RC18,2) -> 0.16 | AH77: =ROUND(RC[-14]/RC18,2) -> 7.0000000000000007E-2 | AI77: =ROUND(RC[-14]/RC18,2) -> 0.16 | AJ77: =ROUND(RC[-14]/RC18,2) -> 0.14000000000000001 | AK77: =ROUND(RC[-14]/RC18,2) -> 0.02 | AL77: =ROUND(RC[-14]/RC18,2) -> 0 | AM77: =ROUND(RC[-14]/RC18,2) -> 0.01 | AO77: =RC[-23]/R4C6 -> 19111.5 | AP77: =RC[-23]/R5C6 -> 15600 | AQ77: =RC[-23]/R6C6 -> 32640 | AR77: =RC[-23]/R7C6 -> 17420 | AS77: =RC[-23]/R8C6 -> 15100 | AT77: =RC[-23]/R9C6 -> 14560 | AV77: =RC[-23]/R11C6 -> 1000 | AX77: =RC[-9]/RC41 -> 1 | AY77: =RC[-9]/RC41 -> 0.8162624597755278 | AZ77: =RC[-9]/RC41 -> 1.7078722235303352 | BA77: =RC[-9]/RC41 -> 0.91149308008267271 | BB77: =RC[-9]/RC41 -> 0.79010020144938908 | BC77: =RC[-9]/RC41 -> 0.76184496245715927 | BD77: =RC[-9]/RC41 -> 0 | BE77: =RC[-9]/RC41 -> 5.2324516652277428E-2
L78: 75 | M78: 4113297 | N78: =SUM(R4C13:RC[-1]) -> 52457122 | R78: =(RC12*R4C9+R4C10)*R4C6*R4C7 -> 967562.5 | S78: =(RC12*R5C9+R5C10)*R5C6 -> 158000 | T78: =(RC12*R6C9+R6C10)*R6C6 -> 66000 | U78: =(RC12*R7C9+R7C10)*R7C6 -> 158850 | V78: =(RC12*R8C9+R8C10)*R8C6 -> 137700 | W78: =(RC12*R9C9+R9C10)*R9C6 -> 14750 | X78: =(RC12*R10C9+R10C10)*R10C6 -> 0 | Y78: =(RC12*R11C9+R11C10)*R11C6 -> 5000 | AA78: =SUM(RC[-9]:RC[-2]) -> 1507862.5 | AB78: =ROUND(RC[-15]/RC[-1],3) -> 2.7280000000000002 | AC78: =SUM(R4C28:RC[-1]) -> 40.332000000000008 | AF78: =ROUND(RC[-14]/RC18,2) -> 1 | AG78: =ROUND(RC[-14]/RC18,2) -> 0.16 | AH78: =ROUND(RC[-14]/RC18,2) -> 7.0000000000000007E-2 | AI78: =ROUND(RC[-14]/RC18,2) -> 0.16 | AJ78: =ROUND(RC[-14]/RC18,2) -> 0.14000000000000001 | AK78: =ROUND(RC[-14]/RC18,2) -> 0.02 | AL78: =ROUND(RC[-14]/RC18,2) -> 0 | AM78: =ROUND(RC[-14]/RC18,2) -> 0.01 | AO78: =RC[-23]/R4C6 -> 19351.25 | AP78: =RC[-23]/R5C6 -> 15800 | AQ78: =RC[-23]/R6C6 -> 33000 | AR78: =RC[-23]/R7C6 -> 17650 | AS78: =RC[-23]/R8C6 -> 15300 | AT78: =RC[-23]/R9C6 -> 14750 | AV78: =RC[-23]/R11C6 -> 1000 | AX78: =RC[-9]/RC41 -> 1 | AY78: =RC[-9]/RC41 -> 0.81648472320909504 | AZ78: =RC[-9]/RC41 -> 1.7053161940443125 | BA78: =RC[-9]/RC41 -> 0.91208578257218531 | BB78: =RC[-9]/RC41 -> 0.79064659905690848 | BC78: =RC[-9]/RC41 -> 0.76222466248950327 | BD78: =RC[-9]/RC41 -> 0 | BE78: =RC[-9]/RC41 -> 5.1676248304373104E-2
L79: 76 | M79: 4384713 | N79: =SUM(R4C13:RC[-1]) -> 56841835 | R79: =(RC12*R4C9+R4C10)*R4C6*R4C7 -> 979550 | S79: =(RC12*R5C9+R5C10)*R5C6 -> 160000 | T79: =(RC12*R6C9+R6C10)*R6C6 -> 66720 | U79: =(RC12*R7C9+R7C10)*R7C6 -> 160920 | V79: =(RC12*R8C9+R8C10)*R8C6 -> 139500 | W79: =(RC12*R9C9+R9C10)*R9C6 -> 14940 | X79: =(RC12*R10C9+R10C10)*R10C6 -> 0 | Y79: =(RC12*R11C9+R11C10)*R11C6 -> 5000 | AA79: =SUM(RC[-9]:RC[-2]) -> 1526630 | AB79: =ROUND(RC[-15]/RC[-1],3) -> 2.8719999999999999 | AC79: =SUM(R4C28:RC[-1]) -> 43.204000000000008 | AF79: =ROUND(RC[-14]/RC18,2) -> 1 | AG79: =ROUND(RC[-14]/RC18,2) -> 0.16 | AH79: =ROUND(RC[-14]/RC18,2) -> 7.0000000000000007E-2 | AI79: =ROUND(RC[-14]/RC18,2) -> 0.16 | AJ79: =ROUND(RC[-14]/RC18,2) -> 0.14000000000000001 | AK79: =ROUND(RC[-14]/RC18,2) -> 0.02 | AL79: =ROUND(RC[-14]/RC18,2) -> 0 | AM79: =ROUND(RC[-14]/RC18,2) -> 0.01 | AO79: =RC[-23]/R4C6 -> 19591 | AP79: =RC[-23]/R5C6 -> 16000 | AQ79: =RC[-23]/R6C6 -> 33360 | AR79: =RC[-23]/R7C6 -> 17880 | AS79: =RC[-23]/R8C6 -> 15500 | AT79: =RC[-23]/R9C6 -> 14940 | AV79: =RC[-23]/R11C6 -> 1000 | AX79: =RC[-9]/RC41 -> 1 | AY79: =RC[-9]/RC41 -> 0.81670154662855388 | AZ79: =RC[-9]/RC41 -> 1.702822724720535 | BA79: =RC[-9]/RC41 -> 0.91266397835740898 | BB79: =RC[-9]/RC41 -> 0.79117962329641167 | BC79: =RC[-9]/RC41 -> 0.76259506916441222 | BD79: =RC[-9]/RC41 -> 0 | BE79: =RC[-9]/RC41 -> 5.1043846664284617E-2
L80: 77 | M80: 4669180 | N80: =SUM(R4C13:RC[-1]) -> 61511015 | R80: =(RC12*R4C9+R4C10)*R4C6*R4C7 -> 991537.5 | S80: =(RC12*R5C9+R5C10)*R5C6 -> 162000 | T80: =(RC12*R6C9+R6C10)*R6C6 -> 67440 | U80: =(RC12*R7C9+R7C10)*R7C6 -> 162990 | V80: =(RC12*R8C9+R8C10)*R8C6 -> 141300 | W80: =(RC12*R9C9+R9C10)*R9C6 -> 15130 | X80: =(RC12*R10C9+R10C10)*R10C6 -> 0 | Y80: =(RC12*R11C9+R11C10)*R11C6 -> 5000 | AA80: =SUM(RC[-9]:RC[-2]) -> 1545397.5 | AB80: =ROUND(RC[-15]/RC[-1],3) -> 3.0209999999999999 | AC80: =SUM(R4C28:RC[-1]) -> 46.225000000000009 | AF80: =ROUND(RC[-14]/RC18,2) -> 1 | AG80: =ROUND(RC[-14]/RC18,2) -> 0.16 | AH80: =ROUND(RC[-14]/RC18,2) -> 7.0000000000000007E-2 | AI80: =ROUND(RC[-14]/RC18,2) -> 0.16 | AJ80: =ROUND(RC[-14]/RC18,2) -> 0.14000000000000001 | AK80: =ROUND(RC[-14]/RC18,2) -> 0.02 | AL80: =ROUND(RC[-14]/RC18,2) -> 0 | AM80: =ROUND(RC[-14]/RC18,2) -> 0.01 | AO80: =RC[-23]/R4C6 -> 19830.75 | AP80: =RC[-23]/R5C6 -> 16200 | AQ80: =RC[-23]/R6C6 -> 33720 | AR80: =RC[-23]/R7C6 -> 18110 | AS80: =RC[-23]/R8C6 -> 15700 | AT80: =RC[-23]/R9C6 -> 15130 | AV80: =RC[-23]/R11C6 -> 1000 | AX80: =RC[-9]/RC41 -> 1 | AY80: =RC[-9]/RC41 -> 0.81691312734011567 | AZ80: =RC[-9]/RC41 -> 1.7003895465375742 | BA80: =RC[-9]/RC41 -> 0.91322819358824048 | BB80: =RC[-9]/RC41 -> 0.79169975921233438 | BC80: =RC[-9]/RC41 -> 0.76295651954666366 | BD80: =RC[-9]/RC41 -> 0 | BE80: =RC[-9]/RC41 -> 5.0426736255562703E-2
L81: 78 | M81: 4967106 | N81: =SUM(R4C13:RC[-1]) -> 66478121 | R81: =(RC12*R4C9+R4C10)*R4C6*R4C7 -> 1003525 | S81: =(RC12*R5C9+R5C10)*R5C6 -> 164000 | T81: =(RC12*R6C9+R6C10)*R6C6 -> 68160 | U81: =(RC12*R7C9+R7C10)*R7C6 -> 165060 | V81: =(RC12*R8C9+R8C10)*R8C6 -> 143100 | W81: =(RC12*R9C9+R9C10)*R9C6 -> 15320 | X81: =(RC12*R10C9+R10C10)*R10C6 -> 0 | Y81: =(RC12*R11C9+R11C10)*R11C6 -> 5000 | AA81: =SUM(RC[-9]:RC[-2]) -> 1564165 | AB81: =ROUND(RC[-15]/RC[-1],3) -> 3.1760000000000002 | AC81: =SUM(R4C28:RC[-1]) -> 49.40100000000001 | AF81: =ROUND(RC[-14]/RC18,2) -> 1 | AG81: =ROUND(RC[-14]/RC18,2) -> 0.16 | AH81: =ROUND(RC[-14]/RC18,2) -> 7.0000000000000007E-2 | AI81: =ROUND(RC[-14]/RC18,2) -> 0.16 | AJ81: =ROUND(RC[-14]/RC18,2) -> 0.14000000000000001 | AK81: =ROUND(RC[-14]/RC18,2) -> 0.02 | AL81: =ROUND(RC[-14]/RC18,2) -> 0 | AM81: =ROUND(RC[-14]/RC18,2) -> 0 | AO81: =RC[-23]/R4C6 -> 20070.5 | AP81: =RC[-23]/R5C6 -> 16400 | AQ81: =RC[-23]/R6C6 -> 34080 | AR81: =RC[-23]/R7C6 -> 18340 | AS81: =RC[-23]/R8C6 -> 15900 | AT81: =RC[-23]/R9C6 -> 15320 | AV81: =RC[-23]/R11C6 -> 1000 | AX81: =RC[-9]/RC41 -> 1 | AY81: =RC[-9]/RC41 -> 0.81711965322239111 | AZ81: =RC[-9]/RC41 -> 1.6980144988914079 | BA81: =RC[-9]/RC41 -> 0.91377892927430804 | BB81: =RC[-9]/RC41 -> 0.79220746867292791 | BC81: =RC[-9]/RC41 -> 0.76330933459555073 | BD81: =RC[-9]/RC41 -> 0 | BE81: =RC[-9]/RC41 -> 4.9824369098926284E-2
L82: 79 | M82: 5278907 | N82: =SUM(R4C13:RC[-1]) -> 71757028 | R82: =(RC12*R4C9+R4C10)*R4C6*R4C7 -> 1015512.5 | S82: =(RC12*R5C9+R5C10)*R5C6 -> 166000 | T82: =(RC12*R6C9+R6C10)*R6C6 -> 68880 | U82: =(RC12*R7C9+R7C10)*R7C6 -> 167130 | V82: =(RC12*R8C9+R8C10)*R8C6 -> 144900 | W82: =(RC12*R9C9+R9C10)*R9C6 -> 15510 | X82: =(RC12*R10C9+R10C10)*R10C6 -> 0 | Y82: =(RC12*R11C9+R11C10)*R11C6 -> 5000 | AA82: =SUM(RC[-9]:RC[-2]) -> 1582932.5 | AB82: =ROUND(RC[-15]/RC[-1],3) -> 3.335 | AC82: =SUM(R4C28:RC[-1]) -> 52.736000000000011 | AF82: =ROUND(RC[-14]/RC18,2) -> 1 | AG82: =ROUND(RC[-14]/RC18,2) -> 0.16 | AH82: =ROUND(RC[-14]/RC18,2) -> 7.0000000000000007E-2 | AI82: =ROUND(RC[-14]/RC18,2) -> 0.16 | AJ82: =ROUND(RC[-14]/RC18,2) -> 0.14000000000000001 | AK82: =ROUND(RC[-14]/RC18,2) -> 0.02 | AL82: =ROUND(RC[-14]/RC18,2) -> 0 | AM82: =ROUND(RC[-14]/RC18,2) -> 0 | AO82: =RC[-23]/R4C6 -> 20310.25 | AP82: =RC[-23]/R5C6 -> 16600 | AQ82: =RC[-23]/R6C6 -> 34440 | AR82: =RC[-23]/R7C6 -> 18570 | AS82: =RC[-23]/R8C6 -> 16100 | AT82: =RC[-23]/R9C6 -> 15510 | AV82: =RC[-23]/R11C6 -> 1000 | AX82: =RC[-9]/RC41 -> 1 | AY82: =RC[-9]/RC41 -> 0.81732130328282515 | AZ82: =RC[-9]/RC41 -> 1.6956955231964157 | BA82: =RC[-9]/RC41 -> 0.91431666276879897 | BB82: =RC[-9]/RC41 -> 0.79270319173816173 | BC82: =RC[-9]/RC41 -> 0.7636538201154589 | BD82: =RC[-9]/RC41 -> 0 | BE82: =RC[-9]/RC41 -> 4.9236223089326819E-2
L83: 80 | M83: 6165502 | N83: =SUM(R4C13:RC[-1]) -> 77922530 | R83: =(RC12*R4C9+R4C10)*R4C6*R4C7 -> 1027500 | S83: =(RC12*R5C9+R5C10)*R5C6 -> 168000 | T83: =(RC12*R6C9+R6C10)*R6C6 -> 69600 | U83: =(RC12*R7C9+R7C10)*R7C6 -> 169200 | V83: =(RC12*R8C9+R8C10)*R8C6 -> 146700 | W83: =(RC12*R9C9+R9C10)*R9C6 -> 15700 | X83: =(RC12*R10C9+R10C10)*R10C6 -> 0 | Y83: =(RC12*R11C9+R11C10)*R11C6 -> 5000 | AA83: =SUM(RC[-9]:RC[-2]) -> 1601700 | AB83: =ROUND(RC[-15]/RC[-1],3) -> 3.8490000000000002 | AC83: =SUM(R4C28:RC[-1]) -> 56.585000000000008 | AD83: =RC[-1]/12 -> 4.715416666666667 | AF83: =ROUND(RC[-14]/RC18,2) -> 1 | AG83: =ROUND(RC[-14]/RC18,2) -> 0.16 | AH83: =ROUND(RC[-14]/RC18,2) -> 7.0000000000000007E-2 | AI83: =ROUND(RC[-14]/RC18,2) -> 0.16 | AJ83: =ROUND(RC[-14]/RC18,2) -> 0.14000000000000001 | AK83: =ROUND(RC[-14]/RC18,2) -> 0.02 | AL83: =ROUND(RC[-14]/RC18,2) -> 0 | AM83: =ROUND(RC[-14]/RC18,2) -> 0 | AO83: =RC[-23]/R4C6 -> 20550 | AP83: =RC[-23]/R5C6 -> 16800 | AQ83: =RC[-23]/R6C6 -> 34800 | AR83: =RC[-23]/R7C6 -> 18800 | AS83: =RC[-23]/R8C6 -> 16300 | AT83: =RC[-23]/R9C6 -> 15700 | AV83: =RC[-23]/R11C6 -> 1000 | AX83: =RC[-9]/RC41 -> 1 | AY83: =RC[-9]/RC41 -> 0.81751824817518248 | AZ83: =RC[-9]/RC41 -> 1.6934306569343065 | BA83: =RC[-9]/RC41 -> 0.91484184914841848 | BB83: =RC[-9]/RC41 -> 0.79318734793187351 | BC83: =RC[-9]/RC41 -> 0.76399026763990263 | BD83: =RC[-9]/RC41 -> 0 | BE83: =RC[-9]/RC41 -> 4.8661800486618008E-2
L84: 81 | M84: 7134982 | N84: =SUM(R4C13:RC[-1]) -> 85057512 | R84: =(RC12*R4C9+R4C10)*R4C6*R4C7 -> 1039487.5 | S84: =(RC12*R5C9+R5C10)*R5C6 -> 170000 | T84: =(RC12*R6C9+R6C10)*R6C6 -> 70320 | U84: =(RC12*R7C9+R7C10)*R7C6 -> 171270 | V84: =(RC12*R8C9+R8C10)*R8C6 -> 148500 | W84: =(RC12*R9C9+R9C10)*R9C6 -> 15890 | X84: =(RC12*R10C9+R10C10)*R10C6 -> 0 | Y84: =(RC12*R11C9+R11C10)*R11C6 -> 5000 | AA84: =SUM(RC[-9]:RC[-2]) -> 1620467.5 | AB84: =ROUND(RC[-15]/RC[-1],3) -> 4.4029999999999996 | AC84: =SUM(R4C28:RC[-1]) -> 60.988000000000007 | AF84: =ROUND(RC[-14]/RC18,2) -> 1 | AG84: =ROUND(RC[-14]/RC18,2) -> 0.16 | AH84: =ROUND(RC[-14]/RC18,2) -> 7.0000000000000007E-2 | AI84: =ROUND(RC[-14]/RC18,2) -> 0.16 | AJ84: =ROUND(RC[-14]/RC18,2) -> 0.14000000000000001 | AK84: =ROUND(RC[-14]/RC18,2) -> 0.02 | AL84: =ROUND(RC[-14]/RC18,2) -> 0 | AM84: =ROUND(RC[-14]/RC18,2) -> 0 | AO84: =RC[-23]/R4C6 -> 20789.75 | AP84: =RC[-23]/R5C6 -> 17000 | AQ84: =RC[-23]/R6C6 -> 35160 | AR84: =RC[-23]/R7C6 -> 19030 | AS84: =RC[-23]/R8C6 -> 16500 | AT84: =RC[-23]/R9C6 -> 15890 | AV84: =RC[-23]/R11C6 -> 1000 | AX84: =RC[-9]/RC41 -> 1 | AY84: =RC[-9]/RC41 -> 0.81771065068122517 | AZ84: =RC[-9]/RC41 -> 1.6912180281148161 | BA84: =RC[-9]/RC41 -> 0.91535492249786554 | BB84: =RC[-9]/RC41 -> 0.79366033742589492 | BC84: =RC[-9]/RC41 -> 0.7643189552543922 | BD84: =RC[-9]/RC41 -> 0 | BE84: =RC[-9]/RC41 -> 4.8100626510660299E-2
L85: 82 | M85: 8192326 | N85: =SUM(R4C13:RC[-1]) -> 93249838 | R85: =(RC12*R4C9+R4C10)*R4C6*R4C7 -> 1051475 | S85: =(RC12*R5C9+R5C10)*R5C6 -> 172000 | T85: =(RC12*R6C9+R6C10)*R6C6 -> 71040 | U85: =(RC12*R7C9+R7C10)*R7C6 -> 173340 | V85: =(RC12*R8C9+R8C10)*R8C6 -> 150300 | W85: =(RC12*R9C9+R9C10)*R9C6 -> 16080 | X85: =(RC12*R10C9+R10C10)*R10C6 -> 0 | Y85: =(RC12*R11C9+R11C10)*R11C6 -> 5000 | AA85: =SUM(RC[-9]:RC[-2]) -> 1639235 | AB85: =ROUND(RC[-15]/RC[-1],3) -> 4.9980000000000002 | AC85: =SUM(R4C28:RC[-1]) -> 65.986000000000004 | AF85: =ROUND(RC[-14]/RC18,2) -> 1 | AG85: =ROUND(RC[-14]/RC18,2) -> 0.16 | AH85: =ROUND(RC[-14]/RC18,2) -> 7.0000000000000007E-2 | AI85: =ROUND(RC[-14]/RC18,2) -> 0.16 | AJ85: =ROUND(RC[-14]/RC18,2) -> 0.14000000000000001 | AK85: =ROUND(RC[-14]/RC18,2) -> 0.02 | AL85: =ROUND(RC[-14]/RC18,2) -> 0 | AM85: =ROUND(RC[-14]/RC18,2) -> 0 | AO85: =RC[-23]/R4C6 -> 21029.5 | AP85: =RC[-23]/R5C6 -> 17200 | AQ85: =RC[-23]/R6C6 -> 35520 | AR85: =RC[-23]/R7C6 -> 19260 | AS85: =RC[-23]/R8C6 -> 16700 | AT85: =RC[-23]/R9C6 -> 16080 | AV85: =RC[-23]/R11C6 -> 1000 | AX85: =RC[-9]/RC41 -> 1 | AY85: =RC[-9]/RC41 -> 0.81789866615944273 | AZ85: =RC[-9]/RC41 -> 1.6890558501153141 | BA85: =RC[-9]/RC41 -> 0.91585629710644567 | BB85: =RC[-9]/RC41 -> 0.79412254214317979 | BC85: =RC[-9]/RC41 -> 0.76464014836301386 | BD85: =RC[-9]/RC41 -> 0 | BE85: =RC[-9]/RC41 -> 4.7552248032525737E-2
L86: 83 | M86: 9342695 | N86: =SUM(R4C13:RC[-1]) -> 102592533 | O86: 5613976 | P86: =RC[-3]/RC[-1] -> 1.6641850624227821 | R86: =(RC12*R4C9+R4C10)*R4C6*R4C7 -> 1063462.5 | S86: =(RC12*R5C9+R5C10)*R5C6 -> 174000 | T86: =(RC12*R6C9+R6C10)*R6C6 -> 71760 | U86: =(RC12*R7C9+R7C10)*R7C6 -> 175410 | V86: =(RC12*R8C9+R8C10)*R8C6 -> 152100 | W86: =(RC12*R9C9+R9C10)*R9C6 -> 16270 | X86: =(RC12*R10C9+R10C10)*R10C6 -> 0 | Y86: =(RC12*R11C9+R11C10)*R11C6 -> 5000 | AA86: =SUM(RC[-9]:RC[-2]) -> 1658002.5 | AB86: =ROUND(RC[-15]/RC[-1],3) -> 5.6349999999999998 | AC86: =SUM(R4C28:RC[-1]) -> 71.621000000000009 | AF86: =ROUND(RC[-14]/RC18,2) -> 1 | AG86: =ROUND(RC[-14]/RC18,2) -> 0.16 | AH86: =ROUND(RC[-14]/RC18,2) -> 7.0000000000000007E-2 | AI86: =ROUND(RC[-14]/RC18,2) -> 0.16 | AJ86: =ROUND(RC[-14]/RC18,2) -> 0.14000000000000001 | AK86: =ROUND(RC[-14]/RC18,2) -> 0.02 | AL86: =ROUND(RC[-14]/RC18,2) -> 0 | AM86: =ROUND(RC[-14]/RC18,2) -> 0 | AO86: =RC[-23]/R4C6 -> 21269.25 | AP86: =RC[-23]/R5C6 -> 17400 | AQ86: =RC[-23]/R6C6 -> 35880 | AR86: =RC[-23]/R7C6 -> 19490 | AS86: =RC[-23]/R8C6 -> 16900 | AT86: =RC[-23]/R9C6 -> 16270 | AV86: =RC[-23]/R11C6 -> 1000 | AX86: =RC[-9]/RC41 -> 1 | AY86: =RC[-9]/RC41 -> 0.81808244296343313 | AZ86: =RC[-9]/RC41 -> 1.6869424168694243 | BA86: =RC[-9]/RC41 -> 0.91634636858375351 | BB86: =RC[-9]/RC41 -> 0.794574326786323 | BC86: =RC[-9]/RC41 -> 0.76495410040316414 | BD86: =RC[-9]/RC41 -> 0 | BE86: =RC[-9]/RC41 -> 4.7016232354220297E-2
L87: 84 | M87: 10591436 | N87: =SUM(R4C13:RC[-1]) -> 113183969 | R87: =(RC12*R4C9+R4C10)*R4C6*R4C7 -> 1075450 | S87: =(RC12*R5C9+R5C10)*R5C6 -> 176000 | T87: =(RC12*R6C9+R6C10)*R6C6 -> 72480 | U87: =(RC12*R7C9+R7C10)*R7C6 -> 177480 | V87: =(RC12*R8C9+R8C10)*R8C6 -> 153900 | W87: =(RC12*R9C9+R9C10)*R9C6 -> 16460 | X87: =(RC12*R10C9+R10C10)*R10C6 -> 0 | Y87: =(RC12*R11C9+R11C10)*R11C6 -> 5000 | AA87: =SUM(RC[-9]:RC[-2]) -> 1676770 | AB87: =ROUND(RC[-15]/RC[-1],3) -> 6.3170000000000002 | AC87: =SUM(R4C28:RC[-1]) -> 77.938000000000017 | AF87: =ROUND(RC[-14]/RC18,2) -> 1 | AG87: =ROUND(RC[-14]/RC18,2) -> 0.16 | AH87: =ROUND(RC[-14]/RC18,2) -> 7.0000000000000007E-2 | AI87: =ROUND(RC[-14]/RC18,2) -> 0.17 | AJ87: =ROUND(RC[-14]/RC18,2) -> 0.14000000000000001 | AK87: =ROUND(RC[-14]/RC18,2) -> 0.02 | AL87: =ROUND(RC[-14]/RC18,2) -> 0 | AM87: =ROUND(RC[-14]/RC18,2) -> 0 | AO87: =RC[-23]/R4C6 -> 21509 | AP87: =RC[-23]/R5C6 -> 17600 | AQ87: =RC[-23]/R6C6 -> 36240 | AR87: =RC[-23]/R7C6 -> 19720 | AS87: =RC[-23]/R8C6 -> 17100 | AT87: =RC[-23]/R9C6 -> 16460 | AV87: =RC[-23]/R11C6 -> 1000 | AX87: =RC[-9]/RC41 -> 1 | AY87: =RC[-9]/RC41 -> 0.81826212283230271 | AZ87: =RC[-9]/RC41 -> 1.6848760983774234 | BA87: =RC[-9]/RC41 -> 0.91682551490073927 | BB87: =RC[-9]/RC41 -> 0.79501603979729418 | BC87: =RC[-9]/RC41 -> 0.76526105351248319 | BD87: =RC[-9]/RC41 -> 0 | BE87: =RC[-9]/RC41 -> 4.6492166070017202E-2
L88: 85 | M88: 11944083 | N88: =SUM(R4C13:RC[-1]) -> 125128052 | R88: =(RC12*R4C9+R4C10)*R4C6*R4C7 -> 1087437.5 | S88: =(RC12*R5C9+R5C10)*R5C6 -> 178000 | T88: =(RC12*R6C9+R6C10)*R6C6 -> 73200 | U88: =(RC12*R7C9+R7C10)*R7C6 -> 179550 | V88: =(RC12*R8C9+R8C10)*R8C6 -> 155700 | W88: =(RC12*R9C9+R9C10)*R9C6 -> 16650 | X88: =(RC12*R10C9+R10C10)*R10C6 -> 0 | Y88: =(RC12*R11C9+R11C10)*R11C6 -> 5000 | AA88: =SUM(RC[-9]:RC[-2]) -> 1695537.5 | AB88: =ROUND(RC[-15]/RC[-1],3) -> 7.0439999999999996 | AC88: =SUM(R4C28:RC[-1]) -> 84.982000000000014 | AF88: =ROUND(RC[-14]/RC18,2) -> 1 | AG88: =ROUND(RC[-14]/RC18,2) -> 0.16 | AH88: =ROUND(RC[-14]/RC18,2) -> 7.0000000000000007E-2 | AI88: =ROUND(RC[-14]/RC18,2) -> 0.17 | AJ88: =ROUND(RC[-14]/RC18,2) -> 0.14000000000000001 | AK88: =ROUND(RC[-14]/RC18,2) -> 0.02 | AL88: =ROUND(RC[-14]/RC18,2) -> 0 | AM88: =ROUND(RC[-14]/RC18,2) -> 0 | AO88: =RC[-23]/R4C6 -> 21748.75 | AP88: =RC[-23]/R5C6 -> 17800 | AQ88: =RC[-23]/R6C6 -> 36600 | AR88: =RC[-23]/R7C6 -> 19950 | AS88: =RC[-23]/R8C6 -> 17300 | AT88: =RC[-23]/R9C6 -> 16650 | AV88: =RC[-23]/R11C6 -> 1000 | AX88: =RC[-9]/RC41 -> 1 | AY88: =RC[-9]/RC41 -> 0.81843784125524455 | AZ88: =RC[-9]/RC41 -> 1.6828553365135928 | BA88: =RC[-9]/RC41 -> 0.91729409736191736 | BB88: =RC[-9]/RC41 -> 0.79544801425369271 | BC88: =RC[-9]/RC41 -> 0.7655612391516754 | BD88: =RC[-9]/RC41 -> 0 | BE88: =RC[-9]/RC41 -> 4.5979654003103623E-2
L89: 86 | M89: 13406363 | N89: =SUM(R4C13:RC[-1]) -> 138534415 | R89: =(RC12*R4C9+R4C10)*R4C6*R4C7 -> 1099425 | S89: =(RC12*R5C9+R5C10)*R5C6 -> 180000 | T89: =(RC12*R6C9+R6C10)*R6C6 -> 73920 | U89: =(RC12*R7C9+R7C10)*R7C6 -> 181620 | V89: =(RC12*R8C9+R8C10)*R8C6 -> 157500 | W89: =(RC12*R9C9+R9C10)*R9C6 -> 16840 | X89: =(RC12*R10C9+R10C10)*R10C6 -> 0 | Y89: =(RC12*R11C9+R11C10)*R11C6 -> 5000 | AA89: =SUM(RC[-9]:RC[-2]) -> 1714305 | AB89: =ROUND(RC[-15]/RC[-1],3) -> 7.82 | AC89: =SUM(R4C28:RC[-1]) -> 92.802000000000021 | AF89: =ROUND(RC[-14]/RC18,2) -> 1 | AG89: =ROUND(RC[-14]/RC18,2) -> 0.16 | AH89: =ROUND(RC[-14]/RC18,2) -> 7.0000000000000007E-2 | AI89: =ROUND(RC[-14]/RC18,2) -> 0.17 | AJ89: =ROUND(RC[-14]/RC18,2) -> 0.14000000000000001 | AK89: =ROUND(RC[-14]/RC18,2) -> 0.02 | AL89: =ROUND(RC[-14]/RC18,2) -> 0 | AM89: =ROUND(RC[-14]/RC18,2) -> 0 | AO89: =RC[-23]/R4C6 -> 21988.5 | AP89: =RC[-23]/R5C6 -> 18000 | AQ89: =RC[-23]/R6C6 -> 36960 | AR89: =RC[-23]/R7C6 -> 20180 | AS89: =RC[-23]/R8C6 -> 17500 | AT89: =RC[-23]/R9C6 -> 16840 | AV89: =RC[-23]/R11C6 -> 1000 | AX89: =RC[-9]/RC41 -> 1 | AY89: =RC[-9]/RC41 -> 0.81860972781226549 | AZ89: =RC[-9]/RC41 -> 1.6808786411078518 | BA89: =RC[-9]/RC41 -> 0.91775246151397316 | BB89: =RC[-9]/RC41 -> 0.79587056870636919 | BC89: =RC[-9]/RC41 -> 0.76585487868658619 | BD89: =RC[-9]/RC41 -> 0 | BE89: =RC[-9]/RC41 -> 4.5478318211792525E-2
L90: 87 | M90: 14984196 | N90: =SUM(R4C13:RC[-1]) -> 153518611 | R90: =(RC12*R4C9+R4C10)*R4C6*R4C7 -> 1111412.5 | S90: =(RC12*R5C9+R5C10)*R5C6 -> 182000 | T90: =(RC12*R6C9+R6C10)*R6C6 -> 74640 | U90: =(RC12*R7C9+R7C10)*R7C6 -> 183690 | V90: =(RC12*R8C9+R8C10)*R8C6 -> 159300 | W90: =(RC12*R9C9+R9C10)*R9C6 -> 17030 | X90: =(RC12*R10C9+R10C10)*R10C6 -> 0 | Y90: =(RC12*R11C9+R11C10)*R11C6 -> 5000 | AA90: =SUM(RC[-9]:RC[-2]) -> 1733072.5 | AB90: =ROUND(RC[-15]/RC[-1],3) -> 8.6460000000000008 | AC90: =SUM(R4C28:RC[-1]) -> 101.44800000000002 | AF90: =ROUND(RC[-14]/RC18,2) -> 1 | AG90: =ROUND(RC[-14]/RC18,2) -> 0.16 | AH90: =ROUND(RC[-14]/RC18,2) -> 7.0000000000000007E-2 | AI90: =ROUND(RC[-14]/RC18,2) -> 0.17 | AJ90: =ROUND(RC[-14]/RC18,2) -> 0.14000000000000001 | AK90: =ROUND(RC[-14]/RC18,2) -> 0.02 | AL90: =ROUND(RC[-14]/RC18,2) -> 0 | AM90: =ROUND(RC[-14]/RC18,2) -> 0 | AO90: =RC[-23]/R4C6 -> 22228.25 | AP90: =RC[-23]/R5C6 -> 18200 | AQ90: =RC[-23]/R6C6 -> 37320 | AR90: =RC[-23]/R7C6 -> 20410 | AS90: =RC[-23]/R8C6 -> 17700 | AT90: =RC[-23]/R9C6 -> 17030 | AV90: =RC[-23]/R11C6 -> 1000 | AX90: =RC[-9]/RC41 -> 1 | AY90: =RC[-9]/RC41 -> 0.81877790649286386 | AZ90: =RC[-9]/RC41 -> 1.6789445862809713 | BA90: =RC[-9]/RC41 -> 0.91820093799556868 | BB90: =RC[-9]/RC41 -> 0.79628400796284005 | BC90: =RC[-9]/RC41 -> 0.76614218393260825 | BD90: =RC[-9]/RC41 -> 0 | BE90: =RC[-9]/RC41 -> 4.4987797060047463E-2
L91: 88 | M91: 16683700 | N91: =SUM(R4C13:RC[-1]) -> 170202311 | R91: =(RC12*R4C9+R4C10)*R4C6*R4C7 -> 1123400 | S91: =(RC12*R5C9+R5C10)*R5C6 -> 184000 | T91: =(RC12*R6C9+R6C10)*R6C6 -> 75360 | U91: =(RC12*R7C9+R7C10)*R7C6 -> 185760 | V91: =(RC12*R8C9+R8C10)*R8C6 -> 161100 | W91: =(RC12*R9C9+R9C10)*R9C6 -> 17220 | X91: =(RC12*R10C9+R10C10)*R10C6 -> 0 | Y91: =(RC12*R11C9+R11C10)*R11C6 -> 5000 | AA91: =SUM(RC[-9]:RC[-2]) -> 1751840 | AB91: =ROUND(RC[-15]/RC[-1],3) -> 9.5239999999999991 | AC91: =SUM(R4C28:RC[-1]) -> 110.97200000000002 | AF91: =ROUND(RC[-14]/RC18,2) -> 1 | AG91: =ROUND(RC[-14]/RC18,2) -> 0.16 | AH91: =ROUND(RC[-14]/RC18,2) -> 7.0000000000000007E-2 | AI91: =ROUND(RC[-14]/RC18,2) -> 0.17 | AJ91: =ROUND(RC[-14]/RC18,2) -> 0.14000000000000001 | AK91: =ROUND(RC[-14]/RC18,2) -> 0.02 | AL91: =ROUND(RC[-14]/RC18,2) -> 0 | AM91: =ROUND(RC[-14]/RC18,2) -> 0 | AO91: =RC[-23]/R4C6 -> 22468 | AP91: =RC[-23]/R5C6 -> 18400 | AQ91: =RC[-23]/R6C6 -> 37680 | AR91: =RC[-23]/R7C6 -> 20640 | AS91: =RC[-23]/R8C6 -> 17900 | AT91: =RC[-23]/R9C6 -> 17220 | AV91: =RC[-23]/R11C6 -> 1000 | AX91: =RC[-9]/RC41 -> 1 | AY91: =RC[-9]/RC41 -> 0.81894249599430302 | AZ91: =RC[-9]/RC41 -> 1.6770518070144205 | BA91: =RC[-9]/RC41 -> 0.91863984333273985 | BB91: =RC[-9]/RC41 -> 0.79668862382054473 | BC91: =RC[-9]/RC41 -> 0.76642335766423353 | BD91: =RC[-9]/RC41 -> 0 | BE91: =RC[-9]/RC41 -> 4.4507744347516469E-2
L92: 89 | M92: 18511193 | N92: =SUM(R4C13:RC[-1]) -> 188713504 | R92: =(RC12*R4C9+R4C10)*R4C6*R4C7 -> 1135387.5 | S92: =(RC12*R5C9+R5C10)*R5C6 -> 186000 | T92: =(RC12*R6C9+R6C10)*R6C6 -> 76080 | U92: =(RC12*R7C9+R7C10)*R7C6 -> 187830 | V92: =(RC12*R8C9+R8C10)*R8C6 -> 162900 | W92: =(RC12*R9C9+R9C10)*R9C6 -> 17410 | X92: =(RC12*R10C9+R10C10)*R10C6 -> 0 | Y92: =(RC12*R11C9+R11C10)*R11C6 -> 5000 | AA92: =SUM(RC[-9]:RC[-2]) -> 1770607.5 | AB92: =ROUND(RC[-15]/RC[-1],3) -> 10.455 | AC92: =SUM(R4C28:RC[-1]) -> 121.42700000000002 | AF92: =ROUND(RC[-14]/RC18,2) -> 1 | AG92: =ROUND(RC[-14]/RC18,2) -> 0.16 | AH92: =ROUND(RC[-14]/RC18,2) -> 7.0000000000000007E-2 | AI92: =ROUND(RC[-14]/RC18,2) -> 0.17 | AJ92: =ROUND(RC[-14]/RC18,2) -> 0.14000000000000001 | AK92: =ROUND(RC[-14]/RC18,2) -> 0.02 | AL92: =ROUND(RC[-14]/RC18,2) -> 0 | AM92: =ROUND(RC[-14]/RC18,2) -> 0 | AO92: =RC[-23]/R4C6 -> 22707.75 | AP92: =RC[-23]/R5C6 -> 18600 | AQ92: =RC[-23]/R6C6 -> 38040 | AR92: =RC[-23]/R7C6 -> 20870 | AS92: =RC[-23]/R8C6 -> 18100 | AT92: =RC[-23]/R9C6 -> 17410 | AV92: =RC[-23]/R11C6 -> 1000 | AX92: =RC[-9]/RC41 -> 1 | AY92: =RC[-9]/RC41 -> 0.81910361000099086 | AZ92: =RC[-9]/RC41 -> 1.6751989959375104 | BA92: =RC[-9]/RC41 -> 0.91906948068390748 | BB92: =RC[-9]/RC41 -> 0.79708469575365237 | BC92: =RC[-9]/RC41 -> 0.76669859409232533 | BD92: =RC[-9]/RC41 -> 0 | BE92: =RC[-9]/RC41 -> 4.4037828494676926E-2
L93: 90 | M93: 20473198 | N93: =SUM(R4C13:RC[-1]) -> 209186702 | R93: =(RC12*R4C9+R4C10)*R4C6*R4C7 -> 1147375 | S93: =(RC12*R5C9+R5C10)*R5C6 -> 188000 | T93: =(RC12*R6C9+R6C10)*R6C6 -> 76800 | U93: =(RC12*R7C9+R7C10)*R7C6 -> 189900 | V93: =(RC12*R8C9+R8C10)*R8C6 -> 164700 | W93: =(RC12*R9C9+R9C10)*R9C6 -> 17600 | X93: =(RC12*R10C9+R10C10)*R10C6 -> 0 | Y93: =(RC12*R11C9+R11C10)*R11C6 -> 5000 | AA93: =SUM(RC[-9]:RC[-2]) -> 1789375 | AB93: =ROUND(RC[-15]/RC[-1],3) -> 11.442 | AC93: =SUM(R4C28:RC[-1]) -> 132.86900000000003 | AF93: =ROUND(RC[-14]/RC18,2) -> 1 | AG93: =ROUND(RC[-14]/RC18,2) -> 0.16 | AH93: =ROUND(RC[-14]/RC18,2) -> 7.0000000000000007E-2 | AI93: =ROUND(RC[-14]/RC18,2) -> 0.17 | AJ93: =ROUND(RC[-14]/RC18,2) -> 0.14000000000000001 | AK93: =ROUND(RC[-14]/RC18,2) -> 0.02 | AL93: =ROUND(RC[-14]/RC18,2) -> 0 | AM93: =ROUND(RC[-14]/RC18,2) -> 0 | AO93: =RC[-23]/R4C6 -> 22947.5 | AP93: =RC[-23]/R5C6 -> 18800 | AQ93: =RC[-23]/R6C6 -> 38400 | AR93: =RC[-23]/R7C6 -> 21100 | AS93: =RC[-23]/R8C6 -> 18300 | AT93: =RC[-23]/R9C6 -> 17600 | AV93: =RC[-23]/R11C6 -> 1000 | AX93: =RC[-9]/RC41 -> 1 | AY93: =RC[-9]/RC41 -> 0.81926135744634487 | AZ93: =RC[-9]/RC41 -> 1.6733849003159385 | BA93: =RC[-9]/RC41 -> 0.91949014053818501 | BB93: =RC[-9]/RC41 -> 0.79747249155681443 | BC93: =RC[-9]/RC41 -> 0.76696807931147182 | BD93: =RC[-9]/RC41 -> 0 | BE93: =RC[-9]/RC41 -> 4.3577731779060901E-2
L94: 91 | M94: 22576445 | N94: =SUM(R4C13:RC[-1]) -> 231763147 | R94: =(RC12*R4C9+R4C10)*R4C6*R4C7 -> 1159362.5 | S94: =(RC12*R5C9+R5C10)*R5C6 -> 190000 | T94: =(RC12*R6C9+R6C10)*R6C6 -> 77520 | U94: =(RC12*R7C9+R7C10)*R7C6 -> 191970 | V94: =(RC12*R8C9+R8C10)*R8C6 -> 166500 | W94: =(RC12*R9C9+R9C10)*R9C6 -> 17790 | X94: =(RC12*R10C9+R10C10)*R10C6 -> 0 | Y94: =(RC12*R11C9+R11C10)*R11C6 -> 5000 | AA94: =SUM(RC[-9]:RC[-2]) -> 1808142.5 | AB94: =ROUND(RC[-15]/RC[-1],3) -> 12.486000000000001 | AC94: =SUM(R4C28:RC[-1]) -> 145.35500000000002 | AF94: =ROUND(RC[-14]/RC18,2) -> 1 | AG94: =ROUND(RC[-14]/RC18,2) -> 0.16 | AH94: =ROUND(RC[-14]/RC18,2) -> 7.0000000000000007E-2 | AI94: =ROUND(RC[-14]/RC18,2) -> 0.17 | AJ94: =ROUND(RC[-14]/RC18,2) -> 0.14000000000000001 | AK94: =ROUND(RC[-14]/RC18,2) -> 0.02 | AL94: =ROUND(RC[-14]/RC18,2) -> 0 | AM94: =ROUND(RC[-14]/RC18,2) -> 0 | AO94: =RC[-23]/R4C6 -> 23187.25 | AP94: =RC[-23]/R5C6 -> 19000 | AQ94: =RC[-23]/R6C6 -> 38760 | AR94: =RC[-23]/R7C6 -> 21330 | AS94: =RC[-23]/R8C6 -> 18500 | AT94: =RC[-23]/R9C6 -> 17790 | AV94: =RC[-23]/R11C6 -> 1000 | AX94: =RC[-9]/RC41 -> 1 | AY94: =RC[-9]/RC41 -> 0.8194158427584125 | AZ94: =RC[-9]/RC41 -> 1.6716083192271616 | BA94: =RC[-9]/RC41 -> 0.91990210137036521 | BB94: =RC[-9]/RC41 -> 0.79785226794898056 | BC94: =RC[-9]/RC41 -> 0.76723199171958723 | BD94: =RC[-9]/RC41 -> 0 | BE94: =RC[-9]/RC41 -> 4.3127149618863818E-2
L95: 92 | M95: 24827873 | N95: =SUM(R4C13:RC[-1]) -> 256591020 | R95: =(RC12*R4C9+R4C10)*R4C6*R4C7 -> 1171350 | S95: =(RC12*R5C9+R5C10)*R5C6 -> 192000 | T95: =(RC12*R6C9+R6C10)*R6C6 -> 78240 | U95: =(RC12*R7C9+R7C10)*R7C6 -> 194040 | V95: =(RC12*R8C9+R8C10)*R8C6 -> 168300 | W95: =(RC12*R9C9+R9C10)*R9C6 -> 17980 | X95: =(RC12*R10C9+R10C10)*R10C6 -> 0 | Y95: =(RC12*R11C9+R11C10)*R11C6 -> 5000 | AA95: =SUM(RC[-9]:RC[-2]) -> 1826910 | AB95: =ROUND(RC[-15]/RC[-1],3) -> 13.59 | AC95: =SUM(R4C28:RC[-1]) -> 158.94500000000002 | AF95: =ROUND(RC[-14]/RC18,2) -> 1 | AG95: =ROUND(RC[-14]/RC18,2) -> 0.16 | AH95: =ROUND(RC[-14]/RC18,2) -> 7.0000000000000007E-2 | AI95: =ROUND(RC[-14]/RC18,2) -> 0.17 | AJ95: =ROUND(RC[-14]/RC18,2) -> 0.14000000000000001 | AK95: =ROUND(RC[-14]/RC18,2) -> 0.02 | AL95: =ROUND(RC[-14]/RC18,2) -> 0 | AM95: =ROUND(RC[-14]/RC18,2) -> 0 | AO95: =RC[-23]/R4C6 -> 23427 | AP95: =RC[-23]/R5C6 -> 19200 | AQ95: =RC[-23]/R6C6 -> 39120 | AR95: =RC[-23]/R7C6 -> 21560 | AS95: =RC[-23]/R8C6 -> 18700 | AT95: =RC[-23]/R9C6 -> 17980 | AV95: =RC[-23]/R11C6 -> 1000 | AX95: =RC[-9]/RC41 -> 1 | AY95: =RC[-9]/RC41 -> 0.81956716609040847 | AZ95: =RC[-9]/RC41 -> 1.6698681009092073 | BA95: =RC[-9]/RC41 -> 0.9203056302556879 | BB95: =RC[-9]/RC41 -> 0.7982242711401375 | BC95: =RC[-9]/RC41 -> 0.7674905024117471 | BD95: =RC[-9]/RC41 -> 0 | BE95: =RC[-9]/RC41 -> 4.2685789900542108E-2
L96: 93 | M96: 27234635 | N96: =SUM(R4C13:RC[-1]) -> 283825655 | R96: =(RC12*R4C9+R4C10)*R4C6*R4C7 -> 1183337.5 | S96: =(RC12*R5C9+R5C10)*R5C6 -> 194000 | T96: =(RC12*R6C9+R6C10)*R6C6 -> 78960 | U96: =(RC12*R7C9+R7C10)*R7C6 -> 196110 | V96: =(RC12*R8C9+R8C10)*R8C6 -> 170100 | W96: =(RC12*R9C9+R9C10)*R9C6 -> 18170 | X96: =(RC12*R10C9+R10C10)*R10C6 -> 0 | Y96: =(RC12*R11C9+R11C10)*R11C6 -> 5000 | AA96: =SUM(RC[-9]:RC[-2]) -> 1845677.5 | AB96: =ROUND(RC[-15]/RC[-1],3) -> 14.756 | AC96: =SUM(R4C28:RC[-1]) -> 173.70100000000002 | AF96: =ROUND(RC[-14]/RC18,2) -> 1 | AG96: =ROUND(RC[-14]/RC18,2) -> 0.16 | AH96: =ROUND(RC[-14]/RC18,2) -> 7.0000000000000007E-2 | AI96: =ROUND(RC[-14]/RC18,2) -> 0.17 | AJ96: =ROUND(RC[-14]/RC18,2) -> 0.14000000000000001 | AK96: =ROUND(RC[-14]/RC18,2) -> 0.02 | AL96: =ROUND(RC[-14]/RC18,2) -> 0 | AM96: =ROUND(RC[-14]/RC18,2) -> 0 | AO96: =RC[-23]/R4C6 -> 23666.75 | AP96: =RC[-23]/R5C6 -> 19400 | AQ96: =RC[-23]/R6C6 -> 39480 | AR96: =RC[-23]/R7C6 -> 21790 | AS96: =RC[-23]/R8C6 -> 18900 | AT96: =RC[-23]/R9C6 -> 18170 | AV96: =RC[-23]/R11C6 -> 1000 | AX96: =RC[-9]/RC41 -> 1 | AY96: =RC[-9]/RC41 -> 0.81971542353724103 | AZ96: =RC[-9]/RC41 -> 1.6681631402706329 | BA96: =RC[-9]/RC41 -> 0.92070098344724138 | BB96: =RC[-9]/RC41 -> 0.79858873736360081 | BC96: =RC[-9]/RC41 -> 0.7677437755500861 | BD96: =RC[-9]/RC41 -> 0 | BE96: =RC[-9]/RC41 -> 4.2253372347280466E-2
L97: 94 | M97: 29804099 | N97: =SUM(R4C13:RC[-1]) -> 313629754 | R97: =(RC12*R4C9+R4C10)*R4C6*R4C7 -> 1195325 | S97: =(RC12*R5C9+R5C10)*R5C6 -> 196000 | T97: =(RC12*R6C9+R6C10)*R6C6 -> 79680 | U97: =(RC12*R7C9+R7C10)*R7C6 -> 198180 | V97: =(RC12*R8C9+R8C10)*R8C6 -> 171900 | W97: =(RC12*R9C9+R9C10)*R9C6 -> 18360 | X97: =(RC12*R10C9+R10C10)*R10C6 -> 0 | Y97: =(RC12*R11C9+R11C10)*R11C6 -> 5000 | AA97: =SUM(RC[-9]:RC[-2]) -> 1864445 | AB97: =ROUND(RC[-15]/RC[-1],3) -> 15.986000000000001 | AC97: =SUM(R4C28:RC[-1]) -> 189.68700000000001 | AF97: =ROUND(RC[-14]/RC18,2) -> 1 | AG97: =ROUND(RC[-14]/RC18,2) -> 0.16 | AH97: =ROUND(RC[-14]/RC18,2) -> 7.0000000000000007E-2 | AI97: =ROUND(RC[-14]/RC18,2) -> 0.17 | AJ97: =ROUND(RC[-14]/RC18,2) -> 0.14000000000000001 | AK97: =ROUND(RC[-14]/RC18,2) -> 0.02 | AL97: =ROUND(RC[-14]/RC18,2) -> 0 | AM97: =ROUND(RC[-14]/RC18,2) -> 0 | AO97: =RC[-23]/R4C6 -> 23906.5 | AP97: =RC[-23]/R5C6 -> 19600 | AQ97: =RC[-23]/R6C6 -> 39840 | AR97: =RC[-23]/R7C6 -> 22020 | AS97: =RC[-23]/R8C6 -> 19100 | AT97: =RC[-23]/R9C6 -> 18360 | AV97: =RC[-23]/R11C6 -> 1000 | AX97: =RC[-9]/RC41 -> 1 | AY97: =RC[-9]/RC41 -> 0.81986070733900818 | AZ97: =RC[-9]/RC41 -> 1.6664923765503106 | BA97: =RC[-9]/RC41 -> 0.92108840691862048 | BB97: =RC[-9]/RC41 -> 0.79894589337627842 | BC97: =RC[-9]/RC41 -> 0.76799196871143827 | BD97: =RC[-9]/RC41 -> 0 | BE97: =RC[-9]/RC41 -> 4.1829627925459606E-2
L98: 95 | M98: 32543854 | N98: =SUM(R4C13:RC[-1]) -> 346173608 | R98: =(RC12*R4C9+R4C10)*R4C6*R4C7 -> 1207312.5 | S98: =(RC12*R5C9+R5C10)*R5C6 -> 198000 | T98: =(RC12*R6C9+R6C10)*R6C6 -> 80400 | U98: =(RC12*R7C9+R7C10)*R7C6 -> 200250 | V98: =(RC12*R8C9+R8C10)*R8C6 -> 173700 | W98: =(RC12*R9C9+R9C10)*R9C6 -> 18550 | X98: =(RC12*R10C9+R10C10)*R10C6 -> 0 | Y98: =(RC12*R11C9+R11C10)*R11C6 -> 5000 | AA98: =SUM(RC[-9]:RC[-2]) -> 1883212.5 | AB98: =ROUND(RC[-15]/RC[-1],3) -> 17.280999999999999 | AC98: =SUM(R4C28:RC[-1]) -> 206.96800000000002 | AF98: =ROUND(RC[-14]/RC18,2) -> 1 | AG98: =ROUND(RC[-14]/RC18,2) -> 0.16 | AH98: =ROUND(RC[-14]/RC18,2) -> 7.0000000000000007E-2 | AI98: =ROUND(RC[-14]/RC18,2) -> 0.17 | AJ98: =ROUND(RC[-14]/RC18,2) -> 0.14000000000000001 | AK98: =ROUND(RC[-14]/RC18,2) -> 0.02 | AL98: =ROUND(RC[-14]/RC18,2) -> 0 | AM98: =ROUND(RC[-14]/RC18,2) -> 0 | AO98: =RC[-23]/R4C6 -> 24146.25 | AP98: =RC[-23]/R5C6 -> 19800 | AQ98: =RC[-23]/R6C6 -> 40200 | AR98: =RC[-23]/R7C6 -> 22250 | AS98: =RC[-23]/R8C6 -> 19300 | AT98: =RC[-23]/R9C6 -> 18550 | AV98: =RC[-23]/R11C6 -> 1000 | AX98: =RC[-9]/RC41 -> 1 | AY98: =RC[-9]/RC41 -> 0.82000310607237148 | AZ98: =RC[-9]/RC41 -> 1.6648547911166329 | BA98: =RC[-9]/RC41 -> 0.92146813687425588 | BB98: =RC[-9]/RC41 -> 0.7992959569291298 | BC98: =RC[-9]/RC41 -> 0.76823523321426723 | BD98: =RC[-9]/RC41 -> 0 | BE98: =RC[-9]/RC41 -> 4.1414298286483409E-2
L99: 96 | M99: 35461711 | N99: =SUM(R4C13:RC[-1]) -> 381635319 | R99: =(RC12*R4C9+R4C10)*R4C6*R4C7 -> 1219300 | S99: =(RC12*R5C9+R5C10)*R5C6 -> 200000 | T99: =(RC12*R6C9+R6C10)*R6C6 -> 81120 | U99: =(RC12*R7C9+R7C10)*R7C6 -> 202320 | V99: =(RC12*R8C9+R8C10)*R8C6 -> 175500 | W99: =(RC12*R9C9+R9C10)*R9C6 -> 18740 | X99: =(RC12*R10C9+R10C10)*R10C6 -> 0 | Y99: =(RC12*R11C9+R11C10)*R11C6 -> 5000 | AA99: =SUM(RC[-9]:RC[-2]) -> 1901980 | AB99: =ROUND(RC[-15]/RC[-1],3) -> 18.645 | AC99: =SUM(R4C28:RC[-1]) -> 225.61300000000003 | AF99: =ROUND(RC[-14]/RC18,2) -> 1 | AG99: =ROUND(RC[-14]/RC18,2) -> 0.16 | AH99: =ROUND(RC[-14]/RC18,2) -> 7.0000000000000007E-2 | AI99: =ROUND(RC[-14]/RC18,2) -> 0.17 | AJ99: =ROUND(RC[-14]/RC18,2) -> 0.14000000000000001 | AK99: =ROUND(RC[-14]/RC18,2) -> 0.02 | AL99: =ROUND(RC[-14]/RC18,2) -> 0 | AM99: =ROUND(RC[-14]/RC18,2) -> 0 | AO99: =RC[-23]/R4C6 -> 24386 | AP99: =RC[-23]/R5C6 -> 20000 | AQ99: =RC[-23]/R6C6 -> 40560 | AR99: =RC[-23]/R7C6 -> 22480 | AS99: =RC[-23]/R8C6 -> 19500 | AT99: =RC[-23]/R9C6 -> 18740 | AV99: =RC[-23]/R11C6 -> 1000 | AX99: =RC[-9]/RC41 -> 1 | AY99: =RC[-9]/RC41 -> 0.82014270483064056 | AZ99: =RC[-9]/RC41 -> 1.663249405396539 | BA99: =RC[-9]/RC41 -> 0.92184040022963998 | BB99: =RC[-9]/RC41 -> 0.79963913720987456 | BC99: =RC[-9]/RC41 -> 0.76847371442631018 | BD99: =RC[-9]/RC41 -> 0 | BE99: =RC[-9]/RC41 -> 4.1007135241532024E-2
L100: 97 | M100: 38565707 | N100: =SUM(R4C13:RC[-1]) -> 420201026 | R100: =(RC12*R4C9+R4C10)*R4C6*R4C7 -> 1231287.5 | S100: =(RC12*R5C9+R5C10)*R5C6 -> 202000 | T100: =(RC12*R6C9+R6C10)*R6C6 -> 81840 | U100: =(RC12*R7C9+R7C10)*R7C6 -> 204390 | V100: =(RC12*R8C9+R8C10)*R8C6 -> 177300 | W100: =(RC12*R9C9+R9C10)*R9C6 -> 18930 | X100: =(RC12*R10C9+R10C10)*R10C6 -> 0 | Y100: =(RC12*R11C9+R11C10)*R11C6 -> 5000 | AA100: =SUM(RC[-9]:RC[-2]) -> 1920747.5 | AB100: =ROUND(RC[-15]/RC[-1],3) -> 20.077999999999999 | AC100: =SUM(R4C28:RC[-1]) -> 245.69100000000003 | AF100: =ROUND(RC[-14]/RC18,2) -> 1 | AG100: =ROUND(RC[-14]/RC18,2) -> 0.16 | AH100: =ROUND(RC[-14]/RC18,2) -> 7.0000000000000007E-2 | AI100: =ROUND(RC[-14]/RC18,2) -> 0.17 | AJ100: =ROUND(RC[-14]/RC18,2) -> 0.14000000000000001 | AK100: =ROUND(RC[-14]/RC18,2) -> 0.02 | AL100: =ROUND(RC[-14]/RC18,2) -> 0 | AM100: =ROUND(RC[-14]/RC18,2) -> 0 | AO100: =RC[-23]/R4C6 -> 24625.75 | AP100: =RC[-23]/R5C6 -> 20200 | AQ100: =RC[-23]/R6C6 -> 40920 | AR100: =RC[-23]/R7C6 -> 22710 | AS100: =RC[-23]/R8C6 -> 19700 | AT100: =RC[-23]/R9C6 -> 18930 | AV100: =RC[-23]/R11C6 -> 1000 | AX100: =RC[-9]/RC41 -> 1 | AY100: =RC[-9]/RC41 -> 0.82027958539333823 | AZ100: =RC[-9]/RC41 -> 1.6616752789255149 | BA100: =RC[-9]/RC41 -> 0.92220541506350062 | BB100: =RC[-9]/RC41 -> 0.79997563525983983 | BC100: =RC[-9]/RC41 -> 0.76870755205425212 | BD100: =RC[-9]/RC41 -> 0 | BE100: =RC[-9]/RC41 -> 4.0607900266996948E-2
L101: 98 | M101: 41864106 | N101: =SUM(R4C13:RC[-1]) -> 462065132 | R101: =(RC12*R4C9+R4C10)*R4C6*R4C7 -> 1243275 | S101: =(RC12*R5C9+R5C10)*R5C6 -> 204000 | T101: =(RC12*R6C9+R6C10)*R6C6 -> 82560 | U101: =(RC12*R7C9+R7C10)*R7C6 -> 206460 | V101: =(RC12*R8C9+R8C10)*R8C6 -> 179100 | W101: =(RC12*R9C9+R9C10)*R9C6 -> 19120 | X101: =(RC12*R10C9+R10C10)*R10C6 -> 0 | Y101: =(RC12*R11C9+R11C10)*R11C6 -> 5000 | AA101: =SUM(RC[-9]:RC[-2]) -> 1939515 | AB101: =ROUND(RC[-15]/RC[-1],3) -> 21.585000000000001 | AC101: =SUM(R4C28:RC[-1]) -> 267.27600000000001 | AF101: =ROUND(RC[-14]/RC18,2) -> 1 | AG101: =ROUND(RC[-14]/RC18,2) -> 0.16 | AH101: =ROUND(RC[-14]/RC18,2) -> 7.0000000000000007E-2 | AI101: =ROUND(RC[-14]/RC18,2) -> 0.17 | AJ101: =ROUND(RC[-14]/RC18,2) -> 0.14000000000000001 | AK101: =ROUND(RC[-14]/RC18,2) -> 0.02 | AL101: =ROUND(RC[-14]/RC18,2) -> 0 | AM101: =ROUND(RC[-14]/RC18,2) -> 0 | AO101: =RC[-23]/R4C6 -> 24865.5 | AP101: =RC[-23]/R5C6 -> 20400 | AQ101: =RC[-23]/R6C6 -> 41280 | AR101: =RC[-23]/R7C6 -> 22940 | AS101: =RC[-23]/R8C6 -> 19900 | AT101: =RC[-23]/R9C6 -> 19120 | AV101: =RC[-23]/R11C6 -> 1000 | AX101: =RC[-9]/RC41 -> 1 | AY101: =RC[-9]/RC41 -> 0.82041382638595639 | AZ101: =RC[-9]/RC41 -> 1.6601315075104059 | BA101: =RC[-9]/RC41 -> 0.92256339104381568 | BB101: =RC[-9]/RC41 -> 0.80030564436669283 | BC101: =RC[-9]/RC41 -> 0.76893688041664154 | BD101: =RC[-9]/RC41 -> 0 | BE101: =RC[-9]/RC41 -> 4.0216364038527276E-2
L102: 99 | M102: 45365405 | N102: =SUM(R4C13:RC[-1]) -> 507430537 | R102: =(RC12*R4C9+R4C10)*R4C6*R4C7 -> 1255262.5 | S102: =(RC12*R5C9+R5C10)*R5C6 -> 206000 | T102: =(RC12*R6C9+R6C10)*R6C6 -> 83280 | U102: =(RC12*R7C9+R7C10)*R7C6 -> 208530 | V102: =(RC12*R8C9+R8C10)*R8C6 -> 180900 | W102: =(RC12*R9C9+R9C10)*R9C6 -> 19310 | X102: =(RC12*R10C9+R10C10)*R10C6 -> 0 | Y102: =(RC12*R11C9+R11C10)*R11C6 -> 5000 | AA102: =SUM(RC[-9]:RC[-2]) -> 1958282.5 | AB102: =ROUND(RC[-15]/RC[-1],3) -> 23.166 | AC102: =SUM(R4C28:RC[-1]) -> 290.44200000000001 | AF102: =ROUND(RC[-14]/RC18,2) -> 1 | AG102: =ROUND(RC[-14]/RC18,2) -> 0.16 | AH102: =ROUND(RC[-14]/RC18,2) -> 7.0000000000000007E-2 | AI102: =ROUND(RC[-14]/RC18,2) -> 0.17 | AJ102: =ROUND(RC[-14]/RC18,2) -> 0.14000000000000001 | AK102: =ROUND(RC[-14]/RC18,2) -> 0.02 | AL102: =ROUND(RC[-14]/RC18,2) -> 0 | AM102: =ROUND(RC[-14]/RC18,2) -> 0 | AO102: =RC[-23]/R4C6 -> 25105.25 | AP102: =RC[-23]/R5C6 -> 20600 | AQ102: =RC[-23]/R6C6 -> 41640 | AR102: =RC[-23]/R7C6 -> 23170 | AS102: =RC[-23]/R8C6 -> 20100 | AT102: =RC[-23]/R9C6 -> 19310 | AV102: =RC[-23]/R11C6 -> 1000 | AX102: =RC[-9]/RC41 -> 1 | AY102: =RC[-9]/RC41 -> 0.82054550343055732 | AZ102: =RC[-9]/RC41 -> 1.6586172214974955 | BA102: =RC[-9]/RC41 -> 0.92291452982941813 | BB102: =RC[-9]/RC41 -> 0.80062935043466998 | BC102: =RC[-9]/RC41 -> 0.76916182870116812 | BD102: =RC[-9]/RC41 -> 0 | BE102: =RC[-9]/RC41 -> 3.9832305991774626E-2
L103: 100 | M103: 61347923 | N103: =SUM(R4C13:RC[-1]) -> 568778460 | R103: =(RC12*R4C9+R4C10)*R4C6*R4C7 -> 1267250 | S103: =(RC12*R5C9+R5C10)*R5C6 -> 208000 | T103: =(RC12*R6C9+R6C10)*R6C6 -> 84000 | U103: =(RC12*R7C9+R7C10)*R7C6 -> 210600 | V103: =(RC12*R8C9+R8C10)*R8C6 -> 182700 | W103: =(RC12*R9C9+R9C10)*R9C6 -> 19500 | X103: =(RC12*R10C9+R10C10)*R10C6 -> 0 | Y103: =(RC12*R11C9+R11C10)*R11C6 -> 5000 | AA103: =SUM(RC[-9]:RC[-2]) -> 1977050 | AB103: =ROUND(RC[-15]/RC[-1],3) -> 31.03 | AC103: =SUM(R4C28:RC[-1]) -> 321.47199999999998 | AF103: =ROUND(RC[-14]/RC18,2) -> 1 | AG103: =ROUND(RC[-14]/RC18,2) -> 0.16 | AH103: =ROUND(RC[-14]/RC18,2) -> 7.0000000000000007E-2 | AI103: =ROUND(RC[-14]/RC18,2) -> 0.17 | AJ103: =ROUND(RC[-14]/RC18,2) -> 0.14000000000000001 | AK103: =ROUND(RC[-14]/RC18,2) -> 0.02 | AL103: =ROUND(RC[-14]/RC18,2) -> 0 | AM103: =ROUND(RC[-14]/RC18,2) -> 0 | AO103: =RC[-23]/R4C6 -> 25345 | AP103: =RC[-23]/R5C6 -> 20800 | AQ103: =RC[-23]/R6C6 -> 42000 | AR103: =RC[-23]/R7C6 -> 23400 | AS103: =RC[-23]/R8C6 -> 20300 | AT103: =RC[-23]/R9C6 -> 19500 | AV103: =RC[-23]/R11C6 -> 1000 | AX103: =RC[-9]/RC41 -> 1 | AY103: =RC[-9]/RC41 -> 0.82067468928782794 | AZ103: =RC[-9]/RC41 -> 1.6571315841388834 | BA103: =RC[-9]/RC41 -> 0.92325902544880645 | BB103: =RC[-9]/RC41 -> 0.80094693233379366 | BC103: =RC[-9]/RC41 -> 0.76938252120733874 | BD103: =RC[-9]/RC41 -> 0 | BE103: =RC[-9]/RC41 -> 3.9455513908068653E-2