Sheet: ctFaBaoSuit
A2: nIndex | B2: sSuitName | C2: tSuitIDList | D2: tAttrActTwo | E2: tAttrActThree | F2: bNstate
A3: i | B3: s | C3: t{i} | D3: t{ii} | E3: t{ii} | F3: b
A4: 序号 | B4: 套装名 | C4: 组成法宝套装ID列表 | D4: 套装2件激活属性 | E4: 套装3件激活属性 | F4: 0
A5: 1 | B5: 殇落青花 | C5: 32501;32507;32508 | D5: 104,88;105,73;101,69; | E5: 104,177;105,146;101,139; | F5: 0
A6: 2 | B6: 悲喜无相 | C6: 32502;32504;32505 | D6: 104,88;105,73;101,69; | E6: 104,177;105,146;101,139; | F6: 1
A7: 3 | B7: 九斩阴阳 | C7: 32503;32509;32510 | D7: 106,25;107,9;102,112; | E7: 106,51;107,19;102,225; | F7: 1
A8: 4 | B8: 奕剑三锋 | C8: 32506;32511;32512 | D8: 106,25;107,9;102,112; | E8: 106,51;107,19;102,225; | F8: 0
A9: 5 | B9: 真·殇落青花 | C9: 32601;32607;32608; | D9: 104,114;105,94;101,89; | E9: 104,230;105,189;101,180; | F9: 0
A10: 6 | B10: 真·悲喜无相 | C10: 32602;32604;32605; | D10: 104,114;105,94;101,89; | E10: 104,230;105,189;101,180; | F10: 0
A11: 7 | B11: 真·九斩阴阳 | C11: 32603;32609;32610; | D11: 106,32;107,11;102,145; | E11: 106,66;107,24;102,292; | F11: 0
A12: 8 | B12: 真·奕剑三锋 | C12: 32606;32611;32612; | D12: 106,32;107,11;102,145; | E12: 106,66;107,24;102,292; | F12: 0

Sheet: Sheet2
H1: 32501 | I1: 32507 | J1: 32508 | R1: 104 | S1: 88 | T1: 105 | U1: 73 | V1: 101 | W1: 69 | AA1: 104 | AB1: 177 | AC1: 105 | AD1: 146 | AE1: 101 | AF1: 139
H2: 32502 | I2: 32504 | J2: 32505 | R2: 104 | S2: 88 | T2: 105 | U2: 73 | V2: 101 | W2: 69 | AA2: 104 | AB2: 177 | AC2: 105 | AD2: 146 | AE2: 101 | AF2: 139
H3: 32503 | I3: 32509 | J3: 32510 | R3: 106 | S3: 25 | T3: 107 | U3: 9 | V3: 102 | W3: 112 | AA3: 106 | AB3: 51 | AC3: 107 | AD3: 19 | AE3: 102 | AF3: 225
H4: 32506 | I4: 32511 | J4: 32512 | R4: 106 | S4: 25 | T4: 107 | U4: 9 | V4: 102 | W4: 112 | AA4: 106 | AB4: 51 | AC4: 107 | AD4: 19 | AE4: 102 | AF4: 225
R6: =R[-5]C -> 104 | S6: =INT(R[-5]C*1.3) -> 114 | T6: =R[-5]C -> 105 | U6: =INT(R[-5]C*1.3) -> 94 | V6: =R[-5]C -> 101 | W6: =INT(R[-5]C*1.3) -> 89 | AA6: =R[-5]C -> 104 | AB6: =INT(R[-5]C*1.3) -> 230 | AC6: =R[-5]C -> 105 | AD6: =INT(R[-5]C*1.3) -> 189 | AE6: =R[-5]C -> 101 | AF6: =INT(R[-5]C*1.3) -> 180
R7: =R[-5]C -> 104 | S7: =INT(R[-5]C*1.3) -> 114 | T7: =R[-5]C -> 105 | U7: =INT(R[-5]C*1.3) -> 94 | V7: =R[-5]C -> 101 | W7: =INT(R[-5]C*1.3) -> 89 | AA7: =R[-5]C -> 104 | AB7: =INT(R[-5]C*1.3) -> 230 | AC7: =R[-5]C -> 105 | AD7: =INT(R[-5]C*1.3) -> 189 | AE7: =R[-5]C -> 101 | AF7: =INT(R[-5]C*1.3) -> 180
R8: =R[-5]C -> 106 | S8: =INT(R[-5]C*1.3) -> 32 | T8: =R[-5]C -> 107 | U8: =INT(R[-5]C*1.3) -> 11 | V8: =R[-5]C -> 102 | W8: =INT(R[-5]C*1.3) -> 145 | AA8: =R[-5]C -> 106 | AB8: =INT(R[-5]C*1.3) -> 66 | AC8: =R[-5]C -> 107 | AD8: =INT(R[-5]C*1.3) -> 24 | AE8: =R[-5]C -> 102 | AF8: =INT(R[-5]C*1.3) -> 292
H9: =R[-8]C+100 -> 32601 | I9: =R[-8]C+100 -> 32607 | J9: =R[-8]C+100 -> 32608 | L9: =RC[-4]&";" -> 32601; | M9: =RC[-4]&";" -> 32607; | N9: =RC[-4]&";" -> 32608; | R9: =R[-5]C -> 106 | S9: =INT(R[-5]C*1.3) -> 32 | T9: =R[-5]C -> 107 | U9: =INT(R[-5]C*1.3) -> 11 | V9: =R[-5]C -> 102 | W9: =INT(R[-5]C*1.3) -> 145 | AA9: =R[-5]C -> 106 | AB9: =INT(R[-5]C*1.3) -> 66 | AC9: =R[-5]C -> 107 | AD9: =INT(R[-5]C*1.3) -> 24 | AE9: =R[-5]C -> 102 | AF9: =INT(R[-5]C*1.3) -> 292
H10: =R[-8]C+100 -> 32602 | I10: =R[-8]C+100 -> 32604 | J10: =R[-8]C+100 -> 32605 | L10: =RC[-4]&";" -> 32602; | M10: =RC[-4]&";" -> 32604; | N10: =RC[-4]&";" -> 32605;
H11: =R[-8]C+100 -> 32603 | I11: =R[-8]C+100 -> 32609 | J11: =R[-8]C+100 -> 32610 | L11: =RC[-4]&";" -> 32603; | M11: =RC[-4]&";" -> 32609; | N11: =RC[-4]&";" -> 32610;
H12: =R[-8]C+100 -> 32606 | I12: =R[-8]C+100 -> 32611 | J12: =R[-8]C+100 -> 32612 | L12: =RC[-4]&";" -> 32606; | M12: =RC[-4]&";" -> 32611; | N12: =RC[-4]&";" -> 32612; | P12: =RC[2]&RC[4]&RC[6] -> 104,114;105,94;101,89; | R12: =R[-6]C&","&R[-6]C[1]&";" -> 104,114; | T12: =R[-6]C&","&R[-6]C[1]&";" -> 105,94; | V12: =R[-6]C&","&R[-6]C[1]&";" -> 101,89; | Y12: =RC[2]&RC[4]&RC[6] -> 104,230;105,189;101,180; | AA12: =R[-6]C&","&R[-6]C[1]&";" -> 104,230; | AC12: =R[-6]C&","&R[-6]C[1]&";" -> 105,189; | AE12: =R[-6]C&","&R[-6]C[1]&";" -> 101,180;
P13: =RC[2]&RC[4]&RC[6] -> 104,114;105,94;101,89; | R13: =R[-6]C&","&R[-6]C[1]&";" -> 104,114; | T13: =R[-6]C&","&R[-6]C[1]&";" -> 105,94; | V13: =R[-6]C&","&R[-6]C[1]&";" -> 101,89; | Y13: =RC[2]&RC[4]&RC[6] -> 104,230;105,189;101,180; | AA13: =R[-6]C&","&R[-6]C[1]&";" -> 104,230; | AC13: =R[-6]C&","&R[-6]C[1]&";" -> 105,189; | AE13: =R[-6]C&","&R[-6]C[1]&";" -> 101,180;
P14: =RC[2]&RC[4]&RC[6] -> 106,32;107,11;102,145; | R14: =R[-6]C&","&R[-6]C[1]&";" -> 106,32; | T14: =R[-6]C&","&R[-6]C[1]&";" -> 107,11; | V14: =R[-6]C&","&R[-6]C[1]&";" -> 102,145; | Y14: =RC[2]&RC[4]&RC[6] -> 106,66;107,24;102,292; | AA14: =R[-6]C&","&R[-6]C[1]&";" -> 106,66; | AC14: =R[-6]C&","&R[-6]C[1]&";" -> 107,24; | AE14: =R[-6]C&","&R[-6]C[1]&";" -> 102,292;
P15: =RC[2]&RC[4]&RC[6] -> 106,32;107,11;102,145; | R15: =R[-6]C&","&R[-6]C[1]&";" -> 106,32; | T15: =R[-6]C&","&R[-6]C[1]&";" -> 107,11; | V15: =R[-6]C&","&R[-6]C[1]&";" -> 102,145; | Y15: =RC[2]&RC[4]&RC[6] -> 106,66;107,24;102,292; | AA15: =R[-6]C&","&R[-6]C[1]&";" -> 106,66; | AC15: =R[-6]C&","&R[-6]C[1]&";" -> 107,24; | AE15: =R[-6]C&","&R[-6]C[1]&";" -> 102,292;