Sheet: ctFaBaoConf
A1: 技能ID(法宝ID) | C1: 1:金 2:木 3:水 4:火 5:土 6:风 | J1: 这个值要根据当前最高星级法宝来取，比如现在最7星(MaxStar), 现在这个值取为Star = 7(MaxStar) - 1 | M1: 101:气血 102:魔法 103:怒气 104:攻击 105:防御 106:灵力 107:速度 108:伤害(百分比100倍,战斗中用) 201:法术攻击(值) 202:法术防御(值) 203:治疗强度(值) 204:封印命中(百分比100倍) 205:封印抗性(百分比100倍) 206:法术命中 207:法术闪避 208:法术伤害(百分比100倍,战斗中用) 301:命中率 302:闪避率 303:暴击率 304:抗暴率 | N1: 6,3,105,300; 6--法宝星级 3--法宝星级数量 105--属性标识 300--对应属性值 | O1: 1,75,10 1--法宝星级 75--合成概率 10--消耗的银币(单位为万) | P1: 法宝重置 100--成功率 100--消耗的银币(单位为万)
A2: nID | B2: sName | C2: nFaBaoAttr | D2: nWeights | E2: nFaBaopPartType | F2: nCostRage | G2: nSuitIndex | H2: nFaBaoGrade | I2: nLevel | J2: nMaxCompResetStar | K2: skillName | L2: nScore | M2: eFaBaoAttrFornula | N2: tFaBaoSetAttr | O2: tFaBaoComposeProbability | P2: tFaBaoReset | Q2: sSkillDec | R2: sFaBaoDec
A3: i | B3: s | C3: i | D3: i | E3: i | F3: i | G3: i | H3: i | I3: i | J3: i | K3: s | L3: i | M3: t{ie} | N3: t{iiii} | O3: t{iii} | P3: t{ii} | Q3: s | R3: s
A4: 编号 | B4: 名称 | C4: 法宝属性 | D4: 合成权重 | E4: 穿戴位置 | F4: 消耗怒气 | G4: 套装索引 | H4: 法宝品级 | I4: 法宝等级 | J4: 小于等于nMaxCompResetStar星级法宝可以参与合成，大于等于nMaxCompResetStar星级法宝可以参与重置 | K4: 特技名 | L4: 特技评分 | M4: 属性计算公式 | N4: 法宝套装属性加成 | O4: 法宝合成概率及消耗的银币 | P4: 100,100 | Q4: 描述 | R4: 法宝描述
A5: 32001 | B5: 1★催魂灯 | C5: 3 | D5: 100 | E5: 3 | F5: 30 | G5: 0 | H5: 1 | I5: 1 | J5: 6 | K5: 如沐春露 | L5: 5000 | M5: 105,(ilv*1.5+10)*1.5; | N5: 6,3,101,0; | O5: 1,85,10;2,80,30;3,75,60;4,70,80;5,65,100;6,65,150; | P5: 100,100 | Q5: 为自己或队友恢复气血。 | R5: 用符封印，于空中一日拜三次，7日后被施术者死亡。
A6: 32002 | B6: 1★翻天印 | C6: 4 | D6: 100 | E6: 4 | F6: 40 | G6: 0 | H6: 1 | I6: 1 | J6: 6 | K6: 战吼 | L6: 5000 | M6: 106,(ilv*1.1+5)*1.5; | N6: 6,3,101,0; | O6: 1,85,10;2,80,30;3,75,60;4,70,80;5,65,100;6,65,150; | P6: 100,100 | Q6: 提高自己或队友12%攻击力，效果不叠加，持续至战斗结束。 | R6: 取不周山断壁炼制而成，翻手无情，专拍人脑门。
A7: 32003 | B7: 1★震天剑 | C7: 5 | D7: 100 | E7: 5 | F7: 40 | G7: 0 | H7: 1 | I7: 1 | J7: 6 | K7: 虎贲 | L7: 5000 | M7: 105,(ilv*0.5+5)*1.5;101,(ilv*3+10)*1.5; | N7: 6,3,101,0; | O7: 1,85,10;2,80,30;3,75,60;4,70,80;5,65,100;6,65,150; | P7: 100,100 | Q7: 提高自己或队友12%防御，效果不叠加，持续至战斗结束。 | R7: 从轩辕黄帝大破蚩尤留传至今，威力无边，无人拿的起来。
A8: 32101 | B8: 2★噬魂珠 | C8: 2 | D8: 100 | E8: 2 | F8: 40 | G8: 0 | H8: 2 | I8: 1 | J8: 6 | K8: 九转归一 | L8: 10000 | M8: 105,(ilv*0.5+5)*1.5;102,ilv*5*1.5; | N8: 6,3,101,0; | O8: 1,85,10;2,80,30;3,75,60;4,70,80;5,65,100;6,65,150; | P8: 100,100 | Q8: 为自己或队友解除各种异常状态。 | R8: 魔教至宝，通体暗紫，摄人心魂，散发阴暗无比之感。
A9: 32102 | B9: 2★清净琉璃瓶 | C9: 1 | D9: 100 | E9: 1 | F9: 40 | G9: 0 | H9: 2 | I9: 1 | J9: 6 | K9: 血煞之力 | L9: 10000 | M9: 104,(ilv*3.8+15)*1.5; | N9: 6,3,101,0; | O9: 1,85,10;2,80,30;3,75,60;4,70,80;5,65,100;6,65,150; | P9: 100,100 | Q9: 降低敌方单人12%攻击力，效果不叠加，续至战斗结束。 | R9: 乃慈航道人法宝，匠人畜吸入瓶中，顷刻身皮肉化成脓水。
A10: 32103 | B10: 2★鸣鸿刀 | C10: 5 | D10: 100 | E10: 5 | F10: 40 | G10: 0 | H10: 2 | I10: 1 | J10: 6 | K10: 杀身成仁 | L10: 10000 | M10: 105,(ilv*0.5+5)*1.5;101,(ilv*3+10)*1.5; | N10: 6,3,101,0; | O10: 1,85,10;2,80,30;3,75,60;4,70,80;5,65,100;6,65,150; | P10: 100,100 | Q10: 降低敌方单人12%防御，效果不叠加，持续至战斗结束。 | R10: 上古神刀，是轩辕黄帝炼金剑之时炼制的，威力不亚于轩辕剑。
A11: 32201 | B11: 3★照妖镜 | C11: 3 | D11: 100 | E11: 3 | F11: 30 | G11: 0 | H11: 3 | I11: 1 | J11: 6 | K11: 佛光普度 | L11: 15000 | M11: 105,(ilv*1.5+10)*1.5; | N11: 6,3,101,0; | O11: 1,85,10;2,80,30;3,75,60;4,70,80;5,65,100;6,65,150; | P11: 100,100 | Q11: 为自己或队友恢复气血。 | R11: 能照出妖魔鬼怪原形的宝镜，识破变身效果。
A12: 32202 | B12: 3★神禹令 | C12: 6 | D12: 100 | E12: 6 | F12: 40 | G12: 0 | H12: 3 | I12: 1 | J12: 6 | K12: 乘风破浪 | L12: 15000 | M12: 105,(ilv*0.5+5)*1.5;107,(ilv*0.4+4)*1.5; | N12: 6,3,101,0; | O12: 1,85,10;2,80,30;3,75,60;4,70,80;5,65,100;6,65,150; | P12: 100,100 | Q12: 提高自己或队友12%速度，效果不叠加，持续至战斗结束。 | R12: 又称潜龙符，取独角潜龙三角所制，能避火防水，降魔诛怪。
A13: 32203 | B13: 3★金刚锤 | C13: 2 | D13: 100 | E13: 2 | F13: 40 | G13: 0 | H13: 3 | I13: 1 | J13: 6 | K13: 冰冻三尺 | L13: 15000 | M13: 105,(ilv*0.5+5)*1.5;102,ilv*5*1.5; | N13: 6,3,101,0; | O13: 1,85,10;2,80,30;3,75,60;4,70,80;5,65,100;6,65,150; | P13: 100,100 | Q13: 降低敌方单人12%速度，效果不叠加，持续至战斗结束。 | R13: 由深埋地下千年的精钢，经圣火九九八十一天炼制而成，专伏妖魔。
A14: 32301 | B14: 4★清心灯 | C14: 3 | D14: 100 | E14: 3 | F14: 60 | G14: 0 | H14: 4 | I14: 1 | J14: 6 | K14: 大慈大悲 | L14: 20000 | M14: 105,(ilv*1.5+10)*1.5; | N14: 6,3,101,0; | O14: 1,85,10;2,80,30;3,75,60;4,70,80;5,65,100;6,65,150; | P14: 100,100 | Q14: 为自己恢复气血。 | R14: 又名散花檠，灯头结三朵火焰，生生不息，可飞出，威力极大。
A15: 32302 | B15: 4★列瘟印 | C15: 5 | D15: 100 | E15: 5 | F15: 120 | G15: 0 | H15: 4 | I15: 1 | J15: 6 | K15: 还魂术 | L15: 20000 | M15: 105,(ilv*0.5+5)*1.5;101,(ilv*3+10)*1.5; | N15: 6,3,101,0; | O15: 1,85,10;2,80,30;3,75,60;4,70,80;5,65,100;6,65,150; | P15: 100,100 | Q15: 复活已死亡的队友，恢复其50%气血 | R15: 为蛊印，蚩尤巫族所有，具有中毒攻击之效果。
A16: 32303 | B16: 4★九疑鼎 | C16: 2 | D16: 100 | E16: 2 | F16: 80 | G16: 0 | H16: 4 | I16: 1 | J16: 6 | K16: 三元归一 | L16: 20000 | M16: 105,(ilv*0.5+5)*1.5;102,ilv*5*1.5; | N16: 6,3,101,0; | O16: 1,85,10;2,80,30;3,75,60;4,70,80;5,65,100;6,65,150; | P16: 100,100 | Q16: 为自己或队友解除各种异常状态，并恢复气血。 | R16: 鼎腹刻有万物，内含先天一气元胎，专收储般宝物，为黄帝所铸。
A17: 32304 | B17: 4★摄魂琴 | C17: 4 | D17: 100 | E17: 4 | F17: 60 | G17: 0 | H17: 4 | I17: 1 | J17: 6 | K17: 离人愁 | L17: 20000 | M17: 106,(ilv*1.1+5)*1.5; | N17: 6,3,101,0; | O17: 1,85,10;2,80,30;3,75,60;4,70,80;5,65,100;6,65,150; | P17: 100,100 | Q17: 减少敌方单人一定气血，最小伤害为100。 | R17: 琴声美妙，敌人如应一声，魂魄立为所摄，为邪教宝物。
A18: 32305 | B18: 4★四海瓶 | C18: 1 | D18: 100 | E18: 1 | F18: 60 | G18: 0 | H18: 4 | I18: 1 | J18: 6 | K18: 金刚伏魔 | L18: 20000 | M18: 104,(ilv*3.8+15)*1.5; | N18: 6,3,101,0; | O18: 1,85,10;2,80,30;3,75,60;4,70,80;5,65,100;6,65,150; | P18: 100,100 | Q18: 物理攻击敌人，并同时减少其魔法值。 | R18: 龙吉公主的瓷瓶，可吸取他人宝物，化为己用。
A19: 32306 | B19: 4★金钟罩 | C19: 6 | D19: 100 | E19: 6 | F19: 60 | G19: 0 | H19: 4 | I19: 1 | J19: 6 | K19: 火眼金睛 | L19: 20000 | M19: 105,(ilv*0.5+5)*1.5;107,(ilv*0.4+4)*1.5; | N19: 6,3,101,0; | O19: 1,85,10;2,80,30;3,75,60;4,70,80;5,65,100;6,65,150; | P19: 100,100 | Q19: 使己方单体目标获得反隐能力，持续4回合。 | R19: 不可多得的护体神器，坚如磐石，刀枪不入。
A20: 32401 | B20: 5★锁心锤 | C20: 2 | D20: 100 | E20: 2 | F20: 30 | G20: 0 | H20: 5 | I20: 1 | J20: 6 | K20: 以毒养身 | L20: 25000 | M20: 105,(ilv*0.5+5)*1.5;102,ilv*5*1.5; | N20: 6,3,101,0; | O20: 1,85,10;2,80,30;3,75,60;4,70,80;5,65,100;6,65,150; | P20: 100,100 | Q20: 为自己或队友恢复气血。 | R20: 取有根基之人的魂魄炼制而成，专放魔火。
A21: 32402 | B21: 5★昏迷剑 | C21: 4 | D21: 100 | E21: 4 | F21: 60 | G21: 0 | H21: 5 | I21: 1 | J21: 6 | K21: 临阵曲 | L21: 25000 | M21: 106,(ilv*1.1+5)*1.5; | N21: 6,3,101,0; | O21: 1,85,10;2,80,30;3,75,60;4,70,80;5,65,100;6,65,150; | P21: 100,100 | Q21: 对己方宠物使用，使其四回合内对敌方的伤害结果提高15%，且不会逃跑。 | R21: 一种被施过妖法的直剑，使人昏迷，无法战斗。
A22: 32403 | B22: 5★颜如玉 | C22: 5 | D22: 100 | E22: 5 | F22: 80 | G22: 0 | H22: 5 | I22: 1 | J22: 6 | K22: 抱元守缺 | L22: 25000 | M22: 105,(ilv*0.5+5)*1.5;101,(ilv*3+10)*1.5; | N22: 6,3,101,0; | O22: 1,85,10;2,80,30;3,75,60;4,70,80;5,65,100;6,65,150; | P22: 100,100 | Q22: 为自己恢复魔法值。 | R22: 碧绿清透，吸日月之精华，能收集灵气。
A23: 32404 | B23: 5★降魔杖 | C23: 3 | D23: 50 | E23: 3 | F23: 140 | G23: 0 | H23: 5 | I23: 1 | J23: 6 | K23: 血气缠绕 | L23: 25000 | M23: 105,(ilv*1.5+10)*1.5; | N23: 6,3,101,0; | O23: 1,85,10;2,80,30;3,75,60;4,70,80;5,65,100;6,65,150; | P23: 100,100 | Q23: 为己方所有队员恢复气血，对有“鬼魂术”的宠物无效。 | R23: 又称金刚杆，包金雕花，分量沉重，握在手里便能感觉到刚正的佛威（可通过低阶法宝合成）
A24: 32405 | B24: 5★混元伞 | C24: 6 | D24: 50 | E24: 6 | F24: 110 | G24: 0 | H24: 5 | I24: 1 | J24: 6 | K24: 朱雀清鸣 | L24: 25000 | M24: 105,(ilv*0.5+5)*1.5;107,(ilv*0.4+4)*1.5; | N24: 6,3,101,0; | O24: 1,85,10;2,80,30;3,75,60;4,70,80;5,65,100;6,65,150; | P24: 100,100 | Q24: 解除己方全员的异常状态。 | R24: 撑开时天昏地暗，日月无光，转一转乾坤晃动，吸收宝物、兵器。
A25: 32406 | B25: 5★太极图 | C25: 1 | D25: 100 | E25: 1 | F25: 60 | G25: 0 | H25: 5 | I25: 1 | J25: 6 | K25: 幽厉血芒 | L25: 25000 | M25: 104,(ilv*3.8+15)*1.5; | N25: 6,3,101,0; | O25: 1,85,10;2,80,30;3,75,60;4,70,80;5,65,100;6,65,150; | P25: 100,100 | Q25: 对敌方宠物使用，使其四回合内对敌方的伤害结果降低15%，且每回合有15%几率逃跑。 | R25: 包罗万象之宝，劈地开天，分清理浊，定天地水风火。
A26: 32501 | B26: 6★乾坤弩 | C26: 3 | D26: 100 | E26: 3 | F26: 130 | G26: 1 | H26: 6 | I26: 1 | J26: 6 | K26: 青光现 | L26: 30000 | M26: 105,(ilv*1.5+10)*1.5; | N26: 6,2,104,118;6,2,105,97;6,2,101,93;6,2,106,34;6,2,107,13;6,2,102,150;6,3,104,177;6,3,105,146;6,3,101,139;6,3,106,51;6,3,107,19;6,3,102,225; | O26: 1,85,10;2,80,30;3,75,60;4,70,80;5,65,100;6,65,150; | P26: 100,100 | Q26: 为自己恢复气血。 | R26: 千古法宝，为神弓，一弓可同时使用八箭。
A27: 32502 | B27: 6★修罗刀 | C27: 3 | D27: 50 | E27: 3 | F27: 150 | G27: 2 | H27: 6 | I27: 1 | J27: 6 | K27: 佛光普照 | L27: 30000 | M27: 105,(ilv*1.5+10)*1.5; | N27: 6,2,104,118;6,2,105,97;6,2,101,93;6,2,106,34;6,2,107,13;6,2,102,150;6,3,104,177;6,3,105,146;6,3,101,139;6,3,106,51;6,3,107,19;6,3,102,225; | O27: 1,85,10;2,80,30;3,75,60;4,70,80;5,65,100;6,65,150; | P27: 100,100 | Q27: 复活己方所有单位（最多5个），使其气血和气血上限完全恢复；使用后自己的魔法值为零、气血和降为1；不能复活鬼魂。 | R27: 魔教至宝，摄专斩修道人元神，发出紫光，暗黑无比。
A28: 32503 | B28: 6★乾天火灵珠 | C28: 2 | D28: 50 | E28: 2 | F28: 150 | G28: 3 | H28: 6 | I28: 1 | J28: 6 | K28: 阴阳调和 | L28: 30000 | M28: 105,(ilv*0.5+5)*1.5;102,ilv*5*1.5; | N28: 6,2,104,118;6,2,105,97;6,2,101,93;6,2,106,34;6,2,107,13;6,2,102,150;6,3,104,177;6,3,105,146;6,3,101,139;6,3,106,51;6,3,107,19;6,3,102,225; | O28: 1,85,10;2,80,30;3,75,60;4,70,80;5,65,100;6,65,150; | P28: 100,100 | Q28: 解除己方全员的异常状态，并恢复气血，对有“鬼魂术”的宠物无效。 | R28: 乃纯阳至宝，由千年恶物所结的元珠，赤红如火。
A29: 32504 | B29: 6★赤焰剑 | C29: 1 | D29: 50 | E29: 1 | F29: 70 | G29: 2 | H29: 6 | I29: 1 | J29: 6 | K29: 赤阳之力 | L29: 30000 | M29: 104,(ilv*3.8+15)*1.5; | N29: 6,2,104,118;6,2,105,97;6,2,101,93;6,2,106,34;6,2,107,13;6,2,102,150;6,3,104,177;6,3,105,146;6,3,101,139;6,3,106,51;6,3,107,19;6,3,102,225; | O29: 1,85,10;2,80,30;3,75,60;4,70,80;5,65,100;6,65,150; | P29: 100,100 | Q29: 提高己方全员9%攻击力，效果不叠加，持续至战斗结束。 | R29: 剑体通红，使用时如一把火剑，威力绝伦。
A30: 32505 | B30: 6★血焰叉 | C30: 5 | D30: 100 | E30: 5 | F30: 80 | G30: 2 | H30: 6 | I30: 1 | J30: 6 | K30: 化实为虚 | L30: 30000 | M30: 105,(ilv*0.5+5)*1.5;101,(ilv*3+10)*1.5; | N30: 6,2,104,118;6,2,105,97;6,2,101,93;6,2,106,34;6,2,107,13;6,2,102,150;6,3,104,177;6,3,105,146;6,3,101,139;6,3,106,51;6,3,107,19;6,3,102,225; | O30: 1,85,10;2,80,30;3,75,60;4,70,80;5,65,100;6,65,150; | P30: 100,100 | Q30: 提高己方全员9%防御，效果不叠加，持续至战斗结束。 | R30: 用子母阴魂和污血练就，阴毒无比
A31: 32506 | B31: 6★紫芒剑 | C31: 6 | D31: 50 | E31: 6 | F31: 80 | G31: 4 | H31: 6 | I31: 1 | J31: 6 | K31: 紫电青霜 | L31: 30000 | M31: 105,(ilv*0.5+5)*1.5;107,(ilv*0.4+4)*1.5; | N31: 6,2,104,118;6,2,105,97;6,2,101,93;6,2,106,34;6,2,107,13;6,2,102,150;6,3,104,177;6,3,105,146;6,3,101,139;6,3,106,51;6,3,107,19;6,3,102,225; | O31: 1,85,10;2,80,30;3,75,60;4,70,80;5,65,100;6,65,150; | P31: 100,100 | Q31: 提高己方全员9%速度，效果不叠加，持续至战斗结束。 | R31: 至阴至邪，灵力很强，可与自身气脉融为一体
A32: 32507 | B32: 6★彼岸花 | C32: 1 | D32: 50 | E32: 1 | F32: 120 | G32: 1 | H32: 6 | I32: 1 | J32: 6 | K32: 黯然神伤 | L32: 30000 | M32: 104,(ilv*3.8+15)*1.5; | N32: 6,2,104,118;6,2,105,97;6,2,101,93;6,2,106,34;6,2,107,13;6,2,102,150;6,3,104,177;6,3,105,146;6,3,101,139;6,3,106,51;6,3,107,19;6,3,102,225; | O32: 1,85,10;2,80,30;3,75,60;4,70,80;5,65,100;6,65,150; | P32: 100,100 | Q32: 降低敌方全员9%攻击力，效果不叠加，持续至战斗结束。 | R32: 一朵会散发出淡淡白光的小花，暗藏巨大魔力。
A33: 32508 | B33: 6★噬魂杖 | C33: 5 | D33: 100 | E33: 5 | F33: 120 | G33: 1 | H33: 6 | I33: 1 | J33: 6 | K33: 噬魂夺魄 | L33: 30000 | M33: 105,(ilv*0.5+5)*1.5;101,(ilv*3+10)*1.5; | N33: 6,2,104,118;6,2,105,97;6,2,101,93;6,2,106,34;6,2,107,13;6,2,102,150;6,3,104,177;6,3,105,146;6,3,101,139;6,3,106,51;6,3,107,19;6,3,102,225; | O33: 1,85,10;2,80,30;3,75,60;4,70,80;5,65,100;6,65,150; | P33: 100,100 | Q33: 降低敌方全员9%防御，效果不叠加，持续至战斗结束。 | R33: 乃巫教的法宝武器，通过摄人魂与噬人血炼造而成。
A34: 32509 | B34: 6★寒冰刺 | C34: 6 | D34: 50 | E34: 6 | F34: 120 | G34: 3 | H34: 6 | I34: 1 | J34: 6 | K34: 冰寒彻骨 | L34: 30000 | M34: 105,(ilv*0.5+5)*1.5;107,(ilv*0.4+4)*1.5; | N34: 6,2,104,118;6,2,105,97;6,2,101,93;6,2,106,34;6,2,107,13;6,2,102,150;6,3,104,177;6,3,105,146;6,3,101,139;6,3,106,51;6,3,107,19;6,3,102,225; | O34: 1,85,10;2,80,30;3,75,60;4,70,80;5,65,100;6,65,150; | P34: 100,100 | Q34: 降低敌方全员9%速度，效果不叠加，持续至战斗结束。 | R34: 取极寒之铁打造而成，一旦被其锋芒所伤，冰毒入体，十死无生！
A35: 32510 | B35: 6★无形剑 | C35: 4 | D35: 100 | E35: 4 | F35: 80 | G35: 3 | H35: 6 | I35: 1 | J35: 6 | K35: 斩龙决 | L35: 30000 | M35: 106,(ilv*1.1+5)*1.5; | N35: 6,2,104,118;6,2,105,97;6,2,101,93;6,2,106,34;6,2,107,13;6,2,102,150;6,3,104,177;6,3,105,146;6,3,101,139;6,3,106,51;6,3,107,19;6,3,102,225; | O35: 1,85,10;2,80,30;3,75,60;4,70,80;5,65,100;6,65,150; | P35: 100,100 | Q35: 对敌方单人连续使用两次物理攻击，伤害结果降低20%。 | R35: 昔日月精华，用时无声无息，无影无形，随御剑之人心意隐现，
A36: 32511 | B36: 6★天璇剑 | C36: 4 | D36: 100 | E36: 4 | F36: 80 | G36: 4 | H36: 6 | I36: 1 | J36: 6 | K36: 御雷决 | L36: 30000 | M36: 106,(ilv*1.1+5)*1.5; | N36: 6,2,104,118;6,2,105,97;6,2,101,93;6,2,106,34;6,2,107,13;6,2,102,150;6,3,104,177;6,3,105,146;6,3,101,139;6,3,106,51;6,3,107,19;6,3,102,225; | O36: 1,85,10;2,80,30;3,75,60;4,70,80;5,65,100;6,65,150; | P36: 100,100 | Q36: 对敌方单人连续使用两次法术攻击，伤害结果降低20%。 | R36: 剑鞘剑柄通体呈天蓝色，色泽鲜亮，隐隐有波光流动，是九天神兵，仙家至宝！
A37: 32512 | B37: 6★五火神焰扇 | C37: 2 | D37: 100 | E37: 2 | F37: 60 | G37: 4 | H37: 6 | I37: 1 | J37: 6 | K37: 鬼魅 | L37: 30000 | M37: 105,(ilv*0.5+5)*1.5;102,ilv*5*1.5; | N37: 6,2,104,118;6,2,105,97;6,2,101,93;6,2,106,34;6,2,107,13;6,2,102,150;6,3,104,177;6,3,105,146;6,3,101,139;6,3,106,51;6,3,107,19;6,3,102,225; | O37: 1,85,10;2,80,30;3,75,60;4,70,80;5,65,100;6,65,150; | P37: 100,100 | Q37: 使己方单人隐身4回合。 | R37: 集空中火、石中火、木中火、三味火、人间火五火，威力无穷。
A38: 32601 | B38: 真·乾坤弩 | C38: 3 | D38: 100 | E38: 3 | F38: 130 | G38: =R[-12]C+4 -> 5 | H38: 7 | I38: 1 | J38: 6 | K38: 真·青光现 | L38: 40000 | M38: 105,(ilv*1.5+10)*1.5; | N38: 7,2,104,153;7,2,105,126;7,2,101,120;7,2,106,44;7,2,107,16;7,2,102,195;7,3,104,230;7,3,105,189;7,3,101,180;7,3,106,66;7,3,107,24;7,3,102,292; | O38: 1,85,10;2,80,30;3,75,60;4,70,80;5,65,100;6,65,150; | P38: 100,100 | Q38: 为自己恢复气血。 | R38: 千古法宝，为神弓，一弓可同时使用八箭。
A39: 32602 | B39: 真·修罗刀 | C39: 3 | D39: 50 | E39: 3 | F39: 150 | G39: =R[-12]C+4 -> 6 | H39: 7 | I39: 1 | J39: 6 | K39: 真·佛光普照 | L39: 40000 | M39: 105,(ilv*1.5+10)*1.5; | N39: 7,2,104,153;7,2,105,126;7,2,101,120;7,2,106,44;7,2,107,16;7,2,102,195;7,3,104,230;7,3,105,189;7,3,101,180;7,3,106,66;7,3,107,24;7,3,102,292; | O39: 1,85,10;2,80,30;3,75,60;4,70,80;5,65,100;6,65,150; | P39: 100,100 | Q39: 复活己方所有单位（最多5个），使其气血和气血上限完全恢复；使用后自己的魔法值为零、气血和降为1；不能复活鬼魂。 | R39: 魔教至宝，摄专斩修道人元神，发出紫光，暗黑无比。
A40: 32603 | B40: 真·乾天火灵珠 | C40: 2 | D40: 50 | E40: 2 | F40: 150 | G40: =R[-12]C+4 -> 7 | H40: 7 | I40: 1 | J40: 6 | K40: 真·阴阳调和 | L40: 40000 | M40: 105,(ilv*0.5+5)*1.5;102,ilv*5*1.5; | N40: 7,2,104,153;7,2,105,126;7,2,101,120;7,2,106,44;7,2,107,16;7,2,102,195;7,3,104,230;7,3,105,189;7,3,101,180;7,3,106,66;7,3,107,24;7,3,102,292; | O40: 1,85,10;2,80,30;3,75,60;4,70,80;5,65,100;6,65,150; | P40: 100,100 | Q40: 解除己方全员的异常状态，并恢复气血，对有“鬼魂术”的宠物无效。 | R40: 乃纯阳至宝，由千年恶物所结的元珠，赤红如火。
A41: 32604 | B41: 真·赤焰剑 | C41: 1 | D41: 50 | E41: 1 | F41: 70 | G41: =R[-12]C+4 -> 6 | H41: 7 | I41: 1 | J41: 6 | K41: 真·赤阳之力 | L41: 40000 | M41: 104,(ilv*3.8+15)*1.5; | N41: 7,2,104,153;7,2,105,126;7,2,101,120;7,2,106,44;7,2,107,16;7,2,102,195;7,3,104,230;7,3,105,189;7,3,101,180;7,3,106,66;7,3,107,24;7,3,102,292; | O41: 1,85,10;2,80,30;3,75,60;4,70,80;5,65,100;6,65,150; | P41: 100,100 | Q41: 提高己方全员9%攻击力，效果不叠加，持续至战斗结束。 | R41: 剑体通红，使用时如一把火剑，威力绝伦。
A42: 32605 | B42: 真·血焰叉 | C42: 5 | D42: 100 | E42: 5 | F42: 80 | G42: =R[-12]C+4 -> 6 | H42: 7 | I42: 1 | J42: 6 | K42: 真·化实为虚 | L42: 40000 | M42: 105,(ilv*0.5+5)*1.5;101,(ilv*3+10)*1.5; | N42: 7,2,104,153;7,2,105,126;7,2,101,120;7,2,106,44;7,2,107,16;7,2,102,195;7,3,104,230;7,3,105,189;7,3,101,180;7,3,106,66;7,3,107,24;7,3,102,292; | O42: 1,85,10;2,80,30;3,75,60;4,70,80;5,65,100;6,65,150; | P42: 100,100 | Q42: 提高己方全员9%防御，效果不叠加，持续至战斗结束。 | R42: 用子母阴魂和污血练就，阴毒无比
A43: 32606 | B43: 真·紫芒剑 | C43: 6 | D43: 50 | E43: 6 | F43: 80 | G43: =R[-12]C+4 -> 8 | H43: 7 | I43: 1 | J43: 6 | K43: 真·紫电青霜 | L43: 40000 | M43: 105,(ilv*0.5+5)*1.5;107,(ilv*0.4+4)*1.5; | N43: 7,2,104,153;7,2,105,126;7,2,101,120;7,2,106,44;7,2,107,16;7,2,102,195;7,3,104,230;7,3,105,189;7,3,101,180;7,3,106,66;7,3,107,24;7,3,102,292; | O43: 1,85,10;2,80,30;3,75,60;4,70,80;5,65,100;6,65,150; | P43: 100,100 | Q43: 提高己方全员9%速度，效果不叠加，持续至战斗结束。 | R43: 至阴至邪，灵力很强，可与自身气脉融为一体
A44: 32607 | B44: 真·彼岸花 | C44: 1 | D44: 50 | E44: 1 | F44: 120 | G44: =R[-12]C+4 -> 5 | H44: 7 | I44: 1 | J44: 6 | K44: 真·黯然神伤 | L44: 40000 | M44: 104,(ilv*3.8+15)*1.5; | N44: 7,2,104,153;7,2,105,126;7,2,101,120;7,2,106,44;7,2,107,16;7,2,102,195;7,3,104,230;7,3,105,189;7,3,101,180;7,3,106,66;7,3,107,24;7,3,102,292; | O44: 1,85,10;2,80,30;3,75,60;4,70,80;5,65,100;6,65,150; | P44: 100,100 | Q44: 降低敌方全员9%攻击力，效果不叠加，持续至战斗结束。 | R44: 一朵会散发出淡淡白光的小花，暗藏巨大魔力。
A45: 32608 | B45: 真·噬魂杖 | C45: 5 | D45: 100 | E45: 5 | F45: 120 | G45: =R[-12]C+4 -> 5 | H45: 7 | I45: 1 | J45: 6 | K45: 真·噬魂夺魄 | L45: 40000 | M45: 105,(ilv*0.5+5)*1.5;101,(ilv*3+10)*1.5; | N45: 7,2,104,153;7,2,105,126;7,2,101,120;7,2,106,44;7,2,107,16;7,2,102,195;7,3,104,230;7,3,105,189;7,3,101,180;7,3,106,66;7,3,107,24;7,3,102,292; | O45: 1,85,10;2,80,30;3,75,60;4,70,80;5,65,100;6,65,150; | P45: 100,100 | Q45: 降低敌方全员9%防御，效果不叠加，持续至战斗结束。 | R45: 乃巫教的法宝武器，通过摄人魂与噬人血炼造而成。
A46: 32609 | B46: 真·寒冰刺 | C46: 6 | D46: 50 | E46: 6 | F46: 120 | G46: =R[-12]C+4 -> 7 | H46: 7 | I46: 1 | J46: 6 | K46: 真·冰寒彻骨 | L46: 40000 | M46: 105,(ilv*0.5+5)*1.5;107,(ilv*0.4+4)*1.5; | N46: 7,2,104,153;7,2,105,126;7,2,101,120;7,2,106,44;7,2,107,16;7,2,102,195;7,3,104,230;7,3,105,189;7,3,101,180;7,3,106,66;7,3,107,24;7,3,102,292; | O46: 1,85,10;2,80,30;3,75,60;4,70,80;5,65,100;6,65,150; | P46: 100,100 | Q46: 降低敌方全员9%速度，效果不叠加，持续至战斗结束。 | R46: 取极寒之铁打造而成，一旦被其锋芒所伤，冰毒入体，十死无生！
A47: 32610 | B47: 真·无形剑 | C47: 4 | D47: 100 | E47: 4 | F47: 80 | G47: =R[-12]C+4 -> 7 | H47: 7 | I47: 1 | J47: 6 | K47: 真·斩龙决 | L47: 40000 | M47: 106,(ilv*1.1+5)*1.5; | N47: 7,2,104,153;7,2,105,126;7,2,101,120;7,2,106,44;7,2,107,16;7,2,102,195;7,3,104,230;7,3,105,189;7,3,101,180;7,3,106,66;7,3,107,24;7,3,102,292; | O47: 1,85,10;2,80,30;3,75,60;4,70,80;5,65,100;6,65,150; | P47: 100,100 | Q47: 对敌方单人连续使用两次物理攻击，伤害结果降低20%。 | R47: 昔日月精华，用时无声无息，无影无形，随御剑之人心意隐现，
A48: 32611 | B48: 真·天璇剑 | C48: 4 | D48: 100 | E48: 4 | F48: 80 | G48: =R[-12]C+4 -> 8 | H48: 7 | I48: 1 | J48: 6 | K48: 真·御雷决 | L48: 40000 | M48: 106,(ilv*1.1+5)*1.5; | N48: 7,2,104,153;7,2,105,126;7,2,101,120;7,2,106,44;7,2,107,16;7,2,102,195;7,3,104,230;7,3,105,189;7,3,101,180;7,3,106,66;7,3,107,24;7,3,102,292; | O48: 1,85,10;2,80,30;3,75,60;4,70,80;5,65,100;6,65,150; | P48: 100,100 | Q48: 对敌方单人连续使用两次法术攻击，伤害结果降低20%。 | R48: 剑鞘剑柄通体呈天蓝色，色泽鲜亮，隐隐有波光流动，是九天神兵，仙家至宝！
A49: 32612 | B49: 真·五火神焰扇 | C49: 2 | D49: 100 | E49: 2 | F49: 60 | G49: =R[-12]C+4 -> 8 | H49: 7 | I49: 1 | J49: 6 | K49: 真·鬼魅 | L49: 40000 | M49: 105,(ilv*0.5+5)*1.5;102,ilv*5*1.5; | N49: 7,2,104,153;7,2,105,126;7,2,101,120;7,2,106,44;7,2,107,16;7,2,102,195;7,3,104,230;7,3,105,189;7,3,101,180;7,3,106,66;7,3,107,24;7,3,102,292; | O49: 1,85,10;2,80,30;3,75,60;4,70,80;5,65,100;6,65,150; | P49: 100,100 | Q49: 使己方单人隐身4回合。 | R49: 集空中火、石中火、木中火、三味火、人间火五火，威力无穷。

Sheet: Sheet2
F4: 木鱼 | G4: 天音寺四大神僧每天都敲的木鱼，受佛法熏陶，已具灵性
F5: 獠牙 | G5: 乃野狗道人所持法宝，状似大狗牙，美其名曰“獠牙”
F6: 十虎剑 | G6: 挥动时会缠有金色的火焰，刚猛如十虎下山，因而得名
F7: 神木骰 | G7: 取南方赤水之畔千年三珠树的精华雕刻而成的法宝(可通过低阶法宝合成）
F8: 赤魔眼 | G8: 炼血堂老大用自己右眼修炼的法宝，施法时，充满血色，会放出凶煞血腥之气（可通过低阶法宝合成）
F9: 杀生刀 | G9: 乃鬼厉手下得力猛将杀生和尚的武器，杀生无数，故而煞气极重（可通过低阶法宝合成）
F10: 浮屠金钵 | G10: 乃天音寺四大神僧普方所持有的法宝，威力刚猛，除魔无数（可通过低阶法宝合成）
F11: 琥珀朱绫 | G11: 看似一条普通的三尺来长的红色腰带，五行属土，妙用无方，威力巨大（可通过低阶法宝合成）
F12: 寒冰剑 | G12: 齐昊自己所修炼，法宝材质极好，乃用北极万年冰晶所炼成，威力巨大，可凝冰墙（可通过低阶法宝合成）
F13: 翡翠念珠 | G13: 佛珠圆润，坠于掌间，随心中佛念和口中福语转动，诸般烦恼，仿佛早已消散于无边无际（可通过低阶法宝合成）
F14: 轮回珠 | G14: 法相的法宝，肃穆之中带着耀眼的佛家光辉，乃佛门至宝（可通过低阶法宝合成）
F15: 六合镜 | G15: 形状古拙，青铜镂边，上刻龙，下刻虎，镜上刻着八卦方位。乃青云至宝之一（可通过低阶法宝合成）
F16: 离人锥 | G16: 本为黑心老人收藏，炼血堂没落后，辗转于周隐之手，相传拥有比刺杀更强大的力量（可通过低阶法宝合成）
F17: 降魔杖 | G17: 又称金刚杆，包金雕花，分量沉重，握在手里便能感觉到刚正的佛威（可通过低阶法宝合成）
F18: 九阳尺 | G18: 又名纯阳玉尺，乃焚香谷宝物，绝非凡品（可通过低阶法宝合成）
F19: 万毒归宗袋 | G19: 乃毒神法宝，袋内养有异虫“七尾蜈蚣”（可通过低阶法宝合成）
F20: 控妖笛 | G20: 纯黑色的铁笛，乃秦无炎的法宝，拥有操控毒物妖怪的奇能（可通过低阶法宝合成）
F21: 青灵石 | G21: 乃焚香谷燕虹的法宝，来历不详，但威力不俗（可通过低阶法宝合成）
F22: 血玉骨片 | G22: 用至阴之人颅骨碎片炼化而成，其中不知还加了多少生人魂魄（可通过低阶法宝合成）
F23: 朱雀印 | G23: 乃鬼王四圣使朱雀幽姬的法宝，内含奇门印法，诡异至极，威力不俗（可通过低阶法宝合成）
F24: 血骷髅 | G24: 吸血老妖炼制的法宝，与鬼厉的嗜血珠乃是同源，是赖以催动五鬼御灵和吸血大阵的法宝（可通过低阶法宝合成）
F25: 乾坤清光戒 | G25: 鬼王四圣使青龙使用的法宝，乃九天神兵之一，威力不俗（可通过低阶法宝合成）
F26: 大悲金轮 | G26: 圆盘金轮模样，通体金黄，一尺直径见方，边缘一圈镂刻着诸罗汉金身法相，围绕着中间处正是佛祖的真身法相（可通过低阶法宝合成）
F27: 阴阳镜 | G27: 有阴阳两面，阴面为黑，阳面为白，黑是死，白是生。乃道家灵宝（可通过低阶法宝合成）
F28: 赤焰剑 | G28: 剑体通红的宝剑，乃大竹峰首座田不易的法宝，威力绝伦（可通过低阶法宝合成）
F29: 墨雪 | G29: 苏茹的法宝，剑刃长两尺，剑柄材质似玉非玉，最奇特处乃是如冰一般（可通过低阶法宝合成）
F30: 紫芒刃 | G30: 乃魔教妙公子金瓶儿所有，至阴至邪，灵力很强，可与自身气脉融为一体（可通过低阶法宝合成）
F31: 伤心花 | G31: 一朵会散发出淡淡白光的小花，是鬼王费大心血为其爱女碧瑶专门炼制的法宝（可通过低阶法宝合成）
F32: 噬魂棍 | G32: 乃张小凡的法宝武器，由“摄魂”与“噬血珠”结合，再由小凡血炼而成（可通过低阶法宝合成）
F33: 九寒凝冰刺 | G33: 焚香谷谷主上官策所使用的法宝，取极寒之铁打造而成，一旦被其锋芒所伤，冰毒入体，十死无生！（可通过低阶法宝合成）
F34: 斩龙剑 | G34: 碧绿仙剑，剑身有龙形，剑刃清清如秋水，瑞气蒸腾，碧绿如水，光芒万丈！（可通过低阶法宝合成）
F35: 天琊剑 | G35: 剑鞘剑柄通体呈天蓝色，色泽鲜亮，隐隐有波光流动，是九天神兵，仙家至宝！（可通过低阶法宝合成）
F36: 斩相思 | G36: 秦无炎的法宝，通体闪烁着妖艳光芒的弯牙匕首，两面都开有血槽，其中暗藏的剧毒，见血封喉！（可通过低阶法宝合成）

Sheet: Sheet3
S2: 6 | T2: 2 | U2: 104 | V2: 118 | X2: =INT(RC[-2]*1.3) -> 153
S3: 6 | T3: 2 | U3: 105 | V3: 97 | X3: =INT(RC[-2]*1.3) -> 126
S4: 6 | T4: 2 | U4: 101 | V4: 93 | X4: =INT(RC[-2]*1.3) -> 120
S5: 6 | T5: 2 | U5: 106 | V5: 34 | X5: =INT(RC[-2]*1.3) -> 44
S6: 6 | T6: 2 | U6: 107 | V6: 13 | X6: =INT(RC[-2]*1.3) -> 16
E7: 6,2,104,118 | F7: 6,2,105,97 | G7: 6,2,101,93 | H7: 6,2,106,34 | I7: 6,2,107,13 | J7: 6,2,102,150 | K7: 6,3,104,177 | L7: 6,3,105,146 | M7: 6,3,101,139 | N7: 6,3,106,51 | O7: 6,3,107,19 | P7: 6,3,102,225 | S7: 6 | T7: 2 | U7: 102 | V7: 150 | X7: =INT(RC[-2]*1.3) -> 195
E8: 6,2,104,118 | F8: 6,2,105,97 | G8: 6,2,101,93 | H8: 6,2,106,34 | I8: 6,2,107,13 | J8: 6,2,102,150 | K8: 6,3,104,177 | L8: 6,3,105,146 | M8: 6,3,101,139 | N8: 6,3,106,51 | O8: 6,3,107,19 | P8: 6,3,102,225 | S8: 6 | T8: 3 | U8: 104 | V8: 177 | X8: =INT(RC[-2]*1.3) -> 230
E9: 7,2,104,118 | F9: 7,2,105,97 | G9: 7,2,101,93 | H9: 7,2,107,34 | I9: 7,2,107,13 | J9: 7,2,102,150 | K9: 7,3,104,177 | L9: 7,3,105,147 | M9: 7,3,101,139 | N9: 7,3,107,51 | O9: 7,3,107,19 | P9: 7,3,102,225 | S9: 6 | T9: 3 | U9: 105 | V9: 146 | X9: =INT(RC[-2]*1.3) -> 189
E10: 7,2,104,118 | F10: 7,2,105,97 | G10: 7,2,101,93 | H10: 7,2,107,34 | I10: 7,2,107,13 | J10: 7,2,102,150 | K10: 7,3,104,177 | L10: 7,3,105,147 | M10: 7,3,101,139 | N10: 7,3,107,51 | O10: 7,3,107,19 | P10: 7,3,102,225 | S10: 6 | T10: 3 | U10: 101 | V10: 139 | X10: =INT(RC[-2]*1.3) -> 180
S11: 6 | T11: 3 | U11: 106 | V11: 51 | X11: =INT(RC[-2]*1.3) -> 66
S12: 6 | T12: 3 | U12: 107 | V12: 19 | X12: =INT(RC[-2]*1.3) -> 24
S13: 6 | T13: 3 | U13: 102 | V13: 225 | X13: =INT(RC[-2]*1.3) -> 292
E14: 7,2,104,153; | F14: 7,2,105,126; | G14: 7,2,101,120; | H14: 7,2,106,44; | I14: 7,2,107,16; | J14: 7,2,102,195; | K14: 7,3,104,230; | L14: 7,3,105,189; | M14: 7,3,101,180; | N14: 7,3,106,66; | O14: 7,3,107,24; | P14: 7,3,102,292;
D16: =R[-2]C[1]&R[-2]C[2]&R[-2]C[3]&R[-2]C[4]&R[-2]C[5]&R[-2]C[6]&R[-2]C[7]&R[-2]C[8]&R[-2]C[9]&R[-2]C[10]&R[-2]C[11]&R[-2]C[12] -> 7,2,104,153;7,2,105,126;7,2,101,120;7,2,106,44;7,2,107,16;7,2,102,195;7,3,104,230;7,3,105,189;7,3,101,180;7,3,106,66;7,3,107,24;7,3,102,292;
S20: 6 | T20: 2 | U20: 104 | V20: =R[-18]C[2] -> 153 | X20: =RC[-5]&"," -> 6, | Y20: =RC[-5]&"," -> 2, | Z20: =RC[-5]&"," -> 104, | AA20: =RC[-5]&";" -> 153; | AC20: =RC[-5]&RC[-4]&RC[-3]&RC[-2] -> 6,2,104,153;
S21: 6 | T21: 2 | U21: 105 | V21: =R[-18]C[2] -> 126 | X21: =RC[-5]&"," -> 6, | Y21: =RC[-5]&"," -> 2, | Z21: =RC[-5]&"," -> 105, | AA21: =RC[-5]&";" -> 126; | AC21: =RC[-5]&RC[-4]&RC[-3]&RC[-2] -> 6,2,105,126;
S22: 6 | T22: 2 | U22: 101 | V22: =R[-18]C[2] -> 120 | X22: =RC[-5]&"," -> 6, | Y22: =RC[-5]&"," -> 2, | Z22: =RC[-5]&"," -> 101, | AA22: =RC[-5]&";" -> 120; | AC22: =RC[-5]&RC[-4]&RC[-3]&RC[-2] -> 6,2,101,120;
S23: 6 | T23: 2 | U23: 106 | V23: =R[-18]C[2] -> 44 | X23: =RC[-5]&"," -> 6, | Y23: =RC[-5]&"," -> 2, | Z23: =RC[-5]&"," -> 106, | AA23: =RC[-5]&";" -> 44; | AC23: =RC[-5]&RC[-4]&RC[-3]&RC[-2] -> 6,2,106,44;
S24: 6 | T24: 2 | U24: 107 | V24: =R[-18]C[2] -> 16 | X24: =RC[-5]&"," -> 6, | Y24: =RC[-5]&"," -> 2, | Z24: =RC[-5]&"," -> 107, | AA24: =RC[-5]&";" -> 16; | AC24: =RC[-5]&RC[-4]&RC[-3]&RC[-2] -> 6,2,107,16;
S25: 6 | T25: 2 | U25: 102 | V25: =R[-18]C[2] -> 195 | X25: =RC[-5]&"," -> 6, | Y25: =RC[-5]&"," -> 2, | Z25: =RC[-5]&"," -> 102, | AA25: =RC[-5]&";" -> 195; | AC25: =RC[-5]&RC[-4]&RC[-3]&RC[-2] -> 6,2,102,195;
S26: 6 | T26: 3 | U26: 104 | V26: =R[-18]C[2] -> 230 | X26: =RC[-5]&"," -> 6, | Y26: =RC[-5]&"," -> 3, | Z26: =RC[-5]&"," -> 104, | AA26: =RC[-5]&";" -> 230; | AC26: =RC[-5]&RC[-4]&RC[-3]&RC[-2] -> 6,3,104,230;
S27: 6 | T27: 3 | U27: 105 | V27: =R[-18]C[2] -> 189 | X27: =RC[-5]&"," -> 6, | Y27: =RC[-5]&"," -> 3, | Z27: =RC[-5]&"," -> 105, | AA27: =RC[-5]&";" -> 189; | AC27: =RC[-5]&RC[-4]&RC[-3]&RC[-2] -> 6,3,105,189;
S28: 6 | T28: 3 | U28: 101 | V28: =R[-18]C[2] -> 180 | X28: =RC[-5]&"," -> 6, | Y28: =RC[-5]&"," -> 3, | Z28: =RC[-5]&"," -> 101, | AA28: =RC[-5]&";" -> 180; | AC28: =RC[-5]&RC[-4]&RC[-3]&RC[-2] -> 6,3,101,180;
S29: 6 | T29: 3 | U29: 106 | V29: =R[-18]C[2] -> 66 | X29: =RC[-5]&"," -> 6, | Y29: =RC[-5]&"," -> 3, | Z29: =RC[-5]&"," -> 106, | AA29: =RC[-5]&";" -> 66; | AC29: =RC[-5]&RC[-4]&RC[-3]&RC[-2] -> 6,3,106,66;
S30: 6 | T30: 3 | U30: 107 | V30: =R[-18]C[2] -> 24 | X30: =RC[-5]&"," -> 6, | Y30: =RC[-5]&"," -> 3, | Z30: =RC[-5]&"," -> 107, | AA30: =RC[-5]&";" -> 24; | AC30: =RC[-5]&RC[-4]&RC[-3]&RC[-2] -> 6,3,107,24;
S31: 6 | T31: 3 | U31: 102 | V31: =R[-18]C[2] -> 292 | X31: =RC[-5]&"," -> 6, | Y31: =RC[-5]&"," -> 3, | Z31: =RC[-5]&"," -> 102, | AA31: =RC[-5]&";" -> 292; | AC31: =RC[-5]&RC[-4]&RC[-3]&RC[-2] -> 6,3,102,292;