Sheet: ctBuyConf
B1: 1 -VIP等级 2-非绑元宝 3-绑定元宝 230-所有元宝(去数量,消耗可用,增加不可用) 4-金币 5-银币 6-活力 7-经验 8-储备经验(已屏蔽) 9-潜力点 10-竞技币 11-修炼经验 12-灵石采集许可 13-绿灵石 14-蓝灵石 15-紫灵石 16-橙灵石 17-宠物经验 18-侠义值 19-活跃值 20-双倍点数 21-帮贡 22-联盟经验(不在角色身上) 23-联盟活跃度(不在角色身上) 24-金锭 25-福缘值 26-蓝钻 27-摄魂灵气 28-摄魂内丹 29-摄魂妖晶 | D1: 2 元宝 5 银币 | F1: 0 无限购 1 周限购 | H1: 目前支持灵气兑换硬币
A2: nID | B2: nBuyType | C2: nBuyCoin | D2: nCostType | E2: nCostNum | F2: nLimitType | G2: nLimitNum | H2: tProportion
A3: i | B3: i | C3: i | D3: i | E3: i | F3: i | G3: i | H3: t{ii}
A4: 编号 | B4: 购买类型 | C4: 购买货币数量 | D4: 消耗货币类型 | E4: 消耗数量 | F4: 限购类型 | G4: 限购数量 | H4: 0,0
A5: 101 | B5: 4 | C5: 60000 | D5: 230 | E5: 600 | F5: 0 | G5: 0 | H5: 0,0
A6: 102 | B6: 4 | C6: 180000 | D6: 230 | E6: 1800 | F6: 0 | G6: 0 | H6: 0,0
A7: 103 | B7: 4 | C7: 300000 | D7: 230 | E7: 3000 | F7: 0 | G7: 0 | H7: 0,0
A8: 104 | B8: 4 | C8: 600000 | D8: 230 | E8: 6000 | F8: 0 | G8: 0 | H8: 0,0
A9: 105 | B9: 4 | C9: 1000000 | D9: 230 | E9: 10000 | F9: 0 | G9: 0 | H9: 0,0
A10: 106 | B10: 4 | C10: 2000000 | D10: 230 | E10: 20000 | F10: 0 | G10: 0 | H10: 0,0
A11: 201 | B11: 5 | C11: =RC[2]*200 -> 100000 | D11: 230 | E11: 500 | F11: 0 | G11: 0 | H11: 0,0
A12: 202 | B12: 5 | C12: =RC[2]*200 -> 300000 | D12: 230 | E12: 1500 | F12: 0 | G12: 0 | H12: 0,0
A13: 203 | B13: 5 | C13: =RC[2]*200 -> 500000 | D13: 230 | E13: 2500 | F13: 0 | G13: 0 | H13: 0,0
A14: 204 | B14: 5 | C14: =RC[2]*200 -> 1000000 | D14: 230 | E14: 5000 | F14: 0 | G14: 0 | H14: 0,0
A15: 205 | B15: 5 | C15: =RC[2]*200 -> 2000000 | D15: 230 | E15: 10000 | F15: 0 | G15: 0 | H15: 0,0
A16: 206 | B16: 5 | C16: =RC[2]*200 -> 4000000 | D16: 230 | E16: 20000 | F16: 0 | G16: 0 | H16: 0,0
A17: 301 | B17: 21 | C17: 50 | D17: 5 | E17: 250000 | F17: 1 | G17: 1 | H17: 0,0
A18: 302 | B18: 21 | C18: 150 | D18: 5 | E18: 750000 | F18: 1 | G18: 1 | H18: 0,0
A19: 303 | B19: 21 | C19: 350 | D19: 5 | E19: 1750000 | F19: 1 | G19: 1 | H19: 0,0
A20: 401 | B20: 24 | C20: 6000 | D20: 2 | E20: 60 | F20: 0 | G20: 0 | H20: 0,0
A21: 402 | B21: 24 | C21: 18000 | D21: 2 | E21: 180 | F21: 0 | G21: 0 | H21: 0,0
A22: 403 | B22: 24 | C22: 30000 | D22: 2 | E22: 300 | F22: 0 | G22: 0 | H22: 0,0
A23: 404 | B23: 24 | C23: 60000 | D23: 2 | E23: 600 | F23: 0 | G23: 0 | H23: 0,0
A24: 405 | B24: 24 | C24: 100000 | D24: 2 | E24: 1000 | F24: 0 | G24: 0 | H24: 0,0
A25: 406 | B25: 24 | C25: 200000 | D25: 2 | E25: 2000 | F25: 0 | G25: 0 | H25: 0,0
A26: 501 | B26: 27 | C26: 30000 | D26: 5 | E26: 600000 | F26: 0 | G26: 0 | H26: 0,0
A27: 502 | B27: 27 | C27: 90000 | D27: 5 | E27: 1800000 | F27: 0 | G27: 0 | H27: 0,0
A28: 503 | B28: 27 | C28: 150000 | D28: 5 | E28: 3000000 | F28: 0 | G28: 0 | H28: 0,0
A29: 504 | B29: 27 | C29: 300000 | D29: 5 | E29: 6000000 | F29: 0 | G29: 0 | H29: 0,0
A30: 505 | B30: 27 | C30: 500000 | D30: 5 | E30: 10000000 | F30: 0 | G30: 0 | H30: 0,0
A31: 506 | B31: 27 | C31: 1000000 | D31: 5 | E31: 20000000 | F31: 0 | G31: 0 | H31: 0,0
A32: 601 | B32: 28 | C32: =RC[2] -> 500 | D32: 2 | E32: 500 | F32: 0 | G32: 0 | H32: 0,0
A33: 602 | B33: 28 | C33: =RC[2] -> 1500 | D33: 2 | E33: 1500 | F33: 0 | G33: 0 | H33: 0,0
A34: 603 | B34: 28 | C34: =RC[2] -> 2500 | D34: 2 | E34: 2500 | F34: 0 | G34: 0 | H34: 0,0
A35: 604 | B35: 28 | C35: =RC[2] -> 5000 | D35: 2 | E35: 5000 | F35: 0 | G35: 0 | H35: 0,0
A36: 605 | B36: 28 | C36: =RC[2] -> 10000 | D36: 2 | E36: 10000 | F36: 0 | G36: 0 | H36: 0,0
A37: 606 | B37: 28 | C37: =RC[2] -> 20000 | D37: 2 | E37: 20000 | F37: 0 | G37: 0 | H37: 0,0
A38: 701 | B38: 5 | C38: 1000000 | D38: 27 | E38: 50000 | F38: 0 | G38: 0 | H38: 1,20