Sheet: ctMassiveShop
E1: 1：上架 0：不上架 | F1: 1: 道具 2: 货币 3: 宠物 4: 伙伴 5: 法宝 | G1: -1：无限 | H1: 2：非绑元宝 3:绑定元宝 4：金币 5：银币 6：活力 7：经验 8：储备经验 9:潜力点 10：竞技积分 18：侠义积分 24：金锭 26 超级神兽蓝钻 27 灵气 28 内丹 29 妖晶 230 通用元宝 | J1: 累计充值元宝数量
A2: nIndex | B2: nID | C2: sName | D2: nNum | E2: bUpFrame | F2: nBagType | G2: nLimNum | H2: nMoneyType | I2: nNeedNum | J2: nTotalMoney
A3: i | B3: i | C3: s | D3: i | E3: b | F3: i | G3: i | H3: i | I3: i | J3: i
A4: 物品排序编号 | B4: 物品ID | C4: 物品名称 | D4: 购买数量 | E4: 是否上架 | F4: 背包类型 | G4: 限购数量 | H4: 货币类型 | I4: 所需货币数量 | J4: 充值达到多少可以购买
A5: 20104 | B5: 10005 | C5: 宠物包袱*10 | D5: 10 | E5: 1 | F5: 1 | G5: 9999 | H5: 2 | I5: 1 | J5: 0
A6: 20105 | B6: 10004 | C6: 角色包袱*10 | D6: 10 | E6: 1 | F6: 1 | G6: 9999 | H6: 2 | I6: 1 | J6: 50
A7: 20106 | B7: 10108 | C7: 器灵经验丹*10 | D7: 10 | E7: 1 | F7: 1 | G7: 9999 | H7: 2 | I7: 1 | J7: 100
A8: 20107 | B8: 10113 | C8: 法宝祭炼石*10 | D8: 10 | E8: 1 | F8: 1 | G8: 9999 | H8: 2 | I8: 1 | J8: 200
A9: 20108 | B9: 19013 | C9: 圣灵果*10 | D9: 10 | E9: 1 | F9: 1 | G9: 9999 | H9: 2 | I9: 1 | J9: 500
A10: 20109 | B10: 10208 | C10: 仙侣觉醒丹*10 | D10: 10 | E10: 1 | F10: 1 | G10: 9999 | H10: 2 | I10: 1 | J10: 1000
A11: 20110 | B11: 10209 | C11: 宠物觉醒丹*10 | D11: 10 | E11: 1 | F11: 1 | G11: 9999 | H11: 2 | I11: 1 | J11: 2000

Sheet: Sheet2
C1: 78 | D1: =RC[-1]/2 -> 39
C2: 500 | D2: =RC[-1]/2 -> 250
C3: 20 | D3: =RC[-1]/2 -> 10
C4: 20 | D4: =RC[-1]/2 -> 10
C5: 100 | D5: =RC[-1]/2 -> 50
C6: 400 | D6: =RC[-1]/2 -> 200
C7: 400 | D7: =RC[-1]/2 -> 200
C8: 1200 | D8: =RC[-1]/2 -> 600
C9: 1200 | D9: =RC[-1]/2 -> 600
C10: 300 | D10: =RC[-1]/2 -> 150
C11: 300 | D11: =RC[-1]/2 -> 150
C12: 300 | D12: =RC[-1]/2 -> 150
C13: 300 | D13: =RC[-1]/2 -> 150
C14: 300 | D14: =RC[-1]/2 -> 150