Sheet: ctShopItem
B1: 101：药店 102：服饰店 103：武器店 104：宠物商店 201:奇珍异宝 202：功能玩法 203：每日限购 204：每周限购 205：积分兑换 301：侠义积分 302：竞技积分 303：蓝钻兑换 304：内丹兑换 305：妖晶兑换 401：特惠 | E1: 1：上架 0：不上架 | F1: 0：不限购 1：每天限购 2：每周限购 3：每月限购 4：每个号只能兑换一次 | G1: 1: 道具 2: 货币 3: 宠物 4: 伙伴 5: 法宝 | H1: -1：无限 | J1: 万分比 | K1: 1：VIP等级 2：非绑元宝 3:绑定元宝 4：金币 5：银币 6：活力 7：经验 8：储备经验 9:潜力点 10：竞技积分 18：侠义积分 24：金锭 26 神兽乐园蓝钻 27 灵气 28 内丹 29 妖晶 230 通用元宝 | P1: 0：无折扣
A2: 0 | B2: 0 | C2: 0 | D2: 0 | E2: 1 | F2: 1 | G2: 1 | H2: 0 | I2: 1 | J2: 1 | K2: 0 | L2: 0 | M2: 0 | N2: 1 | O2: 1 | P2: 1 | Q2: 1
A3: nIndex | B3: nShopType | C3: nID | D3: sName | E3: bUpFrame | F3: nLimBuyType | G3: nBagType | H3: nLimNum | I3: nGroupId | J3: nWeight | K3: nMoneyType | L3: nNeedNum | M3: nLevel | N3: sDisStartDateStr | O3: sDisEndDateStr | P3: nDiscountStr | Q3: nDiscountPriceStr
A4: i | B4: i | C4: i | D4: s | E4: b | F4: i | G4: i | H4: i | I4: i | J4: i | K4: i | L4: i | M4: i | N4: s | O4: s | P4: i | Q4: i
A5: 物品排序编号 | B5: 所属商店 | C5: 物品编号 | D5: 物品名称 | E5: 是否上架 | F5: 限购类型 | G5: 背包类型 | H5: 限购数量 | I5: 分组id | J5: 权重 | K5: 货币类型 | L5: 所需货币数量 | M5: 可见人物等级 | N5: 折扣开始时间 | O5: 折扣结束时间 | P5: 折扣 | Q5: 折扣价
A6: 10101 | B6: 101 | C6: 22000 | D6: 金疮药 | E6: 1 | F6: 0 | G6: 1 | H6: -1 | I6: 0 | J6: 0 | K6: 5 | L6: 750 | M6: 0 | N6: 0 | O6: 0 | P6: 0 | Q6: 0
A7: 10102 | B7: 101 | C7: 22001 | D7: 血还丹 | E7: 1 | F7: 0 | G7: 1 | H7: -1 | I7: 0 | J7: 0 | K7: 5 | L7: 1000 | M7: 0 | N7: 0 | O7: 0 | P7: 0 | Q7: 0
A8: 10103 | B8: 101 | C8: 22002 | D8: 济生丸 | E8: 1 | F8: 0 | G8: 1 | H8: -1 | I8: 0 | J8: 0 | K8: 5 | L8: 3000 | M8: 0 | N8: 0 | O8: 0 | P8: 0 | Q8: 0
A9: 10104 | B9: 101 | C9: 22003 | D9: 聚元丹 | E9: 1 | F9: 0 | G9: 1 | H9: -1 | I9: 0 | J9: 0 | K9: 5 | L9: 30000 | M9: 0 | N9: 0 | O9: 0 | P9: 0 | Q9: 0
A10: 10201 | B10: 102 | C10: 1200100 | D10: 布帽 | E10: 1 | F10: 0 | G10: 1 | H10: -1 | I10: 0 | J10: 0 | K10: 5 | L10: 1000 | M10: 0 | N10: 0 | O10: 0 | P10: 0 | Q10: 0
A11: 10202 | B11: 102 | C11: 1200101 | D11: 武勇帽 | E11: 1 | F11: 0 | G11: 1 | H11: -1 | I11: 0 | J11: 0 | K11: 5 | L11: 1000 | M11: 0 | N11: 0 | O11: 0 | P11: 0 | Q11: 0
A12: 10203 | B12: 102 | C12: 1200200 | D12: 布巾 | E12: 1 | F12: 0 | G12: 1 | H12: -1 | I12: 0 | J12: 0 | K12: 5 | L12: 1000 | M12: 0 | N12: 0 | O12: 0 | P12: 0 | Q12: 0
A13: 10204 | B13: 102 | C13: 1200201 | D13: 巾帼帽 | E13: 1 | F13: 0 | G13: 1 | H13: -1 | I13: 0 | J13: 0 | K13: 5 | L13: 1000 | M13: 0 | N13: 0 | O13: 0 | P13: 0 | Q13: 0
A14: 10301 | B14: 103 | C14: 1101100 | D14: 鬼头 | E14: 1 | F14: 0 | G14: 1 | H14: -1 | I14: 0 | J14: 0 | K14: 5 | L14: 1000 | M14: 0 | N14: 0 | O14: 0 | P14: 0 | Q14: 0
A15: 10302 | B15: 103 | C15: 1101200 | D15: 碧鳞 | E15: 1 | F15: 0 | G15: 1 | H15: -1 | I15: 0 | J15: 0 | K15: 5 | L15: 1000 | M15: 0 | N15: 0 | O15: 0 | P15: 0 | Q15: 0
A16: 10401 | B16: 104 | C16: 3001 | D16: 瞌睡龙 | E16: 1 | F16: 0 | G16: 1 | H16: -1 | I16: 0 | J16: 0 | K16: 5 | L16: 5000 | M16: 0 | N16: 0 | O16: 0 | P16: 0 | Q16: 0
A17: 10402 | B17: 104 | C17: 3002 | D17: 兜兜 | E17: 1 | F17: 0 | G17: 1 | H17: -1 | I17: 0 | J17: 0 | K17: 5 | L17: 5000 | M17: 0 | N17: 0 | O17: 0 | P17: 0 | Q17: 0
A18: 10403 | B18: 104 | C18: 3003 | D18: 菜刀兔 | E18: 1 | F18: 0 | G18: 1 | H18: -1 | I18: 0 | J18: 0 | K18: 5 | L18: 5000 | M18: 0 | N18: 0 | O18: 0 | P18: 0 | Q18: 0
A19: 10404 | B19: 104 | C19: 3011 | D19: 花魅 | E19: 1 | F19: 0 | G19: 1 | H19: -1 | I19: 0 | J19: 0 | K19: 5 | L19: 8000 | M19: 0 | N19: 0 | O19: 0 | P19: 0 | Q19: 0
A20: 10405 | B20: 104 | C20: 3012 | D20: 山精 | E20: 1 | F20: 0 | G20: 1 | H20: -1 | I20: 0 | J20: 0 | K20: 5 | L20: 8000 | M20: 0 | N20: 0 | O20: 0 | P20: 0 | Q20: 0
A21: 10406 | B21: 104 | C21: 3013 | D21: 山狐 | E21: 1 | F21: 0 | G21: 1 | H21: -1 | I21: 0 | J21: 0 | K21: 5 | L21: 8000 | M21: 0 | N21: 0 | O21: 0 | P21: 0 | Q21: 0
A22: 10407 | B22: 104 | C22: 3021 | D22: 魔蝎 | E22: 1 | F22: 0 | G22: 1 | H22: -1 | I22: 0 | J22: 0 | K22: 5 | L22: 11000 | M22: 5 | N22: 0 | O22: 0 | P22: 0 | Q22: 0
A23: 10408 | B23: 104 | C23: 3022 | D23: 浣熊 | E23: 1 | F23: 0 | G23: 1 | H23: -1 | I23: 0 | J23: 0 | K23: 5 | L23: 11000 | M23: 5 | N23: 0 | O23: 0 | P23: 0 | Q23: 0
A24: 10409 | B24: 104 | C24: 3023 | D24: 炼血堂弟子 | E24: 1 | F24: 0 | G24: 1 | H24: -1 | I24: 0 | J24: 0 | K24: 5 | L24: 11000 | M24: 5 | N24: 0 | O24: 0 | P24: 0 | Q24: 0
A25: 10410 | B25: 104 | C25: 3031 | D25: 铁钳虾 | E25: 1 | F25: 0 | G25: 1 | H25: -1 | I25: 0 | J25: 0 | K25: 5 | L25: 14000 | M25: 15 | N25: 0 | O25: 0 | P25: 0 | Q25: 0
A26: 10411 | B26: 104 | C26: 3032 | D26: 横行蟹 | E26: 1 | F26: 0 | G26: 1 | H26: -1 | I26: 0 | J26: 0 | K26: 5 | L26: 14000 | M26: 15 | N26: 0 | O26: 0 | P26: 0 | Q26: 0
A27: 10412 | B27: 104 | C27: 3033 | D27: 蚌精 | E27: 1 | F27: 0 | G27: 1 | H27: -1 | I27: 0 | J27: 0 | K27: 5 | L27: 14000 | M27: 15 | N27: 0 | O27: 0 | P27: 0 | Q27: 0
A28: 10413 | B28: 104 | C28: 3041 | D28: 冰女 | E28: 1 | F28: 0 | G28: 1 | H28: -1 | I28: 0 | J28: 0 | K28: 5 | L28: 17000 | M28: 25 | N28: 0 | O28: 0 | P28: 0 | Q28: 0
A29: 10414 | B29: 104 | C29: 3042 | D29: 红云妖僧 | E29: 1 | F29: 0 | G29: 1 | H29: -1 | I29: 0 | J29: 0 | K29: 5 | L29: 17000 | M29: 25 | N29: 0 | O29: 0 | P29: 0 | Q29: 0
A30: 10415 | B30: 104 | C30: 3043 | D30: 凶灵 | E30: 1 | F30: 0 | G30: 1 | H30: -1 | I30: 0 | J30: 0 | K30: 5 | L30: 17000 | M30: 25 | N30: 0 | O30: 0 | P30: 0 | Q30: 0
A31: 10416 | B31: 104 | C31: 3051 | D31: 火麟兽 | E31: 1 | F31: 0 | G31: 1 | H31: -1 | I31: 0 | J31: 0 | K31: 5 | L31: 20000 | M31: 35 | N31: 0 | O31: 0 | P31: 0 | Q31: 0
A32: 10417 | B32: 104 | C32: 3052 | D32: 魅姬 | E32: 1 | F32: 0 | G32: 1 | H32: -1 | I32: 0 | J32: 0 | K32: 5 | L32: 20000 | M32: 35 | N32: 0 | O32: 0 | P32: 0 | Q32: 0
A33: 10418 | B33: 104 | C33: 3053 | D33: 守灵女弟子 | E33: 1 | F33: 0 | G33: 1 | H33: -1 | I33: 0 | J33: 0 | K33: 5 | L33: 20000 | M33: 35 | N33: 0 | O33: 0 | P33: 0 | Q33: 0
A34: 10419 | B34: 104 | C34: 3061 | D34: 吸血妖人 | E34: 1 | F34: 0 | G34: 1 | H34: -1 | I34: 0 | J34: 0 | K34: 5 | L34: 23000 | M34: 45 | N34: 0 | O34: 0 | P34: 0 | Q34: 0
A35: 10420 | B35: 104 | C35: 3062 | D35: 逍遥仙 | E35: 1 | F35: 0 | G35: 1 | H35: -1 | I35: 0 | J35: 0 | K35: 5 | L35: 23000 | M35: 45 | N35: 0 | O35: 0 | P35: 0 | Q35: 0
A36: 10421 | B36: 104 | C36: 3063 | D36: 御魔镜 | E36: 1 | F36: 0 | G36: 1 | H36: -1 | I36: 0 | J36: 0 | K36: 5 | L36: 23000 | M36: 45 | N36: 0 | O36: 0 | P36: 0 | Q36: 0
A37: 10422 | B37: 104 | C37: 3071 | D37: 九天灵鸟 | E37: 1 | F37: 0 | G37: 1 | H37: -1 | I37: 0 | J37: 0 | K37: 5 | L37: 26000 | M37: 55 | N37: 0 | O37: 0 | P37: 0 | Q37: 0
A38: 10423 | B38: 104 | C38: 3072 | D38: 冰灵兽 | E38: 1 | F38: 0 | G38: 1 | H38: -1 | I38: 0 | J38: 0 | K38: 5 | L38: 26000 | M38: 55 | N38: 0 | O38: 0 | P38: 0 | Q38: 0
A39: 10424 | B39: 104 | C39: 3073 | D39: 虎人战士 | E39: 1 | F39: 0 | G39: 1 | H39: -1 | I39: 0 | J39: 0 | K39: 5 | L39: 26000 | M39: 55 | N39: 0 | O39: 0 | P39: 0 | Q39: 0
A40: 10425 | B40: 104 | C40: 3081 | D40: 剑魔 | E40: 1 | F40: 0 | G40: 1 | H40: -1 | I40: 0 | J40: 0 | K40: 5 | L40: 29000 | M40: 65 | N40: 0 | O40: 0 | P40: 0 | Q40: 0
A41: 10426 | B41: 104 | C41: 3082 | D41: 天狼 | E41: 1 | F41: 0 | G41: 1 | H41: -1 | I41: 0 | J41: 0 | K41: 5 | L41: 29000 | M41: 65 | N41: 0 | O41: 0 | P41: 0 | Q41: 0
A42: 10427 | B42: 104 | C42: 3083 | D42: 刺空之矛 | E42: 1 | F42: 0 | G42: 1 | H42: -1 | I42: 0 | J42: 0 | K42: 5 | L42: 29000 | M42: 65 | N42: 0 | O42: 0 | P42: 0 | Q42: 0
A43: 10428 | B43: 104 | C43: 3091 | D43: 虎人王 | E43: 1 | F43: 0 | G43: 1 | H43: -1 | I43: 0 | J43: 0 | K43: 5 | L43: 32000 | M43: 75 | N43: 0 | O43: 0 | P43: 0 | Q43: 0
A44: 10429 | B44: 104 | C44: 3092 | D44: 万蛊 | E44: 1 | F44: 0 | G44: 1 | H44: -1 | I44: 0 | J44: 0 | K44: 5 | L44: 32000 | M44: 75 | N44: 0 | O44: 0 | P44: 0 | Q44: 0
A45: 10430 | B45: 104 | C45: 3093 | D45: 修罗鸟 | E45: 1 | F45: 0 | G45: 1 | H45: -1 | I45: 0 | J45: 0 | K45: 5 | L45: 32000 | M45: 75 | N45: 0 | O45: 0 | P45: 0 | Q45: 0
A46: 10431 | B46: 104 | C46: 3101 | D46: 制裁之剑 | E46: 1 | F46: 0 | G46: 1 | H46: -1 | I46: 0 | J46: 0 | K46: 5 | L46: 35000 | M46: 85 | N46: 0 | O46: 0 | P46: 0 | Q46: 0
A47: 10432 | B47: 104 | C47: 3102 | D47: 九尾 | E47: 1 | F47: 0 | G47: 1 | H47: -1 | I47: 0 | J47: 0 | K47: 5 | L47: 35000 | M47: 85 | N47: 0 | O47: 0 | P47: 0 | Q47: 0
A48: 10433 | B48: 104 | C48: 3103 | D48: 鬼巫 | E48: 1 | F48: 0 | G48: 1 | H48: -1 | I48: 0 | J48: 0 | K48: 5 | L48: 35000 | M48: 85 | N48: 0 | O48: 0 | P48: 0 | Q48: 0
A49: 20101 | B49: 201 | C49: 28007 | D49: 神兵玄铁 | E49: 1 | F49: 0 | G49: 1 | H49: -1 | I49: 0 | J49: 0 | K49: 230 | L49: 5000 | M49: 0 | N49: 0 | O49: 0 | P49: 0 | Q49: 0
A50: 20102 | B50: 201 | C50: 10004 | D50: 角色包袱 | E50: 1 | F50: 0 | G50: 1 | H50: -1 | I50: 0 | J50: 0 | K50: 230 | L50: 6000 | M50: 0 | N50: 0 | O50: 0 | P50: 0 | Q50: 0
A51: 20103 | B51: 201 | C51: 10005 | D51: 宠物包袱 | E51: 1 | F51: 0 | G51: 1 | H51: -1 | I51: 0 | J51: 0 | K51: 230 | L51: 8000 | M51: 0 | N51: 0 | O51: 0 | P51: 0 | Q51: 0
A52: 20104 | B52: 201 | C52: 10011 | D52: 改名许可证 | E52: 1 | F52: 0 | G52: 1 | H52: -1 | I52: 0 | J52: 0 | K52: 230 | L52: 30000 | M52: 0 | N52: 0 | O52: 0 | P52: 0 | Q52: 0
A53: 20105 | B53: 201 | C53: 10012 | D53: 洗点丹 | E53: 1 | F53: 0 | G53: 1 | H53: -1 | I53: 0 | J53: 0 | K53: 230 | L53: 100000 | M53: 0 | N53: 0 | O53: 0 | P53: 0 | Q53: 0
A54: 20106 | B54: 201 | C54: 19014 | D54: 忘忧水 | E54: 1 | F54: 0 | G54: 1 | H54: -1 | I54: 0 | J54: 0 | K54: 230 | L54: 40000 | M54: 0 | N54: 0 | O54: 0 | P54: 0 | Q54: 0
A55: 20107 | B55: 201 | C55: 10100 | D55: 挑战令 | E55: 1 | F55: 0 | G55: 1 | H55: -1 | I55: 0 | J55: 0 | K55: 230 | L55: 5000 | M55: 0 | N55: 0 | O55: 0 | P55: 0 | Q55: 0
A56: 20201 | B56: 202 | C56: 19016 | D56: 洗髓丹 | E56: 1 | F56: 0 | G56: 1 | H56: -1 | I56: 0 | J56: 0 | K56: 230 | L56: 200 | M56: 0 | N56: 0 | O56: 0 | P56: 0 | Q56: 0
A57: 20202 | B57: 202 | C57: 10114 | D57: 赏金令 | E57: 1 | F57: 0 | G57: 1 | H57: -1 | I57: 0 | J57: 0 | K57: 230 | L57: 500 | M57: 0 | N57: 0 | O57: 0 | P57: 0 | Q57: 0
A58: 20203 | B58: 202 | C58: 28000 | D58: 强化石 | E58: 1 | F58: 0 | G58: 1 | H58: -1 | I58: 0 | J58: 0 | K58: 230 | L58: 200 | M58: 0 | N58: 0 | O58: 0 | P58: 0 | Q58: 0
A59: 20204 | B59: 202 | C59: 28002 | D59: 幸运符 | E59: 1 | F59: 1 | G59: 1 | H59: -1 | I59: 0 | J59: 0 | K59: 230 | L59: 6000 | M59: 10 | N59: 0 | O59: 0 | P59: 0 | Q59: 0
A60: 20205 | B60: 202 | C60: 19017 | D60: 技能铭记丹 | E60: 1 | F60: 1 | G60: 1 | H60: -1 | I60: 0 | J60: 0 | K60: 230 | L60: 25000 | M60: 10 | N60: 0 | O60: 0 | P60: 0 | Q60: 0
A61: 20206 | B61: 202 | C61: 19021 | D61: 高级洗髓丹 | E61: 1 | F61: 0 | G61: 1 | H61: -1 | I61: 0 | J61: 0 | K61: 230 | L61: 1500 | M61: 0 | N61: 0 | O61: 0 | P61: 0 | Q61: 0
A62: 20207 | B62: 202 | C62: 19013 | D62: 圣灵果 | E62: 1 | F62: 0 | G62: 1 | H62: -1 | I62: 0 | J62: 0 | K62: 230 | L62: 7900 | M62: 0 | N62: 0 | O62: 0 | P62: 0 | Q62: 0
A63: 20209 | B63: 202 | C63: 19005 | D63: 攻击资质丹 | E63: 1 | F63: 0 | G63: 1 | H63: -1 | I63: 0 | J63: 0 | K63: 230 | L63: 10000 | M63: 0 | N63: 0 | O63: 0 | P63: 0 | Q63: 0
A64: 20210 | B64: 202 | C64: 19006 | D64: 防御资质丹 | E64: 1 | F64: 0 | G64: 1 | H64: -1 | I64: 0 | J64: 0 | K64: 230 | L64: 5000 | M64: 0 | N64: 0 | O64: 0 | P64: 0 | Q64: 0
A65: 20211 | B65: 202 | C65: 19007 | D65: 体力资质丹 | E65: 1 | F65: 0 | G65: 1 | H65: -1 | I65: 0 | J65: 0 | K65: 230 | L65: 5000 | M65: 0 | N65: 0 | O65: 0 | P65: 0 | Q65: 0
A66: 20212 | B66: 202 | C66: 19008 | D66: 法力资质丹 | E66: 1 | F66: 0 | G66: 1 | H66: -1 | I66: 0 | J66: 0 | K66: 230 | L66: 10000 | M66: 0 | N66: 0 | O66: 0 | P66: 0 | Q66: 0
A67: 20213 | B67: 202 | C67: 19009 | D67: 速度资质丹 | E67: 1 | F67: 0 | G67: 1 | H67: -1 | I67: 0 | J67: 0 | K67: 230 | L67: 10000 | M67: 0 | N67: 0 | O67: 0 | P67: 0 | Q67: 0
A68: 30101 | B68: 301 | C68: 10009 | D68: 大修炼丹 | E68: 1 | F68: 0 | G68: 1 | H68: -1 | I68: 0 | J68: 0 | K68: 18 | L68: 30 | M68: 0 | N68: 0 | O68: 0 | P68: 0 | Q68: 0
A69: 30201 | B69: 302 | C69: 10009 | D69: 大修炼丹 | E69: 1 | F69: 0 | G69: 1 | H69: -1 | I69: 0 | J69: 0 | K69: 10 | L69: 15 | M69: 0 | N69: 0 | O69: 0 | P69: 0 | Q69: 0
A70: 40131 | B70: 301 | C70: 30001 | D70: 红枫玉 | E70: 1 | F70: 0 | G70: 1 | H70: -1 | I70: 0 | J70: 0 | K70: 18 | L70: 60 | M70: 0 | N70: 0 | O70: 0 | P70: 0 | Q70: 0
A71: 40132 | B71: 301 | C71: 30002 | D71: 青麟石 | E71: 1 | F71: 0 | G71: 1 | H71: -1 | I71: 0 | J71: 0 | K71: 18 | L71: 40 | M71: 0 | N71: 0 | O71: 0 | P71: 0 | Q71: 0
A72: 40133 | B72: 301 | C72: 30003 | D72: 芙蓉石 | E72: 1 | F72: 0 | G72: 1 | H72: -1 | I72: 0 | J72: 0 | K72: 18 | L72: 40 | M72: 0 | N72: 0 | O72: 0 | P72: 0 | Q72: 0
A73: 40134 | B73: 301 | C73: 30004 | D73: 蓝宝石 | E73: 1 | F73: 0 | G73: 1 | H73: -1 | I73: 0 | J73: 0 | K73: 18 | L73: 40 | M73: 0 | N73: 0 | O73: 0 | P73: 0 | Q73: 0
A74: 40135 | B74: 301 | C74: 30005 | D74: 九幽红钻 | E74: 1 | F74: 0 | G74: 1 | H74: -1 | I74: 0 | J74: 0 | K74: 18 | L74: 40 | M74: 0 | N74: 0 | O74: 0 | P74: 0 | Q74: 0
A75: 40136 | B75: 301 | C75: 30006 | D75: 幽冥石 | E75: 1 | F75: 0 | G75: 1 | H75: -1 | I75: 0 | J75: 0 | K75: 18 | L75: 40 | M75: 0 | N75: 0 | O75: 0 | P75: 0 | Q75: 0
A76: 40137 | B76: 301 | C76: 30007 | D76: 朦胧石 | E76: 1 | F76: 0 | G76: 1 | H76: -1 | I76: 0 | J76: 0 | K76: 18 | L76: 40 | M76: 0 | N76: 0 | O76: 0 | P76: 0 | Q76: 0
A77: 40138 | B77: 301 | C77: 30008 | D77: 星愿石 | E77: 1 | F77: 0 | G77: 1 | H77: -1 | I77: 0 | J77: 0 | K77: 18 | L77: 40 | M77: 0 | N77: 0 | O77: 0 | P77: 0 | Q77: 0
A78: 40139 | B78: 301 | C78: 30009 | D78: 琉璃石 | E78: 1 | F78: 0 | G78: 1 | H78: -1 | I78: 0 | J78: 0 | K78: 18 | L78: 40 | M78: 0 | N78: 0 | O78: 0 | P78: 0 | Q78: 0
A79: 40140 | B79: 301 | C79: 31000 | D79: 鬼谷残卷 | E79: 1 | F79: 0 | G79: 1 | H79: -1 | I79: 0 | J79: 0 | K79: 18 | L79: 24 | M79: 0 | N79: 0 | O79: 0 | P79: 0 | Q79: 0
A80: 40141 | B80: 301 | C80: 31001 | D80: 天覆阵 | E80: 1 | F80: 0 | G80: 1 | H80: -1 | I80: 0 | J80: 0 | K80: 18 | L80: 250 | M80: 0 | N80: 0 | O80: 0 | P80: 0 | Q80: 0
A81: 40142 | B81: 301 | C81: 31002 | D81: 地载阵 | E81: 1 | F81: 0 | G81: 1 | H81: -1 | I81: 0 | J81: 0 | K81: 18 | L81: 120 | M81: 0 | N81: 0 | O81: 0 | P81: 0 | Q81: 0
A82: 40143 | B82: 301 | C82: 31003 | D82: 风扬阵 | E82: 1 | F82: 0 | G82: 1 | H82: -1 | I82: 0 | J82: 0 | K82: 18 | L82: 120 | M82: 0 | N82: 0 | O82: 0 | P82: 0 | Q82: 0
A83: 40144 | B83: 301 | C83: 31004 | D83: 云垂阵 | E83: 1 | F83: 0 | G83: 1 | H83: -1 | I83: 0 | J83: 0 | K83: 18 | L83: 120 | M83: 0 | N83: 0 | O83: 0 | P83: 0 | Q83: 0
A84: 40145 | B84: 301 | C84: 31005 | D84: 龙飞阵 | E84: 1 | F84: 0 | G84: 1 | H84: -1 | I84: 0 | J84: 0 | K84: 18 | L84: 120 | M84: 0 | N84: 0 | O84: 0 | P84: 0 | Q84: 0
A85: 40146 | B85: 301 | C85: 31006 | D85: 虎翼阵 | E85: 1 | F85: 0 | G85: 1 | H85: -1 | I85: 0 | J85: 0 | K85: 18 | L85: 120 | M85: 0 | N85: 0 | O85: 0 | P85: 0 | Q85: 0
A86: 40147 | B86: 301 | C86: 31007 | D86: 鸟翔阵 | E86: 1 | F86: 0 | G86: 1 | H86: -1 | I86: 0 | J86: 0 | K86: 18 | L86: 120 | M86: 0 | N86: 0 | O86: 0 | P86: 0 | Q86: 0
A87: 40148 | B87: 301 | C87: 31008 | D87: 蛇蟠阵 | E87: 1 | F87: 0 | G87: 1 | H87: -1 | I87: 0 | J87: 0 | K87: 18 | L87: 120 | M87: 0 | N87: 0 | O87: 0 | P87: 0 | Q87: 0
A88: 40149 | B88: 301 | C88: 21070 | D88: 10☆千年人参 | E88: 1 | F88: 0 | G88: 1 | H88: -1 | I88: 0 | J88: 0 | K88: 18 | L88: 10 | M88: 0 | N88: 0 | O88: 0 | P88: 0 | Q88: 0
A89: 30202 | B89: 302 | C89: 18000 | D89: 夜明珠 | E89: 1 | F89: 0 | G89: 1 | H89: -1 | I89: 0 | J89: 0 | K89: 10 | L89: 60 | M89: 0 | N89: 0 | O89: 0 | P89: 0 | Q89: 0
A90: 30203 | B90: 302 | C90: 18001 | D90: 碧水珠 | E90: 1 | F90: 0 | G90: 1 | H90: -1 | I90: 0 | J90: 0 | K90: 10 | L90: 60 | M90: 0 | N90: 0 | O90: 0 | P90: 0 | Q90: 0
A91: 30204 | B91: 302 | C91: 18002 | D91: 象牙 | E91: 1 | F91: 0 | G91: 1 | H91: -1 | I91: 0 | J91: 0 | K91: 10 | L91: 60 | M91: 0 | N91: 0 | O91: 0 | P91: 0 | Q91: 0
A92: 30205 | B92: 302 | C92: 18003 | D92: 五色石 | E92: 1 | F92: 0 | G92: 1 | H92: -1 | I92: 0 | J92: 0 | K92: 10 | L92: 60 | M92: 0 | N92: 0 | O92: 0 | P92: 0 | Q92: 0
A93: 30206 | B93: 302 | C93: 18004 | D93: 唤麟珠 | E93: 1 | F93: 0 | G93: 1 | H93: -1 | I93: 0 | J93: 0 | K93: 10 | L93: 60 | M93: 0 | N93: 0 | O93: 0 | P93: 0 | Q93: 0
A94: 30207 | B94: 302 | C94: 11016 | D94: 300000银币 | E94: 1 | F94: 0 | G94: 1 | H94: -1 | I94: 0 | J94: 0 | K94: 10 | L94: 30 | M94: 0 | N94: 0 | O94: 0 | P94: 0 | Q94: 0
A95: 30301 | B95: 303 | C95: 19016 | D95: 洗髓丹 | E95: 1 | F95: 0 | G95: 1 | H95: -1 | I95: 0 | J95: 0 | K95: 26 | L95: 4 | M95: 0 | N95: 0 | O95: 0 | P95: 0 | Q95: 0
A96: 30302 | B96: 303 | C96: 10114 | D96: 赏金令 | E96: 1 | F96: 0 | G96: 1 | H96: -1 | I96: 0 | J96: 0 | K96: 26 | L96: 10 | M96: 0 | N96: 0 | O96: 0 | P96: 0 | Q96: 0
A97: 30303 | B97: 303 | C97: 28000 | D97: 强化石 | E97: 1 | F97: 0 | G97: 1 | H97: -1 | I97: 0 | J97: 0 | K97: 26 | L97: 4 | M97: 0 | N97: 0 | O97: 0 | P97: 0 | Q97: 0
A98: 30304 | B98: 303 | C98: 28002 | D98: 幸运符 | E98: 1 | F98: 0 | G98: 1 | H98: -1 | I98: 0 | J98: 0 | K98: 26 | L98: 120 | M98: 0 | N98: 0 | O98: 0 | P98: 0 | Q98: 0
A99: 30401 | B99: 304 | C99: 10024 | D99: 四品灵气瓶 | E99: 1 | F99: 0 | G99: 1 | H99: -1 | I99: 0 | J99: 0 | K99: 28 | L99: 15000 | M99: 0 | N99: 0 | O99: 0 | P99: 0 | Q99: 0
A100: 30402 | B100: 304 | C100: 10025 | D100: 三品灵气瓶 | E100: 1 | F100: 0 | G100: 1 | H100: -1 | I100: 0 | J100: 0 | K100: 28 | L100: 25000 | M100: 0 | N100: 0 | O100: 0 | P100: 0 | Q100: 0
A101: 30403 | B101: 304 | C101: 10026 | D101: 二品灵气瓶 | E101: 1 | F101: 0 | G101: 1 | H101: -1 | I101: 0 | J101: 0 | K101: 28 | L101: 50000 | M101: 0 | N101: 0 | O101: 0 | P101: 0 | Q101: 0
A102: 30404 | B102: 304 | C102: 10027 | D102: 一品灵气瓶 | E102: 1 | F102: 0 | G102: 1 | H102: -1 | I102: 0 | J102: 0 | K102: 28 | L102: 100000 | M102: 0 | N102: 0 | O102: 0 | P102: 0 | Q102: 0
A103: 30501 | B103: 305 | C103: 10009 | D103: 大修炼丹 | E103: 1 | F103: 0 | G103: 1 | H103: -1 | I103: 0 | J103: 0 | K103: 29 | L103: 156 | M103: 0 | N103: 0 | O103: 0 | P103: 0 | Q103: 0
A104: 30503 | B104: 305 | C104: 19016 | D104: 洗髓丹 | E104: 1 | F104: 0 | G104: 1 | H104: -1 | I104: 0 | J104: 0 | K104: 29 | L104: 40 | M104: 0 | N104: 0 | O104: 0 | P104: 0 | Q104: 0
A105: 30504 | B105: 305 | C105: 28000 | D105: 强化石 | E105: 1 | F105: 0 | G105: 1 | H105: -1 | I105: 0 | J105: 0 | K105: 29 | L105: 40 | M105: 0 | N105: 0 | O105: 0 | P105: 0 | Q105: 0
A106: 30505 | B106: 305 | C106: 18005 | D106: 藏宝图 | E106: 1 | F106: 0 | G106: 1 | H106: -1 | I106: 0 | J106: 0 | K106: 29 | L106: 200 | M106: 0 | N106: 0 | O106: 0 | P106: 0 | Q106: 0
A107: 30506 | B107: 305 | C107: 2000101 | D107: 一级头盔 | E107: 1 | F107: 0 | G107: 1 | H107: -1 | I107: 0 | J107: 0 | K107: 29 | L107: 800 | M107: 0 | N107: 0 | O107: 0 | P107: 0 | Q107: 0
A108: 30507 | B108: 305 | C108: 2000201 | D108: 一级项圈 | E108: 1 | F108: 0 | G108: 1 | H108: -1 | I108: 0 | J108: 0 | K108: 29 | L108: 800 | M108: 0 | N108: 0 | O108: 0 | P108: 0 | Q108: 0
A109: 30508 | B109: 305 | C109: 2000102 | D109: 二级头盔 | E109: 1 | F109: 0 | G109: 1 | H109: -1 | I109: 0 | J109: 0 | K109: 29 | L109: 2400 | M109: 0 | N109: 0 | O109: 0 | P109: 0 | Q109: 0
A110: 30509 | B110: 305 | C110: 2000202 | D110: 二级项圈 | E110: 1 | F110: 0 | G110: 1 | H110: -1 | I110: 0 | J110: 0 | K110: 29 | L110: 2400 | M110: 0 | N110: 0 | O110: 0 | P110: 0 | Q110: 0
A111: 30510 | B111: 305 | C111: 18000 | D111: 夜明珠 | E111: 1 | F111: 0 | G111: 1 | H111: -1 | I111: 0 | J111: 0 | K111: 29 | L111: 600 | M111: 0 | N111: 0 | O111: 0 | P111: 0 | Q111: 0
A112: 30511 | B112: 305 | C112: 18001 | D112: 碧水珠 | E112: 1 | F112: 0 | G112: 1 | H112: -1 | I112: 0 | J112: 0 | K112: 29 | L112: 600 | M112: 0 | N112: 0 | O112: 0 | P112: 0 | Q112: 0
A113: 30512 | B113: 305 | C113: 18002 | D113: 象牙 | E113: 1 | F113: 0 | G113: 1 | H113: -1 | I113: 0 | J113: 0 | K113: 29 | L113: 600 | M113: 0 | N113: 0 | O113: 0 | P113: 0 | Q113: 0
A114: 30513 | B114: 305 | C114: 18003 | D114: 五彩石 | E114: 1 | F114: 0 | G114: 1 | H114: -1 | I114: 0 | J114: 0 | K114: 29 | L114: 600 | M114: 0 | N114: 0 | O114: 0 | P114: 0 | Q114: 0
A115: 30514 | B115: 305 | C115: 18004 | D115: 唤麟珠 | E115: 1 | F115: 0 | G115: 1 | H115: -1 | I115: 0 | J115: 0 | K115: 29 | L115: 600 | M115: 0 | N115: 0 | O115: 0 | P115: 0 | Q115: 0
A116: 30209 | B116: 302 | C116: 2000101 | D116: 一级头盔 | E116: 1 | F116: 0 | G116: 1 | H116: -1 | I116: 0 | J116: 0 | K116: 10 | L116: 80 | M116: 0 | N116: 0 | O116: 0 | P116: 0 | Q116: 0
A117: 30210 | B117: 302 | C117: 2000201 | D117: 一级项圈 | E117: 1 | F117: 0 | G117: 1 | H117: -1 | I117: 0 | J117: 0 | K117: 10 | L117: 80 | M117: 0 | N117: 0 | O117: 0 | P117: 0 | Q117: 0
A118: 30211 | B118: 302 | C118: 2000102 | D118: 二级头盔 | E118: 1 | F118: 0 | G118: 1 | H118: -1 | I118: 0 | J118: 0 | K118: 10 | L118: 240 | M118: 0 | N118: 0 | O118: 0 | P118: 0 | Q118: 0
A119: 30212 | B119: 302 | C119: 2000202 | D119: 二级项圈 | E119: 1 | F119: 0 | G119: 1 | H119: -1 | I119: 0 | J119: 0 | K119: 10 | L119: 240 | M119: 0 | N119: 0 | O119: 0 | P119: 0 | Q119: 0
A120: 30214 | B120: 302 | C120: 19016 | D120: 洗髓丹 | E120: 1 | F120: 0 | G120: 1 | H120: -1 | I120: 0 | J120: 0 | K120: 10 | L120: 4 | M120: 0 | N120: 0 | O120: 0 | P120: 0 | Q120: 0
A121: 30215 | B121: 302 | C121: 28000 | D121: 强化石 | E121: 1 | F121: 0 | G121: 1 | H121: -1 | I121: 0 | J121: 0 | K121: 10 | L121: 4 | M121: 0 | N121: 0 | O121: 0 | P121: 0 | Q121: 0
A122: 30216 | B122: 302 | C122: 18005 | D122: 藏宝图 | E122: 1 | F122: 0 | G122: 1 | H122: -1 | I122: 0 | J122: 0 | K122: 10 | L122: 20 | M122: 0 | N122: 0 | O122: 0 | P122: 0 | Q122: 0
A123: 30217 | B123: 302 | C123: 34008 | D123: 归元弓碎片 | E123: 1 | F123: 0 | G123: 1 | H123: -1 | I123: 0 | J123: 0 | K123: 10 | L123: 100 | M123: 0 | N123: 0 | O123: 0 | P123: 0 | Q123: 0
A124: 30218 | B124: 301 | C124: 34009 | D124: 修罗面具碎片 | E124: 1 | F124: 0 | G124: 1 | H124: -1 | I124: 0 | J124: 0 | K124: 18 | L124: 200 | M124: 0 | N124: 0 | O124: 0 | P124: 0 | Q124: 0
A125: 30219 | B125: 305 | C125: 34013 | D125: 弑神戟碎片 | E125: 1 | F125: 0 | G125: 1 | H125: -1 | I125: 0 | J125: 0 | K125: 29 | L125: 1000 | M125: 0 | N125: 0 | O125: 0 | P125: 0 | Q125: 0
A126: 20224 | B126: 202 | C126: 10111 | D126: 高级器魂 | E126: 1 | F126: 0 | G126: 1 | H126: -1 | I126: 0 | J126: 0 | K126: 230 | L126: 7500 | M126: 0 | N126: 0 | O126: 0 | P126: 0 | Q126: 0
A127: 30224 | B127: 302 | C127: 35003 | D127: 古典墨竹墙纸 | E127: 0 | F127: 4 | G127: 1 | H127: 1 | I127: 0 | J127: 0 | K127: 10 | L127: 1000 | M127: 0 | N127: 0 | O127: 0 | P127: 0 | Q127: 0
A128: 20108 | B128: 201 | C128: 10050 | D128: 钻石戒指 | E128: 1 | F128: 0 | G128: 1 | H128: -1 | I128: 0 | J128: 0 | K128: 230 | L128: 45000 | M128: 0 | N128: 0 | O128: 0 | P128: 0 | Q128: 0
A129: 20109 | B129: 201 | C129: 19012 | D129: 圣兽之灵 | E129: 1 | F129: 0 | G129: 1 | H129: -1 | I129: 0 | J129: 0 | K129: 2 | L129: 15000 | M129: 0 | N129: 0 | O129: 0 | P129: 0 | Q129: 0
A130: 20111 | B130: 201 | C130: 10014 | D130: 天官宝钥 | E130: 1 | F130: 0 | G130: 1 | H130: -1 | I130: 0 | J130: 0 | K130: 230 | L130: 5000 | M130: 0 | N130: 0 | O130: 0 | P130: 0 | Q130: 0
A131: 30001 | B131: 204 | C131: 13801 | D131: 极品宠物大礼包 | E131: 1 | F131: 2 | G131: 1 | H131: 2 | I131: 0 | J131: 0 | K131: 2 | L131: 324000 | M131: 10 | N131: 0 | O131: 0 | P131: 5 | Q131: 0
A132: 30002 | B132: 204 | C132: 13802 | D132: 豪华装备大礼包 | E132: 1 | F132: 2 | G132: 1 | H132: 5 | I132: 0 | J132: 0 | K132: 2 | L132: 164000 | M132: 10 | N132: 0 | O132: 0 | P132: 5 | Q132: 0
A133: 30003 | B133: 204 | C133: 13803 | D133: 惊喜大礼包 | E133: 1 | F133: 2 | G133: 1 | H133: 5 | I133: 0 | J133: 0 | K133: 2 | L133: 99000 | M133: 10 | N133: 0 | O133: 0 | P133: 5 | Q133: 0
A134: 30004 | B134: 204 | C134: 13804 | D134: 灵珠礼包 | E134: 1 | F134: 2 | G134: 1 | H134: 5 | I134: 0 | J134: 0 | K134: 2 | L134: 99000 | M134: 10 | N134: 0 | O134: 0 | P134: 5 | Q134: 0
A135: 30011 | B135: 203 | C135: 13805 | D135: 超级仙缘礼包 | E135: 1 | F135: 1 | G135: 1 | H135: 2 | I135: 0 | J135: 0 | K135: 230 | L135: 164000 | M135: 10 | N135: 0 | O135: 0 | P135: 7 | Q135: 0
A136: 30012 | B136: 203 | C136: 13806 | D136: 进阶丹大礼包 | E136: 1 | F136: 1 | G136: 1 | H136: 5 | I136: 0 | J136: 0 | K136: 230 | L136: 49000 | M136: 10 | N136: 0 | O136: 0 | P136: 7 | Q136: 0
A137: 30013 | B137: 203 | C137: 13807 | D137: 宠物养成礼包 | E137: 1 | F137: 1 | G137: 1 | H137: 5 | I137: 0 | J137: 0 | K137: 230 | L137: 99000 | M137: 10 | N137: 0 | O137: 0 | P137: 7 | Q137: 0
A138: 30014 | B138: 203 | C138: 13808 | D138: 仙侣养成礼包 | E138: 1 | F138: 1 | G138: 1 | H138: 5 | I138: 0 | J138: 0 | K138: 230 | L138: 99000 | M138: 10 | N138: 0 | O138: 0 | P138: 7 | Q138: 0
A139: 30015 | B139: 203 | C139: 13809 | D139: 大捆经验书 | E139: 1 | F139: 1 | G139: 1 | H139: 5 | I139: 0 | J139: 0 | K139: 230 | L139: 500 | M139: 10 | N139: 0 | O139: 0 | P139: 7 | Q139: 0
A140: 30016 | B140: 203 | C140: 13810 | D140: 大包洗髓丹 | E140: 1 | F140: 1 | G140: 1 | H140: 5 | I140: 0 | J140: 0 | K140: 230 | L140: 500 | M140: 10 | N140: 0 | O140: 0 | P140: 7 | Q140: 0
A141: 40116 | B141: 401 | C141: 50000 | D141: 护教伽蓝之魄 | E141: 1 | F141: 0 | G141: 1 | H141: 1 | I141: 4 | J141: 2000 | K141: 230 | L141: 375 | M141: 0 | N141: 2019-06-15T00:00:00.000 | O141: 2019-10-31T00:00:00.000 | P141: 8 | Q141: =INT(RC[-5]*RC[-1]/10) -> 300
A142: 40117 | B142: 401 | C142: 50001 | D142: 嫦娥之魄 | E142: 1 | F142: 0 | G142: 1 | H142: 1 | I142: 4 | J142: 2000 | K142: 230 | L142: 75 | M142: 0 | N142: 2019-06-15T00:00:00.000 | O142: 2019-10-31T00:00:00.000 | P142: 8 | Q142: =INT(RC[-5]*RC[-1]/10) -> 60
A143: 40118 | B143: 401 | C143: 50002 | D143: 张天师之魄 | E143: 1 | F143: 0 | G143: 1 | H143: 1 | I143: 4 | J143: 2000 | K143: 230 | L143: 375 | M143: 0 | N143: 2019-06-15T00:00:00.000 | O143: 2019-10-31T00:00:00.000 | P143: 8 | Q143: =INT(RC[-5]*RC[-1]/10) -> 300
A144: 40119 | B144: 401 | C144: 50003 | D144: 九天玄女之魄 | E144: 1 | F144: 0 | G144: 1 | H144: 1 | I144: 4 | J144: 2000 | K144: 230 | L144: 6250 | M144: 0 | N144: 2019-06-15T00:00:00.000 | O144: 2019-10-31T00:00:00.000 | P144: 8 | Q144: =INT(RC[-5]*RC[-1]/10) -> 5000
A145: 40120 | B145: 401 | C145: 50004 | D145: 三太子之魄 | E145: 1 | F145: 0 | G145: 1 | H145: 1 | I145: 4 | J145: 2000 | K145: 230 | L145: 1562 | M145: 0 | N145: 2019-06-15T00:00:00.000 | O145: 2019-10-31T00:00:00.000 | P145: 8 | Q145: =INT(RC[-5]*RC[-1]/10) -> 1249
A146: 40126 | B146: 401 | C146: 50005 | D146: 镇元大仙之魄 | E146: 1 | F146: 0 | G146: 1 | H146: 1 | I146: 6 | J146: 2000 | K146: 230 | L146: 1562 | M146: 0 | N146: 2019-06-15T00:00:00.000 | O146: 2019-10-31T00:00:00.000 | P146: 8 | Q146: =INT(RC[-5]*RC[-1]/10) -> 1249
A147: 40127 | B147: 401 | C147: 50006 | D147: 白牡丹之魄 | E147: 1 | F147: 0 | G147: 1 | H147: 1 | I147: 6 | J147: 2000 | K147: 230 | L147: 1562 | M147: 0 | N147: 2019-06-15T00:00:00.000 | O147: 2019-10-31T00:00:00.000 | P147: 8 | Q147: =INT(RC[-5]*RC[-1]/10) -> 1249
A148: 40128 | B148: 401 | C148: 50007 | D148: 东华帝君之魄 | E148: 1 | F148: 0 | G148: 1 | H148: 1 | I148: 6 | J148: 2000 | K148: 230 | L148: 1562 | M148: 0 | N148: 2019-06-15T00:00:00.000 | O148: 2019-10-31T00:00:00.000 | P148: 8 | Q148: =INT(RC[-5]*RC[-1]/10) -> 1249
A149: 40129 | B149: 401 | C149: 50009 | D149: 武曲星君之魄 | E149: 1 | F149: 0 | G149: 1 | H149: 1 | I149: 6 | J149: 2000 | K149: 230 | L149: 6250 | M149: 0 | N149: 2019-06-15T00:00:00.000 | O149: 2019-10-31T00:00:00.000 | P149: 8 | Q149: =INT(RC[-5]*RC[-1]/10) -> 5000
A150: 40130 | B150: 401 | C150: 50010 | D150: 太上老君之魄 | E150: 1 | F150: 0 | G150: 1 | H150: 1 | I150: 6 | J150: 2000 | K150: 230 | L150: 6250 | M150: 0 | N150: 2019-06-15T00:00:00.000 | O150: 2019-10-31T00:00:00.000 | P150: 8 | Q150: =INT(RC[-5]*RC[-1]/10) -> 5000
A151: 40156 | B151: 401 | C151: 50014 | D151: 赤脚大仙之魄 | E151: 1 | F151: 0 | G151: 1 | H151: 1 | I151: 6 | J151: 2000 | K151: 230 | L151: 6250 | M151: 0 | N151: 2019-06-15T00:00:00.000 | O151: 2019-10-31T00:00:00.000 | P151: 8 | Q151: =INT(RC[-5]*RC[-1]/10) -> 5000
A152: 20230 | B152: 202 | C152: 10208 | D152: 仙侣觉醒丹 | E152: 1 | F152: 0 | G152: 1 | H152: -1 | I152: 0 | J152: 0 | K152: 230 | L152: 625 | M152: 0 | N152: 0 | O152: 0 | P152: 0 | Q152: 0
A153: 20231 | B153: 202 | C153: 10209 | D153: 宠物觉醒丹 | E153: 1 | F153: 0 | G153: 1 | H153: -1 | I153: 0 | J153: 0 | K153: 230 | L153: 1250 | M153: 0 | N153: 0 | O153: 0 | P153: 0 | Q153: 0

Sheet: Sheet2
A13: 20301 | B13: 203 | C13: 28002 | D13: 幸运符 | E13: 1 | F13: 1 | G13: 1 | H13: 2 | I13: 0 | J13: 0 | K13: 2 | L13: 5000 | M13: 10 | N13: 0 | O13: 0 | P13: 7 | Q13: =RC[-5]*0.7 -> 3500
A14: 40150 | B14: 203 | C14: 34008 | D14: 归元弓碎片 | E14: 1 | F14: 1 | G14: 1 | H14: 2 | I14: 0 | J14: 0 | K14: 2 | L14: 5000 | M14: 10 | N14: 0 | O14: 0 | P14: 7 | Q14: =RC[-5]*0.7 -> 3500
A16: 40152 | B16: 204 | C16: 19016 | D16: 洗髓丹 | E16: 1 | F16: 2 | G16: 1 | H16: 100 | I16: 0 | J16: 0 | K16: 2 | L16: 100 | M16: 10 | N16: 0 | O16: 0 | P16: 5 | Q16: =RC[-5]/2 -> 50
A17: 40153 | B17: 204 | C17: 28000 | D17: 强化石 | E17: 1 | F17: 2 | G17: 1 | H17: 100 | I17: 0 | J17: 0 | K17: 2 | L17: 100 | M17: 10 | N17: 0 | O17: 0 | P17: 5 | Q17: =RC[-5]/2 -> 50
A18: 40155 | B18: 204 | C18: 19013 | D18: 圣灵果 | E18: 1 | F18: 2 | G18: 1 | H18: 1 | I18: 0 | J18: 0 | K18: 2 | L18: 4000 | M18: 10 | N18: 0 | O18: 0 | P18: 5 | Q18: =RC[-5]/2 -> 2000
A19: 20303 | B19: 203 | C19: 10208 | D19: 仙侣觉醒丹 | E19: 1 | F19: 1 | G19: 1 | H19: 70 | I19: 0 | J19: 0 | K19: 230 | L19: 625 | M19: 10 | N19: 0 | O19: 0 | P19: 0 | Q19: 0
A20: 20304 | B20: 203 | C20: 10209 | D20: 宠物觉醒丹 | E20: 1 | F20: 1 | G20: 1 | H20: 70 | I20: 0 | J20: 0 | K20: 230 | L20: 1250 | M20: 10 | N20: 0 | O20: 0 | P20: 0 | Q20: 0
D31: =RC[1]&"之魄" -> 护教伽蓝之魄 | E31: 护教伽蓝 | F31: 3 | G31: 3 | H31: 0 | I31: 2 | J31: 2 | K31: SR | L31: 0 | M31: 0 | N31: partner_1005 | O31: 0 | P31: 50000 | R31: =VLOOKUP(RC[-7],R47C11:R50C13,3,FALSE) -> 375 | T31: 15 | V31: =ROUNDUP(RC[-4]*RC[-2]/10,0) -> 563
D32: =RC[1]&"之魄" -> 嫦娥之魄 | E32: 嫦娥 | F32: 4 | G32: 1 | H32: 0 | I32: 2 | J32: 1 | K32: R | L32: 0 | M32: 0 | N32: partner_1006 | O32: 0 | P32: 50001 | R32: =VLOOKUP(RC[-7],R47C11:R50C13,3,FALSE) -> 75 | T32: 15 | V32: =ROUNDUP(RC[-4]*RC[-2]/10,0) -> 113
D33: =RC[1]&"之魄" -> 张天师之魄 | E33: 张天师 | F33: 2 | G33: 2 | H33: 0 | I33: 2 | J33: 2 | K33: SR | L33: 0 | M33: 0 | N33: partner_1003 | O33: 0 | P33: 50002 | R33: =VLOOKUP(RC[-7],R47C11:R50C13,3,FALSE) -> 375 | T33: 15 | V33: =ROUNDUP(RC[-4]*RC[-2]/10,0) -> 563
D34: =RC[1]&"之魄" -> 九天玄女之魄 | E34: 九天玄女 | F34: 1 | G34: 1 | H34: 0 | I34: 2 | J34: 4 | K34: SSSR | L34: 0 | M34: 0 | N34: partner_1012 | O34: 0 | P34: 50003 | R34: =VLOOKUP(RC[-7],R47C11:R50C13,3,FALSE) -> 6250 | T34: 15 | V34: =ROUNDUP(RC[-4]*RC[-2]/10,0) -> 9375
D35: =RC[1]&"之魄" -> 三太子之魄 | E35: 三太子 | F35: 2 | G35: 2 | H35: 0 | I35: 2 | J35: 3 | K35: SSR | L35: 0 | M35: 0 | N35: partner_1004 | O35: 0 | P35: 50004 | R35: =VLOOKUP(RC[-7],R47C11:R50C13,3,FALSE) -> 1563 | T35: 15 | V35: =ROUNDUP(RC[-4]*RC[-2]/10,0) -> 2345
D36: =RC[1]&"之魄" -> 镇元大仙之魄 | E36: 镇元大仙 | F36: 5 | G36: 4 | H36: 0 | I36: 2 | J36: 3 | K36: SSR | L36: 0 | M36: 0 | N36: partner_1009 | O36: 0 | P36: 50005 | R36: =VLOOKUP(RC[-7],R47C11:R50C13,3,FALSE) -> 1563 | T36: 15 | V36: =ROUNDUP(RC[-4]*RC[-2]/10,0) -> 2345
D37: =RC[1]&"之魄" -> 白牡丹之魄 | E37: 白牡丹 | F37: 2 | G37: 2 | H37: 0 | I37: 2 | J37: 3 | K37: SSR | L37: 0 | M37: 0 | N37: partner_1011 | O37: 0 | P37: 50006 | R37: =VLOOKUP(RC[-7],R47C11:R50C13,3,FALSE) -> 1563 | T37: 15 | V37: =ROUNDUP(RC[-4]*RC[-2]/10,0) -> 2345
D38: =RC[1]&"之魄" -> 东华帝君之魄 | E38: 东华帝君 | F38: 4 | G38: 1 | H38: 0 | I38: 2 | J38: 3 | K38: SSR | L38: 0 | M38: 0 | N38: partner_1010 | O38: 0 | P38: 50007 | R38: =VLOOKUP(RC[-7],R47C11:R50C13,3,FALSE) -> 1563 | T38: 15 | V38: =ROUNDUP(RC[-4]*RC[-2]/10,0) -> 2345
D39: =RC[1]&"之魄" -> 武曲星君之魄 | E39: 武曲星君 | F39: 4 | G39: 1 | H39: 0 | I39: 2 | J39: 4 | K39: SSSR | L39: 0 | M39: 0 | N39: partner_1002 | O39: 0 | P39: 50009 | R39: =VLOOKUP(RC[-7],R47C11:R50C13,3,FALSE) -> 6250 | T39: 15 | V39: =ROUNDUP(RC[-4]*RC[-2]/10,0) -> 9375
D40: =RC[1]&"之魄" -> 太上老君之魄 | E40: 太上老君 | F40: 3 | G40: 3 | H40: 0 | I40: 2 | J40: 4 | K40: SSSR | L40: 0 | M40: 0 | N40: partner_1001 | O40: 0 | P40: 50010 | R40: =VLOOKUP(RC[-7],R47C11:R50C13,3,FALSE) -> 6250 | T40: 15 | V40: =ROUNDUP(RC[-4]*RC[-2]/10,0) -> 9375
D41: =RC[1]&"之魄" -> 赤脚大仙之魄 | E41: 赤脚大仙 | F41: 4 | G41: 1 | H41: 0 | I41: 2 | J41: 4 | K41: SSSR | L41: 0 | M41: 0 | N41: partner_1016 | O41: 0 | P41: 50014 | R41: =VLOOKUP(RC[-7],R47C11:R50C13,3,FALSE) -> 6250 | T41: 15 | V41: =ROUNDUP(RC[-4]*RC[-2]/10,0) -> 9375
K47: R | L47: 0.15 | M47: =ROUNDUP(RC[-1]*500,0) -> 75
K48: SR | L48: 0.75 | M48: =ROUNDUP(RC[-1]*500,0) -> 375
K49: SSR | L49: 3.125 | M49: =ROUNDUP(RC[-1]*500,0) -> 1563
K50: SSSR | L50: 12.5 | M50: =ROUNDUP(RC[-1]*500,0) -> 6250