Sheet: ctTianDiBaoWuConf
D1: 物品:1,物品ID,数量，权重; | E1: 奖励ID，奖励池对应的展示物品ID; 奖励ID有可能时装ID，有可能奖励池ID 例： 时装ID,展示物ID; 奖励池ID,展示物品ID; | L1: 奖励池:2,奖池ID,抽取次数,权重 | M1: 场景ID，x坐标，y坐标;
A2: nSeq | B2: nNumTotal | C2: nInterval | D2: tShiZhuangIDList | E2: tViewItemList | F2: nItemID | G2: nOnceNum | H2: nTemNum | I2: nCostOnce | J2: nCostTen | K2: nGetFuYuan | L2: tAwardPoolID | M2: tPosList
A3: i | B3: i | C3: i | D3: t{iiii} | E3: t{iiiiiiiiiiii} | F3: i | G3: i | H3: i | I3: i | J3: i | K3: i | L3: t{iiii} | M3: t{iii}
A4: 序号 | B4: 总的宝箱数量 | C4: 刷新时间间隔（分钟） | D4: 本周特有时装ID列表 | E4: 展示物品ID列表 | F4: 开启消耗物品ID | G4: 开启一次消耗物品数量 | H4: 开启十次消耗物品数量 | I4: 开启一次消耗元宝 | J4: 开启十次消耗元宝 | K4: 开启获得的福缘值 | L4: 奖品池列表 | M4: 坐标列表
A5: 1 | B5: 2 | C5: 30 | D5: 1,13054,1,100;1,13154,1,100;1,13254,1,100; | E5: 13004,13104,13204,13318,13319,13320,13321,13322,13323,13324,13327,13330; | F5: 10014 | G5: 1 | H5: 9 | I5: 1888 | J5: 15000 | K5: 3 | L5: 2,2101,1,750;2,2102,1,100;2,2103,1,100;2,2104,1,100;2,2105,1,100;2,2106,1,100;2,2107,1,100;2,2108,1,100;2,2109,1,450; | M5: 1,400,990;1,1170,670;
A6: 2 | B6: 2 | C6: 30 | D6: 1,13055,1,100;1,13155,1,100;1,13255,1,100; | E6: 13005,13105,13205,13318,13319,13320,13321,13322,13323,13324,13328,13330; | F6: 10014 | G6: 1 | H6: 9 | I6: 1888 | J6: 15000 | K6: 3 | L6: 2,2101,1,750;2,2102,1,100;2,2103,1,100;2,2104,1,100;2,2105,1,100;2,2106,1,100;2,2107,1,100;2,2108,1,100;2,2109,1,450; | M6: 1,400,990;1,1170,670;

Sheet: Sheet5
A1: 梦诛 | B1: 宝箱奖励 | C1: 类型 | D1: 奖励内容
A2: 1 | B2: 法宝道具 | C2: 法宝道具 | D2: 随机获得2星獠牙或浮屠金钵、法防、物攻或法攻灵器，概率获得有特效的灵器
A3: 2 | B3: 法印、飞行器 | C3: 法印飞行器 | D3: 随机获得胡萝卜法印或东华法印或飞天酷喵飞行器
A4: 3 | B4: 神兽怒目金刚 | C4: 神兽 | D4: 获得怒目金刚或者怒目金刚碎片
A5: 4 | B5: 神兵武饰 | C5: 装备武饰 | D5: 或获得加少量属性的武饰，可改变武器外观
A6: 5 | B6: 稀有头像框 | C6: 角色头像框 | D6: 概率获得3种永久头像框之一
A7: 6 | B7: 神兽喵喵酱 | C7: 神兽 | D7: 获得喵喵酱或者喵喵酱碎片
A8: 7 | B8: 稀有头像 | C8: 角色头像 | D8: 随机获得羽翼相关道具，概率获得2种永久头像之一
A9: 8 | B9: 坐骑 | C9: 坐骑相关道具 | D9: 随机获得星命丹、洗筋伐髓丹、玄冥狐、黄金黑豹、暗黑马，概率获得垂耳兔坐骑
A10: 9 | B10: 仙侣白露 | C10: 仙侣兑换道具 | D10: 获得元神残念，概率获得仙侣
A11: 10 | B11: 时装 | C11: 时装道具 | D11: 随机获得阴阳仙书、天元石，概率获得3种加少量属性时装之一
A12: 11 | B12: 翅膀、光华 | C12: 羽翼外观道具 | D12: 获得2种加攻1星光华之一，概率获得加攻加技能羽翼外观
A13: 12 | B13: 宠物道具 | C13: 宠物道具 | D13: 概率获得高书、超书、圣兽积分、4种绘卷之一、辰龙或戌狗
B17: M1 | D17: 主要投放物 | I17: 展示物图标
A18: 1 | B18: 法宝 | D18: 全随机法宝碎片 | I18: 各6星法宝的图标，每月轮换使用
A19: 2 | B19: 飞行器 | D19: 飞剑碎片 | I19: 飞剑道具图标，其余各飞行器时装轮换送，轮换使用图标
A20: 3 | B20: 神兽朱雀 | D20: 朱雀 | I20: 朱雀头像图标
A21: 4 | B21: 强化资源幸运符 | D21: 幸运符 | I21: 幸运符道具图标
A22: 5 | B22: 神器碎片 | D22: 招财喵、二哈汪、熊宝、幸运星、爱之心、幻梦蝶碎片 | I22: 上述6件神器图标，轮换使用
A23: 6 | B23: 神兽玄武 | D23: 玄武 | I23: 玄武头像图标
A24: 7 | B24: 器灵资源投放 | D24: 高级器魂 | I24: 高级器魂道具图标
A25: 8 | B25: 采集令、挑战令等元宝杂货 | D25: 挑战令 | I25: 挑战令道具图标
A26: 9 | B26: 仙侣法相 | D26: 法相 | I26: 法相头像图标
A27: 10 | B27: 光影 | D27: 剑影光刃碎片 | I27: 剑影光刃道具图标，其余各光影时装轮换送，轮换使用图标
A28: 11 | B28: 翅膀 | D28: 剑仙之翼碎片 | I28: 剑仙之翼道具图标，其余各翅膀时装轮换送，轮换使用图标
A29: 12 | B29: 高书 | D29: 高书礼包 | I29: 高书道具图标
P35: 物品 | Q35: 权重 | R35: 价格 | S35: 期望
B36: M1 | C36: 道具R价值 | D36: 概率 | E36: 期望 | P36: 飞行器 | Q36: 0 | R36: 15130 | S36: =RC[-2]*RC[-1]/SUM(R37C17:R68C17) -> 0
A37: 1 | B37: 法宝 | C37: 10 | D37: 0.2 | E37: =RC[-2]*RC[-1] -> 2 | P37: 翅膀碎片*1 | Q37: 100 | R37: =24970/30 -> 832.33333333333337 | S37: =RC[-2]*RC[-1]/SUM(R37C17:R67C17) -> 37.833333333333336 | U37: 1
A38: 2 | B38: 飞行器 | C38: =1513/30 -> 50.43333333333333 | D38: 2.5000000000000001E-3 | E38: =RC[-2]*RC[-1] -> 0.12608333333333333 | P38: 飞行器碎片*1 | Q38: 100 | R38: =R[-2]C/30 -> 504.33333333333331 | S38: =RC[-2]*RC[-1]/SUM(R37C17:R67C17) -> 22.924242424242422 | U38: 2
A39: 3 | B39: 神兽朱雀 | C39: 1485 | D39: 2.5000000000000001E-3 | E39: =RC[-2]*RC[-1] -> 3.7124999999999999 | O39: 34001 | P39: 招财喵碎片 | Q39: 100 | R39: 100 | S39: =RC[-2]*RC[-1]/SUM(R37C17:R67C17) -> 4.5454545454545459 | U39: 5
A40: 4 | B40: 幸运符 | C40: 12 | D40: 0.16500000000000001 | E40: =RC[-2]*RC[-1] -> 1.98 | O40: 34002 | P40: 二哈汪碎片 | Q40: 100 | R40: 100 | S40: =RC[-2]*RC[-1]/SUM(R37C17:R67C17) -> 4.5454545454545459
A41: 5 | B41: 神器碎片 | C41: 10 | D41: 0.2 | E41: =RC[-2]*RC[-1] -> 2 | O41: 34003 | P41: 熊宝碎片 | Q41: 100 | R41: 100 | S41: =RC[-2]*RC[-1]/SUM(R37C17:R67C17) -> 4.5454545454545459
A42: 6 | B42: 神兽玄武 | C42: 1485 | D42: 2.5000000000000001E-3 | E42: =RC[-2]*RC[-1] -> 3.7124999999999999 | O42: 34004 | P42: 幸运星碎片 | Q42: 100 | R42: 100 | S42: =RC[-2]*RC[-1]/SUM(R37C17:R67C17) -> 4.5454545454545459
A43: 7 | B43: 高级器灵 | C43: 1.5 | D43: 0.05 | E43: =RC[-2]*RC[-1] -> 7.5000000000000011E-2 | O43: 34005 | P43: 爱之心碎片 | Q43: 100 | R43: 100 | S43: =RC[-2]*RC[-1]/SUM(R37C17:R67C17) -> 4.5454545454545459
A44: 8 | B44: 挑战令 | C44: 1 | D44: 0.05 | E44: =RC[-2]*RC[-1] -> 0.05 | O44: 34006 | P44: 幻梦蝶碎片 | Q44: 100 | R44: 100 | S44: =RC[-2]*RC[-1]/SUM(R37C17:R67C17) -> 4.5454545454545459
A45: 9 | B45: 仙侣法相 | C45: 500 | D45: 5.0000000000000001E-3 | E45: =RC[-2]*RC[-1] -> 2.5 | O45: 20005 | P45: 100灵石采集许可令 | Q45: 100 | R45: 200 | S45: =RC[-2]*RC[-1]/SUM(R37C17:R67C17) -> 9.0909090909090917 | U45: 6
A46: 10 | B46: 菩提丹 | C46: 10 | D46: 0.2 | E46: =RC[-2]*RC[-1] -> 2 | O46: 28000 | P46: 强化石50 | Q46: 100 | R46: 200 | S46: =RC[-2]*RC[-1]/SUM(R37C17:R67C17) -> 9.0909090909090917 | U46: 9
A47: 11 | B47: 翅膀 | C47: =2497/30 -> 83.233333333333334 | D47: 2.5000000000000001E-3 | E47: =RC[-2]*RC[-1] -> 0.20808333333333334 | O47: 28001 | P47: 定灵玉10 | Q47: 100 | R47: 200 | S47: =RC[-2]*RC[-1]/SUM(R37C17:R67C17) -> 9.0909090909090917 | U47: 9
A48: 12 | B48: 高书 | C48: 32.5 | D48: 0.12 | E48: =RC[-2]*RC[-1] -> 3.9 | O48: 28002 | P48: 幸运符2 | Q48: 100 | R48: 240 | S48: =RC[-2]*RC[-1]/SUM(R37C17:R67C17) -> 10.909090909090908 | U48: 9
C49: 合计 | D49: =SUM(R[-12]C:R[-1]C) -> 1 | E49: =SUM(R[-12]C:R[-1]C) -> 22.264166666666668 | O49: 30001 | P49: 太阳石6 | Q49: 50 | R49: 180 | S49: =RC[-2]*RC[-1]/SUM(R37C17:R67C17) -> 4.0909090909090908
C50: 目标数值 | D50: 1 | E50: =14.8*1.5 -> 22.200000000000003 | O50: 30002 | P50: 月亮石8 | Q50: 50 | R50: 160 | S50: =RC[-2]*RC[-1]/SUM(R37C17:R67C17) -> 3.6363636363636362
O51: 30003 | P51: 舍利子8 | Q51: 50 | R51: 160 | S51: =RC[-2]*RC[-1]/SUM(R37C17:R67C17) -> 3.6363636363636362
O52: 30004 | P52: 黑宝石8 | Q52: 50 | R52: 160 | S52: =RC[-2]*RC[-1]/SUM(R37C17:R67C17) -> 3.6363636363636362
O53: 30005 | P53: 红玛瑙8 | Q53: 50 | R53: 160 | S53: =RC[-2]*RC[-1]/SUM(R37C17:R67C17) -> 3.6363636363636362
O54: 30006 | P54: 神秘石8 | Q54: 50 | R54: 160 | S54: =RC[-2]*RC[-1]/SUM(R37C17:R67C17) -> 3.6363636363636362
O55: 30007 | P55: 混沌石8 | Q55: 50 | R55: 160 | S55: =RC[-2]*RC[-1]/SUM(R37C17:R67C17) -> 3.6363636363636362
O56: 30008 | P56: 光芒石8 | Q56: 50 | R56: 160 | S56: =RC[-2]*RC[-1]/SUM(R37C17:R67C17) -> 3.6363636363636362
O57: 30009 | P57: 清心石8 | Q57: 50 | R57: 160 | S57: =RC[-2]*RC[-1]/SUM(R37C17:R67C17) -> 3.6363636363636362
O58: 3 | P58: 金币20000 | Q58: 100 | R58: 200 | S58: =RC[-2]*RC[-1]/SUM(R37C17:R67C17) -> 9.0909090909090917
O59: 4 | P59: 光影碎片*1 | Q59: 100 | R59: =18730/30 -> 624.33333333333337 | S59: =RC[-2]*RC[-1]/SUM(R37C17:R67C17) -> 28.378787878787879 | U59: 3
P60: 全随机2星法宝*2 | Q60: 100 | R60: 114 | S60: =RC[-2]*RC[-1]/SUM(R37C17:R67C17) -> 5.1818181818181817 | U60: 4
P61: 神兽白虎碎片*2 | Q61: 0 | R61: =14850/30*2 -> 990 | S61: =RC[-2]*RC[-1]/SUM(R37C17:R67C17) -> 0
P62: 神兽玄武碎片*2 | Q62: 0 | R62: =14850/30*2 -> 990 | S62: =RC[-2]*RC[-1]/SUM(R37C17:R67C17) -> 0
O63: 20114 | P63: 仙侣大巫师碎片*5 | Q63: 0 | R63: =10000/200*5 -> 250 | S63: =RC[-2]*RC[-1]/SUM(R37C17:R67C17) -> 0
O64: 10100 | P64: 挑战令*1 | Q64: 100 | R64: 100 | S64: =RC[-2]*RC[-1]/SUM(R37C17:R67C17) -> 4.5454545454545459 | U64: 7
O65: 10111 | P65: 高级器灵10 | Q65: 50 | R65: 150 | S65: =RC[-2]*RC[-1]/SUM(R37C17:R67C17) -> 3.4090909090909092 | U65: 10
O66: 20117 | P66: 仙侣兽神碎片*5 | Q66: 0 | R66: =10000/200*5 -> 250 | S66: =RC[-2]*RC[-1]/SUM(R37C17:R67C17) -> 0
O67: 11008 | P67: 高书 | Q67: 100 | R67: 224 | S67: =RC[-2]*RC[-1]/SUM(R37C17:R67C17) -> 10.181818181818182 | U67: 8
Q70: =SUM(R[-33]C:R[-3]C) -> 2200 | T70: =SUM(R[-34]C[-1]:R[-3]C[-1]) -> 220.1818181818181
T71: =148*1.5 -> 222